STDOUT:
Results will be saved in /home/philip/projects/ltspice_examples_code_repo/Circuit-Completion-Using-GNNs/component_classification_with_link_prediction_head/evaluation/FEGIN/results/model_FEGIN_dataset_ltspice_demos
Command line input: python main.py --data ltspice_demos --representation component_net --model FEGIN --layers 3 --hiddens 16 --batch_size 256 --lr 0.01 --emb_size 250 --epochs 100 --save_appendix component_net_L3_H16_BS256_LR0.01_E250 --no_val
 is saved.
-----
ltspice_demos - FEGIN
Using 3 layers, 16 hidden units, h = 2
Loading component_net representation dataset
ENTERED
Training FEGIN on component_net representation
Train: 1565, Test: 383
##################ITERATION #0 ****************************************
 epoch: 0, train_loss: 1.3170, test_loss: 1.3121, test_f1: 0.1365
 epoch: 1, train_loss: 1.1976, test_loss: 1.3275, test_f1: 0.1365
 epoch: 2, train_loss: 1.1616, test_loss: 1.3224, test_f1: 0.2281
 epoch: 3, train_loss: 1.1497, test_loss: 1.2901, test_f1: 0.3409
 epoch: 4, train_loss: 1.1237, test_loss: 1.3290, test_f1: 0.2678
 epoch: 5, train_loss: 1.1124, test_loss: 1.2173, test_f1: 0.3432
 epoch: 6, train_loss: 1.0999, test_loss: 1.2213, test_f1: 0.3150
 epoch: 7, train_loss: 1.0743, test_loss: 1.1690, test_f1: 0.4123
 epoch: 8, train_loss: 1.0577, test_loss: 1.1883, test_f1: 0.4010
 epoch: 9, train_loss: 1.0529, test_loss: 1.2402, test_f1: 0.4140
 epoch: 10, train_loss: 1.0330, test_loss: 1.2784, test_f1: 0.4409
 epoch: 11, train_loss: 1.0115, test_loss: 1.2666, test_f1: 0.3234
 epoch: 12, train_loss: 1.0027, test_loss: 1.1074, test_f1: 0.4917
 epoch: 13, train_loss: 0.9937, test_loss: 1.1236, test_f1: 0.4723
 epoch: 14, train_loss: 0.9755, test_loss: 1.1787, test_f1: 0.5020
 epoch: 15, train_loss: 0.9628, test_loss: 1.3041, test_f1: 0.4883
 epoch: 16, train_loss: 0.9684, test_loss: 1.2317, test_f1: 0.4681
 epoch: 17, train_loss: 0.9477, test_loss: 1.1268, test_f1: 0.4816
 epoch: 18, train_loss: 0.9428, test_loss: 1.1739, test_f1: 0.4599
 epoch: 19, train_loss: 0.9380, test_loss: 1.2154, test_f1: 0.4766
 epoch: 20, train_loss: 0.9126, test_loss: 1.2777, test_f1: 0.4053
 epoch: 21, train_loss: 0.9154, test_loss: 1.1905, test_f1: 0.4832
 epoch: 22, train_loss: 0.9242, test_loss: 1.3378, test_f1: 0.5129
 epoch: 23, train_loss: 0.9147, test_loss: 1.1453, test_f1: 0.4306
 epoch: 24, train_loss: 0.9344, test_loss: 1.2012, test_f1: 0.3610
 epoch: 25, train_loss: 0.9460, test_loss: 1.0772, test_f1: 0.4978
 epoch: 26, train_loss: 0.9119, test_loss: 1.1313, test_f1: 0.4683
 epoch: 27, train_loss: 0.9135, test_loss: 1.1358, test_f1: 0.5315
 epoch: 28, train_loss: 0.9202, test_loss: 1.1498, test_f1: 0.5260
 epoch: 29, train_loss: 0.8968, test_loss: 1.0769, test_f1: 0.5309
 epoch: 30, train_loss: 0.8957, test_loss: 1.0465, test_f1: 0.5217
 epoch: 31, train_loss: 0.8831, test_loss: 1.1121, test_f1: 0.5161
 epoch: 32, train_loss: 0.8941, test_loss: 1.1028, test_f1: 0.5338
 epoch: 33, train_loss: 0.8883, test_loss: 1.1008, test_f1: 0.4929
 epoch: 34, train_loss: 0.9030, test_loss: 1.1323, test_f1: 0.4762
 epoch: 35, train_loss: 0.8872, test_loss: 1.0870, test_f1: 0.4999
 epoch: 36, train_loss: 0.9097, test_loss: 1.1402, test_f1: 0.5509
 epoch: 37, train_loss: 0.9097, test_loss: 1.0771, test_f1: 0.5259
 epoch: 38, train_loss: 0.9326, test_loss: 1.0495, test_f1: 0.5312
 epoch: 39, train_loss: 0.9267, test_loss: 1.1682, test_f1: 0.5155
 epoch: 40, train_loss: 0.9065, test_loss: 1.2734, test_f1: 0.4479
 epoch: 41, train_loss: 0.8995, test_loss: 1.1363, test_f1: 0.4929
 epoch: 42, train_loss: 0.8992, test_loss: 1.0642, test_f1: 0.4801
 epoch: 43, train_loss: 0.8871, test_loss: 1.0284, test_f1: 0.5641
 epoch: 44, train_loss: 0.8752, test_loss: 1.0134, test_f1: 0.5538
 epoch: 45, train_loss: 0.8808, test_loss: 1.0408, test_f1: 0.4925
 epoch: 46, train_loss: 0.8618, test_loss: 0.9912, test_f1: 0.5082
 epoch: 47, train_loss: 0.8737, test_loss: 1.0887, test_f1: 0.5498
 epoch: 48, train_loss: 0.8554, test_loss: 1.1345, test_f1: 0.5153
 epoch: 49, train_loss: 0.8615, test_loss: 1.1068, test_f1: 0.5516
 epoch: 50, train_loss: 0.8371, test_loss: 1.0719, test_f1: 0.5508
 epoch: 51, train_loss: 0.8394, test_loss: 1.1067, test_f1: 0.5317
 epoch: 52, train_loss: 0.8283, test_loss: 1.0843, test_f1: 0.5411
 epoch: 53, train_loss: 0.8304, test_loss: 1.0636, test_f1: 0.5310
 epoch: 54, train_loss: 0.8346, test_loss: 1.0916, test_f1: 0.5539
 epoch: 55, train_loss: 0.8384, test_loss: 1.1564, test_f1: 0.5589
 epoch: 56, train_loss: 0.8270, test_loss: 1.1355, test_f1: 0.5302
 epoch: 57, train_loss: 0.8435, test_loss: 1.1347, test_f1: 0.5370
 epoch: 58, train_loss: 0.8285, test_loss: 1.1881, test_f1: 0.5199
 epoch: 59, train_loss: 0.8469, test_loss: 1.1655, test_f1: 0.5521
 epoch: 60, train_loss: 0.8286, test_loss: 1.1367, test_f1: 0.5557
 epoch: 61, train_loss: 0.8322, test_loss: 1.1971, test_f1: 0.5193
 epoch: 62, train_loss: 0.8228, test_loss: 1.0931, test_f1: 0.5491
 epoch: 63, train_loss: 0.8138, test_loss: 1.1229, test_f1: 0.5679
 epoch: 64, train_loss: 0.8122, test_loss: 1.1323, test_f1: 0.5493
 epoch: 65, train_loss: 0.8161, test_loss: 1.0950, test_f1: 0.5381
 epoch: 66, train_loss: 0.8032, test_loss: 1.1214, test_f1: 0.5535
 epoch: 67, train_loss: 0.8134, test_loss: 1.1665, test_f1: 0.5324
 epoch: 68, train_loss: 0.7988, test_loss: 1.1353, test_f1: 0.5344
 epoch: 69, train_loss: 0.8040, test_loss: 1.1350, test_f1: 0.5336
 epoch: 70, train_loss: 0.7917, test_loss: 1.1599, test_f1: 0.5487
 epoch: 71, train_loss: 0.7997, test_loss: 1.1142, test_f1: 0.5573
 epoch: 72, train_loss: 0.8120, test_loss: 1.2169, test_f1: 0.5412
 epoch: 73, train_loss: 0.8183, test_loss: 1.2953, test_f1: 0.5280
 epoch: 74, train_loss: 0.8237, test_loss: 1.2620, test_f1: 0.5180
 epoch: 75, train_loss: 0.8106, test_loss: 1.2437, test_f1: 0.5378
 epoch: 76, train_loss: 0.8416, test_loss: 1.1076, test_f1: 0.5208
 epoch: 77, train_loss: 0.8304, test_loss: 1.1902, test_f1: 0.5472
 epoch: 78, train_loss: 0.8260, test_loss: 1.3111, test_f1: 0.5238
 epoch: 79, train_loss: 0.8226, test_loss: 1.2012, test_f1: 0.5547
 epoch: 80, train_loss: 0.8057, test_loss: 1.1321, test_f1: 0.5711
 epoch: 81, train_loss: 0.8062, test_loss: 1.1639, test_f1: 0.5720
 epoch: 82, train_loss: 0.7975, test_loss: 1.2534, test_f1: 0.5513
 epoch: 83, train_loss: 0.7930, test_loss: 1.1949, test_f1: 0.5572
 epoch: 84, train_loss: 0.7895, test_loss: 1.2086, test_f1: 0.5475
 epoch: 85, train_loss: 0.7961, test_loss: 1.1806, test_f1: 0.5489
 epoch: 86, train_loss: 0.7866, test_loss: 1.1574, test_f1: 0.5447
 epoch: 87, train_loss: 0.7826, test_loss: 1.2236, test_f1: 0.5473
 epoch: 88, train_loss: 0.8054, test_loss: 1.1525, test_f1: 0.5373
 epoch: 89, train_loss: 0.7891, test_loss: 1.1923, test_f1: 0.5117
 epoch: 90, train_loss: 0.7880, test_loss: 1.1506, test_f1: 0.5273
 epoch: 91, train_loss: 0.7703, test_loss: 1.2213, test_f1: 0.5348
 epoch: 92, train_loss: 0.7664, test_loss: 1.2063, test_f1: 0.5292
 epoch: 93, train_loss: 0.7708, test_loss: 1.3067, test_f1: 0.5244
 epoch: 94, train_loss: 0.7554, test_loss: 1.2205, test_f1: 0.5333
 epoch: 95, train_loss: 0.7467, test_loss: 1.2022, test_f1: 0.5697
 epoch: 96, train_loss: 0.7579, test_loss: 1.3317, test_f1: 0.5516
 epoch: 97, train_loss: 0.7734, test_loss: 1.2046, test_f1: 0.5602
 epoch: 98, train_loss: 0.7634, test_loss: 1.3330, test_f1: 0.5456
 epoch: 99, train_loss: 0.7555, test_loss: 1.2661, test_f1: 0.5262
##################ITERATION #1 ****************************************
 epoch: 0, train_loss: 1.3097, test_loss: 1.3161, test_f1: 0.2281
 epoch: 1, train_loss: 1.1872, test_loss: 1.3617, test_f1: 0.2281
 epoch: 2, train_loss: 1.1291, test_loss: 1.4622, test_f1: 0.2281
 epoch: 3, train_loss: 1.0951, test_loss: 1.4391, test_f1: 0.3118
 epoch: 4, train_loss: 1.0745, test_loss: 1.4034, test_f1: 0.2997
 epoch: 5, train_loss: 1.0340, test_loss: 1.2433, test_f1: 0.3903
 epoch: 6, train_loss: 1.0251, test_loss: 1.1909, test_f1: 0.4307
 epoch: 7, train_loss: 1.0101, test_loss: 1.1769, test_f1: 0.4359
 epoch: 8, train_loss: 0.9976, test_loss: 1.1217, test_f1: 0.4164
 epoch: 9, train_loss: 1.0011, test_loss: 1.0875, test_f1: 0.4908
 epoch: 10, train_loss: 0.9857, test_loss: 1.1282, test_f1: 0.5001
 epoch: 11, train_loss: 0.9908, test_loss: 1.0882, test_f1: 0.4866
 epoch: 12, train_loss: 0.9495, test_loss: 1.1185, test_f1: 0.4475
 epoch: 13, train_loss: 0.9507, test_loss: 1.0629, test_f1: 0.5010
 epoch: 14, train_loss: 0.9263, test_loss: 1.0601, test_f1: 0.4024
 epoch: 15, train_loss: 0.9440, test_loss: 1.1191, test_f1: 0.4160
 epoch: 16, train_loss: 0.9625, test_loss: 1.2189, test_f1: 0.3784
 epoch: 17, train_loss: 0.9694, test_loss: 1.2031, test_f1: 0.3578
 epoch: 18, train_loss: 0.9426, test_loss: 1.1863, test_f1: 0.4676
 epoch: 19, train_loss: 0.9281, test_loss: 1.1116, test_f1: 0.4714
 epoch: 20, train_loss: 0.9229, test_loss: 1.0869, test_f1: 0.4650
 epoch: 21, train_loss: 0.9207, test_loss: 1.1081, test_f1: 0.5007
 epoch: 22, train_loss: 0.9291, test_loss: 1.1900, test_f1: 0.4170
 epoch: 23, train_loss: 0.9298, test_loss: 1.1421, test_f1: 0.4584
 epoch: 24, train_loss: 0.9155, test_loss: 1.1873, test_f1: 0.5110
 epoch: 25, train_loss: 0.9178, test_loss: 1.0697, test_f1: 0.5419
 epoch: 26, train_loss: 0.9216, test_loss: 1.0714, test_f1: 0.4677
 epoch: 27, train_loss: 0.9046, test_loss: 1.1579, test_f1: 0.4492
 epoch: 28, train_loss: 0.9155, test_loss: 1.6180, test_f1: 0.3812
 epoch: 29, train_loss: 0.9184, test_loss: 1.1553, test_f1: 0.5045
 epoch: 30, train_loss: 0.9220, test_loss: 1.0781, test_f1: 0.4942
 epoch: 31, train_loss: 0.9045, test_loss: 1.0633, test_f1: 0.5331
 epoch: 32, train_loss: 0.9044, test_loss: 1.2049, test_f1: 0.4885
 epoch: 33, train_loss: 0.8840, test_loss: 1.0715, test_f1: 0.4930
 epoch: 34, train_loss: 0.8899, test_loss: 1.1678, test_f1: 0.4781
 epoch: 35, train_loss: 0.8726, test_loss: 1.2109, test_f1: 0.4147
 epoch: 36, train_loss: 0.8734, test_loss: 1.0751, test_f1: 0.5137
 epoch: 37, train_loss: 0.8824, test_loss: 1.0588, test_f1: 0.5485
 epoch: 38, train_loss: 0.8972, test_loss: 1.0872, test_f1: 0.5245
 epoch: 39, train_loss: 0.8974, test_loss: 1.0316, test_f1: 0.5232
 epoch: 40, train_loss: 0.8832, test_loss: 1.1312, test_f1: 0.5251
 epoch: 41, train_loss: 0.8865, test_loss: 1.0631, test_f1: 0.5087
 epoch: 42, train_loss: 0.8676, test_loss: 1.2085, test_f1: 0.5039
 epoch: 43, train_loss: 0.8728, test_loss: 1.2247, test_f1: 0.4179
 epoch: 44, train_loss: 0.8850, test_loss: 1.1076, test_f1: 0.4316
 epoch: 45, train_loss: 0.8829, test_loss: 1.2064, test_f1: 0.5066
 epoch: 46, train_loss: 0.8929, test_loss: 1.1181, test_f1: 0.4851
 epoch: 47, train_loss: 0.8768, test_loss: 1.0423, test_f1: 0.5181
 epoch: 48, train_loss: 0.8668, test_loss: 1.1412, test_f1: 0.4723
 epoch: 49, train_loss: 0.8636, test_loss: 1.0642, test_f1: 0.5274
 epoch: 50, train_loss: 0.8493, test_loss: 1.0256, test_f1: 0.5905
 epoch: 51, train_loss: 0.8484, test_loss: 1.0593, test_f1: 0.5590
 epoch: 52, train_loss: 0.8347, test_loss: 1.0826, test_f1: 0.5174
 epoch: 53, train_loss: 0.8298, test_loss: 1.1177, test_f1: 0.5433
 epoch: 54, train_loss: 0.8340, test_loss: 1.0585, test_f1: 0.5372
 epoch: 55, train_loss: 0.8287, test_loss: 1.0140, test_f1: 0.5404
 epoch: 56, train_loss: 0.8368, test_loss: 1.0753, test_f1: 0.5232
 epoch: 57, train_loss: 0.8243, test_loss: 1.0823, test_f1: 0.5019
 epoch: 58, train_loss: 0.8208, test_loss: 1.0752, test_f1: 0.4952
 epoch: 59, train_loss: 0.8337, test_loss: 1.1235, test_f1: 0.5791
 epoch: 60, train_loss: 0.8401, test_loss: 1.0702, test_f1: 0.5719
 epoch: 61, train_loss: 0.8334, test_loss: 1.0737, test_f1: 0.5552
 epoch: 62, train_loss: 0.8120, test_loss: 1.2023, test_f1: 0.5580
 epoch: 63, train_loss: 0.8237, test_loss: 1.0844, test_f1: 0.5317
 epoch: 64, train_loss: 0.8133, test_loss: 1.0423, test_f1: 0.5940
 epoch: 65, train_loss: 0.7947, test_loss: 1.0997, test_f1: 0.5649
 epoch: 66, train_loss: 0.7939, test_loss: 1.1259, test_f1: 0.5521
 epoch: 67, train_loss: 0.7997, test_loss: 1.1009, test_f1: 0.5444
 epoch: 68, train_loss: 0.7976, test_loss: 1.1063, test_f1: 0.5222
 epoch: 69, train_loss: 0.7841, test_loss: 1.1663, test_f1: 0.5360
 epoch: 70, train_loss: 0.7965, test_loss: 1.0910, test_f1: 0.5625
 epoch: 71, train_loss: 0.7828, test_loss: 1.0492, test_f1: 0.5878
 epoch: 72, train_loss: 0.7780, test_loss: 1.1202, test_f1: 0.5599
 epoch: 73, train_loss: 0.7749, test_loss: 1.0758, test_f1: 0.5649
 epoch: 74, train_loss: 0.7733, test_loss: 1.1056, test_f1: 0.5469
 epoch: 75, train_loss: 0.7837, test_loss: 1.2057, test_f1: 0.4929
 epoch: 76, train_loss: 0.7873, test_loss: 1.1380, test_f1: 0.5399
 epoch: 77, train_loss: 0.7628, test_loss: 1.1614, test_f1: 0.5478
 epoch: 78, train_loss: 0.7751, test_loss: 1.1053, test_f1: 0.5605
 epoch: 79, train_loss: 0.7742, test_loss: 1.1119, test_f1: 0.5513
 epoch: 80, train_loss: 0.7528, test_loss: 1.2405, test_f1: 0.5139
 epoch: 81, train_loss: 0.7568, test_loss: 1.1917, test_f1: 0.5674
 epoch: 82, train_loss: 0.7656, test_loss: 1.2249, test_f1: 0.5393
 epoch: 83, train_loss: 0.7578, test_loss: 1.1538, test_f1: 0.5366
 epoch: 84, train_loss: 0.7446, test_loss: 1.2416, test_f1: 0.5560
 epoch: 85, train_loss: 0.7508, test_loss: 1.1708, test_f1: 0.5719
 epoch: 86, train_loss: 0.7514, test_loss: 1.1406, test_f1: 0.5480
 epoch: 87, train_loss: 0.7417, test_loss: 1.6442, test_f1: 0.4771
 epoch: 88, train_loss: 0.8181, test_loss: 1.5982, test_f1: 0.4926
 epoch: 89, train_loss: 0.7751, test_loss: 1.3346, test_f1: 0.5390
 epoch: 90, train_loss: 0.8395, test_loss: 1.3690, test_f1: 0.4981
 epoch: 91, train_loss: 0.8052, test_loss: 1.3286, test_f1: 0.5484
 epoch: 92, train_loss: 0.7886, test_loss: 1.3539, test_f1: 0.5177
 epoch: 93, train_loss: 0.7702, test_loss: 1.4563, test_f1: 0.5265
 epoch: 94, train_loss: 0.7844, test_loss: 1.1908, test_f1: 0.5614
 epoch: 95, train_loss: 0.7798, test_loss: 1.2510, test_f1: 0.5396
 epoch: 96, train_loss: 0.7997, test_loss: 1.1076, test_f1: 0.5428
 epoch: 97, train_loss: 0.7656, test_loss: 1.1092, test_f1: 0.5490
 epoch: 98, train_loss: 0.7773, test_loss: 1.1406, test_f1: 0.5400
 epoch: 99, train_loss: 0.7497, test_loss: 1.0738, test_f1: 0.5581
##################ITERATION #2 ****************************************
 epoch: 0, train_loss: 1.2340, test_loss: 1.3434, test_f1: 0.2932
 epoch: 1, train_loss: 1.1272, test_loss: 1.2974, test_f1: 0.2281
 epoch: 2, train_loss: 1.0863, test_loss: 1.2531, test_f1: 0.2281
 epoch: 3, train_loss: 1.0477, test_loss: 1.2090, test_f1: 0.3005
 epoch: 4, train_loss: 1.0383, test_loss: 1.2036, test_f1: 0.3571
 epoch: 5, train_loss: 1.0093, test_loss: 1.1504, test_f1: 0.3503
 epoch: 6, train_loss: 1.0031, test_loss: 1.1345, test_f1: 0.3985
 epoch: 7, train_loss: 0.9957, test_loss: 1.1389, test_f1: 0.4110
 epoch: 8, train_loss: 0.9888, test_loss: 1.1517, test_f1: 0.4521
 epoch: 9, train_loss: 0.9716, test_loss: 1.0701, test_f1: 0.5376
 epoch: 10, train_loss: 0.9786, test_loss: 1.0821, test_f1: 0.4804
 epoch: 11, train_loss: 0.9474, test_loss: 1.1256, test_f1: 0.5303
 epoch: 12, train_loss: 0.9952, test_loss: 1.0544, test_f1: 0.5002
 epoch: 13, train_loss: 0.9544, test_loss: 1.1389, test_f1: 0.5068
 epoch: 14, train_loss: 0.9346, test_loss: 1.1346, test_f1: 0.4538
 epoch: 15, train_loss: 0.9311, test_loss: 1.1534, test_f1: 0.4813
 epoch: 16, train_loss: 0.9229, test_loss: 1.1224, test_f1: 0.4885
 epoch: 17, train_loss: 0.9234, test_loss: 1.0501, test_f1: 0.5249
 epoch: 18, train_loss: 0.9132, test_loss: 1.0349, test_f1: 0.5105
 epoch: 19, train_loss: 0.9244, test_loss: 1.1051, test_f1: 0.4730
 epoch: 20, train_loss: 0.9062, test_loss: 1.1117, test_f1: 0.4673
 epoch: 21, train_loss: 0.9115, test_loss: 1.1389, test_f1: 0.4964
 epoch: 22, train_loss: 0.9032, test_loss: 1.1009, test_f1: 0.4957
 epoch: 23, train_loss: 0.8877, test_loss: 1.1231, test_f1: 0.5476
 epoch: 24, train_loss: 0.8673, test_loss: 1.1506, test_f1: 0.5263
 epoch: 25, train_loss: 0.8697, test_loss: 1.1610, test_f1: 0.4888
 epoch: 26, train_loss: 0.8844, test_loss: 1.1197, test_f1: 0.4864
 epoch: 27, train_loss: 0.8613, test_loss: 1.1950, test_f1: 0.4997
 epoch: 28, train_loss: 0.8654, test_loss: 1.1797, test_f1: 0.5623
 epoch: 29, train_loss: 0.8646, test_loss: 1.0721, test_f1: 0.5460
 epoch: 30, train_loss: 0.8642, test_loss: 1.0600, test_f1: 0.5305
 epoch: 31, train_loss: 0.8638, test_loss: 1.2843, test_f1: 0.4739
 epoch: 32, train_loss: 0.8506, test_loss: 1.1320, test_f1: 0.5141
 epoch: 33, train_loss: 0.8604, test_loss: 1.2271, test_f1: 0.4909
 epoch: 34, train_loss: 0.8400, test_loss: 1.1394, test_f1: 0.5271
 epoch: 35, train_loss: 0.8660, test_loss: 1.4217, test_f1: 0.4414
 epoch: 36, train_loss: 0.8638, test_loss: 1.2825, test_f1: 0.5314
 epoch: 37, train_loss: 0.8639, test_loss: 1.1828, test_f1: 0.4781
 epoch: 38, train_loss: 0.8716, test_loss: 1.0942, test_f1: 0.5836
 epoch: 39, train_loss: 0.8614, test_loss: 1.1615, test_f1: 0.5511
 epoch: 40, train_loss: 0.8433, test_loss: 1.1662, test_f1: 0.5256
 epoch: 41, train_loss: 0.8261, test_loss: 1.2423, test_f1: 0.5090
 epoch: 42, train_loss: 0.8292, test_loss: 1.0651, test_f1: 0.5709
 epoch: 43, train_loss: 0.8135, test_loss: 1.1322, test_f1: 0.5153
 epoch: 44, train_loss: 0.8285, test_loss: 1.1705, test_f1: 0.5530
 epoch: 45, train_loss: 0.8141, test_loss: 1.2639, test_f1: 0.5624
 epoch: 46, train_loss: 0.8311, test_loss: 1.2641, test_f1: 0.5270
 epoch: 47, train_loss: 0.8464, test_loss: 1.1743, test_f1: 0.5668
 epoch: 48, train_loss: 0.8377, test_loss: 1.1120, test_f1: 0.5492
 epoch: 49, train_loss: 0.8417, test_loss: 1.0395, test_f1: 0.5555
 epoch: 50, train_loss: 0.8274, test_loss: 1.1064, test_f1: 0.5272
 epoch: 51, train_loss: 0.8062, test_loss: 1.1279, test_f1: 0.5703
 epoch: 52, train_loss: 0.8213, test_loss: 1.1521, test_f1: 0.5579
 epoch: 53, train_loss: 0.7983, test_loss: 1.0612, test_f1: 0.5611
 epoch: 54, train_loss: 0.7981, test_loss: 1.0776, test_f1: 0.5715
 epoch: 55, train_loss: 0.7846, test_loss: 1.0639, test_f1: 0.5991
 epoch: 56, train_loss: 0.7762, test_loss: 1.0542, test_f1: 0.6138
 epoch: 57, train_loss: 0.7639, test_loss: 1.1025, test_f1: 0.6051
 epoch: 58, train_loss: 0.7558, test_loss: 1.0426, test_f1: 0.5900
 epoch: 59, train_loss: 0.7703, test_loss: 1.0250, test_f1: 0.5931
 epoch: 60, train_loss: 0.7589, test_loss: 1.1386, test_f1: 0.5900
 epoch: 61, train_loss: 0.7693, test_loss: 1.0949, test_f1: 0.5909
 epoch: 62, train_loss: 0.7480, test_loss: 1.0816, test_f1: 0.5845
 epoch: 63, train_loss: 0.7408, test_loss: 1.0655, test_f1: 0.5904
 epoch: 64, train_loss: 0.7571, test_loss: 1.1248, test_f1: 0.5558
 epoch: 65, train_loss: 0.7808, test_loss: 1.1939, test_f1: 0.5566
 epoch: 66, train_loss: 0.7845, test_loss: 1.0930, test_f1: 0.5740
 epoch: 67, train_loss: 0.7489, test_loss: 1.0992, test_f1: 0.5797
 epoch: 68, train_loss: 0.7536, test_loss: 1.1200, test_f1: 0.5830
 epoch: 69, train_loss: 0.7497, test_loss: 1.0256, test_f1: 0.5709
 epoch: 70, train_loss: 0.7472, test_loss: 1.0838, test_f1: 0.5771
 epoch: 71, train_loss: 0.7408, test_loss: 1.0707, test_f1: 0.5822
 epoch: 72, train_loss: 0.7415, test_loss: 1.1622, test_f1: 0.5482
 epoch: 73, train_loss: 0.7446, test_loss: 1.0107, test_f1: 0.5987
 epoch: 74, train_loss: 0.7334, test_loss: 1.0523, test_f1: 0.5747
 epoch: 75, train_loss: 0.7334, test_loss: 1.0662, test_f1: 0.6086
 epoch: 76, train_loss: 0.7228, test_loss: 1.0610, test_f1: 0.5766
 epoch: 77, train_loss: 0.7347, test_loss: 0.9924, test_f1: 0.6036
 epoch: 78, train_loss: 0.7426, test_loss: 1.0621, test_f1: 0.6068
 epoch: 79, train_loss: 0.7414, test_loss: 1.0847, test_f1: 0.5868
 epoch: 80, train_loss: 0.7443, test_loss: 1.0748, test_f1: 0.5822
 epoch: 81, train_loss: 0.7091, test_loss: 1.0312, test_f1: 0.5616
 epoch: 82, train_loss: 0.7370, test_loss: 1.0526, test_f1: 0.5503
 epoch: 83, train_loss: 0.7063, test_loss: 1.2049, test_f1: 0.5571
 epoch: 84, train_loss: 0.6945, test_loss: 1.2842, test_f1: 0.5610
 epoch: 85, train_loss: 0.7134, test_loss: 1.2315, test_f1: 0.6021
 epoch: 86, train_loss: 0.7330, test_loss: 1.2893, test_f1: 0.5131
 epoch: 87, train_loss: 0.7333, test_loss: 1.1443, test_f1: 0.5567
 epoch: 88, train_loss: 0.7201, test_loss: 1.1041, test_f1: 0.5847
 epoch: 89, train_loss: 0.7235, test_loss: 1.0933, test_f1: 0.5964
 epoch: 90, train_loss: 0.7157, test_loss: 1.1457, test_f1: 0.5515
 epoch: 91, train_loss: 0.7004, test_loss: 0.9651, test_f1: 0.6002
 epoch: 92, train_loss: 0.7021, test_loss: 1.0183, test_f1: 0.6076
 epoch: 93, train_loss: 0.6921, test_loss: 1.0810, test_f1: 0.5820
 epoch: 94, train_loss: 0.7087, test_loss: 1.0781, test_f1: 0.5948
 epoch: 95, train_loss: 0.6668, test_loss: 1.0201, test_f1: 0.5773
 epoch: 96, train_loss: 0.6676, test_loss: 1.0790, test_f1: 0.5946
 epoch: 97, train_loss: 0.6666, test_loss: 1.1351, test_f1: 0.5839
 epoch: 98, train_loss: 0.6684, test_loss: 1.1039, test_f1: 0.5927
 epoch: 99, train_loss: 0.6464, test_loss: 1.3309, test_f1: 0.5648
##################ITERATION #3 ****************************************
 epoch: 0, train_loss: 1.2739, test_loss: 1.4821, test_f1: 0.3232
 epoch: 1, train_loss: 1.1648, test_loss: 1.3940, test_f1: 0.2679
 epoch: 2, train_loss: 1.0885, test_loss: 1.2752, test_f1: 0.2587
 epoch: 3, train_loss: 1.0573, test_loss: 1.2112, test_f1: 0.3384
 epoch: 4, train_loss: 1.0257, test_loss: 1.1980, test_f1: 0.3221
 epoch: 5, train_loss: 1.0146, test_loss: 1.1698, test_f1: 0.3459
 epoch: 6, train_loss: 1.0043, test_loss: 1.1056, test_f1: 0.3991
 epoch: 7, train_loss: 0.9741, test_loss: 1.1930, test_f1: 0.4528
 epoch: 8, train_loss: 0.9752, test_loss: 1.1218, test_f1: 0.4650
 epoch: 9, train_loss: 0.9657, test_loss: 1.0689, test_f1: 0.5085
 epoch: 10, train_loss: 0.9604, test_loss: 1.1595, test_f1: 0.4542
 epoch: 11, train_loss: 0.9563, test_loss: 1.1371, test_f1: 0.4653
 epoch: 12, train_loss: 0.9506, test_loss: 1.1715, test_f1: 0.3785
 epoch: 13, train_loss: 0.9405, test_loss: 1.3773, test_f1: 0.4058
 epoch: 14, train_loss: 0.9476, test_loss: 1.2389, test_f1: 0.4462
 epoch: 15, train_loss: 0.9239, test_loss: 1.1424, test_f1: 0.4461
 epoch: 16, train_loss: 0.9467, test_loss: 1.0820, test_f1: 0.4601
 epoch: 17, train_loss: 0.9000, test_loss: 1.1070, test_f1: 0.5202
 epoch: 18, train_loss: 0.9134, test_loss: 1.6149, test_f1: 0.3999
 epoch: 19, train_loss: 0.9156, test_loss: 1.1695, test_f1: 0.4995
 epoch: 20, train_loss: 0.9178, test_loss: 1.3218, test_f1: 0.4869
 epoch: 21, train_loss: 0.9031, test_loss: 1.1495, test_f1: 0.4169
 epoch: 22, train_loss: 0.8955, test_loss: 1.1343, test_f1: 0.4649
 epoch: 23, train_loss: 0.9120, test_loss: 1.1256, test_f1: 0.5103
 epoch: 24, train_loss: 0.8844, test_loss: 1.2336, test_f1: 0.5039
 epoch: 25, train_loss: 0.9114, test_loss: 1.2594, test_f1: 0.4845
 epoch: 26, train_loss: 0.8826, test_loss: 1.1410, test_f1: 0.4727
 epoch: 27, train_loss: 0.8861, test_loss: 1.1662, test_f1: 0.5026
 epoch: 28, train_loss: 0.8997, test_loss: 1.2165, test_f1: 0.5073
 epoch: 29, train_loss: 0.8797, test_loss: 1.1308, test_f1: 0.5061
 epoch: 30, train_loss: 0.8864, test_loss: 1.1156, test_f1: 0.5140
 epoch: 31, train_loss: 0.8794, test_loss: 1.0798, test_f1: 0.4929
 epoch: 32, train_loss: 0.8673, test_loss: 1.0866, test_f1: 0.4788
 epoch: 33, train_loss: 0.8775, test_loss: 1.0819, test_f1: 0.4816
 epoch: 34, train_loss: 0.8698, test_loss: 1.1312, test_f1: 0.5237
 epoch: 35, train_loss: 0.8790, test_loss: 1.0758, test_f1: 0.5159
 epoch: 36, train_loss: 0.8940, test_loss: 1.0582, test_f1: 0.5105
 epoch: 37, train_loss: 0.9087, test_loss: 1.0548, test_f1: 0.4768
 epoch: 38, train_loss: 0.8837, test_loss: 1.3246, test_f1: 0.4833
 epoch: 39, train_loss: 0.8758, test_loss: 1.5379, test_f1: 0.4527
 epoch: 40, train_loss: 0.8798, test_loss: 1.3802, test_f1: 0.4597
 epoch: 41, train_loss: 0.8581, test_loss: 1.3299, test_f1: 0.4505
 epoch: 42, train_loss: 0.8643, test_loss: 1.2872, test_f1: 0.5158
 epoch: 43, train_loss: 0.8793, test_loss: 1.3066, test_f1: 0.5195
 epoch: 44, train_loss: 0.8619, test_loss: 1.2218, test_f1: 0.5079
 epoch: 45, train_loss: 0.8476, test_loss: 1.2386, test_f1: 0.5303
 epoch: 46, train_loss: 0.8453, test_loss: 1.2538, test_f1: 0.5252
 epoch: 47, train_loss: 0.8172, test_loss: 1.4389, test_f1: 0.5137
 epoch: 48, train_loss: 0.8312, test_loss: 1.3117, test_f1: 0.5363
 epoch: 49, train_loss: 0.8103, test_loss: 1.1769, test_f1: 0.5435
 epoch: 50, train_loss: 0.8130, test_loss: 1.4625, test_f1: 0.5173
 epoch: 51, train_loss: 0.7920, test_loss: 1.3627, test_f1: 0.4943
 epoch: 52, train_loss: 0.7911, test_loss: 1.3214, test_f1: 0.5656
 epoch: 53, train_loss: 0.7828, test_loss: 1.3413, test_f1: 0.5215
 epoch: 54, train_loss: 0.7812, test_loss: 1.4516, test_f1: 0.5396
 epoch: 55, train_loss: 0.7877, test_loss: 1.2280, test_f1: 0.5532
 epoch: 56, train_loss: 0.7839, test_loss: 1.3226, test_f1: 0.5578
 epoch: 57, train_loss: 0.7763, test_loss: 1.4649, test_f1: 0.5281
 epoch: 58, train_loss: 0.7764, test_loss: 1.4199, test_f1: 0.4920
 epoch: 59, train_loss: 0.7713, test_loss: 1.3345, test_f1: 0.5245
 epoch: 60, train_loss: 0.7701, test_loss: 1.5898, test_f1: 0.4866
 epoch: 61, train_loss: 0.7615, test_loss: 1.5156, test_f1: 0.5476
 epoch: 62, train_loss: 0.7554, test_loss: 1.5914, test_f1: 0.5187
 epoch: 63, train_loss: 0.7524, test_loss: 1.5295, test_f1: 0.5589
 epoch: 64, train_loss: 0.7683, test_loss: 1.4525, test_f1: 0.5203
 epoch: 65, train_loss: 0.7477, test_loss: 1.4281, test_f1: 0.5431
 epoch: 66, train_loss: 0.7454, test_loss: 1.3091, test_f1: 0.5190
 epoch: 67, train_loss: 0.7644, test_loss: 1.4026, test_f1: 0.5503
 epoch: 68, train_loss: 0.7501, test_loss: 1.3595, test_f1: 0.4775
 epoch: 69, train_loss: 0.7537, test_loss: 1.2480, test_f1: 0.4465
 epoch: 70, train_loss: 0.7500, test_loss: 1.4640, test_f1: 0.5089
 epoch: 71, train_loss: 0.7435, test_loss: 1.4885, test_f1: 0.5309
 epoch: 72, train_loss: 0.7250, test_loss: 1.6343, test_f1: 0.5446
 epoch: 73, train_loss: 0.7451, test_loss: 1.4294, test_f1: 0.5420
 epoch: 74, train_loss: 0.7336, test_loss: 1.5277, test_f1: 0.4195
 epoch: 75, train_loss: 0.7493, test_loss: 1.7138, test_f1: 0.5204
 epoch: 76, train_loss: 0.7451, test_loss: 1.4634, test_f1: 0.5077
 epoch: 77, train_loss: 0.7367, test_loss: 1.3216, test_f1: 0.5836
 epoch: 78, train_loss: 0.7232, test_loss: 1.3984, test_f1: 0.5019
 epoch: 79, train_loss: 0.7316, test_loss: 1.4677, test_f1: 0.5062
 epoch: 80, train_loss: 0.7088, test_loss: 1.5592, test_f1: 0.4703
 epoch: 81, train_loss: 0.7016, test_loss: 1.5941, test_f1: 0.5148
 epoch: 82, train_loss: 0.7080, test_loss: 1.6555, test_f1: 0.5510
 epoch: 83, train_loss: 0.7070, test_loss: 1.5748, test_f1: 0.5340
 epoch: 84, train_loss: 0.7116, test_loss: 1.4885, test_f1: 0.5110
 epoch: 85, train_loss: 0.7056, test_loss: 1.5199, test_f1: 0.4599
 epoch: 86, train_loss: 0.7166, test_loss: 1.2761, test_f1: 0.4994
 epoch: 87, train_loss: 0.7126, test_loss: 1.4795, test_f1: 0.5461
 epoch: 88, train_loss: 0.7060, test_loss: 1.5838, test_f1: 0.5353
 epoch: 89, train_loss: 0.7085, test_loss: 1.5427, test_f1: 0.5485
 epoch: 90, train_loss: 0.7381, test_loss: 1.7930, test_f1: 0.5466
 epoch: 91, train_loss: 0.7428, test_loss: 1.4395, test_f1: 0.5106
 epoch: 92, train_loss: 0.7321, test_loss: 1.2653, test_f1: 0.5466
 epoch: 93, train_loss: 0.7180, test_loss: 1.3683, test_f1: 0.5326
 epoch: 94, train_loss: 0.6944, test_loss: 1.2893, test_f1: 0.5461
 epoch: 95, train_loss: 0.6790, test_loss: 1.2999, test_f1: 0.5519
 epoch: 96, train_loss: 0.6941, test_loss: 1.3637, test_f1: 0.5406
 epoch: 97, train_loss: 0.6866, test_loss: 1.4775, test_f1: 0.5470
 epoch: 98, train_loss: 0.6850, test_loss: 1.6087, test_f1: 0.5064
 epoch: 99, train_loss: 0.6612, test_loss: 1.6843, test_f1: 0.5493
##################ITERATION #4 ****************************************
 epoch: 0, train_loss: 1.2344, test_loss: 1.3140, test_f1: 0.2281
 epoch: 1, train_loss: 1.0912, test_loss: 1.2887, test_f1: 0.2281
 epoch: 2, train_loss: 1.0648, test_loss: 1.2541, test_f1: 0.3940
 epoch: 3, train_loss: 1.0462, test_loss: 1.2038, test_f1: 0.3487
 epoch: 4, train_loss: 1.0065, test_loss: 1.1665, test_f1: 0.3679
 epoch: 5, train_loss: 1.0083, test_loss: 1.1797, test_f1: 0.4209
 epoch: 6, train_loss: 0.9848, test_loss: 1.1678, test_f1: 0.4480
 epoch: 7, train_loss: 0.9632, test_loss: 1.1260, test_f1: 0.5367
 epoch: 8, train_loss: 0.9687, test_loss: 1.0945, test_f1: 0.5143
 epoch: 9, train_loss: 0.9440, test_loss: 1.0796, test_f1: 0.4787
 epoch: 10, train_loss: 0.9325, test_loss: 1.1462, test_f1: 0.5243
 epoch: 11, train_loss: 0.9465, test_loss: 1.0427, test_f1: 0.5513
 epoch: 12, train_loss: 0.9415, test_loss: 1.3632, test_f1: 0.4364
 epoch: 13, train_loss: 0.9215, test_loss: 1.2280, test_f1: 0.4744
 epoch: 14, train_loss: 0.9035, test_loss: 1.1203, test_f1: 0.4899
 epoch: 15, train_loss: 0.8733, test_loss: 1.1260, test_f1: 0.5348
 epoch: 16, train_loss: 0.8941, test_loss: 1.0688, test_f1: 0.5672
 epoch: 17, train_loss: 0.8794, test_loss: 1.0871, test_f1: 0.5636
 epoch: 18, train_loss: 0.8490, test_loss: 1.1260, test_f1: 0.5031
 epoch: 19, train_loss: 0.8461, test_loss: 1.2121, test_f1: 0.5056
 epoch: 20, train_loss: 0.8533, test_loss: 1.1154, test_f1: 0.4974
 epoch: 21, train_loss: 0.8623, test_loss: 1.2721, test_f1: 0.4960
 epoch: 22, train_loss: 0.8258, test_loss: 1.2667, test_f1: 0.5125
 epoch: 23, train_loss: 0.8415, test_loss: 1.3231, test_f1: 0.4808
 epoch: 24, train_loss: 0.8236, test_loss: 1.1695, test_f1: 0.5170
 epoch: 25, train_loss: 0.8232, test_loss: 1.1192, test_f1: 0.5352
 epoch: 26, train_loss: 0.8071, test_loss: 1.5668, test_f1: 0.5091
 epoch: 27, train_loss: 0.8150, test_loss: 1.4521, test_f1: 0.5104
 epoch: 28, train_loss: 0.8364, test_loss: 1.0597, test_f1: 0.5460
 epoch: 29, train_loss: 0.8045, test_loss: 1.1318, test_f1: 0.5107
 epoch: 30, train_loss: 0.7990, test_loss: 1.3709, test_f1: 0.4605
 epoch: 31, train_loss: 0.7923, test_loss: 1.2796, test_f1: 0.4862
 epoch: 32, train_loss: 0.7942, test_loss: 1.2951, test_f1: 0.4402
 epoch: 33, train_loss: 0.8665, test_loss: 1.1143, test_f1: 0.5448
 epoch: 34, train_loss: 0.8061, test_loss: 1.2540, test_f1: 0.5163
 epoch: 35, train_loss: 0.7824, test_loss: 1.0451, test_f1: 0.5712
 epoch: 36, train_loss: 0.7978, test_loss: 1.0992, test_f1: 0.5651
 epoch: 37, train_loss: 0.7733, test_loss: 1.0933, test_f1: 0.5496
 epoch: 38, train_loss: 0.7742, test_loss: 1.2569, test_f1: 0.4729
 epoch: 39, train_loss: 0.7745, test_loss: 1.2535, test_f1: 0.4495
 epoch: 40, train_loss: 0.7708, test_loss: 1.1645, test_f1: 0.5226
 epoch: 41, train_loss: 0.7982, test_loss: 1.4666, test_f1: 0.4819
 epoch: 42, train_loss: 0.7989, test_loss: 1.1172, test_f1: 0.5506
 epoch: 43, train_loss: 0.7726, test_loss: 1.0653, test_f1: 0.5615
 epoch: 44, train_loss: 0.7927, test_loss: 1.1241, test_f1: 0.5252
 epoch: 45, train_loss: 0.7603, test_loss: 1.1650, test_f1: 0.5251
 epoch: 46, train_loss: 0.7692, test_loss: 1.2428, test_f1: 0.5273
 epoch: 47, train_loss: 0.7403, test_loss: 1.3429, test_f1: 0.5452
 epoch: 48, train_loss: 0.7384, test_loss: 1.2937, test_f1: 0.5419
 epoch: 49, train_loss: 0.7502, test_loss: 1.3002, test_f1: 0.5010
 epoch: 50, train_loss: 0.7623, test_loss: 1.2701, test_f1: 0.5195
 epoch: 51, train_loss: 0.7461, test_loss: 1.1814, test_f1: 0.5255
 epoch: 52, train_loss: 0.7559, test_loss: 1.1131, test_f1: 0.4933
 epoch: 53, train_loss: 0.7537, test_loss: 1.0959, test_f1: 0.5672
 epoch: 54, train_loss: 0.7435, test_loss: 1.1184, test_f1: 0.5544
 epoch: 55, train_loss: 0.7475, test_loss: 1.2252, test_f1: 0.5333
 epoch: 56, train_loss: 0.7039, test_loss: 1.3210, test_f1: 0.5105
 epoch: 57, train_loss: 0.7035, test_loss: 1.2770, test_f1: 0.5514
 epoch: 58, train_loss: 0.7098, test_loss: 1.0908, test_f1: 0.5721
 epoch: 59, train_loss: 0.7141, test_loss: 1.0760, test_f1: 0.5733
 epoch: 60, train_loss: 0.7093, test_loss: 1.1113, test_f1: 0.5797
 epoch: 61, train_loss: 0.6949, test_loss: 1.1760, test_f1: 0.5299
 epoch: 62, train_loss: 0.6765, test_loss: 1.2198, test_f1: 0.5478
 epoch: 63, train_loss: 0.7116, test_loss: 1.2082, test_f1: 0.5358
 epoch: 64, train_loss: 0.6909, test_loss: 1.1382, test_f1: 0.5759
 epoch: 65, train_loss: 0.6616, test_loss: 1.1836, test_f1: 0.5599
 epoch: 66, train_loss: 0.6682, test_loss: 1.2282, test_f1: 0.5719
 epoch: 67, train_loss: 0.6670, test_loss: 1.1503, test_f1: 0.5605
 epoch: 68, train_loss: 0.6525, test_loss: 1.2475, test_f1: 0.5711
 epoch: 69, train_loss: 0.6763, test_loss: 1.2020, test_f1: 0.5677
 epoch: 70, train_loss: 0.7149, test_loss: 1.1448, test_f1: 0.5953
 epoch: 71, train_loss: 0.7199, test_loss: 1.2488, test_f1: 0.5410
 epoch: 72, train_loss: 0.7034, test_loss: 1.2283, test_f1: 0.5355
 epoch: 73, train_loss: 0.6880, test_loss: 1.2173, test_f1: 0.5335
 epoch: 74, train_loss: 0.6855, test_loss: 1.1866, test_f1: 0.5682
 epoch: 75, train_loss: 0.6606, test_loss: 1.1911, test_f1: 0.5437
 epoch: 76, train_loss: 0.6740, test_loss: 1.1371, test_f1: 0.5554
 epoch: 77, train_loss: 0.6712, test_loss: 1.1307, test_f1: 0.5801
 epoch: 78, train_loss: 0.6636, test_loss: 1.2174, test_f1: 0.5409
 epoch: 79, train_loss: 0.6490, test_loss: 1.2485, test_f1: 0.5547
 epoch: 80, train_loss: 0.6713, test_loss: 1.2487, test_f1: 0.5615
 epoch: 81, train_loss: 0.6577, test_loss: 1.3497, test_f1: 0.5676
 epoch: 82, train_loss: 0.6685, test_loss: 1.3004, test_f1: 0.5583
 epoch: 83, train_loss: 0.6616, test_loss: 1.7568, test_f1: 0.5618
 epoch: 84, train_loss: 0.6618, test_loss: 1.4015, test_f1: 0.5188
 epoch: 85, train_loss: 0.6923, test_loss: 1.1238, test_f1: 0.5254
 epoch: 86, train_loss: 0.6995, test_loss: 1.1812, test_f1: 0.5632
 epoch: 87, train_loss: 0.6729, test_loss: 1.4219, test_f1: 0.5299
 epoch: 88, train_loss: 0.6702, test_loss: 1.4356, test_f1: 0.5506
 epoch: 89, train_loss: 0.6785, test_loss: 1.2533, test_f1: 0.5373
 epoch: 90, train_loss: 0.6557, test_loss: 1.2964, test_f1: 0.5234
 epoch: 91, train_loss: 0.6517, test_loss: 1.1672, test_f1: 0.5384
 epoch: 92, train_loss: 0.6694, test_loss: 1.1196, test_f1: 0.5778
 epoch: 93, train_loss: 0.6422, test_loss: 1.2494, test_f1: 0.5666
 epoch: 94, train_loss: 0.6491, test_loss: 1.2384, test_f1: 0.5892
 epoch: 95, train_loss: 0.6467, test_loss: 1.3039, test_f1: 0.5753
 epoch: 96, train_loss: 0.6222, test_loss: 1.1099, test_f1: 0.6178
 epoch: 97, train_loss: 0.6443, test_loss: 1.1136, test_f1: 0.6029
 epoch: 98, train_loss: 0.6583, test_loss: 1.2142, test_f1: 0.5996
 epoch: 99, train_loss: 0.6591, test_loss: 1.1350, test_f1: 0.5921
##################ITERATION #5 ****************************************
 epoch: 0, train_loss: 1.5090, test_loss: 1.4817, test_f1: 0.2583
 epoch: 1, train_loss: 1.1902, test_loss: 1.3495, test_f1: 0.2585
 epoch: 2, train_loss: 1.1045, test_loss: 1.2702, test_f1: 0.2588
 epoch: 3, train_loss: 1.0522, test_loss: 1.2230, test_f1: 0.2982
 epoch: 4, train_loss: 1.0457, test_loss: 1.1859, test_f1: 0.3418
 epoch: 5, train_loss: 1.0199, test_loss: 1.1204, test_f1: 0.3895
 epoch: 6, train_loss: 1.0037, test_loss: 1.0941, test_f1: 0.4347
 epoch: 7, train_loss: 0.9956, test_loss: 1.1543, test_f1: 0.4616
 epoch: 8, train_loss: 0.9891, test_loss: 1.1444, test_f1: 0.4746
 epoch: 9, train_loss: 0.9901, test_loss: 1.1668, test_f1: 0.4672
 epoch: 10, train_loss: 0.9471, test_loss: 1.1440, test_f1: 0.4525
 epoch: 11, train_loss: 0.9542, test_loss: 1.0792, test_f1: 0.4704
 epoch: 12, train_loss: 0.9332, test_loss: 1.2083, test_f1: 0.4570
 epoch: 13, train_loss: 0.9354, test_loss: 1.0336, test_f1: 0.5308
 epoch: 14, train_loss: 0.9177, test_loss: 1.0985, test_f1: 0.4923
 epoch: 15, train_loss: 0.9087, test_loss: 1.0631, test_f1: 0.5152
 epoch: 16, train_loss: 0.8966, test_loss: 1.0540, test_f1: 0.5115
 epoch: 17, train_loss: 0.8936, test_loss: 1.0718, test_f1: 0.5121
 epoch: 18, train_loss: 0.8996, test_loss: 1.0298, test_f1: 0.5459
 epoch: 19, train_loss: 0.8762, test_loss: 1.1483, test_f1: 0.4935
 epoch: 20, train_loss: 0.8826, test_loss: 1.0380, test_f1: 0.5765
 epoch: 21, train_loss: 0.8874, test_loss: 1.2278, test_f1: 0.5343
 epoch: 22, train_loss: 0.9473, test_loss: 1.2808, test_f1: 0.4512
 epoch: 23, train_loss: 0.9508, test_loss: 1.2057, test_f1: 0.4180
 epoch: 24, train_loss: 0.9251, test_loss: 1.1260, test_f1: 0.4652
 epoch: 25, train_loss: 0.9153, test_loss: 1.0763, test_f1: 0.5543
 epoch: 26, train_loss: 0.8980, test_loss: 1.2067, test_f1: 0.4606
 epoch: 27, train_loss: 0.8801, test_loss: 1.2201, test_f1: 0.4685
 epoch: 28, train_loss: 0.8917, test_loss: 1.2887, test_f1: 0.4496
 epoch: 29, train_loss: 0.8640, test_loss: 1.2324, test_f1: 0.5244
 epoch: 30, train_loss: 0.8555, test_loss: 1.0118, test_f1: 0.5554
 epoch: 31, train_loss: 0.8731, test_loss: 1.3185, test_f1: 0.4875
 epoch: 32, train_loss: 0.8418, test_loss: 1.2199, test_f1: 0.5393
 epoch: 33, train_loss: 0.8781, test_loss: 1.1462, test_f1: 0.5442
 epoch: 34, train_loss: 0.8774, test_loss: 1.0937, test_f1: 0.4906
 epoch: 35, train_loss: 0.8624, test_loss: 1.0346, test_f1: 0.5473
 epoch: 36, train_loss: 0.8711, test_loss: 1.0727, test_f1: 0.5191
 epoch: 37, train_loss: 0.8757, test_loss: 1.0546, test_f1: 0.5045
 epoch: 38, train_loss: 0.8487, test_loss: 1.4509, test_f1: 0.4549
 epoch: 39, train_loss: 0.8310, test_loss: 1.1834, test_f1: 0.5380
 epoch: 40, train_loss: 0.8211, test_loss: 1.0650, test_f1: 0.5479
 epoch: 41, train_loss: 0.8271, test_loss: 1.6688, test_f1: 0.3755
 epoch: 42, train_loss: 0.8613, test_loss: 1.0233, test_f1: 0.5580
 epoch: 43, train_loss: 0.8349, test_loss: 0.9794, test_f1: 0.5612
 epoch: 44, train_loss: 0.8461, test_loss: 1.0650, test_f1: 0.5281
 epoch: 45, train_loss: 0.8488, test_loss: 1.0711, test_f1: 0.4987
 epoch: 46, train_loss: 0.8251, test_loss: 1.1518, test_f1: 0.5367
 epoch: 47, train_loss: 0.8388, test_loss: 1.0243, test_f1: 0.5395
 epoch: 48, train_loss: 0.8253, test_loss: 1.1008, test_f1: 0.5313
 epoch: 49, train_loss: 0.8386, test_loss: 1.0849, test_f1: 0.5383
 epoch: 50, train_loss: 0.7974, test_loss: 0.9759, test_f1: 0.5808
 epoch: 51, train_loss: 0.8023, test_loss: 1.0151, test_f1: 0.5648
 epoch: 52, train_loss: 0.7948, test_loss: 1.1159, test_f1: 0.5358
 epoch: 53, train_loss: 0.7695, test_loss: 1.1689, test_f1: 0.5308
 epoch: 54, train_loss: 0.7728, test_loss: 1.1028, test_f1: 0.5669
 epoch: 55, train_loss: 0.7715, test_loss: 1.1299, test_f1: 0.5590
 epoch: 56, train_loss: 0.7702, test_loss: 1.0289, test_f1: 0.5708
 epoch: 57, train_loss: 0.7594, test_loss: 1.0139, test_f1: 0.5520
 epoch: 58, train_loss: 0.7867, test_loss: 1.0172, test_f1: 0.5501
 epoch: 59, train_loss: 0.7698, test_loss: 1.0380, test_f1: 0.5468
 epoch: 60, train_loss: 0.7819, test_loss: 1.1479, test_f1: 0.5161
 epoch: 61, train_loss: 0.7642, test_loss: 1.2148, test_f1: 0.5353
 epoch: 62, train_loss: 0.7495, test_loss: 1.1647, test_f1: 0.5640
 epoch: 63, train_loss: 0.7528, test_loss: 1.0446, test_f1: 0.5464
 epoch: 64, train_loss: 0.7506, test_loss: 1.1489, test_f1: 0.5197
 epoch: 65, train_loss: 0.7447, test_loss: 1.6149, test_f1: 0.4471
 epoch: 66, train_loss: 0.7537, test_loss: 1.1145, test_f1: 0.5180
 epoch: 67, train_loss: 0.7551, test_loss: 1.1663, test_f1: 0.5409
 epoch: 68, train_loss: 0.7497, test_loss: 1.2308, test_f1: 0.5505
 epoch: 69, train_loss: 0.7444, test_loss: 1.3542, test_f1: 0.5364
 epoch: 70, train_loss: 0.7570, test_loss: 1.1543, test_f1: 0.5582
 epoch: 71, train_loss: 0.7695, test_loss: 1.2431, test_f1: 0.5164
 epoch: 72, train_loss: 0.7417, test_loss: 1.1546, test_f1: 0.4907
 epoch: 73, train_loss: 0.7519, test_loss: 1.0468, test_f1: 0.5288
 epoch: 74, train_loss: 0.8007, test_loss: 1.1806, test_f1: 0.5263
 epoch: 75, train_loss: 0.7659, test_loss: 1.3767, test_f1: 0.4252
 epoch: 76, train_loss: 0.7849, test_loss: 0.9601, test_f1: 0.5493
 epoch: 77, train_loss: 0.7559, test_loss: 0.9837, test_f1: 0.6111
 epoch: 78, train_loss: 0.7357, test_loss: 1.0892, test_f1: 0.5590
 epoch: 79, train_loss: 0.7426, test_loss: 1.0978, test_f1: 0.4734
 epoch: 80, train_loss: 0.7261, test_loss: 1.2248, test_f1: 0.5443
 epoch: 81, train_loss: 0.7120, test_loss: 1.2800, test_f1: 0.5714
 epoch: 82, train_loss: 0.7258, test_loss: 1.1683, test_f1: 0.5445
 epoch: 83, train_loss: 0.7063, test_loss: 1.1206, test_f1: 0.5022
 epoch: 84, train_loss: 0.7232, test_loss: 1.1393, test_f1: 0.5545
 epoch: 85, train_loss: 0.7314, test_loss: 1.3607, test_f1: 0.5416
 epoch: 86, train_loss: 0.7203, test_loss: 1.0670, test_f1: 0.5995
 epoch: 87, train_loss: 0.7236, test_loss: 1.1523, test_f1: 0.5558
 epoch: 88, train_loss: 0.7031, test_loss: 1.1123, test_f1: 0.5417
 epoch: 89, train_loss: 0.7254, test_loss: 1.1249, test_f1: 0.5672
 epoch: 90, train_loss: 0.7253, test_loss: 1.1890, test_f1: 0.5117
 epoch: 91, train_loss: 0.7299, test_loss: 1.0715, test_f1: 0.4895
 epoch: 92, train_loss: 0.7061, test_loss: 1.1063, test_f1: 0.5273
 epoch: 93, train_loss: 0.7112, test_loss: 1.1394, test_f1: 0.5339
 epoch: 94, train_loss: 0.7350, test_loss: 1.0955, test_f1: 0.5978
 epoch: 95, train_loss: 0.7269, test_loss: 1.0571, test_f1: 0.5764
 epoch: 96, train_loss: 0.7358, test_loss: 1.1033, test_f1: 0.5029
 epoch: 97, train_loss: 0.7160, test_loss: 1.1386, test_f1: 0.4702
 epoch: 98, train_loss: 0.7218, test_loss: 1.6140, test_f1: 0.4164
 epoch: 99, train_loss: 0.7387, test_loss: 1.2284, test_f1: 0.4637
##################ITERATION #6 ****************************************
 epoch: 0, train_loss: 1.3316, test_loss: 1.5432, test_f1: 0.1365
 epoch: 1, train_loss: 1.1954, test_loss: 1.3069, test_f1: 0.3398
 epoch: 2, train_loss: 1.1435, test_loss: 1.3020, test_f1: 0.2604
 epoch: 3, train_loss: 1.1048, test_loss: 1.1975, test_f1: 0.2934
 epoch: 4, train_loss: 1.0669, test_loss: 1.1460, test_f1: 0.3871
 epoch: 5, train_loss: 1.0373, test_loss: 1.1877, test_f1: 0.3471
 epoch: 6, train_loss: 1.0285, test_loss: 1.1118, test_f1: 0.5055
 epoch: 7, train_loss: 1.0065, test_loss: 1.1014, test_f1: 0.5012
 epoch: 8, train_loss: 1.0043, test_loss: 1.0870, test_f1: 0.5191
 epoch: 9, train_loss: 0.9819, test_loss: 1.2101, test_f1: 0.3730
 epoch: 10, train_loss: 0.9751, test_loss: 1.1345, test_f1: 0.4604
 epoch: 11, train_loss: 0.9709, test_loss: 1.1684, test_f1: 0.4642
 epoch: 12, train_loss: 0.9685, test_loss: 1.0360, test_f1: 0.4796
 epoch: 13, train_loss: 0.9654, test_loss: 1.0334, test_f1: 0.4241
 epoch: 14, train_loss: 0.9537, test_loss: 1.1258, test_f1: 0.4592
 epoch: 15, train_loss: 0.9743, test_loss: 1.1397, test_f1: 0.4651
 epoch: 16, train_loss: 0.9836, test_loss: 1.0895, test_f1: 0.5040
 epoch: 17, train_loss: 0.9508, test_loss: 1.1127, test_f1: 0.5069
 epoch: 18, train_loss: 0.9353, test_loss: 1.1818, test_f1: 0.4814
 epoch: 19, train_loss: 0.9245, test_loss: 1.1324, test_f1: 0.4992
 epoch: 20, train_loss: 0.9316, test_loss: 1.1109, test_f1: 0.5010
 epoch: 21, train_loss: 0.9340, test_loss: 1.3344, test_f1: 0.4432
 epoch: 22, train_loss: 0.9102, test_loss: 1.5944, test_f1: 0.3893
 epoch: 23, train_loss: 0.9161, test_loss: 1.1337, test_f1: 0.5181
 epoch: 24, train_loss: 0.8947, test_loss: 1.1458, test_f1: 0.5298
 epoch: 25, train_loss: 0.8960, test_loss: 1.1808, test_f1: 0.5189
 epoch: 26, train_loss: 0.8847, test_loss: 1.1375, test_f1: 0.5253
 epoch: 27, train_loss: 0.9037, test_loss: 1.0803, test_f1: 0.5329
 epoch: 28, train_loss: 0.9370, test_loss: 1.5465, test_f1: 0.4019
 epoch: 29, train_loss: 0.9303, test_loss: 1.4063, test_f1: 0.4063
 epoch: 30, train_loss: 0.9431, test_loss: 1.2053, test_f1: 0.4609
 epoch: 31, train_loss: 0.9176, test_loss: 1.0599, test_f1: 0.5296
 epoch: 32, train_loss: 0.9186, test_loss: 1.2947, test_f1: 0.4332
 epoch: 33, train_loss: 0.9009, test_loss: 1.3683, test_f1: 0.4231
 epoch: 34, train_loss: 0.8911, test_loss: 1.2377, test_f1: 0.4871
 epoch: 35, train_loss: 0.8858, test_loss: 1.0404, test_f1: 0.5635
 epoch: 36, train_loss: 0.8863, test_loss: 1.2093, test_f1: 0.4699
 epoch: 37, train_loss: 0.8778, test_loss: 1.1989, test_f1: 0.4991
 epoch: 38, train_loss: 0.8730, test_loss: 1.2019, test_f1: 0.5004
 epoch: 39, train_loss: 0.8547, test_loss: 1.2264, test_f1: 0.5153
 epoch: 40, train_loss: 0.9025, test_loss: 1.1335, test_f1: 0.5480
 epoch: 41, train_loss: 0.8937, test_loss: 1.0843, test_f1: 0.5492
 epoch: 42, train_loss: 0.8659, test_loss: 1.0566, test_f1: 0.4987
 epoch: 43, train_loss: 0.8558, test_loss: 1.0996, test_f1: 0.4961
 epoch: 44, train_loss: 0.8699, test_loss: 1.0434, test_f1: 0.5514
 epoch: 45, train_loss: 0.8512, test_loss: 1.0815, test_f1: 0.5692
 epoch: 46, train_loss: 0.8660, test_loss: 1.1863, test_f1: 0.5650
 epoch: 47, train_loss: 0.8733, test_loss: 1.1473, test_f1: 0.5289
 epoch: 48, train_loss: 0.8797, test_loss: 1.1049, test_f1: 0.5304
 epoch: 49, train_loss: 0.8643, test_loss: 1.2045, test_f1: 0.5636
 epoch: 50, train_loss: 0.8821, test_loss: 1.1663, test_f1: 0.5472
 epoch: 51, train_loss: 0.8515, test_loss: 1.1190, test_f1: 0.5383
 epoch: 52, train_loss: 0.8568, test_loss: 1.1120, test_f1: 0.5578
 epoch: 53, train_loss: 0.8336, test_loss: 1.0775, test_f1: 0.5526
 epoch: 54, train_loss: 0.8409, test_loss: 1.0717, test_f1: 0.5650
 epoch: 55, train_loss: 0.8291, test_loss: 1.0921, test_f1: 0.5557
 epoch: 56, train_loss: 0.8338, test_loss: 1.1443, test_f1: 0.5479
 epoch: 57, train_loss: 0.8373, test_loss: 1.1057, test_f1: 0.5623
 epoch: 58, train_loss: 0.8205, test_loss: 1.0815, test_f1: 0.5832
 epoch: 59, train_loss: 0.8311, test_loss: 1.1051, test_f1: 0.5719
 epoch: 60, train_loss: 0.8244, test_loss: 1.0282, test_f1: 0.5397
 epoch: 61, train_loss: 0.8278, test_loss: 1.0256, test_f1: 0.5631
 epoch: 62, train_loss: 0.8251, test_loss: 1.0507, test_f1: 0.5659
 epoch: 63, train_loss: 0.8139, test_loss: 1.0711, test_f1: 0.5320
 epoch: 64, train_loss: 0.8371, test_loss: 1.0461, test_f1: 0.5346
 epoch: 65, train_loss: 0.8284, test_loss: 1.0263, test_f1: 0.5411
 epoch: 66, train_loss: 0.8217, test_loss: 1.1149, test_f1: 0.5487
 epoch: 67, train_loss: 0.8192, test_loss: 1.1074, test_f1: 0.5525
 epoch: 68, train_loss: 0.8095, test_loss: 1.0635, test_f1: 0.5460
 epoch: 69, train_loss: 0.8017, test_loss: 1.1090, test_f1: 0.5694
 epoch: 70, train_loss: 0.8197, test_loss: 1.0842, test_f1: 0.5433
 epoch: 71, train_loss: 0.8063, test_loss: 1.2019, test_f1: 0.5349
 epoch: 72, train_loss: 0.8284, test_loss: 1.1545, test_f1: 0.5734
 epoch: 73, train_loss: 0.7904, test_loss: 1.0798, test_f1: 0.5734
 epoch: 74, train_loss: 0.7994, test_loss: 1.0661, test_f1: 0.5901
 epoch: 75, train_loss: 0.8043, test_loss: 1.0823, test_f1: 0.5558
 epoch: 76, train_loss: 0.7963, test_loss: 1.0461, test_f1: 0.5184
 epoch: 77, train_loss: 0.8027, test_loss: 1.0366, test_f1: 0.5347
 epoch: 78, train_loss: 0.8116, test_loss: 1.1166, test_f1: 0.5233
 epoch: 79, train_loss: 0.7913, test_loss: 1.1115, test_f1: 0.5465
 epoch: 80, train_loss: 0.8004, test_loss: 1.0505, test_f1: 0.5531
 epoch: 81, train_loss: 0.7817, test_loss: 1.0240, test_f1: 0.5341
 epoch: 82, train_loss: 0.7802, test_loss: 1.0169, test_f1: 0.5625
 epoch: 83, train_loss: 0.7846, test_loss: 1.0638, test_f1: 0.5961
 epoch: 84, train_loss: 0.7666, test_loss: 1.1319, test_f1: 0.5728
 epoch: 85, train_loss: 0.7472, test_loss: 1.1181, test_f1: 0.5892
 epoch: 86, train_loss: 0.7514, test_loss: 1.7963, test_f1: 0.4685
 epoch: 87, train_loss: 0.8050, test_loss: 1.0996, test_f1: 0.5527
 epoch: 88, train_loss: 0.7828, test_loss: 1.1389, test_f1: 0.5544
 epoch: 89, train_loss: 0.7673, test_loss: 1.1036, test_f1: 0.5543
 epoch: 90, train_loss: 0.7421, test_loss: 1.0939, test_f1: 0.5543
 epoch: 91, train_loss: 0.7584, test_loss: 1.0863, test_f1: 0.5561
 epoch: 92, train_loss: 0.7652, test_loss: 1.0601, test_f1: 0.5850
 epoch: 93, train_loss: 0.7345, test_loss: 1.0972, test_f1: 0.5816
 epoch: 94, train_loss: 0.7490, test_loss: 1.1655, test_f1: 0.5645
 epoch: 95, train_loss: 0.7590, test_loss: 1.1311, test_f1: 0.5837
 epoch: 96, train_loss: 0.7608, test_loss: 1.1391, test_f1: 0.5891
 epoch: 97, train_loss: 0.7539, test_loss: 1.1651, test_f1: 0.5793
 epoch: 98, train_loss: 0.7379, test_loss: 1.1426, test_f1: 0.5672
 epoch: 99, train_loss: 0.7426, test_loss: 1.1321, test_f1: 0.5741
##################ITERATION #7 ****************************************
 epoch: 0, train_loss: 1.3313, test_loss: 1.4515, test_f1: 0.2281
 epoch: 1, train_loss: 1.1700, test_loss: 1.3497, test_f1: 0.2281
 epoch: 2, train_loss: 1.1312, test_loss: 1.3361, test_f1: 0.2583
 epoch: 3, train_loss: 1.0736, test_loss: 1.2622, test_f1: 0.3534
 epoch: 4, train_loss: 1.0563, test_loss: 1.2075, test_f1: 0.4120
 epoch: 5, train_loss: 1.0481, test_loss: 1.2056, test_f1: 0.4547
 epoch: 6, train_loss: 1.0096, test_loss: 1.1453, test_f1: 0.4693
 epoch: 7, train_loss: 1.0214, test_loss: 1.1189, test_f1: 0.4954
 epoch: 8, train_loss: 1.0034, test_loss: 1.1323, test_f1: 0.4962
 epoch: 9, train_loss: 0.9674, test_loss: 1.1470, test_f1: 0.4561
 epoch: 10, train_loss: 0.9835, test_loss: 1.0849, test_f1: 0.5265
 epoch: 11, train_loss: 0.9557, test_loss: 1.0928, test_f1: 0.5217
 epoch: 12, train_loss: 0.9435, test_loss: 1.1232, test_f1: 0.5125
 epoch: 13, train_loss: 0.9432, test_loss: 1.1432, test_f1: 0.5079
 epoch: 14, train_loss: 0.9345, test_loss: 1.1876, test_f1: 0.4804
 epoch: 15, train_loss: 0.9152, test_loss: 1.2517, test_f1: 0.4462
 epoch: 16, train_loss: 0.9415, test_loss: 1.1396, test_f1: 0.5045
 epoch: 17, train_loss: 0.9338, test_loss: 1.2091, test_f1: 0.4963
 epoch: 18, train_loss: 0.9201, test_loss: 1.1526, test_f1: 0.5336
 epoch: 19, train_loss: 0.9068, test_loss: 1.2487, test_f1: 0.5183
 epoch: 20, train_loss: 0.9019, test_loss: 1.0384, test_f1: 0.5737
 epoch: 21, train_loss: 0.8917, test_loss: 1.0467, test_f1: 0.5926
 epoch: 22, train_loss: 0.8858, test_loss: 1.0190, test_f1: 0.5846
 epoch: 23, train_loss: 0.8843, test_loss: 1.0597, test_f1: 0.5488
 epoch: 24, train_loss: 0.8764, test_loss: 1.0642, test_f1: 0.5639
 epoch: 25, train_loss: 0.8857, test_loss: 1.1481, test_f1: 0.5487
 epoch: 26, train_loss: 0.8841, test_loss: 1.0706, test_f1: 0.5023
 epoch: 27, train_loss: 0.8861, test_loss: 1.0551, test_f1: 0.5201
 epoch: 28, train_loss: 0.8673, test_loss: 1.2265, test_f1: 0.5170
 epoch: 29, train_loss: 0.8705, test_loss: 1.1144, test_f1: 0.5310
 epoch: 30, train_loss: 0.8718, test_loss: 1.0558, test_f1: 0.5443
 epoch: 31, train_loss: 0.8655, test_loss: 1.0736, test_f1: 0.5698
 epoch: 32, train_loss: 0.8462, test_loss: 1.0469, test_f1: 0.5257
 epoch: 33, train_loss: 0.8407, test_loss: 1.1028, test_f1: 0.5617
 epoch: 34, train_loss: 0.8555, test_loss: 1.0383, test_f1: 0.5910
 epoch: 35, train_loss: 0.8559, test_loss: 1.0412, test_f1: 0.5661
 epoch: 36, train_loss: 0.8841, test_loss: 1.0674, test_f1: 0.5621
 epoch: 37, train_loss: 0.8574, test_loss: 1.0923, test_f1: 0.5255
 epoch: 38, train_loss: 0.8365, test_loss: 1.0263, test_f1: 0.5961
 epoch: 39, train_loss: 0.8423, test_loss: 0.9991, test_f1: 0.5766
 epoch: 40, train_loss: 0.8290, test_loss: 0.9981, test_f1: 0.5594
 epoch: 41, train_loss: 0.8224, test_loss: 1.0200, test_f1: 0.5886
 epoch: 42, train_loss: 0.8114, test_loss: 1.2113, test_f1: 0.5032
 epoch: 43, train_loss: 0.8309, test_loss: 1.0262, test_f1: 0.5982
 epoch: 44, train_loss: 0.8391, test_loss: 0.9908, test_f1: 0.5621
 epoch: 45, train_loss: 0.8190, test_loss: 1.0642, test_f1: 0.5691
 epoch: 46, train_loss: 0.8122, test_loss: 1.1236, test_f1: 0.6017
 epoch: 47, train_loss: 0.8228, test_loss: 1.0937, test_f1: 0.5805
 epoch: 48, train_loss: 0.7907, test_loss: 1.0668, test_f1: 0.5915
 epoch: 49, train_loss: 0.7657, test_loss: 1.0760, test_f1: 0.5969
 epoch: 50, train_loss: 0.7747, test_loss: 1.1241, test_f1: 0.5556
 epoch: 51, train_loss: 0.7703, test_loss: 1.0738, test_f1: 0.5880
 epoch: 52, train_loss: 0.7780, test_loss: 1.0105, test_f1: 0.6253
 epoch: 53, train_loss: 0.7525, test_loss: 1.0402, test_f1: 0.6018
 epoch: 54, train_loss: 0.7665, test_loss: 1.0493, test_f1: 0.6098
 epoch: 55, train_loss: 0.7387, test_loss: 1.0606, test_f1: 0.5920
 epoch: 56, train_loss: 0.7401, test_loss: 1.1513, test_f1: 0.6066
 epoch: 57, train_loss: 0.7531, test_loss: 1.1976, test_f1: 0.5770
 epoch: 58, train_loss: 0.7345, test_loss: 1.1184, test_f1: 0.5833
 epoch: 59, train_loss: 0.7445, test_loss: 1.1040, test_f1: 0.5722
 epoch: 60, train_loss: 0.7388, test_loss: 1.0072, test_f1: 0.6086
 epoch: 61, train_loss: 0.7308, test_loss: 1.0720, test_f1: 0.5993
 epoch: 62, train_loss: 0.7373, test_loss: 1.0654, test_f1: 0.5791
 epoch: 63, train_loss: 0.7221, test_loss: 1.1071, test_f1: 0.5762
 epoch: 64, train_loss: 0.7080, test_loss: 1.0834, test_f1: 0.5869
 epoch: 65, train_loss: 0.7179, test_loss: 1.0986, test_f1: 0.5732
 epoch: 66, train_loss: 0.7437, test_loss: 1.2162, test_f1: 0.5494
 epoch: 67, train_loss: 0.7460, test_loss: 1.0797, test_f1: 0.5824
 epoch: 68, train_loss: 0.7499, test_loss: 0.9549, test_f1: 0.5765
 epoch: 69, train_loss: 0.7501, test_loss: 0.9640, test_f1: 0.5696
 epoch: 70, train_loss: 0.7429, test_loss: 1.0764, test_f1: 0.6214
 epoch: 71, train_loss: 0.7135, test_loss: 1.2548, test_f1: 0.5751
 epoch: 72, train_loss: 0.7341, test_loss: 1.1202, test_f1: 0.6120
 epoch: 73, train_loss: 0.7023, test_loss: 1.1137, test_f1: 0.5835
 epoch: 74, train_loss: 0.7147, test_loss: 1.0885, test_f1: 0.6127
 epoch: 75, train_loss: 0.7084, test_loss: 1.0207, test_f1: 0.6259
 epoch: 76, train_loss: 0.7001, test_loss: 1.0405, test_f1: 0.6328
 epoch: 77, train_loss: 0.7044, test_loss: 0.9946, test_f1: 0.6192
 epoch: 78, train_loss: 0.7172, test_loss: 1.0777, test_f1: 0.5824
 epoch: 79, train_loss: 0.7289, test_loss: 1.0995, test_f1: 0.5893
 epoch: 80, train_loss: 0.6909, test_loss: 1.1901, test_f1: 0.5905
 epoch: 81, train_loss: 0.6854, test_loss: 1.2347, test_f1: 0.5734
 epoch: 82, train_loss: 0.6793, test_loss: 1.1524, test_f1: 0.6051
 epoch: 83, train_loss: 0.7096, test_loss: 1.2061, test_f1: 0.5473
 epoch: 84, train_loss: 0.7045, test_loss: 1.0748, test_f1: 0.5945
 epoch: 85, train_loss: 0.7029, test_loss: 1.1436, test_f1: 0.6016
 epoch: 86, train_loss: 0.6887, test_loss: 1.1342, test_f1: 0.5966
 epoch: 87, train_loss: 0.6842, test_loss: 1.0466, test_f1: 0.6159
 epoch: 88, train_loss: 0.6838, test_loss: 1.0591, test_f1: 0.6465
 epoch: 89, train_loss: 0.6891, test_loss: 1.1351, test_f1: 0.6136
 epoch: 90, train_loss: 0.6952, test_loss: 1.2821, test_f1: 0.5755
 epoch: 91, train_loss: 0.6859, test_loss: 1.1620, test_f1: 0.6094
 epoch: 92, train_loss: 0.6930, test_loss: 1.1261, test_f1: 0.5565
 epoch: 93, train_loss: 0.6887, test_loss: 1.0455, test_f1: 0.5766
 epoch: 94, train_loss: 0.7032, test_loss: 1.0612, test_f1: 0.6191
 epoch: 95, train_loss: 0.6719, test_loss: 1.1218, test_f1: 0.5941
 epoch: 96, train_loss: 0.6860, test_loss: 1.0739, test_f1: 0.6288
 epoch: 97, train_loss: 0.6736, test_loss: 1.2610, test_f1: 0.5501
 epoch: 98, train_loss: 0.6740, test_loss: 1.2158, test_f1: 0.5919
 epoch: 99, train_loss: 0.6707, test_loss: 1.1465, test_f1: 0.5892
##################ITERATION #8 ****************************************
 epoch: 0, train_loss: 1.3945, test_loss: 1.3367, test_f1: 0.2630
 epoch: 1, train_loss: 1.2284, test_loss: 1.2994, test_f1: 0.2281
 epoch: 2, train_loss: 1.1805, test_loss: 1.3429, test_f1: 0.2794
 epoch: 3, train_loss: 1.1489, test_loss: 1.3660, test_f1: 0.1688
 epoch: 4, train_loss: 1.1130, test_loss: 1.4141, test_f1: 0.1836
 epoch: 5, train_loss: 1.0923, test_loss: 1.2663, test_f1: 0.3438
 epoch: 6, train_loss: 1.0880, test_loss: 1.1726, test_f1: 0.3745
 epoch: 7, train_loss: 1.0456, test_loss: 1.1156, test_f1: 0.4088
 epoch: 8, train_loss: 1.0429, test_loss: 1.1198, test_f1: 0.5229
 epoch: 9, train_loss: 1.0184, test_loss: 1.1011, test_f1: 0.4666
 epoch: 10, train_loss: 1.0192, test_loss: 1.1215, test_f1: 0.4666
 epoch: 11, train_loss: 1.0168, test_loss: 1.1703, test_f1: 0.4515
 epoch: 12, train_loss: 0.9975, test_loss: 1.0973, test_f1: 0.5218
 epoch: 13, train_loss: 0.9849, test_loss: 1.2408, test_f1: 0.5062
 epoch: 14, train_loss: 0.9671, test_loss: 1.1880, test_f1: 0.4256
 epoch: 15, train_loss: 0.9707, test_loss: 1.0957, test_f1: 0.4565
 epoch: 16, train_loss: 0.9527, test_loss: 1.1145, test_f1: 0.4409
 epoch: 17, train_loss: 0.9430, test_loss: 1.1213, test_f1: 0.4976
 epoch: 18, train_loss: 0.9300, test_loss: 1.1564, test_f1: 0.4710
 epoch: 19, train_loss: 0.9262, test_loss: 1.0859, test_f1: 0.4949
 epoch: 20, train_loss: 0.9160, test_loss: 1.0952, test_f1: 0.4932
 epoch: 21, train_loss: 0.9003, test_loss: 1.2434, test_f1: 0.5235
 epoch: 22, train_loss: 0.9161, test_loss: 1.2585, test_f1: 0.5175
 epoch: 23, train_loss: 0.9109, test_loss: 1.1437, test_f1: 0.4976
 epoch: 24, train_loss: 0.9071, test_loss: 1.2813, test_f1: 0.4064
 epoch: 25, train_loss: 0.9001, test_loss: 1.2285, test_f1: 0.5263
 epoch: 26, train_loss: 0.8967, test_loss: 1.2250, test_f1: 0.5262
 epoch: 27, train_loss: 0.9086, test_loss: 1.1431, test_f1: 0.4572
 epoch: 28, train_loss: 0.9046, test_loss: 1.1631, test_f1: 0.4931
 epoch: 29, train_loss: 0.9063, test_loss: 1.0992, test_f1: 0.5387
 epoch: 30, train_loss: 0.9024, test_loss: 1.2343, test_f1: 0.4835
 epoch: 31, train_loss: 0.9081, test_loss: 1.2281, test_f1: 0.5158
 epoch: 32, train_loss: 0.9029, test_loss: 1.0827, test_f1: 0.5378
 epoch: 33, train_loss: 0.8921, test_loss: 1.1772, test_f1: 0.5346
 epoch: 34, train_loss: 0.8766, test_loss: 1.1826, test_f1: 0.5232
 epoch: 35, train_loss: 0.8784, test_loss: 1.3242, test_f1: 0.5063
 epoch: 36, train_loss: 0.8924, test_loss: 1.2013, test_f1: 0.4502
 epoch: 37, train_loss: 0.8748, test_loss: 1.2178, test_f1: 0.5108
 epoch: 38, train_loss: 0.8677, test_loss: 1.2149, test_f1: 0.5334
 epoch: 39, train_loss: 0.8625, test_loss: 1.2639, test_f1: 0.5020
 epoch: 40, train_loss: 0.8980, test_loss: 1.1155, test_f1: 0.5362
 epoch: 41, train_loss: 0.8772, test_loss: 1.2157, test_f1: 0.5069
 epoch: 42, train_loss: 0.8720, test_loss: 1.1977, test_f1: 0.5288
 epoch: 43, train_loss: 0.8437, test_loss: 1.1929, test_f1: 0.5125
 epoch: 44, train_loss: 0.8670, test_loss: 1.2730, test_f1: 0.4824
 epoch: 45, train_loss: 0.8590, test_loss: 1.2182, test_f1: 0.5325
 epoch: 46, train_loss: 0.8666, test_loss: 1.1026, test_f1: 0.5589
 epoch: 47, train_loss: 0.8375, test_loss: 1.0782, test_f1: 0.5521
 epoch: 48, train_loss: 0.8237, test_loss: 1.1314, test_f1: 0.5201
 epoch: 49, train_loss: 0.8447, test_loss: 1.1648, test_f1: 0.5283
 epoch: 50, train_loss: 0.8344, test_loss: 1.1413, test_f1: 0.5041
 epoch: 51, train_loss: 0.8268, test_loss: 1.2276, test_f1: 0.5318
 epoch: 52, train_loss: 0.8204, test_loss: 1.1737, test_f1: 0.5118
 epoch: 53, train_loss: 0.8182, test_loss: 1.2359, test_f1: 0.5150
 epoch: 54, train_loss: 0.8248, test_loss: 1.1450, test_f1: 0.5142
 epoch: 55, train_loss: 0.8139, test_loss: 1.1385, test_f1: 0.5235
 epoch: 56, train_loss: 0.8175, test_loss: 1.1222, test_f1: 0.4958
 epoch: 57, train_loss: 0.8120, test_loss: 1.1817, test_f1: 0.5423
 epoch: 58, train_loss: 0.8010, test_loss: 1.1440, test_f1: 0.4988
 epoch: 59, train_loss: 0.8085, test_loss: 1.2118, test_f1: 0.5173
 epoch: 60, train_loss: 0.8107, test_loss: 1.2377, test_f1: 0.5330
 epoch: 61, train_loss: 0.8109, test_loss: 1.2601, test_f1: 0.5315
 epoch: 62, train_loss: 0.7912, test_loss: 1.2966, test_f1: 0.5096
 epoch: 63, train_loss: 0.8007, test_loss: 1.3669, test_f1: 0.5240
 epoch: 64, train_loss: 0.7954, test_loss: 1.3881, test_f1: 0.5378
 epoch: 65, train_loss: 0.8148, test_loss: 1.5387, test_f1: 0.5164
 epoch: 66, train_loss: 0.7949, test_loss: 1.1825, test_f1: 0.4956
 epoch: 67, train_loss: 0.7771, test_loss: 1.2940, test_f1: 0.4961
 epoch: 68, train_loss: 0.7902, test_loss: 1.3478, test_f1: 0.5119
 epoch: 69, train_loss: 0.7900, test_loss: 1.3190, test_f1: 0.5519
 epoch: 70, train_loss: 0.8077, test_loss: 1.1484, test_f1: 0.5263
 epoch: 71, train_loss: 0.8168, test_loss: 1.1853, test_f1: 0.5177
 epoch: 72, train_loss: 0.7908, test_loss: 1.2628, test_f1: 0.5216
 epoch: 73, train_loss: 0.7896, test_loss: 1.1017, test_f1: 0.5720
 epoch: 74, train_loss: 0.7940, test_loss: 1.0594, test_f1: 0.5549
 epoch: 75, train_loss: 0.7880, test_loss: 1.1206, test_f1: 0.5361
 epoch: 76, train_loss: 0.7871, test_loss: 1.1570, test_f1: 0.5090
 epoch: 77, train_loss: 0.7858, test_loss: 1.2266, test_f1: 0.5330
 epoch: 78, train_loss: 0.7882, test_loss: 1.2835, test_f1: 0.5461
 epoch: 79, train_loss: 0.7935, test_loss: 1.2599, test_f1: 0.5359
 epoch: 80, train_loss: 0.7798, test_loss: 1.1697, test_f1: 0.5488
 epoch: 81, train_loss: 0.7767, test_loss: 1.1076, test_f1: 0.5271
 epoch: 82, train_loss: 0.8066, test_loss: 1.1382, test_f1: 0.5297
 epoch: 83, train_loss: 0.8057, test_loss: 1.1917, test_f1: 0.5379
 epoch: 84, train_loss: 0.7910, test_loss: 1.3653, test_f1: 0.5285
 epoch: 85, train_loss: 0.7728, test_loss: 1.3533, test_f1: 0.5145
 epoch: 86, train_loss: 0.7813, test_loss: 1.2457, test_f1: 0.5318
 epoch: 87, train_loss: 0.7760, test_loss: 1.2262, test_f1: 0.5367
 epoch: 88, train_loss: 0.7691, test_loss: 1.2363, test_f1: 0.5544
 epoch: 89, train_loss: 0.7748, test_loss: 1.2368, test_f1: 0.4880
 epoch: 90, train_loss: 0.7746, test_loss: 1.2094, test_f1: 0.5516
 epoch: 91, train_loss: 0.7698, test_loss: 1.2096, test_f1: 0.5738
 epoch: 92, train_loss: 0.7688, test_loss: 1.2611, test_f1: 0.5437
 epoch: 93, train_loss: 0.7775, test_loss: 1.4898, test_f1: 0.5157
 epoch: 94, train_loss: 0.7397, test_loss: 1.4965, test_f1: 0.5095
 epoch: 95, train_loss: 0.7568, test_loss: 1.1631, test_f1: 0.5606
 epoch: 96, train_loss: 0.7709, test_loss: 1.0842, test_f1: 0.5675
 epoch: 97, train_loss: 0.7433, test_loss: 1.4491, test_f1: 0.5082
 epoch: 98, train_loss: 0.7363, test_loss: 1.3545, test_f1: 0.5526
 epoch: 99, train_loss: 0.7416, test_loss: 1.2183, test_f1: 0.5781
##################ITERATION #9 ****************************************
 epoch: 0, train_loss: 1.4700, test_loss: 1.6315, test_f1: 0.3533
 epoch: 1, train_loss: 1.1854, test_loss: 1.5983, test_f1: 0.1398
 epoch: 2, train_loss: 1.1086, test_loss: 1.4810, test_f1: 0.3152
 epoch: 3, train_loss: 1.1266, test_loss: 1.4290, test_f1: 0.2723
 epoch: 4, train_loss: 1.0830, test_loss: 1.2330, test_f1: 0.3232
 epoch: 5, train_loss: 1.0699, test_loss: 1.3205, test_f1: 0.2678
 epoch: 6, train_loss: 1.0480, test_loss: 1.2050, test_f1: 0.3645
 epoch: 7, train_loss: 1.0195, test_loss: 1.1809, test_f1: 0.3607
 epoch: 8, train_loss: 0.9968, test_loss: 1.1516, test_f1: 0.3719
 epoch: 9, train_loss: 1.0042, test_loss: 1.1575, test_f1: 0.3507
 epoch: 10, train_loss: 0.9962, test_loss: 1.1070, test_f1: 0.4625
 epoch: 11, train_loss: 0.9798, test_loss: 1.0657, test_f1: 0.5213
 epoch: 12, train_loss: 0.9646, test_loss: 1.0556, test_f1: 0.4572
 epoch: 13, train_loss: 0.9610, test_loss: 1.0622, test_f1: 0.4997
 epoch: 14, train_loss: 0.9533, test_loss: 1.1323, test_f1: 0.4804
 epoch: 15, train_loss: 0.9494, test_loss: 1.0873, test_f1: 0.4868
 epoch: 16, train_loss: 0.9403, test_loss: 1.0564, test_f1: 0.5058
 epoch: 17, train_loss: 0.9333, test_loss: 1.0817, test_f1: 0.4905
 epoch: 18, train_loss: 0.9253, test_loss: 1.1046, test_f1: 0.4733
 epoch: 19, train_loss: 0.9301, test_loss: 1.2772, test_f1: 0.4798
 epoch: 20, train_loss: 0.9254, test_loss: 1.2792, test_f1: 0.4655
 epoch: 21, train_loss: 0.9120, test_loss: 1.2265, test_f1: 0.4346
 epoch: 22, train_loss: 0.8897, test_loss: 1.1528, test_f1: 0.4751
 epoch: 23, train_loss: 0.8932, test_loss: 1.0864, test_f1: 0.4967
 epoch: 24, train_loss: 0.8884, test_loss: 1.0565, test_f1: 0.5373
 epoch: 25, train_loss: 0.8836, test_loss: 1.1797, test_f1: 0.5175
 epoch: 26, train_loss: 0.8707, test_loss: 1.0896, test_f1: 0.5388
 epoch: 27, train_loss: 0.8699, test_loss: 1.0983, test_f1: 0.5550
 epoch: 28, train_loss: 0.8730, test_loss: 1.1279, test_f1: 0.5756
 epoch: 29, train_loss: 0.8697, test_loss: 1.0580, test_f1: 0.5676
 epoch: 30, train_loss: 0.9108, test_loss: 1.1657, test_f1: 0.4722
 epoch: 31, train_loss: 0.8571, test_loss: 1.0969, test_f1: 0.5613
 epoch: 32, train_loss: 0.8566, test_loss: 1.2170, test_f1: 0.5018
 epoch: 33, train_loss: 0.8952, test_loss: 1.0742, test_f1: 0.5755
 epoch: 34, train_loss: 0.8811, test_loss: 1.1866, test_f1: 0.5013
 epoch: 35, train_loss: 0.8705, test_loss: 1.1389, test_f1: 0.5597
 epoch: 36, train_loss: 0.8642, test_loss: 1.0474, test_f1: 0.5695
 epoch: 37, train_loss: 0.8479, test_loss: 1.1689, test_f1: 0.5418
 epoch: 38, train_loss: 0.8329, test_loss: 1.1539, test_f1: 0.5562
 epoch: 39, train_loss: 0.8460, test_loss: 1.0196, test_f1: 0.5802
 epoch: 40, train_loss: 0.8235, test_loss: 1.0696, test_f1: 0.5552
 epoch: 41, train_loss: 0.8201, test_loss: 1.2602, test_f1: 0.5153
 epoch: 42, train_loss: 0.8177, test_loss: 1.0687, test_f1: 0.5799
 epoch: 43, train_loss: 0.8249, test_loss: 1.0821, test_f1: 0.6165
 epoch: 44, train_loss: 0.8357, test_loss: 1.1284, test_f1: 0.5365
 epoch: 45, train_loss: 0.8166, test_loss: 1.0607, test_f1: 0.5569
 epoch: 46, train_loss: 0.8054, test_loss: 1.1298, test_f1: 0.5333
 epoch: 47, train_loss: 0.8023, test_loss: 1.1075, test_f1: 0.5626
 epoch: 48, train_loss: 0.8202, test_loss: 1.0998, test_f1: 0.5923
 epoch: 49, train_loss: 0.7781, test_loss: 1.1599, test_f1: 0.5727
 epoch: 50, train_loss: 0.7885, test_loss: 1.0665, test_f1: 0.5535
 epoch: 51, train_loss: 0.7707, test_loss: 1.0871, test_f1: 0.5896
 epoch: 52, train_loss: 0.7706, test_loss: 1.0808, test_f1: 0.5820
 epoch: 53, train_loss: 0.7572, test_loss: 1.1199, test_f1: 0.5861
 epoch: 54, train_loss: 0.7608, test_loss: 1.1443, test_f1: 0.5825
 epoch: 55, train_loss: 0.7426, test_loss: 1.1276, test_f1: 0.5922
 epoch: 56, train_loss: 0.7335, test_loss: 1.1481, test_f1: 0.5980
 epoch: 57, train_loss: 0.7457, test_loss: 1.2414, test_f1: 0.5449
 epoch: 58, train_loss: 0.7459, test_loss: 1.1742, test_f1: 0.5661
 epoch: 59, train_loss: 0.7412, test_loss: 1.1308, test_f1: 0.5627
 epoch: 60, train_loss: 0.7283, test_loss: 1.1489, test_f1: 0.5670
 epoch: 61, train_loss: 0.7164, test_loss: 1.0585, test_f1: 0.5900
 epoch: 62, train_loss: 0.7294, test_loss: 1.3163, test_f1: 0.5608
 epoch: 63, train_loss: 0.7198, test_loss: 1.1476, test_f1: 0.5616
 epoch: 64, train_loss: 0.7113, test_loss: 1.1560, test_f1: 0.5920
 epoch: 65, train_loss: 0.7214, test_loss: 1.1983, test_f1: 0.5988
 epoch: 66, train_loss: 0.7150, test_loss: 1.1161, test_f1: 0.5951
 epoch: 67, train_loss: 0.7036, test_loss: 1.0870, test_f1: 0.6130
 epoch: 68, train_loss: 0.7050, test_loss: 1.0972, test_f1: 0.5977
 epoch: 69, train_loss: 0.6903, test_loss: 1.1772, test_f1: 0.5791
 epoch: 70, train_loss: 0.6913, test_loss: 1.2294, test_f1: 0.5781
 epoch: 71, train_loss: 0.7031, test_loss: 1.2107, test_f1: 0.5864
 epoch: 72, train_loss: 0.6963, test_loss: 1.1629, test_f1: 0.5884
 epoch: 73, train_loss: 0.7083, test_loss: 1.1424, test_f1: 0.5838
 epoch: 74, train_loss: 0.7212, test_loss: 1.3600, test_f1: 0.5667
 epoch: 75, train_loss: 0.7106, test_loss: 1.1748, test_f1: 0.5792
 epoch: 76, train_loss: 0.7039, test_loss: 1.2465, test_f1: 0.5753
 epoch: 77, train_loss: 0.7047, test_loss: 1.2201, test_f1: 0.5828
 epoch: 78, train_loss: 0.6883, test_loss: 1.1939, test_f1: 0.6077
 epoch: 79, train_loss: 0.6835, test_loss: 1.1372, test_f1: 0.5911
 epoch: 80, train_loss: 0.7010, test_loss: 1.1722, test_f1: 0.5659
 epoch: 81, train_loss: 0.6837, test_loss: 1.1719, test_f1: 0.6072
 epoch: 82, train_loss: 0.6674, test_loss: 1.2551, test_f1: 0.5845
 epoch: 83, train_loss: 0.6775, test_loss: 1.2708, test_f1: 0.5815
 epoch: 84, train_loss: 0.6699, test_loss: 1.1941, test_f1: 0.5997
 epoch: 85, train_loss: 0.6590, test_loss: 1.1744, test_f1: 0.6022
 epoch: 86, train_loss: 0.7066, test_loss: 1.2135, test_f1: 0.5956
 epoch: 87, train_loss: 0.6949, test_loss: 1.3948, test_f1: 0.5740
 epoch: 88, train_loss: 0.7059, test_loss: 1.4404, test_f1: 0.5713
 epoch: 89, train_loss: 0.6883, test_loss: 1.3056, test_f1: 0.5520
 epoch: 90, train_loss: 0.6838, test_loss: 1.4448, test_f1: 0.5573
 epoch: 91, train_loss: 0.6739, test_loss: 1.4844, test_f1: 0.5578
 epoch: 92, train_loss: 0.7037, test_loss: 1.3804, test_f1: 0.5834
 epoch: 93, train_loss: 0.6571, test_loss: 1.4022, test_f1: 0.5864
 epoch: 94, train_loss: 0.6537, test_loss: 1.3509, test_f1: 0.5499
 epoch: 95, train_loss: 0.6594, test_loss: 1.3147, test_f1: 0.6011
 epoch: 96, train_loss: 0.6589, test_loss: 1.3015, test_f1: 0.5976
 epoch: 97, train_loss: 0.6585, test_loss: 1.4068, test_f1: 0.5799
 epoch: 98, train_loss: 0.6781, test_loss: 1.4256, test_f1: 0.5811
 epoch: 99, train_loss: 0.6896, test_loss: 1.2330, test_f1: 0.5900

Training completed in 291.39 seconds
Best F1: 0.6465 at epoch 88
Mean F1 across iterations: 0.6030  0.0214
========================FINAL RESULTS================================
FEGIN weighted F1: 0.6465  0.0214
python main.py --data ltspice_demos --representation component_net --model FEGIN --layers 3 --hiddens 16 --batch_size 256 --lr 0.01 --emb_size 250 --epochs 100 --save_appendix component_net_L3_H16_BS256_LR0.01_E250 --no_val
-----



STDERR:
  File "main.py", line 370, in <module>
    main()
  File "main.py", line 254, in main
    dataset = dataset_class(
  File "/home/philip/projects/ltspice_examples_code_repo/Circuit-Completion-Using-GNNs/component_classification_with_link_prediction_head/evaluation/FEGIN/kernel/circuit_datasets.py", line 15, in __init__
    self.data, self.slices = torch.load(self.processed_paths[0])
  File "/home/philip/.local/lib/python3.8/site-packages/torch/serialization.py", line 1040, in load
    warnings.warn(
  File "/usr/lib/python3.8/warnings.py", line 109, in _showwarnmsg
    sw(msg.message, msg.category, msg.filename, msg.lineno,
  File "main.py", line 47, in warn_with_traceback
    traceback.print_stack(file=log)
/home/philip/projects/ltspice_examples_code_repo/Circuit-Completion-Using-GNNs/component_classification_with_link_prediction_head/evaluation/FEGIN/kernel/circuit_datasets.py:15: FutureWarning: You are using `torch.load` with `weights_only=False` (the current default value), which uses the default pickle module implicitly. It is possible to construct malicious pickle data which will execute arbitrary code during unpickling (See https://github.com/pytorch/pytorch/blob/main/SECURITY.md#untrusted-models for more details). In a future release, the default value for `weights_only` will be flipped to `True`. This limits the functions that could be executed during unpickling. Arbitrary objects will no longer be allowed to be loaded via this mode unless they are explicitly allowlisted by the user via `torch.serialization.add_safe_globals`. We recommend you start setting `weights_only=True` for any use case where you don't have full control of the loaded file. Please open an issue on GitHub for any issues related to this experimental feature.
  self.data, self.slices = torch.load(self.processed_paths[0])
