STDOUT:
Results will be saved in /home/philip/projects/ltspice_examples_code_repo/Circuit-Completion-Using-GNNs/component_classification_with_link_prediction_head/evaluation/FEGIN/results/model_FEGIN_dataset_ltspice_demos
Command line input: python main.py --data ltspice_demos --representation component_pin_net --model FEGIN --layers 5 --hiddens 128 --batch_size 256 --lr 0.01 --emb_size 512 --epochs 100 --save_appendix component_pin_net_L5_H128_BS256_LR0.01_E512 --no_val
 is saved.
-----
ltspice_demos - FEGIN
Using 5 layers, 128 hidden units, h = 2
Loading component_pin_net representation dataset
Loading component_pin_net representation data...
Loaded 1948 examples (component_pin_net)
saving path: data/processed/ltspice_demos_component_pin_net_processed.pt
ENTERED
Training FEGIN on component_pin_net representation
Train: 1565, Test: 383
##################ITERATION #0 ****************************************
 epoch: 0, train_loss: 1.3120, test_loss: 1.3425, test_f1: 0.2281
 epoch: 1, train_loss: 1.2013, test_loss: 1.3585, test_f1: 0.1368
 epoch: 2, train_loss: 1.0551, test_loss: 1.2913, test_f1: 0.2446
 epoch: 3, train_loss: 0.9963, test_loss: 1.3158, test_f1: 0.2147
 epoch: 4, train_loss: 0.9783, test_loss: 1.2761, test_f1: 0.3948
 epoch: 5, train_loss: 0.9505, test_loss: 1.2378, test_f1: 0.3982
 epoch: 6, train_loss: 0.9207, test_loss: 1.8261, test_f1: 0.4104
 epoch: 7, train_loss: 0.9078, test_loss: 1.1189, test_f1: 0.5180
 epoch: 8, train_loss: 0.8883, test_loss: 1.3143, test_f1: 0.4074
 epoch: 9, train_loss: 0.8841, test_loss: 1.0713, test_f1: 0.5416
 epoch: 10, train_loss: 0.8746, test_loss: 1.3549, test_f1: 0.5062
 epoch: 11, train_loss: 0.8512, test_loss: 1.2717, test_f1: 0.4554
 epoch: 12, train_loss: 0.8196, test_loss: 1.1275, test_f1: 0.4789
 epoch: 13, train_loss: 0.8217, test_loss: 1.0840, test_f1: 0.5144
 epoch: 14, train_loss: 0.8381, test_loss: 1.5656, test_f1: 0.4192
 epoch: 15, train_loss: 0.8416, test_loss: 1.1963, test_f1: 0.5093
 epoch: 16, train_loss: 0.7856, test_loss: 1.1545, test_f1: 0.5099
 epoch: 17, train_loss: 0.7900, test_loss: 1.5332, test_f1: 0.4031
 epoch: 18, train_loss: 0.7779, test_loss: 1.1041, test_f1: 0.5674
 epoch: 19, train_loss: 0.7510, test_loss: 1.4524, test_f1: 0.4361
 epoch: 20, train_loss: 0.7517, test_loss: 1.2583, test_f1: 0.4517
 epoch: 21, train_loss: 0.7844, test_loss: 1.0655, test_f1: 0.5494
 epoch: 22, train_loss: 0.7078, test_loss: 1.1934, test_f1: 0.5120
 epoch: 23, train_loss: 0.6940, test_loss: 1.0307, test_f1: 0.6240
 epoch: 24, train_loss: 0.6963, test_loss: 1.5065, test_f1: 0.4264
 epoch: 25, train_loss: 0.6949, test_loss: 1.0247, test_f1: 0.5951
 epoch: 26, train_loss: 0.6971, test_loss: 1.0015, test_f1: 0.5570
 epoch: 27, train_loss: 0.6766, test_loss: 1.0902, test_f1: 0.5173
 epoch: 28, train_loss: 0.6671, test_loss: 1.7599, test_f1: 0.4398
 epoch: 29, train_loss: 0.6680, test_loss: 1.5206, test_f1: 0.4440
 epoch: 30, train_loss: 0.6838, test_loss: 1.0920, test_f1: 0.5692
 epoch: 31, train_loss: 0.6813, test_loss: 2.0000, test_f1: 0.4747
 epoch: 32, train_loss: 0.6831, test_loss: 1.1016, test_f1: 0.5715
 epoch: 33, train_loss: 0.6571, test_loss: 1.3284, test_f1: 0.5772
 epoch: 34, train_loss: 0.6843, test_loss: 1.3181, test_f1: 0.5765
 epoch: 35, train_loss: 0.6918, test_loss: 1.2271, test_f1: 0.5845
 epoch: 36, train_loss: 0.6561, test_loss: 1.2149, test_f1: 0.5572
 epoch: 37, train_loss: 0.5962, test_loss: 1.4325, test_f1: 0.5707
 epoch: 38, train_loss: 0.6436, test_loss: 1.1167, test_f1: 0.5853
 epoch: 39, train_loss: 0.6413, test_loss: 1.1635, test_f1: 0.6109
 epoch: 40, train_loss: 0.6777, test_loss: 1.1739, test_f1: 0.5719
 epoch: 41, train_loss: 0.7077, test_loss: 1.0640, test_f1: 0.5222
 epoch: 42, train_loss: 0.6680, test_loss: 1.1527, test_f1: 0.5739
 epoch: 43, train_loss: 0.6048, test_loss: 1.3105, test_f1: 0.5544
 epoch: 44, train_loss: 0.6743, test_loss: 1.2970, test_f1: 0.5096
 epoch: 45, train_loss: 0.6272, test_loss: 1.5380, test_f1: 0.4504
 epoch: 46, train_loss: 0.5867, test_loss: 1.1548, test_f1: 0.5960
 epoch: 47, train_loss: 0.5894, test_loss: 1.6035, test_f1: 0.5687
 epoch: 48, train_loss: 0.6957, test_loss: 1.1489, test_f1: 0.5490
 epoch: 49, train_loss: 0.6822, test_loss: 1.5592, test_f1: 0.4356
 epoch: 50, train_loss: 0.6208, test_loss: 1.0754, test_f1: 0.5856
 epoch: 51, train_loss: 0.6032, test_loss: 1.0998, test_f1: 0.6040
 epoch: 52, train_loss: 0.5634, test_loss: 1.1431, test_f1: 0.5997
 epoch: 53, train_loss: 0.5446, test_loss: 1.2386, test_f1: 0.5519
 epoch: 54, train_loss: 0.5672, test_loss: 1.1587, test_f1: 0.6022
 epoch: 55, train_loss: 0.5389, test_loss: 1.0917, test_f1: 0.5610
 epoch: 56, train_loss: 0.5305, test_loss: 1.1726, test_f1: 0.5711
 epoch: 57, train_loss: 0.5060, test_loss: 1.1710, test_f1: 0.5916
 epoch: 58, train_loss: 0.4620, test_loss: 1.3882, test_f1: 0.5887
 epoch: 59, train_loss: 0.5058, test_loss: 1.1821, test_f1: 0.6284
 epoch: 60, train_loss: 0.4481, test_loss: 1.3602, test_f1: 0.5526
 epoch: 61, train_loss: 0.4624, test_loss: 1.3975, test_f1: 0.5707
 epoch: 62, train_loss: 0.4557, test_loss: 1.4412, test_f1: 0.5669
 epoch: 63, train_loss: 0.4568, test_loss: 1.4497, test_f1: 0.6232
 epoch: 64, train_loss: 0.4507, test_loss: 1.5024, test_f1: 0.5828
 epoch: 65, train_loss: 0.4562, test_loss: 1.3909, test_f1: 0.6239
 epoch: 66, train_loss: 0.4039, test_loss: 1.3273, test_f1: 0.6345
 epoch: 67, train_loss: 0.3869, test_loss: 1.4618, test_f1: 0.5276
 epoch: 68, train_loss: 0.4009, test_loss: 1.4484, test_f1: 0.6099
 epoch: 69, train_loss: 0.3939, test_loss: 1.5169, test_f1: 0.5762
 epoch: 70, train_loss: 0.3893, test_loss: 1.4459, test_f1: 0.6135
 epoch: 71, train_loss: 0.3890, test_loss: 1.7306, test_f1: 0.5934
 epoch: 72, train_loss: 0.4060, test_loss: 1.5747, test_f1: 0.5862
 epoch: 73, train_loss: 0.4503, test_loss: 1.5958, test_f1: 0.6192
 epoch: 74, train_loss: 0.3891, test_loss: 1.5412, test_f1: 0.5855
 epoch: 75, train_loss: 0.4010, test_loss: 1.4072, test_f1: 0.6326
 epoch: 76, train_loss: 0.3717, test_loss: 1.5866, test_f1: 0.5827
 epoch: 77, train_loss: 0.3878, test_loss: 1.5971, test_f1: 0.6137
 epoch: 78, train_loss: 0.3835, test_loss: 1.4533, test_f1: 0.6178
 epoch: 79, train_loss: 0.3456, test_loss: 1.6833, test_f1: 0.5455
 epoch: 80, train_loss: 0.3471, test_loss: 1.8241, test_f1: 0.5464
 epoch: 81, train_loss: 0.3436, test_loss: 1.7407, test_f1: 0.6119
 epoch: 82, train_loss: 0.3447, test_loss: 1.8086, test_f1: 0.5877
 epoch: 83, train_loss: 0.4118, test_loss: 1.5873, test_f1: 0.5827
 epoch: 84, train_loss: 0.3319, test_loss: 1.6354, test_f1: 0.5990
 epoch: 85, train_loss: 0.3079, test_loss: 1.8733, test_f1: 0.5673
 epoch: 86, train_loss: 0.3578, test_loss: 1.6605, test_f1: 0.5995
 epoch: 87, train_loss: 0.4103, test_loss: 1.5904, test_f1: 0.5846
 epoch: 88, train_loss: 0.4148, test_loss: 1.6955, test_f1: 0.5929
 epoch: 89, train_loss: 0.3817, test_loss: 1.5318, test_f1: 0.5875
 epoch: 90, train_loss: 0.3782, test_loss: 1.5271, test_f1: 0.6400
 epoch: 91, train_loss: 0.3486, test_loss: 1.5385, test_f1: 0.6339
 epoch: 92, train_loss: 0.3149, test_loss: 1.6976, test_f1: 0.6209
 epoch: 93, train_loss: 0.2783, test_loss: 1.7532, test_f1: 0.6513
 epoch: 94, train_loss: 0.2567, test_loss: 1.7542, test_f1: 0.5792
 epoch: 95, train_loss: 0.2867, test_loss: 1.7839, test_f1: 0.6092
 epoch: 96, train_loss: 0.3041, test_loss: 1.9109, test_f1: 0.6081
 epoch: 97, train_loss: 0.3103, test_loss: 1.9639, test_f1: 0.6063
 epoch: 98, train_loss: 0.2890, test_loss: 2.0272, test_f1: 0.6061
 epoch: 99, train_loss: 0.2825, test_loss: 1.8222, test_f1: 0.6439
##################ITERATION #1 ****************************************
 epoch: 0, train_loss: 1.2523, test_loss: 1.2606, test_f1: 0.3374
 epoch: 1, train_loss: 1.0233, test_loss: 1.2581, test_f1: 0.2843
 epoch: 2, train_loss: 0.9843, test_loss: 1.0593, test_f1: 0.5051
 epoch: 3, train_loss: 0.9699, test_loss: 1.1137, test_f1: 0.3744
 epoch: 4, train_loss: 0.9601, test_loss: 1.0487, test_f1: 0.5357
 epoch: 5, train_loss: 0.9291, test_loss: 1.0767, test_f1: 0.5057
 epoch: 6, train_loss: 0.9224, test_loss: 0.9685, test_f1: 0.5550
 epoch: 7, train_loss: 0.8968, test_loss: 0.9805, test_f1: 0.5286
 epoch: 8, train_loss: 0.9052, test_loss: 1.1364, test_f1: 0.4880
 epoch: 9, train_loss: 0.8950, test_loss: 1.1056, test_f1: 0.4793
 epoch: 10, train_loss: 0.8817, test_loss: 1.0573, test_f1: 0.4866
 epoch: 11, train_loss: 0.8872, test_loss: 1.0296, test_f1: 0.5330
 epoch: 12, train_loss: 0.8774, test_loss: 0.9752, test_f1: 0.4620
 epoch: 13, train_loss: 0.8515, test_loss: 1.1239, test_f1: 0.5207
 epoch: 14, train_loss: 0.8361, test_loss: 1.1806, test_f1: 0.5160
 epoch: 15, train_loss: 0.8071, test_loss: 1.2147, test_f1: 0.5036
 epoch: 16, train_loss: 0.8092, test_loss: 1.1786, test_f1: 0.5469
 epoch: 17, train_loss: 0.8120, test_loss: 1.1292, test_f1: 0.4224
 epoch: 18, train_loss: 0.7937, test_loss: 1.5305, test_f1: 0.3533
 epoch: 19, train_loss: 0.8636, test_loss: 1.1075, test_f1: 0.4680
 epoch: 20, train_loss: 0.8001, test_loss: 1.0911, test_f1: 0.5049
 epoch: 21, train_loss: 0.8093, test_loss: 1.1716, test_f1: 0.5161
 epoch: 22, train_loss: 0.7831, test_loss: 1.1451, test_f1: 0.5202
 epoch: 23, train_loss: 0.7614, test_loss: 1.2440, test_f1: 0.5496
 epoch: 24, train_loss: 0.7229, test_loss: 1.7738, test_f1: 0.4019
 epoch: 25, train_loss: 0.7104, test_loss: 1.2347, test_f1: 0.5066
 epoch: 26, train_loss: 0.6712, test_loss: 1.4863, test_f1: 0.5010
 epoch: 27, train_loss: 0.6743, test_loss: 1.6737, test_f1: 0.4683
 epoch: 28, train_loss: 0.6826, test_loss: 1.5647, test_f1: 0.5086
 epoch: 29, train_loss: 0.6854, test_loss: 2.2588, test_f1: 0.4016
 epoch: 30, train_loss: 0.6932, test_loss: 1.4352, test_f1: 0.4769
 epoch: 31, train_loss: 0.7120, test_loss: 1.1355, test_f1: 0.5051
 epoch: 32, train_loss: 0.7191, test_loss: 1.2429, test_f1: 0.4406
 epoch: 33, train_loss: 0.6832, test_loss: 1.4459, test_f1: 0.4916
 epoch: 34, train_loss: 0.6680, test_loss: 1.4245, test_f1: 0.4709
 epoch: 35, train_loss: 0.6693, test_loss: 1.1270, test_f1: 0.5610
 epoch: 36, train_loss: 0.6298, test_loss: 1.3260, test_f1: 0.5664
 epoch: 37, train_loss: 0.6396, test_loss: 1.4157, test_f1: 0.5475
 epoch: 38, train_loss: 0.6340, test_loss: 1.3957, test_f1: 0.5976
 epoch: 39, train_loss: 0.6227, test_loss: 1.4871, test_f1: 0.5332
 epoch: 40, train_loss: 0.5734, test_loss: 1.2421, test_f1: 0.5975
 epoch: 41, train_loss: 0.5808, test_loss: 1.4702, test_f1: 0.5464
 epoch: 42, train_loss: 0.7346, test_loss: 1.7556, test_f1: 0.3636
 epoch: 43, train_loss: 0.7333, test_loss: 1.1323, test_f1: 0.5649
 epoch: 44, train_loss: 0.7035, test_loss: 1.2908, test_f1: 0.4855
 epoch: 45, train_loss: 0.6453, test_loss: 1.2724, test_f1: 0.5941
 epoch: 46, train_loss: 0.6132, test_loss: 1.2957, test_f1: 0.5575
 epoch: 47, train_loss: 0.6224, test_loss: 1.5236, test_f1: 0.5154
 epoch: 48, train_loss: 0.6125, test_loss: 1.2110, test_f1: 0.5359
 epoch: 49, train_loss: 0.6219, test_loss: 1.1356, test_f1: 0.5923
 epoch: 50, train_loss: 0.5648, test_loss: 1.2270, test_f1: 0.5841
 epoch: 51, train_loss: 0.5276, test_loss: 1.2813, test_f1: 0.6219
 epoch: 52, train_loss: 0.4962, test_loss: 1.2944, test_f1: 0.6037
 epoch: 53, train_loss: 0.4541, test_loss: 1.4105, test_f1: 0.6243
 epoch: 54, train_loss: 0.4295, test_loss: 1.4535, test_f1: 0.6128
 epoch: 55, train_loss: 0.5212, test_loss: 1.5747, test_f1: 0.5235
 epoch: 56, train_loss: 0.5048, test_loss: 1.4674, test_f1: 0.5538
 epoch: 57, train_loss: 0.4947, test_loss: 1.3445, test_f1: 0.6448
 epoch: 58, train_loss: 0.4530, test_loss: 1.2769, test_f1: 0.6138
 epoch: 59, train_loss: 0.4338, test_loss: 1.3074, test_f1: 0.6034
 epoch: 60, train_loss: 0.4569, test_loss: 1.3884, test_f1: 0.6456
 epoch: 61, train_loss: 0.4538, test_loss: 1.6435, test_f1: 0.6059
 epoch: 62, train_loss: 0.4257, test_loss: 1.5050, test_f1: 0.6207
 epoch: 63, train_loss: 0.4154, test_loss: 1.6078, test_f1: 0.6207
 epoch: 64, train_loss: 0.3876, test_loss: 1.4766, test_f1: 0.6135
 epoch: 65, train_loss: 0.4092, test_loss: 1.5193, test_f1: 0.6226
 epoch: 66, train_loss: 0.4085, test_loss: 1.5987, test_f1: 0.6057
 epoch: 67, train_loss: 0.3989, test_loss: 1.7094, test_f1: 0.5702
 epoch: 68, train_loss: 0.3772, test_loss: 2.0560, test_f1: 0.5755
 epoch: 69, train_loss: 0.3539, test_loss: 1.8423, test_f1: 0.6135
 epoch: 70, train_loss: 0.3903, test_loss: 1.8060, test_f1: 0.6152
 epoch: 71, train_loss: 0.3707, test_loss: 1.7742, test_f1: 0.5999
 epoch: 72, train_loss: 0.4143, test_loss: 1.8592, test_f1: 0.5952
 epoch: 73, train_loss: 0.3563, test_loss: 1.8076, test_f1: 0.5925
 epoch: 74, train_loss: 0.3513, test_loss: 2.0335, test_f1: 0.5780
 epoch: 75, train_loss: 0.3425, test_loss: 2.3999, test_f1: 0.5606
 epoch: 76, train_loss: 0.3412, test_loss: 2.1613, test_f1: 0.6097
 epoch: 77, train_loss: 0.3487, test_loss: 1.9328, test_f1: 0.5774
 epoch: 78, train_loss: 0.3096, test_loss: 2.3364, test_f1: 0.5791
 epoch: 79, train_loss: 0.3051, test_loss: 2.2784, test_f1: 0.6158
 epoch: 80, train_loss: 0.3053, test_loss: 2.3902, test_f1: 0.5931
 epoch: 81, train_loss: 0.2785, test_loss: 2.0676, test_f1: 0.6107
 epoch: 82, train_loss: 0.3840, test_loss: 2.0810, test_f1: 0.5445
 epoch: 83, train_loss: 0.3884, test_loss: 1.6840, test_f1: 0.6088
 epoch: 84, train_loss: 0.4375, test_loss: 1.6870, test_f1: 0.6228
 epoch: 85, train_loss: 0.3768, test_loss: 1.8225, test_f1: 0.5709
 epoch: 86, train_loss: 0.3226, test_loss: 2.3191, test_f1: 0.5346
 epoch: 87, train_loss: 0.3486, test_loss: 2.3523, test_f1: 0.5677
 epoch: 88, train_loss: 0.3399, test_loss: 2.4251, test_f1: 0.5945
 epoch: 89, train_loss: 0.3655, test_loss: 2.1880, test_f1: 0.5627
 epoch: 90, train_loss: 0.3312, test_loss: 2.1228, test_f1: 0.6089
 epoch: 91, train_loss: 0.3074, test_loss: 2.1763, test_f1: 0.5795
 epoch: 92, train_loss: 0.2732, test_loss: 1.9911, test_f1: 0.5737
 epoch: 93, train_loss: 0.2954, test_loss: 2.3288, test_f1: 0.5320
 epoch: 94, train_loss: 0.3789, test_loss: 2.1636, test_f1: 0.5690
 epoch: 95, train_loss: 0.3889, test_loss: 2.2269, test_f1: 0.5657
 epoch: 96, train_loss: 0.3163, test_loss: 2.0280, test_f1: 0.6120
 epoch: 97, train_loss: 0.3123, test_loss: 2.3558, test_f1: 0.5819
 epoch: 98, train_loss: 0.3192, test_loss: 2.6445, test_f1: 0.5765
 epoch: 99, train_loss: 0.2951, test_loss: 2.2759, test_f1: 0.5830
##################ITERATION #2 ****************************************
 epoch: 0, train_loss: 1.3639, test_loss: 1.4106, test_f1: 0.1426
 epoch: 1, train_loss: 1.1475, test_loss: 1.5640, test_f1: 0.2281
 epoch: 2, train_loss: 1.0480, test_loss: 1.5386, test_f1: 0.2542
 epoch: 3, train_loss: 0.9867, test_loss: 1.4501, test_f1: 0.2251
 epoch: 4, train_loss: 0.9635, test_loss: 1.2876, test_f1: 0.2684
 epoch: 5, train_loss: 0.9479, test_loss: 1.1413, test_f1: 0.4551
 epoch: 6, train_loss: 0.9331, test_loss: 1.1040, test_f1: 0.4795
 epoch: 7, train_loss: 0.9235, test_loss: 1.1631, test_f1: 0.5498
 epoch: 8, train_loss: 0.9080, test_loss: 1.1053, test_f1: 0.4936
 epoch: 9, train_loss: 0.8990, test_loss: 1.0324, test_f1: 0.5100
 epoch: 10, train_loss: 0.8901, test_loss: 1.0202, test_f1: 0.5182
 epoch: 11, train_loss: 0.8835, test_loss: 1.1501, test_f1: 0.5054
 epoch: 12, train_loss: 0.8458, test_loss: 1.0979, test_f1: 0.5019
 epoch: 13, train_loss: 0.8390, test_loss: 1.0952, test_f1: 0.5290
 epoch: 14, train_loss: 0.8406, test_loss: 1.2063, test_f1: 0.5017
 epoch: 15, train_loss: 0.8145, test_loss: 1.0355, test_f1: 0.4798
 epoch: 16, train_loss: 0.7942, test_loss: 1.0369, test_f1: 0.5278
 epoch: 17, train_loss: 0.8053, test_loss: 1.4486, test_f1: 0.2955
 epoch: 18, train_loss: 0.8086, test_loss: 1.2245, test_f1: 0.3594
 epoch: 19, train_loss: 0.7877, test_loss: 1.2539, test_f1: 0.3813
 epoch: 20, train_loss: 0.8380, test_loss: 1.0992, test_f1: 0.5047
 epoch: 21, train_loss: 0.8720, test_loss: 1.4223, test_f1: 0.3905
 epoch: 22, train_loss: 0.8059, test_loss: 1.0075, test_f1: 0.4989
 epoch: 23, train_loss: 0.7745, test_loss: 1.0350, test_f1: 0.5314
 epoch: 24, train_loss: 0.7282, test_loss: 1.5055, test_f1: 0.3706
 epoch: 25, train_loss: 0.7119, test_loss: 0.9880, test_f1: 0.5922
 epoch: 26, train_loss: 0.6957, test_loss: 1.2122, test_f1: 0.5586
 epoch: 27, train_loss: 0.7425, test_loss: 1.0329, test_f1: 0.5365
 epoch: 28, train_loss: 0.7222, test_loss: 1.2117, test_f1: 0.4908
 epoch: 29, train_loss: 0.7282, test_loss: 0.9924, test_f1: 0.6249
 epoch: 30, train_loss: 0.6692, test_loss: 1.1759, test_f1: 0.5525
 epoch: 31, train_loss: 0.6616, test_loss: 1.1089, test_f1: 0.5644
 epoch: 32, train_loss: 0.6677, test_loss: 1.1893, test_f1: 0.5912
 epoch: 33, train_loss: 0.6635, test_loss: 1.1138, test_f1: 0.6017
 epoch: 34, train_loss: 0.6756, test_loss: 1.1842, test_f1: 0.5574
 epoch: 35, train_loss: 0.6689, test_loss: 1.3296, test_f1: 0.5156
 epoch: 36, train_loss: 0.6867, test_loss: 1.3482, test_f1: 0.5350
 epoch: 37, train_loss: 0.6620, test_loss: 1.3794, test_f1: 0.5267
 epoch: 38, train_loss: 0.6632, test_loss: 1.6828, test_f1: 0.4557
 epoch: 39, train_loss: 0.6702, test_loss: 1.2727, test_f1: 0.5403
 epoch: 40, train_loss: 0.6383, test_loss: 1.5934, test_f1: 0.5636
 epoch: 41, train_loss: 0.6123, test_loss: 1.9669, test_f1: 0.5347
 epoch: 42, train_loss: 0.5884, test_loss: 1.7179, test_f1: 0.5372
 epoch: 43, train_loss: 0.5783, test_loss: 1.4685, test_f1: 0.5748
 epoch: 44, train_loss: 0.5661, test_loss: 2.2080, test_f1: 0.4368
 epoch: 45, train_loss: 0.5944, test_loss: 1.2466, test_f1: 0.5326
 epoch: 46, train_loss: 0.6320, test_loss: 1.2157, test_f1: 0.6020
 epoch: 47, train_loss: 0.5941, test_loss: 1.2313, test_f1: 0.6118
 epoch: 48, train_loss: 0.5168, test_loss: 1.5313, test_f1: 0.5887
 epoch: 49, train_loss: 0.5579, test_loss: 1.4254, test_f1: 0.5629
 epoch: 50, train_loss: 0.5568, test_loss: 1.5352, test_f1: 0.6151
 epoch: 51, train_loss: 0.5560, test_loss: 1.3427, test_f1: 0.6352
 epoch: 52, train_loss: 0.5528, test_loss: 1.3272, test_f1: 0.5819
 epoch: 53, train_loss: 0.5032, test_loss: 1.5003, test_f1: 0.5455
 epoch: 54, train_loss: 0.4755, test_loss: 1.4978, test_f1: 0.5988
 epoch: 55, train_loss: 0.4809, test_loss: 1.5247, test_f1: 0.6192
 epoch: 56, train_loss: 0.4469, test_loss: 1.7011, test_f1: 0.6362
 epoch: 57, train_loss: 0.4485, test_loss: 1.3703, test_f1: 0.6394
 epoch: 58, train_loss: 0.4810, test_loss: 1.4459, test_f1: 0.6011
 epoch: 59, train_loss: 0.5111, test_loss: 1.4169, test_f1: 0.6009
 epoch: 60, train_loss: 0.5032, test_loss: 1.5244, test_f1: 0.6182
 epoch: 61, train_loss: 0.4944, test_loss: 1.6696, test_f1: 0.5718
 epoch: 62, train_loss: 0.4753, test_loss: 1.5927, test_f1: 0.6055
 epoch: 63, train_loss: 0.4487, test_loss: 1.6961, test_f1: 0.5916
 epoch: 64, train_loss: 0.4553, test_loss: 1.9832, test_f1: 0.5014
 epoch: 65, train_loss: 0.4231, test_loss: 1.9184, test_f1: 0.5812
 epoch: 66, train_loss: 0.4294, test_loss: 1.9939, test_f1: 0.5610
 epoch: 67, train_loss: 0.4737, test_loss: 1.5372, test_f1: 0.5955
 epoch: 68, train_loss: 0.4930, test_loss: 1.6829, test_f1: 0.5926
 epoch: 69, train_loss: 0.4753, test_loss: 1.8061, test_f1: 0.6066
 epoch: 70, train_loss: 0.4153, test_loss: 1.6149, test_f1: 0.6400
 epoch: 71, train_loss: 0.4397, test_loss: 1.4830, test_f1: 0.6707
 epoch: 72, train_loss: 0.4223, test_loss: 1.6002, test_f1: 0.5580
 epoch: 73, train_loss: 0.4282, test_loss: 1.4644, test_f1: 0.6237
 epoch: 74, train_loss: 0.4242, test_loss: 2.0042, test_f1: 0.5489
 epoch: 75, train_loss: 0.3799, test_loss: 1.6499, test_f1: 0.6209
 epoch: 76, train_loss: 0.3730, test_loss: 1.7510, test_f1: 0.6131
 epoch: 77, train_loss: 0.3741, test_loss: 1.9166, test_f1: 0.6343
 epoch: 78, train_loss: 0.3788, test_loss: 1.8436, test_f1: 0.5238
 epoch: 79, train_loss: 0.4315, test_loss: 2.1308, test_f1: 0.5497
 epoch: 80, train_loss: 0.3577, test_loss: 1.9916, test_f1: 0.6311
 epoch: 81, train_loss: 0.3792, test_loss: 1.8284, test_f1: 0.6017
 epoch: 82, train_loss: 0.3654, test_loss: 1.6799, test_f1: 0.6331
 epoch: 83, train_loss: 0.3519, test_loss: 2.3714, test_f1: 0.5636
 epoch: 84, train_loss: 0.3649, test_loss: 1.9070, test_f1: 0.5929
 epoch: 85, train_loss: 0.3769, test_loss: 1.8840, test_f1: 0.5946
 epoch: 86, train_loss: 0.3489, test_loss: 2.2386, test_f1: 0.6114
 epoch: 87, train_loss: 0.3487, test_loss: 2.4944, test_f1: 0.5415
 epoch: 88, train_loss: 0.3535, test_loss: 2.2446, test_f1: 0.5160
 epoch: 89, train_loss: 0.3509, test_loss: 2.1024, test_f1: 0.6005
 epoch: 90, train_loss: 0.3212, test_loss: 2.1367, test_f1: 0.6264
 epoch: 91, train_loss: 0.3155, test_loss: 2.3161, test_f1: 0.5754
 epoch: 92, train_loss: 0.3440, test_loss: 2.4834, test_f1: 0.5528
 epoch: 93, train_loss: 0.3456, test_loss: 2.1052, test_f1: 0.5842
 epoch: 94, train_loss: 0.3691, test_loss: 2.3456, test_f1: 0.5553
 epoch: 95, train_loss: 0.3778, test_loss: 2.1347, test_f1: 0.5048
 epoch: 96, train_loss: 0.3790, test_loss: 1.6880, test_f1: 0.6082
 epoch: 97, train_loss: 0.3732, test_loss: 2.1517, test_f1: 0.5757
 epoch: 98, train_loss: 0.3698, test_loss: 2.2796, test_f1: 0.5577
 epoch: 99, train_loss: 0.3415, test_loss: 2.3056, test_f1: 0.5751
##################ITERATION #3 ****************************************
 epoch: 0, train_loss: 1.2840, test_loss: 1.5057, test_f1: 0.1791
 epoch: 1, train_loss: 1.0595, test_loss: 1.2802, test_f1: 0.1586
 epoch: 2, train_loss: 0.9890, test_loss: 1.2942, test_f1: 0.2478
 epoch: 3, train_loss: 0.9376, test_loss: 1.2802, test_f1: 0.3138
 epoch: 4, train_loss: 0.9153, test_loss: 1.1085, test_f1: 0.4925
 epoch: 5, train_loss: 0.9028, test_loss: 1.8191, test_f1: 0.3430
 epoch: 6, train_loss: 0.8848, test_loss: 1.4592, test_f1: 0.4599
 epoch: 7, train_loss: 0.8758, test_loss: 1.0389, test_f1: 0.4221
 epoch: 8, train_loss: 0.8577, test_loss: 1.1632, test_f1: 0.4848
 epoch: 9, train_loss: 0.8590, test_loss: 1.0753, test_f1: 0.5495
 epoch: 10, train_loss: 0.8221, test_loss: 1.1335, test_f1: 0.4072
 epoch: 11, train_loss: 0.7808, test_loss: 1.1760, test_f1: 0.4972
 epoch: 12, train_loss: 0.7812, test_loss: 1.0950, test_f1: 0.5184
 epoch: 13, train_loss: 0.7609, test_loss: 1.0933, test_f1: 0.5313
 epoch: 14, train_loss: 0.7532, test_loss: 1.2743, test_f1: 0.4799
 epoch: 15, train_loss: 0.7534, test_loss: 1.2546, test_f1: 0.5115
 epoch: 16, train_loss: 0.7300, test_loss: 1.9126, test_f1: 0.4229
 epoch: 17, train_loss: 0.7252, test_loss: 1.3875, test_f1: 0.5081
 epoch: 18, train_loss: 0.7091, test_loss: 1.2938, test_f1: 0.4652
 epoch: 19, train_loss: 0.7064, test_loss: 1.5029, test_f1: 0.5432
 epoch: 20, train_loss: 0.7255, test_loss: 2.4086, test_f1: 0.4210
 epoch: 21, train_loss: 0.7221, test_loss: 1.2461, test_f1: 0.5423
 epoch: 22, train_loss: 0.7650, test_loss: 1.5499, test_f1: 0.5058
 epoch: 23, train_loss: 0.7221, test_loss: 1.2482, test_f1: 0.5321
 epoch: 24, train_loss: 0.7016, test_loss: 1.3735, test_f1: 0.4923
 epoch: 25, train_loss: 0.6817, test_loss: 1.0922, test_f1: 0.6292
 epoch: 26, train_loss: 0.6654, test_loss: 1.1722, test_f1: 0.5502
 epoch: 27, train_loss: 0.7260, test_loss: 1.3833, test_f1: 0.5004
 epoch: 28, train_loss: 0.7067, test_loss: 1.0390, test_f1: 0.6047
 epoch: 29, train_loss: 0.6760, test_loss: 2.1118, test_f1: 0.4103
 epoch: 30, train_loss: 0.6708, test_loss: 1.2384, test_f1: 0.5673
 epoch: 31, train_loss: 0.6535, test_loss: 1.5459, test_f1: 0.4821
 epoch: 32, train_loss: 0.6980, test_loss: 1.8461, test_f1: 0.4387
 epoch: 33, train_loss: 0.6471, test_loss: 1.9690, test_f1: 0.4582
 epoch: 34, train_loss: 0.6132, test_loss: 1.7123, test_f1: 0.5254
 epoch: 35, train_loss: 0.6639, test_loss: 1.5752, test_f1: 0.4635
 epoch: 36, train_loss: 0.6326, test_loss: 1.3762, test_f1: 0.5714
 epoch: 37, train_loss: 0.5906, test_loss: 1.5471, test_f1: 0.5905
 epoch: 38, train_loss: 0.5825, test_loss: 1.5701, test_f1: 0.5933
 epoch: 39, train_loss: 0.5873, test_loss: 1.2998, test_f1: 0.6248
 epoch: 40, train_loss: 0.6116, test_loss: 1.5586, test_f1: 0.5296
 epoch: 41, train_loss: 0.6595, test_loss: 1.2328, test_f1: 0.6202
 epoch: 42, train_loss: 0.6391, test_loss: 1.3550, test_f1: 0.5387
 epoch: 43, train_loss: 0.5946, test_loss: 1.2281, test_f1: 0.6263
 epoch: 44, train_loss: 0.5555, test_loss: 1.2428, test_f1: 0.6119
 epoch: 45, train_loss: 0.5758, test_loss: 1.3278, test_f1: 0.5894
 epoch: 46, train_loss: 0.5488, test_loss: 1.5282, test_f1: 0.5779
 epoch: 47, train_loss: 0.6343, test_loss: 1.7248, test_f1: 0.4968
 epoch: 48, train_loss: 0.6317, test_loss: 1.6950, test_f1: 0.4963
 epoch: 49, train_loss: 0.6283, test_loss: 1.5214, test_f1: 0.5795
 epoch: 50, train_loss: 0.5923, test_loss: 1.2211, test_f1: 0.6269
 epoch: 51, train_loss: 0.5260, test_loss: 1.3579, test_f1: 0.6037
 epoch: 52, train_loss: 0.5145, test_loss: 1.4742, test_f1: 0.5982
 epoch: 53, train_loss: 0.5013, test_loss: 1.5385, test_f1: 0.5848
 epoch: 54, train_loss: 0.4697, test_loss: 1.5438, test_f1: 0.6167
 epoch: 55, train_loss: 0.4991, test_loss: 1.4410, test_f1: 0.5847
 epoch: 56, train_loss: 0.4667, test_loss: 1.6159, test_f1: 0.5820
 epoch: 57, train_loss: 0.4417, test_loss: 1.5711, test_f1: 0.6258
 epoch: 58, train_loss: 0.4428, test_loss: 1.5853, test_f1: 0.6039
 epoch: 59, train_loss: 0.4298, test_loss: 1.7315, test_f1: 0.5942
 epoch: 60, train_loss: 0.4306, test_loss: 1.7222, test_f1: 0.6211
 epoch: 61, train_loss: 0.4298, test_loss: 1.6745, test_f1: 0.6192
 epoch: 62, train_loss: 0.4196, test_loss: 1.7304, test_f1: 0.6122
 epoch: 63, train_loss: 0.4334, test_loss: 1.6532, test_f1: 0.6637
 epoch: 64, train_loss: 0.4287, test_loss: 1.5178, test_f1: 0.5810
 epoch: 65, train_loss: 0.4227, test_loss: 1.6321, test_f1: 0.6031
 epoch: 66, train_loss: 0.4039, test_loss: 1.8308, test_f1: 0.5926
 epoch: 67, train_loss: 0.4416, test_loss: 2.0077, test_f1: 0.5629
 epoch: 68, train_loss: 0.4609, test_loss: 1.5727, test_f1: 0.6155
 epoch: 69, train_loss: 0.4468, test_loss: 1.6542, test_f1: 0.5907
 epoch: 70, train_loss: 0.4315, test_loss: 1.6999, test_f1: 0.6260
 epoch: 71, train_loss: 0.4537, test_loss: 1.7785, test_f1: 0.6122
 epoch: 72, train_loss: 0.4514, test_loss: 1.7280, test_f1: 0.5903
 epoch: 73, train_loss: 0.4662, test_loss: 1.5551, test_f1: 0.6180
 epoch: 74, train_loss: 0.4242, test_loss: 1.8290, test_f1: 0.5963
 epoch: 75, train_loss: 0.3977, test_loss: 1.8794, test_f1: 0.6138
 epoch: 76, train_loss: 0.4225, test_loss: 1.7636, test_f1: 0.6075
 epoch: 77, train_loss: 0.4404, test_loss: 1.7165, test_f1: 0.5579
 epoch: 78, train_loss: 0.4279, test_loss: 1.8234, test_f1: 0.5933
 epoch: 79, train_loss: 0.4440, test_loss: 2.0715, test_f1: 0.5846
 epoch: 80, train_loss: 0.4071, test_loss: 1.9508, test_f1: 0.5968
 epoch: 81, train_loss: 0.3930, test_loss: 2.0741, test_f1: 0.5820
 epoch: 82, train_loss: 0.3631, test_loss: 1.8979, test_f1: 0.5887
 epoch: 83, train_loss: 0.3674, test_loss: 1.7994, test_f1: 0.5657
 epoch: 84, train_loss: 0.3703, test_loss: 1.7896, test_f1: 0.6636
 epoch: 85, train_loss: 0.3398, test_loss: 2.1672, test_f1: 0.6113
 epoch: 86, train_loss: 0.3368, test_loss: 2.4141, test_f1: 0.5499
 epoch: 87, train_loss: 0.3314, test_loss: 2.1107, test_f1: 0.6200
 epoch: 88, train_loss: 0.3424, test_loss: 2.3406, test_f1: 0.6348
 epoch: 89, train_loss: 0.3179, test_loss: 2.0427, test_f1: 0.6261
 epoch: 90, train_loss: 0.3684, test_loss: 1.9347, test_f1: 0.6017
 epoch: 91, train_loss: 0.3572, test_loss: 2.1139, test_f1: 0.5916
 epoch: 92, train_loss: 0.3856, test_loss: 2.0018, test_f1: 0.5761
 epoch: 93, train_loss: 0.4056, test_loss: 2.3213, test_f1: 0.5640
 epoch: 94, train_loss: 0.3689, test_loss: 2.0381, test_f1: 0.6038
 epoch: 95, train_loss: 0.4034, test_loss: 1.9559, test_f1: 0.6310
 epoch: 96, train_loss: 0.4793, test_loss: 2.0152, test_f1: 0.5024
 epoch: 97, train_loss: 0.4364, test_loss: 1.9641, test_f1: 0.5295
 epoch: 98, train_loss: 0.3765, test_loss: 2.0062, test_f1: 0.6025
 epoch: 99, train_loss: 0.3686, test_loss: 1.9493, test_f1: 0.6360
##################ITERATION #4 ****************************************
 epoch: 0, train_loss: 1.3491, test_loss: 1.2628, test_f1: 0.3529
 epoch: 1, train_loss: 1.1800, test_loss: 1.3720, test_f1: 0.3231
 epoch: 2, train_loss: 1.0877, test_loss: 1.4671, test_f1: 0.2345
 epoch: 3, train_loss: 1.0159, test_loss: 1.3780, test_f1: 0.2180
 epoch: 4, train_loss: 0.9620, test_loss: 1.2093, test_f1: 0.3882
 epoch: 5, train_loss: 0.9461, test_loss: 1.1612, test_f1: 0.4404
 epoch: 6, train_loss: 0.9389, test_loss: 1.1364, test_f1: 0.4139
 epoch: 7, train_loss: 0.9101, test_loss: 1.0768, test_f1: 0.5028
 epoch: 8, train_loss: 0.8849, test_loss: 1.1398, test_f1: 0.4685
 epoch: 9, train_loss: 0.8600, test_loss: 1.1705, test_f1: 0.5379
 epoch: 10, train_loss: 0.8842, test_loss: 1.3265, test_f1: 0.3868
 epoch: 11, train_loss: 0.8210, test_loss: 1.2529, test_f1: 0.5328
 epoch: 12, train_loss: 0.8258, test_loss: 1.0561, test_f1: 0.5001
 epoch: 13, train_loss: 0.8087, test_loss: 1.0683, test_f1: 0.4875
 epoch: 14, train_loss: 0.7853, test_loss: 1.0770, test_f1: 0.5358
 epoch: 15, train_loss: 0.7714, test_loss: 1.0592, test_f1: 0.5793
 epoch: 16, train_loss: 0.7520, test_loss: 1.4444, test_f1: 0.4844
 epoch: 17, train_loss: 0.7489, test_loss: 1.0427, test_f1: 0.5382
 epoch: 18, train_loss: 0.7260, test_loss: 1.0692, test_f1: 0.5768
 epoch: 19, train_loss: 0.7352, test_loss: 1.1283, test_f1: 0.6003
 epoch: 20, train_loss: 0.7346, test_loss: 1.0792, test_f1: 0.6157
 epoch: 21, train_loss: 0.7676, test_loss: 1.1826, test_f1: 0.4326
 epoch: 22, train_loss: 0.7542, test_loss: 1.2644, test_f1: 0.3929
 epoch: 23, train_loss: 0.7569, test_loss: 1.1120, test_f1: 0.5495
 epoch: 24, train_loss: 0.7138, test_loss: 1.6680, test_f1: 0.4599
 epoch: 25, train_loss: 0.7868, test_loss: 1.3158, test_f1: 0.5025
 epoch: 26, train_loss: 0.7221, test_loss: 1.2681, test_f1: 0.4785
 epoch: 27, train_loss: 0.7125, test_loss: 1.2103, test_f1: 0.4781
 epoch: 28, train_loss: 0.6716, test_loss: 1.3322, test_f1: 0.4850
 epoch: 29, train_loss: 0.6870, test_loss: 1.1623, test_f1: 0.6023
 epoch: 30, train_loss: 0.6882, test_loss: 1.1532, test_f1: 0.5214
 epoch: 31, train_loss: 0.7220, test_loss: 1.0511, test_f1: 0.5765
 epoch: 32, train_loss: 0.7004, test_loss: 1.4298, test_f1: 0.5133
 epoch: 33, train_loss: 0.7065, test_loss: 1.2354, test_f1: 0.5521
 epoch: 34, train_loss: 0.6867, test_loss: 0.9072, test_f1: 0.5795
 epoch: 35, train_loss: 0.6633, test_loss: 1.0680, test_f1: 0.5499
 epoch: 36, train_loss: 0.6339, test_loss: 1.0170, test_f1: 0.6633
 epoch: 37, train_loss: 0.6030, test_loss: 1.1262, test_f1: 0.5930
 epoch: 38, train_loss: 0.6127, test_loss: 1.1845, test_f1: 0.5936
 epoch: 39, train_loss: 0.5977, test_loss: 1.2745, test_f1: 0.5538
 epoch: 40, train_loss: 0.6153, test_loss: 1.3788, test_f1: 0.5681
 epoch: 41, train_loss: 0.5652, test_loss: 1.5060, test_f1: 0.5794
 epoch: 42, train_loss: 0.5804, test_loss: 1.2727, test_f1: 0.6283
 epoch: 43, train_loss: 0.5656, test_loss: 1.2199, test_f1: 0.5502
 epoch: 44, train_loss: 0.5573, test_loss: 1.4483, test_f1: 0.6244
 epoch: 45, train_loss: 0.5544, test_loss: 1.5645, test_f1: 0.6038
 epoch: 46, train_loss: 0.6016, test_loss: 1.5729, test_f1: 0.4786
 epoch: 47, train_loss: 0.6452, test_loss: 1.6949, test_f1: 0.5223
 epoch: 48, train_loss: 0.6082, test_loss: 1.2038, test_f1: 0.6160
 epoch: 49, train_loss: 0.5873, test_loss: 1.6453, test_f1: 0.5128
 epoch: 50, train_loss: 0.5625, test_loss: 1.4706, test_f1: 0.5467
 epoch: 51, train_loss: 0.5364, test_loss: 1.4164, test_f1: 0.5406
 epoch: 52, train_loss: 0.5149, test_loss: 1.2651, test_f1: 0.5959
 epoch: 53, train_loss: 0.5094, test_loss: 1.3907, test_f1: 0.6191
 epoch: 54, train_loss: 0.4909, test_loss: 1.8397, test_f1: 0.5006
 epoch: 55, train_loss: 0.5014, test_loss: 1.5366, test_f1: 0.5607
 epoch: 56, train_loss: 0.4926, test_loss: 1.4884, test_f1: 0.5972
 epoch: 57, train_loss: 0.4613, test_loss: 1.3006, test_f1: 0.5969
 epoch: 58, train_loss: 0.4470, test_loss: 1.2219, test_f1: 0.6429
 epoch: 59, train_loss: 0.4864, test_loss: 1.3631, test_f1: 0.5860
 epoch: 60, train_loss: 0.4918, test_loss: 1.5204, test_f1: 0.6083
 epoch: 61, train_loss: 0.4594, test_loss: 1.6025, test_f1: 0.5816
 epoch: 62, train_loss: 0.4487, test_loss: 1.4294, test_f1: 0.6196
 epoch: 63, train_loss: 0.4474, test_loss: 1.3892, test_f1: 0.6117
 epoch: 64, train_loss: 0.4401, test_loss: 1.4372, test_f1: 0.6208
 epoch: 65, train_loss: 0.4130, test_loss: 1.3558, test_f1: 0.6080
 epoch: 66, train_loss: 0.4427, test_loss: 1.4849, test_f1: 0.5806
 epoch: 67, train_loss: 0.4334, test_loss: 1.1805, test_f1: 0.6267
 epoch: 68, train_loss: 0.4003, test_loss: 1.3900, test_f1: 0.5904
 epoch: 69, train_loss: 0.4085, test_loss: 1.3952, test_f1: 0.6066
 epoch: 70, train_loss: 0.4298, test_loss: 1.8218, test_f1: 0.5588
 epoch: 71, train_loss: 0.4035, test_loss: 1.8327, test_f1: 0.5967
 epoch: 72, train_loss: 0.3889, test_loss: 1.7882, test_f1: 0.6008
 epoch: 73, train_loss: 0.4314, test_loss: 1.6347, test_f1: 0.5801
 epoch: 74, train_loss: 0.4073, test_loss: 1.7927, test_f1: 0.5930
 epoch: 75, train_loss: 0.4072, test_loss: 1.9664, test_f1: 0.5619
 epoch: 76, train_loss: 0.4319, test_loss: 1.5862, test_f1: 0.5900
 epoch: 77, train_loss: 0.3838, test_loss: 1.3641, test_f1: 0.6276
 epoch: 78, train_loss: 0.3927, test_loss: 1.7272, test_f1: 0.5898
 epoch: 79, train_loss: 0.3991, test_loss: 1.8773, test_f1: 0.5740
 epoch: 80, train_loss: 0.4011, test_loss: 1.7086, test_f1: 0.6104
 epoch: 81, train_loss: 0.4638, test_loss: 1.6892, test_f1: 0.5240
 epoch: 82, train_loss: 0.4187, test_loss: 1.4670, test_f1: 0.5486
 epoch: 83, train_loss: 0.4009, test_loss: 1.4216, test_f1: 0.5761
 epoch: 84, train_loss: 0.3940, test_loss: 1.8234, test_f1: 0.6029
 epoch: 85, train_loss: 0.3735, test_loss: 2.3222, test_f1: 0.6138
 epoch: 86, train_loss: 0.3863, test_loss: 2.4695, test_f1: 0.5873
 epoch: 87, train_loss: 0.3364, test_loss: 2.2061, test_f1: 0.5827
 epoch: 88, train_loss: 0.3234, test_loss: 2.0962, test_f1: 0.6075
 epoch: 89, train_loss: 0.3533, test_loss: 2.1134, test_f1: 0.6020
 epoch: 90, train_loss: 0.3703, test_loss: 2.0180, test_f1: 0.5906
 epoch: 91, train_loss: 0.4271, test_loss: 1.5595, test_f1: 0.6146
 epoch: 92, train_loss: 0.5112, test_loss: 1.6325, test_f1: 0.5682
 epoch: 93, train_loss: 0.4556, test_loss: 1.6325, test_f1: 0.5859
 epoch: 94, train_loss: 0.3964, test_loss: 1.7399, test_f1: 0.6146
 epoch: 95, train_loss: 0.3800, test_loss: 1.7123, test_f1: 0.6552
 epoch: 96, train_loss: 0.3393, test_loss: 1.8857, test_f1: 0.5856
 epoch: 97, train_loss: 0.3293, test_loss: 2.1539, test_f1: 0.6118
 epoch: 98, train_loss: 0.3234, test_loss: 2.4129, test_f1: 0.5780
 epoch: 99, train_loss: 0.2975, test_loss: 2.2162, test_f1: 0.6186
##################ITERATION #5 ****************************************
 epoch: 0, train_loss: 1.2858, test_loss: 1.3286, test_f1: 0.2851
 epoch: 1, train_loss: 1.0620, test_loss: 1.1931, test_f1: 0.3957
 epoch: 2, train_loss: 0.9810, test_loss: 1.0913, test_f1: 0.4431
 epoch: 3, train_loss: 0.9727, test_loss: 1.1343, test_f1: 0.5027
 epoch: 4, train_loss: 0.9288, test_loss: 1.1033, test_f1: 0.4749
 epoch: 5, train_loss: 0.9298, test_loss: 1.1646, test_f1: 0.4527
 epoch: 6, train_loss: 0.8909, test_loss: 1.1796, test_f1: 0.4877
 epoch: 7, train_loss: 0.9058, test_loss: 1.0535, test_f1: 0.5506
 epoch: 8, train_loss: 0.9202, test_loss: 1.0565, test_f1: 0.5614
 epoch: 9, train_loss: 0.8915, test_loss: 1.0330, test_f1: 0.5702
 epoch: 10, train_loss: 0.8946, test_loss: 1.0780, test_f1: 0.5176
 epoch: 11, train_loss: 0.8668, test_loss: 1.0068, test_f1: 0.5250
 epoch: 12, train_loss: 0.8096, test_loss: 1.0359, test_f1: 0.5165
 epoch: 13, train_loss: 0.8257, test_loss: 0.9941, test_f1: 0.5384
 epoch: 14, train_loss: 0.7971, test_loss: 1.1156, test_f1: 0.4867
 epoch: 15, train_loss: 0.8070, test_loss: 1.2249, test_f1: 0.4483
 epoch: 16, train_loss: 0.8017, test_loss: 1.1948, test_f1: 0.5403
 epoch: 17, train_loss: 0.7632, test_loss: 1.2268, test_f1: 0.5243
 epoch: 18, train_loss: 0.7311, test_loss: 1.3318, test_f1: 0.5035
 epoch: 19, train_loss: 0.7311, test_loss: 2.2397, test_f1: 0.3963
 epoch: 20, train_loss: 0.7743, test_loss: 1.9340, test_f1: 0.3449
 epoch: 21, train_loss: 0.7364, test_loss: 1.3285, test_f1: 0.4586
 epoch: 22, train_loss: 0.7633, test_loss: 1.0926, test_f1: 0.5883
 epoch: 23, train_loss: 0.7205, test_loss: 1.1285, test_f1: 0.5682
 epoch: 24, train_loss: 0.7106, test_loss: 1.1314, test_f1: 0.5326
 epoch: 25, train_loss: 0.7289, test_loss: 1.1470, test_f1: 0.5600
 epoch: 26, train_loss: 0.6742, test_loss: 1.2161, test_f1: 0.5426
 epoch: 27, train_loss: 0.6668, test_loss: 1.1053, test_f1: 0.5898
 epoch: 28, train_loss: 0.6887, test_loss: 1.0785, test_f1: 0.5461
 epoch: 29, train_loss: 0.6916, test_loss: 1.2107, test_f1: 0.5166
 epoch: 30, train_loss: 0.6802, test_loss: 0.9872, test_f1: 0.5746
 epoch: 31, train_loss: 0.6705, test_loss: 1.1526, test_f1: 0.5370
 epoch: 32, train_loss: 0.6634, test_loss: 1.0977, test_f1: 0.5146
 epoch: 33, train_loss: 0.6364, test_loss: 1.2751, test_f1: 0.5382
 epoch: 34, train_loss: 0.6464, test_loss: 1.2339, test_f1: 0.5232
 epoch: 35, train_loss: 0.6392, test_loss: 1.2504, test_f1: 0.5023
 epoch: 36, train_loss: 0.6999, test_loss: 1.2989, test_f1: 0.4943
 epoch: 37, train_loss: 0.6415, test_loss: 1.1010, test_f1: 0.5927
 epoch: 38, train_loss: 0.6312, test_loss: 1.1823, test_f1: 0.5382
 epoch: 39, train_loss: 0.5914, test_loss: 1.2842, test_f1: 0.5164
 epoch: 40, train_loss: 0.5963, test_loss: 1.3021, test_f1: 0.5852
 epoch: 41, train_loss: 0.5910, test_loss: 1.2348, test_f1: 0.5469
 epoch: 42, train_loss: 0.5426, test_loss: 1.4628, test_f1: 0.5419
 epoch: 43, train_loss: 0.5620, test_loss: 1.1618, test_f1: 0.6289
 epoch: 44, train_loss: 0.5822, test_loss: 1.1958, test_f1: 0.6037
 epoch: 45, train_loss: 0.5895, test_loss: 1.1710, test_f1: 0.6122
 epoch: 46, train_loss: 0.5656, test_loss: 1.1814, test_f1: 0.5670
 epoch: 47, train_loss: 0.5928, test_loss: 1.1488, test_f1: 0.5751
 epoch: 48, train_loss: 0.5838, test_loss: 1.2351, test_f1: 0.5600
 epoch: 49, train_loss: 0.5372, test_loss: 1.2298, test_f1: 0.6053
 epoch: 50, train_loss: 0.5392, test_loss: 1.7054, test_f1: 0.5289
 epoch: 51, train_loss: 0.5219, test_loss: 1.4681, test_f1: 0.6133
 epoch: 52, train_loss: 0.4912, test_loss: 1.3916, test_f1: 0.6206
 epoch: 53, train_loss: 0.4607, test_loss: 1.2930, test_f1: 0.6626
 epoch: 54, train_loss: 0.4481, test_loss: 1.4248, test_f1: 0.6392
 epoch: 55, train_loss: 0.4475, test_loss: 1.4307, test_f1: 0.6018
 epoch: 56, train_loss: 0.4384, test_loss: 1.3547, test_f1: 0.6283
 epoch: 57, train_loss: 0.4672, test_loss: 1.3280, test_f1: 0.6641
 epoch: 58, train_loss: 0.4116, test_loss: 1.6565, test_f1: 0.6075
 epoch: 59, train_loss: 0.4483, test_loss: 1.9997, test_f1: 0.5661
 epoch: 60, train_loss: 0.4160, test_loss: 1.2484, test_f1: 0.6376
 epoch: 61, train_loss: 0.4294, test_loss: 1.4145, test_f1: 0.6017
 epoch: 62, train_loss: 0.4236, test_loss: 1.5034, test_f1: 0.6079
 epoch: 63, train_loss: 0.4050, test_loss: 1.5763, test_f1: 0.6153
 epoch: 64, train_loss: 0.4270, test_loss: 1.6609, test_f1: 0.5924
 epoch: 65, train_loss: 0.4026, test_loss: 1.6308, test_f1: 0.6077
 epoch: 66, train_loss: 0.4415, test_loss: 1.7246, test_f1: 0.5773
 epoch: 67, train_loss: 0.4193, test_loss: 1.6857, test_f1: 0.6060
 epoch: 68, train_loss: 0.4186, test_loss: 1.6916, test_f1: 0.6162
 epoch: 69, train_loss: 0.4261, test_loss: 1.5038, test_f1: 0.6237
 epoch: 70, train_loss: 0.4426, test_loss: 1.4205, test_f1: 0.6033
 epoch: 71, train_loss: 0.4686, test_loss: 1.4862, test_f1: 0.5934
 epoch: 72, train_loss: 0.4414, test_loss: 1.5173, test_f1: 0.5962
 epoch: 73, train_loss: 0.4031, test_loss: 1.4177, test_f1: 0.6539
 epoch: 74, train_loss: 0.3625, test_loss: 1.5475, test_f1: 0.6417
 epoch: 75, train_loss: 0.3547, test_loss: 1.6599, test_f1: 0.6246
 epoch: 76, train_loss: 0.3475, test_loss: 1.7311, test_f1: 0.6111
 epoch: 77, train_loss: 0.3671, test_loss: 1.8277, test_f1: 0.6191
 epoch: 78, train_loss: 0.3552, test_loss: 1.8186, test_f1: 0.6071
 epoch: 79, train_loss: 0.3603, test_loss: 1.7232, test_f1: 0.6202
 epoch: 80, train_loss: 0.3479, test_loss: 1.7951, test_f1: 0.6148
 epoch: 81, train_loss: 0.3394, test_loss: 1.8305, test_f1: 0.6235
 epoch: 82, train_loss: 0.3098, test_loss: 2.1238, test_f1: 0.5856
 epoch: 83, train_loss: 0.3552, test_loss: 1.9052, test_f1: 0.6025
 epoch: 84, train_loss: 0.3641, test_loss: 1.8046, test_f1: 0.6275
 epoch: 85, train_loss: 0.3685, test_loss: 1.7414, test_f1: 0.6593
 epoch: 86, train_loss: 0.3398, test_loss: 1.7095, test_f1: 0.6536
 epoch: 87, train_loss: 0.3287, test_loss: 2.4273, test_f1: 0.5495
 epoch: 88, train_loss: 0.3163, test_loss: 1.8265, test_f1: 0.6417
 epoch: 89, train_loss: 0.3277, test_loss: 2.0484, test_f1: 0.6478
 epoch: 90, train_loss: 0.3024, test_loss: 1.9344, test_f1: 0.6332
 epoch: 91, train_loss: 0.3158, test_loss: 1.8855, test_f1: 0.6308
 epoch: 92, train_loss: 0.3503, test_loss: 2.0463, test_f1: 0.6019
 epoch: 93, train_loss: 0.2879, test_loss: 2.1622, test_f1: 0.6130
 epoch: 94, train_loss: 0.3069, test_loss: 2.0484, test_f1: 0.6163
 epoch: 95, train_loss: 0.2862, test_loss: 2.0374, test_f1: 0.6017
 epoch: 96, train_loss: 0.3082, test_loss: 1.8561, test_f1: 0.6370
 epoch: 97, train_loss: 0.3220, test_loss: 1.9724, test_f1: 0.6064
 epoch: 98, train_loss: 0.2919, test_loss: 1.7779, test_f1: 0.6183
 epoch: 99, train_loss: 0.3155, test_loss: 1.7988, test_f1: 0.6134
##################ITERATION #6 ****************************************
 epoch: 0, train_loss: 1.2715, test_loss: 1.4687, test_f1: 0.2281
 epoch: 1, train_loss: 1.0446, test_loss: 1.3912, test_f1: 0.3317
 epoch: 2, train_loss: 0.9461, test_loss: 1.7247, test_f1: 0.3483
 epoch: 3, train_loss: 0.9256, test_loss: 1.7322, test_f1: 0.2928
 epoch: 4, train_loss: 0.9331, test_loss: 1.3155, test_f1: 0.4118
 epoch: 5, train_loss: 0.9114, test_loss: 1.2262, test_f1: 0.3845
 epoch: 6, train_loss: 0.9174, test_loss: 1.1697, test_f1: 0.4238
 epoch: 7, train_loss: 0.9045, test_loss: 1.1014, test_f1: 0.4598
 epoch: 8, train_loss: 0.8559, test_loss: 1.0317, test_f1: 0.4862
 epoch: 9, train_loss: 0.8342, test_loss: 1.1626, test_f1: 0.4680
 epoch: 10, train_loss: 0.8433, test_loss: 1.1263, test_f1: 0.4017
 epoch: 11, train_loss: 0.8238, test_loss: 1.0616, test_f1: 0.5050
 epoch: 12, train_loss: 0.7787, test_loss: 1.1133, test_f1: 0.5524
 epoch: 13, train_loss: 0.7833, test_loss: 1.3695, test_f1: 0.5050
 epoch: 14, train_loss: 0.7631, test_loss: 2.1657, test_f1: 0.3561
 epoch: 15, train_loss: 0.7334, test_loss: 1.7386, test_f1: 0.4835
 epoch: 16, train_loss: 0.7381, test_loss: 1.1938, test_f1: 0.5400
 epoch: 17, train_loss: 0.7287, test_loss: 1.1297, test_f1: 0.5211
 epoch: 18, train_loss: 0.7031, test_loss: 1.2356, test_f1: 0.5112
 epoch: 19, train_loss: 0.6961, test_loss: 1.0983, test_f1: 0.5476
 epoch: 20, train_loss: 0.7220, test_loss: 1.5881, test_f1: 0.3199
 epoch: 21, train_loss: 0.7154, test_loss: 1.1808, test_f1: 0.5768
 epoch: 22, train_loss: 0.6892, test_loss: 0.9744, test_f1: 0.6385
 epoch: 23, train_loss: 0.6493, test_loss: 1.0100, test_f1: 0.6185
 epoch: 24, train_loss: 0.6413, test_loss: 1.2078, test_f1: 0.5837
 epoch: 25, train_loss: 0.6538, test_loss: 1.3801, test_f1: 0.5326
 epoch: 26, train_loss: 0.6690, test_loss: 1.2202, test_f1: 0.5981
 epoch: 27, train_loss: 0.6417, test_loss: 1.3709, test_f1: 0.4344
 epoch: 28, train_loss: 0.6494, test_loss: 1.2829, test_f1: 0.5558
 epoch: 29, train_loss: 0.6767, test_loss: 1.1912, test_f1: 0.5978
 epoch: 30, train_loss: 0.6670, test_loss: 1.1606, test_f1: 0.5794
 epoch: 31, train_loss: 0.6639, test_loss: 1.6933, test_f1: 0.4344
 epoch: 32, train_loss: 0.6671, test_loss: 1.0487, test_f1: 0.5868
 epoch: 33, train_loss: 0.6190, test_loss: 1.1450, test_f1: 0.5528
 epoch: 34, train_loss: 0.5974, test_loss: 1.1339, test_f1: 0.5805
 epoch: 35, train_loss: 0.6147, test_loss: 1.4612, test_f1: 0.4644
 epoch: 36, train_loss: 0.6329, test_loss: 1.2463, test_f1: 0.5593
 epoch: 37, train_loss: 0.6401, test_loss: 1.3644, test_f1: 0.5717
 epoch: 38, train_loss: 0.5951, test_loss: 1.0975, test_f1: 0.5620
 epoch: 39, train_loss: 0.5931, test_loss: 1.2107, test_f1: 0.5582
 epoch: 40, train_loss: 0.5896, test_loss: 2.9387, test_f1: 0.4786
 epoch: 41, train_loss: 0.6406, test_loss: 1.2442, test_f1: 0.5796
 epoch: 42, train_loss: 0.5849, test_loss: 1.2115, test_f1: 0.5758
 epoch: 43, train_loss: 0.5891, test_loss: 1.2733, test_f1: 0.6004
 epoch: 44, train_loss: 0.5894, test_loss: 1.3547, test_f1: 0.5823
 epoch: 45, train_loss: 0.5551, test_loss: 1.2337, test_f1: 0.5665
 epoch: 46, train_loss: 0.6015, test_loss: 1.3056, test_f1: 0.6014
 epoch: 47, train_loss: 0.5778, test_loss: 1.6833, test_f1: 0.5575
 epoch: 48, train_loss: 0.6002, test_loss: 1.2994, test_f1: 0.5741
 epoch: 49, train_loss: 0.5801, test_loss: 1.1676, test_f1: 0.5990
 epoch: 50, train_loss: 0.5656, test_loss: 1.5030, test_f1: 0.5111
 epoch: 51, train_loss: 0.5890, test_loss: 1.2366, test_f1: 0.5772
 epoch: 52, train_loss: 0.5667, test_loss: 1.1303, test_f1: 0.6418
 epoch: 53, train_loss: 0.5635, test_loss: 1.1046, test_f1: 0.6202
 epoch: 54, train_loss: 0.5013, test_loss: 1.3122, test_f1: 0.5633
 epoch: 55, train_loss: 0.4877, test_loss: 1.2073, test_f1: 0.6093
 epoch: 56, train_loss: 0.4539, test_loss: 1.2184, test_f1: 0.6378
 epoch: 57, train_loss: 0.4446, test_loss: 1.2768, test_f1: 0.6119
 epoch: 58, train_loss: 0.4344, test_loss: 1.2877, test_f1: 0.6042
 epoch: 59, train_loss: 0.4280, test_loss: 1.4555, test_f1: 0.5600
 epoch: 60, train_loss: 0.4381, test_loss: 1.3592, test_f1: 0.5973
 epoch: 61, train_loss: 0.3992, test_loss: 1.4349, test_f1: 0.6211
 epoch: 62, train_loss: 0.4293, test_loss: 1.4067, test_f1: 0.6285
 epoch: 63, train_loss: 0.4372, test_loss: 1.2982, test_f1: 0.6275
 epoch: 64, train_loss: 0.4300, test_loss: 1.2986, test_f1: 0.6163
 epoch: 65, train_loss: 0.4100, test_loss: 1.5110, test_f1: 0.6386
 epoch: 66, train_loss: 0.4097, test_loss: 1.5420, test_f1: 0.6142
 epoch: 67, train_loss: 0.4023, test_loss: 1.7655, test_f1: 0.6041
 epoch: 68, train_loss: 0.3841, test_loss: 1.4249, test_f1: 0.5474
 epoch: 69, train_loss: 0.4289, test_loss: 1.7944, test_f1: 0.6282
 epoch: 70, train_loss: 0.4101, test_loss: 1.4578, test_f1: 0.6473
 epoch: 71, train_loss: 0.3889, test_loss: 1.4956, test_f1: 0.6046
 epoch: 72, train_loss: 0.3688, test_loss: 1.5851, test_f1: 0.5943
 epoch: 73, train_loss: 0.3766, test_loss: 1.8142, test_f1: 0.6231
 epoch: 74, train_loss: 0.3584, test_loss: 1.5514, test_f1: 0.6123
 epoch: 75, train_loss: 0.3478, test_loss: 1.8316, test_f1: 0.6414
 epoch: 76, train_loss: 0.3202, test_loss: 2.0470, test_f1: 0.6285
 epoch: 77, train_loss: 0.3328, test_loss: 1.7098, test_f1: 0.6418
 epoch: 78, train_loss: 0.3243, test_loss: 1.5433, test_f1: 0.6507
 epoch: 79, train_loss: 0.3244, test_loss: 1.7102, test_f1: 0.6131
 epoch: 80, train_loss: 0.3248, test_loss: 1.6182, test_f1: 0.6488
 epoch: 81, train_loss: 0.3295, test_loss: 1.7408, test_f1: 0.6129
 epoch: 82, train_loss: 0.3267, test_loss: 1.8360, test_f1: 0.6104
 epoch: 83, train_loss: 0.3160, test_loss: 1.8758, test_f1: 0.6142
 epoch: 84, train_loss: 0.3002, test_loss: 1.7890, test_f1: 0.6347
 epoch: 85, train_loss: 0.3193, test_loss: 2.6146, test_f1: 0.6402
 epoch: 86, train_loss: 0.2957, test_loss: 1.8610, test_f1: 0.6217
 epoch: 87, train_loss: 0.2961, test_loss: 1.6426, test_f1: 0.6377
 epoch: 88, train_loss: 0.2684, test_loss: 2.1562, test_f1: 0.6241
 epoch: 89, train_loss: 0.2861, test_loss: 2.5062, test_f1: 0.5758
 epoch: 90, train_loss: 0.3377, test_loss: 2.1586, test_f1: 0.6375
 epoch: 91, train_loss: 0.2905, test_loss: 1.9578, test_f1: 0.6315
 epoch: 92, train_loss: 0.3046, test_loss: 1.8092, test_f1: 0.6270
 epoch: 93, train_loss: 0.2866, test_loss: 1.9855, test_f1: 0.6389
 epoch: 94, train_loss: 0.2764, test_loss: 2.0751, test_f1: 0.6333
 epoch: 95, train_loss: 0.2883, test_loss: 1.8825, test_f1: 0.6063
 epoch: 96, train_loss: 0.2741, test_loss: 1.7052, test_f1: 0.5975
 epoch: 97, train_loss: 0.2516, test_loss: 2.0163, test_f1: 0.6017
 epoch: 98, train_loss: 0.2473, test_loss: 2.0757, test_f1: 0.6434
 epoch: 99, train_loss: 0.2924, test_loss: 2.3322, test_f1: 0.6367
##################ITERATION #7 ****************************************
 epoch: 0, train_loss: 1.4249, test_loss: 1.4006, test_f1: 0.3112
 epoch: 1, train_loss: 1.0491, test_loss: 1.4498, test_f1: 0.2281
 epoch: 2, train_loss: 0.9760, test_loss: 1.2641, test_f1: 0.2657
 epoch: 3, train_loss: 0.9534, test_loss: 1.3167, test_f1: 0.2456
 epoch: 4, train_loss: 0.9539, test_loss: 1.1027, test_f1: 0.4833
 epoch: 5, train_loss: 0.8819, test_loss: 1.2021, test_f1: 0.4590
 epoch: 6, train_loss: 0.8650, test_loss: 1.0668, test_f1: 0.5024
 epoch: 7, train_loss: 0.8397, test_loss: 0.9879, test_f1: 0.5917
 epoch: 8, train_loss: 0.8240, test_loss: 1.1737, test_f1: 0.5069
 epoch: 9, train_loss: 0.8212, test_loss: 1.2047, test_f1: 0.5132
 epoch: 10, train_loss: 0.8396, test_loss: 1.2235, test_f1: 0.5043
 epoch: 11, train_loss: 0.7727, test_loss: 1.3986, test_f1: 0.4831
 epoch: 12, train_loss: 0.7572, test_loss: 1.1054, test_f1: 0.5537
 epoch: 13, train_loss: 0.7419, test_loss: 1.1956, test_f1: 0.5005
 epoch: 14, train_loss: 0.7332, test_loss: 1.2890, test_f1: 0.5176
 epoch: 15, train_loss: 0.7213, test_loss: 1.1003, test_f1: 0.5077
 epoch: 16, train_loss: 0.7211, test_loss: 1.0615, test_f1: 0.5347
 epoch: 17, train_loss: 0.6867, test_loss: 1.1321, test_f1: 0.5404
 epoch: 18, train_loss: 0.6795, test_loss: 1.4929, test_f1: 0.4673
 epoch: 19, train_loss: 0.7122, test_loss: 1.6805, test_f1: 0.5333
 epoch: 20, train_loss: 0.6853, test_loss: 1.8437, test_f1: 0.5314
 epoch: 21, train_loss: 0.6553, test_loss: 1.1839, test_f1: 0.5763
 epoch: 22, train_loss: 0.6891, test_loss: 1.1274, test_f1: 0.6483
 epoch: 23, train_loss: 0.6629, test_loss: 1.1412, test_f1: 0.5414
 epoch: 24, train_loss: 0.6546, test_loss: 1.3117, test_f1: 0.5518
 epoch: 25, train_loss: 0.6385, test_loss: 1.2353, test_f1: 0.6187
 epoch: 26, train_loss: 0.6400, test_loss: 1.5836, test_f1: 0.4985
 epoch: 27, train_loss: 0.6245, test_loss: 1.2747, test_f1: 0.5185
 epoch: 28, train_loss: 0.5922, test_loss: 1.5533, test_f1: 0.5634
 epoch: 29, train_loss: 0.6401, test_loss: 1.2668, test_f1: 0.5612
 epoch: 30, train_loss: 0.6043, test_loss: 1.6166, test_f1: 0.5024
 epoch: 31, train_loss: 0.5892, test_loss: 1.6434, test_f1: 0.5382
 epoch: 32, train_loss: 0.6551, test_loss: 1.6054, test_f1: 0.4845
 epoch: 33, train_loss: 0.6221, test_loss: 1.3024, test_f1: 0.5463
 epoch: 34, train_loss: 0.6154, test_loss: 2.1333, test_f1: 0.4617
 epoch: 35, train_loss: 0.6425, test_loss: 1.2979, test_f1: 0.4930
 epoch: 36, train_loss: 0.5994, test_loss: 1.4660, test_f1: 0.5439
 epoch: 37, train_loss: 0.5694, test_loss: 1.6334, test_f1: 0.5684
 epoch: 38, train_loss: 0.5568, test_loss: 1.5198, test_f1: 0.5707
 epoch: 39, train_loss: 0.5396, test_loss: 1.2927, test_f1: 0.5560
 epoch: 40, train_loss: 0.5255, test_loss: 1.4607, test_f1: 0.5637
 epoch: 41, train_loss: 0.5868, test_loss: 1.6257, test_f1: 0.5393
 epoch: 42, train_loss: 0.5836, test_loss: 1.4826, test_f1: 0.5373
 epoch: 43, train_loss: 0.5429, test_loss: 1.5280, test_f1: 0.5543
 epoch: 44, train_loss: 0.5094, test_loss: 2.2218, test_f1: 0.5902
 epoch: 45, train_loss: 0.5162, test_loss: 1.4006, test_f1: 0.5747
 epoch: 46, train_loss: 0.5846, test_loss: 2.3317, test_f1: 0.5092
 epoch: 47, train_loss: 0.5725, test_loss: 1.6726, test_f1: 0.5407
 epoch: 48, train_loss: 0.5702, test_loss: 1.4451, test_f1: 0.5616
 epoch: 49, train_loss: 0.5723, test_loss: 1.7684, test_f1: 0.5223
 epoch: 50, train_loss: 0.5189, test_loss: 2.2088, test_f1: 0.5224
 epoch: 51, train_loss: 0.5032, test_loss: 1.5359, test_f1: 0.5791
 epoch: 52, train_loss: 0.4753, test_loss: 1.3218, test_f1: 0.6147
 epoch: 53, train_loss: 0.4465, test_loss: 1.4618, test_f1: 0.5345
 epoch: 54, train_loss: 0.4658, test_loss: 1.3824, test_f1: 0.6254
 epoch: 55, train_loss: 0.4156, test_loss: 1.5083, test_f1: 0.6466
 epoch: 56, train_loss: 0.4121, test_loss: 1.5520, test_f1: 0.6506
 epoch: 57, train_loss: 0.3719, test_loss: 1.8784, test_f1: 0.6378
 epoch: 58, train_loss: 0.3825, test_loss: 1.8284, test_f1: 0.5997
 epoch: 59, train_loss: 0.3644, test_loss: 1.9040, test_f1: 0.6260
 epoch: 60, train_loss: 0.3456, test_loss: 1.7744, test_f1: 0.6441
 epoch: 61, train_loss: 0.3269, test_loss: 2.2564, test_f1: 0.6076
 epoch: 62, train_loss: 0.3637, test_loss: 1.7451, test_f1: 0.6280
 epoch: 63, train_loss: 0.3358, test_loss: 1.7484, test_f1: 0.6158
 epoch: 64, train_loss: 0.3552, test_loss: 1.9072, test_f1: 0.5999
 epoch: 65, train_loss: 0.3421, test_loss: 2.2529, test_f1: 0.6071
 epoch: 66, train_loss: 0.3426, test_loss: 2.2620, test_f1: 0.6059
 epoch: 67, train_loss: 0.3421, test_loss: 1.8205, test_f1: 0.6019
 epoch: 68, train_loss: 0.3102, test_loss: 2.0401, test_f1: 0.6354
 epoch: 69, train_loss: 0.3318, test_loss: 2.0626, test_f1: 0.6190
 epoch: 70, train_loss: 0.3126, test_loss: 2.4569, test_f1: 0.6053
 epoch: 71, train_loss: 0.3077, test_loss: 2.1481, test_f1: 0.6393
 epoch: 72, train_loss: 0.3670, test_loss: 1.8798, test_f1: 0.6073
 epoch: 73, train_loss: 0.4077, test_loss: 1.9430, test_f1: 0.6378
 epoch: 74, train_loss: 0.4366, test_loss: 1.5506, test_f1: 0.6275
 epoch: 75, train_loss: 0.4083, test_loss: 1.7070, test_f1: 0.6353
 epoch: 76, train_loss: 0.3708, test_loss: 1.6994, test_f1: 0.6660
 epoch: 77, train_loss: 0.3384, test_loss: 1.5817, test_f1: 0.6467
 epoch: 78, train_loss: 0.3070, test_loss: 1.5897, test_f1: 0.6581
 epoch: 79, train_loss: 0.3240, test_loss: 1.7396, test_f1: 0.6403
 epoch: 80, train_loss: 0.3145, test_loss: 1.7217, test_f1: 0.6275
 epoch: 81, train_loss: 0.3335, test_loss: 1.9762, test_f1: 0.6108
 epoch: 82, train_loss: 0.3502, test_loss: 2.4546, test_f1: 0.5735
 epoch: 83, train_loss: 0.3030, test_loss: 1.8031, test_f1: 0.5793
 epoch: 84, train_loss: 0.2755, test_loss: 1.7662, test_f1: 0.6572
 epoch: 85, train_loss: 0.2574, test_loss: 1.9660, test_f1: 0.6385
 epoch: 86, train_loss: 0.2492, test_loss: 2.0807, test_f1: 0.6134
 epoch: 87, train_loss: 0.2402, test_loss: 2.0842, test_f1: 0.6520
 epoch: 88, train_loss: 0.2627, test_loss: 2.2877, test_f1: 0.6110
 epoch: 89, train_loss: 0.2218, test_loss: 2.2644, test_f1: 0.6158
 epoch: 90, train_loss: 0.2584, test_loss: 2.1920, test_f1: 0.5813
 epoch: 91, train_loss: 0.2747, test_loss: 2.4493, test_f1: 0.6216
 epoch: 92, train_loss: 0.2509, test_loss: 2.4277, test_f1: 0.6281
 epoch: 93, train_loss: 0.2593, test_loss: 2.5676, test_f1: 0.6390
 epoch: 94, train_loss: 0.2786, test_loss: 2.2981, test_f1: 0.6024
 epoch: 95, train_loss: 0.3382, test_loss: 2.1208, test_f1: 0.5720
 epoch: 96, train_loss: 0.3156, test_loss: 1.9720, test_f1: 0.6247
 epoch: 97, train_loss: 0.3126, test_loss: 2.4374, test_f1: 0.5859
 epoch: 98, train_loss: 0.2594, test_loss: 2.8092, test_f1: 0.6043
 epoch: 99, train_loss: 0.2524, test_loss: 2.8928, test_f1: 0.6070
##################ITERATION #8 ****************************************
 epoch: 0, train_loss: 1.2923, test_loss: 1.7217, test_f1: 0.1365
 epoch: 1, train_loss: 1.1179, test_loss: 1.1925, test_f1: 0.3242
 epoch: 2, train_loss: 1.0002, test_loss: 1.1386, test_f1: 0.4126
 epoch: 3, train_loss: 0.9602, test_loss: 1.1638, test_f1: 0.3339
 epoch: 4, train_loss: 0.9198, test_loss: 1.0872, test_f1: 0.4237
 epoch: 5, train_loss: 0.8974, test_loss: 1.0212, test_f1: 0.5371
 epoch: 6, train_loss: 0.8683, test_loss: 1.1189, test_f1: 0.5146
 epoch: 7, train_loss: 0.8641, test_loss: 1.0392, test_f1: 0.5199
 epoch: 8, train_loss: 0.8570, test_loss: 1.0673, test_f1: 0.4897
 epoch: 9, train_loss: 0.8220, test_loss: 1.0600, test_f1: 0.5498
 epoch: 10, train_loss: 0.7970, test_loss: 1.1274, test_f1: 0.5419
 epoch: 11, train_loss: 0.8134, test_loss: 1.1480, test_f1: 0.4738
 epoch: 12, train_loss: 0.7800, test_loss: 1.1669, test_f1: 0.5271
 epoch: 13, train_loss: 0.7882, test_loss: 1.2182, test_f1: 0.5279
 epoch: 14, train_loss: 0.8124, test_loss: 1.0613, test_f1: 0.5343
 epoch: 15, train_loss: 0.8032, test_loss: 1.3326, test_f1: 0.4072
 epoch: 16, train_loss: 0.7814, test_loss: 1.0365, test_f1: 0.5267
 epoch: 17, train_loss: 0.7628, test_loss: 1.0798, test_f1: 0.5320
 epoch: 18, train_loss: 0.7390, test_loss: 1.1977, test_f1: 0.5108
 epoch: 19, train_loss: 0.7157, test_loss: 1.8000, test_f1: 0.4502
 epoch: 20, train_loss: 0.7363, test_loss: 1.1397, test_f1: 0.5340
 epoch: 21, train_loss: 0.7093, test_loss: 1.3831, test_f1: 0.5078
 epoch: 22, train_loss: 0.7402, test_loss: 1.2876, test_f1: 0.4941
 epoch: 23, train_loss: 0.6929, test_loss: 1.2998, test_f1: 0.5372
 epoch: 24, train_loss: 0.6668, test_loss: 1.6124, test_f1: 0.5172
 epoch: 25, train_loss: 0.7568, test_loss: 1.2130, test_f1: 0.4765
 epoch: 26, train_loss: 0.7277, test_loss: 1.0261, test_f1: 0.5633
 epoch: 27, train_loss: 0.6825, test_loss: 1.1113, test_f1: 0.5545
 epoch: 28, train_loss: 0.6600, test_loss: 1.1410, test_f1: 0.5763
 epoch: 29, train_loss: 0.6725, test_loss: 1.0790, test_f1: 0.5394
 epoch: 30, train_loss: 0.6420, test_loss: 1.1011, test_f1: 0.5565
 epoch: 31, train_loss: 0.6429, test_loss: 1.1482, test_f1: 0.5743
 epoch: 32, train_loss: 0.6576, test_loss: 1.1916, test_f1: 0.5283
 epoch: 33, train_loss: 0.6482, test_loss: 1.3176, test_f1: 0.5367
 epoch: 34, train_loss: 0.6215, test_loss: 1.2682, test_f1: 0.5575
 epoch: 35, train_loss: 0.5828, test_loss: 1.2539, test_f1: 0.5772
 epoch: 36, train_loss: 0.5965, test_loss: 1.2218, test_f1: 0.6065
 epoch: 37, train_loss: 0.5975, test_loss: 1.1005, test_f1: 0.6314
 epoch: 38, train_loss: 0.5862, test_loss: 1.3511, test_f1: 0.5294
 epoch: 39, train_loss: 0.5620, test_loss: 1.2162, test_f1: 0.6194
 epoch: 40, train_loss: 0.5684, test_loss: 1.3969, test_f1: 0.5023
 epoch: 41, train_loss: 0.5637, test_loss: 1.3133, test_f1: 0.5072
 epoch: 42, train_loss: 0.5398, test_loss: 1.0578, test_f1: 0.6434
 epoch: 43, train_loss: 0.5693, test_loss: 1.1458, test_f1: 0.5664
 epoch: 44, train_loss: 0.6001, test_loss: 1.7240, test_f1: 0.5365
 epoch: 45, train_loss: 0.5809, test_loss: 1.3200, test_f1: 0.5805
 epoch: 46, train_loss: 0.5881, test_loss: 2.3005, test_f1: 0.3865
 epoch: 47, train_loss: 0.6513, test_loss: 1.3530, test_f1: 0.5651
 epoch: 48, train_loss: 0.6188, test_loss: 1.3025, test_f1: 0.5364
 epoch: 49, train_loss: 0.5962, test_loss: 1.1077, test_f1: 0.5739
 epoch: 50, train_loss: 0.5663, test_loss: 1.2447, test_f1: 0.5657
 epoch: 51, train_loss: 0.5217, test_loss: 1.0994, test_f1: 0.6165
 epoch: 52, train_loss: 0.5159, test_loss: 1.2238, test_f1: 0.5926
 epoch: 53, train_loss: 0.4726, test_loss: 1.1764, test_f1: 0.6352
 epoch: 54, train_loss: 0.4569, test_loss: 1.0703, test_f1: 0.6064
 epoch: 55, train_loss: 0.4211, test_loss: 1.1232, test_f1: 0.6339
 epoch: 56, train_loss: 0.4617, test_loss: 1.2181, test_f1: 0.5958
 epoch: 57, train_loss: 0.4443, test_loss: 1.1590, test_f1: 0.6442
 epoch: 58, train_loss: 0.4479, test_loss: 1.1340, test_f1: 0.6444
 epoch: 59, train_loss: 0.4432, test_loss: 1.2331, test_f1: 0.6023
 epoch: 60, train_loss: 0.4304, test_loss: 1.3502, test_f1: 0.5612
 epoch: 61, train_loss: 0.4205, test_loss: 1.2905, test_f1: 0.6146
 epoch: 62, train_loss: 0.4933, test_loss: 1.2797, test_f1: 0.5747
 epoch: 63, train_loss: 0.4479, test_loss: 1.3292, test_f1: 0.5813
 epoch: 64, train_loss: 0.4606, test_loss: 1.1764, test_f1: 0.6321
 epoch: 65, train_loss: 0.4583, test_loss: 1.2559, test_f1: 0.6248
 epoch: 66, train_loss: 0.3961, test_loss: 1.2424, test_f1: 0.5996
 epoch: 67, train_loss: 0.4262, test_loss: 1.5364, test_f1: 0.5399
 epoch: 68, train_loss: 0.3917, test_loss: 1.2776, test_f1: 0.6432
 epoch: 69, train_loss: 0.3920, test_loss: 1.4693, test_f1: 0.6163
 epoch: 70, train_loss: 0.3635, test_loss: 1.4601, test_f1: 0.6126
 epoch: 71, train_loss: 0.4159, test_loss: 1.3636, test_f1: 0.5702
 epoch: 72, train_loss: 0.3957, test_loss: 1.3951, test_f1: 0.6186
 epoch: 73, train_loss: 0.3804, test_loss: 1.2614, test_f1: 0.6568
 epoch: 74, train_loss: 0.3307, test_loss: 1.4083, test_f1: 0.6083
 epoch: 75, train_loss: 0.3201, test_loss: 1.5296, test_f1: 0.6329
 epoch: 76, train_loss: 0.3103, test_loss: 1.5790, test_f1: 0.6209
 epoch: 77, train_loss: 0.3021, test_loss: 1.5960, test_f1: 0.5874
 epoch: 78, train_loss: 0.3380, test_loss: 1.5494, test_f1: 0.5272
 epoch: 79, train_loss: 0.3242, test_loss: 1.6724, test_f1: 0.6102
 epoch: 80, train_loss: 0.4200, test_loss: 1.4322, test_f1: 0.5849
 epoch: 81, train_loss: 0.4026, test_loss: 1.4744, test_f1: 0.6192
 epoch: 82, train_loss: 0.3719, test_loss: 1.5729, test_f1: 0.5485
 epoch: 83, train_loss: 0.3364, test_loss: 1.5255, test_f1: 0.6093
 epoch: 84, train_loss: 0.3477, test_loss: 1.4818, test_f1: 0.5963
 epoch: 85, train_loss: 0.3272, test_loss: 1.3285, test_f1: 0.6322
 epoch: 86, train_loss: 0.2827, test_loss: 1.6920, test_f1: 0.5693
 epoch: 87, train_loss: 0.2754, test_loss: 1.7199, test_f1: 0.6357
 epoch: 88, train_loss: 0.3135, test_loss: 1.6690, test_f1: 0.5507
 epoch: 89, train_loss: 0.3856, test_loss: 1.5903, test_f1: 0.5928
 epoch: 90, train_loss: 0.3385, test_loss: 1.5872, test_f1: 0.6317
 epoch: 91, train_loss: 0.2951, test_loss: 1.4516, test_f1: 0.6248
 epoch: 92, train_loss: 0.2818, test_loss: 1.5664, test_f1: 0.6105
 epoch: 93, train_loss: 0.3057, test_loss: 1.8757, test_f1: 0.5491
 epoch: 94, train_loss: 0.3090, test_loss: 1.7086, test_f1: 0.5848
 epoch: 95, train_loss: 0.3543, test_loss: 1.6744, test_f1: 0.5909
 epoch: 96, train_loss: 0.3324, test_loss: 1.5527, test_f1: 0.5881
 epoch: 97, train_loss: 0.2789, test_loss: 1.9793, test_f1: 0.5039
 epoch: 98, train_loss: 0.3104, test_loss: 1.6879, test_f1: 0.6092
 epoch: 99, train_loss: 0.2763, test_loss: 1.9651, test_f1: 0.5927
##################ITERATION #9 ****************************************
 epoch: 0, train_loss: 1.7551, test_loss: 1.3762, test_f1: 0.2583
 epoch: 1, train_loss: 1.1207, test_loss: 1.4564, test_f1: 0.2102
 epoch: 2, train_loss: 1.0228, test_loss: 1.3385, test_f1: 0.3370
 epoch: 3, train_loss: 0.9868, test_loss: 1.2210, test_f1: 0.3838
 epoch: 4, train_loss: 0.9440, test_loss: 1.1876, test_f1: 0.3537
 epoch: 5, train_loss: 0.9232, test_loss: 1.1124, test_f1: 0.4664
 epoch: 6, train_loss: 0.9061, test_loss: 1.0228, test_f1: 0.5357
 epoch: 7, train_loss: 0.8615, test_loss: 1.0052, test_f1: 0.5533
 epoch: 8, train_loss: 0.8608, test_loss: 1.0042, test_f1: 0.5940
 epoch: 9, train_loss: 0.8604, test_loss: 0.9929, test_f1: 0.5966
 epoch: 10, train_loss: 0.8437, test_loss: 1.0176, test_f1: 0.5038
 epoch: 11, train_loss: 0.8120, test_loss: 1.2049, test_f1: 0.4287
 epoch: 12, train_loss: 0.7904, test_loss: 1.5833, test_f1: 0.4215
 epoch: 13, train_loss: 0.7831, test_loss: 1.2385, test_f1: 0.5024
 epoch: 14, train_loss: 0.7415, test_loss: 1.1385, test_f1: 0.5710
 epoch: 15, train_loss: 0.7553, test_loss: 1.2405, test_f1: 0.4873
 epoch: 16, train_loss: 0.7877, test_loss: 1.7215, test_f1: 0.4067
 epoch: 17, train_loss: 0.7636, test_loss: 1.0767, test_f1: 0.5718
 epoch: 18, train_loss: 0.7374, test_loss: 1.0814, test_f1: 0.5599
 epoch: 19, train_loss: 0.7110, test_loss: 1.1752, test_f1: 0.4895
 epoch: 20, train_loss: 0.7102, test_loss: 1.1288, test_f1: 0.5707
 epoch: 21, train_loss: 0.7403, test_loss: 1.0719, test_f1: 0.5677
 epoch: 22, train_loss: 0.7035, test_loss: 1.5936, test_f1: 0.4316
 epoch: 23, train_loss: 0.7208, test_loss: 2.1617, test_f1: 0.3786
 epoch: 24, train_loss: 0.7046, test_loss: 1.3774, test_f1: 0.4833
 epoch: 25, train_loss: 0.6817, test_loss: 1.1118, test_f1: 0.5469
 epoch: 26, train_loss: 0.6802, test_loss: 1.4083, test_f1: 0.5354
 epoch: 27, train_loss: 0.6347, test_loss: 1.3816, test_f1: 0.5628
 epoch: 28, train_loss: 0.6316, test_loss: 1.1770, test_f1: 0.5992
 epoch: 29, train_loss: 0.6760, test_loss: 1.1993, test_f1: 0.5365
 epoch: 30, train_loss: 0.6608, test_loss: 1.2236, test_f1: 0.5582
 epoch: 31, train_loss: 0.6312, test_loss: 1.1693, test_f1: 0.5927
 epoch: 32, train_loss: 0.6303, test_loss: 1.2963, test_f1: 0.5452
 epoch: 33, train_loss: 0.6371, test_loss: 1.1681, test_f1: 0.6080
 epoch: 34, train_loss: 0.6016, test_loss: 1.1184, test_f1: 0.6204
 epoch: 35, train_loss: 0.6419, test_loss: 3.0725, test_f1: 0.3952
 epoch: 36, train_loss: 0.6233, test_loss: 1.4454, test_f1: 0.5869
 epoch: 37, train_loss: 0.6000, test_loss: 1.4155, test_f1: 0.5206
 epoch: 38, train_loss: 0.5568, test_loss: 1.7504, test_f1: 0.5079
 epoch: 39, train_loss: 0.5629, test_loss: 1.3793, test_f1: 0.5291
 epoch: 40, train_loss: 0.5731, test_loss: 1.2909, test_f1: 0.6087
 epoch: 41, train_loss: 0.5678, test_loss: 1.2108, test_f1: 0.6166
 epoch: 42, train_loss: 0.5890, test_loss: 1.5719, test_f1: 0.4686
 epoch: 43, train_loss: 0.6207, test_loss: 1.3534, test_f1: 0.5490
 epoch: 44, train_loss: 0.6222, test_loss: 1.4625, test_f1: 0.5713
 epoch: 45, train_loss: 0.6047, test_loss: 1.2995, test_f1: 0.5581
 epoch: 46, train_loss: 0.5774, test_loss: 1.1292, test_f1: 0.6213
 epoch: 47, train_loss: 0.6054, test_loss: 1.0977, test_f1: 0.6207
 epoch: 48, train_loss: 0.6032, test_loss: 1.2456, test_f1: 0.5608
 epoch: 49, train_loss: 0.5921, test_loss: 1.1517, test_f1: 0.5577
 epoch: 50, train_loss: 0.5855, test_loss: 1.1977, test_f1: 0.5667
 epoch: 51, train_loss: 0.5256, test_loss: 1.0844, test_f1: 0.6243
 epoch: 52, train_loss: 0.5134, test_loss: 1.1206, test_f1: 0.6228
 epoch: 53, train_loss: 0.4846, test_loss: 1.1922, test_f1: 0.6143
 epoch: 54, train_loss: 0.4795, test_loss: 1.3657, test_f1: 0.5798
 epoch: 55, train_loss: 0.4619, test_loss: 1.3874, test_f1: 0.5551
 epoch: 56, train_loss: 0.4684, test_loss: 1.1938, test_f1: 0.6853
 epoch: 57, train_loss: 0.4743, test_loss: 1.2283, test_f1: 0.6292
 epoch: 58, train_loss: 0.4458, test_loss: 1.3751, test_f1: 0.5884
 epoch: 59, train_loss: 0.4269, test_loss: 1.3197, test_f1: 0.6529
 epoch: 60, train_loss: 0.4238, test_loss: 1.2914, test_f1: 0.6312
 epoch: 61, train_loss: 0.4559, test_loss: 1.2533, test_f1: 0.5886
 epoch: 62, train_loss: 0.4502, test_loss: 1.5031, test_f1: 0.5617
 epoch: 63, train_loss: 0.4488, test_loss: 1.3279, test_f1: 0.6199
 epoch: 64, train_loss: 0.4221, test_loss: 1.2748, test_f1: 0.6333
 epoch: 65, train_loss: 0.4075, test_loss: 1.4027, test_f1: 0.6157
 epoch: 66, train_loss: 0.3906, test_loss: 1.4383, test_f1: 0.6433
 epoch: 67, train_loss: 0.3751, test_loss: 1.5227, test_f1: 0.6503
 epoch: 68, train_loss: 0.3605, test_loss: 1.4873, test_f1: 0.6780
 epoch: 69, train_loss: 0.3884, test_loss: 1.3522, test_f1: 0.6602
 epoch: 70, train_loss: 0.3549, test_loss: 1.4126, test_f1: 0.6573
 epoch: 71, train_loss: 0.4028, test_loss: 1.4823, test_f1: 0.6335
 epoch: 72, train_loss: 0.3835, test_loss: 1.3796, test_f1: 0.6776
 epoch: 73, train_loss: 0.3831, test_loss: 1.3892, test_f1: 0.6341
 epoch: 74, train_loss: 0.3500, test_loss: 1.5984, test_f1: 0.6158
 epoch: 75, train_loss: 0.3773, test_loss: 1.5008, test_f1: 0.6119
 epoch: 76, train_loss: 0.3814, test_loss: 1.6888, test_f1: 0.6120
 epoch: 77, train_loss: 0.3714, test_loss: 1.5890, test_f1: 0.6267
 epoch: 78, train_loss: 0.3776, test_loss: 1.5218, test_f1: 0.6100
 epoch: 79, train_loss: 0.3500, test_loss: 1.4237, test_f1: 0.6767
 epoch: 80, train_loss: 0.3477, test_loss: 1.5672, test_f1: 0.6267
 epoch: 81, train_loss: 0.3535, test_loss: 1.5749, test_f1: 0.6304
 epoch: 82, train_loss: 0.3250, test_loss: 1.6655, test_f1: 0.6251
 epoch: 83, train_loss: 0.3335, test_loss: 1.5459, test_f1: 0.6205
 epoch: 84, train_loss: 0.3035, test_loss: 1.4593, test_f1: 0.6633
 epoch: 85, train_loss: 0.3358, test_loss: 1.4368, test_f1: 0.6311
 epoch: 86, train_loss: 0.3329, test_loss: 1.4244, test_f1: 0.6397
 epoch: 87, train_loss: 0.3320, test_loss: 1.3536, test_f1: 0.6506
 epoch: 88, train_loss: 0.3296, test_loss: 1.3603, test_f1: 0.6452
 epoch: 89, train_loss: 0.3260, test_loss: 1.4381, test_f1: 0.6638
 epoch: 90, train_loss: 0.3317, test_loss: 1.7227, test_f1: 0.6144
 epoch: 91, train_loss: 0.3031, test_loss: 1.7745, test_f1: 0.6071
 epoch: 92, train_loss: 0.2998, test_loss: 1.6918, test_f1: 0.6175
 epoch: 93, train_loss: 0.2876, test_loss: 1.5529, test_f1: 0.6276
 epoch: 94, train_loss: 0.3147, test_loss: 1.4783, test_f1: 0.6428
 epoch: 95, train_loss: 0.3924, test_loss: 1.4800, test_f1: 0.6060
 epoch: 96, train_loss: 0.3136, test_loss: 1.6210, test_f1: 0.6304
 epoch: 97, train_loss: 0.2747, test_loss: 1.6739, test_f1: 0.6145
 epoch: 98, train_loss: 0.2794, test_loss: 1.7135, test_f1: 0.6189
 epoch: 99, train_loss: 0.3150, test_loss: 1.8073, test_f1: 0.6338

Training completed in 356.58 seconds
Best F1: 0.6853 at epoch 56
Mean F1 across iterations: 0.6618  0.0109
========================FINAL RESULTS================================
FEGIN weighted F1: 0.6853  0.0109
python main.py --data ltspice_demos --representation component_pin_net --model FEGIN --layers 5 --hiddens 128 --batch_size 256 --lr 0.01 --emb_size 512 --epochs 100 --save_appendix component_pin_net_L5_H128_BS256_LR0.01_E512 --no_val
-----



STDERR:
Processing...
Done!
  File "main.py", line 370, in <module>
    main()
  File "main.py", line 254, in main
    dataset = dataset_class(
  File "/home/philip/projects/ltspice_examples_code_repo/Circuit-Completion-Using-GNNs/component_classification_with_link_prediction_head/evaluation/FEGIN/kernel/circuit_datasets.py", line 15, in __init__
    self.data, self.slices = torch.load(self.processed_paths[0])
  File "/home/philip/.local/lib/python3.8/site-packages/torch/serialization.py", line 1040, in load
    warnings.warn(
  File "/usr/lib/python3.8/warnings.py", line 109, in _showwarnmsg
    sw(msg.message, msg.category, msg.filename, msg.lineno,
  File "main.py", line 47, in warn_with_traceback
    traceback.print_stack(file=log)
/home/philip/projects/ltspice_examples_code_repo/Circuit-Completion-Using-GNNs/component_classification_with_link_prediction_head/evaluation/FEGIN/kernel/circuit_datasets.py:15: FutureWarning: You are using `torch.load` with `weights_only=False` (the current default value), which uses the default pickle module implicitly. It is possible to construct malicious pickle data which will execute arbitrary code during unpickling (See https://github.com/pytorch/pytorch/blob/main/SECURITY.md#untrusted-models for more details). In a future release, the default value for `weights_only` will be flipped to `True`. This limits the functions that could be executed during unpickling. Arbitrary objects will no longer be allowed to be loaded via this mode unless they are explicitly allowlisted by the user via `torch.serialization.add_safe_globals`. We recommend you start setting `weights_only=True` for any use case where you don't have full control of the loaded file. Please open an issue on GitHub for any issues related to this experimental feature.
  self.data, self.slices = torch.load(self.processed_paths[0])
