STDOUT:
Results will be saved in /home/philip/projects/ltspice_examples_code_repo/Circuit-Completion-Using-GNNs/component_classification_with_link_prediction_head/evaluation/FEGIN/results/model_FEGIN_dataset_ltspice_demos
Command line input: python main.py --data ltspice_demos --representation component_component --model FEGIN --layers 5 --hiddens 16 --batch_size 128 --lr 0.001 --emb_size 128 --epochs 100 --save_appendix component_component_L5_H16_BS128_LR0.001_E128 --no_val
 is saved.
-----
ltspice_demos - FEGIN
Using 5 layers, 16 hidden units, h = 2
Loading component_component representation dataset
Loading component_component representation data...
Loaded 1948 examples (component_component)
saving path: data/processed/ltspice_demos_component_component_processed.pt
ENTERED
Training FEGIN on component_component representation
Train: 1565, Test: 383
##################ITERATION #0 ****************************************
 epoch: 0, train_loss: 1.4038, test_loss: 1.3953, test_f1: 0.0301
 epoch: 1, train_loss: 1.3766, test_loss: 1.3776, test_f1: 0.1945
 epoch: 2, train_loss: 1.3569, test_loss: 1.3589, test_f1: 0.2329
 epoch: 3, train_loss: 1.3360, test_loss: 1.3406, test_f1: 0.2349
 epoch: 4, train_loss: 1.3127, test_loss: 1.3201, test_f1: 0.2281
 epoch: 5, train_loss: 1.2868, test_loss: 1.3045, test_f1: 0.2281
 epoch: 6, train_loss: 1.2683, test_loss: 1.2926, test_f1: 0.2281
 epoch: 7, train_loss: 1.2519, test_loss: 1.2796, test_f1: 0.2281
 epoch: 8, train_loss: 1.2353, test_loss: 1.2723, test_f1: 0.2748
 epoch: 9, train_loss: 1.2244, test_loss: 1.2657, test_f1: 0.2951
 epoch: 10, train_loss: 1.2158, test_loss: 1.2646, test_f1: 0.3203
 epoch: 11, train_loss: 1.2017, test_loss: 1.2560, test_f1: 0.2972
 epoch: 12, train_loss: 1.2036, test_loss: 1.2623, test_f1: 0.3276
 epoch: 13, train_loss: 1.1951, test_loss: 1.2810, test_f1: 0.3369
 epoch: 14, train_loss: 1.1853, test_loss: 1.2673, test_f1: 0.3393
 epoch: 15, train_loss: 1.1768, test_loss: 1.2766, test_f1: 0.3410
 epoch: 16, train_loss: 1.1749, test_loss: 1.2702, test_f1: 0.3402
 epoch: 17, train_loss: 1.1631, test_loss: 1.2535, test_f1: 0.3559
 epoch: 18, train_loss: 1.1584, test_loss: 1.2451, test_f1: 0.3563
 epoch: 19, train_loss: 1.1560, test_loss: 1.2937, test_f1: 0.3550
 epoch: 20, train_loss: 1.1353, test_loss: 1.2520, test_f1: 0.3475
 epoch: 21, train_loss: 1.1379, test_loss: 1.2358, test_f1: 0.3782
 epoch: 22, train_loss: 1.1293, test_loss: 1.2911, test_f1: 0.3741
 epoch: 23, train_loss: 1.1233, test_loss: 1.3112, test_f1: 0.4192
 epoch: 24, train_loss: 1.1115, test_loss: 1.3083, test_f1: 0.4569
 epoch: 25, train_loss: 1.0980, test_loss: 1.3330, test_f1: 0.4278
 epoch: 26, train_loss: 1.1089, test_loss: 1.3884, test_f1: 0.4734
 epoch: 27, train_loss: 1.0839, test_loss: 1.3266, test_f1: 0.4606
 epoch: 28, train_loss: 1.0790, test_loss: 1.4370, test_f1: 0.4737
 epoch: 29, train_loss: 1.0752, test_loss: 1.5443, test_f1: 0.4812
 epoch: 30, train_loss: 1.0562, test_loss: 1.4531, test_f1: 0.4819
 epoch: 31, train_loss: 1.0663, test_loss: 1.4018, test_f1: 0.4605
 epoch: 32, train_loss: 1.0508, test_loss: 1.4641, test_f1: 0.4773
 epoch: 33, train_loss: 1.0451, test_loss: 1.5097, test_f1: 0.4595
 epoch: 34, train_loss: 1.0391, test_loss: 1.4609, test_f1: 0.5023
 epoch: 35, train_loss: 1.0571, test_loss: 1.5651, test_f1: 0.4687
 epoch: 36, train_loss: 1.0340, test_loss: 1.6350, test_f1: 0.4782
 epoch: 37, train_loss: 1.0291, test_loss: 1.5993, test_f1: 0.5016
 epoch: 38, train_loss: 1.0356, test_loss: 1.5880, test_f1: 0.4899
 epoch: 39, train_loss: 1.0117, test_loss: 1.5997, test_f1: 0.4838
 epoch: 40, train_loss: 1.0284, test_loss: 1.5376, test_f1: 0.4841
 epoch: 41, train_loss: 1.0201, test_loss: 1.4910, test_f1: 0.5031
 epoch: 42, train_loss: 1.0040, test_loss: 1.4452, test_f1: 0.5026
 epoch: 43, train_loss: 1.0056, test_loss: 1.4798, test_f1: 0.4983
 epoch: 44, train_loss: 0.9705, test_loss: 1.6759, test_f1: 0.5114
 epoch: 45, train_loss: 0.9747, test_loss: 1.6962, test_f1: 0.4657
 epoch: 46, train_loss: 0.9770, test_loss: 1.5212, test_f1: 0.4822
 epoch: 47, train_loss: 0.9685, test_loss: 1.6131, test_f1: 0.4830
 epoch: 48, train_loss: 0.9690, test_loss: 1.6027, test_f1: 0.5020
 epoch: 49, train_loss: 0.9575, test_loss: 1.5466, test_f1: 0.5054
 epoch: 50, train_loss: 0.9455, test_loss: 1.4023, test_f1: 0.5228
 epoch: 51, train_loss: 0.9675, test_loss: 1.5330, test_f1: 0.5078
 epoch: 52, train_loss: 0.9382, test_loss: 1.5179, test_f1: 0.5215
 epoch: 53, train_loss: 0.9456, test_loss: 1.5910, test_f1: 0.5060
 epoch: 54, train_loss: 0.9246, test_loss: 1.5583, test_f1: 0.5179
 epoch: 55, train_loss: 0.9246, test_loss: 1.5524, test_f1: 0.5410
 epoch: 56, train_loss: 0.9168, test_loss: 1.5214, test_f1: 0.5310
 epoch: 57, train_loss: 0.9375, test_loss: 1.5864, test_f1: 0.5147
 epoch: 58, train_loss: 0.9384, test_loss: 1.5455, test_f1: 0.5372
 epoch: 59, train_loss: 0.9132, test_loss: 1.5092, test_f1: 0.5522
 epoch: 60, train_loss: 0.9163, test_loss: 1.5419, test_f1: 0.5458
 epoch: 61, train_loss: 0.9120, test_loss: 1.6081, test_f1: 0.5402
 epoch: 62, train_loss: 0.9013, test_loss: 1.6114, test_f1: 0.5298
 epoch: 63, train_loss: 0.9123, test_loss: 1.5749, test_f1: 0.5291
 epoch: 64, train_loss: 0.9060, test_loss: 1.6074, test_f1: 0.5413
 epoch: 65, train_loss: 0.9242, test_loss: 1.6423, test_f1: 0.5361
 epoch: 66, train_loss: 0.9189, test_loss: 1.6433, test_f1: 0.5061
 epoch: 67, train_loss: 0.9042, test_loss: 1.7233, test_f1: 0.5238
 epoch: 68, train_loss: 0.9056, test_loss: 1.5891, test_f1: 0.5075
 epoch: 69, train_loss: 0.8976, test_loss: 1.6010, test_f1: 0.5305
 epoch: 70, train_loss: 0.9092, test_loss: 1.6355, test_f1: 0.5275
 epoch: 71, train_loss: 0.8993, test_loss: 1.5247, test_f1: 0.5213
 epoch: 72, train_loss: 0.8908, test_loss: 1.4963, test_f1: 0.5417
 epoch: 73, train_loss: 0.8848, test_loss: 1.5067, test_f1: 0.5231
 epoch: 74, train_loss: 0.8812, test_loss: 1.4871, test_f1: 0.5573
 epoch: 75, train_loss: 0.8838, test_loss: 1.5061, test_f1: 0.5392
 epoch: 76, train_loss: 0.8902, test_loss: 1.5405, test_f1: 0.5056
 epoch: 77, train_loss: 0.9000, test_loss: 1.6324, test_f1: 0.5113
 epoch: 78, train_loss: 0.8754, test_loss: 1.6115, test_f1: 0.5028
 epoch: 79, train_loss: 0.8972, test_loss: 1.5647, test_f1: 0.5149
 epoch: 80, train_loss: 0.8801, test_loss: 1.5970, test_f1: 0.5161
 epoch: 81, train_loss: 0.8758, test_loss: 1.6822, test_f1: 0.5218
 epoch: 82, train_loss: 0.8863, test_loss: 1.5902, test_f1: 0.5157
 epoch: 83, train_loss: 0.8715, test_loss: 1.6110, test_f1: 0.5438
 epoch: 84, train_loss: 0.8832, test_loss: 1.5961, test_f1: 0.5301
 epoch: 85, train_loss: 0.8711, test_loss: 1.6091, test_f1: 0.5554
 epoch: 86, train_loss: 0.8551, test_loss: 1.5680, test_f1: 0.5436
 epoch: 87, train_loss: 0.8542, test_loss: 1.5944, test_f1: 0.5314
 epoch: 88, train_loss: 0.8649, test_loss: 1.6520, test_f1: 0.5294
 epoch: 89, train_loss: 0.8668, test_loss: 1.6258, test_f1: 0.5158
 epoch: 90, train_loss: 0.8587, test_loss: 1.5757, test_f1: 0.5248
 epoch: 91, train_loss: 0.8629, test_loss: 1.6280, test_f1: 0.5165
 epoch: 92, train_loss: 0.8588, test_loss: 1.6210, test_f1: 0.5304
 epoch: 93, train_loss: 0.8568, test_loss: 1.6229, test_f1: 0.5390
 epoch: 94, train_loss: 0.8544, test_loss: 1.7030, test_f1: 0.5277
 epoch: 95, train_loss: 0.8460, test_loss: 1.6366, test_f1: 0.5353
 epoch: 96, train_loss: 0.8273, test_loss: 1.6711, test_f1: 0.5285
 epoch: 97, train_loss: 0.8483, test_loss: 1.6891, test_f1: 0.5233
 epoch: 98, train_loss: 0.8450, test_loss: 1.7578, test_f1: 0.5345
 epoch: 99, train_loss: 0.8473, test_loss: 1.7057, test_f1: 0.5319
##################ITERATION #1 ****************************************
 epoch: 0, train_loss: 1.2825, test_loss: 1.3087, test_f1: 0.2507
 epoch: 1, train_loss: 1.2385, test_loss: 1.3089, test_f1: 0.3520
 epoch: 2, train_loss: 1.2183, test_loss: 1.3063, test_f1: 0.3245
 epoch: 3, train_loss: 1.2061, test_loss: 1.3116, test_f1: 0.3412
 epoch: 4, train_loss: 1.1947, test_loss: 1.3119, test_f1: 0.3349
 epoch: 5, train_loss: 1.1797, test_loss: 1.3104, test_f1: 0.3798
 epoch: 6, train_loss: 1.1744, test_loss: 1.2929, test_f1: 0.4224
 epoch: 7, train_loss: 1.1644, test_loss: 1.2912, test_f1: 0.4336
 epoch: 8, train_loss: 1.1543, test_loss: 1.2987, test_f1: 0.4273
 epoch: 9, train_loss: 1.1323, test_loss: 1.3017, test_f1: 0.4169
 epoch: 10, train_loss: 1.1353, test_loss: 1.2751, test_f1: 0.4271
 epoch: 11, train_loss: 1.1307, test_loss: 1.2493, test_f1: 0.4473
 epoch: 12, train_loss: 1.1239, test_loss: 1.2646, test_f1: 0.4388
 epoch: 13, train_loss: 1.1049, test_loss: 1.2362, test_f1: 0.4435
 epoch: 14, train_loss: 1.0877, test_loss: 1.2453, test_f1: 0.4476
 epoch: 15, train_loss: 1.0873, test_loss: 1.2621, test_f1: 0.4407
 epoch: 16, train_loss: 1.0743, test_loss: 1.2655, test_f1: 0.4454
 epoch: 17, train_loss: 1.0672, test_loss: 1.2346, test_f1: 0.4647
 epoch: 18, train_loss: 1.0691, test_loss: 1.2190, test_f1: 0.4627
 epoch: 19, train_loss: 1.0562, test_loss: 1.2393, test_f1: 0.4732
 epoch: 20, train_loss: 1.0458, test_loss: 1.2001, test_f1: 0.4640
 epoch: 21, train_loss: 1.0391, test_loss: 1.2286, test_f1: 0.4688
 epoch: 22, train_loss: 1.0158, test_loss: 1.2140, test_f1: 0.4855
 epoch: 23, train_loss: 1.0326, test_loss: 1.2360, test_f1: 0.4580
 epoch: 24, train_loss: 1.0148, test_loss: 1.2209, test_f1: 0.4717
 epoch: 25, train_loss: 1.0125, test_loss: 1.1817, test_f1: 0.4791
 epoch: 26, train_loss: 1.0089, test_loss: 1.2236, test_f1: 0.4435
 epoch: 27, train_loss: 1.0098, test_loss: 1.2246, test_f1: 0.4604
 epoch: 28, train_loss: 0.9947, test_loss: 1.1850, test_f1: 0.4684
 epoch: 29, train_loss: 0.9904, test_loss: 1.1973, test_f1: 0.4618
 epoch: 30, train_loss: 0.9863, test_loss: 1.2035, test_f1: 0.4746
 epoch: 31, train_loss: 0.9763, test_loss: 1.2244, test_f1: 0.4732
 epoch: 32, train_loss: 0.9508, test_loss: 1.1802, test_f1: 0.4833
 epoch: 33, train_loss: 0.9663, test_loss: 1.2337, test_f1: 0.4646
 epoch: 34, train_loss: 0.9698, test_loss: 1.1761, test_f1: 0.4673
 epoch: 35, train_loss: 0.9614, test_loss: 1.2442, test_f1: 0.4571
 epoch: 36, train_loss: 0.9612, test_loss: 1.2376, test_f1: 0.4699
 epoch: 37, train_loss: 0.9436, test_loss: 1.2320, test_f1: 0.4647
 epoch: 38, train_loss: 0.9521, test_loss: 1.2185, test_f1: 0.4642
 epoch: 39, train_loss: 0.9487, test_loss: 1.2298, test_f1: 0.4752
 epoch: 40, train_loss: 0.9421, test_loss: 1.2688, test_f1: 0.4666
 epoch: 41, train_loss: 0.9309, test_loss: 1.2533, test_f1: 0.4924
 epoch: 42, train_loss: 0.9344, test_loss: 1.2707, test_f1: 0.4754
 epoch: 43, train_loss: 0.9306, test_loss: 1.2714, test_f1: 0.4749
 epoch: 44, train_loss: 0.9337, test_loss: 1.2823, test_f1: 0.4738
 epoch: 45, train_loss: 0.9027, test_loss: 1.1667, test_f1: 0.5073
 epoch: 46, train_loss: 0.9135, test_loss: 1.2929, test_f1: 0.4516
 epoch: 47, train_loss: 0.9051, test_loss: 1.2605, test_f1: 0.4874
 epoch: 48, train_loss: 0.9106, test_loss: 1.3115, test_f1: 0.4676
 epoch: 49, train_loss: 0.8933, test_loss: 1.2980, test_f1: 0.4701
 epoch: 50, train_loss: 0.8906, test_loss: 1.3500, test_f1: 0.4809
 epoch: 51, train_loss: 0.8846, test_loss: 1.3387, test_f1: 0.4704
 epoch: 52, train_loss: 0.8840, test_loss: 1.2914, test_f1: 0.4916
 epoch: 53, train_loss: 0.8679, test_loss: 1.3262, test_f1: 0.4939
 epoch: 54, train_loss: 0.8754, test_loss: 1.3624, test_f1: 0.4680
 epoch: 55, train_loss: 0.8759, test_loss: 1.3569, test_f1: 0.4914
 epoch: 56, train_loss: 0.8839, test_loss: 1.3330, test_f1: 0.5020
 epoch: 57, train_loss: 0.8756, test_loss: 1.4035, test_f1: 0.4626
 epoch: 58, train_loss: 0.8563, test_loss: 1.3653, test_f1: 0.4993
 epoch: 59, train_loss: 0.8403, test_loss: 1.3357, test_f1: 0.5049
 epoch: 60, train_loss: 0.8613, test_loss: 1.3841, test_f1: 0.4786
 epoch: 61, train_loss: 0.8722, test_loss: 1.3537, test_f1: 0.4867
 epoch: 62, train_loss: 0.8514, test_loss: 1.3166, test_f1: 0.4858
 epoch: 63, train_loss: 0.8459, test_loss: 1.3511, test_f1: 0.4730
 epoch: 64, train_loss: 0.8506, test_loss: 1.3605, test_f1: 0.4857
 epoch: 65, train_loss: 0.8521, test_loss: 1.3089, test_f1: 0.5008
 epoch: 66, train_loss: 0.8368, test_loss: 1.3244, test_f1: 0.5032
 epoch: 67, train_loss: 0.8567, test_loss: 1.3317, test_f1: 0.5194
 epoch: 68, train_loss: 0.8610, test_loss: 1.3622, test_f1: 0.4891
 epoch: 69, train_loss: 0.8660, test_loss: 1.4388, test_f1: 0.4581
 epoch: 70, train_loss: 0.8502, test_loss: 1.4232, test_f1: 0.4843
 epoch: 71, train_loss: 0.8540, test_loss: 1.4054, test_f1: 0.5028
 epoch: 72, train_loss: 0.8418, test_loss: 1.4179, test_f1: 0.4788
 epoch: 73, train_loss: 0.8344, test_loss: 1.3682, test_f1: 0.5060
 epoch: 74, train_loss: 0.8368, test_loss: 1.4177, test_f1: 0.5019
 epoch: 75, train_loss: 0.8299, test_loss: 1.4079, test_f1: 0.5039
 epoch: 76, train_loss: 0.8285, test_loss: 1.4281, test_f1: 0.4783
 epoch: 77, train_loss: 0.8327, test_loss: 1.3882, test_f1: 0.5279
 epoch: 78, train_loss: 0.8272, test_loss: 1.3639, test_f1: 0.5091
 epoch: 79, train_loss: 0.8260, test_loss: 1.3749, test_f1: 0.5145
 epoch: 80, train_loss: 0.8341, test_loss: 1.4120, test_f1: 0.5173
 epoch: 81, train_loss: 0.8251, test_loss: 1.4399, test_f1: 0.5142
 epoch: 82, train_loss: 0.8292, test_loss: 1.4140, test_f1: 0.5195
 epoch: 83, train_loss: 0.8266, test_loss: 1.4055, test_f1: 0.5197
 epoch: 84, train_loss: 0.8195, test_loss: 1.4075, test_f1: 0.5121
 epoch: 85, train_loss: 0.8260, test_loss: 1.4059, test_f1: 0.5235
 epoch: 86, train_loss: 0.8247, test_loss: 1.3727, test_f1: 0.5155
 epoch: 87, train_loss: 0.8102, test_loss: 1.3997, test_f1: 0.5074
 epoch: 88, train_loss: 0.8184, test_loss: 1.3881, test_f1: 0.5223
 epoch: 89, train_loss: 0.8113, test_loss: 1.3656, test_f1: 0.5228
 epoch: 90, train_loss: 0.7939, test_loss: 1.3883, test_f1: 0.5228
 epoch: 91, train_loss: 0.8024, test_loss: 1.3875, test_f1: 0.5355
 epoch: 92, train_loss: 0.8058, test_loss: 1.3918, test_f1: 0.5277
 epoch: 93, train_loss: 0.8065, test_loss: 1.4253, test_f1: 0.5255
 epoch: 94, train_loss: 0.7958, test_loss: 1.4158, test_f1: 0.5352
 epoch: 95, train_loss: 0.7937, test_loss: 1.3768, test_f1: 0.5172
 epoch: 96, train_loss: 0.8010, test_loss: 1.4730, test_f1: 0.5049
 epoch: 97, train_loss: 0.7989, test_loss: 1.4684, test_f1: 0.5049
 epoch: 98, train_loss: 0.7870, test_loss: 1.4486, test_f1: 0.5047
 epoch: 99, train_loss: 0.7861, test_loss: 1.4196, test_f1: 0.5180
##################ITERATION #2 ****************************************
 epoch: 0, train_loss: 1.3647, test_loss: 1.3548, test_f1: 0.1836
 epoch: 1, train_loss: 1.2608, test_loss: 1.3212, test_f1: 0.1963
 epoch: 2, train_loss: 1.2365, test_loss: 1.3012, test_f1: 0.2868
 epoch: 3, train_loss: 1.2189, test_loss: 1.2961, test_f1: 0.3689
 epoch: 4, train_loss: 1.2078, test_loss: 1.2904, test_f1: 0.3599
 epoch: 5, train_loss: 1.2048, test_loss: 1.2704, test_f1: 0.3762
 epoch: 6, train_loss: 1.1847, test_loss: 1.2825, test_f1: 0.3744
 epoch: 7, train_loss: 1.1762, test_loss: 1.2566, test_f1: 0.3793
 epoch: 8, train_loss: 1.1760, test_loss: 1.2547, test_f1: 0.3997
 epoch: 9, train_loss: 1.1556, test_loss: 1.2412, test_f1: 0.3869
 epoch: 10, train_loss: 1.1510, test_loss: 1.2319, test_f1: 0.4429
 epoch: 11, train_loss: 1.1370, test_loss: 1.2052, test_f1: 0.4283
 epoch: 12, train_loss: 1.1222, test_loss: 1.1894, test_f1: 0.4614
 epoch: 13, train_loss: 1.1159, test_loss: 1.1842, test_f1: 0.4570
 epoch: 14, train_loss: 1.1010, test_loss: 1.1744, test_f1: 0.4615
 epoch: 15, train_loss: 1.0980, test_loss: 1.1571, test_f1: 0.4929
 epoch: 16, train_loss: 1.0852, test_loss: 1.1688, test_f1: 0.4803
 epoch: 17, train_loss: 1.0648, test_loss: 1.1467, test_f1: 0.4971
 epoch: 18, train_loss: 1.0740, test_loss: 1.1457, test_f1: 0.4789
 epoch: 19, train_loss: 1.0582, test_loss: 1.1719, test_f1: 0.4903
 epoch: 20, train_loss: 1.0563, test_loss: 1.1382, test_f1: 0.5201
 epoch: 21, train_loss: 1.0407, test_loss: 1.1371, test_f1: 0.5065
 epoch: 22, train_loss: 1.0435, test_loss: 1.1240, test_f1: 0.5048
 epoch: 23, train_loss: 1.0251, test_loss: 1.1295, test_f1: 0.5448
 epoch: 24, train_loss: 1.0223, test_loss: 1.0974, test_f1: 0.5127
 epoch: 25, train_loss: 1.0013, test_loss: 1.1064, test_f1: 0.5143
 epoch: 26, train_loss: 1.0098, test_loss: 1.0773, test_f1: 0.5413
 epoch: 27, train_loss: 0.9915, test_loss: 1.0946, test_f1: 0.5413
 epoch: 28, train_loss: 0.9728, test_loss: 1.0875, test_f1: 0.5560
 epoch: 29, train_loss: 0.9823, test_loss: 1.0932, test_f1: 0.5168
 epoch: 30, train_loss: 0.9747, test_loss: 1.0947, test_f1: 0.5074
 epoch: 31, train_loss: 0.9654, test_loss: 1.0876, test_f1: 0.5386
 epoch: 32, train_loss: 0.9581, test_loss: 1.0846, test_f1: 0.5693
 epoch: 33, train_loss: 0.9568, test_loss: 1.0898, test_f1: 0.5601
 epoch: 34, train_loss: 0.9352, test_loss: 1.0840, test_f1: 0.5458
 epoch: 35, train_loss: 0.9470, test_loss: 1.0736, test_f1: 0.5479
 epoch: 36, train_loss: 0.9410, test_loss: 1.0717, test_f1: 0.5588
 epoch: 37, train_loss: 0.9241, test_loss: 1.0945, test_f1: 0.5350
 epoch: 38, train_loss: 0.9212, test_loss: 1.0568, test_f1: 0.5362
 epoch: 39, train_loss: 0.9121, test_loss: 1.0704, test_f1: 0.5619
 epoch: 40, train_loss: 0.9010, test_loss: 1.0839, test_f1: 0.5346
 epoch: 41, train_loss: 0.8964, test_loss: 1.0648, test_f1: 0.5579
 epoch: 42, train_loss: 0.9113, test_loss: 1.0864, test_f1: 0.5066
 epoch: 43, train_loss: 0.9049, test_loss: 1.0887, test_f1: 0.5400
 epoch: 44, train_loss: 0.8944, test_loss: 1.0980, test_f1: 0.5284
 epoch: 45, train_loss: 0.9014, test_loss: 1.0573, test_f1: 0.5367
 epoch: 46, train_loss: 0.8909, test_loss: 1.1137, test_f1: 0.5355
 epoch: 47, train_loss: 0.8793, test_loss: 1.0442, test_f1: 0.5747
 epoch: 48, train_loss: 0.8727, test_loss: 1.0928, test_f1: 0.5266
 epoch: 49, train_loss: 0.8917, test_loss: 1.0588, test_f1: 0.5496
 epoch: 50, train_loss: 0.8870, test_loss: 1.0752, test_f1: 0.5362
 epoch: 51, train_loss: 0.8769, test_loss: 1.1040, test_f1: 0.5243
 epoch: 52, train_loss: 0.8731, test_loss: 1.0943, test_f1: 0.5442
 epoch: 53, train_loss: 0.8532, test_loss: 1.0700, test_f1: 0.5463
 epoch: 54, train_loss: 0.8888, test_loss: 1.0494, test_f1: 0.5299
 epoch: 55, train_loss: 0.8762, test_loss: 1.0525, test_f1: 0.5325
 epoch: 56, train_loss: 0.8670, test_loss: 1.0746, test_f1: 0.5289
 epoch: 57, train_loss: 0.8524, test_loss: 1.0737, test_f1: 0.5255
 epoch: 58, train_loss: 0.8680, test_loss: 1.0528, test_f1: 0.5472
 epoch: 59, train_loss: 0.8425, test_loss: 1.0736, test_f1: 0.5546
 epoch: 60, train_loss: 0.8316, test_loss: 1.0692, test_f1: 0.5474
 epoch: 61, train_loss: 0.8439, test_loss: 1.0737, test_f1: 0.5624
 epoch: 62, train_loss: 0.8430, test_loss: 1.0610, test_f1: 0.5510
 epoch: 63, train_loss: 0.8471, test_loss: 1.1093, test_f1: 0.5299
 epoch: 64, train_loss: 0.8317, test_loss: 1.0551, test_f1: 0.5254
 epoch: 65, train_loss: 0.8287, test_loss: 1.1068, test_f1: 0.5193
 epoch: 66, train_loss: 0.8093, test_loss: 1.0896, test_f1: 0.5178
 epoch: 67, train_loss: 0.8176, test_loss: 1.1341, test_f1: 0.5402
 epoch: 68, train_loss: 0.8444, test_loss: 1.0771, test_f1: 0.5329
 epoch: 69, train_loss: 0.8301, test_loss: 1.0885, test_f1: 0.5206
 epoch: 70, train_loss: 0.8280, test_loss: 1.1547, test_f1: 0.5268
 epoch: 71, train_loss: 0.8235, test_loss: 1.1640, test_f1: 0.5304
 epoch: 72, train_loss: 0.8275, test_loss: 1.1059, test_f1: 0.5553
 epoch: 73, train_loss: 0.8243, test_loss: 1.1161, test_f1: 0.5438
 epoch: 74, train_loss: 0.8042, test_loss: 1.1235, test_f1: 0.5329
 epoch: 75, train_loss: 0.8124, test_loss: 1.1681, test_f1: 0.5368
 epoch: 76, train_loss: 0.8121, test_loss: 1.1095, test_f1: 0.5447
 epoch: 77, train_loss: 0.8171, test_loss: 1.1095, test_f1: 0.5273
 epoch: 78, train_loss: 0.8027, test_loss: 1.1273, test_f1: 0.5417
 epoch: 79, train_loss: 0.7986, test_loss: 1.1433, test_f1: 0.5509
 epoch: 80, train_loss: 0.8173, test_loss: 1.1184, test_f1: 0.5478
 epoch: 81, train_loss: 0.8093, test_loss: 1.1013, test_f1: 0.5561
 epoch: 82, train_loss: 0.8087, test_loss: 1.1155, test_f1: 0.5365
 epoch: 83, train_loss: 0.7957, test_loss: 1.1291, test_f1: 0.5473
 epoch: 84, train_loss: 0.8114, test_loss: 1.1798, test_f1: 0.5313
 epoch: 85, train_loss: 0.8179, test_loss: 1.1576, test_f1: 0.5342
 epoch: 86, train_loss: 0.7948, test_loss: 1.1171, test_f1: 0.5422
 epoch: 87, train_loss: 0.7896, test_loss: 1.1031, test_f1: 0.5452
 epoch: 88, train_loss: 0.7961, test_loss: 1.1335, test_f1: 0.5320
 epoch: 89, train_loss: 0.7993, test_loss: 1.1342, test_f1: 0.5583
 epoch: 90, train_loss: 0.8035, test_loss: 1.1073, test_f1: 0.5658
 epoch: 91, train_loss: 0.8327, test_loss: 1.1715, test_f1: 0.5514
 epoch: 92, train_loss: 0.7980, test_loss: 1.1324, test_f1: 0.5493
 epoch: 93, train_loss: 0.8054, test_loss: 1.1188, test_f1: 0.5407
 epoch: 94, train_loss: 0.8030, test_loss: 1.1207, test_f1: 0.5442
 epoch: 95, train_loss: 0.8143, test_loss: 1.1581, test_f1: 0.5342
 epoch: 96, train_loss: 0.7957, test_loss: 1.1390, test_f1: 0.5352
 epoch: 97, train_loss: 0.7877, test_loss: 1.0993, test_f1: 0.5415
 epoch: 98, train_loss: 0.7898, test_loss: 1.1358, test_f1: 0.5390
 epoch: 99, train_loss: 0.7959, test_loss: 1.1192, test_f1: 0.5535
##################ITERATION #3 ****************************************
 epoch: 0, train_loss: 1.2750, test_loss: 1.3255, test_f1: 0.2773
 epoch: 1, train_loss: 1.2255, test_loss: 1.3119, test_f1: 0.3248
 epoch: 2, train_loss: 1.2125, test_loss: 1.2944, test_f1: 0.3464
 epoch: 3, train_loss: 1.1943, test_loss: 1.2826, test_f1: 0.3600
 epoch: 4, train_loss: 1.1851, test_loss: 1.2523, test_f1: 0.3719
 epoch: 5, train_loss: 1.1671, test_loss: 1.2293, test_f1: 0.4108
 epoch: 6, train_loss: 1.1530, test_loss: 1.2233, test_f1: 0.4169
 epoch: 7, train_loss: 1.1518, test_loss: 1.2082, test_f1: 0.4187
 epoch: 8, train_loss: 1.1377, test_loss: 1.1930, test_f1: 0.4040
 epoch: 9, train_loss: 1.1288, test_loss: 1.1851, test_f1: 0.4355
 epoch: 10, train_loss: 1.1220, test_loss: 1.1912, test_f1: 0.4412
 epoch: 11, train_loss: 1.1083, test_loss: 1.1917, test_f1: 0.4483
 epoch: 12, train_loss: 1.1072, test_loss: 1.2046, test_f1: 0.4330
 epoch: 13, train_loss: 1.0843, test_loss: 1.2156, test_f1: 0.4382
 epoch: 14, train_loss: 1.1026, test_loss: 1.2202, test_f1: 0.4491
 epoch: 15, train_loss: 1.0837, test_loss: 1.2032, test_f1: 0.4511
 epoch: 16, train_loss: 1.0743, test_loss: 1.1939, test_f1: 0.4653
 epoch: 17, train_loss: 1.0707, test_loss: 1.1982, test_f1: 0.4404
 epoch: 18, train_loss: 1.0619, test_loss: 1.2112, test_f1: 0.4604
 epoch: 19, train_loss: 1.0546, test_loss: 1.1895, test_f1: 0.4423
 epoch: 20, train_loss: 1.0519, test_loss: 1.1897, test_f1: 0.4438
 epoch: 21, train_loss: 1.0476, test_loss: 1.1744, test_f1: 0.4516
 epoch: 22, train_loss: 1.0415, test_loss: 1.1555, test_f1: 0.4722
 epoch: 23, train_loss: 1.0324, test_loss: 1.1667, test_f1: 0.4727
 epoch: 24, train_loss: 1.0282, test_loss: 1.1638, test_f1: 0.4613
 epoch: 25, train_loss: 1.0240, test_loss: 1.1576, test_f1: 0.4647
 epoch: 26, train_loss: 1.0227, test_loss: 1.1631, test_f1: 0.4402
 epoch: 27, train_loss: 1.0143, test_loss: 1.1664, test_f1: 0.4160
 epoch: 28, train_loss: 1.0217, test_loss: 1.1689, test_f1: 0.3984
 epoch: 29, train_loss: 0.9946, test_loss: 1.1670, test_f1: 0.3862
 epoch: 30, train_loss: 1.0036, test_loss: 1.1972, test_f1: 0.3918
 epoch: 31, train_loss: 0.9947, test_loss: 1.1660, test_f1: 0.4193
 epoch: 32, train_loss: 1.0000, test_loss: 1.1717, test_f1: 0.4674
 epoch: 33, train_loss: 0.9829, test_loss: 1.1715, test_f1: 0.4235
 epoch: 34, train_loss: 0.9811, test_loss: 1.1613, test_f1: 0.4056
 epoch: 35, train_loss: 0.9856, test_loss: 1.1743, test_f1: 0.4256
 epoch: 36, train_loss: 0.9875, test_loss: 1.1660, test_f1: 0.4113
 epoch: 37, train_loss: 0.9758, test_loss: 1.1408, test_f1: 0.4323
 epoch: 38, train_loss: 0.9665, test_loss: 1.1341, test_f1: 0.4924
 epoch: 39, train_loss: 0.9566, test_loss: 1.1318, test_f1: 0.4839
 epoch: 40, train_loss: 0.9508, test_loss: 1.1524, test_f1: 0.4652
 epoch: 41, train_loss: 0.9489, test_loss: 1.1510, test_f1: 0.4820
 epoch: 42, train_loss: 0.9451, test_loss: 1.1643, test_f1: 0.4737
 epoch: 43, train_loss: 0.9405, test_loss: 1.1820, test_f1: 0.4094
 epoch: 44, train_loss: 0.9280, test_loss: 1.1492, test_f1: 0.4623
 epoch: 45, train_loss: 0.9278, test_loss: 1.1944, test_f1: 0.4311
 epoch: 46, train_loss: 0.9206, test_loss: 1.2296, test_f1: 0.4341
 epoch: 47, train_loss: 0.9226, test_loss: 1.2126, test_f1: 0.4371
 epoch: 48, train_loss: 0.9153, test_loss: 1.3387, test_f1: 0.4573
 epoch: 49, train_loss: 0.9151, test_loss: 1.3048, test_f1: 0.4463
 epoch: 50, train_loss: 0.9063, test_loss: 1.2466, test_f1: 0.4926
 epoch: 51, train_loss: 0.9040, test_loss: 1.2159, test_f1: 0.4801
 epoch: 52, train_loss: 0.8952, test_loss: 1.1879, test_f1: 0.4303
 epoch: 53, train_loss: 0.8948, test_loss: 1.2695, test_f1: 0.4430
 epoch: 54, train_loss: 0.9044, test_loss: 1.3269, test_f1: 0.4434
 epoch: 55, train_loss: 0.8984, test_loss: 1.3147, test_f1: 0.4231
 epoch: 56, train_loss: 0.8884, test_loss: 1.2643, test_f1: 0.4291
 epoch: 57, train_loss: 0.8821, test_loss: 1.2575, test_f1: 0.4384
 epoch: 58, train_loss: 0.8846, test_loss: 1.2530, test_f1: 0.4395
 epoch: 59, train_loss: 0.8892, test_loss: 1.2801, test_f1: 0.4404
 epoch: 60, train_loss: 0.8629, test_loss: 1.2627, test_f1: 0.4730
 epoch: 61, train_loss: 0.8743, test_loss: 1.2571, test_f1: 0.4461
 epoch: 62, train_loss: 0.8841, test_loss: 1.2934, test_f1: 0.4513
 epoch: 63, train_loss: 0.8667, test_loss: 1.2887, test_f1: 0.4424
 epoch: 64, train_loss: 0.8747, test_loss: 1.2697, test_f1: 0.4546
 epoch: 65, train_loss: 0.8695, test_loss: 1.2381, test_f1: 0.4453
 epoch: 66, train_loss: 0.8684, test_loss: 1.2905, test_f1: 0.4425
 epoch: 67, train_loss: 0.8684, test_loss: 1.3466, test_f1: 0.4496
 epoch: 68, train_loss: 0.8640, test_loss: 1.2540, test_f1: 0.4547
 epoch: 69, train_loss: 0.8646, test_loss: 1.3119, test_f1: 0.4615
 epoch: 70, train_loss: 0.8604, test_loss: 1.2940, test_f1: 0.4835
 epoch: 71, train_loss: 0.8473, test_loss: 1.3238, test_f1: 0.4713
 epoch: 72, train_loss: 0.8481, test_loss: 1.4308, test_f1: 0.4381
 epoch: 73, train_loss: 0.8549, test_loss: 1.3235, test_f1: 0.4691
 epoch: 74, train_loss: 0.8549, test_loss: 1.2381, test_f1: 0.4810
 epoch: 75, train_loss: 0.8599, test_loss: 1.2744, test_f1: 0.4595
 epoch: 76, train_loss: 0.8524, test_loss: 1.2874, test_f1: 0.4936
 epoch: 77, train_loss: 0.8363, test_loss: 1.2720, test_f1: 0.5134
 epoch: 78, train_loss: 0.8478, test_loss: 1.2448, test_f1: 0.5240
 epoch: 79, train_loss: 0.8582, test_loss: 1.2982, test_f1: 0.5379
 epoch: 80, train_loss: 0.8379, test_loss: 1.3676, test_f1: 0.5039
 epoch: 81, train_loss: 0.8440, test_loss: 1.3330, test_f1: 0.4995
 epoch: 82, train_loss: 0.8507, test_loss: 1.3318, test_f1: 0.5255
 epoch: 83, train_loss: 0.8501, test_loss: 1.3319, test_f1: 0.4889
 epoch: 84, train_loss: 0.8534, test_loss: 1.2420, test_f1: 0.5286
 epoch: 85, train_loss: 0.8641, test_loss: 1.3048, test_f1: 0.5536
 epoch: 86, train_loss: 0.8350, test_loss: 1.2780, test_f1: 0.5078
 epoch: 87, train_loss: 0.8253, test_loss: 1.2289, test_f1: 0.5290
 epoch: 88, train_loss: 0.8372, test_loss: 1.2843, test_f1: 0.5155
 epoch: 89, train_loss: 0.8248, test_loss: 1.3207, test_f1: 0.4911
 epoch: 90, train_loss: 0.8412, test_loss: 1.3424, test_f1: 0.5181
 epoch: 91, train_loss: 0.8240, test_loss: 1.3259, test_f1: 0.5243
 epoch: 92, train_loss: 0.8277, test_loss: 1.3998, test_f1: 0.5062
 epoch: 93, train_loss: 0.8121, test_loss: 1.3498, test_f1: 0.5185
 epoch: 94, train_loss: 0.8167, test_loss: 1.3223, test_f1: 0.5282
 epoch: 95, train_loss: 0.8080, test_loss: 1.3478, test_f1: 0.5285
 epoch: 96, train_loss: 0.8132, test_loss: 1.4146, test_f1: 0.5129
 epoch: 97, train_loss: 0.8106, test_loss: 1.3965, test_f1: 0.5398
 epoch: 98, train_loss: 0.8043, test_loss: 1.4822, test_f1: 0.5064
 epoch: 99, train_loss: 0.8249, test_loss: 1.4056, test_f1: 0.5237
##################ITERATION #4 ****************************************
 epoch: 0, train_loss: 1.3119, test_loss: 1.3255, test_f1: 0.2274
 epoch: 1, train_loss: 1.2272, test_loss: 1.2786, test_f1: 0.2404
 epoch: 2, train_loss: 1.2123, test_loss: 1.2633, test_f1: 0.2630
 epoch: 3, train_loss: 1.1906, test_loss: 1.2631, test_f1: 0.2669
 epoch: 4, train_loss: 1.1865, test_loss: 1.2524, test_f1: 0.2907
 epoch: 5, train_loss: 1.1826, test_loss: 1.2402, test_f1: 0.3607
 epoch: 6, train_loss: 1.1564, test_loss: 1.2245, test_f1: 0.3653
 epoch: 7, train_loss: 1.1398, test_loss: 1.2255, test_f1: 0.3634
 epoch: 8, train_loss: 1.1328, test_loss: 1.2128, test_f1: 0.3621
 epoch: 9, train_loss: 1.1272, test_loss: 1.2094, test_f1: 0.3694
 epoch: 10, train_loss: 1.1190, test_loss: 1.1938, test_f1: 0.3731
 epoch: 11, train_loss: 1.1170, test_loss: 1.1908, test_f1: 0.3668
 epoch: 12, train_loss: 1.0982, test_loss: 1.1788, test_f1: 0.3899
 epoch: 13, train_loss: 1.0971, test_loss: 1.1680, test_f1: 0.4045
 epoch: 14, train_loss: 1.0779, test_loss: 1.1813, test_f1: 0.3902
 epoch: 15, train_loss: 1.0628, test_loss: 1.1694, test_f1: 0.3995
 epoch: 16, train_loss: 1.0744, test_loss: 1.1523, test_f1: 0.4083
 epoch: 17, train_loss: 1.0653, test_loss: 1.1645, test_f1: 0.4047
 epoch: 18, train_loss: 1.0513, test_loss: 1.1663, test_f1: 0.4184
 epoch: 19, train_loss: 1.0523, test_loss: 1.1710, test_f1: 0.4307
 epoch: 20, train_loss: 1.0331, test_loss: 1.1532, test_f1: 0.4077
 epoch: 21, train_loss: 1.0301, test_loss: 1.1847, test_f1: 0.4565
 epoch: 22, train_loss: 1.0189, test_loss: 1.1998, test_f1: 0.4482
 epoch: 23, train_loss: 1.0479, test_loss: 1.1881, test_f1: 0.4907
 epoch: 24, train_loss: 1.0213, test_loss: 1.1916, test_f1: 0.4695
 epoch: 25, train_loss: 1.0046, test_loss: 1.1928, test_f1: 0.4887
 epoch: 26, train_loss: 1.0072, test_loss: 1.1859, test_f1: 0.4782
 epoch: 27, train_loss: 0.9866, test_loss: 1.1474, test_f1: 0.4903
 epoch: 28, train_loss: 1.0139, test_loss: 1.2427, test_f1: 0.4964
 epoch: 29, train_loss: 0.9982, test_loss: 1.1995, test_f1: 0.4859
 epoch: 30, train_loss: 0.9741, test_loss: 1.2348, test_f1: 0.4740
 epoch: 31, train_loss: 0.9805, test_loss: 1.1987, test_f1: 0.4813
 epoch: 32, train_loss: 0.9735, test_loss: 1.2741, test_f1: 0.4831
 epoch: 33, train_loss: 0.9504, test_loss: 1.2138, test_f1: 0.4878
 epoch: 34, train_loss: 0.9708, test_loss: 1.3293, test_f1: 0.5103
 epoch: 35, train_loss: 0.9785, test_loss: 1.1752, test_f1: 0.4981
 epoch: 36, train_loss: 0.9698, test_loss: 1.3071, test_f1: 0.4986
 epoch: 37, train_loss: 0.9579, test_loss: 1.2714, test_f1: 0.5006
 epoch: 38, train_loss: 0.9472, test_loss: 1.2636, test_f1: 0.5177
 epoch: 39, train_loss: 0.9313, test_loss: 1.2646, test_f1: 0.4979
 epoch: 40, train_loss: 0.9458, test_loss: 1.2428, test_f1: 0.5230
 epoch: 41, train_loss: 0.9258, test_loss: 1.2649, test_f1: 0.5177
 epoch: 42, train_loss: 0.9383, test_loss: 1.3341, test_f1: 0.5245
 epoch: 43, train_loss: 0.9326, test_loss: 1.4043, test_f1: 0.5154
 epoch: 44, train_loss: 0.9325, test_loss: 1.2302, test_f1: 0.5290
 epoch: 45, train_loss: 0.9166, test_loss: 1.2458, test_f1: 0.5175
 epoch: 46, train_loss: 0.9334, test_loss: 1.2067, test_f1: 0.5357
 epoch: 47, train_loss: 0.9209, test_loss: 1.1790, test_f1: 0.5213
 epoch: 48, train_loss: 0.9170, test_loss: 1.2891, test_f1: 0.5262
 epoch: 49, train_loss: 0.9035, test_loss: 1.2646, test_f1: 0.5235
 epoch: 50, train_loss: 0.9152, test_loss: 1.3004, test_f1: 0.5341
 epoch: 51, train_loss: 0.9032, test_loss: 1.2596, test_f1: 0.5401
 epoch: 52, train_loss: 0.9091, test_loss: 1.2491, test_f1: 0.5290
 epoch: 53, train_loss: 0.9112, test_loss: 1.3206, test_f1: 0.5231
 epoch: 54, train_loss: 0.8978, test_loss: 1.2501, test_f1: 0.5386
 epoch: 55, train_loss: 0.8935, test_loss: 1.2583, test_f1: 0.5422
 epoch: 56, train_loss: 0.8916, test_loss: 1.3189, test_f1: 0.5439
 epoch: 57, train_loss: 0.8734, test_loss: 1.2729, test_f1: 0.5375
 epoch: 58, train_loss: 0.8907, test_loss: 1.3270, test_f1: 0.5366
 epoch: 59, train_loss: 0.8836, test_loss: 1.2348, test_f1: 0.5481
 epoch: 60, train_loss: 0.8841, test_loss: 1.2268, test_f1: 0.5505
 epoch: 61, train_loss: 0.8814, test_loss: 1.2078, test_f1: 0.5541
 epoch: 62, train_loss: 0.8874, test_loss: 1.2404, test_f1: 0.5446
 epoch: 63, train_loss: 0.8763, test_loss: 1.2282, test_f1: 0.5579
 epoch: 64, train_loss: 0.8700, test_loss: 1.2984, test_f1: 0.5498
 epoch: 65, train_loss: 0.8593, test_loss: 1.2973, test_f1: 0.5466
 epoch: 66, train_loss: 0.8834, test_loss: 1.2669, test_f1: 0.5286
 epoch: 67, train_loss: 0.8664, test_loss: 1.3445, test_f1: 0.5403
 epoch: 68, train_loss: 0.8506, test_loss: 1.3197, test_f1: 0.5423
 epoch: 69, train_loss: 0.8731, test_loss: 1.2672, test_f1: 0.5498
 epoch: 70, train_loss: 0.8675, test_loss: 1.2720, test_f1: 0.5364
 epoch: 71, train_loss: 0.8461, test_loss: 1.3730, test_f1: 0.5451
 epoch: 72, train_loss: 0.8645, test_loss: 1.4230, test_f1: 0.5490
 epoch: 73, train_loss: 0.8482, test_loss: 1.3319, test_f1: 0.5425
 epoch: 74, train_loss: 0.8549, test_loss: 1.2985, test_f1: 0.5393
 epoch: 75, train_loss: 0.8656, test_loss: 1.3350, test_f1: 0.5488
 epoch: 76, train_loss: 0.8503, test_loss: 1.3129, test_f1: 0.5493
 epoch: 77, train_loss: 0.8513, test_loss: 1.4356, test_f1: 0.5200
 epoch: 78, train_loss: 0.8552, test_loss: 1.3878, test_f1: 0.5230
 epoch: 79, train_loss: 0.8541, test_loss: 1.2154, test_f1: 0.5636
 epoch: 80, train_loss: 0.8468, test_loss: 1.2830, test_f1: 0.5502
 epoch: 81, train_loss: 0.8413, test_loss: 1.3276, test_f1: 0.5401
 epoch: 82, train_loss: 0.8335, test_loss: 1.2020, test_f1: 0.5731
 epoch: 83, train_loss: 0.8482, test_loss: 1.2424, test_f1: 0.5506
 epoch: 84, train_loss: 0.8339, test_loss: 1.2852, test_f1: 0.5586
 epoch: 85, train_loss: 0.8380, test_loss: 1.3049, test_f1: 0.5523
 epoch: 86, train_loss: 0.8336, test_loss: 1.2448, test_f1: 0.5363
 epoch: 87, train_loss: 0.8547, test_loss: 1.3856, test_f1: 0.5080
 epoch: 88, train_loss: 0.8247, test_loss: 1.4135, test_f1: 0.5470
 epoch: 89, train_loss: 0.8225, test_loss: 1.2460, test_f1: 0.5395
 epoch: 90, train_loss: 0.8194, test_loss: 1.3894, test_f1: 0.5222
 epoch: 91, train_loss: 0.8436, test_loss: 1.2247, test_f1: 0.5403
 epoch: 92, train_loss: 0.8377, test_loss: 1.4478, test_f1: 0.5195
 epoch: 93, train_loss: 0.8469, test_loss: 1.4041, test_f1: 0.5189
 epoch: 94, train_loss: 0.8330, test_loss: 1.3208, test_f1: 0.5296
 epoch: 95, train_loss: 0.8260, test_loss: 1.2907, test_f1: 0.5455
 epoch: 96, train_loss: 0.8284, test_loss: 1.3409, test_f1: 0.5243
 epoch: 97, train_loss: 0.8402, test_loss: 1.3892, test_f1: 0.5267
 epoch: 98, train_loss: 0.8119, test_loss: 1.4304, test_f1: 0.5312
 epoch: 99, train_loss: 0.8008, test_loss: 1.2379, test_f1: 0.5532
##################ITERATION #5 ****************************************
 epoch: 0, train_loss: 1.3516, test_loss: 1.3756, test_f1: 0.2404
 epoch: 1, train_loss: 1.2634, test_loss: 1.3326, test_f1: 0.2322
 epoch: 2, train_loss: 1.2523, test_loss: 1.3203, test_f1: 0.2261
 epoch: 3, train_loss: 1.2291, test_loss: 1.2989, test_f1: 0.2251
 epoch: 4, train_loss: 1.2143, test_loss: 1.3108, test_f1: 0.2525
 epoch: 5, train_loss: 1.1982, test_loss: 1.2773, test_f1: 0.2879
 epoch: 6, train_loss: 1.2025, test_loss: 1.3162, test_f1: 0.3312
 epoch: 7, train_loss: 1.1942, test_loss: 1.3209, test_f1: 0.3722
 epoch: 8, train_loss: 1.1760, test_loss: 1.2662, test_f1: 0.3871
 epoch: 9, train_loss: 1.1636, test_loss: 1.2657, test_f1: 0.4139
 epoch: 10, train_loss: 1.1666, test_loss: 1.2475, test_f1: 0.4198
 epoch: 11, train_loss: 1.1575, test_loss: 1.2908, test_f1: 0.4314
 epoch: 12, train_loss: 1.1533, test_loss: 1.3342, test_f1: 0.4207
 epoch: 13, train_loss: 1.1439, test_loss: 1.3216, test_f1: 0.4188
 epoch: 14, train_loss: 1.1320, test_loss: 1.3602, test_f1: 0.4240
 epoch: 15, train_loss: 1.1185, test_loss: 1.5952, test_f1: 0.4390
 epoch: 16, train_loss: 1.1178, test_loss: 1.3378, test_f1: 0.4358
 epoch: 17, train_loss: 1.0897, test_loss: 1.3956, test_f1: 0.4437
 epoch: 18, train_loss: 1.0879, test_loss: 1.5127, test_f1: 0.4615
 epoch: 19, train_loss: 1.0724, test_loss: 1.3440, test_f1: 0.4784
 epoch: 20, train_loss: 1.0768, test_loss: 1.5063, test_f1: 0.4829
 epoch: 21, train_loss: 1.0810, test_loss: 1.4456, test_f1: 0.4597
 epoch: 22, train_loss: 1.0504, test_loss: 1.4437, test_f1: 0.4613
 epoch: 23, train_loss: 1.0597, test_loss: 1.3293, test_f1: 0.4769
 epoch: 24, train_loss: 1.0498, test_loss: 1.3627, test_f1: 0.4942
 epoch: 25, train_loss: 1.0259, test_loss: 1.2866, test_f1: 0.4898
 epoch: 26, train_loss: 1.0381, test_loss: 1.3929, test_f1: 0.5086
 epoch: 27, train_loss: 1.0265, test_loss: 1.3627, test_f1: 0.4815
 epoch: 28, train_loss: 1.0337, test_loss: 1.3720, test_f1: 0.5065
 epoch: 29, train_loss: 1.0161, test_loss: 1.2900, test_f1: 0.5067
 epoch: 30, train_loss: 1.0120, test_loss: 1.2964, test_f1: 0.4973
 epoch: 31, train_loss: 0.9854, test_loss: 1.4015, test_f1: 0.5249
 epoch: 32, train_loss: 0.9820, test_loss: 1.3002, test_f1: 0.5190
 epoch: 33, train_loss: 0.9889, test_loss: 1.2487, test_f1: 0.5129
 epoch: 34, train_loss: 0.9797, test_loss: 1.2589, test_f1: 0.5298
 epoch: 35, train_loss: 0.9817, test_loss: 1.2620, test_f1: 0.5230
 epoch: 36, train_loss: 0.9549, test_loss: 1.2759, test_f1: 0.5362
 epoch: 37, train_loss: 0.9659, test_loss: 1.3772, test_f1: 0.5137
 epoch: 38, train_loss: 0.9616, test_loss: 1.3137, test_f1: 0.5027
 epoch: 39, train_loss: 0.9536, test_loss: 1.2482, test_f1: 0.5062
 epoch: 40, train_loss: 0.9661, test_loss: 1.2650, test_f1: 0.5374
 epoch: 41, train_loss: 0.9469, test_loss: 1.2339, test_f1: 0.5463
 epoch: 42, train_loss: 0.9550, test_loss: 1.3247, test_f1: 0.5164
 epoch: 43, train_loss: 0.9430, test_loss: 1.2454, test_f1: 0.5475
 epoch: 44, train_loss: 0.9471, test_loss: 1.3174, test_f1: 0.5309
 epoch: 45, train_loss: 0.9249, test_loss: 1.2428, test_f1: 0.5355
 epoch: 46, train_loss: 0.9300, test_loss: 1.3474, test_f1: 0.5041
 epoch: 47, train_loss: 0.9316, test_loss: 1.2547, test_f1: 0.5606
 epoch: 48, train_loss: 0.9219, test_loss: 1.2855, test_f1: 0.5443
 epoch: 49, train_loss: 0.9186, test_loss: 1.3073, test_f1: 0.5511
 epoch: 50, train_loss: 0.9234, test_loss: 1.3896, test_f1: 0.5352
 epoch: 51, train_loss: 0.9153, test_loss: 1.3017, test_f1: 0.5310
 epoch: 52, train_loss: 0.9064, test_loss: 1.2825, test_f1: 0.5340
 epoch: 53, train_loss: 0.8934, test_loss: 1.3115, test_f1: 0.5382
 epoch: 54, train_loss: 0.9032, test_loss: 1.2542, test_f1: 0.5415
 epoch: 55, train_loss: 0.9003, test_loss: 1.2533, test_f1: 0.5315
 epoch: 56, train_loss: 0.9085, test_loss: 1.3388, test_f1: 0.5416
 epoch: 57, train_loss: 0.8938, test_loss: 1.3685, test_f1: 0.5365
 epoch: 58, train_loss: 0.9007, test_loss: 1.3343, test_f1: 0.5313
 epoch: 59, train_loss: 0.8952, test_loss: 1.3722, test_f1: 0.5180
 epoch: 60, train_loss: 0.8905, test_loss: 1.4794, test_f1: 0.5320
 epoch: 61, train_loss: 0.8788, test_loss: 1.4641, test_f1: 0.5312
 epoch: 62, train_loss: 0.8992, test_loss: 1.3329, test_f1: 0.5189
 epoch: 63, train_loss: 0.8828, test_loss: 1.3568, test_f1: 0.5157
 epoch: 64, train_loss: 0.8841, test_loss: 1.3384, test_f1: 0.5234
 epoch: 65, train_loss: 0.8769, test_loss: 1.3371, test_f1: 0.5317
 epoch: 66, train_loss: 0.8882, test_loss: 1.3110, test_f1: 0.5207
 epoch: 67, train_loss: 0.8855, test_loss: 1.3176, test_f1: 0.5395
 epoch: 68, train_loss: 0.9035, test_loss: 1.3031, test_f1: 0.5316
 epoch: 69, train_loss: 0.8687, test_loss: 1.3732, test_f1: 0.5250
 epoch: 70, train_loss: 0.8714, test_loss: 1.3332, test_f1: 0.5280
 epoch: 71, train_loss: 0.8584, test_loss: 1.3730, test_f1: 0.5365
 epoch: 72, train_loss: 0.8798, test_loss: 1.4023, test_f1: 0.5429
 epoch: 73, train_loss: 0.8780, test_loss: 1.4243, test_f1: 0.5178
 epoch: 74, train_loss: 0.8700, test_loss: 1.2900, test_f1: 0.5309
 epoch: 75, train_loss: 0.8613, test_loss: 1.3746, test_f1: 0.5396
 epoch: 76, train_loss: 0.8736, test_loss: 1.3736, test_f1: 0.5222
 epoch: 77, train_loss: 0.8641, test_loss: 1.4328, test_f1: 0.5099
 epoch: 78, train_loss: 0.8629, test_loss: 1.3931, test_f1: 0.5079
 epoch: 79, train_loss: 0.8664, test_loss: 1.3361, test_f1: 0.5174
 epoch: 80, train_loss: 0.8520, test_loss: 1.3354, test_f1: 0.5340
 epoch: 81, train_loss: 0.8463, test_loss: 1.3744, test_f1: 0.5240
 epoch: 82, train_loss: 0.8539, test_loss: 1.4129, test_f1: 0.5222
 epoch: 83, train_loss: 0.8411, test_loss: 1.3452, test_f1: 0.5320
 epoch: 84, train_loss: 0.8537, test_loss: 1.3316, test_f1: 0.5190
 epoch: 85, train_loss: 0.8520, test_loss: 1.3102, test_f1: 0.5305
 epoch: 86, train_loss: 0.8481, test_loss: 1.3158, test_f1: 0.5341
 epoch: 87, train_loss: 0.8490, test_loss: 1.4090, test_f1: 0.5253
 epoch: 88, train_loss: 0.8604, test_loss: 1.3254, test_f1: 0.5342
 epoch: 89, train_loss: 0.8511, test_loss: 1.4122, test_f1: 0.5186
 epoch: 90, train_loss: 0.8399, test_loss: 1.3811, test_f1: 0.5282
 epoch: 91, train_loss: 0.8466, test_loss: 1.4275, test_f1: 0.5417
 epoch: 92, train_loss: 0.8461, test_loss: 1.4268, test_f1: 0.5243
 epoch: 93, train_loss: 0.8546, test_loss: 1.4650, test_f1: 0.5219
 epoch: 94, train_loss: 0.8279, test_loss: 1.3982, test_f1: 0.5552
 epoch: 95, train_loss: 0.8398, test_loss: 1.4164, test_f1: 0.5285
 epoch: 96, train_loss: 0.8448, test_loss: 1.3709, test_f1: 0.5465
 epoch: 97, train_loss: 0.8383, test_loss: 1.4500, test_f1: 0.5131
 epoch: 98, train_loss: 0.8323, test_loss: 1.3406, test_f1: 0.5313
 epoch: 99, train_loss: 0.8307, test_loss: 1.3688, test_f1: 0.5342
##################ITERATION #6 ****************************************
 epoch: 0, train_loss: 1.4345, test_loss: 1.3164, test_f1: 0.2215
 epoch: 1, train_loss: 1.2697, test_loss: 1.3388, test_f1: 0.2309
 epoch: 2, train_loss: 1.2501, test_loss: 1.3421, test_f1: 0.2513
 epoch: 3, train_loss: 1.2588, test_loss: 1.3219, test_f1: 0.2735
 epoch: 4, train_loss: 1.2395, test_loss: 1.3194, test_f1: 0.2820
 epoch: 5, train_loss: 1.2265, test_loss: 1.3112, test_f1: 0.2800
 epoch: 6, train_loss: 1.2197, test_loss: 1.3111, test_f1: 0.2699
 epoch: 7, train_loss: 1.2102, test_loss: 1.3071, test_f1: 0.2788
 epoch: 8, train_loss: 1.1901, test_loss: 1.2971, test_f1: 0.3102
 epoch: 9, train_loss: 1.1973, test_loss: 1.2814, test_f1: 0.2876
 epoch: 10, train_loss: 1.1988, test_loss: 1.2771, test_f1: 0.2795
 epoch: 11, train_loss: 1.1901, test_loss: 1.2677, test_f1: 0.2607
 epoch: 12, train_loss: 1.1693, test_loss: 1.2731, test_f1: 0.2769
 epoch: 13, train_loss: 1.1816, test_loss: 1.2613, test_f1: 0.2986
 epoch: 14, train_loss: 1.1723, test_loss: 1.2547, test_f1: 0.3011
 epoch: 15, train_loss: 1.1556, test_loss: 1.2582, test_f1: 0.2717
 epoch: 16, train_loss: 1.1491, test_loss: 1.2285, test_f1: 0.2717
 epoch: 17, train_loss: 1.1389, test_loss: 1.2477, test_f1: 0.2870
 epoch: 18, train_loss: 1.1443, test_loss: 1.2447, test_f1: 0.3018
 epoch: 19, train_loss: 1.1285, test_loss: 1.2252, test_f1: 0.3057
 epoch: 20, train_loss: 1.1350, test_loss: 1.2424, test_f1: 0.3257
 epoch: 21, train_loss: 1.1324, test_loss: 1.2456, test_f1: 0.3648
 epoch: 22, train_loss: 1.1047, test_loss: 1.2366, test_f1: 0.3488
 epoch: 23, train_loss: 1.1195, test_loss: 1.2875, test_f1: 0.3454
 epoch: 24, train_loss: 1.1089, test_loss: 1.2519, test_f1: 0.3483
 epoch: 25, train_loss: 1.1027, test_loss: 1.2061, test_f1: 0.3793
 epoch: 26, train_loss: 1.0915, test_loss: 1.1874, test_f1: 0.3800
 epoch: 27, train_loss: 1.0727, test_loss: 1.1897, test_f1: 0.3874
 epoch: 28, train_loss: 1.0910, test_loss: 1.1954, test_f1: 0.3748
 epoch: 29, train_loss: 1.0734, test_loss: 1.1971, test_f1: 0.4316
 epoch: 30, train_loss: 1.0598, test_loss: 1.1823, test_f1: 0.3918
 epoch: 31, train_loss: 1.0560, test_loss: 1.2060, test_f1: 0.4230
 epoch: 32, train_loss: 1.0460, test_loss: 1.2313, test_f1: 0.4163
 epoch: 33, train_loss: 1.0433, test_loss: 1.2237, test_f1: 0.4120
 epoch: 34, train_loss: 1.0370, test_loss: 1.1881, test_f1: 0.4317
 epoch: 35, train_loss: 1.0349, test_loss: 1.1720, test_f1: 0.4240
 epoch: 36, train_loss: 1.0205, test_loss: 1.1666, test_f1: 0.4397
 epoch: 37, train_loss: 1.0267, test_loss: 1.1513, test_f1: 0.4537
 epoch: 38, train_loss: 1.0130, test_loss: 1.2081, test_f1: 0.4244
 epoch: 39, train_loss: 0.9909, test_loss: 1.2006, test_f1: 0.4499
 epoch: 40, train_loss: 1.0000, test_loss: 1.1969, test_f1: 0.4226
 epoch: 41, train_loss: 1.0025, test_loss: 1.1620, test_f1: 0.4057
 epoch: 42, train_loss: 0.9808, test_loss: 1.1630, test_f1: 0.4519
 epoch: 43, train_loss: 0.9677, test_loss: 1.2061, test_f1: 0.4486
 epoch: 44, train_loss: 0.9662, test_loss: 1.1125, test_f1: 0.4588
 epoch: 45, train_loss: 0.9574, test_loss: 1.3940, test_f1: 0.4261
 epoch: 46, train_loss: 0.9567, test_loss: 1.1541, test_f1: 0.4566
 epoch: 47, train_loss: 0.9574, test_loss: 1.1768, test_f1: 0.4414
 epoch: 48, train_loss: 0.9374, test_loss: 1.1295, test_f1: 0.4761
 epoch: 49, train_loss: 0.9482, test_loss: 1.1607, test_f1: 0.4535
 epoch: 50, train_loss: 0.9357, test_loss: 1.1447, test_f1: 0.4449
 epoch: 51, train_loss: 0.9246, test_loss: 1.1383, test_f1: 0.4916
 epoch: 52, train_loss: 0.9197, test_loss: 1.2084, test_f1: 0.4380
 epoch: 53, train_loss: 0.9044, test_loss: 1.1533, test_f1: 0.4667
 epoch: 54, train_loss: 0.9221, test_loss: 1.1686, test_f1: 0.5017
 epoch: 55, train_loss: 0.9132, test_loss: 1.1084, test_f1: 0.4953
 epoch: 56, train_loss: 0.8898, test_loss: 1.1771, test_f1: 0.4712
 epoch: 57, train_loss: 0.8925, test_loss: 1.1567, test_f1: 0.4953
 epoch: 58, train_loss: 0.9026, test_loss: 1.1719, test_f1: 0.5033
 epoch: 59, train_loss: 0.9090, test_loss: 1.1519, test_f1: 0.5043
 epoch: 60, train_loss: 0.9062, test_loss: 1.1286, test_f1: 0.4976
 epoch: 61, train_loss: 0.9089, test_loss: 1.1930, test_f1: 0.4549
 epoch: 62, train_loss: 0.8907, test_loss: 1.1638, test_f1: 0.4816
 epoch: 63, train_loss: 0.8846, test_loss: 1.1515, test_f1: 0.4961
 epoch: 64, train_loss: 0.8886, test_loss: 1.1726, test_f1: 0.4717
 epoch: 65, train_loss: 0.8962, test_loss: 1.1603, test_f1: 0.5141
 epoch: 66, train_loss: 0.8886, test_loss: 1.1462, test_f1: 0.4967
 epoch: 67, train_loss: 0.8953, test_loss: 1.1563, test_f1: 0.4869
 epoch: 68, train_loss: 0.8888, test_loss: 1.1872, test_f1: 0.4903
 epoch: 69, train_loss: 0.8775, test_loss: 1.1649, test_f1: 0.4887
 epoch: 70, train_loss: 0.8823, test_loss: 1.1512, test_f1: 0.4880
 epoch: 71, train_loss: 0.8782, test_loss: 1.2050, test_f1: 0.5095
 epoch: 72, train_loss: 0.8708, test_loss: 1.1942, test_f1: 0.5102
 epoch: 73, train_loss: 0.8616, test_loss: 1.1848, test_f1: 0.5058
 epoch: 74, train_loss: 0.8825, test_loss: 1.2583, test_f1: 0.4758
 epoch: 75, train_loss: 0.8698, test_loss: 1.2488, test_f1: 0.4886
 epoch: 76, train_loss: 0.8827, test_loss: 1.2892, test_f1: 0.4675
 epoch: 77, train_loss: 0.8793, test_loss: 1.1876, test_f1: 0.4816
 epoch: 78, train_loss: 0.8661, test_loss: 1.2701, test_f1: 0.4946
 epoch: 79, train_loss: 0.8787, test_loss: 1.2817, test_f1: 0.4754
 epoch: 80, train_loss: 0.8714, test_loss: 1.2823, test_f1: 0.5048
 epoch: 81, train_loss: 0.8525, test_loss: 1.2474, test_f1: 0.4885
 epoch: 82, train_loss: 0.8623, test_loss: 1.3394, test_f1: 0.4538
 epoch: 83, train_loss: 0.8529, test_loss: 1.2599, test_f1: 0.5026
 epoch: 84, train_loss: 0.8432, test_loss: 1.2921, test_f1: 0.4945
 epoch: 85, train_loss: 0.8448, test_loss: 1.3223, test_f1: 0.4727
 epoch: 86, train_loss: 0.8504, test_loss: 1.2608, test_f1: 0.5057
 epoch: 87, train_loss: 0.8427, test_loss: 1.2768, test_f1: 0.5161
 epoch: 88, train_loss: 0.8614, test_loss: 1.3253, test_f1: 0.5076
 epoch: 89, train_loss: 0.8467, test_loss: 1.3123, test_f1: 0.5091
 epoch: 90, train_loss: 0.8274, test_loss: 1.3190, test_f1: 0.5134
 epoch: 91, train_loss: 0.8412, test_loss: 1.3106, test_f1: 0.5020
 epoch: 92, train_loss: 0.8440, test_loss: 1.2827, test_f1: 0.5145
 epoch: 93, train_loss: 0.8345, test_loss: 1.3896, test_f1: 0.5090
 epoch: 94, train_loss: 0.8464, test_loss: 1.3150, test_f1: 0.4936
 epoch: 95, train_loss: 0.8323, test_loss: 1.3006, test_f1: 0.5153
 epoch: 96, train_loss: 0.8318, test_loss: 1.2787, test_f1: 0.4970
 epoch: 97, train_loss: 0.8376, test_loss: 1.3042, test_f1: 0.5163
 epoch: 98, train_loss: 0.8407, test_loss: 1.3331, test_f1: 0.5130
 epoch: 99, train_loss: 0.8336, test_loss: 1.3098, test_f1: 0.4854
##################ITERATION #7 ****************************************
 epoch: 0, train_loss: 1.2830, test_loss: 1.3200, test_f1: 0.2281
 epoch: 1, train_loss: 1.2441, test_loss: 1.3115, test_f1: 0.2281
 epoch: 2, train_loss: 1.2395, test_loss: 1.3115, test_f1: 0.2281
 epoch: 3, train_loss: 1.2275, test_loss: 1.3467, test_f1: 0.2285
 epoch: 4, train_loss: 1.2144, test_loss: 1.2913, test_f1: 0.2436
 epoch: 5, train_loss: 1.2042, test_loss: 1.2656, test_f1: 0.2680
 epoch: 6, train_loss: 1.2058, test_loss: 1.2562, test_f1: 0.2729
 epoch: 7, train_loss: 1.2041, test_loss: 1.2552, test_f1: 0.3036
 epoch: 8, train_loss: 1.1897, test_loss: 1.2546, test_f1: 0.2939
 epoch: 9, train_loss: 1.1911, test_loss: 1.2506, test_f1: 0.2981
 epoch: 10, train_loss: 1.1775, test_loss: 1.2503, test_f1: 0.2925
 epoch: 11, train_loss: 1.1691, test_loss: 1.2481, test_f1: 0.3044
 epoch: 12, train_loss: 1.1677, test_loss: 1.2417, test_f1: 0.3084
 epoch: 13, train_loss: 1.1751, test_loss: 1.2433, test_f1: 0.3596
 epoch: 14, train_loss: 1.1575, test_loss: 1.2243, test_f1: 0.3656
 epoch: 15, train_loss: 1.1705, test_loss: 1.2252, test_f1: 0.3367
 epoch: 16, train_loss: 1.1757, test_loss: 1.2258, test_f1: 0.3465
 epoch: 17, train_loss: 1.1584, test_loss: 1.2208, test_f1: 0.3766
 epoch: 18, train_loss: 1.1572, test_loss: 1.2138, test_f1: 0.3534
 epoch: 19, train_loss: 1.1564, test_loss: 1.2193, test_f1: 0.3745
 epoch: 20, train_loss: 1.1510, test_loss: 1.2329, test_f1: 0.4033
 epoch: 21, train_loss: 1.1462, test_loss: 1.2320, test_f1: 0.3659
 epoch: 22, train_loss: 1.1407, test_loss: 1.2223, test_f1: 0.3880
 epoch: 23, train_loss: 1.1419, test_loss: 1.2231, test_f1: 0.3714
 epoch: 24, train_loss: 1.1342, test_loss: 1.2177, test_f1: 0.3438
 epoch: 25, train_loss: 1.1421, test_loss: 1.2215, test_f1: 0.3332
 epoch: 26, train_loss: 1.1310, test_loss: 1.2696, test_f1: 0.3905
 epoch: 27, train_loss: 1.1281, test_loss: 1.2150, test_f1: 0.3869
 epoch: 28, train_loss: 1.1164, test_loss: 1.2048, test_f1: 0.4192
 epoch: 29, train_loss: 1.1087, test_loss: 1.1971, test_f1: 0.4326
 epoch: 30, train_loss: 1.1126, test_loss: 1.1879, test_f1: 0.4337
 epoch: 31, train_loss: 1.1092, test_loss: 1.1856, test_f1: 0.4544
 epoch: 32, train_loss: 1.1130, test_loss: 1.1968, test_f1: 0.4491
 epoch: 33, train_loss: 1.0987, test_loss: 1.1993, test_f1: 0.4079
 epoch: 34, train_loss: 1.0912, test_loss: 1.1935, test_f1: 0.4519
 epoch: 35, train_loss: 1.0767, test_loss: 1.1813, test_f1: 0.4677
 epoch: 36, train_loss: 1.0779, test_loss: 1.1679, test_f1: 0.4489
 epoch: 37, train_loss: 1.0799, test_loss: 1.1610, test_f1: 0.4405
 epoch: 38, train_loss: 1.0708, test_loss: 1.1536, test_f1: 0.4576
 epoch: 39, train_loss: 1.0703, test_loss: 1.1748, test_f1: 0.4679
 epoch: 40, train_loss: 1.0643, test_loss: 1.2006, test_f1: 0.4498
 epoch: 41, train_loss: 1.0609, test_loss: 1.2112, test_f1: 0.4600
 epoch: 42, train_loss: 1.0565, test_loss: 1.2395, test_f1: 0.4450
 epoch: 43, train_loss: 1.0461, test_loss: 1.2408, test_f1: 0.4335
 epoch: 44, train_loss: 1.0429, test_loss: 1.3356, test_f1: 0.4971
 epoch: 45, train_loss: 1.0305, test_loss: 1.1656, test_f1: 0.4714
 epoch: 46, train_loss: 1.0418, test_loss: 1.1908, test_f1: 0.4575
 epoch: 47, train_loss: 1.0383, test_loss: 1.1624, test_f1: 0.4652
 epoch: 48, train_loss: 1.0113, test_loss: 1.1843, test_f1: 0.4520
 epoch: 49, train_loss: 1.0203, test_loss: 1.1831, test_f1: 0.4847
 epoch: 50, train_loss: 1.0210, test_loss: 1.3359, test_f1: 0.4920
 epoch: 51, train_loss: 1.0060, test_loss: 1.1757, test_f1: 0.4890
 epoch: 52, train_loss: 1.0044, test_loss: 1.1600, test_f1: 0.4834
 epoch: 53, train_loss: 1.0158, test_loss: 1.1203, test_f1: 0.5219
 epoch: 54, train_loss: 1.0067, test_loss: 1.1251, test_f1: 0.5008
 epoch: 55, train_loss: 0.9889, test_loss: 1.2718, test_f1: 0.4974
 epoch: 56, train_loss: 0.9975, test_loss: 1.3786, test_f1: 0.4668
 epoch: 57, train_loss: 0.9878, test_loss: 1.3216, test_f1: 0.4891
 epoch: 58, train_loss: 0.9716, test_loss: 1.2641, test_f1: 0.5029
 epoch: 59, train_loss: 0.9759, test_loss: 1.2947, test_f1: 0.4859
 epoch: 60, train_loss: 0.9855, test_loss: 1.1976, test_f1: 0.4672
 epoch: 61, train_loss: 0.9709, test_loss: 1.2653, test_f1: 0.4865
 epoch: 62, train_loss: 0.9710, test_loss: 1.4470, test_f1: 0.4737
 epoch: 63, train_loss: 0.9786, test_loss: 1.4295, test_f1: 0.4851
 epoch: 64, train_loss: 0.9821, test_loss: 1.5266, test_f1: 0.4528
 epoch: 65, train_loss: 0.9866, test_loss: 1.2988, test_f1: 0.4683
 epoch: 66, train_loss: 0.9664, test_loss: 1.4467, test_f1: 0.4705
 epoch: 67, train_loss: 0.9774, test_loss: 1.4106, test_f1: 0.4968
 epoch: 68, train_loss: 0.9575, test_loss: 1.4395, test_f1: 0.4876
 epoch: 69, train_loss: 0.9544, test_loss: 1.4569, test_f1: 0.4706
 epoch: 70, train_loss: 0.9472, test_loss: 1.2649, test_f1: 0.4959
 epoch: 71, train_loss: 0.9468, test_loss: 1.3980, test_f1: 0.4575
 epoch: 72, train_loss: 0.9455, test_loss: 1.2309, test_f1: 0.4928
 epoch: 73, train_loss: 0.9603, test_loss: 1.2139, test_f1: 0.4924
 epoch: 74, train_loss: 0.9671, test_loss: 1.2126, test_f1: 0.5000
 epoch: 75, train_loss: 0.9420, test_loss: 1.3765, test_f1: 0.4720
 epoch: 76, train_loss: 0.9408, test_loss: 1.3705, test_f1: 0.4837
 epoch: 77, train_loss: 0.9322, test_loss: 1.2607, test_f1: 0.5127
 epoch: 78, train_loss: 0.9321, test_loss: 1.2819, test_f1: 0.5124
 epoch: 79, train_loss: 0.9357, test_loss: 1.4574, test_f1: 0.4650
 epoch: 80, train_loss: 0.9477, test_loss: 1.4332, test_f1: 0.5061
 epoch: 81, train_loss: 0.9416, test_loss: 1.3195, test_f1: 0.5001
 epoch: 82, train_loss: 0.9360, test_loss: 1.4140, test_f1: 0.5129
 epoch: 83, train_loss: 0.9273, test_loss: 1.5476, test_f1: 0.4936
 epoch: 84, train_loss: 0.9272, test_loss: 1.3200, test_f1: 0.4897
 epoch: 85, train_loss: 0.9134, test_loss: 1.2414, test_f1: 0.4975
 epoch: 86, train_loss: 0.9199, test_loss: 1.3482, test_f1: 0.4944
 epoch: 87, train_loss: 0.9153, test_loss: 1.4186, test_f1: 0.4996
 epoch: 88, train_loss: 0.9128, test_loss: 1.4202, test_f1: 0.4987
 epoch: 89, train_loss: 0.8984, test_loss: 1.2186, test_f1: 0.5303
 epoch: 90, train_loss: 0.9174, test_loss: 1.1814, test_f1: 0.5185
 epoch: 91, train_loss: 0.8997, test_loss: 1.2848, test_f1: 0.5175
 epoch: 92, train_loss: 0.8998, test_loss: 1.3100, test_f1: 0.4660
 epoch: 93, train_loss: 0.9164, test_loss: 1.2875, test_f1: 0.4760
 epoch: 94, train_loss: 0.9120, test_loss: 1.2759, test_f1: 0.5363
 epoch: 95, train_loss: 0.9063, test_loss: 1.2453, test_f1: 0.5325
 epoch: 96, train_loss: 0.9161, test_loss: 1.2563, test_f1: 0.5350
 epoch: 97, train_loss: 0.9002, test_loss: 1.4002, test_f1: 0.5207
 epoch: 98, train_loss: 0.9074, test_loss: 1.5423, test_f1: 0.5040
 epoch: 99, train_loss: 0.8796, test_loss: 1.3806, test_f1: 0.5222
##################ITERATION #8 ****************************************
 epoch: 0, train_loss: 1.3643, test_loss: 1.3752, test_f1: 0.2630
 epoch: 1, train_loss: 1.2387, test_loss: 1.3871, test_f1: 0.2628
 epoch: 2, train_loss: 1.2109, test_loss: 1.3948, test_f1: 0.2628
 epoch: 3, train_loss: 1.2025, test_loss: 1.3304, test_f1: 0.2640
 epoch: 4, train_loss: 1.1692, test_loss: 1.2769, test_f1: 0.3542
 epoch: 5, train_loss: 1.1663, test_loss: 1.2533, test_f1: 0.3969
 epoch: 6, train_loss: 1.1503, test_loss: 1.2514, test_f1: 0.4042
 epoch: 7, train_loss: 1.1401, test_loss: 1.2458, test_f1: 0.4006
 epoch: 8, train_loss: 1.1258, test_loss: 1.2442, test_f1: 0.4155
 epoch: 9, train_loss: 1.1132, test_loss: 1.2416, test_f1: 0.4260
 epoch: 10, train_loss: 1.1154, test_loss: 1.2460, test_f1: 0.4255
 epoch: 11, train_loss: 1.0895, test_loss: 1.2217, test_f1: 0.4364
 epoch: 12, train_loss: 1.0793, test_loss: 1.2139, test_f1: 0.4537
 epoch: 13, train_loss: 1.0470, test_loss: 1.2361, test_f1: 0.4592
 epoch: 14, train_loss: 1.0555, test_loss: 1.2298, test_f1: 0.4573
 epoch: 15, train_loss: 1.0457, test_loss: 1.2415, test_f1: 0.4899
 epoch: 16, train_loss: 1.0363, test_loss: 1.2405, test_f1: 0.4808
 epoch: 17, train_loss: 1.0178, test_loss: 1.2679, test_f1: 0.4862
 epoch: 18, train_loss: 1.0059, test_loss: 1.2437, test_f1: 0.4837
 epoch: 19, train_loss: 0.9937, test_loss: 1.2151, test_f1: 0.4388
 epoch: 20, train_loss: 0.9770, test_loss: 1.1940, test_f1: 0.4889
 epoch: 21, train_loss: 0.9826, test_loss: 1.2021, test_f1: 0.4886
 epoch: 22, train_loss: 0.9811, test_loss: 1.1877, test_f1: 0.5046
 epoch: 23, train_loss: 0.9769, test_loss: 1.2015, test_f1: 0.5182
 epoch: 24, train_loss: 0.9785, test_loss: 1.2232, test_f1: 0.4584
 epoch: 25, train_loss: 0.9647, test_loss: 1.1495, test_f1: 0.5533
 epoch: 26, train_loss: 0.9566, test_loss: 1.1484, test_f1: 0.5024
 epoch: 27, train_loss: 0.9484, test_loss: 1.2018, test_f1: 0.4553
 epoch: 28, train_loss: 0.9465, test_loss: 1.2266, test_f1: 0.4703
 epoch: 29, train_loss: 0.9328, test_loss: 1.2409, test_f1: 0.4597
 epoch: 30, train_loss: 0.9483, test_loss: 1.2004, test_f1: 0.4807
 epoch: 31, train_loss: 0.9315, test_loss: 1.1501, test_f1: 0.5183
 epoch: 32, train_loss: 0.9384, test_loss: 1.1662, test_f1: 0.4766
 epoch: 33, train_loss: 0.9306, test_loss: 1.1583, test_f1: 0.4857
 epoch: 34, train_loss: 0.9283, test_loss: 1.1388, test_f1: 0.4855
 epoch: 35, train_loss: 0.9110, test_loss: 1.1252, test_f1: 0.5312
 epoch: 36, train_loss: 0.9199, test_loss: 1.1099, test_f1: 0.5155
 epoch: 37, train_loss: 0.9044, test_loss: 1.1548, test_f1: 0.5139
 epoch: 38, train_loss: 0.9067, test_loss: 1.1366, test_f1: 0.5128
 epoch: 39, train_loss: 0.8976, test_loss: 1.1352, test_f1: 0.4883
 epoch: 40, train_loss: 0.8955, test_loss: 1.1334, test_f1: 0.4928
 epoch: 41, train_loss: 0.8902, test_loss: 1.1486, test_f1: 0.4994
 epoch: 42, train_loss: 0.8812, test_loss: 1.1358, test_f1: 0.4817
 epoch: 43, train_loss: 0.8745, test_loss: 1.1431, test_f1: 0.4964
 epoch: 44, train_loss: 0.8795, test_loss: 1.1397, test_f1: 0.5047
 epoch: 45, train_loss: 0.9017, test_loss: 1.1524, test_f1: 0.5399
 epoch: 46, train_loss: 0.8749, test_loss: 1.1305, test_f1: 0.5284
 epoch: 47, train_loss: 0.8782, test_loss: 1.1346, test_f1: 0.5145
 epoch: 48, train_loss: 0.8674, test_loss: 1.1419, test_f1: 0.4709
 epoch: 49, train_loss: 0.8758, test_loss: 1.1189, test_f1: 0.5398
 epoch: 50, train_loss: 0.8567, test_loss: 1.1608, test_f1: 0.5170
 epoch: 51, train_loss: 0.8661, test_loss: 1.1583, test_f1: 0.5182
 epoch: 52, train_loss: 0.8675, test_loss: 1.1443, test_f1: 0.5085
 epoch: 53, train_loss: 0.8685, test_loss: 1.1464, test_f1: 0.5068
 epoch: 54, train_loss: 0.8620, test_loss: 1.1625, test_f1: 0.5040
 epoch: 55, train_loss: 0.8365, test_loss: 1.1733, test_f1: 0.5150
 epoch: 56, train_loss: 0.8492, test_loss: 1.1772, test_f1: 0.5154
 epoch: 57, train_loss: 0.8456, test_loss: 1.1575, test_f1: 0.5264
 epoch: 58, train_loss: 0.8454, test_loss: 1.1463, test_f1: 0.5272
 epoch: 59, train_loss: 0.8633, test_loss: 1.1485, test_f1: 0.5369
 epoch: 60, train_loss: 0.8585, test_loss: 1.1454, test_f1: 0.5081
 epoch: 61, train_loss: 0.8453, test_loss: 1.1653, test_f1: 0.5238
 epoch: 62, train_loss: 0.8438, test_loss: 1.1646, test_f1: 0.5091
 epoch: 63, train_loss: 0.8347, test_loss: 1.1657, test_f1: 0.5170
 epoch: 64, train_loss: 0.8416, test_loss: 1.1641, test_f1: 0.5419
 epoch: 65, train_loss: 0.8343, test_loss: 1.1768, test_f1: 0.4977
 epoch: 66, train_loss: 0.8252, test_loss: 1.1505, test_f1: 0.5254
 epoch: 67, train_loss: 0.8309, test_loss: 1.1579, test_f1: 0.5181
 epoch: 68, train_loss: 0.8264, test_loss: 1.1555, test_f1: 0.5295
 epoch: 69, train_loss: 0.8397, test_loss: 1.1496, test_f1: 0.5233
 epoch: 70, train_loss: 0.8341, test_loss: 1.1644, test_f1: 0.5236
 epoch: 71, train_loss: 0.8384, test_loss: 1.1770, test_f1: 0.5260
 epoch: 72, train_loss: 0.8438, test_loss: 1.1979, test_f1: 0.5083
 epoch: 73, train_loss: 0.8316, test_loss: 1.1834, test_f1: 0.4928
 epoch: 74, train_loss: 0.8203, test_loss: 1.2153, test_f1: 0.5318
 epoch: 75, train_loss: 0.8174, test_loss: 1.1937, test_f1: 0.5239
 epoch: 76, train_loss: 0.8291, test_loss: 1.2157, test_f1: 0.4942
 epoch: 77, train_loss: 0.8141, test_loss: 1.2129, test_f1: 0.5033
 epoch: 78, train_loss: 0.8043, test_loss: 1.2041, test_f1: 0.5435
 epoch: 79, train_loss: 0.8202, test_loss: 1.2149, test_f1: 0.5331
 epoch: 80, train_loss: 0.8257, test_loss: 1.2201, test_f1: 0.5265
 epoch: 81, train_loss: 0.8123, test_loss: 1.2476, test_f1: 0.5077
 epoch: 82, train_loss: 0.8195, test_loss: 1.2443, test_f1: 0.5340
 epoch: 83, train_loss: 0.8015, test_loss: 1.2836, test_f1: 0.5334
 epoch: 84, train_loss: 0.8101, test_loss: 1.2696, test_f1: 0.5124
 epoch: 85, train_loss: 0.8123, test_loss: 1.2353, test_f1: 0.5291
 epoch: 86, train_loss: 0.8150, test_loss: 1.2368, test_f1: 0.5187
 epoch: 87, train_loss: 0.8080, test_loss: 1.2539, test_f1: 0.5306
 epoch: 88, train_loss: 0.8033, test_loss: 1.2590, test_f1: 0.5130
 epoch: 89, train_loss: 0.8045, test_loss: 1.2286, test_f1: 0.5178
 epoch: 90, train_loss: 0.8066, test_loss: 1.2588, test_f1: 0.5020
 epoch: 91, train_loss: 0.8110, test_loss: 1.2378, test_f1: 0.5112
 epoch: 92, train_loss: 0.8238, test_loss: 1.2164, test_f1: 0.5295
 epoch: 93, train_loss: 0.8033, test_loss: 1.2010, test_f1: 0.5403
 epoch: 94, train_loss: 0.7866, test_loss: 1.2042, test_f1: 0.5132
 epoch: 95, train_loss: 0.8028, test_loss: 1.2576, test_f1: 0.5117
 epoch: 96, train_loss: 0.8152, test_loss: 1.2090, test_f1: 0.5214
 epoch: 97, train_loss: 0.8115, test_loss: 1.1916, test_f1: 0.5452
 epoch: 98, train_loss: 0.7973, test_loss: 1.1985, test_f1: 0.5553
 epoch: 99, train_loss: 0.7958, test_loss: 1.2563, test_f1: 0.5261
##################ITERATION #9 ****************************************
 epoch: 0, train_loss: 1.4504, test_loss: 1.3488, test_f1: 0.2281
 epoch: 1, train_loss: 1.2813, test_loss: 1.3026, test_f1: 0.2281
 epoch: 2, train_loss: 1.2557, test_loss: 1.2738, test_f1: 0.2248
 epoch: 3, train_loss: 1.2306, test_loss: 1.2566, test_f1: 0.2292
 epoch: 4, train_loss: 1.2236, test_loss: 1.2450, test_f1: 0.2348
 epoch: 5, train_loss: 1.2034, test_loss: 1.2254, test_f1: 0.2510
 epoch: 6, train_loss: 1.2083, test_loss: 1.2136, test_f1: 0.2616
 epoch: 7, train_loss: 1.1810, test_loss: 1.2173, test_f1: 0.2676
 epoch: 8, train_loss: 1.1658, test_loss: 1.2224, test_f1: 0.3039
 epoch: 9, train_loss: 1.1635, test_loss: 1.2221, test_f1: 0.2969
 epoch: 10, train_loss: 1.1495, test_loss: 1.2304, test_f1: 0.3077
 epoch: 11, train_loss: 1.1561, test_loss: 1.2274, test_f1: 0.3114
 epoch: 12, train_loss: 1.1472, test_loss: 1.2072, test_f1: 0.3077
 epoch: 13, train_loss: 1.1463, test_loss: 1.2173, test_f1: 0.3208
 epoch: 14, train_loss: 1.1301, test_loss: 1.2118, test_f1: 0.3216
 epoch: 15, train_loss: 1.1408, test_loss: 1.1959, test_f1: 0.3558
 epoch: 16, train_loss: 1.1170, test_loss: 1.1908, test_f1: 0.3694
 epoch: 17, train_loss: 1.1047, test_loss: 1.2075, test_f1: 0.3860
 epoch: 18, train_loss: 1.1126, test_loss: 1.1930, test_f1: 0.4031
 epoch: 19, train_loss: 1.1048, test_loss: 1.1808, test_f1: 0.3703
 epoch: 20, train_loss: 1.0951, test_loss: 1.1623, test_f1: 0.3982
 epoch: 21, train_loss: 1.0781, test_loss: 1.1645, test_f1: 0.4012
 epoch: 22, train_loss: 1.0934, test_loss: 1.1601, test_f1: 0.4008
 epoch: 23, train_loss: 1.0628, test_loss: 1.1477, test_f1: 0.3745
 epoch: 24, train_loss: 1.0633, test_loss: 1.1752, test_f1: 0.3740
 epoch: 25, train_loss: 1.0587, test_loss: 1.1683, test_f1: 0.3818
 epoch: 26, train_loss: 1.0797, test_loss: 1.1513, test_f1: 0.4107
 epoch: 27, train_loss: 1.0501, test_loss: 1.1546, test_f1: 0.3963
 epoch: 28, train_loss: 1.0540, test_loss: 1.1426, test_f1: 0.4041
 epoch: 29, train_loss: 1.0487, test_loss: 1.1378, test_f1: 0.3740
 epoch: 30, train_loss: 1.0185, test_loss: 1.1583, test_f1: 0.4107
 epoch: 31, train_loss: 1.0184, test_loss: 1.1732, test_f1: 0.3918
 epoch: 32, train_loss: 1.0190, test_loss: 1.1542, test_f1: 0.4133
 epoch: 33, train_loss: 1.0061, test_loss: 1.1612, test_f1: 0.4448
 epoch: 34, train_loss: 1.0091, test_loss: 1.1305, test_f1: 0.4541
 epoch: 35, train_loss: 1.0021, test_loss: 1.1555, test_f1: 0.3997
 epoch: 36, train_loss: 1.0051, test_loss: 1.1688, test_f1: 0.4225
 epoch: 37, train_loss: 0.9914, test_loss: 1.1472, test_f1: 0.4088
 epoch: 38, train_loss: 0.9782, test_loss: 1.1109, test_f1: 0.4535
 epoch: 39, train_loss: 0.9520, test_loss: 1.1083, test_f1: 0.4335
 epoch: 40, train_loss: 0.9723, test_loss: 1.1114, test_f1: 0.4425
 epoch: 41, train_loss: 0.9729, test_loss: 1.1428, test_f1: 0.4045
 epoch: 42, train_loss: 0.9634, test_loss: 1.1527, test_f1: 0.4092
 epoch: 43, train_loss: 0.9427, test_loss: 1.1706, test_f1: 0.3663
 epoch: 44, train_loss: 0.9610, test_loss: 1.2407, test_f1: 0.4038
 epoch: 45, train_loss: 0.9554, test_loss: 1.2175, test_f1: 0.4341
 epoch: 46, train_loss: 0.9409, test_loss: 1.2147, test_f1: 0.3932
 epoch: 47, train_loss: 0.9446, test_loss: 1.1906, test_f1: 0.3689
 epoch: 48, train_loss: 0.9255, test_loss: 1.1371, test_f1: 0.4112
 epoch: 49, train_loss: 0.9347, test_loss: 1.1717, test_f1: 0.4748
 epoch: 50, train_loss: 0.9100, test_loss: 1.0914, test_f1: 0.4591
 epoch: 51, train_loss: 0.9215, test_loss: 1.1458, test_f1: 0.4010
 epoch: 52, train_loss: 0.9170, test_loss: 1.2791, test_f1: 0.3772
 epoch: 53, train_loss: 0.9258, test_loss: 1.3156, test_f1: 0.4016
 epoch: 54, train_loss: 0.9077, test_loss: 1.2431, test_f1: 0.3860
 epoch: 55, train_loss: 0.9022, test_loss: 1.1603, test_f1: 0.3784
 epoch: 56, train_loss: 0.9049, test_loss: 1.1515, test_f1: 0.3995
 epoch: 57, train_loss: 0.9038, test_loss: 1.2206, test_f1: 0.4154
 epoch: 58, train_loss: 0.8982, test_loss: 1.2146, test_f1: 0.3990
 epoch: 59, train_loss: 0.8845, test_loss: 1.1994, test_f1: 0.4022
 epoch: 60, train_loss: 0.8839, test_loss: 1.2052, test_f1: 0.4313
 epoch: 61, train_loss: 0.8809, test_loss: 1.2065, test_f1: 0.4128
 epoch: 62, train_loss: 0.8730, test_loss: 1.2878, test_f1: 0.3868
 epoch: 63, train_loss: 0.9063, test_loss: 1.2450, test_f1: 0.4319
 epoch: 64, train_loss: 0.8755, test_loss: 1.2522, test_f1: 0.4018
 epoch: 65, train_loss: 0.8739, test_loss: 1.1631, test_f1: 0.4502
 epoch: 66, train_loss: 0.8768, test_loss: 1.2334, test_f1: 0.4828
 epoch: 67, train_loss: 0.8786, test_loss: 1.1817, test_f1: 0.4704
 epoch: 68, train_loss: 0.8532, test_loss: 1.2139, test_f1: 0.4201
 epoch: 69, train_loss: 0.8772, test_loss: 1.2097, test_f1: 0.4635
 epoch: 70, train_loss: 0.8698, test_loss: 1.2733, test_f1: 0.4666
 epoch: 71, train_loss: 0.8501, test_loss: 1.3433, test_f1: 0.4762
 epoch: 72, train_loss: 0.8686, test_loss: 1.3228, test_f1: 0.4887
 epoch: 73, train_loss: 0.8652, test_loss: 1.3537, test_f1: 0.4801
 epoch: 74, train_loss: 0.8490, test_loss: 1.3767, test_f1: 0.4631
 epoch: 75, train_loss: 0.8519, test_loss: 1.2759, test_f1: 0.5054
 epoch: 76, train_loss: 0.8526, test_loss: 1.2823, test_f1: 0.4681
 epoch: 77, train_loss: 0.8526, test_loss: 1.3053, test_f1: 0.4282
 epoch: 78, train_loss: 0.8470, test_loss: 1.2871, test_f1: 0.4497
 epoch: 79, train_loss: 0.8399, test_loss: 1.3122, test_f1: 0.4422
 epoch: 80, train_loss: 0.8373, test_loss: 1.3136, test_f1: 0.4500
 epoch: 81, train_loss: 0.8438, test_loss: 1.2988, test_f1: 0.4515
 epoch: 82, train_loss: 0.8331, test_loss: 1.3849, test_f1: 0.4356
 epoch: 83, train_loss: 0.8364, test_loss: 1.4194, test_f1: 0.4213
 epoch: 84, train_loss: 0.8378, test_loss: 1.3941, test_f1: 0.4457
 epoch: 85, train_loss: 0.8319, test_loss: 1.3669, test_f1: 0.4763
 epoch: 86, train_loss: 0.8405, test_loss: 1.3052, test_f1: 0.4702
 epoch: 87, train_loss: 0.8497, test_loss: 1.2708, test_f1: 0.4696
 epoch: 88, train_loss: 0.8268, test_loss: 1.3066, test_f1: 0.4641
 epoch: 89, train_loss: 0.8301, test_loss: 1.2412, test_f1: 0.4417
 epoch: 90, train_loss: 0.8347, test_loss: 1.2473, test_f1: 0.4571
 epoch: 91, train_loss: 0.8210, test_loss: 1.2780, test_f1: 0.4756
 epoch: 92, train_loss: 0.8373, test_loss: 1.2891, test_f1: 0.4496
 epoch: 93, train_loss: 0.8287, test_loss: 1.2710, test_f1: 0.4626
 epoch: 94, train_loss: 0.8183, test_loss: 1.3220, test_f1: 0.4274
 epoch: 95, train_loss: 0.8292, test_loss: 1.2894, test_f1: 0.4583
 epoch: 96, train_loss: 0.8244, test_loss: 1.2644, test_f1: 0.4643
 epoch: 97, train_loss: 0.8460, test_loss: 1.3432, test_f1: 0.4033
 epoch: 98, train_loss: 0.8299, test_loss: 1.3428, test_f1: 0.4576
 epoch: 99, train_loss: 0.8174, test_loss: 1.3484, test_f1: 0.4569

Training completed in 367.78 seconds
Best F1: 0.5747 at epoch 47
Mean F1 across iterations: 0.5468  0.0218
========================FINAL RESULTS================================
FEGIN weighted F1: 0.5747  0.0218
python main.py --data ltspice_demos --representation component_component --model FEGIN --layers 5 --hiddens 16 --batch_size 128 --lr 0.001 --emb_size 128 --epochs 100 --save_appendix component_component_L5_H16_BS128_LR0.001_E128 --no_val
-----



STDERR:
Processing...
Done!
  File "main.py", line 370, in <module>
    main()
  File "main.py", line 254, in main
    dataset = dataset_class(
  File "/home/philip/projects/ltspice_examples_code_repo/Circuit-Completion-Using-GNNs/component_classification_with_link_prediction_head/evaluation/FEGIN/kernel/circuit_datasets.py", line 15, in __init__
    self.data, self.slices = torch.load(self.processed_paths[0])
  File "/home/philip/.local/lib/python3.8/site-packages/torch/serialization.py", line 1040, in load
    warnings.warn(
  File "/usr/lib/python3.8/warnings.py", line 109, in _showwarnmsg
    sw(msg.message, msg.category, msg.filename, msg.lineno,
  File "main.py", line 47, in warn_with_traceback
    traceback.print_stack(file=log)
/home/philip/projects/ltspice_examples_code_repo/Circuit-Completion-Using-GNNs/component_classification_with_link_prediction_head/evaluation/FEGIN/kernel/circuit_datasets.py:15: FutureWarning: You are using `torch.load` with `weights_only=False` (the current default value), which uses the default pickle module implicitly. It is possible to construct malicious pickle data which will execute arbitrary code during unpickling (See https://github.com/pytorch/pytorch/blob/main/SECURITY.md#untrusted-models for more details). In a future release, the default value for `weights_only` will be flipped to `True`. This limits the functions that could be executed during unpickling. Arbitrary objects will no longer be allowed to be loaded via this mode unless they are explicitly allowlisted by the user via `torch.serialization.add_safe_globals`. We recommend you start setting `weights_only=True` for any use case where you don't have full control of the loaded file. Please open an issue on GitHub for any issues related to this experimental feature.
  self.data, self.slices = torch.load(self.processed_paths[0])
