STDOUT:
Results will be saved in /home/philip/projects/ltspice_examples_code_repo/Circuit-Completion-Using-GNNs/component_classification_with_link_prediction_head/evaluation/FEGIN/results/model_FEGIN_dataset_ltspice_examples
Command line input: python main.py --data ltspice_examples --representation component_pin --model FEGIN --layers 6 --hiddens 32 --batch_size 32 --lr 0.01 --emb_size 512 --epochs 100 --save_appendix component_pin_L6_H32_BS32_LR0.01_E512 --no_val
 is saved.
-----
ltspice_examples - FEGIN
Using 6 layers, 32 hidden units, h = 2
Loading component_pin representation dataset
ENTERED
Training FEGIN on component_pin representation
Train: 3560, Test: 848
##################ITERATION #0 ****************************************
 epoch: 0, train_loss: 1.1717, test_loss: 1.4043, test_f1: 0.3316
 epoch: 1, train_loss: 1.0557, test_loss: 1.2199, test_f1: 0.3378
 epoch: 2, train_loss: 1.0241, test_loss: 1.1087, test_f1: 0.4321
 epoch: 3, train_loss: 1.0022, test_loss: 1.0280, test_f1: 0.5022
 epoch: 4, train_loss: 0.9843, test_loss: 1.0977, test_f1: 0.4554
 epoch: 5, train_loss: 0.9613, test_loss: 1.1709, test_f1: 0.4605
 epoch: 6, train_loss: 0.9784, test_loss: 0.9043, test_f1: 0.5311
 epoch: 7, train_loss: 0.9391, test_loss: 0.9277, test_f1: 0.5289
 epoch: 8, train_loss: 0.9351, test_loss: 0.9083, test_f1: 0.5080
 epoch: 9, train_loss: 0.9047, test_loss: 1.0171, test_f1: 0.4547
 epoch: 10, train_loss: 0.8965, test_loss: 0.9747, test_f1: 0.4888
 epoch: 11, train_loss: 0.9021, test_loss: 0.8976, test_f1: 0.5260
 epoch: 12, train_loss: 0.8927, test_loss: 1.0058, test_f1: 0.4699
 epoch: 13, train_loss: 0.8818, test_loss: 0.9010, test_f1: 0.5887
 epoch: 14, train_loss: 0.8716, test_loss: 0.8581, test_f1: 0.5397
 epoch: 15, train_loss: 0.8806, test_loss: 0.9805, test_f1: 0.5050
 epoch: 16, train_loss: 0.8624, test_loss: 0.8757, test_f1: 0.5194
 epoch: 17, train_loss: 0.8616, test_loss: 0.8787, test_f1: 0.5930
 epoch: 18, train_loss: 0.8487, test_loss: 0.9503, test_f1: 0.4999
 epoch: 19, train_loss: 0.8554, test_loss: 0.9886, test_f1: 0.4768
 epoch: 20, train_loss: 0.8460, test_loss: 0.9143, test_f1: 0.5282
 epoch: 21, train_loss: 0.8342, test_loss: 0.8904, test_f1: 0.5380
 epoch: 22, train_loss: 0.8435, test_loss: 0.9293, test_f1: 0.5091
 epoch: 23, train_loss: 0.8275, test_loss: 0.8856, test_f1: 0.5097
 epoch: 24, train_loss: 0.8241, test_loss: 0.8234, test_f1: 0.5464
 epoch: 25, train_loss: 0.8257, test_loss: 0.8496, test_f1: 0.5796
 epoch: 26, train_loss: 0.8025, test_loss: 0.8866, test_f1: 0.5438
 epoch: 27, train_loss: 0.8052, test_loss: 0.8338, test_f1: 0.5588
 epoch: 28, train_loss: 0.7920, test_loss: 1.0425, test_f1: 0.5436
 epoch: 29, train_loss: 0.8177, test_loss: 0.8390, test_f1: 0.5756
 epoch: 30, train_loss: 0.8012, test_loss: 0.8750, test_f1: 0.5937
 epoch: 31, train_loss: 0.8021, test_loss: 0.9003, test_f1: 0.5604
 epoch: 32, train_loss: 0.8020, test_loss: 0.8692, test_f1: 0.5642
 epoch: 33, train_loss: 0.7818, test_loss: 0.8879, test_f1: 0.5763
 epoch: 34, train_loss: 0.7935, test_loss: 0.8373, test_f1: 0.5627
 epoch: 35, train_loss: 0.7784, test_loss: 0.8821, test_f1: 0.5795
 epoch: 36, train_loss: 0.7730, test_loss: 0.9059, test_f1: 0.6195
 epoch: 37, train_loss: 0.7964, test_loss: 0.8795, test_f1: 0.6157
 epoch: 38, train_loss: 0.7690, test_loss: 0.9248, test_f1: 0.5525
 epoch: 39, train_loss: 0.7684, test_loss: 0.8839, test_f1: 0.5681
 epoch: 40, train_loss: 0.7617, test_loss: 0.9480, test_f1: 0.5346
 epoch: 41, train_loss: 0.7621, test_loss: 0.8805, test_f1: 0.5653
 epoch: 42, train_loss: 0.7586, test_loss: 0.8733, test_f1: 0.5580
 epoch: 43, train_loss: 0.7767, test_loss: 0.8642, test_f1: 0.5822
 epoch: 44, train_loss: 0.7488, test_loss: 0.7690, test_f1: 0.5510
 epoch: 45, train_loss: 0.7505, test_loss: 0.8589, test_f1: 0.5697
 epoch: 46, train_loss: 0.7409, test_loss: 0.9751, test_f1: 0.5651
 epoch: 47, train_loss: 0.7610, test_loss: 0.7824, test_f1: 0.6117
 epoch: 48, train_loss: 0.7438, test_loss: 0.7872, test_f1: 0.6031
 epoch: 49, train_loss: 0.7416, test_loss: 0.8828, test_f1: 0.5905
 epoch: 50, train_loss: 0.7327, test_loss: 0.8748, test_f1: 0.5679
 epoch: 51, train_loss: 0.7180, test_loss: 0.8667, test_f1: 0.5802
 epoch: 52, train_loss: 0.7113, test_loss: 0.8721, test_f1: 0.6076
 epoch: 53, train_loss: 0.6992, test_loss: 0.8141, test_f1: 0.6156
 epoch: 54, train_loss: 0.6926, test_loss: 0.8428, test_f1: 0.6167
 epoch: 55, train_loss: 0.6998, test_loss: 0.7669, test_f1: 0.6313
 epoch: 56, train_loss: 0.6883, test_loss: 0.8821, test_f1: 0.5699
 epoch: 57, train_loss: 0.6919, test_loss: 0.7942, test_f1: 0.5979
 epoch: 58, train_loss: 0.6720, test_loss: 0.9387, test_f1: 0.5861
 epoch: 59, train_loss: 0.6855, test_loss: 0.9014, test_f1: 0.5770
 epoch: 60, train_loss: 0.6716, test_loss: 0.9121, test_f1: 0.6160
 epoch: 61, train_loss: 0.6854, test_loss: 0.8276, test_f1: 0.6278
 epoch: 62, train_loss: 0.6652, test_loss: 0.9492, test_f1: 0.6330
 epoch: 63, train_loss: 0.6551, test_loss: 0.8912, test_f1: 0.6479
 epoch: 64, train_loss: 0.6870, test_loss: 0.8755, test_f1: 0.6006
 epoch: 65, train_loss: 0.6658, test_loss: 0.8402, test_f1: 0.6266
 epoch: 66, train_loss: 0.6857, test_loss: 0.8377, test_f1: 0.6225
 epoch: 67, train_loss: 0.6678, test_loss: 0.8345, test_f1: 0.6172
 epoch: 68, train_loss: 0.6712, test_loss: 0.8696, test_f1: 0.6081
 epoch: 69, train_loss: 0.6617, test_loss: 0.8447, test_f1: 0.6302
 epoch: 70, train_loss: 0.6432, test_loss: 0.8138, test_f1: 0.6467
 epoch: 71, train_loss: 0.6496, test_loss: 0.8229, test_f1: 0.6041
 epoch: 72, train_loss: 0.6585, test_loss: 0.7645, test_f1: 0.6431
 epoch: 73, train_loss: 0.6480, test_loss: 0.8464, test_f1: 0.5986
 epoch: 74, train_loss: 0.6446, test_loss: 0.8928, test_f1: 0.6057
 epoch: 75, train_loss: 0.6516, test_loss: 0.9040, test_f1: 0.5963
 epoch: 76, train_loss: 0.6588, test_loss: 0.9073, test_f1: 0.6412
 epoch: 77, train_loss: 0.6536, test_loss: 0.8498, test_f1: 0.6143
 epoch: 78, train_loss: 0.6584, test_loss: 0.8986, test_f1: 0.6362
 epoch: 79, train_loss: 0.6459, test_loss: 0.9612, test_f1: 0.6044
 epoch: 80, train_loss: 0.6496, test_loss: 0.8972, test_f1: 0.6156
 epoch: 81, train_loss: 0.6400, test_loss: 0.9113, test_f1: 0.6302
 epoch: 82, train_loss: 0.6322, test_loss: 0.8711, test_f1: 0.6288
 epoch: 83, train_loss: 0.6492, test_loss: 0.7971, test_f1: 0.6402
 epoch: 84, train_loss: 0.6441, test_loss: 0.8703, test_f1: 0.6150
 epoch: 85, train_loss: 0.6211, test_loss: 0.8924, test_f1: 0.6350
 epoch: 86, train_loss: 0.6351, test_loss: 0.8879, test_f1: 0.6397
 epoch: 87, train_loss: 0.6453, test_loss: 0.9031, test_f1: 0.6097
 epoch: 88, train_loss: 0.6318, test_loss: 0.9124, test_f1: 0.6159
 epoch: 89, train_loss: 0.6144, test_loss: 0.9342, test_f1: 0.6386
 epoch: 90, train_loss: 0.6387, test_loss: 0.8894, test_f1: 0.6287
 epoch: 91, train_loss: 0.6325, test_loss: 0.9032, test_f1: 0.6499
 epoch: 92, train_loss: 0.6320, test_loss: 0.9159, test_f1: 0.6417
 epoch: 93, train_loss: 0.6258, test_loss: 0.8608, test_f1: 0.6060
 epoch: 94, train_loss: 0.6343, test_loss: 0.8351, test_f1: 0.6469
 epoch: 95, train_loss: 0.6182, test_loss: 0.8585, test_f1: 0.6499
 epoch: 96, train_loss: 0.6296, test_loss: 0.9234, test_f1: 0.6478
 epoch: 97, train_loss: 0.6230, test_loss: 0.9282, test_f1: 0.6428
 epoch: 98, train_loss: 0.6110, test_loss: 0.9203, test_f1: 0.6566
 epoch: 99, train_loss: 0.6141, test_loss: 0.8638, test_f1: 0.6275
##################ITERATION #1 ****************************************
 epoch: 0, train_loss: 1.1317, test_loss: 1.0621, test_f1: 0.3531
 epoch: 1, train_loss: 1.0464, test_loss: 1.1109, test_f1: 0.4246
 epoch: 2, train_loss: 1.0030, test_loss: 1.0563, test_f1: 0.4093
 epoch: 3, train_loss: 0.9934, test_loss: 0.9623, test_f1: 0.4870
 epoch: 4, train_loss: 0.9763, test_loss: 1.1038, test_f1: 0.4783
 epoch: 5, train_loss: 0.9760, test_loss: 1.0948, test_f1: 0.4521
 epoch: 6, train_loss: 0.9547, test_loss: 0.9846, test_f1: 0.5420
 epoch: 7, train_loss: 0.9439, test_loss: 1.1011, test_f1: 0.4573
 epoch: 8, train_loss: 0.9370, test_loss: 0.9509, test_f1: 0.5727
 epoch: 9, train_loss: 0.9187, test_loss: 0.9003, test_f1: 0.5673
 epoch: 10, train_loss: 0.9011, test_loss: 0.9567, test_f1: 0.4889
 epoch: 11, train_loss: 0.9168, test_loss: 0.9701, test_f1: 0.5391
 epoch: 12, train_loss: 0.9149, test_loss: 0.9432, test_f1: 0.5141
 epoch: 13, train_loss: 0.9105, test_loss: 1.2908, test_f1: 0.3723
 epoch: 14, train_loss: 0.9120, test_loss: 0.9747, test_f1: 0.5357
 epoch: 15, train_loss: 0.9091, test_loss: 0.9706, test_f1: 0.5291
 epoch: 16, train_loss: 0.8911, test_loss: 0.9634, test_f1: 0.5227
 epoch: 17, train_loss: 0.8756, test_loss: 0.9083, test_f1: 0.5580
 epoch: 18, train_loss: 0.8851, test_loss: 0.8831, test_f1: 0.5869
 epoch: 19, train_loss: 0.8837, test_loss: 0.9695, test_f1: 0.5367
 epoch: 20, train_loss: 0.8745, test_loss: 0.8886, test_f1: 0.5311
 epoch: 21, train_loss: 0.8717, test_loss: 0.8417, test_f1: 0.5350
 epoch: 22, train_loss: 0.8608, test_loss: 0.8167, test_f1: 0.5629
 epoch: 23, train_loss: 0.8640, test_loss: 0.8906, test_f1: 0.5814
 epoch: 24, train_loss: 0.8767, test_loss: 1.0344, test_f1: 0.5114
 epoch: 25, train_loss: 0.8494, test_loss: 0.9693, test_f1: 0.4798
 epoch: 26, train_loss: 0.8404, test_loss: 0.8949, test_f1: 0.5311
 epoch: 27, train_loss: 0.8469, test_loss: 0.8188, test_f1: 0.5535
 epoch: 28, train_loss: 0.8465, test_loss: 0.8518, test_f1: 0.5329
 epoch: 29, train_loss: 0.8340, test_loss: 0.9891, test_f1: 0.5103
 epoch: 30, train_loss: 0.8386, test_loss: 0.8030, test_f1: 0.5728
 epoch: 31, train_loss: 0.8196, test_loss: 0.9339, test_f1: 0.5131
 epoch: 32, train_loss: 0.8353, test_loss: 0.8488, test_f1: 0.5981
 epoch: 33, train_loss: 0.8249, test_loss: 0.8408, test_f1: 0.5960
 epoch: 34, train_loss: 0.8281, test_loss: 0.8866, test_f1: 0.5684
 epoch: 35, train_loss: 0.8261, test_loss: 0.8545, test_f1: 0.5559
 epoch: 36, train_loss: 0.7994, test_loss: 0.8129, test_f1: 0.5668
 epoch: 37, train_loss: 0.8031, test_loss: 0.9065, test_f1: 0.5684
 epoch: 38, train_loss: 0.8123, test_loss: 0.8550, test_f1: 0.5760
 epoch: 39, train_loss: 0.7961, test_loss: 0.8808, test_f1: 0.6292
 epoch: 40, train_loss: 0.8129, test_loss: 1.2883, test_f1: 0.4948
 epoch: 41, train_loss: 0.8173, test_loss: 0.8533, test_f1: 0.5789
 epoch: 42, train_loss: 0.7919, test_loss: 0.8371, test_f1: 0.5595
 epoch: 43, train_loss: 0.7997, test_loss: 0.8650, test_f1: 0.6047
 epoch: 44, train_loss: 0.7927, test_loss: 0.8729, test_f1: 0.5446
 epoch: 45, train_loss: 0.7908, test_loss: 0.8332, test_f1: 0.6094
 epoch: 46, train_loss: 0.7830, test_loss: 0.8472, test_f1: 0.5839
 epoch: 47, train_loss: 0.7779, test_loss: 0.8424, test_f1: 0.5540
 epoch: 48, train_loss: 0.7794, test_loss: 0.9634, test_f1: 0.5534
 epoch: 49, train_loss: 0.7916, test_loss: 0.8906, test_f1: 0.5705
 epoch: 50, train_loss: 0.7949, test_loss: 0.8174, test_f1: 0.5160
 epoch: 51, train_loss: 0.7542, test_loss: 0.8153, test_f1: 0.5477
 epoch: 52, train_loss: 0.7563, test_loss: 0.8596, test_f1: 0.5675
 epoch: 53, train_loss: 0.7343, test_loss: 0.7722, test_f1: 0.6038
 epoch: 54, train_loss: 0.7271, test_loss: 0.7520, test_f1: 0.6002
 epoch: 55, train_loss: 0.7215, test_loss: 0.8487, test_f1: 0.5713
 epoch: 56, train_loss: 0.7182, test_loss: 0.8186, test_f1: 0.5704
 epoch: 57, train_loss: 0.7169, test_loss: 0.8462, test_f1: 0.5700
 epoch: 58, train_loss: 0.7070, test_loss: 0.7672, test_f1: 0.5981
 epoch: 59, train_loss: 0.7300, test_loss: 0.7847, test_f1: 0.6090
 epoch: 60, train_loss: 0.7035, test_loss: 0.8296, test_f1: 0.6095
 epoch: 61, train_loss: 0.7124, test_loss: 0.7940, test_f1: 0.5810
 epoch: 62, train_loss: 0.7048, test_loss: 0.8254, test_f1: 0.5900
 epoch: 63, train_loss: 0.7045, test_loss: 0.8374, test_f1: 0.6028
 epoch: 64, train_loss: 0.7023, test_loss: 0.8280, test_f1: 0.5972
 epoch: 65, train_loss: 0.6902, test_loss: 0.8231, test_f1: 0.6169
 epoch: 66, train_loss: 0.7087, test_loss: 0.8634, test_f1: 0.5784
 epoch: 67, train_loss: 0.7069, test_loss: 0.7624, test_f1: 0.5880
 epoch: 68, train_loss: 0.6907, test_loss: 0.7942, test_f1: 0.6007
 epoch: 69, train_loss: 0.6918, test_loss: 0.8181, test_f1: 0.6158
 epoch: 70, train_loss: 0.6950, test_loss: 0.7960, test_f1: 0.6212
 epoch: 71, train_loss: 0.6964, test_loss: 0.8486, test_f1: 0.6155
 epoch: 72, train_loss: 0.6881, test_loss: 0.7478, test_f1: 0.6359
 epoch: 73, train_loss: 0.6799, test_loss: 0.8997, test_f1: 0.5964
 epoch: 74, train_loss: 0.6748, test_loss: 0.8215, test_f1: 0.6213
 epoch: 75, train_loss: 0.6782, test_loss: 0.7868, test_f1: 0.6253
 epoch: 76, train_loss: 0.6861, test_loss: 0.7978, test_f1: 0.6234
 epoch: 77, train_loss: 0.6767, test_loss: 0.8144, test_f1: 0.5953
 epoch: 78, train_loss: 0.6871, test_loss: 0.7978, test_f1: 0.6376
 epoch: 79, train_loss: 0.6844, test_loss: 0.8619, test_f1: 0.5952
 epoch: 80, train_loss: 0.6807, test_loss: 0.8278, test_f1: 0.6008
 epoch: 81, train_loss: 0.6678, test_loss: 0.8162, test_f1: 0.6050
 epoch: 82, train_loss: 0.6847, test_loss: 0.8240, test_f1: 0.6289
 epoch: 83, train_loss: 0.6678, test_loss: 0.7951, test_f1: 0.6265
 epoch: 84, train_loss: 0.6613, test_loss: 0.8724, test_f1: 0.6074
 epoch: 85, train_loss: 0.6521, test_loss: 0.7839, test_f1: 0.6009
 epoch: 86, train_loss: 0.6451, test_loss: 0.7959, test_f1: 0.6211
 epoch: 87, train_loss: 0.6779, test_loss: 0.8414, test_f1: 0.6348
 epoch: 88, train_loss: 0.6724, test_loss: 0.8173, test_f1: 0.6339
 epoch: 89, train_loss: 0.6519, test_loss: 0.8952, test_f1: 0.5916
 epoch: 90, train_loss: 0.6607, test_loss: 0.8066, test_f1: 0.6382
 epoch: 91, train_loss: 0.6552, test_loss: 0.8492, test_f1: 0.6223
 epoch: 92, train_loss: 0.6541, test_loss: 0.8249, test_f1: 0.6142
 epoch: 93, train_loss: 0.6498, test_loss: 0.8001, test_f1: 0.6240
 epoch: 94, train_loss: 0.6554, test_loss: 0.8226, test_f1: 0.6367
 epoch: 95, train_loss: 0.6587, test_loss: 0.8299, test_f1: 0.6380
 epoch: 96, train_loss: 0.6578, test_loss: 0.8545, test_f1: 0.6309
 epoch: 97, train_loss: 0.6568, test_loss: 0.8522, test_f1: 0.6265
 epoch: 98, train_loss: 0.6424, test_loss: 0.8893, test_f1: 0.6160
 epoch: 99, train_loss: 0.6383, test_loss: 0.8751, test_f1: 0.6164
##################ITERATION #2 ****************************************
 epoch: 0, train_loss: 1.1318, test_loss: 1.0563, test_f1: 0.4237
 epoch: 1, train_loss: 1.0203, test_loss: 1.0440, test_f1: 0.4253
 epoch: 2, train_loss: 0.9971, test_loss: 0.9959, test_f1: 0.5527
 epoch: 3, train_loss: 0.9567, test_loss: 0.9816, test_f1: 0.5402
 epoch: 4, train_loss: 0.9463, test_loss: 0.9072, test_f1: 0.5322
 epoch: 5, train_loss: 0.9362, test_loss: 0.9210, test_f1: 0.5127
 epoch: 6, train_loss: 0.9343, test_loss: 0.9435, test_f1: 0.5111
 epoch: 7, train_loss: 0.9228, test_loss: 0.9410, test_f1: 0.4616
 epoch: 8, train_loss: 0.9175, test_loss: 0.9419, test_f1: 0.5041
 epoch: 9, train_loss: 0.9393, test_loss: 0.9792, test_f1: 0.5234
 epoch: 10, train_loss: 0.9202, test_loss: 1.0561, test_f1: 0.4573
 epoch: 11, train_loss: 0.9104, test_loss: 0.9842, test_f1: 0.5231
 epoch: 12, train_loss: 0.9054, test_loss: 0.9201, test_f1: 0.5036
 epoch: 13, train_loss: 0.8800, test_loss: 0.9400, test_f1: 0.4614
 epoch: 14, train_loss: 0.8810, test_loss: 0.9169, test_f1: 0.5034
 epoch: 15, train_loss: 0.8755, test_loss: 0.9348, test_f1: 0.5277
 epoch: 16, train_loss: 0.8649, test_loss: 0.9127, test_f1: 0.5219
 epoch: 17, train_loss: 0.8705, test_loss: 0.8736, test_f1: 0.5267
 epoch: 18, train_loss: 0.8669, test_loss: 0.8924, test_f1: 0.5762
 epoch: 19, train_loss: 0.8419, test_loss: 0.9612, test_f1: 0.5281
 epoch: 20, train_loss: 0.8575, test_loss: 0.8447, test_f1: 0.5484
 epoch: 21, train_loss: 0.8323, test_loss: 0.9110, test_f1: 0.5258
 epoch: 22, train_loss: 0.8324, test_loss: 0.8780, test_f1: 0.5541
 epoch: 23, train_loss: 0.8379, test_loss: 0.8700, test_f1: 0.5214
 epoch: 24, train_loss: 0.8310, test_loss: 0.8460, test_f1: 0.5603
 epoch: 25, train_loss: 0.8291, test_loss: 0.8330, test_f1: 0.5291
 epoch: 26, train_loss: 0.8230, test_loss: 0.9237, test_f1: 0.5385
 epoch: 27, train_loss: 0.8181, test_loss: 0.8956, test_f1: 0.5222
 epoch: 28, train_loss: 0.8177, test_loss: 0.8737, test_f1: 0.5310
 epoch: 29, train_loss: 0.8077, test_loss: 1.0231, test_f1: 0.4609
 epoch: 30, train_loss: 0.8108, test_loss: 0.9032, test_f1: 0.5563
 epoch: 31, train_loss: 0.8070, test_loss: 0.8731, test_f1: 0.5492
 epoch: 32, train_loss: 0.7943, test_loss: 0.8759, test_f1: 0.5532
 epoch: 33, train_loss: 0.8016, test_loss: 0.9374, test_f1: 0.5522
 epoch: 34, train_loss: 0.7930, test_loss: 0.9758, test_f1: 0.5690
 epoch: 35, train_loss: 0.7858, test_loss: 0.9095, test_f1: 0.5363
 epoch: 36, train_loss: 0.7995, test_loss: 1.0536, test_f1: 0.5083
 epoch: 37, train_loss: 0.8125, test_loss: 0.9518, test_f1: 0.5144
 epoch: 38, train_loss: 0.7786, test_loss: 0.8892, test_f1: 0.5201
 epoch: 39, train_loss: 0.7754, test_loss: 0.8648, test_f1: 0.5831
 epoch: 40, train_loss: 0.7838, test_loss: 0.8765, test_f1: 0.5874
 epoch: 41, train_loss: 0.7831, test_loss: 0.8413, test_f1: 0.5738
 epoch: 42, train_loss: 0.7661, test_loss: 0.9789, test_f1: 0.5409
 epoch: 43, train_loss: 0.7560, test_loss: 0.8946, test_f1: 0.5540
 epoch: 44, train_loss: 0.7641, test_loss: 0.8617, test_f1: 0.5696
 epoch: 45, train_loss: 0.7553, test_loss: 0.8744, test_f1: 0.6093
 epoch: 46, train_loss: 0.7754, test_loss: 0.8913, test_f1: 0.5475
 epoch: 47, train_loss: 0.7752, test_loss: 0.9252, test_f1: 0.5429
 epoch: 48, train_loss: 0.7520, test_loss: 0.8489, test_f1: 0.5620
 epoch: 49, train_loss: 0.7477, test_loss: 0.9106, test_f1: 0.5528
 epoch: 50, train_loss: 0.7611, test_loss: 0.9454, test_f1: 0.6234
 epoch: 51, train_loss: 0.7323, test_loss: 0.9024, test_f1: 0.5747
 epoch: 52, train_loss: 0.7122, test_loss: 0.8304, test_f1: 0.5974
 epoch: 53, train_loss: 0.7103, test_loss: 0.9253, test_f1: 0.5953
 epoch: 54, train_loss: 0.7077, test_loss: 0.9179, test_f1: 0.6070
 epoch: 55, train_loss: 0.7265, test_loss: 0.9298, test_f1: 0.5695
 epoch: 56, train_loss: 0.7071, test_loss: 1.0156, test_f1: 0.5590
 epoch: 57, train_loss: 0.7189, test_loss: 0.8354, test_f1: 0.6031
 epoch: 58, train_loss: 0.7036, test_loss: 0.8855, test_f1: 0.5984
 epoch: 59, train_loss: 0.7146, test_loss: 0.9562, test_f1: 0.5402
 epoch: 60, train_loss: 0.7223, test_loss: 0.8457, test_f1: 0.6011
 epoch: 61, train_loss: 0.6987, test_loss: 0.8677, test_f1: 0.5761
 epoch: 62, train_loss: 0.6892, test_loss: 0.8749, test_f1: 0.5924
 epoch: 63, train_loss: 0.7000, test_loss: 0.8840, test_f1: 0.6177
 epoch: 64, train_loss: 0.6858, test_loss: 0.8762, test_f1: 0.5802
 epoch: 65, train_loss: 0.6988, test_loss: 0.8727, test_f1: 0.6039
 epoch: 66, train_loss: 0.6739, test_loss: 0.9337, test_f1: 0.5966
 epoch: 67, train_loss: 0.6847, test_loss: 0.9691, test_f1: 0.5980
 epoch: 68, train_loss: 0.7083, test_loss: 0.8858, test_f1: 0.5872
 epoch: 69, train_loss: 0.6749, test_loss: 0.8574, test_f1: 0.6133
 epoch: 70, train_loss: 0.6823, test_loss: 0.8952, test_f1: 0.6013
 epoch: 71, train_loss: 0.6801, test_loss: 0.8852, test_f1: 0.6399
 epoch: 72, train_loss: 0.6778, test_loss: 0.8829, test_f1: 0.6377
 epoch: 73, train_loss: 0.6894, test_loss: 0.8900, test_f1: 0.6106
 epoch: 74, train_loss: 0.6791, test_loss: 0.8587, test_f1: 0.6408
 epoch: 75, train_loss: 0.6661, test_loss: 0.9096, test_f1: 0.6056
 epoch: 76, train_loss: 0.6869, test_loss: 0.8644, test_f1: 0.5912
 epoch: 77, train_loss: 0.6493, test_loss: 0.9188, test_f1: 0.6333
 epoch: 78, train_loss: 0.6591, test_loss: 0.8937, test_f1: 0.6169
 epoch: 79, train_loss: 0.6628, test_loss: 0.9074, test_f1: 0.6308
 epoch: 80, train_loss: 0.6705, test_loss: 0.8528, test_f1: 0.6130
 epoch: 81, train_loss: 0.6591, test_loss: 0.9051, test_f1: 0.6226
 epoch: 82, train_loss: 0.6696, test_loss: 1.0738, test_f1: 0.6072
 epoch: 83, train_loss: 0.6593, test_loss: 0.9402, test_f1: 0.6097
 epoch: 84, train_loss: 0.6467, test_loss: 0.9946, test_f1: 0.6112
 epoch: 85, train_loss: 0.6574, test_loss: 1.0001, test_f1: 0.5981
 epoch: 86, train_loss: 0.6501, test_loss: 0.9367, test_f1: 0.6487
 epoch: 87, train_loss: 0.6387, test_loss: 0.9893, test_f1: 0.6063
 epoch: 88, train_loss: 0.6535, test_loss: 0.8888, test_f1: 0.6112
 epoch: 89, train_loss: 0.6448, test_loss: 0.8464, test_f1: 0.6254
 epoch: 90, train_loss: 0.6497, test_loss: 0.9418, test_f1: 0.6141
 epoch: 91, train_loss: 0.6594, test_loss: 0.9796, test_f1: 0.5641
 epoch: 92, train_loss: 0.6457, test_loss: 0.8884, test_f1: 0.6264
 epoch: 93, train_loss: 0.6485, test_loss: 0.8784, test_f1: 0.6461
 epoch: 94, train_loss: 0.6546, test_loss: 0.8561, test_f1: 0.6266
 epoch: 95, train_loss: 0.6362, test_loss: 0.8542, test_f1: 0.6599
 epoch: 96, train_loss: 0.6515, test_loss: 1.0055, test_f1: 0.6407
 epoch: 97, train_loss: 0.6361, test_loss: 0.9530, test_f1: 0.6133
 epoch: 98, train_loss: 0.6340, test_loss: 0.9007, test_f1: 0.6225
 epoch: 99, train_loss: 0.6234, test_loss: 0.9168, test_f1: 0.6194
##################ITERATION #3 ****************************************
 epoch: 0, train_loss: 1.1334, test_loss: 1.2257, test_f1: 0.3935
 epoch: 1, train_loss: 1.0323, test_loss: 1.1157, test_f1: 0.4471
 epoch: 2, train_loss: 1.0091, test_loss: 1.1602, test_f1: 0.4375
 epoch: 3, train_loss: 0.9880, test_loss: 1.0524, test_f1: 0.4466
 epoch: 4, train_loss: 0.9634, test_loss: 1.1396, test_f1: 0.4743
 epoch: 5, train_loss: 0.9543, test_loss: 1.0776, test_f1: 0.4765
 epoch: 6, train_loss: 0.9345, test_loss: 1.2565, test_f1: 0.4005
 epoch: 7, train_loss: 0.9299, test_loss: 0.9678, test_f1: 0.4841
 epoch: 8, train_loss: 0.9195, test_loss: 0.9640, test_f1: 0.5105
 epoch: 9, train_loss: 0.9323, test_loss: 0.9816, test_f1: 0.5185
 epoch: 10, train_loss: 0.8783, test_loss: 1.0445, test_f1: 0.5203
 epoch: 11, train_loss: 0.8960, test_loss: 0.9541, test_f1: 0.4814
 epoch: 12, train_loss: 0.8836, test_loss: 1.1950, test_f1: 0.4556
 epoch: 13, train_loss: 0.8815, test_loss: 0.9858, test_f1: 0.5220
 epoch: 14, train_loss: 0.8593, test_loss: 0.8450, test_f1: 0.5303
 epoch: 15, train_loss: 0.8616, test_loss: 0.9253, test_f1: 0.5105
 epoch: 16, train_loss: 0.8507, test_loss: 0.8852, test_f1: 0.5308
 epoch: 17, train_loss: 0.8532, test_loss: 0.8899, test_f1: 0.5416
 epoch: 18, train_loss: 0.8394, test_loss: 0.9287, test_f1: 0.5703
 epoch: 19, train_loss: 0.8449, test_loss: 0.8624, test_f1: 0.5676
 epoch: 20, train_loss: 0.8490, test_loss: 0.9757, test_f1: 0.5201
 epoch: 21, train_loss: 0.8368, test_loss: 0.8588, test_f1: 0.6044
 epoch: 22, train_loss: 0.8350, test_loss: 0.9150, test_f1: 0.5343
 epoch: 23, train_loss: 0.8159, test_loss: 0.9352, test_f1: 0.5550
 epoch: 24, train_loss: 0.8140, test_loss: 0.8355, test_f1: 0.5342
 epoch: 25, train_loss: 0.8102, test_loss: 1.0353, test_f1: 0.5916
 epoch: 26, train_loss: 0.8096, test_loss: 1.0116, test_f1: 0.5088
 epoch: 27, train_loss: 0.7966, test_loss: 0.9211, test_f1: 0.5456
 epoch: 28, train_loss: 0.8117, test_loss: 0.8630, test_f1: 0.5632
 epoch: 29, train_loss: 0.7956, test_loss: 0.9438, test_f1: 0.5532
 epoch: 30, train_loss: 0.8071, test_loss: 1.0007, test_f1: 0.5360
 epoch: 31, train_loss: 0.7922, test_loss: 0.8888, test_f1: 0.5868
 epoch: 32, train_loss: 0.7939, test_loss: 0.9114, test_f1: 0.5673
 epoch: 33, train_loss: 0.7906, test_loss: 0.9556, test_f1: 0.5300
 epoch: 34, train_loss: 0.7606, test_loss: 0.8376, test_f1: 0.5743
 epoch: 35, train_loss: 0.7837, test_loss: 0.9206, test_f1: 0.5535
 epoch: 36, train_loss: 0.7976, test_loss: 0.8244, test_f1: 0.5955
 epoch: 37, train_loss: 0.7859, test_loss: 0.8238, test_f1: 0.5824
 epoch: 38, train_loss: 0.7783, test_loss: 0.9895, test_f1: 0.5352
 epoch: 39, train_loss: 0.7651, test_loss: 1.1121, test_f1: 0.5146
 epoch: 40, train_loss: 0.7971, test_loss: 0.9199, test_f1: 0.5178
 epoch: 41, train_loss: 0.7650, test_loss: 0.8731, test_f1: 0.5925
 epoch: 42, train_loss: 0.7542, test_loss: 0.8730, test_f1: 0.5836
 epoch: 43, train_loss: 0.7594, test_loss: 0.8822, test_f1: 0.5973
 epoch: 44, train_loss: 0.7563, test_loss: 1.1838, test_f1: 0.5269
 epoch: 45, train_loss: 0.7773, test_loss: 0.8381, test_f1: 0.5730
 epoch: 46, train_loss: 0.7499, test_loss: 0.8869, test_f1: 0.6223
 epoch: 47, train_loss: 0.7791, test_loss: 0.9894, test_f1: 0.5537
 epoch: 48, train_loss: 0.7743, test_loss: 0.8754, test_f1: 0.6275
 epoch: 49, train_loss: 0.7544, test_loss: 0.7840, test_f1: 0.6025
 epoch: 50, train_loss: 0.7537, test_loss: 0.8465, test_f1: 0.6202
 epoch: 51, train_loss: 0.7238, test_loss: 0.9043, test_f1: 0.6156
 epoch: 52, train_loss: 0.7051, test_loss: 0.9174, test_f1: 0.6081
 epoch: 53, train_loss: 0.6921, test_loss: 0.9103, test_f1: 0.5902
 epoch: 54, train_loss: 0.7033, test_loss: 0.8841, test_f1: 0.5814
 epoch: 55, train_loss: 0.6932, test_loss: 0.9663, test_f1: 0.6140
 epoch: 56, train_loss: 0.6927, test_loss: 0.8813, test_f1: 0.6009
 epoch: 57, train_loss: 0.6903, test_loss: 0.8636, test_f1: 0.5971
 epoch: 58, train_loss: 0.6790, test_loss: 0.9571, test_f1: 0.6007
 epoch: 59, train_loss: 0.6791, test_loss: 0.8827, test_f1: 0.6223
 epoch: 60, train_loss: 0.6901, test_loss: 0.9068, test_f1: 0.5980
 epoch: 61, train_loss: 0.6972, test_loss: 0.9427, test_f1: 0.5907
 epoch: 62, train_loss: 0.6845, test_loss: 0.9093, test_f1: 0.6069
 epoch: 63, train_loss: 0.6801, test_loss: 0.9488, test_f1: 0.6330
 epoch: 64, train_loss: 0.6847, test_loss: 0.9225, test_f1: 0.6377
 epoch: 65, train_loss: 0.6661, test_loss: 0.9015, test_f1: 0.5871
 epoch: 66, train_loss: 0.6591, test_loss: 0.9284, test_f1: 0.5946
 epoch: 67, train_loss: 0.6675, test_loss: 0.9403, test_f1: 0.6241
 epoch: 68, train_loss: 0.6800, test_loss: 0.8812, test_f1: 0.6005
 epoch: 69, train_loss: 0.6609, test_loss: 0.9619, test_f1: 0.6003
 epoch: 70, train_loss: 0.6584, test_loss: 0.9241, test_f1: 0.6010
 epoch: 71, train_loss: 0.6576, test_loss: 0.8513, test_f1: 0.6517
 epoch: 72, train_loss: 0.6651, test_loss: 0.9190, test_f1: 0.6006
 epoch: 73, train_loss: 0.6525, test_loss: 0.8946, test_f1: 0.6038
 epoch: 74, train_loss: 0.6434, test_loss: 0.8914, test_f1: 0.6159
 epoch: 75, train_loss: 0.6444, test_loss: 0.8639, test_f1: 0.6452
 epoch: 76, train_loss: 0.6439, test_loss: 0.8765, test_f1: 0.6438
 epoch: 77, train_loss: 0.6543, test_loss: 0.9255, test_f1: 0.6062
 epoch: 78, train_loss: 0.6507, test_loss: 0.9313, test_f1: 0.6585
 epoch: 79, train_loss: 0.6345, test_loss: 0.8416, test_f1: 0.6468
 epoch: 80, train_loss: 0.6347, test_loss: 1.0065, test_f1: 0.6383
 epoch: 81, train_loss: 0.6343, test_loss: 0.9715, test_f1: 0.6192
 epoch: 82, train_loss: 0.6458, test_loss: 0.8819, test_f1: 0.6065
 epoch: 83, train_loss: 0.6312, test_loss: 1.0202, test_f1: 0.5960
 epoch: 84, train_loss: 0.6372, test_loss: 0.8928, test_f1: 0.6294
 epoch: 85, train_loss: 0.6466, test_loss: 0.9082, test_f1: 0.6085
 epoch: 86, train_loss: 0.6346, test_loss: 0.9012, test_f1: 0.6438
 epoch: 87, train_loss: 0.6269, test_loss: 0.8812, test_f1: 0.6533
 epoch: 88, train_loss: 0.6281, test_loss: 0.9260, test_f1: 0.6669
 epoch: 89, train_loss: 0.6148, test_loss: 0.7645, test_f1: 0.6820
 epoch: 90, train_loss: 0.6283, test_loss: 0.8844, test_f1: 0.5988
 epoch: 91, train_loss: 0.6075, test_loss: 0.9044, test_f1: 0.6518
 epoch: 92, train_loss: 0.6249, test_loss: 0.9681, test_f1: 0.6545
 epoch: 93, train_loss: 0.6201, test_loss: 0.9982, test_f1: 0.6714
 epoch: 94, train_loss: 0.6325, test_loss: 0.9812, test_f1: 0.6801
 epoch: 95, train_loss: 0.6184, test_loss: 0.9922, test_f1: 0.6371
 epoch: 96, train_loss: 0.6314, test_loss: 0.9095, test_f1: 0.6694
 epoch: 97, train_loss: 0.6200, test_loss: 1.0398, test_f1: 0.6918
 epoch: 98, train_loss: 0.6213, test_loss: 0.9998, test_f1: 0.6349
 epoch: 99, train_loss: 0.6107, test_loss: 1.0356, test_f1: 0.6683
##################ITERATION #4 ****************************************
 epoch: 0, train_loss: 1.1594, test_loss: 1.1179, test_f1: 0.3879
 epoch: 1, train_loss: 1.0471, test_loss: 1.1030, test_f1: 0.4423
 epoch: 2, train_loss: 1.0330, test_loss: 1.0771, test_f1: 0.4733
 epoch: 3, train_loss: 1.0288, test_loss: 1.0178, test_f1: 0.3991
 epoch: 4, train_loss: 1.0180, test_loss: 0.9766, test_f1: 0.4669
 epoch: 5, train_loss: 0.9694, test_loss: 1.0238, test_f1: 0.4506
 epoch: 6, train_loss: 0.9900, test_loss: 1.0711, test_f1: 0.4272
 epoch: 7, train_loss: 0.9740, test_loss: 1.0547, test_f1: 0.4682
 epoch: 8, train_loss: 0.9514, test_loss: 1.0005, test_f1: 0.4569
 epoch: 9, train_loss: 0.9675, test_loss: 0.9676, test_f1: 0.4853
 epoch: 10, train_loss: 0.9483, test_loss: 0.9227, test_f1: 0.4868
 epoch: 11, train_loss: 0.9462, test_loss: 0.9539, test_f1: 0.4689
 epoch: 12, train_loss: 0.9069, test_loss: 0.9754, test_f1: 0.4986
 epoch: 13, train_loss: 0.9076, test_loss: 1.0826, test_f1: 0.4513
 epoch: 14, train_loss: 0.9247, test_loss: 0.9165, test_f1: 0.5286
 epoch: 15, train_loss: 0.9156, test_loss: 0.9766, test_f1: 0.5201
 epoch: 16, train_loss: 0.9066, test_loss: 0.9025, test_f1: 0.5310
 epoch: 17, train_loss: 0.9017, test_loss: 0.9247, test_f1: 0.4994
 epoch: 18, train_loss: 0.8979, test_loss: 0.8997, test_f1: 0.5110
 epoch: 19, train_loss: 0.8960, test_loss: 0.8810, test_f1: 0.5549
 epoch: 20, train_loss: 0.9050, test_loss: 0.9412, test_f1: 0.5342
 epoch: 21, train_loss: 0.9101, test_loss: 0.8719, test_f1: 0.5360
 epoch: 22, train_loss: 0.8705, test_loss: 0.9452, test_f1: 0.5530
 epoch: 23, train_loss: 0.8726, test_loss: 0.9138, test_f1: 0.4970
 epoch: 24, train_loss: 0.8739, test_loss: 0.9322, test_f1: 0.5125
 epoch: 25, train_loss: 0.8507, test_loss: 1.0403, test_f1: 0.4845
 epoch: 26, train_loss: 0.8721, test_loss: 1.0215, test_f1: 0.4942
 epoch: 27, train_loss: 0.8603, test_loss: 0.9146, test_f1: 0.5358
 epoch: 28, train_loss: 0.8460, test_loss: 0.8951, test_f1: 0.5419
 epoch: 29, train_loss: 0.8594, test_loss: 0.8621, test_f1: 0.5288
 epoch: 30, train_loss: 0.8541, test_loss: 0.8816, test_f1: 0.5470
 epoch: 31, train_loss: 0.8596, test_loss: 0.8651, test_f1: 0.5442
 epoch: 32, train_loss: 0.8488, test_loss: 0.9145, test_f1: 0.5361
 epoch: 33, train_loss: 0.8551, test_loss: 0.8773, test_f1: 0.5971
 epoch: 34, train_loss: 0.8386, test_loss: 0.8801, test_f1: 0.5227
 epoch: 35, train_loss: 0.8358, test_loss: 0.8811, test_f1: 0.5614
 epoch: 36, train_loss: 0.8462, test_loss: 0.8940, test_f1: 0.5118
 epoch: 37, train_loss: 0.8239, test_loss: 0.8847, test_f1: 0.5894
 epoch: 38, train_loss: 0.8369, test_loss: 0.9443, test_f1: 0.5962
 epoch: 39, train_loss: 0.8044, test_loss: 0.9390, test_f1: 0.5852
 epoch: 40, train_loss: 0.8153, test_loss: 0.9950, test_f1: 0.5258
 epoch: 41, train_loss: 0.8106, test_loss: 0.8400, test_f1: 0.5350
 epoch: 42, train_loss: 0.8188, test_loss: 0.8710, test_f1: 0.5929
 epoch: 43, train_loss: 0.8186, test_loss: 0.8512, test_f1: 0.5460
 epoch: 44, train_loss: 0.8069, test_loss: 0.8648, test_f1: 0.5466
 epoch: 45, train_loss: 0.7915, test_loss: 0.8726, test_f1: 0.5830
 epoch: 46, train_loss: 0.8140, test_loss: 0.8920, test_f1: 0.5560
 epoch: 47, train_loss: 0.8146, test_loss: 0.8971, test_f1: 0.5883
 epoch: 48, train_loss: 0.8147, test_loss: 1.4481, test_f1: 0.4654
 epoch: 49, train_loss: 0.8106, test_loss: 0.8856, test_f1: 0.6012
 epoch: 50, train_loss: 0.8091, test_loss: 0.9230, test_f1: 0.5314
 epoch: 51, train_loss: 0.7653, test_loss: 0.9096, test_f1: 0.5549
 epoch: 52, train_loss: 0.7562, test_loss: 0.8976, test_f1: 0.6059
 epoch: 53, train_loss: 0.7496, test_loss: 0.8771, test_f1: 0.5531
 epoch: 54, train_loss: 0.7543, test_loss: 0.9494, test_f1: 0.6258
 epoch: 55, train_loss: 0.7554, test_loss: 0.8966, test_f1: 0.5915
 epoch: 56, train_loss: 0.7499, test_loss: 0.8994, test_f1: 0.5602
 epoch: 57, train_loss: 0.7319, test_loss: 0.8615, test_f1: 0.6177
 epoch: 58, train_loss: 0.7338, test_loss: 0.8901, test_f1: 0.5899
 epoch: 59, train_loss: 0.7312, test_loss: 0.8781, test_f1: 0.6283
 epoch: 60, train_loss: 0.7285, test_loss: 0.9051, test_f1: 0.6233
 epoch: 61, train_loss: 0.7364, test_loss: 0.8546, test_f1: 0.5575
 epoch: 62, train_loss: 0.7302, test_loss: 0.8654, test_f1: 0.5972
 epoch: 63, train_loss: 0.7293, test_loss: 0.8981, test_f1: 0.6089
 epoch: 64, train_loss: 0.7346, test_loss: 0.8899, test_f1: 0.5653
 epoch: 65, train_loss: 0.7207, test_loss: 0.8493, test_f1: 0.6295
 epoch: 66, train_loss: 0.7238, test_loss: 0.9035, test_f1: 0.6104
 epoch: 67, train_loss: 0.7084, test_loss: 0.8695, test_f1: 0.6183
 epoch: 68, train_loss: 0.7189, test_loss: 0.9111, test_f1: 0.6202
 epoch: 69, train_loss: 0.7222, test_loss: 0.9001, test_f1: 0.5916
 epoch: 70, train_loss: 0.7055, test_loss: 0.8943, test_f1: 0.6272
 epoch: 71, train_loss: 0.7011, test_loss: 0.8506, test_f1: 0.6196
 epoch: 72, train_loss: 0.7092, test_loss: 0.8556, test_f1: 0.6453
 epoch: 73, train_loss: 0.7082, test_loss: 0.8495, test_f1: 0.6072
 epoch: 74, train_loss: 0.7145, test_loss: 0.8801, test_f1: 0.6396
 epoch: 75, train_loss: 0.6942, test_loss: 0.8884, test_f1: 0.6363
 epoch: 76, train_loss: 0.6985, test_loss: 0.9165, test_f1: 0.5697
 epoch: 77, train_loss: 0.7236, test_loss: 0.9145, test_f1: 0.5804
 epoch: 78, train_loss: 0.6961, test_loss: 0.9391, test_f1: 0.6295
 epoch: 79, train_loss: 0.7005, test_loss: 0.8607, test_f1: 0.5969
 epoch: 80, train_loss: 0.6874, test_loss: 0.9059, test_f1: 0.5726
 epoch: 81, train_loss: 0.6773, test_loss: 0.8784, test_f1: 0.6166
 epoch: 82, train_loss: 0.6885, test_loss: 0.9487, test_f1: 0.6039
 epoch: 83, train_loss: 0.6917, test_loss: 0.8742, test_f1: 0.6209
 epoch: 84, train_loss: 0.6905, test_loss: 0.8874, test_f1: 0.6359
 epoch: 85, train_loss: 0.6725, test_loss: 0.9169, test_f1: 0.6269
 epoch: 86, train_loss: 0.6856, test_loss: 0.8390, test_f1: 0.6703
 epoch: 87, train_loss: 0.6934, test_loss: 0.8791, test_f1: 0.6253
 epoch: 88, train_loss: 0.6986, test_loss: 0.8553, test_f1: 0.6346
 epoch: 89, train_loss: 0.6902, test_loss: 0.8804, test_f1: 0.6291
 epoch: 90, train_loss: 0.6800, test_loss: 0.8976, test_f1: 0.6287
 epoch: 91, train_loss: 0.6766, test_loss: 0.8736, test_f1: 0.6054
 epoch: 92, train_loss: 0.7000, test_loss: 0.9009, test_f1: 0.6349
 epoch: 93, train_loss: 0.6833, test_loss: 0.8910, test_f1: 0.5993
 epoch: 94, train_loss: 0.6662, test_loss: 0.8605, test_f1: 0.6254
 epoch: 95, train_loss: 0.6884, test_loss: 0.8928, test_f1: 0.6160
 epoch: 96, train_loss: 0.6844, test_loss: 0.8556, test_f1: 0.6598
 epoch: 97, train_loss: 0.6619, test_loss: 0.8768, test_f1: 0.6294
 epoch: 98, train_loss: 0.6646, test_loss: 0.8494, test_f1: 0.6336
 epoch: 99, train_loss: 0.6507, test_loss: 0.9212, test_f1: 0.6188
##################ITERATION #5 ****************************************
 epoch: 0, train_loss: 1.1259, test_loss: 1.6283, test_f1: 0.3071
 epoch: 1, train_loss: 1.0503, test_loss: 1.0159, test_f1: 0.4072
 epoch: 2, train_loss: 1.0224, test_loss: 1.0265, test_f1: 0.4856
 epoch: 3, train_loss: 1.0122, test_loss: 0.9653, test_f1: 0.4854
 epoch: 4, train_loss: 0.9898, test_loss: 1.0532, test_f1: 0.4679
 epoch: 5, train_loss: 0.9833, test_loss: 1.0159, test_f1: 0.4536
 epoch: 6, train_loss: 0.9639, test_loss: 1.0302, test_f1: 0.4653
 epoch: 7, train_loss: 0.9460, test_loss: 0.9382, test_f1: 0.5122
 epoch: 8, train_loss: 0.9323, test_loss: 0.9309, test_f1: 0.5209
 epoch: 9, train_loss: 0.9195, test_loss: 0.9396, test_f1: 0.5491
 epoch: 10, train_loss: 0.9140, test_loss: 0.9235, test_f1: 0.4866
 epoch: 11, train_loss: 0.8891, test_loss: 0.9230, test_f1: 0.5379
 epoch: 12, train_loss: 0.8914, test_loss: 0.9308, test_f1: 0.5571
 epoch: 13, train_loss: 0.8906, test_loss: 0.8855, test_f1: 0.5519
 epoch: 14, train_loss: 0.8821, test_loss: 0.9629, test_f1: 0.5284
 epoch: 15, train_loss: 0.8677, test_loss: 0.9227, test_f1: 0.5097
 epoch: 16, train_loss: 0.8853, test_loss: 0.9025, test_f1: 0.5399
 epoch: 17, train_loss: 0.8557, test_loss: 0.8727, test_f1: 0.5370
 epoch: 18, train_loss: 0.8617, test_loss: 0.9176, test_f1: 0.5113
 epoch: 19, train_loss: 0.8382, test_loss: 0.9070, test_f1: 0.5156
 epoch: 20, train_loss: 0.8451, test_loss: 0.8107, test_f1: 0.5347
 epoch: 21, train_loss: 0.8470, test_loss: 0.9086, test_f1: 0.5835
 epoch: 22, train_loss: 0.8198, test_loss: 0.8667, test_f1: 0.5608
 epoch: 23, train_loss: 0.8238, test_loss: 0.8659, test_f1: 0.5631
 epoch: 24, train_loss: 0.8054, test_loss: 0.8528, test_f1: 0.5209
 epoch: 25, train_loss: 0.8182, test_loss: 0.8817, test_f1: 0.5340
 epoch: 26, train_loss: 0.8221, test_loss: 0.8829, test_f1: 0.6044
 epoch: 27, train_loss: 0.8171, test_loss: 0.7740, test_f1: 0.5898
 epoch: 28, train_loss: 0.8045, test_loss: 0.8393, test_f1: 0.5433
 epoch: 29, train_loss: 0.8186, test_loss: 0.8433, test_f1: 0.5401
 epoch: 30, train_loss: 0.7988, test_loss: 0.9572, test_f1: 0.5486
 epoch: 31, train_loss: 0.7958, test_loss: 0.9714, test_f1: 0.5277
 epoch: 32, train_loss: 0.7949, test_loss: 0.8528, test_f1: 0.5899
 epoch: 33, train_loss: 0.7957, test_loss: 0.7544, test_f1: 0.6120
 epoch: 34, train_loss: 0.7657, test_loss: 0.8624, test_f1: 0.5428
 epoch: 35, train_loss: 0.7730, test_loss: 0.8733, test_f1: 0.5432
 epoch: 36, train_loss: 0.7812, test_loss: 0.8587, test_f1: 0.5952
 epoch: 37, train_loss: 0.7753, test_loss: 0.8107, test_f1: 0.5438
 epoch: 38, train_loss: 0.7522, test_loss: 0.8924, test_f1: 0.5937
 epoch: 39, train_loss: 0.7823, test_loss: 0.8090, test_f1: 0.5428
 epoch: 40, train_loss: 0.7677, test_loss: 0.8753, test_f1: 0.5421
 epoch: 41, train_loss: 0.7632, test_loss: 0.8431, test_f1: 0.5532
 epoch: 42, train_loss: 0.7524, test_loss: 0.8122, test_f1: 0.5987
 epoch: 43, train_loss: 0.7505, test_loss: 0.8149, test_f1: 0.6200
 epoch: 44, train_loss: 0.7512, test_loss: 0.8459, test_f1: 0.5586
 epoch: 45, train_loss: 0.7623, test_loss: 0.7853, test_f1: 0.6367
 epoch: 46, train_loss: 0.7546, test_loss: 0.9110, test_f1: 0.6084
 epoch: 47, train_loss: 0.7498, test_loss: 0.9390, test_f1: 0.5503
 epoch: 48, train_loss: 0.7396, test_loss: 0.8308, test_f1: 0.5458
 epoch: 49, train_loss: 0.7553, test_loss: 0.8900, test_f1: 0.5532
 epoch: 50, train_loss: 0.7530, test_loss: 0.8694, test_f1: 0.5962
 epoch: 51, train_loss: 0.7111, test_loss: 0.8257, test_f1: 0.6322
 epoch: 52, train_loss: 0.6848, test_loss: 0.8388, test_f1: 0.5865
 epoch: 53, train_loss: 0.6838, test_loss: 0.8980, test_f1: 0.5977
 epoch: 54, train_loss: 0.6834, test_loss: 0.8235, test_f1: 0.6247
 epoch: 55, train_loss: 0.6878, test_loss: 0.8201, test_f1: 0.6361
 epoch: 56, train_loss: 0.6782, test_loss: 0.9110, test_f1: 0.6257
 epoch: 57, train_loss: 0.6688, test_loss: 0.8893, test_f1: 0.6058
 epoch: 58, train_loss: 0.6625, test_loss: 0.8921, test_f1: 0.6453
 epoch: 59, train_loss: 0.6776, test_loss: 0.9200, test_f1: 0.6342
 epoch: 60, train_loss: 0.6579, test_loss: 0.8069, test_f1: 0.6370
 epoch: 61, train_loss: 0.6758, test_loss: 0.8397, test_f1: 0.6652
 epoch: 62, train_loss: 0.6535, test_loss: 0.8574, test_f1: 0.6511
 epoch: 63, train_loss: 0.6739, test_loss: 0.7682, test_f1: 0.6509
 epoch: 64, train_loss: 0.6508, test_loss: 0.8372, test_f1: 0.6358
 epoch: 65, train_loss: 0.6535, test_loss: 0.8753, test_f1: 0.5735
 epoch: 66, train_loss: 0.6489, test_loss: 0.8762, test_f1: 0.6411
 epoch: 67, train_loss: 0.6649, test_loss: 0.8601, test_f1: 0.6371
 epoch: 68, train_loss: 0.6440, test_loss: 0.8819, test_f1: 0.6126
 epoch: 69, train_loss: 0.6482, test_loss: 0.9324, test_f1: 0.6399
 epoch: 70, train_loss: 0.6413, test_loss: 0.8776, test_f1: 0.5876
 epoch: 71, train_loss: 0.6446, test_loss: 0.9260, test_f1: 0.6392
 epoch: 72, train_loss: 0.6443, test_loss: 0.8699, test_f1: 0.6400
 epoch: 73, train_loss: 0.6437, test_loss: 0.8477, test_f1: 0.6428
 epoch: 74, train_loss: 0.6430, test_loss: 0.8878, test_f1: 0.6491
 epoch: 75, train_loss: 0.6376, test_loss: 0.8484, test_f1: 0.6384
 epoch: 76, train_loss: 0.6264, test_loss: 0.8442, test_f1: 0.6309
 epoch: 77, train_loss: 0.6526, test_loss: 0.8804, test_f1: 0.6210
 epoch: 78, train_loss: 0.6366, test_loss: 0.8654, test_f1: 0.6451
 epoch: 79, train_loss: 0.6126, test_loss: 0.9212, test_f1: 0.6328
 epoch: 80, train_loss: 0.6311, test_loss: 0.8393, test_f1: 0.6231
 epoch: 81, train_loss: 0.6365, test_loss: 0.8300, test_f1: 0.6399
 epoch: 82, train_loss: 0.6312, test_loss: 0.8354, test_f1: 0.6425
 epoch: 83, train_loss: 0.6514, test_loss: 0.8143, test_f1: 0.6361
 epoch: 84, train_loss: 0.6424, test_loss: 0.8125, test_f1: 0.6671
 epoch: 85, train_loss: 0.6209, test_loss: 0.8904, test_f1: 0.6612
 epoch: 86, train_loss: 0.6356, test_loss: 0.8265, test_f1: 0.6377
 epoch: 87, train_loss: 0.6013, test_loss: 0.8814, test_f1: 0.6640
 epoch: 88, train_loss: 0.6197, test_loss: 0.8901, test_f1: 0.6241
 epoch: 89, train_loss: 0.6287, test_loss: 0.7605, test_f1: 0.6662
 epoch: 90, train_loss: 0.6229, test_loss: 0.8989, test_f1: 0.6407
 epoch: 91, train_loss: 0.6264, test_loss: 0.9187, test_f1: 0.6575
 epoch: 92, train_loss: 0.6090, test_loss: 0.9221, test_f1: 0.6343
 epoch: 93, train_loss: 0.6118, test_loss: 0.9916, test_f1: 0.6276
 epoch: 94, train_loss: 0.6208, test_loss: 0.9064, test_f1: 0.6390
 epoch: 95, train_loss: 0.6109, test_loss: 1.1176, test_f1: 0.6274
 epoch: 96, train_loss: 0.6284, test_loss: 0.9532, test_f1: 0.6340
 epoch: 97, train_loss: 0.6139, test_loss: 0.9426, test_f1: 0.6363
 epoch: 98, train_loss: 0.6170, test_loss: 0.8591, test_f1: 0.6597
 epoch: 99, train_loss: 0.6206, test_loss: 0.8722, test_f1: 0.6520
##################ITERATION #6 ****************************************
 epoch: 0, train_loss: 1.1415, test_loss: 1.1207, test_f1: 0.4453
 epoch: 1, train_loss: 1.0227, test_loss: 1.0232, test_f1: 0.4746
 epoch: 2, train_loss: 0.9915, test_loss: 0.9909, test_f1: 0.4430
 epoch: 3, train_loss: 0.9778, test_loss: 1.1432, test_f1: 0.4610
 epoch: 4, train_loss: 0.9533, test_loss: 0.9392, test_f1: 0.5109
 epoch: 5, train_loss: 0.9708, test_loss: 0.9891, test_f1: 0.4948
 epoch: 6, train_loss: 0.9465, test_loss: 0.9957, test_f1: 0.4969
 epoch: 7, train_loss: 0.9310, test_loss: 0.9651, test_f1: 0.5576
 epoch: 8, train_loss: 0.9159, test_loss: 0.9985, test_f1: 0.4854
 epoch: 9, train_loss: 0.9204, test_loss: 0.9657, test_f1: 0.4923
 epoch: 10, train_loss: 0.9092, test_loss: 0.9697, test_f1: 0.4520
 epoch: 11, train_loss: 0.8931, test_loss: 0.9529, test_f1: 0.5022
 epoch: 12, train_loss: 0.8936, test_loss: 0.8851, test_f1: 0.5260
 epoch: 13, train_loss: 0.8860, test_loss: 0.9083, test_f1: 0.5479
 epoch: 14, train_loss: 0.9411, test_loss: 1.0395, test_f1: 0.4212
 epoch: 15, train_loss: 0.9634, test_loss: 0.9829, test_f1: 0.4456
 epoch: 16, train_loss: 0.9269, test_loss: 0.8777, test_f1: 0.4967
 epoch: 17, train_loss: 0.9071, test_loss: 0.9466, test_f1: 0.4801
 epoch: 18, train_loss: 0.8941, test_loss: 0.9606, test_f1: 0.5102
 epoch: 19, train_loss: 0.8814, test_loss: 0.8766, test_f1: 0.5367
 epoch: 20, train_loss: 0.8744, test_loss: 1.1367, test_f1: 0.4486
 epoch: 21, train_loss: 0.8737, test_loss: 0.8795, test_f1: 0.5583
 epoch: 22, train_loss: 0.8621, test_loss: 0.8660, test_f1: 0.5330
 epoch: 23, train_loss: 0.8593, test_loss: 0.9308, test_f1: 0.5798
 epoch: 24, train_loss: 0.8451, test_loss: 0.8667, test_f1: 0.5159
 epoch: 25, train_loss: 0.8502, test_loss: 0.8326, test_f1: 0.5244
 epoch: 26, train_loss: 0.8551, test_loss: 0.8363, test_f1: 0.5574
 epoch: 27, train_loss: 0.8486, test_loss: 0.8946, test_f1: 0.5557
 epoch: 28, train_loss: 0.8557, test_loss: 0.8558, test_f1: 0.5417
 epoch: 29, train_loss: 0.8146, test_loss: 0.8154, test_f1: 0.5522
 epoch: 30, train_loss: 0.8159, test_loss: 0.8808, test_f1: 0.5358
 epoch: 31, train_loss: 0.8166, test_loss: 0.9229, test_f1: 0.5093
 epoch: 32, train_loss: 0.8228, test_loss: 0.8965, test_f1: 0.5636
 epoch: 33, train_loss: 0.8072, test_loss: 0.7940, test_f1: 0.5553
 epoch: 34, train_loss: 0.8153, test_loss: 0.8840, test_f1: 0.5514
 epoch: 35, train_loss: 0.8119, test_loss: 0.8320, test_f1: 0.5588
 epoch: 36, train_loss: 0.8027, test_loss: 0.9361, test_f1: 0.5346
 epoch: 37, train_loss: 0.8079, test_loss: 0.8965, test_f1: 0.5292
 epoch: 38, train_loss: 0.7805, test_loss: 0.9701, test_f1: 0.5433
 epoch: 39, train_loss: 0.8028, test_loss: 0.9597, test_f1: 0.5651
 epoch: 40, train_loss: 0.7956, test_loss: 0.9431, test_f1: 0.5414
 epoch: 41, train_loss: 0.7711, test_loss: 0.9989, test_f1: 0.5698
 epoch: 42, train_loss: 0.7895, test_loss: 1.0328, test_f1: 0.5761
 epoch: 43, train_loss: 0.7859, test_loss: 0.8141, test_f1: 0.5651
 epoch: 44, train_loss: 0.7921, test_loss: 0.9331, test_f1: 0.5580
 epoch: 45, train_loss: 0.7750, test_loss: 0.9624, test_f1: 0.5580
 epoch: 46, train_loss: 0.7784, test_loss: 0.8425, test_f1: 0.5809
 epoch: 47, train_loss: 0.7800, test_loss: 1.2025, test_f1: 0.4862
 epoch: 48, train_loss: 0.7661, test_loss: 0.9223, test_f1: 0.5650
 epoch: 49, train_loss: 0.7783, test_loss: 0.8882, test_f1: 0.5712
 epoch: 50, train_loss: 0.7612, test_loss: 0.9011, test_f1: 0.5646
 epoch: 51, train_loss: 0.7487, test_loss: 0.8770, test_f1: 0.5631
 epoch: 52, train_loss: 0.7306, test_loss: 0.9427, test_f1: 0.5439
 epoch: 53, train_loss: 0.7122, test_loss: 0.8655, test_f1: 0.5779
 epoch: 54, train_loss: 0.7129, test_loss: 0.9240, test_f1: 0.6058
 epoch: 55, train_loss: 0.7238, test_loss: 0.9060, test_f1: 0.5757
 epoch: 56, train_loss: 0.7025, test_loss: 0.9526, test_f1: 0.5432
 epoch: 57, train_loss: 0.7178, test_loss: 0.9169, test_f1: 0.5360
 epoch: 58, train_loss: 0.7214, test_loss: 0.8871, test_f1: 0.6054
 epoch: 59, train_loss: 0.7160, test_loss: 0.9304, test_f1: 0.5771
 epoch: 60, train_loss: 0.7180, test_loss: 0.9011, test_f1: 0.6029
 epoch: 61, train_loss: 0.7088, test_loss: 0.8512, test_f1: 0.5792
 epoch: 62, train_loss: 0.6951, test_loss: 0.9152, test_f1: 0.5667
 epoch: 63, train_loss: 0.7136, test_loss: 0.9175, test_f1: 0.5792
 epoch: 64, train_loss: 0.7086, test_loss: 0.9076, test_f1: 0.5787
 epoch: 65, train_loss: 0.7071, test_loss: 0.9063, test_f1: 0.6044
 epoch: 66, train_loss: 0.7063, test_loss: 0.9109, test_f1: 0.5695
 epoch: 67, train_loss: 0.6922, test_loss: 0.8579, test_f1: 0.6016
 epoch: 68, train_loss: 0.6923, test_loss: 0.8355, test_f1: 0.5822
 epoch: 69, train_loss: 0.6967, test_loss: 0.8946, test_f1: 0.5916
 epoch: 70, train_loss: 0.6836, test_loss: 0.8677, test_f1: 0.5561
 epoch: 71, train_loss: 0.6858, test_loss: 0.9682, test_f1: 0.6142
 epoch: 72, train_loss: 0.6940, test_loss: 1.0390, test_f1: 0.5702
 epoch: 73, train_loss: 0.6787, test_loss: 0.9956, test_f1: 0.6146
 epoch: 74, train_loss: 0.6820, test_loss: 0.9413, test_f1: 0.5724
 epoch: 75, train_loss: 0.7926, test_loss: 0.9479, test_f1: 0.5523
 epoch: 76, train_loss: 0.7573, test_loss: 0.8364, test_f1: 0.5504
 epoch: 77, train_loss: 0.7364, test_loss: 0.9131, test_f1: 0.5948
 epoch: 78, train_loss: 0.7000, test_loss: 0.9723, test_f1: 0.5996
 epoch: 79, train_loss: 0.7115, test_loss: 0.8759, test_f1: 0.6127
 epoch: 80, train_loss: 0.6802, test_loss: 0.9525, test_f1: 0.5716
 epoch: 81, train_loss: 0.6875, test_loss: 0.9280, test_f1: 0.5528
 epoch: 82, train_loss: 0.6915, test_loss: 1.0073, test_f1: 0.5880
 epoch: 83, train_loss: 0.6850, test_loss: 0.9256, test_f1: 0.5778
 epoch: 84, train_loss: 0.6743, test_loss: 0.7876, test_f1: 0.5667
 epoch: 85, train_loss: 0.6779, test_loss: 0.8510, test_f1: 0.6135
 epoch: 86, train_loss: 0.6577, test_loss: 0.9086, test_f1: 0.5918
 epoch: 87, train_loss: 0.6729, test_loss: 0.9000, test_f1: 0.6057
 epoch: 88, train_loss: 0.6560, test_loss: 0.8846, test_f1: 0.6170
 epoch: 89, train_loss: 0.6576, test_loss: 0.9513, test_f1: 0.6034
 epoch: 90, train_loss: 0.6614, test_loss: 0.9680, test_f1: 0.5479
 epoch: 91, train_loss: 0.6616, test_loss: 0.9289, test_f1: 0.5984
 epoch: 92, train_loss: 0.6713, test_loss: 1.0133, test_f1: 0.6012
 epoch: 93, train_loss: 0.6585, test_loss: 0.8606, test_f1: 0.6352
 epoch: 94, train_loss: 0.6627, test_loss: 0.9898, test_f1: 0.5873
 epoch: 95, train_loss: 0.6712, test_loss: 0.9067, test_f1: 0.5882
 epoch: 96, train_loss: 0.6576, test_loss: 0.8828, test_f1: 0.6211
 epoch: 97, train_loss: 0.6659, test_loss: 0.8427, test_f1: 0.5826
 epoch: 98, train_loss: 0.6414, test_loss: 0.8719, test_f1: 0.6498
 epoch: 99, train_loss: 0.6723, test_loss: 0.8311, test_f1: 0.6369
##################ITERATION #7 ****************************************
 epoch: 0, train_loss: 1.1575, test_loss: 1.0609, test_f1: 0.4934
 epoch: 1, train_loss: 1.0408, test_loss: 1.0904, test_f1: 0.4292
 epoch: 2, train_loss: 1.0240, test_loss: 1.0333, test_f1: 0.4646
 epoch: 3, train_loss: 1.0063, test_loss: 1.0659, test_f1: 0.4034
 epoch: 4, train_loss: 0.9909, test_loss: 1.0026, test_f1: 0.5161
 epoch: 5, train_loss: 0.9800, test_loss: 0.8828, test_f1: 0.5226
 epoch: 6, train_loss: 0.9639, test_loss: 1.2177, test_f1: 0.4093
 epoch: 7, train_loss: 0.9333, test_loss: 1.1005, test_f1: 0.4636
 epoch: 8, train_loss: 0.9398, test_loss: 1.0421, test_f1: 0.4636
 epoch: 9, train_loss: 0.9262, test_loss: 1.0083, test_f1: 0.4923
 epoch: 10, train_loss: 0.9181, test_loss: 1.0368, test_f1: 0.4864
 epoch: 11, train_loss: 0.9097, test_loss: 0.9426, test_f1: 0.4933
 epoch: 12, train_loss: 0.8927, test_loss: 1.1853, test_f1: 0.4235
 epoch: 13, train_loss: 0.8965, test_loss: 0.9390, test_f1: 0.4895
 epoch: 14, train_loss: 0.8929, test_loss: 1.0360, test_f1: 0.4765
 epoch: 15, train_loss: 0.8792, test_loss: 0.9344, test_f1: 0.4801
 epoch: 16, train_loss: 0.8708, test_loss: 0.8516, test_f1: 0.5608
 epoch: 17, train_loss: 0.8717, test_loss: 0.8892, test_f1: 0.4839
 epoch: 18, train_loss: 0.8727, test_loss: 0.9286, test_f1: 0.4886
 epoch: 19, train_loss: 0.8828, test_loss: 0.8904, test_f1: 0.5845
 epoch: 20, train_loss: 0.8719, test_loss: 0.8741, test_f1: 0.5326
 epoch: 21, train_loss: 0.8637, test_loss: 0.8881, test_f1: 0.5266
 epoch: 22, train_loss: 0.9268, test_loss: 1.0325, test_f1: 0.5244
 epoch: 23, train_loss: 0.9451, test_loss: 0.8906, test_f1: 0.5279
 epoch: 24, train_loss: 0.9194, test_loss: 0.8921, test_f1: 0.5073
 epoch: 25, train_loss: 0.8887, test_loss: 0.9603, test_f1: 0.5297
 epoch: 26, train_loss: 0.8888, test_loss: 0.8993, test_f1: 0.5418
 epoch: 27, train_loss: 0.8772, test_loss: 0.8950, test_f1: 0.5085
 epoch: 28, train_loss: 0.8662, test_loss: 0.8623, test_f1: 0.5473
 epoch: 29, train_loss: 0.8712, test_loss: 0.8522, test_f1: 0.5466
 epoch: 30, train_loss: 0.8641, test_loss: 0.8989, test_f1: 0.5470
 epoch: 31, train_loss: 0.8459, test_loss: 0.8870, test_f1: 0.5127
 epoch: 32, train_loss: 0.8375, test_loss: 0.8921, test_f1: 0.5407
 epoch: 33, train_loss: 0.8471, test_loss: 0.9078, test_f1: 0.5408
 epoch: 34, train_loss: 0.8519, test_loss: 0.9398, test_f1: 0.5679
 epoch: 35, train_loss: 0.8535, test_loss: 0.9287, test_f1: 0.5399
 epoch: 36, train_loss: 0.8444, test_loss: 0.9598, test_f1: 0.5479
 epoch: 37, train_loss: 0.8454, test_loss: 0.9284, test_f1: 0.5696
 epoch: 38, train_loss: 0.8550, test_loss: 0.8808, test_f1: 0.5896
 epoch: 39, train_loss: 0.8441, test_loss: 0.9550, test_f1: 0.5641
 epoch: 40, train_loss: 0.8526, test_loss: 1.0525, test_f1: 0.5263
 epoch: 41, train_loss: 0.8424, test_loss: 1.0122, test_f1: 0.5544
 epoch: 42, train_loss: 0.8275, test_loss: 0.9331, test_f1: 0.5479
 epoch: 43, train_loss: 0.8324, test_loss: 0.9519, test_f1: 0.5409
 epoch: 44, train_loss: 0.8280, test_loss: 1.0003, test_f1: 0.5709
 epoch: 45, train_loss: 0.8177, test_loss: 1.0265, test_f1: 0.5531
 epoch: 46, train_loss: 0.8315, test_loss: 0.9169, test_f1: 0.6086
 epoch: 47, train_loss: 0.8266, test_loss: 0.9632, test_f1: 0.5458
 epoch: 48, train_loss: 0.8128, test_loss: 0.9827, test_f1: 0.5455
 epoch: 49, train_loss: 0.8111, test_loss: 1.0381, test_f1: 0.5364
 epoch: 50, train_loss: 0.8060, test_loss: 1.0296, test_f1: 0.5805
 epoch: 51, train_loss: 0.7858, test_loss: 1.0199, test_f1: 0.5460
 epoch: 52, train_loss: 0.7819, test_loss: 0.9951, test_f1: 0.5767
 epoch: 53, train_loss: 0.7775, test_loss: 1.0091, test_f1: 0.5439
 epoch: 54, train_loss: 0.7637, test_loss: 0.9557, test_f1: 0.5620
 epoch: 55, train_loss: 0.7678, test_loss: 0.9875, test_f1: 0.5667
 epoch: 56, train_loss: 0.7577, test_loss: 0.9878, test_f1: 0.5623
 epoch: 57, train_loss: 0.7621, test_loss: 0.9634, test_f1: 0.5470
 epoch: 58, train_loss: 0.7723, test_loss: 1.0394, test_f1: 0.5484
 epoch: 59, train_loss: 0.7499, test_loss: 1.0440, test_f1: 0.6053
 epoch: 60, train_loss: 0.7508, test_loss: 0.9800, test_f1: 0.5864
 epoch: 61, train_loss: 0.7548, test_loss: 0.9829, test_f1: 0.5667
 epoch: 62, train_loss: 0.7515, test_loss: 0.9768, test_f1: 0.6042
 epoch: 63, train_loss: 0.7571, test_loss: 0.9980, test_f1: 0.5401
 epoch: 64, train_loss: 0.7442, test_loss: 1.0934, test_f1: 0.5937
 epoch: 65, train_loss: 0.7446, test_loss: 0.9808, test_f1: 0.6080
 epoch: 66, train_loss: 0.7539, test_loss: 1.0105, test_f1: 0.5748
 epoch: 67, train_loss: 0.7311, test_loss: 0.9855, test_f1: 0.5787
 epoch: 68, train_loss: 0.7405, test_loss: 0.9915, test_f1: 0.5595
 epoch: 69, train_loss: 0.7428, test_loss: 1.1591, test_f1: 0.5786
 epoch: 70, train_loss: 0.7433, test_loss: 1.0258, test_f1: 0.6028
 epoch: 71, train_loss: 0.7397, test_loss: 1.0120, test_f1: 0.6089
 epoch: 72, train_loss: 0.7386, test_loss: 0.9957, test_f1: 0.6183
 epoch: 73, train_loss: 0.7225, test_loss: 1.0395, test_f1: 0.5988
 epoch: 74, train_loss: 0.7178, test_loss: 1.0729, test_f1: 0.5942
 epoch: 75, train_loss: 0.7949, test_loss: 0.9814, test_f1: 0.5836
 epoch: 76, train_loss: 0.7541, test_loss: 0.9649, test_f1: 0.5981
 epoch: 77, train_loss: 0.7590, test_loss: 0.9782, test_f1: 0.5465
 epoch: 78, train_loss: 0.7421, test_loss: 0.9737, test_f1: 0.6127
 epoch: 79, train_loss: 0.7228, test_loss: 1.0174, test_f1: 0.5440
 epoch: 80, train_loss: 0.7165, test_loss: 1.0726, test_f1: 0.5952
 epoch: 81, train_loss: 0.7133, test_loss: 0.9805, test_f1: 0.6098
 epoch: 82, train_loss: 0.7319, test_loss: 1.1901, test_f1: 0.5598
 epoch: 83, train_loss: 0.7144, test_loss: 1.0684, test_f1: 0.5456
 epoch: 84, train_loss: 0.7079, test_loss: 1.1773, test_f1: 0.5881
 epoch: 85, train_loss: 0.7222, test_loss: 1.2149, test_f1: 0.5637
 epoch: 86, train_loss: 0.7077, test_loss: 1.0015, test_f1: 0.5640
 epoch: 87, train_loss: 0.7061, test_loss: 1.0476, test_f1: 0.5583
 epoch: 88, train_loss: 0.7154, test_loss: 0.9681, test_f1: 0.5640
 epoch: 89, train_loss: 0.7187, test_loss: 1.0634, test_f1: 0.5533
 epoch: 90, train_loss: 0.7071, test_loss: 0.9916, test_f1: 0.5608
 epoch: 91, train_loss: 0.7006, test_loss: 1.1248, test_f1: 0.5346
 epoch: 92, train_loss: 0.7044, test_loss: 1.0442, test_f1: 0.5554
 epoch: 93, train_loss: 0.6892, test_loss: 1.0467, test_f1: 0.5684
 epoch: 94, train_loss: 0.7117, test_loss: 1.0174, test_f1: 0.5732
 epoch: 95, train_loss: 0.7019, test_loss: 1.0721, test_f1: 0.5991
 epoch: 96, train_loss: 0.7085, test_loss: 1.0181, test_f1: 0.5462
 epoch: 97, train_loss: 0.7025, test_loss: 1.0128, test_f1: 0.5677
 epoch: 98, train_loss: 0.6828, test_loss: 1.0592, test_f1: 0.5765
 epoch: 99, train_loss: 0.6823, test_loss: 1.1306, test_f1: 0.5712
##################ITERATION #8 ****************************************
 epoch: 0, train_loss: 1.1502, test_loss: 1.0867, test_f1: 0.4568
 epoch: 1, train_loss: 1.0509, test_loss: 1.0294, test_f1: 0.4395
 epoch: 2, train_loss: 1.0073, test_loss: 1.0294, test_f1: 0.4775
 epoch: 3, train_loss: 0.9898, test_loss: 0.9810, test_f1: 0.4934
 epoch: 4, train_loss: 0.9654, test_loss: 0.9199, test_f1: 0.4721
 epoch: 5, train_loss: 0.9570, test_loss: 0.9265, test_f1: 0.5298
 epoch: 6, train_loss: 0.9330, test_loss: 0.9533, test_f1: 0.5195
 epoch: 7, train_loss: 0.9213, test_loss: 0.9637, test_f1: 0.4976
 epoch: 8, train_loss: 0.9256, test_loss: 0.9413, test_f1: 0.4816
 epoch: 9, train_loss: 0.9153, test_loss: 0.9072, test_f1: 0.5425
 epoch: 10, train_loss: 0.8985, test_loss: 0.9818, test_f1: 0.5318
 epoch: 11, train_loss: 0.9005, test_loss: 0.8946, test_f1: 0.5654
 epoch: 12, train_loss: 0.8870, test_loss: 0.9048, test_f1: 0.5374
 epoch: 13, train_loss: 0.8867, test_loss: 1.0049, test_f1: 0.5068
 epoch: 14, train_loss: 0.8735, test_loss: 0.9012, test_f1: 0.5381
 epoch: 15, train_loss: 0.8685, test_loss: 0.9188, test_f1: 0.5388
 epoch: 16, train_loss: 0.8616, test_loss: 0.9617, test_f1: 0.4740
 epoch: 17, train_loss: 0.8514, test_loss: 0.9257, test_f1: 0.5497
 epoch: 18, train_loss: 0.8547, test_loss: 0.8933, test_f1: 0.5217
 epoch: 19, train_loss: 0.8509, test_loss: 0.8960, test_f1: 0.5219
 epoch: 20, train_loss: 0.8562, test_loss: 0.9293, test_f1: 0.4830
 epoch: 21, train_loss: 0.8492, test_loss: 0.9291, test_f1: 0.5162
 epoch: 22, train_loss: 0.8619, test_loss: 0.9100, test_f1: 0.5653
 epoch: 23, train_loss: 0.8255, test_loss: 0.8628, test_f1: 0.5339
 epoch: 24, train_loss: 0.8699, test_loss: 0.8589, test_f1: 0.5280
 epoch: 25, train_loss: 0.8358, test_loss: 0.8960, test_f1: 0.5371
 epoch: 26, train_loss: 0.8093, test_loss: 0.8946, test_f1: 0.5334
 epoch: 27, train_loss: 0.8259, test_loss: 0.9325, test_f1: 0.5566
 epoch: 28, train_loss: 0.8313, test_loss: 0.9097, test_f1: 0.5589
 epoch: 29, train_loss: 0.8161, test_loss: 0.8397, test_f1: 0.5640
 epoch: 30, train_loss: 0.8172, test_loss: 0.8247, test_f1: 0.5712
 epoch: 31, train_loss: 0.8193, test_loss: 0.9062, test_f1: 0.5403
 epoch: 32, train_loss: 0.8106, test_loss: 0.8924, test_f1: 0.5461
 epoch: 33, train_loss: 0.7870, test_loss: 0.8571, test_f1: 0.5353
 epoch: 34, train_loss: 0.7914, test_loss: 0.8448, test_f1: 0.5638
 epoch: 35, train_loss: 0.7786, test_loss: 1.0099, test_f1: 0.5367
 epoch: 36, train_loss: 0.7920, test_loss: 0.9113, test_f1: 0.5716
 epoch: 37, train_loss: 0.7908, test_loss: 0.8048, test_f1: 0.5519
 epoch: 38, train_loss: 0.7815, test_loss: 0.8462, test_f1: 0.5396
 epoch: 39, train_loss: 0.7691, test_loss: 0.8040, test_f1: 0.5583
 epoch: 40, train_loss: 0.7606, test_loss: 0.8919, test_f1: 0.5504
 epoch: 41, train_loss: 0.7642, test_loss: 1.0290, test_f1: 0.5523
 epoch: 42, train_loss: 0.7688, test_loss: 1.0003, test_f1: 0.5419
 epoch: 43, train_loss: 0.7745, test_loss: 0.8427, test_f1: 0.5417
 epoch: 44, train_loss: 0.7608, test_loss: 0.9092, test_f1: 0.5528
 epoch: 45, train_loss: 0.7610, test_loss: 0.9308, test_f1: 0.5669
 epoch: 46, train_loss: 0.7692, test_loss: 0.9505, test_f1: 0.5359
 epoch: 47, train_loss: 0.7768, test_loss: 0.9730, test_f1: 0.5551
 epoch: 48, train_loss: 0.7540, test_loss: 0.9866, test_f1: 0.5575
 epoch: 49, train_loss: 0.7532, test_loss: 1.0081, test_f1: 0.5516
 epoch: 50, train_loss: 0.7428, test_loss: 0.9841, test_f1: 0.5620
 epoch: 51, train_loss: 0.7194, test_loss: 0.9439, test_f1: 0.5530
 epoch: 52, train_loss: 0.7114, test_loss: 0.9058, test_f1: 0.5717
 epoch: 53, train_loss: 0.7105, test_loss: 0.8844, test_f1: 0.5648
 epoch: 54, train_loss: 0.7118, test_loss: 0.9360, test_f1: 0.5920
 epoch: 55, train_loss: 0.7027, test_loss: 0.9591, test_f1: 0.5724
 epoch: 56, train_loss: 0.6986, test_loss: 1.0126, test_f1: 0.5568
 epoch: 57, train_loss: 0.7056, test_loss: 0.8899, test_f1: 0.5655
 epoch: 58, train_loss: 0.6889, test_loss: 0.9107, test_f1: 0.5663
 epoch: 59, train_loss: 0.6906, test_loss: 0.8804, test_f1: 0.5804
 epoch: 60, train_loss: 0.6951, test_loss: 1.0331, test_f1: 0.5545
 epoch: 61, train_loss: 0.6979, test_loss: 0.9212, test_f1: 0.5654
 epoch: 62, train_loss: 0.7019, test_loss: 0.8468, test_f1: 0.5814
 epoch: 63, train_loss: 0.6778, test_loss: 0.9742, test_f1: 0.5736
 epoch: 64, train_loss: 0.6911, test_loss: 0.9699, test_f1: 0.5920
 epoch: 65, train_loss: 0.6695, test_loss: 1.1259, test_f1: 0.5595
 epoch: 66, train_loss: 0.6923, test_loss: 0.9511, test_f1: 0.5871
 epoch: 67, train_loss: 0.6826, test_loss: 0.9863, test_f1: 0.5518
 epoch: 68, train_loss: 0.6740, test_loss: 1.0316, test_f1: 0.5453
 epoch: 69, train_loss: 0.6850, test_loss: 0.9188, test_f1: 0.5757
 epoch: 70, train_loss: 0.6744, test_loss: 1.0266, test_f1: 0.5559
 epoch: 71, train_loss: 0.6876, test_loss: 0.9810, test_f1: 0.5837
 epoch: 72, train_loss: 0.6494, test_loss: 1.0253, test_f1: 0.6225
 epoch: 73, train_loss: 0.6725, test_loss: 1.0917, test_f1: 0.5674
 epoch: 74, train_loss: 0.6762, test_loss: 0.9545, test_f1: 0.5721
 epoch: 75, train_loss: 0.6573, test_loss: 0.9329, test_f1: 0.6127
 epoch: 76, train_loss: 0.6618, test_loss: 0.9567, test_f1: 0.5646
 epoch: 77, train_loss: 0.6543, test_loss: 0.9276, test_f1: 0.6251
 epoch: 78, train_loss: 0.6765, test_loss: 0.8910, test_f1: 0.6050
 epoch: 79, train_loss: 0.6438, test_loss: 0.9990, test_f1: 0.5805
 epoch: 80, train_loss: 0.6530, test_loss: 0.9622, test_f1: 0.5735
 epoch: 81, train_loss: 0.6865, test_loss: 0.9360, test_f1: 0.5805
 epoch: 82, train_loss: 0.6490, test_loss: 0.9262, test_f1: 0.5753
 epoch: 83, train_loss: 0.6604, test_loss: 1.0362, test_f1: 0.5716
 epoch: 84, train_loss: 0.6651, test_loss: 1.0127, test_f1: 0.5959
 epoch: 85, train_loss: 0.6626, test_loss: 1.0376, test_f1: 0.5955
 epoch: 86, train_loss: 0.6374, test_loss: 1.0433, test_f1: 0.6167
 epoch: 87, train_loss: 0.6345, test_loss: 1.0550, test_f1: 0.5848
 epoch: 88, train_loss: 0.6459, test_loss: 0.9913, test_f1: 0.6127
 epoch: 89, train_loss: 0.6423, test_loss: 0.9891, test_f1: 0.6254
 epoch: 90, train_loss: 0.6407, test_loss: 1.0774, test_f1: 0.6266
 epoch: 91, train_loss: 0.6365, test_loss: 1.0682, test_f1: 0.5702
 epoch: 92, train_loss: 0.6404, test_loss: 0.9764, test_f1: 0.5797
 epoch: 93, train_loss: 0.6548, test_loss: 0.8968, test_f1: 0.5906
 epoch: 94, train_loss: 0.6355, test_loss: 0.9731, test_f1: 0.5999
 epoch: 95, train_loss: 0.6328, test_loss: 0.9492, test_f1: 0.5846
 epoch: 96, train_loss: 0.6351, test_loss: 1.0116, test_f1: 0.6034
 epoch: 97, train_loss: 0.6566, test_loss: 0.9451, test_f1: 0.6188
 epoch: 98, train_loss: 0.6375, test_loss: 0.9314, test_f1: 0.6044
 epoch: 99, train_loss: 0.6342, test_loss: 0.9500, test_f1: 0.5933
##################ITERATION #9 ****************************************
 epoch: 0, train_loss: 1.1479, test_loss: 1.3938, test_f1: 0.3912
 epoch: 1, train_loss: 1.0587, test_loss: 1.1112, test_f1: 0.3471
 epoch: 2, train_loss: 1.0190, test_loss: 1.0540, test_f1: 0.4508
 epoch: 3, train_loss: 1.0079, test_loss: 1.0657, test_f1: 0.4585
 epoch: 4, train_loss: 0.9900, test_loss: 1.0850, test_f1: 0.4523
 epoch: 5, train_loss: 0.9740, test_loss: 1.0048, test_f1: 0.4528
 epoch: 6, train_loss: 0.9595, test_loss: 1.0569, test_f1: 0.4528
 epoch: 7, train_loss: 0.9401, test_loss: 1.0070, test_f1: 0.4818
 epoch: 8, train_loss: 0.9225, test_loss: 0.9669, test_f1: 0.4998
 epoch: 9, train_loss: 0.9278, test_loss: 0.9149, test_f1: 0.5123
 epoch: 10, train_loss: 0.9138, test_loss: 0.9761, test_f1: 0.4882
 epoch: 11, train_loss: 0.9063, test_loss: 0.9292, test_f1: 0.5528
 epoch: 12, train_loss: 0.8911, test_loss: 0.9419, test_f1: 0.5276
 epoch: 13, train_loss: 0.8986, test_loss: 0.9367, test_f1: 0.4887
 epoch: 14, train_loss: 0.8750, test_loss: 1.0888, test_f1: 0.5151
 epoch: 15, train_loss: 0.8811, test_loss: 0.9039, test_f1: 0.5182
 epoch: 16, train_loss: 0.8769, test_loss: 0.9245, test_f1: 0.5503
 epoch: 17, train_loss: 0.8673, test_loss: 0.8262, test_f1: 0.5516
 epoch: 18, train_loss: 0.8607, test_loss: 0.9083, test_f1: 0.5418
 epoch: 19, train_loss: 0.8501, test_loss: 0.8936, test_f1: 0.5558
 epoch: 20, train_loss: 0.8510, test_loss: 0.9583, test_f1: 0.5126
 epoch: 21, train_loss: 0.8453, test_loss: 0.9830, test_f1: 0.5108
 epoch: 22, train_loss: 0.8453, test_loss: 0.9329, test_f1: 0.5237
 epoch: 23, train_loss: 0.8461, test_loss: 0.8572, test_f1: 0.5456
 epoch: 24, train_loss: 0.8299, test_loss: 0.8556, test_f1: 0.5406
 epoch: 25, train_loss: 0.8327, test_loss: 0.8978, test_f1: 0.5311
 epoch: 26, train_loss: 0.8211, test_loss: 0.9471, test_f1: 0.5087
 epoch: 27, train_loss: 0.8161, test_loss: 0.9499, test_f1: 0.5198
 epoch: 28, train_loss: 0.8100, test_loss: 0.9021, test_f1: 0.5227
 epoch: 29, train_loss: 0.8168, test_loss: 0.8782, test_f1: 0.6157
 epoch: 30, train_loss: 0.8213, test_loss: 0.8608, test_f1: 0.6240
 epoch: 31, train_loss: 0.8218, test_loss: 0.8798, test_f1: 0.5386
 epoch: 32, train_loss: 0.8065, test_loss: 0.8628, test_f1: 0.5600
 epoch: 33, train_loss: 0.7921, test_loss: 0.8408, test_f1: 0.5722
 epoch: 34, train_loss: 0.7868, test_loss: 0.8905, test_f1: 0.5950
 epoch: 35, train_loss: 0.8022, test_loss: 0.8704, test_f1: 0.5376
 epoch: 36, train_loss: 0.7984, test_loss: 0.8532, test_f1: 0.5730
 epoch: 37, train_loss: 0.7760, test_loss: 0.8381, test_f1: 0.5669
 epoch: 38, train_loss: 0.7694, test_loss: 0.8467, test_f1: 0.5493
 epoch: 39, train_loss: 0.7649, test_loss: 0.9242, test_f1: 0.5494
 epoch: 40, train_loss: 0.7808, test_loss: 0.8395, test_f1: 0.6097
 epoch: 41, train_loss: 0.7715, test_loss: 0.8588, test_f1: 0.5426
 epoch: 42, train_loss: 0.7673, test_loss: 0.9351, test_f1: 0.5398
 epoch: 43, train_loss: 0.7684, test_loss: 0.8453, test_f1: 0.6392
 epoch: 44, train_loss: 0.7696, test_loss: 0.9164, test_f1: 0.5315
 epoch: 45, train_loss: 0.7756, test_loss: 0.8799, test_f1: 0.5623
 epoch: 46, train_loss: 0.7662, test_loss: 0.8660, test_f1: 0.5927
 epoch: 47, train_loss: 0.7584, test_loss: 0.8682, test_f1: 0.6170
 epoch: 48, train_loss: 0.7592, test_loss: 0.9751, test_f1: 0.5598
 epoch: 49, train_loss: 0.7476, test_loss: 0.8489, test_f1: 0.5996
 epoch: 50, train_loss: 0.7668, test_loss: 0.8855, test_f1: 0.5513
 epoch: 51, train_loss: 0.7134, test_loss: 0.9376, test_f1: 0.6036
 epoch: 52, train_loss: 0.7215, test_loss: 0.8390, test_f1: 0.5958
 epoch: 53, train_loss: 0.7148, test_loss: 0.8710, test_f1: 0.6150
 epoch: 54, train_loss: 0.7030, test_loss: 0.8571, test_f1: 0.5770
 epoch: 55, train_loss: 0.7059, test_loss: 0.8715, test_f1: 0.5916
 epoch: 56, train_loss: 0.6913, test_loss: 0.8804, test_f1: 0.5749
 epoch: 57, train_loss: 0.6810, test_loss: 0.8492, test_f1: 0.5850
 epoch: 58, train_loss: 0.7004, test_loss: 0.8362, test_f1: 0.6509
 epoch: 59, train_loss: 0.6972, test_loss: 0.9070, test_f1: 0.5587
 epoch: 60, train_loss: 0.6824, test_loss: 0.9101, test_f1: 0.5900
 epoch: 61, train_loss: 0.6919, test_loss: 0.9103, test_f1: 0.6142
 epoch: 62, train_loss: 0.6926, test_loss: 0.8509, test_f1: 0.5820
 epoch: 63, train_loss: 0.6845, test_loss: 0.8886, test_f1: 0.6322
 epoch: 64, train_loss: 0.6822, test_loss: 0.9390, test_f1: 0.5750
 epoch: 65, train_loss: 0.6938, test_loss: 0.9313, test_f1: 0.6268
 epoch: 66, train_loss: 0.6661, test_loss: 0.9235, test_f1: 0.6232
 epoch: 67, train_loss: 0.6573, test_loss: 0.8961, test_f1: 0.5715
 epoch: 68, train_loss: 0.6819, test_loss: 0.8931, test_f1: 0.6274
 epoch: 69, train_loss: 0.6864, test_loss: 0.8964, test_f1: 0.6039
 epoch: 70, train_loss: 0.6672, test_loss: 0.8491, test_f1: 0.6493
 epoch: 71, train_loss: 0.6771, test_loss: 0.8567, test_f1: 0.6090
 epoch: 72, train_loss: 0.6623, test_loss: 0.9217, test_f1: 0.6305
 epoch: 73, train_loss: 0.6615, test_loss: 0.9036, test_f1: 0.6385
 epoch: 74, train_loss: 0.6643, test_loss: 0.8837, test_f1: 0.6396
 epoch: 75, train_loss: 0.6707, test_loss: 0.9061, test_f1: 0.5859
 epoch: 76, train_loss: 0.6611, test_loss: 0.8764, test_f1: 0.5869
 epoch: 77, train_loss: 0.6663, test_loss: 0.8898, test_f1: 0.6361
 epoch: 78, train_loss: 0.6609, test_loss: 0.9274, test_f1: 0.6236
 epoch: 79, train_loss: 0.6535, test_loss: 0.8603, test_f1: 0.5918
 epoch: 80, train_loss: 0.6551, test_loss: 0.9194, test_f1: 0.6303
 epoch: 81, train_loss: 0.6691, test_loss: 0.9334, test_f1: 0.6198
 epoch: 82, train_loss: 0.6586, test_loss: 0.8824, test_f1: 0.6352
 epoch: 83, train_loss: 0.6431, test_loss: 0.9547, test_f1: 0.6212
 epoch: 84, train_loss: 0.6538, test_loss: 0.9331, test_f1: 0.5838
 epoch: 85, train_loss: 0.6575, test_loss: 0.9447, test_f1: 0.6191
 epoch: 86, train_loss: 0.6464, test_loss: 0.9153, test_f1: 0.6016
 epoch: 87, train_loss: 0.6466, test_loss: 0.9411, test_f1: 0.6116
 epoch: 88, train_loss: 0.6382, test_loss: 0.9159, test_f1: 0.6354
 epoch: 89, train_loss: 0.6368, test_loss: 0.9004, test_f1: 0.5842
 epoch: 90, train_loss: 0.6335, test_loss: 0.8967, test_f1: 0.6374
 epoch: 91, train_loss: 0.6345, test_loss: 0.9143, test_f1: 0.6420
 epoch: 92, train_loss: 0.6344, test_loss: 0.9289, test_f1: 0.6298
 epoch: 93, train_loss: 0.6294, test_loss: 0.9187, test_f1: 0.6191
 epoch: 94, train_loss: 0.6209, test_loss: 0.9921, test_f1: 0.6313
 epoch: 95, train_loss: 0.6350, test_loss: 0.9261, test_f1: 0.6159
 epoch: 96, train_loss: 0.6392, test_loss: 0.9434, test_f1: 0.6406
 epoch: 97, train_loss: 0.6424, test_loss: 0.8950, test_f1: 0.6003
 epoch: 98, train_loss: 0.6294, test_loss: 0.8838, test_f1: 0.6523
 epoch: 99, train_loss: 0.6404, test_loss: 0.9173, test_f1: 0.6242

Training completed in 1422.82 seconds
Best F1: 0.6918 at epoch 97
Mean F1 across iterations: 0.6531  0.0205
========================FINAL RESULTS================================
FEGIN weighted F1: 0.6918  0.0205
python main.py --data ltspice_examples --representation component_pin --model FEGIN --layers 6 --hiddens 32 --batch_size 32 --lr 0.01 --emb_size 512 --epochs 100 --save_appendix component_pin_L6_H32_BS32_LR0.01_E512 --no_val
-----



STDERR:
  File "main.py", line 370, in <module>
    main()
  File "main.py", line 254, in main
    dataset = dataset_class(
  File "/home/philip/projects/ltspice_examples_code_repo/Circuit-Completion-Using-GNNs/component_classification_with_link_prediction_head/evaluation/FEGIN/kernel/circuit_datasets.py", line 15, in __init__
    self.data, self.slices = torch.load(self.processed_paths[0])
  File "/home/philip/.local/lib/python3.8/site-packages/torch/serialization.py", line 1040, in load
    warnings.warn(
  File "/usr/lib/python3.8/warnings.py", line 109, in _showwarnmsg
    sw(msg.message, msg.category, msg.filename, msg.lineno,
  File "main.py", line 47, in warn_with_traceback
    traceback.print_stack(file=log)
/home/philip/projects/ltspice_examples_code_repo/Circuit-Completion-Using-GNNs/component_classification_with_link_prediction_head/evaluation/FEGIN/kernel/circuit_datasets.py:15: FutureWarning: You are using `torch.load` with `weights_only=False` (the current default value), which uses the default pickle module implicitly. It is possible to construct malicious pickle data which will execute arbitrary code during unpickling (See https://github.com/pytorch/pytorch/blob/main/SECURITY.md#untrusted-models for more details). In a future release, the default value for `weights_only` will be flipped to `True`. This limits the functions that could be executed during unpickling. Arbitrary objects will no longer be allowed to be loaded via this mode unless they are explicitly allowlisted by the user via `torch.serialization.add_safe_globals`. We recommend you start setting `weights_only=True` for any use case where you don't have full control of the loaded file. Please open an issue on GitHub for any issues related to this experimental feature.
  self.data, self.slices = torch.load(self.processed_paths[0])
