STDOUT:
Results will be saved in /home/philip/projects/ltspice_examples_code_repo/Circuit-Completion-Using-GNNs/component_classification_with_link_prediction_head/evaluation/FEGIN/results/model_FEGIN_dataset_ltspice_examples
Command line input: python main.py --data ltspice_examples --representation component_pin --model FEGIN --layers 4 --hiddens 64 --batch_size 256 --lr 0.0001 --emb_size 128 --epochs 100 --save_appendix component_pin_L4_H64_BS256_LR0.0001_E128 --no_val
 is saved.
-----
ltspice_examples - FEGIN
Using 4 layers, 64 hidden units, h = 2
Loading component_pin representation dataset
ENTERED
Training FEGIN on component_pin representation
Train: 3560, Test: 848
##################ITERATION #0 ****************************************
 epoch: 0, train_loss: 1.3963, test_loss: 1.3955, test_f1: 0.0303
 epoch: 1, train_loss: 1.3886, test_loss: 1.3925, test_f1: 0.0303
 epoch: 2, train_loss: 1.3841, test_loss: 1.3888, test_f1: 0.0303
 epoch: 3, train_loss: 1.3788, test_loss: 1.3825, test_f1: 0.1337
 epoch: 4, train_loss: 1.3729, test_loss: 1.3736, test_f1: 0.3006
 epoch: 5, train_loss: 1.3660, test_loss: 1.3631, test_f1: 0.3381
 epoch: 6, train_loss: 1.3577, test_loss: 1.3522, test_f1: 0.3361
 epoch: 7, train_loss: 1.3463, test_loss: 1.3398, test_f1: 0.3361
 epoch: 8, train_loss: 1.3331, test_loss: 1.3240, test_f1: 0.3342
 epoch: 9, train_loss: 1.3163, test_loss: 1.3051, test_f1: 0.3332
 epoch: 10, train_loss: 1.2979, test_loss: 1.2825, test_f1: 0.3280
 epoch: 11, train_loss: 1.2755, test_loss: 1.2581, test_f1: 0.3332
 epoch: 12, train_loss: 1.2535, test_loss: 1.2335, test_f1: 0.3361
 epoch: 13, train_loss: 1.2292, test_loss: 1.2108, test_f1: 0.3361
 epoch: 14, train_loss: 1.2102, test_loss: 1.1875, test_f1: 0.3371
 epoch: 15, train_loss: 1.1921, test_loss: 1.1658, test_f1: 0.3374
 epoch: 16, train_loss: 1.1733, test_loss: 1.1472, test_f1: 0.3429
 epoch: 17, train_loss: 1.1557, test_loss: 1.1253, test_f1: 0.3429
 epoch: 18, train_loss: 1.1375, test_loss: 1.1092, test_f1: 0.3429
 epoch: 19, train_loss: 1.1179, test_loss: 1.0907, test_f1: 0.3438
 epoch: 20, train_loss: 1.1028, test_loss: 1.0736, test_f1: 0.3435
 epoch: 21, train_loss: 1.0877, test_loss: 1.0659, test_f1: 0.3578
 epoch: 22, train_loss: 1.0712, test_loss: 1.0501, test_f1: 0.3658
 epoch: 23, train_loss: 1.0626, test_loss: 1.0471, test_f1: 0.3644
 epoch: 24, train_loss: 1.0551, test_loss: 1.0382, test_f1: 0.3827
 epoch: 25, train_loss: 1.0384, test_loss: 1.0352, test_f1: 0.3828
 epoch: 26, train_loss: 1.0300, test_loss: 1.0319, test_f1: 0.3754
 epoch: 27, train_loss: 1.0279, test_loss: 1.0274, test_f1: 0.4024
 epoch: 28, train_loss: 1.0181, test_loss: 1.0328, test_f1: 0.4141
 epoch: 29, train_loss: 1.0114, test_loss: 1.0229, test_f1: 0.4192
 epoch: 30, train_loss: 1.0040, test_loss: 1.0207, test_f1: 0.4409
 epoch: 31, train_loss: 0.9988, test_loss: 1.0201, test_f1: 0.4358
 epoch: 32, train_loss: 0.9909, test_loss: 1.0246, test_f1: 0.4378
 epoch: 33, train_loss: 0.9953, test_loss: 1.0143, test_f1: 0.4400
 epoch: 34, train_loss: 0.9866, test_loss: 1.0451, test_f1: 0.4271
 epoch: 35, train_loss: 0.9855, test_loss: 1.0208, test_f1: 0.4527
 epoch: 36, train_loss: 0.9806, test_loss: 1.0266, test_f1: 0.4468
 epoch: 37, train_loss: 0.9753, test_loss: 1.0369, test_f1: 0.4428
 epoch: 38, train_loss: 0.9688, test_loss: 1.0157, test_f1: 0.4554
 epoch: 39, train_loss: 0.9692, test_loss: 1.0415, test_f1: 0.4460
 epoch: 40, train_loss: 0.9618, test_loss: 1.0111, test_f1: 0.4609
 epoch: 41, train_loss: 0.9630, test_loss: 1.0168, test_f1: 0.4606
 epoch: 42, train_loss: 0.9542, test_loss: 1.0296, test_f1: 0.4666
 epoch: 43, train_loss: 0.9543, test_loss: 1.0159, test_f1: 0.4654
 epoch: 44, train_loss: 0.9512, test_loss: 1.0232, test_f1: 0.4638
 epoch: 45, train_loss: 0.9458, test_loss: 1.0368, test_f1: 0.4658
 epoch: 46, train_loss: 0.9379, test_loss: 1.0357, test_f1: 0.4661
 epoch: 47, train_loss: 0.9348, test_loss: 1.0122, test_f1: 0.4841
 epoch: 48, train_loss: 0.9381, test_loss: 1.0197, test_f1: 0.4613
 epoch: 49, train_loss: 0.9235, test_loss: 1.0361, test_f1: 0.4843
 epoch: 50, train_loss: 0.9258, test_loss: 1.0055, test_f1: 0.4911
 epoch: 51, train_loss: 0.9180, test_loss: 1.0215, test_f1: 0.4894
 epoch: 52, train_loss: 0.9147, test_loss: 1.0225, test_f1: 0.4786
 epoch: 53, train_loss: 0.9204, test_loss: 1.0230, test_f1: 0.4828
 epoch: 54, train_loss: 0.9096, test_loss: 1.0282, test_f1: 0.4869
 epoch: 55, train_loss: 0.9100, test_loss: 1.0161, test_f1: 0.4949
 epoch: 56, train_loss: 0.9121, test_loss: 1.0154, test_f1: 0.4883
 epoch: 57, train_loss: 0.9118, test_loss: 1.0226, test_f1: 0.4942
 epoch: 58, train_loss: 0.9059, test_loss: 1.0281, test_f1: 0.4889
 epoch: 59, train_loss: 0.9062, test_loss: 1.0119, test_f1: 0.4925
 epoch: 60, train_loss: 0.8972, test_loss: 1.0221, test_f1: 0.4780
 epoch: 61, train_loss: 0.8959, test_loss: 1.0238, test_f1: 0.4890
 epoch: 62, train_loss: 0.8956, test_loss: 1.0152, test_f1: 0.4934
 epoch: 63, train_loss: 0.8920, test_loss: 1.0137, test_f1: 0.4821
 epoch: 64, train_loss: 0.8885, test_loss: 1.0082, test_f1: 0.4842
 epoch: 65, train_loss: 0.8908, test_loss: 1.0166, test_f1: 0.4855
 epoch: 66, train_loss: 0.8898, test_loss: 1.0164, test_f1: 0.4868
 epoch: 67, train_loss: 0.8759, test_loss: 1.0081, test_f1: 0.4869
 epoch: 68, train_loss: 0.8861, test_loss: 0.9989, test_f1: 0.4935
 epoch: 69, train_loss: 0.8747, test_loss: 1.0196, test_f1: 0.4870
 epoch: 70, train_loss: 0.8768, test_loss: 1.0064, test_f1: 0.4819
 epoch: 71, train_loss: 0.8741, test_loss: 1.0113, test_f1: 0.5012
 epoch: 72, train_loss: 0.8712, test_loss: 1.0076, test_f1: 0.5059
 epoch: 73, train_loss: 0.8725, test_loss: 0.9983, test_f1: 0.5051
 epoch: 74, train_loss: 0.8769, test_loss: 1.0153, test_f1: 0.5038
 epoch: 75, train_loss: 0.8699, test_loss: 1.0030, test_f1: 0.5051
 epoch: 76, train_loss: 0.8696, test_loss: 1.0003, test_f1: 0.5066
 epoch: 77, train_loss: 0.8557, test_loss: 1.0014, test_f1: 0.5037
 epoch: 78, train_loss: 0.8589, test_loss: 1.0117, test_f1: 0.5054
 epoch: 79, train_loss: 0.8507, test_loss: 0.9933, test_f1: 0.5079
 epoch: 80, train_loss: 0.8538, test_loss: 1.0027, test_f1: 0.5148
 epoch: 81, train_loss: 0.8538, test_loss: 0.9831, test_f1: 0.5131
 epoch: 82, train_loss: 0.8418, test_loss: 1.0152, test_f1: 0.4976
 epoch: 83, train_loss: 0.8461, test_loss: 0.9948, test_f1: 0.5122
 epoch: 84, train_loss: 0.8409, test_loss: 1.0063, test_f1: 0.5067
 epoch: 85, train_loss: 0.8373, test_loss: 1.0052, test_f1: 0.5097
 epoch: 86, train_loss: 0.8415, test_loss: 0.9800, test_f1: 0.5113
 epoch: 87, train_loss: 0.8390, test_loss: 1.0151, test_f1: 0.5073
 epoch: 88, train_loss: 0.8249, test_loss: 0.9996, test_f1: 0.5121
 epoch: 89, train_loss: 0.8239, test_loss: 0.9944, test_f1: 0.5073
 epoch: 90, train_loss: 0.8236, test_loss: 0.9982, test_f1: 0.5079
 epoch: 91, train_loss: 0.8184, test_loss: 0.9952, test_f1: 0.5167
 epoch: 92, train_loss: 0.8219, test_loss: 1.0041, test_f1: 0.5094
 epoch: 93, train_loss: 0.8307, test_loss: 0.9978, test_f1: 0.5118
 epoch: 94, train_loss: 0.8189, test_loss: 1.0145, test_f1: 0.5059
 epoch: 95, train_loss: 0.8115, test_loss: 1.0080, test_f1: 0.5155
 epoch: 96, train_loss: 0.8194, test_loss: 0.9873, test_f1: 0.5143
 epoch: 97, train_loss: 0.8099, test_loss: 0.9966, test_f1: 0.5171
 epoch: 98, train_loss: 0.8057, test_loss: 0.9870, test_f1: 0.5126
 epoch: 99, train_loss: 0.8001, test_loss: 1.0021, test_f1: 0.5137
##################ITERATION #1 ****************************************
 epoch: 0, train_loss: 1.3545, test_loss: 1.3636, test_f1: 0.2260
 epoch: 1, train_loss: 1.3360, test_loss: 1.3513, test_f1: 0.2260
 epoch: 2, train_loss: 1.3224, test_loss: 1.3328, test_f1: 0.2260
 epoch: 3, train_loss: 1.3091, test_loss: 1.3107, test_f1: 0.2260
 epoch: 4, train_loss: 1.2932, test_loss: 1.2889, test_f1: 0.2260
 epoch: 5, train_loss: 1.2762, test_loss: 1.2675, test_f1: 0.2260
 epoch: 6, train_loss: 1.2591, test_loss: 1.2457, test_f1: 0.2359
 epoch: 7, train_loss: 1.2393, test_loss: 1.2242, test_f1: 0.3358
 epoch: 8, train_loss: 1.2203, test_loss: 1.2014, test_f1: 0.3343
 epoch: 9, train_loss: 1.2036, test_loss: 1.1803, test_f1: 0.3374
 epoch: 10, train_loss: 1.1821, test_loss: 1.1593, test_f1: 0.3400
 epoch: 11, train_loss: 1.1619, test_loss: 1.1367, test_f1: 0.3419
 epoch: 12, train_loss: 1.1438, test_loss: 1.1161, test_f1: 0.3419
 epoch: 13, train_loss: 1.1193, test_loss: 1.0967, test_f1: 0.3429
 epoch: 14, train_loss: 1.1036, test_loss: 1.0776, test_f1: 0.3454
 epoch: 15, train_loss: 1.0829, test_loss: 1.0615, test_f1: 0.3615
 epoch: 16, train_loss: 1.0652, test_loss: 1.0490, test_f1: 0.3701
 epoch: 17, train_loss: 1.0478, test_loss: 1.0338, test_f1: 0.3832
 epoch: 18, train_loss: 1.0360, test_loss: 1.0262, test_f1: 0.4045
 epoch: 19, train_loss: 1.0253, test_loss: 1.0238, test_f1: 0.4045
 epoch: 20, train_loss: 1.0104, test_loss: 1.0110, test_f1: 0.4280
 epoch: 21, train_loss: 1.0051, test_loss: 1.0084, test_f1: 0.4470
 epoch: 22, train_loss: 0.9976, test_loss: 1.0030, test_f1: 0.4451
 epoch: 23, train_loss: 0.9879, test_loss: 1.0005, test_f1: 0.4529
 epoch: 24, train_loss: 0.9795, test_loss: 0.9941, test_f1: 0.4585
 epoch: 25, train_loss: 0.9728, test_loss: 0.9842, test_f1: 0.4757
 epoch: 26, train_loss: 0.9596, test_loss: 0.9868, test_f1: 0.4710
 epoch: 27, train_loss: 0.9564, test_loss: 0.9810, test_f1: 0.4801
 epoch: 28, train_loss: 0.9486, test_loss: 0.9860, test_f1: 0.4715
 epoch: 29, train_loss: 0.9413, test_loss: 0.9692, test_f1: 0.4870
 epoch: 30, train_loss: 0.9330, test_loss: 0.9787, test_f1: 0.4869
 epoch: 31, train_loss: 0.9286, test_loss: 0.9637, test_f1: 0.4971
 epoch: 32, train_loss: 0.9148, test_loss: 0.9670, test_f1: 0.5003
 epoch: 33, train_loss: 0.9136, test_loss: 0.9547, test_f1: 0.5002
 epoch: 34, train_loss: 0.9098, test_loss: 0.9423, test_f1: 0.5027
 epoch: 35, train_loss: 0.8969, test_loss: 0.9569, test_f1: 0.5073
 epoch: 36, train_loss: 0.8957, test_loss: 0.9457, test_f1: 0.5171
 epoch: 37, train_loss: 0.8877, test_loss: 0.9421, test_f1: 0.5088
 epoch: 38, train_loss: 0.8819, test_loss: 0.9280, test_f1: 0.5251
 epoch: 39, train_loss: 0.8799, test_loss: 0.9289, test_f1: 0.5306
 epoch: 40, train_loss: 0.8657, test_loss: 0.9331, test_f1: 0.5222
 epoch: 41, train_loss: 0.8630, test_loss: 0.9158, test_f1: 0.5357
 epoch: 42, train_loss: 0.8605, test_loss: 0.9241, test_f1: 0.5291
 epoch: 43, train_loss: 0.8526, test_loss: 0.9163, test_f1: 0.5353
 epoch: 44, train_loss: 0.8510, test_loss: 0.8847, test_f1: 0.5445
 epoch: 45, train_loss: 0.8567, test_loss: 0.9290, test_f1: 0.5275
 epoch: 46, train_loss: 0.8484, test_loss: 0.8975, test_f1: 0.5413
 epoch: 47, train_loss: 0.8397, test_loss: 0.8887, test_f1: 0.5390
 epoch: 48, train_loss: 0.8225, test_loss: 0.9089, test_f1: 0.5235
 epoch: 49, train_loss: 0.8277, test_loss: 0.8711, test_f1: 0.5422
 epoch: 50, train_loss: 0.8243, test_loss: 0.8756, test_f1: 0.5387
 epoch: 51, train_loss: 0.8165, test_loss: 0.8694, test_f1: 0.5486
 epoch: 52, train_loss: 0.8091, test_loss: 0.8810, test_f1: 0.5364
 epoch: 53, train_loss: 0.8064, test_loss: 0.8719, test_f1: 0.5382
 epoch: 54, train_loss: 0.8075, test_loss: 0.8723, test_f1: 0.5319
 epoch: 55, train_loss: 0.8048, test_loss: 0.8760, test_f1: 0.5225
 epoch: 56, train_loss: 0.8074, test_loss: 0.8710, test_f1: 0.5400
 epoch: 57, train_loss: 0.7946, test_loss: 0.8719, test_f1: 0.5369
 epoch: 58, train_loss: 0.7942, test_loss: 0.8717, test_f1: 0.5331
 epoch: 59, train_loss: 0.7984, test_loss: 0.8614, test_f1: 0.5480
 epoch: 60, train_loss: 0.7894, test_loss: 0.8613, test_f1: 0.5427
 epoch: 61, train_loss: 0.7931, test_loss: 0.8611, test_f1: 0.5303
 epoch: 62, train_loss: 0.7974, test_loss: 0.8556, test_f1: 0.5443
 epoch: 63, train_loss: 0.7805, test_loss: 0.8502, test_f1: 0.5506
 epoch: 64, train_loss: 0.7900, test_loss: 0.8507, test_f1: 0.5430
 epoch: 65, train_loss: 0.7952, test_loss: 0.8520, test_f1: 0.5427
 epoch: 66, train_loss: 0.7827, test_loss: 0.8531, test_f1: 0.5509
 epoch: 67, train_loss: 0.7759, test_loss: 0.8546, test_f1: 0.5411
 epoch: 68, train_loss: 0.7700, test_loss: 0.8568, test_f1: 0.5429
 epoch: 69, train_loss: 0.7761, test_loss: 0.8446, test_f1: 0.5560
 epoch: 70, train_loss: 0.7834, test_loss: 0.8435, test_f1: 0.5539
 epoch: 71, train_loss: 0.7745, test_loss: 0.8609, test_f1: 0.5447
 epoch: 72, train_loss: 0.7605, test_loss: 0.8624, test_f1: 0.5363
 epoch: 73, train_loss: 0.7719, test_loss: 0.8618, test_f1: 0.5405
 epoch: 74, train_loss: 0.7672, test_loss: 0.8466, test_f1: 0.5416
 epoch: 75, train_loss: 0.7720, test_loss: 0.8601, test_f1: 0.5452
 epoch: 76, train_loss: 0.7581, test_loss: 0.8581, test_f1: 0.5312
 epoch: 77, train_loss: 0.7538, test_loss: 0.8547, test_f1: 0.5443
 epoch: 78, train_loss: 0.7558, test_loss: 0.8530, test_f1: 0.5413
 epoch: 79, train_loss: 0.7562, test_loss: 0.8498, test_f1: 0.5471
 epoch: 80, train_loss: 0.7552, test_loss: 0.8536, test_f1: 0.5443
 epoch: 81, train_loss: 0.7616, test_loss: 0.8655, test_f1: 0.5436
 epoch: 82, train_loss: 0.7509, test_loss: 0.8527, test_f1: 0.5415
 epoch: 83, train_loss: 0.7483, test_loss: 0.8448, test_f1: 0.5501
 epoch: 84, train_loss: 0.7459, test_loss: 0.8499, test_f1: 0.5558
 epoch: 85, train_loss: 0.7439, test_loss: 0.8450, test_f1: 0.5649
 epoch: 86, train_loss: 0.7489, test_loss: 0.8464, test_f1: 0.5539
 epoch: 87, train_loss: 0.7367, test_loss: 0.8576, test_f1: 0.5468
 epoch: 88, train_loss: 0.7466, test_loss: 0.8477, test_f1: 0.5568
 epoch: 89, train_loss: 0.7362, test_loss: 0.8612, test_f1: 0.5494
 epoch: 90, train_loss: 0.7409, test_loss: 0.8470, test_f1: 0.5546
 epoch: 91, train_loss: 0.7393, test_loss: 0.8483, test_f1: 0.5630
 epoch: 92, train_loss: 0.7376, test_loss: 0.8618, test_f1: 0.5503
 epoch: 93, train_loss: 0.7351, test_loss: 0.8675, test_f1: 0.5518
 epoch: 94, train_loss: 0.7301, test_loss: 0.8623, test_f1: 0.5439
 epoch: 95, train_loss: 0.7277, test_loss: 0.8609, test_f1: 0.5560
 epoch: 96, train_loss: 0.7255, test_loss: 0.8535, test_f1: 0.5494
 epoch: 97, train_loss: 0.7339, test_loss: 0.8511, test_f1: 0.5581
 epoch: 98, train_loss: 0.7251, test_loss: 0.8748, test_f1: 0.5408
 epoch: 99, train_loss: 0.7223, test_loss: 0.8635, test_f1: 0.5484
##################ITERATION #2 ****************************************
 epoch: 0, train_loss: 1.3334, test_loss: 1.3477, test_f1: 0.2260
 epoch: 1, train_loss: 1.3108, test_loss: 1.3339, test_f1: 0.2260
 epoch: 2, train_loss: 1.2968, test_loss: 1.3152, test_f1: 0.2260
 epoch: 3, train_loss: 1.2840, test_loss: 1.2911, test_f1: 0.2260
 epoch: 4, train_loss: 1.2684, test_loss: 1.2625, test_f1: 0.2260
 epoch: 5, train_loss: 1.2494, test_loss: 1.2326, test_f1: 0.2560
 epoch: 6, train_loss: 1.2291, test_loss: 1.2036, test_f1: 0.3391
 epoch: 7, train_loss: 1.2105, test_loss: 1.1770, test_f1: 0.3707
 epoch: 8, train_loss: 1.1898, test_loss: 1.1514, test_f1: 0.3862
 epoch: 9, train_loss: 1.1665, test_loss: 1.1254, test_f1: 0.3948
 epoch: 10, train_loss: 1.1453, test_loss: 1.1017, test_f1: 0.4071
 epoch: 11, train_loss: 1.1316, test_loss: 1.0837, test_f1: 0.4097
 epoch: 12, train_loss: 1.1056, test_loss: 1.0639, test_f1: 0.4280
 epoch: 13, train_loss: 1.0867, test_loss: 1.0492, test_f1: 0.4358
 epoch: 14, train_loss: 1.0702, test_loss: 1.0331, test_f1: 0.4544
 epoch: 15, train_loss: 1.0510, test_loss: 1.0210, test_f1: 0.4609
 epoch: 16, train_loss: 1.0371, test_loss: 1.0050, test_f1: 0.4640
 epoch: 17, train_loss: 1.0242, test_loss: 0.9987, test_f1: 0.4624
 epoch: 18, train_loss: 1.0157, test_loss: 0.9896, test_f1: 0.4636
 epoch: 19, train_loss: 1.0024, test_loss: 0.9774, test_f1: 0.4685
 epoch: 20, train_loss: 0.9948, test_loss: 0.9680, test_f1: 0.4813
 epoch: 21, train_loss: 0.9756, test_loss: 0.9630, test_f1: 0.4730
 epoch: 22, train_loss: 0.9702, test_loss: 0.9626, test_f1: 0.4758
 epoch: 23, train_loss: 0.9633, test_loss: 0.9497, test_f1: 0.4807
 epoch: 24, train_loss: 0.9596, test_loss: 0.9498, test_f1: 0.4789
 epoch: 25, train_loss: 0.9559, test_loss: 0.9471, test_f1: 0.4757
 epoch: 26, train_loss: 0.9439, test_loss: 0.9402, test_f1: 0.4850
 epoch: 27, train_loss: 0.9361, test_loss: 0.9518, test_f1: 0.4929
 epoch: 28, train_loss: 0.9373, test_loss: 0.9407, test_f1: 0.4939
 epoch: 29, train_loss: 0.9282, test_loss: 0.9310, test_f1: 0.4938
 epoch: 30, train_loss: 0.9119, test_loss: 0.9248, test_f1: 0.4973
 epoch: 31, train_loss: 0.9159, test_loss: 0.9309, test_f1: 0.4978
 epoch: 32, train_loss: 0.9052, test_loss: 0.9313, test_f1: 0.5001
 epoch: 33, train_loss: 0.9165, test_loss: 0.9223, test_f1: 0.4978
 epoch: 34, train_loss: 0.9007, test_loss: 0.9323, test_f1: 0.4964
 epoch: 35, train_loss: 0.9040, test_loss: 0.9231, test_f1: 0.4876
 epoch: 36, train_loss: 0.8924, test_loss: 0.9340, test_f1: 0.4989
 epoch: 37, train_loss: 0.8884, test_loss: 0.9320, test_f1: 0.4951
 epoch: 38, train_loss: 0.8852, test_loss: 0.9232, test_f1: 0.5087
 epoch: 39, train_loss: 0.8707, test_loss: 0.9168, test_f1: 0.4945
 epoch: 40, train_loss: 0.8682, test_loss: 0.9362, test_f1: 0.5092
 epoch: 41, train_loss: 0.8682, test_loss: 0.9354, test_f1: 0.5059
 epoch: 42, train_loss: 0.8683, test_loss: 0.9188, test_f1: 0.5008
 epoch: 43, train_loss: 0.8581, test_loss: 0.9309, test_f1: 0.5015
 epoch: 44, train_loss: 0.8534, test_loss: 0.9147, test_f1: 0.5073
 epoch: 45, train_loss: 0.8467, test_loss: 0.9289, test_f1: 0.5043
 epoch: 46, train_loss: 0.8412, test_loss: 0.9118, test_f1: 0.5153
 epoch: 47, train_loss: 0.8525, test_loss: 0.9539, test_f1: 0.5023
 epoch: 48, train_loss: 0.8409, test_loss: 0.9383, test_f1: 0.5031
 epoch: 49, train_loss: 0.8318, test_loss: 0.9412, test_f1: 0.5038
 epoch: 50, train_loss: 0.8258, test_loss: 0.9431, test_f1: 0.5127
 epoch: 51, train_loss: 0.8219, test_loss: 0.9234, test_f1: 0.5182
 epoch: 52, train_loss: 0.8107, test_loss: 0.9244, test_f1: 0.5185
 epoch: 53, train_loss: 0.8142, test_loss: 0.9184, test_f1: 0.5176
 epoch: 54, train_loss: 0.8101, test_loss: 0.9404, test_f1: 0.5015
 epoch: 55, train_loss: 0.8096, test_loss: 0.9435, test_f1: 0.5009
 epoch: 56, train_loss: 0.8056, test_loss: 0.9360, test_f1: 0.5092
 epoch: 57, train_loss: 0.8045, test_loss: 0.9236, test_f1: 0.5034
 epoch: 58, train_loss: 0.7982, test_loss: 0.9423, test_f1: 0.4984
 epoch: 59, train_loss: 0.7985, test_loss: 0.9297, test_f1: 0.5031
 epoch: 60, train_loss: 0.8032, test_loss: 0.9297, test_f1: 0.5080
 epoch: 61, train_loss: 0.8012, test_loss: 0.9302, test_f1: 0.5074
 epoch: 62, train_loss: 0.7908, test_loss: 0.9392, test_f1: 0.5261
 epoch: 63, train_loss: 0.7887, test_loss: 0.9395, test_f1: 0.5193
 epoch: 64, train_loss: 0.7917, test_loss: 0.9367, test_f1: 0.5075
 epoch: 65, train_loss: 0.7827, test_loss: 0.9289, test_f1: 0.5067
 epoch: 66, train_loss: 0.7898, test_loss: 0.9279, test_f1: 0.5088
 epoch: 67, train_loss: 0.7863, test_loss: 0.9377, test_f1: 0.5243
 epoch: 68, train_loss: 0.7738, test_loss: 0.9475, test_f1: 0.5115
 epoch: 69, train_loss: 0.7748, test_loss: 0.9434, test_f1: 0.5109
 epoch: 70, train_loss: 0.7799, test_loss: 0.9479, test_f1: 0.5074
 epoch: 71, train_loss: 0.7765, test_loss: 0.9419, test_f1: 0.5236
 epoch: 72, train_loss: 0.7753, test_loss: 0.9376, test_f1: 0.5043
 epoch: 73, train_loss: 0.7722, test_loss: 0.9367, test_f1: 0.5203
 epoch: 74, train_loss: 0.7677, test_loss: 0.9546, test_f1: 0.5053
 epoch: 75, train_loss: 0.7696, test_loss: 0.9489, test_f1: 0.4997
 epoch: 76, train_loss: 0.7715, test_loss: 0.9501, test_f1: 0.5055
 epoch: 77, train_loss: 0.7619, test_loss: 0.9531, test_f1: 0.5121
 epoch: 78, train_loss: 0.7531, test_loss: 0.9561, test_f1: 0.5123
 epoch: 79, train_loss: 0.7598, test_loss: 0.9458, test_f1: 0.5183
 epoch: 80, train_loss: 0.7661, test_loss: 0.9296, test_f1: 0.5289
 epoch: 81, train_loss: 0.7616, test_loss: 0.9579, test_f1: 0.5147
 epoch: 82, train_loss: 0.7558, test_loss: 0.9582, test_f1: 0.5137
 epoch: 83, train_loss: 0.7568, test_loss: 0.9413, test_f1: 0.5166
 epoch: 84, train_loss: 0.7449, test_loss: 0.9474, test_f1: 0.5128
 epoch: 85, train_loss: 0.7445, test_loss: 0.9511, test_f1: 0.5188
 epoch: 86, train_loss: 0.7489, test_loss: 0.9567, test_f1: 0.5095
 epoch: 87, train_loss: 0.7459, test_loss: 0.9648, test_f1: 0.5071
 epoch: 88, train_loss: 0.7455, test_loss: 0.9594, test_f1: 0.5186
 epoch: 89, train_loss: 0.7399, test_loss: 0.9604, test_f1: 0.5161
 epoch: 90, train_loss: 0.7462, test_loss: 0.9617, test_f1: 0.5101
 epoch: 91, train_loss: 0.7386, test_loss: 0.9600, test_f1: 0.5148
 epoch: 92, train_loss: 0.7301, test_loss: 0.9503, test_f1: 0.5175
 epoch: 93, train_loss: 0.7318, test_loss: 0.9492, test_f1: 0.5265
 epoch: 94, train_loss: 0.7456, test_loss: 0.9499, test_f1: 0.5185
 epoch: 95, train_loss: 0.7310, test_loss: 0.9556, test_f1: 0.5268
 epoch: 96, train_loss: 0.7374, test_loss: 0.9413, test_f1: 0.5045
 epoch: 97, train_loss: 0.7341, test_loss: 0.9933, test_f1: 0.5191
 epoch: 98, train_loss: 0.7319, test_loss: 0.9939, test_f1: 0.5152
 epoch: 99, train_loss: 0.7270, test_loss: 0.9464, test_f1: 0.5194
##################ITERATION #3 ****************************************
 epoch: 0, train_loss: 1.3078, test_loss: 1.3159, test_f1: 0.2260
 epoch: 1, train_loss: 1.2790, test_loss: 1.3099, test_f1: 0.2260
 epoch: 2, train_loss: 1.2611, test_loss: 1.2952, test_f1: 0.2260
 epoch: 3, train_loss: 1.2409, test_loss: 1.2542, test_f1: 0.2286
 epoch: 4, train_loss: 1.2237, test_loss: 1.2073, test_f1: 0.2820
 epoch: 5, train_loss: 1.2035, test_loss: 1.1689, test_f1: 0.4285
 epoch: 6, train_loss: 1.1797, test_loss: 1.1416, test_f1: 0.4259
 epoch: 7, train_loss: 1.1581, test_loss: 1.1195, test_f1: 0.4357
 epoch: 8, train_loss: 1.1336, test_loss: 1.0995, test_f1: 0.4324
 epoch: 9, train_loss: 1.1183, test_loss: 1.0845, test_f1: 0.4348
 epoch: 10, train_loss: 1.0932, test_loss: 1.0710, test_f1: 0.4237
 epoch: 11, train_loss: 1.0762, test_loss: 1.0540, test_f1: 0.4368
 epoch: 12, train_loss: 1.0625, test_loss: 1.0470, test_f1: 0.4349
 epoch: 13, train_loss: 1.0435, test_loss: 1.0320, test_f1: 0.4736
 epoch: 14, train_loss: 1.0330, test_loss: 1.0287, test_f1: 0.4512
 epoch: 15, train_loss: 1.0153, test_loss: 1.0209, test_f1: 0.4558
 epoch: 16, train_loss: 1.0093, test_loss: 1.0145, test_f1: 0.4693
 epoch: 17, train_loss: 1.0029, test_loss: 1.0218, test_f1: 0.4523
 epoch: 18, train_loss: 0.9902, test_loss: 1.0034, test_f1: 0.4763
 epoch: 19, train_loss: 0.9811, test_loss: 0.9966, test_f1: 0.4804
 epoch: 20, train_loss: 0.9779, test_loss: 0.9986, test_f1: 0.4819
 epoch: 21, train_loss: 0.9693, test_loss: 1.0056, test_f1: 0.4845
 epoch: 22, train_loss: 0.9613, test_loss: 0.9987, test_f1: 0.4875
 epoch: 23, train_loss: 0.9508, test_loss: 0.9854, test_f1: 0.5104
 epoch: 24, train_loss: 0.9481, test_loss: 1.0028, test_f1: 0.4920
 epoch: 25, train_loss: 0.9350, test_loss: 0.9894, test_f1: 0.5048
 epoch: 26, train_loss: 0.9308, test_loss: 0.9810, test_f1: 0.5025
 epoch: 27, train_loss: 0.9216, test_loss: 0.9822, test_f1: 0.5098
 epoch: 28, train_loss: 0.9146, test_loss: 0.9791, test_f1: 0.5133
 epoch: 29, train_loss: 0.9169, test_loss: 0.9822, test_f1: 0.4990
 epoch: 30, train_loss: 0.9097, test_loss: 0.9784, test_f1: 0.5159
 epoch: 31, train_loss: 0.8975, test_loss: 0.9782, test_f1: 0.5059
 epoch: 32, train_loss: 0.8940, test_loss: 0.9602, test_f1: 0.5162
 epoch: 33, train_loss: 0.8930, test_loss: 0.9652, test_f1: 0.5162
 epoch: 34, train_loss: 0.8959, test_loss: 0.9598, test_f1: 0.5093
 epoch: 35, train_loss: 0.8822, test_loss: 0.9540, test_f1: 0.5230
 epoch: 36, train_loss: 0.8718, test_loss: 0.9764, test_f1: 0.5109
 epoch: 37, train_loss: 0.8622, test_loss: 0.9530, test_f1: 0.5247
 epoch: 38, train_loss: 0.8585, test_loss: 0.9426, test_f1: 0.5192
 epoch: 39, train_loss: 0.8611, test_loss: 0.9308, test_f1: 0.5203
 epoch: 40, train_loss: 0.8537, test_loss: 0.9331, test_f1: 0.5168
 epoch: 41, train_loss: 0.8467, test_loss: 0.9636, test_f1: 0.5122
 epoch: 42, train_loss: 0.8422, test_loss: 0.9701, test_f1: 0.5085
 epoch: 43, train_loss: 0.8245, test_loss: 0.9510, test_f1: 0.5195
 epoch: 44, train_loss: 0.8410, test_loss: 0.9587, test_f1: 0.5197
 epoch: 45, train_loss: 0.8208, test_loss: 0.9575, test_f1: 0.5300
 epoch: 46, train_loss: 0.8283, test_loss: 0.9485, test_f1: 0.5376
 epoch: 47, train_loss: 0.8127, test_loss: 0.9315, test_f1: 0.5311
 epoch: 48, train_loss: 0.8121, test_loss: 0.9368, test_f1: 0.5257
 epoch: 49, train_loss: 0.8160, test_loss: 0.9778, test_f1: 0.5147
 epoch: 50, train_loss: 0.8051, test_loss: 0.9853, test_f1: 0.5121
 epoch: 51, train_loss: 0.7923, test_loss: 0.9591, test_f1: 0.5315
 epoch: 52, train_loss: 0.7872, test_loss: 0.9739, test_f1: 0.5203
 epoch: 53, train_loss: 0.7951, test_loss: 0.9357, test_f1: 0.5336
 epoch: 54, train_loss: 0.7912, test_loss: 0.9655, test_f1: 0.5277
 epoch: 55, train_loss: 0.7795, test_loss: 0.9629, test_f1: 0.5173
 epoch: 56, train_loss: 0.7821, test_loss: 0.9462, test_f1: 0.5236
 epoch: 57, train_loss: 0.7765, test_loss: 0.9814, test_f1: 0.5123
 epoch: 58, train_loss: 0.7810, test_loss: 0.9599, test_f1: 0.5296
 epoch: 59, train_loss: 0.7729, test_loss: 0.9631, test_f1: 0.5253
 epoch: 60, train_loss: 0.7752, test_loss: 0.9813, test_f1: 0.5186
 epoch: 61, train_loss: 0.7749, test_loss: 0.9642, test_f1: 0.5249
 epoch: 62, train_loss: 0.7652, test_loss: 0.9667, test_f1: 0.5200
 epoch: 63, train_loss: 0.7632, test_loss: 0.9797, test_f1: 0.5265
 epoch: 64, train_loss: 0.7657, test_loss: 0.9833, test_f1: 0.5260
 epoch: 65, train_loss: 0.7683, test_loss: 0.9791, test_f1: 0.5234
 epoch: 66, train_loss: 0.7557, test_loss: 0.9865, test_f1: 0.5239
 epoch: 67, train_loss: 0.7642, test_loss: 0.9771, test_f1: 0.5197
 epoch: 68, train_loss: 0.7667, test_loss: 0.9900, test_f1: 0.5237
 epoch: 69, train_loss: 0.7509, test_loss: 0.9898, test_f1: 0.5203
 epoch: 70, train_loss: 0.7613, test_loss: 0.9854, test_f1: 0.5294
 epoch: 71, train_loss: 0.7519, test_loss: 0.9710, test_f1: 0.5238
 epoch: 72, train_loss: 0.7505, test_loss: 1.0047, test_f1: 0.5300
 epoch: 73, train_loss: 0.7468, test_loss: 0.9865, test_f1: 0.5324
 epoch: 74, train_loss: 0.7441, test_loss: 0.9854, test_f1: 0.5305
 epoch: 75, train_loss: 0.7452, test_loss: 1.0064, test_f1: 0.5245
 epoch: 76, train_loss: 0.7395, test_loss: 0.9896, test_f1: 0.5291
 epoch: 77, train_loss: 0.7516, test_loss: 0.9960, test_f1: 0.5335
 epoch: 78, train_loss: 0.7458, test_loss: 1.0112, test_f1: 0.5196
 epoch: 79, train_loss: 0.7447, test_loss: 0.9882, test_f1: 0.5295
 epoch: 80, train_loss: 0.7428, test_loss: 1.0002, test_f1: 0.5297
 epoch: 81, train_loss: 0.7318, test_loss: 1.0028, test_f1: 0.5262
 epoch: 82, train_loss: 0.7280, test_loss: 1.0003, test_f1: 0.5313
 epoch: 83, train_loss: 0.7308, test_loss: 1.0082, test_f1: 0.5329
 epoch: 84, train_loss: 0.7211, test_loss: 1.0151, test_f1: 0.5289
 epoch: 85, train_loss: 0.7358, test_loss: 1.0066, test_f1: 0.5321
 epoch: 86, train_loss: 0.7366, test_loss: 0.9982, test_f1: 0.5325
 epoch: 87, train_loss: 0.7152, test_loss: 1.0279, test_f1: 0.5331
 epoch: 88, train_loss: 0.7225, test_loss: 1.0179, test_f1: 0.5334
 epoch: 89, train_loss: 0.7155, test_loss: 1.0107, test_f1: 0.5281
 epoch: 90, train_loss: 0.7135, test_loss: 1.0084, test_f1: 0.5346
 epoch: 91, train_loss: 0.7201, test_loss: 1.0112, test_f1: 0.5389
 epoch: 92, train_loss: 0.7206, test_loss: 1.0201, test_f1: 0.5392
 epoch: 93, train_loss: 0.7103, test_loss: 1.0319, test_f1: 0.5272
 epoch: 94, train_loss: 0.7118, test_loss: 1.0069, test_f1: 0.5400
 epoch: 95, train_loss: 0.7145, test_loss: 1.0357, test_f1: 0.5237
 epoch: 96, train_loss: 0.7077, test_loss: 1.0302, test_f1: 0.5346
 epoch: 97, train_loss: 0.6982, test_loss: 1.0171, test_f1: 0.5364
 epoch: 98, train_loss: 0.7047, test_loss: 1.0384, test_f1: 0.5408
 epoch: 99, train_loss: 0.7077, test_loss: 1.0331, test_f1: 0.5298
##################ITERATION #4 ****************************************
 epoch: 0, train_loss: 1.2905, test_loss: 1.3113, test_f1: 0.2260
 epoch: 1, train_loss: 1.2495, test_loss: 1.3026, test_f1: 0.2260
 epoch: 2, train_loss: 1.2236, test_loss: 1.2850, test_f1: 0.2260
 epoch: 3, train_loss: 1.2014, test_loss: 1.2565, test_f1: 0.2681
 epoch: 4, train_loss: 1.1766, test_loss: 1.2001, test_f1: 0.3134
 epoch: 5, train_loss: 1.1561, test_loss: 1.1344, test_f1: 0.4319
 epoch: 6, train_loss: 1.1364, test_loss: 1.1017, test_f1: 0.4412
 epoch: 7, train_loss: 1.1172, test_loss: 1.0806, test_f1: 0.4412
 epoch: 8, train_loss: 1.0988, test_loss: 1.0657, test_f1: 0.4463
 epoch: 9, train_loss: 1.0832, test_loss: 1.0476, test_f1: 0.4466
 epoch: 10, train_loss: 1.0743, test_loss: 1.0396, test_f1: 0.4453
 epoch: 11, train_loss: 1.0579, test_loss: 1.0329, test_f1: 0.4544
 epoch: 12, train_loss: 1.0387, test_loss: 1.0275, test_f1: 0.4494
 epoch: 13, train_loss: 1.0310, test_loss: 1.0207, test_f1: 0.4631
 epoch: 14, train_loss: 1.0246, test_loss: 1.0156, test_f1: 0.4604
 epoch: 15, train_loss: 1.0181, test_loss: 1.0035, test_f1: 0.4865
 epoch: 16, train_loss: 1.0044, test_loss: 0.9984, test_f1: 0.4755
 epoch: 17, train_loss: 0.9967, test_loss: 0.9974, test_f1: 0.4760
 epoch: 18, train_loss: 0.9865, test_loss: 0.9898, test_f1: 0.4814
 epoch: 19, train_loss: 0.9756, test_loss: 0.9854, test_f1: 0.4735
 epoch: 20, train_loss: 0.9675, test_loss: 0.9710, test_f1: 0.4963
 epoch: 21, train_loss: 0.9620, test_loss: 0.9782, test_f1: 0.4962
 epoch: 22, train_loss: 0.9538, test_loss: 0.9725, test_f1: 0.4968
 epoch: 23, train_loss: 0.9431, test_loss: 0.9678, test_f1: 0.4995
 epoch: 24, train_loss: 0.9365, test_loss: 0.9697, test_f1: 0.4990
 epoch: 25, train_loss: 0.9231, test_loss: 0.9746, test_f1: 0.4917
 epoch: 26, train_loss: 0.9206, test_loss: 0.9587, test_f1: 0.5042
 epoch: 27, train_loss: 0.9181, test_loss: 0.9487, test_f1: 0.5057
 epoch: 28, train_loss: 0.9066, test_loss: 0.9506, test_f1: 0.5206
 epoch: 29, train_loss: 0.8910, test_loss: 0.9454, test_f1: 0.5122
 epoch: 30, train_loss: 0.8946, test_loss: 0.9494, test_f1: 0.5099
 epoch: 31, train_loss: 0.8842, test_loss: 0.9396, test_f1: 0.5065
 epoch: 32, train_loss: 0.8819, test_loss: 0.9314, test_f1: 0.5255
 epoch: 33, train_loss: 0.8759, test_loss: 0.9326, test_f1: 0.5114
 epoch: 34, train_loss: 0.8677, test_loss: 0.9260, test_f1: 0.5217
 epoch: 35, train_loss: 0.8617, test_loss: 0.9518, test_f1: 0.4875
 epoch: 36, train_loss: 0.8503, test_loss: 0.9268, test_f1: 0.5160
 epoch: 37, train_loss: 0.8478, test_loss: 0.9324, test_f1: 0.5037
 epoch: 38, train_loss: 0.8379, test_loss: 0.9147, test_f1: 0.5255
 epoch: 39, train_loss: 0.8310, test_loss: 0.9338, test_f1: 0.5149
 epoch: 40, train_loss: 0.8270, test_loss: 0.9128, test_f1: 0.5210
 epoch: 41, train_loss: 0.8250, test_loss: 0.9265, test_f1: 0.5275
 epoch: 42, train_loss: 0.8126, test_loss: 0.9274, test_f1: 0.5412
 epoch: 43, train_loss: 0.8127, test_loss: 0.9146, test_f1: 0.5301
 epoch: 44, train_loss: 0.8039, test_loss: 0.9268, test_f1: 0.5292
 epoch: 45, train_loss: 0.8029, test_loss: 0.9074, test_f1: 0.5488
 epoch: 46, train_loss: 0.8008, test_loss: 0.9287, test_f1: 0.5312
 epoch: 47, train_loss: 0.7923, test_loss: 0.9152, test_f1: 0.5400
 epoch: 48, train_loss: 0.7883, test_loss: 0.9122, test_f1: 0.5444
 epoch: 49, train_loss: 0.7755, test_loss: 0.9242, test_f1: 0.5296
 epoch: 50, train_loss: 0.7689, test_loss: 0.9212, test_f1: 0.5445
 epoch: 51, train_loss: 0.7582, test_loss: 0.9037, test_f1: 0.5462
 epoch: 52, train_loss: 0.7605, test_loss: 0.9082, test_f1: 0.5409
 epoch: 53, train_loss: 0.7610, test_loss: 0.9093, test_f1: 0.5444
 epoch: 54, train_loss: 0.7541, test_loss: 0.9217, test_f1: 0.5363
 epoch: 55, train_loss: 0.7525, test_loss: 0.9170, test_f1: 0.5360
 epoch: 56, train_loss: 0.7583, test_loss: 0.9140, test_f1: 0.5433
 epoch: 57, train_loss: 0.7569, test_loss: 0.9269, test_f1: 0.5366
 epoch: 58, train_loss: 0.7532, test_loss: 0.8999, test_f1: 0.5484
 epoch: 59, train_loss: 0.7507, test_loss: 0.9066, test_f1: 0.5464
 epoch: 60, train_loss: 0.7362, test_loss: 0.9256, test_f1: 0.5389
 epoch: 61, train_loss: 0.7346, test_loss: 0.9152, test_f1: 0.5470
 epoch: 62, train_loss: 0.7351, test_loss: 0.9278, test_f1: 0.5426
 epoch: 63, train_loss: 0.7433, test_loss: 0.9122, test_f1: 0.5390
 epoch: 64, train_loss: 0.7242, test_loss: 0.9126, test_f1: 0.5490
 epoch: 65, train_loss: 0.7317, test_loss: 0.9196, test_f1: 0.5422
 epoch: 66, train_loss: 0.7323, test_loss: 0.9171, test_f1: 0.5458
 epoch: 67, train_loss: 0.7276, test_loss: 0.9083, test_f1: 0.5498
 epoch: 68, train_loss: 0.7253, test_loss: 0.9115, test_f1: 0.5540
 epoch: 69, train_loss: 0.7236, test_loss: 0.9072, test_f1: 0.5523
 epoch: 70, train_loss: 0.7163, test_loss: 0.9152, test_f1: 0.5578
 epoch: 71, train_loss: 0.7206, test_loss: 0.8991, test_f1: 0.5511
 epoch: 72, train_loss: 0.7159, test_loss: 0.9170, test_f1: 0.5508
 epoch: 73, train_loss: 0.7123, test_loss: 0.9013, test_f1: 0.5568
 epoch: 74, train_loss: 0.7058, test_loss: 0.9208, test_f1: 0.5450
 epoch: 75, train_loss: 0.7097, test_loss: 0.9031, test_f1: 0.5561
 epoch: 76, train_loss: 0.7069, test_loss: 0.9030, test_f1: 0.5559
 epoch: 77, train_loss: 0.7090, test_loss: 0.9047, test_f1: 0.5544
 epoch: 78, train_loss: 0.6976, test_loss: 0.9196, test_f1: 0.5533
 epoch: 79, train_loss: 0.6971, test_loss: 0.9288, test_f1: 0.5534
 epoch: 80, train_loss: 0.7058, test_loss: 0.9299, test_f1: 0.5515
 epoch: 81, train_loss: 0.6877, test_loss: 0.9175, test_f1: 0.5542
 epoch: 82, train_loss: 0.7047, test_loss: 0.9219, test_f1: 0.5511
 epoch: 83, train_loss: 0.6946, test_loss: 0.9389, test_f1: 0.5514
 epoch: 84, train_loss: 0.6902, test_loss: 0.9085, test_f1: 0.5613
 epoch: 85, train_loss: 0.6865, test_loss: 0.9252, test_f1: 0.5586
 epoch: 86, train_loss: 0.6818, test_loss: 0.9296, test_f1: 0.5642
 epoch: 87, train_loss: 0.6818, test_loss: 0.9176, test_f1: 0.5585
 epoch: 88, train_loss: 0.6770, test_loss: 0.9346, test_f1: 0.5578
 epoch: 89, train_loss: 0.6869, test_loss: 0.9244, test_f1: 0.5646
 epoch: 90, train_loss: 0.6807, test_loss: 0.9255, test_f1: 0.5584
 epoch: 91, train_loss: 0.6802, test_loss: 0.9203, test_f1: 0.5617
 epoch: 92, train_loss: 0.6752, test_loss: 0.9268, test_f1: 0.5595
 epoch: 93, train_loss: 0.6780, test_loss: 0.9251, test_f1: 0.5580
 epoch: 94, train_loss: 0.6667, test_loss: 0.9509, test_f1: 0.5579
 epoch: 95, train_loss: 0.6760, test_loss: 0.9417, test_f1: 0.5565
 epoch: 96, train_loss: 0.6776, test_loss: 0.9307, test_f1: 0.5587
 epoch: 97, train_loss: 0.6688, test_loss: 0.9657, test_f1: 0.5572
 epoch: 98, train_loss: 0.6676, test_loss: 0.9294, test_f1: 0.5575
 epoch: 99, train_loss: 0.6686, test_loss: 0.9409, test_f1: 0.5580
##################ITERATION #5 ****************************************
 epoch: 0, train_loss: 1.2602, test_loss: 1.3107, test_f1: 0.2260
 epoch: 1, train_loss: 1.2045, test_loss: 1.2929, test_f1: 0.2260
 epoch: 2, train_loss: 1.1755, test_loss: 1.2551, test_f1: 0.2361
 epoch: 3, train_loss: 1.1536, test_loss: 1.1956, test_f1: 0.2769
 epoch: 4, train_loss: 1.1251, test_loss: 1.1333, test_f1: 0.4198
 epoch: 5, train_loss: 1.1074, test_loss: 1.0939, test_f1: 0.4297
 epoch: 6, train_loss: 1.0806, test_loss: 1.0606, test_f1: 0.4518
 epoch: 7, train_loss: 1.0622, test_loss: 1.0270, test_f1: 0.4633
 epoch: 8, train_loss: 1.0406, test_loss: 1.0075, test_f1: 0.4773
 epoch: 9, train_loss: 1.0217, test_loss: 0.9909, test_f1: 0.4760
 epoch: 10, train_loss: 1.0059, test_loss: 0.9760, test_f1: 0.4831
 epoch: 11, train_loss: 0.9974, test_loss: 0.9642, test_f1: 0.4833
 epoch: 12, train_loss: 0.9790, test_loss: 0.9545, test_f1: 0.4783
 epoch: 13, train_loss: 0.9645, test_loss: 0.9499, test_f1: 0.4717
 epoch: 14, train_loss: 0.9618, test_loss: 0.9302, test_f1: 0.4966
 epoch: 15, train_loss: 0.9477, test_loss: 0.9326, test_f1: 0.4902
 epoch: 16, train_loss: 0.9425, test_loss: 0.9200, test_f1: 0.4973
 epoch: 17, train_loss: 0.9311, test_loss: 0.9158, test_f1: 0.4994
 epoch: 18, train_loss: 0.9126, test_loss: 0.9087, test_f1: 0.4993
 epoch: 19, train_loss: 0.9202, test_loss: 0.9039, test_f1: 0.5008
 epoch: 20, train_loss: 0.9169, test_loss: 0.8961, test_f1: 0.5027
 epoch: 21, train_loss: 0.9041, test_loss: 0.8950, test_f1: 0.5044
 epoch: 22, train_loss: 0.8929, test_loss: 0.8917, test_f1: 0.5054
 epoch: 23, train_loss: 0.8857, test_loss: 0.8875, test_f1: 0.5047
 epoch: 24, train_loss: 0.8835, test_loss: 0.8777, test_f1: 0.5102
 epoch: 25, train_loss: 0.8767, test_loss: 0.8694, test_f1: 0.5124
 epoch: 26, train_loss: 0.8754, test_loss: 0.8804, test_f1: 0.5031
 epoch: 27, train_loss: 0.8694, test_loss: 0.8707, test_f1: 0.5147
 epoch: 28, train_loss: 0.8696, test_loss: 0.8706, test_f1: 0.5111
 epoch: 29, train_loss: 0.8538, test_loss: 0.8586, test_f1: 0.5259
 epoch: 30, train_loss: 0.8532, test_loss: 0.8613, test_f1: 0.5259
 epoch: 31, train_loss: 0.8479, test_loss: 0.8493, test_f1: 0.5265
 epoch: 32, train_loss: 0.8394, test_loss: 0.8498, test_f1: 0.5294
 epoch: 33, train_loss: 0.8414, test_loss: 0.8563, test_f1: 0.5269
 epoch: 34, train_loss: 0.8328, test_loss: 0.8567, test_f1: 0.5304
 epoch: 35, train_loss: 0.8298, test_loss: 0.8330, test_f1: 0.5327
 epoch: 36, train_loss: 0.8273, test_loss: 0.8406, test_f1: 0.5266
 epoch: 37, train_loss: 0.8162, test_loss: 0.8486, test_f1: 0.5274
 epoch: 38, train_loss: 0.8129, test_loss: 0.8383, test_f1: 0.5478
 epoch: 39, train_loss: 0.8096, test_loss: 0.8326, test_f1: 0.5377
 epoch: 40, train_loss: 0.8133, test_loss: 0.8499, test_f1: 0.5239
 epoch: 41, train_loss: 0.8064, test_loss: 0.8384, test_f1: 0.5425
 epoch: 42, train_loss: 0.7976, test_loss: 0.8318, test_f1: 0.5478
 epoch: 43, train_loss: 0.7867, test_loss: 0.8325, test_f1: 0.5499
 epoch: 44, train_loss: 0.7732, test_loss: 0.8353, test_f1: 0.5474
 epoch: 45, train_loss: 0.7695, test_loss: 0.8219, test_f1: 0.5512
 epoch: 46, train_loss: 0.7793, test_loss: 0.8244, test_f1: 0.5578
 epoch: 47, train_loss: 0.7749, test_loss: 0.8344, test_f1: 0.5584
 epoch: 48, train_loss: 0.7692, test_loss: 0.8293, test_f1: 0.5568
 epoch: 49, train_loss: 0.7664, test_loss: 0.8095, test_f1: 0.5432
 epoch: 50, train_loss: 0.7586, test_loss: 0.8190, test_f1: 0.5689
 epoch: 51, train_loss: 0.7578, test_loss: 0.8207, test_f1: 0.5633
 epoch: 52, train_loss: 0.7544, test_loss: 0.8204, test_f1: 0.5602
 epoch: 53, train_loss: 0.7542, test_loss: 0.8177, test_f1: 0.5671
 epoch: 54, train_loss: 0.7441, test_loss: 0.8141, test_f1: 0.5583
 epoch: 55, train_loss: 0.7434, test_loss: 0.8159, test_f1: 0.5679
 epoch: 56, train_loss: 0.7428, test_loss: 0.8196, test_f1: 0.5570
 epoch: 57, train_loss: 0.7334, test_loss: 0.8235, test_f1: 0.5497
 epoch: 58, train_loss: 0.7351, test_loss: 0.8248, test_f1: 0.5528
 epoch: 59, train_loss: 0.7430, test_loss: 0.8186, test_f1: 0.5551
 epoch: 60, train_loss: 0.7334, test_loss: 0.8213, test_f1: 0.5548
 epoch: 61, train_loss: 0.7283, test_loss: 0.8280, test_f1: 0.5639
 epoch: 62, train_loss: 0.7290, test_loss: 0.8280, test_f1: 0.5596
 epoch: 63, train_loss: 0.7285, test_loss: 0.8154, test_f1: 0.5599
 epoch: 64, train_loss: 0.7314, test_loss: 0.8167, test_f1: 0.5596
 epoch: 65, train_loss: 0.7311, test_loss: 0.8208, test_f1: 0.5578
 epoch: 66, train_loss: 0.7233, test_loss: 0.8277, test_f1: 0.5571
 epoch: 67, train_loss: 0.7222, test_loss: 0.8359, test_f1: 0.5551
 epoch: 68, train_loss: 0.7253, test_loss: 0.8428, test_f1: 0.5532
 epoch: 69, train_loss: 0.7149, test_loss: 0.8305, test_f1: 0.5516
 epoch: 70, train_loss: 0.7146, test_loss: 0.8185, test_f1: 0.5531
 epoch: 71, train_loss: 0.7126, test_loss: 0.8315, test_f1: 0.5507
 epoch: 72, train_loss: 0.7153, test_loss: 0.8223, test_f1: 0.5475
 epoch: 73, train_loss: 0.7198, test_loss: 0.8351, test_f1: 0.5604
 epoch: 74, train_loss: 0.7086, test_loss: 0.8241, test_f1: 0.5544
 epoch: 75, train_loss: 0.7098, test_loss: 0.8356, test_f1: 0.5518
 epoch: 76, train_loss: 0.7064, test_loss: 0.8437, test_f1: 0.5497
 epoch: 77, train_loss: 0.7028, test_loss: 0.8501, test_f1: 0.5549
 epoch: 78, train_loss: 0.6939, test_loss: 0.8388, test_f1: 0.5528
 epoch: 79, train_loss: 0.7141, test_loss: 0.8367, test_f1: 0.5515
 epoch: 80, train_loss: 0.6956, test_loss: 0.8316, test_f1: 0.5519
 epoch: 81, train_loss: 0.7078, test_loss: 0.8520, test_f1: 0.5485
 epoch: 82, train_loss: 0.7013, test_loss: 0.8402, test_f1: 0.5572
 epoch: 83, train_loss: 0.6959, test_loss: 0.8454, test_f1: 0.5552
 epoch: 84, train_loss: 0.6897, test_loss: 0.8367, test_f1: 0.5573
 epoch: 85, train_loss: 0.6874, test_loss: 0.8621, test_f1: 0.5497
 epoch: 86, train_loss: 0.6920, test_loss: 0.8478, test_f1: 0.5530
 epoch: 87, train_loss: 0.6895, test_loss: 0.8344, test_f1: 0.5586
 epoch: 88, train_loss: 0.6798, test_loss: 0.8320, test_f1: 0.5508
 epoch: 89, train_loss: 0.6889, test_loss: 0.8267, test_f1: 0.5553
 epoch: 90, train_loss: 0.6893, test_loss: 0.8214, test_f1: 0.5561
 epoch: 91, train_loss: 0.6798, test_loss: 0.8549, test_f1: 0.5455
 epoch: 92, train_loss: 0.6786, test_loss: 0.8608, test_f1: 0.5408
 epoch: 93, train_loss: 0.6760, test_loss: 0.8558, test_f1: 0.5558
 epoch: 94, train_loss: 0.6730, test_loss: 0.8294, test_f1: 0.5593
 epoch: 95, train_loss: 0.6761, test_loss: 0.8333, test_f1: 0.5451
 epoch: 96, train_loss: 0.6766, test_loss: 0.8370, test_f1: 0.5559
 epoch: 97, train_loss: 0.6781, test_loss: 0.8296, test_f1: 0.5500
 epoch: 98, train_loss: 0.6749, test_loss: 0.8419, test_f1: 0.5452
 epoch: 99, train_loss: 0.6632, test_loss: 0.8606, test_f1: 0.5486
##################ITERATION #6 ****************************************
 epoch: 0, train_loss: 1.2937, test_loss: 1.2963, test_f1: 0.2260
 epoch: 1, train_loss: 1.2194, test_loss: 1.2885, test_f1: 0.2650
 epoch: 2, train_loss: 1.1882, test_loss: 1.2611, test_f1: 0.3382
 epoch: 3, train_loss: 1.1673, test_loss: 1.1788, test_f1: 0.3733
 epoch: 4, train_loss: 1.1475, test_loss: 1.1207, test_f1: 0.4492
 epoch: 5, train_loss: 1.1274, test_loss: 1.0885, test_f1: 0.4665
 epoch: 6, train_loss: 1.1051, test_loss: 1.0615, test_f1: 0.4502
 epoch: 7, train_loss: 1.0891, test_loss: 1.0424, test_f1: 0.4540
 epoch: 8, train_loss: 1.0706, test_loss: 1.0285, test_f1: 0.4684
 epoch: 9, train_loss: 1.0583, test_loss: 1.0202, test_f1: 0.4748
 epoch: 10, train_loss: 1.0405, test_loss: 1.0083, test_f1: 0.4785
 epoch: 11, train_loss: 1.0345, test_loss: 1.0007, test_f1: 0.4742
 epoch: 12, train_loss: 1.0199, test_loss: 0.9909, test_f1: 0.4793
 epoch: 13, train_loss: 1.0030, test_loss: 0.9826, test_f1: 0.4768
 epoch: 14, train_loss: 0.9970, test_loss: 0.9789, test_f1: 0.4864
 epoch: 15, train_loss: 0.9808, test_loss: 0.9708, test_f1: 0.4831
 epoch: 16, train_loss: 0.9749, test_loss: 0.9667, test_f1: 0.4814
 epoch: 17, train_loss: 0.9657, test_loss: 0.9621, test_f1: 0.4837
 epoch: 18, train_loss: 0.9624, test_loss: 0.9575, test_f1: 0.4816
 epoch: 19, train_loss: 0.9561, test_loss: 0.9522, test_f1: 0.4935
 epoch: 20, train_loss: 0.9381, test_loss: 0.9480, test_f1: 0.4885
 epoch: 21, train_loss: 0.9413, test_loss: 0.9631, test_f1: 0.4818
 epoch: 22, train_loss: 0.9317, test_loss: 0.9460, test_f1: 0.4877
 epoch: 23, train_loss: 0.9197, test_loss: 0.9390, test_f1: 0.4986
 epoch: 24, train_loss: 0.9269, test_loss: 0.9344, test_f1: 0.4957
 epoch: 25, train_loss: 0.9180, test_loss: 0.9254, test_f1: 0.5007
 epoch: 26, train_loss: 0.9049, test_loss: 0.9468, test_f1: 0.4961
 epoch: 27, train_loss: 0.8947, test_loss: 0.9414, test_f1: 0.5078
 epoch: 28, train_loss: 0.8951, test_loss: 0.9462, test_f1: 0.5077
 epoch: 29, train_loss: 0.8915, test_loss: 0.9529, test_f1: 0.4991
 epoch: 30, train_loss: 0.8822, test_loss: 0.9372, test_f1: 0.5076
 epoch: 31, train_loss: 0.8774, test_loss: 0.9440, test_f1: 0.5055
 epoch: 32, train_loss: 0.8775, test_loss: 0.9303, test_f1: 0.5007
 epoch: 33, train_loss: 0.8598, test_loss: 0.9330, test_f1: 0.5159
 epoch: 34, train_loss: 0.8560, test_loss: 0.9353, test_f1: 0.5137
 epoch: 35, train_loss: 0.8533, test_loss: 0.9556, test_f1: 0.4882
 epoch: 36, train_loss: 0.8433, test_loss: 0.9504, test_f1: 0.4917
 epoch: 37, train_loss: 0.8415, test_loss: 0.9352, test_f1: 0.5053
 epoch: 38, train_loss: 0.8397, test_loss: 0.9351, test_f1: 0.4947
 epoch: 39, train_loss: 0.8388, test_loss: 0.9399, test_f1: 0.5122
 epoch: 40, train_loss: 0.8294, test_loss: 0.9348, test_f1: 0.5082
 epoch: 41, train_loss: 0.8329, test_loss: 0.9379, test_f1: 0.5024
 epoch: 42, train_loss: 0.8219, test_loss: 0.9384, test_f1: 0.5041
 epoch: 43, train_loss: 0.8206, test_loss: 0.9593, test_f1: 0.4927
 epoch: 44, train_loss: 0.8067, test_loss: 0.9319, test_f1: 0.5145
 epoch: 45, train_loss: 0.8053, test_loss: 0.9360, test_f1: 0.5140
 epoch: 46, train_loss: 0.8009, test_loss: 0.9363, test_f1: 0.5091
 epoch: 47, train_loss: 0.7948, test_loss: 0.9380, test_f1: 0.5126
 epoch: 48, train_loss: 0.8011, test_loss: 0.9531, test_f1: 0.5002
 epoch: 49, train_loss: 0.7832, test_loss: 0.9397, test_f1: 0.5098
 epoch: 50, train_loss: 0.7969, test_loss: 0.9455, test_f1: 0.5093
 epoch: 51, train_loss: 0.7911, test_loss: 0.9438, test_f1: 0.4989
 epoch: 52, train_loss: 0.7694, test_loss: 0.9417, test_f1: 0.5121
 epoch: 53, train_loss: 0.7813, test_loss: 0.9382, test_f1: 0.5187
 epoch: 54, train_loss: 0.7706, test_loss: 0.9382, test_f1: 0.5113
 epoch: 55, train_loss: 0.7721, test_loss: 0.9470, test_f1: 0.5175
 epoch: 56, train_loss: 0.7694, test_loss: 0.9415, test_f1: 0.5092
 epoch: 57, train_loss: 0.7784, test_loss: 0.9428, test_f1: 0.5114
 epoch: 58, train_loss: 0.7618, test_loss: 0.9539, test_f1: 0.5098
 epoch: 59, train_loss: 0.7572, test_loss: 0.9537, test_f1: 0.5167
 epoch: 60, train_loss: 0.7572, test_loss: 0.9500, test_f1: 0.5048
 epoch: 61, train_loss: 0.7592, test_loss: 0.9502, test_f1: 0.5079
 epoch: 62, train_loss: 0.7565, test_loss: 0.9502, test_f1: 0.4992
 epoch: 63, train_loss: 0.7488, test_loss: 0.9551, test_f1: 0.5003
 epoch: 64, train_loss: 0.7564, test_loss: 0.9521, test_f1: 0.5077
 epoch: 65, train_loss: 0.7575, test_loss: 0.9498, test_f1: 0.4994
 epoch: 66, train_loss: 0.7499, test_loss: 0.9373, test_f1: 0.5219
 epoch: 67, train_loss: 0.7478, test_loss: 0.9478, test_f1: 0.5086
 epoch: 68, train_loss: 0.7464, test_loss: 0.9438, test_f1: 0.5071
 epoch: 69, train_loss: 0.7591, test_loss: 0.9405, test_f1: 0.5134
 epoch: 70, train_loss: 0.7486, test_loss: 0.9411, test_f1: 0.5131
 epoch: 71, train_loss: 0.7352, test_loss: 0.9780, test_f1: 0.4972
 epoch: 72, train_loss: 0.7365, test_loss: 0.9682, test_f1: 0.5067
 epoch: 73, train_loss: 0.7310, test_loss: 0.9583, test_f1: 0.5140
 epoch: 74, train_loss: 0.7322, test_loss: 0.9492, test_f1: 0.5081
 epoch: 75, train_loss: 0.7289, test_loss: 0.9660, test_f1: 0.5048
 epoch: 76, train_loss: 0.7319, test_loss: 0.9537, test_f1: 0.5035
 epoch: 77, train_loss: 0.7243, test_loss: 0.9639, test_f1: 0.5041
 epoch: 78, train_loss: 0.7279, test_loss: 0.9566, test_f1: 0.5072
 epoch: 79, train_loss: 0.7293, test_loss: 0.9617, test_f1: 0.5030
 epoch: 80, train_loss: 0.7298, test_loss: 0.9714, test_f1: 0.5033
 epoch: 81, train_loss: 0.7312, test_loss: 0.9673, test_f1: 0.5048
 epoch: 82, train_loss: 0.7255, test_loss: 0.9750, test_f1: 0.5045
 epoch: 83, train_loss: 0.7207, test_loss: 0.9708, test_f1: 0.5056
 epoch: 84, train_loss: 0.7195, test_loss: 0.9606, test_f1: 0.5096
 epoch: 85, train_loss: 0.7177, test_loss: 0.9613, test_f1: 0.5170
 epoch: 86, train_loss: 0.7204, test_loss: 0.9656, test_f1: 0.5185
 epoch: 87, train_loss: 0.7144, test_loss: 0.9618, test_f1: 0.5191
 epoch: 88, train_loss: 0.7233, test_loss: 0.9739, test_f1: 0.5085
 epoch: 89, train_loss: 0.7085, test_loss: 0.9915, test_f1: 0.4998
 epoch: 90, train_loss: 0.7088, test_loss: 0.9740, test_f1: 0.5096
 epoch: 91, train_loss: 0.7090, test_loss: 0.9789, test_f1: 0.5195
 epoch: 92, train_loss: 0.7082, test_loss: 0.9683, test_f1: 0.5106
 epoch: 93, train_loss: 0.7061, test_loss: 0.9874, test_f1: 0.5192
 epoch: 94, train_loss: 0.7045, test_loss: 0.9794, test_f1: 0.5229
 epoch: 95, train_loss: 0.6971, test_loss: 0.9822, test_f1: 0.5270
 epoch: 96, train_loss: 0.7090, test_loss: 0.9835, test_f1: 0.5324
 epoch: 97, train_loss: 0.7023, test_loss: 0.9889, test_f1: 0.5321
 epoch: 98, train_loss: 0.6960, test_loss: 0.9865, test_f1: 0.5178
 epoch: 99, train_loss: 0.7007, test_loss: 0.9845, test_f1: 0.5174
##################ITERATION #7 ****************************************
 epoch: 0, train_loss: 1.3024, test_loss: 1.3044, test_f1: 0.2260
 epoch: 1, train_loss: 1.2257, test_loss: 1.3011, test_f1: 0.2260
 epoch: 2, train_loss: 1.1977, test_loss: 1.2763, test_f1: 0.2260
 epoch: 3, train_loss: 1.1645, test_loss: 1.2132, test_f1: 0.2541
 epoch: 4, train_loss: 1.1476, test_loss: 1.1279, test_f1: 0.4236
 epoch: 5, train_loss: 1.1212, test_loss: 1.0803, test_f1: 0.4704
 epoch: 6, train_loss: 1.1025, test_loss: 1.0579, test_f1: 0.4584
 epoch: 7, train_loss: 1.0883, test_loss: 1.0445, test_f1: 0.4681
 epoch: 8, train_loss: 1.0644, test_loss: 1.0322, test_f1: 0.4575
 epoch: 9, train_loss: 1.0582, test_loss: 1.0225, test_f1: 0.4650
 epoch: 10, train_loss: 1.0406, test_loss: 1.0189, test_f1: 0.4583
 epoch: 11, train_loss: 1.0200, test_loss: 1.0106, test_f1: 0.4568
 epoch: 12, train_loss: 1.0218, test_loss: 0.9996, test_f1: 0.4656
 epoch: 13, train_loss: 1.0077, test_loss: 0.9920, test_f1: 0.4649
 epoch: 14, train_loss: 1.0033, test_loss: 0.9879, test_f1: 0.4738
 epoch: 15, train_loss: 0.9811, test_loss: 0.9841, test_f1: 0.4710
 epoch: 16, train_loss: 0.9776, test_loss: 0.9794, test_f1: 0.4805
 epoch: 17, train_loss: 0.9732, test_loss: 0.9796, test_f1: 0.4740
 epoch: 18, train_loss: 0.9653, test_loss: 0.9742, test_f1: 0.4687
 epoch: 19, train_loss: 0.9552, test_loss: 0.9660, test_f1: 0.4788
 epoch: 20, train_loss: 0.9501, test_loss: 0.9642, test_f1: 0.4763
 epoch: 21, train_loss: 0.9391, test_loss: 0.9564, test_f1: 0.4788
 epoch: 22, train_loss: 0.9365, test_loss: 0.9583, test_f1: 0.4965
 epoch: 23, train_loss: 0.9232, test_loss: 0.9576, test_f1: 0.4875
 epoch: 24, train_loss: 0.9231, test_loss: 0.9604, test_f1: 0.4912
 epoch: 25, train_loss: 0.9083, test_loss: 0.9529, test_f1: 0.4938
 epoch: 26, train_loss: 0.9005, test_loss: 0.9622, test_f1: 0.4880
 epoch: 27, train_loss: 0.9013, test_loss: 0.9467, test_f1: 0.4869
 epoch: 28, train_loss: 0.8965, test_loss: 0.9418, test_f1: 0.4873
 epoch: 29, train_loss: 0.8882, test_loss: 0.9379, test_f1: 0.4839
 epoch: 30, train_loss: 0.8784, test_loss: 0.9431, test_f1: 0.4978
 epoch: 31, train_loss: 0.8703, test_loss: 0.9458, test_f1: 0.4973
 epoch: 32, train_loss: 0.8647, test_loss: 0.9383, test_f1: 0.4976
 epoch: 33, train_loss: 0.8633, test_loss: 0.9475, test_f1: 0.4992
 epoch: 34, train_loss: 0.8634, test_loss: 0.9421, test_f1: 0.4974
 epoch: 35, train_loss: 0.8472, test_loss: 0.9363, test_f1: 0.5070
 epoch: 36, train_loss: 0.8529, test_loss: 0.9425, test_f1: 0.5028
 epoch: 37, train_loss: 0.8470, test_loss: 0.9294, test_f1: 0.5180
 epoch: 38, train_loss: 0.8407, test_loss: 0.9412, test_f1: 0.5217
 epoch: 39, train_loss: 0.8271, test_loss: 0.9483, test_f1: 0.5164
 epoch: 40, train_loss: 0.8241, test_loss: 0.9518, test_f1: 0.5179
 epoch: 41, train_loss: 0.8264, test_loss: 0.9420, test_f1: 0.5122
 epoch: 42, train_loss: 0.8186, test_loss: 0.9441, test_f1: 0.5311
 epoch: 43, train_loss: 0.8151, test_loss: 0.9370, test_f1: 0.5340
 epoch: 44, train_loss: 0.8137, test_loss: 0.9486, test_f1: 0.5283
 epoch: 45, train_loss: 0.8161, test_loss: 0.9425, test_f1: 0.5312
 epoch: 46, train_loss: 0.7937, test_loss: 0.9485, test_f1: 0.5411
 epoch: 47, train_loss: 0.7912, test_loss: 0.9474, test_f1: 0.5241
 epoch: 48, train_loss: 0.7965, test_loss: 0.9443, test_f1: 0.5285
 epoch: 49, train_loss: 0.7790, test_loss: 0.9589, test_f1: 0.5321
 epoch: 50, train_loss: 0.7831, test_loss: 0.9883, test_f1: 0.5116
 epoch: 51, train_loss: 0.7752, test_loss: 0.9652, test_f1: 0.5324
 epoch: 52, train_loss: 0.7743, test_loss: 0.9560, test_f1: 0.5305
 epoch: 53, train_loss: 0.7686, test_loss: 0.9607, test_f1: 0.5292
 epoch: 54, train_loss: 0.7645, test_loss: 0.9647, test_f1: 0.5370
 epoch: 55, train_loss: 0.7665, test_loss: 0.9516, test_f1: 0.5359
 epoch: 56, train_loss: 0.7649, test_loss: 0.9523, test_f1: 0.5332
 epoch: 57, train_loss: 0.7663, test_loss: 0.9546, test_f1: 0.5299
 epoch: 58, train_loss: 0.7612, test_loss: 0.9662, test_f1: 0.5280
 epoch: 59, train_loss: 0.7512, test_loss: 0.9518, test_f1: 0.5398
 epoch: 60, train_loss: 0.7637, test_loss: 0.9607, test_f1: 0.5406
 epoch: 61, train_loss: 0.7554, test_loss: 0.9698, test_f1: 0.5338
 epoch: 62, train_loss: 0.7536, test_loss: 0.9766, test_f1: 0.5310
 epoch: 63, train_loss: 0.7406, test_loss: 0.9719, test_f1: 0.5311
 epoch: 64, train_loss: 0.7391, test_loss: 0.9778, test_f1: 0.5339
 epoch: 65, train_loss: 0.7455, test_loss: 0.9757, test_f1: 0.5380
 epoch: 66, train_loss: 0.7468, test_loss: 0.9721, test_f1: 0.5365
 epoch: 67, train_loss: 0.7351, test_loss: 0.9685, test_f1: 0.5420
 epoch: 68, train_loss: 0.7361, test_loss: 0.9628, test_f1: 0.5447
 epoch: 69, train_loss: 0.7320, test_loss: 0.9655, test_f1: 0.5453
 epoch: 70, train_loss: 0.7289, test_loss: 0.9836, test_f1: 0.5413
 epoch: 71, train_loss: 0.7348, test_loss: 0.9738, test_f1: 0.5400
 epoch: 72, train_loss: 0.7285, test_loss: 0.9825, test_f1: 0.5399
 epoch: 73, train_loss: 0.7307, test_loss: 0.9665, test_f1: 0.5503
 epoch: 74, train_loss: 0.7368, test_loss: 0.9748, test_f1: 0.5422
 epoch: 75, train_loss: 0.7223, test_loss: 0.9830, test_f1: 0.5382
 epoch: 76, train_loss: 0.7229, test_loss: 0.9879, test_f1: 0.5369
 epoch: 77, train_loss: 0.7165, test_loss: 0.9922, test_f1: 0.5393
 epoch: 78, train_loss: 0.7276, test_loss: 0.9836, test_f1: 0.5399
 epoch: 79, train_loss: 0.7208, test_loss: 0.9813, test_f1: 0.5456
 epoch: 80, train_loss: 0.7148, test_loss: 0.9761, test_f1: 0.5537
 epoch: 81, train_loss: 0.7117, test_loss: 0.9938, test_f1: 0.5392
 epoch: 82, train_loss: 0.7115, test_loss: 0.9805, test_f1: 0.5555
 epoch: 83, train_loss: 0.7200, test_loss: 0.9979, test_f1: 0.5415
 epoch: 84, train_loss: 0.7107, test_loss: 0.9954, test_f1: 0.5494
 epoch: 85, train_loss: 0.7058, test_loss: 0.9842, test_f1: 0.5405
 epoch: 86, train_loss: 0.7079, test_loss: 1.0042, test_f1: 0.5407
 epoch: 87, train_loss: 0.7043, test_loss: 1.0067, test_f1: 0.5387
 epoch: 88, train_loss: 0.6976, test_loss: 1.0362, test_f1: 0.5350
 epoch: 89, train_loss: 0.7021, test_loss: 1.0121, test_f1: 0.5408
 epoch: 90, train_loss: 0.7064, test_loss: 0.9914, test_f1: 0.5386
 epoch: 91, train_loss: 0.6961, test_loss: 1.0058, test_f1: 0.5426
 epoch: 92, train_loss: 0.6919, test_loss: 1.0105, test_f1: 0.5290
 epoch: 93, train_loss: 0.6964, test_loss: 0.9895, test_f1: 0.5531
 epoch: 94, train_loss: 0.6993, test_loss: 1.0066, test_f1: 0.5417
 epoch: 95, train_loss: 0.6912, test_loss: 1.0279, test_f1: 0.5375
 epoch: 96, train_loss: 0.6881, test_loss: 1.0362, test_f1: 0.5308
 epoch: 97, train_loss: 0.6805, test_loss: 1.0216, test_f1: 0.5351
 epoch: 98, train_loss: 0.6822, test_loss: 1.0175, test_f1: 0.5384
 epoch: 99, train_loss: 0.6835, test_loss: 1.0162, test_f1: 0.5390
##################ITERATION #8 ****************************************
 epoch: 0, train_loss: 1.2943, test_loss: 1.3105, test_f1: 0.2260
 epoch: 1, train_loss: 1.2105, test_loss: 1.2993, test_f1: 0.2260
 epoch: 2, train_loss: 1.1737, test_loss: 1.2700, test_f1: 0.2920
 epoch: 3, train_loss: 1.1515, test_loss: 1.1794, test_f1: 0.3677
 epoch: 4, train_loss: 1.1348, test_loss: 1.1179, test_f1: 0.4256
 epoch: 5, train_loss: 1.1049, test_loss: 1.0679, test_f1: 0.4448
 epoch: 6, train_loss: 1.0870, test_loss: 1.0528, test_f1: 0.4586
 epoch: 7, train_loss: 1.0779, test_loss: 1.0384, test_f1: 0.4579
 epoch: 8, train_loss: 1.0580, test_loss: 1.0245, test_f1: 0.4632
 epoch: 9, train_loss: 1.0540, test_loss: 1.0156, test_f1: 0.4745
 epoch: 10, train_loss: 1.0383, test_loss: 1.0112, test_f1: 0.4704
 epoch: 11, train_loss: 1.0256, test_loss: 0.9984, test_f1: 0.4799
 epoch: 12, train_loss: 1.0170, test_loss: 0.9889, test_f1: 0.4837
 epoch: 13, train_loss: 1.0136, test_loss: 0.9858, test_f1: 0.4815
 epoch: 14, train_loss: 0.9968, test_loss: 0.9817, test_f1: 0.4865
 epoch: 15, train_loss: 0.9830, test_loss: 0.9721, test_f1: 0.4907
 epoch: 16, train_loss: 0.9765, test_loss: 0.9716, test_f1: 0.4951
 epoch: 17, train_loss: 0.9792, test_loss: 0.9680, test_f1: 0.4918
 epoch: 18, train_loss: 0.9660, test_loss: 0.9679, test_f1: 0.4966
 epoch: 19, train_loss: 0.9578, test_loss: 0.9620, test_f1: 0.5005
 epoch: 20, train_loss: 0.9509, test_loss: 0.9622, test_f1: 0.5045
 epoch: 21, train_loss: 0.9423, test_loss: 0.9698, test_f1: 0.5110
 epoch: 22, train_loss: 0.9399, test_loss: 0.9630, test_f1: 0.5244
 epoch: 23, train_loss: 0.9335, test_loss: 0.9618, test_f1: 0.5235
 epoch: 24, train_loss: 0.9306, test_loss: 0.9562, test_f1: 0.5142
 epoch: 25, train_loss: 0.9250, test_loss: 0.9722, test_f1: 0.5100
 epoch: 26, train_loss: 0.9151, test_loss: 0.9575, test_f1: 0.5171
 epoch: 27, train_loss: 0.9164, test_loss: 0.9586, test_f1: 0.5233
 epoch: 28, train_loss: 0.9051, test_loss: 0.9630, test_f1: 0.5141
 epoch: 29, train_loss: 0.9013, test_loss: 0.9502, test_f1: 0.5173
 epoch: 30, train_loss: 0.8905, test_loss: 0.9670, test_f1: 0.5201
 epoch: 31, train_loss: 0.8836, test_loss: 0.9744, test_f1: 0.5131
 epoch: 32, train_loss: 0.8807, test_loss: 0.9572, test_f1: 0.5155
 epoch: 33, train_loss: 0.8692, test_loss: 0.9598, test_f1: 0.5304
 epoch: 34, train_loss: 0.8751, test_loss: 0.9740, test_f1: 0.5199
 epoch: 35, train_loss: 0.8736, test_loss: 0.9564, test_f1: 0.5326
 epoch: 36, train_loss: 0.8662, test_loss: 0.9504, test_f1: 0.5438
 epoch: 37, train_loss: 0.8558, test_loss: 0.9815, test_f1: 0.5333
 epoch: 38, train_loss: 0.8520, test_loss: 0.9994, test_f1: 0.5342
 epoch: 39, train_loss: 0.8423, test_loss: 0.9594, test_f1: 0.5377
 epoch: 40, train_loss: 0.8435, test_loss: 0.9819, test_f1: 0.5332
 epoch: 41, train_loss: 0.8321, test_loss: 0.9564, test_f1: 0.5405
 epoch: 42, train_loss: 0.8459, test_loss: 0.9792, test_f1: 0.5108
 epoch: 43, train_loss: 0.8265, test_loss: 1.0102, test_f1: 0.5427
 epoch: 44, train_loss: 0.8294, test_loss: 0.9439, test_f1: 0.5532
 epoch: 45, train_loss: 0.8229, test_loss: 0.9337, test_f1: 0.5520
 epoch: 46, train_loss: 0.8142, test_loss: 0.9501, test_f1: 0.5410
 epoch: 47, train_loss: 0.8155, test_loss: 0.9643, test_f1: 0.5292
 epoch: 48, train_loss: 0.8084, test_loss: 0.9332, test_f1: 0.5505
 epoch: 49, train_loss: 0.7941, test_loss: 0.9673, test_f1: 0.5209
 epoch: 50, train_loss: 0.8002, test_loss: 1.0078, test_f1: 0.5249
 epoch: 51, train_loss: 0.7930, test_loss: 0.9762, test_f1: 0.5312
 epoch: 52, train_loss: 0.7866, test_loss: 0.9399, test_f1: 0.5359
 epoch: 53, train_loss: 0.7805, test_loss: 0.9740, test_f1: 0.5417
 epoch: 54, train_loss: 0.7802, test_loss: 0.9809, test_f1: 0.5369
 epoch: 55, train_loss: 0.7915, test_loss: 0.9733, test_f1: 0.5312
 epoch: 56, train_loss: 0.7862, test_loss: 0.9821, test_f1: 0.5400
 epoch: 57, train_loss: 0.7807, test_loss: 0.9658, test_f1: 0.5339
 epoch: 58, train_loss: 0.7746, test_loss: 1.0155, test_f1: 0.5355
 epoch: 59, train_loss: 0.7803, test_loss: 1.0216, test_f1: 0.5392
 epoch: 60, train_loss: 0.7701, test_loss: 0.9973, test_f1: 0.5247
 epoch: 61, train_loss: 0.7760, test_loss: 0.9804, test_f1: 0.5369
 epoch: 62, train_loss: 0.7649, test_loss: 0.9666, test_f1: 0.5331
 epoch: 63, train_loss: 0.7731, test_loss: 0.9430, test_f1: 0.5360
 epoch: 64, train_loss: 0.7569, test_loss: 1.0091, test_f1: 0.5368
 epoch: 65, train_loss: 0.7630, test_loss: 0.9789, test_f1: 0.5380
 epoch: 66, train_loss: 0.7617, test_loss: 0.9467, test_f1: 0.5314
 epoch: 67, train_loss: 0.7615, test_loss: 0.9463, test_f1: 0.5502
 epoch: 68, train_loss: 0.7576, test_loss: 1.0290, test_f1: 0.5376
 epoch: 69, train_loss: 0.7509, test_loss: 0.9553, test_f1: 0.5403
 epoch: 70, train_loss: 0.7589, test_loss: 0.9481, test_f1: 0.5407
 epoch: 71, train_loss: 0.7526, test_loss: 0.9640, test_f1: 0.5278
 epoch: 72, train_loss: 0.7434, test_loss: 1.0214, test_f1: 0.5384
 epoch: 73, train_loss: 0.7414, test_loss: 1.0369, test_f1: 0.5314
 epoch: 74, train_loss: 0.7506, test_loss: 1.0571, test_f1: 0.5247
 epoch: 75, train_loss: 0.7409, test_loss: 1.0433, test_f1: 0.5357
 epoch: 76, train_loss: 0.7408, test_loss: 1.0337, test_f1: 0.5311
 epoch: 77, train_loss: 0.7366, test_loss: 1.0175, test_f1: 0.5361
 epoch: 78, train_loss: 0.7302, test_loss: 0.9954, test_f1: 0.5350
 epoch: 79, train_loss: 0.7368, test_loss: 1.0399, test_f1: 0.5306
 epoch: 80, train_loss: 0.7404, test_loss: 1.0394, test_f1: 0.5356
 epoch: 81, train_loss: 0.7317, test_loss: 1.0169, test_f1: 0.5417
 epoch: 82, train_loss: 0.7237, test_loss: 1.0123, test_f1: 0.5467
 epoch: 83, train_loss: 0.7219, test_loss: 0.9956, test_f1: 0.5449
 epoch: 84, train_loss: 0.7297, test_loss: 0.9918, test_f1: 0.5429
 epoch: 85, train_loss: 0.7222, test_loss: 1.0041, test_f1: 0.5556
 epoch: 86, train_loss: 0.7196, test_loss: 0.9975, test_f1: 0.5381
 epoch: 87, train_loss: 0.7286, test_loss: 0.9918, test_f1: 0.5414
 epoch: 88, train_loss: 0.7117, test_loss: 0.9986, test_f1: 0.5471
 epoch: 89, train_loss: 0.7114, test_loss: 0.9893, test_f1: 0.5392
 epoch: 90, train_loss: 0.7083, test_loss: 0.9914, test_f1: 0.5411
 epoch: 91, train_loss: 0.7091, test_loss: 1.0186, test_f1: 0.5319
 epoch: 92, train_loss: 0.7068, test_loss: 1.0398, test_f1: 0.5388
 epoch: 93, train_loss: 0.7152, test_loss: 1.0018, test_f1: 0.5377
 epoch: 94, train_loss: 0.7195, test_loss: 1.0555, test_f1: 0.5314
 epoch: 95, train_loss: 0.7020, test_loss: 1.0463, test_f1: 0.5272
 epoch: 96, train_loss: 0.6982, test_loss: 1.0286, test_f1: 0.5311
 epoch: 97, train_loss: 0.7004, test_loss: 1.0320, test_f1: 0.5359
 epoch: 98, train_loss: 0.6983, test_loss: 1.0644, test_f1: 0.5429
 epoch: 99, train_loss: 0.6967, test_loss: 1.0438, test_f1: 0.5435
##################ITERATION #9 ****************************************
 epoch: 0, train_loss: 1.3133, test_loss: 1.3320, test_f1: 0.2260
 epoch: 1, train_loss: 1.2062, test_loss: 1.3205, test_f1: 0.2540
 epoch: 2, train_loss: 1.1708, test_loss: 1.3014, test_f1: 0.3087
 epoch: 3, train_loss: 1.1429, test_loss: 1.1941, test_f1: 0.3272
 epoch: 4, train_loss: 1.1228, test_loss: 1.0972, test_f1: 0.4384
 epoch: 5, train_loss: 1.0987, test_loss: 1.0549, test_f1: 0.4693
 epoch: 6, train_loss: 1.0754, test_loss: 1.0324, test_f1: 0.4800
 epoch: 7, train_loss: 1.0632, test_loss: 1.0161, test_f1: 0.4763
 epoch: 8, train_loss: 1.0526, test_loss: 1.0038, test_f1: 0.4669
 epoch: 9, train_loss: 1.0424, test_loss: 0.9951, test_f1: 0.4706
 epoch: 10, train_loss: 1.0274, test_loss: 0.9819, test_f1: 0.4655
 epoch: 11, train_loss: 1.0156, test_loss: 0.9754, test_f1: 0.4660
 epoch: 12, train_loss: 1.0042, test_loss: 0.9683, test_f1: 0.4654
 epoch: 13, train_loss: 0.9883, test_loss: 0.9675, test_f1: 0.4642
 epoch: 14, train_loss: 0.9772, test_loss: 0.9591, test_f1: 0.4588
 epoch: 15, train_loss: 0.9692, test_loss: 0.9517, test_f1: 0.4584
 epoch: 16, train_loss: 0.9650, test_loss: 0.9426, test_f1: 0.4729
 epoch: 17, train_loss: 0.9600, test_loss: 0.9500, test_f1: 0.4730
 epoch: 18, train_loss: 0.9517, test_loss: 0.9525, test_f1: 0.4731
 epoch: 19, train_loss: 0.9409, test_loss: 0.9317, test_f1: 0.4812
 epoch: 20, train_loss: 0.9339, test_loss: 0.9361, test_f1: 0.4826
 epoch: 21, train_loss: 0.9289, test_loss: 0.9300, test_f1: 0.4813
 epoch: 22, train_loss: 0.9092, test_loss: 0.9235, test_f1: 0.4862
 epoch: 23, train_loss: 0.9042, test_loss: 0.9172, test_f1: 0.4843
 epoch: 24, train_loss: 0.9105, test_loss: 0.9171, test_f1: 0.4854
 epoch: 25, train_loss: 0.9045, test_loss: 0.8999, test_f1: 0.4914
 epoch: 26, train_loss: 0.8914, test_loss: 0.9197, test_f1: 0.4856
 epoch: 27, train_loss: 0.8846, test_loss: 0.9094, test_f1: 0.4899
 epoch: 28, train_loss: 0.8716, test_loss: 0.9105, test_f1: 0.4982
 epoch: 29, train_loss: 0.8686, test_loss: 0.9095, test_f1: 0.4945
 epoch: 30, train_loss: 0.8598, test_loss: 0.9023, test_f1: 0.4939
 epoch: 31, train_loss: 0.8585, test_loss: 0.9072, test_f1: 0.5007
 epoch: 32, train_loss: 0.8431, test_loss: 0.9223, test_f1: 0.4943
 epoch: 33, train_loss: 0.8427, test_loss: 0.9111, test_f1: 0.4900
 epoch: 34, train_loss: 0.8392, test_loss: 0.9237, test_f1: 0.4936
 epoch: 35, train_loss: 0.8361, test_loss: 0.9237, test_f1: 0.5001
 epoch: 36, train_loss: 0.8167, test_loss: 0.9163, test_f1: 0.4954
 epoch: 37, train_loss: 0.8256, test_loss: 0.9016, test_f1: 0.5097
 epoch: 38, train_loss: 0.8203, test_loss: 0.9367, test_f1: 0.5072
 epoch: 39, train_loss: 0.8214, test_loss: 0.9100, test_f1: 0.5094
 epoch: 40, train_loss: 0.8076, test_loss: 0.9074, test_f1: 0.5046
 epoch: 41, train_loss: 0.8025, test_loss: 0.9074, test_f1: 0.5064
 epoch: 42, train_loss: 0.8035, test_loss: 0.9311, test_f1: 0.5090
 epoch: 43, train_loss: 0.7904, test_loss: 0.9052, test_f1: 0.5361
 epoch: 44, train_loss: 0.7898, test_loss: 0.9219, test_f1: 0.5192
 epoch: 45, train_loss: 0.7816, test_loss: 0.9252, test_f1: 0.5067
 epoch: 46, train_loss: 0.7811, test_loss: 0.9214, test_f1: 0.5188
 epoch: 47, train_loss: 0.7791, test_loss: 0.9137, test_f1: 0.5218
 epoch: 48, train_loss: 0.7742, test_loss: 0.8874, test_f1: 0.5369
 epoch: 49, train_loss: 0.7782, test_loss: 0.8954, test_f1: 0.5341
 epoch: 50, train_loss: 0.7674, test_loss: 0.8980, test_f1: 0.5322
 epoch: 51, train_loss: 0.7594, test_loss: 0.9083, test_f1: 0.5268
 epoch: 52, train_loss: 0.7517, test_loss: 0.8883, test_f1: 0.5469
 epoch: 53, train_loss: 0.7417, test_loss: 0.9217, test_f1: 0.5401
 epoch: 54, train_loss: 0.7409, test_loss: 0.9054, test_f1: 0.5413
 epoch: 55, train_loss: 0.7442, test_loss: 0.9156, test_f1: 0.5390
 epoch: 56, train_loss: 0.7334, test_loss: 0.9174, test_f1: 0.5283
 epoch: 57, train_loss: 0.7326, test_loss: 0.9205, test_f1: 0.5391
 epoch: 58, train_loss: 0.7423, test_loss: 0.9259, test_f1: 0.5573
 epoch: 59, train_loss: 0.7257, test_loss: 0.9294, test_f1: 0.5569
 epoch: 60, train_loss: 0.7315, test_loss: 0.9257, test_f1: 0.5560
 epoch: 61, train_loss: 0.7272, test_loss: 0.9557, test_f1: 0.5042
 epoch: 62, train_loss: 0.7277, test_loss: 0.9327, test_f1: 0.5305
 epoch: 63, train_loss: 0.7253, test_loss: 0.9242, test_f1: 0.5534
 epoch: 64, train_loss: 0.7277, test_loss: 0.9106, test_f1: 0.5505
 epoch: 65, train_loss: 0.7322, test_loss: 0.9224, test_f1: 0.5516
 epoch: 66, train_loss: 0.7253, test_loss: 0.9294, test_f1: 0.5518
 epoch: 67, train_loss: 0.7224, test_loss: 0.9426, test_f1: 0.5429
 epoch: 68, train_loss: 0.7111, test_loss: 0.9200, test_f1: 0.5596
 epoch: 69, train_loss: 0.7133, test_loss: 0.9231, test_f1: 0.5568
 epoch: 70, train_loss: 0.7162, test_loss: 0.9192, test_f1: 0.5600
 epoch: 71, train_loss: 0.7166, test_loss: 0.9127, test_f1: 0.5520
 epoch: 72, train_loss: 0.7032, test_loss: 0.9357, test_f1: 0.5461
 epoch: 73, train_loss: 0.7099, test_loss: 0.9114, test_f1: 0.5492
 epoch: 74, train_loss: 0.7124, test_loss: 0.9118, test_f1: 0.5582
 epoch: 75, train_loss: 0.7187, test_loss: 0.9020, test_f1: 0.5472
 epoch: 76, train_loss: 0.7081, test_loss: 0.9048, test_f1: 0.5523
 epoch: 77, train_loss: 0.6952, test_loss: 0.9283, test_f1: 0.5475
 epoch: 78, train_loss: 0.6978, test_loss: 0.9209, test_f1: 0.5574
 epoch: 79, train_loss: 0.7075, test_loss: 0.9184, test_f1: 0.5579
 epoch: 80, train_loss: 0.6994, test_loss: 0.9146, test_f1: 0.5519
 epoch: 81, train_loss: 0.6920, test_loss: 0.9221, test_f1: 0.5587
 epoch: 82, train_loss: 0.6809, test_loss: 0.9293, test_f1: 0.5532
 epoch: 83, train_loss: 0.6884, test_loss: 0.9262, test_f1: 0.5518
 epoch: 84, train_loss: 0.6885, test_loss: 0.9383, test_f1: 0.5534
 epoch: 85, train_loss: 0.6924, test_loss: 0.9225, test_f1: 0.5520
 epoch: 86, train_loss: 0.6801, test_loss: 0.9430, test_f1: 0.5560
 epoch: 87, train_loss: 0.6813, test_loss: 0.9077, test_f1: 0.5572
 epoch: 88, train_loss: 0.6760, test_loss: 0.9267, test_f1: 0.5578
 epoch: 89, train_loss: 0.6784, test_loss: 0.9282, test_f1: 0.5499
 epoch: 90, train_loss: 0.6777, test_loss: 0.9232, test_f1: 0.5603
 epoch: 91, train_loss: 0.6844, test_loss: 0.9234, test_f1: 0.5483
 epoch: 92, train_loss: 0.6743, test_loss: 0.9430, test_f1: 0.5462
 epoch: 93, train_loss: 0.6717, test_loss: 0.9161, test_f1: 0.5512
 epoch: 94, train_loss: 0.6675, test_loss: 0.9467, test_f1: 0.5434
 epoch: 95, train_loss: 0.6767, test_loss: 0.9147, test_f1: 0.5522
 epoch: 96, train_loss: 0.6628, test_loss: 0.9439, test_f1: 0.5529
 epoch: 97, train_loss: 0.6733, test_loss: 0.9320, test_f1: 0.5582
 epoch: 98, train_loss: 0.6841, test_loss: 0.9494, test_f1: 0.5567
 epoch: 99, train_loss: 0.6671, test_loss: 0.9592, test_f1: 0.5513

Training completed in 440.37 seconds
Best F1: 0.5689 at epoch 50
Mean F1 across iterations: 0.5489  0.0170
========================FINAL RESULTS================================
FEGIN weighted F1: 0.5689  0.0170
python main.py --data ltspice_examples --representation component_pin --model FEGIN --layers 4 --hiddens 64 --batch_size 256 --lr 0.0001 --emb_size 128 --epochs 100 --save_appendix component_pin_L4_H64_BS256_LR0.0001_E128 --no_val
-----



STDERR:
  File "main.py", line 370, in <module>
    main()
  File "main.py", line 254, in main
    dataset = dataset_class(
  File "/home/philip/projects/ltspice_examples_code_repo/Circuit-Completion-Using-GNNs/component_classification_with_link_prediction_head/evaluation/FEGIN/kernel/circuit_datasets.py", line 15, in __init__
    self.data, self.slices = torch.load(self.processed_paths[0])
  File "/home/philip/.local/lib/python3.8/site-packages/torch/serialization.py", line 1040, in load
    warnings.warn(
  File "/usr/lib/python3.8/warnings.py", line 109, in _showwarnmsg
    sw(msg.message, msg.category, msg.filename, msg.lineno,
  File "main.py", line 47, in warn_with_traceback
    traceback.print_stack(file=log)
/home/philip/projects/ltspice_examples_code_repo/Circuit-Completion-Using-GNNs/component_classification_with_link_prediction_head/evaluation/FEGIN/kernel/circuit_datasets.py:15: FutureWarning: You are using `torch.load` with `weights_only=False` (the current default value), which uses the default pickle module implicitly. It is possible to construct malicious pickle data which will execute arbitrary code during unpickling (See https://github.com/pytorch/pytorch/blob/main/SECURITY.md#untrusted-models for more details). In a future release, the default value for `weights_only` will be flipped to `True`. This limits the functions that could be executed during unpickling. Arbitrary objects will no longer be allowed to be loaded via this mode unless they are explicitly allowlisted by the user via `torch.serialization.add_safe_globals`. We recommend you start setting `weights_only=True` for any use case where you don't have full control of the loaded file. Please open an issue on GitHub for any issues related to this experimental feature.
  self.data, self.slices = torch.load(self.processed_paths[0])
