STDOUT:
Results will be saved in /home/philip/projects/ltspice_examples_code_repo/Circuit-Completion-Using-GNNs/component_classification_with_link_prediction_head/evaluation/FEGIN/results/model_FEGIN_dataset_ltspice_examples
Command line input: python main.py --data ltspice_examples --representation component_pin_net --model FEGIN --layers 6 --hiddens 128 --batch_size 32 --lr 0.001 --emb_size 128 --epochs 100 --save_appendix component_pin_net_L6_H128_BS32_LR0.001_E128 --no_val
 is saved.
-----
ltspice_examples - FEGIN
Using 6 layers, 128 hidden units, h = 2
Loading component_pin_net representation dataset
ENTERED
Training FEGIN on component_pin_net representation
Train: 3558, Test: 846
##################ITERATION #0 ****************************************
 epoch: 0, train_loss: 1.1302, test_loss: 1.0997, test_f1: 0.4466
 epoch: 1, train_loss: 0.9960, test_loss: 0.9413, test_f1: 0.4940
 epoch: 2, train_loss: 0.9469, test_loss: 0.9066, test_f1: 0.5553
 epoch: 3, train_loss: 0.9349, test_loss: 0.9115, test_f1: 0.4877
 epoch: 4, train_loss: 0.9110, test_loss: 0.8903, test_f1: 0.5253
 epoch: 5, train_loss: 0.8884, test_loss: 0.8604, test_f1: 0.5511
 epoch: 6, train_loss: 0.8507, test_loss: 0.8058, test_f1: 0.5692
 epoch: 7, train_loss: 0.8395, test_loss: 0.8555, test_f1: 0.5829
 epoch: 8, train_loss: 0.8139, test_loss: 0.7971, test_f1: 0.5494
 epoch: 9, train_loss: 0.8029, test_loss: 0.7724, test_f1: 0.6092
 epoch: 10, train_loss: 0.7846, test_loss: 0.7874, test_f1: 0.6166
 epoch: 11, train_loss: 0.7674, test_loss: 0.7936, test_f1: 0.6058
 epoch: 12, train_loss: 0.7479, test_loss: 0.7174, test_f1: 0.6657
 epoch: 13, train_loss: 0.7443, test_loss: 0.7264, test_f1: 0.6555
 epoch: 14, train_loss: 0.7223, test_loss: 0.7421, test_f1: 0.6514
 epoch: 15, train_loss: 0.7033, test_loss: 0.7518, test_f1: 0.6432
 epoch: 16, train_loss: 0.6928, test_loss: 0.8150, test_f1: 0.6314
 epoch: 17, train_loss: 0.6761, test_loss: 0.7075, test_f1: 0.6780
 epoch: 18, train_loss: 0.6557, test_loss: 0.7553, test_f1: 0.6641
 epoch: 19, train_loss: 0.6546, test_loss: 0.8344, test_f1: 0.6152
 epoch: 20, train_loss: 0.6436, test_loss: 0.7110, test_f1: 0.6634
 epoch: 21, train_loss: 0.6161, test_loss: 0.7976, test_f1: 0.6655
 epoch: 22, train_loss: 0.6090, test_loss: 0.8078, test_f1: 0.6658
 epoch: 23, train_loss: 0.5946, test_loss: 0.7646, test_f1: 0.6326
 epoch: 24, train_loss: 0.6097, test_loss: 0.8869, test_f1: 0.6866
 epoch: 25, train_loss: 0.5843, test_loss: 0.8428, test_f1: 0.6698
 epoch: 26, train_loss: 0.5992, test_loss: 0.7486, test_f1: 0.7175
 epoch: 27, train_loss: 0.5675, test_loss: 0.8788, test_f1: 0.6627
 epoch: 28, train_loss: 0.5551, test_loss: 0.8575, test_f1: 0.6760
 epoch: 29, train_loss: 0.5607, test_loss: 0.7642, test_f1: 0.6472
 epoch: 30, train_loss: 0.5574, test_loss: 0.8155, test_f1: 0.6810
 epoch: 31, train_loss: 0.5226, test_loss: 0.7741, test_f1: 0.6861
 epoch: 32, train_loss: 0.5209, test_loss: 0.8800, test_f1: 0.6792
 epoch: 33, train_loss: 0.5011, test_loss: 0.7987, test_f1: 0.6629
 epoch: 34, train_loss: 0.5147, test_loss: 0.7578, test_f1: 0.6907
 epoch: 35, train_loss: 0.4969, test_loss: 0.8451, test_f1: 0.7182
 epoch: 36, train_loss: 0.4930, test_loss: 0.9231, test_f1: 0.6358
 epoch: 37, train_loss: 0.4805, test_loss: 0.8471, test_f1: 0.6773
 epoch: 38, train_loss: 0.4744, test_loss: 0.9193, test_f1: 0.6874
 epoch: 39, train_loss: 0.4625, test_loss: 0.7504, test_f1: 0.7144
 epoch: 40, train_loss: 0.5002, test_loss: 0.7757, test_f1: 0.7284
 epoch: 41, train_loss: 0.4546, test_loss: 0.9032, test_f1: 0.6851
 epoch: 42, train_loss: 0.4624, test_loss: 0.8132, test_f1: 0.7067
 epoch: 43, train_loss: 0.4471, test_loss: 0.8775, test_f1: 0.6909
 epoch: 44, train_loss: 0.4491, test_loss: 0.9395, test_f1: 0.6870
 epoch: 45, train_loss: 0.4193, test_loss: 0.9141, test_f1: 0.6849
 epoch: 46, train_loss: 0.4447, test_loss: 0.9018, test_f1: 0.7141
 epoch: 47, train_loss: 0.4255, test_loss: 0.9994, test_f1: 0.6869
 epoch: 48, train_loss: 0.4021, test_loss: 0.8980, test_f1: 0.6708
 epoch: 49, train_loss: 0.4357, test_loss: 0.9434, test_f1: 0.6874
 epoch: 50, train_loss: 0.4005, test_loss: 0.9158, test_f1: 0.6765
 epoch: 51, train_loss: 0.3628, test_loss: 1.0764, test_f1: 0.6860
 epoch: 52, train_loss: 0.3358, test_loss: 0.9506, test_f1: 0.6997
 epoch: 53, train_loss: 0.3279, test_loss: 1.1464, test_f1: 0.6813
 epoch: 54, train_loss: 0.3180, test_loss: 1.2121, test_f1: 0.6830
 epoch: 55, train_loss: 0.3111, test_loss: 1.2266, test_f1: 0.7123
 epoch: 56, train_loss: 0.3040, test_loss: 1.1675, test_f1: 0.6774
 epoch: 57, train_loss: 0.3166, test_loss: 1.2180, test_f1: 0.7092
 epoch: 58, train_loss: 0.2962, test_loss: 1.0242, test_f1: 0.7104
 epoch: 59, train_loss: 0.3009, test_loss: 1.1584, test_f1: 0.6895
 epoch: 60, train_loss: 0.2997, test_loss: 1.1760, test_f1: 0.7004
 epoch: 61, train_loss: 0.2788, test_loss: 1.2649, test_f1: 0.6960
 epoch: 62, train_loss: 0.2910, test_loss: 1.0431, test_f1: 0.7127
 epoch: 63, train_loss: 0.2895, test_loss: 1.1232, test_f1: 0.6853
 epoch: 64, train_loss: 0.2952, test_loss: 1.1925, test_f1: 0.6864
 epoch: 65, train_loss: 0.2896, test_loss: 1.2744, test_f1: 0.6805
 epoch: 66, train_loss: 0.2656, test_loss: 1.3626, test_f1: 0.6920
 epoch: 67, train_loss: 0.2713, test_loss: 1.3855, test_f1: 0.6831
 epoch: 68, train_loss: 0.2599, test_loss: 1.2565, test_f1: 0.7031
 epoch: 69, train_loss: 0.2693, test_loss: 1.2702, test_f1: 0.6878
 epoch: 70, train_loss: 0.2554, test_loss: 1.2560, test_f1: 0.6843
 epoch: 71, train_loss: 0.2479, test_loss: 1.2478, test_f1: 0.6971
 epoch: 72, train_loss: 0.2365, test_loss: 1.2195, test_f1: 0.7261
 epoch: 73, train_loss: 0.2313, test_loss: 1.3868, test_f1: 0.7104
 epoch: 74, train_loss: 0.2321, test_loss: 1.5233, test_f1: 0.6570
 epoch: 75, train_loss: 0.2390, test_loss: 1.4083, test_f1: 0.7057
 epoch: 76, train_loss: 0.2419, test_loss: 1.2765, test_f1: 0.6890
 epoch: 77, train_loss: 0.2336, test_loss: 1.5964, test_f1: 0.6801
 epoch: 78, train_loss: 0.2238, test_loss: 1.4943, test_f1: 0.7012
 epoch: 79, train_loss: 0.2377, test_loss: 1.4777, test_f1: 0.6678
 epoch: 80, train_loss: 0.2091, test_loss: 1.3789, test_f1: 0.6948
 epoch: 81, train_loss: 0.2118, test_loss: 1.4808, test_f1: 0.6809
 epoch: 82, train_loss: 0.2100, test_loss: 1.4949, test_f1: 0.7041
 epoch: 83, train_loss: 0.2197, test_loss: 1.4518, test_f1: 0.6918
 epoch: 84, train_loss: 0.2264, test_loss: 1.3886, test_f1: 0.6917
 epoch: 85, train_loss: 0.2181, test_loss: 1.4063, test_f1: 0.6843
 epoch: 86, train_loss: 0.2158, test_loss: 1.5459, test_f1: 0.6831
 epoch: 87, train_loss: 0.2092, test_loss: 1.5141, test_f1: 0.6818
 epoch: 88, train_loss: 0.2076, test_loss: 1.4716, test_f1: 0.6989
 epoch: 89, train_loss: 0.1904, test_loss: 1.6021, test_f1: 0.6922
 epoch: 90, train_loss: 0.2135, test_loss: 1.6236, test_f1: 0.7032
 epoch: 91, train_loss: 0.2123, test_loss: 1.4629, test_f1: 0.6906
 epoch: 92, train_loss: 0.1857, test_loss: 1.7251, test_f1: 0.6944
 epoch: 93, train_loss: 0.1883, test_loss: 1.4675, test_f1: 0.7007
 epoch: 94, train_loss: 0.1974, test_loss: 1.5475, test_f1: 0.6955
 epoch: 95, train_loss: 0.1971, test_loss: 1.6470, test_f1: 0.6852
 epoch: 96, train_loss: 0.1860, test_loss: 1.5512, test_f1: 0.6841
 epoch: 97, train_loss: 0.2079, test_loss: 1.8517, test_f1: 0.6838
 epoch: 98, train_loss: 0.1757, test_loss: 1.7876, test_f1: 0.6804
 epoch: 99, train_loss: 0.1952, test_loss: 1.6940, test_f1: 0.7002
##################ITERATION #1 ****************************************
 epoch: 0, train_loss: 1.0757, test_loss: 1.0801, test_f1: 0.4582
 epoch: 1, train_loss: 0.9621, test_loss: 0.9061, test_f1: 0.5157
 epoch: 2, train_loss: 0.9123, test_loss: 0.8645, test_f1: 0.5469
 epoch: 3, train_loss: 0.8825, test_loss: 0.8381, test_f1: 0.5480
 epoch: 4, train_loss: 0.8566, test_loss: 0.8166, test_f1: 0.5833
 epoch: 5, train_loss: 0.8302, test_loss: 0.9144, test_f1: 0.5488
 epoch: 6, train_loss: 0.8099, test_loss: 0.7949, test_f1: 0.6119
 epoch: 7, train_loss: 0.7894, test_loss: 0.8241, test_f1: 0.6058
 epoch: 8, train_loss: 0.7648, test_loss: 0.7947, test_f1: 0.6271
 epoch: 9, train_loss: 0.7585, test_loss: 0.7683, test_f1: 0.6828
 epoch: 10, train_loss: 0.7396, test_loss: 0.7472, test_f1: 0.6208
 epoch: 11, train_loss: 0.7454, test_loss: 0.7919, test_f1: 0.6279
 epoch: 12, train_loss: 0.7049, test_loss: 0.7872, test_f1: 0.6437
 epoch: 13, train_loss: 0.7005, test_loss: 0.6840, test_f1: 0.6630
 epoch: 14, train_loss: 0.6826, test_loss: 0.6769, test_f1: 0.6922
 epoch: 15, train_loss: 0.6569, test_loss: 0.6986, test_f1: 0.6777
 epoch: 16, train_loss: 0.6665, test_loss: 0.7044, test_f1: 0.6634
 epoch: 17, train_loss: 0.6516, test_loss: 0.7539, test_f1: 0.6533
 epoch: 18, train_loss: 0.6361, test_loss: 0.7369, test_f1: 0.6409
 epoch: 19, train_loss: 0.6231, test_loss: 0.6706, test_f1: 0.6791
 epoch: 20, train_loss: 0.6057, test_loss: 0.7122, test_f1: 0.6468
 epoch: 21, train_loss: 0.6071, test_loss: 0.7643, test_f1: 0.6390
 epoch: 22, train_loss: 0.5873, test_loss: 0.7563, test_f1: 0.6590
 epoch: 23, train_loss: 0.5677, test_loss: 0.6893, test_f1: 0.6780
 epoch: 24, train_loss: 0.5718, test_loss: 0.7390, test_f1: 0.6626
 epoch: 25, train_loss: 0.5564, test_loss: 0.7914, test_f1: 0.6461
 epoch: 26, train_loss: 0.5595, test_loss: 0.7328, test_f1: 0.6569
 epoch: 27, train_loss: 0.5451, test_loss: 0.7144, test_f1: 0.6640
 epoch: 28, train_loss: 0.5270, test_loss: 0.8277, test_f1: 0.6691
 epoch: 29, train_loss: 0.5249, test_loss: 0.7502, test_f1: 0.6624
 epoch: 30, train_loss: 0.5207, test_loss: 0.8841, test_f1: 0.6560
 epoch: 31, train_loss: 0.5036, test_loss: 0.8136, test_f1: 0.6316
 epoch: 32, train_loss: 0.5077, test_loss: 0.7865, test_f1: 0.6597
 epoch: 33, train_loss: 0.4979, test_loss: 0.8171, test_f1: 0.6728
 epoch: 34, train_loss: 0.5043, test_loss: 0.8021, test_f1: 0.6695
 epoch: 35, train_loss: 0.4798, test_loss: 0.8157, test_f1: 0.6647
 epoch: 36, train_loss: 0.4904, test_loss: 0.7376, test_f1: 0.6826
 epoch: 37, train_loss: 0.4797, test_loss: 0.7520, test_f1: 0.6960
 epoch: 38, train_loss: 0.4678, test_loss: 0.7845, test_f1: 0.6690
 epoch: 39, train_loss: 0.4456, test_loss: 0.8586, test_f1: 0.6563
 epoch: 40, train_loss: 0.4307, test_loss: 1.0548, test_f1: 0.6373
 epoch: 41, train_loss: 0.4599, test_loss: 0.9322, test_f1: 0.6797
 epoch: 42, train_loss: 0.4406, test_loss: 0.8234, test_f1: 0.6889
 epoch: 43, train_loss: 0.4324, test_loss: 1.0457, test_f1: 0.6717
 epoch: 44, train_loss: 0.4160, test_loss: 0.9827, test_f1: 0.6862
 epoch: 45, train_loss: 0.4147, test_loss: 0.9319, test_f1: 0.6693
 epoch: 46, train_loss: 0.4061, test_loss: 0.8921, test_f1: 0.6582
 epoch: 47, train_loss: 0.3895, test_loss: 0.9051, test_f1: 0.6469
 epoch: 48, train_loss: 0.4034, test_loss: 0.9676, test_f1: 0.6608
 epoch: 49, train_loss: 0.3959, test_loss: 0.9112, test_f1: 0.6677
 epoch: 50, train_loss: 0.3885, test_loss: 0.8966, test_f1: 0.6721
 epoch: 51, train_loss: 0.3280, test_loss: 0.9139, test_f1: 0.6879
 epoch: 52, train_loss: 0.3178, test_loss: 0.9586, test_f1: 0.6832
 epoch: 53, train_loss: 0.3236, test_loss: 0.9651, test_f1: 0.6891
 epoch: 54, train_loss: 0.2829, test_loss: 1.0297, test_f1: 0.7057
 epoch: 55, train_loss: 0.2938, test_loss: 1.0603, test_f1: 0.6941
 epoch: 56, train_loss: 0.2797, test_loss: 1.1811, test_f1: 0.6806
 epoch: 57, train_loss: 0.2882, test_loss: 1.2074, test_f1: 0.6604
 epoch: 58, train_loss: 0.2762, test_loss: 1.1869, test_f1: 0.6671
 epoch: 59, train_loss: 0.2761, test_loss: 1.0368, test_f1: 0.6908
 epoch: 60, train_loss: 0.2611, test_loss: 1.1014, test_f1: 0.6690
 epoch: 61, train_loss: 0.2536, test_loss: 1.1472, test_f1: 0.6794
 epoch: 62, train_loss: 0.2856, test_loss: 1.2552, test_f1: 0.6441
 epoch: 63, train_loss: 0.2426, test_loss: 1.3028, test_f1: 0.6854
 epoch: 64, train_loss: 0.2602, test_loss: 1.3284, test_f1: 0.6792
 epoch: 65, train_loss: 0.2605, test_loss: 1.3533, test_f1: 0.6664
 epoch: 66, train_loss: 0.2473, test_loss: 1.3805, test_f1: 0.6875
 epoch: 67, train_loss: 0.2455, test_loss: 1.2605, test_f1: 0.6869
 epoch: 68, train_loss: 0.2382, test_loss: 1.4208, test_f1: 0.6828
 epoch: 69, train_loss: 0.2330, test_loss: 1.5291, test_f1: 0.6646
 epoch: 70, train_loss: 0.2392, test_loss: 1.3990, test_f1: 0.6519
 epoch: 71, train_loss: 0.2465, test_loss: 1.4272, test_f1: 0.6639
 epoch: 72, train_loss: 0.2383, test_loss: 1.3762, test_f1: 0.6696
 epoch: 73, train_loss: 0.2279, test_loss: 1.3022, test_f1: 0.6767
 epoch: 74, train_loss: 0.2228, test_loss: 1.2466, test_f1: 0.6545
 epoch: 75, train_loss: 0.2370, test_loss: 1.5039, test_f1: 0.6658
 epoch: 76, train_loss: 0.2212, test_loss: 1.3435, test_f1: 0.6777
 epoch: 77, train_loss: 0.2223, test_loss: 1.4148, test_f1: 0.6696
 epoch: 78, train_loss: 0.2098, test_loss: 1.2680, test_f1: 0.6771
 epoch: 79, train_loss: 0.2177, test_loss: 1.3022, test_f1: 0.6939
 epoch: 80, train_loss: 0.2163, test_loss: 1.4182, test_f1: 0.6601
 epoch: 81, train_loss: 0.2098, test_loss: 1.3234, test_f1: 0.6807
 epoch: 82, train_loss: 0.2109, test_loss: 1.4775, test_f1: 0.6799
 epoch: 83, train_loss: 0.1988, test_loss: 1.4159, test_f1: 0.6756
 epoch: 84, train_loss: 0.1979, test_loss: 1.4890, test_f1: 0.6896
 epoch: 85, train_loss: 0.1910, test_loss: 1.4956, test_f1: 0.6855
 epoch: 86, train_loss: 0.1825, test_loss: 1.6564, test_f1: 0.6705
 epoch: 87, train_loss: 0.1908, test_loss: 1.4437, test_f1: 0.6816
 epoch: 88, train_loss: 0.1895, test_loss: 1.4339, test_f1: 0.6786
 epoch: 89, train_loss: 0.1964, test_loss: 1.4767, test_f1: 0.6653
 epoch: 90, train_loss: 0.2000, test_loss: 1.5631, test_f1: 0.6621
 epoch: 91, train_loss: 0.1975, test_loss: 1.4881, test_f1: 0.6666
 epoch: 92, train_loss: 0.1988, test_loss: 1.4017, test_f1: 0.6634
 epoch: 93, train_loss: 0.1820, test_loss: 1.7146, test_f1: 0.6400
 epoch: 94, train_loss: 0.1650, test_loss: 1.5311, test_f1: 0.6655
 epoch: 95, train_loss: 0.1718, test_loss: 1.6603, test_f1: 0.6709
 epoch: 96, train_loss: 0.1739, test_loss: 1.6556, test_f1: 0.6636
 epoch: 97, train_loss: 0.1828, test_loss: 1.7901, test_f1: 0.6815
 epoch: 98, train_loss: 0.1812, test_loss: 1.7376, test_f1: 0.6793
 epoch: 99, train_loss: 0.1818, test_loss: 1.7168, test_f1: 0.6363
##################ITERATION #2 ****************************************
 epoch: 0, train_loss: 1.1552, test_loss: 0.9875, test_f1: 0.5216
 epoch: 1, train_loss: 0.9725, test_loss: 0.8824, test_f1: 0.5424
 epoch: 2, train_loss: 0.9216, test_loss: 0.9084, test_f1: 0.5665
 epoch: 3, train_loss: 0.8945, test_loss: 0.8553, test_f1: 0.5585
 epoch: 4, train_loss: 0.8721, test_loss: 0.8334, test_f1: 0.5794
 epoch: 5, train_loss: 0.8384, test_loss: 0.8770, test_f1: 0.6011
 epoch: 6, train_loss: 0.8109, test_loss: 0.8168, test_f1: 0.5921
 epoch: 7, train_loss: 0.7824, test_loss: 0.7374, test_f1: 0.6137
 epoch: 8, train_loss: 0.7765, test_loss: 0.7907, test_f1: 0.6380
 epoch: 9, train_loss: 0.7536, test_loss: 0.7115, test_f1: 0.6718
 epoch: 10, train_loss: 0.7367, test_loss: 0.7157, test_f1: 0.6565
 epoch: 11, train_loss: 0.7245, test_loss: 0.7216, test_f1: 0.6607
 epoch: 12, train_loss: 0.6980, test_loss: 0.7083, test_f1: 0.6858
 epoch: 13, train_loss: 0.6940, test_loss: 0.7143, test_f1: 0.6479
 epoch: 14, train_loss: 0.6790, test_loss: 0.6791, test_f1: 0.6956
 epoch: 15, train_loss: 0.6648, test_loss: 0.6917, test_f1: 0.6820
 epoch: 16, train_loss: 0.6504, test_loss: 0.7333, test_f1: 0.6684
 epoch: 17, train_loss: 0.6482, test_loss: 0.7230, test_f1: 0.6835
 epoch: 18, train_loss: 0.6331, test_loss: 0.7313, test_f1: 0.6794
 epoch: 19, train_loss: 0.6247, test_loss: 0.6508, test_f1: 0.6957
 epoch: 20, train_loss: 0.6127, test_loss: 0.6543, test_f1: 0.6809
 epoch: 21, train_loss: 0.5972, test_loss: 0.6757, test_f1: 0.6920
 epoch: 22, train_loss: 0.5905, test_loss: 0.6953, test_f1: 0.6709
 epoch: 23, train_loss: 0.5938, test_loss: 0.7517, test_f1: 0.6489
 epoch: 24, train_loss: 0.5510, test_loss: 0.7926, test_f1: 0.6555
 epoch: 25, train_loss: 0.5743, test_loss: 0.7394, test_f1: 0.6830
 epoch: 26, train_loss: 0.5538, test_loss: 0.6808, test_f1: 0.6883
 epoch: 27, train_loss: 0.5403, test_loss: 0.9428, test_f1: 0.6226
 epoch: 28, train_loss: 0.5420, test_loss: 0.7025, test_f1: 0.6882
 epoch: 29, train_loss: 0.5268, test_loss: 0.7620, test_f1: 0.6753
 epoch: 30, train_loss: 0.4913, test_loss: 0.7763, test_f1: 0.6681
 epoch: 31, train_loss: 0.5003, test_loss: 0.7362, test_f1: 0.6603
 epoch: 32, train_loss: 0.4949, test_loss: 0.7327, test_f1: 0.6757
 epoch: 33, train_loss: 0.4902, test_loss: 0.7806, test_f1: 0.6738
 epoch: 34, train_loss: 0.4918, test_loss: 0.9332, test_f1: 0.6732
 epoch: 35, train_loss: 0.4945, test_loss: 0.8338, test_f1: 0.6674
 epoch: 36, train_loss: 0.4615, test_loss: 0.8372, test_f1: 0.6789
 epoch: 37, train_loss: 0.4667, test_loss: 0.7344, test_f1: 0.6863
 epoch: 38, train_loss: 0.4509, test_loss: 0.7312, test_f1: 0.6720
 epoch: 39, train_loss: 0.4717, test_loss: 0.8635, test_f1: 0.6827
 epoch: 40, train_loss: 0.4420, test_loss: 0.9485, test_f1: 0.6644
 epoch: 41, train_loss: 0.4621, test_loss: 0.8405, test_f1: 0.6825
 epoch: 42, train_loss: 0.4283, test_loss: 0.9104, test_f1: 0.6799
 epoch: 43, train_loss: 0.4062, test_loss: 0.8996, test_f1: 0.6610
 epoch: 44, train_loss: 0.4111, test_loss: 0.9371, test_f1: 0.6820
 epoch: 45, train_loss: 0.4035, test_loss: 0.8240, test_f1: 0.6911
 epoch: 46, train_loss: 0.3956, test_loss: 0.9756, test_f1: 0.6676
 epoch: 47, train_loss: 0.4016, test_loss: 0.8225, test_f1: 0.6757
 epoch: 48, train_loss: 0.4013, test_loss: 0.8323, test_f1: 0.6745
 epoch: 49, train_loss: 0.3816, test_loss: 1.0053, test_f1: 0.6536
 epoch: 50, train_loss: 0.3851, test_loss: 0.9925, test_f1: 0.6794
 epoch: 51, train_loss: 0.3387, test_loss: 1.0049, test_f1: 0.6812
 epoch: 52, train_loss: 0.3089, test_loss: 1.0943, test_f1: 0.6818
 epoch: 53, train_loss: 0.2956, test_loss: 0.9767, test_f1: 0.6777
 epoch: 54, train_loss: 0.2889, test_loss: 1.0338, test_f1: 0.6925
 epoch: 55, train_loss: 0.2805, test_loss: 1.0877, test_f1: 0.7198
 epoch: 56, train_loss: 0.2824, test_loss: 1.1039, test_f1: 0.6838
 epoch: 57, train_loss: 0.2683, test_loss: 1.0491, test_f1: 0.6788
 epoch: 58, train_loss: 0.2797, test_loss: 1.0489, test_f1: 0.6835
 epoch: 59, train_loss: 0.2733, test_loss: 1.1829, test_f1: 0.6722
 epoch: 60, train_loss: 0.2650, test_loss: 1.0047, test_f1: 0.6862
 epoch: 61, train_loss: 0.2428, test_loss: 1.1094, test_f1: 0.7001
 epoch: 62, train_loss: 0.2506, test_loss: 1.0477, test_f1: 0.6711
 epoch: 63, train_loss: 0.2459, test_loss: 1.0755, test_f1: 0.6670
 epoch: 64, train_loss: 0.2627, test_loss: 1.1416, test_f1: 0.6663
 epoch: 65, train_loss: 0.2490, test_loss: 1.1094, test_f1: 0.6770
 epoch: 66, train_loss: 0.2338, test_loss: 1.0129, test_f1: 0.7052
 epoch: 67, train_loss: 0.2627, test_loss: 1.1903, test_f1: 0.6829
 epoch: 68, train_loss: 0.2440, test_loss: 1.1109, test_f1: 0.6902
 epoch: 69, train_loss: 0.2442, test_loss: 1.0664, test_f1: 0.6840
 epoch: 70, train_loss: 0.2340, test_loss: 1.0808, test_f1: 0.6826
 epoch: 71, train_loss: 0.2355, test_loss: 1.2767, test_f1: 0.6905
 epoch: 72, train_loss: 0.2311, test_loss: 1.2230, test_f1: 0.6811
 epoch: 73, train_loss: 0.2102, test_loss: 1.1543, test_f1: 0.6995
 epoch: 74, train_loss: 0.2155, test_loss: 1.2781, test_f1: 0.6894
 epoch: 75, train_loss: 0.2126, test_loss: 1.2737, test_f1: 0.6874
 epoch: 76, train_loss: 0.2094, test_loss: 1.4350, test_f1: 0.6767
 epoch: 77, train_loss: 0.2065, test_loss: 1.2876, test_f1: 0.6788
 epoch: 78, train_loss: 0.2176, test_loss: 1.4149, test_f1: 0.6537
 epoch: 79, train_loss: 0.2147, test_loss: 1.3157, test_f1: 0.6741
 epoch: 80, train_loss: 0.1908, test_loss: 1.4122, test_f1: 0.6959
 epoch: 81, train_loss: 0.2048, test_loss: 1.4368, test_f1: 0.6598
 epoch: 82, train_loss: 0.1840, test_loss: 1.4580, test_f1: 0.6989
 epoch: 83, train_loss: 0.2036, test_loss: 1.3587, test_f1: 0.6694
 epoch: 84, train_loss: 0.1876, test_loss: 1.4254, test_f1: 0.6914
 epoch: 85, train_loss: 0.1973, test_loss: 1.3883, test_f1: 0.6736
 epoch: 86, train_loss: 0.1817, test_loss: 1.4868, test_f1: 0.6689
 epoch: 87, train_loss: 0.1871, test_loss: 1.3401, test_f1: 0.6909
 epoch: 88, train_loss: 0.1974, test_loss: 1.3587, test_f1: 0.6952
 epoch: 89, train_loss: 0.2376, test_loss: 1.5308, test_f1: 0.6778
 epoch: 90, train_loss: 0.1974, test_loss: 1.6284, test_f1: 0.6672
 epoch: 91, train_loss: 0.1948, test_loss: 1.5877, test_f1: 0.6786
 epoch: 92, train_loss: 0.2167, test_loss: 1.4331, test_f1: 0.6863
 epoch: 93, train_loss: 0.1765, test_loss: 1.3674, test_f1: 0.6842
 epoch: 94, train_loss: 0.1714, test_loss: 1.4123, test_f1: 0.7195
 epoch: 95, train_loss: 0.1958, test_loss: 1.4745, test_f1: 0.6807
 epoch: 96, train_loss: 0.1800, test_loss: 1.5713, test_f1: 0.6788
 epoch: 97, train_loss: 0.1736, test_loss: 1.4959, test_f1: 0.6795
 epoch: 98, train_loss: 0.1753, test_loss: 1.4558, test_f1: 0.6757
 epoch: 99, train_loss: 0.1611, test_loss: 1.6178, test_f1: 0.6843
##################ITERATION #3 ****************************************
 epoch: 0, train_loss: 1.1698, test_loss: 1.0328, test_f1: 0.4861
 epoch: 1, train_loss: 0.9703, test_loss: 0.8980, test_f1: 0.5534
 epoch: 2, train_loss: 0.9268, test_loss: 0.8677, test_f1: 0.5228
 epoch: 3, train_loss: 0.8969, test_loss: 0.8631, test_f1: 0.5903
 epoch: 4, train_loss: 0.8775, test_loss: 0.8502, test_f1: 0.5667
 epoch: 5, train_loss: 0.8404, test_loss: 0.8225, test_f1: 0.5691
 epoch: 6, train_loss: 0.8277, test_loss: 0.7477, test_f1: 0.6696
 epoch: 7, train_loss: 0.8040, test_loss: 0.7628, test_f1: 0.6245
 epoch: 8, train_loss: 0.7831, test_loss: 0.7948, test_f1: 0.6305
 epoch: 9, train_loss: 0.7584, test_loss: 0.7615, test_f1: 0.6535
 epoch: 10, train_loss: 0.7496, test_loss: 0.7472, test_f1: 0.6238
 epoch: 11, train_loss: 0.7523, test_loss: 0.8120, test_f1: 0.6123
 epoch: 12, train_loss: 0.7348, test_loss: 0.7691, test_f1: 0.6406
 epoch: 13, train_loss: 0.7128, test_loss: 0.8446, test_f1: 0.6205
 epoch: 14, train_loss: 0.7048, test_loss: 0.7554, test_f1: 0.6541
 epoch: 15, train_loss: 0.6860, test_loss: 0.7166, test_f1: 0.6703
 epoch: 16, train_loss: 0.7110, test_loss: 0.7207, test_f1: 0.6762
 epoch: 17, train_loss: 0.6568, test_loss: 0.7700, test_f1: 0.6625
 epoch: 18, train_loss: 0.6520, test_loss: 0.7557, test_f1: 0.6549
 epoch: 19, train_loss: 0.6397, test_loss: 0.7498, test_f1: 0.6427
 epoch: 20, train_loss: 0.6315, test_loss: 0.7851, test_f1: 0.6706
 epoch: 21, train_loss: 0.6108, test_loss: 0.7961, test_f1: 0.6674
 epoch: 22, train_loss: 0.6038, test_loss: 0.7389, test_f1: 0.6550
 epoch: 23, train_loss: 0.5937, test_loss: 0.7574, test_f1: 0.6573
 epoch: 24, train_loss: 0.6115, test_loss: 0.6711, test_f1: 0.6697
 epoch: 25, train_loss: 0.5779, test_loss: 0.7515, test_f1: 0.6646
 epoch: 26, train_loss: 0.5720, test_loss: 0.7867, test_f1: 0.7086
 epoch: 27, train_loss: 0.5558, test_loss: 0.8587, test_f1: 0.6448
 epoch: 28, train_loss: 0.5769, test_loss: 0.8389, test_f1: 0.6423
 epoch: 29, train_loss: 0.5317, test_loss: 0.7255, test_f1: 0.6703
 epoch: 30, train_loss: 0.5372, test_loss: 0.8222, test_f1: 0.6901
 epoch: 31, train_loss: 0.5279, test_loss: 0.6982, test_f1: 0.6899
 epoch: 32, train_loss: 0.5243, test_loss: 0.7400, test_f1: 0.6616
 epoch: 33, train_loss: 0.4835, test_loss: 0.6961, test_f1: 0.7060
 epoch: 34, train_loss: 0.4963, test_loss: 0.7471, test_f1: 0.6611
 epoch: 35, train_loss: 0.4574, test_loss: 0.8489, test_f1: 0.6781
 epoch: 36, train_loss: 0.4696, test_loss: 0.9609, test_f1: 0.6588
 epoch: 37, train_loss: 0.4978, test_loss: 0.7721, test_f1: 0.6707
 epoch: 38, train_loss: 0.4828, test_loss: 0.9442, test_f1: 0.6745
 epoch: 39, train_loss: 0.4585, test_loss: 0.7885, test_f1: 0.6710
 epoch: 40, train_loss: 0.4594, test_loss: 0.8068, test_f1: 0.6682
 epoch: 41, train_loss: 0.4880, test_loss: 0.8987, test_f1: 0.6742
 epoch: 42, train_loss: 0.4242, test_loss: 0.9315, test_f1: 0.6706
 epoch: 43, train_loss: 0.4723, test_loss: 0.9994, test_f1: 0.6750
 epoch: 44, train_loss: 0.4459, test_loss: 1.0045, test_f1: 0.6703
 epoch: 45, train_loss: 0.4313, test_loss: 1.0501, test_f1: 0.6730
 epoch: 46, train_loss: 0.4204, test_loss: 0.9796, test_f1: 0.6925
 epoch: 47, train_loss: 0.4316, test_loss: 0.8426, test_f1: 0.6845
 epoch: 48, train_loss: 0.4038, test_loss: 0.9458, test_f1: 0.7005
 epoch: 49, train_loss: 0.4165, test_loss: 0.8661, test_f1: 0.6850
 epoch: 50, train_loss: 0.4059, test_loss: 0.9214, test_f1: 0.7275
 epoch: 51, train_loss: 0.3561, test_loss: 1.0612, test_f1: 0.6898
 epoch: 52, train_loss: 0.3288, test_loss: 1.1807, test_f1: 0.6868
 epoch: 53, train_loss: 0.3165, test_loss: 1.0702, test_f1: 0.6849
 epoch: 54, train_loss: 0.3059, test_loss: 1.0582, test_f1: 0.6735
 epoch: 55, train_loss: 0.3055, test_loss: 0.9542, test_f1: 0.7108
 epoch: 56, train_loss: 0.3092, test_loss: 1.1334, test_f1: 0.6705
 epoch: 57, train_loss: 0.3155, test_loss: 1.0722, test_f1: 0.6857
 epoch: 58, train_loss: 0.2980, test_loss: 1.2852, test_f1: 0.7009
 epoch: 59, train_loss: 0.2980, test_loss: 1.1573, test_f1: 0.6732
 epoch: 60, train_loss: 0.2716, test_loss: 1.3735, test_f1: 0.6761
 epoch: 61, train_loss: 0.2595, test_loss: 1.3023, test_f1: 0.6610
 epoch: 62, train_loss: 0.2659, test_loss: 1.3328, test_f1: 0.6870
 epoch: 63, train_loss: 0.2738, test_loss: 1.2287, test_f1: 0.6871
 epoch: 64, train_loss: 0.2552, test_loss: 1.3653, test_f1: 0.6815
 epoch: 65, train_loss: 0.2773, test_loss: 1.2265, test_f1: 0.6705
 epoch: 66, train_loss: 0.2491, test_loss: 1.1317, test_f1: 0.6975
 epoch: 67, train_loss: 0.2631, test_loss: 1.3893, test_f1: 0.6718
 epoch: 68, train_loss: 0.2391, test_loss: 1.4202, test_f1: 0.6697
 epoch: 69, train_loss: 0.2505, test_loss: 1.4236, test_f1: 0.6732
 epoch: 70, train_loss: 0.2337, test_loss: 1.4303, test_f1: 0.6839
 epoch: 71, train_loss: 0.2348, test_loss: 1.3410, test_f1: 0.6648
 epoch: 72, train_loss: 0.2212, test_loss: 1.2862, test_f1: 0.7096
 epoch: 73, train_loss: 0.2380, test_loss: 1.3849, test_f1: 0.6792
 epoch: 74, train_loss: 0.2412, test_loss: 1.4815, test_f1: 0.6773
 epoch: 75, train_loss: 0.2376, test_loss: 1.4582, test_f1: 0.6837
 epoch: 76, train_loss: 0.2391, test_loss: 1.2414, test_f1: 0.7173
 epoch: 77, train_loss: 0.2292, test_loss: 1.4823, test_f1: 0.6925
 epoch: 78, train_loss: 0.2142, test_loss: 1.4710, test_f1: 0.6726
 epoch: 79, train_loss: 0.2158, test_loss: 1.4646, test_f1: 0.7032
 epoch: 80, train_loss: 0.2231, test_loss: 1.3724, test_f1: 0.6900
 epoch: 81, train_loss: 0.2050, test_loss: 1.5045, test_f1: 0.6644
 epoch: 82, train_loss: 0.1903, test_loss: 1.5871, test_f1: 0.6817
 epoch: 83, train_loss: 0.2111, test_loss: 1.4585, test_f1: 0.6729
 epoch: 84, train_loss: 0.2158, test_loss: 1.5424, test_f1: 0.6718
 epoch: 85, train_loss: 0.1988, test_loss: 1.3583, test_f1: 0.6828
 epoch: 86, train_loss: 0.2186, test_loss: 1.4493, test_f1: 0.6678
 epoch: 87, train_loss: 0.2101, test_loss: 1.6003, test_f1: 0.6850
 epoch: 88, train_loss: 0.2030, test_loss: 1.6719, test_f1: 0.6806
 epoch: 89, train_loss: 0.1897, test_loss: 1.5501, test_f1: 0.6729
 epoch: 90, train_loss: 0.1909, test_loss: 1.5919, test_f1: 0.6793
 epoch: 91, train_loss: 0.1918, test_loss: 1.5502, test_f1: 0.6831
 epoch: 92, train_loss: 0.1768, test_loss: 1.5436, test_f1: 0.6803
 epoch: 93, train_loss: 0.1854, test_loss: 1.5008, test_f1: 0.6807
 epoch: 94, train_loss: 0.1785, test_loss: 1.8102, test_f1: 0.6689
 epoch: 95, train_loss: 0.1964, test_loss: 1.4198, test_f1: 0.6801
 epoch: 96, train_loss: 0.1861, test_loss: 1.6457, test_f1: 0.6674
 epoch: 97, train_loss: 0.1852, test_loss: 1.6830, test_f1: 0.6676
 epoch: 98, train_loss: 0.1660, test_loss: 1.3975, test_f1: 0.7006
 epoch: 99, train_loss: 0.1787, test_loss: 1.4944, test_f1: 0.6858
##################ITERATION #4 ****************************************
 epoch: 0, train_loss: 1.1922, test_loss: 0.9502, test_f1: 0.5173
 epoch: 1, train_loss: 0.9689, test_loss: 0.9100, test_f1: 0.5180
 epoch: 2, train_loss: 0.9422, test_loss: 0.9069, test_f1: 0.5226
 epoch: 3, train_loss: 0.9107, test_loss: 0.9760, test_f1: 0.4661
 epoch: 4, train_loss: 0.8977, test_loss: 0.9039, test_f1: 0.5352
 epoch: 5, train_loss: 0.8698, test_loss: 0.8483, test_f1: 0.5571
 epoch: 6, train_loss: 0.8537, test_loss: 0.8333, test_f1: 0.5583
 epoch: 7, train_loss: 0.8333, test_loss: 0.8876, test_f1: 0.5811
 epoch: 8, train_loss: 0.8074, test_loss: 0.7757, test_f1: 0.6030
 epoch: 9, train_loss: 0.8046, test_loss: 0.7648, test_f1: 0.6179
 epoch: 10, train_loss: 0.7791, test_loss: 0.7610, test_f1: 0.5859
 epoch: 11, train_loss: 0.7533, test_loss: 0.8117, test_f1: 0.5986
 epoch: 12, train_loss: 0.7542, test_loss: 0.6803, test_f1: 0.6740
 epoch: 13, train_loss: 0.7218, test_loss: 0.7116, test_f1: 0.6647
 epoch: 14, train_loss: 0.7121, test_loss: 0.7690, test_f1: 0.6478
 epoch: 15, train_loss: 0.7088, test_loss: 0.7490, test_f1: 0.6268
 epoch: 16, train_loss: 0.6790, test_loss: 0.6979, test_f1: 0.6818
 epoch: 17, train_loss: 0.7003, test_loss: 0.7321, test_f1: 0.6705
 epoch: 18, train_loss: 0.6639, test_loss: 0.6967, test_f1: 0.6662
 epoch: 19, train_loss: 0.6590, test_loss: 0.7401, test_f1: 0.6474
 epoch: 20, train_loss: 0.6413, test_loss: 0.7248, test_f1: 0.6484
 epoch: 21, train_loss: 0.6249, test_loss: 0.7916, test_f1: 0.6404
 epoch: 22, train_loss: 0.6241, test_loss: 0.8732, test_f1: 0.6505
 epoch: 23, train_loss: 0.6205, test_loss: 0.7486, test_f1: 0.6798
 epoch: 24, train_loss: 0.5830, test_loss: 0.7981, test_f1: 0.6668
 epoch: 25, train_loss: 0.6114, test_loss: 0.7660, test_f1: 0.6680
 epoch: 26, train_loss: 0.5797, test_loss: 0.8000, test_f1: 0.6694
 epoch: 27, train_loss: 0.5599, test_loss: 0.7920, test_f1: 0.6466
 epoch: 28, train_loss: 0.5364, test_loss: 0.8185, test_f1: 0.6411
 epoch: 29, train_loss: 0.5581, test_loss: 0.7810, test_f1: 0.6832
 epoch: 30, train_loss: 0.5513, test_loss: 0.7507, test_f1: 0.6695
 epoch: 31, train_loss: 0.5318, test_loss: 0.8755, test_f1: 0.6560
 epoch: 32, train_loss: 0.5439, test_loss: 0.8937, test_f1: 0.6433
 epoch: 33, train_loss: 0.5181, test_loss: 0.8791, test_f1: 0.6754
 epoch: 34, train_loss: 0.5046, test_loss: 0.8489, test_f1: 0.6315
 epoch: 35, train_loss: 0.5056, test_loss: 0.8259, test_f1: 0.6658
 epoch: 36, train_loss: 0.4978, test_loss: 0.9235, test_f1: 0.6712
 epoch: 37, train_loss: 0.4873, test_loss: 0.9340, test_f1: 0.6445
 epoch: 38, train_loss: 0.4888, test_loss: 0.8626, test_f1: 0.6773
 epoch: 39, train_loss: 0.4861, test_loss: 0.8527, test_f1: 0.6687
 epoch: 40, train_loss: 0.4549, test_loss: 0.8904, test_f1: 0.6561
 epoch: 41, train_loss: 0.4329, test_loss: 0.8098, test_f1: 0.6986
 epoch: 42, train_loss: 0.4488, test_loss: 0.8767, test_f1: 0.6599
 epoch: 43, train_loss: 0.4340, test_loss: 0.8856, test_f1: 0.6843
 epoch: 44, train_loss: 0.4537, test_loss: 0.8136, test_f1: 0.6657
 epoch: 45, train_loss: 0.4489, test_loss: 0.9006, test_f1: 0.6626
 epoch: 46, train_loss: 0.4257, test_loss: 1.0347, test_f1: 0.6600
 epoch: 47, train_loss: 0.4173, test_loss: 0.9800, test_f1: 0.6775
 epoch: 48, train_loss: 0.4226, test_loss: 0.9457, test_f1: 0.6932
 epoch: 49, train_loss: 0.4233, test_loss: 0.9712, test_f1: 0.6980
 epoch: 50, train_loss: 0.4145, test_loss: 0.8873, test_f1: 0.6947
 epoch: 51, train_loss: 0.3696, test_loss: 0.9866, test_f1: 0.7048
 epoch: 52, train_loss: 0.3516, test_loss: 1.0684, test_f1: 0.6801
 epoch: 53, train_loss: 0.3428, test_loss: 1.0795, test_f1: 0.6811
 epoch: 54, train_loss: 0.3323, test_loss: 1.0990, test_f1: 0.6750
 epoch: 55, train_loss: 0.3041, test_loss: 1.0524, test_f1: 0.6765
 epoch: 56, train_loss: 0.2882, test_loss: 1.1658, test_f1: 0.6913
 epoch: 57, train_loss: 0.3048, test_loss: 1.1456, test_f1: 0.6962
 epoch: 58, train_loss: 0.2752, test_loss: 1.0354, test_f1: 0.6775
 epoch: 59, train_loss: 0.2952, test_loss: 1.1338, test_f1: 0.6828
 epoch: 60, train_loss: 0.2801, test_loss: 1.2731, test_f1: 0.6767
 epoch: 61, train_loss: 0.2850, test_loss: 1.3592, test_f1: 0.6689
 epoch: 62, train_loss: 0.2863, test_loss: 1.1282, test_f1: 0.6862
 epoch: 63, train_loss: 0.2746, test_loss: 1.1560, test_f1: 0.6921
 epoch: 64, train_loss: 0.2625, test_loss: 1.2991, test_f1: 0.6789
 epoch: 65, train_loss: 0.2689, test_loss: 1.1312, test_f1: 0.6816
 epoch: 66, train_loss: 0.2775, test_loss: 1.2077, test_f1: 0.6788
 epoch: 67, train_loss: 0.2661, test_loss: 1.1870, test_f1: 0.6872
 epoch: 68, train_loss: 0.2394, test_loss: 1.2327, test_f1: 0.6851
 epoch: 69, train_loss: 0.2524, test_loss: 1.4757, test_f1: 0.6678
 epoch: 70, train_loss: 0.2556, test_loss: 1.3327, test_f1: 0.6798
 epoch: 71, train_loss: 0.2586, test_loss: 1.2856, test_f1: 0.6784
 epoch: 72, train_loss: 0.2339, test_loss: 1.3642, test_f1: 0.6814
 epoch: 73, train_loss: 0.2465, test_loss: 1.2236, test_f1: 0.6752
 epoch: 74, train_loss: 0.2483, test_loss: 1.4104, test_f1: 0.6705
 epoch: 75, train_loss: 0.2478, test_loss: 1.3701, test_f1: 0.6862
 epoch: 76, train_loss: 0.2349, test_loss: 1.4097, test_f1: 0.6670
 epoch: 77, train_loss: 0.2342, test_loss: 1.3127, test_f1: 0.6816
 epoch: 78, train_loss: 0.2307, test_loss: 1.3679, test_f1: 0.6716
 epoch: 79, train_loss: 0.2161, test_loss: 1.4072, test_f1: 0.6624
 epoch: 80, train_loss: 0.2173, test_loss: 1.5195, test_f1: 0.6709
 epoch: 81, train_loss: 0.2164, test_loss: 1.4432, test_f1: 0.6635
 epoch: 82, train_loss: 0.1990, test_loss: 1.6041, test_f1: 0.6789
 epoch: 83, train_loss: 0.2188, test_loss: 1.6169, test_f1: 0.6708
 epoch: 84, train_loss: 0.2276, test_loss: 1.5313, test_f1: 0.6860
 epoch: 85, train_loss: 0.2183, test_loss: 1.5055, test_f1: 0.6741
 epoch: 86, train_loss: 0.2141, test_loss: 1.5565, test_f1: 0.6732
 epoch: 87, train_loss: 0.2097, test_loss: 1.2352, test_f1: 0.6807
 epoch: 88, train_loss: 0.2204, test_loss: 1.2772, test_f1: 0.6821
 epoch: 89, train_loss: 0.2178, test_loss: 1.5052, test_f1: 0.6698
 epoch: 90, train_loss: 0.2163, test_loss: 1.3277, test_f1: 0.6734
 epoch: 91, train_loss: 0.2017, test_loss: 1.5872, test_f1: 0.6761
 epoch: 92, train_loss: 0.1989, test_loss: 1.6589, test_f1: 0.6763
 epoch: 93, train_loss: 0.2141, test_loss: 1.5273, test_f1: 0.6838
 epoch: 94, train_loss: 0.1909, test_loss: 1.6092, test_f1: 0.6763
 epoch: 95, train_loss: 0.1807, test_loss: 1.6507, test_f1: 0.6606
 epoch: 96, train_loss: 0.1768, test_loss: 1.6378, test_f1: 0.6799
 epoch: 97, train_loss: 0.1976, test_loss: 1.5971, test_f1: 0.6696
 epoch: 98, train_loss: 0.1881, test_loss: 1.7412, test_f1: 0.6716
 epoch: 99, train_loss: 0.1799, test_loss: 1.6182, test_f1: 0.6901
##################ITERATION #5 ****************************************
 epoch: 0, train_loss: 1.2104, test_loss: 0.9804, test_f1: 0.4943
 epoch: 1, train_loss: 0.9627, test_loss: 0.9889, test_f1: 0.5556
 epoch: 2, train_loss: 0.9311, test_loss: 0.9497, test_f1: 0.5428
 epoch: 3, train_loss: 0.9161, test_loss: 0.8972, test_f1: 0.5447
 epoch: 4, train_loss: 0.8753, test_loss: 0.9021, test_f1: 0.5552
 epoch: 5, train_loss: 0.8538, test_loss: 0.8341, test_f1: 0.6067
 epoch: 6, train_loss: 0.8233, test_loss: 0.7909, test_f1: 0.5980
 epoch: 7, train_loss: 0.7946, test_loss: 0.8135, test_f1: 0.5781
 epoch: 8, train_loss: 0.7864, test_loss: 0.8777, test_f1: 0.5763
 epoch: 9, train_loss: 0.7746, test_loss: 0.7990, test_f1: 0.6000
 epoch: 10, train_loss: 0.7574, test_loss: 0.7715, test_f1: 0.6415
 epoch: 11, train_loss: 0.7220, test_loss: 0.7289, test_f1: 0.6342
 epoch: 12, train_loss: 0.7104, test_loss: 0.7529, test_f1: 0.6444
 epoch: 13, train_loss: 0.7314, test_loss: 0.7357, test_f1: 0.6481
 epoch: 14, train_loss: 0.6963, test_loss: 0.8649, test_f1: 0.5922
 epoch: 15, train_loss: 0.6933, test_loss: 0.7887, test_f1: 0.6446
 epoch: 16, train_loss: 0.6747, test_loss: 0.7506, test_f1: 0.6692
 epoch: 17, train_loss: 0.6696, test_loss: 0.7029, test_f1: 0.6522
 epoch: 18, train_loss: 0.6405, test_loss: 0.7414, test_f1: 0.6800
 epoch: 19, train_loss: 0.6369, test_loss: 0.7690, test_f1: 0.6380
 epoch: 20, train_loss: 0.6168, test_loss: 0.7344, test_f1: 0.6579
 epoch: 21, train_loss: 0.6088, test_loss: 0.7025, test_f1: 0.6703
 epoch: 22, train_loss: 0.6067, test_loss: 0.7768, test_f1: 0.6258
 epoch: 23, train_loss: 0.5969, test_loss: 0.6999, test_f1: 0.6775
 epoch: 24, train_loss: 0.6014, test_loss: 0.7527, test_f1: 0.6636
 epoch: 25, train_loss: 0.5894, test_loss: 0.7882, test_f1: 0.6575
 epoch: 26, train_loss: 0.5835, test_loss: 0.7409, test_f1: 0.6618
 epoch: 27, train_loss: 0.5719, test_loss: 0.7163, test_f1: 0.6659
 epoch: 28, train_loss: 0.5495, test_loss: 0.7150, test_f1: 0.6706
 epoch: 29, train_loss: 0.5674, test_loss: 0.7561, test_f1: 0.6431
 epoch: 30, train_loss: 0.5225, test_loss: 0.7479, test_f1: 0.6644
 epoch: 31, train_loss: 0.5204, test_loss: 0.7045, test_f1: 0.6798
 epoch: 32, train_loss: 0.5335, test_loss: 0.7242, test_f1: 0.6696
 epoch: 33, train_loss: 0.5179, test_loss: 0.8317, test_f1: 0.6645
 epoch: 34, train_loss: 0.5218, test_loss: 0.7567, test_f1: 0.6726
 epoch: 35, train_loss: 0.5096, test_loss: 0.6604, test_f1: 0.7208
 epoch: 36, train_loss: 0.5065, test_loss: 0.7665, test_f1: 0.6682
 epoch: 37, train_loss: 0.4529, test_loss: 0.7594, test_f1: 0.6814
 epoch: 38, train_loss: 0.4659, test_loss: 0.8161, test_f1: 0.6752
 epoch: 39, train_loss: 0.4655, test_loss: 0.7948, test_f1: 0.6779
 epoch: 40, train_loss: 0.4613, test_loss: 0.7305, test_f1: 0.6772
 epoch: 41, train_loss: 0.4540, test_loss: 0.7255, test_f1: 0.6903
 epoch: 42, train_loss: 0.4454, test_loss: 0.8296, test_f1: 0.6774
 epoch: 43, train_loss: 0.4199, test_loss: 0.8355, test_f1: 0.6719
 epoch: 44, train_loss: 0.4433, test_loss: 0.7401, test_f1: 0.6983
 epoch: 45, train_loss: 0.4713, test_loss: 0.7708, test_f1: 0.6889
 epoch: 46, train_loss: 0.4358, test_loss: 0.7834, test_f1: 0.6786
 epoch: 47, train_loss: 0.4328, test_loss: 0.8197, test_f1: 0.6821
 epoch: 48, train_loss: 0.4213, test_loss: 0.7803, test_f1: 0.6902
 epoch: 49, train_loss: 0.4067, test_loss: 0.7587, test_f1: 0.6888
 epoch: 50, train_loss: 0.3955, test_loss: 0.8359, test_f1: 0.6959
 epoch: 51, train_loss: 0.3571, test_loss: 0.8181, test_f1: 0.6798
 epoch: 52, train_loss: 0.3478, test_loss: 0.7905, test_f1: 0.6934
 epoch: 53, train_loss: 0.3231, test_loss: 0.8039, test_f1: 0.7056
 epoch: 54, train_loss: 0.3009, test_loss: 0.8875, test_f1: 0.6759
 epoch: 55, train_loss: 0.3174, test_loss: 0.7750, test_f1: 0.7079
 epoch: 56, train_loss: 0.2881, test_loss: 0.8878, test_f1: 0.6970
 epoch: 57, train_loss: 0.3145, test_loss: 0.9084, test_f1: 0.7008
 epoch: 58, train_loss: 0.3116, test_loss: 0.8975, test_f1: 0.6733
 epoch: 59, train_loss: 0.3075, test_loss: 0.9139, test_f1: 0.6767
 epoch: 60, train_loss: 0.2884, test_loss: 0.9897, test_f1: 0.6936
 epoch: 61, train_loss: 0.2816, test_loss: 1.1774, test_f1: 0.6763
 epoch: 62, train_loss: 0.2720, test_loss: 1.0119, test_f1: 0.6896
 epoch: 63, train_loss: 0.2691, test_loss: 1.0627, test_f1: 0.6815
 epoch: 64, train_loss: 0.2773, test_loss: 1.0282, test_f1: 0.6838
 epoch: 65, train_loss: 0.2816, test_loss: 1.0849, test_f1: 0.6984
 epoch: 66, train_loss: 0.2676, test_loss: 1.0506, test_f1: 0.6811
 epoch: 67, train_loss: 0.2657, test_loss: 0.9969, test_f1: 0.6728
 epoch: 68, train_loss: 0.2539, test_loss: 1.1458, test_f1: 0.6648
 epoch: 69, train_loss: 0.2466, test_loss: 1.1441, test_f1: 0.6876
 epoch: 70, train_loss: 0.2572, test_loss: 1.1476, test_f1: 0.6711
 epoch: 71, train_loss: 0.2482, test_loss: 1.0886, test_f1: 0.6866
 epoch: 72, train_loss: 0.2279, test_loss: 1.1190, test_f1: 0.6763
 epoch: 73, train_loss: 0.2648, test_loss: 1.1019, test_f1: 0.6803
 epoch: 74, train_loss: 0.2275, test_loss: 1.1288, test_f1: 0.6339
 epoch: 75, train_loss: 0.2470, test_loss: 1.1187, test_f1: 0.6853
 epoch: 76, train_loss: 0.2291, test_loss: 1.1386, test_f1: 0.6701
 epoch: 77, train_loss: 0.2233, test_loss: 1.2194, test_f1: 0.6874
 epoch: 78, train_loss: 0.2304, test_loss: 1.1827, test_f1: 0.6772
 epoch: 79, train_loss: 0.2160, test_loss: 1.2404, test_f1: 0.6811
 epoch: 80, train_loss: 0.2356, test_loss: 1.1849, test_f1: 0.6870
 epoch: 81, train_loss: 0.2168, test_loss: 1.1809, test_f1: 0.6755
 epoch: 82, train_loss: 0.2240, test_loss: 1.1699, test_f1: 0.6918
 epoch: 83, train_loss: 0.2146, test_loss: 1.1102, test_f1: 0.7075
 epoch: 84, train_loss: 0.2066, test_loss: 1.1504, test_f1: 0.6914
 epoch: 85, train_loss: 0.2092, test_loss: 1.1552, test_f1: 0.6949
 epoch: 86, train_loss: 0.2219, test_loss: 1.2711, test_f1: 0.6857
 epoch: 87, train_loss: 0.2305, test_loss: 1.0845, test_f1: 0.6896
 epoch: 88, train_loss: 0.2208, test_loss: 1.0933, test_f1: 0.6755
 epoch: 89, train_loss: 0.2009, test_loss: 1.1973, test_f1: 0.6681
 epoch: 90, train_loss: 0.2043, test_loss: 1.2138, test_f1: 0.6748
 epoch: 91, train_loss: 0.2048, test_loss: 1.2035, test_f1: 0.6631
 epoch: 92, train_loss: 0.2192, test_loss: 1.2262, test_f1: 0.6848
 epoch: 93, train_loss: 0.1919, test_loss: 1.2782, test_f1: 0.6827
 epoch: 94, train_loss: 0.1886, test_loss: 1.3298, test_f1: 0.6882
 epoch: 95, train_loss: 0.2130, test_loss: 1.3089, test_f1: 0.6674
 epoch: 96, train_loss: 0.2078, test_loss: 1.2577, test_f1: 0.6523
 epoch: 97, train_loss: 0.2209, test_loss: 1.1907, test_f1: 0.6648
 epoch: 98, train_loss: 0.1802, test_loss: 1.2328, test_f1: 0.6686
 epoch: 99, train_loss: 0.2082, test_loss: 1.2446, test_f1: 0.6775
##################ITERATION #6 ****************************************
 epoch: 0, train_loss: 1.1873, test_loss: 1.0024, test_f1: 0.4967
 epoch: 1, train_loss: 0.9669, test_loss: 0.9369, test_f1: 0.5238
 epoch: 2, train_loss: 0.9175, test_loss: 0.9179, test_f1: 0.5402
 epoch: 3, train_loss: 0.8987, test_loss: 0.8361, test_f1: 0.5773
 epoch: 4, train_loss: 0.8618, test_loss: 0.8551, test_f1: 0.5511
 epoch: 5, train_loss: 0.8461, test_loss: 0.9026, test_f1: 0.5211
 epoch: 6, train_loss: 0.8243, test_loss: 0.8141, test_f1: 0.5759
 epoch: 7, train_loss: 0.8075, test_loss: 0.8419, test_f1: 0.5867
 epoch: 8, train_loss: 0.7807, test_loss: 0.7960, test_f1: 0.6016
 epoch: 9, train_loss: 0.7693, test_loss: 0.7673, test_f1: 0.6210
 epoch: 10, train_loss: 0.7471, test_loss: 0.7650, test_f1: 0.6311
 epoch: 11, train_loss: 0.7495, test_loss: 0.8636, test_f1: 0.5955
 epoch: 12, train_loss: 0.7239, test_loss: 0.7801, test_f1: 0.6622
 epoch: 13, train_loss: 0.7284, test_loss: 0.7368, test_f1: 0.6474
 epoch: 14, train_loss: 0.7124, test_loss: 0.6969, test_f1: 0.6728
 epoch: 15, train_loss: 0.6792, test_loss: 0.7142, test_f1: 0.6475
 epoch: 16, train_loss: 0.6697, test_loss: 0.7843, test_f1: 0.6418
 epoch: 17, train_loss: 0.6742, test_loss: 0.7285, test_f1: 0.6524
 epoch: 18, train_loss: 0.6480, test_loss: 0.7420, test_f1: 0.6240
 epoch: 19, train_loss: 0.6314, test_loss: 0.7502, test_f1: 0.6471
 epoch: 20, train_loss: 0.6368, test_loss: 0.6915, test_f1: 0.6653
 epoch: 21, train_loss: 0.6181, test_loss: 0.7690, test_f1: 0.6193
 epoch: 22, train_loss: 0.5958, test_loss: 0.6962, test_f1: 0.7048
 epoch: 23, train_loss: 0.6066, test_loss: 0.7048, test_f1: 0.6591
 epoch: 24, train_loss: 0.5869, test_loss: 0.7447, test_f1: 0.6616
 epoch: 25, train_loss: 0.5878, test_loss: 0.7383, test_f1: 0.6760
 epoch: 26, train_loss: 0.5466, test_loss: 0.8139, test_f1: 0.6276
 epoch: 27, train_loss: 0.5570, test_loss: 0.7235, test_f1: 0.6704
 epoch: 28, train_loss: 0.5614, test_loss: 0.7596, test_f1: 0.6628
 epoch: 29, train_loss: 0.5504, test_loss: 0.7562, test_f1: 0.6594
 epoch: 30, train_loss: 0.5283, test_loss: 0.8106, test_f1: 0.6583
 epoch: 31, train_loss: 0.5425, test_loss: 0.7617, test_f1: 0.6405
 epoch: 32, train_loss: 0.5341, test_loss: 0.7116, test_f1: 0.7114
 epoch: 33, train_loss: 0.4983, test_loss: 0.6950, test_f1: 0.6717
 epoch: 34, train_loss: 0.5013, test_loss: 0.7860, test_f1: 0.6723
 epoch: 35, train_loss: 0.4962, test_loss: 0.6855, test_f1: 0.6914
 epoch: 36, train_loss: 0.5120, test_loss: 0.6707, test_f1: 0.7197
 epoch: 37, train_loss: 0.4772, test_loss: 0.8537, test_f1: 0.6791
 epoch: 38, train_loss: 0.4843, test_loss: 0.7965, test_f1: 0.6795
 epoch: 39, train_loss: 0.4500, test_loss: 0.8169, test_f1: 0.6691
 epoch: 40, train_loss: 0.4884, test_loss: 0.7269, test_f1: 0.6892
 epoch: 41, train_loss: 0.4632, test_loss: 0.7421, test_f1: 0.6834
 epoch: 42, train_loss: 0.4329, test_loss: 0.7459, test_f1: 0.6830
 epoch: 43, train_loss: 0.4462, test_loss: 0.7719, test_f1: 0.6703
 epoch: 44, train_loss: 0.4390, test_loss: 0.7830, test_f1: 0.7000
 epoch: 45, train_loss: 0.4231, test_loss: 0.8126, test_f1: 0.6684
 epoch: 46, train_loss: 0.4019, test_loss: 0.8621, test_f1: 0.6773
 epoch: 47, train_loss: 0.4328, test_loss: 0.7665, test_f1: 0.6927
 epoch: 48, train_loss: 0.4209, test_loss: 1.0192, test_f1: 0.6891
 epoch: 49, train_loss: 0.4233, test_loss: 0.8415, test_f1: 0.6924
 epoch: 50, train_loss: 0.3881, test_loss: 0.8622, test_f1: 0.6862
 epoch: 51, train_loss: 0.3445, test_loss: 0.9099, test_f1: 0.6931
 epoch: 52, train_loss: 0.3316, test_loss: 0.9383, test_f1: 0.6837
 epoch: 53, train_loss: 0.3267, test_loss: 0.9132, test_f1: 0.6704
 epoch: 54, train_loss: 0.3312, test_loss: 0.9378, test_f1: 0.6812
 epoch: 55, train_loss: 0.3183, test_loss: 0.9127, test_f1: 0.6949
 epoch: 56, train_loss: 0.3265, test_loss: 0.9202, test_f1: 0.6831
 epoch: 57, train_loss: 0.2865, test_loss: 0.9445, test_f1: 0.6784
 epoch: 58, train_loss: 0.3009, test_loss: 1.0953, test_f1: 0.6758
 epoch: 59, train_loss: 0.2915, test_loss: 1.0877, test_f1: 0.6829
 epoch: 60, train_loss: 0.2776, test_loss: 1.0517, test_f1: 0.6830
 epoch: 61, train_loss: 0.2922, test_loss: 1.0903, test_f1: 0.6765
 epoch: 62, train_loss: 0.2831, test_loss: 0.9520, test_f1: 0.7005
 epoch: 63, train_loss: 0.3132, test_loss: 0.9766, test_f1: 0.6886
 epoch: 64, train_loss: 0.2733, test_loss: 1.0188, test_f1: 0.6912
 epoch: 65, train_loss: 0.2704, test_loss: 1.0815, test_f1: 0.6725
 epoch: 66, train_loss: 0.2658, test_loss: 1.1318, test_f1: 0.6891
 epoch: 67, train_loss: 0.2739, test_loss: 1.0665, test_f1: 0.6872
 epoch: 68, train_loss: 0.2562, test_loss: 1.2251, test_f1: 0.6723
 epoch: 69, train_loss: 0.2618, test_loss: 1.0840, test_f1: 0.6867
 epoch: 70, train_loss: 0.2624, test_loss: 1.1543, test_f1: 0.6752
 epoch: 71, train_loss: 0.2629, test_loss: 1.3005, test_f1: 0.6603
 epoch: 72, train_loss: 0.2725, test_loss: 1.1904, test_f1: 0.6767
 epoch: 73, train_loss: 0.2481, test_loss: 1.2249, test_f1: 0.6824
 epoch: 74, train_loss: 0.2364, test_loss: 1.2741, test_f1: 0.6731
 epoch: 75, train_loss: 0.2308, test_loss: 1.2745, test_f1: 0.6698
 epoch: 76, train_loss: 0.2390, test_loss: 1.2385, test_f1: 0.6728
 epoch: 77, train_loss: 0.2599, test_loss: 1.3750, test_f1: 0.6671
 epoch: 78, train_loss: 0.2480, test_loss: 1.3681, test_f1: 0.6783
 epoch: 79, train_loss: 0.2476, test_loss: 1.1307, test_f1: 0.6896
 epoch: 80, train_loss: 0.2323, test_loss: 1.1329, test_f1: 0.6753
 epoch: 81, train_loss: 0.2305, test_loss: 1.2640, test_f1: 0.6826
 epoch: 82, train_loss: 0.2302, test_loss: 1.2875, test_f1: 0.6816
 epoch: 83, train_loss: 0.2078, test_loss: 1.3440, test_f1: 0.6729
 epoch: 84, train_loss: 0.2137, test_loss: 1.2928, test_f1: 0.6891
 epoch: 85, train_loss: 0.2147, test_loss: 1.3171, test_f1: 0.6877
 epoch: 86, train_loss: 0.2257, test_loss: 1.4173, test_f1: 0.6877
 epoch: 87, train_loss: 0.2273, test_loss: 1.3005, test_f1: 0.6584
 epoch: 88, train_loss: 0.2259, test_loss: 1.3191, test_f1: 0.6937
 epoch: 89, train_loss: 0.2203, test_loss: 1.2268, test_f1: 0.6920
 epoch: 90, train_loss: 0.2025, test_loss: 1.4180, test_f1: 0.6656
 epoch: 91, train_loss: 0.2127, test_loss: 1.2727, test_f1: 0.6742
 epoch: 92, train_loss: 0.1756, test_loss: 1.3343, test_f1: 0.6842
 epoch: 93, train_loss: 0.2165, test_loss: 1.4023, test_f1: 0.6609
 epoch: 94, train_loss: 0.2091, test_loss: 1.3878, test_f1: 0.6761
 epoch: 95, train_loss: 0.1906, test_loss: 1.3793, test_f1: 0.6831
 epoch: 96, train_loss: 0.1965, test_loss: 1.2888, test_f1: 0.6942
 epoch: 97, train_loss: 0.1954, test_loss: 1.3316, test_f1: 0.6820
 epoch: 98, train_loss: 0.2061, test_loss: 1.3489, test_f1: 0.6796
 epoch: 99, train_loss: 0.2091, test_loss: 1.3819, test_f1: 0.6822
##################ITERATION #7 ****************************************
 epoch: 0, train_loss: 1.1606, test_loss: 0.9820, test_f1: 0.5184
 epoch: 1, train_loss: 0.9714, test_loss: 0.9312, test_f1: 0.5066
 epoch: 2, train_loss: 0.9259, test_loss: 0.9235, test_f1: 0.5085
 epoch: 3, train_loss: 0.9096, test_loss: 0.8919, test_f1: 0.5536
 epoch: 4, train_loss: 0.8851, test_loss: 0.8402, test_f1: 0.5379
 epoch: 5, train_loss: 0.8365, test_loss: 0.8249, test_f1: 0.5512
 epoch: 6, train_loss: 0.8193, test_loss: 0.8493, test_f1: 0.5955
 epoch: 7, train_loss: 0.7988, test_loss: 0.8266, test_f1: 0.5778
 epoch: 8, train_loss: 0.7881, test_loss: 0.8042, test_f1: 0.6066
 epoch: 9, train_loss: 0.7571, test_loss: 0.7650, test_f1: 0.6103
 epoch: 10, train_loss: 0.7466, test_loss: 0.7662, test_f1: 0.6148
 epoch: 11, train_loss: 0.7162, test_loss: 0.7694, test_f1: 0.6332
 epoch: 12, train_loss: 0.7157, test_loss: 0.7847, test_f1: 0.5873
 epoch: 13, train_loss: 0.6825, test_loss: 0.7277, test_f1: 0.6773
 epoch: 14, train_loss: 0.7042, test_loss: 0.8020, test_f1: 0.6260
 epoch: 15, train_loss: 0.6908, test_loss: 0.7522, test_f1: 0.6506
 epoch: 16, train_loss: 0.6768, test_loss: 0.8137, test_f1: 0.5923
 epoch: 17, train_loss: 0.6742, test_loss: 0.7518, test_f1: 0.6721
 epoch: 18, train_loss: 0.6704, test_loss: 0.7157, test_f1: 0.6746
 epoch: 19, train_loss: 0.6456, test_loss: 0.7077, test_f1: 0.6465
 epoch: 20, train_loss: 0.6354, test_loss: 0.7315, test_f1: 0.6550
 epoch: 21, train_loss: 0.6282, test_loss: 0.7208, test_f1: 0.6409
 epoch: 22, train_loss: 0.6096, test_loss: 0.7324, test_f1: 0.6574
 epoch: 23, train_loss: 0.5942, test_loss: 0.7104, test_f1: 0.6969
 epoch: 24, train_loss: 0.5865, test_loss: 0.7536, test_f1: 0.6367
 epoch: 25, train_loss: 0.5862, test_loss: 0.7420, test_f1: 0.6828
 epoch: 26, train_loss: 0.5692, test_loss: 0.7845, test_f1: 0.6880
 epoch: 27, train_loss: 0.5585, test_loss: 0.7728, test_f1: 0.6643
 epoch: 28, train_loss: 0.5630, test_loss: 0.8507, test_f1: 0.6654
 epoch: 29, train_loss: 0.5608, test_loss: 0.7895, test_f1: 0.6546
 epoch: 30, train_loss: 0.5528, test_loss: 0.7403, test_f1: 0.6721
 epoch: 31, train_loss: 0.5292, test_loss: 0.8150, test_f1: 0.6861
 epoch: 32, train_loss: 0.5238, test_loss: 0.8146, test_f1: 0.6491
 epoch: 33, train_loss: 0.5250, test_loss: 0.7819, test_f1: 0.6683
 epoch: 34, train_loss: 0.5237, test_loss: 0.7577, test_f1: 0.6791
 epoch: 35, train_loss: 0.4947, test_loss: 0.7318, test_f1: 0.6783
 epoch: 36, train_loss: 0.5334, test_loss: 0.7509, test_f1: 0.6842
 epoch: 37, train_loss: 0.5254, test_loss: 0.8140, test_f1: 0.6820
 epoch: 38, train_loss: 0.5010, test_loss: 0.7684, test_f1: 0.6888
 epoch: 39, train_loss: 0.4865, test_loss: 1.0159, test_f1: 0.6810
 epoch: 40, train_loss: 0.4676, test_loss: 0.7517, test_f1: 0.6994
 epoch: 41, train_loss: 0.4571, test_loss: 0.9068, test_f1: 0.6518
 epoch: 42, train_loss: 0.4819, test_loss: 0.8224, test_f1: 0.6779
 epoch: 43, train_loss: 0.4722, test_loss: 0.7949, test_f1: 0.6621
 epoch: 44, train_loss: 0.4346, test_loss: 0.7442, test_f1: 0.6776
 epoch: 45, train_loss: 0.4365, test_loss: 0.7920, test_f1: 0.6694
 epoch: 46, train_loss: 0.4597, test_loss: 0.8369, test_f1: 0.6659
 epoch: 47, train_loss: 0.4126, test_loss: 0.8102, test_f1: 0.6805
 epoch: 48, train_loss: 0.4385, test_loss: 0.7834, test_f1: 0.6812
 epoch: 49, train_loss: 0.4169, test_loss: 0.9427, test_f1: 0.6989
 epoch: 50, train_loss: 0.4104, test_loss: 0.8424, test_f1: 0.6861
 epoch: 51, train_loss: 0.3587, test_loss: 0.8906, test_f1: 0.6734
 epoch: 52, train_loss: 0.3365, test_loss: 0.8681, test_f1: 0.7081
 epoch: 53, train_loss: 0.3283, test_loss: 1.0625, test_f1: 0.6868
 epoch: 54, train_loss: 0.3415, test_loss: 0.9726, test_f1: 0.7066
 epoch: 55, train_loss: 0.3229, test_loss: 0.9688, test_f1: 0.6941
 epoch: 56, train_loss: 0.3150, test_loss: 1.0405, test_f1: 0.6776
 epoch: 57, train_loss: 0.3027, test_loss: 1.0295, test_f1: 0.6862
 epoch: 58, train_loss: 0.3151, test_loss: 1.1058, test_f1: 0.6789
 epoch: 59, train_loss: 0.3028, test_loss: 1.0193, test_f1: 0.6875
 epoch: 60, train_loss: 0.2968, test_loss: 1.0404, test_f1: 0.7020
 epoch: 61, train_loss: 0.3020, test_loss: 1.0131, test_f1: 0.6959
 epoch: 62, train_loss: 0.2909, test_loss: 1.0808, test_f1: 0.6844
 epoch: 63, train_loss: 0.2866, test_loss: 1.1355, test_f1: 0.6939
 epoch: 64, train_loss: 0.2774, test_loss: 1.1612, test_f1: 0.6746
 epoch: 65, train_loss: 0.2791, test_loss: 1.0728, test_f1: 0.6884
 epoch: 66, train_loss: 0.3062, test_loss: 1.0729, test_f1: 0.6895
 epoch: 67, train_loss: 0.2812, test_loss: 1.1548, test_f1: 0.6862
 epoch: 68, train_loss: 0.2580, test_loss: 1.0597, test_f1: 0.6741
 epoch: 69, train_loss: 0.2592, test_loss: 1.0603, test_f1: 0.6990
 epoch: 70, train_loss: 0.2479, test_loss: 1.0666, test_f1: 0.6717
 epoch: 71, train_loss: 0.2564, test_loss: 1.1312, test_f1: 0.7051
 epoch: 72, train_loss: 0.2291, test_loss: 1.1777, test_f1: 0.6914
 epoch: 73, train_loss: 0.2284, test_loss: 1.2432, test_f1: 0.6697
 epoch: 74, train_loss: 0.2647, test_loss: 1.2099, test_f1: 0.6724
 epoch: 75, train_loss: 0.2424, test_loss: 1.1790, test_f1: 0.6941
 epoch: 76, train_loss: 0.2628, test_loss: 1.0914, test_f1: 0.6943
 epoch: 77, train_loss: 0.2316, test_loss: 1.2047, test_f1: 0.6845
 epoch: 78, train_loss: 0.2474, test_loss: 1.1613, test_f1: 0.6914
 epoch: 79, train_loss: 0.2343, test_loss: 1.2003, test_f1: 0.7004
 epoch: 80, train_loss: 0.2308, test_loss: 1.1891, test_f1: 0.6890
 epoch: 81, train_loss: 0.2236, test_loss: 1.3175, test_f1: 0.6889
 epoch: 82, train_loss: 0.2135, test_loss: 1.2615, test_f1: 0.6983
 epoch: 83, train_loss: 0.2194, test_loss: 1.3081, test_f1: 0.6638
 epoch: 84, train_loss: 0.2163, test_loss: 1.1772, test_f1: 0.6945
 epoch: 85, train_loss: 0.2164, test_loss: 1.2646, test_f1: 0.6807
 epoch: 86, train_loss: 0.2270, test_loss: 1.2371, test_f1: 0.6815
 epoch: 87, train_loss: 0.2324, test_loss: 1.2984, test_f1: 0.6803
 epoch: 88, train_loss: 0.2286, test_loss: 1.3511, test_f1: 0.6799
 epoch: 89, train_loss: 0.1977, test_loss: 1.3224, test_f1: 0.6984
 epoch: 90, train_loss: 0.1942, test_loss: 1.4238, test_f1: 0.6941
 epoch: 91, train_loss: 0.2491, test_loss: 1.2266, test_f1: 0.6997
 epoch: 92, train_loss: 0.1943, test_loss: 1.2988, test_f1: 0.6878
 epoch: 93, train_loss: 0.1962, test_loss: 1.3850, test_f1: 0.6803
 epoch: 94, train_loss: 0.1922, test_loss: 1.4341, test_f1: 0.6968
 epoch: 95, train_loss: 0.2025, test_loss: 1.3418, test_f1: 0.7009
 epoch: 96, train_loss: 0.2031, test_loss: 1.3578, test_f1: 0.6924
 epoch: 97, train_loss: 0.2074, test_loss: 1.2885, test_f1: 0.6801
 epoch: 98, train_loss: 0.1878, test_loss: 1.3446, test_f1: 0.7025
 epoch: 99, train_loss: 0.1837, test_loss: 1.3809, test_f1: 0.6900
##################ITERATION #8 ****************************************
 epoch: 0, train_loss: 1.2039, test_loss: 1.0214, test_f1: 0.4852
 epoch: 1, train_loss: 0.9831, test_loss: 0.9509, test_f1: 0.5507
 epoch: 2, train_loss: 0.9463, test_loss: 0.9507, test_f1: 0.5123
 epoch: 3, train_loss: 0.9166, test_loss: 0.9025, test_f1: 0.5470
 epoch: 4, train_loss: 0.8731, test_loss: 0.8638, test_f1: 0.5372
 epoch: 5, train_loss: 0.8564, test_loss: 0.8457, test_f1: 0.6151
 epoch: 6, train_loss: 0.8287, test_loss: 0.8353, test_f1: 0.5761
 epoch: 7, train_loss: 0.8094, test_loss: 0.7763, test_f1: 0.5766
 epoch: 8, train_loss: 0.7988, test_loss: 0.7553, test_f1: 0.5914
 epoch: 9, train_loss: 0.7709, test_loss: 0.7884, test_f1: 0.6208
 epoch: 10, train_loss: 0.7605, test_loss: 0.8294, test_f1: 0.6289
 epoch: 11, train_loss: 0.7546, test_loss: 0.7478, test_f1: 0.6358
 epoch: 12, train_loss: 0.7266, test_loss: 0.7398, test_f1: 0.6397
 epoch: 13, train_loss: 0.7177, test_loss: 0.7777, test_f1: 0.6330
 epoch: 14, train_loss: 0.6938, test_loss: 0.7442, test_f1: 0.6536
 epoch: 15, train_loss: 0.6926, test_loss: 0.7830, test_f1: 0.6284
 epoch: 16, train_loss: 0.6819, test_loss: 0.8124, test_f1: 0.6335
 epoch: 17, train_loss: 0.6659, test_loss: 0.8019, test_f1: 0.6082
 epoch: 18, train_loss: 0.6543, test_loss: 0.7734, test_f1: 0.6476
 epoch: 19, train_loss: 0.6364, test_loss: 0.7100, test_f1: 0.6692
 epoch: 20, train_loss: 0.6273, test_loss: 0.7871, test_f1: 0.6184
 epoch: 21, train_loss: 0.6163, test_loss: 0.7420, test_f1: 0.6658
 epoch: 22, train_loss: 0.6170, test_loss: 0.8400, test_f1: 0.6684
 epoch: 23, train_loss: 0.6277, test_loss: 0.7441, test_f1: 0.6398
 epoch: 24, train_loss: 0.5927, test_loss: 0.7360, test_f1: 0.6542
 epoch: 25, train_loss: 0.6137, test_loss: 0.7760, test_f1: 0.6533
 epoch: 26, train_loss: 0.5864, test_loss: 0.8187, test_f1: 0.6914
 epoch: 27, train_loss: 0.5695, test_loss: 0.7812, test_f1: 0.6705
 epoch: 28, train_loss: 0.5590, test_loss: 0.8015, test_f1: 0.6665
 epoch: 29, train_loss: 0.5451, test_loss: 0.7909, test_f1: 0.6971
 epoch: 30, train_loss: 0.5536, test_loss: 0.8709, test_f1: 0.6658
 epoch: 31, train_loss: 0.5299, test_loss: 0.8122, test_f1: 0.6590
 epoch: 32, train_loss: 0.5275, test_loss: 0.8551, test_f1: 0.6515
 epoch: 33, train_loss: 0.5111, test_loss: 0.9077, test_f1: 0.6524
 epoch: 34, train_loss: 0.5145, test_loss: 0.7499, test_f1: 0.6856
 epoch: 35, train_loss: 0.5019, test_loss: 0.9232, test_f1: 0.6718
 epoch: 36, train_loss: 0.5073, test_loss: 0.8012, test_f1: 0.6870
 epoch: 37, train_loss: 0.5087, test_loss: 0.9387, test_f1: 0.6536
 epoch: 38, train_loss: 0.4869, test_loss: 0.8745, test_f1: 0.6763
 epoch: 39, train_loss: 0.4832, test_loss: 0.8823, test_f1: 0.6602
 epoch: 40, train_loss: 0.4655, test_loss: 0.8963, test_f1: 0.6649
 epoch: 41, train_loss: 0.4494, test_loss: 0.9724, test_f1: 0.6799
 epoch: 42, train_loss: 0.4648, test_loss: 0.9122, test_f1: 0.6731
 epoch: 43, train_loss: 0.4577, test_loss: 0.8337, test_f1: 0.6720
 epoch: 44, train_loss: 0.4266, test_loss: 0.9996, test_f1: 0.6633
 epoch: 45, train_loss: 0.4330, test_loss: 0.9869, test_f1: 0.6897
 epoch: 46, train_loss: 0.4047, test_loss: 1.0830, test_f1: 0.6655
 epoch: 47, train_loss: 0.4078, test_loss: 1.1337, test_f1: 0.6767
 epoch: 48, train_loss: 0.4028, test_loss: 1.0172, test_f1: 0.6669
 epoch: 49, train_loss: 0.4200, test_loss: 1.0370, test_f1: 0.6487
 epoch: 50, train_loss: 0.4344, test_loss: 1.0374, test_f1: 0.6891
 epoch: 51, train_loss: 0.3552, test_loss: 1.1302, test_f1: 0.6714
 epoch: 52, train_loss: 0.3367, test_loss: 1.0962, test_f1: 0.6814
 epoch: 53, train_loss: 0.3250, test_loss: 1.2070, test_f1: 0.6758
 epoch: 54, train_loss: 0.3249, test_loss: 1.1972, test_f1: 0.6823
 epoch: 55, train_loss: 0.3371, test_loss: 1.1531, test_f1: 0.7050
 epoch: 56, train_loss: 0.3212, test_loss: 1.2290, test_f1: 0.6708
 epoch: 57, train_loss: 0.3097, test_loss: 1.2123, test_f1: 0.6809
 epoch: 58, train_loss: 0.2981, test_loss: 1.2866, test_f1: 0.6604
 epoch: 59, train_loss: 0.2926, test_loss: 1.2816, test_f1: 0.6630
 epoch: 60, train_loss: 0.2802, test_loss: 1.3168, test_f1: 0.6540
 epoch: 61, train_loss: 0.2977, test_loss: 1.2251, test_f1: 0.6780
 epoch: 62, train_loss: 0.2809, test_loss: 1.3084, test_f1: 0.6981
 epoch: 63, train_loss: 0.2781, test_loss: 1.3935, test_f1: 0.6673
 epoch: 64, train_loss: 0.2833, test_loss: 1.3945, test_f1: 0.6748
 epoch: 65, train_loss: 0.2776, test_loss: 1.2641, test_f1: 0.6694
 epoch: 66, train_loss: 0.2495, test_loss: 1.5220, test_f1: 0.6624
 epoch: 67, train_loss: 0.2618, test_loss: 1.5194, test_f1: 0.6695
 epoch: 68, train_loss: 0.2715, test_loss: 1.4632, test_f1: 0.6912
 epoch: 69, train_loss: 0.2615, test_loss: 1.4839, test_f1: 0.6767
 epoch: 70, train_loss: 0.2496, test_loss: 1.5787, test_f1: 0.6691
 epoch: 71, train_loss: 0.2528, test_loss: 1.4774, test_f1: 0.6740
 epoch: 72, train_loss: 0.2729, test_loss: 1.4626, test_f1: 0.6814
 epoch: 73, train_loss: 0.2622, test_loss: 1.5020, test_f1: 0.6657
 epoch: 74, train_loss: 0.2341, test_loss: 1.7019, test_f1: 0.6692
 epoch: 75, train_loss: 0.2662, test_loss: 1.5868, test_f1: 0.6736
 epoch: 76, train_loss: 0.2284, test_loss: 1.6561, test_f1: 0.6709
 epoch: 77, train_loss: 0.2568, test_loss: 1.6812, test_f1: 0.6757
 epoch: 78, train_loss: 0.2322, test_loss: 1.5814, test_f1: 0.6601
 epoch: 79, train_loss: 0.2246, test_loss: 1.6650, test_f1: 0.6646
 epoch: 80, train_loss: 0.2415, test_loss: 1.6865, test_f1: 0.6738
 epoch: 81, train_loss: 0.2267, test_loss: 1.6676, test_f1: 0.6695
 epoch: 82, train_loss: 0.2118, test_loss: 1.6662, test_f1: 0.6723
 epoch: 83, train_loss: 0.2185, test_loss: 1.8361, test_f1: 0.6591
 epoch: 84, train_loss: 0.2318, test_loss: 1.7387, test_f1: 0.6697
 epoch: 85, train_loss: 0.2223, test_loss: 1.6848, test_f1: 0.6658
 epoch: 86, train_loss: 0.2185, test_loss: 1.7164, test_f1: 0.6570
 epoch: 87, train_loss: 0.2073, test_loss: 1.7654, test_f1: 0.6583
 epoch: 88, train_loss: 0.2163, test_loss: 1.7793, test_f1: 0.6830
 epoch: 89, train_loss: 0.2124, test_loss: 1.8219, test_f1: 0.6581
 epoch: 90, train_loss: 0.2000, test_loss: 1.6532, test_f1: 0.6678
 epoch: 91, train_loss: 0.2049, test_loss: 1.9282, test_f1: 0.6576
 epoch: 92, train_loss: 0.1978, test_loss: 1.9205, test_f1: 0.6634
 epoch: 93, train_loss: 0.1993, test_loss: 1.8554, test_f1: 0.6506
 epoch: 94, train_loss: 0.1909, test_loss: 1.6968, test_f1: 0.6747
 epoch: 95, train_loss: 0.2106, test_loss: 1.8425, test_f1: 0.6687
 epoch: 96, train_loss: 0.1966, test_loss: 1.8359, test_f1: 0.6615
 epoch: 97, train_loss: 0.1806, test_loss: 1.9440, test_f1: 0.6433
 epoch: 98, train_loss: 0.1853, test_loss: 1.9325, test_f1: 0.6590
 epoch: 99, train_loss: 0.2258, test_loss: 1.8879, test_f1: 0.6590
##################ITERATION #9 ****************************************
 epoch: 0, train_loss: 1.2022, test_loss: 0.9989, test_f1: 0.5271
 epoch: 1, train_loss: 0.9907, test_loss: 0.9783, test_f1: 0.4992
 epoch: 2, train_loss: 0.9357, test_loss: 0.9292, test_f1: 0.5151
 epoch: 3, train_loss: 0.9071, test_loss: 0.8664, test_f1: 0.5273
 epoch: 4, train_loss: 0.8826, test_loss: 0.8865, test_f1: 0.5770
 epoch: 5, train_loss: 0.8318, test_loss: 0.8761, test_f1: 0.5824
 epoch: 6, train_loss: 0.8247, test_loss: 0.8147, test_f1: 0.6135
 epoch: 7, train_loss: 0.7939, test_loss: 0.7915, test_f1: 0.6241
 epoch: 8, train_loss: 0.7892, test_loss: 0.8042, test_f1: 0.6127
 epoch: 9, train_loss: 0.7599, test_loss: 0.7881, test_f1: 0.6401
 epoch: 10, train_loss: 0.7584, test_loss: 0.7559, test_f1: 0.5832
 epoch: 11, train_loss: 0.7313, test_loss: 0.7334, test_f1: 0.6714
 epoch: 12, train_loss: 0.7164, test_loss: 0.7470, test_f1: 0.6546
 epoch: 13, train_loss: 0.7016, test_loss: 0.7470, test_f1: 0.6383
 epoch: 14, train_loss: 0.6941, test_loss: 0.7463, test_f1: 0.6544
 epoch: 15, train_loss: 0.6691, test_loss: 0.6953, test_f1: 0.6648
 epoch: 16, train_loss: 0.6846, test_loss: 0.7121, test_f1: 0.6262
 epoch: 17, train_loss: 0.6533, test_loss: 0.7389, test_f1: 0.6749
 epoch: 18, train_loss: 0.6441, test_loss: 0.7429, test_f1: 0.6905
 epoch: 19, train_loss: 0.6612, test_loss: 0.6932, test_f1: 0.7012
 epoch: 20, train_loss: 0.6295, test_loss: 0.7217, test_f1: 0.6683
 epoch: 21, train_loss: 0.6208, test_loss: 0.7403, test_f1: 0.6658
 epoch: 22, train_loss: 0.6110, test_loss: 0.7130, test_f1: 0.6633
 epoch: 23, train_loss: 0.5856, test_loss: 0.7764, test_f1: 0.6759
 epoch: 24, train_loss: 0.5810, test_loss: 0.6938, test_f1: 0.6782
 epoch: 25, train_loss: 0.5876, test_loss: 0.6989, test_f1: 0.6689
 epoch: 26, train_loss: 0.5602, test_loss: 0.6743, test_f1: 0.6990
 epoch: 27, train_loss: 0.5505, test_loss: 0.6787, test_f1: 0.6691
 epoch: 28, train_loss: 0.5409, test_loss: 0.6691, test_f1: 0.6906
 epoch: 29, train_loss: 0.5397, test_loss: 0.7471, test_f1: 0.6697
 epoch: 30, train_loss: 0.5113, test_loss: 0.8676, test_f1: 0.6553
 epoch: 31, train_loss: 0.5472, test_loss: 0.7613, test_f1: 0.6426
 epoch: 32, train_loss: 0.5349, test_loss: 0.7631, test_f1: 0.6793
 epoch: 33, train_loss: 0.4978, test_loss: 0.7610, test_f1: 0.6510
 epoch: 34, train_loss: 0.5014, test_loss: 0.6606, test_f1: 0.7201
 epoch: 35, train_loss: 0.5095, test_loss: 0.7772, test_f1: 0.6774
 epoch: 36, train_loss: 0.4821, test_loss: 0.7339, test_f1: 0.6891
 epoch: 37, train_loss: 0.4851, test_loss: 0.9570, test_f1: 0.6586
 epoch: 38, train_loss: 0.4796, test_loss: 0.9162, test_f1: 0.6498
 epoch: 39, train_loss: 0.4680, test_loss: 0.8771, test_f1: 0.6660
 epoch: 40, train_loss: 0.4524, test_loss: 0.9161, test_f1: 0.6673
 epoch: 41, train_loss: 0.4533, test_loss: 0.9238, test_f1: 0.6499
 epoch: 42, train_loss: 0.4375, test_loss: 0.8992, test_f1: 0.6526
 epoch: 43, train_loss: 0.4331, test_loss: 0.9267, test_f1: 0.6537
 epoch: 44, train_loss: 0.4632, test_loss: 0.7907, test_f1: 0.6707
 epoch: 45, train_loss: 0.4419, test_loss: 0.8956, test_f1: 0.6638
 epoch: 46, train_loss: 0.4385, test_loss: 0.9125, test_f1: 0.6464
 epoch: 47, train_loss: 0.4139, test_loss: 0.8779, test_f1: 0.6485
 epoch: 48, train_loss: 0.4140, test_loss: 0.8835, test_f1: 0.6943
 epoch: 49, train_loss: 0.4399, test_loss: 0.9125, test_f1: 0.6615
 epoch: 50, train_loss: 0.4133, test_loss: 1.1229, test_f1: 0.6447
 epoch: 51, train_loss: 0.3644, test_loss: 1.0317, test_f1: 0.6612
 epoch: 52, train_loss: 0.3424, test_loss: 1.0259, test_f1: 0.6587
 epoch: 53, train_loss: 0.3114, test_loss: 0.9959, test_f1: 0.6766
 epoch: 54, train_loss: 0.3156, test_loss: 1.0691, test_f1: 0.6710
 epoch: 55, train_loss: 0.3076, test_loss: 1.1198, test_f1: 0.6723
 epoch: 56, train_loss: 0.3003, test_loss: 1.1049, test_f1: 0.6564
 epoch: 57, train_loss: 0.3041, test_loss: 1.1663, test_f1: 0.6503
 epoch: 58, train_loss: 0.2973, test_loss: 1.1092, test_f1: 0.6610
 epoch: 59, train_loss: 0.3062, test_loss: 1.0766, test_f1: 0.6562
 epoch: 60, train_loss: 0.2969, test_loss: 1.1214, test_f1: 0.6625
 epoch: 61, train_loss: 0.2985, test_loss: 1.0889, test_f1: 0.6677
 epoch: 62, train_loss: 0.2863, test_loss: 1.0825, test_f1: 0.6592
 epoch: 63, train_loss: 0.3288, test_loss: 1.2356, test_f1: 0.6510
 epoch: 64, train_loss: 0.2967, test_loss: 1.1244, test_f1: 0.6757
 epoch: 65, train_loss: 0.2637, test_loss: 1.1335, test_f1: 0.6658
 epoch: 66, train_loss: 0.2670, test_loss: 1.2272, test_f1: 0.6574
 epoch: 67, train_loss: 0.2616, test_loss: 1.2191, test_f1: 0.6673
 epoch: 68, train_loss: 0.2657, test_loss: 1.2785, test_f1: 0.6665
 epoch: 69, train_loss: 0.2842, test_loss: 1.3125, test_f1: 0.6553
 epoch: 70, train_loss: 0.2822, test_loss: 1.3375, test_f1: 0.6707
 epoch: 71, train_loss: 0.2448, test_loss: 1.3905, test_f1: 0.6620
 epoch: 72, train_loss: 0.2603, test_loss: 1.3588, test_f1: 0.6608
 epoch: 73, train_loss: 0.2616, test_loss: 1.3404, test_f1: 0.6626
 epoch: 74, train_loss: 0.2433, test_loss: 1.2445, test_f1: 0.6753
 epoch: 75, train_loss: 0.2482, test_loss: 1.3714, test_f1: 0.6621
 epoch: 76, train_loss: 0.2422, test_loss: 1.3530, test_f1: 0.6461
 epoch: 77, train_loss: 0.2534, test_loss: 1.4254, test_f1: 0.6553
 epoch: 78, train_loss: 0.2317, test_loss: 1.5139, test_f1: 0.6464
 epoch: 79, train_loss: 0.2329, test_loss: 1.5299, test_f1: 0.6484
 epoch: 80, train_loss: 0.2315, test_loss: 1.3713, test_f1: 0.6630
 epoch: 81, train_loss: 0.2168, test_loss: 1.3392, test_f1: 0.6470
 epoch: 82, train_loss: 0.2323, test_loss: 1.4283, test_f1: 0.6372
 epoch: 83, train_loss: 0.2335, test_loss: 1.5330, test_f1: 0.6478
 epoch: 84, train_loss: 0.2415, test_loss: 1.3897, test_f1: 0.6411
 epoch: 85, train_loss: 0.2120, test_loss: 1.3943, test_f1: 0.6405
 epoch: 86, train_loss: 0.2202, test_loss: 1.5440, test_f1: 0.6481
 epoch: 87, train_loss: 0.2123, test_loss: 1.5139, test_f1: 0.6627
 epoch: 88, train_loss: 0.2447, test_loss: 1.3782, test_f1: 0.6462
 epoch: 89, train_loss: 0.2185, test_loss: 1.5219, test_f1: 0.6487
 epoch: 90, train_loss: 0.2182, test_loss: 1.5187, test_f1: 0.6502
 epoch: 91, train_loss: 0.2122, test_loss: 1.5400, test_f1: 0.6655
 epoch: 92, train_loss: 0.2211, test_loss: 1.6508, test_f1: 0.6324
 epoch: 93, train_loss: 0.2187, test_loss: 1.3663, test_f1: 0.6614
 epoch: 94, train_loss: 0.2190, test_loss: 1.3840, test_f1: 0.6647
 epoch: 95, train_loss: 0.2156, test_loss: 1.7539, test_f1: 0.6461
 epoch: 96, train_loss: 0.2218, test_loss: 1.7211, test_f1: 0.6597
 epoch: 97, train_loss: 0.2034, test_loss: 1.6647, test_f1: 0.6443
 epoch: 98, train_loss: 0.2151, test_loss: 1.5565, test_f1: 0.6607
 epoch: 99, train_loss: 0.2112, test_loss: 1.6936, test_f1: 0.6406

Training completed in 1460.22 seconds
Best F1: 0.7284 at epoch 40
Mean F1 across iterations: 0.7160  0.0088
========================FINAL RESULTS================================
FEGIN weighted F1: 0.7284  0.0088
python main.py --data ltspice_examples --representation component_pin_net --model FEGIN --layers 6 --hiddens 128 --batch_size 32 --lr 0.001 --emb_size 128 --epochs 100 --save_appendix component_pin_net_L6_H128_BS32_LR0.001_E128 --no_val
-----



STDERR:
  File "main.py", line 370, in <module>
    main()
  File "main.py", line 254, in main
    dataset = dataset_class(
  File "/home/philip/projects/ltspice_examples_code_repo/Circuit-Completion-Using-GNNs/component_classification_with_link_prediction_head/evaluation/FEGIN/kernel/circuit_datasets.py", line 15, in __init__
    self.data, self.slices = torch.load(self.processed_paths[0])
  File "/home/philip/.local/lib/python3.8/site-packages/torch/serialization.py", line 1040, in load
    warnings.warn(
  File "/usr/lib/python3.8/warnings.py", line 109, in _showwarnmsg
    sw(msg.message, msg.category, msg.filename, msg.lineno,
  File "main.py", line 47, in warn_with_traceback
    traceback.print_stack(file=log)
/home/philip/projects/ltspice_examples_code_repo/Circuit-Completion-Using-GNNs/component_classification_with_link_prediction_head/evaluation/FEGIN/kernel/circuit_datasets.py:15: FutureWarning: You are using `torch.load` with `weights_only=False` (the current default value), which uses the default pickle module implicitly. It is possible to construct malicious pickle data which will execute arbitrary code during unpickling (See https://github.com/pytorch/pytorch/blob/main/SECURITY.md#untrusted-models for more details). In a future release, the default value for `weights_only` will be flipped to `True`. This limits the functions that could be executed during unpickling. Arbitrary objects will no longer be allowed to be loaded via this mode unless they are explicitly allowlisted by the user via `torch.serialization.add_safe_globals`. We recommend you start setting `weights_only=True` for any use case where you don't have full control of the loaded file. Please open an issue on GitHub for any issues related to this experimental feature.
  self.data, self.slices = torch.load(self.processed_paths[0])
