STDOUT:
Results will be saved in /home/philip/projects/ltspice_examples_code_repo/Circuit-Completion-Using-GNNs/component_classification_with_link_prediction_head/evaluation/FEGIN/results/model_FEGIN_dataset_ltspice_examples
Command line input: python main.py --data ltspice_examples --representation component_component --model FEGIN --layers 4 --hiddens 16 --batch_size 32 --lr 0.01 --emb_size 512 --epochs 100 --save_appendix component_component_L4_H16_BS32_LR0.01_E512 --no_val
 is saved.
-----
ltspice_examples - FEGIN
Using 4 layers, 16 hidden units, h = 2
Loading component_component representation dataset
ENTERED
Training FEGIN on component_component representation
Train: 3556, Test: 845
##################ITERATION #0 ****************************************
 epoch: 0, train_loss: 1.2896, test_loss: 1.2588, test_f1: 0.2274
 epoch: 1, train_loss: 1.2500, test_loss: 1.2170, test_f1: 0.2950
 epoch: 2, train_loss: 1.2171, test_loss: 1.1479, test_f1: 0.3622
 epoch: 3, train_loss: 1.1777, test_loss: 1.0442, test_f1: 0.4629
 epoch: 4, train_loss: 1.1269, test_loss: 1.0537, test_f1: 0.4832
 epoch: 5, train_loss: 1.0811, test_loss: 1.0931, test_f1: 0.4372
 epoch: 6, train_loss: 1.0608, test_loss: 0.9866, test_f1: 0.4439
 epoch: 7, train_loss: 1.0499, test_loss: 1.0795, test_f1: 0.4797
 epoch: 8, train_loss: 1.0418, test_loss: 0.9639, test_f1: 0.4616
 epoch: 9, train_loss: 1.0375, test_loss: 0.9915, test_f1: 0.4528
 epoch: 10, train_loss: 1.0269, test_loss: 1.0393, test_f1: 0.4408
 epoch: 11, train_loss: 1.0298, test_loss: 1.9827, test_f1: 0.4798
 epoch: 12, train_loss: 1.0155, test_loss: 1.0197, test_f1: 0.4490
 epoch: 13, train_loss: 1.0105, test_loss: 0.9892, test_f1: 0.4491
 epoch: 14, train_loss: 1.0113, test_loss: 1.0469, test_f1: 0.4463
 epoch: 15, train_loss: 1.0001, test_loss: 0.9906, test_f1: 0.4601
 epoch: 16, train_loss: 0.9897, test_loss: 1.0270, test_f1: 0.4383
 epoch: 17, train_loss: 0.9881, test_loss: 1.0542, test_f1: 0.4606
 epoch: 18, train_loss: 0.9851, test_loss: 1.0481, test_f1: 0.4658
 epoch: 19, train_loss: 0.9750, test_loss: 1.0316, test_f1: 0.4709
 epoch: 20, train_loss: 0.9829, test_loss: 0.9858, test_f1: 0.4453
 epoch: 21, train_loss: 0.9851, test_loss: 1.0265, test_f1: 0.4576
 epoch: 22, train_loss: 0.9837, test_loss: 1.0047, test_f1: 0.4545
 epoch: 23, train_loss: 0.9567, test_loss: 1.0006, test_f1: 0.4896
 epoch: 24, train_loss: 0.9716, test_loss: 1.1535, test_f1: 0.4317
 epoch: 25, train_loss: 0.9601, test_loss: 1.0260, test_f1: 0.4822
 epoch: 26, train_loss: 0.9631, test_loss: 1.0633, test_f1: 0.4673
 epoch: 27, train_loss: 0.9539, test_loss: 1.0523, test_f1: 0.5092
 epoch: 28, train_loss: 0.9612, test_loss: 1.0361, test_f1: 0.4710
 epoch: 29, train_loss: 0.9531, test_loss: 1.0722, test_f1: 0.4814
 epoch: 30, train_loss: 0.9552, test_loss: 1.1141, test_f1: 0.4461
 epoch: 31, train_loss: 0.9432, test_loss: 1.0119, test_f1: 0.4736
 epoch: 32, train_loss: 0.9652, test_loss: 0.9947, test_f1: 0.4872
 epoch: 33, train_loss: 0.9580, test_loss: 1.0793, test_f1: 0.4528
 epoch: 34, train_loss: 0.9512, test_loss: 1.0477, test_f1: 0.4761
 epoch: 35, train_loss: 0.9398, test_loss: 1.1765, test_f1: 0.4859
 epoch: 36, train_loss: 0.9334, test_loss: 1.1047, test_f1: 0.4683
 epoch: 37, train_loss: 0.9444, test_loss: 1.1512, test_f1: 0.4329
 epoch: 38, train_loss: 0.9396, test_loss: 1.0007, test_f1: 0.4969
 epoch: 39, train_loss: 0.9377, test_loss: 1.1147, test_f1: 0.4834
 epoch: 40, train_loss: 0.9358, test_loss: 1.0980, test_f1: 0.4660
 epoch: 41, train_loss: 0.9502, test_loss: 1.1336, test_f1: 0.4663
 epoch: 42, train_loss: 0.9409, test_loss: 1.1029, test_f1: 0.4584
 epoch: 43, train_loss: 0.9380, test_loss: 1.2450, test_f1: 0.4851
 epoch: 44, train_loss: 0.9436, test_loss: 1.0306, test_f1: 0.5019
 epoch: 45, train_loss: 0.9175, test_loss: 1.0533, test_f1: 0.5168
 epoch: 46, train_loss: 0.9418, test_loss: 1.0202, test_f1: 0.4973
 epoch: 47, train_loss: 0.9332, test_loss: 1.0246, test_f1: 0.5050
 epoch: 48, train_loss: 0.9205, test_loss: 1.0228, test_f1: 0.4910
 epoch: 49, train_loss: 0.9317, test_loss: 1.1155, test_f1: 0.4731
 epoch: 50, train_loss: 0.9387, test_loss: 0.9806, test_f1: 0.4877
 epoch: 51, train_loss: 0.9070, test_loss: 1.0323, test_f1: 0.4965
 epoch: 52, train_loss: 0.8934, test_loss: 1.0188, test_f1: 0.5035
 epoch: 53, train_loss: 0.9130, test_loss: 1.0701, test_f1: 0.5085
 epoch: 54, train_loss: 0.9075, test_loss: 1.0128, test_f1: 0.4981
 epoch: 55, train_loss: 0.9045, test_loss: 1.0882, test_f1: 0.4880
 epoch: 56, train_loss: 0.8920, test_loss: 1.1360, test_f1: 0.4964
 epoch: 57, train_loss: 0.8961, test_loss: 1.0376, test_f1: 0.5202
 epoch: 58, train_loss: 0.8896, test_loss: 1.0568, test_f1: 0.5056
 epoch: 59, train_loss: 0.8999, test_loss: 1.0050, test_f1: 0.4964
 epoch: 60, train_loss: 0.8928, test_loss: 1.0964, test_f1: 0.4961
 epoch: 61, train_loss: 0.8940, test_loss: 1.0248, test_f1: 0.5020
 epoch: 62, train_loss: 0.8775, test_loss: 1.0307, test_f1: 0.5106
 epoch: 63, train_loss: 0.8889, test_loss: 1.0243, test_f1: 0.5050
 epoch: 64, train_loss: 0.9018, test_loss: 1.0059, test_f1: 0.5056
 epoch: 65, train_loss: 0.8904, test_loss: 0.9891, test_f1: 0.5115
 epoch: 66, train_loss: 0.8910, test_loss: 0.9810, test_f1: 0.5088
 epoch: 67, train_loss: 0.8853, test_loss: 1.0044, test_f1: 0.5031
 epoch: 68, train_loss: 0.8757, test_loss: 1.0163, test_f1: 0.5056
 epoch: 69, train_loss: 0.8803, test_loss: 1.0206, test_f1: 0.5038
 epoch: 70, train_loss: 0.8813, test_loss: 1.0575, test_f1: 0.4964
 epoch: 71, train_loss: 0.8826, test_loss: 1.0545, test_f1: 0.4919
 epoch: 72, train_loss: 0.8801, test_loss: 1.0261, test_f1: 0.4890
 epoch: 73, train_loss: 0.8785, test_loss: 0.9941, test_f1: 0.5042
 epoch: 74, train_loss: 0.8852, test_loss: 0.9876, test_f1: 0.4901
 epoch: 75, train_loss: 0.8948, test_loss: 1.0507, test_f1: 0.5078
 epoch: 76, train_loss: 0.8688, test_loss: 1.1318, test_f1: 0.4934
 epoch: 77, train_loss: 0.8728, test_loss: 1.3789, test_f1: 0.4724
 epoch: 78, train_loss: 0.8816, test_loss: 1.0336, test_f1: 0.4972
 epoch: 79, train_loss: 0.8917, test_loss: 0.9320, test_f1: 0.5193
 epoch: 80, train_loss: 0.8734, test_loss: 4.4096, test_f1: 0.4763
 epoch: 81, train_loss: 0.8813, test_loss: 0.9826, test_f1: 0.5056
 epoch: 82, train_loss: 0.8721, test_loss: 0.9952, test_f1: 0.5075
 epoch: 83, train_loss: 0.8632, test_loss: 1.0251, test_f1: 0.5034
 epoch: 84, train_loss: 0.8808, test_loss: 0.9889, test_f1: 0.5075
 epoch: 85, train_loss: 0.8701, test_loss: 1.0367, test_f1: 0.5121
 epoch: 86, train_loss: 0.8623, test_loss: 1.0231, test_f1: 0.5130
 epoch: 87, train_loss: 0.8609, test_loss: 0.9537, test_f1: 0.5185
 epoch: 88, train_loss: 0.8793, test_loss: 0.9979, test_f1: 0.5103
 epoch: 89, train_loss: 0.8660, test_loss: 0.9419, test_f1: 0.5177
 epoch: 90, train_loss: 0.8713, test_loss: 1.0233, test_f1: 0.5016
 epoch: 91, train_loss: 0.8670, test_loss: 1.0296, test_f1: 0.5110
 epoch: 92, train_loss: 0.8719, test_loss: 1.1034, test_f1: 0.5238
 epoch: 93, train_loss: 0.8784, test_loss: 1.0601, test_f1: 0.5008
 epoch: 94, train_loss: 0.8636, test_loss: 1.1407, test_f1: 0.4959
 epoch: 95, train_loss: 0.8536, test_loss: 1.0547, test_f1: 0.5193
 epoch: 96, train_loss: 0.8501, test_loss: 1.1987, test_f1: 0.4918
 epoch: 97, train_loss: 0.8611, test_loss: 1.0326, test_f1: 0.5013
 epoch: 98, train_loss: 0.8616, test_loss: 1.0137, test_f1: 0.5146
 epoch: 99, train_loss: 0.8592, test_loss: 0.9282, test_f1: 0.5268
##################ITERATION #1 ****************************************
 epoch: 0, train_loss: 1.2704, test_loss: 1.2190, test_f1: 0.3595
 epoch: 1, train_loss: 1.1940, test_loss: 1.1858, test_f1: 0.3766
 epoch: 2, train_loss: 1.1327, test_loss: 1.0430, test_f1: 0.4509
 epoch: 3, train_loss: 1.0980, test_loss: 1.0282, test_f1: 0.4201
 epoch: 4, train_loss: 1.0736, test_loss: 1.1660, test_f1: 0.4212
 epoch: 5, train_loss: 1.0542, test_loss: 1.1801, test_f1: 0.4494
 epoch: 6, train_loss: 1.0372, test_loss: 1.0084, test_f1: 0.4662
 epoch: 7, train_loss: 1.0094, test_loss: 1.0344, test_f1: 0.4418
 epoch: 8, train_loss: 1.0090, test_loss: 0.9885, test_f1: 0.4845
 epoch: 9, train_loss: 0.9924, test_loss: 1.0320, test_f1: 0.4470
 epoch: 10, train_loss: 0.9890, test_loss: 0.9861, test_f1: 0.4759
 epoch: 11, train_loss: 0.9863, test_loss: 1.0325, test_f1: 0.4712
 epoch: 12, train_loss: 0.9940, test_loss: 0.9445, test_f1: 0.4849
 epoch: 13, train_loss: 0.9968, test_loss: 1.0306, test_f1: 0.4385
 epoch: 14, train_loss: 0.9686, test_loss: 1.0702, test_f1: 0.4825
 epoch: 15, train_loss: 0.9728, test_loss: 0.9848, test_f1: 0.4891
 epoch: 16, train_loss: 0.9632, test_loss: 1.0262, test_f1: 0.4616
 epoch: 17, train_loss: 0.9814, test_loss: 1.1505, test_f1: 0.4549
 epoch: 18, train_loss: 0.9670, test_loss: 1.0205, test_f1: 0.4607
 epoch: 19, train_loss: 0.9608, test_loss: 1.2020, test_f1: 0.4551
 epoch: 20, train_loss: 0.9507, test_loss: 1.0836, test_f1: 0.4577
 epoch: 21, train_loss: 0.9531, test_loss: 1.0218, test_f1: 0.4779
 epoch: 22, train_loss: 0.9477, test_loss: 1.0621, test_f1: 0.4766
 epoch: 23, train_loss: 0.9499, test_loss: 1.0425, test_f1: 0.5090
 epoch: 24, train_loss: 0.9429, test_loss: 1.0109, test_f1: 0.4705
 epoch: 25, train_loss: 0.9389, test_loss: 1.0287, test_f1: 0.4744
 epoch: 26, train_loss: 0.9526, test_loss: 1.0469, test_f1: 0.4823
 epoch: 27, train_loss: 0.9625, test_loss: 1.0452, test_f1: 0.4787
 epoch: 28, train_loss: 0.9321, test_loss: 0.9932, test_f1: 0.4926
 epoch: 29, train_loss: 0.9347, test_loss: 1.0067, test_f1: 0.4864
 epoch: 30, train_loss: 0.9312, test_loss: 1.0392, test_f1: 0.4767
 epoch: 31, train_loss: 0.9376, test_loss: 1.1005, test_f1: 0.4683
 epoch: 32, train_loss: 0.9514, test_loss: 1.0259, test_f1: 0.4969
 epoch: 33, train_loss: 0.9280, test_loss: 1.0512, test_f1: 0.4915
 epoch: 34, train_loss: 0.9318, test_loss: 1.0620, test_f1: 0.4967
 epoch: 35, train_loss: 0.9389, test_loss: 1.0548, test_f1: 0.5113
 epoch: 36, train_loss: 0.9255, test_loss: 1.2021, test_f1: 0.4769
 epoch: 37, train_loss: 0.9267, test_loss: 1.0685, test_f1: 0.5093
 epoch: 38, train_loss: 0.9085, test_loss: 1.0361, test_f1: 0.5223
 epoch: 39, train_loss: 0.9322, test_loss: 0.9808, test_f1: 0.5524
 epoch: 40, train_loss: 0.9226, test_loss: 1.0379, test_f1: 0.5154
 epoch: 41, train_loss: 0.9116, test_loss: 0.9982, test_f1: 0.5346
 epoch: 42, train_loss: 0.9122, test_loss: 0.9481, test_f1: 0.5441
 epoch: 43, train_loss: 0.9104, test_loss: 1.0094, test_f1: 0.5081
 epoch: 44, train_loss: 0.9058, test_loss: 0.9876, test_f1: 0.5561
 epoch: 45, train_loss: 0.9153, test_loss: 1.0379, test_f1: 0.5302
 epoch: 46, train_loss: 0.9143, test_loss: 1.0090, test_f1: 0.5643
 epoch: 47, train_loss: 0.8883, test_loss: 1.0616, test_f1: 0.5218
 epoch: 48, train_loss: 0.9052, test_loss: 1.0161, test_f1: 0.5337
 epoch: 49, train_loss: 0.9479, test_loss: 1.0036, test_f1: 0.5192
 epoch: 50, train_loss: 0.9245, test_loss: 1.0392, test_f1: 0.5210
 epoch: 51, train_loss: 0.8913, test_loss: 1.0686, test_f1: 0.5233
 epoch: 52, train_loss: 0.8856, test_loss: 1.0322, test_f1: 0.5332
 epoch: 53, train_loss: 0.8891, test_loss: 1.0157, test_f1: 0.5483
 epoch: 54, train_loss: 0.8840, test_loss: 1.0561, test_f1: 0.5313
 epoch: 55, train_loss: 0.8801, test_loss: 1.0267, test_f1: 0.5408
 epoch: 56, train_loss: 0.8586, test_loss: 1.0312, test_f1: 0.5618
 epoch: 57, train_loss: 0.8741, test_loss: 0.9810, test_f1: 0.5204
 epoch: 58, train_loss: 0.8702, test_loss: 1.0205, test_f1: 0.5620
 epoch: 59, train_loss: 0.8787, test_loss: 1.0207, test_f1: 0.5517
 epoch: 60, train_loss: 0.8707, test_loss: 0.9985, test_f1: 0.5370
 epoch: 61, train_loss: 0.8746, test_loss: 1.0172, test_f1: 0.5424
 epoch: 62, train_loss: 0.8611, test_loss: 0.9889, test_f1: 0.5521
 epoch: 63, train_loss: 0.8644, test_loss: 1.0080, test_f1: 0.5326
 epoch: 64, train_loss: 0.8543, test_loss: 0.9724, test_f1: 0.5610
 epoch: 65, train_loss: 0.8688, test_loss: 1.0064, test_f1: 0.5416
 epoch: 66, train_loss: 0.8638, test_loss: 1.0174, test_f1: 0.5304
 epoch: 67, train_loss: 0.8588, test_loss: 0.9566, test_f1: 0.5711
 epoch: 68, train_loss: 0.8569, test_loss: 0.9792, test_f1: 0.5269
 epoch: 69, train_loss: 0.8643, test_loss: 0.9896, test_f1: 0.5453
 epoch: 70, train_loss: 0.8607, test_loss: 0.9194, test_f1: 0.5440
 epoch: 71, train_loss: 0.8742, test_loss: 0.9728, test_f1: 0.5534
 epoch: 72, train_loss: 0.8558, test_loss: 0.9976, test_f1: 0.5397
 epoch: 73, train_loss: 0.8512, test_loss: 1.0003, test_f1: 0.5613
 epoch: 74, train_loss: 0.8416, test_loss: 0.9700, test_f1: 0.5527
 epoch: 75, train_loss: 0.8399, test_loss: 1.0197, test_f1: 0.5452
 epoch: 76, train_loss: 0.8571, test_loss: 0.9095, test_f1: 0.5660
 epoch: 77, train_loss: 0.8669, test_loss: 0.9232, test_f1: 0.5455
 epoch: 78, train_loss: 0.8415, test_loss: 0.9271, test_f1: 0.5355
 epoch: 79, train_loss: 0.8547, test_loss: 0.9354, test_f1: 0.5682
 epoch: 80, train_loss: 0.8374, test_loss: 0.9629, test_f1: 0.5630
 epoch: 81, train_loss: 0.8518, test_loss: 0.9446, test_f1: 0.5694
 epoch: 82, train_loss: 0.8382, test_loss: 0.9742, test_f1: 0.5407
 epoch: 83, train_loss: 0.8508, test_loss: 0.9643, test_f1: 0.5414
 epoch: 84, train_loss: 0.8431, test_loss: 0.9146, test_f1: 0.5577
 epoch: 85, train_loss: 0.8269, test_loss: 0.9451, test_f1: 0.5698
 epoch: 86, train_loss: 0.8272, test_loss: 0.9389, test_f1: 0.5424
 epoch: 87, train_loss: 0.8423, test_loss: 0.9812, test_f1: 0.5645
 epoch: 88, train_loss: 0.8378, test_loss: 0.9387, test_f1: 0.5716
 epoch: 89, train_loss: 0.8281, test_loss: 0.9362, test_f1: 0.5435
 epoch: 90, train_loss: 0.8654, test_loss: 0.9343, test_f1: 0.5693
 epoch: 91, train_loss: 0.8453, test_loss: 1.0212, test_f1: 0.5474
 epoch: 92, train_loss: 0.8464, test_loss: 0.9086, test_f1: 0.5602
 epoch: 93, train_loss: 0.8436, test_loss: 0.9904, test_f1: 0.5717
 epoch: 94, train_loss: 0.8277, test_loss: 0.9683, test_f1: 0.5562
 epoch: 95, train_loss: 0.8266, test_loss: 0.9325, test_f1: 0.5515
 epoch: 96, train_loss: 0.8249, test_loss: 0.9179, test_f1: 0.5562
 epoch: 97, train_loss: 0.8311, test_loss: 0.9452, test_f1: 0.5659
 epoch: 98, train_loss: 0.8224, test_loss: 0.9602, test_f1: 0.5437
 epoch: 99, train_loss: 0.8466, test_loss: 0.9388, test_f1: 0.5666
##################ITERATION #2 ****************************************
 epoch: 0, train_loss: 1.2795, test_loss: 1.2416, test_f1: 0.3311
 epoch: 1, train_loss: 1.2226, test_loss: 1.1412, test_f1: 0.3413
 epoch: 2, train_loss: 1.1740, test_loss: 1.1931, test_f1: 0.3617
 epoch: 3, train_loss: 1.1379, test_loss: 1.1163, test_f1: 0.3772
 epoch: 4, train_loss: 1.0965, test_loss: 0.9945, test_f1: 0.4601
 epoch: 5, train_loss: 1.0825, test_loss: 0.9709, test_f1: 0.4653
 epoch: 6, train_loss: 1.0599, test_loss: 0.9752, test_f1: 0.4492
 epoch: 7, train_loss: 1.0394, test_loss: 1.0253, test_f1: 0.4540
 epoch: 8, train_loss: 1.0262, test_loss: 0.9659, test_f1: 0.4816
 epoch: 9, train_loss: 1.0201, test_loss: 0.9637, test_f1: 0.4546
 epoch: 10, train_loss: 1.0187, test_loss: 0.9892, test_f1: 0.4489
 epoch: 11, train_loss: 1.0071, test_loss: 0.9900, test_f1: 0.4510
 epoch: 12, train_loss: 1.0008, test_loss: 0.9770, test_f1: 0.4707
 epoch: 13, train_loss: 0.9904, test_loss: 1.0116, test_f1: 0.4520
 epoch: 14, train_loss: 0.9839, test_loss: 0.9773, test_f1: 0.4718
 epoch: 15, train_loss: 0.9759, test_loss: 0.9534, test_f1: 0.4797
 epoch: 16, train_loss: 0.9825, test_loss: 0.9712, test_f1: 0.4653
 epoch: 17, train_loss: 0.9856, test_loss: 0.9865, test_f1: 0.4717
 epoch: 18, train_loss: 0.9802, test_loss: 0.9717, test_f1: 0.4477
 epoch: 19, train_loss: 0.9670, test_loss: 1.0214, test_f1: 0.4589
 epoch: 20, train_loss: 0.9867, test_loss: 0.9558, test_f1: 0.5129
 epoch: 21, train_loss: 0.9506, test_loss: 0.9300, test_f1: 0.4841
 epoch: 22, train_loss: 0.9479, test_loss: 0.9547, test_f1: 0.4856
 epoch: 23, train_loss: 0.9661, test_loss: 0.9695, test_f1: 0.4779
 epoch: 24, train_loss: 0.9715, test_loss: 1.0175, test_f1: 0.4918
 epoch: 25, train_loss: 0.9554, test_loss: 1.0382, test_f1: 0.4615
 epoch: 26, train_loss: 0.9754, test_loss: 0.9948, test_f1: 0.5142
 epoch: 27, train_loss: 0.9537, test_loss: 0.9506, test_f1: 0.5106
 epoch: 28, train_loss: 0.9502, test_loss: 0.9813, test_f1: 0.4805
 epoch: 29, train_loss: 0.9384, test_loss: 0.9746, test_f1: 0.4803
 epoch: 30, train_loss: 0.9612, test_loss: 0.9939, test_f1: 0.4604
 epoch: 31, train_loss: 0.9524, test_loss: 0.9844, test_f1: 0.4745
 epoch: 32, train_loss: 0.9379, test_loss: 1.0255, test_f1: 0.4834
 epoch: 33, train_loss: 1.0169, test_loss: 0.9887, test_f1: 0.4608
 epoch: 34, train_loss: 0.9691, test_loss: 0.9836, test_f1: 0.4978
 epoch: 35, train_loss: 0.9618, test_loss: 0.9933, test_f1: 0.4924
 epoch: 36, train_loss: 0.9693, test_loss: 0.9768, test_f1: 0.4679
 epoch: 37, train_loss: 0.9566, test_loss: 1.0055, test_f1: 0.4696
 epoch: 38, train_loss: 0.9362, test_loss: 0.9977, test_f1: 0.4838
 epoch: 39, train_loss: 0.9468, test_loss: 0.9715, test_f1: 0.4946
 epoch: 40, train_loss: 0.9399, test_loss: 0.9724, test_f1: 0.4994
 epoch: 41, train_loss: 0.9428, test_loss: 0.9819, test_f1: 0.4863
 epoch: 42, train_loss: 0.9348, test_loss: 1.0041, test_f1: 0.4981
 epoch: 43, train_loss: 0.9337, test_loss: 1.0237, test_f1: 0.4956
 epoch: 44, train_loss: 0.9358, test_loss: 0.9708, test_f1: 0.4731
 epoch: 45, train_loss: 0.9355, test_loss: 0.9818, test_f1: 0.5016
 epoch: 46, train_loss: 0.9191, test_loss: 0.9973, test_f1: 0.4912
 epoch: 47, train_loss: 0.9235, test_loss: 1.1021, test_f1: 0.4779
 epoch: 48, train_loss: 0.9086, test_loss: 0.9880, test_f1: 0.4854
 epoch: 49, train_loss: 0.9145, test_loss: 0.9597, test_f1: 0.5103
 epoch: 50, train_loss: 0.9126, test_loss: 1.0424, test_f1: 0.4860
 epoch: 51, train_loss: 0.9052, test_loss: 1.1263, test_f1: 0.4717
 epoch: 52, train_loss: 0.9011, test_loss: 1.0521, test_f1: 0.4992
 epoch: 53, train_loss: 0.8876, test_loss: 0.9830, test_f1: 0.5043
 epoch: 54, train_loss: 0.8904, test_loss: 1.0941, test_f1: 0.4997
 epoch: 55, train_loss: 0.8868, test_loss: 1.1334, test_f1: 0.4967
 epoch: 56, train_loss: 0.8779, test_loss: 1.0687, test_f1: 0.5096
 epoch: 57, train_loss: 0.8765, test_loss: 1.0485, test_f1: 0.5217
 epoch: 58, train_loss: 0.8811, test_loss: 0.9966, test_f1: 0.5003
 epoch: 59, train_loss: 0.8722, test_loss: 1.0041, test_f1: 0.5334
 epoch: 60, train_loss: 0.8779, test_loss: 1.0975, test_f1: 0.5087
 epoch: 61, train_loss: 0.8778, test_loss: 1.1711, test_f1: 0.4917
 epoch: 62, train_loss: 0.8689, test_loss: 1.2788, test_f1: 0.4991
 epoch: 63, train_loss: 0.8792, test_loss: 1.1146, test_f1: 0.5205
 epoch: 64, train_loss: 0.8739, test_loss: 1.2007, test_f1: 0.4980
 epoch: 65, train_loss: 0.8711, test_loss: 1.1701, test_f1: 0.4900
 epoch: 66, train_loss: 0.8608, test_loss: 1.2344, test_f1: 0.4757
 epoch: 67, train_loss: 0.8734, test_loss: 1.0245, test_f1: 0.5497
 epoch: 68, train_loss: 0.8743, test_loss: 1.0662, test_f1: 0.5355
 epoch: 69, train_loss: 0.8716, test_loss: 1.0226, test_f1: 0.5233
 epoch: 70, train_loss: 0.8618, test_loss: 1.0039, test_f1: 0.5428
 epoch: 71, train_loss: 0.8576, test_loss: 1.0374, test_f1: 0.5314
 epoch: 72, train_loss: 0.8744, test_loss: 1.0897, test_f1: 0.5363
 epoch: 73, train_loss: 0.8726, test_loss: 1.0241, test_f1: 0.5114
 epoch: 74, train_loss: 0.8773, test_loss: 1.0853, test_f1: 0.5015
 epoch: 75, train_loss: 0.8643, test_loss: 1.0684, test_f1: 0.5109
 epoch: 76, train_loss: 0.8524, test_loss: 1.0017, test_f1: 0.5239
 epoch: 77, train_loss: 0.8781, test_loss: 0.9963, test_f1: 0.5134
 epoch: 78, train_loss: 0.8662, test_loss: 1.0624, test_f1: 0.5148
 epoch: 79, train_loss: 0.8538, test_loss: 1.0263, test_f1: 0.5201
 epoch: 80, train_loss: 0.8527, test_loss: 1.3150, test_f1: 0.5025
 epoch: 81, train_loss: 0.8606, test_loss: 1.1419, test_f1: 0.4747
 epoch: 82, train_loss: 0.8470, test_loss: 1.0146, test_f1: 0.5336
 epoch: 83, train_loss: 0.8450, test_loss: 1.1230, test_f1: 0.4964
 epoch: 84, train_loss: 0.8460, test_loss: 1.0714, test_f1: 0.5124
 epoch: 85, train_loss: 0.8461, test_loss: 1.1289, test_f1: 0.5022
 epoch: 86, train_loss: 0.8442, test_loss: 1.0283, test_f1: 0.5366
 epoch: 87, train_loss: 0.8457, test_loss: 1.2019, test_f1: 0.5139
 epoch: 88, train_loss: 0.8582, test_loss: 1.0149, test_f1: 0.5005
 epoch: 89, train_loss: 0.8452, test_loss: 1.0193, test_f1: 0.5101
 epoch: 90, train_loss: 0.8508, test_loss: 1.0117, test_f1: 0.5155
 epoch: 91, train_loss: 0.8454, test_loss: 1.0262, test_f1: 0.4992
 epoch: 92, train_loss: 0.8427, test_loss: 1.0643, test_f1: 0.5165
 epoch: 93, train_loss: 0.8582, test_loss: 1.0196, test_f1: 0.5170
 epoch: 94, train_loss: 0.8381, test_loss: 1.0230, test_f1: 0.5079
 epoch: 95, train_loss: 0.8486, test_loss: 1.2309, test_f1: 0.4933
 epoch: 96, train_loss: 0.8297, test_loss: 1.1344, test_f1: 0.4972
 epoch: 97, train_loss: 0.8564, test_loss: 1.0626, test_f1: 0.5195
 epoch: 98, train_loss: 0.8445, test_loss: 1.0830, test_f1: 0.4989
 epoch: 99, train_loss: 0.8387, test_loss: 1.0581, test_f1: 0.5146
##################ITERATION #3 ****************************************
 epoch: 0, train_loss: 1.2642, test_loss: 1.2394, test_f1: 0.2879
 epoch: 1, train_loss: 1.1852, test_loss: 1.0752, test_f1: 0.4158
 epoch: 2, train_loss: 1.1466, test_loss: 1.0688, test_f1: 0.4259
 epoch: 3, train_loss: 1.1149, test_loss: 0.9562, test_f1: 0.4788
 epoch: 4, train_loss: 1.0888, test_loss: 0.9868, test_f1: 0.4808
 epoch: 5, train_loss: 1.0643, test_loss: 1.0393, test_f1: 0.4613
 epoch: 6, train_loss: 1.0455, test_loss: 1.0306, test_f1: 0.4684
 epoch: 7, train_loss: 1.0398, test_loss: 0.9976, test_f1: 0.4329
 epoch: 8, train_loss: 1.0562, test_loss: 1.0841, test_f1: 0.4581
 epoch: 9, train_loss: 1.0431, test_loss: 1.0198, test_f1: 0.4289
 epoch: 10, train_loss: 1.0107, test_loss: 1.0197, test_f1: 0.4549
 epoch: 11, train_loss: 1.0006, test_loss: 1.0224, test_f1: 0.4742
 epoch: 12, train_loss: 1.0271, test_loss: 1.0508, test_f1: 0.4418
 epoch: 13, train_loss: 1.0117, test_loss: 0.9800, test_f1: 0.4637
 epoch: 14, train_loss: 1.0058, test_loss: 0.9565, test_f1: 0.4665
 epoch: 15, train_loss: 0.9907, test_loss: 0.9819, test_f1: 0.4585
 epoch: 16, train_loss: 0.9861, test_loss: 0.9447, test_f1: 0.4952
 epoch: 17, train_loss: 0.9745, test_loss: 0.9814, test_f1: 0.4678
 epoch: 18, train_loss: 0.9833, test_loss: 0.9769, test_f1: 0.4680
 epoch: 19, train_loss: 0.9681, test_loss: 0.9941, test_f1: 0.4557
 epoch: 20, train_loss: 0.9577, test_loss: 0.9528, test_f1: 0.4721
 epoch: 21, train_loss: 0.9745, test_loss: 0.9927, test_f1: 0.4661
 epoch: 22, train_loss: 0.9604, test_loss: 0.9361, test_f1: 0.4899
 epoch: 23, train_loss: 0.9702, test_loss: 0.9916, test_f1: 0.4672
 epoch: 24, train_loss: 0.9508, test_loss: 1.0203, test_f1: 0.4840
 epoch: 25, train_loss: 0.9589, test_loss: 1.0203, test_f1: 0.4860
 epoch: 26, train_loss: 0.9537, test_loss: 0.9774, test_f1: 0.4709
 epoch: 27, train_loss: 0.9521, test_loss: 0.9894, test_f1: 0.4689
 epoch: 28, train_loss: 0.9306, test_loss: 0.9706, test_f1: 0.4579
 epoch: 29, train_loss: 0.9427, test_loss: 0.9897, test_f1: 0.4683
 epoch: 30, train_loss: 0.9416, test_loss: 0.9810, test_f1: 0.4585
 epoch: 31, train_loss: 0.9364, test_loss: 0.9437, test_f1: 0.4688
 epoch: 32, train_loss: 0.9323, test_loss: 1.0040, test_f1: 0.4739
 epoch: 33, train_loss: 0.9348, test_loss: 1.0091, test_f1: 0.4886
 epoch: 34, train_loss: 0.9233, test_loss: 0.9487, test_f1: 0.4610
 epoch: 35, train_loss: 0.9331, test_loss: 0.9822, test_f1: 0.4722
 epoch: 36, train_loss: 0.9409, test_loss: 1.0157, test_f1: 0.4742
 epoch: 37, train_loss: 0.9164, test_loss: 1.0130, test_f1: 0.4626
 epoch: 38, train_loss: 0.9435, test_loss: 1.1555, test_f1: 0.4424
 epoch: 39, train_loss: 0.9534, test_loss: 0.8729, test_f1: 0.4880
 epoch: 40, train_loss: 0.9259, test_loss: 0.9803, test_f1: 0.4899
 epoch: 41, train_loss: 0.9202, test_loss: 1.0058, test_f1: 0.4683
 epoch: 42, train_loss: 0.9283, test_loss: 0.9610, test_f1: 0.4879
 epoch: 43, train_loss: 0.9065, test_loss: 0.9666, test_f1: 0.4808
 epoch: 44, train_loss: 0.9189, test_loss: 0.9570, test_f1: 0.4649
 epoch: 45, train_loss: 0.9381, test_loss: 1.0651, test_f1: 0.4498
 epoch: 46, train_loss: 0.9220, test_loss: 1.0001, test_f1: 0.4592
 epoch: 47, train_loss: 0.9256, test_loss: 0.9738, test_f1: 0.4789
 epoch: 48, train_loss: 0.9134, test_loss: 1.0464, test_f1: 0.4505
 epoch: 49, train_loss: 0.9277, test_loss: 0.9698, test_f1: 0.4642
 epoch: 50, train_loss: 0.9148, test_loss: 0.9305, test_f1: 0.4637
 epoch: 51, train_loss: 0.9073, test_loss: 1.0529, test_f1: 0.4692
 epoch: 52, train_loss: 0.8977, test_loss: 0.9834, test_f1: 0.4826
 epoch: 53, train_loss: 0.9003, test_loss: 0.9689, test_f1: 0.4833
 epoch: 54, train_loss: 0.9027, test_loss: 0.9431, test_f1: 0.4899
 epoch: 55, train_loss: 0.9021, test_loss: 0.9402, test_f1: 0.4877
 epoch: 56, train_loss: 0.8868, test_loss: 0.9642, test_f1: 0.4872
 epoch: 57, train_loss: 0.8957, test_loss: 0.9815, test_f1: 0.4730
 epoch: 58, train_loss: 0.8915, test_loss: 1.1432, test_f1: 0.4636
 epoch: 59, train_loss: 0.8824, test_loss: 0.9843, test_f1: 0.4844
 epoch: 60, train_loss: 0.8791, test_loss: 0.9627, test_f1: 0.4712
 epoch: 61, train_loss: 0.8849, test_loss: 0.9407, test_f1: 0.4729
 epoch: 62, train_loss: 0.8832, test_loss: 0.9936, test_f1: 0.4646
 epoch: 63, train_loss: 0.8783, test_loss: 0.9619, test_f1: 0.4731
 epoch: 64, train_loss: 0.8715, test_loss: 0.9963, test_f1: 0.4616
 epoch: 65, train_loss: 0.8872, test_loss: 0.9989, test_f1: 0.4801
 epoch: 66, train_loss: 0.8806, test_loss: 1.0083, test_f1: 0.4725
 epoch: 67, train_loss: 0.8852, test_loss: 0.9988, test_f1: 0.4976
 epoch: 68, train_loss: 0.9114, test_loss: 1.0240, test_f1: 0.4763
 epoch: 69, train_loss: 0.8858, test_loss: 0.9625, test_f1: 0.4943
 epoch: 70, train_loss: 0.8720, test_loss: 0.9581, test_f1: 0.4781
 epoch: 71, train_loss: 0.8775, test_loss: 0.9292, test_f1: 0.4790
 epoch: 72, train_loss: 0.8758, test_loss: 0.9775, test_f1: 0.4998
 epoch: 73, train_loss: 0.8733, test_loss: 0.9281, test_f1: 0.4857
 epoch: 74, train_loss: 0.8730, test_loss: 0.9730, test_f1: 0.4879
 epoch: 75, train_loss: 0.8653, test_loss: 0.9735, test_f1: 0.4665
 epoch: 76, train_loss: 0.8648, test_loss: 0.9216, test_f1: 0.5056
 epoch: 77, train_loss: 0.8704, test_loss: 0.9642, test_f1: 0.4725
 epoch: 78, train_loss: 0.8539, test_loss: 0.9806, test_f1: 0.5014
 epoch: 79, train_loss: 0.8617, test_loss: 0.9720, test_f1: 0.4850
 epoch: 80, train_loss: 0.8671, test_loss: 0.9597, test_f1: 0.4856
 epoch: 81, train_loss: 0.8622, test_loss: 1.0123, test_f1: 0.4763
 epoch: 82, train_loss: 0.8503, test_loss: 0.9805, test_f1: 0.4986
 epoch: 83, train_loss: 0.8683, test_loss: 0.9514, test_f1: 0.4812
 epoch: 84, train_loss: 0.8530, test_loss: 0.9952, test_f1: 0.4805
 epoch: 85, train_loss: 0.8747, test_loss: 0.9711, test_f1: 0.4792
 epoch: 86, train_loss: 0.8564, test_loss: 0.9927, test_f1: 0.4725
 epoch: 87, train_loss: 0.8589, test_loss: 0.9522, test_f1: 0.4800
 epoch: 88, train_loss: 0.8599, test_loss: 0.9532, test_f1: 0.4860
 epoch: 89, train_loss: 0.8735, test_loss: 0.9595, test_f1: 0.4890
 epoch: 90, train_loss: 0.8730, test_loss: 0.9009, test_f1: 0.4909
 epoch: 91, train_loss: 0.8886, test_loss: 0.9697, test_f1: 0.4800
 epoch: 92, train_loss: 0.8645, test_loss: 0.9497, test_f1: 0.5015
 epoch: 93, train_loss: 0.8628, test_loss: 0.8999, test_f1: 0.5081
 epoch: 94, train_loss: 0.8620, test_loss: 0.9686, test_f1: 0.4842
 epoch: 95, train_loss: 0.8626, test_loss: 0.9579, test_f1: 0.4871
 epoch: 96, train_loss: 0.8629, test_loss: 0.9328, test_f1: 0.4963
 epoch: 97, train_loss: 0.8538, test_loss: 0.9341, test_f1: 0.4993
 epoch: 98, train_loss: 0.8477, test_loss: 0.9531, test_f1: 0.4887
 epoch: 99, train_loss: 0.8614, test_loss: 0.9669, test_f1: 0.4970
##################ITERATION #4 ****************************************
 epoch: 0, train_loss: 1.2800, test_loss: 1.2263, test_f1: 0.2822
 epoch: 1, train_loss: 1.2193, test_loss: 1.1486, test_f1: 0.3256
 epoch: 2, train_loss: 1.1765, test_loss: 1.1243, test_f1: 0.3966
 epoch: 3, train_loss: 1.1506, test_loss: 1.0533, test_f1: 0.4469
 epoch: 4, train_loss: 1.1099, test_loss: 1.1114, test_f1: 0.4558
 epoch: 5, train_loss: 1.0948, test_loss: 1.0320, test_f1: 0.4746
 epoch: 6, train_loss: 1.0695, test_loss: 1.0874, test_f1: 0.4796
 epoch: 7, train_loss: 1.0741, test_loss: 1.0883, test_f1: 0.4395
 epoch: 8, train_loss: 1.0479, test_loss: 1.0215, test_f1: 0.4801
 epoch: 9, train_loss: 1.0158, test_loss: 1.1385, test_f1: 0.4324
 epoch: 10, train_loss: 1.0132, test_loss: 1.0162, test_f1: 0.4680
 epoch: 11, train_loss: 1.0042, test_loss: 1.1010, test_f1: 0.4468
 epoch: 12, train_loss: 1.0279, test_loss: 0.9937, test_f1: 0.4747
 epoch: 13, train_loss: 1.0028, test_loss: 1.0156, test_f1: 0.4652
 epoch: 14, train_loss: 0.9977, test_loss: 1.0263, test_f1: 0.4732
 epoch: 15, train_loss: 0.9926, test_loss: 0.9958, test_f1: 0.4840
 epoch: 16, train_loss: 0.9851, test_loss: 1.0333, test_f1: 0.4682
 epoch: 17, train_loss: 0.9729, test_loss: 1.0590, test_f1: 0.4332
 epoch: 18, train_loss: 0.9775, test_loss: 1.0559, test_f1: 0.4535
 epoch: 19, train_loss: 0.9723, test_loss: 0.9955, test_f1: 0.4926
 epoch: 20, train_loss: 0.9673, test_loss: 1.0621, test_f1: 0.4867
 epoch: 21, train_loss: 0.9660, test_loss: 0.9907, test_f1: 0.5005
 epoch: 22, train_loss: 0.9631, test_loss: 1.0310, test_f1: 0.4537
 epoch: 23, train_loss: 0.9626, test_loss: 0.9928, test_f1: 0.5010
 epoch: 24, train_loss: 0.9585, test_loss: 1.0222, test_f1: 0.4825
 epoch: 25, train_loss: 0.9693, test_loss: 0.9941, test_f1: 0.4995
 epoch: 26, train_loss: 0.9645, test_loss: 1.0494, test_f1: 0.4644
 epoch: 27, train_loss: 0.9443, test_loss: 0.9761, test_f1: 0.5019
 epoch: 28, train_loss: 0.9398, test_loss: 0.9874, test_f1: 0.4743
 epoch: 29, train_loss: 0.9487, test_loss: 0.9861, test_f1: 0.4751
 epoch: 30, train_loss: 0.9442, test_loss: 1.0023, test_f1: 0.4977
 epoch: 31, train_loss: 0.9341, test_loss: 1.0384, test_f1: 0.5056
 epoch: 32, train_loss: 0.9469, test_loss: 0.9981, test_f1: 0.4806
 epoch: 33, train_loss: 0.9183, test_loss: 1.0094, test_f1: 0.4965
 epoch: 34, train_loss: 0.9290, test_loss: 0.9897, test_f1: 0.4511
 epoch: 35, train_loss: 0.9370, test_loss: 0.9989, test_f1: 0.4963
 epoch: 36, train_loss: 0.9209, test_loss: 1.0040, test_f1: 0.4858
 epoch: 37, train_loss: 0.9119, test_loss: 1.0389, test_f1: 0.4727
 epoch: 38, train_loss: 0.9432, test_loss: 1.1742, test_f1: 0.4498
 epoch: 39, train_loss: 0.9308, test_loss: 1.0130, test_f1: 0.4689
 epoch: 40, train_loss: 0.9252, test_loss: 1.1034, test_f1: 0.4591
 epoch: 41, train_loss: 0.9240, test_loss: 1.1007, test_f1: 0.4659
 epoch: 42, train_loss: 0.9172, test_loss: 1.1500, test_f1: 0.4653
 epoch: 43, train_loss: 0.9263, test_loss: 1.0292, test_f1: 0.5014
 epoch: 44, train_loss: 0.9245, test_loss: 1.0388, test_f1: 0.4915
 epoch: 45, train_loss: 0.9205, test_loss: 1.0381, test_f1: 0.4711
 epoch: 46, train_loss: 1.0479, test_loss: 1.0089, test_f1: 0.4945
 epoch: 47, train_loss: 1.0025, test_loss: 1.0070, test_f1: 0.4751
 epoch: 48, train_loss: 0.9990, test_loss: 1.0422, test_f1: 0.4574
 epoch: 49, train_loss: 0.9785, test_loss: 1.0025, test_f1: 0.5020
 epoch: 50, train_loss: 0.9812, test_loss: 0.9644, test_f1: 0.4912
 epoch: 51, train_loss: 0.9397, test_loss: 1.0193, test_f1: 0.5185
 epoch: 52, train_loss: 0.9445, test_loss: 0.9633, test_f1: 0.4961
 epoch: 53, train_loss: 0.9273, test_loss: 0.9682, test_f1: 0.5049
 epoch: 54, train_loss: 0.9210, test_loss: 0.9842, test_f1: 0.5145
 epoch: 55, train_loss: 0.9280, test_loss: 0.9538, test_f1: 0.5109
 epoch: 56, train_loss: 0.9123, test_loss: 0.9536, test_f1: 0.5196
 epoch: 57, train_loss: 0.9127, test_loss: 0.9991, test_f1: 0.5119
 epoch: 58, train_loss: 0.9001, test_loss: 0.9861, test_f1: 0.5219
 epoch: 59, train_loss: 0.9023, test_loss: 1.0084, test_f1: 0.5035
 epoch: 60, train_loss: 0.9057, test_loss: 0.9801, test_f1: 0.5150
 epoch: 61, train_loss: 0.9040, test_loss: 0.9490, test_f1: 0.5045
 epoch: 62, train_loss: 0.8837, test_loss: 0.9582, test_f1: 0.5340
 epoch: 63, train_loss: 0.8920, test_loss: 0.9660, test_f1: 0.5282
 epoch: 64, train_loss: 0.8936, test_loss: 0.9925, test_f1: 0.5217
 epoch: 65, train_loss: 0.8896, test_loss: 0.9993, test_f1: 0.4854
 epoch: 66, train_loss: 0.8871, test_loss: 0.9999, test_f1: 0.4870
 epoch: 67, train_loss: 0.8842, test_loss: 0.9821, test_f1: 0.5042
 epoch: 68, train_loss: 0.8960, test_loss: 0.9664, test_f1: 0.5193
 epoch: 69, train_loss: 0.8919, test_loss: 0.9731, test_f1: 0.5170
 epoch: 70, train_loss: 0.8678, test_loss: 1.0031, test_f1: 0.5029
 epoch: 71, train_loss: 0.8738, test_loss: 0.9841, test_f1: 0.5077
 epoch: 72, train_loss: 0.9139, test_loss: 0.9742, test_f1: 0.5052
 epoch: 73, train_loss: 0.8960, test_loss: 0.9599, test_f1: 0.5160
 epoch: 74, train_loss: 0.9035, test_loss: 0.9579, test_f1: 0.5077
 epoch: 75, train_loss: 0.8907, test_loss: 1.0021, test_f1: 0.4985
 epoch: 76, train_loss: 0.8931, test_loss: 1.0057, test_f1: 0.5136
 epoch: 77, train_loss: 0.8806, test_loss: 1.0410, test_f1: 0.5235
 epoch: 78, train_loss: 0.8841, test_loss: 0.9909, test_f1: 0.5061
 epoch: 79, train_loss: 0.8738, test_loss: 0.9913, test_f1: 0.5274
 epoch: 80, train_loss: 0.8837, test_loss: 0.9794, test_f1: 0.5047
 epoch: 81, train_loss: 0.8754, test_loss: 0.9572, test_f1: 0.5279
 epoch: 82, train_loss: 0.8621, test_loss: 1.0264, test_f1: 0.4993
 epoch: 83, train_loss: 0.8681, test_loss: 0.9645, test_f1: 0.5047
 epoch: 84, train_loss: 0.8732, test_loss: 0.9848, test_f1: 0.5181
 epoch: 85, train_loss: 0.8694, test_loss: 1.0768, test_f1: 0.4958
 epoch: 86, train_loss: 0.8641, test_loss: 0.9855, test_f1: 0.4956
 epoch: 87, train_loss: 0.8795, test_loss: 1.0320, test_f1: 0.5022
 epoch: 88, train_loss: 0.8787, test_loss: 1.0372, test_f1: 0.5116
 epoch: 89, train_loss: 0.8706, test_loss: 0.9602, test_f1: 0.5029
 epoch: 90, train_loss: 0.8741, test_loss: 0.9718, test_f1: 0.5185
 epoch: 91, train_loss: 0.8620, test_loss: 1.0417, test_f1: 0.5158
 epoch: 92, train_loss: 0.8590, test_loss: 0.9709, test_f1: 0.5151
 epoch: 93, train_loss: 0.8700, test_loss: 0.9431, test_f1: 0.5160
 epoch: 94, train_loss: 0.8606, test_loss: 0.9669, test_f1: 0.5077
 epoch: 95, train_loss: 0.8644, test_loss: 1.0050, test_f1: 0.5068
 epoch: 96, train_loss: 0.8584, test_loss: 1.0914, test_f1: 0.4994
 epoch: 97, train_loss: 0.8627, test_loss: 1.0187, test_f1: 0.4846
 epoch: 98, train_loss: 0.8534, test_loss: 1.0279, test_f1: 0.4987
 epoch: 99, train_loss: 0.8669, test_loss: 0.9899, test_f1: 0.5048
##################ITERATION #5 ****************************************
 epoch: 0, train_loss: 1.2732, test_loss: 1.2077, test_f1: 0.2615
 epoch: 1, train_loss: 1.1902, test_loss: 1.1370, test_f1: 0.3704
 epoch: 2, train_loss: 1.1346, test_loss: 1.0669, test_f1: 0.3530
 epoch: 3, train_loss: 1.1272, test_loss: 1.0849, test_f1: 0.4043
 epoch: 4, train_loss: 1.0907, test_loss: 1.0320, test_f1: 0.4143
 epoch: 5, train_loss: 1.0843, test_loss: 0.9950, test_f1: 0.4552
 epoch: 6, train_loss: 1.0572, test_loss: 1.0106, test_f1: 0.4413
 epoch: 7, train_loss: 1.0475, test_loss: 1.0008, test_f1: 0.4630
 epoch: 8, train_loss: 1.0147, test_loss: 0.9596, test_f1: 0.4471
 epoch: 9, train_loss: 1.0224, test_loss: 0.9769, test_f1: 0.4518
 epoch: 10, train_loss: 1.0012, test_loss: 1.0203, test_f1: 0.4354
 epoch: 11, train_loss: 0.9996, test_loss: 0.9728, test_f1: 0.4725
 epoch: 12, train_loss: 0.9821, test_loss: 0.9920, test_f1: 0.4589
 epoch: 13, train_loss: 0.9822, test_loss: 1.1164, test_f1: 0.4215
 epoch: 14, train_loss: 0.9793, test_loss: 1.0232, test_f1: 0.4695
 epoch: 15, train_loss: 0.9781, test_loss: 0.9807, test_f1: 0.4674
 epoch: 16, train_loss: 0.9699, test_loss: 1.0003, test_f1: 0.4749
 epoch: 17, train_loss: 0.9631, test_loss: 1.0262, test_f1: 0.4736
 epoch: 18, train_loss: 0.9619, test_loss: 1.0662, test_f1: 0.4382
 epoch: 19, train_loss: 0.9612, test_loss: 1.0202, test_f1: 0.4821
 epoch: 20, train_loss: 0.9554, test_loss: 1.0383, test_f1: 0.4664
 epoch: 21, train_loss: 0.9374, test_loss: 1.0184, test_f1: 0.4788
 epoch: 22, train_loss: 1.0461, test_loss: 1.0368, test_f1: 0.4789
 epoch: 23, train_loss: 0.9746, test_loss: 1.0046, test_f1: 0.4626
 epoch: 24, train_loss: 0.9802, test_loss: 1.0950, test_f1: 0.4536
 epoch: 25, train_loss: 0.9662, test_loss: 1.0159, test_f1: 0.4855
 epoch: 26, train_loss: 0.9588, test_loss: 0.9878, test_f1: 0.4780
 epoch: 27, train_loss: 0.9675, test_loss: 1.0228, test_f1: 0.4498
 epoch: 28, train_loss: 0.9448, test_loss: 1.0070, test_f1: 0.4534
 epoch: 29, train_loss: 0.9477, test_loss: 0.9955, test_f1: 0.4950
 epoch: 30, train_loss: 0.9496, test_loss: 1.1133, test_f1: 0.4671
 epoch: 31, train_loss: 0.9475, test_loss: 0.9701, test_f1: 0.4907
 epoch: 32, train_loss: 0.9358, test_loss: 0.9704, test_f1: 0.4650
 epoch: 33, train_loss: 0.9358, test_loss: 1.0412, test_f1: 0.4656
 epoch: 34, train_loss: 0.9223, test_loss: 0.9936, test_f1: 0.4716
 epoch: 35, train_loss: 0.9356, test_loss: 0.9675, test_f1: 0.4676
 epoch: 36, train_loss: 0.9267, test_loss: 1.0962, test_f1: 0.4511
 epoch: 37, train_loss: 0.9339, test_loss: 0.9888, test_f1: 0.4955
 epoch: 38, train_loss: 0.9232, test_loss: 1.1216, test_f1: 0.4653
 epoch: 39, train_loss: 0.9281, test_loss: 0.9877, test_f1: 0.4813
 epoch: 40, train_loss: 0.9179, test_loss: 0.9931, test_f1: 0.5140
 epoch: 41, train_loss: 0.9240, test_loss: 0.9568, test_f1: 0.4743
 epoch: 42, train_loss: 0.9367, test_loss: 0.9368, test_f1: 0.4720
 epoch: 43, train_loss: 0.9262, test_loss: 0.9605, test_f1: 0.4856
 epoch: 44, train_loss: 0.9109, test_loss: 0.9289, test_f1: 0.5043
 epoch: 45, train_loss: 0.9248, test_loss: 0.9636, test_f1: 0.4977
 epoch: 46, train_loss: 0.9281, test_loss: 0.8924, test_f1: 0.4867
 epoch: 47, train_loss: 0.9375, test_loss: 0.9327, test_f1: 0.5129
 epoch: 48, train_loss: 0.9084, test_loss: 0.9709, test_f1: 0.5129
 epoch: 49, train_loss: 0.9125, test_loss: 0.9310, test_f1: 0.5096
 epoch: 50, train_loss: 0.9137, test_loss: 0.9811, test_f1: 0.4609
 epoch: 51, train_loss: 0.8914, test_loss: 0.9741, test_f1: 0.4921
 epoch: 52, train_loss: 0.8860, test_loss: 1.0348, test_f1: 0.4844
 epoch: 53, train_loss: 0.8845, test_loss: 0.9922, test_f1: 0.5165
 epoch: 54, train_loss: 0.8870, test_loss: 0.9652, test_f1: 0.5002
 epoch: 55, train_loss: 0.8792, test_loss: 0.9360, test_f1: 0.4965
 epoch: 56, train_loss: 0.8646, test_loss: 0.9592, test_f1: 0.5013
 epoch: 57, train_loss: 0.8747, test_loss: 0.9973, test_f1: 0.4792
 epoch: 58, train_loss: 0.8874, test_loss: 0.9356, test_f1: 0.5102
 epoch: 59, train_loss: 0.8776, test_loss: 0.9458, test_f1: 0.5156
 epoch: 60, train_loss: 0.8776, test_loss: 0.9555, test_f1: 0.4856
 epoch: 61, train_loss: 0.8688, test_loss: 0.9635, test_f1: 0.5075
 epoch: 62, train_loss: 0.8872, test_loss: 0.9353, test_f1: 0.5220
 epoch: 63, train_loss: 0.8692, test_loss: 0.9907, test_f1: 0.4754
 epoch: 64, train_loss: 0.8691, test_loss: 0.9253, test_f1: 0.5061
 epoch: 65, train_loss: 0.8651, test_loss: 0.9422, test_f1: 0.5140
 epoch: 66, train_loss: 0.8611, test_loss: 0.9501, test_f1: 0.5134
 epoch: 67, train_loss: 0.8597, test_loss: 0.9298, test_f1: 0.5087
 epoch: 68, train_loss: 0.8683, test_loss: 0.9636, test_f1: 0.5211
 epoch: 69, train_loss: 0.8612, test_loss: 1.0105, test_f1: 0.5093
 epoch: 70, train_loss: 0.8676, test_loss: 0.9396, test_f1: 0.5652
 epoch: 71, train_loss: 0.8631, test_loss: 0.9660, test_f1: 0.5258
 epoch: 72, train_loss: 0.8757, test_loss: 0.9336, test_f1: 0.5480
 epoch: 73, train_loss: 0.8603, test_loss: 0.9665, test_f1: 0.5097
 epoch: 74, train_loss: 0.8560, test_loss: 0.9568, test_f1: 0.5295
 epoch: 75, train_loss: 0.8494, test_loss: 0.9564, test_f1: 0.5752
 epoch: 76, train_loss: 0.8589, test_loss: 0.9631, test_f1: 0.5470
 epoch: 77, train_loss: 0.8455, test_loss: 0.9417, test_f1: 0.5216
 epoch: 78, train_loss: 0.8545, test_loss: 0.9416, test_f1: 0.5580
 epoch: 79, train_loss: 0.8617, test_loss: 0.9367, test_f1: 0.5373
 epoch: 80, train_loss: 0.8459, test_loss: 0.9043, test_f1: 0.5323
 epoch: 81, train_loss: 0.8465, test_loss: 0.9326, test_f1: 0.5353
 epoch: 82, train_loss: 0.8503, test_loss: 0.9855, test_f1: 0.5433
 epoch: 83, train_loss: 0.8565, test_loss: 0.9898, test_f1: 0.5213
 epoch: 84, train_loss: 0.8450, test_loss: 0.9393, test_f1: 0.5644
 epoch: 85, train_loss: 0.8487, test_loss: 0.9506, test_f1: 0.5786
 epoch: 86, train_loss: 0.9149, test_loss: 0.9701, test_f1: 0.5084
 epoch: 87, train_loss: 0.8688, test_loss: 0.9541, test_f1: 0.5618
 epoch: 88, train_loss: 0.8545, test_loss: 0.9652, test_f1: 0.5334
 epoch: 89, train_loss: 0.8565, test_loss: 0.9584, test_f1: 0.5180
 epoch: 90, train_loss: 0.8354, test_loss: 0.9672, test_f1: 0.5249
 epoch: 91, train_loss: 0.8565, test_loss: 1.0380, test_f1: 0.5426
 epoch: 92, train_loss: 0.8487, test_loss: 0.9671, test_f1: 0.5200
 epoch: 93, train_loss: 0.8412, test_loss: 0.9684, test_f1: 0.5275
 epoch: 94, train_loss: 0.8923, test_loss: 0.9587, test_f1: 0.5385
 epoch: 95, train_loss: 0.8462, test_loss: 0.9614, test_f1: 0.5597
 epoch: 96, train_loss: 0.8467, test_loss: 0.9141, test_f1: 0.5567
 epoch: 97, train_loss: 0.8461, test_loss: 0.9607, test_f1: 0.5364
 epoch: 98, train_loss: 0.8448, test_loss: 0.8997, test_f1: 0.5483
 epoch: 99, train_loss: 0.8375, test_loss: 0.9764, test_f1: 0.5442
##################ITERATION #6 ****************************************
 epoch: 0, train_loss: 1.2722, test_loss: 1.2157, test_f1: 0.3538
 epoch: 1, train_loss: 1.2042, test_loss: 1.1210, test_f1: 0.4191
 epoch: 2, train_loss: 1.1463, test_loss: 1.1035, test_f1: 0.4175
 epoch: 3, train_loss: 1.1292, test_loss: 1.0546, test_f1: 0.4044
 epoch: 4, train_loss: 1.1231, test_loss: 1.0510, test_f1: 0.4191
 epoch: 5, train_loss: 1.1062, test_loss: 1.1395, test_f1: 0.3910
 epoch: 6, train_loss: 1.0999, test_loss: 1.1215, test_f1: 0.3425
 epoch: 7, train_loss: 1.0842, test_loss: 1.1148, test_f1: 0.4143
 epoch: 8, train_loss: 1.0860, test_loss: 1.0906, test_f1: 0.4390
 epoch: 9, train_loss: 1.0800, test_loss: 1.0940, test_f1: 0.4504
 epoch: 10, train_loss: 1.0762, test_loss: 1.0982, test_f1: 0.4319
 epoch: 11, train_loss: 1.0679, test_loss: 1.1042, test_f1: 0.4616
 epoch: 12, train_loss: 1.0597, test_loss: 1.0832, test_f1: 0.4485
 epoch: 13, train_loss: 1.0556, test_loss: 1.0957, test_f1: 0.4802
 epoch: 14, train_loss: 1.0477, test_loss: 1.0426, test_f1: 0.4620
 epoch: 15, train_loss: 1.0243, test_loss: 1.0799, test_f1: 0.4448
 epoch: 16, train_loss: 1.0139, test_loss: 1.0674, test_f1: 0.4631
 epoch: 17, train_loss: 1.0050, test_loss: 1.0337, test_f1: 0.4568
 epoch: 18, train_loss: 1.0098, test_loss: 1.2499, test_f1: 0.3879
 epoch: 19, train_loss: 1.0185, test_loss: 1.0415, test_f1: 0.5046
 epoch: 20, train_loss: 1.0087, test_loss: 1.0345, test_f1: 0.4495
 epoch: 21, train_loss: 0.9912, test_loss: 1.0097, test_f1: 0.5084
 epoch: 22, train_loss: 1.0014, test_loss: 0.9946, test_f1: 0.4800
 epoch: 23, train_loss: 0.9899, test_loss: 1.1058, test_f1: 0.4438
 epoch: 24, train_loss: 0.9812, test_loss: 1.0543, test_f1: 0.4771
 epoch: 25, train_loss: 0.9679, test_loss: 1.0203, test_f1: 0.4731
 epoch: 26, train_loss: 0.9783, test_loss: 1.0121, test_f1: 0.4306
 epoch: 27, train_loss: 0.9905, test_loss: 0.9825, test_f1: 0.4774
 epoch: 28, train_loss: 0.9547, test_loss: 1.1218, test_f1: 0.4667
 epoch: 29, train_loss: 0.9615, test_loss: 1.0207, test_f1: 0.4560
 epoch: 30, train_loss: 0.9666, test_loss: 0.9966, test_f1: 0.4977
 epoch: 31, train_loss: 0.9505, test_loss: 0.9988, test_f1: 0.4864
 epoch: 32, train_loss: 0.9583, test_loss: 1.0013, test_f1: 0.4874
 epoch: 33, train_loss: 0.9372, test_loss: 1.0055, test_f1: 0.4919
 epoch: 34, train_loss: 0.9481, test_loss: 1.0767, test_f1: 0.4605
 epoch: 35, train_loss: 0.9617, test_loss: 1.0039, test_f1: 0.4592
 epoch: 36, train_loss: 0.9271, test_loss: 1.0253, test_f1: 0.4878
 epoch: 37, train_loss: 0.9337, test_loss: 1.0167, test_f1: 0.4682
 epoch: 38, train_loss: 0.9366, test_loss: 1.0714, test_f1: 0.4608
 epoch: 39, train_loss: 0.9389, test_loss: 0.9808, test_f1: 0.4761
 epoch: 40, train_loss: 0.9408, test_loss: 0.9720, test_f1: 0.4803
 epoch: 41, train_loss: 0.9468, test_loss: 0.9859, test_f1: 0.4695
 epoch: 42, train_loss: 0.9467, test_loss: 1.0016, test_f1: 0.4666
 epoch: 43, train_loss: 0.9319, test_loss: 1.0327, test_f1: 0.4670
 epoch: 44, train_loss: 0.9273, test_loss: 1.0080, test_f1: 0.4709
 epoch: 45, train_loss: 0.9191, test_loss: 0.9803, test_f1: 0.4762
 epoch: 46, train_loss: 0.9126, test_loss: 0.9942, test_f1: 0.4901
 epoch: 47, train_loss: 0.9155, test_loss: 1.0839, test_f1: 0.4520
 epoch: 48, train_loss: 0.9173, test_loss: 0.9589, test_f1: 0.4811
 epoch: 49, train_loss: 0.9129, test_loss: 1.0344, test_f1: 0.4421
 epoch: 50, train_loss: 0.9210, test_loss: 1.0469, test_f1: 0.4675
 epoch: 51, train_loss: 0.9079, test_loss: 0.9641, test_f1: 0.5305
 epoch: 52, train_loss: 0.8959, test_loss: 0.9654, test_f1: 0.4747
 epoch: 53, train_loss: 0.8893, test_loss: 0.9756, test_f1: 0.4756
 epoch: 54, train_loss: 0.8993, test_loss: 0.9837, test_f1: 0.4787
 epoch: 55, train_loss: 0.8953, test_loss: 0.9786, test_f1: 0.4848
 epoch: 56, train_loss: 0.8996, test_loss: 1.1895, test_f1: 0.4638
 epoch: 57, train_loss: 0.8860, test_loss: 0.9610, test_f1: 0.4849
 epoch: 58, train_loss: 0.8884, test_loss: 0.9684, test_f1: 0.4745
 epoch: 59, train_loss: 0.8905, test_loss: 1.6222, test_f1: 0.4598
 epoch: 60, train_loss: 0.8898, test_loss: 0.9481, test_f1: 0.4916
 epoch: 61, train_loss: 0.8896, test_loss: 1.2072, test_f1: 0.4589
 epoch: 62, train_loss: 0.8981, test_loss: 0.9561, test_f1: 0.4797
 epoch: 63, train_loss: 0.8838, test_loss: 0.9648, test_f1: 0.4881
 epoch: 64, train_loss: 0.9001, test_loss: 0.9627, test_f1: 0.4618
 epoch: 65, train_loss: 0.8882, test_loss: 0.9592, test_f1: 0.4924
 epoch: 66, train_loss: 0.9005, test_loss: 0.9822, test_f1: 0.4843
 epoch: 67, train_loss: 0.8872, test_loss: 0.9569, test_f1: 0.4820
 epoch: 68, train_loss: 0.8864, test_loss: 0.9474, test_f1: 0.4868
 epoch: 69, train_loss: 0.8841, test_loss: 0.9545, test_f1: 0.4956
 epoch: 70, train_loss: 0.8694, test_loss: 0.9650, test_f1: 0.4684
 epoch: 71, train_loss: 0.8856, test_loss: 0.9498, test_f1: 0.4841
 epoch: 72, train_loss: 0.8845, test_loss: 0.9628, test_f1: 0.4860
 epoch: 73, train_loss: 0.8818, test_loss: 0.9413, test_f1: 0.4980
 epoch: 74, train_loss: 0.8820, test_loss: 0.9637, test_f1: 0.4938
 epoch: 75, train_loss: 0.8739, test_loss: 0.9397, test_f1: 0.4963
 epoch: 76, train_loss: 0.8848, test_loss: 0.9469, test_f1: 0.4982
 epoch: 77, train_loss: 0.8714, test_loss: 0.9579, test_f1: 0.4847
 epoch: 78, train_loss: 0.8753, test_loss: 0.9675, test_f1: 0.5160
 epoch: 79, train_loss: 0.8677, test_loss: 0.9720, test_f1: 0.5158
 epoch: 80, train_loss: 0.8751, test_loss: 0.9363, test_f1: 0.5013
 epoch: 81, train_loss: 0.8784, test_loss: 1.0035, test_f1: 0.4642
 epoch: 82, train_loss: 0.8859, test_loss: 0.9642, test_f1: 0.5098
 epoch: 83, train_loss: 0.8720, test_loss: 0.9601, test_f1: 0.5072
 epoch: 84, train_loss: 0.8695, test_loss: 0.9320, test_f1: 0.5379
 epoch: 85, train_loss: 0.8611, test_loss: 0.9585, test_f1: 0.5255
 epoch: 86, train_loss: 0.8681, test_loss: 0.9376, test_f1: 0.5172
 epoch: 87, train_loss: 0.8722, test_loss: 0.9744, test_f1: 0.4791
 epoch: 88, train_loss: 0.8640, test_loss: 0.9733, test_f1: 0.4782
 epoch: 89, train_loss: 0.8739, test_loss: 0.9422, test_f1: 0.4929
 epoch: 90, train_loss: 0.8613, test_loss: 0.9550, test_f1: 0.4871
 epoch: 91, train_loss: 0.8687, test_loss: 0.9604, test_f1: 0.4994
 epoch: 92, train_loss: 0.8546, test_loss: 0.9874, test_f1: 0.5058
 epoch: 93, train_loss: 0.8551, test_loss: 0.9885, test_f1: 0.5185
 epoch: 94, train_loss: 0.8504, test_loss: 0.9873, test_f1: 0.4879
 epoch: 95, train_loss: 0.8379, test_loss: 0.9857, test_f1: 0.5016
 epoch: 96, train_loss: 0.8669, test_loss: 0.9557, test_f1: 0.5041
 epoch: 97, train_loss: 0.8505, test_loss: 0.9850, test_f1: 0.4900
 epoch: 98, train_loss: 0.8540, test_loss: 0.9711, test_f1: 0.4901
 epoch: 99, train_loss: 0.8512, test_loss: 0.9813, test_f1: 0.4989
##################ITERATION #7 ****************************************
 epoch: 0, train_loss: 1.2874, test_loss: 1.2097, test_f1: 0.3973
 epoch: 1, train_loss: 1.2325, test_loss: 1.2279, test_f1: 0.3595
 epoch: 2, train_loss: 1.2023, test_loss: 1.1346, test_f1: 0.3886
 epoch: 3, train_loss: 1.1659, test_loss: 1.1194, test_f1: 0.3917
 epoch: 4, train_loss: 1.1290, test_loss: 1.1086, test_f1: 0.4327
 epoch: 5, train_loss: 1.1352, test_loss: 1.0224, test_f1: 0.4468
 epoch: 6, train_loss: 1.0900, test_loss: 1.0347, test_f1: 0.4529
 epoch: 7, train_loss: 1.0706, test_loss: 0.9655, test_f1: 0.4909
 epoch: 8, train_loss: 1.0436, test_loss: 1.0012, test_f1: 0.4424
 epoch: 9, train_loss: 1.0360, test_loss: 1.0085, test_f1: 0.4874
 epoch: 10, train_loss: 1.0145, test_loss: 1.0093, test_f1: 0.4832
 epoch: 11, train_loss: 1.0061, test_loss: 0.9653, test_f1: 0.4870
 epoch: 12, train_loss: 1.0119, test_loss: 0.9692, test_f1: 0.5108
 epoch: 13, train_loss: 0.9927, test_loss: 0.9364, test_f1: 0.4612
 epoch: 14, train_loss: 0.9973, test_loss: 0.9772, test_f1: 0.4838
 epoch: 15, train_loss: 0.9965, test_loss: 1.0002, test_f1: 0.4735
 epoch: 16, train_loss: 0.9995, test_loss: 1.0045, test_f1: 0.4713
 epoch: 17, train_loss: 0.9853, test_loss: 1.0250, test_f1: 0.4740
 epoch: 18, train_loss: 0.9862, test_loss: 1.0505, test_f1: 0.4472
 epoch: 19, train_loss: 0.9892, test_loss: 1.0389, test_f1: 0.5098
 epoch: 20, train_loss: 1.0412, test_loss: 1.0831, test_f1: 0.4614
 epoch: 21, train_loss: 0.9905, test_loss: 0.9813, test_f1: 0.4748
 epoch: 22, train_loss: 0.9866, test_loss: 0.9964, test_f1: 0.4783
 epoch: 23, train_loss: 0.9611, test_loss: 1.0088, test_f1: 0.4526
 epoch: 24, train_loss: 0.9572, test_loss: 0.9846, test_f1: 0.4868
 epoch: 25, train_loss: 0.9476, test_loss: 1.0003, test_f1: 0.4763
 epoch: 26, train_loss: 0.9537, test_loss: 1.0175, test_f1: 0.4591
 epoch: 27, train_loss: 0.9675, test_loss: 0.9706, test_f1: 0.5043
 epoch: 28, train_loss: 0.9515, test_loss: 0.9861, test_f1: 0.4810
 epoch: 29, train_loss: 0.9471, test_loss: 1.0230, test_f1: 0.5052
 epoch: 30, train_loss: 0.9913, test_loss: 1.0208, test_f1: 0.4588
 epoch: 31, train_loss: 0.9885, test_loss: 0.9991, test_f1: 0.4841
 epoch: 32, train_loss: 0.9582, test_loss: 0.9758, test_f1: 0.5246
 epoch: 33, train_loss: 0.9402, test_loss: 0.9722, test_f1: 0.5052
 epoch: 34, train_loss: 0.9509, test_loss: 0.9806, test_f1: 0.4880
 epoch: 35, train_loss: 0.9630, test_loss: 0.9922, test_f1: 0.5302
 epoch: 36, train_loss: 0.9408, test_loss: 0.9734, test_f1: 0.5002
 epoch: 37, train_loss: 0.9381, test_loss: 0.9853, test_f1: 0.4978
 epoch: 38, train_loss: 0.9402, test_loss: 0.9989, test_f1: 0.4839
 epoch: 39, train_loss: 0.9327, test_loss: 1.0003, test_f1: 0.4810
 epoch: 40, train_loss: 0.9343, test_loss: 0.9676, test_f1: 0.5171
 epoch: 41, train_loss: 0.9309, test_loss: 0.9797, test_f1: 0.5442
 epoch: 42, train_loss: 0.9285, test_loss: 1.0368, test_f1: 0.4743
 epoch: 43, train_loss: 0.9630, test_loss: 0.9761, test_f1: 0.4961
 epoch: 44, train_loss: 0.9598, test_loss: 0.9568, test_f1: 0.5062
 epoch: 45, train_loss: 0.9343, test_loss: 0.9555, test_f1: 0.5271
 epoch: 46, train_loss: 0.9275, test_loss: 1.0268, test_f1: 0.5047
 epoch: 47, train_loss: 0.9255, test_loss: 1.0340, test_f1: 0.4777
 epoch: 48, train_loss: 0.9402, test_loss: 0.9784, test_f1: 0.4852
 epoch: 49, train_loss: 0.9163, test_loss: 0.9698, test_f1: 0.4988
 epoch: 50, train_loss: 0.9141, test_loss: 1.0037, test_f1: 0.5054
 epoch: 51, train_loss: 0.9091, test_loss: 0.9756, test_f1: 0.5047
 epoch: 52, train_loss: 0.8942, test_loss: 1.0117, test_f1: 0.5047
 epoch: 53, train_loss: 0.9009, test_loss: 0.9821, test_f1: 0.5017
 epoch: 54, train_loss: 0.8963, test_loss: 1.0388, test_f1: 0.4853
 epoch: 55, train_loss: 0.8858, test_loss: 0.9534, test_f1: 0.5383
 epoch: 56, train_loss: 0.8835, test_loss: 0.9353, test_f1: 0.5304
 epoch: 57, train_loss: 0.8818, test_loss: 0.9748, test_f1: 0.5074
 epoch: 58, train_loss: 0.8689, test_loss: 0.9571, test_f1: 0.5298
 epoch: 59, train_loss: 0.8941, test_loss: 0.9866, test_f1: 0.5180
 epoch: 60, train_loss: 0.8833, test_loss: 0.9573, test_f1: 0.5079
 epoch: 61, train_loss: 0.8854, test_loss: 0.9319, test_f1: 0.5408
 epoch: 62, train_loss: 0.8902, test_loss: 0.9347, test_f1: 0.5382
 epoch: 63, train_loss: 0.8832, test_loss: 0.9897, test_f1: 0.4807
 epoch: 64, train_loss: 0.8832, test_loss: 0.9647, test_f1: 0.5044
 epoch: 65, train_loss: 0.8719, test_loss: 0.9717, test_f1: 0.4995
 epoch: 66, train_loss: 0.8700, test_loss: 0.9879, test_f1: 0.5168
 epoch: 67, train_loss: 0.8776, test_loss: 1.0155, test_f1: 0.4921
 epoch: 68, train_loss: 0.8684, test_loss: 0.9950, test_f1: 0.5231
 epoch: 69, train_loss: 0.8979, test_loss: 0.9848, test_f1: 0.5209
 epoch: 70, train_loss: 0.8736, test_loss: 0.9704, test_f1: 0.5305
 epoch: 71, train_loss: 0.8773, test_loss: 0.9665, test_f1: 0.5450
 epoch: 72, train_loss: 0.8768, test_loss: 0.9522, test_f1: 0.5407
 epoch: 73, train_loss: 0.8880, test_loss: 0.9534, test_f1: 0.5367
 epoch: 74, train_loss: 0.8718, test_loss: 0.9612, test_f1: 0.5101
 epoch: 75, train_loss: 0.8797, test_loss: 0.9709, test_f1: 0.5146
 epoch: 76, train_loss: 0.8750, test_loss: 0.9462, test_f1: 0.5344
 epoch: 77, train_loss: 0.8648, test_loss: 0.9508, test_f1: 0.5485
 epoch: 78, train_loss: 0.8705, test_loss: 1.0413, test_f1: 0.5184
 epoch: 79, train_loss: 0.8710, test_loss: 1.0122, test_f1: 0.4961
 epoch: 80, train_loss: 0.8666, test_loss: 1.0182, test_f1: 0.5218
 epoch: 81, train_loss: 0.8552, test_loss: 0.9297, test_f1: 0.5447
 epoch: 82, train_loss: 0.9163, test_loss: 0.9699, test_f1: 0.5028
 epoch: 83, train_loss: 0.8844, test_loss: 0.9245, test_f1: 0.5408
 epoch: 84, train_loss: 0.8666, test_loss: 0.9393, test_f1: 0.5415
 epoch: 85, train_loss: 0.8741, test_loss: 0.9857, test_f1: 0.5140
 epoch: 86, train_loss: 0.8555, test_loss: 0.9307, test_f1: 0.5412
 epoch: 87, train_loss: 0.8731, test_loss: 1.0029, test_f1: 0.5087
 epoch: 88, train_loss: 0.8649, test_loss: 0.9985, test_f1: 0.5195
 epoch: 89, train_loss: 0.8797, test_loss: 0.9352, test_f1: 0.5273
 epoch: 90, train_loss: 0.8597, test_loss: 0.9532, test_f1: 0.5252
 epoch: 91, train_loss: 0.8532, test_loss: 0.9886, test_f1: 0.4942
 epoch: 92, train_loss: 0.8669, test_loss: 0.9643, test_f1: 0.5150
 epoch: 93, train_loss: 0.8523, test_loss: 1.0278, test_f1: 0.5036
 epoch: 94, train_loss: 0.8742, test_loss: 0.9644, test_f1: 0.5430
 epoch: 95, train_loss: 0.8650, test_loss: 1.0391, test_f1: 0.4940
 epoch: 96, train_loss: 0.8683, test_loss: 0.9485, test_f1: 0.5626
 epoch: 97, train_loss: 0.8684, test_loss: 0.9866, test_f1: 0.5187
 epoch: 98, train_loss: 0.9070, test_loss: 0.9616, test_f1: 0.5483
 epoch: 99, train_loss: 0.8804, test_loss: 0.9842, test_f1: 0.5073
##################ITERATION #8 ****************************************
 epoch: 0, train_loss: 1.2960, test_loss: 1.2344, test_f1: 0.3294
 epoch: 1, train_loss: 1.2278, test_loss: 1.1562, test_f1: 0.3958
 epoch: 2, train_loss: 1.1716, test_loss: 1.0900, test_f1: 0.5052
 epoch: 3, train_loss: 1.1356, test_loss: 1.0329, test_f1: 0.4333
 epoch: 4, train_loss: 1.1128, test_loss: 1.0294, test_f1: 0.4698
 epoch: 5, train_loss: 1.0742, test_loss: 0.9655, test_f1: 0.5076
 epoch: 6, train_loss: 1.0637, test_loss: 0.9780, test_f1: 0.4621
 epoch: 7, train_loss: 1.0520, test_loss: 1.0612, test_f1: 0.4249
 epoch: 8, train_loss: 1.0323, test_loss: 0.9527, test_f1: 0.4576
 epoch: 9, train_loss: 1.0155, test_loss: 1.0015, test_f1: 0.4711
 epoch: 10, train_loss: 1.0082, test_loss: 1.0465, test_f1: 0.4260
 epoch: 11, train_loss: 1.0072, test_loss: 1.0270, test_f1: 0.4741
 epoch: 12, train_loss: 0.9970, test_loss: 1.0470, test_f1: 0.4436
 epoch: 13, train_loss: 0.9862, test_loss: 0.9768, test_f1: 0.4900
 epoch: 14, train_loss: 0.9905, test_loss: 0.9563, test_f1: 0.4739
 epoch: 15, train_loss: 0.9793, test_loss: 0.9864, test_f1: 0.4666
 epoch: 16, train_loss: 0.9658, test_loss: 1.0176, test_f1: 0.4801
 epoch: 17, train_loss: 0.9775, test_loss: 0.9462, test_f1: 0.4999
 epoch: 18, train_loss: 0.9605, test_loss: 1.0008, test_f1: 0.5068
 epoch: 19, train_loss: 0.9715, test_loss: 0.9793, test_f1: 0.4991
 epoch: 20, train_loss: 0.9607, test_loss: 0.9806, test_f1: 0.5038
 epoch: 21, train_loss: 0.9736, test_loss: 0.9609, test_f1: 0.4977
 epoch: 22, train_loss: 0.9734, test_loss: 0.9781, test_f1: 0.4690
 epoch: 23, train_loss: 0.9644, test_loss: 0.9991, test_f1: 0.4842
 epoch: 24, train_loss: 0.9437, test_loss: 0.9914, test_f1: 0.4917
 epoch: 25, train_loss: 0.9499, test_loss: 0.9407, test_f1: 0.4727
 epoch: 26, train_loss: 0.9573, test_loss: 0.9683, test_f1: 0.4869
 epoch: 27, train_loss: 0.9401, test_loss: 0.9600, test_f1: 0.4777
 epoch: 28, train_loss: 0.9324, test_loss: 1.0106, test_f1: 0.4999
 epoch: 29, train_loss: 0.9357, test_loss: 0.9621, test_f1: 0.4643
 epoch: 30, train_loss: 0.9561, test_loss: 1.0164, test_f1: 0.4986
 epoch: 31, train_loss: 0.9514, test_loss: 0.9605, test_f1: 0.4930
 epoch: 32, train_loss: 0.9342, test_loss: 0.9640, test_f1: 0.4721
 epoch: 33, train_loss: 0.9311, test_loss: 0.9697, test_f1: 0.4912
 epoch: 34, train_loss: 0.9327, test_loss: 0.9832, test_f1: 0.4844
 epoch: 35, train_loss: 0.9697, test_loss: 0.9771, test_f1: 0.4763
 epoch: 36, train_loss: 0.9413, test_loss: 0.9629, test_f1: 0.5121
 epoch: 37, train_loss: 0.9160, test_loss: 0.9411, test_f1: 0.5041
 epoch: 38, train_loss: 0.9319, test_loss: 0.9751, test_f1: 0.5006
 epoch: 39, train_loss: 0.9305, test_loss: 0.9588, test_f1: 0.5199
 epoch: 40, train_loss: 0.9264, test_loss: 0.9742, test_f1: 0.4765
 epoch: 41, train_loss: 0.9385, test_loss: 0.9689, test_f1: 0.4878
 epoch: 42, train_loss: 0.9376, test_loss: 0.9754, test_f1: 0.5369
 epoch: 43, train_loss: 0.9409, test_loss: 0.9325, test_f1: 0.5005
 epoch: 44, train_loss: 0.9212, test_loss: 0.9648, test_f1: 0.4851
 epoch: 45, train_loss: 0.9145, test_loss: 1.0038, test_f1: 0.5098
 epoch: 46, train_loss: 0.9218, test_loss: 1.1970, test_f1: 0.4875
 epoch: 47, train_loss: 0.9335, test_loss: 0.9426, test_f1: 0.4895
 epoch: 48, train_loss: 0.9272, test_loss: 0.9853, test_f1: 0.5040
 epoch: 49, train_loss: 0.9261, test_loss: 0.9321, test_f1: 0.5003
 epoch: 50, train_loss: 0.9479, test_loss: 0.9160, test_f1: 0.4811
 epoch: 51, train_loss: 0.9126, test_loss: 0.9426, test_f1: 0.5188
 epoch: 52, train_loss: 0.9152, test_loss: 0.9730, test_f1: 0.4872
 epoch: 53, train_loss: 0.9049, test_loss: 0.9459, test_f1: 0.5232
 epoch: 54, train_loss: 0.8855, test_loss: 0.9757, test_f1: 0.5020
 epoch: 55, train_loss: 0.8875, test_loss: 0.9305, test_f1: 0.5019
 epoch: 56, train_loss: 0.8809, test_loss: 0.9647, test_f1: 0.5495
 epoch: 57, train_loss: 0.8894, test_loss: 0.9249, test_f1: 0.5074
 epoch: 58, train_loss: 0.8837, test_loss: 0.9405, test_f1: 0.4971
 epoch: 59, train_loss: 0.8787, test_loss: 1.0823, test_f1: 0.4969
 epoch: 60, train_loss: 0.8771, test_loss: 0.9703, test_f1: 0.5263
 epoch: 61, train_loss: 0.8782, test_loss: 0.9592, test_f1: 0.5441
 epoch: 62, train_loss: 0.8759, test_loss: 0.9420, test_f1: 0.4987
 epoch: 63, train_loss: 0.8908, test_loss: 0.9806, test_f1: 0.4771
 epoch: 64, train_loss: 0.8814, test_loss: 0.9990, test_f1: 0.5030
 epoch: 65, train_loss: 0.8744, test_loss: 0.9279, test_f1: 0.5189
 epoch: 66, train_loss: 0.8790, test_loss: 0.9395, test_f1: 0.5136
 epoch: 67, train_loss: 0.8773, test_loss: 0.9445, test_f1: 0.5212
 epoch: 68, train_loss: 0.9111, test_loss: 0.9807, test_f1: 0.4862
 epoch: 69, train_loss: 0.8807, test_loss: 0.9701, test_f1: 0.5000
 epoch: 70, train_loss: 0.8723, test_loss: 0.9475, test_f1: 0.5109
 epoch: 71, train_loss: 0.8795, test_loss: 0.9830, test_f1: 0.4856
 epoch: 72, train_loss: 0.8801, test_loss: 0.9649, test_f1: 0.5168
 epoch: 73, train_loss: 0.8744, test_loss: 0.9429, test_f1: 0.5334
 epoch: 74, train_loss: 0.8684, test_loss: 0.9301, test_f1: 0.5179
 epoch: 75, train_loss: 0.8693, test_loss: 0.9535, test_f1: 0.5167
 epoch: 76, train_loss: 0.8716, test_loss: 0.9481, test_f1: 0.5312
 epoch: 77, train_loss: 0.8644, test_loss: 0.9707, test_f1: 0.5122
 epoch: 78, train_loss: 0.8608, test_loss: 0.9504, test_f1: 0.5238
 epoch: 79, train_loss: 0.8640, test_loss: 1.0105, test_f1: 0.4919
 epoch: 80, train_loss: 0.8699, test_loss: 0.9277, test_f1: 0.5272
 epoch: 81, train_loss: 0.8657, test_loss: 0.9580, test_f1: 0.5120
 epoch: 82, train_loss: 0.8814, test_loss: 0.9774, test_f1: 0.4953
 epoch: 83, train_loss: 0.8703, test_loss: 0.9476, test_f1: 0.5170
 epoch: 84, train_loss: 0.8718, test_loss: 0.9405, test_f1: 0.5005
 epoch: 85, train_loss: 0.8618, test_loss: 0.9630, test_f1: 0.5093
 epoch: 86, train_loss: 0.8636, test_loss: 0.9529, test_f1: 0.5209
 epoch: 87, train_loss: 0.8698, test_loss: 0.9619, test_f1: 0.5095
 epoch: 88, train_loss: 0.8560, test_loss: 0.9516, test_f1: 0.5444
 epoch: 89, train_loss: 0.8645, test_loss: 0.9453, test_f1: 0.5377
 epoch: 90, train_loss: 0.8619, test_loss: 0.9331, test_f1: 0.5750
 epoch: 91, train_loss: 0.8561, test_loss: 0.9520, test_f1: 0.5090
 epoch: 92, train_loss: 0.8685, test_loss: 0.9717, test_f1: 0.5215
 epoch: 93, train_loss: 0.8543, test_loss: 0.9573, test_f1: 0.5138
 epoch: 94, train_loss: 0.8590, test_loss: 0.9363, test_f1: 0.5427
 epoch: 95, train_loss: 0.8462, test_loss: 0.9589, test_f1: 0.5420
 epoch: 96, train_loss: 0.8486, test_loss: 0.9931, test_f1: 0.5113
 epoch: 97, train_loss: 0.8556, test_loss: 0.9509, test_f1: 0.5092
 epoch: 98, train_loss: 0.8343, test_loss: 0.9474, test_f1: 0.5130
 epoch: 99, train_loss: 0.8412, test_loss: 0.9943, test_f1: 0.5277
##################ITERATION #9 ****************************************
 epoch: 0, train_loss: 1.2941, test_loss: 1.2756, test_f1: 0.3779
 epoch: 1, train_loss: 1.2470, test_loss: 1.1923, test_f1: 0.3229
 epoch: 2, train_loss: 1.2208, test_loss: 1.1375, test_f1: 0.4109
 epoch: 3, train_loss: 1.1910, test_loss: 1.1581, test_f1: 0.4031
 epoch: 4, train_loss: 1.1689, test_loss: 1.0837, test_f1: 0.4815
 epoch: 5, train_loss: 1.1375, test_loss: 1.0179, test_f1: 0.4751
 epoch: 6, train_loss: 1.1058, test_loss: 1.0298, test_f1: 0.4409
 epoch: 7, train_loss: 1.0878, test_loss: 1.0274, test_f1: 0.4691
 epoch: 8, train_loss: 1.0653, test_loss: 0.9761, test_f1: 0.4525
 epoch: 9, train_loss: 1.0461, test_loss: 1.0865, test_f1: 0.4586
 epoch: 10, train_loss: 1.0167, test_loss: 1.1310, test_f1: 0.4616
 epoch: 11, train_loss: 1.0240, test_loss: 1.0203, test_f1: 0.4531
 epoch: 12, train_loss: 1.0277, test_loss: 1.0734, test_f1: 0.4614
 epoch: 13, train_loss: 0.9977, test_loss: 0.9862, test_f1: 0.5328
 epoch: 14, train_loss: 1.0107, test_loss: 1.0473, test_f1: 0.4473
 epoch: 15, train_loss: 0.9903, test_loss: 1.0367, test_f1: 0.5170
 epoch: 16, train_loss: 0.9834, test_loss: 1.0350, test_f1: 0.4776
 epoch: 17, train_loss: 0.9931, test_loss: 1.1412, test_f1: 0.4666
 epoch: 18, train_loss: 0.9798, test_loss: 1.0799, test_f1: 0.4560
 epoch: 19, train_loss: 0.9693, test_loss: 0.9761, test_f1: 0.4935
 epoch: 20, train_loss: 0.9748, test_loss: 1.0305, test_f1: 0.4834
 epoch: 21, train_loss: 0.9582, test_loss: 1.2016, test_f1: 0.4648
 epoch: 22, train_loss: 0.9636, test_loss: 1.0207, test_f1: 0.4875
 epoch: 23, train_loss: 0.9611, test_loss: 1.0130, test_f1: 0.4854
 epoch: 24, train_loss: 0.9605, test_loss: 1.0238, test_f1: 0.5201
 epoch: 25, train_loss: 0.9639, test_loss: 1.0055, test_f1: 0.5157
 epoch: 26, train_loss: 0.9534, test_loss: 1.0055, test_f1: 0.4817
 epoch: 27, train_loss: 0.9710, test_loss: 0.9753, test_f1: 0.5046
 epoch: 28, train_loss: 0.9485, test_loss: 1.2189, test_f1: 0.4861
 epoch: 29, train_loss: 0.9455, test_loss: 0.9606, test_f1: 0.4925
 epoch: 30, train_loss: 0.9455, test_loss: 0.9746, test_f1: 0.5050
 epoch: 31, train_loss: 0.9367, test_loss: 0.9794, test_f1: 0.4935
 epoch: 32, train_loss: 0.9451, test_loss: 1.0467, test_f1: 0.4901
 epoch: 33, train_loss: 0.9351, test_loss: 1.0822, test_f1: 0.4942
 epoch: 34, train_loss: 0.9286, test_loss: 0.9490, test_f1: 0.5213
 epoch: 35, train_loss: 0.9315, test_loss: 0.9837, test_f1: 0.4934
 epoch: 36, train_loss: 0.9384, test_loss: 0.9485, test_f1: 0.4887
 epoch: 37, train_loss: 0.9259, test_loss: 1.0512, test_f1: 0.4869
 epoch: 38, train_loss: 0.9376, test_loss: 0.9667, test_f1: 0.5358
 epoch: 39, train_loss: 0.9230, test_loss: 0.9490, test_f1: 0.5045
 epoch: 40, train_loss: 1.0410, test_loss: 0.9764, test_f1: 0.4780
 epoch: 41, train_loss: 0.9776, test_loss: 1.0027, test_f1: 0.4819
 epoch: 42, train_loss: 0.9674, test_loss: 0.9872, test_f1: 0.4908
 epoch: 43, train_loss: 1.0176, test_loss: 0.9570, test_f1: 0.4905
 epoch: 44, train_loss: 0.9668, test_loss: 0.9089, test_f1: 0.4944
 epoch: 45, train_loss: 0.9540, test_loss: 0.9666, test_f1: 0.4901
 epoch: 46, train_loss: 0.9418, test_loss: 0.9298, test_f1: 0.4978
 epoch: 47, train_loss: 0.9415, test_loss: 0.9610, test_f1: 0.4749
 epoch: 48, train_loss: 0.9137, test_loss: 0.9838, test_f1: 0.4704
 epoch: 49, train_loss: 0.9171, test_loss: 0.9435, test_f1: 0.5295
 epoch: 50, train_loss: 0.9043, test_loss: 0.9580, test_f1: 0.5206
 epoch: 51, train_loss: 0.8946, test_loss: 0.9561, test_f1: 0.5290
 epoch: 52, train_loss: 0.8983, test_loss: 0.9758, test_f1: 0.5186
 epoch: 53, train_loss: 0.8927, test_loss: 0.9935, test_f1: 0.4921
 epoch: 54, train_loss: 0.8863, test_loss: 0.9978, test_f1: 0.5060
 epoch: 55, train_loss: 0.8989, test_loss: 1.0250, test_f1: 0.5015
 epoch: 56, train_loss: 0.8787, test_loss: 0.9778, test_f1: 0.5328
 epoch: 57, train_loss: 0.8829, test_loss: 0.9832, test_f1: 0.5267
 epoch: 58, train_loss: 0.8869, test_loss: 0.9784, test_f1: 0.5170
 epoch: 59, train_loss: 0.8842, test_loss: 0.9618, test_f1: 0.5218
 epoch: 60, train_loss: 0.8820, test_loss: 0.9203, test_f1: 0.5183
 epoch: 61, train_loss: 0.8839, test_loss: 0.9864, test_f1: 0.4989
 epoch: 62, train_loss: 0.8829, test_loss: 0.9803, test_f1: 0.5085
 epoch: 63, train_loss: 0.8738, test_loss: 0.9775, test_f1: 0.4998
 epoch: 64, train_loss: 0.8680, test_loss: 1.1325, test_f1: 0.4750
 epoch: 65, train_loss: 0.8774, test_loss: 0.9745, test_f1: 0.5036
 epoch: 66, train_loss: 0.8790, test_loss: 1.0205, test_f1: 0.5076
 epoch: 67, train_loss: 0.8681, test_loss: 0.9793, test_f1: 0.5100
 epoch: 68, train_loss: 0.8695, test_loss: 0.9992, test_f1: 0.5044
 epoch: 69, train_loss: 0.8575, test_loss: 0.9559, test_f1: 0.5143
 epoch: 70, train_loss: 0.8635, test_loss: 0.9623, test_f1: 0.5170
 epoch: 71, train_loss: 0.8756, test_loss: 0.9689, test_f1: 0.5060
 epoch: 72, train_loss: 0.8582, test_loss: 0.9531, test_f1: 0.5064
 epoch: 73, train_loss: 0.8586, test_loss: 1.0201, test_f1: 0.5065
 epoch: 74, train_loss: 0.8503, test_loss: 0.9701, test_f1: 0.5312
 epoch: 75, train_loss: 0.8911, test_loss: 1.0359, test_f1: 0.4885
 epoch: 76, train_loss: 0.8590, test_loss: 1.0412, test_f1: 0.5253
 epoch: 77, train_loss: 0.8670, test_loss: 1.0288, test_f1: 0.5494
 epoch: 78, train_loss: 0.8570, test_loss: 0.9316, test_f1: 0.5446
 epoch: 79, train_loss: 0.8514, test_loss: 1.0378, test_f1: 0.5162
 epoch: 80, train_loss: 0.8588, test_loss: 0.9162, test_f1: 0.5541
 epoch: 81, train_loss: 0.8634, test_loss: 1.0064, test_f1: 0.5025
 epoch: 82, train_loss: 0.8754, test_loss: 1.0310, test_f1: 0.5065
 epoch: 83, train_loss: 0.8597, test_loss: 0.9294, test_f1: 0.5286
 epoch: 84, train_loss: 0.8468, test_loss: 0.9213, test_f1: 0.5449
 epoch: 85, train_loss: 0.8487, test_loss: 0.9796, test_f1: 0.5011
 epoch: 86, train_loss: 0.8534, test_loss: 0.9205, test_f1: 0.5564
 epoch: 87, train_loss: 0.8585, test_loss: 1.0040, test_f1: 0.5149
 epoch: 88, train_loss: 0.8638, test_loss: 1.0141, test_f1: 0.4783
 epoch: 89, train_loss: 0.8561, test_loss: 1.0345, test_f1: 0.5158
 epoch: 90, train_loss: 0.8585, test_loss: 0.9551, test_f1: 0.5192
 epoch: 91, train_loss: 0.8541, test_loss: 0.9865, test_f1: 0.5057
 epoch: 92, train_loss: 0.8361, test_loss: 0.9924, test_f1: 0.5079
 epoch: 93, train_loss: 0.8504, test_loss: 1.0422, test_f1: 0.5025
 epoch: 94, train_loss: 0.8407, test_loss: 1.0161, test_f1: 0.4807
 epoch: 95, train_loss: 0.8626, test_loss: 0.9502, test_f1: 0.5494
 epoch: 96, train_loss: 0.8429, test_loss: 1.0603, test_f1: 0.5116
 epoch: 97, train_loss: 0.8405, test_loss: 1.0256, test_f1: 0.5156
 epoch: 98, train_loss: 0.8385, test_loss: 0.9209, test_f1: 0.5406
 epoch: 99, train_loss: 0.8505, test_loss: 0.9292, test_f1: 0.5508

Training completed in 1112.37 seconds
Best F1: 0.5786 at epoch 85
Mean F1 across iterations: 0.5501  0.0219
========================FINAL RESULTS================================
FEGIN weighted F1: 0.5786  0.0219
python main.py --data ltspice_examples --representation component_component --model FEGIN --layers 4 --hiddens 16 --batch_size 32 --lr 0.01 --emb_size 512 --epochs 100 --save_appendix component_component_L4_H16_BS32_LR0.01_E512 --no_val
-----



STDERR:
  File "main.py", line 370, in <module>
    main()
  File "main.py", line 254, in main
    dataset = dataset_class(
  File "/home/philip/projects/ltspice_examples_code_repo/Circuit-Completion-Using-GNNs/component_classification_with_link_prediction_head/evaluation/FEGIN/kernel/circuit_datasets.py", line 15, in __init__
    self.data, self.slices = torch.load(self.processed_paths[0])
  File "/home/philip/.local/lib/python3.8/site-packages/torch/serialization.py", line 1040, in load
    warnings.warn(
  File "/usr/lib/python3.8/warnings.py", line 109, in _showwarnmsg
    sw(msg.message, msg.category, msg.filename, msg.lineno,
  File "main.py", line 47, in warn_with_traceback
    traceback.print_stack(file=log)
/home/philip/projects/ltspice_examples_code_repo/Circuit-Completion-Using-GNNs/component_classification_with_link_prediction_head/evaluation/FEGIN/kernel/circuit_datasets.py:15: FutureWarning: You are using `torch.load` with `weights_only=False` (the current default value), which uses the default pickle module implicitly. It is possible to construct malicious pickle data which will execute arbitrary code during unpickling (See https://github.com/pytorch/pytorch/blob/main/SECURITY.md#untrusted-models for more details). In a future release, the default value for `weights_only` will be flipped to `True`. This limits the functions that could be executed during unpickling. Arbitrary objects will no longer be allowed to be loaded via this mode unless they are explicitly allowlisted by the user via `torch.serialization.add_safe_globals`. We recommend you start setting `weights_only=True` for any use case where you don't have full control of the loaded file. Please open an issue on GitHub for any issues related to this experimental feature.
  self.data, self.slices = torch.load(self.processed_paths[0])
