STDOUT:
Results will be saved in /home/philip/projects/ltspice_examples_code_repo/Circuit-Completion-Using-GNNs/component_classification_with_link_prediction_head/evaluation/FEGIN/results/model_FEGIN_dataset_ltspice_demos
Command line input: python main.py --data ltspice_demos --representation component_net --model FEGIN --layers 4 --hiddens 32 --batch_size 128 --lr 0.01 --emb_size 250 --epochs 100 --save_appendix component_net_L4_H32_BS128_LR0.01_E250 --no_val
 is saved.
-----
ltspice_demos - FEGIN
Using 4 layers, 32 hidden units, h = 2
Loading component_net representation dataset
ENTERED
Training FEGIN on component_net representation
Train: 1565, Test: 383
##################ITERATION #0 ****************************************
 epoch: 0, train_loss: 1.2411, test_loss: 1.3009, test_f1: 0.2281
 epoch: 1, train_loss: 1.1074, test_loss: 1.2777, test_f1: 0.2281
 epoch: 2, train_loss: 1.0331, test_loss: 1.2567, test_f1: 0.3653
 epoch: 3, train_loss: 1.0205, test_loss: 1.1225, test_f1: 0.3681
 epoch: 4, train_loss: 0.9805, test_loss: 1.1275, test_f1: 0.3997
 epoch: 5, train_loss: 0.9627, test_loss: 1.1556, test_f1: 0.5136
 epoch: 6, train_loss: 0.9514, test_loss: 1.1490, test_f1: 0.4346
 epoch: 7, train_loss: 0.9305, test_loss: 1.1462, test_f1: 0.4442
 epoch: 8, train_loss: 0.8999, test_loss: 1.1024, test_f1: 0.5414
 epoch: 9, train_loss: 0.9019, test_loss: 1.1438, test_f1: 0.3939
 epoch: 10, train_loss: 0.8777, test_loss: 1.0482, test_f1: 0.5787
 epoch: 11, train_loss: 0.9109, test_loss: 1.1090, test_f1: 0.5033
 epoch: 12, train_loss: 0.8833, test_loss: 1.0793, test_f1: 0.5365
 epoch: 13, train_loss: 0.8853, test_loss: 1.2019, test_f1: 0.5359
 epoch: 14, train_loss: 0.8926, test_loss: 1.0757, test_f1: 0.4639
 epoch: 15, train_loss: 0.8457, test_loss: 1.1039, test_f1: 0.5537
 epoch: 16, train_loss: 0.8374, test_loss: 1.1907, test_f1: 0.5560
 epoch: 17, train_loss: 0.8543, test_loss: 1.6069, test_f1: 0.4945
 epoch: 18, train_loss: 0.8555, test_loss: 1.1022, test_f1: 0.6100
 epoch: 19, train_loss: 0.8419, test_loss: 1.0596, test_f1: 0.5443
 epoch: 20, train_loss: 0.8694, test_loss: 1.1208, test_f1: 0.4684
 epoch: 21, train_loss: 0.8406, test_loss: 1.0668, test_f1: 0.5723
 epoch: 22, train_loss: 0.8048, test_loss: 1.1453, test_f1: 0.5710
 epoch: 23, train_loss: 0.7822, test_loss: 1.1032, test_f1: 0.5887
 epoch: 24, train_loss: 0.8122, test_loss: 1.1064, test_f1: 0.5732
 epoch: 25, train_loss: 0.8031, test_loss: 1.0826, test_f1: 0.5528
 epoch: 26, train_loss: 0.7935, test_loss: 1.1334, test_f1: 0.5639
 epoch: 27, train_loss: 0.7806, test_loss: 1.0771, test_f1: 0.5751
 epoch: 28, train_loss: 0.7430, test_loss: 1.2187, test_f1: 0.5566
 epoch: 29, train_loss: 0.7931, test_loss: 1.4385, test_f1: 0.5284
 epoch: 30, train_loss: 0.7953, test_loss: 1.0751, test_f1: 0.5542
 epoch: 31, train_loss: 0.7744, test_loss: 1.2129, test_f1: 0.4513
 epoch: 32, train_loss: 0.7606, test_loss: 1.0624, test_f1: 0.5125
 epoch: 33, train_loss: 0.7236, test_loss: 1.1897, test_f1: 0.5576
 epoch: 34, train_loss: 0.7222, test_loss: 1.3069, test_f1: 0.4277
 epoch: 35, train_loss: 0.7284, test_loss: 1.1057, test_f1: 0.5736
 epoch: 36, train_loss: 0.7238, test_loss: 1.4657, test_f1: 0.5281
 epoch: 37, train_loss: 0.7342, test_loss: 1.0208, test_f1: 0.5859
 epoch: 38, train_loss: 0.7525, test_loss: 1.3407, test_f1: 0.5136
 epoch: 39, train_loss: 0.7121, test_loss: 1.1528, test_f1: 0.5489
 epoch: 40, train_loss: 0.6812, test_loss: 1.1711, test_f1: 0.6172
 epoch: 41, train_loss: 0.6645, test_loss: 1.2362, test_f1: 0.5743
 epoch: 42, train_loss: 0.6557, test_loss: 1.2681, test_f1: 0.5911
 epoch: 43, train_loss: 0.6484, test_loss: 1.2277, test_f1: 0.6184
 epoch: 44, train_loss: 0.6635, test_loss: 1.1199, test_f1: 0.5461
 epoch: 45, train_loss: 0.6609, test_loss: 1.2791, test_f1: 0.5874
 epoch: 46, train_loss: 0.6950, test_loss: 1.5814, test_f1: 0.5543
 epoch: 47, train_loss: 0.6480, test_loss: 1.3688, test_f1: 0.5592
 epoch: 48, train_loss: 0.6914, test_loss: 1.4640, test_f1: 0.5442
 epoch: 49, train_loss: 0.6840, test_loss: 1.9392, test_f1: 0.5141
 epoch: 50, train_loss: 0.6636, test_loss: 1.2379, test_f1: 0.5831
 epoch: 51, train_loss: 0.6408, test_loss: 1.2299, test_f1: 0.5948
 epoch: 52, train_loss: 0.5830, test_loss: 1.2943, test_f1: 0.5783
 epoch: 53, train_loss: 0.5727, test_loss: 1.2482, test_f1: 0.5987
 epoch: 54, train_loss: 0.5446, test_loss: 1.5181, test_f1: 0.5669
 epoch: 55, train_loss: 0.5274, test_loss: 1.4286, test_f1: 0.5710
 epoch: 56, train_loss: 0.5274, test_loss: 1.4654, test_f1: 0.5426
 epoch: 57, train_loss: 0.5521, test_loss: 1.4684, test_f1: 0.5380
 epoch: 58, train_loss: 0.5251, test_loss: 1.5185, test_f1: 0.5753
 epoch: 59, train_loss: 0.5205, test_loss: 1.6325, test_f1: 0.5720
 epoch: 60, train_loss: 0.5236, test_loss: 1.7110, test_f1: 0.5745
 epoch: 61, train_loss: 0.5361, test_loss: 1.5684, test_f1: 0.5788
 epoch: 62, train_loss: 0.5222, test_loss: 1.5749, test_f1: 0.5901
 epoch: 63, train_loss: 0.5209, test_loss: 1.6324, test_f1: 0.5576
 epoch: 64, train_loss: 0.4954, test_loss: 1.7283, test_f1: 0.5596
 epoch: 65, train_loss: 0.4955, test_loss: 1.5841, test_f1: 0.5968
 epoch: 66, train_loss: 0.4743, test_loss: 1.6696, test_f1: 0.5554
 epoch: 67, train_loss: 0.4707, test_loss: 2.1054, test_f1: 0.5857
 epoch: 68, train_loss: 0.4761, test_loss: 1.8573, test_f1: 0.5887
 epoch: 69, train_loss: 0.4832, test_loss: 2.0555, test_f1: 0.5732
 epoch: 70, train_loss: 0.4971, test_loss: 2.0681, test_f1: 0.5342
 epoch: 71, train_loss: 0.4993, test_loss: 2.1007, test_f1: 0.6091
 epoch: 72, train_loss: 0.4842, test_loss: 1.6461, test_f1: 0.6288
 epoch: 73, train_loss: 0.4618, test_loss: 1.8011, test_f1: 0.5526
 epoch: 74, train_loss: 0.4871, test_loss: 2.0152, test_f1: 0.5842
 epoch: 75, train_loss: 0.4848, test_loss: 1.9485, test_f1: 0.5307
 epoch: 76, train_loss: 0.4769, test_loss: 1.9513, test_f1: 0.5935
 epoch: 77, train_loss: 0.4558, test_loss: 1.7280, test_f1: 0.5985
 epoch: 78, train_loss: 0.4257, test_loss: 1.8141, test_f1: 0.5618
 epoch: 79, train_loss: 0.4318, test_loss: 2.0172, test_f1: 0.6069
 epoch: 80, train_loss: 0.4194, test_loss: 2.0272, test_f1: 0.5456
 epoch: 81, train_loss: 0.4349, test_loss: 2.3613, test_f1: 0.5962
 epoch: 82, train_loss: 0.4002, test_loss: 2.4551, test_f1: 0.5797
 epoch: 83, train_loss: 0.4122, test_loss: 1.9869, test_f1: 0.5855
 epoch: 84, train_loss: 0.4194, test_loss: 2.1962, test_f1: 0.5732
 epoch: 85, train_loss: 0.4148, test_loss: 1.9589, test_f1: 0.5522
 epoch: 86, train_loss: 0.4224, test_loss: 2.0645, test_f1: 0.5596
 epoch: 87, train_loss: 0.4462, test_loss: 1.8570, test_f1: 0.6018
 epoch: 88, train_loss: 0.4474, test_loss: 2.1478, test_f1: 0.5918
 epoch: 89, train_loss: 0.4705, test_loss: 1.9947, test_f1: 0.6202
 epoch: 90, train_loss: 0.4232, test_loss: 1.8583, test_f1: 0.5595
 epoch: 91, train_loss: 0.4044, test_loss: 1.9644, test_f1: 0.5794
 epoch: 92, train_loss: 0.3649, test_loss: 2.4271, test_f1: 0.5751
 epoch: 93, train_loss: 0.3821, test_loss: 2.3454, test_f1: 0.5896
 epoch: 94, train_loss: 0.3900, test_loss: 2.3528, test_f1: 0.5855
 epoch: 95, train_loss: 0.4316, test_loss: 2.4270, test_f1: 0.6009
 epoch: 96, train_loss: 0.3916, test_loss: 2.1480, test_f1: 0.5542
 epoch: 97, train_loss: 0.3985, test_loss: 2.6571, test_f1: 0.5423
 epoch: 98, train_loss: 0.3983, test_loss: 2.1635, test_f1: 0.6006
 epoch: 99, train_loss: 0.3990, test_loss: 2.1469, test_f1: 0.5678
##################ITERATION #1 ****************************************
 epoch: 0, train_loss: 1.2158, test_loss: 1.3530, test_f1: 0.2281
 epoch: 1, train_loss: 1.0656, test_loss: 1.2085, test_f1: 0.3809
 epoch: 2, train_loss: 1.0159, test_loss: 1.1005, test_f1: 0.3771
 epoch: 3, train_loss: 0.9617, test_loss: 1.1675, test_f1: 0.4040
 epoch: 4, train_loss: 0.9397, test_loss: 1.0428, test_f1: 0.4998
 epoch: 5, train_loss: 0.9266, test_loss: 1.0522, test_f1: 0.4525
 epoch: 6, train_loss: 0.9206, test_loss: 1.0264, test_f1: 0.5347
 epoch: 7, train_loss: 0.8987, test_loss: 1.0618, test_f1: 0.4860
 epoch: 8, train_loss: 0.8911, test_loss: 1.0703, test_f1: 0.4964
 epoch: 9, train_loss: 0.8752, test_loss: 1.1936, test_f1: 0.4715
 epoch: 10, train_loss: 0.8658, test_loss: 1.0349, test_f1: 0.5577
 epoch: 11, train_loss: 0.8672, test_loss: 1.0645, test_f1: 0.5477
 epoch: 12, train_loss: 0.8366, test_loss: 1.1118, test_f1: 0.4906
 epoch: 13, train_loss: 0.9065, test_loss: 1.2189, test_f1: 0.4379
 epoch: 14, train_loss: 0.8680, test_loss: 1.0573, test_f1: 0.5326
 epoch: 15, train_loss: 0.8518, test_loss: 1.2368, test_f1: 0.4261
 epoch: 16, train_loss: 0.8655, test_loss: 1.0433, test_f1: 0.5182
 epoch: 17, train_loss: 0.8520, test_loss: 1.0908, test_f1: 0.4858
 epoch: 18, train_loss: 0.8635, test_loss: 1.1140, test_f1: 0.4819
 epoch: 19, train_loss: 0.8401, test_loss: 1.0107, test_f1: 0.5737
 epoch: 20, train_loss: 0.8250, test_loss: 0.9946, test_f1: 0.5704
 epoch: 21, train_loss: 0.8177, test_loss: 1.0657, test_f1: 0.5720
 epoch: 22, train_loss: 0.8028, test_loss: 1.1193, test_f1: 0.5772
 epoch: 23, train_loss: 0.7778, test_loss: 1.1450, test_f1: 0.5148
 epoch: 24, train_loss: 0.7702, test_loss: 1.1237, test_f1: 0.5323
 epoch: 25, train_loss: 0.7487, test_loss: 4.3137, test_f1: 0.5484
 epoch: 26, train_loss: 0.7648, test_loss: 1.1666, test_f1: 0.5250
 epoch: 27, train_loss: 0.7338, test_loss: 1.2800, test_f1: 0.5515
 epoch: 28, train_loss: 0.7636, test_loss: 1.2505, test_f1: 0.5068
 epoch: 29, train_loss: 0.7508, test_loss: 1.1063, test_f1: 0.6058
 epoch: 30, train_loss: 0.7428, test_loss: 1.0988, test_f1: 0.5277
 epoch: 31, train_loss: 0.7158, test_loss: 1.1654, test_f1: 0.6016
 epoch: 32, train_loss: 0.7221, test_loss: 1.1071, test_f1: 0.5638
 epoch: 33, train_loss: 0.7382, test_loss: 1.2392, test_f1: 0.5474
 epoch: 34, train_loss: 0.7075, test_loss: 1.1537, test_f1: 0.5675
 epoch: 35, train_loss: 0.7105, test_loss: 1.1288, test_f1: 0.5705
 epoch: 36, train_loss: 0.7000, test_loss: 1.1693, test_f1: 0.5313
 epoch: 37, train_loss: 0.6628, test_loss: 1.2831, test_f1: 0.5680
 epoch: 38, train_loss: 0.6781, test_loss: 1.5035, test_f1: 0.5127
 epoch: 39, train_loss: 0.7074, test_loss: 1.4173, test_f1: 0.4852
 epoch: 40, train_loss: 0.7046, test_loss: 1.5275, test_f1: 0.5245
 epoch: 41, train_loss: 0.6790, test_loss: 1.2883, test_f1: 0.5662
 epoch: 42, train_loss: 0.6545, test_loss: 1.2266, test_f1: 0.5725
 epoch: 43, train_loss: 0.6778, test_loss: 1.1205, test_f1: 0.5762
 epoch: 44, train_loss: 0.7074, test_loss: 1.6578, test_f1: 0.5578
 epoch: 45, train_loss: 0.7245, test_loss: 1.3658, test_f1: 0.5304
 epoch: 46, train_loss: 0.7100, test_loss: 1.4297, test_f1: 0.5091
 epoch: 47, train_loss: 0.6778, test_loss: 1.2334, test_f1: 0.5611
 epoch: 48, train_loss: 0.6530, test_loss: 1.1349, test_f1: 0.6065
 epoch: 49, train_loss: 0.6376, test_loss: 1.2992, test_f1: 0.5876
 epoch: 50, train_loss: 0.6287, test_loss: 1.3567, test_f1: 0.5484
 epoch: 51, train_loss: 0.5932, test_loss: 1.2178, test_f1: 0.6045
 epoch: 52, train_loss: 0.6032, test_loss: 1.1963, test_f1: 0.5829
 epoch: 53, train_loss: 0.5866, test_loss: 1.3097, test_f1: 0.5966
 epoch: 54, train_loss: 0.5465, test_loss: 1.3230, test_f1: 0.5831
 epoch: 55, train_loss: 0.5552, test_loss: 1.3622, test_f1: 0.5927
 epoch: 56, train_loss: 0.5333, test_loss: 1.5107, test_f1: 0.5559
 epoch: 57, train_loss: 0.5205, test_loss: 1.4816, test_f1: 0.5877
 epoch: 58, train_loss: 0.5065, test_loss: 1.4721, test_f1: 0.5873
 epoch: 59, train_loss: 0.5363, test_loss: 1.5088, test_f1: 0.5491
 epoch: 60, train_loss: 0.5364, test_loss: 1.4920, test_f1: 0.5898
 epoch: 61, train_loss: 0.5023, test_loss: 1.4427, test_f1: 0.5934
 epoch: 62, train_loss: 0.4919, test_loss: 1.5099, test_f1: 0.5650
 epoch: 63, train_loss: 0.4898, test_loss: 1.5470, test_f1: 0.5960
 epoch: 64, train_loss: 0.4702, test_loss: 1.5401, test_f1: 0.6161
 epoch: 65, train_loss: 0.4875, test_loss: 1.4794, test_f1: 0.5981
 epoch: 66, train_loss: 0.4907, test_loss: 1.6944, test_f1: 0.5588
 epoch: 67, train_loss: 0.4610, test_loss: 1.4774, test_f1: 0.6128
 epoch: 68, train_loss: 0.5012, test_loss: 1.5451, test_f1: 0.6138
 epoch: 69, train_loss: 0.4955, test_loss: 1.6685, test_f1: 0.6037
 epoch: 70, train_loss: 0.4925, test_loss: 1.5485, test_f1: 0.5951
 epoch: 71, train_loss: 0.5289, test_loss: 1.6134, test_f1: 0.6079
 epoch: 72, train_loss: 0.5240, test_loss: 1.5532, test_f1: 0.5756
 epoch: 73, train_loss: 0.4779, test_loss: 1.6045, test_f1: 0.5896
 epoch: 74, train_loss: 0.4865, test_loss: 1.4072, test_f1: 0.5916
 epoch: 75, train_loss: 0.4821, test_loss: 1.6976, test_f1: 0.5901
 epoch: 76, train_loss: 0.4410, test_loss: 1.6049, test_f1: 0.6030
 epoch: 77, train_loss: 0.4290, test_loss: 1.5406, test_f1: 0.6103
 epoch: 78, train_loss: 0.4578, test_loss: 1.7216, test_f1: 0.5442
 epoch: 79, train_loss: 0.4830, test_loss: 1.8672, test_f1: 0.5577
 epoch: 80, train_loss: 0.4744, test_loss: 2.0031, test_f1: 0.5690
 epoch: 81, train_loss: 0.4411, test_loss: 1.9628, test_f1: 0.5642
 epoch: 82, train_loss: 0.4346, test_loss: 1.6646, test_f1: 0.5981
 epoch: 83, train_loss: 0.3956, test_loss: 1.8643, test_f1: 0.6011
 epoch: 84, train_loss: 0.4146, test_loss: 1.8536, test_f1: 0.5699
 epoch: 85, train_loss: 0.4105, test_loss: 1.7204, test_f1: 0.5642
 epoch: 86, train_loss: 0.4217, test_loss: 1.7509, test_f1: 0.5860
 epoch: 87, train_loss: 0.3994, test_loss: 2.1257, test_f1: 0.5626
 epoch: 88, train_loss: 0.4106, test_loss: 1.8585, test_f1: 0.6220
 epoch: 89, train_loss: 0.4421, test_loss: 1.8765, test_f1: 0.5802
 epoch: 90, train_loss: 0.3946, test_loss: 1.8307, test_f1: 0.5524
 epoch: 91, train_loss: 0.3839, test_loss: 2.1760, test_f1: 0.5573
 epoch: 92, train_loss: 0.4270, test_loss: 1.8929, test_f1: 0.5523
 epoch: 93, train_loss: 0.4098, test_loss: 2.2386, test_f1: 0.6157
 epoch: 94, train_loss: 0.4306, test_loss: 1.7577, test_f1: 0.5958
 epoch: 95, train_loss: 0.3830, test_loss: 1.7602, test_f1: 0.6090
 epoch: 96, train_loss: 0.4076, test_loss: 2.2649, test_f1: 0.5580
 epoch: 97, train_loss: 0.3926, test_loss: 1.7281, test_f1: 0.5704
 epoch: 98, train_loss: 0.3946, test_loss: 2.4989, test_f1: 0.5739
 epoch: 99, train_loss: 0.3860, test_loss: 2.2293, test_f1: 0.5732
##################ITERATION #2 ****************************************
 epoch: 0, train_loss: 1.2165, test_loss: 1.4413, test_f1: 0.3090
 epoch: 1, train_loss: 1.0609, test_loss: 1.2932, test_f1: 0.3187
 epoch: 2, train_loss: 0.9947, test_loss: 1.1404, test_f1: 0.4535
 epoch: 3, train_loss: 0.9866, test_loss: 1.1451, test_f1: 0.4464
 epoch: 4, train_loss: 0.9777, test_loss: 1.1398, test_f1: 0.4808
 epoch: 5, train_loss: 0.9757, test_loss: 1.2414, test_f1: 0.4493
 epoch: 6, train_loss: 0.9366, test_loss: 1.1668, test_f1: 0.4515
 epoch: 7, train_loss: 0.9135, test_loss: 1.0593, test_f1: 0.5429
 epoch: 8, train_loss: 0.8909, test_loss: 1.0836, test_f1: 0.5423
 epoch: 9, train_loss: 0.9013, test_loss: 1.0304, test_f1: 0.5458
 epoch: 10, train_loss: 0.9002, test_loss: 1.0837, test_f1: 0.5197
 epoch: 11, train_loss: 0.8744, test_loss: 1.0753, test_f1: 0.5204
 epoch: 12, train_loss: 0.8555, test_loss: 1.1840, test_f1: 0.4473
 epoch: 13, train_loss: 0.8615, test_loss: 1.0277, test_f1: 0.5383
 epoch: 14, train_loss: 0.8351, test_loss: 1.0476, test_f1: 0.5438
 epoch: 15, train_loss: 0.8492, test_loss: 1.1946, test_f1: 0.4618
 epoch: 16, train_loss: 0.8555, test_loss: 1.0231, test_f1: 0.5432
 epoch: 17, train_loss: 0.8322, test_loss: 1.0308, test_f1: 0.5608
 epoch: 18, train_loss: 0.8023, test_loss: 1.0572, test_f1: 0.5564
 epoch: 19, train_loss: 0.8105, test_loss: 1.1136, test_f1: 0.5560
 epoch: 20, train_loss: 0.7997, test_loss: 1.0793, test_f1: 0.5580
 epoch: 21, train_loss: 0.7769, test_loss: 1.0973, test_f1: 0.5611
 epoch: 22, train_loss: 0.7909, test_loss: 1.0944, test_f1: 0.5507
 epoch: 23, train_loss: 0.8023, test_loss: 1.2474, test_f1: 0.5067
 epoch: 24, train_loss: 0.8383, test_loss: 1.0321, test_f1: 0.5456
 epoch: 25, train_loss: 0.8346, test_loss: 1.1783, test_f1: 0.5188
 epoch: 26, train_loss: 0.7969, test_loss: 1.1517, test_f1: 0.5495
 epoch: 27, train_loss: 0.7431, test_loss: 1.1686, test_f1: 0.5697
 epoch: 28, train_loss: 0.7220, test_loss: 1.0761, test_f1: 0.5713
 epoch: 29, train_loss: 0.7351, test_loss: 1.2588, test_f1: 0.5316
 epoch: 30, train_loss: 0.7172, test_loss: 1.1520, test_f1: 0.5883
 epoch: 31, train_loss: 0.7181, test_loss: 1.2112, test_f1: 0.5670
 epoch: 32, train_loss: 0.7337, test_loss: 1.1835, test_f1: 0.5476
 epoch: 33, train_loss: 0.7355, test_loss: 1.0917, test_f1: 0.5896
 epoch: 34, train_loss: 0.6940, test_loss: 1.1919, test_f1: 0.5676
 epoch: 35, train_loss: 0.6807, test_loss: 1.1524, test_f1: 0.5714
 epoch: 36, train_loss: 0.7221, test_loss: 1.1283, test_f1: 0.5173
 epoch: 37, train_loss: 0.6968, test_loss: 1.1631, test_f1: 0.6471
 epoch: 38, train_loss: 0.6725, test_loss: 1.1193, test_f1: 0.5825
 epoch: 39, train_loss: 0.6872, test_loss: 1.1390, test_f1: 0.5376
 epoch: 40, train_loss: 0.6842, test_loss: 1.3267, test_f1: 0.5664
 epoch: 41, train_loss: 0.6758, test_loss: 1.1566, test_f1: 0.5931
 epoch: 42, train_loss: 0.6845, test_loss: 1.3163, test_f1: 0.5085
 epoch: 43, train_loss: 0.6746, test_loss: 1.4818, test_f1: 0.5346
 epoch: 44, train_loss: 0.7018, test_loss: 1.1601, test_f1: 0.4812
 epoch: 45, train_loss: 0.6879, test_loss: 1.1719, test_f1: 0.6252
 epoch: 46, train_loss: 0.6618, test_loss: 1.3946, test_f1: 0.5440
 epoch: 47, train_loss: 0.6615, test_loss: 1.3793, test_f1: 0.5107
 epoch: 48, train_loss: 0.6501, test_loss: 1.2528, test_f1: 0.5805
 epoch: 49, train_loss: 0.6572, test_loss: 1.3489, test_f1: 0.5631
 epoch: 50, train_loss: 0.6552, test_loss: 1.3775, test_f1: 0.5246
 epoch: 51, train_loss: 0.6192, test_loss: 1.3715, test_f1: 0.5508
 epoch: 52, train_loss: 0.6092, test_loss: 1.2939, test_f1: 0.5802
 epoch: 53, train_loss: 0.5772, test_loss: 1.3471, test_f1: 0.5049
 epoch: 54, train_loss: 0.5677, test_loss: 1.3477, test_f1: 0.5735
 epoch: 55, train_loss: 0.5505, test_loss: 1.4330, test_f1: 0.5677
 epoch: 56, train_loss: 0.5557, test_loss: 1.4810, test_f1: 0.6041
 epoch: 57, train_loss: 0.5582, test_loss: 1.3984, test_f1: 0.5915
 epoch: 58, train_loss: 0.5481, test_loss: 1.4643, test_f1: 0.5929
 epoch: 59, train_loss: 0.5363, test_loss: 1.5353, test_f1: 0.5474
 epoch: 60, train_loss: 0.5345, test_loss: 1.5293, test_f1: 0.5764
 epoch: 61, train_loss: 0.5220, test_loss: 1.7109, test_f1: 0.5962
 epoch: 62, train_loss: 0.5200, test_loss: 1.6744, test_f1: 0.5691
 epoch: 63, train_loss: 0.5275, test_loss: 1.5087, test_f1: 0.5961
 epoch: 64, train_loss: 0.5349, test_loss: 1.5846, test_f1: 0.5521
 epoch: 65, train_loss: 0.5211, test_loss: 1.6705, test_f1: 0.5491
 epoch: 66, train_loss: 0.5607, test_loss: 1.4557, test_f1: 0.5942
 epoch: 67, train_loss: 0.5311, test_loss: 1.4670, test_f1: 0.6246
 epoch: 68, train_loss: 0.5337, test_loss: 1.7681, test_f1: 0.5890
 epoch: 69, train_loss: 0.4969, test_loss: 1.7615, test_f1: 0.5724
 epoch: 70, train_loss: 0.5032, test_loss: 1.7746, test_f1: 0.6071
 epoch: 71, train_loss: 0.4704, test_loss: 1.8275, test_f1: 0.6022
 epoch: 72, train_loss: 0.4809, test_loss: 1.5749, test_f1: 0.6135
 epoch: 73, train_loss: 0.4931, test_loss: 1.8190, test_f1: 0.5797
 epoch: 74, train_loss: 0.5370, test_loss: 1.8776, test_f1: 0.5801
 epoch: 75, train_loss: 0.5129, test_loss: 1.7088, test_f1: 0.6040
 epoch: 76, train_loss: 0.4970, test_loss: 1.5828, test_f1: 0.5493
 epoch: 77, train_loss: 0.4989, test_loss: 1.7002, test_f1: 0.6195
 epoch: 78, train_loss: 0.4742, test_loss: 1.8620, test_f1: 0.5752
 epoch: 79, train_loss: 0.4832, test_loss: 1.6972, test_f1: 0.6247
 epoch: 80, train_loss: 0.4921, test_loss: 1.6801, test_f1: 0.5763
 epoch: 81, train_loss: 0.5027, test_loss: 1.6447, test_f1: 0.6162
 epoch: 82, train_loss: 0.5159, test_loss: 1.7718, test_f1: 0.5499
 epoch: 83, train_loss: 0.5221, test_loss: 1.5567, test_f1: 0.5769
 epoch: 84, train_loss: 0.4842, test_loss: 1.4688, test_f1: 0.6231
 epoch: 85, train_loss: 0.4767, test_loss: 1.7085, test_f1: 0.5978
 epoch: 86, train_loss: 0.4906, test_loss: 1.6064, test_f1: 0.5326
 epoch: 87, train_loss: 0.4953, test_loss: 1.5823, test_f1: 0.6030
 epoch: 88, train_loss: 0.4595, test_loss: 1.6943, test_f1: 0.5556
 epoch: 89, train_loss: 0.4497, test_loss: 1.5973, test_f1: 0.6022
 epoch: 90, train_loss: 0.4566, test_loss: 1.8225, test_f1: 0.5970
 epoch: 91, train_loss: 0.4909, test_loss: 1.8063, test_f1: 0.5809
 epoch: 92, train_loss: 0.4350, test_loss: 1.8361, test_f1: 0.6039
 epoch: 93, train_loss: 0.4874, test_loss: 2.1355, test_f1: 0.5587
 epoch: 94, train_loss: 0.4549, test_loss: 1.7225, test_f1: 0.5643
 epoch: 95, train_loss: 0.5006, test_loss: 2.1684, test_f1: 0.5487
 epoch: 96, train_loss: 0.4216, test_loss: 1.9778, test_f1: 0.5479
 epoch: 97, train_loss: 0.4423, test_loss: 1.8923, test_f1: 0.6029
 epoch: 98, train_loss: 0.4274, test_loss: 1.8846, test_f1: 0.6235
 epoch: 99, train_loss: 0.4421, test_loss: 1.9273, test_f1: 0.5737
##################ITERATION #3 ****************************************
 epoch: 0, train_loss: 1.3397, test_loss: 1.3441, test_f1: 0.1365
 epoch: 1, train_loss: 1.1337, test_loss: 1.3445, test_f1: 0.1989
 epoch: 2, train_loss: 1.0674, test_loss: 1.2234, test_f1: 0.3048
 epoch: 3, train_loss: 1.0272, test_loss: 1.1034, test_f1: 0.4693
 epoch: 4, train_loss: 0.9798, test_loss: 1.0701, test_f1: 0.5220
 epoch: 5, train_loss: 0.9745, test_loss: 1.0635, test_f1: 0.5001
 epoch: 6, train_loss: 0.9598, test_loss: 1.1701, test_f1: 0.4897
 epoch: 7, train_loss: 0.9480, test_loss: 1.1425, test_f1: 0.4966
 epoch: 8, train_loss: 0.9162, test_loss: 1.0798, test_f1: 0.4946
 epoch: 9, train_loss: 0.9214, test_loss: 1.1573, test_f1: 0.4893
 epoch: 10, train_loss: 0.9042, test_loss: 1.0849, test_f1: 0.5194
 epoch: 11, train_loss: 0.8976, test_loss: 1.2011, test_f1: 0.5015
 epoch: 12, train_loss: 0.8946, test_loss: 1.2525, test_f1: 0.4836
 epoch: 13, train_loss: 0.9137, test_loss: 1.3200, test_f1: 0.3614
 epoch: 14, train_loss: 0.8891, test_loss: 1.0283, test_f1: 0.5910
 epoch: 15, train_loss: 0.8687, test_loss: 1.1448, test_f1: 0.5279
 epoch: 16, train_loss: 0.8821, test_loss: 1.0088, test_f1: 0.5718
 epoch: 17, train_loss: 0.8451, test_loss: 1.0550, test_f1: 0.5483
 epoch: 18, train_loss: 0.8372, test_loss: 1.2590, test_f1: 0.4339
 epoch: 19, train_loss: 0.8644, test_loss: 1.0777, test_f1: 0.5522
 epoch: 20, train_loss: 0.8487, test_loss: 1.0675, test_f1: 0.5374
 epoch: 21, train_loss: 0.8731, test_loss: 1.1488, test_f1: 0.5342
 epoch: 22, train_loss: 0.8840, test_loss: 1.0543, test_f1: 0.5464
 epoch: 23, train_loss: 0.8772, test_loss: 1.1074, test_f1: 0.5181
 epoch: 24, train_loss: 0.8461, test_loss: 1.0802, test_f1: 0.5775
 epoch: 25, train_loss: 0.8379, test_loss: 1.1258, test_f1: 0.5676
 epoch: 26, train_loss: 0.8552, test_loss: 1.0133, test_f1: 0.5459
 epoch: 27, train_loss: 0.8001, test_loss: 1.1919, test_f1: 0.5012
 epoch: 28, train_loss: 0.8002, test_loss: 1.0389, test_f1: 0.5620
 epoch: 29, train_loss: 0.7754, test_loss: 1.2514, test_f1: 0.4940
 epoch: 30, train_loss: 0.7569, test_loss: 1.2183, test_f1: 0.5256
 epoch: 31, train_loss: 0.7451, test_loss: 1.3514, test_f1: 0.5207
 epoch: 32, train_loss: 0.7427, test_loss: 0.9719, test_f1: 0.6355
 epoch: 33, train_loss: 0.7285, test_loss: 1.1823, test_f1: 0.5596
 epoch: 34, train_loss: 0.7210, test_loss: 1.2189, test_f1: 0.5424
 epoch: 35, train_loss: 0.7131, test_loss: 1.1687, test_f1: 0.5471
 epoch: 36, train_loss: 0.7091, test_loss: 1.0785, test_f1: 0.5815
 epoch: 37, train_loss: 0.6888, test_loss: 1.3011, test_f1: 0.5262
 epoch: 38, train_loss: 0.6826, test_loss: 1.0442, test_f1: 0.6363
 epoch: 39, train_loss: 0.6783, test_loss: 1.1120, test_f1: 0.5826
 epoch: 40, train_loss: 0.6767, test_loss: 1.2168, test_f1: 0.5342
 epoch: 41, train_loss: 0.6606, test_loss: 1.2069, test_f1: 0.5723
 epoch: 42, train_loss: 0.6610, test_loss: 1.0741, test_f1: 0.6156
 epoch: 43, train_loss: 0.6541, test_loss: 1.1012, test_f1: 0.5888
 epoch: 44, train_loss: 0.6642, test_loss: 1.3295, test_f1: 0.5609
 epoch: 45, train_loss: 0.6798, test_loss: 1.1203, test_f1: 0.6190
 epoch: 46, train_loss: 0.6689, test_loss: 1.3245, test_f1: 0.5798
 epoch: 47, train_loss: 0.6581, test_loss: 1.2562, test_f1: 0.5606
 epoch: 48, train_loss: 0.6523, test_loss: 1.1973, test_f1: 0.6206
 epoch: 49, train_loss: 0.6445, test_loss: 1.1878, test_f1: 0.5622
 epoch: 50, train_loss: 0.6152, test_loss: 1.2542, test_f1: 0.5398
 epoch: 51, train_loss: 0.6252, test_loss: 1.2401, test_f1: 0.6104
 epoch: 52, train_loss: 0.5933, test_loss: 1.1978, test_f1: 0.5684
 epoch: 53, train_loss: 0.5691, test_loss: 1.2190, test_f1: 0.6084
 epoch: 54, train_loss: 0.5365, test_loss: 1.3592, test_f1: 0.5843
 epoch: 55, train_loss: 0.5534, test_loss: 1.3002, test_f1: 0.6007
 epoch: 56, train_loss: 0.5415, test_loss: 1.2669, test_f1: 0.6053
 epoch: 57, train_loss: 0.5442, test_loss: 1.4485, test_f1: 0.5376
 epoch: 58, train_loss: 0.5080, test_loss: 1.4581, test_f1: 0.5630
 epoch: 59, train_loss: 0.5676, test_loss: 1.2658, test_f1: 0.6127
 epoch: 60, train_loss: 0.5356, test_loss: 1.3724, test_f1: 0.5888
 epoch: 61, train_loss: 0.5591, test_loss: 1.3719, test_f1: 0.5620
 epoch: 62, train_loss: 0.5187, test_loss: 1.5877, test_f1: 0.5562
 epoch: 63, train_loss: 0.5188, test_loss: 1.3953, test_f1: 0.5553
 epoch: 64, train_loss: 0.5105, test_loss: 1.3885, test_f1: 0.5695
 epoch: 65, train_loss: 0.5146, test_loss: 1.3929, test_f1: 0.6011
 epoch: 66, train_loss: 0.5341, test_loss: 1.4628, test_f1: 0.5862
 epoch: 67, train_loss: 0.5570, test_loss: 1.1598, test_f1: 0.5969
 epoch: 68, train_loss: 0.5181, test_loss: 1.5626, test_f1: 0.5817
 epoch: 69, train_loss: 0.5180, test_loss: 1.2803, test_f1: 0.6266
 epoch: 70, train_loss: 0.5154, test_loss: 1.3952, test_f1: 0.5762
 epoch: 71, train_loss: 0.4886, test_loss: 1.5584, test_f1: 0.5753
 epoch: 72, train_loss: 0.5058, test_loss: 1.5331, test_f1: 0.5783
 epoch: 73, train_loss: 0.4867, test_loss: 1.5894, test_f1: 0.5424
 epoch: 74, train_loss: 0.5076, test_loss: 1.3127, test_f1: 0.6114
 epoch: 75, train_loss: 0.4833, test_loss: 1.6054, test_f1: 0.5735
 epoch: 76, train_loss: 0.4530, test_loss: 1.4368, test_f1: 0.6037
 epoch: 77, train_loss: 0.4590, test_loss: 1.5531, test_f1: 0.5577
 epoch: 78, train_loss: 0.4880, test_loss: 1.5227, test_f1: 0.5688
 epoch: 79, train_loss: 0.4384, test_loss: 1.6557, test_f1: 0.5842
 epoch: 80, train_loss: 0.4663, test_loss: 1.5482, test_f1: 0.5994
 epoch: 81, train_loss: 0.4495, test_loss: 1.4877, test_f1: 0.6047
 epoch: 82, train_loss: 0.4973, test_loss: 1.6243, test_f1: 0.5772
 epoch: 83, train_loss: 0.4761, test_loss: 1.6932, test_f1: 0.5510
 epoch: 84, train_loss: 0.4733, test_loss: 1.5130, test_f1: 0.6403
 epoch: 85, train_loss: 0.4638, test_loss: 1.5701, test_f1: 0.5724
 epoch: 86, train_loss: 0.4471, test_loss: 1.4557, test_f1: 0.5958
 epoch: 87, train_loss: 0.4437, test_loss: 1.5831, test_f1: 0.6082
 epoch: 88, train_loss: 0.4204, test_loss: 1.7327, test_f1: 0.5896
 epoch: 89, train_loss: 0.4301, test_loss: 1.6123, test_f1: 0.5996
 epoch: 90, train_loss: 0.4417, test_loss: 2.0812, test_f1: 0.5457
 epoch: 91, train_loss: 0.4603, test_loss: 1.7543, test_f1: 0.5813
 epoch: 92, train_loss: 0.4248, test_loss: 1.7721, test_f1: 0.5605
 epoch: 93, train_loss: 0.4596, test_loss: 1.8239, test_f1: 0.5494
 epoch: 94, train_loss: 0.4626, test_loss: 1.9156, test_f1: 0.5421
 epoch: 95, train_loss: 0.4181, test_loss: 1.8103, test_f1: 0.5684
 epoch: 96, train_loss: 0.4238, test_loss: 1.7386, test_f1: 0.5952
 epoch: 97, train_loss: 0.4181, test_loss: 1.4606, test_f1: 0.6039
 epoch: 98, train_loss: 0.4460, test_loss: 1.5432, test_f1: 0.6018
 epoch: 99, train_loss: 0.3890, test_loss: 1.8169, test_f1: 0.5672
##################ITERATION #4 ****************************************
 epoch: 0, train_loss: 1.2950, test_loss: 1.4809, test_f1: 0.3269
 epoch: 1, train_loss: 1.1220, test_loss: 1.3486, test_f1: 0.3374
 epoch: 2, train_loss: 1.0600, test_loss: 1.2457, test_f1: 0.4212
 epoch: 3, train_loss: 1.0102, test_loss: 1.1613, test_f1: 0.5010
 epoch: 4, train_loss: 0.9778, test_loss: 1.0656, test_f1: 0.5068
 epoch: 5, train_loss: 0.9654, test_loss: 1.0790, test_f1: 0.4939
 epoch: 6, train_loss: 0.9599, test_loss: 1.1813, test_f1: 0.5297
 epoch: 7, train_loss: 0.9492, test_loss: 1.1881, test_f1: 0.4773
 epoch: 8, train_loss: 0.9343, test_loss: 1.1299, test_f1: 0.5412
 epoch: 9, train_loss: 0.9093, test_loss: 1.1457, test_f1: 0.5339
 epoch: 10, train_loss: 0.8836, test_loss: 1.1874, test_f1: 0.5584
 epoch: 11, train_loss: 0.9264, test_loss: 1.1019, test_f1: 0.5248
 epoch: 12, train_loss: 0.9304, test_loss: 1.1019, test_f1: 0.5009
 epoch: 13, train_loss: 0.8861, test_loss: 1.1676, test_f1: 0.5094
 epoch: 14, train_loss: 0.8893, test_loss: 1.0934, test_f1: 0.5235
 epoch: 15, train_loss: 0.8731, test_loss: 1.0461, test_f1: 0.5490
 epoch: 16, train_loss: 0.8696, test_loss: 1.2663, test_f1: 0.5124
 epoch: 17, train_loss: 0.8355, test_loss: 1.1720, test_f1: 0.5631
 epoch: 18, train_loss: 0.8482, test_loss: 1.0701, test_f1: 0.5482
 epoch: 19, train_loss: 0.8394, test_loss: 1.1369, test_f1: 0.5491
 epoch: 20, train_loss: 0.8033, test_loss: 1.2576, test_f1: 0.5032
 epoch: 21, train_loss: 0.8060, test_loss: 1.3562, test_f1: 0.5120
 epoch: 22, train_loss: 0.8186, test_loss: 1.1084, test_f1: 0.5836
 epoch: 23, train_loss: 0.8284, test_loss: 1.1165, test_f1: 0.5521
 epoch: 24, train_loss: 0.8320, test_loss: 1.1385, test_f1: 0.5165
 epoch: 25, train_loss: 0.8371, test_loss: 1.1415, test_f1: 0.5774
 epoch: 26, train_loss: 0.7782, test_loss: 1.1481, test_f1: 0.5320
 epoch: 27, train_loss: 0.7799, test_loss: 1.1040, test_f1: 0.5733
 epoch: 28, train_loss: 0.7727, test_loss: 1.0811, test_f1: 0.5370
 epoch: 29, train_loss: 0.7688, test_loss: 1.1841, test_f1: 0.5476
 epoch: 30, train_loss: 0.7448, test_loss: 1.2853, test_f1: 0.5273
 epoch: 31, train_loss: 0.7309, test_loss: 1.1966, test_f1: 0.5538
 epoch: 32, train_loss: 0.7281, test_loss: 1.2949, test_f1: 0.5395
 epoch: 33, train_loss: 0.7002, test_loss: 1.2912, test_f1: 0.5154
 epoch: 34, train_loss: 0.7093, test_loss: 1.1263, test_f1: 0.6057
 epoch: 35, train_loss: 0.6995, test_loss: 1.2384, test_f1: 0.5511
 epoch: 36, train_loss: 0.6830, test_loss: 1.2817, test_f1: 0.5636
 epoch: 37, train_loss: 0.6688, test_loss: 1.3961, test_f1: 0.5590
 epoch: 38, train_loss: 0.6838, test_loss: 1.4357, test_f1: 0.5257
 epoch: 39, train_loss: 0.7141, test_loss: 1.2011, test_f1: 0.5530
 epoch: 40, train_loss: 0.7008, test_loss: 1.2609, test_f1: 0.4763
 epoch: 41, train_loss: 0.6900, test_loss: 1.2078, test_f1: 0.5523
 epoch: 42, train_loss: 0.6587, test_loss: 1.2061, test_f1: 0.5804
 epoch: 43, train_loss: 0.6659, test_loss: 1.4860, test_f1: 0.5807
 epoch: 44, train_loss: 0.6762, test_loss: 1.3248, test_f1: 0.5655
 epoch: 45, train_loss: 0.6597, test_loss: 1.8491, test_f1: 0.4879
 epoch: 46, train_loss: 0.6620, test_loss: 1.2369, test_f1: 0.5413
 epoch: 47, train_loss: 0.6744, test_loss: 1.1954, test_f1: 0.5470
 epoch: 48, train_loss: 0.6664, test_loss: 1.3581, test_f1: 0.4666
 epoch: 49, train_loss: 0.6634, test_loss: 1.2544, test_f1: 0.5240
 epoch: 50, train_loss: 0.6691, test_loss: 1.2791, test_f1: 0.5043
 epoch: 51, train_loss: 0.6057, test_loss: 1.3035, test_f1: 0.5630
 epoch: 52, train_loss: 0.5733, test_loss: 1.3163, test_f1: 0.5556
 epoch: 53, train_loss: 0.5905, test_loss: 1.3935, test_f1: 0.5312
 epoch: 54, train_loss: 0.5872, test_loss: 1.3480, test_f1: 0.5423
 epoch: 55, train_loss: 0.5828, test_loss: 1.3665, test_f1: 0.5863
 epoch: 56, train_loss: 0.5506, test_loss: 1.3819, test_f1: 0.5652
 epoch: 57, train_loss: 0.5494, test_loss: 1.3067, test_f1: 0.5874
 epoch: 58, train_loss: 0.5464, test_loss: 1.3344, test_f1: 0.6149
 epoch: 59, train_loss: 0.5373, test_loss: 1.5128, test_f1: 0.5164
 epoch: 60, train_loss: 0.5552, test_loss: 1.5830, test_f1: 0.5221
 epoch: 61, train_loss: 0.5511, test_loss: 1.2597, test_f1: 0.5398
 epoch: 62, train_loss: 0.5437, test_loss: 1.5267, test_f1: 0.5325
 epoch: 63, train_loss: 0.5706, test_loss: 1.5384, test_f1: 0.5816
 epoch: 64, train_loss: 0.5413, test_loss: 1.3585, test_f1: 0.5718
 epoch: 65, train_loss: 0.5313, test_loss: 1.4788, test_f1: 0.5949
 epoch: 66, train_loss: 0.5151, test_loss: 1.3938, test_f1: 0.5830
 epoch: 67, train_loss: 0.5031, test_loss: 1.6805, test_f1: 0.5333
 epoch: 68, train_loss: 0.4989, test_loss: 1.4103, test_f1: 0.5633
 epoch: 69, train_loss: 0.5063, test_loss: 1.5603, test_f1: 0.6157
 epoch: 70, train_loss: 0.5223, test_loss: 1.5832, test_f1: 0.5498
 epoch: 71, train_loss: 0.5101, test_loss: 1.3544, test_f1: 0.5975
 epoch: 72, train_loss: 0.5058, test_loss: 1.5784, test_f1: 0.5862
 epoch: 73, train_loss: 0.5111, test_loss: 1.4278, test_f1: 0.5468
 epoch: 74, train_loss: 0.4872, test_loss: 1.4852, test_f1: 0.6149
 epoch: 75, train_loss: 0.4771, test_loss: 1.5368, test_f1: 0.5750
 epoch: 76, train_loss: 0.4806, test_loss: 1.5351, test_f1: 0.5768
 epoch: 77, train_loss: 0.5004, test_loss: 1.4928, test_f1: 0.5275
 epoch: 78, train_loss: 0.5185, test_loss: 1.7488, test_f1: 0.5443
 epoch: 79, train_loss: 0.5044, test_loss: 1.3520, test_f1: 0.6302
 epoch: 80, train_loss: 0.4664, test_loss: 1.4096, test_f1: 0.5590
 epoch: 81, train_loss: 0.4705, test_loss: 1.7802, test_f1: 0.5436
 epoch: 82, train_loss: 0.4644, test_loss: 1.5607, test_f1: 0.5140
 epoch: 83, train_loss: 0.4664, test_loss: 1.7974, test_f1: 0.6002
 epoch: 84, train_loss: 0.4409, test_loss: 1.6388, test_f1: 0.5447
 epoch: 85, train_loss: 0.4673, test_loss: 1.7031, test_f1: 0.5257
 epoch: 86, train_loss: 0.4491, test_loss: 1.5998, test_f1: 0.5535
 epoch: 87, train_loss: 0.5075, test_loss: 1.5538, test_f1: 0.5693
 epoch: 88, train_loss: 0.4366, test_loss: 1.4972, test_f1: 0.5852
 epoch: 89, train_loss: 0.4302, test_loss: 1.7381, test_f1: 0.6183
 epoch: 90, train_loss: 0.4459, test_loss: 1.5993, test_f1: 0.5490
 epoch: 91, train_loss: 0.4441, test_loss: 1.6784, test_f1: 0.6228
 epoch: 92, train_loss: 0.4286, test_loss: 1.7971, test_f1: 0.6128
 epoch: 93, train_loss: 0.4185, test_loss: 1.7979, test_f1: 0.5076
 epoch: 94, train_loss: 0.4395, test_loss: 1.6901, test_f1: 0.5910
 epoch: 95, train_loss: 0.4124, test_loss: 1.6997, test_f1: 0.5569
 epoch: 96, train_loss: 0.4981, test_loss: 2.1798, test_f1: 0.5605
 epoch: 97, train_loss: 0.4714, test_loss: 1.6378, test_f1: 0.5940
 epoch: 98, train_loss: 0.4646, test_loss: 1.9135, test_f1: 0.6005
 epoch: 99, train_loss: 0.4200, test_loss: 1.8611, test_f1: 0.5074
##################ITERATION #5 ****************************************
 epoch: 0, train_loss: 1.4056, test_loss: 1.4651, test_f1: 0.2140
 epoch: 1, train_loss: 1.0595, test_loss: 1.3315, test_f1: 0.2314
 epoch: 2, train_loss: 1.0072, test_loss: 1.1740, test_f1: 0.4473
 epoch: 3, train_loss: 0.9893, test_loss: 1.3624, test_f1: 0.3822
 epoch: 4, train_loss: 0.9733, test_loss: 1.1395, test_f1: 0.5028
 epoch: 5, train_loss: 0.9651, test_loss: 1.4638, test_f1: 0.4334
 epoch: 6, train_loss: 0.9589, test_loss: 1.2302, test_f1: 0.3758
 epoch: 7, train_loss: 0.9214, test_loss: 1.0751, test_f1: 0.5108
 epoch: 8, train_loss: 0.9441, test_loss: 1.2235, test_f1: 0.4675
 epoch: 9, train_loss: 0.9255, test_loss: 1.3467, test_f1: 0.4037
 epoch: 10, train_loss: 0.9162, test_loss: 1.1205, test_f1: 0.4791
 epoch: 11, train_loss: 0.9088, test_loss: 1.4050, test_f1: 0.4216
 epoch: 12, train_loss: 0.9159, test_loss: 1.0778, test_f1: 0.5166
 epoch: 13, train_loss: 0.8824, test_loss: 1.1522, test_f1: 0.5215
 epoch: 14, train_loss: 0.8986, test_loss: 1.1435, test_f1: 0.4842
 epoch: 15, train_loss: 0.9122, test_loss: 1.1443, test_f1: 0.5314
 epoch: 16, train_loss: 0.8816, test_loss: 1.0701, test_f1: 0.4811
 epoch: 17, train_loss: 0.8929, test_loss: 1.0834, test_f1: 0.5296
 epoch: 18, train_loss: 0.8773, test_loss: 1.3506, test_f1: 0.4215
 epoch: 19, train_loss: 0.8776, test_loss: 1.1331, test_f1: 0.5548
 epoch: 20, train_loss: 0.8595, test_loss: 1.1134, test_f1: 0.5221
 epoch: 21, train_loss: 0.8597, test_loss: 1.1625, test_f1: 0.4780
 epoch: 22, train_loss: 0.8676, test_loss: 1.0407, test_f1: 0.5614
 epoch: 23, train_loss: 0.8767, test_loss: 1.1500, test_f1: 0.5474
 epoch: 24, train_loss: 0.8560, test_loss: 1.0991, test_f1: 0.5349
 epoch: 25, train_loss: 0.8594, test_loss: 1.3082, test_f1: 0.4626
 epoch: 26, train_loss: 0.8461, test_loss: 1.3476, test_f1: 0.4513
 epoch: 27, train_loss: 0.8373, test_loss: 1.0883, test_f1: 0.5323
 epoch: 28, train_loss: 0.8337, test_loss: 1.1945, test_f1: 0.5316
 epoch: 29, train_loss: 0.8168, test_loss: 1.2184, test_f1: 0.5234
 epoch: 30, train_loss: 0.8123, test_loss: 1.2445, test_f1: 0.5352
 epoch: 31, train_loss: 0.7949, test_loss: 1.2714, test_f1: 0.5238
 epoch: 32, train_loss: 0.8129, test_loss: 1.2711, test_f1: 0.5239
 epoch: 33, train_loss: 0.8576, test_loss: 1.5750, test_f1: 0.4279
 epoch: 34, train_loss: 0.8593, test_loss: 1.2249, test_f1: 0.5181
 epoch: 35, train_loss: 0.8265, test_loss: 1.1272, test_f1: 0.5438
 epoch: 36, train_loss: 0.8097, test_loss: 1.1849, test_f1: 0.5107
 epoch: 37, train_loss: 0.7966, test_loss: 1.3521, test_f1: 0.5070
 epoch: 38, train_loss: 0.7797, test_loss: 1.2445, test_f1: 0.4721
 epoch: 39, train_loss: 0.7918, test_loss: 1.0529, test_f1: 0.5658
 epoch: 40, train_loss: 0.7393, test_loss: 1.2158, test_f1: 0.5416
 epoch: 41, train_loss: 0.7723, test_loss: 1.2137, test_f1: 0.5638
 epoch: 42, train_loss: 0.7639, test_loss: 1.2603, test_f1: 0.4787
 epoch: 43, train_loss: 0.7791, test_loss: 1.2255, test_f1: 0.5102
 epoch: 44, train_loss: 0.7626, test_loss: 1.1338, test_f1: 0.5632
 epoch: 45, train_loss: 0.7298, test_loss: 1.2054, test_f1: 0.5432
 epoch: 46, train_loss: 0.7282, test_loss: 1.1880, test_f1: 0.4961
 epoch: 47, train_loss: 0.7310, test_loss: 1.4146, test_f1: 0.4563
 epoch: 48, train_loss: 0.6974, test_loss: 1.2957, test_f1: 0.5614
 epoch: 49, train_loss: 0.7332, test_loss: 1.3356, test_f1: 0.5132
 epoch: 50, train_loss: 0.7062, test_loss: 1.1943, test_f1: 0.5719
 epoch: 51, train_loss: 0.7088, test_loss: 1.1843, test_f1: 0.5229
 epoch: 52, train_loss: 0.6711, test_loss: 1.2798, test_f1: 0.5483
 epoch: 53, train_loss: 0.6750, test_loss: 1.2109, test_f1: 0.5069
 epoch: 54, train_loss: 0.6527, test_loss: 1.3621, test_f1: 0.5142
 epoch: 55, train_loss: 0.6376, test_loss: 1.3095, test_f1: 0.5518
 epoch: 56, train_loss: 0.6208, test_loss: 1.2927, test_f1: 0.5315
 epoch: 57, train_loss: 0.6420, test_loss: 1.3776, test_f1: 0.5442
 epoch: 58, train_loss: 0.6359, test_loss: 1.4384, test_f1: 0.5017
 epoch: 59, train_loss: 0.6202, test_loss: 1.4530, test_f1: 0.5376
 epoch: 60, train_loss: 0.6214, test_loss: 1.4102, test_f1: 0.5276
 epoch: 61, train_loss: 0.6282, test_loss: 1.4445, test_f1: 0.5415
 epoch: 62, train_loss: 0.5979, test_loss: 1.5595, test_f1: 0.5100
 epoch: 63, train_loss: 0.6160, test_loss: 1.4748, test_f1: 0.5148
 epoch: 64, train_loss: 0.5931, test_loss: 1.4837, test_f1: 0.4926
 epoch: 65, train_loss: 0.6303, test_loss: 1.5884, test_f1: 0.5274
 epoch: 66, train_loss: 0.5989, test_loss: 1.4997, test_f1: 0.5457
 epoch: 67, train_loss: 0.5837, test_loss: 1.3704, test_f1: 0.5461
 epoch: 68, train_loss: 0.5876, test_loss: 1.4647, test_f1: 0.5629
 epoch: 69, train_loss: 0.6009, test_loss: 1.5848, test_f1: 0.5220
 epoch: 70, train_loss: 0.5993, test_loss: 1.5562, test_f1: 0.5334
 epoch: 71, train_loss: 0.5795, test_loss: 1.4757, test_f1: 0.5105
 epoch: 72, train_loss: 0.5852, test_loss: 1.4474, test_f1: 0.5273
 epoch: 73, train_loss: 0.5685, test_loss: 1.5144, test_f1: 0.5265
 epoch: 74, train_loss: 0.5578, test_loss: 1.5343, test_f1: 0.5118
 epoch: 75, train_loss: 0.5648, test_loss: 1.6736, test_f1: 0.5178
 epoch: 76, train_loss: 0.5504, test_loss: 1.6049, test_f1: 0.5508
 epoch: 77, train_loss: 0.5340, test_loss: 1.6121, test_f1: 0.5568
 epoch: 78, train_loss: 0.5561, test_loss: 1.7690, test_f1: 0.5486
 epoch: 79, train_loss: 0.5295, test_loss: 1.6378, test_f1: 0.5574
 epoch: 80, train_loss: 0.5509, test_loss: 1.6037, test_f1: 0.5366
 epoch: 81, train_loss: 0.5475, test_loss: 1.6618, test_f1: 0.5331
 epoch: 82, train_loss: 0.5493, test_loss: 1.6445, test_f1: 0.5200
 epoch: 83, train_loss: 0.5638, test_loss: 1.6662, test_f1: 0.5257
 epoch: 84, train_loss: 0.5563, test_loss: 1.7044, test_f1: 0.5445
 epoch: 85, train_loss: 0.5186, test_loss: 1.7552, test_f1: 0.5311
 epoch: 86, train_loss: 0.5694, test_loss: 1.6281, test_f1: 0.4719
 epoch: 87, train_loss: 0.5569, test_loss: 1.5591, test_f1: 0.5523
 epoch: 88, train_loss: 0.5377, test_loss: 1.5713, test_f1: 0.5403
 epoch: 89, train_loss: 0.5430, test_loss: 1.4850, test_f1: 0.5627
 epoch: 90, train_loss: 0.5183, test_loss: 1.6959, test_f1: 0.5441
 epoch: 91, train_loss: 0.5239, test_loss: 1.7284, test_f1: 0.5439
 epoch: 92, train_loss: 0.5048, test_loss: 1.7389, test_f1: 0.5536
 epoch: 93, train_loss: 0.4957, test_loss: 1.7076, test_f1: 0.5491
 epoch: 94, train_loss: 0.4850, test_loss: 1.8354, test_f1: 0.5425
 epoch: 95, train_loss: 0.4845, test_loss: 1.9699, test_f1: 0.4577
 epoch: 96, train_loss: 0.5659, test_loss: 1.6574, test_f1: 0.5299
 epoch: 97, train_loss: 0.5089, test_loss: 1.8152, test_f1: 0.5313
 epoch: 98, train_loss: 0.5063, test_loss: 1.7256, test_f1: 0.5585
 epoch: 99, train_loss: 0.5413, test_loss: 1.9703, test_f1: 0.4861
##################ITERATION #6 ****************************************
 epoch: 0, train_loss: 1.2607, test_loss: 1.3944, test_f1: 0.1671
 epoch: 1, train_loss: 1.0957, test_loss: 1.2796, test_f1: 0.3299
 epoch: 2, train_loss: 1.0292, test_loss: 1.1750, test_f1: 0.3851
 epoch: 3, train_loss: 0.9977, test_loss: 1.1273, test_f1: 0.4844
 epoch: 4, train_loss: 0.9819, test_loss: 1.1281, test_f1: 0.4962
 epoch: 5, train_loss: 0.9702, test_loss: 1.0750, test_f1: 0.5141
 epoch: 6, train_loss: 0.9478, test_loss: 1.1569, test_f1: 0.5062
 epoch: 7, train_loss: 0.9153, test_loss: 1.1275, test_f1: 0.4825
 epoch: 8, train_loss: 0.9173, test_loss: 1.1618, test_f1: 0.4907
 epoch: 9, train_loss: 0.9314, test_loss: 1.1198, test_f1: 0.5246
 epoch: 10, train_loss: 0.9256, test_loss: 1.1066, test_f1: 0.4945
 epoch: 11, train_loss: 0.9357, test_loss: 1.0833, test_f1: 0.5470
 epoch: 12, train_loss: 0.9206, test_loss: 1.1050, test_f1: 0.5129
 epoch: 13, train_loss: 0.9094, test_loss: 1.0801, test_f1: 0.5009
 epoch: 14, train_loss: 0.9603, test_loss: 1.1029, test_f1: 0.5256
 epoch: 15, train_loss: 0.9253, test_loss: 1.0633, test_f1: 0.5477
 epoch: 16, train_loss: 0.9282, test_loss: 1.2727, test_f1: 0.5176
 epoch: 17, train_loss: 0.9197, test_loss: 0.9960, test_f1: 0.5788
 epoch: 18, train_loss: 0.8846, test_loss: 1.1056, test_f1: 0.4924
 epoch: 19, train_loss: 0.8532, test_loss: 1.0436, test_f1: 0.5311
 epoch: 20, train_loss: 0.8761, test_loss: 1.1733, test_f1: 0.5214
 epoch: 21, train_loss: 0.8748, test_loss: 1.0969, test_f1: 0.5179
 epoch: 22, train_loss: 0.8608, test_loss: 1.0914, test_f1: 0.4983
 epoch: 23, train_loss: 0.8450, test_loss: 1.0712, test_f1: 0.5718
 epoch: 24, train_loss: 0.8479, test_loss: 1.1056, test_f1: 0.5445
 epoch: 25, train_loss: 0.8549, test_loss: 1.0774, test_f1: 0.4793
 epoch: 26, train_loss: 0.8136, test_loss: 1.0251, test_f1: 0.5266
 epoch: 27, train_loss: 0.8226, test_loss: 1.0488, test_f1: 0.5674
 epoch: 28, train_loss: 0.8020, test_loss: 1.0523, test_f1: 0.5448
 epoch: 29, train_loss: 0.8022, test_loss: 1.1148, test_f1: 0.5793
 epoch: 30, train_loss: 0.7806, test_loss: 1.1234, test_f1: 0.5778
 epoch: 31, train_loss: 0.7991, test_loss: 1.1076, test_f1: 0.5694
 epoch: 32, train_loss: 0.7890, test_loss: 1.1577, test_f1: 0.5207
 epoch: 33, train_loss: 0.7523, test_loss: 1.1050, test_f1: 0.5386
 epoch: 34, train_loss: 0.7596, test_loss: 1.1606, test_f1: 0.4728
 epoch: 35, train_loss: 0.7389, test_loss: 1.1194, test_f1: 0.5418
 epoch: 36, train_loss: 0.7400, test_loss: 1.1587, test_f1: 0.5181
 epoch: 37, train_loss: 0.7065, test_loss: 1.2048, test_f1: 0.5472
 epoch: 38, train_loss: 0.7004, test_loss: 1.1841, test_f1: 0.5900
 epoch: 39, train_loss: 0.7325, test_loss: 1.2705, test_f1: 0.5382
 epoch: 40, train_loss: 0.7421, test_loss: 1.1151, test_f1: 0.5481
 epoch: 41, train_loss: 0.7016, test_loss: 1.0664, test_f1: 0.6190
 epoch: 42, train_loss: 0.7148, test_loss: 1.1442, test_f1: 0.5342
 epoch: 43, train_loss: 0.7231, test_loss: 1.1585, test_f1: 0.5823
 epoch: 44, train_loss: 0.7083, test_loss: 1.2353, test_f1: 0.5652
 epoch: 45, train_loss: 0.6818, test_loss: 1.1374, test_f1: 0.5586
 epoch: 46, train_loss: 0.6805, test_loss: 1.1830, test_f1: 0.5739
 epoch: 47, train_loss: 0.6808, test_loss: 1.1796, test_f1: 0.5684
 epoch: 48, train_loss: 0.7053, test_loss: 1.6146, test_f1: 0.4058
 epoch: 49, train_loss: 0.6733, test_loss: 1.1492, test_f1: 0.5488
 epoch: 50, train_loss: 0.6650, test_loss: 1.3040, test_f1: 0.4891
 epoch: 51, train_loss: 0.6258, test_loss: 1.2661, test_f1: 0.5595
 epoch: 52, train_loss: 0.5963, test_loss: 1.2380, test_f1: 0.5778
 epoch: 53, train_loss: 0.5597, test_loss: 1.1849, test_f1: 0.5959
 epoch: 54, train_loss: 0.5773, test_loss: 1.3154, test_f1: 0.5405
 epoch: 55, train_loss: 0.5752, test_loss: 1.1976, test_f1: 0.5865
 epoch: 56, train_loss: 0.5826, test_loss: 1.2582, test_f1: 0.5834
 epoch: 57, train_loss: 0.5431, test_loss: 1.2962, test_f1: 0.5872
 epoch: 58, train_loss: 0.5541, test_loss: 1.3370, test_f1: 0.5544
 epoch: 59, train_loss: 0.5485, test_loss: 1.3223, test_f1: 0.5305
 epoch: 60, train_loss: 0.5466, test_loss: 1.3925, test_f1: 0.5781
 epoch: 61, train_loss: 0.5300, test_loss: 1.1944, test_f1: 0.6020
 epoch: 62, train_loss: 0.5496, test_loss: 1.3981, test_f1: 0.6062
 epoch: 63, train_loss: 0.5836, test_loss: 1.1809, test_f1: 0.6187
 epoch: 64, train_loss: 0.5388, test_loss: 1.2951, test_f1: 0.5547
 epoch: 65, train_loss: 0.5292, test_loss: 1.4946, test_f1: 0.5810
 epoch: 66, train_loss: 0.5350, test_loss: 1.2513, test_f1: 0.6245
 epoch: 67, train_loss: 0.5193, test_loss: 1.3982, test_f1: 0.5413
 epoch: 68, train_loss: 0.5192, test_loss: 1.3679, test_f1: 0.5925
 epoch: 69, train_loss: 0.5324, test_loss: 1.2632, test_f1: 0.6191
 epoch: 70, train_loss: 0.5460, test_loss: 1.3691, test_f1: 0.5685
 epoch: 71, train_loss: 0.5309, test_loss: 1.3061, test_f1: 0.6043
 epoch: 72, train_loss: 0.5222, test_loss: 1.3082, test_f1: 0.5892
 epoch: 73, train_loss: 0.5079, test_loss: 1.3164, test_f1: 0.5472
 epoch: 74, train_loss: 0.4925, test_loss: 1.4699, test_f1: 0.5748
 epoch: 75, train_loss: 0.5078, test_loss: 1.4182, test_f1: 0.5904
 epoch: 76, train_loss: 0.5036, test_loss: 1.4495, test_f1: 0.5524
 epoch: 77, train_loss: 0.5119, test_loss: 1.2601, test_f1: 0.6009
 epoch: 78, train_loss: 0.5038, test_loss: 1.3069, test_f1: 0.5597
 epoch: 79, train_loss: 0.4950, test_loss: 1.4898, test_f1: 0.5645
 epoch: 80, train_loss: 0.4831, test_loss: 1.5765, test_f1: 0.5465
 epoch: 81, train_loss: 0.5005, test_loss: 1.3838, test_f1: 0.5895
 epoch: 82, train_loss: 0.5440, test_loss: 1.2438, test_f1: 0.5719
 epoch: 83, train_loss: 0.5058, test_loss: 1.1253, test_f1: 0.6173
 epoch: 84, train_loss: 0.4774, test_loss: 1.3512, test_f1: 0.5948
 epoch: 85, train_loss: 0.4806, test_loss: 1.4230, test_f1: 0.5873
 epoch: 86, train_loss: 0.4754, test_loss: 1.2742, test_f1: 0.6371
 epoch: 87, train_loss: 0.4922, test_loss: 1.2926, test_f1: 0.5742
 epoch: 88, train_loss: 0.4597, test_loss: 1.8034, test_f1: 0.5823
 epoch: 89, train_loss: 0.4958, test_loss: 1.3047, test_f1: 0.5853
 epoch: 90, train_loss: 0.4588, test_loss: 1.3356, test_f1: 0.5679
 epoch: 91, train_loss: 0.4830, test_loss: 1.3440, test_f1: 0.5968
 epoch: 92, train_loss: 0.4810, test_loss: 1.3237, test_f1: 0.6162
 epoch: 93, train_loss: 0.4756, test_loss: 1.6576, test_f1: 0.5540
 epoch: 94, train_loss: 0.4742, test_loss: 1.4986, test_f1: 0.5747
 epoch: 95, train_loss: 0.4989, test_loss: 1.5453, test_f1: 0.6047
 epoch: 96, train_loss: 0.4764, test_loss: 1.5494, test_f1: 0.5763
 epoch: 97, train_loss: 0.4517, test_loss: 1.5362, test_f1: 0.5891
 epoch: 98, train_loss: 0.4267, test_loss: 1.4771, test_f1: 0.5875
 epoch: 99, train_loss: 0.4653, test_loss: 1.3925, test_f1: 0.6333
##################ITERATION #7 ****************************************
 epoch: 0, train_loss: 1.2789, test_loss: 1.3378, test_f1: 0.3235
 epoch: 1, train_loss: 1.1080, test_loss: 1.4161, test_f1: 0.3201
 epoch: 2, train_loss: 1.0436, test_loss: 1.2138, test_f1: 0.3953
 epoch: 3, train_loss: 1.0306, test_loss: 1.1018, test_f1: 0.4781
 epoch: 4, train_loss: 0.9937, test_loss: 1.1392, test_f1: 0.4980
 epoch: 5, train_loss: 0.9609, test_loss: 1.1565, test_f1: 0.4219
 epoch: 6, train_loss: 0.9623, test_loss: 1.1137, test_f1: 0.4888
 epoch: 7, train_loss: 0.9551, test_loss: 1.0416, test_f1: 0.5564
 epoch: 8, train_loss: 0.9348, test_loss: 1.0882, test_f1: 0.4905
 epoch: 9, train_loss: 0.9228, test_loss: 1.0184, test_f1: 0.5124
 epoch: 10, train_loss: 0.9313, test_loss: 1.2194, test_f1: 0.4767
 epoch: 11, train_loss: 0.9237, test_loss: 1.0738, test_f1: 0.4655
 epoch: 12, train_loss: 0.9079, test_loss: 1.0262, test_f1: 0.5454
 epoch: 13, train_loss: 0.8903, test_loss: 1.0530, test_f1: 0.5507
 epoch: 14, train_loss: 0.8852, test_loss: 1.1592, test_f1: 0.4748
 epoch: 15, train_loss: 0.8807, test_loss: 0.9656, test_f1: 0.5653
 epoch: 16, train_loss: 0.8719, test_loss: 1.1667, test_f1: 0.4736
 epoch: 17, train_loss: 0.8594, test_loss: 1.0124, test_f1: 0.5659
 epoch: 18, train_loss: 0.8335, test_loss: 1.0969, test_f1: 0.4986
 epoch: 19, train_loss: 0.8433, test_loss: 1.0095, test_f1: 0.5344
 epoch: 20, train_loss: 0.8547, test_loss: 1.1465, test_f1: 0.5673
 epoch: 21, train_loss: 0.8505, test_loss: 1.1589, test_f1: 0.5500
 epoch: 22, train_loss: 0.8445, test_loss: 1.0120, test_f1: 0.5531
 epoch: 23, train_loss: 0.8235, test_loss: 1.0375, test_f1: 0.5717
 epoch: 24, train_loss: 0.8534, test_loss: 2.0653, test_f1: 0.3276
 epoch: 25, train_loss: 0.8471, test_loss: 0.9407, test_f1: 0.6057
 epoch: 26, train_loss: 0.8374, test_loss: 1.0257, test_f1: 0.5296
 epoch: 27, train_loss: 0.8046, test_loss: 0.9974, test_f1: 0.5519
 epoch: 28, train_loss: 0.8153, test_loss: 0.9432, test_f1: 0.6350
 epoch: 29, train_loss: 0.7969, test_loss: 1.0365, test_f1: 0.6113
 epoch: 30, train_loss: 0.7950, test_loss: 1.1883, test_f1: 0.5183
 epoch: 31, train_loss: 0.7967, test_loss: 1.0857, test_f1: 0.5596
 epoch: 32, train_loss: 0.7842, test_loss: 1.3038, test_f1: 0.5164
 epoch: 33, train_loss: 0.7820, test_loss: 0.9990, test_f1: 0.5654
 epoch: 34, train_loss: 0.8069, test_loss: 1.1416, test_f1: 0.5120
 epoch: 35, train_loss: 0.8040, test_loss: 1.3775, test_f1: 0.5049
 epoch: 36, train_loss: 0.8152, test_loss: 1.1352, test_f1: 0.5151
 epoch: 37, train_loss: 0.7615, test_loss: 1.0700, test_f1: 0.5679
 epoch: 38, train_loss: 0.7608, test_loss: 1.1744, test_f1: 0.5433
 epoch: 39, train_loss: 0.7691, test_loss: 1.7543, test_f1: 0.3265
 epoch: 40, train_loss: 0.7418, test_loss: 1.1242, test_f1: 0.5646
 epoch: 41, train_loss: 0.7477, test_loss: 1.1430, test_f1: 0.5468
 epoch: 42, train_loss: 0.7345, test_loss: 1.1678, test_f1: 0.5828
 epoch: 43, train_loss: 0.7169, test_loss: 1.2625, test_f1: 0.5598
 epoch: 44, train_loss: 0.7671, test_loss: 1.0789, test_f1: 0.5710
 epoch: 45, train_loss: 0.7296, test_loss: 1.0455, test_f1: 0.5969
 epoch: 46, train_loss: 0.7244, test_loss: 1.2140, test_f1: 0.5146
 epoch: 47, train_loss: 0.7265, test_loss: 1.1319, test_f1: 0.6083
 epoch: 48, train_loss: 0.7114, test_loss: 1.1760, test_f1: 0.5651
 epoch: 49, train_loss: 0.8054, test_loss: 1.1968, test_f1: 0.5434
 epoch: 50, train_loss: 0.7495, test_loss: 1.2106, test_f1: 0.5708
 epoch: 51, train_loss: 0.6997, test_loss: 1.1666, test_f1: 0.5801
 epoch: 52, train_loss: 0.6788, test_loss: 1.0756, test_f1: 0.6105
 epoch: 53, train_loss: 0.6638, test_loss: 1.1160, test_f1: 0.6004
 epoch: 54, train_loss: 0.6533, test_loss: 1.0758, test_f1: 0.6133
 epoch: 55, train_loss: 0.6474, test_loss: 1.1766, test_f1: 0.5814
 epoch: 56, train_loss: 0.6438, test_loss: 1.2865, test_f1: 0.5765
 epoch: 57, train_loss: 0.6380, test_loss: 1.1483, test_f1: 0.5987
 epoch: 58, train_loss: 0.6234, test_loss: 1.1403, test_f1: 0.5748
 epoch: 59, train_loss: 0.6142, test_loss: 1.2059, test_f1: 0.5937
 epoch: 60, train_loss: 0.5995, test_loss: 1.2838, test_f1: 0.6094
 epoch: 61, train_loss: 0.6004, test_loss: 1.2305, test_f1: 0.6006
 epoch: 62, train_loss: 0.6228, test_loss: 1.1407, test_f1: 0.6565
 epoch: 63, train_loss: 0.5824, test_loss: 1.2317, test_f1: 0.6118
 epoch: 64, train_loss: 0.5923, test_loss: 1.2580, test_f1: 0.5957
 epoch: 65, train_loss: 0.5921, test_loss: 1.2663, test_f1: 0.5838
 epoch: 66, train_loss: 0.5930, test_loss: 1.2499, test_f1: 0.5196
 epoch: 67, train_loss: 0.5803, test_loss: 1.2039, test_f1: 0.6109
 epoch: 68, train_loss: 0.5774, test_loss: 1.3443, test_f1: 0.6102
 epoch: 69, train_loss: 0.6196, test_loss: 1.3672, test_f1: 0.5941
 epoch: 70, train_loss: 0.5976, test_loss: 1.6051, test_f1: 0.4319
 epoch: 71, train_loss: 0.5880, test_loss: 1.2435, test_f1: 0.6549
 epoch: 72, train_loss: 0.5929, test_loss: 1.2486, test_f1: 0.6118
 epoch: 73, train_loss: 0.5684, test_loss: 1.2084, test_f1: 0.6144
 epoch: 74, train_loss: 0.5558, test_loss: 1.3234, test_f1: 0.6064
 epoch: 75, train_loss: 0.5645, test_loss: 1.3906, test_f1: 0.5932
 epoch: 76, train_loss: 0.5799, test_loss: 1.6503, test_f1: 0.5809
 epoch: 77, train_loss: 0.5653, test_loss: 1.2288, test_f1: 0.6194
 epoch: 78, train_loss: 0.5805, test_loss: 1.2362, test_f1: 0.5970
 epoch: 79, train_loss: 0.5435, test_loss: 1.4091, test_f1: 0.5738
 epoch: 80, train_loss: 0.5189, test_loss: 1.3898, test_f1: 0.6107
 epoch: 81, train_loss: 0.5238, test_loss: 1.3445, test_f1: 0.6181
 epoch: 82, train_loss: 0.5201, test_loss: 1.4268, test_f1: 0.5812
 epoch: 83, train_loss: 0.5364, test_loss: 1.2819, test_f1: 0.6007
 epoch: 84, train_loss: 0.5564, test_loss: 1.3485, test_f1: 0.6126
 epoch: 85, train_loss: 0.5195, test_loss: 1.5078, test_f1: 0.6040
 epoch: 86, train_loss: 0.5491, test_loss: 1.5449, test_f1: 0.5704
 epoch: 87, train_loss: 0.5200, test_loss: 1.4708, test_f1: 0.5758
 epoch: 88, train_loss: 0.5209, test_loss: 1.3583, test_f1: 0.5884
 epoch: 89, train_loss: 0.5279, test_loss: 1.5430, test_f1: 0.5992
 epoch: 90, train_loss: 0.5382, test_loss: 1.5483, test_f1: 0.5922
 epoch: 91, train_loss: 0.5237, test_loss: 1.4067, test_f1: 0.5712
 epoch: 92, train_loss: 0.5141, test_loss: 1.6440, test_f1: 0.5857
 epoch: 93, train_loss: 0.4703, test_loss: 1.4332, test_f1: 0.5970
 epoch: 94, train_loss: 0.4903, test_loss: 1.8214, test_f1: 0.6110
 epoch: 95, train_loss: 0.5070, test_loss: 1.3904, test_f1: 0.5785
 epoch: 96, train_loss: 0.5305, test_loss: 1.4650, test_f1: 0.6070
 epoch: 97, train_loss: 0.5021, test_loss: 1.4841, test_f1: 0.5755
 epoch: 98, train_loss: 0.5009, test_loss: 1.6423, test_f1: 0.5562
 epoch: 99, train_loss: 0.4847, test_loss: 1.4837, test_f1: 0.5883
##################ITERATION #8 ****************************************
 epoch: 0, train_loss: 1.2902, test_loss: 1.6534, test_f1: 0.2825
 epoch: 1, train_loss: 1.0802, test_loss: 1.3640, test_f1: 0.3219
 epoch: 2, train_loss: 1.0148, test_loss: 1.1244, test_f1: 0.4345
 epoch: 3, train_loss: 0.9892, test_loss: 1.1573, test_f1: 0.4690
 epoch: 4, train_loss: 0.9612, test_loss: 1.1527, test_f1: 0.4714
 epoch: 5, train_loss: 0.9360, test_loss: 1.1678, test_f1: 0.4630
 epoch: 6, train_loss: 0.9327, test_loss: 1.1122, test_f1: 0.5047
 epoch: 7, train_loss: 0.8896, test_loss: 1.0874, test_f1: 0.5334
 epoch: 8, train_loss: 0.8896, test_loss: 1.1703, test_f1: 0.4949
 epoch: 9, train_loss: 0.9265, test_loss: 1.1673, test_f1: 0.5454
 epoch: 10, train_loss: 0.8881, test_loss: 1.1744, test_f1: 0.4985
 epoch: 11, train_loss: 0.8963, test_loss: 1.2754, test_f1: 0.5013
 epoch: 12, train_loss: 0.8889, test_loss: 1.0572, test_f1: 0.5549
 epoch: 13, train_loss: 0.8975, test_loss: 1.0960, test_f1: 0.5507
 epoch: 14, train_loss: 0.8627, test_loss: 1.1923, test_f1: 0.5049
 epoch: 15, train_loss: 0.8629, test_loss: 1.2722, test_f1: 0.5023
 epoch: 16, train_loss: 0.8637, test_loss: 1.1120, test_f1: 0.5863
 epoch: 17, train_loss: 0.8531, test_loss: 1.0630, test_f1: 0.5205
 epoch: 18, train_loss: 0.8335, test_loss: 1.1242, test_f1: 0.5413
 epoch: 19, train_loss: 0.8232, test_loss: 1.2038, test_f1: 0.5929
 epoch: 20, train_loss: 0.8516, test_loss: 1.0865, test_f1: 0.5672
 epoch: 21, train_loss: 0.8402, test_loss: 1.1797, test_f1: 0.5239
 epoch: 22, train_loss: 0.8309, test_loss: 1.2791, test_f1: 0.4875
 epoch: 23, train_loss: 0.8349, test_loss: 1.5414, test_f1: 0.4759
 epoch: 24, train_loss: 0.8897, test_loss: 1.1834, test_f1: 0.5040
 epoch: 25, train_loss: 0.8561, test_loss: 1.1558, test_f1: 0.5080
 epoch: 26, train_loss: 0.8373, test_loss: 1.1628, test_f1: 0.5275
 epoch: 27, train_loss: 0.8129, test_loss: 1.0691, test_f1: 0.5665
 epoch: 28, train_loss: 0.7799, test_loss: 1.1873, test_f1: 0.5330
 epoch: 29, train_loss: 0.7557, test_loss: 1.2120, test_f1: 0.5151
 epoch: 30, train_loss: 0.7673, test_loss: 1.1754, test_f1: 0.5539
 epoch: 31, train_loss: 0.7546, test_loss: 1.1659, test_f1: 0.5682
 epoch: 32, train_loss: 0.7272, test_loss: 1.1896, test_f1: 0.5439
 epoch: 33, train_loss: 0.7633, test_loss: 1.1554, test_f1: 0.5457
 epoch: 34, train_loss: 0.7459, test_loss: 1.1669, test_f1: 0.5834
 epoch: 35, train_loss: 0.7432, test_loss: 1.2082, test_f1: 0.5772
 epoch: 36, train_loss: 0.7453, test_loss: 1.4964, test_f1: 0.4814
 epoch: 37, train_loss: 0.8029, test_loss: 1.1393, test_f1: 0.5536
 epoch: 38, train_loss: 0.7776, test_loss: 1.1519, test_f1: 0.5503
 epoch: 39, train_loss: 0.7821, test_loss: 1.0478, test_f1: 0.5788
 epoch: 40, train_loss: 0.7562, test_loss: 1.2442, test_f1: 0.5337
 epoch: 41, train_loss: 0.7221, test_loss: 1.2382, test_f1: 0.5654
 epoch: 42, train_loss: 0.7110, test_loss: 1.5849, test_f1: 0.4144
 epoch: 43, train_loss: 0.6981, test_loss: 1.2659, test_f1: 0.5777
 epoch: 44, train_loss: 0.6963, test_loss: 1.3291, test_f1: 0.5635
 epoch: 45, train_loss: 0.7414, test_loss: 1.3418, test_f1: 0.5737
 epoch: 46, train_loss: 0.6995, test_loss: 1.3512, test_f1: 0.5507
 epoch: 47, train_loss: 0.7143, test_loss: 1.3318, test_f1: 0.5836
 epoch: 48, train_loss: 0.7027, test_loss: 1.3172, test_f1: 0.4771
 epoch: 49, train_loss: 0.6966, test_loss: 1.2337, test_f1: 0.5586
 epoch: 50, train_loss: 0.6675, test_loss: 1.3218, test_f1: 0.6040
 epoch: 51, train_loss: 0.6668, test_loss: 1.2931, test_f1: 0.5593
 epoch: 52, train_loss: 0.6466, test_loss: 1.4328, test_f1: 0.5601
 epoch: 53, train_loss: 0.6127, test_loss: 1.4279, test_f1: 0.5290
 epoch: 54, train_loss: 0.6420, test_loss: 1.6089, test_f1: 0.5029
 epoch: 55, train_loss: 0.6240, test_loss: 1.3790, test_f1: 0.5570
 epoch: 56, train_loss: 0.6086, test_loss: 1.3469, test_f1: 0.5752
 epoch: 57, train_loss: 0.5929, test_loss: 1.4513, test_f1: 0.5844
 epoch: 58, train_loss: 0.5999, test_loss: 1.7088, test_f1: 0.5181
 epoch: 59, train_loss: 0.6003, test_loss: 1.4434, test_f1: 0.5768
 epoch: 60, train_loss: 0.5894, test_loss: 1.4542, test_f1: 0.5544
 epoch: 61, train_loss: 0.5976, test_loss: 1.6494, test_f1: 0.5021
 epoch: 62, train_loss: 0.5812, test_loss: 1.3470, test_f1: 0.5665
 epoch: 63, train_loss: 0.5457, test_loss: 1.5300, test_f1: 0.5333
 epoch: 64, train_loss: 0.5772, test_loss: 1.4735, test_f1: 0.5870
 epoch: 65, train_loss: 0.5831, test_loss: 1.4767, test_f1: 0.5805
 epoch: 66, train_loss: 0.5673, test_loss: 1.6220, test_f1: 0.5796
 epoch: 67, train_loss: 0.5510, test_loss: 1.5712, test_f1: 0.5744
 epoch: 68, train_loss: 0.5275, test_loss: 1.5048, test_f1: 0.6089
 epoch: 69, train_loss: 0.5316, test_loss: 1.7388, test_f1: 0.5215
 epoch: 70, train_loss: 0.5346, test_loss: 1.5256, test_f1: 0.5603
 epoch: 71, train_loss: 0.5359, test_loss: 1.5215, test_f1: 0.6043
 epoch: 72, train_loss: 0.5209, test_loss: 1.8281, test_f1: 0.5355
 epoch: 73, train_loss: 0.5339, test_loss: 1.7949, test_f1: 0.5092
 epoch: 74, train_loss: 0.5450, test_loss: 1.6202, test_f1: 0.5394
 epoch: 75, train_loss: 0.5247, test_loss: 1.9816, test_f1: 0.5886
 epoch: 76, train_loss: 0.5182, test_loss: 1.7930, test_f1: 0.5903
 epoch: 77, train_loss: 0.5224, test_loss: 1.7087, test_f1: 0.5818
 epoch: 78, train_loss: 0.5464, test_loss: 1.6283, test_f1: 0.6090
 epoch: 79, train_loss: 0.5456, test_loss: 1.6389, test_f1: 0.5819
 epoch: 80, train_loss: 0.5307, test_loss: 1.7226, test_f1: 0.5372
 epoch: 81, train_loss: 0.4947, test_loss: 1.6765, test_f1: 0.5771
 epoch: 82, train_loss: 0.4886, test_loss: 1.7912, test_f1: 0.5650
 epoch: 83, train_loss: 0.4710, test_loss: 1.7317, test_f1: 0.5897
 epoch: 84, train_loss: 0.4599, test_loss: 1.8420, test_f1: 0.5935
 epoch: 85, train_loss: 0.4626, test_loss: 1.7797, test_f1: 0.5836
 epoch: 86, train_loss: 0.4918, test_loss: 1.7322, test_f1: 0.5770
 epoch: 87, train_loss: 0.4771, test_loss: 1.8607, test_f1: 0.5415
 epoch: 88, train_loss: 0.4727, test_loss: 1.6649, test_f1: 0.5817
 epoch: 89, train_loss: 0.4913, test_loss: 1.6078, test_f1: 0.6063
 epoch: 90, train_loss: 0.4728, test_loss: 1.9485, test_f1: 0.5119
 epoch: 91, train_loss: 0.4920, test_loss: 1.7515, test_f1: 0.5634
 epoch: 92, train_loss: 0.4695, test_loss: 1.7222, test_f1: 0.5920
 epoch: 93, train_loss: 0.4776, test_loss: 1.5509, test_f1: 0.6186
 epoch: 94, train_loss: 0.4525, test_loss: 1.9622, test_f1: 0.5456
 epoch: 95, train_loss: 0.4624, test_loss: 1.7226, test_f1: 0.5750
 epoch: 96, train_loss: 0.4792, test_loss: 1.8071, test_f1: 0.5648
 epoch: 97, train_loss: 0.4851, test_loss: 1.8277, test_f1: 0.5863
 epoch: 98, train_loss: 0.4545, test_loss: 1.7108, test_f1: 0.5837
 epoch: 99, train_loss: 0.4132, test_loss: 1.7013, test_f1: 0.6238
##################ITERATION #9 ****************************************
 epoch: 0, train_loss: 1.2910, test_loss: 1.3645, test_f1: 0.2587
 epoch: 1, train_loss: 1.0923, test_loss: 1.2223, test_f1: 0.3579
 epoch: 2, train_loss: 1.0230, test_loss: 1.1986, test_f1: 0.3970
 epoch: 3, train_loss: 0.9943, test_loss: 1.0786, test_f1: 0.4331
 epoch: 4, train_loss: 0.9516, test_loss: 1.0836, test_f1: 0.4737
 epoch: 5, train_loss: 0.9436, test_loss: 1.0642, test_f1: 0.5148
 epoch: 6, train_loss: 0.9400, test_loss: 1.1049, test_f1: 0.4826
 epoch: 7, train_loss: 0.9281, test_loss: 1.0481, test_f1: 0.5018
 epoch: 8, train_loss: 0.9386, test_loss: 1.0547, test_f1: 0.4540
 epoch: 9, train_loss: 0.9211, test_loss: 1.0203, test_f1: 0.5683
 epoch: 10, train_loss: 0.9011, test_loss: 1.0184, test_f1: 0.5066
 epoch: 11, train_loss: 0.8954, test_loss: 0.9855, test_f1: 0.5467
 epoch: 12, train_loss: 0.8795, test_loss: 1.0257, test_f1: 0.5926
 epoch: 13, train_loss: 0.8698, test_loss: 1.0015, test_f1: 0.5925
 epoch: 14, train_loss: 0.8523, test_loss: 1.0292, test_f1: 0.5631
 epoch: 15, train_loss: 0.8449, test_loss: 0.9741, test_f1: 0.6136
 epoch: 16, train_loss: 0.8563, test_loss: 1.0113, test_f1: 0.5528
 epoch: 17, train_loss: 0.8324, test_loss: 0.9744, test_f1: 0.6152
 epoch: 18, train_loss: 0.8117, test_loss: 1.0340, test_f1: 0.5908
 epoch: 19, train_loss: 0.8144, test_loss: 1.0113, test_f1: 0.5911
 epoch: 20, train_loss: 0.7998, test_loss: 1.0436, test_f1: 0.5647
 epoch: 21, train_loss: 0.7822, test_loss: 1.0341, test_f1: 0.5836
 epoch: 22, train_loss: 0.7978, test_loss: 1.0103, test_f1: 0.5484
 epoch: 23, train_loss: 0.8004, test_loss: 1.0588, test_f1: 0.6005
 epoch: 24, train_loss: 0.7946, test_loss: 1.0393, test_f1: 0.5763
 epoch: 25, train_loss: 0.7622, test_loss: 1.1288, test_f1: 0.4885
 epoch: 26, train_loss: 0.7798, test_loss: 1.3792, test_f1: 0.5343
 epoch: 27, train_loss: 0.7753, test_loss: 0.9985, test_f1: 0.5929
 epoch: 28, train_loss: 0.8224, test_loss: 1.1772, test_f1: 0.5089
 epoch: 29, train_loss: 0.8467, test_loss: 1.0563, test_f1: 0.5873
 epoch: 30, train_loss: 0.8247, test_loss: 1.0272, test_f1: 0.5824
 epoch: 31, train_loss: 0.8212, test_loss: 0.9302, test_f1: 0.6340
 epoch: 32, train_loss: 0.8169, test_loss: 1.0056, test_f1: 0.6148
 epoch: 33, train_loss: 0.7674, test_loss: 1.0368, test_f1: 0.6217
 epoch: 34, train_loss: 0.7540, test_loss: 0.9832, test_f1: 0.5994
 epoch: 35, train_loss: 0.7780, test_loss: 1.0822, test_f1: 0.6023
 epoch: 36, train_loss: 0.7479, test_loss: 1.0170, test_f1: 0.5709
 epoch: 37, train_loss: 0.7114, test_loss: 1.2021, test_f1: 0.5471
 epoch: 38, train_loss: 0.7180, test_loss: 1.0779, test_f1: 0.6001
 epoch: 39, train_loss: 0.6949, test_loss: 1.0872, test_f1: 0.6083
 epoch: 40, train_loss: 0.6815, test_loss: 1.0905, test_f1: 0.6222
 epoch: 41, train_loss: 0.6724, test_loss: 1.0318, test_f1: 0.5794
 epoch: 42, train_loss: 0.6836, test_loss: 1.0865, test_f1: 0.6299
 epoch: 43, train_loss: 0.6730, test_loss: 1.1479, test_f1: 0.5671
 epoch: 44, train_loss: 0.7118, test_loss: 1.4344, test_f1: 0.5231
 epoch: 45, train_loss: 0.7142, test_loss: 1.0979, test_f1: 0.5664
 epoch: 46, train_loss: 0.7170, test_loss: 1.1701, test_f1: 0.5496
 epoch: 47, train_loss: 0.7176, test_loss: 1.0992, test_f1: 0.6348
 epoch: 48, train_loss: 0.6761, test_loss: 1.0388, test_f1: 0.6376
 epoch: 49, train_loss: 0.6650, test_loss: 1.0699, test_f1: 0.6499
 epoch: 50, train_loss: 0.6594, test_loss: 1.1817, test_f1: 0.6111
 epoch: 51, train_loss: 0.6259, test_loss: 1.1112, test_f1: 0.6271
 epoch: 52, train_loss: 0.6106, test_loss: 1.0782, test_f1: 0.6246
 epoch: 53, train_loss: 0.6015, test_loss: 1.0972, test_f1: 0.6276
 epoch: 54, train_loss: 0.5747, test_loss: 1.0709, test_f1: 0.6457
 epoch: 55, train_loss: 0.5533, test_loss: 1.1962, test_f1: 0.5858
 epoch: 56, train_loss: 0.5699, test_loss: 1.0932, test_f1: 0.6628
 epoch: 57, train_loss: 0.5801, test_loss: 1.1795, test_f1: 0.6172
 epoch: 58, train_loss: 0.5824, test_loss: 1.0167, test_f1: 0.6626
 epoch: 59, train_loss: 0.5676, test_loss: 1.1605, test_f1: 0.6261
 epoch: 60, train_loss: 0.5589, test_loss: 1.0680, test_f1: 0.6609
 epoch: 61, train_loss: 0.5275, test_loss: 1.2475, test_f1: 0.6013
 epoch: 62, train_loss: 0.5528, test_loss: 1.3216, test_f1: 0.6216
 epoch: 63, train_loss: 0.5541, test_loss: 1.0814, test_f1: 0.6490
 epoch: 64, train_loss: 0.5403, test_loss: 1.1787, test_f1: 0.6383
 epoch: 65, train_loss: 0.5831, test_loss: 1.0211, test_f1: 0.6636
 epoch: 66, train_loss: 0.5812, test_loss: 1.1007, test_f1: 0.6412
 epoch: 67, train_loss: 0.5511, test_loss: 1.2451, test_f1: 0.6016
 epoch: 68, train_loss: 0.5247, test_loss: 1.2458, test_f1: 0.6274
 epoch: 69, train_loss: 0.5222, test_loss: 1.1048, test_f1: 0.6300
 epoch: 70, train_loss: 0.5214, test_loss: 1.1052, test_f1: 0.6339
 epoch: 71, train_loss: 0.5271, test_loss: 1.2794, test_f1: 0.5989
 epoch: 72, train_loss: 0.5440, test_loss: 1.1707, test_f1: 0.6301
 epoch: 73, train_loss: 0.5265, test_loss: 1.2823, test_f1: 0.6251
 epoch: 74, train_loss: 0.5362, test_loss: 1.2038, test_f1: 0.6368
 epoch: 75, train_loss: 0.5385, test_loss: 1.1659, test_f1: 0.6499
 epoch: 76, train_loss: 0.5266, test_loss: 1.3596, test_f1: 0.5774
 epoch: 77, train_loss: 0.5133, test_loss: 1.1203, test_f1: 0.6684
 epoch: 78, train_loss: 0.5291, test_loss: 1.3069, test_f1: 0.6500
 epoch: 79, train_loss: 0.5093, test_loss: 1.2195, test_f1: 0.6302
 epoch: 80, train_loss: 0.5040, test_loss: 1.1348, test_f1: 0.6447
 epoch: 81, train_loss: 0.4970, test_loss: 1.1848, test_f1: 0.6184
 epoch: 82, train_loss: 0.4682, test_loss: 1.1954, test_f1: 0.6472
 epoch: 83, train_loss: 0.4755, test_loss: 1.3403, test_f1: 0.5912
 epoch: 84, train_loss: 0.4739, test_loss: 1.3943, test_f1: 0.5958
 epoch: 85, train_loss: 0.4744, test_loss: 1.6223, test_f1: 0.6226
 epoch: 86, train_loss: 0.4670, test_loss: 1.4021, test_f1: 0.6144
 epoch: 87, train_loss: 0.4721, test_loss: 1.2911, test_f1: 0.6552
 epoch: 88, train_loss: 0.5014, test_loss: 1.5819, test_f1: 0.5860
 epoch: 89, train_loss: 0.5287, test_loss: 1.4021, test_f1: 0.6143
 epoch: 90, train_loss: 0.5030, test_loss: 2.9379, test_f1: 0.5869
 epoch: 91, train_loss: 0.4720, test_loss: 1.2749, test_f1: 0.6471
 epoch: 92, train_loss: 0.4642, test_loss: 1.2387, test_f1: 0.6363
 epoch: 93, train_loss: 0.4512, test_loss: 1.3313, test_f1: 0.6456
 epoch: 94, train_loss: 0.4605, test_loss: 1.3848, test_f1: 0.6191
 epoch: 95, train_loss: 0.4268, test_loss: 1.6466, test_f1: 0.6202
 epoch: 96, train_loss: 0.4368, test_loss: 1.7364, test_f1: 0.5718
 epoch: 97, train_loss: 0.4812, test_loss: 1.6934, test_f1: 0.5427
 epoch: 98, train_loss: 0.4821, test_loss: 1.3132, test_f1: 0.6089
 epoch: 99, train_loss: 0.4410, test_loss: 1.4378, test_f1: 0.6224

Training completed in 451.44 seconds
Best F1: 0.6684 at epoch 77
Mean F1 across iterations: 0.6326  0.0246
========================FINAL RESULTS================================
FEGIN weighted F1: 0.6684  0.0246
python main.py --data ltspice_demos --representation component_net --model FEGIN --layers 4 --hiddens 32 --batch_size 128 --lr 0.01 --emb_size 250 --epochs 100 --save_appendix component_net_L4_H32_BS128_LR0.01_E250 --no_val
-----



STDERR:
  File "main.py", line 370, in <module>
    main()
  File "main.py", line 254, in main
    dataset = dataset_class(
  File "/home/philip/projects/ltspice_examples_code_repo/Circuit-Completion-Using-GNNs/component_classification_with_link_prediction_head/evaluation/FEGIN/kernel/circuit_datasets.py", line 15, in __init__
    self.data, self.slices = torch.load(self.processed_paths[0])
  File "/home/philip/.local/lib/python3.8/site-packages/torch/serialization.py", line 1040, in load
    warnings.warn(
  File "/usr/lib/python3.8/warnings.py", line 109, in _showwarnmsg
    sw(msg.message, msg.category, msg.filename, msg.lineno,
  File "main.py", line 47, in warn_with_traceback
    traceback.print_stack(file=log)
/home/philip/projects/ltspice_examples_code_repo/Circuit-Completion-Using-GNNs/component_classification_with_link_prediction_head/evaluation/FEGIN/kernel/circuit_datasets.py:15: FutureWarning: You are using `torch.load` with `weights_only=False` (the current default value), which uses the default pickle module implicitly. It is possible to construct malicious pickle data which will execute arbitrary code during unpickling (See https://github.com/pytorch/pytorch/blob/main/SECURITY.md#untrusted-models for more details). In a future release, the default value for `weights_only` will be flipped to `True`. This limits the functions that could be executed during unpickling. Arbitrary objects will no longer be allowed to be loaded via this mode unless they are explicitly allowlisted by the user via `torch.serialization.add_safe_globals`. We recommend you start setting `weights_only=True` for any use case where you don't have full control of the loaded file. Please open an issue on GitHub for any issues related to this experimental feature.
  self.data, self.slices = torch.load(self.processed_paths[0])
