STDOUT:
Results will be saved in /home/philip/projects/llm_inference_code_repo/Circuit-Completion-Using-GNNs/component_classification_with_link_prediction_head/evaluation/FEGIN/results/model_FEGIN_dataset_ltspice_examples
Command line input: python main.py --data ltspice_examples --representation component_component --model FEGIN --layers 4 --hiddens 128 --batch_size 128 --lr 0.0001 --emb_size 128 --epochs 100 --save_appendix component_component_L4_H128_BS128_LR0.0001_E128 --no_val
 is saved.
-----
ltspice_examples - FEGIN
Using 4 layers, 128 hidden units, h = 2
Loading component_component representation dataset
ENTERED
Training FEGIN on component_component representation
Train: 3556, Test: 845
##################ITERATION #0 ****************************************
 epoch: 0, train_loss: 1.3623, test_loss: 1.3560, test_f1: 0.2274
 epoch: 1, train_loss: 1.3372, test_loss: 1.3345, test_f1: 0.2274
 epoch: 2, train_loss: 1.3126, test_loss: 1.3043, test_f1: 0.2274
 epoch: 3, train_loss: 1.2833, test_loss: 1.2716, test_f1: 0.2269
 epoch: 4, train_loss: 1.2553, test_loss: 1.2378, test_f1: 0.2844
 epoch: 5, train_loss: 1.2297, test_loss: 1.2076, test_f1: 0.3184
 epoch: 6, train_loss: 1.2051, test_loss: 1.1822, test_f1: 0.3565
 epoch: 7, train_loss: 1.1815, test_loss: 1.1550, test_f1: 0.3937
 epoch: 8, train_loss: 1.1620, test_loss: 1.1400, test_f1: 0.3813
 epoch: 9, train_loss: 1.1366, test_loss: 1.1181, test_f1: 0.4601
 epoch: 10, train_loss: 1.1150, test_loss: 1.0935, test_f1: 0.4846
 epoch: 11, train_loss: 1.0921, test_loss: 1.0667, test_f1: 0.5058
 epoch: 12, train_loss: 1.0727, test_loss: 1.0526, test_f1: 0.5040
 epoch: 13, train_loss: 1.0447, test_loss: 1.0463, test_f1: 0.4808
 epoch: 14, train_loss: 1.0287, test_loss: 1.0272, test_f1: 0.5013
 epoch: 15, train_loss: 1.0035, test_loss: 1.0187, test_f1: 0.4908
 epoch: 16, train_loss: 0.9970, test_loss: 1.0057, test_f1: 0.5160
 epoch: 17, train_loss: 0.9701, test_loss: 1.0069, test_f1: 0.5035
 epoch: 18, train_loss: 0.9490, test_loss: 1.0225, test_f1: 0.4991
 epoch: 19, train_loss: 0.9347, test_loss: 1.0302, test_f1: 0.4829
 epoch: 20, train_loss: 0.9264, test_loss: 1.0263, test_f1: 0.5053
 epoch: 21, train_loss: 0.9103, test_loss: 1.0280, test_f1: 0.5171
 epoch: 22, train_loss: 0.8831, test_loss: 1.0070, test_f1: 0.5107
 epoch: 23, train_loss: 0.8771, test_loss: 1.0248, test_f1: 0.5122
 epoch: 24, train_loss: 0.8642, test_loss: 1.0233, test_f1: 0.5065
 epoch: 25, train_loss: 0.8567, test_loss: 1.0516, test_f1: 0.4859
 epoch: 26, train_loss: 0.8476, test_loss: 1.0539, test_f1: 0.4989
 epoch: 27, train_loss: 0.8355, test_loss: 1.0561, test_f1: 0.5034
 epoch: 28, train_loss: 0.8237, test_loss: 1.0856, test_f1: 0.5000
 epoch: 29, train_loss: 0.8095, test_loss: 1.0845, test_f1: 0.5145
 epoch: 30, train_loss: 0.8036, test_loss: 1.0898, test_f1: 0.4979
 epoch: 31, train_loss: 0.8050, test_loss: 1.0959, test_f1: 0.4994
 epoch: 32, train_loss: 0.7869, test_loss: 1.0892, test_f1: 0.5101
 epoch: 33, train_loss: 0.7722, test_loss: 1.1190, test_f1: 0.4881
 epoch: 34, train_loss: 0.7677, test_loss: 1.1025, test_f1: 0.5003
 epoch: 35, train_loss: 0.7626, test_loss: 1.1476, test_f1: 0.4967
 epoch: 36, train_loss: 0.7495, test_loss: 1.1687, test_f1: 0.4997
 epoch: 37, train_loss: 0.7355, test_loss: 1.1859, test_f1: 0.5038
 epoch: 38, train_loss: 0.7346, test_loss: 1.1446, test_f1: 0.5084
 epoch: 39, train_loss: 0.7252, test_loss: 1.1765, test_f1: 0.4947
 epoch: 40, train_loss: 0.7106, test_loss: 1.1863, test_f1: 0.5148
 epoch: 41, train_loss: 0.7258, test_loss: 1.1775, test_f1: 0.4930
 epoch: 42, train_loss: 0.6925, test_loss: 1.1702, test_f1: 0.5060
 epoch: 43, train_loss: 0.6893, test_loss: 1.2011, test_f1: 0.4977
 epoch: 44, train_loss: 0.6839, test_loss: 1.2104, test_f1: 0.5114
 epoch: 45, train_loss: 0.6784, test_loss: 1.2049, test_f1: 0.4998
 epoch: 46, train_loss: 0.6659, test_loss: 1.2271, test_f1: 0.5239
 epoch: 47, train_loss: 0.6631, test_loss: 1.2242, test_f1: 0.5181
 epoch: 48, train_loss: 0.6592, test_loss: 1.2033, test_f1: 0.5235
 epoch: 49, train_loss: 0.6549, test_loss: 1.2085, test_f1: 0.5096
 epoch: 50, train_loss: 0.6492, test_loss: 1.2543, test_f1: 0.5318
 epoch: 51, train_loss: 0.6299, test_loss: 1.2422, test_f1: 0.5244
 epoch: 52, train_loss: 0.6175, test_loss: 1.2550, test_f1: 0.5231
 epoch: 53, train_loss: 0.6131, test_loss: 1.2530, test_f1: 0.5192
 epoch: 54, train_loss: 0.6112, test_loss: 1.2768, test_f1: 0.5317
 epoch: 55, train_loss: 0.6060, test_loss: 1.2980, test_f1: 0.5215
 epoch: 56, train_loss: 0.5886, test_loss: 1.3159, test_f1: 0.5194
 epoch: 57, train_loss: 0.6114, test_loss: 1.2959, test_f1: 0.5321
 epoch: 58, train_loss: 0.6003, test_loss: 1.3032, test_f1: 0.5342
 epoch: 59, train_loss: 0.5877, test_loss: 1.3019, test_f1: 0.5236
 epoch: 60, train_loss: 0.5813, test_loss: 1.3556, test_f1: 0.5242
 epoch: 61, train_loss: 0.5734, test_loss: 1.3582, test_f1: 0.5228
 epoch: 62, train_loss: 0.5797, test_loss: 1.3453, test_f1: 0.5310
 epoch: 63, train_loss: 0.5664, test_loss: 1.3317, test_f1: 0.5244
 epoch: 64, train_loss: 0.5671, test_loss: 1.3434, test_f1: 0.5364
 epoch: 65, train_loss: 0.5702, test_loss: 1.3411, test_f1: 0.5328
 epoch: 66, train_loss: 0.5626, test_loss: 1.3494, test_f1: 0.5301
 epoch: 67, train_loss: 0.5564, test_loss: 1.3954, test_f1: 0.5192
 epoch: 68, train_loss: 0.5550, test_loss: 1.3551, test_f1: 0.5226
 epoch: 69, train_loss: 0.5654, test_loss: 1.3756, test_f1: 0.5202
 epoch: 70, train_loss: 0.5530, test_loss: 1.3698, test_f1: 0.5395
 epoch: 71, train_loss: 0.5615, test_loss: 1.3889, test_f1: 0.5223
 epoch: 72, train_loss: 0.5430, test_loss: 1.3866, test_f1: 0.5414
 epoch: 73, train_loss: 0.5491, test_loss: 1.3715, test_f1: 0.5447
 epoch: 74, train_loss: 0.5314, test_loss: 1.4262, test_f1: 0.5403
 epoch: 75, train_loss: 0.5345, test_loss: 1.4436, test_f1: 0.5403
 epoch: 76, train_loss: 0.5364, test_loss: 1.3735, test_f1: 0.5247
 epoch: 77, train_loss: 0.5430, test_loss: 1.4284, test_f1: 0.5310
 epoch: 78, train_loss: 0.5244, test_loss: 1.3900, test_f1: 0.5388
 epoch: 79, train_loss: 0.5219, test_loss: 1.4164, test_f1: 0.5296
 epoch: 80, train_loss: 0.5317, test_loss: 1.3998, test_f1: 0.5348
 epoch: 81, train_loss: 0.5176, test_loss: 1.4507, test_f1: 0.5213
 epoch: 82, train_loss: 0.5156, test_loss: 1.4529, test_f1: 0.5303
 epoch: 83, train_loss: 0.5241, test_loss: 1.5083, test_f1: 0.5372
 epoch: 84, train_loss: 0.5226, test_loss: 1.4674, test_f1: 0.5373
 epoch: 85, train_loss: 0.5040, test_loss: 1.4837, test_f1: 0.5329
 epoch: 86, train_loss: 0.4973, test_loss: 1.5217, test_f1: 0.5415
 epoch: 87, train_loss: 0.5103, test_loss: 1.4901, test_f1: 0.5238
 epoch: 88, train_loss: 0.5195, test_loss: 1.4874, test_f1: 0.5414
 epoch: 89, train_loss: 0.5199, test_loss: 1.5028, test_f1: 0.5413
 epoch: 90, train_loss: 0.4792, test_loss: 1.5286, test_f1: 0.5187
 epoch: 91, train_loss: 0.4876, test_loss: 1.5227, test_f1: 0.5380
 epoch: 92, train_loss: 0.4759, test_loss: 1.5367, test_f1: 0.5378
 epoch: 93, train_loss: 0.4985, test_loss: 1.5123, test_f1: 0.5408
 epoch: 94, train_loss: 0.4877, test_loss: 1.5500, test_f1: 0.5193
 epoch: 95, train_loss: 0.4890, test_loss: 1.5356, test_f1: 0.5377
 epoch: 96, train_loss: 0.4884, test_loss: 1.5463, test_f1: 0.5285
 epoch: 97, train_loss: 0.4860, test_loss: 1.5154, test_f1: 0.5489
 epoch: 98, train_loss: 0.4703, test_loss: 1.5542, test_f1: 0.5267
 epoch: 99, train_loss: 0.4754, test_loss: 1.5776, test_f1: 0.5243
##################ITERATION #1 ****************************************
 epoch: 0, train_loss: 1.3098, test_loss: 1.3011, test_f1: 0.2274
 epoch: 1, train_loss: 1.2419, test_loss: 1.2348, test_f1: 0.2748
 epoch: 2, train_loss: 1.2057, test_loss: 1.1920, test_f1: 0.3456
 epoch: 3, train_loss: 1.1845, test_loss: 1.1632, test_f1: 0.4103
 epoch: 4, train_loss: 1.1541, test_loss: 1.1470, test_f1: 0.4342
 epoch: 5, train_loss: 1.1322, test_loss: 1.1256, test_f1: 0.4496
 epoch: 6, train_loss: 1.1120, test_loss: 1.1122, test_f1: 0.4533
 epoch: 7, train_loss: 1.0941, test_loss: 1.1007, test_f1: 0.4434
 epoch: 8, train_loss: 1.0797, test_loss: 1.0819, test_f1: 0.4724
 epoch: 9, train_loss: 1.0612, test_loss: 1.0791, test_f1: 0.4741
 epoch: 10, train_loss: 1.0405, test_loss: 1.0656, test_f1: 0.4780
 epoch: 11, train_loss: 1.0223, test_loss: 1.0594, test_f1: 0.4915
 epoch: 12, train_loss: 1.0099, test_loss: 1.0454, test_f1: 0.5048
 epoch: 13, train_loss: 0.9914, test_loss: 1.0503, test_f1: 0.4869
 epoch: 14, train_loss: 0.9776, test_loss: 1.0478, test_f1: 0.4938
 epoch: 15, train_loss: 0.9567, test_loss: 1.0367, test_f1: 0.5075
 epoch: 16, train_loss: 0.9524, test_loss: 1.0390, test_f1: 0.5034
 epoch: 17, train_loss: 0.9296, test_loss: 1.0391, test_f1: 0.4996
 epoch: 18, train_loss: 0.9267, test_loss: 1.0366, test_f1: 0.5002
 epoch: 19, train_loss: 0.9076, test_loss: 1.0264, test_f1: 0.5083
 epoch: 20, train_loss: 0.8965, test_loss: 1.0448, test_f1: 0.5089
 epoch: 21, train_loss: 0.8836, test_loss: 1.0345, test_f1: 0.5166
 epoch: 22, train_loss: 0.8766, test_loss: 1.0714, test_f1: 0.4902
 epoch: 23, train_loss: 0.8642, test_loss: 1.0447, test_f1: 0.5235
 epoch: 24, train_loss: 0.8419, test_loss: 1.0560, test_f1: 0.5059
 epoch: 25, train_loss: 0.8389, test_loss: 1.0584, test_f1: 0.5013
 epoch: 26, train_loss: 0.8493, test_loss: 1.0684, test_f1: 0.4946
 epoch: 27, train_loss: 0.8372, test_loss: 1.0808, test_f1: 0.5133
 epoch: 28, train_loss: 0.8056, test_loss: 1.1406, test_f1: 0.4783
 epoch: 29, train_loss: 0.8147, test_loss: 1.1188, test_f1: 0.5057
 epoch: 30, train_loss: 0.8014, test_loss: 1.1117, test_f1: 0.4944
 epoch: 31, train_loss: 0.7821, test_loss: 1.1252, test_f1: 0.4885
 epoch: 32, train_loss: 0.7789, test_loss: 1.1382, test_f1: 0.4995
 epoch: 33, train_loss: 0.7746, test_loss: 1.1877, test_f1: 0.5025
 epoch: 34, train_loss: 0.7597, test_loss: 1.1389, test_f1: 0.5145
 epoch: 35, train_loss: 0.7549, test_loss: 1.1959, test_f1: 0.4741
 epoch: 36, train_loss: 0.7330, test_loss: 1.2240, test_f1: 0.4981
 epoch: 37, train_loss: 0.7250, test_loss: 1.2266, test_f1: 0.4760
 epoch: 38, train_loss: 0.7298, test_loss: 1.2558, test_f1: 0.4846
 epoch: 39, train_loss: 0.7219, test_loss: 1.2251, test_f1: 0.4644
 epoch: 40, train_loss: 0.7100, test_loss: 1.2335, test_f1: 0.5057
 epoch: 41, train_loss: 0.7040, test_loss: 1.2337, test_f1: 0.4973
 epoch: 42, train_loss: 0.6930, test_loss: 1.2117, test_f1: 0.5190
 epoch: 43, train_loss: 0.6890, test_loss: 1.2841, test_f1: 0.4960
 epoch: 44, train_loss: 0.6866, test_loss: 1.3436, test_f1: 0.4949
 epoch: 45, train_loss: 0.6671, test_loss: 1.2385, test_f1: 0.5105
 epoch: 46, train_loss: 0.6621, test_loss: 1.3019, test_f1: 0.5056
 epoch: 47, train_loss: 0.6697, test_loss: 1.3243, test_f1: 0.5167
 epoch: 48, train_loss: 0.6470, test_loss: 1.3069, test_f1: 0.5183
 epoch: 49, train_loss: 0.6294, test_loss: 1.3450, test_f1: 0.4924
 epoch: 50, train_loss: 0.6412, test_loss: 1.3686, test_f1: 0.5005
 epoch: 51, train_loss: 0.6242, test_loss: 1.3571, test_f1: 0.5315
 epoch: 52, train_loss: 0.6177, test_loss: 1.3826, test_f1: 0.5139
 epoch: 53, train_loss: 0.6050, test_loss: 1.4058, test_f1: 0.5186
 epoch: 54, train_loss: 0.6005, test_loss: 1.4097, test_f1: 0.5220
 epoch: 55, train_loss: 0.6081, test_loss: 1.3506, test_f1: 0.5272
 epoch: 56, train_loss: 0.5986, test_loss: 1.4284, test_f1: 0.5058
 epoch: 57, train_loss: 0.5824, test_loss: 1.4311, test_f1: 0.4992
 epoch: 58, train_loss: 0.5934, test_loss: 1.4788, test_f1: 0.5258
 epoch: 59, train_loss: 0.5859, test_loss: 1.4449, test_f1: 0.5331
 epoch: 60, train_loss: 0.5924, test_loss: 1.4425, test_f1: 0.5215
 epoch: 61, train_loss: 0.5765, test_loss: 1.4804, test_f1: 0.4967
 epoch: 62, train_loss: 0.5774, test_loss: 1.4640, test_f1: 0.5034
 epoch: 63, train_loss: 0.5684, test_loss: 1.4901, test_f1: 0.5052
 epoch: 64, train_loss: 0.5586, test_loss: 1.5138, test_f1: 0.5062
 epoch: 65, train_loss: 0.5597, test_loss: 1.4966, test_f1: 0.5230
 epoch: 66, train_loss: 0.5556, test_loss: 1.5115, test_f1: 0.5000
 epoch: 67, train_loss: 0.5487, test_loss: 1.4954, test_f1: 0.5178
 epoch: 68, train_loss: 0.5414, test_loss: 1.5265, test_f1: 0.5080
 epoch: 69, train_loss: 0.5287, test_loss: 1.5460, test_f1: 0.5126
 epoch: 70, train_loss: 0.5367, test_loss: 1.5059, test_f1: 0.5251
 epoch: 71, train_loss: 0.5488, test_loss: 1.5381, test_f1: 0.5166
 epoch: 72, train_loss: 0.5326, test_loss: 1.5312, test_f1: 0.5161
 epoch: 73, train_loss: 0.5274, test_loss: 1.5648, test_f1: 0.4965
 epoch: 74, train_loss: 0.5292, test_loss: 1.6403, test_f1: 0.5149
 epoch: 75, train_loss: 0.5197, test_loss: 1.6426, test_f1: 0.5010
 epoch: 76, train_loss: 0.5189, test_loss: 1.5676, test_f1: 0.5159
 epoch: 77, train_loss: 0.5304, test_loss: 1.5600, test_f1: 0.5251
 epoch: 78, train_loss: 0.5126, test_loss: 1.5830, test_f1: 0.5081
 epoch: 79, train_loss: 0.5160, test_loss: 1.6274, test_f1: 0.5031
 epoch: 80, train_loss: 0.5091, test_loss: 1.6101, test_f1: 0.5054
 epoch: 81, train_loss: 0.5120, test_loss: 1.5928, test_f1: 0.5250
 epoch: 82, train_loss: 0.5062, test_loss: 1.5826, test_f1: 0.5144
 epoch: 83, train_loss: 0.5298, test_loss: 1.6634, test_f1: 0.5054
 epoch: 84, train_loss: 0.5001, test_loss: 1.6729, test_f1: 0.4919
 epoch: 85, train_loss: 0.5177, test_loss: 1.6431, test_f1: 0.5328
 epoch: 86, train_loss: 0.4831, test_loss: 1.7032, test_f1: 0.5009
 epoch: 87, train_loss: 0.4928, test_loss: 1.7009, test_f1: 0.5043
 epoch: 88, train_loss: 0.4845, test_loss: 1.6646, test_f1: 0.5184
 epoch: 89, train_loss: 0.4998, test_loss: 1.6874, test_f1: 0.4903
 epoch: 90, train_loss: 0.4912, test_loss: 1.6416, test_f1: 0.5035
 epoch: 91, train_loss: 0.4949, test_loss: 1.6465, test_f1: 0.5053
 epoch: 92, train_loss: 0.5000, test_loss: 1.6930, test_f1: 0.5245
 epoch: 93, train_loss: 0.4888, test_loss: 1.6970, test_f1: 0.4951
 epoch: 94, train_loss: 0.4687, test_loss: 1.6949, test_f1: 0.5244
 epoch: 95, train_loss: 0.4845, test_loss: 1.6850, test_f1: 0.4953
 epoch: 96, train_loss: 0.4810, test_loss: 1.6971, test_f1: 0.5147
 epoch: 97, train_loss: 0.4768, test_loss: 1.7552, test_f1: 0.5080
 epoch: 98, train_loss: 0.4691, test_loss: 1.6959, test_f1: 0.5097
 epoch: 99, train_loss: 0.4795, test_loss: 1.7148, test_f1: 0.4879
##################ITERATION #2 ****************************************
 epoch: 0, train_loss: 1.2912, test_loss: 1.2787, test_f1: 0.2274
 epoch: 1, train_loss: 1.2124, test_loss: 1.2094, test_f1: 0.3015
 epoch: 2, train_loss: 1.1821, test_loss: 1.1623, test_f1: 0.4025
 epoch: 3, train_loss: 1.1583, test_loss: 1.1373, test_f1: 0.4374
 epoch: 4, train_loss: 1.1398, test_loss: 1.1159, test_f1: 0.4245
 epoch: 5, train_loss: 1.1156, test_loss: 1.1035, test_f1: 0.4412
 epoch: 6, train_loss: 1.0981, test_loss: 1.0903, test_f1: 0.4366
 epoch: 7, train_loss: 1.0763, test_loss: 1.0747, test_f1: 0.4406
 epoch: 8, train_loss: 1.0634, test_loss: 1.0562, test_f1: 0.4479
 epoch: 9, train_loss: 1.0440, test_loss: 1.0454, test_f1: 0.4408
 epoch: 10, train_loss: 1.0355, test_loss: 1.0329, test_f1: 0.4637
 epoch: 11, train_loss: 1.0153, test_loss: 1.0251, test_f1: 0.4624
 epoch: 12, train_loss: 1.0003, test_loss: 1.0259, test_f1: 0.4623
 epoch: 13, train_loss: 0.9920, test_loss: 1.0172, test_f1: 0.4836
 epoch: 14, train_loss: 0.9789, test_loss: 1.0200, test_f1: 0.4855
 epoch: 15, train_loss: 0.9614, test_loss: 1.0098, test_f1: 0.4854
 epoch: 16, train_loss: 0.9454, test_loss: 1.0198, test_f1: 0.4979
 epoch: 17, train_loss: 0.9343, test_loss: 1.0198, test_f1: 0.4981
 epoch: 18, train_loss: 0.9198, test_loss: 1.0215, test_f1: 0.5182
 epoch: 19, train_loss: 0.9097, test_loss: 1.0175, test_f1: 0.5052
 epoch: 20, train_loss: 0.8996, test_loss: 1.0262, test_f1: 0.5142
 epoch: 21, train_loss: 0.8906, test_loss: 1.0287, test_f1: 0.5157
 epoch: 22, train_loss: 0.8776, test_loss: 1.0414, test_f1: 0.4914
 epoch: 23, train_loss: 0.8627, test_loss: 1.0241, test_f1: 0.5227
 epoch: 24, train_loss: 0.8443, test_loss: 1.0445, test_f1: 0.5235
 epoch: 25, train_loss: 0.8346, test_loss: 1.0622, test_f1: 0.5128
 epoch: 26, train_loss: 0.8427, test_loss: 1.0522, test_f1: 0.5029
 epoch: 27, train_loss: 0.8256, test_loss: 1.0402, test_f1: 0.4896
 epoch: 28, train_loss: 0.7945, test_loss: 1.0652, test_f1: 0.5126
 epoch: 29, train_loss: 0.7871, test_loss: 1.0701, test_f1: 0.5209
 epoch: 30, train_loss: 0.7929, test_loss: 1.0760, test_f1: 0.4963
 epoch: 31, train_loss: 0.7775, test_loss: 1.1113, test_f1: 0.5044
 epoch: 32, train_loss: 0.7614, test_loss: 1.1273, test_f1: 0.4958
 epoch: 33, train_loss: 0.7604, test_loss: 1.1036, test_f1: 0.5147
 epoch: 34, train_loss: 0.7495, test_loss: 1.1284, test_f1: 0.4908
 epoch: 35, train_loss: 0.7546, test_loss: 1.1146, test_f1: 0.5264
 epoch: 36, train_loss: 0.7300, test_loss: 1.0996, test_f1: 0.4971
 epoch: 37, train_loss: 0.7182, test_loss: 1.1296, test_f1: 0.5129
 epoch: 38, train_loss: 0.7181, test_loss: 1.1494, test_f1: 0.4981
 epoch: 39, train_loss: 0.7109, test_loss: 1.1678, test_f1: 0.4846
 epoch: 40, train_loss: 0.6904, test_loss: 1.1648, test_f1: 0.4992
 epoch: 41, train_loss: 0.6984, test_loss: 1.1407, test_f1: 0.5046
 epoch: 42, train_loss: 0.6834, test_loss: 1.1796, test_f1: 0.5112
 epoch: 43, train_loss: 0.6862, test_loss: 1.2258, test_f1: 0.5017
 epoch: 44, train_loss: 0.6691, test_loss: 1.2698, test_f1: 0.4840
 epoch: 45, train_loss: 0.6682, test_loss: 1.1916, test_f1: 0.5035
 epoch: 46, train_loss: 0.6754, test_loss: 1.2498, test_f1: 0.4950
 epoch: 47, train_loss: 0.6443, test_loss: 1.2290, test_f1: 0.5093
 epoch: 48, train_loss: 0.6431, test_loss: 1.2157, test_f1: 0.5203
 epoch: 49, train_loss: 0.6343, test_loss: 1.2846, test_f1: 0.4858
 epoch: 50, train_loss: 0.6322, test_loss: 1.2851, test_f1: 0.5044
 epoch: 51, train_loss: 0.6142, test_loss: 1.2347, test_f1: 0.5024
 epoch: 52, train_loss: 0.5909, test_loss: 1.3041, test_f1: 0.5135
 epoch: 53, train_loss: 0.6003, test_loss: 1.2932, test_f1: 0.4996
 epoch: 54, train_loss: 0.5785, test_loss: 1.2765, test_f1: 0.5113
 epoch: 55, train_loss: 0.5831, test_loss: 1.3223, test_f1: 0.5006
 epoch: 56, train_loss: 0.5837, test_loss: 1.3457, test_f1: 0.5008
 epoch: 57, train_loss: 0.5861, test_loss: 1.3127, test_f1: 0.4949
 epoch: 58, train_loss: 0.5920, test_loss: 1.3559, test_f1: 0.4890
 epoch: 59, train_loss: 0.5706, test_loss: 1.3398, test_f1: 0.4919
 epoch: 60, train_loss: 0.5727, test_loss: 1.3658, test_f1: 0.5000
 epoch: 61, train_loss: 0.5646, test_loss: 1.3517, test_f1: 0.4938
 epoch: 62, train_loss: 0.5666, test_loss: 1.3618, test_f1: 0.4964
 epoch: 63, train_loss: 0.5624, test_loss: 1.3743, test_f1: 0.4993
 epoch: 64, train_loss: 0.5586, test_loss: 1.3806, test_f1: 0.4908
 epoch: 65, train_loss: 0.5394, test_loss: 1.3619, test_f1: 0.5086
 epoch: 66, train_loss: 0.5523, test_loss: 1.4130, test_f1: 0.4885
 epoch: 67, train_loss: 0.5360, test_loss: 1.3957, test_f1: 0.5072
 epoch: 68, train_loss: 0.5475, test_loss: 1.3791, test_f1: 0.5034
 epoch: 69, train_loss: 0.5469, test_loss: 1.3998, test_f1: 0.4978
 epoch: 70, train_loss: 0.5495, test_loss: 1.4185, test_f1: 0.5007
 epoch: 71, train_loss: 0.5526, test_loss: 1.4891, test_f1: 0.5026
 epoch: 72, train_loss: 0.5432, test_loss: 1.4262, test_f1: 0.5132
 epoch: 73, train_loss: 0.5325, test_loss: 1.4603, test_f1: 0.4898
 epoch: 74, train_loss: 0.5313, test_loss: 1.4316, test_f1: 0.5042
 epoch: 75, train_loss: 0.5324, test_loss: 1.4300, test_f1: 0.4957
 epoch: 76, train_loss: 0.5208, test_loss: 1.4234, test_f1: 0.5129
 epoch: 77, train_loss: 0.5339, test_loss: 1.4631, test_f1: 0.5026
 epoch: 78, train_loss: 0.5341, test_loss: 1.4900, test_f1: 0.4987
 epoch: 79, train_loss: 0.5280, test_loss: 1.4718, test_f1: 0.4974
 epoch: 80, train_loss: 0.5222, test_loss: 1.4947, test_f1: 0.4974
 epoch: 81, train_loss: 0.5102, test_loss: 1.5018, test_f1: 0.4899
 epoch: 82, train_loss: 0.5078, test_loss: 1.4977, test_f1: 0.4882
 epoch: 83, train_loss: 0.5071, test_loss: 1.4640, test_f1: 0.5091
 epoch: 84, train_loss: 0.5011, test_loss: 1.4915, test_f1: 0.5130
 epoch: 85, train_loss: 0.5073, test_loss: 1.4906, test_f1: 0.5040
 epoch: 86, train_loss: 0.4876, test_loss: 1.5334, test_f1: 0.4958
 epoch: 87, train_loss: 0.5178, test_loss: 1.5045, test_f1: 0.5092
 epoch: 88, train_loss: 0.5067, test_loss: 1.5414, test_f1: 0.5106
 epoch: 89, train_loss: 0.4889, test_loss: 1.5085, test_f1: 0.5135
 epoch: 90, train_loss: 0.4861, test_loss: 1.5893, test_f1: 0.5049
 epoch: 91, train_loss: 0.5036, test_loss: 1.6011, test_f1: 0.5102
 epoch: 92, train_loss: 0.4954, test_loss: 1.5534, test_f1: 0.4990
 epoch: 93, train_loss: 0.4824, test_loss: 1.5426, test_f1: 0.4969
 epoch: 94, train_loss: 0.4810, test_loss: 1.5986, test_f1: 0.5026
 epoch: 95, train_loss: 0.4824, test_loss: 1.5763, test_f1: 0.5030
 epoch: 96, train_loss: 0.4958, test_loss: 1.5567, test_f1: 0.4988
 epoch: 97, train_loss: 0.4807, test_loss: 1.6236, test_f1: 0.5072
 epoch: 98, train_loss: 0.4663, test_loss: 1.5972, test_f1: 0.5081
 epoch: 99, train_loss: 0.4706, test_loss: 1.6455, test_f1: 0.5049
##################ITERATION #3 ****************************************
 epoch: 0, train_loss: 1.2733, test_loss: 1.2397, test_f1: 0.2366
 epoch: 1, train_loss: 1.1976, test_loss: 1.1801, test_f1: 0.3821
 epoch: 2, train_loss: 1.1759, test_loss: 1.1479, test_f1: 0.4392
 epoch: 3, train_loss: 1.1503, test_loss: 1.1303, test_f1: 0.4318
 epoch: 4, train_loss: 1.1266, test_loss: 1.1162, test_f1: 0.4268
 epoch: 5, train_loss: 1.1121, test_loss: 1.1016, test_f1: 0.4348
 epoch: 6, train_loss: 1.0969, test_loss: 1.0882, test_f1: 0.4366
 epoch: 7, train_loss: 1.0929, test_loss: 1.0730, test_f1: 0.4371
 epoch: 8, train_loss: 1.0677, test_loss: 1.0561, test_f1: 0.4484
 epoch: 9, train_loss: 1.0527, test_loss: 1.0488, test_f1: 0.4514
 epoch: 10, train_loss: 1.0290, test_loss: 1.0333, test_f1: 0.4416
 epoch: 11, train_loss: 1.0258, test_loss: 1.0252, test_f1: 0.4442
 epoch: 12, train_loss: 1.0055, test_loss: 1.0215, test_f1: 0.4529
 epoch: 13, train_loss: 0.9949, test_loss: 1.0124, test_f1: 0.4645
 epoch: 14, train_loss: 0.9656, test_loss: 1.0078, test_f1: 0.4606
 epoch: 15, train_loss: 0.9700, test_loss: 0.9923, test_f1: 0.4790
 epoch: 16, train_loss: 0.9554, test_loss: 0.9871, test_f1: 0.4702
 epoch: 17, train_loss: 0.9402, test_loss: 0.9885, test_f1: 0.4781
 epoch: 18, train_loss: 0.9276, test_loss: 0.9994, test_f1: 0.4992
 epoch: 19, train_loss: 0.9195, test_loss: 0.9919, test_f1: 0.4926
 epoch: 20, train_loss: 0.9001, test_loss: 0.9882, test_f1: 0.4961
 epoch: 21, train_loss: 0.8886, test_loss: 0.9964, test_f1: 0.4706
 epoch: 22, train_loss: 0.8795, test_loss: 0.9978, test_f1: 0.4911
 epoch: 23, train_loss: 0.8598, test_loss: 1.0038, test_f1: 0.5074
 epoch: 24, train_loss: 0.8518, test_loss: 1.0203, test_f1: 0.4970
 epoch: 25, train_loss: 0.8378, test_loss: 1.0214, test_f1: 0.5002
 epoch: 26, train_loss: 0.8365, test_loss: 1.0343, test_f1: 0.4814
 epoch: 27, train_loss: 0.8217, test_loss: 1.0571, test_f1: 0.4799
 epoch: 28, train_loss: 0.8136, test_loss: 1.0386, test_f1: 0.4876
 epoch: 29, train_loss: 0.8010, test_loss: 1.0523, test_f1: 0.4946
 epoch: 30, train_loss: 0.7995, test_loss: 1.0485, test_f1: 0.4972
 epoch: 31, train_loss: 0.7878, test_loss: 1.0798, test_f1: 0.4848
 epoch: 32, train_loss: 0.7698, test_loss: 1.0995, test_f1: 0.4792
 epoch: 33, train_loss: 0.7649, test_loss: 1.0816, test_f1: 0.4863
 epoch: 34, train_loss: 0.7487, test_loss: 1.1074, test_f1: 0.4945
 epoch: 35, train_loss: 0.7538, test_loss: 1.1091, test_f1: 0.4664
 epoch: 36, train_loss: 0.7419, test_loss: 1.1295, test_f1: 0.5081
 epoch: 37, train_loss: 0.7268, test_loss: 1.1657, test_f1: 0.4703
 epoch: 38, train_loss: 0.7294, test_loss: 1.1000, test_f1: 0.4958
 epoch: 39, train_loss: 0.7228, test_loss: 1.1769, test_f1: 0.4737
 epoch: 40, train_loss: 0.6982, test_loss: 1.1658, test_f1: 0.4582
 epoch: 41, train_loss: 0.7124, test_loss: 1.2038, test_f1: 0.4927
 epoch: 42, train_loss: 0.6855, test_loss: 1.2092, test_f1: 0.4786
 epoch: 43, train_loss: 0.6759, test_loss: 1.2575, test_f1: 0.4825
 epoch: 44, train_loss: 0.6819, test_loss: 1.2494, test_f1: 0.4920
 epoch: 45, train_loss: 0.6611, test_loss: 1.2520, test_f1: 0.4761
 epoch: 46, train_loss: 0.6642, test_loss: 1.2756, test_f1: 0.4768
 epoch: 47, train_loss: 0.6542, test_loss: 1.2974, test_f1: 0.4887
 epoch: 48, train_loss: 0.6647, test_loss: 1.2673, test_f1: 0.4786
 epoch: 49, train_loss: 0.6455, test_loss: 1.2800, test_f1: 0.4806
 epoch: 50, train_loss: 0.6288, test_loss: 1.3136, test_f1: 0.4826
 epoch: 51, train_loss: 0.6250, test_loss: 1.3377, test_f1: 0.4865
 epoch: 52, train_loss: 0.6200, test_loss: 1.3165, test_f1: 0.4875
 epoch: 53, train_loss: 0.6110, test_loss: 1.3784, test_f1: 0.4751
 epoch: 54, train_loss: 0.6107, test_loss: 1.2722, test_f1: 0.4959
 epoch: 55, train_loss: 0.5917, test_loss: 1.3422, test_f1: 0.4766
 epoch: 56, train_loss: 0.6052, test_loss: 1.3775, test_f1: 0.4829
 epoch: 57, train_loss: 0.5915, test_loss: 1.3264, test_f1: 0.4772
 epoch: 58, train_loss: 0.5857, test_loss: 1.3568, test_f1: 0.4898
 epoch: 59, train_loss: 0.5918, test_loss: 1.3616, test_f1: 0.4816
 epoch: 60, train_loss: 0.5739, test_loss: 1.3869, test_f1: 0.4747
 epoch: 61, train_loss: 0.5728, test_loss: 1.4293, test_f1: 0.4659
 epoch: 62, train_loss: 0.5727, test_loss: 1.3834, test_f1: 0.4842
 epoch: 63, train_loss: 0.5717, test_loss: 1.4525, test_f1: 0.4744
 epoch: 64, train_loss: 0.5702, test_loss: 1.4235, test_f1: 0.4844
 epoch: 65, train_loss: 0.5519, test_loss: 1.4323, test_f1: 0.4817
 epoch: 66, train_loss: 0.5568, test_loss: 1.4173, test_f1: 0.4789
 epoch: 67, train_loss: 0.5510, test_loss: 1.4609, test_f1: 0.4844
 epoch: 68, train_loss: 0.5474, test_loss: 1.4961, test_f1: 0.4747
 epoch: 69, train_loss: 0.5532, test_loss: 1.4748, test_f1: 0.4747
 epoch: 70, train_loss: 0.5420, test_loss: 1.4973, test_f1: 0.4854
 epoch: 71, train_loss: 0.5428, test_loss: 1.4717, test_f1: 0.4829
 epoch: 72, train_loss: 0.5515, test_loss: 1.4514, test_f1: 0.4805
 epoch: 73, train_loss: 0.5392, test_loss: 1.4832, test_f1: 0.4914
 epoch: 74, train_loss: 0.5339, test_loss: 1.4721, test_f1: 0.4929
 epoch: 75, train_loss: 0.5391, test_loss: 1.4809, test_f1: 0.5060
 epoch: 76, train_loss: 0.5282, test_loss: 1.5123, test_f1: 0.4744
 epoch: 77, train_loss: 0.5220, test_loss: 1.4772, test_f1: 0.4856
 epoch: 78, train_loss: 0.5255, test_loss: 1.4867, test_f1: 0.4801
 epoch: 79, train_loss: 0.5080, test_loss: 1.5067, test_f1: 0.4992
 epoch: 80, train_loss: 0.5026, test_loss: 1.5010, test_f1: 0.4967
 epoch: 81, train_loss: 0.5179, test_loss: 1.5718, test_f1: 0.4824
 epoch: 82, train_loss: 0.5049, test_loss: 1.6149, test_f1: 0.4848
 epoch: 83, train_loss: 0.4990, test_loss: 1.6098, test_f1: 0.4819
 epoch: 84, train_loss: 0.5076, test_loss: 1.6074, test_f1: 0.4818
 epoch: 85, train_loss: 0.5133, test_loss: 1.5739, test_f1: 0.4884
 epoch: 86, train_loss: 0.5005, test_loss: 1.6320, test_f1: 0.4858
 epoch: 87, train_loss: 0.4959, test_loss: 1.6131, test_f1: 0.4858
 epoch: 88, train_loss: 0.5082, test_loss: 1.6334, test_f1: 0.4792
 epoch: 89, train_loss: 0.4875, test_loss: 1.6136, test_f1: 0.4823
 epoch: 90, train_loss: 0.4854, test_loss: 1.5644, test_f1: 0.4940
 epoch: 91, train_loss: 0.4956, test_loss: 1.5979, test_f1: 0.5116
 epoch: 92, train_loss: 0.4749, test_loss: 1.6068, test_f1: 0.4948
 epoch: 93, train_loss: 0.4874, test_loss: 1.5896, test_f1: 0.5099
 epoch: 94, train_loss: 0.4758, test_loss: 1.6639, test_f1: 0.5061
 epoch: 95, train_loss: 0.4779, test_loss: 1.6663, test_f1: 0.4876
 epoch: 96, train_loss: 0.4679, test_loss: 1.6176, test_f1: 0.4954
 epoch: 97, train_loss: 0.4579, test_loss: 1.6937, test_f1: 0.4938
 epoch: 98, train_loss: 0.4735, test_loss: 1.6753, test_f1: 0.4969
 epoch: 99, train_loss: 0.4663, test_loss: 1.7157, test_f1: 0.4905
##################ITERATION #4 ****************************************
 epoch: 0, train_loss: 1.3010, test_loss: 1.2719, test_f1: 0.2869
 epoch: 1, train_loss: 1.2124, test_loss: 1.1974, test_f1: 0.3807
 epoch: 2, train_loss: 1.1935, test_loss: 1.1369, test_f1: 0.4334
 epoch: 3, train_loss: 1.1630, test_loss: 1.1169, test_f1: 0.4076
 epoch: 4, train_loss: 1.1445, test_loss: 1.1053, test_f1: 0.4295
 epoch: 5, train_loss: 1.1258, test_loss: 1.0927, test_f1: 0.4467
 epoch: 6, train_loss: 1.1130, test_loss: 1.0813, test_f1: 0.4515
 epoch: 7, train_loss: 1.0910, test_loss: 1.0718, test_f1: 0.4509
 epoch: 8, train_loss: 1.0802, test_loss: 1.0592, test_f1: 0.4622
 epoch: 9, train_loss: 1.0680, test_loss: 1.0533, test_f1: 0.4862
 epoch: 10, train_loss: 1.0506, test_loss: 1.0547, test_f1: 0.4495
 epoch: 11, train_loss: 1.0372, test_loss: 1.0424, test_f1: 0.4737
 epoch: 12, train_loss: 1.0305, test_loss: 1.0322, test_f1: 0.4607
 epoch: 13, train_loss: 1.0304, test_loss: 1.0199, test_f1: 0.4713
 epoch: 14, train_loss: 1.0178, test_loss: 1.0158, test_f1: 0.4877
 epoch: 15, train_loss: 0.9997, test_loss: 1.0172, test_f1: 0.4660
 epoch: 16, train_loss: 0.9917, test_loss: 1.0036, test_f1: 0.4888
 epoch: 17, train_loss: 0.9704, test_loss: 1.0011, test_f1: 0.4780
 epoch: 18, train_loss: 0.9695, test_loss: 1.0140, test_f1: 0.4800
 epoch: 19, train_loss: 0.9630, test_loss: 0.9882, test_f1: 0.4918
 epoch: 20, train_loss: 0.9408, test_loss: 1.0185, test_f1: 0.4861
 epoch: 21, train_loss: 0.9327, test_loss: 0.9949, test_f1: 0.4927
 epoch: 22, train_loss: 0.9136, test_loss: 0.9995, test_f1: 0.5033
 epoch: 23, train_loss: 0.9024, test_loss: 1.0060, test_f1: 0.4935
 epoch: 24, train_loss: 0.8921, test_loss: 1.0077, test_f1: 0.5011
 epoch: 25, train_loss: 0.8976, test_loss: 1.0163, test_f1: 0.5003
 epoch: 26, train_loss: 0.8794, test_loss: 1.0267, test_f1: 0.5070
 epoch: 27, train_loss: 0.8708, test_loss: 1.0616, test_f1: 0.5063
 epoch: 28, train_loss: 0.8627, test_loss: 1.0124, test_f1: 0.5321
 epoch: 29, train_loss: 0.8480, test_loss: 1.0291, test_f1: 0.5028
 epoch: 30, train_loss: 0.8379, test_loss: 1.0282, test_f1: 0.5083
 epoch: 31, train_loss: 0.8214, test_loss: 1.0799, test_f1: 0.4784
 epoch: 32, train_loss: 0.8311, test_loss: 1.0164, test_f1: 0.5158
 epoch: 33, train_loss: 0.8095, test_loss: 1.0572, test_f1: 0.5094
 epoch: 34, train_loss: 0.7999, test_loss: 1.0996, test_f1: 0.5095
 epoch: 35, train_loss: 0.7969, test_loss: 1.0585, test_f1: 0.4981
 epoch: 36, train_loss: 0.7914, test_loss: 1.1035, test_f1: 0.4814
 epoch: 37, train_loss: 0.7684, test_loss: 1.0740, test_f1: 0.5020
 epoch: 38, train_loss: 0.7827, test_loss: 1.0994, test_f1: 0.4880
 epoch: 39, train_loss: 0.7734, test_loss: 1.0829, test_f1: 0.4969
 epoch: 40, train_loss: 0.7578, test_loss: 1.0881, test_f1: 0.5115
 epoch: 41, train_loss: 0.7436, test_loss: 1.1318, test_f1: 0.4988
 epoch: 42, train_loss: 0.7339, test_loss: 1.1606, test_f1: 0.5038
 epoch: 43, train_loss: 0.7244, test_loss: 1.1288, test_f1: 0.4896
 epoch: 44, train_loss: 0.7169, test_loss: 1.1619, test_f1: 0.4959
 epoch: 45, train_loss: 0.7127, test_loss: 1.1578, test_f1: 0.5156
 epoch: 46, train_loss: 0.7094, test_loss: 1.1407, test_f1: 0.5177
 epoch: 47, train_loss: 0.6990, test_loss: 1.2138, test_f1: 0.4894
 epoch: 48, train_loss: 0.6967, test_loss: 1.1709, test_f1: 0.5008
 epoch: 49, train_loss: 0.7029, test_loss: 1.2451, test_f1: 0.4986
 epoch: 50, train_loss: 0.6918, test_loss: 1.2321, test_f1: 0.5080
 epoch: 51, train_loss: 0.6872, test_loss: 1.2662, test_f1: 0.4995
 epoch: 52, train_loss: 0.6639, test_loss: 1.2911, test_f1: 0.5113
 epoch: 53, train_loss: 0.6564, test_loss: 1.2602, test_f1: 0.5102
 epoch: 54, train_loss: 0.6402, test_loss: 1.2565, test_f1: 0.5108
 epoch: 55, train_loss: 0.6499, test_loss: 1.2479, test_f1: 0.4977
 epoch: 56, train_loss: 0.6309, test_loss: 1.2446, test_f1: 0.4990
 epoch: 57, train_loss: 0.6331, test_loss: 1.2949, test_f1: 0.5105
 epoch: 58, train_loss: 0.6338, test_loss: 1.3273, test_f1: 0.4914
 epoch: 59, train_loss: 0.6174, test_loss: 1.2842, test_f1: 0.4960
 epoch: 60, train_loss: 0.6160, test_loss: 1.3103, test_f1: 0.5032
 epoch: 61, train_loss: 0.6210, test_loss: 1.3114, test_f1: 0.4878
 epoch: 62, train_loss: 0.6095, test_loss: 1.3739, test_f1: 0.5040
 epoch: 63, train_loss: 0.6123, test_loss: 1.3108, test_f1: 0.5048
 epoch: 64, train_loss: 0.5972, test_loss: 1.3327, test_f1: 0.5067
 epoch: 65, train_loss: 0.6040, test_loss: 1.3074, test_f1: 0.5028
 epoch: 66, train_loss: 0.6103, test_loss: 1.3411, test_f1: 0.4999
 epoch: 67, train_loss: 0.6148, test_loss: 1.3385, test_f1: 0.5205
 epoch: 68, train_loss: 0.6069, test_loss: 1.3205, test_f1: 0.5051
 epoch: 69, train_loss: 0.5882, test_loss: 1.3477, test_f1: 0.5210
 epoch: 70, train_loss: 0.5896, test_loss: 1.3295, test_f1: 0.5082
 epoch: 71, train_loss: 0.5997, test_loss: 1.3102, test_f1: 0.5076
 epoch: 72, train_loss: 0.5786, test_loss: 1.3755, test_f1: 0.5159
 epoch: 73, train_loss: 0.5680, test_loss: 1.3213, test_f1: 0.5134
 epoch: 74, train_loss: 0.5734, test_loss: 1.3887, test_f1: 0.5307
 epoch: 75, train_loss: 0.5774, test_loss: 1.3674, test_f1: 0.5107
 epoch: 76, train_loss: 0.5638, test_loss: 1.3763, test_f1: 0.5059
 epoch: 77, train_loss: 0.5610, test_loss: 1.3596, test_f1: 0.5176
 epoch: 78, train_loss: 0.5635, test_loss: 1.3801, test_f1: 0.4996
 epoch: 79, train_loss: 0.5587, test_loss: 1.4344, test_f1: 0.5167
 epoch: 80, train_loss: 0.5590, test_loss: 1.4105, test_f1: 0.5015
 epoch: 81, train_loss: 0.5587, test_loss: 1.4226, test_f1: 0.5087
 epoch: 82, train_loss: 0.5529, test_loss: 1.3988, test_f1: 0.5196
 epoch: 83, train_loss: 0.5400, test_loss: 1.4139, test_f1: 0.5091
 epoch: 84, train_loss: 0.5566, test_loss: 1.4330, test_f1: 0.5253
 epoch: 85, train_loss: 0.5468, test_loss: 1.4672, test_f1: 0.5291
 epoch: 86, train_loss: 0.5296, test_loss: 1.4114, test_f1: 0.5140
 epoch: 87, train_loss: 0.5358, test_loss: 1.4201, test_f1: 0.5127
 epoch: 88, train_loss: 0.5476, test_loss: 1.4003, test_f1: 0.5184
 epoch: 89, train_loss: 0.5302, test_loss: 1.3857, test_f1: 0.5173
 epoch: 90, train_loss: 0.5417, test_loss: 1.3990, test_f1: 0.5095
 epoch: 91, train_loss: 0.5260, test_loss: 1.4002, test_f1: 0.5289
 epoch: 92, train_loss: 0.5377, test_loss: 1.3950, test_f1: 0.5205
 epoch: 93, train_loss: 0.5256, test_loss: 1.4011, test_f1: 0.5208
 epoch: 94, train_loss: 0.5126, test_loss: 1.4170, test_f1: 0.5217
 epoch: 95, train_loss: 0.5273, test_loss: 1.4133, test_f1: 0.5157
 epoch: 96, train_loss: 0.5157, test_loss: 1.4463, test_f1: 0.5092
 epoch: 97, train_loss: 0.4966, test_loss: 1.4476, test_f1: 0.5051
 epoch: 98, train_loss: 0.5228, test_loss: 1.4608, test_f1: 0.5127
 epoch: 99, train_loss: 0.5144, test_loss: 1.4447, test_f1: 0.5334
##################ITERATION #5 ****************************************
 epoch: 0, train_loss: 1.3104, test_loss: 1.2490, test_f1: 0.2869
 epoch: 1, train_loss: 1.2269, test_loss: 1.1722, test_f1: 0.3997
 epoch: 2, train_loss: 1.1970, test_loss: 1.1462, test_f1: 0.4293
 epoch: 3, train_loss: 1.1676, test_loss: 1.1309, test_f1: 0.4314
 epoch: 4, train_loss: 1.1419, test_loss: 1.1138, test_f1: 0.4488
 epoch: 5, train_loss: 1.1196, test_loss: 1.0962, test_f1: 0.4545
 epoch: 6, train_loss: 1.1203, test_loss: 1.0954, test_f1: 0.4378
 epoch: 7, train_loss: 1.0937, test_loss: 1.0696, test_f1: 0.4641
 epoch: 8, train_loss: 1.0861, test_loss: 1.0631, test_f1: 0.4444
 epoch: 9, train_loss: 1.0714, test_loss: 1.0518, test_f1: 0.4574
 epoch: 10, train_loss: 1.0609, test_loss: 1.0434, test_f1: 0.4579
 epoch: 11, train_loss: 1.0356, test_loss: 1.0471, test_f1: 0.4562
 epoch: 12, train_loss: 1.0227, test_loss: 1.0235, test_f1: 0.4651
 epoch: 13, train_loss: 1.0184, test_loss: 1.0191, test_f1: 0.4565
 epoch: 14, train_loss: 1.0080, test_loss: 1.0195, test_f1: 0.4622
 epoch: 15, train_loss: 0.9952, test_loss: 1.0177, test_f1: 0.4697
 epoch: 16, train_loss: 0.9829, test_loss: 1.0034, test_f1: 0.4768
 epoch: 17, train_loss: 0.9672, test_loss: 1.0248, test_f1: 0.4646
 epoch: 18, train_loss: 0.9625, test_loss: 1.0312, test_f1: 0.4749
 epoch: 19, train_loss: 0.9531, test_loss: 1.0085, test_f1: 0.4664
 epoch: 20, train_loss: 0.9353, test_loss: 0.9927, test_f1: 0.4674
 epoch: 21, train_loss: 0.9266, test_loss: 0.9962, test_f1: 0.4681
 epoch: 22, train_loss: 0.9130, test_loss: 1.0080, test_f1: 0.4815
 epoch: 23, train_loss: 0.9039, test_loss: 0.9979, test_f1: 0.4726
 epoch: 24, train_loss: 0.9023, test_loss: 0.9840, test_f1: 0.4809
 epoch: 25, train_loss: 0.8900, test_loss: 0.9916, test_f1: 0.4742
 epoch: 26, train_loss: 0.8874, test_loss: 1.0242, test_f1: 0.4769
 epoch: 27, train_loss: 0.8732, test_loss: 1.0265, test_f1: 0.4707
 epoch: 28, train_loss: 0.8556, test_loss: 0.9865, test_f1: 0.4928
 epoch: 29, train_loss: 0.8608, test_loss: 1.0118, test_f1: 0.5070
 epoch: 30, train_loss: 0.8548, test_loss: 0.9915, test_f1: 0.5016
 epoch: 31, train_loss: 0.8427, test_loss: 1.0040, test_f1: 0.4963
 epoch: 32, train_loss: 0.8359, test_loss: 1.0192, test_f1: 0.5019
 epoch: 33, train_loss: 0.8222, test_loss: 1.0163, test_f1: 0.4814
 epoch: 34, train_loss: 0.8178, test_loss: 0.9919, test_f1: 0.4950
 epoch: 35, train_loss: 0.7981, test_loss: 1.0200, test_f1: 0.5218
 epoch: 36, train_loss: 0.8036, test_loss: 1.0449, test_f1: 0.4986
 epoch: 37, train_loss: 0.7892, test_loss: 1.0720, test_f1: 0.5006
 epoch: 38, train_loss: 0.7864, test_loss: 1.0716, test_f1: 0.5022
 epoch: 39, train_loss: 0.7858, test_loss: 1.0998, test_f1: 0.5060
 epoch: 40, train_loss: 0.7738, test_loss: 1.0678, test_f1: 0.5038
 epoch: 41, train_loss: 0.7563, test_loss: 1.0961, test_f1: 0.5105
 epoch: 42, train_loss: 0.7458, test_loss: 1.0986, test_f1: 0.5130
 epoch: 43, train_loss: 0.7508, test_loss: 1.1173, test_f1: 0.5125
 epoch: 44, train_loss: 0.7425, test_loss: 1.0896, test_f1: 0.4960
 epoch: 45, train_loss: 0.7376, test_loss: 1.1450, test_f1: 0.4938
 epoch: 46, train_loss: 0.7199, test_loss: 1.0745, test_f1: 0.5124
 epoch: 47, train_loss: 0.7231, test_loss: 1.0814, test_f1: 0.5243
 epoch: 48, train_loss: 0.7117, test_loss: 1.0920, test_f1: 0.5241
 epoch: 49, train_loss: 0.7056, test_loss: 1.0865, test_f1: 0.5233
 epoch: 50, train_loss: 0.7143, test_loss: 1.1350, test_f1: 0.5023
 epoch: 51, train_loss: 0.6881, test_loss: 1.1259, test_f1: 0.5084
 epoch: 52, train_loss: 0.6730, test_loss: 1.1264, test_f1: 0.5153
 epoch: 53, train_loss: 0.6742, test_loss: 1.1658, test_f1: 0.5075
 epoch: 54, train_loss: 0.6583, test_loss: 1.1597, test_f1: 0.5284
 epoch: 55, train_loss: 0.6509, test_loss: 1.1374, test_f1: 0.5197
 epoch: 56, train_loss: 0.6449, test_loss: 1.1600, test_f1: 0.5253
 epoch: 57, train_loss: 0.6510, test_loss: 1.1461, test_f1: 0.5315
 epoch: 58, train_loss: 0.6486, test_loss: 1.1698, test_f1: 0.5215
 epoch: 59, train_loss: 0.6379, test_loss: 1.2044, test_f1: 0.5230
 epoch: 60, train_loss: 0.6486, test_loss: 1.2510, test_f1: 0.5107
 epoch: 61, train_loss: 0.6475, test_loss: 1.1985, test_f1: 0.4957
 epoch: 62, train_loss: 0.6364, test_loss: 1.1763, test_f1: 0.5221
 epoch: 63, train_loss: 0.6391, test_loss: 1.2196, test_f1: 0.5161
 epoch: 64, train_loss: 0.6342, test_loss: 1.2042, test_f1: 0.5190
 epoch: 65, train_loss: 0.6117, test_loss: 1.2445, test_f1: 0.5196
 epoch: 66, train_loss: 0.6157, test_loss: 1.2276, test_f1: 0.5303
 epoch: 67, train_loss: 0.6280, test_loss: 1.2010, test_f1: 0.5480
 epoch: 68, train_loss: 0.6406, test_loss: 1.1917, test_f1: 0.5365
 epoch: 69, train_loss: 0.6255, test_loss: 1.1717, test_f1: 0.5380
 epoch: 70, train_loss: 0.6169, test_loss: 1.2094, test_f1: 0.5262
 epoch: 71, train_loss: 0.6020, test_loss: 1.2458, test_f1: 0.5208
 epoch: 72, train_loss: 0.6130, test_loss: 1.2606, test_f1: 0.5295
 epoch: 73, train_loss: 0.6096, test_loss: 1.2232, test_f1: 0.5435
 epoch: 74, train_loss: 0.6057, test_loss: 1.2570, test_f1: 0.5262
 epoch: 75, train_loss: 0.5952, test_loss: 1.2411, test_f1: 0.5351
 epoch: 76, train_loss: 0.6040, test_loss: 1.2547, test_f1: 0.5323
 epoch: 77, train_loss: 0.5901, test_loss: 1.2415, test_f1: 0.5386
 epoch: 78, train_loss: 0.5948, test_loss: 1.2847, test_f1: 0.5361
 epoch: 79, train_loss: 0.5871, test_loss: 1.2816, test_f1: 0.5286
 epoch: 80, train_loss: 0.5805, test_loss: 1.2351, test_f1: 0.5500
 epoch: 81, train_loss: 0.5899, test_loss: 1.2556, test_f1: 0.5245
 epoch: 82, train_loss: 0.5671, test_loss: 1.2562, test_f1: 0.5318
 epoch: 83, train_loss: 0.5692, test_loss: 1.2835, test_f1: 0.5358
 epoch: 84, train_loss: 0.5744, test_loss: 1.2904, test_f1: 0.5470
 epoch: 85, train_loss: 0.5618, test_loss: 1.2736, test_f1: 0.5312
 epoch: 86, train_loss: 0.5486, test_loss: 1.2736, test_f1: 0.5217
 epoch: 87, train_loss: 0.5565, test_loss: 1.3686, test_f1: 0.5342
 epoch: 88, train_loss: 0.5557, test_loss: 1.3258, test_f1: 0.5344
 epoch: 89, train_loss: 0.5611, test_loss: 1.2700, test_f1: 0.5281
 epoch: 90, train_loss: 0.5634, test_loss: 1.2766, test_f1: 0.5346
 epoch: 91, train_loss: 0.5521, test_loss: 1.2605, test_f1: 0.5397
 epoch: 92, train_loss: 0.5488, test_loss: 1.2925, test_f1: 0.5352
 epoch: 93, train_loss: 0.5278, test_loss: 1.3160, test_f1: 0.5480
 epoch: 94, train_loss: 0.5298, test_loss: 1.3134, test_f1: 0.5274
 epoch: 95, train_loss: 0.5303, test_loss: 1.3615, test_f1: 0.5390
 epoch: 96, train_loss: 0.5295, test_loss: 1.3493, test_f1: 0.5346
 epoch: 97, train_loss: 0.5338, test_loss: 1.3575, test_f1: 0.5506
 epoch: 98, train_loss: 0.5257, test_loss: 1.3740, test_f1: 0.5583
 epoch: 99, train_loss: 0.5339, test_loss: 1.3454, test_f1: 0.5459
##################ITERATION #6 ****************************************
 epoch: 0, train_loss: 1.3080, test_loss: 1.2475, test_f1: 0.2918
 epoch: 1, train_loss: 1.2109, test_loss: 1.1703, test_f1: 0.4172
 epoch: 2, train_loss: 1.1828, test_loss: 1.1224, test_f1: 0.4328
 epoch: 3, train_loss: 1.1479, test_loss: 1.1003, test_f1: 0.4382
 epoch: 4, train_loss: 1.1333, test_loss: 1.0804, test_f1: 0.4489
 epoch: 5, train_loss: 1.1127, test_loss: 1.0677, test_f1: 0.4582
 epoch: 6, train_loss: 1.0987, test_loss: 1.0434, test_f1: 0.4758
 epoch: 7, train_loss: 1.0827, test_loss: 1.0395, test_f1: 0.4633
 epoch: 8, train_loss: 1.0746, test_loss: 1.0324, test_f1: 0.4777
 epoch: 9, train_loss: 1.0499, test_loss: 1.0304, test_f1: 0.4528
 epoch: 10, train_loss: 1.0425, test_loss: 1.0187, test_f1: 0.4596
 epoch: 11, train_loss: 1.0337, test_loss: 1.0163, test_f1: 0.4565
 epoch: 12, train_loss: 1.0268, test_loss: 1.0060, test_f1: 0.4661
 epoch: 13, train_loss: 1.0033, test_loss: 1.0105, test_f1: 0.4629
 epoch: 14, train_loss: 1.0003, test_loss: 1.0026, test_f1: 0.4716
 epoch: 15, train_loss: 0.9801, test_loss: 0.9875, test_f1: 0.4901
 epoch: 16, train_loss: 0.9926, test_loss: 1.0027, test_f1: 0.4741
 epoch: 17, train_loss: 0.9756, test_loss: 1.0087, test_f1: 0.4844
 epoch: 18, train_loss: 0.9698, test_loss: 0.9912, test_f1: 0.4889
 epoch: 19, train_loss: 0.9479, test_loss: 0.9917, test_f1: 0.4870
 epoch: 20, train_loss: 0.9426, test_loss: 1.0048, test_f1: 0.4739
 epoch: 21, train_loss: 0.9330, test_loss: 0.9934, test_f1: 0.4819
 epoch: 22, train_loss: 0.9165, test_loss: 1.0027, test_f1: 0.4860
 epoch: 23, train_loss: 0.9113, test_loss: 1.0014, test_f1: 0.4823
 epoch: 24, train_loss: 0.9052, test_loss: 0.9999, test_f1: 0.4843
 epoch: 25, train_loss: 0.9070, test_loss: 1.0089, test_f1: 0.4801
 epoch: 26, train_loss: 0.9000, test_loss: 0.9974, test_f1: 0.4997
 epoch: 27, train_loss: 0.8787, test_loss: 0.9979, test_f1: 0.4963
 epoch: 28, train_loss: 0.8739, test_loss: 0.9971, test_f1: 0.5112
 epoch: 29, train_loss: 0.8576, test_loss: 1.0159, test_f1: 0.5111
 epoch: 30, train_loss: 0.8639, test_loss: 1.0357, test_f1: 0.4915
 epoch: 31, train_loss: 0.8396, test_loss: 1.0436, test_f1: 0.4990
 epoch: 32, train_loss: 0.8438, test_loss: 1.0465, test_f1: 0.5051
 epoch: 33, train_loss: 0.8401, test_loss: 1.0817, test_f1: 0.4991
 epoch: 34, train_loss: 0.8254, test_loss: 1.0555, test_f1: 0.4831
 epoch: 35, train_loss: 0.8138, test_loss: 1.0903, test_f1: 0.4808
 epoch: 36, train_loss: 0.8066, test_loss: 1.1374, test_f1: 0.4911
 epoch: 37, train_loss: 0.7932, test_loss: 1.0893, test_f1: 0.4908
 epoch: 38, train_loss: 0.7997, test_loss: 1.1253, test_f1: 0.5034
 epoch: 39, train_loss: 0.7880, test_loss: 1.1147, test_f1: 0.4553
 epoch: 40, train_loss: 0.7829, test_loss: 1.0973, test_f1: 0.4831
 epoch: 41, train_loss: 0.7699, test_loss: 1.1382, test_f1: 0.4995
 epoch: 42, train_loss: 0.7587, test_loss: 1.1014, test_f1: 0.5074
 epoch: 43, train_loss: 0.7435, test_loss: 1.1534, test_f1: 0.4937
 epoch: 44, train_loss: 0.7341, test_loss: 1.1602, test_f1: 0.4999
 epoch: 45, train_loss: 0.7431, test_loss: 1.1820, test_f1: 0.4959
 epoch: 46, train_loss: 0.7431, test_loss: 1.1485, test_f1: 0.5051
 epoch: 47, train_loss: 0.7332, test_loss: 1.1953, test_f1: 0.4966
 epoch: 48, train_loss: 0.7265, test_loss: 1.1921, test_f1: 0.4904
 epoch: 49, train_loss: 0.7123, test_loss: 1.2171, test_f1: 0.4868
 epoch: 50, train_loss: 0.7047, test_loss: 1.1989, test_f1: 0.5141
 epoch: 51, train_loss: 0.7133, test_loss: 1.2141, test_f1: 0.4935
 epoch: 52, train_loss: 0.6830, test_loss: 1.2455, test_f1: 0.5028
 epoch: 53, train_loss: 0.6763, test_loss: 1.2675, test_f1: 0.4916
 epoch: 54, train_loss: 0.6762, test_loss: 1.2553, test_f1: 0.5008
 epoch: 55, train_loss: 0.6697, test_loss: 1.2319, test_f1: 0.5151
 epoch: 56, train_loss: 0.6722, test_loss: 1.2734, test_f1: 0.4989
 epoch: 57, train_loss: 0.6628, test_loss: 1.2786, test_f1: 0.5011
 epoch: 58, train_loss: 0.6492, test_loss: 1.2679, test_f1: 0.5133
 epoch: 59, train_loss: 0.6540, test_loss: 1.2948, test_f1: 0.4947
 epoch: 60, train_loss: 0.6548, test_loss: 1.2893, test_f1: 0.5109
 epoch: 61, train_loss: 0.6516, test_loss: 1.3607, test_f1: 0.4891
 epoch: 62, train_loss: 0.6288, test_loss: 1.3504, test_f1: 0.4972
 epoch: 63, train_loss: 0.6404, test_loss: 1.3074, test_f1: 0.5007
 epoch: 64, train_loss: 0.6331, test_loss: 1.3675, test_f1: 0.5055
 epoch: 65, train_loss: 0.6434, test_loss: 1.3658, test_f1: 0.5005
 epoch: 66, train_loss: 0.6256, test_loss: 1.3067, test_f1: 0.5166
 epoch: 67, train_loss: 0.6151, test_loss: 1.3346, test_f1: 0.5129
 epoch: 68, train_loss: 0.6259, test_loss: 1.3518, test_f1: 0.5092
 epoch: 69, train_loss: 0.6232, test_loss: 1.3303, test_f1: 0.5183
 epoch: 70, train_loss: 0.6266, test_loss: 1.3126, test_f1: 0.5162
 epoch: 71, train_loss: 0.6232, test_loss: 1.3704, test_f1: 0.4988
 epoch: 72, train_loss: 0.6234, test_loss: 1.3304, test_f1: 0.5172
 epoch: 73, train_loss: 0.6151, test_loss: 1.3463, test_f1: 0.5053
 epoch: 74, train_loss: 0.6144, test_loss: 1.3556, test_f1: 0.5246
 epoch: 75, train_loss: 0.6110, test_loss: 1.3687, test_f1: 0.5077
 epoch: 76, train_loss: 0.5916, test_loss: 1.3776, test_f1: 0.5168
 epoch: 77, train_loss: 0.6063, test_loss: 1.3805, test_f1: 0.5163
 epoch: 78, train_loss: 0.6078, test_loss: 1.4190, test_f1: 0.5108
 epoch: 79, train_loss: 0.5827, test_loss: 1.4263, test_f1: 0.5034
 epoch: 80, train_loss: 0.6045, test_loss: 1.4111, test_f1: 0.4986
 epoch: 81, train_loss: 0.5776, test_loss: 1.4220, test_f1: 0.5253
 epoch: 82, train_loss: 0.5939, test_loss: 1.3732, test_f1: 0.5121
 epoch: 83, train_loss: 0.5673, test_loss: 1.4357, test_f1: 0.5097
 epoch: 84, train_loss: 0.5721, test_loss: 1.4300, test_f1: 0.5100
 epoch: 85, train_loss: 0.5869, test_loss: 1.4617, test_f1: 0.4982
 epoch: 86, train_loss: 0.5669, test_loss: 1.4099, test_f1: 0.5129
 epoch: 87, train_loss: 0.5709, test_loss: 1.5220, test_f1: 0.5074
 epoch: 88, train_loss: 0.5699, test_loss: 1.4687, test_f1: 0.5203
 epoch: 89, train_loss: 0.5595, test_loss: 1.4660, test_f1: 0.5037
 epoch: 90, train_loss: 0.5734, test_loss: 1.4534, test_f1: 0.5059
 epoch: 91, train_loss: 0.5720, test_loss: 1.4297, test_f1: 0.5220
 epoch: 92, train_loss: 0.5696, test_loss: 1.4773, test_f1: 0.5170
 epoch: 93, train_loss: 0.5647, test_loss: 1.4796, test_f1: 0.5158
 epoch: 94, train_loss: 0.5531, test_loss: 1.4791, test_f1: 0.5144
 epoch: 95, train_loss: 0.5511, test_loss: 1.5174, test_f1: 0.5244
 epoch: 96, train_loss: 0.5502, test_loss: 1.4862, test_f1: 0.5106
 epoch: 97, train_loss: 0.5544, test_loss: 1.5437, test_f1: 0.5097
 epoch: 98, train_loss: 0.5360, test_loss: 1.5337, test_f1: 0.5077
 epoch: 99, train_loss: 0.5337, test_loss: 1.5406, test_f1: 0.5329
##################ITERATION #7 ****************************************
 epoch: 0, train_loss: 1.2877, test_loss: 1.2537, test_f1: 0.3090
 epoch: 1, train_loss: 1.1963, test_loss: 1.1569, test_f1: 0.4001
 epoch: 2, train_loss: 1.1717, test_loss: 1.1027, test_f1: 0.4437
 epoch: 3, train_loss: 1.1481, test_loss: 1.0993, test_f1: 0.4574
 epoch: 4, train_loss: 1.1348, test_loss: 1.0918, test_f1: 0.4814
 epoch: 5, train_loss: 1.1106, test_loss: 1.0799, test_f1: 0.4441
 epoch: 6, train_loss: 1.0902, test_loss: 1.0745, test_f1: 0.4496
 epoch: 7, train_loss: 1.0815, test_loss: 1.0588, test_f1: 0.4518
 epoch: 8, train_loss: 1.0638, test_loss: 1.0522, test_f1: 0.4492
 epoch: 9, train_loss: 1.0435, test_loss: 1.0337, test_f1: 0.4402
 epoch: 10, train_loss: 1.0275, test_loss: 1.0264, test_f1: 0.4585
 epoch: 11, train_loss: 1.0149, test_loss: 1.0277, test_f1: 0.4613
 epoch: 12, train_loss: 1.0110, test_loss: 1.0269, test_f1: 0.4493
 epoch: 13, train_loss: 0.9908, test_loss: 1.0394, test_f1: 0.4571
 epoch: 14, train_loss: 0.9870, test_loss: 1.0356, test_f1: 0.4706
 epoch: 15, train_loss: 0.9786, test_loss: 1.0254, test_f1: 0.4747
 epoch: 16, train_loss: 0.9600, test_loss: 1.0208, test_f1: 0.4886
 epoch: 17, train_loss: 0.9468, test_loss: 1.0163, test_f1: 0.4835
 epoch: 18, train_loss: 0.9420, test_loss: 1.0332, test_f1: 0.4749
 epoch: 19, train_loss: 0.9374, test_loss: 1.0180, test_f1: 0.4738
 epoch: 20, train_loss: 0.9313, test_loss: 1.0165, test_f1: 0.4862
 epoch: 21, train_loss: 0.9118, test_loss: 1.0164, test_f1: 0.4942
 epoch: 22, train_loss: 0.9121, test_loss: 1.0305, test_f1: 0.4684
 epoch: 23, train_loss: 0.9015, test_loss: 1.0210, test_f1: 0.4927
 epoch: 24, train_loss: 0.8958, test_loss: 1.0215, test_f1: 0.4924
 epoch: 25, train_loss: 0.8801, test_loss: 1.0404, test_f1: 0.4855
 epoch: 26, train_loss: 0.8740, test_loss: 1.0402, test_f1: 0.4762
 epoch: 27, train_loss: 0.8613, test_loss: 1.0348, test_f1: 0.4901
 epoch: 28, train_loss: 0.8397, test_loss: 1.0270, test_f1: 0.5092
 epoch: 29, train_loss: 0.8459, test_loss: 1.0295, test_f1: 0.4883
 epoch: 30, train_loss: 0.8318, test_loss: 1.0515, test_f1: 0.5047
 epoch: 31, train_loss: 0.8233, test_loss: 1.0486, test_f1: 0.5153
 epoch: 32, train_loss: 0.8136, test_loss: 1.0739, test_f1: 0.5123
 epoch: 33, train_loss: 0.8171, test_loss: 1.0598, test_f1: 0.5185
 epoch: 34, train_loss: 0.7926, test_loss: 1.0643, test_f1: 0.5111
 epoch: 35, train_loss: 0.7979, test_loss: 1.0847, test_f1: 0.4992
 epoch: 36, train_loss: 0.7821, test_loss: 1.0802, test_f1: 0.5118
 epoch: 37, train_loss: 0.7773, test_loss: 1.0716, test_f1: 0.5264
 epoch: 38, train_loss: 0.7739, test_loss: 1.0780, test_f1: 0.5121
 epoch: 39, train_loss: 0.7704, test_loss: 1.0672, test_f1: 0.5302
 epoch: 40, train_loss: 0.7685, test_loss: 1.0763, test_f1: 0.5243
 epoch: 41, train_loss: 0.7459, test_loss: 1.0711, test_f1: 0.5237
 epoch: 42, train_loss: 0.7497, test_loss: 1.1323, test_f1: 0.4993
 epoch: 43, train_loss: 0.7250, test_loss: 1.1376, test_f1: 0.5131
 epoch: 44, train_loss: 0.7305, test_loss: 1.1345, test_f1: 0.5142
 epoch: 45, train_loss: 0.7149, test_loss: 1.1256, test_f1: 0.5122
 epoch: 46, train_loss: 0.7053, test_loss: 1.1351, test_f1: 0.5042
 epoch: 47, train_loss: 0.7135, test_loss: 1.1396, test_f1: 0.5164
 epoch: 48, train_loss: 0.6942, test_loss: 1.1650, test_f1: 0.5078
 epoch: 49, train_loss: 0.6865, test_loss: 1.1588, test_f1: 0.5180
 epoch: 50, train_loss: 0.6868, test_loss: 1.1673, test_f1: 0.5132
 epoch: 51, train_loss: 0.6704, test_loss: 1.1425, test_f1: 0.5023
 epoch: 52, train_loss: 0.6770, test_loss: 1.1983, test_f1: 0.5198
 epoch: 53, train_loss: 0.6510, test_loss: 1.1618, test_f1: 0.5177
 epoch: 54, train_loss: 0.6543, test_loss: 1.1553, test_f1: 0.5230
 epoch: 55, train_loss: 0.6659, test_loss: 1.2032, test_f1: 0.5219
 epoch: 56, train_loss: 0.6486, test_loss: 1.1903, test_f1: 0.5252
 epoch: 57, train_loss: 0.6409, test_loss: 1.1857, test_f1: 0.5248
 epoch: 58, train_loss: 0.6521, test_loss: 1.1917, test_f1: 0.5088
 epoch: 59, train_loss: 0.6394, test_loss: 1.1885, test_f1: 0.5079
 epoch: 60, train_loss: 0.6288, test_loss: 1.1837, test_f1: 0.5351
 epoch: 61, train_loss: 0.6159, test_loss: 1.1697, test_f1: 0.5284
 epoch: 62, train_loss: 0.6215, test_loss: 1.1966, test_f1: 0.5307
 epoch: 63, train_loss: 0.6121, test_loss: 1.2282, test_f1: 0.5313
 epoch: 64, train_loss: 0.6186, test_loss: 1.2422, test_f1: 0.5194
 epoch: 65, train_loss: 0.6154, test_loss: 1.2255, test_f1: 0.5302
 epoch: 66, train_loss: 0.6084, test_loss: 1.2302, test_f1: 0.5329
 epoch: 67, train_loss: 0.6076, test_loss: 1.2288, test_f1: 0.5363
 epoch: 68, train_loss: 0.5979, test_loss: 1.2508, test_f1: 0.5251
 epoch: 69, train_loss: 0.6066, test_loss: 1.2480, test_f1: 0.5195
 epoch: 70, train_loss: 0.5990, test_loss: 1.2762, test_f1: 0.5257
 epoch: 71, train_loss: 0.5888, test_loss: 1.2769, test_f1: 0.5168
 epoch: 72, train_loss: 0.5893, test_loss: 1.2669, test_f1: 0.5230
 epoch: 73, train_loss: 0.6086, test_loss: 1.2600, test_f1: 0.5265
 epoch: 74, train_loss: 0.5814, test_loss: 1.2722, test_f1: 0.5327
 epoch: 75, train_loss: 0.5907, test_loss: 1.2651, test_f1: 0.5125
 epoch: 76, train_loss: 0.5874, test_loss: 1.2855, test_f1: 0.5290
 epoch: 77, train_loss: 0.5815, test_loss: 1.2820, test_f1: 0.5326
 epoch: 78, train_loss: 0.5731, test_loss: 1.2676, test_f1: 0.5213
 epoch: 79, train_loss: 0.5912, test_loss: 1.2622, test_f1: 0.5182
 epoch: 80, train_loss: 0.5723, test_loss: 1.2680, test_f1: 0.5326
 epoch: 81, train_loss: 0.5617, test_loss: 1.2557, test_f1: 0.5367
 epoch: 82, train_loss: 0.5572, test_loss: 1.2735, test_f1: 0.5205
 epoch: 83, train_loss: 0.5734, test_loss: 1.2965, test_f1: 0.5158
 epoch: 84, train_loss: 0.5521, test_loss: 1.2779, test_f1: 0.5236
 epoch: 85, train_loss: 0.5494, test_loss: 1.3102, test_f1: 0.5169
 epoch: 86, train_loss: 0.5555, test_loss: 1.2695, test_f1: 0.5251
 epoch: 87, train_loss: 0.5560, test_loss: 1.3079, test_f1: 0.5446
 epoch: 88, train_loss: 0.5373, test_loss: 1.2892, test_f1: 0.5299
 epoch: 89, train_loss: 0.5529, test_loss: 1.3242, test_f1: 0.5213
 epoch: 90, train_loss: 0.5357, test_loss: 1.3334, test_f1: 0.5336
 epoch: 91, train_loss: 0.5446, test_loss: 1.2894, test_f1: 0.5410
 epoch: 92, train_loss: 0.5298, test_loss: 1.3189, test_f1: 0.5366
 epoch: 93, train_loss: 0.5351, test_loss: 1.3278, test_f1: 0.5410
 epoch: 94, train_loss: 0.5386, test_loss: 1.3453, test_f1: 0.5382
 epoch: 95, train_loss: 0.5451, test_loss: 1.3431, test_f1: 0.5188
 epoch: 96, train_loss: 0.5374, test_loss: 1.3421, test_f1: 0.5331
 epoch: 97, train_loss: 0.5247, test_loss: 1.3559, test_f1: 0.5236
 epoch: 98, train_loss: 0.5247, test_loss: 1.3951, test_f1: 0.5129
 epoch: 99, train_loss: 0.5233, test_loss: 1.3645, test_f1: 0.5378
##################ITERATION #8 ****************************************
 epoch: 0, train_loss: 1.4031, test_loss: 1.2860, test_f1: 0.3224
 epoch: 1, train_loss: 1.2386, test_loss: 1.1823, test_f1: 0.3830
 epoch: 2, train_loss: 1.1991, test_loss: 1.1482, test_f1: 0.4492
 epoch: 3, train_loss: 1.1804, test_loss: 1.1700, test_f1: 0.4060
 epoch: 4, train_loss: 1.1608, test_loss: 1.1482, test_f1: 0.4484
 epoch: 5, train_loss: 1.1522, test_loss: 1.1625, test_f1: 0.4226
 epoch: 6, train_loss: 1.1275, test_loss: 1.1138, test_f1: 0.4441
 epoch: 7, train_loss: 1.1210, test_loss: 1.1017, test_f1: 0.4482
 epoch: 8, train_loss: 1.1031, test_loss: 1.1028, test_f1: 0.4394
 epoch: 9, train_loss: 1.0862, test_loss: 1.0689, test_f1: 0.4513
 epoch: 10, train_loss: 1.0665, test_loss: 1.0515, test_f1: 0.4708
 epoch: 11, train_loss: 1.0616, test_loss: 1.0421, test_f1: 0.4638
 epoch: 12, train_loss: 1.0408, test_loss: 1.0454, test_f1: 0.4705
 epoch: 13, train_loss: 1.0270, test_loss: 1.0312, test_f1: 0.4650
 epoch: 14, train_loss: 1.0285, test_loss: 1.0338, test_f1: 0.4462
 epoch: 15, train_loss: 1.0151, test_loss: 1.0133, test_f1: 0.4790
 epoch: 16, train_loss: 0.9890, test_loss: 1.0365, test_f1: 0.4590
 epoch: 17, train_loss: 0.9933, test_loss: 1.0039, test_f1: 0.4939
 epoch: 18, train_loss: 0.9846, test_loss: 1.0280, test_f1: 0.4613
 epoch: 19, train_loss: 0.9712, test_loss: 1.0127, test_f1: 0.4776
 epoch: 20, train_loss: 0.9583, test_loss: 0.9894, test_f1: 0.4923
 epoch: 21, train_loss: 0.9511, test_loss: 0.9957, test_f1: 0.4753
 epoch: 22, train_loss: 0.9421, test_loss: 1.0113, test_f1: 0.4821
 epoch: 23, train_loss: 0.9403, test_loss: 1.0166, test_f1: 0.4727
 epoch: 24, train_loss: 0.9425, test_loss: 1.0020, test_f1: 0.4934
 epoch: 25, train_loss: 0.9328, test_loss: 0.9971, test_f1: 0.4940
 epoch: 26, train_loss: 0.9101, test_loss: 0.9872, test_f1: 0.5014
 epoch: 27, train_loss: 0.9131, test_loss: 1.0021, test_f1: 0.4806
 epoch: 28, train_loss: 0.8836, test_loss: 1.0375, test_f1: 0.4595
 epoch: 29, train_loss: 0.8891, test_loss: 0.9702, test_f1: 0.4976
 epoch: 30, train_loss: 0.8712, test_loss: 1.0232, test_f1: 0.4720
 epoch: 31, train_loss: 0.8803, test_loss: 1.0034, test_f1: 0.4915
 epoch: 32, train_loss: 0.8808, test_loss: 1.0325, test_f1: 0.4848
 epoch: 33, train_loss: 0.8464, test_loss: 1.0063, test_f1: 0.4882
 epoch: 34, train_loss: 0.8419, test_loss: 1.0627, test_f1: 0.4963
 epoch: 35, train_loss: 0.8623, test_loss: 1.0446, test_f1: 0.4855
 epoch: 36, train_loss: 0.8331, test_loss: 1.0829, test_f1: 0.4901
 epoch: 37, train_loss: 0.8290, test_loss: 1.0758, test_f1: 0.5044
 epoch: 38, train_loss: 0.8312, test_loss: 1.0782, test_f1: 0.4868
 epoch: 39, train_loss: 0.8091, test_loss: 1.0642, test_f1: 0.4996
 epoch: 40, train_loss: 0.7972, test_loss: 1.1049, test_f1: 0.4775
 epoch: 41, train_loss: 0.7957, test_loss: 1.0305, test_f1: 0.5044
 epoch: 42, train_loss: 0.7865, test_loss: 1.0767, test_f1: 0.4927
 epoch: 43, train_loss: 0.7957, test_loss: 1.0678, test_f1: 0.4821
 epoch: 44, train_loss: 0.7740, test_loss: 1.0617, test_f1: 0.4974
 epoch: 45, train_loss: 0.7760, test_loss: 1.0687, test_f1: 0.5054
 epoch: 46, train_loss: 0.7734, test_loss: 1.0932, test_f1: 0.4897
 epoch: 47, train_loss: 0.7564, test_loss: 1.1414, test_f1: 0.5086
 epoch: 48, train_loss: 0.7476, test_loss: 1.0797, test_f1: 0.4895
 epoch: 49, train_loss: 0.7492, test_loss: 1.0899, test_f1: 0.5070
 epoch: 50, train_loss: 0.7441, test_loss: 1.1827, test_f1: 0.4977
 epoch: 51, train_loss: 0.7310, test_loss: 1.0774, test_f1: 0.5112
 epoch: 52, train_loss: 0.7184, test_loss: 1.1387, test_f1: 0.5010
 epoch: 53, train_loss: 0.7100, test_loss: 1.1314, test_f1: 0.4975
 epoch: 54, train_loss: 0.7063, test_loss: 1.0785, test_f1: 0.4999
 epoch: 55, train_loss: 0.7132, test_loss: 1.1131, test_f1: 0.4894
 epoch: 56, train_loss: 0.7070, test_loss: 1.1430, test_f1: 0.4982
 epoch: 57, train_loss: 0.7063, test_loss: 1.1638, test_f1: 0.4941
 epoch: 58, train_loss: 0.6989, test_loss: 1.1558, test_f1: 0.4944
 epoch: 59, train_loss: 0.6964, test_loss: 1.1321, test_f1: 0.5151
 epoch: 60, train_loss: 0.7019, test_loss: 1.0910, test_f1: 0.5024
 epoch: 61, train_loss: 0.6970, test_loss: 1.1023, test_f1: 0.5105
 epoch: 62, train_loss: 0.6800, test_loss: 1.2133, test_f1: 0.5134
 epoch: 63, train_loss: 0.6788, test_loss: 1.1521, test_f1: 0.4936
 epoch: 64, train_loss: 0.6626, test_loss: 1.1226, test_f1: 0.5104
 epoch: 65, train_loss: 0.6734, test_loss: 1.1736, test_f1: 0.4964
 epoch: 66, train_loss: 0.6536, test_loss: 1.1966, test_f1: 0.5018
 epoch: 67, train_loss: 0.6703, test_loss: 1.2020, test_f1: 0.4994
 epoch: 68, train_loss: 0.6633, test_loss: 1.1668, test_f1: 0.4966
 epoch: 69, train_loss: 0.6628, test_loss: 1.1279, test_f1: 0.5094
 epoch: 70, train_loss: 0.6624, test_loss: 1.1531, test_f1: 0.5187
 epoch: 71, train_loss: 0.6737, test_loss: 1.1532, test_f1: 0.5293
 epoch: 72, train_loss: 0.6568, test_loss: 1.2048, test_f1: 0.4988
 epoch: 73, train_loss: 0.6501, test_loss: 1.1508, test_f1: 0.5185
 epoch: 74, train_loss: 0.6444, test_loss: 1.2184, test_f1: 0.5102
 epoch: 75, train_loss: 0.6617, test_loss: 1.2593, test_f1: 0.5119
 epoch: 76, train_loss: 0.6453, test_loss: 1.1687, test_f1: 0.4952
 epoch: 77, train_loss: 0.6426, test_loss: 1.2527, test_f1: 0.5003
 epoch: 78, train_loss: 0.6323, test_loss: 1.2242, test_f1: 0.4909
 epoch: 79, train_loss: 0.6455, test_loss: 1.2577, test_f1: 0.4984
 epoch: 80, train_loss: 0.6099, test_loss: 1.2475, test_f1: 0.5034
 epoch: 81, train_loss: 0.6234, test_loss: 1.2603, test_f1: 0.5072
 epoch: 82, train_loss: 0.6237, test_loss: 1.2075, test_f1: 0.5225
 epoch: 83, train_loss: 0.6280, test_loss: 1.2626, test_f1: 0.4965
 epoch: 84, train_loss: 0.6219, test_loss: 1.2324, test_f1: 0.5230
 epoch: 85, train_loss: 0.6195, test_loss: 1.2029, test_f1: 0.5219
 epoch: 86, train_loss: 0.6145, test_loss: 1.2821, test_f1: 0.5200
 epoch: 87, train_loss: 0.6153, test_loss: 1.2590, test_f1: 0.5115
 epoch: 88, train_loss: 0.6107, test_loss: 1.3296, test_f1: 0.5150
 epoch: 89, train_loss: 0.6007, test_loss: 1.2724, test_f1: 0.5122
 epoch: 90, train_loss: 0.6071, test_loss: 1.2702, test_f1: 0.5137
 epoch: 91, train_loss: 0.6133, test_loss: 1.2123, test_f1: 0.5389
 epoch: 92, train_loss: 0.6030, test_loss: 1.2653, test_f1: 0.5121
 epoch: 93, train_loss: 0.5904, test_loss: 1.2440, test_f1: 0.5262
 epoch: 94, train_loss: 0.5944, test_loss: 1.2359, test_f1: 0.5173
 epoch: 95, train_loss: 0.5937, test_loss: 1.2377, test_f1: 0.5203
 epoch: 96, train_loss: 0.5876, test_loss: 1.2500, test_f1: 0.5255
 epoch: 97, train_loss: 0.5913, test_loss: 1.2286, test_f1: 0.5387
 epoch: 98, train_loss: 0.5806, test_loss: 1.2321, test_f1: 0.5461
 epoch: 99, train_loss: 0.5878, test_loss: 1.2584, test_f1: 0.5337
##################ITERATION #9 ****************************************
 epoch: 0, train_loss: 1.3530, test_loss: 1.2430, test_f1: 0.3056
 epoch: 1, train_loss: 1.2322, test_loss: 1.1559, test_f1: 0.4626
 epoch: 2, train_loss: 1.2009, test_loss: 1.1221, test_f1: 0.4523
 epoch: 3, train_loss: 1.1838, test_loss: 1.1124, test_f1: 0.4430
 epoch: 4, train_loss: 1.1552, test_loss: 1.1017, test_f1: 0.4535
 epoch: 5, train_loss: 1.1353, test_loss: 1.0886, test_f1: 0.4452
 epoch: 6, train_loss: 1.1190, test_loss: 1.0617, test_f1: 0.4567
 epoch: 7, train_loss: 1.0965, test_loss: 1.0690, test_f1: 0.4604
 epoch: 8, train_loss: 1.0825, test_loss: 1.0560, test_f1: 0.4646
 epoch: 9, train_loss: 1.0782, test_loss: 1.0409, test_f1: 0.4659
 epoch: 10, train_loss: 1.0531, test_loss: 1.0362, test_f1: 0.4527
 epoch: 11, train_loss: 1.0426, test_loss: 1.0398, test_f1: 0.4457
 epoch: 12, train_loss: 1.0467, test_loss: 1.0402, test_f1: 0.4601
 epoch: 13, train_loss: 1.0144, test_loss: 1.0178, test_f1: 0.4936
 epoch: 14, train_loss: 1.0039, test_loss: 1.0297, test_f1: 0.4780
 epoch: 15, train_loss: 0.9939, test_loss: 1.0210, test_f1: 0.4756
 epoch: 16, train_loss: 0.9882, test_loss: 1.0155, test_f1: 0.4726
 epoch: 17, train_loss: 0.9743, test_loss: 1.0111, test_f1: 0.4671
 epoch: 18, train_loss: 0.9689, test_loss: 1.0125, test_f1: 0.4714
 epoch: 19, train_loss: 0.9525, test_loss: 0.9936, test_f1: 0.4821
 epoch: 20, train_loss: 0.9459, test_loss: 0.9954, test_f1: 0.4850
 epoch: 21, train_loss: 0.9301, test_loss: 1.0239, test_f1: 0.4770
 epoch: 22, train_loss: 0.9335, test_loss: 0.9906, test_f1: 0.4916
 epoch: 23, train_loss: 0.9140, test_loss: 1.0027, test_f1: 0.4768
 epoch: 24, train_loss: 0.9050, test_loss: 0.9900, test_f1: 0.5046
 epoch: 25, train_loss: 0.8940, test_loss: 0.9771, test_f1: 0.5013
 epoch: 26, train_loss: 0.8850, test_loss: 1.0023, test_f1: 0.4807
 epoch: 27, train_loss: 0.8711, test_loss: 1.0244, test_f1: 0.4849
 epoch: 28, train_loss: 0.8764, test_loss: 0.9988, test_f1: 0.4974
 epoch: 29, train_loss: 0.8707, test_loss: 1.0150, test_f1: 0.5024
 epoch: 30, train_loss: 0.8575, test_loss: 1.0071, test_f1: 0.4890
 epoch: 31, train_loss: 0.8428, test_loss: 1.0282, test_f1: 0.4840
 epoch: 32, train_loss: 0.8506, test_loss: 1.0162, test_f1: 0.4959
 epoch: 33, train_loss: 0.8358, test_loss: 1.0024, test_f1: 0.4979
 epoch: 34, train_loss: 0.8299, test_loss: 1.0396, test_f1: 0.5035
 epoch: 35, train_loss: 0.8217, test_loss: 1.0525, test_f1: 0.4949
 epoch: 36, train_loss: 0.8138, test_loss: 1.0204, test_f1: 0.5107
 epoch: 37, train_loss: 0.8016, test_loss: 1.0582, test_f1: 0.5089
 epoch: 38, train_loss: 0.7886, test_loss: 1.0331, test_f1: 0.5191
 epoch: 39, train_loss: 0.7969, test_loss: 1.0713, test_f1: 0.5141
 epoch: 40, train_loss: 0.7631, test_loss: 1.0879, test_f1: 0.5184
 epoch: 41, train_loss: 0.7728, test_loss: 1.0489, test_f1: 0.5160
 epoch: 42, train_loss: 0.7596, test_loss: 1.1056, test_f1: 0.5180
 epoch: 43, train_loss: 0.7598, test_loss: 1.0819, test_f1: 0.5383
 epoch: 44, train_loss: 0.7397, test_loss: 1.0922, test_f1: 0.5097
 epoch: 45, train_loss: 0.7480, test_loss: 1.0809, test_f1: 0.5117
 epoch: 46, train_loss: 0.7499, test_loss: 1.1441, test_f1: 0.5143
 epoch: 47, train_loss: 0.7242, test_loss: 1.0664, test_f1: 0.5330
 epoch: 48, train_loss: 0.7250, test_loss: 1.0950, test_f1: 0.5274
 epoch: 49, train_loss: 0.7301, test_loss: 1.1198, test_f1: 0.5156
 epoch: 50, train_loss: 0.7056, test_loss: 1.1249, test_f1: 0.5297
 epoch: 51, train_loss: 0.6902, test_loss: 1.0812, test_f1: 0.5374
 epoch: 52, train_loss: 0.6978, test_loss: 1.1121, test_f1: 0.5071
 epoch: 53, train_loss: 0.7007, test_loss: 1.1031, test_f1: 0.5221
 epoch: 54, train_loss: 0.6835, test_loss: 1.1128, test_f1: 0.5356
 epoch: 55, train_loss: 0.6738, test_loss: 1.1524, test_f1: 0.5311
 epoch: 56, train_loss: 0.6736, test_loss: 1.1339, test_f1: 0.5316
 epoch: 57, train_loss: 0.6775, test_loss: 1.1507, test_f1: 0.5198
 epoch: 58, train_loss: 0.6680, test_loss: 1.1737, test_f1: 0.5263
 epoch: 59, train_loss: 0.6652, test_loss: 1.1616, test_f1: 0.5346
 epoch: 60, train_loss: 0.6468, test_loss: 1.1761, test_f1: 0.5285
 epoch: 61, train_loss: 0.6594, test_loss: 1.1714, test_f1: 0.5339
 epoch: 62, train_loss: 0.6547, test_loss: 1.1681, test_f1: 0.5411
 epoch: 63, train_loss: 0.6479, test_loss: 1.1511, test_f1: 0.5437
 epoch: 64, train_loss: 0.6421, test_loss: 1.1619, test_f1: 0.5345
 epoch: 65, train_loss: 0.6500, test_loss: 1.1902, test_f1: 0.5292
 epoch: 66, train_loss: 0.6357, test_loss: 1.1657, test_f1: 0.5492
 epoch: 67, train_loss: 0.6351, test_loss: 1.1805, test_f1: 0.5319
 epoch: 68, train_loss: 0.6334, test_loss: 1.1694, test_f1: 0.5559
 epoch: 69, train_loss: 0.6240, test_loss: 1.2159, test_f1: 0.5341
 epoch: 70, train_loss: 0.6211, test_loss: 1.2253, test_f1: 0.5390
 epoch: 71, train_loss: 0.6482, test_loss: 1.2116, test_f1: 0.5292
 epoch: 72, train_loss: 0.6102, test_loss: 1.2087, test_f1: 0.5403
 epoch: 73, train_loss: 0.6209, test_loss: 1.1940, test_f1: 0.5474
 epoch: 74, train_loss: 0.6220, test_loss: 1.1906, test_f1: 0.5536
 epoch: 75, train_loss: 0.6315, test_loss: 1.2512, test_f1: 0.5490
 epoch: 76, train_loss: 0.6066, test_loss: 1.2449, test_f1: 0.5368
 epoch: 77, train_loss: 0.6211, test_loss: 1.2413, test_f1: 0.5374
 epoch: 78, train_loss: 0.6079, test_loss: 1.2118, test_f1: 0.5588
 epoch: 79, train_loss: 0.6152, test_loss: 1.2283, test_f1: 0.5387
 epoch: 80, train_loss: 0.6120, test_loss: 1.2760, test_f1: 0.5303
 epoch: 81, train_loss: 0.6184, test_loss: 1.2472, test_f1: 0.5595
 epoch: 82, train_loss: 0.6080, test_loss: 1.2526, test_f1: 0.5584
 epoch: 83, train_loss: 0.6018, test_loss: 1.2972, test_f1: 0.5475
 epoch: 84, train_loss: 0.5832, test_loss: 1.3023, test_f1: 0.5499
 epoch: 85, train_loss: 0.5900, test_loss: 1.2519, test_f1: 0.5431
 epoch: 86, train_loss: 0.6024, test_loss: 1.2720, test_f1: 0.5449
 epoch: 87, train_loss: 0.5805, test_loss: 1.2849, test_f1: 0.5518
 epoch: 88, train_loss: 0.6018, test_loss: 1.2405, test_f1: 0.5480
 epoch: 89, train_loss: 0.5848, test_loss: 1.2962, test_f1: 0.5501
 epoch: 90, train_loss: 0.5825, test_loss: 1.3299, test_f1: 0.5549
 epoch: 91, train_loss: 0.5710, test_loss: 1.2739, test_f1: 0.5461
 epoch: 92, train_loss: 0.5731, test_loss: 1.3004, test_f1: 0.5525
 epoch: 93, train_loss: 0.5679, test_loss: 1.2806, test_f1: 0.5580
 epoch: 94, train_loss: 0.5696, test_loss: 1.2832, test_f1: 0.5618
 epoch: 95, train_loss: 0.5582, test_loss: 1.2706, test_f1: 0.5414
 epoch: 96, train_loss: 0.5553, test_loss: 1.3267, test_f1: 0.5497
 epoch: 97, train_loss: 0.5533, test_loss: 1.3117, test_f1: 0.5486
 epoch: 98, train_loss: 0.5577, test_loss: 1.3035, test_f1: 0.5549
 epoch: 99, train_loss: 0.5571, test_loss: 1.2987, test_f1: 0.5617

Training completed in 787.02 seconds
Best F1: 0.5618 at epoch 94
Mean F1 across iterations: 0.5397  0.0144
========================FINAL RESULTS================================
FEGIN weighted F1: 0.5618  0.0144
python main.py --data ltspice_examples --representation component_component --model FEGIN --layers 4 --hiddens 128 --batch_size 128 --lr 0.0001 --emb_size 128 --epochs 100 --save_appendix component_component_L4_H128_BS128_LR0.0001_E128 --no_val
-----



STDERR:
  File "main.py", line 370, in <module>
    main()
  File "main.py", line 254, in main
    dataset = dataset_class(
  File "/home/philip/projects/llm_inference_code_repo/Circuit-Completion-Using-GNNs/component_classification_with_link_prediction_head/evaluation/FEGIN/kernel/circuit_datasets.py", line 15, in __init__
    self.data, self.slices = torch.load(self.processed_paths[0])
  File "/home/philip/.local/lib/python3.8/site-packages/torch/serialization.py", line 1040, in load
    warnings.warn(
  File "/usr/lib/python3.8/warnings.py", line 109, in _showwarnmsg
    sw(msg.message, msg.category, msg.filename, msg.lineno,
  File "main.py", line 47, in warn_with_traceback
    traceback.print_stack(file=log)
/home/philip/projects/llm_inference_code_repo/Circuit-Completion-Using-GNNs/component_classification_with_link_prediction_head/evaluation/FEGIN/kernel/circuit_datasets.py:15: FutureWarning: You are using `torch.load` with `weights_only=False` (the current default value), which uses the default pickle module implicitly. It is possible to construct malicious pickle data which will execute arbitrary code during unpickling (See https://github.com/pytorch/pytorch/blob/main/SECURITY.md#untrusted-models for more details). In a future release, the default value for `weights_only` will be flipped to `True`. This limits the functions that could be executed during unpickling. Arbitrary objects will no longer be allowed to be loaded via this mode unless they are explicitly allowlisted by the user via `torch.serialization.add_safe_globals`. We recommend you start setting `weights_only=True` for any use case where you don't have full control of the loaded file. Please open an issue on GitHub for any issues related to this experimental feature.
  self.data, self.slices = torch.load(self.processed_paths[0])
