STDOUT:
Results will be saved in /home/philip/projects/ltspice_examples_code_repo/Circuit-Completion-Using-GNNs/component_classification_with_link_prediction_head/evaluation/FEGIN/results/model_FEGIN_dataset_ltspice_demos
Command line input: python main.py --data ltspice_demos --representation component_pin --model FEGIN --layers 6 --hiddens 32 --batch_size 32 --lr 0.01 --emb_size 512 --epochs 100 --save_appendix component_pin_L6_H32_BS32_LR0.01_E512 --no_val
 is saved.
-----
ltspice_demos - FEGIN
Using 6 layers, 32 hidden units, h = 2
Loading component_pin representation dataset
ENTERED
Training FEGIN on component_pin representation
Train: 1565, Test: 383
##################ITERATION #0 ****************************************
 epoch: 0, train_loss: 1.2520, test_loss: 1.1864, test_f1: 0.3979
 epoch: 1, train_loss: 1.0878, test_loss: 1.0578, test_f1: 0.4346
 epoch: 2, train_loss: 0.9862, test_loss: 1.1030, test_f1: 0.5056
 epoch: 3, train_loss: 0.9148, test_loss: 1.0804, test_f1: 0.5309
 epoch: 4, train_loss: 0.9040, test_loss: 1.0352, test_f1: 0.4200
 epoch: 5, train_loss: 0.8808, test_loss: 1.1713, test_f1: 0.4443
 epoch: 6, train_loss: 0.8734, test_loss: 0.9699, test_f1: 0.4582
 epoch: 7, train_loss: 0.8658, test_loss: 1.1885, test_f1: 0.3940
 epoch: 8, train_loss: 0.8510, test_loss: 1.0148, test_f1: 0.5709
 epoch: 9, train_loss: 0.8385, test_loss: 1.0005, test_f1: 0.5598
 epoch: 10, train_loss: 0.8343, test_loss: 1.0059, test_f1: 0.5079
 epoch: 11, train_loss: 0.8245, test_loss: 1.0432, test_f1: 0.5122
 epoch: 12, train_loss: 0.8270, test_loss: 0.9673, test_f1: 0.5424
 epoch: 13, train_loss: 0.7942, test_loss: 1.0835, test_f1: 0.5388
 epoch: 14, train_loss: 0.7901, test_loss: 0.9749, test_f1: 0.6038
 epoch: 15, train_loss: 0.7886, test_loss: 1.1722, test_f1: 0.5501
 epoch: 16, train_loss: 0.8219, test_loss: 0.9767, test_f1: 0.5813
 epoch: 17, train_loss: 0.7920, test_loss: 1.1004, test_f1: 0.5507
 epoch: 18, train_loss: 0.7857, test_loss: 1.1833, test_f1: 0.4523
 epoch: 19, train_loss: 0.8013, test_loss: 1.2613, test_f1: 0.4647
 epoch: 20, train_loss: 0.7849, test_loss: 1.0523, test_f1: 0.6107
 epoch: 21, train_loss: 0.8191, test_loss: 0.9843, test_f1: 0.5944
 epoch: 22, train_loss: 0.7991, test_loss: 1.0697, test_f1: 0.5277
 epoch: 23, train_loss: 0.7954, test_loss: 0.9843, test_f1: 0.5716
 epoch: 24, train_loss: 0.7830, test_loss: 0.9814, test_f1: 0.5716
 epoch: 25, train_loss: 0.7860, test_loss: 1.1066, test_f1: 0.5962
 epoch: 26, train_loss: 0.7578, test_loss: 1.1318, test_f1: 0.5790
 epoch: 27, train_loss: 0.7589, test_loss: 1.1518, test_f1: 0.5457
 epoch: 28, train_loss: 0.7515, test_loss: 1.1884, test_f1: 0.5834
 epoch: 29, train_loss: 0.7407, test_loss: 1.2857, test_f1: 0.5939
 epoch: 30, train_loss: 0.7778, test_loss: 1.0300, test_f1: 0.5386
 epoch: 31, train_loss: 0.7518, test_loss: 1.1410, test_f1: 0.5359
 epoch: 32, train_loss: 0.7549, test_loss: 1.0419, test_f1: 0.5820
 epoch: 33, train_loss: 0.7663, test_loss: 1.0764, test_f1: 0.5600
 epoch: 34, train_loss: 0.7407, test_loss: 1.0078, test_f1: 0.5819
 epoch: 35, train_loss: 0.7468, test_loss: 1.2504, test_f1: 0.5329
 epoch: 36, train_loss: 0.7199, test_loss: 1.2084, test_f1: 0.4745
 epoch: 37, train_loss: 0.7352, test_loss: 1.3100, test_f1: 0.4932
 epoch: 38, train_loss: 0.7402, test_loss: 1.1535, test_f1: 0.5727
 epoch: 39, train_loss: 0.7257, test_loss: 1.3571, test_f1: 0.5706
 epoch: 40, train_loss: 0.7663, test_loss: 1.2423, test_f1: 0.5334
 epoch: 41, train_loss: 0.7308, test_loss: 1.3331, test_f1: 0.4341
 epoch: 42, train_loss: 0.7310, test_loss: 1.0355, test_f1: 0.6131
 epoch: 43, train_loss: 0.7382, test_loss: 1.2888, test_f1: 0.5727
 epoch: 44, train_loss: 0.7217, test_loss: 2.1579, test_f1: 0.4852
 epoch: 45, train_loss: 0.7170, test_loss: 1.1212, test_f1: 0.4970
 epoch: 46, train_loss: 0.6984, test_loss: 1.2245, test_f1: 0.6054
 epoch: 47, train_loss: 0.7012, test_loss: 1.1956, test_f1: 0.5919
 epoch: 48, train_loss: 0.7255, test_loss: 1.0584, test_f1: 0.6114
 epoch: 49, train_loss: 0.7383, test_loss: 1.2159, test_f1: 0.6073
 epoch: 50, train_loss: 0.7061, test_loss: 1.2431, test_f1: 0.5098
 epoch: 51, train_loss: 0.6879, test_loss: 1.3076, test_f1: 0.5744
 epoch: 52, train_loss: 0.6787, test_loss: 1.4251, test_f1: 0.5654
 epoch: 53, train_loss: 0.6642, test_loss: 1.2252, test_f1: 0.6278
 epoch: 54, train_loss: 0.6506, test_loss: 1.3485, test_f1: 0.5839
 epoch: 55, train_loss: 0.6474, test_loss: 1.4634, test_f1: 0.5622
 epoch: 56, train_loss: 0.6594, test_loss: 1.3440, test_f1: 0.6062
 epoch: 57, train_loss: 0.6407, test_loss: 1.5072, test_f1: 0.5866
 epoch: 58, train_loss: 0.6600, test_loss: 1.3248, test_f1: 0.5318
 epoch: 59, train_loss: 0.6698, test_loss: 1.4119, test_f1: 0.5934
 epoch: 60, train_loss: 0.6465, test_loss: 1.5469, test_f1: 0.5834
 epoch: 61, train_loss: 0.6424, test_loss: 1.4409, test_f1: 0.5914
 epoch: 62, train_loss: 0.6491, test_loss: 1.7046, test_f1: 0.5107
 epoch: 63, train_loss: 0.6872, test_loss: 1.4131, test_f1: 0.5749
 epoch: 64, train_loss: 0.6472, test_loss: 1.4848, test_f1: 0.5441
 epoch: 65, train_loss: 0.6524, test_loss: 1.3267, test_f1: 0.5915
 epoch: 66, train_loss: 0.6673, test_loss: 1.3473, test_f1: 0.5824
 epoch: 67, train_loss: 0.6469, test_loss: 1.3694, test_f1: 0.5421
 epoch: 68, train_loss: 0.6339, test_loss: 1.5219, test_f1: 0.5538
 epoch: 69, train_loss: 0.6303, test_loss: 1.3113, test_f1: 0.5637
 epoch: 70, train_loss: 0.6366, test_loss: 1.4359, test_f1: 0.5708
 epoch: 71, train_loss: 0.6440, test_loss: 1.5266, test_f1: 0.5571
 epoch: 72, train_loss: 0.6423, test_loss: 1.4242, test_f1: 0.5437
 epoch: 73, train_loss: 0.6431, test_loss: 1.4152, test_f1: 0.5429
 epoch: 74, train_loss: 0.6282, test_loss: 1.5807, test_f1: 0.5278
 epoch: 75, train_loss: 0.6420, test_loss: 1.5582, test_f1: 0.5595
 epoch: 76, train_loss: 0.6234, test_loss: 1.5172, test_f1: 0.5995
 epoch: 77, train_loss: 0.6166, test_loss: 1.5322, test_f1: 0.5676
 epoch: 78, train_loss: 0.6194, test_loss: 1.5508, test_f1: 0.5710
 epoch: 79, train_loss: 0.6118, test_loss: 1.7234, test_f1: 0.5507
 epoch: 80, train_loss: 0.6362, test_loss: 1.5156, test_f1: 0.5685
 epoch: 81, train_loss: 0.6149, test_loss: 1.7869, test_f1: 0.5542
 epoch: 82, train_loss: 0.6175, test_loss: 1.7883, test_f1: 0.5459
 epoch: 83, train_loss: 0.6078, test_loss: 1.7182, test_f1: 0.5994
 epoch: 84, train_loss: 0.6163, test_loss: 1.5819, test_f1: 0.5602
 epoch: 85, train_loss: 0.5875, test_loss: 1.9407, test_f1: 0.5471
 epoch: 86, train_loss: 0.6162, test_loss: 1.8081, test_f1: 0.5765
 epoch: 87, train_loss: 0.6014, test_loss: 1.7293, test_f1: 0.5859
 epoch: 88, train_loss: 0.5929, test_loss: 1.7056, test_f1: 0.5822
 epoch: 89, train_loss: 0.5869, test_loss: 1.7458, test_f1: 0.5585
 epoch: 90, train_loss: 0.6025, test_loss: 1.6439, test_f1: 0.5432
 epoch: 91, train_loss: 0.5774, test_loss: 1.9404, test_f1: 0.5745
 epoch: 92, train_loss: 0.5884, test_loss: 1.9534, test_f1: 0.5135
 epoch: 93, train_loss: 0.6125, test_loss: 1.7338, test_f1: 0.5505
 epoch: 94, train_loss: 0.6286, test_loss: 1.4539, test_f1: 0.5816
 epoch: 95, train_loss: 0.5953, test_loss: 1.7368, test_f1: 0.5720
 epoch: 96, train_loss: 0.5797, test_loss: 1.6210, test_f1: 0.5774
 epoch: 97, train_loss: 0.5578, test_loss: 1.8678, test_f1: 0.5812
 epoch: 98, train_loss: 0.5726, test_loss: 1.9164, test_f1: 0.5672
 epoch: 99, train_loss: 0.6095, test_loss: 1.8546, test_f1: 0.4758
##################ITERATION #1 ****************************************
 epoch: 0, train_loss: 1.1714, test_loss: 1.1666, test_f1: 0.3592
 epoch: 1, train_loss: 1.0528, test_loss: 1.1075, test_f1: 0.4507
 epoch: 2, train_loss: 0.9787, test_loss: 0.9986, test_f1: 0.5581
 epoch: 3, train_loss: 0.9709, test_loss: 1.4319, test_f1: 0.4584
 epoch: 4, train_loss: 0.9187, test_loss: 0.9920, test_f1: 0.5766
 epoch: 5, train_loss: 0.8625, test_loss: 0.9389, test_f1: 0.5584
 epoch: 6, train_loss: 0.8491, test_loss: 1.0526, test_f1: 0.4711
 epoch: 7, train_loss: 0.8285, test_loss: 0.9911, test_f1: 0.5290
 epoch: 8, train_loss: 0.8236, test_loss: 1.1765, test_f1: 0.5232
 epoch: 9, train_loss: 0.8836, test_loss: 0.9741, test_f1: 0.5686
 epoch: 10, train_loss: 0.8248, test_loss: 1.2625, test_f1: 0.5495
 epoch: 11, train_loss: 0.8012, test_loss: 1.4028, test_f1: 0.5233
 epoch: 12, train_loss: 0.7998, test_loss: 1.0229, test_f1: 0.5872
 epoch: 13, train_loss: 0.7922, test_loss: 1.0341, test_f1: 0.6118
 epoch: 14, train_loss: 0.7683, test_loss: 1.0493, test_f1: 0.5878
 epoch: 15, train_loss: 0.7885, test_loss: 1.1727, test_f1: 0.5140
 epoch: 16, train_loss: 0.7762, test_loss: 1.0017, test_f1: 0.4937
 epoch: 17, train_loss: 0.7934, test_loss: 1.2834, test_f1: 0.4808
 epoch: 18, train_loss: 0.7659, test_loss: 1.2695, test_f1: 0.5811
 epoch: 19, train_loss: 0.7516, test_loss: 0.9958, test_f1: 0.5423
 epoch: 20, train_loss: 0.7435, test_loss: 1.2779, test_f1: 0.5775
 epoch: 21, train_loss: 0.7343, test_loss: 1.3109, test_f1: 0.5364
 epoch: 22, train_loss: 0.7537, test_loss: 1.1094, test_f1: 0.5658
 epoch: 23, train_loss: 0.7409, test_loss: 1.0117, test_f1: 0.6131
 epoch: 24, train_loss: 0.7487, test_loss: 1.0188, test_f1: 0.6154
 epoch: 25, train_loss: 0.7157, test_loss: 1.2488, test_f1: 0.6083
 epoch: 26, train_loss: 0.7237, test_loss: 1.0018, test_f1: 0.6288
 epoch: 27, train_loss: 0.7294, test_loss: 1.1492, test_f1: 0.5624
 epoch: 28, train_loss: 0.7266, test_loss: 1.0159, test_f1: 0.6158
 epoch: 29, train_loss: 0.6906, test_loss: 1.0754, test_f1: 0.5897
 epoch: 30, train_loss: 0.7210, test_loss: 1.0925, test_f1: 0.5956
 epoch: 31, train_loss: 0.7088, test_loss: 1.1205, test_f1: 0.5208
 epoch: 32, train_loss: 0.7275, test_loss: 1.0446, test_f1: 0.6451
 epoch: 33, train_loss: 0.6747, test_loss: 1.0235, test_f1: 0.6455
 epoch: 34, train_loss: 0.6824, test_loss: 1.3112, test_f1: 0.6148
 epoch: 35, train_loss: 0.6866, test_loss: 1.1560, test_f1: 0.6004
 epoch: 36, train_loss: 0.6963, test_loss: 1.8469, test_f1: 0.5093
 epoch: 37, train_loss: 0.6879, test_loss: 1.0156, test_f1: 0.5985
 epoch: 38, train_loss: 0.6706, test_loss: 1.1073, test_f1: 0.6626
 epoch: 39, train_loss: 0.6730, test_loss: 1.2350, test_f1: 0.6426
 epoch: 40, train_loss: 0.6658, test_loss: 1.0680, test_f1: 0.5985
 epoch: 41, train_loss: 0.6934, test_loss: 1.0373, test_f1: 0.6422
 epoch: 42, train_loss: 0.6587, test_loss: 1.0976, test_f1: 0.6294
 epoch: 43, train_loss: 0.7015, test_loss: 1.0406, test_f1: 0.6235
 epoch: 44, train_loss: 0.6448, test_loss: 1.1011, test_f1: 0.5965
 epoch: 45, train_loss: 0.6584, test_loss: 1.0376, test_f1: 0.6609
 epoch: 46, train_loss: 0.6306, test_loss: 1.0621, test_f1: 0.6268
 epoch: 47, train_loss: 0.6545, test_loss: 1.5079, test_f1: 0.5896
 epoch: 48, train_loss: 0.6632, test_loss: 1.0437, test_f1: 0.6232
 epoch: 49, train_loss: 0.6695, test_loss: 1.0839, test_f1: 0.6488
 epoch: 50, train_loss: 0.6447, test_loss: 1.2006, test_f1: 0.5937
 epoch: 51, train_loss: 0.6211, test_loss: 1.1528, test_f1: 0.6048
 epoch: 52, train_loss: 0.5980, test_loss: 1.0279, test_f1: 0.6542
 epoch: 53, train_loss: 0.5847, test_loss: 1.2199, test_f1: 0.6315
 epoch: 54, train_loss: 0.5651, test_loss: 1.1683, test_f1: 0.6384
 epoch: 55, train_loss: 0.5946, test_loss: 1.1446, test_f1: 0.6483
 epoch: 56, train_loss: 0.5931, test_loss: 1.1853, test_f1: 0.6522
 epoch: 57, train_loss: 0.5757, test_loss: 1.1869, test_f1: 0.6358
 epoch: 58, train_loss: 0.5580, test_loss: 1.1173, test_f1: 0.6342
 epoch: 59, train_loss: 0.5667, test_loss: 1.3253, test_f1: 0.6087
 epoch: 60, train_loss: 0.5708, test_loss: 1.1715, test_f1: 0.6277
 epoch: 61, train_loss: 0.5482, test_loss: 1.2417, test_f1: 0.6135
 epoch: 62, train_loss: 0.5641, test_loss: 1.2893, test_f1: 0.6341
 epoch: 63, train_loss: 0.5472, test_loss: 1.2225, test_f1: 0.6420
 epoch: 64, train_loss: 0.5589, test_loss: 1.3192, test_f1: 0.6359
 epoch: 65, train_loss: 0.5483, test_loss: 1.1101, test_f1: 0.6119
 epoch: 66, train_loss: 0.5323, test_loss: 1.3110, test_f1: 0.6867
 epoch: 67, train_loss: 0.5455, test_loss: 1.3877, test_f1: 0.6692
 epoch: 68, train_loss: 0.5440, test_loss: 1.5232, test_f1: 0.6288
 epoch: 69, train_loss: 0.5473, test_loss: 1.5186, test_f1: 0.6215
 epoch: 70, train_loss: 0.5533, test_loss: 1.3713, test_f1: 0.6205
 epoch: 71, train_loss: 0.5167, test_loss: 1.4323, test_f1: 0.6358
 epoch: 72, train_loss: 0.5429, test_loss: 1.4659, test_f1: 0.6272
 epoch: 73, train_loss: 0.5177, test_loss: 1.3326, test_f1: 0.6473
 epoch: 74, train_loss: 0.5135, test_loss: 1.5372, test_f1: 0.6372
 epoch: 75, train_loss: 0.5207, test_loss: 1.6880, test_f1: 0.6148
 epoch: 76, train_loss: 0.5351, test_loss: 1.6718, test_f1: 0.5710
 epoch: 77, train_loss: 0.5129, test_loss: 1.3632, test_f1: 0.6226
 epoch: 78, train_loss: 0.5064, test_loss: 1.6782, test_f1: 0.6165
 epoch: 79, train_loss: 0.5058, test_loss: 1.5006, test_f1: 0.6707
 epoch: 80, train_loss: 0.4927, test_loss: 1.4427, test_f1: 0.6388
 epoch: 81, train_loss: 0.5054, test_loss: 1.8803, test_f1: 0.6455
 epoch: 82, train_loss: 0.5141, test_loss: 1.5016, test_f1: 0.6338
 epoch: 83, train_loss: 0.5134, test_loss: 1.4867, test_f1: 0.6403
 epoch: 84, train_loss: 0.4769, test_loss: 1.6636, test_f1: 0.6677
 epoch: 85, train_loss: 0.5150, test_loss: 1.5373, test_f1: 0.5678
 epoch: 86, train_loss: 0.4901, test_loss: 1.4863, test_f1: 0.6488
 epoch: 87, train_loss: 0.5088, test_loss: 1.4004, test_f1: 0.6605
 epoch: 88, train_loss: 0.5019, test_loss: 1.4201, test_f1: 0.6544
 epoch: 89, train_loss: 0.4735, test_loss: 1.5283, test_f1: 0.6103
 epoch: 90, train_loss: 0.4673, test_loss: 1.5495, test_f1: 0.6499
 epoch: 91, train_loss: 0.4971, test_loss: 1.7328, test_f1: 0.5983
 epoch: 92, train_loss: 0.4982, test_loss: 1.4008, test_f1: 0.6568
 epoch: 93, train_loss: 0.4823, test_loss: 1.6331, test_f1: 0.6142
 epoch: 94, train_loss: 0.4823, test_loss: 1.4979, test_f1: 0.6234
 epoch: 95, train_loss: 0.4700, test_loss: 1.3979, test_f1: 0.6594
 epoch: 96, train_loss: 0.4614, test_loss: 1.8756, test_f1: 0.6373
 epoch: 97, train_loss: 0.4460, test_loss: 1.6086, test_f1: 0.6229
 epoch: 98, train_loss: 0.4503, test_loss: 1.4383, test_f1: 0.6778
 epoch: 99, train_loss: 0.4691, test_loss: 1.7186, test_f1: 0.6596
##################ITERATION #2 ****************************************
 epoch: 0, train_loss: 1.1756, test_loss: 1.1341, test_f1: 0.4691
 epoch: 1, train_loss: 0.9854, test_loss: 1.0764, test_f1: 0.5029
 epoch: 2, train_loss: 0.9366, test_loss: 1.0634, test_f1: 0.5139
 epoch: 3, train_loss: 0.9020, test_loss: 1.0594, test_f1: 0.5585
 epoch: 4, train_loss: 0.8936, test_loss: 1.0281, test_f1: 0.5402
 epoch: 5, train_loss: 0.8714, test_loss: 1.0882, test_f1: 0.5401
 epoch: 6, train_loss: 0.8582, test_loss: 1.0396, test_f1: 0.4419
 epoch: 7, train_loss: 0.8383, test_loss: 1.0604, test_f1: 0.5769
 epoch: 8, train_loss: 0.8423, test_loss: 0.9822, test_f1: 0.5499
 epoch: 9, train_loss: 0.8435, test_loss: 1.0631, test_f1: 0.5077
 epoch: 10, train_loss: 0.8224, test_loss: 1.1452, test_f1: 0.4551
 epoch: 11, train_loss: 0.8086, test_loss: 1.2402, test_f1: 0.5225
 epoch: 12, train_loss: 0.7963, test_loss: 1.0687, test_f1: 0.4708
 epoch: 13, train_loss: 0.7987, test_loss: 1.1167, test_f1: 0.5529
 epoch: 14, train_loss: 0.8085, test_loss: 1.0680, test_f1: 0.4823
 epoch: 15, train_loss: 0.8076, test_loss: 1.6006, test_f1: 0.4597
 epoch: 16, train_loss: 0.7746, test_loss: 1.0108, test_f1: 0.5753
 epoch: 17, train_loss: 0.7753, test_loss: 1.0859, test_f1: 0.5998
 epoch: 18, train_loss: 0.7772, test_loss: 1.0363, test_f1: 0.5814
 epoch: 19, train_loss: 0.7578, test_loss: 1.0586, test_f1: 0.5815
 epoch: 20, train_loss: 0.7564, test_loss: 1.0232, test_f1: 0.5872
 epoch: 21, train_loss: 0.7679, test_loss: 0.9572, test_f1: 0.5523
 epoch: 22, train_loss: 0.7585, test_loss: 0.9396, test_f1: 0.5919
 epoch: 23, train_loss: 0.7424, test_loss: 1.1376, test_f1: 0.5659
 epoch: 24, train_loss: 0.7663, test_loss: 1.0897, test_f1: 0.5794
 epoch: 25, train_loss: 0.7387, test_loss: 1.1610, test_f1: 0.5906
 epoch: 26, train_loss: 0.7309, test_loss: 1.0403, test_f1: 0.6007
 epoch: 27, train_loss: 0.7453, test_loss: 1.3675, test_f1: 0.5780
 epoch: 28, train_loss: 0.7294, test_loss: 1.1469, test_f1: 0.6599
 epoch: 29, train_loss: 0.6927, test_loss: 1.2277, test_f1: 0.6046
 epoch: 30, train_loss: 0.7340, test_loss: 1.2204, test_f1: 0.6094
 epoch: 31, train_loss: 0.7429, test_loss: 1.2962, test_f1: 0.6107
 epoch: 32, train_loss: 0.7380, test_loss: 1.4905, test_f1: 0.5994
 epoch: 33, train_loss: 0.7078, test_loss: 1.3860, test_f1: 0.6389
 epoch: 34, train_loss: 0.7119, test_loss: 1.4761, test_f1: 0.6122
 epoch: 35, train_loss: 0.6870, test_loss: 1.3864, test_f1: 0.6166
 epoch: 36, train_loss: 0.7161, test_loss: 1.1601, test_f1: 0.6206
 epoch: 37, train_loss: 0.6866, test_loss: 1.7071, test_f1: 0.6059
 epoch: 38, train_loss: 0.7192, test_loss: 1.2419, test_f1: 0.6237
 epoch: 39, train_loss: 0.6804, test_loss: 1.1676, test_f1: 0.6136
 epoch: 40, train_loss: 0.6820, test_loss: 1.4310, test_f1: 0.6053
 epoch: 41, train_loss: 0.6628, test_loss: 1.4174, test_f1: 0.5681
 epoch: 42, train_loss: 0.6670, test_loss: 1.6669, test_f1: 0.5792
 epoch: 43, train_loss: 0.6627, test_loss: 1.4648, test_f1: 0.6138
 epoch: 44, train_loss: 0.6791, test_loss: 1.6711, test_f1: 0.5743
 epoch: 45, train_loss: 0.6657, test_loss: 1.1972, test_f1: 0.6195
 epoch: 46, train_loss: 0.7103, test_loss: 1.4880, test_f1: 0.5007
 epoch: 47, train_loss: 0.6784, test_loss: 1.0199, test_f1: 0.6264
 epoch: 48, train_loss: 0.6674, test_loss: 1.3089, test_f1: 0.6476
 epoch: 49, train_loss: 0.6353, test_loss: 1.1153, test_f1: 0.5866
 epoch: 50, train_loss: 0.6539, test_loss: 1.3418, test_f1: 0.5585
 epoch: 51, train_loss: 0.6542, test_loss: 1.5385, test_f1: 0.6157
 epoch: 52, train_loss: 0.5994, test_loss: 1.3790, test_f1: 0.6209
 epoch: 53, train_loss: 0.6159, test_loss: 1.3758, test_f1: 0.6332
 epoch: 54, train_loss: 0.5709, test_loss: 1.4426, test_f1: 0.6608
 epoch: 55, train_loss: 0.5845, test_loss: 1.1122, test_f1: 0.5959
 epoch: 56, train_loss: 0.6034, test_loss: 1.6680, test_f1: 0.6174
 epoch: 57, train_loss: 0.5721, test_loss: 1.4449, test_f1: 0.6297
 epoch: 58, train_loss: 0.5704, test_loss: 1.4035, test_f1: 0.6600
 epoch: 59, train_loss: 0.5639, test_loss: 1.8428, test_f1: 0.6763
 epoch: 60, train_loss: 0.6064, test_loss: 1.0112, test_f1: 0.6453
 epoch: 61, train_loss: 0.5741, test_loss: 1.4676, test_f1: 0.6457
 epoch: 62, train_loss: 0.5495, test_loss: 1.3713, test_f1: 0.6477
 epoch: 63, train_loss: 0.5667, test_loss: 1.5226, test_f1: 0.6713
 epoch: 64, train_loss: 0.5648, test_loss: 1.6765, test_f1: 0.6553
 epoch: 65, train_loss: 0.5643, test_loss: 1.4929, test_f1: 0.6446
 epoch: 66, train_loss: 0.5284, test_loss: 1.8852, test_f1: 0.6277
 epoch: 67, train_loss: 0.5426, test_loss: 1.5838, test_f1: 0.6617
 epoch: 68, train_loss: 0.5513, test_loss: 1.7902, test_f1: 0.6163
 epoch: 69, train_loss: 0.5470, test_loss: 1.5342, test_f1: 0.6094
 epoch: 70, train_loss: 0.5336, test_loss: 1.9371, test_f1: 0.6668
 epoch: 71, train_loss: 0.5432, test_loss: 1.6782, test_f1: 0.6185
 epoch: 72, train_loss: 0.5761, test_loss: 1.8110, test_f1: 0.6095
 epoch: 73, train_loss: 0.5435, test_loss: 2.0992, test_f1: 0.6366
 epoch: 74, train_loss: 0.5512, test_loss: 2.1365, test_f1: 0.6390
 epoch: 75, train_loss: 0.5225, test_loss: 1.7056, test_f1: 0.6251
 epoch: 76, train_loss: 0.5230, test_loss: 1.5799, test_f1: 0.6051
 epoch: 77, train_loss: 0.5069, test_loss: 1.7963, test_f1: 0.6329
 epoch: 78, train_loss: 0.5257, test_loss: 2.0211, test_f1: 0.5943
 epoch: 79, train_loss: 0.5040, test_loss: 2.4434, test_f1: 0.6301
 epoch: 80, train_loss: 0.5102, test_loss: 2.2698, test_f1: 0.6140
 epoch: 81, train_loss: 0.5488, test_loss: 2.1904, test_f1: 0.6195
 epoch: 82, train_loss: 0.4957, test_loss: 1.8376, test_f1: 0.6310
 epoch: 83, train_loss: 0.5104, test_loss: 1.7842, test_f1: 0.6106
 epoch: 84, train_loss: 0.5005, test_loss: 2.0961, test_f1: 0.6364
 epoch: 85, train_loss: 0.4706, test_loss: 1.8384, test_f1: 0.6202
 epoch: 86, train_loss: 0.4945, test_loss: 2.6041, test_f1: 0.5964
 epoch: 87, train_loss: 0.4921, test_loss: 1.8746, test_f1: 0.5982
 epoch: 88, train_loss: 0.4709, test_loss: 2.0669, test_f1: 0.6306
 epoch: 89, train_loss: 0.4852, test_loss: 1.9272, test_f1: 0.6201
 epoch: 90, train_loss: 0.4817, test_loss: 1.6826, test_f1: 0.6194
 epoch: 91, train_loss: 0.4775, test_loss: 2.3414, test_f1: 0.6064
 epoch: 92, train_loss: 0.5169, test_loss: 2.5080, test_f1: 0.5465
 epoch: 93, train_loss: 0.4909, test_loss: 1.9164, test_f1: 0.5608
 epoch: 94, train_loss: 0.4487, test_loss: 2.2223, test_f1: 0.6389
 epoch: 95, train_loss: 0.4930, test_loss: 1.9880, test_f1: 0.6288
 epoch: 96, train_loss: 0.4578, test_loss: 1.8695, test_f1: 0.6309
 epoch: 97, train_loss: 0.4822, test_loss: 1.6853, test_f1: 0.6039
 epoch: 98, train_loss: 0.4539, test_loss: 2.3634, test_f1: 0.5476
 epoch: 99, train_loss: 0.4518, test_loss: 1.9093, test_f1: 0.5832
##################ITERATION #3 ****************************************
 epoch: 0, train_loss: 1.1754, test_loss: 1.1335, test_f1: 0.4616
 epoch: 1, train_loss: 0.9978, test_loss: 1.0246, test_f1: 0.5319
 epoch: 2, train_loss: 0.9493, test_loss: 1.0390, test_f1: 0.5089
 epoch: 3, train_loss: 0.9392, test_loss: 1.1880, test_f1: 0.4551
 epoch: 4, train_loss: 0.9221, test_loss: 1.0136, test_f1: 0.5163
 epoch: 5, train_loss: 0.8700, test_loss: 1.1173, test_f1: 0.5176
 epoch: 6, train_loss: 0.8717, test_loss: 0.9696, test_f1: 0.5302
 epoch: 7, train_loss: 0.8448, test_loss: 1.1295, test_f1: 0.4684
 epoch: 8, train_loss: 0.8489, test_loss: 0.9859, test_f1: 0.5809
 epoch: 9, train_loss: 0.8515, test_loss: 0.9505, test_f1: 0.5295
 epoch: 10, train_loss: 0.7984, test_loss: 1.0488, test_f1: 0.5552
 epoch: 11, train_loss: 0.8722, test_loss: 0.9202, test_f1: 0.5191
 epoch: 12, train_loss: 0.8513, test_loss: 0.9846, test_f1: 0.4734
 epoch: 13, train_loss: 0.8081, test_loss: 0.9823, test_f1: 0.5171
 epoch: 14, train_loss: 0.8081, test_loss: 0.9684, test_f1: 0.5738
 epoch: 15, train_loss: 0.7942, test_loss: 1.1360, test_f1: 0.5605
 epoch: 16, train_loss: 0.8117, test_loss: 1.0596, test_f1: 0.5503
 epoch: 17, train_loss: 0.8203, test_loss: 1.0119, test_f1: 0.5345
 epoch: 18, train_loss: 0.7912, test_loss: 1.5284, test_f1: 0.5625
 epoch: 19, train_loss: 0.7900, test_loss: 0.9830, test_f1: 0.6131
 epoch: 20, train_loss: 0.8028, test_loss: 0.9771, test_f1: 0.5432
 epoch: 21, train_loss: 0.7933, test_loss: 0.9986, test_f1: 0.5440
 epoch: 22, train_loss: 0.7795, test_loss: 1.2027, test_f1: 0.5284
 epoch: 23, train_loss: 0.7781, test_loss: 0.9815, test_f1: 0.5720
 epoch: 24, train_loss: 0.7668, test_loss: 1.0253, test_f1: 0.5848
 epoch: 25, train_loss: 0.8133, test_loss: 0.9278, test_f1: 0.6096
 epoch: 26, train_loss: 0.7924, test_loss: 0.9785, test_f1: 0.5707
 epoch: 27, train_loss: 0.7404, test_loss: 0.9886, test_f1: 0.6050
 epoch: 28, train_loss: 0.7691, test_loss: 1.0173, test_f1: 0.5579
 epoch: 29, train_loss: 0.7383, test_loss: 0.9690, test_f1: 0.6017
 epoch: 30, train_loss: 0.7471, test_loss: 1.0072, test_f1: 0.5546
 epoch: 31, train_loss: 0.7694, test_loss: 1.1793, test_f1: 0.5728
 epoch: 32, train_loss: 0.7506, test_loss: 0.9952, test_f1: 0.5723
 epoch: 33, train_loss: 0.7271, test_loss: 1.1126, test_f1: 0.5407
 epoch: 34, train_loss: 0.7369, test_loss: 1.2528, test_f1: 0.5656
 epoch: 35, train_loss: 0.7270, test_loss: 1.0722, test_f1: 0.5736
 epoch: 36, train_loss: 0.7301, test_loss: 1.1759, test_f1: 0.5541
 epoch: 37, train_loss: 0.7581, test_loss: 1.1767, test_f1: 0.5822
 epoch: 38, train_loss: 0.7512, test_loss: 1.0210, test_f1: 0.5617
 epoch: 39, train_loss: 0.7352, test_loss: 1.1197, test_f1: 0.6286
 epoch: 40, train_loss: 0.7547, test_loss: 1.0320, test_f1: 0.4958
 epoch: 41, train_loss: 0.7670, test_loss: 0.9961, test_f1: 0.5692
 epoch: 42, train_loss: 0.7476, test_loss: 0.9677, test_f1: 0.5139
 epoch: 43, train_loss: 0.7288, test_loss: 0.9546, test_f1: 0.5973
 epoch: 44, train_loss: 0.7163, test_loss: 1.1022, test_f1: 0.5729
 epoch: 45, train_loss: 0.7371, test_loss: 0.9364, test_f1: 0.5818
 epoch: 46, train_loss: 0.7049, test_loss: 1.1802, test_f1: 0.5782
 epoch: 47, train_loss: 0.6959, test_loss: 1.0870, test_f1: 0.5740
 epoch: 48, train_loss: 0.7116, test_loss: 1.0817, test_f1: 0.5733
 epoch: 49, train_loss: 0.7184, test_loss: 1.1785, test_f1: 0.5307
 epoch: 50, train_loss: 0.6929, test_loss: 1.1455, test_f1: 0.5972
 epoch: 51, train_loss: 0.6920, test_loss: 1.1274, test_f1: 0.5714
 epoch: 52, train_loss: 0.6635, test_loss: 1.0710, test_f1: 0.6147
 epoch: 53, train_loss: 0.6569, test_loss: 1.2826, test_f1: 0.6104
 epoch: 54, train_loss: 0.6706, test_loss: 1.1137, test_f1: 0.5847
 epoch: 55, train_loss: 0.6531, test_loss: 1.3553, test_f1: 0.5448
 epoch: 56, train_loss: 0.6474, test_loss: 1.2385, test_f1: 0.5646
 epoch: 57, train_loss: 0.6501, test_loss: 1.0258, test_f1: 0.6249
 epoch: 58, train_loss: 0.6596, test_loss: 1.1458, test_f1: 0.6120
 epoch: 59, train_loss: 0.6823, test_loss: 1.0523, test_f1: 0.5820
 epoch: 60, train_loss: 0.6656, test_loss: 1.1474, test_f1: 0.5497
 epoch: 61, train_loss: 0.6501, test_loss: 1.4123, test_f1: 0.5859
 epoch: 62, train_loss: 0.6453, test_loss: 1.4098, test_f1: 0.5708
 epoch: 63, train_loss: 0.6347, test_loss: 1.1281, test_f1: 0.5612
 epoch: 64, train_loss: 0.6434, test_loss: 1.1402, test_f1: 0.5940
 epoch: 65, train_loss: 0.6286, test_loss: 1.2301, test_f1: 0.5397
 epoch: 66, train_loss: 0.6397, test_loss: 1.2864, test_f1: 0.5695
 epoch: 67, train_loss: 0.6303, test_loss: 1.3505, test_f1: 0.5633
 epoch: 68, train_loss: 0.6122, test_loss: 1.2384, test_f1: 0.5486
 epoch: 69, train_loss: 0.6156, test_loss: 1.2270, test_f1: 0.5571
 epoch: 70, train_loss: 0.6186, test_loss: 1.2857, test_f1: 0.6122
 epoch: 71, train_loss: 0.6198, test_loss: 1.3427, test_f1: 0.5591
 epoch: 72, train_loss: 0.6226, test_loss: 1.2836, test_f1: 0.5647
 epoch: 73, train_loss: 0.6216, test_loss: 1.3273, test_f1: 0.6078
 epoch: 74, train_loss: 0.6183, test_loss: 1.3168, test_f1: 0.5483
 epoch: 75, train_loss: 0.5878, test_loss: 1.1870, test_f1: 0.5742
 epoch: 76, train_loss: 0.6008, test_loss: 1.3531, test_f1: 0.5285
 epoch: 77, train_loss: 0.5907, test_loss: 1.3339, test_f1: 0.5262
 epoch: 78, train_loss: 0.6199, test_loss: 1.6509, test_f1: 0.5000
 epoch: 79, train_loss: 0.6085, test_loss: 1.3734, test_f1: 0.5736
 epoch: 80, train_loss: 0.5920, test_loss: 1.2480, test_f1: 0.5678
 epoch: 81, train_loss: 0.6047, test_loss: 1.1769, test_f1: 0.5622
 epoch: 82, train_loss: 0.5922, test_loss: 1.1641, test_f1: 0.5592
 epoch: 83, train_loss: 0.5885, test_loss: 1.3812, test_f1: 0.6004
 epoch: 84, train_loss: 0.5992, test_loss: 1.4216, test_f1: 0.5546
 epoch: 85, train_loss: 0.6008, test_loss: 1.1867, test_f1: 0.5796
 epoch: 86, train_loss: 0.5711, test_loss: 1.6075, test_f1: 0.5210
 epoch: 87, train_loss: 0.5752, test_loss: 1.3216, test_f1: 0.5545
 epoch: 88, train_loss: 0.5948, test_loss: 1.4802, test_f1: 0.5755
 epoch: 89, train_loss: 0.6017, test_loss: 1.1720, test_f1: 0.5730
 epoch: 90, train_loss: 0.5904, test_loss: 1.2752, test_f1: 0.5826
 epoch: 91, train_loss: 0.5826, test_loss: 1.2790, test_f1: 0.5525
 epoch: 92, train_loss: 0.5726, test_loss: 1.3331, test_f1: 0.5126
 epoch: 93, train_loss: 0.5682, test_loss: 1.2475, test_f1: 0.5482
 epoch: 94, train_loss: 0.5686, test_loss: 1.1670, test_f1: 0.5693
 epoch: 95, train_loss: 0.5717, test_loss: 1.6910, test_f1: 0.5518
 epoch: 96, train_loss: 0.5888, test_loss: 1.2871, test_f1: 0.5374
 epoch: 97, train_loss: 0.5581, test_loss: 1.3202, test_f1: 0.5803
 epoch: 98, train_loss: 0.5510, test_loss: 1.5157, test_f1: 0.5227
 epoch: 99, train_loss: 0.5416, test_loss: 1.4200, test_f1: 0.5634
##################ITERATION #4 ****************************************
 epoch: 0, train_loss: 1.1828, test_loss: 1.4384, test_f1: 0.2916
 epoch: 1, train_loss: 0.9619, test_loss: 0.9906, test_f1: 0.5439
 epoch: 2, train_loss: 0.9285, test_loss: 0.9987, test_f1: 0.5322
 epoch: 3, train_loss: 0.8789, test_loss: 1.1166, test_f1: 0.4879
 epoch: 4, train_loss: 0.8882, test_loss: 0.9420, test_f1: 0.5827
 epoch: 5, train_loss: 0.8422, test_loss: 1.0485, test_f1: 0.5327
 epoch: 6, train_loss: 0.8630, test_loss: 1.3978, test_f1: 0.4897
 epoch: 7, train_loss: 0.8377, test_loss: 1.0715, test_f1: 0.4762
 epoch: 8, train_loss: 0.8557, test_loss: 1.0713, test_f1: 0.5094
 epoch: 9, train_loss: 0.8613, test_loss: 0.9804, test_f1: 0.5785
 epoch: 10, train_loss: 0.8169, test_loss: 0.9486, test_f1: 0.6031
 epoch: 11, train_loss: 0.8132, test_loss: 0.9737, test_f1: 0.5392
 epoch: 12, train_loss: 0.7987, test_loss: 0.9150, test_f1: 0.6067
 epoch: 13, train_loss: 0.8116, test_loss: 1.0833, test_f1: 0.5403
 epoch: 14, train_loss: 0.7954, test_loss: 1.0291, test_f1: 0.6257
 epoch: 15, train_loss: 0.8023, test_loss: 0.9387, test_f1: 0.5807
 epoch: 16, train_loss: 0.7743, test_loss: 0.9498, test_f1: 0.5828
 epoch: 17, train_loss: 0.7775, test_loss: 1.3400, test_f1: 0.5385
 epoch: 18, train_loss: 0.7735, test_loss: 1.0205, test_f1: 0.6048
 epoch: 19, train_loss: 0.7637, test_loss: 1.0428, test_f1: 0.5686
 epoch: 20, train_loss: 0.7757, test_loss: 1.0356, test_f1: 0.6135
 epoch: 21, train_loss: 0.7472, test_loss: 1.0306, test_f1: 0.5982
 epoch: 22, train_loss: 0.7724, test_loss: 1.0078, test_f1: 0.6091
 epoch: 23, train_loss: 0.7624, test_loss: 1.0069, test_f1: 0.6047
 epoch: 24, train_loss: 0.7691, test_loss: 1.0720, test_f1: 0.6016
 epoch: 25, train_loss: 0.7508, test_loss: 1.0435, test_f1: 0.6277
 epoch: 26, train_loss: 0.7459, test_loss: 1.0930, test_f1: 0.5853
 epoch: 27, train_loss: 0.7278, test_loss: 0.9952, test_f1: 0.6375
 epoch: 28, train_loss: 0.7293, test_loss: 1.2165, test_f1: 0.5957
 epoch: 29, train_loss: 0.7368, test_loss: 1.1091, test_f1: 0.6268
 epoch: 30, train_loss: 0.7233, test_loss: 1.0213, test_f1: 0.6007
 epoch: 31, train_loss: 0.7346, test_loss: 1.0676, test_f1: 0.5811
 epoch: 32, train_loss: 0.7470, test_loss: 1.0605, test_f1: 0.5946
 epoch: 33, train_loss: 0.7650, test_loss: 0.9137, test_f1: 0.6457
 epoch: 34, train_loss: 0.7326, test_loss: 0.9697, test_f1: 0.6339
 epoch: 35, train_loss: 0.7238, test_loss: 1.1070, test_f1: 0.5571
 epoch: 36, train_loss: 0.7121, test_loss: 1.0957, test_f1: 0.6176
 epoch: 37, train_loss: 0.7280, test_loss: 0.9845, test_f1: 0.5979
 epoch: 38, train_loss: 0.7393, test_loss: 1.0712, test_f1: 0.5840
 epoch: 39, train_loss: 0.7669, test_loss: 0.9946, test_f1: 0.5940
 epoch: 40, train_loss: 0.7124, test_loss: 1.0278, test_f1: 0.6218
 epoch: 41, train_loss: 0.6842, test_loss: 1.1340, test_f1: 0.6006
 epoch: 42, train_loss: 0.6844, test_loss: 1.0739, test_f1: 0.6427
 epoch: 43, train_loss: 0.6970, test_loss: 1.1298, test_f1: 0.5729
 epoch: 44, train_loss: 0.6963, test_loss: 1.1025, test_f1: 0.6304
 epoch: 45, train_loss: 0.6845, test_loss: 1.0494, test_f1: 0.5724
 epoch: 46, train_loss: 0.7373, test_loss: 0.9634, test_f1: 0.6061
 epoch: 47, train_loss: 0.6989, test_loss: 1.0185, test_f1: 0.6181
 epoch: 48, train_loss: 0.6930, test_loss: 0.9912, test_f1: 0.6153
 epoch: 49, train_loss: 0.6848, test_loss: 1.0320, test_f1: 0.6041
 epoch: 50, train_loss: 0.6979, test_loss: 0.9596, test_f1: 0.6434
 epoch: 51, train_loss: 0.6615, test_loss: 1.1342, test_f1: 0.6411
 epoch: 52, train_loss: 0.6403, test_loss: 1.0745, test_f1: 0.6256
 epoch: 53, train_loss: 0.6439, test_loss: 1.2286, test_f1: 0.6304
 epoch: 54, train_loss: 0.6441, test_loss: 1.0891, test_f1: 0.6054
 epoch: 55, train_loss: 0.6344, test_loss: 1.0552, test_f1: 0.6359
 epoch: 56, train_loss: 0.6279, test_loss: 1.2200, test_f1: 0.5801
 epoch: 57, train_loss: 0.6186, test_loss: 1.0757, test_f1: 0.6190
 epoch: 58, train_loss: 0.6120, test_loss: 1.1707, test_f1: 0.6012
 epoch: 59, train_loss: 0.6409, test_loss: 1.1825, test_f1: 0.5878
 epoch: 60, train_loss: 0.6122, test_loss: 1.3116, test_f1: 0.5848
 epoch: 61, train_loss: 0.6042, test_loss: 1.1185, test_f1: 0.6592
 epoch: 62, train_loss: 0.6295, test_loss: 1.2121, test_f1: 0.6093
 epoch: 63, train_loss: 0.6198, test_loss: 1.2143, test_f1: 0.5980
 epoch: 64, train_loss: 0.5793, test_loss: 1.1067, test_f1: 0.6426
 epoch: 65, train_loss: 0.5985, test_loss: 1.1935, test_f1: 0.6129
 epoch: 66, train_loss: 0.6097, test_loss: 1.0972, test_f1: 0.6153
 epoch: 67, train_loss: 0.6184, test_loss: 1.2515, test_f1: 0.6160
 epoch: 68, train_loss: 0.6093, test_loss: 1.1826, test_f1: 0.6401
 epoch: 69, train_loss: 0.5925, test_loss: 1.1774, test_f1: 0.6332
 epoch: 70, train_loss: 0.5865, test_loss: 1.1813, test_f1: 0.6115
 epoch: 71, train_loss: 0.5955, test_loss: 1.1126, test_f1: 0.6372
 epoch: 72, train_loss: 0.5751, test_loss: 1.2002, test_f1: 0.6050
 epoch: 73, train_loss: 0.5922, test_loss: 1.0509, test_f1: 0.6091
 epoch: 74, train_loss: 0.5792, test_loss: 1.1495, test_f1: 0.6337
 epoch: 75, train_loss: 0.5956, test_loss: 1.1217, test_f1: 0.6141
 epoch: 76, train_loss: 0.5675, test_loss: 1.1679, test_f1: 0.6222
 epoch: 77, train_loss: 0.5739, test_loss: 1.2305, test_f1: 0.5985
 epoch: 78, train_loss: 0.5604, test_loss: 1.6202, test_f1: 0.5385
 epoch: 79, train_loss: 0.5827, test_loss: 1.1686, test_f1: 0.6363
 epoch: 80, train_loss: 0.5912, test_loss: 1.2075, test_f1: 0.5849
 epoch: 81, train_loss: 0.5863, test_loss: 1.1772, test_f1: 0.6463
 epoch: 82, train_loss: 0.5825, test_loss: 1.1993, test_f1: 0.6169
 epoch: 83, train_loss: 0.5549, test_loss: 1.1086, test_f1: 0.6722
 epoch: 84, train_loss: 0.5871, test_loss: 1.1075, test_f1: 0.6640
 epoch: 85, train_loss: 0.5518, test_loss: 1.3586, test_f1: 0.6221
 epoch: 86, train_loss: 0.5611, test_loss: 1.0175, test_f1: 0.6593
 epoch: 87, train_loss: 0.5357, test_loss: 1.4142, test_f1: 0.5928
 epoch: 88, train_loss: 0.5581, test_loss: 1.2039, test_f1: 0.6322
 epoch: 89, train_loss: 0.5540, test_loss: 1.4305, test_f1: 0.6278
 epoch: 90, train_loss: 0.5841, test_loss: 1.1017, test_f1: 0.6505
 epoch: 91, train_loss: 0.5381, test_loss: 1.1205, test_f1: 0.6648
 epoch: 92, train_loss: 0.5610, test_loss: 1.1919, test_f1: 0.6344
 epoch: 93, train_loss: 0.5795, test_loss: 1.4962, test_f1: 0.5424
 epoch: 94, train_loss: 0.5736, test_loss: 1.3460, test_f1: 0.6080
 epoch: 95, train_loss: 0.5307, test_loss: 1.3044, test_f1: 0.6486
 epoch: 96, train_loss: 0.5136, test_loss: 1.3686, test_f1: 0.6012
 epoch: 97, train_loss: 0.5258, test_loss: 1.2399, test_f1: 0.6166
 epoch: 98, train_loss: 0.5094, test_loss: 1.3340, test_f1: 0.6100
 epoch: 99, train_loss: 0.5247, test_loss: 1.2515, test_f1: 0.6413
##################ITERATION #5 ****************************************
 epoch: 0, train_loss: 1.1912, test_loss: 1.2340, test_f1: 0.2675
 epoch: 1, train_loss: 0.9957, test_loss: 1.1419, test_f1: 0.5139
 epoch: 2, train_loss: 0.9676, test_loss: 1.0195, test_f1: 0.5158
 epoch: 3, train_loss: 0.9152, test_loss: 1.0041, test_f1: 0.4901
 epoch: 4, train_loss: 0.8963, test_loss: 1.3778, test_f1: 0.3920
 epoch: 5, train_loss: 0.8842, test_loss: 0.9602, test_f1: 0.6037
 epoch: 6, train_loss: 0.8520, test_loss: 0.9330, test_f1: 0.5923
 epoch: 7, train_loss: 0.8678, test_loss: 0.9607, test_f1: 0.5471
 epoch: 8, train_loss: 0.8595, test_loss: 1.1080, test_f1: 0.4756
 epoch: 9, train_loss: 0.8494, test_loss: 0.9771, test_f1: 0.5183
 epoch: 10, train_loss: 0.8149, test_loss: 1.4045, test_f1: 0.5276
 epoch: 11, train_loss: 0.8431, test_loss: 1.0293, test_f1: 0.5765
 epoch: 12, train_loss: 0.8253, test_loss: 1.4208, test_f1: 0.4157
 epoch: 13, train_loss: 0.8259, test_loss: 1.0342, test_f1: 0.5644
 epoch: 14, train_loss: 0.7915, test_loss: 1.0251, test_f1: 0.5185
 epoch: 15, train_loss: 0.7974, test_loss: 1.0701, test_f1: 0.5708
 epoch: 16, train_loss: 0.8437, test_loss: 1.0588, test_f1: 0.5582
 epoch: 17, train_loss: 0.8020, test_loss: 1.5752, test_f1: 0.5031
 epoch: 18, train_loss: 0.8083, test_loss: 1.0358, test_f1: 0.5351
 epoch: 19, train_loss: 0.8016, test_loss: 1.1198, test_f1: 0.5956
 epoch: 20, train_loss: 0.7792, test_loss: 1.0061, test_f1: 0.4810
 epoch: 21, train_loss: 0.7919, test_loss: 1.0015, test_f1: 0.5884
 epoch: 22, train_loss: 0.7613, test_loss: 1.8696, test_f1: 0.4450
 epoch: 23, train_loss: 0.7687, test_loss: 1.1360, test_f1: 0.4992
 epoch: 24, train_loss: 0.7509, test_loss: 1.0653, test_f1: 0.5816
 epoch: 25, train_loss: 0.7701, test_loss: 1.0618, test_f1: 0.5893
 epoch: 26, train_loss: 0.7592, test_loss: 1.5581, test_f1: 0.4702
 epoch: 27, train_loss: 0.7480, test_loss: 1.0840, test_f1: 0.5544
 epoch: 28, train_loss: 0.7666, test_loss: 1.1102, test_f1: 0.4691
 epoch: 29, train_loss: 0.7708, test_loss: 1.2634, test_f1: 0.5601
 epoch: 30, train_loss: 0.7588, test_loss: 1.5633, test_f1: 0.5188
 epoch: 31, train_loss: 0.7417, test_loss: 1.3314, test_f1: 0.6034
 epoch: 32, train_loss: 0.7220, test_loss: 1.0445, test_f1: 0.5899
 epoch: 33, train_loss: 0.7433, test_loss: 0.9392, test_f1: 0.6351
 epoch: 34, train_loss: 0.7456, test_loss: 0.9732, test_f1: 0.6326
 epoch: 35, train_loss: 0.7312, test_loss: 1.3308, test_f1: 0.5573
 epoch: 36, train_loss: 0.7389, test_loss: 1.0519, test_f1: 0.5635
 epoch: 37, train_loss: 0.7134, test_loss: 1.0330, test_f1: 0.6587
 epoch: 38, train_loss: 0.7549, test_loss: 0.9851, test_f1: 0.6460
 epoch: 39, train_loss: 0.7301, test_loss: 1.1644, test_f1: 0.5650
 epoch: 40, train_loss: 0.7484, test_loss: 0.9161, test_f1: 0.6061
 epoch: 41, train_loss: 0.7132, test_loss: 1.0114, test_f1: 0.6168
 epoch: 42, train_loss: 0.7698, test_loss: 1.1875, test_f1: 0.5196
 epoch: 43, train_loss: 0.7464, test_loss: 0.9484, test_f1: 0.6323
 epoch: 44, train_loss: 0.7252, test_loss: 1.0652, test_f1: 0.5888
 epoch: 45, train_loss: 0.7362, test_loss: 1.1253, test_f1: 0.5646
 epoch: 46, train_loss: 0.7192, test_loss: 1.2865, test_f1: 0.6204
 epoch: 47, train_loss: 0.7398, test_loss: 1.0655, test_f1: 0.5793
 epoch: 48, train_loss: 0.6829, test_loss: 0.9906, test_f1: 0.5909
 epoch: 49, train_loss: 0.6798, test_loss: 1.1075, test_f1: 0.6013
 epoch: 50, train_loss: 0.6880, test_loss: 1.3775, test_f1: 0.6136
 epoch: 51, train_loss: 0.6716, test_loss: 1.2429, test_f1: 0.6431
 epoch: 52, train_loss: 0.6529, test_loss: 1.1400, test_f1: 0.6202
 epoch: 53, train_loss: 0.6473, test_loss: 1.1965, test_f1: 0.6335
 epoch: 54, train_loss: 0.6396, test_loss: 1.2571, test_f1: 0.6165
 epoch: 55, train_loss: 0.6457, test_loss: 1.2062, test_f1: 0.6351
 epoch: 56, train_loss: 0.6386, test_loss: 0.9838, test_f1: 0.6795
 epoch: 57, train_loss: 0.6369, test_loss: 2.0789, test_f1: 0.6119
 epoch: 58, train_loss: 0.6236, test_loss: 1.4380, test_f1: 0.6262
 epoch: 59, train_loss: 0.6146, test_loss: 1.1052, test_f1: 0.6168
 epoch: 60, train_loss: 0.6069, test_loss: 5.5917, test_f1: 0.6376
 epoch: 61, train_loss: 0.6261, test_loss: 6.4786, test_f1: 0.6156
 epoch: 62, train_loss: 0.6198, test_loss: 2.3476, test_f1: 0.6584
 epoch: 63, train_loss: 0.6056, test_loss: 1.3308, test_f1: 0.6561
 epoch: 64, train_loss: 0.6271, test_loss: 1.4161, test_f1: 0.5879
 epoch: 65, train_loss: 0.6372, test_loss: 1.2390, test_f1: 0.5966
 epoch: 66, train_loss: 0.5982, test_loss: 1.1793, test_f1: 0.6311
 epoch: 67, train_loss: 0.6261, test_loss: 1.0063, test_f1: 0.6624
 epoch: 68, train_loss: 0.6261, test_loss: 1.2439, test_f1: 0.6511
 epoch: 69, train_loss: 0.6074, test_loss: 1.2025, test_f1: 0.6173
 epoch: 70, train_loss: 0.5850, test_loss: 1.3113, test_f1: 0.6561
 epoch: 71, train_loss: 0.5675, test_loss: 1.1828, test_f1: 0.6591
 epoch: 72, train_loss: 0.5964, test_loss: 1.2964, test_f1: 0.6451
 epoch: 73, train_loss: 0.5739, test_loss: 1.4493, test_f1: 0.6150
 epoch: 74, train_loss: 0.6146, test_loss: 1.5349, test_f1: 0.6458
 epoch: 75, train_loss: 0.6065, test_loss: 1.1919, test_f1: 0.6048
 epoch: 76, train_loss: 0.5766, test_loss: 1.2463, test_f1: 0.6557
 epoch: 77, train_loss: 0.5822, test_loss: 1.2457, test_f1: 0.6655
 epoch: 78, train_loss: 0.5737, test_loss: 4.0672, test_f1: 0.6248
 epoch: 79, train_loss: 0.5805, test_loss: 1.3513, test_f1: 0.6481
 epoch: 80, train_loss: 0.5696, test_loss: 1.2476, test_f1: 0.6744
 epoch: 81, train_loss: 0.5628, test_loss: 1.3122, test_f1: 0.6751
 epoch: 82, train_loss: 0.5743, test_loss: 1.4727, test_f1: 0.6618
 epoch: 83, train_loss: 0.5986, test_loss: 1.1026, test_f1: 0.6551
 epoch: 84, train_loss: 0.6035, test_loss: 1.1861, test_f1: 0.6839
 epoch: 85, train_loss: 0.5623, test_loss: 1.3162, test_f1: 0.6380
 epoch: 86, train_loss: 0.5633, test_loss: 1.3943, test_f1: 0.6323
 epoch: 87, train_loss: 0.5549, test_loss: 1.3926, test_f1: 0.6235
 epoch: 88, train_loss: 0.5799, test_loss: 1.4563, test_f1: 0.6456
 epoch: 89, train_loss: 0.5825, test_loss: 1.1618, test_f1: 0.6801
 epoch: 90, train_loss: 0.5401, test_loss: 1.2794, test_f1: 0.6549
 epoch: 91, train_loss: 0.5304, test_loss: 1.3752, test_f1: 0.6571
 epoch: 92, train_loss: 0.5368, test_loss: 1.2776, test_f1: 0.6595
 epoch: 93, train_loss: 0.5634, test_loss: 1.2070, test_f1: 0.6444
 epoch: 94, train_loss: 0.5320, test_loss: 1.2788, test_f1: 0.6877
 epoch: 95, train_loss: 0.5554, test_loss: 1.4179, test_f1: 0.6480
 epoch: 96, train_loss: 0.5282, test_loss: 1.2480, test_f1: 0.6850
 epoch: 97, train_loss: 0.5331, test_loss: 1.3469, test_f1: 0.6394
 epoch: 98, train_loss: 0.5542, test_loss: 1.2065, test_f1: 0.6519
 epoch: 99, train_loss: 0.5348, test_loss: 1.4745, test_f1: 0.6491
##################ITERATION #6 ****************************************
 epoch: 0, train_loss: 1.1645, test_loss: 1.1043, test_f1: 0.4117
 epoch: 1, train_loss: 0.9475, test_loss: 1.0205, test_f1: 0.5059
 epoch: 2, train_loss: 0.9052, test_loss: 0.9951, test_f1: 0.5490
 epoch: 3, train_loss: 0.8849, test_loss: 1.0413, test_f1: 0.5897
 epoch: 4, train_loss: 0.8786, test_loss: 0.9842, test_f1: 0.5911
 epoch: 5, train_loss: 0.8400, test_loss: 1.0219, test_f1: 0.5527
 epoch: 6, train_loss: 0.8443, test_loss: 0.9790, test_f1: 0.5826
 epoch: 7, train_loss: 0.8325, test_loss: 1.0249, test_f1: 0.5686
 epoch: 8, train_loss: 0.8310, test_loss: 1.2456, test_f1: 0.4656
 epoch: 9, train_loss: 0.8289, test_loss: 1.0359, test_f1: 0.5770
 epoch: 10, train_loss: 0.8088, test_loss: 1.0703, test_f1: 0.5234
 epoch: 11, train_loss: 0.8070, test_loss: 0.9974, test_f1: 0.6185
 epoch: 12, train_loss: 0.8742, test_loss: 1.0549, test_f1: 0.4978
 epoch: 13, train_loss: 0.8762, test_loss: 1.0792, test_f1: 0.4658
 epoch: 14, train_loss: 0.8239, test_loss: 1.1907, test_f1: 0.5617
 epoch: 15, train_loss: 0.7811, test_loss: 1.0608, test_f1: 0.5945
 epoch: 16, train_loss: 0.7646, test_loss: 0.9830, test_f1: 0.6000
 epoch: 17, train_loss: 0.7711, test_loss: 1.1438, test_f1: 0.5827
 epoch: 18, train_loss: 0.7762, test_loss: 1.1190, test_f1: 0.5509
 epoch: 19, train_loss: 0.7626, test_loss: 1.1681, test_f1: 0.5459
 epoch: 20, train_loss: 0.7479, test_loss: 1.1430, test_f1: 0.6210
 epoch: 21, train_loss: 0.7442, test_loss: 1.1226, test_f1: 0.5512
 epoch: 22, train_loss: 0.7933, test_loss: 1.0803, test_f1: 0.6030
 epoch: 23, train_loss: 0.7509, test_loss: 1.2401, test_f1: 0.5750
 epoch: 24, train_loss: 0.7496, test_loss: 1.1418, test_f1: 0.5691
 epoch: 25, train_loss: 0.7390, test_loss: 1.1782, test_f1: 0.4973
 epoch: 26, train_loss: 0.7466, test_loss: 1.1354, test_f1: 0.6205
 epoch: 27, train_loss: 0.7267, test_loss: 0.9786, test_f1: 0.5888
 epoch: 28, train_loss: 0.7433, test_loss: 1.1888, test_f1: 0.5130
 epoch: 29, train_loss: 0.7686, test_loss: 1.0342, test_f1: 0.5979
 epoch: 30, train_loss: 0.7115, test_loss: 1.2126, test_f1: 0.5853
 epoch: 31, train_loss: 0.7033, test_loss: 1.2504, test_f1: 0.5691
 epoch: 32, train_loss: 0.7288, test_loss: 1.1983, test_f1: 0.5162
 epoch: 33, train_loss: 0.7187, test_loss: 1.0757, test_f1: 0.5841
 epoch: 34, train_loss: 0.7189, test_loss: 1.0729, test_f1: 0.5805
 epoch: 35, train_loss: 0.7063, test_loss: 1.0693, test_f1: 0.5956
 epoch: 36, train_loss: 0.6981, test_loss: 1.0957, test_f1: 0.6335
 epoch: 37, train_loss: 0.6583, test_loss: 1.1431, test_f1: 0.6175
 epoch: 38, train_loss: 0.6841, test_loss: 1.1571, test_f1: 0.6065
 epoch: 39, train_loss: 0.7046, test_loss: 1.1006, test_f1: 0.5411
 epoch: 40, train_loss: 0.6945, test_loss: 1.2022, test_f1: 0.5035
 epoch: 41, train_loss: 0.6903, test_loss: 1.0959, test_f1: 0.5924
 epoch: 42, train_loss: 0.6929, test_loss: 1.0002, test_f1: 0.6121
 epoch: 43, train_loss: 0.6655, test_loss: 1.2222, test_f1: 0.5467
 epoch: 44, train_loss: 0.6631, test_loss: 1.1298, test_f1: 0.6117
 epoch: 45, train_loss: 0.6569, test_loss: 1.4539, test_f1: 0.5913
 epoch: 46, train_loss: 0.6734, test_loss: 1.2819, test_f1: 0.5866
 epoch: 47, train_loss: 0.6611, test_loss: 1.0706, test_f1: 0.5692
 epoch: 48, train_loss: 0.6276, test_loss: 1.1051, test_f1: 0.5806
 epoch: 49, train_loss: 0.6532, test_loss: 1.3016, test_f1: 0.5801
 epoch: 50, train_loss: 0.6688, test_loss: 1.1498, test_f1: 0.6578
 epoch: 51, train_loss: 0.6232, test_loss: 1.1418, test_f1: 0.6335
 epoch: 52, train_loss: 0.6011, test_loss: 1.2245, test_f1: 0.6584
 epoch: 53, train_loss: 0.6064, test_loss: 1.3370, test_f1: 0.6300
 epoch: 54, train_loss: 0.5891, test_loss: 1.2875, test_f1: 0.6382
 epoch: 55, train_loss: 0.5947, test_loss: 1.2246, test_f1: 0.6053
 epoch: 56, train_loss: 0.5779, test_loss: 1.2496, test_f1: 0.6408
 epoch: 57, train_loss: 0.5649, test_loss: 1.1812, test_f1: 0.6644
 epoch: 58, train_loss: 0.5645, test_loss: 1.2641, test_f1: 0.6273
 epoch: 59, train_loss: 0.5583, test_loss: 1.1539, test_f1: 0.6483
 epoch: 60, train_loss: 0.5771, test_loss: 1.2391, test_f1: 0.6406
 epoch: 61, train_loss: 0.5488, test_loss: 1.2755, test_f1: 0.6110
 epoch: 62, train_loss: 0.5342, test_loss: 1.3374, test_f1: 0.6346
 epoch: 63, train_loss: 0.5471, test_loss: 1.2105, test_f1: 0.6453
 epoch: 64, train_loss: 0.5757, test_loss: 1.4348, test_f1: 0.6234
 epoch: 65, train_loss: 0.5569, test_loss: 1.3434, test_f1: 0.6229
 epoch: 66, train_loss: 0.5460, test_loss: 1.4209, test_f1: 0.6197
 epoch: 67, train_loss: 0.5415, test_loss: 7.8663, test_f1: 0.2036
 epoch: 68, train_loss: 0.5390, test_loss: 1.7611, test_f1: 0.6090
 epoch: 69, train_loss: 0.5314, test_loss: 1.4256, test_f1: 0.6345
 epoch: 70, train_loss: 0.5388, test_loss: 1.6248, test_f1: 0.6163
 epoch: 71, train_loss: 0.5334, test_loss: 1.2895, test_f1: 0.6574
 epoch: 72, train_loss: 0.5418, test_loss: 1.6933, test_f1: 0.5987
 epoch: 73, train_loss: 0.5208, test_loss: 1.4471, test_f1: 0.6225
 epoch: 74, train_loss: 0.5231, test_loss: 1.5556, test_f1: 0.6500
 epoch: 75, train_loss: 0.5001, test_loss: 1.4208, test_f1: 0.6375
 epoch: 76, train_loss: 0.5084, test_loss: 1.4712, test_f1: 0.6580
 epoch: 77, train_loss: 0.4920, test_loss: 1.7080, test_f1: 0.5957
 epoch: 78, train_loss: 0.5519, test_loss: 1.3133, test_f1: 0.6521
 epoch: 79, train_loss: 0.5017, test_loss: 1.3433, test_f1: 0.6292
 epoch: 80, train_loss: 0.5092, test_loss: 1.4455, test_f1: 0.6537
 epoch: 81, train_loss: 0.5060, test_loss: 1.3946, test_f1: 0.6373
 epoch: 82, train_loss: 0.5191, test_loss: 1.4819, test_f1: 0.6310
 epoch: 83, train_loss: 0.5040, test_loss: 1.5290, test_f1: 0.6328
 epoch: 84, train_loss: 0.4736, test_loss: 1.7629, test_f1: 0.6245
 epoch: 85, train_loss: 0.5009, test_loss: 1.5416, test_f1: 0.6212
 epoch: 86, train_loss: 0.5207, test_loss: 1.6901, test_f1: 0.6288
 epoch: 87, train_loss: 0.5244, test_loss: 1.6223, test_f1: 0.6150
 epoch: 88, train_loss: 0.5128, test_loss: 1.5837, test_f1: 0.5862
 epoch: 89, train_loss: 0.4987, test_loss: 1.4524, test_f1: 0.6350
 epoch: 90, train_loss: 0.4705, test_loss: 1.4272, test_f1: 0.6360
 epoch: 91, train_loss: 0.4680, test_loss: 1.4657, test_f1: 0.6421
 epoch: 92, train_loss: 0.4731, test_loss: 1.5774, test_f1: 0.6581
 epoch: 93, train_loss: 0.5129, test_loss: 1.4422, test_f1: 0.6250
 epoch: 94, train_loss: 0.4652, test_loss: 1.5459, test_f1: 0.6570
 epoch: 95, train_loss: 0.4557, test_loss: 1.5223, test_f1: 0.6237
 epoch: 96, train_loss: 0.4584, test_loss: 1.5715, test_f1: 0.6439
 epoch: 97, train_loss: 0.4611, test_loss: 1.5116, test_f1: 0.6783
 epoch: 98, train_loss: 0.4873, test_loss: 1.4625, test_f1: 0.6560
 epoch: 99, train_loss: 0.4749, test_loss: 1.5385, test_f1: 0.6554
##################ITERATION #7 ****************************************
 epoch: 0, train_loss: 1.1447, test_loss: 1.2285, test_f1: 0.4872
 epoch: 1, train_loss: 0.9572, test_loss: 1.0603, test_f1: 0.5291
 epoch: 2, train_loss: 0.9285, test_loss: 1.3283, test_f1: 0.2940
 epoch: 3, train_loss: 0.9252, test_loss: 0.9568, test_f1: 0.5578
 epoch: 4, train_loss: 0.8931, test_loss: 1.2215, test_f1: 0.5306
 epoch: 5, train_loss: 0.8468, test_loss: 1.0432, test_f1: 0.5739
 epoch: 6, train_loss: 0.8540, test_loss: 1.1261, test_f1: 0.4982
 epoch: 7, train_loss: 0.8702, test_loss: 1.0272, test_f1: 0.5375
 epoch: 8, train_loss: 0.8804, test_loss: 1.1678, test_f1: 0.5069
 epoch: 9, train_loss: 0.8580, test_loss: 1.0012, test_f1: 0.5518
 epoch: 10, train_loss: 0.8302, test_loss: 0.9536, test_f1: 0.5929
 epoch: 11, train_loss: 0.8087, test_loss: 1.0159, test_f1: 0.5798
 epoch: 12, train_loss: 0.8018, test_loss: 0.9432, test_f1: 0.6178
 epoch: 13, train_loss: 0.7916, test_loss: 1.0693, test_f1: 0.5676
 epoch: 14, train_loss: 0.7802, test_loss: 0.9846, test_f1: 0.5923
 epoch: 15, train_loss: 0.8076, test_loss: 0.9667, test_f1: 0.6046
 epoch: 16, train_loss: 0.8097, test_loss: 0.9674, test_f1: 0.6152
 epoch: 17, train_loss: 0.7938, test_loss: 1.3873, test_f1: 0.5710
 epoch: 18, train_loss: 0.7798, test_loss: 0.9951, test_f1: 0.5837
 epoch: 19, train_loss: 0.7739, test_loss: 1.0280, test_f1: 0.6384
 epoch: 20, train_loss: 0.7535, test_loss: 1.1018, test_f1: 0.6041
 epoch: 21, train_loss: 0.7691, test_loss: 0.9901, test_f1: 0.6045
 epoch: 22, train_loss: 0.7519, test_loss: 0.9943, test_f1: 0.5450
 epoch: 23, train_loss: 0.7947, test_loss: 1.0607, test_f1: 0.5738
 epoch: 24, train_loss: 0.7562, test_loss: 0.9806, test_f1: 0.6201
 epoch: 25, train_loss: 0.7511, test_loss: 1.4370, test_f1: 0.5643
 epoch: 26, train_loss: 0.7623, test_loss: 0.9744, test_f1: 0.6039
 epoch: 27, train_loss: 0.7420, test_loss: 1.0676, test_f1: 0.5733
 epoch: 28, train_loss: 0.7225, test_loss: 1.0500, test_f1: 0.6372
 epoch: 29, train_loss: 0.7139, test_loss: 0.9800, test_f1: 0.6549
 epoch: 30, train_loss: 0.7282, test_loss: 0.9810, test_f1: 0.5776
 epoch: 31, train_loss: 0.7210, test_loss: 1.0379, test_f1: 0.6191
 epoch: 32, train_loss: 0.7113, test_loss: 1.3006, test_f1: 0.5832
 epoch: 33, train_loss: 0.7382, test_loss: 1.3704, test_f1: 0.5752
 epoch: 34, train_loss: 0.7171, test_loss: 1.0229, test_f1: 0.6119
 epoch: 35, train_loss: 0.7040, test_loss: 0.9910, test_f1: 0.6313
 epoch: 36, train_loss: 0.6721, test_loss: 0.9352, test_f1: 0.6478
 epoch: 37, train_loss: 0.7510, test_loss: 1.0360, test_f1: 0.6645
 epoch: 38, train_loss: 0.7292, test_loss: 1.2065, test_f1: 0.6018
 epoch: 39, train_loss: 0.7161, test_loss: 1.2336, test_f1: 0.5839
 epoch: 40, train_loss: 0.7078, test_loss: 1.1140, test_f1: 0.6171
 epoch: 41, train_loss: 0.6929, test_loss: 1.3434, test_f1: 0.6205
 epoch: 42, train_loss: 0.7014, test_loss: 1.6889, test_f1: 0.5697
 epoch: 43, train_loss: 0.6651, test_loss: 1.5320, test_f1: 0.5826
 epoch: 44, train_loss: 0.6950, test_loss: 1.2522, test_f1: 0.5836
 epoch: 45, train_loss: 0.6840, test_loss: 1.0262, test_f1: 0.6237
 epoch: 46, train_loss: 0.6860, test_loss: 1.0801, test_f1: 0.6237
 epoch: 47, train_loss: 0.6711, test_loss: 1.6786, test_f1: 0.5427
 epoch: 48, train_loss: 0.6669, test_loss: 0.9796, test_f1: 0.6742
 epoch: 49, train_loss: 0.6392, test_loss: 1.1016, test_f1: 0.6533
 epoch: 50, train_loss: 0.6525, test_loss: 1.1021, test_f1: 0.6437
 epoch: 51, train_loss: 0.6472, test_loss: 1.0221, test_f1: 0.6281
 epoch: 52, train_loss: 0.6094, test_loss: 0.9883, test_f1: 0.6717
 epoch: 53, train_loss: 0.6285, test_loss: 0.9760, test_f1: 0.6693
 epoch: 54, train_loss: 0.6094, test_loss: 1.5596, test_f1: 0.6522
 epoch: 55, train_loss: 0.6134, test_loss: 1.0103, test_f1: 0.6490
 epoch: 56, train_loss: 0.6362, test_loss: 1.1307, test_f1: 0.6197
 epoch: 57, train_loss: 0.6247, test_loss: 1.0220, test_f1: 0.6554
 epoch: 58, train_loss: 0.6057, test_loss: 1.0926, test_f1: 0.6312
 epoch: 59, train_loss: 0.6197, test_loss: 1.5124, test_f1: 0.6029
 epoch: 60, train_loss: 0.6049, test_loss: 1.1012, test_f1: 0.6444
 epoch: 61, train_loss: 0.5870, test_loss: 1.1392, test_f1: 0.6116
 epoch: 62, train_loss: 0.5761, test_loss: 1.2188, test_f1: 0.6613
 epoch: 63, train_loss: 0.5827, test_loss: 0.9858, test_f1: 0.6634
 epoch: 64, train_loss: 0.5955, test_loss: 1.1187, test_f1: 0.6139
 epoch: 65, train_loss: 0.5894, test_loss: 1.1806, test_f1: 0.6523
 epoch: 66, train_loss: 0.5906, test_loss: 1.3479, test_f1: 0.6337
 epoch: 67, train_loss: 0.5849, test_loss: 1.0971, test_f1: 0.6362
 epoch: 68, train_loss: 0.6202, test_loss: 1.0378, test_f1: 0.6524
 epoch: 69, train_loss: 0.5677, test_loss: 1.0566, test_f1: 0.6330
 epoch: 70, train_loss: 0.5785, test_loss: 1.0008, test_f1: 0.6324
 epoch: 71, train_loss: 0.5841, test_loss: 1.0813, test_f1: 0.6721
 epoch: 72, train_loss: 0.5601, test_loss: 1.1774, test_f1: 0.5955
 epoch: 73, train_loss: 0.5620, test_loss: 1.1700, test_f1: 0.6172
 epoch: 74, train_loss: 0.5805, test_loss: 1.0987, test_f1: 0.6221
 epoch: 75, train_loss: 0.5821, test_loss: 1.0138, test_f1: 0.6652
 epoch: 76, train_loss: 0.5546, test_loss: 1.0501, test_f1: 0.6338
 epoch: 77, train_loss: 0.5404, test_loss: 1.1625, test_f1: 0.6053
 epoch: 78, train_loss: 0.5590, test_loss: 1.0096, test_f1: 0.6550
 epoch: 79, train_loss: 0.5341, test_loss: 1.0365, test_f1: 0.6746
 epoch: 80, train_loss: 0.5598, test_loss: 1.0418, test_f1: 0.6656
 epoch: 81, train_loss: 0.5498, test_loss: 1.1663, test_f1: 0.6342
 epoch: 82, train_loss: 0.5608, test_loss: 1.1061, test_f1: 0.6394
 epoch: 83, train_loss: 0.5413, test_loss: 1.4850, test_f1: 0.5745
 epoch: 84, train_loss: 0.5206, test_loss: 1.1277, test_f1: 0.6196
 epoch: 85, train_loss: 0.5455, test_loss: 1.0094, test_f1: 0.6374
 epoch: 86, train_loss: 0.5386, test_loss: 1.1117, test_f1: 0.5970
 epoch: 87, train_loss: 0.5530, test_loss: 1.3227, test_f1: 0.5938
 epoch: 88, train_loss: 0.5470, test_loss: 1.1097, test_f1: 0.6259
 epoch: 89, train_loss: 0.5552, test_loss: 1.0856, test_f1: 0.6383
 epoch: 90, train_loss: 0.5232, test_loss: 1.2211, test_f1: 0.6130
 epoch: 91, train_loss: 0.5177, test_loss: 1.3052, test_f1: 0.5980
 epoch: 92, train_loss: 0.5708, test_loss: 1.1565, test_f1: 0.6529
 epoch: 93, train_loss: 0.5397, test_loss: 1.4081, test_f1: 0.6332
 epoch: 94, train_loss: 0.5309, test_loss: 1.3181, test_f1: 0.6161
 epoch: 95, train_loss: 0.5266, test_loss: 2.1396, test_f1: 0.6044
 epoch: 96, train_loss: 0.5257, test_loss: 1.2603, test_f1: 0.6109
 epoch: 97, train_loss: 0.5229, test_loss: 1.1241, test_f1: 0.6753
 epoch: 98, train_loss: 0.4910, test_loss: 1.3073, test_f1: 0.6246
 epoch: 99, train_loss: 0.5092, test_loss: 1.0874, test_f1: 0.6448
##################ITERATION #8 ****************************************
 epoch: 0, train_loss: 1.1642, test_loss: 1.5181, test_f1: 0.1864
 epoch: 1, train_loss: 0.9701, test_loss: 1.1276, test_f1: 0.4437
 epoch: 2, train_loss: 0.9631, test_loss: 1.1534, test_f1: 0.4857
 epoch: 3, train_loss: 0.9346, test_loss: 1.0727, test_f1: 0.5185
 epoch: 4, train_loss: 0.8830, test_loss: 1.0548, test_f1: 0.5483
 epoch: 5, train_loss: 0.8791, test_loss: 1.3915, test_f1: 0.4389
 epoch: 6, train_loss: 0.8958, test_loss: 1.0137, test_f1: 0.5885
 epoch: 7, train_loss: 0.8816, test_loss: 1.0266, test_f1: 0.5631
 epoch: 8, train_loss: 0.8713, test_loss: 0.9653, test_f1: 0.5964
 epoch: 9, train_loss: 0.8439, test_loss: 1.0131, test_f1: 0.5844
 epoch: 10, train_loss: 0.8365, test_loss: 0.9800, test_f1: 0.5487
 epoch: 11, train_loss: 0.8366, test_loss: 0.9240, test_f1: 0.5558
 epoch: 12, train_loss: 0.8046, test_loss: 1.3165, test_f1: 0.4894
 epoch: 13, train_loss: 0.8176, test_loss: 1.0505, test_f1: 0.6039
 epoch: 14, train_loss: 0.8364, test_loss: 1.2804, test_f1: 0.5715
 epoch: 15, train_loss: 0.7970, test_loss: 1.0539, test_f1: 0.5642
 epoch: 16, train_loss: 0.7839, test_loss: 1.4602, test_f1: 0.5795
 epoch: 17, train_loss: 0.8105, test_loss: 1.9010, test_f1: 0.5181
 epoch: 18, train_loss: 0.8081, test_loss: 1.0060, test_f1: 0.5763
 epoch: 19, train_loss: 0.7881, test_loss: 1.7476, test_f1: 0.3832
 epoch: 20, train_loss: 0.8165, test_loss: 1.3291, test_f1: 0.4797
 epoch: 21, train_loss: 0.7908, test_loss: 1.0255, test_f1: 0.5536
 epoch: 22, train_loss: 0.8025, test_loss: 1.6633, test_f1: 0.5249
 epoch: 23, train_loss: 0.7832, test_loss: 2.2217, test_f1: 0.5215
 epoch: 24, train_loss: 0.7838, test_loss: 1.0209, test_f1: 0.5689
 epoch: 25, train_loss: 0.7756, test_loss: 1.1299, test_f1: 0.4821
 epoch: 26, train_loss: 0.7954, test_loss: 0.9476, test_f1: 0.5887
 epoch: 27, train_loss: 0.7848, test_loss: 1.0044, test_f1: 0.5919
 epoch: 28, train_loss: 0.7492, test_loss: 1.0253, test_f1: 0.6106
 epoch: 29, train_loss: 0.7561, test_loss: 1.3293, test_f1: 0.5470
 epoch: 30, train_loss: 0.7356, test_loss: 1.0667, test_f1: 0.5646
 epoch: 31, train_loss: 0.7533, test_loss: 1.2435, test_f1: 0.4724
 epoch: 32, train_loss: 0.7479, test_loss: 1.0893, test_f1: 0.5818
 epoch: 33, train_loss: 0.7617, test_loss: 1.1258, test_f1: 0.5715
 epoch: 34, train_loss: 0.7752, test_loss: 1.7679, test_f1: 0.5290
 epoch: 35, train_loss: 0.7630, test_loss: 1.5658, test_f1: 0.5688
 epoch: 36, train_loss: 0.7290, test_loss: 1.6526, test_f1: 0.5841
 epoch: 37, train_loss: 0.7557, test_loss: 1.5575, test_f1: 0.5426
 epoch: 38, train_loss: 0.7666, test_loss: 1.0166, test_f1: 0.5687
 epoch: 39, train_loss: 0.7166, test_loss: 1.6631, test_f1: 0.5920
 epoch: 40, train_loss: 0.7298, test_loss: 1.3308, test_f1: 0.5937
 epoch: 41, train_loss: 0.7658, test_loss: 1.2211, test_f1: 0.5615
 epoch: 42, train_loss: 0.7476, test_loss: 1.1462, test_f1: 0.5565
 epoch: 43, train_loss: 0.7282, test_loss: 1.3715, test_f1: 0.5113
 epoch: 44, train_loss: 0.7224, test_loss: 1.2771, test_f1: 0.6173
 epoch: 45, train_loss: 0.7200, test_loss: 1.0178, test_f1: 0.6213
 epoch: 46, train_loss: 0.7201, test_loss: 0.9812, test_f1: 0.6151
 epoch: 47, train_loss: 0.6995, test_loss: 1.9528, test_f1: 0.5936
 epoch: 48, train_loss: 0.7162, test_loss: 1.3012, test_f1: 0.5521
 epoch: 49, train_loss: 0.7262, test_loss: 1.0298, test_f1: 0.6021
 epoch: 50, train_loss: 0.7306, test_loss: 1.5632, test_f1: 0.5192
 epoch: 51, train_loss: 0.6846, test_loss: 1.0724, test_f1: 0.6124
 epoch: 52, train_loss: 0.6567, test_loss: 1.1426, test_f1: 0.6066
 epoch: 53, train_loss: 0.6674, test_loss: 1.1149, test_f1: 0.5925
 epoch: 54, train_loss: 0.6700, test_loss: 1.2905, test_f1: 0.5945
 epoch: 55, train_loss: 0.6667, test_loss: 1.0143, test_f1: 0.6227
 epoch: 56, train_loss: 0.6536, test_loss: 1.2724, test_f1: 0.6151
 epoch: 57, train_loss: 0.6348, test_loss: 1.2291, test_f1: 0.6381
 epoch: 58, train_loss: 0.6592, test_loss: 0.9818, test_f1: 0.6008
 epoch: 59, train_loss: 0.6599, test_loss: 1.1894, test_f1: 0.6410
 epoch: 60, train_loss: 0.6448, test_loss: 0.9887, test_f1: 0.6392
 epoch: 61, train_loss: 0.6654, test_loss: 1.0761, test_f1: 0.5994
 epoch: 62, train_loss: 0.6427, test_loss: 1.0252, test_f1: 0.6304
 epoch: 63, train_loss: 0.6570, test_loss: 0.9998, test_f1: 0.6412
 epoch: 64, train_loss: 0.6454, test_loss: 1.2225, test_f1: 0.6089
 epoch: 65, train_loss: 0.6318, test_loss: 1.1726, test_f1: 0.6569
 epoch: 66, train_loss: 0.6253, test_loss: 1.0645, test_f1: 0.6692
 epoch: 67, train_loss: 0.6359, test_loss: 1.0454, test_f1: 0.5890
 epoch: 68, train_loss: 0.6357, test_loss: 1.0800, test_f1: 0.6330
 epoch: 69, train_loss: 0.6355, test_loss: 1.0711, test_f1: 0.6258
 epoch: 70, train_loss: 0.6288, test_loss: 0.9847, test_f1: 0.6282
 epoch: 71, train_loss: 0.6131, test_loss: 0.9508, test_f1: 0.6665
 epoch: 72, train_loss: 0.6245, test_loss: 1.1829, test_f1: 0.6432
 epoch: 73, train_loss: 0.6218, test_loss: 1.1536, test_f1: 0.6387
 epoch: 74, train_loss: 0.6212, test_loss: 1.3429, test_f1: 0.6073
 epoch: 75, train_loss: 0.6282, test_loss: 1.2941, test_f1: 0.6241
 epoch: 76, train_loss: 0.6147, test_loss: 1.1933, test_f1: 0.6443
 epoch: 77, train_loss: 0.6272, test_loss: 1.4598, test_f1: 0.6377
 epoch: 78, train_loss: 0.6193, test_loss: 1.2167, test_f1: 0.5733
 epoch: 79, train_loss: 0.6309, test_loss: 1.0665, test_f1: 0.6329
 epoch: 80, train_loss: 0.6159, test_loss: 1.2966, test_f1: 0.6344
 epoch: 81, train_loss: 0.7433, test_loss: 1.5407, test_f1: 0.3575
 epoch: 82, train_loss: 0.7590, test_loss: 1.1252, test_f1: 0.4987
 epoch: 83, train_loss: 0.6955, test_loss: 1.1174, test_f1: 0.5266
 epoch: 84, train_loss: 0.6452, test_loss: 1.1364, test_f1: 0.6152
 epoch: 85, train_loss: 0.6450, test_loss: 0.9786, test_f1: 0.6109
 epoch: 86, train_loss: 0.6198, test_loss: 1.0519, test_f1: 0.6173
 epoch: 87, train_loss: 0.6311, test_loss: 1.0047, test_f1: 0.6414
 epoch: 88, train_loss: 0.6219, test_loss: 1.1873, test_f1: 0.6271
 epoch: 89, train_loss: 0.6355, test_loss: 1.0771, test_f1: 0.6417
 epoch: 90, train_loss: 0.6368, test_loss: 0.9977, test_f1: 0.6266
 epoch: 91, train_loss: 0.6082, test_loss: 1.0996, test_f1: 0.6335
 epoch: 92, train_loss: 0.5975, test_loss: 1.0674, test_f1: 0.6324
 epoch: 93, train_loss: 0.5917, test_loss: 1.1042, test_f1: 0.6566
 epoch: 94, train_loss: 0.6039, test_loss: 1.2044, test_f1: 0.5932
 epoch: 95, train_loss: 0.5967, test_loss: 1.1196, test_f1: 0.6308
 epoch: 96, train_loss: 0.6006, test_loss: 1.1085, test_f1: 0.6185
 epoch: 97, train_loss: 0.5838, test_loss: 1.3094, test_f1: 0.5634
 epoch: 98, train_loss: 0.5810, test_loss: 1.2395, test_f1: 0.6375
 epoch: 99, train_loss: 0.5869, test_loss: 1.2400, test_f1: 0.6169
##################ITERATION #9 ****************************************
 epoch: 0, train_loss: 1.1936, test_loss: 1.2251, test_f1: 0.4352
 epoch: 1, train_loss: 1.0371, test_loss: 1.0385, test_f1: 0.5319
 epoch: 2, train_loss: 0.9647, test_loss: 1.1011, test_f1: 0.5561
 epoch: 3, train_loss: 0.9533, test_loss: 1.0752, test_f1: 0.5292
 epoch: 4, train_loss: 0.9282, test_loss: 1.0617, test_f1: 0.5590
 epoch: 5, train_loss: 0.9120, test_loss: 1.3765, test_f1: 0.4188
 epoch: 6, train_loss: 0.8590, test_loss: 1.0578, test_f1: 0.5557
 epoch: 7, train_loss: 0.8552, test_loss: 1.0484, test_f1: 0.5529
 epoch: 8, train_loss: 0.8455, test_loss: 1.0100, test_f1: 0.5351
 epoch: 9, train_loss: 0.8473, test_loss: 0.9845, test_f1: 0.5520
 epoch: 10, train_loss: 0.8246, test_loss: 1.1561, test_f1: 0.5546
 epoch: 11, train_loss: 0.8264, test_loss: 1.1464, test_f1: 0.5276
 epoch: 12, train_loss: 0.8167, test_loss: 1.0186, test_f1: 0.5955
 epoch: 13, train_loss: 0.7919, test_loss: 0.9863, test_f1: 0.5868
 epoch: 14, train_loss: 0.8057, test_loss: 1.0426, test_f1: 0.5435
 epoch: 15, train_loss: 0.8486, test_loss: 1.0757, test_f1: 0.5775
 epoch: 16, train_loss: 0.8162, test_loss: 0.9606, test_f1: 0.5450
 epoch: 17, train_loss: 0.8119, test_loss: 1.0328, test_f1: 0.5785
 epoch: 18, train_loss: 0.7953, test_loss: 1.0098, test_f1: 0.5861
 epoch: 19, train_loss: 0.7968, test_loss: 1.0368, test_f1: 0.6091
 epoch: 20, train_loss: 0.7704, test_loss: 1.0123, test_f1: 0.5889
 epoch: 21, train_loss: 0.7823, test_loss: 0.9491, test_f1: 0.5902
 epoch: 22, train_loss: 0.7747, test_loss: 1.0761, test_f1: 0.5448
 epoch: 23, train_loss: 0.7757, test_loss: 1.0539, test_f1: 0.5870
 epoch: 24, train_loss: 0.7738, test_loss: 1.0679, test_f1: 0.5590
 epoch: 25, train_loss: 0.7640, test_loss: 1.1061, test_f1: 0.6067
 epoch: 26, train_loss: 0.7496, test_loss: 0.9941, test_f1: 0.6187
 epoch: 27, train_loss: 0.7583, test_loss: 0.9715, test_f1: 0.6179
 epoch: 28, train_loss: 0.7631, test_loss: 1.2121, test_f1: 0.5461
 epoch: 29, train_loss: 0.7836, test_loss: 1.2240, test_f1: 0.5520
 epoch: 30, train_loss: 0.7676, test_loss: 0.9541, test_f1: 0.6307
 epoch: 31, train_loss: 0.7487, test_loss: 1.3530, test_f1: 0.6089
 epoch: 32, train_loss: 0.7449, test_loss: 1.1501, test_f1: 0.5594
 epoch: 33, train_loss: 0.7588, test_loss: 1.0605, test_f1: 0.6082
 epoch: 34, train_loss: 0.7381, test_loss: 1.2994, test_f1: 0.4994
 epoch: 35, train_loss: 0.7622, test_loss: 1.1105, test_f1: 0.6029
 epoch: 36, train_loss: 0.7404, test_loss: 0.9949, test_f1: 0.6449
 epoch: 37, train_loss: 0.7590, test_loss: 1.0599, test_f1: 0.6070
 epoch: 38, train_loss: 0.7243, test_loss: 0.9234, test_f1: 0.6160
 epoch: 39, train_loss: 0.7106, test_loss: 1.0369, test_f1: 0.5820
 epoch: 40, train_loss: 0.7280, test_loss: 0.9602, test_f1: 0.6512
 epoch: 41, train_loss: 0.7122, test_loss: 1.1899, test_f1: 0.5871
 epoch: 42, train_loss: 0.7142, test_loss: 1.0832, test_f1: 0.5550
 epoch: 43, train_loss: 0.7009, test_loss: 1.0736, test_f1: 0.6390
 epoch: 44, train_loss: 0.7253, test_loss: 1.0478, test_f1: 0.5661
 epoch: 45, train_loss: 0.7169, test_loss: 0.9614, test_f1: 0.6185
 epoch: 46, train_loss: 0.6938, test_loss: 1.0412, test_f1: 0.5993
 epoch: 47, train_loss: 0.6937, test_loss: 1.0620, test_f1: 0.6407
 epoch: 48, train_loss: 0.6810, test_loss: 0.9015, test_f1: 0.6614
 epoch: 49, train_loss: 0.6679, test_loss: 1.1549, test_f1: 0.5435
 epoch: 50, train_loss: 0.7174, test_loss: 0.9347, test_f1: 0.6423
 epoch: 51, train_loss: 0.6634, test_loss: 0.9924, test_f1: 0.6490
 epoch: 52, train_loss: 0.6313, test_loss: 0.9967, test_f1: 0.6441
 epoch: 53, train_loss: 0.6402, test_loss: 1.0861, test_f1: 0.6512
 epoch: 54, train_loss: 0.6362, test_loss: 1.1122, test_f1: 0.6405
 epoch: 55, train_loss: 0.6280, test_loss: 1.0068, test_f1: 0.6671
 epoch: 56, train_loss: 0.6128, test_loss: 1.0911, test_f1: 0.6637
 epoch: 57, train_loss: 0.6083, test_loss: 1.2316, test_f1: 0.6395
 epoch: 58, train_loss: 0.6148, test_loss: 1.1118, test_f1: 0.6544
 epoch: 59, train_loss: 0.6051, test_loss: 1.0802, test_f1: 0.6153
 epoch: 60, train_loss: 0.6115, test_loss: 1.0682, test_f1: 0.6398
 epoch: 61, train_loss: 0.6025, test_loss: 1.1082, test_f1: 0.6693
 epoch: 62, train_loss: 0.6248, test_loss: 1.0158, test_f1: 0.6502
 epoch: 63, train_loss: 0.6185, test_loss: 1.2206, test_f1: 0.5797
 epoch: 64, train_loss: 0.5940, test_loss: 1.2360, test_f1: 0.6451
 epoch: 65, train_loss: 0.5926, test_loss: 1.1440, test_f1: 0.6050
 epoch: 66, train_loss: 0.6101, test_loss: 1.2781, test_f1: 0.6041
 epoch: 67, train_loss: 0.6148, test_loss: 1.1746, test_f1: 0.6405
 epoch: 68, train_loss: 0.5691, test_loss: 1.0189, test_f1: 0.6627
 epoch: 69, train_loss: 0.5825, test_loss: 1.1253, test_f1: 0.6465
 epoch: 70, train_loss: 0.6398, test_loss: 1.0721, test_f1: 0.6382
 epoch: 71, train_loss: 0.5869, test_loss: 0.9886, test_f1: 0.6328
 epoch: 72, train_loss: 0.5910, test_loss: 1.0259, test_f1: 0.6479
 epoch: 73, train_loss: 0.5923, test_loss: 1.0908, test_f1: 0.6630
 epoch: 74, train_loss: 0.5541, test_loss: 1.1822, test_f1: 0.6436
 epoch: 75, train_loss: 0.5726, test_loss: 1.2236, test_f1: 0.6171
 epoch: 76, train_loss: 0.5663, test_loss: 1.2859, test_f1: 0.6330
 epoch: 77, train_loss: 0.5750, test_loss: 1.1507, test_f1: 0.6596
 epoch: 78, train_loss: 0.5600, test_loss: 1.1798, test_f1: 0.5899
 epoch: 79, train_loss: 0.5661, test_loss: 1.2204, test_f1: 0.6349
 epoch: 80, train_loss: 0.5467, test_loss: 1.1261, test_f1: 0.6251
 epoch: 81, train_loss: 0.5395, test_loss: 1.2453, test_f1: 0.6606
 epoch: 82, train_loss: 0.5444, test_loss: 1.1120, test_f1: 0.6238
 epoch: 83, train_loss: 0.5358, test_loss: 1.2643, test_f1: 0.6269
 epoch: 84, train_loss: 0.5477, test_loss: 1.1561, test_f1: 0.6438
 epoch: 85, train_loss: 0.5357, test_loss: 1.3279, test_f1: 0.6531
 epoch: 86, train_loss: 0.5709, test_loss: 1.3594, test_f1: 0.6435
 epoch: 87, train_loss: 0.5557, test_loss: 1.1940, test_f1: 0.6032
 epoch: 88, train_loss: 0.5259, test_loss: 1.1189, test_f1: 0.6231
 epoch: 89, train_loss: 0.5407, test_loss: 1.0668, test_f1: 0.6759
 epoch: 90, train_loss: 0.5116, test_loss: 1.1833, test_f1: 0.6234
 epoch: 91, train_loss: 0.5335, test_loss: 1.1893, test_f1: 0.6392
 epoch: 92, train_loss: 0.4967, test_loss: 1.3147, test_f1: 0.6488
 epoch: 93, train_loss: 0.4940, test_loss: 1.2425, test_f1: 0.6690
 epoch: 94, train_loss: 0.5138, test_loss: 1.2878, test_f1: 0.6538
 epoch: 95, train_loss: 0.5209, test_loss: 1.3918, test_f1: 0.6596
 epoch: 96, train_loss: 0.5089, test_loss: 1.3698, test_f1: 0.6544
 epoch: 97, train_loss: 0.5349, test_loss: 1.1263, test_f1: 0.6455
 epoch: 98, train_loss: 0.5173, test_loss: 1.2379, test_f1: 0.6930
 epoch: 99, train_loss: 0.5266, test_loss: 1.5638, test_f1: 0.6086

Training completed in 1207.44 seconds
Best F1: 0.6930 at epoch 98
Mean F1 across iterations: 0.6695  0.0218
========================FINAL RESULTS================================
FEGIN weighted F1: 0.6930  0.0218
python main.py --data ltspice_demos --representation component_pin --model FEGIN --layers 6 --hiddens 32 --batch_size 32 --lr 0.01 --emb_size 512 --epochs 100 --save_appendix component_pin_L6_H32_BS32_LR0.01_E512 --no_val
-----



STDERR:
  File "main.py", line 370, in <module>
    main()
  File "main.py", line 254, in main
    dataset = dataset_class(
  File "/home/philip/projects/ltspice_examples_code_repo/Circuit-Completion-Using-GNNs/component_classification_with_link_prediction_head/evaluation/FEGIN/kernel/circuit_datasets.py", line 15, in __init__
    self.data, self.slices = torch.load(self.processed_paths[0])
  File "/home/philip/.local/lib/python3.8/site-packages/torch/serialization.py", line 1040, in load
    warnings.warn(
  File "/usr/lib/python3.8/warnings.py", line 109, in _showwarnmsg
    sw(msg.message, msg.category, msg.filename, msg.lineno,
  File "main.py", line 47, in warn_with_traceback
    traceback.print_stack(file=log)
/home/philip/projects/ltspice_examples_code_repo/Circuit-Completion-Using-GNNs/component_classification_with_link_prediction_head/evaluation/FEGIN/kernel/circuit_datasets.py:15: FutureWarning: You are using `torch.load` with `weights_only=False` (the current default value), which uses the default pickle module implicitly. It is possible to construct malicious pickle data which will execute arbitrary code during unpickling (See https://github.com/pytorch/pytorch/blob/main/SECURITY.md#untrusted-models for more details). In a future release, the default value for `weights_only` will be flipped to `True`. This limits the functions that could be executed during unpickling. Arbitrary objects will no longer be allowed to be loaded via this mode unless they are explicitly allowlisted by the user via `torch.serialization.add_safe_globals`. We recommend you start setting `weights_only=True` for any use case where you don't have full control of the loaded file. Please open an issue on GitHub for any issues related to this experimental feature.
  self.data, self.slices = torch.load(self.processed_paths[0])
