STDOUT:
Results will be saved in /home/philip/projects/llm_inference_code_repo/Circuit-Completion-Using-GNNs/component_classification_with_link_prediction_head/evaluation/FEGIN/results/model_FEGIN_dataset_ltspice_examples
Command line input: python main.py --data ltspice_examples --representation component_pin --model FEGIN --layers 6 --hiddens 64 --batch_size 64 --lr 0.01 --emb_size 250 --epochs 100 --save_appendix component_pin_L6_H64_BS64_LR0.01_E250 --no_val
 is saved.
-----
ltspice_examples - FEGIN
Using 6 layers, 64 hidden units, h = 2
Loading component_pin representation dataset
ENTERED
Training FEGIN on component_pin representation
Train: 3560, Test: 848
##################ITERATION #0 ****************************************
 epoch: 0, train_loss: 1.1712, test_loss: 1.1886, test_f1: 0.3733
 epoch: 1, train_loss: 1.0326, test_loss: 1.0473, test_f1: 0.3741
 epoch: 2, train_loss: 0.9995, test_loss: 0.9962, test_f1: 0.5289
 epoch: 3, train_loss: 0.9859, test_loss: 1.1251, test_f1: 0.4249
 epoch: 4, train_loss: 0.9600, test_loss: 0.9765, test_f1: 0.5287
 epoch: 5, train_loss: 0.9544, test_loss: 0.9960, test_f1: 0.4662
 epoch: 6, train_loss: 0.9241, test_loss: 0.9652, test_f1: 0.4748
 epoch: 7, train_loss: 0.9176, test_loss: 1.0262, test_f1: 0.4526
 epoch: 8, train_loss: 0.9111, test_loss: 0.9659, test_f1: 0.4832
 epoch: 9, train_loss: 0.8920, test_loss: 0.9252, test_f1: 0.5252
 epoch: 10, train_loss: 0.8803, test_loss: 0.8901, test_f1: 0.5085
 epoch: 11, train_loss: 0.8654, test_loss: 0.9419, test_f1: 0.5404
 epoch: 12, train_loss: 0.8455, test_loss: 0.8227, test_f1: 0.5505
 epoch: 13, train_loss: 0.8362, test_loss: 0.8641, test_f1: 0.5032
 epoch: 14, train_loss: 0.8568, test_loss: 0.9270, test_f1: 0.4986
 epoch: 15, train_loss: 0.8658, test_loss: 2.2603, test_f1: 0.4324
 epoch: 16, train_loss: 0.8425, test_loss: 1.0711, test_f1: 0.5434
 epoch: 17, train_loss: 0.8187, test_loss: 0.8065, test_f1: 0.5393
 epoch: 18, train_loss: 0.8234, test_loss: 0.9205, test_f1: 0.5411
 epoch: 19, train_loss: 0.8147, test_loss: 0.8084, test_f1: 0.5461
 epoch: 20, train_loss: 0.8081, test_loss: 1.4901, test_f1: 0.4630
 epoch: 21, train_loss: 0.8097, test_loss: 0.9099, test_f1: 0.5387
 epoch: 22, train_loss: 0.7831, test_loss: 0.8278, test_f1: 0.5887
 epoch: 23, train_loss: 0.7768, test_loss: 0.9507, test_f1: 0.5349
 epoch: 24, train_loss: 0.7852, test_loss: 1.0168, test_f1: 0.5487
 epoch: 25, train_loss: 0.7514, test_loss: 0.7882, test_f1: 0.5761
 epoch: 26, train_loss: 0.7580, test_loss: 0.8319, test_f1: 0.5678
 epoch: 27, train_loss: 0.7509, test_loss: 0.8778, test_f1: 0.5453
 epoch: 28, train_loss: 0.7447, test_loss: 0.8801, test_f1: 0.5131
 epoch: 29, train_loss: 0.7209, test_loss: 0.7349, test_f1: 0.6475
 epoch: 30, train_loss: 0.7392, test_loss: 0.8125, test_f1: 0.5594
 epoch: 31, train_loss: 0.7507, test_loss: 0.9308, test_f1: 0.5510
 epoch: 32, train_loss: 0.7107, test_loss: 0.8486, test_f1: 0.5621
 epoch: 33, train_loss: 0.7133, test_loss: 0.9818, test_f1: 0.5816
 epoch: 34, train_loss: 0.7351, test_loss: 0.9002, test_f1: 0.6093
 epoch: 35, train_loss: 0.7209, test_loss: 0.9631, test_f1: 0.5485
 epoch: 36, train_loss: 0.7161, test_loss: 0.8219, test_f1: 0.6457
 epoch: 37, train_loss: 0.7028, test_loss: 0.8106, test_f1: 0.6126
 epoch: 38, train_loss: 0.6982, test_loss: 0.7749, test_f1: 0.5566
 epoch: 39, train_loss: 0.6946, test_loss: 1.0250, test_f1: 0.5691
 epoch: 40, train_loss: 0.6908, test_loss: 0.7248, test_f1: 0.6424
 epoch: 41, train_loss: 0.6947, test_loss: 0.7697, test_f1: 0.6342
 epoch: 42, train_loss: 0.6782, test_loss: 0.8622, test_f1: 0.5667
 epoch: 43, train_loss: 0.6756, test_loss: 0.7311, test_f1: 0.6328
 epoch: 44, train_loss: 0.6935, test_loss: 0.8182, test_f1: 0.6351
 epoch: 45, train_loss: 0.6642, test_loss: 0.8212, test_f1: 0.6158
 epoch: 46, train_loss: 0.6667, test_loss: 0.7504, test_f1: 0.6311
 epoch: 47, train_loss: 0.6934, test_loss: 0.7844, test_f1: 0.6193
 epoch: 48, train_loss: 0.6522, test_loss: 0.8001, test_f1: 0.6253
 epoch: 49, train_loss: 0.6482, test_loss: 0.8674, test_f1: 0.5821
 epoch: 50, train_loss: 0.6518, test_loss: 0.8768, test_f1: 0.6579
 epoch: 51, train_loss: 0.6123, test_loss: 0.8226, test_f1: 0.6167
 epoch: 52, train_loss: 0.6017, test_loss: 0.9484, test_f1: 0.6124
 epoch: 53, train_loss: 0.5932, test_loss: 0.8502, test_f1: 0.6215
 epoch: 54, train_loss: 0.5965, test_loss: 0.7722, test_f1: 0.6375
 epoch: 55, train_loss: 0.5901, test_loss: 1.0129, test_f1: 0.6434
 epoch: 56, train_loss: 0.5871, test_loss: 1.1458, test_f1: 0.6234
 epoch: 57, train_loss: 0.5723, test_loss: 0.9682, test_f1: 0.6305
 epoch: 58, train_loss: 0.5817, test_loss: 0.8390, test_f1: 0.6407
 epoch: 59, train_loss: 0.5520, test_loss: 0.7902, test_f1: 0.6505
 epoch: 60, train_loss: 0.5646, test_loss: 0.8123, test_f1: 0.6622
 epoch: 61, train_loss: 0.5461, test_loss: 1.2464, test_f1: 0.6054
 epoch: 62, train_loss: 0.5380, test_loss: 0.9721, test_f1: 0.6675
 epoch: 63, train_loss: 0.5769, test_loss: 1.2141, test_f1: 0.6155
 epoch: 64, train_loss: 0.5637, test_loss: 0.9438, test_f1: 0.5967
 epoch: 65, train_loss: 0.5582, test_loss: 0.7872, test_f1: 0.6406
 epoch: 66, train_loss: 0.5330, test_loss: 0.8729, test_f1: 0.6761
 epoch: 67, train_loss: 0.5364, test_loss: 0.8207, test_f1: 0.6402
 epoch: 68, train_loss: 0.5461, test_loss: 0.9230, test_f1: 0.6537
 epoch: 69, train_loss: 0.5277, test_loss: 0.8779, test_f1: 0.6551
 epoch: 70, train_loss: 0.5290, test_loss: 0.9560, test_f1: 0.6270
 epoch: 71, train_loss: 0.5396, test_loss: 0.9085, test_f1: 0.6434
 epoch: 72, train_loss: 0.5095, test_loss: 1.3145, test_f1: 0.6043
 epoch: 73, train_loss: 0.5348, test_loss: 0.9170, test_f1: 0.6582
 epoch: 74, train_loss: 0.5266, test_loss: 0.7706, test_f1: 0.6679
 epoch: 75, train_loss: 0.5344, test_loss: 1.0737, test_f1: 0.6418
 epoch: 76, train_loss: 0.5250, test_loss: 0.8132, test_f1: 0.6631
 epoch: 77, train_loss: 0.5039, test_loss: 0.8574, test_f1: 0.6555
 epoch: 78, train_loss: 0.4986, test_loss: 0.9439, test_f1: 0.6607
 epoch: 79, train_loss: 0.4923, test_loss: 0.9908, test_f1: 0.6280
 epoch: 80, train_loss: 0.4852, test_loss: 0.8210, test_f1: 0.6496
 epoch: 81, train_loss: 0.4995, test_loss: 0.8985, test_f1: 0.6370
 epoch: 82, train_loss: 0.5051, test_loss: 0.8994, test_f1: 0.6332
 epoch: 83, train_loss: 0.5015, test_loss: 1.0500, test_f1: 0.6366
 epoch: 84, train_loss: 0.4847, test_loss: 0.9049, test_f1: 0.6348
 epoch: 85, train_loss: 0.4704, test_loss: 0.8940, test_f1: 0.6346
 epoch: 86, train_loss: 0.4974, test_loss: 0.9077, test_f1: 0.6524
 epoch: 87, train_loss: 0.4944, test_loss: 0.9323, test_f1: 0.6638
 epoch: 88, train_loss: 0.4855, test_loss: 1.0500, test_f1: 0.6484
 epoch: 89, train_loss: 0.4775, test_loss: 0.9892, test_f1: 0.6315
 epoch: 90, train_loss: 0.4839, test_loss: 1.0155, test_f1: 0.6570
 epoch: 91, train_loss: 0.4534, test_loss: 0.9631, test_f1: 0.6555
 epoch: 92, train_loss: 0.4923, test_loss: 0.8154, test_f1: 0.6705
 epoch: 93, train_loss: 0.4700, test_loss: 0.9318, test_f1: 0.6409
 epoch: 94, train_loss: 0.4871, test_loss: 1.0558, test_f1: 0.6610
 epoch: 95, train_loss: 0.4625, test_loss: 0.8876, test_f1: 0.6701
 epoch: 96, train_loss: 0.4829, test_loss: 0.8730, test_f1: 0.6567
 epoch: 97, train_loss: 0.4700, test_loss: 0.9749, test_f1: 0.6366
 epoch: 98, train_loss: 0.4540, test_loss: 0.9286, test_f1: 0.6681
 epoch: 99, train_loss: 0.4607, test_loss: 0.8796, test_f1: 0.6550
##################ITERATION #1 ****************************************
 epoch: 0, train_loss: 1.1529, test_loss: 1.1863, test_f1: 0.3173
 epoch: 1, train_loss: 1.0278, test_loss: 0.9912, test_f1: 0.4229
 epoch: 2, train_loss: 0.9741, test_loss: 0.9817, test_f1: 0.5194
 epoch: 3, train_loss: 0.9326, test_loss: 1.0512, test_f1: 0.4832
 epoch: 4, train_loss: 0.9214, test_loss: 0.9048, test_f1: 0.5068
 epoch: 5, train_loss: 0.9104, test_loss: 0.8441, test_f1: 0.5422
 epoch: 6, train_loss: 0.8751, test_loss: 0.8534, test_f1: 0.5408
 epoch: 7, train_loss: 0.8635, test_loss: 0.8776, test_f1: 0.5129
 epoch: 8, train_loss: 0.8687, test_loss: 0.9603, test_f1: 0.5217
 epoch: 9, train_loss: 0.8427, test_loss: 0.9278, test_f1: 0.5188
 epoch: 10, train_loss: 0.8576, test_loss: 0.9737, test_f1: 0.5267
 epoch: 11, train_loss: 0.8381, test_loss: 0.8989, test_f1: 0.4774
 epoch: 12, train_loss: 0.8168, test_loss: 0.9967, test_f1: 0.4931
 epoch: 13, train_loss: 0.8198, test_loss: 0.9859, test_f1: 0.5012
 epoch: 14, train_loss: 0.8242, test_loss: 0.9191, test_f1: 0.5166
 epoch: 15, train_loss: 0.8123, test_loss: 0.8978, test_f1: 0.5315
 epoch: 16, train_loss: 0.7953, test_loss: 1.0505, test_f1: 0.4789
 epoch: 17, train_loss: 0.8032, test_loss: 0.9381, test_f1: 0.5531
 epoch: 18, train_loss: 0.7836, test_loss: 0.9046, test_f1: 0.4942
 epoch: 19, train_loss: 0.7835, test_loss: 0.9348, test_f1: 0.5602
 epoch: 20, train_loss: 0.7592, test_loss: 0.8634, test_f1: 0.5816
 epoch: 21, train_loss: 0.7922, test_loss: 0.8668, test_f1: 0.6126
 epoch: 22, train_loss: 0.7704, test_loss: 0.8374, test_f1: 0.6408
 epoch: 23, train_loss: 0.7564, test_loss: 0.9527, test_f1: 0.5615
 epoch: 24, train_loss: 0.7501, test_loss: 0.9517, test_f1: 0.5798
 epoch: 25, train_loss: 0.7673, test_loss: 0.9634, test_f1: 0.5448
 epoch: 26, train_loss: 0.7476, test_loss: 0.8829, test_f1: 0.5696
 epoch: 27, train_loss: 0.7434, test_loss: 0.8516, test_f1: 0.5495
 epoch: 28, train_loss: 0.7352, test_loss: 0.9099, test_f1: 0.5792
 epoch: 29, train_loss: 0.7371, test_loss: 1.2196, test_f1: 0.4248
 epoch: 30, train_loss: 0.7472, test_loss: 0.9372, test_f1: 0.5648
 epoch: 31, train_loss: 0.7270, test_loss: 0.9236, test_f1: 0.5461
 epoch: 32, train_loss: 0.7385, test_loss: 0.8121, test_f1: 0.5808
 epoch: 33, train_loss: 0.7127, test_loss: 0.9201, test_f1: 0.5458
 epoch: 34, train_loss: 0.7043, test_loss: 0.9268, test_f1: 0.5682
 epoch: 35, train_loss: 0.7292, test_loss: 1.0372, test_f1: 0.5449
 epoch: 36, train_loss: 0.7157, test_loss: 0.8661, test_f1: 0.5883
 epoch: 37, train_loss: 0.6978, test_loss: 0.9455, test_f1: 0.5922
 epoch: 38, train_loss: 0.6994, test_loss: 0.9967, test_f1: 0.6091
 epoch: 39, train_loss: 0.7124, test_loss: 0.9558, test_f1: 0.6014
 epoch: 40, train_loss: 0.7093, test_loss: 1.0006, test_f1: 0.5736
 epoch: 41, train_loss: 0.6815, test_loss: 1.0916, test_f1: 0.5289
 epoch: 42, train_loss: 0.6980, test_loss: 0.9667, test_f1: 0.6022
 epoch: 43, train_loss: 0.6898, test_loss: 0.9004, test_f1: 0.6325
 epoch: 44, train_loss: 0.6640, test_loss: 0.9047, test_f1: 0.6587
 epoch: 45, train_loss: 0.6928, test_loss: 0.8554, test_f1: 0.5866
 epoch: 46, train_loss: 0.6783, test_loss: 0.8771, test_f1: 0.5923
 epoch: 47, train_loss: 0.6612, test_loss: 1.0279, test_f1: 0.5507
 epoch: 48, train_loss: 0.6783, test_loss: 1.0251, test_f1: 0.5629
 epoch: 49, train_loss: 0.6974, test_loss: 1.0814, test_f1: 0.6073
 epoch: 50, train_loss: 0.6875, test_loss: 0.9304, test_f1: 0.6593
 epoch: 51, train_loss: 0.6349, test_loss: 1.0174, test_f1: 0.6148
 epoch: 52, train_loss: 0.6162, test_loss: 1.0363, test_f1: 0.6078
 epoch: 53, train_loss: 0.6006, test_loss: 0.9326, test_f1: 0.6030
 epoch: 54, train_loss: 0.5955, test_loss: 1.0082, test_f1: 0.6288
 epoch: 55, train_loss: 0.5981, test_loss: 1.0899, test_f1: 0.6439
 epoch: 56, train_loss: 0.5938, test_loss: 0.9707, test_f1: 0.6190
 epoch: 57, train_loss: 0.5905, test_loss: 1.1108, test_f1: 0.6449
 epoch: 58, train_loss: 0.5802, test_loss: 1.0848, test_f1: 0.6544
 epoch: 59, train_loss: 0.5735, test_loss: 1.1099, test_f1: 0.6333
 epoch: 60, train_loss: 0.5925, test_loss: 0.9435, test_f1: 0.6553
 epoch: 61, train_loss: 0.5651, test_loss: 1.0096, test_f1: 0.6487
 epoch: 62, train_loss: 0.5768, test_loss: 1.1098, test_f1: 0.6074
 epoch: 63, train_loss: 0.5612, test_loss: 1.0963, test_f1: 0.6354
 epoch: 64, train_loss: 0.5492, test_loss: 1.1424, test_f1: 0.6365
 epoch: 65, train_loss: 0.5580, test_loss: 1.0220, test_f1: 0.6500
 epoch: 66, train_loss: 0.5742, test_loss: 1.0533, test_f1: 0.6624
 epoch: 67, train_loss: 0.5411, test_loss: 1.1091, test_f1: 0.6296
 epoch: 68, train_loss: 0.5622, test_loss: 1.0311, test_f1: 0.6195
 epoch: 69, train_loss: 0.5484, test_loss: 1.0609, test_f1: 0.6453
 epoch: 70, train_loss: 0.5402, test_loss: 1.1079, test_f1: 0.6462
 epoch: 71, train_loss: 0.5313, test_loss: 1.1188, test_f1: 0.6638
 epoch: 72, train_loss: 0.5321, test_loss: 1.4073, test_f1: 0.5829
 epoch: 73, train_loss: 0.5336, test_loss: 1.0680, test_f1: 0.6638
 epoch: 74, train_loss: 0.5321, test_loss: 0.9800, test_f1: 0.6399
 epoch: 75, train_loss: 0.5221, test_loss: 1.3354, test_f1: 0.6256
 epoch: 76, train_loss: 0.5216, test_loss: 1.0185, test_f1: 0.6430
 epoch: 77, train_loss: 0.5233, test_loss: 1.0226, test_f1: 0.6635
 epoch: 78, train_loss: 0.5051, test_loss: 1.0372, test_f1: 0.6668
 epoch: 79, train_loss: 0.5325, test_loss: 1.1154, test_f1: 0.6772
 epoch: 80, train_loss: 0.5258, test_loss: 1.1441, test_f1: 0.6575
 epoch: 81, train_loss: 0.5247, test_loss: 1.0044, test_f1: 0.6727
 epoch: 82, train_loss: 0.5110, test_loss: 0.9085, test_f1: 0.6579
 epoch: 83, train_loss: 0.5107, test_loss: 1.1725, test_f1: 0.6239
 epoch: 84, train_loss: 0.5178, test_loss: 1.0904, test_f1: 0.6601
 epoch: 85, train_loss: 0.4918, test_loss: 1.0772, test_f1: 0.6818
 epoch: 86, train_loss: 0.4853, test_loss: 1.0718, test_f1: 0.6518
 epoch: 87, train_loss: 0.4908, test_loss: 0.9573, test_f1: 0.6706
 epoch: 88, train_loss: 0.5024, test_loss: 1.0938, test_f1: 0.6526
 epoch: 89, train_loss: 0.4918, test_loss: 1.1464, test_f1: 0.6825
 epoch: 90, train_loss: 0.4976, test_loss: 1.0651, test_f1: 0.6656
 epoch: 91, train_loss: 0.5016, test_loss: 1.0314, test_f1: 0.6754
 epoch: 92, train_loss: 0.4818, test_loss: 0.9994, test_f1: 0.6675
 epoch: 93, train_loss: 0.4647, test_loss: 1.1110, test_f1: 0.6750
 epoch: 94, train_loss: 0.4947, test_loss: 1.0258, test_f1: 0.6476
 epoch: 95, train_loss: 0.4757, test_loss: 1.1187, test_f1: 0.6646
 epoch: 96, train_loss: 0.4804, test_loss: 1.0852, test_f1: 0.6476
 epoch: 97, train_loss: 0.4981, test_loss: 0.9561, test_f1: 0.6700
 epoch: 98, train_loss: 0.4697, test_loss: 1.2303, test_f1: 0.6633
 epoch: 99, train_loss: 0.4727, test_loss: 0.9636, test_f1: 0.6628
##################ITERATION #2 ****************************************
 epoch: 0, train_loss: 1.1748, test_loss: 1.0111, test_f1: 0.4429
 epoch: 1, train_loss: 1.0080, test_loss: 1.0057, test_f1: 0.4496
 epoch: 2, train_loss: 0.9892, test_loss: 1.0061, test_f1: 0.4655
 epoch: 3, train_loss: 0.9635, test_loss: 1.0834, test_f1: 0.4377
 epoch: 4, train_loss: 0.9449, test_loss: 1.0206, test_f1: 0.4849
 epoch: 5, train_loss: 0.9190, test_loss: 1.5555, test_f1: 0.3169
 epoch: 6, train_loss: 0.9130, test_loss: 1.0050, test_f1: 0.4700
 epoch: 7, train_loss: 0.8754, test_loss: 0.9412, test_f1: 0.4901
 epoch: 8, train_loss: 0.8666, test_loss: 0.9350, test_f1: 0.4746
 epoch: 9, train_loss: 0.8647, test_loss: 0.9366, test_f1: 0.5357
 epoch: 10, train_loss: 0.8557, test_loss: 0.9001, test_f1: 0.4793
 epoch: 11, train_loss: 0.8421, test_loss: 0.8815, test_f1: 0.5210
 epoch: 12, train_loss: 0.8210, test_loss: 0.9303, test_f1: 0.5407
 epoch: 13, train_loss: 0.8082, test_loss: 0.9093, test_f1: 0.5190
 epoch: 14, train_loss: 0.7969, test_loss: 0.9874, test_f1: 0.4929
 epoch: 15, train_loss: 0.7783, test_loss: 0.9782, test_f1: 0.4921
 epoch: 16, train_loss: 0.7866, test_loss: 0.8155, test_f1: 0.5196
 epoch: 17, train_loss: 0.7674, test_loss: 1.0356, test_f1: 0.4779
 epoch: 18, train_loss: 0.7834, test_loss: 0.9362, test_f1: 0.5229
 epoch: 19, train_loss: 0.7709, test_loss: 0.8778, test_f1: 0.5363
 epoch: 20, train_loss: 0.7540, test_loss: 0.7720, test_f1: 0.5429
 epoch: 21, train_loss: 0.7562, test_loss: 0.9903, test_f1: 0.5023
 epoch: 22, train_loss: 0.7465, test_loss: 0.8225, test_f1: 0.6138
 epoch: 23, train_loss: 0.7433, test_loss: 1.0719, test_f1: 0.4858
 epoch: 24, train_loss: 0.7415, test_loss: 0.9864, test_f1: 0.5061
 epoch: 25, train_loss: 0.7289, test_loss: 0.9606, test_f1: 0.5002
 epoch: 26, train_loss: 0.7172, test_loss: 0.9513, test_f1: 0.6028
 epoch: 27, train_loss: 0.7146, test_loss: 0.8392, test_f1: 0.5594
 epoch: 28, train_loss: 0.6971, test_loss: 0.8327, test_f1: 0.5932
 epoch: 29, train_loss: 0.6906, test_loss: 0.8854, test_f1: 0.5536
 epoch: 30, train_loss: 0.6888, test_loss: 0.9184, test_f1: 0.5781
 epoch: 31, train_loss: 0.6870, test_loss: 0.9699, test_f1: 0.5271
 epoch: 32, train_loss: 0.6891, test_loss: 0.8779, test_f1: 0.5650
 epoch: 33, train_loss: 0.6779, test_loss: 1.3454, test_f1: 0.4695
 epoch: 34, train_loss: 0.6856, test_loss: 0.9144, test_f1: 0.5831
 epoch: 35, train_loss: 0.6597, test_loss: 0.9017, test_f1: 0.6358
 epoch: 36, train_loss: 0.6620, test_loss: 0.8418, test_f1: 0.5971
 epoch: 37, train_loss: 0.6495, test_loss: 0.9957, test_f1: 0.5801
 epoch: 38, train_loss: 0.6558, test_loss: 1.0582, test_f1: 0.6175
 epoch: 39, train_loss: 0.6564, test_loss: 1.0405, test_f1: 0.5863
 epoch: 40, train_loss: 0.6531, test_loss: 0.8845, test_f1: 0.5765
 epoch: 41, train_loss: 0.6433, test_loss: 0.8641, test_f1: 0.5517
 epoch: 42, train_loss: 0.6627, test_loss: 1.0263, test_f1: 0.5857
 epoch: 43, train_loss: 0.6353, test_loss: 0.9178, test_f1: 0.5493
 epoch: 44, train_loss: 0.6349, test_loss: 0.8782, test_f1: 0.5917
 epoch: 45, train_loss: 0.6812, test_loss: 0.9068, test_f1: 0.6111
 epoch: 46, train_loss: 0.6434, test_loss: 1.0316, test_f1: 0.5664
 epoch: 47, train_loss: 0.6256, test_loss: 1.0025, test_f1: 0.5923
 epoch: 48, train_loss: 0.6352, test_loss: 1.0493, test_f1: 0.5829
 epoch: 49, train_loss: 0.6159, test_loss: 0.8985, test_f1: 0.6074
 epoch: 50, train_loss: 0.6095, test_loss: 0.8423, test_f1: 0.5846
 epoch: 51, train_loss: 0.5851, test_loss: 0.9104, test_f1: 0.6469
 epoch: 52, train_loss: 0.5567, test_loss: 0.8491, test_f1: 0.6407
 epoch: 53, train_loss: 0.5356, test_loss: 0.9743, test_f1: 0.6185
 epoch: 54, train_loss: 0.5433, test_loss: 1.0310, test_f1: 0.6018
 epoch: 55, train_loss: 0.5395, test_loss: 0.9194, test_f1: 0.6050
 epoch: 56, train_loss: 0.5234, test_loss: 1.0640, test_f1: 0.6060
 epoch: 57, train_loss: 0.5238, test_loss: 0.9699, test_f1: 0.6156
 epoch: 58, train_loss: 0.5399, test_loss: 0.9107, test_f1: 0.6160
 epoch: 59, train_loss: 0.5369, test_loss: 0.9077, test_f1: 0.6310
 epoch: 60, train_loss: 0.5134, test_loss: 0.8309, test_f1: 0.6559
 epoch: 61, train_loss: 0.5154, test_loss: 1.0627, test_f1: 0.6132
 epoch: 62, train_loss: 0.5080, test_loss: 0.9988, test_f1: 0.6336
 epoch: 63, train_loss: 0.5134, test_loss: 0.9026, test_f1: 0.6361
 epoch: 64, train_loss: 0.4942, test_loss: 1.0002, test_f1: 0.6435
 epoch: 65, train_loss: 0.5127, test_loss: 0.8371, test_f1: 0.6546
 epoch: 66, train_loss: 0.4985, test_loss: 0.9485, test_f1: 0.6392
 epoch: 67, train_loss: 0.5138, test_loss: 0.9926, test_f1: 0.6504
 epoch: 68, train_loss: 0.4874, test_loss: 1.0351, test_f1: 0.6271
 epoch: 69, train_loss: 0.4917, test_loss: 0.8923, test_f1: 0.6355
 epoch: 70, train_loss: 0.4669, test_loss: 0.9669, test_f1: 0.6287
 epoch: 71, train_loss: 0.4935, test_loss: 0.9660, test_f1: 0.6361
 epoch: 72, train_loss: 0.4856, test_loss: 0.9357, test_f1: 0.6260
 epoch: 73, train_loss: 0.4837, test_loss: 1.0138, test_f1: 0.6179
 epoch: 74, train_loss: 0.4782, test_loss: 1.0846, test_f1: 0.6502
 epoch: 75, train_loss: 0.4708, test_loss: 1.1012, test_f1: 0.6245
 epoch: 76, train_loss: 0.4801, test_loss: 0.9913, test_f1: 0.6465
 epoch: 77, train_loss: 0.4785, test_loss: 1.0306, test_f1: 0.6296
 epoch: 78, train_loss: 0.4742, test_loss: 1.0282, test_f1: 0.6053
 epoch: 79, train_loss: 0.4762, test_loss: 1.0427, test_f1: 0.6157
 epoch: 80, train_loss: 0.4653, test_loss: 1.0237, test_f1: 0.6241
 epoch: 81, train_loss: 0.4821, test_loss: 1.0628, test_f1: 0.6230
 epoch: 82, train_loss: 0.4509, test_loss: 1.0267, test_f1: 0.6027
 epoch: 83, train_loss: 0.4481, test_loss: 1.1433, test_f1: 0.5917
 epoch: 84, train_loss: 0.4608, test_loss: 0.9642, test_f1: 0.6583
 epoch: 85, train_loss: 0.4608, test_loss: 1.1241, test_f1: 0.6332
 epoch: 86, train_loss: 0.4595, test_loss: 1.0257, test_f1: 0.6482
 epoch: 87, train_loss: 0.4649, test_loss: 1.0033, test_f1: 0.6320
 epoch: 88, train_loss: 0.4362, test_loss: 0.9809, test_f1: 0.6734
 epoch: 89, train_loss: 0.4432, test_loss: 0.9992, test_f1: 0.6188
 epoch: 90, train_loss: 0.4458, test_loss: 1.0335, test_f1: 0.6301
 epoch: 91, train_loss: 0.4369, test_loss: 1.2480, test_f1: 0.6399
 epoch: 92, train_loss: 0.4306, test_loss: 1.0466, test_f1: 0.6641
 epoch: 93, train_loss: 0.4517, test_loss: 1.0732, test_f1: 0.6508
 epoch: 94, train_loss: 0.4370, test_loss: 0.8584, test_f1: 0.6710
 epoch: 95, train_loss: 0.4345, test_loss: 1.0588, test_f1: 0.6477
 epoch: 96, train_loss: 0.4191, test_loss: 1.0744, test_f1: 0.6136
 epoch: 97, train_loss: 0.4414, test_loss: 1.0348, test_f1: 0.6238
 epoch: 98, train_loss: 0.4272, test_loss: 0.9879, test_f1: 0.6527
 epoch: 99, train_loss: 0.4237, test_loss: 1.1097, test_f1: 0.6529
##################ITERATION #3 ****************************************
 epoch: 0, train_loss: 1.1340, test_loss: 1.2915, test_f1: 0.4173
 epoch: 1, train_loss: 1.0400, test_loss: 1.1542, test_f1: 0.4480
 epoch: 2, train_loss: 0.9870, test_loss: 1.0536, test_f1: 0.4892
 epoch: 3, train_loss: 0.9680, test_loss: 1.1749, test_f1: 0.4496
 epoch: 4, train_loss: 0.9374, test_loss: 0.9200, test_f1: 0.4823
 epoch: 5, train_loss: 0.9312, test_loss: 1.0245, test_f1: 0.4911
 epoch: 6, train_loss: 0.9034, test_loss: 0.9615, test_f1: 0.5064
 epoch: 7, train_loss: 0.9011, test_loss: 0.9865, test_f1: 0.4809
 epoch: 8, train_loss: 0.8839, test_loss: 1.0505, test_f1: 0.4987
 epoch: 9, train_loss: 0.8556, test_loss: 0.8684, test_f1: 0.5254
 epoch: 10, train_loss: 0.8501, test_loss: 1.0546, test_f1: 0.4686
 epoch: 11, train_loss: 0.8684, test_loss: 0.8969, test_f1: 0.5346
 epoch: 12, train_loss: 0.8537, test_loss: 0.8904, test_f1: 0.5501
 epoch: 13, train_loss: 0.8261, test_loss: 0.9630, test_f1: 0.5195
 epoch: 14, train_loss: 0.8085, test_loss: 0.9911, test_f1: 0.5215
 epoch: 15, train_loss: 0.8028, test_loss: 1.0991, test_f1: 0.4831
 epoch: 16, train_loss: 0.8164, test_loss: 1.0618, test_f1: 0.5225
 epoch: 17, train_loss: 0.7991, test_loss: 1.0431, test_f1: 0.5523
 epoch: 18, train_loss: 0.7780, test_loss: 1.0902, test_f1: 0.4803
 epoch: 19, train_loss: 0.7700, test_loss: 0.8743, test_f1: 0.5233
 epoch: 20, train_loss: 0.7940, test_loss: 0.9674, test_f1: 0.5906
 epoch: 21, train_loss: 0.7867, test_loss: 0.9553, test_f1: 0.5313
 epoch: 22, train_loss: 0.7753, test_loss: 1.0022, test_f1: 0.5324
 epoch: 23, train_loss: 0.7855, test_loss: 0.9083, test_f1: 0.5634
 epoch: 24, train_loss: 0.7377, test_loss: 0.9475, test_f1: 0.5460
 epoch: 25, train_loss: 0.7531, test_loss: 0.9688, test_f1: 0.5600
 epoch: 26, train_loss: 0.7434, test_loss: 0.9471, test_f1: 0.6293
 epoch: 27, train_loss: 0.7525, test_loss: 0.9113, test_f1: 0.6254
 epoch: 28, train_loss: 0.7358, test_loss: 0.9367, test_f1: 0.5976
 epoch: 29, train_loss: 0.7299, test_loss: 0.9266, test_f1: 0.5411
 epoch: 30, train_loss: 0.7154, test_loss: 1.0660, test_f1: 0.5958
 epoch: 31, train_loss: 0.7052, test_loss: 1.0727, test_f1: 0.6157
 epoch: 32, train_loss: 0.6938, test_loss: 1.0586, test_f1: 0.6194
 epoch: 33, train_loss: 0.6970, test_loss: 1.0994, test_f1: 0.6395
 epoch: 34, train_loss: 0.7179, test_loss: 1.0537, test_f1: 0.5465
 epoch: 35, train_loss: 0.6862, test_loss: 1.0466, test_f1: 0.5629
 epoch: 36, train_loss: 0.6862, test_loss: 0.9736, test_f1: 0.6285
 epoch: 37, train_loss: 0.6991, test_loss: 0.8833, test_f1: 0.6230
 epoch: 38, train_loss: 0.6717, test_loss: 1.0366, test_f1: 0.5749
 epoch: 39, train_loss: 0.6692, test_loss: 0.9928, test_f1: 0.5987
 epoch: 40, train_loss: 0.6644, test_loss: 0.9901, test_f1: 0.6449
 epoch: 41, train_loss: 0.6433, test_loss: 0.9980, test_f1: 0.6111
 epoch: 42, train_loss: 0.6652, test_loss: 0.9704, test_f1: 0.6420
 epoch: 43, train_loss: 0.6629, test_loss: 1.0528, test_f1: 0.6191
 epoch: 44, train_loss: 0.6566, test_loss: 0.8314, test_f1: 0.6215
 epoch: 45, train_loss: 0.6253, test_loss: 1.1361, test_f1: 0.6183
 epoch: 46, train_loss: 0.6336, test_loss: 1.3310, test_f1: 0.5952
 epoch: 47, train_loss: 0.6248, test_loss: 1.2241, test_f1: 0.6336
 epoch: 48, train_loss: 0.6483, test_loss: 1.2219, test_f1: 0.6090
 epoch: 49, train_loss: 0.6405, test_loss: 1.2298, test_f1: 0.6559
 epoch: 50, train_loss: 0.6326, test_loss: 1.2236, test_f1: 0.6342
 epoch: 51, train_loss: 0.5897, test_loss: 1.1105, test_f1: 0.6230
 epoch: 52, train_loss: 0.5856, test_loss: 1.1721, test_f1: 0.6545
 epoch: 53, train_loss: 0.5678, test_loss: 1.0962, test_f1: 0.6489
 epoch: 54, train_loss: 0.5493, test_loss: 1.1998, test_f1: 0.6183
 epoch: 55, train_loss: 0.5583, test_loss: 1.1420, test_f1: 0.6659
 epoch: 56, train_loss: 0.5396, test_loss: 1.3329, test_f1: 0.6420
 epoch: 57, train_loss: 0.5496, test_loss: 1.1485, test_f1: 0.6595
 epoch: 58, train_loss: 0.5286, test_loss: 1.1595, test_f1: 0.6459
 epoch: 59, train_loss: 0.5371, test_loss: 1.2625, test_f1: 0.6196
 epoch: 60, train_loss: 0.5186, test_loss: 1.1654, test_f1: 0.6162
 epoch: 61, train_loss: 0.5449, test_loss: 1.4876, test_f1: 0.6179
 epoch: 62, train_loss: 0.5219, test_loss: 1.2885, test_f1: 0.6464
 epoch: 63, train_loss: 0.5185, test_loss: 1.3968, test_f1: 0.6417
 epoch: 64, train_loss: 0.5044, test_loss: 1.1969, test_f1: 0.6399
 epoch: 65, train_loss: 0.4810, test_loss: 1.1656, test_f1: 0.6498
 epoch: 66, train_loss: 0.5192, test_loss: 1.1038, test_f1: 0.6524
 epoch: 67, train_loss: 0.5038, test_loss: 1.1874, test_f1: 0.6537
 epoch: 68, train_loss: 0.5059, test_loss: 1.2752, test_f1: 0.6355
 epoch: 69, train_loss: 0.4919, test_loss: 1.2356, test_f1: 0.6359
 epoch: 70, train_loss: 0.4849, test_loss: 1.2642, test_f1: 0.6491
 epoch: 71, train_loss: 0.4845, test_loss: 1.2350, test_f1: 0.6321
 epoch: 72, train_loss: 0.4881, test_loss: 1.3169, test_f1: 0.6577
 epoch: 73, train_loss: 0.4647, test_loss: 1.3755, test_f1: 0.6484
 epoch: 74, train_loss: 0.4823, test_loss: 1.3066, test_f1: 0.6522
 epoch: 75, train_loss: 0.5003, test_loss: 1.3105, test_f1: 0.6555
 epoch: 76, train_loss: 0.4771, test_loss: 1.3219, test_f1: 0.6595
 epoch: 77, train_loss: 0.4687, test_loss: 1.2448, test_f1: 0.6279
 epoch: 78, train_loss: 0.4540, test_loss: 1.2425, test_f1: 0.6661
 epoch: 79, train_loss: 0.4831, test_loss: 1.3146, test_f1: 0.6507
 epoch: 80, train_loss: 0.4755, test_loss: 1.1921, test_f1: 0.6436
 epoch: 81, train_loss: 0.4595, test_loss: 1.3836, test_f1: 0.6483
 epoch: 82, train_loss: 0.4649, test_loss: 1.2425, test_f1: 0.6535
 epoch: 83, train_loss: 0.4424, test_loss: 1.4910, test_f1: 0.6198
 epoch: 84, train_loss: 0.4711, test_loss: 1.4110, test_f1: 0.6296
 epoch: 85, train_loss: 0.4522, test_loss: 1.3407, test_f1: 0.6588
 epoch: 86, train_loss: 0.4848, test_loss: 1.6033, test_f1: 0.5823
 epoch: 87, train_loss: 0.4686, test_loss: 1.1782, test_f1: 0.6565
 epoch: 88, train_loss: 0.4559, test_loss: 1.3844, test_f1: 0.6674
 epoch: 89, train_loss: 0.4383, test_loss: 1.2469, test_f1: 0.6748
 epoch: 90, train_loss: 0.4394, test_loss: 1.4317, test_f1: 0.6399
 epoch: 91, train_loss: 0.4409, test_loss: 1.0589, test_f1: 0.6693
 epoch: 92, train_loss: 0.4548, test_loss: 1.3259, test_f1: 0.6568
 epoch: 93, train_loss: 0.4414, test_loss: 1.3752, test_f1: 0.6811
 epoch: 94, train_loss: 0.4309, test_loss: 1.4018, test_f1: 0.6489
 epoch: 95, train_loss: 0.4267, test_loss: 1.3617, test_f1: 0.6635
 epoch: 96, train_loss: 0.4373, test_loss: 1.3378, test_f1: 0.6777
 epoch: 97, train_loss: 0.4498, test_loss: 1.3130, test_f1: 0.6767
 epoch: 98, train_loss: 0.4244, test_loss: 1.3399, test_f1: 0.6490
 epoch: 99, train_loss: 0.4612, test_loss: 1.1513, test_f1: 0.6684
##################ITERATION #4 ****************************************
 epoch: 0, train_loss: 1.1746, test_loss: 1.4859, test_f1: 0.2811
 epoch: 1, train_loss: 1.0246, test_loss: 1.0140, test_f1: 0.4688
 epoch: 2, train_loss: 0.9996, test_loss: 1.0119, test_f1: 0.4764
 epoch: 3, train_loss: 0.9845, test_loss: 1.0932, test_f1: 0.4554
 epoch: 4, train_loss: 0.9679, test_loss: 1.0750, test_f1: 0.4828
 epoch: 5, train_loss: 0.9507, test_loss: 1.0257, test_f1: 0.4338
 epoch: 6, train_loss: 0.9137, test_loss: 0.9543, test_f1: 0.4909
 epoch: 7, train_loss: 0.9105, test_loss: 1.0002, test_f1: 0.5370
 epoch: 8, train_loss: 0.8909, test_loss: 0.9429, test_f1: 0.4762
 epoch: 9, train_loss: 0.8749, test_loss: 0.9736, test_f1: 0.5066
 epoch: 10, train_loss: 0.8718, test_loss: 1.0170, test_f1: 0.5403
 epoch: 11, train_loss: 0.8669, test_loss: 0.9298, test_f1: 0.5538
 epoch: 12, train_loss: 0.8420, test_loss: 0.9485, test_f1: 0.5490
 epoch: 13, train_loss: 0.8223, test_loss: 0.9658, test_f1: 0.5601
 epoch: 14, train_loss: 0.8210, test_loss: 1.0673, test_f1: 0.5137
 epoch: 15, train_loss: 0.8204, test_loss: 0.9517, test_f1: 0.5318
 epoch: 16, train_loss: 0.8191, test_loss: 0.9243, test_f1: 0.5353
 epoch: 17, train_loss: 0.7896, test_loss: 1.0135, test_f1: 0.5677
 epoch: 18, train_loss: 0.8088, test_loss: 1.1284, test_f1: 0.5779
 epoch: 19, train_loss: 0.7978, test_loss: 0.9166, test_f1: 0.5436
 epoch: 20, train_loss: 0.7767, test_loss: 0.9082, test_f1: 0.5483
 epoch: 21, train_loss: 0.7811, test_loss: 1.0618, test_f1: 0.5243
 epoch: 22, train_loss: 0.7827, test_loss: 1.0069, test_f1: 0.5432
 epoch: 23, train_loss: 0.8181, test_loss: 0.9353, test_f1: 0.5442
 epoch: 24, train_loss: 0.7796, test_loss: 1.1123, test_f1: 0.5764
 epoch: 25, train_loss: 0.8037, test_loss: 0.8477, test_f1: 0.6399
 epoch: 26, train_loss: 0.7710, test_loss: 0.9494, test_f1: 0.5874
 epoch: 27, train_loss: 0.7780, test_loss: 1.2750, test_f1: 0.4726
 epoch: 28, train_loss: 0.7552, test_loss: 0.9563, test_f1: 0.5457
 epoch: 29, train_loss: 0.7382, test_loss: 0.9969, test_f1: 0.5586
 epoch: 30, train_loss: 0.7305, test_loss: 0.9619, test_f1: 0.5451
 epoch: 31, train_loss: 0.7149, test_loss: 1.1755, test_f1: 0.5374
 epoch: 32, train_loss: 0.7216, test_loss: 0.9491, test_f1: 0.6086
 epoch: 33, train_loss: 0.7119, test_loss: 0.9419, test_f1: 0.6129
 epoch: 34, train_loss: 0.7162, test_loss: 1.0353, test_f1: 0.5552
 epoch: 35, train_loss: 0.7193, test_loss: 0.9403, test_f1: 0.5634
 epoch: 36, train_loss: 0.7105, test_loss: 0.9879, test_f1: 0.5571
 epoch: 37, train_loss: 0.7048, test_loss: 0.8982, test_f1: 0.5542
 epoch: 38, train_loss: 0.7068, test_loss: 1.0678, test_f1: 0.5168
 epoch: 39, train_loss: 0.6966, test_loss: 1.1287, test_f1: 0.6332
 epoch: 40, train_loss: 0.6802, test_loss: 1.0272, test_f1: 0.5456
 epoch: 41, train_loss: 0.7023, test_loss: 1.0615, test_f1: 0.5593
 epoch: 42, train_loss: 0.6972, test_loss: 0.8671, test_f1: 0.6298
 epoch: 43, train_loss: 0.6692, test_loss: 1.0956, test_f1: 0.5430
 epoch: 44, train_loss: 0.6796, test_loss: 1.0287, test_f1: 0.6060
 epoch: 45, train_loss: 0.6473, test_loss: 1.2814, test_f1: 0.6180
 epoch: 46, train_loss: 0.6535, test_loss: 1.1638, test_f1: 0.5953
 epoch: 47, train_loss: 0.6441, test_loss: 1.1823, test_f1: 0.5827
 epoch: 48, train_loss: 0.6723, test_loss: 0.9336, test_f1: 0.6536
 epoch: 49, train_loss: 0.6462, test_loss: 1.0665, test_f1: 0.5485
 epoch: 50, train_loss: 0.6548, test_loss: 1.0210, test_f1: 0.5375
 epoch: 51, train_loss: 0.5900, test_loss: 0.9676, test_f1: 0.6419
 epoch: 52, train_loss: 0.5928, test_loss: 1.0646, test_f1: 0.6402
 epoch: 53, train_loss: 0.5757, test_loss: 1.0202, test_f1: 0.6710
 epoch: 54, train_loss: 0.5831, test_loss: 1.0577, test_f1: 0.5866
 epoch: 55, train_loss: 0.5422, test_loss: 0.9831, test_f1: 0.6442
 epoch: 56, train_loss: 0.5557, test_loss: 1.0461, test_f1: 0.6563
 epoch: 57, train_loss: 0.5673, test_loss: 0.9878, test_f1: 0.6357
 epoch: 58, train_loss: 0.5609, test_loss: 1.0467, test_f1: 0.6422
 epoch: 59, train_loss: 0.5400, test_loss: 1.0850, test_f1: 0.6206
 epoch: 60, train_loss: 0.5312, test_loss: 1.0780, test_f1: 0.6592
 epoch: 61, train_loss: 0.5129, test_loss: 1.0973, test_f1: 0.6674
 epoch: 62, train_loss: 0.5348, test_loss: 1.2245, test_f1: 0.6300
 epoch: 63, train_loss: 0.5484, test_loss: 1.0737, test_f1: 0.6541
 epoch: 64, train_loss: 0.5144, test_loss: 1.1325, test_f1: 0.6430
 epoch: 65, train_loss: 0.5359, test_loss: 1.0911, test_f1: 0.6753
 epoch: 66, train_loss: 0.5201, test_loss: 0.8950, test_f1: 0.6586
 epoch: 67, train_loss: 0.4992, test_loss: 1.1706, test_f1: 0.6490
 epoch: 68, train_loss: 0.5065, test_loss: 1.0616, test_f1: 0.6363
 epoch: 69, train_loss: 0.5063, test_loss: 0.9443, test_f1: 0.6744
 epoch: 70, train_loss: 0.5019, test_loss: 1.1307, test_f1: 0.6661
 epoch: 71, train_loss: 0.5143, test_loss: 1.0688, test_f1: 0.6626
 epoch: 72, train_loss: 0.5027, test_loss: 0.9440, test_f1: 0.6539
 epoch: 73, train_loss: 0.5201, test_loss: 1.0979, test_f1: 0.6487
 epoch: 74, train_loss: 0.4946, test_loss: 0.9577, test_f1: 0.6639
 epoch: 75, train_loss: 0.4980, test_loss: 1.0743, test_f1: 0.6546
 epoch: 76, train_loss: 0.4828, test_loss: 0.9006, test_f1: 0.6139
 epoch: 77, train_loss: 0.4808, test_loss: 1.1181, test_f1: 0.6520
 epoch: 78, train_loss: 0.4851, test_loss: 1.0643, test_f1: 0.6459
 epoch: 79, train_loss: 0.4842, test_loss: 0.9541, test_f1: 0.6591
 epoch: 80, train_loss: 0.4766, test_loss: 1.1431, test_f1: 0.6468
 epoch: 81, train_loss: 0.4972, test_loss: 1.1450, test_f1: 0.6488
 epoch: 82, train_loss: 0.4836, test_loss: 1.0016, test_f1: 0.6716
 epoch: 83, train_loss: 0.4584, test_loss: 0.9708, test_f1: 0.6691
 epoch: 84, train_loss: 0.4719, test_loss: 0.9659, test_f1: 0.6489
 epoch: 85, train_loss: 0.4829, test_loss: 1.2401, test_f1: 0.6706
 epoch: 86, train_loss: 0.4671, test_loss: 1.0269, test_f1: 0.6363
 epoch: 87, train_loss: 0.4559, test_loss: 1.0529, test_f1: 0.6382
 epoch: 88, train_loss: 0.4513, test_loss: 1.0529, test_f1: 0.6683
 epoch: 89, train_loss: 0.4490, test_loss: 1.1775, test_f1: 0.6532
 epoch: 90, train_loss: 0.4375, test_loss: 1.2141, test_f1: 0.6700
 epoch: 91, train_loss: 0.4467, test_loss: 1.0846, test_f1: 0.6329
 epoch: 92, train_loss: 0.4403, test_loss: 1.0578, test_f1: 0.6593
 epoch: 93, train_loss: 0.4428, test_loss: 1.2570, test_f1: 0.6777
 epoch: 94, train_loss: 0.4303, test_loss: 1.1284, test_f1: 0.6585
 epoch: 95, train_loss: 0.4495, test_loss: 1.1815, test_f1: 0.6815
 epoch: 96, train_loss: 0.4259, test_loss: 0.9454, test_f1: 0.6594
 epoch: 97, train_loss: 0.4413, test_loss: 1.0180, test_f1: 0.6397
 epoch: 98, train_loss: 0.4540, test_loss: 1.3419, test_f1: 0.6583
 epoch: 99, train_loss: 0.4545, test_loss: 1.1465, test_f1: 0.6258
##################ITERATION #5 ****************************************
 epoch: 0, train_loss: 1.1755, test_loss: 1.0702, test_f1: 0.4122
 epoch: 1, train_loss: 1.0337, test_loss: 1.0394, test_f1: 0.4741
 epoch: 2, train_loss: 1.0003, test_loss: 0.9986, test_f1: 0.4612
 epoch: 3, train_loss: 0.9671, test_loss: 1.0236, test_f1: 0.4414
 epoch: 4, train_loss: 0.9509, test_loss: 0.9785, test_f1: 0.4973
 epoch: 5, train_loss: 0.9018, test_loss: 0.9084, test_f1: 0.5588
 epoch: 6, train_loss: 0.9098, test_loss: 0.8956, test_f1: 0.5088
 epoch: 7, train_loss: 0.9053, test_loss: 0.8517, test_f1: 0.5633
 epoch: 8, train_loss: 0.8884, test_loss: 0.9056, test_f1: 0.5090
 epoch: 9, train_loss: 0.8703, test_loss: 0.8842, test_f1: 0.5202
 epoch: 10, train_loss: 0.8636, test_loss: 1.0121, test_f1: 0.4850
 epoch: 11, train_loss: 0.8772, test_loss: 0.8859, test_f1: 0.5236
 epoch: 12, train_loss: 0.8647, test_loss: 0.9214, test_f1: 0.4966
 epoch: 13, train_loss: 0.8614, test_loss: 0.9563, test_f1: 0.5254
 epoch: 14, train_loss: 0.8396, test_loss: 1.0288, test_f1: 0.5234
 epoch: 15, train_loss: 0.8225, test_loss: 0.8524, test_f1: 0.5223
 epoch: 16, train_loss: 0.8212, test_loss: 0.8557, test_f1: 0.5544
 epoch: 17, train_loss: 0.8348, test_loss: 0.8188, test_f1: 0.5616
 epoch: 18, train_loss: 0.8171, test_loss: 0.8792, test_f1: 0.5569
 epoch: 19, train_loss: 0.8637, test_loss: 0.9476, test_f1: 0.5202
 epoch: 20, train_loss: 0.8196, test_loss: 1.0118, test_f1: 0.5295
 epoch: 21, train_loss: 0.8034, test_loss: 0.8940, test_f1: 0.5542
 epoch: 22, train_loss: 0.7771, test_loss: 1.0563, test_f1: 0.5416
 epoch: 23, train_loss: 0.7797, test_loss: 1.0181, test_f1: 0.5392
 epoch: 24, train_loss: 0.7835, test_loss: 0.9335, test_f1: 0.5569
 epoch: 25, train_loss: 0.7604, test_loss: 0.9793, test_f1: 0.5328
 epoch: 26, train_loss: 0.7518, test_loss: 0.8947, test_f1: 0.5480
 epoch: 27, train_loss: 0.7611, test_loss: 1.0434, test_f1: 0.5871
 epoch: 28, train_loss: 0.7615, test_loss: 0.9966, test_f1: 0.5377
 epoch: 29, train_loss: 0.7608, test_loss: 0.9505, test_f1: 0.5283
 epoch: 30, train_loss: 0.7438, test_loss: 0.9502, test_f1: 0.5422
 epoch: 31, train_loss: 0.7385, test_loss: 0.9548, test_f1: 0.4997
 epoch: 32, train_loss: 0.7412, test_loss: 0.9988, test_f1: 0.5340
 epoch: 33, train_loss: 0.7378, test_loss: 0.9762, test_f1: 0.5097
 epoch: 34, train_loss: 0.7291, test_loss: 1.0085, test_f1: 0.5526
 epoch: 35, train_loss: 0.7168, test_loss: 0.9641, test_f1: 0.5531
 epoch: 36, train_loss: 0.7231, test_loss: 1.0075, test_f1: 0.5616
 epoch: 37, train_loss: 0.7327, test_loss: 0.9392, test_f1: 0.6026
 epoch: 38, train_loss: 0.7208, test_loss: 1.1205, test_f1: 0.5394
 epoch: 39, train_loss: 0.6940, test_loss: 0.8782, test_f1: 0.6252
 epoch: 40, train_loss: 0.6883, test_loss: 1.0321, test_f1: 0.5443
 epoch: 41, train_loss: 0.7013, test_loss: 0.9256, test_f1: 0.5810
 epoch: 42, train_loss: 0.7306, test_loss: 1.1010, test_f1: 0.5211
 epoch: 43, train_loss: 0.7079, test_loss: 0.9001, test_f1: 0.5916
 epoch: 44, train_loss: 0.6957, test_loss: 1.1166, test_f1: 0.5169
 epoch: 45, train_loss: 0.6837, test_loss: 0.9371, test_f1: 0.6022
 epoch: 46, train_loss: 0.6913, test_loss: 0.9705, test_f1: 0.5585
 epoch: 47, train_loss: 0.6703, test_loss: 0.8921, test_f1: 0.5726
 epoch: 48, train_loss: 0.6716, test_loss: 0.8890, test_f1: 0.6268
 epoch: 49, train_loss: 0.6816, test_loss: 1.0269, test_f1: 0.6277
 epoch: 50, train_loss: 0.6698, test_loss: 1.0655, test_f1: 0.5897
 epoch: 51, train_loss: 0.6102, test_loss: 0.9759, test_f1: 0.6220
 epoch: 52, train_loss: 0.6244, test_loss: 1.0067, test_f1: 0.6245
 epoch: 53, train_loss: 0.6018, test_loss: 0.8901, test_f1: 0.6406
 epoch: 54, train_loss: 0.5949, test_loss: 1.0341, test_f1: 0.5742
 epoch: 55, train_loss: 0.5827, test_loss: 1.0552, test_f1: 0.5740
 epoch: 56, train_loss: 0.5955, test_loss: 1.0354, test_f1: 0.6063
 epoch: 57, train_loss: 0.5836, test_loss: 1.0251, test_f1: 0.6192
 epoch: 58, train_loss: 0.5691, test_loss: 1.1243, test_f1: 0.6304
 epoch: 59, train_loss: 0.5673, test_loss: 1.1952, test_f1: 0.5658
 epoch: 60, train_loss: 0.5704, test_loss: 1.2522, test_f1: 0.5547
 epoch: 61, train_loss: 0.5718, test_loss: 1.1266, test_f1: 0.6113
 epoch: 62, train_loss: 0.5644, test_loss: 1.2228, test_f1: 0.6129
 epoch: 63, train_loss: 0.5787, test_loss: 1.2510, test_f1: 0.5591
 epoch: 64, train_loss: 0.5659, test_loss: 1.1403, test_f1: 0.6306
 epoch: 65, train_loss: 0.5549, test_loss: 1.1348, test_f1: 0.6080
 epoch: 66, train_loss: 0.5432, test_loss: 1.2147, test_f1: 0.6165
 epoch: 67, train_loss: 0.5542, test_loss: 1.1109, test_f1: 0.6552
 epoch: 68, train_loss: 0.5710, test_loss: 1.1903, test_f1: 0.6689
 epoch: 69, train_loss: 0.5537, test_loss: 1.3492, test_f1: 0.6258
 epoch: 70, train_loss: 0.5457, test_loss: 1.3592, test_f1: 0.6012
 epoch: 71, train_loss: 0.5546, test_loss: 1.2764, test_f1: 0.6428
 epoch: 72, train_loss: 0.5542, test_loss: 1.2581, test_f1: 0.6132
 epoch: 73, train_loss: 0.5373, test_loss: 1.3752, test_f1: 0.6105
 epoch: 74, train_loss: 0.5252, test_loss: 1.2846, test_f1: 0.6395
 epoch: 75, train_loss: 0.5275, test_loss: 1.3829, test_f1: 0.6281
 epoch: 76, train_loss: 0.5367, test_loss: 1.2846, test_f1: 0.6317
 epoch: 77, train_loss: 0.5385, test_loss: 1.0233, test_f1: 0.6582
 epoch: 78, train_loss: 0.5299, test_loss: 1.1683, test_f1: 0.6296
 epoch: 79, train_loss: 0.5442, test_loss: 1.2183, test_f1: 0.6239
 epoch: 80, train_loss: 0.5277, test_loss: 1.0857, test_f1: 0.6658
 epoch: 81, train_loss: 0.5170, test_loss: 1.1711, test_f1: 0.6692
 epoch: 82, train_loss: 0.5143, test_loss: 1.0848, test_f1: 0.6509
 epoch: 83, train_loss: 0.5307, test_loss: 1.1208, test_f1: 0.6367
 epoch: 84, train_loss: 0.5122, test_loss: 1.3841, test_f1: 0.6473
 epoch: 85, train_loss: 0.5074, test_loss: 1.6118, test_f1: 0.6363
 epoch: 86, train_loss: 0.5127, test_loss: 1.4821, test_f1: 0.6070
 epoch: 87, train_loss: 0.5016, test_loss: 1.3203, test_f1: 0.6137
 epoch: 88, train_loss: 0.5072, test_loss: 1.3109, test_f1: 0.6308
 epoch: 89, train_loss: 0.5131, test_loss: 1.2422, test_f1: 0.6154
 epoch: 90, train_loss: 0.4996, test_loss: 1.1124, test_f1: 0.6245
 epoch: 91, train_loss: 0.4937, test_loss: 1.1053, test_f1: 0.6408
 epoch: 92, train_loss: 0.4829, test_loss: 1.3749, test_f1: 0.6028
 epoch: 93, train_loss: 0.4985, test_loss: 1.3402, test_f1: 0.6081
 epoch: 94, train_loss: 0.4954, test_loss: 1.2142, test_f1: 0.6210
 epoch: 95, train_loss: 0.4903, test_loss: 1.1434, test_f1: 0.6133
 epoch: 96, train_loss: 0.4655, test_loss: 1.1890, test_f1: 0.6259
 epoch: 97, train_loss: 0.4906, test_loss: 1.7523, test_f1: 0.5960
 epoch: 98, train_loss: 0.4663, test_loss: 1.2204, test_f1: 0.6445
 epoch: 99, train_loss: 0.4716, test_loss: 1.3436, test_f1: 0.6257
##################ITERATION #6 ****************************************
 epoch: 0, train_loss: 1.1737, test_loss: 1.0408, test_f1: 0.4039
 epoch: 1, train_loss: 1.0159, test_loss: 1.0850, test_f1: 0.4610
 epoch: 2, train_loss: 0.9759, test_loss: 1.0078, test_f1: 0.5048
 epoch: 3, train_loss: 0.9387, test_loss: 1.0353, test_f1: 0.5344
 epoch: 4, train_loss: 0.9546, test_loss: 0.9697, test_f1: 0.5030
 epoch: 5, train_loss: 0.9101, test_loss: 0.9806, test_f1: 0.5032
 epoch: 6, train_loss: 0.9104, test_loss: 0.9913, test_f1: 0.4835
 epoch: 7, train_loss: 0.8933, test_loss: 0.9299, test_f1: 0.4483
 epoch: 8, train_loss: 0.8830, test_loss: 0.9059, test_f1: 0.4964
 epoch: 9, train_loss: 0.8500, test_loss: 0.8876, test_f1: 0.5240
 epoch: 10, train_loss: 0.8218, test_loss: 1.0925, test_f1: 0.5356
 epoch: 11, train_loss: 0.8555, test_loss: 1.0989, test_f1: 0.4976
 epoch: 12, train_loss: 0.8200, test_loss: 0.8380, test_f1: 0.5876
 epoch: 13, train_loss: 0.8054, test_loss: 1.1458, test_f1: 0.4311
 epoch: 14, train_loss: 0.8081, test_loss: 0.8858, test_f1: 0.6116
 epoch: 15, train_loss: 0.7954, test_loss: 0.8842, test_f1: 0.5137
 epoch: 16, train_loss: 0.7996, test_loss: 0.8385, test_f1: 0.5497
 epoch: 17, train_loss: 0.8011, test_loss: 0.9653, test_f1: 0.5699
 epoch: 18, train_loss: 0.7691, test_loss: 1.5495, test_f1: 0.3940
 epoch: 19, train_loss: 0.8177, test_loss: 0.9179, test_f1: 0.5795
 epoch: 20, train_loss: 0.7935, test_loss: 0.9009, test_f1: 0.5244
 epoch: 21, train_loss: 0.7665, test_loss: 0.9700, test_f1: 0.5147
 epoch: 22, train_loss: 0.7506, test_loss: 1.0218, test_f1: 0.5461
 epoch: 23, train_loss: 0.7431, test_loss: 1.0143, test_f1: 0.5216
 epoch: 24, train_loss: 0.7314, test_loss: 0.9518, test_f1: 0.5878
 epoch: 25, train_loss: 0.7546, test_loss: 0.9858, test_f1: 0.5154
 epoch: 26, train_loss: 0.7284, test_loss: 0.9494, test_f1: 0.5985
 epoch: 27, train_loss: 0.7434, test_loss: 0.8949, test_f1: 0.5586
 epoch: 28, train_loss: 0.7138, test_loss: 0.8456, test_f1: 0.5893
 epoch: 29, train_loss: 0.7049, test_loss: 0.9285, test_f1: 0.6291
 epoch: 30, train_loss: 0.7131, test_loss: 0.9484, test_f1: 0.5686
 epoch: 31, train_loss: 0.7255, test_loss: 1.0933, test_f1: 0.5233
 epoch: 32, train_loss: 0.7254, test_loss: 0.9855, test_f1: 0.5807
 epoch: 33, train_loss: 0.6838, test_loss: 0.9073, test_f1: 0.6260
 epoch: 34, train_loss: 0.6982, test_loss: 0.8671, test_f1: 0.6701
 epoch: 35, train_loss: 0.6844, test_loss: 0.7870, test_f1: 0.6426
 epoch: 36, train_loss: 0.6910, test_loss: 1.0796, test_f1: 0.5598
 epoch: 37, train_loss: 0.6743, test_loss: 1.0924, test_f1: 0.5473
 epoch: 38, train_loss: 0.6615, test_loss: 1.5329, test_f1: 0.4952
 epoch: 39, train_loss: 0.7054, test_loss: 0.8967, test_f1: 0.6239
 epoch: 40, train_loss: 0.6800, test_loss: 0.9114, test_f1: 0.6260
 epoch: 41, train_loss: 0.6494, test_loss: 1.0018, test_f1: 0.5683
 epoch: 42, train_loss: 0.6508, test_loss: 0.9523, test_f1: 0.6199
 epoch: 43, train_loss: 0.6297, test_loss: 0.8927, test_f1: 0.6034
 epoch: 44, train_loss: 0.6443, test_loss: 0.9859, test_f1: 0.5758
 epoch: 45, train_loss: 0.6403, test_loss: 0.9493, test_f1: 0.6289
 epoch: 46, train_loss: 0.6315, test_loss: 1.0104, test_f1: 0.6271
 epoch: 47, train_loss: 0.6384, test_loss: 0.9269, test_f1: 0.5932
 epoch: 48, train_loss: 0.6271, test_loss: 0.9776, test_f1: 0.6157
 epoch: 49, train_loss: 0.6389, test_loss: 1.0206, test_f1: 0.6436
 epoch: 50, train_loss: 0.6409, test_loss: 1.0984, test_f1: 0.6165
 epoch: 51, train_loss: 0.6031, test_loss: 0.9331, test_f1: 0.6550
 epoch: 52, train_loss: 0.5764, test_loss: 1.0026, test_f1: 0.6219
 epoch: 53, train_loss: 0.5735, test_loss: 0.9883, test_f1: 0.6607
 epoch: 54, train_loss: 0.5491, test_loss: 0.9560, test_f1: 0.6832
 epoch: 55, train_loss: 0.5450, test_loss: 0.9964, test_f1: 0.6505
 epoch: 56, train_loss: 0.5295, test_loss: 1.0436, test_f1: 0.6652
 epoch: 57, train_loss: 0.5482, test_loss: 1.0482, test_f1: 0.6552
 epoch: 58, train_loss: 0.5293, test_loss: 1.0220, test_f1: 0.6687
 epoch: 59, train_loss: 0.5312, test_loss: 1.0540, test_f1: 0.6841
 epoch: 60, train_loss: 0.5356, test_loss: 1.0288, test_f1: 0.6488
 epoch: 61, train_loss: 0.5284, test_loss: 1.0092, test_f1: 0.6601
 epoch: 62, train_loss: 0.5056, test_loss: 0.9894, test_f1: 0.6569
 epoch: 63, train_loss: 0.5012, test_loss: 1.0232, test_f1: 0.6579
 epoch: 64, train_loss: 0.5009, test_loss: 1.1173, test_f1: 0.6316
 epoch: 65, train_loss: 0.4879, test_loss: 1.0412, test_f1: 0.6544
 epoch: 66, train_loss: 0.5216, test_loss: 1.1300, test_f1: 0.6277
 epoch: 67, train_loss: 0.5009, test_loss: 1.0831, test_f1: 0.6523
 epoch: 68, train_loss: 0.5040, test_loss: 1.0080, test_f1: 0.6285
 epoch: 69, train_loss: 0.4896, test_loss: 1.0964, test_f1: 0.6614
 epoch: 70, train_loss: 0.4801, test_loss: 1.0698, test_f1: 0.6808
 epoch: 71, train_loss: 0.4973, test_loss: 1.0311, test_f1: 0.6694
 epoch: 72, train_loss: 0.4980, test_loss: 1.1427, test_f1: 0.6631
 epoch: 73, train_loss: 0.4951, test_loss: 1.1095, test_f1: 0.6490
 epoch: 74, train_loss: 0.4913, test_loss: 1.0887, test_f1: 0.6502
 epoch: 75, train_loss: 0.4985, test_loss: 1.0321, test_f1: 0.6386
 epoch: 76, train_loss: 0.4894, test_loss: 1.0298, test_f1: 0.6647
 epoch: 77, train_loss: 0.4790, test_loss: 1.1217, test_f1: 0.6612
 epoch: 78, train_loss: 0.4821, test_loss: 1.0564, test_f1: 0.6625
 epoch: 79, train_loss: 0.4666, test_loss: 1.0116, test_f1: 0.6377
 epoch: 80, train_loss: 0.4564, test_loss: 1.0146, test_f1: 0.6706
 epoch: 81, train_loss: 0.4653, test_loss: 1.1547, test_f1: 0.6631
 epoch: 82, train_loss: 0.4484, test_loss: 1.2413, test_f1: 0.6617
 epoch: 83, train_loss: 0.4387, test_loss: 1.0320, test_f1: 0.6765
 epoch: 84, train_loss: 0.4465, test_loss: 1.1221, test_f1: 0.6408
 epoch: 85, train_loss: 0.4510, test_loss: 1.1592, test_f1: 0.6331
 epoch: 86, train_loss: 0.4614, test_loss: 1.0849, test_f1: 0.6679
 epoch: 87, train_loss: 0.4646, test_loss: 1.1502, test_f1: 0.6614
 epoch: 88, train_loss: 0.4603, test_loss: 1.1304, test_f1: 0.6597
 epoch: 89, train_loss: 0.4401, test_loss: 1.1646, test_f1: 0.6660
 epoch: 90, train_loss: 0.4285, test_loss: 1.0388, test_f1: 0.6741
 epoch: 91, train_loss: 0.4515, test_loss: 1.3157, test_f1: 0.6534
 epoch: 92, train_loss: 0.4525, test_loss: 1.0782, test_f1: 0.6575
 epoch: 93, train_loss: 0.4442, test_loss: 0.9499, test_f1: 0.6815
 epoch: 94, train_loss: 0.4120, test_loss: 1.2315, test_f1: 0.6601
 epoch: 95, train_loss: 0.4345, test_loss: 0.9850, test_f1: 0.6598
 epoch: 96, train_loss: 0.4457, test_loss: 1.0074, test_f1: 0.6624
 epoch: 97, train_loss: 0.4314, test_loss: 1.0454, test_f1: 0.7018
 epoch: 98, train_loss: 0.4220, test_loss: 1.0270, test_f1: 0.6727
 epoch: 99, train_loss: 0.3998, test_loss: 1.2029, test_f1: 0.6850
##################ITERATION #7 ****************************************
 epoch: 0, train_loss: 1.1752, test_loss: 1.1064, test_f1: 0.4231
 epoch: 1, train_loss: 1.0239, test_loss: 1.1665, test_f1: 0.4899
 epoch: 2, train_loss: 0.9908, test_loss: 1.0024, test_f1: 0.4393
 epoch: 3, train_loss: 0.9672, test_loss: 0.9694, test_f1: 0.5130
 epoch: 4, train_loss: 0.9455, test_loss: 1.0351, test_f1: 0.5513
 epoch: 5, train_loss: 0.9056, test_loss: 1.2183, test_f1: 0.4069
 epoch: 6, train_loss: 0.9167, test_loss: 1.0755, test_f1: 0.5106
 epoch: 7, train_loss: 0.8877, test_loss: 0.9087, test_f1: 0.5387
 epoch: 8, train_loss: 0.8591, test_loss: 0.9531, test_f1: 0.5171
 epoch: 9, train_loss: 0.8500, test_loss: 1.0646, test_f1: 0.4986
 epoch: 10, train_loss: 0.8508, test_loss: 0.9603, test_f1: 0.4900
 epoch: 11, train_loss: 0.8377, test_loss: 0.8449, test_f1: 0.5532
 epoch: 12, train_loss: 0.8363, test_loss: 1.0382, test_f1: 0.4906
 epoch: 13, train_loss: 0.8188, test_loss: 0.8240, test_f1: 0.5659
 epoch: 14, train_loss: 0.8057, test_loss: 0.8544, test_f1: 0.5322
 epoch: 15, train_loss: 0.8085, test_loss: 0.9364, test_f1: 0.5342
 epoch: 16, train_loss: 0.8059, test_loss: 0.8769, test_f1: 0.5631
 epoch: 17, train_loss: 0.7916, test_loss: 1.0261, test_f1: 0.5449
 epoch: 18, train_loss: 0.7959, test_loss: 0.9361, test_f1: 0.5448
 epoch: 19, train_loss: 0.7983, test_loss: 0.9816, test_f1: 0.5239
 epoch: 20, train_loss: 0.7628, test_loss: 1.0190, test_f1: 0.5488
 epoch: 21, train_loss: 0.7606, test_loss: 0.8261, test_f1: 0.5492
 epoch: 22, train_loss: 0.7776, test_loss: 1.1447, test_f1: 0.5301
 epoch: 23, train_loss: 0.7443, test_loss: 0.7846, test_f1: 0.6525
 epoch: 24, train_loss: 0.7370, test_loss: 0.8801, test_f1: 0.5906
 epoch: 25, train_loss: 0.7288, test_loss: 0.9669, test_f1: 0.5871
 epoch: 26, train_loss: 0.7346, test_loss: 0.9197, test_f1: 0.5260
 epoch: 27, train_loss: 0.7142, test_loss: 0.9800, test_f1: 0.6023
 epoch: 28, train_loss: 0.7231, test_loss: 1.0468, test_f1: 0.5391
 epoch: 29, train_loss: 0.7283, test_loss: 0.8791, test_f1: 0.6480
 epoch: 30, train_loss: 0.6838, test_loss: 1.0988, test_f1: 0.6411
 epoch: 31, train_loss: 0.7053, test_loss: 1.1066, test_f1: 0.5284
 epoch: 32, train_loss: 0.7059, test_loss: 0.9327, test_f1: 0.5997
 epoch: 33, train_loss: 0.7045, test_loss: 1.0128, test_f1: 0.5553
 epoch: 34, train_loss: 0.6924, test_loss: 0.9395, test_f1: 0.6018
 epoch: 35, train_loss: 0.6807, test_loss: 0.9736, test_f1: 0.5618
 epoch: 36, train_loss: 0.6882, test_loss: 0.9493, test_f1: 0.5954
 epoch: 37, train_loss: 0.6827, test_loss: 1.0043, test_f1: 0.6036
 epoch: 38, train_loss: 0.6709, test_loss: 0.9242, test_f1: 0.5899
 epoch: 39, train_loss: 0.6961, test_loss: 1.0004, test_f1: 0.5648
 epoch: 40, train_loss: 0.6576, test_loss: 0.9524, test_f1: 0.5696
 epoch: 41, train_loss: 0.6777, test_loss: 0.9222, test_f1: 0.5648
 epoch: 42, train_loss: 0.6426, test_loss: 1.0859, test_f1: 0.6210
 epoch: 43, train_loss: 0.6551, test_loss: 1.0997, test_f1: 0.5986
 epoch: 44, train_loss: 0.6517, test_loss: 1.0846, test_f1: 0.6075
 epoch: 45, train_loss: 0.6339, test_loss: 1.0280, test_f1: 0.6028
 epoch: 46, train_loss: 0.6303, test_loss: 1.0035, test_f1: 0.6256
 epoch: 47, train_loss: 0.6167, test_loss: 1.1963, test_f1: 0.6291
 epoch: 48, train_loss: 0.6306, test_loss: 1.1028, test_f1: 0.6100
 epoch: 49, train_loss: 0.6301, test_loss: 1.1835, test_f1: 0.6297
 epoch: 50, train_loss: 0.6200, test_loss: 0.9668, test_f1: 0.6243
 epoch: 51, train_loss: 0.5797, test_loss: 1.1657, test_f1: 0.6180
 epoch: 52, train_loss: 0.5640, test_loss: 1.0749, test_f1: 0.6327
 epoch: 53, train_loss: 0.5501, test_loss: 1.0412, test_f1: 0.6484
 epoch: 54, train_loss: 0.5421, test_loss: 1.0812, test_f1: 0.6506
 epoch: 55, train_loss: 0.5349, test_loss: 1.1171, test_f1: 0.6517
 epoch: 56, train_loss: 0.5379, test_loss: 1.0696, test_f1: 0.6447
 epoch: 57, train_loss: 0.5369, test_loss: 1.1875, test_f1: 0.6421
 epoch: 58, train_loss: 0.5319, test_loss: 1.2086, test_f1: 0.6424
 epoch: 59, train_loss: 0.5123, test_loss: 1.1680, test_f1: 0.6729
 epoch: 60, train_loss: 0.5120, test_loss: 1.0680, test_f1: 0.6613
 epoch: 61, train_loss: 0.5069, test_loss: 1.1921, test_f1: 0.6332
 epoch: 62, train_loss: 0.5359, test_loss: 1.0496, test_f1: 0.6640
 epoch: 63, train_loss: 0.5182, test_loss: 1.0110, test_f1: 0.6623
 epoch: 64, train_loss: 0.5126, test_loss: 1.1464, test_f1: 0.6536
 epoch: 65, train_loss: 0.5040, test_loss: 1.0868, test_f1: 0.6624
 epoch: 66, train_loss: 0.5081, test_loss: 1.1423, test_f1: 0.6554
 epoch: 67, train_loss: 0.5049, test_loss: 1.1526, test_f1: 0.6527
 epoch: 68, train_loss: 0.4953, test_loss: 1.1750, test_f1: 0.6502
 epoch: 69, train_loss: 0.5106, test_loss: 1.2003, test_f1: 0.6698
 epoch: 70, train_loss: 0.4800, test_loss: 1.2583, test_f1: 0.6479
 epoch: 71, train_loss: 0.4851, test_loss: 1.1593, test_f1: 0.6704
 epoch: 72, train_loss: 0.4708, test_loss: 1.2520, test_f1: 0.6530
 epoch: 73, train_loss: 0.4709, test_loss: 1.1175, test_f1: 0.6529
 epoch: 74, train_loss: 0.4936, test_loss: 1.1529, test_f1: 0.6671
 epoch: 75, train_loss: 0.4748, test_loss: 1.1418, test_f1: 0.6616
 epoch: 76, train_loss: 0.4632, test_loss: 1.1413, test_f1: 0.6853
 epoch: 77, train_loss: 0.4403, test_loss: 1.1854, test_f1: 0.6593
 epoch: 78, train_loss: 0.4672, test_loss: 1.3235, test_f1: 0.6373
 epoch: 79, train_loss: 0.4508, test_loss: 1.2461, test_f1: 0.6750
 epoch: 80, train_loss: 0.4739, test_loss: 1.3096, test_f1: 0.6676
 epoch: 81, train_loss: 0.4496, test_loss: 1.3687, test_f1: 0.6605
 epoch: 82, train_loss: 0.4553, test_loss: 1.3295, test_f1: 0.6710
 epoch: 83, train_loss: 0.4369, test_loss: 1.2788, test_f1: 0.6656
 epoch: 84, train_loss: 0.4591, test_loss: 1.2907, test_f1: 0.6447
 epoch: 85, train_loss: 0.4460, test_loss: 1.3427, test_f1: 0.6599
 epoch: 86, train_loss: 0.4339, test_loss: 1.3373, test_f1: 0.6561
 epoch: 87, train_loss: 0.4579, test_loss: 1.5969, test_f1: 0.6321
 epoch: 88, train_loss: 0.4231, test_loss: 1.2820, test_f1: 0.7057
 epoch: 89, train_loss: 0.4304, test_loss: 1.2938, test_f1: 0.6798
 epoch: 90, train_loss: 0.4299, test_loss: 1.3023, test_f1: 0.6579
 epoch: 91, train_loss: 0.4358, test_loss: 1.3657, test_f1: 0.6772
 epoch: 92, train_loss: 0.4348, test_loss: 1.2163, test_f1: 0.6608
 epoch: 93, train_loss: 0.4299, test_loss: 1.3248, test_f1: 0.6788
 epoch: 94, train_loss: 0.4208, test_loss: 1.2736, test_f1: 0.6639
 epoch: 95, train_loss: 0.4131, test_loss: 1.3367, test_f1: 0.6721
 epoch: 96, train_loss: 0.3985, test_loss: 1.2780, test_f1: 0.6848
 epoch: 97, train_loss: 0.4281, test_loss: 1.3026, test_f1: 0.6948
 epoch: 98, train_loss: 0.4098, test_loss: 1.3015, test_f1: 0.6608
 epoch: 99, train_loss: 0.3916, test_loss: 1.3883, test_f1: 0.6526
##################ITERATION #8 ****************************************
 epoch: 0, train_loss: 1.1909, test_loss: 1.0710, test_f1: 0.4586
 epoch: 1, train_loss: 1.0423, test_loss: 1.2840, test_f1: 0.3953
 epoch: 2, train_loss: 1.0098, test_loss: 1.1539, test_f1: 0.4383
 epoch: 3, train_loss: 0.9924, test_loss: 1.0359, test_f1: 0.4765
 epoch: 4, train_loss: 0.9674, test_loss: 0.9813, test_f1: 0.4812
 epoch: 5, train_loss: 0.9486, test_loss: 1.0083, test_f1: 0.5250
 epoch: 6, train_loss: 0.9365, test_loss: 0.9832, test_f1: 0.5131
 epoch: 7, train_loss: 0.9056, test_loss: 1.0653, test_f1: 0.4960
 epoch: 8, train_loss: 0.8775, test_loss: 0.9542, test_f1: 0.5284
 epoch: 9, train_loss: 0.8917, test_loss: 0.9088, test_f1: 0.5320
 epoch: 10, train_loss: 0.8760, test_loss: 1.0069, test_f1: 0.5090
 epoch: 11, train_loss: 0.8509, test_loss: 1.0392, test_f1: 0.5163
 epoch: 12, train_loss: 0.8453, test_loss: 0.9081, test_f1: 0.5471
 epoch: 13, train_loss: 0.8425, test_loss: 0.9609, test_f1: 0.5530
 epoch: 14, train_loss: 0.8413, test_loss: 0.9997, test_f1: 0.4987
 epoch: 15, train_loss: 0.8414, test_loss: 0.9998, test_f1: 0.5217
 epoch: 16, train_loss: 0.7979, test_loss: 0.9506, test_f1: 0.5163
 epoch: 17, train_loss: 0.8268, test_loss: 0.8830, test_f1: 0.5160
 epoch: 18, train_loss: 0.8043, test_loss: 0.8929, test_f1: 0.5202
 epoch: 19, train_loss: 0.7943, test_loss: 0.8816, test_f1: 0.5348
 epoch: 20, train_loss: 0.7952, test_loss: 0.8586, test_f1: 0.5293
 epoch: 21, train_loss: 0.7829, test_loss: 0.9812, test_f1: 0.5356
 epoch: 22, train_loss: 0.7987, test_loss: 0.9904, test_f1: 0.5325
 epoch: 23, train_loss: 0.7698, test_loss: 0.8771, test_f1: 0.5307
 epoch: 24, train_loss: 0.7547, test_loss: 0.9319, test_f1: 0.5396
 epoch: 25, train_loss: 0.7630, test_loss: 1.0388, test_f1: 0.5262
 epoch: 26, train_loss: 0.7476, test_loss: 0.9094, test_f1: 0.5733
 epoch: 27, train_loss: 0.7531, test_loss: 1.0264, test_f1: 0.5791
 epoch: 28, train_loss: 0.7317, test_loss: 0.8975, test_f1: 0.5731
 epoch: 29, train_loss: 0.7437, test_loss: 0.9421, test_f1: 0.5852
 epoch: 30, train_loss: 0.7534, test_loss: 0.8136, test_f1: 0.5521
 epoch: 31, train_loss: 0.7407, test_loss: 1.0271, test_f1: 0.5578
 epoch: 32, train_loss: 0.7286, test_loss: 0.9519, test_f1: 0.6012
 epoch: 33, train_loss: 0.7333, test_loss: 0.9139, test_f1: 0.5625
 epoch: 34, train_loss: 0.7258, test_loss: 0.8338, test_f1: 0.5719
 epoch: 35, train_loss: 0.7095, test_loss: 0.9110, test_f1: 0.5866
 epoch: 36, train_loss: 0.7157, test_loss: 0.8631, test_f1: 0.5675
 epoch: 37, train_loss: 0.7185, test_loss: 0.9616, test_f1: 0.6378
 epoch: 38, train_loss: 0.7027, test_loss: 1.0597, test_f1: 0.5924
 epoch: 39, train_loss: 0.7080, test_loss: 0.8871, test_f1: 0.5950
 epoch: 40, train_loss: 0.6818, test_loss: 0.9608, test_f1: 0.5713
 epoch: 41, train_loss: 0.7068, test_loss: 1.0061, test_f1: 0.5843
 epoch: 42, train_loss: 0.7131, test_loss: 0.9389, test_f1: 0.6154
 epoch: 43, train_loss: 0.6790, test_loss: 0.8797, test_f1: 0.6140
 epoch: 44, train_loss: 0.6620, test_loss: 0.9338, test_f1: 0.6120
 epoch: 45, train_loss: 0.6666, test_loss: 0.9277, test_f1: 0.6004
 epoch: 46, train_loss: 0.6700, test_loss: 1.1303, test_f1: 0.5793
 epoch: 47, train_loss: 0.6786, test_loss: 1.2865, test_f1: 0.5683
 epoch: 48, train_loss: 0.6616, test_loss: 1.0098, test_f1: 0.6178
 epoch: 49, train_loss: 0.6694, test_loss: 1.0263, test_f1: 0.5679
 epoch: 50, train_loss: 0.6490, test_loss: 0.8994, test_f1: 0.6707
 epoch: 51, train_loss: 0.6132, test_loss: 0.9715, test_f1: 0.6344
 epoch: 52, train_loss: 0.5890, test_loss: 1.0664, test_f1: 0.6417
 epoch: 53, train_loss: 0.5807, test_loss: 1.0215, test_f1: 0.6536
 epoch: 54, train_loss: 0.5725, test_loss: 1.1573, test_f1: 0.6248
 epoch: 55, train_loss: 0.5790, test_loss: 1.1567, test_f1: 0.5994
 epoch: 56, train_loss: 0.5704, test_loss: 0.9942, test_f1: 0.6201
 epoch: 57, train_loss: 0.5703, test_loss: 1.1044, test_f1: 0.5986
 epoch: 58, train_loss: 0.5689, test_loss: 1.0427, test_f1: 0.6306
 epoch: 59, train_loss: 0.5612, test_loss: 1.0341, test_f1: 0.6581
 epoch: 60, train_loss: 0.5638, test_loss: 1.1659, test_f1: 0.6303
 epoch: 61, train_loss: 0.5509, test_loss: 1.1423, test_f1: 0.5809
 epoch: 62, train_loss: 0.5576, test_loss: 1.0496, test_f1: 0.6469
 epoch: 63, train_loss: 0.5385, test_loss: 1.0640, test_f1: 0.6344
 epoch: 64, train_loss: 0.5333, test_loss: 1.2721, test_f1: 0.6166
 epoch: 65, train_loss: 0.5464, test_loss: 1.1810, test_f1: 0.6111
 epoch: 66, train_loss: 0.5428, test_loss: 1.1482, test_f1: 0.6142
 epoch: 67, train_loss: 0.5403, test_loss: 1.2150, test_f1: 0.5936
 epoch: 68, train_loss: 0.5464, test_loss: 1.0798, test_f1: 0.6183
 epoch: 69, train_loss: 0.5434, test_loss: 1.2030, test_f1: 0.6111
 epoch: 70, train_loss: 0.5449, test_loss: 1.1887, test_f1: 0.6035
 epoch: 71, train_loss: 0.5023, test_loss: 1.1280, test_f1: 0.6167
 epoch: 72, train_loss: 0.5066, test_loss: 1.0982, test_f1: 0.6219
 epoch: 73, train_loss: 0.5273, test_loss: 1.2187, test_f1: 0.6205
 epoch: 74, train_loss: 0.5058, test_loss: 1.1798, test_f1: 0.6417
 epoch: 75, train_loss: 0.4983, test_loss: 1.1618, test_f1: 0.6163
 epoch: 76, train_loss: 0.5106, test_loss: 1.2113, test_f1: 0.6168
 epoch: 77, train_loss: 0.5079, test_loss: 1.0955, test_f1: 0.6265
 epoch: 78, train_loss: 0.4848, test_loss: 1.1588, test_f1: 0.6187
 epoch: 79, train_loss: 0.4855, test_loss: 1.3071, test_f1: 0.6134
 epoch: 80, train_loss: 0.4658, test_loss: 1.2990, test_f1: 0.6081
 epoch: 81, train_loss: 0.5051, test_loss: 1.1419, test_f1: 0.6099
 epoch: 82, train_loss: 0.4832, test_loss: 1.1998, test_f1: 0.6300
 epoch: 83, train_loss: 0.5082, test_loss: 1.0202, test_f1: 0.6453
 epoch: 84, train_loss: 0.4787, test_loss: 1.1636, test_f1: 0.6125
 epoch: 85, train_loss: 0.4740, test_loss: 1.2319, test_f1: 0.6214
 epoch: 86, train_loss: 0.4696, test_loss: 1.1593, test_f1: 0.6020
 epoch: 87, train_loss: 0.5015, test_loss: 1.2646, test_f1: 0.5781
 epoch: 88, train_loss: 0.5012, test_loss: 1.1512, test_f1: 0.6297
 epoch: 89, train_loss: 0.4808, test_loss: 1.2351, test_f1: 0.6013
 epoch: 90, train_loss: 0.4721, test_loss: 1.1986, test_f1: 0.6163
 epoch: 91, train_loss: 0.4492, test_loss: 1.2073, test_f1: 0.6165
 epoch: 92, train_loss: 0.4730, test_loss: 1.2867, test_f1: 0.6095
 epoch: 93, train_loss: 0.4461, test_loss: 1.3648, test_f1: 0.6098
 epoch: 94, train_loss: 0.4462, test_loss: 1.1567, test_f1: 0.6028
 epoch: 95, train_loss: 0.4449, test_loss: 1.2990, test_f1: 0.6433
 epoch: 96, train_loss: 0.4716, test_loss: 1.4422, test_f1: 0.6175
 epoch: 97, train_loss: 0.4434, test_loss: 1.2977, test_f1: 0.5992
 epoch: 98, train_loss: 0.4535, test_loss: 1.3104, test_f1: 0.6143
 epoch: 99, train_loss: 0.4468, test_loss: 1.1548, test_f1: 0.6558
##################ITERATION #9 ****************************************
 epoch: 0, train_loss: 1.2043, test_loss: 1.1435, test_f1: 0.4253
 epoch: 1, train_loss: 1.0382, test_loss: 1.1147, test_f1: 0.4787
 epoch: 2, train_loss: 1.0234, test_loss: 1.1072, test_f1: 0.4414
 epoch: 3, train_loss: 1.0081, test_loss: 1.2243, test_f1: 0.5162
 epoch: 4, train_loss: 0.9819, test_loss: 1.0052, test_f1: 0.4656
 epoch: 5, train_loss: 0.9602, test_loss: 1.0232, test_f1: 0.4920
 epoch: 6, train_loss: 0.9499, test_loss: 1.1142, test_f1: 0.4638
 epoch: 7, train_loss: 0.9150, test_loss: 1.0648, test_f1: 0.5987
 epoch: 8, train_loss: 0.9129, test_loss: 1.3065, test_f1: 0.4018
 epoch: 9, train_loss: 0.9137, test_loss: 1.0219, test_f1: 0.4751
 epoch: 10, train_loss: 0.8638, test_loss: 0.9412, test_f1: 0.5424
 epoch: 11, train_loss: 0.8696, test_loss: 0.9290, test_f1: 0.5394
 epoch: 12, train_loss: 0.8475, test_loss: 1.0221, test_f1: 0.5462
 epoch: 13, train_loss: 0.8522, test_loss: 0.8970, test_f1: 0.5345
 epoch: 14, train_loss: 0.8322, test_loss: 1.0041, test_f1: 0.5902
 epoch: 15, train_loss: 0.8353, test_loss: 0.9811, test_f1: 0.5386
 epoch: 16, train_loss: 0.8262, test_loss: 0.8422, test_f1: 0.5887
 epoch: 17, train_loss: 0.8106, test_loss: 0.8873, test_f1: 0.5858
 epoch: 18, train_loss: 0.8063, test_loss: 0.9259, test_f1: 0.6013
 epoch: 19, train_loss: 0.8024, test_loss: 0.9404, test_f1: 0.5741
 epoch: 20, train_loss: 0.7991, test_loss: 0.9066, test_f1: 0.5575
 epoch: 21, train_loss: 0.7873, test_loss: 0.8458, test_f1: 0.5303
 epoch: 22, train_loss: 0.7983, test_loss: 0.8490, test_f1: 0.5452
 epoch: 23, train_loss: 0.7744, test_loss: 0.9350, test_f1: 0.5193
 epoch: 24, train_loss: 0.7602, test_loss: 0.9213, test_f1: 0.6359
 epoch: 25, train_loss: 0.7619, test_loss: 0.9363, test_f1: 0.6123
 epoch: 26, train_loss: 0.7450, test_loss: 1.0987, test_f1: 0.5707
 epoch: 27, train_loss: 0.7449, test_loss: 0.9019, test_f1: 0.5452
 epoch: 28, train_loss: 0.7544, test_loss: 0.7930, test_f1: 0.6642
 epoch: 29, train_loss: 0.7586, test_loss: 0.9548, test_f1: 0.5343
 epoch: 30, train_loss: 0.7356, test_loss: 0.8640, test_f1: 0.6229
 epoch: 31, train_loss: 0.7270, test_loss: 0.8391, test_f1: 0.5797
 epoch: 32, train_loss: 0.7376, test_loss: 0.9577, test_f1: 0.6478
 epoch: 33, train_loss: 0.7373, test_loss: 0.9800, test_f1: 0.5446
 epoch: 34, train_loss: 0.7400, test_loss: 0.8372, test_f1: 0.6748
 epoch: 35, train_loss: 0.7375, test_loss: 0.9650, test_f1: 0.5735
 epoch: 36, train_loss: 0.7108, test_loss: 0.8931, test_f1: 0.5748
 epoch: 37, train_loss: 0.7100, test_loss: 0.9871, test_f1: 0.6416
 epoch: 38, train_loss: 0.7020, test_loss: 0.8744, test_f1: 0.6140
 epoch: 39, train_loss: 0.7078, test_loss: 0.8969, test_f1: 0.6264
 epoch: 40, train_loss: 0.6736, test_loss: 1.1565, test_f1: 0.5953
 epoch: 41, train_loss: 0.6711, test_loss: 0.9862, test_f1: 0.6370
 epoch: 42, train_loss: 0.6725, test_loss: 1.1061, test_f1: 0.6008
 epoch: 43, train_loss: 0.6813, test_loss: 0.8359, test_f1: 0.6499
 epoch: 44, train_loss: 0.6977, test_loss: 0.9977, test_f1: 0.5746
 epoch: 45, train_loss: 0.6774, test_loss: 0.9806, test_f1: 0.6475
 epoch: 46, train_loss: 0.6581, test_loss: 1.1082, test_f1: 0.5364
 epoch: 47, train_loss: 0.6498, test_loss: 0.9742, test_f1: 0.6354
 epoch: 48, train_loss: 0.6624, test_loss: 1.0001, test_f1: 0.6356
 epoch: 49, train_loss: 0.6265, test_loss: 1.0353, test_f1: 0.6303
 epoch: 50, train_loss: 0.6553, test_loss: 0.9838, test_f1: 0.6289
 epoch: 51, train_loss: 0.6234, test_loss: 0.9155, test_f1: 0.6678
 epoch: 52, train_loss: 0.5826, test_loss: 0.9201, test_f1: 0.6420
 epoch: 53, train_loss: 0.5749, test_loss: 0.9130, test_f1: 0.6514
 epoch: 54, train_loss: 0.5744, test_loss: 0.9732, test_f1: 0.6389
 epoch: 55, train_loss: 0.5572, test_loss: 0.9397, test_f1: 0.6313
 epoch: 56, train_loss: 0.5615, test_loss: 0.9715, test_f1: 0.6447
 epoch: 57, train_loss: 0.5483, test_loss: 1.1515, test_f1: 0.6021
 epoch: 58, train_loss: 0.5491, test_loss: 1.0298, test_f1: 0.6672
 epoch: 59, train_loss: 0.5562, test_loss: 1.0550, test_f1: 0.6488
 epoch: 60, train_loss: 0.5351, test_loss: 1.1460, test_f1: 0.6417
 epoch: 61, train_loss: 0.5442, test_loss: 1.0140, test_f1: 0.6233
 epoch: 62, train_loss: 0.5216, test_loss: 1.0967, test_f1: 0.6358
 epoch: 63, train_loss: 0.5158, test_loss: 1.0600, test_f1: 0.6510
 epoch: 64, train_loss: 0.5140, test_loss: 1.1024, test_f1: 0.6345
 epoch: 65, train_loss: 0.5094, test_loss: 1.1584, test_f1: 0.6434
 epoch: 66, train_loss: 0.5311, test_loss: 0.9628, test_f1: 0.6549
 epoch: 67, train_loss: 0.5200, test_loss: 1.2132, test_f1: 0.6282
 epoch: 68, train_loss: 0.5125, test_loss: 1.1047, test_f1: 0.6857
 epoch: 69, train_loss: 0.5387, test_loss: 1.0059, test_f1: 0.6731
 epoch: 70, train_loss: 0.5120, test_loss: 1.1823, test_f1: 0.6587
 epoch: 71, train_loss: 0.5202, test_loss: 1.3960, test_f1: 0.6347
 epoch: 72, train_loss: 0.5103, test_loss: 1.1885, test_f1: 0.6448
 epoch: 73, train_loss: 0.5060, test_loss: 1.0188, test_f1: 0.6582
 epoch: 74, train_loss: 0.4912, test_loss: 1.2407, test_f1: 0.6851
 epoch: 75, train_loss: 0.4792, test_loss: 1.1492, test_f1: 0.6758
 epoch: 76, train_loss: 0.4784, test_loss: 1.1333, test_f1: 0.6623
 epoch: 77, train_loss: 0.4656, test_loss: 0.9759, test_f1: 0.6832
 epoch: 78, train_loss: 0.4750, test_loss: 1.2048, test_f1: 0.6497
 epoch: 79, train_loss: 0.4708, test_loss: 1.1950, test_f1: 0.6533
 epoch: 80, train_loss: 0.4553, test_loss: 1.1616, test_f1: 0.6740
 epoch: 81, train_loss: 0.4716, test_loss: 1.2805, test_f1: 0.6442
 epoch: 82, train_loss: 0.4763, test_loss: 1.2117, test_f1: 0.6417
 epoch: 83, train_loss: 0.4577, test_loss: 1.1167, test_f1: 0.6620
 epoch: 84, train_loss: 0.4549, test_loss: 1.1119, test_f1: 0.6733
 epoch: 85, train_loss: 0.4394, test_loss: 1.2859, test_f1: 0.6453
 epoch: 86, train_loss: 0.4489, test_loss: 1.2773, test_f1: 0.6517
 epoch: 87, train_loss: 0.4406, test_loss: 1.1075, test_f1: 0.6762
 epoch: 88, train_loss: 0.4385, test_loss: 1.2981, test_f1: 0.6569
 epoch: 89, train_loss: 0.4526, test_loss: 1.1259, test_f1: 0.6709
 epoch: 90, train_loss: 0.4376, test_loss: 1.0301, test_f1: 0.6453
 epoch: 91, train_loss: 0.4105, test_loss: 1.1650, test_f1: 0.6585
 epoch: 92, train_loss: 0.4258, test_loss: 1.0719, test_f1: 0.6768
 epoch: 93, train_loss: 0.4375, test_loss: 1.1221, test_f1: 0.6669
 epoch: 94, train_loss: 0.4424, test_loss: 0.9694, test_f1: 0.6788
 epoch: 95, train_loss: 0.4206, test_loss: 1.0097, test_f1: 0.6858
 epoch: 96, train_loss: 0.3940, test_loss: 1.1020, test_f1: 0.6707
 epoch: 97, train_loss: 0.4356, test_loss: 1.1537, test_f1: 0.6375
 epoch: 98, train_loss: 0.4269, test_loss: 1.0638, test_f1: 0.6598
 epoch: 99, train_loss: 0.4413, test_loss: 1.1521, test_f1: 0.6361

Training completed in 1352.67 seconds
Best F1: 0.7057 at epoch 88
Mean F1 across iterations: 0.6828  0.0117
========================FINAL RESULTS================================
FEGIN weighted F1: 0.7057  0.0117
python main.py --data ltspice_examples --representation component_pin --model FEGIN --layers 6 --hiddens 64 --batch_size 64 --lr 0.01 --emb_size 250 --epochs 100 --save_appendix component_pin_L6_H64_BS64_LR0.01_E250 --no_val
-----



STDERR:
  File "main.py", line 370, in <module>
    main()
  File "main.py", line 254, in main
    dataset = dataset_class(
  File "/home/philip/projects/llm_inference_code_repo/Circuit-Completion-Using-GNNs/component_classification_with_link_prediction_head/evaluation/FEGIN/kernel/circuit_datasets.py", line 15, in __init__
    self.data, self.slices = torch.load(self.processed_paths[0])
  File "/home/philip/.local/lib/python3.8/site-packages/torch/serialization.py", line 1040, in load
    warnings.warn(
  File "/usr/lib/python3.8/warnings.py", line 109, in _showwarnmsg
    sw(msg.message, msg.category, msg.filename, msg.lineno,
  File "main.py", line 47, in warn_with_traceback
    traceback.print_stack(file=log)
/home/philip/projects/llm_inference_code_repo/Circuit-Completion-Using-GNNs/component_classification_with_link_prediction_head/evaluation/FEGIN/kernel/circuit_datasets.py:15: FutureWarning: You are using `torch.load` with `weights_only=False` (the current default value), which uses the default pickle module implicitly. It is possible to construct malicious pickle data which will execute arbitrary code during unpickling (See https://github.com/pytorch/pytorch/blob/main/SECURITY.md#untrusted-models for more details). In a future release, the default value for `weights_only` will be flipped to `True`. This limits the functions that could be executed during unpickling. Arbitrary objects will no longer be allowed to be loaded via this mode unless they are explicitly allowlisted by the user via `torch.serialization.add_safe_globals`. We recommend you start setting `weights_only=True` for any use case where you don't have full control of the loaded file. Please open an issue on GitHub for any issues related to this experimental feature.
  self.data, self.slices = torch.load(self.processed_paths[0])
