STDOUT:
Results will be saved in /home/philip/projects/ltspice_examples_code_repo/Circuit-Completion-Using-GNNs/component_classification_with_link_prediction_head/evaluation/FEGIN/results/model_FEGIN_dataset_ltspice_examples
Command line input: python main.py --data ltspice_examples --representation component_pin_net --model FEGIN --layers 6 --hiddens 16 --batch_size 32 --lr 0.0001 --emb_size 250 --epochs 100 --save_appendix component_pin_net_L6_H16_BS32_LR0.0001_E250 --no_val
 is saved.
-----
ltspice_examples - FEGIN
Using 6 layers, 16 hidden units, h = 2
Loading component_pin_net representation dataset
ENTERED
Training FEGIN on component_pin_net representation
Train: 3558, Test: 846
##################ITERATION #0 ****************************************
 epoch: 0, train_loss: 1.4581, test_loss: 1.4369, test_f1: 0.0793
 epoch: 1, train_loss: 1.4422, test_loss: 1.4287, test_f1: 0.0793
 epoch: 2, train_loss: 1.4334, test_loss: 1.4197, test_f1: 0.0794
 epoch: 3, train_loss: 1.4235, test_loss: 1.4091, test_f1: 0.1390
 epoch: 4, train_loss: 1.4124, test_loss: 1.3971, test_f1: 0.1909
 epoch: 5, train_loss: 1.3986, test_loss: 1.3847, test_f1: 0.2099
 epoch: 6, train_loss: 1.3807, test_loss: 1.3633, test_f1: 0.2999
 epoch: 7, train_loss: 1.3582, test_loss: 1.3323, test_f1: 0.3187
 epoch: 8, train_loss: 1.3276, test_loss: 1.3105, test_f1: 0.3149
 epoch: 9, train_loss: 1.3070, test_loss: 1.2829, test_f1: 0.2929
 epoch: 10, train_loss: 1.2871, test_loss: 1.2652, test_f1: 0.2876
 epoch: 11, train_loss: 1.2723, test_loss: 1.2493, test_f1: 0.2640
 epoch: 12, train_loss: 1.2606, test_loss: 1.2297, test_f1: 0.2749
 epoch: 13, train_loss: 1.2469, test_loss: 1.2153, test_f1: 0.3066
 epoch: 14, train_loss: 1.2364, test_loss: 1.2003, test_f1: 0.3390
 epoch: 15, train_loss: 1.2229, test_loss: 1.1874, test_f1: 0.3362
 epoch: 16, train_loss: 1.2092, test_loss: 1.1743, test_f1: 0.3584
 epoch: 17, train_loss: 1.2042, test_loss: 1.1610, test_f1: 0.3764
 epoch: 18, train_loss: 1.1879, test_loss: 1.1457, test_f1: 0.3434
 epoch: 19, train_loss: 1.1752, test_loss: 1.1299, test_f1: 0.3454
 epoch: 20, train_loss: 1.1679, test_loss: 1.1154, test_f1: 0.3422
 epoch: 21, train_loss: 1.1531, test_loss: 1.1121, test_f1: 0.3429
 epoch: 22, train_loss: 1.1523, test_loss: 1.0951, test_f1: 0.3422
 epoch: 23, train_loss: 1.1290, test_loss: 1.0869, test_f1: 0.3462
 epoch: 24, train_loss: 1.1284, test_loss: 1.0787, test_f1: 0.3472
 epoch: 25, train_loss: 1.1244, test_loss: 1.0744, test_f1: 0.3439
 epoch: 26, train_loss: 1.1108, test_loss: 1.0686, test_f1: 0.3452
 epoch: 27, train_loss: 1.1019, test_loss: 1.0669, test_f1: 0.3460
 epoch: 28, train_loss: 1.0899, test_loss: 1.0634, test_f1: 0.3450
 epoch: 29, train_loss: 1.0928, test_loss: 1.0583, test_f1: 0.3452
 epoch: 30, train_loss: 1.0838, test_loss: 1.0548, test_f1: 0.3472
 epoch: 31, train_loss: 1.0907, test_loss: 1.0537, test_f1: 0.3472
 epoch: 32, train_loss: 1.0866, test_loss: 1.0466, test_f1: 0.3450
 epoch: 33, train_loss: 1.0734, test_loss: 1.0516, test_f1: 0.3450
 epoch: 34, train_loss: 1.0730, test_loss: 1.0497, test_f1: 0.3467
 epoch: 35, train_loss: 1.0752, test_loss: 1.0541, test_f1: 0.3452
 epoch: 36, train_loss: 1.0735, test_loss: 1.0491, test_f1: 0.3457
 epoch: 37, train_loss: 1.0671, test_loss: 1.0518, test_f1: 0.3444
 epoch: 38, train_loss: 1.0653, test_loss: 1.0427, test_f1: 0.3450
 epoch: 39, train_loss: 1.0504, test_loss: 1.0387, test_f1: 0.3466
 epoch: 40, train_loss: 1.0604, test_loss: 1.0409, test_f1: 0.3459
 epoch: 41, train_loss: 1.0474, test_loss: 1.0483, test_f1: 0.3431
 epoch: 42, train_loss: 1.0508, test_loss: 1.0337, test_f1: 0.3508
 epoch: 43, train_loss: 1.0529, test_loss: 1.0359, test_f1: 0.3606
 epoch: 44, train_loss: 1.0463, test_loss: 1.0325, test_f1: 0.3530
 epoch: 45, train_loss: 1.0430, test_loss: 1.0336, test_f1: 0.3722
 epoch: 46, train_loss: 1.0439, test_loss: 1.0390, test_f1: 0.3584
 epoch: 47, train_loss: 1.0427, test_loss: 1.0344, test_f1: 0.3549
 epoch: 48, train_loss: 1.0380, test_loss: 1.0372, test_f1: 0.3753
 epoch: 49, train_loss: 1.0368, test_loss: 1.0380, test_f1: 0.3709
 epoch: 50, train_loss: 1.0302, test_loss: 1.0298, test_f1: 0.3805
 epoch: 51, train_loss: 1.0237, test_loss: 1.0310, test_f1: 0.3983
 epoch: 52, train_loss: 1.0262, test_loss: 1.0327, test_f1: 0.3901
 epoch: 53, train_loss: 1.0289, test_loss: 1.0293, test_f1: 0.3990
 epoch: 54, train_loss: 1.0248, test_loss: 1.0254, test_f1: 0.4052
 epoch: 55, train_loss: 1.0200, test_loss: 1.0319, test_f1: 0.4159
 epoch: 56, train_loss: 1.0219, test_loss: 1.0212, test_f1: 0.4166
 epoch: 57, train_loss: 1.0238, test_loss: 1.0215, test_f1: 0.4058
 epoch: 58, train_loss: 1.0249, test_loss: 1.0244, test_f1: 0.4134
 epoch: 59, train_loss: 1.0212, test_loss: 1.0195, test_f1: 0.4235
 epoch: 60, train_loss: 1.0243, test_loss: 1.0190, test_f1: 0.4438
 epoch: 61, train_loss: 1.0241, test_loss: 1.0161, test_f1: 0.4388
 epoch: 62, train_loss: 1.0197, test_loss: 1.0226, test_f1: 0.4318
 epoch: 63, train_loss: 1.0177, test_loss: 1.0350, test_f1: 0.4468
 epoch: 64, train_loss: 1.0165, test_loss: 1.0220, test_f1: 0.4493
 epoch: 65, train_loss: 1.0103, test_loss: 1.0213, test_f1: 0.4452
 epoch: 66, train_loss: 1.0132, test_loss: 1.0279, test_f1: 0.4368
 epoch: 67, train_loss: 1.0179, test_loss: 1.0209, test_f1: 0.4390
 epoch: 68, train_loss: 1.0155, test_loss: 1.0268, test_f1: 0.4446
 epoch: 69, train_loss: 1.0121, test_loss: 1.0278, test_f1: 0.4487
 epoch: 70, train_loss: 1.0186, test_loss: 1.0213, test_f1: 0.4479
 epoch: 71, train_loss: 1.0064, test_loss: 1.0104, test_f1: 0.4309
 epoch: 72, train_loss: 1.0114, test_loss: 1.0026, test_f1: 0.4388
 epoch: 73, train_loss: 1.0090, test_loss: 1.0119, test_f1: 0.4352
 epoch: 74, train_loss: 1.0095, test_loss: 1.0273, test_f1: 0.4488
 epoch: 75, train_loss: 1.0129, test_loss: 1.0151, test_f1: 0.4493
 epoch: 76, train_loss: 1.0102, test_loss: 1.0258, test_f1: 0.4573
 epoch: 77, train_loss: 1.0049, test_loss: 1.0184, test_f1: 0.4487
 epoch: 78, train_loss: 1.0051, test_loss: 1.0196, test_f1: 0.4474
 epoch: 79, train_loss: 1.0005, test_loss: 1.0257, test_f1: 0.4619
 epoch: 80, train_loss: 1.0085, test_loss: 1.0274, test_f1: 0.4680
 epoch: 81, train_loss: 1.0042, test_loss: 1.0203, test_f1: 0.4581
 epoch: 82, train_loss: 1.0080, test_loss: 1.0265, test_f1: 0.4471
 epoch: 83, train_loss: 1.0062, test_loss: 1.0271, test_f1: 0.4540
 epoch: 84, train_loss: 1.0001, test_loss: 1.0293, test_f1: 0.4588
 epoch: 85, train_loss: 1.0043, test_loss: 1.0064, test_f1: 0.4604
 epoch: 86, train_loss: 0.9996, test_loss: 1.0166, test_f1: 0.4528
 epoch: 87, train_loss: 1.0007, test_loss: 1.0257, test_f1: 0.4630
 epoch: 88, train_loss: 0.9945, test_loss: 1.0177, test_f1: 0.4607
 epoch: 89, train_loss: 0.9994, test_loss: 1.0072, test_f1: 0.4622
 epoch: 90, train_loss: 0.9962, test_loss: 1.0109, test_f1: 0.4515
 epoch: 91, train_loss: 0.9948, test_loss: 1.0355, test_f1: 0.4568
 epoch: 92, train_loss: 0.9901, test_loss: 1.0357, test_f1: 0.4559
 epoch: 93, train_loss: 0.9846, test_loss: 1.0107, test_f1: 0.4803
 epoch: 94, train_loss: 0.9930, test_loss: 1.0154, test_f1: 0.4706
 epoch: 95, train_loss: 0.9920, test_loss: 1.0049, test_f1: 0.4808
 epoch: 96, train_loss: 0.9950, test_loss: 0.9981, test_f1: 0.4665
 epoch: 97, train_loss: 0.9854, test_loss: 1.0130, test_f1: 0.4683
 epoch: 98, train_loss: 0.9993, test_loss: 1.0125, test_f1: 0.4581
 epoch: 99, train_loss: 0.9932, test_loss: 1.0107, test_f1: 0.4684
##################ITERATION #1 ****************************************
 epoch: 0, train_loss: 1.3602, test_loss: 1.3505, test_f1: 0.2703
 epoch: 1, train_loss: 1.3442, test_loss: 1.3377, test_f1: 0.2295
 epoch: 2, train_loss: 1.3295, test_loss: 1.3205, test_f1: 0.2270
 epoch: 3, train_loss: 1.3084, test_loss: 1.2948, test_f1: 0.2270
 epoch: 4, train_loss: 1.2854, test_loss: 1.2599, test_f1: 0.2270
 epoch: 5, train_loss: 1.2599, test_loss: 1.2267, test_f1: 0.3171
 epoch: 6, train_loss: 1.2281, test_loss: 1.1927, test_f1: 0.3422
 epoch: 7, train_loss: 1.1986, test_loss: 1.1525, test_f1: 0.3460
 epoch: 8, train_loss: 1.1782, test_loss: 1.1351, test_f1: 0.3416
 epoch: 9, train_loss: 1.1561, test_loss: 1.1129, test_f1: 0.3419
 epoch: 10, train_loss: 1.1432, test_loss: 1.1047, test_f1: 0.3384
 epoch: 11, train_loss: 1.1158, test_loss: 1.0909, test_f1: 0.3426
 epoch: 12, train_loss: 1.1155, test_loss: 1.0835, test_f1: 0.3407
 epoch: 13, train_loss: 1.1057, test_loss: 1.0794, test_f1: 0.3414
 epoch: 14, train_loss: 1.0907, test_loss: 1.0761, test_f1: 0.3384
 epoch: 15, train_loss: 1.0908, test_loss: 1.0689, test_f1: 0.3416
 epoch: 16, train_loss: 1.0911, test_loss: 1.0683, test_f1: 0.3430
 epoch: 17, train_loss: 1.0789, test_loss: 1.0674, test_f1: 0.3424
 epoch: 18, train_loss: 1.0727, test_loss: 1.0633, test_f1: 0.3407
 epoch: 19, train_loss: 1.0739, test_loss: 1.0563, test_f1: 0.3428
 epoch: 20, train_loss: 1.0720, test_loss: 1.0488, test_f1: 0.3450
 epoch: 21, train_loss: 1.0619, test_loss: 1.0489, test_f1: 0.3452
 epoch: 22, train_loss: 1.0652, test_loss: 1.0445, test_f1: 0.3437
 epoch: 23, train_loss: 1.0538, test_loss: 1.0488, test_f1: 0.3544
 epoch: 24, train_loss: 1.0574, test_loss: 1.0436, test_f1: 0.3636
 epoch: 25, train_loss: 1.0559, test_loss: 1.0332, test_f1: 0.3653
 epoch: 26, train_loss: 1.0457, test_loss: 1.0243, test_f1: 0.3758
 epoch: 27, train_loss: 1.0397, test_loss: 1.0244, test_f1: 0.3739
 epoch: 28, train_loss: 1.0397, test_loss: 1.0150, test_f1: 0.3850
 epoch: 29, train_loss: 1.0387, test_loss: 1.0180, test_f1: 0.4212
 epoch: 30, train_loss: 1.0368, test_loss: 1.0083, test_f1: 0.4415
 epoch: 31, train_loss: 1.0290, test_loss: 0.9919, test_f1: 0.4274
 epoch: 32, train_loss: 1.0304, test_loss: 0.9912, test_f1: 0.4417
 epoch: 33, train_loss: 1.0305, test_loss: 1.0033, test_f1: 0.4407
 epoch: 34, train_loss: 1.0171, test_loss: 0.9948, test_f1: 0.4465
 epoch: 35, train_loss: 1.0181, test_loss: 0.9919, test_f1: 0.4462
 epoch: 36, train_loss: 1.0260, test_loss: 0.9822, test_f1: 0.4700
 epoch: 37, train_loss: 1.0179, test_loss: 0.9749, test_f1: 0.4727
 epoch: 38, train_loss: 1.0037, test_loss: 0.9713, test_f1: 0.4832
 epoch: 39, train_loss: 1.0127, test_loss: 0.9793, test_f1: 0.4821
 epoch: 40, train_loss: 1.0074, test_loss: 0.9649, test_f1: 0.4774
 epoch: 41, train_loss: 1.0037, test_loss: 0.9757, test_f1: 0.4876
 epoch: 42, train_loss: 1.0062, test_loss: 1.0095, test_f1: 0.4680
 epoch: 43, train_loss: 0.9895, test_loss: 0.9759, test_f1: 0.4991
 epoch: 44, train_loss: 0.9986, test_loss: 0.9669, test_f1: 0.4891
 epoch: 45, train_loss: 0.9946, test_loss: 0.9497, test_f1: 0.4947
 epoch: 46, train_loss: 0.9916, test_loss: 0.9540, test_f1: 0.4911
 epoch: 47, train_loss: 0.9951, test_loss: 0.9596, test_f1: 0.4845
 epoch: 48, train_loss: 0.9930, test_loss: 0.9567, test_f1: 0.5002
 epoch: 49, train_loss: 0.9814, test_loss: 0.9562, test_f1: 0.4920
 epoch: 50, train_loss: 0.9867, test_loss: 0.9423, test_f1: 0.4952
 epoch: 51, train_loss: 0.9748, test_loss: 0.9454, test_f1: 0.5001
 epoch: 52, train_loss: 0.9804, test_loss: 0.9437, test_f1: 0.5004
 epoch: 53, train_loss: 0.9827, test_loss: 0.9468, test_f1: 0.5052
 epoch: 54, train_loss: 0.9667, test_loss: 0.9422, test_f1: 0.5068
 epoch: 55, train_loss: 0.9705, test_loss: 0.9397, test_f1: 0.5062
 epoch: 56, train_loss: 0.9709, test_loss: 0.9371, test_f1: 0.4977
 epoch: 57, train_loss: 0.9667, test_loss: 0.9379, test_f1: 0.5119
 epoch: 58, train_loss: 0.9792, test_loss: 0.9419, test_f1: 0.4950
 epoch: 59, train_loss: 0.9786, test_loss: 0.9412, test_f1: 0.4957
 epoch: 60, train_loss: 0.9779, test_loss: 0.9360, test_f1: 0.5071
 epoch: 61, train_loss: 0.9633, test_loss: 0.9281, test_f1: 0.4990
 epoch: 62, train_loss: 0.9659, test_loss: 0.9367, test_f1: 0.5106
 epoch: 63, train_loss: 0.9745, test_loss: 0.9264, test_f1: 0.5107
 epoch: 64, train_loss: 0.9663, test_loss: 0.9373, test_f1: 0.4990
 epoch: 65, train_loss: 0.9665, test_loss: 0.9275, test_f1: 0.5026
 epoch: 66, train_loss: 0.9729, test_loss: 0.9303, test_f1: 0.5076
 epoch: 67, train_loss: 0.9581, test_loss: 0.9346, test_f1: 0.4863
 epoch: 68, train_loss: 0.9623, test_loss: 0.9243, test_f1: 0.5140
 epoch: 69, train_loss: 0.9621, test_loss: 0.9280, test_f1: 0.5112
 epoch: 70, train_loss: 0.9580, test_loss: 0.9237, test_f1: 0.5168
 epoch: 71, train_loss: 0.9639, test_loss: 0.9229, test_f1: 0.5060
 epoch: 72, train_loss: 0.9598, test_loss: 0.9367, test_f1: 0.4989
 epoch: 73, train_loss: 0.9647, test_loss: 0.9268, test_f1: 0.5209
 epoch: 74, train_loss: 0.9593, test_loss: 0.9322, test_f1: 0.5096
 epoch: 75, train_loss: 0.9604, test_loss: 0.9325, test_f1: 0.5031
 epoch: 76, train_loss: 0.9629, test_loss: 0.9195, test_f1: 0.5103
 epoch: 77, train_loss: 0.9518, test_loss: 0.9232, test_f1: 0.5121
 epoch: 78, train_loss: 0.9538, test_loss: 0.9273, test_f1: 0.5120
 epoch: 79, train_loss: 0.9551, test_loss: 0.9319, test_f1: 0.4968
 epoch: 80, train_loss: 0.9518, test_loss: 0.9278, test_f1: 0.5012
 epoch: 81, train_loss: 0.9583, test_loss: 0.9171, test_f1: 0.5206
 epoch: 82, train_loss: 0.9433, test_loss: 0.9140, test_f1: 0.5119
 epoch: 83, train_loss: 0.9596, test_loss: 0.9136, test_f1: 0.5187
 epoch: 84, train_loss: 0.9571, test_loss: 0.9176, test_f1: 0.5106
 epoch: 85, train_loss: 0.9579, test_loss: 0.9004, test_f1: 0.5220
 epoch: 86, train_loss: 0.9533, test_loss: 0.9156, test_f1: 0.5149
 epoch: 87, train_loss: 0.9714, test_loss: 0.9115, test_f1: 0.5201
 epoch: 88, train_loss: 0.9587, test_loss: 0.9054, test_f1: 0.5283
 epoch: 89, train_loss: 0.9400, test_loss: 0.9134, test_f1: 0.5118
 epoch: 90, train_loss: 0.9593, test_loss: 0.9070, test_f1: 0.5298
 epoch: 91, train_loss: 0.9503, test_loss: 0.9048, test_f1: 0.5254
 epoch: 92, train_loss: 0.9589, test_loss: 0.9051, test_f1: 0.5207
 epoch: 93, train_loss: 0.9522, test_loss: 0.9147, test_f1: 0.5186
 epoch: 94, train_loss: 0.9468, test_loss: 0.9078, test_f1: 0.5228
 epoch: 95, train_loss: 0.9485, test_loss: 0.9092, test_f1: 0.5260
 epoch: 96, train_loss: 0.9477, test_loss: 0.9081, test_f1: 0.5241
 epoch: 97, train_loss: 0.9421, test_loss: 0.9097, test_f1: 0.5246
 epoch: 98, train_loss: 0.9484, test_loss: 0.9018, test_f1: 0.5278
 epoch: 99, train_loss: 0.9440, test_loss: 0.9094, test_f1: 0.5260
##################ITERATION #2 ****************************************
 epoch: 0, train_loss: 1.2960, test_loss: 1.2795, test_f1: 0.2270
 epoch: 1, train_loss: 1.2760, test_loss: 1.2656, test_f1: 0.2270
 epoch: 2, train_loss: 1.2630, test_loss: 1.2528, test_f1: 0.2270
 epoch: 3, train_loss: 1.2512, test_loss: 1.2393, test_f1: 0.2270
 epoch: 4, train_loss: 1.2387, test_loss: 1.2236, test_f1: 0.2270
 epoch: 5, train_loss: 1.2221, test_loss: 1.2035, test_f1: 0.2270
 epoch: 6, train_loss: 1.2075, test_loss: 1.1824, test_f1: 0.2631
 epoch: 7, train_loss: 1.1858, test_loss: 1.1576, test_f1: 0.3379
 epoch: 8, train_loss: 1.1689, test_loss: 1.1371, test_f1: 0.3422
 epoch: 9, train_loss: 1.1514, test_loss: 1.1136, test_f1: 0.3441
 epoch: 10, train_loss: 1.1381, test_loss: 1.0998, test_f1: 0.3331
 epoch: 11, train_loss: 1.1228, test_loss: 1.0840, test_f1: 0.3400
 epoch: 12, train_loss: 1.1113, test_loss: 1.0808, test_f1: 0.3384
 epoch: 13, train_loss: 1.1051, test_loss: 1.0772, test_f1: 0.3302
 epoch: 14, train_loss: 1.0891, test_loss: 1.0695, test_f1: 0.3368
 epoch: 15, train_loss: 1.0787, test_loss: 1.0658, test_f1: 0.3449
 epoch: 16, train_loss: 1.0810, test_loss: 1.0709, test_f1: 0.3392
 epoch: 17, train_loss: 1.0752, test_loss: 1.0639, test_f1: 0.3632
 epoch: 18, train_loss: 1.0637, test_loss: 1.0700, test_f1: 0.3588
 epoch: 19, train_loss: 1.0695, test_loss: 1.0687, test_f1: 0.3652
 epoch: 20, train_loss: 1.0743, test_loss: 1.0647, test_f1: 0.3767
 epoch: 21, train_loss: 1.0578, test_loss: 1.0683, test_f1: 0.3776
 epoch: 22, train_loss: 1.0579, test_loss: 1.0630, test_f1: 0.3791
 epoch: 23, train_loss: 1.0517, test_loss: 1.0657, test_f1: 0.3622
 epoch: 24, train_loss: 1.0485, test_loss: 1.0619, test_f1: 0.3976
 epoch: 25, train_loss: 1.0469, test_loss: 1.0616, test_f1: 0.3918
 epoch: 26, train_loss: 1.0444, test_loss: 1.0715, test_f1: 0.3888
 epoch: 27, train_loss: 1.0433, test_loss: 1.0651, test_f1: 0.4092
 epoch: 28, train_loss: 1.0436, test_loss: 1.0682, test_f1: 0.4174
 epoch: 29, train_loss: 1.0388, test_loss: 1.0572, test_f1: 0.4345
 epoch: 30, train_loss: 1.0424, test_loss: 1.0665, test_f1: 0.4171
 epoch: 31, train_loss: 1.0364, test_loss: 1.0604, test_f1: 0.4356
 epoch: 32, train_loss: 1.0320, test_loss: 1.0583, test_f1: 0.4464
 epoch: 33, train_loss: 1.0302, test_loss: 1.0569, test_f1: 0.4376
 epoch: 34, train_loss: 1.0293, test_loss: 1.0528, test_f1: 0.4487
 epoch: 35, train_loss: 1.0237, test_loss: 1.0572, test_f1: 0.4415
 epoch: 36, train_loss: 1.0237, test_loss: 1.0660, test_f1: 0.4492
 epoch: 37, train_loss: 1.0167, test_loss: 1.0644, test_f1: 0.4456
 epoch: 38, train_loss: 1.0195, test_loss: 1.0637, test_f1: 0.4491
 epoch: 39, train_loss: 1.0137, test_loss: 1.0434, test_f1: 0.4643
 epoch: 40, train_loss: 1.0185, test_loss: 1.0407, test_f1: 0.4788
 epoch: 41, train_loss: 1.0155, test_loss: 1.0533, test_f1: 0.4653
 epoch: 42, train_loss: 1.0113, test_loss: 1.0422, test_f1: 0.4701
 epoch: 43, train_loss: 1.0081, test_loss: 1.0455, test_f1: 0.4685
 epoch: 44, train_loss: 1.0072, test_loss: 1.0427, test_f1: 0.4761
 epoch: 45, train_loss: 1.0050, test_loss: 1.0376, test_f1: 0.4649
 epoch: 46, train_loss: 1.0027, test_loss: 1.0404, test_f1: 0.4648
 epoch: 47, train_loss: 1.0027, test_loss: 1.0375, test_f1: 0.4496
 epoch: 48, train_loss: 0.9989, test_loss: 1.0439, test_f1: 0.4695
 epoch: 49, train_loss: 1.0028, test_loss: 1.0366, test_f1: 0.4670
 epoch: 50, train_loss: 0.9927, test_loss: 1.0336, test_f1: 0.4743
 epoch: 51, train_loss: 0.9977, test_loss: 1.0315, test_f1: 0.4790
 epoch: 52, train_loss: 0.9933, test_loss: 1.0300, test_f1: 0.4685
 epoch: 53, train_loss: 0.9884, test_loss: 1.0268, test_f1: 0.4785
 epoch: 54, train_loss: 0.9956, test_loss: 1.0336, test_f1: 0.4654
 epoch: 55, train_loss: 0.9816, test_loss: 1.0354, test_f1: 0.4875
 epoch: 56, train_loss: 0.9924, test_loss: 1.0251, test_f1: 0.4877
 epoch: 57, train_loss: 0.9935, test_loss: 1.0275, test_f1: 0.4806
 epoch: 58, train_loss: 0.9885, test_loss: 1.0302, test_f1: 0.4735
 epoch: 59, train_loss: 0.9814, test_loss: 1.0343, test_f1: 0.4778
 epoch: 60, train_loss: 0.9892, test_loss: 1.0240, test_f1: 0.4940
 epoch: 61, train_loss: 0.9774, test_loss: 1.0334, test_f1: 0.4827
 epoch: 62, train_loss: 0.9852, test_loss: 1.0237, test_f1: 0.4886
 epoch: 63, train_loss: 0.9833, test_loss: 1.0306, test_f1: 0.4754
 epoch: 64, train_loss: 0.9767, test_loss: 1.0331, test_f1: 0.4862
 epoch: 65, train_loss: 0.9820, test_loss: 1.0193, test_f1: 0.4693
 epoch: 66, train_loss: 0.9899, test_loss: 1.0268, test_f1: 0.4681
 epoch: 67, train_loss: 0.9809, test_loss: 1.0192, test_f1: 0.4848
 epoch: 68, train_loss: 0.9751, test_loss: 1.0103, test_f1: 0.4837
 epoch: 69, train_loss: 0.9846, test_loss: 1.0327, test_f1: 0.4679
 epoch: 70, train_loss: 0.9756, test_loss: 1.0329, test_f1: 0.4651
 epoch: 71, train_loss: 0.9768, test_loss: 1.0232, test_f1: 0.4771
 epoch: 72, train_loss: 0.9748, test_loss: 1.0234, test_f1: 0.4888
 epoch: 73, train_loss: 0.9775, test_loss: 1.0224, test_f1: 0.4670
 epoch: 74, train_loss: 0.9807, test_loss: 1.0149, test_f1: 0.4842
 epoch: 75, train_loss: 0.9700, test_loss: 1.0127, test_f1: 0.4787
 epoch: 76, train_loss: 0.9751, test_loss: 1.0280, test_f1: 0.4800
 epoch: 77, train_loss: 0.9743, test_loss: 1.0088, test_f1: 0.4913
 epoch: 78, train_loss: 0.9710, test_loss: 1.0133, test_f1: 0.4870
 epoch: 79, train_loss: 0.9743, test_loss: 1.0182, test_f1: 0.4831
 epoch: 80, train_loss: 0.9824, test_loss: 1.0155, test_f1: 0.4703
 epoch: 81, train_loss: 0.9726, test_loss: 1.0210, test_f1: 0.4717
 epoch: 82, train_loss: 0.9748, test_loss: 1.0027, test_f1: 0.4884
 epoch: 83, train_loss: 0.9733, test_loss: 0.9985, test_f1: 0.4951
 epoch: 84, train_loss: 0.9705, test_loss: 1.0104, test_f1: 0.4789
 epoch: 85, train_loss: 0.9724, test_loss: 1.0086, test_f1: 0.4842
 epoch: 86, train_loss: 0.9684, test_loss: 1.0115, test_f1: 0.4734
 epoch: 87, train_loss: 0.9741, test_loss: 1.0087, test_f1: 0.4864
 epoch: 88, train_loss: 0.9645, test_loss: 1.0076, test_f1: 0.4914
 epoch: 89, train_loss: 0.9614, test_loss: 1.0165, test_f1: 0.4825
 epoch: 90, train_loss: 0.9621, test_loss: 0.9963, test_f1: 0.4802
 epoch: 91, train_loss: 0.9688, test_loss: 1.0105, test_f1: 0.4889
 epoch: 92, train_loss: 0.9642, test_loss: 1.0001, test_f1: 0.4848
 epoch: 93, train_loss: 0.9662, test_loss: 0.9984, test_f1: 0.4894
 epoch: 94, train_loss: 0.9641, test_loss: 1.0078, test_f1: 0.4678
 epoch: 95, train_loss: 0.9652, test_loss: 1.0004, test_f1: 0.4898
 epoch: 96, train_loss: 0.9640, test_loss: 1.0105, test_f1: 0.4822
 epoch: 97, train_loss: 0.9576, test_loss: 1.0089, test_f1: 0.4727
 epoch: 98, train_loss: 0.9604, test_loss: 0.9949, test_f1: 0.4835
 epoch: 99, train_loss: 0.9601, test_loss: 0.9895, test_f1: 0.4974
##################ITERATION #3 ****************************************
 epoch: 0, train_loss: 1.2923, test_loss: 1.2602, test_f1: 0.2270
 epoch: 1, train_loss: 1.2526, test_loss: 1.2212, test_f1: 0.2936
 epoch: 2, train_loss: 1.2189, test_loss: 1.1871, test_f1: 0.3313
 epoch: 3, train_loss: 1.1909, test_loss: 1.1551, test_f1: 0.3451
 epoch: 4, train_loss: 1.1733, test_loss: 1.1327, test_f1: 0.3460
 epoch: 5, train_loss: 1.1442, test_loss: 1.1166, test_f1: 0.3460
 epoch: 6, train_loss: 1.1299, test_loss: 1.1119, test_f1: 0.3421
 epoch: 7, train_loss: 1.1135, test_loss: 1.1162, test_f1: 0.3421
 epoch: 8, train_loss: 1.1078, test_loss: 1.0941, test_f1: 0.3431
 epoch: 9, train_loss: 1.0966, test_loss: 1.0939, test_f1: 0.3403
 epoch: 10, train_loss: 1.0929, test_loss: 1.0870, test_f1: 0.3428
 epoch: 11, train_loss: 1.0803, test_loss: 1.0821, test_f1: 0.3385
 epoch: 12, train_loss: 1.0718, test_loss: 1.0820, test_f1: 0.3396
 epoch: 13, train_loss: 1.0700, test_loss: 1.0876, test_f1: 0.3354
 epoch: 14, train_loss: 1.0625, test_loss: 1.0872, test_f1: 0.3309
 epoch: 15, train_loss: 1.0588, test_loss: 1.0818, test_f1: 0.3309
 epoch: 16, train_loss: 1.0509, test_loss: 1.0912, test_f1: 0.3252
 epoch: 17, train_loss: 1.0500, test_loss: 1.0785, test_f1: 0.3431
 epoch: 18, train_loss: 1.0499, test_loss: 1.0929, test_f1: 0.3447
 epoch: 19, train_loss: 1.0424, test_loss: 1.0840, test_f1: 0.3415
 epoch: 20, train_loss: 1.0306, test_loss: 1.0726, test_f1: 0.3576
 epoch: 21, train_loss: 1.0385, test_loss: 1.0428, test_f1: 0.3805
 epoch: 22, train_loss: 1.0299, test_loss: 1.0698, test_f1: 0.3660
 epoch: 23, train_loss: 1.0271, test_loss: 1.0449, test_f1: 0.4081
 epoch: 24, train_loss: 1.0283, test_loss: 1.0693, test_f1: 0.3900
 epoch: 25, train_loss: 1.0179, test_loss: 1.0445, test_f1: 0.4010
 epoch: 26, train_loss: 1.0111, test_loss: 1.0429, test_f1: 0.4089
 epoch: 27, train_loss: 1.0105, test_loss: 1.0424, test_f1: 0.4047
 epoch: 28, train_loss: 1.0062, test_loss: 1.0290, test_f1: 0.4153
 epoch: 29, train_loss: 1.0085, test_loss: 1.0590, test_f1: 0.4202
 epoch: 30, train_loss: 1.0049, test_loss: 1.0409, test_f1: 0.4409
 epoch: 31, train_loss: 1.0056, test_loss: 1.0236, test_f1: 0.4420
 epoch: 32, train_loss: 0.9986, test_loss: 1.0684, test_f1: 0.4214
 epoch: 33, train_loss: 0.9938, test_loss: 1.0389, test_f1: 0.4495
 epoch: 34, train_loss: 0.9954, test_loss: 1.0333, test_f1: 0.4612
 epoch: 35, train_loss: 0.9829, test_loss: 1.0268, test_f1: 0.4635
 epoch: 36, train_loss: 0.9892, test_loss: 1.0303, test_f1: 0.4755
 epoch: 37, train_loss: 0.9843, test_loss: 1.0293, test_f1: 0.4687
 epoch: 38, train_loss: 0.9796, test_loss: 1.0209, test_f1: 0.4777
 epoch: 39, train_loss: 0.9822, test_loss: 1.0441, test_f1: 0.4475
 epoch: 40, train_loss: 0.9843, test_loss: 1.0254, test_f1: 0.4929
 epoch: 41, train_loss: 0.9736, test_loss: 1.0248, test_f1: 0.4691
 epoch: 42, train_loss: 0.9766, test_loss: 1.0215, test_f1: 0.4824
 epoch: 43, train_loss: 0.9728, test_loss: 1.0063, test_f1: 0.4822
 epoch: 44, train_loss: 0.9759, test_loss: 1.0353, test_f1: 0.4643
 epoch: 45, train_loss: 0.9696, test_loss: 1.0078, test_f1: 0.4863
 epoch: 46, train_loss: 0.9723, test_loss: 1.0081, test_f1: 0.4873
 epoch: 47, train_loss: 0.9780, test_loss: 0.9936, test_f1: 0.4903
 epoch: 48, train_loss: 0.9634, test_loss: 1.0072, test_f1: 0.4943
 epoch: 49, train_loss: 0.9656, test_loss: 0.9962, test_f1: 0.4890
 epoch: 50, train_loss: 0.9705, test_loss: 1.0151, test_f1: 0.4816
 epoch: 51, train_loss: 0.9592, test_loss: 1.0245, test_f1: 0.5000
 epoch: 52, train_loss: 0.9604, test_loss: 1.0119, test_f1: 0.4975
 epoch: 53, train_loss: 0.9613, test_loss: 1.0065, test_f1: 0.4918
 epoch: 54, train_loss: 0.9652, test_loss: 1.0357, test_f1: 0.4820
 epoch: 55, train_loss: 0.9617, test_loss: 1.0012, test_f1: 0.4934
 epoch: 56, train_loss: 0.9557, test_loss: 1.0088, test_f1: 0.4792
 epoch: 57, train_loss: 0.9513, test_loss: 1.0098, test_f1: 0.4887
 epoch: 58, train_loss: 0.9597, test_loss: 1.0254, test_f1: 0.4912
 epoch: 59, train_loss: 0.9546, test_loss: 1.0176, test_f1: 0.4962
 epoch: 60, train_loss: 0.9600, test_loss: 1.0111, test_f1: 0.4987
 epoch: 61, train_loss: 0.9550, test_loss: 1.0008, test_f1: 0.4954
 epoch: 62, train_loss: 0.9513, test_loss: 1.0070, test_f1: 0.4922
 epoch: 63, train_loss: 0.9603, test_loss: 1.0090, test_f1: 0.4906
 epoch: 64, train_loss: 0.9517, test_loss: 1.0101, test_f1: 0.4989
 epoch: 65, train_loss: 0.9552, test_loss: 1.0417, test_f1: 0.4773
 epoch: 66, train_loss: 0.9523, test_loss: 1.0223, test_f1: 0.4908
 epoch: 67, train_loss: 0.9442, test_loss: 1.0025, test_f1: 0.5066
 epoch: 68, train_loss: 0.9515, test_loss: 1.0352, test_f1: 0.4851
 epoch: 69, train_loss: 0.9429, test_loss: 1.0175, test_f1: 0.4996
 epoch: 70, train_loss: 0.9483, test_loss: 1.0087, test_f1: 0.5039
 epoch: 71, train_loss: 0.9517, test_loss: 1.0397, test_f1: 0.4951
 epoch: 72, train_loss: 0.9505, test_loss: 1.0147, test_f1: 0.5029
 epoch: 73, train_loss: 0.9517, test_loss: 1.0155, test_f1: 0.5009
 epoch: 74, train_loss: 0.9477, test_loss: 1.0304, test_f1: 0.4769
 epoch: 75, train_loss: 0.9442, test_loss: 1.0236, test_f1: 0.4954
 epoch: 76, train_loss: 0.9497, test_loss: 1.0195, test_f1: 0.4951
 epoch: 77, train_loss: 0.9476, test_loss: 1.0166, test_f1: 0.5061
 epoch: 78, train_loss: 0.9440, test_loss: 1.0289, test_f1: 0.4846
 epoch: 79, train_loss: 0.9467, test_loss: 1.0028, test_f1: 0.5092
 epoch: 80, train_loss: 0.9451, test_loss: 1.0127, test_f1: 0.4976
 epoch: 81, train_loss: 0.9467, test_loss: 1.0381, test_f1: 0.4864
 epoch: 82, train_loss: 0.9465, test_loss: 1.0063, test_f1: 0.5063
 epoch: 83, train_loss: 0.9400, test_loss: 1.0272, test_f1: 0.4889
 epoch: 84, train_loss: 0.9475, test_loss: 1.0355, test_f1: 0.4995
 epoch: 85, train_loss: 0.9395, test_loss: 1.0196, test_f1: 0.5051
 epoch: 86, train_loss: 0.9491, test_loss: 1.0204, test_f1: 0.4936
 epoch: 87, train_loss: 0.9403, test_loss: 1.0412, test_f1: 0.4875
 epoch: 88, train_loss: 0.9380, test_loss: 1.0078, test_f1: 0.5085
 epoch: 89, train_loss: 0.9358, test_loss: 1.0016, test_f1: 0.5049
 epoch: 90, train_loss: 0.9330, test_loss: 1.0044, test_f1: 0.5062
 epoch: 91, train_loss: 0.9373, test_loss: 1.0112, test_f1: 0.5064
 epoch: 92, train_loss: 0.9319, test_loss: 1.0171, test_f1: 0.4944
 epoch: 93, train_loss: 0.9407, test_loss: 1.0273, test_f1: 0.5121
 epoch: 94, train_loss: 0.9421, test_loss: 1.0122, test_f1: 0.4979
 epoch: 95, train_loss: 0.9263, test_loss: 1.0122, test_f1: 0.4889
 epoch: 96, train_loss: 0.9214, test_loss: 1.0171, test_f1: 0.4990
 epoch: 97, train_loss: 0.9325, test_loss: 1.0290, test_f1: 0.4924
 epoch: 98, train_loss: 0.9345, test_loss: 1.0150, test_f1: 0.4881
 epoch: 99, train_loss: 0.9407, test_loss: 1.0194, test_f1: 0.4875
##################ITERATION #4 ****************************************
 epoch: 0, train_loss: 1.2766, test_loss: 1.2334, test_f1: 0.2783
 epoch: 1, train_loss: 1.2303, test_loss: 1.2100, test_f1: 0.3188
 epoch: 2, train_loss: 1.2057, test_loss: 1.1838, test_f1: 0.3460
 epoch: 3, train_loss: 1.1858, test_loss: 1.1619, test_f1: 0.3415
 epoch: 4, train_loss: 1.1622, test_loss: 1.1447, test_f1: 0.3431
 epoch: 5, train_loss: 1.1476, test_loss: 1.1344, test_f1: 0.3311
 epoch: 6, train_loss: 1.1220, test_loss: 1.1184, test_f1: 0.3387
 epoch: 7, train_loss: 1.1161, test_loss: 1.0975, test_f1: 0.3457
 epoch: 8, train_loss: 1.1001, test_loss: 1.0806, test_f1: 0.3514
 epoch: 9, train_loss: 1.0949, test_loss: 1.0837, test_f1: 0.3452
 epoch: 10, train_loss: 1.0856, test_loss: 1.0720, test_f1: 0.3640
 epoch: 11, train_loss: 1.0691, test_loss: 1.0659, test_f1: 0.3923
 epoch: 12, train_loss: 1.0711, test_loss: 1.0600, test_f1: 0.3963
 epoch: 13, train_loss: 1.0590, test_loss: 1.0635, test_f1: 0.3961
 epoch: 14, train_loss: 1.0603, test_loss: 1.0889, test_f1: 0.3668
 epoch: 15, train_loss: 1.0537, test_loss: 1.0588, test_f1: 0.4137
 epoch: 16, train_loss: 1.0374, test_loss: 1.0556, test_f1: 0.4061
 epoch: 17, train_loss: 1.0394, test_loss: 1.0419, test_f1: 0.4120
 epoch: 18, train_loss: 1.0428, test_loss: 1.0288, test_f1: 0.4456
 epoch: 19, train_loss: 1.0324, test_loss: 1.0299, test_f1: 0.4440
 epoch: 20, train_loss: 1.0228, test_loss: 1.0307, test_f1: 0.4330
 epoch: 21, train_loss: 1.0225, test_loss: 1.0292, test_f1: 0.4494
 epoch: 22, train_loss: 1.0215, test_loss: 1.0131, test_f1: 0.4538
 epoch: 23, train_loss: 1.0135, test_loss: 1.0137, test_f1: 0.4637
 epoch: 24, train_loss: 1.0106, test_loss: 1.0126, test_f1: 0.4503
 epoch: 25, train_loss: 1.0030, test_loss: 1.0036, test_f1: 0.4610
 epoch: 26, train_loss: 0.9999, test_loss: 1.0041, test_f1: 0.4621
 epoch: 27, train_loss: 1.0087, test_loss: 1.0149, test_f1: 0.4466
 epoch: 28, train_loss: 1.0040, test_loss: 1.0054, test_f1: 0.4735
 epoch: 29, train_loss: 0.9875, test_loss: 1.0037, test_f1: 0.4586
 epoch: 30, train_loss: 0.9932, test_loss: 0.9974, test_f1: 0.4739
 epoch: 31, train_loss: 0.9837, test_loss: 0.9961, test_f1: 0.4627
 epoch: 32, train_loss: 0.9877, test_loss: 0.9946, test_f1: 0.4719
 epoch: 33, train_loss: 0.9855, test_loss: 0.9887, test_f1: 0.4742
 epoch: 34, train_loss: 0.9752, test_loss: 0.9929, test_f1: 0.4756
 epoch: 35, train_loss: 0.9756, test_loss: 0.9860, test_f1: 0.4836
 epoch: 36, train_loss: 0.9711, test_loss: 0.9926, test_f1: 0.4866
 epoch: 37, train_loss: 0.9757, test_loss: 0.9969, test_f1: 0.4746
 epoch: 38, train_loss: 0.9663, test_loss: 0.9680, test_f1: 0.4989
 epoch: 39, train_loss: 0.9690, test_loss: 0.9839, test_f1: 0.4835
 epoch: 40, train_loss: 0.9680, test_loss: 0.9962, test_f1: 0.4807
 epoch: 41, train_loss: 0.9654, test_loss: 0.9859, test_f1: 0.4847
 epoch: 42, train_loss: 0.9576, test_loss: 0.9766, test_f1: 0.5093
 epoch: 43, train_loss: 0.9688, test_loss: 0.9903, test_f1: 0.4885
 epoch: 44, train_loss: 0.9621, test_loss: 0.9821, test_f1: 0.4973
 epoch: 45, train_loss: 0.9607, test_loss: 0.9693, test_f1: 0.5047
 epoch: 46, train_loss: 0.9638, test_loss: 0.9594, test_f1: 0.4836
 epoch: 47, train_loss: 0.9517, test_loss: 0.9676, test_f1: 0.5036
 epoch: 48, train_loss: 0.9519, test_loss: 0.9757, test_f1: 0.4817
 epoch: 49, train_loss: 0.9458, test_loss: 0.9599, test_f1: 0.4924
 epoch: 50, train_loss: 0.9516, test_loss: 0.9709, test_f1: 0.4920
 epoch: 51, train_loss: 0.9387, test_loss: 0.9421, test_f1: 0.5044
 epoch: 52, train_loss: 0.9478, test_loss: 0.9644, test_f1: 0.4873
 epoch: 53, train_loss: 0.9465, test_loss: 0.9571, test_f1: 0.4944
 epoch: 54, train_loss: 0.9405, test_loss: 0.9601, test_f1: 0.4883
 epoch: 55, train_loss: 0.9417, test_loss: 0.9565, test_f1: 0.5172
 epoch: 56, train_loss: 0.9498, test_loss: 0.9510, test_f1: 0.4957
 epoch: 57, train_loss: 0.9351, test_loss: 0.9696, test_f1: 0.4921
 epoch: 58, train_loss: 0.9429, test_loss: 0.9509, test_f1: 0.5026
 epoch: 59, train_loss: 0.9427, test_loss: 0.9644, test_f1: 0.4863
 epoch: 60, train_loss: 0.9491, test_loss: 0.9580, test_f1: 0.5036
 epoch: 61, train_loss: 0.9411, test_loss: 0.9496, test_f1: 0.5254
 epoch: 62, train_loss: 0.9370, test_loss: 0.9459, test_f1: 0.5138
 epoch: 63, train_loss: 0.9346, test_loss: 0.9433, test_f1: 0.4961
 epoch: 64, train_loss: 0.9410, test_loss: 0.9691, test_f1: 0.4913
 epoch: 65, train_loss: 0.9327, test_loss: 0.9597, test_f1: 0.5086
 epoch: 66, train_loss: 0.9330, test_loss: 0.9435, test_f1: 0.4997
 epoch: 67, train_loss: 0.9326, test_loss: 0.9340, test_f1: 0.4966
 epoch: 68, train_loss: 0.9381, test_loss: 0.9562, test_f1: 0.5154
 epoch: 69, train_loss: 0.9324, test_loss: 0.9360, test_f1: 0.5221
 epoch: 70, train_loss: 0.9322, test_loss: 0.9427, test_f1: 0.4999
 epoch: 71, train_loss: 0.9249, test_loss: 0.9425, test_f1: 0.4985
 epoch: 72, train_loss: 0.9325, test_loss: 0.9335, test_f1: 0.5162
 epoch: 73, train_loss: 0.9250, test_loss: 0.9386, test_f1: 0.5100
 epoch: 74, train_loss: 0.9298, test_loss: 0.9332, test_f1: 0.4987
 epoch: 75, train_loss: 0.9265, test_loss: 0.9528, test_f1: 0.5257
 epoch: 76, train_loss: 0.9231, test_loss: 0.9577, test_f1: 0.5248
 epoch: 77, train_loss: 0.9319, test_loss: 0.9386, test_f1: 0.5171
 epoch: 78, train_loss: 0.9273, test_loss: 0.9319, test_f1: 0.5047
 epoch: 79, train_loss: 0.9255, test_loss: 0.9318, test_f1: 0.5212
 epoch: 80, train_loss: 0.9299, test_loss: 0.9309, test_f1: 0.5084
 epoch: 81, train_loss: 0.9261, test_loss: 0.9246, test_f1: 0.5238
 epoch: 82, train_loss: 0.9303, test_loss: 0.9271, test_f1: 0.5026
 epoch: 83, train_loss: 0.9196, test_loss: 0.9296, test_f1: 0.5072
 epoch: 84, train_loss: 0.9222, test_loss: 0.9340, test_f1: 0.5134
 epoch: 85, train_loss: 0.9105, test_loss: 0.9258, test_f1: 0.5212
 epoch: 86, train_loss: 0.9183, test_loss: 0.9531, test_f1: 0.5255
 epoch: 87, train_loss: 0.9276, test_loss: 0.9161, test_f1: 0.5142
 epoch: 88, train_loss: 0.9214, test_loss: 0.9260, test_f1: 0.5235
 epoch: 89, train_loss: 0.9221, test_loss: 0.9270, test_f1: 0.5323
 epoch: 90, train_loss: 0.9228, test_loss: 0.9171, test_f1: 0.5072
 epoch: 91, train_loss: 0.9143, test_loss: 0.9119, test_f1: 0.5224
 epoch: 92, train_loss: 0.9196, test_loss: 0.9413, test_f1: 0.5188
 epoch: 93, train_loss: 0.9206, test_loss: 0.9394, test_f1: 0.5186
 epoch: 94, train_loss: 0.9150, test_loss: 0.9101, test_f1: 0.4999
 epoch: 95, train_loss: 0.9159, test_loss: 0.9140, test_f1: 0.5092
 epoch: 96, train_loss: 0.9086, test_loss: 0.9334, test_f1: 0.5228
 epoch: 97, train_loss: 0.9153, test_loss: 0.9130, test_f1: 0.5281
 epoch: 98, train_loss: 0.9163, test_loss: 0.9120, test_f1: 0.5234
 epoch: 99, train_loss: 0.9147, test_loss: 0.9203, test_f1: 0.5188
##################ITERATION #5 ****************************************
 epoch: 0, train_loss: 1.2713, test_loss: 1.1443, test_f1: 0.3416
 epoch: 1, train_loss: 1.1868, test_loss: 1.1178, test_f1: 0.3422
 epoch: 2, train_loss: 1.1607, test_loss: 1.1036, test_f1: 0.3460
 epoch: 3, train_loss: 1.1370, test_loss: 1.0924, test_f1: 0.3542
 epoch: 4, train_loss: 1.1256, test_loss: 1.0877, test_f1: 0.3535
 epoch: 5, train_loss: 1.1099, test_loss: 1.0814, test_f1: 0.3523
 epoch: 6, train_loss: 1.1003, test_loss: 1.0735, test_f1: 0.3546
 epoch: 7, train_loss: 1.0884, test_loss: 1.0670, test_f1: 0.3541
 epoch: 8, train_loss: 1.0873, test_loss: 1.0658, test_f1: 0.3522
 epoch: 9, train_loss: 1.0764, test_loss: 1.0694, test_f1: 0.3517
 epoch: 10, train_loss: 1.0759, test_loss: 1.0589, test_f1: 0.3543
 epoch: 11, train_loss: 1.0666, test_loss: 1.0572, test_f1: 0.3617
 epoch: 12, train_loss: 1.0701, test_loss: 1.0556, test_f1: 0.3600
 epoch: 13, train_loss: 1.0571, test_loss: 1.0528, test_f1: 0.3589
 epoch: 14, train_loss: 1.0598, test_loss: 1.0562, test_f1: 0.3627
 epoch: 15, train_loss: 1.0577, test_loss: 1.0481, test_f1: 0.3613
 epoch: 16, train_loss: 1.0506, test_loss: 1.0474, test_f1: 0.3646
 epoch: 17, train_loss: 1.0574, test_loss: 1.0481, test_f1: 0.3665
 epoch: 18, train_loss: 1.0460, test_loss: 1.0462, test_f1: 0.3662
 epoch: 19, train_loss: 1.0458, test_loss: 1.0438, test_f1: 0.3789
 epoch: 20, train_loss: 1.0402, test_loss: 1.0499, test_f1: 0.3754
 epoch: 21, train_loss: 1.0384, test_loss: 1.0480, test_f1: 0.3754
 epoch: 22, train_loss: 1.0366, test_loss: 1.0426, test_f1: 0.3722
 epoch: 23, train_loss: 1.0331, test_loss: 1.0403, test_f1: 0.4016
 epoch: 24, train_loss: 1.0295, test_loss: 1.0321, test_f1: 0.4132
 epoch: 25, train_loss: 1.0321, test_loss: 1.0338, test_f1: 0.4136
 epoch: 26, train_loss: 1.0246, test_loss: 1.0223, test_f1: 0.4233
 epoch: 27, train_loss: 1.0262, test_loss: 1.0210, test_f1: 0.4242
 epoch: 28, train_loss: 1.0131, test_loss: 1.0224, test_f1: 0.4314
 epoch: 29, train_loss: 1.0156, test_loss: 1.0182, test_f1: 0.4334
 epoch: 30, train_loss: 1.0125, test_loss: 1.0204, test_f1: 0.4285
 epoch: 31, train_loss: 1.0141, test_loss: 1.0209, test_f1: 0.4282
 epoch: 32, train_loss: 1.0117, test_loss: 1.0271, test_f1: 0.4483
 epoch: 33, train_loss: 1.0132, test_loss: 1.0225, test_f1: 0.4312
 epoch: 34, train_loss: 1.0102, test_loss: 1.0139, test_f1: 0.4480
 epoch: 35, train_loss: 1.0111, test_loss: 1.0079, test_f1: 0.4555
 epoch: 36, train_loss: 1.0081, test_loss: 1.0043, test_f1: 0.4483
 epoch: 37, train_loss: 1.0074, test_loss: 0.9918, test_f1: 0.4357
 epoch: 38, train_loss: 1.0009, test_loss: 1.0071, test_f1: 0.4620
 epoch: 39, train_loss: 0.9968, test_loss: 0.9995, test_f1: 0.4433
 epoch: 40, train_loss: 1.0022, test_loss: 0.9930, test_f1: 0.4472
 epoch: 41, train_loss: 0.9912, test_loss: 0.9951, test_f1: 0.4511
 epoch: 42, train_loss: 0.9980, test_loss: 1.0122, test_f1: 0.4499
 epoch: 43, train_loss: 0.9861, test_loss: 1.0078, test_f1: 0.4607
 epoch: 44, train_loss: 0.9830, test_loss: 1.0093, test_f1: 0.4464
 epoch: 45, train_loss: 0.9893, test_loss: 0.9935, test_f1: 0.4566
 epoch: 46, train_loss: 0.9935, test_loss: 0.9948, test_f1: 0.4536
 epoch: 47, train_loss: 0.9871, test_loss: 0.9889, test_f1: 0.4557
 epoch: 48, train_loss: 0.9813, test_loss: 0.9891, test_f1: 0.4622
 epoch: 49, train_loss: 0.9757, test_loss: 0.9935, test_f1: 0.4543
 epoch: 50, train_loss: 0.9774, test_loss: 0.9781, test_f1: 0.4799
 epoch: 51, train_loss: 0.9736, test_loss: 0.9824, test_f1: 0.4723
 epoch: 52, train_loss: 0.9769, test_loss: 0.9796, test_f1: 0.4592
 epoch: 53, train_loss: 0.9698, test_loss: 0.9785, test_f1: 0.4608
 epoch: 54, train_loss: 0.9673, test_loss: 0.9759, test_f1: 0.4563
 epoch: 55, train_loss: 0.9722, test_loss: 0.9804, test_f1: 0.4663
 epoch: 56, train_loss: 0.9710, test_loss: 0.9768, test_f1: 0.4599
 epoch: 57, train_loss: 0.9705, test_loss: 0.9690, test_f1: 0.4730
 epoch: 58, train_loss: 0.9672, test_loss: 0.9649, test_f1: 0.4591
 epoch: 59, train_loss: 0.9736, test_loss: 0.9809, test_f1: 0.4608
 epoch: 60, train_loss: 0.9644, test_loss: 0.9718, test_f1: 0.4723
 epoch: 61, train_loss: 0.9759, test_loss: 0.9630, test_f1: 0.4695
 epoch: 62, train_loss: 0.9752, test_loss: 0.9727, test_f1: 0.4698
 epoch: 63, train_loss: 0.9623, test_loss: 0.9567, test_f1: 0.4697
 epoch: 64, train_loss: 0.9740, test_loss: 0.9723, test_f1: 0.4727
 epoch: 65, train_loss: 0.9686, test_loss: 0.9675, test_f1: 0.4641
 epoch: 66, train_loss: 0.9640, test_loss: 0.9615, test_f1: 0.4768
 epoch: 67, train_loss: 0.9654, test_loss: 0.9660, test_f1: 0.4680
 epoch: 68, train_loss: 0.9634, test_loss: 0.9660, test_f1: 0.4577
 epoch: 69, train_loss: 0.9600, test_loss: 0.9580, test_f1: 0.4600
 epoch: 70, train_loss: 0.9624, test_loss: 0.9736, test_f1: 0.4667
 epoch: 71, train_loss: 0.9608, test_loss: 0.9597, test_f1: 0.4688
 epoch: 72, train_loss: 0.9638, test_loss: 0.9564, test_f1: 0.4659
 epoch: 73, train_loss: 0.9589, test_loss: 0.9555, test_f1: 0.4653
 epoch: 74, train_loss: 0.9617, test_loss: 0.9565, test_f1: 0.4854
 epoch: 75, train_loss: 0.9556, test_loss: 0.9555, test_f1: 0.4727
 epoch: 76, train_loss: 0.9575, test_loss: 0.9572, test_f1: 0.4807
 epoch: 77, train_loss: 0.9623, test_loss: 0.9532, test_f1: 0.4672
 epoch: 78, train_loss: 0.9559, test_loss: 0.9502, test_f1: 0.4849
 epoch: 79, train_loss: 0.9548, test_loss: 0.9539, test_f1: 0.4761
 epoch: 80, train_loss: 0.9511, test_loss: 0.9538, test_f1: 0.4653
 epoch: 81, train_loss: 0.9490, test_loss: 0.9574, test_f1: 0.4809
 epoch: 82, train_loss: 0.9574, test_loss: 0.9491, test_f1: 0.4798
 epoch: 83, train_loss: 0.9429, test_loss: 0.9505, test_f1: 0.4718
 epoch: 84, train_loss: 0.9487, test_loss: 0.9450, test_f1: 0.4602
 epoch: 85, train_loss: 0.9484, test_loss: 0.9553, test_f1: 0.4728
 epoch: 86, train_loss: 0.9483, test_loss: 0.9574, test_f1: 0.4756
 epoch: 87, train_loss: 0.9516, test_loss: 0.9519, test_f1: 0.4872
 epoch: 88, train_loss: 0.9485, test_loss: 0.9491, test_f1: 0.4894
 epoch: 89, train_loss: 0.9532, test_loss: 0.9531, test_f1: 0.4913
 epoch: 90, train_loss: 0.9455, test_loss: 0.9397, test_f1: 0.4862
 epoch: 91, train_loss: 0.9422, test_loss: 0.9490, test_f1: 0.4940
 epoch: 92, train_loss: 0.9499, test_loss: 0.9475, test_f1: 0.4892
 epoch: 93, train_loss: 0.9523, test_loss: 0.9523, test_f1: 0.4739
 epoch: 94, train_loss: 0.9418, test_loss: 0.9375, test_f1: 0.4873
 epoch: 95, train_loss: 0.9481, test_loss: 0.9558, test_f1: 0.4901
 epoch: 96, train_loss: 0.9477, test_loss: 0.9528, test_f1: 0.4915
 epoch: 97, train_loss: 0.9461, test_loss: 0.9534, test_f1: 0.4869
 epoch: 98, train_loss: 0.9433, test_loss: 0.9483, test_f1: 0.4750
 epoch: 99, train_loss: 0.9413, test_loss: 0.9430, test_f1: 0.4936
##################ITERATION #6 ****************************************
 epoch: 0, train_loss: 1.2988, test_loss: 1.1712, test_f1: 0.3029
 epoch: 1, train_loss: 1.2094, test_loss: 1.1326, test_f1: 0.3488
 epoch: 2, train_loss: 1.1693, test_loss: 1.0996, test_f1: 0.3565
 epoch: 3, train_loss: 1.1476, test_loss: 1.0789, test_f1: 0.3564
 epoch: 4, train_loss: 1.1261, test_loss: 1.0704, test_f1: 0.3602
 epoch: 5, train_loss: 1.1154, test_loss: 1.0606, test_f1: 0.3618
 epoch: 6, train_loss: 1.0958, test_loss: 1.0526, test_f1: 0.3742
 epoch: 7, train_loss: 1.0882, test_loss: 1.0370, test_f1: 0.3981
 epoch: 8, train_loss: 1.0836, test_loss: 1.0335, test_f1: 0.3867
 epoch: 9, train_loss: 1.0736, test_loss: 1.0387, test_f1: 0.4064
 epoch: 10, train_loss: 1.0689, test_loss: 1.0205, test_f1: 0.4162
 epoch: 11, train_loss: 1.0606, test_loss: 1.0182, test_f1: 0.4045
 epoch: 12, train_loss: 1.0448, test_loss: 1.0117, test_f1: 0.4322
 epoch: 13, train_loss: 1.0427, test_loss: 0.9995, test_f1: 0.4329
 epoch: 14, train_loss: 1.0358, test_loss: 1.0042, test_f1: 0.4329
 epoch: 15, train_loss: 1.0314, test_loss: 0.9956, test_f1: 0.4441
 epoch: 16, train_loss: 1.0243, test_loss: 0.9949, test_f1: 0.4484
 epoch: 17, train_loss: 1.0266, test_loss: 0.9810, test_f1: 0.4545
 epoch: 18, train_loss: 1.0182, test_loss: 0.9764, test_f1: 0.4454
 epoch: 19, train_loss: 1.0187, test_loss: 0.9771, test_f1: 0.4703
 epoch: 20, train_loss: 1.0166, test_loss: 0.9837, test_f1: 0.4629
 epoch: 21, train_loss: 1.0102, test_loss: 0.9783, test_f1: 0.4648
 epoch: 22, train_loss: 1.0113, test_loss: 0.9750, test_f1: 0.4586
 epoch: 23, train_loss: 1.0061, test_loss: 0.9811, test_f1: 0.4622
 epoch: 24, train_loss: 0.9941, test_loss: 0.9587, test_f1: 0.4535
 epoch: 25, train_loss: 0.9971, test_loss: 0.9595, test_f1: 0.4648
 epoch: 26, train_loss: 0.9919, test_loss: 0.9589, test_f1: 0.4699
 epoch: 27, train_loss: 0.9988, test_loss: 0.9532, test_f1: 0.4702
 epoch: 28, train_loss: 0.9931, test_loss: 0.9403, test_f1: 0.4796
 epoch: 29, train_loss: 0.9806, test_loss: 0.9493, test_f1: 0.4697
 epoch: 30, train_loss: 0.9820, test_loss: 0.9465, test_f1: 0.4794
 epoch: 31, train_loss: 0.9888, test_loss: 0.9499, test_f1: 0.4795
 epoch: 32, train_loss: 0.9795, test_loss: 0.9498, test_f1: 0.4756
 epoch: 33, train_loss: 0.9798, test_loss: 0.9416, test_f1: 0.4820
 epoch: 34, train_loss: 0.9734, test_loss: 0.9319, test_f1: 0.4806
 epoch: 35, train_loss: 0.9686, test_loss: 0.9300, test_f1: 0.4925
 epoch: 36, train_loss: 0.9674, test_loss: 0.9245, test_f1: 0.4947
 epoch: 37, train_loss: 0.9555, test_loss: 0.9476, test_f1: 0.4622
 epoch: 38, train_loss: 0.9571, test_loss: 0.9204, test_f1: 0.4955
 epoch: 39, train_loss: 0.9635, test_loss: 0.9211, test_f1: 0.5011
 epoch: 40, train_loss: 0.9513, test_loss: 0.9155, test_f1: 0.4889
 epoch: 41, train_loss: 0.9580, test_loss: 0.9249, test_f1: 0.4944
 epoch: 42, train_loss: 0.9512, test_loss: 0.9216, test_f1: 0.4917
 epoch: 43, train_loss: 0.9532, test_loss: 0.9127, test_f1: 0.5009
 epoch: 44, train_loss: 0.9555, test_loss: 0.9286, test_f1: 0.4842
 epoch: 45, train_loss: 0.9386, test_loss: 0.9084, test_f1: 0.5088
 epoch: 46, train_loss: 0.9434, test_loss: 0.9174, test_f1: 0.4992
 epoch: 47, train_loss: 0.9430, test_loss: 0.9084, test_f1: 0.5060
 epoch: 48, train_loss: 0.9479, test_loss: 0.8956, test_f1: 0.5169
 epoch: 49, train_loss: 0.9487, test_loss: 0.8985, test_f1: 0.5138
 epoch: 50, train_loss: 0.9341, test_loss: 0.9365, test_f1: 0.4991
 epoch: 51, train_loss: 0.9422, test_loss: 0.9154, test_f1: 0.4912
 epoch: 52, train_loss: 0.9445, test_loss: 0.8960, test_f1: 0.5121
 epoch: 53, train_loss: 0.9368, test_loss: 0.9090, test_f1: 0.4991
 epoch: 54, train_loss: 0.9336, test_loss: 0.9133, test_f1: 0.5093
 epoch: 55, train_loss: 0.9339, test_loss: 0.8922, test_f1: 0.5159
 epoch: 56, train_loss: 0.9464, test_loss: 0.8981, test_f1: 0.5176
 epoch: 57, train_loss: 0.9228, test_loss: 0.8976, test_f1: 0.5011
 epoch: 58, train_loss: 0.9356, test_loss: 0.9012, test_f1: 0.5052
 epoch: 59, train_loss: 0.9360, test_loss: 0.9016, test_f1: 0.4989
 epoch: 60, train_loss: 0.9239, test_loss: 0.9014, test_f1: 0.5113
 epoch: 61, train_loss: 0.9312, test_loss: 0.8915, test_f1: 0.5169
 epoch: 62, train_loss: 0.9277, test_loss: 0.8968, test_f1: 0.5019
 epoch: 63, train_loss: 0.9314, test_loss: 0.8848, test_f1: 0.5256
 epoch: 64, train_loss: 0.9338, test_loss: 0.8965, test_f1: 0.5104
 epoch: 65, train_loss: 0.9298, test_loss: 0.8985, test_f1: 0.5198
 epoch: 66, train_loss: 0.9282, test_loss: 0.8820, test_f1: 0.5138
 epoch: 67, train_loss: 0.9310, test_loss: 0.8897, test_f1: 0.5172
 epoch: 68, train_loss: 0.9280, test_loss: 0.8880, test_f1: 0.5202
 epoch: 69, train_loss: 0.9274, test_loss: 0.8838, test_f1: 0.5119
 epoch: 70, train_loss: 0.9160, test_loss: 0.8814, test_f1: 0.5267
 epoch: 71, train_loss: 0.9235, test_loss: 0.9051, test_f1: 0.5141
 epoch: 72, train_loss: 0.9222, test_loss: 0.8964, test_f1: 0.5123
 epoch: 73, train_loss: 0.9240, test_loss: 0.8983, test_f1: 0.5068
 epoch: 74, train_loss: 0.9054, test_loss: 0.9106, test_f1: 0.5075
 epoch: 75, train_loss: 0.9284, test_loss: 0.8983, test_f1: 0.5133
 epoch: 76, train_loss: 0.9263, test_loss: 0.9190, test_f1: 0.5008
 epoch: 77, train_loss: 0.9191, test_loss: 0.8747, test_f1: 0.5321
 epoch: 78, train_loss: 0.9306, test_loss: 0.8898, test_f1: 0.5063
 epoch: 79, train_loss: 0.9347, test_loss: 0.9000, test_f1: 0.4991
 epoch: 80, train_loss: 0.9233, test_loss: 0.9056, test_f1: 0.4847
 epoch: 81, train_loss: 0.9191, test_loss: 0.8833, test_f1: 0.5166
 epoch: 82, train_loss: 0.9199, test_loss: 0.8796, test_f1: 0.5246
 epoch: 83, train_loss: 0.9143, test_loss: 0.9029, test_f1: 0.4976
 epoch: 84, train_loss: 0.9216, test_loss: 0.9023, test_f1: 0.4917
 epoch: 85, train_loss: 0.9204, test_loss: 0.8931, test_f1: 0.5169
 epoch: 86, train_loss: 0.9226, test_loss: 0.8788, test_f1: 0.5261
 epoch: 87, train_loss: 0.9124, test_loss: 0.8892, test_f1: 0.5199
 epoch: 88, train_loss: 0.9102, test_loss: 0.8795, test_f1: 0.5343
 epoch: 89, train_loss: 0.9068, test_loss: 0.8848, test_f1: 0.5224
 epoch: 90, train_loss: 0.9088, test_loss: 0.9231, test_f1: 0.4987
 epoch: 91, train_loss: 0.9147, test_loss: 0.9045, test_f1: 0.4951
 epoch: 92, train_loss: 0.9038, test_loss: 0.8975, test_f1: 0.5217
 epoch: 93, train_loss: 0.8996, test_loss: 0.8908, test_f1: 0.5199
 epoch: 94, train_loss: 0.9181, test_loss: 0.9029, test_f1: 0.4950
 epoch: 95, train_loss: 0.9151, test_loss: 0.8924, test_f1: 0.5207
 epoch: 96, train_loss: 0.9060, test_loss: 0.8962, test_f1: 0.5039
 epoch: 97, train_loss: 0.9183, test_loss: 0.8924, test_f1: 0.5151
 epoch: 98, train_loss: 0.9047, test_loss: 0.9143, test_f1: 0.5043
 epoch: 99, train_loss: 0.9007, test_loss: 0.8907, test_f1: 0.5127
##################ITERATION #7 ****************************************
 epoch: 0, train_loss: 1.3556, test_loss: 1.2614, test_f1: 0.2570
 epoch: 1, train_loss: 1.2371, test_loss: 1.1883, test_f1: 0.3059
 epoch: 2, train_loss: 1.2062, test_loss: 1.1422, test_f1: 0.3197
 epoch: 3, train_loss: 1.1728, test_loss: 1.1205, test_f1: 0.3458
 epoch: 4, train_loss: 1.1480, test_loss: 1.1032, test_f1: 0.3504
 epoch: 5, train_loss: 1.1261, test_loss: 1.0859, test_f1: 0.3662
 epoch: 6, train_loss: 1.1132, test_loss: 1.0801, test_f1: 0.3533
 epoch: 7, train_loss: 1.0979, test_loss: 1.0705, test_f1: 0.3683
 epoch: 8, train_loss: 1.0883, test_loss: 1.0584, test_f1: 0.3606
 epoch: 9, train_loss: 1.0771, test_loss: 1.0527, test_f1: 0.3680
 epoch: 10, train_loss: 1.0658, test_loss: 1.0448, test_f1: 0.3776
 epoch: 11, train_loss: 1.0603, test_loss: 1.0382, test_f1: 0.3912
 epoch: 12, train_loss: 1.0523, test_loss: 1.0334, test_f1: 0.4163
 epoch: 13, train_loss: 1.0468, test_loss: 1.0316, test_f1: 0.4118
 epoch: 14, train_loss: 1.0410, test_loss: 1.0210, test_f1: 0.4626
 epoch: 15, train_loss: 1.0351, test_loss: 1.0272, test_f1: 0.4304
 epoch: 16, train_loss: 1.0344, test_loss: 1.0168, test_f1: 0.4689
 epoch: 17, train_loss: 1.0246, test_loss: 1.0127, test_f1: 0.4522
 epoch: 18, train_loss: 1.0127, test_loss: 1.0067, test_f1: 0.4726
 epoch: 19, train_loss: 1.0105, test_loss: 1.0041, test_f1: 0.4821
 epoch: 20, train_loss: 1.0155, test_loss: 0.9988, test_f1: 0.4794
 epoch: 21, train_loss: 1.0074, test_loss: 0.9929, test_f1: 0.4754
 epoch: 22, train_loss: 0.9970, test_loss: 0.9904, test_f1: 0.4864
 epoch: 23, train_loss: 0.9994, test_loss: 0.9838, test_f1: 0.5024
 epoch: 24, train_loss: 0.9959, test_loss: 0.9908, test_f1: 0.4897
 epoch: 25, train_loss: 0.9931, test_loss: 0.9821, test_f1: 0.4859
 epoch: 26, train_loss: 0.9868, test_loss: 0.9821, test_f1: 0.4845
 epoch: 27, train_loss: 0.9841, test_loss: 0.9804, test_f1: 0.4880
 epoch: 28, train_loss: 0.9801, test_loss: 0.9838, test_f1: 0.4911
 epoch: 29, train_loss: 0.9808, test_loss: 0.9729, test_f1: 0.4988
 epoch: 30, train_loss: 0.9742, test_loss: 0.9671, test_f1: 0.4933
 epoch: 31, train_loss: 0.9731, test_loss: 0.9739, test_f1: 0.4968
 epoch: 32, train_loss: 0.9712, test_loss: 0.9689, test_f1: 0.4878
 epoch: 33, train_loss: 0.9720, test_loss: 0.9648, test_f1: 0.4899
 epoch: 34, train_loss: 0.9753, test_loss: 0.9588, test_f1: 0.4912
 epoch: 35, train_loss: 0.9702, test_loss: 0.9574, test_f1: 0.4909
 epoch: 36, train_loss: 0.9731, test_loss: 0.9640, test_f1: 0.4945
 epoch: 37, train_loss: 0.9692, test_loss: 0.9714, test_f1: 0.5030
 epoch: 38, train_loss: 0.9609, test_loss: 0.9623, test_f1: 0.4994
 epoch: 39, train_loss: 0.9677, test_loss: 0.9610, test_f1: 0.4998
 epoch: 40, train_loss: 0.9647, test_loss: 0.9580, test_f1: 0.4994
 epoch: 41, train_loss: 0.9605, test_loss: 0.9525, test_f1: 0.4940
 epoch: 42, train_loss: 0.9563, test_loss: 0.9497, test_f1: 0.5042
 epoch: 43, train_loss: 0.9568, test_loss: 0.9459, test_f1: 0.5029
 epoch: 44, train_loss: 0.9524, test_loss: 0.9417, test_f1: 0.5048
 epoch: 45, train_loss: 0.9483, test_loss: 0.9426, test_f1: 0.5132
 epoch: 46, train_loss: 0.9530, test_loss: 0.9359, test_f1: 0.5121
 epoch: 47, train_loss: 0.9519, test_loss: 0.9302, test_f1: 0.5056
 epoch: 48, train_loss: 0.9422, test_loss: 0.9364, test_f1: 0.5108
 epoch: 49, train_loss: 0.9373, test_loss: 0.9281, test_f1: 0.5121
 epoch: 50, train_loss: 0.9472, test_loss: 0.9394, test_f1: 0.5129
 epoch: 51, train_loss: 0.9479, test_loss: 0.9310, test_f1: 0.5039
 epoch: 52, train_loss: 0.9336, test_loss: 0.9392, test_f1: 0.5056
 epoch: 53, train_loss: 0.9343, test_loss: 0.9342, test_f1: 0.5176
 epoch: 54, train_loss: 0.9407, test_loss: 0.9253, test_f1: 0.5129
 epoch: 55, train_loss: 0.9399, test_loss: 0.9142, test_f1: 0.5263
 epoch: 56, train_loss: 0.9349, test_loss: 0.9315, test_f1: 0.5037
 epoch: 57, train_loss: 0.9304, test_loss: 0.9256, test_f1: 0.5100
 epoch: 58, train_loss: 0.9336, test_loss: 0.9183, test_f1: 0.5140
 epoch: 59, train_loss: 0.9287, test_loss: 0.9182, test_f1: 0.5106
 epoch: 60, train_loss: 0.9432, test_loss: 0.9042, test_f1: 0.5072
 epoch: 61, train_loss: 0.9327, test_loss: 0.9012, test_f1: 0.5276
 epoch: 62, train_loss: 0.9268, test_loss: 0.8995, test_f1: 0.5217
 epoch: 63, train_loss: 0.9313, test_loss: 0.9031, test_f1: 0.5279
 epoch: 64, train_loss: 0.9315, test_loss: 0.8995, test_f1: 0.5126
 epoch: 65, train_loss: 0.9241, test_loss: 0.9005, test_f1: 0.5172
 epoch: 66, train_loss: 0.9184, test_loss: 0.9018, test_f1: 0.5168
 epoch: 67, train_loss: 0.9328, test_loss: 0.9091, test_f1: 0.5107
 epoch: 68, train_loss: 0.9237, test_loss: 0.8987, test_f1: 0.5322
 epoch: 69, train_loss: 0.9297, test_loss: 0.9027, test_f1: 0.5170
 epoch: 70, train_loss: 0.9288, test_loss: 0.9216, test_f1: 0.5147
 epoch: 71, train_loss: 0.9209, test_loss: 0.9104, test_f1: 0.5301
 epoch: 72, train_loss: 0.9236, test_loss: 0.9104, test_f1: 0.5090
 epoch: 73, train_loss: 0.9149, test_loss: 0.9076, test_f1: 0.5094
 epoch: 74, train_loss: 0.9173, test_loss: 0.9177, test_f1: 0.5105
 epoch: 75, train_loss: 0.9205, test_loss: 0.8960, test_f1: 0.5066
 epoch: 76, train_loss: 0.9148, test_loss: 0.9052, test_f1: 0.5163
 epoch: 77, train_loss: 0.9201, test_loss: 0.8924, test_f1: 0.5267
 epoch: 78, train_loss: 0.9130, test_loss: 0.9149, test_f1: 0.5208
 epoch: 79, train_loss: 0.9158, test_loss: 0.8888, test_f1: 0.5225
 epoch: 80, train_loss: 0.9083, test_loss: 0.8886, test_f1: 0.5258
 epoch: 81, train_loss: 0.9169, test_loss: 0.8981, test_f1: 0.5159
 epoch: 82, train_loss: 0.9083, test_loss: 0.8828, test_f1: 0.5375
 epoch: 83, train_loss: 0.9154, test_loss: 0.9001, test_f1: 0.5162
 epoch: 84, train_loss: 0.9081, test_loss: 0.8839, test_f1: 0.5309
 epoch: 85, train_loss: 0.9060, test_loss: 0.8963, test_f1: 0.5190
 epoch: 86, train_loss: 0.9159, test_loss: 0.9021, test_f1: 0.5078
 epoch: 87, train_loss: 0.9082, test_loss: 0.8948, test_f1: 0.5148
 epoch: 88, train_loss: 0.9163, test_loss: 0.8967, test_f1: 0.4999
 epoch: 89, train_loss: 0.9070, test_loss: 0.8870, test_f1: 0.5287
 epoch: 90, train_loss: 0.9016, test_loss: 0.8863, test_f1: 0.5181
 epoch: 91, train_loss: 0.8967, test_loss: 0.8870, test_f1: 0.5233
 epoch: 92, train_loss: 0.9095, test_loss: 0.8990, test_f1: 0.5145
 epoch: 93, train_loss: 0.9148, test_loss: 0.8859, test_f1: 0.5174
 epoch: 94, train_loss: 0.8942, test_loss: 0.8921, test_f1: 0.5205
 epoch: 95, train_loss: 0.9088, test_loss: 0.8861, test_f1: 0.5325
 epoch: 96, train_loss: 0.9009, test_loss: 0.8906, test_f1: 0.5176
 epoch: 97, train_loss: 0.9060, test_loss: 0.8852, test_f1: 0.5251
 epoch: 98, train_loss: 0.9051, test_loss: 0.8823, test_f1: 0.5338
 epoch: 99, train_loss: 0.9058, test_loss: 0.8880, test_f1: 0.5346
##################ITERATION #8 ****************************************
 epoch: 0, train_loss: 1.3512, test_loss: 1.2261, test_f1: 0.2671
 epoch: 1, train_loss: 1.2343, test_loss: 1.1843, test_f1: 0.3099
 epoch: 2, train_loss: 1.2173, test_loss: 1.1616, test_f1: 0.3147
 epoch: 3, train_loss: 1.1822, test_loss: 1.1291, test_f1: 0.3283
 epoch: 4, train_loss: 1.1717, test_loss: 1.1080, test_f1: 0.3394
 epoch: 5, train_loss: 1.1498, test_loss: 1.1049, test_f1: 0.3367
 epoch: 6, train_loss: 1.1392, test_loss: 1.0971, test_f1: 0.3367
 epoch: 7, train_loss: 1.1356, test_loss: 1.0802, test_f1: 0.3434
 epoch: 8, train_loss: 1.1232, test_loss: 1.0638, test_f1: 0.3530
 epoch: 9, train_loss: 1.1059, test_loss: 1.0668, test_f1: 0.3473
 epoch: 10, train_loss: 1.0919, test_loss: 1.0520, test_f1: 0.3810
 epoch: 11, train_loss: 1.0949, test_loss: 1.0473, test_f1: 0.3822
 epoch: 12, train_loss: 1.0780, test_loss: 1.0532, test_f1: 0.3869
 epoch: 13, train_loss: 1.0751, test_loss: 1.0353, test_f1: 0.3943
 epoch: 14, train_loss: 1.0691, test_loss: 1.0471, test_f1: 0.3934
 epoch: 15, train_loss: 1.0691, test_loss: 1.0244, test_f1: 0.4119
 epoch: 16, train_loss: 1.0585, test_loss: 1.0260, test_f1: 0.4192
 epoch: 17, train_loss: 1.0483, test_loss: 1.0243, test_f1: 0.4188
 epoch: 18, train_loss: 1.0472, test_loss: 1.0223, test_f1: 0.4117
 epoch: 19, train_loss: 1.0439, test_loss: 1.0083, test_f1: 0.4286
 epoch: 20, train_loss: 1.0437, test_loss: 1.0031, test_f1: 0.4350
 epoch: 21, train_loss: 1.0367, test_loss: 1.0088, test_f1: 0.4199
 epoch: 22, train_loss: 1.0290, test_loss: 1.0062, test_f1: 0.4493
 epoch: 23, train_loss: 1.0328, test_loss: 1.0166, test_f1: 0.4163
 epoch: 24, train_loss: 1.0241, test_loss: 0.9914, test_f1: 0.4644
 epoch: 25, train_loss: 1.0215, test_loss: 0.9990, test_f1: 0.4524
 epoch: 26, train_loss: 1.0121, test_loss: 0.9931, test_f1: 0.4617
 epoch: 27, train_loss: 1.0258, test_loss: 0.9951, test_f1: 0.4641
 epoch: 28, train_loss: 1.0105, test_loss: 0.9856, test_f1: 0.4600
 epoch: 29, train_loss: 1.0101, test_loss: 0.9762, test_f1: 0.4591
 epoch: 30, train_loss: 1.0032, test_loss: 1.0069, test_f1: 0.4444
 epoch: 31, train_loss: 0.9997, test_loss: 0.9789, test_f1: 0.4637
 epoch: 32, train_loss: 0.9937, test_loss: 0.9756, test_f1: 0.4652
 epoch: 33, train_loss: 1.0001, test_loss: 0.9770, test_f1: 0.4587
 epoch: 34, train_loss: 0.9944, test_loss: 0.9954, test_f1: 0.4617
 epoch: 35, train_loss: 0.9918, test_loss: 0.9715, test_f1: 0.4658
 epoch: 36, train_loss: 0.9965, test_loss: 0.9790, test_f1: 0.4690
 epoch: 37, train_loss: 0.9938, test_loss: 0.9722, test_f1: 0.4701
 epoch: 38, train_loss: 0.9838, test_loss: 0.9669, test_f1: 0.4719
 epoch: 39, train_loss: 0.9893, test_loss: 0.9742, test_f1: 0.4857
 epoch: 40, train_loss: 0.9740, test_loss: 0.9725, test_f1: 0.4774
 epoch: 41, train_loss: 0.9839, test_loss: 0.9670, test_f1: 0.4675
 epoch: 42, train_loss: 0.9763, test_loss: 0.9566, test_f1: 0.4692
 epoch: 43, train_loss: 0.9772, test_loss: 0.9499, test_f1: 0.4817
 epoch: 44, train_loss: 0.9763, test_loss: 0.9643, test_f1: 0.4807
 epoch: 45, train_loss: 0.9798, test_loss: 0.9630, test_f1: 0.4814
 epoch: 46, train_loss: 0.9702, test_loss: 0.9544, test_f1: 0.4851
 epoch: 47, train_loss: 0.9634, test_loss: 0.9498, test_f1: 0.4804
 epoch: 48, train_loss: 0.9618, test_loss: 0.9612, test_f1: 0.4839
 epoch: 49, train_loss: 0.9674, test_loss: 0.9477, test_f1: 0.4978
 epoch: 50, train_loss: 0.9652, test_loss: 0.9441, test_f1: 0.4898
 epoch: 51, train_loss: 0.9571, test_loss: 0.9501, test_f1: 0.4813
 epoch: 52, train_loss: 0.9620, test_loss: 0.9406, test_f1: 0.4992
 epoch: 53, train_loss: 0.9652, test_loss: 0.9522, test_f1: 0.4893
 epoch: 54, train_loss: 0.9649, test_loss: 0.9493, test_f1: 0.4901
 epoch: 55, train_loss: 0.9624, test_loss: 0.9480, test_f1: 0.4803
 epoch: 56, train_loss: 0.9590, test_loss: 0.9443, test_f1: 0.4825
 epoch: 57, train_loss: 0.9553, test_loss: 0.9344, test_f1: 0.4886
 epoch: 58, train_loss: 0.9477, test_loss: 0.9378, test_f1: 0.4811
 epoch: 59, train_loss: 0.9504, test_loss: 0.9543, test_f1: 0.4908
 epoch: 60, train_loss: 0.9464, test_loss: 0.9338, test_f1: 0.4881
 epoch: 61, train_loss: 0.9547, test_loss: 0.9273, test_f1: 0.4955
 epoch: 62, train_loss: 0.9522, test_loss: 0.9351, test_f1: 0.4919
 epoch: 63, train_loss: 0.9479, test_loss: 0.9335, test_f1: 0.4949
 epoch: 64, train_loss: 0.9458, test_loss: 0.9306, test_f1: 0.4995
 epoch: 65, train_loss: 0.9423, test_loss: 0.9262, test_f1: 0.5011
 epoch: 66, train_loss: 0.9525, test_loss: 0.9366, test_f1: 0.5000
 epoch: 67, train_loss: 0.9426, test_loss: 0.9303, test_f1: 0.4997
 epoch: 68, train_loss: 0.9564, test_loss: 0.9319, test_f1: 0.4982
 epoch: 69, train_loss: 0.9455, test_loss: 0.9446, test_f1: 0.4810
 epoch: 70, train_loss: 0.9445, test_loss: 0.9236, test_f1: 0.5025
 epoch: 71, train_loss: 0.9385, test_loss: 0.9215, test_f1: 0.4934
 epoch: 72, train_loss: 0.9509, test_loss: 0.9239, test_f1: 0.4926
 epoch: 73, train_loss: 0.9472, test_loss: 0.9323, test_f1: 0.4932
 epoch: 74, train_loss: 0.9385, test_loss: 0.9229, test_f1: 0.4968
 epoch: 75, train_loss: 0.9418, test_loss: 0.9224, test_f1: 0.5027
 epoch: 76, train_loss: 0.9465, test_loss: 0.9282, test_f1: 0.5023
 epoch: 77, train_loss: 0.9452, test_loss: 0.9240, test_f1: 0.5023
 epoch: 78, train_loss: 0.9395, test_loss: 0.9194, test_f1: 0.5153
 epoch: 79, train_loss: 0.9346, test_loss: 0.9207, test_f1: 0.5135
 epoch: 80, train_loss: 0.9433, test_loss: 0.9185, test_f1: 0.4977
 epoch: 81, train_loss: 0.9371, test_loss: 0.9146, test_f1: 0.5011
 epoch: 82, train_loss: 0.9347, test_loss: 0.9101, test_f1: 0.5157
 epoch: 83, train_loss: 0.9391, test_loss: 0.9267, test_f1: 0.4823
 epoch: 84, train_loss: 0.9332, test_loss: 0.9144, test_f1: 0.5062
 epoch: 85, train_loss: 0.9361, test_loss: 0.9168, test_f1: 0.5053
 epoch: 86, train_loss: 0.9350, test_loss: 0.9260, test_f1: 0.4988
 epoch: 87, train_loss: 0.9341, test_loss: 0.9145, test_f1: 0.4833
 epoch: 88, train_loss: 0.9362, test_loss: 0.9131, test_f1: 0.5046
 epoch: 89, train_loss: 0.9315, test_loss: 0.9098, test_f1: 0.5142
 epoch: 90, train_loss: 0.9349, test_loss: 0.9108, test_f1: 0.5115
 epoch: 91, train_loss: 0.9345, test_loss: 0.9067, test_f1: 0.5004
 epoch: 92, train_loss: 0.9354, test_loss: 0.9115, test_f1: 0.5026
 epoch: 93, train_loss: 0.9466, test_loss: 0.9111, test_f1: 0.5028
 epoch: 94, train_loss: 0.9244, test_loss: 0.9075, test_f1: 0.5020
 epoch: 95, train_loss: 0.9318, test_loss: 0.9101, test_f1: 0.5133
 epoch: 96, train_loss: 0.9255, test_loss: 0.9068, test_f1: 0.5018
 epoch: 97, train_loss: 0.9332, test_loss: 0.9049, test_f1: 0.5053
 epoch: 98, train_loss: 0.9265, test_loss: 0.9048, test_f1: 0.5114
 epoch: 99, train_loss: 0.9278, test_loss: 0.9013, test_f1: 0.5209
##################ITERATION #9 ****************************************
 epoch: 0, train_loss: 1.3201, test_loss: 1.1661, test_f1: 0.3050
 epoch: 1, train_loss: 1.2142, test_loss: 1.1231, test_f1: 0.3638
 epoch: 2, train_loss: 1.1839, test_loss: 1.1084, test_f1: 0.3866
 epoch: 3, train_loss: 1.1485, test_loss: 1.0828, test_f1: 0.4015
 epoch: 4, train_loss: 1.1411, test_loss: 1.0725, test_f1: 0.4227
 epoch: 5, train_loss: 1.1291, test_loss: 1.0561, test_f1: 0.4217
 epoch: 6, train_loss: 1.1122, test_loss: 1.0385, test_f1: 0.4313
 epoch: 7, train_loss: 1.1001, test_loss: 1.0322, test_f1: 0.4300
 epoch: 8, train_loss: 1.0996, test_loss: 1.0223, test_f1: 0.4377
 epoch: 9, train_loss: 1.0870, test_loss: 1.0172, test_f1: 0.4443
 epoch: 10, train_loss: 1.0780, test_loss: 1.0067, test_f1: 0.4544
 epoch: 11, train_loss: 1.0676, test_loss: 1.0043, test_f1: 0.4357
 epoch: 12, train_loss: 1.0580, test_loss: 1.0007, test_f1: 0.4454
 epoch: 13, train_loss: 1.0554, test_loss: 1.0012, test_f1: 0.4485
 epoch: 14, train_loss: 1.0397, test_loss: 0.9879, test_f1: 0.4613
 epoch: 15, train_loss: 1.0438, test_loss: 0.9918, test_f1: 0.4561
 epoch: 16, train_loss: 1.0372, test_loss: 0.9847, test_f1: 0.4468
 epoch: 17, train_loss: 1.0402, test_loss: 0.9770, test_f1: 0.4555
 epoch: 18, train_loss: 1.0370, test_loss: 0.9804, test_f1: 0.4545
 epoch: 19, train_loss: 1.0303, test_loss: 0.9714, test_f1: 0.4623
 epoch: 20, train_loss: 1.0214, test_loss: 0.9727, test_f1: 0.4551
 epoch: 21, train_loss: 1.0183, test_loss: 0.9676, test_f1: 0.4699
 epoch: 22, train_loss: 1.0210, test_loss: 0.9710, test_f1: 0.4760
 epoch: 23, train_loss: 1.0104, test_loss: 0.9673, test_f1: 0.4625
 epoch: 24, train_loss: 1.0036, test_loss: 0.9618, test_f1: 0.4703
 epoch: 25, train_loss: 1.0085, test_loss: 0.9633, test_f1: 0.4817
 epoch: 26, train_loss: 0.9931, test_loss: 0.9510, test_f1: 0.4732
 epoch: 27, train_loss: 0.9952, test_loss: 0.9537, test_f1: 0.4764
 epoch: 28, train_loss: 0.9987, test_loss: 0.9494, test_f1: 0.4750
 epoch: 29, train_loss: 0.9829, test_loss: 0.9561, test_f1: 0.4700
 epoch: 30, train_loss: 0.9857, test_loss: 0.9540, test_f1: 0.4704
 epoch: 31, train_loss: 0.9989, test_loss: 0.9513, test_f1: 0.4678
 epoch: 32, train_loss: 0.9856, test_loss: 0.9479, test_f1: 0.4813
 epoch: 33, train_loss: 0.9828, test_loss: 0.9436, test_f1: 0.4874
 epoch: 34, train_loss: 0.9749, test_loss: 0.9390, test_f1: 0.4806
 epoch: 35, train_loss: 0.9801, test_loss: 0.9418, test_f1: 0.4964
 epoch: 36, train_loss: 0.9848, test_loss: 0.9396, test_f1: 0.4838
 epoch: 37, train_loss: 0.9704, test_loss: 0.9398, test_f1: 0.4877
 epoch: 38, train_loss: 0.9744, test_loss: 0.9326, test_f1: 0.5078
 epoch: 39, train_loss: 0.9693, test_loss: 0.9320, test_f1: 0.4995
 epoch: 40, train_loss: 0.9790, test_loss: 0.9331, test_f1: 0.5046
 epoch: 41, train_loss: 0.9704, test_loss: 0.9285, test_f1: 0.5060
 epoch: 42, train_loss: 0.9681, test_loss: 0.9349, test_f1: 0.5060
 epoch: 43, train_loss: 0.9634, test_loss: 0.9361, test_f1: 0.4904
 epoch: 44, train_loss: 0.9736, test_loss: 0.9382, test_f1: 0.4974
 epoch: 45, train_loss: 0.9626, test_loss: 0.9443, test_f1: 0.4942
 epoch: 46, train_loss: 0.9607, test_loss: 0.9329, test_f1: 0.5019
 epoch: 47, train_loss: 0.9653, test_loss: 0.9248, test_f1: 0.4990
 epoch: 48, train_loss: 0.9590, test_loss: 0.9262, test_f1: 0.5067
 epoch: 49, train_loss: 0.9608, test_loss: 0.9353, test_f1: 0.5047
 epoch: 50, train_loss: 0.9601, test_loss: 0.9239, test_f1: 0.4838
 epoch: 51, train_loss: 0.9496, test_loss: 0.9292, test_f1: 0.5048
 epoch: 52, train_loss: 0.9555, test_loss: 0.9297, test_f1: 0.5098
 epoch: 53, train_loss: 0.9492, test_loss: 0.9284, test_f1: 0.5146
 epoch: 54, train_loss: 0.9451, test_loss: 0.9322, test_f1: 0.5013
 epoch: 55, train_loss: 0.9575, test_loss: 0.9319, test_f1: 0.5156
 epoch: 56, train_loss: 0.9564, test_loss: 0.9353, test_f1: 0.5102
 epoch: 57, train_loss: 0.9441, test_loss: 0.9245, test_f1: 0.5061
 epoch: 58, train_loss: 0.9576, test_loss: 0.9234, test_f1: 0.5061
 epoch: 59, train_loss: 0.9486, test_loss: 0.9316, test_f1: 0.5044
 epoch: 60, train_loss: 0.9497, test_loss: 0.9205, test_f1: 0.5158
 epoch: 61, train_loss: 0.9505, test_loss: 0.9347, test_f1: 0.5098
 epoch: 62, train_loss: 0.9445, test_loss: 0.9183, test_f1: 0.5075
 epoch: 63, train_loss: 0.9508, test_loss: 0.9191, test_f1: 0.5115
 epoch: 64, train_loss: 0.9498, test_loss: 0.9247, test_f1: 0.5062
 epoch: 65, train_loss: 0.9403, test_loss: 0.9215, test_f1: 0.5101
 epoch: 66, train_loss: 0.9355, test_loss: 0.9214, test_f1: 0.5105
 epoch: 67, train_loss: 0.9360, test_loss: 0.9271, test_f1: 0.5056
 epoch: 68, train_loss: 0.9447, test_loss: 0.9294, test_f1: 0.5078
 epoch: 69, train_loss: 0.9391, test_loss: 0.9391, test_f1: 0.4997
 epoch: 70, train_loss: 0.9470, test_loss: 0.9202, test_f1: 0.5101
 epoch: 71, train_loss: 0.9528, test_loss: 0.9164, test_f1: 0.5175
 epoch: 72, train_loss: 0.9525, test_loss: 0.9210, test_f1: 0.5147
 epoch: 73, train_loss: 0.9320, test_loss: 0.9191, test_f1: 0.5175
 epoch: 74, train_loss: 0.9358, test_loss: 0.9318, test_f1: 0.5050
 epoch: 75, train_loss: 0.9414, test_loss: 0.9194, test_f1: 0.5196
 epoch: 76, train_loss: 0.9376, test_loss: 0.9119, test_f1: 0.5146
 epoch: 77, train_loss: 0.9363, test_loss: 0.9148, test_f1: 0.5066
 epoch: 78, train_loss: 0.9413, test_loss: 0.9099, test_f1: 0.5164
 epoch: 79, train_loss: 0.9346, test_loss: 0.9163, test_f1: 0.5340
 epoch: 80, train_loss: 0.9364, test_loss: 0.9076, test_f1: 0.5099
 epoch: 81, train_loss: 0.9452, test_loss: 0.9190, test_f1: 0.5128
 epoch: 82, train_loss: 0.9384, test_loss: 0.9068, test_f1: 0.5221
 epoch: 83, train_loss: 0.9327, test_loss: 0.9234, test_f1: 0.5131
 epoch: 84, train_loss: 0.9384, test_loss: 0.9054, test_f1: 0.5217
 epoch: 85, train_loss: 0.9289, test_loss: 0.9193, test_f1: 0.5143
 epoch: 86, train_loss: 0.9404, test_loss: 0.9132, test_f1: 0.5105
 epoch: 87, train_loss: 0.9336, test_loss: 0.9141, test_f1: 0.5085
 epoch: 88, train_loss: 0.9450, test_loss: 0.9181, test_f1: 0.5104
 epoch: 89, train_loss: 0.9391, test_loss: 0.9192, test_f1: 0.5153
 epoch: 90, train_loss: 0.9257, test_loss: 0.9173, test_f1: 0.5165
 epoch: 91, train_loss: 0.9266, test_loss: 0.9212, test_f1: 0.5119
 epoch: 92, train_loss: 0.9379, test_loss: 0.9130, test_f1: 0.5153
 epoch: 93, train_loss: 0.9312, test_loss: 0.9075, test_f1: 0.5126
 epoch: 94, train_loss: 0.9281, test_loss: 0.9115, test_f1: 0.5158
 epoch: 95, train_loss: 0.9220, test_loss: 0.9115, test_f1: 0.5171
 epoch: 96, train_loss: 0.9295, test_loss: 0.9214, test_f1: 0.5136
 epoch: 97, train_loss: 0.9272, test_loss: 0.9096, test_f1: 0.5225
 epoch: 98, train_loss: 0.9353, test_loss: 0.9327, test_f1: 0.5095
 epoch: 99, train_loss: 0.9377, test_loss: 0.9387, test_f1: 0.5095

Training completed in 1418.89 seconds
Best F1: 0.5375 at epoch 82
Mean F1 across iterations: 0.5173  0.0191
========================FINAL RESULTS================================
FEGIN weighted F1: 0.5375  0.0191
python main.py --data ltspice_examples --representation component_pin_net --model FEGIN --layers 6 --hiddens 16 --batch_size 32 --lr 0.0001 --emb_size 250 --epochs 100 --save_appendix component_pin_net_L6_H16_BS32_LR0.0001_E250 --no_val
-----



STDERR:
  File "main.py", line 370, in <module>
    main()
  File "main.py", line 254, in main
    dataset = dataset_class(
  File "/home/philip/projects/ltspice_examples_code_repo/Circuit-Completion-Using-GNNs/component_classification_with_link_prediction_head/evaluation/FEGIN/kernel/circuit_datasets.py", line 15, in __init__
    self.data, self.slices = torch.load(self.processed_paths[0])
  File "/home/philip/.local/lib/python3.8/site-packages/torch/serialization.py", line 1040, in load
    warnings.warn(
  File "/usr/lib/python3.8/warnings.py", line 109, in _showwarnmsg
    sw(msg.message, msg.category, msg.filename, msg.lineno,
  File "main.py", line 47, in warn_with_traceback
    traceback.print_stack(file=log)
/home/philip/projects/ltspice_examples_code_repo/Circuit-Completion-Using-GNNs/component_classification_with_link_prediction_head/evaluation/FEGIN/kernel/circuit_datasets.py:15: FutureWarning: You are using `torch.load` with `weights_only=False` (the current default value), which uses the default pickle module implicitly. It is possible to construct malicious pickle data which will execute arbitrary code during unpickling (See https://github.com/pytorch/pytorch/blob/main/SECURITY.md#untrusted-models for more details). In a future release, the default value for `weights_only` will be flipped to `True`. This limits the functions that could be executed during unpickling. Arbitrary objects will no longer be allowed to be loaded via this mode unless they are explicitly allowlisted by the user via `torch.serialization.add_safe_globals`. We recommend you start setting `weights_only=True` for any use case where you don't have full control of the loaded file. Please open an issue on GitHub for any issues related to this experimental feature.
  self.data, self.slices = torch.load(self.processed_paths[0])
