STDOUT:
Results will be saved in /home/philip/projects/ltspice_examples_code_repo/Circuit-Completion-Using-GNNs/component_classification_with_link_prediction_head/evaluation/FEGIN/results/model_FEGIN_dataset_ltspice_examples
Command line input: python main.py --data ltspice_examples --representation component_net --model FEGIN --layers 6 --hiddens 128 --batch_size 128 --lr 0.001 --emb_size 128 --epochs 100 --save_appendix component_net_L6_H128_BS128_LR0.001_E128 --no_val
 is saved.
-----
ltspice_examples - FEGIN
Using 6 layers, 128 hidden units, h = 2
Loading component_net representation dataset
ENTERED
Training FEGIN on component_net representation
Train: 3558, Test: 846
##################ITERATION #0 ****************************************
 epoch: 0, train_loss: 1.2177, test_loss: 1.2683, test_f1: 0.3125
 epoch: 1, train_loss: 1.0388, test_loss: 0.9760, test_f1: 0.4696
 epoch: 2, train_loss: 0.9639, test_loss: 0.9430, test_f1: 0.5193
 epoch: 3, train_loss: 0.9217, test_loss: 0.9676, test_f1: 0.5169
 epoch: 4, train_loss: 0.9007, test_loss: 0.9350, test_f1: 0.5095
 epoch: 5, train_loss: 0.8903, test_loss: 0.9022, test_f1: 0.5170
 epoch: 6, train_loss: 0.8518, test_loss: 0.9389, test_f1: 0.5491
 epoch: 7, train_loss: 0.8554, test_loss: 0.9788, test_f1: 0.5447
 epoch: 8, train_loss: 0.8268, test_loss: 0.8448, test_f1: 0.5552
 epoch: 9, train_loss: 0.8156, test_loss: 0.8841, test_f1: 0.5758
 epoch: 10, train_loss: 0.8015, test_loss: 1.0298, test_f1: 0.5750
 epoch: 11, train_loss: 0.7734, test_loss: 1.1097, test_f1: 0.5405
 epoch: 12, train_loss: 0.7804, test_loss: 0.8138, test_f1: 0.5953
 epoch: 13, train_loss: 0.7665, test_loss: 0.9150, test_f1: 0.6356
 epoch: 14, train_loss: 0.7448, test_loss: 0.9007, test_f1: 0.6264
 epoch: 15, train_loss: 0.7389, test_loss: 0.9841, test_f1: 0.5959
 epoch: 16, train_loss: 0.7079, test_loss: 0.9022, test_f1: 0.6177
 epoch: 17, train_loss: 0.7000, test_loss: 1.0192, test_f1: 0.5954
 epoch: 18, train_loss: 0.7002, test_loss: 0.9426, test_f1: 0.5956
 epoch: 19, train_loss: 0.7054, test_loss: 1.0148, test_f1: 0.5667
 epoch: 20, train_loss: 0.6871, test_loss: 0.9874, test_f1: 0.6141
 epoch: 21, train_loss: 0.6785, test_loss: 1.0197, test_f1: 0.5997
 epoch: 22, train_loss: 0.6542, test_loss: 0.9275, test_f1: 0.6334
 epoch: 23, train_loss: 0.6574, test_loss: 1.0873, test_f1: 0.5734
 epoch: 24, train_loss: 0.6438, test_loss: 0.9213, test_f1: 0.6603
 epoch: 25, train_loss: 0.6359, test_loss: 0.9417, test_f1: 0.5702
 epoch: 26, train_loss: 0.6417, test_loss: 1.0194, test_f1: 0.6176
 epoch: 27, train_loss: 0.6186, test_loss: 1.0054, test_f1: 0.6040
 epoch: 28, train_loss: 0.6067, test_loss: 1.0641, test_f1: 0.6271
 epoch: 29, train_loss: 0.5812, test_loss: 1.0174, test_f1: 0.6246
 epoch: 30, train_loss: 0.6018, test_loss: 1.0642, test_f1: 0.6041
 epoch: 31, train_loss: 0.5852, test_loss: 1.0242, test_f1: 0.6124
 epoch: 32, train_loss: 0.5840, test_loss: 1.0350, test_f1: 0.6164
 epoch: 33, train_loss: 0.5561, test_loss: 0.9695, test_f1: 0.6577
 epoch: 34, train_loss: 0.5228, test_loss: 0.9952, test_f1: 0.6626
 epoch: 35, train_loss: 0.5146, test_loss: 1.0863, test_f1: 0.6661
 epoch: 36, train_loss: 0.5149, test_loss: 1.0857, test_f1: 0.6175
 epoch: 37, train_loss: 0.5041, test_loss: 1.0330, test_f1: 0.6676
 epoch: 38, train_loss: 0.4888, test_loss: 1.1379, test_f1: 0.6322
 epoch: 39, train_loss: 0.5100, test_loss: 1.1261, test_f1: 0.6292
 epoch: 40, train_loss: 0.4920, test_loss: 1.1018, test_f1: 0.6476
 epoch: 41, train_loss: 0.4847, test_loss: 1.2303, test_f1: 0.6081
 epoch: 42, train_loss: 0.4863, test_loss: 1.2968, test_f1: 0.6008
 epoch: 43, train_loss: 0.4582, test_loss: 1.1759, test_f1: 0.6538
 epoch: 44, train_loss: 0.4507, test_loss: 1.2594, test_f1: 0.6557
 epoch: 45, train_loss: 0.4161, test_loss: 1.1920, test_f1: 0.6300
 epoch: 46, train_loss: 0.4235, test_loss: 1.2085, test_f1: 0.6270
 epoch: 47, train_loss: 0.4104, test_loss: 1.3432, test_f1: 0.6426
 epoch: 48, train_loss: 0.4371, test_loss: 1.2714, test_f1: 0.6261
 epoch: 49, train_loss: 0.4022, test_loss: 1.2367, test_f1: 0.6455
 epoch: 50, train_loss: 0.3962, test_loss: 1.4012, test_f1: 0.6088
 epoch: 51, train_loss: 0.3447, test_loss: 1.3241, test_f1: 0.6391
 epoch: 52, train_loss: 0.3125, test_loss: 1.3868, test_f1: 0.6549
 epoch: 53, train_loss: 0.3027, test_loss: 1.4543, test_f1: 0.6563
 epoch: 54, train_loss: 0.2934, test_loss: 1.4331, test_f1: 0.6584
 epoch: 55, train_loss: 0.2883, test_loss: 1.4653, test_f1: 0.6474
 epoch: 56, train_loss: 0.2888, test_loss: 1.4570, test_f1: 0.6670
 epoch: 57, train_loss: 0.2605, test_loss: 1.4659, test_f1: 0.6485
 epoch: 58, train_loss: 0.2371, test_loss: 1.7019, test_f1: 0.6641
 epoch: 59, train_loss: 0.2605, test_loss: 1.5980, test_f1: 0.6692
 epoch: 60, train_loss: 0.2597, test_loss: 1.6135, test_f1: 0.6707
 epoch: 61, train_loss: 0.2484, test_loss: 1.6953, test_f1: 0.6646
 epoch: 62, train_loss: 0.2305, test_loss: 1.8221, test_f1: 0.6269
 epoch: 63, train_loss: 0.2428, test_loss: 1.6590, test_f1: 0.6681
 epoch: 64, train_loss: 0.2423, test_loss: 1.7747, test_f1: 0.6806
 epoch: 65, train_loss: 0.2319, test_loss: 1.8059, test_f1: 0.6429
 epoch: 66, train_loss: 0.2425, test_loss: 1.8921, test_f1: 0.6230
 epoch: 67, train_loss: 0.2438, test_loss: 1.8531, test_f1: 0.6151
 epoch: 68, train_loss: 0.2401, test_loss: 1.7499, test_f1: 0.6599
 epoch: 69, train_loss: 0.2062, test_loss: 1.9489, test_f1: 0.6254
 epoch: 70, train_loss: 0.2345, test_loss: 1.8977, test_f1: 0.6230
 epoch: 71, train_loss: 0.2257, test_loss: 1.7689, test_f1: 0.6507
 epoch: 72, train_loss: 0.2151, test_loss: 1.9893, test_f1: 0.6396
 epoch: 73, train_loss: 0.2205, test_loss: 1.7979, test_f1: 0.6557
 epoch: 74, train_loss: 0.2024, test_loss: 1.8554, test_f1: 0.6607
 epoch: 75, train_loss: 0.1909, test_loss: 1.9027, test_f1: 0.6515
 epoch: 76, train_loss: 0.2001, test_loss: 1.8014, test_f1: 0.6761
 epoch: 77, train_loss: 0.2106, test_loss: 1.8448, test_f1: 0.6576
 epoch: 78, train_loss: 0.2165, test_loss: 1.9626, test_f1: 0.6957
 epoch: 79, train_loss: 0.1891, test_loss: 1.9969, test_f1: 0.6443
 epoch: 80, train_loss: 0.1846, test_loss: 1.9758, test_f1: 0.6420
 epoch: 81, train_loss: 0.1841, test_loss: 1.9657, test_f1: 0.6446
 epoch: 82, train_loss: 0.1950, test_loss: 1.9078, test_f1: 0.6564
 epoch: 83, train_loss: 0.1645, test_loss: 2.3039, test_f1: 0.6383
 epoch: 84, train_loss: 0.1823, test_loss: 2.2924, test_f1: 0.6352
 epoch: 85, train_loss: 0.1865, test_loss: 2.2088, test_f1: 0.6463
 epoch: 86, train_loss: 0.1813, test_loss: 2.1182, test_f1: 0.6552
 epoch: 87, train_loss: 0.1799, test_loss: 2.1210, test_f1: 0.6490
 epoch: 88, train_loss: 0.1656, test_loss: 2.1924, test_f1: 0.6561
 epoch: 89, train_loss: 0.1866, test_loss: 2.1834, test_f1: 0.6649
 epoch: 90, train_loss: 0.1658, test_loss: 2.3616, test_f1: 0.6291
 epoch: 91, train_loss: 0.1560, test_loss: 2.3251, test_f1: 0.6425
 epoch: 92, train_loss: 0.1763, test_loss: 2.1670, test_f1: 0.6544
 epoch: 93, train_loss: 0.1974, test_loss: 2.2988, test_f1: 0.6406
 epoch: 94, train_loss: 0.1883, test_loss: 2.2108, test_f1: 0.6415
 epoch: 95, train_loss: 0.1521, test_loss: 2.1892, test_f1: 0.6428
 epoch: 96, train_loss: 0.1488, test_loss: 2.1689, test_f1: 0.6508
 epoch: 97, train_loss: 0.1524, test_loss: 2.2269, test_f1: 0.6529
 epoch: 98, train_loss: 0.1618, test_loss: 2.2226, test_f1: 0.6431
 epoch: 99, train_loss: 0.1504, test_loss: 2.3390, test_f1: 0.6343
##################ITERATION #1 ****************************************
 epoch: 0, train_loss: 1.1570, test_loss: 1.1728, test_f1: 0.3454
 epoch: 1, train_loss: 0.9968, test_loss: 0.9425, test_f1: 0.5144
 epoch: 2, train_loss: 0.9285, test_loss: 0.9954, test_f1: 0.4711
 epoch: 3, train_loss: 0.9236, test_loss: 0.9369, test_f1: 0.5305
 epoch: 4, train_loss: 0.8943, test_loss: 0.8778, test_f1: 0.5511
 epoch: 5, train_loss: 0.8825, test_loss: 0.9190, test_f1: 0.5876
 epoch: 6, train_loss: 0.8702, test_loss: 0.9044, test_f1: 0.5226
 epoch: 7, train_loss: 0.8301, test_loss: 1.0087, test_f1: 0.5399
 epoch: 8, train_loss: 0.8184, test_loss: 0.9443, test_f1: 0.5892
 epoch: 9, train_loss: 0.8083, test_loss: 0.9189, test_f1: 0.5567
 epoch: 10, train_loss: 0.7977, test_loss: 0.9903, test_f1: 0.5588
 epoch: 11, train_loss: 0.7707, test_loss: 0.9118, test_f1: 0.5937
 epoch: 12, train_loss: 0.7567, test_loss: 0.9555, test_f1: 0.5648
 epoch: 13, train_loss: 0.7523, test_loss: 0.9951, test_f1: 0.5357
 epoch: 14, train_loss: 0.7551, test_loss: 0.9969, test_f1: 0.5826
 epoch: 15, train_loss: 0.7277, test_loss: 0.9845, test_f1: 0.5878
 epoch: 16, train_loss: 0.7140, test_loss: 0.9971, test_f1: 0.5924
 epoch: 17, train_loss: 0.7055, test_loss: 0.9525, test_f1: 0.5860
 epoch: 18, train_loss: 0.6917, test_loss: 0.9843, test_f1: 0.5950
 epoch: 19, train_loss: 0.6868, test_loss: 0.9934, test_f1: 0.5858
 epoch: 20, train_loss: 0.6773, test_loss: 0.9461, test_f1: 0.5930
 epoch: 21, train_loss: 0.6549, test_loss: 0.9088, test_f1: 0.6275
 epoch: 22, train_loss: 0.6642, test_loss: 0.9798, test_f1: 0.6245
 epoch: 23, train_loss: 0.6499, test_loss: 0.9879, test_f1: 0.5773
 epoch: 24, train_loss: 0.6382, test_loss: 0.9357, test_f1: 0.6260
 epoch: 25, train_loss: 0.6248, test_loss: 0.9380, test_f1: 0.6391
 epoch: 26, train_loss: 0.6038, test_loss: 0.9760, test_f1: 0.6299
 epoch: 27, train_loss: 0.5861, test_loss: 1.0634, test_f1: 0.6235
 epoch: 28, train_loss: 0.5851, test_loss: 0.9707, test_f1: 0.6260
 epoch: 29, train_loss: 0.5659, test_loss: 0.9736, test_f1: 0.6509
 epoch: 30, train_loss: 0.5551, test_loss: 1.0276, test_f1: 0.6678
 epoch: 31, train_loss: 0.5632, test_loss: 1.1116, test_f1: 0.5880
 epoch: 32, train_loss: 0.5723, test_loss: 0.9739, test_f1: 0.5978
 epoch: 33, train_loss: 0.5386, test_loss: 1.1410, test_f1: 0.6565
 epoch: 34, train_loss: 0.5300, test_loss: 1.0499, test_f1: 0.6425
 epoch: 35, train_loss: 0.5125, test_loss: 1.1603, test_f1: 0.6356
 epoch: 36, train_loss: 0.5220, test_loss: 1.0460, test_f1: 0.6494
 epoch: 37, train_loss: 0.4933, test_loss: 1.0088, test_f1: 0.6274
 epoch: 38, train_loss: 0.4920, test_loss: 1.3538, test_f1: 0.5870
 epoch: 39, train_loss: 0.4951, test_loss: 1.0883, test_f1: 0.6632
 epoch: 40, train_loss: 0.4808, test_loss: 1.0713, test_f1: 0.6655
 epoch: 41, train_loss: 0.4735, test_loss: 1.0754, test_f1: 0.6333
 epoch: 42, train_loss: 0.4412, test_loss: 1.0226, test_f1: 0.6595
 epoch: 43, train_loss: 0.4195, test_loss: 1.1942, test_f1: 0.6749
 epoch: 44, train_loss: 0.4482, test_loss: 1.1221, test_f1: 0.6723
 epoch: 45, train_loss: 0.4273, test_loss: 1.1405, test_f1: 0.6328
 epoch: 46, train_loss: 0.4055, test_loss: 1.1746, test_f1: 0.6709
 epoch: 47, train_loss: 0.4342, test_loss: 1.2907, test_f1: 0.6157
 epoch: 48, train_loss: 0.3924, test_loss: 1.4173, test_f1: 0.6293
 epoch: 49, train_loss: 0.3931, test_loss: 1.1056, test_f1: 0.6738
 epoch: 50, train_loss: 0.4075, test_loss: 1.2857, test_f1: 0.6423
 epoch: 51, train_loss: 0.3553, test_loss: 1.2251, test_f1: 0.6490
 epoch: 52, train_loss: 0.3011, test_loss: 1.3283, test_f1: 0.6607
 epoch: 53, train_loss: 0.3042, test_loss: 1.4345, test_f1: 0.6231
 epoch: 54, train_loss: 0.3019, test_loss: 1.5919, test_f1: 0.6175
 epoch: 55, train_loss: 0.3149, test_loss: 1.3181, test_f1: 0.6883
 epoch: 56, train_loss: 0.2796, test_loss: 1.3800, test_f1: 0.6715
 epoch: 57, train_loss: 0.2716, test_loss: 1.4007, test_f1: 0.6662
 epoch: 58, train_loss: 0.2849, test_loss: 1.5118, test_f1: 0.6502
 epoch: 59, train_loss: 0.2604, test_loss: 1.4637, test_f1: 0.6594
 epoch: 60, train_loss: 0.2624, test_loss: 1.5683, test_f1: 0.6683
 epoch: 61, train_loss: 0.2503, test_loss: 1.5138, test_f1: 0.6311
 epoch: 62, train_loss: 0.2382, test_loss: 1.6454, test_f1: 0.6218
 epoch: 63, train_loss: 0.2309, test_loss: 1.6388, test_f1: 0.6429
 epoch: 64, train_loss: 0.2222, test_loss: 1.7570, test_f1: 0.6474
 epoch: 65, train_loss: 0.2511, test_loss: 1.7381, test_f1: 0.6361
 epoch: 66, train_loss: 0.2248, test_loss: 1.5903, test_f1: 0.6689
 epoch: 67, train_loss: 0.2225, test_loss: 1.7912, test_f1: 0.6386
 epoch: 68, train_loss: 0.2189, test_loss: 2.1088, test_f1: 0.6105
 epoch: 69, train_loss: 0.2212, test_loss: 1.8051, test_f1: 0.6436
 epoch: 70, train_loss: 0.2219, test_loss: 1.8632, test_f1: 0.6175
 epoch: 71, train_loss: 0.2105, test_loss: 1.9396, test_f1: 0.6200
 epoch: 72, train_loss: 0.2049, test_loss: 1.7564, test_f1: 0.6553
 epoch: 73, train_loss: 0.2257, test_loss: 2.1185, test_f1: 0.6151
 epoch: 74, train_loss: 0.2260, test_loss: 1.7327, test_f1: 0.6386
 epoch: 75, train_loss: 0.2168, test_loss: 1.7308, test_f1: 0.6555
 epoch: 76, train_loss: 0.2130, test_loss: 1.8791, test_f1: 0.6555
 epoch: 77, train_loss: 0.2084, test_loss: 1.7485, test_f1: 0.6697
 epoch: 78, train_loss: 0.2273, test_loss: 1.7991, test_f1: 0.6548
 epoch: 79, train_loss: 0.1930, test_loss: 1.7393, test_f1: 0.6451
 epoch: 80, train_loss: 0.1902, test_loss: 1.9859, test_f1: 0.6376
 epoch: 81, train_loss: 0.1980, test_loss: 1.9076, test_f1: 0.6326
 epoch: 82, train_loss: 0.2048, test_loss: 2.1204, test_f1: 0.6380
 epoch: 83, train_loss: 0.1850, test_loss: 2.0053, test_f1: 0.6472
 epoch: 84, train_loss: 0.1980, test_loss: 1.8088, test_f1: 0.6571
 epoch: 85, train_loss: 0.1720, test_loss: 1.9918, test_f1: 0.6402
 epoch: 86, train_loss: 0.1879, test_loss: 1.9474, test_f1: 0.6416
 epoch: 87, train_loss: 0.1816, test_loss: 2.0405, test_f1: 0.6341
 epoch: 88, train_loss: 0.1840, test_loss: 2.2394, test_f1: 0.6260
 epoch: 89, train_loss: 0.1920, test_loss: 2.1048, test_f1: 0.6379
 epoch: 90, train_loss: 0.1912, test_loss: 1.8892, test_f1: 0.6669
 epoch: 91, train_loss: 0.1918, test_loss: 1.8877, test_f1: 0.6438
 epoch: 92, train_loss: 0.1805, test_loss: 2.0198, test_f1: 0.6399
 epoch: 93, train_loss: 0.1697, test_loss: 2.0741, test_f1: 0.6517
 epoch: 94, train_loss: 0.1630, test_loss: 2.1397, test_f1: 0.6290
 epoch: 95, train_loss: 0.1650, test_loss: 2.1473, test_f1: 0.6379
 epoch: 96, train_loss: 0.1599, test_loss: 1.9701, test_f1: 0.6666
 epoch: 97, train_loss: 0.1631, test_loss: 2.3235, test_f1: 0.6457
 epoch: 98, train_loss: 0.1668, test_loss: 2.2403, test_f1: 0.6411
 epoch: 99, train_loss: 0.1566, test_loss: 2.2095, test_f1: 0.6579
##################ITERATION #2 ****************************************
 epoch: 0, train_loss: 1.1836, test_loss: 1.5848, test_f1: 0.1775
 epoch: 1, train_loss: 1.0253, test_loss: 0.9831, test_f1: 0.4739
 epoch: 2, train_loss: 0.9822, test_loss: 0.8896, test_f1: 0.5176
 epoch: 3, train_loss: 0.9119, test_loss: 0.9143, test_f1: 0.5234
 epoch: 4, train_loss: 0.8885, test_loss: 0.8947, test_f1: 0.5490
 epoch: 5, train_loss: 0.8788, test_loss: 0.8782, test_f1: 0.4887
 epoch: 6, train_loss: 0.8699, test_loss: 0.8784, test_f1: 0.5782
 epoch: 7, train_loss: 0.8432, test_loss: 0.9215, test_f1: 0.5349
 epoch: 8, train_loss: 0.8211, test_loss: 0.9469, test_f1: 0.5393
 epoch: 9, train_loss: 0.8001, test_loss: 0.9592, test_f1: 0.5224
 epoch: 10, train_loss: 0.8005, test_loss: 0.9516, test_f1: 0.5826
 epoch: 11, train_loss: 0.7758, test_loss: 0.9426, test_f1: 0.5671
 epoch: 12, train_loss: 0.7699, test_loss: 0.8999, test_f1: 0.5999
 epoch: 13, train_loss: 0.7617, test_loss: 0.9581, test_f1: 0.5565
 epoch: 14, train_loss: 0.7396, test_loss: 0.9214, test_f1: 0.5624
 epoch: 15, train_loss: 0.7241, test_loss: 0.9391, test_f1: 0.5762
 epoch: 16, train_loss: 0.7283, test_loss: 0.9514, test_f1: 0.5937
 epoch: 17, train_loss: 0.7269, test_loss: 0.9642, test_f1: 0.5866
 epoch: 18, train_loss: 0.7093, test_loss: 0.9975, test_f1: 0.5920
 epoch: 19, train_loss: 0.6958, test_loss: 0.9365, test_f1: 0.6225
 epoch: 20, train_loss: 0.6930, test_loss: 0.9855, test_f1: 0.5665
 epoch: 21, train_loss: 0.6650, test_loss: 0.9607, test_f1: 0.5991
 epoch: 22, train_loss: 0.6525, test_loss: 0.9322, test_f1: 0.6318
 epoch: 23, train_loss: 0.6698, test_loss: 1.0148, test_f1: 0.6151
 epoch: 24, train_loss: 0.6588, test_loss: 0.9565, test_f1: 0.5959
 epoch: 25, train_loss: 0.6492, test_loss: 0.8728, test_f1: 0.6270
 epoch: 26, train_loss: 0.6325, test_loss: 0.9978, test_f1: 0.5978
 epoch: 27, train_loss: 0.6246, test_loss: 0.9490, test_f1: 0.6028
 epoch: 28, train_loss: 0.6091, test_loss: 1.0587, test_f1: 0.6086
 epoch: 29, train_loss: 0.6109, test_loss: 0.9607, test_f1: 0.6401
 epoch: 30, train_loss: 0.5995, test_loss: 0.9041, test_f1: 0.6232
 epoch: 31, train_loss: 0.5796, test_loss: 0.9439, test_f1: 0.6371
 epoch: 32, train_loss: 0.5789, test_loss: 0.9537, test_f1: 0.6292
 epoch: 33, train_loss: 0.5738, test_loss: 0.9736, test_f1: 0.6206
 epoch: 34, train_loss: 0.5574, test_loss: 1.0958, test_f1: 0.6138
 epoch: 35, train_loss: 0.5714, test_loss: 0.9658, test_f1: 0.6226
 epoch: 36, train_loss: 0.5463, test_loss: 1.0505, test_f1: 0.6203
 epoch: 37, train_loss: 0.5164, test_loss: 1.0553, test_f1: 0.6196
 epoch: 38, train_loss: 0.5219, test_loss: 1.0951, test_f1: 0.6229
 epoch: 39, train_loss: 0.5018, test_loss: 0.9412, test_f1: 0.6909
 epoch: 40, train_loss: 0.4915, test_loss: 1.0046, test_f1: 0.6610
 epoch: 41, train_loss: 0.4932, test_loss: 1.1043, test_f1: 0.6177
 epoch: 42, train_loss: 0.5056, test_loss: 1.1114, test_f1: 0.6417
 epoch: 43, train_loss: 0.4715, test_loss: 1.2601, test_f1: 0.5925
 epoch: 44, train_loss: 0.4731, test_loss: 1.0129, test_f1: 0.6871
 epoch: 45, train_loss: 0.4694, test_loss: 1.1943, test_f1: 0.6267
 epoch: 46, train_loss: 0.4558, test_loss: 1.1431, test_f1: 0.6584
 epoch: 47, train_loss: 0.4457, test_loss: 1.1930, test_f1: 0.6545
 epoch: 48, train_loss: 0.4350, test_loss: 1.2328, test_f1: 0.6508
 epoch: 49, train_loss: 0.4535, test_loss: 1.2029, test_f1: 0.6481
 epoch: 50, train_loss: 0.4125, test_loss: 1.1186, test_f1: 0.6635
 epoch: 51, train_loss: 0.3845, test_loss: 1.1963, test_f1: 0.6378
 epoch: 52, train_loss: 0.3389, test_loss: 1.2503, test_f1: 0.6469
 epoch: 53, train_loss: 0.3131, test_loss: 1.2614, test_f1: 0.6715
 epoch: 54, train_loss: 0.3161, test_loss: 1.3869, test_f1: 0.6736
 epoch: 55, train_loss: 0.3068, test_loss: 1.3843, test_f1: 0.6378
 epoch: 56, train_loss: 0.3013, test_loss: 1.4532, test_f1: 0.6237
 epoch: 57, train_loss: 0.3016, test_loss: 1.3367, test_f1: 0.6463
 epoch: 58, train_loss: 0.2931, test_loss: 1.3636, test_f1: 0.6381
 epoch: 59, train_loss: 0.2993, test_loss: 1.4269, test_f1: 0.6708
 epoch: 60, train_loss: 0.2945, test_loss: 1.5353, test_f1: 0.6497
 epoch: 61, train_loss: 0.2853, test_loss: 1.5611, test_f1: 0.6393
 epoch: 62, train_loss: 0.2907, test_loss: 1.3652, test_f1: 0.6793
 epoch: 63, train_loss: 0.2687, test_loss: 1.5211, test_f1: 0.6587
 epoch: 64, train_loss: 0.2760, test_loss: 1.5995, test_f1: 0.6573
 epoch: 65, train_loss: 0.2620, test_loss: 1.5732, test_f1: 0.6488
 epoch: 66, train_loss: 0.2756, test_loss: 1.5425, test_f1: 0.6408
 epoch: 67, train_loss: 0.2584, test_loss: 1.6284, test_f1: 0.6662
 epoch: 68, train_loss: 0.2645, test_loss: 1.6386, test_f1: 0.6719
 epoch: 69, train_loss: 0.2467, test_loss: 1.6238, test_f1: 0.6560
 epoch: 70, train_loss: 0.2804, test_loss: 1.5346, test_f1: 0.6374
 epoch: 71, train_loss: 0.2492, test_loss: 1.5289, test_f1: 0.6839
 epoch: 72, train_loss: 0.2370, test_loss: 1.7235, test_f1: 0.6356
 epoch: 73, train_loss: 0.2396, test_loss: 1.6388, test_f1: 0.6283
 epoch: 74, train_loss: 0.2450, test_loss: 1.6115, test_f1: 0.6687
 epoch: 75, train_loss: 0.2580, test_loss: 1.6300, test_f1: 0.6481
 epoch: 76, train_loss: 0.2303, test_loss: 1.7971, test_f1: 0.6571
 epoch: 77, train_loss: 0.2323, test_loss: 1.6897, test_f1: 0.6815
 epoch: 78, train_loss: 0.2282, test_loss: 1.7857, test_f1: 0.6864
 epoch: 79, train_loss: 0.2491, test_loss: 1.9115, test_f1: 0.6478
 epoch: 80, train_loss: 0.2287, test_loss: 1.7744, test_f1: 0.6841
 epoch: 81, train_loss: 0.2081, test_loss: 1.8485, test_f1: 0.6504
 epoch: 82, train_loss: 0.2312, test_loss: 1.7213, test_f1: 0.6429
 epoch: 83, train_loss: 0.2238, test_loss: 1.7361, test_f1: 0.6656
 epoch: 84, train_loss: 0.2047, test_loss: 1.7568, test_f1: 0.6546
 epoch: 85, train_loss: 0.1899, test_loss: 1.7838, test_f1: 0.6713
 epoch: 86, train_loss: 0.1990, test_loss: 1.8731, test_f1: 0.6582
 epoch: 87, train_loss: 0.2061, test_loss: 1.9078, test_f1: 0.6292
 epoch: 88, train_loss: 0.2101, test_loss: 1.9348, test_f1: 0.6682
 epoch: 89, train_loss: 0.2397, test_loss: 1.9670, test_f1: 0.6195
 epoch: 90, train_loss: 0.2204, test_loss: 1.9463, test_f1: 0.6583
 epoch: 91, train_loss: 0.2035, test_loss: 1.9354, test_f1: 0.6671
 epoch: 92, train_loss: 0.1991, test_loss: 1.9426, test_f1: 0.6770
 epoch: 93, train_loss: 0.1881, test_loss: 1.9900, test_f1: 0.6815
 epoch: 94, train_loss: 0.1892, test_loss: 2.0796, test_f1: 0.6479
 epoch: 95, train_loss: 0.1931, test_loss: 2.0000, test_f1: 0.6518
 epoch: 96, train_loss: 0.1884, test_loss: 1.9764, test_f1: 0.6629
 epoch: 97, train_loss: 0.1818, test_loss: 1.9442, test_f1: 0.6283
 epoch: 98, train_loss: 0.1928, test_loss: 2.1504, test_f1: 0.6486
 epoch: 99, train_loss: 0.1812, test_loss: 1.9828, test_f1: 0.6545
##################ITERATION #3 ****************************************
 epoch: 0, train_loss: 1.2330, test_loss: 1.1730, test_f1: 0.4398
 epoch: 1, train_loss: 1.0180, test_loss: 1.0139, test_f1: 0.4837
 epoch: 2, train_loss: 0.9640, test_loss: 0.9514, test_f1: 0.5037
 epoch: 3, train_loss: 0.9302, test_loss: 0.9631, test_f1: 0.4830
 epoch: 4, train_loss: 0.9034, test_loss: 1.0103, test_f1: 0.5012
 epoch: 5, train_loss: 0.8986, test_loss: 0.9666, test_f1: 0.4823
 epoch: 6, train_loss: 0.8551, test_loss: 0.9809, test_f1: 0.4941
 epoch: 7, train_loss: 0.8398, test_loss: 1.0449, test_f1: 0.5243
 epoch: 8, train_loss: 0.8330, test_loss: 1.0348, test_f1: 0.5456
 epoch: 9, train_loss: 0.8138, test_loss: 0.9422, test_f1: 0.5429
 epoch: 10, train_loss: 0.8138, test_loss: 0.9993, test_f1: 0.5406
 epoch: 11, train_loss: 0.7914, test_loss: 0.9972, test_f1: 0.5356
 epoch: 12, train_loss: 0.7795, test_loss: 0.9806, test_f1: 0.5561
 epoch: 13, train_loss: 0.7559, test_loss: 1.0070, test_f1: 0.5701
 epoch: 14, train_loss: 0.7747, test_loss: 0.9978, test_f1: 0.6016
 epoch: 15, train_loss: 0.7557, test_loss: 1.0071, test_f1: 0.5620
 epoch: 16, train_loss: 0.7437, test_loss: 1.0230, test_f1: 0.5849
 epoch: 17, train_loss: 0.6987, test_loss: 0.9946, test_f1: 0.5643
 epoch: 18, train_loss: 0.7091, test_loss: 1.0921, test_f1: 0.5347
 epoch: 19, train_loss: 0.7248, test_loss: 1.0081, test_f1: 0.5556
 epoch: 20, train_loss: 0.7072, test_loss: 1.0145, test_f1: 0.6117
 epoch: 21, train_loss: 0.6970, test_loss: 1.0132, test_f1: 0.5681
 epoch: 22, train_loss: 0.6882, test_loss: 1.0816, test_f1: 0.6355
 epoch: 23, train_loss: 0.7011, test_loss: 0.9674, test_f1: 0.5892
 epoch: 24, train_loss: 0.6692, test_loss: 1.0454, test_f1: 0.6281
 epoch: 25, train_loss: 0.6478, test_loss: 1.0585, test_f1: 0.5933
 epoch: 26, train_loss: 0.6339, test_loss: 1.0508, test_f1: 0.5564
 epoch: 27, train_loss: 0.6327, test_loss: 1.1012, test_f1: 0.5960
 epoch: 28, train_loss: 0.6215, test_loss: 1.0461, test_f1: 0.5912
 epoch: 29, train_loss: 0.6094, test_loss: 1.0942, test_f1: 0.6314
 epoch: 30, train_loss: 0.6046, test_loss: 1.0913, test_f1: 0.6424
 epoch: 31, train_loss: 0.5900, test_loss: 1.0904, test_f1: 0.6439
 epoch: 32, train_loss: 0.5921, test_loss: 1.1029, test_f1: 0.6337
 epoch: 33, train_loss: 0.5980, test_loss: 1.1484, test_f1: 0.6263
 epoch: 34, train_loss: 0.5740, test_loss: 1.1006, test_f1: 0.6171
 epoch: 35, train_loss: 0.5689, test_loss: 1.1427, test_f1: 0.5988
 epoch: 36, train_loss: 0.5652, test_loss: 1.1653, test_f1: 0.6186
 epoch: 37, train_loss: 0.5548, test_loss: 1.2665, test_f1: 0.6161
 epoch: 38, train_loss: 0.5252, test_loss: 1.2035, test_f1: 0.6552
 epoch: 39, train_loss: 0.5249, test_loss: 1.2780, test_f1: 0.5915
 epoch: 40, train_loss: 0.5337, test_loss: 1.2560, test_f1: 0.6405
 epoch: 41, train_loss: 0.5253, test_loss: 1.2464, test_f1: 0.6242
 epoch: 42, train_loss: 0.5104, test_loss: 1.2281, test_f1: 0.6068
 epoch: 43, train_loss: 0.4883, test_loss: 1.2771, test_f1: 0.6431
 epoch: 44, train_loss: 0.5135, test_loss: 1.1139, test_f1: 0.6285
 epoch: 45, train_loss: 0.5097, test_loss: 1.2610, test_f1: 0.6053
 epoch: 46, train_loss: 0.4666, test_loss: 1.4540, test_f1: 0.5954
 epoch: 47, train_loss: 0.4454, test_loss: 1.2898, test_f1: 0.6419
 epoch: 48, train_loss: 0.4581, test_loss: 1.3885, test_f1: 0.6409
 epoch: 49, train_loss: 0.4396, test_loss: 1.4470, test_f1: 0.6224
 epoch: 50, train_loss: 0.4603, test_loss: 1.3667, test_f1: 0.6463
 epoch: 51, train_loss: 0.4012, test_loss: 1.3536, test_f1: 0.6415
 epoch: 52, train_loss: 0.3791, test_loss: 1.3636, test_f1: 0.6431
 epoch: 53, train_loss: 0.3524, test_loss: 1.4707, test_f1: 0.6433
 epoch: 54, train_loss: 0.3344, test_loss: 1.5676, test_f1: 0.6271
 epoch: 55, train_loss: 0.3249, test_loss: 1.5971, test_f1: 0.6315
 epoch: 56, train_loss: 0.3290, test_loss: 1.5820, test_f1: 0.6333
 epoch: 57, train_loss: 0.3157, test_loss: 1.6512, test_f1: 0.6510
 epoch: 58, train_loss: 0.3117, test_loss: 1.6022, test_f1: 0.6379
 epoch: 59, train_loss: 0.3052, test_loss: 1.6292, test_f1: 0.6456
 epoch: 60, train_loss: 0.3025, test_loss: 1.6559, test_f1: 0.6472
 epoch: 61, train_loss: 0.3017, test_loss: 1.6896, test_f1: 0.6373
 epoch: 62, train_loss: 0.3041, test_loss: 1.6509, test_f1: 0.6561
 epoch: 63, train_loss: 0.2816, test_loss: 1.8892, test_f1: 0.6001
 epoch: 64, train_loss: 0.2793, test_loss: 1.8000, test_f1: 0.6141
 epoch: 65, train_loss: 0.2664, test_loss: 1.8319, test_f1: 0.6277
 epoch: 66, train_loss: 0.2792, test_loss: 1.7438, test_f1: 0.6479
 epoch: 67, train_loss: 0.2844, test_loss: 1.7518, test_f1: 0.6309
 epoch: 68, train_loss: 0.2798, test_loss: 1.8864, test_f1: 0.6328
 epoch: 69, train_loss: 0.2834, test_loss: 1.8308, test_f1: 0.6518
 epoch: 70, train_loss: 0.2670, test_loss: 1.6878, test_f1: 0.6328
 epoch: 71, train_loss: 0.2518, test_loss: 1.7523, test_f1: 0.6474
 epoch: 72, train_loss: 0.2687, test_loss: 1.8886, test_f1: 0.6230
 epoch: 73, train_loss: 0.2525, test_loss: 1.8675, test_f1: 0.6209
 epoch: 74, train_loss: 0.2745, test_loss: 1.9610, test_f1: 0.6250
 epoch: 75, train_loss: 0.2705, test_loss: 2.0539, test_f1: 0.6258
 epoch: 76, train_loss: 0.2427, test_loss: 1.9550, test_f1: 0.6351
 epoch: 77, train_loss: 0.2455, test_loss: 2.0195, test_f1: 0.6227
 epoch: 78, train_loss: 0.2530, test_loss: 2.0449, test_f1: 0.6237
 epoch: 79, train_loss: 0.2371, test_loss: 2.1140, test_f1: 0.6354
 epoch: 80, train_loss: 0.2286, test_loss: 1.9210, test_f1: 0.6349
 epoch: 81, train_loss: 0.2380, test_loss: 1.9022, test_f1: 0.6062
 epoch: 82, train_loss: 0.2439, test_loss: 2.0081, test_f1: 0.6229
 epoch: 83, train_loss: 0.2216, test_loss: 2.1502, test_f1: 0.6257
 epoch: 84, train_loss: 0.2102, test_loss: 2.0814, test_f1: 0.6434
 epoch: 85, train_loss: 0.2396, test_loss: 1.9178, test_f1: 0.6384
 epoch: 86, train_loss: 0.2248, test_loss: 2.1129, test_f1: 0.6089
 epoch: 87, train_loss: 0.2096, test_loss: 2.1320, test_f1: 0.6158
 epoch: 88, train_loss: 0.2032, test_loss: 2.4243, test_f1: 0.6051
 epoch: 89, train_loss: 0.2117, test_loss: 2.4054, test_f1: 0.6071
 epoch: 90, train_loss: 0.2060, test_loss: 2.4285, test_f1: 0.6098
 epoch: 91, train_loss: 0.1948, test_loss: 2.2551, test_f1: 0.6228
 epoch: 92, train_loss: 0.2149, test_loss: 2.2657, test_f1: 0.5961
 epoch: 93, train_loss: 0.2190, test_loss: 2.1469, test_f1: 0.6274
 epoch: 94, train_loss: 0.2071, test_loss: 2.1707, test_f1: 0.6389
 epoch: 95, train_loss: 0.1816, test_loss: 2.3271, test_f1: 0.6143
 epoch: 96, train_loss: 0.1918, test_loss: 2.3664, test_f1: 0.6344
 epoch: 97, train_loss: 0.1904, test_loss: 2.5262, test_f1: 0.6198
 epoch: 98, train_loss: 0.1967, test_loss: 2.4422, test_f1: 0.6221
 epoch: 99, train_loss: 0.2027, test_loss: 2.1681, test_f1: 0.6053
##################ITERATION #4 ****************************************
 epoch: 0, train_loss: 1.2822, test_loss: 1.3309, test_f1: 0.3105
 epoch: 1, train_loss: 1.0571, test_loss: 0.9880, test_f1: 0.4876
 epoch: 2, train_loss: 0.9745, test_loss: 1.0111, test_f1: 0.4945
 epoch: 3, train_loss: 0.9305, test_loss: 0.9439, test_f1: 0.4808
 epoch: 4, train_loss: 0.9066, test_loss: 0.9560, test_f1: 0.4904
 epoch: 5, train_loss: 0.8808, test_loss: 0.9899, test_f1: 0.5195
 epoch: 6, train_loss: 0.8760, test_loss: 0.9685, test_f1: 0.5512
 epoch: 7, train_loss: 0.8632, test_loss: 0.9988, test_f1: 0.5459
 epoch: 8, train_loss: 0.8505, test_loss: 0.9886, test_f1: 0.5683
 epoch: 9, train_loss: 0.8285, test_loss: 0.9820, test_f1: 0.5427
 epoch: 10, train_loss: 0.8054, test_loss: 0.9466, test_f1: 0.5627
 epoch: 11, train_loss: 0.7947, test_loss: 0.9896, test_f1: 0.5980
 epoch: 12, train_loss: 0.7928, test_loss: 0.9962, test_f1: 0.5785
 epoch: 13, train_loss: 0.7879, test_loss: 1.0359, test_f1: 0.5486
 epoch: 14, train_loss: 0.7470, test_loss: 0.9201, test_f1: 0.5564
 epoch: 15, train_loss: 0.7691, test_loss: 0.9756, test_f1: 0.5880
 epoch: 16, train_loss: 0.7465, test_loss: 0.9813, test_f1: 0.5910
 epoch: 17, train_loss: 0.7472, test_loss: 1.0031, test_f1: 0.5947
 epoch: 18, train_loss: 0.7227, test_loss: 1.0571, test_f1: 0.5988
 epoch: 19, train_loss: 0.7274, test_loss: 0.9494, test_f1: 0.5967
 epoch: 20, train_loss: 0.7264, test_loss: 1.0514, test_f1: 0.5794
 epoch: 21, train_loss: 0.7099, test_loss: 1.0368, test_f1: 0.5970
 epoch: 22, train_loss: 0.7009, test_loss: 1.0574, test_f1: 0.5638
 epoch: 23, train_loss: 0.6992, test_loss: 1.0662, test_f1: 0.5848
 epoch: 24, train_loss: 0.6727, test_loss: 1.0867, test_f1: 0.5788
 epoch: 25, train_loss: 0.6818, test_loss: 1.0620, test_f1: 0.6137
 epoch: 26, train_loss: 0.6568, test_loss: 0.9990, test_f1: 0.5965
 epoch: 27, train_loss: 0.6575, test_loss: 1.0462, test_f1: 0.6239
 epoch: 28, train_loss: 0.6235, test_loss: 1.0082, test_f1: 0.6037
 epoch: 29, train_loss: 0.6188, test_loss: 1.1096, test_f1: 0.5817
 epoch: 30, train_loss: 0.6348, test_loss: 1.0373, test_f1: 0.6236
 epoch: 31, train_loss: 0.6169, test_loss: 1.1399, test_f1: 0.5956
 epoch: 32, train_loss: 0.6025, test_loss: 1.0836, test_f1: 0.6031
 epoch: 33, train_loss: 0.6044, test_loss: 1.2077, test_f1: 0.6192
 epoch: 34, train_loss: 0.5924, test_loss: 1.0784, test_f1: 0.6053
 epoch: 35, train_loss: 0.6054, test_loss: 1.0880, test_f1: 0.6130
 epoch: 36, train_loss: 0.5871, test_loss: 1.1301, test_f1: 0.6466
 epoch: 37, train_loss: 0.5526, test_loss: 1.1344, test_f1: 0.6198
 epoch: 38, train_loss: 0.5439, test_loss: 1.2015, test_f1: 0.6299
 epoch: 39, train_loss: 0.5270, test_loss: 1.1229, test_f1: 0.6214
 epoch: 40, train_loss: 0.5446, test_loss: 1.1795, test_f1: 0.6046
 epoch: 41, train_loss: 0.5368, test_loss: 1.2031, test_f1: 0.6186
 epoch: 42, train_loss: 0.5249, test_loss: 1.0494, test_f1: 0.6208
 epoch: 43, train_loss: 0.5117, test_loss: 1.2784, test_f1: 0.5865
 epoch: 44, train_loss: 0.5194, test_loss: 1.2323, test_f1: 0.6030
 epoch: 45, train_loss: 0.4989, test_loss: 1.0949, test_f1: 0.6484
 epoch: 46, train_loss: 0.5097, test_loss: 1.1686, test_f1: 0.6286
 epoch: 47, train_loss: 0.4987, test_loss: 1.2301, test_f1: 0.6087
 epoch: 48, train_loss: 0.4702, test_loss: 1.2917, test_f1: 0.5941
 epoch: 49, train_loss: 0.4539, test_loss: 1.2503, test_f1: 0.6240
 epoch: 50, train_loss: 0.4633, test_loss: 1.2351, test_f1: 0.6476
 epoch: 51, train_loss: 0.4046, test_loss: 1.2528, test_f1: 0.6369
 epoch: 52, train_loss: 0.3821, test_loss: 1.3317, test_f1: 0.6324
 epoch: 53, train_loss: 0.3825, test_loss: 1.3173, test_f1: 0.6350
 epoch: 54, train_loss: 0.3568, test_loss: 1.2702, test_f1: 0.6213
 epoch: 55, train_loss: 0.3568, test_loss: 1.3998, test_f1: 0.6251
 epoch: 56, train_loss: 0.3493, test_loss: 1.4331, test_f1: 0.6258
 epoch: 57, train_loss: 0.3371, test_loss: 1.3447, test_f1: 0.6110
 epoch: 58, train_loss: 0.3410, test_loss: 1.4746, test_f1: 0.6132
 epoch: 59, train_loss: 0.3293, test_loss: 1.4626, test_f1: 0.6233
 epoch: 60, train_loss: 0.3179, test_loss: 1.4137, test_f1: 0.6508
 epoch: 61, train_loss: 0.3080, test_loss: 1.5211, test_f1: 0.6238
 epoch: 62, train_loss: 0.3097, test_loss: 1.4534, test_f1: 0.6447
 epoch: 63, train_loss: 0.3063, test_loss: 1.5239, test_f1: 0.6269
 epoch: 64, train_loss: 0.3087, test_loss: 1.4166, test_f1: 0.6392
 epoch: 65, train_loss: 0.3226, test_loss: 1.5866, test_f1: 0.6194
 epoch: 66, train_loss: 0.3019, test_loss: 1.4392, test_f1: 0.6350
 epoch: 67, train_loss: 0.3024, test_loss: 1.5549, test_f1: 0.6435
 epoch: 68, train_loss: 0.3034, test_loss: 1.5555, test_f1: 0.6407
 epoch: 69, train_loss: 0.3029, test_loss: 1.5296, test_f1: 0.6118
 epoch: 70, train_loss: 0.3101, test_loss: 1.7450, test_f1: 0.6074
 epoch: 71, train_loss: 0.2904, test_loss: 1.5701, test_f1: 0.6238
 epoch: 72, train_loss: 0.2710, test_loss: 1.6494, test_f1: 0.6332
 epoch: 73, train_loss: 0.2754, test_loss: 1.8311, test_f1: 0.6312
 epoch: 74, train_loss: 0.2622, test_loss: 1.6849, test_f1: 0.6102
 epoch: 75, train_loss: 0.2680, test_loss: 1.6666, test_f1: 0.6474
 epoch: 76, train_loss: 0.2518, test_loss: 1.6560, test_f1: 0.6377
 epoch: 77, train_loss: 0.2753, test_loss: 1.7777, test_f1: 0.6447
 epoch: 78, train_loss: 0.2538, test_loss: 1.7432, test_f1: 0.6254
 epoch: 79, train_loss: 0.2495, test_loss: 1.7324, test_f1: 0.6377
 epoch: 80, train_loss: 0.2341, test_loss: 1.8415, test_f1: 0.6298
 epoch: 81, train_loss: 0.2576, test_loss: 1.8097, test_f1: 0.6212
 epoch: 82, train_loss: 0.2539, test_loss: 1.9796, test_f1: 0.6420
 epoch: 83, train_loss: 0.2319, test_loss: 1.8502, test_f1: 0.6363
 epoch: 84, train_loss: 0.2553, test_loss: 1.8486, test_f1: 0.6277
 epoch: 85, train_loss: 0.2614, test_loss: 1.8469, test_f1: 0.6363
 epoch: 86, train_loss: 0.2380, test_loss: 1.8004, test_f1: 0.6364
 epoch: 87, train_loss: 0.2362, test_loss: 1.8521, test_f1: 0.6371
 epoch: 88, train_loss: 0.2295, test_loss: 1.8495, test_f1: 0.6191
 epoch: 89, train_loss: 0.2193, test_loss: 2.0131, test_f1: 0.6383
 epoch: 90, train_loss: 0.2331, test_loss: 2.1157, test_f1: 0.6283
 epoch: 91, train_loss: 0.2276, test_loss: 1.9056, test_f1: 0.6317
 epoch: 92, train_loss: 0.2309, test_loss: 1.9913, test_f1: 0.6341
 epoch: 93, train_loss: 0.2249, test_loss: 2.0141, test_f1: 0.6137
 epoch: 94, train_loss: 0.2210, test_loss: 2.0483, test_f1: 0.6233
 epoch: 95, train_loss: 0.2048, test_loss: 1.9148, test_f1: 0.6472
 epoch: 96, train_loss: 0.2063, test_loss: 2.0932, test_f1: 0.6361
 epoch: 97, train_loss: 0.2153, test_loss: 1.9148, test_f1: 0.6327
 epoch: 98, train_loss: 0.2104, test_loss: 1.8814, test_f1: 0.6334
 epoch: 99, train_loss: 0.2089, test_loss: 2.0584, test_f1: 0.6460
##################ITERATION #5 ****************************************
 epoch: 0, train_loss: 1.3496, test_loss: 1.1159, test_f1: 0.3553
 epoch: 1, train_loss: 1.0266, test_loss: 0.9655, test_f1: 0.5079
 epoch: 2, train_loss: 0.9631, test_loss: 0.9161, test_f1: 0.4746
 epoch: 3, train_loss: 0.9354, test_loss: 0.9247, test_f1: 0.4883
 epoch: 4, train_loss: 0.8992, test_loss: 0.9426, test_f1: 0.5112
 epoch: 5, train_loss: 0.8873, test_loss: 1.0228, test_f1: 0.5059
 epoch: 6, train_loss: 0.8776, test_loss: 0.9264, test_f1: 0.4958
 epoch: 7, train_loss: 0.8587, test_loss: 0.9071, test_f1: 0.5303
 epoch: 8, train_loss: 0.8450, test_loss: 0.9218, test_f1: 0.5308
 epoch: 9, train_loss: 0.8294, test_loss: 0.9686, test_f1: 0.5116
 epoch: 10, train_loss: 0.8190, test_loss: 0.9179, test_f1: 0.5380
 epoch: 11, train_loss: 0.8034, test_loss: 0.9006, test_f1: 0.5867
 epoch: 12, train_loss: 0.7899, test_loss: 0.9609, test_f1: 0.5440
 epoch: 13, train_loss: 0.7921, test_loss: 0.9172, test_f1: 0.5883
 epoch: 14, train_loss: 0.7548, test_loss: 0.9453, test_f1: 0.5585
 epoch: 15, train_loss: 0.7619, test_loss: 0.8909, test_f1: 0.5666
 epoch: 16, train_loss: 0.7607, test_loss: 0.9097, test_f1: 0.5740
 epoch: 17, train_loss: 0.7539, test_loss: 0.9796, test_f1: 0.5835
 epoch: 18, train_loss: 0.7376, test_loss: 0.9482, test_f1: 0.5515
 epoch: 19, train_loss: 0.7231, test_loss: 0.9548, test_f1: 0.6099
 epoch: 20, train_loss: 0.7111, test_loss: 0.9497, test_f1: 0.5963
 epoch: 21, train_loss: 0.7137, test_loss: 1.0005, test_f1: 0.5935
 epoch: 22, train_loss: 0.7038, test_loss: 0.9640, test_f1: 0.5786
 epoch: 23, train_loss: 0.7032, test_loss: 0.9319, test_f1: 0.6062
 epoch: 24, train_loss: 0.7037, test_loss: 0.9448, test_f1: 0.6159
 epoch: 25, train_loss: 0.6872, test_loss: 0.9906, test_f1: 0.6192
 epoch: 26, train_loss: 0.6668, test_loss: 0.9934, test_f1: 0.6025
 epoch: 27, train_loss: 0.6535, test_loss: 0.9981, test_f1: 0.5894
 epoch: 28, train_loss: 0.6653, test_loss: 1.0401, test_f1: 0.5632
 epoch: 29, train_loss: 0.6454, test_loss: 0.9725, test_f1: 0.6136
 epoch: 30, train_loss: 0.6437, test_loss: 0.9098, test_f1: 0.6196
 epoch: 31, train_loss: 0.6377, test_loss: 1.0688, test_f1: 0.5891
 epoch: 32, train_loss: 0.6222, test_loss: 0.9679, test_f1: 0.6147
 epoch: 33, train_loss: 0.6332, test_loss: 1.0696, test_f1: 0.5977
 epoch: 34, train_loss: 0.6323, test_loss: 0.9964, test_f1: 0.6115
 epoch: 35, train_loss: 0.5772, test_loss: 1.1221, test_f1: 0.6116
 epoch: 36, train_loss: 0.5904, test_loss: 1.0260, test_f1: 0.6136
 epoch: 37, train_loss: 0.5961, test_loss: 1.0907, test_f1: 0.6172
 epoch: 38, train_loss: 0.5753, test_loss: 1.0475, test_f1: 0.6326
 epoch: 39, train_loss: 0.5714, test_loss: 1.1409, test_f1: 0.5836
 epoch: 40, train_loss: 0.5956, test_loss: 1.0232, test_f1: 0.6162
 epoch: 41, train_loss: 0.6011, test_loss: 1.0548, test_f1: 0.6310
 epoch: 42, train_loss: 0.5411, test_loss: 1.0810, test_f1: 0.6230
 epoch: 43, train_loss: 0.5398, test_loss: 1.1357, test_f1: 0.6093
 epoch: 44, train_loss: 0.5346, test_loss: 0.9887, test_f1: 0.6344
 epoch: 45, train_loss: 0.5432, test_loss: 1.1473, test_f1: 0.5769
 epoch: 46, train_loss: 0.5218, test_loss: 1.1257, test_f1: 0.6176
 epoch: 47, train_loss: 0.5162, test_loss: 1.0555, test_f1: 0.6376
 epoch: 48, train_loss: 0.5300, test_loss: 1.0348, test_f1: 0.6465
 epoch: 49, train_loss: 0.5203, test_loss: 1.1878, test_f1: 0.5988
 epoch: 50, train_loss: 0.4978, test_loss: 1.1061, test_f1: 0.6644
 epoch: 51, train_loss: 0.4508, test_loss: 1.1746, test_f1: 0.6548
 epoch: 52, train_loss: 0.4197, test_loss: 1.2043, test_f1: 0.6450
 epoch: 53, train_loss: 0.4026, test_loss: 1.1779, test_f1: 0.6249
 epoch: 54, train_loss: 0.3864, test_loss: 1.2997, test_f1: 0.6080
 epoch: 55, train_loss: 0.3722, test_loss: 1.2596, test_f1: 0.6337
 epoch: 56, train_loss: 0.3689, test_loss: 1.2910, test_f1: 0.6226
 epoch: 57, train_loss: 0.3890, test_loss: 1.3299, test_f1: 0.6547
 epoch: 58, train_loss: 0.3826, test_loss: 1.3429, test_f1: 0.6243
 epoch: 59, train_loss: 0.3720, test_loss: 1.2193, test_f1: 0.6335
 epoch: 60, train_loss: 0.3373, test_loss: 1.3555, test_f1: 0.6313
 epoch: 61, train_loss: 0.3660, test_loss: 1.3850, test_f1: 0.6395
 epoch: 62, train_loss: 0.3645, test_loss: 1.3772, test_f1: 0.6558
 epoch: 63, train_loss: 0.3664, test_loss: 1.3402, test_f1: 0.6271
 epoch: 64, train_loss: 0.3444, test_loss: 1.3950, test_f1: 0.6253
 epoch: 65, train_loss: 0.3402, test_loss: 1.4472, test_f1: 0.6370
 epoch: 66, train_loss: 0.3137, test_loss: 1.4013, test_f1: 0.6150
 epoch: 67, train_loss: 0.3062, test_loss: 1.4340, test_f1: 0.6177
 epoch: 68, train_loss: 0.3126, test_loss: 1.5338, test_f1: 0.6191
 epoch: 69, train_loss: 0.3195, test_loss: 1.3387, test_f1: 0.6180
 epoch: 70, train_loss: 0.3133, test_loss: 1.4797, test_f1: 0.6230
 epoch: 71, train_loss: 0.3180, test_loss: 1.5623, test_f1: 0.6272
 epoch: 72, train_loss: 0.3121, test_loss: 1.5471, test_f1: 0.6156
 epoch: 73, train_loss: 0.2765, test_loss: 1.5633, test_f1: 0.6229
 epoch: 74, train_loss: 0.3232, test_loss: 1.5073, test_f1: 0.6471
 epoch: 75, train_loss: 0.2878, test_loss: 1.4623, test_f1: 0.6335
 epoch: 76, train_loss: 0.2868, test_loss: 1.5586, test_f1: 0.6120
 epoch: 77, train_loss: 0.3034, test_loss: 1.7136, test_f1: 0.6014
 epoch: 78, train_loss: 0.3070, test_loss: 1.5488, test_f1: 0.6104
 epoch: 79, train_loss: 0.2843, test_loss: 1.6528, test_f1: 0.5931
 epoch: 80, train_loss: 0.2799, test_loss: 1.6121, test_f1: 0.6204
 epoch: 81, train_loss: 0.2823, test_loss: 1.6137, test_f1: 0.6266
 epoch: 82, train_loss: 0.2706, test_loss: 1.5724, test_f1: 0.6375
 epoch: 83, train_loss: 0.2671, test_loss: 1.5310, test_f1: 0.6318
 epoch: 84, train_loss: 0.2588, test_loss: 1.5480, test_f1: 0.6192
 epoch: 85, train_loss: 0.2780, test_loss: 1.5437, test_f1: 0.6194
 epoch: 86, train_loss: 0.2459, test_loss: 1.7538, test_f1: 0.6052
 epoch: 87, train_loss: 0.2647, test_loss: 1.6589, test_f1: 0.6142
 epoch: 88, train_loss: 0.2652, test_loss: 1.5868, test_f1: 0.6453
 epoch: 89, train_loss: 0.2439, test_loss: 1.7488, test_f1: 0.6310
 epoch: 90, train_loss: 0.2518, test_loss: 1.5702, test_f1: 0.6322
 epoch: 91, train_loss: 0.2380, test_loss: 1.7266, test_f1: 0.6026
 epoch: 92, train_loss: 0.2312, test_loss: 1.7173, test_f1: 0.6103
 epoch: 93, train_loss: 0.2198, test_loss: 1.8094, test_f1: 0.6009
 epoch: 94, train_loss: 0.2346, test_loss: 1.8098, test_f1: 0.6154
 epoch: 95, train_loss: 0.2327, test_loss: 1.7368, test_f1: 0.6287
 epoch: 96, train_loss: 0.2277, test_loss: 1.7403, test_f1: 0.6134
 epoch: 97, train_loss: 0.2213, test_loss: 1.7672, test_f1: 0.6136
 epoch: 98, train_loss: 0.2236, test_loss: 1.7179, test_f1: 0.6264
 epoch: 99, train_loss: 0.2306, test_loss: 1.7598, test_f1: 0.6062
##################ITERATION #6 ****************************************
 epoch: 0, train_loss: 1.3388, test_loss: 1.1484, test_f1: 0.3925
 epoch: 1, train_loss: 1.0155, test_loss: 0.9651, test_f1: 0.4749
 epoch: 2, train_loss: 0.9582, test_loss: 0.9330, test_f1: 0.4979
 epoch: 3, train_loss: 0.9255, test_loss: 0.9898, test_f1: 0.4894
 epoch: 4, train_loss: 0.9068, test_loss: 0.9447, test_f1: 0.4831
 epoch: 5, train_loss: 0.8878, test_loss: 0.9230, test_f1: 0.5016
 epoch: 6, train_loss: 0.8727, test_loss: 0.9491, test_f1: 0.4886
 epoch: 7, train_loss: 0.8475, test_loss: 0.9589, test_f1: 0.4897
 epoch: 8, train_loss: 0.8500, test_loss: 0.9717, test_f1: 0.5366
 epoch: 9, train_loss: 0.8269, test_loss: 0.9336, test_f1: 0.5483
 epoch: 10, train_loss: 0.8084, test_loss: 0.9445, test_f1: 0.5342
 epoch: 11, train_loss: 0.7847, test_loss: 0.9200, test_f1: 0.5527
 epoch: 12, train_loss: 0.7902, test_loss: 0.9702, test_f1: 0.5563
 epoch: 13, train_loss: 0.7673, test_loss: 0.9471, test_f1: 0.5479
 epoch: 14, train_loss: 0.7702, test_loss: 0.9893, test_f1: 0.5834
 epoch: 15, train_loss: 0.7555, test_loss: 0.9846, test_f1: 0.5535
 epoch: 16, train_loss: 0.7575, test_loss: 0.9342, test_f1: 0.5886
 epoch: 17, train_loss: 0.7505, test_loss: 0.9440, test_f1: 0.5921
 epoch: 18, train_loss: 0.7426, test_loss: 1.0288, test_f1: 0.5643
 epoch: 19, train_loss: 0.7182, test_loss: 0.9908, test_f1: 0.5638
 epoch: 20, train_loss: 0.7106, test_loss: 0.9289, test_f1: 0.5991
 epoch: 21, train_loss: 0.7081, test_loss: 0.9410, test_f1: 0.5850
 epoch: 22, train_loss: 0.6874, test_loss: 0.9683, test_f1: 0.5641
 epoch: 23, train_loss: 0.6898, test_loss: 0.9800, test_f1: 0.5784
 epoch: 24, train_loss: 0.6668, test_loss: 0.9265, test_f1: 0.5987
 epoch: 25, train_loss: 0.6809, test_loss: 1.0381, test_f1: 0.5571
 epoch: 26, train_loss: 0.6758, test_loss: 0.9930, test_f1: 0.5941
 epoch: 27, train_loss: 0.6594, test_loss: 0.9471, test_f1: 0.5919
 epoch: 28, train_loss: 0.6652, test_loss: 1.1014, test_f1: 0.5690
 epoch: 29, train_loss: 0.6437, test_loss: 0.9504, test_f1: 0.6230
 epoch: 30, train_loss: 0.6401, test_loss: 0.9306, test_f1: 0.6043
 epoch: 31, train_loss: 0.6147, test_loss: 0.9445, test_f1: 0.6209
 epoch: 32, train_loss: 0.6224, test_loss: 0.9618, test_f1: 0.5859
 epoch: 33, train_loss: 0.5947, test_loss: 1.0390, test_f1: 0.6616
 epoch: 34, train_loss: 0.6193, test_loss: 1.0378, test_f1: 0.5944
 epoch: 35, train_loss: 0.6027, test_loss: 1.0715, test_f1: 0.5988
 epoch: 36, train_loss: 0.6027, test_loss: 1.0086, test_f1: 0.5778
 epoch: 37, train_loss: 0.5800, test_loss: 1.0875, test_f1: 0.5823
 epoch: 38, train_loss: 0.5887, test_loss: 1.0042, test_f1: 0.6278
 epoch: 39, train_loss: 0.5800, test_loss: 1.0521, test_f1: 0.5881
 epoch: 40, train_loss: 0.5628, test_loss: 0.9961, test_f1: 0.6251
 epoch: 41, train_loss: 0.5500, test_loss: 1.1121, test_f1: 0.6001
 epoch: 42, train_loss: 0.5720, test_loss: 0.9650, test_f1: 0.6343
 epoch: 43, train_loss: 0.5321, test_loss: 0.9921, test_f1: 0.6425
 epoch: 44, train_loss: 0.5066, test_loss: 1.0050, test_f1: 0.6381
 epoch: 45, train_loss: 0.4973, test_loss: 1.0554, test_f1: 0.6341
 epoch: 46, train_loss: 0.5216, test_loss: 1.0192, test_f1: 0.6389
 epoch: 47, train_loss: 0.5105, test_loss: 1.1238, test_f1: 0.6306
 epoch: 48, train_loss: 0.5136, test_loss: 1.0217, test_f1: 0.6500
 epoch: 49, train_loss: 0.4749, test_loss: 1.1653, test_f1: 0.6181
 epoch: 50, train_loss: 0.4806, test_loss: 1.0262, test_f1: 0.6238
 epoch: 51, train_loss: 0.4653, test_loss: 1.0427, test_f1: 0.6820
 epoch: 52, train_loss: 0.3993, test_loss: 1.0758, test_f1: 0.6581
 epoch: 53, train_loss: 0.3999, test_loss: 1.0656, test_f1: 0.6461
 epoch: 54, train_loss: 0.3689, test_loss: 1.1301, test_f1: 0.6409
 epoch: 55, train_loss: 0.3710, test_loss: 1.1025, test_f1: 0.6283
 epoch: 56, train_loss: 0.3713, test_loss: 1.0889, test_f1: 0.6466
 epoch: 57, train_loss: 0.3536, test_loss: 1.2443, test_f1: 0.6627
 epoch: 58, train_loss: 0.3478, test_loss: 1.2933, test_f1: 0.6550
 epoch: 59, train_loss: 0.3557, test_loss: 1.1598, test_f1: 0.6403
 epoch: 60, train_loss: 0.3704, test_loss: 1.0590, test_f1: 0.6619
 epoch: 61, train_loss: 0.3383, test_loss: 1.2427, test_f1: 0.6586
 epoch: 62, train_loss: 0.3223, test_loss: 1.3383, test_f1: 0.6482
 epoch: 63, train_loss: 0.3364, test_loss: 1.3336, test_f1: 0.6396
 epoch: 64, train_loss: 0.3271, test_loss: 1.3812, test_f1: 0.6460
 epoch: 65, train_loss: 0.3094, test_loss: 1.2691, test_f1: 0.6643
 epoch: 66, train_loss: 0.3212, test_loss: 1.2797, test_f1: 0.6739
 epoch: 67, train_loss: 0.3103, test_loss: 1.3829, test_f1: 0.6041
 epoch: 68, train_loss: 0.3133, test_loss: 1.4014, test_f1: 0.6415
 epoch: 69, train_loss: 0.3041, test_loss: 1.3785, test_f1: 0.6392
 epoch: 70, train_loss: 0.2941, test_loss: 1.3851, test_f1: 0.6325
 epoch: 71, train_loss: 0.2836, test_loss: 1.4264, test_f1: 0.6409
 epoch: 72, train_loss: 0.3010, test_loss: 1.4111, test_f1: 0.6423
 epoch: 73, train_loss: 0.2837, test_loss: 1.4295, test_f1: 0.6472
 epoch: 74, train_loss: 0.2690, test_loss: 1.4786, test_f1: 0.6581
 epoch: 75, train_loss: 0.2738, test_loss: 1.4636, test_f1: 0.6588
 epoch: 76, train_loss: 0.2750, test_loss: 1.5322, test_f1: 0.6557
 epoch: 77, train_loss: 0.2783, test_loss: 1.5098, test_f1: 0.6439
 epoch: 78, train_loss: 0.2666, test_loss: 1.4799, test_f1: 0.6412
 epoch: 79, train_loss: 0.2628, test_loss: 1.5948, test_f1: 0.6477
 epoch: 80, train_loss: 0.2710, test_loss: 1.5893, test_f1: 0.6195
 epoch: 81, train_loss: 0.2648, test_loss: 1.4231, test_f1: 0.6609
 epoch: 82, train_loss: 0.2609, test_loss: 1.4531, test_f1: 0.6376
 epoch: 83, train_loss: 0.2522, test_loss: 1.4684, test_f1: 0.6672
 epoch: 84, train_loss: 0.2586, test_loss: 1.4485, test_f1: 0.6693
 epoch: 85, train_loss: 0.2557, test_loss: 1.5350, test_f1: 0.6710
 epoch: 86, train_loss: 0.2561, test_loss: 1.6184, test_f1: 0.6351
 epoch: 87, train_loss: 0.2740, test_loss: 1.6079, test_f1: 0.6464
 epoch: 88, train_loss: 0.2715, test_loss: 1.4841, test_f1: 0.6442
 epoch: 89, train_loss: 0.2527, test_loss: 1.5654, test_f1: 0.6467
 epoch: 90, train_loss: 0.2237, test_loss: 1.7649, test_f1: 0.6317
 epoch: 91, train_loss: 0.2328, test_loss: 1.6587, test_f1: 0.6201
 epoch: 92, train_loss: 0.2417, test_loss: 1.5794, test_f1: 0.6431
 epoch: 93, train_loss: 0.2179, test_loss: 1.5101, test_f1: 0.6551
 epoch: 94, train_loss: 0.2134, test_loss: 1.6433, test_f1: 0.6513
 epoch: 95, train_loss: 0.2174, test_loss: 1.6285, test_f1: 0.6596
 epoch: 96, train_loss: 0.2059, test_loss: 1.7142, test_f1: 0.6427
 epoch: 97, train_loss: 0.2343, test_loss: 1.6237, test_f1: 0.6120
 epoch: 98, train_loss: 0.2400, test_loss: 1.6341, test_f1: 0.6469
 epoch: 99, train_loss: 0.2092, test_loss: 1.5406, test_f1: 0.6400
##################ITERATION #7 ****************************************
 epoch: 0, train_loss: 1.3628, test_loss: 1.1672, test_f1: 0.3339
 epoch: 1, train_loss: 1.0408, test_loss: 0.9840, test_f1: 0.4594
 epoch: 2, train_loss: 0.9644, test_loss: 0.9820, test_f1: 0.5013
 epoch: 3, train_loss: 0.9365, test_loss: 0.9265, test_f1: 0.5010
 epoch: 4, train_loss: 0.9032, test_loss: 0.9177, test_f1: 0.4915
 epoch: 5, train_loss: 0.8839, test_loss: 0.9443, test_f1: 0.4997
 epoch: 6, train_loss: 0.8581, test_loss: 0.9759, test_f1: 0.5141
 epoch: 7, train_loss: 0.8362, test_loss: 1.0132, test_f1: 0.5235
 epoch: 8, train_loss: 0.8297, test_loss: 0.9177, test_f1: 0.5535
 epoch: 9, train_loss: 0.8331, test_loss: 0.9609, test_f1: 0.5087
 epoch: 10, train_loss: 0.8232, test_loss: 0.9476, test_f1: 0.5524
 epoch: 11, train_loss: 0.8079, test_loss: 0.9117, test_f1: 0.5320
 epoch: 12, train_loss: 0.7889, test_loss: 0.9679, test_f1: 0.5672
 epoch: 13, train_loss: 0.7830, test_loss: 0.9529, test_f1: 0.5708
 epoch: 14, train_loss: 0.7624, test_loss: 0.9452, test_f1: 0.5632
 epoch: 15, train_loss: 0.7455, test_loss: 1.0307, test_f1: 0.5623
 epoch: 16, train_loss: 0.7437, test_loss: 0.9741, test_f1: 0.5893
 epoch: 17, train_loss: 0.7372, test_loss: 0.9897, test_f1: 0.5766
 epoch: 18, train_loss: 0.7389, test_loss: 0.9946, test_f1: 0.5624
 epoch: 19, train_loss: 0.7139, test_loss: 1.0752, test_f1: 0.5692
 epoch: 20, train_loss: 0.7036, test_loss: 0.9424, test_f1: 0.6271
 epoch: 21, train_loss: 0.6918, test_loss: 1.0073, test_f1: 0.6004
 epoch: 22, train_loss: 0.6620, test_loss: 1.0472, test_f1: 0.5580
 epoch: 23, train_loss: 0.6930, test_loss: 1.0380, test_f1: 0.5856
 epoch: 24, train_loss: 0.6691, test_loss: 1.0143, test_f1: 0.6145
 epoch: 25, train_loss: 0.6529, test_loss: 1.0114, test_f1: 0.6105
 epoch: 26, train_loss: 0.6649, test_loss: 1.1485, test_f1: 0.5795
 epoch: 27, train_loss: 0.6621, test_loss: 1.0394, test_f1: 0.5974
 epoch: 28, train_loss: 0.6515, test_loss: 1.0251, test_f1: 0.5973
 epoch: 29, train_loss: 0.6439, test_loss: 1.0074, test_f1: 0.6035
 epoch: 30, train_loss: 0.6233, test_loss: 0.9890, test_f1: 0.6176
 epoch: 31, train_loss: 0.6108, test_loss: 1.0715, test_f1: 0.6115
 epoch: 32, train_loss: 0.5976, test_loss: 1.0303, test_f1: 0.6148
 epoch: 33, train_loss: 0.6078, test_loss: 1.0742, test_f1: 0.5992
 epoch: 34, train_loss: 0.5903, test_loss: 1.1317, test_f1: 0.5896
 epoch: 35, train_loss: 0.5872, test_loss: 1.0194, test_f1: 0.6339
 epoch: 36, train_loss: 0.5706, test_loss: 1.1377, test_f1: 0.6104
 epoch: 37, train_loss: 0.5985, test_loss: 1.1332, test_f1: 0.5821
 epoch: 38, train_loss: 0.5724, test_loss: 1.0431, test_f1: 0.6447
 epoch: 39, train_loss: 0.5645, test_loss: 1.0566, test_f1: 0.6450
 epoch: 40, train_loss: 0.5399, test_loss: 1.1194, test_f1: 0.6265
 epoch: 41, train_loss: 0.5336, test_loss: 1.1693, test_f1: 0.6292
 epoch: 42, train_loss: 0.5382, test_loss: 1.1574, test_f1: 0.6000
 epoch: 43, train_loss: 0.5136, test_loss: 1.2409, test_f1: 0.6186
 epoch: 44, train_loss: 0.4998, test_loss: 1.1882, test_f1: 0.5991
 epoch: 45, train_loss: 0.4849, test_loss: 1.0683, test_f1: 0.6352
 epoch: 46, train_loss: 0.4831, test_loss: 1.1181, test_f1: 0.6138
 epoch: 47, train_loss: 0.4988, test_loss: 1.2105, test_f1: 0.6224
 epoch: 48, train_loss: 0.4788, test_loss: 1.2099, test_f1: 0.6335
 epoch: 49, train_loss: 0.4749, test_loss: 1.2798, test_f1: 0.6020
 epoch: 50, train_loss: 0.4920, test_loss: 1.2446, test_f1: 0.6321
 epoch: 51, train_loss: 0.4377, test_loss: 1.1903, test_f1: 0.6406
 epoch: 52, train_loss: 0.4085, test_loss: 1.2268, test_f1: 0.6364
 epoch: 53, train_loss: 0.3821, test_loss: 1.2755, test_f1: 0.6518
 epoch: 54, train_loss: 0.3875, test_loss: 1.3833, test_f1: 0.6257
 epoch: 55, train_loss: 0.3668, test_loss: 1.2230, test_f1: 0.6667
 epoch: 56, train_loss: 0.3784, test_loss: 1.3774, test_f1: 0.6236
 epoch: 57, train_loss: 0.3681, test_loss: 1.2549, test_f1: 0.6270
 epoch: 58, train_loss: 0.3793, test_loss: 1.2788, test_f1: 0.6372
 epoch: 59, train_loss: 0.3632, test_loss: 1.4125, test_f1: 0.6366
 epoch: 60, train_loss: 0.3481, test_loss: 1.3550, test_f1: 0.6427
 epoch: 61, train_loss: 0.3357, test_loss: 1.2898, test_f1: 0.6389
 epoch: 62, train_loss: 0.3240, test_loss: 1.3375, test_f1: 0.6534
 epoch: 63, train_loss: 0.3266, test_loss: 1.4567, test_f1: 0.6381
 epoch: 64, train_loss: 0.3140, test_loss: 1.4078, test_f1: 0.6326
 epoch: 65, train_loss: 0.3227, test_loss: 1.4222, test_f1: 0.6423
 epoch: 66, train_loss: 0.3303, test_loss: 1.4515, test_f1: 0.6552
 epoch: 67, train_loss: 0.3117, test_loss: 1.5670, test_f1: 0.6395
 epoch: 68, train_loss: 0.3135, test_loss: 1.5450, test_f1: 0.6456
 epoch: 69, train_loss: 0.3115, test_loss: 1.4897, test_f1: 0.6107
 epoch: 70, train_loss: 0.3175, test_loss: 1.4233, test_f1: 0.6380
 epoch: 71, train_loss: 0.3084, test_loss: 1.5268, test_f1: 0.6488
 epoch: 72, train_loss: 0.3060, test_loss: 1.4595, test_f1: 0.6251
 epoch: 73, train_loss: 0.2979, test_loss: 1.6147, test_f1: 0.6149
 epoch: 74, train_loss: 0.2949, test_loss: 1.6250, test_f1: 0.6527
 epoch: 75, train_loss: 0.2715, test_loss: 1.5632, test_f1: 0.6433
 epoch: 76, train_loss: 0.3001, test_loss: 1.5971, test_f1: 0.6164
 epoch: 77, train_loss: 0.2745, test_loss: 1.4702, test_f1: 0.6406
 epoch: 78, train_loss: 0.2729, test_loss: 1.5514, test_f1: 0.6475
 epoch: 79, train_loss: 0.2728, test_loss: 1.6012, test_f1: 0.6482
 epoch: 80, train_loss: 0.2595, test_loss: 1.7613, test_f1: 0.6440
 epoch: 81, train_loss: 0.2656, test_loss: 1.6551, test_f1: 0.6236
 epoch: 82, train_loss: 0.2657, test_loss: 1.5567, test_f1: 0.6493
 epoch: 83, train_loss: 0.2594, test_loss: 1.6395, test_f1: 0.6459
 epoch: 84, train_loss: 0.2510, test_loss: 1.5825, test_f1: 0.6181
 epoch: 85, train_loss: 0.2597, test_loss: 1.6070, test_f1: 0.6528
 epoch: 86, train_loss: 0.2635, test_loss: 1.6974, test_f1: 0.6509
 epoch: 87, train_loss: 0.2573, test_loss: 1.6685, test_f1: 0.6374
 epoch: 88, train_loss: 0.2508, test_loss: 1.7299, test_f1: 0.6469
 epoch: 89, train_loss: 0.2580, test_loss: 1.6408, test_f1: 0.6641
 epoch: 90, train_loss: 0.2560, test_loss: 1.5868, test_f1: 0.6348
 epoch: 91, train_loss: 0.2445, test_loss: 1.8334, test_f1: 0.6464
 epoch: 92, train_loss: 0.2406, test_loss: 1.7553, test_f1: 0.6393
 epoch: 93, train_loss: 0.2342, test_loss: 1.7918, test_f1: 0.6497
 epoch: 94, train_loss: 0.2199, test_loss: 1.8346, test_f1: 0.6325
 epoch: 95, train_loss: 0.2072, test_loss: 1.9451, test_f1: 0.6187
 epoch: 96, train_loss: 0.2242, test_loss: 1.9370, test_f1: 0.6327
 epoch: 97, train_loss: 0.2275, test_loss: 1.8043, test_f1: 0.6551
 epoch: 98, train_loss: 0.2247, test_loss: 1.8437, test_f1: 0.6390
 epoch: 99, train_loss: 0.2161, test_loss: 1.9289, test_f1: 0.6243
##################ITERATION #8 ****************************************
 epoch: 0, train_loss: 1.3606, test_loss: 1.1086, test_f1: 0.3492
 epoch: 1, train_loss: 1.0386, test_loss: 1.0064, test_f1: 0.5000
 epoch: 2, train_loss: 0.9623, test_loss: 0.9305, test_f1: 0.4592
 epoch: 3, train_loss: 0.9288, test_loss: 0.9272, test_f1: 0.4738
 epoch: 4, train_loss: 0.8992, test_loss: 0.9581, test_f1: 0.5021
 epoch: 5, train_loss: 0.8727, test_loss: 1.0136, test_f1: 0.5006
 epoch: 6, train_loss: 0.8646, test_loss: 0.9898, test_f1: 0.4971
 epoch: 7, train_loss: 0.8563, test_loss: 0.9717, test_f1: 0.5335
 epoch: 8, train_loss: 0.8345, test_loss: 0.9973, test_f1: 0.5042
 epoch: 9, train_loss: 0.8249, test_loss: 0.9389, test_f1: 0.5353
 epoch: 10, train_loss: 0.8208, test_loss: 0.9598, test_f1: 0.5464
 epoch: 11, train_loss: 0.8160, test_loss: 1.0311, test_f1: 0.5586
 epoch: 12, train_loss: 0.7785, test_loss: 1.0211, test_f1: 0.5603
 epoch: 13, train_loss: 0.7940, test_loss: 1.0319, test_f1: 0.5616
 epoch: 14, train_loss: 0.7771, test_loss: 1.0405, test_f1: 0.5871
 epoch: 15, train_loss: 0.7702, test_loss: 1.0577, test_f1: 0.5610
 epoch: 16, train_loss: 0.7549, test_loss: 0.9960, test_f1: 0.5485
 epoch: 17, train_loss: 0.7307, test_loss: 1.0433, test_f1: 0.5614
 epoch: 18, train_loss: 0.7331, test_loss: 1.0638, test_f1: 0.5687
 epoch: 19, train_loss: 0.7189, test_loss: 1.0689, test_f1: 0.5861
 epoch: 20, train_loss: 0.7021, test_loss: 1.0317, test_f1: 0.5931
 epoch: 21, train_loss: 0.6993, test_loss: 1.0729, test_f1: 0.6098
 epoch: 22, train_loss: 0.7110, test_loss: 0.9966, test_f1: 0.5595
 epoch: 23, train_loss: 0.6982, test_loss: 1.1040, test_f1: 0.5728
 epoch: 24, train_loss: 0.6807, test_loss: 1.1346, test_f1: 0.5480
 epoch: 25, train_loss: 0.6670, test_loss: 0.9902, test_f1: 0.6429
 epoch: 26, train_loss: 0.6658, test_loss: 1.1334, test_f1: 0.5737
 epoch: 27, train_loss: 0.6632, test_loss: 1.1229, test_f1: 0.5490
 epoch: 28, train_loss: 0.6649, test_loss: 1.0914, test_f1: 0.6001
 epoch: 29, train_loss: 0.6522, test_loss: 1.0671, test_f1: 0.5941
 epoch: 30, train_loss: 0.6349, test_loss: 1.0483, test_f1: 0.6022
 epoch: 31, train_loss: 0.6256, test_loss: 1.0736, test_f1: 0.6087
 epoch: 32, train_loss: 0.6101, test_loss: 1.1091, test_f1: 0.6308
 epoch: 33, train_loss: 0.6181, test_loss: 1.0933, test_f1: 0.6263
 epoch: 34, train_loss: 0.6009, test_loss: 1.1125, test_f1: 0.6216
 epoch: 35, train_loss: 0.5927, test_loss: 1.1725, test_f1: 0.5905
 epoch: 36, train_loss: 0.5660, test_loss: 1.1281, test_f1: 0.6218
 epoch: 37, train_loss: 0.5679, test_loss: 1.1526, test_f1: 0.6366
 epoch: 38, train_loss: 0.5582, test_loss: 1.2939, test_f1: 0.6099
 epoch: 39, train_loss: 0.5597, test_loss: 1.1763, test_f1: 0.6396
 epoch: 40, train_loss: 0.5727, test_loss: 1.1628, test_f1: 0.6459
 epoch: 41, train_loss: 0.5489, test_loss: 1.2256, test_f1: 0.6299
 epoch: 42, train_loss: 0.5267, test_loss: 1.1219, test_f1: 0.6325
 epoch: 43, train_loss: 0.5252, test_loss: 1.1531, test_f1: 0.6136
 epoch: 44, train_loss: 0.4992, test_loss: 1.1313, test_f1: 0.6130
 epoch: 45, train_loss: 0.5078, test_loss: 1.1686, test_f1: 0.6001
 epoch: 46, train_loss: 0.4927, test_loss: 1.1539, test_f1: 0.6458
 epoch: 47, train_loss: 0.4968, test_loss: 1.1901, test_f1: 0.6210
 epoch: 48, train_loss: 0.5210, test_loss: 1.2923, test_f1: 0.6249
 epoch: 49, train_loss: 0.4870, test_loss: 1.1909, test_f1: 0.6201
 epoch: 50, train_loss: 0.4771, test_loss: 1.2690, test_f1: 0.6274
 epoch: 51, train_loss: 0.4272, test_loss: 1.2957, test_f1: 0.6311
 epoch: 52, train_loss: 0.3950, test_loss: 1.2793, test_f1: 0.6072
 epoch: 53, train_loss: 0.3783, test_loss: 1.3062, test_f1: 0.6316
 epoch: 54, train_loss: 0.3698, test_loss: 1.2515, test_f1: 0.6534
 epoch: 55, train_loss: 0.3653, test_loss: 1.4236, test_f1: 0.6322
 epoch: 56, train_loss: 0.3546, test_loss: 1.4351, test_f1: 0.6220
 epoch: 57, train_loss: 0.3488, test_loss: 1.4294, test_f1: 0.6614
 epoch: 58, train_loss: 0.3449, test_loss: 1.3496, test_f1: 0.6287
 epoch: 59, train_loss: 0.3456, test_loss: 1.4198, test_f1: 0.6362
 epoch: 60, train_loss: 0.3283, test_loss: 1.5989, test_f1: 0.6302
 epoch: 61, train_loss: 0.3178, test_loss: 1.4368, test_f1: 0.6604
 epoch: 62, train_loss: 0.3205, test_loss: 1.5718, test_f1: 0.6170
 epoch: 63, train_loss: 0.3358, test_loss: 1.5735, test_f1: 0.6220
 epoch: 64, train_loss: 0.3239, test_loss: 1.4483, test_f1: 0.6506
 epoch: 65, train_loss: 0.3140, test_loss: 1.5047, test_f1: 0.6175
 epoch: 66, train_loss: 0.3103, test_loss: 1.4989, test_f1: 0.6312
 epoch: 67, train_loss: 0.3042, test_loss: 1.5665, test_f1: 0.6262
 epoch: 68, train_loss: 0.3007, test_loss: 1.6428, test_f1: 0.6328
 epoch: 69, train_loss: 0.2895, test_loss: 1.5859, test_f1: 0.6450
 epoch: 70, train_loss: 0.2755, test_loss: 1.5842, test_f1: 0.6292
 epoch: 71, train_loss: 0.2690, test_loss: 1.5674, test_f1: 0.6404
 epoch: 72, train_loss: 0.2824, test_loss: 1.6662, test_f1: 0.6498
 epoch: 73, train_loss: 0.2681, test_loss: 1.6622, test_f1: 0.6230
 epoch: 74, train_loss: 0.2688, test_loss: 1.5915, test_f1: 0.6458
 epoch: 75, train_loss: 0.2803, test_loss: 1.7403, test_f1: 0.6432
 epoch: 76, train_loss: 0.2810, test_loss: 1.6315, test_f1: 0.6365
 epoch: 77, train_loss: 0.2941, test_loss: 1.8619, test_f1: 0.6349
 epoch: 78, train_loss: 0.2672, test_loss: 1.6715, test_f1: 0.6222
 epoch: 79, train_loss: 0.2704, test_loss: 1.6831, test_f1: 0.6302
 epoch: 80, train_loss: 0.2546, test_loss: 1.7209, test_f1: 0.6438
 epoch: 81, train_loss: 0.2500, test_loss: 1.7479, test_f1: 0.6222
 epoch: 82, train_loss: 0.2466, test_loss: 1.7543, test_f1: 0.6263
 epoch: 83, train_loss: 0.2334, test_loss: 1.8682, test_f1: 0.6337
 epoch: 84, train_loss: 0.2478, test_loss: 1.8434, test_f1: 0.6189
 epoch: 85, train_loss: 0.2452, test_loss: 1.7872, test_f1: 0.6425
 epoch: 86, train_loss: 0.2536, test_loss: 1.9648, test_f1: 0.6231
 epoch: 87, train_loss: 0.2312, test_loss: 1.7376, test_f1: 0.6202
 epoch: 88, train_loss: 0.2304, test_loss: 1.7166, test_f1: 0.6533
 epoch: 89, train_loss: 0.2509, test_loss: 1.8595, test_f1: 0.6327
 epoch: 90, train_loss: 0.2375, test_loss: 1.9076, test_f1: 0.6313
 epoch: 91, train_loss: 0.2210, test_loss: 1.7575, test_f1: 0.6595
 epoch: 92, train_loss: 0.2307, test_loss: 1.7965, test_f1: 0.6272
 epoch: 93, train_loss: 0.2527, test_loss: 1.8102, test_f1: 0.6299
 epoch: 94, train_loss: 0.2363, test_loss: 1.8545, test_f1: 0.6395
 epoch: 95, train_loss: 0.2179, test_loss: 2.0197, test_f1: 0.6323
 epoch: 96, train_loss: 0.2342, test_loss: 2.0252, test_f1: 0.6051
 epoch: 97, train_loss: 0.2237, test_loss: 1.8573, test_f1: 0.6241
 epoch: 98, train_loss: 0.2415, test_loss: 2.0385, test_f1: 0.6202
 epoch: 99, train_loss: 0.2220, test_loss: 1.9985, test_f1: 0.6100
##################ITERATION #9 ****************************************
 epoch: 0, train_loss: 1.4190, test_loss: 1.2620, test_f1: 0.3085
 epoch: 1, train_loss: 1.0208, test_loss: 1.0532, test_f1: 0.4360
 epoch: 2, train_loss: 0.9648, test_loss: 0.9935, test_f1: 0.4743
 epoch: 3, train_loss: 0.9365, test_loss: 0.9632, test_f1: 0.4915
 epoch: 4, train_loss: 0.9154, test_loss: 0.9574, test_f1: 0.5058
 epoch: 5, train_loss: 0.8977, test_loss: 0.9648, test_f1: 0.5082
 epoch: 6, train_loss: 0.8724, test_loss: 0.9887, test_f1: 0.5309
 epoch: 7, train_loss: 0.8507, test_loss: 0.9495, test_f1: 0.5087
 epoch: 8, train_loss: 0.8346, test_loss: 0.9880, test_f1: 0.5194
 epoch: 9, train_loss: 0.8118, test_loss: 1.0224, test_f1: 0.5616
 epoch: 10, train_loss: 0.7988, test_loss: 1.0433, test_f1: 0.5515
 epoch: 11, train_loss: 0.7952, test_loss: 0.9944, test_f1: 0.5339
 epoch: 12, train_loss: 0.7960, test_loss: 1.0015, test_f1: 0.5107
 epoch: 13, train_loss: 0.7815, test_loss: 0.9698, test_f1: 0.5538
 epoch: 14, train_loss: 0.7718, test_loss: 0.9796, test_f1: 0.6093
 epoch: 15, train_loss: 0.7470, test_loss: 1.0480, test_f1: 0.5669
 epoch: 16, train_loss: 0.7515, test_loss: 0.9545, test_f1: 0.5922
 epoch: 17, train_loss: 0.7223, test_loss: 1.0581, test_f1: 0.5637
 epoch: 18, train_loss: 0.7162, test_loss: 0.9506, test_f1: 0.5955
 epoch: 19, train_loss: 0.7101, test_loss: 0.9975, test_f1: 0.6227
 epoch: 20, train_loss: 0.7065, test_loss: 0.9811, test_f1: 0.6079
 epoch: 21, train_loss: 0.6871, test_loss: 0.9882, test_f1: 0.6134
 epoch: 22, train_loss: 0.6820, test_loss: 1.0040, test_f1: 0.6036
 epoch: 23, train_loss: 0.6571, test_loss: 1.0255, test_f1: 0.5859
 epoch: 24, train_loss: 0.6686, test_loss: 0.9678, test_f1: 0.6197
 epoch: 25, train_loss: 0.6763, test_loss: 1.0197, test_f1: 0.6211
 epoch: 26, train_loss: 0.6470, test_loss: 1.0000, test_f1: 0.5874
 epoch: 27, train_loss: 0.6299, test_loss: 1.0878, test_f1: 0.6032
 epoch: 28, train_loss: 0.6047, test_loss: 1.1609, test_f1: 0.5592
 epoch: 29, train_loss: 0.6230, test_loss: 1.0441, test_f1: 0.6180
 epoch: 30, train_loss: 0.5895, test_loss: 1.0841, test_f1: 0.6173
 epoch: 31, train_loss: 0.6030, test_loss: 1.0881, test_f1: 0.6237
 epoch: 32, train_loss: 0.5926, test_loss: 1.1660, test_f1: 0.5998
 epoch: 33, train_loss: 0.5981, test_loss: 1.1070, test_f1: 0.5837
 epoch: 34, train_loss: 0.6029, test_loss: 1.0947, test_f1: 0.6164
 epoch: 35, train_loss: 0.5780, test_loss: 1.0679, test_f1: 0.5976
 epoch: 36, train_loss: 0.5487, test_loss: 1.1524, test_f1: 0.6018
 epoch: 37, train_loss: 0.5516, test_loss: 1.0195, test_f1: 0.6424
 epoch: 38, train_loss: 0.5411, test_loss: 1.1406, test_f1: 0.5884
 epoch: 39, train_loss: 0.5454, test_loss: 1.0392, test_f1: 0.6178
 epoch: 40, train_loss: 0.5424, test_loss: 1.0440, test_f1: 0.6314
 epoch: 41, train_loss: 0.5453, test_loss: 1.1219, test_f1: 0.6109
 epoch: 42, train_loss: 0.5320, test_loss: 1.2237, test_f1: 0.6208
 epoch: 43, train_loss: 0.4766, test_loss: 1.1471, test_f1: 0.6361
 epoch: 44, train_loss: 0.4790, test_loss: 1.2537, test_f1: 0.5895
 epoch: 45, train_loss: 0.4833, test_loss: 1.2254, test_f1: 0.6342
 epoch: 46, train_loss: 0.4842, test_loss: 1.1131, test_f1: 0.6124
 epoch: 47, train_loss: 0.4894, test_loss: 1.1116, test_f1: 0.6412
 epoch: 48, train_loss: 0.4663, test_loss: 1.1957, test_f1: 0.5922
 epoch: 49, train_loss: 0.4746, test_loss: 1.2671, test_f1: 0.6297
 epoch: 50, train_loss: 0.4701, test_loss: 1.1876, test_f1: 0.6559
 epoch: 51, train_loss: 0.4242, test_loss: 1.2331, test_f1: 0.6490
 epoch: 52, train_loss: 0.3828, test_loss: 1.3050, test_f1: 0.6215
 epoch: 53, train_loss: 0.3654, test_loss: 1.3865, test_f1: 0.6070
 epoch: 54, train_loss: 0.3613, test_loss: 1.3583, test_f1: 0.6229
 epoch: 55, train_loss: 0.3371, test_loss: 1.4274, test_f1: 0.5981
 epoch: 56, train_loss: 0.3350, test_loss: 1.3599, test_f1: 0.6564
 epoch: 57, train_loss: 0.3405, test_loss: 1.5020, test_f1: 0.6406
 epoch: 58, train_loss: 0.3270, test_loss: 1.3737, test_f1: 0.6133
 epoch: 59, train_loss: 0.3249, test_loss: 1.3279, test_f1: 0.6287
 epoch: 60, train_loss: 0.3320, test_loss: 1.3972, test_f1: 0.6357
 epoch: 61, train_loss: 0.3147, test_loss: 1.4232, test_f1: 0.6598
 epoch: 62, train_loss: 0.3245, test_loss: 1.4370, test_f1: 0.6473
 epoch: 63, train_loss: 0.3144, test_loss: 1.4352, test_f1: 0.6411
 epoch: 64, train_loss: 0.3056, test_loss: 1.4284, test_f1: 0.6345
 epoch: 65, train_loss: 0.3068, test_loss: 1.5023, test_f1: 0.6365
 epoch: 66, train_loss: 0.2999, test_loss: 1.5892, test_f1: 0.6322
 epoch: 67, train_loss: 0.2987, test_loss: 1.5410, test_f1: 0.6545
 epoch: 68, train_loss: 0.2748, test_loss: 1.4441, test_f1: 0.6426
 epoch: 69, train_loss: 0.2835, test_loss: 1.5236, test_f1: 0.6445
 epoch: 70, train_loss: 0.2902, test_loss: 1.5631, test_f1: 0.6520
 epoch: 71, train_loss: 0.2525, test_loss: 1.5549, test_f1: 0.6685
 epoch: 72, train_loss: 0.2789, test_loss: 1.6663, test_f1: 0.6316
 epoch: 73, train_loss: 0.2763, test_loss: 1.6407, test_f1: 0.6393
 epoch: 74, train_loss: 0.2596, test_loss: 1.6325, test_f1: 0.6339
 epoch: 75, train_loss: 0.2620, test_loss: 1.6298, test_f1: 0.6196
 epoch: 76, train_loss: 0.2528, test_loss: 1.6255, test_f1: 0.6328
 epoch: 77, train_loss: 0.2624, test_loss: 1.5028, test_f1: 0.6543
 epoch: 78, train_loss: 0.2767, test_loss: 1.6990, test_f1: 0.6316
 epoch: 79, train_loss: 0.2375, test_loss: 1.6282, test_f1: 0.6531
 epoch: 80, train_loss: 0.2535, test_loss: 1.6320, test_f1: 0.6255
 epoch: 81, train_loss: 0.2306, test_loss: 1.7529, test_f1: 0.6315
 epoch: 82, train_loss: 0.2440, test_loss: 1.6651, test_f1: 0.6510
 epoch: 83, train_loss: 0.2284, test_loss: 1.7283, test_f1: 0.6358
 epoch: 84, train_loss: 0.2419, test_loss: 1.8424, test_f1: 0.6506
 epoch: 85, train_loss: 0.2223, test_loss: 1.8014, test_f1: 0.6002
 epoch: 86, train_loss: 0.2333, test_loss: 1.9278, test_f1: 0.6191
 epoch: 87, train_loss: 0.2487, test_loss: 1.9093, test_f1: 0.6216
 epoch: 88, train_loss: 0.2335, test_loss: 1.8626, test_f1: 0.6185
 epoch: 89, train_loss: 0.2253, test_loss: 1.7578, test_f1: 0.6248
 epoch: 90, train_loss: 0.2245, test_loss: 1.8035, test_f1: 0.6489
 epoch: 91, train_loss: 0.2213, test_loss: 1.7467, test_f1: 0.6454
 epoch: 92, train_loss: 0.2136, test_loss: 1.9468, test_f1: 0.6388
 epoch: 93, train_loss: 0.2235, test_loss: 1.9209, test_f1: 0.6483
 epoch: 94, train_loss: 0.2188, test_loss: 1.8645, test_f1: 0.6346
 epoch: 95, train_loss: 0.2040, test_loss: 1.9026, test_f1: 0.6341
 epoch: 96, train_loss: 0.2119, test_loss: 1.8593, test_f1: 0.6543
 epoch: 97, train_loss: 0.2007, test_loss: 2.0533, test_f1: 0.6408
 epoch: 98, train_loss: 0.1982, test_loss: 1.9703, test_f1: 0.6279
 epoch: 99, train_loss: 0.2103, test_loss: 2.0847, test_f1: 0.6203

Training completed in 566.47 seconds
Best F1: 0.6957 at epoch 78
Mean F1 across iterations: 0.6725  0.0148
========================FINAL RESULTS================================
FEGIN weighted F1: 0.6957  0.0148
python main.py --data ltspice_examples --representation component_net --model FEGIN --layers 6 --hiddens 128 --batch_size 128 --lr 0.001 --emb_size 128 --epochs 100 --save_appendix component_net_L6_H128_BS128_LR0.001_E128 --no_val
-----



STDERR:
  File "main.py", line 370, in <module>
    main()
  File "main.py", line 254, in main
    dataset = dataset_class(
  File "/home/philip/projects/ltspice_examples_code_repo/Circuit-Completion-Using-GNNs/component_classification_with_link_prediction_head/evaluation/FEGIN/kernel/circuit_datasets.py", line 15, in __init__
    self.data, self.slices = torch.load(self.processed_paths[0])
  File "/home/philip/.local/lib/python3.8/site-packages/torch/serialization.py", line 1040, in load
    warnings.warn(
  File "/usr/lib/python3.8/warnings.py", line 109, in _showwarnmsg
    sw(msg.message, msg.category, msg.filename, msg.lineno,
  File "main.py", line 47, in warn_with_traceback
    traceback.print_stack(file=log)
/home/philip/projects/ltspice_examples_code_repo/Circuit-Completion-Using-GNNs/component_classification_with_link_prediction_head/evaluation/FEGIN/kernel/circuit_datasets.py:15: FutureWarning: You are using `torch.load` with `weights_only=False` (the current default value), which uses the default pickle module implicitly. It is possible to construct malicious pickle data which will execute arbitrary code during unpickling (See https://github.com/pytorch/pytorch/blob/main/SECURITY.md#untrusted-models for more details). In a future release, the default value for `weights_only` will be flipped to `True`. This limits the functions that could be executed during unpickling. Arbitrary objects will no longer be allowed to be loaded via this mode unless they are explicitly allowlisted by the user via `torch.serialization.add_safe_globals`. We recommend you start setting `weights_only=True` for any use case where you don't have full control of the loaded file. Please open an issue on GitHub for any issues related to this experimental feature.
  self.data, self.slices = torch.load(self.processed_paths[0])
