STDOUT:
Results will be saved in /home/philip/projects/ltspice_examples_code_repo/Circuit-Completion-Using-GNNs/component_classification_with_link_prediction_head/evaluation/FEGIN/results/model_FEGIN_dataset_ltspice_examples
Command line input: python main.py --data ltspice_examples --representation component_pin --model FEGIN --layers 6 --hiddens 32 --batch_size 32 --lr 0.01 --emb_size 512 --epochs 100 --save_appendix component_pin_L6_H32_BS32_LR0.01_E512 --no_val
 is saved.
-----
ltspice_examples - FEGIN
Using 6 layers, 32 hidden units, h = 2
Loading component_pin representation dataset
ENTERED
Training FEGIN on component_pin representation
Train: 3560, Test: 848
##################ITERATION #0 ****************************************
 epoch: 0, train_loss: 1.1779, test_loss: 2.7764, test_f1: 0.2626
 epoch: 1, train_loss: 1.0652, test_loss: 1.0970, test_f1: 0.3852
 epoch: 2, train_loss: 1.0376, test_loss: 1.1005, test_f1: 0.4922
 epoch: 3, train_loss: 1.0158, test_loss: 1.1028, test_f1: 0.4728
 epoch: 4, train_loss: 1.0049, test_loss: 0.9651, test_f1: 0.4868
 epoch: 5, train_loss: 0.9703, test_loss: 1.0095, test_f1: 0.4914
 epoch: 6, train_loss: 0.9537, test_loss: 0.9904, test_f1: 0.4284
 epoch: 7, train_loss: 0.9530, test_loss: 0.9195, test_f1: 0.4929
 epoch: 8, train_loss: 0.9202, test_loss: 0.9826, test_f1: 0.4787
 epoch: 9, train_loss: 0.9177, test_loss: 0.9245, test_f1: 0.5527
 epoch: 10, train_loss: 0.9042, test_loss: 0.8991, test_f1: 0.5156
 epoch: 11, train_loss: 0.9166, test_loss: 0.9629, test_f1: 0.4360
 epoch: 12, train_loss: 0.8988, test_loss: 0.9472, test_f1: 0.5302
 epoch: 13, train_loss: 0.8817, test_loss: 0.8882, test_f1: 0.5631
 epoch: 14, train_loss: 0.8642, test_loss: 0.8734, test_f1: 0.5162
 epoch: 15, train_loss: 0.8813, test_loss: 0.9202, test_f1: 0.5578
 epoch: 16, train_loss: 0.8576, test_loss: 0.8726, test_f1: 0.5323
 epoch: 17, train_loss: 0.8563, test_loss: 0.9519, test_f1: 0.5429
 epoch: 18, train_loss: 0.8615, test_loss: 0.8807, test_f1: 0.5137
 epoch: 19, train_loss: 0.8678, test_loss: 0.9019, test_f1: 0.5126
 epoch: 20, train_loss: 0.8524, test_loss: 0.8678, test_f1: 0.5118
 epoch: 21, train_loss: 0.8566, test_loss: 0.8780, test_f1: 0.5401
 epoch: 22, train_loss: 0.8394, test_loss: 0.9040, test_f1: 0.5520
 epoch: 23, train_loss: 0.8349, test_loss: 0.8609, test_f1: 0.5448
 epoch: 24, train_loss: 0.8302, test_loss: 0.8633, test_f1: 0.4948
 epoch: 25, train_loss: 0.8208, test_loss: 0.8542, test_f1: 0.5467
 epoch: 26, train_loss: 0.8187, test_loss: 0.8712, test_f1: 0.5296
 epoch: 27, train_loss: 0.7996, test_loss: 0.8308, test_f1: 0.5755
 epoch: 28, train_loss: 0.8206, test_loss: 0.8670, test_f1: 0.5470
 epoch: 29, train_loss: 0.8267, test_loss: 0.8861, test_f1: 0.5509
 epoch: 30, train_loss: 0.8094, test_loss: 0.8125, test_f1: 0.5986
 epoch: 31, train_loss: 0.7965, test_loss: 0.8567, test_f1: 0.5568
 epoch: 32, train_loss: 0.8022, test_loss: 0.8020, test_f1: 0.5430
 epoch: 33, train_loss: 0.7854, test_loss: 0.8508, test_f1: 0.5852
 epoch: 34, train_loss: 0.7992, test_loss: 0.8438, test_f1: 0.5389
 epoch: 35, train_loss: 0.7763, test_loss: 0.8172, test_f1: 0.6134
 epoch: 36, train_loss: 0.7909, test_loss: 0.8991, test_f1: 0.6073
 epoch: 37, train_loss: 0.7829, test_loss: 0.8590, test_f1: 0.6087
 epoch: 38, train_loss: 0.7665, test_loss: 0.8426, test_f1: 0.5764
 epoch: 39, train_loss: 0.7926, test_loss: 0.8411, test_f1: 0.5580
 epoch: 40, train_loss: 0.7783, test_loss: 0.8325, test_f1: 0.5662
 epoch: 41, train_loss: 0.7801, test_loss: 0.7776, test_f1: 0.5939
 epoch: 42, train_loss: 0.7788, test_loss: 0.8225, test_f1: 0.5643
 epoch: 43, train_loss: 0.7663, test_loss: 0.9620, test_f1: 0.5563
 epoch: 44, train_loss: 0.7620, test_loss: 0.8295, test_f1: 0.5753
 epoch: 45, train_loss: 0.7541, test_loss: 0.8762, test_f1: 0.5317
 epoch: 46, train_loss: 0.7559, test_loss: 0.8342, test_f1: 0.5935
 epoch: 47, train_loss: 0.7639, test_loss: 0.9252, test_f1: 0.5912
 epoch: 48, train_loss: 0.7560, test_loss: 0.8927, test_f1: 0.5341
 epoch: 49, train_loss: 0.7549, test_loss: 0.9017, test_f1: 0.5567
 epoch: 50, train_loss: 0.7434, test_loss: 0.8684, test_f1: 0.5847
 epoch: 51, train_loss: 0.7152, test_loss: 0.8578, test_f1: 0.6173
 epoch: 52, train_loss: 0.6999, test_loss: 0.8913, test_f1: 0.6016
 epoch: 53, train_loss: 0.7012, test_loss: 0.8467, test_f1: 0.6111
 epoch: 54, train_loss: 0.6902, test_loss: 0.8103, test_f1: 0.6050
 epoch: 55, train_loss: 0.6930, test_loss: 0.8214, test_f1: 0.6129
 epoch: 56, train_loss: 0.6839, test_loss: 0.8781, test_f1: 0.5827
 epoch: 57, train_loss: 0.6919, test_loss: 0.8196, test_f1: 0.6000
 epoch: 58, train_loss: 0.6767, test_loss: 0.7826, test_f1: 0.6313
 epoch: 59, train_loss: 0.6754, test_loss: 0.8329, test_f1: 0.6068
 epoch: 60, train_loss: 0.6780, test_loss: 0.8366, test_f1: 0.6283
 epoch: 61, train_loss: 0.6753, test_loss: 0.8597, test_f1: 0.6406
 epoch: 62, train_loss: 0.6618, test_loss: 0.8480, test_f1: 0.6423
 epoch: 63, train_loss: 0.6649, test_loss: 0.8098, test_f1: 0.6308
 epoch: 64, train_loss: 0.6664, test_loss: 0.8739, test_f1: 0.6147
 epoch: 65, train_loss: 0.6753, test_loss: 0.8830, test_f1: 0.6522
 epoch: 66, train_loss: 0.6484, test_loss: 0.8071, test_f1: 0.6146
 epoch: 67, train_loss: 0.6696, test_loss: 0.9195, test_f1: 0.5608
 epoch: 68, train_loss: 0.6687, test_loss: 0.8400, test_f1: 0.6115
 epoch: 69, train_loss: 0.6541, test_loss: 0.8426, test_f1: 0.6248
 epoch: 70, train_loss: 0.6683, test_loss: 0.8344, test_f1: 0.6289
 epoch: 71, train_loss: 0.6517, test_loss: 0.8463, test_f1: 0.5816
 epoch: 72, train_loss: 0.6419, test_loss: 0.7946, test_f1: 0.6409
 epoch: 73, train_loss: 0.6560, test_loss: 0.8295, test_f1: 0.6130
 epoch: 74, train_loss: 0.6441, test_loss: 0.8382, test_f1: 0.6442
 epoch: 75, train_loss: 0.6592, test_loss: 0.8502, test_f1: 0.6203
 epoch: 76, train_loss: 0.6231, test_loss: 0.8302, test_f1: 0.6497
 epoch: 77, train_loss: 0.6499, test_loss: 0.7973, test_f1: 0.6373
 epoch: 78, train_loss: 0.6453, test_loss: 0.8072, test_f1: 0.6699
 epoch: 79, train_loss: 0.6304, test_loss: 0.8402, test_f1: 0.6343
 epoch: 80, train_loss: 0.6388, test_loss: 0.8181, test_f1: 0.6304
 epoch: 81, train_loss: 0.6431, test_loss: 0.8259, test_f1: 0.6213
 epoch: 82, train_loss: 0.6377, test_loss: 0.8972, test_f1: 0.6129
 epoch: 83, train_loss: 0.6530, test_loss: 0.8937, test_f1: 0.6434
 epoch: 84, train_loss: 0.6311, test_loss: 0.9182, test_f1: 0.6364
 epoch: 85, train_loss: 0.6247, test_loss: 0.9384, test_f1: 0.6227
 epoch: 86, train_loss: 0.6269, test_loss: 0.8904, test_f1: 0.6508
 epoch: 87, train_loss: 0.6324, test_loss: 0.9222, test_f1: 0.6162
 epoch: 88, train_loss: 0.6434, test_loss: 0.8637, test_f1: 0.6495
 epoch: 89, train_loss: 0.6390, test_loss: 0.8834, test_f1: 0.6260
 epoch: 90, train_loss: 0.6227, test_loss: 0.8912, test_f1: 0.6438
 epoch: 91, train_loss: 0.6246, test_loss: 0.9214, test_f1: 0.6415
 epoch: 92, train_loss: 0.6243, test_loss: 0.9323, test_f1: 0.6233
 epoch: 93, train_loss: 0.6242, test_loss: 0.9056, test_f1: 0.6258
 epoch: 94, train_loss: 0.6206, test_loss: 0.8843, test_f1: 0.6293
 epoch: 95, train_loss: 0.6101, test_loss: 0.9263, test_f1: 0.6400
 epoch: 96, train_loss: 0.6210, test_loss: 0.9532, test_f1: 0.6463
 epoch: 97, train_loss: 0.6104, test_loss: 0.8347, test_f1: 0.6281
 epoch: 98, train_loss: 0.6195, test_loss: 0.8527, test_f1: 0.6463
 epoch: 99, train_loss: 0.6155, test_loss: 0.8370, test_f1: 0.6275
##################ITERATION #1 ****************************************
 epoch: 0, train_loss: 1.1407, test_loss: 1.1148, test_f1: 0.3508
 epoch: 1, train_loss: 1.0506, test_loss: 1.0537, test_f1: 0.4624
 epoch: 2, train_loss: 1.0199, test_loss: 1.0801, test_f1: 0.4519
 epoch: 3, train_loss: 1.0147, test_loss: 1.0477, test_f1: 0.4568
 epoch: 4, train_loss: 1.0090, test_loss: 1.0350, test_f1: 0.4650
 epoch: 5, train_loss: 0.9972, test_loss: 0.9712, test_f1: 0.4778
 epoch: 6, train_loss: 0.9827, test_loss: 0.9974, test_f1: 0.5245
 epoch: 7, train_loss: 0.9534, test_loss: 1.0048, test_f1: 0.4915
 epoch: 8, train_loss: 0.9605, test_loss: 0.9249, test_f1: 0.5447
 epoch: 9, train_loss: 0.9514, test_loss: 1.1112, test_f1: 0.5173
 epoch: 10, train_loss: 0.9283, test_loss: 1.0028, test_f1: 0.4102
 epoch: 11, train_loss: 0.9356, test_loss: 0.9848, test_f1: 0.5036
 epoch: 12, train_loss: 0.9310, test_loss: 0.9433, test_f1: 0.5030
 epoch: 13, train_loss: 0.9217, test_loss: 0.9573, test_f1: 0.5247
 epoch: 14, train_loss: 0.9077, test_loss: 0.9037, test_f1: 0.5507
 epoch: 15, train_loss: 0.9149, test_loss: 1.1205, test_f1: 0.4860
 epoch: 16, train_loss: 0.8907, test_loss: 0.9678, test_f1: 0.5676
 epoch: 17, train_loss: 0.9068, test_loss: 0.9506, test_f1: 0.5570
 epoch: 18, train_loss: 0.8980, test_loss: 0.9345, test_f1: 0.5868
 epoch: 19, train_loss: 0.8830, test_loss: 0.8512, test_f1: 0.5927
 epoch: 20, train_loss: 0.8862, test_loss: 0.8943, test_f1: 0.5877
 epoch: 21, train_loss: 0.8635, test_loss: 0.9430, test_f1: 0.5286
 epoch: 22, train_loss: 0.8671, test_loss: 0.8972, test_f1: 0.5382
 epoch: 23, train_loss: 0.8563, test_loss: 0.9305, test_f1: 0.5660
 epoch: 24, train_loss: 0.8511, test_loss: 0.9127, test_f1: 0.5383
 epoch: 25, train_loss: 0.8546, test_loss: 0.9243, test_f1: 0.5399
 epoch: 26, train_loss: 0.8481, test_loss: 1.0241, test_f1: 0.5015
 epoch: 27, train_loss: 0.8542, test_loss: 0.8888, test_f1: 0.5550
 epoch: 28, train_loss: 0.8488, test_loss: 1.0623, test_f1: 0.4845
 epoch: 29, train_loss: 0.8593, test_loss: 0.9305, test_f1: 0.5116
 epoch: 30, train_loss: 0.8285, test_loss: 0.8667, test_f1: 0.5354
 epoch: 31, train_loss: 0.8348, test_loss: 1.1214, test_f1: 0.4924
 epoch: 32, train_loss: 0.8416, test_loss: 0.9147, test_f1: 0.5800
 epoch: 33, train_loss: 0.8092, test_loss: 0.8394, test_f1: 0.6045
 epoch: 34, train_loss: 0.8216, test_loss: 0.9038, test_f1: 0.6220
 epoch: 35, train_loss: 0.7950, test_loss: 0.9383, test_f1: 0.5084
 epoch: 36, train_loss: 0.7957, test_loss: 0.8757, test_f1: 0.5294
 epoch: 37, train_loss: 0.7955, test_loss: 0.9036, test_f1: 0.5545
 epoch: 38, train_loss: 0.8020, test_loss: 0.8518, test_f1: 0.6099
 epoch: 39, train_loss: 0.7943, test_loss: 0.8647, test_f1: 0.6226
 epoch: 40, train_loss: 0.7875, test_loss: 0.9046, test_f1: 0.5937
 epoch: 41, train_loss: 0.7918, test_loss: 0.8044, test_f1: 0.6191
 epoch: 42, train_loss: 0.7770, test_loss: 0.9319, test_f1: 0.5326
 epoch: 43, train_loss: 0.7663, test_loss: 0.8797, test_f1: 0.5528
 epoch: 44, train_loss: 0.7893, test_loss: 0.8977, test_f1: 0.5524
 epoch: 45, train_loss: 0.7883, test_loss: 0.8462, test_f1: 0.6055
 epoch: 46, train_loss: 0.7747, test_loss: 0.8554, test_f1: 0.6012
 epoch: 47, train_loss: 0.7748, test_loss: 0.8594, test_f1: 0.5393
 epoch: 48, train_loss: 0.7701, test_loss: 0.8519, test_f1: 0.6140
 epoch: 49, train_loss: 0.7436, test_loss: 1.2131, test_f1: 0.5125
 epoch: 50, train_loss: 0.7692, test_loss: 0.8581, test_f1: 0.5505
 epoch: 51, train_loss: 0.7451, test_loss: 0.8699, test_f1: 0.5576
 epoch: 52, train_loss: 0.7252, test_loss: 0.8945, test_f1: 0.5766
 epoch: 53, train_loss: 0.7140, test_loss: 0.8861, test_f1: 0.5853
 epoch: 54, train_loss: 0.7136, test_loss: 0.8499, test_f1: 0.5784
 epoch: 55, train_loss: 0.7134, test_loss: 0.8860, test_f1: 0.5725
 epoch: 56, train_loss: 0.7040, test_loss: 0.8218, test_f1: 0.5615
 epoch: 57, train_loss: 0.6964, test_loss: 0.9251, test_f1: 0.5831
 epoch: 58, train_loss: 0.6940, test_loss: 0.8571, test_f1: 0.6290
 epoch: 59, train_loss: 0.7001, test_loss: 0.8147, test_f1: 0.6269
 epoch: 60, train_loss: 0.6961, test_loss: 0.8739, test_f1: 0.5948
 epoch: 61, train_loss: 0.7179, test_loss: 0.9458, test_f1: 0.5356
 epoch: 62, train_loss: 0.7130, test_loss: 0.9178, test_f1: 0.5760
 epoch: 63, train_loss: 0.7249, test_loss: 0.9317, test_f1: 0.5976
 epoch: 64, train_loss: 0.7073, test_loss: 0.8648, test_f1: 0.5986
 epoch: 65, train_loss: 0.7020, test_loss: 0.9045, test_f1: 0.6066
 epoch: 66, train_loss: 0.7024, test_loss: 0.8851, test_f1: 0.5958
 epoch: 67, train_loss: 0.6998, test_loss: 0.8296, test_f1: 0.5603
 epoch: 68, train_loss: 0.6957, test_loss: 0.8371, test_f1: 0.5834
 epoch: 69, train_loss: 0.6935, test_loss: 0.7728, test_f1: 0.6265
 epoch: 70, train_loss: 0.6885, test_loss: 0.8152, test_f1: 0.5744
 epoch: 71, train_loss: 0.6734, test_loss: 0.9289, test_f1: 0.5867
 epoch: 72, train_loss: 0.6789, test_loss: 0.8129, test_f1: 0.5684
 epoch: 73, train_loss: 0.6858, test_loss: 0.8687, test_f1: 0.6243
 epoch: 74, train_loss: 0.6883, test_loss: 0.9030, test_f1: 0.6056
 epoch: 75, train_loss: 0.6860, test_loss: 0.8684, test_f1: 0.6248
 epoch: 76, train_loss: 0.6823, test_loss: 0.8237, test_f1: 0.6112
 epoch: 77, train_loss: 0.6799, test_loss: 0.8680, test_f1: 0.6021
 epoch: 78, train_loss: 0.6827, test_loss: 0.8336, test_f1: 0.6362
 epoch: 79, train_loss: 0.6760, test_loss: 0.8431, test_f1: 0.6365
 epoch: 80, train_loss: 0.6791, test_loss: 0.8297, test_f1: 0.5840
 epoch: 81, train_loss: 0.6528, test_loss: 0.8380, test_f1: 0.5813
 epoch: 82, train_loss: 0.6598, test_loss: 0.8338, test_f1: 0.6413
 epoch: 83, train_loss: 0.6613, test_loss: 0.8590, test_f1: 0.6131
 epoch: 84, train_loss: 0.6749, test_loss: 0.8959, test_f1: 0.6122
 epoch: 85, train_loss: 0.6634, test_loss: 0.8686, test_f1: 0.5860
 epoch: 86, train_loss: 0.6555, test_loss: 0.8660, test_f1: 0.5643
 epoch: 87, train_loss: 0.6589, test_loss: 0.8308, test_f1: 0.5800
 epoch: 88, train_loss: 0.6688, test_loss: 0.8327, test_f1: 0.5875
 epoch: 89, train_loss: 0.6507, test_loss: 0.9013, test_f1: 0.5620
 epoch: 90, train_loss: 0.6626, test_loss: 0.8504, test_f1: 0.6026
 epoch: 91, train_loss: 0.6710, test_loss: 0.8296, test_f1: 0.5999
 epoch: 92, train_loss: 0.6660, test_loss: 0.9455, test_f1: 0.5659
 epoch: 93, train_loss: 0.6604, test_loss: 0.8703, test_f1: 0.6214
 epoch: 94, train_loss: 0.6411, test_loss: 0.9011, test_f1: 0.5967
 epoch: 95, train_loss: 0.6645, test_loss: 0.8730, test_f1: 0.6120
 epoch: 96, train_loss: 0.6504, test_loss: 0.8757, test_f1: 0.5976
 epoch: 97, train_loss: 0.6507, test_loss: 0.8423, test_f1: 0.5769
 epoch: 98, train_loss: 0.6665, test_loss: 0.8883, test_f1: 0.6005
 epoch: 99, train_loss: 0.6486, test_loss: 0.8887, test_f1: 0.6020
##################ITERATION #2 ****************************************
 epoch: 0, train_loss: 1.1552, test_loss: 1.1396, test_f1: 0.4141
 epoch: 1, train_loss: 1.0662, test_loss: 1.1089, test_f1: 0.3998
 epoch: 2, train_loss: 1.0401, test_loss: 1.1979, test_f1: 0.3797
 epoch: 3, train_loss: 1.0202, test_loss: 1.0531, test_f1: 0.4685
 epoch: 4, train_loss: 1.0069, test_loss: 1.0301, test_f1: 0.4868
 epoch: 5, train_loss: 0.9951, test_loss: 1.0692, test_f1: 0.4435
 epoch: 6, train_loss: 0.9733, test_loss: 1.1007, test_f1: 0.4759
 epoch: 7, train_loss: 0.9714, test_loss: 1.0736, test_f1: 0.4785
 epoch: 8, train_loss: 0.9483, test_loss: 1.0230, test_f1: 0.4606
 epoch: 9, train_loss: 0.9377, test_loss: 1.0581, test_f1: 0.4535
 epoch: 10, train_loss: 0.9290, test_loss: 0.9602, test_f1: 0.4881
 epoch: 11, train_loss: 0.9174, test_loss: 1.0958, test_f1: 0.4520
 epoch: 12, train_loss: 0.8889, test_loss: 0.9966, test_f1: 0.4579
 epoch: 13, train_loss: 0.9008, test_loss: 0.9348, test_f1: 0.5179
 epoch: 14, train_loss: 0.9065, test_loss: 0.9677, test_f1: 0.4694
 epoch: 15, train_loss: 0.8739, test_loss: 0.9839, test_f1: 0.4771
 epoch: 16, train_loss: 0.8743, test_loss: 0.9098, test_f1: 0.5303
 epoch: 17, train_loss: 0.8725, test_loss: 0.9017, test_f1: 0.5023
 epoch: 18, train_loss: 0.8632, test_loss: 1.0537, test_f1: 0.5103
 epoch: 19, train_loss: 0.8498, test_loss: 0.9396, test_f1: 0.5187
 epoch: 20, train_loss: 0.8489, test_loss: 0.8661, test_f1: 0.5023
 epoch: 21, train_loss: 0.8499, test_loss: 0.9294, test_f1: 0.5029
 epoch: 22, train_loss: 0.8379, test_loss: 0.9552, test_f1: 0.5262
 epoch: 23, train_loss: 0.8362, test_loss: 0.8992, test_f1: 0.5058
 epoch: 24, train_loss: 0.8407, test_loss: 0.9649, test_f1: 0.4968
 epoch: 25, train_loss: 0.8239, test_loss: 0.8882, test_f1: 0.5402
 epoch: 26, train_loss: 0.8437, test_loss: 0.8874, test_f1: 0.5139
 epoch: 27, train_loss: 0.8323, test_loss: 0.9944, test_f1: 0.4672
 epoch: 28, train_loss: 0.8161, test_loss: 0.8634, test_f1: 0.5375
 epoch: 29, train_loss: 0.8176, test_loss: 0.9797, test_f1: 0.5005
 epoch: 30, train_loss: 0.8088, test_loss: 0.8662, test_f1: 0.5296
 epoch: 31, train_loss: 0.7987, test_loss: 0.8451, test_f1: 0.5409
 epoch: 32, train_loss: 0.8051, test_loss: 0.9354, test_f1: 0.4967
 epoch: 33, train_loss: 0.7926, test_loss: 0.9089, test_f1: 0.5079
 epoch: 34, train_loss: 0.8020, test_loss: 0.8657, test_f1: 0.5292
 epoch: 35, train_loss: 0.7871, test_loss: 0.9855, test_f1: 0.4833
 epoch: 36, train_loss: 0.7851, test_loss: 0.9078, test_f1: 0.5430
 epoch: 37, train_loss: 0.7871, test_loss: 1.0219, test_f1: 0.4750
 epoch: 38, train_loss: 0.7831, test_loss: 0.9858, test_f1: 0.5237
 epoch: 39, train_loss: 0.8037, test_loss: 0.9616, test_f1: 0.4851
 epoch: 40, train_loss: 0.8046, test_loss: 0.9165, test_f1: 0.5176
 epoch: 41, train_loss: 0.7951, test_loss: 0.8547, test_f1: 0.5934
 epoch: 42, train_loss: 0.7767, test_loss: 0.8701, test_f1: 0.5950
 epoch: 43, train_loss: 0.7686, test_loss: 0.8795, test_f1: 0.5458
 epoch: 44, train_loss: 0.7924, test_loss: 0.8881, test_f1: 0.5362
 epoch: 45, train_loss: 0.7700, test_loss: 0.9239, test_f1: 0.6209
 epoch: 46, train_loss: 0.7623, test_loss: 0.9119, test_f1: 0.5242
 epoch: 47, train_loss: 0.7935, test_loss: 0.8568, test_f1: 0.5690
 epoch: 48, train_loss: 0.7641, test_loss: 0.8732, test_f1: 0.5283
 epoch: 49, train_loss: 0.7721, test_loss: 0.9023, test_f1: 0.5244
 epoch: 50, train_loss: 0.7549, test_loss: 0.9121, test_f1: 0.6261
 epoch: 51, train_loss: 0.7361, test_loss: 0.8453, test_f1: 0.5531
 epoch: 52, train_loss: 0.7361, test_loss: 0.8861, test_f1: 0.6042
 epoch: 53, train_loss: 0.7193, test_loss: 0.8847, test_f1: 0.5834
 epoch: 54, train_loss: 0.7367, test_loss: 0.8265, test_f1: 0.6321
 epoch: 55, train_loss: 0.7045, test_loss: 0.8415, test_f1: 0.5535
 epoch: 56, train_loss: 0.7106, test_loss: 0.8869, test_f1: 0.6122
 epoch: 57, train_loss: 0.7188, test_loss: 0.8758, test_f1: 0.5847
 epoch: 58, train_loss: 0.7144, test_loss: 0.8559, test_f1: 0.5907
 epoch: 59, train_loss: 0.7024, test_loss: 0.8505, test_f1: 0.5561
 epoch: 60, train_loss: 0.7091, test_loss: 0.9086, test_f1: 0.6222
 epoch: 61, train_loss: 0.7072, test_loss: 0.8353, test_f1: 0.5945
 epoch: 62, train_loss: 0.6950, test_loss: 0.8218, test_f1: 0.6027
 epoch: 63, train_loss: 0.6985, test_loss: 0.8922, test_f1: 0.6067
 epoch: 64, train_loss: 0.7159, test_loss: 0.8019, test_f1: 0.5933
 epoch: 65, train_loss: 0.7126, test_loss: 0.8330, test_f1: 0.5608
 epoch: 66, train_loss: 0.6890, test_loss: 0.8243, test_f1: 0.6195
 epoch: 67, train_loss: 0.7010, test_loss: 0.8894, test_f1: 0.5871
 epoch: 68, train_loss: 0.6895, test_loss: 0.8325, test_f1: 0.6193
 epoch: 69, train_loss: 0.6864, test_loss: 0.8460, test_f1: 0.6322
 epoch: 70, train_loss: 0.7026, test_loss: 0.8420, test_f1: 0.6170
 epoch: 71, train_loss: 0.6910, test_loss: 0.8657, test_f1: 0.5991
 epoch: 72, train_loss: 0.6887, test_loss: 0.8701, test_f1: 0.6174
 epoch: 73, train_loss: 0.6805, test_loss: 0.8835, test_f1: 0.6414
 epoch: 74, train_loss: 0.6915, test_loss: 0.8323, test_f1: 0.6172
 epoch: 75, train_loss: 0.6902, test_loss: 0.8365, test_f1: 0.6306
 epoch: 76, train_loss: 0.6932, test_loss: 0.8923, test_f1: 0.6304
 epoch: 77, train_loss: 0.6628, test_loss: 0.8815, test_f1: 0.6438
 epoch: 78, train_loss: 0.6625, test_loss: 0.8636, test_f1: 0.6415
 epoch: 79, train_loss: 0.6821, test_loss: 0.8494, test_f1: 0.6335
 epoch: 80, train_loss: 0.6731, test_loss: 0.8432, test_f1: 0.6311
 epoch: 81, train_loss: 0.6747, test_loss: 0.8782, test_f1: 0.6292
 epoch: 82, train_loss: 0.6784, test_loss: 0.8080, test_f1: 0.6179
 epoch: 83, train_loss: 0.6623, test_loss: 0.9035, test_f1: 0.6381
 epoch: 84, train_loss: 0.6696, test_loss: 0.9324, test_f1: 0.5948
 epoch: 85, train_loss: 0.6796, test_loss: 0.8653, test_f1: 0.6271
 epoch: 86, train_loss: 0.6673, test_loss: 0.9264, test_f1: 0.6268
 epoch: 87, train_loss: 0.6621, test_loss: 0.8915, test_f1: 0.6110
 epoch: 88, train_loss: 0.6766, test_loss: 0.8994, test_f1: 0.6398
 epoch: 89, train_loss: 0.6529, test_loss: 0.8448, test_f1: 0.6212
 epoch: 90, train_loss: 0.6785, test_loss: 0.8733, test_f1: 0.6077
 epoch: 91, train_loss: 0.6587, test_loss: 0.7950, test_f1: 0.6378
 epoch: 92, train_loss: 0.6650, test_loss: 0.8451, test_f1: 0.6060
 epoch: 93, train_loss: 0.6691, test_loss: 0.8175, test_f1: 0.6288
 epoch: 94, train_loss: 0.6632, test_loss: 0.8486, test_f1: 0.6168
 epoch: 95, train_loss: 0.6639, test_loss: 0.7735, test_f1: 0.6638
 epoch: 96, train_loss: 0.6624, test_loss: 0.8568, test_f1: 0.6282
 epoch: 97, train_loss: 0.6575, test_loss: 0.8962, test_f1: 0.6260
 epoch: 98, train_loss: 0.6505, test_loss: 0.8675, test_f1: 0.6329
 epoch: 99, train_loss: 0.6592, test_loss: 0.8902, test_f1: 0.6304
##################ITERATION #3 ****************************************
 epoch: 0, train_loss: 1.1368, test_loss: 1.1222, test_f1: 0.4341
 epoch: 1, train_loss: 1.0521, test_loss: 1.0528, test_f1: 0.4260
 epoch: 2, train_loss: 1.0356, test_loss: 1.0795, test_f1: 0.4256
 epoch: 3, train_loss: 1.0050, test_loss: 0.9925, test_f1: 0.4751
 epoch: 4, train_loss: 0.9798, test_loss: 1.0834, test_f1: 0.4305
 epoch: 5, train_loss: 0.9748, test_loss: 1.0751, test_f1: 0.4370
 epoch: 6, train_loss: 0.9548, test_loss: 0.9652, test_f1: 0.5054
 epoch: 7, train_loss: 0.9325, test_loss: 0.9765, test_f1: 0.5281
 epoch: 8, train_loss: 0.9272, test_loss: 0.9321, test_f1: 0.4897
 epoch: 9, train_loss: 0.9287, test_loss: 0.8988, test_f1: 0.4867
 epoch: 10, train_loss: 0.9100, test_loss: 1.1081, test_f1: 0.4875
 epoch: 11, train_loss: 0.8928, test_loss: 0.9614, test_f1: 0.5041
 epoch: 12, train_loss: 0.9064, test_loss: 1.0966, test_f1: 0.4671
 epoch: 13, train_loss: 0.8862, test_loss: 0.9267, test_f1: 0.5014
 epoch: 14, train_loss: 0.8901, test_loss: 1.0300, test_f1: 0.5143
 epoch: 15, train_loss: 0.8934, test_loss: 0.9341, test_f1: 0.5025
 epoch: 16, train_loss: 0.8657, test_loss: 0.8840, test_f1: 0.5560
 epoch: 17, train_loss: 0.8779, test_loss: 0.9735, test_f1: 0.4877
 epoch: 18, train_loss: 0.8589, test_loss: 0.9799, test_f1: 0.5034
 epoch: 19, train_loss: 0.8648, test_loss: 0.8374, test_f1: 0.5515
 epoch: 20, train_loss: 0.8435, test_loss: 0.9101, test_f1: 0.5288
 epoch: 21, train_loss: 0.8575, test_loss: 0.9652, test_f1: 0.5214
 epoch: 22, train_loss: 0.8533, test_loss: 0.9659, test_f1: 0.5363
 epoch: 23, train_loss: 0.8350, test_loss: 1.1539, test_f1: 0.4975
 epoch: 24, train_loss: 0.8346, test_loss: 0.8502, test_f1: 0.5186
 epoch: 25, train_loss: 0.8145, test_loss: 0.8640, test_f1: 0.5516
 epoch: 26, train_loss: 0.8307, test_loss: 0.9886, test_f1: 0.5126
 epoch: 27, train_loss: 0.8311, test_loss: 0.8738, test_f1: 0.5442
 epoch: 28, train_loss: 0.8221, test_loss: 0.9003, test_f1: 0.4978
 epoch: 29, train_loss: 0.8358, test_loss: 0.9192, test_f1: 0.5270
 epoch: 30, train_loss: 0.8328, test_loss: 0.9004, test_f1: 0.5194
 epoch: 31, train_loss: 0.8180, test_loss: 0.8814, test_f1: 0.5531
 epoch: 32, train_loss: 0.8116, test_loss: 0.9008, test_f1: 0.5420
 epoch: 33, train_loss: 0.8129, test_loss: 0.9595, test_f1: 0.5001
 epoch: 34, train_loss: 0.8074, test_loss: 0.8114, test_f1: 0.5271
 epoch: 35, train_loss: 0.8209, test_loss: 1.0609, test_f1: 0.5187
 epoch: 36, train_loss: 0.7958, test_loss: 1.0979, test_f1: 0.5313
 epoch: 37, train_loss: 0.7938, test_loss: 0.9602, test_f1: 0.5237
 epoch: 38, train_loss: 0.8037, test_loss: 0.9118, test_f1: 0.5196
 epoch: 39, train_loss: 0.7895, test_loss: 0.8662, test_f1: 0.5285
 epoch: 40, train_loss: 0.8012, test_loss: 0.8233, test_f1: 0.5361
 epoch: 41, train_loss: 0.7748, test_loss: 0.8649, test_f1: 0.5411
 epoch: 42, train_loss: 0.7951, test_loss: 0.7613, test_f1: 0.5696
 epoch: 43, train_loss: 0.7749, test_loss: 0.8052, test_f1: 0.5551
 epoch: 44, train_loss: 0.7611, test_loss: 0.9025, test_f1: 0.5386
 epoch: 45, train_loss: 0.7761, test_loss: 0.8094, test_f1: 0.5506
 epoch: 46, train_loss: 0.7630, test_loss: 0.7560, test_f1: 0.6095
 epoch: 47, train_loss: 0.7679, test_loss: 0.8021, test_f1: 0.5413
 epoch: 48, train_loss: 0.7564, test_loss: 0.8623, test_f1: 0.5347
 epoch: 49, train_loss: 0.7669, test_loss: 0.7978, test_f1: 0.6017
 epoch: 50, train_loss: 0.7650, test_loss: 0.7840, test_f1: 0.5955
 epoch: 51, train_loss: 0.7442, test_loss: 0.8000, test_f1: 0.5514
 epoch: 52, train_loss: 0.7258, test_loss: 0.8014, test_f1: 0.5368
 epoch: 53, train_loss: 0.7089, test_loss: 0.7647, test_f1: 0.5806
 epoch: 54, train_loss: 0.7055, test_loss: 0.7995, test_f1: 0.5570
 epoch: 55, train_loss: 0.7099, test_loss: 0.7808, test_f1: 0.5580
 epoch: 56, train_loss: 0.7054, test_loss: 0.7612, test_f1: 0.5596
 epoch: 57, train_loss: 0.6959, test_loss: 0.7714, test_f1: 0.5623
 epoch: 58, train_loss: 0.6926, test_loss: 0.8343, test_f1: 0.5424
 epoch: 59, train_loss: 0.7011, test_loss: 0.7668, test_f1: 0.6141
 epoch: 60, train_loss: 0.6909, test_loss: 0.7669, test_f1: 0.5699
 epoch: 61, train_loss: 0.6901, test_loss: 0.7462, test_f1: 0.5556
 epoch: 62, train_loss: 0.6885, test_loss: 0.8037, test_f1: 0.6175
 epoch: 63, train_loss: 0.6926, test_loss: 0.8026, test_f1: 0.6101
 epoch: 64, train_loss: 0.6904, test_loss: 0.8688, test_f1: 0.6326
 epoch: 65, train_loss: 0.6939, test_loss: 0.8021, test_f1: 0.6156
 epoch: 66, train_loss: 0.6744, test_loss: 0.8222, test_f1: 0.5696
 epoch: 67, train_loss: 0.6847, test_loss: 0.8086, test_f1: 0.5675
 epoch: 68, train_loss: 0.6821, test_loss: 0.7598, test_f1: 0.5801
 epoch: 69, train_loss: 0.6863, test_loss: 0.7625, test_f1: 0.5643
 epoch: 70, train_loss: 0.6642, test_loss: 0.7773, test_f1: 0.5639
 epoch: 71, train_loss: 0.6711, test_loss: 0.8689, test_f1: 0.5412
 epoch: 72, train_loss: 0.6701, test_loss: 0.7918, test_f1: 0.5567
 epoch: 73, train_loss: 0.6817, test_loss: 0.7965, test_f1: 0.5422
 epoch: 74, train_loss: 0.6643, test_loss: 0.7672, test_f1: 0.5898
 epoch: 75, train_loss: 0.6623, test_loss: 0.7516, test_f1: 0.6184
 epoch: 76, train_loss: 0.6585, test_loss: 0.7391, test_f1: 0.6039
 epoch: 77, train_loss: 0.6597, test_loss: 0.8510, test_f1: 0.5658
 epoch: 78, train_loss: 0.6680, test_loss: 0.8353, test_f1: 0.5581
 epoch: 79, train_loss: 0.6679, test_loss: 0.8432, test_f1: 0.5618
 epoch: 80, train_loss: 0.6554, test_loss: 0.8540, test_f1: 0.5762
 epoch: 81, train_loss: 0.6520, test_loss: 0.7641, test_f1: 0.6319
 epoch: 82, train_loss: 0.6657, test_loss: 0.7501, test_f1: 0.6058
 epoch: 83, train_loss: 0.6574, test_loss: 0.7215, test_f1: 0.6070
 epoch: 84, train_loss: 0.6634, test_loss: 0.7723, test_f1: 0.6237
 epoch: 85, train_loss: 0.6467, test_loss: 0.7462, test_f1: 0.6484
 epoch: 86, train_loss: 0.6444, test_loss: 0.7519, test_f1: 0.5882
 epoch: 87, train_loss: 0.6423, test_loss: 0.7788, test_f1: 0.5826
 epoch: 88, train_loss: 0.6706, test_loss: 0.8088, test_f1: 0.6182
 epoch: 89, train_loss: 0.6526, test_loss: 0.8064, test_f1: 0.6155
 epoch: 90, train_loss: 0.6455, test_loss: 0.7728, test_f1: 0.5674
 epoch: 91, train_loss: 0.6385, test_loss: 0.7256, test_f1: 0.6552
 epoch: 92, train_loss: 0.6577, test_loss: 0.7297, test_f1: 0.5756
 epoch: 93, train_loss: 0.6370, test_loss: 0.7680, test_f1: 0.5959
 epoch: 94, train_loss: 0.6293, test_loss: 0.7434, test_f1: 0.6245
 epoch: 95, train_loss: 0.6428, test_loss: 0.7063, test_f1: 0.6489
 epoch: 96, train_loss: 0.6438, test_loss: 0.7337, test_f1: 0.6282
 epoch: 97, train_loss: 0.6308, test_loss: 0.7709, test_f1: 0.6255
 epoch: 98, train_loss: 0.6502, test_loss: 0.7509, test_f1: 0.6287
 epoch: 99, train_loss: 0.6213, test_loss: 0.7602, test_f1: 0.6224
##################ITERATION #4 ****************************************
 epoch: 0, train_loss: 1.1495, test_loss: 1.3029, test_f1: 0.2882
 epoch: 1, train_loss: 1.0549, test_loss: 1.0967, test_f1: 0.4245
 epoch: 2, train_loss: 1.0550, test_loss: 1.1207, test_f1: 0.4205
 epoch: 3, train_loss: 1.0416, test_loss: 1.0716, test_f1: 0.3984
 epoch: 4, train_loss: 1.0415, test_loss: 1.0774, test_f1: 0.4343
 epoch: 5, train_loss: 1.0145, test_loss: 1.0463, test_f1: 0.4018
 epoch: 6, train_loss: 0.9902, test_loss: 0.9449, test_f1: 0.4791
 epoch: 7, train_loss: 0.9963, test_loss: 0.9672, test_f1: 0.4824
 epoch: 8, train_loss: 0.9872, test_loss: 1.0532, test_f1: 0.4048
 epoch: 9, train_loss: 0.9700, test_loss: 0.9987, test_f1: 0.4705
 epoch: 10, train_loss: 0.9711, test_loss: 0.9961, test_f1: 0.4671
 epoch: 11, train_loss: 0.9513, test_loss: 1.0855, test_f1: 0.4300
 epoch: 12, train_loss: 0.9483, test_loss: 0.9671, test_f1: 0.4863
 epoch: 13, train_loss: 0.9273, test_loss: 0.9669, test_f1: 0.5023
 epoch: 14, train_loss: 0.9241, test_loss: 0.9576, test_f1: 0.5377
 epoch: 15, train_loss: 0.9177, test_loss: 0.9087, test_f1: 0.4999
 epoch: 16, train_loss: 0.9102, test_loss: 1.0180, test_f1: 0.4955
 epoch: 17, train_loss: 0.9086, test_loss: 1.0281, test_f1: 0.4506
 epoch: 18, train_loss: 0.9141, test_loss: 0.9254, test_f1: 0.5290
 epoch: 19, train_loss: 0.8920, test_loss: 0.8694, test_f1: 0.5414
 epoch: 20, train_loss: 0.8819, test_loss: 0.9476, test_f1: 0.5298
 epoch: 21, train_loss: 0.8823, test_loss: 0.8681, test_f1: 0.5458
 epoch: 22, train_loss: 0.8773, test_loss: 0.8902, test_f1: 0.5128
 epoch: 23, train_loss: 0.8731, test_loss: 0.9104, test_f1: 0.5290
 epoch: 24, train_loss: 0.8769, test_loss: 1.0541, test_f1: 0.5034
 epoch: 25, train_loss: 0.8604, test_loss: 0.9422, test_f1: 0.5218
 epoch: 26, train_loss: 0.8789, test_loss: 0.8704, test_f1: 0.5400
 epoch: 27, train_loss: 0.8592, test_loss: 0.9873, test_f1: 0.5049
 epoch: 28, train_loss: 0.8619, test_loss: 0.9352, test_f1: 0.5478
 epoch: 29, train_loss: 0.8710, test_loss: 0.9717, test_f1: 0.5336
 epoch: 30, train_loss: 0.8479, test_loss: 0.9976, test_f1: 0.5147
 epoch: 31, train_loss: 0.8657, test_loss: 0.9528, test_f1: 0.5444
 epoch: 32, train_loss: 0.8687, test_loss: 0.9000, test_f1: 0.5242
 epoch: 33, train_loss: 0.8808, test_loss: 0.8810, test_f1: 0.5379
 epoch: 34, train_loss: 0.8505, test_loss: 1.0023, test_f1: 0.5398
 epoch: 35, train_loss: 0.8366, test_loss: 0.9364, test_f1: 0.5269
 epoch: 36, train_loss: 0.8523, test_loss: 0.9058, test_f1: 0.5327
 epoch: 37, train_loss: 0.8358, test_loss: 0.8566, test_f1: 0.5370
 epoch: 38, train_loss: 0.8297, test_loss: 0.9884, test_f1: 0.5204
 epoch: 39, train_loss: 0.8233, test_loss: 0.9889, test_f1: 0.5208
 epoch: 40, train_loss: 0.8291, test_loss: 0.9435, test_f1: 0.5332
 epoch: 41, train_loss: 0.8458, test_loss: 0.8902, test_f1: 0.5395
 epoch: 42, train_loss: 0.8280, test_loss: 0.8857, test_f1: 0.5678
 epoch: 43, train_loss: 0.8123, test_loss: 0.9278, test_f1: 0.5486
 epoch: 44, train_loss: 0.8191, test_loss: 0.8873, test_f1: 0.5522
 epoch: 45, train_loss: 0.8062, test_loss: 1.0185, test_f1: 0.5693
 epoch: 46, train_loss: 0.8057, test_loss: 0.9369, test_f1: 0.5340
 epoch: 47, train_loss: 0.8081, test_loss: 0.8832, test_f1: 0.5578
 epoch: 48, train_loss: 0.8114, test_loss: 0.9913, test_f1: 0.5334
 epoch: 49, train_loss: 0.8163, test_loss: 0.9171, test_f1: 0.5429
 epoch: 50, train_loss: 0.8134, test_loss: 0.9079, test_f1: 0.5334
 epoch: 51, train_loss: 0.7758, test_loss: 0.9460, test_f1: 0.5406
 epoch: 52, train_loss: 0.7765, test_loss: 1.0840, test_f1: 0.5769
 epoch: 53, train_loss: 0.7712, test_loss: 0.9795, test_f1: 0.5509
 epoch: 54, train_loss: 0.7368, test_loss: 0.9736, test_f1: 0.5695
 epoch: 55, train_loss: 0.7604, test_loss: 0.9508, test_f1: 0.5541
 epoch: 56, train_loss: 0.7497, test_loss: 0.9768, test_f1: 0.5448
 epoch: 57, train_loss: 0.7599, test_loss: 0.9235, test_f1: 0.5958
 epoch: 58, train_loss: 0.7451, test_loss: 0.9834, test_f1: 0.5838
 epoch: 59, train_loss: 0.7419, test_loss: 1.0128, test_f1: 0.5686
 epoch: 60, train_loss: 0.7395, test_loss: 0.9606, test_f1: 0.5776
 epoch: 61, train_loss: 0.7326, test_loss: 1.0186, test_f1: 0.5479
 epoch: 62, train_loss: 0.7425, test_loss: 1.0296, test_f1: 0.5494
 epoch: 63, train_loss: 0.7373, test_loss: 0.9544, test_f1: 0.5679
 epoch: 64, train_loss: 0.7446, test_loss: 1.0070, test_f1: 0.5764
 epoch: 65, train_loss: 0.7316, test_loss: 1.0803, test_f1: 0.5578
 epoch: 66, train_loss: 0.7132, test_loss: 1.1736, test_f1: 0.5702
 epoch: 67, train_loss: 0.7182, test_loss: 0.9946, test_f1: 0.5508
 epoch: 68, train_loss: 0.7357, test_loss: 1.0258, test_f1: 0.5847
 epoch: 69, train_loss: 0.7145, test_loss: 1.0571, test_f1: 0.5656
 epoch: 70, train_loss: 0.7156, test_loss: 1.0543, test_f1: 0.5718
 epoch: 71, train_loss: 0.7200, test_loss: 1.0339, test_f1: 0.5667
 epoch: 72, train_loss: 0.7066, test_loss: 1.0282, test_f1: 0.5845
 epoch: 73, train_loss: 0.7044, test_loss: 1.1307, test_f1: 0.5412
 epoch: 74, train_loss: 0.7227, test_loss: 1.0894, test_f1: 0.5784
 epoch: 75, train_loss: 0.6883, test_loss: 1.0809, test_f1: 0.5366
 epoch: 76, train_loss: 0.7095, test_loss: 1.0324, test_f1: 0.5727
 epoch: 77, train_loss: 0.7006, test_loss: 1.0536, test_f1: 0.6185
 epoch: 78, train_loss: 0.7082, test_loss: 1.0528, test_f1: 0.5533
 epoch: 79, train_loss: 0.6989, test_loss: 1.0145, test_f1: 0.5810
 epoch: 80, train_loss: 0.6889, test_loss: 1.0208, test_f1: 0.5280
 epoch: 81, train_loss: 0.6845, test_loss: 1.1116, test_f1: 0.6063
 epoch: 82, train_loss: 0.7004, test_loss: 1.1194, test_f1: 0.5856
 epoch: 83, train_loss: 0.6948, test_loss: 1.0218, test_f1: 0.5996
 epoch: 84, train_loss: 0.6869, test_loss: 1.0578, test_f1: 0.5887
 epoch: 85, train_loss: 0.6843, test_loss: 1.0583, test_f1: 0.5931
 epoch: 86, train_loss: 0.6836, test_loss: 1.0944, test_f1: 0.6091
 epoch: 87, train_loss: 0.6826, test_loss: 1.0780, test_f1: 0.5799
 epoch: 88, train_loss: 0.6826, test_loss: 1.0071, test_f1: 0.6180
 epoch: 89, train_loss: 0.6884, test_loss: 1.1601, test_f1: 0.5836
 epoch: 90, train_loss: 0.6684, test_loss: 1.0891, test_f1: 0.5608
 epoch: 91, train_loss: 0.6715, test_loss: 1.0452, test_f1: 0.5929
 epoch: 92, train_loss: 0.6669, test_loss: 1.0736, test_f1: 0.5680
 epoch: 93, train_loss: 0.6766, test_loss: 1.0360, test_f1: 0.5800
 epoch: 94, train_loss: 0.6599, test_loss: 1.0274, test_f1: 0.5980
 epoch: 95, train_loss: 0.6700, test_loss: 1.0909, test_f1: 0.5877
 epoch: 96, train_loss: 0.6637, test_loss: 1.1281, test_f1: 0.5754
 epoch: 97, train_loss: 0.6611, test_loss: 1.1235, test_f1: 0.5825
 epoch: 98, train_loss: 0.6680, test_loss: 1.0920, test_f1: 0.5592
 epoch: 99, train_loss: 0.6526, test_loss: 1.0306, test_f1: 0.5757
##################ITERATION #5 ****************************************
 epoch: 0, train_loss: 1.1322, test_loss: 1.0814, test_f1: 0.4490
 epoch: 1, train_loss: 1.0502, test_loss: 1.0631, test_f1: 0.4404
 epoch: 2, train_loss: 1.0238, test_loss: 1.0566, test_f1: 0.4554
 epoch: 3, train_loss: 1.0011, test_loss: 0.9647, test_f1: 0.5243
 epoch: 4, train_loss: 0.9573, test_loss: 0.9598, test_f1: 0.4791
 epoch: 5, train_loss: 0.9601, test_loss: 0.9977, test_f1: 0.4714
 epoch: 6, train_loss: 0.9448, test_loss: 1.0334, test_f1: 0.4977
 epoch: 7, train_loss: 0.9461, test_loss: 0.9573, test_f1: 0.4579
 epoch: 8, train_loss: 0.9659, test_loss: 0.9797, test_f1: 0.4980
 epoch: 9, train_loss: 0.9535, test_loss: 0.9210, test_f1: 0.5412
 epoch: 10, train_loss: 0.9410, test_loss: 0.9295, test_f1: 0.5178
 epoch: 11, train_loss: 0.9039, test_loss: 0.8951, test_f1: 0.5233
 epoch: 12, train_loss: 0.9109, test_loss: 0.9739, test_f1: 0.5396
 epoch: 13, train_loss: 0.9254, test_loss: 0.9209, test_f1: 0.5371
 epoch: 14, train_loss: 0.9149, test_loss: 0.9015, test_f1: 0.5267
 epoch: 15, train_loss: 0.8904, test_loss: 0.9081, test_f1: 0.5067
 epoch: 16, train_loss: 0.8846, test_loss: 0.8882, test_f1: 0.5180
 epoch: 17, train_loss: 0.8816, test_loss: 0.9416, test_f1: 0.5459
 epoch: 18, train_loss: 0.8799, test_loss: 0.9273, test_f1: 0.5432
 epoch: 19, train_loss: 0.8631, test_loss: 0.9583, test_f1: 0.5266
 epoch: 20, train_loss: 0.8770, test_loss: 0.8976, test_f1: 0.5717
 epoch: 21, train_loss: 0.8785, test_loss: 1.0390, test_f1: 0.5685
 epoch: 22, train_loss: 0.8602, test_loss: 0.9280, test_f1: 0.5360
 epoch: 23, train_loss: 0.8583, test_loss: 0.9856, test_f1: 0.5260
 epoch: 24, train_loss: 0.8493, test_loss: 0.8965, test_f1: 0.5385
 epoch: 25, train_loss: 0.8640, test_loss: 1.0373, test_f1: 0.5239
 epoch: 26, train_loss: 0.8439, test_loss: 0.9178, test_f1: 0.5952
 epoch: 27, train_loss: 0.8391, test_loss: 1.0434, test_f1: 0.5493
 epoch: 28, train_loss: 0.8232, test_loss: 0.9422, test_f1: 0.5350
 epoch: 29, train_loss: 0.8422, test_loss: 0.9437, test_f1: 0.5320
 epoch: 30, train_loss: 0.8335, test_loss: 0.8908, test_f1: 0.5540
 epoch: 31, train_loss: 0.8344, test_loss: 1.0113, test_f1: 0.5342
 epoch: 32, train_loss: 0.8076, test_loss: 1.2066, test_f1: 0.5398
 epoch: 33, train_loss: 0.8328, test_loss: 0.9428, test_f1: 0.5251
 epoch: 34, train_loss: 0.8097, test_loss: 0.9703, test_f1: 0.5262
 epoch: 35, train_loss: 0.8166, test_loss: 0.9813, test_f1: 0.5172
 epoch: 36, train_loss: 0.8375, test_loss: 1.0076, test_f1: 0.5855
 epoch: 37, train_loss: 0.8138, test_loss: 0.9833, test_f1: 0.5275
 epoch: 38, train_loss: 0.8193, test_loss: 1.1526, test_f1: 0.5172
 epoch: 39, train_loss: 0.8171, test_loss: 0.9745, test_f1: 0.5362
 epoch: 40, train_loss: 0.8091, test_loss: 1.1208, test_f1: 0.5112
 epoch: 41, train_loss: 0.7957, test_loss: 1.0220, test_f1: 0.5052
 epoch: 42, train_loss: 0.7935, test_loss: 0.8957, test_f1: 0.6023
 epoch: 43, train_loss: 0.7789, test_loss: 0.9677, test_f1: 0.6054
 epoch: 44, train_loss: 0.8061, test_loss: 0.8514, test_f1: 0.5603
 epoch: 45, train_loss: 0.7937, test_loss: 0.9813, test_f1: 0.5838
 epoch: 46, train_loss: 0.7853, test_loss: 1.0131, test_f1: 0.5385
 epoch: 47, train_loss: 0.7988, test_loss: 1.0021, test_f1: 0.5115
 epoch: 48, train_loss: 0.7847, test_loss: 0.8926, test_f1: 0.5512
 epoch: 49, train_loss: 0.8024, test_loss: 0.9590, test_f1: 0.5440
 epoch: 50, train_loss: 0.7725, test_loss: 0.9620, test_f1: 0.5385
 epoch: 51, train_loss: 0.7602, test_loss: 0.9623, test_f1: 0.5514
 epoch: 52, train_loss: 0.7231, test_loss: 0.9301, test_f1: 0.5397
 epoch: 53, train_loss: 0.7302, test_loss: 0.9685, test_f1: 0.5436
 epoch: 54, train_loss: 0.7101, test_loss: 1.0716, test_f1: 0.5502
 epoch: 55, train_loss: 0.7312, test_loss: 0.9957, test_f1: 0.5583
 epoch: 56, train_loss: 0.7331, test_loss: 0.9201, test_f1: 0.6036
 epoch: 57, train_loss: 0.7149, test_loss: 0.9968, test_f1: 0.5247
 epoch: 58, train_loss: 0.7219, test_loss: 1.0502, test_f1: 0.5281
 epoch: 59, train_loss: 0.7121, test_loss: 1.0417, test_f1: 0.6110
 epoch: 60, train_loss: 0.7017, test_loss: 0.9618, test_f1: 0.5693
 epoch: 61, train_loss: 0.6963, test_loss: 1.0245, test_f1: 0.6021
 epoch: 62, train_loss: 0.7164, test_loss: 1.0656, test_f1: 0.5478
 epoch: 63, train_loss: 0.7145, test_loss: 0.9826, test_f1: 0.6210
 epoch: 64, train_loss: 0.7030, test_loss: 0.9752, test_f1: 0.6078
 epoch: 65, train_loss: 0.6921, test_loss: 1.0036, test_f1: 0.5500
 epoch: 66, train_loss: 0.7103, test_loss: 0.9950, test_f1: 0.5715
 epoch: 67, train_loss: 0.6808, test_loss: 1.1139, test_f1: 0.5881
 epoch: 68, train_loss: 0.7120, test_loss: 0.9898, test_f1: 0.5785
 epoch: 69, train_loss: 0.6788, test_loss: 1.0418, test_f1: 0.5908
 epoch: 70, train_loss: 0.6772, test_loss: 1.0399, test_f1: 0.5548
 epoch: 71, train_loss: 0.7036, test_loss: 1.0373, test_f1: 0.5848
 epoch: 72, train_loss: 0.6739, test_loss: 1.0819, test_f1: 0.5967
 epoch: 73, train_loss: 0.6852, test_loss: 0.9318, test_f1: 0.5846
 epoch: 74, train_loss: 0.6721, test_loss: 1.0009, test_f1: 0.5876
 epoch: 75, train_loss: 0.6750, test_loss: 1.0790, test_f1: 0.5577
 epoch: 76, train_loss: 0.6809, test_loss: 0.9845, test_f1: 0.5931
 epoch: 77, train_loss: 0.6809, test_loss: 1.0702, test_f1: 0.5734
 epoch: 78, train_loss: 0.6610, test_loss: 1.0387, test_f1: 0.6197
 epoch: 79, train_loss: 0.6678, test_loss: 1.0287, test_f1: 0.5678
 epoch: 80, train_loss: 0.6894, test_loss: 1.0657, test_f1: 0.5785
 epoch: 81, train_loss: 0.6649, test_loss: 1.0672, test_f1: 0.5990
 epoch: 82, train_loss: 0.6701, test_loss: 1.0519, test_f1: 0.6015
 epoch: 83, train_loss: 0.6711, test_loss: 0.9995, test_f1: 0.5909
 epoch: 84, train_loss: 0.6688, test_loss: 1.0246, test_f1: 0.6367
 epoch: 85, train_loss: 0.6483, test_loss: 1.0258, test_f1: 0.6323
 epoch: 86, train_loss: 0.6596, test_loss: 1.0250, test_f1: 0.5972
 epoch: 87, train_loss: 0.6464, test_loss: 1.0131, test_f1: 0.6272
 epoch: 88, train_loss: 0.6588, test_loss: 1.0952, test_f1: 0.5662
 epoch: 89, train_loss: 0.6437, test_loss: 1.0595, test_f1: 0.5776
 epoch: 90, train_loss: 0.6694, test_loss: 0.9939, test_f1: 0.6050
 epoch: 91, train_loss: 0.6514, test_loss: 1.0018, test_f1: 0.6085
 epoch: 92, train_loss: 0.6421, test_loss: 1.1720, test_f1: 0.5859
 epoch: 93, train_loss: 0.6571, test_loss: 1.0909, test_f1: 0.5619
 epoch: 94, train_loss: 0.6468, test_loss: 1.0112, test_f1: 0.6199
 epoch: 95, train_loss: 0.6533, test_loss: 1.1250, test_f1: 0.5904
 epoch: 96, train_loss: 0.6604, test_loss: 0.9301, test_f1: 0.6361
 epoch: 97, train_loss: 0.6492, test_loss: 1.0501, test_f1: 0.5736
 epoch: 98, train_loss: 0.6380, test_loss: 1.0363, test_f1: 0.5937
 epoch: 99, train_loss: 0.6454, test_loss: 0.9174, test_f1: 0.6052
##################ITERATION #6 ****************************************
 epoch: 0, train_loss: 1.1367, test_loss: 1.0264, test_f1: 0.4595
 epoch: 1, train_loss: 1.0410, test_loss: 1.0619, test_f1: 0.5046
 epoch: 2, train_loss: 1.0073, test_loss: 1.1563, test_f1: 0.4052
 epoch: 3, train_loss: 0.9965, test_loss: 0.9719, test_f1: 0.4875
 epoch: 4, train_loss: 0.9771, test_loss: 0.9890, test_f1: 0.4909
 epoch: 5, train_loss: 0.9648, test_loss: 0.9702, test_f1: 0.4915
 epoch: 6, train_loss: 0.9518, test_loss: 1.0029, test_f1: 0.4781
 epoch: 7, train_loss: 0.9540, test_loss: 0.9195, test_f1: 0.5246
 epoch: 8, train_loss: 0.9198, test_loss: 0.9512, test_f1: 0.4642
 epoch: 9, train_loss: 0.9327, test_loss: 0.9798, test_f1: 0.4995
 epoch: 10, train_loss: 0.9255, test_loss: 0.9423, test_f1: 0.5132
 epoch: 11, train_loss: 0.9043, test_loss: 0.8802, test_f1: 0.4955
 epoch: 12, train_loss: 0.9085, test_loss: 1.1427, test_f1: 0.4906
 epoch: 13, train_loss: 0.9116, test_loss: 0.9032, test_f1: 0.5314
 epoch: 14, train_loss: 0.8802, test_loss: 1.0332, test_f1: 0.4507
 epoch: 15, train_loss: 0.9063, test_loss: 0.9404, test_f1: 0.4911
 epoch: 16, train_loss: 0.8748, test_loss: 0.8823, test_f1: 0.5431
 epoch: 17, train_loss: 0.8870, test_loss: 0.8609, test_f1: 0.5388
 epoch: 18, train_loss: 0.8549, test_loss: 1.0501, test_f1: 0.4533
 epoch: 19, train_loss: 0.8706, test_loss: 0.9361, test_f1: 0.5197
 epoch: 20, train_loss: 0.8615, test_loss: 1.1316, test_f1: 0.4460
 epoch: 21, train_loss: 0.8708, test_loss: 2.3799, test_f1: 0.5293
 epoch: 22, train_loss: 0.8460, test_loss: 0.9252, test_f1: 0.5291
 epoch: 23, train_loss: 0.8409, test_loss: 0.8935, test_f1: 0.5829
 epoch: 24, train_loss: 0.8316, test_loss: 0.9057, test_f1: 0.5321
 epoch: 25, train_loss: 0.8245, test_loss: 0.8710, test_f1: 0.5190
 epoch: 26, train_loss: 0.8290, test_loss: 0.8290, test_f1: 0.5661
 epoch: 27, train_loss: 0.8377, test_loss: 0.8531, test_f1: 0.5428
 epoch: 28, train_loss: 0.8327, test_loss: 0.8905, test_f1: 0.5392
 epoch: 29, train_loss: 0.8006, test_loss: 0.8239, test_f1: 0.5505
 epoch: 30, train_loss: 0.8062, test_loss: 0.9112, test_f1: 0.5085
 epoch: 31, train_loss: 0.8270, test_loss: 0.9302, test_f1: 0.5253
 epoch: 32, train_loss: 0.8370, test_loss: 0.8536, test_f1: 0.5907
 epoch: 33, train_loss: 0.8046, test_loss: 0.8203, test_f1: 0.5406
 epoch: 34, train_loss: 0.8246, test_loss: 0.8995, test_f1: 0.5338
 epoch: 35, train_loss: 0.7874, test_loss: 0.8974, test_f1: 0.5224
 epoch: 36, train_loss: 0.7968, test_loss: 0.9182, test_f1: 0.5363
 epoch: 37, train_loss: 0.7993, test_loss: 0.8875, test_f1: 0.5132
 epoch: 38, train_loss: 0.7968, test_loss: 1.1555, test_f1: 0.4602
 epoch: 39, train_loss: 0.7954, test_loss: 0.7854, test_f1: 0.5775
 epoch: 40, train_loss: 0.7891, test_loss: 0.9045, test_f1: 0.5400
 epoch: 41, train_loss: 0.7866, test_loss: 0.8675, test_f1: 0.5530
 epoch: 42, train_loss: 0.7882, test_loss: 0.9532, test_f1: 0.5580
 epoch: 43, train_loss: 0.7728, test_loss: 0.9124, test_f1: 0.5557
 epoch: 44, train_loss: 0.7983, test_loss: 0.8876, test_f1: 0.5451
 epoch: 45, train_loss: 0.7740, test_loss: 1.0312, test_f1: 0.4946
 epoch: 46, train_loss: 0.7713, test_loss: 0.8718, test_f1: 0.5972
 epoch: 47, train_loss: 0.7602, test_loss: 0.9099, test_f1: 0.6136
 epoch: 48, train_loss: 0.7520, test_loss: 0.9530, test_f1: 0.6192
 epoch: 49, train_loss: 0.7545, test_loss: 0.9302, test_f1: 0.5969
 epoch: 50, train_loss: 0.7430, test_loss: 0.9009, test_f1: 0.6123
 epoch: 51, train_loss: 0.7232, test_loss: 0.8866, test_f1: 0.5681
 epoch: 52, train_loss: 0.6986, test_loss: 0.9109, test_f1: 0.5768
 epoch: 53, train_loss: 0.7073, test_loss: 0.8832, test_f1: 0.5685
 epoch: 54, train_loss: 0.6989, test_loss: 0.9587, test_f1: 0.6082
 epoch: 55, train_loss: 0.6930, test_loss: 0.9775, test_f1: 0.5828
 epoch: 56, train_loss: 0.7081, test_loss: 0.8858, test_f1: 0.5770
 epoch: 57, train_loss: 0.7089, test_loss: 0.8954, test_f1: 0.6065
 epoch: 58, train_loss: 0.7008, test_loss: 0.9322, test_f1: 0.5971
 epoch: 59, train_loss: 0.6875, test_loss: 0.9343, test_f1: 0.5819
 epoch: 60, train_loss: 0.6942, test_loss: 0.9125, test_f1: 0.6204
 epoch: 61, train_loss: 0.6929, test_loss: 0.9330, test_f1: 0.6131
 epoch: 62, train_loss: 0.6903, test_loss: 0.9400, test_f1: 0.6270
 epoch: 63, train_loss: 0.6774, test_loss: 0.9488, test_f1: 0.6185
 epoch: 64, train_loss: 0.6773, test_loss: 0.9120, test_f1: 0.5834
 epoch: 65, train_loss: 0.6867, test_loss: 0.9132, test_f1: 0.6226
 epoch: 66, train_loss: 0.6890, test_loss: 0.9437, test_f1: 0.5988
 epoch: 67, train_loss: 0.6741, test_loss: 0.9269, test_f1: 0.6452
 epoch: 68, train_loss: 0.6683, test_loss: 0.8870, test_f1: 0.6020
 epoch: 69, train_loss: 0.6807, test_loss: 0.9027, test_f1: 0.6212
 epoch: 70, train_loss: 0.6971, test_loss: 0.8962, test_f1: 0.6179
 epoch: 71, train_loss: 0.6694, test_loss: 0.9292, test_f1: 0.6313
 epoch: 72, train_loss: 0.6750, test_loss: 0.9345, test_f1: 0.6205
 epoch: 73, train_loss: 0.6560, test_loss: 0.9011, test_f1: 0.6200
 epoch: 74, train_loss: 0.6625, test_loss: 0.9146, test_f1: 0.5961
 epoch: 75, train_loss: 0.6773, test_loss: 0.8798, test_f1: 0.6023
 epoch: 76, train_loss: 0.6581, test_loss: 0.9047, test_f1: 0.6544
 epoch: 77, train_loss: 0.6769, test_loss: 0.9598, test_f1: 0.6245
 epoch: 78, train_loss: 0.6581, test_loss: 0.9335, test_f1: 0.6215
 epoch: 79, train_loss: 0.6764, test_loss: 0.8466, test_f1: 0.6309
 epoch: 80, train_loss: 0.6512, test_loss: 0.9536, test_f1: 0.6083
 epoch: 81, train_loss: 0.6553, test_loss: 0.9192, test_f1: 0.6073
 epoch: 82, train_loss: 0.6600, test_loss: 0.8851, test_f1: 0.5884
 epoch: 83, train_loss: 0.6380, test_loss: 0.9652, test_f1: 0.5921
 epoch: 84, train_loss: 0.6620, test_loss: 0.8907, test_f1: 0.6327
 epoch: 85, train_loss: 0.6393, test_loss: 0.8733, test_f1: 0.6514
 epoch: 86, train_loss: 0.6508, test_loss: 0.8500, test_f1: 0.6185
 epoch: 87, train_loss: 0.6539, test_loss: 0.8404, test_f1: 0.6493
 epoch: 88, train_loss: 0.6365, test_loss: 0.9183, test_f1: 0.6342
 epoch: 89, train_loss: 0.6461, test_loss: 0.9022, test_f1: 0.6327
 epoch: 90, train_loss: 0.6424, test_loss: 0.9198, test_f1: 0.6245
 epoch: 91, train_loss: 0.6351, test_loss: 0.8970, test_f1: 0.6373
 epoch: 92, train_loss: 0.6315, test_loss: 0.8741, test_f1: 0.6672
 epoch: 93, train_loss: 0.6465, test_loss: 0.8792, test_f1: 0.6557
 epoch: 94, train_loss: 0.6394, test_loss: 0.9339, test_f1: 0.6328
 epoch: 95, train_loss: 0.6433, test_loss: 0.9606, test_f1: 0.6179
 epoch: 96, train_loss: 0.6420, test_loss: 0.9390, test_f1: 0.6549
 epoch: 97, train_loss: 0.6446, test_loss: 0.8944, test_f1: 0.6303
 epoch: 98, train_loss: 0.6210, test_loss: 0.9273, test_f1: 0.6495
 epoch: 99, train_loss: 0.6187, test_loss: 0.8690, test_f1: 0.6842
##################ITERATION #7 ****************************************
 epoch: 0, train_loss: 1.1708, test_loss: 1.1766, test_f1: 0.4060
 epoch: 1, train_loss: 1.0590, test_loss: 1.1160, test_f1: 0.3895
 epoch: 2, train_loss: 1.0400, test_loss: 1.1001, test_f1: 0.4414
 epoch: 3, train_loss: 1.0175, test_loss: 1.0907, test_f1: 0.4862
 epoch: 4, train_loss: 1.0116, test_loss: 1.0332, test_f1: 0.4991
 epoch: 5, train_loss: 0.9886, test_loss: 1.0236, test_f1: 0.4687
 epoch: 6, train_loss: 0.9665, test_loss: 1.0198, test_f1: 0.4363
 epoch: 7, train_loss: 0.9808, test_loss: 1.0261, test_f1: 0.4842
 epoch: 8, train_loss: 0.9416, test_loss: 0.9239, test_f1: 0.5014
 epoch: 9, train_loss: 0.9337, test_loss: 0.9392, test_f1: 0.5189
 epoch: 10, train_loss: 0.9169, test_loss: 0.8948, test_f1: 0.4925
 epoch: 11, train_loss: 0.9109, test_loss: 1.0954, test_f1: 0.4460
 epoch: 12, train_loss: 0.8868, test_loss: 0.9324, test_f1: 0.4988
 epoch: 13, train_loss: 0.8912, test_loss: 0.9661, test_f1: 0.5131
 epoch: 14, train_loss: 0.8834, test_loss: 0.9393, test_f1: 0.5086
 epoch: 15, train_loss: 0.8629, test_loss: 0.8417, test_f1: 0.5144
 epoch: 16, train_loss: 0.8728, test_loss: 0.9697, test_f1: 0.5496
 epoch: 17, train_loss: 0.8780, test_loss: 0.9874, test_f1: 0.4758
 epoch: 18, train_loss: 0.8467, test_loss: 0.8487, test_f1: 0.5180
 epoch: 19, train_loss: 0.8642, test_loss: 0.8919, test_f1: 0.5472
 epoch: 20, train_loss: 0.8449, test_loss: 0.9495, test_f1: 0.5674
 epoch: 21, train_loss: 0.8467, test_loss: 0.9413, test_f1: 0.5507
 epoch: 22, train_loss: 0.8378, test_loss: 0.9071, test_f1: 0.5826
 epoch: 23, train_loss: 0.8352, test_loss: 0.9069, test_f1: 0.5409
 epoch: 24, train_loss: 0.8433, test_loss: 0.8739, test_f1: 0.5268
 epoch: 25, train_loss: 0.8344, test_loss: 0.8960, test_f1: 0.5048
 epoch: 26, train_loss: 0.8241, test_loss: 0.9736, test_f1: 0.5170
 epoch: 27, train_loss: 0.8287, test_loss: 0.9444, test_f1: 0.5394
 epoch: 28, train_loss: 0.8292, test_loss: 0.8934, test_f1: 0.5433
 epoch: 29, train_loss: 0.8227, test_loss: 0.8115, test_f1: 0.5445
 epoch: 30, train_loss: 0.8218, test_loss: 1.0533, test_f1: 0.5029
 epoch: 31, train_loss: 0.8127, test_loss: 0.8863, test_f1: 0.6007
 epoch: 32, train_loss: 0.8168, test_loss: 0.9090, test_f1: 0.5823
 epoch: 33, train_loss: 0.8027, test_loss: 1.4425, test_f1: 0.4341
 epoch: 34, train_loss: 0.7999, test_loss: 1.3320, test_f1: 0.4982
 epoch: 35, train_loss: 0.8281, test_loss: 1.0198, test_f1: 0.5248
 epoch: 36, train_loss: 0.8137, test_loss: 0.8553, test_f1: 0.5536
 epoch: 37, train_loss: 0.8031, test_loss: 0.8569, test_f1: 0.5509
 epoch: 38, train_loss: 0.7902, test_loss: 0.9120, test_f1: 0.6074
 epoch: 39, train_loss: 0.7968, test_loss: 0.9371, test_f1: 0.5536
 epoch: 40, train_loss: 0.8257, test_loss: 0.9242, test_f1: 0.5730
 epoch: 41, train_loss: 0.8023, test_loss: 0.8769, test_f1: 0.5721
 epoch: 42, train_loss: 0.8123, test_loss: 0.8514, test_f1: 0.5421
 epoch: 43, train_loss: 0.7855, test_loss: 0.9443, test_f1: 0.5156
 epoch: 44, train_loss: 0.7665, test_loss: 0.9419, test_f1: 0.5990
 epoch: 45, train_loss: 0.7812, test_loss: 0.9164, test_f1: 0.5391
 epoch: 46, train_loss: 0.7785, test_loss: 1.0041, test_f1: 0.5868
 epoch: 47, train_loss: 0.7740, test_loss: 1.0587, test_f1: 0.5170
 epoch: 48, train_loss: 0.7724, test_loss: 0.9559, test_f1: 0.5288
 epoch: 49, train_loss: 0.7576, test_loss: 0.9424, test_f1: 0.5393
 epoch: 50, train_loss: 0.7642, test_loss: 0.9792, test_f1: 0.5713
 epoch: 51, train_loss: 0.7541, test_loss: 0.9314, test_f1: 0.5334
 epoch: 52, train_loss: 0.7443, test_loss: 1.0296, test_f1: 0.5927
 epoch: 53, train_loss: 0.7316, test_loss: 0.9220, test_f1: 0.6010
 epoch: 54, train_loss: 0.7148, test_loss: 0.9820, test_f1: 0.5465
 epoch: 55, train_loss: 0.7129, test_loss: 0.9832, test_f1: 0.5994
 epoch: 56, train_loss: 0.7069, test_loss: 0.9827, test_f1: 0.5650
 epoch: 57, train_loss: 0.7156, test_loss: 1.0066, test_f1: 0.5242
 epoch: 58, train_loss: 0.7074, test_loss: 1.1256, test_f1: 0.5385
 epoch: 59, train_loss: 0.8645, test_loss: 1.1136, test_f1: 0.5266
 epoch: 60, train_loss: 0.7849, test_loss: 0.9376, test_f1: 0.5264
 epoch: 61, train_loss: 0.7812, test_loss: 1.0511, test_f1: 0.5081
 epoch: 62, train_loss: 0.7696, test_loss: 0.9284, test_f1: 0.5736
 epoch: 63, train_loss: 0.7499, test_loss: 0.9613, test_f1: 0.5391
 epoch: 64, train_loss: 0.7278, test_loss: 1.0186, test_f1: 0.5540
 epoch: 65, train_loss: 0.7554, test_loss: 0.9720, test_f1: 0.5572
 epoch: 66, train_loss: 0.7315, test_loss: 0.9630, test_f1: 0.5373
 epoch: 67, train_loss: 0.7209, test_loss: 0.9719, test_f1: 0.5670
 epoch: 68, train_loss: 0.7184, test_loss: 0.8963, test_f1: 0.5701
 epoch: 69, train_loss: 0.7228, test_loss: 1.0833, test_f1: 0.5531
 epoch: 70, train_loss: 0.7086, test_loss: 0.9684, test_f1: 0.5786
 epoch: 71, train_loss: 0.7131, test_loss: 0.8740, test_f1: 0.6212
 epoch: 72, train_loss: 0.7231, test_loss: 0.8542, test_f1: 0.5905
 epoch: 73, train_loss: 0.7083, test_loss: 0.8910, test_f1: 0.6150
 epoch: 74, train_loss: 0.6863, test_loss: 0.8613, test_f1: 0.5962
 epoch: 75, train_loss: 0.7015, test_loss: 0.9597, test_f1: 0.6219
 epoch: 76, train_loss: 0.7061, test_loss: 0.8959, test_f1: 0.5597
 epoch: 77, train_loss: 0.6987, test_loss: 0.8836, test_f1: 0.5537
 epoch: 78, train_loss: 0.6940, test_loss: 0.9324, test_f1: 0.6279
 epoch: 79, train_loss: 0.6919, test_loss: 0.9899, test_f1: 0.5553
 epoch: 80, train_loss: 0.7014, test_loss: 0.8858, test_f1: 0.6141
 epoch: 81, train_loss: 0.6749, test_loss: 1.0779, test_f1: 0.6006
 epoch: 82, train_loss: 0.6778, test_loss: 0.9335, test_f1: 0.5777
 epoch: 83, train_loss: 0.6849, test_loss: 1.0033, test_f1: 0.5610
 epoch: 84, train_loss: 0.6801, test_loss: 0.9428, test_f1: 0.5810
 epoch: 85, train_loss: 0.6689, test_loss: 0.9150, test_f1: 0.5692
 epoch: 86, train_loss: 0.6793, test_loss: 0.9890, test_f1: 0.5930
 epoch: 87, train_loss: 0.6712, test_loss: 1.0132, test_f1: 0.5976
 epoch: 88, train_loss: 0.6850, test_loss: 0.9222, test_f1: 0.5727
 epoch: 89, train_loss: 0.6800, test_loss: 0.9721, test_f1: 0.5704
 epoch: 90, train_loss: 0.6570, test_loss: 0.9611, test_f1: 0.5920
 epoch: 91, train_loss: 0.6750, test_loss: 0.9678, test_f1: 0.5676
 epoch: 92, train_loss: 0.6645, test_loss: 0.9750, test_f1: 0.5846
 epoch: 93, train_loss: 0.6654, test_loss: 0.9585, test_f1: 0.6142
 epoch: 94, train_loss: 0.6583, test_loss: 1.0106, test_f1: 0.5895
 epoch: 95, train_loss: 0.6736, test_loss: 0.9066, test_f1: 0.6084
 epoch: 96, train_loss: 0.6545, test_loss: 1.0122, test_f1: 0.5467
 epoch: 97, train_loss: 0.6453, test_loss: 1.0923, test_f1: 0.5570
 epoch: 98, train_loss: 0.6554, test_loss: 1.1178, test_f1: 0.6166
 epoch: 99, train_loss: 0.6483, test_loss: 0.9821, test_f1: 0.5755
##################ITERATION #8 ****************************************
 epoch: 0, train_loss: 1.1617, test_loss: 1.1683, test_f1: 0.4253
 epoch: 1, train_loss: 1.0836, test_loss: 1.0983, test_f1: 0.4371
 epoch: 2, train_loss: 1.0598, test_loss: 1.1113, test_f1: 0.4063
 epoch: 3, train_loss: 1.0092, test_loss: 1.2871, test_f1: 0.3889
 epoch: 4, train_loss: 0.9882, test_loss: 1.0475, test_f1: 0.4191
 epoch: 5, train_loss: 0.9772, test_loss: 1.0860, test_f1: 0.4694
 epoch: 6, train_loss: 0.9527, test_loss: 1.1681, test_f1: 0.4415
 epoch: 7, train_loss: 0.9528, test_loss: 1.0172, test_f1: 0.4711
 epoch: 8, train_loss: 0.9395, test_loss: 1.0413, test_f1: 0.4859
 epoch: 9, train_loss: 0.9278, test_loss: 1.6379, test_f1: 0.4877
 epoch: 10, train_loss: 0.9383, test_loss: 1.0267, test_f1: 0.5352
 epoch: 11, train_loss: 0.9284, test_loss: 1.0863, test_f1: 0.4780
 epoch: 12, train_loss: 0.9227, test_loss: 0.9348, test_f1: 0.5330
 epoch: 13, train_loss: 0.9148, test_loss: 1.0404, test_f1: 0.4561
 epoch: 14, train_loss: 0.9222, test_loss: 1.0606, test_f1: 0.4763
 epoch: 15, train_loss: 0.8960, test_loss: 0.9062, test_f1: 0.5144
 epoch: 16, train_loss: 0.8914, test_loss: 0.9475, test_f1: 0.4637
 epoch: 17, train_loss: 0.8795, test_loss: 0.9781, test_f1: 0.5314
 epoch: 18, train_loss: 0.8683, test_loss: 0.9658, test_f1: 0.4808
 epoch: 19, train_loss: 0.8758, test_loss: 0.8336, test_f1: 0.5477
 epoch: 20, train_loss: 0.8610, test_loss: 0.9707, test_f1: 0.4910
 epoch: 21, train_loss: 0.8763, test_loss: 0.9063, test_f1: 0.5381
 epoch: 22, train_loss: 0.8828, test_loss: 0.9091, test_f1: 0.5207
 epoch: 23, train_loss: 0.8464, test_loss: 0.9007, test_f1: 0.5253
 epoch: 24, train_loss: 0.8501, test_loss: 1.0396, test_f1: 0.4803
 epoch: 25, train_loss: 0.8579, test_loss: 1.1355, test_f1: 0.4982
 epoch: 26, train_loss: 0.8429, test_loss: 0.9872, test_f1: 0.4998
 epoch: 27, train_loss: 0.8351, test_loss: 0.9188, test_f1: 0.5862
 epoch: 28, train_loss: 0.8393, test_loss: 0.9638, test_f1: 0.5435
 epoch: 29, train_loss: 0.8440, test_loss: 1.0350, test_f1: 0.5265
 epoch: 30, train_loss: 0.8285, test_loss: 1.0622, test_f1: 0.5198
 epoch: 31, train_loss: 0.8150, test_loss: 1.0824, test_f1: 0.5137
 epoch: 32, train_loss: 0.8192, test_loss: 0.9564, test_f1: 0.5901
 epoch: 33, train_loss: 0.8083, test_loss: 1.0464, test_f1: 0.5796
 epoch: 34, train_loss: 0.8086, test_loss: 0.9739, test_f1: 0.5573
 epoch: 35, train_loss: 0.8204, test_loss: 0.9960, test_f1: 0.5330
 epoch: 36, train_loss: 0.8069, test_loss: 0.9604, test_f1: 0.6026
 epoch: 37, train_loss: 0.8111, test_loss: 0.9437, test_f1: 0.5601
 epoch: 38, train_loss: 0.8070, test_loss: 0.9669, test_f1: 0.5387
 epoch: 39, train_loss: 0.7954, test_loss: 0.8848, test_f1: 0.5743
 epoch: 40, train_loss: 0.7841, test_loss: 0.9889, test_f1: 0.5746
 epoch: 41, train_loss: 0.8024, test_loss: 0.9562, test_f1: 0.5775
 epoch: 42, train_loss: 0.7950, test_loss: 0.8881, test_f1: 0.5931
 epoch: 43, train_loss: 0.7878, test_loss: 0.8991, test_f1: 0.5256
 epoch: 44, train_loss: 0.7893, test_loss: 0.8754, test_f1: 0.5417
 epoch: 45, train_loss: 0.7841, test_loss: 0.8245, test_f1: 0.5552
 epoch: 46, train_loss: 0.7738, test_loss: 1.2610, test_f1: 0.4511
 epoch: 47, train_loss: 0.7862, test_loss: 0.9127, test_f1: 0.6163
 epoch: 48, train_loss: 0.7802, test_loss: 0.8656, test_f1: 0.6359
 epoch: 49, train_loss: 0.7697, test_loss: 0.8799, test_f1: 0.5660
 epoch: 50, train_loss: 0.7674, test_loss: 0.9128, test_f1: 0.5989
 epoch: 51, train_loss: 0.7508, test_loss: 0.9347, test_f1: 0.6257
 epoch: 52, train_loss: 0.7290, test_loss: 0.9299, test_f1: 0.5803
 epoch: 53, train_loss: 0.7359, test_loss: 0.9232, test_f1: 0.6026
 epoch: 54, train_loss: 0.7188, test_loss: 0.9935, test_f1: 0.5858
 epoch: 55, train_loss: 0.7205, test_loss: 0.9055, test_f1: 0.6655
 epoch: 56, train_loss: 0.7160, test_loss: 1.0189, test_f1: 0.6302
 epoch: 57, train_loss: 0.7125, test_loss: 0.9854, test_f1: 0.6433
 epoch: 58, train_loss: 0.7046, test_loss: 1.0258, test_f1: 0.5820
 epoch: 59, train_loss: 0.7083, test_loss: 0.9703, test_f1: 0.6136
 epoch: 60, train_loss: 0.7081, test_loss: 0.9249, test_f1: 0.6269
 epoch: 61, train_loss: 0.7114, test_loss: 0.9972, test_f1: 0.6051
 epoch: 62, train_loss: 0.7094, test_loss: 1.0510, test_f1: 0.6123
 epoch: 63, train_loss: 0.7011, test_loss: 1.0994, test_f1: 0.6255
 epoch: 64, train_loss: 0.7123, test_loss: 0.8945, test_f1: 0.6415
 epoch: 65, train_loss: 0.6885, test_loss: 1.0033, test_f1: 0.5944
 epoch: 66, train_loss: 0.7068, test_loss: 0.9118, test_f1: 0.6165
 epoch: 67, train_loss: 0.7126, test_loss: 0.9066, test_f1: 0.6069
 epoch: 68, train_loss: 0.6838, test_loss: 0.9733, test_f1: 0.6077
 epoch: 69, train_loss: 0.6867, test_loss: 1.0066, test_f1: 0.5953
 epoch: 70, train_loss: 0.6809, test_loss: 0.9460, test_f1: 0.6055
 epoch: 71, train_loss: 0.6859, test_loss: 0.9698, test_f1: 0.6246
 epoch: 72, train_loss: 0.6729, test_loss: 1.0200, test_f1: 0.6048
 epoch: 73, train_loss: 0.7052, test_loss: 0.9460, test_f1: 0.5954
 epoch: 74, train_loss: 0.6622, test_loss: 0.9170, test_f1: 0.6238
 epoch: 75, train_loss: 0.6949, test_loss: 0.9442, test_f1: 0.6181
 epoch: 76, train_loss: 0.6861, test_loss: 1.0363, test_f1: 0.6169
 epoch: 77, train_loss: 0.6666, test_loss: 0.9345, test_f1: 0.6409
 epoch: 78, train_loss: 0.6746, test_loss: 0.9412, test_f1: 0.6181
 epoch: 79, train_loss: 0.6660, test_loss: 0.9263, test_f1: 0.6169
 epoch: 80, train_loss: 0.6691, test_loss: 0.8819, test_f1: 0.6442
 epoch: 81, train_loss: 0.6787, test_loss: 1.0223, test_f1: 0.6021
 epoch: 82, train_loss: 0.6709, test_loss: 0.9216, test_f1: 0.6224
 epoch: 83, train_loss: 0.6585, test_loss: 0.9703, test_f1: 0.6006
 epoch: 84, train_loss: 0.6513, test_loss: 0.9956, test_f1: 0.6301
 epoch: 85, train_loss: 0.6754, test_loss: 0.8829, test_f1: 0.6449
 epoch: 86, train_loss: 0.6734, test_loss: 1.0487, test_f1: 0.6151
 epoch: 87, train_loss: 0.6590, test_loss: 0.9913, test_f1: 0.6216
 epoch: 88, train_loss: 0.6636, test_loss: 0.9335, test_f1: 0.6175
 epoch: 89, train_loss: 0.6362, test_loss: 0.9322, test_f1: 0.6238
 epoch: 90, train_loss: 0.6458, test_loss: 1.0161, test_f1: 0.6161
 epoch: 91, train_loss: 0.6590, test_loss: 0.9526, test_f1: 0.6242
 epoch: 92, train_loss: 0.6528, test_loss: 0.9844, test_f1: 0.6340
 epoch: 93, train_loss: 0.6440, test_loss: 0.9383, test_f1: 0.5829
 epoch: 94, train_loss: 0.6550, test_loss: 0.8814, test_f1: 0.5938
 epoch: 95, train_loss: 0.6560, test_loss: 0.9045, test_f1: 0.5986
 epoch: 96, train_loss: 0.6378, test_loss: 0.9520, test_f1: 0.6398
 epoch: 97, train_loss: 0.6496, test_loss: 1.0169, test_f1: 0.6203
 epoch: 98, train_loss: 0.6404, test_loss: 0.9282, test_f1: 0.6317
 epoch: 99, train_loss: 0.6598, test_loss: 0.9065, test_f1: 0.6195
##################ITERATION #9 ****************************************
 epoch: 0, train_loss: 1.1496, test_loss: 1.0852, test_f1: 0.5030
 epoch: 1, train_loss: 1.0306, test_loss: 1.0407, test_f1: 0.4984
 epoch: 2, train_loss: 1.0038, test_loss: 1.0901, test_f1: 0.4592
 epoch: 3, train_loss: 0.9739, test_loss: 1.0487, test_f1: 0.5277
 epoch: 4, train_loss: 0.9698, test_loss: 1.0331, test_f1: 0.4928
 epoch: 5, train_loss: 0.9696, test_loss: 1.0416, test_f1: 0.4574
 epoch: 6, train_loss: 0.9379, test_loss: 1.0477, test_f1: 0.4837
 epoch: 7, train_loss: 0.9406, test_loss: 1.0587, test_f1: 0.4788
 epoch: 8, train_loss: 0.9588, test_loss: 0.8769, test_f1: 0.4763
 epoch: 9, train_loss: 0.9244, test_loss: 0.9401, test_f1: 0.4841
 epoch: 10, train_loss: 0.9063, test_loss: 0.9662, test_f1: 0.4830
 epoch: 11, train_loss: 0.8927, test_loss: 0.9925, test_f1: 0.5265
 epoch: 12, train_loss: 0.8841, test_loss: 0.9157, test_f1: 0.5344
 epoch: 13, train_loss: 0.8637, test_loss: 0.9902, test_f1: 0.4953
 epoch: 14, train_loss: 0.8739, test_loss: 0.8922, test_f1: 0.5327
 epoch: 15, train_loss: 0.8706, test_loss: 0.8708, test_f1: 0.5503
 epoch: 16, train_loss: 0.8763, test_loss: 0.9254, test_f1: 0.4812
 epoch: 17, train_loss: 0.8592, test_loss: 0.8738, test_f1: 0.5349
 epoch: 18, train_loss: 0.8324, test_loss: 0.9103, test_f1: 0.5550
 epoch: 19, train_loss: 0.8287, test_loss: 0.9147, test_f1: 0.5418
 epoch: 20, train_loss: 0.8452, test_loss: 0.9088, test_f1: 0.5336
 epoch: 21, train_loss: 0.8367, test_loss: 0.8820, test_f1: 0.5769
 epoch: 22, train_loss: 0.8201, test_loss: 1.1117, test_f1: 0.4519
 epoch: 23, train_loss: 0.8158, test_loss: 0.9249, test_f1: 0.5288
 epoch: 24, train_loss: 0.8017, test_loss: 0.8466, test_f1: 0.5438
 epoch: 25, train_loss: 0.7942, test_loss: 0.8459, test_f1: 0.5241
 epoch: 26, train_loss: 0.7962, test_loss: 0.9105, test_f1: 0.5606
 epoch: 27, train_loss: 0.7991, test_loss: 0.8520, test_f1: 0.5622
 epoch: 28, train_loss: 0.8165, test_loss: 0.9375, test_f1: 0.5151
 epoch: 29, train_loss: 0.8010, test_loss: 0.9338, test_f1: 0.5318
 epoch: 30, train_loss: 0.7995, test_loss: 0.8560, test_f1: 0.5952
 epoch: 31, train_loss: 0.7907, test_loss: 0.8981, test_f1: 0.6051
 epoch: 32, train_loss: 0.7787, test_loss: 0.7716, test_f1: 0.6245
 epoch: 33, train_loss: 0.7826, test_loss: 0.9552, test_f1: 0.5619
 epoch: 34, train_loss: 0.7837, test_loss: 0.7985, test_f1: 0.6136
 epoch: 35, train_loss: 0.7845, test_loss: 0.8057, test_f1: 0.6095
 epoch: 36, train_loss: 0.7727, test_loss: 0.7463, test_f1: 0.6397
 epoch: 37, train_loss: 0.7753, test_loss: 0.8193, test_f1: 0.6329
 epoch: 38, train_loss: 0.7417, test_loss: 0.8910, test_f1: 0.6119
 epoch: 39, train_loss: 0.7716, test_loss: 0.8958, test_f1: 0.5981
 epoch: 40, train_loss: 0.7684, test_loss: 0.7909, test_f1: 0.6237
 epoch: 41, train_loss: 0.7585, test_loss: 0.9830, test_f1: 0.5098
 epoch: 42, train_loss: 0.7673, test_loss: 0.8779, test_f1: 0.5371
 epoch: 43, train_loss: 0.7417, test_loss: 0.8233, test_f1: 0.6042
 epoch: 44, train_loss: 0.7465, test_loss: 0.8305, test_f1: 0.6203
 epoch: 45, train_loss: 0.7662, test_loss: 0.8285, test_f1: 0.6113
 epoch: 46, train_loss: 0.7574, test_loss: 0.8830, test_f1: 0.5844
 epoch: 47, train_loss: 0.7294, test_loss: 0.8321, test_f1: 0.6482
 epoch: 48, train_loss: 0.7264, test_loss: 0.8363, test_f1: 0.6090
 epoch: 49, train_loss: 0.7327, test_loss: 0.8866, test_f1: 0.5781
 epoch: 50, train_loss: 0.7488, test_loss: 0.9184, test_f1: 0.5596
 epoch: 51, train_loss: 0.7171, test_loss: 0.8616, test_f1: 0.6191
 epoch: 52, train_loss: 0.6899, test_loss: 0.8728, test_f1: 0.6236
 epoch: 53, train_loss: 0.6864, test_loss: 0.7766, test_f1: 0.6227
 epoch: 54, train_loss: 0.6861, test_loss: 0.8617, test_f1: 0.6371
 epoch: 55, train_loss: 0.6776, test_loss: 0.8336, test_f1: 0.6384
 epoch: 56, train_loss: 0.6802, test_loss: 0.8640, test_f1: 0.6181
 epoch: 57, train_loss: 0.6717, test_loss: 0.8535, test_f1: 0.6438
 epoch: 58, train_loss: 0.6906, test_loss: 0.8491, test_f1: 0.6727
 epoch: 59, train_loss: 0.6688, test_loss: 0.8622, test_f1: 0.6209
 epoch: 60, train_loss: 0.6772, test_loss: 0.8354, test_f1: 0.6396
 epoch: 61, train_loss: 0.6858, test_loss: 0.7872, test_f1: 0.6084
 epoch: 62, train_loss: 0.6633, test_loss: 0.8484, test_f1: 0.6419
 epoch: 63, train_loss: 0.6597, test_loss: 0.9095, test_f1: 0.5961
 epoch: 64, train_loss: 0.6687, test_loss: 0.8828, test_f1: 0.5732
 epoch: 65, train_loss: 0.6618, test_loss: 0.8614, test_f1: 0.6370
 epoch: 66, train_loss: 0.6562, test_loss: 0.8195, test_f1: 0.6426
 epoch: 67, train_loss: 0.6525, test_loss: 0.8277, test_f1: 0.6542
 epoch: 68, train_loss: 0.6553, test_loss: 0.9602, test_f1: 0.5904
 epoch: 69, train_loss: 0.6599, test_loss: 0.9086, test_f1: 0.6414
 epoch: 70, train_loss: 0.6544, test_loss: 0.8724, test_f1: 0.6488
 epoch: 71, train_loss: 0.6403, test_loss: 0.7440, test_f1: 0.6609
 epoch: 72, train_loss: 0.6421, test_loss: 0.9078, test_f1: 0.6181
 epoch: 73, train_loss: 0.6326, test_loss: 0.8360, test_f1: 0.6402
 epoch: 74, train_loss: 0.6418, test_loss: 0.8942, test_f1: 0.6458
 epoch: 75, train_loss: 0.6509, test_loss: 0.8079, test_f1: 0.6461
 epoch: 76, train_loss: 0.6644, test_loss: 0.8683, test_f1: 0.6053
 epoch: 77, train_loss: 0.6327, test_loss: 0.9179, test_f1: 0.6324
 epoch: 78, train_loss: 0.6346, test_loss: 0.9486, test_f1: 0.6238
 epoch: 79, train_loss: 0.6385, test_loss: 0.9452, test_f1: 0.6127
 epoch: 80, train_loss: 0.6194, test_loss: 0.9525, test_f1: 0.6414
 epoch: 81, train_loss: 0.6317, test_loss: 0.9208, test_f1: 0.6341
 epoch: 82, train_loss: 0.6299, test_loss: 0.8587, test_f1: 0.6261
 epoch: 83, train_loss: 0.6276, test_loss: 0.9724, test_f1: 0.6178
 epoch: 84, train_loss: 0.6116, test_loss: 0.9708, test_f1: 0.6261
 epoch: 85, train_loss: 0.6197, test_loss: 0.9464, test_f1: 0.6320
 epoch: 86, train_loss: 0.6152, test_loss: 0.9573, test_f1: 0.6486
 epoch: 87, train_loss: 0.6340, test_loss: 0.9301, test_f1: 0.6527
 epoch: 88, train_loss: 0.6185, test_loss: 0.9286, test_f1: 0.6391
 epoch: 89, train_loss: 0.6323, test_loss: 0.8961, test_f1: 0.6518
 epoch: 90, train_loss: 0.6236, test_loss: 0.8033, test_f1: 0.6236
 epoch: 91, train_loss: 0.6299, test_loss: 0.9356, test_f1: 0.5825
 epoch: 92, train_loss: 0.6143, test_loss: 0.9514, test_f1: 0.6128
 epoch: 93, train_loss: 0.6377, test_loss: 0.8733, test_f1: 0.6335
 epoch: 94, train_loss: 0.6213, test_loss: 0.8945, test_f1: 0.6522
 epoch: 95, train_loss: 0.6038, test_loss: 0.9934, test_f1: 0.6446
 epoch: 96, train_loss: 0.6032, test_loss: 1.0175, test_f1: 0.6442
 epoch: 97, train_loss: 0.6155, test_loss: 0.8905, test_f1: 0.6103
 epoch: 98, train_loss: 0.6092, test_loss: 0.9411, test_f1: 0.6251
 epoch: 99, train_loss: 0.6012, test_loss: 1.1408, test_f1: 0.6236

Training completed in 1414.71 seconds
Best F1: 0.6842 at epoch 99
Mean F1 across iterations: 0.6536  0.0204
========================FINAL RESULTS================================
FEGIN weighted F1: 0.6842  0.0204
python main.py --data ltspice_examples --representation component_pin --model FEGIN --layers 6 --hiddens 32 --batch_size 32 --lr 0.01 --emb_size 512 --epochs 100 --save_appendix component_pin_L6_H32_BS32_LR0.01_E512 --no_val
-----



STDERR:
  File "main.py", line 370, in <module>
    main()
  File "main.py", line 254, in main
    dataset = dataset_class(
  File "/home/philip/projects/ltspice_examples_code_repo/Circuit-Completion-Using-GNNs/component_classification_with_link_prediction_head/evaluation/FEGIN/kernel/circuit_datasets.py", line 15, in __init__
    self.data, self.slices = torch.load(self.processed_paths[0])
  File "/home/philip/.local/lib/python3.8/site-packages/torch/serialization.py", line 1040, in load
    warnings.warn(
  File "/usr/lib/python3.8/warnings.py", line 109, in _showwarnmsg
    sw(msg.message, msg.category, msg.filename, msg.lineno,
  File "main.py", line 47, in warn_with_traceback
    traceback.print_stack(file=log)
/home/philip/projects/ltspice_examples_code_repo/Circuit-Completion-Using-GNNs/component_classification_with_link_prediction_head/evaluation/FEGIN/kernel/circuit_datasets.py:15: FutureWarning: You are using `torch.load` with `weights_only=False` (the current default value), which uses the default pickle module implicitly. It is possible to construct malicious pickle data which will execute arbitrary code during unpickling (See https://github.com/pytorch/pytorch/blob/main/SECURITY.md#untrusted-models for more details). In a future release, the default value for `weights_only` will be flipped to `True`. This limits the functions that could be executed during unpickling. Arbitrary objects will no longer be allowed to be loaded via this mode unless they are explicitly allowlisted by the user via `torch.serialization.add_safe_globals`. We recommend you start setting `weights_only=True` for any use case where you don't have full control of the loaded file. Please open an issue on GitHub for any issues related to this experimental feature.
  self.data, self.slices = torch.load(self.processed_paths[0])
