STDOUT:
Results will be saved in /home/philip/projects/ltspice_examples_code_repo/Circuit-Completion-Using-GNNs/component_classification_with_link_prediction_head/evaluation/FEGIN/results/model_FEGIN_dataset_ltspice_demos
Command line input: python main.py --data ltspice_demos --representation component_net --model FEGIN --layers 5 --hiddens 16 --batch_size 256 --lr 0.001 --emb_size 512 --epochs 100 --save_appendix component_net_L5_H16_BS256_LR0.001_E512 --no_val
 is saved.
-----
ltspice_demos - FEGIN
Using 5 layers, 16 hidden units, h = 2
Loading component_net representation dataset
ENTERED
Training FEGIN on component_net representation
Train: 1565, Test: 383
##################ITERATION #0 ****************************************
 epoch: 0, train_loss: 1.4551, test_loss: 1.4354, test_f1: 0.0507
 epoch: 1, train_loss: 1.4397, test_loss: 1.4300, test_f1: 0.0507
 epoch: 2, train_loss: 1.4298, test_loss: 1.4246, test_f1: 0.0507
 epoch: 3, train_loss: 1.4205, test_loss: 1.4190, test_f1: 0.0507
 epoch: 4, train_loss: 1.4085, test_loss: 1.4131, test_f1: 0.0507
 epoch: 5, train_loss: 1.3956, test_loss: 1.4050, test_f1: 0.0876
 epoch: 6, train_loss: 1.3829, test_loss: 1.3934, test_f1: 0.2021
 epoch: 7, train_loss: 1.3632, test_loss: 1.3782, test_f1: 0.2293
 epoch: 8, train_loss: 1.3453, test_loss: 1.3607, test_f1: 0.2660
 epoch: 9, train_loss: 1.3200, test_loss: 1.3414, test_f1: 0.3108
 epoch: 10, train_loss: 1.2965, test_loss: 1.3233, test_f1: 0.3080
 epoch: 11, train_loss: 1.2672, test_loss: 1.2986, test_f1: 0.3056
 epoch: 12, train_loss: 1.2513, test_loss: 1.2829, test_f1: 0.2927
 epoch: 13, train_loss: 1.2314, test_loss: 1.2754, test_f1: 0.3339
 epoch: 14, train_loss: 1.2162, test_loss: 1.2661, test_f1: 0.3440
 epoch: 15, train_loss: 1.2046, test_loss: 1.2542, test_f1: 0.3684
 epoch: 16, train_loss: 1.1906, test_loss: 1.2479, test_f1: 0.3615
 epoch: 17, train_loss: 1.1780, test_loss: 1.2347, test_f1: 0.3292
 epoch: 18, train_loss: 1.1882, test_loss: 1.2252, test_f1: 0.3402
 epoch: 19, train_loss: 1.1736, test_loss: 1.2203, test_f1: 0.3374
 epoch: 20, train_loss: 1.1583, test_loss: 1.2175, test_f1: 0.3542
 epoch: 21, train_loss: 1.1586, test_loss: 1.2124, test_f1: 0.3606
 epoch: 22, train_loss: 1.1467, test_loss: 1.2100, test_f1: 0.3641
 epoch: 23, train_loss: 1.1405, test_loss: 1.2078, test_f1: 0.3584
 epoch: 24, train_loss: 1.1326, test_loss: 1.1990, test_f1: 0.3549
 epoch: 25, train_loss: 1.1238, test_loss: 1.1986, test_f1: 0.3529
 epoch: 26, train_loss: 1.1320, test_loss: 1.2124, test_f1: 0.3525
 epoch: 27, train_loss: 1.1297, test_loss: 1.2011, test_f1: 0.3505
 epoch: 28, train_loss: 1.1138, test_loss: 1.1960, test_f1: 0.3588
 epoch: 29, train_loss: 1.1112, test_loss: 1.2012, test_f1: 0.3703
 epoch: 30, train_loss: 1.1117, test_loss: 1.1968, test_f1: 0.3600
 epoch: 31, train_loss: 1.1028, test_loss: 1.1748, test_f1: 0.3700
 epoch: 32, train_loss: 1.1020, test_loss: 1.1659, test_f1: 0.3950
 epoch: 33, train_loss: 1.1058, test_loss: 1.1652, test_f1: 0.4074
 epoch: 34, train_loss: 1.1103, test_loss: 1.1594, test_f1: 0.4036
 epoch: 35, train_loss: 1.0866, test_loss: 1.1638, test_f1: 0.4051
 epoch: 36, train_loss: 1.0761, test_loss: 1.1817, test_f1: 0.4006
 epoch: 37, train_loss: 1.0849, test_loss: 1.1864, test_f1: 0.3933
 epoch: 38, train_loss: 1.0797, test_loss: 1.1785, test_f1: 0.3977
 epoch: 39, train_loss: 1.0734, test_loss: 1.1791, test_f1: 0.3944
 epoch: 40, train_loss: 1.0744, test_loss: 1.1543, test_f1: 0.3981
 epoch: 41, train_loss: 1.0620, test_loss: 1.1532, test_f1: 0.3988
 epoch: 42, train_loss: 1.0646, test_loss: 1.1740, test_f1: 0.4081
 epoch: 43, train_loss: 1.0617, test_loss: 1.1698, test_f1: 0.3912
 epoch: 44, train_loss: 1.0613, test_loss: 1.1561, test_f1: 0.3846
 epoch: 45, train_loss: 1.0638, test_loss: 1.1578, test_f1: 0.3884
 epoch: 46, train_loss: 1.0677, test_loss: 1.1870, test_f1: 0.3763
 epoch: 47, train_loss: 1.0603, test_loss: 1.1516, test_f1: 0.3872
 epoch: 48, train_loss: 1.0580, test_loss: 1.1479, test_f1: 0.4049
 epoch: 49, train_loss: 1.0536, test_loss: 1.1539, test_f1: 0.4034
 epoch: 50, train_loss: 1.0564, test_loss: 1.1388, test_f1: 0.3970
 epoch: 51, train_loss: 1.0536, test_loss: 1.1282, test_f1: 0.3996
 epoch: 52, train_loss: 1.0555, test_loss: 1.1308, test_f1: 0.4131
 epoch: 53, train_loss: 1.0443, test_loss: 1.1362, test_f1: 0.4147
 epoch: 54, train_loss: 1.0448, test_loss: 1.1389, test_f1: 0.4018
 epoch: 55, train_loss: 1.0443, test_loss: 1.1343, test_f1: 0.3904
 epoch: 56, train_loss: 1.0432, test_loss: 1.1397, test_f1: 0.3944
 epoch: 57, train_loss: 1.0372, test_loss: 1.1383, test_f1: 0.4018
 epoch: 58, train_loss: 1.0423, test_loss: 1.1146, test_f1: 0.4080
 epoch: 59, train_loss: 1.0353, test_loss: 1.1122, test_f1: 0.4198
 epoch: 60, train_loss: 1.0332, test_loss: 1.1155, test_f1: 0.4119
 epoch: 61, train_loss: 1.0297, test_loss: 1.1175, test_f1: 0.4132
 epoch: 62, train_loss: 1.0213, test_loss: 1.1277, test_f1: 0.4032
 epoch: 63, train_loss: 1.0292, test_loss: 1.1511, test_f1: 0.4008
 epoch: 64, train_loss: 1.0365, test_loss: 1.1466, test_f1: 0.4148
 epoch: 65, train_loss: 1.0398, test_loss: 1.1338, test_f1: 0.4096
 epoch: 66, train_loss: 1.0270, test_loss: 1.1308, test_f1: 0.3940
 epoch: 67, train_loss: 1.0296, test_loss: 1.1293, test_f1: 0.3894
 epoch: 68, train_loss: 1.0146, test_loss: 1.1207, test_f1: 0.3953
 epoch: 69, train_loss: 1.0113, test_loss: 1.1139, test_f1: 0.4111
 epoch: 70, train_loss: 1.0196, test_loss: 1.1131, test_f1: 0.4262
 epoch: 71, train_loss: 1.0230, test_loss: 1.1249, test_f1: 0.4487
 epoch: 72, train_loss: 1.0164, test_loss: 1.1362, test_f1: 0.4637
 epoch: 73, train_loss: 1.0154, test_loss: 1.1363, test_f1: 0.4826
 epoch: 74, train_loss: 1.0184, test_loss: 1.1470, test_f1: 0.4845
 epoch: 75, train_loss: 1.0186, test_loss: 1.1341, test_f1: 0.4912
 epoch: 76, train_loss: 1.0125, test_loss: 1.1413, test_f1: 0.4888
 epoch: 77, train_loss: 1.0161, test_loss: 1.1429, test_f1: 0.4872
 epoch: 78, train_loss: 1.0210, test_loss: 1.1379, test_f1: 0.4910
 epoch: 79, train_loss: 1.0108, test_loss: 1.1460, test_f1: 0.4784
 epoch: 80, train_loss: 1.0133, test_loss: 1.1524, test_f1: 0.4899
 epoch: 81, train_loss: 1.0097, test_loss: 1.1663, test_f1: 0.4802
 epoch: 82, train_loss: 1.0121, test_loss: 1.1530, test_f1: 0.4975
 epoch: 83, train_loss: 1.0073, test_loss: 1.1431, test_f1: 0.4775
 epoch: 84, train_loss: 1.0100, test_loss: 1.1392, test_f1: 0.4931
 epoch: 85, train_loss: 1.0071, test_loss: 1.1467, test_f1: 0.4919
 epoch: 86, train_loss: 0.9979, test_loss: 1.1404, test_f1: 0.4879
 epoch: 87, train_loss: 1.0090, test_loss: 1.1492, test_f1: 0.5102
 epoch: 88, train_loss: 1.0118, test_loss: 1.1351, test_f1: 0.4995
 epoch: 89, train_loss: 1.0049, test_loss: 1.1223, test_f1: 0.4927
 epoch: 90, train_loss: 1.0049, test_loss: 1.1216, test_f1: 0.4777
 epoch: 91, train_loss: 0.9969, test_loss: 1.1257, test_f1: 0.4678
 epoch: 92, train_loss: 0.9991, test_loss: 1.1331, test_f1: 0.4736
 epoch: 93, train_loss: 1.0005, test_loss: 1.1352, test_f1: 0.4694
 epoch: 94, train_loss: 0.9928, test_loss: 1.1407, test_f1: 0.4952
 epoch: 95, train_loss: 0.9970, test_loss: 1.1297, test_f1: 0.4855
 epoch: 96, train_loss: 0.9946, test_loss: 1.1423, test_f1: 0.4847
 epoch: 97, train_loss: 0.9882, test_loss: 1.1518, test_f1: 0.4866
 epoch: 98, train_loss: 0.9873, test_loss: 1.1361, test_f1: 0.4844
 epoch: 99, train_loss: 0.9914, test_loss: 1.1435, test_f1: 0.4890
##################ITERATION #1 ****************************************
 epoch: 0, train_loss: 1.3565, test_loss: 1.3659, test_f1: 0.1365
 epoch: 1, train_loss: 1.3029, test_loss: 1.3498, test_f1: 0.1771
 epoch: 2, train_loss: 1.2799, test_loss: 1.3376, test_f1: 0.3232
 epoch: 3, train_loss: 1.2505, test_loss: 1.3258, test_f1: 0.2722
 epoch: 4, train_loss: 1.2296, test_loss: 1.3128, test_f1: 0.2722
 epoch: 5, train_loss: 1.2096, test_loss: 1.2988, test_f1: 0.2709
 epoch: 6, train_loss: 1.1913, test_loss: 1.2802, test_f1: 0.2504
 epoch: 7, train_loss: 1.1747, test_loss: 1.2666, test_f1: 0.2446
 epoch: 8, train_loss: 1.1687, test_loss: 1.2547, test_f1: 0.2562
 epoch: 9, train_loss: 1.1506, test_loss: 1.2385, test_f1: 0.2615
 epoch: 10, train_loss: 1.1520, test_loss: 1.2215, test_f1: 0.2297
 epoch: 11, train_loss: 1.1436, test_loss: 1.2124, test_f1: 0.2392
 epoch: 12, train_loss: 1.1315, test_loss: 1.2035, test_f1: 0.2487
 epoch: 13, train_loss: 1.1306, test_loss: 1.2007, test_f1: 0.2678
 epoch: 14, train_loss: 1.1124, test_loss: 1.1939, test_f1: 0.3323
 epoch: 15, train_loss: 1.1133, test_loss: 1.1848, test_f1: 0.3588
 epoch: 16, train_loss: 1.1111, test_loss: 1.1874, test_f1: 0.3748
 epoch: 17, train_loss: 1.1097, test_loss: 1.1852, test_f1: 0.3863
 epoch: 18, train_loss: 1.1059, test_loss: 1.1769, test_f1: 0.3890
 epoch: 19, train_loss: 1.0985, test_loss: 1.1800, test_f1: 0.3434
 epoch: 20, train_loss: 1.0916, test_loss: 1.1869, test_f1: 0.3996
 epoch: 21, train_loss: 1.0865, test_loss: 1.1935, test_f1: 0.3823
 epoch: 22, train_loss: 1.0893, test_loss: 1.1905, test_f1: 0.4092
 epoch: 23, train_loss: 1.0804, test_loss: 1.1867, test_f1: 0.3985
 epoch: 24, train_loss: 1.0884, test_loss: 1.1784, test_f1: 0.3885
 epoch: 25, train_loss: 1.0800, test_loss: 1.1733, test_f1: 0.3878
 epoch: 26, train_loss: 1.0733, test_loss: 1.1742, test_f1: 0.3912
 epoch: 27, train_loss: 1.0646, test_loss: 1.1877, test_f1: 0.4216
 epoch: 28, train_loss: 1.0651, test_loss: 1.1802, test_f1: 0.4298
 epoch: 29, train_loss: 1.0597, test_loss: 1.1810, test_f1: 0.4207
 epoch: 30, train_loss: 1.0638, test_loss: 1.1813, test_f1: 0.4243
 epoch: 31, train_loss: 1.0433, test_loss: 1.1626, test_f1: 0.4357
 epoch: 32, train_loss: 1.0573, test_loss: 1.1602, test_f1: 0.3918
 epoch: 33, train_loss: 1.0464, test_loss: 1.1639, test_f1: 0.3891
 epoch: 34, train_loss: 1.0504, test_loss: 1.1638, test_f1: 0.4047
 epoch: 35, train_loss: 1.0398, test_loss: 1.1676, test_f1: 0.4220
 epoch: 36, train_loss: 1.0391, test_loss: 1.1875, test_f1: 0.4323
 epoch: 37, train_loss: 1.0359, test_loss: 1.1736, test_f1: 0.4121
 epoch: 38, train_loss: 1.0300, test_loss: 1.1690, test_f1: 0.4165
 epoch: 39, train_loss: 1.0356, test_loss: 1.1596, test_f1: 0.4204
 epoch: 40, train_loss: 1.0327, test_loss: 1.1689, test_f1: 0.4765
 epoch: 41, train_loss: 1.0093, test_loss: 1.1800, test_f1: 0.4164
 epoch: 42, train_loss: 1.0144, test_loss: 1.1768, test_f1: 0.4307
 epoch: 43, train_loss: 1.0230, test_loss: 1.1709, test_f1: 0.4330
 epoch: 44, train_loss: 1.0109, test_loss: 1.1543, test_f1: 0.4205
 epoch: 45, train_loss: 0.9999, test_loss: 1.1563, test_f1: 0.4702
 epoch: 46, train_loss: 1.0160, test_loss: 1.1458, test_f1: 0.4538
 epoch: 47, train_loss: 1.0049, test_loss: 1.1478, test_f1: 0.4428
 epoch: 48, train_loss: 0.9886, test_loss: 1.1432, test_f1: 0.4244
 epoch: 49, train_loss: 0.9939, test_loss: 1.1782, test_f1: 0.4337
 epoch: 50, train_loss: 0.9881, test_loss: 1.1815, test_f1: 0.4348
 epoch: 51, train_loss: 0.9959, test_loss: 1.1498, test_f1: 0.4476
 epoch: 52, train_loss: 0.9993, test_loss: 1.1457, test_f1: 0.4460
 epoch: 53, train_loss: 0.9926, test_loss: 1.1291, test_f1: 0.4096
 epoch: 54, train_loss: 0.9858, test_loss: 1.1489, test_f1: 0.4311
 epoch: 55, train_loss: 0.9807, test_loss: 1.1580, test_f1: 0.4535
 epoch: 56, train_loss: 0.9769, test_loss: 1.1589, test_f1: 0.4544
 epoch: 57, train_loss: 0.9724, test_loss: 1.1703, test_f1: 0.4572
 epoch: 58, train_loss: 0.9717, test_loss: 1.1718, test_f1: 0.4841
 epoch: 59, train_loss: 0.9719, test_loss: 1.1796, test_f1: 0.4935
 epoch: 60, train_loss: 0.9658, test_loss: 1.1872, test_f1: 0.4731
 epoch: 61, train_loss: 0.9725, test_loss: 1.1829, test_f1: 0.4705
 epoch: 62, train_loss: 0.9756, test_loss: 1.1713, test_f1: 0.4711
 epoch: 63, train_loss: 0.9733, test_loss: 1.1586, test_f1: 0.4662
 epoch: 64, train_loss: 0.9716, test_loss: 1.1732, test_f1: 0.4673
 epoch: 65, train_loss: 0.9643, test_loss: 1.1671, test_f1: 0.4697
 epoch: 66, train_loss: 0.9595, test_loss: 1.1669, test_f1: 0.4626
 epoch: 67, train_loss: 0.9576, test_loss: 1.1699, test_f1: 0.4925
 epoch: 68, train_loss: 0.9612, test_loss: 1.1512, test_f1: 0.4768
 epoch: 69, train_loss: 0.9637, test_loss: 1.1609, test_f1: 0.4840
 epoch: 70, train_loss: 0.9616, test_loss: 1.1466, test_f1: 0.4602
 epoch: 71, train_loss: 0.9575, test_loss: 1.1477, test_f1: 0.4897
 epoch: 72, train_loss: 0.9466, test_loss: 1.1438, test_f1: 0.5198
 epoch: 73, train_loss: 0.9569, test_loss: 1.1709, test_f1: 0.5083
 epoch: 74, train_loss: 0.9470, test_loss: 1.1766, test_f1: 0.4967
 epoch: 75, train_loss: 0.9514, test_loss: 1.1752, test_f1: 0.5038
 epoch: 76, train_loss: 0.9600, test_loss: 1.1769, test_f1: 0.4984
 epoch: 77, train_loss: 0.9595, test_loss: 1.1878, test_f1: 0.4945
 epoch: 78, train_loss: 0.9562, test_loss: 1.2132, test_f1: 0.4866
 epoch: 79, train_loss: 0.9538, test_loss: 1.2025, test_f1: 0.4644
 epoch: 80, train_loss: 0.9452, test_loss: 1.1909, test_f1: 0.4995
 epoch: 81, train_loss: 0.9372, test_loss: 1.1918, test_f1: 0.4826
 epoch: 82, train_loss: 0.9583, test_loss: 1.1480, test_f1: 0.4776
 epoch: 83, train_loss: 0.9541, test_loss: 1.1614, test_f1: 0.4722
 epoch: 84, train_loss: 0.9549, test_loss: 1.1494, test_f1: 0.4904
 epoch: 85, train_loss: 0.9405, test_loss: 1.1633, test_f1: 0.4941
 epoch: 86, train_loss: 0.9378, test_loss: 1.1661, test_f1: 0.5058
 epoch: 87, train_loss: 0.9297, test_loss: 1.1499, test_f1: 0.5199
 epoch: 88, train_loss: 0.9344, test_loss: 1.1285, test_f1: 0.5100
 epoch: 89, train_loss: 0.9414, test_loss: 1.1269, test_f1: 0.5190
 epoch: 90, train_loss: 0.9455, test_loss: 1.1296, test_f1: 0.5080
 epoch: 91, train_loss: 0.9470, test_loss: 1.1602, test_f1: 0.5259
 epoch: 92, train_loss: 0.9343, test_loss: 1.1624, test_f1: 0.5150
 epoch: 93, train_loss: 0.9322, test_loss: 1.1724, test_f1: 0.5130
 epoch: 94, train_loss: 0.9285, test_loss: 1.2071, test_f1: 0.5114
 epoch: 95, train_loss: 0.9347, test_loss: 1.2243, test_f1: 0.4998
 epoch: 96, train_loss: 0.9260, test_loss: 1.2069, test_f1: 0.4920
 epoch: 97, train_loss: 0.9307, test_loss: 1.1894, test_f1: 0.5211
 epoch: 98, train_loss: 0.9182, test_loss: 1.1902, test_f1: 0.5107
 epoch: 99, train_loss: 0.9300, test_loss: 1.2048, test_f1: 0.5191
##################ITERATION #2 ****************************************
 epoch: 0, train_loss: 1.3185, test_loss: 1.3533, test_f1: 0.2281
 epoch: 1, train_loss: 1.2479, test_loss: 1.3415, test_f1: 0.2281
 epoch: 2, train_loss: 1.2203, test_loss: 1.3317, test_f1: 0.2281
 epoch: 3, train_loss: 1.2009, test_loss: 1.3169, test_f1: 0.2281
 epoch: 4, train_loss: 1.1906, test_loss: 1.3025, test_f1: 0.2281
 epoch: 5, train_loss: 1.1715, test_loss: 1.2924, test_f1: 0.2281
 epoch: 6, train_loss: 1.1552, test_loss: 1.2766, test_f1: 0.2281
 epoch: 7, train_loss: 1.1424, test_loss: 1.2634, test_f1: 0.2500
 epoch: 8, train_loss: 1.1372, test_loss: 1.2342, test_f1: 0.2682
 epoch: 9, train_loss: 1.1366, test_loss: 1.2102, test_f1: 0.3412
 epoch: 10, train_loss: 1.1175, test_loss: 1.2006, test_f1: 0.3682
 epoch: 11, train_loss: 1.1254, test_loss: 1.2024, test_f1: 0.3923
 epoch: 12, train_loss: 1.1106, test_loss: 1.2060, test_f1: 0.4007
 epoch: 13, train_loss: 1.1076, test_loss: 1.1944, test_f1: 0.4115
 epoch: 14, train_loss: 1.1088, test_loss: 1.2066, test_f1: 0.3922
 epoch: 15, train_loss: 1.0889, test_loss: 1.1889, test_f1: 0.4065
 epoch: 16, train_loss: 1.0834, test_loss: 1.1702, test_f1: 0.4186
 epoch: 17, train_loss: 1.0787, test_loss: 1.1679, test_f1: 0.4251
 epoch: 18, train_loss: 1.0863, test_loss: 1.1757, test_f1: 0.4151
 epoch: 19, train_loss: 1.0725, test_loss: 1.1815, test_f1: 0.4363
 epoch: 20, train_loss: 1.0756, test_loss: 1.1791, test_f1: 0.4291
 epoch: 21, train_loss: 1.0672, test_loss: 1.1762, test_f1: 0.4134
 epoch: 22, train_loss: 1.0570, test_loss: 1.1617, test_f1: 0.4180
 epoch: 23, train_loss: 1.0570, test_loss: 1.1764, test_f1: 0.4164
 epoch: 24, train_loss: 1.0526, test_loss: 1.1813, test_f1: 0.4209
 epoch: 25, train_loss: 1.0448, test_loss: 1.2314, test_f1: 0.4263
 epoch: 26, train_loss: 1.0562, test_loss: 1.1923, test_f1: 0.4401
 epoch: 27, train_loss: 1.0464, test_loss: 1.1899, test_f1: 0.4367
 epoch: 28, train_loss: 1.0444, test_loss: 1.2165, test_f1: 0.4389
 epoch: 29, train_loss: 1.0475, test_loss: 1.2278, test_f1: 0.4313
 epoch: 30, train_loss: 1.0344, test_loss: 1.2064, test_f1: 0.4156
 epoch: 31, train_loss: 1.0395, test_loss: 1.1810, test_f1: 0.4294
 epoch: 32, train_loss: 1.0360, test_loss: 1.1760, test_f1: 0.4256
 epoch: 33, train_loss: 1.0395, test_loss: 1.1926, test_f1: 0.4359
 epoch: 34, train_loss: 1.0139, test_loss: 1.2172, test_f1: 0.4345
 epoch: 35, train_loss: 1.0175, test_loss: 1.1954, test_f1: 0.4407
 epoch: 36, train_loss: 1.0267, test_loss: 1.1749, test_f1: 0.4429
 epoch: 37, train_loss: 1.0369, test_loss: 1.1913, test_f1: 0.4347
 epoch: 38, train_loss: 1.0181, test_loss: 1.1909, test_f1: 0.4240
 epoch: 39, train_loss: 1.0229, test_loss: 1.1991, test_f1: 0.4385
 epoch: 40, train_loss: 1.0132, test_loss: 1.1794, test_f1: 0.4174
 epoch: 41, train_loss: 1.0012, test_loss: 1.1682, test_f1: 0.4320
 epoch: 42, train_loss: 0.9978, test_loss: 1.1748, test_f1: 0.4485
 epoch: 43, train_loss: 1.0042, test_loss: 1.1870, test_f1: 0.4400
 epoch: 44, train_loss: 0.9993, test_loss: 1.2043, test_f1: 0.4348
 epoch: 45, train_loss: 1.0087, test_loss: 1.1571, test_f1: 0.4412
 epoch: 46, train_loss: 0.9960, test_loss: 1.1516, test_f1: 0.4275
 epoch: 47, train_loss: 1.0055, test_loss: 1.1960, test_f1: 0.4455
 epoch: 48, train_loss: 1.0078, test_loss: 1.1867, test_f1: 0.4341
 epoch: 49, train_loss: 0.9904, test_loss: 1.1907, test_f1: 0.4433
 epoch: 50, train_loss: 0.9818, test_loss: 1.1683, test_f1: 0.4452
 epoch: 51, train_loss: 0.9833, test_loss: 1.1630, test_f1: 0.4349
 epoch: 52, train_loss: 0.9823, test_loss: 1.1673, test_f1: 0.4385
 epoch: 53, train_loss: 0.9780, test_loss: 1.1701, test_f1: 0.4387
 epoch: 54, train_loss: 0.9705, test_loss: 1.1743, test_f1: 0.4517
 epoch: 55, train_loss: 0.9799, test_loss: 1.1965, test_f1: 0.4461
 epoch: 56, train_loss: 0.9817, test_loss: 1.1993, test_f1: 0.4482
 epoch: 57, train_loss: 0.9753, test_loss: 1.1768, test_f1: 0.4512
 epoch: 58, train_loss: 0.9824, test_loss: 1.1732, test_f1: 0.4323
 epoch: 59, train_loss: 0.9683, test_loss: 1.1819, test_f1: 0.4327
 epoch: 60, train_loss: 0.9654, test_loss: 1.1970, test_f1: 0.4365
 epoch: 61, train_loss: 0.9653, test_loss: 1.1798, test_f1: 0.4366
 epoch: 62, train_loss: 0.9558, test_loss: 1.1755, test_f1: 0.4373
 epoch: 63, train_loss: 0.9722, test_loss: 1.1870, test_f1: 0.4391
 epoch: 64, train_loss: 0.9673, test_loss: 1.1876, test_f1: 0.4512
 epoch: 65, train_loss: 0.9555, test_loss: 1.1847, test_f1: 0.4580
 epoch: 66, train_loss: 0.9596, test_loss: 1.1932, test_f1: 0.4440
 epoch: 67, train_loss: 0.9578, test_loss: 1.1932, test_f1: 0.4519
 epoch: 68, train_loss: 0.9490, test_loss: 1.1965, test_f1: 0.4552
 epoch: 69, train_loss: 0.9545, test_loss: 1.2137, test_f1: 0.4590
 epoch: 70, train_loss: 0.9474, test_loss: 1.1833, test_f1: 0.4395
 epoch: 71, train_loss: 0.9502, test_loss: 1.1659, test_f1: 0.4449
 epoch: 72, train_loss: 0.9524, test_loss: 1.1918, test_f1: 0.4526
 epoch: 73, train_loss: 0.9546, test_loss: 1.2015, test_f1: 0.4520
 epoch: 74, train_loss: 0.9519, test_loss: 1.1882, test_f1: 0.4529
 epoch: 75, train_loss: 0.9493, test_loss: 1.1887, test_f1: 0.4591
 epoch: 76, train_loss: 0.9404, test_loss: 1.1912, test_f1: 0.4633
 epoch: 77, train_loss: 0.9528, test_loss: 1.1749, test_f1: 0.4619
 epoch: 78, train_loss: 0.9455, test_loss: 1.1926, test_f1: 0.4534
 epoch: 79, train_loss: 0.9595, test_loss: 1.2267, test_f1: 0.4473
 epoch: 80, train_loss: 0.9462, test_loss: 1.2474, test_f1: 0.4477
 epoch: 81, train_loss: 0.9468, test_loss: 1.1988, test_f1: 0.4549
 epoch: 82, train_loss: 0.9534, test_loss: 1.1824, test_f1: 0.4603
 epoch: 83, train_loss: 0.9432, test_loss: 1.2024, test_f1: 0.4499
 epoch: 84, train_loss: 0.9484, test_loss: 1.1888, test_f1: 0.4539
 epoch: 85, train_loss: 0.9483, test_loss: 1.1845, test_f1: 0.4549
 epoch: 86, train_loss: 0.9436, test_loss: 1.1933, test_f1: 0.4521
 epoch: 87, train_loss: 0.9478, test_loss: 1.1888, test_f1: 0.4467
 epoch: 88, train_loss: 0.9360, test_loss: 1.1929, test_f1: 0.4511
 epoch: 89, train_loss: 0.9346, test_loss: 1.1867, test_f1: 0.4484
 epoch: 90, train_loss: 0.9301, test_loss: 1.1904, test_f1: 0.4454
 epoch: 91, train_loss: 0.9368, test_loss: 1.1717, test_f1: 0.4643
 epoch: 92, train_loss: 0.9347, test_loss: 1.1783, test_f1: 0.4602
 epoch: 93, train_loss: 0.9312, test_loss: 1.2041, test_f1: 0.4594
 epoch: 94, train_loss: 0.9323, test_loss: 1.2251, test_f1: 0.4521
 epoch: 95, train_loss: 0.9173, test_loss: 1.2143, test_f1: 0.4662
 epoch: 96, train_loss: 0.9268, test_loss: 1.1971, test_f1: 0.4602
 epoch: 97, train_loss: 0.9342, test_loss: 1.1954, test_f1: 0.4644
 epoch: 98, train_loss: 0.9311, test_loss: 1.2120, test_f1: 0.4521
 epoch: 99, train_loss: 0.9167, test_loss: 1.2214, test_f1: 0.4621
##################ITERATION #3 ****************************************
 epoch: 0, train_loss: 1.3145, test_loss: 1.3150, test_f1: 0.2281
 epoch: 1, train_loss: 1.2222, test_loss: 1.3011, test_f1: 0.2281
 epoch: 2, train_loss: 1.1935, test_loss: 1.2969, test_f1: 0.2281
 epoch: 3, train_loss: 1.1777, test_loss: 1.2924, test_f1: 0.2281
 epoch: 4, train_loss: 1.1541, test_loss: 1.2852, test_f1: 0.2281
 epoch: 5, train_loss: 1.1446, test_loss: 1.2753, test_f1: 0.2441
 epoch: 6, train_loss: 1.1280, test_loss: 1.2502, test_f1: 0.2526
 epoch: 7, train_loss: 1.1221, test_loss: 1.2214, test_f1: 0.2589
 epoch: 8, train_loss: 1.1169, test_loss: 1.1977, test_f1: 0.2610
 epoch: 9, train_loss: 1.1031, test_loss: 1.1895, test_f1: 0.3104
 epoch: 10, train_loss: 1.1144, test_loss: 1.1793, test_f1: 0.3407
 epoch: 11, train_loss: 1.0899, test_loss: 1.1692, test_f1: 0.3503
 epoch: 12, train_loss: 1.0872, test_loss: 1.1809, test_f1: 0.3717
 epoch: 13, train_loss: 1.0775, test_loss: 1.1960, test_f1: 0.4118
 epoch: 14, train_loss: 1.0698, test_loss: 1.1931, test_f1: 0.4184
 epoch: 15, train_loss: 1.0640, test_loss: 1.1966, test_f1: 0.3609
 epoch: 16, train_loss: 1.0629, test_loss: 1.1941, test_f1: 0.3896
 epoch: 17, train_loss: 1.0433, test_loss: 1.2296, test_f1: 0.4124
 epoch: 18, train_loss: 1.0395, test_loss: 1.2366, test_f1: 0.4140
 epoch: 19, train_loss: 1.0367, test_loss: 1.2312, test_f1: 0.4410
 epoch: 20, train_loss: 1.0364, test_loss: 1.2691, test_f1: 0.4360
 epoch: 21, train_loss: 1.0133, test_loss: 1.2961, test_f1: 0.4161
 epoch: 22, train_loss: 1.0181, test_loss: 1.2716, test_f1: 0.4136
 epoch: 23, train_loss: 1.0217, test_loss: 1.2312, test_f1: 0.4100
 epoch: 24, train_loss: 1.0205, test_loss: 1.1992, test_f1: 0.4173
 epoch: 25, train_loss: 1.0130, test_loss: 1.2017, test_f1: 0.4393
 epoch: 26, train_loss: 0.9979, test_loss: 1.1904, test_f1: 0.4238
 epoch: 27, train_loss: 1.0003, test_loss: 1.1552, test_f1: 0.4157
 epoch: 28, train_loss: 0.9955, test_loss: 1.1608, test_f1: 0.4307
 epoch: 29, train_loss: 0.9900, test_loss: 1.1055, test_f1: 0.4318
 epoch: 30, train_loss: 0.9842, test_loss: 1.0795, test_f1: 0.4159
 epoch: 31, train_loss: 0.9903, test_loss: 1.0691, test_f1: 0.4198
 epoch: 32, train_loss: 0.9807, test_loss: 1.1083, test_f1: 0.4129
 epoch: 33, train_loss: 0.9810, test_loss: 1.1046, test_f1: 0.4172
 epoch: 34, train_loss: 0.9740, test_loss: 1.0984, test_f1: 0.4099
 epoch: 35, train_loss: 0.9658, test_loss: 1.1052, test_f1: 0.4203
 epoch: 36, train_loss: 0.9703, test_loss: 1.0970, test_f1: 0.4331
 epoch: 37, train_loss: 0.9820, test_loss: 1.0749, test_f1: 0.4262
 epoch: 38, train_loss: 0.9742, test_loss: 1.0724, test_f1: 0.4297
 epoch: 39, train_loss: 0.9580, test_loss: 1.0805, test_f1: 0.4483
 epoch: 40, train_loss: 0.9685, test_loss: 1.1083, test_f1: 0.4359
 epoch: 41, train_loss: 0.9598, test_loss: 1.0825, test_f1: 0.4235
 epoch: 42, train_loss: 0.9406, test_loss: 1.0719, test_f1: 0.4399
 epoch: 43, train_loss: 0.9585, test_loss: 1.0696, test_f1: 0.4440
 epoch: 44, train_loss: 0.9408, test_loss: 1.0737, test_f1: 0.4461
 epoch: 45, train_loss: 0.9438, test_loss: 1.0679, test_f1: 0.4416
 epoch: 46, train_loss: 0.9399, test_loss: 1.0705, test_f1: 0.4467
 epoch: 47, train_loss: 0.9411, test_loss: 1.0790, test_f1: 0.4242
 epoch: 48, train_loss: 0.9466, test_loss: 1.0789, test_f1: 0.3515
 epoch: 49, train_loss: 0.9700, test_loss: 1.3152, test_f1: 0.3975
 epoch: 50, train_loss: 0.9552, test_loss: 1.1083, test_f1: 0.4241
 epoch: 51, train_loss: 0.9452, test_loss: 1.1477, test_f1: 0.4391
 epoch: 52, train_loss: 0.9251, test_loss: 1.0925, test_f1: 0.4513
 epoch: 53, train_loss: 0.9466, test_loss: 1.0794, test_f1: 0.4456
 epoch: 54, train_loss: 0.9296, test_loss: 1.0716, test_f1: 0.4414
 epoch: 55, train_loss: 0.9287, test_loss: 1.0723, test_f1: 0.4540
 epoch: 56, train_loss: 0.9253, test_loss: 1.0808, test_f1: 0.4416
 epoch: 57, train_loss: 0.9242, test_loss: 1.0942, test_f1: 0.4696
 epoch: 58, train_loss: 0.9229, test_loss: 1.0756, test_f1: 0.4767
 epoch: 59, train_loss: 0.9198, test_loss: 1.0619, test_f1: 0.4612
 epoch: 60, train_loss: 0.9323, test_loss: 1.0676, test_f1: 0.4619
 epoch: 61, train_loss: 0.9185, test_loss: 1.0778, test_f1: 0.4687
 epoch: 62, train_loss: 0.9277, test_loss: 1.1126, test_f1: 0.4655
 epoch: 63, train_loss: 0.9246, test_loss: 1.1151, test_f1: 0.4603
 epoch: 64, train_loss: 0.9192, test_loss: 1.1080, test_f1: 0.4660
 epoch: 65, train_loss: 0.9199, test_loss: 1.0703, test_f1: 0.4894
 epoch: 66, train_loss: 0.9266, test_loss: 1.0169, test_f1: 0.4693
 epoch: 67, train_loss: 0.9301, test_loss: 1.0277, test_f1: 0.4905
 epoch: 68, train_loss: 0.9156, test_loss: 1.0786, test_f1: 0.4969
 epoch: 69, train_loss: 0.9210, test_loss: 1.1004, test_f1: 0.4867
 epoch: 70, train_loss: 0.9308, test_loss: 1.0949, test_f1: 0.4963
 epoch: 71, train_loss: 0.9163, test_loss: 1.0921, test_f1: 0.4945
 epoch: 72, train_loss: 0.8994, test_loss: 1.1049, test_f1: 0.4801
 epoch: 73, train_loss: 0.8949, test_loss: 1.1032, test_f1: 0.4794
 epoch: 74, train_loss: 0.8988, test_loss: 1.0878, test_f1: 0.4804
 epoch: 75, train_loss: 0.8993, test_loss: 1.0712, test_f1: 0.4688
 epoch: 76, train_loss: 0.9068, test_loss: 1.1001, test_f1: 0.4907
 epoch: 77, train_loss: 0.9065, test_loss: 1.0876, test_f1: 0.4695
 epoch: 78, train_loss: 0.9034, test_loss: 1.0905, test_f1: 0.4818
 epoch: 79, train_loss: 0.9015, test_loss: 1.0848, test_f1: 0.4694
 epoch: 80, train_loss: 0.8966, test_loss: 1.0885, test_f1: 0.4723
 epoch: 81, train_loss: 0.8951, test_loss: 1.0941, test_f1: 0.4742
 epoch: 82, train_loss: 0.9060, test_loss: 1.0984, test_f1: 0.4882
 epoch: 83, train_loss: 0.9001, test_loss: 1.1373, test_f1: 0.4910
 epoch: 84, train_loss: 0.9118, test_loss: 1.1228, test_f1: 0.4818
 epoch: 85, train_loss: 0.8938, test_loss: 1.1077, test_f1: 0.4916
 epoch: 86, train_loss: 0.8944, test_loss: 1.0984, test_f1: 0.4943
 epoch: 87, train_loss: 0.8994, test_loss: 1.1053, test_f1: 0.5119
 epoch: 88, train_loss: 0.8996, test_loss: 1.0924, test_f1: 0.5077
 epoch: 89, train_loss: 0.8914, test_loss: 1.0966, test_f1: 0.4993
 epoch: 90, train_loss: 0.8904, test_loss: 1.0965, test_f1: 0.4969
 epoch: 91, train_loss: 0.8920, test_loss: 1.0923, test_f1: 0.4808
 epoch: 92, train_loss: 0.8928, test_loss: 1.0994, test_f1: 0.4920
 epoch: 93, train_loss: 0.8904, test_loss: 1.0791, test_f1: 0.5160
 epoch: 94, train_loss: 0.8870, test_loss: 1.0796, test_f1: 0.5279
 epoch: 95, train_loss: 0.8897, test_loss: 1.1013, test_f1: 0.4987
 epoch: 96, train_loss: 0.8872, test_loss: 1.0950, test_f1: 0.5006
 epoch: 97, train_loss: 0.8960, test_loss: 1.0939, test_f1: 0.4883
 epoch: 98, train_loss: 0.8931, test_loss: 1.0950, test_f1: 0.5143
 epoch: 99, train_loss: 0.8796, test_loss: 1.0980, test_f1: 0.5156
##################ITERATION #4 ****************************************
 epoch: 0, train_loss: 1.3016, test_loss: 1.3137, test_f1: 0.2281
 epoch: 1, train_loss: 1.2411, test_loss: 1.3066, test_f1: 0.2281
 epoch: 2, train_loss: 1.2243, test_loss: 1.2977, test_f1: 0.2281
 epoch: 3, train_loss: 1.2040, test_loss: 1.2892, test_f1: 0.2281
 epoch: 4, train_loss: 1.1842, test_loss: 1.2829, test_f1: 0.2281
 epoch: 5, train_loss: 1.1637, test_loss: 1.2751, test_f1: 0.2281
 epoch: 6, train_loss: 1.1476, test_loss: 1.2558, test_f1: 0.2390
 epoch: 7, train_loss: 1.1389, test_loss: 1.2361, test_f1: 0.2822
 epoch: 8, train_loss: 1.1259, test_loss: 1.2000, test_f1: 0.3272
 epoch: 9, train_loss: 1.1205, test_loss: 1.1867, test_f1: 0.3393
 epoch: 10, train_loss: 1.0939, test_loss: 1.1847, test_f1: 0.3475
 epoch: 11, train_loss: 1.1040, test_loss: 1.1734, test_f1: 0.3271
 epoch: 12, train_loss: 1.0920, test_loss: 1.1643, test_f1: 0.3510
 epoch: 13, train_loss: 1.0840, test_loss: 1.1635, test_f1: 0.3493
 epoch: 14, train_loss: 1.0985, test_loss: 1.1486, test_f1: 0.3598
 epoch: 15, train_loss: 1.0778, test_loss: 1.1365, test_f1: 0.3597
 epoch: 16, train_loss: 1.0738, test_loss: 1.1461, test_f1: 0.3590
 epoch: 17, train_loss: 1.0851, test_loss: 1.1413, test_f1: 0.3536
 epoch: 18, train_loss: 1.0660, test_loss: 1.1254, test_f1: 0.3639
 epoch: 19, train_loss: 1.0593, test_loss: 1.1175, test_f1: 0.3567
 epoch: 20, train_loss: 1.0461, test_loss: 1.1132, test_f1: 0.3546
 epoch: 21, train_loss: 1.0387, test_loss: 1.1156, test_f1: 0.3831
 epoch: 22, train_loss: 1.0505, test_loss: 1.1076, test_f1: 0.3737
 epoch: 23, train_loss: 1.0531, test_loss: 1.1029, test_f1: 0.4014
 epoch: 24, train_loss: 1.0416, test_loss: 1.1063, test_f1: 0.4206
 epoch: 25, train_loss: 1.0362, test_loss: 1.1034, test_f1: 0.3898
 epoch: 26, train_loss: 1.0319, test_loss: 1.0993, test_f1: 0.3985
 epoch: 27, train_loss: 1.0324, test_loss: 1.1063, test_f1: 0.4261
 epoch: 28, train_loss: 1.0444, test_loss: 1.0942, test_f1: 0.3892
 epoch: 29, train_loss: 1.0222, test_loss: 1.0829, test_f1: 0.4196
 epoch: 30, train_loss: 1.0337, test_loss: 1.0926, test_f1: 0.4259
 epoch: 31, train_loss: 1.0184, test_loss: 1.0927, test_f1: 0.4442
 epoch: 32, train_loss: 1.0129, test_loss: 1.0943, test_f1: 0.4306
 epoch: 33, train_loss: 1.0200, test_loss: 1.1136, test_f1: 0.4098
 epoch: 34, train_loss: 1.0073, test_loss: 1.1149, test_f1: 0.4099
 epoch: 35, train_loss: 0.9994, test_loss: 1.1285, test_f1: 0.4280
 epoch: 36, train_loss: 1.0082, test_loss: 1.1205, test_f1: 0.4326
 epoch: 37, train_loss: 1.0036, test_loss: 1.0710, test_f1: 0.4691
 epoch: 38, train_loss: 1.0168, test_loss: 1.0952, test_f1: 0.4212
 epoch: 39, train_loss: 0.9969, test_loss: 1.0833, test_f1: 0.4557
 epoch: 40, train_loss: 0.9858, test_loss: 1.1126, test_f1: 0.4601
 epoch: 41, train_loss: 1.0058, test_loss: 1.1381, test_f1: 0.4755
 epoch: 42, train_loss: 0.9882, test_loss: 1.1130, test_f1: 0.4192
 epoch: 43, train_loss: 0.9803, test_loss: 1.0870, test_f1: 0.4046
 epoch: 44, train_loss: 0.9901, test_loss: 1.0809, test_f1: 0.3904
 epoch: 45, train_loss: 0.9824, test_loss: 1.0819, test_f1: 0.4172
 epoch: 46, train_loss: 0.9827, test_loss: 1.1181, test_f1: 0.4451
 epoch: 47, train_loss: 0.9768, test_loss: 1.0792, test_f1: 0.4439
 epoch: 48, train_loss: 0.9752, test_loss: 1.0697, test_f1: 0.4605
 epoch: 49, train_loss: 0.9695, test_loss: 1.0677, test_f1: 0.4569
 epoch: 50, train_loss: 0.9719, test_loss: 1.0589, test_f1: 0.4373
 epoch: 51, train_loss: 0.9658, test_loss: 1.0977, test_f1: 0.4531
 epoch: 52, train_loss: 0.9723, test_loss: 1.0814, test_f1: 0.4757
 epoch: 53, train_loss: 0.9582, test_loss: 1.0834, test_f1: 0.4793
 epoch: 54, train_loss: 0.9578, test_loss: 1.0534, test_f1: 0.4802
 epoch: 55, train_loss: 0.9593, test_loss: 1.0471, test_f1: 0.4867
 epoch: 56, train_loss: 0.9532, test_loss: 1.0496, test_f1: 0.4902
 epoch: 57, train_loss: 0.9562, test_loss: 1.0538, test_f1: 0.4885
 epoch: 58, train_loss: 0.9509, test_loss: 1.0642, test_f1: 0.4656
 epoch: 59, train_loss: 0.9504, test_loss: 1.0806, test_f1: 0.4664
 epoch: 60, train_loss: 0.9465, test_loss: 1.0753, test_f1: 0.4773
 epoch: 61, train_loss: 0.9550, test_loss: 1.0608, test_f1: 0.4776
 epoch: 62, train_loss: 0.9471, test_loss: 1.0625, test_f1: 0.4580
 epoch: 63, train_loss: 0.9386, test_loss: 1.0492, test_f1: 0.4679
 epoch: 64, train_loss: 0.9393, test_loss: 1.0442, test_f1: 0.4805
 epoch: 65, train_loss: 0.9537, test_loss: 1.0460, test_f1: 0.4792
 epoch: 66, train_loss: 0.9440, test_loss: 1.0479, test_f1: 0.4680
 epoch: 67, train_loss: 0.9248, test_loss: 1.0467, test_f1: 0.4552
 epoch: 68, train_loss: 0.9542, test_loss: 1.0327, test_f1: 0.4711
 epoch: 69, train_loss: 0.9378, test_loss: 1.1164, test_f1: 0.5025
 epoch: 70, train_loss: 0.9343, test_loss: 1.0920, test_f1: 0.4769
 epoch: 71, train_loss: 0.9370, test_loss: 1.0830, test_f1: 0.4907
 epoch: 72, train_loss: 0.9372, test_loss: 1.0701, test_f1: 0.4984
 epoch: 73, train_loss: 0.9365, test_loss: 1.0465, test_f1: 0.5170
 epoch: 74, train_loss: 0.9456, test_loss: 1.0356, test_f1: 0.5149
 epoch: 75, train_loss: 0.9378, test_loss: 1.0366, test_f1: 0.5103
 epoch: 76, train_loss: 0.9246, test_loss: 1.0371, test_f1: 0.5022
 epoch: 77, train_loss: 0.9231, test_loss: 1.0432, test_f1: 0.5007
 epoch: 78, train_loss: 0.9228, test_loss: 1.0556, test_f1: 0.4857
 epoch: 79, train_loss: 0.9329, test_loss: 1.0631, test_f1: 0.4963
 epoch: 80, train_loss: 0.9365, test_loss: 1.0728, test_f1: 0.5049
 epoch: 81, train_loss: 0.9203, test_loss: 1.0759, test_f1: 0.5202
 epoch: 82, train_loss: 0.9196, test_loss: 1.0734, test_f1: 0.5187
 epoch: 83, train_loss: 0.9247, test_loss: 1.0656, test_f1: 0.5294
 epoch: 84, train_loss: 0.9183, test_loss: 1.0517, test_f1: 0.5199
 epoch: 85, train_loss: 0.9173, test_loss: 1.0444, test_f1: 0.5211
 epoch: 86, train_loss: 0.9168, test_loss: 1.0442, test_f1: 0.5404
 epoch: 87, train_loss: 0.9197, test_loss: 1.0483, test_f1: 0.5462
 epoch: 88, train_loss: 0.9229, test_loss: 1.0529, test_f1: 0.5476
 epoch: 89, train_loss: 0.9237, test_loss: 1.0634, test_f1: 0.5449
 epoch: 90, train_loss: 0.9191, test_loss: 1.0674, test_f1: 0.5420
 epoch: 91, train_loss: 0.9163, test_loss: 1.0782, test_f1: 0.5259
 epoch: 92, train_loss: 0.9070, test_loss: 1.1357, test_f1: 0.5112
 epoch: 93, train_loss: 0.9260, test_loss: 1.1299, test_f1: 0.5262
 epoch: 94, train_loss: 0.9391, test_loss: 1.1100, test_f1: 0.5204
 epoch: 95, train_loss: 0.9183, test_loss: 1.0466, test_f1: 0.5247
 epoch: 96, train_loss: 0.9165, test_loss: 1.0242, test_f1: 0.5017
 epoch: 97, train_loss: 0.9136, test_loss: 1.0298, test_f1: 0.4994
 epoch: 98, train_loss: 0.9209, test_loss: 1.0615, test_f1: 0.5042
 epoch: 99, train_loss: 0.9092, test_loss: 1.0687, test_f1: 0.5174
##################ITERATION #5 ****************************************
 epoch: 0, train_loss: 1.2746, test_loss: 1.3232, test_f1: 0.2281
 epoch: 1, train_loss: 1.2103, test_loss: 1.3156, test_f1: 0.2281
 epoch: 2, train_loss: 1.1820, test_loss: 1.3179, test_f1: 0.2281
 epoch: 3, train_loss: 1.1620, test_loss: 1.3212, test_f1: 0.2281
 epoch: 4, train_loss: 1.1562, test_loss: 1.3077, test_f1: 0.2646
 epoch: 5, train_loss: 1.1493, test_loss: 1.3024, test_f1: 0.3196
 epoch: 6, train_loss: 1.1381, test_loss: 1.2675, test_f1: 0.3068
 epoch: 7, train_loss: 1.1319, test_loss: 1.2245, test_f1: 0.3217
 epoch: 8, train_loss: 1.1141, test_loss: 1.1933, test_f1: 0.3668
 epoch: 9, train_loss: 1.1122, test_loss: 1.1749, test_f1: 0.3635
 epoch: 10, train_loss: 1.1059, test_loss: 1.1628, test_f1: 0.3867
 epoch: 11, train_loss: 1.1064, test_loss: 1.1557, test_f1: 0.4082
 epoch: 12, train_loss: 1.0988, test_loss: 1.1622, test_f1: 0.4086
 epoch: 13, train_loss: 1.0844, test_loss: 1.1572, test_f1: 0.4205
 epoch: 14, train_loss: 1.0887, test_loss: 1.1521, test_f1: 0.4196
 epoch: 15, train_loss: 1.0710, test_loss: 1.2222, test_f1: 0.3860
 epoch: 16, train_loss: 1.0678, test_loss: 1.1853, test_f1: 0.3858
 epoch: 17, train_loss: 1.0612, test_loss: 1.1493, test_f1: 0.4216
 epoch: 18, train_loss: 1.0742, test_loss: 1.1423, test_f1: 0.4278
 epoch: 19, train_loss: 1.0741, test_loss: 1.1458, test_f1: 0.4253
 epoch: 20, train_loss: 1.0609, test_loss: 1.1371, test_f1: 0.4362
 epoch: 21, train_loss: 1.0568, test_loss: 1.1419, test_f1: 0.4374
 epoch: 22, train_loss: 1.0516, test_loss: 1.1470, test_f1: 0.4383
 epoch: 23, train_loss: 1.0538, test_loss: 1.1497, test_f1: 0.4286
 epoch: 24, train_loss: 1.0423, test_loss: 1.1387, test_f1: 0.4275
 epoch: 25, train_loss: 1.0545, test_loss: 1.1637, test_f1: 0.4085
 epoch: 26, train_loss: 1.0579, test_loss: 1.1334, test_f1: 0.4402
 epoch: 27, train_loss: 1.0466, test_loss: 1.1408, test_f1: 0.4378
 epoch: 28, train_loss: 1.0478, test_loss: 1.1453, test_f1: 0.4217
 epoch: 29, train_loss: 1.0330, test_loss: 1.1334, test_f1: 0.4286
 epoch: 30, train_loss: 1.0398, test_loss: 1.1162, test_f1: 0.4327
 epoch: 31, train_loss: 1.0337, test_loss: 1.1141, test_f1: 0.4317
 epoch: 32, train_loss: 1.0205, test_loss: 1.1175, test_f1: 0.4350
 epoch: 33, train_loss: 1.0393, test_loss: 1.1053, test_f1: 0.4459
 epoch: 34, train_loss: 1.0279, test_loss: 1.1174, test_f1: 0.4309
 epoch: 35, train_loss: 1.0254, test_loss: 1.1006, test_f1: 0.4364
 epoch: 36, train_loss: 1.0171, test_loss: 1.1019, test_f1: 0.4408
 epoch: 37, train_loss: 1.0122, test_loss: 1.0859, test_f1: 0.4578
 epoch: 38, train_loss: 1.0178, test_loss: 1.1192, test_f1: 0.4358
 epoch: 39, train_loss: 1.0285, test_loss: 1.0900, test_f1: 0.4485
 epoch: 40, train_loss: 1.0108, test_loss: 1.1009, test_f1: 0.4454
 epoch: 41, train_loss: 1.0116, test_loss: 1.1032, test_f1: 0.4260
 epoch: 42, train_loss: 1.0092, test_loss: 1.1223, test_f1: 0.4468
 epoch: 43, train_loss: 1.0097, test_loss: 1.1254, test_f1: 0.4431
 epoch: 44, train_loss: 0.9994, test_loss: 1.0993, test_f1: 0.4480
 epoch: 45, train_loss: 0.9947, test_loss: 1.0948, test_f1: 0.4739
 epoch: 46, train_loss: 1.0072, test_loss: 1.1145, test_f1: 0.4697
 epoch: 47, train_loss: 0.9932, test_loss: 1.1319, test_f1: 0.4634
 epoch: 48, train_loss: 0.9992, test_loss: 1.1192, test_f1: 0.4516
 epoch: 49, train_loss: 0.9858, test_loss: 1.1255, test_f1: 0.4495
 epoch: 50, train_loss: 0.9870, test_loss: 1.1145, test_f1: 0.4511
 epoch: 51, train_loss: 0.9806, test_loss: 1.1041, test_f1: 0.4378
 epoch: 52, train_loss: 0.9826, test_loss: 1.0834, test_f1: 0.4569
 epoch: 53, train_loss: 0.9790, test_loss: 1.0922, test_f1: 0.4582
 epoch: 54, train_loss: 0.9689, test_loss: 1.0962, test_f1: 0.4570
 epoch: 55, train_loss: 0.9653, test_loss: 1.1186, test_f1: 0.4624
 epoch: 56, train_loss: 0.9787, test_loss: 1.1093, test_f1: 0.4630
 epoch: 57, train_loss: 0.9749, test_loss: 1.0989, test_f1: 0.4743
 epoch: 58, train_loss: 0.9617, test_loss: 1.0989, test_f1: 0.4893
 epoch: 59, train_loss: 0.9684, test_loss: 1.0910, test_f1: 0.4820
 epoch: 60, train_loss: 0.9747, test_loss: 1.0854, test_f1: 0.4901
 epoch: 61, train_loss: 0.9767, test_loss: 1.0870, test_f1: 0.5007
 epoch: 62, train_loss: 0.9661, test_loss: 1.1018, test_f1: 0.5008
 epoch: 63, train_loss: 0.9593, test_loss: 1.1134, test_f1: 0.4883
 epoch: 64, train_loss: 0.9623, test_loss: 1.1240, test_f1: 0.4968
 epoch: 65, train_loss: 0.9529, test_loss: 1.1003, test_f1: 0.4689
 epoch: 66, train_loss: 0.9551, test_loss: 1.0968, test_f1: 0.4846
 epoch: 67, train_loss: 0.9655, test_loss: 1.1061, test_f1: 0.4928
 epoch: 68, train_loss: 0.9610, test_loss: 1.1139, test_f1: 0.4886
 epoch: 69, train_loss: 0.9553, test_loss: 1.1045, test_f1: 0.4541
 epoch: 70, train_loss: 0.9693, test_loss: 1.1017, test_f1: 0.4681
 epoch: 71, train_loss: 0.9561, test_loss: 1.1143, test_f1: 0.4887
 epoch: 72, train_loss: 0.9597, test_loss: 1.1024, test_f1: 0.4824
 epoch: 73, train_loss: 0.9529, test_loss: 1.0840, test_f1: 0.5062
 epoch: 74, train_loss: 0.9488, test_loss: 1.0736, test_f1: 0.5003
 epoch: 75, train_loss: 0.9554, test_loss: 1.0863, test_f1: 0.4818
 epoch: 76, train_loss: 0.9455, test_loss: 1.0927, test_f1: 0.5090
 epoch: 77, train_loss: 0.9488, test_loss: 1.0807, test_f1: 0.5000
 epoch: 78, train_loss: 0.9440, test_loss: 1.0709, test_f1: 0.5011
 epoch: 79, train_loss: 0.9528, test_loss: 1.0882, test_f1: 0.4943
 epoch: 80, train_loss: 0.9576, test_loss: 1.1247, test_f1: 0.5074
 epoch: 81, train_loss: 0.9363, test_loss: 1.1195, test_f1: 0.5112
 epoch: 82, train_loss: 0.9381, test_loss: 1.1034, test_f1: 0.4953
 epoch: 83, train_loss: 0.9405, test_loss: 1.1068, test_f1: 0.4953
 epoch: 84, train_loss: 0.9296, test_loss: 1.0963, test_f1: 0.5072
 epoch: 85, train_loss: 0.9307, test_loss: 1.0894, test_f1: 0.5233
 epoch: 86, train_loss: 0.9377, test_loss: 1.0910, test_f1: 0.5070
 epoch: 87, train_loss: 0.9264, test_loss: 1.0847, test_f1: 0.5126
 epoch: 88, train_loss: 0.9270, test_loss: 1.0774, test_f1: 0.5119
 epoch: 89, train_loss: 0.9300, test_loss: 1.0794, test_f1: 0.5118
 epoch: 90, train_loss: 0.9213, test_loss: 1.0903, test_f1: 0.5044
 epoch: 91, train_loss: 0.9260, test_loss: 1.1208, test_f1: 0.5095
 epoch: 92, train_loss: 0.9287, test_loss: 1.1211, test_f1: 0.5277
 epoch: 93, train_loss: 0.9363, test_loss: 1.1155, test_f1: 0.5093
 epoch: 94, train_loss: 0.9219, test_loss: 1.1143, test_f1: 0.4883
 epoch: 95, train_loss: 0.9274, test_loss: 1.1006, test_f1: 0.5008
 epoch: 96, train_loss: 0.9307, test_loss: 1.0935, test_f1: 0.5072
 epoch: 97, train_loss: 0.9260, test_loss: 1.0831, test_f1: 0.4975
 epoch: 98, train_loss: 0.9284, test_loss: 1.0955, test_f1: 0.5234
 epoch: 99, train_loss: 0.9285, test_loss: 1.0981, test_f1: 0.5130
##################ITERATION #6 ****************************************
 epoch: 0, train_loss: 1.2721, test_loss: 1.2997, test_f1: 0.2281
 epoch: 1, train_loss: 1.1982, test_loss: 1.2988, test_f1: 0.2281
 epoch: 2, train_loss: 1.1690, test_loss: 1.3071, test_f1: 0.2281
 epoch: 3, train_loss: 1.1632, test_loss: 1.3325, test_f1: 0.2698
 epoch: 4, train_loss: 1.1527, test_loss: 1.3354, test_f1: 0.2686
 epoch: 5, train_loss: 1.1361, test_loss: 1.3083, test_f1: 0.2640
 epoch: 6, train_loss: 1.1308, test_loss: 1.2608, test_f1: 0.2980
 epoch: 7, train_loss: 1.1219, test_loss: 1.2083, test_f1: 0.3392
 epoch: 8, train_loss: 1.1090, test_loss: 1.1805, test_f1: 0.3585
 epoch: 9, train_loss: 1.1035, test_loss: 1.1712, test_f1: 0.3931
 epoch: 10, train_loss: 1.0930, test_loss: 1.1873, test_f1: 0.4275
 epoch: 11, train_loss: 1.0890, test_loss: 1.1757, test_f1: 0.4176
 epoch: 12, train_loss: 1.0768, test_loss: 1.1621, test_f1: 0.4396
 epoch: 13, train_loss: 1.0794, test_loss: 1.1720, test_f1: 0.4412
 epoch: 14, train_loss: 1.0579, test_loss: 1.1881, test_f1: 0.4204
 epoch: 15, train_loss: 1.0525, test_loss: 1.1569, test_f1: 0.4386
 epoch: 16, train_loss: 1.0460, test_loss: 1.1352, test_f1: 0.4411
 epoch: 17, train_loss: 1.0507, test_loss: 1.1386, test_f1: 0.4590
 epoch: 18, train_loss: 1.0387, test_loss: 1.1414, test_f1: 0.4568
 epoch: 19, train_loss: 1.0318, test_loss: 1.1400, test_f1: 0.4612
 epoch: 20, train_loss: 1.0235, test_loss: 1.1462, test_f1: 0.4465
 epoch: 21, train_loss: 1.0378, test_loss: 1.1440, test_f1: 0.4418
 epoch: 22, train_loss: 1.0091, test_loss: 1.1495, test_f1: 0.4565
 epoch: 23, train_loss: 1.0076, test_loss: 1.1376, test_f1: 0.4521
 epoch: 24, train_loss: 1.0066, test_loss: 1.1264, test_f1: 0.4413
 epoch: 25, train_loss: 1.0061, test_loss: 1.1243, test_f1: 0.4329
 epoch: 26, train_loss: 1.0020, test_loss: 1.1268, test_f1: 0.4249
 epoch: 27, train_loss: 1.0036, test_loss: 1.1473, test_f1: 0.4284
 epoch: 28, train_loss: 0.9904, test_loss: 1.1631, test_f1: 0.4381
 epoch: 29, train_loss: 0.9943, test_loss: 1.1582, test_f1: 0.4543
 epoch: 30, train_loss: 0.9921, test_loss: 1.1818, test_f1: 0.4635
 epoch: 31, train_loss: 0.9816, test_loss: 1.2318, test_f1: 0.4595
 epoch: 32, train_loss: 0.9936, test_loss: 1.2572, test_f1: 0.4549
 epoch: 33, train_loss: 0.9898, test_loss: 1.2185, test_f1: 0.4651
 epoch: 34, train_loss: 0.9810, test_loss: 1.1738, test_f1: 0.4623
 epoch: 35, train_loss: 0.9725, test_loss: 1.1334, test_f1: 0.4277
 epoch: 36, train_loss: 0.9676, test_loss: 1.1389, test_f1: 0.4048
 epoch: 37, train_loss: 0.9933, test_loss: 1.1523, test_f1: 0.4261
 epoch: 38, train_loss: 0.9899, test_loss: 1.1563, test_f1: 0.3740
 epoch: 39, train_loss: 1.0056, test_loss: 1.2121, test_f1: 0.3755
 epoch: 40, train_loss: 1.0110, test_loss: 1.1694, test_f1: 0.3777
 epoch: 41, train_loss: 1.0005, test_loss: 1.1575, test_f1: 0.3867
 epoch: 42, train_loss: 0.9897, test_loss: 1.1717, test_f1: 0.4293
 epoch: 43, train_loss: 0.9797, test_loss: 1.1767, test_f1: 0.4500
 epoch: 44, train_loss: 0.9743, test_loss: 1.2217, test_f1: 0.4585
 epoch: 45, train_loss: 0.9623, test_loss: 1.1980, test_f1: 0.4453
 epoch: 46, train_loss: 0.9690, test_loss: 1.1680, test_f1: 0.4484
 epoch: 47, train_loss: 0.9664, test_loss: 1.2287, test_f1: 0.4479
 epoch: 48, train_loss: 0.9508, test_loss: 1.2124, test_f1: 0.4526
 epoch: 49, train_loss: 0.9570, test_loss: 1.1969, test_f1: 0.4565
 epoch: 50, train_loss: 0.9291, test_loss: 1.1913, test_f1: 0.4657
 epoch: 51, train_loss: 0.9532, test_loss: 1.1822, test_f1: 0.4601
 epoch: 52, train_loss: 0.9390, test_loss: 1.1857, test_f1: 0.4718
 epoch: 53, train_loss: 0.9404, test_loss: 1.1708, test_f1: 0.4500
 epoch: 54, train_loss: 0.9340, test_loss: 1.1719, test_f1: 0.4601
 epoch: 55, train_loss: 0.9291, test_loss: 1.1564, test_f1: 0.4630
 epoch: 56, train_loss: 0.9220, test_loss: 1.1563, test_f1: 0.4782
 epoch: 57, train_loss: 0.9196, test_loss: 1.1611, test_f1: 0.4742
 epoch: 58, train_loss: 0.9271, test_loss: 1.1528, test_f1: 0.4693
 epoch: 59, train_loss: 0.9248, test_loss: 1.1462, test_f1: 0.4641
 epoch: 60, train_loss: 0.9227, test_loss: 1.1454, test_f1: 0.4677
 epoch: 61, train_loss: 0.9459, test_loss: 1.1350, test_f1: 0.4911
 epoch: 62, train_loss: 0.9249, test_loss: 1.1391, test_f1: 0.4813
 epoch: 63, train_loss: 0.9242, test_loss: 1.1636, test_f1: 0.4769
 epoch: 64, train_loss: 0.9276, test_loss: 1.1342, test_f1: 0.4844
 epoch: 65, train_loss: 0.9307, test_loss: 1.1764, test_f1: 0.4801
 epoch: 66, train_loss: 0.9268, test_loss: 1.1917, test_f1: 0.4732
 epoch: 67, train_loss: 0.9196, test_loss: 1.1913, test_f1: 0.4734
 epoch: 68, train_loss: 0.9270, test_loss: 1.1859, test_f1: 0.4735
 epoch: 69, train_loss: 0.9199, test_loss: 1.1621, test_f1: 0.4793
 epoch: 70, train_loss: 0.9210, test_loss: 1.1619, test_f1: 0.4890
 epoch: 71, train_loss: 0.9131, test_loss: 1.1377, test_f1: 0.4740
 epoch: 72, train_loss: 0.9053, test_loss: 1.1512, test_f1: 0.4730
 epoch: 73, train_loss: 0.9062, test_loss: 1.1756, test_f1: 0.4695
 epoch: 74, train_loss: 0.9070, test_loss: 1.1636, test_f1: 0.4749
 epoch: 75, train_loss: 0.9049, test_loss: 1.1640, test_f1: 0.4860
 epoch: 76, train_loss: 0.9046, test_loss: 1.1281, test_f1: 0.4964
 epoch: 77, train_loss: 0.9159, test_loss: 1.1569, test_f1: 0.4828
 epoch: 78, train_loss: 0.9044, test_loss: 1.1543, test_f1: 0.5066
 epoch: 79, train_loss: 0.8996, test_loss: 1.1583, test_f1: 0.5090
 epoch: 80, train_loss: 0.9063, test_loss: 1.1741, test_f1: 0.4893
 epoch: 81, train_loss: 0.9085, test_loss: 1.1734, test_f1: 0.5004
 epoch: 82, train_loss: 0.9060, test_loss: 1.1492, test_f1: 0.4716
 epoch: 83, train_loss: 0.9069, test_loss: 1.1520, test_f1: 0.4590
 epoch: 84, train_loss: 0.9063, test_loss: 1.1835, test_f1: 0.4895
 epoch: 85, train_loss: 0.9032, test_loss: 1.2074, test_f1: 0.5013
 epoch: 86, train_loss: 0.9087, test_loss: 1.1967, test_f1: 0.4662
 epoch: 87, train_loss: 0.9100, test_loss: 1.1650, test_f1: 0.4582
 epoch: 88, train_loss: 0.9069, test_loss: 1.1384, test_f1: 0.4991
 epoch: 89, train_loss: 0.9059, test_loss: 1.1447, test_f1: 0.4846
 epoch: 90, train_loss: 0.9087, test_loss: 1.1426, test_f1: 0.5119
 epoch: 91, train_loss: 0.8969, test_loss: 1.1392, test_f1: 0.4719
 epoch: 92, train_loss: 0.9236, test_loss: 1.1487, test_f1: 0.4970
 epoch: 93, train_loss: 0.9188, test_loss: 1.1670, test_f1: 0.4917
 epoch: 94, train_loss: 0.9038, test_loss: 1.1538, test_f1: 0.5019
 epoch: 95, train_loss: 0.8975, test_loss: 1.1643, test_f1: 0.5065
 epoch: 96, train_loss: 0.8947, test_loss: 1.1921, test_f1: 0.4942
 epoch: 97, train_loss: 0.9123, test_loss: 1.2506, test_f1: 0.4914
 epoch: 98, train_loss: 0.9041, test_loss: 1.2458, test_f1: 0.4889
 epoch: 99, train_loss: 0.8980, test_loss: 1.2173, test_f1: 0.4909
##################ITERATION #7 ****************************************
 epoch: 0, train_loss: 1.2963, test_loss: 1.3365, test_f1: 0.2281
 epoch: 1, train_loss: 1.1876, test_loss: 1.3160, test_f1: 0.2281
 epoch: 2, train_loss: 1.1572, test_loss: 1.2723, test_f1: 0.2281
 epoch: 3, train_loss: 1.1333, test_loss: 1.2531, test_f1: 0.2281
 epoch: 4, train_loss: 1.1184, test_loss: 1.2434, test_f1: 0.2857
 epoch: 5, train_loss: 1.1132, test_loss: 1.2510, test_f1: 0.2876
 epoch: 6, train_loss: 1.1019, test_loss: 1.2765, test_f1: 0.2766
 epoch: 7, train_loss: 1.0982, test_loss: 1.2437, test_f1: 0.2998
 epoch: 8, train_loss: 1.0793, test_loss: 1.2196, test_f1: 0.3186
 epoch: 9, train_loss: 1.0705, test_loss: 1.1768, test_f1: 0.3666
 epoch: 10, train_loss: 1.0769, test_loss: 1.1332, test_f1: 0.3733
 epoch: 11, train_loss: 1.0551, test_loss: 1.1279, test_f1: 0.3641
 epoch: 12, train_loss: 1.0569, test_loss: 1.1246, test_f1: 0.3694
 epoch: 13, train_loss: 1.0643, test_loss: 1.1088, test_f1: 0.3457
 epoch: 14, train_loss: 1.0558, test_loss: 1.1064, test_f1: 0.3389
 epoch: 15, train_loss: 1.0408, test_loss: 1.0948, test_f1: 0.3918
 epoch: 16, train_loss: 1.0305, test_loss: 1.0898, test_f1: 0.4271
 epoch: 17, train_loss: 1.0339, test_loss: 1.0896, test_f1: 0.4283
 epoch: 18, train_loss: 1.0218, test_loss: 1.0889, test_f1: 0.4607
 epoch: 19, train_loss: 1.0218, test_loss: 1.0766, test_f1: 0.4648
 epoch: 20, train_loss: 1.0301, test_loss: 1.0814, test_f1: 0.3904
 epoch: 21, train_loss: 1.0128, test_loss: 1.0630, test_f1: 0.3781
 epoch: 22, train_loss: 1.0132, test_loss: 1.0834, test_f1: 0.4248
 epoch: 23, train_loss: 0.9944, test_loss: 1.0776, test_f1: 0.4499
 epoch: 24, train_loss: 0.9957, test_loss: 1.0909, test_f1: 0.4368
 epoch: 25, train_loss: 0.9985, test_loss: 1.0897, test_f1: 0.4508
 epoch: 26, train_loss: 0.9834, test_loss: 1.0730, test_f1: 0.4342
 epoch: 27, train_loss: 0.9944, test_loss: 1.0532, test_f1: 0.4228
 epoch: 28, train_loss: 0.9881, test_loss: 1.1172, test_f1: 0.4260
 epoch: 29, train_loss: 0.9788, test_loss: 1.1196, test_f1: 0.4678
 epoch: 30, train_loss: 0.9918, test_loss: 1.1101, test_f1: 0.4605
 epoch: 31, train_loss: 0.9745, test_loss: 1.1025, test_f1: 0.4526
 epoch: 32, train_loss: 0.9586, test_loss: 1.0918, test_f1: 0.4272
 epoch: 33, train_loss: 0.9656, test_loss: 1.0729, test_f1: 0.4503
 epoch: 34, train_loss: 0.9592, test_loss: 1.0590, test_f1: 0.4625
 epoch: 35, train_loss: 0.9530, test_loss: 1.0846, test_f1: 0.4832
 epoch: 36, train_loss: 0.9594, test_loss: 1.0772, test_f1: 0.4715
 epoch: 37, train_loss: 0.9549, test_loss: 1.0777, test_f1: 0.4430
 epoch: 38, train_loss: 0.9733, test_loss: 1.1022, test_f1: 0.4764
 epoch: 39, train_loss: 0.9589, test_loss: 1.1214, test_f1: 0.4329
 epoch: 40, train_loss: 0.9416, test_loss: 1.1132, test_f1: 0.4117
 epoch: 41, train_loss: 0.9429, test_loss: 1.1414, test_f1: 0.4328
 epoch: 42, train_loss: 0.9360, test_loss: 1.1533, test_f1: 0.4781
 epoch: 43, train_loss: 0.9447, test_loss: 1.0866, test_f1: 0.4433
 epoch: 44, train_loss: 0.9365, test_loss: 1.0651, test_f1: 0.4485
 epoch: 45, train_loss: 0.9398, test_loss: 1.0465, test_f1: 0.4929
 epoch: 46, train_loss: 0.9313, test_loss: 1.0501, test_f1: 0.5142
 epoch: 47, train_loss: 0.9189, test_loss: 1.0650, test_f1: 0.4931
 epoch: 48, train_loss: 0.9190, test_loss: 1.0773, test_f1: 0.4981
 epoch: 49, train_loss: 0.9208, test_loss: 1.0997, test_f1: 0.4865
 epoch: 50, train_loss: 0.9092, test_loss: 1.0830, test_f1: 0.4597
 epoch: 51, train_loss: 0.9195, test_loss: 1.0947, test_f1: 0.4538
 epoch: 52, train_loss: 0.9097, test_loss: 1.1108, test_f1: 0.4839
 epoch: 53, train_loss: 0.9033, test_loss: 1.1177, test_f1: 0.4844
 epoch: 54, train_loss: 0.9136, test_loss: 1.1116, test_f1: 0.4981
 epoch: 55, train_loss: 0.9215, test_loss: 1.1172, test_f1: 0.4937
 epoch: 56, train_loss: 0.8922, test_loss: 1.1023, test_f1: 0.5219
 epoch: 57, train_loss: 0.8994, test_loss: 1.0942, test_f1: 0.5131
 epoch: 58, train_loss: 0.9078, test_loss: 1.0936, test_f1: 0.5107
 epoch: 59, train_loss: 0.8948, test_loss: 1.0922, test_f1: 0.5023
 epoch: 60, train_loss: 0.8909, test_loss: 1.0958, test_f1: 0.4952
 epoch: 61, train_loss: 0.9027, test_loss: 1.1109, test_f1: 0.5030
 epoch: 62, train_loss: 0.8933, test_loss: 1.1130, test_f1: 0.5084
 epoch: 63, train_loss: 0.8958, test_loss: 1.0854, test_f1: 0.5136
 epoch: 64, train_loss: 0.8892, test_loss: 1.0979, test_f1: 0.5106
 epoch: 65, train_loss: 0.8900, test_loss: 1.0981, test_f1: 0.5193
 epoch: 66, train_loss: 0.8996, test_loss: 1.0741, test_f1: 0.5350
 epoch: 67, train_loss: 0.8932, test_loss: 1.0831, test_f1: 0.5121
 epoch: 68, train_loss: 0.9020, test_loss: 1.0811, test_f1: 0.5036
 epoch: 69, train_loss: 0.8924, test_loss: 1.1121, test_f1: 0.5020
 epoch: 70, train_loss: 0.8913, test_loss: 1.0959, test_f1: 0.5027
 epoch: 71, train_loss: 0.8887, test_loss: 1.0791, test_f1: 0.4854
 epoch: 72, train_loss: 0.8896, test_loss: 1.0779, test_f1: 0.4945
 epoch: 73, train_loss: 0.8769, test_loss: 1.0855, test_f1: 0.4938
 epoch: 74, train_loss: 0.8895, test_loss: 1.0961, test_f1: 0.5016
 epoch: 75, train_loss: 0.8822, test_loss: 1.0951, test_f1: 0.5028
 epoch: 76, train_loss: 0.8887, test_loss: 1.0860, test_f1: 0.5087
 epoch: 77, train_loss: 0.8873, test_loss: 1.1112, test_f1: 0.5144
 epoch: 78, train_loss: 0.8823, test_loss: 1.0995, test_f1: 0.5008
 epoch: 79, train_loss: 0.8807, test_loss: 1.1099, test_f1: 0.4855
 epoch: 80, train_loss: 0.8774, test_loss: 1.1527, test_f1: 0.5246
 epoch: 81, train_loss: 0.8816, test_loss: 1.1531, test_f1: 0.4903
 epoch: 82, train_loss: 0.8969, test_loss: 1.1453, test_f1: 0.4906
 epoch: 83, train_loss: 0.8715, test_loss: 1.1275, test_f1: 0.4835
 epoch: 84, train_loss: 0.8960, test_loss: 1.1102, test_f1: 0.4999
 epoch: 85, train_loss: 0.8868, test_loss: 1.1039, test_f1: 0.4960
 epoch: 86, train_loss: 0.8932, test_loss: 1.1142, test_f1: 0.4871
 epoch: 87, train_loss: 0.8894, test_loss: 1.1202, test_f1: 0.5045
 epoch: 88, train_loss: 0.9005, test_loss: 1.0957, test_f1: 0.4745
 epoch: 89, train_loss: 0.8990, test_loss: 1.1399, test_f1: 0.4215
 epoch: 90, train_loss: 0.9211, test_loss: 1.1377, test_f1: 0.4371
 epoch: 91, train_loss: 0.8889, test_loss: 1.1424, test_f1: 0.5082
 epoch: 92, train_loss: 0.8933, test_loss: 1.1352, test_f1: 0.5066
 epoch: 93, train_loss: 0.9012, test_loss: 1.1405, test_f1: 0.4738
 epoch: 94, train_loss: 0.8758, test_loss: 1.1361, test_f1: 0.4854
 epoch: 95, train_loss: 0.8715, test_loss: 1.1391, test_f1: 0.4939
 epoch: 96, train_loss: 0.8783, test_loss: 1.1532, test_f1: 0.5161
 epoch: 97, train_loss: 0.8678, test_loss: 1.1730, test_f1: 0.4923
 epoch: 98, train_loss: 0.8651, test_loss: 1.1643, test_f1: 0.5161
 epoch: 99, train_loss: 0.8680, test_loss: 1.1441, test_f1: 0.5188
##################ITERATION #8 ****************************************
 epoch: 0, train_loss: 1.2931, test_loss: 1.3066, test_f1: 0.2281
 epoch: 1, train_loss: 1.2145, test_loss: 1.3020, test_f1: 0.2281
 epoch: 2, train_loss: 1.1826, test_loss: 1.3075, test_f1: 0.2281
 epoch: 3, train_loss: 1.1603, test_loss: 1.3103, test_f1: 0.2281
 epoch: 4, train_loss: 1.1331, test_loss: 1.2977, test_f1: 0.2281
 epoch: 5, train_loss: 1.1196, test_loss: 1.2671, test_f1: 0.2622
 epoch: 6, train_loss: 1.1187, test_loss: 1.2450, test_f1: 0.3178
 epoch: 7, train_loss: 1.1035, test_loss: 1.2152, test_f1: 0.3371
 epoch: 8, train_loss: 1.0955, test_loss: 1.1780, test_f1: 0.3634
 epoch: 9, train_loss: 1.0893, test_loss: 1.1415, test_f1: 0.3974
 epoch: 10, train_loss: 1.0919, test_loss: 1.1384, test_f1: 0.4237
 epoch: 11, train_loss: 1.0655, test_loss: 1.1409, test_f1: 0.4241
 epoch: 12, train_loss: 1.0684, test_loss: 1.1367, test_f1: 0.4582
 epoch: 13, train_loss: 1.0453, test_loss: 1.1224, test_f1: 0.4603
 epoch: 14, train_loss: 1.0459, test_loss: 1.1195, test_f1: 0.4354
 epoch: 15, train_loss: 1.0425, test_loss: 1.1198, test_f1: 0.4310
 epoch: 16, train_loss: 1.0196, test_loss: 1.1064, test_f1: 0.4314
 epoch: 17, train_loss: 1.0336, test_loss: 1.1040, test_f1: 0.4263
 epoch: 18, train_loss: 1.0161, test_loss: 1.0891, test_f1: 0.4541
 epoch: 19, train_loss: 1.0106, test_loss: 1.0931, test_f1: 0.4730
 epoch: 20, train_loss: 1.0032, test_loss: 1.0991, test_f1: 0.4772
 epoch: 21, train_loss: 1.0052, test_loss: 1.1081, test_f1: 0.4823
 epoch: 22, train_loss: 0.9897, test_loss: 1.1045, test_f1: 0.4896
 epoch: 23, train_loss: 0.9974, test_loss: 1.1076, test_f1: 0.4826
 epoch: 24, train_loss: 0.9952, test_loss: 1.0984, test_f1: 0.4732
 epoch: 25, train_loss: 1.0011, test_loss: 1.0965, test_f1: 0.4800
 epoch: 26, train_loss: 0.9891, test_loss: 1.0980, test_f1: 0.4802
 epoch: 27, train_loss: 0.9889, test_loss: 1.0848, test_f1: 0.4797
 epoch: 28, train_loss: 0.9873, test_loss: 1.0881, test_f1: 0.4778
 epoch: 29, train_loss: 0.9892, test_loss: 1.0969, test_f1: 0.4798
 epoch: 30, train_loss: 0.9776, test_loss: 1.1112, test_f1: 0.4815
 epoch: 31, train_loss: 0.9600, test_loss: 1.1273, test_f1: 0.4986
 epoch: 32, train_loss: 0.9725, test_loss: 1.1178, test_f1: 0.5023
 epoch: 33, train_loss: 0.9689, test_loss: 1.1142, test_f1: 0.5140
 epoch: 34, train_loss: 0.9532, test_loss: 1.1151, test_f1: 0.5159
 epoch: 35, train_loss: 0.9547, test_loss: 1.0970, test_f1: 0.5108
 epoch: 36, train_loss: 0.9490, test_loss: 1.0785, test_f1: 0.4858
 epoch: 37, train_loss: 0.9587, test_loss: 1.0939, test_f1: 0.4895
 epoch: 38, train_loss: 0.9523, test_loss: 1.0945, test_f1: 0.5039
 epoch: 39, train_loss: 0.9498, test_loss: 1.0754, test_f1: 0.5087
 epoch: 40, train_loss: 0.9521, test_loss: 1.0888, test_f1: 0.4502
 epoch: 41, train_loss: 0.9629, test_loss: 1.0806, test_f1: 0.4780
 epoch: 42, train_loss: 0.9546, test_loss: 1.0947, test_f1: 0.5146
 epoch: 43, train_loss: 0.9443, test_loss: 1.0943, test_f1: 0.5024
 epoch: 44, train_loss: 0.9372, test_loss: 1.0993, test_f1: 0.5050
 epoch: 45, train_loss: 0.9398, test_loss: 1.0914, test_f1: 0.4901
 epoch: 46, train_loss: 0.9209, test_loss: 1.0824, test_f1: 0.4862
 epoch: 47, train_loss: 0.9234, test_loss: 1.0533, test_f1: 0.4910
 epoch: 48, train_loss: 0.9262, test_loss: 1.0479, test_f1: 0.4998
 epoch: 49, train_loss: 0.9280, test_loss: 1.0523, test_f1: 0.4973
 epoch: 50, train_loss: 0.9397, test_loss: 1.0472, test_f1: 0.4973
 epoch: 51, train_loss: 0.9215, test_loss: 1.0390, test_f1: 0.4877
 epoch: 52, train_loss: 0.9230, test_loss: 1.0595, test_f1: 0.4929
 epoch: 53, train_loss: 0.9248, test_loss: 1.0728, test_f1: 0.4964
 epoch: 54, train_loss: 0.9140, test_loss: 1.0704, test_f1: 0.4907
 epoch: 55, train_loss: 0.9146, test_loss: 1.0737, test_f1: 0.4944
 epoch: 56, train_loss: 0.9012, test_loss: 1.0900, test_f1: 0.4934
 epoch: 57, train_loss: 0.9049, test_loss: 1.1009, test_f1: 0.4966
 epoch: 58, train_loss: 0.9143, test_loss: 1.0981, test_f1: 0.4947
 epoch: 59, train_loss: 0.9074, test_loss: 1.0997, test_f1: 0.4979
 epoch: 60, train_loss: 0.8950, test_loss: 1.0791, test_f1: 0.4918
 epoch: 61, train_loss: 0.9080, test_loss: 1.0848, test_f1: 0.4960
 epoch: 62, train_loss: 0.9003, test_loss: 1.0990, test_f1: 0.4916
 epoch: 63, train_loss: 0.9090, test_loss: 1.0957, test_f1: 0.4942
 epoch: 64, train_loss: 0.9077, test_loss: 1.0939, test_f1: 0.5020
 epoch: 65, train_loss: 0.9108, test_loss: 1.0728, test_f1: 0.5003
 epoch: 66, train_loss: 0.9031, test_loss: 1.0531, test_f1: 0.4967
 epoch: 67, train_loss: 0.8922, test_loss: 1.0794, test_f1: 0.5064
 epoch: 68, train_loss: 0.8996, test_loss: 1.0916, test_f1: 0.5015
 epoch: 69, train_loss: 0.8747, test_loss: 1.0679, test_f1: 0.5048
 epoch: 70, train_loss: 0.8935, test_loss: 1.0752, test_f1: 0.4955
 epoch: 71, train_loss: 0.8968, test_loss: 1.0734, test_f1: 0.4992
 epoch: 72, train_loss: 0.8792, test_loss: 1.0708, test_f1: 0.4937
 epoch: 73, train_loss: 0.9039, test_loss: 1.1015, test_f1: 0.5070
 epoch: 74, train_loss: 0.9003, test_loss: 1.1272, test_f1: 0.5050
 epoch: 75, train_loss: 0.8974, test_loss: 1.1255, test_f1: 0.4981
 epoch: 76, train_loss: 0.8828, test_loss: 1.1064, test_f1: 0.4964
 epoch: 77, train_loss: 0.8871, test_loss: 1.0974, test_f1: 0.5022
 epoch: 78, train_loss: 0.8733, test_loss: 1.1077, test_f1: 0.5039
 epoch: 79, train_loss: 0.8899, test_loss: 1.1162, test_f1: 0.5066
 epoch: 80, train_loss: 0.8755, test_loss: 1.1040, test_f1: 0.5005
 epoch: 81, train_loss: 0.8773, test_loss: 1.1100, test_f1: 0.4924
 epoch: 82, train_loss: 0.8837, test_loss: 1.1171, test_f1: 0.4942
 epoch: 83, train_loss: 0.8829, test_loss: 1.1113, test_f1: 0.4956
 epoch: 84, train_loss: 0.8689, test_loss: 1.0877, test_f1: 0.5029
 epoch: 85, train_loss: 0.8846, test_loss: 1.1040, test_f1: 0.5048
 epoch: 86, train_loss: 0.8748, test_loss: 1.1092, test_f1: 0.5016
 epoch: 87, train_loss: 0.8687, test_loss: 1.1015, test_f1: 0.4987
 epoch: 88, train_loss: 0.8676, test_loss: 1.0839, test_f1: 0.5090
 epoch: 89, train_loss: 0.8809, test_loss: 1.0578, test_f1: 0.5285
 epoch: 90, train_loss: 0.8936, test_loss: 1.0711, test_f1: 0.5364
 epoch: 91, train_loss: 0.8936, test_loss: 1.0737, test_f1: 0.5504
 epoch: 92, train_loss: 0.8684, test_loss: 1.1019, test_f1: 0.5312
 epoch: 93, train_loss: 0.8822, test_loss: 1.0974, test_f1: 0.5273
 epoch: 94, train_loss: 0.8820, test_loss: 1.0981, test_f1: 0.5180
 epoch: 95, train_loss: 0.8787, test_loss: 1.0901, test_f1: 0.5137
 epoch: 96, train_loss: 0.8721, test_loss: 1.0831, test_f1: 0.5373
 epoch: 97, train_loss: 0.8655, test_loss: 1.0880, test_f1: 0.5440
 epoch: 98, train_loss: 0.8733, test_loss: 1.1254, test_f1: 0.5394
 epoch: 99, train_loss: 0.8675, test_loss: 1.1163, test_f1: 0.5168
##################ITERATION #9 ****************************************
 epoch: 0, train_loss: 1.7751, test_loss: 1.4617, test_f1: 0.0507
 epoch: 1, train_loss: 1.4084, test_loss: 1.4113, test_f1: 0.0507
 epoch: 2, train_loss: 1.3247, test_loss: 1.3884, test_f1: 0.0507
 epoch: 3, train_loss: 1.2644, test_loss: 1.3596, test_f1: 0.0560
 epoch: 4, train_loss: 1.2349, test_loss: 1.3332, test_f1: 0.1692
 epoch: 5, train_loss: 1.2090, test_loss: 1.3028, test_f1: 0.3086
 epoch: 6, train_loss: 1.1880, test_loss: 1.2625, test_f1: 0.3096
 epoch: 7, train_loss: 1.1495, test_loss: 1.2102, test_f1: 0.3401
 epoch: 8, train_loss: 1.1398, test_loss: 1.1502, test_f1: 0.4166
 epoch: 9, train_loss: 1.1093, test_loss: 1.1250, test_f1: 0.4554
 epoch: 10, train_loss: 1.1017, test_loss: 1.1171, test_f1: 0.4607
 epoch: 11, train_loss: 1.0926, test_loss: 1.1168, test_f1: 0.4634
 epoch: 12, train_loss: 1.1049, test_loss: 1.1073, test_f1: 0.4742
 epoch: 13, train_loss: 1.0888, test_loss: 1.1164, test_f1: 0.4695
 epoch: 14, train_loss: 1.0854, test_loss: 1.0939, test_f1: 0.4864
 epoch: 15, train_loss: 1.0742, test_loss: 1.0949, test_f1: 0.4853
 epoch: 16, train_loss: 1.0626, test_loss: 1.1102, test_f1: 0.5020
 epoch: 17, train_loss: 1.0716, test_loss: 1.1491, test_f1: 0.4706
 epoch: 18, train_loss: 1.0588, test_loss: 1.1318, test_f1: 0.5034
 epoch: 19, train_loss: 1.0504, test_loss: 1.1246, test_f1: 0.4970
 epoch: 20, train_loss: 1.0464, test_loss: 1.1190, test_f1: 0.4901
 epoch: 21, train_loss: 1.0486, test_loss: 1.1178, test_f1: 0.4944
 epoch: 22, train_loss: 1.0355, test_loss: 1.1060, test_f1: 0.5023
 epoch: 23, train_loss: 1.0346, test_loss: 1.1175, test_f1: 0.5010
 epoch: 24, train_loss: 1.0176, test_loss: 1.1137, test_f1: 0.4923
 epoch: 25, train_loss: 1.0187, test_loss: 1.1117, test_f1: 0.4946
 epoch: 26, train_loss: 1.0197, test_loss: 1.1087, test_f1: 0.5182
 epoch: 27, train_loss: 1.0092, test_loss: 1.1131, test_f1: 0.5177
 epoch: 28, train_loss: 1.0225, test_loss: 1.1173, test_f1: 0.5222
 epoch: 29, train_loss: 1.0111, test_loss: 1.1106, test_f1: 0.5066
 epoch: 30, train_loss: 0.9882, test_loss: 1.1018, test_f1: 0.5143
 epoch: 31, train_loss: 0.9898, test_loss: 1.1012, test_f1: 0.4872
 epoch: 32, train_loss: 1.0061, test_loss: 1.1369, test_f1: 0.4830
 epoch: 33, train_loss: 0.9873, test_loss: 1.1245, test_f1: 0.5038
 epoch: 34, train_loss: 0.9826, test_loss: 1.1065, test_f1: 0.4981
 epoch: 35, train_loss: 0.9868, test_loss: 1.1040, test_f1: 0.5132
 epoch: 36, train_loss: 0.9823, test_loss: 1.0974, test_f1: 0.5163
 epoch: 37, train_loss: 0.9936, test_loss: 1.1247, test_f1: 0.4991
 epoch: 38, train_loss: 0.9659, test_loss: 1.1079, test_f1: 0.5027
 epoch: 39, train_loss: 0.9788, test_loss: 1.1156, test_f1: 0.5011
 epoch: 40, train_loss: 0.9704, test_loss: 1.1078, test_f1: 0.4901
 epoch: 41, train_loss: 0.9757, test_loss: 1.1030, test_f1: 0.5086
 epoch: 42, train_loss: 0.9663, test_loss: 1.0865, test_f1: 0.5115
 epoch: 43, train_loss: 0.9711, test_loss: 1.1254, test_f1: 0.5125
 epoch: 44, train_loss: 0.9564, test_loss: 1.1200, test_f1: 0.5250
 epoch: 45, train_loss: 0.9538, test_loss: 1.1149, test_f1: 0.5151
 epoch: 46, train_loss: 0.9681, test_loss: 1.1188, test_f1: 0.5275
 epoch: 47, train_loss: 0.9485, test_loss: 1.1004, test_f1: 0.5107
 epoch: 48, train_loss: 0.9479, test_loss: 1.1091, test_f1: 0.5092
 epoch: 49, train_loss: 0.9629, test_loss: 1.0951, test_f1: 0.5106
 epoch: 50, train_loss: 0.9562, test_loss: 1.0828, test_f1: 0.5095
 epoch: 51, train_loss: 0.9466, test_loss: 1.0768, test_f1: 0.5078
 epoch: 52, train_loss: 0.9629, test_loss: 1.0909, test_f1: 0.5150
 epoch: 53, train_loss: 0.9357, test_loss: 1.1085, test_f1: 0.5075
 epoch: 54, train_loss: 0.9340, test_loss: 1.1146, test_f1: 0.5062
 epoch: 55, train_loss: 0.9371, test_loss: 1.1134, test_f1: 0.5056
 epoch: 56, train_loss: 0.9334, test_loss: 1.1319, test_f1: 0.5017
 epoch: 57, train_loss: 0.9280, test_loss: 1.1304, test_f1: 0.5141
 epoch: 58, train_loss: 0.9230, test_loss: 1.1384, test_f1: 0.5190
 epoch: 59, train_loss: 0.9237, test_loss: 1.1271, test_f1: 0.5188
 epoch: 60, train_loss: 0.9242, test_loss: 1.1554, test_f1: 0.5279
 epoch: 61, train_loss: 0.9088, test_loss: 1.1508, test_f1: 0.5224
 epoch: 62, train_loss: 0.9188, test_loss: 1.1447, test_f1: 0.5198
 epoch: 63, train_loss: 0.9192, test_loss: 1.1391, test_f1: 0.5188
 epoch: 64, train_loss: 0.9228, test_loss: 1.1563, test_f1: 0.5058
 epoch: 65, train_loss: 0.9180, test_loss: 1.1512, test_f1: 0.5185
 epoch: 66, train_loss: 0.9256, test_loss: 1.1512, test_f1: 0.5214
 epoch: 67, train_loss: 0.9149, test_loss: 1.1496, test_f1: 0.5289
 epoch: 68, train_loss: 0.9249, test_loss: 1.1498, test_f1: 0.5249
 epoch: 69, train_loss: 0.9177, test_loss: 1.1433, test_f1: 0.5354
 epoch: 70, train_loss: 0.9127, test_loss: 1.1435, test_f1: 0.5475
 epoch: 71, train_loss: 0.9121, test_loss: 1.1422, test_f1: 0.5416
 epoch: 72, train_loss: 0.9237, test_loss: 1.1457, test_f1: 0.5402
 epoch: 73, train_loss: 0.9173, test_loss: 1.1423, test_f1: 0.5457
 epoch: 74, train_loss: 0.9095, test_loss: 1.1535, test_f1: 0.5407
 epoch: 75, train_loss: 0.9167, test_loss: 1.1651, test_f1: 0.5182
 epoch: 76, train_loss: 0.9079, test_loss: 1.1788, test_f1: 0.5350
 epoch: 77, train_loss: 0.9021, test_loss: 1.1740, test_f1: 0.5280
 epoch: 78, train_loss: 0.8956, test_loss: 1.1744, test_f1: 0.5322
 epoch: 79, train_loss: 0.9151, test_loss: 1.1886, test_f1: 0.5329
 epoch: 80, train_loss: 0.9174, test_loss: 1.1887, test_f1: 0.5318
 epoch: 81, train_loss: 0.9040, test_loss: 1.1547, test_f1: 0.5284
 epoch: 82, train_loss: 0.9040, test_loss: 1.1519, test_f1: 0.5375
 epoch: 83, train_loss: 0.9000, test_loss: 1.1727, test_f1: 0.5436
 epoch: 84, train_loss: 0.9208, test_loss: 1.1637, test_f1: 0.5277
 epoch: 85, train_loss: 0.9106, test_loss: 1.1513, test_f1: 0.5400
 epoch: 86, train_loss: 0.9023, test_loss: 1.1532, test_f1: 0.5323
 epoch: 87, train_loss: 0.9032, test_loss: 1.1685, test_f1: 0.5377
 epoch: 88, train_loss: 0.8963, test_loss: 1.1787, test_f1: 0.5301
 epoch: 89, train_loss: 0.8941, test_loss: 1.2005, test_f1: 0.5400
 epoch: 90, train_loss: 0.8951, test_loss: 1.1981, test_f1: 0.5314
 epoch: 91, train_loss: 0.8949, test_loss: 1.1750, test_f1: 0.5289
 epoch: 92, train_loss: 0.8971, test_loss: 1.1080, test_f1: 0.5307
 epoch: 93, train_loss: 0.9150, test_loss: 1.1035, test_f1: 0.5311
 epoch: 94, train_loss: 0.8993, test_loss: 1.1397, test_f1: 0.5325
 epoch: 95, train_loss: 0.9058, test_loss: 1.1247, test_f1: 0.5337
 epoch: 96, train_loss: 0.9079, test_loss: 1.1722, test_f1: 0.5457
 epoch: 97, train_loss: 0.8936, test_loss: 1.2068, test_f1: 0.5385
 epoch: 98, train_loss: 0.9046, test_loss: 1.2125, test_f1: 0.5235
 epoch: 99, train_loss: 0.9000, test_loss: 1.2002, test_f1: 0.5416

Training completed in 308.88 seconds
Best F1: 0.5504 at epoch 91
Mean F1 across iterations: 0.5250  0.0237
========================FINAL RESULTS================================
FEGIN weighted F1: 0.5504  0.0237
python main.py --data ltspice_demos --representation component_net --model FEGIN --layers 5 --hiddens 16 --batch_size 256 --lr 0.001 --emb_size 512 --epochs 100 --save_appendix component_net_L5_H16_BS256_LR0.001_E512 --no_val
-----



STDERR:
  File "main.py", line 370, in <module>
    main()
  File "main.py", line 254, in main
    dataset = dataset_class(
  File "/home/philip/projects/ltspice_examples_code_repo/Circuit-Completion-Using-GNNs/component_classification_with_link_prediction_head/evaluation/FEGIN/kernel/circuit_datasets.py", line 15, in __init__
    self.data, self.slices = torch.load(self.processed_paths[0])
  File "/home/philip/.local/lib/python3.8/site-packages/torch/serialization.py", line 1040, in load
    warnings.warn(
  File "/usr/lib/python3.8/warnings.py", line 109, in _showwarnmsg
    sw(msg.message, msg.category, msg.filename, msg.lineno,
  File "main.py", line 47, in warn_with_traceback
    traceback.print_stack(file=log)
/home/philip/projects/ltspice_examples_code_repo/Circuit-Completion-Using-GNNs/component_classification_with_link_prediction_head/evaluation/FEGIN/kernel/circuit_datasets.py:15: FutureWarning: You are using `torch.load` with `weights_only=False` (the current default value), which uses the default pickle module implicitly. It is possible to construct malicious pickle data which will execute arbitrary code during unpickling (See https://github.com/pytorch/pytorch/blob/main/SECURITY.md#untrusted-models for more details). In a future release, the default value for `weights_only` will be flipped to `True`. This limits the functions that could be executed during unpickling. Arbitrary objects will no longer be allowed to be loaded via this mode unless they are explicitly allowlisted by the user via `torch.serialization.add_safe_globals`. We recommend you start setting `weights_only=True` for any use case where you don't have full control of the loaded file. Please open an issue on GitHub for any issues related to this experimental feature.
  self.data, self.slices = torch.load(self.processed_paths[0])
