STDOUT:
Results will be saved in /home/philip/projects/ltspice_examples_code_repo/Circuit-Completion-Using-GNNs/component_classification_with_link_prediction_head/evaluation/FEGIN/results/model_FEGIN_dataset_ltspice_examples
Command line input: python main.py --data ltspice_examples --representation component_component --model FEGIN --layers 4 --hiddens 128 --batch_size 128 --lr 0.0001 --emb_size 128 --epochs 100 --save_appendix component_component_L4_H128_BS128_LR0.0001_E128 --no_val
 is saved.
-----
ltspice_examples - FEGIN
Using 4 layers, 128 hidden units, h = 2
Loading component_component representation dataset
ENTERED
Training FEGIN on component_component representation
Train: 3556, Test: 845
##################ITERATION #0 ****************************************
 epoch: 0, train_loss: 1.3581, test_loss: 1.3532, test_f1: 0.2274
 epoch: 1, train_loss: 1.3280, test_loss: 1.3258, test_f1: 0.2555
 epoch: 2, train_loss: 1.3010, test_loss: 1.2926, test_f1: 0.2555
 epoch: 3, train_loss: 1.2739, test_loss: 1.2557, test_f1: 0.2999
 epoch: 4, train_loss: 1.2460, test_loss: 1.2239, test_f1: 0.3151
 epoch: 5, train_loss: 1.2225, test_loss: 1.1972, test_f1: 0.3345
 epoch: 6, train_loss: 1.1999, test_loss: 1.1766, test_f1: 0.3596
 epoch: 7, train_loss: 1.1794, test_loss: 1.1577, test_f1: 0.3735
 epoch: 8, train_loss: 1.1600, test_loss: 1.1353, test_f1: 0.3678
 epoch: 9, train_loss: 1.1426, test_loss: 1.1172, test_f1: 0.4049
 epoch: 10, train_loss: 1.1266, test_loss: 1.1020, test_f1: 0.4194
 epoch: 11, train_loss: 1.1051, test_loss: 1.0895, test_f1: 0.4263
 epoch: 12, train_loss: 1.0866, test_loss: 1.0758, test_f1: 0.4442
 epoch: 13, train_loss: 1.0726, test_loss: 1.0569, test_f1: 0.4421
 epoch: 14, train_loss: 1.0586, test_loss: 1.0457, test_f1: 0.4570
 epoch: 15, train_loss: 1.0381, test_loss: 1.0445, test_f1: 0.4617
 epoch: 16, train_loss: 1.0191, test_loss: 1.0321, test_f1: 0.4438
 epoch: 17, train_loss: 1.0134, test_loss: 1.0219, test_f1: 0.4538
 epoch: 18, train_loss: 0.9991, test_loss: 1.0161, test_f1: 0.4460
 epoch: 19, train_loss: 0.9785, test_loss: 1.0127, test_f1: 0.4620
 epoch: 20, train_loss: 0.9660, test_loss: 1.0153, test_f1: 0.4615
 epoch: 21, train_loss: 0.9477, test_loss: 1.0074, test_f1: 0.4978
 epoch: 22, train_loss: 0.9260, test_loss: 1.0125, test_f1: 0.4723
 epoch: 23, train_loss: 0.9212, test_loss: 1.0262, test_f1: 0.4928
 epoch: 24, train_loss: 0.9094, test_loss: 1.0433, test_f1: 0.5087
 epoch: 25, train_loss: 0.8883, test_loss: 1.0262, test_f1: 0.4892
 epoch: 26, train_loss: 0.8862, test_loss: 1.0122, test_f1: 0.4852
 epoch: 27, train_loss: 0.8661, test_loss: 1.0408, test_f1: 0.4949
 epoch: 28, train_loss: 0.8597, test_loss: 1.0585, test_f1: 0.4887
 epoch: 29, train_loss: 0.8480, test_loss: 1.0864, test_f1: 0.5131
 epoch: 30, train_loss: 0.8286, test_loss: 1.0512, test_f1: 0.5115
 epoch: 31, train_loss: 0.8253, test_loss: 1.0854, test_f1: 0.4980
 epoch: 32, train_loss: 0.8094, test_loss: 1.0833, test_f1: 0.5099
 epoch: 33, train_loss: 0.7973, test_loss: 1.1024, test_f1: 0.4863
 epoch: 34, train_loss: 0.7931, test_loss: 1.1045, test_f1: 0.5112
 epoch: 35, train_loss: 0.7800, test_loss: 1.0818, test_f1: 0.5025
 epoch: 36, train_loss: 0.7726, test_loss: 1.1061, test_f1: 0.5177
 epoch: 37, train_loss: 0.7732, test_loss: 1.1569, test_f1: 0.4903
 epoch: 38, train_loss: 0.7573, test_loss: 1.1182, test_f1: 0.5057
 epoch: 39, train_loss: 0.7369, test_loss: 1.1494, test_f1: 0.5104
 epoch: 40, train_loss: 0.7371, test_loss: 1.1475, test_f1: 0.4985
 epoch: 41, train_loss: 0.7393, test_loss: 1.1707, test_f1: 0.5031
 epoch: 42, train_loss: 0.7429, test_loss: 1.1196, test_f1: 0.5107
 epoch: 43, train_loss: 0.7138, test_loss: 1.1550, test_f1: 0.4982
 epoch: 44, train_loss: 0.6991, test_loss: 1.1884, test_f1: 0.4996
 epoch: 45, train_loss: 0.6973, test_loss: 1.2300, test_f1: 0.5002
 epoch: 46, train_loss: 0.7074, test_loss: 1.2461, test_f1: 0.4920
 epoch: 47, train_loss: 0.6828, test_loss: 1.2582, test_f1: 0.5066
 epoch: 48, train_loss: 0.6728, test_loss: 1.2127, test_f1: 0.5294
 epoch: 49, train_loss: 0.6852, test_loss: 1.2641, test_f1: 0.5154
 epoch: 50, train_loss: 0.6507, test_loss: 1.2637, test_f1: 0.5004
 epoch: 51, train_loss: 0.6510, test_loss: 1.2137, test_f1: 0.5312
 epoch: 52, train_loss: 0.6313, test_loss: 1.2545, test_f1: 0.5286
 epoch: 53, train_loss: 0.6357, test_loss: 1.2477, test_f1: 0.5188
 epoch: 54, train_loss: 0.6246, test_loss: 1.2302, test_f1: 0.5288
 epoch: 55, train_loss: 0.6205, test_loss: 1.3084, test_f1: 0.5212
 epoch: 56, train_loss: 0.6229, test_loss: 1.2830, test_f1: 0.5260
 epoch: 57, train_loss: 0.6257, test_loss: 1.2790, test_f1: 0.5139
 epoch: 58, train_loss: 0.6129, test_loss: 1.2794, test_f1: 0.5454
 epoch: 59, train_loss: 0.6007, test_loss: 1.3200, test_f1: 0.5286
 epoch: 60, train_loss: 0.6162, test_loss: 1.3030, test_f1: 0.5224
 epoch: 61, train_loss: 0.6068, test_loss: 1.3281, test_f1: 0.5116
 epoch: 62, train_loss: 0.6056, test_loss: 1.3268, test_f1: 0.5319
 epoch: 63, train_loss: 0.6039, test_loss: 1.3338, test_f1: 0.5184
 epoch: 64, train_loss: 0.6043, test_loss: 1.3438, test_f1: 0.5289
 epoch: 65, train_loss: 0.6049, test_loss: 1.3302, test_f1: 0.5215
 epoch: 66, train_loss: 0.6029, test_loss: 1.3599, test_f1: 0.5216
 epoch: 67, train_loss: 0.5875, test_loss: 1.3523, test_f1: 0.5223
 epoch: 68, train_loss: 0.5844, test_loss: 1.3024, test_f1: 0.5415
 epoch: 69, train_loss: 0.5782, test_loss: 1.3474, test_f1: 0.5347
 epoch: 70, train_loss: 0.5722, test_loss: 1.3507, test_f1: 0.5163
 epoch: 71, train_loss: 0.5665, test_loss: 1.3587, test_f1: 0.5285
 epoch: 72, train_loss: 0.5766, test_loss: 1.3534, test_f1: 0.5329
 epoch: 73, train_loss: 0.5722, test_loss: 1.3698, test_f1: 0.5336
 epoch: 74, train_loss: 0.5684, test_loss: 1.4661, test_f1: 0.5174
 epoch: 75, train_loss: 0.5626, test_loss: 1.3949, test_f1: 0.5199
 epoch: 76, train_loss: 0.5509, test_loss: 1.4501, test_f1: 0.5227
 epoch: 77, train_loss: 0.5653, test_loss: 1.3969, test_f1: 0.5191
 epoch: 78, train_loss: 0.5774, test_loss: 1.4266, test_f1: 0.5193
 epoch: 79, train_loss: 0.5413, test_loss: 1.4325, test_f1: 0.5135
 epoch: 80, train_loss: 0.5494, test_loss: 1.4387, test_f1: 0.5288
 epoch: 81, train_loss: 0.5458, test_loss: 1.4343, test_f1: 0.5249
 epoch: 82, train_loss: 0.5443, test_loss: 1.4123, test_f1: 0.5329
 epoch: 83, train_loss: 0.5352, test_loss: 1.4498, test_f1: 0.5350
 epoch: 84, train_loss: 0.5497, test_loss: 1.4774, test_f1: 0.5308
 epoch: 85, train_loss: 0.5358, test_loss: 1.4850, test_f1: 0.5128
 epoch: 86, train_loss: 0.5360, test_loss: 1.4477, test_f1: 0.5285
 epoch: 87, train_loss: 0.5380, test_loss: 1.4629, test_f1: 0.5137
 epoch: 88, train_loss: 0.5366, test_loss: 1.5004, test_f1: 0.5080
 epoch: 89, train_loss: 0.5266, test_loss: 1.4605, test_f1: 0.5215
 epoch: 90, train_loss: 0.5145, test_loss: 1.5184, test_f1: 0.5341
 epoch: 91, train_loss: 0.5325, test_loss: 1.4549, test_f1: 0.5146
 epoch: 92, train_loss: 0.5104, test_loss: 1.4851, test_f1: 0.5227
 epoch: 93, train_loss: 0.5126, test_loss: 1.5085, test_f1: 0.5289
 epoch: 94, train_loss: 0.5128, test_loss: 1.5315, test_f1: 0.5254
 epoch: 95, train_loss: 0.5220, test_loss: 1.5019, test_f1: 0.5298
 epoch: 96, train_loss: 0.5172, test_loss: 1.5309, test_f1: 0.5253
 epoch: 97, train_loss: 0.5109, test_loss: 1.5261, test_f1: 0.5158
 epoch: 98, train_loss: 0.5151, test_loss: 1.5182, test_f1: 0.5111
 epoch: 99, train_loss: 0.4927, test_loss: 1.5103, test_f1: 0.5403
##################ITERATION #1 ****************************************
 epoch: 0, train_loss: 1.3094, test_loss: 1.2994, test_f1: 0.2274
 epoch: 1, train_loss: 1.2460, test_loss: 1.2445, test_f1: 0.2555
 epoch: 2, train_loss: 1.2146, test_loss: 1.2016, test_f1: 0.3392
 epoch: 3, train_loss: 1.1893, test_loss: 1.1776, test_f1: 0.4054
 epoch: 4, train_loss: 1.1654, test_loss: 1.1934, test_f1: 0.4224
 epoch: 5, train_loss: 1.1498, test_loss: 1.1676, test_f1: 0.4208
 epoch: 6, train_loss: 1.1220, test_loss: 1.1710, test_f1: 0.4319
 epoch: 7, train_loss: 1.1117, test_loss: 1.1365, test_f1: 0.4370
 epoch: 8, train_loss: 1.0930, test_loss: 1.1195, test_f1: 0.4599
 epoch: 9, train_loss: 1.0700, test_loss: 1.1240, test_f1: 0.4535
 epoch: 10, train_loss: 1.0484, test_loss: 1.1489, test_f1: 0.4553
 epoch: 11, train_loss: 1.0321, test_loss: 1.1234, test_f1: 0.4599
 epoch: 12, train_loss: 1.0065, test_loss: 1.1141, test_f1: 0.4597
 epoch: 13, train_loss: 0.9960, test_loss: 1.1044, test_f1: 0.4515
 epoch: 14, train_loss: 0.9756, test_loss: 1.1344, test_f1: 0.4696
 epoch: 15, train_loss: 0.9529, test_loss: 1.0645, test_f1: 0.4641
 epoch: 16, train_loss: 0.9441, test_loss: 1.0179, test_f1: 0.4776
 epoch: 17, train_loss: 0.9229, test_loss: 1.0544, test_f1: 0.4581
 epoch: 18, train_loss: 0.9101, test_loss: 1.0548, test_f1: 0.4734
 epoch: 19, train_loss: 0.8912, test_loss: 1.0301, test_f1: 0.4712
 epoch: 20, train_loss: 0.8839, test_loss: 1.0202, test_f1: 0.4786
 epoch: 21, train_loss: 0.8603, test_loss: 1.0160, test_f1: 0.4805
 epoch: 22, train_loss: 0.8526, test_loss: 1.0356, test_f1: 0.4849
 epoch: 23, train_loss: 0.8476, test_loss: 1.0401, test_f1: 0.4708
 epoch: 24, train_loss: 0.8499, test_loss: 1.0587, test_f1: 0.4705
 epoch: 25, train_loss: 0.8347, test_loss: 1.0548, test_f1: 0.4564
 epoch: 26, train_loss: 0.8088, test_loss: 1.0089, test_f1: 0.4864
 epoch: 27, train_loss: 0.8060, test_loss: 1.0051, test_f1: 0.4822
 epoch: 28, train_loss: 0.7866, test_loss: 1.0408, test_f1: 0.4968
 epoch: 29, train_loss: 0.7862, test_loss: 1.0660, test_f1: 0.4789
 epoch: 30, train_loss: 0.7828, test_loss: 1.0848, test_f1: 0.4811
 epoch: 31, train_loss: 0.7633, test_loss: 1.0634, test_f1: 0.4861
 epoch: 32, train_loss: 0.7543, test_loss: 1.0858, test_f1: 0.4899
 epoch: 33, train_loss: 0.7416, test_loss: 1.1096, test_f1: 0.4869
 epoch: 34, train_loss: 0.7450, test_loss: 1.0860, test_f1: 0.4998
 epoch: 35, train_loss: 0.7316, test_loss: 1.1096, test_f1: 0.4675
 epoch: 36, train_loss: 0.7153, test_loss: 1.0742, test_f1: 0.5034
 epoch: 37, train_loss: 0.6997, test_loss: 1.1354, test_f1: 0.4709
 epoch: 38, train_loss: 0.7081, test_loss: 1.2134, test_f1: 0.4803
 epoch: 39, train_loss: 0.6823, test_loss: 1.1460, test_f1: 0.4953
 epoch: 40, train_loss: 0.6848, test_loss: 1.1307, test_f1: 0.5030
 epoch: 41, train_loss: 0.6726, test_loss: 1.1585, test_f1: 0.4941
 epoch: 42, train_loss: 0.6729, test_loss: 1.1733, test_f1: 0.4898
 epoch: 43, train_loss: 0.6651, test_loss: 1.2039, test_f1: 0.5021
 epoch: 44, train_loss: 0.6629, test_loss: 1.2645, test_f1: 0.4724
 epoch: 45, train_loss: 0.6661, test_loss: 1.2339, test_f1: 0.5119
 epoch: 46, train_loss: 0.6588, test_loss: 1.2293, test_f1: 0.5032
 epoch: 47, train_loss: 0.6477, test_loss: 1.3184, test_f1: 0.4890
 epoch: 48, train_loss: 0.6357, test_loss: 1.3076, test_f1: 0.4942
 epoch: 49, train_loss: 0.6387, test_loss: 1.2690, test_f1: 0.4958
 epoch: 50, train_loss: 0.6245, test_loss: 1.2525, test_f1: 0.4915
 epoch: 51, train_loss: 0.5948, test_loss: 1.3135, test_f1: 0.5019
 epoch: 52, train_loss: 0.5926, test_loss: 1.3125, test_f1: 0.4993
 epoch: 53, train_loss: 0.5969, test_loss: 1.3162, test_f1: 0.5018
 epoch: 54, train_loss: 0.5809, test_loss: 1.3201, test_f1: 0.5100
 epoch: 55, train_loss: 0.5826, test_loss: 1.3295, test_f1: 0.4946
 epoch: 56, train_loss: 0.5929, test_loss: 1.3374, test_f1: 0.5102
 epoch: 57, train_loss: 0.5793, test_loss: 1.3829, test_f1: 0.4936
 epoch: 58, train_loss: 0.5825, test_loss: 1.3275, test_f1: 0.5050
 epoch: 59, train_loss: 0.5720, test_loss: 1.3705, test_f1: 0.4923
 epoch: 60, train_loss: 0.5698, test_loss: 1.3550, test_f1: 0.5170
 epoch: 61, train_loss: 0.5628, test_loss: 1.3708, test_f1: 0.5030
 epoch: 62, train_loss: 0.5731, test_loss: 1.4577, test_f1: 0.4986
 epoch: 63, train_loss: 0.5683, test_loss: 1.3939, test_f1: 0.5069
 epoch: 64, train_loss: 0.5571, test_loss: 1.4132, test_f1: 0.5002
 epoch: 65, train_loss: 0.5570, test_loss: 1.4587, test_f1: 0.4986
 epoch: 66, train_loss: 0.5440, test_loss: 1.4578, test_f1: 0.4950
 epoch: 67, train_loss: 0.5434, test_loss: 1.4356, test_f1: 0.5025
 epoch: 68, train_loss: 0.5532, test_loss: 1.4324, test_f1: 0.5147
 epoch: 69, train_loss: 0.5410, test_loss: 1.4858, test_f1: 0.5049
 epoch: 70, train_loss: 0.5290, test_loss: 1.4531, test_f1: 0.5097
 epoch: 71, train_loss: 0.5439, test_loss: 1.4894, test_f1: 0.5074
 epoch: 72, train_loss: 0.5379, test_loss: 1.4619, test_f1: 0.5163
 epoch: 73, train_loss: 0.5380, test_loss: 1.4542, test_f1: 0.5083
 epoch: 74, train_loss: 0.5197, test_loss: 1.4985, test_f1: 0.5073
 epoch: 75, train_loss: 0.5321, test_loss: 1.4956, test_f1: 0.5093
 epoch: 76, train_loss: 0.5245, test_loss: 1.5453, test_f1: 0.5098
 epoch: 77, train_loss: 0.5235, test_loss: 1.5595, test_f1: 0.4919
 epoch: 78, train_loss: 0.5227, test_loss: 1.5341, test_f1: 0.5090
 epoch: 79, train_loss: 0.5024, test_loss: 1.5770, test_f1: 0.5024
 epoch: 80, train_loss: 0.5216, test_loss: 1.5672, test_f1: 0.5084
 epoch: 81, train_loss: 0.5116, test_loss: 1.5748, test_f1: 0.5030
 epoch: 82, train_loss: 0.5060, test_loss: 1.5945, test_f1: 0.5138
 epoch: 83, train_loss: 0.5083, test_loss: 1.6159, test_f1: 0.4986
 epoch: 84, train_loss: 0.5019, test_loss: 1.6015, test_f1: 0.5127
 epoch: 85, train_loss: 0.4982, test_loss: 1.6947, test_f1: 0.5070
 epoch: 86, train_loss: 0.4998, test_loss: 1.6217, test_f1: 0.5116
 epoch: 87, train_loss: 0.4883, test_loss: 1.6197, test_f1: 0.5057
 epoch: 88, train_loss: 0.5099, test_loss: 1.6890, test_f1: 0.4900
 epoch: 89, train_loss: 0.4966, test_loss: 1.6351, test_f1: 0.4916
 epoch: 90, train_loss: 0.4955, test_loss: 1.6956, test_f1: 0.4919
 epoch: 91, train_loss: 0.4844, test_loss: 1.6524, test_f1: 0.5058
 epoch: 92, train_loss: 0.4908, test_loss: 1.7230, test_f1: 0.5043
 epoch: 93, train_loss: 0.4775, test_loss: 1.6971, test_f1: 0.5062
 epoch: 94, train_loss: 0.4715, test_loss: 1.6953, test_f1: 0.5062
 epoch: 95, train_loss: 0.4631, test_loss: 1.7556, test_f1: 0.5050
 epoch: 96, train_loss: 0.4839, test_loss: 1.7592, test_f1: 0.5120
 epoch: 97, train_loss: 0.4691, test_loss: 1.7260, test_f1: 0.5071
 epoch: 98, train_loss: 0.4794, test_loss: 1.8057, test_f1: 0.4999
 epoch: 99, train_loss: 0.4792, test_loss: 1.7221, test_f1: 0.5152
##################ITERATION #2 ****************************************
 epoch: 0, train_loss: 1.3084, test_loss: 1.2810, test_f1: 0.2555
 epoch: 1, train_loss: 1.2174, test_loss: 1.2090, test_f1: 0.2996
 epoch: 2, train_loss: 1.1855, test_loss: 1.1545, test_f1: 0.4416
 epoch: 3, train_loss: 1.1649, test_loss: 1.1292, test_f1: 0.4602
 epoch: 4, train_loss: 1.1367, test_loss: 1.1084, test_f1: 0.4464
 epoch: 5, train_loss: 1.1216, test_loss: 1.1023, test_f1: 0.4409
 epoch: 6, train_loss: 1.1025, test_loss: 1.0803, test_f1: 0.4724
 epoch: 7, train_loss: 1.0827, test_loss: 1.0680, test_f1: 0.4429
 epoch: 8, train_loss: 1.0736, test_loss: 1.0606, test_f1: 0.4617
 epoch: 9, train_loss: 1.0596, test_loss: 1.0474, test_f1: 0.4459
 epoch: 10, train_loss: 1.0406, test_loss: 1.0395, test_f1: 0.4724
 epoch: 11, train_loss: 1.0334, test_loss: 1.0241, test_f1: 0.4635
 epoch: 12, train_loss: 1.0140, test_loss: 1.0231, test_f1: 0.4797
 epoch: 13, train_loss: 1.0055, test_loss: 1.0188, test_f1: 0.4641
 epoch: 14, train_loss: 0.9808, test_loss: 1.0085, test_f1: 0.4605
 epoch: 15, train_loss: 0.9735, test_loss: 1.0026, test_f1: 0.4728
 epoch: 16, train_loss: 0.9594, test_loss: 1.0097, test_f1: 0.4862
 epoch: 17, train_loss: 0.9545, test_loss: 0.9845, test_f1: 0.5080
 epoch: 18, train_loss: 0.9387, test_loss: 1.0039, test_f1: 0.4856
 epoch: 19, train_loss: 0.9303, test_loss: 0.9810, test_f1: 0.5026
 epoch: 20, train_loss: 0.9192, test_loss: 0.9893, test_f1: 0.4893
 epoch: 21, train_loss: 0.8955, test_loss: 0.9727, test_f1: 0.5146
 epoch: 22, train_loss: 0.8863, test_loss: 1.0172, test_f1: 0.4780
 epoch: 23, train_loss: 0.8765, test_loss: 0.9858, test_f1: 0.5041
 epoch: 24, train_loss: 0.8815, test_loss: 1.0279, test_f1: 0.5012
 epoch: 25, train_loss: 0.8652, test_loss: 0.9867, test_f1: 0.5071
 epoch: 26, train_loss: 0.8459, test_loss: 1.0272, test_f1: 0.4965
 epoch: 27, train_loss: 0.8378, test_loss: 1.0001, test_f1: 0.5054
 epoch: 28, train_loss: 0.8296, test_loss: 1.0040, test_f1: 0.5201
 epoch: 29, train_loss: 0.8202, test_loss: 1.0190, test_f1: 0.5140
 epoch: 30, train_loss: 0.8077, test_loss: 1.0115, test_f1: 0.5534
 epoch: 31, train_loss: 0.7947, test_loss: 1.0364, test_f1: 0.5262
 epoch: 32, train_loss: 0.7988, test_loss: 1.0615, test_f1: 0.5169
 epoch: 33, train_loss: 0.7865, test_loss: 1.0461, test_f1: 0.5272
 epoch: 34, train_loss: 0.7597, test_loss: 1.0854, test_f1: 0.5237
 epoch: 35, train_loss: 0.7525, test_loss: 1.0964, test_f1: 0.5306
 epoch: 36, train_loss: 0.7462, test_loss: 1.0762, test_f1: 0.5321
 epoch: 37, train_loss: 0.7333, test_loss: 1.0875, test_f1: 0.5197
 epoch: 38, train_loss: 0.7297, test_loss: 1.1229, test_f1: 0.4920
 epoch: 39, train_loss: 0.7211, test_loss: 1.1285, test_f1: 0.5185
 epoch: 40, train_loss: 0.7096, test_loss: 1.0750, test_f1: 0.5460
 epoch: 41, train_loss: 0.7099, test_loss: 1.1300, test_f1: 0.5365
 epoch: 42, train_loss: 0.6952, test_loss: 1.1563, test_f1: 0.5151
 epoch: 43, train_loss: 0.6873, test_loss: 1.1461, test_f1: 0.5347
 epoch: 44, train_loss: 0.6891, test_loss: 1.1244, test_f1: 0.5451
 epoch: 45, train_loss: 0.6797, test_loss: 1.1913, test_f1: 0.5169
 epoch: 46, train_loss: 0.6688, test_loss: 1.1521, test_f1: 0.5337
 epoch: 47, train_loss: 0.6609, test_loss: 1.1532, test_f1: 0.5280
 epoch: 48, train_loss: 0.6744, test_loss: 1.1769, test_f1: 0.5412
 epoch: 49, train_loss: 0.6596, test_loss: 1.1957, test_f1: 0.5308
 epoch: 50, train_loss: 0.6502, test_loss: 1.2163, test_f1: 0.5216
 epoch: 51, train_loss: 0.6362, test_loss: 1.1926, test_f1: 0.5223
 epoch: 52, train_loss: 0.6230, test_loss: 1.2198, test_f1: 0.5250
 epoch: 53, train_loss: 0.6052, test_loss: 1.2163, test_f1: 0.5247
 epoch: 54, train_loss: 0.6059, test_loss: 1.2418, test_f1: 0.5058
 epoch: 55, train_loss: 0.6054, test_loss: 1.2076, test_f1: 0.5265
 epoch: 56, train_loss: 0.5919, test_loss: 1.2435, test_f1: 0.5249
 epoch: 57, train_loss: 0.5971, test_loss: 1.2426, test_f1: 0.5158
 epoch: 58, train_loss: 0.5804, test_loss: 1.2577, test_f1: 0.5203
 epoch: 59, train_loss: 0.5936, test_loss: 1.2874, test_f1: 0.5120
 epoch: 60, train_loss: 0.5809, test_loss: 1.2659, test_f1: 0.5247
 epoch: 61, train_loss: 0.5966, test_loss: 1.2675, test_f1: 0.5235
 epoch: 62, train_loss: 0.5719, test_loss: 1.2780, test_f1: 0.5281
 epoch: 63, train_loss: 0.5663, test_loss: 1.2742, test_f1: 0.5181
 epoch: 64, train_loss: 0.5714, test_loss: 1.3384, test_f1: 0.5334
 epoch: 65, train_loss: 0.5643, test_loss: 1.2587, test_f1: 0.5420
 epoch: 66, train_loss: 0.5555, test_loss: 1.3336, test_f1: 0.5313
 epoch: 67, train_loss: 0.5506, test_loss: 1.2998, test_f1: 0.5293
 epoch: 68, train_loss: 0.5637, test_loss: 1.3276, test_f1: 0.5404
 epoch: 69, train_loss: 0.5498, test_loss: 1.3336, test_f1: 0.5190
 epoch: 70, train_loss: 0.5573, test_loss: 1.3639, test_f1: 0.5303
 epoch: 71, train_loss: 0.5572, test_loss: 1.3388, test_f1: 0.5297
 epoch: 72, train_loss: 0.5537, test_loss: 1.3216, test_f1: 0.5377
 epoch: 73, train_loss: 0.5420, test_loss: 1.4191, test_f1: 0.5242
 epoch: 74, train_loss: 0.5256, test_loss: 1.3100, test_f1: 0.5480
 epoch: 75, train_loss: 0.5376, test_loss: 1.3522, test_f1: 0.5338
 epoch: 76, train_loss: 0.5160, test_loss: 1.4037, test_f1: 0.5190
 epoch: 77, train_loss: 0.5456, test_loss: 1.3656, test_f1: 0.5366
 epoch: 78, train_loss: 0.5194, test_loss: 1.3838, test_f1: 0.5402
 epoch: 79, train_loss: 0.5273, test_loss: 1.3719, test_f1: 0.5438
 epoch: 80, train_loss: 0.5253, test_loss: 1.3598, test_f1: 0.5428
 epoch: 81, train_loss: 0.5167, test_loss: 1.3577, test_f1: 0.5504
 epoch: 82, train_loss: 0.5207, test_loss: 1.3737, test_f1: 0.5437
 epoch: 83, train_loss: 0.5042, test_loss: 1.4001, test_f1: 0.5465
 epoch: 84, train_loss: 0.5244, test_loss: 1.4118, test_f1: 0.5331
 epoch: 85, train_loss: 0.4910, test_loss: 1.4189, test_f1: 0.5395
 epoch: 86, train_loss: 0.5010, test_loss: 1.4120, test_f1: 0.5484
 epoch: 87, train_loss: 0.5094, test_loss: 1.4255, test_f1: 0.5462
 epoch: 88, train_loss: 0.5124, test_loss: 1.4449, test_f1: 0.5493
 epoch: 89, train_loss: 0.5058, test_loss: 1.4532, test_f1: 0.5375
 epoch: 90, train_loss: 0.5070, test_loss: 1.4393, test_f1: 0.5409
 epoch: 91, train_loss: 0.4809, test_loss: 1.5010, test_f1: 0.5268
 epoch: 92, train_loss: 0.4873, test_loss: 1.4349, test_f1: 0.5558
 epoch: 93, train_loss: 0.4848, test_loss: 1.4113, test_f1: 0.5465
 epoch: 94, train_loss: 0.4936, test_loss: 1.4883, test_f1: 0.5476
 epoch: 95, train_loss: 0.4966, test_loss: 1.4158, test_f1: 0.5531
 epoch: 96, train_loss: 0.4734, test_loss: 1.4835, test_f1: 0.5476
 epoch: 97, train_loss: 0.4732, test_loss: 1.4753, test_f1: 0.5448
 epoch: 98, train_loss: 0.4686, test_loss: 1.4694, test_f1: 0.5513
 epoch: 99, train_loss: 0.4719, test_loss: 1.4984, test_f1: 0.5457
##################ITERATION #3 ****************************************
 epoch: 0, train_loss: 1.2816, test_loss: 1.2677, test_f1: 0.2911
 epoch: 1, train_loss: 1.2007, test_loss: 1.1872, test_f1: 0.4438
 epoch: 2, train_loss: 1.1678, test_loss: 1.1402, test_f1: 0.4071
 epoch: 3, train_loss: 1.1509, test_loss: 1.1151, test_f1: 0.4448
 epoch: 4, train_loss: 1.1308, test_loss: 1.0979, test_f1: 0.4565
 epoch: 5, train_loss: 1.1096, test_loss: 1.0867, test_f1: 0.4481
 epoch: 6, train_loss: 1.1016, test_loss: 1.0889, test_f1: 0.4387
 epoch: 7, train_loss: 1.0846, test_loss: 1.0700, test_f1: 0.4500
 epoch: 8, train_loss: 1.0678, test_loss: 1.0594, test_f1: 0.4547
 epoch: 9, train_loss: 1.0466, test_loss: 1.0532, test_f1: 0.4551
 epoch: 10, train_loss: 1.0360, test_loss: 1.0348, test_f1: 0.4628
 epoch: 11, train_loss: 1.0277, test_loss: 1.0334, test_f1: 0.4679
 epoch: 12, train_loss: 1.0028, test_loss: 1.0243, test_f1: 0.4645
 epoch: 13, train_loss: 0.9961, test_loss: 1.0318, test_f1: 0.4599
 epoch: 14, train_loss: 0.9882, test_loss: 1.0357, test_f1: 0.4745
 epoch: 15, train_loss: 0.9771, test_loss: 1.0137, test_f1: 0.4962
 epoch: 16, train_loss: 0.9623, test_loss: 1.0190, test_f1: 0.4775
 epoch: 17, train_loss: 0.9481, test_loss: 0.9896, test_f1: 0.4829
 epoch: 18, train_loss: 0.9308, test_loss: 1.0042, test_f1: 0.5072
 epoch: 19, train_loss: 0.9201, test_loss: 0.9940, test_f1: 0.4788
 epoch: 20, train_loss: 0.9127, test_loss: 1.0378, test_f1: 0.4887
 epoch: 21, train_loss: 0.8977, test_loss: 0.9838, test_f1: 0.5085
 epoch: 22, train_loss: 0.8989, test_loss: 0.9858, test_f1: 0.4972
 epoch: 23, train_loss: 0.8782, test_loss: 0.9934, test_f1: 0.5003
 epoch: 24, train_loss: 0.8637, test_loss: 0.9754, test_f1: 0.5073
 epoch: 25, train_loss: 0.8443, test_loss: 1.0148, test_f1: 0.5080
 epoch: 26, train_loss: 0.8413, test_loss: 0.9922, test_f1: 0.5049
 epoch: 27, train_loss: 0.8313, test_loss: 1.0100, test_f1: 0.5026
 epoch: 28, train_loss: 0.8278, test_loss: 1.0049, test_f1: 0.5109
 epoch: 29, train_loss: 0.8147, test_loss: 0.9960, test_f1: 0.5257
 epoch: 30, train_loss: 0.8031, test_loss: 1.0168, test_f1: 0.4962
 epoch: 31, train_loss: 0.8048, test_loss: 1.0012, test_f1: 0.5203
 epoch: 32, train_loss: 0.7875, test_loss: 1.0092, test_f1: 0.5237
 epoch: 33, train_loss: 0.7772, test_loss: 1.0548, test_f1: 0.4954
 epoch: 34, train_loss: 0.7756, test_loss: 1.0852, test_f1: 0.4989
 epoch: 35, train_loss: 0.7665, test_loss: 1.0852, test_f1: 0.5010
 epoch: 36, train_loss: 0.7642, test_loss: 1.0150, test_f1: 0.5281
 epoch: 37, train_loss: 0.7548, test_loss: 1.0733, test_f1: 0.4989
 epoch: 38, train_loss: 0.7553, test_loss: 1.0611, test_f1: 0.5017
 epoch: 39, train_loss: 0.7329, test_loss: 1.0872, test_f1: 0.5005
 epoch: 40, train_loss: 0.7350, test_loss: 1.0532, test_f1: 0.5107
 epoch: 41, train_loss: 0.7241, test_loss: 1.0609, test_f1: 0.5250
 epoch: 42, train_loss: 0.7105, test_loss: 1.0976, test_f1: 0.5264
 epoch: 43, train_loss: 0.6965, test_loss: 1.1090, test_f1: 0.5202
 epoch: 44, train_loss: 0.6925, test_loss: 1.1026, test_f1: 0.5266
 epoch: 45, train_loss: 0.6819, test_loss: 1.0876, test_f1: 0.5321
 epoch: 46, train_loss: 0.6887, test_loss: 1.1066, test_f1: 0.5360
 epoch: 47, train_loss: 0.6646, test_loss: 1.1299, test_f1: 0.5125
 epoch: 48, train_loss: 0.6629, test_loss: 1.1188, test_f1: 0.5472
 epoch: 49, train_loss: 0.6512, test_loss: 1.1164, test_f1: 0.5281
 epoch: 50, train_loss: 0.6627, test_loss: 1.1620, test_f1: 0.5172
 epoch: 51, train_loss: 0.6423, test_loss: 1.1764, test_f1: 0.5306
 epoch: 52, train_loss: 0.6301, test_loss: 1.1692, test_f1: 0.5237
 epoch: 53, train_loss: 0.6209, test_loss: 1.1556, test_f1: 0.5396
 epoch: 54, train_loss: 0.6204, test_loss: 1.1532, test_f1: 0.5402
 epoch: 55, train_loss: 0.6150, test_loss: 1.1775, test_f1: 0.5228
 epoch: 56, train_loss: 0.6129, test_loss: 1.1690, test_f1: 0.5259
 epoch: 57, train_loss: 0.6053, test_loss: 1.1716, test_f1: 0.5455
 epoch: 58, train_loss: 0.6117, test_loss: 1.2025, test_f1: 0.5375
 epoch: 59, train_loss: 0.6039, test_loss: 1.1620, test_f1: 0.5359
 epoch: 60, train_loss: 0.5995, test_loss: 1.1910, test_f1: 0.5463
 epoch: 61, train_loss: 0.5801, test_loss: 1.1713, test_f1: 0.5451
 epoch: 62, train_loss: 0.5832, test_loss: 1.1912, test_f1: 0.5355
 epoch: 63, train_loss: 0.5823, test_loss: 1.1997, test_f1: 0.5438
 epoch: 64, train_loss: 0.5982, test_loss: 1.1955, test_f1: 0.5309
 epoch: 65, train_loss: 0.5764, test_loss: 1.2259, test_f1: 0.5250
 epoch: 66, train_loss: 0.5886, test_loss: 1.2216, test_f1: 0.5399
 epoch: 67, train_loss: 0.5791, test_loss: 1.2189, test_f1: 0.5535
 epoch: 68, train_loss: 0.5750, test_loss: 1.1937, test_f1: 0.5455
 epoch: 69, train_loss: 0.5681, test_loss: 1.2357, test_f1: 0.5398
 epoch: 70, train_loss: 0.5651, test_loss: 1.2372, test_f1: 0.5377
 epoch: 71, train_loss: 0.5546, test_loss: 1.2127, test_f1: 0.5527
 epoch: 72, train_loss: 0.5673, test_loss: 1.2227, test_f1: 0.5428
 epoch: 73, train_loss: 0.5723, test_loss: 1.2312, test_f1: 0.5615
 epoch: 74, train_loss: 0.5467, test_loss: 1.2528, test_f1: 0.5486
 epoch: 75, train_loss: 0.5475, test_loss: 1.2492, test_f1: 0.5425
 epoch: 76, train_loss: 0.5573, test_loss: 1.2633, test_f1: 0.5400
 epoch: 77, train_loss: 0.5423, test_loss: 1.2791, test_f1: 0.5353
 epoch: 78, train_loss: 0.5586, test_loss: 1.2648, test_f1: 0.5398
 epoch: 79, train_loss: 0.5436, test_loss: 1.2666, test_f1: 0.5252
 epoch: 80, train_loss: 0.5528, test_loss: 1.3065, test_f1: 0.5170
 epoch: 81, train_loss: 0.5423, test_loss: 1.3110, test_f1: 0.5364
 epoch: 82, train_loss: 0.5291, test_loss: 1.2550, test_f1: 0.5724
 epoch: 83, train_loss: 0.5341, test_loss: 1.2901, test_f1: 0.5320
 epoch: 84, train_loss: 0.5243, test_loss: 1.2756, test_f1: 0.5480
 epoch: 85, train_loss: 0.5189, test_loss: 1.3078, test_f1: 0.5505
 epoch: 86, train_loss: 0.5263, test_loss: 1.3345, test_f1: 0.5332
 epoch: 87, train_loss: 0.5307, test_loss: 1.2751, test_f1: 0.5388
 epoch: 88, train_loss: 0.5259, test_loss: 1.3128, test_f1: 0.5547
 epoch: 89, train_loss: 0.5177, test_loss: 1.3068, test_f1: 0.5335
 epoch: 90, train_loss: 0.5146, test_loss: 1.3390, test_f1: 0.5227
 epoch: 91, train_loss: 0.5037, test_loss: 1.3238, test_f1: 0.5385
 epoch: 92, train_loss: 0.5059, test_loss: 1.3018, test_f1: 0.5342
 epoch: 93, train_loss: 0.5022, test_loss: 1.3514, test_f1: 0.5296
 epoch: 94, train_loss: 0.5017, test_loss: 1.3207, test_f1: 0.5420
 epoch: 95, train_loss: 0.5092, test_loss: 1.3195, test_f1: 0.5476
 epoch: 96, train_loss: 0.4887, test_loss: 1.3015, test_f1: 0.5408
 epoch: 97, train_loss: 0.4986, test_loss: 1.3470, test_f1: 0.5518
 epoch: 98, train_loss: 0.4829, test_loss: 1.3345, test_f1: 0.5440
 epoch: 99, train_loss: 0.4790, test_loss: 1.3589, test_f1: 0.5285
##################ITERATION #4 ****************************************
 epoch: 0, train_loss: 1.2942, test_loss: 1.2391, test_f1: 0.2557
 epoch: 1, train_loss: 1.2126, test_loss: 1.1877, test_f1: 0.3100
 epoch: 2, train_loss: 1.1877, test_loss: 1.1538, test_f1: 0.4596
 epoch: 3, train_loss: 1.1671, test_loss: 1.1269, test_f1: 0.4538
 epoch: 4, train_loss: 1.1399, test_loss: 1.1047, test_f1: 0.4486
 epoch: 5, train_loss: 1.1261, test_loss: 1.0867, test_f1: 0.4634
 epoch: 6, train_loss: 1.1138, test_loss: 1.0693, test_f1: 0.4676
 epoch: 7, train_loss: 1.0870, test_loss: 1.0512, test_f1: 0.4783
 epoch: 8, train_loss: 1.0785, test_loss: 1.0419, test_f1: 0.4691
 epoch: 9, train_loss: 1.0678, test_loss: 1.0308, test_f1: 0.4612
 epoch: 10, train_loss: 1.0498, test_loss: 1.0290, test_f1: 0.4644
 epoch: 11, train_loss: 1.0385, test_loss: 1.0170, test_f1: 0.4655
 epoch: 12, train_loss: 1.0288, test_loss: 1.0072, test_f1: 0.4706
 epoch: 13, train_loss: 1.0168, test_loss: 0.9894, test_f1: 0.4728
 epoch: 14, train_loss: 1.0055, test_loss: 0.9913, test_f1: 0.4757
 epoch: 15, train_loss: 1.0001, test_loss: 0.9670, test_f1: 0.4916
 epoch: 16, train_loss: 0.9878, test_loss: 0.9719, test_f1: 0.4862
 epoch: 17, train_loss: 0.9627, test_loss: 0.9515, test_f1: 0.5345
 epoch: 18, train_loss: 0.9572, test_loss: 0.9556, test_f1: 0.5099
 epoch: 19, train_loss: 0.9454, test_loss: 0.9521, test_f1: 0.5210
 epoch: 20, train_loss: 0.9343, test_loss: 0.9539, test_f1: 0.5367
 epoch: 21, train_loss: 0.9323, test_loss: 0.9398, test_f1: 0.5297
 epoch: 22, train_loss: 0.9151, test_loss: 0.9440, test_f1: 0.5241
 epoch: 23, train_loss: 0.9128, test_loss: 0.9474, test_f1: 0.5112
 epoch: 24, train_loss: 0.9064, test_loss: 0.9508, test_f1: 0.5147
 epoch: 25, train_loss: 0.8884, test_loss: 0.9386, test_f1: 0.5301
 epoch: 26, train_loss: 0.8825, test_loss: 0.9251, test_f1: 0.5218
 epoch: 27, train_loss: 0.8628, test_loss: 0.9438, test_f1: 0.5211
 epoch: 28, train_loss: 0.8547, test_loss: 0.9395, test_f1: 0.5175
 epoch: 29, train_loss: 0.8492, test_loss: 0.9582, test_f1: 0.5027
 epoch: 30, train_loss: 0.8346, test_loss: 0.9374, test_f1: 0.5382
 epoch: 31, train_loss: 0.8375, test_loss: 0.9633, test_f1: 0.5296
 epoch: 32, train_loss: 0.8308, test_loss: 0.9455, test_f1: 0.5643
 epoch: 33, train_loss: 0.8281, test_loss: 0.9574, test_f1: 0.5132
 epoch: 34, train_loss: 0.8148, test_loss: 0.9567, test_f1: 0.5390
 epoch: 35, train_loss: 0.8032, test_loss: 1.0121, test_f1: 0.5133
 epoch: 36, train_loss: 0.7885, test_loss: 0.9562, test_f1: 0.5445
 epoch: 37, train_loss: 0.7769, test_loss: 0.9911, test_f1: 0.5151
 epoch: 38, train_loss: 0.7669, test_loss: 0.9708, test_f1: 0.5445
 epoch: 39, train_loss: 0.7635, test_loss: 0.9793, test_f1: 0.5620
 epoch: 40, train_loss: 0.7522, test_loss: 0.9911, test_f1: 0.5392
 epoch: 41, train_loss: 0.7550, test_loss: 1.0177, test_f1: 0.5511
 epoch: 42, train_loss: 0.7267, test_loss: 1.0198, test_f1: 0.5492
 epoch: 43, train_loss: 0.7284, test_loss: 1.0245, test_f1: 0.5459
 epoch: 44, train_loss: 0.7412, test_loss: 1.0363, test_f1: 0.5347
 epoch: 45, train_loss: 0.7249, test_loss: 1.0393, test_f1: 0.5493
 epoch: 46, train_loss: 0.7249, test_loss: 1.0516, test_f1: 0.5161
 epoch: 47, train_loss: 0.7227, test_loss: 1.0463, test_f1: 0.5168
 epoch: 48, train_loss: 0.7056, test_loss: 1.1007, test_f1: 0.5284
 epoch: 49, train_loss: 0.6909, test_loss: 1.0667, test_f1: 0.5347
 epoch: 50, train_loss: 0.6823, test_loss: 1.0736, test_f1: 0.5272
 epoch: 51, train_loss: 0.6730, test_loss: 1.0967, test_f1: 0.5270
 epoch: 52, train_loss: 0.6692, test_loss: 1.1034, test_f1: 0.5259
 epoch: 53, train_loss: 0.6561, test_loss: 1.0717, test_f1: 0.5440
 epoch: 54, train_loss: 0.6500, test_loss: 1.1066, test_f1: 0.5265
 epoch: 55, train_loss: 0.6474, test_loss: 1.1249, test_f1: 0.5264
 epoch: 56, train_loss: 0.6471, test_loss: 1.1454, test_f1: 0.5355
 epoch: 57, train_loss: 0.6464, test_loss: 1.1206, test_f1: 0.5301
 epoch: 58, train_loss: 0.6414, test_loss: 1.1216, test_f1: 0.5293
 epoch: 59, train_loss: 0.6440, test_loss: 1.1253, test_f1: 0.5242
 epoch: 60, train_loss: 0.6360, test_loss: 1.1541, test_f1: 0.5057
 epoch: 61, train_loss: 0.6392, test_loss: 1.1492, test_f1: 0.5148
 epoch: 62, train_loss: 0.6274, test_loss: 1.1404, test_f1: 0.5220
 epoch: 63, train_loss: 0.6186, test_loss: 1.1480, test_f1: 0.5183
 epoch: 64, train_loss: 0.6365, test_loss: 1.1374, test_f1: 0.5365
 epoch: 65, train_loss: 0.6234, test_loss: 1.1654, test_f1: 0.5123
 epoch: 66, train_loss: 0.6213, test_loss: 1.1489, test_f1: 0.5235
 epoch: 67, train_loss: 0.6033, test_loss: 1.1731, test_f1: 0.5320
 epoch: 68, train_loss: 0.6031, test_loss: 1.1867, test_f1: 0.5237
 epoch: 69, train_loss: 0.6088, test_loss: 1.2081, test_f1: 0.5200
 epoch: 70, train_loss: 0.6006, test_loss: 1.1750, test_f1: 0.5217
 epoch: 71, train_loss: 0.5979, test_loss: 1.2247, test_f1: 0.5020
 epoch: 72, train_loss: 0.5881, test_loss: 1.2033, test_f1: 0.5146
 epoch: 73, train_loss: 0.6059, test_loss: 1.2160, test_f1: 0.5353
 epoch: 74, train_loss: 0.6026, test_loss: 1.2163, test_f1: 0.5181
 epoch: 75, train_loss: 0.6050, test_loss: 1.2015, test_f1: 0.5212
 epoch: 76, train_loss: 0.5818, test_loss: 1.1924, test_f1: 0.5288
 epoch: 77, train_loss: 0.5871, test_loss: 1.2190, test_f1: 0.5203
 epoch: 78, train_loss: 0.5848, test_loss: 1.2058, test_f1: 0.5185
 epoch: 79, train_loss: 0.5818, test_loss: 1.2347, test_f1: 0.5335
 epoch: 80, train_loss: 0.5667, test_loss: 1.2284, test_f1: 0.5139
 epoch: 81, train_loss: 0.5877, test_loss: 1.2236, test_f1: 0.5142
 epoch: 82, train_loss: 0.5669, test_loss: 1.2369, test_f1: 0.5178
 epoch: 83, train_loss: 0.5794, test_loss: 1.2479, test_f1: 0.5166
 epoch: 84, train_loss: 0.5704, test_loss: 1.2591, test_f1: 0.5124
 epoch: 85, train_loss: 0.5592, test_loss: 1.2675, test_f1: 0.5071
 epoch: 86, train_loss: 0.5559, test_loss: 1.2749, test_f1: 0.5108
 epoch: 87, train_loss: 0.5637, test_loss: 1.2640, test_f1: 0.5253
 epoch: 88, train_loss: 0.5409, test_loss: 1.3261, test_f1: 0.5092
 epoch: 89, train_loss: 0.5594, test_loss: 1.2911, test_f1: 0.5093
 epoch: 90, train_loss: 0.5555, test_loss: 1.2996, test_f1: 0.5095
 epoch: 91, train_loss: 0.5497, test_loss: 1.3041, test_f1: 0.5135
 epoch: 92, train_loss: 0.5548, test_loss: 1.2526, test_f1: 0.5212
 epoch: 93, train_loss: 0.5420, test_loss: 1.2813, test_f1: 0.5205
 epoch: 94, train_loss: 0.5384, test_loss: 1.2964, test_f1: 0.5224
 epoch: 95, train_loss: 0.5366, test_loss: 1.3235, test_f1: 0.5073
 epoch: 96, train_loss: 0.5313, test_loss: 1.3368, test_f1: 0.5051
 epoch: 97, train_loss: 0.5340, test_loss: 1.3013, test_f1: 0.5211
 epoch: 98, train_loss: 0.5355, test_loss: 1.2836, test_f1: 0.5057
 epoch: 99, train_loss: 0.5319, test_loss: 1.3261, test_f1: 0.5202
##################ITERATION #5 ****************************************
 epoch: 0, train_loss: 1.3444, test_loss: 1.2653, test_f1: 0.2582
 epoch: 1, train_loss: 1.2187, test_loss: 1.1823, test_f1: 0.4067
 epoch: 2, train_loss: 1.1841, test_loss: 1.1361, test_f1: 0.4573
 epoch: 3, train_loss: 1.1579, test_loss: 1.1118, test_f1: 0.4635
 epoch: 4, train_loss: 1.1331, test_loss: 1.0978, test_f1: 0.4569
 epoch: 5, train_loss: 1.1119, test_loss: 1.0916, test_f1: 0.4744
 epoch: 6, train_loss: 1.0927, test_loss: 1.0662, test_f1: 0.4710
 epoch: 7, train_loss: 1.0832, test_loss: 1.0536, test_f1: 0.4826
 epoch: 8, train_loss: 1.0619, test_loss: 1.0384, test_f1: 0.4779
 epoch: 9, train_loss: 1.0574, test_loss: 1.0358, test_f1: 0.4783
 epoch: 10, train_loss: 1.0366, test_loss: 1.0237, test_f1: 0.4902
 epoch: 11, train_loss: 1.0223, test_loss: 1.0227, test_f1: 0.4700
 epoch: 12, train_loss: 1.0051, test_loss: 1.0350, test_f1: 0.4479
 epoch: 13, train_loss: 0.9865, test_loss: 1.0033, test_f1: 0.5025
 epoch: 14, train_loss: 0.9806, test_loss: 1.0068, test_f1: 0.4625
 epoch: 15, train_loss: 0.9614, test_loss: 1.0117, test_f1: 0.4857
 epoch: 16, train_loss: 0.9612, test_loss: 0.9942, test_f1: 0.4914
 epoch: 17, train_loss: 0.9416, test_loss: 0.9905, test_f1: 0.5072
 epoch: 18, train_loss: 0.9291, test_loss: 0.9855, test_f1: 0.4809
 epoch: 19, train_loss: 0.9210, test_loss: 0.9822, test_f1: 0.4957
 epoch: 20, train_loss: 0.9086, test_loss: 0.9619, test_f1: 0.4921
 epoch: 21, train_loss: 0.8939, test_loss: 0.9845, test_f1: 0.4925
 epoch: 22, train_loss: 0.8820, test_loss: 0.9628, test_f1: 0.5040
 epoch: 23, train_loss: 0.8796, test_loss: 0.9687, test_f1: 0.4945
 epoch: 24, train_loss: 0.8564, test_loss: 0.9859, test_f1: 0.4889
 epoch: 25, train_loss: 0.8493, test_loss: 0.9852, test_f1: 0.5101
 epoch: 26, train_loss: 0.8518, test_loss: 0.9677, test_f1: 0.5097
 epoch: 27, train_loss: 0.8297, test_loss: 0.9679, test_f1: 0.5062
 epoch: 28, train_loss: 0.8291, test_loss: 0.9887, test_f1: 0.4933
 epoch: 29, train_loss: 0.8142, test_loss: 1.0214, test_f1: 0.4882
 epoch: 30, train_loss: 0.8154, test_loss: 1.0138, test_f1: 0.5145
 epoch: 31, train_loss: 0.7965, test_loss: 1.0065, test_f1: 0.5099
 epoch: 32, train_loss: 0.7720, test_loss: 1.0214, test_f1: 0.5316
 epoch: 33, train_loss: 0.7790, test_loss: 1.0449, test_f1: 0.5145
 epoch: 34, train_loss: 0.7711, test_loss: 1.0250, test_f1: 0.5126
 epoch: 35, train_loss: 0.7499, test_loss: 1.0561, test_f1: 0.5087
 epoch: 36, train_loss: 0.7523, test_loss: 1.0711, test_f1: 0.5176
 epoch: 37, train_loss: 0.7473, test_loss: 1.0090, test_f1: 0.5594
 epoch: 38, train_loss: 0.7256, test_loss: 1.0603, test_f1: 0.5244
 epoch: 39, train_loss: 0.7282, test_loss: 1.0938, test_f1: 0.5254
 epoch: 40, train_loss: 0.7373, test_loss: 1.1069, test_f1: 0.5174
 epoch: 41, train_loss: 0.7156, test_loss: 1.1056, test_f1: 0.5194
 epoch: 42, train_loss: 0.6992, test_loss: 1.0993, test_f1: 0.5322
 epoch: 43, train_loss: 0.7009, test_loss: 1.1245, test_f1: 0.5154
 epoch: 44, train_loss: 0.6971, test_loss: 1.1010, test_f1: 0.5475
 epoch: 45, train_loss: 0.6728, test_loss: 1.1337, test_f1: 0.5226
 epoch: 46, train_loss: 0.6850, test_loss: 1.1106, test_f1: 0.5347
 epoch: 47, train_loss: 0.6668, test_loss: 1.1460, test_f1: 0.5363
 epoch: 48, train_loss: 0.6588, test_loss: 1.1257, test_f1: 0.5325
 epoch: 49, train_loss: 0.6506, test_loss: 1.1475, test_f1: 0.5415
 epoch: 50, train_loss: 0.6480, test_loss: 1.1993, test_f1: 0.5287
 epoch: 51, train_loss: 0.6214, test_loss: 1.1795, test_f1: 0.5356
 epoch: 52, train_loss: 0.6282, test_loss: 1.1769, test_f1: 0.5355
 epoch: 53, train_loss: 0.6273, test_loss: 1.1518, test_f1: 0.5457
 epoch: 54, train_loss: 0.6148, test_loss: 1.1851, test_f1: 0.5464
 epoch: 55, train_loss: 0.6074, test_loss: 1.1814, test_f1: 0.5429
 epoch: 56, train_loss: 0.6200, test_loss: 1.1745, test_f1: 0.5399
 epoch: 57, train_loss: 0.6064, test_loss: 1.2395, test_f1: 0.5467
 epoch: 58, train_loss: 0.5997, test_loss: 1.2422, test_f1: 0.5328
 epoch: 59, train_loss: 0.6091, test_loss: 1.2113, test_f1: 0.5441
 epoch: 60, train_loss: 0.6001, test_loss: 1.1899, test_f1: 0.5551
 epoch: 61, train_loss: 0.5876, test_loss: 1.2132, test_f1: 0.5412
 epoch: 62, train_loss: 0.5826, test_loss: 1.1903, test_f1: 0.5496
 epoch: 63, train_loss: 0.5815, test_loss: 1.2176, test_f1: 0.5510
 epoch: 64, train_loss: 0.5853, test_loss: 1.2658, test_f1: 0.5371
 epoch: 65, train_loss: 0.5893, test_loss: 1.2573, test_f1: 0.5363
 epoch: 66, train_loss: 0.5926, test_loss: 1.2707, test_f1: 0.5279
 epoch: 67, train_loss: 0.5753, test_loss: 1.2241, test_f1: 0.5346
 epoch: 68, train_loss: 0.5649, test_loss: 1.2410, test_f1: 0.5207
 epoch: 69, train_loss: 0.5825, test_loss: 1.2549, test_f1: 0.5407
 epoch: 70, train_loss: 0.5692, test_loss: 1.2534, test_f1: 0.5510
 epoch: 71, train_loss: 0.5614, test_loss: 1.2849, test_f1: 0.5498
 epoch: 72, train_loss: 0.5558, test_loss: 1.2795, test_f1: 0.5448
 epoch: 73, train_loss: 0.5602, test_loss: 1.3180, test_f1: 0.5412
 epoch: 74, train_loss: 0.5699, test_loss: 1.2885, test_f1: 0.5328
 epoch: 75, train_loss: 0.5567, test_loss: 1.2947, test_f1: 0.5381
 epoch: 76, train_loss: 0.5482, test_loss: 1.3000, test_f1: 0.5682
 epoch: 77, train_loss: 0.5472, test_loss: 1.3030, test_f1: 0.5493
 epoch: 78, train_loss: 0.5374, test_loss: 1.2989, test_f1: 0.5613
 epoch: 79, train_loss: 0.5425, test_loss: 1.3159, test_f1: 0.5630
 epoch: 80, train_loss: 0.5231, test_loss: 1.3418, test_f1: 0.5420
 epoch: 81, train_loss: 0.5421, test_loss: 1.3339, test_f1: 0.5590
 epoch: 82, train_loss: 0.5359, test_loss: 1.3398, test_f1: 0.5534
 epoch: 83, train_loss: 0.5288, test_loss: 1.3189, test_f1: 0.5539
 epoch: 84, train_loss: 0.5274, test_loss: 1.3780, test_f1: 0.5415
 epoch: 85, train_loss: 0.5214, test_loss: 1.3741, test_f1: 0.5424
 epoch: 86, train_loss: 0.5121, test_loss: 1.3742, test_f1: 0.5394
 epoch: 87, train_loss: 0.5110, test_loss: 1.3756, test_f1: 0.5496
 epoch: 88, train_loss: 0.5111, test_loss: 1.3765, test_f1: 0.5360
 epoch: 89, train_loss: 0.5291, test_loss: 1.3880, test_f1: 0.5672
 epoch: 90, train_loss: 0.5128, test_loss: 1.3863, test_f1: 0.5426
 epoch: 91, train_loss: 0.5077, test_loss: 1.3998, test_f1: 0.5489
 epoch: 92, train_loss: 0.5049, test_loss: 1.4259, test_f1: 0.5664
 epoch: 93, train_loss: 0.5224, test_loss: 1.3986, test_f1: 0.5523
 epoch: 94, train_loss: 0.5014, test_loss: 1.4130, test_f1: 0.5599
 epoch: 95, train_loss: 0.4840, test_loss: 1.4286, test_f1: 0.5536
 epoch: 96, train_loss: 0.5231, test_loss: 1.4140, test_f1: 0.5689
 epoch: 97, train_loss: 0.4968, test_loss: 1.4526, test_f1: 0.5673
 epoch: 98, train_loss: 0.4853, test_loss: 1.4411, test_f1: 0.5507
 epoch: 99, train_loss: 0.4924, test_loss: 1.4580, test_f1: 0.5620
##################ITERATION #6 ****************************************
 epoch: 0, train_loss: 1.3340, test_loss: 1.2634, test_f1: 0.2555
 epoch: 1, train_loss: 1.2166, test_loss: 1.1893, test_f1: 0.3664
 epoch: 2, train_loss: 1.1898, test_loss: 1.1531, test_f1: 0.4396
 epoch: 3, train_loss: 1.1527, test_loss: 1.1382, test_f1: 0.4468
 epoch: 4, train_loss: 1.1359, test_loss: 1.1180, test_f1: 0.4287
 epoch: 5, train_loss: 1.1253, test_loss: 1.1121, test_f1: 0.4337
 epoch: 6, train_loss: 1.1072, test_loss: 1.0994, test_f1: 0.4380
 epoch: 7, train_loss: 1.0922, test_loss: 1.0844, test_f1: 0.4547
 epoch: 8, train_loss: 1.0790, test_loss: 1.0790, test_f1: 0.4488
 epoch: 9, train_loss: 1.0541, test_loss: 1.0864, test_f1: 0.4409
 epoch: 10, train_loss: 1.0499, test_loss: 1.0754, test_f1: 0.4533
 epoch: 11, train_loss: 1.0332, test_loss: 1.0523, test_f1: 0.4645
 epoch: 12, train_loss: 1.0312, test_loss: 1.0509, test_f1: 0.4507
 epoch: 13, train_loss: 1.0214, test_loss: 1.0550, test_f1: 0.4608
 epoch: 14, train_loss: 1.0064, test_loss: 1.0392, test_f1: 0.4494
 epoch: 15, train_loss: 0.9858, test_loss: 1.0458, test_f1: 0.4662
 epoch: 16, train_loss: 0.9815, test_loss: 1.0396, test_f1: 0.4585
 epoch: 17, train_loss: 0.9629, test_loss: 1.0388, test_f1: 0.4664
 epoch: 18, train_loss: 0.9583, test_loss: 1.0297, test_f1: 0.4841
 epoch: 19, train_loss: 0.9435, test_loss: 1.0344, test_f1: 0.4581
 epoch: 20, train_loss: 0.9478, test_loss: 1.0311, test_f1: 0.4654
 epoch: 21, train_loss: 0.9317, test_loss: 1.0550, test_f1: 0.5197
 epoch: 22, train_loss: 0.9342, test_loss: 1.0259, test_f1: 0.4774
 epoch: 23, train_loss: 0.9200, test_loss: 1.0442, test_f1: 0.4831
 epoch: 24, train_loss: 0.9060, test_loss: 1.0397, test_f1: 0.4851
 epoch: 25, train_loss: 0.8948, test_loss: 1.0406, test_f1: 0.4829
 epoch: 26, train_loss: 0.8988, test_loss: 1.0478, test_f1: 0.4932
 epoch: 27, train_loss: 0.8845, test_loss: 1.0504, test_f1: 0.4980
 epoch: 28, train_loss: 0.8716, test_loss: 1.0666, test_f1: 0.4885
 epoch: 29, train_loss: 0.8609, test_loss: 1.0608, test_f1: 0.4886
 epoch: 30, train_loss: 0.8489, test_loss: 1.0471, test_f1: 0.4845
 epoch: 31, train_loss: 0.8425, test_loss: 1.0610, test_f1: 0.4889
 epoch: 32, train_loss: 0.8266, test_loss: 1.0954, test_f1: 0.4927
 epoch: 33, train_loss: 0.8139, test_loss: 1.0854, test_f1: 0.4927
 epoch: 34, train_loss: 0.8160, test_loss: 1.1071, test_f1: 0.4939
 epoch: 35, train_loss: 0.8058, test_loss: 1.0959, test_f1: 0.5085
 epoch: 36, train_loss: 0.8023, test_loss: 1.1053, test_f1: 0.5096
 epoch: 37, train_loss: 0.7960, test_loss: 1.0996, test_f1: 0.5054
 epoch: 38, train_loss: 0.7733, test_loss: 1.1022, test_f1: 0.5084
 epoch: 39, train_loss: 0.7922, test_loss: 1.1284, test_f1: 0.4972
 epoch: 40, train_loss: 0.7779, test_loss: 1.1081, test_f1: 0.5205
 epoch: 41, train_loss: 0.7641, test_loss: 1.1210, test_f1: 0.5127
 epoch: 42, train_loss: 0.7588, test_loss: 1.1268, test_f1: 0.5023
 epoch: 43, train_loss: 0.7389, test_loss: 1.1499, test_f1: 0.4894
 epoch: 44, train_loss: 0.7388, test_loss: 1.1542, test_f1: 0.4991
 epoch: 45, train_loss: 0.7265, test_loss: 1.1842, test_f1: 0.4981
 epoch: 46, train_loss: 0.7328, test_loss: 1.1501, test_f1: 0.5253
 epoch: 47, train_loss: 0.7224, test_loss: 1.1695, test_f1: 0.5058
 epoch: 48, train_loss: 0.7143, test_loss: 1.1599, test_f1: 0.4947
 epoch: 49, train_loss: 0.6911, test_loss: 1.1435, test_f1: 0.4983
 epoch: 50, train_loss: 0.7064, test_loss: 1.1884, test_f1: 0.5009
 epoch: 51, train_loss: 0.6843, test_loss: 1.1425, test_f1: 0.5163
 epoch: 52, train_loss: 0.6778, test_loss: 1.1697, test_f1: 0.5277
 epoch: 53, train_loss: 0.6682, test_loss: 1.1950, test_f1: 0.5145
 epoch: 54, train_loss: 0.6721, test_loss: 1.1712, test_f1: 0.5201
 epoch: 55, train_loss: 0.6652, test_loss: 1.2213, test_f1: 0.5159
 epoch: 56, train_loss: 0.6492, test_loss: 1.2340, test_f1: 0.5050
 epoch: 57, train_loss: 0.6445, test_loss: 1.1898, test_f1: 0.5066
 epoch: 58, train_loss: 0.6426, test_loss: 1.2267, test_f1: 0.5087
 epoch: 59, train_loss: 0.6503, test_loss: 1.2277, test_f1: 0.5170
 epoch: 60, train_loss: 0.6308, test_loss: 1.2534, test_f1: 0.4970
 epoch: 61, train_loss: 0.6430, test_loss: 1.2291, test_f1: 0.5050
 epoch: 62, train_loss: 0.6228, test_loss: 1.2379, test_f1: 0.5165
 epoch: 63, train_loss: 0.6332, test_loss: 1.2466, test_f1: 0.5188
 epoch: 64, train_loss: 0.6226, test_loss: 1.2482, test_f1: 0.5230
 epoch: 65, train_loss: 0.6292, test_loss: 1.2382, test_f1: 0.5074
 epoch: 66, train_loss: 0.6233, test_loss: 1.2518, test_f1: 0.5110
 epoch: 67, train_loss: 0.5932, test_loss: 1.2318, test_f1: 0.5228
 epoch: 68, train_loss: 0.6028, test_loss: 1.2630, test_f1: 0.5209
 epoch: 69, train_loss: 0.6280, test_loss: 1.2619, test_f1: 0.5174
 epoch: 70, train_loss: 0.5939, test_loss: 1.2783, test_f1: 0.5065
 epoch: 71, train_loss: 0.5958, test_loss: 1.2591, test_f1: 0.5105
 epoch: 72, train_loss: 0.6063, test_loss: 1.2961, test_f1: 0.5120
 epoch: 73, train_loss: 0.6149, test_loss: 1.2594, test_f1: 0.5190
 epoch: 74, train_loss: 0.5763, test_loss: 1.2907, test_f1: 0.5134
 epoch: 75, train_loss: 0.5856, test_loss: 1.3127, test_f1: 0.5199
 epoch: 76, train_loss: 0.6007, test_loss: 1.3102, test_f1: 0.5222
 epoch: 77, train_loss: 0.5714, test_loss: 1.3528, test_f1: 0.5256
 epoch: 78, train_loss: 0.5860, test_loss: 1.3174, test_f1: 0.5134
 epoch: 79, train_loss: 0.5767, test_loss: 1.3225, test_f1: 0.5321
 epoch: 80, train_loss: 0.5798, test_loss: 1.3463, test_f1: 0.5325
 epoch: 81, train_loss: 0.5757, test_loss: 1.3274, test_f1: 0.5281
 epoch: 82, train_loss: 0.5687, test_loss: 1.3553, test_f1: 0.5252
 epoch: 83, train_loss: 0.5635, test_loss: 1.3544, test_f1: 0.5346
 epoch: 84, train_loss: 0.5607, test_loss: 1.3243, test_f1: 0.5188
 epoch: 85, train_loss: 0.5488, test_loss: 1.3292, test_f1: 0.5159
 epoch: 86, train_loss: 0.5537, test_loss: 1.3565, test_f1: 0.5447
 epoch: 87, train_loss: 0.5696, test_loss: 1.3541, test_f1: 0.5377
 epoch: 88, train_loss: 0.5664, test_loss: 1.3808, test_f1: 0.5299
 epoch: 89, train_loss: 0.5479, test_loss: 1.3738, test_f1: 0.5320
 epoch: 90, train_loss: 0.5627, test_loss: 1.3762, test_f1: 0.5278
 epoch: 91, train_loss: 0.5591, test_loss: 1.3729, test_f1: 0.5352
 epoch: 92, train_loss: 0.5510, test_loss: 1.4309, test_f1: 0.5305
 epoch: 93, train_loss: 0.5373, test_loss: 1.3969, test_f1: 0.5260
 epoch: 94, train_loss: 0.5328, test_loss: 1.3826, test_f1: 0.5551
 epoch: 95, train_loss: 0.5443, test_loss: 1.4205, test_f1: 0.5296
 epoch: 96, train_loss: 0.5207, test_loss: 1.4234, test_f1: 0.5479
 epoch: 97, train_loss: 0.5335, test_loss: 1.3940, test_f1: 0.5372
 epoch: 98, train_loss: 0.5292, test_loss: 1.4152, test_f1: 0.5336
 epoch: 99, train_loss: 0.5299, test_loss: 1.4778, test_f1: 0.5389
##################ITERATION #7 ****************************************
 epoch: 0, train_loss: 1.3402, test_loss: 1.2650, test_f1: 0.2936
 epoch: 1, train_loss: 1.2456, test_loss: 1.2041, test_f1: 0.4139
 epoch: 2, train_loss: 1.2288, test_loss: 1.1692, test_f1: 0.4528
 epoch: 3, train_loss: 1.1827, test_loss: 1.1494, test_f1: 0.4513
 epoch: 4, train_loss: 1.1655, test_loss: 1.2007, test_f1: 0.4586
 epoch: 5, train_loss: 1.1529, test_loss: 1.1464, test_f1: 0.4359
 epoch: 6, train_loss: 1.1307, test_loss: 1.1172, test_f1: 0.4566
 epoch: 7, train_loss: 1.1212, test_loss: 1.2256, test_f1: 0.4443
 epoch: 8, train_loss: 1.0967, test_loss: 1.1524, test_f1: 0.4500
 epoch: 9, train_loss: 1.0931, test_loss: 1.0800, test_f1: 0.4348
 epoch: 10, train_loss: 1.0801, test_loss: 1.0672, test_f1: 0.4456
 epoch: 11, train_loss: 1.0683, test_loss: 1.2487, test_f1: 0.4532
 epoch: 12, train_loss: 1.0651, test_loss: 1.0633, test_f1: 0.4697
 epoch: 13, train_loss: 1.0508, test_loss: 1.0805, test_f1: 0.4728
 epoch: 14, train_loss: 1.0414, test_loss: 1.1620, test_f1: 0.4733
 epoch: 15, train_loss: 1.0288, test_loss: 1.0362, test_f1: 0.4608
 epoch: 16, train_loss: 1.0175, test_loss: 1.0336, test_f1: 0.4405
 epoch: 17, train_loss: 1.0140, test_loss: 1.0228, test_f1: 0.4519
 epoch: 18, train_loss: 0.9869, test_loss: 1.0286, test_f1: 0.4355
 epoch: 19, train_loss: 0.9961, test_loss: 1.0287, test_f1: 0.4404
 epoch: 20, train_loss: 0.9834, test_loss: 1.0010, test_f1: 0.4716
 epoch: 21, train_loss: 0.9749, test_loss: 1.0098, test_f1: 0.4839
 epoch: 22, train_loss: 0.9734, test_loss: 1.0125, test_f1: 0.4676
 epoch: 23, train_loss: 0.9645, test_loss: 0.9920, test_f1: 0.4701
 epoch: 24, train_loss: 0.9523, test_loss: 1.0106, test_f1: 0.4763
 epoch: 25, train_loss: 0.9462, test_loss: 1.0213, test_f1: 0.4704
 epoch: 26, train_loss: 0.9430, test_loss: 1.0399, test_f1: 0.4572
 epoch: 27, train_loss: 0.9309, test_loss: 1.0053, test_f1: 0.4821
 epoch: 28, train_loss: 0.9178, test_loss: 1.0069, test_f1: 0.4755
 epoch: 29, train_loss: 0.9027, test_loss: 1.0091, test_f1: 0.4744
 epoch: 30, train_loss: 0.8965, test_loss: 1.0199, test_f1: 0.4787
 epoch: 31, train_loss: 0.8901, test_loss: 1.0224, test_f1: 0.4732
 epoch: 32, train_loss: 0.8874, test_loss: 1.0183, test_f1: 0.4966
 epoch: 33, train_loss: 0.8854, test_loss: 1.0262, test_f1: 0.4752
 epoch: 34, train_loss: 0.8738, test_loss: 1.0542, test_f1: 0.4908
 epoch: 35, train_loss: 0.8705, test_loss: 1.0235, test_f1: 0.4837
 epoch: 36, train_loss: 0.8675, test_loss: 1.0643, test_f1: 0.4717
 epoch: 37, train_loss: 0.8617, test_loss: 1.0770, test_f1: 0.4603
 epoch: 38, train_loss: 0.8562, test_loss: 1.0279, test_f1: 0.4796
 epoch: 39, train_loss: 0.8422, test_loss: 1.0214, test_f1: 0.4776
 epoch: 40, train_loss: 0.8276, test_loss: 1.0420, test_f1: 0.4766
 epoch: 41, train_loss: 0.8278, test_loss: 1.0717, test_f1: 0.5025
 epoch: 42, train_loss: 0.8209, test_loss: 1.0893, test_f1: 0.4673
 epoch: 43, train_loss: 0.8214, test_loss: 1.0088, test_f1: 0.5026
 epoch: 44, train_loss: 0.8136, test_loss: 1.0792, test_f1: 0.4861
 epoch: 45, train_loss: 0.7936, test_loss: 1.0687, test_f1: 0.4969
 epoch: 46, train_loss: 0.8050, test_loss: 1.1334, test_f1: 0.4818
 epoch: 47, train_loss: 0.7924, test_loss: 1.0582, test_f1: 0.4863
 epoch: 48, train_loss: 0.7808, test_loss: 1.0834, test_f1: 0.4794
 epoch: 49, train_loss: 0.7859, test_loss: 1.0895, test_f1: 0.5003
 epoch: 50, train_loss: 0.7739, test_loss: 1.1227, test_f1: 0.4911
 epoch: 51, train_loss: 0.7639, test_loss: 1.0899, test_f1: 0.4863
 epoch: 52, train_loss: 0.7549, test_loss: 1.0944, test_f1: 0.4953
 epoch: 53, train_loss: 0.7491, test_loss: 1.1195, test_f1: 0.4890
 epoch: 54, train_loss: 0.7523, test_loss: 1.1575, test_f1: 0.4982
 epoch: 55, train_loss: 0.7331, test_loss: 1.0987, test_f1: 0.5013
 epoch: 56, train_loss: 0.7428, test_loss: 1.0997, test_f1: 0.4928
 epoch: 57, train_loss: 0.7359, test_loss: 1.1077, test_f1: 0.5013
 epoch: 58, train_loss: 0.7326, test_loss: 1.1361, test_f1: 0.4889
 epoch: 59, train_loss: 0.7258, test_loss: 1.1257, test_f1: 0.4970
 epoch: 60, train_loss: 0.7308, test_loss: 1.1507, test_f1: 0.4889
 epoch: 61, train_loss: 0.7264, test_loss: 1.1417, test_f1: 0.4956
 epoch: 62, train_loss: 0.7329, test_loss: 1.1605, test_f1: 0.4887
 epoch: 63, train_loss: 0.7149, test_loss: 1.1909, test_f1: 0.5022
 epoch: 64, train_loss: 0.7142, test_loss: 1.1803, test_f1: 0.4981
 epoch: 65, train_loss: 0.7004, test_loss: 1.2007, test_f1: 0.5102
 epoch: 66, train_loss: 0.7021, test_loss: 1.1621, test_f1: 0.5046
 epoch: 67, train_loss: 0.6990, test_loss: 1.1815, test_f1: 0.4939
 epoch: 68, train_loss: 0.6914, test_loss: 1.2047, test_f1: 0.5049
 epoch: 69, train_loss: 0.6921, test_loss: 1.2215, test_f1: 0.4945
 epoch: 70, train_loss: 0.6793, test_loss: 1.1993, test_f1: 0.5022
 epoch: 71, train_loss: 0.6789, test_loss: 1.2095, test_f1: 0.4985
 epoch: 72, train_loss: 0.6743, test_loss: 1.2352, test_f1: 0.5108
 epoch: 73, train_loss: 0.6889, test_loss: 1.2396, test_f1: 0.4877
 epoch: 74, train_loss: 0.6946, test_loss: 1.2027, test_f1: 0.5027
 epoch: 75, train_loss: 0.6725, test_loss: 1.2437, test_f1: 0.5056
 epoch: 76, train_loss: 0.6622, test_loss: 1.2893, test_f1: 0.5134
 epoch: 77, train_loss: 0.6649, test_loss: 1.2641, test_f1: 0.5034
 epoch: 78, train_loss: 0.6803, test_loss: 1.2067, test_f1: 0.5088
 epoch: 79, train_loss: 0.6663, test_loss: 1.2330, test_f1: 0.5194
 epoch: 80, train_loss: 0.6468, test_loss: 1.2722, test_f1: 0.5116
 epoch: 81, train_loss: 0.6585, test_loss: 1.3037, test_f1: 0.5040
 epoch: 82, train_loss: 0.6590, test_loss: 1.3003, test_f1: 0.5054
 epoch: 83, train_loss: 0.6592, test_loss: 1.3665, test_f1: 0.5144
 epoch: 84, train_loss: 0.6520, test_loss: 1.3618, test_f1: 0.5090
 epoch: 85, train_loss: 0.6389, test_loss: 1.3225, test_f1: 0.5089
 epoch: 86, train_loss: 0.6437, test_loss: 1.3329, test_f1: 0.5043
 epoch: 87, train_loss: 0.6502, test_loss: 1.3952, test_f1: 0.5084
 epoch: 88, train_loss: 0.6499, test_loss: 1.3483, test_f1: 0.5132
 epoch: 89, train_loss: 0.6309, test_loss: 1.2916, test_f1: 0.5025
 epoch: 90, train_loss: 0.6342, test_loss: 1.3702, test_f1: 0.5087
 epoch: 91, train_loss: 0.6168, test_loss: 1.3767, test_f1: 0.5133
 epoch: 92, train_loss: 0.6168, test_loss: 1.3607, test_f1: 0.5055
 epoch: 93, train_loss: 0.6147, test_loss: 1.3819, test_f1: 0.5147
 epoch: 94, train_loss: 0.6255, test_loss: 1.3419, test_f1: 0.5176
 epoch: 95, train_loss: 0.6227, test_loss: 1.3658, test_f1: 0.5235
 epoch: 96, train_loss: 0.6293, test_loss: 1.4134, test_f1: 0.5140
 epoch: 97, train_loss: 0.6126, test_loss: 1.3408, test_f1: 0.5137
 epoch: 98, train_loss: 0.6063, test_loss: 1.3385, test_f1: 0.5198
 epoch: 99, train_loss: 0.6083, test_loss: 1.4339, test_f1: 0.5102
##################ITERATION #8 ****************************************
 epoch: 0, train_loss: 1.3455, test_loss: 1.2371, test_f1: 0.2928
 epoch: 1, train_loss: 1.2298, test_loss: 1.1672, test_f1: 0.4598
 epoch: 2, train_loss: 1.1949, test_loss: 1.1309, test_f1: 0.4427
 epoch: 3, train_loss: 1.1540, test_loss: 1.1136, test_f1: 0.4561
 epoch: 4, train_loss: 1.1340, test_loss: 1.1022, test_f1: 0.4406
 epoch: 5, train_loss: 1.1257, test_loss: 1.0799, test_f1: 0.4437
 epoch: 6, train_loss: 1.1216, test_loss: 1.0848, test_f1: 0.4532
 epoch: 7, train_loss: 1.0846, test_loss: 1.1004, test_f1: 0.4215
 epoch: 8, train_loss: 1.0784, test_loss: 1.0885, test_f1: 0.4305
 epoch: 9, train_loss: 1.0574, test_loss: 1.0688, test_f1: 0.4316
 epoch: 10, train_loss: 1.0560, test_loss: 1.0561, test_f1: 0.4244
 epoch: 11, train_loss: 1.0387, test_loss: 1.0750, test_f1: 0.4240
 epoch: 12, train_loss: 1.0219, test_loss: 1.0556, test_f1: 0.4475
 epoch: 13, train_loss: 1.0134, test_loss: 1.0346, test_f1: 0.4531
 epoch: 14, train_loss: 1.0093, test_loss: 1.0402, test_f1: 0.4456
 epoch: 15, train_loss: 0.9905, test_loss: 1.0461, test_f1: 0.4426
 epoch: 16, train_loss: 0.9719, test_loss: 1.0363, test_f1: 0.4556
 epoch: 17, train_loss: 0.9763, test_loss: 1.0366, test_f1: 0.4623
 epoch: 18, train_loss: 0.9652, test_loss: 1.0281, test_f1: 0.4547
 epoch: 19, train_loss: 0.9493, test_loss: 1.0448, test_f1: 0.4649
 epoch: 20, train_loss: 0.9449, test_loss: 1.0336, test_f1: 0.4643
 epoch: 21, train_loss: 0.9341, test_loss: 1.0195, test_f1: 0.4617
 epoch: 22, train_loss: 0.9426, test_loss: 1.0061, test_f1: 0.4710
 epoch: 23, train_loss: 0.9187, test_loss: 1.0187, test_f1: 0.4794
 epoch: 24, train_loss: 0.9154, test_loss: 1.0096, test_f1: 0.4877
 epoch: 25, train_loss: 0.9007, test_loss: 1.0183, test_f1: 0.4748
 epoch: 26, train_loss: 0.9025, test_loss: 1.0266, test_f1: 0.4797
 epoch: 27, train_loss: 0.8824, test_loss: 1.0157, test_f1: 0.4920
 epoch: 28, train_loss: 0.8821, test_loss: 1.0451, test_f1: 0.4765
 epoch: 29, train_loss: 0.8696, test_loss: 1.0397, test_f1: 0.4776
 epoch: 30, train_loss: 0.8518, test_loss: 1.0354, test_f1: 0.4947
 epoch: 31, train_loss: 0.8577, test_loss: 1.0424, test_f1: 0.4872
 epoch: 32, train_loss: 0.8484, test_loss: 1.0237, test_f1: 0.5073
 epoch: 33, train_loss: 0.8411, test_loss: 1.0541, test_f1: 0.4935
 epoch: 34, train_loss: 0.8217, test_loss: 1.0326, test_f1: 0.5059
 epoch: 35, train_loss: 0.8173, test_loss: 1.0470, test_f1: 0.4839
 epoch: 36, train_loss: 0.8125, test_loss: 1.0302, test_f1: 0.5158
 epoch: 37, train_loss: 0.8016, test_loss: 1.0451, test_f1: 0.5039
 epoch: 38, train_loss: 0.7949, test_loss: 1.0413, test_f1: 0.5118
 epoch: 39, train_loss: 0.7992, test_loss: 1.0110, test_f1: 0.5185
 epoch: 40, train_loss: 0.7911, test_loss: 1.0396, test_f1: 0.5182
 epoch: 41, train_loss: 0.7761, test_loss: 1.0579, test_f1: 0.5174
 epoch: 42, train_loss: 0.7721, test_loss: 1.0856, test_f1: 0.5183
 epoch: 43, train_loss: 0.7691, test_loss: 1.0333, test_f1: 0.5325
 epoch: 44, train_loss: 0.7629, test_loss: 1.0615, test_f1: 0.5255
 epoch: 45, train_loss: 0.7494, test_loss: 1.0929, test_f1: 0.5139
 epoch: 46, train_loss: 0.7338, test_loss: 1.0782, test_f1: 0.5356
 epoch: 47, train_loss: 0.7303, test_loss: 1.0807, test_f1: 0.5233
 epoch: 48, train_loss: 0.7550, test_loss: 1.0875, test_f1: 0.5194
 epoch: 49, train_loss: 0.7400, test_loss: 1.1194, test_f1: 0.5103
 epoch: 50, train_loss: 0.7150, test_loss: 1.1074, test_f1: 0.5369
 epoch: 51, train_loss: 0.7178, test_loss: 1.0805, test_f1: 0.5224
 epoch: 52, train_loss: 0.6904, test_loss: 1.0988, test_f1: 0.5180
 epoch: 53, train_loss: 0.7009, test_loss: 1.1024, test_f1: 0.5339
 epoch: 54, train_loss: 0.6809, test_loss: 1.0920, test_f1: 0.5186
 epoch: 55, train_loss: 0.6805, test_loss: 1.1206, test_f1: 0.5354
 epoch: 56, train_loss: 0.6918, test_loss: 1.1225, test_f1: 0.5298
 epoch: 57, train_loss: 0.6795, test_loss: 1.0976, test_f1: 0.5157
 epoch: 58, train_loss: 0.6736, test_loss: 1.1501, test_f1: 0.5270
 epoch: 59, train_loss: 0.6685, test_loss: 1.1311, test_f1: 0.5089
 epoch: 60, train_loss: 0.6641, test_loss: 1.1385, test_f1: 0.5231
 epoch: 61, train_loss: 0.6657, test_loss: 1.1468, test_f1: 0.5159
 epoch: 62, train_loss: 0.6596, test_loss: 1.1212, test_f1: 0.5323
 epoch: 63, train_loss: 0.6537, test_loss: 1.1424, test_f1: 0.5159
 epoch: 64, train_loss: 0.6660, test_loss: 1.1923, test_f1: 0.5024
 epoch: 65, train_loss: 0.6672, test_loss: 1.1466, test_f1: 0.5227
 epoch: 66, train_loss: 0.6663, test_loss: 1.1424, test_f1: 0.5198
 epoch: 67, train_loss: 0.6533, test_loss: 1.1609, test_f1: 0.5305
 epoch: 68, train_loss: 0.6380, test_loss: 1.1813, test_f1: 0.5158
 epoch: 69, train_loss: 0.6424, test_loss: 1.1442, test_f1: 0.5293
 epoch: 70, train_loss: 0.6332, test_loss: 1.1927, test_f1: 0.5250
 epoch: 71, train_loss: 0.6178, test_loss: 1.1725, test_f1: 0.5210
 epoch: 72, train_loss: 0.6350, test_loss: 1.1908, test_f1: 0.5107
 epoch: 73, train_loss: 0.6267, test_loss: 1.2042, test_f1: 0.5110
 epoch: 74, train_loss: 0.6184, test_loss: 1.2128, test_f1: 0.5068
 epoch: 75, train_loss: 0.6372, test_loss: 1.2193, test_f1: 0.5185
 epoch: 76, train_loss: 0.6125, test_loss: 1.2359, test_f1: 0.5002
 epoch: 77, train_loss: 0.5928, test_loss: 1.2369, test_f1: 0.5109
 epoch: 78, train_loss: 0.6215, test_loss: 1.2050, test_f1: 0.5194
 epoch: 79, train_loss: 0.6128, test_loss: 1.2212, test_f1: 0.5088
 epoch: 80, train_loss: 0.6198, test_loss: 1.2088, test_f1: 0.5184
 epoch: 81, train_loss: 0.6100, test_loss: 1.2398, test_f1: 0.5111
 epoch: 82, train_loss: 0.6152, test_loss: 1.2178, test_f1: 0.5163
 epoch: 83, train_loss: 0.6051, test_loss: 1.2174, test_f1: 0.5182
 epoch: 84, train_loss: 0.6051, test_loss: 1.2136, test_f1: 0.5130
 epoch: 85, train_loss: 0.5945, test_loss: 1.2654, test_f1: 0.5108
 epoch: 86, train_loss: 0.6059, test_loss: 1.2346, test_f1: 0.5174
 epoch: 87, train_loss: 0.5953, test_loss: 1.2340, test_f1: 0.5164
 epoch: 88, train_loss: 0.5720, test_loss: 1.2737, test_f1: 0.5009
 epoch: 89, train_loss: 0.5891, test_loss: 1.2286, test_f1: 0.5228
 epoch: 90, train_loss: 0.5807, test_loss: 1.2614, test_f1: 0.5173
 epoch: 91, train_loss: 0.5899, test_loss: 1.2600, test_f1: 0.5191
 epoch: 92, train_loss: 0.5781, test_loss: 1.2693, test_f1: 0.5103
 epoch: 93, train_loss: 0.5693, test_loss: 1.2826, test_f1: 0.5186
 epoch: 94, train_loss: 0.5847, test_loss: 1.3129, test_f1: 0.5078
 epoch: 95, train_loss: 0.5669, test_loss: 1.2877, test_f1: 0.5113
 epoch: 96, train_loss: 0.5865, test_loss: 1.2777, test_f1: 0.5203
 epoch: 97, train_loss: 0.5595, test_loss: 1.2845, test_f1: 0.5239
 epoch: 98, train_loss: 0.5705, test_loss: 1.3007, test_f1: 0.5192
 epoch: 99, train_loss: 0.5836, test_loss: 1.2963, test_f1: 0.5064
##################ITERATION #9 ****************************************
 epoch: 0, train_loss: 1.3579, test_loss: 1.2954, test_f1: 0.3287
 epoch: 1, train_loss: 1.2400, test_loss: 1.2155, test_f1: 0.4131
 epoch: 2, train_loss: 1.2080, test_loss: 1.1554, test_f1: 0.4522
 epoch: 3, train_loss: 1.1786, test_loss: 1.1313, test_f1: 0.4605
 epoch: 4, train_loss: 1.1561, test_loss: 1.1060, test_f1: 0.4706
 epoch: 5, train_loss: 1.1356, test_loss: 1.0872, test_f1: 0.4657
 epoch: 6, train_loss: 1.1059, test_loss: 1.0751, test_f1: 0.4568
 epoch: 7, train_loss: 1.0951, test_loss: 1.0594, test_f1: 0.4754
 epoch: 8, train_loss: 1.0836, test_loss: 1.0525, test_f1: 0.4863
 epoch: 9, train_loss: 1.0850, test_loss: 1.0555, test_f1: 0.4677
 epoch: 10, train_loss: 1.0537, test_loss: 1.0194, test_f1: 0.4638
 epoch: 11, train_loss: 1.0486, test_loss: 1.0253, test_f1: 0.4714
 epoch: 12, train_loss: 1.0515, test_loss: 1.0181, test_f1: 0.4787
 epoch: 13, train_loss: 1.0359, test_loss: 1.0053, test_f1: 0.4805
 epoch: 14, train_loss: 1.0401, test_loss: 1.0189, test_f1: 0.4818
 epoch: 15, train_loss: 1.0090, test_loss: 1.0112, test_f1: 0.4846
 epoch: 16, train_loss: 0.9950, test_loss: 1.0120, test_f1: 0.4785
 epoch: 17, train_loss: 0.9789, test_loss: 0.9860, test_f1: 0.5142
 epoch: 18, train_loss: 0.9686, test_loss: 1.0101, test_f1: 0.4926
 epoch: 19, train_loss: 0.9666, test_loss: 1.0048, test_f1: 0.4945
 epoch: 20, train_loss: 0.9545, test_loss: 0.9930, test_f1: 0.5129
 epoch: 21, train_loss: 0.9579, test_loss: 0.9868, test_f1: 0.5312
 epoch: 22, train_loss: 0.9415, test_loss: 0.9972, test_f1: 0.5088
 epoch: 23, train_loss: 0.9440, test_loss: 0.9923, test_f1: 0.4981
 epoch: 24, train_loss: 0.9232, test_loss: 0.9930, test_f1: 0.4890
 epoch: 25, train_loss: 0.9138, test_loss: 0.9932, test_f1: 0.5016
 epoch: 26, train_loss: 0.9053, test_loss: 0.9956, test_f1: 0.5205
 epoch: 27, train_loss: 0.8923, test_loss: 0.9959, test_f1: 0.5007
 epoch: 28, train_loss: 0.8779, test_loss: 0.9872, test_f1: 0.5129
 epoch: 29, train_loss: 0.8550, test_loss: 0.9709, test_f1: 0.5074
 epoch: 30, train_loss: 0.8787, test_loss: 0.9792, test_f1: 0.5040
 epoch: 31, train_loss: 0.8651, test_loss: 0.9858, test_f1: 0.5047
 epoch: 32, train_loss: 0.8518, test_loss: 0.9886, test_f1: 0.5244
 epoch: 33, train_loss: 0.8508, test_loss: 0.9833, test_f1: 0.5095
 epoch: 34, train_loss: 0.8288, test_loss: 0.9634, test_f1: 0.5209
 epoch: 35, train_loss: 0.8295, test_loss: 0.9696, test_f1: 0.5200
 epoch: 36, train_loss: 0.8249, test_loss: 1.0012, test_f1: 0.5149
 epoch: 37, train_loss: 0.8211, test_loss: 0.9998, test_f1: 0.5187
 epoch: 38, train_loss: 0.8016, test_loss: 1.0019, test_f1: 0.5189
 epoch: 39, train_loss: 0.7971, test_loss: 1.0255, test_f1: 0.4949
 epoch: 40, train_loss: 0.7817, test_loss: 1.0219, test_f1: 0.4952
 epoch: 41, train_loss: 0.7850, test_loss: 1.0425, test_f1: 0.4879
 epoch: 42, train_loss: 0.7784, test_loss: 1.0285, test_f1: 0.5125
 epoch: 43, train_loss: 0.7605, test_loss: 0.9756, test_f1: 0.5216
 epoch: 44, train_loss: 0.7631, test_loss: 1.0177, test_f1: 0.5193
 epoch: 45, train_loss: 0.7473, test_loss: 1.0592, test_f1: 0.5224
 epoch: 46, train_loss: 0.7528, test_loss: 1.0730, test_f1: 0.4975
 epoch: 47, train_loss: 0.7396, test_loss: 1.1291, test_f1: 0.4938
 epoch: 48, train_loss: 0.7311, test_loss: 1.0647, test_f1: 0.5124
 epoch: 49, train_loss: 0.7288, test_loss: 1.0402, test_f1: 0.5316
 epoch: 50, train_loss: 0.7027, test_loss: 1.0627, test_f1: 0.5326
 epoch: 51, train_loss: 0.7056, test_loss: 1.0802, test_f1: 0.5264
 epoch: 52, train_loss: 0.7043, test_loss: 1.0696, test_f1: 0.5312
 epoch: 53, train_loss: 0.6850, test_loss: 1.0503, test_f1: 0.5389
 epoch: 54, train_loss: 0.6834, test_loss: 1.0837, test_f1: 0.5248
 epoch: 55, train_loss: 0.6797, test_loss: 1.1091, test_f1: 0.5099
 epoch: 56, train_loss: 0.6791, test_loss: 1.0760, test_f1: 0.5208
 epoch: 57, train_loss: 0.6811, test_loss: 1.0754, test_f1: 0.5271
 epoch: 58, train_loss: 0.6789, test_loss: 1.0826, test_f1: 0.5383
 epoch: 59, train_loss: 0.6649, test_loss: 1.1125, test_f1: 0.5131
 epoch: 60, train_loss: 0.6673, test_loss: 1.1060, test_f1: 0.5256
 epoch: 61, train_loss: 0.6723, test_loss: 1.0835, test_f1: 0.5227
 epoch: 62, train_loss: 0.6647, test_loss: 1.1069, test_f1: 0.5388
 epoch: 63, train_loss: 0.6587, test_loss: 1.1180, test_f1: 0.5259
 epoch: 64, train_loss: 0.6507, test_loss: 1.1296, test_f1: 0.5361
 epoch: 65, train_loss: 0.6433, test_loss: 1.1281, test_f1: 0.5209
 epoch: 66, train_loss: 0.6465, test_loss: 1.1341, test_f1: 0.5366
 epoch: 67, train_loss: 0.6412, test_loss: 1.1040, test_f1: 0.5433
 epoch: 68, train_loss: 0.6389, test_loss: 1.1264, test_f1: 0.5383
 epoch: 69, train_loss: 0.6309, test_loss: 1.1329, test_f1: 0.5394
 epoch: 70, train_loss: 0.6409, test_loss: 1.1429, test_f1: 0.5351
 epoch: 71, train_loss: 0.6412, test_loss: 1.1252, test_f1: 0.5270
 epoch: 72, train_loss: 0.6424, test_loss: 1.1594, test_f1: 0.5236
 epoch: 73, train_loss: 0.6382, test_loss: 1.1883, test_f1: 0.5242
 epoch: 74, train_loss: 0.6208, test_loss: 1.1563, test_f1: 0.5395
 epoch: 75, train_loss: 0.6142, test_loss: 1.1574, test_f1: 0.5414
 epoch: 76, train_loss: 0.6066, test_loss: 1.1829, test_f1: 0.5269
 epoch: 77, train_loss: 0.6059, test_loss: 1.1786, test_f1: 0.5273
 epoch: 78, train_loss: 0.6138, test_loss: 1.1974, test_f1: 0.5324
 epoch: 79, train_loss: 0.6066, test_loss: 1.1705, test_f1: 0.5380
 epoch: 80, train_loss: 0.6035, test_loss: 1.1760, test_f1: 0.5450
 epoch: 81, train_loss: 0.6033, test_loss: 1.1986, test_f1: 0.5297
 epoch: 82, train_loss: 0.6042, test_loss: 1.1834, test_f1: 0.5438
 epoch: 83, train_loss: 0.5904, test_loss: 1.2846, test_f1: 0.5388
 epoch: 84, train_loss: 0.5838, test_loss: 1.2162, test_f1: 0.5356
 epoch: 85, train_loss: 0.5934, test_loss: 1.1841, test_f1: 0.5484
 epoch: 86, train_loss: 0.5976, test_loss: 1.1909, test_f1: 0.5298
 epoch: 87, train_loss: 0.5983, test_loss: 1.2217, test_f1: 0.5360
 epoch: 88, train_loss: 0.5715, test_loss: 1.1965, test_f1: 0.5500
 epoch: 89, train_loss: 0.5760, test_loss: 1.2244, test_f1: 0.5370
 epoch: 90, train_loss: 0.5831, test_loss: 1.2267, test_f1: 0.5284
 epoch: 91, train_loss: 0.5668, test_loss: 1.2307, test_f1: 0.5425
 epoch: 92, train_loss: 0.5770, test_loss: 1.2352, test_f1: 0.5251
 epoch: 93, train_loss: 0.5678, test_loss: 1.2123, test_f1: 0.5428
 epoch: 94, train_loss: 0.5629, test_loss: 1.2502, test_f1: 0.5357
 epoch: 95, train_loss: 0.5559, test_loss: 1.2436, test_f1: 0.5406
 epoch: 96, train_loss: 0.5428, test_loss: 1.2730, test_f1: 0.5336
 epoch: 97, train_loss: 0.5512, test_loss: 1.2988, test_f1: 0.5313
 epoch: 98, train_loss: 0.5567, test_loss: 1.2906, test_f1: 0.5257
 epoch: 99, train_loss: 0.5587, test_loss: 1.3278, test_f1: 0.5365

Training completed in 487.22 seconds
Best F1: 0.5724 at epoch 82
Mean F1 across iterations: 0.5489  0.0176
========================FINAL RESULTS================================
FEGIN weighted F1: 0.5724  0.0176
python main.py --data ltspice_examples --representation component_component --model FEGIN --layers 4 --hiddens 128 --batch_size 128 --lr 0.0001 --emb_size 128 --epochs 100 --save_appendix component_component_L4_H128_BS128_LR0.0001_E128 --no_val
-----



STDERR:
  File "main.py", line 370, in <module>
    main()
  File "main.py", line 254, in main
    dataset = dataset_class(
  File "/home/philip/projects/ltspice_examples_code_repo/Circuit-Completion-Using-GNNs/component_classification_with_link_prediction_head/evaluation/FEGIN/kernel/circuit_datasets.py", line 15, in __init__
    self.data, self.slices = torch.load(self.processed_paths[0])
  File "/home/philip/.local/lib/python3.8/site-packages/torch/serialization.py", line 1040, in load
    warnings.warn(
  File "/usr/lib/python3.8/warnings.py", line 109, in _showwarnmsg
    sw(msg.message, msg.category, msg.filename, msg.lineno,
  File "main.py", line 47, in warn_with_traceback
    traceback.print_stack(file=log)
/home/philip/projects/ltspice_examples_code_repo/Circuit-Completion-Using-GNNs/component_classification_with_link_prediction_head/evaluation/FEGIN/kernel/circuit_datasets.py:15: FutureWarning: You are using `torch.load` with `weights_only=False` (the current default value), which uses the default pickle module implicitly. It is possible to construct malicious pickle data which will execute arbitrary code during unpickling (See https://github.com/pytorch/pytorch/blob/main/SECURITY.md#untrusted-models for more details). In a future release, the default value for `weights_only` will be flipped to `True`. This limits the functions that could be executed during unpickling. Arbitrary objects will no longer be allowed to be loaded via this mode unless they are explicitly allowlisted by the user via `torch.serialization.add_safe_globals`. We recommend you start setting `weights_only=True` for any use case where you don't have full control of the loaded file. Please open an issue on GitHub for any issues related to this experimental feature.
  self.data, self.slices = torch.load(self.processed_paths[0])
