STDOUT:
Results will be saved in /home/philip/projects/ltspice_examples_code_repo/Circuit-Completion-Using-GNNs/component_classification_with_link_prediction_head/evaluation/FEGIN/results/model_FEGIN_dataset_ltspice_demos
Command line input: python main.py --data ltspice_demos --representation component_component --model FEGIN --layers 2 --hiddens 64 --batch_size 32 --lr 0.01 --emb_size 512 --epochs 100 --save_appendix component_component_L2_H64_BS32_LR0.01_E512 --no_val
 is saved.
-----
ltspice_demos - FEGIN
Using 2 layers, 64 hidden units, h = 2
Loading component_component representation dataset
ENTERED
Training FEGIN on component_component representation
Train: 1565, Test: 383
##################ITERATION #0 ****************************************
 epoch: 0, train_loss: 1.2558, test_loss: 1.2969, test_f1: 0.3588
 epoch: 1, train_loss: 1.1260, test_loss: 1.1643, test_f1: 0.4582
 epoch: 2, train_loss: 1.0558, test_loss: 1.1675, test_f1: 0.3377
 epoch: 3, train_loss: 1.0287, test_loss: 1.4150, test_f1: 0.3439
 epoch: 4, train_loss: 1.0222, test_loss: 1.1211, test_f1: 0.4464
 epoch: 5, train_loss: 0.9557, test_loss: 0.9862, test_f1: 0.5547
 epoch: 6, train_loss: 0.9037, test_loss: 1.0185, test_f1: 0.5349
 epoch: 7, train_loss: 0.9123, test_loss: 1.0625, test_f1: 0.5716
 epoch: 8, train_loss: 0.8825, test_loss: 0.9950, test_f1: 0.4474
 epoch: 9, train_loss: 0.8799, test_loss: 0.9963, test_f1: 0.4475
 epoch: 10, train_loss: 0.8867, test_loss: 1.0689, test_f1: 0.5438
 epoch: 11, train_loss: 0.8891, test_loss: 1.0735, test_f1: 0.5605
 epoch: 12, train_loss: 0.8595, test_loss: 1.0440, test_f1: 0.5092
 epoch: 13, train_loss: 0.8775, test_loss: 1.1035, test_f1: 0.5437
 epoch: 14, train_loss: 0.8444, test_loss: 0.9718, test_f1: 0.4835
 epoch: 15, train_loss: 0.8642, test_loss: 1.2533, test_f1: 0.5369
 epoch: 16, train_loss: 0.8465, test_loss: 1.3074, test_f1: 0.5108
 epoch: 17, train_loss: 0.8475, test_loss: 1.5860, test_f1: 0.4736
 epoch: 18, train_loss: 0.8688, test_loss: 1.1785, test_f1: 0.5665
 epoch: 19, train_loss: 0.8222, test_loss: 1.1329, test_f1: 0.4952
 epoch: 20, train_loss: 0.8451, test_loss: 1.3204, test_f1: 0.5684
 epoch: 21, train_loss: 0.8263, test_loss: 1.0380, test_f1: 0.6243
 epoch: 22, train_loss: 0.7998, test_loss: 1.2382, test_f1: 0.5675
 epoch: 23, train_loss: 0.8003, test_loss: 1.2441, test_f1: 0.4569
 epoch: 24, train_loss: 0.8391, test_loss: 1.1521, test_f1: 0.4732
 epoch: 25, train_loss: 0.7871, test_loss: 1.2157, test_f1: 0.6112
 epoch: 26, train_loss: 0.7766, test_loss: 1.0490, test_f1: 0.6098
 epoch: 27, train_loss: 0.8102, test_loss: 1.1093, test_f1: 0.5788
 epoch: 28, train_loss: 0.8076, test_loss: 1.2242, test_f1: 0.5799
 epoch: 29, train_loss: 0.7765, test_loss: 1.1631, test_f1: 0.5787
 epoch: 30, train_loss: 0.7786, test_loss: 1.2084, test_f1: 0.5804
 epoch: 31, train_loss: 0.7739, test_loss: 1.8159, test_f1: 0.4536
 epoch: 32, train_loss: 0.7721, test_loss: 1.2701, test_f1: 0.4916
 epoch: 33, train_loss: 0.7507, test_loss: 1.4505, test_f1: 0.4926
 epoch: 34, train_loss: 0.8034, test_loss: 1.3399, test_f1: 0.5734
 epoch: 35, train_loss: 0.7967, test_loss: 1.0856, test_f1: 0.5423
 epoch: 36, train_loss: 0.7477, test_loss: 1.2318, test_f1: 0.5899
 epoch: 37, train_loss: 0.7418, test_loss: 1.1698, test_f1: 0.5126
 epoch: 38, train_loss: 0.7614, test_loss: 1.0842, test_f1: 0.5898
 epoch: 39, train_loss: 0.7526, test_loss: 1.1431, test_f1: 0.5792
 epoch: 40, train_loss: 0.7226, test_loss: 1.4574, test_f1: 0.6189
 epoch: 41, train_loss: 0.7223, test_loss: 1.0347, test_f1: 0.5742
 epoch: 42, train_loss: 0.7494, test_loss: 1.3043, test_f1: 0.6485
 epoch: 43, train_loss: 0.7117, test_loss: 1.1213, test_f1: 0.6069
 epoch: 44, train_loss: 0.6914, test_loss: 1.1854, test_f1: 0.6164
 epoch: 45, train_loss: 0.7349, test_loss: 1.0808, test_f1: 0.5665
 epoch: 46, train_loss: 0.7082, test_loss: 1.3164, test_f1: 0.5693
 epoch: 47, train_loss: 0.6941, test_loss: 1.1840, test_f1: 0.6107
 epoch: 48, train_loss: 0.6744, test_loss: 1.2336, test_f1: 0.6110
 epoch: 49, train_loss: 0.7174, test_loss: 1.6269, test_f1: 0.5001
 epoch: 50, train_loss: 0.6685, test_loss: 1.1159, test_f1: 0.6474
 epoch: 51, train_loss: 0.6502, test_loss: 1.2129, test_f1: 0.5668
 epoch: 52, train_loss: 0.6186, test_loss: 1.4352, test_f1: 0.5565
 epoch: 53, train_loss: 0.6253, test_loss: 1.5745, test_f1: 0.5155
 epoch: 54, train_loss: 0.6106, test_loss: 1.2916, test_f1: 0.6040
 epoch: 55, train_loss: 0.6067, test_loss: 1.8004, test_f1: 0.6122
 epoch: 56, train_loss: 0.6174, test_loss: 1.3117, test_f1: 0.6089
 epoch: 57, train_loss: 0.5976, test_loss: 1.6048, test_f1: 0.6056
 epoch: 58, train_loss: 0.6106, test_loss: 1.6772, test_f1: 0.5693
 epoch: 59, train_loss: 0.5959, test_loss: 1.8377, test_f1: 0.6082
 epoch: 60, train_loss: 0.6036, test_loss: 1.3987, test_f1: 0.6044
 epoch: 61, train_loss: 0.5823, test_loss: 1.3480, test_f1: 0.5807
 epoch: 62, train_loss: 0.5697, test_loss: 1.4660, test_f1: 0.5779
 epoch: 63, train_loss: 0.5799, test_loss: 1.5494, test_f1: 0.5772
 epoch: 64, train_loss: 0.5549, test_loss: 1.6085, test_f1: 0.5887
 epoch: 65, train_loss: 0.5410, test_loss: 1.6487, test_f1: 0.5885
 epoch: 66, train_loss: 0.5486, test_loss: 1.4783, test_f1: 0.5943
 epoch: 67, train_loss: 0.5554, test_loss: 2.1132, test_f1: 0.5843
 epoch: 68, train_loss: 0.5932, test_loss: 1.4876, test_f1: 0.6027
 epoch: 69, train_loss: 0.5648, test_loss: 1.6020, test_f1: 0.6205
 epoch: 70, train_loss: 0.5426, test_loss: 1.6472, test_f1: 0.6004
 epoch: 71, train_loss: 0.5653, test_loss: 2.1217, test_f1: 0.6093
 epoch: 72, train_loss: 0.5649, test_loss: 2.0589, test_f1: 0.5978
 epoch: 73, train_loss: 0.5485, test_loss: 2.0054, test_f1: 0.6063
 epoch: 74, train_loss: 0.5659, test_loss: 2.5494, test_f1: 0.5923
 epoch: 75, train_loss: 0.5374, test_loss: 1.9311, test_f1: 0.6117
 epoch: 76, train_loss: 0.5350, test_loss: 1.8462, test_f1: 0.6163
 epoch: 77, train_loss: 0.5432, test_loss: 2.2132, test_f1: 0.5999
 epoch: 78, train_loss: 0.5368, test_loss: 2.0055, test_f1: 0.5779
 epoch: 79, train_loss: 0.5163, test_loss: 1.9925, test_f1: 0.5992
 epoch: 80, train_loss: 0.5590, test_loss: 1.6747, test_f1: 0.5918
 epoch: 81, train_loss: 0.5197, test_loss: 2.3333, test_f1: 0.5973
 epoch: 82, train_loss: 0.5085, test_loss: 2.1241, test_f1: 0.6015
 epoch: 83, train_loss: 0.5041, test_loss: 2.5337, test_f1: 0.5613
 epoch: 84, train_loss: 0.5131, test_loss: 2.4253, test_f1: 0.5907
 epoch: 85, train_loss: 0.5370, test_loss: 2.1650, test_f1: 0.6058
 epoch: 86, train_loss: 0.5219, test_loss: 2.1657, test_f1: 0.6167
 epoch: 87, train_loss: 0.5137, test_loss: 2.3757, test_f1: 0.5943
 epoch: 88, train_loss: 0.5058, test_loss: 2.2721, test_f1: 0.5900
 epoch: 89, train_loss: 0.5107, test_loss: 2.5920, test_f1: 0.5951
 epoch: 90, train_loss: 0.4898, test_loss: 2.5218, test_f1: 0.6274
 epoch: 91, train_loss: 0.5056, test_loss: 2.6380, test_f1: 0.5714
 epoch: 92, train_loss: 0.4890, test_loss: 2.7983, test_f1: 0.5686
 epoch: 93, train_loss: 0.4964, test_loss: 2.9686, test_f1: 0.5913
 epoch: 94, train_loss: 0.5041, test_loss: 2.4173, test_f1: 0.6336
 epoch: 95, train_loss: 0.4783, test_loss: 2.4401, test_f1: 0.6018
 epoch: 96, train_loss: 0.4736, test_loss: 2.4020, test_f1: 0.6018
 epoch: 97, train_loss: 0.4841, test_loss: 2.6042, test_f1: 0.6141
 epoch: 98, train_loss: 0.4926, test_loss: 2.6486, test_f1: 0.6035
 epoch: 99, train_loss: 0.5088, test_loss: 2.3936, test_f1: 0.5984
##################ITERATION #1 ****************************************
 epoch: 0, train_loss: 1.2016, test_loss: 1.2226, test_f1: 0.2948
 epoch: 1, train_loss: 1.1102, test_loss: 1.3210, test_f1: 0.2863
 epoch: 2, train_loss: 1.0727, test_loss: 1.2398, test_f1: 0.4085
 epoch: 3, train_loss: 1.0205, test_loss: 1.1104, test_f1: 0.4974
 epoch: 4, train_loss: 1.0073, test_loss: 1.1887, test_f1: 0.5094
 epoch: 5, train_loss: 0.9315, test_loss: 1.1168, test_f1: 0.5073
 epoch: 6, train_loss: 0.9054, test_loss: 0.9791, test_f1: 0.5306
 epoch: 7, train_loss: 0.8693, test_loss: 1.0732, test_f1: 0.5310
 epoch: 8, train_loss: 0.9139, test_loss: 1.0994, test_f1: 0.5179
 epoch: 9, train_loss: 0.8785, test_loss: 0.9633, test_f1: 0.5729
 epoch: 10, train_loss: 0.8869, test_loss: 0.9839, test_f1: 0.4843
 epoch: 11, train_loss: 0.8712, test_loss: 1.0858, test_f1: 0.5456
 epoch: 12, train_loss: 0.8471, test_loss: 1.0114, test_f1: 0.4423
 epoch: 13, train_loss: 0.8417, test_loss: 1.0199, test_f1: 0.5107
 epoch: 14, train_loss: 0.8253, test_loss: 0.9751, test_f1: 0.5809
 epoch: 15, train_loss: 0.8492, test_loss: 1.1187, test_f1: 0.5044
 epoch: 16, train_loss: 0.8440, test_loss: 1.0398, test_f1: 0.5351
 epoch: 17, train_loss: 0.8213, test_loss: 1.1224, test_f1: 0.5337
 epoch: 18, train_loss: 0.8257, test_loss: 1.0735, test_f1: 0.5691
 epoch: 19, train_loss: 0.8172, test_loss: 0.9899, test_f1: 0.5432
 epoch: 20, train_loss: 0.8159, test_loss: 1.1154, test_f1: 0.5141
 epoch: 21, train_loss: 0.7824, test_loss: 1.4675, test_f1: 0.4917
 epoch: 22, train_loss: 0.8078, test_loss: 1.2794, test_f1: 0.5163
 epoch: 23, train_loss: 0.7966, test_loss: 1.0396, test_f1: 0.5632
 epoch: 24, train_loss: 0.8050, test_loss: 1.5434, test_f1: 0.4071
 epoch: 25, train_loss: 0.8025, test_loss: 0.9998, test_f1: 0.5600
 epoch: 26, train_loss: 0.8047, test_loss: 1.1148, test_f1: 0.4990
 epoch: 27, train_loss: 0.7885, test_loss: 0.9477, test_f1: 0.5882
 epoch: 28, train_loss: 0.7846, test_loss: 1.0083, test_f1: 0.5772
 epoch: 29, train_loss: 0.7686, test_loss: 0.9898, test_f1: 0.5765
 epoch: 30, train_loss: 0.7539, test_loss: 1.2155, test_f1: 0.5794
 epoch: 31, train_loss: 0.7744, test_loss: 1.0965, test_f1: 0.6292
 epoch: 32, train_loss: 0.7300, test_loss: 1.2003, test_f1: 0.5210
 epoch: 33, train_loss: 0.7524, test_loss: 1.0805, test_f1: 0.6353
 epoch: 34, train_loss: 0.7579, test_loss: 1.4986, test_f1: 0.4981
 epoch: 35, train_loss: 0.7752, test_loss: 1.3183, test_f1: 0.5232
 epoch: 36, train_loss: 0.7316, test_loss: 1.4012, test_f1: 0.5430
 epoch: 37, train_loss: 0.8138, test_loss: 1.1340, test_f1: 0.5551
 epoch: 38, train_loss: 0.7629, test_loss: 1.0615, test_f1: 0.5831
 epoch: 39, train_loss: 0.7665, test_loss: 1.0627, test_f1: 0.5691
 epoch: 40, train_loss: 0.7292, test_loss: 1.0755, test_f1: 0.6058
 epoch: 41, train_loss: 0.7053, test_loss: 1.1928, test_f1: 0.5626
 epoch: 42, train_loss: 0.7451, test_loss: 1.1171, test_f1: 0.5818
 epoch: 43, train_loss: 0.7320, test_loss: 1.1545, test_f1: 0.5721
 epoch: 44, train_loss: 0.7253, test_loss: 1.0922, test_f1: 0.5957
 epoch: 45, train_loss: 0.6925, test_loss: 1.4320, test_f1: 0.6040
 epoch: 46, train_loss: 0.6937, test_loss: 1.2592, test_f1: 0.5364
 epoch: 47, train_loss: 0.7019, test_loss: 1.2848, test_f1: 0.6024
 epoch: 48, train_loss: 0.7016, test_loss: 1.3407, test_f1: 0.6172
 epoch: 49, train_loss: 0.6737, test_loss: 1.4948, test_f1: 0.5812
 epoch: 50, train_loss: 0.6834, test_loss: 1.4401, test_f1: 0.5285
 epoch: 51, train_loss: 0.6805, test_loss: 1.2401, test_f1: 0.5949
 epoch: 52, train_loss: 0.6521, test_loss: 1.2539, test_f1: 0.6188
 epoch: 53, train_loss: 0.6356, test_loss: 1.3496, test_f1: 0.5887
 epoch: 54, train_loss: 0.6090, test_loss: 1.3637, test_f1: 0.5673
 epoch: 55, train_loss: 0.5990, test_loss: 1.4638, test_f1: 0.5645
 epoch: 56, train_loss: 0.5948, test_loss: 1.4519, test_f1: 0.6027
 epoch: 57, train_loss: 0.6065, test_loss: 1.5003, test_f1: 0.5345
 epoch: 58, train_loss: 0.5924, test_loss: 1.6285, test_f1: 0.5490
 epoch: 59, train_loss: 0.5639, test_loss: 1.8741, test_f1: 0.5857
 epoch: 60, train_loss: 0.5494, test_loss: 1.8120, test_f1: 0.5638
 epoch: 61, train_loss: 0.5773, test_loss: 2.0218, test_f1: 0.5731
 epoch: 62, train_loss: 0.5621, test_loss: 1.9252, test_f1: 0.5662
 epoch: 63, train_loss: 0.5616, test_loss: 1.6169, test_f1: 0.5643
 epoch: 64, train_loss: 0.5613, test_loss: 1.8241, test_f1: 0.5581
 epoch: 65, train_loss: 0.5509, test_loss: 1.7048, test_f1: 0.6037
 epoch: 66, train_loss: 0.5421, test_loss: 2.0195, test_f1: 0.5690
 epoch: 67, train_loss: 0.5165, test_loss: 1.9262, test_f1: 0.5571
 epoch: 68, train_loss: 0.5157, test_loss: 2.1118, test_f1: 0.5671
 epoch: 69, train_loss: 0.5419, test_loss: 1.9911, test_f1: 0.5618
 epoch: 70, train_loss: 0.5232, test_loss: 1.7186, test_f1: 0.5432
 epoch: 71, train_loss: 0.5116, test_loss: 1.8434, test_f1: 0.5710
 epoch: 72, train_loss: 0.4981, test_loss: 1.8504, test_f1: 0.5325
 epoch: 73, train_loss: 0.5339, test_loss: 2.0535, test_f1: 0.5426
 epoch: 74, train_loss: 0.4975, test_loss: 2.1057, test_f1: 0.5554
 epoch: 75, train_loss: 0.5039, test_loss: 1.6946, test_f1: 0.5362
 epoch: 76, train_loss: 0.5111, test_loss: 2.3896, test_f1: 0.5502
 epoch: 77, train_loss: 0.4918, test_loss: 1.8870, test_f1: 0.5681
 epoch: 78, train_loss: 0.4887, test_loss: 1.9267, test_f1: 0.5743
 epoch: 79, train_loss: 0.5031, test_loss: 2.1091, test_f1: 0.5840
 epoch: 80, train_loss: 0.4783, test_loss: 2.1377, test_f1: 0.5409
 epoch: 81, train_loss: 0.4666, test_loss: 2.1780, test_f1: 0.5699
 epoch: 82, train_loss: 0.4613, test_loss: 2.6700, test_f1: 0.5206
 epoch: 83, train_loss: 0.4923, test_loss: 2.5482, test_f1: 0.5191
 epoch: 84, train_loss: 0.4717, test_loss: 1.9314, test_f1: 0.5411
 epoch: 85, train_loss: 0.4989, test_loss: 2.0572, test_f1: 0.5598
 epoch: 86, train_loss: 0.4941, test_loss: 2.1468, test_f1: 0.5357
 epoch: 87, train_loss: 0.4566, test_loss: 1.9588, test_f1: 0.5458
 epoch: 88, train_loss: 0.4578, test_loss: 2.1344, test_f1: 0.5591
 epoch: 89, train_loss: 0.4686, test_loss: 2.9472, test_f1: 0.5726
 epoch: 90, train_loss: 0.4490, test_loss: 2.5381, test_f1: 0.5499
 epoch: 91, train_loss: 0.4451, test_loss: 2.4572, test_f1: 0.5393
 epoch: 92, train_loss: 0.4571, test_loss: 2.5495, test_f1: 0.5342
 epoch: 93, train_loss: 0.4347, test_loss: 2.3340, test_f1: 0.5673
 epoch: 94, train_loss: 0.4088, test_loss: 2.8705, test_f1: 0.5134
 epoch: 95, train_loss: 0.4558, test_loss: 2.8149, test_f1: 0.5427
 epoch: 96, train_loss: 0.4601, test_loss: 2.0943, test_f1: 0.5529
 epoch: 97, train_loss: 0.4420, test_loss: 2.0632, test_f1: 0.5871
 epoch: 98, train_loss: 0.4093, test_loss: 2.3288, test_f1: 0.5702
 epoch: 99, train_loss: 0.4130, test_loss: 2.7739, test_f1: 0.5481
##################ITERATION #2 ****************************************
 epoch: 0, train_loss: 1.2460, test_loss: 1.1986, test_f1: 0.3939
 epoch: 1, train_loss: 1.1294, test_loss: 1.2967, test_f1: 0.3121
 epoch: 2, train_loss: 1.0856, test_loss: 1.2817, test_f1: 0.4207
 epoch: 3, train_loss: 1.0360, test_loss: 1.1267, test_f1: 0.4740
 epoch: 4, train_loss: 0.9940, test_loss: 1.0811, test_f1: 0.4985
 epoch: 5, train_loss: 0.9543, test_loss: 1.1013, test_f1: 0.3857
 epoch: 6, train_loss: 0.9389, test_loss: 1.0473, test_f1: 0.5754
 epoch: 7, train_loss: 0.9069, test_loss: 1.0296, test_f1: 0.5530
 epoch: 8, train_loss: 0.8988, test_loss: 1.0127, test_f1: 0.5565
 epoch: 9, train_loss: 0.8841, test_loss: 1.7949, test_f1: 0.3821
 epoch: 10, train_loss: 0.8723, test_loss: 0.9962, test_f1: 0.5749
 epoch: 11, train_loss: 0.8757, test_loss: 0.9661, test_f1: 0.5082
 epoch: 12, train_loss: 0.8626, test_loss: 1.0300, test_f1: 0.5833
 epoch: 13, train_loss: 0.8493, test_loss: 1.0132, test_f1: 0.5642
 epoch: 14, train_loss: 0.8789, test_loss: 1.5791, test_f1: 0.5343
 epoch: 15, train_loss: 0.8662, test_loss: 1.0010, test_f1: 0.6170
 epoch: 16, train_loss: 0.8359, test_loss: 1.1223, test_f1: 0.5485
 epoch: 17, train_loss: 0.8316, test_loss: 1.0114, test_f1: 0.5454
 epoch: 18, train_loss: 0.8136, test_loss: 0.9731, test_f1: 0.6019
 epoch: 19, train_loss: 0.8269, test_loss: 1.0651, test_f1: 0.5867
 epoch: 20, train_loss: 0.8120, test_loss: 1.0221, test_f1: 0.5805
 epoch: 21, train_loss: 0.8140, test_loss: 1.1370, test_f1: 0.5735
 epoch: 22, train_loss: 0.8609, test_loss: 0.9739, test_f1: 0.5383
 epoch: 23, train_loss: 0.8205, test_loss: 1.0895, test_f1: 0.5435
 epoch: 24, train_loss: 0.7957, test_loss: 1.1621, test_f1: 0.6203
 epoch: 25, train_loss: 0.7892, test_loss: 1.0081, test_f1: 0.6166
 epoch: 26, train_loss: 0.8000, test_loss: 1.0900, test_f1: 0.5602
 epoch: 27, train_loss: 0.7760, test_loss: 1.1653, test_f1: 0.6353
 epoch: 28, train_loss: 0.7592, test_loss: 1.0350, test_f1: 0.5803
 epoch: 29, train_loss: 0.7499, test_loss: 1.1018, test_f1: 0.6046
 epoch: 30, train_loss: 0.7833, test_loss: 1.0266, test_f1: 0.6123
 epoch: 31, train_loss: 0.7650, test_loss: 1.1462, test_f1: 0.5402
 epoch: 32, train_loss: 0.7253, test_loss: 1.0634, test_f1: 0.6150
 epoch: 33, train_loss: 0.7474, test_loss: 1.0380, test_f1: 0.6107
 epoch: 34, train_loss: 0.7322, test_loss: 1.0010, test_f1: 0.5821
 epoch: 35, train_loss: 0.7541, test_loss: 1.0344, test_f1: 0.6138
 epoch: 36, train_loss: 0.7252, test_loss: 1.2960, test_f1: 0.5363
 epoch: 37, train_loss: 0.7209, test_loss: 1.1427, test_f1: 0.5905
 epoch: 38, train_loss: 0.7104, test_loss: 1.3276, test_f1: 0.5714
 epoch: 39, train_loss: 0.7109, test_loss: 1.3679, test_f1: 0.4973
 epoch: 40, train_loss: 0.6932, test_loss: 1.1779, test_f1: 0.6029
 epoch: 41, train_loss: 0.7333, test_loss: 1.0926, test_f1: 0.5428
 epoch: 42, train_loss: 0.7077, test_loss: 1.1433, test_f1: 0.5300
 epoch: 43, train_loss: 0.6830, test_loss: 1.2800, test_f1: 0.5495
 epoch: 44, train_loss: 0.6668, test_loss: 1.1995, test_f1: 0.5524
 epoch: 45, train_loss: 0.6827, test_loss: 1.2009, test_f1: 0.5862
 epoch: 46, train_loss: 0.6708, test_loss: 1.0126, test_f1: 0.6314
 epoch: 47, train_loss: 0.6583, test_loss: 1.2469, test_f1: 0.6141
 epoch: 48, train_loss: 0.6619, test_loss: 1.1291, test_f1: 0.5450
 epoch: 49, train_loss: 0.6605, test_loss: 1.0540, test_f1: 0.6067
 epoch: 50, train_loss: 0.6269, test_loss: 1.1186, test_f1: 0.5892
 epoch: 51, train_loss: 0.6035, test_loss: 1.2329, test_f1: 0.5430
 epoch: 52, train_loss: 0.5980, test_loss: 1.2228, test_f1: 0.6105
 epoch: 53, train_loss: 0.5717, test_loss: 1.2126, test_f1: 0.5610
 epoch: 54, train_loss: 0.5648, test_loss: 1.1845, test_f1: 0.5902
 epoch: 55, train_loss: 0.5695, test_loss: 1.2962, test_f1: 0.5867
 epoch: 56, train_loss: 0.5434, test_loss: 1.3561, test_f1: 0.5586
 epoch: 57, train_loss: 0.5590, test_loss: 1.2986, test_f1: 0.5454
 epoch: 58, train_loss: 0.5213, test_loss: 1.4099, test_f1: 0.5500
 epoch: 59, train_loss: 0.5348, test_loss: 1.4198, test_f1: 0.5778
 epoch: 60, train_loss: 0.5366, test_loss: 1.4084, test_f1: 0.5506
 epoch: 61, train_loss: 0.5536, test_loss: 1.2722, test_f1: 0.5546
 epoch: 62, train_loss: 0.5627, test_loss: 1.5277, test_f1: 0.5528
 epoch: 63, train_loss: 0.5516, test_loss: 1.4475, test_f1: 0.5408
 epoch: 64, train_loss: 0.5481, test_loss: 1.2423, test_f1: 0.5958
 epoch: 65, train_loss: 0.5285, test_loss: 1.3730, test_f1: 0.5450
 epoch: 66, train_loss: 0.4950, test_loss: 1.5194, test_f1: 0.5278
 epoch: 67, train_loss: 0.5173, test_loss: 1.5231, test_f1: 0.5581
 epoch: 68, train_loss: 0.4711, test_loss: 1.5320, test_f1: 0.5546
 epoch: 69, train_loss: 0.4959, test_loss: 1.6088, test_f1: 0.5364
 epoch: 70, train_loss: 0.5069, test_loss: 1.4285, test_f1: 0.5261
 epoch: 71, train_loss: 0.5082, test_loss: 1.4175, test_f1: 0.5593
 epoch: 72, train_loss: 0.4796, test_loss: 1.4503, test_f1: 0.5760
 epoch: 73, train_loss: 0.4847, test_loss: 1.5400, test_f1: 0.5462
 epoch: 74, train_loss: 0.4820, test_loss: 1.3783, test_f1: 0.5889
 epoch: 75, train_loss: 0.4941, test_loss: 1.4978, test_f1: 0.5760
 epoch: 76, train_loss: 0.5141, test_loss: 1.4917, test_f1: 0.5753
 epoch: 77, train_loss: 0.4997, test_loss: 1.4167, test_f1: 0.5581
 epoch: 78, train_loss: 0.5034, test_loss: 1.7100, test_f1: 0.5432
 epoch: 79, train_loss: 0.4674, test_loss: 1.5558, test_f1: 0.5650
 epoch: 80, train_loss: 0.4660, test_loss: 1.4692, test_f1: 0.5655
 epoch: 81, train_loss: 0.4546, test_loss: 1.7042, test_f1: 0.5262
 epoch: 82, train_loss: 0.4596, test_loss: 1.7005, test_f1: 0.5475
 epoch: 83, train_loss: 0.4856, test_loss: 1.5075, test_f1: 0.5357
 epoch: 84, train_loss: 0.4879, test_loss: 1.7728, test_f1: 0.5728
 epoch: 85, train_loss: 0.4442, test_loss: 1.6144, test_f1: 0.5704
 epoch: 86, train_loss: 0.4621, test_loss: 1.7289, test_f1: 0.5497
 epoch: 87, train_loss: 0.4669, test_loss: 1.6835, test_f1: 0.5715
 epoch: 88, train_loss: 0.4495, test_loss: 1.7825, test_f1: 0.5490
 epoch: 89, train_loss: 0.4906, test_loss: 1.6058, test_f1: 0.5525
 epoch: 90, train_loss: 0.4650, test_loss: 1.6729, test_f1: 0.5694
 epoch: 91, train_loss: 0.4539, test_loss: 1.7172, test_f1: 0.5470
 epoch: 92, train_loss: 0.4196, test_loss: 1.6684, test_f1: 0.5483
 epoch: 93, train_loss: 0.4307, test_loss: 2.0328, test_f1: 0.5562
 epoch: 94, train_loss: 0.4393, test_loss: 1.8873, test_f1: 0.5439
 epoch: 95, train_loss: 0.3970, test_loss: 1.8744, test_f1: 0.5489
 epoch: 96, train_loss: 0.4330, test_loss: 1.7481, test_f1: 0.5355
 epoch: 97, train_loss: 0.4302, test_loss: 1.7897, test_f1: 0.5331
 epoch: 98, train_loss: 0.4568, test_loss: 1.6720, test_f1: 0.5667
 epoch: 99, train_loss: 0.4026, test_loss: 1.5818, test_f1: 0.5797
##################ITERATION #3 ****************************************
 epoch: 0, train_loss: 1.2441, test_loss: 1.3089, test_f1: 0.3799
 epoch: 1, train_loss: 1.0998, test_loss: 1.2262, test_f1: 0.3718
 epoch: 2, train_loss: 1.0652, test_loss: 1.2733, test_f1: 0.4044
 epoch: 3, train_loss: 1.0326, test_loss: 1.0505, test_f1: 0.5632
 epoch: 4, train_loss: 0.9891, test_loss: 1.0804, test_f1: 0.5061
 epoch: 5, train_loss: 0.9786, test_loss: 1.0782, test_f1: 0.4527
 epoch: 6, train_loss: 0.9304, test_loss: 1.0607, test_f1: 0.5079
 epoch: 7, train_loss: 0.9414, test_loss: 1.0963, test_f1: 0.5233
 epoch: 8, train_loss: 0.9067, test_loss: 1.0834, test_f1: 0.5051
 epoch: 9, train_loss: 0.9152, test_loss: 0.9981, test_f1: 0.5557
 epoch: 10, train_loss: 0.8978, test_loss: 1.1151, test_f1: 0.5539
 epoch: 11, train_loss: 0.8802, test_loss: 1.5549, test_f1: 0.3927
 epoch: 12, train_loss: 0.8768, test_loss: 1.1064, test_f1: 0.5207
 epoch: 13, train_loss: 0.8867, test_loss: 1.0855, test_f1: 0.5851
 epoch: 14, train_loss: 0.8570, test_loss: 1.0549, test_f1: 0.4932
 epoch: 15, train_loss: 0.8328, test_loss: 1.0174, test_f1: 0.5930
 epoch: 16, train_loss: 0.8590, test_loss: 1.2585, test_f1: 0.4905
 epoch: 17, train_loss: 0.8689, test_loss: 0.9552, test_f1: 0.5314
 epoch: 18, train_loss: 0.8258, test_loss: 1.2009, test_f1: 0.5489
 epoch: 19, train_loss: 0.8149, test_loss: 1.0047, test_f1: 0.5689
 epoch: 20, train_loss: 0.8228, test_loss: 0.9832, test_f1: 0.5914
 epoch: 21, train_loss: 0.8228, test_loss: 1.2456, test_f1: 0.5306
 epoch: 22, train_loss: 0.8448, test_loss: 1.8645, test_f1: 0.4949
 epoch: 23, train_loss: 0.8016, test_loss: 0.9685, test_f1: 0.5749
 epoch: 24, train_loss: 0.7929, test_loss: 1.2328, test_f1: 0.5472
 epoch: 25, train_loss: 0.8088, test_loss: 1.0725, test_f1: 0.5257
 epoch: 26, train_loss: 0.7947, test_loss: 1.1241, test_f1: 0.5711
 epoch: 27, train_loss: 0.7957, test_loss: 1.1071, test_f1: 0.5413
 epoch: 28, train_loss: 0.7775, test_loss: 1.0270, test_f1: 0.5532
 epoch: 29, train_loss: 0.7687, test_loss: 1.1745, test_f1: 0.5211
 epoch: 30, train_loss: 0.7623, test_loss: 1.1660, test_f1: 0.5385
 epoch: 31, train_loss: 0.7900, test_loss: 1.0193, test_f1: 0.5802
 epoch: 32, train_loss: 0.7528, test_loss: 1.4457, test_f1: 0.4995
 epoch: 33, train_loss: 0.7462, test_loss: 1.8522, test_f1: 0.5006
 epoch: 34, train_loss: 0.7578, test_loss: 2.5502, test_f1: 0.4407
 epoch: 35, train_loss: 0.7548, test_loss: 1.0893, test_f1: 0.5143
 epoch: 36, train_loss: 0.7430, test_loss: 1.2827, test_f1: 0.6140
 epoch: 37, train_loss: 0.7465, test_loss: 1.0147, test_f1: 0.6187
 epoch: 38, train_loss: 0.7549, test_loss: 1.0471, test_f1: 0.5576
 epoch: 39, train_loss: 0.7273, test_loss: 1.6945, test_f1: 0.5267
 epoch: 40, train_loss: 0.7435, test_loss: 1.1041, test_f1: 0.5784
 epoch: 41, train_loss: 0.7207, test_loss: 1.0301, test_f1: 0.6017
 epoch: 42, train_loss: 0.7579, test_loss: 1.2492, test_f1: 0.5969
 epoch: 43, train_loss: 0.7337, test_loss: 1.3789, test_f1: 0.5794
 epoch: 44, train_loss: 0.7239, test_loss: 1.1610, test_f1: 0.6197
 epoch: 45, train_loss: 0.7418, test_loss: 1.3502, test_f1: 0.4801
 epoch: 46, train_loss: 0.7271, test_loss: 1.2121, test_f1: 0.5477
 epoch: 47, train_loss: 0.7024, test_loss: 1.3672, test_f1: 0.5618
 epoch: 48, train_loss: 0.7019, test_loss: 1.0627, test_f1: 0.5540
 epoch: 49, train_loss: 0.6972, test_loss: 1.3116, test_f1: 0.5723
 epoch: 50, train_loss: 0.6883, test_loss: 1.4240, test_f1: 0.5709
 epoch: 51, train_loss: 0.6575, test_loss: 1.4069, test_f1: 0.5426
 epoch: 52, train_loss: 0.6711, test_loss: 1.4093, test_f1: 0.5825
 epoch: 53, train_loss: 0.6198, test_loss: 1.4768, test_f1: 0.5595
 epoch: 54, train_loss: 0.6283, test_loss: 1.5679, test_f1: 0.5306
 epoch: 55, train_loss: 0.6035, test_loss: 1.5619, test_f1: 0.5399
 epoch: 56, train_loss: 0.6233, test_loss: 1.2760, test_f1: 0.5396
 epoch: 57, train_loss: 0.6178, test_loss: 1.3679, test_f1: 0.5586
 epoch: 58, train_loss: 0.6003, test_loss: 1.8334, test_f1: 0.5692
 epoch: 59, train_loss: 0.5947, test_loss: 1.6301, test_f1: 0.5559
 epoch: 60, train_loss: 0.5905, test_loss: 1.3521, test_f1: 0.5515
 epoch: 61, train_loss: 0.6087, test_loss: 1.7059, test_f1: 0.5390
 epoch: 62, train_loss: 0.5945, test_loss: 1.8355, test_f1: 0.5933
 epoch: 63, train_loss: 0.5608, test_loss: 1.6573, test_f1: 0.5559
 epoch: 64, train_loss: 0.5461, test_loss: 2.0627, test_f1: 0.5523
 epoch: 65, train_loss: 0.5748, test_loss: 1.8329, test_f1: 0.5563
 epoch: 66, train_loss: 0.5735, test_loss: 1.6401, test_f1: 0.5840
 epoch: 67, train_loss: 0.5977, test_loss: 1.5260, test_f1: 0.5646
 epoch: 68, train_loss: 0.5723, test_loss: 1.6663, test_f1: 0.5800
 epoch: 69, train_loss: 0.5513, test_loss: 1.7385, test_f1: 0.5739
 epoch: 70, train_loss: 0.5908, test_loss: 1.5730, test_f1: 0.5349
 epoch: 71, train_loss: 0.5639, test_loss: 1.7837, test_f1: 0.5843
 epoch: 72, train_loss: 0.5399, test_loss: 1.7338, test_f1: 0.5765
 epoch: 73, train_loss: 0.5570, test_loss: 1.5634, test_f1: 0.5928
 epoch: 74, train_loss: 0.5422, test_loss: 1.4820, test_f1: 0.5332
 epoch: 75, train_loss: 0.5449, test_loss: 1.8396, test_f1: 0.6050
 epoch: 76, train_loss: 0.5330, test_loss: 2.1699, test_f1: 0.5421
 epoch: 77, train_loss: 0.5420, test_loss: 2.8404, test_f1: 0.5595
 epoch: 78, train_loss: 0.5333, test_loss: 2.0540, test_f1: 0.5668
 epoch: 79, train_loss: 0.5118, test_loss: 1.9813, test_f1: 0.5445
 epoch: 80, train_loss: 0.5527, test_loss: 2.1537, test_f1: 0.5775
 epoch: 81, train_loss: 0.5654, test_loss: 1.6197, test_f1: 0.5402
 epoch: 82, train_loss: 0.5288, test_loss: 2.1427, test_f1: 0.5822
 epoch: 83, train_loss: 0.5194, test_loss: 1.9286, test_f1: 0.5533
 epoch: 84, train_loss: 0.5061, test_loss: 1.9216, test_f1: 0.5810
 epoch: 85, train_loss: 0.5077, test_loss: 2.4896, test_f1: 0.5484
 epoch: 86, train_loss: 0.5445, test_loss: 1.9858, test_f1: 0.5795
 epoch: 87, train_loss: 0.5187, test_loss: 1.8932, test_f1: 0.5766
 epoch: 88, train_loss: 0.5203, test_loss: 2.0732, test_f1: 0.5580
 epoch: 89, train_loss: 0.5190, test_loss: 2.3872, test_f1: 0.5712
 epoch: 90, train_loss: 0.4978, test_loss: 2.3650, test_f1: 0.5343
 epoch: 91, train_loss: 0.4821, test_loss: 2.1825, test_f1: 0.5680
 epoch: 92, train_loss: 0.5127, test_loss: 1.9341, test_f1: 0.5749
 epoch: 93, train_loss: 0.4880, test_loss: 2.1632, test_f1: 0.5684
 epoch: 94, train_loss: 0.5090, test_loss: 1.8380, test_f1: 0.5750
 epoch: 95, train_loss: 0.5011, test_loss: 1.5505, test_f1: 0.5761
 epoch: 96, train_loss: 0.4616, test_loss: 1.7738, test_f1: 0.5608
 epoch: 97, train_loss: 0.5084, test_loss: 2.2239, test_f1: 0.5714
 epoch: 98, train_loss: 0.4892, test_loss: 2.0898, test_f1: 0.5170
 epoch: 99, train_loss: 0.4860, test_loss: 2.2174, test_f1: 0.5468
##################ITERATION #4 ****************************************
 epoch: 0, train_loss: 1.2678, test_loss: 1.2383, test_f1: 0.4081
 epoch: 1, train_loss: 1.1227, test_loss: 1.1236, test_f1: 0.3633
 epoch: 2, train_loss: 1.0646, test_loss: 1.0534, test_f1: 0.4576
 epoch: 3, train_loss: 0.9765, test_loss: 1.0542, test_f1: 0.5158
 epoch: 4, train_loss: 0.9362, test_loss: 1.2325, test_f1: 0.4573
 epoch: 5, train_loss: 0.9287, test_loss: 1.0192, test_f1: 0.5710
 epoch: 6, train_loss: 0.9420, test_loss: 1.0231, test_f1: 0.4707
 epoch: 7, train_loss: 0.9092, test_loss: 1.1795, test_f1: 0.4061
 epoch: 8, train_loss: 0.9093, test_loss: 1.0818, test_f1: 0.5483
 epoch: 9, train_loss: 0.9198, test_loss: 1.0236, test_f1: 0.5501
 epoch: 10, train_loss: 0.8661, test_loss: 0.9816, test_f1: 0.5373
 epoch: 11, train_loss: 0.8569, test_loss: 1.0690, test_f1: 0.5716
 epoch: 12, train_loss: 0.8508, test_loss: 1.0942, test_f1: 0.5366
 epoch: 13, train_loss: 0.8560, test_loss: 1.0465, test_f1: 0.5599
 epoch: 14, train_loss: 0.8547, test_loss: 1.0681, test_f1: 0.4610
 epoch: 15, train_loss: 0.8428, test_loss: 1.0041, test_f1: 0.5395
 epoch: 16, train_loss: 0.8249, test_loss: 1.0051, test_f1: 0.5796
 epoch: 17, train_loss: 0.8418, test_loss: 1.0387, test_f1: 0.5209
 epoch: 18, train_loss: 0.8360, test_loss: 1.0244, test_f1: 0.5562
 epoch: 19, train_loss: 0.8187, test_loss: 1.0529, test_f1: 0.5578
 epoch: 20, train_loss: 0.8212, test_loss: 1.0869, test_f1: 0.5495
 epoch: 21, train_loss: 0.8308, test_loss: 1.1026, test_f1: 0.5835
 epoch: 22, train_loss: 0.8211, test_loss: 1.0533, test_f1: 0.5494
 epoch: 23, train_loss: 0.7960, test_loss: 1.0253, test_f1: 0.5578
 epoch: 24, train_loss: 0.8239, test_loss: 1.0274, test_f1: 0.5946
 epoch: 25, train_loss: 0.7920, test_loss: 1.0333, test_f1: 0.6161
 epoch: 26, train_loss: 0.8082, test_loss: 1.0703, test_f1: 0.6233
 epoch: 27, train_loss: 0.8034, test_loss: 1.1791, test_f1: 0.5211
 epoch: 28, train_loss: 0.7983, test_loss: 1.1341, test_f1: 0.5682
 epoch: 29, train_loss: 0.7995, test_loss: 1.3668, test_f1: 0.5174
 epoch: 30, train_loss: 0.7911, test_loss: 1.0430, test_f1: 0.5758
 epoch: 31, train_loss: 0.7996, test_loss: 1.0823, test_f1: 0.6028
 epoch: 32, train_loss: 0.7848, test_loss: 1.0072, test_f1: 0.6193
 epoch: 33, train_loss: 0.7969, test_loss: 1.0174, test_f1: 0.6112
 epoch: 34, train_loss: 0.7607, test_loss: 1.0507, test_f1: 0.5700
 epoch: 35, train_loss: 0.7520, test_loss: 1.1107, test_f1: 0.5983
 epoch: 36, train_loss: 0.7417, test_loss: 1.1726, test_f1: 0.6036
 epoch: 37, train_loss: 0.7482, test_loss: 1.1933, test_f1: 0.5690
 epoch: 38, train_loss: 0.7831, test_loss: 1.0738, test_f1: 0.5874
 epoch: 39, train_loss: 0.7714, test_loss: 0.9726, test_f1: 0.6272
 epoch: 40, train_loss: 0.7325, test_loss: 1.1422, test_f1: 0.5677
 epoch: 41, train_loss: 0.7372, test_loss: 1.1659, test_f1: 0.5692
 epoch: 42, train_loss: 0.7262, test_loss: 1.1207, test_f1: 0.4579
 epoch: 43, train_loss: 0.7272, test_loss: 1.1308, test_f1: 0.5406
 epoch: 44, train_loss: 0.7200, test_loss: 1.2274, test_f1: 0.5446
 epoch: 45, train_loss: 0.7178, test_loss: 1.2028, test_f1: 0.5375
 epoch: 46, train_loss: 0.7235, test_loss: 1.3769, test_f1: 0.5612
 epoch: 47, train_loss: 0.7558, test_loss: 1.5587, test_f1: 0.5445
 epoch: 48, train_loss: 0.7407, test_loss: 1.3023, test_f1: 0.5597
 epoch: 49, train_loss: 0.7068, test_loss: 1.3654, test_f1: 0.4550
 epoch: 50, train_loss: 0.7214, test_loss: 1.5829, test_f1: 0.5583
 epoch: 51, train_loss: 0.6421, test_loss: 1.5106, test_f1: 0.5503
 epoch: 52, train_loss: 0.6302, test_loss: 1.3982, test_f1: 0.5727
 epoch: 53, train_loss: 0.6186, test_loss: 1.4246, test_f1: 0.5423
 epoch: 54, train_loss: 0.6454, test_loss: 1.5243, test_f1: 0.5319
 epoch: 55, train_loss: 0.6099, test_loss: 1.6897, test_f1: 0.5351
 epoch: 56, train_loss: 0.6390, test_loss: 1.4792, test_f1: 0.5440
 epoch: 57, train_loss: 0.6083, test_loss: 1.7613, test_f1: 0.5486
 epoch: 58, train_loss: 0.5744, test_loss: 1.6760, test_f1: 0.5343
 epoch: 59, train_loss: 0.6032, test_loss: 1.6420, test_f1: 0.5074
 epoch: 60, train_loss: 0.5897, test_loss: 1.7600, test_f1: 0.5018
 epoch: 61, train_loss: 0.5909, test_loss: 1.5878, test_f1: 0.5080
 epoch: 62, train_loss: 0.5722, test_loss: 1.6993, test_f1: 0.5170
 epoch: 63, train_loss: 0.6020, test_loss: 1.6851, test_f1: 0.5529
 epoch: 64, train_loss: 0.5940, test_loss: 1.8771, test_f1: 0.4864
 epoch: 65, train_loss: 0.5556, test_loss: 1.7683, test_f1: 0.5238
 epoch: 66, train_loss: 0.5411, test_loss: 1.6853, test_f1: 0.5367
 epoch: 67, train_loss: 0.5478, test_loss: 2.0454, test_f1: 0.4889
 epoch: 68, train_loss: 0.5755, test_loss: 1.4610, test_f1: 0.5556
 epoch: 69, train_loss: 0.5572, test_loss: 1.8954, test_f1: 0.5114
 epoch: 70, train_loss: 0.5393, test_loss: 1.7070, test_f1: 0.5038
 epoch: 71, train_loss: 0.5373, test_loss: 1.7897, test_f1: 0.5232
 epoch: 72, train_loss: 0.5420, test_loss: 2.0196, test_f1: 0.5354
 epoch: 73, train_loss: 0.5346, test_loss: 1.7396, test_f1: 0.5377
 epoch: 74, train_loss: 0.5296, test_loss: 1.7424, test_f1: 0.5320
 epoch: 75, train_loss: 0.5367, test_loss: 2.1528, test_f1: 0.5883
 epoch: 76, train_loss: 0.5201, test_loss: 1.9395, test_f1: 0.5447
 epoch: 77, train_loss: 0.5041, test_loss: 1.8962, test_f1: 0.5456
 epoch: 78, train_loss: 0.5097, test_loss: 1.7831, test_f1: 0.5497
 epoch: 79, train_loss: 0.5014, test_loss: 2.2322, test_f1: 0.5177
 epoch: 80, train_loss: 0.4871, test_loss: 2.0435, test_f1: 0.5324
 epoch: 81, train_loss: 0.4948, test_loss: 2.2478, test_f1: 0.5280
 epoch: 82, train_loss: 0.5484, test_loss: 1.7112, test_f1: 0.5457
 epoch: 83, train_loss: 0.5625, test_loss: 2.0070, test_f1: 0.5442
 epoch: 84, train_loss: 0.5009, test_loss: 1.9003, test_f1: 0.5051
 epoch: 85, train_loss: 0.4744, test_loss: 2.0773, test_f1: 0.5589
 epoch: 86, train_loss: 0.5131, test_loss: 2.3764, test_f1: 0.4785
 epoch: 87, train_loss: 0.4777, test_loss: 1.8200, test_f1: 0.5677
 epoch: 88, train_loss: 0.4752, test_loss: 1.9906, test_f1: 0.5346
 epoch: 89, train_loss: 0.4648, test_loss: 1.8783, test_f1: 0.5197
 epoch: 90, train_loss: 0.4514, test_loss: 2.1098, test_f1: 0.5680
 epoch: 91, train_loss: 0.4929, test_loss: 2.2720, test_f1: 0.5476
 epoch: 92, train_loss: 0.4946, test_loss: 2.4068, test_f1: 0.5741
 epoch: 93, train_loss: 0.5022, test_loss: 1.9341, test_f1: 0.5627
 epoch: 94, train_loss: 0.4714, test_loss: 1.9414, test_f1: 0.5477
 epoch: 95, train_loss: 0.4544, test_loss: 2.3507, test_f1: 0.5008
 epoch: 96, train_loss: 0.4821, test_loss: 2.0106, test_f1: 0.5281
 epoch: 97, train_loss: 0.4677, test_loss: 2.0397, test_f1: 0.5412
 epoch: 98, train_loss: 0.4898, test_loss: 2.2191, test_f1: 0.5430
 epoch: 99, train_loss: 0.4609, test_loss: 2.2814, test_f1: 0.5267
##################ITERATION #5 ****************************************
 epoch: 0, train_loss: 1.2708, test_loss: 1.3145, test_f1: 0.2675
 epoch: 1, train_loss: 1.0600, test_loss: 1.0986, test_f1: 0.4908
 epoch: 2, train_loss: 1.0002, test_loss: 1.2021, test_f1: 0.4346
 epoch: 3, train_loss: 0.9793, test_loss: 1.0534, test_f1: 0.5836
 epoch: 4, train_loss: 0.9372, test_loss: 1.0207, test_f1: 0.5363
 epoch: 5, train_loss: 0.9120, test_loss: 1.1717, test_f1: 0.4728
 epoch: 6, train_loss: 0.8871, test_loss: 1.0182, test_f1: 0.4720
 epoch: 7, train_loss: 0.9363, test_loss: 1.0972, test_f1: 0.4285
 epoch: 8, train_loss: 0.8784, test_loss: 0.9941, test_f1: 0.5919
 epoch: 9, train_loss: 0.8595, test_loss: 1.1057, test_f1: 0.5470
 epoch: 10, train_loss: 0.8779, test_loss: 1.0117, test_f1: 0.5434
 epoch: 11, train_loss: 0.8606, test_loss: 1.3115, test_f1: 0.4182
 epoch: 12, train_loss: 0.9056, test_loss: 1.0047, test_f1: 0.5281
 epoch: 13, train_loss: 0.8889, test_loss: 1.0757, test_f1: 0.5033
 epoch: 14, train_loss: 0.8331, test_loss: 1.2721, test_f1: 0.4877
 epoch: 15, train_loss: 0.8272, test_loss: 1.0503, test_f1: 0.5219
 epoch: 16, train_loss: 0.8508, test_loss: 1.4108, test_f1: 0.5195
 epoch: 17, train_loss: 0.8190, test_loss: 1.0727, test_f1: 0.5397
 epoch: 18, train_loss: 0.8439, test_loss: 1.0943, test_f1: 0.5347
 epoch: 19, train_loss: 0.8207, test_loss: 1.1263, test_f1: 0.5270
 epoch: 20, train_loss: 0.7843, test_loss: 1.1118, test_f1: 0.5410
 epoch: 21, train_loss: 0.8109, test_loss: 1.0512, test_f1: 0.5280
 epoch: 22, train_loss: 0.8132, test_loss: 1.3714, test_f1: 0.5347
 epoch: 23, train_loss: 0.7853, test_loss: 1.0468, test_f1: 0.5616
 epoch: 24, train_loss: 0.7835, test_loss: 1.3069, test_f1: 0.5263
 epoch: 25, train_loss: 0.7991, test_loss: 1.0823, test_f1: 0.5701
 epoch: 26, train_loss: 0.8176, test_loss: 1.0440, test_f1: 0.5865
 epoch: 27, train_loss: 0.8060, test_loss: 1.1402, test_f1: 0.5244
 epoch: 28, train_loss: 0.7711, test_loss: 0.9991, test_f1: 0.6099
 epoch: 29, train_loss: 0.7972, test_loss: 1.1283, test_f1: 0.5599
 epoch: 30, train_loss: 0.7673, test_loss: 1.0663, test_f1: 0.5694
 epoch: 31, train_loss: 0.7776, test_loss: 1.1468, test_f1: 0.5455
 epoch: 32, train_loss: 0.7405, test_loss: 1.0954, test_f1: 0.5713
 epoch: 33, train_loss: 0.7473, test_loss: 1.0820, test_f1: 0.5565
 epoch: 34, train_loss: 0.7557, test_loss: 1.0799, test_f1: 0.5861
 epoch: 35, train_loss: 0.7739, test_loss: 1.2157, test_f1: 0.5411
 epoch: 36, train_loss: 0.7891, test_loss: 1.2837, test_f1: 0.4605
 epoch: 37, train_loss: 0.7557, test_loss: 1.1609, test_f1: 0.5794
 epoch: 38, train_loss: 0.7592, test_loss: 1.3032, test_f1: 0.5599
 epoch: 39, train_loss: 0.7421, test_loss: 1.0475, test_f1: 0.5787
 epoch: 40, train_loss: 0.7238, test_loss: 1.1256, test_f1: 0.6163
 epoch: 41, train_loss: 0.7022, test_loss: 1.2767, test_f1: 0.5122
 epoch: 42, train_loss: 0.7089, test_loss: 1.1095, test_f1: 0.5538
 epoch: 43, train_loss: 0.7201, test_loss: 1.1922, test_f1: 0.5505
 epoch: 44, train_loss: 0.6944, test_loss: 1.1856, test_f1: 0.5581
 epoch: 45, train_loss: 0.7054, test_loss: 1.1628, test_f1: 0.5705
 epoch: 46, train_loss: 0.7006, test_loss: 1.1756, test_f1: 0.5466
 epoch: 47, train_loss: 0.7294, test_loss: 1.2019, test_f1: 0.4839
 epoch: 48, train_loss: 0.7771, test_loss: 1.4261, test_f1: 0.5030
 epoch: 49, train_loss: 0.7118, test_loss: 1.3667, test_f1: 0.5743
 epoch: 50, train_loss: 0.6994, test_loss: 1.3208, test_f1: 0.6156
 epoch: 51, train_loss: 0.6429, test_loss: 1.3794, test_f1: 0.5831
 epoch: 52, train_loss: 0.6138, test_loss: 1.5892, test_f1: 0.5982
 epoch: 53, train_loss: 0.6395, test_loss: 1.3688, test_f1: 0.5682
 epoch: 54, train_loss: 0.6301, test_loss: 1.5721, test_f1: 0.5531
 epoch: 55, train_loss: 0.5994, test_loss: 1.4698, test_f1: 0.5553
 epoch: 56, train_loss: 0.6003, test_loss: 1.3690, test_f1: 0.5488
 epoch: 57, train_loss: 0.6055, test_loss: 1.5495, test_f1: 0.5415
 epoch: 58, train_loss: 0.5845, test_loss: 1.4632, test_f1: 0.5565
 epoch: 59, train_loss: 0.6050, test_loss: 1.3523, test_f1: 0.5845
 epoch: 60, train_loss: 0.5676, test_loss: 1.4344, test_f1: 0.5687
 epoch: 61, train_loss: 0.5803, test_loss: 1.5565, test_f1: 0.5542
 epoch: 62, train_loss: 0.5655, test_loss: 1.7612, test_f1: 0.5826
 epoch: 63, train_loss: 0.5379, test_loss: 1.6338, test_f1: 0.5776
 epoch: 64, train_loss: 0.5676, test_loss: 1.7090, test_f1: 0.5679
 epoch: 65, train_loss: 0.5278, test_loss: 1.5651, test_f1: 0.5752
 epoch: 66, train_loss: 0.5711, test_loss: 1.7372, test_f1: 0.5635
 epoch: 67, train_loss: 0.5443, test_loss: 1.7608, test_f1: 0.5861
 epoch: 68, train_loss: 0.5451, test_loss: 1.4016, test_f1: 0.5841
 epoch: 69, train_loss: 0.5608, test_loss: 1.5689, test_f1: 0.5776
 epoch: 70, train_loss: 0.5105, test_loss: 1.7357, test_f1: 0.5663
 epoch: 71, train_loss: 0.5671, test_loss: 1.5307, test_f1: 0.5667
 epoch: 72, train_loss: 0.5636, test_loss: 1.9020, test_f1: 0.5586
 epoch: 73, train_loss: 0.5518, test_loss: 1.4878, test_f1: 0.5903
 epoch: 74, train_loss: 0.5196, test_loss: 1.9956, test_f1: 0.5625
 epoch: 75, train_loss: 0.4813, test_loss: 1.9035, test_f1: 0.5558
 epoch: 76, train_loss: 0.5154, test_loss: 1.8807, test_f1: 0.5525
 epoch: 77, train_loss: 0.5247, test_loss: 1.7051, test_f1: 0.5834
 epoch: 78, train_loss: 0.5212, test_loss: 1.8852, test_f1: 0.5721
 epoch: 79, train_loss: 0.5200, test_loss: 1.8717, test_f1: 0.5759
 epoch: 80, train_loss: 0.5213, test_loss: 1.6916, test_f1: 0.5722
 epoch: 81, train_loss: 0.5094, test_loss: 1.7128, test_f1: 0.5805
 epoch: 82, train_loss: 0.4974, test_loss: 1.7258, test_f1: 0.5973
 epoch: 83, train_loss: 0.5046, test_loss: 2.0248, test_f1: 0.5502
 epoch: 84, train_loss: 0.4787, test_loss: 1.9190, test_f1: 0.5139
 epoch: 85, train_loss: 0.4795, test_loss: 2.1086, test_f1: 0.5440
 epoch: 86, train_loss: 0.4715, test_loss: 1.7731, test_f1: 0.5354
 epoch: 87, train_loss: 0.4981, test_loss: 1.9106, test_f1: 0.5631
 epoch: 88, train_loss: 0.5144, test_loss: 1.8883, test_f1: 0.5870
 epoch: 89, train_loss: 0.4647, test_loss: 2.0811, test_f1: 0.5717
 epoch: 90, train_loss: 0.4730, test_loss: 2.0878, test_f1: 0.5704
 epoch: 91, train_loss: 0.4540, test_loss: 1.9593, test_f1: 0.5373
 epoch: 92, train_loss: 0.4516, test_loss: 2.2304, test_f1: 0.5576
 epoch: 93, train_loss: 0.4632, test_loss: 2.5367, test_f1: 0.5811
 epoch: 94, train_loss: 0.4715, test_loss: 2.0112, test_f1: 0.6011
 epoch: 95, train_loss: 0.4707, test_loss: 1.8699, test_f1: 0.5860
 epoch: 96, train_loss: 0.4437, test_loss: 1.8478, test_f1: 0.5636
 epoch: 97, train_loss: 0.4639, test_loss: 1.8606, test_f1: 0.6127
 epoch: 98, train_loss: 0.4881, test_loss: 1.6776, test_f1: 0.5535
 epoch: 99, train_loss: 0.4469, test_loss: 1.8416, test_f1: 0.5816
##################ITERATION #6 ****************************************
 epoch: 0, train_loss: 1.2641, test_loss: 1.2620, test_f1: 0.3030
 epoch: 1, train_loss: 1.1183, test_loss: 1.2308, test_f1: 0.4631
 epoch: 2, train_loss: 1.0432, test_loss: 1.0929, test_f1: 0.4759
 epoch: 3, train_loss: 0.9740, test_loss: 1.1342, test_f1: 0.4685
 epoch: 4, train_loss: 0.9605, test_loss: 1.1268, test_f1: 0.4632
 epoch: 5, train_loss: 0.9169, test_loss: 1.0524, test_f1: 0.4648
 epoch: 6, train_loss: 0.9067, test_loss: 1.1498, test_f1: 0.4855
 epoch: 7, train_loss: 0.9182, test_loss: 1.0657, test_f1: 0.5330
 epoch: 8, train_loss: 0.9142, test_loss: 1.0309, test_f1: 0.4039
 epoch: 9, train_loss: 0.9092, test_loss: 1.0212, test_f1: 0.5708
 epoch: 10, train_loss: 0.9013, test_loss: 1.2285, test_f1: 0.5057
 epoch: 11, train_loss: 0.8713, test_loss: 1.0013, test_f1: 0.5902
 epoch: 12, train_loss: 0.8328, test_loss: 1.1428, test_f1: 0.5505
 epoch: 13, train_loss: 0.8341, test_loss: 0.9906, test_f1: 0.5025
 epoch: 14, train_loss: 0.8708, test_loss: 1.3100, test_f1: 0.5391
 epoch: 15, train_loss: 0.8323, test_loss: 1.3889, test_f1: 0.5771
 epoch: 16, train_loss: 0.8119, test_loss: 1.1670, test_f1: 0.5285
 epoch: 17, train_loss: 0.8169, test_loss: 1.0782, test_f1: 0.5586
 epoch: 18, train_loss: 0.8292, test_loss: 1.2055, test_f1: 0.5061
 epoch: 19, train_loss: 0.8297, test_loss: 1.1143, test_f1: 0.4907
 epoch: 20, train_loss: 0.8217, test_loss: 0.9884, test_f1: 0.5683
 epoch: 21, train_loss: 0.7966, test_loss: 0.9956, test_f1: 0.5789
 epoch: 22, train_loss: 0.8052, test_loss: 0.9811, test_f1: 0.5345
 epoch: 23, train_loss: 0.8035, test_loss: 1.2464, test_f1: 0.5234
 epoch: 24, train_loss: 0.8114, test_loss: 1.0828, test_f1: 0.5817
 epoch: 25, train_loss: 0.7894, test_loss: 1.3485, test_f1: 0.5692
 epoch: 26, train_loss: 0.7718, test_loss: 1.3426, test_f1: 0.4504
 epoch: 27, train_loss: 0.8023, test_loss: 0.9571, test_f1: 0.6257
 epoch: 28, train_loss: 0.7627, test_loss: 1.0314, test_f1: 0.5413
 epoch: 29, train_loss: 0.7806, test_loss: 1.2903, test_f1: 0.5994
 epoch: 30, train_loss: 0.7863, test_loss: 2.6039, test_f1: 0.5151
 epoch: 31, train_loss: 0.8460, test_loss: 1.2723, test_f1: 0.4680
 epoch: 32, train_loss: 0.7780, test_loss: 1.1286, test_f1: 0.5508
 epoch: 33, train_loss: 0.7587, test_loss: 1.1381, test_f1: 0.5121
 epoch: 34, train_loss: 0.7695, test_loss: 1.1326, test_f1: 0.5525
 epoch: 35, train_loss: 0.7589, test_loss: 1.2627, test_f1: 0.4808
 epoch: 36, train_loss: 0.7565, test_loss: 1.2302, test_f1: 0.5532
 epoch: 37, train_loss: 0.7818, test_loss: 1.2147, test_f1: 0.5644
 epoch: 38, train_loss: 0.7693, test_loss: 1.1584, test_f1: 0.5836
 epoch: 39, train_loss: 0.7561, test_loss: 1.2402, test_f1: 0.5472
 epoch: 40, train_loss: 0.7356, test_loss: 0.9747, test_f1: 0.6326
 epoch: 41, train_loss: 0.7373, test_loss: 1.1045, test_f1: 0.5465
 epoch: 42, train_loss: 0.7354, test_loss: 1.2666, test_f1: 0.5057
 epoch: 43, train_loss: 0.7539, test_loss: 1.0731, test_f1: 0.5738
 epoch: 44, train_loss: 0.7335, test_loss: 1.0730, test_f1: 0.5898
 epoch: 45, train_loss: 0.7008, test_loss: 1.0581, test_f1: 0.6026
 epoch: 46, train_loss: 0.7163, test_loss: 1.6594, test_f1: 0.5087
 epoch: 47, train_loss: 0.7125, test_loss: 1.1309, test_f1: 0.5646
 epoch: 48, train_loss: 0.7182, test_loss: 1.1489, test_f1: 0.5968
 epoch: 49, train_loss: 0.7187, test_loss: 0.9430, test_f1: 0.5991
 epoch: 50, train_loss: 0.6761, test_loss: 1.2168, test_f1: 0.5470
 epoch: 51, train_loss: 0.6430, test_loss: 1.0756, test_f1: 0.6290
 epoch: 52, train_loss: 0.6349, test_loss: 1.1429, test_f1: 0.6376
 epoch: 53, train_loss: 0.6943, test_loss: 1.1447, test_f1: 0.5726
 epoch: 54, train_loss: 0.6597, test_loss: 1.0357, test_f1: 0.6250
 epoch: 55, train_loss: 0.6378, test_loss: 1.1226, test_f1: 0.5909
 epoch: 56, train_loss: 0.6296, test_loss: 1.1488, test_f1: 0.6028
 epoch: 57, train_loss: 0.6315, test_loss: 1.1088, test_f1: 0.6297
 epoch: 58, train_loss: 0.6079, test_loss: 1.0823, test_f1: 0.5876
 epoch: 59, train_loss: 0.6326, test_loss: 1.1163, test_f1: 0.6064
 epoch: 60, train_loss: 0.6131, test_loss: 1.1512, test_f1: 0.6421
 epoch: 61, train_loss: 0.6229, test_loss: 1.2494, test_f1: 0.5660
 epoch: 62, train_loss: 0.5909, test_loss: 1.0961, test_f1: 0.6486
 epoch: 63, train_loss: 0.5859, test_loss: 1.2194, test_f1: 0.6207
 epoch: 64, train_loss: 0.6016, test_loss: 1.1250, test_f1: 0.6031
 epoch: 65, train_loss: 0.5920, test_loss: 1.3393, test_f1: 0.5358
 epoch: 66, train_loss: 0.5944, test_loss: 1.3882, test_f1: 0.5926
 epoch: 67, train_loss: 0.5751, test_loss: 1.2581, test_f1: 0.5733
 epoch: 68, train_loss: 0.5702, test_loss: 1.3888, test_f1: 0.5898
 epoch: 69, train_loss: 0.5883, test_loss: 1.4725, test_f1: 0.6183
 epoch: 70, train_loss: 0.6121, test_loss: 1.2580, test_f1: 0.5873
 epoch: 71, train_loss: 0.5911, test_loss: 1.2914, test_f1: 0.5675
 epoch: 72, train_loss: 0.5597, test_loss: 1.4889, test_f1: 0.5560
 epoch: 73, train_loss: 0.5793, test_loss: 1.5766, test_f1: 0.5051
 epoch: 74, train_loss: 0.5430, test_loss: 1.5119, test_f1: 0.5604
 epoch: 75, train_loss: 0.5767, test_loss: 1.6996, test_f1: 0.5641
 epoch: 76, train_loss: 0.5872, test_loss: 1.3042, test_f1: 0.5986
 epoch: 77, train_loss: 0.5504, test_loss: 1.4885, test_f1: 0.5659
 epoch: 78, train_loss: 0.5718, test_loss: 1.2941, test_f1: 0.5738
 epoch: 79, train_loss: 0.5247, test_loss: 1.5571, test_f1: 0.5629
 epoch: 80, train_loss: 0.5537, test_loss: 1.3571, test_f1: 0.5906
 epoch: 81, train_loss: 0.5369, test_loss: 1.5502, test_f1: 0.5687
 epoch: 82, train_loss: 0.5231, test_loss: 1.4572, test_f1: 0.5554
 epoch: 83, train_loss: 0.5184, test_loss: 1.4595, test_f1: 0.5913
 epoch: 84, train_loss: 0.5382, test_loss: 1.3533, test_f1: 0.6090
 epoch: 85, train_loss: 0.5305, test_loss: 1.6326, test_f1: 0.5443
 epoch: 86, train_loss: 0.5212, test_loss: 1.6067, test_f1: 0.5657
 epoch: 87, train_loss: 0.5268, test_loss: 1.6090, test_f1: 0.5870
 epoch: 88, train_loss: 0.4980, test_loss: 1.5480, test_f1: 0.5761
 epoch: 89, train_loss: 0.4923, test_loss: 1.7512, test_f1: 0.5776
 epoch: 90, train_loss: 0.5115, test_loss: 1.6541, test_f1: 0.5973
 epoch: 91, train_loss: 0.4991, test_loss: 1.8838, test_f1: 0.5299
 epoch: 92, train_loss: 0.4806, test_loss: 1.6084, test_f1: 0.5693
 epoch: 93, train_loss: 0.5265, test_loss: 1.4619, test_f1: 0.5232
 epoch: 94, train_loss: 0.5058, test_loss: 1.6054, test_f1: 0.5275
 epoch: 95, train_loss: 0.4748, test_loss: 1.6857, test_f1: 0.5816
 epoch: 96, train_loss: 0.4889, test_loss: 1.3535, test_f1: 0.6131
 epoch: 97, train_loss: 0.5011, test_loss: 1.7026, test_f1: 0.5481
 epoch: 98, train_loss: 0.4638, test_loss: 1.6107, test_f1: 0.5195
 epoch: 99, train_loss: 0.4798, test_loss: 1.4558, test_f1: 0.5866
##################ITERATION #7 ****************************************
 epoch: 0, train_loss: 1.2305, test_loss: 1.2983, test_f1: 0.2437
 epoch: 1, train_loss: 1.1101, test_loss: 1.2011, test_f1: 0.4008
 epoch: 2, train_loss: 1.0286, test_loss: 1.1744, test_f1: 0.3936
 epoch: 3, train_loss: 0.9577, test_loss: 1.0750, test_f1: 0.5530
 epoch: 4, train_loss: 0.9746, test_loss: 1.1008, test_f1: 0.4330
 epoch: 5, train_loss: 0.9196, test_loss: 1.0070, test_f1: 0.5204
 epoch: 6, train_loss: 0.9190, test_loss: 1.0457, test_f1: 0.5455
 epoch: 7, train_loss: 0.9199, test_loss: 1.0546, test_f1: 0.5281
 epoch: 8, train_loss: 0.8906, test_loss: 1.0317, test_f1: 0.5751
 epoch: 9, train_loss: 0.8599, test_loss: 1.2001, test_f1: 0.4743
 epoch: 10, train_loss: 0.8586, test_loss: 1.0275, test_f1: 0.5659
 epoch: 11, train_loss: 0.8636, test_loss: 1.1452, test_f1: 0.4283
 epoch: 12, train_loss: 0.8925, test_loss: 1.1070, test_f1: 0.5156
 epoch: 13, train_loss: 0.8566, test_loss: 1.1910, test_f1: 0.4928
 epoch: 14, train_loss: 0.8468, test_loss: 1.0812, test_f1: 0.5336
 epoch: 15, train_loss: 0.8252, test_loss: 1.0648, test_f1: 0.5459
 epoch: 16, train_loss: 0.8387, test_loss: 1.1380, test_f1: 0.4889
 epoch: 17, train_loss: 0.8442, test_loss: 1.0550, test_f1: 0.5691
 epoch: 18, train_loss: 0.8313, test_loss: 1.0203, test_f1: 0.4362
 epoch: 19, train_loss: 0.8264, test_loss: 1.0343, test_f1: 0.5273
 epoch: 20, train_loss: 0.8367, test_loss: 1.0549, test_f1: 0.5286
 epoch: 21, train_loss: 0.8477, test_loss: 1.0325, test_f1: 0.5696
 epoch: 22, train_loss: 0.8216, test_loss: 1.1053, test_f1: 0.4093
 epoch: 23, train_loss: 0.8414, test_loss: 1.6259, test_f1: 0.4420
 epoch: 24, train_loss: 0.7975, test_loss: 1.0579, test_f1: 0.4451
 epoch: 25, train_loss: 0.7905, test_loss: 1.9589, test_f1: 0.5445
 epoch: 26, train_loss: 0.7939, test_loss: 1.7408, test_f1: 0.5324
 epoch: 27, train_loss: 0.8124, test_loss: 1.6944, test_f1: 0.4389
 epoch: 28, train_loss: 0.8242, test_loss: 1.1161, test_f1: 0.4789
 epoch: 29, train_loss: 0.8196, test_loss: 1.0225, test_f1: 0.5122
 epoch: 30, train_loss: 0.7835, test_loss: 1.2257, test_f1: 0.5439
 epoch: 31, train_loss: 0.8227, test_loss: 1.1828, test_f1: 0.5199
 epoch: 32, train_loss: 0.7884, test_loss: 1.6567, test_f1: 0.3941
 epoch: 33, train_loss: 0.7784, test_loss: 1.3285, test_f1: 0.5655
 epoch: 34, train_loss: 0.7999, test_loss: 1.1687, test_f1: 0.5409
 epoch: 35, train_loss: 0.7715, test_loss: 2.3669, test_f1: 0.5431
 epoch: 36, train_loss: 0.7965, test_loss: 1.1826, test_f1: 0.5185
 epoch: 37, train_loss: 0.7706, test_loss: 1.2825, test_f1: 0.6011
 epoch: 38, train_loss: 0.7780, test_loss: 1.2318, test_f1: 0.4909
 epoch: 39, train_loss: 0.7740, test_loss: 1.1672, test_f1: 0.4322
 epoch: 40, train_loss: 0.7742, test_loss: 1.8913, test_f1: 0.4547
 epoch: 41, train_loss: 0.7561, test_loss: 2.0438, test_f1: 0.5191
 epoch: 42, train_loss: 0.7528, test_loss: 1.6784, test_f1: 0.5097
 epoch: 43, train_loss: 0.7787, test_loss: 1.0369, test_f1: 0.5759
 epoch: 44, train_loss: 0.7522, test_loss: 1.4661, test_f1: 0.5231
 epoch: 45, train_loss: 0.7279, test_loss: 1.6590, test_f1: 0.5252
 epoch: 46, train_loss: 0.7526, test_loss: 2.9186, test_f1: 0.5110
 epoch: 47, train_loss: 0.7193, test_loss: 1.2594, test_f1: 0.5498
 epoch: 48, train_loss: 0.7473, test_loss: 2.2246, test_f1: 0.5421
 epoch: 49, train_loss: 0.7365, test_loss: 1.3746, test_f1: 0.6077
 epoch: 50, train_loss: 0.7003, test_loss: 5.8335, test_f1: 0.4090
 epoch: 51, train_loss: 0.7002, test_loss: 1.7085, test_f1: 0.5630
 epoch: 52, train_loss: 0.6890, test_loss: 1.6864, test_f1: 0.5510
 epoch: 53, train_loss: 0.6312, test_loss: 1.7930, test_f1: 0.5790
 epoch: 54, train_loss: 0.6490, test_loss: 2.1739, test_f1: 0.6108
 epoch: 55, train_loss: 0.6544, test_loss: 2.3219, test_f1: 0.5620
 epoch: 56, train_loss: 0.6632, test_loss: 1.5910, test_f1: 0.5445
 epoch: 57, train_loss: 0.6477, test_loss: 1.4087, test_f1: 0.5920
 epoch: 58, train_loss: 0.6550, test_loss: 1.1323, test_f1: 0.6156
 epoch: 59, train_loss: 0.6557, test_loss: 1.6415, test_f1: 0.4882
 epoch: 60, train_loss: 0.6113, test_loss: 2.4354, test_f1: 0.5646
 epoch: 61, train_loss: 0.6223, test_loss: 2.1798, test_f1: 0.5478
 epoch: 62, train_loss: 0.6044, test_loss: 2.2081, test_f1: 0.5466
 epoch: 63, train_loss: 0.6317, test_loss: 2.1836, test_f1: 0.5560
 epoch: 64, train_loss: 0.6325, test_loss: 1.6312, test_f1: 0.5384
 epoch: 65, train_loss: 0.6011, test_loss: 1.9804, test_f1: 0.5677
 epoch: 66, train_loss: 0.6166, test_loss: 1.8258, test_f1: 0.5199
 epoch: 67, train_loss: 0.5841, test_loss: 1.7676, test_f1: 0.5812
 epoch: 68, train_loss: 0.5916, test_loss: 1.6901, test_f1: 0.5501
 epoch: 69, train_loss: 0.5822, test_loss: 2.1136, test_f1: 0.6127
 epoch: 70, train_loss: 0.5668, test_loss: 1.9659, test_f1: 0.5630
 epoch: 71, train_loss: 0.5909, test_loss: 1.5131, test_f1: 0.5639
 epoch: 72, train_loss: 0.5783, test_loss: 2.1612, test_f1: 0.5550
 epoch: 73, train_loss: 0.5933, test_loss: 1.8579, test_f1: 0.5619
 epoch: 74, train_loss: 0.5611, test_loss: 2.3331, test_f1: 0.4802
 epoch: 75, train_loss: 0.5803, test_loss: 1.8488, test_f1: 0.5607
 epoch: 76, train_loss: 0.5539, test_loss: 2.0526, test_f1: 0.5657
 epoch: 77, train_loss: 0.5429, test_loss: 3.2811, test_f1: 0.5019
 epoch: 78, train_loss: 0.5604, test_loss: 2.6113, test_f1: 0.5520
 epoch: 79, train_loss: 0.5491, test_loss: 2.2128, test_f1: 0.5452
 epoch: 80, train_loss: 0.5387, test_loss: 1.7830, test_f1: 0.5624
 epoch: 81, train_loss: 0.5426, test_loss: 2.7887, test_f1: 0.5228
 epoch: 82, train_loss: 0.5311, test_loss: 2.2424, test_f1: 0.5307
 epoch: 83, train_loss: 0.5483, test_loss: 2.1451, test_f1: 0.5583
 epoch: 84, train_loss: 0.5360, test_loss: 2.7352, test_f1: 0.5508
 epoch: 85, train_loss: 0.5298, test_loss: 1.8327, test_f1: 0.6218
 epoch: 86, train_loss: 0.5243, test_loss: 2.1148, test_f1: 0.5415
 epoch: 87, train_loss: 0.5092, test_loss: 2.0128, test_f1: 0.5450
 epoch: 88, train_loss: 0.5198, test_loss: 2.9921, test_f1: 0.4937
 epoch: 89, train_loss: 0.5032, test_loss: 2.3337, test_f1: 0.5651
 epoch: 90, train_loss: 0.5193, test_loss: 2.1243, test_f1: 0.4504
 epoch: 91, train_loss: 0.5121, test_loss: 1.9208, test_f1: 0.5246
 epoch: 92, train_loss: 0.4790, test_loss: 2.2034, test_f1: 0.5865
 epoch: 93, train_loss: 0.4951, test_loss: 2.5419, test_f1: 0.5564
 epoch: 94, train_loss: 0.4691, test_loss: 2.1265, test_f1: 0.5587
 epoch: 95, train_loss: 0.5153, test_loss: 1.8507, test_f1: 0.5816
 epoch: 96, train_loss: 0.4773, test_loss: 2.6083, test_f1: 0.5465
 epoch: 97, train_loss: 0.4785, test_loss: 2.4851, test_f1: 0.5255
 epoch: 98, train_loss: 0.5069, test_loss: 1.6075, test_f1: 0.5647
 epoch: 99, train_loss: 0.4787, test_loss: 2.1198, test_f1: 0.5253
##################ITERATION #8 ****************************************
 epoch: 0, train_loss: 1.2277, test_loss: 1.2545, test_f1: 0.3106
 epoch: 1, train_loss: 1.0831, test_loss: 1.1856, test_f1: 0.3829
 epoch: 2, train_loss: 1.0048, test_loss: 1.2425, test_f1: 0.3716
 epoch: 3, train_loss: 0.9560, test_loss: 1.1222, test_f1: 0.5510
 epoch: 4, train_loss: 0.9014, test_loss: 1.2102, test_f1: 0.5000
 epoch: 5, train_loss: 0.9394, test_loss: 1.0492, test_f1: 0.4279
 epoch: 6, train_loss: 0.9022, test_loss: 1.2692, test_f1: 0.4745
 epoch: 7, train_loss: 0.9096, test_loss: 1.0986, test_f1: 0.5313
 epoch: 8, train_loss: 0.8772, test_loss: 1.3250, test_f1: 0.4676
 epoch: 9, train_loss: 0.8549, test_loss: 1.0658, test_f1: 0.5292
 epoch: 10, train_loss: 0.8521, test_loss: 1.2319, test_f1: 0.5112
 epoch: 11, train_loss: 0.8539, test_loss: 1.0851, test_f1: 0.4376
 epoch: 12, train_loss: 0.8270, test_loss: 1.4061, test_f1: 0.4653
 epoch: 13, train_loss: 0.8019, test_loss: 1.0024, test_f1: 0.5819
 epoch: 14, train_loss: 0.8128, test_loss: 1.0454, test_f1: 0.5553
 epoch: 15, train_loss: 0.7920, test_loss: 1.4955, test_f1: 0.4803
 epoch: 16, train_loss: 0.8117, test_loss: 1.2704, test_f1: 0.5286
 epoch: 17, train_loss: 0.8003, test_loss: 1.0075, test_f1: 0.5997
 epoch: 18, train_loss: 0.7855, test_loss: 0.9891, test_f1: 0.5662
 epoch: 19, train_loss: 0.8038, test_loss: 1.1551, test_f1: 0.5252
 epoch: 20, train_loss: 0.7788, test_loss: 1.9954, test_f1: 0.4576
 epoch: 21, train_loss: 0.8108, test_loss: 1.0963, test_f1: 0.5598
 epoch: 22, train_loss: 0.7820, test_loss: 1.1831, test_f1: 0.5608
 epoch: 23, train_loss: 0.7579, test_loss: 1.0392, test_f1: 0.5763
 epoch: 24, train_loss: 0.7671, test_loss: 1.4213, test_f1: 0.4795
 epoch: 25, train_loss: 0.7610, test_loss: 1.5650, test_f1: 0.5958
 epoch: 26, train_loss: 0.7808, test_loss: 1.2117, test_f1: 0.5221
 epoch: 27, train_loss: 0.8093, test_loss: 1.5157, test_f1: 0.4863
 epoch: 28, train_loss: 0.7709, test_loss: 1.1769, test_f1: 0.5258
 epoch: 29, train_loss: 0.7317, test_loss: 1.2753, test_f1: 0.5732
 epoch: 30, train_loss: 0.7218, test_loss: 1.3857, test_f1: 0.5096
 epoch: 31, train_loss: 0.7697, test_loss: 1.2407, test_f1: 0.5110
 epoch: 32, train_loss: 0.7809, test_loss: 1.6060, test_f1: 0.4403
 epoch: 33, train_loss: 0.7653, test_loss: 1.1749, test_f1: 0.5635
 epoch: 34, train_loss: 0.7473, test_loss: 1.0612, test_f1: 0.5923
 epoch: 35, train_loss: 0.7140, test_loss: 1.4616, test_f1: 0.5250
 epoch: 36, train_loss: 0.7685, test_loss: 1.0920, test_f1: 0.5916
 epoch: 37, train_loss: 0.7365, test_loss: 1.3438, test_f1: 0.5335
 epoch: 38, train_loss: 0.7333, test_loss: 1.2540, test_f1: 0.4985
 epoch: 39, train_loss: 0.7065, test_loss: 1.1192, test_f1: 0.5178
 epoch: 40, train_loss: 0.7039, test_loss: 1.2175, test_f1: 0.5224
 epoch: 41, train_loss: 0.7447, test_loss: 1.1988, test_f1: 0.5745
 epoch: 42, train_loss: 0.7391, test_loss: 1.1842, test_f1: 0.5630
 epoch: 43, train_loss: 0.7242, test_loss: 1.6171, test_f1: 0.5278
 epoch: 44, train_loss: 0.6983, test_loss: 1.7429, test_f1: 0.5412
 epoch: 45, train_loss: 0.6644, test_loss: 1.4580, test_f1: 0.5106
 epoch: 46, train_loss: 0.6802, test_loss: 1.5953, test_f1: 0.4918
 epoch: 47, train_loss: 0.7068, test_loss: 1.6300, test_f1: 0.5197
 epoch: 48, train_loss: 0.6737, test_loss: 1.2656, test_f1: 0.5351
 epoch: 49, train_loss: 0.6948, test_loss: 1.8024, test_f1: 0.5015
 epoch: 50, train_loss: 0.6681, test_loss: 2.0263, test_f1: 0.5351
 epoch: 51, train_loss: 0.6313, test_loss: 2.4183, test_f1: 0.5221
 epoch: 52, train_loss: 0.6292, test_loss: 1.7618, test_f1: 0.5120
 epoch: 53, train_loss: 0.5980, test_loss: 1.7188, test_f1: 0.5369
 epoch: 54, train_loss: 0.5949, test_loss: 1.5543, test_f1: 0.5703
 epoch: 55, train_loss: 0.5766, test_loss: 1.9308, test_f1: 0.5243
 epoch: 56, train_loss: 0.5852, test_loss: 1.8827, test_f1: 0.5565
 epoch: 57, train_loss: 0.5828, test_loss: 2.0613, test_f1: 0.5423
 epoch: 58, train_loss: 0.5885, test_loss: 1.5450, test_f1: 0.5424
 epoch: 59, train_loss: 0.5885, test_loss: 1.6211, test_f1: 0.5292
 epoch: 60, train_loss: 0.5904, test_loss: 1.2348, test_f1: 0.5080
 epoch: 61, train_loss: 0.5804, test_loss: 1.6860, test_f1: 0.5052
 epoch: 62, train_loss: 0.5492, test_loss: 1.5428, test_f1: 0.5350
 epoch: 63, train_loss: 0.5757, test_loss: 1.5308, test_f1: 0.5452
 epoch: 64, train_loss: 0.5572, test_loss: 1.9960, test_f1: 0.4943
 epoch: 65, train_loss: 0.6020, test_loss: 1.3863, test_f1: 0.5843
 epoch: 66, train_loss: 0.5456, test_loss: 1.8758, test_f1: 0.5182
 epoch: 67, train_loss: 0.5554, test_loss: 1.6948, test_f1: 0.5318
 epoch: 68, train_loss: 0.5526, test_loss: 2.0574, test_f1: 0.5019
 epoch: 69, train_loss: 0.5349, test_loss: 1.9816, test_f1: 0.5266
 epoch: 70, train_loss: 0.5335, test_loss: 1.5140, test_f1: 0.5511
 epoch: 71, train_loss: 0.5382, test_loss: 1.3907, test_f1: 0.5184
 epoch: 72, train_loss: 0.5336, test_loss: 1.4811, test_f1: 0.5509
 epoch: 73, train_loss: 0.5100, test_loss: 1.5026, test_f1: 0.5388
 epoch: 74, train_loss: 0.5585, test_loss: 1.5317, test_f1: 0.5487
 epoch: 75, train_loss: 0.5416, test_loss: 1.6487, test_f1: 0.5250
 epoch: 76, train_loss: 0.5205, test_loss: 1.7700, test_f1: 0.5117
 epoch: 77, train_loss: 0.5297, test_loss: 1.9119, test_f1: 0.5050
 epoch: 78, train_loss: 0.5206, test_loss: 1.5066, test_f1: 0.5222
 epoch: 79, train_loss: 0.4930, test_loss: 1.8734, test_f1: 0.5285
 epoch: 80, train_loss: 0.5015, test_loss: 1.5001, test_f1: 0.5284
 epoch: 81, train_loss: 0.5232, test_loss: 2.0794, test_f1: 0.5172
 epoch: 82, train_loss: 0.5095, test_loss: 1.6253, test_f1: 0.5187
 epoch: 83, train_loss: 0.5094, test_loss: 2.4078, test_f1: 0.4701
 epoch: 84, train_loss: 0.4829, test_loss: 1.9728, test_f1: 0.4769
 epoch: 85, train_loss: 0.4756, test_loss: 2.0825, test_f1: 0.5104
 epoch: 86, train_loss: 0.4856, test_loss: 1.6501, test_f1: 0.5271
 epoch: 87, train_loss: 0.4849, test_loss: 1.7439, test_f1: 0.5291
 epoch: 88, train_loss: 0.4854, test_loss: 1.4858, test_f1: 0.5941
 epoch: 89, train_loss: 0.4930, test_loss: 1.8991, test_f1: 0.5290
 epoch: 90, train_loss: 0.5002, test_loss: 1.5576, test_f1: 0.5680
 epoch: 91, train_loss: 0.4750, test_loss: 1.7760, test_f1: 0.5465
 epoch: 92, train_loss: 0.4582, test_loss: 2.0042, test_f1: 0.5142
 epoch: 93, train_loss: 0.4461, test_loss: 2.0888, test_f1: 0.5226
 epoch: 94, train_loss: 0.4590, test_loss: 1.8967, test_f1: 0.5338
 epoch: 95, train_loss: 0.4388, test_loss: 2.1708, test_f1: 0.5583
 epoch: 96, train_loss: 0.4682, test_loss: 1.9040, test_f1: 0.5379
 epoch: 97, train_loss: 0.4601, test_loss: 2.1947, test_f1: 0.5454
 epoch: 98, train_loss: 0.4657, test_loss: 1.9540, test_f1: 0.5216
 epoch: 99, train_loss: 0.4474, test_loss: 2.5715, test_f1: 0.4720
##################ITERATION #9 ****************************************
 epoch: 0, train_loss: 1.2709, test_loss: 1.2424, test_f1: 0.3950
 epoch: 1, train_loss: 1.1130, test_loss: 1.3132, test_f1: 0.3909
 epoch: 2, train_loss: 1.0479, test_loss: 1.1059, test_f1: 0.5117
 epoch: 3, train_loss: 0.9787, test_loss: 1.1030, test_f1: 0.4834
 epoch: 4, train_loss: 0.9747, test_loss: 1.0923, test_f1: 0.5074
 epoch: 5, train_loss: 0.9403, test_loss: 1.3322, test_f1: 0.4458
 epoch: 6, train_loss: 0.8906, test_loss: 1.1129, test_f1: 0.5049
 epoch: 7, train_loss: 0.8977, test_loss: 1.0832, test_f1: 0.5104
 epoch: 8, train_loss: 0.8755, test_loss: 1.1231, test_f1: 0.5415
 epoch: 9, train_loss: 0.8440, test_loss: 1.3513, test_f1: 0.5052
 epoch: 10, train_loss: 0.8714, test_loss: 1.0902, test_f1: 0.5946
 epoch: 11, train_loss: 0.8553, test_loss: 1.2996, test_f1: 0.5172
 epoch: 12, train_loss: 0.8237, test_loss: 1.0524, test_f1: 0.5272
 epoch: 13, train_loss: 0.8333, test_loss: 1.2153, test_f1: 0.5371
 epoch: 14, train_loss: 0.8330, test_loss: 1.0260, test_f1: 0.5472
 epoch: 15, train_loss: 0.8501, test_loss: 1.2335, test_f1: 0.5076
 epoch: 16, train_loss: 0.8129, test_loss: 1.0273, test_f1: 0.5710
 epoch: 17, train_loss: 0.7878, test_loss: 1.1790, test_f1: 0.5538
 epoch: 18, train_loss: 0.7945, test_loss: 1.0189, test_f1: 0.5486
 epoch: 19, train_loss: 0.8013, test_loss: 1.1757, test_f1: 0.5748
 epoch: 20, train_loss: 0.7539, test_loss: 1.1382, test_f1: 0.5086
 epoch: 21, train_loss: 0.7675, test_loss: 0.9940, test_f1: 0.5874
 epoch: 22, train_loss: 0.7901, test_loss: 1.0834, test_f1: 0.5558
 epoch: 23, train_loss: 0.7709, test_loss: 1.2941, test_f1: 0.5037
 epoch: 24, train_loss: 0.7664, test_loss: 1.2465, test_f1: 0.5915
 epoch: 25, train_loss: 0.7548, test_loss: 1.1860, test_f1: 0.5256
 epoch: 26, train_loss: 0.7436, test_loss: 1.2475, test_f1: 0.5618
 epoch: 27, train_loss: 0.7428, test_loss: 1.0981, test_f1: 0.5721
 epoch: 28, train_loss: 0.7791, test_loss: 1.4451, test_f1: 0.5377
 epoch: 29, train_loss: 0.7330, test_loss: 1.2337, test_f1: 0.5818
 epoch: 30, train_loss: 0.7396, test_loss: 1.0956, test_f1: 0.5360
 epoch: 31, train_loss: 0.7175, test_loss: 1.1754, test_f1: 0.5765
 epoch: 32, train_loss: 0.7561, test_loss: 0.9773, test_f1: 0.6134
 epoch: 33, train_loss: 0.6966, test_loss: 1.0865, test_f1: 0.5499
 epoch: 34, train_loss: 0.7358, test_loss: 1.0278, test_f1: 0.5886
 epoch: 35, train_loss: 0.6848, test_loss: 1.3150, test_f1: 0.5643
 epoch: 36, train_loss: 0.6951, test_loss: 1.0654, test_f1: 0.5617
 epoch: 37, train_loss: 0.7026, test_loss: 1.2777, test_f1: 0.5419
 epoch: 38, train_loss: 0.6964, test_loss: 1.2168, test_f1: 0.5634
 epoch: 39, train_loss: 0.6753, test_loss: 1.0680, test_f1: 0.5565
 epoch: 40, train_loss: 0.6829, test_loss: 1.1099, test_f1: 0.5856
 epoch: 41, train_loss: 0.6932, test_loss: 1.1035, test_f1: 0.5794
 epoch: 42, train_loss: 0.6910, test_loss: 1.1091, test_f1: 0.6069
 epoch: 43, train_loss: 0.6668, test_loss: 1.1673, test_f1: 0.5365
 epoch: 44, train_loss: 0.6772, test_loss: 1.3550, test_f1: 0.5768
 epoch: 45, train_loss: 0.6609, test_loss: 1.1847, test_f1: 0.5688
 epoch: 46, train_loss: 0.6742, test_loss: 1.6214, test_f1: 0.3864
 epoch: 47, train_loss: 0.6426, test_loss: 1.7427, test_f1: 0.5739
 epoch: 48, train_loss: 0.6351, test_loss: 1.5471, test_f1: 0.6006
 epoch: 49, train_loss: 0.6393, test_loss: 1.2342, test_f1: 0.5629
 epoch: 50, train_loss: 0.6539, test_loss: 1.3178, test_f1: 0.5844
 epoch: 51, train_loss: 0.6076, test_loss: 1.5013, test_f1: 0.5811
 epoch: 52, train_loss: 0.5737, test_loss: 1.6666, test_f1: 0.5862
 epoch: 53, train_loss: 0.5449, test_loss: 1.2914, test_f1: 0.5778
 epoch: 54, train_loss: 0.5560, test_loss: 1.2339, test_f1: 0.5939
 epoch: 55, train_loss: 0.5401, test_loss: 1.7163, test_f1: 0.5433
 epoch: 56, train_loss: 0.5705, test_loss: 1.7897, test_f1: 0.5721
 epoch: 57, train_loss: 0.5544, test_loss: 1.9119, test_f1: 0.5855
 epoch: 58, train_loss: 0.5129, test_loss: 1.8786, test_f1: 0.5856
 epoch: 59, train_loss: 0.5395, test_loss: 1.6454, test_f1: 0.5864
 epoch: 60, train_loss: 0.5409, test_loss: 1.9513, test_f1: 0.6006
 epoch: 61, train_loss: 0.5089, test_loss: 1.9558, test_f1: 0.5821
 epoch: 62, train_loss: 0.4894, test_loss: 2.0596, test_f1: 0.5618
 epoch: 63, train_loss: 0.5246, test_loss: 1.6849, test_f1: 0.5446
 epoch: 64, train_loss: 0.5112, test_loss: 2.0024, test_f1: 0.5269
 epoch: 65, train_loss: 0.4989, test_loss: 1.9428, test_f1: 0.5565
 epoch: 66, train_loss: 0.4742, test_loss: 2.5604, test_f1: 0.5275
 epoch: 67, train_loss: 0.4881, test_loss: 1.4785, test_f1: 0.5650
 epoch: 68, train_loss: 0.4869, test_loss: 1.7161, test_f1: 0.5670
 epoch: 69, train_loss: 0.4905, test_loss: 2.2719, test_f1: 0.5287
 epoch: 70, train_loss: 0.4673, test_loss: 2.6906, test_f1: 0.5396
 epoch: 71, train_loss: 0.4675, test_loss: 2.5376, test_f1: 0.5475
 epoch: 72, train_loss: 0.4842, test_loss: 2.6812, test_f1: 0.5293
 epoch: 73, train_loss: 0.4778, test_loss: 1.5900, test_f1: 0.5742
 epoch: 74, train_loss: 0.4545, test_loss: 2.5853, test_f1: 0.5612
 epoch: 75, train_loss: 0.4466, test_loss: 2.1970, test_f1: 0.5981
 epoch: 76, train_loss: 0.4577, test_loss: 3.4477, test_f1: 0.5147
 epoch: 77, train_loss: 0.4380, test_loss: 2.6388, test_f1: 0.5494
 epoch: 78, train_loss: 0.4590, test_loss: 2.0671, test_f1: 0.4980
 epoch: 79, train_loss: 0.4380, test_loss: 2.2986, test_f1: 0.5657
 epoch: 80, train_loss: 0.4162, test_loss: 2.8603, test_f1: 0.5665
 epoch: 81, train_loss: 0.4268, test_loss: 2.5686, test_f1: 0.5996
 epoch: 82, train_loss: 0.4175, test_loss: 2.4647, test_f1: 0.5729
 epoch: 83, train_loss: 0.4218, test_loss: 3.7281, test_f1: 0.5338
 epoch: 84, train_loss: 0.4683, test_loss: 2.6110, test_f1: 0.5497
 epoch: 85, train_loss: 0.4393, test_loss: 3.1350, test_f1: 0.5569
 epoch: 86, train_loss: 0.4202, test_loss: 2.3979, test_f1: 0.5635
 epoch: 87, train_loss: 0.4235, test_loss: 2.0889, test_f1: 0.5654
 epoch: 88, train_loss: 0.3915, test_loss: 2.8301, test_f1: 0.5940
 epoch: 89, train_loss: 0.4108, test_loss: 2.1653, test_f1: 0.5556
 epoch: 90, train_loss: 0.4058, test_loss: 3.2280, test_f1: 0.5577
 epoch: 91, train_loss: 0.3995, test_loss: 2.7586, test_f1: 0.5727
 epoch: 92, train_loss: 0.3949, test_loss: 2.6093, test_f1: 0.5874
 epoch: 93, train_loss: 0.3960, test_loss: 2.4172, test_f1: 0.6066
 epoch: 94, train_loss: 0.3708, test_loss: 1.9869, test_f1: 0.5796
 epoch: 95, train_loss: 0.3641, test_loss: 2.2278, test_f1: 0.5387
 epoch: 96, train_loss: 0.3885, test_loss: 2.4822, test_f1: 0.5631
 epoch: 97, train_loss: 0.3564, test_loss: 3.2534, test_f1: 0.5404
 epoch: 98, train_loss: 0.3773, test_loss: 3.1591, test_f1: 0.5270
 epoch: 99, train_loss: 0.3993, test_loss: 2.8104, test_f1: 0.5564

Training completed in 494.08 seconds
Best F1: 0.6486 at epoch 62
Mean F1 across iterations: 0.6266  0.0148
========================FINAL RESULTS================================
FEGIN weighted F1: 0.6486  0.0148
python main.py --data ltspice_demos --representation component_component --model FEGIN --layers 2 --hiddens 64 --batch_size 32 --lr 0.01 --emb_size 512 --epochs 100 --save_appendix component_component_L2_H64_BS32_LR0.01_E512 --no_val
-----



STDERR:
  File "main.py", line 370, in <module>
    main()
  File "main.py", line 254, in main
    dataset = dataset_class(
  File "/home/philip/projects/ltspice_examples_code_repo/Circuit-Completion-Using-GNNs/component_classification_with_link_prediction_head/evaluation/FEGIN/kernel/circuit_datasets.py", line 15, in __init__
    self.data, self.slices = torch.load(self.processed_paths[0])
  File "/home/philip/.local/lib/python3.8/site-packages/torch/serialization.py", line 1040, in load
    warnings.warn(
  File "/usr/lib/python3.8/warnings.py", line 109, in _showwarnmsg
    sw(msg.message, msg.category, msg.filename, msg.lineno,
  File "main.py", line 47, in warn_with_traceback
    traceback.print_stack(file=log)
/home/philip/projects/ltspice_examples_code_repo/Circuit-Completion-Using-GNNs/component_classification_with_link_prediction_head/evaluation/FEGIN/kernel/circuit_datasets.py:15: FutureWarning: You are using `torch.load` with `weights_only=False` (the current default value), which uses the default pickle module implicitly. It is possible to construct malicious pickle data which will execute arbitrary code during unpickling (See https://github.com/pytorch/pytorch/blob/main/SECURITY.md#untrusted-models for more details). In a future release, the default value for `weights_only` will be flipped to `True`. This limits the functions that could be executed during unpickling. Arbitrary objects will no longer be allowed to be loaded via this mode unless they are explicitly allowlisted by the user via `torch.serialization.add_safe_globals`. We recommend you start setting `weights_only=True` for any use case where you don't have full control of the loaded file. Please open an issue on GitHub for any issues related to this experimental feature.
  self.data, self.slices = torch.load(self.processed_paths[0])
