STDOUT:
Results will be saved in /home/philip/projects/ltspice_examples_code_repo/Circuit-Completion-Using-GNNs/component_classification_with_link_prediction_head/evaluation/FEGIN/results/model_FEGIN_dataset_ltspice_demos
Command line input: python main.py --data ltspice_demos --representation component_component --model FEGIN --layers 3 --hiddens 128 --batch_size 32 --lr 0.001 --emb_size 512 --epochs 100 --save_appendix component_component_L3_H128_BS32_LR0.001_E512 --no_val
 is saved.
-----
ltspice_demos - FEGIN
Using 3 layers, 128 hidden units, h = 2
Loading component_component representation dataset
ENTERED
Training FEGIN on component_component representation
Train: 1565, Test: 383
##################ITERATION #0 ****************************************
 epoch: 0, train_loss: 1.2235, test_loss: 1.2564, test_f1: 0.2665
 epoch: 1, train_loss: 1.1087, test_loss: 1.2684, test_f1: 0.4020
 epoch: 2, train_loss: 1.0485, test_loss: 1.3165, test_f1: 0.4267
 epoch: 3, train_loss: 1.0233, test_loss: 1.1918, test_f1: 0.4910
 epoch: 4, train_loss: 0.9827, test_loss: 1.1852, test_f1: 0.5018
 epoch: 5, train_loss: 0.9350, test_loss: 1.2300, test_f1: 0.4775
 epoch: 6, train_loss: 0.9290, test_loss: 1.2532, test_f1: 0.5191
 epoch: 7, train_loss: 0.8916, test_loss: 1.1582, test_f1: 0.5373
 epoch: 8, train_loss: 0.8648, test_loss: 1.0677, test_f1: 0.5763
 epoch: 9, train_loss: 0.8595, test_loss: 1.2483, test_f1: 0.5681
 epoch: 10, train_loss: 0.8366, test_loss: 1.2102, test_f1: 0.5505
 epoch: 11, train_loss: 0.8208, test_loss: 1.1475, test_f1: 0.5440
 epoch: 12, train_loss: 0.7941, test_loss: 1.3850, test_f1: 0.4886
 epoch: 13, train_loss: 0.7746, test_loss: 1.1891, test_f1: 0.4908
 epoch: 14, train_loss: 0.7770, test_loss: 1.1572, test_f1: 0.5831
 epoch: 15, train_loss: 0.7465, test_loss: 1.1339, test_f1: 0.5881
 epoch: 16, train_loss: 0.7207, test_loss: 1.3416, test_f1: 0.5206
 epoch: 17, train_loss: 0.7045, test_loss: 1.2574, test_f1: 0.5782
 epoch: 18, train_loss: 0.6922, test_loss: 1.2127, test_f1: 0.6005
 epoch: 19, train_loss: 0.7077, test_loss: 1.3367, test_f1: 0.5900
 epoch: 20, train_loss: 0.6750, test_loss: 1.4117, test_f1: 0.5853
 epoch: 21, train_loss: 0.6460, test_loss: 1.1979, test_f1: 0.5436
 epoch: 22, train_loss: 0.6339, test_loss: 1.2743, test_f1: 0.6084
 epoch: 23, train_loss: 0.6232, test_loss: 1.3772, test_f1: 0.5827
 epoch: 24, train_loss: 0.6221, test_loss: 1.3339, test_f1: 0.5474
 epoch: 25, train_loss: 0.5788, test_loss: 1.4386, test_f1: 0.5396
 epoch: 26, train_loss: 0.5972, test_loss: 1.4799, test_f1: 0.5516
 epoch: 27, train_loss: 0.5969, test_loss: 1.3649, test_f1: 0.5785
 epoch: 28, train_loss: 0.5715, test_loss: 1.7438, test_f1: 0.5180
 epoch: 29, train_loss: 0.5470, test_loss: 1.4021, test_f1: 0.6042
 epoch: 30, train_loss: 0.5484, test_loss: 1.4230, test_f1: 0.5915
 epoch: 31, train_loss: 0.5534, test_loss: 1.6394, test_f1: 0.5386
 epoch: 32, train_loss: 0.5435, test_loss: 1.7387, test_f1: 0.5251
 epoch: 33, train_loss: 0.5292, test_loss: 1.7316, test_f1: 0.5549
 epoch: 34, train_loss: 0.5001, test_loss: 1.6822, test_f1: 0.5690
 epoch: 35, train_loss: 0.4900, test_loss: 1.7256, test_f1: 0.5807
 epoch: 36, train_loss: 0.5149, test_loss: 1.6263, test_f1: 0.5588
 epoch: 37, train_loss: 0.4686, test_loss: 1.7404, test_f1: 0.5871
 epoch: 38, train_loss: 0.4922, test_loss: 1.8650, test_f1: 0.5468
 epoch: 39, train_loss: 0.4620, test_loss: 2.6327, test_f1: 0.5418
 epoch: 40, train_loss: 0.5105, test_loss: 1.9519, test_f1: 0.5232
 epoch: 41, train_loss: 0.4918, test_loss: 1.9500, test_f1: 0.5276
 epoch: 42, train_loss: 0.4613, test_loss: 2.1307, test_f1: 0.5715
 epoch: 43, train_loss: 0.4290, test_loss: 2.1701, test_f1: 0.5687
 epoch: 44, train_loss: 0.4833, test_loss: 2.1938, test_f1: 0.5023
 epoch: 45, train_loss: 0.4809, test_loss: 2.2334, test_f1: 0.4573
 epoch: 46, train_loss: 0.4274, test_loss: 2.3514, test_f1: 0.5330
 epoch: 47, train_loss: 0.4214, test_loss: 2.3393, test_f1: 0.5737
 epoch: 48, train_loss: 0.4555, test_loss: 2.1158, test_f1: 0.5924
 epoch: 49, train_loss: 0.4289, test_loss: 1.7114, test_f1: 0.6119
 epoch: 50, train_loss: 0.4398, test_loss: 2.0604, test_f1: 0.5634
 epoch: 51, train_loss: 0.3623, test_loss: 2.1741, test_f1: 0.5705
 epoch: 52, train_loss: 0.3510, test_loss: 2.1690, test_f1: 0.5370
 epoch: 53, train_loss: 0.3252, test_loss: 2.3226, test_f1: 0.5615
 epoch: 54, train_loss: 0.3235, test_loss: 2.4660, test_f1: 0.5407
 epoch: 55, train_loss: 0.3040, test_loss: 2.7483, test_f1: 0.5384
 epoch: 56, train_loss: 0.3236, test_loss: 2.6844, test_f1: 0.5732
 epoch: 57, train_loss: 0.3243, test_loss: 2.5867, test_f1: 0.5347
 epoch: 58, train_loss: 0.2946, test_loss: 2.7988, test_f1: 0.5528
 epoch: 59, train_loss: 0.2973, test_loss: 2.7551, test_f1: 0.5859
 epoch: 60, train_loss: 0.2897, test_loss: 3.0837, test_f1: 0.5786
 epoch: 61, train_loss: 0.2890, test_loss: 2.5911, test_f1: 0.5836
 epoch: 62, train_loss: 0.2928, test_loss: 2.7940, test_f1: 0.5389
 epoch: 63, train_loss: 0.3099, test_loss: 2.6391, test_f1: 0.5627
 epoch: 64, train_loss: 0.2798, test_loss: 2.5896, test_f1: 0.5143
 epoch: 65, train_loss: 0.2814, test_loss: 3.2375, test_f1: 0.5910
 epoch: 66, train_loss: 0.3069, test_loss: 2.7819, test_f1: 0.5615
 epoch: 67, train_loss: 0.2901, test_loss: 2.5895, test_f1: 0.5792
 epoch: 68, train_loss: 0.2861, test_loss: 3.0708, test_f1: 0.5323
 epoch: 69, train_loss: 0.2515, test_loss: 3.4976, test_f1: 0.5731
 epoch: 70, train_loss: 0.2934, test_loss: 3.4434, test_f1: 0.5327
 epoch: 71, train_loss: 0.2652, test_loss: 3.9401, test_f1: 0.5236
 epoch: 72, train_loss: 0.2457, test_loss: 3.5996, test_f1: 0.5561
 epoch: 73, train_loss: 0.2539, test_loss: 3.3805, test_f1: 0.5748
 epoch: 74, train_loss: 0.2441, test_loss: 3.9432, test_f1: 0.5482
 epoch: 75, train_loss: 0.2669, test_loss: 3.6426, test_f1: 0.5861
 epoch: 76, train_loss: 0.2655, test_loss: 3.2506, test_f1: 0.5895
 epoch: 77, train_loss: 0.2309, test_loss: 3.7098, test_f1: 0.5623
 epoch: 78, train_loss: 0.2943, test_loss: 3.4926, test_f1: 0.5499
 epoch: 79, train_loss: 0.2338, test_loss: 3.6137, test_f1: 0.5932
 epoch: 80, train_loss: 0.2500, test_loss: 4.3589, test_f1: 0.5040
 epoch: 81, train_loss: 0.2869, test_loss: 3.3405, test_f1: 0.5486
 epoch: 82, train_loss: 0.2449, test_loss: 2.7637, test_f1: 0.6055
 epoch: 83, train_loss: 0.2319, test_loss: 3.1879, test_f1: 0.5886
 epoch: 84, train_loss: 0.2389, test_loss: 3.2426, test_f1: 0.5780
 epoch: 85, train_loss: 0.2034, test_loss: 3.2241, test_f1: 0.5914
 epoch: 86, train_loss: 0.2327, test_loss: 3.7724, test_f1: 0.5715
 epoch: 87, train_loss: 0.2220, test_loss: 3.6166, test_f1: 0.5887
 epoch: 88, train_loss: 0.2204, test_loss: 3.4810, test_f1: 0.5490
 epoch: 89, train_loss: 0.2751, test_loss: 3.3356, test_f1: 0.5692
 epoch: 90, train_loss: 0.2070, test_loss: 3.6071, test_f1: 0.5781
 epoch: 91, train_loss: 0.1877, test_loss: 3.6289, test_f1: 0.5681
 epoch: 92, train_loss: 0.2149, test_loss: 3.3455, test_f1: 0.5675
 epoch: 93, train_loss: 0.2071, test_loss: 3.9194, test_f1: 0.5752
 epoch: 94, train_loss: 0.2131, test_loss: 3.5533, test_f1: 0.5995
 epoch: 95, train_loss: 0.2108, test_loss: 3.1706, test_f1: 0.5710
 epoch: 96, train_loss: 0.2250, test_loss: 3.6739, test_f1: 0.5781
 epoch: 97, train_loss: 0.2142, test_loss: 3.4472, test_f1: 0.5364
 epoch: 98, train_loss: 0.2146, test_loss: 4.0880, test_f1: 0.5802
 epoch: 99, train_loss: 0.1786, test_loss: 3.5023, test_f1: 0.6073
##################ITERATION #1 ****************************************
 epoch: 0, train_loss: 1.1566, test_loss: 1.2027, test_f1: 0.3846
 epoch: 1, train_loss: 1.0835, test_loss: 1.1438, test_f1: 0.4934
 epoch: 2, train_loss: 1.0014, test_loss: 1.1589, test_f1: 0.5200
 epoch: 3, train_loss: 0.9383, test_loss: 1.2198, test_f1: 0.4710
 epoch: 4, train_loss: 0.9396, test_loss: 1.1201, test_f1: 0.5420
 epoch: 5, train_loss: 0.9271, test_loss: 1.0687, test_f1: 0.5931
 epoch: 6, train_loss: 0.8785, test_loss: 1.1056, test_f1: 0.5220
 epoch: 7, train_loss: 0.8643, test_loss: 1.0821, test_f1: 0.5988
 epoch: 8, train_loss: 0.8362, test_loss: 1.1940, test_f1: 0.5544
 epoch: 9, train_loss: 0.8289, test_loss: 1.1051, test_f1: 0.5765
 epoch: 10, train_loss: 0.8044, test_loss: 1.3648, test_f1: 0.5611
 epoch: 11, train_loss: 0.7930, test_loss: 1.1801, test_f1: 0.5741
 epoch: 12, train_loss: 0.8001, test_loss: 1.3176, test_f1: 0.5187
 epoch: 13, train_loss: 0.7920, test_loss: 1.0733, test_f1: 0.6030
 epoch: 14, train_loss: 0.7452, test_loss: 1.1208, test_f1: 0.5947
 epoch: 15, train_loss: 0.7120, test_loss: 1.2241, test_f1: 0.5764
 epoch: 16, train_loss: 0.7223, test_loss: 1.2504, test_f1: 0.5842
 epoch: 17, train_loss: 0.7058, test_loss: 1.4069, test_f1: 0.5218
 epoch: 18, train_loss: 0.6993, test_loss: 1.2550, test_f1: 0.5865
 epoch: 19, train_loss: 0.7353, test_loss: 1.3323, test_f1: 0.5571
 epoch: 20, train_loss: 0.6967, test_loss: 1.2839, test_f1: 0.5797
 epoch: 21, train_loss: 0.6608, test_loss: 1.3507, test_f1: 0.6292
 epoch: 22, train_loss: 0.6684, test_loss: 1.7497, test_f1: 0.5537
 epoch: 23, train_loss: 0.6848, test_loss: 1.4919, test_f1: 0.5628
 epoch: 24, train_loss: 0.6496, test_loss: 1.4619, test_f1: 0.5287
 epoch: 25, train_loss: 0.6093, test_loss: 1.4797, test_f1: 0.5423
 epoch: 26, train_loss: 0.6393, test_loss: 1.4144, test_f1: 0.6011
 epoch: 27, train_loss: 0.5995, test_loss: 1.4239, test_f1: 0.5108
 epoch: 28, train_loss: 0.6307, test_loss: 1.5016, test_f1: 0.5859
 epoch: 29, train_loss: 0.5911, test_loss: 1.5752, test_f1: 0.5372
 epoch: 30, train_loss: 0.5819, test_loss: 1.4475, test_f1: 0.5955
 epoch: 31, train_loss: 0.5700, test_loss: 1.4641, test_f1: 0.5936
 epoch: 32, train_loss: 0.5674, test_loss: 1.6179, test_f1: 0.5845
 epoch: 33, train_loss: 0.5773, test_loss: 1.6180, test_f1: 0.5770
 epoch: 34, train_loss: 0.5482, test_loss: 1.6386, test_f1: 0.6007
 epoch: 35, train_loss: 0.5376, test_loss: 1.8976, test_f1: 0.5881
 epoch: 36, train_loss: 0.5051, test_loss: 1.7269, test_f1: 0.5671
 epoch: 37, train_loss: 0.5178, test_loss: 1.4927, test_f1: 0.5253
 epoch: 38, train_loss: 0.5242, test_loss: 1.7875, test_f1: 0.5761
 epoch: 39, train_loss: 0.5269, test_loss: 1.5918, test_f1: 0.5387
 epoch: 40, train_loss: 0.4822, test_loss: 1.6620, test_f1: 0.5889
 epoch: 41, train_loss: 0.4990, test_loss: 2.2523, test_f1: 0.5530
 epoch: 42, train_loss: 0.4751, test_loss: 1.9159, test_f1: 0.5607
 epoch: 43, train_loss: 0.4775, test_loss: 2.1059, test_f1: 0.6186
 epoch: 44, train_loss: 0.4648, test_loss: 1.6944, test_f1: 0.6153
 epoch: 45, train_loss: 0.4498, test_loss: 2.0974, test_f1: 0.5339
 epoch: 46, train_loss: 0.4546, test_loss: 1.9766, test_f1: 0.6215
 epoch: 47, train_loss: 0.4543, test_loss: 2.2023, test_f1: 0.5427
 epoch: 48, train_loss: 0.4545, test_loss: 2.0810, test_f1: 0.5804
 epoch: 49, train_loss: 0.4421, test_loss: 1.8918, test_f1: 0.5848
 epoch: 50, train_loss: 0.4505, test_loss: 1.8845, test_f1: 0.6029
 epoch: 51, train_loss: 0.3953, test_loss: 2.0713, test_f1: 0.5927
 epoch: 52, train_loss: 0.3793, test_loss: 2.0102, test_f1: 0.5606
 epoch: 53, train_loss: 0.3600, test_loss: 2.1936, test_f1: 0.5824
 epoch: 54, train_loss: 0.3364, test_loss: 2.2694, test_f1: 0.5714
 epoch: 55, train_loss: 0.3578, test_loss: 2.2496, test_f1: 0.5643
 epoch: 56, train_loss: 0.3377, test_loss: 2.4592, test_f1: 0.5788
 epoch: 57, train_loss: 0.3439, test_loss: 2.3917, test_f1: 0.6059
 epoch: 58, train_loss: 0.3340, test_loss: 2.1967, test_f1: 0.6096
 epoch: 59, train_loss: 0.3222, test_loss: 2.6116, test_f1: 0.6099
 epoch: 60, train_loss: 0.3477, test_loss: 2.3532, test_f1: 0.5866
 epoch: 61, train_loss: 0.3256, test_loss: 2.9499, test_f1: 0.5717
 epoch: 62, train_loss: 0.2911, test_loss: 3.0158, test_f1: 0.5487
 epoch: 63, train_loss: 0.3093, test_loss: 2.9350, test_f1: 0.6072
 epoch: 64, train_loss: 0.3024, test_loss: 2.7776, test_f1: 0.5803
 epoch: 65, train_loss: 0.2890, test_loss: 2.8088, test_f1: 0.5935
 epoch: 66, train_loss: 0.2995, test_loss: 2.9620, test_f1: 0.5938
 epoch: 67, train_loss: 0.2975, test_loss: 2.9902, test_f1: 0.5734
 epoch: 68, train_loss: 0.2738, test_loss: 2.7504, test_f1: 0.6070
 epoch: 69, train_loss: 0.3033, test_loss: 2.7941, test_f1: 0.6110
 epoch: 70, train_loss: 0.2929, test_loss: 2.6593, test_f1: 0.6159
 epoch: 71, train_loss: 0.2803, test_loss: 2.9118, test_f1: 0.6252
 epoch: 72, train_loss: 0.3093, test_loss: 2.9338, test_f1: 0.6220
 epoch: 73, train_loss: 0.2694, test_loss: 2.7700, test_f1: 0.5983
 epoch: 74, train_loss: 0.2695, test_loss: 2.8713, test_f1: 0.5868
 epoch: 75, train_loss: 0.2539, test_loss: 2.8229, test_f1: 0.6066
 epoch: 76, train_loss: 0.2652, test_loss: 3.0447, test_f1: 0.5881
 epoch: 77, train_loss: 0.2754, test_loss: 3.1839, test_f1: 0.6097
 epoch: 78, train_loss: 0.2794, test_loss: 2.9268, test_f1: 0.6198
 epoch: 79, train_loss: 0.2821, test_loss: 3.4156, test_f1: 0.5840
 epoch: 80, train_loss: 0.2563, test_loss: 3.1002, test_f1: 0.5756
 epoch: 81, train_loss: 0.2405, test_loss: 3.1301, test_f1: 0.5737
 epoch: 82, train_loss: 0.2511, test_loss: 3.1169, test_f1: 0.6010
 epoch: 83, train_loss: 0.2467, test_loss: 2.9278, test_f1: 0.5988
 epoch: 84, train_loss: 0.2445, test_loss: 2.8724, test_f1: 0.5598
 epoch: 85, train_loss: 0.2612, test_loss: 3.1428, test_f1: 0.6003
 epoch: 86, train_loss: 0.2379, test_loss: 2.9867, test_f1: 0.6067
 epoch: 87, train_loss: 0.2496, test_loss: 2.9178, test_f1: 0.5805
 epoch: 88, train_loss: 0.2783, test_loss: 3.2249, test_f1: 0.5585
 epoch: 89, train_loss: 0.2576, test_loss: 2.7889, test_f1: 0.5995
 epoch: 90, train_loss: 0.2355, test_loss: 3.0833, test_f1: 0.5789
 epoch: 91, train_loss: 0.2299, test_loss: 3.5151, test_f1: 0.5965
 epoch: 92, train_loss: 0.2283, test_loss: 3.2303, test_f1: 0.6108
 epoch: 93, train_loss: 0.2402, test_loss: 3.3994, test_f1: 0.5825
 epoch: 94, train_loss: 0.2328, test_loss: 3.1442, test_f1: 0.6098
 epoch: 95, train_loss: 0.2314, test_loss: 3.0523, test_f1: 0.5635
 epoch: 96, train_loss: 0.2253, test_loss: 2.8507, test_f1: 0.5967
 epoch: 97, train_loss: 0.2270, test_loss: 3.2621, test_f1: 0.6007
 epoch: 98, train_loss: 0.2111, test_loss: 3.2107, test_f1: 0.6048
 epoch: 99, train_loss: 0.2111, test_loss: 3.6121, test_f1: 0.5621
##################ITERATION #2 ****************************************
 epoch: 0, train_loss: 1.2259, test_loss: 1.2528, test_f1: 0.4075
 epoch: 1, train_loss: 1.0675, test_loss: 1.1470, test_f1: 0.4874
 epoch: 2, train_loss: 0.9944, test_loss: 1.0999, test_f1: 0.4725
 epoch: 3, train_loss: 0.9386, test_loss: 1.0670, test_f1: 0.5437
 epoch: 4, train_loss: 0.9020, test_loss: 1.1007, test_f1: 0.5471
 epoch: 5, train_loss: 0.8962, test_loss: 1.0539, test_f1: 0.5726
 epoch: 6, train_loss: 0.8666, test_loss: 1.0811, test_f1: 0.5658
 epoch: 7, train_loss: 0.8576, test_loss: 1.0043, test_f1: 0.6100
 epoch: 8, train_loss: 0.8238, test_loss: 1.0769, test_f1: 0.5580
 epoch: 9, train_loss: 0.8212, test_loss: 1.1999, test_f1: 0.5753
 epoch: 10, train_loss: 0.7939, test_loss: 1.0447, test_f1: 0.5317
 epoch: 11, train_loss: 0.7744, test_loss: 1.1250, test_f1: 0.5586
 epoch: 12, train_loss: 0.7704, test_loss: 1.0841, test_f1: 0.5838
 epoch: 13, train_loss: 0.7178, test_loss: 1.1778, test_f1: 0.5663
 epoch: 14, train_loss: 0.7302, test_loss: 1.1447, test_f1: 0.6112
 epoch: 15, train_loss: 0.7381, test_loss: 1.1043, test_f1: 0.6007
 epoch: 16, train_loss: 0.7559, test_loss: 1.2082, test_f1: 0.5901
 epoch: 17, train_loss: 0.7019, test_loss: 1.1122, test_f1: 0.5752
 epoch: 18, train_loss: 0.6804, test_loss: 1.4435, test_f1: 0.5593
 epoch: 19, train_loss: 0.7229, test_loss: 1.2723, test_f1: 0.5446
 epoch: 20, train_loss: 0.6895, test_loss: 1.3257, test_f1: 0.5687
 epoch: 21, train_loss: 0.6915, test_loss: 1.4216, test_f1: 0.5768
 epoch: 22, train_loss: 0.6388, test_loss: 1.2629, test_f1: 0.5934
 epoch: 23, train_loss: 0.6266, test_loss: 1.3443, test_f1: 0.6123
 epoch: 24, train_loss: 0.6324, test_loss: 1.4415, test_f1: 0.6051
 epoch: 25, train_loss: 0.6129, test_loss: 1.6307, test_f1: 0.5781
 epoch: 26, train_loss: 0.6000, test_loss: 1.4449, test_f1: 0.5826
 epoch: 27, train_loss: 0.6323, test_loss: 1.3079, test_f1: 0.6101
 epoch: 28, train_loss: 0.5781, test_loss: 1.7471, test_f1: 0.5992
 epoch: 29, train_loss: 0.5633, test_loss: 1.5998, test_f1: 0.5641
 epoch: 30, train_loss: 0.5636, test_loss: 1.5757, test_f1: 0.5248
 epoch: 31, train_loss: 0.5834, test_loss: 1.6123, test_f1: 0.5833
 epoch: 32, train_loss: 0.5876, test_loss: 1.6482, test_f1: 0.5938
 epoch: 33, train_loss: 0.5405, test_loss: 1.5534, test_f1: 0.6268
 epoch: 34, train_loss: 0.5384, test_loss: 1.6527, test_f1: 0.5177
 epoch: 35, train_loss: 0.5423, test_loss: 1.7208, test_f1: 0.5743
 epoch: 36, train_loss: 0.5390, test_loss: 1.5652, test_f1: 0.6034
 epoch: 37, train_loss: 0.5153, test_loss: 1.7100, test_f1: 0.5936
 epoch: 38, train_loss: 0.4762, test_loss: 1.6826, test_f1: 0.5910
 epoch: 39, train_loss: 0.5219, test_loss: 1.6367, test_f1: 0.5404
 epoch: 40, train_loss: 0.5129, test_loss: 1.5436, test_f1: 0.5944
 epoch: 41, train_loss: 0.5290, test_loss: 1.7089, test_f1: 0.5797
 epoch: 42, train_loss: 0.4936, test_loss: 1.4869, test_f1: 0.6060
 epoch: 43, train_loss: 0.4903, test_loss: 1.6320, test_f1: 0.5926
 epoch: 44, train_loss: 0.5085, test_loss: 2.1033, test_f1: 0.5862
 epoch: 45, train_loss: 0.4654, test_loss: 2.0786, test_f1: 0.6114
 epoch: 46, train_loss: 0.4955, test_loss: 1.9102, test_f1: 0.5670
 epoch: 47, train_loss: 0.4613, test_loss: 2.2005, test_f1: 0.5942
 epoch: 48, train_loss: 0.4331, test_loss: 1.8037, test_f1: 0.5558
 epoch: 49, train_loss: 0.4233, test_loss: 2.0469, test_f1: 0.5997
 epoch: 50, train_loss: 0.4332, test_loss: 1.8157, test_f1: 0.5941
 epoch: 51, train_loss: 0.4124, test_loss: 1.7930, test_f1: 0.5893
 epoch: 52, train_loss: 0.3485, test_loss: 1.8839, test_f1: 0.5886
 epoch: 53, train_loss: 0.3580, test_loss: 2.0027, test_f1: 0.5907
 epoch: 54, train_loss: 0.3664, test_loss: 2.0141, test_f1: 0.5842
 epoch: 55, train_loss: 0.3645, test_loss: 2.1061, test_f1: 0.5967
 epoch: 56, train_loss: 0.3581, test_loss: 2.3816, test_f1: 0.6093
 epoch: 57, train_loss: 0.3249, test_loss: 2.1662, test_f1: 0.6166
 epoch: 58, train_loss: 0.3177, test_loss: 2.4644, test_f1: 0.5921
 epoch: 59, train_loss: 0.3327, test_loss: 2.5583, test_f1: 0.5830
 epoch: 60, train_loss: 0.3285, test_loss: 2.3924, test_f1: 0.5979
 epoch: 61, train_loss: 0.3158, test_loss: 2.3613, test_f1: 0.5978
 epoch: 62, train_loss: 0.3187, test_loss: 2.7279, test_f1: 0.6011
 epoch: 63, train_loss: 0.3181, test_loss: 2.3692, test_f1: 0.5745
 epoch: 64, train_loss: 0.3068, test_loss: 2.2649, test_f1: 0.5703
 epoch: 65, train_loss: 0.2913, test_loss: 2.3820, test_f1: 0.6023
 epoch: 66, train_loss: 0.2973, test_loss: 2.6685, test_f1: 0.5858
 epoch: 67, train_loss: 0.2972, test_loss: 2.6813, test_f1: 0.5894
 epoch: 68, train_loss: 0.2584, test_loss: 2.7143, test_f1: 0.6227
 epoch: 69, train_loss: 0.2942, test_loss: 2.6003, test_f1: 0.6275
 epoch: 70, train_loss: 0.2739, test_loss: 2.8672, test_f1: 0.5905
 epoch: 71, train_loss: 0.2516, test_loss: 2.9129, test_f1: 0.5993
 epoch: 72, train_loss: 0.2850, test_loss: 2.9104, test_f1: 0.5552
 epoch: 73, train_loss: 0.2550, test_loss: 3.2138, test_f1: 0.5965
 epoch: 74, train_loss: 0.2841, test_loss: 2.8424, test_f1: 0.5764
 epoch: 75, train_loss: 0.2818, test_loss: 3.0992, test_f1: 0.5805
 epoch: 76, train_loss: 0.2765, test_loss: 2.6136, test_f1: 0.6175
 epoch: 77, train_loss: 0.2566, test_loss: 2.8477, test_f1: 0.5932
 epoch: 78, train_loss: 0.2600, test_loss: 3.1067, test_f1: 0.6134
 epoch: 79, train_loss: 0.2688, test_loss: 2.6733, test_f1: 0.5652
 epoch: 80, train_loss: 0.2655, test_loss: 2.4163, test_f1: 0.5897
 epoch: 81, train_loss: 0.2653, test_loss: 2.6643, test_f1: 0.5719
 epoch: 82, train_loss: 0.2776, test_loss: 2.5894, test_f1: 0.5877
 epoch: 83, train_loss: 0.2289, test_loss: 2.4334, test_f1: 0.6103
 epoch: 84, train_loss: 0.2631, test_loss: 2.7965, test_f1: 0.5824
 epoch: 85, train_loss: 0.2404, test_loss: 2.6240, test_f1: 0.6005
 epoch: 86, train_loss: 0.2745, test_loss: 2.9964, test_f1: 0.5941
 epoch: 87, train_loss: 0.2672, test_loss: 3.0552, test_f1: 0.6049
 epoch: 88, train_loss: 0.2434, test_loss: 3.6212, test_f1: 0.5829
 epoch: 89, train_loss: 0.2381, test_loss: 3.5433, test_f1: 0.5726
 epoch: 90, train_loss: 0.2543, test_loss: 3.0407, test_f1: 0.5779
 epoch: 91, train_loss: 0.2369, test_loss: 2.8290, test_f1: 0.5989
 epoch: 92, train_loss: 0.2133, test_loss: 3.2717, test_f1: 0.5842
 epoch: 93, train_loss: 0.2545, test_loss: 3.3989, test_f1: 0.5925
 epoch: 94, train_loss: 0.2335, test_loss: 3.6494, test_f1: 0.5819
 epoch: 95, train_loss: 0.2402, test_loss: 3.4350, test_f1: 0.5867
 epoch: 96, train_loss: 0.2273, test_loss: 2.9641, test_f1: 0.5873
 epoch: 97, train_loss: 0.2424, test_loss: 3.2108, test_f1: 0.6042
 epoch: 98, train_loss: 0.2198, test_loss: 3.2914, test_f1: 0.5885
 epoch: 99, train_loss: 0.2100, test_loss: 3.9105, test_f1: 0.6005
##################ITERATION #3 ****************************************
 epoch: 0, train_loss: 1.2337, test_loss: 1.2284, test_f1: 0.4854
 epoch: 1, train_loss: 1.0635, test_loss: 1.1470, test_f1: 0.5503
 epoch: 2, train_loss: 0.9907, test_loss: 1.1912, test_f1: 0.4947
 epoch: 3, train_loss: 0.9603, test_loss: 1.0960, test_f1: 0.6070
 epoch: 4, train_loss: 0.8975, test_loss: 1.3385, test_f1: 0.4280
 epoch: 5, train_loss: 0.8956, test_loss: 1.1356, test_f1: 0.5561
 epoch: 6, train_loss: 0.8644, test_loss: 1.1832, test_f1: 0.5301
 epoch: 7, train_loss: 0.8470, test_loss: 1.0197, test_f1: 0.6278
 epoch: 8, train_loss: 0.8473, test_loss: 1.1281, test_f1: 0.5729
 epoch: 9, train_loss: 0.8353, test_loss: 1.1728, test_f1: 0.5565
 epoch: 10, train_loss: 0.8017, test_loss: 1.0378, test_f1: 0.5948
 epoch: 11, train_loss: 0.8144, test_loss: 1.1416, test_f1: 0.5949
 epoch: 12, train_loss: 0.8084, test_loss: 1.1724, test_f1: 0.5601
 epoch: 13, train_loss: 0.7622, test_loss: 1.1796, test_f1: 0.5590
 epoch: 14, train_loss: 0.7538, test_loss: 1.3764, test_f1: 0.5039
 epoch: 15, train_loss: 0.7505, test_loss: 1.3111, test_f1: 0.5421
 epoch: 16, train_loss: 0.7207, test_loss: 1.2648, test_f1: 0.5994
 epoch: 17, train_loss: 0.7248, test_loss: 1.1661, test_f1: 0.6256
 epoch: 18, train_loss: 0.7210, test_loss: 1.2075, test_f1: 0.5767
 epoch: 19, train_loss: 0.6793, test_loss: 1.3232, test_f1: 0.5814
 epoch: 20, train_loss: 0.6622, test_loss: 1.3183, test_f1: 0.5746
 epoch: 21, train_loss: 0.6297, test_loss: 1.3247, test_f1: 0.5830
 epoch: 22, train_loss: 0.6594, test_loss: 1.2344, test_f1: 0.6137
 epoch: 23, train_loss: 0.6430, test_loss: 1.2991, test_f1: 0.5581
 epoch: 24, train_loss: 0.5962, test_loss: 1.4511, test_f1: 0.5128
 epoch: 25, train_loss: 0.6064, test_loss: 1.3641, test_f1: 0.5968
 epoch: 26, train_loss: 0.6303, test_loss: 1.2766, test_f1: 0.5872
 epoch: 27, train_loss: 0.6076, test_loss: 1.5477, test_f1: 0.5366
 epoch: 28, train_loss: 0.5752, test_loss: 1.4202, test_f1: 0.5764
 epoch: 29, train_loss: 0.5832, test_loss: 1.4779, test_f1: 0.5863
 epoch: 30, train_loss: 0.5374, test_loss: 1.4063, test_f1: 0.5900
 epoch: 31, train_loss: 0.5355, test_loss: 1.5844, test_f1: 0.5672
 epoch: 32, train_loss: 0.5665, test_loss: 1.5268, test_f1: 0.5690
 epoch: 33, train_loss: 0.5402, test_loss: 1.5309, test_f1: 0.5758
 epoch: 34, train_loss: 0.5031, test_loss: 1.6114, test_f1: 0.5788
 epoch: 35, train_loss: 0.5006, test_loss: 1.7854, test_f1: 0.5590
 epoch: 36, train_loss: 0.5049, test_loss: 1.7267, test_f1: 0.5803
 epoch: 37, train_loss: 0.4692, test_loss: 1.6458, test_f1: 0.5817
 epoch: 38, train_loss: 0.4977, test_loss: 1.8393, test_f1: 0.5405
 epoch: 39, train_loss: 0.4822, test_loss: 1.6842, test_f1: 0.5600
 epoch: 40, train_loss: 0.4753, test_loss: 1.6191, test_f1: 0.6429
 epoch: 41, train_loss: 0.4634, test_loss: 1.7260, test_f1: 0.6232
 epoch: 42, train_loss: 0.4380, test_loss: 2.0477, test_f1: 0.5539
 epoch: 43, train_loss: 0.4588, test_loss: 1.7145, test_f1: 0.5532
 epoch: 44, train_loss: 0.4349, test_loss: 1.9417, test_f1: 0.5768
 epoch: 45, train_loss: 0.4921, test_loss: 1.6910, test_f1: 0.6065
 epoch: 46, train_loss: 0.4590, test_loss: 1.8608, test_f1: 0.5452
 epoch: 47, train_loss: 0.4485, test_loss: 1.7865, test_f1: 0.5241
 epoch: 48, train_loss: 0.4231, test_loss: 1.7846, test_f1: 0.5578
 epoch: 49, train_loss: 0.4185, test_loss: 1.8595, test_f1: 0.6135
 epoch: 50, train_loss: 0.4383, test_loss: 1.8436, test_f1: 0.5692
 epoch: 51, train_loss: 0.3807, test_loss: 1.7692, test_f1: 0.5794
 epoch: 52, train_loss: 0.3548, test_loss: 1.8159, test_f1: 0.6250
 epoch: 53, train_loss: 0.3336, test_loss: 2.0328, test_f1: 0.5951
 epoch: 54, train_loss: 0.3132, test_loss: 2.0593, test_f1: 0.5813
 epoch: 55, train_loss: 0.3105, test_loss: 2.1946, test_f1: 0.5639
 epoch: 56, train_loss: 0.3151, test_loss: 2.1262, test_f1: 0.5876
 epoch: 57, train_loss: 0.3116, test_loss: 2.1656, test_f1: 0.5872
 epoch: 58, train_loss: 0.3035, test_loss: 2.2468, test_f1: 0.5674
 epoch: 59, train_loss: 0.2925, test_loss: 2.2253, test_f1: 0.6175
 epoch: 60, train_loss: 0.2909, test_loss: 2.2915, test_f1: 0.5736
 epoch: 61, train_loss: 0.2986, test_loss: 2.0806, test_f1: 0.6175
 epoch: 62, train_loss: 0.2947, test_loss: 2.2575, test_f1: 0.6090
 epoch: 63, train_loss: 0.2595, test_loss: 2.2457, test_f1: 0.5938
 epoch: 64, train_loss: 0.2577, test_loss: 2.3755, test_f1: 0.5721
 epoch: 65, train_loss: 0.2587, test_loss: 2.3145, test_f1: 0.6132
 epoch: 66, train_loss: 0.2516, test_loss: 2.4308, test_f1: 0.5829
 epoch: 67, train_loss: 0.2510, test_loss: 2.4499, test_f1: 0.5676
 epoch: 68, train_loss: 0.2701, test_loss: 2.5307, test_f1: 0.6049
 epoch: 69, train_loss: 0.2998, test_loss: 2.4506, test_f1: 0.5745
 epoch: 70, train_loss: 0.2974, test_loss: 2.5441, test_f1: 0.5565
 epoch: 71, train_loss: 0.2595, test_loss: 2.4857, test_f1: 0.5889
 epoch: 72, train_loss: 0.2987, test_loss: 2.3977, test_f1: 0.6052
 epoch: 73, train_loss: 0.2497, test_loss: 2.4715, test_f1: 0.6098
 epoch: 74, train_loss: 0.2858, test_loss: 2.3862, test_f1: 0.6139
 epoch: 75, train_loss: 0.2558, test_loss: 2.6083, test_f1: 0.6051
 epoch: 76, train_loss: 0.2490, test_loss: 2.2959, test_f1: 0.6353
 epoch: 77, train_loss: 0.2181, test_loss: 2.6240, test_f1: 0.6369
 epoch: 78, train_loss: 0.2280, test_loss: 2.9831, test_f1: 0.5940
 epoch: 79, train_loss: 0.2330, test_loss: 2.8104, test_f1: 0.5986
 epoch: 80, train_loss: 0.2242, test_loss: 2.8457, test_f1: 0.5896
 epoch: 81, train_loss: 0.2101, test_loss: 2.7034, test_f1: 0.5837
 epoch: 82, train_loss: 0.2226, test_loss: 2.7460, test_f1: 0.5619
 epoch: 83, train_loss: 0.2358, test_loss: 3.1896, test_f1: 0.5633
 epoch: 84, train_loss: 0.2111, test_loss: 2.8072, test_f1: 0.5762
 epoch: 85, train_loss: 0.2196, test_loss: 2.7107, test_f1: 0.6125
 epoch: 86, train_loss: 0.1895, test_loss: 2.8767, test_f1: 0.5606
 epoch: 87, train_loss: 0.2286, test_loss: 2.8058, test_f1: 0.5970
 epoch: 88, train_loss: 0.2174, test_loss: 2.9604, test_f1: 0.5808
 epoch: 89, train_loss: 0.2242, test_loss: 3.0706, test_f1: 0.5775
 epoch: 90, train_loss: 0.2218, test_loss: 3.1736, test_f1: 0.5965
 epoch: 91, train_loss: 0.2278, test_loss: 2.8554, test_f1: 0.6000
 epoch: 92, train_loss: 0.1975, test_loss: 2.9179, test_f1: 0.5946
 epoch: 93, train_loss: 0.2113, test_loss: 2.8030, test_f1: 0.6186
 epoch: 94, train_loss: 0.1973, test_loss: 2.7806, test_f1: 0.5849
 epoch: 95, train_loss: 0.2402, test_loss: 2.8064, test_f1: 0.5904
 epoch: 96, train_loss: 0.2166, test_loss: 2.8114, test_f1: 0.5950
 epoch: 97, train_loss: 0.2037, test_loss: 3.1255, test_f1: 0.6152
 epoch: 98, train_loss: 0.1919, test_loss: 3.0701, test_f1: 0.6019
 epoch: 99, train_loss: 0.2006, test_loss: 3.1635, test_f1: 0.5508
##################ITERATION #4 ****************************************
 epoch: 0, train_loss: 1.2703, test_loss: 1.4132, test_f1: 0.2728
 epoch: 1, train_loss: 1.1016, test_loss: 1.3096, test_f1: 0.4548
 epoch: 2, train_loss: 1.0492, test_loss: 1.2023, test_f1: 0.5016
 epoch: 3, train_loss: 0.9978, test_loss: 1.2055, test_f1: 0.5292
 epoch: 4, train_loss: 0.9608, test_loss: 1.2241, test_f1: 0.5125
 epoch: 5, train_loss: 0.9267, test_loss: 1.0891, test_f1: 0.6021
 epoch: 6, train_loss: 0.8941, test_loss: 1.1815, test_f1: 0.5864
 epoch: 7, train_loss: 0.8795, test_loss: 1.1295, test_f1: 0.5663
 epoch: 8, train_loss: 0.8644, test_loss: 1.0941, test_f1: 0.6023
 epoch: 9, train_loss: 0.8339, test_loss: 1.1832, test_f1: 0.5515
 epoch: 10, train_loss: 0.7951, test_loss: 1.2084, test_f1: 0.5374
 epoch: 11, train_loss: 0.8180, test_loss: 1.1830, test_f1: 0.6075
 epoch: 12, train_loss: 0.8008, test_loss: 1.3227, test_f1: 0.5729
 epoch: 13, train_loss: 0.7881, test_loss: 1.1279, test_f1: 0.5849
 epoch: 14, train_loss: 0.8106, test_loss: 1.2171, test_f1: 0.5596
 epoch: 15, train_loss: 0.7528, test_loss: 1.1291, test_f1: 0.5904
 epoch: 16, train_loss: 0.7448, test_loss: 1.2265, test_f1: 0.6270
 epoch: 17, train_loss: 0.7481, test_loss: 1.3197, test_f1: 0.5311
 epoch: 18, train_loss: 0.7410, test_loss: 1.4215, test_f1: 0.5005
 epoch: 19, train_loss: 0.7319, test_loss: 1.3220, test_f1: 0.6292
 epoch: 20, train_loss: 0.7206, test_loss: 1.4974, test_f1: 0.5831
 epoch: 21, train_loss: 0.6976, test_loss: 1.3912, test_f1: 0.5696
 epoch: 22, train_loss: 0.6874, test_loss: 1.4044, test_f1: 0.5999
 epoch: 23, train_loss: 0.6855, test_loss: 1.4063, test_f1: 0.5693
 epoch: 24, train_loss: 0.6663, test_loss: 1.3424, test_f1: 0.5637
 epoch: 25, train_loss: 0.6472, test_loss: 1.5306, test_f1: 0.5333
 epoch: 26, train_loss: 0.6471, test_loss: 1.3019, test_f1: 0.5935
 epoch: 27, train_loss: 0.6424, test_loss: 1.5391, test_f1: 0.5817
 epoch: 28, train_loss: 0.6148, test_loss: 1.3515, test_f1: 0.5527
 epoch: 29, train_loss: 0.6299, test_loss: 1.4635, test_f1: 0.5616
 epoch: 30, train_loss: 0.6408, test_loss: 1.4741, test_f1: 0.6336
 epoch: 31, train_loss: 0.6257, test_loss: 1.5861, test_f1: 0.5674
 epoch: 32, train_loss: 0.5735, test_loss: 1.7021, test_f1: 0.5228
 epoch: 33, train_loss: 0.5898, test_loss: 1.6111, test_f1: 0.6194
 epoch: 34, train_loss: 0.5765, test_loss: 1.4862, test_f1: 0.6184
 epoch: 35, train_loss: 0.5859, test_loss: 1.6413, test_f1: 0.5684
 epoch: 36, train_loss: 0.5667, test_loss: 1.5771, test_f1: 0.5918
 epoch: 37, train_loss: 0.5695, test_loss: 1.5349, test_f1: 0.5856
 epoch: 38, train_loss: 0.5790, test_loss: 2.2856, test_f1: 0.5848
 epoch: 39, train_loss: 0.5645, test_loss: 1.7124, test_f1: 0.5860
 epoch: 40, train_loss: 0.5406, test_loss: 1.8713, test_f1: 0.5999
 epoch: 41, train_loss: 0.5285, test_loss: 1.6302, test_f1: 0.6169
 epoch: 42, train_loss: 0.5396, test_loss: 1.8422, test_f1: 0.5377
 epoch: 43, train_loss: 0.4844, test_loss: 2.3617, test_f1: 0.5489
 epoch: 44, train_loss: 0.5752, test_loss: 1.9202, test_f1: 0.5631
 epoch: 45, train_loss: 0.5222, test_loss: 1.8007, test_f1: 0.5459
 epoch: 46, train_loss: 0.4857, test_loss: 2.1427, test_f1: 0.5412
 epoch: 47, train_loss: 0.4922, test_loss: 2.0766, test_f1: 0.5297
 epoch: 48, train_loss: 0.4804, test_loss: 1.8424, test_f1: 0.5936
 epoch: 49, train_loss: 0.4600, test_loss: 1.8820, test_f1: 0.5942
 epoch: 50, train_loss: 0.4691, test_loss: 1.8270, test_f1: 0.6150
 epoch: 51, train_loss: 0.4138, test_loss: 2.2111, test_f1: 0.5966
 epoch: 52, train_loss: 0.3892, test_loss: 2.3248, test_f1: 0.5273
 epoch: 53, train_loss: 0.3866, test_loss: 2.1733, test_f1: 0.5926
 epoch: 54, train_loss: 0.4012, test_loss: 2.1122, test_f1: 0.6196
 epoch: 55, train_loss: 0.3806, test_loss: 2.3297, test_f1: 0.5777
 epoch: 56, train_loss: 0.3461, test_loss: 2.3014, test_f1: 0.5799
 epoch: 57, train_loss: 0.3678, test_loss: 2.1315, test_f1: 0.5964
 epoch: 58, train_loss: 0.3790, test_loss: 2.3176, test_f1: 0.5571
 epoch: 59, train_loss: 0.3657, test_loss: 2.7771, test_f1: 0.6226
 epoch: 60, train_loss: 0.3325, test_loss: 2.6636, test_f1: 0.6126
 epoch: 61, train_loss: 0.3423, test_loss: 2.2903, test_f1: 0.5621
 epoch: 62, train_loss: 0.3503, test_loss: 2.4401, test_f1: 0.5973
 epoch: 63, train_loss: 0.3258, test_loss: 3.0620, test_f1: 0.5591
 epoch: 64, train_loss: 0.3198, test_loss: 2.9855, test_f1: 0.5567
 epoch: 65, train_loss: 0.3213, test_loss: 2.5141, test_f1: 0.5924
 epoch: 66, train_loss: 0.3400, test_loss: 3.1310, test_f1: 0.5980
 epoch: 67, train_loss: 0.3184, test_loss: 3.0439, test_f1: 0.6002
 epoch: 68, train_loss: 0.3186, test_loss: 2.6117, test_f1: 0.6067
 epoch: 69, train_loss: 0.2858, test_loss: 2.3931, test_f1: 0.5570
 epoch: 70, train_loss: 0.3096, test_loss: 2.5517, test_f1: 0.6049
 epoch: 71, train_loss: 0.2881, test_loss: 2.6278, test_f1: 0.5597
 epoch: 72, train_loss: 0.2974, test_loss: 2.6910, test_f1: 0.5973
 epoch: 73, train_loss: 0.2941, test_loss: 2.7732, test_f1: 0.5658
 epoch: 74, train_loss: 0.2948, test_loss: 2.7481, test_f1: 0.5635
 epoch: 75, train_loss: 0.2877, test_loss: 2.9105, test_f1: 0.5820
 epoch: 76, train_loss: 0.3093, test_loss: 3.1339, test_f1: 0.5849
 epoch: 77, train_loss: 0.2747, test_loss: 3.0704, test_f1: 0.5635
 epoch: 78, train_loss: 0.3284, test_loss: 2.8898, test_f1: 0.5684
 epoch: 79, train_loss: 0.2830, test_loss: 2.9847, test_f1: 0.5875
 epoch: 80, train_loss: 0.2710, test_loss: 3.3821, test_f1: 0.6005
 epoch: 81, train_loss: 0.2773, test_loss: 2.9350, test_f1: 0.6036
 epoch: 82, train_loss: 0.2742, test_loss: 3.3588, test_f1: 0.5701
 epoch: 83, train_loss: 0.2689, test_loss: 3.0857, test_f1: 0.5598
 epoch: 84, train_loss: 0.2801, test_loss: 3.2494, test_f1: 0.5731
 epoch: 85, train_loss: 0.2687, test_loss: 2.9300, test_f1: 0.6089
 epoch: 86, train_loss: 0.2788, test_loss: 3.3333, test_f1: 0.5632
 epoch: 87, train_loss: 0.2757, test_loss: 2.9419, test_f1: 0.6131
 epoch: 88, train_loss: 0.2466, test_loss: 3.7045, test_f1: 0.6050
 epoch: 89, train_loss: 0.2221, test_loss: 3.1786, test_f1: 0.6322
 epoch: 90, train_loss: 0.2691, test_loss: 3.2792, test_f1: 0.5832
 epoch: 91, train_loss: 0.2987, test_loss: 3.6791, test_f1: 0.6073
 epoch: 92, train_loss: 0.2331, test_loss: 3.6943, test_f1: 0.5980
 epoch: 93, train_loss: 0.2370, test_loss: 3.1875, test_f1: 0.5867
 epoch: 94, train_loss: 0.2484, test_loss: 4.3067, test_f1: 0.5457
 epoch: 95, train_loss: 0.2124, test_loss: 3.3022, test_f1: 0.5789
 epoch: 96, train_loss: 0.2211, test_loss: 3.7179, test_f1: 0.6049
 epoch: 97, train_loss: 0.2360, test_loss: 3.8445, test_f1: 0.5644
 epoch: 98, train_loss: 0.2591, test_loss: 3.2354, test_f1: 0.5884
 epoch: 99, train_loss: 0.2504, test_loss: 3.4880, test_f1: 0.5550
##################ITERATION #5 ****************************************
 epoch: 0, train_loss: 1.2357, test_loss: 1.4155, test_f1: 0.4183
 epoch: 1, train_loss: 1.0703, test_loss: 1.2216, test_f1: 0.5397
 epoch: 2, train_loss: 0.9693, test_loss: 1.1487, test_f1: 0.5747
 epoch: 3, train_loss: 0.9268, test_loss: 1.2037, test_f1: 0.5191
 epoch: 4, train_loss: 0.9072, test_loss: 1.1100, test_f1: 0.5471
 epoch: 5, train_loss: 0.8657, test_loss: 1.1626, test_f1: 0.5836
 epoch: 6, train_loss: 0.8560, test_loss: 1.1268, test_f1: 0.5589
 epoch: 7, train_loss: 0.8304, test_loss: 1.1188, test_f1: 0.5321
 epoch: 8, train_loss: 0.8034, test_loss: 1.0833, test_f1: 0.6029
 epoch: 9, train_loss: 0.8079, test_loss: 1.1925, test_f1: 0.5029
 epoch: 10, train_loss: 0.7953, test_loss: 1.2756, test_f1: 0.5100
 epoch: 11, train_loss: 0.7809, test_loss: 1.2610, test_f1: 0.5382
 epoch: 12, train_loss: 0.7534, test_loss: 1.2556, test_f1: 0.4894
 epoch: 13, train_loss: 0.7447, test_loss: 1.2888, test_f1: 0.5078
 epoch: 14, train_loss: 0.7222, test_loss: 1.1408, test_f1: 0.6173
 epoch: 15, train_loss: 0.7295, test_loss: 1.1786, test_f1: 0.5565
 epoch: 16, train_loss: 0.7155, test_loss: 1.1922, test_f1: 0.5741
 epoch: 17, train_loss: 0.6981, test_loss: 1.3380, test_f1: 0.5338
 epoch: 18, train_loss: 0.6865, test_loss: 1.1904, test_f1: 0.6180
 epoch: 19, train_loss: 0.6767, test_loss: 1.7554, test_f1: 0.4851
 epoch: 20, train_loss: 0.6708, test_loss: 1.1325, test_f1: 0.6241
 epoch: 21, train_loss: 0.6282, test_loss: 1.6144, test_f1: 0.5207
 epoch: 22, train_loss: 0.6133, test_loss: 1.3362, test_f1: 0.6042
 epoch: 23, train_loss: 0.6198, test_loss: 1.7446, test_f1: 0.5305
 epoch: 24, train_loss: 0.6449, test_loss: 1.4255, test_f1: 0.5207
 epoch: 25, train_loss: 0.5990, test_loss: 1.3532, test_f1: 0.5549
 epoch: 26, train_loss: 0.6093, test_loss: 2.1666, test_f1: 0.5328
 epoch: 27, train_loss: 0.6114, test_loss: 1.7265, test_f1: 0.5518
 epoch: 28, train_loss: 0.5958, test_loss: 1.7238, test_f1: 0.5034
 epoch: 29, train_loss: 0.6025, test_loss: 1.4543, test_f1: 0.5614
 epoch: 30, train_loss: 0.6020, test_loss: 1.3019, test_f1: 0.5903
 epoch: 31, train_loss: 0.5694, test_loss: 1.4033, test_f1: 0.5680
 epoch: 32, train_loss: 0.5452, test_loss: 1.5714, test_f1: 0.5707
 epoch: 33, train_loss: 0.5485, test_loss: 1.6164, test_f1: 0.5941
 epoch: 34, train_loss: 0.5468, test_loss: 1.6284, test_f1: 0.5516
 epoch: 35, train_loss: 0.5430, test_loss: 1.6024, test_f1: 0.5629
 epoch: 36, train_loss: 0.5125, test_loss: 1.7633, test_f1: 0.5434
 epoch: 37, train_loss: 0.5014, test_loss: 1.7263, test_f1: 0.5518
 epoch: 38, train_loss: 0.4939, test_loss: 1.9833, test_f1: 0.5338
 epoch: 39, train_loss: 0.4899, test_loss: 1.7957, test_f1: 0.5680
 epoch: 40, train_loss: 0.5048, test_loss: 1.6490, test_f1: 0.6029
 epoch: 41, train_loss: 0.4658, test_loss: 2.0108, test_f1: 0.5338
 epoch: 42, train_loss: 0.5045, test_loss: 1.7072, test_f1: 0.5946
 epoch: 43, train_loss: 0.4647, test_loss: 1.7584, test_f1: 0.5795
 epoch: 44, train_loss: 0.4542, test_loss: 1.8075, test_f1: 0.5832
 epoch: 45, train_loss: 0.4724, test_loss: 2.0102, test_f1: 0.5797
 epoch: 46, train_loss: 0.4486, test_loss: 2.1047, test_f1: 0.5653
 epoch: 47, train_loss: 0.4373, test_loss: 2.0463, test_f1: 0.5648
 epoch: 48, train_loss: 0.4163, test_loss: 1.9003, test_f1: 0.5646
 epoch: 49, train_loss: 0.4491, test_loss: 1.9300, test_f1: 0.5416
 epoch: 50, train_loss: 0.4762, test_loss: 2.0627, test_f1: 0.5552
 epoch: 51, train_loss: 0.4049, test_loss: 1.8609, test_f1: 0.5736
 epoch: 52, train_loss: 0.3532, test_loss: 1.9332, test_f1: 0.5956
 epoch: 53, train_loss: 0.3311, test_loss: 2.1937, test_f1: 0.5649
 epoch: 54, train_loss: 0.3445, test_loss: 1.9671, test_f1: 0.5810
 epoch: 55, train_loss: 0.3279, test_loss: 2.2347, test_f1: 0.5817
 epoch: 56, train_loss: 0.3089, test_loss: 2.1700, test_f1: 0.5666
 epoch: 57, train_loss: 0.3107, test_loss: 2.1599, test_f1: 0.5922
 epoch: 58, train_loss: 0.2753, test_loss: 2.3118, test_f1: 0.5547
 epoch: 59, train_loss: 0.2894, test_loss: 2.4361, test_f1: 0.5488
 epoch: 60, train_loss: 0.2973, test_loss: 2.1880, test_f1: 0.5732
 epoch: 61, train_loss: 0.3035, test_loss: 2.2041, test_f1: 0.5673
 epoch: 62, train_loss: 0.3116, test_loss: 2.3110, test_f1: 0.5463
 epoch: 63, train_loss: 0.3010, test_loss: 2.5892, test_f1: 0.5572
 epoch: 64, train_loss: 0.2705, test_loss: 2.5672, test_f1: 0.5804
 epoch: 65, train_loss: 0.2476, test_loss: 2.6182, test_f1: 0.5732
 epoch: 66, train_loss: 0.2721, test_loss: 2.7906, test_f1: 0.5708
 epoch: 67, train_loss: 0.2709, test_loss: 2.6949, test_f1: 0.5932
 epoch: 68, train_loss: 0.2661, test_loss: 2.5185, test_f1: 0.5466
 epoch: 69, train_loss: 0.2634, test_loss: 3.0184, test_f1: 0.5616
 epoch: 70, train_loss: 0.2422, test_loss: 2.8395, test_f1: 0.5495
 epoch: 71, train_loss: 0.2545, test_loss: 2.7073, test_f1: 0.5820
 epoch: 72, train_loss: 0.2526, test_loss: 2.8830, test_f1: 0.5537
 epoch: 73, train_loss: 0.2528, test_loss: 2.7942, test_f1: 0.5801
 epoch: 74, train_loss: 0.2591, test_loss: 2.5913, test_f1: 0.5891
 epoch: 75, train_loss: 0.2602, test_loss: 2.7642, test_f1: 0.5713
 epoch: 76, train_loss: 0.2349, test_loss: 2.9381, test_f1: 0.5824
 epoch: 77, train_loss: 0.2406, test_loss: 2.3909, test_f1: 0.6111
 epoch: 78, train_loss: 0.2533, test_loss: 2.6288, test_f1: 0.5753
 epoch: 79, train_loss: 0.2517, test_loss: 2.5425, test_f1: 0.5792
 epoch: 80, train_loss: 0.2645, test_loss: 2.5923, test_f1: 0.5624
 epoch: 81, train_loss: 0.2279, test_loss: 2.7071, test_f1: 0.5964
 epoch: 82, train_loss: 0.2221, test_loss: 3.0102, test_f1: 0.5811
 epoch: 83, train_loss: 0.2292, test_loss: 2.8650, test_f1: 0.5670
 epoch: 84, train_loss: 0.2203, test_loss: 2.8955, test_f1: 0.5705
 epoch: 85, train_loss: 0.2267, test_loss: 2.7217, test_f1: 0.5895
 epoch: 86, train_loss: 0.2326, test_loss: 2.7017, test_f1: 0.6105
 epoch: 87, train_loss: 0.2317, test_loss: 3.2076, test_f1: 0.5754
 epoch: 88, train_loss: 0.2009, test_loss: 2.9592, test_f1: 0.5663
 epoch: 89, train_loss: 0.2016, test_loss: 2.8268, test_f1: 0.5837
 epoch: 90, train_loss: 0.1972, test_loss: 3.0768, test_f1: 0.5887
 epoch: 91, train_loss: 0.2183, test_loss: 2.9543, test_f1: 0.5647
 epoch: 92, train_loss: 0.2028, test_loss: 2.7794, test_f1: 0.5842
 epoch: 93, train_loss: 0.2122, test_loss: 3.0357, test_f1: 0.5641
 epoch: 94, train_loss: 0.1975, test_loss: 2.8433, test_f1: 0.6020
 epoch: 95, train_loss: 0.1829, test_loss: 3.3696, test_f1: 0.5731
 epoch: 96, train_loss: 0.2066, test_loss: 3.3798, test_f1: 0.5802
 epoch: 97, train_loss: 0.1924, test_loss: 3.2660, test_f1: 0.5781
 epoch: 98, train_loss: 0.2149, test_loss: 3.4380, test_f1: 0.5815
 epoch: 99, train_loss: 0.2277, test_loss: 3.0613, test_f1: 0.5784
##################ITERATION #6 ****************************************
 epoch: 0, train_loss: 1.2925, test_loss: 1.4296, test_f1: 0.4137
 epoch: 1, train_loss: 1.1136, test_loss: 1.2397, test_f1: 0.4876
 epoch: 2, train_loss: 1.0075, test_loss: 1.2275, test_f1: 0.4989
 epoch: 3, train_loss: 0.9855, test_loss: 1.2711, test_f1: 0.5494
 epoch: 4, train_loss: 0.9753, test_loss: 1.0992, test_f1: 0.5273
 epoch: 5, train_loss: 0.9560, test_loss: 1.1616, test_f1: 0.5571
 epoch: 6, train_loss: 0.9482, test_loss: 1.0449, test_f1: 0.5675
 epoch: 7, train_loss: 0.9143, test_loss: 1.1076, test_f1: 0.5345
 epoch: 8, train_loss: 0.8869, test_loss: 1.0527, test_f1: 0.5698
 epoch: 9, train_loss: 0.8567, test_loss: 1.1040, test_f1: 0.6055
 epoch: 10, train_loss: 0.8420, test_loss: 1.2246, test_f1: 0.5468
 epoch: 11, train_loss: 0.8355, test_loss: 1.0945, test_f1: 0.5771
 epoch: 12, train_loss: 0.8266, test_loss: 1.2451, test_f1: 0.5735
 epoch: 13, train_loss: 0.7986, test_loss: 1.0204, test_f1: 0.5872
 epoch: 14, train_loss: 0.7711, test_loss: 1.1808, test_f1: 0.6078
 epoch: 15, train_loss: 0.7558, test_loss: 1.2390, test_f1: 0.5717
 epoch: 16, train_loss: 0.7671, test_loss: 1.1519, test_f1: 0.5699
 epoch: 17, train_loss: 0.7290, test_loss: 1.2173, test_f1: 0.5900
 epoch: 18, train_loss: 0.7082, test_loss: 1.0964, test_f1: 0.6307
 epoch: 19, train_loss: 0.7235, test_loss: 1.2939, test_f1: 0.5138
 epoch: 20, train_loss: 0.7159, test_loss: 1.1557, test_f1: 0.5646
 epoch: 21, train_loss: 0.7033, test_loss: 1.1685, test_f1: 0.5915
 epoch: 22, train_loss: 0.7209, test_loss: 1.1938, test_f1: 0.5900
 epoch: 23, train_loss: 0.6638, test_loss: 1.0771, test_f1: 0.6040
 epoch: 24, train_loss: 0.6398, test_loss: 1.2146, test_f1: 0.5901
 epoch: 25, train_loss: 0.6364, test_loss: 1.2431, test_f1: 0.5267
 epoch: 26, train_loss: 0.6218, test_loss: 1.3522, test_f1: 0.5454
 epoch: 27, train_loss: 0.6324, test_loss: 1.1922, test_f1: 0.5633
 epoch: 28, train_loss: 0.6724, test_loss: 1.2231, test_f1: 0.5854
 epoch: 29, train_loss: 0.6138, test_loss: 1.2667, test_f1: 0.6010
 epoch: 30, train_loss: 0.5929, test_loss: 1.3436, test_f1: 0.6094
 epoch: 31, train_loss: 0.6325, test_loss: 1.4464, test_f1: 0.5966
 epoch: 32, train_loss: 0.6002, test_loss: 1.6625, test_f1: 0.5794
 epoch: 33, train_loss: 0.6131, test_loss: 1.4171, test_f1: 0.5361
 epoch: 34, train_loss: 0.5999, test_loss: 1.3060, test_f1: 0.5747
 epoch: 35, train_loss: 0.6023, test_loss: 1.4999, test_f1: 0.5494
 epoch: 36, train_loss: 0.5600, test_loss: 1.3976, test_f1: 0.5966
 epoch: 37, train_loss: 0.5694, test_loss: 1.9328, test_f1: 0.5609
 epoch: 38, train_loss: 0.6035, test_loss: 1.4009, test_f1: 0.5842
 epoch: 39, train_loss: 0.6037, test_loss: 1.5394, test_f1: 0.5068
 epoch: 40, train_loss: 0.5517, test_loss: 1.5813, test_f1: 0.5698
 epoch: 41, train_loss: 0.5485, test_loss: 1.5367, test_f1: 0.5917
 epoch: 42, train_loss: 0.5618, test_loss: 1.6257, test_f1: 0.5876
 epoch: 43, train_loss: 0.5295, test_loss: 1.8071, test_f1: 0.5473
 epoch: 44, train_loss: 0.5120, test_loss: 1.6073, test_f1: 0.5675
 epoch: 45, train_loss: 0.5093, test_loss: 1.6296, test_f1: 0.5749
 epoch: 46, train_loss: 0.5009, test_loss: 1.6559, test_f1: 0.5622
 epoch: 47, train_loss: 0.5335, test_loss: 2.0153, test_f1: 0.5043
 epoch: 48, train_loss: 0.5667, test_loss: 2.0987, test_f1: 0.5522
 epoch: 49, train_loss: 0.4938, test_loss: 1.8739, test_f1: 0.5892
 epoch: 50, train_loss: 0.4854, test_loss: 1.7437, test_f1: 0.5726
 epoch: 51, train_loss: 0.4401, test_loss: 1.8834, test_f1: 0.5577
 epoch: 52, train_loss: 0.4013, test_loss: 2.1918, test_f1: 0.5660
 epoch: 53, train_loss: 0.4169, test_loss: 2.0652, test_f1: 0.6284
 epoch: 54, train_loss: 0.3903, test_loss: 2.2314, test_f1: 0.5775
 epoch: 55, train_loss: 0.3729, test_loss: 2.1696, test_f1: 0.5592
 epoch: 56, train_loss: 0.3817, test_loss: 2.0084, test_f1: 0.6012
 epoch: 57, train_loss: 0.3596, test_loss: 2.3891, test_f1: 0.5471
 epoch: 58, train_loss: 0.3626, test_loss: 2.2968, test_f1: 0.5488
 epoch: 59, train_loss: 0.3901, test_loss: 2.4463, test_f1: 0.5658
 epoch: 60, train_loss: 0.3702, test_loss: 2.2756, test_f1: 0.5417
 epoch: 61, train_loss: 0.4045, test_loss: 2.0660, test_f1: 0.6039
 epoch: 62, train_loss: 0.3605, test_loss: 2.5708, test_f1: 0.5664
 epoch: 63, train_loss: 0.3577, test_loss: 2.3476, test_f1: 0.5592
 epoch: 64, train_loss: 0.3418, test_loss: 2.7599, test_f1: 0.5767
 epoch: 65, train_loss: 0.3547, test_loss: 2.4026, test_f1: 0.5809
 epoch: 66, train_loss: 0.3282, test_loss: 2.4166, test_f1: 0.5616
 epoch: 67, train_loss: 0.3466, test_loss: 2.3489, test_f1: 0.5543
 epoch: 68, train_loss: 0.3267, test_loss: 2.7498, test_f1: 0.5467
 epoch: 69, train_loss: 0.3041, test_loss: 2.2745, test_f1: 0.5720
 epoch: 70, train_loss: 0.3224, test_loss: 2.3728, test_f1: 0.5570
 epoch: 71, train_loss: 0.3406, test_loss: 2.2753, test_f1: 0.5825
 epoch: 72, train_loss: 0.3123, test_loss: 2.4455, test_f1: 0.5468
 epoch: 73, train_loss: 0.3191, test_loss: 2.5717, test_f1: 0.5543
 epoch: 74, train_loss: 0.3181, test_loss: 2.3799, test_f1: 0.5924
 epoch: 75, train_loss: 0.3076, test_loss: 2.1715, test_f1: 0.5842
 epoch: 76, train_loss: 0.3035, test_loss: 2.4131, test_f1: 0.5904
 epoch: 77, train_loss: 0.2816, test_loss: 2.1336, test_f1: 0.5646
 epoch: 78, train_loss: 0.2833, test_loss: 2.2844, test_f1: 0.5914
 epoch: 79, train_loss: 0.2866, test_loss: 2.5222, test_f1: 0.5736
 epoch: 80, train_loss: 0.2901, test_loss: 2.5885, test_f1: 0.5376
 epoch: 81, train_loss: 0.2576, test_loss: 2.4646, test_f1: 0.6029
 epoch: 82, train_loss: 0.2858, test_loss: 2.3614, test_f1: 0.6365
 epoch: 83, train_loss: 0.3064, test_loss: 2.1886, test_f1: 0.6334
 epoch: 84, train_loss: 0.2874, test_loss: 2.1867, test_f1: 0.6080
 epoch: 85, train_loss: 0.2867, test_loss: 2.5102, test_f1: 0.5818
 epoch: 86, train_loss: 0.2667, test_loss: 2.5948, test_f1: 0.5798
 epoch: 87, train_loss: 0.2707, test_loss: 2.6633, test_f1: 0.5600
 epoch: 88, train_loss: 0.2655, test_loss: 2.5324, test_f1: 0.6011
 epoch: 89, train_loss: 0.2669, test_loss: 2.7542, test_f1: 0.5640
 epoch: 90, train_loss: 0.2640, test_loss: 2.9641, test_f1: 0.5238
 epoch: 91, train_loss: 0.2646, test_loss: 2.5639, test_f1: 0.5215
 epoch: 92, train_loss: 0.2626, test_loss: 2.4682, test_f1: 0.5623
 epoch: 93, train_loss: 0.2470, test_loss: 2.6016, test_f1: 0.5727
 epoch: 94, train_loss: 0.2603, test_loss: 2.6162, test_f1: 0.5748
 epoch: 95, train_loss: 0.2506, test_loss: 2.5371, test_f1: 0.5719
 epoch: 96, train_loss: 0.2392, test_loss: 2.7997, test_f1: 0.5647
 epoch: 97, train_loss: 0.2317, test_loss: 2.6628, test_f1: 0.5546
 epoch: 98, train_loss: 0.2495, test_loss: 3.1907, test_f1: 0.5694
 epoch: 99, train_loss: 0.2424, test_loss: 3.0561, test_f1: 0.5652
##################ITERATION #7 ****************************************
 epoch: 0, train_loss: 1.3454, test_loss: 1.2608, test_f1: 0.4779
 epoch: 1, train_loss: 1.1423, test_loss: 1.1265, test_f1: 0.5109
 epoch: 2, train_loss: 1.0352, test_loss: 1.2020, test_f1: 0.4747
 epoch: 3, train_loss: 0.9784, test_loss: 1.0738, test_f1: 0.5394
 epoch: 4, train_loss: 0.9632, test_loss: 1.0669, test_f1: 0.5346
 epoch: 5, train_loss: 0.9349, test_loss: 1.1354, test_f1: 0.5660
 epoch: 6, train_loss: 0.9053, test_loss: 1.0905, test_f1: 0.5430
 epoch: 7, train_loss: 0.8837, test_loss: 1.2852, test_f1: 0.4968
 epoch: 8, train_loss: 0.8735, test_loss: 1.0789, test_f1: 0.6052
 epoch: 9, train_loss: 0.8326, test_loss: 1.0850, test_f1: 0.6092
 epoch: 10, train_loss: 0.8233, test_loss: 1.0148, test_f1: 0.6140
 epoch: 11, train_loss: 0.7924, test_loss: 1.0967, test_f1: 0.5507
 epoch: 12, train_loss: 0.7732, test_loss: 1.1357, test_f1: 0.5671
 epoch: 13, train_loss: 0.7961, test_loss: 1.1396, test_f1: 0.5621
 epoch: 14, train_loss: 0.7719, test_loss: 1.3490, test_f1: 0.5823
 epoch: 15, train_loss: 0.7620, test_loss: 1.2278, test_f1: 0.5858
 epoch: 16, train_loss: 0.7537, test_loss: 1.2399, test_f1: 0.5756
 epoch: 17, train_loss: 0.7392, test_loss: 1.1156, test_f1: 0.6118
 epoch: 18, train_loss: 0.7101, test_loss: 1.1383, test_f1: 0.5696
 epoch: 19, train_loss: 0.6918, test_loss: 1.2248, test_f1: 0.6287
 epoch: 20, train_loss: 0.6965, test_loss: 1.1353, test_f1: 0.6433
 epoch: 21, train_loss: 0.6763, test_loss: 1.2516, test_f1: 0.6030
 epoch: 22, train_loss: 0.6532, test_loss: 1.2164, test_f1: 0.5866
 epoch: 23, train_loss: 0.6450, test_loss: 1.2390, test_f1: 0.6087
 epoch: 24, train_loss: 0.6544, test_loss: 1.4159, test_f1: 0.5872
 epoch: 25, train_loss: 0.6093, test_loss: 1.4236, test_f1: 0.5557
 epoch: 26, train_loss: 0.6197, test_loss: 1.3268, test_f1: 0.6228
 epoch: 27, train_loss: 0.6701, test_loss: 1.3023, test_f1: 0.6102
 epoch: 28, train_loss: 0.6116, test_loss: 1.3975, test_f1: 0.5529
 epoch: 29, train_loss: 0.6136, test_loss: 1.3614, test_f1: 0.5840
 epoch: 30, train_loss: 0.5951, test_loss: 1.3245, test_f1: 0.6135
 epoch: 31, train_loss: 0.6026, test_loss: 1.6310, test_f1: 0.5723
 epoch: 32, train_loss: 0.5699, test_loss: 1.5353, test_f1: 0.5822
 epoch: 33, train_loss: 0.5584, test_loss: 1.6546, test_f1: 0.5989
 epoch: 34, train_loss: 0.5731, test_loss: 1.8951, test_f1: 0.4921
 epoch: 35, train_loss: 0.5607, test_loss: 1.7256, test_f1: 0.5872
 epoch: 36, train_loss: 0.5936, test_loss: 1.5262, test_f1: 0.5574
 epoch: 37, train_loss: 0.5318, test_loss: 1.6409, test_f1: 0.5557
 epoch: 38, train_loss: 0.5419, test_loss: 1.7657, test_f1: 0.6121
 epoch: 39, train_loss: 0.5247, test_loss: 1.7726, test_f1: 0.6007
 epoch: 40, train_loss: 0.5052, test_loss: 1.6474, test_f1: 0.5998
 epoch: 41, train_loss: 0.4774, test_loss: 1.6206, test_f1: 0.6063
 epoch: 42, train_loss: 0.5313, test_loss: 1.5437, test_f1: 0.5970
 epoch: 43, train_loss: 0.5040, test_loss: 1.7720, test_f1: 0.5710
 epoch: 44, train_loss: 0.4626, test_loss: 2.1608, test_f1: 0.5996
 epoch: 45, train_loss: 0.4831, test_loss: 1.9441, test_f1: 0.5623
 epoch: 46, train_loss: 0.4652, test_loss: 1.8140, test_f1: 0.5720
 epoch: 47, train_loss: 0.4586, test_loss: 1.8913, test_f1: 0.5677
 epoch: 48, train_loss: 0.4530, test_loss: 1.9339, test_f1: 0.6027
 epoch: 49, train_loss: 0.4683, test_loss: 2.2869, test_f1: 0.5796
 epoch: 50, train_loss: 0.4500, test_loss: 2.5003, test_f1: 0.5505
 epoch: 51, train_loss: 0.4143, test_loss: 2.2191, test_f1: 0.5849
 epoch: 52, train_loss: 0.3743, test_loss: 2.4054, test_f1: 0.5422
 epoch: 53, train_loss: 0.3374, test_loss: 2.4046, test_f1: 0.5632
 epoch: 54, train_loss: 0.3645, test_loss: 2.8402, test_f1: 0.5588
 epoch: 55, train_loss: 0.3489, test_loss: 2.5579, test_f1: 0.5748
 epoch: 56, train_loss: 0.3358, test_loss: 2.9272, test_f1: 0.5724
 epoch: 57, train_loss: 0.3543, test_loss: 2.8676, test_f1: 0.5468
 epoch: 58, train_loss: 0.3396, test_loss: 2.7468, test_f1: 0.5690
 epoch: 59, train_loss: 0.3166, test_loss: 2.6406, test_f1: 0.5679
 epoch: 60, train_loss: 0.3324, test_loss: 2.8840, test_f1: 0.5966
 epoch: 61, train_loss: 0.3266, test_loss: 3.1792, test_f1: 0.5332
 epoch: 62, train_loss: 0.3174, test_loss: 2.8993, test_f1: 0.5898
 epoch: 63, train_loss: 0.2955, test_loss: 2.6241, test_f1: 0.5841
 epoch: 64, train_loss: 0.3083, test_loss: 2.7263, test_f1: 0.5844
 epoch: 65, train_loss: 0.3567, test_loss: 2.6974, test_f1: 0.5798
 epoch: 66, train_loss: 0.3115, test_loss: 3.3178, test_f1: 0.5882
 epoch: 67, train_loss: 0.2759, test_loss: 2.7758, test_f1: 0.5962
 epoch: 68, train_loss: 0.3038, test_loss: 2.8417, test_f1: 0.5932
 epoch: 69, train_loss: 0.2994, test_loss: 2.6548, test_f1: 0.5777
 epoch: 70, train_loss: 0.3129, test_loss: 2.6773, test_f1: 0.5787
 epoch: 71, train_loss: 0.3215, test_loss: 3.1936, test_f1: 0.5400
 epoch: 72, train_loss: 0.2564, test_loss: 2.9075, test_f1: 0.5506
 epoch: 73, train_loss: 0.2719, test_loss: 3.5564, test_f1: 0.5804
 epoch: 74, train_loss: 0.2779, test_loss: 3.6560, test_f1: 0.5498
 epoch: 75, train_loss: 0.2868, test_loss: 3.2511, test_f1: 0.5911
 epoch: 76, train_loss: 0.2647, test_loss: 3.4722, test_f1: 0.5680
 epoch: 77, train_loss: 0.2495, test_loss: 3.1630, test_f1: 0.5867
 epoch: 78, train_loss: 0.2803, test_loss: 2.9862, test_f1: 0.5510
 epoch: 79, train_loss: 0.2366, test_loss: 3.0732, test_f1: 0.5637
 epoch: 80, train_loss: 0.2814, test_loss: 3.0219, test_f1: 0.5479
 epoch: 81, train_loss: 0.2495, test_loss: 3.2886, test_f1: 0.5804
 epoch: 82, train_loss: 0.2716, test_loss: 3.1329, test_f1: 0.5619
 epoch: 83, train_loss: 0.2455, test_loss: 3.5780, test_f1: 0.5537
 epoch: 84, train_loss: 0.2527, test_loss: 3.0062, test_f1: 0.5609
 epoch: 85, train_loss: 0.2460, test_loss: 4.1632, test_f1: 0.5731
 epoch: 86, train_loss: 0.2208, test_loss: 4.4315, test_f1: 0.5526
 epoch: 87, train_loss: 0.2401, test_loss: 4.1438, test_f1: 0.5748
 epoch: 88, train_loss: 0.2759, test_loss: 3.2306, test_f1: 0.6059
 epoch: 89, train_loss: 0.2384, test_loss: 3.0591, test_f1: 0.5901
 epoch: 90, train_loss: 0.2215, test_loss: 3.7324, test_f1: 0.5521
 epoch: 91, train_loss: 0.2288, test_loss: 3.1000, test_f1: 0.6026
 epoch: 92, train_loss: 0.2359, test_loss: 3.4090, test_f1: 0.6073
 epoch: 93, train_loss: 0.2239, test_loss: 3.2320, test_f1: 0.5770
 epoch: 94, train_loss: 0.2449, test_loss: 3.4045, test_f1: 0.5891
 epoch: 95, train_loss: 0.2551, test_loss: 3.2800, test_f1: 0.5628
 epoch: 96, train_loss: 0.3386, test_loss: 2.2452, test_f1: 0.6141
 epoch: 97, train_loss: 0.2476, test_loss: 2.5239, test_f1: 0.5635
 epoch: 98, train_loss: 0.2423, test_loss: 2.3842, test_f1: 0.6005
 epoch: 99, train_loss: 0.2155, test_loss: 2.7591, test_f1: 0.5729
##################ITERATION #8 ****************************************
 epoch: 0, train_loss: 1.2916, test_loss: 1.4302, test_f1: 0.4772
 epoch: 1, train_loss: 1.0753, test_loss: 1.1179, test_f1: 0.5423
 epoch: 2, train_loss: 1.0232, test_loss: 1.2326, test_f1: 0.5595
 epoch: 3, train_loss: 0.9795, test_loss: 1.1757, test_f1: 0.5697
 epoch: 4, train_loss: 0.9418, test_loss: 1.1595, test_f1: 0.5922
 epoch: 5, train_loss: 0.9094, test_loss: 1.1363, test_f1: 0.5318
 epoch: 6, train_loss: 0.8953, test_loss: 1.2378, test_f1: 0.5729
 epoch: 7, train_loss: 0.8486, test_loss: 1.2422, test_f1: 0.5632
 epoch: 8, train_loss: 0.8321, test_loss: 1.1397, test_f1: 0.5640
 epoch: 9, train_loss: 0.8258, test_loss: 1.4352, test_f1: 0.4816
 epoch: 10, train_loss: 0.8353, test_loss: 1.1776, test_f1: 0.5884
 epoch: 11, train_loss: 0.7724, test_loss: 1.2708, test_f1: 0.4930
 epoch: 12, train_loss: 0.8278, test_loss: 1.2988, test_f1: 0.5036
 epoch: 13, train_loss: 0.7499, test_loss: 1.4570, test_f1: 0.5303
 epoch: 14, train_loss: 0.7487, test_loss: 1.3407, test_f1: 0.5784
 epoch: 15, train_loss: 0.7311, test_loss: 1.4368, test_f1: 0.5181
 epoch: 16, train_loss: 0.7272, test_loss: 1.2080, test_f1: 0.5726
 epoch: 17, train_loss: 0.7169, test_loss: 1.2267, test_f1: 0.5627
 epoch: 18, train_loss: 0.7102, test_loss: 4.8525, test_f1: 0.5386
 epoch: 19, train_loss: 0.6774, test_loss: 1.3060, test_f1: 0.5072
 epoch: 20, train_loss: 0.6912, test_loss: 1.3865, test_f1: 0.5462
 epoch: 21, train_loss: 0.6574, test_loss: 1.3086, test_f1: 0.5952
 epoch: 22, train_loss: 0.6538, test_loss: 1.2847, test_f1: 0.5571
 epoch: 23, train_loss: 0.6380, test_loss: 1.5048, test_f1: 0.5258
 epoch: 24, train_loss: 0.6459, test_loss: 1.2236, test_f1: 0.5856
 epoch: 25, train_loss: 0.6210, test_loss: 1.3463, test_f1: 0.6197
 epoch: 26, train_loss: 0.5990, test_loss: 1.7233, test_f1: 0.5313
 epoch: 27, train_loss: 0.5821, test_loss: 1.6276, test_f1: 0.5405
 epoch: 28, train_loss: 0.6179, test_loss: 1.3201, test_f1: 0.5987
 epoch: 29, train_loss: 0.5668, test_loss: 1.5106, test_f1: 0.5788
 epoch: 30, train_loss: 0.5839, test_loss: 1.4483, test_f1: 0.5848
 epoch: 31, train_loss: 0.5644, test_loss: 1.5550, test_f1: 0.6162
 epoch: 32, train_loss: 0.5639, test_loss: 1.3621, test_f1: 0.5701
 epoch: 33, train_loss: 0.5308, test_loss: 1.3760, test_f1: 0.6136
 epoch: 34, train_loss: 0.5519, test_loss: 1.9803, test_f1: 0.5266
 epoch: 35, train_loss: 0.5243, test_loss: 1.7203, test_f1: 0.5354
 epoch: 36, train_loss: 0.4945, test_loss: 1.3819, test_f1: 0.6115
 epoch: 37, train_loss: 0.5227, test_loss: 1.4237, test_f1: 0.5572
 epoch: 38, train_loss: 0.5530, test_loss: 1.3840, test_f1: 0.6094
 epoch: 39, train_loss: 0.5105, test_loss: 1.7538, test_f1: 0.5871
 epoch: 40, train_loss: 0.4709, test_loss: 1.9333, test_f1: 0.5965
 epoch: 41, train_loss: 0.4747, test_loss: 1.6080, test_f1: 0.6277
 epoch: 42, train_loss: 0.4533, test_loss: 2.0220, test_f1: 0.5448
 epoch: 43, train_loss: 0.4542, test_loss: 1.8380, test_f1: 0.5624
 epoch: 44, train_loss: 0.4645, test_loss: 1.9167, test_f1: 0.6497
 epoch: 45, train_loss: 0.4623, test_loss: 1.7118, test_f1: 0.6266
 epoch: 46, train_loss: 0.4313, test_loss: 2.5314, test_f1: 0.5426
 epoch: 47, train_loss: 0.4069, test_loss: 2.2346, test_f1: 0.6046
 epoch: 48, train_loss: 0.4493, test_loss: 1.8823, test_f1: 0.5487
 epoch: 49, train_loss: 0.4550, test_loss: 2.0936, test_f1: 0.5978
 epoch: 50, train_loss: 0.4483, test_loss: 1.8573, test_f1: 0.5390
 epoch: 51, train_loss: 0.3747, test_loss: 1.9321, test_f1: 0.5753
 epoch: 52, train_loss: 0.3571, test_loss: 2.0575, test_f1: 0.5469
 epoch: 53, train_loss: 0.3607, test_loss: 1.9932, test_f1: 0.5773
 epoch: 54, train_loss: 0.3413, test_loss: 2.5184, test_f1: 0.5640
 epoch: 55, train_loss: 0.3400, test_loss: 2.3588, test_f1: 0.5764
 epoch: 56, train_loss: 0.3256, test_loss: 2.4290, test_f1: 0.5643
 epoch: 57, train_loss: 0.3050, test_loss: 2.3746, test_f1: 0.6031
 epoch: 58, train_loss: 0.2916, test_loss: 2.6624, test_f1: 0.5468
 epoch: 59, train_loss: 0.2857, test_loss: 2.4150, test_f1: 0.6257
 epoch: 60, train_loss: 0.3394, test_loss: 2.7881, test_f1: 0.5544
 epoch: 61, train_loss: 0.2986, test_loss: 2.1620, test_f1: 0.5657
 epoch: 62, train_loss: 0.3102, test_loss: 2.0155, test_f1: 0.5533
 epoch: 63, train_loss: 0.2735, test_loss: 2.1797, test_f1: 0.5640
 epoch: 64, train_loss: 0.2801, test_loss: 2.6782, test_f1: 0.5833
 epoch: 65, train_loss: 0.2976, test_loss: 2.2967, test_f1: 0.5336
 epoch: 66, train_loss: 0.2990, test_loss: 2.4692, test_f1: 0.5767
 epoch: 67, train_loss: 0.2607, test_loss: 2.1624, test_f1: 0.6035
 epoch: 68, train_loss: 0.2817, test_loss: 2.3570, test_f1: 0.5528
 epoch: 69, train_loss: 0.3396, test_loss: 2.2886, test_f1: 0.6267
 epoch: 70, train_loss: 0.3043, test_loss: 2.4663, test_f1: 0.5940
 epoch: 71, train_loss: 0.2902, test_loss: 2.5366, test_f1: 0.6279
 epoch: 72, train_loss: 0.2682, test_loss: 2.5070, test_f1: 0.5629
 epoch: 73, train_loss: 0.2683, test_loss: 2.2391, test_f1: 0.5950
 epoch: 74, train_loss: 0.2593, test_loss: 2.5104, test_f1: 0.5635
 epoch: 75, train_loss: 0.2632, test_loss: 2.5716, test_f1: 0.5649
 epoch: 76, train_loss: 0.2273, test_loss: 2.6703, test_f1: 0.5807
 epoch: 77, train_loss: 0.2684, test_loss: 2.8471, test_f1: 0.5483
 epoch: 78, train_loss: 0.2489, test_loss: 2.7932, test_f1: 0.5705
 epoch: 79, train_loss: 0.2314, test_loss: 3.0856, test_f1: 0.5427
 epoch: 80, train_loss: 0.2225, test_loss: 3.2061, test_f1: 0.5433
 epoch: 81, train_loss: 0.2280, test_loss: 2.9684, test_f1: 0.5641
 epoch: 82, train_loss: 0.2561, test_loss: 3.2780, test_f1: 0.5741
 epoch: 83, train_loss: 0.2165, test_loss: 2.7108, test_f1: 0.6106
 epoch: 84, train_loss: 0.2546, test_loss: 2.7953, test_f1: 0.5473
 epoch: 85, train_loss: 0.2453, test_loss: 2.8157, test_f1: 0.5531
 epoch: 86, train_loss: 0.2283, test_loss: 2.6358, test_f1: 0.5520
 epoch: 87, train_loss: 0.2311, test_loss: 3.0983, test_f1: 0.5775
 epoch: 88, train_loss: 0.2215, test_loss: 3.1881, test_f1: 0.5749
 epoch: 89, train_loss: 0.2423, test_loss: 2.8043, test_f1: 0.5768
 epoch: 90, train_loss: 0.2223, test_loss: 2.9597, test_f1: 0.5516
 epoch: 91, train_loss: 0.2215, test_loss: 3.1899, test_f1: 0.5733
 epoch: 92, train_loss: 0.2291, test_loss: 3.0838, test_f1: 0.5573
 epoch: 93, train_loss: 0.2275, test_loss: 2.7794, test_f1: 0.5909
 epoch: 94, train_loss: 0.2143, test_loss: 3.1551, test_f1: 0.5770
 epoch: 95, train_loss: 0.2092, test_loss: 2.9276, test_f1: 0.5752
 epoch: 96, train_loss: 0.2168, test_loss: 2.8763, test_f1: 0.5828
 epoch: 97, train_loss: 0.2225, test_loss: 3.1839, test_f1: 0.5758
 epoch: 98, train_loss: 0.2144, test_loss: 2.8053, test_f1: 0.5769
 epoch: 99, train_loss: 0.1919, test_loss: 3.3303, test_f1: 0.5762
##################ITERATION #9 ****************************************
 epoch: 0, train_loss: 1.3294, test_loss: 1.3353, test_f1: 0.3886
 epoch: 1, train_loss: 1.0724, test_loss: 1.1206, test_f1: 0.5179
 epoch: 2, train_loss: 1.0162, test_loss: 1.1175, test_f1: 0.5351
 epoch: 3, train_loss: 0.9926, test_loss: 1.1389, test_f1: 0.4667
 epoch: 4, train_loss: 0.9684, test_loss: 1.0872, test_f1: 0.5014
 epoch: 5, train_loss: 0.9204, test_loss: 1.0643, test_f1: 0.5224
 epoch: 6, train_loss: 0.8947, test_loss: 1.0857, test_f1: 0.5806
 epoch: 7, train_loss: 0.8669, test_loss: 1.1477, test_f1: 0.5157
 epoch: 8, train_loss: 0.8307, test_loss: 1.1120, test_f1: 0.5281
 epoch: 9, train_loss: 0.8489, test_loss: 1.1873, test_f1: 0.5378
 epoch: 10, train_loss: 0.8129, test_loss: 1.1526, test_f1: 0.4906
 epoch: 11, train_loss: 0.8407, test_loss: 1.1243, test_f1: 0.5541
 epoch: 12, train_loss: 0.7995, test_loss: 1.0848, test_f1: 0.5643
 epoch: 13, train_loss: 0.7908, test_loss: 1.1094, test_f1: 0.5799
 epoch: 14, train_loss: 0.7323, test_loss: 1.1517, test_f1: 0.6247
 epoch: 15, train_loss: 0.7772, test_loss: 1.2094, test_f1: 0.5476
 epoch: 16, train_loss: 0.7644, test_loss: 1.3495, test_f1: 0.5972
 epoch: 17, train_loss: 0.7263, test_loss: 1.0932, test_f1: 0.5902
 epoch: 18, train_loss: 0.6924, test_loss: 1.3441, test_f1: 0.5444
 epoch: 19, train_loss: 0.7096, test_loss: 1.1070, test_f1: 0.5927
 epoch: 20, train_loss: 0.6605, test_loss: 1.1915, test_f1: 0.5692
 epoch: 21, train_loss: 0.6907, test_loss: 1.1704, test_f1: 0.6111
 epoch: 22, train_loss: 0.6727, test_loss: 1.3102, test_f1: 0.5396
 epoch: 23, train_loss: 0.6702, test_loss: 1.0690, test_f1: 0.5962
 epoch: 24, train_loss: 0.6492, test_loss: 1.5581, test_f1: 0.5019
 epoch: 25, train_loss: 0.6443, test_loss: 1.3020, test_f1: 0.4900
 epoch: 26, train_loss: 0.6261, test_loss: 1.2950, test_f1: 0.5246
 epoch: 27, train_loss: 0.6217, test_loss: 1.2521, test_f1: 0.6192
 epoch: 28, train_loss: 0.6126, test_loss: 1.2813, test_f1: 0.6209
 epoch: 29, train_loss: 0.5888, test_loss: 1.3642, test_f1: 0.5815
 epoch: 30, train_loss: 0.6040, test_loss: 1.3757, test_f1: 0.6029
 epoch: 31, train_loss: 0.5698, test_loss: 1.1515, test_f1: 0.5908
 epoch: 32, train_loss: 0.5668, test_loss: 1.3759, test_f1: 0.5851
 epoch: 33, train_loss: 0.5468, test_loss: 1.5608, test_f1: 0.5253
 epoch: 34, train_loss: 0.5608, test_loss: 1.4298, test_f1: 0.5647
 epoch: 35, train_loss: 0.5169, test_loss: 1.6145, test_f1: 0.5686
 epoch: 36, train_loss: 0.5044, test_loss: 1.5377, test_f1: 0.5708
 epoch: 37, train_loss: 0.4981, test_loss: 2.2026, test_f1: 0.5685
 epoch: 38, train_loss: 0.5286, test_loss: 1.7599, test_f1: 0.6050
 epoch: 39, train_loss: 0.5203, test_loss: 1.4138, test_f1: 0.5881
 epoch: 40, train_loss: 0.4983, test_loss: 1.7188, test_f1: 0.6150
 epoch: 41, train_loss: 0.4722, test_loss: 1.8033, test_f1: 0.5564
 epoch: 42, train_loss: 0.4805, test_loss: 1.5660, test_f1: 0.5751
 epoch: 43, train_loss: 0.4640, test_loss: 1.6110, test_f1: 0.5586
 epoch: 44, train_loss: 0.4858, test_loss: 1.7301, test_f1: 0.6174
 epoch: 45, train_loss: 0.4915, test_loss: 1.7883, test_f1: 0.5585
 epoch: 46, train_loss: 0.4438, test_loss: 1.7208, test_f1: 0.6172
 epoch: 47, train_loss: 0.4264, test_loss: 1.7175, test_f1: 0.5481
 epoch: 48, train_loss: 0.4726, test_loss: 1.6905, test_f1: 0.5418
 epoch: 49, train_loss: 0.4981, test_loss: 1.7027, test_f1: 0.5375
 epoch: 50, train_loss: 0.4315, test_loss: 1.9563, test_f1: 0.5717
 epoch: 51, train_loss: 0.3868, test_loss: 1.7476, test_f1: 0.5370
 epoch: 52, train_loss: 0.3229, test_loss: 1.8394, test_f1: 0.5556
 epoch: 53, train_loss: 0.3282, test_loss: 1.9480, test_f1: 0.5509
 epoch: 54, train_loss: 0.3593, test_loss: 2.1034, test_f1: 0.5503
 epoch: 55, train_loss: 0.3263, test_loss: 1.9209, test_f1: 0.5794
 epoch: 56, train_loss: 0.3326, test_loss: 2.0336, test_f1: 0.5664
 epoch: 57, train_loss: 0.3058, test_loss: 2.1184, test_f1: 0.5331
 epoch: 58, train_loss: 0.3187, test_loss: 2.2383, test_f1: 0.5569
 epoch: 59, train_loss: 0.3264, test_loss: 2.1425, test_f1: 0.5728
 epoch: 60, train_loss: 0.2827, test_loss: 2.3057, test_f1: 0.5580
 epoch: 61, train_loss: 0.3200, test_loss: 2.0362, test_f1: 0.6010
 epoch: 62, train_loss: 0.3104, test_loss: 2.2694, test_f1: 0.5469
 epoch: 63, train_loss: 0.3047, test_loss: 2.1871, test_f1: 0.5651
 epoch: 64, train_loss: 0.2908, test_loss: 2.2737, test_f1: 0.5569
 epoch: 65, train_loss: 0.2702, test_loss: 2.3484, test_f1: 0.5646
 epoch: 66, train_loss: 0.2669, test_loss: 2.5177, test_f1: 0.5587
 epoch: 67, train_loss: 0.2924, test_loss: 2.4232, test_f1: 0.5564
 epoch: 68, train_loss: 0.2589, test_loss: 2.1503, test_f1: 0.5709
 epoch: 69, train_loss: 0.2843, test_loss: 2.2728, test_f1: 0.5516
 epoch: 70, train_loss: 0.2658, test_loss: 2.3545, test_f1: 0.5541
 epoch: 71, train_loss: 0.2637, test_loss: 2.3332, test_f1: 0.5712
 epoch: 72, train_loss: 0.2463, test_loss: 2.6632, test_f1: 0.5511
 epoch: 73, train_loss: 0.2838, test_loss: 2.6322, test_f1: 0.5950
 epoch: 74, train_loss: 0.2460, test_loss: 2.5450, test_f1: 0.5665
 epoch: 75, train_loss: 0.2621, test_loss: 2.6234, test_f1: 0.5696
 epoch: 76, train_loss: 0.2246, test_loss: 2.4527, test_f1: 0.5941
 epoch: 77, train_loss: 0.2308, test_loss: 2.3837, test_f1: 0.5475
 epoch: 78, train_loss: 0.2591, test_loss: 2.6693, test_f1: 0.5271
 epoch: 79, train_loss: 0.2787, test_loss: 2.4606, test_f1: 0.5555
 epoch: 80, train_loss: 0.2491, test_loss: 2.6318, test_f1: 0.5504
 epoch: 81, train_loss: 0.2451, test_loss: 2.5747, test_f1: 0.5578
 epoch: 82, train_loss: 0.2370, test_loss: 2.6125, test_f1: 0.5751
 epoch: 83, train_loss: 0.2447, test_loss: 2.6163, test_f1: 0.5591
 epoch: 84, train_loss: 0.2050, test_loss: 2.8164, test_f1: 0.5390
 epoch: 85, train_loss: 0.2392, test_loss: 2.5468, test_f1: 0.5473
 epoch: 86, train_loss: 0.2268, test_loss: 2.4892, test_f1: 0.5830
 epoch: 87, train_loss: 0.2162, test_loss: 2.5055, test_f1: 0.5730
 epoch: 88, train_loss: 0.2273, test_loss: 2.4563, test_f1: 0.5850
 epoch: 89, train_loss: 0.2323, test_loss: 2.6389, test_f1: 0.5563
 epoch: 90, train_loss: 0.1998, test_loss: 2.6286, test_f1: 0.5751
 epoch: 91, train_loss: 0.1995, test_loss: 3.1017, test_f1: 0.5673
 epoch: 92, train_loss: 0.2078, test_loss: 2.9387, test_f1: 0.5680
 epoch: 93, train_loss: 0.2011, test_loss: 2.7060, test_f1: 0.5466
 epoch: 94, train_loss: 0.1885, test_loss: 2.6650, test_f1: 0.5894
 epoch: 95, train_loss: 0.2100, test_loss: 2.9442, test_f1: 0.5796
 epoch: 96, train_loss: 0.1864, test_loss: 2.6455, test_f1: 0.5990
 epoch: 97, train_loss: 0.1852, test_loss: 2.7521, test_f1: 0.5646
 epoch: 98, train_loss: 0.2282, test_loss: 2.8822, test_f1: 0.5755
 epoch: 99, train_loss: 0.2414, test_loss: 2.4288, test_f1: 0.5796

Training completed in 587.13 seconds
Best F1: 0.6497 at epoch 44
Mean F1 across iterations: 0.6324  0.0106
========================FINAL RESULTS================================
FEGIN weighted F1: 0.6497  0.0106
python main.py --data ltspice_demos --representation component_component --model FEGIN --layers 3 --hiddens 128 --batch_size 32 --lr 0.001 --emb_size 512 --epochs 100 --save_appendix component_component_L3_H128_BS32_LR0.001_E512 --no_val
-----



STDERR:
  File "main.py", line 370, in <module>
    main()
  File "main.py", line 254, in main
    dataset = dataset_class(
  File "/home/philip/projects/ltspice_examples_code_repo/Circuit-Completion-Using-GNNs/component_classification_with_link_prediction_head/evaluation/FEGIN/kernel/circuit_datasets.py", line 15, in __init__
    self.data, self.slices = torch.load(self.processed_paths[0])
  File "/home/philip/.local/lib/python3.8/site-packages/torch/serialization.py", line 1040, in load
    warnings.warn(
  File "/usr/lib/python3.8/warnings.py", line 109, in _showwarnmsg
    sw(msg.message, msg.category, msg.filename, msg.lineno,
  File "main.py", line 47, in warn_with_traceback
    traceback.print_stack(file=log)
/home/philip/projects/ltspice_examples_code_repo/Circuit-Completion-Using-GNNs/component_classification_with_link_prediction_head/evaluation/FEGIN/kernel/circuit_datasets.py:15: FutureWarning: You are using `torch.load` with `weights_only=False` (the current default value), which uses the default pickle module implicitly. It is possible to construct malicious pickle data which will execute arbitrary code during unpickling (See https://github.com/pytorch/pytorch/blob/main/SECURITY.md#untrusted-models for more details). In a future release, the default value for `weights_only` will be flipped to `True`. This limits the functions that could be executed during unpickling. Arbitrary objects will no longer be allowed to be loaded via this mode unless they are explicitly allowlisted by the user via `torch.serialization.add_safe_globals`. We recommend you start setting `weights_only=True` for any use case where you don't have full control of the loaded file. Please open an issue on GitHub for any issues related to this experimental feature.
  self.data, self.slices = torch.load(self.processed_paths[0])
