STDOUT:
Results will be saved in /home/philip/projects/ltspice_examples_code_repo/Circuit-Completion-Using-GNNs/component_classification_with_link_prediction_head/evaluation/FEGIN/results/model_FEGIN_dataset_ltspice_examples
Command line input: python main.py --data ltspice_examples --representation component_pin_net --model FEGIN --layers 3 --hiddens 128 --batch_size 32 --lr 0.0001 --emb_size 128 --epochs 100 --save_appendix component_pin_net_L3_H128_BS32_LR0.0001_E128 --no_val
 is saved.
-----
ltspice_examples - FEGIN
Using 3 layers, 128 hidden units, h = 2
Loading component_pin_net representation dataset
ENTERED
Training FEGIN on component_pin_net representation
Train: 3558, Test: 846
##################ITERATION #0 ****************************************
 epoch: 0, train_loss: 1.3110, test_loss: 1.1881, test_f1: 0.2999
 epoch: 1, train_loss: 1.1823, test_loss: 1.1293, test_f1: 0.3908
 epoch: 2, train_loss: 1.1183, test_loss: 1.0540, test_f1: 0.4482
 epoch: 3, train_loss: 1.0497, test_loss: 1.0259, test_f1: 0.4773
 epoch: 4, train_loss: 1.0058, test_loss: 0.9971, test_f1: 0.5156
 epoch: 5, train_loss: 0.9803, test_loss: 0.9565, test_f1: 0.4985
 epoch: 6, train_loss: 0.9542, test_loss: 0.9635, test_f1: 0.5198
 epoch: 7, train_loss: 0.9309, test_loss: 0.9369, test_f1: 0.5340
 epoch: 8, train_loss: 0.9293, test_loss: 0.9067, test_f1: 0.5007
 epoch: 9, train_loss: 0.9140, test_loss: 0.9387, test_f1: 0.4934
 epoch: 10, train_loss: 0.9023, test_loss: 0.9036, test_f1: 0.5165
 epoch: 11, train_loss: 0.8834, test_loss: 0.9131, test_f1: 0.5267
 epoch: 12, train_loss: 0.8792, test_loss: 0.8701, test_f1: 0.5253
 epoch: 13, train_loss: 0.8666, test_loss: 0.8723, test_f1: 0.5374
 epoch: 14, train_loss: 0.8491, test_loss: 0.8621, test_f1: 0.5580
 epoch: 15, train_loss: 0.8543, test_loss: 0.8710, test_f1: 0.5436
 epoch: 16, train_loss: 0.8399, test_loss: 0.8895, test_f1: 0.5312
 epoch: 17, train_loss: 0.8339, test_loss: 0.8435, test_f1: 0.5545
 epoch: 18, train_loss: 0.8185, test_loss: 0.8643, test_f1: 0.5558
 epoch: 19, train_loss: 0.8110, test_loss: 0.8447, test_f1: 0.5441
 epoch: 20, train_loss: 0.8101, test_loss: 0.8313, test_f1: 0.5558
 epoch: 21, train_loss: 0.7999, test_loss: 0.8266, test_f1: 0.5698
 epoch: 22, train_loss: 0.7931, test_loss: 0.8782, test_f1: 0.5388
 epoch: 23, train_loss: 0.7788, test_loss: 0.8247, test_f1: 0.5496
 epoch: 24, train_loss: 0.7737, test_loss: 0.8232, test_f1: 0.5630
 epoch: 25, train_loss: 0.7726, test_loss: 0.7972, test_f1: 0.5702
 epoch: 26, train_loss: 0.7703, test_loss: 0.8027, test_f1: 0.5898
 epoch: 27, train_loss: 0.7583, test_loss: 0.8004, test_f1: 0.5721
 epoch: 28, train_loss: 0.7564, test_loss: 0.8385, test_f1: 0.5774
 epoch: 29, train_loss: 0.7560, test_loss: 0.8242, test_f1: 0.6062
 epoch: 30, train_loss: 0.7430, test_loss: 0.7613, test_f1: 0.6161
 epoch: 31, train_loss: 0.7356, test_loss: 0.8277, test_f1: 0.5783
 epoch: 32, train_loss: 0.7269, test_loss: 0.8177, test_f1: 0.5878
 epoch: 33, train_loss: 0.7170, test_loss: 0.7894, test_f1: 0.5814
 epoch: 34, train_loss: 0.7200, test_loss: 0.7997, test_f1: 0.5760
 epoch: 35, train_loss: 0.7213, test_loss: 0.8003, test_f1: 0.6049
 epoch: 36, train_loss: 0.7129, test_loss: 0.7922, test_f1: 0.6243
 epoch: 37, train_loss: 0.6945, test_loss: 0.7716, test_f1: 0.6331
 epoch: 38, train_loss: 0.7015, test_loss: 0.8425, test_f1: 0.6328
 epoch: 39, train_loss: 0.6818, test_loss: 0.8194, test_f1: 0.6023
 epoch: 40, train_loss: 0.6880, test_loss: 0.7735, test_f1: 0.6110
 epoch: 41, train_loss: 0.6799, test_loss: 0.7798, test_f1: 0.6134
 epoch: 42, train_loss: 0.6807, test_loss: 0.7679, test_f1: 0.6099
 epoch: 43, train_loss: 0.6809, test_loss: 0.7863, test_f1: 0.6329
 epoch: 44, train_loss: 0.6714, test_loss: 0.8031, test_f1: 0.5865
 epoch: 45, train_loss: 0.6643, test_loss: 0.8285, test_f1: 0.6445
 epoch: 46, train_loss: 0.6566, test_loss: 0.7937, test_f1: 0.6208
 epoch: 47, train_loss: 0.6658, test_loss: 0.8192, test_f1: 0.6094
 epoch: 48, train_loss: 0.6487, test_loss: 0.7826, test_f1: 0.6086
 epoch: 49, train_loss: 0.6505, test_loss: 0.7817, test_f1: 0.6285
 epoch: 50, train_loss: 0.6362, test_loss: 0.8321, test_f1: 0.6183
 epoch: 51, train_loss: 0.6161, test_loss: 0.7892, test_f1: 0.6390
 epoch: 52, train_loss: 0.6207, test_loss: 0.7998, test_f1: 0.6364
 epoch: 53, train_loss: 0.6143, test_loss: 0.8135, test_f1: 0.6540
 epoch: 54, train_loss: 0.6037, test_loss: 0.7993, test_f1: 0.6406
 epoch: 55, train_loss: 0.6022, test_loss: 0.8125, test_f1: 0.6542
 epoch: 56, train_loss: 0.6092, test_loss: 0.7939, test_f1: 0.6422
 epoch: 57, train_loss: 0.5969, test_loss: 0.8066, test_f1: 0.6429
 epoch: 58, train_loss: 0.5970, test_loss: 0.8188, test_f1: 0.6371
 epoch: 59, train_loss: 0.5844, test_loss: 0.8301, test_f1: 0.6493
 epoch: 60, train_loss: 0.5820, test_loss: 0.8194, test_f1: 0.6351
 epoch: 61, train_loss: 0.5855, test_loss: 0.8601, test_f1: 0.6325
 epoch: 62, train_loss: 0.5888, test_loss: 0.8724, test_f1: 0.6475
 epoch: 63, train_loss: 0.5871, test_loss: 0.8323, test_f1: 0.6259
 epoch: 64, train_loss: 0.5747, test_loss: 0.8443, test_f1: 0.6433
 epoch: 65, train_loss: 0.5841, test_loss: 0.8454, test_f1: 0.6473
 epoch: 66, train_loss: 0.5760, test_loss: 0.8440, test_f1: 0.6472
 epoch: 67, train_loss: 0.5655, test_loss: 0.8340, test_f1: 0.6386
 epoch: 68, train_loss: 0.5687, test_loss: 0.8450, test_f1: 0.6448
 epoch: 69, train_loss: 0.5622, test_loss: 0.8878, test_f1: 0.6251
 epoch: 70, train_loss: 0.5795, test_loss: 0.8591, test_f1: 0.6480
 epoch: 71, train_loss: 0.5519, test_loss: 0.8822, test_f1: 0.6347
 epoch: 72, train_loss: 0.5602, test_loss: 0.8253, test_f1: 0.6333
 epoch: 73, train_loss: 0.5635, test_loss: 0.8294, test_f1: 0.6565
 epoch: 74, train_loss: 0.5574, test_loss: 0.8352, test_f1: 0.6600
 epoch: 75, train_loss: 0.5603, test_loss: 0.8425, test_f1: 0.6630
 epoch: 76, train_loss: 0.5520, test_loss: 0.8706, test_f1: 0.6630
 epoch: 77, train_loss: 0.5504, test_loss: 0.8518, test_f1: 0.6348
 epoch: 78, train_loss: 0.5338, test_loss: 0.8705, test_f1: 0.6290
 epoch: 79, train_loss: 0.5361, test_loss: 0.8540, test_f1: 0.6397
 epoch: 80, train_loss: 0.5468, test_loss: 0.8628, test_f1: 0.6447
 epoch: 81, train_loss: 0.5406, test_loss: 0.8007, test_f1: 0.6548
 epoch: 82, train_loss: 0.5403, test_loss: 0.8920, test_f1: 0.6469
 epoch: 83, train_loss: 0.5299, test_loss: 0.9113, test_f1: 0.6083
 epoch: 84, train_loss: 0.5171, test_loss: 0.9155, test_f1: 0.6273
 epoch: 85, train_loss: 0.5264, test_loss: 0.8621, test_f1: 0.6097
 epoch: 86, train_loss: 0.5455, test_loss: 0.8654, test_f1: 0.6329
 epoch: 87, train_loss: 0.5336, test_loss: 0.8732, test_f1: 0.6267
 epoch: 88, train_loss: 0.5240, test_loss: 0.8587, test_f1: 0.6224
 epoch: 89, train_loss: 0.5145, test_loss: 0.8737, test_f1: 0.6346
 epoch: 90, train_loss: 0.5196, test_loss: 0.8945, test_f1: 0.6427
 epoch: 91, train_loss: 0.5043, test_loss: 0.9041, test_f1: 0.6218
 epoch: 92, train_loss: 0.4999, test_loss: 0.9259, test_f1: 0.6224
 epoch: 93, train_loss: 0.5153, test_loss: 0.9506, test_f1: 0.6083
 epoch: 94, train_loss: 0.5140, test_loss: 0.8950, test_f1: 0.6185
 epoch: 95, train_loss: 0.5099, test_loss: 0.9193, test_f1: 0.6397
 epoch: 96, train_loss: 0.5142, test_loss: 0.9137, test_f1: 0.6672
 epoch: 97, train_loss: 0.5059, test_loss: 0.9153, test_f1: 0.6317
 epoch: 98, train_loss: 0.4960, test_loss: 0.9036, test_f1: 0.6291
 epoch: 99, train_loss: 0.4956, test_loss: 0.9521, test_f1: 0.6365
##################ITERATION #1 ****************************************
 epoch: 0, train_loss: 1.2074, test_loss: 1.0494, test_f1: 0.4104
 epoch: 1, train_loss: 1.0382, test_loss: 0.9882, test_f1: 0.4813
 epoch: 2, train_loss: 0.9847, test_loss: 0.9530, test_f1: 0.5137
 epoch: 3, train_loss: 0.9579, test_loss: 0.9359, test_f1: 0.5418
 epoch: 4, train_loss: 0.9378, test_loss: 0.9163, test_f1: 0.5248
 epoch: 5, train_loss: 0.9203, test_loss: 0.8935, test_f1: 0.5326
 epoch: 6, train_loss: 0.9003, test_loss: 0.9168, test_f1: 0.5416
 epoch: 7, train_loss: 0.8931, test_loss: 0.8969, test_f1: 0.5593
 epoch: 8, train_loss: 0.8613, test_loss: 0.8408, test_f1: 0.5519
 epoch: 9, train_loss: 0.8603, test_loss: 0.8489, test_f1: 0.5630
 epoch: 10, train_loss: 0.8365, test_loss: 0.8431, test_f1: 0.5705
 epoch: 11, train_loss: 0.8303, test_loss: 0.8204, test_f1: 0.5693
 epoch: 12, train_loss: 0.8249, test_loss: 0.8054, test_f1: 0.5876
 epoch: 13, train_loss: 0.8153, test_loss: 0.7965, test_f1: 0.5886
 epoch: 14, train_loss: 0.7989, test_loss: 0.8198, test_f1: 0.5643
 epoch: 15, train_loss: 0.7985, test_loss: 0.7874, test_f1: 0.5922
 epoch: 16, train_loss: 0.7838, test_loss: 0.7823, test_f1: 0.6165
 epoch: 17, train_loss: 0.7721, test_loss: 0.7486, test_f1: 0.6193
 epoch: 18, train_loss: 0.7661, test_loss: 0.7970, test_f1: 0.6219
 epoch: 19, train_loss: 0.7503, test_loss: 0.8131, test_f1: 0.6190
 epoch: 20, train_loss: 0.7476, test_loss: 0.7553, test_f1: 0.6168
 epoch: 21, train_loss: 0.7352, test_loss: 0.7458, test_f1: 0.6222
 epoch: 22, train_loss: 0.7286, test_loss: 0.7825, test_f1: 0.5909
 epoch: 23, train_loss: 0.7310, test_loss: 0.7278, test_f1: 0.6585
 epoch: 24, train_loss: 0.7138, test_loss: 0.7448, test_f1: 0.6359
 epoch: 25, train_loss: 0.6961, test_loss: 0.7705, test_f1: 0.5956
 epoch: 26, train_loss: 0.7057, test_loss: 0.7697, test_f1: 0.6152
 epoch: 27, train_loss: 0.6850, test_loss: 0.7595, test_f1: 0.6154
 epoch: 28, train_loss: 0.6887, test_loss: 0.7522, test_f1: 0.6102
 epoch: 29, train_loss: 0.6696, test_loss: 0.7115, test_f1: 0.6660
 epoch: 30, train_loss: 0.6733, test_loss: 0.7325, test_f1: 0.6341
 epoch: 31, train_loss: 0.6574, test_loss: 0.7304, test_f1: 0.6455
 epoch: 32, train_loss: 0.6636, test_loss: 0.7124, test_f1: 0.6507
 epoch: 33, train_loss: 0.6504, test_loss: 0.7367, test_f1: 0.6659
 epoch: 34, train_loss: 0.6517, test_loss: 0.7241, test_f1: 0.6469
 epoch: 35, train_loss: 0.6321, test_loss: 0.7821, test_f1: 0.6537
 epoch: 36, train_loss: 0.6233, test_loss: 0.7273, test_f1: 0.6323
 epoch: 37, train_loss: 0.6100, test_loss: 0.7361, test_f1: 0.6398
 epoch: 38, train_loss: 0.6252, test_loss: 0.7130, test_f1: 0.6616
 epoch: 39, train_loss: 0.6154, test_loss: 0.7130, test_f1: 0.6648
 epoch: 40, train_loss: 0.5985, test_loss: 0.7165, test_f1: 0.6485
 epoch: 41, train_loss: 0.5976, test_loss: 0.7238, test_f1: 0.6507
 epoch: 42, train_loss: 0.6021, test_loss: 0.7360, test_f1: 0.6634
 epoch: 43, train_loss: 0.5950, test_loss: 0.7091, test_f1: 0.6709
 epoch: 44, train_loss: 0.5792, test_loss: 0.7168, test_f1: 0.6594
 epoch: 45, train_loss: 0.5810, test_loss: 0.7325, test_f1: 0.6644
 epoch: 46, train_loss: 0.5809, test_loss: 0.7322, test_f1: 0.6583
 epoch: 47, train_loss: 0.5737, test_loss: 0.7317, test_f1: 0.6452
 epoch: 48, train_loss: 0.5676, test_loss: 0.6755, test_f1: 0.6498
 epoch: 49, train_loss: 0.5625, test_loss: 0.7358, test_f1: 0.6637
 epoch: 50, train_loss: 0.5570, test_loss: 0.7165, test_f1: 0.6700
 epoch: 51, train_loss: 0.5377, test_loss: 0.7184, test_f1: 0.6658
 epoch: 52, train_loss: 0.5341, test_loss: 0.7186, test_f1: 0.6812
 epoch: 53, train_loss: 0.5308, test_loss: 0.7409, test_f1: 0.6500
 epoch: 54, train_loss: 0.5306, test_loss: 0.7511, test_f1: 0.6706
 epoch: 55, train_loss: 0.5169, test_loss: 0.7319, test_f1: 0.6730
 epoch: 56, train_loss: 0.5060, test_loss: 0.7365, test_f1: 0.6739
 epoch: 57, train_loss: 0.5216, test_loss: 0.7160, test_f1: 0.6862
 epoch: 58, train_loss: 0.5191, test_loss: 0.7420, test_f1: 0.6585
 epoch: 59, train_loss: 0.5112, test_loss: 0.7661, test_f1: 0.6483
 epoch: 60, train_loss: 0.5005, test_loss: 0.7395, test_f1: 0.6989
 epoch: 61, train_loss: 0.4994, test_loss: 0.7263, test_f1: 0.6845
 epoch: 62, train_loss: 0.4982, test_loss: 0.7168, test_f1: 0.6869
 epoch: 63, train_loss: 0.5029, test_loss: 0.7725, test_f1: 0.6597
 epoch: 64, train_loss: 0.4946, test_loss: 0.7351, test_f1: 0.6919
 epoch: 65, train_loss: 0.4899, test_loss: 0.7585, test_f1: 0.6676
 epoch: 66, train_loss: 0.4961, test_loss: 0.7568, test_f1: 0.6688
 epoch: 67, train_loss: 0.4875, test_loss: 0.7575, test_f1: 0.6642
 epoch: 68, train_loss: 0.4791, test_loss: 0.7763, test_f1: 0.6862
 epoch: 69, train_loss: 0.4739, test_loss: 0.7681, test_f1: 0.6787
 epoch: 70, train_loss: 0.4851, test_loss: 0.7998, test_f1: 0.6579
 epoch: 71, train_loss: 0.4837, test_loss: 0.7675, test_f1: 0.6811
 epoch: 72, train_loss: 0.4693, test_loss: 0.7855, test_f1: 0.6892
 epoch: 73, train_loss: 0.4673, test_loss: 0.7794, test_f1: 0.6644
 epoch: 74, train_loss: 0.4612, test_loss: 0.8284, test_f1: 0.6606
 epoch: 75, train_loss: 0.4574, test_loss: 0.8118, test_f1: 0.6393
 epoch: 76, train_loss: 0.4659, test_loss: 0.7782, test_f1: 0.6636
 epoch: 77, train_loss: 0.4579, test_loss: 0.8112, test_f1: 0.6630
 epoch: 78, train_loss: 0.4471, test_loss: 0.7702, test_f1: 0.6820
 epoch: 79, train_loss: 0.4533, test_loss: 0.8075, test_f1: 0.6856
 epoch: 80, train_loss: 0.4543, test_loss: 0.7970, test_f1: 0.6644
 epoch: 81, train_loss: 0.4444, test_loss: 0.8196, test_f1: 0.6648
 epoch: 82, train_loss: 0.4502, test_loss: 0.8308, test_f1: 0.6663
 epoch: 83, train_loss: 0.4393, test_loss: 0.8345, test_f1: 0.6637
 epoch: 84, train_loss: 0.4468, test_loss: 0.8600, test_f1: 0.6556
 epoch: 85, train_loss: 0.4365, test_loss: 0.9053, test_f1: 0.6414
 epoch: 86, train_loss: 0.4330, test_loss: 0.8473, test_f1: 0.6546
 epoch: 87, train_loss: 0.4317, test_loss: 0.8453, test_f1: 0.6735
 epoch: 88, train_loss: 0.4386, test_loss: 0.8999, test_f1: 0.6645
 epoch: 89, train_loss: 0.4259, test_loss: 0.8894, test_f1: 0.6421
 epoch: 90, train_loss: 0.4269, test_loss: 0.8451, test_f1: 0.6549
 epoch: 91, train_loss: 0.4297, test_loss: 0.8583, test_f1: 0.6672
 epoch: 92, train_loss: 0.4151, test_loss: 0.8701, test_f1: 0.6492
 epoch: 93, train_loss: 0.4240, test_loss: 0.8616, test_f1: 0.6755
 epoch: 94, train_loss: 0.4192, test_loss: 0.9296, test_f1: 0.6506
 epoch: 95, train_loss: 0.4165, test_loss: 0.8652, test_f1: 0.6586
 epoch: 96, train_loss: 0.4343, test_loss: 0.8866, test_f1: 0.6469
 epoch: 97, train_loss: 0.4142, test_loss: 0.9487, test_f1: 0.6432
 epoch: 98, train_loss: 0.4059, test_loss: 0.9054, test_f1: 0.6519
 epoch: 99, train_loss: 0.4174, test_loss: 0.8916, test_f1: 0.6436
##################ITERATION #2 ****************************************
 epoch: 0, train_loss: 1.1450, test_loss: 1.0253, test_f1: 0.4995
 epoch: 1, train_loss: 1.0078, test_loss: 0.9854, test_f1: 0.4743
 epoch: 2, train_loss: 0.9668, test_loss: 0.9630, test_f1: 0.5160
 epoch: 3, train_loss: 0.9459, test_loss: 0.9330, test_f1: 0.5410
 epoch: 4, train_loss: 0.9333, test_loss: 0.9077, test_f1: 0.5302
 epoch: 5, train_loss: 0.9216, test_loss: 0.8828, test_f1: 0.5294
 epoch: 6, train_loss: 0.9031, test_loss: 0.8866, test_f1: 0.5285
 epoch: 7, train_loss: 0.8921, test_loss: 0.8688, test_f1: 0.5431
 epoch: 8, train_loss: 0.8700, test_loss: 0.8705, test_f1: 0.5478
 epoch: 9, train_loss: 0.8589, test_loss: 0.8569, test_f1: 0.5466
 epoch: 10, train_loss: 0.8483, test_loss: 0.8395, test_f1: 0.5570
 epoch: 11, train_loss: 0.8377, test_loss: 0.8113, test_f1: 0.5741
 epoch: 12, train_loss: 0.8193, test_loss: 0.8057, test_f1: 0.5734
 epoch: 13, train_loss: 0.8146, test_loss: 0.7944, test_f1: 0.5738
 epoch: 14, train_loss: 0.8143, test_loss: 0.7891, test_f1: 0.6019
 epoch: 15, train_loss: 0.7923, test_loss: 0.8004, test_f1: 0.6095
 epoch: 16, train_loss: 0.7830, test_loss: 0.7661, test_f1: 0.6087
 epoch: 17, train_loss: 0.7740, test_loss: 0.7750, test_f1: 0.6004
 epoch: 18, train_loss: 0.7754, test_loss: 0.7662, test_f1: 0.6133
 epoch: 19, train_loss: 0.7605, test_loss: 0.7835, test_f1: 0.6295
 epoch: 20, train_loss: 0.7584, test_loss: 0.7872, test_f1: 0.5898
 epoch: 21, train_loss: 0.7439, test_loss: 0.7716, test_f1: 0.6174
 epoch: 22, train_loss: 0.7256, test_loss: 0.7753, test_f1: 0.6330
 epoch: 23, train_loss: 0.7154, test_loss: 0.7180, test_f1: 0.6473
 epoch: 24, train_loss: 0.7142, test_loss: 0.7347, test_f1: 0.6421
 epoch: 25, train_loss: 0.7009, test_loss: 0.7209, test_f1: 0.6401
 epoch: 26, train_loss: 0.7012, test_loss: 0.7555, test_f1: 0.6549
 epoch: 27, train_loss: 0.7096, test_loss: 0.7260, test_f1: 0.6446
 epoch: 28, train_loss: 0.6904, test_loss: 0.7009, test_f1: 0.6584
 epoch: 29, train_loss: 0.6784, test_loss: 0.7518, test_f1: 0.6285
 epoch: 30, train_loss: 0.6662, test_loss: 0.7145, test_f1: 0.6479
 epoch: 31, train_loss: 0.6703, test_loss: 0.7529, test_f1: 0.6512
 epoch: 32, train_loss: 0.6615, test_loss: 0.7240, test_f1: 0.6615
 epoch: 33, train_loss: 0.6529, test_loss: 0.7157, test_f1: 0.6578
 epoch: 34, train_loss: 0.6386, test_loss: 0.7469, test_f1: 0.6724
 epoch: 35, train_loss: 0.6435, test_loss: 0.7195, test_f1: 0.6609
 epoch: 36, train_loss: 0.6360, test_loss: 0.7472, test_f1: 0.6684
 epoch: 37, train_loss: 0.6261, test_loss: 0.7672, test_f1: 0.6482
 epoch: 38, train_loss: 0.6278, test_loss: 0.7472, test_f1: 0.6555
 epoch: 39, train_loss: 0.6137, test_loss: 0.7548, test_f1: 0.6749
 epoch: 40, train_loss: 0.6103, test_loss: 0.7515, test_f1: 0.6493
 epoch: 41, train_loss: 0.5934, test_loss: 0.8238, test_f1: 0.6422
 epoch: 42, train_loss: 0.6077, test_loss: 0.7342, test_f1: 0.6538
 epoch: 43, train_loss: 0.5988, test_loss: 0.7944, test_f1: 0.6409
 epoch: 44, train_loss: 0.5835, test_loss: 0.7485, test_f1: 0.6452
 epoch: 45, train_loss: 0.5850, test_loss: 0.6981, test_f1: 0.6816
 epoch: 46, train_loss: 0.5846, test_loss: 0.7369, test_f1: 0.6527
 epoch: 47, train_loss: 0.5726, test_loss: 0.7493, test_f1: 0.6532
 epoch: 48, train_loss: 0.5739, test_loss: 0.7411, test_f1: 0.6483
 epoch: 49, train_loss: 0.5750, test_loss: 0.7606, test_f1: 0.6495
 epoch: 50, train_loss: 0.5578, test_loss: 0.7439, test_f1: 0.6622
 epoch: 51, train_loss: 0.5390, test_loss: 0.7556, test_f1: 0.6646
 epoch: 52, train_loss: 0.5310, test_loss: 0.7851, test_f1: 0.6436
 epoch: 53, train_loss: 0.5264, test_loss: 0.7621, test_f1: 0.6519
 epoch: 54, train_loss: 0.5204, test_loss: 0.7581, test_f1: 0.6507
 epoch: 55, train_loss: 0.5087, test_loss: 0.7348, test_f1: 0.6465
 epoch: 56, train_loss: 0.5213, test_loss: 0.7972, test_f1: 0.6444
 epoch: 57, train_loss: 0.5247, test_loss: 0.7908, test_f1: 0.6495
 epoch: 58, train_loss: 0.5006, test_loss: 0.7922, test_f1: 0.6385
 epoch: 59, train_loss: 0.5024, test_loss: 0.7882, test_f1: 0.6541
 epoch: 60, train_loss: 0.5059, test_loss: 0.8132, test_f1: 0.6388
 epoch: 61, train_loss: 0.5081, test_loss: 0.7837, test_f1: 0.6432
 epoch: 62, train_loss: 0.5072, test_loss: 0.7721, test_f1: 0.6576
 epoch: 63, train_loss: 0.4971, test_loss: 0.8282, test_f1: 0.6659
 epoch: 64, train_loss: 0.4957, test_loss: 0.8013, test_f1: 0.6496
 epoch: 65, train_loss: 0.4924, test_loss: 0.8132, test_f1: 0.6503
 epoch: 66, train_loss: 0.5007, test_loss: 0.7950, test_f1: 0.6446
 epoch: 67, train_loss: 0.4910, test_loss: 0.7811, test_f1: 0.6645
 epoch: 68, train_loss: 0.4788, test_loss: 0.8283, test_f1: 0.6536
 epoch: 69, train_loss: 0.4888, test_loss: 0.8188, test_f1: 0.6504
 epoch: 70, train_loss: 0.4844, test_loss: 0.7771, test_f1: 0.6606
 epoch: 71, train_loss: 0.4750, test_loss: 0.8253, test_f1: 0.6521
 epoch: 72, train_loss: 0.4668, test_loss: 0.8142, test_f1: 0.6711
 epoch: 73, train_loss: 0.4769, test_loss: 0.8559, test_f1: 0.6387
 epoch: 74, train_loss: 0.4611, test_loss: 0.8639, test_f1: 0.6507
 epoch: 75, train_loss: 0.4674, test_loss: 0.8725, test_f1: 0.6474
 epoch: 76, train_loss: 0.4691, test_loss: 0.8765, test_f1: 0.6394
 epoch: 77, train_loss: 0.4638, test_loss: 0.9114, test_f1: 0.6404
 epoch: 78, train_loss: 0.4618, test_loss: 0.8597, test_f1: 0.6485
 epoch: 79, train_loss: 0.4536, test_loss: 0.8970, test_f1: 0.6487
 epoch: 80, train_loss: 0.4509, test_loss: 0.8902, test_f1: 0.6428
 epoch: 81, train_loss: 0.4573, test_loss: 0.8465, test_f1: 0.6611
 epoch: 82, train_loss: 0.4382, test_loss: 0.8772, test_f1: 0.6392
 epoch: 83, train_loss: 0.4417, test_loss: 0.9286, test_f1: 0.6322
 epoch: 84, train_loss: 0.4539, test_loss: 0.9428, test_f1: 0.6591
 epoch: 85, train_loss: 0.4351, test_loss: 0.8986, test_f1: 0.6462
 epoch: 86, train_loss: 0.4463, test_loss: 0.9036, test_f1: 0.6475
 epoch: 87, train_loss: 0.4400, test_loss: 0.8796, test_f1: 0.6518
 epoch: 88, train_loss: 0.4352, test_loss: 0.9187, test_f1: 0.6455
 epoch: 89, train_loss: 0.4177, test_loss: 0.8783, test_f1: 0.6560
 epoch: 90, train_loss: 0.4419, test_loss: 0.8767, test_f1: 0.6491
 epoch: 91, train_loss: 0.4137, test_loss: 0.9038, test_f1: 0.6522
 epoch: 92, train_loss: 0.4500, test_loss: 1.0204, test_f1: 0.6331
 epoch: 93, train_loss: 0.4392, test_loss: 0.9208, test_f1: 0.6518
 epoch: 94, train_loss: 0.4183, test_loss: 0.9780, test_f1: 0.6471
 epoch: 95, train_loss: 0.4261, test_loss: 1.0091, test_f1: 0.6453
 epoch: 96, train_loss: 0.4278, test_loss: 0.9535, test_f1: 0.6456
 epoch: 97, train_loss: 0.4259, test_loss: 0.9814, test_f1: 0.6466
 epoch: 98, train_loss: 0.4251, test_loss: 0.9592, test_f1: 0.6488
 epoch: 99, train_loss: 0.4111, test_loss: 0.9847, test_f1: 0.6481
##################ITERATION #3 ****************************************
 epoch: 0, train_loss: 1.1159, test_loss: 1.0116, test_f1: 0.4656
 epoch: 1, train_loss: 1.0142, test_loss: 0.9587, test_f1: 0.4858
 epoch: 2, train_loss: 0.9805, test_loss: 0.9614, test_f1: 0.5011
 epoch: 3, train_loss: 0.9553, test_loss: 0.9445, test_f1: 0.4897
 epoch: 4, train_loss: 0.9440, test_loss: 0.9281, test_f1: 0.5194
 epoch: 5, train_loss: 0.9288, test_loss: 0.9329, test_f1: 0.5233
 epoch: 6, train_loss: 0.9223, test_loss: 0.9128, test_f1: 0.5653
 epoch: 7, train_loss: 0.9037, test_loss: 0.9051, test_f1: 0.5405
 epoch: 8, train_loss: 0.8900, test_loss: 0.8777, test_f1: 0.5408
 epoch: 9, train_loss: 0.8765, test_loss: 0.8626, test_f1: 0.5703
 epoch: 10, train_loss: 0.8573, test_loss: 0.8577, test_f1: 0.5786
 epoch: 11, train_loss: 0.8579, test_loss: 0.8334, test_f1: 0.5617
 epoch: 12, train_loss: 0.8446, test_loss: 0.8359, test_f1: 0.5649
 epoch: 13, train_loss: 0.8301, test_loss: 0.8182, test_f1: 0.5747
 epoch: 14, train_loss: 0.8274, test_loss: 0.8223, test_f1: 0.5967
 epoch: 15, train_loss: 0.8130, test_loss: 0.8219, test_f1: 0.5767
 epoch: 16, train_loss: 0.7981, test_loss: 0.7991, test_f1: 0.6013
 epoch: 17, train_loss: 0.8001, test_loss: 0.7959, test_f1: 0.6053
 epoch: 18, train_loss: 0.7937, test_loss: 0.8071, test_f1: 0.6238
 epoch: 19, train_loss: 0.7829, test_loss: 0.7978, test_f1: 0.5930
 epoch: 20, train_loss: 0.7691, test_loss: 0.7894, test_f1: 0.6083
 epoch: 21, train_loss: 0.7668, test_loss: 0.7740, test_f1: 0.6083
 epoch: 22, train_loss: 0.7528, test_loss: 0.7865, test_f1: 0.6130
 epoch: 23, train_loss: 0.7337, test_loss: 0.7944, test_f1: 0.6340
 epoch: 24, train_loss: 0.7395, test_loss: 0.7559, test_f1: 0.6371
 epoch: 25, train_loss: 0.7314, test_loss: 0.7870, test_f1: 0.6448
 epoch: 26, train_loss: 0.7146, test_loss: 0.7682, test_f1: 0.6387
 epoch: 27, train_loss: 0.7233, test_loss: 0.7455, test_f1: 0.6733
 epoch: 28, train_loss: 0.7112, test_loss: 0.7391, test_f1: 0.6625
 epoch: 29, train_loss: 0.7004, test_loss: 0.7543, test_f1: 0.6347
 epoch: 30, train_loss: 0.6910, test_loss: 0.7449, test_f1: 0.6605
 epoch: 31, train_loss: 0.6912, test_loss: 0.7411, test_f1: 0.6584
 epoch: 32, train_loss: 0.6755, test_loss: 0.7523, test_f1: 0.6622
 epoch: 33, train_loss: 0.6708, test_loss: 0.7732, test_f1: 0.6370
 epoch: 34, train_loss: 0.6637, test_loss: 0.7813, test_f1: 0.6172
 epoch: 35, train_loss: 0.6731, test_loss: 0.7934, test_f1: 0.6440
 epoch: 36, train_loss: 0.6584, test_loss: 0.7391, test_f1: 0.6947
 epoch: 37, train_loss: 0.6488, test_loss: 0.7536, test_f1: 0.6865
 epoch: 38, train_loss: 0.6406, test_loss: 0.7833, test_f1: 0.6447
 epoch: 39, train_loss: 0.6387, test_loss: 0.7862, test_f1: 0.6654
 epoch: 40, train_loss: 0.6277, test_loss: 0.7769, test_f1: 0.6595
 epoch: 41, train_loss: 0.6290, test_loss: 0.7706, test_f1: 0.6659
 epoch: 42, train_loss: 0.6307, test_loss: 0.7619, test_f1: 0.6624
 epoch: 43, train_loss: 0.6247, test_loss: 0.7945, test_f1: 0.6397
 epoch: 44, train_loss: 0.6200, test_loss: 0.7916, test_f1: 0.6639
 epoch: 45, train_loss: 0.6012, test_loss: 0.7987, test_f1: 0.6598
 epoch: 46, train_loss: 0.5991, test_loss: 0.7913, test_f1: 0.6764
 epoch: 47, train_loss: 0.6059, test_loss: 0.7805, test_f1: 0.6603
 epoch: 48, train_loss: 0.5843, test_loss: 0.8017, test_f1: 0.6337
 epoch: 49, train_loss: 0.5834, test_loss: 0.8126, test_f1: 0.6689
 epoch: 50, train_loss: 0.5843, test_loss: 0.7765, test_f1: 0.6480
 epoch: 51, train_loss: 0.5585, test_loss: 0.8050, test_f1: 0.6615
 epoch: 52, train_loss: 0.5497, test_loss: 0.8348, test_f1: 0.6583
 epoch: 53, train_loss: 0.5600, test_loss: 0.8407, test_f1: 0.6591
 epoch: 54, train_loss: 0.5463, test_loss: 0.8601, test_f1: 0.6756
 epoch: 55, train_loss: 0.5532, test_loss: 0.8228, test_f1: 0.6634
 epoch: 56, train_loss: 0.5437, test_loss: 0.8452, test_f1: 0.6783
 epoch: 57, train_loss: 0.5282, test_loss: 0.8128, test_f1: 0.6559
 epoch: 58, train_loss: 0.5350, test_loss: 0.8129, test_f1: 0.6598
 epoch: 59, train_loss: 0.5305, test_loss: 0.8603, test_f1: 0.6815
 epoch: 60, train_loss: 0.5344, test_loss: 0.8436, test_f1: 0.6568
 epoch: 61, train_loss: 0.5324, test_loss: 0.8577, test_f1: 0.6737
 epoch: 62, train_loss: 0.5214, test_loss: 0.8678, test_f1: 0.6483
 epoch: 63, train_loss: 0.5280, test_loss: 0.8746, test_f1: 0.6480
 epoch: 64, train_loss: 0.5138, test_loss: 0.9082, test_f1: 0.6608
 epoch: 65, train_loss: 0.5191, test_loss: 0.9240, test_f1: 0.6553
 epoch: 66, train_loss: 0.5237, test_loss: 0.8597, test_f1: 0.6615
 epoch: 67, train_loss: 0.4991, test_loss: 0.8913, test_f1: 0.6420
 epoch: 68, train_loss: 0.5092, test_loss: 0.8576, test_f1: 0.6556
 epoch: 69, train_loss: 0.5038, test_loss: 0.8661, test_f1: 0.6490
 epoch: 70, train_loss: 0.5152, test_loss: 0.8796, test_f1: 0.6607
 epoch: 71, train_loss: 0.5032, test_loss: 0.8689, test_f1: 0.6676
 epoch: 72, train_loss: 0.4941, test_loss: 0.9015, test_f1: 0.6628
 epoch: 73, train_loss: 0.5021, test_loss: 0.9077, test_f1: 0.6605
 epoch: 74, train_loss: 0.4956, test_loss: 0.9251, test_f1: 0.6650
 epoch: 75, train_loss: 0.4932, test_loss: 0.8754, test_f1: 0.6405
 epoch: 76, train_loss: 0.4836, test_loss: 0.9063, test_f1: 0.6596
 epoch: 77, train_loss: 0.4959, test_loss: 0.9341, test_f1: 0.6613
 epoch: 78, train_loss: 0.4907, test_loss: 0.9589, test_f1: 0.6633
 epoch: 79, train_loss: 0.4927, test_loss: 0.9472, test_f1: 0.6739
 epoch: 80, train_loss: 0.4692, test_loss: 0.9324, test_f1: 0.6708
 epoch: 81, train_loss: 0.4748, test_loss: 0.9764, test_f1: 0.6580
 epoch: 82, train_loss: 0.4782, test_loss: 0.9468, test_f1: 0.6595
 epoch: 83, train_loss: 0.4796, test_loss: 0.9553, test_f1: 0.6669
 epoch: 84, train_loss: 0.4632, test_loss: 0.9661, test_f1: 0.6787
 epoch: 85, train_loss: 0.4733, test_loss: 1.0023, test_f1: 0.6629
 epoch: 86, train_loss: 0.4625, test_loss: 1.0032, test_f1: 0.6551
 epoch: 87, train_loss: 0.4721, test_loss: 0.9569, test_f1: 0.6471
 epoch: 88, train_loss: 0.4638, test_loss: 0.9365, test_f1: 0.6432
 epoch: 89, train_loss: 0.4669, test_loss: 0.9128, test_f1: 0.6638
 epoch: 90, train_loss: 0.4539, test_loss: 1.0116, test_f1: 0.6490
 epoch: 91, train_loss: 0.4516, test_loss: 0.9928, test_f1: 0.6629
 epoch: 92, train_loss: 0.4504, test_loss: 0.9941, test_f1: 0.6542
 epoch: 93, train_loss: 0.4570, test_loss: 0.9891, test_f1: 0.6529
 epoch: 94, train_loss: 0.4584, test_loss: 0.9949, test_f1: 0.6337
 epoch: 95, train_loss: 0.4407, test_loss: 0.9589, test_f1: 0.6536
 epoch: 96, train_loss: 0.4532, test_loss: 0.9806, test_f1: 0.6370
 epoch: 97, train_loss: 0.4421, test_loss: 0.9536, test_f1: 0.6628
 epoch: 98, train_loss: 0.4314, test_loss: 1.0646, test_f1: 0.6492
 epoch: 99, train_loss: 0.4419, test_loss: 1.0331, test_f1: 0.6546
##################ITERATION #4 ****************************************
 epoch: 0, train_loss: 1.1317, test_loss: 0.9774, test_f1: 0.4622
 epoch: 1, train_loss: 0.9884, test_loss: 0.9684, test_f1: 0.4818
 epoch: 2, train_loss: 0.9672, test_loss: 0.9427, test_f1: 0.5222
 epoch: 3, train_loss: 0.9388, test_loss: 0.9138, test_f1: 0.5040
 epoch: 4, train_loss: 0.9307, test_loss: 0.9176, test_f1: 0.5422
 epoch: 5, train_loss: 0.9140, test_loss: 0.8972, test_f1: 0.5546
 epoch: 6, train_loss: 0.8966, test_loss: 0.8806, test_f1: 0.5578
 epoch: 7, train_loss: 0.8917, test_loss: 0.8836, test_f1: 0.5725
 epoch: 8, train_loss: 0.8644, test_loss: 0.8497, test_f1: 0.5716
 epoch: 9, train_loss: 0.8544, test_loss: 0.8401, test_f1: 0.5882
 epoch: 10, train_loss: 0.8382, test_loss: 0.8577, test_f1: 0.5899
 epoch: 11, train_loss: 0.8297, test_loss: 0.8408, test_f1: 0.5939
 epoch: 12, train_loss: 0.8234, test_loss: 0.8285, test_f1: 0.5645
 epoch: 13, train_loss: 0.7992, test_loss: 0.8424, test_f1: 0.5705
 epoch: 14, train_loss: 0.7896, test_loss: 0.8253, test_f1: 0.6294
 epoch: 15, train_loss: 0.7792, test_loss: 0.8004, test_f1: 0.6325
 epoch: 16, train_loss: 0.7766, test_loss: 0.7963, test_f1: 0.6254
 epoch: 17, train_loss: 0.7716, test_loss: 0.7743, test_f1: 0.6346
 epoch: 18, train_loss: 0.7558, test_loss: 0.7724, test_f1: 0.6189
 epoch: 19, train_loss: 0.7518, test_loss: 0.7463, test_f1: 0.6108
 epoch: 20, train_loss: 0.7397, test_loss: 0.7544, test_f1: 0.6414
 epoch: 21, train_loss: 0.7346, test_loss: 0.7556, test_f1: 0.6492
 epoch: 22, train_loss: 0.7254, test_loss: 0.7962, test_f1: 0.6582
 epoch: 23, train_loss: 0.7155, test_loss: 0.7402, test_f1: 0.6549
 epoch: 24, train_loss: 0.7081, test_loss: 0.8292, test_f1: 0.6027
 epoch: 25, train_loss: 0.7093, test_loss: 0.7603, test_f1: 0.6580
 epoch: 26, train_loss: 0.6877, test_loss: 0.7187, test_f1: 0.6735
 epoch: 27, train_loss: 0.6784, test_loss: 0.7286, test_f1: 0.6728
 epoch: 28, train_loss: 0.6704, test_loss: 0.6980, test_f1: 0.6969
 epoch: 29, train_loss: 0.6730, test_loss: 0.7249, test_f1: 0.6512
 epoch: 30, train_loss: 0.6659, test_loss: 0.7850, test_f1: 0.6352
 epoch: 31, train_loss: 0.6487, test_loss: 0.7327, test_f1: 0.6631
 epoch: 32, train_loss: 0.6530, test_loss: 0.7341, test_f1: 0.6791
 epoch: 33, train_loss: 0.6411, test_loss: 0.7240, test_f1: 0.6934
 epoch: 34, train_loss: 0.6411, test_loss: 0.7396, test_f1: 0.6538
 epoch: 35, train_loss: 0.6352, test_loss: 0.7884, test_f1: 0.6751
 epoch: 36, train_loss: 0.6180, test_loss: 0.7774, test_f1: 0.6540
 epoch: 37, train_loss: 0.6169, test_loss: 0.6947, test_f1: 0.6819
 epoch: 38, train_loss: 0.6187, test_loss: 0.8771, test_f1: 0.6485
 epoch: 39, train_loss: 0.6037, test_loss: 0.7079, test_f1: 0.6576
 epoch: 40, train_loss: 0.5981, test_loss: 0.7831, test_f1: 0.6571
 epoch: 41, train_loss: 0.5932, test_loss: 0.8055, test_f1: 0.6508
 epoch: 42, train_loss: 0.6032, test_loss: 0.7435, test_f1: 0.6715
 epoch: 43, train_loss: 0.5914, test_loss: 0.6957, test_f1: 0.6730
 epoch: 44, train_loss: 0.5680, test_loss: 0.7017, test_f1: 0.6574
 epoch: 45, train_loss: 0.5706, test_loss: 0.8651, test_f1: 0.6696
 epoch: 46, train_loss: 0.5694, test_loss: 0.7420, test_f1: 0.6702
 epoch: 47, train_loss: 0.5603, test_loss: 0.7353, test_f1: 0.6689
 epoch: 48, train_loss: 0.5624, test_loss: 0.7701, test_f1: 0.6679
 epoch: 49, train_loss: 0.5603, test_loss: 0.7180, test_f1: 0.6765
 epoch: 50, train_loss: 0.5435, test_loss: 0.7317, test_f1: 0.6593
 epoch: 51, train_loss: 0.5220, test_loss: 0.7677, test_f1: 0.6498
 epoch: 52, train_loss: 0.5204, test_loss: 0.7409, test_f1: 0.6706
 epoch: 53, train_loss: 0.5209, test_loss: 0.8002, test_f1: 0.6517
 epoch: 54, train_loss: 0.5002, test_loss: 0.8185, test_f1: 0.6620
 epoch: 55, train_loss: 0.4994, test_loss: 0.7591, test_f1: 0.6523
 epoch: 56, train_loss: 0.5062, test_loss: 0.8408, test_f1: 0.6421
 epoch: 57, train_loss: 0.4995, test_loss: 0.7739, test_f1: 0.6646
 epoch: 58, train_loss: 0.4934, test_loss: 0.8488, test_f1: 0.6595
 epoch: 59, train_loss: 0.4921, test_loss: 0.8270, test_f1: 0.6529
 epoch: 60, train_loss: 0.4988, test_loss: 0.7963, test_f1: 0.6412
 epoch: 61, train_loss: 0.4817, test_loss: 0.8817, test_f1: 0.6472
 epoch: 62, train_loss: 0.4893, test_loss: 0.8615, test_f1: 0.6674
 epoch: 63, train_loss: 0.4883, test_loss: 0.8926, test_f1: 0.6656
 epoch: 64, train_loss: 0.4824, test_loss: 0.9170, test_f1: 0.6592
 epoch: 65, train_loss: 0.4823, test_loss: 0.9201, test_f1: 0.6562
 epoch: 66, train_loss: 0.4701, test_loss: 0.8924, test_f1: 0.6461
 epoch: 67, train_loss: 0.4556, test_loss: 0.9326, test_f1: 0.6466
 epoch: 68, train_loss: 0.4626, test_loss: 0.8551, test_f1: 0.6674
 epoch: 69, train_loss: 0.4665, test_loss: 0.9389, test_f1: 0.6411
 epoch: 70, train_loss: 0.4819, test_loss: 0.8809, test_f1: 0.6430
 epoch: 71, train_loss: 0.4575, test_loss: 0.8589, test_f1: 0.6656
 epoch: 72, train_loss: 0.4656, test_loss: 0.8886, test_f1: 0.6427
 epoch: 73, train_loss: 0.4604, test_loss: 0.9013, test_f1: 0.6369
 epoch: 74, train_loss: 0.4521, test_loss: 0.9022, test_f1: 0.6493
 epoch: 75, train_loss: 0.4536, test_loss: 0.9176, test_f1: 0.6400
 epoch: 76, train_loss: 0.4441, test_loss: 0.9140, test_f1: 0.6454
 epoch: 77, train_loss: 0.4534, test_loss: 0.9420, test_f1: 0.6597
 epoch: 78, train_loss: 0.4469, test_loss: 0.9643, test_f1: 0.6422
 epoch: 79, train_loss: 0.4390, test_loss: 0.9318, test_f1: 0.6455
 epoch: 80, train_loss: 0.4406, test_loss: 0.9488, test_f1: 0.6471
 epoch: 81, train_loss: 0.4288, test_loss: 0.9263, test_f1: 0.6483
 epoch: 82, train_loss: 0.4334, test_loss: 0.9794, test_f1: 0.6516
 epoch: 83, train_loss: 0.4322, test_loss: 1.0330, test_f1: 0.6385
 epoch: 84, train_loss: 0.4363, test_loss: 0.9667, test_f1: 0.6553
 epoch: 85, train_loss: 0.4192, test_loss: 0.9750, test_f1: 0.6374
 epoch: 86, train_loss: 0.4256, test_loss: 0.9884, test_f1: 0.6384
 epoch: 87, train_loss: 0.4145, test_loss: 1.0379, test_f1: 0.6382
 epoch: 88, train_loss: 0.4119, test_loss: 1.0512, test_f1: 0.6640
 epoch: 89, train_loss: 0.4109, test_loss: 1.0662, test_f1: 0.6424
 epoch: 90, train_loss: 0.4236, test_loss: 1.0515, test_f1: 0.6423
 epoch: 91, train_loss: 0.4215, test_loss: 1.1088, test_f1: 0.6502
 epoch: 92, train_loss: 0.4083, test_loss: 1.0890, test_f1: 0.6454
 epoch: 93, train_loss: 0.4169, test_loss: 1.0361, test_f1: 0.6383
 epoch: 94, train_loss: 0.3969, test_loss: 0.9955, test_f1: 0.6498
 epoch: 95, train_loss: 0.4145, test_loss: 1.0729, test_f1: 0.6465
 epoch: 96, train_loss: 0.3975, test_loss: 1.1251, test_f1: 0.6528
 epoch: 97, train_loss: 0.3954, test_loss: 1.1686, test_f1: 0.6563
 epoch: 98, train_loss: 0.3948, test_loss: 1.1096, test_f1: 0.6446
 epoch: 99, train_loss: 0.3975, test_loss: 1.1492, test_f1: 0.6576
##################ITERATION #5 ****************************************
 epoch: 0, train_loss: 1.1346, test_loss: 0.9603, test_f1: 0.5003
 epoch: 1, train_loss: 0.9990, test_loss: 0.9157, test_f1: 0.5016
 epoch: 2, train_loss: 0.9734, test_loss: 0.8805, test_f1: 0.5291
 epoch: 3, train_loss: 0.9396, test_loss: 0.8695, test_f1: 0.5222
 epoch: 4, train_loss: 0.9201, test_loss: 0.8562, test_f1: 0.5173
 epoch: 5, train_loss: 0.8950, test_loss: 0.8558, test_f1: 0.5411
 epoch: 6, train_loss: 0.8717, test_loss: 0.8248, test_f1: 0.5606
 epoch: 7, train_loss: 0.8653, test_loss: 0.8224, test_f1: 0.5809
 epoch: 8, train_loss: 0.8526, test_loss: 0.8097, test_f1: 0.5610
 epoch: 9, train_loss: 0.8322, test_loss: 0.7856, test_f1: 0.6182
 epoch: 10, train_loss: 0.8156, test_loss: 0.7927, test_f1: 0.6034
 epoch: 11, train_loss: 0.8115, test_loss: 0.7842, test_f1: 0.5928
 epoch: 12, train_loss: 0.7951, test_loss: 0.7764, test_f1: 0.5894
 epoch: 13, train_loss: 0.7887, test_loss: 0.7705, test_f1: 0.5881
 epoch: 14, train_loss: 0.7834, test_loss: 0.7640, test_f1: 0.5883
 epoch: 15, train_loss: 0.7605, test_loss: 0.7454, test_f1: 0.6137
 epoch: 16, train_loss: 0.7539, test_loss: 0.7513, test_f1: 0.5943
 epoch: 17, train_loss: 0.7468, test_loss: 0.7609, test_f1: 0.6132
 epoch: 18, train_loss: 0.7410, test_loss: 0.7545, test_f1: 0.6016
 epoch: 19, train_loss: 0.7241, test_loss: 0.7500, test_f1: 0.5827
 epoch: 20, train_loss: 0.7197, test_loss: 0.7495, test_f1: 0.5974
 epoch: 21, train_loss: 0.7244, test_loss: 0.7361, test_f1: 0.6256
 epoch: 22, train_loss: 0.7142, test_loss: 0.7341, test_f1: 0.5996
 epoch: 23, train_loss: 0.7023, test_loss: 0.7436, test_f1: 0.6204
 epoch: 24, train_loss: 0.6917, test_loss: 0.7412, test_f1: 0.6311
 epoch: 25, train_loss: 0.6739, test_loss: 0.7373, test_f1: 0.6494
 epoch: 26, train_loss: 0.6746, test_loss: 0.7493, test_f1: 0.6226
 epoch: 27, train_loss: 0.6664, test_loss: 0.7738, test_f1: 0.5787
 epoch: 28, train_loss: 0.6551, test_loss: 0.7374, test_f1: 0.6526
 epoch: 29, train_loss: 0.6513, test_loss: 0.7067, test_f1: 0.6521
 epoch: 30, train_loss: 0.6526, test_loss: 0.7277, test_f1: 0.6468
 epoch: 31, train_loss: 0.6603, test_loss: 0.7442, test_f1: 0.6390
 epoch: 32, train_loss: 0.6467, test_loss: 0.7309, test_f1: 0.6241
 epoch: 33, train_loss: 0.6299, test_loss: 0.7195, test_f1: 0.6712
 epoch: 34, train_loss: 0.6200, test_loss: 0.7404, test_f1: 0.6531
 epoch: 35, train_loss: 0.6119, test_loss: 0.7522, test_f1: 0.6606
 epoch: 36, train_loss: 0.6124, test_loss: 0.7587, test_f1: 0.6266
 epoch: 37, train_loss: 0.6117, test_loss: 0.7335, test_f1: 0.6492
 epoch: 38, train_loss: 0.6009, test_loss: 0.7625, test_f1: 0.6817
 epoch: 39, train_loss: 0.6078, test_loss: 0.7295, test_f1: 0.6699
 epoch: 40, train_loss: 0.5986, test_loss: 0.7317, test_f1: 0.6832
 epoch: 41, train_loss: 0.5878, test_loss: 0.7306, test_f1: 0.6656
 epoch: 42, train_loss: 0.5758, test_loss: 0.8250, test_f1: 0.6312
 epoch: 43, train_loss: 0.5773, test_loss: 0.7780, test_f1: 0.6403
 epoch: 44, train_loss: 0.5686, test_loss: 0.8283, test_f1: 0.6701
 epoch: 45, train_loss: 0.5699, test_loss: 0.8569, test_f1: 0.6351
 epoch: 46, train_loss: 0.5725, test_loss: 0.8392, test_f1: 0.6427
 epoch: 47, train_loss: 0.5727, test_loss: 0.8218, test_f1: 0.6756
 epoch: 48, train_loss: 0.5588, test_loss: 0.8090, test_f1: 0.6524
 epoch: 49, train_loss: 0.5545, test_loss: 0.8375, test_f1: 0.6673
 epoch: 50, train_loss: 0.5408, test_loss: 0.9317, test_f1: 0.6487
 epoch: 51, train_loss: 0.5204, test_loss: 0.8014, test_f1: 0.6446
 epoch: 52, train_loss: 0.5290, test_loss: 0.8291, test_f1: 0.6423
 epoch: 53, train_loss: 0.5132, test_loss: 0.8559, test_f1: 0.6402
 epoch: 54, train_loss: 0.5052, test_loss: 0.8684, test_f1: 0.6377
 epoch: 55, train_loss: 0.5174, test_loss: 0.8396, test_f1: 0.6479
 epoch: 56, train_loss: 0.5081, test_loss: 0.9071, test_f1: 0.6290
 epoch: 57, train_loss: 0.4979, test_loss: 0.8710, test_f1: 0.6372
 epoch: 58, train_loss: 0.5005, test_loss: 0.8730, test_f1: 0.6283
 epoch: 59, train_loss: 0.5086, test_loss: 0.8748, test_f1: 0.6382
 epoch: 60, train_loss: 0.4966, test_loss: 0.8508, test_f1: 0.6453
 epoch: 61, train_loss: 0.4911, test_loss: 0.9375, test_f1: 0.6290
 epoch: 62, train_loss: 0.4885, test_loss: 0.9013, test_f1: 0.6236
 epoch: 63, train_loss: 0.4723, test_loss: 0.9097, test_f1: 0.6391
 epoch: 64, train_loss: 0.4784, test_loss: 0.9626, test_f1: 0.6430
 epoch: 65, train_loss: 0.4808, test_loss: 0.9187, test_f1: 0.6473
 epoch: 66, train_loss: 0.4712, test_loss: 0.9436, test_f1: 0.6411
 epoch: 67, train_loss: 0.4777, test_loss: 1.0168, test_f1: 0.6413
 epoch: 68, train_loss: 0.4848, test_loss: 0.9171, test_f1: 0.6473
 epoch: 69, train_loss: 0.4661, test_loss: 0.9551, test_f1: 0.6362
 epoch: 70, train_loss: 0.4638, test_loss: 0.9367, test_f1: 0.6455
 epoch: 71, train_loss: 0.4779, test_loss: 0.9517, test_f1: 0.6443
 epoch: 72, train_loss: 0.4751, test_loss: 0.9734, test_f1: 0.6314
 epoch: 73, train_loss: 0.4576, test_loss: 0.9695, test_f1: 0.6503
 epoch: 74, train_loss: 0.4517, test_loss: 1.0386, test_f1: 0.6365
 epoch: 75, train_loss: 0.4601, test_loss: 1.0038, test_f1: 0.6429
 epoch: 76, train_loss: 0.4652, test_loss: 1.0151, test_f1: 0.6501
 epoch: 77, train_loss: 0.4638, test_loss: 1.0053, test_f1: 0.6536
 epoch: 78, train_loss: 0.4547, test_loss: 1.0136, test_f1: 0.6648
 epoch: 79, train_loss: 0.4472, test_loss: 1.0025, test_f1: 0.6465
 epoch: 80, train_loss: 0.4477, test_loss: 0.9507, test_f1: 0.6542
 epoch: 81, train_loss: 0.4304, test_loss: 1.0163, test_f1: 0.6538
 epoch: 82, train_loss: 0.4455, test_loss: 1.0583, test_f1: 0.6488
 epoch: 83, train_loss: 0.4458, test_loss: 1.0146, test_f1: 0.6546
 epoch: 84, train_loss: 0.4282, test_loss: 1.0013, test_f1: 0.6509
 epoch: 85, train_loss: 0.4313, test_loss: 0.9843, test_f1: 0.6512
 epoch: 86, train_loss: 0.4239, test_loss: 1.0186, test_f1: 0.6620
 epoch: 87, train_loss: 0.4370, test_loss: 1.0207, test_f1: 0.6630
 epoch: 88, train_loss: 0.4388, test_loss: 1.0210, test_f1: 0.6637
 epoch: 89, train_loss: 0.4200, test_loss: 1.0011, test_f1: 0.6669
 epoch: 90, train_loss: 0.4231, test_loss: 1.0587, test_f1: 0.6365
 epoch: 91, train_loss: 0.4137, test_loss: 1.0694, test_f1: 0.6519
 epoch: 92, train_loss: 0.4140, test_loss: 1.0296, test_f1: 0.6511
 epoch: 93, train_loss: 0.4202, test_loss: 1.0858, test_f1: 0.6458
 epoch: 94, train_loss: 0.4078, test_loss: 1.0781, test_f1: 0.6443
 epoch: 95, train_loss: 0.4114, test_loss: 1.0897, test_f1: 0.6522
 epoch: 96, train_loss: 0.3932, test_loss: 1.1236, test_f1: 0.6464
 epoch: 97, train_loss: 0.4085, test_loss: 1.1021, test_f1: 0.6492
 epoch: 98, train_loss: 0.4075, test_loss: 1.0928, test_f1: 0.6521
 epoch: 99, train_loss: 0.4102, test_loss: 1.0752, test_f1: 0.6472
##################ITERATION #6 ****************************************
 epoch: 0, train_loss: 1.1850, test_loss: 0.9675, test_f1: 0.4769
 epoch: 1, train_loss: 1.0152, test_loss: 0.9340, test_f1: 0.5121
 epoch: 2, train_loss: 0.9806, test_loss: 0.9071, test_f1: 0.5307
 epoch: 3, train_loss: 0.9329, test_loss: 0.8819, test_f1: 0.5378
 epoch: 4, train_loss: 0.9258, test_loss: 0.8847, test_f1: 0.5450
 epoch: 5, train_loss: 0.9173, test_loss: 0.8563, test_f1: 0.5790
 epoch: 6, train_loss: 0.8952, test_loss: 0.8517, test_f1: 0.5718
 epoch: 7, train_loss: 0.8860, test_loss: 0.8589, test_f1: 0.5664
 epoch: 8, train_loss: 0.8792, test_loss: 0.8657, test_f1: 0.5446
 epoch: 9, train_loss: 0.8409, test_loss: 0.8487, test_f1: 0.5888
 epoch: 10, train_loss: 0.8453, test_loss: 0.8273, test_f1: 0.6145
 epoch: 11, train_loss: 0.8143, test_loss: 0.8014, test_f1: 0.5744
 epoch: 12, train_loss: 0.8029, test_loss: 0.7969, test_f1: 0.6061
 epoch: 13, train_loss: 0.8069, test_loss: 0.7776, test_f1: 0.6062
 epoch: 14, train_loss: 0.7879, test_loss: 0.7852, test_f1: 0.6100
 epoch: 15, train_loss: 0.7902, test_loss: 0.7940, test_f1: 0.6198
 epoch: 16, train_loss: 0.7726, test_loss: 0.7623, test_f1: 0.6496
 epoch: 17, train_loss: 0.7515, test_loss: 0.7527, test_f1: 0.6212
 epoch: 18, train_loss: 0.7578, test_loss: 0.7695, test_f1: 0.6081
 epoch: 19, train_loss: 0.7368, test_loss: 0.7387, test_f1: 0.6668
 epoch: 20, train_loss: 0.7361, test_loss: 0.7539, test_f1: 0.6177
 epoch: 21, train_loss: 0.7231, test_loss: 0.7446, test_f1: 0.6552
 epoch: 22, train_loss: 0.7256, test_loss: 0.7299, test_f1: 0.6610
 epoch: 23, train_loss: 0.7206, test_loss: 0.7467, test_f1: 0.6639
 epoch: 24, train_loss: 0.7084, test_loss: 0.7177, test_f1: 0.6515
 epoch: 25, train_loss: 0.7018, test_loss: 0.7342, test_f1: 0.6646
 epoch: 26, train_loss: 0.6812, test_loss: 0.7178, test_f1: 0.6419
 epoch: 27, train_loss: 0.6840, test_loss: 0.7178, test_f1: 0.6639
 epoch: 28, train_loss: 0.6631, test_loss: 0.7182, test_f1: 0.6610
 epoch: 29, train_loss: 0.6620, test_loss: 0.7362, test_f1: 0.6398
 epoch: 30, train_loss: 0.6685, test_loss: 0.7235, test_f1: 0.6588
 epoch: 31, train_loss: 0.6574, test_loss: 0.7052, test_f1: 0.6792
 epoch: 32, train_loss: 0.6557, test_loss: 0.6987, test_f1: 0.6691
 epoch: 33, train_loss: 0.6371, test_loss: 0.7248, test_f1: 0.6438
 epoch: 34, train_loss: 0.6446, test_loss: 0.7348, test_f1: 0.6460
 epoch: 35, train_loss: 0.6390, test_loss: 0.7196, test_f1: 0.6458
 epoch: 36, train_loss: 0.6214, test_loss: 0.7174, test_f1: 0.6649
 epoch: 37, train_loss: 0.6094, test_loss: 0.7005, test_f1: 0.6650
 epoch: 38, train_loss: 0.5999, test_loss: 0.7144, test_f1: 0.6609
 epoch: 39, train_loss: 0.6133, test_loss: 0.7231, test_f1: 0.6471
 epoch: 40, train_loss: 0.5919, test_loss: 0.7306, test_f1: 0.6726
 epoch: 41, train_loss: 0.5988, test_loss: 0.7412, test_f1: 0.6669
 epoch: 42, train_loss: 0.5911, test_loss: 0.7319, test_f1: 0.6582
 epoch: 43, train_loss: 0.5696, test_loss: 0.7236, test_f1: 0.6693
 epoch: 44, train_loss: 0.5800, test_loss: 0.7331, test_f1: 0.6762
 epoch: 45, train_loss: 0.5753, test_loss: 0.7186, test_f1: 0.6614
 epoch: 46, train_loss: 0.5717, test_loss: 0.7360, test_f1: 0.6458
 epoch: 47, train_loss: 0.5545, test_loss: 0.7848, test_f1: 0.6384
 epoch: 48, train_loss: 0.5654, test_loss: 0.7547, test_f1: 0.6577
 epoch: 49, train_loss: 0.5588, test_loss: 0.7915, test_f1: 0.6591
 epoch: 50, train_loss: 0.5540, test_loss: 0.7891, test_f1: 0.6508
 epoch: 51, train_loss: 0.5276, test_loss: 0.7741, test_f1: 0.6608
 epoch: 52, train_loss: 0.5143, test_loss: 0.7858, test_f1: 0.6382
 epoch: 53, train_loss: 0.5135, test_loss: 0.7716, test_f1: 0.6625
 epoch: 54, train_loss: 0.5174, test_loss: 0.7766, test_f1: 0.6586
 epoch: 55, train_loss: 0.5099, test_loss: 0.7899, test_f1: 0.6754
 epoch: 56, train_loss: 0.5121, test_loss: 0.7885, test_f1: 0.6538
 epoch: 57, train_loss: 0.5166, test_loss: 0.8172, test_f1: 0.6721
 epoch: 58, train_loss: 0.4985, test_loss: 0.7827, test_f1: 0.6945
 epoch: 59, train_loss: 0.5006, test_loss: 0.8135, test_f1: 0.6573
 epoch: 60, train_loss: 0.4982, test_loss: 0.8295, test_f1: 0.6672
 epoch: 61, train_loss: 0.4845, test_loss: 0.8416, test_f1: 0.6611
 epoch: 62, train_loss: 0.4838, test_loss: 0.8568, test_f1: 0.6453
 epoch: 63, train_loss: 0.4966, test_loss: 0.8384, test_f1: 0.6567
 epoch: 64, train_loss: 0.4958, test_loss: 0.8464, test_f1: 0.6730
 epoch: 65, train_loss: 0.4789, test_loss: 0.8795, test_f1: 0.6563
 epoch: 66, train_loss: 0.4783, test_loss: 0.8224, test_f1: 0.6693
 epoch: 67, train_loss: 0.4759, test_loss: 0.8425, test_f1: 0.6660
 epoch: 68, train_loss: 0.4730, test_loss: 0.8269, test_f1: 0.6619
 epoch: 69, train_loss: 0.4680, test_loss: 0.8317, test_f1: 0.6738
 epoch: 70, train_loss: 0.4717, test_loss: 0.8439, test_f1: 0.6597
 epoch: 71, train_loss: 0.4680, test_loss: 0.8406, test_f1: 0.6693
 epoch: 72, train_loss: 0.4681, test_loss: 0.8726, test_f1: 0.6590
 epoch: 73, train_loss: 0.4575, test_loss: 0.8524, test_f1: 0.6590
 epoch: 74, train_loss: 0.4513, test_loss: 0.8345, test_f1: 0.6697
 epoch: 75, train_loss: 0.4614, test_loss: 0.8785, test_f1: 0.6787
 epoch: 76, train_loss: 0.4498, test_loss: 0.9052, test_f1: 0.6596
 epoch: 77, train_loss: 0.4357, test_loss: 0.8595, test_f1: 0.6605
 epoch: 78, train_loss: 0.4461, test_loss: 0.8813, test_f1: 0.6639
 epoch: 79, train_loss: 0.4553, test_loss: 0.8770, test_f1: 0.6669
 epoch: 80, train_loss: 0.4445, test_loss: 0.8799, test_f1: 0.6777
 epoch: 81, train_loss: 0.4419, test_loss: 0.9022, test_f1: 0.6514
 epoch: 82, train_loss: 0.4464, test_loss: 0.9461, test_f1: 0.6521
 epoch: 83, train_loss: 0.4401, test_loss: 0.9403, test_f1: 0.6741
 epoch: 84, train_loss: 0.4421, test_loss: 0.9447, test_f1: 0.6667
 epoch: 85, train_loss: 0.4479, test_loss: 0.9201, test_f1: 0.6765
 epoch: 86, train_loss: 0.4222, test_loss: 0.9201, test_f1: 0.6671
 epoch: 87, train_loss: 0.4210, test_loss: 0.9514, test_f1: 0.6512
 epoch: 88, train_loss: 0.4342, test_loss: 0.9868, test_f1: 0.6633
 epoch: 89, train_loss: 0.4278, test_loss: 0.9653, test_f1: 0.6598
 epoch: 90, train_loss: 0.4137, test_loss: 0.9767, test_f1: 0.6547
 epoch: 91, train_loss: 0.4147, test_loss: 0.9929, test_f1: 0.6655
 epoch: 92, train_loss: 0.4281, test_loss: 0.9954, test_f1: 0.6548
 epoch: 93, train_loss: 0.4126, test_loss: 0.9732, test_f1: 0.6623
 epoch: 94, train_loss: 0.4179, test_loss: 1.0049, test_f1: 0.6582
 epoch: 95, train_loss: 0.4092, test_loss: 0.9519, test_f1: 0.6710
 epoch: 96, train_loss: 0.4104, test_loss: 0.9797, test_f1: 0.6702
 epoch: 97, train_loss: 0.4008, test_loss: 1.0304, test_f1: 0.6532
 epoch: 98, train_loss: 0.4036, test_loss: 0.9963, test_f1: 0.6606
 epoch: 99, train_loss: 0.4077, test_loss: 1.0424, test_f1: 0.6513
##################ITERATION #7 ****************************************
 epoch: 0, train_loss: 1.2073, test_loss: 1.0013, test_f1: 0.5294
 epoch: 1, train_loss: 1.0270, test_loss: 0.9274, test_f1: 0.5234
 epoch: 2, train_loss: 0.9858, test_loss: 0.9446, test_f1: 0.5215
 epoch: 3, train_loss: 0.9637, test_loss: 0.9477, test_f1: 0.5307
 epoch: 4, train_loss: 0.9293, test_loss: 0.9289, test_f1: 0.5382
 epoch: 5, train_loss: 0.9205, test_loss: 0.8928, test_f1: 0.5409
 epoch: 6, train_loss: 0.8970, test_loss: 0.8885, test_f1: 0.5459
 epoch: 7, train_loss: 0.8945, test_loss: 0.8702, test_f1: 0.5628
 epoch: 8, train_loss: 0.8693, test_loss: 0.8767, test_f1: 0.5810
 epoch: 9, train_loss: 0.8691, test_loss: 0.9035, test_f1: 0.5723
 epoch: 10, train_loss: 0.8493, test_loss: 0.8681, test_f1: 0.6103
 epoch: 11, train_loss: 0.8433, test_loss: 0.8818, test_f1: 0.5824
 epoch: 12, train_loss: 0.8191, test_loss: 0.8583, test_f1: 0.6274
 epoch: 13, train_loss: 0.7957, test_loss: 0.8424, test_f1: 0.6151
 epoch: 14, train_loss: 0.8047, test_loss: 0.8287, test_f1: 0.5924
 epoch: 15, train_loss: 0.7956, test_loss: 0.8760, test_f1: 0.5710
 epoch: 16, train_loss: 0.7799, test_loss: 0.8091, test_f1: 0.6118
 epoch: 17, train_loss: 0.7668, test_loss: 0.8468, test_f1: 0.6199
 epoch: 18, train_loss: 0.7639, test_loss: 0.8243, test_f1: 0.6325
 epoch: 19, train_loss: 0.7550, test_loss: 0.8607, test_f1: 0.6274
 epoch: 20, train_loss: 0.7408, test_loss: 0.8534, test_f1: 0.6306
 epoch: 21, train_loss: 0.7383, test_loss: 0.8209, test_f1: 0.6320
 epoch: 22, train_loss: 0.7386, test_loss: 0.7831, test_f1: 0.6378
 epoch: 23, train_loss: 0.7280, test_loss: 0.8330, test_f1: 0.6619
 epoch: 24, train_loss: 0.6991, test_loss: 0.7934, test_f1: 0.6458
 epoch: 25, train_loss: 0.7065, test_loss: 0.8162, test_f1: 0.6158
 epoch: 26, train_loss: 0.7041, test_loss: 0.8180, test_f1: 0.6409
 epoch: 27, train_loss: 0.6889, test_loss: 0.7951, test_f1: 0.6211
 epoch: 28, train_loss: 0.6887, test_loss: 0.8149, test_f1: 0.6307
 epoch: 29, train_loss: 0.6720, test_loss: 0.8121, test_f1: 0.6269
 epoch: 30, train_loss: 0.6733, test_loss: 0.8328, test_f1: 0.6194
 epoch: 31, train_loss: 0.6676, test_loss: 0.8059, test_f1: 0.6186
 epoch: 32, train_loss: 0.6592, test_loss: 0.7861, test_f1: 0.6339
 epoch: 33, train_loss: 0.6626, test_loss: 0.8470, test_f1: 0.6132
 epoch: 34, train_loss: 0.6517, test_loss: 0.8145, test_f1: 0.6316
 epoch: 35, train_loss: 0.6426, test_loss: 0.8223, test_f1: 0.6288
 epoch: 36, train_loss: 0.6399, test_loss: 0.8451, test_f1: 0.6182
 epoch: 37, train_loss: 0.6276, test_loss: 0.8550, test_f1: 0.6320
 epoch: 38, train_loss: 0.6190, test_loss: 0.8143, test_f1: 0.6525
 epoch: 39, train_loss: 0.6309, test_loss: 0.8490, test_f1: 0.6508
 epoch: 40, train_loss: 0.6197, test_loss: 0.8502, test_f1: 0.6327
 epoch: 41, train_loss: 0.6156, test_loss: 0.8306, test_f1: 0.6266
 epoch: 42, train_loss: 0.6076, test_loss: 0.8648, test_f1: 0.6219
 epoch: 43, train_loss: 0.5918, test_loss: 0.7478, test_f1: 0.6399
 epoch: 44, train_loss: 0.6099, test_loss: 0.8154, test_f1: 0.6301
 epoch: 45, train_loss: 0.6167, test_loss: 0.8464, test_f1: 0.6428
 epoch: 46, train_loss: 0.5880, test_loss: 0.8069, test_f1: 0.6474
 epoch: 47, train_loss: 0.5810, test_loss: 0.8313, test_f1: 0.6337
 epoch: 48, train_loss: 0.5850, test_loss: 0.8311, test_f1: 0.6516
 epoch: 49, train_loss: 0.5846, test_loss: 0.8746, test_f1: 0.6753
 epoch: 50, train_loss: 0.5698, test_loss: 0.8734, test_f1: 0.6462
 epoch: 51, train_loss: 0.5589, test_loss: 0.7933, test_f1: 0.6460
 epoch: 52, train_loss: 0.5460, test_loss: 0.8118, test_f1: 0.6672
 epoch: 53, train_loss: 0.5512, test_loss: 0.8459, test_f1: 0.6356
 epoch: 54, train_loss: 0.5277, test_loss: 0.8799, test_f1: 0.6157
 epoch: 55, train_loss: 0.5340, test_loss: 0.8975, test_f1: 0.6385
 epoch: 56, train_loss: 0.5226, test_loss: 0.8988, test_f1: 0.6259
 epoch: 57, train_loss: 0.5219, test_loss: 0.8757, test_f1: 0.6232
 epoch: 58, train_loss: 0.5120, test_loss: 0.8620, test_f1: 0.6438
 epoch: 59, train_loss: 0.5137, test_loss: 0.9348, test_f1: 0.6337
 epoch: 60, train_loss: 0.5086, test_loss: 0.8884, test_f1: 0.6212
 epoch: 61, train_loss: 0.5290, test_loss: 0.9146, test_f1: 0.6465
 epoch: 62, train_loss: 0.5126, test_loss: 0.8951, test_f1: 0.6386
 epoch: 63, train_loss: 0.5029, test_loss: 0.8653, test_f1: 0.6471
 epoch: 64, train_loss: 0.5028, test_loss: 0.9616, test_f1: 0.6402
 epoch: 65, train_loss: 0.5207, test_loss: 0.9490, test_f1: 0.6281
 epoch: 66, train_loss: 0.4937, test_loss: 0.9536, test_f1: 0.6304
 epoch: 67, train_loss: 0.5116, test_loss: 0.9520, test_f1: 0.6287
 epoch: 68, train_loss: 0.4970, test_loss: 0.9402, test_f1: 0.6402
 epoch: 69, train_loss: 0.4939, test_loss: 0.9514, test_f1: 0.6407
 epoch: 70, train_loss: 0.4832, test_loss: 0.9904, test_f1: 0.6336
 epoch: 71, train_loss: 0.4905, test_loss: 0.9260, test_f1: 0.6426
 epoch: 72, train_loss: 0.4869, test_loss: 0.9506, test_f1: 0.6395
 epoch: 73, train_loss: 0.4781, test_loss: 0.9481, test_f1: 0.6281
 epoch: 74, train_loss: 0.4741, test_loss: 1.0010, test_f1: 0.6388
 epoch: 75, train_loss: 0.4953, test_loss: 0.9622, test_f1: 0.6337
 epoch: 76, train_loss: 0.4686, test_loss: 1.0194, test_f1: 0.6495
 epoch: 77, train_loss: 0.4779, test_loss: 0.9496, test_f1: 0.6383
 epoch: 78, train_loss: 0.4656, test_loss: 0.9233, test_f1: 0.6430
 epoch: 79, train_loss: 0.4697, test_loss: 0.9973, test_f1: 0.6460
 epoch: 80, train_loss: 0.4686, test_loss: 0.9273, test_f1: 0.6465
 epoch: 81, train_loss: 0.4665, test_loss: 0.9833, test_f1: 0.6342
 epoch: 82, train_loss: 0.4563, test_loss: 0.9682, test_f1: 0.6462
 epoch: 83, train_loss: 0.4583, test_loss: 1.0269, test_f1: 0.6358
 epoch: 84, train_loss: 0.4648, test_loss: 0.9968, test_f1: 0.6488
 epoch: 85, train_loss: 0.4615, test_loss: 1.0168, test_f1: 0.6414
 epoch: 86, train_loss: 0.4565, test_loss: 1.0137, test_f1: 0.6532
 epoch: 87, train_loss: 0.4529, test_loss: 0.9568, test_f1: 0.6449
 epoch: 88, train_loss: 0.4555, test_loss: 0.9839, test_f1: 0.6396
 epoch: 89, train_loss: 0.4466, test_loss: 1.0319, test_f1: 0.6309
 epoch: 90, train_loss: 0.4269, test_loss: 1.0143, test_f1: 0.6462
 epoch: 91, train_loss: 0.4389, test_loss: 1.0027, test_f1: 0.6452
 epoch: 92, train_loss: 0.4335, test_loss: 1.1115, test_f1: 0.6498
 epoch: 93, train_loss: 0.4220, test_loss: 1.0652, test_f1: 0.6565
 epoch: 94, train_loss: 0.4415, test_loss: 1.0819, test_f1: 0.6388
 epoch: 95, train_loss: 0.4320, test_loss: 1.0469, test_f1: 0.6315
 epoch: 96, train_loss: 0.4168, test_loss: 1.1075, test_f1: 0.6400
 epoch: 97, train_loss: 0.4401, test_loss: 1.1002, test_f1: 0.6341
 epoch: 98, train_loss: 0.4209, test_loss: 1.0442, test_f1: 0.6426
 epoch: 99, train_loss: 0.4127, test_loss: 1.1203, test_f1: 0.6384
##################ITERATION #8 ****************************************
 epoch: 0, train_loss: 1.2124, test_loss: 0.9900, test_f1: 0.5015
 epoch: 1, train_loss: 1.0408, test_loss: 0.9232, test_f1: 0.5314
 epoch: 2, train_loss: 0.9854, test_loss: 0.9095, test_f1: 0.5413
 epoch: 3, train_loss: 0.9672, test_loss: 0.9032, test_f1: 0.5332
 epoch: 4, train_loss: 0.9432, test_loss: 0.8860, test_f1: 0.5600
 epoch: 5, train_loss: 0.9072, test_loss: 0.8611, test_f1: 0.5351
 epoch: 6, train_loss: 0.8786, test_loss: 0.8527, test_f1: 0.5745
 epoch: 7, train_loss: 0.8853, test_loss: 0.8231, test_f1: 0.5662
 epoch: 8, train_loss: 0.8625, test_loss: 0.8408, test_f1: 0.5543
 epoch: 9, train_loss: 0.8467, test_loss: 0.8305, test_f1: 0.5745
 epoch: 10, train_loss: 0.8463, test_loss: 0.8091, test_f1: 0.5887
 epoch: 11, train_loss: 0.8153, test_loss: 0.7957, test_f1: 0.5795
 epoch: 12, train_loss: 0.8001, test_loss: 0.7740, test_f1: 0.6104
 epoch: 13, train_loss: 0.8006, test_loss: 0.7799, test_f1: 0.6014
 epoch: 14, train_loss: 0.7847, test_loss: 0.7975, test_f1: 0.5792
 epoch: 15, train_loss: 0.7650, test_loss: 0.7574, test_f1: 0.6226
 epoch: 16, train_loss: 0.7857, test_loss: 0.7579, test_f1: 0.6259
 epoch: 17, train_loss: 0.7435, test_loss: 0.7652, test_f1: 0.6215
 epoch: 18, train_loss: 0.7508, test_loss: 0.7503, test_f1: 0.6023
 epoch: 19, train_loss: 0.7275, test_loss: 0.7210, test_f1: 0.6578
 epoch: 20, train_loss: 0.7279, test_loss: 0.7410, test_f1: 0.6126
 epoch: 21, train_loss: 0.7200, test_loss: 0.7566, test_f1: 0.6028
 epoch: 22, train_loss: 0.7242, test_loss: 0.7392, test_f1: 0.6276
 epoch: 23, train_loss: 0.7131, test_loss: 0.7426, test_f1: 0.5957
 epoch: 24, train_loss: 0.6959, test_loss: 0.7320, test_f1: 0.6615
 epoch: 25, train_loss: 0.6936, test_loss: 0.7411, test_f1: 0.6201
 epoch: 26, train_loss: 0.6864, test_loss: 0.7256, test_f1: 0.6558
 epoch: 27, train_loss: 0.6801, test_loss: 0.7468, test_f1: 0.6260
 epoch: 28, train_loss: 0.6668, test_loss: 0.7122, test_f1: 0.6731
 epoch: 29, train_loss: 0.6524, test_loss: 0.7412, test_f1: 0.6347
 epoch: 30, train_loss: 0.6608, test_loss: 0.7326, test_f1: 0.6340
 epoch: 31, train_loss: 0.6506, test_loss: 0.7196, test_f1: 0.6676
 epoch: 32, train_loss: 0.6405, test_loss: 0.7410, test_f1: 0.6387
 epoch: 33, train_loss: 0.6364, test_loss: 0.7502, test_f1: 0.6109
 epoch: 34, train_loss: 0.6340, test_loss: 0.7438, test_f1: 0.6398
 epoch: 35, train_loss: 0.6298, test_loss: 0.7568, test_f1: 0.6714
 epoch: 36, train_loss: 0.6192, test_loss: 0.7319, test_f1: 0.6544
 epoch: 37, train_loss: 0.6178, test_loss: 0.7491, test_f1: 0.6594
 epoch: 38, train_loss: 0.6164, test_loss: 0.7211, test_f1: 0.6578
 epoch: 39, train_loss: 0.6054, test_loss: 0.7574, test_f1: 0.6699
 epoch: 40, train_loss: 0.5985, test_loss: 0.7177, test_f1: 0.6761
 epoch: 41, train_loss: 0.5871, test_loss: 0.7433, test_f1: 0.6550
 epoch: 42, train_loss: 0.5930, test_loss: 0.7306, test_f1: 0.6632
 epoch: 43, train_loss: 0.5811, test_loss: 0.8041, test_f1: 0.6335
 epoch: 44, train_loss: 0.5666, test_loss: 0.7576, test_f1: 0.6501
 epoch: 45, train_loss: 0.5730, test_loss: 0.7873, test_f1: 0.6434
 epoch: 46, train_loss: 0.5764, test_loss: 0.8128, test_f1: 0.6466
 epoch: 47, train_loss: 0.5698, test_loss: 0.7598, test_f1: 0.6705
 epoch: 48, train_loss: 0.5468, test_loss: 0.7704, test_f1: 0.6525
 epoch: 49, train_loss: 0.5593, test_loss: 0.7896, test_f1: 0.6479
 epoch: 50, train_loss: 0.5537, test_loss: 0.8546, test_f1: 0.6318
 epoch: 51, train_loss: 0.5283, test_loss: 0.8197, test_f1: 0.6391
 epoch: 52, train_loss: 0.5177, test_loss: 0.8171, test_f1: 0.6502
 epoch: 53, train_loss: 0.5131, test_loss: 0.8000, test_f1: 0.6478
 epoch: 54, train_loss: 0.5095, test_loss: 0.8033, test_f1: 0.6611
 epoch: 55, train_loss: 0.5179, test_loss: 0.8414, test_f1: 0.6377
 epoch: 56, train_loss: 0.5089, test_loss: 0.7997, test_f1: 0.6725
 epoch: 57, train_loss: 0.5061, test_loss: 0.8227, test_f1: 0.6507
 epoch: 58, train_loss: 0.5067, test_loss: 0.8219, test_f1: 0.6555
 epoch: 59, train_loss: 0.4974, test_loss: 0.7970, test_f1: 0.6591
 epoch: 60, train_loss: 0.4798, test_loss: 0.8139, test_f1: 0.6406
 epoch: 61, train_loss: 0.4909, test_loss: 0.8413, test_f1: 0.6553
 epoch: 62, train_loss: 0.4978, test_loss: 0.8479, test_f1: 0.6631
 epoch: 63, train_loss: 0.4701, test_loss: 0.8514, test_f1: 0.6384
 epoch: 64, train_loss: 0.4825, test_loss: 0.9150, test_f1: 0.6384
 epoch: 65, train_loss: 0.4893, test_loss: 0.9034, test_f1: 0.6560
 epoch: 66, train_loss: 0.4762, test_loss: 0.9613, test_f1: 0.6614
 epoch: 67, train_loss: 0.4652, test_loss: 0.8878, test_f1: 0.6499
 epoch: 68, train_loss: 0.4448, test_loss: 0.8760, test_f1: 0.6710
 epoch: 69, train_loss: 0.4698, test_loss: 0.9475, test_f1: 0.6530
 epoch: 70, train_loss: 0.4721, test_loss: 0.8882, test_f1: 0.6373
 epoch: 71, train_loss: 0.4656, test_loss: 0.9391, test_f1: 0.6545
 epoch: 72, train_loss: 0.4568, test_loss: 0.9017, test_f1: 0.6410
 epoch: 73, train_loss: 0.4444, test_loss: 0.8993, test_f1: 0.6434
 epoch: 74, train_loss: 0.4626, test_loss: 0.9023, test_f1: 0.6536
 epoch: 75, train_loss: 0.4505, test_loss: 0.9148, test_f1: 0.6612
 epoch: 76, train_loss: 0.4502, test_loss: 0.9354, test_f1: 0.6638
 epoch: 77, train_loss: 0.4458, test_loss: 0.9382, test_f1: 0.6521
 epoch: 78, train_loss: 0.4455, test_loss: 0.9367, test_f1: 0.6665
 epoch: 79, train_loss: 0.4358, test_loss: 0.9712, test_f1: 0.6527
 epoch: 80, train_loss: 0.4414, test_loss: 0.9686, test_f1: 0.6563
 epoch: 81, train_loss: 0.4304, test_loss: 0.8995, test_f1: 0.6597
 epoch: 82, train_loss: 0.4309, test_loss: 1.0207, test_f1: 0.6523
 epoch: 83, train_loss: 0.4269, test_loss: 0.9774, test_f1: 0.6554
 epoch: 84, train_loss: 0.4331, test_loss: 0.9573, test_f1: 0.6554
 epoch: 85, train_loss: 0.4208, test_loss: 0.9849, test_f1: 0.6603
 epoch: 86, train_loss: 0.4118, test_loss: 1.0067, test_f1: 0.6634
 epoch: 87, train_loss: 0.4236, test_loss: 1.0421, test_f1: 0.6466
 epoch: 88, train_loss: 0.4122, test_loss: 1.0342, test_f1: 0.6491
 epoch: 89, train_loss: 0.4141, test_loss: 1.0277, test_f1: 0.6514
 epoch: 90, train_loss: 0.4096, test_loss: 1.0340, test_f1: 0.6515
 epoch: 91, train_loss: 0.4204, test_loss: 1.0502, test_f1: 0.6484
 epoch: 92, train_loss: 0.4021, test_loss: 0.9816, test_f1: 0.6561
 epoch: 93, train_loss: 0.4000, test_loss: 1.0307, test_f1: 0.6506
 epoch: 94, train_loss: 0.4062, test_loss: 1.0456, test_f1: 0.6543
 epoch: 95, train_loss: 0.4090, test_loss: 1.0140, test_f1: 0.6390
 epoch: 96, train_loss: 0.3953, test_loss: 1.0842, test_f1: 0.6561
 epoch: 97, train_loss: 0.3977, test_loss: 1.1544, test_f1: 0.6509
 epoch: 98, train_loss: 0.4049, test_loss: 1.1666, test_f1: 0.6557
 epoch: 99, train_loss: 0.3945, test_loss: 1.1189, test_f1: 0.6605
##################ITERATION #9 ****************************************
 epoch: 0, train_loss: 1.2045, test_loss: 1.0311, test_f1: 0.4983
 epoch: 1, train_loss: 1.0352, test_loss: 1.0120, test_f1: 0.5138
 epoch: 2, train_loss: 0.9899, test_loss: 0.9465, test_f1: 0.5053
 epoch: 3, train_loss: 0.9580, test_loss: 0.9245, test_f1: 0.5383
 epoch: 4, train_loss: 0.9531, test_loss: 0.9104, test_f1: 0.5656
 epoch: 5, train_loss: 0.9234, test_loss: 0.9043, test_f1: 0.5493
 epoch: 6, train_loss: 0.9061, test_loss: 0.9141, test_f1: 0.5339
 epoch: 7, train_loss: 0.8976, test_loss: 0.8880, test_f1: 0.5583
 epoch: 8, train_loss: 0.8658, test_loss: 0.8753, test_f1: 0.5414
 epoch: 9, train_loss: 0.8764, test_loss: 0.8692, test_f1: 0.5458
 epoch: 10, train_loss: 0.8453, test_loss: 0.8235, test_f1: 0.6018
 epoch: 11, train_loss: 0.8411, test_loss: 0.8880, test_f1: 0.5752
 epoch: 12, train_loss: 0.8234, test_loss: 0.8593, test_f1: 0.6179
 epoch: 13, train_loss: 0.8145, test_loss: 0.8433, test_f1: 0.5853
 epoch: 14, train_loss: 0.8053, test_loss: 0.8369, test_f1: 0.5955
 epoch: 15, train_loss: 0.7941, test_loss: 0.8334, test_f1: 0.5710
 epoch: 16, train_loss: 0.7816, test_loss: 0.8408, test_f1: 0.5812
 epoch: 17, train_loss: 0.7718, test_loss: 0.7680, test_f1: 0.6316
 epoch: 18, train_loss: 0.7678, test_loss: 0.7941, test_f1: 0.6244
 epoch: 19, train_loss: 0.7559, test_loss: 0.8171, test_f1: 0.5767
 epoch: 20, train_loss: 0.7478, test_loss: 0.8020, test_f1: 0.6107
 epoch: 21, train_loss: 0.7386, test_loss: 0.7623, test_f1: 0.6122
 epoch: 22, train_loss: 0.7412, test_loss: 0.7523, test_f1: 0.6311
 epoch: 23, train_loss: 0.7354, test_loss: 0.7523, test_f1: 0.6236
 epoch: 24, train_loss: 0.7167, test_loss: 0.7639, test_f1: 0.6325
 epoch: 25, train_loss: 0.7181, test_loss: 0.7443, test_f1: 0.6457
 epoch: 26, train_loss: 0.7038, test_loss: 0.8036, test_f1: 0.6433
 epoch: 27, train_loss: 0.7034, test_loss: 0.7653, test_f1: 0.6331
 epoch: 28, train_loss: 0.6969, test_loss: 0.7302, test_f1: 0.6465
 epoch: 29, train_loss: 0.6875, test_loss: 0.7465, test_f1: 0.6697
 epoch: 30, train_loss: 0.6868, test_loss: 0.7911, test_f1: 0.6482
 epoch: 31, train_loss: 0.6831, test_loss: 0.8133, test_f1: 0.6661
 epoch: 32, train_loss: 0.6768, test_loss: 0.7447, test_f1: 0.6239
 epoch: 33, train_loss: 0.6759, test_loss: 0.7510, test_f1: 0.6501
 epoch: 34, train_loss: 0.6505, test_loss: 0.7515, test_f1: 0.6555
 epoch: 35, train_loss: 0.6376, test_loss: 0.7503, test_f1: 0.6513
 epoch: 36, train_loss: 0.6489, test_loss: 0.7544, test_f1: 0.6431
 epoch: 37, train_loss: 0.6378, test_loss: 0.7480, test_f1: 0.6363
 epoch: 38, train_loss: 0.6393, test_loss: 0.7274, test_f1: 0.6519
 epoch: 39, train_loss: 0.6412, test_loss: 0.8031, test_f1: 0.6212
 epoch: 40, train_loss: 0.6188, test_loss: 0.7156, test_f1: 0.6578
 epoch: 41, train_loss: 0.6180, test_loss: 0.7361, test_f1: 0.6625
 epoch: 42, train_loss: 0.6085, test_loss: 0.7765, test_f1: 0.6339
 epoch: 43, train_loss: 0.6113, test_loss: 0.7417, test_f1: 0.6496
 epoch: 44, train_loss: 0.6185, test_loss: 0.7680, test_f1: 0.6636
 epoch: 45, train_loss: 0.6093, test_loss: 0.7243, test_f1: 0.6639
 epoch: 46, train_loss: 0.5847, test_loss: 0.8645, test_f1: 0.6455
 epoch: 47, train_loss: 0.5837, test_loss: 0.7739, test_f1: 0.6552
 epoch: 48, train_loss: 0.5859, test_loss: 0.7769, test_f1: 0.6590
 epoch: 49, train_loss: 0.5753, test_loss: 0.7871, test_f1: 0.6352
 epoch: 50, train_loss: 0.5579, test_loss: 0.7740, test_f1: 0.6618
 epoch: 51, train_loss: 0.5456, test_loss: 0.8172, test_f1: 0.6443
 epoch: 52, train_loss: 0.5559, test_loss: 0.8083, test_f1: 0.6661
 epoch: 53, train_loss: 0.5518, test_loss: 0.7684, test_f1: 0.6655
 epoch: 54, train_loss: 0.5386, test_loss: 0.7450, test_f1: 0.6516
 epoch: 55, train_loss: 0.5356, test_loss: 0.8055, test_f1: 0.6620
 epoch: 56, train_loss: 0.5364, test_loss: 0.7695, test_f1: 0.6694
 epoch: 57, train_loss: 0.5420, test_loss: 0.7955, test_f1: 0.6431
 epoch: 58, train_loss: 0.5250, test_loss: 0.7842, test_f1: 0.6530
 epoch: 59, train_loss: 0.5201, test_loss: 0.8694, test_f1: 0.6526
 epoch: 60, train_loss: 0.5282, test_loss: 0.8217, test_f1: 0.6498
 epoch: 61, train_loss: 0.5168, test_loss: 0.8368, test_f1: 0.6448
 epoch: 62, train_loss: 0.5186, test_loss: 0.8301, test_f1: 0.6379
 epoch: 63, train_loss: 0.4994, test_loss: 0.8653, test_f1: 0.6399
 epoch: 64, train_loss: 0.5177, test_loss: 0.8284, test_f1: 0.6399
 epoch: 65, train_loss: 0.5062, test_loss: 0.8344, test_f1: 0.6545
 epoch: 66, train_loss: 0.4983, test_loss: 0.7924, test_f1: 0.6662
 epoch: 67, train_loss: 0.5054, test_loss: 0.7758, test_f1: 0.6640
 epoch: 68, train_loss: 0.4965, test_loss: 0.8343, test_f1: 0.6694
 epoch: 69, train_loss: 0.5049, test_loss: 0.7944, test_f1: 0.6589
 epoch: 70, train_loss: 0.4834, test_loss: 0.8569, test_f1: 0.6635
 epoch: 71, train_loss: 0.4790, test_loss: 0.8566, test_f1: 0.6696
 epoch: 72, train_loss: 0.4952, test_loss: 0.9071, test_f1: 0.6551
 epoch: 73, train_loss: 0.4905, test_loss: 0.8473, test_f1: 0.6568
 epoch: 74, train_loss: 0.4859, test_loss: 0.8774, test_f1: 0.6695
 epoch: 75, train_loss: 0.4817, test_loss: 0.9184, test_f1: 0.6654
 epoch: 76, train_loss: 0.4713, test_loss: 0.9041, test_f1: 0.6520
 epoch: 77, train_loss: 0.4699, test_loss: 0.8972, test_f1: 0.6576
 epoch: 78, train_loss: 0.4664, test_loss: 0.8926, test_f1: 0.6505
 epoch: 79, train_loss: 0.4686, test_loss: 0.8768, test_f1: 0.6740
 epoch: 80, train_loss: 0.4818, test_loss: 0.8993, test_f1: 0.6609
 epoch: 81, train_loss: 0.4636, test_loss: 0.8681, test_f1: 0.6624
 epoch: 82, train_loss: 0.4546, test_loss: 0.8970, test_f1: 0.6704
 epoch: 83, train_loss: 0.4582, test_loss: 0.9522, test_f1: 0.6699
 epoch: 84, train_loss: 0.4624, test_loss: 0.9544, test_f1: 0.6651
 epoch: 85, train_loss: 0.4595, test_loss: 0.9365, test_f1: 0.6658
 epoch: 86, train_loss: 0.4562, test_loss: 0.9345, test_f1: 0.6612
 epoch: 87, train_loss: 0.4541, test_loss: 0.9587, test_f1: 0.6733
 epoch: 88, train_loss: 0.4567, test_loss: 0.9180, test_f1: 0.6721
 epoch: 89, train_loss: 0.4398, test_loss: 0.9209, test_f1: 0.6742
 epoch: 90, train_loss: 0.4359, test_loss: 0.9714, test_f1: 0.6695
 epoch: 91, train_loss: 0.4390, test_loss: 0.8981, test_f1: 0.6638
 epoch: 92, train_loss: 0.4385, test_loss: 0.9508, test_f1: 0.6723
 epoch: 93, train_loss: 0.4473, test_loss: 0.9908, test_f1: 0.6746
 epoch: 94, train_loss: 0.4483, test_loss: 0.9740, test_f1: 0.6739
 epoch: 95, train_loss: 0.4256, test_loss: 0.9775, test_f1: 0.6758
 epoch: 96, train_loss: 0.4281, test_loss: 0.9831, test_f1: 0.6555
 epoch: 97, train_loss: 0.4233, test_loss: 0.9870, test_f1: 0.6708
 epoch: 98, train_loss: 0.4284, test_loss: 0.9979, test_f1: 0.6573
 epoch: 99, train_loss: 0.4229, test_loss: 1.0078, test_f1: 0.6669

Training completed in 984.31 seconds
Best F1: 0.6989 at epoch 60
Mean F1 across iterations: 0.6844  0.0105
========================FINAL RESULTS================================
FEGIN weighted F1: 0.6989  0.0105
python main.py --data ltspice_examples --representation component_pin_net --model FEGIN --layers 3 --hiddens 128 --batch_size 32 --lr 0.0001 --emb_size 128 --epochs 100 --save_appendix component_pin_net_L3_H128_BS32_LR0.0001_E128 --no_val
-----



STDERR:
  File "main.py", line 370, in <module>
    main()
  File "main.py", line 254, in main
    dataset = dataset_class(
  File "/home/philip/projects/ltspice_examples_code_repo/Circuit-Completion-Using-GNNs/component_classification_with_link_prediction_head/evaluation/FEGIN/kernel/circuit_datasets.py", line 15, in __init__
    self.data, self.slices = torch.load(self.processed_paths[0])
  File "/home/philip/.local/lib/python3.8/site-packages/torch/serialization.py", line 1040, in load
    warnings.warn(
  File "/usr/lib/python3.8/warnings.py", line 109, in _showwarnmsg
    sw(msg.message, msg.category, msg.filename, msg.lineno,
  File "main.py", line 47, in warn_with_traceback
    traceback.print_stack(file=log)
/home/philip/projects/ltspice_examples_code_repo/Circuit-Completion-Using-GNNs/component_classification_with_link_prediction_head/evaluation/FEGIN/kernel/circuit_datasets.py:15: FutureWarning: You are using `torch.load` with `weights_only=False` (the current default value), which uses the default pickle module implicitly. It is possible to construct malicious pickle data which will execute arbitrary code during unpickling (See https://github.com/pytorch/pytorch/blob/main/SECURITY.md#untrusted-models for more details). In a future release, the default value for `weights_only` will be flipped to `True`. This limits the functions that could be executed during unpickling. Arbitrary objects will no longer be allowed to be loaded via this mode unless they are explicitly allowlisted by the user via `torch.serialization.add_safe_globals`. We recommend you start setting `weights_only=True` for any use case where you don't have full control of the loaded file. Please open an issue on GitHub for any issues related to this experimental feature.
  self.data, self.slices = torch.load(self.processed_paths[0])
