STDOUT:
Results will be saved in /home/philip/projects/ltspice_examples_code_repo/Circuit-Completion-Using-GNNs/component_classification_with_link_prediction_head/evaluation/FEGIN/results/model_FEGIN_dataset_ltspice_examples
Command line input: python main.py --data ltspice_examples --representation component_component --model FEGIN --layers 5 --hiddens 32 --batch_size 32 --lr 0.0001 --emb_size 512 --epochs 100 --save_appendix component_component_L5_H32_BS32_LR0.0001_E512 --no_val
 is saved.
-----
ltspice_examples - FEGIN
Using 5 layers, 32 hidden units, h = 2
Loading component_component representation dataset
ENTERED
Training FEGIN on component_component representation
Train: 3556, Test: 845
##################ITERATION #0 ****************************************
 epoch: 0, train_loss: 1.3513, test_loss: 1.3467, test_f1: 0.2274
 epoch: 1, train_loss: 1.3346, test_loss: 1.3338, test_f1: 0.2274
 epoch: 2, train_loss: 1.3213, test_loss: 1.3228, test_f1: 0.2274
 epoch: 3, train_loss: 1.3095, test_loss: 1.3067, test_f1: 0.2274
 epoch: 4, train_loss: 1.2971, test_loss: 1.3008, test_f1: 0.2274
 epoch: 5, train_loss: 1.2871, test_loss: 1.2831, test_f1: 0.2274
 epoch: 6, train_loss: 1.2820, test_loss: 1.2765, test_f1: 0.2274
 epoch: 7, train_loss: 1.2694, test_loss: 1.2662, test_f1: 0.2274
 epoch: 8, train_loss: 1.2660, test_loss: 1.2529, test_f1: 0.2274
 epoch: 9, train_loss: 1.2572, test_loss: 1.2480, test_f1: 0.2274
 epoch: 10, train_loss: 1.2491, test_loss: 1.2415, test_f1: 0.2274
 epoch: 11, train_loss: 1.2455, test_loss: 1.2291, test_f1: 0.2274
 epoch: 12, train_loss: 1.2366, test_loss: 1.2263, test_f1: 0.2274
 epoch: 13, train_loss: 1.2311, test_loss: 1.2193, test_f1: 0.2271
 epoch: 14, train_loss: 1.2236, test_loss: 1.2085, test_f1: 0.2858
 epoch: 15, train_loss: 1.2248, test_loss: 1.2021, test_f1: 0.3131
 epoch: 16, train_loss: 1.2183, test_loss: 1.2008, test_f1: 0.3114
 epoch: 17, train_loss: 1.2118, test_loss: 1.1906, test_f1: 0.3197
 epoch: 18, train_loss: 1.2129, test_loss: 1.1878, test_f1: 0.3232
 epoch: 19, train_loss: 1.2054, test_loss: 1.1822, test_f1: 0.3266
 epoch: 20, train_loss: 1.2107, test_loss: 1.1863, test_f1: 0.3287
 epoch: 21, train_loss: 1.1972, test_loss: 1.1778, test_f1: 0.3372
 epoch: 22, train_loss: 1.1960, test_loss: 1.1697, test_f1: 0.3371
 epoch: 23, train_loss: 1.1923, test_loss: 1.1642, test_f1: 0.3418
 epoch: 24, train_loss: 1.1852, test_loss: 1.1672, test_f1: 0.3415
 epoch: 25, train_loss: 1.1848, test_loss: 1.1629, test_f1: 0.3499
 epoch: 26, train_loss: 1.1765, test_loss: 1.1554, test_f1: 0.3663
 epoch: 27, train_loss: 1.1723, test_loss: 1.1496, test_f1: 0.3612
 epoch: 28, train_loss: 1.1681, test_loss: 1.1454, test_f1: 0.3681
 epoch: 29, train_loss: 1.1582, test_loss: 1.1451, test_f1: 0.3597
 epoch: 30, train_loss: 1.1526, test_loss: 1.1492, test_f1: 0.3549
 epoch: 31, train_loss: 1.1505, test_loss: 1.1244, test_f1: 0.3670
 epoch: 32, train_loss: 1.1421, test_loss: 1.1234, test_f1: 0.4112
 epoch: 33, train_loss: 1.1441, test_loss: 1.1099, test_f1: 0.4425
 epoch: 34, train_loss: 1.1365, test_loss: 1.1119, test_f1: 0.4389
 epoch: 35, train_loss: 1.1382, test_loss: 1.1098, test_f1: 0.4363
 epoch: 36, train_loss: 1.1205, test_loss: 1.0919, test_f1: 0.4500
 epoch: 37, train_loss: 1.1129, test_loss: 1.1005, test_f1: 0.4466
 epoch: 38, train_loss: 1.1105, test_loss: 1.1069, test_f1: 0.4624
 epoch: 39, train_loss: 1.1074, test_loss: 1.1068, test_f1: 0.4538
 epoch: 40, train_loss: 1.1072, test_loss: 1.0876, test_f1: 0.4417
 epoch: 41, train_loss: 1.1061, test_loss: 1.0934, test_f1: 0.4671
 epoch: 42, train_loss: 1.1065, test_loss: 1.1001, test_f1: 0.4434
 epoch: 43, train_loss: 1.0948, test_loss: 1.0763, test_f1: 0.4408
 epoch: 44, train_loss: 1.0919, test_loss: 1.0928, test_f1: 0.4559
 epoch: 45, train_loss: 1.0854, test_loss: 1.0822, test_f1: 0.4501
 epoch: 46, train_loss: 1.0872, test_loss: 1.0818, test_f1: 0.4595
 epoch: 47, train_loss: 1.0963, test_loss: 1.0724, test_f1: 0.4791
 epoch: 48, train_loss: 1.0793, test_loss: 1.0710, test_f1: 0.4766
 epoch: 49, train_loss: 1.0758, test_loss: 1.0801, test_f1: 0.4575
 epoch: 50, train_loss: 1.0760, test_loss: 1.0707, test_f1: 0.4755
 epoch: 51, train_loss: 1.0780, test_loss: 1.0676, test_f1: 0.4772
 epoch: 52, train_loss: 1.0735, test_loss: 1.0656, test_f1: 0.4711
 epoch: 53, train_loss: 1.0723, test_loss: 1.0753, test_f1: 0.4581
 epoch: 54, train_loss: 1.0623, test_loss: 1.0599, test_f1: 0.4787
 epoch: 55, train_loss: 1.0628, test_loss: 1.0846, test_f1: 0.4562
 epoch: 56, train_loss: 1.0737, test_loss: 1.0748, test_f1: 0.4576
 epoch: 57, train_loss: 1.0724, test_loss: 1.0600, test_f1: 0.4810
 epoch: 58, train_loss: 1.0572, test_loss: 1.0697, test_f1: 0.4620
 epoch: 59, train_loss: 1.0579, test_loss: 1.0728, test_f1: 0.4622
 epoch: 60, train_loss: 1.0702, test_loss: 1.0628, test_f1: 0.4786
 epoch: 61, train_loss: 1.0664, test_loss: 1.0701, test_f1: 0.4594
 epoch: 62, train_loss: 1.0571, test_loss: 1.0761, test_f1: 0.4595
 epoch: 63, train_loss: 1.0590, test_loss: 1.0610, test_f1: 0.4534
 epoch: 64, train_loss: 1.0538, test_loss: 1.1076, test_f1: 0.4487
 epoch: 65, train_loss: 1.0567, test_loss: 1.1104, test_f1: 0.4508
 epoch: 66, train_loss: 1.0453, test_loss: 1.0813, test_f1: 0.4543
 epoch: 67, train_loss: 1.0541, test_loss: 1.0660, test_f1: 0.4535
 epoch: 68, train_loss: 1.0434, test_loss: 1.0570, test_f1: 0.4596
 epoch: 69, train_loss: 1.0526, test_loss: 1.0600, test_f1: 0.4702
 epoch: 70, train_loss: 1.0405, test_loss: 1.0877, test_f1: 0.4383
 epoch: 71, train_loss: 1.0426, test_loss: 1.0672, test_f1: 0.4698
 epoch: 72, train_loss: 1.0379, test_loss: 1.0785, test_f1: 0.4648
 epoch: 73, train_loss: 1.0423, test_loss: 1.0590, test_f1: 0.4749
 epoch: 74, train_loss: 1.0439, test_loss: 1.0512, test_f1: 0.4772
 epoch: 75, train_loss: 1.0449, test_loss: 1.0624, test_f1: 0.4763
 epoch: 76, train_loss: 1.0415, test_loss: 1.0428, test_f1: 0.4791
 epoch: 77, train_loss: 1.0355, test_loss: 1.0616, test_f1: 0.4575
 epoch: 78, train_loss: 1.0330, test_loss: 1.0532, test_f1: 0.4821
 epoch: 79, train_loss: 1.0305, test_loss: 1.0731, test_f1: 0.4530
 epoch: 80, train_loss: 1.0325, test_loss: 1.0899, test_f1: 0.4618
 epoch: 81, train_loss: 1.0245, test_loss: 1.0466, test_f1: 0.4683
 epoch: 82, train_loss: 1.0321, test_loss: 1.0470, test_f1: 0.4595
 epoch: 83, train_loss: 1.0232, test_loss: 1.0543, test_f1: 0.4640
 epoch: 84, train_loss: 1.0381, test_loss: 1.0540, test_f1: 0.4706
 epoch: 85, train_loss: 1.0219, test_loss: 1.0389, test_f1: 0.4728
 epoch: 86, train_loss: 1.0261, test_loss: 1.0643, test_f1: 0.4585
 epoch: 87, train_loss: 1.0271, test_loss: 1.0411, test_f1: 0.4642
 epoch: 88, train_loss: 1.0278, test_loss: 1.0591, test_f1: 0.4656
 epoch: 89, train_loss: 1.0163, test_loss: 1.0671, test_f1: 0.4484
 epoch: 90, train_loss: 1.0119, test_loss: 1.0569, test_f1: 0.4735
 epoch: 91, train_loss: 1.0226, test_loss: 1.0393, test_f1: 0.4712
 epoch: 92, train_loss: 1.0277, test_loss: 1.0937, test_f1: 0.4581
 epoch: 93, train_loss: 1.0202, test_loss: 1.0310, test_f1: 0.4769
 epoch: 94, train_loss: 1.0088, test_loss: 1.0636, test_f1: 0.4576
 epoch: 95, train_loss: 1.0199, test_loss: 1.0530, test_f1: 0.4565
 epoch: 96, train_loss: 1.0124, test_loss: 1.0281, test_f1: 0.4752
 epoch: 97, train_loss: 1.0193, test_loss: 1.0352, test_f1: 0.4741
 epoch: 98, train_loss: 1.0139, test_loss: 1.1111, test_f1: 0.4492
 epoch: 99, train_loss: 1.0119, test_loss: 1.0547, test_f1: 0.4616
##################ITERATION #1 ****************************************
 epoch: 0, train_loss: 1.3247, test_loss: 1.3239, test_f1: 0.2274
 epoch: 1, train_loss: 1.2908, test_loss: 1.2863, test_f1: 0.2274
 epoch: 2, train_loss: 1.2727, test_loss: 1.2745, test_f1: 0.2274
 epoch: 3, train_loss: 1.2654, test_loss: 1.2602, test_f1: 0.2274
 epoch: 4, train_loss: 1.2527, test_loss: 1.2502, test_f1: 0.2274
 epoch: 5, train_loss: 1.2483, test_loss: 1.2398, test_f1: 0.2274
 epoch: 6, train_loss: 1.2413, test_loss: 1.2373, test_f1: 0.2274
 epoch: 7, train_loss: 1.2352, test_loss: 1.2265, test_f1: 0.2511
 epoch: 8, train_loss: 1.2297, test_loss: 1.2175, test_f1: 0.2822
 epoch: 9, train_loss: 1.2200, test_loss: 1.2065, test_f1: 0.3060
 epoch: 10, train_loss: 1.2165, test_loss: 1.1977, test_f1: 0.3462
 epoch: 11, train_loss: 1.2102, test_loss: 1.1969, test_f1: 0.3776
 epoch: 12, train_loss: 1.2070, test_loss: 1.1816, test_f1: 0.3899
 epoch: 13, train_loss: 1.2030, test_loss: 1.1798, test_f1: 0.3917
 epoch: 14, train_loss: 1.1944, test_loss: 1.1755, test_f1: 0.3915
 epoch: 15, train_loss: 1.1881, test_loss: 1.1631, test_f1: 0.4098
 epoch: 16, train_loss: 1.1830, test_loss: 1.1508, test_f1: 0.4214
 epoch: 17, train_loss: 1.1760, test_loss: 1.1527, test_f1: 0.4215
 epoch: 18, train_loss: 1.1733, test_loss: 1.1382, test_f1: 0.4338
 epoch: 19, train_loss: 1.1601, test_loss: 1.1349, test_f1: 0.4411
 epoch: 20, train_loss: 1.1540, test_loss: 1.1284, test_f1: 0.4505
 epoch: 21, train_loss: 1.1502, test_loss: 1.1219, test_f1: 0.4472
 epoch: 22, train_loss: 1.1516, test_loss: 1.1092, test_f1: 0.4475
 epoch: 23, train_loss: 1.1405, test_loss: 1.1132, test_f1: 0.4572
 epoch: 24, train_loss: 1.1451, test_loss: 1.1081, test_f1: 0.4501
 epoch: 25, train_loss: 1.1398, test_loss: 1.1169, test_f1: 0.4326
 epoch: 26, train_loss: 1.1308, test_loss: 1.1076, test_f1: 0.4408
 epoch: 27, train_loss: 1.1249, test_loss: 1.1011, test_f1: 0.4457
 epoch: 28, train_loss: 1.1297, test_loss: 1.1029, test_f1: 0.4641
 epoch: 29, train_loss: 1.1234, test_loss: 1.0852, test_f1: 0.4469
 epoch: 30, train_loss: 1.1241, test_loss: 1.1073, test_f1: 0.4437
 epoch: 31, train_loss: 1.1202, test_loss: 1.0923, test_f1: 0.4375
 epoch: 32, train_loss: 1.1041, test_loss: 1.0745, test_f1: 0.4496
 epoch: 33, train_loss: 1.1030, test_loss: 1.0775, test_f1: 0.4529
 epoch: 34, train_loss: 1.1110, test_loss: 1.0712, test_f1: 0.4416
 epoch: 35, train_loss: 1.1161, test_loss: 1.0846, test_f1: 0.4618
 epoch: 36, train_loss: 1.1118, test_loss: 1.0744, test_f1: 0.4539
 epoch: 37, train_loss: 1.1044, test_loss: 1.0709, test_f1: 0.4491
 epoch: 38, train_loss: 1.1025, test_loss: 1.0685, test_f1: 0.4446
 epoch: 39, train_loss: 1.0952, test_loss: 1.0638, test_f1: 0.4683
 epoch: 40, train_loss: 1.0910, test_loss: 1.0762, test_f1: 0.4496
 epoch: 41, train_loss: 1.0941, test_loss: 1.0559, test_f1: 0.4660
 epoch: 42, train_loss: 1.0889, test_loss: 1.0581, test_f1: 0.4667
 epoch: 43, train_loss: 1.0840, test_loss: 1.0500, test_f1: 0.4596
 epoch: 44, train_loss: 1.0914, test_loss: 1.0695, test_f1: 0.4472
 epoch: 45, train_loss: 1.0831, test_loss: 1.0686, test_f1: 0.4689
 epoch: 46, train_loss: 1.0793, test_loss: 1.0539, test_f1: 0.4722
 epoch: 47, train_loss: 1.0858, test_loss: 1.0380, test_f1: 0.4833
 epoch: 48, train_loss: 1.0716, test_loss: 1.0536, test_f1: 0.4693
 epoch: 49, train_loss: 1.0755, test_loss: 1.0372, test_f1: 0.4739
 epoch: 50, train_loss: 1.0697, test_loss: 1.0194, test_f1: 0.4769
 epoch: 51, train_loss: 1.0701, test_loss: 1.0438, test_f1: 0.4708
 epoch: 52, train_loss: 1.0639, test_loss: 1.0390, test_f1: 0.4705
 epoch: 53, train_loss: 1.0701, test_loss: 1.0345, test_f1: 0.4790
 epoch: 54, train_loss: 1.0622, test_loss: 1.0407, test_f1: 0.4854
 epoch: 55, train_loss: 1.0643, test_loss: 1.0469, test_f1: 0.4644
 epoch: 56, train_loss: 1.0669, test_loss: 1.0454, test_f1: 0.4681
 epoch: 57, train_loss: 1.0579, test_loss: 1.0451, test_f1: 0.4748
 epoch: 58, train_loss: 1.0556, test_loss: 1.0332, test_f1: 0.4768
 epoch: 59, train_loss: 1.0590, test_loss: 1.0416, test_f1: 0.4775
 epoch: 60, train_loss: 1.0662, test_loss: 1.0358, test_f1: 0.4729
 epoch: 61, train_loss: 1.0607, test_loss: 1.0344, test_f1: 0.4676
 epoch: 62, train_loss: 1.0536, test_loss: 1.0277, test_f1: 0.4910
 epoch: 63, train_loss: 1.0528, test_loss: 1.0472, test_f1: 0.4729
 epoch: 64, train_loss: 1.0460, test_loss: 1.0470, test_f1: 0.4475
 epoch: 65, train_loss: 1.0587, test_loss: 1.0281, test_f1: 0.4620
 epoch: 66, train_loss: 1.0514, test_loss: 1.0377, test_f1: 0.4809
 epoch: 67, train_loss: 1.0552, test_loss: 1.0299, test_f1: 0.4680
 epoch: 68, train_loss: 1.0532, test_loss: 1.0273, test_f1: 0.4864
 epoch: 69, train_loss: 1.0522, test_loss: 1.0522, test_f1: 0.4577
 epoch: 70, train_loss: 1.0407, test_loss: 1.0407, test_f1: 0.4741
 epoch: 71, train_loss: 1.0472, test_loss: 1.0491, test_f1: 0.4583
 epoch: 72, train_loss: 1.0428, test_loss: 1.0406, test_f1: 0.4590
 epoch: 73, train_loss: 1.0526, test_loss: 1.0254, test_f1: 0.4694
 epoch: 74, train_loss: 1.0266, test_loss: 1.0309, test_f1: 0.4646
 epoch: 75, train_loss: 1.0477, test_loss: 1.0329, test_f1: 0.4436
 epoch: 76, train_loss: 1.0444, test_loss: 1.0230, test_f1: 0.4639
 epoch: 77, train_loss: 1.0350, test_loss: 1.0258, test_f1: 0.4706
 epoch: 78, train_loss: 1.0366, test_loss: 1.0225, test_f1: 0.4869
 epoch: 79, train_loss: 1.0423, test_loss: 1.0076, test_f1: 0.4811
 epoch: 80, train_loss: 1.0435, test_loss: 1.0313, test_f1: 0.4781
 epoch: 81, train_loss: 1.0383, test_loss: 1.0188, test_f1: 0.4777
 epoch: 82, train_loss: 1.0407, test_loss: 1.0271, test_f1: 0.4773
 epoch: 83, train_loss: 1.0385, test_loss: 1.0569, test_f1: 0.4655
 epoch: 84, train_loss: 1.0305, test_loss: 1.0293, test_f1: 0.4807
 epoch: 85, train_loss: 1.0367, test_loss: 1.0231, test_f1: 0.4594
 epoch: 86, train_loss: 1.0371, test_loss: 1.0243, test_f1: 0.4676
 epoch: 87, train_loss: 1.0315, test_loss: 1.0315, test_f1: 0.4625
 epoch: 88, train_loss: 1.0383, test_loss: 1.0202, test_f1: 0.4690
 epoch: 89, train_loss: 1.0314, test_loss: 1.0331, test_f1: 0.4616
 epoch: 90, train_loss: 1.0288, test_loss: 1.0175, test_f1: 0.4633
 epoch: 91, train_loss: 1.0363, test_loss: 1.0344, test_f1: 0.4648
 epoch: 92, train_loss: 1.0304, test_loss: 1.0323, test_f1: 0.4598
 epoch: 93, train_loss: 1.0260, test_loss: 1.0207, test_f1: 0.4751
 epoch: 94, train_loss: 1.0340, test_loss: 1.0177, test_f1: 0.4753
 epoch: 95, train_loss: 1.0252, test_loss: 1.0353, test_f1: 0.4602
 epoch: 96, train_loss: 1.0365, test_loss: 1.0202, test_f1: 0.4731
 epoch: 97, train_loss: 1.0195, test_loss: 1.0184, test_f1: 0.4711
 epoch: 98, train_loss: 1.0277, test_loss: 1.0053, test_f1: 0.4907
 epoch: 99, train_loss: 1.0299, test_loss: 1.0203, test_f1: 0.4689
##################ITERATION #2 ****************************************
 epoch: 0, train_loss: 1.3144, test_loss: 1.2822, test_f1: 0.2274
 epoch: 1, train_loss: 1.2840, test_loss: 1.2701, test_f1: 0.2274
 epoch: 2, train_loss: 1.2745, test_loss: 1.2561, test_f1: 0.2274
 epoch: 3, train_loss: 1.2594, test_loss: 1.2483, test_f1: 0.2504
 epoch: 4, train_loss: 1.2557, test_loss: 1.2418, test_f1: 0.2649
 epoch: 5, train_loss: 1.2430, test_loss: 1.2347, test_f1: 0.2816
 epoch: 6, train_loss: 1.2376, test_loss: 1.2238, test_f1: 0.2963
 epoch: 7, train_loss: 1.2292, test_loss: 1.2147, test_f1: 0.3207
 epoch: 8, train_loss: 1.2222, test_loss: 1.2037, test_f1: 0.3604
 epoch: 9, train_loss: 1.2171, test_loss: 1.1920, test_f1: 0.3704
 epoch: 10, train_loss: 1.2144, test_loss: 1.1848, test_f1: 0.3770
 epoch: 11, train_loss: 1.2067, test_loss: 1.1769, test_f1: 0.3829
 epoch: 12, train_loss: 1.1978, test_loss: 1.1661, test_f1: 0.3815
 epoch: 13, train_loss: 1.1937, test_loss: 1.1597, test_f1: 0.3917
 epoch: 14, train_loss: 1.1863, test_loss: 1.1469, test_f1: 0.3915
 epoch: 15, train_loss: 1.1851, test_loss: 1.1418, test_f1: 0.3882
 epoch: 16, train_loss: 1.1784, test_loss: 1.1388, test_f1: 0.4154
 epoch: 17, train_loss: 1.1732, test_loss: 1.1260, test_f1: 0.4132
 epoch: 18, train_loss: 1.1661, test_loss: 1.1295, test_f1: 0.4249
 epoch: 19, train_loss: 1.1608, test_loss: 1.1153, test_f1: 0.4284
 epoch: 20, train_loss: 1.1520, test_loss: 1.1074, test_f1: 0.4281
 epoch: 21, train_loss: 1.1516, test_loss: 1.1093, test_f1: 0.4325
 epoch: 22, train_loss: 1.1423, test_loss: 1.1157, test_f1: 0.4178
 epoch: 23, train_loss: 1.1500, test_loss: 1.1060, test_f1: 0.4290
 epoch: 24, train_loss: 1.1413, test_loss: 1.0937, test_f1: 0.4454
 epoch: 25, train_loss: 1.1390, test_loss: 1.0912, test_f1: 0.4662
 epoch: 26, train_loss: 1.1263, test_loss: 1.0867, test_f1: 0.4579
 epoch: 27, train_loss: 1.1298, test_loss: 1.0848, test_f1: 0.4330
 epoch: 28, train_loss: 1.1207, test_loss: 1.0873, test_f1: 0.4555
 epoch: 29, train_loss: 1.1224, test_loss: 1.0832, test_f1: 0.4546
 epoch: 30, train_loss: 1.1158, test_loss: 1.0781, test_f1: 0.4345
 epoch: 31, train_loss: 1.1029, test_loss: 1.0688, test_f1: 0.4678
 epoch: 32, train_loss: 1.1005, test_loss: 1.0668, test_f1: 0.4665
 epoch: 33, train_loss: 1.1053, test_loss: 1.0607, test_f1: 0.4613
 epoch: 34, train_loss: 1.0980, test_loss: 1.0643, test_f1: 0.4630
 epoch: 35, train_loss: 1.1014, test_loss: 1.0569, test_f1: 0.4617
 epoch: 36, train_loss: 1.0998, test_loss: 1.0622, test_f1: 0.4670
 epoch: 37, train_loss: 1.0841, test_loss: 1.0538, test_f1: 0.4654
 epoch: 38, train_loss: 1.0824, test_loss: 1.0554, test_f1: 0.4666
 epoch: 39, train_loss: 1.0814, test_loss: 1.0490, test_f1: 0.4605
 epoch: 40, train_loss: 1.0841, test_loss: 1.0443, test_f1: 0.4665
 epoch: 41, train_loss: 1.0700, test_loss: 1.0531, test_f1: 0.4421
 epoch: 42, train_loss: 1.0705, test_loss: 1.0535, test_f1: 0.4614
 epoch: 43, train_loss: 1.0729, test_loss: 1.0442, test_f1: 0.4627
 epoch: 44, train_loss: 1.0704, test_loss: 1.0435, test_f1: 0.4693
 epoch: 45, train_loss: 1.0630, test_loss: 1.0325, test_f1: 0.4590
 epoch: 46, train_loss: 1.0609, test_loss: 1.0471, test_f1: 0.4508
 epoch: 47, train_loss: 1.0510, test_loss: 1.0484, test_f1: 0.4503
 epoch: 48, train_loss: 1.0563, test_loss: 1.0317, test_f1: 0.4606
 epoch: 49, train_loss: 1.0562, test_loss: 1.0252, test_f1: 0.4703
 epoch: 50, train_loss: 1.0497, test_loss: 1.0305, test_f1: 0.4519
 epoch: 51, train_loss: 1.0521, test_loss: 1.0280, test_f1: 0.4680
 epoch: 52, train_loss: 1.0478, test_loss: 1.0155, test_f1: 0.4744
 epoch: 53, train_loss: 1.0430, test_loss: 1.0255, test_f1: 0.4576
 epoch: 54, train_loss: 1.0366, test_loss: 1.0237, test_f1: 0.4667
 epoch: 55, train_loss: 1.0477, test_loss: 1.0094, test_f1: 0.4833
 epoch: 56, train_loss: 1.0408, test_loss: 1.0209, test_f1: 0.4649
 epoch: 57, train_loss: 1.0320, test_loss: 1.0099, test_f1: 0.4758
 epoch: 58, train_loss: 1.0295, test_loss: 1.0126, test_f1: 0.4797
 epoch: 59, train_loss: 1.0300, test_loss: 1.0100, test_f1: 0.4763
 epoch: 60, train_loss: 1.0312, test_loss: 1.0091, test_f1: 0.4473
 epoch: 61, train_loss: 1.0307, test_loss: 1.0087, test_f1: 0.4766
 epoch: 62, train_loss: 1.0319, test_loss: 1.0016, test_f1: 0.4922
 epoch: 63, train_loss: 1.0294, test_loss: 1.0071, test_f1: 0.4913
 epoch: 64, train_loss: 1.0254, test_loss: 1.0110, test_f1: 0.4721
 epoch: 65, train_loss: 1.0160, test_loss: 1.0125, test_f1: 0.4714
 epoch: 66, train_loss: 1.0245, test_loss: 1.0137, test_f1: 0.4676
 epoch: 67, train_loss: 1.0346, test_loss: 0.9982, test_f1: 0.4937
 epoch: 68, train_loss: 1.0211, test_loss: 1.0144, test_f1: 0.4741
 epoch: 69, train_loss: 1.0177, test_loss: 1.0049, test_f1: 0.4796
 epoch: 70, train_loss: 1.0218, test_loss: 1.0032, test_f1: 0.4748
 epoch: 71, train_loss: 1.0197, test_loss: 0.9954, test_f1: 0.4908
 epoch: 72, train_loss: 1.0134, test_loss: 0.9994, test_f1: 0.4861
 epoch: 73, train_loss: 1.0237, test_loss: 1.0021, test_f1: 0.4769
 epoch: 74, train_loss: 1.0212, test_loss: 1.0008, test_f1: 0.4959
 epoch: 75, train_loss: 1.0069, test_loss: 1.0120, test_f1: 0.4556
 epoch: 76, train_loss: 1.0117, test_loss: 0.9871, test_f1: 0.4974
 epoch: 77, train_loss: 1.0210, test_loss: 1.0251, test_f1: 0.4657
 epoch: 78, train_loss: 1.0096, test_loss: 0.9869, test_f1: 0.5010
 epoch: 79, train_loss: 1.0128, test_loss: 1.0008, test_f1: 0.4796
 epoch: 80, train_loss: 1.0078, test_loss: 1.0022, test_f1: 0.4740
 epoch: 81, train_loss: 1.0112, test_loss: 0.9993, test_f1: 0.4855
 epoch: 82, train_loss: 1.0001, test_loss: 1.0007, test_f1: 0.4737
 epoch: 83, train_loss: 1.0015, test_loss: 0.9937, test_f1: 0.5029
 epoch: 84, train_loss: 1.0051, test_loss: 0.9937, test_f1: 0.4849
 epoch: 85, train_loss: 1.0078, test_loss: 0.9877, test_f1: 0.4996
 epoch: 86, train_loss: 0.9974, test_loss: 0.9932, test_f1: 0.4908
 epoch: 87, train_loss: 1.0028, test_loss: 1.0058, test_f1: 0.4760
 epoch: 88, train_loss: 1.0017, test_loss: 0.9988, test_f1: 0.4853
 epoch: 89, train_loss: 0.9984, test_loss: 0.9861, test_f1: 0.4938
 epoch: 90, train_loss: 0.9909, test_loss: 0.9897, test_f1: 0.4854
 epoch: 91, train_loss: 0.9994, test_loss: 0.9931, test_f1: 0.4953
 epoch: 92, train_loss: 0.9893, test_loss: 1.0023, test_f1: 0.4812
 epoch: 93, train_loss: 0.9903, test_loss: 0.9907, test_f1: 0.4879
 epoch: 94, train_loss: 0.9961, test_loss: 0.9766, test_f1: 0.5056
 epoch: 95, train_loss: 0.9890, test_loss: 1.0144, test_f1: 0.4776
 epoch: 96, train_loss: 1.0026, test_loss: 0.9959, test_f1: 0.4826
 epoch: 97, train_loss: 0.9913, test_loss: 0.9829, test_f1: 0.4931
 epoch: 98, train_loss: 0.9875, test_loss: 0.9807, test_f1: 0.4946
 epoch: 99, train_loss: 0.9882, test_loss: 0.9923, test_f1: 0.4908
##################ITERATION #3 ****************************************
 epoch: 0, train_loss: 1.3115, test_loss: 1.2702, test_f1: 0.2274
 epoch: 1, train_loss: 1.2756, test_loss: 1.2529, test_f1: 0.2274
 epoch: 2, train_loss: 1.2620, test_loss: 1.2422, test_f1: 0.2409
 epoch: 3, train_loss: 1.2539, test_loss: 1.2252, test_f1: 0.2707
 epoch: 4, train_loss: 1.2445, test_loss: 1.2177, test_f1: 0.2919
 epoch: 5, train_loss: 1.2370, test_loss: 1.2056, test_f1: 0.3193
 epoch: 6, train_loss: 1.2209, test_loss: 1.1931, test_f1: 0.3701
 epoch: 7, train_loss: 1.2226, test_loss: 1.1848, test_f1: 0.3791
 epoch: 8, train_loss: 1.2232, test_loss: 1.1785, test_f1: 0.3792
 epoch: 9, train_loss: 1.2133, test_loss: 1.1703, test_f1: 0.3783
 epoch: 10, train_loss: 1.2037, test_loss: 1.1603, test_f1: 0.4002
 epoch: 11, train_loss: 1.2070, test_loss: 1.1638, test_f1: 0.3818
 epoch: 12, train_loss: 1.2023, test_loss: 1.1521, test_f1: 0.4048
 epoch: 13, train_loss: 1.1968, test_loss: 1.1534, test_f1: 0.4180
 epoch: 14, train_loss: 1.1931, test_loss: 1.1472, test_f1: 0.4203
 epoch: 15, train_loss: 1.1847, test_loss: 1.1393, test_f1: 0.4056
 epoch: 16, train_loss: 1.1832, test_loss: 1.1384, test_f1: 0.4100
 epoch: 17, train_loss: 1.1849, test_loss: 1.1374, test_f1: 0.4073
 epoch: 18, train_loss: 1.1723, test_loss: 1.1325, test_f1: 0.4159
 epoch: 19, train_loss: 1.1776, test_loss: 1.1309, test_f1: 0.4102
 epoch: 20, train_loss: 1.1737, test_loss: 1.1226, test_f1: 0.4070
 epoch: 21, train_loss: 1.1729, test_loss: 1.1142, test_f1: 0.4206
 epoch: 22, train_loss: 1.1617, test_loss: 1.1088, test_f1: 0.4177
 epoch: 23, train_loss: 1.1665, test_loss: 1.1090, test_f1: 0.4314
 epoch: 24, train_loss: 1.1615, test_loss: 1.1007, test_f1: 0.4185
 epoch: 25, train_loss: 1.1564, test_loss: 1.1088, test_f1: 0.4069
 epoch: 26, train_loss: 1.1384, test_loss: 1.1009, test_f1: 0.4175
 epoch: 27, train_loss: 1.1474, test_loss: 1.1143, test_f1: 0.4192
 epoch: 28, train_loss: 1.1448, test_loss: 1.1088, test_f1: 0.4136
 epoch: 29, train_loss: 1.1391, test_loss: 1.0952, test_f1: 0.4212
 epoch: 30, train_loss: 1.1380, test_loss: 1.0935, test_f1: 0.4353
 epoch: 31, train_loss: 1.1409, test_loss: 1.0780, test_f1: 0.4282
 epoch: 32, train_loss: 1.1314, test_loss: 1.0825, test_f1: 0.4349
 epoch: 33, train_loss: 1.1307, test_loss: 1.0801, test_f1: 0.4344
 epoch: 34, train_loss: 1.1297, test_loss: 1.0777, test_f1: 0.4528
 epoch: 35, train_loss: 1.1265, test_loss: 1.0816, test_f1: 0.4253
 epoch: 36, train_loss: 1.1186, test_loss: 1.0676, test_f1: 0.4415
 epoch: 37, train_loss: 1.1185, test_loss: 1.0810, test_f1: 0.4152
 epoch: 38, train_loss: 1.1142, test_loss: 1.0710, test_f1: 0.4414
 epoch: 39, train_loss: 1.1164, test_loss: 1.0709, test_f1: 0.4275
 epoch: 40, train_loss: 1.1177, test_loss: 1.0762, test_f1: 0.4505
 epoch: 41, train_loss: 1.1080, test_loss: 1.0739, test_f1: 0.4267
 epoch: 42, train_loss: 1.1033, test_loss: 1.0675, test_f1: 0.4484
 epoch: 43, train_loss: 1.1010, test_loss: 1.0651, test_f1: 0.4262
 epoch: 44, train_loss: 1.0977, test_loss: 1.0607, test_f1: 0.4548
 epoch: 45, train_loss: 1.0974, test_loss: 1.0558, test_f1: 0.4379
 epoch: 46, train_loss: 1.0948, test_loss: 1.0483, test_f1: 0.4423
 epoch: 47, train_loss: 1.0900, test_loss: 1.0563, test_f1: 0.4237
 epoch: 48, train_loss: 1.0977, test_loss: 1.0665, test_f1: 0.4202
 epoch: 49, train_loss: 1.0875, test_loss: 1.0571, test_f1: 0.4291
 epoch: 50, train_loss: 1.0851, test_loss: 1.0578, test_f1: 0.4322
 epoch: 51, train_loss: 1.0820, test_loss: 1.0604, test_f1: 0.4354
 epoch: 52, train_loss: 1.0755, test_loss: 1.0865, test_f1: 0.4261
 epoch: 53, train_loss: 1.0796, test_loss: 1.0450, test_f1: 0.4360
 epoch: 54, train_loss: 1.0837, test_loss: 1.0974, test_f1: 0.4309
 epoch: 55, train_loss: 1.0803, test_loss: 1.0778, test_f1: 0.4184
 epoch: 56, train_loss: 1.0794, test_loss: 1.0613, test_f1: 0.4222
 epoch: 57, train_loss: 1.0698, test_loss: 1.0627, test_f1: 0.4226
 epoch: 58, train_loss: 1.0775, test_loss: 1.0622, test_f1: 0.4139
 epoch: 59, train_loss: 1.0696, test_loss: 1.0449, test_f1: 0.4285
 epoch: 60, train_loss: 1.0700, test_loss: 1.0546, test_f1: 0.4239
 epoch: 61, train_loss: 1.0787, test_loss: 1.0469, test_f1: 0.4301
 epoch: 62, train_loss: 1.0688, test_loss: 1.0356, test_f1: 0.4360
 epoch: 63, train_loss: 1.0712, test_loss: 1.0504, test_f1: 0.4236
 epoch: 64, train_loss: 1.0609, test_loss: 1.0461, test_f1: 0.4238
 epoch: 65, train_loss: 1.0749, test_loss: 1.0477, test_f1: 0.4336
 epoch: 66, train_loss: 1.0634, test_loss: 1.0381, test_f1: 0.4415
 epoch: 67, train_loss: 1.0568, test_loss: 1.0506, test_f1: 0.4369
 epoch: 68, train_loss: 1.0671, test_loss: 1.0631, test_f1: 0.4487
 epoch: 69, train_loss: 1.0645, test_loss: 1.0381, test_f1: 0.4286
 epoch: 70, train_loss: 1.0675, test_loss: 1.0248, test_f1: 0.4500
 epoch: 71, train_loss: 1.0665, test_loss: 1.0492, test_f1: 0.4440
 epoch: 72, train_loss: 1.0530, test_loss: 1.0658, test_f1: 0.4371
 epoch: 73, train_loss: 1.0510, test_loss: 1.0663, test_f1: 0.4351
 epoch: 74, train_loss: 1.0634, test_loss: 1.0568, test_f1: 0.4201
 epoch: 75, train_loss: 1.0605, test_loss: 1.0251, test_f1: 0.4428
 epoch: 76, train_loss: 1.0541, test_loss: 1.0419, test_f1: 0.4209
 epoch: 77, train_loss: 1.0539, test_loss: 1.0421, test_f1: 0.4330
 epoch: 78, train_loss: 1.0474, test_loss: 1.0321, test_f1: 0.4324
 epoch: 79, train_loss: 1.0514, test_loss: 1.0288, test_f1: 0.4441
 epoch: 80, train_loss: 1.0475, test_loss: 1.0222, test_f1: 0.4603
 epoch: 81, train_loss: 1.0516, test_loss: 1.0710, test_f1: 0.4320
 epoch: 82, train_loss: 1.0522, test_loss: 1.0403, test_f1: 0.4332
 epoch: 83, train_loss: 1.0486, test_loss: 1.0543, test_f1: 0.4407
 epoch: 84, train_loss: 1.0418, test_loss: 1.0596, test_f1: 0.4283
 epoch: 85, train_loss: 1.0423, test_loss: 1.0835, test_f1: 0.4357
 epoch: 86, train_loss: 1.0420, test_loss: 1.0334, test_f1: 0.4436
 epoch: 87, train_loss: 1.0463, test_loss: 1.0129, test_f1: 0.4537
 epoch: 88, train_loss: 1.0417, test_loss: 1.0493, test_f1: 0.4511
 epoch: 89, train_loss: 1.0420, test_loss: 1.0085, test_f1: 0.4439
 epoch: 90, train_loss: 1.0450, test_loss: 1.0165, test_f1: 0.4467
 epoch: 91, train_loss: 1.0495, test_loss: 1.0654, test_f1: 0.4391
 epoch: 92, train_loss: 1.0382, test_loss: 1.0179, test_f1: 0.4526
 epoch: 93, train_loss: 1.0493, test_loss: 1.0140, test_f1: 0.4593
 epoch: 94, train_loss: 1.0435, test_loss: 1.0305, test_f1: 0.4484
 epoch: 95, train_loss: 1.0515, test_loss: 1.0655, test_f1: 0.4311
 epoch: 96, train_loss: 1.0347, test_loss: 1.0367, test_f1: 0.4347
 epoch: 97, train_loss: 1.0496, test_loss: 1.0593, test_f1: 0.4320
 epoch: 98, train_loss: 1.0321, test_loss: 1.1268, test_f1: 0.4353
 epoch: 99, train_loss: 1.0353, test_loss: 1.0203, test_f1: 0.4416
##################ITERATION #4 ****************************************
 epoch: 0, train_loss: 1.3402, test_loss: 1.2843, test_f1: 0.2611
 epoch: 1, train_loss: 1.2686, test_loss: 1.2585, test_f1: 0.2500
 epoch: 2, train_loss: 1.2581, test_loss: 1.2440, test_f1: 0.2459
 epoch: 3, train_loss: 1.2430, test_loss: 1.2312, test_f1: 0.2509
 epoch: 4, train_loss: 1.2392, test_loss: 1.2230, test_f1: 0.2851
 epoch: 5, train_loss: 1.2286, test_loss: 1.2108, test_f1: 0.2642
 epoch: 6, train_loss: 1.2256, test_loss: 1.1951, test_f1: 0.3316
 epoch: 7, train_loss: 1.2138, test_loss: 1.1869, test_f1: 0.3755
 epoch: 8, train_loss: 1.2060, test_loss: 1.1728, test_f1: 0.3736
 epoch: 9, train_loss: 1.1998, test_loss: 1.1628, test_f1: 0.3814
 epoch: 10, train_loss: 1.1881, test_loss: 1.1544, test_f1: 0.3925
 epoch: 11, train_loss: 1.1882, test_loss: 1.1426, test_f1: 0.3822
 epoch: 12, train_loss: 1.1749, test_loss: 1.1340, test_f1: 0.4111
 epoch: 13, train_loss: 1.1730, test_loss: 1.1307, test_f1: 0.4122
 epoch: 14, train_loss: 1.1602, test_loss: 1.1238, test_f1: 0.3958
 epoch: 15, train_loss: 1.1549, test_loss: 1.1077, test_f1: 0.4240
 epoch: 16, train_loss: 1.1396, test_loss: 1.1069, test_f1: 0.4165
 epoch: 17, train_loss: 1.1456, test_loss: 1.0977, test_f1: 0.4158
 epoch: 18, train_loss: 1.1339, test_loss: 1.0927, test_f1: 0.4267
 epoch: 19, train_loss: 1.1321, test_loss: 1.0805, test_f1: 0.4271
 epoch: 20, train_loss: 1.1215, test_loss: 1.0802, test_f1: 0.4305
 epoch: 21, train_loss: 1.1280, test_loss: 1.0748, test_f1: 0.4442
 epoch: 22, train_loss: 1.1143, test_loss: 1.0798, test_f1: 0.4286
 epoch: 23, train_loss: 1.1030, test_loss: 1.0660, test_f1: 0.4375
 epoch: 24, train_loss: 1.0962, test_loss: 1.0502, test_f1: 0.4228
 epoch: 25, train_loss: 1.1016, test_loss: 1.0463, test_f1: 0.4336
 epoch: 26, train_loss: 1.0977, test_loss: 1.0559, test_f1: 0.4352
 epoch: 27, train_loss: 1.0949, test_loss: 1.0498, test_f1: 0.4455
 epoch: 28, train_loss: 1.0915, test_loss: 1.0395, test_f1: 0.4375
 epoch: 29, train_loss: 1.0788, test_loss: 1.0452, test_f1: 0.4475
 epoch: 30, train_loss: 1.0723, test_loss: 1.0368, test_f1: 0.4452
 epoch: 31, train_loss: 1.0747, test_loss: 1.0306, test_f1: 0.4417
 epoch: 32, train_loss: 1.0737, test_loss: 1.0355, test_f1: 0.4444
 epoch: 33, train_loss: 1.0787, test_loss: 1.0365, test_f1: 0.4415
 epoch: 34, train_loss: 1.0653, test_loss: 1.0382, test_f1: 0.4375
 epoch: 35, train_loss: 1.0689, test_loss: 1.0292, test_f1: 0.4482
 epoch: 36, train_loss: 1.0659, test_loss: 1.0299, test_f1: 0.4613
 epoch: 37, train_loss: 1.0597, test_loss: 1.0233, test_f1: 0.4624
 epoch: 38, train_loss: 1.0550, test_loss: 1.0241, test_f1: 0.4444
 epoch: 39, train_loss: 1.0491, test_loss: 1.0363, test_f1: 0.4490
 epoch: 40, train_loss: 1.0510, test_loss: 1.0256, test_f1: 0.4631
 epoch: 41, train_loss: 1.0498, test_loss: 1.0254, test_f1: 0.4492
 epoch: 42, train_loss: 1.0494, test_loss: 1.0077, test_f1: 0.4452
 epoch: 43, train_loss: 1.0408, test_loss: 1.0095, test_f1: 0.4621
 epoch: 44, train_loss: 1.0280, test_loss: 1.0124, test_f1: 0.4526
 epoch: 45, train_loss: 1.0369, test_loss: 1.0211, test_f1: 0.4569
 epoch: 46, train_loss: 1.0328, test_loss: 1.0158, test_f1: 0.4404
 epoch: 47, train_loss: 1.0211, test_loss: 1.0011, test_f1: 0.4512
 epoch: 48, train_loss: 1.0245, test_loss: 0.9981, test_f1: 0.4611
 epoch: 49, train_loss: 1.0223, test_loss: 1.0254, test_f1: 0.4396
 epoch: 50, train_loss: 1.0222, test_loss: 1.0014, test_f1: 0.4519
 epoch: 51, train_loss: 1.0148, test_loss: 0.9743, test_f1: 0.4515
 epoch: 52, train_loss: 1.0163, test_loss: 1.0040, test_f1: 0.4522
 epoch: 53, train_loss: 1.0211, test_loss: 0.9912, test_f1: 0.4592
 epoch: 54, train_loss: 1.0183, test_loss: 0.9976, test_f1: 0.4545
 epoch: 55, train_loss: 1.0003, test_loss: 1.0037, test_f1: 0.4444
 epoch: 56, train_loss: 1.0025, test_loss: 1.0147, test_f1: 0.4710
 epoch: 57, train_loss: 1.0094, test_loss: 0.9824, test_f1: 0.4653
 epoch: 58, train_loss: 0.9990, test_loss: 1.0029, test_f1: 0.4624
 epoch: 59, train_loss: 0.9996, test_loss: 0.9919, test_f1: 0.4830
 epoch: 60, train_loss: 0.9982, test_loss: 0.9995, test_f1: 0.4481
 epoch: 61, train_loss: 1.0029, test_loss: 0.9936, test_f1: 0.4357
 epoch: 62, train_loss: 1.0083, test_loss: 1.0038, test_f1: 0.4689
 epoch: 63, train_loss: 1.0061, test_loss: 0.9867, test_f1: 0.4671
 epoch: 64, train_loss: 1.0004, test_loss: 1.0074, test_f1: 0.4673
 epoch: 65, train_loss: 0.9902, test_loss: 0.9929, test_f1: 0.4573
 epoch: 66, train_loss: 0.9935, test_loss: 0.9809, test_f1: 0.4760
 epoch: 67, train_loss: 0.9958, test_loss: 0.9969, test_f1: 0.4671
 epoch: 68, train_loss: 0.9935, test_loss: 0.9957, test_f1: 0.4728
 epoch: 69, train_loss: 0.9876, test_loss: 0.9803, test_f1: 0.4907
 epoch: 70, train_loss: 0.9907, test_loss: 0.9772, test_f1: 0.4637
 epoch: 71, train_loss: 0.9962, test_loss: 0.9745, test_f1: 0.4713
 epoch: 72, train_loss: 0.9961, test_loss: 1.0083, test_f1: 0.4653
 epoch: 73, train_loss: 1.0083, test_loss: 1.0098, test_f1: 0.4796
 epoch: 74, train_loss: 0.9888, test_loss: 1.0061, test_f1: 0.4732
 epoch: 75, train_loss: 0.9936, test_loss: 0.9908, test_f1: 0.4666
 epoch: 76, train_loss: 0.9959, test_loss: 1.0070, test_f1: 0.4684
 epoch: 77, train_loss: 0.9896, test_loss: 0.9938, test_f1: 0.4704
 epoch: 78, train_loss: 0.9909, test_loss: 0.9969, test_f1: 0.4746
 epoch: 79, train_loss: 0.9909, test_loss: 0.9988, test_f1: 0.4549
 epoch: 80, train_loss: 0.9798, test_loss: 1.0105, test_f1: 0.4784
 epoch: 81, train_loss: 0.9775, test_loss: 0.9936, test_f1: 0.4750
 epoch: 82, train_loss: 0.9911, test_loss: 0.9966, test_f1: 0.4768
 epoch: 83, train_loss: 0.9768, test_loss: 1.0000, test_f1: 0.4700
 epoch: 84, train_loss: 0.9914, test_loss: 0.9941, test_f1: 0.4764
 epoch: 85, train_loss: 0.9885, test_loss: 0.9922, test_f1: 0.4721
 epoch: 86, train_loss: 0.9851, test_loss: 0.9918, test_f1: 0.4805
 epoch: 87, train_loss: 0.9887, test_loss: 0.9786, test_f1: 0.4504
 epoch: 88, train_loss: 0.9787, test_loss: 0.9838, test_f1: 0.4830
 epoch: 89, train_loss: 0.9820, test_loss: 0.9766, test_f1: 0.4563
 epoch: 90, train_loss: 0.9740, test_loss: 1.0070, test_f1: 0.4436
 epoch: 91, train_loss: 0.9806, test_loss: 0.9939, test_f1: 0.4725
 epoch: 92, train_loss: 0.9729, test_loss: 0.9851, test_f1: 0.4773
 epoch: 93, train_loss: 0.9756, test_loss: 0.9927, test_f1: 0.4737
 epoch: 94, train_loss: 0.9709, test_loss: 0.9850, test_f1: 0.4570
 epoch: 95, train_loss: 0.9779, test_loss: 1.0004, test_f1: 0.4715
 epoch: 96, train_loss: 0.9722, test_loss: 1.0081, test_f1: 0.4788
 epoch: 97, train_loss: 0.9671, test_loss: 0.9954, test_f1: 0.4598
 epoch: 98, train_loss: 0.9686, test_loss: 0.9865, test_f1: 0.4786
 epoch: 99, train_loss: 0.9682, test_loss: 0.9921, test_f1: 0.4772
##################ITERATION #5 ****************************************
 epoch: 0, train_loss: 1.3036, test_loss: 1.2257, test_f1: 0.2379
 epoch: 1, train_loss: 1.2548, test_loss: 1.2017, test_f1: 0.3094
 epoch: 2, train_loss: 1.2322, test_loss: 1.1901, test_f1: 0.3568
 epoch: 3, train_loss: 1.2277, test_loss: 1.1803, test_f1: 0.4155
 epoch: 4, train_loss: 1.2246, test_loss: 1.1691, test_f1: 0.3799
 epoch: 5, train_loss: 1.2108, test_loss: 1.1668, test_f1: 0.3852
 epoch: 6, train_loss: 1.1958, test_loss: 1.1570, test_f1: 0.4044
 epoch: 7, train_loss: 1.1954, test_loss: 1.1520, test_f1: 0.4254
 epoch: 8, train_loss: 1.1925, test_loss: 1.1466, test_f1: 0.4125
 epoch: 9, train_loss: 1.1807, test_loss: 1.1390, test_f1: 0.4256
 epoch: 10, train_loss: 1.1694, test_loss: 1.1324, test_f1: 0.4208
 epoch: 11, train_loss: 1.1756, test_loss: 1.1251, test_f1: 0.4183
 epoch: 12, train_loss: 1.1640, test_loss: 1.1171, test_f1: 0.4274
 epoch: 13, train_loss: 1.1675, test_loss: 1.1153, test_f1: 0.4219
 epoch: 14, train_loss: 1.1634, test_loss: 1.1190, test_f1: 0.4448
 epoch: 15, train_loss: 1.1543, test_loss: 1.1056, test_f1: 0.4281
 epoch: 16, train_loss: 1.1464, test_loss: 1.1064, test_f1: 0.4351
 epoch: 17, train_loss: 1.1439, test_loss: 1.0995, test_f1: 0.4370
 epoch: 18, train_loss: 1.1454, test_loss: 1.0963, test_f1: 0.4394
 epoch: 19, train_loss: 1.1374, test_loss: 1.0834, test_f1: 0.4413
 epoch: 20, train_loss: 1.1256, test_loss: 1.0872, test_f1: 0.4358
 epoch: 21, train_loss: 1.1281, test_loss: 1.0798, test_f1: 0.4430
 epoch: 22, train_loss: 1.1205, test_loss: 1.0798, test_f1: 0.4626
 epoch: 23, train_loss: 1.1182, test_loss: 1.0741, test_f1: 0.4537
 epoch: 24, train_loss: 1.1192, test_loss: 1.0691, test_f1: 0.4517
 epoch: 25, train_loss: 1.1068, test_loss: 1.0616, test_f1: 0.4617
 epoch: 26, train_loss: 1.1164, test_loss: 1.0660, test_f1: 0.4549
 epoch: 27, train_loss: 1.1019, test_loss: 1.0559, test_f1: 0.4392
 epoch: 28, train_loss: 1.1026, test_loss: 1.0606, test_f1: 0.4583
 epoch: 29, train_loss: 1.0980, test_loss: 1.0566, test_f1: 0.4574
 epoch: 30, train_loss: 1.0887, test_loss: 1.0522, test_f1: 0.4594
 epoch: 31, train_loss: 1.0961, test_loss: 1.0495, test_f1: 0.4599
 epoch: 32, train_loss: 1.1012, test_loss: 1.0513, test_f1: 0.4650
 epoch: 33, train_loss: 1.0867, test_loss: 1.0435, test_f1: 0.4618
 epoch: 34, train_loss: 1.0833, test_loss: 1.0708, test_f1: 0.4420
 epoch: 35, train_loss: 1.0826, test_loss: 1.0357, test_f1: 0.4505
 epoch: 36, train_loss: 1.0763, test_loss: 1.0297, test_f1: 0.4715
 epoch: 37, train_loss: 1.0816, test_loss: 1.0318, test_f1: 0.4772
 epoch: 38, train_loss: 1.0854, test_loss: 1.0250, test_f1: 0.4796
 epoch: 39, train_loss: 1.0655, test_loss: 1.0163, test_f1: 0.4893
 epoch: 40, train_loss: 1.0509, test_loss: 1.0137, test_f1: 0.4778
 epoch: 41, train_loss: 1.0618, test_loss: 1.0192, test_f1: 0.4926
 epoch: 42, train_loss: 1.0515, test_loss: 1.0548, test_f1: 0.4410
 epoch: 43, train_loss: 1.0670, test_loss: 1.0118, test_f1: 0.4980
 epoch: 44, train_loss: 1.0558, test_loss: 1.0329, test_f1: 0.4656
 epoch: 45, train_loss: 1.0505, test_loss: 1.0014, test_f1: 0.5036
 epoch: 46, train_loss: 1.0532, test_loss: 1.0054, test_f1: 0.4956
 epoch: 47, train_loss: 1.0491, test_loss: 1.0131, test_f1: 0.4844
 epoch: 48, train_loss: 1.0361, test_loss: 1.0293, test_f1: 0.4642
 epoch: 49, train_loss: 1.0372, test_loss: 1.0023, test_f1: 0.4750
 epoch: 50, train_loss: 1.0563, test_loss: 0.9864, test_f1: 0.4947
 epoch: 51, train_loss: 1.0335, test_loss: 1.0019, test_f1: 0.4918
 epoch: 52, train_loss: 1.0413, test_loss: 1.0064, test_f1: 0.5073
 epoch: 53, train_loss: 1.0329, test_loss: 0.9847, test_f1: 0.4972
 epoch: 54, train_loss: 1.0322, test_loss: 0.9918, test_f1: 0.4929
 epoch: 55, train_loss: 1.0404, test_loss: 0.9930, test_f1: 0.5107
 epoch: 56, train_loss: 1.0283, test_loss: 0.9863, test_f1: 0.4748
 epoch: 57, train_loss: 1.0321, test_loss: 0.9890, test_f1: 0.4935
 epoch: 58, train_loss: 1.0237, test_loss: 1.0041, test_f1: 0.4884
 epoch: 59, train_loss: 1.0207, test_loss: 1.0317, test_f1: 0.4489
 epoch: 60, train_loss: 1.0240, test_loss: 0.9991, test_f1: 0.4948
 epoch: 61, train_loss: 1.0340, test_loss: 0.9842, test_f1: 0.4887
 epoch: 62, train_loss: 1.0143, test_loss: 1.0116, test_f1: 0.4693
 epoch: 63, train_loss: 1.0284, test_loss: 1.0172, test_f1: 0.4532
 epoch: 64, train_loss: 1.0081, test_loss: 0.9856, test_f1: 0.5070
 epoch: 65, train_loss: 1.0231, test_loss: 1.0090, test_f1: 0.4785
 epoch: 66, train_loss: 1.0108, test_loss: 0.9846, test_f1: 0.4977
 epoch: 67, train_loss: 1.0199, test_loss: 0.9830, test_f1: 0.4975
 epoch: 68, train_loss: 1.0110, test_loss: 0.9845, test_f1: 0.4895
 epoch: 69, train_loss: 1.0240, test_loss: 0.9883, test_f1: 0.5053
 epoch: 70, train_loss: 1.0179, test_loss: 0.9807, test_f1: 0.4855
 epoch: 71, train_loss: 1.0104, test_loss: 0.9700, test_f1: 0.4911
 epoch: 72, train_loss: 1.0063, test_loss: 0.9672, test_f1: 0.5020
 epoch: 73, train_loss: 1.0184, test_loss: 0.9705, test_f1: 0.4951
 epoch: 74, train_loss: 1.0160, test_loss: 0.9788, test_f1: 0.5009
 epoch: 75, train_loss: 1.0107, test_loss: 1.0149, test_f1: 0.4484
 epoch: 76, train_loss: 1.0150, test_loss: 0.9665, test_f1: 0.4946
 epoch: 77, train_loss: 1.0113, test_loss: 0.9824, test_f1: 0.4776
 epoch: 78, train_loss: 0.9997, test_loss: 0.9922, test_f1: 0.4906
 epoch: 79, train_loss: 1.0105, test_loss: 0.9656, test_f1: 0.5096
 epoch: 80, train_loss: 1.0123, test_loss: 1.0391, test_f1: 0.4724
 epoch: 81, train_loss: 0.9991, test_loss: 0.9745, test_f1: 0.4992
 epoch: 82, train_loss: 1.0008, test_loss: 1.0043, test_f1: 0.4709
 epoch: 83, train_loss: 0.9999, test_loss: 0.9943, test_f1: 0.4594
 epoch: 84, train_loss: 1.0091, test_loss: 1.0248, test_f1: 0.4690
 epoch: 85, train_loss: 1.0038, test_loss: 0.9677, test_f1: 0.5147
 epoch: 86, train_loss: 1.0006, test_loss: 0.9819, test_f1: 0.4907
 epoch: 87, train_loss: 1.0128, test_loss: 0.9790, test_f1: 0.4951
 epoch: 88, train_loss: 1.0007, test_loss: 0.9746, test_f1: 0.5120
 epoch: 89, train_loss: 0.9932, test_loss: 0.9955, test_f1: 0.4834
 epoch: 90, train_loss: 0.9923, test_loss: 0.9772, test_f1: 0.5034
 epoch: 91, train_loss: 0.9993, test_loss: 0.9692, test_f1: 0.5217
 epoch: 92, train_loss: 1.0025, test_loss: 0.9695, test_f1: 0.5083
 epoch: 93, train_loss: 0.9933, test_loss: 0.9979, test_f1: 0.4757
 epoch: 94, train_loss: 0.9833, test_loss: 0.9802, test_f1: 0.4878
 epoch: 95, train_loss: 0.9899, test_loss: 0.9669, test_f1: 0.5278
 epoch: 96, train_loss: 1.0004, test_loss: 0.9930, test_f1: 0.4672
 epoch: 97, train_loss: 0.9887, test_loss: 0.9794, test_f1: 0.4805
 epoch: 98, train_loss: 0.9898, test_loss: 1.0339, test_f1: 0.4695
 epoch: 99, train_loss: 0.9868, test_loss: 0.9979, test_f1: 0.4747
##################ITERATION #6 ****************************************
 epoch: 0, train_loss: 1.3260, test_loss: 1.2615, test_f1: 0.2416
 epoch: 1, train_loss: 1.2676, test_loss: 1.2346, test_f1: 0.2836
 epoch: 2, train_loss: 1.2611, test_loss: 1.2260, test_f1: 0.3076
 epoch: 3, train_loss: 1.2403, test_loss: 1.2075, test_f1: 0.3203
 epoch: 4, train_loss: 1.2333, test_loss: 1.1992, test_f1: 0.3363
 epoch: 5, train_loss: 1.2285, test_loss: 1.1859, test_f1: 0.3348
 epoch: 6, train_loss: 1.2278, test_loss: 1.1945, test_f1: 0.3394
 epoch: 7, train_loss: 1.2105, test_loss: 1.1803, test_f1: 0.3592
 epoch: 8, train_loss: 1.2099, test_loss: 1.1733, test_f1: 0.3734
 epoch: 9, train_loss: 1.1977, test_loss: 1.1642, test_f1: 0.3802
 epoch: 10, train_loss: 1.1966, test_loss: 1.1479, test_f1: 0.4005
 epoch: 11, train_loss: 1.1884, test_loss: 1.1418, test_f1: 0.3993
 epoch: 12, train_loss: 1.1841, test_loss: 1.1416, test_f1: 0.4086
 epoch: 13, train_loss: 1.1803, test_loss: 1.1407, test_f1: 0.3894
 epoch: 14, train_loss: 1.1798, test_loss: 1.1302, test_f1: 0.4257
 epoch: 15, train_loss: 1.1742, test_loss: 1.1276, test_f1: 0.4399
 epoch: 16, train_loss: 1.1702, test_loss: 1.1130, test_f1: 0.4168
 epoch: 17, train_loss: 1.1621, test_loss: 1.1142, test_f1: 0.4204
 epoch: 18, train_loss: 1.1695, test_loss: 1.1112, test_f1: 0.4064
 epoch: 19, train_loss: 1.1581, test_loss: 1.1076, test_f1: 0.4232
 epoch: 20, train_loss: 1.1485, test_loss: 1.1008, test_f1: 0.4095
 epoch: 21, train_loss: 1.1573, test_loss: 1.0997, test_f1: 0.4283
 epoch: 22, train_loss: 1.1478, test_loss: 1.0964, test_f1: 0.4323
 epoch: 23, train_loss: 1.1396, test_loss: 1.0958, test_f1: 0.4338
 epoch: 24, train_loss: 1.1272, test_loss: 1.0913, test_f1: 0.4426
 epoch: 25, train_loss: 1.1260, test_loss: 1.0874, test_f1: 0.4383
 epoch: 26, train_loss: 1.1284, test_loss: 1.0880, test_f1: 0.4443
 epoch: 27, train_loss: 1.1308, test_loss: 1.0817, test_f1: 0.4242
 epoch: 28, train_loss: 1.1167, test_loss: 1.0786, test_f1: 0.4466
 epoch: 29, train_loss: 1.1182, test_loss: 1.0831, test_f1: 0.4488
 epoch: 30, train_loss: 1.1181, test_loss: 1.0716, test_f1: 0.4650
 epoch: 31, train_loss: 1.1120, test_loss: 1.0869, test_f1: 0.4439
 epoch: 32, train_loss: 1.1073, test_loss: 1.0760, test_f1: 0.4572
 epoch: 33, train_loss: 1.1168, test_loss: 1.0710, test_f1: 0.4479
 epoch: 34, train_loss: 1.1080, test_loss: 1.0734, test_f1: 0.4545
 epoch: 35, train_loss: 1.1066, test_loss: 1.0646, test_f1: 0.4682
 epoch: 36, train_loss: 1.1031, test_loss: 1.0600, test_f1: 0.4581
 epoch: 37, train_loss: 1.1008, test_loss: 1.0599, test_f1: 0.4752
 epoch: 38, train_loss: 1.0892, test_loss: 1.0509, test_f1: 0.4590
 epoch: 39, train_loss: 1.0913, test_loss: 1.0440, test_f1: 0.4794
 epoch: 40, train_loss: 1.0870, test_loss: 1.0583, test_f1: 0.4787
 epoch: 41, train_loss: 1.0882, test_loss: 1.0442, test_f1: 0.4766
 epoch: 42, train_loss: 1.0883, test_loss: 1.0602, test_f1: 0.4804
 epoch: 43, train_loss: 1.0815, test_loss: 1.0654, test_f1: 0.4700
 epoch: 44, train_loss: 1.0752, test_loss: 1.0574, test_f1: 0.4551
 epoch: 45, train_loss: 1.0732, test_loss: 1.0359, test_f1: 0.4920
 epoch: 46, train_loss: 1.0697, test_loss: 1.0503, test_f1: 0.4735
 epoch: 47, train_loss: 1.0723, test_loss: 1.0434, test_f1: 0.4780
 epoch: 48, train_loss: 1.0690, test_loss: 1.0447, test_f1: 0.4841
 epoch: 49, train_loss: 1.0658, test_loss: 1.0404, test_f1: 0.4826
 epoch: 50, train_loss: 1.0627, test_loss: 1.0420, test_f1: 0.4785
 epoch: 51, train_loss: 1.0643, test_loss: 1.0361, test_f1: 0.4868
 epoch: 52, train_loss: 1.0523, test_loss: 1.0361, test_f1: 0.4756
 epoch: 53, train_loss: 1.0543, test_loss: 1.0454, test_f1: 0.4799
 epoch: 54, train_loss: 1.0594, test_loss: 1.0388, test_f1: 0.4974
 epoch: 55, train_loss: 1.0463, test_loss: 1.0360, test_f1: 0.4819
 epoch: 56, train_loss: 1.0552, test_loss: 1.0350, test_f1: 0.4840
 epoch: 57, train_loss: 1.0514, test_loss: 1.0279, test_f1: 0.4667
 epoch: 58, train_loss: 1.0575, test_loss: 1.0249, test_f1: 0.4642
 epoch: 59, train_loss: 1.0532, test_loss: 1.0382, test_f1: 0.5044
 epoch: 60, train_loss: 1.0424, test_loss: 1.0337, test_f1: 0.4914
 epoch: 61, train_loss: 1.0565, test_loss: 1.0406, test_f1: 0.4837
 epoch: 62, train_loss: 1.0403, test_loss: 1.0149, test_f1: 0.4792
 epoch: 63, train_loss: 1.0446, test_loss: 1.0267, test_f1: 0.4669
 epoch: 64, train_loss: 1.0480, test_loss: 1.0254, test_f1: 0.4789
 epoch: 65, train_loss: 1.0470, test_loss: 1.0230, test_f1: 0.4868
 epoch: 66, train_loss: 1.0467, test_loss: 1.0207, test_f1: 0.4938
 epoch: 67, train_loss: 1.0399, test_loss: 1.0119, test_f1: 0.4840
 epoch: 68, train_loss: 1.0336, test_loss: 1.0320, test_f1: 0.4921
 epoch: 69, train_loss: 1.0405, test_loss: 1.0161, test_f1: 0.4943
 epoch: 70, train_loss: 1.0436, test_loss: 1.0339, test_f1: 0.4682
 epoch: 71, train_loss: 1.0339, test_loss: 1.0421, test_f1: 0.4911
 epoch: 72, train_loss: 1.0345, test_loss: 1.0289, test_f1: 0.5109
 epoch: 73, train_loss: 1.0279, test_loss: 1.0206, test_f1: 0.4804
 epoch: 74, train_loss: 1.0291, test_loss: 1.0176, test_f1: 0.4873
 epoch: 75, train_loss: 1.0357, test_loss: 1.0397, test_f1: 0.4829
 epoch: 76, train_loss: 1.0291, test_loss: 1.0159, test_f1: 0.4947
 epoch: 77, train_loss: 1.0180, test_loss: 1.0157, test_f1: 0.4903
 epoch: 78, train_loss: 1.0362, test_loss: 1.0145, test_f1: 0.4809
 epoch: 79, train_loss: 1.0351, test_loss: 1.0251, test_f1: 0.4906
 epoch: 80, train_loss: 1.0269, test_loss: 1.0265, test_f1: 0.4940
 epoch: 81, train_loss: 1.0277, test_loss: 1.0239, test_f1: 0.4912
 epoch: 82, train_loss: 1.0234, test_loss: 1.0366, test_f1: 0.4945
 epoch: 83, train_loss: 1.0185, test_loss: 1.0221, test_f1: 0.5097
 epoch: 84, train_loss: 1.0269, test_loss: 1.0271, test_f1: 0.4911
 epoch: 85, train_loss: 1.0163, test_loss: 1.0445, test_f1: 0.5034
 epoch: 86, train_loss: 1.0222, test_loss: 1.0156, test_f1: 0.4948
 epoch: 87, train_loss: 1.0207, test_loss: 1.0121, test_f1: 0.5041
 epoch: 88, train_loss: 1.0119, test_loss: 1.0050, test_f1: 0.5108
 epoch: 89, train_loss: 1.0184, test_loss: 1.0220, test_f1: 0.4804
 epoch: 90, train_loss: 1.0122, test_loss: 1.0294, test_f1: 0.5061
 epoch: 91, train_loss: 1.0129, test_loss: 1.0095, test_f1: 0.4834
 epoch: 92, train_loss: 1.0036, test_loss: 1.0150, test_f1: 0.4860
 epoch: 93, train_loss: 1.0063, test_loss: 1.0148, test_f1: 0.4818
 epoch: 94, train_loss: 1.0046, test_loss: 1.0087, test_f1: 0.4883
 epoch: 95, train_loss: 1.0171, test_loss: 1.0044, test_f1: 0.4812
 epoch: 96, train_loss: 1.0101, test_loss: 1.0291, test_f1: 0.4962
 epoch: 97, train_loss: 1.0072, test_loss: 1.0167, test_f1: 0.4969
 epoch: 98, train_loss: 1.0042, test_loss: 1.0054, test_f1: 0.5042
 epoch: 99, train_loss: 1.0121, test_loss: 1.0121, test_f1: 0.4986
##################ITERATION #7 ****************************************
 epoch: 0, train_loss: 1.3283, test_loss: 1.2769, test_f1: 0.2556
 epoch: 1, train_loss: 1.2749, test_loss: 1.2614, test_f1: 0.2812
 epoch: 2, train_loss: 1.2690, test_loss: 1.2440, test_f1: 0.3296
 epoch: 3, train_loss: 1.2541, test_loss: 1.2477, test_f1: 0.2907
 epoch: 4, train_loss: 1.2429, test_loss: 1.2310, test_f1: 0.3087
 epoch: 5, train_loss: 1.2411, test_loss: 1.2368, test_f1: 0.3823
 epoch: 6, train_loss: 1.2290, test_loss: 1.2078, test_f1: 0.3689
 epoch: 7, train_loss: 1.2235, test_loss: 1.2141, test_f1: 0.3543
 epoch: 8, train_loss: 1.2247, test_loss: 1.1959, test_f1: 0.3544
 epoch: 9, train_loss: 1.2214, test_loss: 1.1885, test_f1: 0.4117
 epoch: 10, train_loss: 1.2122, test_loss: 1.1937, test_f1: 0.3947
 epoch: 11, train_loss: 1.2020, test_loss: 1.1891, test_f1: 0.4144
 epoch: 12, train_loss: 1.2036, test_loss: 1.1798, test_f1: 0.4025
 epoch: 13, train_loss: 1.2039, test_loss: 1.1691, test_f1: 0.3916
 epoch: 14, train_loss: 1.1970, test_loss: 1.1666, test_f1: 0.4158
 epoch: 15, train_loss: 1.1865, test_loss: 1.1645, test_f1: 0.4267
 epoch: 16, train_loss: 1.1767, test_loss: 1.1545, test_f1: 0.4510
 epoch: 17, train_loss: 1.1799, test_loss: 1.1506, test_f1: 0.4504
 epoch: 18, train_loss: 1.1755, test_loss: 1.1429, test_f1: 0.4279
 epoch: 19, train_loss: 1.1748, test_loss: 1.1410, test_f1: 0.4404
 epoch: 20, train_loss: 1.1624, test_loss: 1.1448, test_f1: 0.4484
 epoch: 21, train_loss: 1.1561, test_loss: 1.1396, test_f1: 0.4353
 epoch: 22, train_loss: 1.1605, test_loss: 1.1108, test_f1: 0.4291
 epoch: 23, train_loss: 1.1664, test_loss: 1.1344, test_f1: 0.4281
 epoch: 24, train_loss: 1.1545, test_loss: 1.1210, test_f1: 0.4249
 epoch: 25, train_loss: 1.1482, test_loss: 1.1233, test_f1: 0.4569
 epoch: 26, train_loss: 1.1450, test_loss: 1.1174, test_f1: 0.4355
 epoch: 27, train_loss: 1.1489, test_loss: 1.1049, test_f1: 0.4529
 epoch: 28, train_loss: 1.1479, test_loss: 1.0954, test_f1: 0.4630
 epoch: 29, train_loss: 1.1354, test_loss: 1.0798, test_f1: 0.4530
 epoch: 30, train_loss: 1.1428, test_loss: 1.0855, test_f1: 0.4625
 epoch: 31, train_loss: 1.1284, test_loss: 1.0811, test_f1: 0.4625
 epoch: 32, train_loss: 1.1234, test_loss: 1.0745, test_f1: 0.4579
 epoch: 33, train_loss: 1.1256, test_loss: 1.0755, test_f1: 0.4471
 epoch: 34, train_loss: 1.1208, test_loss: 1.0773, test_f1: 0.4585
 epoch: 35, train_loss: 1.1192, test_loss: 1.0728, test_f1: 0.4754
 epoch: 36, train_loss: 1.1175, test_loss: 1.0601, test_f1: 0.4647
 epoch: 37, train_loss: 1.1069, test_loss: 1.0501, test_f1: 0.4607
 epoch: 38, train_loss: 1.1059, test_loss: 1.0780, test_f1: 0.4530
 epoch: 39, train_loss: 1.1137, test_loss: 1.0671, test_f1: 0.4676
 epoch: 40, train_loss: 1.0936, test_loss: 1.0435, test_f1: 0.4635
 epoch: 41, train_loss: 1.1067, test_loss: 1.0600, test_f1: 0.4607
 epoch: 42, train_loss: 1.1013, test_loss: 1.0425, test_f1: 0.4554
 epoch: 43, train_loss: 1.0954, test_loss: 1.0596, test_f1: 0.4591
 epoch: 44, train_loss: 1.0988, test_loss: 1.0399, test_f1: 0.4626
 epoch: 45, train_loss: 1.0919, test_loss: 1.0482, test_f1: 0.4647
 epoch: 46, train_loss: 1.0978, test_loss: 1.0313, test_f1: 0.4545
 epoch: 47, train_loss: 1.0958, test_loss: 1.0441, test_f1: 0.4810
 epoch: 48, train_loss: 1.0702, test_loss: 1.0313, test_f1: 0.4916
 epoch: 49, train_loss: 1.0794, test_loss: 1.0415, test_f1: 0.4719
 epoch: 50, train_loss: 1.0756, test_loss: 1.0366, test_f1: 0.4619
 epoch: 51, train_loss: 1.0726, test_loss: 1.0303, test_f1: 0.4756
 epoch: 52, train_loss: 1.0732, test_loss: 1.0441, test_f1: 0.4755
 epoch: 53, train_loss: 1.0614, test_loss: 1.0389, test_f1: 0.4516
 epoch: 54, train_loss: 1.0729, test_loss: 1.0239, test_f1: 0.4762
 epoch: 55, train_loss: 1.0776, test_loss: 1.0464, test_f1: 0.4615
 epoch: 56, train_loss: 1.0702, test_loss: 1.0354, test_f1: 0.4553
 epoch: 57, train_loss: 1.0668, test_loss: 1.0463, test_f1: 0.4503
 epoch: 58, train_loss: 1.0656, test_loss: 1.0174, test_f1: 0.4898
 epoch: 59, train_loss: 1.0716, test_loss: 1.0592, test_f1: 0.4706
 epoch: 60, train_loss: 1.0563, test_loss: 1.0126, test_f1: 0.4970
 epoch: 61, train_loss: 1.0609, test_loss: 1.0952, test_f1: 0.4993
 epoch: 62, train_loss: 1.0705, test_loss: 1.0359, test_f1: 0.4567
 epoch: 63, train_loss: 1.0589, test_loss: 1.0390, test_f1: 0.4793
 epoch: 64, train_loss: 1.0618, test_loss: 1.0040, test_f1: 0.4987
 epoch: 65, train_loss: 1.0553, test_loss: 1.0395, test_f1: 0.4872
 epoch: 66, train_loss: 1.0535, test_loss: 1.0218, test_f1: 0.4734
 epoch: 67, train_loss: 1.0541, test_loss: 1.0204, test_f1: 0.5028
 epoch: 68, train_loss: 1.0580, test_loss: 1.0289, test_f1: 0.4859
 epoch: 69, train_loss: 1.0441, test_loss: 1.0327, test_f1: 0.4682
 epoch: 70, train_loss: 1.0467, test_loss: 1.1575, test_f1: 0.4853
 epoch: 71, train_loss: 1.0541, test_loss: 1.0095, test_f1: 0.4854
 epoch: 72, train_loss: 1.0405, test_loss: 1.0507, test_f1: 0.4750
 epoch: 73, train_loss: 1.0446, test_loss: 0.9942, test_f1: 0.4996
 epoch: 74, train_loss: 1.0417, test_loss: 1.0152, test_f1: 0.5033
 epoch: 75, train_loss: 1.0430, test_loss: 1.0210, test_f1: 0.4895
 epoch: 76, train_loss: 1.0388, test_loss: 1.1223, test_f1: 0.5078
 epoch: 77, train_loss: 1.0466, test_loss: 1.0128, test_f1: 0.4890
 epoch: 78, train_loss: 1.0352, test_loss: 1.0113, test_f1: 0.4932
 epoch: 79, train_loss: 1.0392, test_loss: 1.0083, test_f1: 0.4904
 epoch: 80, train_loss: 1.0435, test_loss: 1.0076, test_f1: 0.5012
 epoch: 81, train_loss: 1.0484, test_loss: 1.0376, test_f1: 0.5118
 epoch: 82, train_loss: 1.0384, test_loss: 1.0070, test_f1: 0.4847
 epoch: 83, train_loss: 1.0376, test_loss: 1.0252, test_f1: 0.4643
 epoch: 84, train_loss: 1.0298, test_loss: 0.9982, test_f1: 0.4897
 epoch: 85, train_loss: 1.0343, test_loss: 1.0040, test_f1: 0.4930
 epoch: 86, train_loss: 1.0315, test_loss: 1.0082, test_f1: 0.4930
 epoch: 87, train_loss: 1.0354, test_loss: 1.0094, test_f1: 0.4968
 epoch: 88, train_loss: 1.0323, test_loss: 0.9925, test_f1: 0.4976
 epoch: 89, train_loss: 1.0329, test_loss: 0.9650, test_f1: 0.4869
 epoch: 90, train_loss: 1.0245, test_loss: 1.0136, test_f1: 0.4747
 epoch: 91, train_loss: 1.0318, test_loss: 0.9938, test_f1: 0.4930
 epoch: 92, train_loss: 1.0301, test_loss: 0.9922, test_f1: 0.4941
 epoch: 93, train_loss: 1.0292, test_loss: 0.9827, test_f1: 0.4836
 epoch: 94, train_loss: 1.0272, test_loss: 0.9967, test_f1: 0.5020
 epoch: 95, train_loss: 1.0278, test_loss: 0.9844, test_f1: 0.5066
 epoch: 96, train_loss: 1.0201, test_loss: 1.0068, test_f1: 0.5096
 epoch: 97, train_loss: 1.0150, test_loss: 0.9866, test_f1: 0.5101
 epoch: 98, train_loss: 1.0117, test_loss: 0.9982, test_f1: 0.4923
 epoch: 99, train_loss: 1.0266, test_loss: 0.9868, test_f1: 0.4823
##################ITERATION #8 ****************************************
 epoch: 0, train_loss: 1.3150, test_loss: 1.2866, test_f1: 0.2644
 epoch: 1, train_loss: 1.2746, test_loss: 1.2529, test_f1: 0.2781
 epoch: 2, train_loss: 1.2645, test_loss: 1.2491, test_f1: 0.3162
 epoch: 3, train_loss: 1.2537, test_loss: 1.2253, test_f1: 0.3297
 epoch: 4, train_loss: 1.2417, test_loss: 1.2238, test_f1: 0.3412
 epoch: 5, train_loss: 1.2324, test_loss: 1.2082, test_f1: 0.3585
 epoch: 6, train_loss: 1.2315, test_loss: 1.2034, test_f1: 0.3616
 epoch: 7, train_loss: 1.2189, test_loss: 1.1858, test_f1: 0.3982
 epoch: 8, train_loss: 1.2087, test_loss: 1.1970, test_f1: 0.3773
 epoch: 9, train_loss: 1.2110, test_loss: 1.1765, test_f1: 0.3938
 epoch: 10, train_loss: 1.2058, test_loss: 1.1710, test_f1: 0.3851
 epoch: 11, train_loss: 1.1955, test_loss: 1.1545, test_f1: 0.3979
 epoch: 12, train_loss: 1.1960, test_loss: 1.1522, test_f1: 0.4040
 epoch: 13, train_loss: 1.1896, test_loss: 1.1454, test_f1: 0.4120
 epoch: 14, train_loss: 1.1823, test_loss: 1.1478, test_f1: 0.4046
 epoch: 15, train_loss: 1.1825, test_loss: 1.1352, test_f1: 0.4251
 epoch: 16, train_loss: 1.1747, test_loss: 1.1244, test_f1: 0.4057
 epoch: 17, train_loss: 1.1649, test_loss: 1.1180, test_f1: 0.4094
 epoch: 18, train_loss: 1.1633, test_loss: 1.1339, test_f1: 0.4210
 epoch: 19, train_loss: 1.1604, test_loss: 1.1114, test_f1: 0.4032
 epoch: 20, train_loss: 1.1516, test_loss: 1.1122, test_f1: 0.4084
 epoch: 21, train_loss: 1.1356, test_loss: 1.1040, test_f1: 0.4109
 epoch: 22, train_loss: 1.1353, test_loss: 1.1029, test_f1: 0.4087
 epoch: 23, train_loss: 1.1371, test_loss: 1.0947, test_f1: 0.4146
 epoch: 24, train_loss: 1.1291, test_loss: 1.1160, test_f1: 0.4082
 epoch: 25, train_loss: 1.1346, test_loss: 1.1066, test_f1: 0.4001
 epoch: 26, train_loss: 1.1236, test_loss: 1.0885, test_f1: 0.4168
 epoch: 27, train_loss: 1.1237, test_loss: 1.0880, test_f1: 0.4147
 epoch: 28, train_loss: 1.1093, test_loss: 1.0813, test_f1: 0.4313
 epoch: 29, train_loss: 1.1155, test_loss: 1.0791, test_f1: 0.4124
 epoch: 30, train_loss: 1.1173, test_loss: 1.0755, test_f1: 0.4243
 epoch: 31, train_loss: 1.1110, test_loss: 1.0615, test_f1: 0.4222
 epoch: 32, train_loss: 1.1108, test_loss: 1.0668, test_f1: 0.4190
 epoch: 33, train_loss: 1.1045, test_loss: 1.0596, test_f1: 0.4633
 epoch: 34, train_loss: 1.0952, test_loss: 1.0543, test_f1: 0.4401
 epoch: 35, train_loss: 1.1026, test_loss: 1.0649, test_f1: 0.4313
 epoch: 36, train_loss: 1.1015, test_loss: 1.0586, test_f1: 0.4298
 epoch: 37, train_loss: 1.0924, test_loss: 1.0602, test_f1: 0.4203
 epoch: 38, train_loss: 1.0888, test_loss: 1.0522, test_f1: 0.4284
 epoch: 39, train_loss: 1.0860, test_loss: 1.0452, test_f1: 0.4301
 epoch: 40, train_loss: 1.0760, test_loss: 1.0402, test_f1: 0.4302
 epoch: 41, train_loss: 1.0825, test_loss: 1.0438, test_f1: 0.4386
 epoch: 42, train_loss: 1.0718, test_loss: 1.0485, test_f1: 0.4431
 epoch: 43, train_loss: 1.0730, test_loss: 1.0408, test_f1: 0.4354
 epoch: 44, train_loss: 1.0645, test_loss: 1.0455, test_f1: 0.4362
 epoch: 45, train_loss: 1.0690, test_loss: 1.0302, test_f1: 0.4478
 epoch: 46, train_loss: 1.0647, test_loss: 1.0267, test_f1: 0.4566
 epoch: 47, train_loss: 1.0679, test_loss: 1.0333, test_f1: 0.4576
 epoch: 48, train_loss: 1.0662, test_loss: 1.0342, test_f1: 0.4438
 epoch: 49, train_loss: 1.0693, test_loss: 1.0434, test_f1: 0.4518
 epoch: 50, train_loss: 1.0646, test_loss: 1.0245, test_f1: 0.4452
 epoch: 51, train_loss: 1.0508, test_loss: 1.0245, test_f1: 0.4459
 epoch: 52, train_loss: 1.0493, test_loss: 1.0214, test_f1: 0.4609
 epoch: 53, train_loss: 1.0515, test_loss: 1.0415, test_f1: 0.4491
 epoch: 54, train_loss: 1.0481, test_loss: 1.0277, test_f1: 0.4437
 epoch: 55, train_loss: 1.0441, test_loss: 1.0327, test_f1: 0.4351
 epoch: 56, train_loss: 1.0540, test_loss: 1.0258, test_f1: 0.4445
 epoch: 57, train_loss: 1.0482, test_loss: 1.0199, test_f1: 0.4501
 epoch: 58, train_loss: 1.0498, test_loss: 1.0200, test_f1: 0.4522
 epoch: 59, train_loss: 1.0489, test_loss: 1.0283, test_f1: 0.4500
 epoch: 60, train_loss: 1.0385, test_loss: 1.0193, test_f1: 0.4675
 epoch: 61, train_loss: 1.0429, test_loss: 1.0166, test_f1: 0.4491
 epoch: 62, train_loss: 1.0370, test_loss: 1.0254, test_f1: 0.4511
 epoch: 63, train_loss: 1.0441, test_loss: 1.0201, test_f1: 0.4438
 epoch: 64, train_loss: 1.0374, test_loss: 1.0208, test_f1: 0.4530
 epoch: 65, train_loss: 1.0288, test_loss: 1.0302, test_f1: 0.4592
 epoch: 66, train_loss: 1.0391, test_loss: 1.0520, test_f1: 0.4580
 epoch: 67, train_loss: 1.0420, test_loss: 1.0125, test_f1: 0.4710
 epoch: 68, train_loss: 1.0366, test_loss: 1.0235, test_f1: 0.4372
 epoch: 69, train_loss: 1.0354, test_loss: 1.0218, test_f1: 0.4625
 epoch: 70, train_loss: 1.0347, test_loss: 1.0323, test_f1: 0.4666
 epoch: 71, train_loss: 1.0367, test_loss: 1.0181, test_f1: 0.4514
 epoch: 72, train_loss: 1.0335, test_loss: 1.0209, test_f1: 0.4521
 epoch: 73, train_loss: 1.0251, test_loss: 1.0254, test_f1: 0.4563
 epoch: 74, train_loss: 1.0410, test_loss: 1.0094, test_f1: 0.4432
 epoch: 75, train_loss: 1.0254, test_loss: 1.0242, test_f1: 0.4471
 epoch: 76, train_loss: 1.0222, test_loss: 1.0269, test_f1: 0.4412
 epoch: 77, train_loss: 1.0196, test_loss: 1.0103, test_f1: 0.4409
 epoch: 78, train_loss: 1.0269, test_loss: 1.0400, test_f1: 0.4493
 epoch: 79, train_loss: 1.0203, test_loss: 1.0247, test_f1: 0.4496
 epoch: 80, train_loss: 1.0270, test_loss: 1.0251, test_f1: 0.4434
 epoch: 81, train_loss: 1.0167, test_loss: 1.0199, test_f1: 0.4497
 epoch: 82, train_loss: 1.0105, test_loss: 1.0148, test_f1: 0.4502
 epoch: 83, train_loss: 1.0131, test_loss: 1.0183, test_f1: 0.4418
 epoch: 84, train_loss: 1.0178, test_loss: 1.0139, test_f1: 0.4409
 epoch: 85, train_loss: 1.0039, test_loss: 1.0249, test_f1: 0.4588
 epoch: 86, train_loss: 1.0145, test_loss: 1.0071, test_f1: 0.4393
 epoch: 87, train_loss: 1.0088, test_loss: 1.0118, test_f1: 0.4550
 epoch: 88, train_loss: 1.0096, test_loss: 1.0191, test_f1: 0.4464
 epoch: 89, train_loss: 1.0128, test_loss: 1.0032, test_f1: 0.4432
 epoch: 90, train_loss: 1.0167, test_loss: 1.0124, test_f1: 0.4497
 epoch: 91, train_loss: 1.0124, test_loss: 1.0167, test_f1: 0.4440
 epoch: 92, train_loss: 1.0056, test_loss: 1.0229, test_f1: 0.4586
 epoch: 93, train_loss: 1.0165, test_loss: 1.0106, test_f1: 0.4610
 epoch: 94, train_loss: 1.0069, test_loss: 1.0256, test_f1: 0.4465
 epoch: 95, train_loss: 1.0034, test_loss: 1.0082, test_f1: 0.4527
 epoch: 96, train_loss: 1.0028, test_loss: 1.0132, test_f1: 0.4552
 epoch: 97, train_loss: 1.0037, test_loss: 0.9975, test_f1: 0.4509
 epoch: 98, train_loss: 1.0038, test_loss: 1.0224, test_f1: 0.4512
 epoch: 99, train_loss: 1.0071, test_loss: 1.0048, test_f1: 0.4614
##################ITERATION #9 ****************************************
 epoch: 0, train_loss: 1.3643, test_loss: 1.2808, test_f1: 0.2395
 epoch: 1, train_loss: 1.2902, test_loss: 1.2556, test_f1: 0.2294
 epoch: 2, train_loss: 1.2710, test_loss: 1.2364, test_f1: 0.2722
 epoch: 3, train_loss: 1.2465, test_loss: 1.2217, test_f1: 0.2833
 epoch: 4, train_loss: 1.2457, test_loss: 1.2005, test_f1: 0.3396
 epoch: 5, train_loss: 1.2241, test_loss: 1.1914, test_f1: 0.3557
 epoch: 6, train_loss: 1.2298, test_loss: 1.1786, test_f1: 0.3663
 epoch: 7, train_loss: 1.2181, test_loss: 1.1698, test_f1: 0.3654
 epoch: 8, train_loss: 1.2044, test_loss: 1.1643, test_f1: 0.3712
 epoch: 9, train_loss: 1.1943, test_loss: 1.1527, test_f1: 0.3858
 epoch: 10, train_loss: 1.1968, test_loss: 1.1424, test_f1: 0.3903
 epoch: 11, train_loss: 1.1780, test_loss: 1.1413, test_f1: 0.3852
 epoch: 12, train_loss: 1.1787, test_loss: 1.1291, test_f1: 0.3928
 epoch: 13, train_loss: 1.1623, test_loss: 1.1266, test_f1: 0.3898
 epoch: 14, train_loss: 1.1660, test_loss: 1.1145, test_f1: 0.3985
 epoch: 15, train_loss: 1.1541, test_loss: 1.1108, test_f1: 0.4140
 epoch: 16, train_loss: 1.1532, test_loss: 1.1087, test_f1: 0.4089
 epoch: 17, train_loss: 1.1524, test_loss: 1.1044, test_f1: 0.4011
 epoch: 18, train_loss: 1.1431, test_loss: 1.0975, test_f1: 0.4074
 epoch: 19, train_loss: 1.1368, test_loss: 1.1052, test_f1: 0.4183
 epoch: 20, train_loss: 1.1379, test_loss: 1.0968, test_f1: 0.4075
 epoch: 21, train_loss: 1.1421, test_loss: 1.0899, test_f1: 0.4261
 epoch: 22, train_loss: 1.1278, test_loss: 1.0894, test_f1: 0.4217
 epoch: 23, train_loss: 1.1341, test_loss: 1.0826, test_f1: 0.3967
 epoch: 24, train_loss: 1.1177, test_loss: 1.0883, test_f1: 0.4276
 epoch: 25, train_loss: 1.1187, test_loss: 1.0782, test_f1: 0.4308
 epoch: 26, train_loss: 1.1175, test_loss: 1.0706, test_f1: 0.4340
 epoch: 27, train_loss: 1.1163, test_loss: 1.0758, test_f1: 0.4236
 epoch: 28, train_loss: 1.1092, test_loss: 1.0617, test_f1: 0.4207
 epoch: 29, train_loss: 1.1047, test_loss: 1.0570, test_f1: 0.4342
 epoch: 30, train_loss: 1.0978, test_loss: 1.0476, test_f1: 0.4248
 epoch: 31, train_loss: 1.1037, test_loss: 1.0448, test_f1: 0.4335
 epoch: 32, train_loss: 1.0924, test_loss: 1.0559, test_f1: 0.4319
 epoch: 33, train_loss: 1.0973, test_loss: 1.0395, test_f1: 0.4396
 epoch: 34, train_loss: 1.1023, test_loss: 1.0419, test_f1: 0.4300
 epoch: 35, train_loss: 1.0932, test_loss: 1.0448, test_f1: 0.4362
 epoch: 36, train_loss: 1.0879, test_loss: 1.0339, test_f1: 0.4511
 epoch: 37, train_loss: 1.0837, test_loss: 1.0280, test_f1: 0.4508
 epoch: 38, train_loss: 1.0869, test_loss: 1.0276, test_f1: 0.4459
 epoch: 39, train_loss: 1.0854, test_loss: 1.0248, test_f1: 0.4508
 epoch: 40, train_loss: 1.0767, test_loss: 1.0337, test_f1: 0.4345
 epoch: 41, train_loss: 1.0692, test_loss: 1.0296, test_f1: 0.4372
 epoch: 42, train_loss: 1.0643, test_loss: 1.0161, test_f1: 0.4369
 epoch: 43, train_loss: 1.0682, test_loss: 1.0180, test_f1: 0.4411
 epoch: 44, train_loss: 1.0605, test_loss: 1.0193, test_f1: 0.4446
 epoch: 45, train_loss: 1.0585, test_loss: 1.0074, test_f1: 0.4497
 epoch: 46, train_loss: 1.0601, test_loss: 1.0222, test_f1: 0.4403
 epoch: 47, train_loss: 1.0681, test_loss: 1.0116, test_f1: 0.4490
 epoch: 48, train_loss: 1.0597, test_loss: 1.0113, test_f1: 0.4458
 epoch: 49, train_loss: 1.0540, test_loss: 1.0118, test_f1: 0.4479
 epoch: 50, train_loss: 1.0435, test_loss: 1.0153, test_f1: 0.4486
 epoch: 51, train_loss: 1.0540, test_loss: 1.0082, test_f1: 0.4533
 epoch: 52, train_loss: 1.0520, test_loss: 1.0116, test_f1: 0.4511
 epoch: 53, train_loss: 1.0421, test_loss: 1.0038, test_f1: 0.4573
 epoch: 54, train_loss: 1.0521, test_loss: 1.0072, test_f1: 0.4482
 epoch: 55, train_loss: 1.0456, test_loss: 1.0138, test_f1: 0.4381
 epoch: 56, train_loss: 1.0482, test_loss: 1.0213, test_f1: 0.4426
 epoch: 57, train_loss: 1.0338, test_loss: 1.0280, test_f1: 0.4517
 epoch: 58, train_loss: 1.0402, test_loss: 1.0313, test_f1: 0.4351
 epoch: 59, train_loss: 1.0466, test_loss: 1.0268, test_f1: 0.4496
 epoch: 60, train_loss: 1.0350, test_loss: 1.0284, test_f1: 0.4436
 epoch: 61, train_loss: 1.0288, test_loss: 1.0112, test_f1: 0.4479
 epoch: 62, train_loss: 1.0367, test_loss: 1.0141, test_f1: 0.4442
 epoch: 63, train_loss: 1.0431, test_loss: 1.0343, test_f1: 0.4386
 epoch: 64, train_loss: 1.0339, test_loss: 1.0056, test_f1: 0.4508
 epoch: 65, train_loss: 1.0342, test_loss: 1.0144, test_f1: 0.4560
 epoch: 66, train_loss: 1.0380, test_loss: 1.0049, test_f1: 0.4605
 epoch: 67, train_loss: 1.0380, test_loss: 1.0157, test_f1: 0.4337
 epoch: 68, train_loss: 1.0313, test_loss: 1.0154, test_f1: 0.4463
 epoch: 69, train_loss: 1.0214, test_loss: 1.0087, test_f1: 0.4457
 epoch: 70, train_loss: 1.0308, test_loss: 1.0200, test_f1: 0.4341
 epoch: 71, train_loss: 1.0333, test_loss: 1.0213, test_f1: 0.4412
 epoch: 72, train_loss: 1.0236, test_loss: 1.0256, test_f1: 0.4450
 epoch: 73, train_loss: 1.0134, test_loss: 1.0301, test_f1: 0.4327
 epoch: 74, train_loss: 1.0190, test_loss: 1.0153, test_f1: 0.4422
 epoch: 75, train_loss: 1.0236, test_loss: 1.0265, test_f1: 0.4447
 epoch: 76, train_loss: 1.0229, test_loss: 1.0276, test_f1: 0.4461
 epoch: 77, train_loss: 1.0306, test_loss: 1.0103, test_f1: 0.4433
 epoch: 78, train_loss: 1.0347, test_loss: 1.0385, test_f1: 0.4346
 epoch: 79, train_loss: 1.0183, test_loss: 1.0233, test_f1: 0.4397
 epoch: 80, train_loss: 1.0311, test_loss: 1.0060, test_f1: 0.4437
 epoch: 81, train_loss: 1.0183, test_loss: 1.0246, test_f1: 0.4393
 epoch: 82, train_loss: 1.0063, test_loss: 1.0177, test_f1: 0.4466
 epoch: 83, train_loss: 1.0091, test_loss: 1.0122, test_f1: 0.4477
 epoch: 84, train_loss: 1.0079, test_loss: 1.0003, test_f1: 0.4453
 epoch: 85, train_loss: 1.0194, test_loss: 1.0047, test_f1: 0.4502
 epoch: 86, train_loss: 1.0127, test_loss: 1.0037, test_f1: 0.4459
 epoch: 87, train_loss: 1.0117, test_loss: 1.0151, test_f1: 0.4412
 epoch: 88, train_loss: 1.0079, test_loss: 0.9965, test_f1: 0.4595
 epoch: 89, train_loss: 1.0093, test_loss: 1.0174, test_f1: 0.4476
 epoch: 90, train_loss: 1.0177, test_loss: 1.0020, test_f1: 0.4379
 epoch: 91, train_loss: 1.0126, test_loss: 1.0193, test_f1: 0.4515
 epoch: 92, train_loss: 1.0041, test_loss: 1.0002, test_f1: 0.4575
 epoch: 93, train_loss: 1.0079, test_loss: 0.9984, test_f1: 0.4432
 epoch: 94, train_loss: 1.0022, test_loss: 0.9973, test_f1: 0.4549
 epoch: 95, train_loss: 1.0036, test_loss: 1.0357, test_f1: 0.4631
 epoch: 96, train_loss: 1.0000, test_loss: 1.0023, test_f1: 0.4632
 epoch: 97, train_loss: 0.9904, test_loss: 0.9964, test_f1: 0.4517
 epoch: 98, train_loss: 1.0052, test_loss: 1.0086, test_f1: 0.4536
 epoch: 99, train_loss: 0.9977, test_loss: 1.0246, test_f1: 0.4418

Training completed in 1269.07 seconds
Best F1: 0.5278 at epoch 95
Mean F1 across iterations: 0.4914  0.0214
========================FINAL RESULTS================================
FEGIN weighted F1: 0.5278  0.0214
python main.py --data ltspice_examples --representation component_component --model FEGIN --layers 5 --hiddens 32 --batch_size 32 --lr 0.0001 --emb_size 512 --epochs 100 --save_appendix component_component_L5_H32_BS32_LR0.0001_E512 --no_val
-----



STDERR:
  File "main.py", line 370, in <module>
    main()
  File "main.py", line 254, in main
    dataset = dataset_class(
  File "/home/philip/projects/ltspice_examples_code_repo/Circuit-Completion-Using-GNNs/component_classification_with_link_prediction_head/evaluation/FEGIN/kernel/circuit_datasets.py", line 15, in __init__
    self.data, self.slices = torch.load(self.processed_paths[0])
  File "/home/philip/.local/lib/python3.8/site-packages/torch/serialization.py", line 1040, in load
    warnings.warn(
  File "/usr/lib/python3.8/warnings.py", line 109, in _showwarnmsg
    sw(msg.message, msg.category, msg.filename, msg.lineno,
  File "main.py", line 47, in warn_with_traceback
    traceback.print_stack(file=log)
/home/philip/projects/ltspice_examples_code_repo/Circuit-Completion-Using-GNNs/component_classification_with_link_prediction_head/evaluation/FEGIN/kernel/circuit_datasets.py:15: FutureWarning: You are using `torch.load` with `weights_only=False` (the current default value), which uses the default pickle module implicitly. It is possible to construct malicious pickle data which will execute arbitrary code during unpickling (See https://github.com/pytorch/pytorch/blob/main/SECURITY.md#untrusted-models for more details). In a future release, the default value for `weights_only` will be flipped to `True`. This limits the functions that could be executed during unpickling. Arbitrary objects will no longer be allowed to be loaded via this mode unless they are explicitly allowlisted by the user via `torch.serialization.add_safe_globals`. We recommend you start setting `weights_only=True` for any use case where you don't have full control of the loaded file. Please open an issue on GitHub for any issues related to this experimental feature.
  self.data, self.slices = torch.load(self.processed_paths[0])
