STDOUT:
Results will be saved in /home/philip/projects/ltspice_examples_code_repo/Circuit-Completion-Using-GNNs/component_classification_with_link_prediction_head/evaluation/FEGIN/results/model_FEGIN_dataset_ltspice_demos
Command line input: python main.py --data ltspice_demos --representation component_pin_net --model FEGIN --layers 4 --hiddens 16 --batch_size 256 --lr 0.001 --emb_size 128 --epochs 100 --save_appendix component_pin_net_L4_H16_BS256_LR0.001_E128 --no_val
 is saved.
-----
ltspice_demos - FEGIN
Using 4 layers, 16 hidden units, h = 2
Loading component_pin_net representation dataset
ENTERED
Training FEGIN on component_pin_net representation
Train: 1565, Test: 383
##################ITERATION #0 ****************************************
 epoch: 0, train_loss: 1.4598, test_loss: 1.4423, test_f1: 0.0507
 epoch: 1, train_loss: 1.4429, test_loss: 1.4350, test_f1: 0.0507
 epoch: 2, train_loss: 1.4280, test_loss: 1.4256, test_f1: 0.0507
 epoch: 3, train_loss: 1.4143, test_loss: 1.4102, test_f1: 0.0507
 epoch: 4, train_loss: 1.3951, test_loss: 1.3941, test_f1: 0.1818
 epoch: 5, train_loss: 1.3757, test_loss: 1.3784, test_f1: 0.1512
 epoch: 6, train_loss: 1.3528, test_loss: 1.3617, test_f1: 0.1572
 epoch: 7, train_loss: 1.3243, test_loss: 1.3423, test_f1: 0.1606
 epoch: 8, train_loss: 1.2979, test_loss: 1.3230, test_f1: 0.1365
 epoch: 9, train_loss: 1.2766, test_loss: 1.3068, test_f1: 0.1365
 epoch: 10, train_loss: 1.2607, test_loss: 1.2967, test_f1: 0.1365
 epoch: 11, train_loss: 1.2446, test_loss: 1.2866, test_f1: 0.1365
 epoch: 12, train_loss: 1.2319, test_loss: 1.2729, test_f1: 0.1368
 epoch: 13, train_loss: 1.2116, test_loss: 1.2627, test_f1: 0.1385
 epoch: 14, train_loss: 1.1996, test_loss: 1.2522, test_f1: 0.1500
 epoch: 15, train_loss: 1.1838, test_loss: 1.2461, test_f1: 0.2447
 epoch: 16, train_loss: 1.1804, test_loss: 1.2384, test_f1: 0.3448
 epoch: 17, train_loss: 1.1647, test_loss: 1.2299, test_f1: 0.3462
 epoch: 18, train_loss: 1.1591, test_loss: 1.2199, test_f1: 0.3523
 epoch: 19, train_loss: 1.1516, test_loss: 1.2148, test_f1: 0.3593
 epoch: 20, train_loss: 1.1398, test_loss: 1.2170, test_f1: 0.3424
 epoch: 21, train_loss: 1.1349, test_loss: 1.2168, test_f1: 0.3425
 epoch: 22, train_loss: 1.1260, test_loss: 1.2107, test_f1: 0.3490
 epoch: 23, train_loss: 1.1165, test_loss: 1.2091, test_f1: 0.3955
 epoch: 24, train_loss: 1.1159, test_loss: 1.2010, test_f1: 0.4350
 epoch: 25, train_loss: 1.1048, test_loss: 1.1995, test_f1: 0.4537
 epoch: 26, train_loss: 1.1054, test_loss: 1.2013, test_f1: 0.4864
 epoch: 27, train_loss: 1.1051, test_loss: 1.2259, test_f1: 0.4133
 epoch: 28, train_loss: 1.0926, test_loss: 1.1949, test_f1: 0.4374
 epoch: 29, train_loss: 1.0978, test_loss: 1.1803, test_f1: 0.4142
 epoch: 30, train_loss: 1.0886, test_loss: 1.2049, test_f1: 0.4394
 epoch: 31, train_loss: 1.0853, test_loss: 1.1811, test_f1: 0.4394
 epoch: 32, train_loss: 1.0844, test_loss: 1.1772, test_f1: 0.4239
 epoch: 33, train_loss: 1.0713, test_loss: 1.1834, test_f1: 0.4351
 epoch: 34, train_loss: 1.0696, test_loss: 1.1896, test_f1: 0.4418
 epoch: 35, train_loss: 1.0646, test_loss: 1.2052, test_f1: 0.4581
 epoch: 36, train_loss: 1.0535, test_loss: 1.1836, test_f1: 0.4370
 epoch: 37, train_loss: 1.0616, test_loss: 1.1725, test_f1: 0.4363
 epoch: 38, train_loss: 1.0583, test_loss: 1.2365, test_f1: 0.4433
 epoch: 39, train_loss: 1.0518, test_loss: 1.2242, test_f1: 0.4511
 epoch: 40, train_loss: 1.0552, test_loss: 1.1653, test_f1: 0.4384
 epoch: 41, train_loss: 1.0486, test_loss: 1.1565, test_f1: 0.4390
 epoch: 42, train_loss: 1.0440, test_loss: 1.1520, test_f1: 0.4430
 epoch: 43, train_loss: 1.0354, test_loss: 1.1627, test_f1: 0.4216
 epoch: 44, train_loss: 1.0366, test_loss: 1.1542, test_f1: 0.4290
 epoch: 45, train_loss: 1.0267, test_loss: 1.1606, test_f1: 0.4439
 epoch: 46, train_loss: 1.0148, test_loss: 1.1553, test_f1: 0.4471
 epoch: 47, train_loss: 1.0172, test_loss: 1.1512, test_f1: 0.4482
 epoch: 48, train_loss: 1.0179, test_loss: 1.1543, test_f1: 0.4427
 epoch: 49, train_loss: 1.0105, test_loss: 1.1450, test_f1: 0.4437
 epoch: 50, train_loss: 1.0014, test_loss: 1.1619, test_f1: 0.4457
 epoch: 51, train_loss: 1.0014, test_loss: 1.1446, test_f1: 0.4459
 epoch: 52, train_loss: 1.0065, test_loss: 1.1489, test_f1: 0.4444
 epoch: 53, train_loss: 0.9993, test_loss: 1.1370, test_f1: 0.4444
 epoch: 54, train_loss: 0.9903, test_loss: 1.1227, test_f1: 0.4411
 epoch: 55, train_loss: 0.9853, test_loss: 1.1222, test_f1: 0.4425
 epoch: 56, train_loss: 0.9864, test_loss: 1.1222, test_f1: 0.4441
 epoch: 57, train_loss: 0.9947, test_loss: 1.1547, test_f1: 0.4499
 epoch: 58, train_loss: 0.9858, test_loss: 1.1362, test_f1: 0.4419
 epoch: 59, train_loss: 0.9853, test_loss: 1.1272, test_f1: 0.4419
 epoch: 60, train_loss: 0.9771, test_loss: 1.1219, test_f1: 0.4418
 epoch: 61, train_loss: 0.9794, test_loss: 1.1166, test_f1: 0.4414
 epoch: 62, train_loss: 0.9844, test_loss: 1.1114, test_f1: 0.4395
 epoch: 63, train_loss: 0.9705, test_loss: 1.1381, test_f1: 0.4495
 epoch: 64, train_loss: 0.9711, test_loss: 1.1326, test_f1: 0.4546
 epoch: 65, train_loss: 0.9662, test_loss: 1.1235, test_f1: 0.4535
 epoch: 66, train_loss: 0.9732, test_loss: 1.1260, test_f1: 0.4537
 epoch: 67, train_loss: 0.9658, test_loss: 1.1242, test_f1: 0.4453
 epoch: 68, train_loss: 0.9669, test_loss: 1.1148, test_f1: 0.4414
 epoch: 69, train_loss: 0.9667, test_loss: 1.1233, test_f1: 0.4471
 epoch: 70, train_loss: 0.9610, test_loss: 1.1251, test_f1: 0.4471
 epoch: 71, train_loss: 0.9510, test_loss: 1.1224, test_f1: 0.4496
 epoch: 72, train_loss: 0.9541, test_loss: 1.1270, test_f1: 0.4419
 epoch: 73, train_loss: 0.9475, test_loss: 1.1343, test_f1: 0.4661
 epoch: 74, train_loss: 0.9520, test_loss: 1.1282, test_f1: 0.4620
 epoch: 75, train_loss: 0.9538, test_loss: 1.1180, test_f1: 0.4620
 epoch: 76, train_loss: 0.9480, test_loss: 1.1243, test_f1: 0.4581
 epoch: 77, train_loss: 0.9504, test_loss: 1.1101, test_f1: 0.4570
 epoch: 78, train_loss: 0.9497, test_loss: 1.1183, test_f1: 0.4535
 epoch: 79, train_loss: 0.9485, test_loss: 1.1324, test_f1: 0.4404
 epoch: 80, train_loss: 0.9520, test_loss: 1.1161, test_f1: 0.4516
 epoch: 81, train_loss: 0.9395, test_loss: 1.1150, test_f1: 0.4536
 epoch: 82, train_loss: 0.9446, test_loss: 1.1395, test_f1: 0.4458
 epoch: 83, train_loss: 0.9340, test_loss: 1.1568, test_f1: 0.4514
 epoch: 84, train_loss: 0.9434, test_loss: 1.1250, test_f1: 0.4482
 epoch: 85, train_loss: 0.9443, test_loss: 1.1248, test_f1: 0.4618
 epoch: 86, train_loss: 0.9448, test_loss: 1.1233, test_f1: 0.4459
 epoch: 87, train_loss: 0.9354, test_loss: 1.1123, test_f1: 0.4616
 epoch: 88, train_loss: 0.9337, test_loss: 1.1063, test_f1: 0.4819
 epoch: 89, train_loss: 0.9408, test_loss: 1.1336, test_f1: 0.4783
 epoch: 90, train_loss: 0.9290, test_loss: 1.1291, test_f1: 0.4639
 epoch: 91, train_loss: 0.9264, test_loss: 1.1277, test_f1: 0.4600
 epoch: 92, train_loss: 0.9372, test_loss: 1.1390, test_f1: 0.4650
 epoch: 93, train_loss: 0.9316, test_loss: 1.1421, test_f1: 0.4582
 epoch: 94, train_loss: 0.9332, test_loss: 1.1231, test_f1: 0.4483
 epoch: 95, train_loss: 0.9132, test_loss: 1.1528, test_f1: 0.4529
 epoch: 96, train_loss: 0.9248, test_loss: 1.1208, test_f1: 0.4434
 epoch: 97, train_loss: 0.9318, test_loss: 1.1422, test_f1: 0.4501
 epoch: 98, train_loss: 0.9200, test_loss: 1.1432, test_f1: 0.4631
 epoch: 99, train_loss: 0.9199, test_loss: 1.1469, test_f1: 0.4730
##################ITERATION #1 ****************************************
 epoch: 0, train_loss: 1.4375, test_loss: 1.4297, test_f1: 0.0301
 epoch: 1, train_loss: 1.3680, test_loss: 1.4046, test_f1: 0.0301
 epoch: 2, train_loss: 1.3194, test_loss: 1.3665, test_f1: 0.2281
 epoch: 3, train_loss: 1.2743, test_loss: 1.3346, test_f1: 0.2281
 epoch: 4, train_loss: 1.2327, test_loss: 1.3136, test_f1: 0.2281
 epoch: 5, train_loss: 1.2059, test_loss: 1.2983, test_f1: 0.2281
 epoch: 6, train_loss: 1.1786, test_loss: 1.2769, test_f1: 0.2583
 epoch: 7, train_loss: 1.1599, test_loss: 1.2557, test_f1: 0.2720
 epoch: 8, train_loss: 1.1457, test_loss: 1.2526, test_f1: 0.3232
 epoch: 9, train_loss: 1.1373, test_loss: 1.2422, test_f1: 0.3540
 epoch: 10, train_loss: 1.1320, test_loss: 1.2266, test_f1: 0.4106
 epoch: 11, train_loss: 1.1222, test_loss: 1.1991, test_f1: 0.4162
 epoch: 12, train_loss: 1.1201, test_loss: 1.1937, test_f1: 0.4334
 epoch: 13, train_loss: 1.1190, test_loss: 1.1904, test_f1: 0.4327
 epoch: 14, train_loss: 1.1097, test_loss: 1.1843, test_f1: 0.4346
 epoch: 15, train_loss: 1.1004, test_loss: 1.1919, test_f1: 0.4340
 epoch: 16, train_loss: 1.1003, test_loss: 1.2049, test_f1: 0.4360
 epoch: 17, train_loss: 1.0996, test_loss: 1.2060, test_f1: 0.4360
 epoch: 18, train_loss: 1.0920, test_loss: 1.1884, test_f1: 0.4329
 epoch: 19, train_loss: 1.0904, test_loss: 1.1984, test_f1: 0.4346
 epoch: 20, train_loss: 1.0860, test_loss: 1.2272, test_f1: 0.4308
 epoch: 21, train_loss: 1.0742, test_loss: 1.2187, test_f1: 0.4241
 epoch: 22, train_loss: 1.0702, test_loss: 1.2045, test_f1: 0.4253
 epoch: 23, train_loss: 1.0639, test_loss: 1.1923, test_f1: 0.4247
 epoch: 24, train_loss: 1.0586, test_loss: 1.1850, test_f1: 0.4204
 epoch: 25, train_loss: 1.0535, test_loss: 1.1768, test_f1: 0.4337
 epoch: 26, train_loss: 1.0512, test_loss: 1.1641, test_f1: 0.4111
 epoch: 27, train_loss: 1.0508, test_loss: 1.1574, test_f1: 0.4156
 epoch: 28, train_loss: 1.0411, test_loss: 1.1623, test_f1: 0.4135
 epoch: 29, train_loss: 1.0292, test_loss: 1.1645, test_f1: 0.4195
 epoch: 30, train_loss: 1.0350, test_loss: 1.1643, test_f1: 0.4321
 epoch: 31, train_loss: 1.0252, test_loss: 1.1710, test_f1: 0.4285
 epoch: 32, train_loss: 1.0261, test_loss: 1.1805, test_f1: 0.4303
 epoch: 33, train_loss: 1.0092, test_loss: 1.1574, test_f1: 0.4260
 epoch: 34, train_loss: 1.0073, test_loss: 1.1524, test_f1: 0.4340
 epoch: 35, train_loss: 1.0105, test_loss: 1.1708, test_f1: 0.4341
 epoch: 36, train_loss: 1.0168, test_loss: 1.1625, test_f1: 0.4142
 epoch: 37, train_loss: 1.0099, test_loss: 1.1619, test_f1: 0.4245
 epoch: 38, train_loss: 0.9940, test_loss: 1.1497, test_f1: 0.4248
 epoch: 39, train_loss: 1.0043, test_loss: 1.1602, test_f1: 0.4221
 epoch: 40, train_loss: 1.0075, test_loss: 1.1454, test_f1: 0.4333
 epoch: 41, train_loss: 1.0021, test_loss: 1.1582, test_f1: 0.4285
 epoch: 42, train_loss: 1.0263, test_loss: 1.2113, test_f1: 0.4342
 epoch: 43, train_loss: 1.0348, test_loss: 1.2077, test_f1: 0.4328
 epoch: 44, train_loss: 1.0213, test_loss: 1.1817, test_f1: 0.4334
 epoch: 45, train_loss: 1.0131, test_loss: 1.1339, test_f1: 0.4329
 epoch: 46, train_loss: 1.0048, test_loss: 1.1459, test_f1: 0.4304
 epoch: 47, train_loss: 0.9961, test_loss: 1.1391, test_f1: 0.4298
 epoch: 48, train_loss: 1.0009, test_loss: 1.1370, test_f1: 0.4329
 epoch: 49, train_loss: 0.9850, test_loss: 1.1312, test_f1: 0.4239
 epoch: 50, train_loss: 0.9854, test_loss: 1.1195, test_f1: 0.4210
 epoch: 51, train_loss: 0.9782, test_loss: 1.1182, test_f1: 0.4210
 epoch: 52, train_loss: 0.9833, test_loss: 1.1227, test_f1: 0.4208
 epoch: 53, train_loss: 0.9824, test_loss: 1.1383, test_f1: 0.4239
 epoch: 54, train_loss: 0.9839, test_loss: 1.1516, test_f1: 0.4239
 epoch: 55, train_loss: 0.9801, test_loss: 1.1510, test_f1: 0.4239
 epoch: 56, train_loss: 0.9836, test_loss: 1.1418, test_f1: 0.4218
 epoch: 57, train_loss: 0.9763, test_loss: 1.1352, test_f1: 0.4158
 epoch: 58, train_loss: 0.9752, test_loss: 1.1429, test_f1: 0.4241
 epoch: 59, train_loss: 0.9714, test_loss: 1.1305, test_f1: 0.4193
 epoch: 60, train_loss: 0.9706, test_loss: 1.1358, test_f1: 0.4210
 epoch: 61, train_loss: 0.9595, test_loss: 1.1510, test_f1: 0.4275
 epoch: 62, train_loss: 0.9733, test_loss: 1.1627, test_f1: 0.4275
 epoch: 63, train_loss: 0.9703, test_loss: 1.1344, test_f1: 0.4130
 epoch: 64, train_loss: 0.9620, test_loss: 1.1373, test_f1: 0.4125
 epoch: 65, train_loss: 0.9608, test_loss: 1.1474, test_f1: 0.4170
 epoch: 66, train_loss: 0.9592, test_loss: 1.1282, test_f1: 0.4079
 epoch: 67, train_loss: 0.9656, test_loss: 1.1397, test_f1: 0.4176
 epoch: 68, train_loss: 0.9680, test_loss: 1.1402, test_f1: 0.4165
 epoch: 69, train_loss: 0.9620, test_loss: 1.1394, test_f1: 0.4156
 epoch: 70, train_loss: 0.9712, test_loss: 1.1359, test_f1: 0.4080
 epoch: 71, train_loss: 0.9608, test_loss: 1.1428, test_f1: 0.4095
 epoch: 72, train_loss: 0.9654, test_loss: 1.1467, test_f1: 0.4170
 epoch: 73, train_loss: 0.9564, test_loss: 1.1430, test_f1: 0.4162
 epoch: 74, train_loss: 0.9561, test_loss: 1.1493, test_f1: 0.4126
 epoch: 75, train_loss: 0.9480, test_loss: 1.1404, test_f1: 0.4053
 epoch: 76, train_loss: 0.9598, test_loss: 1.1522, test_f1: 0.4108
 epoch: 77, train_loss: 0.9621, test_loss: 1.1617, test_f1: 0.4293
 epoch: 78, train_loss: 0.9518, test_loss: 1.1481, test_f1: 0.4230
 epoch: 79, train_loss: 0.9630, test_loss: 1.1398, test_f1: 0.4173
 epoch: 80, train_loss: 0.9473, test_loss: 1.1411, test_f1: 0.4178
 epoch: 81, train_loss: 0.9617, test_loss: 1.1621, test_f1: 0.4178
 epoch: 82, train_loss: 0.9564, test_loss: 1.1625, test_f1: 0.4007
 epoch: 83, train_loss: 0.9594, test_loss: 1.1593, test_f1: 0.4025
 epoch: 84, train_loss: 0.9555, test_loss: 1.1513, test_f1: 0.4127
 epoch: 85, train_loss: 0.9474, test_loss: 1.1493, test_f1: 0.4102
 epoch: 86, train_loss: 0.9505, test_loss: 1.1522, test_f1: 0.4084
 epoch: 87, train_loss: 0.9505, test_loss: 1.1609, test_f1: 0.4183
 epoch: 88, train_loss: 0.9424, test_loss: 1.1666, test_f1: 0.4161
 epoch: 89, train_loss: 0.9534, test_loss: 1.1687, test_f1: 0.4189
 epoch: 90, train_loss: 0.9542, test_loss: 1.1523, test_f1: 0.4170
 epoch: 91, train_loss: 0.9454, test_loss: 1.1469, test_f1: 0.4182
 epoch: 92, train_loss: 0.9336, test_loss: 1.1400, test_f1: 0.4214
 epoch: 93, train_loss: 0.9368, test_loss: 1.1474, test_f1: 0.4389
 epoch: 94, train_loss: 0.9427, test_loss: 1.1580, test_f1: 0.4369
 epoch: 95, train_loss: 0.9476, test_loss: 1.1654, test_f1: 0.4196
 epoch: 96, train_loss: 0.9462, test_loss: 1.1585, test_f1: 0.4343
 epoch: 97, train_loss: 0.9455, test_loss: 1.1686, test_f1: 0.4382
 epoch: 98, train_loss: 0.9406, test_loss: 1.1690, test_f1: 0.4381
 epoch: 99, train_loss: 0.9363, test_loss: 1.1731, test_f1: 0.4510
##################ITERATION #2 ****************************************
 epoch: 0, train_loss: 1.3665, test_loss: 1.3856, test_f1: 0.2344
 epoch: 1, train_loss: 1.2764, test_loss: 1.3632, test_f1: 0.2281
 epoch: 2, train_loss: 1.2389, test_loss: 1.3492, test_f1: 0.2281
 epoch: 3, train_loss: 1.2058, test_loss: 1.3334, test_f1: 0.2281
 epoch: 4, train_loss: 1.1825, test_loss: 1.3099, test_f1: 0.2441
 epoch: 5, train_loss: 1.1707, test_loss: 1.2854, test_f1: 0.2862
 epoch: 6, train_loss: 1.1561, test_loss: 1.2687, test_f1: 0.3000
 epoch: 7, train_loss: 1.1332, test_loss: 1.2407, test_f1: 0.3097
 epoch: 8, train_loss: 1.1169, test_loss: 1.2213, test_f1: 0.3123
 epoch: 9, train_loss: 1.1183, test_loss: 1.2003, test_f1: 0.3212
 epoch: 10, train_loss: 1.1070, test_loss: 1.1845, test_f1: 0.3327
 epoch: 11, train_loss: 1.1026, test_loss: 1.1673, test_f1: 0.3362
 epoch: 12, train_loss: 1.0916, test_loss: 1.1613, test_f1: 0.3288
 epoch: 13, train_loss: 1.0764, test_loss: 1.1576, test_f1: 0.3845
 epoch: 14, train_loss: 1.0777, test_loss: 1.1473, test_f1: 0.4034
 epoch: 15, train_loss: 1.0706, test_loss: 1.1554, test_f1: 0.4039
 epoch: 16, train_loss: 1.0758, test_loss: 1.1553, test_f1: 0.3951
 epoch: 17, train_loss: 1.0614, test_loss: 1.1352, test_f1: 0.4346
 epoch: 18, train_loss: 1.0585, test_loss: 1.1211, test_f1: 0.4250
 epoch: 19, train_loss: 1.0493, test_loss: 1.1124, test_f1: 0.4263
 epoch: 20, train_loss: 1.0481, test_loss: 1.1195, test_f1: 0.4093
 epoch: 21, train_loss: 1.0514, test_loss: 1.1084, test_f1: 0.4309
 epoch: 22, train_loss: 1.0391, test_loss: 1.1161, test_f1: 0.4258
 epoch: 23, train_loss: 1.0332, test_loss: 1.1079, test_f1: 0.4282
 epoch: 24, train_loss: 1.0293, test_loss: 1.1334, test_f1: 0.4322
 epoch: 25, train_loss: 1.0291, test_loss: 1.1001, test_f1: 0.4232
 epoch: 26, train_loss: 1.0120, test_loss: 1.1022, test_f1: 0.4302
 epoch: 27, train_loss: 1.0200, test_loss: 1.0928, test_f1: 0.4275
 epoch: 28, train_loss: 1.0130, test_loss: 1.1057, test_f1: 0.4180
 epoch: 29, train_loss: 1.0085, test_loss: 1.1152, test_f1: 0.3965
 epoch: 30, train_loss: 1.0129, test_loss: 1.1353, test_f1: 0.3861
 epoch: 31, train_loss: 1.0044, test_loss: 1.1196, test_f1: 0.4373
 epoch: 32, train_loss: 0.9947, test_loss: 1.0936, test_f1: 0.4287
 epoch: 33, train_loss: 0.9973, test_loss: 1.1068, test_f1: 0.4264
 epoch: 34, train_loss: 0.9971, test_loss: 1.1130, test_f1: 0.4305
 epoch: 35, train_loss: 0.9922, test_loss: 1.1065, test_f1: 0.4036
 epoch: 36, train_loss: 0.9906, test_loss: 1.1009, test_f1: 0.3857
 epoch: 37, train_loss: 0.9799, test_loss: 1.1075, test_f1: 0.4099
 epoch: 38, train_loss: 0.9823, test_loss: 1.1246, test_f1: 0.4305
 epoch: 39, train_loss: 0.9832, test_loss: 1.1271, test_f1: 0.4173
 epoch: 40, train_loss: 0.9722, test_loss: 1.1031, test_f1: 0.4429
 epoch: 41, train_loss: 0.9808, test_loss: 1.0626, test_f1: 0.4326
 epoch: 42, train_loss: 0.9772, test_loss: 1.1822, test_f1: 0.4372
 epoch: 43, train_loss: 0.9713, test_loss: 1.1245, test_f1: 0.4214
 epoch: 44, train_loss: 0.9664, test_loss: 1.1445, test_f1: 0.4261
 epoch: 45, train_loss: 0.9547, test_loss: 1.0863, test_f1: 0.3994
 epoch: 46, train_loss: 0.9668, test_loss: 1.1028, test_f1: 0.4115
 epoch: 47, train_loss: 0.9523, test_loss: 1.0876, test_f1: 0.3951
 epoch: 48, train_loss: 0.9590, test_loss: 1.1617, test_f1: 0.4292
 epoch: 49, train_loss: 0.9670, test_loss: 1.1304, test_f1: 0.4245
 epoch: 50, train_loss: 0.9553, test_loss: 1.0975, test_f1: 0.4199
 epoch: 51, train_loss: 0.9499, test_loss: 1.0659, test_f1: 0.4091
 epoch: 52, train_loss: 0.9487, test_loss: 1.0848, test_f1: 0.4251
 epoch: 53, train_loss: 0.9425, test_loss: 1.1190, test_f1: 0.4366
 epoch: 54, train_loss: 0.9389, test_loss: 1.1140, test_f1: 0.4340
 epoch: 55, train_loss: 0.9338, test_loss: 1.1202, test_f1: 0.4237
 epoch: 56, train_loss: 0.9439, test_loss: 1.1408, test_f1: 0.4327
 epoch: 57, train_loss: 0.9390, test_loss: 1.1091, test_f1: 0.4317
 epoch: 58, train_loss: 0.9415, test_loss: 1.1020, test_f1: 0.4158
 epoch: 59, train_loss: 0.9329, test_loss: 1.1091, test_f1: 0.4344
 epoch: 60, train_loss: 0.9355, test_loss: 1.0757, test_f1: 0.4083
 epoch: 61, train_loss: 0.9259, test_loss: 1.0934, test_f1: 0.4020
 epoch: 62, train_loss: 0.9313, test_loss: 1.1090, test_f1: 0.4288
 epoch: 63, train_loss: 0.9277, test_loss: 1.1024, test_f1: 0.4286
 epoch: 64, train_loss: 0.9208, test_loss: 1.1169, test_f1: 0.3981
 epoch: 65, train_loss: 0.9291, test_loss: 1.1444, test_f1: 0.4282
 epoch: 66, train_loss: 0.9365, test_loss: 1.0971, test_f1: 0.4148
 epoch: 67, train_loss: 0.9309, test_loss: 1.1385, test_f1: 0.4512
 epoch: 68, train_loss: 0.9348, test_loss: 1.1024, test_f1: 0.4486
 epoch: 69, train_loss: 0.9292, test_loss: 1.1085, test_f1: 0.4487
 epoch: 70, train_loss: 0.9330, test_loss: 1.1123, test_f1: 0.4400
 epoch: 71, train_loss: 0.9314, test_loss: 1.0764, test_f1: 0.4479
 epoch: 72, train_loss: 0.9217, test_loss: 1.0984, test_f1: 0.4742
 epoch: 73, train_loss: 0.9211, test_loss: 1.0985, test_f1: 0.4661
 epoch: 74, train_loss: 0.9290, test_loss: 1.0921, test_f1: 0.4705
 epoch: 75, train_loss: 0.9218, test_loss: 1.1221, test_f1: 0.4777
 epoch: 76, train_loss: 0.9233, test_loss: 1.1199, test_f1: 0.4592
 epoch: 77, train_loss: 0.9270, test_loss: 1.0726, test_f1: 0.4647
 epoch: 78, train_loss: 0.9345, test_loss: 1.0815, test_f1: 0.4523
 epoch: 79, train_loss: 0.9450, test_loss: 1.0932, test_f1: 0.4554
 epoch: 80, train_loss: 0.9464, test_loss: 1.1213, test_f1: 0.4840
 epoch: 81, train_loss: 0.9289, test_loss: 1.1556, test_f1: 0.4838
 epoch: 82, train_loss: 0.9298, test_loss: 1.1321, test_f1: 0.4739
 epoch: 83, train_loss: 0.9257, test_loss: 1.0845, test_f1: 0.4779
 epoch: 84, train_loss: 0.9229, test_loss: 1.0899, test_f1: 0.4753
 epoch: 85, train_loss: 0.9192, test_loss: 1.1157, test_f1: 0.4752
 epoch: 86, train_loss: 0.9199, test_loss: 1.1121, test_f1: 0.5008
 epoch: 87, train_loss: 0.9151, test_loss: 1.0926, test_f1: 0.4926
 epoch: 88, train_loss: 0.9318, test_loss: 1.0731, test_f1: 0.4749
 epoch: 89, train_loss: 0.9185, test_loss: 1.0713, test_f1: 0.4754
 epoch: 90, train_loss: 0.9084, test_loss: 1.1104, test_f1: 0.4612
 epoch: 91, train_loss: 0.9138, test_loss: 1.1007, test_f1: 0.4637
 epoch: 92, train_loss: 0.9104, test_loss: 1.0969, test_f1: 0.4715
 epoch: 93, train_loss: 0.9086, test_loss: 1.0982, test_f1: 0.4786
 epoch: 94, train_loss: 0.9022, test_loss: 1.0929, test_f1: 0.4870
 epoch: 95, train_loss: 0.9073, test_loss: 1.1145, test_f1: 0.4942
 epoch: 96, train_loss: 0.8965, test_loss: 1.1226, test_f1: 0.5048
 epoch: 97, train_loss: 0.9098, test_loss: 1.0849, test_f1: 0.5131
 epoch: 98, train_loss: 0.9100, test_loss: 1.1048, test_f1: 0.5149
 epoch: 99, train_loss: 0.9029, test_loss: 1.1037, test_f1: 0.5126
##################ITERATION #3 ****************************************
 epoch: 0, train_loss: 1.3026, test_loss: 1.3219, test_f1: 0.2281
 epoch: 1, train_loss: 1.2311, test_loss: 1.3088, test_f1: 0.2281
 epoch: 2, train_loss: 1.2148, test_loss: 1.3002, test_f1: 0.2281
 epoch: 3, train_loss: 1.1844, test_loss: 1.2922, test_f1: 0.2281
 epoch: 4, train_loss: 1.1724, test_loss: 1.2829, test_f1: 0.2281
 epoch: 5, train_loss: 1.1542, test_loss: 1.2678, test_f1: 0.2281
 epoch: 6, train_loss: 1.1360, test_loss: 1.2534, test_f1: 0.2281
 epoch: 7, train_loss: 1.1308, test_loss: 1.2341, test_f1: 0.2720
 epoch: 8, train_loss: 1.1253, test_loss: 1.2117, test_f1: 0.3432
 epoch: 9, train_loss: 1.1086, test_loss: 1.1947, test_f1: 0.4107
 epoch: 10, train_loss: 1.0970, test_loss: 1.1786, test_f1: 0.4236
 epoch: 11, train_loss: 1.0984, test_loss: 1.1639, test_f1: 0.4410
 epoch: 12, train_loss: 1.1007, test_loss: 1.1508, test_f1: 0.4460
 epoch: 13, train_loss: 1.0847, test_loss: 1.1464, test_f1: 0.4238
 epoch: 14, train_loss: 1.0755, test_loss: 1.1505, test_f1: 0.4214
 epoch: 15, train_loss: 1.0690, test_loss: 1.1444, test_f1: 0.4453
 epoch: 16, train_loss: 1.0571, test_loss: 1.1361, test_f1: 0.4615
 epoch: 17, train_loss: 1.0446, test_loss: 1.1385, test_f1: 0.4433
 epoch: 18, train_loss: 1.0456, test_loss: 1.1406, test_f1: 0.4417
 epoch: 19, train_loss: 1.0279, test_loss: 1.1285, test_f1: 0.4536
 epoch: 20, train_loss: 1.0285, test_loss: 1.1205, test_f1: 0.4518
 epoch: 21, train_loss: 1.0165, test_loss: 1.1223, test_f1: 0.4444
 epoch: 22, train_loss: 1.0115, test_loss: 1.1511, test_f1: 0.4444
 epoch: 23, train_loss: 1.0127, test_loss: 1.1535, test_f1: 0.4394
 epoch: 24, train_loss: 1.0086, test_loss: 1.1280, test_f1: 0.4350
 epoch: 25, train_loss: 0.9946, test_loss: 1.1030, test_f1: 0.4550
 epoch: 26, train_loss: 0.9885, test_loss: 1.1020, test_f1: 0.4507
 epoch: 27, train_loss: 0.9909, test_loss: 1.1008, test_f1: 0.4400
 epoch: 28, train_loss: 0.9814, test_loss: 1.1124, test_f1: 0.4389
 epoch: 29, train_loss: 0.9877, test_loss: 1.1616, test_f1: 0.4374
 epoch: 30, train_loss: 0.9924, test_loss: 1.1259, test_f1: 0.4491
 epoch: 31, train_loss: 0.9851, test_loss: 1.1142, test_f1: 0.4509
 epoch: 32, train_loss: 0.9775, test_loss: 1.1122, test_f1: 0.4560
 epoch: 33, train_loss: 0.9714, test_loss: 1.1211, test_f1: 0.4524
 epoch: 34, train_loss: 0.9703, test_loss: 1.1148, test_f1: 0.4506
 epoch: 35, train_loss: 0.9672, test_loss: 1.1097, test_f1: 0.4613
 epoch: 36, train_loss: 0.9707, test_loss: 1.1002, test_f1: 0.4696
 epoch: 37, train_loss: 0.9677, test_loss: 1.1152, test_f1: 0.4603
 epoch: 38, train_loss: 0.9534, test_loss: 1.0753, test_f1: 0.4625
 epoch: 39, train_loss: 0.9552, test_loss: 1.0734, test_f1: 0.4691
 epoch: 40, train_loss: 0.9479, test_loss: 1.0846, test_f1: 0.4505
 epoch: 41, train_loss: 0.9559, test_loss: 1.0881, test_f1: 0.4609
 epoch: 42, train_loss: 0.9566, test_loss: 1.0844, test_f1: 0.4673
 epoch: 43, train_loss: 0.9434, test_loss: 1.0658, test_f1: 0.4735
 epoch: 44, train_loss: 0.9298, test_loss: 1.0667, test_f1: 0.4743
 epoch: 45, train_loss: 0.9284, test_loss: 1.0658, test_f1: 0.4705
 epoch: 46, train_loss: 0.9301, test_loss: 1.0689, test_f1: 0.4682
 epoch: 47, train_loss: 0.9247, test_loss: 1.0670, test_f1: 0.4761
 epoch: 48, train_loss: 0.9238, test_loss: 1.0844, test_f1: 0.4735
 epoch: 49, train_loss: 0.9428, test_loss: 1.0840, test_f1: 0.4457
 epoch: 50, train_loss: 0.9383, test_loss: 1.1080, test_f1: 0.4264
 epoch: 51, train_loss: 0.9175, test_loss: 1.0950, test_f1: 0.4686
 epoch: 52, train_loss: 0.9103, test_loss: 1.0902, test_f1: 0.4908
 epoch: 53, train_loss: 0.9129, test_loss: 1.0897, test_f1: 0.4947
 epoch: 54, train_loss: 0.9092, test_loss: 1.0776, test_f1: 0.4943
 epoch: 55, train_loss: 0.9232, test_loss: 1.0772, test_f1: 0.4849
 epoch: 56, train_loss: 0.9064, test_loss: 1.0939, test_f1: 0.4739
 epoch: 57, train_loss: 0.9025, test_loss: 1.0857, test_f1: 0.4786
 epoch: 58, train_loss: 0.9019, test_loss: 1.0890, test_f1: 0.4748
 epoch: 59, train_loss: 0.9086, test_loss: 1.0903, test_f1: 0.4744
 epoch: 60, train_loss: 0.9055, test_loss: 1.0999, test_f1: 0.4709
 epoch: 61, train_loss: 0.9037, test_loss: 1.0880, test_f1: 0.4556
 epoch: 62, train_loss: 0.9127, test_loss: 1.0941, test_f1: 0.4497
 epoch: 63, train_loss: 0.9171, test_loss: 1.0854, test_f1: 0.4493
 epoch: 64, train_loss: 0.9135, test_loss: 1.0775, test_f1: 0.4645
 epoch: 65, train_loss: 0.9028, test_loss: 1.0780, test_f1: 0.4659
 epoch: 66, train_loss: 0.8937, test_loss: 1.0923, test_f1: 0.4761
 epoch: 67, train_loss: 0.9074, test_loss: 1.1011, test_f1: 0.4708
 epoch: 68, train_loss: 0.9010, test_loss: 1.0799, test_f1: 0.4745
 epoch: 69, train_loss: 0.8951, test_loss: 1.0746, test_f1: 0.4817
 epoch: 70, train_loss: 0.8987, test_loss: 1.0841, test_f1: 0.4836
 epoch: 71, train_loss: 0.8950, test_loss: 1.0797, test_f1: 0.4862
 epoch: 72, train_loss: 0.8887, test_loss: 1.0864, test_f1: 0.4827
 epoch: 73, train_loss: 0.8848, test_loss: 1.0914, test_f1: 0.4808
 epoch: 74, train_loss: 0.9060, test_loss: 1.0806, test_f1: 0.4604
 epoch: 75, train_loss: 0.8969, test_loss: 1.1075, test_f1: 0.4671
 epoch: 76, train_loss: 0.8840, test_loss: 1.1151, test_f1: 0.4782
 epoch: 77, train_loss: 0.8889, test_loss: 1.1018, test_f1: 0.4753
 epoch: 78, train_loss: 0.8868, test_loss: 1.0938, test_f1: 0.4807
 epoch: 79, train_loss: 0.8887, test_loss: 1.0876, test_f1: 0.4996
 epoch: 80, train_loss: 0.8805, test_loss: 1.0856, test_f1: 0.5025
 epoch: 81, train_loss: 0.8782, test_loss: 1.1028, test_f1: 0.5075
 epoch: 82, train_loss: 0.8810, test_loss: 1.0999, test_f1: 0.5179
 epoch: 83, train_loss: 0.8738, test_loss: 1.0734, test_f1: 0.5074
 epoch: 84, train_loss: 0.8747, test_loss: 1.0675, test_f1: 0.5329
 epoch: 85, train_loss: 0.8753, test_loss: 1.0645, test_f1: 0.5310
 epoch: 86, train_loss: 0.8662, test_loss: 1.0601, test_f1: 0.5237
 epoch: 87, train_loss: 0.8776, test_loss: 1.0557, test_f1: 0.5132
 epoch: 88, train_loss: 0.8610, test_loss: 1.0694, test_f1: 0.5307
 epoch: 89, train_loss: 0.8792, test_loss: 1.0667, test_f1: 0.5438
 epoch: 90, train_loss: 0.8713, test_loss: 1.0688, test_f1: 0.5362
 epoch: 91, train_loss: 0.8726, test_loss: 1.0508, test_f1: 0.5281
 epoch: 92, train_loss: 0.8677, test_loss: 1.0472, test_f1: 0.5431
 epoch: 93, train_loss: 0.8785, test_loss: 1.0457, test_f1: 0.5367
 epoch: 94, train_loss: 0.8652, test_loss: 1.0388, test_f1: 0.5305
 epoch: 95, train_loss: 0.8620, test_loss: 1.0654, test_f1: 0.5362
 epoch: 96, train_loss: 0.8688, test_loss: 1.1272, test_f1: 0.5277
 epoch: 97, train_loss: 0.8678, test_loss: 1.1032, test_f1: 0.5317
 epoch: 98, train_loss: 0.8635, test_loss: 1.0839, test_f1: 0.5291
 epoch: 99, train_loss: 0.8678, test_loss: 1.0687, test_f1: 0.5426
##################ITERATION #4 ****************************************
 epoch: 0, train_loss: 1.2757, test_loss: 1.3205, test_f1: 0.2281
 epoch: 1, train_loss: 1.1990, test_loss: 1.3070, test_f1: 0.2281
 epoch: 2, train_loss: 1.1814, test_loss: 1.3020, test_f1: 0.2281
 epoch: 3, train_loss: 1.1625, test_loss: 1.3057, test_f1: 0.2281
 epoch: 4, train_loss: 1.1500, test_loss: 1.3141, test_f1: 0.2281
 epoch: 5, train_loss: 1.1439, test_loss: 1.2993, test_f1: 0.2281
 epoch: 6, train_loss: 1.1386, test_loss: 1.2788, test_f1: 0.2281
 epoch: 7, train_loss: 1.1281, test_loss: 1.2518, test_f1: 0.2583
 epoch: 8, train_loss: 1.1178, test_loss: 1.2300, test_f1: 0.2692
 epoch: 9, train_loss: 1.1089, test_loss: 1.2035, test_f1: 0.3515
 epoch: 10, train_loss: 1.0985, test_loss: 1.1809, test_f1: 0.3675
 epoch: 11, train_loss: 1.0975, test_loss: 1.1738, test_f1: 0.3952
 epoch: 12, train_loss: 1.0810, test_loss: 1.1715, test_f1: 0.4414
 epoch: 13, train_loss: 1.0719, test_loss: 1.1704, test_f1: 0.4393
 epoch: 14, train_loss: 1.0833, test_loss: 1.1675, test_f1: 0.4374
 epoch: 15, train_loss: 1.0575, test_loss: 1.1515, test_f1: 0.4334
 epoch: 16, train_loss: 1.0543, test_loss: 1.1481, test_f1: 0.4345
 epoch: 17, train_loss: 1.0534, test_loss: 1.1662, test_f1: 0.4295
 epoch: 18, train_loss: 1.0526, test_loss: 1.1601, test_f1: 0.4314
 epoch: 19, train_loss: 1.0427, test_loss: 1.1323, test_f1: 0.4414
 epoch: 20, train_loss: 1.0432, test_loss: 1.1324, test_f1: 0.4292
 epoch: 21, train_loss: 1.0306, test_loss: 1.1373, test_f1: 0.4348
 epoch: 22, train_loss: 1.0307, test_loss: 1.1330, test_f1: 0.4382
 epoch: 23, train_loss: 1.0167, test_loss: 1.1349, test_f1: 0.4383
 epoch: 24, train_loss: 1.0288, test_loss: 1.1340, test_f1: 0.4394
 epoch: 25, train_loss: 1.0242, test_loss: 1.1165, test_f1: 0.4317
 epoch: 26, train_loss: 1.0244, test_loss: 1.1096, test_f1: 0.4337
 epoch: 27, train_loss: 1.0149, test_loss: 1.1149, test_f1: 0.4318
 epoch: 28, train_loss: 1.0051, test_loss: 1.1215, test_f1: 0.4275
 epoch: 29, train_loss: 1.0185, test_loss: 1.1138, test_f1: 0.4174
 epoch: 30, train_loss: 1.0084, test_loss: 1.1208, test_f1: 0.4256
 epoch: 31, train_loss: 0.9979, test_loss: 1.1154, test_f1: 0.4314
 epoch: 32, train_loss: 1.0016, test_loss: 1.1096, test_f1: 0.4309
 epoch: 33, train_loss: 1.0065, test_loss: 1.1031, test_f1: 0.4332
 epoch: 34, train_loss: 1.0058, test_loss: 1.0976, test_f1: 0.4369
 epoch: 35, train_loss: 1.0035, test_loss: 1.1021, test_f1: 0.4422
 epoch: 36, train_loss: 0.9867, test_loss: 1.1153, test_f1: 0.4374
 epoch: 37, train_loss: 0.9929, test_loss: 1.1054, test_f1: 0.4289
 epoch: 38, train_loss: 0.9865, test_loss: 1.1049, test_f1: 0.4297
 epoch: 39, train_loss: 0.9899, test_loss: 1.1202, test_f1: 0.4284
 epoch: 40, train_loss: 0.9821, test_loss: 1.0979, test_f1: 0.4345
 epoch: 41, train_loss: 0.9894, test_loss: 1.1007, test_f1: 0.4111
 epoch: 42, train_loss: 0.9861, test_loss: 1.1000, test_f1: 0.4350
 epoch: 43, train_loss: 0.9921, test_loss: 1.0987, test_f1: 0.4311
 epoch: 44, train_loss: 0.9695, test_loss: 1.1004, test_f1: 0.4365
 epoch: 45, train_loss: 0.9822, test_loss: 1.0995, test_f1: 0.4007
 epoch: 46, train_loss: 0.9762, test_loss: 1.1074, test_f1: 0.3685
 epoch: 47, train_loss: 0.9799, test_loss: 1.0932, test_f1: 0.3760
 epoch: 48, train_loss: 0.9812, test_loss: 1.0936, test_f1: 0.4022
 epoch: 49, train_loss: 0.9698, test_loss: 1.1147, test_f1: 0.4312
 epoch: 50, train_loss: 0.9641, test_loss: 1.1108, test_f1: 0.4332
 epoch: 51, train_loss: 0.9588, test_loss: 1.1153, test_f1: 0.4304
 epoch: 52, train_loss: 0.9605, test_loss: 1.1076, test_f1: 0.4309
 epoch: 53, train_loss: 0.9652, test_loss: 1.0879, test_f1: 0.4179
 epoch: 54, train_loss: 0.9628, test_loss: 1.0981, test_f1: 0.4164
 epoch: 55, train_loss: 0.9544, test_loss: 1.1129, test_f1: 0.4291
 epoch: 56, train_loss: 0.9528, test_loss: 1.1249, test_f1: 0.4012
 epoch: 57, train_loss: 0.9534, test_loss: 1.0974, test_f1: 0.4171
 epoch: 58, train_loss: 0.9500, test_loss: 1.0901, test_f1: 0.4323
 epoch: 59, train_loss: 0.9552, test_loss: 1.1024, test_f1: 0.4322
 epoch: 60, train_loss: 0.9583, test_loss: 1.0998, test_f1: 0.4303
 epoch: 61, train_loss: 0.9500, test_loss: 1.1231, test_f1: 0.4326
 epoch: 62, train_loss: 0.9574, test_loss: 1.1116, test_f1: 0.4070
 epoch: 63, train_loss: 0.9579, test_loss: 1.0966, test_f1: 0.3924
 epoch: 64, train_loss: 0.9566, test_loss: 1.1652, test_f1: 0.3738
 epoch: 65, train_loss: 0.9484, test_loss: 1.1170, test_f1: 0.4111
 epoch: 66, train_loss: 0.9482, test_loss: 1.1108, test_f1: 0.3940
 epoch: 67, train_loss: 0.9463, test_loss: 1.0944, test_f1: 0.4236
 epoch: 68, train_loss: 0.9432, test_loss: 1.1110, test_f1: 0.4343
 epoch: 69, train_loss: 0.9414, test_loss: 1.1107, test_f1: 0.3875
 epoch: 70, train_loss: 0.9395, test_loss: 1.1043, test_f1: 0.4121
 epoch: 71, train_loss: 0.9383, test_loss: 1.1387, test_f1: 0.4135
 epoch: 72, train_loss: 0.9370, test_loss: 1.1241, test_f1: 0.4237
 epoch: 73, train_loss: 0.9306, test_loss: 1.0898, test_f1: 0.4369
 epoch: 74, train_loss: 0.9454, test_loss: 1.0906, test_f1: 0.4341
 epoch: 75, train_loss: 0.9301, test_loss: 1.1087, test_f1: 0.4325
 epoch: 76, train_loss: 0.9515, test_loss: 1.0969, test_f1: 0.4272
 epoch: 77, train_loss: 0.9306, test_loss: 1.0871, test_f1: 0.4215
 epoch: 78, train_loss: 0.9252, test_loss: 1.0746, test_f1: 0.4013
 epoch: 79, train_loss: 0.9280, test_loss: 1.0754, test_f1: 0.4066
 epoch: 80, train_loss: 0.9239, test_loss: 1.0914, test_f1: 0.4360
 epoch: 81, train_loss: 0.9234, test_loss: 1.0741, test_f1: 0.4123
 epoch: 82, train_loss: 0.9295, test_loss: 1.0893, test_f1: 0.4128
 epoch: 83, train_loss: 0.9242, test_loss: 1.0803, test_f1: 0.4138
 epoch: 84, train_loss: 0.9269, test_loss: 1.1876, test_f1: 0.3657
 epoch: 85, train_loss: 0.9203, test_loss: 1.1157, test_f1: 0.4166
 epoch: 86, train_loss: 0.9256, test_loss: 1.0869, test_f1: 0.4261
 epoch: 87, train_loss: 0.9161, test_loss: 1.1135, test_f1: 0.4211
 epoch: 88, train_loss: 0.9235, test_loss: 1.0953, test_f1: 0.4397
 epoch: 89, train_loss: 0.9179, test_loss: 1.1381, test_f1: 0.4182
 epoch: 90, train_loss: 0.9358, test_loss: 1.2585, test_f1: 0.3994
 epoch: 91, train_loss: 0.9315, test_loss: 1.1025, test_f1: 0.4370
 epoch: 92, train_loss: 0.9169, test_loss: 1.0832, test_f1: 0.4277
 epoch: 93, train_loss: 0.9248, test_loss: 1.0720, test_f1: 0.4051
 epoch: 94, train_loss: 0.9200, test_loss: 1.0938, test_f1: 0.4021
 epoch: 95, train_loss: 0.9193, test_loss: 1.1325, test_f1: 0.4242
 epoch: 96, train_loss: 0.9332, test_loss: 1.1021, test_f1: 0.4173
 epoch: 97, train_loss: 0.9043, test_loss: 1.0669, test_f1: 0.4496
 epoch: 98, train_loss: 0.9038, test_loss: 1.0672, test_f1: 0.4694
 epoch: 99, train_loss: 0.9096, test_loss: 1.0842, test_f1: 0.4769
##################ITERATION #5 ****************************************
 epoch: 0, train_loss: 1.2930, test_loss: 1.3172, test_f1: 0.2281
 epoch: 1, train_loss: 1.2018, test_loss: 1.3162, test_f1: 0.2281
 epoch: 2, train_loss: 1.1726, test_loss: 1.2992, test_f1: 0.2281
 epoch: 3, train_loss: 1.1429, test_loss: 1.2902, test_f1: 0.2281
 epoch: 4, train_loss: 1.1368, test_loss: 1.2721, test_f1: 0.2281
 epoch: 5, train_loss: 1.1212, test_loss: 1.2402, test_f1: 0.3111
 epoch: 6, train_loss: 1.1109, test_loss: 1.2109, test_f1: 0.3063
 epoch: 7, train_loss: 1.1006, test_loss: 1.1803, test_f1: 0.3243
 epoch: 8, train_loss: 1.0941, test_loss: 1.1653, test_f1: 0.3588
 epoch: 9, train_loss: 1.0845, test_loss: 1.1487, test_f1: 0.3731
 epoch: 10, train_loss: 1.0687, test_loss: 1.1352, test_f1: 0.3767
 epoch: 11, train_loss: 1.0628, test_loss: 1.1286, test_f1: 0.3763
 epoch: 12, train_loss: 1.0526, test_loss: 1.1225, test_f1: 0.3713
 epoch: 13, train_loss: 1.0665, test_loss: 1.1286, test_f1: 0.3669
 epoch: 14, train_loss: 1.0483, test_loss: 1.1316, test_f1: 0.3726
 epoch: 15, train_loss: 1.0457, test_loss: 1.1337, test_f1: 0.3781
 epoch: 16, train_loss: 1.0439, test_loss: 1.1218, test_f1: 0.3822
 epoch: 17, train_loss: 1.0382, test_loss: 1.1194, test_f1: 0.3822
 epoch: 18, train_loss: 1.0305, test_loss: 1.1193, test_f1: 0.3794
 epoch: 19, train_loss: 1.0236, test_loss: 1.1178, test_f1: 0.3959
 epoch: 20, train_loss: 1.0235, test_loss: 1.1282, test_f1: 0.3940
 epoch: 21, train_loss: 1.0294, test_loss: 1.1207, test_f1: 0.3836
 epoch: 22, train_loss: 1.0176, test_loss: 1.1189, test_f1: 0.3439
 epoch: 23, train_loss: 1.0173, test_loss: 1.0996, test_f1: 0.3785
 epoch: 24, train_loss: 1.0112, test_loss: 1.1133, test_f1: 0.3836
 epoch: 25, train_loss: 0.9990, test_loss: 1.0998, test_f1: 0.3995
 epoch: 26, train_loss: 1.0071, test_loss: 1.1008, test_f1: 0.4066
 epoch: 27, train_loss: 0.9936, test_loss: 1.1024, test_f1: 0.4302
 epoch: 28, train_loss: 0.9902, test_loss: 1.0969, test_f1: 0.4302
 epoch: 29, train_loss: 0.9824, test_loss: 1.0915, test_f1: 0.4375
 epoch: 30, train_loss: 0.9964, test_loss: 1.0964, test_f1: 0.4319
 epoch: 31, train_loss: 0.9933, test_loss: 1.0981, test_f1: 0.3811
 epoch: 32, train_loss: 0.9969, test_loss: 1.0891, test_f1: 0.3692
 epoch: 33, train_loss: 0.9889, test_loss: 1.0856, test_f1: 0.3669
 epoch: 34, train_loss: 0.9784, test_loss: 1.0762, test_f1: 0.3701
 epoch: 35, train_loss: 0.9875, test_loss: 1.0769, test_f1: 0.4175
 epoch: 36, train_loss: 0.9728, test_loss: 1.0970, test_f1: 0.4339
 epoch: 37, train_loss: 0.9722, test_loss: 1.1311, test_f1: 0.4249
 epoch: 38, train_loss: 0.9772, test_loss: 1.0805, test_f1: 0.4113
 epoch: 39, train_loss: 0.9721, test_loss: 1.0697, test_f1: 0.4153
 epoch: 40, train_loss: 0.9668, test_loss: 1.0692, test_f1: 0.4285
 epoch: 41, train_loss: 0.9729, test_loss: 1.0680, test_f1: 0.4250
 epoch: 42, train_loss: 0.9601, test_loss: 1.0996, test_f1: 0.4590
 epoch: 43, train_loss: 0.9516, test_loss: 1.1070, test_f1: 0.4598
 epoch: 44, train_loss: 0.9535, test_loss: 1.0633, test_f1: 0.4625
 epoch: 45, train_loss: 0.9550, test_loss: 1.0791, test_f1: 0.4519
 epoch: 46, train_loss: 0.9598, test_loss: 1.0750, test_f1: 0.4502
 epoch: 47, train_loss: 0.9463, test_loss: 1.0612, test_f1: 0.4570
 epoch: 48, train_loss: 0.9423, test_loss: 1.0563, test_f1: 0.4599
 epoch: 49, train_loss: 0.9426, test_loss: 1.0625, test_f1: 0.4599
 epoch: 50, train_loss: 0.9477, test_loss: 1.0933, test_f1: 0.4505
 epoch: 51, train_loss: 0.9293, test_loss: 1.0984, test_f1: 0.4555
 epoch: 52, train_loss: 0.9371, test_loss: 1.0784, test_f1: 0.4609
 epoch: 53, train_loss: 0.9389, test_loss: 1.0674, test_f1: 0.4662
 epoch: 54, train_loss: 0.9338, test_loss: 1.0714, test_f1: 0.4656
 epoch: 55, train_loss: 0.9225, test_loss: 1.0783, test_f1: 0.4688
 epoch: 56, train_loss: 0.9364, test_loss: 1.0767, test_f1: 0.4690
 epoch: 57, train_loss: 0.9329, test_loss: 1.0758, test_f1: 0.4682
 epoch: 58, train_loss: 0.9377, test_loss: 1.0725, test_f1: 0.4583
 epoch: 59, train_loss: 0.9310, test_loss: 1.0707, test_f1: 0.4823
 epoch: 60, train_loss: 0.9315, test_loss: 1.0541, test_f1: 0.4778
 epoch: 61, train_loss: 0.9285, test_loss: 1.0578, test_f1: 0.4915
 epoch: 62, train_loss: 0.9379, test_loss: 1.0569, test_f1: 0.4869
 epoch: 63, train_loss: 0.9293, test_loss: 1.0596, test_f1: 0.4832
 epoch: 64, train_loss: 0.9242, test_loss: 1.0782, test_f1: 0.4979
 epoch: 65, train_loss: 0.9307, test_loss: 1.0698, test_f1: 0.4903
 epoch: 66, train_loss: 0.9166, test_loss: 1.1093, test_f1: 0.5037
 epoch: 67, train_loss: 0.9233, test_loss: 1.0745, test_f1: 0.5003
 epoch: 68, train_loss: 0.9191, test_loss: 1.0483, test_f1: 0.5024
 epoch: 69, train_loss: 0.9188, test_loss: 1.0626, test_f1: 0.4685
 epoch: 70, train_loss: 0.9164, test_loss: 1.0730, test_f1: 0.5039
 epoch: 71, train_loss: 0.9198, test_loss: 1.0683, test_f1: 0.5061
 epoch: 72, train_loss: 0.9194, test_loss: 1.0543, test_f1: 0.5156
 epoch: 73, train_loss: 0.9214, test_loss: 1.0839, test_f1: 0.5110
 epoch: 74, train_loss: 0.9185, test_loss: 1.0994, test_f1: 0.5186
 epoch: 75, train_loss: 0.9162, test_loss: 1.0630, test_f1: 0.5111
 epoch: 76, train_loss: 0.9080, test_loss: 1.0717, test_f1: 0.5000
 epoch: 77, train_loss: 0.9121, test_loss: 1.0957, test_f1: 0.4891
 epoch: 78, train_loss: 0.9230, test_loss: 1.0927, test_f1: 0.4996
 epoch: 79, train_loss: 0.9138, test_loss: 1.0878, test_f1: 0.4943
 epoch: 80, train_loss: 0.9094, test_loss: 1.0831, test_f1: 0.4889
 epoch: 81, train_loss: 0.9201, test_loss: 1.0847, test_f1: 0.5191
 epoch: 82, train_loss: 0.9136, test_loss: 1.0557, test_f1: 0.5017
 epoch: 83, train_loss: 0.9203, test_loss: 1.0878, test_f1: 0.4954
 epoch: 84, train_loss: 0.9137, test_loss: 1.0909, test_f1: 0.4991
 epoch: 85, train_loss: 0.9076, test_loss: 1.0681, test_f1: 0.5211
 epoch: 86, train_loss: 0.9116, test_loss: 1.0870, test_f1: 0.5241
 epoch: 87, train_loss: 0.9158, test_loss: 1.0687, test_f1: 0.5264
 epoch: 88, train_loss: 0.8988, test_loss: 1.0581, test_f1: 0.5274
 epoch: 89, train_loss: 0.9132, test_loss: 1.0802, test_f1: 0.5282
 epoch: 90, train_loss: 0.9012, test_loss: 1.0613, test_f1: 0.5101
 epoch: 91, train_loss: 0.9016, test_loss: 1.0587, test_f1: 0.5237
 epoch: 92, train_loss: 0.8956, test_loss: 1.0878, test_f1: 0.5040
 epoch: 93, train_loss: 0.9046, test_loss: 1.1027, test_f1: 0.4987
 epoch: 94, train_loss: 0.9051, test_loss: 1.0817, test_f1: 0.5197
 epoch: 95, train_loss: 0.9116, test_loss: 1.0669, test_f1: 0.5210
 epoch: 96, train_loss: 0.9034, test_loss: 1.0668, test_f1: 0.5206
 epoch: 97, train_loss: 0.8958, test_loss: 1.0803, test_f1: 0.5212
 epoch: 98, train_loss: 0.8914, test_loss: 1.0520, test_f1: 0.5341
 epoch: 99, train_loss: 0.9023, test_loss: 1.0621, test_f1: 0.5413
##################ITERATION #6 ****************************************
 epoch: 0, train_loss: 1.3810, test_loss: 1.3612, test_f1: 0.2281
 epoch: 1, train_loss: 1.2043, test_loss: 1.3280, test_f1: 0.2281
 epoch: 2, train_loss: 1.1471, test_loss: 1.3046, test_f1: 0.2281
 epoch: 3, train_loss: 1.1104, test_loss: 1.3136, test_f1: 0.2281
 epoch: 4, train_loss: 1.0936, test_loss: 1.3807, test_f1: 0.2281
 epoch: 5, train_loss: 1.0743, test_loss: 1.4275, test_f1: 0.2390
 epoch: 6, train_loss: 1.0641, test_loss: 1.4075, test_f1: 0.2917
 epoch: 7, train_loss: 1.0616, test_loss: 1.3317, test_f1: 0.3644
 epoch: 8, train_loss: 1.0441, test_loss: 1.2403, test_f1: 0.3609
 epoch: 9, train_loss: 1.0356, test_loss: 1.1920, test_f1: 0.3959
 epoch: 10, train_loss: 1.0353, test_loss: 1.1540, test_f1: 0.3821
 epoch: 11, train_loss: 1.0231, test_loss: 1.1231, test_f1: 0.4288
 epoch: 12, train_loss: 1.0188, test_loss: 1.1022, test_f1: 0.4015
 epoch: 13, train_loss: 1.0159, test_loss: 1.1070, test_f1: 0.3830
 epoch: 14, train_loss: 1.0175, test_loss: 1.1099, test_f1: 0.3824
 epoch: 15, train_loss: 1.0082, test_loss: 1.0837, test_f1: 0.3786
 epoch: 16, train_loss: 1.0020, test_loss: 1.0887, test_f1: 0.4002
 epoch: 17, train_loss: 0.9916, test_loss: 1.0996, test_f1: 0.4025
 epoch: 18, train_loss: 0.9920, test_loss: 1.1158, test_f1: 0.4362
 epoch: 19, train_loss: 0.9928, test_loss: 1.1223, test_f1: 0.4555
 epoch: 20, train_loss: 0.9863, test_loss: 1.1057, test_f1: 0.4553
 epoch: 21, train_loss: 0.9872, test_loss: 1.0754, test_f1: 0.4309
 epoch: 22, train_loss: 0.9938, test_loss: 1.0747, test_f1: 0.4479
 epoch: 23, train_loss: 0.9773, test_loss: 1.0855, test_f1: 0.4475
 epoch: 24, train_loss: 0.9753, test_loss: 1.0823, test_f1: 0.4236
 epoch: 25, train_loss: 0.9809, test_loss: 1.0767, test_f1: 0.4399
 epoch: 26, train_loss: 0.9755, test_loss: 1.0647, test_f1: 0.4463
 epoch: 27, train_loss: 0.9725, test_loss: 1.0536, test_f1: 0.4430
 epoch: 28, train_loss: 0.9767, test_loss: 1.0626, test_f1: 0.4589
 epoch: 29, train_loss: 0.9646, test_loss: 1.0541, test_f1: 0.4361
 epoch: 30, train_loss: 0.9603, test_loss: 1.0805, test_f1: 0.4440
 epoch: 31, train_loss: 0.9550, test_loss: 1.0721, test_f1: 0.4515
 epoch: 32, train_loss: 0.9618, test_loss: 1.0771, test_f1: 0.4512
 epoch: 33, train_loss: 0.9540, test_loss: 1.1261, test_f1: 0.4611
 epoch: 34, train_loss: 0.9503, test_loss: 1.0745, test_f1: 0.4557
 epoch: 35, train_loss: 0.9591, test_loss: 1.0495, test_f1: 0.4654
 epoch: 36, train_loss: 0.9563, test_loss: 1.0896, test_f1: 0.4721
 epoch: 37, train_loss: 0.9552, test_loss: 1.1171, test_f1: 0.4779
 epoch: 38, train_loss: 0.9457, test_loss: 1.0708, test_f1: 0.4646
 epoch: 39, train_loss: 0.9493, test_loss: 1.0730, test_f1: 0.4980
 epoch: 40, train_loss: 0.9336, test_loss: 1.0788, test_f1: 0.4847
 epoch: 41, train_loss: 0.9420, test_loss: 1.0548, test_f1: 0.4860
 epoch: 42, train_loss: 0.9373, test_loss: 1.0454, test_f1: 0.4949
 epoch: 43, train_loss: 0.9310, test_loss: 1.0330, test_f1: 0.5042
 epoch: 44, train_loss: 0.9351, test_loss: 1.0848, test_f1: 0.5053
 epoch: 45, train_loss: 0.9391, test_loss: 1.0830, test_f1: 0.5028
 epoch: 46, train_loss: 0.9278, test_loss: 1.0478, test_f1: 0.4862
 epoch: 47, train_loss: 0.9391, test_loss: 1.0654, test_f1: 0.4884
 epoch: 48, train_loss: 0.9275, test_loss: 1.0833, test_f1: 0.4862
 epoch: 49, train_loss: 0.9273, test_loss: 1.0490, test_f1: 0.5023
 epoch: 50, train_loss: 0.9237, test_loss: 1.0460, test_f1: 0.5029
 epoch: 51, train_loss: 0.9224, test_loss: 1.0593, test_f1: 0.5184
 epoch: 52, train_loss: 0.9253, test_loss: 1.0355, test_f1: 0.5220
 epoch: 53, train_loss: 0.9237, test_loss: 1.0399, test_f1: 0.5296
 epoch: 54, train_loss: 0.9197, test_loss: 1.0642, test_f1: 0.5378
 epoch: 55, train_loss: 0.9140, test_loss: 1.0553, test_f1: 0.5211
 epoch: 56, train_loss: 0.9139, test_loss: 1.0395, test_f1: 0.4981
 epoch: 57, train_loss: 0.9125, test_loss: 1.0285, test_f1: 0.5024
 epoch: 58, train_loss: 0.9105, test_loss: 1.0354, test_f1: 0.5015
 epoch: 59, train_loss: 0.9191, test_loss: 1.0496, test_f1: 0.5077
 epoch: 60, train_loss: 0.9066, test_loss: 1.0255, test_f1: 0.5185
 epoch: 61, train_loss: 0.9100, test_loss: 1.0242, test_f1: 0.5281
 epoch: 62, train_loss: 0.8966, test_loss: 1.0367, test_f1: 0.5119
 epoch: 63, train_loss: 0.9137, test_loss: 1.0345, test_f1: 0.5130
 epoch: 64, train_loss: 0.9012, test_loss: 1.0340, test_f1: 0.5164
 epoch: 65, train_loss: 0.9063, test_loss: 1.0435, test_f1: 0.5425
 epoch: 66, train_loss: 0.9095, test_loss: 1.0702, test_f1: 0.5451
 epoch: 67, train_loss: 0.8932, test_loss: 1.0416, test_f1: 0.5327
 epoch: 68, train_loss: 0.9141, test_loss: 1.0326, test_f1: 0.5144
 epoch: 69, train_loss: 0.9022, test_loss: 1.0213, test_f1: 0.5136
 epoch: 70, train_loss: 0.8937, test_loss: 1.0396, test_f1: 0.5019
 epoch: 71, train_loss: 0.9072, test_loss: 1.0264, test_f1: 0.5115
 epoch: 72, train_loss: 0.9013, test_loss: 1.0273, test_f1: 0.5103
 epoch: 73, train_loss: 0.8968, test_loss: 1.0213, test_f1: 0.5331
 epoch: 74, train_loss: 0.9002, test_loss: 1.0338, test_f1: 0.5336
 epoch: 75, train_loss: 0.8891, test_loss: 1.0408, test_f1: 0.5259
 epoch: 76, train_loss: 0.9030, test_loss: 1.0114, test_f1: 0.5414
 epoch: 77, train_loss: 0.8945, test_loss: 1.0240, test_f1: 0.5417
 epoch: 78, train_loss: 0.8915, test_loss: 1.0425, test_f1: 0.5217
 epoch: 79, train_loss: 0.8843, test_loss: 1.0474, test_f1: 0.5197
 epoch: 80, train_loss: 0.8787, test_loss: 1.0434, test_f1: 0.5200
 epoch: 81, train_loss: 0.8919, test_loss: 1.0360, test_f1: 0.5296
 epoch: 82, train_loss: 0.8957, test_loss: 1.0207, test_f1: 0.5045
 epoch: 83, train_loss: 0.9017, test_loss: 1.0591, test_f1: 0.5124
 epoch: 84, train_loss: 0.8956, test_loss: 1.0765, test_f1: 0.5227
 epoch: 85, train_loss: 0.8871, test_loss: 1.0539, test_f1: 0.5344
 epoch: 86, train_loss: 0.8899, test_loss: 1.0502, test_f1: 0.5358
 epoch: 87, train_loss: 0.8861, test_loss: 1.0418, test_f1: 0.5404
 epoch: 88, train_loss: 0.8912, test_loss: 1.0573, test_f1: 0.5327
 epoch: 89, train_loss: 0.8925, test_loss: 1.0298, test_f1: 0.5533
 epoch: 90, train_loss: 0.8832, test_loss: 1.0286, test_f1: 0.5456
 epoch: 91, train_loss: 0.8829, test_loss: 1.0324, test_f1: 0.5491
 epoch: 92, train_loss: 0.8904, test_loss: 1.0178, test_f1: 0.5514
 epoch: 93, train_loss: 0.8877, test_loss: 1.0293, test_f1: 0.5422
 epoch: 94, train_loss: 0.8816, test_loss: 1.0220, test_f1: 0.5327
 epoch: 95, train_loss: 0.8898, test_loss: 1.0436, test_f1: 0.5713
 epoch: 96, train_loss: 0.8849, test_loss: 1.0505, test_f1: 0.5572
 epoch: 97, train_loss: 0.8878, test_loss: 1.0520, test_f1: 0.5402
 epoch: 98, train_loss: 0.8838, test_loss: 1.0198, test_f1: 0.5565
 epoch: 99, train_loss: 0.8850, test_loss: 1.0383, test_f1: 0.5385
##################ITERATION #7 ****************************************
 epoch: 0, train_loss: 1.2697, test_loss: 1.3186, test_f1: 0.2281
 epoch: 1, train_loss: 1.1774, test_loss: 1.3214, test_f1: 0.2281
 epoch: 2, train_loss: 1.1505, test_loss: 1.3380, test_f1: 0.2281
 epoch: 3, train_loss: 1.1241, test_loss: 1.3574, test_f1: 0.2281
 epoch: 4, train_loss: 1.1078, test_loss: 1.3776, test_f1: 0.2281
 epoch: 5, train_loss: 1.0999, test_loss: 1.3888, test_f1: 0.3167
 epoch: 6, train_loss: 1.0728, test_loss: 1.3699, test_f1: 0.3125
 epoch: 7, train_loss: 1.0621, test_loss: 1.3217, test_f1: 0.3106
 epoch: 8, train_loss: 1.0509, test_loss: 1.2661, test_f1: 0.3633
 epoch: 9, train_loss: 1.0432, test_loss: 1.2100, test_f1: 0.3853
 epoch: 10, train_loss: 1.0354, test_loss: 1.1558, test_f1: 0.4241
 epoch: 11, train_loss: 1.0351, test_loss: 1.1275, test_f1: 0.4331
 epoch: 12, train_loss: 1.0275, test_loss: 1.1247, test_f1: 0.4253
 epoch: 13, train_loss: 1.0066, test_loss: 1.1143, test_f1: 0.4255
 epoch: 14, train_loss: 1.0120, test_loss: 1.1056, test_f1: 0.4353
 epoch: 15, train_loss: 0.9993, test_loss: 1.0923, test_f1: 0.4406
 epoch: 16, train_loss: 0.9943, test_loss: 1.0832, test_f1: 0.4321
 epoch: 17, train_loss: 0.9958, test_loss: 1.0855, test_f1: 0.4408
 epoch: 18, train_loss: 0.9784, test_loss: 1.0763, test_f1: 0.4469
 epoch: 19, train_loss: 0.9840, test_loss: 1.0812, test_f1: 0.4338
 epoch: 20, train_loss: 0.9787, test_loss: 1.0756, test_f1: 0.4361
 epoch: 21, train_loss: 0.9684, test_loss: 1.0790, test_f1: 0.4383
 epoch: 22, train_loss: 0.9705, test_loss: 1.0870, test_f1: 0.4392
 epoch: 23, train_loss: 0.9628, test_loss: 1.0897, test_f1: 0.4407
 epoch: 24, train_loss: 0.9576, test_loss: 1.0865, test_f1: 0.4374
 epoch: 25, train_loss: 0.9592, test_loss: 1.0800, test_f1: 0.4205
 epoch: 26, train_loss: 0.9556, test_loss: 1.0744, test_f1: 0.4445
 epoch: 27, train_loss: 0.9477, test_loss: 1.0778, test_f1: 0.4374
 epoch: 28, train_loss: 0.9507, test_loss: 1.0811, test_f1: 0.4384
 epoch: 29, train_loss: 0.9524, test_loss: 1.0740, test_f1: 0.4397
 epoch: 30, train_loss: 0.9444, test_loss: 1.0559, test_f1: 0.4515
 epoch: 31, train_loss: 0.9374, test_loss: 1.0548, test_f1: 0.4419
 epoch: 32, train_loss: 0.9294, test_loss: 1.0472, test_f1: 0.4443
 epoch: 33, train_loss: 0.9409, test_loss: 1.0435, test_f1: 0.4500
 epoch: 34, train_loss: 0.9247, test_loss: 1.0572, test_f1: 0.4502
 epoch: 35, train_loss: 0.9383, test_loss: 1.0748, test_f1: 0.4454
 epoch: 36, train_loss: 0.9299, test_loss: 1.0674, test_f1: 0.4376
 epoch: 37, train_loss: 0.9248, test_loss: 1.0323, test_f1: 0.4735
 epoch: 38, train_loss: 0.9199, test_loss: 1.0294, test_f1: 0.4878
 epoch: 39, train_loss: 0.9243, test_loss: 1.0365, test_f1: 0.4769
 epoch: 40, train_loss: 0.9076, test_loss: 1.0491, test_f1: 0.4866
 epoch: 41, train_loss: 0.9116, test_loss: 1.0417, test_f1: 0.4695
 epoch: 42, train_loss: 0.9129, test_loss: 1.0469, test_f1: 0.4831
 epoch: 43, train_loss: 0.9167, test_loss: 1.0376, test_f1: 0.5110
 epoch: 44, train_loss: 0.9092, test_loss: 1.0399, test_f1: 0.4861
 epoch: 45, train_loss: 0.8972, test_loss: 1.0332, test_f1: 0.5016
 epoch: 46, train_loss: 0.9042, test_loss: 1.0175, test_f1: 0.5353
 epoch: 47, train_loss: 0.8976, test_loss: 1.0170, test_f1: 0.5035
 epoch: 48, train_loss: 0.9045, test_loss: 1.0429, test_f1: 0.5046
 epoch: 49, train_loss: 0.8961, test_loss: 1.0700, test_f1: 0.4865
 epoch: 50, train_loss: 0.8942, test_loss: 1.0480, test_f1: 0.5082
 epoch: 51, train_loss: 0.8892, test_loss: 1.0374, test_f1: 0.5117
 epoch: 52, train_loss: 0.8893, test_loss: 1.0290, test_f1: 0.5134
 epoch: 53, train_loss: 0.8789, test_loss: 1.0379, test_f1: 0.5107
 epoch: 54, train_loss: 0.8782, test_loss: 1.0344, test_f1: 0.5060
 epoch: 55, train_loss: 0.8747, test_loss: 1.0199, test_f1: 0.5128
 epoch: 56, train_loss: 0.8858, test_loss: 1.0231, test_f1: 0.5294
 epoch: 57, train_loss: 0.8844, test_loss: 1.0278, test_f1: 0.5154
 epoch: 58, train_loss: 0.8722, test_loss: 1.0318, test_f1: 0.5224
 epoch: 59, train_loss: 0.8806, test_loss: 1.0226, test_f1: 0.5111
 epoch: 60, train_loss: 0.8777, test_loss: 1.0200, test_f1: 0.5166
 epoch: 61, train_loss: 0.8754, test_loss: 1.0150, test_f1: 0.5494
 epoch: 62, train_loss: 0.8728, test_loss: 1.0149, test_f1: 0.5262
 epoch: 63, train_loss: 0.8759, test_loss: 1.0105, test_f1: 0.5238
 epoch: 64, train_loss: 0.8600, test_loss: 1.0143, test_f1: 0.5200
 epoch: 65, train_loss: 0.8583, test_loss: 1.0343, test_f1: 0.5092
 epoch: 66, train_loss: 0.8558, test_loss: 1.0391, test_f1: 0.4992
 epoch: 67, train_loss: 0.8728, test_loss: 1.0350, test_f1: 0.5014
 epoch: 68, train_loss: 0.8488, test_loss: 1.0425, test_f1: 0.5122
 epoch: 69, train_loss: 0.8505, test_loss: 1.0330, test_f1: 0.5169
 epoch: 70, train_loss: 0.8537, test_loss: 1.0230, test_f1: 0.5171
 epoch: 71, train_loss: 0.8555, test_loss: 1.0156, test_f1: 0.5238
 epoch: 72, train_loss: 0.8535, test_loss: 1.0166, test_f1: 0.5279
 epoch: 73, train_loss: 0.8364, test_loss: 1.0330, test_f1: 0.5091
 epoch: 74, train_loss: 0.8461, test_loss: 1.0335, test_f1: 0.5162
 epoch: 75, train_loss: 0.8467, test_loss: 1.0363, test_f1: 0.5004
 epoch: 76, train_loss: 0.8413, test_loss: 1.0227, test_f1: 0.5162
 epoch: 77, train_loss: 0.8469, test_loss: 1.0194, test_f1: 0.5283
 epoch: 78, train_loss: 0.8437, test_loss: 1.0057, test_f1: 0.5288
 epoch: 79, train_loss: 0.8425, test_loss: 1.0175, test_f1: 0.5097
 epoch: 80, train_loss: 0.8426, test_loss: 1.0240, test_f1: 0.5305
 epoch: 81, train_loss: 0.8529, test_loss: 1.0220, test_f1: 0.5197
 epoch: 82, train_loss: 0.8487, test_loss: 1.0326, test_f1: 0.5219
 epoch: 83, train_loss: 0.8395, test_loss: 1.0260, test_f1: 0.5273
 epoch: 84, train_loss: 0.8358, test_loss: 1.0212, test_f1: 0.5288
 epoch: 85, train_loss: 0.8466, test_loss: 1.0218, test_f1: 0.5257
 epoch: 86, train_loss: 0.8273, test_loss: 1.0115, test_f1: 0.5147
 epoch: 87, train_loss: 0.8270, test_loss: 1.0151, test_f1: 0.5306
 epoch: 88, train_loss: 0.8297, test_loss: 1.0285, test_f1: 0.5281
 epoch: 89, train_loss: 0.8290, test_loss: 1.0113, test_f1: 0.5325
 epoch: 90, train_loss: 0.8173, test_loss: 1.0130, test_f1: 0.5187
 epoch: 91, train_loss: 0.8234, test_loss: 1.0146, test_f1: 0.5214
 epoch: 92, train_loss: 0.8234, test_loss: 1.0183, test_f1: 0.5272
 epoch: 93, train_loss: 0.8231, test_loss: 1.0373, test_f1: 0.5292
 epoch: 94, train_loss: 0.8079, test_loss: 1.0386, test_f1: 0.5135
 epoch: 95, train_loss: 0.8291, test_loss: 1.0273, test_f1: 0.5187
 epoch: 96, train_loss: 0.8261, test_loss: 1.0172, test_f1: 0.5115
 epoch: 97, train_loss: 0.8190, test_loss: 1.0230, test_f1: 0.5193
 epoch: 98, train_loss: 0.8436, test_loss: 1.0072, test_f1: 0.5357
 epoch: 99, train_loss: 0.8367, test_loss: 1.0160, test_f1: 0.5249
##################ITERATION #8 ****************************************
 epoch: 0, train_loss: 1.3596, test_loss: 1.3276, test_f1: 0.2281
 epoch: 1, train_loss: 1.2276, test_loss: 1.3080, test_f1: 0.2281
 epoch: 2, train_loss: 1.1766, test_loss: 1.2937, test_f1: 0.2281
 epoch: 3, train_loss: 1.1433, test_loss: 1.2822, test_f1: 0.2281
 epoch: 4, train_loss: 1.1314, test_loss: 1.2612, test_f1: 0.3176
 epoch: 5, train_loss: 1.0953, test_loss: 1.2266, test_f1: 0.3367
 epoch: 6, train_loss: 1.0724, test_loss: 1.1976, test_f1: 0.3248
 epoch: 7, train_loss: 1.0607, test_loss: 1.1559, test_f1: 0.3544
 epoch: 8, train_loss: 1.0514, test_loss: 1.1307, test_f1: 0.4500
 epoch: 9, train_loss: 1.0330, test_loss: 1.1108, test_f1: 0.4423
 epoch: 10, train_loss: 1.0245, test_loss: 1.0996, test_f1: 0.4323
 epoch: 11, train_loss: 1.0245, test_loss: 1.1003, test_f1: 0.4292
 epoch: 12, train_loss: 1.0114, test_loss: 1.1100, test_f1: 0.4185
 epoch: 13, train_loss: 1.0081, test_loss: 1.1134, test_f1: 0.4021
 epoch: 14, train_loss: 1.0003, test_loss: 1.1271, test_f1: 0.4003
 epoch: 15, train_loss: 0.9980, test_loss: 1.1095, test_f1: 0.3945
 epoch: 16, train_loss: 0.9847, test_loss: 1.1135, test_f1: 0.4118
 epoch: 17, train_loss: 0.9858, test_loss: 1.1016, test_f1: 0.4332
 epoch: 18, train_loss: 0.9973, test_loss: 1.1049, test_f1: 0.4600
 epoch: 19, train_loss: 0.9704, test_loss: 1.1224, test_f1: 0.4055
 epoch: 20, train_loss: 0.9800, test_loss: 1.0936, test_f1: 0.4153
 epoch: 21, train_loss: 0.9690, test_loss: 1.0869, test_f1: 0.4529
 epoch: 22, train_loss: 0.9674, test_loss: 1.0878, test_f1: 0.4909
 epoch: 23, train_loss: 0.9650, test_loss: 1.0933, test_f1: 0.4931
 epoch: 24, train_loss: 0.9535, test_loss: 1.1138, test_f1: 0.4666
 epoch: 25, train_loss: 0.9562, test_loss: 1.1131, test_f1: 0.4826
 epoch: 26, train_loss: 0.9615, test_loss: 1.1161, test_f1: 0.4784
 epoch: 27, train_loss: 0.9642, test_loss: 1.1027, test_f1: 0.4876
 epoch: 28, train_loss: 0.9634, test_loss: 1.0928, test_f1: 0.4677
 epoch: 29, train_loss: 0.9602, test_loss: 1.0737, test_f1: 0.4927
 epoch: 30, train_loss: 0.9441, test_loss: 1.0554, test_f1: 0.5083
 epoch: 31, train_loss: 0.9455, test_loss: 1.0726, test_f1: 0.4885
 epoch: 32, train_loss: 0.9390, test_loss: 1.0855, test_f1: 0.4777
 epoch: 33, train_loss: 0.9286, test_loss: 1.0829, test_f1: 0.4951
 epoch: 34, train_loss: 0.9246, test_loss: 1.0874, test_f1: 0.5151
 epoch: 35, train_loss: 0.9194, test_loss: 1.0761, test_f1: 0.5196
 epoch: 36, train_loss: 0.9153, test_loss: 1.0695, test_f1: 0.5175
 epoch: 37, train_loss: 0.9128, test_loss: 1.0733, test_f1: 0.5121
 epoch: 38, train_loss: 0.9230, test_loss: 1.0732, test_f1: 0.5084
 epoch: 39, train_loss: 0.9260, test_loss: 1.0777, test_f1: 0.5292
 epoch: 40, train_loss: 0.9151, test_loss: 1.0743, test_f1: 0.5183
 epoch: 41, train_loss: 0.9113, test_loss: 1.0521, test_f1: 0.5082
 epoch: 42, train_loss: 0.9084, test_loss: 1.0926, test_f1: 0.5241
 epoch: 43, train_loss: 0.9097, test_loss: 1.0941, test_f1: 0.5184
 epoch: 44, train_loss: 0.8965, test_loss: 1.0671, test_f1: 0.5096
 epoch: 45, train_loss: 0.9043, test_loss: 1.0501, test_f1: 0.5084
 epoch: 46, train_loss: 0.9028, test_loss: 1.0357, test_f1: 0.5381
 epoch: 47, train_loss: 0.9000, test_loss: 1.0665, test_f1: 0.5393
 epoch: 48, train_loss: 0.8819, test_loss: 1.0849, test_f1: 0.5493
 epoch: 49, train_loss: 0.8852, test_loss: 1.0735, test_f1: 0.5384
 epoch: 50, train_loss: 0.8789, test_loss: 1.0538, test_f1: 0.5486
 epoch: 51, train_loss: 0.8766, test_loss: 1.0445, test_f1: 0.5490
 epoch: 52, train_loss: 0.8744, test_loss: 1.0436, test_f1: 0.5406
 epoch: 53, train_loss: 0.8772, test_loss: 1.0545, test_f1: 0.5341
 epoch: 54, train_loss: 0.8660, test_loss: 1.0778, test_f1: 0.5485
 epoch: 55, train_loss: 0.8697, test_loss: 1.0844, test_f1: 0.5429
 epoch: 56, train_loss: 0.8699, test_loss: 1.0810, test_f1: 0.5411
 epoch: 57, train_loss: 0.8700, test_loss: 1.0730, test_f1: 0.5610
 epoch: 58, train_loss: 0.8551, test_loss: 1.0651, test_f1: 0.5445
 epoch: 59, train_loss: 0.8682, test_loss: 1.0488, test_f1: 0.5460
 epoch: 60, train_loss: 0.8553, test_loss: 1.0611, test_f1: 0.5416
 epoch: 61, train_loss: 0.8626, test_loss: 1.0510, test_f1: 0.5555
 epoch: 62, train_loss: 0.8621, test_loss: 1.0990, test_f1: 0.5274
 epoch: 63, train_loss: 0.8647, test_loss: 1.1068, test_f1: 0.5256
 epoch: 64, train_loss: 0.8649, test_loss: 1.1366, test_f1: 0.5224
 epoch: 65, train_loss: 0.8437, test_loss: 1.1245, test_f1: 0.5277
 epoch: 66, train_loss: 0.8488, test_loss: 1.0816, test_f1: 0.5563
 epoch: 67, train_loss: 0.8448, test_loss: 1.0708, test_f1: 0.5483
 epoch: 68, train_loss: 0.8456, test_loss: 1.0652, test_f1: 0.5673
 epoch: 69, train_loss: 0.8390, test_loss: 1.0624, test_f1: 0.5608
 epoch: 70, train_loss: 0.8367, test_loss: 1.0597, test_f1: 0.5726
 epoch: 71, train_loss: 0.8381, test_loss: 1.0435, test_f1: 0.5636
 epoch: 72, train_loss: 0.8379, test_loss: 1.0536, test_f1: 0.5647
 epoch: 73, train_loss: 0.8332, test_loss: 1.0575, test_f1: 0.5590
 epoch: 74, train_loss: 0.8378, test_loss: 1.0439, test_f1: 0.5656
 epoch: 75, train_loss: 0.8215, test_loss: 1.0421, test_f1: 0.5637
 epoch: 76, train_loss: 0.8413, test_loss: 1.0436, test_f1: 0.5766
 epoch: 77, train_loss: 0.8109, test_loss: 1.0550, test_f1: 0.5655
 epoch: 78, train_loss: 0.8229, test_loss: 1.0797, test_f1: 0.5580
 epoch: 79, train_loss: 0.8167, test_loss: 1.1242, test_f1: 0.5666
 epoch: 80, train_loss: 0.8218, test_loss: 1.1476, test_f1: 0.5174
 epoch: 81, train_loss: 0.8070, test_loss: 1.1050, test_f1: 0.5635
 epoch: 82, train_loss: 0.8067, test_loss: 1.1017, test_f1: 0.5561
 epoch: 83, train_loss: 0.8087, test_loss: 1.0983, test_f1: 0.5752
 epoch: 84, train_loss: 0.8137, test_loss: 1.0956, test_f1: 0.5753
 epoch: 85, train_loss: 0.8189, test_loss: 1.0750, test_f1: 0.5710
 epoch: 86, train_loss: 0.8071, test_loss: 1.0492, test_f1: 0.5801
 epoch: 87, train_loss: 0.8023, test_loss: 1.0882, test_f1: 0.5667
 epoch: 88, train_loss: 0.8091, test_loss: 1.0854, test_f1: 0.5637
 epoch: 89, train_loss: 0.8044, test_loss: 1.1007, test_f1: 0.5593
 epoch: 90, train_loss: 0.7997, test_loss: 1.1207, test_f1: 0.5559
 epoch: 91, train_loss: 0.7854, test_loss: 1.1135, test_f1: 0.5622
 epoch: 92, train_loss: 0.7808, test_loss: 1.1288, test_f1: 0.5752
 epoch: 93, train_loss: 0.7862, test_loss: 1.1155, test_f1: 0.5659
 epoch: 94, train_loss: 0.7933, test_loss: 1.0809, test_f1: 0.5630
 epoch: 95, train_loss: 0.7898, test_loss: 1.0760, test_f1: 0.5643
 epoch: 96, train_loss: 0.8113, test_loss: 1.0894, test_f1: 0.5661
 epoch: 97, train_loss: 0.8019, test_loss: 1.0773, test_f1: 0.5608
 epoch: 98, train_loss: 0.7937, test_loss: 1.0601, test_f1: 0.5811
 epoch: 99, train_loss: 0.7929, test_loss: 1.0710, test_f1: 0.5771
##################ITERATION #9 ****************************************
 epoch: 0, train_loss: 1.5443, test_loss: 1.3581, test_f1: 0.2281
 epoch: 1, train_loss: 1.2576, test_loss: 1.3170, test_f1: 0.2281
 epoch: 2, train_loss: 1.1995, test_loss: 1.2944, test_f1: 0.2281
 epoch: 3, train_loss: 1.1443, test_loss: 1.3188, test_f1: 0.2281
 epoch: 4, train_loss: 1.1199, test_loss: 1.3423, test_f1: 0.2281
 epoch: 5, train_loss: 1.1221, test_loss: 1.3255, test_f1: 0.2735
 epoch: 6, train_loss: 1.0938, test_loss: 1.2849, test_f1: 0.2720
 epoch: 7, train_loss: 1.0881, test_loss: 1.2378, test_f1: 0.2968
 epoch: 8, train_loss: 1.0772, test_loss: 1.1910, test_f1: 0.3809
 epoch: 9, train_loss: 1.0611, test_loss: 1.1547, test_f1: 0.4218
 epoch: 10, train_loss: 1.0549, test_loss: 1.1306, test_f1: 0.4253
 epoch: 11, train_loss: 1.0402, test_loss: 1.1150, test_f1: 0.4119
 epoch: 12, train_loss: 1.0359, test_loss: 1.1149, test_f1: 0.4069
 epoch: 13, train_loss: 1.0249, test_loss: 1.1018, test_f1: 0.4032
 epoch: 14, train_loss: 1.0337, test_loss: 1.0747, test_f1: 0.4077
 epoch: 15, train_loss: 1.0156, test_loss: 1.0654, test_f1: 0.4223
 epoch: 16, train_loss: 1.0190, test_loss: 1.0697, test_f1: 0.4128
 epoch: 17, train_loss: 0.9988, test_loss: 1.0790, test_f1: 0.4264
 epoch: 18, train_loss: 1.0148, test_loss: 1.0736, test_f1: 0.4371
 epoch: 19, train_loss: 0.9981, test_loss: 1.0752, test_f1: 0.4498
 epoch: 20, train_loss: 1.0039, test_loss: 1.0619, test_f1: 0.4543
 epoch: 21, train_loss: 0.9892, test_loss: 1.0616, test_f1: 0.4456
 epoch: 22, train_loss: 0.9943, test_loss: 1.0633, test_f1: 0.4677
 epoch: 23, train_loss: 0.9760, test_loss: 1.0542, test_f1: 0.4584
 epoch: 24, train_loss: 0.9733, test_loss: 1.0617, test_f1: 0.4517
 epoch: 25, train_loss: 0.9804, test_loss: 1.0535, test_f1: 0.4274
 epoch: 26, train_loss: 0.9601, test_loss: 1.0464, test_f1: 0.4358
 epoch: 27, train_loss: 0.9612, test_loss: 1.0443, test_f1: 0.4844
 epoch: 28, train_loss: 0.9677, test_loss: 1.0618, test_f1: 0.4536
 epoch: 29, train_loss: 0.9711, test_loss: 1.0536, test_f1: 0.4747
 epoch: 30, train_loss: 0.9606, test_loss: 1.0541, test_f1: 0.4784
 epoch: 31, train_loss: 0.9523, test_loss: 1.0508, test_f1: 0.5095
 epoch: 32, train_loss: 0.9585, test_loss: 1.0496, test_f1: 0.5193
 epoch: 33, train_loss: 0.9403, test_loss: 1.0419, test_f1: 0.4704
 epoch: 34, train_loss: 0.9437, test_loss: 1.0602, test_f1: 0.5028
 epoch: 35, train_loss: 0.9460, test_loss: 1.0480, test_f1: 0.4721
 epoch: 36, train_loss: 0.9505, test_loss: 1.0614, test_f1: 0.4782
 epoch: 37, train_loss: 0.9494, test_loss: 1.1147, test_f1: 0.4821
 epoch: 38, train_loss: 0.9479, test_loss: 1.0815, test_f1: 0.4756
 epoch: 39, train_loss: 0.9466, test_loss: 1.0971, test_f1: 0.4771
 epoch: 40, train_loss: 0.9458, test_loss: 1.1052, test_f1: 0.4747
 epoch: 41, train_loss: 0.9393, test_loss: 1.0814, test_f1: 0.5060
 epoch: 42, train_loss: 0.9319, test_loss: 1.0888, test_f1: 0.5230
 epoch: 43, train_loss: 0.9420, test_loss: 1.0780, test_f1: 0.5327
 epoch: 44, train_loss: 0.9276, test_loss: 1.0716, test_f1: 0.5147
 epoch: 45, train_loss: 0.9169, test_loss: 1.0624, test_f1: 0.4978
 epoch: 46, train_loss: 0.9139, test_loss: 1.0604, test_f1: 0.5030
 epoch: 47, train_loss: 0.9003, test_loss: 1.0456, test_f1: 0.5036
 epoch: 48, train_loss: 0.9073, test_loss: 1.0554, test_f1: 0.5156
 epoch: 49, train_loss: 0.8994, test_loss: 1.0424, test_f1: 0.5481
 epoch: 50, train_loss: 0.9001, test_loss: 1.0270, test_f1: 0.5453
 epoch: 51, train_loss: 0.8981, test_loss: 1.0230, test_f1: 0.5498
 epoch: 52, train_loss: 0.8918, test_loss: 1.0333, test_f1: 0.5267
 epoch: 53, train_loss: 0.8933, test_loss: 1.0310, test_f1: 0.5533
 epoch: 54, train_loss: 0.8858, test_loss: 1.0284, test_f1: 0.5611
 epoch: 55, train_loss: 0.8839, test_loss: 1.0311, test_f1: 0.5613
 epoch: 56, train_loss: 0.8795, test_loss: 1.0388, test_f1: 0.5407
 epoch: 57, train_loss: 0.8742, test_loss: 1.0341, test_f1: 0.5367
 epoch: 58, train_loss: 0.8762, test_loss: 1.0336, test_f1: 0.5425
 epoch: 59, train_loss: 0.8838, test_loss: 1.0196, test_f1: 0.5590
 epoch: 60, train_loss: 0.8716, test_loss: 1.0153, test_f1: 0.5517
 epoch: 61, train_loss: 0.8810, test_loss: 1.0251, test_f1: 0.5460
 epoch: 62, train_loss: 0.8714, test_loss: 1.0374, test_f1: 0.5425
 epoch: 63, train_loss: 0.8637, test_loss: 1.0513, test_f1: 0.5387
 epoch: 64, train_loss: 0.8674, test_loss: 1.0531, test_f1: 0.5525
 epoch: 65, train_loss: 0.8806, test_loss: 1.0443, test_f1: 0.5172
 epoch: 66, train_loss: 0.8768, test_loss: 1.0343, test_f1: 0.5325
 epoch: 67, train_loss: 0.8830, test_loss: 1.0383, test_f1: 0.5678
 epoch: 68, train_loss: 0.8771, test_loss: 1.0564, test_f1: 0.5255
 epoch: 69, train_loss: 0.8657, test_loss: 1.0441, test_f1: 0.5843
 epoch: 70, train_loss: 0.8571, test_loss: 1.0538, test_f1: 0.5575
 epoch: 71, train_loss: 0.8568, test_loss: 1.0380, test_f1: 0.5705
 epoch: 72, train_loss: 0.8550, test_loss: 1.0419, test_f1: 0.5693
 epoch: 73, train_loss: 0.8499, test_loss: 1.0442, test_f1: 0.5587
 epoch: 74, train_loss: 0.8645, test_loss: 1.0808, test_f1: 0.5486
 epoch: 75, train_loss: 0.8649, test_loss: 1.0477, test_f1: 0.5645
 epoch: 76, train_loss: 0.8636, test_loss: 1.0414, test_f1: 0.5759
 epoch: 77, train_loss: 0.8456, test_loss: 1.0809, test_f1: 0.5578
 epoch: 78, train_loss: 0.8663, test_loss: 1.0585, test_f1: 0.5639
 epoch: 79, train_loss: 0.8599, test_loss: 1.0462, test_f1: 0.5916
 epoch: 80, train_loss: 0.8537, test_loss: 1.0239, test_f1: 0.5678
 epoch: 81, train_loss: 0.8483, test_loss: 1.0238, test_f1: 0.5681
 epoch: 82, train_loss: 0.8471, test_loss: 1.0336, test_f1: 0.5611
 epoch: 83, train_loss: 0.8569, test_loss: 1.0355, test_f1: 0.5530
 epoch: 84, train_loss: 0.8497, test_loss: 1.0380, test_f1: 0.5779
 epoch: 85, train_loss: 0.8467, test_loss: 1.0296, test_f1: 0.5907
 epoch: 86, train_loss: 0.8487, test_loss: 1.0171, test_f1: 0.5763
 epoch: 87, train_loss: 0.8390, test_loss: 1.0237, test_f1: 0.5685
 epoch: 88, train_loss: 0.8273, test_loss: 1.0172, test_f1: 0.5781
 epoch: 89, train_loss: 0.8178, test_loss: 1.0091, test_f1: 0.6183
 epoch: 90, train_loss: 0.8387, test_loss: 1.0130, test_f1: 0.5978
 epoch: 91, train_loss: 0.8443, test_loss: 1.0370, test_f1: 0.5542
 epoch: 92, train_loss: 0.8446, test_loss: 1.0731, test_f1: 0.5219
 epoch: 93, train_loss: 0.8428, test_loss: 1.0314, test_f1: 0.5755
 epoch: 94, train_loss: 0.8279, test_loss: 1.0381, test_f1: 0.5670
 epoch: 95, train_loss: 0.8223, test_loss: 1.0315, test_f1: 0.5708
 epoch: 96, train_loss: 0.8342, test_loss: 1.0221, test_f1: 0.5788
 epoch: 97, train_loss: 0.8434, test_loss: 1.0260, test_f1: 0.5802
 epoch: 98, train_loss: 0.8160, test_loss: 1.0427, test_f1: 0.5736
 epoch: 99, train_loss: 0.8132, test_loss: 1.0495, test_f1: 0.5723

Training completed in 384.52 seconds
Best F1: 0.6183 at epoch 89
Mean F1 across iterations: 0.5334  0.0489
========================FINAL RESULTS================================
FEGIN weighted F1: 0.6183  0.0489
python main.py --data ltspice_demos --representation component_pin_net --model FEGIN --layers 4 --hiddens 16 --batch_size 256 --lr 0.001 --emb_size 128 --epochs 100 --save_appendix component_pin_net_L4_H16_BS256_LR0.001_E128 --no_val
-----



STDERR:
  File "main.py", line 370, in <module>
    main()
  File "main.py", line 254, in main
    dataset = dataset_class(
  File "/home/philip/projects/ltspice_examples_code_repo/Circuit-Completion-Using-GNNs/component_classification_with_link_prediction_head/evaluation/FEGIN/kernel/circuit_datasets.py", line 15, in __init__
    self.data, self.slices = torch.load(self.processed_paths[0])
  File "/home/philip/.local/lib/python3.8/site-packages/torch/serialization.py", line 1040, in load
    warnings.warn(
  File "/usr/lib/python3.8/warnings.py", line 109, in _showwarnmsg
    sw(msg.message, msg.category, msg.filename, msg.lineno,
  File "main.py", line 47, in warn_with_traceback
    traceback.print_stack(file=log)
/home/philip/projects/ltspice_examples_code_repo/Circuit-Completion-Using-GNNs/component_classification_with_link_prediction_head/evaluation/FEGIN/kernel/circuit_datasets.py:15: FutureWarning: You are using `torch.load` with `weights_only=False` (the current default value), which uses the default pickle module implicitly. It is possible to construct malicious pickle data which will execute arbitrary code during unpickling (See https://github.com/pytorch/pytorch/blob/main/SECURITY.md#untrusted-models for more details). In a future release, the default value for `weights_only` will be flipped to `True`. This limits the functions that could be executed during unpickling. Arbitrary objects will no longer be allowed to be loaded via this mode unless they are explicitly allowlisted by the user via `torch.serialization.add_safe_globals`. We recommend you start setting `weights_only=True` for any use case where you don't have full control of the loaded file. Please open an issue on GitHub for any issues related to this experimental feature.
  self.data, self.slices = torch.load(self.processed_paths[0])
