STDOUT:
Results will be saved in /home/philip/projects/ltspice_examples_code_repo/Circuit-Completion-Using-GNNs/component_classification_with_link_prediction_head/evaluation/FEGIN/results/model_FEGIN_dataset_ltspice_demos
Command line input: python main.py --data ltspice_demos --representation component_net --model FEGIN --layers 3 --hiddens 64 --batch_size 128 --lr 0.01 --emb_size 250 --epochs 100 --save_appendix component_net_L3_H64_BS128_LR0.01_E250 --no_val
 is saved.
-----
ltspice_demos - FEGIN
Using 3 layers, 64 hidden units, h = 2
Loading component_net representation dataset
ENTERED
Training FEGIN on component_net representation
Train: 1565, Test: 383
##################ITERATION #0 ****************************************
 epoch: 0, train_loss: 1.2216, test_loss: 1.4888, test_f1: 0.2281
 epoch: 1, train_loss: 1.1323, test_loss: 1.2961, test_f1: 0.2754
 epoch: 2, train_loss: 1.1119, test_loss: 1.3163, test_f1: 0.3151
 epoch: 3, train_loss: 1.0447, test_loss: 1.1512, test_f1: 0.4122
 epoch: 4, train_loss: 0.9963, test_loss: 1.1140, test_f1: 0.5121
 epoch: 5, train_loss: 0.9642, test_loss: 1.4480, test_f1: 0.4406
 epoch: 6, train_loss: 0.9477, test_loss: 1.0544, test_f1: 0.5172
 epoch: 7, train_loss: 0.9129, test_loss: 1.1755, test_f1: 0.5513
 epoch: 8, train_loss: 0.9166, test_loss: 1.1019, test_f1: 0.5808
 epoch: 9, train_loss: 0.9058, test_loss: 1.4680, test_f1: 0.4627
 epoch: 10, train_loss: 0.8825, test_loss: 1.1762, test_f1: 0.5272
 epoch: 11, train_loss: 0.8512, test_loss: 1.1773, test_f1: 0.4645
 epoch: 12, train_loss: 0.8748, test_loss: 1.2119, test_f1: 0.5600
 epoch: 13, train_loss: 0.8256, test_loss: 1.5672, test_f1: 0.4540
 epoch: 14, train_loss: 0.8205, test_loss: 1.1441, test_f1: 0.5731
 epoch: 15, train_loss: 0.8079, test_loss: 1.2889, test_f1: 0.5000
 epoch: 16, train_loss: 0.8015, test_loss: 1.2437, test_f1: 0.5823
 epoch: 17, train_loss: 0.7494, test_loss: 1.6036, test_f1: 0.4681
 epoch: 18, train_loss: 0.7665, test_loss: 1.2927, test_f1: 0.4530
 epoch: 19, train_loss: 0.7641, test_loss: 1.6905, test_f1: 0.5721
 epoch: 20, train_loss: 0.7504, test_loss: 1.3101, test_f1: 0.5634
 epoch: 21, train_loss: 0.7212, test_loss: 1.1855, test_f1: 0.4610
 epoch: 22, train_loss: 0.6931, test_loss: 1.2546, test_f1: 0.4791
 epoch: 23, train_loss: 0.6681, test_loss: 1.2816, test_f1: 0.5869
 epoch: 24, train_loss: 0.6818, test_loss: 1.1391, test_f1: 0.6013
 epoch: 25, train_loss: 0.6859, test_loss: 2.7274, test_f1: 0.4930
 epoch: 26, train_loss: 0.7118, test_loss: 1.3310, test_f1: 0.5897
 epoch: 27, train_loss: 0.7294, test_loss: 1.1586, test_f1: 0.5978
 epoch: 28, train_loss: 0.6893, test_loss: 1.0931, test_f1: 0.5623
 epoch: 29, train_loss: 0.6538, test_loss: 1.8395, test_f1: 0.5077
 epoch: 30, train_loss: 0.6740, test_loss: 1.6619, test_f1: 0.5777
 epoch: 31, train_loss: 0.6732, test_loss: 1.5973, test_f1: 0.5414
 epoch: 32, train_loss: 0.6406, test_loss: 1.5137, test_f1: 0.5910
 epoch: 33, train_loss: 0.6015, test_loss: 1.5958, test_f1: 0.6172
 epoch: 34, train_loss: 0.6031, test_loss: 1.2193, test_f1: 0.6077
 epoch: 35, train_loss: 0.5997, test_loss: 2.7685, test_f1: 0.4838
 epoch: 36, train_loss: 0.6232, test_loss: 1.3836, test_f1: 0.4871
 epoch: 37, train_loss: 0.5859, test_loss: 1.7759, test_f1: 0.5713
 epoch: 38, train_loss: 0.6017, test_loss: 1.8869, test_f1: 0.5750
 epoch: 39, train_loss: 0.5833, test_loss: 1.5351, test_f1: 0.6321
 epoch: 40, train_loss: 0.5506, test_loss: 1.3940, test_f1: 0.6074
 epoch: 41, train_loss: 0.5615, test_loss: 1.7725, test_f1: 0.6034
 epoch: 42, train_loss: 0.5363, test_loss: 1.4404, test_f1: 0.6077
 epoch: 43, train_loss: 0.5584, test_loss: 1.3634, test_f1: 0.6246
 epoch: 44, train_loss: 0.5519, test_loss: 1.2598, test_f1: 0.6218
 epoch: 45, train_loss: 0.5451, test_loss: 1.6268, test_f1: 0.5598
 epoch: 46, train_loss: 0.5419, test_loss: 1.7931, test_f1: 0.6303
 epoch: 47, train_loss: 0.5285, test_loss: 2.1104, test_f1: 0.5866
 epoch: 48, train_loss: 0.4994, test_loss: 1.7410, test_f1: 0.6286
 epoch: 49, train_loss: 0.5123, test_loss: 2.1831, test_f1: 0.5664
 epoch: 50, train_loss: 0.5239, test_loss: 2.0758, test_f1: 0.5266
 epoch: 51, train_loss: 0.4971, test_loss: 1.8658, test_f1: 0.6034
 epoch: 52, train_loss: 0.4612, test_loss: 1.5762, test_f1: 0.6139
 epoch: 53, train_loss: 0.4282, test_loss: 2.0255, test_f1: 0.5890
 epoch: 54, train_loss: 0.4204, test_loss: 2.0881, test_f1: 0.6206
 epoch: 55, train_loss: 0.3703, test_loss: 2.4086, test_f1: 0.6103
 epoch: 56, train_loss: 0.3884, test_loss: 2.0025, test_f1: 0.6044
 epoch: 57, train_loss: 0.4041, test_loss: 2.4774, test_f1: 0.6181
 epoch: 58, train_loss: 0.4314, test_loss: 2.5475, test_f1: 0.5644
 epoch: 59, train_loss: 0.4057, test_loss: 2.0627, test_f1: 0.6159
 epoch: 60, train_loss: 0.3732, test_loss: 2.0327, test_f1: 0.6333
 epoch: 61, train_loss: 0.3850, test_loss: 1.7886, test_f1: 0.6519
 epoch: 62, train_loss: 0.3895, test_loss: 1.8980, test_f1: 0.6216
 epoch: 63, train_loss: 0.3716, test_loss: 2.4293, test_f1: 0.5991
 epoch: 64, train_loss: 0.3516, test_loss: 2.1990, test_f1: 0.6156
 epoch: 65, train_loss: 0.3412, test_loss: 2.2144, test_f1: 0.6409
 epoch: 66, train_loss: 0.4361, test_loss: 2.2831, test_f1: 0.5729
 epoch: 67, train_loss: 0.4031, test_loss: 2.2549, test_f1: 0.6150
 epoch: 68, train_loss: 0.3508, test_loss: 2.2057, test_f1: 0.5915
 epoch: 69, train_loss: 0.3411, test_loss: 2.4520, test_f1: 0.6382
 epoch: 70, train_loss: 0.3600, test_loss: 2.2365, test_f1: 0.5893
 epoch: 71, train_loss: 0.3428, test_loss: 1.9026, test_f1: 0.6134
 epoch: 72, train_loss: 0.3389, test_loss: 2.5191, test_f1: 0.5936
 epoch: 73, train_loss: 0.3454, test_loss: 2.6531, test_f1: 0.6076
 epoch: 74, train_loss: 0.3343, test_loss: 2.8388, test_f1: 0.6040
 epoch: 75, train_loss: 0.2974, test_loss: 2.5484, test_f1: 0.6100
 epoch: 76, train_loss: 0.3104, test_loss: 2.6045, test_f1: 0.6099
 epoch: 77, train_loss: 0.2851, test_loss: 2.7724, test_f1: 0.6375
 epoch: 78, train_loss: 0.3336, test_loss: 2.8896, test_f1: 0.5896
 epoch: 79, train_loss: 0.3430, test_loss: 2.8983, test_f1: 0.5732
 epoch: 80, train_loss: 0.3861, test_loss: 2.8397, test_f1: 0.4771
 epoch: 81, train_loss: 0.4629, test_loss: 2.2038, test_f1: 0.5632
 epoch: 82, train_loss: 0.4201, test_loss: 1.7364, test_f1: 0.6200
 epoch: 83, train_loss: 0.3587, test_loss: 2.3356, test_f1: 0.6141
 epoch: 84, train_loss: 0.3499, test_loss: 2.3612, test_f1: 0.6079
 epoch: 85, train_loss: 0.3434, test_loss: 2.5353, test_f1: 0.6151
 epoch: 86, train_loss: 0.3367, test_loss: 2.9602, test_f1: 0.6289
 epoch: 87, train_loss: 0.3191, test_loss: 2.5527, test_f1: 0.6499
 epoch: 88, train_loss: 0.2737, test_loss: 2.8547, test_f1: 0.6150
 epoch: 89, train_loss: 0.2940, test_loss: 2.7650, test_f1: 0.6284
 epoch: 90, train_loss: 0.3336, test_loss: 3.5861, test_f1: 0.5608
 epoch: 91, train_loss: 0.3095, test_loss: 2.3151, test_f1: 0.6390
 epoch: 92, train_loss: 0.2652, test_loss: 2.5647, test_f1: 0.6448
 epoch: 93, train_loss: 0.2722, test_loss: 2.6500, test_f1: 0.6457
 epoch: 94, train_loss: 0.2918, test_loss: 2.9006, test_f1: 0.6459
 epoch: 95, train_loss: 0.3025, test_loss: 2.8858, test_f1: 0.6087
 epoch: 96, train_loss: 0.2988, test_loss: 2.5273, test_f1: 0.6253
 epoch: 97, train_loss: 0.2928, test_loss: 2.5940, test_f1: 0.6382
 epoch: 98, train_loss: 0.4086, test_loss: 3.2864, test_f1: 0.5953
 epoch: 99, train_loss: 0.3541, test_loss: 2.4592, test_f1: 0.6450
##################ITERATION #1 ****************************************
 epoch: 0, train_loss: 1.2118, test_loss: 1.5418, test_f1: 0.1365
 epoch: 1, train_loss: 1.0643, test_loss: 1.2731, test_f1: 0.2981
 epoch: 2, train_loss: 0.9986, test_loss: 1.1328, test_f1: 0.4729
 epoch: 3, train_loss: 0.9452, test_loss: 1.0388, test_f1: 0.4880
 epoch: 4, train_loss: 0.9618, test_loss: 1.3029, test_f1: 0.4674
 epoch: 5, train_loss: 0.9242, test_loss: 1.1924, test_f1: 0.4678
 epoch: 6, train_loss: 0.9029, test_loss: 1.0710, test_f1: 0.5636
 epoch: 7, train_loss: 0.8962, test_loss: 1.0953, test_f1: 0.5363
 epoch: 8, train_loss: 0.8626, test_loss: 1.1210, test_f1: 0.5196
 epoch: 9, train_loss: 0.8599, test_loss: 1.3607, test_f1: 0.4312
 epoch: 10, train_loss: 0.8746, test_loss: 1.1252, test_f1: 0.4438
 epoch: 11, train_loss: 0.8577, test_loss: 1.3051, test_f1: 0.4023
 epoch: 12, train_loss: 0.8495, test_loss: 1.1168, test_f1: 0.4106
 epoch: 13, train_loss: 0.8338, test_loss: 1.0470, test_f1: 0.5032
 epoch: 14, train_loss: 0.7988, test_loss: 1.3622, test_f1: 0.4027
 epoch: 15, train_loss: 0.7788, test_loss: 1.2285, test_f1: 0.4744
 epoch: 16, train_loss: 0.7942, test_loss: 1.2805, test_f1: 0.5420
 epoch: 17, train_loss: 0.7897, test_loss: 1.5618, test_f1: 0.4087
 epoch: 18, train_loss: 0.7874, test_loss: 1.2706, test_f1: 0.5396
 epoch: 19, train_loss: 0.7720, test_loss: 1.3747, test_f1: 0.5573
 epoch: 20, train_loss: 0.7666, test_loss: 1.2050, test_f1: 0.6091
 epoch: 21, train_loss: 0.7278, test_loss: 1.2673, test_f1: 0.5596
 epoch: 22, train_loss: 0.7119, test_loss: 1.2711, test_f1: 0.5803
 epoch: 23, train_loss: 0.7409, test_loss: 1.2078, test_f1: 0.5983
 epoch: 24, train_loss: 0.7018, test_loss: 1.4499, test_f1: 0.5572
 epoch: 25, train_loss: 0.7022, test_loss: 1.2934, test_f1: 0.5979
 epoch: 26, train_loss: 0.7101, test_loss: 1.5025, test_f1: 0.5090
 epoch: 27, train_loss: 0.6966, test_loss: 1.1836, test_f1: 0.5929
 epoch: 28, train_loss: 0.6576, test_loss: 1.4259, test_f1: 0.5973
 epoch: 29, train_loss: 0.6532, test_loss: 1.2737, test_f1: 0.5779
 epoch: 30, train_loss: 0.6203, test_loss: 1.6395, test_f1: 0.5440
 epoch: 31, train_loss: 0.6281, test_loss: 1.3232, test_f1: 0.5957
 epoch: 32, train_loss: 0.6569, test_loss: 1.5232, test_f1: 0.5065
 epoch: 33, train_loss: 0.6829, test_loss: 2.0113, test_f1: 0.5070
 epoch: 34, train_loss: 0.6795, test_loss: 1.3566, test_f1: 0.5675
 epoch: 35, train_loss: 0.6651, test_loss: 1.6118, test_f1: 0.5235
 epoch: 36, train_loss: 0.6298, test_loss: 1.3716, test_f1: 0.5386
 epoch: 37, train_loss: 0.6174, test_loss: 1.5469, test_f1: 0.5080
 epoch: 38, train_loss: 0.6198, test_loss: 1.3459, test_f1: 0.5092
 epoch: 39, train_loss: 0.6560, test_loss: 1.6941, test_f1: 0.5355
 epoch: 40, train_loss: 0.5994, test_loss: 1.6527, test_f1: 0.5926
 epoch: 41, train_loss: 0.5746, test_loss: 1.5166, test_f1: 0.6106
 epoch: 42, train_loss: 0.5716, test_loss: 1.1850, test_f1: 0.6397
 epoch: 43, train_loss: 0.5484, test_loss: 1.6349, test_f1: 0.5366
 epoch: 44, train_loss: 0.6402, test_loss: 2.0243, test_f1: 0.5493
 epoch: 45, train_loss: 0.6079, test_loss: 1.6436, test_f1: 0.5797
 epoch: 46, train_loss: 0.5537, test_loss: 1.5606, test_f1: 0.6088
 epoch: 47, train_loss: 0.5494, test_loss: 1.4871, test_f1: 0.5957
 epoch: 48, train_loss: 0.5639, test_loss: 1.8168, test_f1: 0.5255
 epoch: 49, train_loss: 0.5335, test_loss: 1.9232, test_f1: 0.5563
 epoch: 50, train_loss: 0.5330, test_loss: 1.7618, test_f1: 0.6139
 epoch: 51, train_loss: 0.5172, test_loss: 1.7332, test_f1: 0.5803
 epoch: 52, train_loss: 0.5267, test_loss: 1.4842, test_f1: 0.5871
 epoch: 53, train_loss: 0.4731, test_loss: 1.9980, test_f1: 0.5809
 epoch: 54, train_loss: 0.4628, test_loss: 1.7385, test_f1: 0.6055
 epoch: 55, train_loss: 0.4372, test_loss: 1.8345, test_f1: 0.6241
 epoch: 56, train_loss: 0.4082, test_loss: 2.0566, test_f1: 0.6203
 epoch: 57, train_loss: 0.4421, test_loss: 1.9611, test_f1: 0.6508
 epoch: 58, train_loss: 0.4131, test_loss: 2.0141, test_f1: 0.5925
 epoch: 59, train_loss: 0.4145, test_loss: 2.0212, test_f1: 0.6113
 epoch: 60, train_loss: 0.3879, test_loss: 2.1393, test_f1: 0.5534
 epoch: 61, train_loss: 0.4044, test_loss: 2.1672, test_f1: 0.5968
 epoch: 62, train_loss: 0.3915, test_loss: 2.3772, test_f1: 0.5578
 epoch: 63, train_loss: 0.3815, test_loss: 2.5829, test_f1: 0.6010
 epoch: 64, train_loss: 0.3996, test_loss: 2.1678, test_f1: 0.6249
 epoch: 65, train_loss: 0.3888, test_loss: 1.9353, test_f1: 0.6350
 epoch: 66, train_loss: 0.4025, test_loss: 2.0165, test_f1: 0.6310
 epoch: 67, train_loss: 0.4181, test_loss: 1.9263, test_f1: 0.6250
 epoch: 68, train_loss: 0.4484, test_loss: 2.0620, test_f1: 0.5738
 epoch: 69, train_loss: 0.4098, test_loss: 2.4650, test_f1: 0.5885
 epoch: 70, train_loss: 0.4134, test_loss: 2.8732, test_f1: 0.5695
 epoch: 71, train_loss: 0.3655, test_loss: 2.4952, test_f1: 0.6166
 epoch: 72, train_loss: 0.3648, test_loss: 2.3840, test_f1: 0.6420
 epoch: 73, train_loss: 0.3580, test_loss: 2.4310, test_f1: 0.6091
 epoch: 74, train_loss: 0.3584, test_loss: 2.7903, test_f1: 0.5474
 epoch: 75, train_loss: 0.3619, test_loss: 2.1420, test_f1: 0.6598
 epoch: 76, train_loss: 0.3519, test_loss: 2.3607, test_f1: 0.6122
 epoch: 77, train_loss: 0.3176, test_loss: 2.7162, test_f1: 0.6231
 epoch: 78, train_loss: 0.3450, test_loss: 2.5181, test_f1: 0.5937
 epoch: 79, train_loss: 0.3294, test_loss: 2.3863, test_f1: 0.6245
 epoch: 80, train_loss: 0.3158, test_loss: 3.0900, test_f1: 0.5774
 epoch: 81, train_loss: 0.3803, test_loss: 2.5756, test_f1: 0.6323
 epoch: 82, train_loss: 0.3529, test_loss: 2.4857, test_f1: 0.6350
 epoch: 83, train_loss: 0.3337, test_loss: 2.5752, test_f1: 0.6057
 epoch: 84, train_loss: 0.3437, test_loss: 2.1999, test_f1: 0.6521
 epoch: 85, train_loss: 0.3833, test_loss: 2.8711, test_f1: 0.5924
 epoch: 86, train_loss: 0.3470, test_loss: 2.3006, test_f1: 0.6038
 epoch: 87, train_loss: 0.2957, test_loss: 2.3799, test_f1: 0.6026
 epoch: 88, train_loss: 0.3041, test_loss: 2.7309, test_f1: 0.5970
 epoch: 89, train_loss: 0.3162, test_loss: 2.5044, test_f1: 0.6484
 epoch: 90, train_loss: 0.2892, test_loss: 3.0595, test_f1: 0.5573
 epoch: 91, train_loss: 0.2789, test_loss: 2.9085, test_f1: 0.5730
 epoch: 92, train_loss: 0.2883, test_loss: 2.6535, test_f1: 0.6248
 epoch: 93, train_loss: 0.2846, test_loss: 3.7535, test_f1: 0.5962
 epoch: 94, train_loss: 0.3046, test_loss: 2.6542, test_f1: 0.6213
 epoch: 95, train_loss: 0.2783, test_loss: 3.8037, test_f1: 0.6044
 epoch: 96, train_loss: 0.3011, test_loss: 3.1526, test_f1: 0.6277
 epoch: 97, train_loss: 0.2898, test_loss: 2.5011, test_f1: 0.6214
 epoch: 98, train_loss: 0.2716, test_loss: 2.9383, test_f1: 0.6127
 epoch: 99, train_loss: 0.2924, test_loss: 2.7215, test_f1: 0.6203
##################ITERATION #2 ****************************************
 epoch: 0, train_loss: 1.2533, test_loss: 1.4611, test_f1: 0.1474
 epoch: 1, train_loss: 1.0527, test_loss: 1.3010, test_f1: 0.3250
 epoch: 2, train_loss: 0.9885, test_loss: 1.1576, test_f1: 0.4253
 epoch: 3, train_loss: 0.9358, test_loss: 1.0347, test_f1: 0.4904
 epoch: 4, train_loss: 0.9589, test_loss: 1.0606, test_f1: 0.5161
 epoch: 5, train_loss: 0.9487, test_loss: 1.1691, test_f1: 0.4668
 epoch: 6, train_loss: 0.9167, test_loss: 0.9992, test_f1: 0.5365
 epoch: 7, train_loss: 0.8837, test_loss: 1.0551, test_f1: 0.4795
 epoch: 8, train_loss: 0.8891, test_loss: 1.1044, test_f1: 0.5374
 epoch: 9, train_loss: 0.8499, test_loss: 1.0092, test_f1: 0.5519
 epoch: 10, train_loss: 0.8546, test_loss: 1.0132, test_f1: 0.5773
 epoch: 11, train_loss: 0.8098, test_loss: 1.0480, test_f1: 0.5440
 epoch: 12, train_loss: 0.8005, test_loss: 1.1466, test_f1: 0.5226
 epoch: 13, train_loss: 0.8065, test_loss: 1.2120, test_f1: 0.5088
 epoch: 14, train_loss: 0.8469, test_loss: 1.0093, test_f1: 0.5350
 epoch: 15, train_loss: 0.7949, test_loss: 1.0600, test_f1: 0.5498
 epoch: 16, train_loss: 0.8033, test_loss: 1.2243, test_f1: 0.5548
 epoch: 17, train_loss: 0.7659, test_loss: 1.0200, test_f1: 0.5708
 epoch: 18, train_loss: 0.7582, test_loss: 1.1856, test_f1: 0.5038
 epoch: 19, train_loss: 0.7303, test_loss: 1.2897, test_f1: 0.5880
 epoch: 20, train_loss: 0.6999, test_loss: 1.2393, test_f1: 0.5691
 epoch: 21, train_loss: 0.7044, test_loss: 1.3454, test_f1: 0.4693
 epoch: 22, train_loss: 0.7503, test_loss: 1.2126, test_f1: 0.4469
 epoch: 23, train_loss: 0.7088, test_loss: 1.2165, test_f1: 0.5176
 epoch: 24, train_loss: 0.7075, test_loss: 1.4497, test_f1: 0.4520
 epoch: 25, train_loss: 0.6793, test_loss: 1.1535, test_f1: 0.5387
 epoch: 26, train_loss: 0.6694, test_loss: 1.2472, test_f1: 0.5106
 epoch: 27, train_loss: 0.6563, test_loss: 1.1902, test_f1: 0.5841
 epoch: 28, train_loss: 0.6586, test_loss: 1.2655, test_f1: 0.5836
 epoch: 29, train_loss: 0.6361, test_loss: 1.3675, test_f1: 0.5972
 epoch: 30, train_loss: 0.7004, test_loss: 1.0381, test_f1: 0.5811
 epoch: 31, train_loss: 0.6646, test_loss: 1.1210, test_f1: 0.5684
 epoch: 32, train_loss: 0.6230, test_loss: 1.1696, test_f1: 0.5737
 epoch: 33, train_loss: 0.6009, test_loss: 1.4476, test_f1: 0.5502
 epoch: 34, train_loss: 0.6178, test_loss: 1.2694, test_f1: 0.5603
 epoch: 35, train_loss: 0.6056, test_loss: 1.2670, test_f1: 0.5843
 epoch: 36, train_loss: 0.5900, test_loss: 1.2800, test_f1: 0.6258
 epoch: 37, train_loss: 0.5806, test_loss: 1.3268, test_f1: 0.5729
 epoch: 38, train_loss: 0.5854, test_loss: 1.5729, test_f1: 0.5932
 epoch: 39, train_loss: 0.5955, test_loss: 1.5873, test_f1: 0.5687
 epoch: 40, train_loss: 0.5683, test_loss: 1.5432, test_f1: 0.5636
 epoch: 41, train_loss: 0.5938, test_loss: 1.4143, test_f1: 0.5801
 epoch: 42, train_loss: 0.5643, test_loss: 1.4331, test_f1: 0.5613
 epoch: 43, train_loss: 0.5568, test_loss: 1.3213, test_f1: 0.6345
 epoch: 44, train_loss: 0.5643, test_loss: 1.5005, test_f1: 0.5704
 epoch: 45, train_loss: 0.5563, test_loss: 1.5702, test_f1: 0.4682
 epoch: 46, train_loss: 0.5336, test_loss: 1.5551, test_f1: 0.5083
 epoch: 47, train_loss: 0.5129, test_loss: 1.5066, test_f1: 0.6147
 epoch: 48, train_loss: 0.5200, test_loss: 1.4745, test_f1: 0.5646
 epoch: 49, train_loss: 0.6052, test_loss: 1.3280, test_f1: 0.6100
 epoch: 50, train_loss: 0.5404, test_loss: 1.3347, test_f1: 0.6079
 epoch: 51, train_loss: 0.4874, test_loss: 1.4333, test_f1: 0.6267
 epoch: 52, train_loss: 0.4621, test_loss: 1.2414, test_f1: 0.6462
 epoch: 53, train_loss: 0.4612, test_loss: 1.3422, test_f1: 0.5961
 epoch: 54, train_loss: 0.4343, test_loss: 1.5516, test_f1: 0.6222
 epoch: 55, train_loss: 0.4291, test_loss: 1.4136, test_f1: 0.6285
 epoch: 56, train_loss: 0.4253, test_loss: 1.5225, test_f1: 0.5910
 epoch: 57, train_loss: 0.4201, test_loss: 1.7153, test_f1: 0.6170
 epoch: 58, train_loss: 0.4069, test_loss: 1.7891, test_f1: 0.5934
 epoch: 59, train_loss: 0.4038, test_loss: 1.7099, test_f1: 0.6006
 epoch: 60, train_loss: 0.4014, test_loss: 1.7113, test_f1: 0.5971
 epoch: 61, train_loss: 0.3989, test_loss: 1.7115, test_f1: 0.5948
 epoch: 62, train_loss: 0.3856, test_loss: 1.8210, test_f1: 0.6250
 epoch: 63, train_loss: 0.3959, test_loss: 2.0786, test_f1: 0.5729
 epoch: 64, train_loss: 0.3652, test_loss: 1.8204, test_f1: 0.6047
 epoch: 65, train_loss: 0.3683, test_loss: 2.2557, test_f1: 0.5941
 epoch: 66, train_loss: 0.3942, test_loss: 2.2492, test_f1: 0.5691
 epoch: 67, train_loss: 0.3989, test_loss: 1.8574, test_f1: 0.6159
 epoch: 68, train_loss: 0.4093, test_loss: 1.5290, test_f1: 0.6331
 epoch: 69, train_loss: 0.3921, test_loss: 1.8041, test_f1: 0.6094
 epoch: 70, train_loss: 0.3821, test_loss: 1.8129, test_f1: 0.6284
 epoch: 71, train_loss: 0.3639, test_loss: 1.8357, test_f1: 0.6008
 epoch: 72, train_loss: 0.3595, test_loss: 1.9544, test_f1: 0.5990
 epoch: 73, train_loss: 0.3650, test_loss: 1.8724, test_f1: 0.6343
 epoch: 74, train_loss: 0.3449, test_loss: 2.1564, test_f1: 0.6137
 epoch: 75, train_loss: 0.3379, test_loss: 2.0784, test_f1: 0.4943
 epoch: 76, train_loss: 0.4193, test_loss: 2.4362, test_f1: 0.5742
 epoch: 77, train_loss: 0.4022, test_loss: 1.7918, test_f1: 0.6314
 epoch: 78, train_loss: 0.3537, test_loss: 2.0615, test_f1: 0.5654
 epoch: 79, train_loss: 0.3892, test_loss: 1.8539, test_f1: 0.6225
 epoch: 80, train_loss: 0.3676, test_loss: 1.7067, test_f1: 0.6088
 epoch: 81, train_loss: 0.3451, test_loss: 1.9117, test_f1: 0.6247
 epoch: 82, train_loss: 0.3486, test_loss: 1.7748, test_f1: 0.6370
 epoch: 83, train_loss: 0.3312, test_loss: 1.9705, test_f1: 0.6148
 epoch: 84, train_loss: 0.4040, test_loss: 2.7518, test_f1: 0.5557
 epoch: 85, train_loss: 0.3543, test_loss: 1.9140, test_f1: 0.6126
 epoch: 86, train_loss: 0.3335, test_loss: 2.0899, test_f1: 0.5745
 epoch: 87, train_loss: 0.3373, test_loss: 2.0950, test_f1: 0.6008
 epoch: 88, train_loss: 0.3221, test_loss: 2.2166, test_f1: 0.6088
 epoch: 89, train_loss: 0.3133, test_loss: 2.1552, test_f1: 0.5929
 epoch: 90, train_loss: 0.3170, test_loss: 2.0623, test_f1: 0.6533
 epoch: 91, train_loss: 0.2837, test_loss: 2.0394, test_f1: 0.6085
 epoch: 92, train_loss: 0.2653, test_loss: 2.2017, test_f1: 0.6124
 epoch: 93, train_loss: 0.2744, test_loss: 2.3959, test_f1: 0.6010
 epoch: 94, train_loss: 0.2570, test_loss: 2.4498, test_f1: 0.6181
 epoch: 95, train_loss: 0.2891, test_loss: 2.8320, test_f1: 0.5680
 epoch: 96, train_loss: 0.3333, test_loss: 1.9549, test_f1: 0.6406
 epoch: 97, train_loss: 0.2889, test_loss: 2.3998, test_f1: 0.6192
 epoch: 98, train_loss: 0.2808, test_loss: 2.1370, test_f1: 0.5947
 epoch: 99, train_loss: 0.2718, test_loss: 2.9104, test_f1: 0.5986
##################ITERATION #3 ****************************************
 epoch: 0, train_loss: 1.3304, test_loss: 1.6132, test_f1: 0.1770
 epoch: 1, train_loss: 1.0873, test_loss: 1.3219, test_f1: 0.3066
 epoch: 2, train_loss: 1.0160, test_loss: 1.2071, test_f1: 0.3877
 epoch: 3, train_loss: 0.9798, test_loss: 1.0838, test_f1: 0.4571
 epoch: 4, train_loss: 0.9385, test_loss: 1.0499, test_f1: 0.4925
 epoch: 5, train_loss: 0.9327, test_loss: 1.0349, test_f1: 0.5036
 epoch: 6, train_loss: 0.9175, test_loss: 1.0909, test_f1: 0.5360
 epoch: 7, train_loss: 0.8982, test_loss: 1.0051, test_f1: 0.5514
 epoch: 8, train_loss: 0.8920, test_loss: 1.0257, test_f1: 0.5379
 epoch: 9, train_loss: 0.8597, test_loss: 1.1452, test_f1: 0.5104
 epoch: 10, train_loss: 0.8687, test_loss: 1.0255, test_f1: 0.5737
 epoch: 11, train_loss: 0.8446, test_loss: 1.1831, test_f1: 0.4902
 epoch: 12, train_loss: 0.8259, test_loss: 1.0873, test_f1: 0.5111
 epoch: 13, train_loss: 0.8387, test_loss: 1.0501, test_f1: 0.5252
 epoch: 14, train_loss: 0.7935, test_loss: 1.0369, test_f1: 0.5997
 epoch: 15, train_loss: 0.7952, test_loss: 1.1653, test_f1: 0.5653
 epoch: 16, train_loss: 0.7701, test_loss: 1.0596, test_f1: 0.5786
 epoch: 17, train_loss: 0.7736, test_loss: 1.0737, test_f1: 0.4775
 epoch: 18, train_loss: 0.7350, test_loss: 1.1644, test_f1: 0.4811
 epoch: 19, train_loss: 0.7244, test_loss: 1.2242, test_f1: 0.4644
 epoch: 20, train_loss: 0.7258, test_loss: 1.2166, test_f1: 0.5139
 epoch: 21, train_loss: 0.7003, test_loss: 1.1913, test_f1: 0.5530
 epoch: 22, train_loss: 0.7234, test_loss: 1.3850, test_f1: 0.4025
 epoch: 23, train_loss: 0.7122, test_loss: 1.5497, test_f1: 0.4408
 epoch: 24, train_loss: 0.7280, test_loss: 1.2899, test_f1: 0.5105
 epoch: 25, train_loss: 0.7110, test_loss: 1.1432, test_f1: 0.5470
 epoch: 26, train_loss: 0.7193, test_loss: 1.1821, test_f1: 0.4963
 epoch: 27, train_loss: 0.6978, test_loss: 1.1814, test_f1: 0.5925
 epoch: 28, train_loss: 0.6737, test_loss: 1.4014, test_f1: 0.4959
 epoch: 29, train_loss: 0.6687, test_loss: 1.1824, test_f1: 0.5894
 epoch: 30, train_loss: 0.6533, test_loss: 1.2253, test_f1: 0.5847
 epoch: 31, train_loss: 0.6644, test_loss: 1.2673, test_f1: 0.5841
 epoch: 32, train_loss: 0.6575, test_loss: 1.2557, test_f1: 0.5472
 epoch: 33, train_loss: 0.6473, test_loss: 1.1813, test_f1: 0.5761
 epoch: 34, train_loss: 0.6338, test_loss: 1.2367, test_f1: 0.5787
 epoch: 35, train_loss: 0.6192, test_loss: 1.3301, test_f1: 0.5555
 epoch: 36, train_loss: 0.6037, test_loss: 1.3901, test_f1: 0.5789
 epoch: 37, train_loss: 0.6109, test_loss: 1.7180, test_f1: 0.4819
 epoch: 38, train_loss: 0.6284, test_loss: 1.4031, test_f1: 0.5166
 epoch: 39, train_loss: 0.6728, test_loss: 1.5618, test_f1: 0.4854
 epoch: 40, train_loss: 0.6393, test_loss: 1.2409, test_f1: 0.6053
 epoch: 41, train_loss: 0.6024, test_loss: 1.2403, test_f1: 0.4894
 epoch: 42, train_loss: 0.6014, test_loss: 1.4684, test_f1: 0.5853
 epoch: 43, train_loss: 0.5906, test_loss: 1.1844, test_f1: 0.4532
 epoch: 44, train_loss: 0.6019, test_loss: 1.5245, test_f1: 0.4705
 epoch: 45, train_loss: 0.6102, test_loss: 1.2275, test_f1: 0.6197
 epoch: 46, train_loss: 0.5618, test_loss: 1.4215, test_f1: 0.5199
 epoch: 47, train_loss: 0.5506, test_loss: 1.5233, test_f1: 0.5314
 epoch: 48, train_loss: 0.5452, test_loss: 1.1631, test_f1: 0.6509
 epoch: 49, train_loss: 0.5492, test_loss: 1.5685, test_f1: 0.5712
 epoch: 50, train_loss: 0.5293, test_loss: 1.5678, test_f1: 0.5777
 epoch: 51, train_loss: 0.4976, test_loss: 1.3557, test_f1: 0.6380
 epoch: 52, train_loss: 0.5138, test_loss: 1.5314, test_f1: 0.5914
 epoch: 53, train_loss: 0.4810, test_loss: 1.4990, test_f1: 0.5912
 epoch: 54, train_loss: 0.4833, test_loss: 1.5745, test_f1: 0.6123
 epoch: 55, train_loss: 0.4613, test_loss: 1.4628, test_f1: 0.6444
 epoch: 56, train_loss: 0.4350, test_loss: 1.4978, test_f1: 0.5690
 epoch: 57, train_loss: 0.4626, test_loss: 1.5029, test_f1: 0.6389
 epoch: 58, train_loss: 0.4187, test_loss: 1.5305, test_f1: 0.6438
 epoch: 59, train_loss: 0.4260, test_loss: 1.5156, test_f1: 0.6393
 epoch: 60, train_loss: 0.4229, test_loss: 1.6706, test_f1: 0.6370
 epoch: 61, train_loss: 0.4633, test_loss: 1.5183, test_f1: 0.6083
 epoch: 62, train_loss: 0.4486, test_loss: 1.6541, test_f1: 0.6029
 epoch: 63, train_loss: 0.4042, test_loss: 1.7185, test_f1: 0.5996
 epoch: 64, train_loss: 0.4374, test_loss: 1.7666, test_f1: 0.5979
 epoch: 65, train_loss: 0.4111, test_loss: 1.5857, test_f1: 0.6078
 epoch: 66, train_loss: 0.3942, test_loss: 1.6117, test_f1: 0.6263
 epoch: 67, train_loss: 0.4016, test_loss: 1.7724, test_f1: 0.6031
 epoch: 68, train_loss: 0.4132, test_loss: 1.5533, test_f1: 0.6376
 epoch: 69, train_loss: 0.3934, test_loss: 1.7756, test_f1: 0.5935
 epoch: 70, train_loss: 0.3796, test_loss: 1.7978, test_f1: 0.5950
 epoch: 71, train_loss: 0.4019, test_loss: 2.2582, test_f1: 0.5603
 epoch: 72, train_loss: 0.3893, test_loss: 1.6458, test_f1: 0.6209
 epoch: 73, train_loss: 0.3645, test_loss: 1.8664, test_f1: 0.6125
 epoch: 74, train_loss: 0.3844, test_loss: 1.9980, test_f1: 0.6235
 epoch: 75, train_loss: 0.3697, test_loss: 1.9826, test_f1: 0.5948
 epoch: 76, train_loss: 0.3619, test_loss: 2.2111, test_f1: 0.6058
 epoch: 77, train_loss: 0.3431, test_loss: 2.0097, test_f1: 0.6186
 epoch: 78, train_loss: 0.3456, test_loss: 1.8289, test_f1: 0.6476
 epoch: 79, train_loss: 0.3628, test_loss: 1.9321, test_f1: 0.6264
 epoch: 80, train_loss: 0.3661, test_loss: 2.0802, test_f1: 0.6003
 epoch: 81, train_loss: 0.3673, test_loss: 2.3004, test_f1: 0.6243
 epoch: 82, train_loss: 0.3586, test_loss: 1.9207, test_f1: 0.6009
 epoch: 83, train_loss: 0.3201, test_loss: 2.1635, test_f1: 0.6251
 epoch: 84, train_loss: 0.2948, test_loss: 1.9907, test_f1: 0.6082
 epoch: 85, train_loss: 0.3132, test_loss: 2.0587, test_f1: 0.6200
 epoch: 86, train_loss: 0.3003, test_loss: 2.0915, test_f1: 0.5965
 epoch: 87, train_loss: 0.2977, test_loss: 2.0813, test_f1: 0.6038
 epoch: 88, train_loss: 0.2977, test_loss: 2.0088, test_f1: 0.6375
 epoch: 89, train_loss: 0.3282, test_loss: 2.8926, test_f1: 0.5716
 epoch: 90, train_loss: 0.3404, test_loss: 2.3563, test_f1: 0.5781
 epoch: 91, train_loss: 0.3071, test_loss: 3.0417, test_f1: 0.5681
 epoch: 92, train_loss: 0.3356, test_loss: 2.3044, test_f1: 0.6105
 epoch: 93, train_loss: 0.3312, test_loss: 2.4377, test_f1: 0.5544
 epoch: 94, train_loss: 0.3198, test_loss: 2.2401, test_f1: 0.5948
 epoch: 95, train_loss: 0.3231, test_loss: 1.9355, test_f1: 0.6223
 epoch: 96, train_loss: 0.3357, test_loss: 1.8907, test_f1: 0.6273
 epoch: 97, train_loss: 0.2931, test_loss: 1.7861, test_f1: 0.6295
 epoch: 98, train_loss: 0.3020, test_loss: 2.1519, test_f1: 0.6259
 epoch: 99, train_loss: 0.2811, test_loss: 2.6364, test_f1: 0.5846
##################ITERATION #4 ****************************************
 epoch: 0, train_loss: 1.4240, test_loss: 1.4419, test_f1: 0.2206
 epoch: 1, train_loss: 1.0421, test_loss: 1.2409, test_f1: 0.4315
 epoch: 2, train_loss: 0.9710, test_loss: 1.1721, test_f1: 0.4670
 epoch: 3, train_loss: 0.9680, test_loss: 1.2015, test_f1: 0.4242
 epoch: 4, train_loss: 0.9443, test_loss: 1.1069, test_f1: 0.4853
 epoch: 5, train_loss: 0.9065, test_loss: 1.1615, test_f1: 0.4911
 epoch: 6, train_loss: 0.9111, test_loss: 1.0472, test_f1: 0.5047
 epoch: 7, train_loss: 0.8963, test_loss: 1.1058, test_f1: 0.5306
 epoch: 8, train_loss: 0.9130, test_loss: 1.2374, test_f1: 0.4825
 epoch: 9, train_loss: 0.8967, test_loss: 1.0555, test_f1: 0.5571
 epoch: 10, train_loss: 0.8603, test_loss: 1.0268, test_f1: 0.5469
 epoch: 11, train_loss: 0.8230, test_loss: 1.1598, test_f1: 0.4520
 epoch: 12, train_loss: 0.8103, test_loss: 1.0820, test_f1: 0.5908
 epoch: 13, train_loss: 0.8031, test_loss: 1.1021, test_f1: 0.5175
 epoch: 14, train_loss: 0.7835, test_loss: 1.1013, test_f1: 0.5592
 epoch: 15, train_loss: 0.7877, test_loss: 1.1568, test_f1: 0.5510
 epoch: 16, train_loss: 0.7700, test_loss: 1.2194, test_f1: 0.5491
 epoch: 17, train_loss: 0.7379, test_loss: 1.1838, test_f1: 0.5301
 epoch: 18, train_loss: 0.7617, test_loss: 1.0730, test_f1: 0.5728
 epoch: 19, train_loss: 0.7392, test_loss: 1.0596, test_f1: 0.5374
 epoch: 20, train_loss: 0.7372, test_loss: 1.1708, test_f1: 0.5459
 epoch: 21, train_loss: 0.7257, test_loss: 1.1517, test_f1: 0.5398
 epoch: 22, train_loss: 0.7137, test_loss: 1.1225, test_f1: 0.5986
 epoch: 23, train_loss: 0.6746, test_loss: 1.1698, test_f1: 0.5744
 epoch: 24, train_loss: 0.6748, test_loss: 1.1620, test_f1: 0.5601
 epoch: 25, train_loss: 0.6806, test_loss: 1.2262, test_f1: 0.5998
 epoch: 26, train_loss: 0.6638, test_loss: 1.1022, test_f1: 0.6169
 epoch: 27, train_loss: 0.6543, test_loss: 1.1382, test_f1: 0.5762
 epoch: 28, train_loss: 0.6546, test_loss: 1.1470, test_f1: 0.5574
 epoch: 29, train_loss: 0.6629, test_loss: 1.1473, test_f1: 0.5405
 epoch: 30, train_loss: 0.6523, test_loss: 1.0970, test_f1: 0.6550
 epoch: 31, train_loss: 0.6575, test_loss: 1.2675, test_f1: 0.6010
 epoch: 32, train_loss: 0.6571, test_loss: 1.3620, test_f1: 0.5610
 epoch: 33, train_loss: 0.6593, test_loss: 1.2058, test_f1: 0.5610
 epoch: 34, train_loss: 0.6358, test_loss: 1.1507, test_f1: 0.6101
 epoch: 35, train_loss: 0.6102, test_loss: 1.2538, test_f1: 0.5570
 epoch: 36, train_loss: 0.6098, test_loss: 1.1817, test_f1: 0.6118
 epoch: 37, train_loss: 0.6032, test_loss: 1.2697, test_f1: 0.5464
 epoch: 38, train_loss: 0.5554, test_loss: 1.4232, test_f1: 0.5453
 epoch: 39, train_loss: 0.6161, test_loss: 1.3203, test_f1: 0.5507
 epoch: 40, train_loss: 0.5895, test_loss: 1.4114, test_f1: 0.5201
 epoch: 41, train_loss: 0.5910, test_loss: 1.2828, test_f1: 0.6035
 epoch: 42, train_loss: 0.6001, test_loss: 1.3146, test_f1: 0.5637
 epoch: 43, train_loss: 0.5450, test_loss: 1.4106, test_f1: 0.5874
 epoch: 44, train_loss: 0.5879, test_loss: 1.3063, test_f1: 0.5519
 epoch: 45, train_loss: 0.5525, test_loss: 1.3473, test_f1: 0.5840
 epoch: 46, train_loss: 0.5499, test_loss: 1.2520, test_f1: 0.6121
 epoch: 47, train_loss: 0.5735, test_loss: 1.1658, test_f1: 0.5803
 epoch: 48, train_loss: 0.5755, test_loss: 1.1402, test_f1: 0.6266
 epoch: 49, train_loss: 0.5587, test_loss: 1.3029, test_f1: 0.5363
 epoch: 50, train_loss: 0.5345, test_loss: 1.4965, test_f1: 0.5937
 epoch: 51, train_loss: 0.5202, test_loss: 1.2998, test_f1: 0.5948
 epoch: 52, train_loss: 0.4958, test_loss: 1.2210, test_f1: 0.5791
 epoch: 53, train_loss: 0.4988, test_loss: 1.3097, test_f1: 0.5925
 epoch: 54, train_loss: 0.4630, test_loss: 1.4132, test_f1: 0.5977
 epoch: 55, train_loss: 0.4569, test_loss: 1.5236, test_f1: 0.5756
 epoch: 56, train_loss: 0.4578, test_loss: 1.4072, test_f1: 0.6127
 epoch: 57, train_loss: 0.4971, test_loss: 1.3972, test_f1: 0.5900
 epoch: 58, train_loss: 0.4366, test_loss: 1.4112, test_f1: 0.5714
 epoch: 59, train_loss: 0.4512, test_loss: 1.4734, test_f1: 0.5745
 epoch: 60, train_loss: 0.4585, test_loss: 1.5222, test_f1: 0.5876
 epoch: 61, train_loss: 0.4423, test_loss: 1.4206, test_f1: 0.6093
 epoch: 62, train_loss: 0.4110, test_loss: 1.6440, test_f1: 0.5819
 epoch: 63, train_loss: 0.3876, test_loss: 1.9117, test_f1: 0.5773
 epoch: 64, train_loss: 0.4031, test_loss: 1.5776, test_f1: 0.6077
 epoch: 65, train_loss: 0.4253, test_loss: 1.5717, test_f1: 0.6093
 epoch: 66, train_loss: 0.3995, test_loss: 1.7703, test_f1: 0.6049
 epoch: 67, train_loss: 0.4069, test_loss: 1.7079, test_f1: 0.5830
 epoch: 68, train_loss: 0.4191, test_loss: 1.7301, test_f1: 0.5997
 epoch: 69, train_loss: 0.4102, test_loss: 1.6092, test_f1: 0.5865
 epoch: 70, train_loss: 0.3975, test_loss: 1.4863, test_f1: 0.5980
 epoch: 71, train_loss: 0.3845, test_loss: 1.5340, test_f1: 0.5998
 epoch: 72, train_loss: 0.3948, test_loss: 1.7340, test_f1: 0.6314
 epoch: 73, train_loss: 0.3572, test_loss: 1.9200, test_f1: 0.6373
 epoch: 74, train_loss: 0.3564, test_loss: 1.7089, test_f1: 0.5741
 epoch: 75, train_loss: 0.3586, test_loss: 1.6707, test_f1: 0.6070
 epoch: 76, train_loss: 0.3600, test_loss: 1.7894, test_f1: 0.6131
 epoch: 77, train_loss: 0.3629, test_loss: 1.8374, test_f1: 0.5772
 epoch: 78, train_loss: 0.3489, test_loss: 1.6183, test_f1: 0.6025
 epoch: 79, train_loss: 0.3333, test_loss: 1.9214, test_f1: 0.6061
 epoch: 80, train_loss: 0.3369, test_loss: 2.0405, test_f1: 0.6028
 epoch: 81, train_loss: 0.3458, test_loss: 1.9451, test_f1: 0.5684
 epoch: 82, train_loss: 0.3508, test_loss: 1.8925, test_f1: 0.6098
 epoch: 83, train_loss: 0.3591, test_loss: 1.9075, test_f1: 0.6024
 epoch: 84, train_loss: 0.3344, test_loss: 1.7874, test_f1: 0.5957
 epoch: 85, train_loss: 0.3663, test_loss: 2.2137, test_f1: 0.5668
 epoch: 86, train_loss: 0.3559, test_loss: 2.2625, test_f1: 0.6036
 epoch: 87, train_loss: 0.3380, test_loss: 1.9741, test_f1: 0.5730
 epoch: 88, train_loss: 0.3384, test_loss: 1.9717, test_f1: 0.5764
 epoch: 89, train_loss: 0.3427, test_loss: 1.8312, test_f1: 0.6371
 epoch: 90, train_loss: 0.3160, test_loss: 2.1096, test_f1: 0.5971
 epoch: 91, train_loss: 0.3212, test_loss: 2.1458, test_f1: 0.6331
 epoch: 92, train_loss: 0.3236, test_loss: 2.2381, test_f1: 0.5497
 epoch: 93, train_loss: 0.2723, test_loss: 1.9423, test_f1: 0.6002
 epoch: 94, train_loss: 0.2935, test_loss: 2.3464, test_f1: 0.5933
 epoch: 95, train_loss: 0.2825, test_loss: 2.6489, test_f1: 0.6071
 epoch: 96, train_loss: 0.2930, test_loss: 2.6488, test_f1: 0.5879
 epoch: 97, train_loss: 0.3326, test_loss: 2.0622, test_f1: 0.5735
 epoch: 98, train_loss: 0.2925, test_loss: 2.0917, test_f1: 0.5753
 epoch: 99, train_loss: 0.3460, test_loss: 2.2977, test_f1: 0.5877
##################ITERATION #5 ****************************************
 epoch: 0, train_loss: 1.3328, test_loss: 1.6355, test_f1: 0.1377
 epoch: 1, train_loss: 1.0903, test_loss: 1.1998, test_f1: 0.4425
 epoch: 2, train_loss: 1.0091, test_loss: 1.1401, test_f1: 0.4389
 epoch: 3, train_loss: 0.9684, test_loss: 1.1338, test_f1: 0.4796
 epoch: 4, train_loss: 0.9427, test_loss: 1.0545, test_f1: 0.5052
 epoch: 5, train_loss: 0.9377, test_loss: 1.0884, test_f1: 0.5339
 epoch: 6, train_loss: 0.9168, test_loss: 1.1122, test_f1: 0.5272
 epoch: 7, train_loss: 0.9041, test_loss: 1.0910, test_f1: 0.5427
 epoch: 8, train_loss: 0.8966, test_loss: 1.0871, test_f1: 0.5407
 epoch: 9, train_loss: 0.8953, test_loss: 1.0282, test_f1: 0.5282
 epoch: 10, train_loss: 0.8900, test_loss: 1.0196, test_f1: 0.5558
 epoch: 11, train_loss: 0.8795, test_loss: 1.0648, test_f1: 0.5314
 epoch: 12, train_loss: 0.8618, test_loss: 1.0443, test_f1: 0.5716
 epoch: 13, train_loss: 0.8965, test_loss: 0.9727, test_f1: 0.5518
 epoch: 14, train_loss: 0.8636, test_loss: 1.0249, test_f1: 0.5847
 epoch: 15, train_loss: 0.8375, test_loss: 1.0596, test_f1: 0.5318
 epoch: 16, train_loss: 0.8416, test_loss: 1.0245, test_f1: 0.5942
 epoch: 17, train_loss: 0.8366, test_loss: 0.9788, test_f1: 0.5820
 epoch: 18, train_loss: 0.8205, test_loss: 1.1161, test_f1: 0.5656
 epoch: 19, train_loss: 0.8090, test_loss: 1.0792, test_f1: 0.5246
 epoch: 20, train_loss: 0.8307, test_loss: 1.0365, test_f1: 0.5705
 epoch: 21, train_loss: 0.8082, test_loss: 1.1312, test_f1: 0.5353
 epoch: 22, train_loss: 0.7520, test_loss: 1.1137, test_f1: 0.5032
 epoch: 23, train_loss: 0.7429, test_loss: 1.3367, test_f1: 0.4270
 epoch: 24, train_loss: 0.7167, test_loss: 1.0365, test_f1: 0.5910
 epoch: 25, train_loss: 0.7202, test_loss: 1.4511, test_f1: 0.5066
 epoch: 26, train_loss: 0.7770, test_loss: 1.1079, test_f1: 0.5322
 epoch: 27, train_loss: 0.7743, test_loss: 1.2997, test_f1: 0.5588
 epoch: 28, train_loss: 0.7548, test_loss: 1.1923, test_f1: 0.5691
 epoch: 29, train_loss: 0.7203, test_loss: 2.2290, test_f1: 0.3672
 epoch: 30, train_loss: 0.7112, test_loss: 1.1985, test_f1: 0.5853
 epoch: 31, train_loss: 0.7022, test_loss: 1.2674, test_f1: 0.5755
 epoch: 32, train_loss: 0.7131, test_loss: 1.0801, test_f1: 0.5745
 epoch: 33, train_loss: 0.6505, test_loss: 1.2151, test_f1: 0.5653
 epoch: 34, train_loss: 0.6696, test_loss: 1.3117, test_f1: 0.5319
 epoch: 35, train_loss: 0.6795, test_loss: 1.1581, test_f1: 0.5936
 epoch: 36, train_loss: 0.6441, test_loss: 1.2509, test_f1: 0.5977
 epoch: 37, train_loss: 0.6223, test_loss: 1.2050, test_f1: 0.6048
 epoch: 38, train_loss: 0.5868, test_loss: 1.2221, test_f1: 0.5813
 epoch: 39, train_loss: 0.6288, test_loss: 1.2339, test_f1: 0.5905
 epoch: 40, train_loss: 0.6302, test_loss: 1.2255, test_f1: 0.5773
 epoch: 41, train_loss: 0.6160, test_loss: 1.2648, test_f1: 0.5430
 epoch: 42, train_loss: 0.6597, test_loss: 1.4048, test_f1: 0.5001
 epoch: 43, train_loss: 0.6115, test_loss: 1.1828, test_f1: 0.5658
 epoch: 44, train_loss: 0.6247, test_loss: 1.2140, test_f1: 0.5920
 epoch: 45, train_loss: 0.6078, test_loss: 1.3114, test_f1: 0.5867
 epoch: 46, train_loss: 0.5729, test_loss: 1.3039, test_f1: 0.5969
 epoch: 47, train_loss: 0.5682, test_loss: 1.4045, test_f1: 0.5770
 epoch: 48, train_loss: 0.5462, test_loss: 1.3777, test_f1: 0.5728
 epoch: 49, train_loss: 0.5537, test_loss: 1.4898, test_f1: 0.5135
 epoch: 50, train_loss: 0.6065, test_loss: 1.4315, test_f1: 0.5882
 epoch: 51, train_loss: 0.5463, test_loss: 1.4391, test_f1: 0.6096
 epoch: 52, train_loss: 0.4754, test_loss: 1.3655, test_f1: 0.6314
 epoch: 53, train_loss: 0.4794, test_loss: 1.5839, test_f1: 0.6024
 epoch: 54, train_loss: 0.4917, test_loss: 1.4411, test_f1: 0.6090
 epoch: 55, train_loss: 0.4880, test_loss: 1.4199, test_f1: 0.5998
 epoch: 56, train_loss: 0.4683, test_loss: 1.6001, test_f1: 0.5802
 epoch: 57, train_loss: 0.4690, test_loss: 1.5049, test_f1: 0.5883
 epoch: 58, train_loss: 0.4709, test_loss: 1.5942, test_f1: 0.5571
 epoch: 59, train_loss: 0.4539, test_loss: 1.6007, test_f1: 0.6033
 epoch: 60, train_loss: 0.4582, test_loss: 1.4812, test_f1: 0.5850
 epoch: 61, train_loss: 0.4377, test_loss: 1.5600, test_f1: 0.6169
 epoch: 62, train_loss: 0.4006, test_loss: 1.7713, test_f1: 0.5962
 epoch: 63, train_loss: 0.4104, test_loss: 1.7766, test_f1: 0.5929
 epoch: 64, train_loss: 0.4173, test_loss: 1.7008, test_f1: 0.5996
 epoch: 65, train_loss: 0.4620, test_loss: 1.6138, test_f1: 0.6083
 epoch: 66, train_loss: 0.4079, test_loss: 1.4534, test_f1: 0.6189
 epoch: 67, train_loss: 0.3928, test_loss: 1.6165, test_f1: 0.5838
 epoch: 68, train_loss: 0.4172, test_loss: 1.7955, test_f1: 0.5550
 epoch: 69, train_loss: 0.3782, test_loss: 1.6778, test_f1: 0.5848
 epoch: 70, train_loss: 0.3926, test_loss: 1.9868, test_f1: 0.5723
 epoch: 71, train_loss: 0.3928, test_loss: 1.5073, test_f1: 0.6167
 epoch: 72, train_loss: 0.3529, test_loss: 2.0063, test_f1: 0.5767
 epoch: 73, train_loss: 0.3816, test_loss: 1.9021, test_f1: 0.5920
 epoch: 74, train_loss: 0.3605, test_loss: 1.8799, test_f1: 0.5653
 epoch: 75, train_loss: 0.3257, test_loss: 1.9706, test_f1: 0.5780
 epoch: 76, train_loss: 0.3507, test_loss: 1.7748, test_f1: 0.6078
 epoch: 77, train_loss: 0.3761, test_loss: 1.9057, test_f1: 0.5631
 epoch: 78, train_loss: 0.3514, test_loss: 1.6379, test_f1: 0.6097
 epoch: 79, train_loss: 0.3490, test_loss: 1.9272, test_f1: 0.6249
 epoch: 80, train_loss: 0.3128, test_loss: 1.7381, test_f1: 0.5869
 epoch: 81, train_loss: 0.3087, test_loss: 1.8407, test_f1: 0.5950
 epoch: 82, train_loss: 0.2998, test_loss: 2.1837, test_f1: 0.5962
 epoch: 83, train_loss: 0.3282, test_loss: 2.1917, test_f1: 0.5695
 epoch: 84, train_loss: 0.3630, test_loss: 1.6831, test_f1: 0.6252
 epoch: 85, train_loss: 0.3308, test_loss: 1.6476, test_f1: 0.6210
 epoch: 86, train_loss: 0.3169, test_loss: 1.9689, test_f1: 0.6157
 epoch: 87, train_loss: 0.3537, test_loss: 1.9633, test_f1: 0.6176
 epoch: 88, train_loss: 0.3077, test_loss: 1.9013, test_f1: 0.6330
 epoch: 89, train_loss: 0.2975, test_loss: 1.9232, test_f1: 0.6020
 epoch: 90, train_loss: 0.3013, test_loss: 1.9361, test_f1: 0.5940
 epoch: 91, train_loss: 0.2812, test_loss: 2.0878, test_f1: 0.6222
 epoch: 92, train_loss: 0.3187, test_loss: 1.8369, test_f1: 0.5693
 epoch: 93, train_loss: 0.3636, test_loss: 2.0391, test_f1: 0.6020
 epoch: 94, train_loss: 0.3259, test_loss: 2.1671, test_f1: 0.6208
 epoch: 95, train_loss: 0.2800, test_loss: 2.0555, test_f1: 0.6285
 epoch: 96, train_loss: 0.4375, test_loss: 2.0000, test_f1: 0.6020
 epoch: 97, train_loss: 0.4185, test_loss: 1.7280, test_f1: 0.6190
 epoch: 98, train_loss: 0.3892, test_loss: 1.7581, test_f1: 0.5123
 epoch: 99, train_loss: 0.3271, test_loss: 2.0320, test_f1: 0.5800
##################ITERATION #6 ****************************************
 epoch: 0, train_loss: 1.4057, test_loss: 1.4327, test_f1: 0.2370
 epoch: 1, train_loss: 1.0872, test_loss: 1.3073, test_f1: 0.2787
 epoch: 2, train_loss: 1.0297, test_loss: 1.0878, test_f1: 0.5052
 epoch: 3, train_loss: 0.9840, test_loss: 1.0594, test_f1: 0.4860
 epoch: 4, train_loss: 0.9528, test_loss: 1.0871, test_f1: 0.5182
 epoch: 5, train_loss: 0.9246, test_loss: 1.0291, test_f1: 0.5692
 epoch: 6, train_loss: 0.9136, test_loss: 1.1239, test_f1: 0.4998
 epoch: 7, train_loss: 0.8771, test_loss: 1.0683, test_f1: 0.5399
 epoch: 8, train_loss: 0.9037, test_loss: 1.0821, test_f1: 0.5890
 epoch: 9, train_loss: 0.8919, test_loss: 1.0886, test_f1: 0.5580
 epoch: 10, train_loss: 0.8484, test_loss: 1.0884, test_f1: 0.5292
 epoch: 11, train_loss: 0.8437, test_loss: 1.1848, test_f1: 0.4421
 epoch: 12, train_loss: 0.8381, test_loss: 1.0156, test_f1: 0.5693
 epoch: 13, train_loss: 0.8302, test_loss: 1.1276, test_f1: 0.5145
 epoch: 14, train_loss: 0.8117, test_loss: 1.1476, test_f1: 0.5212
 epoch: 15, train_loss: 0.8128, test_loss: 1.1438, test_f1: 0.5165
 epoch: 16, train_loss: 0.7667, test_loss: 1.1906, test_f1: 0.5595
 epoch: 17, train_loss: 0.7364, test_loss: 1.1035, test_f1: 0.5115
 epoch: 18, train_loss: 0.7430, test_loss: 1.1603, test_f1: 0.5430
 epoch: 19, train_loss: 0.7470, test_loss: 1.1058, test_f1: 0.5868
 epoch: 20, train_loss: 0.7084, test_loss: 1.0500, test_f1: 0.5699
 epoch: 21, train_loss: 0.7133, test_loss: 1.2417, test_f1: 0.5770
 epoch: 22, train_loss: 0.6951, test_loss: 1.1608, test_f1: 0.5672
 epoch: 23, train_loss: 0.6745, test_loss: 1.1091, test_f1: 0.5714
 epoch: 24, train_loss: 0.6698, test_loss: 1.2247, test_f1: 0.5718
 epoch: 25, train_loss: 0.6841, test_loss: 1.1564, test_f1: 0.5947
 epoch: 26, train_loss: 0.6624, test_loss: 1.2068, test_f1: 0.5870
 epoch: 27, train_loss: 0.6493, test_loss: 1.1544, test_f1: 0.5873
 epoch: 28, train_loss: 0.6471, test_loss: 1.4127, test_f1: 0.5141
 epoch: 29, train_loss: 0.6461, test_loss: 1.1586, test_f1: 0.6167
 epoch: 30, train_loss: 0.6314, test_loss: 1.1191, test_f1: 0.5956
 epoch: 31, train_loss: 0.6081, test_loss: 1.1704, test_f1: 0.5815
 epoch: 32, train_loss: 0.6251, test_loss: 1.6713, test_f1: 0.4788
 epoch: 33, train_loss: 0.6455, test_loss: 1.2131, test_f1: 0.5463
 epoch: 34, train_loss: 0.6230, test_loss: 1.4048, test_f1: 0.4973
 epoch: 35, train_loss: 0.6151, test_loss: 1.4054, test_f1: 0.5258
 epoch: 36, train_loss: 0.6136, test_loss: 1.4671, test_f1: 0.5606
 epoch: 37, train_loss: 0.5680, test_loss: 1.1934, test_f1: 0.5306
 epoch: 38, train_loss: 0.5693, test_loss: 1.1508, test_f1: 0.6083
 epoch: 39, train_loss: 0.6417, test_loss: 2.2507, test_f1: 0.4922
 epoch: 40, train_loss: 0.5965, test_loss: 1.5251, test_f1: 0.4769
 epoch: 41, train_loss: 0.6166, test_loss: 1.1707, test_f1: 0.6124
 epoch: 42, train_loss: 0.5820, test_loss: 2.1347, test_f1: 0.4628
 epoch: 43, train_loss: 0.6015, test_loss: 1.1756, test_f1: 0.5827
 epoch: 44, train_loss: 0.5588, test_loss: 1.3388, test_f1: 0.5706
 epoch: 45, train_loss: 0.5238, test_loss: 1.5588, test_f1: 0.5542
 epoch: 46, train_loss: 0.5498, test_loss: 1.2342, test_f1: 0.6257
 epoch: 47, train_loss: 0.5254, test_loss: 1.2042, test_f1: 0.6231
 epoch: 48, train_loss: 0.5193, test_loss: 1.4867, test_f1: 0.6149
 epoch: 49, train_loss: 0.5508, test_loss: 1.4710, test_f1: 0.5271
 epoch: 50, train_loss: 0.5206, test_loss: 1.5344, test_f1: 0.4903
 epoch: 51, train_loss: 0.4795, test_loss: 1.2241, test_f1: 0.6201
 epoch: 52, train_loss: 0.4842, test_loss: 1.3360, test_f1: 0.6256
 epoch: 53, train_loss: 0.4588, test_loss: 1.2525, test_f1: 0.6237
 epoch: 54, train_loss: 0.4406, test_loss: 1.5566, test_f1: 0.6010
 epoch: 55, train_loss: 0.4186, test_loss: 1.4684, test_f1: 0.5654
 epoch: 56, train_loss: 0.4101, test_loss: 1.5812, test_f1: 0.6010
 epoch: 57, train_loss: 0.4045, test_loss: 1.6161, test_f1: 0.5810
 epoch: 58, train_loss: 0.4117, test_loss: 1.6406, test_f1: 0.5825
 epoch: 59, train_loss: 0.3971, test_loss: 1.7223, test_f1: 0.5839
 epoch: 60, train_loss: 0.4181, test_loss: 1.4029, test_f1: 0.6044
 epoch: 61, train_loss: 0.4469, test_loss: 1.4459, test_f1: 0.6313
 epoch: 62, train_loss: 0.3951, test_loss: 1.6428, test_f1: 0.6079
 epoch: 63, train_loss: 0.4360, test_loss: 1.7015, test_f1: 0.5552
 epoch: 64, train_loss: 0.4118, test_loss: 1.7541, test_f1: 0.5728
 epoch: 65, train_loss: 0.4059, test_loss: 1.6288, test_f1: 0.5676
 epoch: 66, train_loss: 0.3733, test_loss: 1.7087, test_f1: 0.5980
 epoch: 67, train_loss: 0.3607, test_loss: 1.6528, test_f1: 0.6024
 epoch: 68, train_loss: 0.3850, test_loss: 1.8355, test_f1: 0.5620
 epoch: 69, train_loss: 0.3746, test_loss: 1.7025, test_f1: 0.5906
 epoch: 70, train_loss: 0.4373, test_loss: 1.9279, test_f1: 0.5434
 epoch: 71, train_loss: 0.4022, test_loss: 1.4971, test_f1: 0.5873
 epoch: 72, train_loss: 0.3597, test_loss: 1.4586, test_f1: 0.6219
 epoch: 73, train_loss: 0.3673, test_loss: 1.7049, test_f1: 0.5927
 epoch: 74, train_loss: 0.3425, test_loss: 1.6806, test_f1: 0.6011
 epoch: 75, train_loss: 0.3115, test_loss: 1.6880, test_f1: 0.6276
 epoch: 76, train_loss: 0.3507, test_loss: 1.6026, test_f1: 0.5898
 epoch: 77, train_loss: 0.3285, test_loss: 1.8131, test_f1: 0.5696
 epoch: 78, train_loss: 0.3756, test_loss: 1.7455, test_f1: 0.5822
 epoch: 79, train_loss: 0.3630, test_loss: 1.7601, test_f1: 0.6102
 epoch: 80, train_loss: 0.3572, test_loss: 1.6502, test_f1: 0.5864
 epoch: 81, train_loss: 0.3515, test_loss: 1.7422, test_f1: 0.6040
 epoch: 82, train_loss: 0.3070, test_loss: 1.5517, test_f1: 0.5971
 epoch: 83, train_loss: 0.3228, test_loss: 1.7084, test_f1: 0.5710
 epoch: 84, train_loss: 0.3186, test_loss: 1.8917, test_f1: 0.5747
 epoch: 85, train_loss: 0.3138, test_loss: 1.6763, test_f1: 0.5953
 epoch: 86, train_loss: 0.2842, test_loss: 1.7048, test_f1: 0.5959
 epoch: 87, train_loss: 0.3611, test_loss: 2.5047, test_f1: 0.5274
 epoch: 88, train_loss: 0.3409, test_loss: 1.6400, test_f1: 0.5899
 epoch: 89, train_loss: 0.2836, test_loss: 2.1478, test_f1: 0.5770
 epoch: 90, train_loss: 0.2984, test_loss: 2.1142, test_f1: 0.6004
 epoch: 91, train_loss: 0.2911, test_loss: 1.9131, test_f1: 0.5718
 epoch: 92, train_loss: 0.3163, test_loss: 1.7890, test_f1: 0.5888
 epoch: 93, train_loss: 0.2558, test_loss: 1.8951, test_f1: 0.5666
 epoch: 94, train_loss: 0.2824, test_loss: 1.7961, test_f1: 0.5908
 epoch: 95, train_loss: 0.2797, test_loss: 2.2285, test_f1: 0.5947
 epoch: 96, train_loss: 0.2930, test_loss: 2.1722, test_f1: 0.6023
 epoch: 97, train_loss: 0.2600, test_loss: 2.1775, test_f1: 0.5624
 epoch: 98, train_loss: 0.3277, test_loss: 1.7671, test_f1: 0.5812
 epoch: 99, train_loss: 0.3065, test_loss: 2.1799, test_f1: 0.5245
##################ITERATION #7 ****************************************
 epoch: 0, train_loss: 1.3823, test_loss: 1.5365, test_f1: 0.1704
 epoch: 1, train_loss: 1.0565, test_loss: 1.2687, test_f1: 0.2545
 epoch: 2, train_loss: 1.0074, test_loss: 1.2027, test_f1: 0.4365
 epoch: 3, train_loss: 0.9445, test_loss: 1.1819, test_f1: 0.4902
 epoch: 4, train_loss: 0.9312, test_loss: 1.0957, test_f1: 0.4718
 epoch: 5, train_loss: 0.9129, test_loss: 1.0618, test_f1: 0.5255
 epoch: 6, train_loss: 0.8952, test_loss: 1.0971, test_f1: 0.5146
 epoch: 7, train_loss: 0.8866, test_loss: 1.1094, test_f1: 0.5204
 epoch: 8, train_loss: 0.8776, test_loss: 1.0907, test_f1: 0.5484
 epoch: 9, train_loss: 0.8648, test_loss: 1.0569, test_f1: 0.5067
 epoch: 10, train_loss: 0.8744, test_loss: 1.2025, test_f1: 0.5261
 epoch: 11, train_loss: 0.8590, test_loss: 1.0056, test_f1: 0.5564
 epoch: 12, train_loss: 0.8460, test_loss: 1.0440, test_f1: 0.5707
 epoch: 13, train_loss: 0.8063, test_loss: 1.2191, test_f1: 0.5299
 epoch: 14, train_loss: 0.8054, test_loss: 1.1009, test_f1: 0.5275
 epoch: 15, train_loss: 0.8016, test_loss: 1.1155, test_f1: 0.5674
 epoch: 16, train_loss: 0.7519, test_loss: 1.1319, test_f1: 0.5424
 epoch: 17, train_loss: 0.7565, test_loss: 1.0910, test_f1: 0.5581
 epoch: 18, train_loss: 0.7638, test_loss: 1.0493, test_f1: 0.5536
 epoch: 19, train_loss: 0.7593, test_loss: 1.2276, test_f1: 0.5231
 epoch: 20, train_loss: 0.7246, test_loss: 1.0856, test_f1: 0.5665
 epoch: 21, train_loss: 0.6940, test_loss: 1.1553, test_f1: 0.5621
 epoch: 22, train_loss: 0.6860, test_loss: 1.1151, test_f1: 0.5936
 epoch: 23, train_loss: 0.6998, test_loss: 1.0831, test_f1: 0.5829
 epoch: 24, train_loss: 0.7246, test_loss: 1.2123, test_f1: 0.5528
 epoch: 25, train_loss: 0.7218, test_loss: 1.2263, test_f1: 0.5094
 epoch: 26, train_loss: 0.6902, test_loss: 1.4877, test_f1: 0.4998
 epoch: 27, train_loss: 0.6585, test_loss: 1.2405, test_f1: 0.5712
 epoch: 28, train_loss: 0.6806, test_loss: 1.1089, test_f1: 0.5860
 epoch: 29, train_loss: 0.6452, test_loss: 1.2868, test_f1: 0.5164
 epoch: 30, train_loss: 0.6759, test_loss: 1.3695, test_f1: 0.5748
 epoch: 31, train_loss: 0.6683, test_loss: 1.2553, test_f1: 0.5615
 epoch: 32, train_loss: 0.6432, test_loss: 1.1016, test_f1: 0.6075
 epoch: 33, train_loss: 0.6213, test_loss: 1.1492, test_f1: 0.5521
 epoch: 34, train_loss: 0.6341, test_loss: 1.2303, test_f1: 0.5963
 epoch: 35, train_loss: 0.6219, test_loss: 1.2385, test_f1: 0.5869
 epoch: 36, train_loss: 0.5689, test_loss: 1.6437, test_f1: 0.4789
 epoch: 37, train_loss: 0.6163, test_loss: 1.2911, test_f1: 0.5800
 epoch: 38, train_loss: 0.6057, test_loss: 1.4200, test_f1: 0.4549
 epoch: 39, train_loss: 0.6580, test_loss: 1.2508, test_f1: 0.5195
 epoch: 40, train_loss: 0.6083, test_loss: 1.1303, test_f1: 0.5787
 epoch: 41, train_loss: 0.5748, test_loss: 1.1996, test_f1: 0.5178
 epoch: 42, train_loss: 0.5653, test_loss: 1.3704, test_f1: 0.5358
 epoch: 43, train_loss: 0.5755, test_loss: 1.3079, test_f1: 0.5646
 epoch: 44, train_loss: 0.5566, test_loss: 1.4235, test_f1: 0.5356
 epoch: 45, train_loss: 0.5613, test_loss: 1.6845, test_f1: 0.5330
 epoch: 46, train_loss: 0.6041, test_loss: 1.4789, test_f1: 0.5971
 epoch: 47, train_loss: 0.5815, test_loss: 1.2519, test_f1: 0.6005
 epoch: 48, train_loss: 0.5792, test_loss: 1.4373, test_f1: 0.5104
 epoch: 49, train_loss: 0.5801, test_loss: 1.3612, test_f1: 0.5838
 epoch: 50, train_loss: 0.5800, test_loss: 1.3961, test_f1: 0.5382
 epoch: 51, train_loss: 0.5295, test_loss: 1.4197, test_f1: 0.5674
 epoch: 52, train_loss: 0.5075, test_loss: 1.3547, test_f1: 0.5804
 epoch: 53, train_loss: 0.4734, test_loss: 1.4780, test_f1: 0.5472
 epoch: 54, train_loss: 0.4994, test_loss: 1.5267, test_f1: 0.5595
 epoch: 55, train_loss: 0.4680, test_loss: 1.4831, test_f1: 0.6040
 epoch: 56, train_loss: 0.4776, test_loss: 1.4665, test_f1: 0.5902
 epoch: 57, train_loss: 0.4387, test_loss: 1.5100, test_f1: 0.5992
 epoch: 58, train_loss: 0.4292, test_loss: 1.5131, test_f1: 0.6047
 epoch: 59, train_loss: 0.4553, test_loss: 1.4712, test_f1: 0.5648
 epoch: 60, train_loss: 0.4450, test_loss: 1.5849, test_f1: 0.5753
 epoch: 61, train_loss: 0.4336, test_loss: 1.6298, test_f1: 0.5611
 epoch: 62, train_loss: 0.4123, test_loss: 1.5545, test_f1: 0.6170
 epoch: 63, train_loss: 0.4432, test_loss: 1.7474, test_f1: 0.5479
 epoch: 64, train_loss: 0.4683, test_loss: 1.6353, test_f1: 0.6149
 epoch: 65, train_loss: 0.4356, test_loss: 1.5514, test_f1: 0.6032
 epoch: 66, train_loss: 0.4450, test_loss: 1.4294, test_f1: 0.5939
 epoch: 67, train_loss: 0.4162, test_loss: 1.6435, test_f1: 0.5856
 epoch: 68, train_loss: 0.4103, test_loss: 1.5561, test_f1: 0.5889
 epoch: 69, train_loss: 0.4256, test_loss: 1.4943, test_f1: 0.5282
 epoch: 70, train_loss: 0.4229, test_loss: 1.6698, test_f1: 0.6097
 epoch: 71, train_loss: 0.3982, test_loss: 1.6723, test_f1: 0.6068
 epoch: 72, train_loss: 0.4249, test_loss: 1.6650, test_f1: 0.6130
 epoch: 73, train_loss: 0.4153, test_loss: 1.5535, test_f1: 0.6313
 epoch: 74, train_loss: 0.3938, test_loss: 1.6464, test_f1: 0.5920
 epoch: 75, train_loss: 0.3779, test_loss: 1.8972, test_f1: 0.5778
 epoch: 76, train_loss: 0.3771, test_loss: 1.9785, test_f1: 0.5313
 epoch: 77, train_loss: 0.3656, test_loss: 1.7109, test_f1: 0.6384
 epoch: 78, train_loss: 0.3751, test_loss: 1.8901, test_f1: 0.5872
 epoch: 79, train_loss: 0.3846, test_loss: 2.0322, test_f1: 0.5588
 epoch: 80, train_loss: 0.3664, test_loss: 1.7854, test_f1: 0.5948
 epoch: 81, train_loss: 0.4014, test_loss: 2.0613, test_f1: 0.5780
 epoch: 82, train_loss: 0.4312, test_loss: 1.4753, test_f1: 0.6332
 epoch: 83, train_loss: 0.4075, test_loss: 1.8596, test_f1: 0.5629
 epoch: 84, train_loss: 0.4018, test_loss: 1.5874, test_f1: 0.6020
 epoch: 85, train_loss: 0.3549, test_loss: 1.7389, test_f1: 0.5666
 epoch: 86, train_loss: 0.4190, test_loss: 1.8611, test_f1: 0.5989
 epoch: 87, train_loss: 0.4049, test_loss: 1.8518, test_f1: 0.5040
 epoch: 88, train_loss: 0.4030, test_loss: 1.6186, test_f1: 0.6248
 epoch: 89, train_loss: 0.4038, test_loss: 1.6145, test_f1: 0.6206
 epoch: 90, train_loss: 0.3994, test_loss: 1.7110, test_f1: 0.5398
 epoch: 91, train_loss: 0.4060, test_loss: 1.6988, test_f1: 0.5784
 epoch: 92, train_loss: 0.3775, test_loss: 1.9473, test_f1: 0.5784
 epoch: 93, train_loss: 0.3407, test_loss: 2.0587, test_f1: 0.5790
 epoch: 94, train_loss: 0.3647, test_loss: 1.7167, test_f1: 0.6137
 epoch: 95, train_loss: 0.3374, test_loss: 1.7356, test_f1: 0.5553
 epoch: 96, train_loss: 0.3368, test_loss: 1.9626, test_f1: 0.5886
 epoch: 97, train_loss: 0.3303, test_loss: 1.8689, test_f1: 0.6005
 epoch: 98, train_loss: 0.3010, test_loss: 1.9491, test_f1: 0.6096
 epoch: 99, train_loss: 0.3031, test_loss: 1.9908, test_f1: 0.5884
##################ITERATION #8 ****************************************
 epoch: 0, train_loss: 1.6143, test_loss: 1.5917, test_f1: 0.2054
 epoch: 1, train_loss: 1.0628, test_loss: 1.3120, test_f1: 0.3626
 epoch: 2, train_loss: 1.0012, test_loss: 1.1339, test_f1: 0.4588
 epoch: 3, train_loss: 0.9775, test_loss: 1.1112, test_f1: 0.4632
 epoch: 4, train_loss: 0.9653, test_loss: 1.0636, test_f1: 0.4837
 epoch: 5, train_loss: 0.9307, test_loss: 1.0395, test_f1: 0.5156
 epoch: 6, train_loss: 0.8918, test_loss: 1.0239, test_f1: 0.5371
 epoch: 7, train_loss: 0.8610, test_loss: 1.1086, test_f1: 0.5107
 epoch: 8, train_loss: 0.8622, test_loss: 1.0826, test_f1: 0.4808
 epoch: 9, train_loss: 0.8782, test_loss: 1.1375, test_f1: 0.4880
 epoch: 10, train_loss: 0.8401, test_loss: 1.1658, test_f1: 0.5323
 epoch: 11, train_loss: 0.8312, test_loss: 1.0786, test_f1: 0.5363
 epoch: 12, train_loss: 0.8082, test_loss: 1.1835, test_f1: 0.5415
 epoch: 13, train_loss: 0.8063, test_loss: 0.9859, test_f1: 0.5443
 epoch: 14, train_loss: 0.7797, test_loss: 1.0419, test_f1: 0.5752
 epoch: 15, train_loss: 0.7591, test_loss: 1.1713, test_f1: 0.5640
 epoch: 16, train_loss: 0.7734, test_loss: 1.1943, test_f1: 0.5196
 epoch: 17, train_loss: 0.7522, test_loss: 1.2180, test_f1: 0.5336
 epoch: 18, train_loss: 0.7190, test_loss: 1.0800, test_f1: 0.5972
 epoch: 19, train_loss: 0.7081, test_loss: 1.0978, test_f1: 0.5857
 epoch: 20, train_loss: 0.7164, test_loss: 1.0471, test_f1: 0.5812
 epoch: 21, train_loss: 0.6807, test_loss: 1.2483, test_f1: 0.5289
 epoch: 22, train_loss: 0.6894, test_loss: 1.1615, test_f1: 0.5550
 epoch: 23, train_loss: 0.6608, test_loss: 1.1325, test_f1: 0.5696
 epoch: 24, train_loss: 0.6876, test_loss: 1.1330, test_f1: 0.5330
 epoch: 25, train_loss: 0.6820, test_loss: 1.1659, test_f1: 0.5472
 epoch: 26, train_loss: 0.6701, test_loss: 1.0908, test_f1: 0.6021
 epoch: 27, train_loss: 0.6608, test_loss: 1.2809, test_f1: 0.5310
 epoch: 28, train_loss: 0.6680, test_loss: 1.0963, test_f1: 0.6094
 epoch: 29, train_loss: 0.6468, test_loss: 1.1993, test_f1: 0.5898
 epoch: 30, train_loss: 0.6396, test_loss: 1.2324, test_f1: 0.5633
 epoch: 31, train_loss: 0.6321, test_loss: 1.2579, test_f1: 0.4904
 epoch: 32, train_loss: 0.6498, test_loss: 1.1057, test_f1: 0.5620
 epoch: 33, train_loss: 0.6518, test_loss: 1.2618, test_f1: 0.5515
 epoch: 34, train_loss: 0.6425, test_loss: 1.2397, test_f1: 0.5480
 epoch: 35, train_loss: 0.6128, test_loss: 1.3210, test_f1: 0.4841
 epoch: 36, train_loss: 0.5936, test_loss: 1.1421, test_f1: 0.5882
 epoch: 37, train_loss: 0.6017, test_loss: 1.2501, test_f1: 0.6166
 epoch: 38, train_loss: 0.6533, test_loss: 1.3829, test_f1: 0.5422
 epoch: 39, train_loss: 0.6379, test_loss: 1.2042, test_f1: 0.5763
 epoch: 40, train_loss: 0.6119, test_loss: 1.2940, test_f1: 0.5248
 epoch: 41, train_loss: 0.5851, test_loss: 1.4008, test_f1: 0.5343
 epoch: 42, train_loss: 0.5723, test_loss: 1.1171, test_f1: 0.5963
 epoch: 43, train_loss: 0.5661, test_loss: 1.1141, test_f1: 0.6310
 epoch: 44, train_loss: 0.5618, test_loss: 1.2131, test_f1: 0.5432
 epoch: 45, train_loss: 0.5559, test_loss: 1.3689, test_f1: 0.5641
 epoch: 46, train_loss: 0.6027, test_loss: 1.3381, test_f1: 0.5154
 epoch: 47, train_loss: 0.5862, test_loss: 1.3716, test_f1: 0.4730
 epoch: 48, train_loss: 0.5669, test_loss: 1.4703, test_f1: 0.4851
 epoch: 49, train_loss: 0.5700, test_loss: 1.3908, test_f1: 0.5085
 epoch: 50, train_loss: 0.5736, test_loss: 1.6145, test_f1: 0.4248
 epoch: 51, train_loss: 0.5525, test_loss: 1.3924, test_f1: 0.5366
 epoch: 52, train_loss: 0.5271, test_loss: 1.3529, test_f1: 0.6080
 epoch: 53, train_loss: 0.4953, test_loss: 1.3177, test_f1: 0.5956
 epoch: 54, train_loss: 0.4779, test_loss: 1.1742, test_f1: 0.5618
 epoch: 55, train_loss: 0.4898, test_loss: 1.2546, test_f1: 0.5816
 epoch: 56, train_loss: 0.4763, test_loss: 1.5098, test_f1: 0.6095
 epoch: 57, train_loss: 0.4778, test_loss: 1.3246, test_f1: 0.6147
 epoch: 58, train_loss: 0.4685, test_loss: 1.3364, test_f1: 0.5738
 epoch: 59, train_loss: 0.5028, test_loss: 1.5711, test_f1: 0.5086
 epoch: 60, train_loss: 0.4591, test_loss: 1.3792, test_f1: 0.6079
 epoch: 61, train_loss: 0.4373, test_loss: 1.4925, test_f1: 0.5751
 epoch: 62, train_loss: 0.4358, test_loss: 1.5268, test_f1: 0.5726
 epoch: 63, train_loss: 0.4240, test_loss: 1.5649, test_f1: 0.5936
 epoch: 64, train_loss: 0.4339, test_loss: 1.6213, test_f1: 0.5812
 epoch: 65, train_loss: 0.4287, test_loss: 1.5160, test_f1: 0.5711
 epoch: 66, train_loss: 0.4330, test_loss: 1.4193, test_f1: 0.5761
 epoch: 67, train_loss: 0.4054, test_loss: 1.6935, test_f1: 0.5734
 epoch: 68, train_loss: 0.4122, test_loss: 1.6194, test_f1: 0.5996
 epoch: 69, train_loss: 0.4381, test_loss: 1.5855, test_f1: 0.5855
 epoch: 70, train_loss: 0.4262, test_loss: 1.5255, test_f1: 0.5760
 epoch: 71, train_loss: 0.4129, test_loss: 1.7450, test_f1: 0.5947
 epoch: 72, train_loss: 0.4246, test_loss: 1.5463, test_f1: 0.5968
 epoch: 73, train_loss: 0.3855, test_loss: 1.8450, test_f1: 0.5895
 epoch: 74, train_loss: 0.4336, test_loss: 1.6146, test_f1: 0.5784
 epoch: 75, train_loss: 0.4108, test_loss: 1.3880, test_f1: 0.6004
 epoch: 76, train_loss: 0.4112, test_loss: 1.5202, test_f1: 0.5864
 epoch: 77, train_loss: 0.4362, test_loss: 1.6619, test_f1: 0.5926
 epoch: 78, train_loss: 0.4373, test_loss: 1.6794, test_f1: 0.5855
 epoch: 79, train_loss: 0.4094, test_loss: 1.7792, test_f1: 0.5712
 epoch: 80, train_loss: 0.4154, test_loss: 1.5926, test_f1: 0.5878
 epoch: 81, train_loss: 0.3878, test_loss: 1.5712, test_f1: 0.5722
 epoch: 82, train_loss: 0.3718, test_loss: 1.6664, test_f1: 0.5764
 epoch: 83, train_loss: 0.3490, test_loss: 1.7164, test_f1: 0.5983
 epoch: 84, train_loss: 0.3323, test_loss: 1.7285, test_f1: 0.5740
 epoch: 85, train_loss: 0.3412, test_loss: 1.5681, test_f1: 0.5769
 epoch: 86, train_loss: 0.3554, test_loss: 1.7309, test_f1: 0.6032
 epoch: 87, train_loss: 0.3453, test_loss: 1.7538, test_f1: 0.5801
 epoch: 88, train_loss: 0.3439, test_loss: 2.0164, test_f1: 0.5629
 epoch: 89, train_loss: 0.3252, test_loss: 1.7673, test_f1: 0.5874
 epoch: 90, train_loss: 0.3576, test_loss: 1.9598, test_f1: 0.5762
 epoch: 91, train_loss: 0.3539, test_loss: 2.3543, test_f1: 0.5384
 epoch: 92, train_loss: 0.3820, test_loss: 1.6873, test_f1: 0.5785
 epoch: 93, train_loss: 0.3352, test_loss: 1.7184, test_f1: 0.5891
 epoch: 94, train_loss: 0.3394, test_loss: 1.7368, test_f1: 0.6044
 epoch: 95, train_loss: 0.3169, test_loss: 1.8457, test_f1: 0.5960
 epoch: 96, train_loss: 0.3270, test_loss: 1.8626, test_f1: 0.5877
 epoch: 97, train_loss: 0.2955, test_loss: 1.7998, test_f1: 0.5868
 epoch: 98, train_loss: 0.3260, test_loss: 2.0217, test_f1: 0.5640
 epoch: 99, train_loss: 0.3113, test_loss: 2.0541, test_f1: 0.5602
##################ITERATION #9 ****************************************
 epoch: 0, train_loss: 1.4360, test_loss: 1.6278, test_f1: 0.1824
 epoch: 1, train_loss: 1.0642, test_loss: 1.3527, test_f1: 0.2634
 epoch: 2, train_loss: 0.9814, test_loss: 1.1359, test_f1: 0.4407
 epoch: 3, train_loss: 0.9463, test_loss: 1.0773, test_f1: 0.5223
 epoch: 4, train_loss: 0.9153, test_loss: 1.0531, test_f1: 0.5410
 epoch: 5, train_loss: 0.8820, test_loss: 1.0873, test_f1: 0.5428
 epoch: 6, train_loss: 0.8694, test_loss: 1.0710, test_f1: 0.5027
 epoch: 7, train_loss: 0.8610, test_loss: 1.2927, test_f1: 0.4237
 epoch: 8, train_loss: 0.8695, test_loss: 1.0572, test_f1: 0.5496
 epoch: 9, train_loss: 0.8429, test_loss: 1.2820, test_f1: 0.4451
 epoch: 10, train_loss: 0.8485, test_loss: 1.2004, test_f1: 0.4829
 epoch: 11, train_loss: 0.8067, test_loss: 1.0283, test_f1: 0.5441
 epoch: 12, train_loss: 0.7770, test_loss: 1.0564, test_f1: 0.5880
 epoch: 13, train_loss: 0.8054, test_loss: 1.1689, test_f1: 0.5170
 epoch: 14, train_loss: 0.8177, test_loss: 1.0408, test_f1: 0.5518
 epoch: 15, train_loss: 0.7965, test_loss: 1.0619, test_f1: 0.5676
 epoch: 16, train_loss: 0.7900, test_loss: 1.0198, test_f1: 0.5978
 epoch: 17, train_loss: 0.7512, test_loss: 1.1454, test_f1: 0.5675
 epoch: 18, train_loss: 0.7528, test_loss: 1.0356, test_f1: 0.5970
 epoch: 19, train_loss: 0.7317, test_loss: 1.0566, test_f1: 0.5182
 epoch: 20, train_loss: 0.7031, test_loss: 1.0901, test_f1: 0.5783
 epoch: 21, train_loss: 0.7480, test_loss: 1.0581, test_f1: 0.5891
 epoch: 22, train_loss: 0.6998, test_loss: 1.2057, test_f1: 0.4802
 epoch: 23, train_loss: 0.7020, test_loss: 1.1941, test_f1: 0.4635
 epoch: 24, train_loss: 0.6468, test_loss: 1.2064, test_f1: 0.6029
 epoch: 25, train_loss: 0.6718, test_loss: 1.3270, test_f1: 0.5555
 epoch: 26, train_loss: 0.6724, test_loss: 1.1310, test_f1: 0.5561
 epoch: 27, train_loss: 0.6830, test_loss: 1.1636, test_f1: 0.6090
 epoch: 28, train_loss: 0.6910, test_loss: 1.1291, test_f1: 0.5084
 epoch: 29, train_loss: 0.6288, test_loss: 1.2356, test_f1: 0.5251
 epoch: 30, train_loss: 0.6214, test_loss: 1.1272, test_f1: 0.6090
 epoch: 31, train_loss: 0.6279, test_loss: 1.2223, test_f1: 0.5728
 epoch: 32, train_loss: 0.6095, test_loss: 1.2721, test_f1: 0.5780
 epoch: 33, train_loss: 0.6276, test_loss: 1.3047, test_f1: 0.5597
 epoch: 34, train_loss: 0.6072, test_loss: 1.2833, test_f1: 0.5207
 epoch: 35, train_loss: 0.6142, test_loss: 1.4295, test_f1: 0.4829
 epoch: 36, train_loss: 0.5980, test_loss: 1.4500, test_f1: 0.4944
 epoch: 37, train_loss: 0.5994, test_loss: 1.4938, test_f1: 0.5147
 epoch: 38, train_loss: 0.6133, test_loss: 1.4645, test_f1: 0.4666
 epoch: 39, train_loss: 0.6590, test_loss: 1.3103, test_f1: 0.4727
 epoch: 40, train_loss: 0.6243, test_loss: 1.2521, test_f1: 0.5896
 epoch: 41, train_loss: 0.5968, test_loss: 0.9982, test_f1: 0.6102
 epoch: 42, train_loss: 0.5815, test_loss: 1.1152, test_f1: 0.6131
 epoch: 43, train_loss: 0.6074, test_loss: 1.3701, test_f1: 0.5673
 epoch: 44, train_loss: 0.5817, test_loss: 1.5096, test_f1: 0.5753
 epoch: 45, train_loss: 0.5396, test_loss: 1.3600, test_f1: 0.5178
 epoch: 46, train_loss: 0.5959, test_loss: 1.2980, test_f1: 0.5329
 epoch: 47, train_loss: 0.5617, test_loss: 1.3953, test_f1: 0.5076
 epoch: 48, train_loss: 0.5867, test_loss: 1.3949, test_f1: 0.5597
 epoch: 49, train_loss: 0.5233, test_loss: 1.7175, test_f1: 0.5311
 epoch: 50, train_loss: 0.5403, test_loss: 1.3941, test_f1: 0.5915
 epoch: 51, train_loss: 0.5125, test_loss: 1.4198, test_f1: 0.5897
 epoch: 52, train_loss: 0.4940, test_loss: 1.4673, test_f1: 0.6062
 epoch: 53, train_loss: 0.4873, test_loss: 1.4505, test_f1: 0.5956
 epoch: 54, train_loss: 0.4441, test_loss: 1.5689, test_f1: 0.5966
 epoch: 55, train_loss: 0.4637, test_loss: 1.5227, test_f1: 0.5999
 epoch: 56, train_loss: 0.4107, test_loss: 1.5368, test_f1: 0.6164
 epoch: 57, train_loss: 0.4336, test_loss: 1.3876, test_f1: 0.5776
 epoch: 58, train_loss: 0.4174, test_loss: 1.6378, test_f1: 0.6327
 epoch: 59, train_loss: 0.4456, test_loss: 1.5235, test_f1: 0.5926
 epoch: 60, train_loss: 0.4188, test_loss: 1.4873, test_f1: 0.5928
 epoch: 61, train_loss: 0.4212, test_loss: 1.5828, test_f1: 0.6389
 epoch: 62, train_loss: 0.4268, test_loss: 1.8342, test_f1: 0.5441
 epoch: 63, train_loss: 0.3985, test_loss: 1.5445, test_f1: 0.6199
 epoch: 64, train_loss: 0.4208, test_loss: 1.9227, test_f1: 0.5634
 epoch: 65, train_loss: 0.4228, test_loss: 1.7587, test_f1: 0.5733
 epoch: 66, train_loss: 0.4261, test_loss: 1.7190, test_f1: 0.5447
 epoch: 67, train_loss: 0.4284, test_loss: 1.6411, test_f1: 0.6124
 epoch: 68, train_loss: 0.4087, test_loss: 1.7419, test_f1: 0.5390
 epoch: 69, train_loss: 0.3998, test_loss: 1.6466, test_f1: 0.5857
 epoch: 70, train_loss: 0.3639, test_loss: 1.6666, test_f1: 0.5859
 epoch: 71, train_loss: 0.3949, test_loss: 1.8656, test_f1: 0.5992
 epoch: 72, train_loss: 0.3693, test_loss: 1.7012, test_f1: 0.5833
 epoch: 73, train_loss: 0.3948, test_loss: 1.7439, test_f1: 0.5864
 epoch: 74, train_loss: 0.4049, test_loss: 1.7008, test_f1: 0.6034
 epoch: 75, train_loss: 0.3907, test_loss: 1.7561, test_f1: 0.6093
 epoch: 76, train_loss: 0.3926, test_loss: 1.7136, test_f1: 0.5976
 epoch: 77, train_loss: 0.3742, test_loss: 1.6497, test_f1: 0.6175
 epoch: 78, train_loss: 0.3568, test_loss: 2.0293, test_f1: 0.5420
 epoch: 79, train_loss: 0.3512, test_loss: 1.6865, test_f1: 0.5882
 epoch: 80, train_loss: 0.3339, test_loss: 1.9727, test_f1: 0.5918
 epoch: 81, train_loss: 0.3317, test_loss: 1.8457, test_f1: 0.6112
 epoch: 82, train_loss: 0.3633, test_loss: 2.0364, test_f1: 0.5851
 epoch: 83, train_loss: 0.3758, test_loss: 2.1010, test_f1: 0.6235
 epoch: 84, train_loss: 0.3456, test_loss: 2.0276, test_f1: 0.5233
 epoch: 85, train_loss: 0.4679, test_loss: 2.1042, test_f1: 0.5330
 epoch: 86, train_loss: 0.3953, test_loss: 1.9076, test_f1: 0.5691
 epoch: 87, train_loss: 0.4009, test_loss: 1.6922, test_f1: 0.6159
 epoch: 88, train_loss: 0.3674, test_loss: 1.8175, test_f1: 0.6320
 epoch: 89, train_loss: 0.3509, test_loss: 1.7810, test_f1: 0.6104
 epoch: 90, train_loss: 0.3722, test_loss: 2.1893, test_f1: 0.5185
 epoch: 91, train_loss: 0.3736, test_loss: 1.9035, test_f1: 0.5975
 epoch: 92, train_loss: 0.3411, test_loss: 1.8453, test_f1: 0.5869
 epoch: 93, train_loss: 0.2770, test_loss: 1.9902, test_f1: 0.5636
 epoch: 94, train_loss: 0.2808, test_loss: 2.1576, test_f1: 0.6036
 epoch: 95, train_loss: 0.2895, test_loss: 2.0902, test_f1: 0.6207
 epoch: 96, train_loss: 0.3000, test_loss: 2.0441, test_f1: 0.5785
 epoch: 97, train_loss: 0.3057, test_loss: 1.9669, test_f1: 0.6029
 epoch: 98, train_loss: 0.2895, test_loss: 2.1610, test_f1: 0.5982
 epoch: 99, train_loss: 0.3155, test_loss: 1.9969, test_f1: 0.5894

Training completed in 331.60 seconds
Best F1: 0.6598 at epoch 75
Mean F1 across iterations: 0.6443  0.0104
========================FINAL RESULTS================================
FEGIN weighted F1: 0.6598  0.0104
python main.py --data ltspice_demos --representation component_net --model FEGIN --layers 3 --hiddens 64 --batch_size 128 --lr 0.01 --emb_size 250 --epochs 100 --save_appendix component_net_L3_H64_BS128_LR0.01_E250 --no_val
-----



STDERR:
  File "main.py", line 370, in <module>
    main()
  File "main.py", line 254, in main
    dataset = dataset_class(
  File "/home/philip/projects/ltspice_examples_code_repo/Circuit-Completion-Using-GNNs/component_classification_with_link_prediction_head/evaluation/FEGIN/kernel/circuit_datasets.py", line 15, in __init__
    self.data, self.slices = torch.load(self.processed_paths[0])
  File "/home/philip/.local/lib/python3.8/site-packages/torch/serialization.py", line 1040, in load
    warnings.warn(
  File "/usr/lib/python3.8/warnings.py", line 109, in _showwarnmsg
    sw(msg.message, msg.category, msg.filename, msg.lineno,
  File "main.py", line 47, in warn_with_traceback
    traceback.print_stack(file=log)
/home/philip/projects/ltspice_examples_code_repo/Circuit-Completion-Using-GNNs/component_classification_with_link_prediction_head/evaluation/FEGIN/kernel/circuit_datasets.py:15: FutureWarning: You are using `torch.load` with `weights_only=False` (the current default value), which uses the default pickle module implicitly. It is possible to construct malicious pickle data which will execute arbitrary code during unpickling (See https://github.com/pytorch/pytorch/blob/main/SECURITY.md#untrusted-models for more details). In a future release, the default value for `weights_only` will be flipped to `True`. This limits the functions that could be executed during unpickling. Arbitrary objects will no longer be allowed to be loaded via this mode unless they are explicitly allowlisted by the user via `torch.serialization.add_safe_globals`. We recommend you start setting `weights_only=True` for any use case where you don't have full control of the loaded file. Please open an issue on GitHub for any issues related to this experimental feature.
  self.data, self.slices = torch.load(self.processed_paths[0])
