STDOUT:
Results will be saved in /home/philip/projects/ltspice_examples_code_repo/Circuit-Completion-Using-GNNs/component_classification_with_link_prediction_head/evaluation/FEGIN/results/model_FEGIN_dataset_ltspice_demos
Command line input: python main.py --data ltspice_demos --representation component_pin --model FEGIN --layers 4 --hiddens 32 --batch_size 256 --lr 0.001 --emb_size 128 --epochs 100 --save_appendix component_pin_L4_H32_BS256_LR0.001_E128 --no_val
 is saved.
-----
ltspice_demos - FEGIN
Using 4 layers, 32 hidden units, h = 2
Loading component_pin representation dataset
ENTERED
Training FEGIN on component_pin representation
Train: 1565, Test: 383
##################ITERATION #0 ****************************************
 epoch: 0, train_loss: 1.3097, test_loss: 1.3263, test_f1: 0.2628
 epoch: 1, train_loss: 1.2975, test_loss: 1.3224, test_f1: 0.2628
 epoch: 2, train_loss: 1.2885, test_loss: 1.3183, test_f1: 0.2628
 epoch: 3, train_loss: 1.2767, test_loss: 1.3138, test_f1: 0.2630
 epoch: 4, train_loss: 1.2638, test_loss: 1.3086, test_f1: 0.2630
 epoch: 5, train_loss: 1.2450, test_loss: 1.3027, test_f1: 0.2600
 epoch: 6, train_loss: 1.2248, test_loss: 1.2946, test_f1: 0.2884
 epoch: 7, train_loss: 1.2030, test_loss: 1.2830, test_f1: 0.3189
 epoch: 8, train_loss: 1.1807, test_loss: 1.2787, test_f1: 0.3325
 epoch: 9, train_loss: 1.1568, test_loss: 1.2599, test_f1: 0.3231
 epoch: 10, train_loss: 1.1315, test_loss: 1.2184, test_f1: 0.3534
 epoch: 11, train_loss: 1.1075, test_loss: 1.2042, test_f1: 0.3989
 epoch: 12, train_loss: 1.0848, test_loss: 1.2243, test_f1: 0.3890
 epoch: 13, train_loss: 1.0646, test_loss: 1.1585, test_f1: 0.4483
 epoch: 14, train_loss: 1.0332, test_loss: 1.2474, test_f1: 0.3860
 epoch: 15, train_loss: 1.0032, test_loss: 1.1111, test_f1: 0.4498
 epoch: 16, train_loss: 0.9957, test_loss: 1.1391, test_f1: 0.4434
 epoch: 17, train_loss: 0.9805, test_loss: 1.1618, test_f1: 0.4416
 epoch: 18, train_loss: 0.9864, test_loss: 1.1571, test_f1: 0.4218
 epoch: 19, train_loss: 0.9775, test_loss: 1.1316, test_f1: 0.4328
 epoch: 20, train_loss: 0.9799, test_loss: 1.1905, test_f1: 0.4208
 epoch: 21, train_loss: 0.9657, test_loss: 1.0704, test_f1: 0.4609
 epoch: 22, train_loss: 0.9509, test_loss: 1.0579, test_f1: 0.4551
 epoch: 23, train_loss: 0.9430, test_loss: 1.0362, test_f1: 0.4779
 epoch: 24, train_loss: 0.9246, test_loss: 1.0197, test_f1: 0.4799
 epoch: 25, train_loss: 0.9337, test_loss: 1.0353, test_f1: 0.4671
 epoch: 26, train_loss: 0.9101, test_loss: 1.0428, test_f1: 0.4420
 epoch: 27, train_loss: 0.9115, test_loss: 1.0378, test_f1: 0.4651
 epoch: 28, train_loss: 0.9087, test_loss: 1.1127, test_f1: 0.4311
 epoch: 29, train_loss: 0.9032, test_loss: 1.1268, test_f1: 0.4462
 epoch: 30, train_loss: 0.8955, test_loss: 1.1340, test_f1: 0.4451
 epoch: 31, train_loss: 0.8814, test_loss: 1.1266, test_f1: 0.4440
 epoch: 32, train_loss: 0.8786, test_loss: 1.0766, test_f1: 0.4564
 epoch: 33, train_loss: 0.8782, test_loss: 1.0364, test_f1: 0.4858
 epoch: 34, train_loss: 0.8843, test_loss: 1.0179, test_f1: 0.4524
 epoch: 35, train_loss: 0.8924, test_loss: 1.0341, test_f1: 0.4982
 epoch: 36, train_loss: 0.8652, test_loss: 1.0372, test_f1: 0.4778
 epoch: 37, train_loss: 0.8606, test_loss: 1.0761, test_f1: 0.4785
 epoch: 38, train_loss: 0.8475, test_loss: 1.1062, test_f1: 0.4584
 epoch: 39, train_loss: 0.8416, test_loss: 1.0231, test_f1: 0.4408
 epoch: 40, train_loss: 0.8370, test_loss: 0.9676, test_f1: 0.5422
 epoch: 41, train_loss: 0.8260, test_loss: 0.9798, test_f1: 0.5274
 epoch: 42, train_loss: 0.8166, test_loss: 0.9702, test_f1: 0.5330
 epoch: 43, train_loss: 0.7978, test_loss: 0.9909, test_f1: 0.5435
 epoch: 44, train_loss: 0.7984, test_loss: 1.0409, test_f1: 0.5422
 epoch: 45, train_loss: 0.8038, test_loss: 1.1263, test_f1: 0.5036
 epoch: 46, train_loss: 0.7903, test_loss: 1.0062, test_f1: 0.5623
 epoch: 47, train_loss: 0.7911, test_loss: 1.0079, test_f1: 0.5292
 epoch: 48, train_loss: 0.7952, test_loss: 1.0714, test_f1: 0.5207
 epoch: 49, train_loss: 0.7794, test_loss: 1.0430, test_f1: 0.5206
 epoch: 50, train_loss: 0.7736, test_loss: 1.0616, test_f1: 0.5554
 epoch: 51, train_loss: 0.7565, test_loss: 0.9930, test_f1: 0.5214
 epoch: 52, train_loss: 0.7409, test_loss: 0.9821, test_f1: 0.5211
 epoch: 53, train_loss: 0.7419, test_loss: 1.0061, test_f1: 0.5223
 epoch: 54, train_loss: 0.7432, test_loss: 1.0559, test_f1: 0.5057
 epoch: 55, train_loss: 0.7315, test_loss: 1.0277, test_f1: 0.5365
 epoch: 56, train_loss: 0.7233, test_loss: 1.0096, test_f1: 0.5237
 epoch: 57, train_loss: 0.7248, test_loss: 1.0426, test_f1: 0.5126
 epoch: 58, train_loss: 0.7159, test_loss: 1.0551, test_f1: 0.5079
 epoch: 59, train_loss: 0.7269, test_loss: 1.0115, test_f1: 0.5322
 epoch: 60, train_loss: 0.7042, test_loss: 1.0176, test_f1: 0.5446
 epoch: 61, train_loss: 0.7088, test_loss: 1.1159, test_f1: 0.5034
 epoch: 62, train_loss: 0.7141, test_loss: 1.1215, test_f1: 0.5303
 epoch: 63, train_loss: 0.7062, test_loss: 1.1158, test_f1: 0.5356
 epoch: 64, train_loss: 0.7055, test_loss: 1.0321, test_f1: 0.5388
 epoch: 65, train_loss: 0.6988, test_loss: 1.0141, test_f1: 0.5387
 epoch: 66, train_loss: 0.6867, test_loss: 1.0135, test_f1: 0.5710
 epoch: 67, train_loss: 0.6911, test_loss: 1.0286, test_f1: 0.5606
 epoch: 68, train_loss: 0.6867, test_loss: 1.0737, test_f1: 0.5538
 epoch: 69, train_loss: 0.7013, test_loss: 1.0417, test_f1: 0.5437
 epoch: 70, train_loss: 0.6951, test_loss: 1.0474, test_f1: 0.5485
 epoch: 71, train_loss: 0.6798, test_loss: 1.0324, test_f1: 0.5492
 epoch: 72, train_loss: 0.6806, test_loss: 1.0346, test_f1: 0.5497
 epoch: 73, train_loss: 0.6794, test_loss: 1.0410, test_f1: 0.5500
 epoch: 74, train_loss: 0.6782, test_loss: 1.0440, test_f1: 0.5365
 epoch: 75, train_loss: 0.6688, test_loss: 1.0352, test_f1: 0.5349
 epoch: 76, train_loss: 0.7023, test_loss: 1.1298, test_f1: 0.5618
 epoch: 77, train_loss: 0.7187, test_loss: 1.0195, test_f1: 0.5504
 epoch: 78, train_loss: 0.6931, test_loss: 1.0026, test_f1: 0.5523
 epoch: 79, train_loss: 0.6855, test_loss: 0.9998, test_f1: 0.5570
 epoch: 80, train_loss: 0.6859, test_loss: 1.0111, test_f1: 0.5912
 epoch: 81, train_loss: 0.6802, test_loss: 1.0085, test_f1: 0.5450
 epoch: 82, train_loss: 0.6755, test_loss: 1.0292, test_f1: 0.5655
 epoch: 83, train_loss: 0.6732, test_loss: 1.0491, test_f1: 0.5515
 epoch: 84, train_loss: 0.6741, test_loss: 1.0401, test_f1: 0.5697
 epoch: 85, train_loss: 0.6811, test_loss: 1.0248, test_f1: 0.5575
 epoch: 86, train_loss: 0.6761, test_loss: 1.0224, test_f1: 0.5457
 epoch: 87, train_loss: 0.6628, test_loss: 1.0540, test_f1: 0.5515
 epoch: 88, train_loss: 0.6644, test_loss: 1.0578, test_f1: 0.5663
 epoch: 89, train_loss: 0.6498, test_loss: 1.0626, test_f1: 0.5827
 epoch: 90, train_loss: 0.6522, test_loss: 1.0892, test_f1: 0.5896
 epoch: 91, train_loss: 0.6558, test_loss: 1.0464, test_f1: 0.5450
 epoch: 92, train_loss: 0.6474, test_loss: 1.0342, test_f1: 0.5763
 epoch: 93, train_loss: 0.6377, test_loss: 1.0498, test_f1: 0.5793
 epoch: 94, train_loss: 0.6342, test_loss: 1.0639, test_f1: 0.5922
 epoch: 95, train_loss: 0.6488, test_loss: 1.0952, test_f1: 0.5410
 epoch: 96, train_loss: 0.6506, test_loss: 1.1156, test_f1: 0.5303
 epoch: 97, train_loss: 0.6774, test_loss: 1.2502, test_f1: 0.5214
 epoch: 98, train_loss: 0.6609, test_loss: 1.1950, test_f1: 0.5439
 epoch: 99, train_loss: 0.6456, test_loss: 1.1952, test_f1: 0.5284
##################ITERATION #1 ****************************************
 epoch: 0, train_loss: 1.2602, test_loss: 1.2980, test_f1: 0.2281
 epoch: 1, train_loss: 1.2132, test_loss: 1.2966, test_f1: 0.2281
 epoch: 2, train_loss: 1.1850, test_loss: 1.2993, test_f1: 0.2281
 epoch: 3, train_loss: 1.1556, test_loss: 1.3088, test_f1: 0.2281
 epoch: 4, train_loss: 1.1254, test_loss: 1.3172, test_f1: 0.2281
 epoch: 5, train_loss: 1.1007, test_loss: 1.3147, test_f1: 0.2281
 epoch: 6, train_loss: 1.0770, test_loss: 1.2872, test_f1: 0.2281
 epoch: 7, train_loss: 1.0513, test_loss: 1.2187, test_f1: 0.3213
 epoch: 8, train_loss: 1.0255, test_loss: 1.1608, test_f1: 0.3873
 epoch: 9, train_loss: 1.0077, test_loss: 1.1585, test_f1: 0.4105
 epoch: 10, train_loss: 0.9827, test_loss: 1.0738, test_f1: 0.4377
 epoch: 11, train_loss: 0.9618, test_loss: 1.0715, test_f1: 0.4829
 epoch: 12, train_loss: 0.9463, test_loss: 1.0520, test_f1: 0.5092
 epoch: 13, train_loss: 0.9269, test_loss: 1.0347, test_f1: 0.5188
 epoch: 14, train_loss: 0.9074, test_loss: 1.0535, test_f1: 0.5115
 epoch: 15, train_loss: 0.9028, test_loss: 1.0105, test_f1: 0.5530
 epoch: 16, train_loss: 0.8853, test_loss: 1.0159, test_f1: 0.5199
 epoch: 17, train_loss: 0.8677, test_loss: 0.9789, test_f1: 0.5532
 epoch: 18, train_loss: 0.8631, test_loss: 1.1591, test_f1: 0.5098
 epoch: 19, train_loss: 0.8513, test_loss: 1.2675, test_f1: 0.4790
 epoch: 20, train_loss: 0.8437, test_loss: 1.4771, test_f1: 0.3824
 epoch: 21, train_loss: 0.8449, test_loss: 1.0392, test_f1: 0.5349
 epoch: 22, train_loss: 0.8289, test_loss: 1.0410, test_f1: 0.5525
 epoch: 23, train_loss: 0.8184, test_loss: 1.1163, test_f1: 0.5494
 epoch: 24, train_loss: 0.8070, test_loss: 1.2208, test_f1: 0.5405
 epoch: 25, train_loss: 0.8002, test_loss: 1.1971, test_f1: 0.5194
 epoch: 26, train_loss: 0.7889, test_loss: 1.0877, test_f1: 0.5444
 epoch: 27, train_loss: 0.7611, test_loss: 1.1084, test_f1: 0.5831
 epoch: 28, train_loss: 0.7609, test_loss: 1.2195, test_f1: 0.5806
 epoch: 29, train_loss: 0.7617, test_loss: 1.0508, test_f1: 0.5966
 epoch: 30, train_loss: 0.7602, test_loss: 1.1750, test_f1: 0.5383
 epoch: 31, train_loss: 0.7563, test_loss: 1.1084, test_f1: 0.5489
 epoch: 32, train_loss: 0.7328, test_loss: 1.2132, test_f1: 0.5314
 epoch: 33, train_loss: 0.7355, test_loss: 1.2242, test_f1: 0.4917
 epoch: 34, train_loss: 0.7467, test_loss: 1.1061, test_f1: 0.5773
 epoch: 35, train_loss: 0.7127, test_loss: 1.0692, test_f1: 0.5657
 epoch: 36, train_loss: 0.7027, test_loss: 1.0441, test_f1: 0.6021
 epoch: 37, train_loss: 0.7267, test_loss: 1.1880, test_f1: 0.5645
 epoch: 38, train_loss: 0.7074, test_loss: 1.1498, test_f1: 0.5830
 epoch: 39, train_loss: 0.7011, test_loss: 1.2629, test_f1: 0.5222
 epoch: 40, train_loss: 0.6968, test_loss: 1.1703, test_f1: 0.5305
 epoch: 41, train_loss: 0.6783, test_loss: 1.2716, test_f1: 0.5167
 epoch: 42, train_loss: 0.6845, test_loss: 1.1369, test_f1: 0.5320
 epoch: 43, train_loss: 0.6820, test_loss: 1.1583, test_f1: 0.5479
 epoch: 44, train_loss: 0.6678, test_loss: 1.1654, test_f1: 0.5576
 epoch: 45, train_loss: 0.6742, test_loss: 1.3106, test_f1: 0.5183
 epoch: 46, train_loss: 0.6637, test_loss: 1.2980, test_f1: 0.5410
 epoch: 47, train_loss: 0.6915, test_loss: 1.2104, test_f1: 0.5928
 epoch: 48, train_loss: 0.6727, test_loss: 1.6122, test_f1: 0.5207
 epoch: 49, train_loss: 0.6749, test_loss: 1.2038, test_f1: 0.5570
 epoch: 50, train_loss: 0.6726, test_loss: 1.1910, test_f1: 0.5240
 epoch: 51, train_loss: 0.6650, test_loss: 1.3711, test_f1: 0.5458
 epoch: 52, train_loss: 0.6660, test_loss: 1.2837, test_f1: 0.5391
 epoch: 53, train_loss: 0.6524, test_loss: 1.2816, test_f1: 0.5556
 epoch: 54, train_loss: 0.6563, test_loss: 1.1958, test_f1: 0.5505
 epoch: 55, train_loss: 0.6535, test_loss: 1.3165, test_f1: 0.5033
 epoch: 56, train_loss: 0.6450, test_loss: 1.2222, test_f1: 0.5631
 epoch: 57, train_loss: 0.6437, test_loss: 1.2228, test_f1: 0.5591
 epoch: 58, train_loss: 0.6319, test_loss: 1.1864, test_f1: 0.5278
 epoch: 59, train_loss: 0.6430, test_loss: 1.2207, test_f1: 0.5294
 epoch: 60, train_loss: 0.6425, test_loss: 1.2619, test_f1: 0.5409
 epoch: 61, train_loss: 0.6299, test_loss: 1.2173, test_f1: 0.5675
 epoch: 62, train_loss: 0.6355, test_loss: 1.2995, test_f1: 0.5520
 epoch: 63, train_loss: 0.6355, test_loss: 1.3439, test_f1: 0.5665
 epoch: 64, train_loss: 0.6258, test_loss: 1.3089, test_f1: 0.5531
 epoch: 65, train_loss: 0.6198, test_loss: 1.2584, test_f1: 0.5511
 epoch: 66, train_loss: 0.6200, test_loss: 1.3422, test_f1: 0.5706
 epoch: 67, train_loss: 0.6133, test_loss: 1.4400, test_f1: 0.5498
 epoch: 68, train_loss: 0.6140, test_loss: 1.2362, test_f1: 0.5719
 epoch: 69, train_loss: 0.6178, test_loss: 1.1427, test_f1: 0.5621
 epoch: 70, train_loss: 0.6129, test_loss: 1.1775, test_f1: 0.5498
 epoch: 71, train_loss: 0.6306, test_loss: 1.3475, test_f1: 0.5207
 epoch: 72, train_loss: 0.6287, test_loss: 1.3657, test_f1: 0.5529
 epoch: 73, train_loss: 0.6206, test_loss: 1.3730, test_f1: 0.5350
 epoch: 74, train_loss: 0.6132, test_loss: 1.3733, test_f1: 0.5346
 epoch: 75, train_loss: 0.6173, test_loss: 1.4645, test_f1: 0.5533
 epoch: 76, train_loss: 0.6093, test_loss: 1.4783, test_f1: 0.5470
 epoch: 77, train_loss: 0.6153, test_loss: 1.5041, test_f1: 0.4959
 epoch: 78, train_loss: 0.6183, test_loss: 1.2734, test_f1: 0.5830
 epoch: 79, train_loss: 0.6425, test_loss: 1.2391, test_f1: 0.5863
 epoch: 80, train_loss: 0.6325, test_loss: 1.3430, test_f1: 0.5506
 epoch: 81, train_loss: 0.6163, test_loss: 1.2105, test_f1: 0.5509
 epoch: 82, train_loss: 0.6034, test_loss: 1.1857, test_f1: 0.5675
 epoch: 83, train_loss: 0.5981, test_loss: 1.1300, test_f1: 0.5886
 epoch: 84, train_loss: 0.6004, test_loss: 1.1494, test_f1: 0.5784
 epoch: 85, train_loss: 0.6033, test_loss: 1.2417, test_f1: 0.5699
 epoch: 86, train_loss: 0.6231, test_loss: 1.3699, test_f1: 0.5590
 epoch: 87, train_loss: 0.6197, test_loss: 1.2115, test_f1: 0.5405
 epoch: 88, train_loss: 0.6049, test_loss: 1.5540, test_f1: 0.5099
 epoch: 89, train_loss: 0.6071, test_loss: 1.4044, test_f1: 0.5333
 epoch: 90, train_loss: 0.5941, test_loss: 1.4232, test_f1: 0.5587
 epoch: 91, train_loss: 0.5976, test_loss: 1.3797, test_f1: 0.5525
 epoch: 92, train_loss: 0.5972, test_loss: 1.2985, test_f1: 0.5596
 epoch: 93, train_loss: 0.6006, test_loss: 1.3662, test_f1: 0.5561
 epoch: 94, train_loss: 0.6028, test_loss: 1.3669, test_f1: 0.5407
 epoch: 95, train_loss: 0.5919, test_loss: 1.4314, test_f1: 0.5432
 epoch: 96, train_loss: 0.6033, test_loss: 1.4997, test_f1: 0.5566
 epoch: 97, train_loss: 0.5920, test_loss: 1.5826, test_f1: 0.5507
 epoch: 98, train_loss: 0.5944, test_loss: 1.3399, test_f1: 0.5433
 epoch: 99, train_loss: 0.5954, test_loss: 1.2271, test_f1: 0.5371
##################ITERATION #2 ****************************************
 epoch: 0, train_loss: 1.2481, test_loss: 1.3107, test_f1: 0.2281
 epoch: 1, train_loss: 1.1874, test_loss: 1.3033, test_f1: 0.2281
 epoch: 2, train_loss: 1.1580, test_loss: 1.2871, test_f1: 0.2281
 epoch: 3, train_loss: 1.1259, test_loss: 1.2710, test_f1: 0.2281
 epoch: 4, train_loss: 1.0919, test_loss: 1.2448, test_f1: 0.2281
 epoch: 5, train_loss: 1.0594, test_loss: 1.2034, test_f1: 0.2913
 epoch: 6, train_loss: 1.0216, test_loss: 1.1545, test_f1: 0.3305
 epoch: 7, train_loss: 1.0056, test_loss: 1.1099, test_f1: 0.3715
 epoch: 8, train_loss: 0.9906, test_loss: 1.0690, test_f1: 0.4140
 epoch: 9, train_loss: 0.9614, test_loss: 1.0989, test_f1: 0.4169
 epoch: 10, train_loss: 0.9483, test_loss: 1.0727, test_f1: 0.4463
 epoch: 11, train_loss: 0.9275, test_loss: 1.0709, test_f1: 0.4427
 epoch: 12, train_loss: 0.9111, test_loss: 1.0308, test_f1: 0.5167
 epoch: 13, train_loss: 0.8911, test_loss: 1.0110, test_f1: 0.4933
 epoch: 14, train_loss: 0.8771, test_loss: 1.0349, test_f1: 0.5261
 epoch: 15, train_loss: 0.8691, test_loss: 1.0444, test_f1: 0.4936
 epoch: 16, train_loss: 0.8599, test_loss: 1.0299, test_f1: 0.4906
 epoch: 17, train_loss: 0.8460, test_loss: 1.0310, test_f1: 0.5005
 epoch: 18, train_loss: 0.8244, test_loss: 1.0037, test_f1: 0.5220
 epoch: 19, train_loss: 0.8107, test_loss: 0.9783, test_f1: 0.5399
 epoch: 20, train_loss: 0.8139, test_loss: 0.9920, test_f1: 0.5569
 epoch: 21, train_loss: 0.8191, test_loss: 0.9775, test_f1: 0.5649
 epoch: 22, train_loss: 0.7999, test_loss: 1.0055, test_f1: 0.5580
 epoch: 23, train_loss: 0.8144, test_loss: 0.9755, test_f1: 0.5745
 epoch: 24, train_loss: 0.7923, test_loss: 0.9416, test_f1: 0.5654
 epoch: 25, train_loss: 0.8062, test_loss: 1.0437, test_f1: 0.5397
 epoch: 26, train_loss: 0.7951, test_loss: 0.9737, test_f1: 0.5465
 epoch: 27, train_loss: 0.7862, test_loss: 0.9559, test_f1: 0.5198
 epoch: 28, train_loss: 0.7817, test_loss: 0.9697, test_f1: 0.5136
 epoch: 29, train_loss: 0.7769, test_loss: 0.9713, test_f1: 0.5428
 epoch: 30, train_loss: 0.7771, test_loss: 0.9957, test_f1: 0.5712
 epoch: 31, train_loss: 0.7627, test_loss: 0.9669, test_f1: 0.5654
 epoch: 32, train_loss: 0.7609, test_loss: 0.9696, test_f1: 0.5685
 epoch: 33, train_loss: 0.7695, test_loss: 0.9902, test_f1: 0.5816
 epoch: 34, train_loss: 0.7549, test_loss: 0.9579, test_f1: 0.5996
 epoch: 35, train_loss: 0.7454, test_loss: 0.9768, test_f1: 0.5839
 epoch: 36, train_loss: 0.7430, test_loss: 1.0247, test_f1: 0.5241
 epoch: 37, train_loss: 0.7394, test_loss: 1.0711, test_f1: 0.5513
 epoch: 38, train_loss: 0.7209, test_loss: 1.0217, test_f1: 0.5983
 epoch: 39, train_loss: 0.7273, test_loss: 1.0098, test_f1: 0.6007
 epoch: 40, train_loss: 0.7357, test_loss: 1.0071, test_f1: 0.5985
 epoch: 41, train_loss: 0.7515, test_loss: 1.0074, test_f1: 0.5765
 epoch: 42, train_loss: 0.7178, test_loss: 1.0332, test_f1: 0.5797
 epoch: 43, train_loss: 0.7269, test_loss: 1.0441, test_f1: 0.5651
 epoch: 44, train_loss: 0.7264, test_loss: 1.0823, test_f1: 0.5422
 epoch: 45, train_loss: 0.7146, test_loss: 1.0712, test_f1: 0.5682
 epoch: 46, train_loss: 0.7307, test_loss: 1.0324, test_f1: 0.5673
 epoch: 47, train_loss: 0.7256, test_loss: 1.0413, test_f1: 0.5658
 epoch: 48, train_loss: 0.7041, test_loss: 0.9883, test_f1: 0.5882
 epoch: 49, train_loss: 0.6957, test_loss: 1.0658, test_f1: 0.5693
 epoch: 50, train_loss: 0.6991, test_loss: 1.0573, test_f1: 0.5647
 epoch: 51, train_loss: 0.6937, test_loss: 1.0480, test_f1: 0.5557
 epoch: 52, train_loss: 0.6745, test_loss: 1.0526, test_f1: 0.5647
 epoch: 53, train_loss: 0.6774, test_loss: 1.0428, test_f1: 0.5755
 epoch: 54, train_loss: 0.6797, test_loss: 1.0629, test_f1: 0.5793
 epoch: 55, train_loss: 0.6764, test_loss: 1.0693, test_f1: 0.6016
 epoch: 56, train_loss: 0.6710, test_loss: 1.0672, test_f1: 0.6063
 epoch: 57, train_loss: 0.6734, test_loss: 1.1003, test_f1: 0.5982
 epoch: 58, train_loss: 0.6753, test_loss: 1.0690, test_f1: 0.6023
 epoch: 59, train_loss: 0.6696, test_loss: 1.0566, test_f1: 0.5811
 epoch: 60, train_loss: 0.6716, test_loss: 1.0803, test_f1: 0.5662
 epoch: 61, train_loss: 0.6848, test_loss: 1.0729, test_f1: 0.5674
 epoch: 62, train_loss: 0.6612, test_loss: 1.0418, test_f1: 0.6029
 epoch: 63, train_loss: 0.6733, test_loss: 1.0433, test_f1: 0.6092
 epoch: 64, train_loss: 0.6689, test_loss: 1.0833, test_f1: 0.5788
 epoch: 65, train_loss: 0.6705, test_loss: 1.0947, test_f1: 0.5901
 epoch: 66, train_loss: 0.6716, test_loss: 1.1163, test_f1: 0.5884
 epoch: 67, train_loss: 0.6779, test_loss: 1.1331, test_f1: 0.5925
 epoch: 68, train_loss: 0.6616, test_loss: 1.0790, test_f1: 0.5972
 epoch: 69, train_loss: 0.6501, test_loss: 1.0468, test_f1: 0.5866
 epoch: 70, train_loss: 0.6693, test_loss: 1.0291, test_f1: 0.5959
 epoch: 71, train_loss: 0.6626, test_loss: 1.0652, test_f1: 0.5856
 epoch: 72, train_loss: 0.6545, test_loss: 1.0799, test_f1: 0.5851
 epoch: 73, train_loss: 0.6613, test_loss: 1.1053, test_f1: 0.5842
 epoch: 74, train_loss: 0.6580, test_loss: 1.1417, test_f1: 0.5899
 epoch: 75, train_loss: 0.6638, test_loss: 1.1228, test_f1: 0.5979
 epoch: 76, train_loss: 0.6389, test_loss: 1.0987, test_f1: 0.6060
 epoch: 77, train_loss: 0.6446, test_loss: 1.1120, test_f1: 0.5889
 epoch: 78, train_loss: 0.6476, test_loss: 1.1492, test_f1: 0.5754
 epoch: 79, train_loss: 0.6435, test_loss: 1.1846, test_f1: 0.5630
 epoch: 80, train_loss: 0.6393, test_loss: 1.1617, test_f1: 0.5796
 epoch: 81, train_loss: 0.6353, test_loss: 1.0916, test_f1: 0.5948
 epoch: 82, train_loss: 0.6422, test_loss: 1.1192, test_f1: 0.5859
 epoch: 83, train_loss: 0.6508, test_loss: 1.1405, test_f1: 0.5802
 epoch: 84, train_loss: 0.6367, test_loss: 1.0193, test_f1: 0.5958
 epoch: 85, train_loss: 0.6428, test_loss: 1.1099, test_f1: 0.5922
 epoch: 86, train_loss: 0.6321, test_loss: 1.1450, test_f1: 0.5960
 epoch: 87, train_loss: 0.6221, test_loss: 1.1138, test_f1: 0.6000
 epoch: 88, train_loss: 0.6310, test_loss: 1.1871, test_f1: 0.5985
 epoch: 89, train_loss: 0.6392, test_loss: 1.1726, test_f1: 0.5821
 epoch: 90, train_loss: 0.6251, test_loss: 1.1898, test_f1: 0.5994
 epoch: 91, train_loss: 0.6265, test_loss: 1.3320, test_f1: 0.5542
 epoch: 92, train_loss: 0.6468, test_loss: 1.2000, test_f1: 0.5699
 epoch: 93, train_loss: 0.6288, test_loss: 1.1590, test_f1: 0.5922
 epoch: 94, train_loss: 0.6299, test_loss: 1.2060, test_f1: 0.5881
 epoch: 95, train_loss: 0.6285, test_loss: 1.2021, test_f1: 0.5760
 epoch: 96, train_loss: 0.6311, test_loss: 1.1106, test_f1: 0.5869
 epoch: 97, train_loss: 0.6204, test_loss: 1.1256, test_f1: 0.5846
 epoch: 98, train_loss: 0.6180, test_loss: 1.1617, test_f1: 0.5856
 epoch: 99, train_loss: 0.6150, test_loss: 1.1594, test_f1: 0.5872
##################ITERATION #3 ****************************************
 epoch: 0, train_loss: 1.2107, test_loss: 1.3211, test_f1: 0.2281
 epoch: 1, train_loss: 1.1332, test_loss: 1.3272, test_f1: 0.2248
 epoch: 2, train_loss: 1.1064, test_loss: 1.3370, test_f1: 0.2392
 epoch: 3, train_loss: 1.0723, test_loss: 1.3384, test_f1: 0.2404
 epoch: 4, train_loss: 1.0468, test_loss: 1.3276, test_f1: 0.2248
 epoch: 5, train_loss: 1.0112, test_loss: 1.2830, test_f1: 0.2389
 epoch: 6, train_loss: 0.9913, test_loss: 1.2190, test_f1: 0.3400
 epoch: 7, train_loss: 0.9547, test_loss: 1.1716, test_f1: 0.4306
 epoch: 8, train_loss: 0.9434, test_loss: 1.0928, test_f1: 0.4741
 epoch: 9, train_loss: 0.9047, test_loss: 1.0405, test_f1: 0.5259
 epoch: 10, train_loss: 0.8953, test_loss: 1.0155, test_f1: 0.5228
 epoch: 11, train_loss: 0.8751, test_loss: 1.0059, test_f1: 0.5573
 epoch: 12, train_loss: 0.8688, test_loss: 0.9870, test_f1: 0.5525
 epoch: 13, train_loss: 0.8553, test_loss: 1.0073, test_f1: 0.5448
 epoch: 14, train_loss: 0.8399, test_loss: 0.9913, test_f1: 0.5661
 epoch: 15, train_loss: 0.8497, test_loss: 0.9735, test_f1: 0.6043
 epoch: 16, train_loss: 0.8263, test_loss: 0.9566, test_f1: 0.5622
 epoch: 17, train_loss: 0.8079, test_loss: 0.9280, test_f1: 0.5650
 epoch: 18, train_loss: 0.8174, test_loss: 0.9563, test_f1: 0.5533
 epoch: 19, train_loss: 0.7973, test_loss: 0.9394, test_f1: 0.5790
 epoch: 20, train_loss: 0.8079, test_loss: 0.9430, test_f1: 0.6268
 epoch: 21, train_loss: 0.7860, test_loss: 0.9213, test_f1: 0.6196
 epoch: 22, train_loss: 0.7837, test_loss: 0.9452, test_f1: 0.5964
 epoch: 23, train_loss: 0.7712, test_loss: 0.9371, test_f1: 0.5787
 epoch: 24, train_loss: 0.7552, test_loss: 0.9215, test_f1: 0.6321
 epoch: 25, train_loss: 0.7651, test_loss: 0.9279, test_f1: 0.6350
 epoch: 26, train_loss: 0.7430, test_loss: 0.9581, test_f1: 0.5775
 epoch: 27, train_loss: 0.7440, test_loss: 0.9319, test_f1: 0.5966
 epoch: 28, train_loss: 0.7304, test_loss: 0.9388, test_f1: 0.5842
 epoch: 29, train_loss: 0.7201, test_loss: 0.9449, test_f1: 0.5936
 epoch: 30, train_loss: 0.7195, test_loss: 0.9508, test_f1: 0.5956
 epoch: 31, train_loss: 0.7234, test_loss: 0.9070, test_f1: 0.6037
 epoch: 32, train_loss: 0.7114, test_loss: 0.8995, test_f1: 0.5947
 epoch: 33, train_loss: 0.7109, test_loss: 0.9294, test_f1: 0.5785
 epoch: 34, train_loss: 0.7125, test_loss: 0.9452, test_f1: 0.5856
 epoch: 35, train_loss: 0.7129, test_loss: 0.9971, test_f1: 0.5885
 epoch: 36, train_loss: 0.7217, test_loss: 0.9724, test_f1: 0.5735
 epoch: 37, train_loss: 0.7209, test_loss: 0.9192, test_f1: 0.5940
 epoch: 38, train_loss: 0.6969, test_loss: 0.9261, test_f1: 0.6179
 epoch: 39, train_loss: 0.7117, test_loss: 0.9284, test_f1: 0.6036
 epoch: 40, train_loss: 0.6967, test_loss: 0.9344, test_f1: 0.6009
 epoch: 41, train_loss: 0.6886, test_loss: 0.9143, test_f1: 0.5844
 epoch: 42, train_loss: 0.6775, test_loss: 0.9150, test_f1: 0.6113
 epoch: 43, train_loss: 0.6877, test_loss: 0.9050, test_f1: 0.6055
 epoch: 44, train_loss: 0.6761, test_loss: 0.9136, test_f1: 0.5904
 epoch: 45, train_loss: 0.6846, test_loss: 0.9096, test_f1: 0.6149
 epoch: 46, train_loss: 0.6825, test_loss: 0.9626, test_f1: 0.6120
 epoch: 47, train_loss: 0.6813, test_loss: 0.9495, test_f1: 0.5331
 epoch: 48, train_loss: 0.7017, test_loss: 0.9456, test_f1: 0.5860
 epoch: 49, train_loss: 0.6864, test_loss: 1.0512, test_f1: 0.5568
 epoch: 50, train_loss: 0.6735, test_loss: 0.9819, test_f1: 0.6139
 epoch: 51, train_loss: 0.6552, test_loss: 0.9490, test_f1: 0.6268
 epoch: 52, train_loss: 0.6572, test_loss: 0.9579, test_f1: 0.6157
 epoch: 53, train_loss: 0.6553, test_loss: 0.9871, test_f1: 0.5853
 epoch: 54, train_loss: 0.6327, test_loss: 0.9819, test_f1: 0.5840
 epoch: 55, train_loss: 0.6366, test_loss: 0.9876, test_f1: 0.5991
 epoch: 56, train_loss: 0.6316, test_loss: 1.0379, test_f1: 0.5644
 epoch: 57, train_loss: 0.6311, test_loss: 0.9900, test_f1: 0.6045
 epoch: 58, train_loss: 0.6391, test_loss: 0.9951, test_f1: 0.5680
 epoch: 59, train_loss: 0.6328, test_loss: 0.9997, test_f1: 0.5757
 epoch: 60, train_loss: 0.6235, test_loss: 1.0025, test_f1: 0.6001
 epoch: 61, train_loss: 0.6279, test_loss: 1.0196, test_f1: 0.5872
 epoch: 62, train_loss: 0.6149, test_loss: 1.0108, test_f1: 0.5812
 epoch: 63, train_loss: 0.6344, test_loss: 1.0148, test_f1: 0.5934
 epoch: 64, train_loss: 0.6230, test_loss: 1.0145, test_f1: 0.5868
 epoch: 65, train_loss: 0.6242, test_loss: 0.9983, test_f1: 0.5532
 epoch: 66, train_loss: 0.6123, test_loss: 1.0194, test_f1: 0.5512
 epoch: 67, train_loss: 0.6098, test_loss: 1.0418, test_f1: 0.5976
 epoch: 68, train_loss: 0.6171, test_loss: 1.0284, test_f1: 0.5711
 epoch: 69, train_loss: 0.6152, test_loss: 1.0265, test_f1: 0.5818
 epoch: 70, train_loss: 0.6272, test_loss: 0.9779, test_f1: 0.5911
 epoch: 71, train_loss: 0.6138, test_loss: 1.0037, test_f1: 0.5892
 epoch: 72, train_loss: 0.6253, test_loss: 0.9703, test_f1: 0.5738
 epoch: 73, train_loss: 0.6198, test_loss: 0.9510, test_f1: 0.5774
 epoch: 74, train_loss: 0.6049, test_loss: 0.9555, test_f1: 0.5686
 epoch: 75, train_loss: 0.6011, test_loss: 0.9865, test_f1: 0.5670
 epoch: 76, train_loss: 0.6071, test_loss: 0.9862, test_f1: 0.5833
 epoch: 77, train_loss: 0.6211, test_loss: 1.0114, test_f1: 0.5719
 epoch: 78, train_loss: 0.6096, test_loss: 1.0298, test_f1: 0.5416
 epoch: 79, train_loss: 0.6008, test_loss: 1.0943, test_f1: 0.5752
 epoch: 80, train_loss: 0.5970, test_loss: 1.1008, test_f1: 0.5514
 epoch: 81, train_loss: 0.6038, test_loss: 1.0953, test_f1: 0.5448
 epoch: 82, train_loss: 0.5922, test_loss: 1.1019, test_f1: 0.5433
 epoch: 83, train_loss: 0.5850, test_loss: 1.1363, test_f1: 0.5279
 epoch: 84, train_loss: 0.5801, test_loss: 1.1175, test_f1: 0.5495
 epoch: 85, train_loss: 0.5907, test_loss: 1.1243, test_f1: 0.5531
 epoch: 86, train_loss: 0.5854, test_loss: 1.1170, test_f1: 0.5725
 epoch: 87, train_loss: 0.5917, test_loss: 1.0693, test_f1: 0.5676
 epoch: 88, train_loss: 0.5931, test_loss: 1.0477, test_f1: 0.5527
 epoch: 89, train_loss: 0.6054, test_loss: 1.0906, test_f1: 0.5674
 epoch: 90, train_loss: 0.5842, test_loss: 1.1206, test_f1: 0.5763
 epoch: 91, train_loss: 0.5831, test_loss: 1.0983, test_f1: 0.5757
 epoch: 92, train_loss: 0.5873, test_loss: 1.0790, test_f1: 0.5672
 epoch: 93, train_loss: 0.5707, test_loss: 1.1047, test_f1: 0.5921
 epoch: 94, train_loss: 0.5811, test_loss: 1.1273, test_f1: 0.5868
 epoch: 95, train_loss: 0.5712, test_loss: 1.1402, test_f1: 0.5897
 epoch: 96, train_loss: 0.5648, test_loss: 1.1936, test_f1: 0.5532
 epoch: 97, train_loss: 0.5628, test_loss: 1.1850, test_f1: 0.5419
 epoch: 98, train_loss: 0.5653, test_loss: 1.1060, test_f1: 0.5329
 epoch: 99, train_loss: 0.5578, test_loss: 1.2382, test_f1: 0.5292
##################ITERATION #4 ****************************************
 epoch: 0, train_loss: 1.2381, test_loss: 1.3028, test_f1: 0.2281
 epoch: 1, train_loss: 1.1250, test_loss: 1.2964, test_f1: 0.2281
 epoch: 2, train_loss: 1.0773, test_loss: 1.2977, test_f1: 0.2281
 epoch: 3, train_loss: 1.0530, test_loss: 1.3158, test_f1: 0.2344
 epoch: 4, train_loss: 1.0279, test_loss: 1.3394, test_f1: 0.2592
 epoch: 5, train_loss: 0.9957, test_loss: 1.4060, test_f1: 0.1483
 epoch: 6, train_loss: 0.9683, test_loss: 1.4756, test_f1: 0.1414
 epoch: 7, train_loss: 0.9604, test_loss: 1.4733, test_f1: 0.1581
 epoch: 8, train_loss: 0.9354, test_loss: 1.3137, test_f1: 0.2784
 epoch: 9, train_loss: 0.9121, test_loss: 1.1172, test_f1: 0.4558
 epoch: 10, train_loss: 0.8947, test_loss: 1.0754, test_f1: 0.5017
 epoch: 11, train_loss: 0.8750, test_loss: 1.0335, test_f1: 0.5645
 epoch: 12, train_loss: 0.8738, test_loss: 1.0088, test_f1: 0.5681
 epoch: 13, train_loss: 0.8492, test_loss: 0.9912, test_f1: 0.5572
 epoch: 14, train_loss: 0.8364, test_loss: 1.0014, test_f1: 0.5766
 epoch: 15, train_loss: 0.8325, test_loss: 0.9801, test_f1: 0.5810
 epoch: 16, train_loss: 0.8154, test_loss: 0.9842, test_f1: 0.5828
 epoch: 17, train_loss: 0.8095, test_loss: 0.9704, test_f1: 0.5940
 epoch: 18, train_loss: 0.7960, test_loss: 1.0089, test_f1: 0.5692
 epoch: 19, train_loss: 0.7949, test_loss: 0.9839, test_f1: 0.5669
 epoch: 20, train_loss: 0.7777, test_loss: 1.0104, test_f1: 0.6076
 epoch: 21, train_loss: 0.7694, test_loss: 1.0445, test_f1: 0.5091
 epoch: 22, train_loss: 0.7543, test_loss: 1.0128, test_f1: 0.5353
 epoch: 23, train_loss: 0.7505, test_loss: 1.0132, test_f1: 0.6120
 epoch: 24, train_loss: 0.7535, test_loss: 1.0252, test_f1: 0.5929
 epoch: 25, train_loss: 0.7469, test_loss: 1.0037, test_f1: 0.6289
 epoch: 26, train_loss: 0.7443, test_loss: 0.9735, test_f1: 0.6086
 epoch: 27, train_loss: 0.7384, test_loss: 1.0692, test_f1: 0.5975
 epoch: 28, train_loss: 0.7291, test_loss: 1.0345, test_f1: 0.6019
 epoch: 29, train_loss: 0.7225, test_loss: 1.0878, test_f1: 0.5980
 epoch: 30, train_loss: 0.7013, test_loss: 1.0703, test_f1: 0.5973
 epoch: 31, train_loss: 0.7057, test_loss: 1.0399, test_f1: 0.5893
 epoch: 32, train_loss: 0.7149, test_loss: 1.1432, test_f1: 0.5681
 epoch: 33, train_loss: 0.7287, test_loss: 1.0933, test_f1: 0.5756
 epoch: 34, train_loss: 0.7043, test_loss: 1.1125, test_f1: 0.5874
 epoch: 35, train_loss: 0.7012, test_loss: 1.1218, test_f1: 0.5899
 epoch: 36, train_loss: 0.7111, test_loss: 1.1033, test_f1: 0.6078
 epoch: 37, train_loss: 0.7013, test_loss: 1.1226, test_f1: 0.6125
 epoch: 38, train_loss: 0.7141, test_loss: 1.1215, test_f1: 0.6167
 epoch: 39, train_loss: 0.6824, test_loss: 1.1710, test_f1: 0.5920
 epoch: 40, train_loss: 0.6819, test_loss: 1.1054, test_f1: 0.6054
 epoch: 41, train_loss: 0.6750, test_loss: 1.0981, test_f1: 0.5918
 epoch: 42, train_loss: 0.6608, test_loss: 1.0685, test_f1: 0.6073
 epoch: 43, train_loss: 0.6455, test_loss: 1.1204, test_f1: 0.5842
 epoch: 44, train_loss: 0.6566, test_loss: 1.1526, test_f1: 0.6097
 epoch: 45, train_loss: 0.6559, test_loss: 1.1763, test_f1: 0.5770
 epoch: 46, train_loss: 0.6377, test_loss: 1.1975, test_f1: 0.6201
 epoch: 47, train_loss: 0.6565, test_loss: 1.1729, test_f1: 0.6112
 epoch: 48, train_loss: 0.6419, test_loss: 1.1253, test_f1: 0.6144
 epoch: 49, train_loss: 0.6608, test_loss: 1.0757, test_f1: 0.6133
 epoch: 50, train_loss: 0.6715, test_loss: 1.0692, test_f1: 0.6021
 epoch: 51, train_loss: 0.6609, test_loss: 1.0721, test_f1: 0.6106
 epoch: 52, train_loss: 0.6425, test_loss: 1.1321, test_f1: 0.6172
 epoch: 53, train_loss: 0.6207, test_loss: 1.1179, test_f1: 0.6070
 epoch: 54, train_loss: 0.6196, test_loss: 1.1209, test_f1: 0.6144
 epoch: 55, train_loss: 0.6236, test_loss: 1.1377, test_f1: 0.6516
 epoch: 56, train_loss: 0.6275, test_loss: 1.1482, test_f1: 0.6450
 epoch: 57, train_loss: 0.6053, test_loss: 1.1419, test_f1: 0.6129
 epoch: 58, train_loss: 0.6100, test_loss: 1.1411, test_f1: 0.6286
 epoch: 59, train_loss: 0.5908, test_loss: 1.1725, test_f1: 0.5914
 epoch: 60, train_loss: 0.5958, test_loss: 1.1955, test_f1: 0.5881
 epoch: 61, train_loss: 0.6071, test_loss: 1.1446, test_f1: 0.6176
 epoch: 62, train_loss: 0.6037, test_loss: 1.1166, test_f1: 0.6378
 epoch: 63, train_loss: 0.5998, test_loss: 1.1187, test_f1: 0.6301
 epoch: 64, train_loss: 0.5905, test_loss: 1.1440, test_f1: 0.6030
 epoch: 65, train_loss: 0.5858, test_loss: 1.1618, test_f1: 0.5845
 epoch: 66, train_loss: 0.5888, test_loss: 1.2088, test_f1: 0.5987
 epoch: 67, train_loss: 0.5843, test_loss: 1.1627, test_f1: 0.6248
 epoch: 68, train_loss: 0.5745, test_loss: 1.1548, test_f1: 0.6308
 epoch: 69, train_loss: 0.5801, test_loss: 1.1602, test_f1: 0.6203
 epoch: 70, train_loss: 0.5785, test_loss: 1.1724, test_f1: 0.6396
 epoch: 71, train_loss: 0.5726, test_loss: 1.1617, test_f1: 0.6390
 epoch: 72, train_loss: 0.5793, test_loss: 1.1759, test_f1: 0.6081
 epoch: 73, train_loss: 0.5809, test_loss: 1.1473, test_f1: 0.6404
 epoch: 74, train_loss: 0.5651, test_loss: 1.1764, test_f1: 0.6113
 epoch: 75, train_loss: 0.5757, test_loss: 1.2440, test_f1: 0.6121
 epoch: 76, train_loss: 0.5710, test_loss: 1.2392, test_f1: 0.6081
 epoch: 77, train_loss: 0.5692, test_loss: 1.2373, test_f1: 0.6037
 epoch: 78, train_loss: 0.5576, test_loss: 1.2238, test_f1: 0.5790
 epoch: 79, train_loss: 0.5645, test_loss: 1.2540, test_f1: 0.5951
 epoch: 80, train_loss: 0.5663, test_loss: 1.2223, test_f1: 0.5891
 epoch: 81, train_loss: 0.5616, test_loss: 1.1234, test_f1: 0.5800
 epoch: 82, train_loss: 0.5561, test_loss: 1.3465, test_f1: 0.5499
 epoch: 83, train_loss: 0.5691, test_loss: 1.1549, test_f1: 0.6254
 epoch: 84, train_loss: 0.5546, test_loss: 1.2856, test_f1: 0.5765
 epoch: 85, train_loss: 0.5644, test_loss: 1.2965, test_f1: 0.5981
 epoch: 86, train_loss: 0.5671, test_loss: 1.3538, test_f1: 0.5744
 epoch: 87, train_loss: 0.5349, test_loss: 1.3891, test_f1: 0.5831
 epoch: 88, train_loss: 0.5601, test_loss: 1.3461, test_f1: 0.5746
 epoch: 89, train_loss: 0.5545, test_loss: 1.3634, test_f1: 0.5808
 epoch: 90, train_loss: 0.5339, test_loss: 1.5019, test_f1: 0.5631
 epoch: 91, train_loss: 0.5671, test_loss: 1.3492, test_f1: 0.5691
 epoch: 92, train_loss: 0.5523, test_loss: 1.1830, test_f1: 0.6056
 epoch: 93, train_loss: 0.5402, test_loss: 1.2074, test_f1: 0.6234
 epoch: 94, train_loss: 0.5453, test_loss: 1.3721, test_f1: 0.5798
 epoch: 95, train_loss: 0.5288, test_loss: 1.3531, test_f1: 0.5823
 epoch: 96, train_loss: 0.5415, test_loss: 1.2579, test_f1: 0.5972
 epoch: 97, train_loss: 0.5363, test_loss: 1.3163, test_f1: 0.5759
 epoch: 98, train_loss: 0.5321, test_loss: 1.4424, test_f1: 0.5704
 epoch: 99, train_loss: 0.5391, test_loss: 1.3452, test_f1: 0.5977
##################ITERATION #5 ****************************************
 epoch: 0, train_loss: 1.2692, test_loss: 1.3241, test_f1: 0.2281
 epoch: 1, train_loss: 1.1520, test_loss: 1.3196, test_f1: 0.2281
 epoch: 2, train_loss: 1.1060, test_loss: 1.2985, test_f1: 0.2281
 epoch: 3, train_loss: 1.0688, test_loss: 1.2707, test_f1: 0.2285
 epoch: 4, train_loss: 1.0443, test_loss: 1.2162, test_f1: 0.2587
 epoch: 5, train_loss: 1.0115, test_loss: 1.1560, test_f1: 0.3610
 epoch: 6, train_loss: 0.9904, test_loss: 1.1021, test_f1: 0.4711
 epoch: 7, train_loss: 0.9675, test_loss: 1.0450, test_f1: 0.5316
 epoch: 8, train_loss: 0.9407, test_loss: 1.0063, test_f1: 0.5288
 epoch: 9, train_loss: 0.9221, test_loss: 1.0306, test_f1: 0.5385
 epoch: 10, train_loss: 0.9167, test_loss: 1.0187, test_f1: 0.5439
 epoch: 11, train_loss: 0.8980, test_loss: 1.0436, test_f1: 0.5246
 epoch: 12, train_loss: 0.8850, test_loss: 0.9990, test_f1: 0.5337
 epoch: 13, train_loss: 0.8776, test_loss: 0.9630, test_f1: 0.5608
 epoch: 14, train_loss: 0.8613, test_loss: 0.9646, test_f1: 0.5634
 epoch: 15, train_loss: 0.8437, test_loss: 0.9946, test_f1: 0.5744
 epoch: 16, train_loss: 0.8342, test_loss: 1.0353, test_f1: 0.5085
 epoch: 17, train_loss: 0.8491, test_loss: 1.0375, test_f1: 0.5064
 epoch: 18, train_loss: 0.8200, test_loss: 1.0213, test_f1: 0.5732
 epoch: 19, train_loss: 0.8145, test_loss: 1.0121, test_f1: 0.5821
 epoch: 20, train_loss: 0.8134, test_loss: 1.0070, test_f1: 0.5529
 epoch: 21, train_loss: 0.7947, test_loss: 1.0651, test_f1: 0.5249
 epoch: 22, train_loss: 0.7930, test_loss: 1.0356, test_f1: 0.4799
 epoch: 23, train_loss: 0.7871, test_loss: 1.0374, test_f1: 0.5264
 epoch: 24, train_loss: 0.7691, test_loss: 1.0809, test_f1: 0.5805
 epoch: 25, train_loss: 0.7807, test_loss: 1.1037, test_f1: 0.5235
 epoch: 26, train_loss: 0.7624, test_loss: 1.0265, test_f1: 0.5685
 epoch: 27, train_loss: 0.7663, test_loss: 1.0177, test_f1: 0.5804
 epoch: 28, train_loss: 0.7449, test_loss: 1.0388, test_f1: 0.5794
 epoch: 29, train_loss: 0.7442, test_loss: 1.0809, test_f1: 0.5481
 epoch: 30, train_loss: 0.7436, test_loss: 1.0087, test_f1: 0.6095
 epoch: 31, train_loss: 0.7336, test_loss: 1.0938, test_f1: 0.5673
 epoch: 32, train_loss: 0.7432, test_loss: 1.0804, test_f1: 0.5626
 epoch: 33, train_loss: 0.7156, test_loss: 1.0554, test_f1: 0.5852
 epoch: 34, train_loss: 0.7217, test_loss: 1.1138, test_f1: 0.5650
 epoch: 35, train_loss: 0.7321, test_loss: 1.0422, test_f1: 0.6055
 epoch: 36, train_loss: 0.7111, test_loss: 1.0350, test_f1: 0.5744
 epoch: 37, train_loss: 0.7232, test_loss: 1.1335, test_f1: 0.5591
 epoch: 38, train_loss: 0.7196, test_loss: 1.1809, test_f1: 0.5411
 epoch: 39, train_loss: 0.7278, test_loss: 1.1905, test_f1: 0.5277
 epoch: 40, train_loss: 0.7329, test_loss: 1.1642, test_f1: 0.5153
 epoch: 41, train_loss: 0.7178, test_loss: 1.0360, test_f1: 0.5893
 epoch: 42, train_loss: 0.6971, test_loss: 1.0348, test_f1: 0.5929
 epoch: 43, train_loss: 0.6909, test_loss: 1.1284, test_f1: 0.6057
 epoch: 44, train_loss: 0.7045, test_loss: 1.1110, test_f1: 0.6173
 epoch: 45, train_loss: 0.6838, test_loss: 1.0332, test_f1: 0.6186
 epoch: 46, train_loss: 0.6766, test_loss: 1.1557, test_f1: 0.5274
 epoch: 47, train_loss: 0.6779, test_loss: 1.1781, test_f1: 0.5760
 epoch: 48, train_loss: 0.6611, test_loss: 1.1947, test_f1: 0.5382
 epoch: 49, train_loss: 0.7047, test_loss: 1.1636, test_f1: 0.5721
 epoch: 50, train_loss: 0.6800, test_loss: 1.2026, test_f1: 0.5891
 epoch: 51, train_loss: 0.6755, test_loss: 1.1312, test_f1: 0.5942
 epoch: 52, train_loss: 0.6594, test_loss: 1.1034, test_f1: 0.6092
 epoch: 53, train_loss: 0.6491, test_loss: 1.1183, test_f1: 0.6003
 epoch: 54, train_loss: 0.6553, test_loss: 1.1932, test_f1: 0.6026
 epoch: 55, train_loss: 0.6456, test_loss: 1.1181, test_f1: 0.5812
 epoch: 56, train_loss: 0.6420, test_loss: 1.1244, test_f1: 0.6013
 epoch: 57, train_loss: 0.6430, test_loss: 1.1716, test_f1: 0.6369
 epoch: 58, train_loss: 0.6442, test_loss: 1.1194, test_f1: 0.6099
 epoch: 59, train_loss: 0.6587, test_loss: 1.2001, test_f1: 0.5706
 epoch: 60, train_loss: 0.6808, test_loss: 1.2347, test_f1: 0.5605
 epoch: 61, train_loss: 0.6533, test_loss: 1.1909, test_f1: 0.5973
 epoch: 62, train_loss: 0.6452, test_loss: 1.1879, test_f1: 0.5863
 epoch: 63, train_loss: 0.6343, test_loss: 1.1748, test_f1: 0.6048
 epoch: 64, train_loss: 0.6290, test_loss: 1.1784, test_f1: 0.5352
 epoch: 65, train_loss: 0.6373, test_loss: 1.1420, test_f1: 0.5705
 epoch: 66, train_loss: 0.6396, test_loss: 1.1412, test_f1: 0.5863
 epoch: 67, train_loss: 0.6240, test_loss: 1.1570, test_f1: 0.5823
 epoch: 68, train_loss: 0.6185, test_loss: 1.1652, test_f1: 0.6155
 epoch: 69, train_loss: 0.6221, test_loss: 1.1759, test_f1: 0.6022
 epoch: 70, train_loss: 0.6112, test_loss: 1.2045, test_f1: 0.6053
 epoch: 71, train_loss: 0.6226, test_loss: 1.2177, test_f1: 0.5861
 epoch: 72, train_loss: 0.6179, test_loss: 1.2213, test_f1: 0.5936
 epoch: 73, train_loss: 0.6162, test_loss: 1.2112, test_f1: 0.6097
 epoch: 74, train_loss: 0.6174, test_loss: 1.2112, test_f1: 0.6156
 epoch: 75, train_loss: 0.6099, test_loss: 1.2585, test_f1: 0.5907
 epoch: 76, train_loss: 0.6149, test_loss: 1.1927, test_f1: 0.6007
 epoch: 77, train_loss: 0.6128, test_loss: 1.2439, test_f1: 0.5527
 epoch: 78, train_loss: 0.6271, test_loss: 1.2625, test_f1: 0.5487
 epoch: 79, train_loss: 0.6143, test_loss: 1.1980, test_f1: 0.5729
 epoch: 80, train_loss: 0.5964, test_loss: 1.1914, test_f1: 0.5946
 epoch: 81, train_loss: 0.5961, test_loss: 1.1990, test_f1: 0.5862
 epoch: 82, train_loss: 0.6017, test_loss: 1.2350, test_f1: 0.6013
 epoch: 83, train_loss: 0.5944, test_loss: 1.2000, test_f1: 0.5957
 epoch: 84, train_loss: 0.5977, test_loss: 1.1995, test_f1: 0.5530
 epoch: 85, train_loss: 0.5917, test_loss: 1.2486, test_f1: 0.5397
 epoch: 86, train_loss: 0.5913, test_loss: 1.2898, test_f1: 0.5609
 epoch: 87, train_loss: 0.5821, test_loss: 1.3168, test_f1: 0.5821
 epoch: 88, train_loss: 0.5822, test_loss: 1.3178, test_f1: 0.6083
 epoch: 89, train_loss: 0.5850, test_loss: 1.3208, test_f1: 0.5874
 epoch: 90, train_loss: 0.5760, test_loss: 1.3003, test_f1: 0.5926
 epoch: 91, train_loss: 0.6122, test_loss: 1.2498, test_f1: 0.5801
 epoch: 92, train_loss: 0.6316, test_loss: 1.2338, test_f1: 0.5746
 epoch: 93, train_loss: 0.6170, test_loss: 1.4532, test_f1: 0.5907
 epoch: 94, train_loss: 0.6121, test_loss: 1.4252, test_f1: 0.5764
 epoch: 95, train_loss: 0.6042, test_loss: 1.3363, test_f1: 0.5895
 epoch: 96, train_loss: 0.5778, test_loss: 1.3838, test_f1: 0.5988
 epoch: 97, train_loss: 0.5798, test_loss: 1.4570, test_f1: 0.5887
 epoch: 98, train_loss: 0.5771, test_loss: 1.3475, test_f1: 0.5666
 epoch: 99, train_loss: 0.5680, test_loss: 1.2933, test_f1: 0.5777
##################ITERATION #6 ****************************************
 epoch: 0, train_loss: 1.2598, test_loss: 1.4584, test_f1: 0.3051
 epoch: 1, train_loss: 1.1028, test_loss: 1.4245, test_f1: 0.3051
 epoch: 2, train_loss: 1.0677, test_loss: 1.3600, test_f1: 0.3019
 epoch: 3, train_loss: 1.0369, test_loss: 1.3157, test_f1: 0.2585
 epoch: 4, train_loss: 1.0167, test_loss: 1.2662, test_f1: 0.2631
 epoch: 5, train_loss: 0.9948, test_loss: 1.2493, test_f1: 0.3205
 epoch: 6, train_loss: 0.9836, test_loss: 1.2155, test_f1: 0.3830
 epoch: 7, train_loss: 0.9660, test_loss: 1.1567, test_f1: 0.3509
 epoch: 8, train_loss: 0.9453, test_loss: 1.1077, test_f1: 0.3900
 epoch: 9, train_loss: 0.9263, test_loss: 1.0414, test_f1: 0.4434
 epoch: 10, train_loss: 0.9293, test_loss: 1.0225, test_f1: 0.4505
 epoch: 11, train_loss: 0.9281, test_loss: 1.0101, test_f1: 0.4688
 epoch: 12, train_loss: 0.8961, test_loss: 0.9899, test_f1: 0.5347
 epoch: 13, train_loss: 0.8987, test_loss: 0.9934, test_f1: 0.5521
 epoch: 14, train_loss: 0.8928, test_loss: 1.0272, test_f1: 0.5604
 epoch: 15, train_loss: 0.8738, test_loss: 0.9931, test_f1: 0.5651
 epoch: 16, train_loss: 0.8625, test_loss: 0.9908, test_f1: 0.5566
 epoch: 17, train_loss: 0.8663, test_loss: 1.0014, test_f1: 0.5504
 epoch: 18, train_loss: 0.8548, test_loss: 1.0036, test_f1: 0.5345
 epoch: 19, train_loss: 0.8705, test_loss: 0.9731, test_f1: 0.5612
 epoch: 20, train_loss: 0.8407, test_loss: 0.9689, test_f1: 0.5716
 epoch: 21, train_loss: 0.8404, test_loss: 0.9495, test_f1: 0.5792
 epoch: 22, train_loss: 0.8199, test_loss: 0.9729, test_f1: 0.6104
 epoch: 23, train_loss: 0.8096, test_loss: 0.9656, test_f1: 0.6080
 epoch: 24, train_loss: 0.7948, test_loss: 0.9340, test_f1: 0.6235
 epoch: 25, train_loss: 0.7967, test_loss: 0.9369, test_f1: 0.6061
 epoch: 26, train_loss: 0.7878, test_loss: 0.9452, test_f1: 0.5962
 epoch: 27, train_loss: 0.7790, test_loss: 0.9372, test_f1: 0.6276
 epoch: 28, train_loss: 0.7764, test_loss: 0.9330, test_f1: 0.6426
 epoch: 29, train_loss: 0.7760, test_loss: 0.9405, test_f1: 0.6073
 epoch: 30, train_loss: 0.7862, test_loss: 0.9315, test_f1: 0.6096
 epoch: 31, train_loss: 0.7617, test_loss: 0.9233, test_f1: 0.5884
 epoch: 32, train_loss: 0.7684, test_loss: 0.9721, test_f1: 0.5957
 epoch: 33, train_loss: 0.7523, test_loss: 0.9481, test_f1: 0.5844
 epoch: 34, train_loss: 0.7491, test_loss: 1.0088, test_f1: 0.5625
 epoch: 35, train_loss: 0.7465, test_loss: 0.9593, test_f1: 0.5742
 epoch: 36, train_loss: 0.7367, test_loss: 0.9937, test_f1: 0.5693
 epoch: 37, train_loss: 0.7124, test_loss: 0.9642, test_f1: 0.6169
 epoch: 38, train_loss: 0.7276, test_loss: 1.0132, test_f1: 0.5904
 epoch: 39, train_loss: 0.7285, test_loss: 0.9649, test_f1: 0.6295
 epoch: 40, train_loss: 0.7279, test_loss: 0.9983, test_f1: 0.6187
 epoch: 41, train_loss: 0.7102, test_loss: 1.0431, test_f1: 0.6097
 epoch: 42, train_loss: 0.7323, test_loss: 0.9462, test_f1: 0.6392
 epoch: 43, train_loss: 0.7068, test_loss: 0.9401, test_f1: 0.6173
 epoch: 44, train_loss: 0.6921, test_loss: 0.9679, test_f1: 0.6234
 epoch: 45, train_loss: 0.7027, test_loss: 0.9768, test_f1: 0.5812
 epoch: 46, train_loss: 0.6840, test_loss: 0.9747, test_f1: 0.5802
 epoch: 47, train_loss: 0.6783, test_loss: 0.9985, test_f1: 0.5897
 epoch: 48, train_loss: 0.6660, test_loss: 0.9973, test_f1: 0.5695
 epoch: 49, train_loss: 0.6659, test_loss: 0.9881, test_f1: 0.5550
 epoch: 50, train_loss: 0.6809, test_loss: 0.9858, test_f1: 0.5937
 epoch: 51, train_loss: 0.6741, test_loss: 1.0252, test_f1: 0.5608
 epoch: 52, train_loss: 0.6535, test_loss: 1.0047, test_f1: 0.5779
 epoch: 53, train_loss: 0.6385, test_loss: 0.9832, test_f1: 0.6257
 epoch: 54, train_loss: 0.6300, test_loss: 0.9885, test_f1: 0.6068
 epoch: 55, train_loss: 0.6194, test_loss: 0.9973, test_f1: 0.6132
 epoch: 56, train_loss: 0.6277, test_loss: 1.0255, test_f1: 0.5909
 epoch: 57, train_loss: 0.6492, test_loss: 1.1099, test_f1: 0.5299
 epoch: 58, train_loss: 0.6560, test_loss: 1.0580, test_f1: 0.5696
 epoch: 59, train_loss: 0.6453, test_loss: 1.0240, test_f1: 0.5889
 epoch: 60, train_loss: 0.6636, test_loss: 1.0382, test_f1: 0.5749
 epoch: 61, train_loss: 0.6380, test_loss: 1.0451, test_f1: 0.5472
 epoch: 62, train_loss: 0.6328, test_loss: 1.0014, test_f1: 0.5744
 epoch: 63, train_loss: 0.6463, test_loss: 0.9904, test_f1: 0.5999
 epoch: 64, train_loss: 0.6444, test_loss: 0.9683, test_f1: 0.6132
 epoch: 65, train_loss: 0.6280, test_loss: 0.9898, test_f1: 0.6099
 epoch: 66, train_loss: 0.6285, test_loss: 1.0339, test_f1: 0.5586
 epoch: 67, train_loss: 0.6216, test_loss: 0.9986, test_f1: 0.5723
 epoch: 68, train_loss: 0.6239, test_loss: 1.0515, test_f1: 0.5430
 epoch: 69, train_loss: 0.6198, test_loss: 0.9960, test_f1: 0.5840
 epoch: 70, train_loss: 0.6223, test_loss: 1.0205, test_f1: 0.5865
 epoch: 71, train_loss: 0.6220, test_loss: 1.0775, test_f1: 0.5616
 epoch: 72, train_loss: 0.5975, test_loss: 1.0253, test_f1: 0.5883
 epoch: 73, train_loss: 0.6060, test_loss: 1.0194, test_f1: 0.5986
 epoch: 74, train_loss: 0.5905, test_loss: 1.0682, test_f1: 0.5768
 epoch: 75, train_loss: 0.5857, test_loss: 1.0635, test_f1: 0.5595
 epoch: 76, train_loss: 0.5872, test_loss: 1.0438, test_f1: 0.5709
 epoch: 77, train_loss: 0.5815, test_loss: 1.0053, test_f1: 0.6009
 epoch: 78, train_loss: 0.5875, test_loss: 1.0414, test_f1: 0.5791
 epoch: 79, train_loss: 0.5935, test_loss: 1.0946, test_f1: 0.5794
 epoch: 80, train_loss: 0.5885, test_loss: 1.0338, test_f1: 0.5898
 epoch: 81, train_loss: 0.5935, test_loss: 1.1087, test_f1: 0.5631
 epoch: 82, train_loss: 0.5879, test_loss: 1.0800, test_f1: 0.5786
 epoch: 83, train_loss: 0.5925, test_loss: 1.1157, test_f1: 0.5854
 epoch: 84, train_loss: 0.5972, test_loss: 1.1820, test_f1: 0.5941
 epoch: 85, train_loss: 0.5927, test_loss: 1.1388, test_f1: 0.5860
 epoch: 86, train_loss: 0.5894, test_loss: 1.1202, test_f1: 0.6134
 epoch: 87, train_loss: 0.5874, test_loss: 1.1462, test_f1: 0.5770
 epoch: 88, train_loss: 0.5732, test_loss: 1.0739, test_f1: 0.5861
 epoch: 89, train_loss: 0.5689, test_loss: 1.0772, test_f1: 0.5815
 epoch: 90, train_loss: 0.5852, test_loss: 1.0267, test_f1: 0.5996
 epoch: 91, train_loss: 0.5765, test_loss: 1.0598, test_f1: 0.6159
 epoch: 92, train_loss: 0.5664, test_loss: 1.1086, test_f1: 0.6158
 epoch: 93, train_loss: 0.5625, test_loss: 1.1257, test_f1: 0.5952
 epoch: 94, train_loss: 0.5580, test_loss: 1.1541, test_f1: 0.5884
 epoch: 95, train_loss: 0.5671, test_loss: 1.0716, test_f1: 0.6159
 epoch: 96, train_loss: 0.5539, test_loss: 1.0870, test_f1: 0.6041
 epoch: 97, train_loss: 0.5720, test_loss: 1.0663, test_f1: 0.6217
 epoch: 98, train_loss: 0.5638, test_loss: 1.0804, test_f1: 0.5852
 epoch: 99, train_loss: 0.5462, test_loss: 1.1696, test_f1: 0.5550
##################ITERATION #7 ****************************************
 epoch: 0, train_loss: 1.2942, test_loss: 1.3576, test_f1: 0.2281
 epoch: 1, train_loss: 1.1780, test_loss: 1.3310, test_f1: 0.2281
 epoch: 2, train_loss: 1.1330, test_loss: 1.3154, test_f1: 0.2465
 epoch: 3, train_loss: 1.1241, test_loss: 1.2962, test_f1: 0.3046
 epoch: 4, train_loss: 1.0755, test_loss: 1.2853, test_f1: 0.2495
 epoch: 5, train_loss: 1.0525, test_loss: 1.2610, test_f1: 0.2827
 epoch: 6, train_loss: 1.0421, test_loss: 1.2361, test_f1: 0.3328
 epoch: 7, train_loss: 1.0192, test_loss: 1.1768, test_f1: 0.3824
 epoch: 8, train_loss: 0.9974, test_loss: 1.1518, test_f1: 0.3895
 epoch: 9, train_loss: 0.9834, test_loss: 1.0947, test_f1: 0.4906
 epoch: 10, train_loss: 0.9796, test_loss: 1.0701, test_f1: 0.5309
 epoch: 11, train_loss: 0.9488, test_loss: 1.0421, test_f1: 0.5427
 epoch: 12, train_loss: 0.9314, test_loss: 1.0286, test_f1: 0.5656
 epoch: 13, train_loss: 0.9143, test_loss: 1.0120, test_f1: 0.5611
 epoch: 14, train_loss: 0.9018, test_loss: 1.0186, test_f1: 0.5783
 epoch: 15, train_loss: 0.8996, test_loss: 1.0408, test_f1: 0.5614
 epoch: 16, train_loss: 0.8692, test_loss: 1.0041, test_f1: 0.5913
 epoch: 17, train_loss: 0.8683, test_loss: 0.9707, test_f1: 0.5997
 epoch: 18, train_loss: 0.8568, test_loss: 0.9744, test_f1: 0.5844
 epoch: 19, train_loss: 0.8545, test_loss: 0.9870, test_f1: 0.5457
 epoch: 20, train_loss: 0.8314, test_loss: 0.9413, test_f1: 0.5631
 epoch: 21, train_loss: 0.8289, test_loss: 0.9591, test_f1: 0.5665
 epoch: 22, train_loss: 0.8282, test_loss: 0.9745, test_f1: 0.5452
 epoch: 23, train_loss: 0.7916, test_loss: 0.9503, test_f1: 0.5689
 epoch: 24, train_loss: 0.8099, test_loss: 0.9459, test_f1: 0.5610
 epoch: 25, train_loss: 0.7858, test_loss: 1.0101, test_f1: 0.5201
 epoch: 26, train_loss: 0.8056, test_loss: 1.0153, test_f1: 0.5997
 epoch: 27, train_loss: 0.7977, test_loss: 0.9723, test_f1: 0.5810
 epoch: 28, train_loss: 0.7835, test_loss: 1.1396, test_f1: 0.4625
 epoch: 29, train_loss: 0.7765, test_loss: 0.9715, test_f1: 0.5721
 epoch: 30, train_loss: 0.7678, test_loss: 0.9908, test_f1: 0.5873
 epoch: 31, train_loss: 0.7486, test_loss: 0.9748, test_f1: 0.6067
 epoch: 32, train_loss: 0.7452, test_loss: 0.9904, test_f1: 0.5831
 epoch: 33, train_loss: 0.7431, test_loss: 0.9684, test_f1: 0.5934
 epoch: 34, train_loss: 0.7629, test_loss: 0.9842, test_f1: 0.5520
 epoch: 35, train_loss: 0.7467, test_loss: 0.9484, test_f1: 0.5714
 epoch: 36, train_loss: 0.7422, test_loss: 1.0080, test_f1: 0.5672
 epoch: 37, train_loss: 0.7433, test_loss: 1.0171, test_f1: 0.5637
 epoch: 38, train_loss: 0.7256, test_loss: 1.0455, test_f1: 0.5343
 epoch: 39, train_loss: 0.7241, test_loss: 1.0252, test_f1: 0.5988
 epoch: 40, train_loss: 0.7195, test_loss: 1.0318, test_f1: 0.5563
 epoch: 41, train_loss: 0.7578, test_loss: 0.9688, test_f1: 0.6003
 epoch: 42, train_loss: 0.7330, test_loss: 1.0020, test_f1: 0.5948
 epoch: 43, train_loss: 0.7070, test_loss: 0.9831, test_f1: 0.6073
 epoch: 44, train_loss: 0.7223, test_loss: 0.9882, test_f1: 0.6077
 epoch: 45, train_loss: 0.7006, test_loss: 1.0263, test_f1: 0.5953
 epoch: 46, train_loss: 0.7024, test_loss: 1.1187, test_f1: 0.6013
 epoch: 47, train_loss: 0.7029, test_loss: 1.1184, test_f1: 0.5882
 epoch: 48, train_loss: 0.6940, test_loss: 1.0093, test_f1: 0.6066
 epoch: 49, train_loss: 0.6884, test_loss: 1.0248, test_f1: 0.5811
 epoch: 50, train_loss: 0.7041, test_loss: 1.0596, test_f1: 0.5695
 epoch: 51, train_loss: 0.6945, test_loss: 1.0210, test_f1: 0.6280
 epoch: 52, train_loss: 0.6624, test_loss: 1.0172, test_f1: 0.6173
 epoch: 53, train_loss: 0.6608, test_loss: 1.0198, test_f1: 0.6233
 epoch: 54, train_loss: 0.6697, test_loss: 1.0304, test_f1: 0.6014
 epoch: 55, train_loss: 0.6490, test_loss: 1.0546, test_f1: 0.5921
 epoch: 56, train_loss: 0.6412, test_loss: 1.0931, test_f1: 0.5815
 epoch: 57, train_loss: 0.6482, test_loss: 1.0731, test_f1: 0.6134
 epoch: 58, train_loss: 0.6441, test_loss: 1.0455, test_f1: 0.5978
 epoch: 59, train_loss: 0.6436, test_loss: 0.9999, test_f1: 0.6187
 epoch: 60, train_loss: 0.6366, test_loss: 0.9972, test_f1: 0.6027
 epoch: 61, train_loss: 0.6315, test_loss: 1.0573, test_f1: 0.5775
 epoch: 62, train_loss: 0.6299, test_loss: 1.0741, test_f1: 0.5879
 epoch: 63, train_loss: 0.6248, test_loss: 1.1085, test_f1: 0.5505
 epoch: 64, train_loss: 0.6260, test_loss: 1.0705, test_f1: 0.5529
 epoch: 65, train_loss: 0.6275, test_loss: 1.0724, test_f1: 0.5915
 epoch: 66, train_loss: 0.6250, test_loss: 1.1009, test_f1: 0.5630
 epoch: 67, train_loss: 0.6109, test_loss: 1.1054, test_f1: 0.5818
 epoch: 68, train_loss: 0.6271, test_loss: 1.1116, test_f1: 0.5976
 epoch: 69, train_loss: 0.6117, test_loss: 1.1081, test_f1: 0.5837
 epoch: 70, train_loss: 0.6103, test_loss: 1.0839, test_f1: 0.5870
 epoch: 71, train_loss: 0.6212, test_loss: 1.0889, test_f1: 0.6114
 epoch: 72, train_loss: 0.6059, test_loss: 1.1250, test_f1: 0.5776
 epoch: 73, train_loss: 0.6134, test_loss: 1.1252, test_f1: 0.5744
 epoch: 74, train_loss: 0.6130, test_loss: 1.0760, test_f1: 0.5852
 epoch: 75, train_loss: 0.6041, test_loss: 1.0875, test_f1: 0.5857
 epoch: 76, train_loss: 0.6195, test_loss: 1.1435, test_f1: 0.5701
 epoch: 77, train_loss: 0.6144, test_loss: 1.1365, test_f1: 0.5807
 epoch: 78, train_loss: 0.5890, test_loss: 1.2064, test_f1: 0.5597
 epoch: 79, train_loss: 0.6102, test_loss: 1.2135, test_f1: 0.5723
 epoch: 80, train_loss: 0.5976, test_loss: 1.1947, test_f1: 0.5977
 epoch: 81, train_loss: 0.5861, test_loss: 1.1293, test_f1: 0.5759
 epoch: 82, train_loss: 0.5874, test_loss: 1.0484, test_f1: 0.5952
 epoch: 83, train_loss: 0.6031, test_loss: 1.0392, test_f1: 0.5879
 epoch: 84, train_loss: 0.5774, test_loss: 1.0830, test_f1: 0.5680
 epoch: 85, train_loss: 0.5958, test_loss: 1.0731, test_f1: 0.6006
 epoch: 86, train_loss: 0.5834, test_loss: 1.0694, test_f1: 0.5989
 epoch: 87, train_loss: 0.5703, test_loss: 1.1003, test_f1: 0.5985
 epoch: 88, train_loss: 0.5727, test_loss: 1.0919, test_f1: 0.6130
 epoch: 89, train_loss: 0.5719, test_loss: 1.0769, test_f1: 0.5744
 epoch: 90, train_loss: 0.5867, test_loss: 1.1035, test_f1: 0.5906
 epoch: 91, train_loss: 0.5719, test_loss: 1.1319, test_f1: 0.5729
 epoch: 92, train_loss: 0.5766, test_loss: 1.1196, test_f1: 0.6053
 epoch: 93, train_loss: 0.5698, test_loss: 1.1473, test_f1: 0.5726
 epoch: 94, train_loss: 0.5738, test_loss: 1.2194, test_f1: 0.5895
 epoch: 95, train_loss: 0.5608, test_loss: 1.2372, test_f1: 0.5946
 epoch: 96, train_loss: 0.5810, test_loss: 1.2175, test_f1: 0.5851
 epoch: 97, train_loss: 0.5598, test_loss: 1.2371, test_f1: 0.5781
 epoch: 98, train_loss: 0.5645, test_loss: 1.2744, test_f1: 0.5841
 epoch: 99, train_loss: 0.5690, test_loss: 1.2090, test_f1: 0.6007
##################ITERATION #8 ****************************************
 epoch: 0, train_loss: 1.4284, test_loss: 1.4068, test_f1: 0.3441
 epoch: 1, train_loss: 1.1934, test_loss: 1.3774, test_f1: 0.3462
 epoch: 2, train_loss: 1.1374, test_loss: 1.3552, test_f1: 0.3384
 epoch: 3, train_loss: 1.1021, test_loss: 1.3546, test_f1: 0.3411
 epoch: 4, train_loss: 1.0757, test_loss: 1.3573, test_f1: 0.3365
 epoch: 5, train_loss: 1.0433, test_loss: 1.3484, test_f1: 0.2890
 epoch: 6, train_loss: 1.0243, test_loss: 1.3084, test_f1: 0.2970
 epoch: 7, train_loss: 1.0110, test_loss: 1.2495, test_f1: 0.4430
 epoch: 8, train_loss: 0.9690, test_loss: 1.1884, test_f1: 0.4989
 epoch: 9, train_loss: 0.9530, test_loss: 1.1220, test_f1: 0.5004
 epoch: 10, train_loss: 0.9438, test_loss: 1.0498, test_f1: 0.5328
 epoch: 11, train_loss: 0.9230, test_loss: 1.0238, test_f1: 0.5203
 epoch: 12, train_loss: 0.9169, test_loss: 1.0249, test_f1: 0.5321
 epoch: 13, train_loss: 0.9102, test_loss: 1.0305, test_f1: 0.5220
 epoch: 14, train_loss: 0.8949, test_loss: 1.0331, test_f1: 0.5031
 epoch: 15, train_loss: 0.8892, test_loss: 1.0177, test_f1: 0.5047
 epoch: 16, train_loss: 0.8868, test_loss: 1.0352, test_f1: 0.5377
 epoch: 17, train_loss: 0.8745, test_loss: 1.0453, test_f1: 0.5363
 epoch: 18, train_loss: 0.8435, test_loss: 1.0330, test_f1: 0.5455
 epoch: 19, train_loss: 0.8542, test_loss: 1.0362, test_f1: 0.5423
 epoch: 20, train_loss: 0.8388, test_loss: 1.0150, test_f1: 0.5414
 epoch: 21, train_loss: 0.8228, test_loss: 1.0379, test_f1: 0.5258
 epoch: 22, train_loss: 0.8059, test_loss: 1.0280, test_f1: 0.5228
 epoch: 23, train_loss: 0.8000, test_loss: 1.0424, test_f1: 0.5259
 epoch: 24, train_loss: 0.8106, test_loss: 1.0103, test_f1: 0.5482
 epoch: 25, train_loss: 0.7799, test_loss: 0.9991, test_f1: 0.5526
 epoch: 26, train_loss: 0.7906, test_loss: 1.0601, test_f1: 0.5476
 epoch: 27, train_loss: 0.7709, test_loss: 1.0655, test_f1: 0.5439
 epoch: 28, train_loss: 0.7761, test_loss: 1.0397, test_f1: 0.5582
 epoch: 29, train_loss: 0.7592, test_loss: 1.0383, test_f1: 0.5548
 epoch: 30, train_loss: 0.7596, test_loss: 1.0555, test_f1: 0.5496
 epoch: 31, train_loss: 0.7643, test_loss: 1.0619, test_f1: 0.5630
 epoch: 32, train_loss: 0.7679, test_loss: 1.1166, test_f1: 0.5749
 epoch: 33, train_loss: 0.7537, test_loss: 1.1011, test_f1: 0.5619
 epoch: 34, train_loss: 0.7435, test_loss: 1.0034, test_f1: 0.5514
 epoch: 35, train_loss: 0.7365, test_loss: 1.0429, test_f1: 0.5419
 epoch: 36, train_loss: 0.7205, test_loss: 1.0916, test_f1: 0.5463
 epoch: 37, train_loss: 0.7179, test_loss: 1.0746, test_f1: 0.5516
 epoch: 38, train_loss: 0.7002, test_loss: 1.0414, test_f1: 0.5654
 epoch: 39, train_loss: 0.7068, test_loss: 1.1232, test_f1: 0.5794
 epoch: 40, train_loss: 0.6956, test_loss: 1.1209, test_f1: 0.5422
 epoch: 41, train_loss: 0.7064, test_loss: 1.1027, test_f1: 0.5667
 epoch: 42, train_loss: 0.6948, test_loss: 1.1274, test_f1: 0.5612
 epoch: 43, train_loss: 0.6967, test_loss: 1.0963, test_f1: 0.5619
 epoch: 44, train_loss: 0.6915, test_loss: 1.0666, test_f1: 0.5610
 epoch: 45, train_loss: 0.6909, test_loss: 1.0631, test_f1: 0.5490
 epoch: 46, train_loss: 0.6848, test_loss: 1.0921, test_f1: 0.5641
 epoch: 47, train_loss: 0.6694, test_loss: 1.0509, test_f1: 0.5471
 epoch: 48, train_loss: 0.6645, test_loss: 1.0467, test_f1: 0.5696
 epoch: 49, train_loss: 0.6934, test_loss: 1.0636, test_f1: 0.5525
 epoch: 50, train_loss: 0.6673, test_loss: 1.2093, test_f1: 0.5606
 epoch: 51, train_loss: 0.6693, test_loss: 1.1730, test_f1: 0.5606
 epoch: 52, train_loss: 0.6463, test_loss: 1.0992, test_f1: 0.5693
 epoch: 53, train_loss: 0.6442, test_loss: 1.0628, test_f1: 0.5700
 epoch: 54, train_loss: 0.6522, test_loss: 1.1171, test_f1: 0.5542
 epoch: 55, train_loss: 0.6326, test_loss: 1.1649, test_f1: 0.5521
 epoch: 56, train_loss: 0.6255, test_loss: 1.1346, test_f1: 0.5651
 epoch: 57, train_loss: 0.6319, test_loss: 1.0821, test_f1: 0.5530
 epoch: 58, train_loss: 0.6223, test_loss: 1.0929, test_f1: 0.5449
 epoch: 59, train_loss: 0.6231, test_loss: 1.1010, test_f1: 0.5471
 epoch: 60, train_loss: 0.6337, test_loss: 1.1159, test_f1: 0.5308
 epoch: 61, train_loss: 0.6226, test_loss: 1.1570, test_f1: 0.5409
 epoch: 62, train_loss: 0.6202, test_loss: 1.1523, test_f1: 0.5632
 epoch: 63, train_loss: 0.6188, test_loss: 1.1577, test_f1: 0.5580
 epoch: 64, train_loss: 0.6202, test_loss: 1.1444, test_f1: 0.5570
 epoch: 65, train_loss: 0.6063, test_loss: 1.1642, test_f1: 0.5639
 epoch: 66, train_loss: 0.5952, test_loss: 1.1832, test_f1: 0.5712
 epoch: 67, train_loss: 0.5950, test_loss: 1.1839, test_f1: 0.5506
 epoch: 68, train_loss: 0.5868, test_loss: 1.1383, test_f1: 0.5762
 epoch: 69, train_loss: 0.6001, test_loss: 1.1512, test_f1: 0.5583
 epoch: 70, train_loss: 0.5973, test_loss: 1.1745, test_f1: 0.5595
 epoch: 71, train_loss: 0.5808, test_loss: 1.2216, test_f1: 0.5614
 epoch: 72, train_loss: 0.5835, test_loss: 1.1742, test_f1: 0.5642
 epoch: 73, train_loss: 0.5869, test_loss: 1.1562, test_f1: 0.5964
 epoch: 74, train_loss: 0.5693, test_loss: 1.1746, test_f1: 0.5792
 epoch: 75, train_loss: 0.5878, test_loss: 1.2141, test_f1: 0.5760
 epoch: 76, train_loss: 0.5849, test_loss: 1.2980, test_f1: 0.5422
 epoch: 77, train_loss: 0.5777, test_loss: 1.2668, test_f1: 0.5619
 epoch: 78, train_loss: 0.5789, test_loss: 1.2374, test_f1: 0.5557
 epoch: 79, train_loss: 0.5839, test_loss: 1.1326, test_f1: 0.5714
 epoch: 80, train_loss: 0.5641, test_loss: 1.1108, test_f1: 0.5670
 epoch: 81, train_loss: 0.5950, test_loss: 1.1690, test_f1: 0.5847
 epoch: 82, train_loss: 0.5889, test_loss: 1.2030, test_f1: 0.5782
 epoch: 83, train_loss: 0.6028, test_loss: 1.2205, test_f1: 0.5682
 epoch: 84, train_loss: 0.5702, test_loss: 1.3656, test_f1: 0.5471
 epoch: 85, train_loss: 0.5843, test_loss: 1.2817, test_f1: 0.5517
 epoch: 86, train_loss: 0.5708, test_loss: 1.1932, test_f1: 0.5685
 epoch: 87, train_loss: 0.5673, test_loss: 1.1751, test_f1: 0.5797
 epoch: 88, train_loss: 0.5536, test_loss: 1.2676, test_f1: 0.5595
 epoch: 89, train_loss: 0.5700, test_loss: 1.2394, test_f1: 0.5618
 epoch: 90, train_loss: 0.5471, test_loss: 1.1677, test_f1: 0.6027
 epoch: 91, train_loss: 0.5504, test_loss: 1.2769, test_f1: 0.5734
 epoch: 92, train_loss: 0.5490, test_loss: 1.3662, test_f1: 0.5661
 epoch: 93, train_loss: 0.5577, test_loss: 1.3130, test_f1: 0.5590
 epoch: 94, train_loss: 0.5617, test_loss: 1.2461, test_f1: 0.5720
 epoch: 95, train_loss: 0.5631, test_loss: 1.2778, test_f1: 0.5714
 epoch: 96, train_loss: 0.5451, test_loss: 1.1885, test_f1: 0.5889
 epoch: 97, train_loss: 0.5502, test_loss: 1.2099, test_f1: 0.5840
 epoch: 98, train_loss: 0.5397, test_loss: 1.2709, test_f1: 0.5622
 epoch: 99, train_loss: 0.5463, test_loss: 1.1858, test_f1: 0.5797
##################ITERATION #9 ****************************************
 epoch: 0, train_loss: 1.3840, test_loss: 1.5113, test_f1: 0.2847
 epoch: 1, train_loss: 1.1752, test_loss: 1.4987, test_f1: 0.2041
 epoch: 2, train_loss: 1.0992, test_loss: 1.4124, test_f1: 0.2735
 epoch: 3, train_loss: 1.0667, test_loss: 1.3501, test_f1: 0.2239
 epoch: 4, train_loss: 1.0475, test_loss: 1.4573, test_f1: 0.2624
 epoch: 5, train_loss: 0.9999, test_loss: 1.5824, test_f1: 0.1854
 epoch: 6, train_loss: 0.9752, test_loss: 1.7131, test_f1: 0.1460
 epoch: 7, train_loss: 0.9619, test_loss: 1.7130, test_f1: 0.2304
 epoch: 8, train_loss: 0.9436, test_loss: 1.7086, test_f1: 0.2371
 epoch: 9, train_loss: 0.9133, test_loss: 1.3673, test_f1: 0.3780
 epoch: 10, train_loss: 0.9154, test_loss: 1.1372, test_f1: 0.5089
 epoch: 11, train_loss: 0.9028, test_loss: 1.1878, test_f1: 0.5091
 epoch: 12, train_loss: 0.8853, test_loss: 1.0777, test_f1: 0.5558
 epoch: 13, train_loss: 0.8765, test_loss: 1.0605, test_f1: 0.5616
 epoch: 14, train_loss: 0.8653, test_loss: 1.0598, test_f1: 0.5771
 epoch: 15, train_loss: 0.8623, test_loss: 1.1960, test_f1: 0.5498
 epoch: 16, train_loss: 0.8550, test_loss: 1.0117, test_f1: 0.5990
 epoch: 17, train_loss: 0.8301, test_loss: 1.0509, test_f1: 0.5370
 epoch: 18, train_loss: 0.8578, test_loss: 1.2019, test_f1: 0.5409
 epoch: 19, train_loss: 0.8379, test_loss: 1.1145, test_f1: 0.5700
 epoch: 20, train_loss: 0.8197, test_loss: 1.0399, test_f1: 0.5987
 epoch: 21, train_loss: 0.8140, test_loss: 1.0195, test_f1: 0.5896
 epoch: 22, train_loss: 0.8006, test_loss: 0.9894, test_f1: 0.6121
 epoch: 23, train_loss: 0.7983, test_loss: 1.0040, test_f1: 0.6263
 epoch: 24, train_loss: 0.7645, test_loss: 1.0191, test_f1: 0.6048
 epoch: 25, train_loss: 0.7737, test_loss: 1.0422, test_f1: 0.6008
 epoch: 26, train_loss: 0.7754, test_loss: 1.0879, test_f1: 0.5779
 epoch: 27, train_loss: 0.7680, test_loss: 1.1188, test_f1: 0.5855
 epoch: 28, train_loss: 0.7679, test_loss: 1.0165, test_f1: 0.5875
 epoch: 29, train_loss: 0.7635, test_loss: 1.0174, test_f1: 0.6054
 epoch: 30, train_loss: 0.7368, test_loss: 0.9994, test_f1: 0.6267
 epoch: 31, train_loss: 0.7306, test_loss: 0.9794, test_f1: 0.6479
 epoch: 32, train_loss: 0.7217, test_loss: 0.9876, test_f1: 0.6240
 epoch: 33, train_loss: 0.7496, test_loss: 0.9665, test_f1: 0.6230
 epoch: 34, train_loss: 0.7258, test_loss: 0.9720, test_f1: 0.6292
 epoch: 35, train_loss: 0.7248, test_loss: 0.9609, test_f1: 0.6356
 epoch: 36, train_loss: 0.7124, test_loss: 1.0287, test_f1: 0.6093
 epoch: 37, train_loss: 0.7086, test_loss: 0.9894, test_f1: 0.6137
 epoch: 38, train_loss: 0.6946, test_loss: 1.0120, test_f1: 0.6281
 epoch: 39, train_loss: 0.7144, test_loss: 1.0336, test_f1: 0.5815
 epoch: 40, train_loss: 0.6858, test_loss: 1.1484, test_f1: 0.5799
 epoch: 41, train_loss: 0.7066, test_loss: 1.1099, test_f1: 0.5552
 epoch: 42, train_loss: 0.7103, test_loss: 1.0407, test_f1: 0.5945
 epoch: 43, train_loss: 0.7187, test_loss: 1.0944, test_f1: 0.5974
 epoch: 44, train_loss: 0.6945, test_loss: 1.0834, test_f1: 0.6189
 epoch: 45, train_loss: 0.6801, test_loss: 1.0494, test_f1: 0.6167
 epoch: 46, train_loss: 0.6784, test_loss: 1.0093, test_f1: 0.6234
 epoch: 47, train_loss: 0.6772, test_loss: 1.0143, test_f1: 0.6004
 epoch: 48, train_loss: 0.6564, test_loss: 1.0297, test_f1: 0.6169
 epoch: 49, train_loss: 0.6737, test_loss: 1.1353, test_f1: 0.6174
 epoch: 50, train_loss: 0.6753, test_loss: 1.0359, test_f1: 0.6116
 epoch: 51, train_loss: 0.6678, test_loss: 1.0737, test_f1: 0.5980
 epoch: 52, train_loss: 0.6541, test_loss: 1.1642, test_f1: 0.6195
 epoch: 53, train_loss: 0.6475, test_loss: 1.0953, test_f1: 0.6173
 epoch: 54, train_loss: 0.6348, test_loss: 1.0788, test_f1: 0.5818
 epoch: 55, train_loss: 0.6451, test_loss: 1.0817, test_f1: 0.5286
 epoch: 56, train_loss: 0.6327, test_loss: 1.0449, test_f1: 0.5801
 epoch: 57, train_loss: 0.6251, test_loss: 1.1587, test_f1: 0.5981
 epoch: 58, train_loss: 0.6282, test_loss: 1.1432, test_f1: 0.6004
 epoch: 59, train_loss: 0.6430, test_loss: 1.1284, test_f1: 0.6285
 epoch: 60, train_loss: 0.6154, test_loss: 1.1007, test_f1: 0.6392
 epoch: 61, train_loss: 0.6299, test_loss: 1.0771, test_f1: 0.5844
 epoch: 62, train_loss: 0.6162, test_loss: 1.0949, test_f1: 0.5946
 epoch: 63, train_loss: 0.6201, test_loss: 1.0843, test_f1: 0.6081
 epoch: 64, train_loss: 0.6074, test_loss: 1.0539, test_f1: 0.5820
 epoch: 65, train_loss: 0.6160, test_loss: 1.0534, test_f1: 0.5818
 epoch: 66, train_loss: 0.6189, test_loss: 1.0799, test_f1: 0.6507
 epoch: 67, train_loss: 0.6056, test_loss: 1.1304, test_f1: 0.6056
 epoch: 68, train_loss: 0.6166, test_loss: 1.0703, test_f1: 0.6329
 epoch: 69, train_loss: 0.6253, test_loss: 1.0580, test_f1: 0.6300
 epoch: 70, train_loss: 0.6098, test_loss: 1.0661, test_f1: 0.6083
 epoch: 71, train_loss: 0.6204, test_loss: 1.0706, test_f1: 0.6468
 epoch: 72, train_loss: 0.6338, test_loss: 1.0562, test_f1: 0.6385
 epoch: 73, train_loss: 0.6104, test_loss: 1.0553, test_f1: 0.6434
 epoch: 74, train_loss: 0.6093, test_loss: 1.1227, test_f1: 0.6182
 epoch: 75, train_loss: 0.6008, test_loss: 1.0747, test_f1: 0.6403
 epoch: 76, train_loss: 0.6058, test_loss: 1.0873, test_f1: 0.6230
 epoch: 77, train_loss: 0.6048, test_loss: 1.0563, test_f1: 0.6439
 epoch: 78, train_loss: 0.6176, test_loss: 1.1001, test_f1: 0.6329
 epoch: 79, train_loss: 0.5841, test_loss: 1.1105, test_f1: 0.6218
 epoch: 80, train_loss: 0.6002, test_loss: 1.1342, test_f1: 0.6139
 epoch: 81, train_loss: 0.5885, test_loss: 1.1195, test_f1: 0.6045
 epoch: 82, train_loss: 0.5860, test_loss: 1.0967, test_f1: 0.5998
 epoch: 83, train_loss: 0.5820, test_loss: 1.1224, test_f1: 0.5858
 epoch: 84, train_loss: 0.5889, test_loss: 1.1178, test_f1: 0.6306
 epoch: 85, train_loss: 0.5942, test_loss: 1.1904, test_f1: 0.6096
 epoch: 86, train_loss: 0.5946, test_loss: 1.1241, test_f1: 0.6407
 epoch: 87, train_loss: 0.6012, test_loss: 1.0674, test_f1: 0.6168
 epoch: 88, train_loss: 0.5940, test_loss: 1.1305, test_f1: 0.5672
 epoch: 89, train_loss: 0.5972, test_loss: 1.1739, test_f1: 0.6215
 epoch: 90, train_loss: 0.5844, test_loss: 1.1920, test_f1: 0.6152
 epoch: 91, train_loss: 0.5920, test_loss: 1.1195, test_f1: 0.6256
 epoch: 92, train_loss: 0.5710, test_loss: 1.1154, test_f1: 0.5867
 epoch: 93, train_loss: 0.5741, test_loss: 1.1087, test_f1: 0.6005
 epoch: 94, train_loss: 0.5689, test_loss: 1.1805, test_f1: 0.6005
 epoch: 95, train_loss: 0.5651, test_loss: 1.2578, test_f1: 0.5981
 epoch: 96, train_loss: 0.5729, test_loss: 1.1830, test_f1: 0.6132
 epoch: 97, train_loss: 0.5635, test_loss: 1.1355, test_f1: 0.6467
 epoch: 98, train_loss: 0.5628, test_loss: 1.1523, test_f1: 0.6141
 epoch: 99, train_loss: 0.5593, test_loss: 1.1156, test_f1: 0.6401

Training completed in 402.79 seconds
Best F1: 0.6516 at epoch 55
Mean F1 across iterations: 0.6251  0.0207
========================FINAL RESULTS================================
FEGIN weighted F1: 0.6516  0.0207
python main.py --data ltspice_demos --representation component_pin --model FEGIN --layers 4 --hiddens 32 --batch_size 256 --lr 0.001 --emb_size 128 --epochs 100 --save_appendix component_pin_L4_H32_BS256_LR0.001_E128 --no_val
-----



STDERR:
  File "main.py", line 370, in <module>
    main()
  File "main.py", line 254, in main
    dataset = dataset_class(
  File "/home/philip/projects/ltspice_examples_code_repo/Circuit-Completion-Using-GNNs/component_classification_with_link_prediction_head/evaluation/FEGIN/kernel/circuit_datasets.py", line 15, in __init__
    self.data, self.slices = torch.load(self.processed_paths[0])
  File "/home/philip/.local/lib/python3.8/site-packages/torch/serialization.py", line 1040, in load
    warnings.warn(
  File "/usr/lib/python3.8/warnings.py", line 109, in _showwarnmsg
    sw(msg.message, msg.category, msg.filename, msg.lineno,
  File "main.py", line 47, in warn_with_traceback
    traceback.print_stack(file=log)
/home/philip/projects/ltspice_examples_code_repo/Circuit-Completion-Using-GNNs/component_classification_with_link_prediction_head/evaluation/FEGIN/kernel/circuit_datasets.py:15: FutureWarning: You are using `torch.load` with `weights_only=False` (the current default value), which uses the default pickle module implicitly. It is possible to construct malicious pickle data which will execute arbitrary code during unpickling (See https://github.com/pytorch/pytorch/blob/main/SECURITY.md#untrusted-models for more details). In a future release, the default value for `weights_only` will be flipped to `True`. This limits the functions that could be executed during unpickling. Arbitrary objects will no longer be allowed to be loaded via this mode unless they are explicitly allowlisted by the user via `torch.serialization.add_safe_globals`. We recommend you start setting `weights_only=True` for any use case where you don't have full control of the loaded file. Please open an issue on GitHub for any issues related to this experimental feature.
  self.data, self.slices = torch.load(self.processed_paths[0])
