STDOUT:
Results will be saved in /home/philip/projects/ltspice_examples_code_repo/Circuit-Completion-Using-GNNs/component_classification_with_link_prediction_head/evaluation/FEGIN/results/model_FEGIN_dataset_ltspice_demos
Command line input: python main.py --data ltspice_demos --representation component_component --model FEGIN --layers 5 --hiddens 32 --batch_size 32 --lr 0.0001 --emb_size 512 --epochs 100 --save_appendix component_component_L5_H32_BS32_LR0.0001_E512 --no_val
 is saved.
-----
ltspice_demos - FEGIN
Using 5 layers, 32 hidden units, h = 2
Loading component_component representation dataset
ENTERED
Training FEGIN on component_component representation
Train: 1565, Test: 383
##################ITERATION #0 ****************************************
 epoch: 0, train_loss: 1.3602, test_loss: 1.3601, test_f1: 0.2281
 epoch: 1, train_loss: 1.3495, test_loss: 1.3534, test_f1: 0.2281
 epoch: 2, train_loss: 1.3409, test_loss: 1.3453, test_f1: 0.2281
 epoch: 3, train_loss: 1.3326, test_loss: 1.3402, test_f1: 0.2281
 epoch: 4, train_loss: 1.3224, test_loss: 1.3310, test_f1: 0.2281
 epoch: 5, train_loss: 1.3106, test_loss: 1.3216, test_f1: 0.2281
 epoch: 6, train_loss: 1.2999, test_loss: 1.3102, test_f1: 0.2281
 epoch: 7, train_loss: 1.2861, test_loss: 1.3030, test_f1: 0.2281
 epoch: 8, train_loss: 1.2736, test_loss: 1.2951, test_f1: 0.2281
 epoch: 9, train_loss: 1.2607, test_loss: 1.2863, test_f1: 0.2281
 epoch: 10, train_loss: 1.2465, test_loss: 1.2789, test_f1: 0.2281
 epoch: 11, train_loss: 1.2359, test_loss: 1.2712, test_f1: 0.2281
 epoch: 12, train_loss: 1.2276, test_loss: 1.2631, test_f1: 0.2281
 epoch: 13, train_loss: 1.2159, test_loss: 1.2619, test_f1: 0.2281
 epoch: 14, train_loss: 1.2065, test_loss: 1.2606, test_f1: 0.2281
 epoch: 15, train_loss: 1.2032, test_loss: 1.2550, test_f1: 0.2281
 epoch: 16, train_loss: 1.1922, test_loss: 1.2554, test_f1: 0.2337
 epoch: 17, train_loss: 1.1887, test_loss: 1.2536, test_f1: 0.2379
 epoch: 18, train_loss: 1.1846, test_loss: 1.2481, test_f1: 0.2551
 epoch: 19, train_loss: 1.1837, test_loss: 1.2434, test_f1: 0.3359
 epoch: 20, train_loss: 1.1713, test_loss: 1.2505, test_f1: 0.3447
 epoch: 21, train_loss: 1.1741, test_loss: 1.2460, test_f1: 0.3318
 epoch: 22, train_loss: 1.1756, test_loss: 1.2480, test_f1: 0.3303
 epoch: 23, train_loss: 1.1595, test_loss: 1.2470, test_f1: 0.3268
 epoch: 24, train_loss: 1.1577, test_loss: 1.2475, test_f1: 0.3349
 epoch: 25, train_loss: 1.1577, test_loss: 1.2425, test_f1: 0.3476
 epoch: 26, train_loss: 1.1618, test_loss: 1.2362, test_f1: 0.3323
 epoch: 27, train_loss: 1.1515, test_loss: 1.2358, test_f1: 0.3348
 epoch: 28, train_loss: 1.1469, test_loss: 1.2329, test_f1: 0.3354
 epoch: 29, train_loss: 1.1460, test_loss: 1.2319, test_f1: 0.2957
 epoch: 30, train_loss: 1.1403, test_loss: 1.2379, test_f1: 0.3285
 epoch: 31, train_loss: 1.1423, test_loss: 1.2253, test_f1: 0.3547
 epoch: 32, train_loss: 1.1358, test_loss: 1.2302, test_f1: 0.3385
 epoch: 33, train_loss: 1.1344, test_loss: 1.2218, test_f1: 0.3336
 epoch: 34, train_loss: 1.1279, test_loss: 1.2328, test_f1: 0.3273
 epoch: 35, train_loss: 1.1243, test_loss: 1.2213, test_f1: 0.3226
 epoch: 36, train_loss: 1.1235, test_loss: 1.2273, test_f1: 0.3299
 epoch: 37, train_loss: 1.1111, test_loss: 1.2199, test_f1: 0.3298
 epoch: 38, train_loss: 1.1221, test_loss: 1.2182, test_f1: 0.3228
 epoch: 39, train_loss: 1.1178, test_loss: 1.2221, test_f1: 0.3160
 epoch: 40, train_loss: 1.1171, test_loss: 1.2139, test_f1: 0.3284
 epoch: 41, train_loss: 1.0992, test_loss: 1.2194, test_f1: 0.3458
 epoch: 42, train_loss: 1.1112, test_loss: 1.2191, test_f1: 0.3676
 epoch: 43, train_loss: 1.1003, test_loss: 1.2114, test_f1: 0.3874
 epoch: 44, train_loss: 1.1002, test_loss: 1.2098, test_f1: 0.3888
 epoch: 45, train_loss: 1.0925, test_loss: 1.2210, test_f1: 0.3967
 epoch: 46, train_loss: 1.0988, test_loss: 1.1902, test_f1: 0.3929
 epoch: 47, train_loss: 1.0963, test_loss: 1.2038, test_f1: 0.3940
 epoch: 48, train_loss: 1.0866, test_loss: 1.2133, test_f1: 0.4257
 epoch: 49, train_loss: 1.0899, test_loss: 1.2010, test_f1: 0.4329
 epoch: 50, train_loss: 1.0727, test_loss: 1.2041, test_f1: 0.4311
 epoch: 51, train_loss: 1.0704, test_loss: 1.1970, test_f1: 0.4256
 epoch: 52, train_loss: 1.0792, test_loss: 1.1997, test_f1: 0.4317
 epoch: 53, train_loss: 1.0799, test_loss: 1.1943, test_f1: 0.4272
 epoch: 54, train_loss: 1.0680, test_loss: 1.1979, test_f1: 0.4288
 epoch: 55, train_loss: 1.0684, test_loss: 1.1932, test_f1: 0.4235
 epoch: 56, train_loss: 1.0676, test_loss: 1.1905, test_f1: 0.4290
 epoch: 57, train_loss: 1.0760, test_loss: 1.1994, test_f1: 0.4362
 epoch: 58, train_loss: 1.0643, test_loss: 1.2055, test_f1: 0.4349
 epoch: 59, train_loss: 1.0674, test_loss: 1.1936, test_f1: 0.4395
 epoch: 60, train_loss: 1.0658, test_loss: 1.2051, test_f1: 0.4333
 epoch: 61, train_loss: 1.0587, test_loss: 1.2048, test_f1: 0.4363
 epoch: 62, train_loss: 1.0572, test_loss: 1.1882, test_f1: 0.4574
 epoch: 63, train_loss: 1.0593, test_loss: 1.2110, test_f1: 0.4508
 epoch: 64, train_loss: 1.0576, test_loss: 1.1989, test_f1: 0.4556
 epoch: 65, train_loss: 1.0403, test_loss: 1.2025, test_f1: 0.4659
 epoch: 66, train_loss: 1.0616, test_loss: 1.1929, test_f1: 0.4676
 epoch: 67, train_loss: 1.0504, test_loss: 1.1971, test_f1: 0.4576
 epoch: 68, train_loss: 1.0470, test_loss: 1.1931, test_f1: 0.4820
 epoch: 69, train_loss: 1.0502, test_loss: 1.1966, test_f1: 0.4888
 epoch: 70, train_loss: 1.0416, test_loss: 1.1917, test_f1: 0.4761
 epoch: 71, train_loss: 1.0371, test_loss: 1.2019, test_f1: 0.4807
 epoch: 72, train_loss: 1.0544, test_loss: 1.2014, test_f1: 0.4901
 epoch: 73, train_loss: 1.0423, test_loss: 1.2075, test_f1: 0.4903
 epoch: 74, train_loss: 1.0462, test_loss: 1.1959, test_f1: 0.5014
 epoch: 75, train_loss: 1.0341, test_loss: 1.2099, test_f1: 0.4995
 epoch: 76, train_loss: 1.0318, test_loss: 1.2018, test_f1: 0.5015
 epoch: 77, train_loss: 1.0308, test_loss: 1.2089, test_f1: 0.4970
 epoch: 78, train_loss: 1.0354, test_loss: 1.2046, test_f1: 0.5033
 epoch: 79, train_loss: 1.0269, test_loss: 1.1905, test_f1: 0.4964
 epoch: 80, train_loss: 1.0297, test_loss: 1.1958, test_f1: 0.5007
 epoch: 81, train_loss: 1.0355, test_loss: 1.2053, test_f1: 0.5172
 epoch: 82, train_loss: 1.0228, test_loss: 1.2021, test_f1: 0.5247
 epoch: 83, train_loss: 1.0392, test_loss: 1.2069, test_f1: 0.5268
 epoch: 84, train_loss: 1.0246, test_loss: 1.2100, test_f1: 0.5310
 epoch: 85, train_loss: 1.0263, test_loss: 1.2192, test_f1: 0.5142
 epoch: 86, train_loss: 1.0242, test_loss: 1.1961, test_f1: 0.5329
 epoch: 87, train_loss: 1.0363, test_loss: 1.2128, test_f1: 0.5312
 epoch: 88, train_loss: 1.0071, test_loss: 1.2058, test_f1: 0.5257
 epoch: 89, train_loss: 1.0198, test_loss: 1.2228, test_f1: 0.5364
 epoch: 90, train_loss: 1.0035, test_loss: 1.2121, test_f1: 0.5497
 epoch: 91, train_loss: 1.0077, test_loss: 1.2067, test_f1: 0.5500
 epoch: 92, train_loss: 1.0122, test_loss: 1.2066, test_f1: 0.5394
 epoch: 93, train_loss: 0.9991, test_loss: 1.2069, test_f1: 0.5425
 epoch: 94, train_loss: 1.0095, test_loss: 1.2181, test_f1: 0.5555
 epoch: 95, train_loss: 1.0057, test_loss: 1.1890, test_f1: 0.5591
 epoch: 96, train_loss: 1.0071, test_loss: 1.1950, test_f1: 0.5518
 epoch: 97, train_loss: 1.0070, test_loss: 1.2055, test_f1: 0.5490
 epoch: 98, train_loss: 1.0054, test_loss: 1.2007, test_f1: 0.5541
 epoch: 99, train_loss: 1.0009, test_loss: 1.1919, test_f1: 0.5658
##################ITERATION #1 ****************************************
 epoch: 0, train_loss: 1.3204, test_loss: 1.3800, test_f1: 0.2281
 epoch: 1, train_loss: 1.2949, test_loss: 1.4076, test_f1: 0.2281
 epoch: 2, train_loss: 1.2794, test_loss: 1.3691, test_f1: 0.2281
 epoch: 3, train_loss: 1.2612, test_loss: 1.3580, test_f1: 0.2281
 epoch: 4, train_loss: 1.2492, test_loss: 1.3685, test_f1: 0.2281
 epoch: 5, train_loss: 1.2334, test_loss: 1.3637, test_f1: 0.2281
 epoch: 6, train_loss: 1.2252, test_loss: 1.3199, test_f1: 0.2281
 epoch: 7, train_loss: 1.2190, test_loss: 1.3059, test_f1: 0.2281
 epoch: 8, train_loss: 1.2124, test_loss: 1.3326, test_f1: 0.2281
 epoch: 9, train_loss: 1.2085, test_loss: 1.2995, test_f1: 0.2281
 epoch: 10, train_loss: 1.2027, test_loss: 1.3034, test_f1: 0.2281
 epoch: 11, train_loss: 1.1970, test_loss: 1.2896, test_f1: 0.2281
 epoch: 12, train_loss: 1.1843, test_loss: 1.2978, test_f1: 0.2325
 epoch: 13, train_loss: 1.1827, test_loss: 1.2903, test_f1: 0.2579
 epoch: 14, train_loss: 1.1819, test_loss: 1.2911, test_f1: 0.2410
 epoch: 15, train_loss: 1.1830, test_loss: 1.3077, test_f1: 0.2574
 epoch: 16, train_loss: 1.1786, test_loss: 1.2897, test_f1: 0.2325
 epoch: 17, train_loss: 1.1784, test_loss: 1.2695, test_f1: 0.2325
 epoch: 18, train_loss: 1.1715, test_loss: 1.2816, test_f1: 0.2325
 epoch: 19, train_loss: 1.1731, test_loss: 1.2637, test_f1: 0.2325
 epoch: 20, train_loss: 1.1589, test_loss: 1.3256, test_f1: 0.2563
 epoch: 21, train_loss: 1.1513, test_loss: 1.2746, test_f1: 0.2413
 epoch: 22, train_loss: 1.1626, test_loss: 1.2853, test_f1: 0.2774
 epoch: 23, train_loss: 1.1483, test_loss: 1.2848, test_f1: 0.2667
 epoch: 24, train_loss: 1.1503, test_loss: 1.2967, test_f1: 0.2844
 epoch: 25, train_loss: 1.1419, test_loss: 1.2675, test_f1: 0.2775
 epoch: 26, train_loss: 1.1531, test_loss: 1.2842, test_f1: 0.3134
 epoch: 27, train_loss: 1.1328, test_loss: 1.2705, test_f1: 0.2962
 epoch: 28, train_loss: 1.1324, test_loss: 1.2823, test_f1: 0.2991
 epoch: 29, train_loss: 1.1363, test_loss: 1.2780, test_f1: 0.3067
 epoch: 30, train_loss: 1.1321, test_loss: 1.2712, test_f1: 0.3118
 epoch: 31, train_loss: 1.1254, test_loss: 1.2581, test_f1: 0.3205
 epoch: 32, train_loss: 1.1231, test_loss: 1.2668, test_f1: 0.3188
 epoch: 33, train_loss: 1.1196, test_loss: 1.2636, test_f1: 0.3452
 epoch: 34, train_loss: 1.1249, test_loss: 1.2556, test_f1: 0.3213
 epoch: 35, train_loss: 1.1089, test_loss: 1.2315, test_f1: 0.3366
 epoch: 36, train_loss: 1.1070, test_loss: 1.2367, test_f1: 0.3234
 epoch: 37, train_loss: 1.1008, test_loss: 1.2328, test_f1: 0.3657
 epoch: 38, train_loss: 1.0924, test_loss: 1.2297, test_f1: 0.3630
 epoch: 39, train_loss: 1.0925, test_loss: 1.2133, test_f1: 0.3645
 epoch: 40, train_loss: 1.0984, test_loss: 1.2451, test_f1: 0.3457
 epoch: 41, train_loss: 1.0845, test_loss: 1.2291, test_f1: 0.3864
 epoch: 42, train_loss: 1.0848, test_loss: 1.2276, test_f1: 0.3712
 epoch: 43, train_loss: 1.0803, test_loss: 1.2430, test_f1: 0.3869
 epoch: 44, train_loss: 1.0770, test_loss: 1.2587, test_f1: 0.3915
 epoch: 45, train_loss: 1.0691, test_loss: 1.2267, test_f1: 0.4005
 epoch: 46, train_loss: 1.0646, test_loss: 1.2374, test_f1: 0.4005
 epoch: 47, train_loss: 1.0815, test_loss: 1.2441, test_f1: 0.3751
 epoch: 48, train_loss: 1.0629, test_loss: 1.2401, test_f1: 0.3932
 epoch: 49, train_loss: 1.0534, test_loss: 1.2401, test_f1: 0.4430
 epoch: 50, train_loss: 1.0495, test_loss: 1.2855, test_f1: 0.4307
 epoch: 51, train_loss: 1.0362, test_loss: 1.2461, test_f1: 0.4129
 epoch: 52, train_loss: 1.0417, test_loss: 1.2333, test_f1: 0.4435
 epoch: 53, train_loss: 1.0537, test_loss: 1.2353, test_f1: 0.4102
 epoch: 54, train_loss: 1.0541, test_loss: 1.2350, test_f1: 0.3964
 epoch: 55, train_loss: 1.0482, test_loss: 1.2324, test_f1: 0.4121
 epoch: 56, train_loss: 1.0449, test_loss: 1.2243, test_f1: 0.4125
 epoch: 57, train_loss: 1.0400, test_loss: 1.2228, test_f1: 0.4084
 epoch: 58, train_loss: 1.0411, test_loss: 1.2125, test_f1: 0.4494
 epoch: 59, train_loss: 1.0405, test_loss: 1.2876, test_f1: 0.4230
 epoch: 60, train_loss: 1.0359, test_loss: 1.2527, test_f1: 0.3844
 epoch: 61, train_loss: 1.0386, test_loss: 1.2089, test_f1: 0.4006
 epoch: 62, train_loss: 1.0252, test_loss: 1.2531, test_f1: 0.4113
 epoch: 63, train_loss: 1.0240, test_loss: 1.2319, test_f1: 0.4550
 epoch: 64, train_loss: 1.0363, test_loss: 1.3346, test_f1: 0.4334
 epoch: 65, train_loss: 1.0326, test_loss: 1.2313, test_f1: 0.4193
 epoch: 66, train_loss: 1.0154, test_loss: 1.2847, test_f1: 0.4052
 epoch: 67, train_loss: 1.0357, test_loss: 1.2209, test_f1: 0.4432
 epoch: 68, train_loss: 1.0290, test_loss: 1.2415, test_f1: 0.4104
 epoch: 69, train_loss: 1.0087, test_loss: 1.2162, test_f1: 0.3998
 epoch: 70, train_loss: 1.0204, test_loss: 1.2933, test_f1: 0.4028
 epoch: 71, train_loss: 1.0105, test_loss: 1.2887, test_f1: 0.4065
 epoch: 72, train_loss: 1.0139, test_loss: 1.2360, test_f1: 0.4534
 epoch: 73, train_loss: 1.0116, test_loss: 1.2588, test_f1: 0.4663
 epoch: 74, train_loss: 1.0122, test_loss: 1.2594, test_f1: 0.4608
 epoch: 75, train_loss: 1.0273, test_loss: 1.2313, test_f1: 0.4749
 epoch: 76, train_loss: 1.0124, test_loss: 1.2362, test_f1: 0.4682
 epoch: 77, train_loss: 1.0143, test_loss: 1.2297, test_f1: 0.4596
 epoch: 78, train_loss: 1.0065, test_loss: 1.3570, test_f1: 0.4525
 epoch: 79, train_loss: 0.9971, test_loss: 1.2776, test_f1: 0.4692
 epoch: 80, train_loss: 0.9992, test_loss: 1.2890, test_f1: 0.4692
 epoch: 81, train_loss: 1.0066, test_loss: 1.2798, test_f1: 0.4672
 epoch: 82, train_loss: 0.9919, test_loss: 1.2402, test_f1: 0.4573
 epoch: 83, train_loss: 0.9996, test_loss: 1.2488, test_f1: 0.4862
 epoch: 84, train_loss: 1.0016, test_loss: 1.1942, test_f1: 0.4800
 epoch: 85, train_loss: 0.9967, test_loss: 1.2396, test_f1: 0.4668
 epoch: 86, train_loss: 1.0040, test_loss: 1.2193, test_f1: 0.4998
 epoch: 87, train_loss: 0.9952, test_loss: 1.2847, test_f1: 0.4774
 epoch: 88, train_loss: 0.9936, test_loss: 1.2242, test_f1: 0.4601
 epoch: 89, train_loss: 0.9936, test_loss: 1.2316, test_f1: 0.4746
 epoch: 90, train_loss: 0.9913, test_loss: 1.2177, test_f1: 0.5028
 epoch: 91, train_loss: 0.9965, test_loss: 1.2595, test_f1: 0.4761
 epoch: 92, train_loss: 0.9892, test_loss: 1.1982, test_f1: 0.4815
 epoch: 93, train_loss: 0.9802, test_loss: 1.2645, test_f1: 0.4870
 epoch: 94, train_loss: 0.9884, test_loss: 1.2003, test_f1: 0.4800
 epoch: 95, train_loss: 0.9744, test_loss: 1.3001, test_f1: 0.4815
 epoch: 96, train_loss: 0.9769, test_loss: 1.2539, test_f1: 0.4598
 epoch: 97, train_loss: 0.9753, test_loss: 1.3256, test_f1: 0.4650
 epoch: 98, train_loss: 0.9863, test_loss: 1.2949, test_f1: 0.5165
 epoch: 99, train_loss: 0.9850, test_loss: 1.3276, test_f1: 0.5097
##################ITERATION #2 ****************************************
 epoch: 0, train_loss: 1.2904, test_loss: 1.3214, test_f1: 0.2253
 epoch: 1, train_loss: 1.2713, test_loss: 1.4135, test_f1: 0.2404
 epoch: 2, train_loss: 1.2575, test_loss: 1.4443, test_f1: 0.2404
 epoch: 3, train_loss: 1.2499, test_loss: 1.4268, test_f1: 0.2407
 epoch: 4, train_loss: 1.2366, test_loss: 1.3992, test_f1: 0.2404
 epoch: 5, train_loss: 1.2331, test_loss: 1.3937, test_f1: 0.2407
 epoch: 6, train_loss: 1.2225, test_loss: 1.4446, test_f1: 0.2404
 epoch: 7, train_loss: 1.2203, test_loss: 1.5004, test_f1: 0.2407
 epoch: 8, train_loss: 1.2165, test_loss: 1.4096, test_f1: 0.2407
 epoch: 9, train_loss: 1.2093, test_loss: 1.4516, test_f1: 0.2456
 epoch: 10, train_loss: 1.2097, test_loss: 1.4583, test_f1: 0.2456
 epoch: 11, train_loss: 1.2020, test_loss: 1.3907, test_f1: 0.2456
 epoch: 12, train_loss: 1.2013, test_loss: 1.3968, test_f1: 0.2450
 epoch: 13, train_loss: 1.1941, test_loss: 1.4356, test_f1: 0.2454
 epoch: 14, train_loss: 1.1844, test_loss: 1.3956, test_f1: 0.2656
 epoch: 15, train_loss: 1.1839, test_loss: 1.3778, test_f1: 0.2752
 epoch: 16, train_loss: 1.1789, test_loss: 1.3763, test_f1: 0.3064
 epoch: 17, train_loss: 1.1702, test_loss: 1.3872, test_f1: 0.3242
 epoch: 18, train_loss: 1.1787, test_loss: 1.3346, test_f1: 0.3189
 epoch: 19, train_loss: 1.1622, test_loss: 1.3721, test_f1: 0.3233
 epoch: 20, train_loss: 1.1622, test_loss: 1.3547, test_f1: 0.3579
 epoch: 21, train_loss: 1.1518, test_loss: 1.3464, test_f1: 0.3440
 epoch: 22, train_loss: 1.1522, test_loss: 1.3534, test_f1: 0.3623
 epoch: 23, train_loss: 1.1475, test_loss: 1.3384, test_f1: 0.3772
 epoch: 24, train_loss: 1.1500, test_loss: 1.3955, test_f1: 0.3894
 epoch: 25, train_loss: 1.1426, test_loss: 1.3155, test_f1: 0.3744
 epoch: 26, train_loss: 1.1382, test_loss: 1.3135, test_f1: 0.3701
 epoch: 27, train_loss: 1.1366, test_loss: 1.3306, test_f1: 0.3952
 epoch: 28, train_loss: 1.1259, test_loss: 1.2646, test_f1: 0.4199
 epoch: 29, train_loss: 1.1189, test_loss: 1.3211, test_f1: 0.4133
 epoch: 30, train_loss: 1.1179, test_loss: 1.3084, test_f1: 0.4125
 epoch: 31, train_loss: 1.1058, test_loss: 1.3378, test_f1: 0.4171
 epoch: 32, train_loss: 1.1112, test_loss: 1.2962, test_f1: 0.4230
 epoch: 33, train_loss: 1.1016, test_loss: 1.3145, test_f1: 0.4357
 epoch: 34, train_loss: 1.1073, test_loss: 1.2705, test_f1: 0.4414
 epoch: 35, train_loss: 1.0915, test_loss: 1.2240, test_f1: 0.4314
 epoch: 36, train_loss: 1.0844, test_loss: 1.2852, test_f1: 0.4422
 epoch: 37, train_loss: 1.0841, test_loss: 1.3019, test_f1: 0.4424
 epoch: 38, train_loss: 1.0809, test_loss: 1.3155, test_f1: 0.4603
 epoch: 39, train_loss: 1.0767, test_loss: 1.2869, test_f1: 0.4298
 epoch: 40, train_loss: 1.0683, test_loss: 1.2256, test_f1: 0.4547
 epoch: 41, train_loss: 1.0794, test_loss: 1.2013, test_f1: 0.4494
 epoch: 42, train_loss: 1.0525, test_loss: 1.2110, test_f1: 0.4448
 epoch: 43, train_loss: 1.0541, test_loss: 1.2567, test_f1: 0.4439
 epoch: 44, train_loss: 1.0526, test_loss: 1.2151, test_f1: 0.4421
 epoch: 45, train_loss: 1.0587, test_loss: 1.2478, test_f1: 0.4534
 epoch: 46, train_loss: 1.0428, test_loss: 1.2289, test_f1: 0.4606
 epoch: 47, train_loss: 1.0552, test_loss: 1.2301, test_f1: 0.4724
 epoch: 48, train_loss: 1.0369, test_loss: 1.2452, test_f1: 0.4760
 epoch: 49, train_loss: 1.0370, test_loss: 1.3878, test_f1: 0.4894
 epoch: 50, train_loss: 1.0295, test_loss: 1.3130, test_f1: 0.4835
 epoch: 51, train_loss: 1.0294, test_loss: 1.2980, test_f1: 0.5127
 epoch: 52, train_loss: 1.0192, test_loss: 1.2659, test_f1: 0.5007
 epoch: 53, train_loss: 1.0193, test_loss: 1.2483, test_f1: 0.5147
 epoch: 54, train_loss: 1.0427, test_loss: 1.2746, test_f1: 0.4909
 epoch: 55, train_loss: 1.0177, test_loss: 1.2313, test_f1: 0.4987
 epoch: 56, train_loss: 1.0222, test_loss: 1.2788, test_f1: 0.5064
 epoch: 57, train_loss: 1.0085, test_loss: 1.2811, test_f1: 0.5059
 epoch: 58, train_loss: 1.0185, test_loss: 1.3040, test_f1: 0.5233
 epoch: 59, train_loss: 1.0211, test_loss: 1.2658, test_f1: 0.5140
 epoch: 60, train_loss: 1.0161, test_loss: 1.3449, test_f1: 0.5417
 epoch: 61, train_loss: 1.0078, test_loss: 1.2618, test_f1: 0.5305
 epoch: 62, train_loss: 1.0124, test_loss: 1.3038, test_f1: 0.5232
 epoch: 63, train_loss: 1.0045, test_loss: 1.2889, test_f1: 0.5251
 epoch: 64, train_loss: 1.0073, test_loss: 1.3062, test_f1: 0.5356
 epoch: 65, train_loss: 1.0081, test_loss: 1.3080, test_f1: 0.5468
 epoch: 66, train_loss: 0.9949, test_loss: 1.3218, test_f1: 0.5333
 epoch: 67, train_loss: 0.9957, test_loss: 1.2741, test_f1: 0.5376
 epoch: 68, train_loss: 1.0024, test_loss: 1.3398, test_f1: 0.5355
 epoch: 69, train_loss: 0.9874, test_loss: 1.2798, test_f1: 0.5397
 epoch: 70, train_loss: 0.9983, test_loss: 1.3617, test_f1: 0.5461
 epoch: 71, train_loss: 0.9966, test_loss: 1.3130, test_f1: 0.5346
 epoch: 72, train_loss: 0.9983, test_loss: 1.4080, test_f1: 0.5482
 epoch: 73, train_loss: 0.9919, test_loss: 1.3505, test_f1: 0.5272
 epoch: 74, train_loss: 1.0106, test_loss: 1.2372, test_f1: 0.5472
 epoch: 75, train_loss: 1.0068, test_loss: 1.3428, test_f1: 0.5443
 epoch: 76, train_loss: 0.9813, test_loss: 1.3624, test_f1: 0.5564
 epoch: 77, train_loss: 0.9881, test_loss: 1.2229, test_f1: 0.5615
 epoch: 78, train_loss: 0.9762, test_loss: 1.2734, test_f1: 0.5669
 epoch: 79, train_loss: 0.9962, test_loss: 1.3460, test_f1: 0.5656
 epoch: 80, train_loss: 0.9899, test_loss: 1.2775, test_f1: 0.5581
 epoch: 81, train_loss: 0.9859, test_loss: 1.2961, test_f1: 0.5688
 epoch: 82, train_loss: 0.9817, test_loss: 1.2938, test_f1: 0.5687
 epoch: 83, train_loss: 0.9739, test_loss: 1.2540, test_f1: 0.5644
 epoch: 84, train_loss: 0.9777, test_loss: 1.2758, test_f1: 0.5640
 epoch: 85, train_loss: 0.9679, test_loss: 1.3148, test_f1: 0.5523
 epoch: 86, train_loss: 0.9576, test_loss: 1.3451, test_f1: 0.5607
 epoch: 87, train_loss: 0.9665, test_loss: 1.3515, test_f1: 0.5565
 epoch: 88, train_loss: 0.9781, test_loss: 1.3437, test_f1: 0.5590
 epoch: 89, train_loss: 0.9545, test_loss: 1.3790, test_f1: 0.5861
 epoch: 90, train_loss: 0.9698, test_loss: 1.4075, test_f1: 0.5646
 epoch: 91, train_loss: 0.9546, test_loss: 1.3389, test_f1: 0.5637
 epoch: 92, train_loss: 0.9543, test_loss: 1.4604, test_f1: 0.5711
 epoch: 93, train_loss: 0.9605, test_loss: 1.4413, test_f1: 0.5643
 epoch: 94, train_loss: 0.9588, test_loss: 1.3507, test_f1: 0.5570
 epoch: 95, train_loss: 0.9474, test_loss: 1.3341, test_f1: 0.5605
 epoch: 96, train_loss: 0.9586, test_loss: 1.4177, test_f1: 0.5576
 epoch: 97, train_loss: 0.9673, test_loss: 1.3926, test_f1: 0.5532
 epoch: 98, train_loss: 0.9452, test_loss: 1.3096, test_f1: 0.5500
 epoch: 99, train_loss: 0.9606, test_loss: 1.3342, test_f1: 0.5628
##################ITERATION #3 ****************************************
 epoch: 0, train_loss: 1.2806, test_loss: 1.3074, test_f1: 0.2446
 epoch: 1, train_loss: 1.2552, test_loss: 1.3036, test_f1: 0.2270
 epoch: 2, train_loss: 1.2462, test_loss: 1.2964, test_f1: 0.2259
 epoch: 3, train_loss: 1.2305, test_loss: 1.2894, test_f1: 0.2587
 epoch: 4, train_loss: 1.2291, test_loss: 1.2829, test_f1: 0.2571
 epoch: 5, train_loss: 1.2178, test_loss: 1.2728, test_f1: 0.2587
 epoch: 6, train_loss: 1.2146, test_loss: 1.2673, test_f1: 0.2642
 epoch: 7, train_loss: 1.2040, test_loss: 1.2614, test_f1: 0.2642
 epoch: 8, train_loss: 1.2074, test_loss: 1.2613, test_f1: 0.2601
 epoch: 9, train_loss: 1.1915, test_loss: 1.2588, test_f1: 0.2617
 epoch: 10, train_loss: 1.1913, test_loss: 1.2485, test_f1: 0.2658
 epoch: 11, train_loss: 1.1778, test_loss: 1.2445, test_f1: 0.2720
 epoch: 12, train_loss: 1.1791, test_loss: 1.2509, test_f1: 0.3000
 epoch: 13, train_loss: 1.1687, test_loss: 1.2454, test_f1: 0.3208
 epoch: 14, train_loss: 1.1693, test_loss: 1.2448, test_f1: 0.3217
 epoch: 15, train_loss: 1.1717, test_loss: 1.2419, test_f1: 0.3320
 epoch: 16, train_loss: 1.1452, test_loss: 1.2386, test_f1: 0.3399
 epoch: 17, train_loss: 1.1512, test_loss: 1.2389, test_f1: 0.3568
 epoch: 18, train_loss: 1.1462, test_loss: 1.2369, test_f1: 0.3741
 epoch: 19, train_loss: 1.1430, test_loss: 1.2399, test_f1: 0.3640
 epoch: 20, train_loss: 1.1329, test_loss: 1.2285, test_f1: 0.3795
 epoch: 21, train_loss: 1.1318, test_loss: 1.2166, test_f1: 0.3808
 epoch: 22, train_loss: 1.1329, test_loss: 1.2250, test_f1: 0.3688
 epoch: 23, train_loss: 1.1206, test_loss: 1.2258, test_f1: 0.3985
 epoch: 24, train_loss: 1.1145, test_loss: 1.2176, test_f1: 0.3968
 epoch: 25, train_loss: 1.1104, test_loss: 1.2082, test_f1: 0.3970
 epoch: 26, train_loss: 1.1067, test_loss: 1.2178, test_f1: 0.4232
 epoch: 27, train_loss: 1.1008, test_loss: 1.2040, test_f1: 0.4220
 epoch: 28, train_loss: 1.1070, test_loss: 1.2036, test_f1: 0.4127
 epoch: 29, train_loss: 1.1056, test_loss: 1.1999, test_f1: 0.4082
 epoch: 30, train_loss: 1.0950, test_loss: 1.2034, test_f1: 0.4193
 epoch: 31, train_loss: 1.0916, test_loss: 1.2138, test_f1: 0.4209
 epoch: 32, train_loss: 1.1004, test_loss: 1.2107, test_f1: 0.4241
 epoch: 33, train_loss: 1.0854, test_loss: 1.2244, test_f1: 0.4309
 epoch: 34, train_loss: 1.0844, test_loss: 1.2066, test_f1: 0.4235
 epoch: 35, train_loss: 1.0788, test_loss: 1.2123, test_f1: 0.4289
 epoch: 36, train_loss: 1.0735, test_loss: 1.1998, test_f1: 0.4425
 epoch: 37, train_loss: 1.0673, test_loss: 1.1938, test_f1: 0.4402
 epoch: 38, train_loss: 1.0597, test_loss: 1.2076, test_f1: 0.4549
 epoch: 39, train_loss: 1.0624, test_loss: 1.2076, test_f1: 0.4828
 epoch: 40, train_loss: 1.0754, test_loss: 1.2013, test_f1: 0.4803
 epoch: 41, train_loss: 1.0506, test_loss: 1.2010, test_f1: 0.4841
 epoch: 42, train_loss: 1.0561, test_loss: 1.1904, test_f1: 0.5108
 epoch: 43, train_loss: 1.0465, test_loss: 1.1838, test_f1: 0.4950
 epoch: 44, train_loss: 1.0423, test_loss: 1.1820, test_f1: 0.4945
 epoch: 45, train_loss: 1.0346, test_loss: 1.1782, test_f1: 0.5021
 epoch: 46, train_loss: 1.0308, test_loss: 1.1898, test_f1: 0.5111
 epoch: 47, train_loss: 1.0401, test_loss: 1.1856, test_f1: 0.5245
 epoch: 48, train_loss: 1.0339, test_loss: 1.1850, test_f1: 0.5372
 epoch: 49, train_loss: 1.0315, test_loss: 1.1806, test_f1: 0.5075
 epoch: 50, train_loss: 1.0344, test_loss: 1.1717, test_f1: 0.5356
 epoch: 51, train_loss: 1.0300, test_loss: 1.1797, test_f1: 0.5444
 epoch: 52, train_loss: 1.0179, test_loss: 1.1862, test_f1: 0.5041
 epoch: 53, train_loss: 1.0087, test_loss: 1.1722, test_f1: 0.5274
 epoch: 54, train_loss: 1.0208, test_loss: 1.1745, test_f1: 0.5470
 epoch: 55, train_loss: 1.0257, test_loss: 1.1753, test_f1: 0.5213
 epoch: 56, train_loss: 1.0181, test_loss: 1.1754, test_f1: 0.5344
 epoch: 57, train_loss: 1.0284, test_loss: 1.1677, test_f1: 0.5028
 epoch: 58, train_loss: 1.0200, test_loss: 1.1744, test_f1: 0.5048
 epoch: 59, train_loss: 0.9996, test_loss: 1.1747, test_f1: 0.5026
 epoch: 60, train_loss: 1.0247, test_loss: 1.1763, test_f1: 0.5160
 epoch: 61, train_loss: 1.0110, test_loss: 1.1779, test_f1: 0.5042
 epoch: 62, train_loss: 1.0041, test_loss: 1.1736, test_f1: 0.4976
 epoch: 63, train_loss: 1.0193, test_loss: 1.1837, test_f1: 0.4940
 epoch: 64, train_loss: 1.0112, test_loss: 1.1698, test_f1: 0.5055
 epoch: 65, train_loss: 1.0078, test_loss: 1.1723, test_f1: 0.5244
 epoch: 66, train_loss: 0.9952, test_loss: 1.1714, test_f1: 0.5461
 epoch: 67, train_loss: 0.9976, test_loss: 1.1754, test_f1: 0.5260
 epoch: 68, train_loss: 1.0078, test_loss: 1.1739, test_f1: 0.5462
 epoch: 69, train_loss: 1.0049, test_loss: 1.1738, test_f1: 0.5593
 epoch: 70, train_loss: 0.9919, test_loss: 1.1769, test_f1: 0.5151
 epoch: 71, train_loss: 1.0071, test_loss: 1.1698, test_f1: 0.5446
 epoch: 72, train_loss: 1.0071, test_loss: 1.1748, test_f1: 0.5197
 epoch: 73, train_loss: 1.0001, test_loss: 1.1840, test_f1: 0.5257
 epoch: 74, train_loss: 1.0006, test_loss: 1.1738, test_f1: 0.5210
 epoch: 75, train_loss: 0.9754, test_loss: 1.1755, test_f1: 0.5384
 epoch: 76, train_loss: 0.9841, test_loss: 1.1653, test_f1: 0.5588
 epoch: 77, train_loss: 0.9765, test_loss: 1.1699, test_f1: 0.5416
 epoch: 78, train_loss: 0.9935, test_loss: 1.1763, test_f1: 0.5448
 epoch: 79, train_loss: 0.9815, test_loss: 1.1664, test_f1: 0.5354
 epoch: 80, train_loss: 0.9728, test_loss: 1.1771, test_f1: 0.5362
 epoch: 81, train_loss: 0.9888, test_loss: 1.1804, test_f1: 0.5420
 epoch: 82, train_loss: 0.9875, test_loss: 1.1652, test_f1: 0.5388
 epoch: 83, train_loss: 0.9760, test_loss: 1.1653, test_f1: 0.5567
 epoch: 84, train_loss: 1.0017, test_loss: 1.1808, test_f1: 0.5307
 epoch: 85, train_loss: 0.9914, test_loss: 1.1715, test_f1: 0.5623
 epoch: 86, train_loss: 0.9790, test_loss: 1.1729, test_f1: 0.5526
 epoch: 87, train_loss: 0.9659, test_loss: 1.1730, test_f1: 0.5697
 epoch: 88, train_loss: 0.9759, test_loss: 1.1679, test_f1: 0.5562
 epoch: 89, train_loss: 0.9579, test_loss: 1.1779, test_f1: 0.5551
 epoch: 90, train_loss: 0.9771, test_loss: 1.1729, test_f1: 0.5672
 epoch: 91, train_loss: 0.9751, test_loss: 1.1798, test_f1: 0.5651
 epoch: 92, train_loss: 0.9727, test_loss: 1.1782, test_f1: 0.5727
 epoch: 93, train_loss: 0.9695, test_loss: 1.1751, test_f1: 0.5696
 epoch: 94, train_loss: 0.9676, test_loss: 1.1789, test_f1: 0.5746
 epoch: 95, train_loss: 0.9644, test_loss: 1.1788, test_f1: 0.5752
 epoch: 96, train_loss: 0.9704, test_loss: 1.1828, test_f1: 0.5713
 epoch: 97, train_loss: 0.9742, test_loss: 1.1733, test_f1: 0.5813
 epoch: 98, train_loss: 0.9639, test_loss: 1.1774, test_f1: 0.5701
 epoch: 99, train_loss: 0.9703, test_loss: 1.1821, test_f1: 0.5724
##################ITERATION #4 ****************************************
 epoch: 0, train_loss: 1.2859, test_loss: 1.3364, test_f1: 0.2281
 epoch: 1, train_loss: 1.2625, test_loss: 1.4898, test_f1: 0.2557
 epoch: 2, train_loss: 1.2431, test_loss: 1.3682, test_f1: 0.2654
 epoch: 3, train_loss: 1.2269, test_loss: 1.3760, test_f1: 0.2613
 epoch: 4, train_loss: 1.2277, test_loss: 1.4824, test_f1: 0.2626
 epoch: 5, train_loss: 1.2241, test_loss: 1.4517, test_f1: 0.2659
 epoch: 6, train_loss: 1.2134, test_loss: 1.3463, test_f1: 0.2651
 epoch: 7, train_loss: 1.2093, test_loss: 1.5951, test_f1: 0.2768
 epoch: 8, train_loss: 1.2071, test_loss: 1.3574, test_f1: 0.2670
 epoch: 9, train_loss: 1.1957, test_loss: 1.3942, test_f1: 0.2793
 epoch: 10, train_loss: 1.1898, test_loss: 1.4412, test_f1: 0.3107
 epoch: 11, train_loss: 1.1875, test_loss: 1.6301, test_f1: 0.3446
 epoch: 12, train_loss: 1.1766, test_loss: 1.4779, test_f1: 0.3495
 epoch: 13, train_loss: 1.1739, test_loss: 1.4387, test_f1: 0.3638
 epoch: 14, train_loss: 1.1730, test_loss: 1.4312, test_f1: 0.3826
 epoch: 15, train_loss: 1.1516, test_loss: 1.4155, test_f1: 0.3950
 epoch: 16, train_loss: 1.1619, test_loss: 1.3898, test_f1: 0.3893
 epoch: 17, train_loss: 1.1458, test_loss: 1.3114, test_f1: 0.4170
 epoch: 18, train_loss: 1.1419, test_loss: 1.3408, test_f1: 0.4291
 epoch: 19, train_loss: 1.1432, test_loss: 1.3829, test_f1: 0.4160
 epoch: 20, train_loss: 1.1455, test_loss: 1.2963, test_f1: 0.3952
 epoch: 21, train_loss: 1.1247, test_loss: 1.2902, test_f1: 0.4178
 epoch: 22, train_loss: 1.1178, test_loss: 1.3305, test_f1: 0.4257
 epoch: 23, train_loss: 1.1204, test_loss: 1.6201, test_f1: 0.4226
 epoch: 24, train_loss: 1.1118, test_loss: 1.4045, test_f1: 0.4281
 epoch: 25, train_loss: 1.1041, test_loss: 1.2917, test_f1: 0.4247
 epoch: 26, train_loss: 1.0859, test_loss: 1.2901, test_f1: 0.3940
 epoch: 27, train_loss: 1.0950, test_loss: 1.2773, test_f1: 0.4347
 epoch: 28, train_loss: 1.0884, test_loss: 1.3837, test_f1: 0.4294
 epoch: 29, train_loss: 1.0773, test_loss: 1.2666, test_f1: 0.4253
 epoch: 30, train_loss: 1.0866, test_loss: 1.2540, test_f1: 0.4405
 epoch: 31, train_loss: 1.0731, test_loss: 1.2993, test_f1: 0.4350
 epoch: 32, train_loss: 1.0537, test_loss: 1.2460, test_f1: 0.4403
 epoch: 33, train_loss: 1.0756, test_loss: 1.2579, test_f1: 0.4311
 epoch: 34, train_loss: 1.0604, test_loss: 1.2158, test_f1: 0.4602
 epoch: 35, train_loss: 1.0646, test_loss: 1.2769, test_f1: 0.4669
 epoch: 36, train_loss: 1.0446, test_loss: 1.2838, test_f1: 0.4685
 epoch: 37, train_loss: 1.0423, test_loss: 1.2611, test_f1: 0.4817
 epoch: 38, train_loss: 1.0451, test_loss: 1.2591, test_f1: 0.5040
 epoch: 39, train_loss: 1.0231, test_loss: 1.2588, test_f1: 0.4947
 epoch: 40, train_loss: 1.0409, test_loss: 1.3644, test_f1: 0.4967
 epoch: 41, train_loss: 1.0347, test_loss: 1.2324, test_f1: 0.5099
 epoch: 42, train_loss: 1.0301, test_loss: 1.2973, test_f1: 0.4987
 epoch: 43, train_loss: 1.0261, test_loss: 1.2894, test_f1: 0.5184
 epoch: 44, train_loss: 1.0231, test_loss: 1.2412, test_f1: 0.5357
 epoch: 45, train_loss: 1.0227, test_loss: 1.2337, test_f1: 0.5243
 epoch: 46, train_loss: 1.0159, test_loss: 1.2191, test_f1: 0.5111
 epoch: 47, train_loss: 1.0016, test_loss: 1.2543, test_f1: 0.5110
 epoch: 48, train_loss: 1.0151, test_loss: 1.3076, test_f1: 0.5037
 epoch: 49, train_loss: 1.0124, test_loss: 1.4717, test_f1: 0.4985
 epoch: 50, train_loss: 1.0060, test_loss: 1.3194, test_f1: 0.5005
 epoch: 51, train_loss: 1.0057, test_loss: 1.3330, test_f1: 0.4975
 epoch: 52, train_loss: 0.9891, test_loss: 1.2718, test_f1: 0.4904
 epoch: 53, train_loss: 0.9956, test_loss: 1.3330, test_f1: 0.5019
 epoch: 54, train_loss: 0.9966, test_loss: 1.3183, test_f1: 0.5057
 epoch: 55, train_loss: 0.9925, test_loss: 1.3761, test_f1: 0.5071
 epoch: 56, train_loss: 0.9803, test_loss: 1.4849, test_f1: 0.4909
 epoch: 57, train_loss: 0.9864, test_loss: 1.5311, test_f1: 0.5257
 epoch: 58, train_loss: 0.9876, test_loss: 1.2488, test_f1: 0.5139
 epoch: 59, train_loss: 0.9978, test_loss: 1.6039, test_f1: 0.5183
 epoch: 60, train_loss: 0.9703, test_loss: 1.4669, test_f1: 0.5178
 epoch: 61, train_loss: 0.9870, test_loss: 1.5438, test_f1: 0.5263
 epoch: 62, train_loss: 0.9753, test_loss: 1.6454, test_f1: 0.5150
 epoch: 63, train_loss: 0.9747, test_loss: 1.5144, test_f1: 0.5025
 epoch: 64, train_loss: 0.9751, test_loss: 1.4864, test_f1: 0.5320
 epoch: 65, train_loss: 0.9711, test_loss: 1.5217, test_f1: 0.5037
 epoch: 66, train_loss: 0.9890, test_loss: 1.3386, test_f1: 0.5204
 epoch: 67, train_loss: 0.9741, test_loss: 1.4193, test_f1: 0.5334
 epoch: 68, train_loss: 0.9605, test_loss: 1.5212, test_f1: 0.5201
 epoch: 69, train_loss: 0.9737, test_loss: 1.3831, test_f1: 0.5047
 epoch: 70, train_loss: 0.9685, test_loss: 1.4020, test_f1: 0.5314
 epoch: 71, train_loss: 0.9688, test_loss: 1.4540, test_f1: 0.5108
 epoch: 72, train_loss: 0.9606, test_loss: 1.2582, test_f1: 0.5337
 epoch: 73, train_loss: 0.9676, test_loss: 1.5538, test_f1: 0.5187
 epoch: 74, train_loss: 0.9619, test_loss: 1.3279, test_f1: 0.5213
 epoch: 75, train_loss: 0.9502, test_loss: 1.3526, test_f1: 0.5266
 epoch: 76, train_loss: 0.9686, test_loss: 1.4402, test_f1: 0.5265
 epoch: 77, train_loss: 0.9663, test_loss: 1.5206, test_f1: 0.5078
 epoch: 78, train_loss: 0.9485, test_loss: 1.5782, test_f1: 0.5404
 epoch: 79, train_loss: 0.9579, test_loss: 1.5040, test_f1: 0.5296
 epoch: 80, train_loss: 0.9430, test_loss: 1.7045, test_f1: 0.5304
 epoch: 81, train_loss: 0.9408, test_loss: 1.8478, test_f1: 0.5241
 epoch: 82, train_loss: 0.9501, test_loss: 1.7067, test_f1: 0.5142
 epoch: 83, train_loss: 0.9470, test_loss: 1.5927, test_f1: 0.5354
 epoch: 84, train_loss: 0.9518, test_loss: 1.6348, test_f1: 0.5318
 epoch: 85, train_loss: 0.9490, test_loss: 1.5709, test_f1: 0.5422
 epoch: 86, train_loss: 0.9486, test_loss: 1.9343, test_f1: 0.5380
 epoch: 87, train_loss: 0.9420, test_loss: 1.8267, test_f1: 0.5391
 epoch: 88, train_loss: 0.9439, test_loss: 1.8043, test_f1: 0.5308
 epoch: 89, train_loss: 0.9329, test_loss: 1.4581, test_f1: 0.4908
 epoch: 90, train_loss: 0.9468, test_loss: 1.4767, test_f1: 0.5606
 epoch: 91, train_loss: 0.9486, test_loss: 1.7451, test_f1: 0.5285
 epoch: 92, train_loss: 0.9264, test_loss: 1.6535, test_f1: 0.5516
 epoch: 93, train_loss: 0.9511, test_loss: 1.5874, test_f1: 0.5246
 epoch: 94, train_loss: 0.9276, test_loss: 1.6725, test_f1: 0.5353
 epoch: 95, train_loss: 0.9334, test_loss: 1.6542, test_f1: 0.5207
 epoch: 96, train_loss: 0.9380, test_loss: 1.7222, test_f1: 0.5125
 epoch: 97, train_loss: 0.9184, test_loss: 1.5789, test_f1: 0.5036
 epoch: 98, train_loss: 0.9396, test_loss: 1.6220, test_f1: 0.5267
 epoch: 99, train_loss: 0.9333, test_loss: 1.7216, test_f1: 0.5189
##################ITERATION #5 ****************************************
 epoch: 0, train_loss: 1.2770, test_loss: 1.3557, test_f1: 0.2357
 epoch: 1, train_loss: 1.2545, test_loss: 1.3815, test_f1: 0.3051
 epoch: 2, train_loss: 1.2419, test_loss: 1.5058, test_f1: 0.3425
 epoch: 3, train_loss: 1.2252, test_loss: 1.4519, test_f1: 0.3368
 epoch: 4, train_loss: 1.2202, test_loss: 1.4059, test_f1: 0.3509
 epoch: 5, train_loss: 1.2039, test_loss: 1.4159, test_f1: 0.3965
 epoch: 6, train_loss: 1.1962, test_loss: 1.3684, test_f1: 0.4124
 epoch: 7, train_loss: 1.1869, test_loss: 1.3835, test_f1: 0.4284
 epoch: 8, train_loss: 1.1904, test_loss: 1.3591, test_f1: 0.4233
 epoch: 9, train_loss: 1.1719, test_loss: 1.3500, test_f1: 0.4124
 epoch: 10, train_loss: 1.1636, test_loss: 1.3478, test_f1: 0.4203
 epoch: 11, train_loss: 1.1590, test_loss: 1.3336, test_f1: 0.4350
 epoch: 12, train_loss: 1.1507, test_loss: 1.3620, test_f1: 0.4474
 epoch: 13, train_loss: 1.1362, test_loss: 1.3913, test_f1: 0.4318
 epoch: 14, train_loss: 1.1362, test_loss: 1.3474, test_f1: 0.4320
 epoch: 15, train_loss: 1.1227, test_loss: 1.4156, test_f1: 0.4443
 epoch: 16, train_loss: 1.1363, test_loss: 1.3094, test_f1: 0.4342
 epoch: 17, train_loss: 1.1207, test_loss: 1.3503, test_f1: 0.4383
 epoch: 18, train_loss: 1.1296, test_loss: 1.4347, test_f1: 0.4371
 epoch: 19, train_loss: 1.1120, test_loss: 1.3001, test_f1: 0.4318
 epoch: 20, train_loss: 1.1104, test_loss: 1.2938, test_f1: 0.4571
 epoch: 21, train_loss: 1.1218, test_loss: 1.3441, test_f1: 0.4337
 epoch: 22, train_loss: 1.0993, test_loss: 1.3339, test_f1: 0.4447
 epoch: 23, train_loss: 1.0929, test_loss: 1.3477, test_f1: 0.4356
 epoch: 24, train_loss: 1.0935, test_loss: 1.3325, test_f1: 0.4318
 epoch: 25, train_loss: 1.0899, test_loss: 1.3196, test_f1: 0.4552
 epoch: 26, train_loss: 1.0842, test_loss: 1.2906, test_f1: 0.4515
 epoch: 27, train_loss: 1.0775, test_loss: 1.3083, test_f1: 0.4735
 epoch: 28, train_loss: 1.0630, test_loss: 1.3171, test_f1: 0.4748
 epoch: 29, train_loss: 1.0751, test_loss: 1.3986, test_f1: 0.4412
 epoch: 30, train_loss: 1.0620, test_loss: 1.8361, test_f1: 0.4520
 epoch: 31, train_loss: 1.0644, test_loss: 1.3696, test_f1: 0.4648
 epoch: 32, train_loss: 1.0621, test_loss: 1.3496, test_f1: 0.4735
 epoch: 33, train_loss: 1.0618, test_loss: 1.3253, test_f1: 0.4543
 epoch: 34, train_loss: 1.0584, test_loss: 1.3598, test_f1: 0.4770
 epoch: 35, train_loss: 1.0453, test_loss: 1.5502, test_f1: 0.4585
 epoch: 36, train_loss: 1.0528, test_loss: 1.3397, test_f1: 0.4844
 epoch: 37, train_loss: 1.0532, test_loss: 1.5706, test_f1: 0.4717
 epoch: 38, train_loss: 1.0363, test_loss: 1.6311, test_f1: 0.4798
 epoch: 39, train_loss: 1.0514, test_loss: 1.3478, test_f1: 0.4571
 epoch: 40, train_loss: 1.0339, test_loss: 1.4846, test_f1: 0.4576
 epoch: 41, train_loss: 1.0539, test_loss: 1.6115, test_f1: 0.4689
 epoch: 42, train_loss: 1.0381, test_loss: 1.5174, test_f1: 0.4896
 epoch: 43, train_loss: 1.0433, test_loss: 1.5271, test_f1: 0.4827
 epoch: 44, train_loss: 1.0223, test_loss: 1.4973, test_f1: 0.4754
 epoch: 45, train_loss: 1.0243, test_loss: 1.4451, test_f1: 0.5116
 epoch: 46, train_loss: 1.0047, test_loss: 1.3747, test_f1: 0.4886
 epoch: 47, train_loss: 1.0176, test_loss: 1.4331, test_f1: 0.4984
 epoch: 48, train_loss: 1.0258, test_loss: 1.4196, test_f1: 0.4902
 epoch: 49, train_loss: 1.0147, test_loss: 1.5199, test_f1: 0.5230
 epoch: 50, train_loss: 0.9967, test_loss: 1.4083, test_f1: 0.5033
 epoch: 51, train_loss: 1.0147, test_loss: 1.3490, test_f1: 0.5119
 epoch: 52, train_loss: 0.9958, test_loss: 1.4584, test_f1: 0.5108
 epoch: 53, train_loss: 1.0042, test_loss: 1.4508, test_f1: 0.5100
 epoch: 54, train_loss: 0.9904, test_loss: 1.3207, test_f1: 0.5067
 epoch: 55, train_loss: 1.0117, test_loss: 1.3472, test_f1: 0.5267
 epoch: 56, train_loss: 0.9908, test_loss: 1.4286, test_f1: 0.5202
 epoch: 57, train_loss: 1.0030, test_loss: 1.5043, test_f1: 0.5237
 epoch: 58, train_loss: 0.9911, test_loss: 1.3046, test_f1: 0.5214
 epoch: 59, train_loss: 0.9974, test_loss: 1.3706, test_f1: 0.5302
 epoch: 60, train_loss: 0.9839, test_loss: 1.3041, test_f1: 0.5121
 epoch: 61, train_loss: 0.9810, test_loss: 1.3315, test_f1: 0.5294
 epoch: 62, train_loss: 0.9922, test_loss: 1.3502, test_f1: 0.5129
 epoch: 63, train_loss: 0.9925, test_loss: 1.4198, test_f1: 0.5154
 epoch: 64, train_loss: 0.9889, test_loss: 1.3433, test_f1: 0.5127
 epoch: 65, train_loss: 0.9785, test_loss: 1.3440, test_f1: 0.5401
 epoch: 66, train_loss: 0.9963, test_loss: 1.3084, test_f1: 0.5236
 epoch: 67, train_loss: 0.9796, test_loss: 1.3296, test_f1: 0.5129
 epoch: 68, train_loss: 0.9830, test_loss: 1.3104, test_f1: 0.5384
 epoch: 69, train_loss: 0.9794, test_loss: 1.3864, test_f1: 0.5193
 epoch: 70, train_loss: 0.9845, test_loss: 1.5340, test_f1: 0.5261
 epoch: 71, train_loss: 0.9771, test_loss: 1.3676, test_f1: 0.5288
 epoch: 72, train_loss: 0.9813, test_loss: 1.3529, test_f1: 0.5426
 epoch: 73, train_loss: 0.9710, test_loss: 1.4944, test_f1: 0.5195
 epoch: 74, train_loss: 0.9893, test_loss: 1.6322, test_f1: 0.5214
 epoch: 75, train_loss: 0.9763, test_loss: 1.3093, test_f1: 0.5296
 epoch: 76, train_loss: 0.9713, test_loss: 1.3160, test_f1: 0.5366
 epoch: 77, train_loss: 0.9630, test_loss: 1.3225, test_f1: 0.5154
 epoch: 78, train_loss: 0.9692, test_loss: 1.3865, test_f1: 0.5165
 epoch: 79, train_loss: 0.9529, test_loss: 1.4884, test_f1: 0.5338
 epoch: 80, train_loss: 0.9624, test_loss: 1.3427, test_f1: 0.5482
 epoch: 81, train_loss: 0.9637, test_loss: 1.2886, test_f1: 0.5400
 epoch: 82, train_loss: 0.9657, test_loss: 1.3818, test_f1: 0.5452
 epoch: 83, train_loss: 0.9578, test_loss: 1.4347, test_f1: 0.5394
 epoch: 84, train_loss: 0.9669, test_loss: 1.4051, test_f1: 0.5283
 epoch: 85, train_loss: 0.9682, test_loss: 1.4098, test_f1: 0.5459
 epoch: 86, train_loss: 0.9595, test_loss: 1.3475, test_f1: 0.5591
 epoch: 87, train_loss: 0.9655, test_loss: 1.3199, test_f1: 0.5503
 epoch: 88, train_loss: 0.9418, test_loss: 1.3983, test_f1: 0.5425
 epoch: 89, train_loss: 0.9490, test_loss: 1.3012, test_f1: 0.5754
 epoch: 90, train_loss: 0.9610, test_loss: 1.3530, test_f1: 0.5518
 epoch: 91, train_loss: 0.9382, test_loss: 1.3266, test_f1: 0.5585
 epoch: 92, train_loss: 0.9576, test_loss: 1.4075, test_f1: 0.5599
 epoch: 93, train_loss: 0.9478, test_loss: 1.4959, test_f1: 0.5779
 epoch: 94, train_loss: 0.9580, test_loss: 1.3862, test_f1: 0.5608
 epoch: 95, train_loss: 0.9630, test_loss: 1.3030, test_f1: 0.5949
 epoch: 96, train_loss: 0.9463, test_loss: 1.5094, test_f1: 0.5726
 epoch: 97, train_loss: 0.9584, test_loss: 1.2935, test_f1: 0.5847
 epoch: 98, train_loss: 0.9315, test_loss: 1.5267, test_f1: 0.5641
 epoch: 99, train_loss: 0.9623, test_loss: 1.3021, test_f1: 0.5706
##################ITERATION #6 ****************************************
 epoch: 0, train_loss: 1.3000, test_loss: 1.3318, test_f1: 0.2906
 epoch: 1, train_loss: 1.2696, test_loss: 1.3406, test_f1: 0.2919
 epoch: 2, train_loss: 1.2504, test_loss: 1.3296, test_f1: 0.3044
 epoch: 3, train_loss: 1.2439, test_loss: 1.3255, test_f1: 0.3172
 epoch: 4, train_loss: 1.2384, test_loss: 1.3407, test_f1: 0.2799
 epoch: 5, train_loss: 1.2318, test_loss: 1.3571, test_f1: 0.2997
 epoch: 6, train_loss: 1.2197, test_loss: 1.3649, test_f1: 0.2894
 epoch: 7, train_loss: 1.2048, test_loss: 1.3394, test_f1: 0.2836
 epoch: 8, train_loss: 1.1969, test_loss: 1.3539, test_f1: 0.3114
 epoch: 9, train_loss: 1.2029, test_loss: 1.3348, test_f1: 0.3048
 epoch: 10, train_loss: 1.1921, test_loss: 1.3232, test_f1: 0.2792
 epoch: 11, train_loss: 1.1913, test_loss: 1.3126, test_f1: 0.2941
 epoch: 12, train_loss: 1.1849, test_loss: 1.3047, test_f1: 0.3111
 epoch: 13, train_loss: 1.1807, test_loss: 1.3489, test_f1: 0.3249
 epoch: 14, train_loss: 1.1791, test_loss: 1.3131, test_f1: 0.3172
 epoch: 15, train_loss: 1.1747, test_loss: 1.3016, test_f1: 0.3359
 epoch: 16, train_loss: 1.1657, test_loss: 1.2856, test_f1: 0.3162
 epoch: 17, train_loss: 1.1493, test_loss: 1.2983, test_f1: 0.3325
 epoch: 18, train_loss: 1.1501, test_loss: 1.2544, test_f1: 0.3291
 epoch: 19, train_loss: 1.1453, test_loss: 1.2557, test_f1: 0.3664
 epoch: 20, train_loss: 1.1345, test_loss: 1.2427, test_f1: 0.3770
 epoch: 21, train_loss: 1.1390, test_loss: 1.2614, test_f1: 0.3776
 epoch: 22, train_loss: 1.1309, test_loss: 1.2651, test_f1: 0.3780
 epoch: 23, train_loss: 1.1299, test_loss: 1.2420, test_f1: 0.3888
 epoch: 24, train_loss: 1.1117, test_loss: 1.2461, test_f1: 0.3760
 epoch: 25, train_loss: 1.1132, test_loss: 1.2469, test_f1: 0.3747
 epoch: 26, train_loss: 1.1104, test_loss: 1.2613, test_f1: 0.3916
 epoch: 27, train_loss: 1.1073, test_loss: 1.2612, test_f1: 0.3929
 epoch: 28, train_loss: 1.1075, test_loss: 1.2621, test_f1: 0.3910
 epoch: 29, train_loss: 1.0886, test_loss: 1.2403, test_f1: 0.3978
 epoch: 30, train_loss: 1.0936, test_loss: 1.2532, test_f1: 0.4257
 epoch: 31, train_loss: 1.0998, test_loss: 1.2350, test_f1: 0.4108
 epoch: 32, train_loss: 1.0813, test_loss: 1.2094, test_f1: 0.3894
 epoch: 33, train_loss: 1.0932, test_loss: 1.2431, test_f1: 0.4229
 epoch: 34, train_loss: 1.1001, test_loss: 1.2328, test_f1: 0.3913
 epoch: 35, train_loss: 1.0772, test_loss: 1.2363, test_f1: 0.4215
 epoch: 36, train_loss: 1.1025, test_loss: 1.2219, test_f1: 0.4022
 epoch: 37, train_loss: 1.0717, test_loss: 1.2326, test_f1: 0.4156
 epoch: 38, train_loss: 1.0782, test_loss: 1.2336, test_f1: 0.4206
 epoch: 39, train_loss: 1.0540, test_loss: 1.2363, test_f1: 0.4248
 epoch: 40, train_loss: 1.0632, test_loss: 1.2398, test_f1: 0.4104
 epoch: 41, train_loss: 1.0673, test_loss: 1.2168, test_f1: 0.4053
 epoch: 42, train_loss: 1.0713, test_loss: 1.2274, test_f1: 0.4049
 epoch: 43, train_loss: 1.0507, test_loss: 1.2079, test_f1: 0.4118
 epoch: 44, train_loss: 1.0496, test_loss: 1.2225, test_f1: 0.4419
 epoch: 45, train_loss: 1.0567, test_loss: 1.2135, test_f1: 0.4106
 epoch: 46, train_loss: 1.0372, test_loss: 1.2416, test_f1: 0.4032
 epoch: 47, train_loss: 1.0538, test_loss: 1.2474, test_f1: 0.4046
 epoch: 48, train_loss: 1.0445, test_loss: 1.2386, test_f1: 0.4227
 epoch: 49, train_loss: 1.0261, test_loss: 1.2204, test_f1: 0.4323
 epoch: 50, train_loss: 1.0315, test_loss: 1.2196, test_f1: 0.4161
 epoch: 51, train_loss: 1.0362, test_loss: 1.2169, test_f1: 0.4378
 epoch: 52, train_loss: 1.0329, test_loss: 1.2142, test_f1: 0.4105
 epoch: 53, train_loss: 1.0374, test_loss: 1.2500, test_f1: 0.4338
 epoch: 54, train_loss: 1.0253, test_loss: 1.2583, test_f1: 0.4346
 epoch: 55, train_loss: 1.0286, test_loss: 1.2444, test_f1: 0.4594
 epoch: 56, train_loss: 1.0317, test_loss: 1.2347, test_f1: 0.4529
 epoch: 57, train_loss: 1.0359, test_loss: 1.2334, test_f1: 0.4594
 epoch: 58, train_loss: 1.0331, test_loss: 1.2565, test_f1: 0.4462
 epoch: 59, train_loss: 1.0207, test_loss: 1.2191, test_f1: 0.4419
 epoch: 60, train_loss: 1.0241, test_loss: 1.2397, test_f1: 0.4521
 epoch: 61, train_loss: 1.0191, test_loss: 1.2235, test_f1: 0.4549
 epoch: 62, train_loss: 1.0170, test_loss: 1.2279, test_f1: 0.4674
 epoch: 63, train_loss: 1.0268, test_loss: 1.2368, test_f1: 0.4555
 epoch: 64, train_loss: 1.0241, test_loss: 1.2240, test_f1: 0.4520
 epoch: 65, train_loss: 1.0101, test_loss: 1.2498, test_f1: 0.4655
 epoch: 66, train_loss: 1.0120, test_loss: 1.2197, test_f1: 0.4523
 epoch: 67, train_loss: 1.0189, test_loss: 1.1912, test_f1: 0.4544
 epoch: 68, train_loss: 1.0214, test_loss: 1.2202, test_f1: 0.4470
 epoch: 69, train_loss: 1.0078, test_loss: 1.2317, test_f1: 0.4578
 epoch: 70, train_loss: 1.0108, test_loss: 1.2156, test_f1: 0.4557
 epoch: 71, train_loss: 0.9906, test_loss: 1.2642, test_f1: 0.4528
 epoch: 72, train_loss: 1.0268, test_loss: 1.2178, test_f1: 0.4499
 epoch: 73, train_loss: 0.9966, test_loss: 1.2271, test_f1: 0.4650
 epoch: 74, train_loss: 1.0078, test_loss: 1.2442, test_f1: 0.4681
 epoch: 75, train_loss: 1.0011, test_loss: 1.2578, test_f1: 0.4645
 epoch: 76, train_loss: 1.0138, test_loss: 1.2364, test_f1: 0.4651
 epoch: 77, train_loss: 0.9944, test_loss: 1.2107, test_f1: 0.4685
 epoch: 78, train_loss: 1.0077, test_loss: 1.2410, test_f1: 0.4489
 epoch: 79, train_loss: 0.9989, test_loss: 1.2477, test_f1: 0.4519
 epoch: 80, train_loss: 0.9866, test_loss: 1.2653, test_f1: 0.4663
 epoch: 81, train_loss: 0.9937, test_loss: 1.2378, test_f1: 0.4749
 epoch: 82, train_loss: 0.9974, test_loss: 1.2087, test_f1: 0.4549
 epoch: 83, train_loss: 0.9913, test_loss: 1.2728, test_f1: 0.4747
 epoch: 84, train_loss: 0.9977, test_loss: 1.2182, test_f1: 0.4866
 epoch: 85, train_loss: 0.9839, test_loss: 1.2135, test_f1: 0.4754
 epoch: 86, train_loss: 0.9957, test_loss: 1.2277, test_f1: 0.4784
 epoch: 87, train_loss: 0.9815, test_loss: 1.2334, test_f1: 0.4617
 epoch: 88, train_loss: 0.9672, test_loss: 1.2424, test_f1: 0.5151
 epoch: 89, train_loss: 0.9931, test_loss: 1.2482, test_f1: 0.4815
 epoch: 90, train_loss: 1.0009, test_loss: 1.2654, test_f1: 0.4689
 epoch: 91, train_loss: 0.9990, test_loss: 1.2314, test_f1: 0.4790
 epoch: 92, train_loss: 0.9853, test_loss: 1.2526, test_f1: 0.4849
 epoch: 93, train_loss: 0.9923, test_loss: 1.2360, test_f1: 0.5002
 epoch: 94, train_loss: 0.9736, test_loss: 1.2320, test_f1: 0.4889
 epoch: 95, train_loss: 0.9740, test_loss: 1.2553, test_f1: 0.5087
 epoch: 96, train_loss: 0.9662, test_loss: 1.2671, test_f1: 0.4908
 epoch: 97, train_loss: 0.9738, test_loss: 1.2222, test_f1: 0.4928
 epoch: 98, train_loss: 0.9726, test_loss: 1.2149, test_f1: 0.4811
 epoch: 99, train_loss: 0.9680, test_loss: 1.2551, test_f1: 0.4844
##################ITERATION #7 ****************************************
 epoch: 0, train_loss: 1.2952, test_loss: 1.3180, test_f1: 0.2281
 epoch: 1, train_loss: 1.2577, test_loss: 1.2902, test_f1: 0.2718
 epoch: 2, train_loss: 1.2548, test_loss: 1.3345, test_f1: 0.2777
 epoch: 3, train_loss: 1.2539, test_loss: 1.3000, test_f1: 0.2758
 epoch: 4, train_loss: 1.2404, test_loss: 1.3342, test_f1: 0.3120
 epoch: 5, train_loss: 1.2327, test_loss: 1.3278, test_f1: 0.2954
 epoch: 6, train_loss: 1.2215, test_loss: 1.2845, test_f1: 0.3090
 epoch: 7, train_loss: 1.2131, test_loss: 1.2808, test_f1: 0.3025
 epoch: 8, train_loss: 1.2197, test_loss: 1.2750, test_f1: 0.3062
 epoch: 9, train_loss: 1.2128, test_loss: 1.2702, test_f1: 0.3159
 epoch: 10, train_loss: 1.2047, test_loss: 1.2633, test_f1: 0.3358
 epoch: 11, train_loss: 1.2008, test_loss: 1.2796, test_f1: 0.3205
 epoch: 12, train_loss: 1.1966, test_loss: 1.2812, test_f1: 0.3243
 epoch: 13, train_loss: 1.1939, test_loss: 1.2663, test_f1: 0.3582
 epoch: 14, train_loss: 1.1899, test_loss: 1.2814, test_f1: 0.3567
 epoch: 15, train_loss: 1.1806, test_loss: 1.3102, test_f1: 0.3488
 epoch: 16, train_loss: 1.1904, test_loss: 1.2590, test_f1: 0.3572
 epoch: 17, train_loss: 1.1744, test_loss: 1.2605, test_f1: 0.3714
 epoch: 18, train_loss: 1.1765, test_loss: 1.2688, test_f1: 0.3806
 epoch: 19, train_loss: 1.1716, test_loss: 1.3036, test_f1: 0.3606
 epoch: 20, train_loss: 1.1580, test_loss: 1.3206, test_f1: 0.3625
 epoch: 21, train_loss: 1.1632, test_loss: 1.2633, test_f1: 0.3850
 epoch: 22, train_loss: 1.1616, test_loss: 1.2538, test_f1: 0.3970
 epoch: 23, train_loss: 1.1669, test_loss: 1.2672, test_f1: 0.3543
 epoch: 24, train_loss: 1.1689, test_loss: 1.2364, test_f1: 0.4048
 epoch: 25, train_loss: 1.1461, test_loss: 1.3221, test_f1: 0.3843
 epoch: 26, train_loss: 1.1647, test_loss: 1.2555, test_f1: 0.3807
 epoch: 27, train_loss: 1.1618, test_loss: 1.2522, test_f1: 0.3655
 epoch: 28, train_loss: 1.1401, test_loss: 1.2385, test_f1: 0.3676
 epoch: 29, train_loss: 1.1393, test_loss: 1.2490, test_f1: 0.3790
 epoch: 30, train_loss: 1.1335, test_loss: 1.2638, test_f1: 0.3512
 epoch: 31, train_loss: 1.1323, test_loss: 1.2294, test_f1: 0.3851
 epoch: 32, train_loss: 1.1293, test_loss: 1.2254, test_f1: 0.4016
 epoch: 33, train_loss: 1.1394, test_loss: 1.2228, test_f1: 0.4030
 epoch: 34, train_loss: 1.1262, test_loss: 1.2504, test_f1: 0.3864
 epoch: 35, train_loss: 1.1268, test_loss: 1.2240, test_f1: 0.3787
 epoch: 36, train_loss: 1.1307, test_loss: 1.2447, test_f1: 0.4095
 epoch: 37, train_loss: 1.1244, test_loss: 1.2404, test_f1: 0.3874
 epoch: 38, train_loss: 1.1248, test_loss: 1.2717, test_f1: 0.4067
 epoch: 39, train_loss: 1.1304, test_loss: 1.2257, test_f1: 0.4045
 epoch: 40, train_loss: 1.1186, test_loss: 1.2322, test_f1: 0.4019
 epoch: 41, train_loss: 1.1105, test_loss: 1.2442, test_f1: 0.3924
 epoch: 42, train_loss: 1.1135, test_loss: 1.2221, test_f1: 0.4258
 epoch: 43, train_loss: 1.1089, test_loss: 1.2149, test_f1: 0.4176
 epoch: 44, train_loss: 1.1095, test_loss: 1.2158, test_f1: 0.4154
 epoch: 45, train_loss: 1.0933, test_loss: 1.2250, test_f1: 0.4233
 epoch: 46, train_loss: 1.1050, test_loss: 1.2441, test_f1: 0.4226
 epoch: 47, train_loss: 1.0982, test_loss: 1.2648, test_f1: 0.4219
 epoch: 48, train_loss: 1.0960, test_loss: 1.2211, test_f1: 0.4444
 epoch: 49, train_loss: 1.0907, test_loss: 1.2188, test_f1: 0.4482
 epoch: 50, train_loss: 1.0915, test_loss: 1.2536, test_f1: 0.4340
 epoch: 51, train_loss: 1.0850, test_loss: 1.2136, test_f1: 0.4394
 epoch: 52, train_loss: 1.0764, test_loss: 1.2038, test_f1: 0.4389
 epoch: 53, train_loss: 1.0863, test_loss: 1.2307, test_f1: 0.4313
 epoch: 54, train_loss: 1.0808, test_loss: 1.2687, test_f1: 0.4371
 epoch: 55, train_loss: 1.0789, test_loss: 1.2793, test_f1: 0.4347
 epoch: 56, train_loss: 1.0778, test_loss: 1.2226, test_f1: 0.4501
 epoch: 57, train_loss: 1.0927, test_loss: 1.2612, test_f1: 0.4256
 epoch: 58, train_loss: 1.0819, test_loss: 1.2201, test_f1: 0.4172
 epoch: 59, train_loss: 1.0680, test_loss: 1.2014, test_f1: 0.4328
 epoch: 60, train_loss: 1.0729, test_loss: 1.2655, test_f1: 0.4445
 epoch: 61, train_loss: 1.0745, test_loss: 1.2572, test_f1: 0.4334
 epoch: 62, train_loss: 1.0733, test_loss: 1.2364, test_f1: 0.4534
 epoch: 63, train_loss: 1.0596, test_loss: 1.2135, test_f1: 0.4634
 epoch: 64, train_loss: 1.0739, test_loss: 1.2333, test_f1: 0.4486
 epoch: 65, train_loss: 1.0683, test_loss: 1.3570, test_f1: 0.4432
 epoch: 66, train_loss: 1.0647, test_loss: 1.2425, test_f1: 0.4371
 epoch: 67, train_loss: 1.0739, test_loss: 1.2199, test_f1: 0.4450
 epoch: 68, train_loss: 1.0630, test_loss: 1.3382, test_f1: 0.4723
 epoch: 69, train_loss: 1.0596, test_loss: 1.2384, test_f1: 0.4528
 epoch: 70, train_loss: 1.0740, test_loss: 1.2312, test_f1: 0.4649
 epoch: 71, train_loss: 1.0749, test_loss: 1.2598, test_f1: 0.4430
 epoch: 72, train_loss: 1.0588, test_loss: 1.2597, test_f1: 0.4691
 epoch: 73, train_loss: 1.0474, test_loss: 1.2287, test_f1: 0.4713
 epoch: 74, train_loss: 1.0682, test_loss: 1.2390, test_f1: 0.4551
 epoch: 75, train_loss: 1.0519, test_loss: 1.2358, test_f1: 0.4648
 epoch: 76, train_loss: 1.0519, test_loss: 1.2224, test_f1: 0.4503
 epoch: 77, train_loss: 1.0729, test_loss: 1.2113, test_f1: 0.4587
 epoch: 78, train_loss: 1.0511, test_loss: 1.2090, test_f1: 0.4670
 epoch: 79, train_loss: 1.0633, test_loss: 1.2041, test_f1: 0.4490
 epoch: 80, train_loss: 1.0407, test_loss: 1.2529, test_f1: 0.4762
 epoch: 81, train_loss: 1.0433, test_loss: 1.2151, test_f1: 0.4844
 epoch: 82, train_loss: 1.0518, test_loss: 1.2384, test_f1: 0.4705
 epoch: 83, train_loss: 1.0516, test_loss: 1.2460, test_f1: 0.4647
 epoch: 84, train_loss: 1.0596, test_loss: 1.2085, test_f1: 0.4608
 epoch: 85, train_loss: 1.0606, test_loss: 1.2248, test_f1: 0.4538
 epoch: 86, train_loss: 1.0389, test_loss: 1.2100, test_f1: 0.4705
 epoch: 87, train_loss: 1.0443, test_loss: 1.2246, test_f1: 0.4950
 epoch: 88, train_loss: 1.0378, test_loss: 1.3027, test_f1: 0.5039
 epoch: 89, train_loss: 1.0390, test_loss: 1.2277, test_f1: 0.4970
 epoch: 90, train_loss: 1.0392, test_loss: 1.2256, test_f1: 0.4733
 epoch: 91, train_loss: 1.0498, test_loss: 1.2713, test_f1: 0.4693
 epoch: 92, train_loss: 1.0466, test_loss: 1.2112, test_f1: 0.4742
 epoch: 93, train_loss: 1.0540, test_loss: 1.2114, test_f1: 0.4856
 epoch: 94, train_loss: 1.0470, test_loss: 1.2387, test_f1: 0.4814
 epoch: 95, train_loss: 1.0320, test_loss: 1.2011, test_f1: 0.5051
 epoch: 96, train_loss: 1.0403, test_loss: 1.2419, test_f1: 0.4938
 epoch: 97, train_loss: 1.0350, test_loss: 1.2184, test_f1: 0.4799
 epoch: 98, train_loss: 1.0401, test_loss: 1.2230, test_f1: 0.4778
 epoch: 99, train_loss: 1.0158, test_loss: 1.2775, test_f1: 0.5154
##################ITERATION #8 ****************************************
 epoch: 0, train_loss: 1.2571, test_loss: 1.3009, test_f1: 0.2735
 epoch: 1, train_loss: 1.2461, test_loss: 1.3200, test_f1: 0.2873
 epoch: 2, train_loss: 1.2296, test_loss: 1.3077, test_f1: 0.2957
 epoch: 3, train_loss: 1.2232, test_loss: 1.3166, test_f1: 0.2967
 epoch: 4, train_loss: 1.2084, test_loss: 1.3048, test_f1: 0.3016
 epoch: 5, train_loss: 1.1966, test_loss: 1.3039, test_f1: 0.3034
 epoch: 6, train_loss: 1.2006, test_loss: 1.3095, test_f1: 0.3266
 epoch: 7, train_loss: 1.1788, test_loss: 1.2932, test_f1: 0.3482
 epoch: 8, train_loss: 1.1871, test_loss: 1.2957, test_f1: 0.3492
 epoch: 9, train_loss: 1.1772, test_loss: 1.2806, test_f1: 0.3650
 epoch: 10, train_loss: 1.1728, test_loss: 1.2721, test_f1: 0.3758
 epoch: 11, train_loss: 1.1655, test_loss: 1.2475, test_f1: 0.3953
 epoch: 12, train_loss: 1.1499, test_loss: 1.2450, test_f1: 0.4140
 epoch: 13, train_loss: 1.1512, test_loss: 1.2317, test_f1: 0.4311
 epoch: 14, train_loss: 1.1448, test_loss: 1.2430, test_f1: 0.4213
 epoch: 15, train_loss: 1.1408, test_loss: 1.2273, test_f1: 0.4669
 epoch: 16, train_loss: 1.1362, test_loss: 1.2390, test_f1: 0.4456
 epoch: 17, train_loss: 1.1373, test_loss: 1.2518, test_f1: 0.4560
 epoch: 18, train_loss: 1.1346, test_loss: 1.2665, test_f1: 0.4638
 epoch: 19, train_loss: 1.1256, test_loss: 1.2593, test_f1: 0.4632
 epoch: 20, train_loss: 1.1195, test_loss: 1.2459, test_f1: 0.4652
 epoch: 21, train_loss: 1.1169, test_loss: 1.2337, test_f1: 0.4659
 epoch: 22, train_loss: 1.0989, test_loss: 1.2186, test_f1: 0.4754
 epoch: 23, train_loss: 1.1101, test_loss: 1.2061, test_f1: 0.4795
 epoch: 24, train_loss: 1.1044, test_loss: 1.2172, test_f1: 0.4698
 epoch: 25, train_loss: 1.1076, test_loss: 1.2322, test_f1: 0.4650
 epoch: 26, train_loss: 1.1089, test_loss: 1.2190, test_f1: 0.4691
 epoch: 27, train_loss: 1.0865, test_loss: 1.2295, test_f1: 0.4523
 epoch: 28, train_loss: 1.0860, test_loss: 1.2153, test_f1: 0.4531
 epoch: 29, train_loss: 1.0796, test_loss: 1.2036, test_f1: 0.4371
 epoch: 30, train_loss: 1.0858, test_loss: 1.1989, test_f1: 0.4668
 epoch: 31, train_loss: 1.0696, test_loss: 1.2123, test_f1: 0.4627
 epoch: 32, train_loss: 1.0670, test_loss: 1.2361, test_f1: 0.4652
 epoch: 33, train_loss: 1.0823, test_loss: 1.2378, test_f1: 0.4553
 epoch: 34, train_loss: 1.0655, test_loss: 1.2249, test_f1: 0.4616
 epoch: 35, train_loss: 1.0646, test_loss: 1.2260, test_f1: 0.4675
 epoch: 36, train_loss: 1.0731, test_loss: 1.2235, test_f1: 0.4482
 epoch: 37, train_loss: 1.0485, test_loss: 1.2237, test_f1: 0.4669
 epoch: 38, train_loss: 1.0539, test_loss: 1.2248, test_f1: 0.4783
 epoch: 39, train_loss: 1.0530, test_loss: 1.2479, test_f1: 0.4651
 epoch: 40, train_loss: 1.0444, test_loss: 1.2347, test_f1: 0.4784
 epoch: 41, train_loss: 1.0338, test_loss: 1.2263, test_f1: 0.4756
 epoch: 42, train_loss: 1.0154, test_loss: 1.2450, test_f1: 0.4583
 epoch: 43, train_loss: 1.0407, test_loss: 1.2468, test_f1: 0.4533
 epoch: 44, train_loss: 1.0181, test_loss: 1.2474, test_f1: 0.4660
 epoch: 45, train_loss: 1.0391, test_loss: 1.2577, test_f1: 0.4756
 epoch: 46, train_loss: 1.0263, test_loss: 1.2687, test_f1: 0.4717
 epoch: 47, train_loss: 1.0260, test_loss: 1.2749, test_f1: 0.4639
 epoch: 48, train_loss: 1.0247, test_loss: 1.3146, test_f1: 0.4550
 epoch: 49, train_loss: 1.0185, test_loss: 1.2742, test_f1: 0.4570
 epoch: 50, train_loss: 1.0139, test_loss: 1.2697, test_f1: 0.4695
 epoch: 51, train_loss: 1.0143, test_loss: 1.2757, test_f1: 0.4636
 epoch: 52, train_loss: 1.0038, test_loss: 1.3033, test_f1: 0.4589
 epoch: 53, train_loss: 1.0050, test_loss: 1.3063, test_f1: 0.4481
 epoch: 54, train_loss: 0.9914, test_loss: 1.3070, test_f1: 0.4695
 epoch: 55, train_loss: 0.9927, test_loss: 1.2892, test_f1: 0.4687
 epoch: 56, train_loss: 0.9962, test_loss: 1.2984, test_f1: 0.4687
 epoch: 57, train_loss: 1.0051, test_loss: 1.2958, test_f1: 0.4786
 epoch: 58, train_loss: 0.9873, test_loss: 1.2857, test_f1: 0.4840
 epoch: 59, train_loss: 1.0053, test_loss: 1.2777, test_f1: 0.4841
 epoch: 60, train_loss: 0.9905, test_loss: 1.2694, test_f1: 0.4937
 epoch: 61, train_loss: 0.9796, test_loss: 1.2933, test_f1: 0.4818
 epoch: 62, train_loss: 0.9847, test_loss: 1.2647, test_f1: 0.4823
 epoch: 63, train_loss: 0.9722, test_loss: 1.2715, test_f1: 0.4948
 epoch: 64, train_loss: 0.9813, test_loss: 1.2880, test_f1: 0.4751
 epoch: 65, train_loss: 0.9856, test_loss: 1.2722, test_f1: 0.4876
 epoch: 66, train_loss: 0.9621, test_loss: 1.2760, test_f1: 0.4985
 epoch: 67, train_loss: 0.9771, test_loss: 1.2582, test_f1: 0.4924
 epoch: 68, train_loss: 0.9694, test_loss: 1.2776, test_f1: 0.4929
 epoch: 69, train_loss: 0.9704, test_loss: 1.2763, test_f1: 0.5017
 epoch: 70, train_loss: 0.9899, test_loss: 1.2823, test_f1: 0.4858
 epoch: 71, train_loss: 0.9783, test_loss: 1.2752, test_f1: 0.4781
 epoch: 72, train_loss: 0.9622, test_loss: 1.2637, test_f1: 0.4968
 epoch: 73, train_loss: 0.9654, test_loss: 1.2732, test_f1: 0.4896
 epoch: 74, train_loss: 0.9766, test_loss: 1.2803, test_f1: 0.4846
 epoch: 75, train_loss: 0.9651, test_loss: 1.2826, test_f1: 0.4885
 epoch: 76, train_loss: 0.9604, test_loss: 1.2895, test_f1: 0.4883
 epoch: 77, train_loss: 0.9569, test_loss: 1.3046, test_f1: 0.4910
 epoch: 78, train_loss: 0.9511, test_loss: 1.2961, test_f1: 0.4879
 epoch: 79, train_loss: 0.9567, test_loss: 1.2686, test_f1: 0.5000
 epoch: 80, train_loss: 0.9651, test_loss: 1.2934, test_f1: 0.5055
 epoch: 81, train_loss: 0.9616, test_loss: 1.3269, test_f1: 0.4850
 epoch: 82, train_loss: 0.9558, test_loss: 1.2774, test_f1: 0.4988
 epoch: 83, train_loss: 0.9525, test_loss: 1.3087, test_f1: 0.4926
 epoch: 84, train_loss: 0.9381, test_loss: 1.2740, test_f1: 0.5033
 epoch: 85, train_loss: 0.9557, test_loss: 1.2802, test_f1: 0.5106
 epoch: 86, train_loss: 0.9427, test_loss: 1.3056, test_f1: 0.4996
 epoch: 87, train_loss: 0.9405, test_loss: 1.2702, test_f1: 0.5044
 epoch: 88, train_loss: 0.9546, test_loss: 1.2491, test_f1: 0.5011
 epoch: 89, train_loss: 0.9461, test_loss: 1.2977, test_f1: 0.5093
 epoch: 90, train_loss: 0.9569, test_loss: 1.2955, test_f1: 0.5026
 epoch: 91, train_loss: 0.9526, test_loss: 1.2809, test_f1: 0.4953
 epoch: 92, train_loss: 0.9459, test_loss: 1.2681, test_f1: 0.5061
 epoch: 93, train_loss: 0.9376, test_loss: 1.2739, test_f1: 0.5066
 epoch: 94, train_loss: 0.9272, test_loss: 1.2763, test_f1: 0.5114
 epoch: 95, train_loss: 0.9393, test_loss: 1.2629, test_f1: 0.5153
 epoch: 96, train_loss: 0.9317, test_loss: 1.2745, test_f1: 0.5176
 epoch: 97, train_loss: 0.9467, test_loss: 1.3032, test_f1: 0.5031
 epoch: 98, train_loss: 0.9314, test_loss: 1.3044, test_f1: 0.5025
 epoch: 99, train_loss: 0.9204, test_loss: 1.2848, test_f1: 0.5025
##################ITERATION #9 ****************************************
 epoch: 0, train_loss: 1.2910, test_loss: 1.3430, test_f1: 0.2956
 epoch: 1, train_loss: 1.2479, test_loss: 1.3212, test_f1: 0.2604
 epoch: 2, train_loss: 1.2368, test_loss: 1.3054, test_f1: 0.2658
 epoch: 3, train_loss: 1.2276, test_loss: 1.3396, test_f1: 0.2690
 epoch: 4, train_loss: 1.2365, test_loss: 1.2802, test_f1: 0.2920
 epoch: 5, train_loss: 1.2072, test_loss: 1.2965, test_f1: 0.2818
 epoch: 6, train_loss: 1.2122, test_loss: 1.2986, test_f1: 0.2936
 epoch: 7, train_loss: 1.1951, test_loss: 1.2859, test_f1: 0.3201
 epoch: 8, train_loss: 1.1982, test_loss: 1.2704, test_f1: 0.3548
 epoch: 9, train_loss: 1.1887, test_loss: 1.2678, test_f1: 0.3540
 epoch: 10, train_loss: 1.1708, test_loss: 1.2557, test_f1: 0.3754
 epoch: 11, train_loss: 1.1782, test_loss: 1.2696, test_f1: 0.3707
 epoch: 12, train_loss: 1.1760, test_loss: 1.2649, test_f1: 0.3643
 epoch: 13, train_loss: 1.1686, test_loss: 1.2533, test_f1: 0.3804
 epoch: 14, train_loss: 1.1578, test_loss: 1.2395, test_f1: 0.3731
 epoch: 15, train_loss: 1.1584, test_loss: 1.2597, test_f1: 0.3989
 epoch: 16, train_loss: 1.1488, test_loss: 1.2359, test_f1: 0.3870
 epoch: 17, train_loss: 1.1301, test_loss: 1.2405, test_f1: 0.3914
 epoch: 18, train_loss: 1.1372, test_loss: 1.2217, test_f1: 0.3957
 epoch: 19, train_loss: 1.1523, test_loss: 1.2374, test_f1: 0.4043
 epoch: 20, train_loss: 1.1422, test_loss: 1.2204, test_f1: 0.3640
 epoch: 21, train_loss: 1.1335, test_loss: 1.2230, test_f1: 0.3949
 epoch: 22, train_loss: 1.1350, test_loss: 1.2215, test_f1: 0.3855
 epoch: 23, train_loss: 1.1114, test_loss: 1.2152, test_f1: 0.4122
 epoch: 24, train_loss: 1.1351, test_loss: 1.2104, test_f1: 0.4124
 epoch: 25, train_loss: 1.1239, test_loss: 1.2104, test_f1: 0.4033
 epoch: 26, train_loss: 1.1190, test_loss: 1.2092, test_f1: 0.4093
 epoch: 27, train_loss: 1.1170, test_loss: 1.2080, test_f1: 0.4412
 epoch: 28, train_loss: 1.1165, test_loss: 1.2032, test_f1: 0.4248
 epoch: 29, train_loss: 1.1100, test_loss: 1.2122, test_f1: 0.4443
 epoch: 30, train_loss: 1.1152, test_loss: 1.2105, test_f1: 0.4441
 epoch: 31, train_loss: 1.1017, test_loss: 1.2068, test_f1: 0.4534
 epoch: 32, train_loss: 1.0911, test_loss: 1.2045, test_f1: 0.4546
 epoch: 33, train_loss: 1.0848, test_loss: 1.2167, test_f1: 0.4576
 epoch: 34, train_loss: 1.0889, test_loss: 1.1974, test_f1: 0.4474
 epoch: 35, train_loss: 1.0902, test_loss: 1.1906, test_f1: 0.4548
 epoch: 36, train_loss: 1.0828, test_loss: 1.1919, test_f1: 0.4514
 epoch: 37, train_loss: 1.0817, test_loss: 1.1850, test_f1: 0.4484
 epoch: 38, train_loss: 1.0793, test_loss: 1.1937, test_f1: 0.4640
 epoch: 39, train_loss: 1.0772, test_loss: 1.1959, test_f1: 0.4573
 epoch: 40, train_loss: 1.0711, test_loss: 1.1994, test_f1: 0.4629
 epoch: 41, train_loss: 1.0717, test_loss: 1.1964, test_f1: 0.4632
 epoch: 42, train_loss: 1.0740, test_loss: 1.2003, test_f1: 0.4787
 epoch: 43, train_loss: 1.0681, test_loss: 1.1965, test_f1: 0.4691
 epoch: 44, train_loss: 1.0644, test_loss: 1.1858, test_f1: 0.4740
 epoch: 45, train_loss: 1.0712, test_loss: 1.1847, test_f1: 0.4760
 epoch: 46, train_loss: 1.0599, test_loss: 1.2006, test_f1: 0.4780
 epoch: 47, train_loss: 1.0626, test_loss: 1.1947, test_f1: 0.4578
 epoch: 48, train_loss: 1.0440, test_loss: 1.1950, test_f1: 0.4790
 epoch: 49, train_loss: 1.0499, test_loss: 1.1834, test_f1: 0.4763
 epoch: 50, train_loss: 1.0470, test_loss: 1.1978, test_f1: 0.4709
 epoch: 51, train_loss: 1.0415, test_loss: 1.1950, test_f1: 0.4883
 epoch: 52, train_loss: 1.0311, test_loss: 1.1976, test_f1: 0.4899
 epoch: 53, train_loss: 1.0421, test_loss: 1.1898, test_f1: 0.4721
 epoch: 54, train_loss: 1.0469, test_loss: 1.1891, test_f1: 0.4790
 epoch: 55, train_loss: 1.0488, test_loss: 1.1855, test_f1: 0.4700
 epoch: 56, train_loss: 1.0331, test_loss: 1.1805, test_f1: 0.4728
 epoch: 57, train_loss: 1.0315, test_loss: 1.1832, test_f1: 0.4729
 epoch: 58, train_loss: 1.0390, test_loss: 1.1892, test_f1: 0.4779
 epoch: 59, train_loss: 1.0391, test_loss: 1.1833, test_f1: 0.4809
 epoch: 60, train_loss: 1.0259, test_loss: 1.1889, test_f1: 0.4820
 epoch: 61, train_loss: 1.0151, test_loss: 1.1898, test_f1: 0.4781
 epoch: 62, train_loss: 1.0304, test_loss: 1.1871, test_f1: 0.4941
 epoch: 63, train_loss: 1.0365, test_loss: 1.1907, test_f1: 0.4764
 epoch: 64, train_loss: 1.0273, test_loss: 1.1714, test_f1: 0.4812
 epoch: 65, train_loss: 1.0216, test_loss: 1.1770, test_f1: 0.4968
 epoch: 66, train_loss: 1.0284, test_loss: 1.1866, test_f1: 0.4829
 epoch: 67, train_loss: 1.0273, test_loss: 1.1933, test_f1: 0.4923
 epoch: 68, train_loss: 1.0326, test_loss: 1.1910, test_f1: 0.4753
 epoch: 69, train_loss: 1.0261, test_loss: 1.1778, test_f1: 0.4832
 epoch: 70, train_loss: 1.0365, test_loss: 1.1780, test_f1: 0.4914
 epoch: 71, train_loss: 1.0062, test_loss: 1.1899, test_f1: 0.5008
 epoch: 72, train_loss: 1.0189, test_loss: 1.2069, test_f1: 0.4800
 epoch: 73, train_loss: 1.0125, test_loss: 1.2013, test_f1: 0.4913
 epoch: 74, train_loss: 1.0277, test_loss: 1.2044, test_f1: 0.5009
 epoch: 75, train_loss: 1.0367, test_loss: 1.2013, test_f1: 0.4979
 epoch: 76, train_loss: 1.0372, test_loss: 1.1935, test_f1: 0.4973
 epoch: 77, train_loss: 1.0142, test_loss: 1.1709, test_f1: 0.5023
 epoch: 78, train_loss: 1.0057, test_loss: 1.1932, test_f1: 0.5014
 epoch: 79, train_loss: 1.0154, test_loss: 1.1758, test_f1: 0.4703
 epoch: 80, train_loss: 1.0195, test_loss: 1.2025, test_f1: 0.4890
 epoch: 81, train_loss: 1.0127, test_loss: 1.1973, test_f1: 0.5149
 epoch: 82, train_loss: 1.0055, test_loss: 1.1818, test_f1: 0.4870
 epoch: 83, train_loss: 0.9957, test_loss: 1.1810, test_f1: 0.5061
 epoch: 84, train_loss: 0.9976, test_loss: 1.1881, test_f1: 0.4980
 epoch: 85, train_loss: 1.0111, test_loss: 1.2082, test_f1: 0.5000
 epoch: 86, train_loss: 1.0020, test_loss: 1.1749, test_f1: 0.4768
 epoch: 87, train_loss: 1.0062, test_loss: 1.1929, test_f1: 0.5103
 epoch: 88, train_loss: 1.0033, test_loss: 1.1797, test_f1: 0.5016
 epoch: 89, train_loss: 1.0002, test_loss: 1.1867, test_f1: 0.4965
 epoch: 90, train_loss: 1.0033, test_loss: 1.1826, test_f1: 0.4771
 epoch: 91, train_loss: 0.9976, test_loss: 1.1768, test_f1: 0.5018
 epoch: 92, train_loss: 1.0018, test_loss: 1.1776, test_f1: 0.5069
 epoch: 93, train_loss: 1.0004, test_loss: 1.1726, test_f1: 0.4996
 epoch: 94, train_loss: 0.9977, test_loss: 1.1774, test_f1: 0.4644
 epoch: 95, train_loss: 0.9996, test_loss: 1.1806, test_f1: 0.4782
 epoch: 96, train_loss: 0.9968, test_loss: 1.1823, test_f1: 0.5028
 epoch: 97, train_loss: 0.9898, test_loss: 1.1788, test_f1: 0.4897
 epoch: 98, train_loss: 1.0009, test_loss: 1.1713, test_f1: 0.5206
 epoch: 99, train_loss: 0.9910, test_loss: 1.1815, test_f1: 0.4768

Training completed in 720.90 seconds
Best F1: 0.5949 at epoch 95
Mean F1 across iterations: 0.5474  0.0317
========================FINAL RESULTS================================
FEGIN weighted F1: 0.5949  0.0317
python main.py --data ltspice_demos --representation component_component --model FEGIN --layers 5 --hiddens 32 --batch_size 32 --lr 0.0001 --emb_size 512 --epochs 100 --save_appendix component_component_L5_H32_BS32_LR0.0001_E512 --no_val
-----



STDERR:
  File "main.py", line 370, in <module>
    main()
  File "main.py", line 254, in main
    dataset = dataset_class(
  File "/home/philip/projects/ltspice_examples_code_repo/Circuit-Completion-Using-GNNs/component_classification_with_link_prediction_head/evaluation/FEGIN/kernel/circuit_datasets.py", line 15, in __init__
    self.data, self.slices = torch.load(self.processed_paths[0])
  File "/home/philip/.local/lib/python3.8/site-packages/torch/serialization.py", line 1040, in load
    warnings.warn(
  File "/usr/lib/python3.8/warnings.py", line 109, in _showwarnmsg
    sw(msg.message, msg.category, msg.filename, msg.lineno,
  File "main.py", line 47, in warn_with_traceback
    traceback.print_stack(file=log)
/home/philip/projects/ltspice_examples_code_repo/Circuit-Completion-Using-GNNs/component_classification_with_link_prediction_head/evaluation/FEGIN/kernel/circuit_datasets.py:15: FutureWarning: You are using `torch.load` with `weights_only=False` (the current default value), which uses the default pickle module implicitly. It is possible to construct malicious pickle data which will execute arbitrary code during unpickling (See https://github.com/pytorch/pytorch/blob/main/SECURITY.md#untrusted-models for more details). In a future release, the default value for `weights_only` will be flipped to `True`. This limits the functions that could be executed during unpickling. Arbitrary objects will no longer be allowed to be loaded via this mode unless they are explicitly allowlisted by the user via `torch.serialization.add_safe_globals`. We recommend you start setting `weights_only=True` for any use case where you don't have full control of the loaded file. Please open an issue on GitHub for any issues related to this experimental feature.
  self.data, self.slices = torch.load(self.processed_paths[0])
