STDOUT:
Results will be saved in /home/philip/projects/ltspice_examples_code_repo/Circuit-Completion-Using-GNNs/component_classification_with_link_prediction_head/evaluation/FEGIN/results/model_FEGIN_dataset_ltspice_demos
Command line input: python main.py --data ltspice_demos --representation component_pin --model FEGIN --layers 2 --hiddens 128 --batch_size 128 --lr 0.001 --emb_size 250 --epochs 100 --save_appendix component_pin_L2_H128_BS128_LR0.001_E250 --no_val
 is saved.
-----
ltspice_demos - FEGIN
Using 2 layers, 128 hidden units, h = 2
Loading component_pin representation dataset
ENTERED
Training FEGIN on component_pin representation
Train: 1565, Test: 383
##################ITERATION #0 ****************************************
 epoch: 0, train_loss: 1.2919, test_loss: 1.3060, test_f1: 0.3083
 epoch: 1, train_loss: 1.1478, test_loss: 1.2785, test_f1: 0.2886
 epoch: 2, train_loss: 1.0627, test_loss: 1.2768, test_f1: 0.3480
 epoch: 3, train_loss: 0.9845, test_loss: 1.2755, test_f1: 0.3633
 epoch: 4, train_loss: 0.9232, test_loss: 1.1995, test_f1: 0.4301
 epoch: 5, train_loss: 0.8942, test_loss: 1.0527, test_f1: 0.5838
 epoch: 6, train_loss: 0.8420, test_loss: 0.9811, test_f1: 0.6036
 epoch: 7, train_loss: 0.8257, test_loss: 0.9891, test_f1: 0.5561
 epoch: 8, train_loss: 0.7785, test_loss: 0.9973, test_f1: 0.6109
 epoch: 9, train_loss: 0.7660, test_loss: 0.9423, test_f1: 0.5856
 epoch: 10, train_loss: 0.7448, test_loss: 1.0163, test_f1: 0.5816
 epoch: 11, train_loss: 0.7015, test_loss: 1.0146, test_f1: 0.5556
 epoch: 12, train_loss: 0.6865, test_loss: 1.0071, test_f1: 0.5855
 epoch: 13, train_loss: 0.6449, test_loss: 1.1724, test_f1: 0.5427
 epoch: 14, train_loss: 0.6555, test_loss: 1.0230, test_f1: 0.5855
 epoch: 15, train_loss: 0.6300, test_loss: 1.2521, test_f1: 0.5251
 epoch: 16, train_loss: 0.6426, test_loss: 1.0138, test_f1: 0.5757
 epoch: 17, train_loss: 0.6016, test_loss: 1.0177, test_f1: 0.5811
 epoch: 18, train_loss: 0.5945, test_loss: 1.0788, test_f1: 0.6271
 epoch: 19, train_loss: 0.5637, test_loss: 1.2509, test_f1: 0.5296
 epoch: 20, train_loss: 0.5393, test_loss: 1.2580, test_f1: 0.5781
 epoch: 21, train_loss: 0.5536, test_loss: 1.3430, test_f1: 0.5950
 epoch: 22, train_loss: 0.5655, test_loss: 1.3458, test_f1: 0.5869
 epoch: 23, train_loss: 0.5564, test_loss: 1.1161, test_f1: 0.5911
 epoch: 24, train_loss: 0.5213, test_loss: 1.0789, test_f1: 0.5932
 epoch: 25, train_loss: 0.5062, test_loss: 1.2336, test_f1: 0.5668
 epoch: 26, train_loss: 0.4847, test_loss: 1.2093, test_f1: 0.5827
 epoch: 27, train_loss: 0.4588, test_loss: 1.2419, test_f1: 0.6121
 epoch: 28, train_loss: 0.4544, test_loss: 1.1606, test_f1: 0.6394
 epoch: 29, train_loss: 0.4512, test_loss: 1.2166, test_f1: 0.6311
 epoch: 30, train_loss: 0.4302, test_loss: 1.3352, test_f1: 0.6458
 epoch: 31, train_loss: 0.4189, test_loss: 1.5051, test_f1: 0.5524
 epoch: 32, train_loss: 0.3956, test_loss: 1.3771, test_f1: 0.6326
 epoch: 33, train_loss: 0.4091, test_loss: 1.3096, test_f1: 0.6308
 epoch: 34, train_loss: 0.4020, test_loss: 1.3528, test_f1: 0.6052
 epoch: 35, train_loss: 0.3473, test_loss: 1.5071, test_f1: 0.6326
 epoch: 36, train_loss: 0.3611, test_loss: 1.8608, test_f1: 0.5661
 epoch: 37, train_loss: 0.3785, test_loss: 1.5001, test_f1: 0.6393
 epoch: 38, train_loss: 0.3842, test_loss: 1.6569, test_f1: 0.6102
 epoch: 39, train_loss: 0.3425, test_loss: 1.5454, test_f1: 0.6451
 epoch: 40, train_loss: 0.3680, test_loss: 1.4380, test_f1: 0.6637
 epoch: 41, train_loss: 0.3519, test_loss: 1.4250, test_f1: 0.6086
 epoch: 42, train_loss: 0.3264, test_loss: 1.7055, test_f1: 0.6079
 epoch: 43, train_loss: 0.2960, test_loss: 1.9239, test_f1: 0.6414
 epoch: 44, train_loss: 0.3224, test_loss: 1.8504, test_f1: 0.6025
 epoch: 45, train_loss: 0.2987, test_loss: 1.9465, test_f1: 0.5756
 epoch: 46, train_loss: 0.2791, test_loss: 1.9337, test_f1: 0.6317
 epoch: 47, train_loss: 0.2904, test_loss: 1.8537, test_f1: 0.6012
 epoch: 48, train_loss: 0.2912, test_loss: 1.5084, test_f1: 0.6535
 epoch: 49, train_loss: 0.2943, test_loss: 1.8916, test_f1: 0.6529
 epoch: 50, train_loss: 0.2542, test_loss: 1.9037, test_f1: 0.6036
 epoch: 51, train_loss: 0.2222, test_loss: 2.0564, test_f1: 0.6541
 epoch: 52, train_loss: 0.2167, test_loss: 2.0892, test_f1: 0.6238
 epoch: 53, train_loss: 0.2149, test_loss: 1.9816, test_f1: 0.6433
 epoch: 54, train_loss: 0.2052, test_loss: 2.0210, test_f1: 0.6466
 epoch: 55, train_loss: 0.1982, test_loss: 2.0525, test_f1: 0.6371
 epoch: 56, train_loss: 0.2014, test_loss: 1.9794, test_f1: 0.6396
 epoch: 57, train_loss: 0.1781, test_loss: 2.1622, test_f1: 0.6361
 epoch: 58, train_loss: 0.1788, test_loss: 2.0440, test_f1: 0.6251
 epoch: 59, train_loss: 0.1595, test_loss: 2.0969, test_f1: 0.6123
 epoch: 60, train_loss: 0.1689, test_loss: 2.2232, test_f1: 0.5994
 epoch: 61, train_loss: 0.1841, test_loss: 2.2105, test_f1: 0.6374
 epoch: 62, train_loss: 0.1627, test_loss: 2.2048, test_f1: 0.6291
 epoch: 63, train_loss: 0.1560, test_loss: 2.3666, test_f1: 0.6557
 epoch: 64, train_loss: 0.1655, test_loss: 2.3524, test_f1: 0.6540
 epoch: 65, train_loss: 0.1873, test_loss: 2.4024, test_f1: 0.6336
 epoch: 66, train_loss: 0.1594, test_loss: 2.3544, test_f1: 0.6376
 epoch: 67, train_loss: 0.1852, test_loss: 2.5431, test_f1: 0.5842
 epoch: 68, train_loss: 0.1715, test_loss: 2.5884, test_f1: 0.5991
 epoch: 69, train_loss: 0.1409, test_loss: 2.2164, test_f1: 0.6314
 epoch: 70, train_loss: 0.1359, test_loss: 2.2494, test_f1: 0.6362
 epoch: 71, train_loss: 0.1296, test_loss: 2.3337, test_f1: 0.6494
 epoch: 72, train_loss: 0.1230, test_loss: 2.3777, test_f1: 0.6538
 epoch: 73, train_loss: 0.1549, test_loss: 2.2876, test_f1: 0.6415
 epoch: 74, train_loss: 0.1731, test_loss: 2.5349, test_f1: 0.6324
 epoch: 75, train_loss: 0.1756, test_loss: 2.7634, test_f1: 0.6275
 epoch: 76, train_loss: 0.1398, test_loss: 2.3728, test_f1: 0.6225
 epoch: 77, train_loss: 0.1095, test_loss: 2.6411, test_f1: 0.6188
 epoch: 78, train_loss: 0.1007, test_loss: 2.6095, test_f1: 0.6428
 epoch: 79, train_loss: 0.1017, test_loss: 2.3331, test_f1: 0.6431
 epoch: 80, train_loss: 0.1142, test_loss: 2.2962, test_f1: 0.6659
 epoch: 81, train_loss: 0.1389, test_loss: 2.6005, test_f1: 0.6130
 epoch: 82, train_loss: 0.1191, test_loss: 2.4837, test_f1: 0.6312
 epoch: 83, train_loss: 0.1226, test_loss: 2.6730, test_f1: 0.6444
 epoch: 84, train_loss: 0.1562, test_loss: 2.6297, test_f1: 0.6294
 epoch: 85, train_loss: 0.1790, test_loss: 2.9171, test_f1: 0.6357
 epoch: 86, train_loss: 0.1342, test_loss: 2.6259, test_f1: 0.5964
 epoch: 87, train_loss: 0.1161, test_loss: 2.7305, test_f1: 0.6311
 epoch: 88, train_loss: 0.1081, test_loss: 2.7643, test_f1: 0.6448
 epoch: 89, train_loss: 0.1128, test_loss: 2.6567, test_f1: 0.6521
 epoch: 90, train_loss: 0.1084, test_loss: 2.8215, test_f1: 0.6238
 epoch: 91, train_loss: 0.1030, test_loss: 2.6730, test_f1: 0.6176
 epoch: 92, train_loss: 0.0876, test_loss: 2.6273, test_f1: 0.6500
 epoch: 93, train_loss: 0.0824, test_loss: 2.6524, test_f1: 0.6255
 epoch: 94, train_loss: 0.1270, test_loss: 2.7234, test_f1: 0.6516
 epoch: 95, train_loss: 0.1559, test_loss: 2.8494, test_f1: 0.6301
 epoch: 96, train_loss: 0.1151, test_loss: 2.6597, test_f1: 0.6166
 epoch: 97, train_loss: 0.1317, test_loss: 2.5934, test_f1: 0.6128
 epoch: 98, train_loss: 0.1098, test_loss: 2.5751, test_f1: 0.6510
 epoch: 99, train_loss: 0.1034, test_loss: 2.6796, test_f1: 0.6234
##################ITERATION #1 ****************************************
 epoch: 0, train_loss: 1.1592, test_loss: 1.3099, test_f1: 0.2676
 epoch: 1, train_loss: 0.9622, test_loss: 1.3395, test_f1: 0.2412
 epoch: 2, train_loss: 0.9100, test_loss: 1.1847, test_f1: 0.4499
 epoch: 3, train_loss: 0.8524, test_loss: 1.0726, test_f1: 0.4975
 epoch: 4, train_loss: 0.8089, test_loss: 1.0216, test_f1: 0.5571
 epoch: 5, train_loss: 0.7546, test_loss: 1.0073, test_f1: 0.5404
 epoch: 6, train_loss: 0.7203, test_loss: 1.1071, test_f1: 0.5099
 epoch: 7, train_loss: 0.7225, test_loss: 1.2273, test_f1: 0.5682
 epoch: 8, train_loss: 0.7089, test_loss: 1.1338, test_f1: 0.5431
 epoch: 9, train_loss: 0.6674, test_loss: 0.9969, test_f1: 0.6068
 epoch: 10, train_loss: 0.6476, test_loss: 1.1057, test_f1: 0.5558
 epoch: 11, train_loss: 0.6289, test_loss: 1.0516, test_f1: 0.5851
 epoch: 12, train_loss: 0.6018, test_loss: 1.1036, test_f1: 0.5931
 epoch: 13, train_loss: 0.5960, test_loss: 1.1291, test_f1: 0.5768
 epoch: 14, train_loss: 0.5960, test_loss: 1.1740, test_f1: 0.5643
 epoch: 15, train_loss: 0.5654, test_loss: 1.1358, test_f1: 0.5442
 epoch: 16, train_loss: 0.5551, test_loss: 1.1724, test_f1: 0.5691
 epoch: 17, train_loss: 0.5380, test_loss: 1.3183, test_f1: 0.5563
 epoch: 18, train_loss: 0.5255, test_loss: 1.3803, test_f1: 0.5986
 epoch: 19, train_loss: 0.4896, test_loss: 1.2865, test_f1: 0.5699
 epoch: 20, train_loss: 0.4954, test_loss: 1.4829, test_f1: 0.5596
 epoch: 21, train_loss: 0.4689, test_loss: 1.2497, test_f1: 0.6224
 epoch: 22, train_loss: 0.4564, test_loss: 1.2769, test_f1: 0.6895
 epoch: 23, train_loss: 0.4636, test_loss: 1.2652, test_f1: 0.6094
 epoch: 24, train_loss: 0.4484, test_loss: 1.3433, test_f1: 0.6445
 epoch: 25, train_loss: 0.4286, test_loss: 1.3825, test_f1: 0.6128
 epoch: 26, train_loss: 0.4230, test_loss: 1.4827, test_f1: 0.6450
 epoch: 27, train_loss: 0.4053, test_loss: 1.7543, test_f1: 0.6285
 epoch: 28, train_loss: 0.4021, test_loss: 1.4582, test_f1: 0.6399
 epoch: 29, train_loss: 0.3899, test_loss: 1.6600, test_f1: 0.6090
 epoch: 30, train_loss: 0.3634, test_loss: 1.4467, test_f1: 0.6504
 epoch: 31, train_loss: 0.3540, test_loss: 1.6825, test_f1: 0.6191
 epoch: 32, train_loss: 0.3308, test_loss: 1.6698, test_f1: 0.6456
 epoch: 33, train_loss: 0.3242, test_loss: 1.7227, test_f1: 0.6589
 epoch: 34, train_loss: 0.3359, test_loss: 1.7054, test_f1: 0.6582
 epoch: 35, train_loss: 0.3519, test_loss: 1.8636, test_f1: 0.6575
 epoch: 36, train_loss: 0.3154, test_loss: 1.6521, test_f1: 0.6317
 epoch: 37, train_loss: 0.3154, test_loss: 1.9219, test_f1: 0.6052
 epoch: 38, train_loss: 0.3118, test_loss: 1.7980, test_f1: 0.6337
 epoch: 39, train_loss: 0.3094, test_loss: 1.6941, test_f1: 0.6312
 epoch: 40, train_loss: 0.2896, test_loss: 2.0748, test_f1: 0.6351
 epoch: 41, train_loss: 0.2899, test_loss: 1.9320, test_f1: 0.6586
 epoch: 42, train_loss: 0.2579, test_loss: 1.9088, test_f1: 0.6703
 epoch: 43, train_loss: 0.2598, test_loss: 2.0202, test_f1: 0.6470
 epoch: 44, train_loss: 0.2212, test_loss: 1.9611, test_f1: 0.6378
 epoch: 45, train_loss: 0.2678, test_loss: 2.2030, test_f1: 0.6491
 epoch: 46, train_loss: 0.2482, test_loss: 2.0728, test_f1: 0.6318
 epoch: 47, train_loss: 0.2244, test_loss: 2.1067, test_f1: 0.6308
 epoch: 48, train_loss: 0.2097, test_loss: 2.1855, test_f1: 0.6121
 epoch: 49, train_loss: 0.1954, test_loss: 2.3500, test_f1: 0.5814
 epoch: 50, train_loss: 0.1818, test_loss: 2.2281, test_f1: 0.6160
 epoch: 51, train_loss: 0.1776, test_loss: 2.4505, test_f1: 0.6429
 epoch: 52, train_loss: 0.1621, test_loss: 2.2481, test_f1: 0.6514
 epoch: 53, train_loss: 0.1572, test_loss: 2.2897, test_f1: 0.6432
 epoch: 54, train_loss: 0.1458, test_loss: 2.2572, test_f1: 0.6451
 epoch: 55, train_loss: 0.1330, test_loss: 2.3923, test_f1: 0.6519
 epoch: 56, train_loss: 0.1173, test_loss: 2.4954, test_f1: 0.6490
 epoch: 57, train_loss: 0.1130, test_loss: 2.5279, test_f1: 0.6307
 epoch: 58, train_loss: 0.1374, test_loss: 2.6564, test_f1: 0.6327
 epoch: 59, train_loss: 0.1159, test_loss: 2.7778, test_f1: 0.6683
 epoch: 60, train_loss: 0.1157, test_loss: 2.8163, test_f1: 0.6215
 epoch: 61, train_loss: 0.1274, test_loss: 2.6451, test_f1: 0.6262
 epoch: 62, train_loss: 0.1393, test_loss: 2.6618, test_f1: 0.6366
 epoch: 63, train_loss: 0.1473, test_loss: 2.6003, test_f1: 0.6261
 epoch: 64, train_loss: 0.1215, test_loss: 2.8264, test_f1: 0.6526
 epoch: 65, train_loss: 0.1077, test_loss: 2.9733, test_f1: 0.6625
 epoch: 66, train_loss: 0.1209, test_loss: 2.7161, test_f1: 0.6588
 epoch: 67, train_loss: 0.1141, test_loss: 2.7794, test_f1: 0.6611
 epoch: 68, train_loss: 0.1011, test_loss: 3.0189, test_f1: 0.6153
 epoch: 69, train_loss: 0.0834, test_loss: 2.8163, test_f1: 0.6554
 epoch: 70, train_loss: 0.1055, test_loss: 2.9372, test_f1: 0.6413
 epoch: 71, train_loss: 0.1343, test_loss: 3.0191, test_f1: 0.6354
 epoch: 72, train_loss: 0.0974, test_loss: 3.1551, test_f1: 0.6321
 epoch: 73, train_loss: 0.1023, test_loss: 2.8665, test_f1: 0.6099
 epoch: 74, train_loss: 0.1324, test_loss: 2.9814, test_f1: 0.6211
 epoch: 75, train_loss: 0.1206, test_loss: 3.0250, test_f1: 0.6339
 epoch: 76, train_loss: 0.0854, test_loss: 2.8790, test_f1: 0.6606
 epoch: 77, train_loss: 0.0933, test_loss: 3.0670, test_f1: 0.6248
 epoch: 78, train_loss: 0.1131, test_loss: 3.1223, test_f1: 0.6185
 epoch: 79, train_loss: 0.0816, test_loss: 3.2194, test_f1: 0.6082
 epoch: 80, train_loss: 0.0795, test_loss: 3.0309, test_f1: 0.6249
 epoch: 81, train_loss: 0.0714, test_loss: 3.0900, test_f1: 0.6308
 epoch: 82, train_loss: 0.0609, test_loss: 3.5365, test_f1: 0.6080
 epoch: 83, train_loss: 0.0833, test_loss: 3.1595, test_f1: 0.6396
 epoch: 84, train_loss: 0.0833, test_loss: 3.1829, test_f1: 0.6528
 epoch: 85, train_loss: 0.0757, test_loss: 3.2662, test_f1: 0.6507
 epoch: 86, train_loss: 0.0683, test_loss: 3.4440, test_f1: 0.6190
 epoch: 87, train_loss: 0.0923, test_loss: 3.3569, test_f1: 0.6261
 epoch: 88, train_loss: 0.1064, test_loss: 3.3002, test_f1: 0.6258
 epoch: 89, train_loss: 0.1033, test_loss: 3.3808, test_f1: 0.6129
 epoch: 90, train_loss: 0.0808, test_loss: 3.4414, test_f1: 0.6052
 epoch: 91, train_loss: 0.1101, test_loss: 3.2222, test_f1: 0.6183
 epoch: 92, train_loss: 0.0763, test_loss: 3.1337, test_f1: 0.6448
 epoch: 93, train_loss: 0.0829, test_loss: 3.4052, test_f1: 0.6254
 epoch: 94, train_loss: 0.0789, test_loss: 3.2156, test_f1: 0.6260
 epoch: 95, train_loss: 0.0801, test_loss: 3.1955, test_f1: 0.6233
 epoch: 96, train_loss: 0.0657, test_loss: 3.2525, test_f1: 0.6404
 epoch: 97, train_loss: 0.0745, test_loss: 3.3303, test_f1: 0.6332
 epoch: 98, train_loss: 0.0630, test_loss: 3.4093, test_f1: 0.6114
 epoch: 99, train_loss: 0.0690, test_loss: 3.4120, test_f1: 0.6337
##################ITERATION #2 ****************************************
 epoch: 0, train_loss: 1.1237, test_loss: 1.3318, test_f1: 0.3070
 epoch: 1, train_loss: 0.9672, test_loss: 1.2874, test_f1: 0.2594
 epoch: 2, train_loss: 0.8881, test_loss: 1.1194, test_f1: 0.4027
 epoch: 3, train_loss: 0.8407, test_loss: 1.0716, test_f1: 0.4636
 epoch: 4, train_loss: 0.7959, test_loss: 1.0176, test_f1: 0.5703
 epoch: 5, train_loss: 0.7618, test_loss: 1.0113, test_f1: 0.6030
 epoch: 6, train_loss: 0.7228, test_loss: 1.0414, test_f1: 0.5747
 epoch: 7, train_loss: 0.7357, test_loss: 1.0780, test_f1: 0.6040
 epoch: 8, train_loss: 0.6874, test_loss: 1.0340, test_f1: 0.6314
 epoch: 9, train_loss: 0.6725, test_loss: 1.0276, test_f1: 0.5828
 epoch: 10, train_loss: 0.6449, test_loss: 1.0494, test_f1: 0.5919
 epoch: 11, train_loss: 0.6130, test_loss: 1.0600, test_f1: 0.6810
 epoch: 12, train_loss: 0.6192, test_loss: 1.1237, test_f1: 0.5917
 epoch: 13, train_loss: 0.5881, test_loss: 1.2055, test_f1: 0.5561
 epoch: 14, train_loss: 0.5847, test_loss: 1.1850, test_f1: 0.6086
 epoch: 15, train_loss: 0.5773, test_loss: 1.2023, test_f1: 0.6155
 epoch: 16, train_loss: 0.5876, test_loss: 1.2677, test_f1: 0.5670
 epoch: 17, train_loss: 0.5738, test_loss: 1.0639, test_f1: 0.5943
 epoch: 18, train_loss: 0.5325, test_loss: 1.1577, test_f1: 0.6302
 epoch: 19, train_loss: 0.5178, test_loss: 1.2054, test_f1: 0.6449
 epoch: 20, train_loss: 0.5044, test_loss: 1.2869, test_f1: 0.6208
 epoch: 21, train_loss: 0.4868, test_loss: 1.2223, test_f1: 0.6103
 epoch: 22, train_loss: 0.4670, test_loss: 1.4897, test_f1: 0.6003
 epoch: 23, train_loss: 0.4679, test_loss: 1.4569, test_f1: 0.5808
 epoch: 24, train_loss: 0.4482, test_loss: 1.2252, test_f1: 0.6430
 epoch: 25, train_loss: 0.4301, test_loss: 1.5877, test_f1: 0.5226
 epoch: 26, train_loss: 0.4250, test_loss: 1.4768, test_f1: 0.6302
 epoch: 27, train_loss: 0.3883, test_loss: 1.4757, test_f1: 0.6214
 epoch: 28, train_loss: 0.3914, test_loss: 1.4299, test_f1: 0.6032
 epoch: 29, train_loss: 0.3963, test_loss: 1.5973, test_f1: 0.6360
 epoch: 30, train_loss: 0.4105, test_loss: 1.5421, test_f1: 0.6312
 epoch: 31, train_loss: 0.3957, test_loss: 1.5201, test_f1: 0.6129
 epoch: 32, train_loss: 0.3631, test_loss: 1.5902, test_f1: 0.5928
 epoch: 33, train_loss: 0.3327, test_loss: 1.2604, test_f1: 0.6388
 epoch: 34, train_loss: 0.3406, test_loss: 1.6925, test_f1: 0.5966
 epoch: 35, train_loss: 0.3832, test_loss: 1.6811, test_f1: 0.6222
 epoch: 36, train_loss: 0.3611, test_loss: 1.7938, test_f1: 0.5892
 epoch: 37, train_loss: 0.3381, test_loss: 1.7263, test_f1: 0.5926
 epoch: 38, train_loss: 0.3129, test_loss: 1.4261, test_f1: 0.6251
 epoch: 39, train_loss: 0.3269, test_loss: 1.6282, test_f1: 0.6231
 epoch: 40, train_loss: 0.3160, test_loss: 1.7158, test_f1: 0.5709
 epoch: 41, train_loss: 0.3156, test_loss: 2.0884, test_f1: 0.5855
 epoch: 42, train_loss: 0.2959, test_loss: 1.5103, test_f1: 0.6316
 epoch: 43, train_loss: 0.2770, test_loss: 1.6000, test_f1: 0.6404
 epoch: 44, train_loss: 0.2929, test_loss: 1.9275, test_f1: 0.5856
 epoch: 45, train_loss: 0.2761, test_loss: 1.7853, test_f1: 0.5785
 epoch: 46, train_loss: 0.2784, test_loss: 1.7755, test_f1: 0.6566
 epoch: 47, train_loss: 0.2810, test_loss: 2.0376, test_f1: 0.6105
 epoch: 48, train_loss: 0.2805, test_loss: 1.9299, test_f1: 0.6025
 epoch: 49, train_loss: 0.2420, test_loss: 1.7981, test_f1: 0.6023
 epoch: 50, train_loss: 0.2327, test_loss: 1.7948, test_f1: 0.6122
 epoch: 51, train_loss: 0.2191, test_loss: 2.0244, test_f1: 0.5669
 epoch: 52, train_loss: 0.1756, test_loss: 2.1621, test_f1: 0.5932
 epoch: 53, train_loss: 0.1575, test_loss: 2.0294, test_f1: 0.6143
 epoch: 54, train_loss: 0.1536, test_loss: 2.1089, test_f1: 0.6023
 epoch: 55, train_loss: 0.1634, test_loss: 2.1938, test_f1: 0.5865
 epoch: 56, train_loss: 0.1562, test_loss: 2.2003, test_f1: 0.5977
 epoch: 57, train_loss: 0.1576, test_loss: 2.0951, test_f1: 0.6101
 epoch: 58, train_loss: 0.1675, test_loss: 2.1208, test_f1: 0.6490
 epoch: 59, train_loss: 0.1551, test_loss: 2.2822, test_f1: 0.6370
 epoch: 60, train_loss: 0.1342, test_loss: 2.3913, test_f1: 0.6305
 epoch: 61, train_loss: 0.1364, test_loss: 2.4194, test_f1: 0.5930
 epoch: 62, train_loss: 0.1426, test_loss: 2.1261, test_f1: 0.6095
 epoch: 63, train_loss: 0.1234, test_loss: 2.3182, test_f1: 0.5969
 epoch: 64, train_loss: 0.1306, test_loss: 2.5430, test_f1: 0.5943
 epoch: 65, train_loss: 0.1217, test_loss: 2.5088, test_f1: 0.5985
 epoch: 66, train_loss: 0.1145, test_loss: 2.4060, test_f1: 0.6176
 epoch: 67, train_loss: 0.1217, test_loss: 2.4027, test_f1: 0.6319
 epoch: 68, train_loss: 0.1232, test_loss: 2.5651, test_f1: 0.5932
 epoch: 69, train_loss: 0.1249, test_loss: 2.8654, test_f1: 0.6136
 epoch: 70, train_loss: 0.1083, test_loss: 2.6575, test_f1: 0.5839
 epoch: 71, train_loss: 0.1031, test_loss: 2.6566, test_f1: 0.5875
 epoch: 72, train_loss: 0.1027, test_loss: 2.8338, test_f1: 0.5988
 epoch: 73, train_loss: 0.1295, test_loss: 2.6554, test_f1: 0.6097
 epoch: 74, train_loss: 0.1251, test_loss: 2.5005, test_f1: 0.6210
 epoch: 75, train_loss: 0.1188, test_loss: 2.6310, test_f1: 0.6267
 epoch: 76, train_loss: 0.1495, test_loss: 2.5647, test_f1: 0.5995
 epoch: 77, train_loss: 0.1273, test_loss: 2.6724, test_f1: 0.6240
 epoch: 78, train_loss: 0.0964, test_loss: 2.4556, test_f1: 0.6172
 epoch: 79, train_loss: 0.1143, test_loss: 2.5153, test_f1: 0.6094
 epoch: 80, train_loss: 0.1131, test_loss: 2.8330, test_f1: 0.5818
 epoch: 81, train_loss: 0.0979, test_loss: 3.2145, test_f1: 0.5749
 epoch: 82, train_loss: 0.1092, test_loss: 2.7630, test_f1: 0.5940
 epoch: 83, train_loss: 0.0877, test_loss: 2.8991, test_f1: 0.6179
 epoch: 84, train_loss: 0.1007, test_loss: 2.7274, test_f1: 0.6212
 epoch: 85, train_loss: 0.1061, test_loss: 2.6863, test_f1: 0.6033
 epoch: 86, train_loss: 0.1086, test_loss: 2.9017, test_f1: 0.6021
 epoch: 87, train_loss: 0.0911, test_loss: 2.7108, test_f1: 0.6284
 epoch: 88, train_loss: 0.0995, test_loss: 2.8695, test_f1: 0.6187
 epoch: 89, train_loss: 0.1141, test_loss: 2.8980, test_f1: 0.6048
 epoch: 90, train_loss: 0.0898, test_loss: 2.7217, test_f1: 0.6064
 epoch: 91, train_loss: 0.1084, test_loss: 2.8138, test_f1: 0.5931
 epoch: 92, train_loss: 0.0940, test_loss: 3.1139, test_f1: 0.5913
 epoch: 93, train_loss: 0.1284, test_loss: 3.0926, test_f1: 0.6224
 epoch: 94, train_loss: 0.1080, test_loss: 3.1823, test_f1: 0.5984
 epoch: 95, train_loss: 0.1000, test_loss: 2.8355, test_f1: 0.6183
 epoch: 96, train_loss: 0.1037, test_loss: 2.7279, test_f1: 0.6223
 epoch: 97, train_loss: 0.1103, test_loss: 2.6864, test_f1: 0.6340
 epoch: 98, train_loss: 0.0780, test_loss: 2.8025, test_f1: 0.6074
 epoch: 99, train_loss: 0.0749, test_loss: 2.9192, test_f1: 0.6082
##################ITERATION #3 ****************************************
 epoch: 0, train_loss: 1.1269, test_loss: 1.3835, test_f1: 0.2416
 epoch: 1, train_loss: 0.9357, test_loss: 1.3909, test_f1: 0.3314
 epoch: 2, train_loss: 0.8505, test_loss: 1.3204, test_f1: 0.3934
 epoch: 3, train_loss: 0.8237, test_loss: 1.0447, test_f1: 0.5552
 epoch: 4, train_loss: 0.7698, test_loss: 1.0432, test_f1: 0.5566
 epoch: 5, train_loss: 0.7290, test_loss: 1.0288, test_f1: 0.6022
 epoch: 6, train_loss: 0.7004, test_loss: 0.9892, test_f1: 0.5947
 epoch: 7, train_loss: 0.7095, test_loss: 1.0007, test_f1: 0.5908
 epoch: 8, train_loss: 0.6659, test_loss: 1.0531, test_f1: 0.5962
 epoch: 9, train_loss: 0.6575, test_loss: 1.0712, test_f1: 0.6021
 epoch: 10, train_loss: 0.6467, test_loss: 1.1094, test_f1: 0.6079
 epoch: 11, train_loss: 0.6289, test_loss: 0.9655, test_f1: 0.6411
 epoch: 12, train_loss: 0.6039, test_loss: 1.1244, test_f1: 0.5809
 epoch: 13, train_loss: 0.6042, test_loss: 1.0087, test_f1: 0.6315
 epoch: 14, train_loss: 0.6028, test_loss: 1.3339, test_f1: 0.5330
 epoch: 15, train_loss: 0.5550, test_loss: 1.1181, test_f1: 0.6270
 epoch: 16, train_loss: 0.6024, test_loss: 1.0040, test_f1: 0.6560
 epoch: 17, train_loss: 0.5554, test_loss: 1.2604, test_f1: 0.5403
 epoch: 18, train_loss: 0.5132, test_loss: 1.1113, test_f1: 0.6042
 epoch: 19, train_loss: 0.5050, test_loss: 1.3749, test_f1: 0.5645
 epoch: 20, train_loss: 0.4798, test_loss: 1.1480, test_f1: 0.6131
 epoch: 21, train_loss: 0.4820, test_loss: 1.1362, test_f1: 0.6328
 epoch: 22, train_loss: 0.4556, test_loss: 1.0809, test_f1: 0.6549
 epoch: 23, train_loss: 0.5037, test_loss: 1.3103, test_f1: 0.5783
 epoch: 24, train_loss: 0.4502, test_loss: 1.2839, test_f1: 0.6051
 epoch: 25, train_loss: 0.4237, test_loss: 1.1170, test_f1: 0.6339
 epoch: 26, train_loss: 0.4130, test_loss: 1.1753, test_f1: 0.6219
 epoch: 27, train_loss: 0.3924, test_loss: 1.2562, test_f1: 0.6619
 epoch: 28, train_loss: 0.4009, test_loss: 1.3012, test_f1: 0.6798
 epoch: 29, train_loss: 0.3886, test_loss: 1.1837, test_f1: 0.6755
 epoch: 30, train_loss: 0.3994, test_loss: 1.2779, test_f1: 0.6410
 epoch: 31, train_loss: 0.3677, test_loss: 1.9060, test_f1: 0.6178
 epoch: 32, train_loss: 0.3993, test_loss: 1.5883, test_f1: 0.6127
 epoch: 33, train_loss: 0.3878, test_loss: 1.3365, test_f1: 0.6536
 epoch: 34, train_loss: 0.3779, test_loss: 1.2814, test_f1: 0.6449
 epoch: 35, train_loss: 0.3737, test_loss: 1.3255, test_f1: 0.6282
 epoch: 36, train_loss: 0.3694, test_loss: 1.5097, test_f1: 0.5861
 epoch: 37, train_loss: 0.3328, test_loss: 1.8124, test_f1: 0.6303
 epoch: 38, train_loss: 0.3091, test_loss: 1.5552, test_f1: 0.6298
 epoch: 39, train_loss: 0.3284, test_loss: 1.7187, test_f1: 0.5441
 epoch: 40, train_loss: 0.3100, test_loss: 1.4874, test_f1: 0.6330
 epoch: 41, train_loss: 0.3306, test_loss: 1.5029, test_f1: 0.6366
 epoch: 42, train_loss: 0.3065, test_loss: 1.5017, test_f1: 0.6184
 epoch: 43, train_loss: 0.2696, test_loss: 1.7034, test_f1: 0.6149
 epoch: 44, train_loss: 0.2549, test_loss: 1.7452, test_f1: 0.6118
 epoch: 45, train_loss: 0.2862, test_loss: 1.9538, test_f1: 0.5947
 epoch: 46, train_loss: 0.3113, test_loss: 1.6742, test_f1: 0.6446
 epoch: 47, train_loss: 0.2441, test_loss: 1.6734, test_f1: 0.6583
 epoch: 48, train_loss: 0.2794, test_loss: 1.5261, test_f1: 0.6740
 epoch: 49, train_loss: 0.2744, test_loss: 1.6964, test_f1: 0.6277
 epoch: 50, train_loss: 0.2420, test_loss: 1.8086, test_f1: 0.6496
 epoch: 51, train_loss: 0.2475, test_loss: 1.7414, test_f1: 0.6401
 epoch: 52, train_loss: 0.1975, test_loss: 1.8012, test_f1: 0.6610
 epoch: 53, train_loss: 0.2092, test_loss: 1.9836, test_f1: 0.6389
 epoch: 54, train_loss: 0.1811, test_loss: 2.1179, test_f1: 0.6372
 epoch: 55, train_loss: 0.1769, test_loss: 1.8604, test_f1: 0.6393
 epoch: 56, train_loss: 0.1795, test_loss: 2.2283, test_f1: 0.6035
 epoch: 57, train_loss: 0.1725, test_loss: 1.8695, test_f1: 0.6281
 epoch: 58, train_loss: 0.1666, test_loss: 2.2129, test_f1: 0.6412
 epoch: 59, train_loss: 0.1575, test_loss: 2.1532, test_f1: 0.6363
 epoch: 60, train_loss: 0.1541, test_loss: 2.2151, test_f1: 0.6509
 epoch: 61, train_loss: 0.1765, test_loss: 2.1725, test_f1: 0.6552
 epoch: 62, train_loss: 0.1636, test_loss: 2.1159, test_f1: 0.6256
 epoch: 63, train_loss: 0.1546, test_loss: 2.2291, test_f1: 0.6422
 epoch: 64, train_loss: 0.1533, test_loss: 2.0731, test_f1: 0.6370
 epoch: 65, train_loss: 0.1559, test_loss: 2.1861, test_f1: 0.6464
 epoch: 66, train_loss: 0.1490, test_loss: 2.2270, test_f1: 0.6299
 epoch: 67, train_loss: 0.1564, test_loss: 2.2079, test_f1: 0.6363
 epoch: 68, train_loss: 0.1603, test_loss: 2.2314, test_f1: 0.6409
 epoch: 69, train_loss: 0.1424, test_loss: 2.1435, test_f1: 0.6001
 epoch: 70, train_loss: 0.1530, test_loss: 2.2344, test_f1: 0.6147
 epoch: 71, train_loss: 0.1315, test_loss: 2.1387, test_f1: 0.6472
 epoch: 72, train_loss: 0.1420, test_loss: 2.0045, test_f1: 0.6451
 epoch: 73, train_loss: 0.2460, test_loss: 2.2576, test_f1: 0.6366
 epoch: 74, train_loss: 0.1676, test_loss: 2.5230, test_f1: 0.6033
 epoch: 75, train_loss: 0.1291, test_loss: 2.3504, test_f1: 0.6317
 epoch: 76, train_loss: 0.1304, test_loss: 2.5315, test_f1: 0.6375
 epoch: 77, train_loss: 0.1169, test_loss: 2.5571, test_f1: 0.6058
 epoch: 78, train_loss: 0.1195, test_loss: 2.5305, test_f1: 0.6161
 epoch: 79, train_loss: 0.1161, test_loss: 2.6202, test_f1: 0.6337
 epoch: 80, train_loss: 0.1038, test_loss: 2.7258, test_f1: 0.6157
 epoch: 81, train_loss: 0.1345, test_loss: 2.5080, test_f1: 0.6360
 epoch: 82, train_loss: 0.1243, test_loss: 2.4969, test_f1: 0.6496
 epoch: 83, train_loss: 0.1131, test_loss: 2.5433, test_f1: 0.6171
 epoch: 84, train_loss: 0.1206, test_loss: 2.8864, test_f1: 0.6270
 epoch: 85, train_loss: 0.1046, test_loss: 2.5379, test_f1: 0.6037
 epoch: 86, train_loss: 0.1082, test_loss: 2.4296, test_f1: 0.6452
 epoch: 87, train_loss: 0.1068, test_loss: 2.6234, test_f1: 0.6072
 epoch: 88, train_loss: 0.1041, test_loss: 2.4762, test_f1: 0.6470
 epoch: 89, train_loss: 0.1251, test_loss: 2.5189, test_f1: 0.6279
 epoch: 90, train_loss: 0.1043, test_loss: 2.5220, test_f1: 0.6420
 epoch: 91, train_loss: 0.1208, test_loss: 2.8153, test_f1: 0.6269
 epoch: 92, train_loss: 0.1112, test_loss: 2.6624, test_f1: 0.6174
 epoch: 93, train_loss: 0.1115, test_loss: 2.6704, test_f1: 0.6183
 epoch: 94, train_loss: 0.1117, test_loss: 2.5652, test_f1: 0.6089
 epoch: 95, train_loss: 0.0819, test_loss: 2.6423, test_f1: 0.6240
 epoch: 96, train_loss: 0.1000, test_loss: 2.7653, test_f1: 0.6223
 epoch: 97, train_loss: 0.1011, test_loss: 2.6283, test_f1: 0.6253
 epoch: 98, train_loss: 0.1119, test_loss: 2.8298, test_f1: 0.6144
 epoch: 99, train_loss: 0.1099, test_loss: 2.6788, test_f1: 0.6069
##################ITERATION #4 ****************************************
 epoch: 0, train_loss: 1.2573, test_loss: 1.4453, test_f1: 0.1526
 epoch: 1, train_loss: 1.0039, test_loss: 1.3980, test_f1: 0.3596
 epoch: 2, train_loss: 0.9379, test_loss: 1.3497, test_f1: 0.3403
 epoch: 3, train_loss: 0.8713, test_loss: 1.3076, test_f1: 0.4130
 epoch: 4, train_loss: 0.8115, test_loss: 1.1794, test_f1: 0.5216
 epoch: 5, train_loss: 0.7874, test_loss: 1.0927, test_f1: 0.5674
 epoch: 6, train_loss: 0.7427, test_loss: 1.0964, test_f1: 0.5637
 epoch: 7, train_loss: 0.7205, test_loss: 0.9832, test_f1: 0.6018
 epoch: 8, train_loss: 0.7055, test_loss: 0.9654, test_f1: 0.6249
 epoch: 9, train_loss: 0.6714, test_loss: 1.0579, test_f1: 0.5743
 epoch: 10, train_loss: 0.6399, test_loss: 1.1090, test_f1: 0.4979
 epoch: 11, train_loss: 0.6320, test_loss: 1.1142, test_f1: 0.5711
 epoch: 12, train_loss: 0.6088, test_loss: 1.0004, test_f1: 0.6214
 epoch: 13, train_loss: 0.5872, test_loss: 1.0345, test_f1: 0.6007
 epoch: 14, train_loss: 0.5873, test_loss: 1.0623, test_f1: 0.6128
 epoch: 15, train_loss: 0.5630, test_loss: 1.1752, test_f1: 0.5948
 epoch: 16, train_loss: 0.5309, test_loss: 1.0560, test_f1: 0.6005
 epoch: 17, train_loss: 0.5069, test_loss: 1.3864, test_f1: 0.5457
 epoch: 18, train_loss: 0.4987, test_loss: 1.2071, test_f1: 0.6093
 epoch: 19, train_loss: 0.4793, test_loss: 1.3209, test_f1: 0.5780
 epoch: 20, train_loss: 0.4835, test_loss: 1.4373, test_f1: 0.5718
 epoch: 21, train_loss: 0.4683, test_loss: 1.0890, test_f1: 0.6385
 epoch: 22, train_loss: 0.4408, test_loss: 1.4780, test_f1: 0.5635
 epoch: 23, train_loss: 0.4419, test_loss: 1.3359, test_f1: 0.6511
 epoch: 24, train_loss: 0.4097, test_loss: 1.3139, test_f1: 0.6382
 epoch: 25, train_loss: 0.4214, test_loss: 1.4907, test_f1: 0.6005
 epoch: 26, train_loss: 0.4125, test_loss: 1.2874, test_f1: 0.6359
 epoch: 27, train_loss: 0.3930, test_loss: 1.4116, test_f1: 0.6003
 epoch: 28, train_loss: 0.3695, test_loss: 1.6281, test_f1: 0.5692
 epoch: 29, train_loss: 0.3827, test_loss: 1.5583, test_f1: 0.5695
 epoch: 30, train_loss: 0.3383, test_loss: 1.5838, test_f1: 0.6313
 epoch: 31, train_loss: 0.4045, test_loss: 1.5977, test_f1: 0.5743
 epoch: 32, train_loss: 0.3825, test_loss: 1.5467, test_f1: 0.6205
 epoch: 33, train_loss: 0.3442, test_loss: 1.9332, test_f1: 0.5460
 epoch: 34, train_loss: 0.3259, test_loss: 1.5418, test_f1: 0.6218
 epoch: 35, train_loss: 0.3223, test_loss: 1.7988, test_f1: 0.6402
 epoch: 36, train_loss: 0.3074, test_loss: 1.5180, test_f1: 0.6340
 epoch: 37, train_loss: 0.2973, test_loss: 1.6157, test_f1: 0.6029
 epoch: 38, train_loss: 0.3104, test_loss: 2.0389, test_f1: 0.6106
 epoch: 39, train_loss: 0.3250, test_loss: 2.1776, test_f1: 0.5865
 epoch: 40, train_loss: 0.3010, test_loss: 2.0206, test_f1: 0.6168
 epoch: 41, train_loss: 0.2923, test_loss: 1.8218, test_f1: 0.5846
 epoch: 42, train_loss: 0.3084, test_loss: 1.5355, test_f1: 0.6236
 epoch: 43, train_loss: 0.2746, test_loss: 1.6885, test_f1: 0.6061
 epoch: 44, train_loss: 0.2508, test_loss: 1.7087, test_f1: 0.6418
 epoch: 45, train_loss: 0.2351, test_loss: 1.8347, test_f1: 0.6556
 epoch: 46, train_loss: 0.2828, test_loss: 2.1561, test_f1: 0.5920
 epoch: 47, train_loss: 0.2885, test_loss: 2.0803, test_f1: 0.5973
 epoch: 48, train_loss: 0.2938, test_loss: 1.9994, test_f1: 0.6052
 epoch: 49, train_loss: 0.2395, test_loss: 1.9832, test_f1: 0.6020
 epoch: 50, train_loss: 0.2474, test_loss: 2.0702, test_f1: 0.5822
 epoch: 51, train_loss: 0.2215, test_loss: 1.9150, test_f1: 0.6385
 epoch: 52, train_loss: 0.1941, test_loss: 1.8860, test_f1: 0.6509
 epoch: 53, train_loss: 0.1733, test_loss: 2.0455, test_f1: 0.6443
 epoch: 54, train_loss: 0.1781, test_loss: 2.1852, test_f1: 0.6273
 epoch: 55, train_loss: 0.1455, test_loss: 2.0823, test_f1: 0.6248
 epoch: 56, train_loss: 0.1630, test_loss: 2.1744, test_f1: 0.6261
 epoch: 57, train_loss: 0.1513, test_loss: 2.2406, test_f1: 0.6289
 epoch: 58, train_loss: 0.1372, test_loss: 2.2262, test_f1: 0.6384
 epoch: 59, train_loss: 0.1595, test_loss: 2.1869, test_f1: 0.6123
 epoch: 60, train_loss: 0.1481, test_loss: 2.4012, test_f1: 0.6273
 epoch: 61, train_loss: 0.1378, test_loss: 2.3899, test_f1: 0.6251
 epoch: 62, train_loss: 0.1302, test_loss: 2.5268, test_f1: 0.6247
 epoch: 63, train_loss: 0.1378, test_loss: 2.3509, test_f1: 0.6230
 epoch: 64, train_loss: 0.1431, test_loss: 2.3898, test_f1: 0.6314
 epoch: 65, train_loss: 0.1578, test_loss: 2.4261, test_f1: 0.6174
 epoch: 66, train_loss: 0.1304, test_loss: 2.5303, test_f1: 0.6005
 epoch: 67, train_loss: 0.1282, test_loss: 2.7270, test_f1: 0.6077
 epoch: 68, train_loss: 0.1539, test_loss: 2.2916, test_f1: 0.6112
 epoch: 69, train_loss: 0.1533, test_loss: 2.6075, test_f1: 0.6159
 epoch: 70, train_loss: 0.1554, test_loss: 2.5002, test_f1: 0.6088
 epoch: 71, train_loss: 0.1207, test_loss: 2.5984, test_f1: 0.6357
 epoch: 72, train_loss: 0.1245, test_loss: 2.4371, test_f1: 0.6224
 epoch: 73, train_loss: 0.1293, test_loss: 2.5217, test_f1: 0.6208
 epoch: 74, train_loss: 0.1248, test_loss: 2.4844, test_f1: 0.6288
 epoch: 75, train_loss: 0.1126, test_loss: 2.6783, test_f1: 0.6090
 epoch: 76, train_loss: 0.1040, test_loss: 2.9704, test_f1: 0.6231
 epoch: 77, train_loss: 0.1015, test_loss: 2.5916, test_f1: 0.6317
 epoch: 78, train_loss: 0.1046, test_loss: 2.7073, test_f1: 0.6246
 epoch: 79, train_loss: 0.1120, test_loss: 2.8798, test_f1: 0.6025
 epoch: 80, train_loss: 0.1006, test_loss: 2.9787, test_f1: 0.6192
 epoch: 81, train_loss: 0.1094, test_loss: 2.7211, test_f1: 0.6153
 epoch: 82, train_loss: 0.1127, test_loss: 2.6698, test_f1: 0.6321
 epoch: 83, train_loss: 0.1460, test_loss: 2.8364, test_f1: 0.6092
 epoch: 84, train_loss: 0.1454, test_loss: 3.0682, test_f1: 0.6294
 epoch: 85, train_loss: 0.1240, test_loss: 2.8857, test_f1: 0.6205
 epoch: 86, train_loss: 0.1120, test_loss: 2.6302, test_f1: 0.6203
 epoch: 87, train_loss: 0.0940, test_loss: 2.7411, test_f1: 0.6096
 epoch: 88, train_loss: 0.0769, test_loss: 2.8448, test_f1: 0.6128
 epoch: 89, train_loss: 0.0928, test_loss: 2.7893, test_f1: 0.6299
 epoch: 90, train_loss: 0.0987, test_loss: 2.8372, test_f1: 0.6354
 epoch: 91, train_loss: 0.1150, test_loss: 2.8529, test_f1: 0.6138
 epoch: 92, train_loss: 0.1341, test_loss: 2.9709, test_f1: 0.6242
 epoch: 93, train_loss: 0.1016, test_loss: 2.9765, test_f1: 0.6216
 epoch: 94, train_loss: 0.1252, test_loss: 3.0414, test_f1: 0.5969
 epoch: 95, train_loss: 0.1033, test_loss: 3.0337, test_f1: 0.5806
 epoch: 96, train_loss: 0.1264, test_loss: 2.8973, test_f1: 0.6067
 epoch: 97, train_loss: 0.1438, test_loss: 2.6773, test_f1: 0.6180
 epoch: 98, train_loss: 0.1517, test_loss: 2.7362, test_f1: 0.6273
 epoch: 99, train_loss: 0.1158, test_loss: 2.9703, test_f1: 0.6148
##################ITERATION #5 ****************************************
 epoch: 0, train_loss: 1.2568, test_loss: 1.4669, test_f1: 0.2373
 epoch: 1, train_loss: 1.0221, test_loss: 1.4008, test_f1: 0.3461
 epoch: 2, train_loss: 0.9166, test_loss: 1.3608, test_f1: 0.3602
 epoch: 3, train_loss: 0.8675, test_loss: 1.1668, test_f1: 0.4921
 epoch: 4, train_loss: 0.8000, test_loss: 1.0817, test_f1: 0.5562
 epoch: 5, train_loss: 0.7728, test_loss: 1.0702, test_f1: 0.5991
 epoch: 6, train_loss: 0.7772, test_loss: 1.0539, test_f1: 0.5532
 epoch: 7, train_loss: 0.7264, test_loss: 1.1549, test_f1: 0.5834
 epoch: 8, train_loss: 0.7068, test_loss: 1.0748, test_f1: 0.5641
 epoch: 9, train_loss: 0.7072, test_loss: 1.2666, test_f1: 0.5316
 epoch: 10, train_loss: 0.6643, test_loss: 1.1001, test_f1: 0.5427
 epoch: 11, train_loss: 0.6405, test_loss: 1.0455, test_f1: 0.6008
 epoch: 12, train_loss: 0.6174, test_loss: 1.3104, test_f1: 0.5550
 epoch: 13, train_loss: 0.6007, test_loss: 1.1155, test_f1: 0.5791
 epoch: 14, train_loss: 0.6038, test_loss: 1.1957, test_f1: 0.5443
 epoch: 15, train_loss: 0.5803, test_loss: 1.0597, test_f1: 0.6410
 epoch: 16, train_loss: 0.5601, test_loss: 1.1444, test_f1: 0.6191
 epoch: 17, train_loss: 0.5489, test_loss: 1.0890, test_f1: 0.6492
 epoch: 18, train_loss: 0.5256, test_loss: 1.3087, test_f1: 0.6314
 epoch: 19, train_loss: 0.5151, test_loss: 1.2142, test_f1: 0.6038
 epoch: 20, train_loss: 0.4951, test_loss: 1.1775, test_f1: 0.6139
 epoch: 21, train_loss: 0.5073, test_loss: 1.4098, test_f1: 0.5883
 epoch: 22, train_loss: 0.4623, test_loss: 1.3681, test_f1: 0.6328
 epoch: 23, train_loss: 0.4602, test_loss: 1.7239, test_f1: 0.5736
 epoch: 24, train_loss: 0.4474, test_loss: 1.4187, test_f1: 0.6225
 epoch: 25, train_loss: 0.4131, test_loss: 1.3605, test_f1: 0.5835
 epoch: 26, train_loss: 0.4238, test_loss: 1.6452, test_f1: 0.5902
 epoch: 27, train_loss: 0.4142, test_loss: 1.6208, test_f1: 0.6095
 epoch: 28, train_loss: 0.3869, test_loss: 1.5493, test_f1: 0.6199
 epoch: 29, train_loss: 0.3518, test_loss: 1.6354, test_f1: 0.6425
 epoch: 30, train_loss: 0.3502, test_loss: 1.8051, test_f1: 0.5895
 epoch: 31, train_loss: 0.3736, test_loss: 1.4379, test_f1: 0.6503
 epoch: 32, train_loss: 0.3930, test_loss: 1.5634, test_f1: 0.6290
 epoch: 33, train_loss: 0.3418, test_loss: 1.7831, test_f1: 0.5959
 epoch: 34, train_loss: 0.3436, test_loss: 1.8686, test_f1: 0.6219
 epoch: 35, train_loss: 0.3471, test_loss: 1.9135, test_f1: 0.6153
 epoch: 36, train_loss: 0.3851, test_loss: 1.9880, test_f1: 0.6034
 epoch: 37, train_loss: 0.3278, test_loss: 1.5825, test_f1: 0.6127
 epoch: 38, train_loss: 0.3079, test_loss: 1.9624, test_f1: 0.6221
 epoch: 39, train_loss: 0.3293, test_loss: 1.9597, test_f1: 0.6014
 epoch: 40, train_loss: 0.3035, test_loss: 2.0294, test_f1: 0.5651
 epoch: 41, train_loss: 0.3130, test_loss: 2.1449, test_f1: 0.6189
 epoch: 42, train_loss: 0.3053, test_loss: 2.2391, test_f1: 0.5797
 epoch: 43, train_loss: 0.2765, test_loss: 1.7542, test_f1: 0.6090
 epoch: 44, train_loss: 0.3251, test_loss: 2.0354, test_f1: 0.6055
 epoch: 45, train_loss: 0.2925, test_loss: 1.8377, test_f1: 0.5944
 epoch: 46, train_loss: 0.2759, test_loss: 1.5869, test_f1: 0.6397
 epoch: 47, train_loss: 0.2479, test_loss: 1.6994, test_f1: 0.6495
 epoch: 48, train_loss: 0.2374, test_loss: 2.1392, test_f1: 0.5952
 epoch: 49, train_loss: 0.2190, test_loss: 1.8884, test_f1: 0.6382
 epoch: 50, train_loss: 0.2524, test_loss: 2.4293, test_f1: 0.5707
 epoch: 51, train_loss: 0.2422, test_loss: 2.0598, test_f1: 0.6220
 epoch: 52, train_loss: 0.1991, test_loss: 2.0370, test_f1: 0.6454
 epoch: 53, train_loss: 0.1809, test_loss: 2.0667, test_f1: 0.6334
 epoch: 54, train_loss: 0.1771, test_loss: 2.1226, test_f1: 0.6348
 epoch: 55, train_loss: 0.1628, test_loss: 2.2715, test_f1: 0.6366
 epoch: 56, train_loss: 0.1712, test_loss: 2.1479, test_f1: 0.6405
 epoch: 57, train_loss: 0.1612, test_loss: 2.2139, test_f1: 0.6334
 epoch: 58, train_loss: 0.1495, test_loss: 2.2173, test_f1: 0.6439
 epoch: 59, train_loss: 0.1323, test_loss: 2.6029, test_f1: 0.6214
 epoch: 60, train_loss: 0.1521, test_loss: 2.4072, test_f1: 0.6269
 epoch: 61, train_loss: 0.1429, test_loss: 2.3456, test_f1: 0.6280
 epoch: 62, train_loss: 0.1347, test_loss: 2.4522, test_f1: 0.6305
 epoch: 63, train_loss: 0.1683, test_loss: 2.2823, test_f1: 0.6252
 epoch: 64, train_loss: 0.1285, test_loss: 2.4499, test_f1: 0.6182
 epoch: 65, train_loss: 0.1580, test_loss: 2.4961, test_f1: 0.5866
 epoch: 66, train_loss: 0.1678, test_loss: 2.4786, test_f1: 0.5902
 epoch: 67, train_loss: 0.1390, test_loss: 2.6384, test_f1: 0.6136
 epoch: 68, train_loss: 0.1099, test_loss: 2.5191, test_f1: 0.6456
 epoch: 69, train_loss: 0.1333, test_loss: 2.4963, test_f1: 0.6166
 epoch: 70, train_loss: 0.1156, test_loss: 2.6071, test_f1: 0.6328
 epoch: 71, train_loss: 0.1049, test_loss: 2.5807, test_f1: 0.6339
 epoch: 72, train_loss: 0.1096, test_loss: 2.5551, test_f1: 0.6209
 epoch: 73, train_loss: 0.1327, test_loss: 2.6671, test_f1: 0.6332
 epoch: 74, train_loss: 0.1153, test_loss: 2.9589, test_f1: 0.6123
 epoch: 75, train_loss: 0.1273, test_loss: 2.9216, test_f1: 0.6248
 epoch: 76, train_loss: 0.1090, test_loss: 2.7447, test_f1: 0.6405
 epoch: 77, train_loss: 0.1074, test_loss: 2.6373, test_f1: 0.6468
 epoch: 78, train_loss: 0.1210, test_loss: 2.5796, test_f1: 0.6405
 epoch: 79, train_loss: 0.1163, test_loss: 2.6847, test_f1: 0.6158
 epoch: 80, train_loss: 0.1184, test_loss: 2.6745, test_f1: 0.6395
 epoch: 81, train_loss: 0.1039, test_loss: 3.0691, test_f1: 0.6203
 epoch: 82, train_loss: 0.1131, test_loss: 2.9554, test_f1: 0.6192
 epoch: 83, train_loss: 0.0953, test_loss: 2.8797, test_f1: 0.6141
 epoch: 84, train_loss: 0.1241, test_loss: 2.7218, test_f1: 0.6194
 epoch: 85, train_loss: 0.1008, test_loss: 2.8450, test_f1: 0.6319
 epoch: 86, train_loss: 0.0881, test_loss: 2.8838, test_f1: 0.6241
 epoch: 87, train_loss: 0.1015, test_loss: 2.9102, test_f1: 0.6481
 epoch: 88, train_loss: 0.0714, test_loss: 3.1538, test_f1: 0.6139
 epoch: 89, train_loss: 0.0866, test_loss: 3.0989, test_f1: 0.6190
 epoch: 90, train_loss: 0.1055, test_loss: 3.1075, test_f1: 0.6289
 epoch: 91, train_loss: 0.1419, test_loss: 3.3377, test_f1: 0.6011
 epoch: 92, train_loss: 0.1079, test_loss: 2.9071, test_f1: 0.6398
 epoch: 93, train_loss: 0.1184, test_loss: 2.9388, test_f1: 0.6304
 epoch: 94, train_loss: 0.0843, test_loss: 2.9794, test_f1: 0.6121
 epoch: 95, train_loss: 0.0992, test_loss: 3.1726, test_f1: 0.6335
 epoch: 96, train_loss: 0.0916, test_loss: 3.2588, test_f1: 0.6109
 epoch: 97, train_loss: 0.0909, test_loss: 3.3827, test_f1: 0.6286
 epoch: 98, train_loss: 0.1076, test_loss: 3.3790, test_f1: 0.6224
 epoch: 99, train_loss: 0.0864, test_loss: 3.1832, test_f1: 0.6063
##################ITERATION #6 ****************************************
 epoch: 0, train_loss: 1.2761, test_loss: 1.4791, test_f1: 0.1365
 epoch: 1, train_loss: 1.0058, test_loss: 1.3706, test_f1: 0.2423
 epoch: 2, train_loss: 0.9357, test_loss: 1.2337, test_f1: 0.3394
 epoch: 3, train_loss: 0.8765, test_loss: 1.0745, test_f1: 0.5085
 epoch: 4, train_loss: 0.8243, test_loss: 1.0199, test_f1: 0.5788
 epoch: 5, train_loss: 0.8144, test_loss: 1.0524, test_f1: 0.5701
 epoch: 6, train_loss: 0.7681, test_loss: 0.9817, test_f1: 0.6148
 epoch: 7, train_loss: 0.7434, test_loss: 1.0185, test_f1: 0.6315
 epoch: 8, train_loss: 0.7147, test_loss: 0.9867, test_f1: 0.6295
 epoch: 9, train_loss: 0.6857, test_loss: 0.9690, test_f1: 0.6333
 epoch: 10, train_loss: 0.6716, test_loss: 0.9873, test_f1: 0.6212
 epoch: 11, train_loss: 0.6644, test_loss: 1.2603, test_f1: 0.5110
 epoch: 12, train_loss: 0.6366, test_loss: 1.0614, test_f1: 0.6308
 epoch: 13, train_loss: 0.6120, test_loss: 1.0529, test_f1: 0.6139
 epoch: 14, train_loss: 0.6091, test_loss: 1.0894, test_f1: 0.5693
 epoch: 15, train_loss: 0.5821, test_loss: 1.1578, test_f1: 0.5840
 epoch: 16, train_loss: 0.5919, test_loss: 1.5237, test_f1: 0.5049
 epoch: 17, train_loss: 0.5681, test_loss: 1.1295, test_f1: 0.6253
 epoch: 18, train_loss: 0.5254, test_loss: 1.0775, test_f1: 0.6169
 epoch: 19, train_loss: 0.5364, test_loss: 1.1102, test_f1: 0.6328
 epoch: 20, train_loss: 0.5354, test_loss: 1.1235, test_f1: 0.6035
 epoch: 21, train_loss: 0.5017, test_loss: 1.1895, test_f1: 0.5941
 epoch: 22, train_loss: 0.5402, test_loss: 1.1476, test_f1: 0.5799
 epoch: 23, train_loss: 0.5043, test_loss: 1.1411, test_f1: 0.6051
 epoch: 24, train_loss: 0.4582, test_loss: 1.3473, test_f1: 0.6193
 epoch: 25, train_loss: 0.4723, test_loss: 1.3820, test_f1: 0.5826
 epoch: 26, train_loss: 0.4455, test_loss: 1.2736, test_f1: 0.6210
 epoch: 27, train_loss: 0.4233, test_loss: 1.2972, test_f1: 0.5704
 epoch: 28, train_loss: 0.4241, test_loss: 1.2622, test_f1: 0.5869
 epoch: 29, train_loss: 0.4015, test_loss: 1.3083, test_f1: 0.6306
 epoch: 30, train_loss: 0.3919, test_loss: 1.3513, test_f1: 0.6280
 epoch: 31, train_loss: 0.3806, test_loss: 1.5391, test_f1: 0.6233
 epoch: 32, train_loss: 0.3922, test_loss: 1.3817, test_f1: 0.6199
 epoch: 33, train_loss: 0.3990, test_loss: 1.4188, test_f1: 0.5882
 epoch: 34, train_loss: 0.3863, test_loss: 1.5742, test_f1: 0.6116
 epoch: 35, train_loss: 0.3609, test_loss: 1.4356, test_f1: 0.6415
 epoch: 36, train_loss: 0.3445, test_loss: 1.3441, test_f1: 0.6693
 epoch: 37, train_loss: 0.3719, test_loss: 1.6584, test_f1: 0.5470
 epoch: 38, train_loss: 0.3670, test_loss: 1.3926, test_f1: 0.6155
 epoch: 39, train_loss: 0.3667, test_loss: 1.5337, test_f1: 0.6397
 epoch: 40, train_loss: 0.3473, test_loss: 1.4889, test_f1: 0.5999
 epoch: 41, train_loss: 0.3086, test_loss: 1.4835, test_f1: 0.5972
 epoch: 42, train_loss: 0.3282, test_loss: 1.7187, test_f1: 0.5592
 epoch: 43, train_loss: 0.3525, test_loss: 1.3953, test_f1: 0.6532
 epoch: 44, train_loss: 0.2903, test_loss: 1.4096, test_f1: 0.6147
 epoch: 45, train_loss: 0.2541, test_loss: 1.5509, test_f1: 0.6135
 epoch: 46, train_loss: 0.2550, test_loss: 1.5736, test_f1: 0.6423
 epoch: 47, train_loss: 0.2783, test_loss: 1.6542, test_f1: 0.6485
 epoch: 48, train_loss: 0.2893, test_loss: 1.7678, test_f1: 0.6320
 epoch: 49, train_loss: 0.2908, test_loss: 2.2819, test_f1: 0.4674
 epoch: 50, train_loss: 0.2935, test_loss: 1.6912, test_f1: 0.6603
 epoch: 51, train_loss: 0.2530, test_loss: 1.6306, test_f1: 0.6445
 epoch: 52, train_loss: 0.2110, test_loss: 1.7257, test_f1: 0.6331
 epoch: 53, train_loss: 0.1752, test_loss: 1.7310, test_f1: 0.6227
 epoch: 54, train_loss: 0.1842, test_loss: 1.6900, test_f1: 0.6521
 epoch: 55, train_loss: 0.1788, test_loss: 1.8142, test_f1: 0.6274
 epoch: 56, train_loss: 0.1758, test_loss: 1.7328, test_f1: 0.6361
 epoch: 57, train_loss: 0.1777, test_loss: 1.7856, test_f1: 0.6451
 epoch: 58, train_loss: 0.1498, test_loss: 1.8143, test_f1: 0.6480
 epoch: 59, train_loss: 0.1556, test_loss: 1.7825, test_f1: 0.6417
 epoch: 60, train_loss: 0.1593, test_loss: 1.8989, test_f1: 0.6253
 epoch: 61, train_loss: 0.1499, test_loss: 1.8832, test_f1: 0.6542
 epoch: 62, train_loss: 0.1504, test_loss: 1.9322, test_f1: 0.6261
 epoch: 63, train_loss: 0.1926, test_loss: 1.9166, test_f1: 0.6595
 epoch: 64, train_loss: 0.1832, test_loss: 1.7256, test_f1: 0.6479
 epoch: 65, train_loss: 0.1736, test_loss: 1.8012, test_f1: 0.6290
 epoch: 66, train_loss: 0.1417, test_loss: 2.0202, test_f1: 0.6230
 epoch: 67, train_loss: 0.1798, test_loss: 1.8415, test_f1: 0.6369
 epoch: 68, train_loss: 0.1580, test_loss: 1.8243, test_f1: 0.6393
 epoch: 69, train_loss: 0.1443, test_loss: 1.8070, test_f1: 0.6519
 epoch: 70, train_loss: 0.1441, test_loss: 1.9746, test_f1: 0.6048
 epoch: 71, train_loss: 0.1439, test_loss: 1.9684, test_f1: 0.6328
 epoch: 72, train_loss: 0.1457, test_loss: 1.8957, test_f1: 0.6278
 epoch: 73, train_loss: 0.1415, test_loss: 1.9597, test_f1: 0.6508
 epoch: 74, train_loss: 0.1328, test_loss: 1.9940, test_f1: 0.6362
 epoch: 75, train_loss: 0.1292, test_loss: 2.1651, test_f1: 0.6161
 epoch: 76, train_loss: 0.1326, test_loss: 2.2742, test_f1: 0.6303
 epoch: 77, train_loss: 0.1166, test_loss: 2.2189, test_f1: 0.6215
 epoch: 78, train_loss: 0.1215, test_loss: 2.1950, test_f1: 0.6313
 epoch: 79, train_loss: 0.1217, test_loss: 2.2542, test_f1: 0.6119
 epoch: 80, train_loss: 0.1325, test_loss: 2.0271, test_f1: 0.6440
 epoch: 81, train_loss: 0.1381, test_loss: 2.2808, test_f1: 0.6156
 epoch: 82, train_loss: 0.1368, test_loss: 1.9692, test_f1: 0.6273
 epoch: 83, train_loss: 0.1383, test_loss: 1.9674, test_f1: 0.6293
 epoch: 84, train_loss: 0.1032, test_loss: 2.0526, test_f1: 0.6391
 epoch: 85, train_loss: 0.1155, test_loss: 2.1594, test_f1: 0.6306
 epoch: 86, train_loss: 0.1123, test_loss: 2.1769, test_f1: 0.6176
 epoch: 87, train_loss: 0.1018, test_loss: 2.2114, test_f1: 0.6367
 epoch: 88, train_loss: 0.0997, test_loss: 2.4562, test_f1: 0.6310
 epoch: 89, train_loss: 0.1161, test_loss: 2.2684, test_f1: 0.6519
 epoch: 90, train_loss: 0.1053, test_loss: 2.2468, test_f1: 0.6094
 epoch: 91, train_loss: 0.1018, test_loss: 2.2748, test_f1: 0.6347
 epoch: 92, train_loss: 0.0907, test_loss: 2.2903, test_f1: 0.6093
 epoch: 93, train_loss: 0.1449, test_loss: 2.2487, test_f1: 0.6283
 epoch: 94, train_loss: 0.1515, test_loss: 2.4618, test_f1: 0.6303
 epoch: 95, train_loss: 0.1712, test_loss: 2.3808, test_f1: 0.6240
 epoch: 96, train_loss: 0.1274, test_loss: 2.3102, test_f1: 0.6387
 epoch: 97, train_loss: 0.0920, test_loss: 2.4194, test_f1: 0.6349
 epoch: 98, train_loss: 0.0898, test_loss: 2.3937, test_f1: 0.6279
 epoch: 99, train_loss: 0.0771, test_loss: 2.4043, test_f1: 0.6167
##################ITERATION #7 ****************************************
 epoch: 0, train_loss: 1.3867, test_loss: 1.4708, test_f1: 0.2544
 epoch: 1, train_loss: 1.0461, test_loss: 1.3139, test_f1: 0.2852
 epoch: 2, train_loss: 0.9519, test_loss: 1.2256, test_f1: 0.4414
 epoch: 3, train_loss: 0.8908, test_loss: 1.1035, test_f1: 0.5234
 epoch: 4, train_loss: 0.8220, test_loss: 0.9825, test_f1: 0.5621
 epoch: 5, train_loss: 0.7998, test_loss: 1.0534, test_f1: 0.5306
 epoch: 6, train_loss: 0.7821, test_loss: 0.9919, test_f1: 0.6123
 epoch: 7, train_loss: 0.7601, test_loss: 1.0071, test_f1: 0.5877
 epoch: 8, train_loss: 0.7347, test_loss: 1.0372, test_f1: 0.5655
 epoch: 9, train_loss: 0.7016, test_loss: 1.0413, test_f1: 0.5584
 epoch: 10, train_loss: 0.6966, test_loss: 0.9696, test_f1: 0.5967
 epoch: 11, train_loss: 0.6454, test_loss: 0.9587, test_f1: 0.5937
 epoch: 12, train_loss: 0.6869, test_loss: 0.9706, test_f1: 0.5914
 epoch: 13, train_loss: 0.6139, test_loss: 1.1238, test_f1: 0.5643
 epoch: 14, train_loss: 0.6105, test_loss: 0.9881, test_f1: 0.5825
 epoch: 15, train_loss: 0.5763, test_loss: 0.9933, test_f1: 0.6044
 epoch: 16, train_loss: 0.5810, test_loss: 1.2255, test_f1: 0.5972
 epoch: 17, train_loss: 0.5741, test_loss: 1.2801, test_f1: 0.5799
 epoch: 18, train_loss: 0.5931, test_loss: 1.1961, test_f1: 0.5295
 epoch: 19, train_loss: 0.5562, test_loss: 1.3028, test_f1: 0.6258
 epoch: 20, train_loss: 0.5371, test_loss: 1.1202, test_f1: 0.5966
 epoch: 21, train_loss: 0.5353, test_loss: 1.2961, test_f1: 0.5902
 epoch: 22, train_loss: 0.5673, test_loss: 1.5314, test_f1: 0.6067
 epoch: 23, train_loss: 0.5610, test_loss: 1.4400, test_f1: 0.6049
 epoch: 24, train_loss: 0.5093, test_loss: 1.2888, test_f1: 0.5854
 epoch: 25, train_loss: 0.5043, test_loss: 1.0823, test_f1: 0.6216
 epoch: 26, train_loss: 0.4804, test_loss: 1.2751, test_f1: 0.6109
 epoch: 27, train_loss: 0.4912, test_loss: 1.2162, test_f1: 0.6239
 epoch: 28, train_loss: 0.4495, test_loss: 1.3226, test_f1: 0.5990
 epoch: 29, train_loss: 0.4678, test_loss: 1.2425, test_f1: 0.6175
 epoch: 30, train_loss: 0.4382, test_loss: 1.3898, test_f1: 0.5885
 epoch: 31, train_loss: 0.4291, test_loss: 1.4165, test_f1: 0.6421
 epoch: 32, train_loss: 0.4120, test_loss: 1.4465, test_f1: 0.6428
 epoch: 33, train_loss: 0.4206, test_loss: 1.3384, test_f1: 0.6480
 epoch: 34, train_loss: 0.3742, test_loss: 1.6057, test_f1: 0.6140
 epoch: 35, train_loss: 0.4424, test_loss: 1.2604, test_f1: 0.6612
 epoch: 36, train_loss: 0.3985, test_loss: 1.1929, test_f1: 0.6355
 epoch: 37, train_loss: 0.3635, test_loss: 1.4056, test_f1: 0.6098
 epoch: 38, train_loss: 0.3719, test_loss: 1.4884, test_f1: 0.5764
 epoch: 39, train_loss: 0.3840, test_loss: 1.4303, test_f1: 0.5759
 epoch: 40, train_loss: 0.3455, test_loss: 1.4542, test_f1: 0.6100
 epoch: 41, train_loss: 0.3412, test_loss: 1.4973, test_f1: 0.6006
 epoch: 42, train_loss: 0.3636, test_loss: 1.7370, test_f1: 0.5715
 epoch: 43, train_loss: 0.3415, test_loss: 1.8752, test_f1: 0.5647
 epoch: 44, train_loss: 0.3327, test_loss: 1.6869, test_f1: 0.6658
 epoch: 45, train_loss: 0.3246, test_loss: 1.6545, test_f1: 0.5461
 epoch: 46, train_loss: 0.2970, test_loss: 1.9329, test_f1: 0.6071
 epoch: 47, train_loss: 0.2970, test_loss: 1.8019, test_f1: 0.6041
 epoch: 48, train_loss: 0.3254, test_loss: 1.5441, test_f1: 0.5813
 epoch: 49, train_loss: 0.3085, test_loss: 1.6783, test_f1: 0.6154
 epoch: 50, train_loss: 0.2910, test_loss: 1.9149, test_f1: 0.6182
 epoch: 51, train_loss: 0.2578, test_loss: 1.6951, test_f1: 0.6527
 epoch: 52, train_loss: 0.2283, test_loss: 1.8273, test_f1: 0.5961
 epoch: 53, train_loss: 0.2266, test_loss: 1.7104, test_f1: 0.6493
 epoch: 54, train_loss: 0.2079, test_loss: 1.6993, test_f1: 0.6623
 epoch: 55, train_loss: 0.1969, test_loss: 1.8211, test_f1: 0.6343
 epoch: 56, train_loss: 0.2098, test_loss: 1.7236, test_f1: 0.6251
 epoch: 57, train_loss: 0.1995, test_loss: 1.9226, test_f1: 0.6408
 epoch: 58, train_loss: 0.2116, test_loss: 1.8965, test_f1: 0.6249
 epoch: 59, train_loss: 0.2267, test_loss: 1.9477, test_f1: 0.6078
 epoch: 60, train_loss: 0.1879, test_loss: 2.2018, test_f1: 0.5877
 epoch: 61, train_loss: 0.1850, test_loss: 2.1488, test_f1: 0.6115
 epoch: 62, train_loss: 0.1720, test_loss: 2.1090, test_f1: 0.6203
 epoch: 63, train_loss: 0.1760, test_loss: 1.9145, test_f1: 0.6408
 epoch: 64, train_loss: 0.2066, test_loss: 1.9883, test_f1: 0.6364
 epoch: 65, train_loss: 0.1843, test_loss: 2.0083, test_f1: 0.6235
 epoch: 66, train_loss: 0.1756, test_loss: 1.9684, test_f1: 0.6133
 epoch: 67, train_loss: 0.1781, test_loss: 2.2297, test_f1: 0.6246
 epoch: 68, train_loss: 0.1586, test_loss: 2.2357, test_f1: 0.5932
 epoch: 69, train_loss: 0.1517, test_loss: 2.3024, test_f1: 0.6301
 epoch: 70, train_loss: 0.1771, test_loss: 2.2591, test_f1: 0.6052
 epoch: 71, train_loss: 0.1510, test_loss: 2.2367, test_f1: 0.6206
 epoch: 72, train_loss: 0.1656, test_loss: 2.3047, test_f1: 0.5932
 epoch: 73, train_loss: 0.1350, test_loss: 2.1119, test_f1: 0.6489
 epoch: 74, train_loss: 0.1402, test_loss: 2.2425, test_f1: 0.6210
 epoch: 75, train_loss: 0.1331, test_loss: 2.4191, test_f1: 0.6024
 epoch: 76, train_loss: 0.1495, test_loss: 2.5052, test_f1: 0.6215
 epoch: 77, train_loss: 0.1453, test_loss: 2.2207, test_f1: 0.6264
 epoch: 78, train_loss: 0.1489, test_loss: 2.2681, test_f1: 0.6091
 epoch: 79, train_loss: 0.1448, test_loss: 2.2515, test_f1: 0.6175
 epoch: 80, train_loss: 0.1222, test_loss: 2.3555, test_f1: 0.6230
 epoch: 81, train_loss: 0.1115, test_loss: 2.3450, test_f1: 0.6233
 epoch: 82, train_loss: 0.1164, test_loss: 2.3820, test_f1: 0.6288
 epoch: 83, train_loss: 0.1201, test_loss: 2.4439, test_f1: 0.6194
 epoch: 84, train_loss: 0.1585, test_loss: 2.3513, test_f1: 0.5984
 epoch: 85, train_loss: 0.1751, test_loss: 2.3626, test_f1: 0.6112
 epoch: 86, train_loss: 0.1555, test_loss: 2.2560, test_f1: 0.6038
 epoch: 87, train_loss: 0.1464, test_loss: 2.0927, test_f1: 0.5885
 epoch: 88, train_loss: 0.1421, test_loss: 2.3794, test_f1: 0.6085
 epoch: 89, train_loss: 0.1192, test_loss: 2.4226, test_f1: 0.6323
 epoch: 90, train_loss: 0.1128, test_loss: 2.5181, test_f1: 0.6157
 epoch: 91, train_loss: 0.1218, test_loss: 2.4451, test_f1: 0.6338
 epoch: 92, train_loss: 0.1341, test_loss: 2.2414, test_f1: 0.6342
 epoch: 93, train_loss: 0.1318, test_loss: 2.3259, test_f1: 0.6041
 epoch: 94, train_loss: 0.1654, test_loss: 2.5908, test_f1: 0.6035
 epoch: 95, train_loss: 0.1778, test_loss: 2.5063, test_f1: 0.6057
 epoch: 96, train_loss: 0.1597, test_loss: 2.4999, test_f1: 0.6040
 epoch: 97, train_loss: 0.1180, test_loss: 2.3604, test_f1: 0.6240
 epoch: 98, train_loss: 0.1063, test_loss: 2.3777, test_f1: 0.6031
 epoch: 99, train_loss: 0.1009, test_loss: 2.6267, test_f1: 0.5934
##################ITERATION #8 ****************************************
 epoch: 0, train_loss: 1.4655, test_loss: 1.3842, test_f1: 0.2469
 epoch: 1, train_loss: 1.0693, test_loss: 1.3535, test_f1: 0.2205
 epoch: 2, train_loss: 0.9570, test_loss: 1.1872, test_f1: 0.4751
 epoch: 3, train_loss: 0.8909, test_loss: 1.0938, test_f1: 0.5122
 epoch: 4, train_loss: 0.8573, test_loss: 1.0925, test_f1: 0.5381
 epoch: 5, train_loss: 0.8192, test_loss: 1.0552, test_f1: 0.4929
 epoch: 6, train_loss: 0.7530, test_loss: 1.0298, test_f1: 0.5806
 epoch: 7, train_loss: 0.7557, test_loss: 1.1696, test_f1: 0.5467
 epoch: 8, train_loss: 0.7323, test_loss: 1.0723, test_f1: 0.5196
 epoch: 9, train_loss: 0.7110, test_loss: 0.9888, test_f1: 0.5633
 epoch: 10, train_loss: 0.6906, test_loss: 0.9965, test_f1: 0.5728
 epoch: 11, train_loss: 0.6660, test_loss: 1.0796, test_f1: 0.5619
 epoch: 12, train_loss: 0.6382, test_loss: 1.2365, test_f1: 0.5261
 epoch: 13, train_loss: 0.6396, test_loss: 1.0343, test_f1: 0.5659
 epoch: 14, train_loss: 0.6228, test_loss: 0.9930, test_f1: 0.5915
 epoch: 15, train_loss: 0.6338, test_loss: 1.0532, test_f1: 0.6042
 epoch: 16, train_loss: 0.5735, test_loss: 1.0788, test_f1: 0.5755
 epoch: 17, train_loss: 0.5685, test_loss: 1.1060, test_f1: 0.5957
 epoch: 18, train_loss: 0.5540, test_loss: 1.1900, test_f1: 0.5829
 epoch: 19, train_loss: 0.5423, test_loss: 1.1735, test_f1: 0.5946
 epoch: 20, train_loss: 0.5526, test_loss: 1.2691, test_f1: 0.5427
 epoch: 21, train_loss: 0.5481, test_loss: 1.1119, test_f1: 0.5665
 epoch: 22, train_loss: 0.5164, test_loss: 1.1852, test_f1: 0.5605
 epoch: 23, train_loss: 0.5075, test_loss: 1.0679, test_f1: 0.6381
 epoch: 24, train_loss: 0.4841, test_loss: 1.2339, test_f1: 0.5782
 epoch: 25, train_loss: 0.4675, test_loss: 1.2715, test_f1: 0.6148
 epoch: 26, train_loss: 0.4454, test_loss: 1.2134, test_f1: 0.5621
 epoch: 27, train_loss: 0.4366, test_loss: 1.4837, test_f1: 0.6021
 epoch: 28, train_loss: 0.4029, test_loss: 1.5192, test_f1: 0.5936
 epoch: 29, train_loss: 0.4211, test_loss: 1.3673, test_f1: 0.5854
 epoch: 30, train_loss: 0.4012, test_loss: 1.4783, test_f1: 0.5830
 epoch: 31, train_loss: 0.4122, test_loss: 1.4664, test_f1: 0.6303
 epoch: 32, train_loss: 0.3927, test_loss: 1.4171, test_f1: 0.6204
 epoch: 33, train_loss: 0.4032, test_loss: 1.5721, test_f1: 0.5572
 epoch: 34, train_loss: 0.3632, test_loss: 1.5216, test_f1: 0.6212
 epoch: 35, train_loss: 0.3978, test_loss: 1.5311, test_f1: 0.5673
 epoch: 36, train_loss: 0.4176, test_loss: 1.5661, test_f1: 0.5337
 epoch: 37, train_loss: 0.3835, test_loss: 1.5051, test_f1: 0.5845
 epoch: 38, train_loss: 0.3684, test_loss: 1.5201, test_f1: 0.6029
 epoch: 39, train_loss: 0.3599, test_loss: 1.4657, test_f1: 0.5972
 epoch: 40, train_loss: 0.3581, test_loss: 1.5108, test_f1: 0.6093
 epoch: 41, train_loss: 0.3829, test_loss: 1.6817, test_f1: 0.5944
 epoch: 42, train_loss: 0.3576, test_loss: 1.4944, test_f1: 0.6042
 epoch: 43, train_loss: 0.3305, test_loss: 1.5430, test_f1: 0.5795
 epoch: 44, train_loss: 0.3265, test_loss: 1.3867, test_f1: 0.5959
 epoch: 45, train_loss: 0.3094, test_loss: 1.6365, test_f1: 0.5837
 epoch: 46, train_loss: 0.3231, test_loss: 1.4926, test_f1: 0.5785
 epoch: 47, train_loss: 0.3078, test_loss: 1.5388, test_f1: 0.6251
 epoch: 48, train_loss: 0.2753, test_loss: 1.6440, test_f1: 0.6114
 epoch: 49, train_loss: 0.2821, test_loss: 1.7513, test_f1: 0.5982
 epoch: 50, train_loss: 0.3429, test_loss: 1.7034, test_f1: 0.6009
 epoch: 51, train_loss: 0.2611, test_loss: 1.7063, test_f1: 0.5681
 epoch: 52, train_loss: 0.2367, test_loss: 1.7090, test_f1: 0.5915
 epoch: 53, train_loss: 0.2214, test_loss: 1.9629, test_f1: 0.5912
 epoch: 54, train_loss: 0.1945, test_loss: 1.9794, test_f1: 0.6053
 epoch: 55, train_loss: 0.1957, test_loss: 1.8433, test_f1: 0.5857
 epoch: 56, train_loss: 0.1983, test_loss: 1.9887, test_f1: 0.6137
 epoch: 57, train_loss: 0.1947, test_loss: 2.1299, test_f1: 0.6005
 epoch: 58, train_loss: 0.1694, test_loss: 2.0221, test_f1: 0.6111
 epoch: 59, train_loss: 0.1642, test_loss: 2.0959, test_f1: 0.5948
 epoch: 60, train_loss: 0.1950, test_loss: 2.1596, test_f1: 0.5791
 epoch: 61, train_loss: 0.1744, test_loss: 2.2245, test_f1: 0.5843
 epoch: 62, train_loss: 0.1886, test_loss: 2.4394, test_f1: 0.6000
 epoch: 63, train_loss: 0.1797, test_loss: 2.1388, test_f1: 0.6035
 epoch: 64, train_loss: 0.1787, test_loss: 2.0186, test_f1: 0.5929
 epoch: 65, train_loss: 0.1713, test_loss: 2.2601, test_f1: 0.5980
 epoch: 66, train_loss: 0.1625, test_loss: 2.3206, test_f1: 0.5810
 epoch: 67, train_loss: 0.1912, test_loss: 2.2693, test_f1: 0.5948
 epoch: 68, train_loss: 0.1744, test_loss: 2.2859, test_f1: 0.6104
 epoch: 69, train_loss: 0.1799, test_loss: 2.1640, test_f1: 0.6098
 epoch: 70, train_loss: 0.1721, test_loss: 2.2142, test_f1: 0.5987
 epoch: 71, train_loss: 0.1637, test_loss: 2.2102, test_f1: 0.6172
 epoch: 72, train_loss: 0.1600, test_loss: 2.1053, test_f1: 0.6050
 epoch: 73, train_loss: 0.1422, test_loss: 2.3074, test_f1: 0.6052
 epoch: 74, train_loss: 0.1500, test_loss: 2.1818, test_f1: 0.6115
 epoch: 75, train_loss: 0.1396, test_loss: 2.4785, test_f1: 0.5974
 epoch: 76, train_loss: 0.1324, test_loss: 2.5973, test_f1: 0.6089
 epoch: 77, train_loss: 0.1507, test_loss: 2.3598, test_f1: 0.5997
 epoch: 78, train_loss: 0.1475, test_loss: 2.5206, test_f1: 0.6156
 epoch: 79, train_loss: 0.1216, test_loss: 2.4591, test_f1: 0.6178
 epoch: 80, train_loss: 0.1069, test_loss: 2.5260, test_f1: 0.5839
 epoch: 81, train_loss: 0.1405, test_loss: 2.4558, test_f1: 0.5950
 epoch: 82, train_loss: 0.1317, test_loss: 2.5616, test_f1: 0.5829
 epoch: 83, train_loss: 0.1374, test_loss: 2.6266, test_f1: 0.6051
 epoch: 84, train_loss: 0.1608, test_loss: 2.6614, test_f1: 0.5883
 epoch: 85, train_loss: 0.1403, test_loss: 2.8740, test_f1: 0.5575
 epoch: 86, train_loss: 0.1286, test_loss: 2.6824, test_f1: 0.5513
 epoch: 87, train_loss: 0.1368, test_loss: 2.5335, test_f1: 0.5839
 epoch: 88, train_loss: 0.1421, test_loss: 2.4782, test_f1: 0.6250
 epoch: 89, train_loss: 0.1603, test_loss: 2.6123, test_f1: 0.5995
 epoch: 90, train_loss: 0.1704, test_loss: 2.4192, test_f1: 0.5908
 epoch: 91, train_loss: 0.1298, test_loss: 2.5776, test_f1: 0.6066
 epoch: 92, train_loss: 0.1440, test_loss: 2.5169, test_f1: 0.6258
 epoch: 93, train_loss: 0.1517, test_loss: 2.4666, test_f1: 0.6012
 epoch: 94, train_loss: 0.1355, test_loss: 2.5178, test_f1: 0.5978
 epoch: 95, train_loss: 0.1426, test_loss: 2.4201, test_f1: 0.5890
 epoch: 96, train_loss: 0.1111, test_loss: 2.5779, test_f1: 0.6010
 epoch: 97, train_loss: 0.1035, test_loss: 2.5299, test_f1: 0.6079
 epoch: 98, train_loss: 0.1023, test_loss: 2.4731, test_f1: 0.6066
 epoch: 99, train_loss: 0.1136, test_loss: 2.7282, test_f1: 0.5701
##################ITERATION #9 ****************************************
 epoch: 0, train_loss: 1.4386, test_loss: 1.5406, test_f1: 0.3206
 epoch: 1, train_loss: 1.0769, test_loss: 1.4157, test_f1: 0.4239
 epoch: 2, train_loss: 0.9156, test_loss: 1.2775, test_f1: 0.4562
 epoch: 3, train_loss: 0.8576, test_loss: 1.1326, test_f1: 0.5376
 epoch: 4, train_loss: 0.8155, test_loss: 1.1562, test_f1: 0.5494
 epoch: 5, train_loss: 0.7977, test_loss: 1.0701, test_f1: 0.5227
 epoch: 6, train_loss: 0.7446, test_loss: 1.1551, test_f1: 0.5732
 epoch: 7, train_loss: 0.6989, test_loss: 1.1563, test_f1: 0.5552
 epoch: 8, train_loss: 0.6841, test_loss: 1.2125, test_f1: 0.5810
 epoch: 9, train_loss: 0.6688, test_loss: 1.1868, test_f1: 0.5993
 epoch: 10, train_loss: 0.6662, test_loss: 1.2460, test_f1: 0.5698
 epoch: 11, train_loss: 0.6345, test_loss: 1.1833, test_f1: 0.5659
 epoch: 12, train_loss: 0.6205, test_loss: 1.3715, test_f1: 0.5769
 epoch: 13, train_loss: 0.6319, test_loss: 1.1798, test_f1: 0.5614
 epoch: 14, train_loss: 0.6020, test_loss: 1.1896, test_f1: 0.5348
 epoch: 15, train_loss: 0.5758, test_loss: 1.2989, test_f1: 0.6040
 epoch: 16, train_loss: 0.5563, test_loss: 1.1984, test_f1: 0.5728
 epoch: 17, train_loss: 0.5791, test_loss: 1.2875, test_f1: 0.5680
 epoch: 18, train_loss: 0.5318, test_loss: 1.3901, test_f1: 0.5536
 epoch: 19, train_loss: 0.5217, test_loss: 1.3905, test_f1: 0.5525
 epoch: 20, train_loss: 0.4711, test_loss: 1.2029, test_f1: 0.5826
 epoch: 21, train_loss: 0.4822, test_loss: 1.5901, test_f1: 0.5260
 epoch: 22, train_loss: 0.4467, test_loss: 1.3537, test_f1: 0.5867
 epoch: 23, train_loss: 0.4746, test_loss: 1.5935, test_f1: 0.6524
 epoch: 24, train_loss: 0.4479, test_loss: 1.5992, test_f1: 0.5382
 epoch: 25, train_loss: 0.4822, test_loss: 1.4061, test_f1: 0.5803
 epoch: 26, train_loss: 0.4329, test_loss: 1.2954, test_f1: 0.6221
 epoch: 27, train_loss: 0.4648, test_loss: 1.3884, test_f1: 0.5930
 epoch: 28, train_loss: 0.4304, test_loss: 1.2480, test_f1: 0.6444
 epoch: 29, train_loss: 0.4051, test_loss: 1.5099, test_f1: 0.6096
 epoch: 30, train_loss: 0.4057, test_loss: 1.4731, test_f1: 0.6162
 epoch: 31, train_loss: 0.4038, test_loss: 1.3828, test_f1: 0.6420
 epoch: 32, train_loss: 0.3895, test_loss: 1.7202, test_f1: 0.5871
 epoch: 33, train_loss: 0.3646, test_loss: 1.5150, test_f1: 0.5751
 epoch: 34, train_loss: 0.3888, test_loss: 1.7937, test_f1: 0.5158
 epoch: 35, train_loss: 0.3686, test_loss: 1.6061, test_f1: 0.5900
 epoch: 36, train_loss: 0.3330, test_loss: 1.5122, test_f1: 0.6147
 epoch: 37, train_loss: 0.2973, test_loss: 1.4940, test_f1: 0.6771
 epoch: 38, train_loss: 0.3106, test_loss: 1.8194, test_f1: 0.5650
 epoch: 39, train_loss: 0.3552, test_loss: 1.7406, test_f1: 0.5908
 epoch: 40, train_loss: 0.3260, test_loss: 1.7241, test_f1: 0.6034
 epoch: 41, train_loss: 0.3083, test_loss: 1.5624, test_f1: 0.6266
 epoch: 42, train_loss: 0.3297, test_loss: 1.6736, test_f1: 0.5812
 epoch: 43, train_loss: 0.3555, test_loss: 1.6810, test_f1: 0.5916
 epoch: 44, train_loss: 0.3613, test_loss: 1.6788, test_f1: 0.6116
 epoch: 45, train_loss: 0.3291, test_loss: 1.8534, test_f1: 0.5856
 epoch: 46, train_loss: 0.2996, test_loss: 1.7210, test_f1: 0.6001
 epoch: 47, train_loss: 0.2963, test_loss: 1.7129, test_f1: 0.6270
 epoch: 48, train_loss: 0.2641, test_loss: 1.7969, test_f1: 0.6200
 epoch: 49, train_loss: 0.2632, test_loss: 1.9425, test_f1: 0.6077
 epoch: 50, train_loss: 0.2879, test_loss: 1.7861, test_f1: 0.5938
 epoch: 51, train_loss: 0.2702, test_loss: 1.9544, test_f1: 0.6460
 epoch: 52, train_loss: 0.2316, test_loss: 1.9106, test_f1: 0.6362
 epoch: 53, train_loss: 0.2058, test_loss: 1.7921, test_f1: 0.6361
 epoch: 54, train_loss: 0.2025, test_loss: 1.8258, test_f1: 0.6300
 epoch: 55, train_loss: 0.1985, test_loss: 2.0137, test_f1: 0.6112
 epoch: 56, train_loss: 0.1644, test_loss: 2.0555, test_f1: 0.6044
 epoch: 57, train_loss: 0.1607, test_loss: 2.1232, test_f1: 0.6232
 epoch: 58, train_loss: 0.1623, test_loss: 2.2273, test_f1: 0.6062
 epoch: 59, train_loss: 0.1640, test_loss: 2.1246, test_f1: 0.5979
 epoch: 60, train_loss: 0.1521, test_loss: 2.1228, test_f1: 0.6332
 epoch: 61, train_loss: 0.1265, test_loss: 2.2382, test_f1: 0.6259
 epoch: 62, train_loss: 0.1492, test_loss: 2.2173, test_f1: 0.6187
 epoch: 63, train_loss: 0.1625, test_loss: 2.2755, test_f1: 0.6098
 epoch: 64, train_loss: 0.1808, test_loss: 2.2502, test_f1: 0.6144
 epoch: 65, train_loss: 0.1370, test_loss: 2.4798, test_f1: 0.6041
 epoch: 66, train_loss: 0.1330, test_loss: 2.5798, test_f1: 0.6019
 epoch: 67, train_loss: 0.1424, test_loss: 2.3108, test_f1: 0.6060
 epoch: 68, train_loss: 0.1320, test_loss: 2.5157, test_f1: 0.6161
 epoch: 69, train_loss: 0.1277, test_loss: 2.5132, test_f1: 0.5983
 epoch: 70, train_loss: 0.1535, test_loss: 2.3909, test_f1: 0.6164
 epoch: 71, train_loss: 0.1723, test_loss: 2.5335, test_f1: 0.6049
 epoch: 72, train_loss: 0.1920, test_loss: 2.1805, test_f1: 0.6176
 epoch: 73, train_loss: 0.1626, test_loss: 2.1975, test_f1: 0.6213
 epoch: 74, train_loss: 0.1357, test_loss: 2.3198, test_f1: 0.6045
 epoch: 75, train_loss: 0.1257, test_loss: 2.3956, test_f1: 0.6350
 epoch: 76, train_loss: 0.1140, test_loss: 2.5313, test_f1: 0.6140
 epoch: 77, train_loss: 0.1263, test_loss: 2.4406, test_f1: 0.6230
 epoch: 78, train_loss: 0.1306, test_loss: 2.3764, test_f1: 0.6184
 epoch: 79, train_loss: 0.1308, test_loss: 2.5803, test_f1: 0.5957
 epoch: 80, train_loss: 0.1090, test_loss: 2.6353, test_f1: 0.6145
 epoch: 81, train_loss: 0.1086, test_loss: 2.7129, test_f1: 0.6094
 epoch: 82, train_loss: 0.0960, test_loss: 2.6604, test_f1: 0.6113
 epoch: 83, train_loss: 0.1106, test_loss: 2.9809, test_f1: 0.6117
 epoch: 84, train_loss: 0.0978, test_loss: 2.7400, test_f1: 0.5895
 epoch: 85, train_loss: 0.0994, test_loss: 2.5958, test_f1: 0.6283
 epoch: 86, train_loss: 0.1118, test_loss: 2.7792, test_f1: 0.6118
 epoch: 87, train_loss: 0.0886, test_loss: 2.9776, test_f1: 0.5839
 epoch: 88, train_loss: 0.1066, test_loss: 2.6962, test_f1: 0.6218
 epoch: 89, train_loss: 0.0785, test_loss: 2.9506, test_f1: 0.6110
 epoch: 90, train_loss: 0.0975, test_loss: 3.1722, test_f1: 0.6032
 epoch: 91, train_loss: 0.1398, test_loss: 3.1502, test_f1: 0.6206
 epoch: 92, train_loss: 0.1344, test_loss: 2.8325, test_f1: 0.6186
 epoch: 93, train_loss: 0.1195, test_loss: 2.7112, test_f1: 0.6161
 epoch: 94, train_loss: 0.1184, test_loss: 2.8983, test_f1: 0.6266
 epoch: 95, train_loss: 0.1406, test_loss: 2.6850, test_f1: 0.6161
 epoch: 96, train_loss: 0.1023, test_loss: 2.4716, test_f1: 0.6165
 epoch: 97, train_loss: 0.0874, test_loss: 2.5083, test_f1: 0.6140
 epoch: 98, train_loss: 0.0868, test_loss: 2.7913, test_f1: 0.6360
 epoch: 99, train_loss: 0.0976, test_loss: 2.6674, test_f1: 0.6280

Training completed in 418.97 seconds
Best F1: 0.6895 at epoch 22
Mean F1 across iterations: 0.6672  0.0149
========================FINAL RESULTS================================
FEGIN weighted F1: 0.6895  0.0149
python main.py --data ltspice_demos --representation component_pin --model FEGIN --layers 2 --hiddens 128 --batch_size 128 --lr 0.001 --emb_size 250 --epochs 100 --save_appendix component_pin_L2_H128_BS128_LR0.001_E250 --no_val
-----



STDERR:
  File "main.py", line 370, in <module>
    main()
  File "main.py", line 254, in main
    dataset = dataset_class(
  File "/home/philip/projects/ltspice_examples_code_repo/Circuit-Completion-Using-GNNs/component_classification_with_link_prediction_head/evaluation/FEGIN/kernel/circuit_datasets.py", line 15, in __init__
    self.data, self.slices = torch.load(self.processed_paths[0])
  File "/home/philip/.local/lib/python3.8/site-packages/torch/serialization.py", line 1040, in load
    warnings.warn(
  File "/usr/lib/python3.8/warnings.py", line 109, in _showwarnmsg
    sw(msg.message, msg.category, msg.filename, msg.lineno,
  File "main.py", line 47, in warn_with_traceback
    traceback.print_stack(file=log)
/home/philip/projects/ltspice_examples_code_repo/Circuit-Completion-Using-GNNs/component_classification_with_link_prediction_head/evaluation/FEGIN/kernel/circuit_datasets.py:15: FutureWarning: You are using `torch.load` with `weights_only=False` (the current default value), which uses the default pickle module implicitly. It is possible to construct malicious pickle data which will execute arbitrary code during unpickling (See https://github.com/pytorch/pytorch/blob/main/SECURITY.md#untrusted-models for more details). In a future release, the default value for `weights_only` will be flipped to `True`. This limits the functions that could be executed during unpickling. Arbitrary objects will no longer be allowed to be loaded via this mode unless they are explicitly allowlisted by the user via `torch.serialization.add_safe_globals`. We recommend you start setting `weights_only=True` for any use case where you don't have full control of the loaded file. Please open an issue on GitHub for any issues related to this experimental feature.
  self.data, self.slices = torch.load(self.processed_paths[0])
