STDOUT:
Results will be saved in /home/philip/projects/ltspice_examples_code_repo/Circuit-Completion-Using-GNNs/component_classification_with_link_prediction_head/evaluation/FEGIN/results/model_FEGIN_dataset_ltspice_examples
Command line input: python main.py --data ltspice_examples --representation component_pin --model FEGIN --layers 4 --hiddens 64 --batch_size 256 --lr 0.0001 --emb_size 128 --epochs 100 --save_appendix component_pin_L4_H64_BS256_LR0.0001_E128 --no_val
 is saved.
-----
ltspice_examples - FEGIN
Using 4 layers, 64 hidden units, h = 2
Loading component_pin representation dataset
ENTERED
Training FEGIN on component_pin representation
Train: 3560, Test: 848
##################ITERATION #0 ****************************************
 epoch: 0, train_loss: 1.3963, test_loss: 1.3955, test_f1: 0.0303
 epoch: 1, train_loss: 1.3886, test_loss: 1.3925, test_f1: 0.0303
 epoch: 2, train_loss: 1.3841, test_loss: 1.3888, test_f1: 0.0303
 epoch: 3, train_loss: 1.3788, test_loss: 1.3825, test_f1: 0.1316
 epoch: 4, train_loss: 1.3730, test_loss: 1.3736, test_f1: 0.2975
 epoch: 5, train_loss: 1.3660, test_loss: 1.3631, test_f1: 0.3381
 epoch: 6, train_loss: 1.3577, test_loss: 1.3522, test_f1: 0.3361
 epoch: 7, train_loss: 1.3463, test_loss: 1.3398, test_f1: 0.3361
 epoch: 8, train_loss: 1.3331, test_loss: 1.3240, test_f1: 0.3352
 epoch: 9, train_loss: 1.3163, test_loss: 1.3051, test_f1: 0.3301
 epoch: 10, train_loss: 1.2979, test_loss: 1.2825, test_f1: 0.3291
 epoch: 11, train_loss: 1.2754, test_loss: 1.2580, test_f1: 0.3332
 epoch: 12, train_loss: 1.2534, test_loss: 1.2332, test_f1: 0.3361
 epoch: 13, train_loss: 1.2291, test_loss: 1.2109, test_f1: 0.3361
 epoch: 14, train_loss: 1.2101, test_loss: 1.1873, test_f1: 0.3371
 epoch: 15, train_loss: 1.1919, test_loss: 1.1655, test_f1: 0.3374
 epoch: 16, train_loss: 1.1730, test_loss: 1.1468, test_f1: 0.3429
 epoch: 17, train_loss: 1.1555, test_loss: 1.1250, test_f1: 0.3429
 epoch: 18, train_loss: 1.1373, test_loss: 1.1082, test_f1: 0.3429
 epoch: 19, train_loss: 1.1177, test_loss: 1.0902, test_f1: 0.3438
 epoch: 20, train_loss: 1.1025, test_loss: 1.0733, test_f1: 0.3435
 epoch: 21, train_loss: 1.0874, test_loss: 1.0660, test_f1: 0.3557
 epoch: 22, train_loss: 1.0711, test_loss: 1.0502, test_f1: 0.3658
 epoch: 23, train_loss: 1.0628, test_loss: 1.0478, test_f1: 0.3669
 epoch: 24, train_loss: 1.0551, test_loss: 1.0381, test_f1: 0.3719
 epoch: 25, train_loss: 1.0381, test_loss: 1.0341, test_f1: 0.3819
 epoch: 26, train_loss: 1.0300, test_loss: 1.0295, test_f1: 0.3792
 epoch: 27, train_loss: 1.0265, test_loss: 1.0273, test_f1: 0.4138
 epoch: 28, train_loss: 1.0175, test_loss: 1.0269, test_f1: 0.4135
 epoch: 29, train_loss: 1.0111, test_loss: 1.0237, test_f1: 0.4037
 epoch: 30, train_loss: 1.0045, test_loss: 1.0260, test_f1: 0.4327
 epoch: 31, train_loss: 0.9992, test_loss: 1.0242, test_f1: 0.4275
 epoch: 32, train_loss: 0.9909, test_loss: 1.0239, test_f1: 0.4429
 epoch: 33, train_loss: 0.9958, test_loss: 1.0223, test_f1: 0.4289
 epoch: 34, train_loss: 0.9867, test_loss: 1.0449, test_f1: 0.4261
 epoch: 35, train_loss: 0.9858, test_loss: 1.0233, test_f1: 0.4453
 epoch: 36, train_loss: 0.9804, test_loss: 1.0281, test_f1: 0.4369
 epoch: 37, train_loss: 0.9764, test_loss: 1.0363, test_f1: 0.4327
 epoch: 38, train_loss: 0.9670, test_loss: 1.0223, test_f1: 0.4420
 epoch: 39, train_loss: 0.9692, test_loss: 1.0403, test_f1: 0.4333
 epoch: 40, train_loss: 0.9604, test_loss: 1.0230, test_f1: 0.4472
 epoch: 41, train_loss: 0.9606, test_loss: 1.0449, test_f1: 0.4411
 epoch: 42, train_loss: 0.9521, test_loss: 1.0329, test_f1: 0.4529
 epoch: 43, train_loss: 0.9519, test_loss: 1.0347, test_f1: 0.4621
 epoch: 44, train_loss: 0.9511, test_loss: 1.0414, test_f1: 0.4498
 epoch: 45, train_loss: 0.9445, test_loss: 1.0468, test_f1: 0.4525
 epoch: 46, train_loss: 0.9375, test_loss: 1.0655, test_f1: 0.4479
 epoch: 47, train_loss: 0.9324, test_loss: 1.0396, test_f1: 0.4637
 epoch: 48, train_loss: 0.9332, test_loss: 1.0545, test_f1: 0.4457
 epoch: 49, train_loss: 0.9211, test_loss: 1.0382, test_f1: 0.4802
 epoch: 50, train_loss: 0.9210, test_loss: 1.0242, test_f1: 0.4789
 epoch: 51, train_loss: 0.9149, test_loss: 1.0336, test_f1: 0.4764
 epoch: 52, train_loss: 0.9120, test_loss: 1.0403, test_f1: 0.4658
 epoch: 53, train_loss: 0.9141, test_loss: 1.0444, test_f1: 0.4701
 epoch: 54, train_loss: 0.9049, test_loss: 1.0399, test_f1: 0.4705
 epoch: 55, train_loss: 0.9073, test_loss: 1.0305, test_f1: 0.4745
 epoch: 56, train_loss: 0.9076, test_loss: 1.0321, test_f1: 0.4698
 epoch: 57, train_loss: 0.9077, test_loss: 1.0336, test_f1: 0.4786
 epoch: 58, train_loss: 0.9006, test_loss: 1.0302, test_f1: 0.4788
 epoch: 59, train_loss: 0.9012, test_loss: 1.0247, test_f1: 0.4840
 epoch: 60, train_loss: 0.8904, test_loss: 1.0287, test_f1: 0.4752
 epoch: 61, train_loss: 0.8896, test_loss: 1.0256, test_f1: 0.4853
 epoch: 62, train_loss: 0.8888, test_loss: 1.0304, test_f1: 0.4729
 epoch: 63, train_loss: 0.8852, test_loss: 1.0255, test_f1: 0.4819
 epoch: 64, train_loss: 0.8798, test_loss: 1.0253, test_f1: 0.4848
 epoch: 65, train_loss: 0.8822, test_loss: 1.0230, test_f1: 0.4975
 epoch: 66, train_loss: 0.8818, test_loss: 1.0270, test_f1: 0.4672
 epoch: 67, train_loss: 0.8686, test_loss: 1.0271, test_f1: 0.4844
 epoch: 68, train_loss: 0.8782, test_loss: 1.0182, test_f1: 0.5136
 epoch: 69, train_loss: 0.8665, test_loss: 1.0335, test_f1: 0.4954
 epoch: 70, train_loss: 0.8686, test_loss: 1.0224, test_f1: 0.4921
 epoch: 71, train_loss: 0.8672, test_loss: 1.0157, test_f1: 0.5016
 epoch: 72, train_loss: 0.8654, test_loss: 1.0219, test_f1: 0.4939
 epoch: 73, train_loss: 0.8695, test_loss: 1.0087, test_f1: 0.4976
 epoch: 74, train_loss: 0.8705, test_loss: 1.0142, test_f1: 0.5116
 epoch: 75, train_loss: 0.8583, test_loss: 1.0116, test_f1: 0.5032
 epoch: 76, train_loss: 0.8594, test_loss: 1.0141, test_f1: 0.5169
 epoch: 77, train_loss: 0.8472, test_loss: 1.0080, test_f1: 0.5144
 epoch: 78, train_loss: 0.8511, test_loss: 1.0038, test_f1: 0.5056
 epoch: 79, train_loss: 0.8422, test_loss: 1.0045, test_f1: 0.5185
 epoch: 80, train_loss: 0.8447, test_loss: 1.0045, test_f1: 0.5228
 epoch: 81, train_loss: 0.8408, test_loss: 0.9991, test_f1: 0.5312
 epoch: 82, train_loss: 0.8337, test_loss: 1.0171, test_f1: 0.5001
 epoch: 83, train_loss: 0.8377, test_loss: 1.0088, test_f1: 0.5252
 epoch: 84, train_loss: 0.8337, test_loss: 1.0160, test_f1: 0.5069
 epoch: 85, train_loss: 0.8293, test_loss: 0.9991, test_f1: 0.5234
 epoch: 86, train_loss: 0.8331, test_loss: 1.0029, test_f1: 0.5193
 epoch: 87, train_loss: 0.8308, test_loss: 1.0128, test_f1: 0.5196
 epoch: 88, train_loss: 0.8156, test_loss: 1.0029, test_f1: 0.5314
 epoch: 89, train_loss: 0.8137, test_loss: 0.9964, test_f1: 0.5131
 epoch: 90, train_loss: 0.8174, test_loss: 0.9911, test_f1: 0.5336
 epoch: 91, train_loss: 0.8105, test_loss: 1.0006, test_f1: 0.5313
 epoch: 92, train_loss: 0.8164, test_loss: 1.0027, test_f1: 0.5210
 epoch: 93, train_loss: 0.8224, test_loss: 0.9989, test_f1: 0.5341
 epoch: 94, train_loss: 0.8125, test_loss: 1.0036, test_f1: 0.5200
 epoch: 95, train_loss: 0.8028, test_loss: 1.0101, test_f1: 0.5326
 epoch: 96, train_loss: 0.8131, test_loss: 1.0231, test_f1: 0.5166
 epoch: 97, train_loss: 0.8037, test_loss: 1.0139, test_f1: 0.5138
 epoch: 98, train_loss: 0.8013, test_loss: 0.9777, test_f1: 0.5403
 epoch: 99, train_loss: 0.7926, test_loss: 0.9911, test_f1: 0.5288
##################ITERATION #1 ****************************************
 epoch: 0, train_loss: 1.3546, test_loss: 1.3634, test_f1: 0.2260
 epoch: 1, train_loss: 1.3362, test_loss: 1.3510, test_f1: 0.2260
 epoch: 2, train_loss: 1.3227, test_loss: 1.3328, test_f1: 0.2260
 epoch: 3, train_loss: 1.3091, test_loss: 1.3109, test_f1: 0.2260
 epoch: 4, train_loss: 1.2931, test_loss: 1.2887, test_f1: 0.2260
 epoch: 5, train_loss: 1.2759, test_loss: 1.2670, test_f1: 0.2260
 epoch: 6, train_loss: 1.2587, test_loss: 1.2448, test_f1: 0.2260
 epoch: 7, train_loss: 1.2390, test_loss: 1.2237, test_f1: 0.3347
 epoch: 8, train_loss: 1.2205, test_loss: 1.2008, test_f1: 0.3343
 epoch: 9, train_loss: 1.2037, test_loss: 1.1805, test_f1: 0.3374
 epoch: 10, train_loss: 1.1832, test_loss: 1.1606, test_f1: 0.3391
 epoch: 11, train_loss: 1.1638, test_loss: 1.1382, test_f1: 0.3419
 epoch: 12, train_loss: 1.1455, test_loss: 1.1187, test_f1: 0.3419
 epoch: 13, train_loss: 1.1212, test_loss: 1.0992, test_f1: 0.3419
 epoch: 14, train_loss: 1.1051, test_loss: 1.0807, test_f1: 0.3461
 epoch: 15, train_loss: 1.0850, test_loss: 1.0636, test_f1: 0.3591
 epoch: 16, train_loss: 1.0669, test_loss: 1.0544, test_f1: 0.3724
 epoch: 17, train_loss: 1.0500, test_loss: 1.0387, test_f1: 0.3865
 epoch: 18, train_loss: 1.0385, test_loss: 1.0312, test_f1: 0.3996
 epoch: 19, train_loss: 1.0259, test_loss: 1.0198, test_f1: 0.4195
 epoch: 20, train_loss: 1.0097, test_loss: 1.0119, test_f1: 0.4308
 epoch: 21, train_loss: 1.0047, test_loss: 1.0049, test_f1: 0.4518
 epoch: 22, train_loss: 0.9989, test_loss: 1.0116, test_f1: 0.4403
 epoch: 23, train_loss: 0.9893, test_loss: 0.9965, test_f1: 0.4570
 epoch: 24, train_loss: 0.9801, test_loss: 0.9941, test_f1: 0.4670
 epoch: 25, train_loss: 0.9749, test_loss: 0.9846, test_f1: 0.4649
 epoch: 26, train_loss: 0.9605, test_loss: 0.9882, test_f1: 0.4631
 epoch: 27, train_loss: 0.9578, test_loss: 0.9776, test_f1: 0.4726
 epoch: 28, train_loss: 0.9519, test_loss: 0.9789, test_f1: 0.4707
 epoch: 29, train_loss: 0.9420, test_loss: 0.9671, test_f1: 0.4736
 epoch: 30, train_loss: 0.9360, test_loss: 0.9661, test_f1: 0.4772
 epoch: 31, train_loss: 0.9306, test_loss: 0.9582, test_f1: 0.4882
 epoch: 32, train_loss: 0.9175, test_loss: 0.9656, test_f1: 0.4876
 epoch: 33, train_loss: 0.9171, test_loss: 0.9435, test_f1: 0.4987
 epoch: 34, train_loss: 0.9113, test_loss: 0.9377, test_f1: 0.4926
 epoch: 35, train_loss: 0.8996, test_loss: 0.9461, test_f1: 0.5047
 epoch: 36, train_loss: 0.9007, test_loss: 0.9276, test_f1: 0.5147
 epoch: 37, train_loss: 0.8896, test_loss: 0.9273, test_f1: 0.5103
 epoch: 38, train_loss: 0.8827, test_loss: 0.9122, test_f1: 0.5201
 epoch: 39, train_loss: 0.8818, test_loss: 0.9106, test_f1: 0.5223
 epoch: 40, train_loss: 0.8686, test_loss: 0.9209, test_f1: 0.5229
 epoch: 41, train_loss: 0.8611, test_loss: 0.8997, test_f1: 0.5294
 epoch: 42, train_loss: 0.8615, test_loss: 0.9108, test_f1: 0.5307
 epoch: 43, train_loss: 0.8544, test_loss: 0.9052, test_f1: 0.5285
 epoch: 44, train_loss: 0.8495, test_loss: 0.8799, test_f1: 0.5419
 epoch: 45, train_loss: 0.8489, test_loss: 0.8969, test_f1: 0.5318
 epoch: 46, train_loss: 0.8473, test_loss: 0.8888, test_f1: 0.5250
 epoch: 47, train_loss: 0.8387, test_loss: 0.8769, test_f1: 0.5358
 epoch: 48, train_loss: 0.8223, test_loss: 0.9014, test_f1: 0.5118
 epoch: 49, train_loss: 0.8260, test_loss: 0.8796, test_f1: 0.5191
 epoch: 50, train_loss: 0.8183, test_loss: 0.8725, test_f1: 0.5351
 epoch: 51, train_loss: 0.8142, test_loss: 0.8796, test_f1: 0.5276
 epoch: 52, train_loss: 0.8105, test_loss: 0.8799, test_f1: 0.5362
 epoch: 53, train_loss: 0.8048, test_loss: 0.8705, test_f1: 0.5350
 epoch: 54, train_loss: 0.8069, test_loss: 0.8778, test_f1: 0.5315
 epoch: 55, train_loss: 0.8048, test_loss: 0.8731, test_f1: 0.5273
 epoch: 56, train_loss: 0.8050, test_loss: 0.8752, test_f1: 0.5384
 epoch: 57, train_loss: 0.7936, test_loss: 0.8887, test_f1: 0.5228
 epoch: 58, train_loss: 0.7911, test_loss: 0.8781, test_f1: 0.5363
 epoch: 59, train_loss: 0.7906, test_loss: 0.8718, test_f1: 0.5345
 epoch: 60, train_loss: 0.7895, test_loss: 0.8764, test_f1: 0.5324
 epoch: 61, train_loss: 0.7901, test_loss: 0.8866, test_f1: 0.5313
 epoch: 62, train_loss: 0.7936, test_loss: 0.8778, test_f1: 0.5228
 epoch: 63, train_loss: 0.7769, test_loss: 0.8794, test_f1: 0.5309
 epoch: 64, train_loss: 0.7870, test_loss: 0.8694, test_f1: 0.5287
 epoch: 65, train_loss: 0.7871, test_loss: 0.8839, test_f1: 0.5267
 epoch: 66, train_loss: 0.7775, test_loss: 0.8738, test_f1: 0.5410
 epoch: 67, train_loss: 0.7692, test_loss: 0.8940, test_f1: 0.5271
 epoch: 68, train_loss: 0.7607, test_loss: 0.8889, test_f1: 0.5329
 epoch: 69, train_loss: 0.7705, test_loss: 0.8873, test_f1: 0.5356
 epoch: 70, train_loss: 0.7777, test_loss: 0.8795, test_f1: 0.5373
 epoch: 71, train_loss: 0.7720, test_loss: 0.8891, test_f1: 0.5284
 epoch: 72, train_loss: 0.7571, test_loss: 0.9014, test_f1: 0.5250
 epoch: 73, train_loss: 0.7641, test_loss: 0.8948, test_f1: 0.5185
 epoch: 74, train_loss: 0.7610, test_loss: 0.8897, test_f1: 0.5323
 epoch: 75, train_loss: 0.7648, test_loss: 0.9060, test_f1: 0.5295
 epoch: 76, train_loss: 0.7496, test_loss: 0.9010, test_f1: 0.5339
 epoch: 77, train_loss: 0.7474, test_loss: 0.9118, test_f1: 0.5222
 epoch: 78, train_loss: 0.7473, test_loss: 0.9007, test_f1: 0.5351
 epoch: 79, train_loss: 0.7462, test_loss: 0.9082, test_f1: 0.5317
 epoch: 80, train_loss: 0.7458, test_loss: 0.9082, test_f1: 0.5269
 epoch: 81, train_loss: 0.7508, test_loss: 0.9060, test_f1: 0.5366
 epoch: 82, train_loss: 0.7439, test_loss: 0.9044, test_f1: 0.5305
 epoch: 83, train_loss: 0.7378, test_loss: 0.9028, test_f1: 0.5357
 epoch: 84, train_loss: 0.7393, test_loss: 0.9103, test_f1: 0.5294
 epoch: 85, train_loss: 0.7355, test_loss: 0.8971, test_f1: 0.5317
 epoch: 86, train_loss: 0.7333, test_loss: 0.9123, test_f1: 0.5207
 epoch: 87, train_loss: 0.7270, test_loss: 0.9130, test_f1: 0.5314
 epoch: 88, train_loss: 0.7361, test_loss: 0.9208, test_f1: 0.5328
 epoch: 89, train_loss: 0.7244, test_loss: 0.9217, test_f1: 0.5309
 epoch: 90, train_loss: 0.7296, test_loss: 0.9121, test_f1: 0.5311
 epoch: 91, train_loss: 0.7327, test_loss: 0.9313, test_f1: 0.5334
 epoch: 92, train_loss: 0.7265, test_loss: 0.9374, test_f1: 0.5326
 epoch: 93, train_loss: 0.7249, test_loss: 0.9465, test_f1: 0.5223
 epoch: 94, train_loss: 0.7185, test_loss: 0.9367, test_f1: 0.5276
 epoch: 95, train_loss: 0.7213, test_loss: 0.9421, test_f1: 0.5215
 epoch: 96, train_loss: 0.7146, test_loss: 0.9290, test_f1: 0.5394
 epoch: 97, train_loss: 0.7187, test_loss: 0.9116, test_f1: 0.5395
 epoch: 98, train_loss: 0.7131, test_loss: 0.9293, test_f1: 0.5321
 epoch: 99, train_loss: 0.7113, test_loss: 0.9360, test_f1: 0.5262
##################ITERATION #2 ****************************************
 epoch: 0, train_loss: 1.3328, test_loss: 1.3473, test_f1: 0.2260
 epoch: 1, train_loss: 1.3099, test_loss: 1.3335, test_f1: 0.2260
 epoch: 2, train_loss: 1.2958, test_loss: 1.3146, test_f1: 0.2260
 epoch: 3, train_loss: 1.2828, test_loss: 1.2904, test_f1: 0.2260
 epoch: 4, train_loss: 1.2675, test_loss: 1.2613, test_f1: 0.2260
 epoch: 5, train_loss: 1.2482, test_loss: 1.2313, test_f1: 0.2709
 epoch: 6, train_loss: 1.2280, test_loss: 1.2031, test_f1: 0.3441
 epoch: 7, train_loss: 1.2097, test_loss: 1.1778, test_f1: 0.3825
 epoch: 8, train_loss: 1.1893, test_loss: 1.1520, test_f1: 0.3924
 epoch: 9, train_loss: 1.1663, test_loss: 1.1267, test_f1: 0.4008
 epoch: 10, train_loss: 1.1449, test_loss: 1.1041, test_f1: 0.4155
 epoch: 11, train_loss: 1.1308, test_loss: 1.0864, test_f1: 0.4269
 epoch: 12, train_loss: 1.1052, test_loss: 1.0645, test_f1: 0.4443
 epoch: 13, train_loss: 1.0841, test_loss: 1.0483, test_f1: 0.4459
 epoch: 14, train_loss: 1.0685, test_loss: 1.0346, test_f1: 0.4513
 epoch: 15, train_loss: 1.0487, test_loss: 1.0208, test_f1: 0.4643
 epoch: 16, train_loss: 1.0353, test_loss: 1.0048, test_f1: 0.4672
 epoch: 17, train_loss: 1.0224, test_loss: 1.0009, test_f1: 0.4608
 epoch: 18, train_loss: 1.0134, test_loss: 0.9873, test_f1: 0.4847
 epoch: 19, train_loss: 0.9990, test_loss: 0.9797, test_f1: 0.4653
 epoch: 20, train_loss: 0.9923, test_loss: 0.9746, test_f1: 0.4849
 epoch: 21, train_loss: 0.9733, test_loss: 0.9631, test_f1: 0.4706
 epoch: 22, train_loss: 0.9671, test_loss: 0.9599, test_f1: 0.4923
 epoch: 23, train_loss: 0.9603, test_loss: 0.9525, test_f1: 0.4988
 epoch: 24, train_loss: 0.9560, test_loss: 0.9466, test_f1: 0.4928
 epoch: 25, train_loss: 0.9527, test_loss: 0.9426, test_f1: 0.4814
 epoch: 26, train_loss: 0.9380, test_loss: 0.9382, test_f1: 0.4828
 epoch: 27, train_loss: 0.9300, test_loss: 0.9612, test_f1: 0.4799
 epoch: 28, train_loss: 0.9292, test_loss: 0.9325, test_f1: 0.5035
 epoch: 29, train_loss: 0.9196, test_loss: 0.9188, test_f1: 0.5009
 epoch: 30, train_loss: 0.9059, test_loss: 0.9237, test_f1: 0.5095
 epoch: 31, train_loss: 0.9066, test_loss: 0.9255, test_f1: 0.5031
 epoch: 32, train_loss: 0.8945, test_loss: 0.9257, test_f1: 0.5117
 epoch: 33, train_loss: 0.9080, test_loss: 0.9269, test_f1: 0.5175
 epoch: 34, train_loss: 0.8903, test_loss: 0.9131, test_f1: 0.5178
 epoch: 35, train_loss: 0.8890, test_loss: 0.9110, test_f1: 0.5065
 epoch: 36, train_loss: 0.8829, test_loss: 0.9111, test_f1: 0.4998
 epoch: 37, train_loss: 0.8750, test_loss: 0.9256, test_f1: 0.5297
 epoch: 38, train_loss: 0.8722, test_loss: 0.9173, test_f1: 0.5392
 epoch: 39, train_loss: 0.8589, test_loss: 0.9045, test_f1: 0.5319
 epoch: 40, train_loss: 0.8550, test_loss: 0.9209, test_f1: 0.5146
 epoch: 41, train_loss: 0.8558, test_loss: 0.9255, test_f1: 0.5151
 epoch: 42, train_loss: 0.8549, test_loss: 0.9112, test_f1: 0.5289
 epoch: 43, train_loss: 0.8501, test_loss: 0.9214, test_f1: 0.5218
 epoch: 44, train_loss: 0.8420, test_loss: 0.9199, test_f1: 0.5124
 epoch: 45, train_loss: 0.8327, test_loss: 0.9286, test_f1: 0.5091
 epoch: 46, train_loss: 0.8279, test_loss: 0.9192, test_f1: 0.5183
 epoch: 47, train_loss: 0.8384, test_loss: 0.9176, test_f1: 0.5200
 epoch: 48, train_loss: 0.8319, test_loss: 0.9139, test_f1: 0.5177
 epoch: 49, train_loss: 0.8175, test_loss: 0.9285, test_f1: 0.5261
 epoch: 50, train_loss: 0.8147, test_loss: 0.9187, test_f1: 0.5213
 epoch: 51, train_loss: 0.8077, test_loss: 0.9176, test_f1: 0.5281
 epoch: 52, train_loss: 0.8003, test_loss: 0.9229, test_f1: 0.5195
 epoch: 53, train_loss: 0.8069, test_loss: 0.9181, test_f1: 0.5136
 epoch: 54, train_loss: 0.8037, test_loss: 0.9216, test_f1: 0.5241
 epoch: 55, train_loss: 0.7994, test_loss: 0.9294, test_f1: 0.5052
 epoch: 56, train_loss: 0.7980, test_loss: 0.9196, test_f1: 0.5164
 epoch: 57, train_loss: 0.7918, test_loss: 0.9155, test_f1: 0.5200
 epoch: 58, train_loss: 0.7889, test_loss: 0.9246, test_f1: 0.5214
 epoch: 59, train_loss: 0.7912, test_loss: 0.9105, test_f1: 0.5206
 epoch: 60, train_loss: 0.7980, test_loss: 0.9230, test_f1: 0.5346
 epoch: 61, train_loss: 0.7916, test_loss: 0.9209, test_f1: 0.5370
 epoch: 62, train_loss: 0.7809, test_loss: 0.9157, test_f1: 0.5506
 epoch: 63, train_loss: 0.7783, test_loss: 0.9177, test_f1: 0.5369
 epoch: 64, train_loss: 0.7824, test_loss: 0.9213, test_f1: 0.5405
 epoch: 65, train_loss: 0.7726, test_loss: 0.9228, test_f1: 0.5418
 epoch: 66, train_loss: 0.7804, test_loss: 0.9066, test_f1: 0.5476
 epoch: 67, train_loss: 0.7777, test_loss: 0.9169, test_f1: 0.5473
 epoch: 68, train_loss: 0.7678, test_loss: 0.9172, test_f1: 0.5367
 epoch: 69, train_loss: 0.7639, test_loss: 0.9176, test_f1: 0.5459
 epoch: 70, train_loss: 0.7751, test_loss: 0.9257, test_f1: 0.5399
 epoch: 71, train_loss: 0.7652, test_loss: 0.9363, test_f1: 0.5455
 epoch: 72, train_loss: 0.7646, test_loss: 0.9265, test_f1: 0.5297
 epoch: 73, train_loss: 0.7665, test_loss: 0.9142, test_f1: 0.5467
 epoch: 74, train_loss: 0.7552, test_loss: 0.9241, test_f1: 0.5423
 epoch: 75, train_loss: 0.7621, test_loss: 0.9232, test_f1: 0.5473
 epoch: 76, train_loss: 0.7613, test_loss: 0.9130, test_f1: 0.5475
 epoch: 77, train_loss: 0.7569, test_loss: 0.9236, test_f1: 0.5406
 epoch: 78, train_loss: 0.7470, test_loss: 0.9307, test_f1: 0.5389
 epoch: 79, train_loss: 0.7511, test_loss: 0.9321, test_f1: 0.5410
 epoch: 80, train_loss: 0.7556, test_loss: 0.9265, test_f1: 0.5468
 epoch: 81, train_loss: 0.7534, test_loss: 0.9371, test_f1: 0.5471
 epoch: 82, train_loss: 0.7537, test_loss: 0.9231, test_f1: 0.5457
 epoch: 83, train_loss: 0.7524, test_loss: 0.9278, test_f1: 0.5495
 epoch: 84, train_loss: 0.7374, test_loss: 0.9323, test_f1: 0.5418
 epoch: 85, train_loss: 0.7403, test_loss: 0.9345, test_f1: 0.5415
 epoch: 86, train_loss: 0.7401, test_loss: 0.9292, test_f1: 0.5389
 epoch: 87, train_loss: 0.7385, test_loss: 0.9322, test_f1: 0.5402
 epoch: 88, train_loss: 0.7391, test_loss: 0.9346, test_f1: 0.5439
 epoch: 89, train_loss: 0.7375, test_loss: 0.9316, test_f1: 0.5380
 epoch: 90, train_loss: 0.7348, test_loss: 0.9365, test_f1: 0.5403
 epoch: 91, train_loss: 0.7321, test_loss: 0.9413, test_f1: 0.5483
 epoch: 92, train_loss: 0.7271, test_loss: 0.9311, test_f1: 0.5441
 epoch: 93, train_loss: 0.7256, test_loss: 0.9275, test_f1: 0.5408
 epoch: 94, train_loss: 0.7359, test_loss: 0.9209, test_f1: 0.5465
 epoch: 95, train_loss: 0.7267, test_loss: 0.9245, test_f1: 0.5366
 epoch: 96, train_loss: 0.7277, test_loss: 0.9172, test_f1: 0.5414
 epoch: 97, train_loss: 0.7308, test_loss: 0.9604, test_f1: 0.5338
 epoch: 98, train_loss: 0.7214, test_loss: 0.9584, test_f1: 0.5403
 epoch: 99, train_loss: 0.7252, test_loss: 0.9173, test_f1: 0.5454
##################ITERATION #3 ****************************************
 epoch: 0, train_loss: 1.3078, test_loss: 1.3159, test_f1: 0.2260
 epoch: 1, train_loss: 1.2792, test_loss: 1.3096, test_f1: 0.2260
 epoch: 2, train_loss: 1.2619, test_loss: 1.2954, test_f1: 0.2260
 epoch: 3, train_loss: 1.2420, test_loss: 1.2540, test_f1: 0.2306
 epoch: 4, train_loss: 1.2254, test_loss: 1.2073, test_f1: 0.2872
 epoch: 5, train_loss: 1.2049, test_loss: 1.1693, test_f1: 0.4270
 epoch: 6, train_loss: 1.1812, test_loss: 1.1430, test_f1: 0.4316
 epoch: 7, train_loss: 1.1594, test_loss: 1.1192, test_f1: 0.4347
 epoch: 8, train_loss: 1.1339, test_loss: 1.0990, test_f1: 0.4398
 epoch: 9, train_loss: 1.1185, test_loss: 1.0849, test_f1: 0.4340
 epoch: 10, train_loss: 1.0941, test_loss: 1.0713, test_f1: 0.4251
 epoch: 11, train_loss: 1.0764, test_loss: 1.0546, test_f1: 0.4359
 epoch: 12, train_loss: 1.0621, test_loss: 1.0466, test_f1: 0.4357
 epoch: 13, train_loss: 1.0436, test_loss: 1.0358, test_f1: 0.4629
 epoch: 14, train_loss: 1.0335, test_loss: 1.0322, test_f1: 0.4532
 epoch: 15, train_loss: 1.0147, test_loss: 1.0246, test_f1: 0.4562
 epoch: 16, train_loss: 1.0089, test_loss: 1.0164, test_f1: 0.4699
 epoch: 17, train_loss: 1.0015, test_loss: 1.0189, test_f1: 0.4503
 epoch: 18, train_loss: 0.9896, test_loss: 1.0029, test_f1: 0.4887
 epoch: 19, train_loss: 0.9794, test_loss: 1.0033, test_f1: 0.4780
 epoch: 20, train_loss: 0.9762, test_loss: 0.9995, test_f1: 0.4761
 epoch: 21, train_loss: 0.9697, test_loss: 1.0048, test_f1: 0.4878
 epoch: 22, train_loss: 0.9608, test_loss: 0.9916, test_f1: 0.4879
 epoch: 23, train_loss: 0.9495, test_loss: 0.9796, test_f1: 0.5099
 epoch: 24, train_loss: 0.9463, test_loss: 0.9936, test_f1: 0.4973
 epoch: 25, train_loss: 0.9343, test_loss: 0.9922, test_f1: 0.4945
 epoch: 26, train_loss: 0.9305, test_loss: 0.9913, test_f1: 0.4975
 epoch: 27, train_loss: 0.9215, test_loss: 0.9838, test_f1: 0.5060
 epoch: 28, train_loss: 0.9151, test_loss: 0.9846, test_f1: 0.5104
 epoch: 29, train_loss: 0.9166, test_loss: 0.9860, test_f1: 0.5111
 epoch: 30, train_loss: 0.9078, test_loss: 0.9868, test_f1: 0.5011
 epoch: 31, train_loss: 0.8977, test_loss: 0.9781, test_f1: 0.5131
 epoch: 32, train_loss: 0.8923, test_loss: 0.9720, test_f1: 0.5211
 epoch: 33, train_loss: 0.8916, test_loss: 0.9750, test_f1: 0.5160
 epoch: 34, train_loss: 0.8950, test_loss: 0.9798, test_f1: 0.5141
 epoch: 35, train_loss: 0.8795, test_loss: 0.9818, test_f1: 0.5189
 epoch: 36, train_loss: 0.8729, test_loss: 0.9760, test_f1: 0.5187
 epoch: 37, train_loss: 0.8571, test_loss: 0.9737, test_f1: 0.5268
 epoch: 38, train_loss: 0.8559, test_loss: 0.9692, test_f1: 0.5225
 epoch: 39, train_loss: 0.8570, test_loss: 0.9666, test_f1: 0.5242
 epoch: 40, train_loss: 0.8499, test_loss: 0.9672, test_f1: 0.5472
 epoch: 41, train_loss: 0.8397, test_loss: 0.9578, test_f1: 0.5434
 epoch: 42, train_loss: 0.8387, test_loss: 0.9707, test_f1: 0.5206
 epoch: 43, train_loss: 0.8232, test_loss: 0.9587, test_f1: 0.5478
 epoch: 44, train_loss: 0.8372, test_loss: 0.9655, test_f1: 0.5406
 epoch: 45, train_loss: 0.8200, test_loss: 0.9793, test_f1: 0.5379
 epoch: 46, train_loss: 0.8224, test_loss: 0.9771, test_f1: 0.5374
 epoch: 47, train_loss: 0.8089, test_loss: 0.9675, test_f1: 0.5392
 epoch: 48, train_loss: 0.8060, test_loss: 0.9792, test_f1: 0.5419
 epoch: 49, train_loss: 0.8107, test_loss: 0.9863, test_f1: 0.5288
 epoch: 50, train_loss: 0.7974, test_loss: 0.9715, test_f1: 0.5381
 epoch: 51, train_loss: 0.7849, test_loss: 0.9700, test_f1: 0.5441
 epoch: 52, train_loss: 0.7788, test_loss: 0.9672, test_f1: 0.5519
 epoch: 53, train_loss: 0.7867, test_loss: 0.9722, test_f1: 0.5379
 epoch: 54, train_loss: 0.7821, test_loss: 0.9749, test_f1: 0.5468
 epoch: 55, train_loss: 0.7736, test_loss: 0.9724, test_f1: 0.5528
 epoch: 56, train_loss: 0.7739, test_loss: 0.9675, test_f1: 0.5559
 epoch: 57, train_loss: 0.7692, test_loss: 0.9702, test_f1: 0.5487
 epoch: 58, train_loss: 0.7727, test_loss: 0.9648, test_f1: 0.5561
 epoch: 59, train_loss: 0.7640, test_loss: 0.9655, test_f1: 0.5636
 epoch: 60, train_loss: 0.7673, test_loss: 0.9847, test_f1: 0.5433
 epoch: 61, train_loss: 0.7657, test_loss: 0.9766, test_f1: 0.5292
 epoch: 62, train_loss: 0.7541, test_loss: 0.9786, test_f1: 0.5467
 epoch: 63, train_loss: 0.7559, test_loss: 0.9875, test_f1: 0.5410
 epoch: 64, train_loss: 0.7549, test_loss: 0.9831, test_f1: 0.5604
 epoch: 65, train_loss: 0.7583, test_loss: 0.9784, test_f1: 0.5428
 epoch: 66, train_loss: 0.7450, test_loss: 0.9849, test_f1: 0.5430
 epoch: 67, train_loss: 0.7537, test_loss: 0.9781, test_f1: 0.5550
 epoch: 68, train_loss: 0.7533, test_loss: 0.9910, test_f1: 0.5409
 epoch: 69, train_loss: 0.7404, test_loss: 0.9886, test_f1: 0.5557
 epoch: 70, train_loss: 0.7502, test_loss: 0.9798, test_f1: 0.5603
 epoch: 71, train_loss: 0.7446, test_loss: 0.9900, test_f1: 0.5494
 epoch: 72, train_loss: 0.7396, test_loss: 1.0006, test_f1: 0.5503
 epoch: 73, train_loss: 0.7371, test_loss: 0.9964, test_f1: 0.5595
 epoch: 74, train_loss: 0.7371, test_loss: 0.9948, test_f1: 0.5542
 epoch: 75, train_loss: 0.7336, test_loss: 1.0033, test_f1: 0.5536
 epoch: 76, train_loss: 0.7284, test_loss: 0.9965, test_f1: 0.5487
 epoch: 77, train_loss: 0.7419, test_loss: 0.9947, test_f1: 0.5651
 epoch: 78, train_loss: 0.7299, test_loss: 1.0051, test_f1: 0.5399
 epoch: 79, train_loss: 0.7302, test_loss: 0.9907, test_f1: 0.5581
 epoch: 80, train_loss: 0.7281, test_loss: 1.0009, test_f1: 0.5572
 epoch: 81, train_loss: 0.7190, test_loss: 1.0110, test_f1: 0.5498
 epoch: 82, train_loss: 0.7154, test_loss: 1.0118, test_f1: 0.5575
 epoch: 83, train_loss: 0.7237, test_loss: 1.0094, test_f1: 0.5693
 epoch: 84, train_loss: 0.7097, test_loss: 1.0023, test_f1: 0.5515
 epoch: 85, train_loss: 0.7214, test_loss: 1.0190, test_f1: 0.5573
 epoch: 86, train_loss: 0.7220, test_loss: 1.0003, test_f1: 0.5611
 epoch: 87, train_loss: 0.7029, test_loss: 1.0214, test_f1: 0.5604
 epoch: 88, train_loss: 0.7150, test_loss: 1.0119, test_f1: 0.5534
 epoch: 89, train_loss: 0.7033, test_loss: 1.0240, test_f1: 0.5645
 epoch: 90, train_loss: 0.7026, test_loss: 1.0195, test_f1: 0.5578
 epoch: 91, train_loss: 0.7118, test_loss: 1.0229, test_f1: 0.5557
 epoch: 92, train_loss: 0.7087, test_loss: 1.0318, test_f1: 0.5574
 epoch: 93, train_loss: 0.7020, test_loss: 1.0201, test_f1: 0.5600
 epoch: 94, train_loss: 0.7056, test_loss: 1.0385, test_f1: 0.5514
 epoch: 95, train_loss: 0.7004, test_loss: 1.0206, test_f1: 0.5494
 epoch: 96, train_loss: 0.6968, test_loss: 1.0308, test_f1: 0.5533
 epoch: 97, train_loss: 0.6902, test_loss: 1.0188, test_f1: 0.5426
 epoch: 98, train_loss: 0.6911, test_loss: 1.0347, test_f1: 0.5517
 epoch: 99, train_loss: 0.6989, test_loss: 1.0455, test_f1: 0.5505
##################ITERATION #4 ****************************************
 epoch: 0, train_loss: 1.2920, test_loss: 1.3118, test_f1: 0.2260
 epoch: 1, train_loss: 1.2505, test_loss: 1.3029, test_f1: 0.2260
 epoch: 2, train_loss: 1.2245, test_loss: 1.2851, test_f1: 0.2260
 epoch: 3, train_loss: 1.2020, test_loss: 1.2575, test_f1: 0.2877
 epoch: 4, train_loss: 1.1782, test_loss: 1.2012, test_f1: 0.3008
 epoch: 5, train_loss: 1.1576, test_loss: 1.1354, test_f1: 0.4262
 epoch: 6, train_loss: 1.1384, test_loss: 1.1010, test_f1: 0.4554
 epoch: 7, train_loss: 1.1192, test_loss: 1.0797, test_f1: 0.4605
 epoch: 8, train_loss: 1.0997, test_loss: 1.0664, test_f1: 0.4500
 epoch: 9, train_loss: 1.0837, test_loss: 1.0508, test_f1: 0.4527
 epoch: 10, train_loss: 1.0750, test_loss: 1.0411, test_f1: 0.4543
 epoch: 11, train_loss: 1.0584, test_loss: 1.0344, test_f1: 0.4591
 epoch: 12, train_loss: 1.0378, test_loss: 1.0284, test_f1: 0.4628
 epoch: 13, train_loss: 1.0299, test_loss: 1.0250, test_f1: 0.4645
 epoch: 14, train_loss: 1.0230, test_loss: 1.0135, test_f1: 0.4785
 epoch: 15, train_loss: 1.0164, test_loss: 1.0030, test_f1: 0.4984
 epoch: 16, train_loss: 1.0024, test_loss: 0.9983, test_f1: 0.4974
 epoch: 17, train_loss: 0.9944, test_loss: 0.9980, test_f1: 0.4794
 epoch: 18, train_loss: 0.9843, test_loss: 0.9843, test_f1: 0.4981
 epoch: 19, train_loss: 0.9734, test_loss: 0.9837, test_f1: 0.4844
 epoch: 20, train_loss: 0.9650, test_loss: 0.9807, test_f1: 0.4892
 epoch: 21, train_loss: 0.9618, test_loss: 0.9782, test_f1: 0.4989
 epoch: 22, train_loss: 0.9527, test_loss: 0.9672, test_f1: 0.5073
 epoch: 23, train_loss: 0.9417, test_loss: 0.9679, test_f1: 0.5073
 epoch: 24, train_loss: 0.9341, test_loss: 0.9639, test_f1: 0.5104
 epoch: 25, train_loss: 0.9212, test_loss: 0.9604, test_f1: 0.5151
 epoch: 26, train_loss: 0.9175, test_loss: 0.9624, test_f1: 0.5047
 epoch: 27, train_loss: 0.9147, test_loss: 0.9522, test_f1: 0.5076
 epoch: 28, train_loss: 0.9059, test_loss: 0.9515, test_f1: 0.4983
 epoch: 29, train_loss: 0.8894, test_loss: 0.9413, test_f1: 0.5094
 epoch: 30, train_loss: 0.8905, test_loss: 0.9416, test_f1: 0.5066
 epoch: 31, train_loss: 0.8816, test_loss: 0.9470, test_f1: 0.5094
 epoch: 32, train_loss: 0.8805, test_loss: 0.9388, test_f1: 0.5038
 epoch: 33, train_loss: 0.8762, test_loss: 0.9248, test_f1: 0.5161
 epoch: 34, train_loss: 0.8655, test_loss: 0.9265, test_f1: 0.5197
 epoch: 35, train_loss: 0.8600, test_loss: 0.9677, test_f1: 0.4876
 epoch: 36, train_loss: 0.8504, test_loss: 0.9432, test_f1: 0.5059
 epoch: 37, train_loss: 0.8468, test_loss: 0.9394, test_f1: 0.4930
 epoch: 38, train_loss: 0.8348, test_loss: 0.9158, test_f1: 0.5320
 epoch: 39, train_loss: 0.8280, test_loss: 0.9415, test_f1: 0.5256
 epoch: 40, train_loss: 0.8259, test_loss: 0.9155, test_f1: 0.5391
 epoch: 41, train_loss: 0.8235, test_loss: 0.9196, test_f1: 0.5429
 epoch: 42, train_loss: 0.8090, test_loss: 0.9087, test_f1: 0.5524
 epoch: 43, train_loss: 0.8109, test_loss: 0.9114, test_f1: 0.5450
 epoch: 44, train_loss: 0.8020, test_loss: 0.9196, test_f1: 0.5490
 epoch: 45, train_loss: 0.8011, test_loss: 0.9028, test_f1: 0.5617
 epoch: 46, train_loss: 0.7986, test_loss: 0.9346, test_f1: 0.5487
 epoch: 47, train_loss: 0.7906, test_loss: 0.9214, test_f1: 0.5455
 epoch: 48, train_loss: 0.7878, test_loss: 0.9014, test_f1: 0.5547
 epoch: 49, train_loss: 0.7770, test_loss: 0.9123, test_f1: 0.5414
 epoch: 50, train_loss: 0.7742, test_loss: 0.9044, test_f1: 0.5532
 epoch: 51, train_loss: 0.7580, test_loss: 0.8991, test_f1: 0.5617
 epoch: 52, train_loss: 0.7629, test_loss: 0.9119, test_f1: 0.5428
 epoch: 53, train_loss: 0.7626, test_loss: 0.9065, test_f1: 0.5505
 epoch: 54, train_loss: 0.7520, test_loss: 0.9205, test_f1: 0.5492
 epoch: 55, train_loss: 0.7535, test_loss: 0.9013, test_f1: 0.5587
 epoch: 56, train_loss: 0.7576, test_loss: 0.9029, test_f1: 0.5578
 epoch: 57, train_loss: 0.7567, test_loss: 0.9130, test_f1: 0.5496
 epoch: 58, train_loss: 0.7554, test_loss: 0.9090, test_f1: 0.5505
 epoch: 59, train_loss: 0.7504, test_loss: 0.9095, test_f1: 0.5521
 epoch: 60, train_loss: 0.7381, test_loss: 0.9251, test_f1: 0.5405
 epoch: 61, train_loss: 0.7378, test_loss: 0.9047, test_f1: 0.5562
 epoch: 62, train_loss: 0.7397, test_loss: 0.9316, test_f1: 0.5386
 epoch: 63, train_loss: 0.7464, test_loss: 0.8995, test_f1: 0.5593
 epoch: 64, train_loss: 0.7252, test_loss: 0.9017, test_f1: 0.5554
 epoch: 65, train_loss: 0.7316, test_loss: 0.9131, test_f1: 0.5489
 epoch: 66, train_loss: 0.7331, test_loss: 0.9109, test_f1: 0.5410
 epoch: 67, train_loss: 0.7295, test_loss: 0.9042, test_f1: 0.5491
 epoch: 68, train_loss: 0.7298, test_loss: 0.9004, test_f1: 0.5571
 epoch: 69, train_loss: 0.7268, test_loss: 0.8977, test_f1: 0.5596
 epoch: 70, train_loss: 0.7169, test_loss: 0.9055, test_f1: 0.5485
 epoch: 71, train_loss: 0.7277, test_loss: 0.8930, test_f1: 0.5586
 epoch: 72, train_loss: 0.7195, test_loss: 0.9102, test_f1: 0.5529
 epoch: 73, train_loss: 0.7141, test_loss: 0.8961, test_f1: 0.5624
 epoch: 74, train_loss: 0.7093, test_loss: 0.9037, test_f1: 0.5428
 epoch: 75, train_loss: 0.7153, test_loss: 0.9014, test_f1: 0.5604
 epoch: 76, train_loss: 0.7119, test_loss: 0.8935, test_f1: 0.5619
 epoch: 77, train_loss: 0.7097, test_loss: 0.9006, test_f1: 0.5651
 epoch: 78, train_loss: 0.7019, test_loss: 0.9084, test_f1: 0.5486
 epoch: 79, train_loss: 0.7037, test_loss: 0.9109, test_f1: 0.5521
 epoch: 80, train_loss: 0.7070, test_loss: 0.9226, test_f1: 0.5503
 epoch: 81, train_loss: 0.6895, test_loss: 0.9214, test_f1: 0.5470
 epoch: 82, train_loss: 0.7046, test_loss: 0.9080, test_f1: 0.5541
 epoch: 83, train_loss: 0.6971, test_loss: 0.9148, test_f1: 0.5583
 epoch: 84, train_loss: 0.6931, test_loss: 0.9027, test_f1: 0.5644
 epoch: 85, train_loss: 0.6921, test_loss: 0.9237, test_f1: 0.5539
 epoch: 86, train_loss: 0.6852, test_loss: 0.9159, test_f1: 0.5536
 epoch: 87, train_loss: 0.6856, test_loss: 0.9073, test_f1: 0.5633
 epoch: 88, train_loss: 0.6852, test_loss: 0.9235, test_f1: 0.5538
 epoch: 89, train_loss: 0.6900, test_loss: 0.9192, test_f1: 0.5587
 epoch: 90, train_loss: 0.6870, test_loss: 0.9233, test_f1: 0.5594
 epoch: 91, train_loss: 0.6886, test_loss: 0.9172, test_f1: 0.5633
 epoch: 92, train_loss: 0.6812, test_loss: 0.9045, test_f1: 0.5593
 epoch: 93, train_loss: 0.6848, test_loss: 0.9183, test_f1: 0.5607
 epoch: 94, train_loss: 0.6726, test_loss: 0.9267, test_f1: 0.5586
 epoch: 95, train_loss: 0.6812, test_loss: 0.9263, test_f1: 0.5613
 epoch: 96, train_loss: 0.6850, test_loss: 0.9291, test_f1: 0.5566
 epoch: 97, train_loss: 0.6761, test_loss: 0.9325, test_f1: 0.5576
 epoch: 98, train_loss: 0.6712, test_loss: 0.9353, test_f1: 0.5649
 epoch: 99, train_loss: 0.6789, test_loss: 0.9334, test_f1: 0.5619
##################ITERATION #5 ****************************************
 epoch: 0, train_loss: 1.2583, test_loss: 1.3097, test_f1: 0.2260
 epoch: 1, train_loss: 1.2026, test_loss: 1.2920, test_f1: 0.2260
 epoch: 2, train_loss: 1.1733, test_loss: 1.2546, test_f1: 0.2361
 epoch: 3, train_loss: 1.1524, test_loss: 1.1965, test_f1: 0.2764
 epoch: 4, train_loss: 1.1244, test_loss: 1.1319, test_f1: 0.4357
 epoch: 5, train_loss: 1.1060, test_loss: 1.0952, test_f1: 0.4273
 epoch: 6, train_loss: 1.0806, test_loss: 1.0587, test_f1: 0.4487
 epoch: 7, train_loss: 1.0622, test_loss: 1.0280, test_f1: 0.4611
 epoch: 8, train_loss: 1.0407, test_loss: 1.0118, test_f1: 0.4805
 epoch: 9, train_loss: 1.0225, test_loss: 0.9958, test_f1: 0.4753
 epoch: 10, train_loss: 1.0065, test_loss: 0.9808, test_f1: 0.4801
 epoch: 11, train_loss: 0.9989, test_loss: 0.9699, test_f1: 0.4778
 epoch: 12, train_loss: 0.9809, test_loss: 0.9664, test_f1: 0.4774
 epoch: 13, train_loss: 0.9660, test_loss: 0.9546, test_f1: 0.4766
 epoch: 14, train_loss: 0.9627, test_loss: 0.9366, test_f1: 0.4840
 epoch: 15, train_loss: 0.9485, test_loss: 0.9382, test_f1: 0.4880
 epoch: 16, train_loss: 0.9452, test_loss: 0.9289, test_f1: 0.4843
 epoch: 17, train_loss: 0.9319, test_loss: 0.9261, test_f1: 0.4814
 epoch: 18, train_loss: 0.9144, test_loss: 0.9208, test_f1: 0.4842
 epoch: 19, train_loss: 0.9204, test_loss: 0.9120, test_f1: 0.4843
 epoch: 20, train_loss: 0.9185, test_loss: 0.9028, test_f1: 0.4842
 epoch: 21, train_loss: 0.9050, test_loss: 0.9057, test_f1: 0.4849
 epoch: 22, train_loss: 0.8939, test_loss: 0.8964, test_f1: 0.4949
 epoch: 23, train_loss: 0.8861, test_loss: 0.8976, test_f1: 0.4813
 epoch: 24, train_loss: 0.8859, test_loss: 0.8854, test_f1: 0.4993
 epoch: 25, train_loss: 0.8776, test_loss: 0.8822, test_f1: 0.4952
 epoch: 26, train_loss: 0.8762, test_loss: 0.8912, test_f1: 0.5015
 epoch: 27, train_loss: 0.8699, test_loss: 0.8814, test_f1: 0.5017
 epoch: 28, train_loss: 0.8694, test_loss: 0.8792, test_f1: 0.5077
 epoch: 29, train_loss: 0.8543, test_loss: 0.8656, test_f1: 0.5192
 epoch: 30, train_loss: 0.8524, test_loss: 0.8747, test_f1: 0.5097
 epoch: 31, train_loss: 0.8502, test_loss: 0.8573, test_f1: 0.5241
 epoch: 32, train_loss: 0.8405, test_loss: 0.8590, test_f1: 0.5177
 epoch: 33, train_loss: 0.8417, test_loss: 0.8857, test_f1: 0.5079
 epoch: 34, train_loss: 0.8362, test_loss: 0.8609, test_f1: 0.5288
 epoch: 35, train_loss: 0.8300, test_loss: 0.8381, test_f1: 0.5500
 epoch: 36, train_loss: 0.8273, test_loss: 0.8499, test_f1: 0.5329
 epoch: 37, train_loss: 0.8148, test_loss: 0.8594, test_f1: 0.5222
 epoch: 38, train_loss: 0.8132, test_loss: 0.8476, test_f1: 0.5381
 epoch: 39, train_loss: 0.8111, test_loss: 0.8368, test_f1: 0.5391
 epoch: 40, train_loss: 0.8098, test_loss: 0.8562, test_f1: 0.5265
 epoch: 41, train_loss: 0.8055, test_loss: 0.8304, test_f1: 0.5411
 epoch: 42, train_loss: 0.7957, test_loss: 0.8387, test_f1: 0.5338
 epoch: 43, train_loss: 0.7871, test_loss: 0.8467, test_f1: 0.5348
 epoch: 44, train_loss: 0.7748, test_loss: 0.8513, test_f1: 0.5307
 epoch: 45, train_loss: 0.7713, test_loss: 0.8389, test_f1: 0.5423
 epoch: 46, train_loss: 0.7794, test_loss: 0.8395, test_f1: 0.5268
 epoch: 47, train_loss: 0.7738, test_loss: 0.8391, test_f1: 0.5292
 epoch: 48, train_loss: 0.7717, test_loss: 0.8272, test_f1: 0.5376
 epoch: 49, train_loss: 0.7672, test_loss: 0.8227, test_f1: 0.5353
 epoch: 50, train_loss: 0.7575, test_loss: 0.8243, test_f1: 0.5473
 epoch: 51, train_loss: 0.7571, test_loss: 0.8328, test_f1: 0.5451
 epoch: 52, train_loss: 0.7519, test_loss: 0.8446, test_f1: 0.5323
 epoch: 53, train_loss: 0.7540, test_loss: 0.8358, test_f1: 0.5454
 epoch: 54, train_loss: 0.7446, test_loss: 0.8328, test_f1: 0.5356
 epoch: 55, train_loss: 0.7443, test_loss: 0.8296, test_f1: 0.5458
 epoch: 56, train_loss: 0.7401, test_loss: 0.8261, test_f1: 0.5493
 epoch: 57, train_loss: 0.7331, test_loss: 0.8422, test_f1: 0.5394
 epoch: 58, train_loss: 0.7359, test_loss: 0.8328, test_f1: 0.5539
 epoch: 59, train_loss: 0.7427, test_loss: 0.8315, test_f1: 0.5583
 epoch: 60, train_loss: 0.7353, test_loss: 0.8260, test_f1: 0.5492
 epoch: 61, train_loss: 0.7298, test_loss: 0.8349, test_f1: 0.5413
 epoch: 62, train_loss: 0.7291, test_loss: 0.8514, test_f1: 0.5541
 epoch: 63, train_loss: 0.7311, test_loss: 0.8452, test_f1: 0.5430
 epoch: 64, train_loss: 0.7366, test_loss: 0.8563, test_f1: 0.5365
 epoch: 65, train_loss: 0.7314, test_loss: 0.8523, test_f1: 0.5340
 epoch: 66, train_loss: 0.7213, test_loss: 0.8421, test_f1: 0.5448
 epoch: 67, train_loss: 0.7220, test_loss: 0.8480, test_f1: 0.5437
 epoch: 68, train_loss: 0.7238, test_loss: 0.8459, test_f1: 0.5411
 epoch: 69, train_loss: 0.7117, test_loss: 0.8426, test_f1: 0.5485
 epoch: 70, train_loss: 0.7131, test_loss: 0.8373, test_f1: 0.5485
 epoch: 71, train_loss: 0.7118, test_loss: 0.8528, test_f1: 0.5406
 epoch: 72, train_loss: 0.7115, test_loss: 0.8525, test_f1: 0.5414
 epoch: 73, train_loss: 0.7176, test_loss: 0.8804, test_f1: 0.5345
 epoch: 74, train_loss: 0.7056, test_loss: 0.8586, test_f1: 0.5445
 epoch: 75, train_loss: 0.7116, test_loss: 0.8558, test_f1: 0.5459
 epoch: 76, train_loss: 0.7026, test_loss: 0.8588, test_f1: 0.5418
 epoch: 77, train_loss: 0.7020, test_loss: 0.8810, test_f1: 0.5372
 epoch: 78, train_loss: 0.6960, test_loss: 0.8701, test_f1: 0.5390
 epoch: 79, train_loss: 0.7111, test_loss: 0.8832, test_f1: 0.5354
 epoch: 80, train_loss: 0.6960, test_loss: 0.8572, test_f1: 0.5417
 epoch: 81, train_loss: 0.7061, test_loss: 0.8690, test_f1: 0.5414
 epoch: 82, train_loss: 0.7004, test_loss: 0.8659, test_f1: 0.5467
 epoch: 83, train_loss: 0.6923, test_loss: 0.8601, test_f1: 0.5399
 epoch: 84, train_loss: 0.6864, test_loss: 0.8513, test_f1: 0.5408
 epoch: 85, train_loss: 0.6855, test_loss: 0.8930, test_f1: 0.5398
 epoch: 86, train_loss: 0.6897, test_loss: 0.9046, test_f1: 0.5361
 epoch: 87, train_loss: 0.6828, test_loss: 0.8699, test_f1: 0.5399
 epoch: 88, train_loss: 0.6793, test_loss: 0.8694, test_f1: 0.5480
 epoch: 89, train_loss: 0.6870, test_loss: 0.8766, test_f1: 0.5352
 epoch: 90, train_loss: 0.6867, test_loss: 0.8854, test_f1: 0.5433
 epoch: 91, train_loss: 0.6863, test_loss: 0.8959, test_f1: 0.5439
 epoch: 92, train_loss: 0.6752, test_loss: 0.8963, test_f1: 0.5443
 epoch: 93, train_loss: 0.6714, test_loss: 0.8884, test_f1: 0.5402
 epoch: 94, train_loss: 0.6690, test_loss: 0.8879, test_f1: 0.5412
 epoch: 95, train_loss: 0.6751, test_loss: 0.8850, test_f1: 0.5351
 epoch: 96, train_loss: 0.6750, test_loss: 0.8916, test_f1: 0.5472
 epoch: 97, train_loss: 0.6747, test_loss: 0.8546, test_f1: 0.5466
 epoch: 98, train_loss: 0.6772, test_loss: 0.8994, test_f1: 0.5394
 epoch: 99, train_loss: 0.6640, test_loss: 0.8857, test_f1: 0.5429
##################ITERATION #6 ****************************************
 epoch: 0, train_loss: 1.2970, test_loss: 1.2973, test_f1: 0.2260
 epoch: 1, train_loss: 1.2213, test_loss: 1.2891, test_f1: 0.2513
 epoch: 2, train_loss: 1.1890, test_loss: 1.2621, test_f1: 0.3260
 epoch: 3, train_loss: 1.1687, test_loss: 1.1803, test_f1: 0.3569
 epoch: 4, train_loss: 1.1489, test_loss: 1.1235, test_f1: 0.4390
 epoch: 5, train_loss: 1.1292, test_loss: 1.0896, test_f1: 0.4618
 epoch: 6, train_loss: 1.1061, test_loss: 1.0643, test_f1: 0.4512
 epoch: 7, train_loss: 1.0899, test_loss: 1.0458, test_f1: 0.4546
 epoch: 8, train_loss: 1.0719, test_loss: 1.0309, test_f1: 0.4698
 epoch: 9, train_loss: 1.0606, test_loss: 1.0234, test_f1: 0.4799
 epoch: 10, train_loss: 1.0421, test_loss: 1.0119, test_f1: 0.4802
 epoch: 11, train_loss: 1.0360, test_loss: 1.0035, test_f1: 0.4772
 epoch: 12, train_loss: 1.0201, test_loss: 0.9971, test_f1: 0.4870
 epoch: 13, train_loss: 1.0047, test_loss: 0.9870, test_f1: 0.4794
 epoch: 14, train_loss: 0.9984, test_loss: 0.9880, test_f1: 0.4777
 epoch: 15, train_loss: 0.9824, test_loss: 0.9754, test_f1: 0.4804
 epoch: 16, train_loss: 0.9749, test_loss: 0.9661, test_f1: 0.4805
 epoch: 17, train_loss: 0.9677, test_loss: 0.9629, test_f1: 0.4803
 epoch: 18, train_loss: 0.9640, test_loss: 0.9597, test_f1: 0.4821
 epoch: 19, train_loss: 0.9576, test_loss: 0.9610, test_f1: 0.4706
 epoch: 20, train_loss: 0.9393, test_loss: 0.9577, test_f1: 0.4838
 epoch: 21, train_loss: 0.9409, test_loss: 0.9484, test_f1: 0.4888
 epoch: 22, train_loss: 0.9335, test_loss: 0.9625, test_f1: 0.4863
 epoch: 23, train_loss: 0.9209, test_loss: 0.9632, test_f1: 0.4833
 epoch: 24, train_loss: 0.9280, test_loss: 0.9541, test_f1: 0.4875
 epoch: 25, train_loss: 0.9181, test_loss: 0.9554, test_f1: 0.4864
 epoch: 26, train_loss: 0.9048, test_loss: 0.9583, test_f1: 0.4814
 epoch: 27, train_loss: 0.8942, test_loss: 0.9497, test_f1: 0.4932
 epoch: 28, train_loss: 0.8960, test_loss: 0.9500, test_f1: 0.5034
 epoch: 29, train_loss: 0.8909, test_loss: 0.9631, test_f1: 0.4974
 epoch: 30, train_loss: 0.8821, test_loss: 0.9899, test_f1: 0.4661
 epoch: 31, train_loss: 0.8791, test_loss: 0.9602, test_f1: 0.4853
 epoch: 32, train_loss: 0.8780, test_loss: 0.9566, test_f1: 0.4825
 epoch: 33, train_loss: 0.8614, test_loss: 0.9541, test_f1: 0.4939
 epoch: 34, train_loss: 0.8580, test_loss: 0.9422, test_f1: 0.4962
 epoch: 35, train_loss: 0.8547, test_loss: 0.9579, test_f1: 0.4988
 epoch: 36, train_loss: 0.8448, test_loss: 0.9945, test_f1: 0.4816
 epoch: 37, train_loss: 0.8419, test_loss: 0.9682, test_f1: 0.4848
 epoch: 38, train_loss: 0.8394, test_loss: 0.9542, test_f1: 0.4810
 epoch: 39, train_loss: 0.8392, test_loss: 0.9797, test_f1: 0.4643
 epoch: 40, train_loss: 0.8276, test_loss: 0.9598, test_f1: 0.4974
 epoch: 41, train_loss: 0.8354, test_loss: 0.9797, test_f1: 0.4797
 epoch: 42, train_loss: 0.8234, test_loss: 0.9643, test_f1: 0.4876
 epoch: 43, train_loss: 0.8222, test_loss: 0.9598, test_f1: 0.4984
 epoch: 44, train_loss: 0.8092, test_loss: 0.9658, test_f1: 0.4852
 epoch: 45, train_loss: 0.8110, test_loss: 1.0092, test_f1: 0.4589
 epoch: 46, train_loss: 0.8019, test_loss: 0.9725, test_f1: 0.4938
 epoch: 47, train_loss: 0.7972, test_loss: 0.9713, test_f1: 0.4911
 epoch: 48, train_loss: 0.8020, test_loss: 0.9649, test_f1: 0.4918
 epoch: 49, train_loss: 0.7838, test_loss: 0.9865, test_f1: 0.4795
 epoch: 50, train_loss: 0.7974, test_loss: 1.0190, test_f1: 0.4675
 epoch: 51, train_loss: 0.7930, test_loss: 0.9766, test_f1: 0.4961
 epoch: 52, train_loss: 0.7733, test_loss: 0.9840, test_f1: 0.4855
 epoch: 53, train_loss: 0.7775, test_loss: 0.9764, test_f1: 0.4875
 epoch: 54, train_loss: 0.7689, test_loss: 0.9830, test_f1: 0.4895
 epoch: 55, train_loss: 0.7750, test_loss: 0.9929, test_f1: 0.4752
 epoch: 56, train_loss: 0.7728, test_loss: 0.9841, test_f1: 0.4837
 epoch: 57, train_loss: 0.7784, test_loss: 0.9918, test_f1: 0.4780
 epoch: 58, train_loss: 0.7631, test_loss: 1.0105, test_f1: 0.4769
 epoch: 59, train_loss: 0.7595, test_loss: 0.9990, test_f1: 0.4719
 epoch: 60, train_loss: 0.7597, test_loss: 0.9938, test_f1: 0.4891
 epoch: 61, train_loss: 0.7586, test_loss: 1.0129, test_f1: 0.4760
 epoch: 62, train_loss: 0.7585, test_loss: 0.9931, test_f1: 0.4943
 epoch: 63, train_loss: 0.7533, test_loss: 1.0168, test_f1: 0.4862
 epoch: 64, train_loss: 0.7564, test_loss: 1.0024, test_f1: 0.4815
 epoch: 65, train_loss: 0.7600, test_loss: 0.9980, test_f1: 0.4898
 epoch: 66, train_loss: 0.7498, test_loss: 0.9591, test_f1: 0.4931
 epoch: 67, train_loss: 0.7480, test_loss: 0.9688, test_f1: 0.4958
 epoch: 68, train_loss: 0.7462, test_loss: 0.9800, test_f1: 0.4930
 epoch: 69, train_loss: 0.7586, test_loss: 0.9924, test_f1: 0.4904
 epoch: 70, train_loss: 0.7480, test_loss: 0.9704, test_f1: 0.4836
 epoch: 71, train_loss: 0.7355, test_loss: 1.0283, test_f1: 0.4859
 epoch: 72, train_loss: 0.7374, test_loss: 1.0060, test_f1: 0.4849
 epoch: 73, train_loss: 0.7292, test_loss: 1.0159, test_f1: 0.4974
 epoch: 74, train_loss: 0.7335, test_loss: 0.9928, test_f1: 0.4973
 epoch: 75, train_loss: 0.7324, test_loss: 1.0172, test_f1: 0.4924
 epoch: 76, train_loss: 0.7329, test_loss: 1.0032, test_f1: 0.4995
 epoch: 77, train_loss: 0.7257, test_loss: 1.0034, test_f1: 0.4925
 epoch: 78, train_loss: 0.7329, test_loss: 1.0066, test_f1: 0.4886
 epoch: 79, train_loss: 0.7284, test_loss: 0.9907, test_f1: 0.5084
 epoch: 80, train_loss: 0.7345, test_loss: 1.0011, test_f1: 0.4980
 epoch: 81, train_loss: 0.7347, test_loss: 0.9934, test_f1: 0.4979
 epoch: 82, train_loss: 0.7277, test_loss: 0.9947, test_f1: 0.5112
 epoch: 83, train_loss: 0.7208, test_loss: 0.9979, test_f1: 0.5153
 epoch: 84, train_loss: 0.7228, test_loss: 0.9975, test_f1: 0.5159
 epoch: 85, train_loss: 0.7190, test_loss: 1.0005, test_f1: 0.5058
 epoch: 86, train_loss: 0.7203, test_loss: 1.0084, test_f1: 0.4989
 epoch: 87, train_loss: 0.7170, test_loss: 0.9966, test_f1: 0.5123
 epoch: 88, train_loss: 0.7236, test_loss: 1.0073, test_f1: 0.4999
 epoch: 89, train_loss: 0.7111, test_loss: 1.0154, test_f1: 0.5048
 epoch: 90, train_loss: 0.7142, test_loss: 1.0010, test_f1: 0.5096
 epoch: 91, train_loss: 0.7111, test_loss: 1.0198, test_f1: 0.5131
 epoch: 92, train_loss: 0.7087, test_loss: 0.9962, test_f1: 0.5169
 epoch: 93, train_loss: 0.7070, test_loss: 1.0198, test_f1: 0.5114
 epoch: 94, train_loss: 0.7021, test_loss: 1.0124, test_f1: 0.5088
 epoch: 95, train_loss: 0.6983, test_loss: 1.0164, test_f1: 0.5078
 epoch: 96, train_loss: 0.7097, test_loss: 1.0079, test_f1: 0.5144
 epoch: 97, train_loss: 0.7044, test_loss: 1.0371, test_f1: 0.5084
 epoch: 98, train_loss: 0.6986, test_loss: 1.0295, test_f1: 0.5035
 epoch: 99, train_loss: 0.7032, test_loss: 1.0310, test_f1: 0.5171
##################ITERATION #7 ****************************************
 epoch: 0, train_loss: 1.3058, test_loss: 1.3051, test_f1: 0.2260
 epoch: 1, train_loss: 1.2271, test_loss: 1.3018, test_f1: 0.2260
 epoch: 2, train_loss: 1.1996, test_loss: 1.2766, test_f1: 0.2260
 epoch: 3, train_loss: 1.1661, test_loss: 1.2151, test_f1: 0.2485
 epoch: 4, train_loss: 1.1503, test_loss: 1.1329, test_f1: 0.3871
 epoch: 5, train_loss: 1.1247, test_loss: 1.0831, test_f1: 0.4678
 epoch: 6, train_loss: 1.1065, test_loss: 1.0601, test_f1: 0.4592
 epoch: 7, train_loss: 1.0909, test_loss: 1.0462, test_f1: 0.4661
 epoch: 8, train_loss: 1.0672, test_loss: 1.0354, test_f1: 0.4556
 epoch: 9, train_loss: 1.0607, test_loss: 1.0258, test_f1: 0.4607
 epoch: 10, train_loss: 1.0440, test_loss: 1.0184, test_f1: 0.4656
 epoch: 11, train_loss: 1.0222, test_loss: 1.0142, test_f1: 0.4529
 epoch: 12, train_loss: 1.0220, test_loss: 1.0027, test_f1: 0.4618
 epoch: 13, train_loss: 1.0107, test_loss: 0.9968, test_f1: 0.4555
 epoch: 14, train_loss: 1.0031, test_loss: 0.9930, test_f1: 0.4681
 epoch: 15, train_loss: 0.9828, test_loss: 0.9885, test_f1: 0.4707
 epoch: 16, train_loss: 0.9788, test_loss: 0.9832, test_f1: 0.4746
 epoch: 17, train_loss: 0.9725, test_loss: 0.9831, test_f1: 0.4616
 epoch: 18, train_loss: 0.9655, test_loss: 0.9752, test_f1: 0.4695
 epoch: 19, train_loss: 0.9554, test_loss: 0.9679, test_f1: 0.4723
 epoch: 20, train_loss: 0.9482, test_loss: 0.9668, test_f1: 0.4787
 epoch: 21, train_loss: 0.9398, test_loss: 0.9577, test_f1: 0.4780
 epoch: 22, train_loss: 0.9348, test_loss: 0.9610, test_f1: 0.4795
 epoch: 23, train_loss: 0.9238, test_loss: 0.9629, test_f1: 0.4760
 epoch: 24, train_loss: 0.9220, test_loss: 0.9727, test_f1: 0.4763
 epoch: 25, train_loss: 0.9087, test_loss: 0.9510, test_f1: 0.4805
 epoch: 26, train_loss: 0.8984, test_loss: 0.9634, test_f1: 0.4678
 epoch: 27, train_loss: 0.9036, test_loss: 0.9423, test_f1: 0.4834
 epoch: 28, train_loss: 0.8952, test_loss: 0.9470, test_f1: 0.4920
 epoch: 29, train_loss: 0.8873, test_loss: 0.9442, test_f1: 0.4913
 epoch: 30, train_loss: 0.8788, test_loss: 0.9370, test_f1: 0.4874
 epoch: 31, train_loss: 0.8689, test_loss: 0.9421, test_f1: 0.4888
 epoch: 32, train_loss: 0.8636, test_loss: 0.9386, test_f1: 0.4998
 epoch: 33, train_loss: 0.8637, test_loss: 0.9385, test_f1: 0.4985
 epoch: 34, train_loss: 0.8632, test_loss: 0.9373, test_f1: 0.4895
 epoch: 35, train_loss: 0.8489, test_loss: 0.9312, test_f1: 0.5002
 epoch: 36, train_loss: 0.8544, test_loss: 0.9346, test_f1: 0.4973
 epoch: 37, train_loss: 0.8483, test_loss: 0.9281, test_f1: 0.5016
 epoch: 38, train_loss: 0.8425, test_loss: 0.9405, test_f1: 0.4963
 epoch: 39, train_loss: 0.8309, test_loss: 0.9323, test_f1: 0.5086
 epoch: 40, train_loss: 0.8253, test_loss: 0.9209, test_f1: 0.5082
 epoch: 41, train_loss: 0.8263, test_loss: 0.9296, test_f1: 0.5064
 epoch: 42, train_loss: 0.8198, test_loss: 0.9431, test_f1: 0.5092
 epoch: 43, train_loss: 0.8145, test_loss: 0.9287, test_f1: 0.5180
 epoch: 44, train_loss: 0.8158, test_loss: 0.9559, test_f1: 0.5118
 epoch: 45, train_loss: 0.8163, test_loss: 0.9268, test_f1: 0.5170
 epoch: 46, train_loss: 0.7963, test_loss: 0.9414, test_f1: 0.5135
 epoch: 47, train_loss: 0.7906, test_loss: 0.9417, test_f1: 0.5002
 epoch: 48, train_loss: 0.7939, test_loss: 0.9743, test_f1: 0.5170
 epoch: 49, train_loss: 0.7774, test_loss: 0.9423, test_f1: 0.5206
 epoch: 50, train_loss: 0.7811, test_loss: 0.9668, test_f1: 0.5219
 epoch: 51, train_loss: 0.7737, test_loss: 0.9575, test_f1: 0.5171
 epoch: 52, train_loss: 0.7709, test_loss: 0.9509, test_f1: 0.5257
 epoch: 53, train_loss: 0.7690, test_loss: 0.9574, test_f1: 0.5250
 epoch: 54, train_loss: 0.7651, test_loss: 0.9737, test_f1: 0.5225
 epoch: 55, train_loss: 0.7652, test_loss: 0.9477, test_f1: 0.5266
 epoch: 56, train_loss: 0.7634, test_loss: 0.9566, test_f1: 0.5295
 epoch: 57, train_loss: 0.7622, test_loss: 0.9578, test_f1: 0.5219
 epoch: 58, train_loss: 0.7585, test_loss: 0.9738, test_f1: 0.5225
 epoch: 59, train_loss: 0.7474, test_loss: 0.9526, test_f1: 0.5324
 epoch: 60, train_loss: 0.7638, test_loss: 0.9702, test_f1: 0.5247
 epoch: 61, train_loss: 0.7510, test_loss: 0.9820, test_f1: 0.5174
 epoch: 62, train_loss: 0.7523, test_loss: 0.9620, test_f1: 0.5346
 epoch: 63, train_loss: 0.7421, test_loss: 0.9650, test_f1: 0.5189
 epoch: 64, train_loss: 0.7326, test_loss: 0.9704, test_f1: 0.5225
 epoch: 65, train_loss: 0.7420, test_loss: 0.9685, test_f1: 0.5252
 epoch: 66, train_loss: 0.7403, test_loss: 0.9745, test_f1: 0.5248
 epoch: 67, train_loss: 0.7316, test_loss: 0.9707, test_f1: 0.5293
 epoch: 68, train_loss: 0.7339, test_loss: 0.9803, test_f1: 0.5252
 epoch: 69, train_loss: 0.7289, test_loss: 0.9655, test_f1: 0.5304
 epoch: 70, train_loss: 0.7247, test_loss: 0.9806, test_f1: 0.5179
 epoch: 71, train_loss: 0.7281, test_loss: 0.9765, test_f1: 0.5234
 epoch: 72, train_loss: 0.7265, test_loss: 0.9756, test_f1: 0.5323
 epoch: 73, train_loss: 0.7258, test_loss: 0.9794, test_f1: 0.5250
 epoch: 74, train_loss: 0.7354, test_loss: 0.9833, test_f1: 0.5268
 epoch: 75, train_loss: 0.7209, test_loss: 0.9969, test_f1: 0.5169
 epoch: 76, train_loss: 0.7183, test_loss: 0.9871, test_f1: 0.5272
 epoch: 77, train_loss: 0.7150, test_loss: 0.9864, test_f1: 0.5358
 epoch: 78, train_loss: 0.7216, test_loss: 0.9783, test_f1: 0.5350
 epoch: 79, train_loss: 0.7152, test_loss: 0.9683, test_f1: 0.5384
 epoch: 80, train_loss: 0.7100, test_loss: 0.9809, test_f1: 0.5329
 epoch: 81, train_loss: 0.7067, test_loss: 1.0080, test_f1: 0.5224
 epoch: 82, train_loss: 0.7087, test_loss: 0.9886, test_f1: 0.5250
 epoch: 83, train_loss: 0.7139, test_loss: 0.9889, test_f1: 0.5314
 epoch: 84, train_loss: 0.7105, test_loss: 0.9803, test_f1: 0.5423
 epoch: 85, train_loss: 0.7010, test_loss: 0.9813, test_f1: 0.5369
 epoch: 86, train_loss: 0.7088, test_loss: 0.9910, test_f1: 0.5402
 epoch: 87, train_loss: 0.7016, test_loss: 0.9899, test_f1: 0.5396
 epoch: 88, train_loss: 0.6977, test_loss: 0.9872, test_f1: 0.5411
 epoch: 89, train_loss: 0.6993, test_loss: 0.9940, test_f1: 0.5370
 epoch: 90, train_loss: 0.7070, test_loss: 0.9921, test_f1: 0.5395
 epoch: 91, train_loss: 0.6942, test_loss: 0.9938, test_f1: 0.5382
 epoch: 92, train_loss: 0.6902, test_loss: 1.0005, test_f1: 0.5406
 epoch: 93, train_loss: 0.6921, test_loss: 0.9753, test_f1: 0.5517
 epoch: 94, train_loss: 0.6940, test_loss: 0.9940, test_f1: 0.5465
 epoch: 95, train_loss: 0.6871, test_loss: 0.9852, test_f1: 0.5416
 epoch: 96, train_loss: 0.6858, test_loss: 1.0078, test_f1: 0.5360
 epoch: 97, train_loss: 0.6761, test_loss: 1.0098, test_f1: 0.5467
 epoch: 98, train_loss: 0.6787, test_loss: 0.9996, test_f1: 0.5418
 epoch: 99, train_loss: 0.6775, test_loss: 1.0007, test_f1: 0.5417
##################ITERATION #8 ****************************************
 epoch: 0, train_loss: 1.2977, test_loss: 1.3106, test_f1: 0.2260
 epoch: 1, train_loss: 1.2147, test_loss: 1.3000, test_f1: 0.2260
 epoch: 2, train_loss: 1.1782, test_loss: 1.2739, test_f1: 0.2995
 epoch: 3, train_loss: 1.1543, test_loss: 1.1815, test_f1: 0.3411
 epoch: 4, train_loss: 1.1363, test_loss: 1.1192, test_f1: 0.4213
 epoch: 5, train_loss: 1.1071, test_loss: 1.0713, test_f1: 0.4541
 epoch: 6, train_loss: 1.0887, test_loss: 1.0547, test_f1: 0.4645
 epoch: 7, train_loss: 1.0782, test_loss: 1.0453, test_f1: 0.4607
 epoch: 8, train_loss: 1.0594, test_loss: 1.0359, test_f1: 0.4617
 epoch: 9, train_loss: 1.0570, test_loss: 1.0284, test_f1: 0.4667
 epoch: 10, train_loss: 1.0408, test_loss: 1.0243, test_f1: 0.4686
 epoch: 11, train_loss: 1.0275, test_loss: 1.0096, test_f1: 0.4775
 epoch: 12, train_loss: 1.0196, test_loss: 0.9999, test_f1: 0.4908
 epoch: 13, train_loss: 1.0156, test_loss: 0.9964, test_f1: 0.4771
 epoch: 14, train_loss: 0.9991, test_loss: 0.9896, test_f1: 0.4857
 epoch: 15, train_loss: 0.9843, test_loss: 0.9745, test_f1: 0.4918
 epoch: 16, train_loss: 0.9776, test_loss: 0.9713, test_f1: 0.4935
 epoch: 17, train_loss: 0.9800, test_loss: 0.9679, test_f1: 0.4977
 epoch: 18, train_loss: 0.9663, test_loss: 0.9632, test_f1: 0.5031
 epoch: 19, train_loss: 0.9586, test_loss: 0.9650, test_f1: 0.5042
 epoch: 20, train_loss: 0.9503, test_loss: 0.9625, test_f1: 0.5058
 epoch: 21, train_loss: 0.9377, test_loss: 0.9688, test_f1: 0.5075
 epoch: 22, train_loss: 0.9393, test_loss: 0.9687, test_f1: 0.5122
 epoch: 23, train_loss: 0.9316, test_loss: 0.9686, test_f1: 0.5139
 epoch: 24, train_loss: 0.9286, test_loss: 0.9554, test_f1: 0.5099
 epoch: 25, train_loss: 0.9231, test_loss: 0.9756, test_f1: 0.4987
 epoch: 26, train_loss: 0.9149, test_loss: 0.9654, test_f1: 0.5149
 epoch: 27, train_loss: 0.9134, test_loss: 0.9724, test_f1: 0.4963
 epoch: 28, train_loss: 0.9043, test_loss: 0.9658, test_f1: 0.4997
 epoch: 29, train_loss: 0.8993, test_loss: 0.9476, test_f1: 0.5194
 epoch: 30, train_loss: 0.8863, test_loss: 0.9668, test_f1: 0.5092
 epoch: 31, train_loss: 0.8811, test_loss: 0.9598, test_f1: 0.5189
 epoch: 32, train_loss: 0.8767, test_loss: 0.9515, test_f1: 0.5174
 epoch: 33, train_loss: 0.8672, test_loss: 0.9476, test_f1: 0.5313
 epoch: 34, train_loss: 0.8721, test_loss: 0.9667, test_f1: 0.5152
 epoch: 35, train_loss: 0.8672, test_loss: 0.9467, test_f1: 0.5293
 epoch: 36, train_loss: 0.8614, test_loss: 0.9328, test_f1: 0.5396
 epoch: 37, train_loss: 0.8498, test_loss: 0.9571, test_f1: 0.5363
 epoch: 38, train_loss: 0.8485, test_loss: 0.9865, test_f1: 0.5298
 epoch: 39, train_loss: 0.8369, test_loss: 0.9506, test_f1: 0.5329
 epoch: 40, train_loss: 0.8388, test_loss: 0.9657, test_f1: 0.5281
 epoch: 41, train_loss: 0.8314, test_loss: 0.9617, test_f1: 0.5267
 epoch: 42, train_loss: 0.8383, test_loss: 0.9620, test_f1: 0.5278
 epoch: 43, train_loss: 0.8198, test_loss: 1.0255, test_f1: 0.5294
 epoch: 44, train_loss: 0.8211, test_loss: 0.9480, test_f1: 0.5417
 epoch: 45, train_loss: 0.8207, test_loss: 0.9309, test_f1: 0.5504
 epoch: 46, train_loss: 0.8077, test_loss: 0.9343, test_f1: 0.5517
 epoch: 47, train_loss: 0.8064, test_loss: 0.9272, test_f1: 0.5502
 epoch: 48, train_loss: 0.8014, test_loss: 0.9286, test_f1: 0.5583
 epoch: 49, train_loss: 0.7837, test_loss: 0.9589, test_f1: 0.5293
 epoch: 50, train_loss: 0.7892, test_loss: 1.0057, test_f1: 0.5326
 epoch: 51, train_loss: 0.7855, test_loss: 0.9752, test_f1: 0.5388
 epoch: 52, train_loss: 0.7801, test_loss: 0.9660, test_f1: 0.5481
 epoch: 53, train_loss: 0.7748, test_loss: 0.9780, test_f1: 0.5387
 epoch: 54, train_loss: 0.7720, test_loss: 0.9925, test_f1: 0.5437
 epoch: 55, train_loss: 0.7855, test_loss: 0.9737, test_f1: 0.5481
 epoch: 56, train_loss: 0.7807, test_loss: 0.9804, test_f1: 0.5357
 epoch: 57, train_loss: 0.7733, test_loss: 0.9678, test_f1: 0.5440
 epoch: 58, train_loss: 0.7682, test_loss: 1.0405, test_f1: 0.5460
 epoch: 59, train_loss: 0.7756, test_loss: 1.0333, test_f1: 0.5451
 epoch: 60, train_loss: 0.7615, test_loss: 0.9517, test_f1: 0.5415
 epoch: 61, train_loss: 0.7652, test_loss: 0.9822, test_f1: 0.5481
 epoch: 62, train_loss: 0.7599, test_loss: 0.9544, test_f1: 0.5416
 epoch: 63, train_loss: 0.7635, test_loss: 0.9539, test_f1: 0.5491
 epoch: 64, train_loss: 0.7481, test_loss: 0.9968, test_f1: 0.5388
 epoch: 65, train_loss: 0.7540, test_loss: 1.0061, test_f1: 0.5420
 epoch: 66, train_loss: 0.7575, test_loss: 0.9408, test_f1: 0.5486
 epoch: 67, train_loss: 0.7535, test_loss: 0.9306, test_f1: 0.5604
 epoch: 68, train_loss: 0.7477, test_loss: 0.9916, test_f1: 0.5493
 epoch: 69, train_loss: 0.7402, test_loss: 0.9557, test_f1: 0.5443
 epoch: 70, train_loss: 0.7535, test_loss: 0.9470, test_f1: 0.5492
 epoch: 71, train_loss: 0.7425, test_loss: 0.9532, test_f1: 0.5489
 epoch: 72, train_loss: 0.7379, test_loss: 1.0008, test_f1: 0.5494
 epoch: 73, train_loss: 0.7309, test_loss: 1.0169, test_f1: 0.5472
 epoch: 74, train_loss: 0.7382, test_loss: 1.0108, test_f1: 0.5468
 epoch: 75, train_loss: 0.7356, test_loss: 1.0248, test_f1: 0.5463
 epoch: 76, train_loss: 0.7297, test_loss: 1.0362, test_f1: 0.5443
 epoch: 77, train_loss: 0.7269, test_loss: 0.9751, test_f1: 0.5506
 epoch: 78, train_loss: 0.7242, test_loss: 0.9547, test_f1: 0.5539
 epoch: 79, train_loss: 0.7314, test_loss: 1.0035, test_f1: 0.5488
 epoch: 80, train_loss: 0.7316, test_loss: 0.9927, test_f1: 0.5464
 epoch: 81, train_loss: 0.7247, test_loss: 1.0782, test_f1: 0.5475
 epoch: 82, train_loss: 0.7139, test_loss: 1.0645, test_f1: 0.5483
 epoch: 83, train_loss: 0.7153, test_loss: 1.0252, test_f1: 0.5478
 epoch: 84, train_loss: 0.7248, test_loss: 1.0333, test_f1: 0.5459
 epoch: 85, train_loss: 0.7167, test_loss: 1.0131, test_f1: 0.5501
 epoch: 86, train_loss: 0.7143, test_loss: 1.0061, test_f1: 0.5391
 epoch: 87, train_loss: 0.7201, test_loss: 0.9827, test_f1: 0.5512
 epoch: 88, train_loss: 0.7055, test_loss: 0.9906, test_f1: 0.5533
 epoch: 89, train_loss: 0.7033, test_loss: 1.0032, test_f1: 0.5489
 epoch: 90, train_loss: 0.7010, test_loss: 0.9828, test_f1: 0.5478
 epoch: 91, train_loss: 0.7062, test_loss: 1.0055, test_f1: 0.5466
 epoch: 92, train_loss: 0.6961, test_loss: 0.9739, test_f1: 0.5514
 epoch: 93, train_loss: 0.7065, test_loss: 0.9638, test_f1: 0.5485
 epoch: 94, train_loss: 0.7114, test_loss: 0.9812, test_f1: 0.5489
 epoch: 95, train_loss: 0.6960, test_loss: 0.9879, test_f1: 0.5529
 epoch: 96, train_loss: 0.6900, test_loss: 1.0764, test_f1: 0.5505
 epoch: 97, train_loss: 0.6922, test_loss: 1.0522, test_f1: 0.5552
 epoch: 98, train_loss: 0.6955, test_loss: 1.0601, test_f1: 0.5535
 epoch: 99, train_loss: 0.6968, test_loss: 1.0400, test_f1: 0.5428
##################ITERATION #9 ****************************************
 epoch: 0, train_loss: 1.3181, test_loss: 1.3352, test_f1: 0.2260
 epoch: 1, train_loss: 1.2075, test_loss: 1.3246, test_f1: 0.2540
 epoch: 2, train_loss: 1.1711, test_loss: 1.3089, test_f1: 0.3031
 epoch: 3, train_loss: 1.1429, test_loss: 1.2031, test_f1: 0.3263
 epoch: 4, train_loss: 1.1239, test_loss: 1.1020, test_f1: 0.4294
 epoch: 5, train_loss: 1.1013, test_loss: 1.0556, test_f1: 0.4644
 epoch: 6, train_loss: 1.0758, test_loss: 1.0332, test_f1: 0.4711
 epoch: 7, train_loss: 1.0655, test_loss: 1.0165, test_f1: 0.4687
 epoch: 8, train_loss: 1.0552, test_loss: 1.0043, test_f1: 0.4756
 epoch: 9, train_loss: 1.0421, test_loss: 0.9955, test_f1: 0.4722
 epoch: 10, train_loss: 1.0283, test_loss: 0.9827, test_f1: 0.4663
 epoch: 11, train_loss: 1.0169, test_loss: 0.9747, test_f1: 0.4697
 epoch: 12, train_loss: 1.0055, test_loss: 0.9691, test_f1: 0.4695
 epoch: 13, train_loss: 0.9898, test_loss: 0.9656, test_f1: 0.4641
 epoch: 14, train_loss: 0.9781, test_loss: 0.9564, test_f1: 0.4656
 epoch: 15, train_loss: 0.9702, test_loss: 0.9516, test_f1: 0.4652
 epoch: 16, train_loss: 0.9646, test_loss: 0.9417, test_f1: 0.4731
 epoch: 17, train_loss: 0.9591, test_loss: 0.9501, test_f1: 0.4785
 epoch: 18, train_loss: 0.9522, test_loss: 0.9446, test_f1: 0.4741
 epoch: 19, train_loss: 0.9395, test_loss: 0.9324, test_f1: 0.4769
 epoch: 20, train_loss: 0.9324, test_loss: 0.9297, test_f1: 0.4904
 epoch: 21, train_loss: 0.9263, test_loss: 0.9239, test_f1: 0.4849
 epoch: 22, train_loss: 0.9072, test_loss: 0.9196, test_f1: 0.4877
 epoch: 23, train_loss: 0.9039, test_loss: 0.9213, test_f1: 0.4848
 epoch: 24, train_loss: 0.9093, test_loss: 0.9084, test_f1: 0.4880
 epoch: 25, train_loss: 0.9031, test_loss: 0.8959, test_f1: 0.4874
 epoch: 26, train_loss: 0.8899, test_loss: 0.9083, test_f1: 0.4940
 epoch: 27, train_loss: 0.8817, test_loss: 0.9077, test_f1: 0.4844
 epoch: 28, train_loss: 0.8716, test_loss: 0.9078, test_f1: 0.4876
 epoch: 29, train_loss: 0.8666, test_loss: 0.9003, test_f1: 0.4917
 epoch: 30, train_loss: 0.8587, test_loss: 0.9078, test_f1: 0.4916
 epoch: 31, train_loss: 0.8556, test_loss: 0.9196, test_f1: 0.4975
 epoch: 32, train_loss: 0.8431, test_loss: 0.9012, test_f1: 0.5033
 epoch: 33, train_loss: 0.8411, test_loss: 0.9025, test_f1: 0.4972
 epoch: 34, train_loss: 0.8386, test_loss: 0.8912, test_f1: 0.5073
 epoch: 35, train_loss: 0.8343, test_loss: 0.9054, test_f1: 0.5064
 epoch: 36, train_loss: 0.8160, test_loss: 0.9225, test_f1: 0.4868
 epoch: 37, train_loss: 0.8244, test_loss: 0.9050, test_f1: 0.5095
 epoch: 38, train_loss: 0.8186, test_loss: 0.9208, test_f1: 0.4950
 epoch: 39, train_loss: 0.8148, test_loss: 0.9045, test_f1: 0.5089
 epoch: 40, train_loss: 0.8070, test_loss: 0.9064, test_f1: 0.5024
 epoch: 41, train_loss: 0.8018, test_loss: 0.8912, test_f1: 0.5057
 epoch: 42, train_loss: 0.8092, test_loss: 0.9491, test_f1: 0.4984
 epoch: 43, train_loss: 0.7892, test_loss: 0.8936, test_f1: 0.5182
 epoch: 44, train_loss: 0.7847, test_loss: 0.8866, test_f1: 0.5327
 epoch: 45, train_loss: 0.7787, test_loss: 0.9324, test_f1: 0.5210
 epoch: 46, train_loss: 0.7767, test_loss: 0.9108, test_f1: 0.5257
 epoch: 47, train_loss: 0.7723, test_loss: 0.9142, test_f1: 0.5245
 epoch: 48, train_loss: 0.7692, test_loss: 0.8695, test_f1: 0.5477
 epoch: 49, train_loss: 0.7750, test_loss: 0.9028, test_f1: 0.5492
 epoch: 50, train_loss: 0.7645, test_loss: 0.9082, test_f1: 0.5318
 epoch: 51, train_loss: 0.7547, test_loss: 0.9067, test_f1: 0.5455
 epoch: 52, train_loss: 0.7458, test_loss: 0.9063, test_f1: 0.5449
 epoch: 53, train_loss: 0.7408, test_loss: 0.9258, test_f1: 0.5379
 epoch: 54, train_loss: 0.7354, test_loss: 0.8977, test_f1: 0.5487
 epoch: 55, train_loss: 0.7413, test_loss: 0.9123, test_f1: 0.5408
 epoch: 56, train_loss: 0.7292, test_loss: 0.9250, test_f1: 0.5534
 epoch: 57, train_loss: 0.7326, test_loss: 0.9078, test_f1: 0.5495
 epoch: 58, train_loss: 0.7385, test_loss: 0.9096, test_f1: 0.5601
 epoch: 59, train_loss: 0.7230, test_loss: 0.9261, test_f1: 0.5493
 epoch: 60, train_loss: 0.7248, test_loss: 0.9291, test_f1: 0.5490
 epoch: 61, train_loss: 0.7241, test_loss: 0.9290, test_f1: 0.5437
 epoch: 62, train_loss: 0.7228, test_loss: 0.9282, test_f1: 0.5501
 epoch: 63, train_loss: 0.7158, test_loss: 0.9373, test_f1: 0.5395
 epoch: 64, train_loss: 0.7247, test_loss: 0.9276, test_f1: 0.5528
 epoch: 65, train_loss: 0.7272, test_loss: 0.9168, test_f1: 0.5519
 epoch: 66, train_loss: 0.7199, test_loss: 0.9224, test_f1: 0.5651
 epoch: 67, train_loss: 0.7184, test_loss: 0.9555, test_f1: 0.5570
 epoch: 68, train_loss: 0.7042, test_loss: 0.9114, test_f1: 0.5617
 epoch: 69, train_loss: 0.7090, test_loss: 0.9352, test_f1: 0.5474
 epoch: 70, train_loss: 0.7109, test_loss: 0.9211, test_f1: 0.5636
 epoch: 71, train_loss: 0.7128, test_loss: 0.9337, test_f1: 0.5467
 epoch: 72, train_loss: 0.6996, test_loss: 0.9280, test_f1: 0.5465
 epoch: 73, train_loss: 0.7058, test_loss: 0.9358, test_f1: 0.5594
 epoch: 74, train_loss: 0.7053, test_loss: 0.9373, test_f1: 0.5579
 epoch: 75, train_loss: 0.7108, test_loss: 0.9219, test_f1: 0.5534
 epoch: 76, train_loss: 0.7059, test_loss: 0.9205, test_f1: 0.5521
 epoch: 77, train_loss: 0.6898, test_loss: 0.9425, test_f1: 0.5452
 epoch: 78, train_loss: 0.6905, test_loss: 0.9257, test_f1: 0.5575
 epoch: 79, train_loss: 0.6975, test_loss: 0.9266, test_f1: 0.5584
 epoch: 80, train_loss: 0.6917, test_loss: 0.9272, test_f1: 0.5649
 epoch: 81, train_loss: 0.6849, test_loss: 0.9062, test_f1: 0.5549
 epoch: 82, train_loss: 0.6746, test_loss: 0.9310, test_f1: 0.5559
 epoch: 83, train_loss: 0.6818, test_loss: 0.9148, test_f1: 0.5602
 epoch: 84, train_loss: 0.6828, test_loss: 0.9439, test_f1: 0.5628
 epoch: 85, train_loss: 0.6871, test_loss: 0.9454, test_f1: 0.5516
 epoch: 86, train_loss: 0.6763, test_loss: 0.9438, test_f1: 0.5538
 epoch: 87, train_loss: 0.6778, test_loss: 0.9323, test_f1: 0.5626
 epoch: 88, train_loss: 0.6718, test_loss: 0.9515, test_f1: 0.5607
 epoch: 89, train_loss: 0.6685, test_loss: 0.9837, test_f1: 0.5439
 epoch: 90, train_loss: 0.6745, test_loss: 0.9721, test_f1: 0.5527
 epoch: 91, train_loss: 0.6808, test_loss: 0.9381, test_f1: 0.5556
 epoch: 92, train_loss: 0.6663, test_loss: 0.9473, test_f1: 0.5518
 epoch: 93, train_loss: 0.6614, test_loss: 0.9681, test_f1: 0.5604
 epoch: 94, train_loss: 0.6642, test_loss: 0.9548, test_f1: 0.5664
 epoch: 95, train_loss: 0.6686, test_loss: 0.9639, test_f1: 0.5483
 epoch: 96, train_loss: 0.6611, test_loss: 0.9392, test_f1: 0.5495
 epoch: 97, train_loss: 0.6668, test_loss: 0.9470, test_f1: 0.5552
 epoch: 98, train_loss: 0.6688, test_loss: 0.9977, test_f1: 0.5496
 epoch: 99, train_loss: 0.6597, test_loss: 0.9889, test_f1: 0.5507

Training completed in 444.51 seconds
Best F1: 0.5693 at epoch 83
Mean F1 across iterations: 0.5521  0.0150
========================FINAL RESULTS================================
FEGIN weighted F1: 0.5693  0.0150
python main.py --data ltspice_examples --representation component_pin --model FEGIN --layers 4 --hiddens 64 --batch_size 256 --lr 0.0001 --emb_size 128 --epochs 100 --save_appendix component_pin_L4_H64_BS256_LR0.0001_E128 --no_val
-----



STDERR:
  File "main.py", line 370, in <module>
    main()
  File "main.py", line 254, in main
    dataset = dataset_class(
  File "/home/philip/projects/ltspice_examples_code_repo/Circuit-Completion-Using-GNNs/component_classification_with_link_prediction_head/evaluation/FEGIN/kernel/circuit_datasets.py", line 15, in __init__
    self.data, self.slices = torch.load(self.processed_paths[0])
  File "/home/philip/.local/lib/python3.8/site-packages/torch/serialization.py", line 1040, in load
    warnings.warn(
  File "/usr/lib/python3.8/warnings.py", line 109, in _showwarnmsg
    sw(msg.message, msg.category, msg.filename, msg.lineno,
  File "main.py", line 47, in warn_with_traceback
    traceback.print_stack(file=log)
/home/philip/projects/ltspice_examples_code_repo/Circuit-Completion-Using-GNNs/component_classification_with_link_prediction_head/evaluation/FEGIN/kernel/circuit_datasets.py:15: FutureWarning: You are using `torch.load` with `weights_only=False` (the current default value), which uses the default pickle module implicitly. It is possible to construct malicious pickle data which will execute arbitrary code during unpickling (See https://github.com/pytorch/pytorch/blob/main/SECURITY.md#untrusted-models for more details). In a future release, the default value for `weights_only` will be flipped to `True`. This limits the functions that could be executed during unpickling. Arbitrary objects will no longer be allowed to be loaded via this mode unless they are explicitly allowlisted by the user via `torch.serialization.add_safe_globals`. We recommend you start setting `weights_only=True` for any use case where you don't have full control of the loaded file. Please open an issue on GitHub for any issues related to this experimental feature.
  self.data, self.slices = torch.load(self.processed_paths[0])
