STDOUT:
Results will be saved in /home/philip/projects/ltspice_examples_code_repo/Circuit-Completion-Using-GNNs/component_classification_with_link_prediction_head/evaluation/FEGIN/results/model_FEGIN_dataset_ltspice_examples
Command line input: python main.py --data ltspice_examples --representation component_pin --model FEGIN --layers 2 --hiddens 128 --batch_size 32 --lr 0.0001 --emb_size 250 --epochs 100 --save_appendix component_pin_L2_H128_BS32_LR0.0001_E250 --no_val
 is saved.
-----
ltspice_examples - FEGIN
Using 2 layers, 128 hidden units, h = 2
Loading component_pin representation dataset
ENTERED
Training FEGIN on component_pin representation
Train: 3560, Test: 848
##################ITERATION #0 ****************************************
 epoch: 0, train_loss: 1.3325, test_loss: 1.2085, test_f1: 0.3361
 epoch: 1, train_loss: 1.1555, test_loss: 1.0849, test_f1: 0.3445
 epoch: 2, train_loss: 1.0701, test_loss: 1.0522, test_f1: 0.3432
 epoch: 3, train_loss: 1.0374, test_loss: 1.0367, test_f1: 0.3711
 epoch: 4, train_loss: 1.0163, test_loss: 1.0103, test_f1: 0.4266
 epoch: 5, train_loss: 0.9920, test_loss: 1.0077, test_f1: 0.4320
 epoch: 6, train_loss: 0.9765, test_loss: 1.0099, test_f1: 0.4737
 epoch: 7, train_loss: 0.9615, test_loss: 0.9923, test_f1: 0.4889
 epoch: 8, train_loss: 0.9555, test_loss: 1.0021, test_f1: 0.4707
 epoch: 9, train_loss: 0.9316, test_loss: 0.9833, test_f1: 0.4844
 epoch: 10, train_loss: 0.9223, test_loss: 0.9773, test_f1: 0.5013
 epoch: 11, train_loss: 0.9011, test_loss: 0.9970, test_f1: 0.5090
 epoch: 12, train_loss: 0.8898, test_loss: 0.9351, test_f1: 0.5206
 epoch: 13, train_loss: 0.8764, test_loss: 0.9329, test_f1: 0.5145
 epoch: 14, train_loss: 0.8601, test_loss: 0.9096, test_f1: 0.5178
 epoch: 15, train_loss: 0.8423, test_loss: 0.9153, test_f1: 0.5239
 epoch: 16, train_loss: 0.8369, test_loss: 0.9013, test_f1: 0.5202
 epoch: 17, train_loss: 0.8239, test_loss: 0.8796, test_f1: 0.5355
 epoch: 18, train_loss: 0.8172, test_loss: 0.8636, test_f1: 0.5440
 epoch: 19, train_loss: 0.7944, test_loss: 0.8747, test_f1: 0.5401
 epoch: 20, train_loss: 0.7879, test_loss: 0.8756, test_f1: 0.5419
 epoch: 21, train_loss: 0.7816, test_loss: 0.8930, test_f1: 0.5398
 epoch: 22, train_loss: 0.7802, test_loss: 0.8597, test_f1: 0.5481
 epoch: 23, train_loss: 0.7609, test_loss: 0.8549, test_f1: 0.5467
 epoch: 24, train_loss: 0.7468, test_loss: 0.8705, test_f1: 0.5457
 epoch: 25, train_loss: 0.7495, test_loss: 0.8696, test_f1: 0.5549
 epoch: 26, train_loss: 0.7369, test_loss: 0.8856, test_f1: 0.5530
 epoch: 27, train_loss: 0.7266, test_loss: 0.8668, test_f1: 0.5395
 epoch: 28, train_loss: 0.7224, test_loss: 0.8587, test_f1: 0.5703
 epoch: 29, train_loss: 0.7135, test_loss: 0.8511, test_f1: 0.5752
 epoch: 30, train_loss: 0.7152, test_loss: 0.8569, test_f1: 0.5687
 epoch: 31, train_loss: 0.7058, test_loss: 0.8739, test_f1: 0.5708
 epoch: 32, train_loss: 0.7035, test_loss: 0.8814, test_f1: 0.5750
 epoch: 33, train_loss: 0.6870, test_loss: 0.8659, test_f1: 0.5833
 epoch: 34, train_loss: 0.6832, test_loss: 0.9179, test_f1: 0.5603
 epoch: 35, train_loss: 0.6823, test_loss: 0.9126, test_f1: 0.5689
 epoch: 36, train_loss: 0.6757, test_loss: 0.8919, test_f1: 0.5797
 epoch: 37, train_loss: 0.6753, test_loss: 0.8950, test_f1: 0.5911
 epoch: 38, train_loss: 0.6524, test_loss: 0.9198, test_f1: 0.5986
 epoch: 39, train_loss: 0.6626, test_loss: 0.9120, test_f1: 0.5870
 epoch: 40, train_loss: 0.6414, test_loss: 0.8893, test_f1: 0.5950
 epoch: 41, train_loss: 0.6391, test_loss: 0.9182, test_f1: 0.6056
 epoch: 42, train_loss: 0.6403, test_loss: 0.9266, test_f1: 0.6034
 epoch: 43, train_loss: 0.6495, test_loss: 0.9195, test_f1: 0.5951
 epoch: 44, train_loss: 0.6341, test_loss: 0.9488, test_f1: 0.6023
 epoch: 45, train_loss: 0.6213, test_loss: 0.9264, test_f1: 0.6096
 epoch: 46, train_loss: 0.6349, test_loss: 0.9405, test_f1: 0.5942
 epoch: 47, train_loss: 0.6207, test_loss: 0.9605, test_f1: 0.5874
 epoch: 48, train_loss: 0.6119, test_loss: 0.9697, test_f1: 0.6203
 epoch: 49, train_loss: 0.6138, test_loss: 0.9253, test_f1: 0.6008
 epoch: 50, train_loss: 0.6076, test_loss: 0.9815, test_f1: 0.6132
 epoch: 51, train_loss: 0.6055, test_loss: 0.9595, test_f1: 0.6147
 epoch: 52, train_loss: 0.5980, test_loss: 0.9658, test_f1: 0.6204
 epoch: 53, train_loss: 0.5896, test_loss: 0.9857, test_f1: 0.6141
 epoch: 54, train_loss: 0.5869, test_loss: 0.9910, test_f1: 0.6099
 epoch: 55, train_loss: 0.5891, test_loss: 0.9888, test_f1: 0.6212
 epoch: 56, train_loss: 0.5712, test_loss: 1.0264, test_f1: 0.5998
 epoch: 57, train_loss: 0.5660, test_loss: 1.0088, test_f1: 0.6075
 epoch: 58, train_loss: 0.5774, test_loss: 0.9860, test_f1: 0.6286
 epoch: 59, train_loss: 0.5790, test_loss: 0.9993, test_f1: 0.6151
 epoch: 60, train_loss: 0.5772, test_loss: 0.9905, test_f1: 0.6088
 epoch: 61, train_loss: 0.5682, test_loss: 0.9982, test_f1: 0.6159
 epoch: 62, train_loss: 0.5696, test_loss: 1.0058, test_f1: 0.6104
 epoch: 63, train_loss: 0.5658, test_loss: 1.0176, test_f1: 0.6142
 epoch: 64, train_loss: 0.5650, test_loss: 0.9826, test_f1: 0.6472
 epoch: 65, train_loss: 0.5585, test_loss: 1.0370, test_f1: 0.6204
 epoch: 66, train_loss: 0.5496, test_loss: 1.0402, test_f1: 0.6214
 epoch: 67, train_loss: 0.5561, test_loss: 1.0071, test_f1: 0.6159
 epoch: 68, train_loss: 0.5492, test_loss: 1.0447, test_f1: 0.6197
 epoch: 69, train_loss: 0.5370, test_loss: 1.0572, test_f1: 0.6244
 epoch: 70, train_loss: 0.5497, test_loss: 1.0466, test_f1: 0.6269
 epoch: 71, train_loss: 0.5318, test_loss: 1.0397, test_f1: 0.6338
 epoch: 72, train_loss: 0.5544, test_loss: 1.0252, test_f1: 0.6358
 epoch: 73, train_loss: 0.5489, test_loss: 1.0267, test_f1: 0.6326
 epoch: 74, train_loss: 0.5276, test_loss: 1.0477, test_f1: 0.6424
 epoch: 75, train_loss: 0.5365, test_loss: 1.0305, test_f1: 0.6316
 epoch: 76, train_loss: 0.5391, test_loss: 1.0574, test_f1: 0.6279
 epoch: 77, train_loss: 0.5278, test_loss: 1.0831, test_f1: 0.6185
 epoch: 78, train_loss: 0.5346, test_loss: 1.0540, test_f1: 0.6198
 epoch: 79, train_loss: 0.5176, test_loss: 1.1024, test_f1: 0.6393
 epoch: 80, train_loss: 0.5173, test_loss: 1.0646, test_f1: 0.6399
 epoch: 81, train_loss: 0.5151, test_loss: 1.1126, test_f1: 0.6087
 epoch: 82, train_loss: 0.5194, test_loss: 1.1002, test_f1: 0.6454
 epoch: 83, train_loss: 0.5215, test_loss: 1.1227, test_f1: 0.6246
 epoch: 84, train_loss: 0.5166, test_loss: 1.1153, test_f1: 0.6439
 epoch: 85, train_loss: 0.5175, test_loss: 1.1547, test_f1: 0.6018
 epoch: 86, train_loss: 0.5149, test_loss: 1.0877, test_f1: 0.6284
 epoch: 87, train_loss: 0.5156, test_loss: 1.1202, test_f1: 0.6468
 epoch: 88, train_loss: 0.5118, test_loss: 1.0823, test_f1: 0.6304
 epoch: 89, train_loss: 0.5088, test_loss: 1.0871, test_f1: 0.6410
 epoch: 90, train_loss: 0.5134, test_loss: 1.1311, test_f1: 0.6562
 epoch: 91, train_loss: 0.4925, test_loss: 1.1596, test_f1: 0.6336
 epoch: 92, train_loss: 0.5030, test_loss: 1.1246, test_f1: 0.6240
 epoch: 93, train_loss: 0.5038, test_loss: 1.1228, test_f1: 0.6291
 epoch: 94, train_loss: 0.4980, test_loss: 1.1432, test_f1: 0.6295
 epoch: 95, train_loss: 0.5117, test_loss: 1.1340, test_f1: 0.6423
 epoch: 96, train_loss: 0.5083, test_loss: 1.1538, test_f1: 0.6484
 epoch: 97, train_loss: 0.5029, test_loss: 1.1338, test_f1: 0.6639
 epoch: 98, train_loss: 0.4871, test_loss: 1.1685, test_f1: 0.6421
 epoch: 99, train_loss: 0.4945, test_loss: 1.1502, test_f1: 0.6247
##################ITERATION #1 ****************************************
 epoch: 0, train_loss: 1.2191, test_loss: 1.0702, test_f1: 0.3929
 epoch: 1, train_loss: 1.0528, test_loss: 0.9982, test_f1: 0.4694
 epoch: 2, train_loss: 1.0029, test_loss: 0.9839, test_f1: 0.5183
 epoch: 3, train_loss: 0.9661, test_loss: 0.9509, test_f1: 0.4967
 epoch: 4, train_loss: 0.9415, test_loss: 0.9241, test_f1: 0.4982
 epoch: 5, train_loss: 0.9099, test_loss: 0.9071, test_f1: 0.5300
 epoch: 6, train_loss: 0.8923, test_loss: 0.8959, test_f1: 0.5387
 epoch: 7, train_loss: 0.8703, test_loss: 0.8767, test_f1: 0.5293
 epoch: 8, train_loss: 0.8543, test_loss: 0.8662, test_f1: 0.5447
 epoch: 9, train_loss: 0.8379, test_loss: 0.8468, test_f1: 0.5346
 epoch: 10, train_loss: 0.8334, test_loss: 0.8400, test_f1: 0.5595
 epoch: 11, train_loss: 0.8153, test_loss: 0.8569, test_f1: 0.5618
 epoch: 12, train_loss: 0.7863, test_loss: 0.8527, test_f1: 0.5535
 epoch: 13, train_loss: 0.7887, test_loss: 0.8181, test_f1: 0.5599
 epoch: 14, train_loss: 0.7755, test_loss: 0.8085, test_f1: 0.5690
 epoch: 15, train_loss: 0.7617, test_loss: 0.8660, test_f1: 0.5709
 epoch: 16, train_loss: 0.7658, test_loss: 0.8168, test_f1: 0.5690
 epoch: 17, train_loss: 0.7621, test_loss: 0.8324, test_f1: 0.5583
 epoch: 18, train_loss: 0.7477, test_loss: 0.8484, test_f1: 0.5719
 epoch: 19, train_loss: 0.7297, test_loss: 0.8311, test_f1: 0.5669
 epoch: 20, train_loss: 0.7266, test_loss: 0.8398, test_f1: 0.5940
 epoch: 21, train_loss: 0.7227, test_loss: 0.8602, test_f1: 0.5851
 epoch: 22, train_loss: 0.7131, test_loss: 0.8592, test_f1: 0.5470
 epoch: 23, train_loss: 0.7087, test_loss: 0.8567, test_f1: 0.5588
 epoch: 24, train_loss: 0.7062, test_loss: 0.8605, test_f1: 0.5887
 epoch: 25, train_loss: 0.6969, test_loss: 0.8687, test_f1: 0.5601
 epoch: 26, train_loss: 0.6937, test_loss: 0.9322, test_f1: 0.5524
 epoch: 27, train_loss: 0.6814, test_loss: 0.8237, test_f1: 0.5760
 epoch: 28, train_loss: 0.6815, test_loss: 0.8767, test_f1: 0.5536
 epoch: 29, train_loss: 0.6886, test_loss: 0.8915, test_f1: 0.5783
 epoch: 30, train_loss: 0.6730, test_loss: 0.8642, test_f1: 0.5656
 epoch: 31, train_loss: 0.6657, test_loss: 0.8855, test_f1: 0.5837
 epoch: 32, train_loss: 0.6513, test_loss: 0.9101, test_f1: 0.5807
 epoch: 33, train_loss: 0.6603, test_loss: 0.9122, test_f1: 0.5741
 epoch: 34, train_loss: 0.6527, test_loss: 0.8855, test_f1: 0.5888
 epoch: 35, train_loss: 0.6573, test_loss: 0.9136, test_f1: 0.5983
 epoch: 36, train_loss: 0.6353, test_loss: 0.8769, test_f1: 0.6036
 epoch: 37, train_loss: 0.6288, test_loss: 0.8683, test_f1: 0.6172
 epoch: 38, train_loss: 0.6325, test_loss: 0.8487, test_f1: 0.6330
 epoch: 39, train_loss: 0.6298, test_loss: 0.8315, test_f1: 0.6166
 epoch: 40, train_loss: 0.6327, test_loss: 0.9060, test_f1: 0.5843
 epoch: 41, train_loss: 0.6081, test_loss: 0.8374, test_f1: 0.6232
 epoch: 42, train_loss: 0.6142, test_loss: 0.8556, test_f1: 0.6194
 epoch: 43, train_loss: 0.6095, test_loss: 0.8444, test_f1: 0.6387
 epoch: 44, train_loss: 0.6036, test_loss: 0.9639, test_f1: 0.6283
 epoch: 45, train_loss: 0.6101, test_loss: 0.9326, test_f1: 0.6046
 epoch: 46, train_loss: 0.6074, test_loss: 0.9487, test_f1: 0.6268
 epoch: 47, train_loss: 0.5926, test_loss: 0.9656, test_f1: 0.6195
 epoch: 48, train_loss: 0.5913, test_loss: 0.9829, test_f1: 0.6219
 epoch: 49, train_loss: 0.6004, test_loss: 0.8946, test_f1: 0.6276
 epoch: 50, train_loss: 0.5804, test_loss: 0.9018, test_f1: 0.6177
 epoch: 51, train_loss: 0.5687, test_loss: 0.9473, test_f1: 0.6394
 epoch: 52, train_loss: 0.5559, test_loss: 0.9004, test_f1: 0.6361
 epoch: 53, train_loss: 0.5561, test_loss: 0.8954, test_f1: 0.6262
 epoch: 54, train_loss: 0.5593, test_loss: 0.9597, test_f1: 0.6306
 epoch: 55, train_loss: 0.5490, test_loss: 0.8976, test_f1: 0.6477
 epoch: 56, train_loss: 0.5451, test_loss: 0.8958, test_f1: 0.6366
 epoch: 57, train_loss: 0.5425, test_loss: 0.9224, test_f1: 0.6458
 epoch: 58, train_loss: 0.5459, test_loss: 0.9298, test_f1: 0.6463
 epoch: 59, train_loss: 0.5329, test_loss: 0.9362, test_f1: 0.6220
 epoch: 60, train_loss: 0.5495, test_loss: 0.9767, test_f1: 0.6227
 epoch: 61, train_loss: 0.5386, test_loss: 0.9208, test_f1: 0.6412
 epoch: 62, train_loss: 0.5466, test_loss: 0.9766, test_f1: 0.6396
 epoch: 63, train_loss: 0.5287, test_loss: 0.9290, test_f1: 0.6287
 epoch: 64, train_loss: 0.5253, test_loss: 0.9576, test_f1: 0.6293
 epoch: 65, train_loss: 0.5179, test_loss: 0.9695, test_f1: 0.6441
 epoch: 66, train_loss: 0.5224, test_loss: 0.9946, test_f1: 0.6351
 epoch: 67, train_loss: 0.5314, test_loss: 0.9962, test_f1: 0.6508
 epoch: 68, train_loss: 0.5278, test_loss: 0.8920, test_f1: 0.6469
 epoch: 69, train_loss: 0.5209, test_loss: 0.9141, test_f1: 0.6475
 epoch: 70, train_loss: 0.5227, test_loss: 0.9323, test_f1: 0.6336
 epoch: 71, train_loss: 0.5133, test_loss: 0.9847, test_f1: 0.6491
 epoch: 72, train_loss: 0.5204, test_loss: 0.9459, test_f1: 0.6407
 epoch: 73, train_loss: 0.5206, test_loss: 0.9765, test_f1: 0.6528
 epoch: 74, train_loss: 0.5152, test_loss: 0.9803, test_f1: 0.6442
 epoch: 75, train_loss: 0.5110, test_loss: 0.8533, test_f1: 0.6442
 epoch: 76, train_loss: 0.4934, test_loss: 0.9491, test_f1: 0.6364
 epoch: 77, train_loss: 0.5028, test_loss: 0.9619, test_f1: 0.6338
 epoch: 78, train_loss: 0.4905, test_loss: 0.9822, test_f1: 0.6468
 epoch: 79, train_loss: 0.5009, test_loss: 0.9586, test_f1: 0.6521
 epoch: 80, train_loss: 0.5037, test_loss: 1.0125, test_f1: 0.6461
 epoch: 81, train_loss: 0.4837, test_loss: 0.9348, test_f1: 0.6492
 epoch: 82, train_loss: 0.4965, test_loss: 0.9510, test_f1: 0.6508
 epoch: 83, train_loss: 0.4816, test_loss: 0.9902, test_f1: 0.6472
 epoch: 84, train_loss: 0.4951, test_loss: 1.0087, test_f1: 0.6318
 epoch: 85, train_loss: 0.4753, test_loss: 0.9707, test_f1: 0.6354
 epoch: 86, train_loss: 0.4917, test_loss: 0.9814, test_f1: 0.6492
 epoch: 87, train_loss: 0.4837, test_loss: 0.9758, test_f1: 0.6502
 epoch: 88, train_loss: 0.4846, test_loss: 0.9968, test_f1: 0.6490
 epoch: 89, train_loss: 0.4809, test_loss: 0.9681, test_f1: 0.6524
 epoch: 90, train_loss: 0.4799, test_loss: 0.9843, test_f1: 0.6516
 epoch: 91, train_loss: 0.4589, test_loss: 1.0037, test_f1: 0.6499
 epoch: 92, train_loss: 0.4690, test_loss: 1.0339, test_f1: 0.6540
 epoch: 93, train_loss: 0.4763, test_loss: 0.9871, test_f1: 0.6641
 epoch: 94, train_loss: 0.4700, test_loss: 0.9676, test_f1: 0.6587
 epoch: 95, train_loss: 0.4653, test_loss: 0.9666, test_f1: 0.6511
 epoch: 96, train_loss: 0.4827, test_loss: 1.0164, test_f1: 0.6456
 epoch: 97, train_loss: 0.4664, test_loss: 0.9297, test_f1: 0.6535
 epoch: 98, train_loss: 0.4668, test_loss: 1.0108, test_f1: 0.6429
 epoch: 99, train_loss: 0.4648, test_loss: 1.0497, test_f1: 0.6369
##################ITERATION #2 ****************************************
 epoch: 0, train_loss: 1.1667, test_loss: 1.0220, test_f1: 0.4138
 epoch: 1, train_loss: 1.0278, test_loss: 0.9772, test_f1: 0.4871
 epoch: 2, train_loss: 0.9923, test_loss: 0.9704, test_f1: 0.4849
 epoch: 3, train_loss: 0.9614, test_loss: 0.9501, test_f1: 0.5394
 epoch: 4, train_loss: 0.9348, test_loss: 0.9344, test_f1: 0.4960
 epoch: 5, train_loss: 0.9185, test_loss: 0.9202, test_f1: 0.5333
 epoch: 6, train_loss: 0.9018, test_loss: 0.9313, test_f1: 0.5476
 epoch: 7, train_loss: 0.8806, test_loss: 0.9114, test_f1: 0.5324
 epoch: 8, train_loss: 0.8693, test_loss: 0.9092, test_f1: 0.5559
 epoch: 9, train_loss: 0.8524, test_loss: 0.8831, test_f1: 0.5580
 epoch: 10, train_loss: 0.8358, test_loss: 0.8657, test_f1: 0.5474
 epoch: 11, train_loss: 0.8241, test_loss: 0.8554, test_f1: 0.5817
 epoch: 12, train_loss: 0.8097, test_loss: 0.8553, test_f1: 0.5673
 epoch: 13, train_loss: 0.8010, test_loss: 0.8737, test_f1: 0.5413
 epoch: 14, train_loss: 0.7930, test_loss: 0.8263, test_f1: 0.5765
 epoch: 15, train_loss: 0.7701, test_loss: 0.8468, test_f1: 0.5665
 epoch: 16, train_loss: 0.7785, test_loss: 0.8162, test_f1: 0.5880
 epoch: 17, train_loss: 0.7688, test_loss: 0.8309, test_f1: 0.5528
 epoch: 18, train_loss: 0.7542, test_loss: 0.8246, test_f1: 0.5706
 epoch: 19, train_loss: 0.7384, test_loss: 0.8271, test_f1: 0.5890
 epoch: 20, train_loss: 0.7238, test_loss: 0.8213, test_f1: 0.6029
 epoch: 21, train_loss: 0.7242, test_loss: 0.8299, test_f1: 0.6092
 epoch: 22, train_loss: 0.7116, test_loss: 0.8284, test_f1: 0.5857
 epoch: 23, train_loss: 0.7052, test_loss: 0.8673, test_f1: 0.5858
 epoch: 24, train_loss: 0.7068, test_loss: 0.8057, test_f1: 0.6218
 epoch: 25, train_loss: 0.6982, test_loss: 0.8159, test_f1: 0.5817
 epoch: 26, train_loss: 0.6953, test_loss: 0.8576, test_f1: 0.5871
 epoch: 27, train_loss: 0.6809, test_loss: 0.8013, test_f1: 0.6298
 epoch: 28, train_loss: 0.6799, test_loss: 0.7986, test_f1: 0.6258
 epoch: 29, train_loss: 0.6637, test_loss: 0.7940, test_f1: 0.6211
 epoch: 30, train_loss: 0.6562, test_loss: 0.7846, test_f1: 0.6247
 epoch: 31, train_loss: 0.6579, test_loss: 0.7732, test_f1: 0.6152
 epoch: 32, train_loss: 0.6499, test_loss: 0.7687, test_f1: 0.6163
 epoch: 33, train_loss: 0.6494, test_loss: 0.8115, test_f1: 0.6305
 epoch: 34, train_loss: 0.6295, test_loss: 0.7768, test_f1: 0.6553
 epoch: 35, train_loss: 0.6214, test_loss: 0.8138, test_f1: 0.6191
 epoch: 36, train_loss: 0.6311, test_loss: 0.8014, test_f1: 0.6222
 epoch: 37, train_loss: 0.6163, test_loss: 0.8162, test_f1: 0.6180
 epoch: 38, train_loss: 0.6227, test_loss: 0.7413, test_f1: 0.6350
 epoch: 39, train_loss: 0.6094, test_loss: 0.7521, test_f1: 0.6356
 epoch: 40, train_loss: 0.6163, test_loss: 0.7724, test_f1: 0.6441
 epoch: 41, train_loss: 0.6039, test_loss: 0.8088, test_f1: 0.6117
 epoch: 42, train_loss: 0.6028, test_loss: 0.8304, test_f1: 0.6333
 epoch: 43, train_loss: 0.5929, test_loss: 0.8547, test_f1: 0.6003
 epoch: 44, train_loss: 0.5954, test_loss: 0.8142, test_f1: 0.6487
 epoch: 45, train_loss: 0.5917, test_loss: 0.8496, test_f1: 0.6271
 epoch: 46, train_loss: 0.5865, test_loss: 0.7840, test_f1: 0.6358
 epoch: 47, train_loss: 0.5679, test_loss: 0.8527, test_f1: 0.6272
 epoch: 48, train_loss: 0.5675, test_loss: 0.7888, test_f1: 0.6388
 epoch: 49, train_loss: 0.5700, test_loss: 0.8528, test_f1: 0.6184
 epoch: 50, train_loss: 0.5634, test_loss: 0.8652, test_f1: 0.6336
 epoch: 51, train_loss: 0.5459, test_loss: 0.8739, test_f1: 0.6310
 epoch: 52, train_loss: 0.5457, test_loss: 0.8557, test_f1: 0.6454
 epoch: 53, train_loss: 0.5380, test_loss: 0.8563, test_f1: 0.6427
 epoch: 54, train_loss: 0.5346, test_loss: 0.8098, test_f1: 0.6451
 epoch: 55, train_loss: 0.5345, test_loss: 0.7946, test_f1: 0.6438
 epoch: 56, train_loss: 0.5236, test_loss: 0.8260, test_f1: 0.6446
 epoch: 57, train_loss: 0.5276, test_loss: 0.8319, test_f1: 0.6346
 epoch: 58, train_loss: 0.5215, test_loss: 0.8090, test_f1: 0.6168
 epoch: 59, train_loss: 0.5283, test_loss: 0.8611, test_f1: 0.6249
 epoch: 60, train_loss: 0.5236, test_loss: 0.8490, test_f1: 0.6492
 epoch: 61, train_loss: 0.5353, test_loss: 0.7965, test_f1: 0.6391
 epoch: 62, train_loss: 0.5195, test_loss: 0.8574, test_f1: 0.6285
 epoch: 63, train_loss: 0.5238, test_loss: 0.8501, test_f1: 0.6427
 epoch: 64, train_loss: 0.5185, test_loss: 0.8723, test_f1: 0.6521
 epoch: 65, train_loss: 0.5112, test_loss: 0.8558, test_f1: 0.6697
 epoch: 66, train_loss: 0.5207, test_loss: 0.8844, test_f1: 0.6660
 epoch: 67, train_loss: 0.5088, test_loss: 0.8823, test_f1: 0.6399
 epoch: 68, train_loss: 0.5146, test_loss: 0.8312, test_f1: 0.6661
 epoch: 69, train_loss: 0.5080, test_loss: 0.8488, test_f1: 0.6535
 epoch: 70, train_loss: 0.5046, test_loss: 0.8472, test_f1: 0.6506
 epoch: 71, train_loss: 0.5079, test_loss: 0.8495, test_f1: 0.6509
 epoch: 72, train_loss: 0.5152, test_loss: 0.9146, test_f1: 0.6392
 epoch: 73, train_loss: 0.5031, test_loss: 0.8210, test_f1: 0.6511
 epoch: 74, train_loss: 0.4992, test_loss: 0.8791, test_f1: 0.6624
 epoch: 75, train_loss: 0.4927, test_loss: 0.8727, test_f1: 0.6529
 epoch: 76, train_loss: 0.4912, test_loss: 0.8467, test_f1: 0.6723
 epoch: 77, train_loss: 0.4932, test_loss: 0.8445, test_f1: 0.6423
 epoch: 78, train_loss: 0.4996, test_loss: 0.8516, test_f1: 0.6489
 epoch: 79, train_loss: 0.4866, test_loss: 0.8277, test_f1: 0.6504
 epoch: 80, train_loss: 0.4860, test_loss: 0.8573, test_f1: 0.6581
 epoch: 81, train_loss: 0.4784, test_loss: 0.8498, test_f1: 0.6467
 epoch: 82, train_loss: 0.4768, test_loss: 0.8062, test_f1: 0.6816
 epoch: 83, train_loss: 0.4676, test_loss: 0.8560, test_f1: 0.6596
 epoch: 84, train_loss: 0.4816, test_loss: 0.8953, test_f1: 0.6607
 epoch: 85, train_loss: 0.4659, test_loss: 0.8346, test_f1: 0.6487
 epoch: 86, train_loss: 0.4698, test_loss: 0.9137, test_f1: 0.6421
 epoch: 87, train_loss: 0.4682, test_loss: 0.8863, test_f1: 0.6540
 epoch: 88, train_loss: 0.4700, test_loss: 0.9334, test_f1: 0.6685
 epoch: 89, train_loss: 0.4560, test_loss: 0.9185, test_f1: 0.6419
 epoch: 90, train_loss: 0.4652, test_loss: 0.8937, test_f1: 0.6545
 epoch: 91, train_loss: 0.4622, test_loss: 0.9368, test_f1: 0.6699
 epoch: 92, train_loss: 0.4566, test_loss: 0.8574, test_f1: 0.6638
 epoch: 93, train_loss: 0.4543, test_loss: 0.8532, test_f1: 0.6427
 epoch: 94, train_loss: 0.4536, test_loss: 0.9128, test_f1: 0.6400
 epoch: 95, train_loss: 0.4607, test_loss: 0.8467, test_f1: 0.6530
 epoch: 96, train_loss: 0.4611, test_loss: 0.8962, test_f1: 0.6615
 epoch: 97, train_loss: 0.4592, test_loss: 0.9283, test_f1: 0.6577
 epoch: 98, train_loss: 0.4504, test_loss: 0.9921, test_f1: 0.6585
 epoch: 99, train_loss: 0.4580, test_loss: 0.9510, test_f1: 0.6733
##################ITERATION #3 ****************************************
 epoch: 0, train_loss: 1.1401, test_loss: 0.9868, test_f1: 0.5043
 epoch: 1, train_loss: 1.0260, test_loss: 0.9557, test_f1: 0.5199
 epoch: 2, train_loss: 0.9934, test_loss: 0.9511, test_f1: 0.5218
 epoch: 3, train_loss: 0.9621, test_loss: 0.9287, test_f1: 0.5535
 epoch: 4, train_loss: 0.9347, test_loss: 0.9264, test_f1: 0.5343
 epoch: 5, train_loss: 0.9263, test_loss: 0.9306, test_f1: 0.5499
 epoch: 6, train_loss: 0.9046, test_loss: 0.9192, test_f1: 0.5810
 epoch: 7, train_loss: 0.8885, test_loss: 0.9263, test_f1: 0.5691
 epoch: 8, train_loss: 0.8839, test_loss: 0.8911, test_f1: 0.5840
 epoch: 9, train_loss: 0.8746, test_loss: 0.8965, test_f1: 0.5677
 epoch: 10, train_loss: 0.8584, test_loss: 0.9052, test_f1: 0.5584
 epoch: 11, train_loss: 0.8449, test_loss: 0.8772, test_f1: 0.5937
 epoch: 12, train_loss: 0.8359, test_loss: 0.8787, test_f1: 0.5736
 epoch: 13, train_loss: 0.8144, test_loss: 0.8983, test_f1: 0.5823
 epoch: 14, train_loss: 0.8121, test_loss: 0.8794, test_f1: 0.6069
 epoch: 15, train_loss: 0.8003, test_loss: 0.8337, test_f1: 0.6010
 epoch: 16, train_loss: 0.7939, test_loss: 0.8410, test_f1: 0.6061
 epoch: 17, train_loss: 0.7868, test_loss: 0.8559, test_f1: 0.6007
 epoch: 18, train_loss: 0.7764, test_loss: 0.7999, test_f1: 0.6159
 epoch: 19, train_loss: 0.7642, test_loss: 0.8451, test_f1: 0.5635
 epoch: 20, train_loss: 0.7650, test_loss: 0.8055, test_f1: 0.6150
 epoch: 21, train_loss: 0.7502, test_loss: 0.8015, test_f1: 0.6235
 epoch: 22, train_loss: 0.7396, test_loss: 0.8102, test_f1: 0.6291
 epoch: 23, train_loss: 0.7436, test_loss: 0.8144, test_f1: 0.6081
 epoch: 24, train_loss: 0.7204, test_loss: 0.8394, test_f1: 0.6060
 epoch: 25, train_loss: 0.7280, test_loss: 0.8143, test_f1: 0.6359
 epoch: 26, train_loss: 0.7039, test_loss: 0.8123, test_f1: 0.6184
 epoch: 27, train_loss: 0.7027, test_loss: 0.7848, test_f1: 0.6414
 epoch: 28, train_loss: 0.6986, test_loss: 0.7875, test_f1: 0.6415
 epoch: 29, train_loss: 0.6967, test_loss: 0.8098, test_f1: 0.6183
 epoch: 30, train_loss: 0.6914, test_loss: 0.7924, test_f1: 0.6456
 epoch: 31, train_loss: 0.6919, test_loss: 0.8634, test_f1: 0.5987
 epoch: 32, train_loss: 0.6731, test_loss: 0.8665, test_f1: 0.6239
 epoch: 33, train_loss: 0.6677, test_loss: 0.7665, test_f1: 0.6431
 epoch: 34, train_loss: 0.6675, test_loss: 0.7704, test_f1: 0.6142
 epoch: 35, train_loss: 0.6743, test_loss: 0.7781, test_f1: 0.6575
 epoch: 36, train_loss: 0.6600, test_loss: 0.8038, test_f1: 0.6400
 epoch: 37, train_loss: 0.6657, test_loss: 0.7668, test_f1: 0.6425
 epoch: 38, train_loss: 0.6306, test_loss: 0.7906, test_f1: 0.6458
 epoch: 39, train_loss: 0.6397, test_loss: 0.7625, test_f1: 0.6289
 epoch: 40, train_loss: 0.6485, test_loss: 0.7326, test_f1: 0.6504
 epoch: 41, train_loss: 0.6438, test_loss: 0.7522, test_f1: 0.6393
 epoch: 42, train_loss: 0.6270, test_loss: 0.7481, test_f1: 0.6570
 epoch: 43, train_loss: 0.6267, test_loss: 0.8483, test_f1: 0.6407
 epoch: 44, train_loss: 0.6147, test_loss: 0.7866, test_f1: 0.6343
 epoch: 45, train_loss: 0.6215, test_loss: 0.9118, test_f1: 0.6213
 epoch: 46, train_loss: 0.5971, test_loss: 0.8062, test_f1: 0.6147
 epoch: 47, train_loss: 0.6114, test_loss: 0.8383, test_f1: 0.6296
 epoch: 48, train_loss: 0.6102, test_loss: 0.7977, test_f1: 0.6326
 epoch: 49, train_loss: 0.5983, test_loss: 0.7957, test_f1: 0.6589
 epoch: 50, train_loss: 0.6111, test_loss: 0.8160, test_f1: 0.6345
 epoch: 51, train_loss: 0.5777, test_loss: 0.7759, test_f1: 0.6364
 epoch: 52, train_loss: 0.5706, test_loss: 0.7825, test_f1: 0.6519
 epoch: 53, train_loss: 0.5555, test_loss: 0.7540, test_f1: 0.6451
 epoch: 54, train_loss: 0.5591, test_loss: 0.7725, test_f1: 0.6456
 epoch: 55, train_loss: 0.5623, test_loss: 0.8207, test_f1: 0.6270
 epoch: 56, train_loss: 0.5499, test_loss: 0.8100, test_f1: 0.6362
 epoch: 57, train_loss: 0.5539, test_loss: 0.8020, test_f1: 0.6532
 epoch: 58, train_loss: 0.5676, test_loss: 0.8257, test_f1: 0.6556
 epoch: 59, train_loss: 0.5498, test_loss: 0.8089, test_f1: 0.6495
 epoch: 60, train_loss: 0.5415, test_loss: 0.8250, test_f1: 0.6405
 epoch: 61, train_loss: 0.5580, test_loss: 0.8203, test_f1: 0.6398
 epoch: 62, train_loss: 0.5435, test_loss: 0.8236, test_f1: 0.6465
 epoch: 63, train_loss: 0.5389, test_loss: 0.8154, test_f1: 0.6327
 epoch: 64, train_loss: 0.5321, test_loss: 0.7663, test_f1: 0.6566
 epoch: 65, train_loss: 0.5336, test_loss: 0.8938, test_f1: 0.6394
 epoch: 66, train_loss: 0.5280, test_loss: 0.8198, test_f1: 0.6442
 epoch: 67, train_loss: 0.5385, test_loss: 0.7655, test_f1: 0.6792
 epoch: 68, train_loss: 0.5233, test_loss: 0.8281, test_f1: 0.6432
 epoch: 69, train_loss: 0.5193, test_loss: 0.8111, test_f1: 0.6550
 epoch: 70, train_loss: 0.5256, test_loss: 0.8085, test_f1: 0.6599
 epoch: 71, train_loss: 0.5265, test_loss: 0.7671, test_f1: 0.6436
 epoch: 72, train_loss: 0.5185, test_loss: 0.8660, test_f1: 0.6461
 epoch: 73, train_loss: 0.5133, test_loss: 0.8408, test_f1: 0.6545
 epoch: 74, train_loss: 0.5142, test_loss: 0.8606, test_f1: 0.6281
 epoch: 75, train_loss: 0.5065, test_loss: 0.8148, test_f1: 0.6430
 epoch: 76, train_loss: 0.5101, test_loss: 0.8298, test_f1: 0.6419
 epoch: 77, train_loss: 0.5129, test_loss: 0.7964, test_f1: 0.6701
 epoch: 78, train_loss: 0.5004, test_loss: 0.7912, test_f1: 0.6547
 epoch: 79, train_loss: 0.4962, test_loss: 0.8838, test_f1: 0.6452
 epoch: 80, train_loss: 0.4936, test_loss: 0.8446, test_f1: 0.6376
 epoch: 81, train_loss: 0.4983, test_loss: 0.8563, test_f1: 0.6355
 epoch: 82, train_loss: 0.4937, test_loss: 0.8922, test_f1: 0.6369
 epoch: 83, train_loss: 0.4861, test_loss: 0.8583, test_f1: 0.6487
 epoch: 84, train_loss: 0.4866, test_loss: 0.8441, test_f1: 0.6522
 epoch: 85, train_loss: 0.4881, test_loss: 0.9005, test_f1: 0.6587
 epoch: 86, train_loss: 0.4758, test_loss: 0.8527, test_f1: 0.6466
 epoch: 87, train_loss: 0.4918, test_loss: 0.8748, test_f1: 0.6505
 epoch: 88, train_loss: 0.4890, test_loss: 0.8913, test_f1: 0.6587
 epoch: 89, train_loss: 0.4804, test_loss: 0.8409, test_f1: 0.6716
 epoch: 90, train_loss: 0.4789, test_loss: 0.9035, test_f1: 0.6504
 epoch: 91, train_loss: 0.4730, test_loss: 0.9196, test_f1: 0.6461
 epoch: 92, train_loss: 0.4720, test_loss: 0.9078, test_f1: 0.6496
 epoch: 93, train_loss: 0.4699, test_loss: 0.8715, test_f1: 0.6523
 epoch: 94, train_loss: 0.4813, test_loss: 0.9057, test_f1: 0.6436
 epoch: 95, train_loss: 0.4611, test_loss: 0.8320, test_f1: 0.6471
 epoch: 96, train_loss: 0.4602, test_loss: 0.7878, test_f1: 0.6718
 epoch: 97, train_loss: 0.4619, test_loss: 0.8260, test_f1: 0.6722
 epoch: 98, train_loss: 0.4557, test_loss: 0.8859, test_f1: 0.6525
 epoch: 99, train_loss: 0.4628, test_loss: 0.8366, test_f1: 0.6576
##################ITERATION #4 ****************************************
 epoch: 0, train_loss: 1.1752, test_loss: 0.9996, test_f1: 0.5098
 epoch: 1, train_loss: 1.0385, test_loss: 0.9640, test_f1: 0.5332
 epoch: 2, train_loss: 0.9956, test_loss: 0.9504, test_f1: 0.5134
 epoch: 3, train_loss: 0.9707, test_loss: 0.9300, test_f1: 0.5385
 epoch: 4, train_loss: 0.9340, test_loss: 0.9143, test_f1: 0.5410
 epoch: 5, train_loss: 0.9293, test_loss: 0.9174, test_f1: 0.5587
 epoch: 6, train_loss: 0.9014, test_loss: 0.9169, test_f1: 0.5339
 epoch: 7, train_loss: 0.8843, test_loss: 0.8987, test_f1: 0.5456
 epoch: 8, train_loss: 0.8743, test_loss: 0.9158, test_f1: 0.5489
 epoch: 9, train_loss: 0.8653, test_loss: 0.8858, test_f1: 0.5810
 epoch: 10, train_loss: 0.8474, test_loss: 0.8701, test_f1: 0.5723
 epoch: 11, train_loss: 0.8391, test_loss: 0.9048, test_f1: 0.5613
 epoch: 12, train_loss: 0.8104, test_loss: 0.8957, test_f1: 0.5872
 epoch: 13, train_loss: 0.8092, test_loss: 0.8923, test_f1: 0.5979
 epoch: 14, train_loss: 0.8039, test_loss: 0.8568, test_f1: 0.6028
 epoch: 15, train_loss: 0.7898, test_loss: 0.8498, test_f1: 0.6088
 epoch: 16, train_loss: 0.7763, test_loss: 0.8786, test_f1: 0.5945
 epoch: 17, train_loss: 0.7693, test_loss: 0.8709, test_f1: 0.5838
 epoch: 18, train_loss: 0.7626, test_loss: 0.8535, test_f1: 0.6235
 epoch: 19, train_loss: 0.7550, test_loss: 0.8546, test_f1: 0.6100
 epoch: 20, train_loss: 0.7504, test_loss: 0.8432, test_f1: 0.6033
 epoch: 21, train_loss: 0.7370, test_loss: 0.8350, test_f1: 0.6127
 epoch: 22, train_loss: 0.7350, test_loss: 0.8271, test_f1: 0.6127
 epoch: 23, train_loss: 0.7153, test_loss: 0.8305, test_f1: 0.6322
 epoch: 24, train_loss: 0.7122, test_loss: 0.8503, test_f1: 0.6233
 epoch: 25, train_loss: 0.6967, test_loss: 0.8605, test_f1: 0.6161
 epoch: 26, train_loss: 0.7016, test_loss: 0.8687, test_f1: 0.6067
 epoch: 27, train_loss: 0.6916, test_loss: 0.8688, test_f1: 0.6024
 epoch: 28, train_loss: 0.6888, test_loss: 0.8341, test_f1: 0.6312
 epoch: 29, train_loss: 0.6731, test_loss: 0.8369, test_f1: 0.6120
 epoch: 30, train_loss: 0.6738, test_loss: 0.8419, test_f1: 0.6215
 epoch: 31, train_loss: 0.6626, test_loss: 0.8632, test_f1: 0.6010
 epoch: 32, train_loss: 0.6772, test_loss: 0.8160, test_f1: 0.6269
 epoch: 33, train_loss: 0.6568, test_loss: 0.8437, test_f1: 0.6411
 epoch: 34, train_loss: 0.6484, test_loss: 0.8515, test_f1: 0.6184
 epoch: 35, train_loss: 0.6524, test_loss: 0.8416, test_f1: 0.6502
 epoch: 36, train_loss: 0.6413, test_loss: 0.8166, test_f1: 0.6365
 epoch: 37, train_loss: 0.6436, test_loss: 0.7979, test_f1: 0.6349
 epoch: 38, train_loss: 0.6466, test_loss: 0.8027, test_f1: 0.6495
 epoch: 39, train_loss: 0.6242, test_loss: 0.7880, test_f1: 0.6256
 epoch: 40, train_loss: 0.6134, test_loss: 0.8174, test_f1: 0.6558
 epoch: 41, train_loss: 0.6150, test_loss: 0.7636, test_f1: 0.6479
 epoch: 42, train_loss: 0.6171, test_loss: 0.7738, test_f1: 0.6494
 epoch: 43, train_loss: 0.6159, test_loss: 0.8278, test_f1: 0.6582
 epoch: 44, train_loss: 0.6096, test_loss: 0.8359, test_f1: 0.6525
 epoch: 45, train_loss: 0.5939, test_loss: 0.8037, test_f1: 0.6333
 epoch: 46, train_loss: 0.5952, test_loss: 0.8613, test_f1: 0.6659
 epoch: 47, train_loss: 0.5875, test_loss: 0.7917, test_f1: 0.6561
 epoch: 48, train_loss: 0.5902, test_loss: 0.8296, test_f1: 0.6539
 epoch: 49, train_loss: 0.5904, test_loss: 0.8237, test_f1: 0.6419
 epoch: 50, train_loss: 0.5757, test_loss: 0.8470, test_f1: 0.6663
 epoch: 51, train_loss: 0.5657, test_loss: 0.8374, test_f1: 0.6652
 epoch: 52, train_loss: 0.5539, test_loss: 0.8393, test_f1: 0.6587
 epoch: 53, train_loss: 0.5439, test_loss: 0.8488, test_f1: 0.6642
 epoch: 54, train_loss: 0.5512, test_loss: 0.8488, test_f1: 0.6670
 epoch: 55, train_loss: 0.5568, test_loss: 0.8093, test_f1: 0.6679
 epoch: 56, train_loss: 0.5443, test_loss: 0.8369, test_f1: 0.6755
 epoch: 57, train_loss: 0.5509, test_loss: 0.8445, test_f1: 0.6613
 epoch: 58, train_loss: 0.5468, test_loss: 0.8497, test_f1: 0.6731
 epoch: 59, train_loss: 0.5359, test_loss: 0.8111, test_f1: 0.6573
 epoch: 60, train_loss: 0.5280, test_loss: 0.8421, test_f1: 0.6746
 epoch: 61, train_loss: 0.5453, test_loss: 0.8558, test_f1: 0.6656
 epoch: 62, train_loss: 0.5266, test_loss: 0.8341, test_f1: 0.6574
 epoch: 63, train_loss: 0.5435, test_loss: 0.8294, test_f1: 0.6633
 epoch: 64, train_loss: 0.5250, test_loss: 0.8356, test_f1: 0.6713
 epoch: 65, train_loss: 0.5410, test_loss: 0.8354, test_f1: 0.6815
 epoch: 66, train_loss: 0.5230, test_loss: 0.8144, test_f1: 0.6727
 epoch: 67, train_loss: 0.5326, test_loss: 0.8269, test_f1: 0.6631
 epoch: 68, train_loss: 0.5226, test_loss: 0.8313, test_f1: 0.6508
 epoch: 69, train_loss: 0.5011, test_loss: 0.8443, test_f1: 0.6789
 epoch: 70, train_loss: 0.5195, test_loss: 0.7736, test_f1: 0.6578
 epoch: 71, train_loss: 0.5166, test_loss: 0.8193, test_f1: 0.6551
 epoch: 72, train_loss: 0.5093, test_loss: 0.8110, test_f1: 0.6655
 epoch: 73, train_loss: 0.5159, test_loss: 0.8358, test_f1: 0.6707
 epoch: 74, train_loss: 0.5158, test_loss: 0.8388, test_f1: 0.6789
 epoch: 75, train_loss: 0.4930, test_loss: 0.8367, test_f1: 0.6672
 epoch: 76, train_loss: 0.4920, test_loss: 0.8226, test_f1: 0.6795
 epoch: 77, train_loss: 0.4905, test_loss: 0.8971, test_f1: 0.6582
 epoch: 78, train_loss: 0.4864, test_loss: 0.8855, test_f1: 0.6802
 epoch: 79, train_loss: 0.4867, test_loss: 0.9286, test_f1: 0.6558
 epoch: 80, train_loss: 0.4984, test_loss: 0.8226, test_f1: 0.6754
 epoch: 81, train_loss: 0.4908, test_loss: 0.8791, test_f1: 0.6583
 epoch: 82, train_loss: 0.4916, test_loss: 0.8630, test_f1: 0.6738
 epoch: 83, train_loss: 0.4837, test_loss: 0.8572, test_f1: 0.6802
 epoch: 84, train_loss: 0.4767, test_loss: 0.8687, test_f1: 0.6685
 epoch: 85, train_loss: 0.4789, test_loss: 0.8971, test_f1: 0.6817
 epoch: 86, train_loss: 0.4871, test_loss: 0.9239, test_f1: 0.6705
 epoch: 87, train_loss: 0.4818, test_loss: 0.8741, test_f1: 0.6667
 epoch: 88, train_loss: 0.4801, test_loss: 0.8515, test_f1: 0.6794
 epoch: 89, train_loss: 0.4672, test_loss: 0.8493, test_f1: 0.6861
 epoch: 90, train_loss: 0.4695, test_loss: 0.8360, test_f1: 0.6730
 epoch: 91, train_loss: 0.4687, test_loss: 0.9219, test_f1: 0.6483
 epoch: 92, train_loss: 0.4799, test_loss: 0.8597, test_f1: 0.6861
 epoch: 93, train_loss: 0.4599, test_loss: 0.8350, test_f1: 0.6784
 epoch: 94, train_loss: 0.4772, test_loss: 0.8629, test_f1: 0.6742
 epoch: 95, train_loss: 0.4604, test_loss: 0.8431, test_f1: 0.6912
 epoch: 96, train_loss: 0.4536, test_loss: 0.8741, test_f1: 0.6995
 epoch: 97, train_loss: 0.4621, test_loss: 0.8817, test_f1: 0.6909
 epoch: 98, train_loss: 0.4664, test_loss: 0.8938, test_f1: 0.6751
 epoch: 99, train_loss: 0.4532, test_loss: 0.9354, test_f1: 0.6820
##################ITERATION #5 ****************************************
 epoch: 0, train_loss: 1.1623, test_loss: 0.9644, test_f1: 0.4796
 epoch: 1, train_loss: 1.0255, test_loss: 0.9471, test_f1: 0.4849
 epoch: 2, train_loss: 0.9911, test_loss: 0.9426, test_f1: 0.5112
 epoch: 3, train_loss: 0.9666, test_loss: 0.9488, test_f1: 0.5132
 epoch: 4, train_loss: 0.9334, test_loss: 0.9078, test_f1: 0.5341
 epoch: 5, train_loss: 0.9225, test_loss: 0.8866, test_f1: 0.5564
 epoch: 6, train_loss: 0.8940, test_loss: 0.8802, test_f1: 0.5552
 epoch: 7, train_loss: 0.8835, test_loss: 0.8853, test_f1: 0.5949
 epoch: 8, train_loss: 0.8675, test_loss: 0.9108, test_f1: 0.5426
 epoch: 9, train_loss: 0.8443, test_loss: 0.8839, test_f1: 0.5772
 epoch: 10, train_loss: 0.8301, test_loss: 0.8743, test_f1: 0.5941
 epoch: 11, train_loss: 0.8314, test_loss: 0.8508, test_f1: 0.6132
 epoch: 12, train_loss: 0.8024, test_loss: 0.8601, test_f1: 0.6032
 epoch: 13, train_loss: 0.8011, test_loss: 0.8381, test_f1: 0.6443
 epoch: 14, train_loss: 0.7872, test_loss: 0.8390, test_f1: 0.6151
 epoch: 15, train_loss: 0.7793, test_loss: 0.8293, test_f1: 0.6341
 epoch: 16, train_loss: 0.7660, test_loss: 0.8088, test_f1: 0.6576
 epoch: 17, train_loss: 0.7521, test_loss: 0.8192, test_f1: 0.6129
 epoch: 18, train_loss: 0.7525, test_loss: 0.8449, test_f1: 0.6353
 epoch: 19, train_loss: 0.7413, test_loss: 0.8389, test_f1: 0.6260
 epoch: 20, train_loss: 0.7216, test_loss: 0.8149, test_f1: 0.6558
 epoch: 21, train_loss: 0.7229, test_loss: 0.8271, test_f1: 0.6367
 epoch: 22, train_loss: 0.7157, test_loss: 0.8206, test_f1: 0.6307
 epoch: 23, train_loss: 0.6999, test_loss: 0.8391, test_f1: 0.6409
 epoch: 24, train_loss: 0.6947, test_loss: 0.8358, test_f1: 0.6420
 epoch: 25, train_loss: 0.6957, test_loss: 0.8119, test_f1: 0.6510
 epoch: 26, train_loss: 0.6823, test_loss: 0.8271, test_f1: 0.6455
 epoch: 27, train_loss: 0.6743, test_loss: 0.8383, test_f1: 0.6274
 epoch: 28, train_loss: 0.6642, test_loss: 0.8213, test_f1: 0.6563
 epoch: 29, train_loss: 0.6598, test_loss: 0.8441, test_f1: 0.6537
 epoch: 30, train_loss: 0.6555, test_loss: 0.8610, test_f1: 0.6302
 epoch: 31, train_loss: 0.6580, test_loss: 0.8581, test_f1: 0.6367
 epoch: 32, train_loss: 0.6381, test_loss: 0.8557, test_f1: 0.6467
 epoch: 33, train_loss: 0.6459, test_loss: 0.8970, test_f1: 0.6166
 epoch: 34, train_loss: 0.6425, test_loss: 0.8392, test_f1: 0.6536
 epoch: 35, train_loss: 0.6356, test_loss: 0.8787, test_f1: 0.6504
 epoch: 36, train_loss: 0.6314, test_loss: 0.8015, test_f1: 0.6466
 epoch: 37, train_loss: 0.6332, test_loss: 0.8220, test_f1: 0.6500
 epoch: 38, train_loss: 0.6227, test_loss: 0.8734, test_f1: 0.6426
 epoch: 39, train_loss: 0.6256, test_loss: 0.8685, test_f1: 0.6361
 epoch: 40, train_loss: 0.6102, test_loss: 0.8418, test_f1: 0.6369
 epoch: 41, train_loss: 0.6053, test_loss: 0.8706, test_f1: 0.6615
 epoch: 42, train_loss: 0.6056, test_loss: 0.8027, test_f1: 0.6539
 epoch: 43, train_loss: 0.5950, test_loss: 0.8981, test_f1: 0.6446
 epoch: 44, train_loss: 0.5926, test_loss: 0.8961, test_f1: 0.6428
 epoch: 45, train_loss: 0.5810, test_loss: 0.8408, test_f1: 0.6602
 epoch: 46, train_loss: 0.5820, test_loss: 0.8429, test_f1: 0.6624
 epoch: 47, train_loss: 0.5755, test_loss: 0.8649, test_f1: 0.6605
 epoch: 48, train_loss: 0.5727, test_loss: 0.8744, test_f1: 0.6502
 epoch: 49, train_loss: 0.5772, test_loss: 0.8384, test_f1: 0.6485
 epoch: 50, train_loss: 0.5543, test_loss: 0.8425, test_f1: 0.6479
 epoch: 51, train_loss: 0.5553, test_loss: 0.8768, test_f1: 0.6480
 epoch: 52, train_loss: 0.5494, test_loss: 0.8712, test_f1: 0.6489
 epoch: 53, train_loss: 0.5429, test_loss: 0.8723, test_f1: 0.6649
 epoch: 54, train_loss: 0.5599, test_loss: 0.8562, test_f1: 0.6649
 epoch: 55, train_loss: 0.5351, test_loss: 0.8792, test_f1: 0.6493
 epoch: 56, train_loss: 0.5426, test_loss: 0.9372, test_f1: 0.6421
 epoch: 57, train_loss: 0.5194, test_loss: 0.9283, test_f1: 0.6442
 epoch: 58, train_loss: 0.5227, test_loss: 0.8924, test_f1: 0.6530
 epoch: 59, train_loss: 0.5242, test_loss: 0.8965, test_f1: 0.6560
 epoch: 60, train_loss: 0.5177, test_loss: 0.8965, test_f1: 0.6476
 epoch: 61, train_loss: 0.5193, test_loss: 0.9006, test_f1: 0.6547
 epoch: 62, train_loss: 0.5129, test_loss: 0.9183, test_f1: 0.6547
 epoch: 63, train_loss: 0.5157, test_loss: 0.8657, test_f1: 0.6579
 epoch: 64, train_loss: 0.5296, test_loss: 0.9204, test_f1: 0.6494
 epoch: 65, train_loss: 0.5155, test_loss: 0.8656, test_f1: 0.6707
 epoch: 66, train_loss: 0.5013, test_loss: 0.8946, test_f1: 0.6522
 epoch: 67, train_loss: 0.5154, test_loss: 0.9095, test_f1: 0.6623
 epoch: 68, train_loss: 0.5005, test_loss: 0.8836, test_f1: 0.6564
 epoch: 69, train_loss: 0.4942, test_loss: 0.8931, test_f1: 0.6611
 epoch: 70, train_loss: 0.4953, test_loss: 0.9379, test_f1: 0.6510
 epoch: 71, train_loss: 0.5000, test_loss: 0.8800, test_f1: 0.6717
 epoch: 72, train_loss: 0.4952, test_loss: 0.9388, test_f1: 0.6465
 epoch: 73, train_loss: 0.4958, test_loss: 0.9103, test_f1: 0.6291
 epoch: 74, train_loss: 0.4945, test_loss: 0.9019, test_f1: 0.6395
 epoch: 75, train_loss: 0.4946, test_loss: 0.9628, test_f1: 0.6645
 epoch: 76, train_loss: 0.4880, test_loss: 0.9069, test_f1: 0.6820
 epoch: 77, train_loss: 0.4817, test_loss: 0.8957, test_f1: 0.6480
 epoch: 78, train_loss: 0.4765, test_loss: 0.8791, test_f1: 0.6729
 epoch: 79, train_loss: 0.4674, test_loss: 0.9248, test_f1: 0.6588
 epoch: 80, train_loss: 0.4856, test_loss: 0.9148, test_f1: 0.6574
 epoch: 81, train_loss: 0.4692, test_loss: 0.9082, test_f1: 0.6663
 epoch: 82, train_loss: 0.4740, test_loss: 0.8946, test_f1: 0.6562
 epoch: 83, train_loss: 0.4726, test_loss: 0.9002, test_f1: 0.6629
 epoch: 84, train_loss: 0.4717, test_loss: 0.9576, test_f1: 0.6547
 epoch: 85, train_loss: 0.4620, test_loss: 0.9177, test_f1: 0.6677
 epoch: 86, train_loss: 0.4641, test_loss: 0.9699, test_f1: 0.6403
 epoch: 87, train_loss: 0.4647, test_loss: 0.9873, test_f1: 0.6590
 epoch: 88, train_loss: 0.4537, test_loss: 1.0439, test_f1: 0.6383
 epoch: 89, train_loss: 0.4653, test_loss: 0.9704, test_f1: 0.6485
 epoch: 90, train_loss: 0.4535, test_loss: 0.9562, test_f1: 0.6567
 epoch: 91, train_loss: 0.4657, test_loss: 1.0021, test_f1: 0.6559
 epoch: 92, train_loss: 0.4392, test_loss: 0.9646, test_f1: 0.6678
 epoch: 93, train_loss: 0.4610, test_loss: 0.9688, test_f1: 0.6556
 epoch: 94, train_loss: 0.4486, test_loss: 1.0341, test_f1: 0.6492
 epoch: 95, train_loss: 0.4485, test_loss: 1.0385, test_f1: 0.6609
 epoch: 96, train_loss: 0.4481, test_loss: 1.0134, test_f1: 0.6755
 epoch: 97, train_loss: 0.4515, test_loss: 1.0310, test_f1: 0.6612
 epoch: 98, train_loss: 0.4377, test_loss: 0.9782, test_f1: 0.6618
 epoch: 99, train_loss: 0.4303, test_loss: 0.9867, test_f1: 0.6623
##################ITERATION #6 ****************************************
 epoch: 0, train_loss: 1.2098, test_loss: 1.0146, test_f1: 0.4915
 epoch: 1, train_loss: 1.0672, test_loss: 0.9854, test_f1: 0.5279
 epoch: 2, train_loss: 1.0181, test_loss: 0.9760, test_f1: 0.5302
 epoch: 3, train_loss: 0.9815, test_loss: 0.9757, test_f1: 0.5091
 epoch: 4, train_loss: 0.9622, test_loss: 0.9564, test_f1: 0.5477
 epoch: 5, train_loss: 0.9450, test_loss: 0.9247, test_f1: 0.5383
 epoch: 6, train_loss: 0.9223, test_loss: 0.9066, test_f1: 0.5501
 epoch: 7, train_loss: 0.9046, test_loss: 0.9082, test_f1: 0.5322
 epoch: 8, train_loss: 0.8858, test_loss: 0.9058, test_f1: 0.5519
 epoch: 9, train_loss: 0.8755, test_loss: 0.8591, test_f1: 0.5698
 epoch: 10, train_loss: 0.8563, test_loss: 0.8872, test_f1: 0.5933
 epoch: 11, train_loss: 0.8440, test_loss: 0.8728, test_f1: 0.5790
 epoch: 12, train_loss: 0.8259, test_loss: 0.8605, test_f1: 0.5926
 epoch: 13, train_loss: 0.8193, test_loss: 0.8801, test_f1: 0.5593
 epoch: 14, train_loss: 0.8144, test_loss: 0.8381, test_f1: 0.6252
 epoch: 15, train_loss: 0.8079, test_loss: 0.8618, test_f1: 0.5885
 epoch: 16, train_loss: 0.7761, test_loss: 0.8409, test_f1: 0.6047
 epoch: 17, train_loss: 0.7815, test_loss: 0.8450, test_f1: 0.6134
 epoch: 18, train_loss: 0.7739, test_loss: 0.8469, test_f1: 0.5999
 epoch: 19, train_loss: 0.7633, test_loss: 0.8077, test_f1: 0.6300
 epoch: 20, train_loss: 0.7552, test_loss: 0.8120, test_f1: 0.6144
 epoch: 21, train_loss: 0.7461, test_loss: 0.8432, test_f1: 0.6193
 epoch: 22, train_loss: 0.7329, test_loss: 0.8394, test_f1: 0.6054
 epoch: 23, train_loss: 0.7244, test_loss: 0.8158, test_f1: 0.6181
 epoch: 24, train_loss: 0.7305, test_loss: 0.7974, test_f1: 0.6340
 epoch: 25, train_loss: 0.7162, test_loss: 0.8368, test_f1: 0.6018
 epoch: 26, train_loss: 0.7206, test_loss: 0.7973, test_f1: 0.6228
 epoch: 27, train_loss: 0.6900, test_loss: 0.8111, test_f1: 0.6320
 epoch: 28, train_loss: 0.6940, test_loss: 0.7997, test_f1: 0.6221
 epoch: 29, train_loss: 0.6669, test_loss: 0.7771, test_f1: 0.6286
 epoch: 30, train_loss: 0.6995, test_loss: 0.7939, test_f1: 0.6254
 epoch: 31, train_loss: 0.6833, test_loss: 0.8012, test_f1: 0.6303
 epoch: 32, train_loss: 0.6688, test_loss: 0.7845, test_f1: 0.6318
 epoch: 33, train_loss: 0.6706, test_loss: 0.7884, test_f1: 0.6499
 epoch: 34, train_loss: 0.6561, test_loss: 0.7872, test_f1: 0.6208
 epoch: 35, train_loss: 0.6586, test_loss: 0.8016, test_f1: 0.6281
 epoch: 36, train_loss: 0.6551, test_loss: 0.8063, test_f1: 0.6369
 epoch: 37, train_loss: 0.6397, test_loss: 0.7697, test_f1: 0.6167
 epoch: 38, train_loss: 0.6396, test_loss: 0.8277, test_f1: 0.6188
 epoch: 39, train_loss: 0.6206, test_loss: 0.8421, test_f1: 0.6266
 epoch: 40, train_loss: 0.6235, test_loss: 0.7870, test_f1: 0.6334
 epoch: 41, train_loss: 0.6309, test_loss: 0.7651, test_f1: 0.6306
 epoch: 42, train_loss: 0.6168, test_loss: 0.8708, test_f1: 0.6295
 epoch: 43, train_loss: 0.6027, test_loss: 0.7736, test_f1: 0.6505
 epoch: 44, train_loss: 0.6100, test_loss: 0.8184, test_f1: 0.6443
 epoch: 45, train_loss: 0.6086, test_loss: 0.8200, test_f1: 0.6165
 epoch: 46, train_loss: 0.5949, test_loss: 0.8309, test_f1: 0.6755
 epoch: 47, train_loss: 0.5897, test_loss: 0.8340, test_f1: 0.6470
 epoch: 48, train_loss: 0.5913, test_loss: 0.7703, test_f1: 0.6695
 epoch: 49, train_loss: 0.5832, test_loss: 0.7816, test_f1: 0.6608
 epoch: 50, train_loss: 0.5831, test_loss: 0.8523, test_f1: 0.6213
 epoch: 51, train_loss: 0.5592, test_loss: 0.7741, test_f1: 0.6773
 epoch: 52, train_loss: 0.5535, test_loss: 0.7966, test_f1: 0.6739
 epoch: 53, train_loss: 0.5733, test_loss: 0.7800, test_f1: 0.6616
 epoch: 54, train_loss: 0.5584, test_loss: 0.8246, test_f1: 0.6390
 epoch: 55, train_loss: 0.5542, test_loss: 0.8001, test_f1: 0.6785
 epoch: 56, train_loss: 0.5416, test_loss: 0.7820, test_f1: 0.6675
 epoch: 57, train_loss: 0.5590, test_loss: 0.7878, test_f1: 0.6629
 epoch: 58, train_loss: 0.5412, test_loss: 0.7731, test_f1: 0.6777
 epoch: 59, train_loss: 0.5318, test_loss: 0.7897, test_f1: 0.6511
 epoch: 60, train_loss: 0.5336, test_loss: 0.8180, test_f1: 0.6509
 epoch: 61, train_loss: 0.5338, test_loss: 0.7864, test_f1: 0.6650
 epoch: 62, train_loss: 0.5174, test_loss: 0.7896, test_f1: 0.6705
 epoch: 63, train_loss: 0.5378, test_loss: 0.8281, test_f1: 0.6482
 epoch: 64, train_loss: 0.5212, test_loss: 0.8453, test_f1: 0.6674
 epoch: 65, train_loss: 0.5270, test_loss: 0.8056, test_f1: 0.6462
 epoch: 66, train_loss: 0.5118, test_loss: 0.8054, test_f1: 0.6486
 epoch: 67, train_loss: 0.5213, test_loss: 0.8384, test_f1: 0.6496
 epoch: 68, train_loss: 0.5102, test_loss: 0.8107, test_f1: 0.6643
 epoch: 69, train_loss: 0.5103, test_loss: 0.8306, test_f1: 0.6715
 epoch: 70, train_loss: 0.5140, test_loss: 0.7928, test_f1: 0.6620
 epoch: 71, train_loss: 0.5216, test_loss: 0.8302, test_f1: 0.6724
 epoch: 72, train_loss: 0.5010, test_loss: 0.8195, test_f1: 0.6725
 epoch: 73, train_loss: 0.5020, test_loss: 0.8095, test_f1: 0.6641
 epoch: 74, train_loss: 0.5088, test_loss: 0.8278, test_f1: 0.6629
 epoch: 75, train_loss: 0.5146, test_loss: 0.8794, test_f1: 0.6496
 epoch: 76, train_loss: 0.5112, test_loss: 0.8227, test_f1: 0.6734
 epoch: 77, train_loss: 0.4901, test_loss: 0.8539, test_f1: 0.6346
 epoch: 78, train_loss: 0.4975, test_loss: 0.8977, test_f1: 0.6315
 epoch: 79, train_loss: 0.5121, test_loss: 0.8294, test_f1: 0.6508
 epoch: 80, train_loss: 0.4801, test_loss: 0.8779, test_f1: 0.6486
 epoch: 81, train_loss: 0.4789, test_loss: 0.9108, test_f1: 0.6571
 epoch: 82, train_loss: 0.4844, test_loss: 0.8657, test_f1: 0.6514
 epoch: 83, train_loss: 0.4735, test_loss: 0.8971, test_f1: 0.6291
 epoch: 84, train_loss: 0.4825, test_loss: 0.8714, test_f1: 0.6497
 epoch: 85, train_loss: 0.4805, test_loss: 0.8176, test_f1: 0.6586
 epoch: 86, train_loss: 0.4735, test_loss: 0.8657, test_f1: 0.6486
 epoch: 87, train_loss: 0.4800, test_loss: 0.8396, test_f1: 0.6641
 epoch: 88, train_loss: 0.4775, test_loss: 0.8788, test_f1: 0.6545
 epoch: 89, train_loss: 0.4687, test_loss: 0.8180, test_f1: 0.6523
 epoch: 90, train_loss: 0.4670, test_loss: 0.8868, test_f1: 0.6547
 epoch: 91, train_loss: 0.4694, test_loss: 0.8910, test_f1: 0.6410
 epoch: 92, train_loss: 0.4749, test_loss: 0.9101, test_f1: 0.6604
 epoch: 93, train_loss: 0.4824, test_loss: 0.9199, test_f1: 0.6466
 epoch: 94, train_loss: 0.4644, test_loss: 0.9416, test_f1: 0.6545
 epoch: 95, train_loss: 0.4642, test_loss: 0.9213, test_f1: 0.6388
 epoch: 96, train_loss: 0.4516, test_loss: 0.8914, test_f1: 0.6631
 epoch: 97, train_loss: 0.4633, test_loss: 0.8840, test_f1: 0.6643
 epoch: 98, train_loss: 0.4503, test_loss: 0.8777, test_f1: 0.6514
 epoch: 99, train_loss: 0.4692, test_loss: 0.8905, test_f1: 0.6694
##################ITERATION #7 ****************************************
 epoch: 0, train_loss: 1.1605, test_loss: 0.9798, test_f1: 0.4739
 epoch: 1, train_loss: 1.0414, test_loss: 0.9537, test_f1: 0.5046
 epoch: 2, train_loss: 0.9879, test_loss: 0.9699, test_f1: 0.4864
 epoch: 3, train_loss: 0.9664, test_loss: 0.9065, test_f1: 0.5568
 epoch: 4, train_loss: 0.9372, test_loss: 0.9030, test_f1: 0.5301
 epoch: 5, train_loss: 0.9177, test_loss: 0.9096, test_f1: 0.5583
 epoch: 6, train_loss: 0.9017, test_loss: 0.9028, test_f1: 0.5553
 epoch: 7, train_loss: 0.8822, test_loss: 0.8922, test_f1: 0.5459
 epoch: 8, train_loss: 0.8744, test_loss: 0.9073, test_f1: 0.5283
 epoch: 9, train_loss: 0.8539, test_loss: 0.8853, test_f1: 0.5467
 epoch: 10, train_loss: 0.8432, test_loss: 0.8673, test_f1: 0.5807
 epoch: 11, train_loss: 0.8181, test_loss: 0.8938, test_f1: 0.5676
 epoch: 12, train_loss: 0.8187, test_loss: 0.8452, test_f1: 0.5892
 epoch: 13, train_loss: 0.8172, test_loss: 0.8613, test_f1: 0.5861
 epoch: 14, train_loss: 0.8064, test_loss: 0.8728, test_f1: 0.5621
 epoch: 15, train_loss: 0.8027, test_loss: 0.8667, test_f1: 0.6003
 epoch: 16, train_loss: 0.7853, test_loss: 0.8740, test_f1: 0.6044
 epoch: 17, train_loss: 0.7694, test_loss: 0.8759, test_f1: 0.5885
 epoch: 18, train_loss: 0.7623, test_loss: 0.8379, test_f1: 0.5831
 epoch: 19, train_loss: 0.7541, test_loss: 0.8789, test_f1: 0.5738
 epoch: 20, train_loss: 0.7508, test_loss: 0.8646, test_f1: 0.6137
 epoch: 21, train_loss: 0.7443, test_loss: 0.8579, test_f1: 0.6294
 epoch: 22, train_loss: 0.7259, test_loss: 0.8747, test_f1: 0.6225
 epoch: 23, train_loss: 0.7303, test_loss: 0.8612, test_f1: 0.6215
 epoch: 24, train_loss: 0.7184, test_loss: 0.8804, test_f1: 0.6323
 epoch: 25, train_loss: 0.7081, test_loss: 0.8302, test_f1: 0.6304
 epoch: 26, train_loss: 0.7051, test_loss: 0.8623, test_f1: 0.5888
 epoch: 27, train_loss: 0.6949, test_loss: 0.8157, test_f1: 0.6186
 epoch: 28, train_loss: 0.6812, test_loss: 0.8583, test_f1: 0.6257
 epoch: 29, train_loss: 0.6702, test_loss: 0.8275, test_f1: 0.6287
 epoch: 30, train_loss: 0.6778, test_loss: 0.8754, test_f1: 0.6160
 epoch: 31, train_loss: 0.6743, test_loss: 0.8576, test_f1: 0.6161
 epoch: 32, train_loss: 0.6730, test_loss: 0.8476, test_f1: 0.6273
 epoch: 33, train_loss: 0.6632, test_loss: 0.8570, test_f1: 0.6446
 epoch: 34, train_loss: 0.6542, test_loss: 0.8383, test_f1: 0.6464
 epoch: 35, train_loss: 0.6315, test_loss: 0.8412, test_f1: 0.6404
 epoch: 36, train_loss: 0.6188, test_loss: 0.8250, test_f1: 0.6367
 epoch: 37, train_loss: 0.6232, test_loss: 0.8316, test_f1: 0.6486
 epoch: 38, train_loss: 0.6390, test_loss: 0.8760, test_f1: 0.6345
 epoch: 39, train_loss: 0.6161, test_loss: 0.8198, test_f1: 0.6350
 epoch: 40, train_loss: 0.6208, test_loss: 0.8363, test_f1: 0.6530
 epoch: 41, train_loss: 0.6271, test_loss: 0.8407, test_f1: 0.6636
 epoch: 42, train_loss: 0.6117, test_loss: 0.8377, test_f1: 0.6226
 epoch: 43, train_loss: 0.6075, test_loss: 0.8517, test_f1: 0.6350
 epoch: 44, train_loss: 0.5929, test_loss: 0.8326, test_f1: 0.6463
 epoch: 45, train_loss: 0.5927, test_loss: 0.8526, test_f1: 0.6384
 epoch: 46, train_loss: 0.5929, test_loss: 0.8245, test_f1: 0.6662
 epoch: 47, train_loss: 0.5813, test_loss: 0.8904, test_f1: 0.6221
 epoch: 48, train_loss: 0.5793, test_loss: 0.8409, test_f1: 0.6451
 epoch: 49, train_loss: 0.5793, test_loss: 0.8519, test_f1: 0.6408
 epoch: 50, train_loss: 0.5594, test_loss: 0.8480, test_f1: 0.6458
 epoch: 51, train_loss: 0.5460, test_loss: 0.8846, test_f1: 0.6451
 epoch: 52, train_loss: 0.5404, test_loss: 0.8402, test_f1: 0.6507
 epoch: 53, train_loss: 0.5466, test_loss: 0.8620, test_f1: 0.6394
 epoch: 54, train_loss: 0.5441, test_loss: 0.8439, test_f1: 0.6479
 epoch: 55, train_loss: 0.5215, test_loss: 0.8503, test_f1: 0.6476
 epoch: 56, train_loss: 0.5321, test_loss: 0.8491, test_f1: 0.6454
 epoch: 57, train_loss: 0.5336, test_loss: 0.8623, test_f1: 0.6365
 epoch: 58, train_loss: 0.5328, test_loss: 0.8423, test_f1: 0.6503
 epoch: 59, train_loss: 0.5352, test_loss: 0.8404, test_f1: 0.6498
 epoch: 60, train_loss: 0.5279, test_loss: 0.8701, test_f1: 0.6608
 epoch: 61, train_loss: 0.5255, test_loss: 0.8591, test_f1: 0.6587
 epoch: 62, train_loss: 0.5147, test_loss: 0.8905, test_f1: 0.6731
 epoch: 63, train_loss: 0.5132, test_loss: 0.8664, test_f1: 0.6435
 epoch: 64, train_loss: 0.5102, test_loss: 0.8475, test_f1: 0.6572
 epoch: 65, train_loss: 0.5052, test_loss: 0.9068, test_f1: 0.6491
 epoch: 66, train_loss: 0.4978, test_loss: 0.8800, test_f1: 0.6537
 epoch: 67, train_loss: 0.5109, test_loss: 0.9141, test_f1: 0.6479
 epoch: 68, train_loss: 0.5025, test_loss: 0.8918, test_f1: 0.6418
 epoch: 69, train_loss: 0.4962, test_loss: 0.8761, test_f1: 0.6525
 epoch: 70, train_loss: 0.5085, test_loss: 0.8878, test_f1: 0.6684
 epoch: 71, train_loss: 0.4938, test_loss: 0.8952, test_f1: 0.6521
 epoch: 72, train_loss: 0.4829, test_loss: 0.8982, test_f1: 0.6485
 epoch: 73, train_loss: 0.4836, test_loss: 0.8768, test_f1: 0.6431
 epoch: 74, train_loss: 0.4910, test_loss: 0.8821, test_f1: 0.6608
 epoch: 75, train_loss: 0.4933, test_loss: 0.8986, test_f1: 0.6609
 epoch: 76, train_loss: 0.4857, test_loss: 0.8994, test_f1: 0.6529
 epoch: 77, train_loss: 0.4768, test_loss: 0.9250, test_f1: 0.6495
 epoch: 78, train_loss: 0.4853, test_loss: 0.9462, test_f1: 0.6443
 epoch: 79, train_loss: 0.4856, test_loss: 0.9042, test_f1: 0.6447
 epoch: 80, train_loss: 0.4759, test_loss: 0.9185, test_f1: 0.6594
 epoch: 81, train_loss: 0.4937, test_loss: 0.8838, test_f1: 0.6664
 epoch: 82, train_loss: 0.4735, test_loss: 0.9225, test_f1: 0.6592
 epoch: 83, train_loss: 0.4704, test_loss: 0.9287, test_f1: 0.6587
 epoch: 84, train_loss: 0.4630, test_loss: 0.8747, test_f1: 0.6552
 epoch: 85, train_loss: 0.4724, test_loss: 0.8778, test_f1: 0.6614
 epoch: 86, train_loss: 0.4609, test_loss: 0.9682, test_f1: 0.6532
 epoch: 87, train_loss: 0.4626, test_loss: 0.9287, test_f1: 0.6572
 epoch: 88, train_loss: 0.4530, test_loss: 0.9123, test_f1: 0.6651
 epoch: 89, train_loss: 0.4602, test_loss: 0.9510, test_f1: 0.6563
 epoch: 90, train_loss: 0.4730, test_loss: 0.9042, test_f1: 0.6708
 epoch: 91, train_loss: 0.4465, test_loss: 0.8845, test_f1: 0.6659
 epoch: 92, train_loss: 0.4564, test_loss: 0.9313, test_f1: 0.6462
 epoch: 93, train_loss: 0.4518, test_loss: 0.9316, test_f1: 0.6584
 epoch: 94, train_loss: 0.4503, test_loss: 0.9173, test_f1: 0.6614
 epoch: 95, train_loss: 0.4410, test_loss: 0.9700, test_f1: 0.6373
 epoch: 96, train_loss: 0.4396, test_loss: 0.9015, test_f1: 0.6637
 epoch: 97, train_loss: 0.4447, test_loss: 1.0086, test_f1: 0.6624
 epoch: 98, train_loss: 0.4306, test_loss: 0.9446, test_f1: 0.6422
 epoch: 99, train_loss: 0.4383, test_loss: 0.9637, test_f1: 0.6575
##################ITERATION #8 ****************************************
 epoch: 0, train_loss: 1.2104, test_loss: 1.0222, test_f1: 0.4628
 epoch: 1, train_loss: 1.0645, test_loss: 0.9760, test_f1: 0.4580
 epoch: 2, train_loss: 1.0164, test_loss: 0.9708, test_f1: 0.4877
 epoch: 3, train_loss: 0.9954, test_loss: 0.9131, test_f1: 0.5318
 epoch: 4, train_loss: 0.9522, test_loss: 0.9398, test_f1: 0.5004
 epoch: 5, train_loss: 0.9472, test_loss: 0.9023, test_f1: 0.5326
 epoch: 6, train_loss: 0.9256, test_loss: 0.9192, test_f1: 0.5415
 epoch: 7, train_loss: 0.9003, test_loss: 0.8831, test_f1: 0.5704
 epoch: 8, train_loss: 0.8946, test_loss: 0.8795, test_f1: 0.5659
 epoch: 9, train_loss: 0.8709, test_loss: 0.9160, test_f1: 0.5560
 epoch: 10, train_loss: 0.8623, test_loss: 0.9101, test_f1: 0.5745
 epoch: 11, train_loss: 0.8534, test_loss: 0.9048, test_f1: 0.5811
 epoch: 12, train_loss: 0.8472, test_loss: 0.9543, test_f1: 0.5389
 epoch: 13, train_loss: 0.8292, test_loss: 0.8707, test_f1: 0.5941
 epoch: 14, train_loss: 0.8132, test_loss: 0.8626, test_f1: 0.6095
 epoch: 15, train_loss: 0.8012, test_loss: 0.9055, test_f1: 0.6081
 epoch: 16, train_loss: 0.8004, test_loss: 0.9141, test_f1: 0.5947
 epoch: 17, train_loss: 0.7916, test_loss: 0.8710, test_f1: 0.5693
 epoch: 18, train_loss: 0.7784, test_loss: 0.8449, test_f1: 0.5917
 epoch: 19, train_loss: 0.7773, test_loss: 0.8842, test_f1: 0.5733
 epoch: 20, train_loss: 0.7696, test_loss: 0.8812, test_f1: 0.5828
 epoch: 21, train_loss: 0.7649, test_loss: 0.9142, test_f1: 0.5852
 epoch: 22, train_loss: 0.7586, test_loss: 0.8187, test_f1: 0.6080
 epoch: 23, train_loss: 0.7480, test_loss: 0.8509, test_f1: 0.6097
 epoch: 24, train_loss: 0.7496, test_loss: 0.8620, test_f1: 0.6003
 epoch: 25, train_loss: 0.7283, test_loss: 0.8681, test_f1: 0.6161
 epoch: 26, train_loss: 0.7357, test_loss: 0.8528, test_f1: 0.5965
 epoch: 27, train_loss: 0.7273, test_loss: 0.8612, test_f1: 0.6085
 epoch: 28, train_loss: 0.7159, test_loss: 0.8450, test_f1: 0.5947
 epoch: 29, train_loss: 0.7032, test_loss: 0.8774, test_f1: 0.5996
 epoch: 30, train_loss: 0.7137, test_loss: 0.8196, test_f1: 0.5894
 epoch: 31, train_loss: 0.6926, test_loss: 0.8225, test_f1: 0.5921
 epoch: 32, train_loss: 0.6950, test_loss: 0.7863, test_f1: 0.6274
 epoch: 33, train_loss: 0.6762, test_loss: 0.8104, test_f1: 0.6087
 epoch: 34, train_loss: 0.6865, test_loss: 0.8621, test_f1: 0.6111
 epoch: 35, train_loss: 0.6655, test_loss: 0.8141, test_f1: 0.6220
 epoch: 36, train_loss: 0.6678, test_loss: 0.7990, test_f1: 0.6219
 epoch: 37, train_loss: 0.6663, test_loss: 0.8422, test_f1: 0.6161
 epoch: 38, train_loss: 0.6638, test_loss: 0.8920, test_f1: 0.5866
 epoch: 39, train_loss: 0.6622, test_loss: 0.8423, test_f1: 0.6162
 epoch: 40, train_loss: 0.6453, test_loss: 0.7869, test_f1: 0.6266
 epoch: 41, train_loss: 0.6323, test_loss: 0.8612, test_f1: 0.6032
 epoch: 42, train_loss: 0.6437, test_loss: 0.7808, test_f1: 0.6377
 epoch: 43, train_loss: 0.6228, test_loss: 0.8407, test_f1: 0.5967
 epoch: 44, train_loss: 0.6348, test_loss: 0.8099, test_f1: 0.6389
 epoch: 45, train_loss: 0.6189, test_loss: 0.8077, test_f1: 0.6247
 epoch: 46, train_loss: 0.6127, test_loss: 0.8135, test_f1: 0.6111
 epoch: 47, train_loss: 0.6214, test_loss: 0.8989, test_f1: 0.6132
 epoch: 48, train_loss: 0.6245, test_loss: 0.8603, test_f1: 0.5964
 epoch: 49, train_loss: 0.6097, test_loss: 0.7731, test_f1: 0.6521
 epoch: 50, train_loss: 0.6018, test_loss: 0.8289, test_f1: 0.6484
 epoch: 51, train_loss: 0.5886, test_loss: 0.7872, test_f1: 0.6302
 epoch: 52, train_loss: 0.5892, test_loss: 0.8183, test_f1: 0.6311
 epoch: 53, train_loss: 0.5955, test_loss: 0.8423, test_f1: 0.6323
 epoch: 54, train_loss: 0.5856, test_loss: 0.7876, test_f1: 0.6228
 epoch: 55, train_loss: 0.5828, test_loss: 0.7949, test_f1: 0.6416
 epoch: 56, train_loss: 0.5786, test_loss: 0.7783, test_f1: 0.6429
 epoch: 57, train_loss: 0.5695, test_loss: 0.8388, test_f1: 0.6250
 epoch: 58, train_loss: 0.5738, test_loss: 0.8277, test_f1: 0.6314
 epoch: 59, train_loss: 0.5780, test_loss: 0.8199, test_f1: 0.6333
 epoch: 60, train_loss: 0.5670, test_loss: 0.8186, test_f1: 0.6331
 epoch: 61, train_loss: 0.5714, test_loss: 0.8352, test_f1: 0.6410
 epoch: 62, train_loss: 0.5546, test_loss: 0.8232, test_f1: 0.6517
 epoch: 63, train_loss: 0.5503, test_loss: 0.7856, test_f1: 0.6548
 epoch: 64, train_loss: 0.5536, test_loss: 0.8078, test_f1: 0.6531
 epoch: 65, train_loss: 0.5628, test_loss: 0.8061, test_f1: 0.6421
 epoch: 66, train_loss: 0.5544, test_loss: 0.8758, test_f1: 0.6453
 epoch: 67, train_loss: 0.5417, test_loss: 0.8646, test_f1: 0.6579
 epoch: 68, train_loss: 0.5538, test_loss: 0.8333, test_f1: 0.6446
 epoch: 69, train_loss: 0.5432, test_loss: 0.8012, test_f1: 0.6549
 epoch: 70, train_loss: 0.5428, test_loss: 0.7685, test_f1: 0.6778
 epoch: 71, train_loss: 0.5377, test_loss: 0.8387, test_f1: 0.6555
 epoch: 72, train_loss: 0.5415, test_loss: 0.8428, test_f1: 0.6629
 epoch: 73, train_loss: 0.5344, test_loss: 0.8270, test_f1: 0.6514
 epoch: 74, train_loss: 0.5343, test_loss: 0.8256, test_f1: 0.6669
 epoch: 75, train_loss: 0.5383, test_loss: 0.8393, test_f1: 0.6436
 epoch: 76, train_loss: 0.5348, test_loss: 0.8052, test_f1: 0.6646
 epoch: 77, train_loss: 0.5263, test_loss: 0.8089, test_f1: 0.6528
 epoch: 78, train_loss: 0.5273, test_loss: 0.8906, test_f1: 0.6391
 epoch: 79, train_loss: 0.5265, test_loss: 0.8306, test_f1: 0.6456
 epoch: 80, train_loss: 0.5075, test_loss: 0.8617, test_f1: 0.6620
 epoch: 81, train_loss: 0.5277, test_loss: 0.8419, test_f1: 0.6528
 epoch: 82, train_loss: 0.5167, test_loss: 0.8688, test_f1: 0.6662
 epoch: 83, train_loss: 0.5206, test_loss: 0.8900, test_f1: 0.6463
 epoch: 84, train_loss: 0.5233, test_loss: 0.8883, test_f1: 0.6354
 epoch: 85, train_loss: 0.5093, test_loss: 0.7970, test_f1: 0.6674
 epoch: 86, train_loss: 0.5195, test_loss: 0.8553, test_f1: 0.6712
 epoch: 87, train_loss: 0.5199, test_loss: 0.8846, test_f1: 0.6617
 epoch: 88, train_loss: 0.5065, test_loss: 0.8831, test_f1: 0.6515
 epoch: 89, train_loss: 0.5152, test_loss: 0.8243, test_f1: 0.6447
 epoch: 90, train_loss: 0.5149, test_loss: 0.8831, test_f1: 0.6559
 epoch: 91, train_loss: 0.5107, test_loss: 0.8541, test_f1: 0.6372
 epoch: 92, train_loss: 0.5004, test_loss: 0.8576, test_f1: 0.6510
 epoch: 93, train_loss: 0.4987, test_loss: 0.9124, test_f1: 0.6428
 epoch: 94, train_loss: 0.4947, test_loss: 0.8756, test_f1: 0.6542
 epoch: 95, train_loss: 0.4948, test_loss: 0.8825, test_f1: 0.6508
 epoch: 96, train_loss: 0.4906, test_loss: 0.9096, test_f1: 0.6481
 epoch: 97, train_loss: 0.4950, test_loss: 0.8712, test_f1: 0.6625
 epoch: 98, train_loss: 0.4870, test_loss: 0.8444, test_f1: 0.6643
 epoch: 99, train_loss: 0.5004, test_loss: 0.8917, test_f1: 0.6455
##################ITERATION #9 ****************************************
 epoch: 0, train_loss: 1.2517, test_loss: 0.9963, test_f1: 0.5090
 epoch: 1, train_loss: 1.0797, test_loss: 0.9720, test_f1: 0.4945
 epoch: 2, train_loss: 1.0078, test_loss: 0.9263, test_f1: 0.5150
 epoch: 3, train_loss: 0.9710, test_loss: 0.9029, test_f1: 0.5357
 epoch: 4, train_loss: 0.9520, test_loss: 0.9257, test_f1: 0.5372
 epoch: 5, train_loss: 0.9389, test_loss: 0.8817, test_f1: 0.5336
 epoch: 6, train_loss: 0.9209, test_loss: 0.9172, test_f1: 0.5538
 epoch: 7, train_loss: 0.8988, test_loss: 0.8796, test_f1: 0.5475
 epoch: 8, train_loss: 0.8774, test_loss: 0.8888, test_f1: 0.5461
 epoch: 9, train_loss: 0.8722, test_loss: 0.8618, test_f1: 0.5624
 epoch: 10, train_loss: 0.8489, test_loss: 0.8607, test_f1: 0.5581
 epoch: 11, train_loss: 0.8424, test_loss: 0.8749, test_f1: 0.5736
 epoch: 12, train_loss: 0.8271, test_loss: 0.8626, test_f1: 0.5574
 epoch: 13, train_loss: 0.8176, test_loss: 0.8613, test_f1: 0.6210
 epoch: 14, train_loss: 0.8092, test_loss: 0.8642, test_f1: 0.6040
 epoch: 15, train_loss: 0.7966, test_loss: 0.8498, test_f1: 0.5859
 epoch: 16, train_loss: 0.7977, test_loss: 0.8323, test_f1: 0.5784
 epoch: 17, train_loss: 0.7896, test_loss: 0.8366, test_f1: 0.5867
 epoch: 18, train_loss: 0.7766, test_loss: 0.8340, test_f1: 0.5892
 epoch: 19, train_loss: 0.7630, test_loss: 0.8029, test_f1: 0.6130
 epoch: 20, train_loss: 0.7631, test_loss: 0.8569, test_f1: 0.5881
 epoch: 21, train_loss: 0.7468, test_loss: 0.8457, test_f1: 0.6107
 epoch: 22, train_loss: 0.7388, test_loss: 0.8252, test_f1: 0.6001
 epoch: 23, train_loss: 0.7354, test_loss: 0.7986, test_f1: 0.6599
 epoch: 24, train_loss: 0.7240, test_loss: 0.7949, test_f1: 0.6407
 epoch: 25, train_loss: 0.7236, test_loss: 0.7883, test_f1: 0.6376
 epoch: 26, train_loss: 0.7172, test_loss: 0.7965, test_f1: 0.6372
 epoch: 27, train_loss: 0.7198, test_loss: 0.7823, test_f1: 0.6289
 epoch: 28, train_loss: 0.7170, test_loss: 0.8103, test_f1: 0.6132
 epoch: 29, train_loss: 0.7002, test_loss: 0.7943, test_f1: 0.6240
 epoch: 30, train_loss: 0.6964, test_loss: 0.7824, test_f1: 0.6412
 epoch: 31, train_loss: 0.6883, test_loss: 0.8137, test_f1: 0.6368
 epoch: 32, train_loss: 0.6859, test_loss: 0.8068, test_f1: 0.6295
 epoch: 33, train_loss: 0.6862, test_loss: 0.8088, test_f1: 0.6357
 epoch: 34, train_loss: 0.6785, test_loss: 0.8248, test_f1: 0.6381
 epoch: 35, train_loss: 0.6601, test_loss: 0.7902, test_f1: 0.6368
 epoch: 36, train_loss: 0.6637, test_loss: 0.8214, test_f1: 0.6341
 epoch: 37, train_loss: 0.6635, test_loss: 0.8516, test_f1: 0.6095
 epoch: 38, train_loss: 0.6530, test_loss: 0.8301, test_f1: 0.6282
 epoch: 39, train_loss: 0.6384, test_loss: 0.7823, test_f1: 0.6395
 epoch: 40, train_loss: 0.6399, test_loss: 0.8372, test_f1: 0.6226
 epoch: 41, train_loss: 0.6296, test_loss: 0.8461, test_f1: 0.6391
 epoch: 42, train_loss: 0.6303, test_loss: 0.7699, test_f1: 0.6329
 epoch: 43, train_loss: 0.6311, test_loss: 0.8119, test_f1: 0.6418
 epoch: 44, train_loss: 0.6221, test_loss: 0.8334, test_f1: 0.6214
 epoch: 45, train_loss: 0.6152, test_loss: 0.8571, test_f1: 0.6643
 epoch: 46, train_loss: 0.6100, test_loss: 0.8282, test_f1: 0.6348
 epoch: 47, train_loss: 0.6069, test_loss: 0.7793, test_f1: 0.6376
 epoch: 48, train_loss: 0.6016, test_loss: 0.8057, test_f1: 0.6433
 epoch: 49, train_loss: 0.5999, test_loss: 0.8488, test_f1: 0.6515
 epoch: 50, train_loss: 0.5982, test_loss: 0.8468, test_f1: 0.6522
 epoch: 51, train_loss: 0.5680, test_loss: 0.8017, test_f1: 0.6447
 epoch: 52, train_loss: 0.5761, test_loss: 0.7893, test_f1: 0.6670
 epoch: 53, train_loss: 0.5600, test_loss: 0.8011, test_f1: 0.6382
 epoch: 54, train_loss: 0.5612, test_loss: 0.8260, test_f1: 0.6280
 epoch: 55, train_loss: 0.5639, test_loss: 0.8575, test_f1: 0.6403
 epoch: 56, train_loss: 0.5601, test_loss: 0.8303, test_f1: 0.6525
 epoch: 57, train_loss: 0.5576, test_loss: 0.8091, test_f1: 0.6634
 epoch: 58, train_loss: 0.5635, test_loss: 0.8127, test_f1: 0.6536
 epoch: 59, train_loss: 0.5579, test_loss: 0.8264, test_f1: 0.6417
 epoch: 60, train_loss: 0.5594, test_loss: 0.8028, test_f1: 0.6824
 epoch: 61, train_loss: 0.5414, test_loss: 0.8803, test_f1: 0.6525
 epoch: 62, train_loss: 0.5424, test_loss: 0.8364, test_f1: 0.6619
 epoch: 63, train_loss: 0.5335, test_loss: 0.8227, test_f1: 0.6655
 epoch: 64, train_loss: 0.5369, test_loss: 0.8427, test_f1: 0.6679
 epoch: 65, train_loss: 0.5489, test_loss: 0.8619, test_f1: 0.6389
 epoch: 66, train_loss: 0.5392, test_loss: 0.8294, test_f1: 0.6593
 epoch: 67, train_loss: 0.5333, test_loss: 0.8593, test_f1: 0.6543
 epoch: 68, train_loss: 0.5372, test_loss: 0.8771, test_f1: 0.6406
 epoch: 69, train_loss: 0.5256, test_loss: 0.8703, test_f1: 0.6570
 epoch: 70, train_loss: 0.5264, test_loss: 0.9103, test_f1: 0.6374
 epoch: 71, train_loss: 0.5297, test_loss: 0.8906, test_f1: 0.6495
 epoch: 72, train_loss: 0.5135, test_loss: 0.8540, test_f1: 0.6577
 epoch: 73, train_loss: 0.5211, test_loss: 0.8679, test_f1: 0.6624
 epoch: 74, train_loss: 0.5159, test_loss: 0.8869, test_f1: 0.6530
 epoch: 75, train_loss: 0.5173, test_loss: 0.8613, test_f1: 0.6559
 epoch: 76, train_loss: 0.5245, test_loss: 0.8706, test_f1: 0.6582
 epoch: 77, train_loss: 0.5151, test_loss: 0.8579, test_f1: 0.6598
 epoch: 78, train_loss: 0.5173, test_loss: 0.8746, test_f1: 0.6484
 epoch: 79, train_loss: 0.5095, test_loss: 0.8405, test_f1: 0.6726
 epoch: 80, train_loss: 0.5056, test_loss: 0.8060, test_f1: 0.6526
 epoch: 81, train_loss: 0.5021, test_loss: 0.8434, test_f1: 0.6601
 epoch: 82, train_loss: 0.5028, test_loss: 0.8327, test_f1: 0.6807
 epoch: 83, train_loss: 0.4893, test_loss: 0.8883, test_f1: 0.6479
 epoch: 84, train_loss: 0.4990, test_loss: 0.8821, test_f1: 0.6519
 epoch: 85, train_loss: 0.4878, test_loss: 0.8593, test_f1: 0.6592
 epoch: 86, train_loss: 0.5069, test_loss: 0.8629, test_f1: 0.6574
 epoch: 87, train_loss: 0.4957, test_loss: 0.8467, test_f1: 0.6575
 epoch: 88, train_loss: 0.4831, test_loss: 0.9159, test_f1: 0.6314
 epoch: 89, train_loss: 0.5029, test_loss: 0.9432, test_f1: 0.6460
 epoch: 90, train_loss: 0.4835, test_loss: 0.8724, test_f1: 0.6521
 epoch: 91, train_loss: 0.4840, test_loss: 0.8641, test_f1: 0.6717
 epoch: 92, train_loss: 0.4833, test_loss: 0.8885, test_f1: 0.6494
 epoch: 93, train_loss: 0.4846, test_loss: 0.8841, test_f1: 0.6632
 epoch: 94, train_loss: 0.4913, test_loss: 0.9211, test_f1: 0.6480
 epoch: 95, train_loss: 0.4737, test_loss: 0.8492, test_f1: 0.6525
 epoch: 96, train_loss: 0.4560, test_loss: 0.8114, test_f1: 0.6589
 epoch: 97, train_loss: 0.4515, test_loss: 0.8532, test_f1: 0.6681
 epoch: 98, train_loss: 0.4700, test_loss: 0.8952, test_f1: 0.6558
 epoch: 99, train_loss: 0.4630, test_loss: 0.8999, test_f1: 0.6508

Training completed in 827.99 seconds
Best F1: 0.6995 at epoch 96
Mean F1 across iterations: 0.6782  0.0096
========================FINAL RESULTS================================
FEGIN weighted F1: 0.6995  0.0096
python main.py --data ltspice_examples --representation component_pin --model FEGIN --layers 2 --hiddens 128 --batch_size 32 --lr 0.0001 --emb_size 250 --epochs 100 --save_appendix component_pin_L2_H128_BS32_LR0.0001_E250 --no_val
-----



STDERR:
  File "main.py", line 370, in <module>
    main()
  File "main.py", line 254, in main
    dataset = dataset_class(
  File "/home/philip/projects/ltspice_examples_code_repo/Circuit-Completion-Using-GNNs/component_classification_with_link_prediction_head/evaluation/FEGIN/kernel/circuit_datasets.py", line 15, in __init__
    self.data, self.slices = torch.load(self.processed_paths[0])
  File "/home/philip/.local/lib/python3.8/site-packages/torch/serialization.py", line 1040, in load
    warnings.warn(
  File "/usr/lib/python3.8/warnings.py", line 109, in _showwarnmsg
    sw(msg.message, msg.category, msg.filename, msg.lineno,
  File "main.py", line 47, in warn_with_traceback
    traceback.print_stack(file=log)
/home/philip/projects/ltspice_examples_code_repo/Circuit-Completion-Using-GNNs/component_classification_with_link_prediction_head/evaluation/FEGIN/kernel/circuit_datasets.py:15: FutureWarning: You are using `torch.load` with `weights_only=False` (the current default value), which uses the default pickle module implicitly. It is possible to construct malicious pickle data which will execute arbitrary code during unpickling (See https://github.com/pytorch/pytorch/blob/main/SECURITY.md#untrusted-models for more details). In a future release, the default value for `weights_only` will be flipped to `True`. This limits the functions that could be executed during unpickling. Arbitrary objects will no longer be allowed to be loaded via this mode unless they are explicitly allowlisted by the user via `torch.serialization.add_safe_globals`. We recommend you start setting `weights_only=True` for any use case where you don't have full control of the loaded file. Please open an issue on GitHub for any issues related to this experimental feature.
  self.data, self.slices = torch.load(self.processed_paths[0])
