STDOUT:
Results will be saved in /home/philip/projects/llm_inference_code_repo/Circuit-Completion-Using-GNNs/component_classification_with_link_prediction_head/evaluation/FEGIN/results/model_FEGIN_dataset_ltspice_examples
Command line input: python main.py --data ltspice_examples --representation component_pin_net --model FEGIN --layers 4 --hiddens 16 --batch_size 256 --lr 0.001 --emb_size 128 --epochs 100 --save_appendix component_pin_net_L4_H16_BS256_LR0.001_E128 --no_val
 is saved.
-----
ltspice_examples - FEGIN
Using 4 layers, 16 hidden units, h = 2
Loading component_pin_net representation dataset
ENTERED
Training FEGIN on component_pin_net representation
Train: 3558, Test: 846
##################ITERATION #0 ****************************************
 epoch: 0, train_loss: 1.4105, test_loss: 1.4107, test_f1: 0.1004
 epoch: 1, train_loss: 1.3831, test_loss: 1.3985, test_f1: 0.1004
 epoch: 2, train_loss: 1.3554, test_loss: 1.3664, test_f1: 0.1647
 epoch: 3, train_loss: 1.3236, test_loss: 1.3086, test_f1: 0.2677
 epoch: 4, train_loss: 1.2830, test_loss: 1.2557, test_f1: 0.2953
 epoch: 5, train_loss: 1.2419, test_loss: 1.2038, test_f1: 0.3668
 epoch: 6, train_loss: 1.1999, test_loss: 1.1620, test_f1: 0.3352
 epoch: 7, train_loss: 1.1721, test_loss: 1.1450, test_f1: 0.3419
 epoch: 8, train_loss: 1.1590, test_loss: 1.1175, test_f1: 0.3379
 epoch: 9, train_loss: 1.1346, test_loss: 1.1006, test_f1: 0.3553
 epoch: 10, train_loss: 1.1193, test_loss: 1.0781, test_f1: 0.3745
 epoch: 11, train_loss: 1.1084, test_loss: 1.0778, test_f1: 0.3583
 epoch: 12, train_loss: 1.0935, test_loss: 1.0479, test_f1: 0.3785
 epoch: 13, train_loss: 1.0814, test_loss: 1.0393, test_f1: 0.3942
 epoch: 14, train_loss: 1.0667, test_loss: 1.0407, test_f1: 0.4141
 epoch: 15, train_loss: 1.0565, test_loss: 1.0252, test_f1: 0.4179
 epoch: 16, train_loss: 1.0427, test_loss: 1.0303, test_f1: 0.4072
 epoch: 17, train_loss: 1.0323, test_loss: 0.9883, test_f1: 0.4362
 epoch: 18, train_loss: 1.0273, test_loss: 0.9985, test_f1: 0.4235
 epoch: 19, train_loss: 1.0271, test_loss: 0.9836, test_f1: 0.4496
 epoch: 20, train_loss: 1.0202, test_loss: 0.9740, test_f1: 0.4550
 epoch: 21, train_loss: 1.0113, test_loss: 0.9971, test_f1: 0.4516
 epoch: 22, train_loss: 1.0069, test_loss: 0.9958, test_f1: 0.4530
 epoch: 23, train_loss: 0.9986, test_loss: 0.9819, test_f1: 0.4602
 epoch: 24, train_loss: 0.9913, test_loss: 0.9626, test_f1: 0.4760
 epoch: 25, train_loss: 0.9855, test_loss: 0.9617, test_f1: 0.4771
 epoch: 26, train_loss: 0.9839, test_loss: 1.0266, test_f1: 0.4659
 epoch: 27, train_loss: 0.9797, test_loss: 0.9631, test_f1: 0.4533
 epoch: 28, train_loss: 0.9811, test_loss: 0.9459, test_f1: 0.4749
 epoch: 29, train_loss: 0.9751, test_loss: 0.9484, test_f1: 0.4624
 epoch: 30, train_loss: 0.9768, test_loss: 0.9422, test_f1: 0.4675
 epoch: 31, train_loss: 0.9678, test_loss: 0.9691, test_f1: 0.4654
 epoch: 32, train_loss: 0.9646, test_loss: 0.9300, test_f1: 0.4798
 epoch: 33, train_loss: 0.9558, test_loss: 0.9419, test_f1: 0.4714
 epoch: 34, train_loss: 0.9498, test_loss: 0.9283, test_f1: 0.4909
 epoch: 35, train_loss: 0.9504, test_loss: 0.9660, test_f1: 0.4779
 epoch: 36, train_loss: 0.9499, test_loss: 0.9472, test_f1: 0.4623
 epoch: 37, train_loss: 0.9545, test_loss: 0.9553, test_f1: 0.4745
 epoch: 38, train_loss: 0.9442, test_loss: 0.9371, test_f1: 0.4819
 epoch: 39, train_loss: 0.9446, test_loss: 0.9184, test_f1: 0.4890
 epoch: 40, train_loss: 0.9222, test_loss: 0.9306, test_f1: 0.4773
 epoch: 41, train_loss: 0.9217, test_loss: 0.9429, test_f1: 0.4768
 epoch: 42, train_loss: 0.9243, test_loss: 0.9694, test_f1: 0.4755
 epoch: 43, train_loss: 0.9195, test_loss: 0.9087, test_f1: 0.4917
 epoch: 44, train_loss: 0.9166, test_loss: 0.9189, test_f1: 0.4923
 epoch: 45, train_loss: 0.9194, test_loss: 0.9388, test_f1: 0.4855
 epoch: 46, train_loss: 0.9154, test_loss: 0.9115, test_f1: 0.5031
 epoch: 47, train_loss: 0.9067, test_loss: 0.8920, test_f1: 0.4979
 epoch: 48, train_loss: 0.9057, test_loss: 0.9138, test_f1: 0.5029
 epoch: 49, train_loss: 0.9012, test_loss: 0.9045, test_f1: 0.4790
 epoch: 50, train_loss: 0.9104, test_loss: 0.9399, test_f1: 0.4908
 epoch: 51, train_loss: 0.8893, test_loss: 0.8839, test_f1: 0.5099
 epoch: 52, train_loss: 0.8898, test_loss: 0.8829, test_f1: 0.4983
 epoch: 53, train_loss: 0.8854, test_loss: 0.8716, test_f1: 0.5176
 epoch: 54, train_loss: 0.8827, test_loss: 0.8730, test_f1: 0.5104
 epoch: 55, train_loss: 0.8719, test_loss: 0.8883, test_f1: 0.5052
 epoch: 56, train_loss: 0.8842, test_loss: 0.8720, test_f1: 0.5126
 epoch: 57, train_loss: 0.8844, test_loss: 0.8816, test_f1: 0.5020
 epoch: 58, train_loss: 0.8819, test_loss: 0.8623, test_f1: 0.5177
 epoch: 59, train_loss: 0.8777, test_loss: 0.8595, test_f1: 0.5221
 epoch: 60, train_loss: 0.8762, test_loss: 0.8558, test_f1: 0.5150
 epoch: 61, train_loss: 0.8737, test_loss: 0.8744, test_f1: 0.5158
 epoch: 62, train_loss: 0.8728, test_loss: 0.8829, test_f1: 0.5070
 epoch: 63, train_loss: 0.8677, test_loss: 0.8535, test_f1: 0.5336
 epoch: 64, train_loss: 0.8723, test_loss: 0.8550, test_f1: 0.5248
 epoch: 65, train_loss: 0.8621, test_loss: 0.8721, test_f1: 0.5121
 epoch: 66, train_loss: 0.8653, test_loss: 0.8688, test_f1: 0.5119
 epoch: 67, train_loss: 0.8614, test_loss: 0.8670, test_f1: 0.5216
 epoch: 68, train_loss: 0.8661, test_loss: 0.8703, test_f1: 0.5159
 epoch: 69, train_loss: 0.8662, test_loss: 0.8715, test_f1: 0.5220
 epoch: 70, train_loss: 0.8546, test_loss: 0.8550, test_f1: 0.5187
 epoch: 71, train_loss: 0.8564, test_loss: 0.8653, test_f1: 0.5128
 epoch: 72, train_loss: 0.8553, test_loss: 0.8905, test_f1: 0.4963
 epoch: 73, train_loss: 0.8501, test_loss: 0.8584, test_f1: 0.5287
 epoch: 74, train_loss: 0.8496, test_loss: 0.8444, test_f1: 0.5302
 epoch: 75, train_loss: 0.8554, test_loss: 0.8632, test_f1: 0.5115
 epoch: 76, train_loss: 0.8469, test_loss: 0.8556, test_f1: 0.5167
 epoch: 77, train_loss: 0.8413, test_loss: 0.8522, test_f1: 0.5344
 epoch: 78, train_loss: 0.8476, test_loss: 0.8559, test_f1: 0.5226
 epoch: 79, train_loss: 0.8386, test_loss: 0.8442, test_f1: 0.5304
 epoch: 80, train_loss: 0.8350, test_loss: 0.8711, test_f1: 0.5084
 epoch: 81, train_loss: 0.8474, test_loss: 0.8631, test_f1: 0.5160
 epoch: 82, train_loss: 0.8384, test_loss: 0.8766, test_f1: 0.5074
 epoch: 83, train_loss: 0.8393, test_loss: 0.8647, test_f1: 0.5218
 epoch: 84, train_loss: 0.8305, test_loss: 0.8592, test_f1: 0.5183
 epoch: 85, train_loss: 0.8294, test_loss: 0.8494, test_f1: 0.5259
 epoch: 86, train_loss: 0.8329, test_loss: 0.8538, test_f1: 0.5226
 epoch: 87, train_loss: 0.8372, test_loss: 0.8843, test_f1: 0.5040
 epoch: 88, train_loss: 0.8306, test_loss: 0.8812, test_f1: 0.5106
 epoch: 89, train_loss: 0.8343, test_loss: 0.8662, test_f1: 0.5206
 epoch: 90, train_loss: 0.8350, test_loss: 0.8609, test_f1: 0.5268
 epoch: 91, train_loss: 0.8338, test_loss: 0.8382, test_f1: 0.5153
 epoch: 92, train_loss: 0.8297, test_loss: 0.8601, test_f1: 0.5152
 epoch: 93, train_loss: 0.8294, test_loss: 0.8498, test_f1: 0.5421
 epoch: 94, train_loss: 0.8202, test_loss: 0.8530, test_f1: 0.5287
 epoch: 95, train_loss: 0.8171, test_loss: 0.8578, test_f1: 0.5223
 epoch: 96, train_loss: 0.8202, test_loss: 0.8755, test_f1: 0.5197
 epoch: 97, train_loss: 0.8174, test_loss: 0.8400, test_f1: 0.5327
 epoch: 98, train_loss: 0.8262, test_loss: 0.8273, test_f1: 0.5402
 epoch: 99, train_loss: 0.8238, test_loss: 0.8545, test_f1: 0.5182
##################ITERATION #1 ****************************************
 epoch: 0, train_loss: 1.3241, test_loss: 1.3523, test_f1: 0.2270
 epoch: 1, train_loss: 1.2504, test_loss: 1.3292, test_f1: 0.2270
 epoch: 2, train_loss: 1.2129, test_loss: 1.2558, test_f1: 0.2484
 epoch: 3, train_loss: 1.1800, test_loss: 1.1705, test_f1: 0.3413
 epoch: 4, train_loss: 1.1563, test_loss: 1.1348, test_f1: 0.3460
 epoch: 5, train_loss: 1.1271, test_loss: 1.1076, test_f1: 0.3426
 epoch: 6, train_loss: 1.1128, test_loss: 1.0863, test_f1: 0.3433
 epoch: 7, train_loss: 1.0903, test_loss: 1.0691, test_f1: 0.3370
 epoch: 8, train_loss: 1.0756, test_loss: 1.0568, test_f1: 0.3368
 epoch: 9, train_loss: 1.0626, test_loss: 1.0564, test_f1: 0.3362
 epoch: 10, train_loss: 1.0568, test_loss: 1.0474, test_f1: 0.3491
 epoch: 11, train_loss: 1.0527, test_loss: 1.0520, test_f1: 0.3625
 epoch: 12, train_loss: 1.0422, test_loss: 1.0404, test_f1: 0.3875
 epoch: 13, train_loss: 1.0267, test_loss: 1.0419, test_f1: 0.3637
 epoch: 14, train_loss: 1.0231, test_loss: 1.0459, test_f1: 0.4101
 epoch: 15, train_loss: 1.0231, test_loss: 1.0507, test_f1: 0.4289
 epoch: 16, train_loss: 1.0043, test_loss: 1.0109, test_f1: 0.4378
 epoch: 17, train_loss: 1.0023, test_loss: 1.0166, test_f1: 0.4664
 epoch: 18, train_loss: 1.0021, test_loss: 0.9831, test_f1: 0.4642
 epoch: 19, train_loss: 0.9881, test_loss: 1.0508, test_f1: 0.4452
 epoch: 20, train_loss: 0.9858, test_loss: 1.0347, test_f1: 0.4482
 epoch: 21, train_loss: 0.9788, test_loss: 0.9927, test_f1: 0.4900
 epoch: 22, train_loss: 0.9686, test_loss: 0.9916, test_f1: 0.4924
 epoch: 23, train_loss: 0.9712, test_loss: 1.0231, test_f1: 0.4746
 epoch: 24, train_loss: 0.9658, test_loss: 0.9466, test_f1: 0.4938
 epoch: 25, train_loss: 0.9577, test_loss: 0.9519, test_f1: 0.4929
 epoch: 26, train_loss: 0.9491, test_loss: 0.9861, test_f1: 0.5060
 epoch: 27, train_loss: 0.9466, test_loss: 0.9288, test_f1: 0.5098
 epoch: 28, train_loss: 0.9395, test_loss: 0.9414, test_f1: 0.5070
 epoch: 29, train_loss: 0.9372, test_loss: 0.9985, test_f1: 0.4980
 epoch: 30, train_loss: 0.9258, test_loss: 0.9251, test_f1: 0.5030
 epoch: 31, train_loss: 0.9196, test_loss: 0.9366, test_f1: 0.5118
 epoch: 32, train_loss: 0.9198, test_loss: 0.9709, test_f1: 0.4943
 epoch: 33, train_loss: 0.9213, test_loss: 0.9385, test_f1: 0.4837
 epoch: 34, train_loss: 0.9123, test_loss: 1.0028, test_f1: 0.4837
 epoch: 35, train_loss: 0.9020, test_loss: 0.9349, test_f1: 0.4819
 epoch: 36, train_loss: 0.9048, test_loss: 0.9419, test_f1: 0.4986
 epoch: 37, train_loss: 0.9031, test_loss: 0.8933, test_f1: 0.5239
 epoch: 38, train_loss: 0.8900, test_loss: 0.9870, test_f1: 0.5021
 epoch: 39, train_loss: 0.8925, test_loss: 0.9575, test_f1: 0.4834
 epoch: 40, train_loss: 0.8831, test_loss: 0.9534, test_f1: 0.4697
 epoch: 41, train_loss: 0.8784, test_loss: 0.9112, test_f1: 0.4983
 epoch: 42, train_loss: 0.8816, test_loss: 0.8926, test_f1: 0.5209
 epoch: 43, train_loss: 0.8709, test_loss: 0.9556, test_f1: 0.4813
 epoch: 44, train_loss: 0.8685, test_loss: 0.9066, test_f1: 0.5064
 epoch: 45, train_loss: 0.8640, test_loss: 0.9301, test_f1: 0.5029
 epoch: 46, train_loss: 0.8584, test_loss: 0.9331, test_f1: 0.4769
 epoch: 47, train_loss: 0.8599, test_loss: 0.9136, test_f1: 0.5155
 epoch: 48, train_loss: 0.8514, test_loss: 0.9052, test_f1: 0.5031
 epoch: 49, train_loss: 0.8519, test_loss: 0.9726, test_f1: 0.4782
 epoch: 50, train_loss: 0.8712, test_loss: 0.9248, test_f1: 0.5014
 epoch: 51, train_loss: 0.8365, test_loss: 0.8940, test_f1: 0.5127
 epoch: 52, train_loss: 0.8457, test_loss: 0.8842, test_f1: 0.5214
 epoch: 53, train_loss: 0.8380, test_loss: 0.8971, test_f1: 0.5197
 epoch: 54, train_loss: 0.8348, test_loss: 0.9119, test_f1: 0.5140
 epoch: 55, train_loss: 0.8425, test_loss: 0.9216, test_f1: 0.4929
 epoch: 56, train_loss: 0.8391, test_loss: 0.8838, test_f1: 0.5190
 epoch: 57, train_loss: 0.8196, test_loss: 0.8795, test_f1: 0.5315
 epoch: 58, train_loss: 0.8337, test_loss: 0.9123, test_f1: 0.4946
 epoch: 59, train_loss: 0.8354, test_loss: 0.8890, test_f1: 0.5215
 epoch: 60, train_loss: 0.8258, test_loss: 0.8780, test_f1: 0.5211
 epoch: 61, train_loss: 0.8221, test_loss: 0.9020, test_f1: 0.5144
 epoch: 62, train_loss: 0.8231, test_loss: 0.9254, test_f1: 0.5255
 epoch: 63, train_loss: 0.8264, test_loss: 0.9117, test_f1: 0.5062
 epoch: 64, train_loss: 0.8170, test_loss: 0.8681, test_f1: 0.5278
 epoch: 65, train_loss: 0.8212, test_loss: 0.8998, test_f1: 0.5119
 epoch: 66, train_loss: 0.8128, test_loss: 0.8892, test_f1: 0.5158
 epoch: 67, train_loss: 0.8279, test_loss: 0.9173, test_f1: 0.5116
 epoch: 68, train_loss: 0.8116, test_loss: 0.8779, test_f1: 0.5198
 epoch: 69, train_loss: 0.8154, test_loss: 0.8855, test_f1: 0.5148
 epoch: 70, train_loss: 0.8147, test_loss: 0.8789, test_f1: 0.5318
 epoch: 71, train_loss: 0.8190, test_loss: 0.8917, test_f1: 0.5231
 epoch: 72, train_loss: 0.8043, test_loss: 0.9045, test_f1: 0.5153
 epoch: 73, train_loss: 0.8022, test_loss: 0.8885, test_f1: 0.5185
 epoch: 74, train_loss: 0.8100, test_loss: 0.8699, test_f1: 0.5429
 epoch: 75, train_loss: 0.8116, test_loss: 0.8894, test_f1: 0.5129
 epoch: 76, train_loss: 0.7996, test_loss: 0.9042, test_f1: 0.5118
 epoch: 77, train_loss: 0.8092, test_loss: 0.9076, test_f1: 0.5306
 epoch: 78, train_loss: 0.8107, test_loss: 0.8774, test_f1: 0.5319
 epoch: 79, train_loss: 0.8091, test_loss: 0.8634, test_f1: 0.5236
 epoch: 80, train_loss: 0.8002, test_loss: 0.9209, test_f1: 0.5046
 epoch: 81, train_loss: 0.8117, test_loss: 0.8804, test_f1: 0.5351
 epoch: 82, train_loss: 0.7974, test_loss: 0.9130, test_f1: 0.5536
 epoch: 83, train_loss: 0.7922, test_loss: 0.9148, test_f1: 0.5425
 epoch: 84, train_loss: 0.7974, test_loss: 0.9173, test_f1: 0.5147
 epoch: 85, train_loss: 0.7919, test_loss: 0.8984, test_f1: 0.5229
 epoch: 86, train_loss: 0.7948, test_loss: 0.9188, test_f1: 0.5136
 epoch: 87, train_loss: 0.7985, test_loss: 0.9162, test_f1: 0.5186
 epoch: 88, train_loss: 0.8044, test_loss: 0.9045, test_f1: 0.5234
 epoch: 89, train_loss: 0.7891, test_loss: 0.9154, test_f1: 0.5126
 epoch: 90, train_loss: 0.7976, test_loss: 0.9314, test_f1: 0.5181
 epoch: 91, train_loss: 0.7881, test_loss: 0.8842, test_f1: 0.5507
 epoch: 92, train_loss: 0.7993, test_loss: 0.9099, test_f1: 0.5245
 epoch: 93, train_loss: 0.7869, test_loss: 0.9195, test_f1: 0.5362
 epoch: 94, train_loss: 0.7986, test_loss: 0.9345, test_f1: 0.5293
 epoch: 95, train_loss: 0.7936, test_loss: 0.8916, test_f1: 0.5324
 epoch: 96, train_loss: 0.7991, test_loss: 0.9019, test_f1: 0.5482
 epoch: 97, train_loss: 0.7806, test_loss: 0.9030, test_f1: 0.5166
 epoch: 98, train_loss: 0.7915, test_loss: 0.9089, test_f1: 0.5236
 epoch: 99, train_loss: 0.7818, test_loss: 0.9177, test_f1: 0.5218
##################ITERATION #2 ****************************************
 epoch: 0, train_loss: 1.2805, test_loss: 1.3144, test_f1: 0.2270
 epoch: 1, train_loss: 1.2090, test_loss: 1.3068, test_f1: 0.2270
 epoch: 2, train_loss: 1.1767, test_loss: 1.3013, test_f1: 0.2270
 epoch: 3, train_loss: 1.1429, test_loss: 1.2289, test_f1: 0.2270
 epoch: 4, train_loss: 1.1053, test_loss: 1.1200, test_f1: 0.3137
 epoch: 5, train_loss: 1.0760, test_loss: 1.0518, test_f1: 0.3816
 epoch: 6, train_loss: 1.0496, test_loss: 1.0143, test_f1: 0.4100
 epoch: 7, train_loss: 1.0381, test_loss: 0.9799, test_f1: 0.4541
 epoch: 8, train_loss: 1.0147, test_loss: 0.9788, test_f1: 0.4557
 epoch: 9, train_loss: 0.9995, test_loss: 0.9662, test_f1: 0.4595
 epoch: 10, train_loss: 0.9798, test_loss: 0.9481, test_f1: 0.4788
 epoch: 11, train_loss: 0.9710, test_loss: 0.9423, test_f1: 0.5034
 epoch: 12, train_loss: 0.9568, test_loss: 0.9400, test_f1: 0.4964
 epoch: 13, train_loss: 0.9530, test_loss: 0.9306, test_f1: 0.4951
 epoch: 14, train_loss: 0.9448, test_loss: 0.9258, test_f1: 0.4900
 epoch: 15, train_loss: 0.9304, test_loss: 0.9089, test_f1: 0.5067
 epoch: 16, train_loss: 0.9290, test_loss: 0.9183, test_f1: 0.4855
 epoch: 17, train_loss: 0.9292, test_loss: 0.9134, test_f1: 0.4908
 epoch: 18, train_loss: 0.9147, test_loss: 0.9145, test_f1: 0.5200
 epoch: 19, train_loss: 0.9138, test_loss: 0.9049, test_f1: 0.5330
 epoch: 20, train_loss: 0.9066, test_loss: 0.9022, test_f1: 0.5208
 epoch: 21, train_loss: 0.9003, test_loss: 0.9060, test_f1: 0.5121
 epoch: 22, train_loss: 0.8964, test_loss: 0.9273, test_f1: 0.5268
 epoch: 23, train_loss: 0.8922, test_loss: 0.8928, test_f1: 0.5362
 epoch: 24, train_loss: 0.8835, test_loss: 0.9147, test_f1: 0.5065
 epoch: 25, train_loss: 0.8794, test_loss: 0.8882, test_f1: 0.5299
 epoch: 26, train_loss: 0.8815, test_loss: 0.8929, test_f1: 0.5253
 epoch: 27, train_loss: 0.8815, test_loss: 0.8937, test_f1: 0.5242
 epoch: 28, train_loss: 0.8739, test_loss: 0.9007, test_f1: 0.5293
 epoch: 29, train_loss: 0.8752, test_loss: 0.9116, test_f1: 0.5282
 epoch: 30, train_loss: 0.8685, test_loss: 0.9060, test_f1: 0.5017
 epoch: 31, train_loss: 0.8565, test_loss: 0.8963, test_f1: 0.5438
 epoch: 32, train_loss: 0.8665, test_loss: 0.8956, test_f1: 0.5182
 epoch: 33, train_loss: 0.8681, test_loss: 0.9164, test_f1: 0.5177
 epoch: 34, train_loss: 0.8627, test_loss: 0.9041, test_f1: 0.5376
 epoch: 35, train_loss: 0.8649, test_loss: 0.9290, test_f1: 0.5011
 epoch: 36, train_loss: 0.8569, test_loss: 0.8874, test_f1: 0.5332
 epoch: 37, train_loss: 0.8529, test_loss: 0.8969, test_f1: 0.5195
 epoch: 38, train_loss: 0.8427, test_loss: 0.9144, test_f1: 0.5373
 epoch: 39, train_loss: 0.8542, test_loss: 0.8900, test_f1: 0.5396
 epoch: 40, train_loss: 0.8391, test_loss: 0.8830, test_f1: 0.5451
 epoch: 41, train_loss: 0.8390, test_loss: 0.9165, test_f1: 0.5289
 epoch: 42, train_loss: 0.8363, test_loss: 0.9152, test_f1: 0.5319
 epoch: 43, train_loss: 0.8297, test_loss: 0.9108, test_f1: 0.5228
 epoch: 44, train_loss: 0.8303, test_loss: 0.9155, test_f1: 0.5433
 epoch: 45, train_loss: 0.8215, test_loss: 0.9234, test_f1: 0.5278
 epoch: 46, train_loss: 0.8166, test_loss: 0.9086, test_f1: 0.5423
 epoch: 47, train_loss: 0.8193, test_loss: 0.9279, test_f1: 0.5263
 epoch: 48, train_loss: 0.8173, test_loss: 0.9006, test_f1: 0.5389
 epoch: 49, train_loss: 0.8067, test_loss: 0.9120, test_f1: 0.5423
 epoch: 50, train_loss: 0.8150, test_loss: 0.9066, test_f1: 0.5488
 epoch: 51, train_loss: 0.8016, test_loss: 0.8966, test_f1: 0.5487
 epoch: 52, train_loss: 0.8099, test_loss: 0.9208, test_f1: 0.5454
 epoch: 53, train_loss: 0.8079, test_loss: 0.9366, test_f1: 0.5183
 epoch: 54, train_loss: 0.8073, test_loss: 0.9117, test_f1: 0.5419
 epoch: 55, train_loss: 0.7987, test_loss: 0.9173, test_f1: 0.5399
 epoch: 56, train_loss: 0.7978, test_loss: 0.9092, test_f1: 0.5479
 epoch: 57, train_loss: 0.7949, test_loss: 0.9073, test_f1: 0.5464
 epoch: 58, train_loss: 0.7933, test_loss: 0.9166, test_f1: 0.5466
 epoch: 59, train_loss: 0.7891, test_loss: 0.9040, test_f1: 0.5390
 epoch: 60, train_loss: 0.7968, test_loss: 0.9275, test_f1: 0.5378
 epoch: 61, train_loss: 0.7840, test_loss: 0.9199, test_f1: 0.5378
 epoch: 62, train_loss: 0.7924, test_loss: 0.9118, test_f1: 0.5586
 epoch: 63, train_loss: 0.7852, test_loss: 0.9317, test_f1: 0.5424
 epoch: 64, train_loss: 0.7854, test_loss: 0.9160, test_f1: 0.5386
 epoch: 65, train_loss: 0.7922, test_loss: 0.9190, test_f1: 0.5407
 epoch: 66, train_loss: 0.7785, test_loss: 0.9174, test_f1: 0.5374
 epoch: 67, train_loss: 0.7838, test_loss: 0.9294, test_f1: 0.5430
 epoch: 68, train_loss: 0.7890, test_loss: 0.9408, test_f1: 0.5423
 epoch: 69, train_loss: 0.7886, test_loss: 0.9182, test_f1: 0.5362
 epoch: 70, train_loss: 0.7810, test_loss: 0.9320, test_f1: 0.5487
 epoch: 71, train_loss: 0.7838, test_loss: 0.9244, test_f1: 0.5431
 epoch: 72, train_loss: 0.7755, test_loss: 0.9105, test_f1: 0.5447
 epoch: 73, train_loss: 0.7800, test_loss: 0.9442, test_f1: 0.5368
 epoch: 74, train_loss: 0.7718, test_loss: 0.9320, test_f1: 0.5446
 epoch: 75, train_loss: 0.7776, test_loss: 0.9419, test_f1: 0.5350
 epoch: 76, train_loss: 0.7795, test_loss: 0.9031, test_f1: 0.5563
 epoch: 77, train_loss: 0.7675, test_loss: 0.9327, test_f1: 0.5372
 epoch: 78, train_loss: 0.7729, test_loss: 0.9398, test_f1: 0.5276
 epoch: 79, train_loss: 0.7765, test_loss: 0.9148, test_f1: 0.5466
 epoch: 80, train_loss: 0.7639, test_loss: 0.9477, test_f1: 0.5329
 epoch: 81, train_loss: 0.7725, test_loss: 0.9444, test_f1: 0.5409
 epoch: 82, train_loss: 0.7678, test_loss: 0.9262, test_f1: 0.5352
 epoch: 83, train_loss: 0.7663, test_loss: 0.9277, test_f1: 0.5417
 epoch: 84, train_loss: 0.7615, test_loss: 0.9324, test_f1: 0.5311
 epoch: 85, train_loss: 0.7650, test_loss: 0.9483, test_f1: 0.5362
 epoch: 86, train_loss: 0.7670, test_loss: 0.9276, test_f1: 0.5402
 epoch: 87, train_loss: 0.7632, test_loss: 0.9417, test_f1: 0.5442
 epoch: 88, train_loss: 0.7665, test_loss: 0.9352, test_f1: 0.5414
 epoch: 89, train_loss: 0.7732, test_loss: 0.9205, test_f1: 0.5410
 epoch: 90, train_loss: 0.7742, test_loss: 0.9386, test_f1: 0.5314
 epoch: 91, train_loss: 0.7528, test_loss: 0.9661, test_f1: 0.5290
 epoch: 92, train_loss: 0.7662, test_loss: 0.9770, test_f1: 0.5247
 epoch: 93, train_loss: 0.7725, test_loss: 0.9529, test_f1: 0.5552
 epoch: 94, train_loss: 0.7551, test_loss: 0.9301, test_f1: 0.5485
 epoch: 95, train_loss: 0.7617, test_loss: 0.9285, test_f1: 0.5390
 epoch: 96, train_loss: 0.7548, test_loss: 0.9295, test_f1: 0.5525
 epoch: 97, train_loss: 0.7564, test_loss: 0.9381, test_f1: 0.5517
 epoch: 98, train_loss: 0.7687, test_loss: 0.9515, test_f1: 0.5385
 epoch: 99, train_loss: 0.7558, test_loss: 0.9528, test_f1: 0.5498
##################ITERATION #3 ****************************************
 epoch: 0, train_loss: 1.2473, test_loss: 1.3338, test_f1: 0.2270
 epoch: 1, train_loss: 1.1641, test_loss: 1.3133, test_f1: 0.2270
 epoch: 2, train_loss: 1.1291, test_loss: 1.2280, test_f1: 0.2270
 epoch: 3, train_loss: 1.1020, test_loss: 1.0993, test_f1: 0.3374
 epoch: 4, train_loss: 1.0823, test_loss: 1.0766, test_f1: 0.3469
 epoch: 5, train_loss: 1.0680, test_loss: 1.0508, test_f1: 0.3624
 epoch: 6, train_loss: 1.0529, test_loss: 1.0600, test_f1: 0.3583
 epoch: 7, train_loss: 1.0416, test_loss: 1.0406, test_f1: 0.3859
 epoch: 8, train_loss: 1.0241, test_loss: 1.0285, test_f1: 0.4019
 epoch: 9, train_loss: 1.0217, test_loss: 1.0117, test_f1: 0.4306
 epoch: 10, train_loss: 1.0133, test_loss: 1.0121, test_f1: 0.4665
 epoch: 11, train_loss: 0.9904, test_loss: 1.0097, test_f1: 0.4501
 epoch: 12, train_loss: 0.9926, test_loss: 0.9981, test_f1: 0.4632
 epoch: 13, train_loss: 0.9786, test_loss: 1.0057, test_f1: 0.4540
 epoch: 14, train_loss: 0.9725, test_loss: 0.9834, test_f1: 0.4668
 epoch: 15, train_loss: 0.9643, test_loss: 0.9572, test_f1: 0.4773
 epoch: 16, train_loss: 0.9538, test_loss: 0.9602, test_f1: 0.5056
 epoch: 17, train_loss: 0.9497, test_loss: 0.9389, test_f1: 0.4750
 epoch: 18, train_loss: 0.9514, test_loss: 0.9791, test_f1: 0.5006
 epoch: 19, train_loss: 0.9340, test_loss: 0.9242, test_f1: 0.4943
 epoch: 20, train_loss: 0.9289, test_loss: 0.9706, test_f1: 0.4986
 epoch: 21, train_loss: 0.9301, test_loss: 0.9793, test_f1: 0.5102
 epoch: 22, train_loss: 0.9255, test_loss: 0.9241, test_f1: 0.5061
 epoch: 23, train_loss: 0.9137, test_loss: 0.9445, test_f1: 0.5063
 epoch: 24, train_loss: 0.9177, test_loss: 0.9182, test_f1: 0.5120
 epoch: 25, train_loss: 0.8955, test_loss: 0.9075, test_f1: 0.5029
 epoch: 26, train_loss: 0.8968, test_loss: 0.9682, test_f1: 0.5060
 epoch: 27, train_loss: 0.9046, test_loss: 0.9060, test_f1: 0.4967
 epoch: 28, train_loss: 0.9005, test_loss: 0.9609, test_f1: 0.4945
 epoch: 29, train_loss: 0.8913, test_loss: 0.9565, test_f1: 0.5099
 epoch: 30, train_loss: 0.8985, test_loss: 0.8977, test_f1: 0.5235
 epoch: 31, train_loss: 0.8890, test_loss: 0.8968, test_f1: 0.5114
 epoch: 32, train_loss: 0.8795, test_loss: 0.9557, test_f1: 0.5283
 epoch: 33, train_loss: 0.8768, test_loss: 0.9787, test_f1: 0.4834
 epoch: 34, train_loss: 0.8662, test_loss: 0.9446, test_f1: 0.5051
 epoch: 35, train_loss: 0.8731, test_loss: 0.9714, test_f1: 0.4878
 epoch: 36, train_loss: 0.8670, test_loss: 0.9237, test_f1: 0.5284
 epoch: 37, train_loss: 0.8649, test_loss: 0.8634, test_f1: 0.5310
 epoch: 38, train_loss: 0.8514, test_loss: 0.8933, test_f1: 0.5135
 epoch: 39, train_loss: 0.8544, test_loss: 0.8982, test_f1: 0.5281
 epoch: 40, train_loss: 0.8631, test_loss: 0.8858, test_f1: 0.5203
 epoch: 41, train_loss: 0.8653, test_loss: 0.9218, test_f1: 0.5184
 epoch: 42, train_loss: 0.8547, test_loss: 0.9648, test_f1: 0.5222
 epoch: 43, train_loss: 0.8559, test_loss: 0.9167, test_f1: 0.5035
 epoch: 44, train_loss: 0.8537, test_loss: 0.9719, test_f1: 0.5148
 epoch: 45, train_loss: 0.8396, test_loss: 0.8793, test_f1: 0.5218
 epoch: 46, train_loss: 0.8547, test_loss: 0.8978, test_f1: 0.5073
 epoch: 47, train_loss: 0.8507, test_loss: 0.9103, test_f1: 0.5232
 epoch: 48, train_loss: 0.8439, test_loss: 0.9593, test_f1: 0.5238
 epoch: 49, train_loss: 0.8359, test_loss: 0.9131, test_f1: 0.5137
 epoch: 50, train_loss: 0.8333, test_loss: 0.8933, test_f1: 0.5117
 epoch: 51, train_loss: 0.8351, test_loss: 0.9383, test_f1: 0.5208
 epoch: 52, train_loss: 0.8336, test_loss: 0.9350, test_f1: 0.5232
 epoch: 53, train_loss: 0.8231, test_loss: 0.9486, test_f1: 0.5107
 epoch: 54, train_loss: 0.8181, test_loss: 0.9183, test_f1: 0.5233
 epoch: 55, train_loss: 0.8187, test_loss: 0.9326, test_f1: 0.5317
 epoch: 56, train_loss: 0.8156, test_loss: 0.9051, test_f1: 0.5143
 epoch: 57, train_loss: 0.8217, test_loss: 0.9054, test_f1: 0.5240
 epoch: 58, train_loss: 0.8133, test_loss: 0.9300, test_f1: 0.5261
 epoch: 59, train_loss: 0.8137, test_loss: 0.9172, test_f1: 0.5146
 epoch: 60, train_loss: 0.8185, test_loss: 0.9299, test_f1: 0.5247
 epoch: 61, train_loss: 0.8041, test_loss: 0.8738, test_f1: 0.5318
 epoch: 62, train_loss: 0.8133, test_loss: 0.9000, test_f1: 0.5263
 epoch: 63, train_loss: 0.8116, test_loss: 0.8677, test_f1: 0.5467
 epoch: 64, train_loss: 0.8026, test_loss: 0.9127, test_f1: 0.5279
 epoch: 65, train_loss: 0.8187, test_loss: 0.9467, test_f1: 0.5187
 epoch: 66, train_loss: 0.8149, test_loss: 0.9193, test_f1: 0.5300
 epoch: 67, train_loss: 0.8012, test_loss: 0.8932, test_f1: 0.5316
 epoch: 68, train_loss: 0.7938, test_loss: 0.9298, test_f1: 0.5242
 epoch: 69, train_loss: 0.7909, test_loss: 0.9432, test_f1: 0.5311
 epoch: 70, train_loss: 0.8010, test_loss: 0.9081, test_f1: 0.5288
 epoch: 71, train_loss: 0.7963, test_loss: 0.9336, test_f1: 0.5218
 epoch: 72, train_loss: 0.7995, test_loss: 0.9089, test_f1: 0.5230
 epoch: 73, train_loss: 0.7949, test_loss: 0.9179, test_f1: 0.5310
 epoch: 74, train_loss: 0.8002, test_loss: 0.9511, test_f1: 0.5286
 epoch: 75, train_loss: 0.7959, test_loss: 0.9335, test_f1: 0.5326
 epoch: 76, train_loss: 0.8116, test_loss: 0.9329, test_f1: 0.5239
 epoch: 77, train_loss: 0.7974, test_loss: 0.9097, test_f1: 0.5253
 epoch: 78, train_loss: 0.7849, test_loss: 0.9338, test_f1: 0.5227
 epoch: 79, train_loss: 0.7870, test_loss: 0.9620, test_f1: 0.5216
 epoch: 80, train_loss: 0.7953, test_loss: 0.8818, test_f1: 0.5228
 epoch: 81, train_loss: 0.7818, test_loss: 0.9438, test_f1: 0.5147
 epoch: 82, train_loss: 0.7932, test_loss: 0.9517, test_f1: 0.5317
 epoch: 83, train_loss: 0.7888, test_loss: 0.9239, test_f1: 0.5223
 epoch: 84, train_loss: 0.7839, test_loss: 0.9478, test_f1: 0.5304
 epoch: 85, train_loss: 0.7803, test_loss: 0.9579, test_f1: 0.5333
 epoch: 86, train_loss: 0.7803, test_loss: 0.9265, test_f1: 0.5227
 epoch: 87, train_loss: 0.7739, test_loss: 0.9634, test_f1: 0.5221
 epoch: 88, train_loss: 0.7912, test_loss: 0.9520, test_f1: 0.5289
 epoch: 89, train_loss: 0.7782, test_loss: 0.9592, test_f1: 0.5143
 epoch: 90, train_loss: 0.7777, test_loss: 0.9168, test_f1: 0.5293
 epoch: 91, train_loss: 0.7724, test_loss: 0.9529, test_f1: 0.5285
 epoch: 92, train_loss: 0.7800, test_loss: 0.9584, test_f1: 0.5192
 epoch: 93, train_loss: 0.7877, test_loss: 0.9222, test_f1: 0.5287
 epoch: 94, train_loss: 0.7764, test_loss: 0.9359, test_f1: 0.5353
 epoch: 95, train_loss: 0.7671, test_loss: 0.9192, test_f1: 0.5325
 epoch: 96, train_loss: 0.7770, test_loss: 0.9606, test_f1: 0.5251
 epoch: 97, train_loss: 0.7760, test_loss: 0.9522, test_f1: 0.5376
 epoch: 98, train_loss: 0.7729, test_loss: 0.9725, test_f1: 0.5379
 epoch: 99, train_loss: 0.7664, test_loss: 0.9274, test_f1: 0.5333
##################ITERATION #4 ****************************************
 epoch: 0, train_loss: 1.2582, test_loss: 1.3464, test_f1: 0.2270
 epoch: 1, train_loss: 1.1569, test_loss: 1.3421, test_f1: 0.2270
 epoch: 2, train_loss: 1.1190, test_loss: 1.3809, test_f1: 0.2326
 epoch: 3, train_loss: 1.0822, test_loss: 1.3155, test_f1: 0.2864
 epoch: 4, train_loss: 1.0661, test_loss: 1.1851, test_f1: 0.3619
 epoch: 5, train_loss: 1.0518, test_loss: 1.0299, test_f1: 0.4650
 epoch: 6, train_loss: 1.0380, test_loss: 1.0019, test_f1: 0.4382
 epoch: 7, train_loss: 1.0125, test_loss: 1.0113, test_f1: 0.4663
 epoch: 8, train_loss: 1.0056, test_loss: 0.9792, test_f1: 0.4707
 epoch: 9, train_loss: 0.9919, test_loss: 0.9677, test_f1: 0.4508
 epoch: 10, train_loss: 0.9851, test_loss: 0.9665, test_f1: 0.4759
 epoch: 11, train_loss: 0.9778, test_loss: 0.9456, test_f1: 0.4667
 epoch: 12, train_loss: 0.9684, test_loss: 0.9297, test_f1: 0.5000
 epoch: 13, train_loss: 0.9667, test_loss: 0.9556, test_f1: 0.4663
 epoch: 14, train_loss: 0.9548, test_loss: 0.9236, test_f1: 0.4864
 epoch: 15, train_loss: 0.9488, test_loss: 0.9123, test_f1: 0.4864
 epoch: 16, train_loss: 0.9351, test_loss: 0.9544, test_f1: 0.4758
 epoch: 17, train_loss: 0.9365, test_loss: 0.9219, test_f1: 0.5131
 epoch: 18, train_loss: 0.9302, test_loss: 0.9258, test_f1: 0.4779
 epoch: 19, train_loss: 0.9285, test_loss: 0.9002, test_f1: 0.5213
 epoch: 20, train_loss: 0.9384, test_loss: 0.9792, test_f1: 0.5026
 epoch: 21, train_loss: 0.9241, test_loss: 0.9065, test_f1: 0.5323
 epoch: 22, train_loss: 0.9224, test_loss: 0.9034, test_f1: 0.5263
 epoch: 23, train_loss: 0.9054, test_loss: 0.8770, test_f1: 0.5083
 epoch: 24, train_loss: 0.9139, test_loss: 0.8720, test_f1: 0.5460
 epoch: 25, train_loss: 0.9019, test_loss: 0.9748, test_f1: 0.5044
 epoch: 26, train_loss: 0.8985, test_loss: 0.9213, test_f1: 0.5314
 epoch: 27, train_loss: 0.8911, test_loss: 0.8612, test_f1: 0.5332
 epoch: 28, train_loss: 0.8891, test_loss: 0.8575, test_f1: 0.5355
 epoch: 29, train_loss: 0.8793, test_loss: 0.8739, test_f1: 0.5050
 epoch: 30, train_loss: 0.8840, test_loss: 0.8696, test_f1: 0.5521
 epoch: 31, train_loss: 0.8771, test_loss: 0.8596, test_f1: 0.5514
 epoch: 32, train_loss: 0.8740, test_loss: 0.8583, test_f1: 0.5309
 epoch: 33, train_loss: 0.8737, test_loss: 0.8609, test_f1: 0.5332
 epoch: 34, train_loss: 0.8705, test_loss: 0.8490, test_f1: 0.5416
 epoch: 35, train_loss: 0.8625, test_loss: 0.8354, test_f1: 0.5475
 epoch: 36, train_loss: 0.8527, test_loss: 0.8162, test_f1: 0.5721
 epoch: 37, train_loss: 0.8637, test_loss: 0.8405, test_f1: 0.5525
 epoch: 38, train_loss: 0.8603, test_loss: 0.8398, test_f1: 0.5481
 epoch: 39, train_loss: 0.8621, test_loss: 0.8393, test_f1: 0.5554
 epoch: 40, train_loss: 0.8583, test_loss: 0.8353, test_f1: 0.5307
 epoch: 41, train_loss: 0.8524, test_loss: 0.8467, test_f1: 0.5319
 epoch: 42, train_loss: 0.8511, test_loss: 1.0044, test_f1: 0.4990
 epoch: 43, train_loss: 0.8535, test_loss: 0.8496, test_f1: 0.5276
 epoch: 44, train_loss: 0.8300, test_loss: 0.8472, test_f1: 0.5247
 epoch: 45, train_loss: 0.8296, test_loss: 0.8296, test_f1: 0.5522
 epoch: 46, train_loss: 0.8437, test_loss: 0.8293, test_f1: 0.5660
 epoch: 47, train_loss: 0.8292, test_loss: 0.8193, test_f1: 0.5671
 epoch: 48, train_loss: 0.8380, test_loss: 0.8413, test_f1: 0.5416
 epoch: 49, train_loss: 0.8285, test_loss: 0.8446, test_f1: 0.5605
 epoch: 50, train_loss: 0.8372, test_loss: 0.9018, test_f1: 0.5427
 epoch: 51, train_loss: 0.8206, test_loss: 0.8213, test_f1: 0.5544
 epoch: 52, train_loss: 0.8188, test_loss: 0.8307, test_f1: 0.5691
 epoch: 53, train_loss: 0.8032, test_loss: 0.8134, test_f1: 0.5685
 epoch: 54, train_loss: 0.7963, test_loss: 0.8261, test_f1: 0.5668
 epoch: 55, train_loss: 0.8105, test_loss: 0.8073, test_f1: 0.5776
 epoch: 56, train_loss: 0.8002, test_loss: 0.8170, test_f1: 0.5563
 epoch: 57, train_loss: 0.8123, test_loss: 0.8234, test_f1: 0.5531
 epoch: 58, train_loss: 0.8068, test_loss: 0.8255, test_f1: 0.5693
 epoch: 59, train_loss: 0.7990, test_loss: 0.8107, test_f1: 0.5793
 epoch: 60, train_loss: 0.8036, test_loss: 0.8104, test_f1: 0.5732
 epoch: 61, train_loss: 0.8004, test_loss: 0.8181, test_f1: 0.5514
 epoch: 62, train_loss: 0.7947, test_loss: 0.8183, test_f1: 0.5552
 epoch: 63, train_loss: 0.8007, test_loss: 0.8172, test_f1: 0.5776
 epoch: 64, train_loss: 0.8059, test_loss: 0.8217, test_f1: 0.5569
 epoch: 65, train_loss: 0.8082, test_loss: 0.8223, test_f1: 0.5649
 epoch: 66, train_loss: 0.8091, test_loss: 0.8692, test_f1: 0.5267
 epoch: 67, train_loss: 0.8000, test_loss: 0.8192, test_f1: 0.5574
 epoch: 68, train_loss: 0.8051, test_loss: 0.8221, test_f1: 0.5614
 epoch: 69, train_loss: 0.7934, test_loss: 0.8044, test_f1: 0.5780
 epoch: 70, train_loss: 0.7938, test_loss: 0.8393, test_f1: 0.5538
 epoch: 71, train_loss: 0.7938, test_loss: 0.8145, test_f1: 0.5596
 epoch: 72, train_loss: 0.7963, test_loss: 0.8083, test_f1: 0.5649
 epoch: 73, train_loss: 0.7995, test_loss: 0.8337, test_f1: 0.5487
 epoch: 74, train_loss: 0.7928, test_loss: 0.8405, test_f1: 0.5556
 epoch: 75, train_loss: 0.7883, test_loss: 0.8283, test_f1: 0.5699
 epoch: 76, train_loss: 0.7787, test_loss: 0.8241, test_f1: 0.5628
 epoch: 77, train_loss: 0.7976, test_loss: 0.8318, test_f1: 0.5520
 epoch: 78, train_loss: 0.7691, test_loss: 0.8210, test_f1: 0.5603
 epoch: 79, train_loss: 0.7840, test_loss: 0.8140, test_f1: 0.5649
 epoch: 80, train_loss: 0.7862, test_loss: 0.8090, test_f1: 0.5583
 epoch: 81, train_loss: 0.7712, test_loss: 0.8042, test_f1: 0.5567
 epoch: 82, train_loss: 0.7816, test_loss: 0.8404, test_f1: 0.5543
 epoch: 83, train_loss: 0.7783, test_loss: 0.7997, test_f1: 0.5625
 epoch: 84, train_loss: 0.7659, test_loss: 0.8002, test_f1: 0.5653
 epoch: 85, train_loss: 0.7767, test_loss: 0.8223, test_f1: 0.5612
 epoch: 86, train_loss: 0.7776, test_loss: 0.8217, test_f1: 0.5610
 epoch: 87, train_loss: 0.7756, test_loss: 0.8182, test_f1: 0.5563
 epoch: 88, train_loss: 0.7866, test_loss: 0.8363, test_f1: 0.5507
 epoch: 89, train_loss: 0.7780, test_loss: 0.8285, test_f1: 0.5393
 epoch: 90, train_loss: 0.7775, test_loss: 0.8076, test_f1: 0.5659
 epoch: 91, train_loss: 0.7621, test_loss: 0.8091, test_f1: 0.5824
 epoch: 92, train_loss: 0.7796, test_loss: 0.8069, test_f1: 0.5758
 epoch: 93, train_loss: 0.7643, test_loss: 0.8074, test_f1: 0.5619
 epoch: 94, train_loss: 0.7705, test_loss: 0.8047, test_f1: 0.5698
 epoch: 95, train_loss: 0.7500, test_loss: 0.8046, test_f1: 0.5532
 epoch: 96, train_loss: 0.7628, test_loss: 0.7883, test_f1: 0.5485
 epoch: 97, train_loss: 0.7669, test_loss: 0.8132, test_f1: 0.5680
 epoch: 98, train_loss: 0.7596, test_loss: 0.8063, test_f1: 0.5610
 epoch: 99, train_loss: 0.7747, test_loss: 0.7911, test_f1: 0.5594
##################ITERATION #5 ****************************************
 epoch: 0, train_loss: 1.3395, test_loss: 1.3583, test_f1: 0.2270
 epoch: 1, train_loss: 1.1890, test_loss: 1.3639, test_f1: 0.2270
 epoch: 2, train_loss: 1.1195, test_loss: 1.3403, test_f1: 0.2395
 epoch: 3, train_loss: 1.0896, test_loss: 1.1070, test_f1: 0.3492
 epoch: 4, train_loss: 1.0488, test_loss: 1.0495, test_f1: 0.4042
 epoch: 5, train_loss: 1.0424, test_loss: 1.0332, test_f1: 0.4333
 epoch: 6, train_loss: 1.0385, test_loss: 1.0144, test_f1: 0.4870
 epoch: 7, train_loss: 1.0227, test_loss: 1.0027, test_f1: 0.4790
 epoch: 8, train_loss: 1.0096, test_loss: 0.9946, test_f1: 0.4938
 epoch: 9, train_loss: 1.0023, test_loss: 1.0075, test_f1: 0.4720
 epoch: 10, train_loss: 0.9880, test_loss: 0.9957, test_f1: 0.4922
 epoch: 11, train_loss: 0.9766, test_loss: 0.9956, test_f1: 0.5000
 epoch: 12, train_loss: 0.9698, test_loss: 1.0037, test_f1: 0.4875
 epoch: 13, train_loss: 0.9577, test_loss: 0.9736, test_f1: 0.5090
 epoch: 14, train_loss: 0.9626, test_loss: 0.9864, test_f1: 0.5093
 epoch: 15, train_loss: 0.9629, test_loss: 0.9768, test_f1: 0.4898
 epoch: 16, train_loss: 0.9543, test_loss: 0.9757, test_f1: 0.4948
 epoch: 17, train_loss: 0.9483, test_loss: 0.9731, test_f1: 0.4894
 epoch: 18, train_loss: 0.9526, test_loss: 0.9676, test_f1: 0.4987
 epoch: 19, train_loss: 0.9386, test_loss: 0.9390, test_f1: 0.4925
 epoch: 20, train_loss: 0.9342, test_loss: 0.9741, test_f1: 0.4919
 epoch: 21, train_loss: 0.9257, test_loss: 0.9668, test_f1: 0.4925
 epoch: 22, train_loss: 0.9272, test_loss: 1.0129, test_f1: 0.4612
 epoch: 23, train_loss: 0.9222, test_loss: 0.9632, test_f1: 0.4896
 epoch: 24, train_loss: 0.9198, test_loss: 0.9563, test_f1: 0.5045
 epoch: 25, train_loss: 0.9123, test_loss: 0.9413, test_f1: 0.5145
 epoch: 26, train_loss: 0.9154, test_loss: 0.9308, test_f1: 0.5122
 epoch: 27, train_loss: 0.9101, test_loss: 0.9537, test_f1: 0.5182
 epoch: 28, train_loss: 0.8955, test_loss: 0.9617, test_f1: 0.5091
 epoch: 29, train_loss: 0.8920, test_loss: 0.9444, test_f1: 0.5167
 epoch: 30, train_loss: 0.8928, test_loss: 0.9488, test_f1: 0.5085
 epoch: 31, train_loss: 0.8896, test_loss: 0.9506, test_f1: 0.5059
 epoch: 32, train_loss: 0.8830, test_loss: 0.9435, test_f1: 0.5374
 epoch: 33, train_loss: 0.8813, test_loss: 0.9391, test_f1: 0.5231
 epoch: 34, train_loss: 0.8807, test_loss: 0.9513, test_f1: 0.5318
 epoch: 35, train_loss: 0.8831, test_loss: 0.9545, test_f1: 0.5072
 epoch: 36, train_loss: 0.8775, test_loss: 0.9645, test_f1: 0.5441
 epoch: 37, train_loss: 0.8798, test_loss: 0.9313, test_f1: 0.5360
 epoch: 38, train_loss: 0.8699, test_loss: 0.9507, test_f1: 0.5327
 epoch: 39, train_loss: 0.8728, test_loss: 0.9224, test_f1: 0.5418
 epoch: 40, train_loss: 0.8626, test_loss: 0.9425, test_f1: 0.5110
 epoch: 41, train_loss: 0.8610, test_loss: 0.9259, test_f1: 0.5345
 epoch: 42, train_loss: 0.8649, test_loss: 0.9074, test_f1: 0.5255
 epoch: 43, train_loss: 0.8629, test_loss: 0.8894, test_f1: 0.5206
 epoch: 44, train_loss: 0.8516, test_loss: 0.9568, test_f1: 0.5133
 epoch: 45, train_loss: 0.8509, test_loss: 0.9061, test_f1: 0.5375
 epoch: 46, train_loss: 0.8555, test_loss: 1.0347, test_f1: 0.5021
 epoch: 47, train_loss: 0.8502, test_loss: 0.9265, test_f1: 0.5542
 epoch: 48, train_loss: 0.8438, test_loss: 0.9141, test_f1: 0.5607
 epoch: 49, train_loss: 0.8430, test_loss: 0.9338, test_f1: 0.5467
 epoch: 50, train_loss: 0.8369, test_loss: 0.9285, test_f1: 0.5768
 epoch: 51, train_loss: 0.8324, test_loss: 0.9214, test_f1: 0.5512
 epoch: 52, train_loss: 0.8309, test_loss: 0.9059, test_f1: 0.5603
 epoch: 53, train_loss: 0.8239, test_loss: 0.9368, test_f1: 0.5182
 epoch: 54, train_loss: 0.8289, test_loss: 0.9202, test_f1: 0.5555
 epoch: 55, train_loss: 0.8264, test_loss: 0.8925, test_f1: 0.5475
 epoch: 56, train_loss: 0.8182, test_loss: 0.9066, test_f1: 0.5599
 epoch: 57, train_loss: 0.8258, test_loss: 0.8776, test_f1: 0.5489
 epoch: 58, train_loss: 0.8132, test_loss: 0.9170, test_f1: 0.5444
 epoch: 59, train_loss: 0.8206, test_loss: 0.9225, test_f1: 0.5487
 epoch: 60, train_loss: 0.8141, test_loss: 0.8983, test_f1: 0.5663
 epoch: 61, train_loss: 0.8106, test_loss: 0.9131, test_f1: 0.5523
 epoch: 62, train_loss: 0.8188, test_loss: 0.9184, test_f1: 0.5675
 epoch: 63, train_loss: 0.8082, test_loss: 0.9307, test_f1: 0.5569
 epoch: 64, train_loss: 0.8100, test_loss: 0.9232, test_f1: 0.5370
 epoch: 65, train_loss: 0.8057, test_loss: 0.9179, test_f1: 0.5892
 epoch: 66, train_loss: 0.8040, test_loss: 0.9262, test_f1: 0.5617
 epoch: 67, train_loss: 0.8086, test_loss: 0.9077, test_f1: 0.5502
 epoch: 68, train_loss: 0.8079, test_loss: 0.9221, test_f1: 0.5594
 epoch: 69, train_loss: 0.8054, test_loss: 0.9087, test_f1: 0.5617
 epoch: 70, train_loss: 0.7971, test_loss: 0.8898, test_f1: 0.5683
 epoch: 71, train_loss: 0.8036, test_loss: 0.9468, test_f1: 0.5595
 epoch: 72, train_loss: 0.8002, test_loss: 0.9298, test_f1: 0.5774
 epoch: 73, train_loss: 0.8034, test_loss: 0.9238, test_f1: 0.5644
 epoch: 74, train_loss: 0.7945, test_loss: 0.9290, test_f1: 0.5724
 epoch: 75, train_loss: 0.8026, test_loss: 0.9232, test_f1: 0.5658
 epoch: 76, train_loss: 0.8025, test_loss: 0.9244, test_f1: 0.5728
 epoch: 77, train_loss: 0.7908, test_loss: 0.9324, test_f1: 0.5782
 epoch: 78, train_loss: 0.8015, test_loss: 0.9177, test_f1: 0.5814
 epoch: 79, train_loss: 0.7974, test_loss: 0.9336, test_f1: 0.5425
 epoch: 80, train_loss: 0.7975, test_loss: 0.9096, test_f1: 0.5794
 epoch: 81, train_loss: 0.7896, test_loss: 0.9277, test_f1: 0.5662
 epoch: 82, train_loss: 0.7890, test_loss: 0.9006, test_f1: 0.5766
 epoch: 83, train_loss: 0.7962, test_loss: 0.9236, test_f1: 0.5726
 epoch: 84, train_loss: 0.7877, test_loss: 0.9246, test_f1: 0.5691
 epoch: 85, train_loss: 0.7862, test_loss: 0.9266, test_f1: 0.5605
 epoch: 86, train_loss: 0.7871, test_loss: 0.9440, test_f1: 0.5535
 epoch: 87, train_loss: 0.7910, test_loss: 0.9465, test_f1: 0.5477
 epoch: 88, train_loss: 0.7755, test_loss: 0.9488, test_f1: 0.5608
 epoch: 89, train_loss: 0.7822, test_loss: 0.9387, test_f1: 0.5471
 epoch: 90, train_loss: 0.7940, test_loss: 0.9520, test_f1: 0.5384
 epoch: 91, train_loss: 0.7714, test_loss: 0.9395, test_f1: 0.5357
 epoch: 92, train_loss: 0.7926, test_loss: 0.9465, test_f1: 0.5348
 epoch: 93, train_loss: 0.7795, test_loss: 0.9322, test_f1: 0.5708
 epoch: 94, train_loss: 0.7701, test_loss: 0.9650, test_f1: 0.5548
 epoch: 95, train_loss: 0.7832, test_loss: 0.9330, test_f1: 0.5607
 epoch: 96, train_loss: 0.7926, test_loss: 0.9465, test_f1: 0.5527
 epoch: 97, train_loss: 0.7687, test_loss: 0.9286, test_f1: 0.5604
 epoch: 98, train_loss: 0.7610, test_loss: 0.9470, test_f1: 0.5646
 epoch: 99, train_loss: 0.7684, test_loss: 0.9429, test_f1: 0.5739
##################ITERATION #6 ****************************************
 epoch: 0, train_loss: 1.4319, test_loss: 1.3742, test_f1: 0.2270
 epoch: 1, train_loss: 1.1959, test_loss: 1.3949, test_f1: 0.2270
 epoch: 2, train_loss: 1.1236, test_loss: 1.3888, test_f1: 0.2350
 epoch: 3, train_loss: 1.0832, test_loss: 1.2824, test_f1: 0.2558
 epoch: 4, train_loss: 1.0741, test_loss: 1.1022, test_f1: 0.3910
 epoch: 5, train_loss: 1.0378, test_loss: 1.0486, test_f1: 0.4427
 epoch: 6, train_loss: 1.0292, test_loss: 1.0302, test_f1: 0.4681
 epoch: 7, train_loss: 1.0094, test_loss: 1.0335, test_f1: 0.4650
 epoch: 8, train_loss: 1.0020, test_loss: 1.0193, test_f1: 0.4688
 epoch: 9, train_loss: 1.0029, test_loss: 1.0124, test_f1: 0.4895
 epoch: 10, train_loss: 0.9883, test_loss: 1.0208, test_f1: 0.4898
 epoch: 11, train_loss: 0.9744, test_loss: 1.0036, test_f1: 0.4920
 epoch: 12, train_loss: 0.9647, test_loss: 0.9969, test_f1: 0.5100
 epoch: 13, train_loss: 0.9713, test_loss: 1.0009, test_f1: 0.4972
 epoch: 14, train_loss: 0.9471, test_loss: 0.9971, test_f1: 0.4982
 epoch: 15, train_loss: 0.9461, test_loss: 0.9854, test_f1: 0.5007
 epoch: 16, train_loss: 0.9404, test_loss: 0.9975, test_f1: 0.5012
 epoch: 17, train_loss: 0.9440, test_loss: 0.9816, test_f1: 0.5099
 epoch: 18, train_loss: 0.9233, test_loss: 0.9920, test_f1: 0.4966
 epoch: 19, train_loss: 0.9172, test_loss: 0.9798, test_f1: 0.5168
 epoch: 20, train_loss: 0.9199, test_loss: 0.9723, test_f1: 0.5067
 epoch: 21, train_loss: 0.9138, test_loss: 0.9910, test_f1: 0.4953
 epoch: 22, train_loss: 0.9072, test_loss: 0.9779, test_f1: 0.5062
 epoch: 23, train_loss: 0.9019, test_loss: 0.9814, test_f1: 0.5137
 epoch: 24, train_loss: 0.8997, test_loss: 0.9569, test_f1: 0.5428
 epoch: 25, train_loss: 0.8949, test_loss: 0.9757, test_f1: 0.5170
 epoch: 26, train_loss: 0.8889, test_loss: 0.9662, test_f1: 0.5182
 epoch: 27, train_loss: 0.8880, test_loss: 0.9790, test_f1: 0.5102
 epoch: 28, train_loss: 0.8808, test_loss: 0.9489, test_f1: 0.5196
 epoch: 29, train_loss: 0.8763, test_loss: 0.9605, test_f1: 0.5400
 epoch: 30, train_loss: 0.8810, test_loss: 0.9513, test_f1: 0.5360
 epoch: 31, train_loss: 0.8679, test_loss: 0.9873, test_f1: 0.5198
 epoch: 32, train_loss: 0.8714, test_loss: 0.9609, test_f1: 0.5461
 epoch: 33, train_loss: 0.8742, test_loss: 0.9650, test_f1: 0.5191
 epoch: 34, train_loss: 0.8739, test_loss: 0.9592, test_f1: 0.5350
 epoch: 35, train_loss: 0.8680, test_loss: 0.9625, test_f1: 0.5169
 epoch: 36, train_loss: 0.8684, test_loss: 0.9594, test_f1: 0.5525
 epoch: 37, train_loss: 0.8595, test_loss: 0.9443, test_f1: 0.5505
 epoch: 38, train_loss: 0.8557, test_loss: 0.9869, test_f1: 0.5264
 epoch: 39, train_loss: 0.8561, test_loss: 0.9572, test_f1: 0.5503
 epoch: 40, train_loss: 0.8525, test_loss: 0.9500, test_f1: 0.5346
 epoch: 41, train_loss: 0.8413, test_loss: 0.9463, test_f1: 0.5408
 epoch: 42, train_loss: 0.8586, test_loss: 0.9412, test_f1: 0.5362
 epoch: 43, train_loss: 0.8480, test_loss: 0.9667, test_f1: 0.5372
 epoch: 44, train_loss: 0.8549, test_loss: 0.9543, test_f1: 0.5414
 epoch: 45, train_loss: 0.8402, test_loss: 0.9697, test_f1: 0.5523
 epoch: 46, train_loss: 0.8310, test_loss: 0.9524, test_f1: 0.5397
 epoch: 47, train_loss: 0.8337, test_loss: 0.9478, test_f1: 0.5501
 epoch: 48, train_loss: 0.8206, test_loss: 0.9392, test_f1: 0.5512
 epoch: 49, train_loss: 0.8337, test_loss: 0.9551, test_f1: 0.5281
 epoch: 50, train_loss: 0.8193, test_loss: 0.9293, test_f1: 0.5656
 epoch: 51, train_loss: 0.8061, test_loss: 0.9248, test_f1: 0.5456
 epoch: 52, train_loss: 0.8113, test_loss: 0.9286, test_f1: 0.5538
 epoch: 53, train_loss: 0.8105, test_loss: 0.9292, test_f1: 0.5542
 epoch: 54, train_loss: 0.8052, test_loss: 0.9338, test_f1: 0.5581
 epoch: 55, train_loss: 0.7995, test_loss: 0.9254, test_f1: 0.5637
 epoch: 56, train_loss: 0.8006, test_loss: 0.9366, test_f1: 0.5427
 epoch: 57, train_loss: 0.7995, test_loss: 0.9349, test_f1: 0.5561
 epoch: 58, train_loss: 0.7984, test_loss: 0.9294, test_f1: 0.5639
 epoch: 59, train_loss: 0.8041, test_loss: 0.9286, test_f1: 0.5645
 epoch: 60, train_loss: 0.8024, test_loss: 0.9388, test_f1: 0.5716
 epoch: 61, train_loss: 0.8114, test_loss: 0.9486, test_f1: 0.5630
 epoch: 62, train_loss: 0.7996, test_loss: 0.9362, test_f1: 0.5609
 epoch: 63, train_loss: 0.7900, test_loss: 0.9367, test_f1: 0.5706
 epoch: 64, train_loss: 0.7869, test_loss: 0.9365, test_f1: 0.5610
 epoch: 65, train_loss: 0.7952, test_loss: 0.9395, test_f1: 0.5641
 epoch: 66, train_loss: 0.7931, test_loss: 0.9627, test_f1: 0.5409
 epoch: 67, train_loss: 0.7863, test_loss: 0.9429, test_f1: 0.5511
 epoch: 68, train_loss: 0.7943, test_loss: 0.9765, test_f1: 0.5264
 epoch: 69, train_loss: 0.7992, test_loss: 0.9313, test_f1: 0.5426
 epoch: 70, train_loss: 0.7990, test_loss: 0.9295, test_f1: 0.5642
 epoch: 71, train_loss: 0.7981, test_loss: 0.9370, test_f1: 0.5666
 epoch: 72, train_loss: 0.7876, test_loss: 0.9543, test_f1: 0.5518
 epoch: 73, train_loss: 0.7760, test_loss: 0.9563, test_f1: 0.5641
 epoch: 74, train_loss: 0.7825, test_loss: 0.9621, test_f1: 0.5530
 epoch: 75, train_loss: 0.7780, test_loss: 0.9378, test_f1: 0.5631
 epoch: 76, train_loss: 0.7829, test_loss: 0.9336, test_f1: 0.5636
 epoch: 77, train_loss: 0.7793, test_loss: 0.9514, test_f1: 0.5546
 epoch: 78, train_loss: 0.7707, test_loss: 0.9544, test_f1: 0.5505
 epoch: 79, train_loss: 0.7679, test_loss: 0.9494, test_f1: 0.5408
 epoch: 80, train_loss: 0.7803, test_loss: 0.9764, test_f1: 0.5389
 epoch: 81, train_loss: 0.7719, test_loss: 0.9530, test_f1: 0.5582
 epoch: 82, train_loss: 0.7749, test_loss: 0.9568, test_f1: 0.5682
 epoch: 83, train_loss: 0.7658, test_loss: 0.9752, test_f1: 0.5602
 epoch: 84, train_loss: 0.7666, test_loss: 0.9655, test_f1: 0.5621
 epoch: 85, train_loss: 0.7638, test_loss: 0.9538, test_f1: 0.5578
 epoch: 86, train_loss: 0.7578, test_loss: 0.9494, test_f1: 0.5655
 epoch: 87, train_loss: 0.7670, test_loss: 0.9675, test_f1: 0.5635
 epoch: 88, train_loss: 0.7741, test_loss: 0.9693, test_f1: 0.5559
 epoch: 89, train_loss: 0.7623, test_loss: 0.9500, test_f1: 0.5689
 epoch: 90, train_loss: 0.7621, test_loss: 0.9623, test_f1: 0.5633
 epoch: 91, train_loss: 0.7639, test_loss: 0.9523, test_f1: 0.5630
 epoch: 92, train_loss: 0.7831, test_loss: 0.9574, test_f1: 0.5509
 epoch: 93, train_loss: 0.7670, test_loss: 0.9621, test_f1: 0.5396
 epoch: 94, train_loss: 0.7563, test_loss: 0.9647, test_f1: 0.5669
 epoch: 95, train_loss: 0.7569, test_loss: 0.9550, test_f1: 0.5713
 epoch: 96, train_loss: 0.7579, test_loss: 0.9645, test_f1: 0.5682
 epoch: 97, train_loss: 0.7637, test_loss: 0.9685, test_f1: 0.5670
 epoch: 98, train_loss: 0.7656, test_loss: 0.9646, test_f1: 0.5570
 epoch: 99, train_loss: 0.7619, test_loss: 0.9486, test_f1: 0.5553
##################ITERATION #7 ****************************************
 epoch: 0, train_loss: 1.3201, test_loss: 1.3417, test_f1: 0.2270
 epoch: 1, train_loss: 1.1677, test_loss: 1.3030, test_f1: 0.2270
 epoch: 2, train_loss: 1.1194, test_loss: 1.2810, test_f1: 0.2514
 epoch: 3, train_loss: 1.0898, test_loss: 1.1497, test_f1: 0.4035
 epoch: 4, train_loss: 1.0609, test_loss: 1.0567, test_f1: 0.4448
 epoch: 5, train_loss: 1.0493, test_loss: 1.0031, test_f1: 0.4856
 epoch: 6, train_loss: 1.0250, test_loss: 0.9797, test_f1: 0.4847
 epoch: 7, train_loss: 1.0268, test_loss: 0.9811, test_f1: 0.4607
 epoch: 8, train_loss: 1.0100, test_loss: 0.9608, test_f1: 0.4963
 epoch: 9, train_loss: 0.9971, test_loss: 0.9609, test_f1: 0.5118
 epoch: 10, train_loss: 0.9918, test_loss: 0.9517, test_f1: 0.5065
 epoch: 11, train_loss: 0.9981, test_loss: 0.9495, test_f1: 0.4925
 epoch: 12, train_loss: 0.9849, test_loss: 0.9552, test_f1: 0.5001
 epoch: 13, train_loss: 0.9680, test_loss: 0.9967, test_f1: 0.4841
 epoch: 14, train_loss: 0.9704, test_loss: 0.9390, test_f1: 0.5255
 epoch: 15, train_loss: 0.9498, test_loss: 0.9373, test_f1: 0.5149
 epoch: 16, train_loss: 0.9551, test_loss: 0.9534, test_f1: 0.4980
 epoch: 17, train_loss: 0.9500, test_loss: 0.9478, test_f1: 0.5202
 epoch: 18, train_loss: 0.9385, test_loss: 0.9196, test_f1: 0.5240
 epoch: 19, train_loss: 0.9334, test_loss: 0.9477, test_f1: 0.5135
 epoch: 20, train_loss: 0.9220, test_loss: 0.9706, test_f1: 0.4808
 epoch: 21, train_loss: 0.9232, test_loss: 0.9254, test_f1: 0.5172
 epoch: 22, train_loss: 0.9248, test_loss: 0.9063, test_f1: 0.5333
 epoch: 23, train_loss: 0.9148, test_loss: 0.9516, test_f1: 0.4885
 epoch: 24, train_loss: 0.9220, test_loss: 0.9257, test_f1: 0.5069
 epoch: 25, train_loss: 0.9113, test_loss: 0.9550, test_f1: 0.4678
 epoch: 26, train_loss: 0.9060, test_loss: 1.0003, test_f1: 0.4939
 epoch: 27, train_loss: 0.9104, test_loss: 0.9303, test_f1: 0.4949
 epoch: 28, train_loss: 0.9006, test_loss: 0.9450, test_f1: 0.4970
 epoch: 29, train_loss: 0.8914, test_loss: 0.9514, test_f1: 0.5165
 epoch: 30, train_loss: 0.8842, test_loss: 0.8854, test_f1: 0.5271
 epoch: 31, train_loss: 0.8890, test_loss: 0.9134, test_f1: 0.5077
 epoch: 32, train_loss: 0.8923, test_loss: 0.9313, test_f1: 0.5186
 epoch: 33, train_loss: 0.8855, test_loss: 0.9015, test_f1: 0.4937
 epoch: 34, train_loss: 0.8671, test_loss: 1.0136, test_f1: 0.4896
 epoch: 35, train_loss: 0.8758, test_loss: 0.9334, test_f1: 0.4895
 epoch: 36, train_loss: 0.8725, test_loss: 0.9249, test_f1: 0.4844
 epoch: 37, train_loss: 0.8692, test_loss: 0.8973, test_f1: 0.5416
 epoch: 38, train_loss: 0.8729, test_loss: 0.8849, test_f1: 0.5185
 epoch: 39, train_loss: 0.8702, test_loss: 0.9005, test_f1: 0.5139
 epoch: 40, train_loss: 0.8584, test_loss: 0.8997, test_f1: 0.5082
 epoch: 41, train_loss: 0.8598, test_loss: 0.9124, test_f1: 0.5186
 epoch: 42, train_loss: 0.8613, test_loss: 0.8925, test_f1: 0.5165
 epoch: 43, train_loss: 0.8542, test_loss: 0.8933, test_f1: 0.5212
 epoch: 44, train_loss: 0.8530, test_loss: 0.9457, test_f1: 0.5198
 epoch: 45, train_loss: 0.8514, test_loss: 0.9849, test_f1: 0.4937
 epoch: 46, train_loss: 0.8525, test_loss: 0.8825, test_f1: 0.5334
 epoch: 47, train_loss: 0.8500, test_loss: 0.9102, test_f1: 0.5342
 epoch: 48, train_loss: 0.8382, test_loss: 0.9325, test_f1: 0.5078
 epoch: 49, train_loss: 0.8445, test_loss: 0.8918, test_f1: 0.5146
 epoch: 50, train_loss: 0.8356, test_loss: 0.9534, test_f1: 0.5183
 epoch: 51, train_loss: 0.8311, test_loss: 0.8631, test_f1: 0.5393
 epoch: 52, train_loss: 0.8291, test_loss: 0.8871, test_f1: 0.5345
 epoch: 53, train_loss: 0.8170, test_loss: 0.8684, test_f1: 0.5361
 epoch: 54, train_loss: 0.8106, test_loss: 0.8903, test_f1: 0.5314
 epoch: 55, train_loss: 0.8181, test_loss: 0.8973, test_f1: 0.5207
 epoch: 56, train_loss: 0.8141, test_loss: 0.8858, test_f1: 0.5297
 epoch: 57, train_loss: 0.8040, test_loss: 0.9097, test_f1: 0.5236
 epoch: 58, train_loss: 0.8032, test_loss: 0.8797, test_f1: 0.5236
 epoch: 59, train_loss: 0.8163, test_loss: 0.9049, test_f1: 0.5303
 epoch: 60, train_loss: 0.8062, test_loss: 0.9151, test_f1: 0.5291
 epoch: 61, train_loss: 0.8066, test_loss: 0.8826, test_f1: 0.5313
 epoch: 62, train_loss: 0.8054, test_loss: 0.8805, test_f1: 0.5309
 epoch: 63, train_loss: 0.8025, test_loss: 0.8905, test_f1: 0.5333
 epoch: 64, train_loss: 0.8121, test_loss: 0.9045, test_f1: 0.5195
 epoch: 65, train_loss: 0.7955, test_loss: 0.9125, test_f1: 0.5323
 epoch: 66, train_loss: 0.7985, test_loss: 0.9140, test_f1: 0.5256
 epoch: 67, train_loss: 0.7911, test_loss: 0.8936, test_f1: 0.5337
 epoch: 68, train_loss: 0.7983, test_loss: 0.9062, test_f1: 0.5249
 epoch: 69, train_loss: 0.7990, test_loss: 0.8906, test_f1: 0.5378
 epoch: 70, train_loss: 0.7891, test_loss: 0.9069, test_f1: 0.5443
 epoch: 71, train_loss: 0.7908, test_loss: 0.9030, test_f1: 0.5437
 epoch: 72, train_loss: 0.7796, test_loss: 0.8874, test_f1: 0.5333
 epoch: 73, train_loss: 0.7935, test_loss: 0.9019, test_f1: 0.5319
 epoch: 74, train_loss: 0.7909, test_loss: 0.9159, test_f1: 0.5330
 epoch: 75, train_loss: 0.7872, test_loss: 0.9054, test_f1: 0.5382
 epoch: 76, train_loss: 0.7811, test_loss: 0.8922, test_f1: 0.5361
 epoch: 77, train_loss: 0.7981, test_loss: 0.9152, test_f1: 0.5387
 epoch: 78, train_loss: 0.7961, test_loss: 0.9035, test_f1: 0.5354
 epoch: 79, train_loss: 0.7804, test_loss: 0.9491, test_f1: 0.5197
 epoch: 80, train_loss: 0.7911, test_loss: 0.9206, test_f1: 0.5334
 epoch: 81, train_loss: 0.7918, test_loss: 0.9219, test_f1: 0.5306
 epoch: 82, train_loss: 0.7742, test_loss: 0.9142, test_f1: 0.5327
 epoch: 83, train_loss: 0.7742, test_loss: 0.9298, test_f1: 0.5285
 epoch: 84, train_loss: 0.7775, test_loss: 0.9094, test_f1: 0.5383
 epoch: 85, train_loss: 0.7759, test_loss: 0.9223, test_f1: 0.5347
 epoch: 86, train_loss: 0.7795, test_loss: 0.9303, test_f1: 0.5270
 epoch: 87, train_loss: 0.7749, test_loss: 0.9034, test_f1: 0.5237
 epoch: 88, train_loss: 0.7857, test_loss: 0.9621, test_f1: 0.5178
 epoch: 89, train_loss: 0.7739, test_loss: 0.9178, test_f1: 0.5295
 epoch: 90, train_loss: 0.7757, test_loss: 0.9266, test_f1: 0.5366
 epoch: 91, train_loss: 0.7739, test_loss: 0.8854, test_f1: 0.5414
 epoch: 92, train_loss: 0.7815, test_loss: 0.8942, test_f1: 0.5467
 epoch: 93, train_loss: 0.7708, test_loss: 0.9303, test_f1: 0.5430
 epoch: 94, train_loss: 0.7721, test_loss: 0.8843, test_f1: 0.5344
 epoch: 95, train_loss: 0.7772, test_loss: 0.8879, test_f1: 0.5454
 epoch: 96, train_loss: 0.7600, test_loss: 0.9136, test_f1: 0.5678
 epoch: 97, train_loss: 0.7616, test_loss: 0.9173, test_f1: 0.5600
 epoch: 98, train_loss: 0.7682, test_loss: 0.9006, test_f1: 0.5426
 epoch: 99, train_loss: 0.7693, test_loss: 0.8788, test_f1: 0.5422
##################ITERATION #8 ****************************************
 epoch: 0, train_loss: 1.2782, test_loss: 1.3752, test_f1: 0.2270
 epoch: 1, train_loss: 1.1188, test_loss: 1.3148, test_f1: 0.2257
 epoch: 2, train_loss: 1.0749, test_loss: 1.3060, test_f1: 0.1286
 epoch: 3, train_loss: 1.0536, test_loss: 1.1262, test_f1: 0.3365
 epoch: 4, train_loss: 1.0351, test_loss: 1.0116, test_f1: 0.4586
 epoch: 5, train_loss: 1.0170, test_loss: 0.9752, test_f1: 0.4879
 epoch: 6, train_loss: 1.0173, test_loss: 0.9635, test_f1: 0.4978
 epoch: 7, train_loss: 0.9912, test_loss: 0.9590, test_f1: 0.4769
 epoch: 8, train_loss: 0.9825, test_loss: 0.9626, test_f1: 0.4804
 epoch: 9, train_loss: 0.9803, test_loss: 0.9483, test_f1: 0.4702
 epoch: 10, train_loss: 0.9622, test_loss: 0.9400, test_f1: 0.4934
 epoch: 11, train_loss: 0.9496, test_loss: 0.9291, test_f1: 0.5032
 epoch: 12, train_loss: 0.9408, test_loss: 0.9310, test_f1: 0.5090
 epoch: 13, train_loss: 0.9459, test_loss: 0.9333, test_f1: 0.5035
 epoch: 14, train_loss: 0.9292, test_loss: 0.9266, test_f1: 0.4845
 epoch: 15, train_loss: 0.9350, test_loss: 0.9113, test_f1: 0.5053
 epoch: 16, train_loss: 0.9238, test_loss: 0.9121, test_f1: 0.5030
 epoch: 17, train_loss: 0.9099, test_loss: 0.9053, test_f1: 0.5165
 epoch: 18, train_loss: 0.9064, test_loss: 0.9105, test_f1: 0.5132
 epoch: 19, train_loss: 0.9126, test_loss: 0.8953, test_f1: 0.5067
 epoch: 20, train_loss: 0.8908, test_loss: 0.8972, test_f1: 0.5072
 epoch: 21, train_loss: 0.8908, test_loss: 0.8870, test_f1: 0.5167
 epoch: 22, train_loss: 0.8853, test_loss: 0.8896, test_f1: 0.5134
 epoch: 23, train_loss: 0.8783, test_loss: 0.8834, test_f1: 0.5065
 epoch: 24, train_loss: 0.8787, test_loss: 0.8729, test_f1: 0.5156
 epoch: 25, train_loss: 0.8697, test_loss: 0.8648, test_f1: 0.5159
 epoch: 26, train_loss: 0.8798, test_loss: 0.8823, test_f1: 0.5170
 epoch: 27, train_loss: 0.8698, test_loss: 0.8684, test_f1: 0.5201
 epoch: 28, train_loss: 0.8713, test_loss: 0.8793, test_f1: 0.5063
 epoch: 29, train_loss: 0.8530, test_loss: 0.8665, test_f1: 0.5107
 epoch: 30, train_loss: 0.8570, test_loss: 0.8491, test_f1: 0.5205
 epoch: 31, train_loss: 0.8459, test_loss: 0.8445, test_f1: 0.5300
 epoch: 32, train_loss: 0.8526, test_loss: 0.8403, test_f1: 0.5254
 epoch: 33, train_loss: 0.8382, test_loss: 0.8407, test_f1: 0.5310
 epoch: 34, train_loss: 0.8413, test_loss: 0.8608, test_f1: 0.5338
 epoch: 35, train_loss: 0.8370, test_loss: 0.8674, test_f1: 0.5075
 epoch: 36, train_loss: 0.8384, test_loss: 0.8591, test_f1: 0.5319
 epoch: 37, train_loss: 0.8313, test_loss: 0.8504, test_f1: 0.5300
 epoch: 38, train_loss: 0.8201, test_loss: 0.8559, test_f1: 0.5211
 epoch: 39, train_loss: 0.8182, test_loss: 0.8627, test_f1: 0.5040
 epoch: 40, train_loss: 0.8187, test_loss: 0.8167, test_f1: 0.5358
 epoch: 41, train_loss: 0.8205, test_loss: 0.8452, test_f1: 0.5206
 epoch: 42, train_loss: 0.8166, test_loss: 0.8231, test_f1: 0.5367
 epoch: 43, train_loss: 0.8121, test_loss: 0.8524, test_f1: 0.5074
 epoch: 44, train_loss: 0.8107, test_loss: 0.8489, test_f1: 0.5148
 epoch: 45, train_loss: 0.8105, test_loss: 0.8462, test_f1: 0.5137
 epoch: 46, train_loss: 0.8001, test_loss: 0.8246, test_f1: 0.5212
 epoch: 47, train_loss: 0.8112, test_loss: 0.8270, test_f1: 0.5193
 epoch: 48, train_loss: 0.7896, test_loss: 0.8145, test_f1: 0.5347
 epoch: 49, train_loss: 0.8028, test_loss: 0.7999, test_f1: 0.5317
 epoch: 50, train_loss: 0.8006, test_loss: 0.7882, test_f1: 0.5626
 epoch: 51, train_loss: 0.7906, test_loss: 0.7963, test_f1: 0.5353
 epoch: 52, train_loss: 0.7796, test_loss: 0.7963, test_f1: 0.5283
 epoch: 53, train_loss: 0.7659, test_loss: 0.7865, test_f1: 0.5479
 epoch: 54, train_loss: 0.7771, test_loss: 0.7917, test_f1: 0.5403
 epoch: 55, train_loss: 0.7727, test_loss: 0.7905, test_f1: 0.5331
 epoch: 56, train_loss: 0.7752, test_loss: 0.7992, test_f1: 0.5338
 epoch: 57, train_loss: 0.7768, test_loss: 0.7973, test_f1: 0.5441
 epoch: 58, train_loss: 0.7620, test_loss: 0.7988, test_f1: 0.5449
 epoch: 59, train_loss: 0.7624, test_loss: 0.7908, test_f1: 0.5343
 epoch: 60, train_loss: 0.7592, test_loss: 0.7954, test_f1: 0.5382
 epoch: 61, train_loss: 0.7582, test_loss: 0.8057, test_f1: 0.5289
 epoch: 62, train_loss: 0.7678, test_loss: 0.7925, test_f1: 0.5431
 epoch: 63, train_loss: 0.7784, test_loss: 0.7888, test_f1: 0.5522
 epoch: 64, train_loss: 0.7578, test_loss: 0.7912, test_f1: 0.5464
 epoch: 65, train_loss: 0.7508, test_loss: 0.7891, test_f1: 0.5574
 epoch: 66, train_loss: 0.7661, test_loss: 0.8040, test_f1: 0.5475
 epoch: 67, train_loss: 0.7542, test_loss: 0.7870, test_f1: 0.5401
 epoch: 68, train_loss: 0.7480, test_loss: 0.7798, test_f1: 0.5475
 epoch: 69, train_loss: 0.7525, test_loss: 0.7880, test_f1: 0.5417
 epoch: 70, train_loss: 0.7419, test_loss: 0.7891, test_f1: 0.5525
 epoch: 71, train_loss: 0.7616, test_loss: 0.7832, test_f1: 0.5446
 epoch: 72, train_loss: 0.7629, test_loss: 0.7732, test_f1: 0.5569
 epoch: 73, train_loss: 0.7472, test_loss: 0.7774, test_f1: 0.5538
 epoch: 74, train_loss: 0.7399, test_loss: 0.7866, test_f1: 0.5448
 epoch: 75, train_loss: 0.7399, test_loss: 0.7818, test_f1: 0.5525
 epoch: 76, train_loss: 0.7420, test_loss: 0.7758, test_f1: 0.5754
 epoch: 77, train_loss: 0.7397, test_loss: 0.7782, test_f1: 0.5493
 epoch: 78, train_loss: 0.7373, test_loss: 0.7923, test_f1: 0.5654
 epoch: 79, train_loss: 0.7422, test_loss: 0.7871, test_f1: 0.5510
 epoch: 80, train_loss: 0.7293, test_loss: 0.7972, test_f1: 0.5494
 epoch: 81, train_loss: 0.7358, test_loss: 0.7868, test_f1: 0.5736
 epoch: 82, train_loss: 0.7427, test_loss: 0.7858, test_f1: 0.5668
 epoch: 83, train_loss: 0.7466, test_loss: 0.7785, test_f1: 0.5678
 epoch: 84, train_loss: 0.7249, test_loss: 0.7749, test_f1: 0.5657
 epoch: 85, train_loss: 0.7366, test_loss: 0.7701, test_f1: 0.5729
 epoch: 86, train_loss: 0.7340, test_loss: 0.8023, test_f1: 0.5541
 epoch: 87, train_loss: 0.7356, test_loss: 0.7930, test_f1: 0.5417
 epoch: 88, train_loss: 0.7399, test_loss: 0.7848, test_f1: 0.5646
 epoch: 89, train_loss: 0.7331, test_loss: 0.7957, test_f1: 0.5804
 epoch: 90, train_loss: 0.7302, test_loss: 0.7853, test_f1: 0.5538
 epoch: 91, train_loss: 0.7212, test_loss: 0.7842, test_f1: 0.5715
 epoch: 92, train_loss: 0.7337, test_loss: 0.7964, test_f1: 0.5599
 epoch: 93, train_loss: 0.7206, test_loss: 0.7751, test_f1: 0.5788
 epoch: 94, train_loss: 0.7224, test_loss: 0.7788, test_f1: 0.5700
 epoch: 95, train_loss: 0.7169, test_loss: 0.7897, test_f1: 0.5745
 epoch: 96, train_loss: 0.7333, test_loss: 0.7766, test_f1: 0.5765
 epoch: 97, train_loss: 0.7300, test_loss: 0.7795, test_f1: 0.5692
 epoch: 98, train_loss: 0.7377, test_loss: 0.7811, test_f1: 0.5595
 epoch: 99, train_loss: 0.7063, test_loss: 0.7774, test_f1: 0.5778
##################ITERATION #9 ****************************************
 epoch: 0, train_loss: 1.4474, test_loss: 1.3836, test_f1: 0.2270
 epoch: 1, train_loss: 1.1891, test_loss: 1.3170, test_f1: 0.2270
 epoch: 2, train_loss: 1.1165, test_loss: 1.1973, test_f1: 0.3114
 epoch: 3, train_loss: 1.0826, test_loss: 1.1435, test_f1: 0.3927
 epoch: 4, train_loss: 1.0571, test_loss: 1.0787, test_f1: 0.4187
 epoch: 5, train_loss: 1.0379, test_loss: 1.0353, test_f1: 0.4151
 epoch: 6, train_loss: 1.0181, test_loss: 1.0232, test_f1: 0.4266
 epoch: 7, train_loss: 1.0092, test_loss: 0.9949, test_f1: 0.4403
 epoch: 8, train_loss: 0.9845, test_loss: 1.0039, test_f1: 0.4526
 epoch: 9, train_loss: 0.9841, test_loss: 0.9818, test_f1: 0.4316
 epoch: 10, train_loss: 0.9785, test_loss: 0.9686, test_f1: 0.4817
 epoch: 11, train_loss: 0.9747, test_loss: 0.9556, test_f1: 0.5071
 epoch: 12, train_loss: 0.9666, test_loss: 0.9628, test_f1: 0.4773
 epoch: 13, train_loss: 0.9618, test_loss: 0.9384, test_f1: 0.4871
 epoch: 14, train_loss: 0.9476, test_loss: 0.9585, test_f1: 0.4878
 epoch: 15, train_loss: 0.9370, test_loss: 0.9296, test_f1: 0.5017
 epoch: 16, train_loss: 0.9305, test_loss: 0.9519, test_f1: 0.5123
 epoch: 17, train_loss: 0.9398, test_loss: 0.9434, test_f1: 0.5116
 epoch: 18, train_loss: 0.9133, test_loss: 0.9462, test_f1: 0.5351
 epoch: 19, train_loss: 0.9244, test_loss: 0.9635, test_f1: 0.4913
 epoch: 20, train_loss: 0.9114, test_loss: 1.0067, test_f1: 0.5059
 epoch: 21, train_loss: 0.9086, test_loss: 0.9344, test_f1: 0.5389
 epoch: 22, train_loss: 0.8980, test_loss: 0.9430, test_f1: 0.5505
 epoch: 23, train_loss: 0.8926, test_loss: 0.9763, test_f1: 0.5290
 epoch: 24, train_loss: 0.8862, test_loss: 0.9395, test_f1: 0.5196
 epoch: 25, train_loss: 0.8809, test_loss: 0.9494, test_f1: 0.4992
 epoch: 26, train_loss: 0.8753, test_loss: 0.9405, test_f1: 0.5261
 epoch: 27, train_loss: 0.8794, test_loss: 0.9611, test_f1: 0.5012
 epoch: 28, train_loss: 0.8663, test_loss: 0.9408, test_f1: 0.4957
 epoch: 29, train_loss: 0.8590, test_loss: 0.9359, test_f1: 0.5437
 epoch: 30, train_loss: 0.8701, test_loss: 0.9547, test_f1: 0.5121
 epoch: 31, train_loss: 0.8551, test_loss: 0.9474, test_f1: 0.5132
 epoch: 32, train_loss: 0.8592, test_loss: 0.9471, test_f1: 0.5226
 epoch: 33, train_loss: 0.8566, test_loss: 0.9495, test_f1: 0.5326
 epoch: 34, train_loss: 0.8540, test_loss: 0.9517, test_f1: 0.5189
 epoch: 35, train_loss: 0.8541, test_loss: 0.9444, test_f1: 0.5090
 epoch: 36, train_loss: 0.8533, test_loss: 0.9226, test_f1: 0.5206
 epoch: 37, train_loss: 0.8512, test_loss: 0.9644, test_f1: 0.4961
 epoch: 38, train_loss: 0.8542, test_loss: 0.9680, test_f1: 0.5182
 epoch: 39, train_loss: 0.8425, test_loss: 0.9463, test_f1: 0.5206
 epoch: 40, train_loss: 0.8309, test_loss: 0.9447, test_f1: 0.5166
 epoch: 41, train_loss: 0.8274, test_loss: 0.9236, test_f1: 0.5218
 epoch: 42, train_loss: 0.8193, test_loss: 0.9443, test_f1: 0.5283
 epoch: 43, train_loss: 0.8259, test_loss: 0.9450, test_f1: 0.5441
 epoch: 44, train_loss: 0.8235, test_loss: 0.9533, test_f1: 0.5226
 epoch: 45, train_loss: 0.8227, test_loss: 0.9671, test_f1: 0.5230
 epoch: 46, train_loss: 0.8156, test_loss: 0.9678, test_f1: 0.5136
 epoch: 47, train_loss: 0.8021, test_loss: 0.9602, test_f1: 0.5412
 epoch: 48, train_loss: 0.8090, test_loss: 0.9609, test_f1: 0.5124
 epoch: 49, train_loss: 0.8108, test_loss: 0.9594, test_f1: 0.5399
 epoch: 50, train_loss: 0.7974, test_loss: 0.9684, test_f1: 0.5390
 epoch: 51, train_loss: 0.7893, test_loss: 0.9490, test_f1: 0.5350
 epoch: 52, train_loss: 0.7932, test_loss: 0.9645, test_f1: 0.5472
 epoch: 53, train_loss: 0.7819, test_loss: 0.9568, test_f1: 0.5169
 epoch: 54, train_loss: 0.7792, test_loss: 0.9614, test_f1: 0.5259
 epoch: 55, train_loss: 0.7740, test_loss: 0.9617, test_f1: 0.5223
 epoch: 56, train_loss: 0.7870, test_loss: 0.9888, test_f1: 0.5203
 epoch: 57, train_loss: 0.7856, test_loss: 0.9852, test_f1: 0.5397
 epoch: 58, train_loss: 0.7859, test_loss: 0.9644, test_f1: 0.5300
 epoch: 59, train_loss: 0.7743, test_loss: 0.9555, test_f1: 0.5329
 epoch: 60, train_loss: 0.7803, test_loss: 0.9686, test_f1: 0.5226
 epoch: 61, train_loss: 0.7750, test_loss: 0.9563, test_f1: 0.5315
 epoch: 62, train_loss: 0.7751, test_loss: 0.9771, test_f1: 0.5209
 epoch: 63, train_loss: 0.7723, test_loss: 0.9685, test_f1: 0.5406
 epoch: 64, train_loss: 0.7721, test_loss: 0.9661, test_f1: 0.5297
 epoch: 65, train_loss: 0.7681, test_loss: 0.9676, test_f1: 0.5364
 epoch: 66, train_loss: 0.7751, test_loss: 0.9578, test_f1: 0.5133
 epoch: 67, train_loss: 0.7825, test_loss: 0.9833, test_f1: 0.5375
 epoch: 68, train_loss: 0.7712, test_loss: 0.9546, test_f1: 0.5323
 epoch: 69, train_loss: 0.7703, test_loss: 0.9911, test_f1: 0.4948
 epoch: 70, train_loss: 0.7651, test_loss: 0.9540, test_f1: 0.5172
 epoch: 71, train_loss: 0.7572, test_loss: 0.9788, test_f1: 0.5293
 epoch: 72, train_loss: 0.7531, test_loss: 0.9727, test_f1: 0.5194
 epoch: 73, train_loss: 0.7588, test_loss: 0.9771, test_f1: 0.5155
 epoch: 74, train_loss: 0.7506, test_loss: 0.9798, test_f1: 0.5361
 epoch: 75, train_loss: 0.7571, test_loss: 0.9828, test_f1: 0.5274
 epoch: 76, train_loss: 0.7614, test_loss: 0.9487, test_f1: 0.5320
 epoch: 77, train_loss: 0.7472, test_loss: 0.9942, test_f1: 0.5237
 epoch: 78, train_loss: 0.7547, test_loss: 0.9872, test_f1: 0.5374
 epoch: 79, train_loss: 0.7613, test_loss: 1.0251, test_f1: 0.5007
 epoch: 80, train_loss: 0.7653, test_loss: 0.9854, test_f1: 0.5198
 epoch: 81, train_loss: 0.7644, test_loss: 0.9812, test_f1: 0.5254
 epoch: 82, train_loss: 0.7538, test_loss: 0.9997, test_f1: 0.5339
 epoch: 83, train_loss: 0.7497, test_loss: 0.9734, test_f1: 0.5322
 epoch: 84, train_loss: 0.7542, test_loss: 0.9843, test_f1: 0.4990
 epoch: 85, train_loss: 0.7574, test_loss: 0.9734, test_f1: 0.5264
 epoch: 86, train_loss: 0.7607, test_loss: 0.9764, test_f1: 0.5226
 epoch: 87, train_loss: 0.7510, test_loss: 0.9727, test_f1: 0.5232
 epoch: 88, train_loss: 0.7409, test_loss: 0.9740, test_f1: 0.5192
 epoch: 89, train_loss: 0.7404, test_loss: 0.9835, test_f1: 0.5444
 epoch: 90, train_loss: 0.7391, test_loss: 0.9825, test_f1: 0.5173
 epoch: 91, train_loss: 0.7362, test_loss: 0.9928, test_f1: 0.5225
 epoch: 92, train_loss: 0.7357, test_loss: 1.0037, test_f1: 0.5406
 epoch: 93, train_loss: 0.7424, test_loss: 0.9699, test_f1: 0.5365
 epoch: 94, train_loss: 0.7295, test_loss: 0.9852, test_f1: 0.5331
 epoch: 95, train_loss: 0.7389, test_loss: 0.9880, test_f1: 0.5273
 epoch: 96, train_loss: 0.7405, test_loss: 0.9954, test_f1: 0.5241
 epoch: 97, train_loss: 0.7387, test_loss: 1.0041, test_f1: 0.5162
 epoch: 98, train_loss: 0.7439, test_loss: 0.9710, test_f1: 0.5309
 epoch: 99, train_loss: 0.7505, test_loss: 0.9861, test_f1: 0.5368

Training completed in 572.99 seconds
Best F1: 0.5892 at epoch 65
Mean F1 across iterations: 0.5643  0.0155
========================FINAL RESULTS================================
FEGIN weighted F1: 0.5892  0.0155
python main.py --data ltspice_examples --representation component_pin_net --model FEGIN --layers 4 --hiddens 16 --batch_size 256 --lr 0.001 --emb_size 128 --epochs 100 --save_appendix component_pin_net_L4_H16_BS256_LR0.001_E128 --no_val
-----



STDERR:
  File "main.py", line 370, in <module>
    main()
  File "main.py", line 254, in main
    dataset = dataset_class(
  File "/home/philip/projects/llm_inference_code_repo/Circuit-Completion-Using-GNNs/component_classification_with_link_prediction_head/evaluation/FEGIN/kernel/circuit_datasets.py", line 15, in __init__
    self.data, self.slices = torch.load(self.processed_paths[0])
  File "/home/philip/.local/lib/python3.8/site-packages/torch/serialization.py", line 1040, in load
    warnings.warn(
  File "/usr/lib/python3.8/warnings.py", line 109, in _showwarnmsg
    sw(msg.message, msg.category, msg.filename, msg.lineno,
  File "main.py", line 47, in warn_with_traceback
    traceback.print_stack(file=log)
/home/philip/projects/llm_inference_code_repo/Circuit-Completion-Using-GNNs/component_classification_with_link_prediction_head/evaluation/FEGIN/kernel/circuit_datasets.py:15: FutureWarning: You are using `torch.load` with `weights_only=False` (the current default value), which uses the default pickle module implicitly. It is possible to construct malicious pickle data which will execute arbitrary code during unpickling (See https://github.com/pytorch/pytorch/blob/main/SECURITY.md#untrusted-models for more details). In a future release, the default value for `weights_only` will be flipped to `True`. This limits the functions that could be executed during unpickling. Arbitrary objects will no longer be allowed to be loaded via this mode unless they are explicitly allowlisted by the user via `torch.serialization.add_safe_globals`. We recommend you start setting `weights_only=True` for any use case where you don't have full control of the loaded file. Please open an issue on GitHub for any issues related to this experimental feature.
  self.data, self.slices = torch.load(self.processed_paths[0])
