STDOUT:
Results will be saved in /home/philip/projects/ltspice_examples_code_repo/Circuit-Completion-Using-GNNs/component_classification_with_link_prediction_head/evaluation/FEGIN/results/model_FEGIN_dataset_ltspice_demos
Command line input: python main.py --data ltspice_demos --representation component_pin --model FEGIN --layers 5 --hiddens 32 --batch_size 32 --lr 0.0001 --emb_size 250 --epochs 100 --save_appendix component_pin_L5_H32_BS32_LR0.0001_E250 --no_val
 is saved.
-----
ltspice_demos - FEGIN
Using 5 layers, 32 hidden units, h = 2
Loading component_pin representation dataset
ENTERED
Training FEGIN on component_pin representation
Train: 1565, Test: 383
##################ITERATION #0 ****************************************
 epoch: 0, train_loss: 1.4223, test_loss: 1.4096, test_f1: 0.0507
 epoch: 1, train_loss: 1.4072, test_loss: 1.3998, test_f1: 0.0507
 epoch: 2, train_loss: 1.3933, test_loss: 1.3884, test_f1: 0.0664
 epoch: 3, train_loss: 1.3759, test_loss: 1.3756, test_f1: 0.2023
 epoch: 4, train_loss: 1.3551, test_loss: 1.3596, test_f1: 0.3042
 epoch: 5, train_loss: 1.3275, test_loss: 1.3405, test_f1: 0.3213
 epoch: 6, train_loss: 1.2988, test_loss: 1.3185, test_f1: 0.3230
 epoch: 7, train_loss: 1.2733, test_loss: 1.2991, test_f1: 0.3231
 epoch: 8, train_loss: 1.2433, test_loss: 1.2814, test_f1: 0.3392
 epoch: 9, train_loss: 1.2282, test_loss: 1.2705, test_f1: 0.3426
 epoch: 10, train_loss: 1.2070, test_loss: 1.2609, test_f1: 0.3410
 epoch: 11, train_loss: 1.1952, test_loss: 1.2536, test_f1: 0.3350
 epoch: 12, train_loss: 1.1877, test_loss: 1.2434, test_f1: 0.3419
 epoch: 13, train_loss: 1.1760, test_loss: 1.2404, test_f1: 0.3490
 epoch: 14, train_loss: 1.1668, test_loss: 1.2308, test_f1: 0.3617
 epoch: 15, train_loss: 1.1628, test_loss: 1.2256, test_f1: 0.3521
 epoch: 16, train_loss: 1.1545, test_loss: 1.2189, test_f1: 0.3537
 epoch: 17, train_loss: 1.1480, test_loss: 1.2083, test_f1: 0.3514
 epoch: 18, train_loss: 1.1411, test_loss: 1.2047, test_f1: 0.3822
 epoch: 19, train_loss: 1.1336, test_loss: 1.2000, test_f1: 0.3577
 epoch: 20, train_loss: 1.1293, test_loss: 1.1868, test_f1: 0.3618
 epoch: 21, train_loss: 1.1210, test_loss: 1.1860, test_f1: 0.3595
 epoch: 22, train_loss: 1.1206, test_loss: 1.1691, test_f1: 0.3269
 epoch: 23, train_loss: 1.1145, test_loss: 1.1667, test_f1: 0.3798
 epoch: 24, train_loss: 1.1115, test_loss: 1.1614, test_f1: 0.3790
 epoch: 25, train_loss: 1.1082, test_loss: 1.1533, test_f1: 0.3702
 epoch: 26, train_loss: 1.1028, test_loss: 1.1513, test_f1: 0.3722
 epoch: 27, train_loss: 1.0955, test_loss: 1.1435, test_f1: 0.4202
 epoch: 28, train_loss: 1.0924, test_loss: 1.1377, test_f1: 0.4497
 epoch: 29, train_loss: 1.0919, test_loss: 1.1344, test_f1: 0.4248
 epoch: 30, train_loss: 1.0736, test_loss: 1.1417, test_f1: 0.5144
 epoch: 31, train_loss: 1.0751, test_loss: 1.1334, test_f1: 0.4724
 epoch: 32, train_loss: 1.0622, test_loss: 1.1184, test_f1: 0.4382
 epoch: 33, train_loss: 1.0689, test_loss: 1.1204, test_f1: 0.4464
 epoch: 34, train_loss: 1.0589, test_loss: 1.1185, test_f1: 0.4254
 epoch: 35, train_loss: 1.0513, test_loss: 1.1114, test_f1: 0.4407
 epoch: 36, train_loss: 1.0511, test_loss: 1.1071, test_f1: 0.4336
 epoch: 37, train_loss: 1.0414, test_loss: 1.1017, test_f1: 0.4271
 epoch: 38, train_loss: 1.0305, test_loss: 1.0940, test_f1: 0.4219
 epoch: 39, train_loss: 1.0350, test_loss: 1.0920, test_f1: 0.4338
 epoch: 40, train_loss: 1.0347, test_loss: 1.0868, test_f1: 0.4362
 epoch: 41, train_loss: 1.0203, test_loss: 1.0857, test_f1: 0.4185
 epoch: 42, train_loss: 1.0120, test_loss: 1.0786, test_f1: 0.4112
 epoch: 43, train_loss: 1.0050, test_loss: 1.0847, test_f1: 0.4027
 epoch: 44, train_loss: 1.0044, test_loss: 1.0595, test_f1: 0.4257
 epoch: 45, train_loss: 0.9911, test_loss: 1.0671, test_f1: 0.4198
 epoch: 46, train_loss: 0.9883, test_loss: 1.0518, test_f1: 0.4282
 epoch: 47, train_loss: 0.9757, test_loss: 1.0574, test_f1: 0.4172
 epoch: 48, train_loss: 0.9651, test_loss: 1.0447, test_f1: 0.4282
 epoch: 49, train_loss: 0.9603, test_loss: 1.0488, test_f1: 0.4343
 epoch: 50, train_loss: 0.9677, test_loss: 1.0476, test_f1: 0.4355
 epoch: 51, train_loss: 0.9477, test_loss: 1.0502, test_f1: 0.4300
 epoch: 52, train_loss: 0.9477, test_loss: 1.0478, test_f1: 0.4240
 epoch: 53, train_loss: 0.9430, test_loss: 1.0481, test_f1: 0.4138
 epoch: 54, train_loss: 0.9447, test_loss: 1.0502, test_f1: 0.4340
 epoch: 55, train_loss: 0.9397, test_loss: 1.0519, test_f1: 0.4126
 epoch: 56, train_loss: 0.9344, test_loss: 1.0392, test_f1: 0.4383
 epoch: 57, train_loss: 0.9317, test_loss: 1.0498, test_f1: 0.4340
 epoch: 58, train_loss: 0.9334, test_loss: 1.0474, test_f1: 0.4243
 epoch: 59, train_loss: 0.9170, test_loss: 1.0648, test_f1: 0.4312
 epoch: 60, train_loss: 0.9336, test_loss: 1.0392, test_f1: 0.4466
 epoch: 61, train_loss: 0.9200, test_loss: 1.0388, test_f1: 0.4349
 epoch: 62, train_loss: 0.9242, test_loss: 1.0414, test_f1: 0.4485
 epoch: 63, train_loss: 0.9184, test_loss: 1.0409, test_f1: 0.4582
 epoch: 64, train_loss: 0.9322, test_loss: 1.0611, test_f1: 0.4347
 epoch: 65, train_loss: 0.9187, test_loss: 1.0635, test_f1: 0.4307
 epoch: 66, train_loss: 0.9055, test_loss: 1.0388, test_f1: 0.4523
 epoch: 67, train_loss: 0.9064, test_loss: 1.0418, test_f1: 0.4422
 epoch: 68, train_loss: 0.9009, test_loss: 1.0457, test_f1: 0.4324
 epoch: 69, train_loss: 0.9101, test_loss: 1.0519, test_f1: 0.4317
 epoch: 70, train_loss: 0.8973, test_loss: 1.0464, test_f1: 0.4337
 epoch: 71, train_loss: 0.9032, test_loss: 1.0415, test_f1: 0.4496
 epoch: 72, train_loss: 0.8896, test_loss: 1.0501, test_f1: 0.4551
 epoch: 73, train_loss: 0.8981, test_loss: 1.0400, test_f1: 0.4379
 epoch: 74, train_loss: 0.8917, test_loss: 1.0463, test_f1: 0.4729
 epoch: 75, train_loss: 0.8866, test_loss: 1.0437, test_f1: 0.4755
 epoch: 76, train_loss: 0.8949, test_loss: 1.0400, test_f1: 0.4455
 epoch: 77, train_loss: 0.8933, test_loss: 1.0496, test_f1: 0.4820
 epoch: 78, train_loss: 0.8816, test_loss: 1.0413, test_f1: 0.4595
 epoch: 79, train_loss: 0.8830, test_loss: 1.0361, test_f1: 0.4715
 epoch: 80, train_loss: 0.8938, test_loss: 1.0463, test_f1: 0.4799
 epoch: 81, train_loss: 0.8777, test_loss: 1.0206, test_f1: 0.4855
 epoch: 82, train_loss: 0.8738, test_loss: 1.0313, test_f1: 0.4887
 epoch: 83, train_loss: 0.8728, test_loss: 1.0421, test_f1: 0.4758
 epoch: 84, train_loss: 0.8804, test_loss: 1.0397, test_f1: 0.4730
 epoch: 85, train_loss: 0.8682, test_loss: 1.0386, test_f1: 0.4683
 epoch: 86, train_loss: 0.8696, test_loss: 1.0514, test_f1: 0.4700
 epoch: 87, train_loss: 0.8791, test_loss: 1.0257, test_f1: 0.4525
 epoch: 88, train_loss: 0.8694, test_loss: 1.0258, test_f1: 0.4931
 epoch: 89, train_loss: 0.8617, test_loss: 1.0291, test_f1: 0.4728
 epoch: 90, train_loss: 0.8793, test_loss: 1.0436, test_f1: 0.5092
 epoch: 91, train_loss: 0.8714, test_loss: 1.0302, test_f1: 0.4796
 epoch: 92, train_loss: 0.8594, test_loss: 1.0380, test_f1: 0.4925
 epoch: 93, train_loss: 0.8687, test_loss: 1.0316, test_f1: 0.5111
 epoch: 94, train_loss: 0.8555, test_loss: 1.0486, test_f1: 0.4695
 epoch: 95, train_loss: 0.8639, test_loss: 1.0389, test_f1: 0.4761
 epoch: 96, train_loss: 0.8536, test_loss: 1.0350, test_f1: 0.5056
 epoch: 97, train_loss: 0.8579, test_loss: 1.0445, test_f1: 0.5056
 epoch: 98, train_loss: 0.8493, test_loss: 1.0639, test_f1: 0.5005
 epoch: 99, train_loss: 0.8450, test_loss: 1.0411, test_f1: 0.5025
##################ITERATION #1 ****************************************
 epoch: 0, train_loss: 1.3976, test_loss: 1.3874, test_f1: 0.0664
 epoch: 1, train_loss: 1.3448, test_loss: 1.3602, test_f1: 0.1987
 epoch: 2, train_loss: 1.3084, test_loss: 1.3356, test_f1: 0.2883
 epoch: 3, train_loss: 1.2772, test_loss: 1.3106, test_f1: 0.2985
 epoch: 4, train_loss: 1.2489, test_loss: 1.2926, test_f1: 0.3022
 epoch: 5, train_loss: 1.2220, test_loss: 1.2803, test_f1: 0.3008
 epoch: 6, train_loss: 1.2008, test_loss: 1.2758, test_f1: 0.2929
 epoch: 7, train_loss: 1.1945, test_loss: 1.2647, test_f1: 0.2912
 epoch: 8, train_loss: 1.1822, test_loss: 1.2584, test_f1: 0.2869
 epoch: 9, train_loss: 1.1775, test_loss: 1.2650, test_f1: 0.2966
 epoch: 10, train_loss: 1.1617, test_loss: 1.2588, test_f1: 0.3344
 epoch: 11, train_loss: 1.1596, test_loss: 1.2450, test_f1: 0.3436
 epoch: 12, train_loss: 1.1454, test_loss: 1.2404, test_f1: 0.3643
 epoch: 13, train_loss: 1.1340, test_loss: 1.2346, test_f1: 0.3655
 epoch: 14, train_loss: 1.1392, test_loss: 1.2215, test_f1: 0.3696
 epoch: 15, train_loss: 1.1109, test_loss: 1.2211, test_f1: 0.3590
 epoch: 16, train_loss: 1.1106, test_loss: 1.2230, test_f1: 0.3453
 epoch: 17, train_loss: 1.1044, test_loss: 1.2118, test_f1: 0.3516
 epoch: 18, train_loss: 1.0978, test_loss: 1.2071, test_f1: 0.3348
 epoch: 19, train_loss: 1.0831, test_loss: 1.1965, test_f1: 0.3668
 epoch: 20, train_loss: 1.0818, test_loss: 1.2065, test_f1: 0.3491
 epoch: 21, train_loss: 1.0673, test_loss: 1.1915, test_f1: 0.3587
 epoch: 22, train_loss: 1.0584, test_loss: 1.2008, test_f1: 0.3562
 epoch: 23, train_loss: 1.0562, test_loss: 1.1730, test_f1: 0.3887
 epoch: 24, train_loss: 1.0547, test_loss: 1.1707, test_f1: 0.3752
 epoch: 25, train_loss: 1.0410, test_loss: 1.1748, test_f1: 0.3799
 epoch: 26, train_loss: 1.0290, test_loss: 1.1776, test_f1: 0.3802
 epoch: 27, train_loss: 1.0432, test_loss: 1.1698, test_f1: 0.3616
 epoch: 28, train_loss: 1.0202, test_loss: 1.1741, test_f1: 0.3549
 epoch: 29, train_loss: 1.0202, test_loss: 1.1794, test_f1: 0.3883
 epoch: 30, train_loss: 1.0216, test_loss: 1.1744, test_f1: 0.3656
 epoch: 31, train_loss: 1.0072, test_loss: 1.1479, test_f1: 0.3818
 epoch: 32, train_loss: 0.9977, test_loss: 1.1606, test_f1: 0.3958
 epoch: 33, train_loss: 1.0134, test_loss: 1.1603, test_f1: 0.3997
 epoch: 34, train_loss: 0.9961, test_loss: 1.1514, test_f1: 0.3946
 epoch: 35, train_loss: 0.9914, test_loss: 1.1441, test_f1: 0.3892
 epoch: 36, train_loss: 0.9798, test_loss: 1.1309, test_f1: 0.3775
 epoch: 37, train_loss: 0.9838, test_loss: 1.1408, test_f1: 0.3928
 epoch: 38, train_loss: 0.9836, test_loss: 1.1557, test_f1: 0.3921
 epoch: 39, train_loss: 0.9622, test_loss: 1.1334, test_f1: 0.3797
 epoch: 40, train_loss: 0.9674, test_loss: 1.1557, test_f1: 0.3974
 epoch: 41, train_loss: 0.9684, test_loss: 1.1306, test_f1: 0.4041
 epoch: 42, train_loss: 0.9647, test_loss: 1.1515, test_f1: 0.3980
 epoch: 43, train_loss: 0.9620, test_loss: 1.1573, test_f1: 0.3947
 epoch: 44, train_loss: 0.9511, test_loss: 1.1414, test_f1: 0.4154
 epoch: 45, train_loss: 0.9427, test_loss: 1.1246, test_f1: 0.3916
 epoch: 46, train_loss: 0.9382, test_loss: 1.1380, test_f1: 0.3900
 epoch: 47, train_loss: 0.9357, test_loss: 1.1254, test_f1: 0.4028
 epoch: 48, train_loss: 0.9412, test_loss: 1.1034, test_f1: 0.3883
 epoch: 49, train_loss: 0.9376, test_loss: 1.1325, test_f1: 0.4050
 epoch: 50, train_loss: 0.9264, test_loss: 1.0865, test_f1: 0.4257
 epoch: 51, train_loss: 0.9219, test_loss: 1.0953, test_f1: 0.4163
 epoch: 52, train_loss: 0.9194, test_loss: 1.0934, test_f1: 0.4136
 epoch: 53, train_loss: 0.9301, test_loss: 1.1122, test_f1: 0.4032
 epoch: 54, train_loss: 0.9123, test_loss: 1.0875, test_f1: 0.4203
 epoch: 55, train_loss: 0.9202, test_loss: 1.0980, test_f1: 0.4128
 epoch: 56, train_loss: 0.9086, test_loss: 1.0960, test_f1: 0.4182
 epoch: 57, train_loss: 0.9113, test_loss: 1.1187, test_f1: 0.4026
 epoch: 58, train_loss: 0.9107, test_loss: 1.0929, test_f1: 0.4215
 epoch: 59, train_loss: 0.9183, test_loss: 1.0977, test_f1: 0.4049
 epoch: 60, train_loss: 0.9032, test_loss: 1.1144, test_f1: 0.4191
 epoch: 61, train_loss: 0.9104, test_loss: 1.1204, test_f1: 0.4105
 epoch: 62, train_loss: 0.8934, test_loss: 1.0838, test_f1: 0.4080
 epoch: 63, train_loss: 0.9031, test_loss: 1.0733, test_f1: 0.4107
 epoch: 64, train_loss: 0.9093, test_loss: 1.0762, test_f1: 0.3915
 epoch: 65, train_loss: 0.9087, test_loss: 1.1001, test_f1: 0.4131
 epoch: 66, train_loss: 0.9101, test_loss: 1.0886, test_f1: 0.4119
 epoch: 67, train_loss: 0.9097, test_loss: 1.0750, test_f1: 0.4237
 epoch: 68, train_loss: 0.9037, test_loss: 1.1455, test_f1: 0.4057
 epoch: 69, train_loss: 0.8987, test_loss: 1.0869, test_f1: 0.4189
 epoch: 70, train_loss: 0.9095, test_loss: 1.1068, test_f1: 0.4365
 epoch: 71, train_loss: 0.8920, test_loss: 1.0831, test_f1: 0.4152
 epoch: 72, train_loss: 0.8991, test_loss: 1.0855, test_f1: 0.4187
 epoch: 73, train_loss: 0.8854, test_loss: 1.0818, test_f1: 0.4125
 epoch: 74, train_loss: 0.8929, test_loss: 1.0718, test_f1: 0.4300
 epoch: 75, train_loss: 0.8817, test_loss: 1.0925, test_f1: 0.4018
 epoch: 76, train_loss: 0.8826, test_loss: 1.0894, test_f1: 0.4162
 epoch: 77, train_loss: 0.8931, test_loss: 1.0937, test_f1: 0.4333
 epoch: 78, train_loss: 0.8749, test_loss: 1.0901, test_f1: 0.4138
 epoch: 79, train_loss: 0.8819, test_loss: 1.0861, test_f1: 0.4279
 epoch: 80, train_loss: 0.8812, test_loss: 1.0690, test_f1: 0.4440
 epoch: 81, train_loss: 0.8804, test_loss: 1.0802, test_f1: 0.4374
 epoch: 82, train_loss: 0.8795, test_loss: 1.0927, test_f1: 0.4389
 epoch: 83, train_loss: 0.8754, test_loss: 1.1017, test_f1: 0.4438
 epoch: 84, train_loss: 0.8710, test_loss: 1.0836, test_f1: 0.4682
 epoch: 85, train_loss: 0.8831, test_loss: 1.0861, test_f1: 0.4222
 epoch: 86, train_loss: 0.8792, test_loss: 1.0796, test_f1: 0.4513
 epoch: 87, train_loss: 0.8684, test_loss: 1.0905, test_f1: 0.4412
 epoch: 88, train_loss: 0.8675, test_loss: 1.0831, test_f1: 0.4513
 epoch: 89, train_loss: 0.8742, test_loss: 1.1003, test_f1: 0.4370
 epoch: 90, train_loss: 0.8755, test_loss: 1.0984, test_f1: 0.4318
 epoch: 91, train_loss: 0.8525, test_loss: 1.0992, test_f1: 0.4523
 epoch: 92, train_loss: 0.8767, test_loss: 1.1197, test_f1: 0.4382
 epoch: 93, train_loss: 0.8747, test_loss: 1.0974, test_f1: 0.4573
 epoch: 94, train_loss: 0.8674, test_loss: 1.0743, test_f1: 0.4583
 epoch: 95, train_loss: 0.8706, test_loss: 1.1027, test_f1: 0.4485
 epoch: 96, train_loss: 0.8650, test_loss: 1.0815, test_f1: 0.4608
 epoch: 97, train_loss: 0.8600, test_loss: 1.1109, test_f1: 0.4462
 epoch: 98, train_loss: 0.8828, test_loss: 1.1105, test_f1: 0.4474
 epoch: 99, train_loss: 0.8551, test_loss: 1.1138, test_f1: 0.4722
##################ITERATION #2 ****************************************
 epoch: 0, train_loss: 1.3339, test_loss: 1.3334, test_f1: 0.2281
 epoch: 1, train_loss: 1.2806, test_loss: 1.3062, test_f1: 0.2457
 epoch: 2, train_loss: 1.2530, test_loss: 1.2895, test_f1: 0.2455
 epoch: 3, train_loss: 1.2337, test_loss: 1.2721, test_f1: 0.2423
 epoch: 4, train_loss: 1.2147, test_loss: 1.2623, test_f1: 0.2355
 epoch: 5, train_loss: 1.1937, test_loss: 1.2396, test_f1: 0.2653
 epoch: 6, train_loss: 1.1715, test_loss: 1.2351, test_f1: 0.3123
 epoch: 7, train_loss: 1.1606, test_loss: 1.2160, test_f1: 0.3346
 epoch: 8, train_loss: 1.1467, test_loss: 1.2071, test_f1: 0.3339
 epoch: 9, train_loss: 1.1273, test_loss: 1.1968, test_f1: 0.3330
 epoch: 10, train_loss: 1.1149, test_loss: 1.1806, test_f1: 0.3367
 epoch: 11, train_loss: 1.1098, test_loss: 1.1732, test_f1: 0.3207
 epoch: 12, train_loss: 1.0965, test_loss: 1.1679, test_f1: 0.3196
 epoch: 13, train_loss: 1.0876, test_loss: 1.1531, test_f1: 0.3232
 epoch: 14, train_loss: 1.0722, test_loss: 1.1468, test_f1: 0.3332
 epoch: 15, train_loss: 1.0636, test_loss: 1.1475, test_f1: 0.3290
 epoch: 16, train_loss: 1.0498, test_loss: 1.1531, test_f1: 0.3468
 epoch: 17, train_loss: 1.0377, test_loss: 1.1262, test_f1: 0.3905
 epoch: 18, train_loss: 1.0329, test_loss: 1.1178, test_f1: 0.3932
 epoch: 19, train_loss: 1.0188, test_loss: 1.1067, test_f1: 0.4008
 epoch: 20, train_loss: 1.0224, test_loss: 1.1141, test_f1: 0.4004
 epoch: 21, train_loss: 1.0147, test_loss: 1.1213, test_f1: 0.4015
 epoch: 22, train_loss: 1.0163, test_loss: 1.0905, test_f1: 0.4100
 epoch: 23, train_loss: 1.0008, test_loss: 1.1021, test_f1: 0.4175
 epoch: 24, train_loss: 0.9967, test_loss: 1.1038, test_f1: 0.4073
 epoch: 25, train_loss: 0.9846, test_loss: 1.1077, test_f1: 0.4238
 epoch: 26, train_loss: 0.9777, test_loss: 1.0985, test_f1: 0.4082
 epoch: 27, train_loss: 0.9836, test_loss: 1.0918, test_f1: 0.4187
 epoch: 28, train_loss: 0.9640, test_loss: 1.1004, test_f1: 0.4106
 epoch: 29, train_loss: 0.9653, test_loss: 1.0965, test_f1: 0.4109
 epoch: 30, train_loss: 0.9614, test_loss: 1.0810, test_f1: 0.3982
 epoch: 31, train_loss: 0.9613, test_loss: 1.0993, test_f1: 0.3994
 epoch: 32, train_loss: 0.9604, test_loss: 1.1016, test_f1: 0.4030
 epoch: 33, train_loss: 0.9541, test_loss: 1.0861, test_f1: 0.4118
 epoch: 34, train_loss: 0.9428, test_loss: 1.0686, test_f1: 0.4031
 epoch: 35, train_loss: 0.9407, test_loss: 1.0645, test_f1: 0.4070
 epoch: 36, train_loss: 0.9380, test_loss: 1.0476, test_f1: 0.4087
 epoch: 37, train_loss: 0.9261, test_loss: 1.0622, test_f1: 0.4096
 epoch: 38, train_loss: 0.9339, test_loss: 1.0640, test_f1: 0.4174
 epoch: 39, train_loss: 0.9318, test_loss: 1.0569, test_f1: 0.4091
 epoch: 40, train_loss: 0.9309, test_loss: 1.0468, test_f1: 0.4219
 epoch: 41, train_loss: 0.9174, test_loss: 1.0295, test_f1: 0.4080
 epoch: 42, train_loss: 0.9151, test_loss: 1.0726, test_f1: 0.4108
 epoch: 43, train_loss: 0.9091, test_loss: 1.1858, test_f1: 0.4063
 epoch: 44, train_loss: 0.9107, test_loss: 1.0245, test_f1: 0.4212
 epoch: 45, train_loss: 0.9028, test_loss: 1.0389, test_f1: 0.4497
 epoch: 46, train_loss: 0.9031, test_loss: 1.0634, test_f1: 0.4321
 epoch: 47, train_loss: 0.8932, test_loss: 1.0196, test_f1: 0.4384
 epoch: 48, train_loss: 0.8983, test_loss: 1.0471, test_f1: 0.4381
 epoch: 49, train_loss: 0.8905, test_loss: 1.0231, test_f1: 0.4645
 epoch: 50, train_loss: 0.8881, test_loss: 1.0108, test_f1: 0.4469
 epoch: 51, train_loss: 0.8847, test_loss: 1.0133, test_f1: 0.4630
 epoch: 52, train_loss: 0.8754, test_loss: 1.0101, test_f1: 0.4418
 epoch: 53, train_loss: 0.8800, test_loss: 1.0277, test_f1: 0.4729
 epoch: 54, train_loss: 0.8677, test_loss: 1.0166, test_f1: 0.4558
 epoch: 55, train_loss: 0.8678, test_loss: 1.0164, test_f1: 0.4937
 epoch: 56, train_loss: 0.8805, test_loss: 1.0241, test_f1: 0.4739
 epoch: 57, train_loss: 0.8766, test_loss: 1.0269, test_f1: 0.4812
 epoch: 58, train_loss: 0.8690, test_loss: 1.0691, test_f1: 0.4969
 epoch: 59, train_loss: 0.8637, test_loss: 1.0264, test_f1: 0.4754
 epoch: 60, train_loss: 0.8737, test_loss: 1.0453, test_f1: 0.4584
 epoch: 61, train_loss: 0.8595, test_loss: 1.0374, test_f1: 0.4772
 epoch: 62, train_loss: 0.8682, test_loss: 1.0272, test_f1: 0.4882
 epoch: 63, train_loss: 0.8598, test_loss: 1.0300, test_f1: 0.4722
 epoch: 64, train_loss: 0.8577, test_loss: 1.0436, test_f1: 0.4969
 epoch: 65, train_loss: 0.8666, test_loss: 1.0197, test_f1: 0.4778
 epoch: 66, train_loss: 0.8620, test_loss: 1.0127, test_f1: 0.4721
 epoch: 67, train_loss: 0.8494, test_loss: 1.0169, test_f1: 0.4790
 epoch: 68, train_loss: 0.8464, test_loss: 1.0238, test_f1: 0.4784
 epoch: 69, train_loss: 0.8544, test_loss: 1.0147, test_f1: 0.4854
 epoch: 70, train_loss: 0.8531, test_loss: 1.0353, test_f1: 0.4755
 epoch: 71, train_loss: 0.8598, test_loss: 1.0026, test_f1: 0.4823
 epoch: 72, train_loss: 0.8488, test_loss: 1.0171, test_f1: 0.4993
 epoch: 73, train_loss: 0.8438, test_loss: 1.0067, test_f1: 0.4785
 epoch: 74, train_loss: 0.8446, test_loss: 1.0074, test_f1: 0.4875
 epoch: 75, train_loss: 0.8533, test_loss: 1.0150, test_f1: 0.5023
 epoch: 76, train_loss: 0.8410, test_loss: 1.0085, test_f1: 0.5028
 epoch: 77, train_loss: 0.8462, test_loss: 1.0167, test_f1: 0.4935
 epoch: 78, train_loss: 0.8403, test_loss: 1.0128, test_f1: 0.5061
 epoch: 79, train_loss: 0.8382, test_loss: 1.0075, test_f1: 0.4940
 epoch: 80, train_loss: 0.8352, test_loss: 1.0046, test_f1: 0.5052
 epoch: 81, train_loss: 0.8348, test_loss: 1.0170, test_f1: 0.5065
 epoch: 82, train_loss: 0.8512, test_loss: 0.9928, test_f1: 0.5053
 epoch: 83, train_loss: 0.8389, test_loss: 1.0168, test_f1: 0.5059
 epoch: 84, train_loss: 0.8444, test_loss: 1.0322, test_f1: 0.4932
 epoch: 85, train_loss: 0.8293, test_loss: 1.0118, test_f1: 0.5092
 epoch: 86, train_loss: 0.8286, test_loss: 1.0128, test_f1: 0.4909
 epoch: 87, train_loss: 0.8330, test_loss: 1.0202, test_f1: 0.5052
 epoch: 88, train_loss: 0.8224, test_loss: 1.0078, test_f1: 0.5176
 epoch: 89, train_loss: 0.8312, test_loss: 1.0068, test_f1: 0.5173
 epoch: 90, train_loss: 0.8264, test_loss: 0.9965, test_f1: 0.5217
 epoch: 91, train_loss: 0.8358, test_loss: 1.0117, test_f1: 0.5149
 epoch: 92, train_loss: 0.8251, test_loss: 1.0177, test_f1: 0.4974
 epoch: 93, train_loss: 0.8349, test_loss: 0.9995, test_f1: 0.5042
 epoch: 94, train_loss: 0.8337, test_loss: 1.0169, test_f1: 0.5270
 epoch: 95, train_loss: 0.8191, test_loss: 1.0080, test_f1: 0.5117
 epoch: 96, train_loss: 0.8137, test_loss: 0.9990, test_f1: 0.5255
 epoch: 97, train_loss: 0.8021, test_loss: 1.0247, test_f1: 0.5021
 epoch: 98, train_loss: 0.8167, test_loss: 1.0166, test_f1: 0.5238
 epoch: 99, train_loss: 0.8287, test_loss: 1.0549, test_f1: 0.5031
##################ITERATION #3 ****************************************
 epoch: 0, train_loss: 1.3637, test_loss: 1.3443, test_f1: 0.2357
 epoch: 1, train_loss: 1.2967, test_loss: 1.3238, test_f1: 0.2390
 epoch: 2, train_loss: 1.2634, test_loss: 1.2984, test_f1: 0.2281
 epoch: 3, train_loss: 1.2415, test_loss: 1.2843, test_f1: 0.2306
 epoch: 4, train_loss: 1.2264, test_loss: 1.2709, test_f1: 0.2366
 epoch: 5, train_loss: 1.2097, test_loss: 1.2602, test_f1: 0.2373
 epoch: 6, train_loss: 1.1895, test_loss: 1.2429, test_f1: 0.2531
 epoch: 7, train_loss: 1.1813, test_loss: 1.2330, test_f1: 0.2939
 epoch: 8, train_loss: 1.1593, test_loss: 1.2240, test_f1: 0.3577
 epoch: 9, train_loss: 1.1509, test_loss: 1.2175, test_f1: 0.3638
 epoch: 10, train_loss: 1.1407, test_loss: 1.2104, test_f1: 0.3363
 epoch: 11, train_loss: 1.1128, test_loss: 1.1964, test_f1: 0.3697
 epoch: 12, train_loss: 1.1083, test_loss: 1.1939, test_f1: 0.3806
 epoch: 13, train_loss: 1.0932, test_loss: 1.1721, test_f1: 0.3763
 epoch: 14, train_loss: 1.0823, test_loss: 1.1720, test_f1: 0.3763
 epoch: 15, train_loss: 1.0693, test_loss: 1.1580, test_f1: 0.3885
 epoch: 16, train_loss: 1.0660, test_loss: 1.1499, test_f1: 0.4085
 epoch: 17, train_loss: 1.0574, test_loss: 1.1392, test_f1: 0.4127
 epoch: 18, train_loss: 1.0469, test_loss: 1.1319, test_f1: 0.4096
 epoch: 19, train_loss: 1.0359, test_loss: 1.1276, test_f1: 0.4216
 epoch: 20, train_loss: 1.0152, test_loss: 1.1172, test_f1: 0.4258
 epoch: 21, train_loss: 1.0229, test_loss: 1.1059, test_f1: 0.4375
 epoch: 22, train_loss: 1.0155, test_loss: 1.0984, test_f1: 0.4310
 epoch: 23, train_loss: 1.0042, test_loss: 1.0996, test_f1: 0.4335
 epoch: 24, train_loss: 1.0040, test_loss: 1.0830, test_f1: 0.4583
 epoch: 25, train_loss: 0.9924, test_loss: 1.0874, test_f1: 0.4511
 epoch: 26, train_loss: 0.9882, test_loss: 1.0780, test_f1: 0.4606
 epoch: 27, train_loss: 0.9870, test_loss: 1.0886, test_f1: 0.4672
 epoch: 28, train_loss: 0.9804, test_loss: 1.0649, test_f1: 0.4852
 epoch: 29, train_loss: 0.9724, test_loss: 1.0713, test_f1: 0.4687
 epoch: 30, train_loss: 0.9663, test_loss: 1.0650, test_f1: 0.4709
 epoch: 31, train_loss: 0.9631, test_loss: 1.0535, test_f1: 0.4876
 epoch: 32, train_loss: 0.9585, test_loss: 1.0502, test_f1: 0.4887
 epoch: 33, train_loss: 0.9566, test_loss: 1.0631, test_f1: 0.4730
 epoch: 34, train_loss: 0.9545, test_loss: 1.0648, test_f1: 0.4695
 epoch: 35, train_loss: 0.9467, test_loss: 1.0708, test_f1: 0.4761
 epoch: 36, train_loss: 0.9423, test_loss: 1.0497, test_f1: 0.4930
 epoch: 37, train_loss: 0.9293, test_loss: 1.0376, test_f1: 0.4997
 epoch: 38, train_loss: 0.9382, test_loss: 1.0458, test_f1: 0.4861
 epoch: 39, train_loss: 0.9313, test_loss: 1.0348, test_f1: 0.5004
 epoch: 40, train_loss: 0.9154, test_loss: 1.0396, test_f1: 0.5025
 epoch: 41, train_loss: 0.9188, test_loss: 1.0276, test_f1: 0.5028
 epoch: 42, train_loss: 0.9223, test_loss: 1.0203, test_f1: 0.5029
 epoch: 43, train_loss: 0.9265, test_loss: 1.0269, test_f1: 0.4972
 epoch: 44, train_loss: 0.9094, test_loss: 1.0343, test_f1: 0.5010
 epoch: 45, train_loss: 0.9081, test_loss: 1.0199, test_f1: 0.5193
 epoch: 46, train_loss: 0.9023, test_loss: 1.0300, test_f1: 0.4949
 epoch: 47, train_loss: 0.9040, test_loss: 1.0202, test_f1: 0.5086
 epoch: 48, train_loss: 0.9090, test_loss: 1.0148, test_f1: 0.5308
 epoch: 49, train_loss: 0.9014, test_loss: 1.0125, test_f1: 0.5313
 epoch: 50, train_loss: 0.8978, test_loss: 1.0049, test_f1: 0.5072
 epoch: 51, train_loss: 0.8901, test_loss: 1.0129, test_f1: 0.5194
 epoch: 52, train_loss: 0.8859, test_loss: 1.0089, test_f1: 0.5111
 epoch: 53, train_loss: 0.8848, test_loss: 1.0039, test_f1: 0.5205
 epoch: 54, train_loss: 0.8864, test_loss: 1.0073, test_f1: 0.5173
 epoch: 55, train_loss: 0.8797, test_loss: 1.0058, test_f1: 0.5128
 epoch: 56, train_loss: 0.8828, test_loss: 1.0151, test_f1: 0.5193
 epoch: 57, train_loss: 0.8725, test_loss: 1.0066, test_f1: 0.5279
 epoch: 58, train_loss: 0.8886, test_loss: 1.0052, test_f1: 0.5223
 epoch: 59, train_loss: 0.8790, test_loss: 0.9938, test_f1: 0.5250
 epoch: 60, train_loss: 0.8764, test_loss: 1.0039, test_f1: 0.5228
 epoch: 61, train_loss: 0.8752, test_loss: 1.0072, test_f1: 0.5226
 epoch: 62, train_loss: 0.8648, test_loss: 1.0063, test_f1: 0.5139
 epoch: 63, train_loss: 0.8813, test_loss: 1.0212, test_f1: 0.5127
 epoch: 64, train_loss: 0.8763, test_loss: 1.0049, test_f1: 0.5308
 epoch: 65, train_loss: 0.8711, test_loss: 1.0036, test_f1: 0.5236
 epoch: 66, train_loss: 0.8682, test_loss: 0.9984, test_f1: 0.5373
 epoch: 67, train_loss: 0.8686, test_loss: 0.9897, test_f1: 0.5309
 epoch: 68, train_loss: 0.8754, test_loss: 1.0040, test_f1: 0.5370
 epoch: 69, train_loss: 0.8741, test_loss: 0.9887, test_f1: 0.5326
 epoch: 70, train_loss: 0.8680, test_loss: 0.9984, test_f1: 0.5229
 epoch: 71, train_loss: 0.8581, test_loss: 0.9965, test_f1: 0.5219
 epoch: 72, train_loss: 0.8458, test_loss: 0.9933, test_f1: 0.5233
 epoch: 73, train_loss: 0.8513, test_loss: 0.9973, test_f1: 0.5190
 epoch: 74, train_loss: 0.8496, test_loss: 1.0022, test_f1: 0.5271
 epoch: 75, train_loss: 0.8488, test_loss: 1.0074, test_f1: 0.5345
 epoch: 76, train_loss: 0.8465, test_loss: 1.0057, test_f1: 0.5229
 epoch: 77, train_loss: 0.8590, test_loss: 1.0169, test_f1: 0.5155
 epoch: 78, train_loss: 0.8573, test_loss: 1.0105, test_f1: 0.5226
 epoch: 79, train_loss: 0.8371, test_loss: 1.0173, test_f1: 0.5205
 epoch: 80, train_loss: 0.8421, test_loss: 1.0164, test_f1: 0.5359
 epoch: 81, train_loss: 0.8538, test_loss: 1.0224, test_f1: 0.5058
 epoch: 82, train_loss: 0.8453, test_loss: 1.0123, test_f1: 0.5253
 epoch: 83, train_loss: 0.8389, test_loss: 1.0128, test_f1: 0.5073
 epoch: 84, train_loss: 0.8452, test_loss: 1.0091, test_f1: 0.5045
 epoch: 85, train_loss: 0.8449, test_loss: 1.0084, test_f1: 0.5131
 epoch: 86, train_loss: 0.8356, test_loss: 1.0069, test_f1: 0.5213
 epoch: 87, train_loss: 0.8260, test_loss: 1.0124, test_f1: 0.5304
 epoch: 88, train_loss: 0.8458, test_loss: 1.0259, test_f1: 0.5175
 epoch: 89, train_loss: 0.8394, test_loss: 1.0201, test_f1: 0.5220
 epoch: 90, train_loss: 0.8213, test_loss: 1.0179, test_f1: 0.5184
 epoch: 91, train_loss: 0.8240, test_loss: 1.0084, test_f1: 0.5251
 epoch: 92, train_loss: 0.8330, test_loss: 1.0237, test_f1: 0.5265
 epoch: 93, train_loss: 0.8368, test_loss: 1.0163, test_f1: 0.5352
 epoch: 94, train_loss: 0.8276, test_loss: 1.0244, test_f1: 0.5349
 epoch: 95, train_loss: 0.8364, test_loss: 1.0201, test_f1: 0.5324
 epoch: 96, train_loss: 0.8229, test_loss: 1.0003, test_f1: 0.5425
 epoch: 97, train_loss: 0.8174, test_loss: 1.0072, test_f1: 0.5321
 epoch: 98, train_loss: 0.8287, test_loss: 0.9997, test_f1: 0.5133
 epoch: 99, train_loss: 0.8288, test_loss: 1.0205, test_f1: 0.5162
##################ITERATION #4 ****************************************
 epoch: 0, train_loss: 1.3290, test_loss: 1.3570, test_f1: 0.2404
 epoch: 1, train_loss: 1.2694, test_loss: 1.3897, test_f1: 0.2569
 epoch: 2, train_loss: 1.2427, test_loss: 1.3414, test_f1: 0.2737
 epoch: 3, train_loss: 1.2272, test_loss: 1.3086, test_f1: 0.2675
 epoch: 4, train_loss: 1.2121, test_loss: 1.2886, test_f1: 0.2770
 epoch: 5, train_loss: 1.1825, test_loss: 1.2893, test_f1: 0.2871
 epoch: 6, train_loss: 1.1773, test_loss: 1.2752, test_f1: 0.2938
 epoch: 7, train_loss: 1.1751, test_loss: 1.2587, test_f1: 0.3079
 epoch: 8, train_loss: 1.1569, test_loss: 1.2351, test_f1: 0.3564
 epoch: 9, train_loss: 1.1457, test_loss: 1.2227, test_f1: 0.3498
 epoch: 10, train_loss: 1.1239, test_loss: 1.2013, test_f1: 0.3594
 epoch: 11, train_loss: 1.1279, test_loss: 1.1922, test_f1: 0.3647
 epoch: 12, train_loss: 1.1011, test_loss: 1.1709, test_f1: 0.3614
 epoch: 13, train_loss: 1.0920, test_loss: 1.1581, test_f1: 0.3805
 epoch: 14, train_loss: 1.0789, test_loss: 1.1428, test_f1: 0.3855
 epoch: 15, train_loss: 1.0622, test_loss: 1.1262, test_f1: 0.3744
 epoch: 16, train_loss: 1.0542, test_loss: 1.1003, test_f1: 0.3912
 epoch: 17, train_loss: 1.0475, test_loss: 1.0962, test_f1: 0.3911
 epoch: 18, train_loss: 1.0261, test_loss: 1.0868, test_f1: 0.4051
 epoch: 19, train_loss: 1.0194, test_loss: 1.0681, test_f1: 0.4661
 epoch: 20, train_loss: 1.0281, test_loss: 1.0688, test_f1: 0.4735
 epoch: 21, train_loss: 1.0167, test_loss: 1.0516, test_f1: 0.4494
 epoch: 22, train_loss: 0.9952, test_loss: 1.1116, test_f1: 0.3630
 epoch: 23, train_loss: 0.9976, test_loss: 1.0425, test_f1: 0.4690
 epoch: 24, train_loss: 0.9919, test_loss: 1.0432, test_f1: 0.4681
 epoch: 25, train_loss: 0.9779, test_loss: 1.0195, test_f1: 0.4798
 epoch: 26, train_loss: 0.9735, test_loss: 1.0088, test_f1: 0.4925
 epoch: 27, train_loss: 0.9637, test_loss: 0.9995, test_f1: 0.5103
 epoch: 28, train_loss: 0.9590, test_loss: 0.9949, test_f1: 0.5084
 epoch: 29, train_loss: 0.9539, test_loss: 1.0015, test_f1: 0.4812
 epoch: 30, train_loss: 0.9365, test_loss: 1.0007, test_f1: 0.4866
 epoch: 31, train_loss: 0.9395, test_loss: 0.9867, test_f1: 0.5161
 epoch: 32, train_loss: 0.9452, test_loss: 1.0026, test_f1: 0.5002
 epoch: 33, train_loss: 0.9390, test_loss: 0.9945, test_f1: 0.5035
 epoch: 34, train_loss: 0.9242, test_loss: 0.9767, test_f1: 0.4966
 epoch: 35, train_loss: 0.9361, test_loss: 0.9738, test_f1: 0.4924
 epoch: 36, train_loss: 0.9172, test_loss: 0.9944, test_f1: 0.5312
 epoch: 37, train_loss: 0.9154, test_loss: 0.9702, test_f1: 0.5261
 epoch: 38, train_loss: 0.9179, test_loss: 0.9569, test_f1: 0.5381
 epoch: 39, train_loss: 0.9129, test_loss: 0.9606, test_f1: 0.5401
 epoch: 40, train_loss: 0.9031, test_loss: 0.9831, test_f1: 0.5449
 epoch: 41, train_loss: 0.9116, test_loss: 0.9628, test_f1: 0.5301
 epoch: 42, train_loss: 0.9027, test_loss: 0.9550, test_f1: 0.5477
 epoch: 43, train_loss: 0.8860, test_loss: 0.9595, test_f1: 0.5352
 epoch: 44, train_loss: 0.9019, test_loss: 0.9464, test_f1: 0.5472
 epoch: 45, train_loss: 0.8979, test_loss: 0.9455, test_f1: 0.5721
 epoch: 46, train_loss: 0.8930, test_loss: 0.9607, test_f1: 0.5512
 epoch: 47, train_loss: 0.8829, test_loss: 0.9373, test_f1: 0.5685
 epoch: 48, train_loss: 0.8761, test_loss: 0.9384, test_f1: 0.5708
 epoch: 49, train_loss: 0.8820, test_loss: 0.9465, test_f1: 0.5831
 epoch: 50, train_loss: 0.8780, test_loss: 0.9304, test_f1: 0.5852
 epoch: 51, train_loss: 0.8744, test_loss: 0.9305, test_f1: 0.5737
 epoch: 52, train_loss: 0.8690, test_loss: 0.9300, test_f1: 0.5771
 epoch: 53, train_loss: 0.8573, test_loss: 0.9379, test_f1: 0.5823
 epoch: 54, train_loss: 0.8641, test_loss: 0.9360, test_f1: 0.5822
 epoch: 55, train_loss: 0.8622, test_loss: 0.9314, test_f1: 0.5907
 epoch: 56, train_loss: 0.8668, test_loss: 0.9295, test_f1: 0.6011
 epoch: 57, train_loss: 0.8653, test_loss: 0.9390, test_f1: 0.5667
 epoch: 58, train_loss: 0.8671, test_loss: 0.9418, test_f1: 0.5896
 epoch: 59, train_loss: 0.8513, test_loss: 0.9380, test_f1: 0.5924
 epoch: 60, train_loss: 0.8513, test_loss: 0.9297, test_f1: 0.5755
 epoch: 61, train_loss: 0.8577, test_loss: 0.9534, test_f1: 0.5780
 epoch: 62, train_loss: 0.8542, test_loss: 0.9354, test_f1: 0.5854
 epoch: 63, train_loss: 0.8513, test_loss: 0.9236, test_f1: 0.5853
 epoch: 64, train_loss: 0.8484, test_loss: 0.9357, test_f1: 0.6082
 epoch: 65, train_loss: 0.8444, test_loss: 0.9250, test_f1: 0.5952
 epoch: 66, train_loss: 0.8492, test_loss: 0.9368, test_f1: 0.5875
 epoch: 67, train_loss: 0.8457, test_loss: 0.9429, test_f1: 0.5879
 epoch: 68, train_loss: 0.8509, test_loss: 0.9248, test_f1: 0.5833
 epoch: 69, train_loss: 0.8409, test_loss: 0.9261, test_f1: 0.6151
 epoch: 70, train_loss: 0.8455, test_loss: 0.9261, test_f1: 0.5997
 epoch: 71, train_loss: 0.8434, test_loss: 0.9344, test_f1: 0.5872
 epoch: 72, train_loss: 0.8301, test_loss: 0.9249, test_f1: 0.5995
 epoch: 73, train_loss: 0.8326, test_loss: 0.9401, test_f1: 0.5790
 epoch: 74, train_loss: 0.8293, test_loss: 0.9266, test_f1: 0.5907
 epoch: 75, train_loss: 0.8355, test_loss: 0.9444, test_f1: 0.6038
 epoch: 76, train_loss: 0.8546, test_loss: 0.9247, test_f1: 0.6098
 epoch: 77, train_loss: 0.8342, test_loss: 0.9227, test_f1: 0.6055
 epoch: 78, train_loss: 0.8325, test_loss: 0.9172, test_f1: 0.5886
 epoch: 79, train_loss: 0.8275, test_loss: 0.9238, test_f1: 0.6002
 epoch: 80, train_loss: 0.8166, test_loss: 0.9212, test_f1: 0.5980
 epoch: 81, train_loss: 0.8262, test_loss: 0.9360, test_f1: 0.5984
 epoch: 82, train_loss: 0.8276, test_loss: 0.9246, test_f1: 0.6006
 epoch: 83, train_loss: 0.8357, test_loss: 0.9159, test_f1: 0.6016
 epoch: 84, train_loss: 0.8195, test_loss: 0.9350, test_f1: 0.6007
 epoch: 85, train_loss: 0.8141, test_loss: 0.9228, test_f1: 0.6015
 epoch: 86, train_loss: 0.8273, test_loss: 0.9330, test_f1: 0.6040
 epoch: 87, train_loss: 0.8102, test_loss: 0.9351, test_f1: 0.6145
 epoch: 88, train_loss: 0.8043, test_loss: 0.9243, test_f1: 0.6003
 epoch: 89, train_loss: 0.8212, test_loss: 0.9340, test_f1: 0.5846
 epoch: 90, train_loss: 0.8002, test_loss: 0.9276, test_f1: 0.6132
 epoch: 91, train_loss: 0.8113, test_loss: 0.9260, test_f1: 0.6120
 epoch: 92, train_loss: 0.7971, test_loss: 0.9260, test_f1: 0.6125
 epoch: 93, train_loss: 0.8098, test_loss: 0.9289, test_f1: 0.6103
 epoch: 94, train_loss: 0.7950, test_loss: 0.9311, test_f1: 0.6232
 epoch: 95, train_loss: 0.8029, test_loss: 0.9434, test_f1: 0.6033
 epoch: 96, train_loss: 0.7922, test_loss: 0.9589, test_f1: 0.6020
 epoch: 97, train_loss: 0.7982, test_loss: 0.9454, test_f1: 0.6043
 epoch: 98, train_loss: 0.8081, test_loss: 0.9555, test_f1: 0.5951
 epoch: 99, train_loss: 0.7995, test_loss: 0.9341, test_f1: 0.6098
##################ITERATION #5 ****************************************
 epoch: 0, train_loss: 1.3178, test_loss: 1.3365, test_f1: 0.2717
 epoch: 1, train_loss: 1.2739, test_loss: 1.3055, test_f1: 0.2874
 epoch: 2, train_loss: 1.2572, test_loss: 1.2938, test_f1: 0.2850
 epoch: 3, train_loss: 1.2351, test_loss: 1.2892, test_f1: 0.2718
 epoch: 4, train_loss: 1.2236, test_loss: 1.2802, test_f1: 0.2893
 epoch: 5, train_loss: 1.2027, test_loss: 1.2713, test_f1: 0.2926
 epoch: 6, train_loss: 1.1886, test_loss: 1.2567, test_f1: 0.2944
 epoch: 7, train_loss: 1.1788, test_loss: 1.2457, test_f1: 0.2976
 epoch: 8, train_loss: 1.1655, test_loss: 1.2307, test_f1: 0.2959
 epoch: 9, train_loss: 1.1575, test_loss: 1.2098, test_f1: 0.3014
 epoch: 10, train_loss: 1.1386, test_loss: 1.2107, test_f1: 0.3354
 epoch: 11, train_loss: 1.1255, test_loss: 1.2362, test_f1: 0.3385
 epoch: 12, train_loss: 1.1265, test_loss: 1.2034, test_f1: 0.3980
 epoch: 13, train_loss: 1.1071, test_loss: 1.1973, test_f1: 0.4101
 epoch: 14, train_loss: 1.1084, test_loss: 1.1749, test_f1: 0.4328
 epoch: 15, train_loss: 1.0978, test_loss: 1.1651, test_f1: 0.4342
 epoch: 16, train_loss: 1.0792, test_loss: 1.1752, test_f1: 0.4552
 epoch: 17, train_loss: 1.0724, test_loss: 1.1525, test_f1: 0.4470
 epoch: 18, train_loss: 1.0613, test_loss: 1.1470, test_f1: 0.4445
 epoch: 19, train_loss: 1.0460, test_loss: 1.1249, test_f1: 0.4653
 epoch: 20, train_loss: 1.0462, test_loss: 1.1334, test_f1: 0.4564
 epoch: 21, train_loss: 1.0298, test_loss: 1.1094, test_f1: 0.4731
 epoch: 22, train_loss: 1.0269, test_loss: 1.1214, test_f1: 0.5139
 epoch: 23, train_loss: 1.0244, test_loss: 1.0997, test_f1: 0.5068
 epoch: 24, train_loss: 0.9945, test_loss: 1.1136, test_f1: 0.5141
 epoch: 25, train_loss: 1.0068, test_loss: 1.1088, test_f1: 0.5149
 epoch: 26, train_loss: 1.0021, test_loss: 1.0886, test_f1: 0.4956
 epoch: 27, train_loss: 0.9809, test_loss: 1.0893, test_f1: 0.5136
 epoch: 28, train_loss: 0.9788, test_loss: 1.0780, test_f1: 0.5044
 epoch: 29, train_loss: 0.9845, test_loss: 1.0689, test_f1: 0.5113
 epoch: 30, train_loss: 0.9557, test_loss: 1.0840, test_f1: 0.5049
 epoch: 31, train_loss: 0.9637, test_loss: 1.0616, test_f1: 0.5138
 epoch: 32, train_loss: 0.9526, test_loss: 1.0475, test_f1: 0.5285
 epoch: 33, train_loss: 0.9394, test_loss: 1.0481, test_f1: 0.5365
 epoch: 34, train_loss: 0.9498, test_loss: 1.0359, test_f1: 0.5385
 epoch: 35, train_loss: 0.9442, test_loss: 1.0402, test_f1: 0.5361
 epoch: 36, train_loss: 0.9344, test_loss: 1.0343, test_f1: 0.5251
 epoch: 37, train_loss: 0.9279, test_loss: 1.0458, test_f1: 0.5081
 epoch: 38, train_loss: 0.9242, test_loss: 1.0407, test_f1: 0.5211
 epoch: 39, train_loss: 0.9308, test_loss: 1.0349, test_f1: 0.5228
 epoch: 40, train_loss: 0.9199, test_loss: 1.0294, test_f1: 0.5215
 epoch: 41, train_loss: 0.9276, test_loss: 1.0189, test_f1: 0.5292
 epoch: 42, train_loss: 0.8981, test_loss: 1.0201, test_f1: 0.5397
 epoch: 43, train_loss: 0.9063, test_loss: 1.0202, test_f1: 0.5474
 epoch: 44, train_loss: 0.9092, test_loss: 1.0288, test_f1: 0.5357
 epoch: 45, train_loss: 0.9085, test_loss: 1.0110, test_f1: 0.5389
 epoch: 46, train_loss: 0.8910, test_loss: 1.0152, test_f1: 0.5362
 epoch: 47, train_loss: 0.9086, test_loss: 1.0205, test_f1: 0.5362
 epoch: 48, train_loss: 0.8905, test_loss: 1.0251, test_f1: 0.5286
 epoch: 49, train_loss: 0.8957, test_loss: 1.0308, test_f1: 0.5440
 epoch: 50, train_loss: 0.8768, test_loss: 1.0286, test_f1: 0.5706
 epoch: 51, train_loss: 0.8723, test_loss: 1.0210, test_f1: 0.5373
 epoch: 52, train_loss: 0.8833, test_loss: 1.0061, test_f1: 0.5442
 epoch: 53, train_loss: 0.8734, test_loss: 1.0189, test_f1: 0.5503
 epoch: 54, train_loss: 0.8737, test_loss: 1.0174, test_f1: 0.5597
 epoch: 55, train_loss: 0.8720, test_loss: 1.0129, test_f1: 0.5407
 epoch: 56, train_loss: 0.8730, test_loss: 1.0240, test_f1: 0.5555
 epoch: 57, train_loss: 0.8704, test_loss: 1.0156, test_f1: 0.5473
 epoch: 58, train_loss: 0.8647, test_loss: 1.0066, test_f1: 0.5684
 epoch: 59, train_loss: 0.8548, test_loss: 1.0137, test_f1: 0.5719
 epoch: 60, train_loss: 0.8604, test_loss: 1.0173, test_f1: 0.5442
 epoch: 61, train_loss: 0.8600, test_loss: 1.0122, test_f1: 0.5559
 epoch: 62, train_loss: 0.8594, test_loss: 1.0213, test_f1: 0.5581
 epoch: 63, train_loss: 0.8666, test_loss: 1.0123, test_f1: 0.5469
 epoch: 64, train_loss: 0.8571, test_loss: 0.9966, test_f1: 0.5704
 epoch: 65, train_loss: 0.8541, test_loss: 0.9989, test_f1: 0.5706
 epoch: 66, train_loss: 0.8456, test_loss: 1.0052, test_f1: 0.5793
 epoch: 67, train_loss: 0.8569, test_loss: 0.9966, test_f1: 0.5535
 epoch: 68, train_loss: 0.8458, test_loss: 1.0154, test_f1: 0.5548
 epoch: 69, train_loss: 0.8462, test_loss: 1.0031, test_f1: 0.5756
 epoch: 70, train_loss: 0.8368, test_loss: 1.0040, test_f1: 0.5551
 epoch: 71, train_loss: 0.8591, test_loss: 1.0097, test_f1: 0.5460
 epoch: 72, train_loss: 0.8290, test_loss: 1.0186, test_f1: 0.5532
 epoch: 73, train_loss: 0.8395, test_loss: 0.9977, test_f1: 0.5642
 epoch: 74, train_loss: 0.8454, test_loss: 0.9882, test_f1: 0.5667
 epoch: 75, train_loss: 0.8494, test_loss: 1.0086, test_f1: 0.5763
 epoch: 76, train_loss: 0.8389, test_loss: 1.0009, test_f1: 0.5669
 epoch: 77, train_loss: 0.8360, test_loss: 0.9990, test_f1: 0.5435
 epoch: 78, train_loss: 0.8321, test_loss: 0.9995, test_f1: 0.5682
 epoch: 79, train_loss: 0.8278, test_loss: 1.0067, test_f1: 0.5682
 epoch: 80, train_loss: 0.8459, test_loss: 1.0013, test_f1: 0.5740
 epoch: 81, train_loss: 0.8346, test_loss: 0.9759, test_f1: 0.5776
 epoch: 82, train_loss: 0.8391, test_loss: 1.0051, test_f1: 0.5842
 epoch: 83, train_loss: 0.8419, test_loss: 0.9995, test_f1: 0.5769
 epoch: 84, train_loss: 0.8227, test_loss: 0.9908, test_f1: 0.5804
 epoch: 85, train_loss: 0.8181, test_loss: 0.9929, test_f1: 0.5802
 epoch: 86, train_loss: 0.8269, test_loss: 1.0062, test_f1: 0.5725
 epoch: 87, train_loss: 0.8152, test_loss: 1.0162, test_f1: 0.5606
 epoch: 88, train_loss: 0.8160, test_loss: 1.0150, test_f1: 0.5532
 epoch: 89, train_loss: 0.8181, test_loss: 1.0078, test_f1: 0.5811
 epoch: 90, train_loss: 0.8239, test_loss: 0.9951, test_f1: 0.5852
 epoch: 91, train_loss: 0.8249, test_loss: 1.0396, test_f1: 0.5784
 epoch: 92, train_loss: 0.8071, test_loss: 1.0043, test_f1: 0.5767
 epoch: 93, train_loss: 0.8181, test_loss: 0.9813, test_f1: 0.5869
 epoch: 94, train_loss: 0.8074, test_loss: 0.9939, test_f1: 0.5780
 epoch: 95, train_loss: 0.8270, test_loss: 1.0203, test_f1: 0.5541
 epoch: 96, train_loss: 0.8067, test_loss: 1.0092, test_f1: 0.5938
 epoch: 97, train_loss: 0.8084, test_loss: 1.0028, test_f1: 0.5897
 epoch: 98, train_loss: 0.8008, test_loss: 0.9862, test_f1: 0.5902
 epoch: 99, train_loss: 0.8191, test_loss: 0.9904, test_f1: 0.5937
##################ITERATION #6 ****************************************
 epoch: 0, train_loss: 1.3172, test_loss: 1.3210, test_f1: 0.2461
 epoch: 1, train_loss: 1.2295, test_loss: 1.2886, test_f1: 0.2586
 epoch: 2, train_loss: 1.2009, test_loss: 1.2619, test_f1: 0.3146
 epoch: 3, train_loss: 1.1834, test_loss: 1.2402, test_f1: 0.3338
 epoch: 4, train_loss: 1.1581, test_loss: 1.2075, test_f1: 0.3648
 epoch: 5, train_loss: 1.1250, test_loss: 1.2095, test_f1: 0.3609
 epoch: 6, train_loss: 1.1313, test_loss: 1.1667, test_f1: 0.3673
 epoch: 7, train_loss: 1.1119, test_loss: 1.1708, test_f1: 0.3746
 epoch: 8, train_loss: 1.0867, test_loss: 1.1553, test_f1: 0.3899
 epoch: 9, train_loss: 1.0850, test_loss: 1.1373, test_f1: 0.4177
 epoch: 10, train_loss: 1.0780, test_loss: 1.1209, test_f1: 0.4219
 epoch: 11, train_loss: 1.0654, test_loss: 1.1119, test_f1: 0.4233
 epoch: 12, train_loss: 1.0617, test_loss: 1.0998, test_f1: 0.4328
 epoch: 13, train_loss: 1.0476, test_loss: 1.0929, test_f1: 0.4248
 epoch: 14, train_loss: 1.0357, test_loss: 1.0890, test_f1: 0.4284
 epoch: 15, train_loss: 1.0352, test_loss: 1.0911, test_f1: 0.4382
 epoch: 16, train_loss: 1.0284, test_loss: 1.0763, test_f1: 0.4464
 epoch: 17, train_loss: 1.0181, test_loss: 1.0928, test_f1: 0.4526
 epoch: 18, train_loss: 1.0205, test_loss: 1.0941, test_f1: 0.4392
 epoch: 19, train_loss: 1.0115, test_loss: 1.0855, test_f1: 0.4475
 epoch: 20, train_loss: 1.0000, test_loss: 1.0860, test_f1: 0.4602
 epoch: 21, train_loss: 0.9938, test_loss: 1.0728, test_f1: 0.4720
 epoch: 22, train_loss: 0.9993, test_loss: 1.0682, test_f1: 0.4675
 epoch: 23, train_loss: 0.9962, test_loss: 1.0806, test_f1: 0.4541
 epoch: 24, train_loss: 0.9764, test_loss: 1.0744, test_f1: 0.4496
 epoch: 25, train_loss: 0.9798, test_loss: 1.0727, test_f1: 0.4506
 epoch: 26, train_loss: 0.9782, test_loss: 1.0618, test_f1: 0.4507
 epoch: 27, train_loss: 0.9768, test_loss: 1.0824, test_f1: 0.4510
 epoch: 28, train_loss: 0.9704, test_loss: 1.0702, test_f1: 0.4510
 epoch: 29, train_loss: 0.9693, test_loss: 1.0583, test_f1: 0.4752
 epoch: 30, train_loss: 0.9602, test_loss: 1.0906, test_f1: 0.4582
 epoch: 31, train_loss: 0.9590, test_loss: 1.1007, test_f1: 0.4582
 epoch: 32, train_loss: 0.9530, test_loss: 1.0290, test_f1: 0.4920
 epoch: 33, train_loss: 0.9474, test_loss: 1.0861, test_f1: 0.4651
 epoch: 34, train_loss: 0.9457, test_loss: 1.0664, test_f1: 0.4752
 epoch: 35, train_loss: 0.9388, test_loss: 1.0652, test_f1: 0.4930
 epoch: 36, train_loss: 0.9277, test_loss: 1.0360, test_f1: 0.4776
 epoch: 37, train_loss: 0.9371, test_loss: 1.0889, test_f1: 0.4596
 epoch: 38, train_loss: 0.9352, test_loss: 1.0608, test_f1: 0.4950
 epoch: 39, train_loss: 0.9331, test_loss: 1.0403, test_f1: 0.4739
 epoch: 40, train_loss: 0.9392, test_loss: 1.1269, test_f1: 0.4984
 epoch: 41, train_loss: 0.9331, test_loss: 1.0802, test_f1: 0.5085
 epoch: 42, train_loss: 0.9303, test_loss: 1.0950, test_f1: 0.4831
 epoch: 43, train_loss: 0.9255, test_loss: 1.0950, test_f1: 0.4957
 epoch: 44, train_loss: 0.9232, test_loss: 1.0341, test_f1: 0.4942
 epoch: 45, train_loss: 0.9142, test_loss: 1.1033, test_f1: 0.4997
 epoch: 46, train_loss: 0.9117, test_loss: 1.1032, test_f1: 0.4975
 epoch: 47, train_loss: 0.9074, test_loss: 1.0498, test_f1: 0.5063
 epoch: 48, train_loss: 0.8936, test_loss: 1.1061, test_f1: 0.4914
 epoch: 49, train_loss: 0.8933, test_loss: 1.0886, test_f1: 0.4892
 epoch: 50, train_loss: 0.8911, test_loss: 1.1325, test_f1: 0.4815
 epoch: 51, train_loss: 0.9029, test_loss: 1.0932, test_f1: 0.4944
 epoch: 52, train_loss: 0.8985, test_loss: 1.1097, test_f1: 0.4860
 epoch: 53, train_loss: 0.8939, test_loss: 1.1323, test_f1: 0.4798
 epoch: 54, train_loss: 0.8974, test_loss: 1.1923, test_f1: 0.5043
 epoch: 55, train_loss: 0.8804, test_loss: 1.2207, test_f1: 0.4835
 epoch: 56, train_loss: 0.8915, test_loss: 1.2246, test_f1: 0.4854
 epoch: 57, train_loss: 0.8896, test_loss: 1.1588, test_f1: 0.5033
 epoch: 58, train_loss: 0.8863, test_loss: 1.1963, test_f1: 0.5009
 epoch: 59, train_loss: 0.8883, test_loss: 1.1294, test_f1: 0.4964
 epoch: 60, train_loss: 0.8820, test_loss: 1.2170, test_f1: 0.5131
 epoch: 61, train_loss: 0.8729, test_loss: 1.1906, test_f1: 0.5038
 epoch: 62, train_loss: 0.8781, test_loss: 1.1163, test_f1: 0.4962
 epoch: 63, train_loss: 0.8734, test_loss: 1.1867, test_f1: 0.5237
 epoch: 64, train_loss: 0.8688, test_loss: 1.1895, test_f1: 0.5033
 epoch: 65, train_loss: 0.8778, test_loss: 1.1217, test_f1: 0.5002
 epoch: 66, train_loss: 0.8766, test_loss: 1.1044, test_f1: 0.4850
 epoch: 67, train_loss: 0.8792, test_loss: 1.2016, test_f1: 0.5032
 epoch: 68, train_loss: 0.8731, test_loss: 1.1557, test_f1: 0.5301
 epoch: 69, train_loss: 0.8682, test_loss: 1.0746, test_f1: 0.4927
 epoch: 70, train_loss: 0.8657, test_loss: 1.2301, test_f1: 0.5153
 epoch: 71, train_loss: 0.8625, test_loss: 1.1995, test_f1: 0.5334
 epoch: 72, train_loss: 0.8711, test_loss: 1.1002, test_f1: 0.5218
 epoch: 73, train_loss: 0.8729, test_loss: 1.1725, test_f1: 0.5034
 epoch: 74, train_loss: 0.8671, test_loss: 1.1702, test_f1: 0.5274
 epoch: 75, train_loss: 0.8646, test_loss: 1.1500, test_f1: 0.5080
 epoch: 76, train_loss: 0.8454, test_loss: 1.0729, test_f1: 0.5011
 epoch: 77, train_loss: 0.8461, test_loss: 1.2423, test_f1: 0.5408
 epoch: 78, train_loss: 0.8595, test_loss: 1.1212, test_f1: 0.5259
 epoch: 79, train_loss: 0.8637, test_loss: 1.1666, test_f1: 0.5243
 epoch: 80, train_loss: 0.8593, test_loss: 1.2552, test_f1: 0.5199
 epoch: 81, train_loss: 0.8427, test_loss: 1.2272, test_f1: 0.5241
 epoch: 82, train_loss: 0.8614, test_loss: 1.1703, test_f1: 0.5070
 epoch: 83, train_loss: 0.8497, test_loss: 1.1002, test_f1: 0.5130
 epoch: 84, train_loss: 0.8352, test_loss: 1.1069, test_f1: 0.5198
 epoch: 85, train_loss: 0.8476, test_loss: 1.1674, test_f1: 0.5432
 epoch: 86, train_loss: 0.8505, test_loss: 1.2031, test_f1: 0.5418
 epoch: 87, train_loss: 0.8544, test_loss: 1.3199, test_f1: 0.5130
 epoch: 88, train_loss: 0.8404, test_loss: 1.0369, test_f1: 0.5285
 epoch: 89, train_loss: 0.8324, test_loss: 1.1720, test_f1: 0.5272
 epoch: 90, train_loss: 0.8506, test_loss: 1.1381, test_f1: 0.5218
 epoch: 91, train_loss: 0.8341, test_loss: 1.2253, test_f1: 0.5365
 epoch: 92, train_loss: 0.8478, test_loss: 1.1345, test_f1: 0.5356
 epoch: 93, train_loss: 0.8349, test_loss: 1.1968, test_f1: 0.5448
 epoch: 94, train_loss: 0.8354, test_loss: 1.1669, test_f1: 0.5398
 epoch: 95, train_loss: 0.8315, test_loss: 1.1162, test_f1: 0.5432
 epoch: 96, train_loss: 0.8330, test_loss: 1.2310, test_f1: 0.5384
 epoch: 97, train_loss: 0.8238, test_loss: 1.2558, test_f1: 0.5513
 epoch: 98, train_loss: 0.8288, test_loss: 1.2336, test_f1: 0.5345
 epoch: 99, train_loss: 0.8231, test_loss: 1.2140, test_f1: 0.5388
##################ITERATION #7 ****************************************
 epoch: 0, train_loss: 1.3257, test_loss: 1.3725, test_f1: 0.2521
 epoch: 1, train_loss: 1.2483, test_loss: 1.3005, test_f1: 0.2667
 epoch: 2, train_loss: 1.2146, test_loss: 1.2769, test_f1: 0.2950
 epoch: 3, train_loss: 1.1812, test_loss: 1.2472, test_f1: 0.3257
 epoch: 4, train_loss: 1.1779, test_loss: 1.2313, test_f1: 0.3550
 epoch: 5, train_loss: 1.1611, test_loss: 1.2135, test_f1: 0.3137
 epoch: 6, train_loss: 1.1311, test_loss: 1.1999, test_f1: 0.3521
 epoch: 7, train_loss: 1.1189, test_loss: 1.1872, test_f1: 0.3725
 epoch: 8, train_loss: 1.1178, test_loss: 1.1813, test_f1: 0.3375
 epoch: 9, train_loss: 1.1012, test_loss: 1.1785, test_f1: 0.3783
 epoch: 10, train_loss: 1.0916, test_loss: 1.1703, test_f1: 0.3756
 epoch: 11, train_loss: 1.0735, test_loss: 1.1532, test_f1: 0.3709
 epoch: 12, train_loss: 1.0668, test_loss: 1.1546, test_f1: 0.3766
 epoch: 13, train_loss: 1.0490, test_loss: 1.1421, test_f1: 0.4035
 epoch: 14, train_loss: 1.0546, test_loss: 1.1230, test_f1: 0.3904
 epoch: 15, train_loss: 1.0304, test_loss: 1.1176, test_f1: 0.4087
 epoch: 16, train_loss: 1.0318, test_loss: 1.1099, test_f1: 0.3987
 epoch: 17, train_loss: 1.0113, test_loss: 1.1053, test_f1: 0.4003
 epoch: 18, train_loss: 1.0235, test_loss: 1.0862, test_f1: 0.4569
 epoch: 19, train_loss: 1.0097, test_loss: 1.0915, test_f1: 0.4408
 epoch: 20, train_loss: 0.9982, test_loss: 1.0783, test_f1: 0.4483
 epoch: 21, train_loss: 0.9901, test_loss: 1.0673, test_f1: 0.4622
 epoch: 22, train_loss: 0.9924, test_loss: 1.0596, test_f1: 0.4824
 epoch: 23, train_loss: 0.9848, test_loss: 1.0508, test_f1: 0.4872
 epoch: 24, train_loss: 0.9769, test_loss: 1.0508, test_f1: 0.4803
 epoch: 25, train_loss: 0.9693, test_loss: 1.0407, test_f1: 0.4888
 epoch: 26, train_loss: 0.9645, test_loss: 1.0491, test_f1: 0.4893
 epoch: 27, train_loss: 0.9655, test_loss: 1.0471, test_f1: 0.5053
 epoch: 28, train_loss: 0.9486, test_loss: 1.0277, test_f1: 0.5188
 epoch: 29, train_loss: 0.9515, test_loss: 1.0287, test_f1: 0.5207
 epoch: 30, train_loss: 0.9451, test_loss: 1.0304, test_f1: 0.5178
 epoch: 31, train_loss: 0.9309, test_loss: 1.0377, test_f1: 0.5350
 epoch: 32, train_loss: 0.9374, test_loss: 1.0260, test_f1: 0.5215
 epoch: 33, train_loss: 0.9281, test_loss: 1.0275, test_f1: 0.5235
 epoch: 34, train_loss: 0.9337, test_loss: 1.0199, test_f1: 0.5223
 epoch: 35, train_loss: 0.9190, test_loss: 1.0123, test_f1: 0.5226
 epoch: 36, train_loss: 0.9144, test_loss: 1.0287, test_f1: 0.5199
 epoch: 37, train_loss: 0.9082, test_loss: 1.0095, test_f1: 0.5317
 epoch: 38, train_loss: 0.9067, test_loss: 1.0154, test_f1: 0.5316
 epoch: 39, train_loss: 0.9044, test_loss: 1.0071, test_f1: 0.5328
 epoch: 40, train_loss: 0.8962, test_loss: 0.9957, test_f1: 0.5182
 epoch: 41, train_loss: 0.9025, test_loss: 1.0019, test_f1: 0.5192
 epoch: 42, train_loss: 0.8931, test_loss: 1.0009, test_f1: 0.5305
 epoch: 43, train_loss: 0.8917, test_loss: 0.9954, test_f1: 0.5381
 epoch: 44, train_loss: 0.8914, test_loss: 1.0167, test_f1: 0.5260
 epoch: 45, train_loss: 0.8877, test_loss: 1.0119, test_f1: 0.5393
 epoch: 46, train_loss: 0.8855, test_loss: 1.0075, test_f1: 0.5318
 epoch: 47, train_loss: 0.8707, test_loss: 0.9973, test_f1: 0.5479
 epoch: 48, train_loss: 0.8614, test_loss: 1.0291, test_f1: 0.5327
 epoch: 49, train_loss: 0.8543, test_loss: 1.0046, test_f1: 0.5418
 epoch: 50, train_loss: 0.8586, test_loss: 0.9926, test_f1: 0.5501
 epoch: 51, train_loss: 0.8513, test_loss: 1.0017, test_f1: 0.5290
 epoch: 52, train_loss: 0.8635, test_loss: 0.9933, test_f1: 0.5398
 epoch: 53, train_loss: 0.8637, test_loss: 1.0025, test_f1: 0.5335
 epoch: 54, train_loss: 0.8612, test_loss: 0.9936, test_f1: 0.5371
 epoch: 55, train_loss: 0.8563, test_loss: 0.9937, test_f1: 0.5376
 epoch: 56, train_loss: 0.8419, test_loss: 1.0050, test_f1: 0.5433
 epoch: 57, train_loss: 0.8453, test_loss: 1.0194, test_f1: 0.5232
 epoch: 58, train_loss: 0.8628, test_loss: 1.0264, test_f1: 0.5096
 epoch: 59, train_loss: 0.8340, test_loss: 0.9979, test_f1: 0.5353
 epoch: 60, train_loss: 0.8399, test_loss: 1.0064, test_f1: 0.5337
 epoch: 61, train_loss: 0.8523, test_loss: 1.0118, test_f1: 0.5119
 epoch: 62, train_loss: 0.8461, test_loss: 0.9779, test_f1: 0.5490
 epoch: 63, train_loss: 0.8401, test_loss: 0.9782, test_f1: 0.5479
 epoch: 64, train_loss: 0.8384, test_loss: 0.9984, test_f1: 0.5427
 epoch: 65, train_loss: 0.8482, test_loss: 1.0001, test_f1: 0.5481
 epoch: 66, train_loss: 0.8425, test_loss: 0.9971, test_f1: 0.5431
 epoch: 67, train_loss: 0.8349, test_loss: 1.0137, test_f1: 0.5383
 epoch: 68, train_loss: 0.8373, test_loss: 1.0040, test_f1: 0.5414
 epoch: 69, train_loss: 0.8402, test_loss: 0.9922, test_f1: 0.5409
 epoch: 70, train_loss: 0.8293, test_loss: 1.0159, test_f1: 0.5401
 epoch: 71, train_loss: 0.8195, test_loss: 0.9889, test_f1: 0.5456
 epoch: 72, train_loss: 0.8207, test_loss: 1.0249, test_f1: 0.5387
 epoch: 73, train_loss: 0.8131, test_loss: 1.0114, test_f1: 0.5358
 epoch: 74, train_loss: 0.8188, test_loss: 1.0103, test_f1: 0.5406
 epoch: 75, train_loss: 0.8228, test_loss: 1.0144, test_f1: 0.5382
 epoch: 76, train_loss: 0.8300, test_loss: 0.9994, test_f1: 0.5574
 epoch: 77, train_loss: 0.8131, test_loss: 1.0120, test_f1: 0.5540
 epoch: 78, train_loss: 0.8186, test_loss: 1.0016, test_f1: 0.5398
 epoch: 79, train_loss: 0.7999, test_loss: 1.0031, test_f1: 0.5487
 epoch: 80, train_loss: 0.8067, test_loss: 1.0093, test_f1: 0.5572
 epoch: 81, train_loss: 0.8129, test_loss: 1.0026, test_f1: 0.5606
 epoch: 82, train_loss: 0.8090, test_loss: 0.9765, test_f1: 0.5709
 epoch: 83, train_loss: 0.8110, test_loss: 0.9946, test_f1: 0.5524
 epoch: 84, train_loss: 0.8247, test_loss: 0.9939, test_f1: 0.5541
 epoch: 85, train_loss: 0.7949, test_loss: 1.0016, test_f1: 0.5509
 epoch: 86, train_loss: 0.8008, test_loss: 0.9802, test_f1: 0.5652
 epoch: 87, train_loss: 0.8111, test_loss: 0.9915, test_f1: 0.5633
 epoch: 88, train_loss: 0.8157, test_loss: 0.9915, test_f1: 0.5594
 epoch: 89, train_loss: 0.8035, test_loss: 0.9882, test_f1: 0.5611
 epoch: 90, train_loss: 0.7901, test_loss: 0.9909, test_f1: 0.5613
 epoch: 91, train_loss: 0.7877, test_loss: 0.9953, test_f1: 0.5670
 epoch: 92, train_loss: 0.8070, test_loss: 0.9921, test_f1: 0.5501
 epoch: 93, train_loss: 0.7887, test_loss: 1.0160, test_f1: 0.5592
 epoch: 94, train_loss: 0.8006, test_loss: 0.9861, test_f1: 0.5555
 epoch: 95, train_loss: 0.8024, test_loss: 1.0065, test_f1: 0.5439
 epoch: 96, train_loss: 0.7855, test_loss: 0.9874, test_f1: 0.5682
 epoch: 97, train_loss: 0.7835, test_loss: 0.9910, test_f1: 0.5685
 epoch: 98, train_loss: 0.7988, test_loss: 0.9892, test_f1: 0.5562
 epoch: 99, train_loss: 0.7783, test_loss: 0.9861, test_f1: 0.5691
##################ITERATION #8 ****************************************
 epoch: 0, train_loss: 1.3492, test_loss: 1.3818, test_f1: 0.2567
 epoch: 1, train_loss: 1.2445, test_loss: 1.2960, test_f1: 0.2360
 epoch: 2, train_loss: 1.2180, test_loss: 1.2602, test_f1: 0.2539
 epoch: 3, train_loss: 1.1912, test_loss: 1.2453, test_f1: 0.2824
 epoch: 4, train_loss: 1.1864, test_loss: 1.2218, test_f1: 0.3131
 epoch: 5, train_loss: 1.1661, test_loss: 1.2161, test_f1: 0.3354
 epoch: 6, train_loss: 1.1459, test_loss: 1.2010, test_f1: 0.3706
 epoch: 7, train_loss: 1.1356, test_loss: 1.1873, test_f1: 0.3702
 epoch: 8, train_loss: 1.1073, test_loss: 1.1787, test_f1: 0.3860
 epoch: 9, train_loss: 1.1052, test_loss: 1.1667, test_f1: 0.4140
 epoch: 10, train_loss: 1.0906, test_loss: 1.1531, test_f1: 0.4166
 epoch: 11, train_loss: 1.0872, test_loss: 1.1519, test_f1: 0.3997
 epoch: 12, train_loss: 1.0822, test_loss: 1.1439, test_f1: 0.4376
 epoch: 13, train_loss: 1.0552, test_loss: 1.1383, test_f1: 0.4247
 epoch: 14, train_loss: 1.0406, test_loss: 1.1513, test_f1: 0.4489
 epoch: 15, train_loss: 1.0499, test_loss: 1.1376, test_f1: 0.4445
 epoch: 16, train_loss: 1.0441, test_loss: 1.1330, test_f1: 0.4457
 epoch: 17, train_loss: 1.0234, test_loss: 1.1163, test_f1: 0.4371
 epoch: 18, train_loss: 1.0156, test_loss: 1.1107, test_f1: 0.4476
 epoch: 19, train_loss: 1.0249, test_loss: 1.1135, test_f1: 0.4594
 epoch: 20, train_loss: 1.0033, test_loss: 1.1038, test_f1: 0.4861
 epoch: 21, train_loss: 0.9964, test_loss: 1.0775, test_f1: 0.4925
 epoch: 22, train_loss: 1.0017, test_loss: 1.1024, test_f1: 0.5038
 epoch: 23, train_loss: 1.0036, test_loss: 1.0855, test_f1: 0.5142
 epoch: 24, train_loss: 0.9846, test_loss: 1.0864, test_f1: 0.5181
 epoch: 25, train_loss: 0.9752, test_loss: 1.0954, test_f1: 0.5244
 epoch: 26, train_loss: 0.9864, test_loss: 1.0913, test_f1: 0.5061
 epoch: 27, train_loss: 0.9669, test_loss: 1.0884, test_f1: 0.5142
 epoch: 28, train_loss: 0.9612, test_loss: 1.0733, test_f1: 0.5240
 epoch: 29, train_loss: 0.9513, test_loss: 1.0820, test_f1: 0.5137
 epoch: 30, train_loss: 0.9535, test_loss: 1.0710, test_f1: 0.5224
 epoch: 31, train_loss: 0.9516, test_loss: 1.0686, test_f1: 0.5138
 epoch: 32, train_loss: 0.9403, test_loss: 1.0664, test_f1: 0.5132
 epoch: 33, train_loss: 0.9376, test_loss: 1.0479, test_f1: 0.5349
 epoch: 34, train_loss: 0.9322, test_loss: 1.0458, test_f1: 0.5364
 epoch: 35, train_loss: 0.9163, test_loss: 1.0458, test_f1: 0.5341
 epoch: 36, train_loss: 0.9256, test_loss: 1.0222, test_f1: 0.5454
 epoch: 37, train_loss: 0.9231, test_loss: 1.0549, test_f1: 0.5235
 epoch: 38, train_loss: 0.9047, test_loss: 1.0512, test_f1: 0.5472
 epoch: 39, train_loss: 0.9192, test_loss: 1.0314, test_f1: 0.5410
 epoch: 40, train_loss: 0.9016, test_loss: 1.0427, test_f1: 0.5453
 epoch: 41, train_loss: 0.8964, test_loss: 1.0153, test_f1: 0.5388
 epoch: 42, train_loss: 0.8939, test_loss: 1.0206, test_f1: 0.5352
 epoch: 43, train_loss: 0.8922, test_loss: 1.0315, test_f1: 0.5471
 epoch: 44, train_loss: 0.8836, test_loss: 1.0328, test_f1: 0.5379
 epoch: 45, train_loss: 0.8809, test_loss: 1.0300, test_f1: 0.5406
 epoch: 46, train_loss: 0.8730, test_loss: 1.0210, test_f1: 0.5623
 epoch: 47, train_loss: 0.8688, test_loss: 0.9987, test_f1: 0.5609
 epoch: 48, train_loss: 0.8846, test_loss: 1.0086, test_f1: 0.5453
 epoch: 49, train_loss: 0.8639, test_loss: 1.0279, test_f1: 0.5526
 epoch: 50, train_loss: 0.8628, test_loss: 1.0182, test_f1: 0.5460
 epoch: 51, train_loss: 0.8599, test_loss: 1.0154, test_f1: 0.5612
 epoch: 52, train_loss: 0.8539, test_loss: 1.0204, test_f1: 0.5489
 epoch: 53, train_loss: 0.8532, test_loss: 1.0154, test_f1: 0.5687
 epoch: 54, train_loss: 0.8405, test_loss: 1.0172, test_f1: 0.5582
 epoch: 55, train_loss: 0.8512, test_loss: 1.0231, test_f1: 0.5335
 epoch: 56, train_loss: 0.8459, test_loss: 1.0273, test_f1: 0.5507
 epoch: 57, train_loss: 0.8427, test_loss: 1.0087, test_f1: 0.5514
 epoch: 58, train_loss: 0.8415, test_loss: 1.0300, test_f1: 0.5605
 epoch: 59, train_loss: 0.8234, test_loss: 1.0271, test_f1: 0.5500
 epoch: 60, train_loss: 0.8326, test_loss: 1.0320, test_f1: 0.5486
 epoch: 61, train_loss: 0.8385, test_loss: 1.0321, test_f1: 0.5543
 epoch: 62, train_loss: 0.8247, test_loss: 1.0322, test_f1: 0.5407
 epoch: 63, train_loss: 0.8198, test_loss: 1.0538, test_f1: 0.5577
 epoch: 64, train_loss: 0.8085, test_loss: 1.0477, test_f1: 0.5543
 epoch: 65, train_loss: 0.8295, test_loss: 1.0450, test_f1: 0.5649
 epoch: 66, train_loss: 0.8341, test_loss: 1.0580, test_f1: 0.5495
 epoch: 67, train_loss: 0.8285, test_loss: 1.0419, test_f1: 0.5373
 epoch: 68, train_loss: 0.8328, test_loss: 1.0619, test_f1: 0.5535
 epoch: 69, train_loss: 0.8326, test_loss: 1.0263, test_f1: 0.5426
 epoch: 70, train_loss: 0.8130, test_loss: 1.0572, test_f1: 0.5335
 epoch: 71, train_loss: 0.8127, test_loss: 1.0831, test_f1: 0.5016
 epoch: 72, train_loss: 0.7928, test_loss: 1.0597, test_f1: 0.5150
 epoch: 73, train_loss: 0.8031, test_loss: 1.0728, test_f1: 0.5397
 epoch: 74, train_loss: 0.8124, test_loss: 1.0830, test_f1: 0.5443
 epoch: 75, train_loss: 0.8009, test_loss: 1.0885, test_f1: 0.5148
 epoch: 76, train_loss: 0.7957, test_loss: 1.0710, test_f1: 0.5348
 epoch: 77, train_loss: 0.7865, test_loss: 1.0874, test_f1: 0.5408
 epoch: 78, train_loss: 0.7959, test_loss: 1.0981, test_f1: 0.5285
 epoch: 79, train_loss: 0.8112, test_loss: 1.0960, test_f1: 0.5279
 epoch: 80, train_loss: 0.7939, test_loss: 1.1083, test_f1: 0.5205
 epoch: 81, train_loss: 0.8004, test_loss: 1.0825, test_f1: 0.5276
 epoch: 82, train_loss: 0.7834, test_loss: 1.0936, test_f1: 0.5508
 epoch: 83, train_loss: 0.7930, test_loss: 1.0995, test_f1: 0.5269
 epoch: 84, train_loss: 0.7906, test_loss: 1.0944, test_f1: 0.5433
 epoch: 85, train_loss: 0.7802, test_loss: 1.0988, test_f1: 0.5450
 epoch: 86, train_loss: 0.7783, test_loss: 1.1080, test_f1: 0.5234
 epoch: 87, train_loss: 0.7880, test_loss: 1.1089, test_f1: 0.5271
 epoch: 88, train_loss: 0.7818, test_loss: 1.1067, test_f1: 0.5380
 epoch: 89, train_loss: 0.7847, test_loss: 1.1094, test_f1: 0.5432
 epoch: 90, train_loss: 0.7701, test_loss: 1.1068, test_f1: 0.5227
 epoch: 91, train_loss: 0.7851, test_loss: 1.1165, test_f1: 0.5300
 epoch: 92, train_loss: 0.7837, test_loss: 1.1109, test_f1: 0.5145
 epoch: 93, train_loss: 0.7661, test_loss: 1.1142, test_f1: 0.5035
 epoch: 94, train_loss: 0.7640, test_loss: 1.1178, test_f1: 0.5355
 epoch: 95, train_loss: 0.7670, test_loss: 1.1014, test_f1: 0.5344
 epoch: 96, train_loss: 0.7635, test_loss: 1.1069, test_f1: 0.5299
 epoch: 97, train_loss: 0.7646, test_loss: 1.1174, test_f1: 0.5192
 epoch: 98, train_loss: 0.7617, test_loss: 1.1151, test_f1: 0.5359
 epoch: 99, train_loss: 0.7733, test_loss: 1.1233, test_f1: 0.5314
##################ITERATION #9 ****************************************
 epoch: 0, train_loss: 1.3010, test_loss: 1.3103, test_f1: 0.2407
 epoch: 1, train_loss: 1.2168, test_loss: 1.2316, test_f1: 0.3330
 epoch: 2, train_loss: 1.1739, test_loss: 1.2089, test_f1: 0.3582
 epoch: 3, train_loss: 1.1478, test_loss: 1.1915, test_f1: 0.3904
 epoch: 4, train_loss: 1.1240, test_loss: 1.1740, test_f1: 0.3759
 epoch: 5, train_loss: 1.0967, test_loss: 1.1666, test_f1: 0.3659
 epoch: 6, train_loss: 1.0783, test_loss: 1.1341, test_f1: 0.3809
 epoch: 7, train_loss: 1.0580, test_loss: 1.1223, test_f1: 0.3975
 epoch: 8, train_loss: 1.0480, test_loss: 1.1183, test_f1: 0.3760
 epoch: 9, train_loss: 1.0308, test_loss: 1.1286, test_f1: 0.4434
 epoch: 10, train_loss: 1.0295, test_loss: 1.0949, test_f1: 0.4283
 epoch: 11, train_loss: 1.0178, test_loss: 1.0900, test_f1: 0.4851
 epoch: 12, train_loss: 1.0054, test_loss: 1.0747, test_f1: 0.4838
 epoch: 13, train_loss: 0.9989, test_loss: 1.0683, test_f1: 0.4883
 epoch: 14, train_loss: 0.9812, test_loss: 1.0684, test_f1: 0.4977
 epoch: 15, train_loss: 0.9900, test_loss: 1.0720, test_f1: 0.5102
 epoch: 16, train_loss: 0.9696, test_loss: 1.0684, test_f1: 0.5040
 epoch: 17, train_loss: 0.9590, test_loss: 1.0659, test_f1: 0.5165
 epoch: 18, train_loss: 0.9564, test_loss: 1.0387, test_f1: 0.5242
 epoch: 19, train_loss: 0.9447, test_loss: 1.0588, test_f1: 0.5195
 epoch: 20, train_loss: 0.9495, test_loss: 1.0480, test_f1: 0.5172
 epoch: 21, train_loss: 0.9388, test_loss: 1.0491, test_f1: 0.5289
 epoch: 22, train_loss: 0.9348, test_loss: 1.0292, test_f1: 0.5405
 epoch: 23, train_loss: 0.9319, test_loss: 1.0258, test_f1: 0.5336
 epoch: 24, train_loss: 0.9323, test_loss: 1.0165, test_f1: 0.5457
 epoch: 25, train_loss: 0.9256, test_loss: 1.0168, test_f1: 0.5429
 epoch: 26, train_loss: 0.9236, test_loss: 1.0135, test_f1: 0.5578
 epoch: 27, train_loss: 0.9210, test_loss: 1.0409, test_f1: 0.5268
 epoch: 28, train_loss: 0.9144, test_loss: 1.0540, test_f1: 0.5267
 epoch: 29, train_loss: 0.8979, test_loss: 1.0110, test_f1: 0.5477
 epoch: 30, train_loss: 0.9081, test_loss: 0.9919, test_f1: 0.5564
 epoch: 31, train_loss: 0.8951, test_loss: 0.9983, test_f1: 0.5577
 epoch: 32, train_loss: 0.8899, test_loss: 1.0032, test_f1: 0.5615
 epoch: 33, train_loss: 0.9010, test_loss: 0.9998, test_f1: 0.5589
 epoch: 34, train_loss: 0.8864, test_loss: 1.0204, test_f1: 0.5454
 epoch: 35, train_loss: 0.8800, test_loss: 0.9985, test_f1: 0.5645
 epoch: 36, train_loss: 0.8784, test_loss: 0.9855, test_f1: 0.5735
 epoch: 37, train_loss: 0.8867, test_loss: 0.9848, test_f1: 0.5659
 epoch: 38, train_loss: 0.8810, test_loss: 0.9827, test_f1: 0.5769
 epoch: 39, train_loss: 0.8677, test_loss: 0.9944, test_f1: 0.5613
 epoch: 40, train_loss: 0.8675, test_loss: 0.9964, test_f1: 0.5611
 epoch: 41, train_loss: 0.8478, test_loss: 0.9895, test_f1: 0.5623
 epoch: 42, train_loss: 0.8452, test_loss: 1.0113, test_f1: 0.5608
 epoch: 43, train_loss: 0.8635, test_loss: 0.9881, test_f1: 0.5669
 epoch: 44, train_loss: 0.8517, test_loss: 0.9681, test_f1: 0.5707
 epoch: 45, train_loss: 0.8493, test_loss: 0.9721, test_f1: 0.5726
 epoch: 46, train_loss: 0.8443, test_loss: 0.9630, test_f1: 0.5722
 epoch: 47, train_loss: 0.8489, test_loss: 0.9638, test_f1: 0.5863
 epoch: 48, train_loss: 0.8509, test_loss: 1.0016, test_f1: 0.5609
 epoch: 49, train_loss: 0.8383, test_loss: 0.9913, test_f1: 0.5744
 epoch: 50, train_loss: 0.8407, test_loss: 0.9895, test_f1: 0.5748
 epoch: 51, train_loss: 0.8267, test_loss: 0.9652, test_f1: 0.5804
 epoch: 52, train_loss: 0.8268, test_loss: 0.9697, test_f1: 0.5756
 epoch: 53, train_loss: 0.8320, test_loss: 0.9754, test_f1: 0.5643
 epoch: 54, train_loss: 0.8260, test_loss: 0.9864, test_f1: 0.5730
 epoch: 55, train_loss: 0.8275, test_loss: 0.9887, test_f1: 0.5774
 epoch: 56, train_loss: 0.8173, test_loss: 0.9806, test_f1: 0.5786
 epoch: 57, train_loss: 0.8183, test_loss: 0.9708, test_f1: 0.5855
 epoch: 58, train_loss: 0.8175, test_loss: 0.9876, test_f1: 0.5714
 epoch: 59, train_loss: 0.8049, test_loss: 0.9872, test_f1: 0.5734
 epoch: 60, train_loss: 0.8106, test_loss: 0.9989, test_f1: 0.5635
 epoch: 61, train_loss: 0.8098, test_loss: 1.0131, test_f1: 0.5702
 epoch: 62, train_loss: 0.7998, test_loss: 0.9714, test_f1: 0.5793
 epoch: 63, train_loss: 0.8157, test_loss: 1.0174, test_f1: 0.5584
 epoch: 64, train_loss: 0.8070, test_loss: 0.9928, test_f1: 0.5790
 epoch: 65, train_loss: 0.7984, test_loss: 1.0119, test_f1: 0.5797
 epoch: 66, train_loss: 0.8060, test_loss: 1.0115, test_f1: 0.5758
 epoch: 67, train_loss: 0.8075, test_loss: 0.9822, test_f1: 0.5858
 epoch: 68, train_loss: 0.7915, test_loss: 1.0036, test_f1: 0.5863
 epoch: 69, train_loss: 0.7896, test_loss: 0.9970, test_f1: 0.5750
 epoch: 70, train_loss: 0.7968, test_loss: 0.9752, test_f1: 0.5897
 epoch: 71, train_loss: 0.7919, test_loss: 1.0096, test_f1: 0.5733
 epoch: 72, train_loss: 0.7935, test_loss: 0.9909, test_f1: 0.5781
 epoch: 73, train_loss: 0.7976, test_loss: 0.9833, test_f1: 0.5823
 epoch: 74, train_loss: 0.7898, test_loss: 0.9898, test_f1: 0.5803
 epoch: 75, train_loss: 0.8012, test_loss: 0.9821, test_f1: 0.5770
 epoch: 76, train_loss: 0.7853, test_loss: 1.0065, test_f1: 0.5807
 epoch: 77, train_loss: 0.7979, test_loss: 0.9937, test_f1: 0.5780
 epoch: 78, train_loss: 0.7842, test_loss: 1.0046, test_f1: 0.5860
 epoch: 79, train_loss: 0.8016, test_loss: 0.9827, test_f1: 0.5828
 epoch: 80, train_loss: 0.7712, test_loss: 0.9953, test_f1: 0.5877
 epoch: 81, train_loss: 0.7818, test_loss: 0.9950, test_f1: 0.5917
 epoch: 82, train_loss: 0.7816, test_loss: 0.9945, test_f1: 0.6025
 epoch: 83, train_loss: 0.7653, test_loss: 0.9835, test_f1: 0.5783
 epoch: 84, train_loss: 0.7772, test_loss: 1.0087, test_f1: 0.5766
 epoch: 85, train_loss: 0.7764, test_loss: 0.9884, test_f1: 0.5908
 epoch: 86, train_loss: 0.7657, test_loss: 1.0062, test_f1: 0.5985
 epoch: 87, train_loss: 0.7624, test_loss: 1.0168, test_f1: 0.5629
 epoch: 88, train_loss: 0.7691, test_loss: 1.0360, test_f1: 0.5799
 epoch: 89, train_loss: 0.7674, test_loss: 0.9904, test_f1: 0.5751
 epoch: 90, train_loss: 0.7590, test_loss: 0.9895, test_f1: 0.5779
 epoch: 91, train_loss: 0.7646, test_loss: 1.0025, test_f1: 0.5738
 epoch: 92, train_loss: 0.7654, test_loss: 0.9948, test_f1: 0.5831
 epoch: 93, train_loss: 0.7631, test_loss: 0.9995, test_f1: 0.5622
 epoch: 94, train_loss: 0.7721, test_loss: 1.0176, test_f1: 0.5828
 epoch: 95, train_loss: 0.7579, test_loss: 0.9995, test_f1: 0.5916
 epoch: 96, train_loss: 0.7611, test_loss: 1.0106, test_f1: 0.5884
 epoch: 97, train_loss: 0.7644, test_loss: 1.0014, test_f1: 0.6014
 epoch: 98, train_loss: 0.7603, test_loss: 1.0045, test_f1: 0.5853
 epoch: 99, train_loss: 0.7610, test_loss: 1.0310, test_f1: 0.5783

Training completed in 736.64 seconds
Best F1: 0.6232 at epoch 94
Mean F1 across iterations: 0.5567  0.0428
========================FINAL RESULTS================================
FEGIN weighted F1: 0.6232  0.0428
python main.py --data ltspice_demos --representation component_pin --model FEGIN --layers 5 --hiddens 32 --batch_size 32 --lr 0.0001 --emb_size 250 --epochs 100 --save_appendix component_pin_L5_H32_BS32_LR0.0001_E250 --no_val
-----



STDERR:
  File "main.py", line 370, in <module>
    main()
  File "main.py", line 254, in main
    dataset = dataset_class(
  File "/home/philip/projects/ltspice_examples_code_repo/Circuit-Completion-Using-GNNs/component_classification_with_link_prediction_head/evaluation/FEGIN/kernel/circuit_datasets.py", line 15, in __init__
    self.data, self.slices = torch.load(self.processed_paths[0])
  File "/home/philip/.local/lib/python3.8/site-packages/torch/serialization.py", line 1040, in load
    warnings.warn(
  File "/usr/lib/python3.8/warnings.py", line 109, in _showwarnmsg
    sw(msg.message, msg.category, msg.filename, msg.lineno,
  File "main.py", line 47, in warn_with_traceback
    traceback.print_stack(file=log)
/home/philip/projects/ltspice_examples_code_repo/Circuit-Completion-Using-GNNs/component_classification_with_link_prediction_head/evaluation/FEGIN/kernel/circuit_datasets.py:15: FutureWarning: You are using `torch.load` with `weights_only=False` (the current default value), which uses the default pickle module implicitly. It is possible to construct malicious pickle data which will execute arbitrary code during unpickling (See https://github.com/pytorch/pytorch/blob/main/SECURITY.md#untrusted-models for more details). In a future release, the default value for `weights_only` will be flipped to `True`. This limits the functions that could be executed during unpickling. Arbitrary objects will no longer be allowed to be loaded via this mode unless they are explicitly allowlisted by the user via `torch.serialization.add_safe_globals`. We recommend you start setting `weights_only=True` for any use case where you don't have full control of the loaded file. Please open an issue on GitHub for any issues related to this experimental feature.
  self.data, self.slices = torch.load(self.processed_paths[0])
