STDOUT:
Results will be saved in /home/philip/projects/ltspice_examples_code_repo/Circuit-Completion-Using-GNNs/component_classification_with_link_prediction_head/evaluation/FEGIN/results/model_FEGIN_dataset_ltspice_examples
Command line input: python main.py --data ltspice_examples --representation component_component --model FEGIN --layers 6 --hiddens 64 --batch_size 64 --lr 0.001 --emb_size 512 --epochs 100 --save_appendix component_component_L6_H64_BS64_LR0.001_E512 --no_val
 is saved.
-----
ltspice_examples - FEGIN
Using 6 layers, 64 hidden units, h = 2
Loading component_component representation dataset
ENTERED
Training FEGIN on component_component representation
Train: 3556, Test: 845
##################ITERATION #0 ****************************************
 epoch: 0, train_loss: 1.2825, test_loss: 1.2211, test_f1: 0.2883
 epoch: 1, train_loss: 1.1902, test_loss: 1.1500, test_f1: 0.3704
 epoch: 2, train_loss: 1.1267, test_loss: 1.0921, test_f1: 0.4204
 epoch: 3, train_loss: 1.0912, test_loss: 1.0831, test_f1: 0.4583
 epoch: 4, train_loss: 1.0579, test_loss: 1.0380, test_f1: 0.4325
 epoch: 5, train_loss: 1.0402, test_loss: 0.9905, test_f1: 0.4778
 epoch: 6, train_loss: 1.0104, test_loss: 1.0057, test_f1: 0.4815
 epoch: 7, train_loss: 0.9849, test_loss: 1.0466, test_f1: 0.4557
 epoch: 8, train_loss: 0.9757, test_loss: 0.9775, test_f1: 0.4809
 epoch: 9, train_loss: 0.9599, test_loss: 1.0485, test_f1: 0.4444
 epoch: 10, train_loss: 0.9426, test_loss: 0.9744, test_f1: 0.4553
 epoch: 11, train_loss: 0.9222, test_loss: 1.0072, test_f1: 0.4800
 epoch: 12, train_loss: 0.9092, test_loss: 0.9828, test_f1: 0.4925
 epoch: 13, train_loss: 0.8917, test_loss: 0.9213, test_f1: 0.5206
 epoch: 14, train_loss: 0.8737, test_loss: 1.0048, test_f1: 0.4715
 epoch: 15, train_loss: 0.8547, test_loss: 1.0688, test_f1: 0.4719
 epoch: 16, train_loss: 0.8441, test_loss: 0.9863, test_f1: 0.4891
 epoch: 17, train_loss: 0.8557, test_loss: 0.9779, test_f1: 0.4978
 epoch: 18, train_loss: 0.8538, test_loss: 1.0310, test_f1: 0.5165
 epoch: 19, train_loss: 0.8245, test_loss: 1.0742, test_f1: 0.4903
 epoch: 20, train_loss: 0.8324, test_loss: 1.0396, test_f1: 0.5075
 epoch: 21, train_loss: 0.7877, test_loss: 1.0787, test_f1: 0.4867
 epoch: 22, train_loss: 0.7963, test_loss: 1.0013, test_f1: 0.5123
 epoch: 23, train_loss: 0.7682, test_loss: 1.0755, test_f1: 0.4942
 epoch: 24, train_loss: 0.7941, test_loss: 1.0102, test_f1: 0.5325
 epoch: 25, train_loss: 0.7804, test_loss: 1.0997, test_f1: 0.5147
 epoch: 26, train_loss: 0.7503, test_loss: 1.1825, test_f1: 0.5078
 epoch: 27, train_loss: 0.7340, test_loss: 1.0912, test_f1: 0.5208
 epoch: 28, train_loss: 0.7554, test_loss: 1.0936, test_f1: 0.5240
 epoch: 29, train_loss: 0.7374, test_loss: 1.1087, test_f1: 0.5113
 epoch: 30, train_loss: 0.7398, test_loss: 1.0837, test_f1: 0.5067
 epoch: 31, train_loss: 0.7247, test_loss: 1.2790, test_f1: 0.4772
 epoch: 32, train_loss: 0.7139, test_loss: 1.0988, test_f1: 0.5452
 epoch: 33, train_loss: 0.7125, test_loss: 1.0917, test_f1: 0.5289
 epoch: 34, train_loss: 0.7276, test_loss: 1.0984, test_f1: 0.5303
 epoch: 35, train_loss: 0.7043, test_loss: 1.1572, test_f1: 0.5238
 epoch: 36, train_loss: 0.6997, test_loss: 1.1421, test_f1: 0.5426
 epoch: 37, train_loss: 0.6790, test_loss: 1.2010, test_f1: 0.5324
 epoch: 38, train_loss: 0.6576, test_loss: 1.2658, test_f1: 0.5314
 epoch: 39, train_loss: 0.6705, test_loss: 1.1490, test_f1: 0.5225
 epoch: 40, train_loss: 0.6818, test_loss: 1.2036, test_f1: 0.5082
 epoch: 41, train_loss: 0.6685, test_loss: 1.1924, test_f1: 0.5064
 epoch: 42, train_loss: 0.6406, test_loss: 1.2436, test_f1: 0.5319
 epoch: 43, train_loss: 0.6396, test_loss: 1.1558, test_f1: 0.5256
 epoch: 44, train_loss: 0.6577, test_loss: 1.2395, test_f1: 0.5450
 epoch: 45, train_loss: 0.6296, test_loss: 1.2308, test_f1: 0.5403
 epoch: 46, train_loss: 0.6359, test_loss: 1.2721, test_f1: 0.4904
 epoch: 47, train_loss: 0.6256, test_loss: 1.2435, test_f1: 0.5701
 epoch: 48, train_loss: 0.6099, test_loss: 1.2549, test_f1: 0.5908
 epoch: 49, train_loss: 0.6135, test_loss: 1.1946, test_f1: 0.5740
 epoch: 50, train_loss: 0.6251, test_loss: 1.1260, test_f1: 0.5914
 epoch: 51, train_loss: 0.5569, test_loss: 1.2567, test_f1: 0.5742
 epoch: 52, train_loss: 0.5523, test_loss: 1.2716, test_f1: 0.5352
 epoch: 53, train_loss: 0.5221, test_loss: 1.3535, test_f1: 0.5513
 epoch: 54, train_loss: 0.5276, test_loss: 1.3531, test_f1: 0.5844
 epoch: 55, train_loss: 0.5275, test_loss: 1.3154, test_f1: 0.5432
 epoch: 56, train_loss: 0.5121, test_loss: 1.3228, test_f1: 0.5782
 epoch: 57, train_loss: 0.5130, test_loss: 1.3508, test_f1: 0.5368
 epoch: 58, train_loss: 0.5150, test_loss: 1.3466, test_f1: 0.5792
 epoch: 59, train_loss: 0.5054, test_loss: 1.3707, test_f1: 0.5795
 epoch: 60, train_loss: 0.4929, test_loss: 1.5875, test_f1: 0.5386
 epoch: 61, train_loss: 0.5146, test_loss: 1.4226, test_f1: 0.5569
 epoch: 62, train_loss: 0.4958, test_loss: 1.4466, test_f1: 0.5712
 epoch: 63, train_loss: 0.4780, test_loss: 1.3718, test_f1: 0.5942
 epoch: 64, train_loss: 0.4897, test_loss: 1.4134, test_f1: 0.5902
 epoch: 65, train_loss: 0.4679, test_loss: 1.4451, test_f1: 0.5710
 epoch: 66, train_loss: 0.4690, test_loss: 1.4718, test_f1: 0.5678
 epoch: 67, train_loss: 0.4649, test_loss: 1.4094, test_f1: 0.5773
 epoch: 68, train_loss: 0.4556, test_loss: 1.4993, test_f1: 0.5760
 epoch: 69, train_loss: 0.4463, test_loss: 1.4998, test_f1: 0.5806
 epoch: 70, train_loss: 0.4623, test_loss: 1.5329, test_f1: 0.5841
 epoch: 71, train_loss: 0.4645, test_loss: 1.5687, test_f1: 0.5946
 epoch: 72, train_loss: 0.4583, test_loss: 1.5529, test_f1: 0.5538
 epoch: 73, train_loss: 0.4416, test_loss: 1.5459, test_f1: 0.5704
 epoch: 74, train_loss: 0.4342, test_loss: 1.6308, test_f1: 0.5876
 epoch: 75, train_loss: 0.4278, test_loss: 1.5329, test_f1: 0.5873
 epoch: 76, train_loss: 0.4496, test_loss: 1.4757, test_f1: 0.5936
 epoch: 77, train_loss: 0.4204, test_loss: 1.5058, test_f1: 0.5968
 epoch: 78, train_loss: 0.4318, test_loss: 1.4550, test_f1: 0.5701
 epoch: 79, train_loss: 0.4251, test_loss: 1.5152, test_f1: 0.5814
 epoch: 80, train_loss: 0.4218, test_loss: 1.5537, test_f1: 0.5758
 epoch: 81, train_loss: 0.4219, test_loss: 1.5194, test_f1: 0.5811
 epoch: 82, train_loss: 0.4372, test_loss: 1.5938, test_f1: 0.5560
 epoch: 83, train_loss: 0.4001, test_loss: 1.5765, test_f1: 0.5944
 epoch: 84, train_loss: 0.4320, test_loss: 1.6202, test_f1: 0.5864
 epoch: 85, train_loss: 0.4298, test_loss: 1.5215, test_f1: 0.5831
 epoch: 86, train_loss: 0.4162, test_loss: 1.6552, test_f1: 0.5843
 epoch: 87, train_loss: 0.4006, test_loss: 1.5527, test_f1: 0.6033
 epoch: 88, train_loss: 0.4002, test_loss: 1.6780, test_f1: 0.5843
 epoch: 89, train_loss: 0.3832, test_loss: 1.7149, test_f1: 0.5612
 epoch: 90, train_loss: 0.3981, test_loss: 1.6808, test_f1: 0.5811
 epoch: 91, train_loss: 0.3953, test_loss: 1.5355, test_f1: 0.5968
 epoch: 92, train_loss: 0.3829, test_loss: 1.7469, test_f1: 0.6003
 epoch: 93, train_loss: 0.4075, test_loss: 1.9018, test_f1: 0.5486
 epoch: 94, train_loss: 0.3866, test_loss: 1.6686, test_f1: 0.5829
 epoch: 95, train_loss: 0.4156, test_loss: 1.6733, test_f1: 0.5841
 epoch: 96, train_loss: 0.3665, test_loss: 1.6965, test_f1: 0.5585
 epoch: 97, train_loss: 0.3623, test_loss: 1.7003, test_f1: 0.5850
 epoch: 98, train_loss: 0.3846, test_loss: 1.6438, test_f1: 0.5938
 epoch: 99, train_loss: 0.3715, test_loss: 1.7439, test_f1: 0.5912
##################ITERATION #1 ****************************************
 epoch: 0, train_loss: 1.2378, test_loss: 1.1618, test_f1: 0.4494
 epoch: 1, train_loss: 1.1630, test_loss: 1.0952, test_f1: 0.4277
 epoch: 2, train_loss: 1.1141, test_loss: 1.0500, test_f1: 0.4526
 epoch: 3, train_loss: 1.0757, test_loss: 0.9913, test_f1: 0.4742
 epoch: 4, train_loss: 1.0540, test_loss: 0.9727, test_f1: 0.5010
 epoch: 5, train_loss: 1.0279, test_loss: 0.9627, test_f1: 0.4751
 epoch: 6, train_loss: 1.0110, test_loss: 0.9539, test_f1: 0.5007
 epoch: 7, train_loss: 0.9932, test_loss: 0.9347, test_f1: 0.5058
 epoch: 8, train_loss: 0.9760, test_loss: 0.9758, test_f1: 0.5075
 epoch: 9, train_loss: 0.9691, test_loss: 0.9626, test_f1: 0.5105
 epoch: 10, train_loss: 0.9512, test_loss: 0.9574, test_f1: 0.5032
 epoch: 11, train_loss: 0.9266, test_loss: 0.9588, test_f1: 0.5070
 epoch: 12, train_loss: 0.9038, test_loss: 0.9777, test_f1: 0.5209
 epoch: 13, train_loss: 0.9018, test_loss: 0.9424, test_f1: 0.5394
 epoch: 14, train_loss: 0.8908, test_loss: 0.9368, test_f1: 0.4857
 epoch: 15, train_loss: 0.8896, test_loss: 0.9849, test_f1: 0.5161
 epoch: 16, train_loss: 0.8705, test_loss: 0.9757, test_f1: 0.5258
 epoch: 17, train_loss: 0.8791, test_loss: 1.0326, test_f1: 0.4889
 epoch: 18, train_loss: 0.8609, test_loss: 0.9609, test_f1: 0.5414
 epoch: 19, train_loss: 0.8580, test_loss: 0.9836, test_f1: 0.5065
 epoch: 20, train_loss: 0.8322, test_loss: 1.0193, test_f1: 0.5219
 epoch: 21, train_loss: 0.8241, test_loss: 1.0294, test_f1: 0.5504
 epoch: 22, train_loss: 0.8091, test_loss: 1.0298, test_f1: 0.5458
 epoch: 23, train_loss: 0.8037, test_loss: 1.0338, test_f1: 0.5233
 epoch: 24, train_loss: 0.7971, test_loss: 1.0513, test_f1: 0.5121
 epoch: 25, train_loss: 0.7830, test_loss: 1.0908, test_f1: 0.5179
 epoch: 26, train_loss: 0.7671, test_loss: 1.1417, test_f1: 0.5229
 epoch: 27, train_loss: 0.7675, test_loss: 1.1440, test_f1: 0.4991
 epoch: 28, train_loss: 0.7633, test_loss: 1.1178, test_f1: 0.5288
 epoch: 29, train_loss: 0.7499, test_loss: 1.1233, test_f1: 0.5214
 epoch: 30, train_loss: 0.7559, test_loss: 1.1189, test_f1: 0.5308
 epoch: 31, train_loss: 0.7439, test_loss: 1.2306, test_f1: 0.4870
 epoch: 32, train_loss: 0.7124, test_loss: 1.1430, test_f1: 0.5192
 epoch: 33, train_loss: 0.7345, test_loss: 1.1166, test_f1: 0.5549
 epoch: 34, train_loss: 0.7227, test_loss: 1.1688, test_f1: 0.5429
 epoch: 35, train_loss: 0.7165, test_loss: 1.1488, test_f1: 0.5081
 epoch: 36, train_loss: 0.7061, test_loss: 1.2530, test_f1: 0.5170
 epoch: 37, train_loss: 0.6785, test_loss: 1.2561, test_f1: 0.5404
 epoch: 38, train_loss: 0.6854, test_loss: 1.2181, test_f1: 0.5435
 epoch: 39, train_loss: 0.6858, test_loss: 1.2632, test_f1: 0.5148
 epoch: 40, train_loss: 0.6735, test_loss: 1.3218, test_f1: 0.5372
 epoch: 41, train_loss: 0.7002, test_loss: 1.2902, test_f1: 0.5294
 epoch: 42, train_loss: 0.6695, test_loss: 1.1758, test_f1: 0.5261
 epoch: 43, train_loss: 0.6631, test_loss: 1.2778, test_f1: 0.5073
 epoch: 44, train_loss: 0.6737, test_loss: 1.2556, test_f1: 0.5447
 epoch: 45, train_loss: 0.6532, test_loss: 1.1702, test_f1: 0.5627
 epoch: 46, train_loss: 0.6523, test_loss: 1.2551, test_f1: 0.5602
 epoch: 47, train_loss: 0.6460, test_loss: 1.3164, test_f1: 0.5475
 epoch: 48, train_loss: 0.6338, test_loss: 1.3411, test_f1: 0.5491
 epoch: 49, train_loss: 0.6289, test_loss: 1.2411, test_f1: 0.5645
 epoch: 50, train_loss: 0.6237, test_loss: 1.3246, test_f1: 0.5267
 epoch: 51, train_loss: 0.5776, test_loss: 1.3867, test_f1: 0.5432
 epoch: 52, train_loss: 0.5712, test_loss: 1.4188, test_f1: 0.5593
 epoch: 53, train_loss: 0.5565, test_loss: 1.4154, test_f1: 0.5343
 epoch: 54, train_loss: 0.5515, test_loss: 1.4284, test_f1: 0.5521
 epoch: 55, train_loss: 0.5561, test_loss: 1.4229, test_f1: 0.5571
 epoch: 56, train_loss: 0.5393, test_loss: 1.4239, test_f1: 0.5447
 epoch: 57, train_loss: 0.5339, test_loss: 1.5212, test_f1: 0.5409
 epoch: 58, train_loss: 0.5372, test_loss: 1.4854, test_f1: 0.5358
 epoch: 59, train_loss: 0.5489, test_loss: 1.3979, test_f1: 0.5602
 epoch: 60, train_loss: 0.5270, test_loss: 1.4841, test_f1: 0.5631
 epoch: 61, train_loss: 0.5067, test_loss: 1.4744, test_f1: 0.5673
 epoch: 62, train_loss: 0.5174, test_loss: 1.4540, test_f1: 0.5696
 epoch: 63, train_loss: 0.5191, test_loss: 1.5046, test_f1: 0.5902
 epoch: 64, train_loss: 0.5151, test_loss: 1.4660, test_f1: 0.5823
 epoch: 65, train_loss: 0.5018, test_loss: 1.6033, test_f1: 0.5425
 epoch: 66, train_loss: 0.5152, test_loss: 1.5174, test_f1: 0.5805
 epoch: 67, train_loss: 0.4881, test_loss: 1.6141, test_f1: 0.5559
 epoch: 68, train_loss: 0.4821, test_loss: 1.5817, test_f1: 0.5562
 epoch: 69, train_loss: 0.4736, test_loss: 1.6200, test_f1: 0.5671
 epoch: 70, train_loss: 0.4839, test_loss: 1.6424, test_f1: 0.5633
 epoch: 71, train_loss: 0.4697, test_loss: 1.6265, test_f1: 0.5483
 epoch: 72, train_loss: 0.4754, test_loss: 1.6224, test_f1: 0.5447
 epoch: 73, train_loss: 0.4968, test_loss: 1.5801, test_f1: 0.5886
 epoch: 74, train_loss: 0.4657, test_loss: 1.7360, test_f1: 0.5548
 epoch: 75, train_loss: 0.4763, test_loss: 1.7437, test_f1: 0.5769
 epoch: 76, train_loss: 0.4775, test_loss: 1.8553, test_f1: 0.5611
 epoch: 77, train_loss: 0.4597, test_loss: 1.6647, test_f1: 0.5517
 epoch: 78, train_loss: 0.4632, test_loss: 1.7088, test_f1: 0.5689
 epoch: 79, train_loss: 0.4713, test_loss: 1.7160, test_f1: 0.5617
 epoch: 80, train_loss: 0.4642, test_loss: 1.7213, test_f1: 0.5891
 epoch: 81, train_loss: 0.4343, test_loss: 1.7322, test_f1: 0.5734
 epoch: 82, train_loss: 0.4586, test_loss: 1.7564, test_f1: 0.5615
 epoch: 83, train_loss: 0.4255, test_loss: 1.6556, test_f1: 0.5553
 epoch: 84, train_loss: 0.4342, test_loss: 1.8357, test_f1: 0.5531
 epoch: 85, train_loss: 0.4498, test_loss: 1.6731, test_f1: 0.5775
 epoch: 86, train_loss: 0.4352, test_loss: 1.7518, test_f1: 0.5677
 epoch: 87, train_loss: 0.4139, test_loss: 1.7418, test_f1: 0.5690
 epoch: 88, train_loss: 0.4255, test_loss: 1.7685, test_f1: 0.5751
 epoch: 89, train_loss: 0.4211, test_loss: 1.9490, test_f1: 0.5437
 epoch: 90, train_loss: 0.4310, test_loss: 1.7677, test_f1: 0.5738
 epoch: 91, train_loss: 0.4254, test_loss: 1.9998, test_f1: 0.5574
 epoch: 92, train_loss: 0.4196, test_loss: 1.7822, test_f1: 0.5473
 epoch: 93, train_loss: 0.4150, test_loss: 2.0045, test_f1: 0.5562
 epoch: 94, train_loss: 0.3934, test_loss: 1.8616, test_f1: 0.5422
 epoch: 95, train_loss: 0.4226, test_loss: 1.9463, test_f1: 0.5677
 epoch: 96, train_loss: 0.4223, test_loss: 1.8660, test_f1: 0.5688
 epoch: 97, train_loss: 0.4095, test_loss: 1.7550, test_f1: 0.5800
 epoch: 98, train_loss: 0.4032, test_loss: 1.7551, test_f1: 0.5626
 epoch: 99, train_loss: 0.3946, test_loss: 1.9298, test_f1: 0.5564
##################ITERATION #2 ****************************************
 epoch: 0, train_loss: 1.2939, test_loss: 1.1967, test_f1: 0.4029
 epoch: 1, train_loss: 1.1795, test_loss: 1.1038, test_f1: 0.4395
 epoch: 2, train_loss: 1.1258, test_loss: 1.0546, test_f1: 0.4502
 epoch: 3, train_loss: 1.0899, test_loss: 1.0725, test_f1: 0.4698
 epoch: 4, train_loss: 1.0710, test_loss: 1.0291, test_f1: 0.4604
 epoch: 5, train_loss: 1.0447, test_loss: 1.0135, test_f1: 0.4669
 epoch: 6, train_loss: 1.0168, test_loss: 0.9723, test_f1: 0.4993
 epoch: 7, train_loss: 1.0036, test_loss: 1.0333, test_f1: 0.4396
 epoch: 8, train_loss: 0.9708, test_loss: 1.0963, test_f1: 0.4460
 epoch: 9, train_loss: 0.9832, test_loss: 0.9649, test_f1: 0.4687
 epoch: 10, train_loss: 0.9374, test_loss: 0.9627, test_f1: 0.4759
 epoch: 11, train_loss: 0.9286, test_loss: 1.0395, test_f1: 0.4697
 epoch: 12, train_loss: 0.9090, test_loss: 1.0002, test_f1: 0.4909
 epoch: 13, train_loss: 0.8878, test_loss: 1.0158, test_f1: 0.4706
 epoch: 14, train_loss: 0.9011, test_loss: 0.9918, test_f1: 0.5110
 epoch: 15, train_loss: 0.8800, test_loss: 0.9685, test_f1: 0.4956
 epoch: 16, train_loss: 0.8778, test_loss: 1.0025, test_f1: 0.4676
 epoch: 17, train_loss: 0.8624, test_loss: 0.9668, test_f1: 0.5036
 epoch: 18, train_loss: 0.8573, test_loss: 0.9991, test_f1: 0.4830
 epoch: 19, train_loss: 0.8600, test_loss: 1.0939, test_f1: 0.4624
 epoch: 20, train_loss: 0.8271, test_loss: 1.0136, test_f1: 0.5016
 epoch: 21, train_loss: 0.8234, test_loss: 1.0301, test_f1: 0.5032
 epoch: 22, train_loss: 0.8430, test_loss: 0.9560, test_f1: 0.5303
 epoch: 23, train_loss: 0.8055, test_loss: 0.9825, test_f1: 0.5063
 epoch: 24, train_loss: 0.8124, test_loss: 1.0693, test_f1: 0.5057
 epoch: 25, train_loss: 0.7883, test_loss: 1.1634, test_f1: 0.4819
 epoch: 26, train_loss: 0.7892, test_loss: 1.0541, test_f1: 0.5146
 epoch: 27, train_loss: 0.7858, test_loss: 1.2674, test_f1: 0.4862
 epoch: 28, train_loss: 0.7836, test_loss: 1.5817, test_f1: 0.5072
 epoch: 29, train_loss: 0.7949, test_loss: 1.1200, test_f1: 0.5178
 epoch: 30, train_loss: 0.7692, test_loss: 1.1353, test_f1: 0.5008
 epoch: 31, train_loss: 0.7466, test_loss: 1.1166, test_f1: 0.5312
 epoch: 32, train_loss: 0.7387, test_loss: 1.1758, test_f1: 0.5086
 epoch: 33, train_loss: 0.7426, test_loss: 1.1836, test_f1: 0.5089
 epoch: 34, train_loss: 0.7442, test_loss: 1.2400, test_f1: 0.4887
 epoch: 35, train_loss: 0.7555, test_loss: 1.1072, test_f1: 0.5037
 epoch: 36, train_loss: 0.7471, test_loss: 1.1915, test_f1: 0.5020
 epoch: 37, train_loss: 0.7451, test_loss: 1.1754, test_f1: 0.5272
 epoch: 38, train_loss: 0.7188, test_loss: 1.1497, test_f1: 0.5111
 epoch: 39, train_loss: 0.7244, test_loss: 1.1691, test_f1: 0.5103
 epoch: 40, train_loss: 0.7041, test_loss: 1.1373, test_f1: 0.5394
 epoch: 41, train_loss: 0.7219, test_loss: 1.3967, test_f1: 0.4937
 epoch: 42, train_loss: 0.7007, test_loss: 1.1877, test_f1: 0.4927
 epoch: 43, train_loss: 0.7160, test_loss: 1.2190, test_f1: 0.5058
 epoch: 44, train_loss: 0.7055, test_loss: 1.3468, test_f1: 0.4789
 epoch: 45, train_loss: 0.6808, test_loss: 1.3020, test_f1: 0.5072
 epoch: 46, train_loss: 0.6696, test_loss: 1.2457, test_f1: 0.5002
 epoch: 47, train_loss: 0.6563, test_loss: 1.4168, test_f1: 0.4937
 epoch: 48, train_loss: 0.6560, test_loss: 1.4220, test_f1: 0.5128
 epoch: 49, train_loss: 0.6502, test_loss: 1.2781, test_f1: 0.5142
 epoch: 50, train_loss: 0.6646, test_loss: 1.3253, test_f1: 0.5215
 epoch: 51, train_loss: 0.6277, test_loss: 1.3931, test_f1: 0.5164
 epoch: 52, train_loss: 0.6187, test_loss: 1.3839, test_f1: 0.5245
 epoch: 53, train_loss: 0.5924, test_loss: 1.3948, test_f1: 0.5173
 epoch: 54, train_loss: 0.5748, test_loss: 1.4006, test_f1: 0.5214
 epoch: 55, train_loss: 0.5929, test_loss: 1.3320, test_f1: 0.5571
 epoch: 56, train_loss: 0.5896, test_loss: 1.3929, test_f1: 0.5346
 epoch: 57, train_loss: 0.5704, test_loss: 1.5395, test_f1: 0.5275
 epoch: 58, train_loss: 0.5857, test_loss: 1.4253, test_f1: 0.5252
 epoch: 59, train_loss: 0.5687, test_loss: 1.4665, test_f1: 0.5247
 epoch: 60, train_loss: 0.5710, test_loss: 1.4446, test_f1: 0.5439
 epoch: 61, train_loss: 0.5553, test_loss: 1.4687, test_f1: 0.5195
 epoch: 62, train_loss: 0.5733, test_loss: 1.5285, test_f1: 0.5184
 epoch: 63, train_loss: 0.5695, test_loss: 1.6610, test_f1: 0.5397
 epoch: 64, train_loss: 0.5650, test_loss: 1.5018, test_f1: 0.5216
 epoch: 65, train_loss: 0.5562, test_loss: 1.6079, test_f1: 0.5303
 epoch: 66, train_loss: 0.5372, test_loss: 1.5916, test_f1: 0.5300
 epoch: 67, train_loss: 0.5508, test_loss: 1.7201, test_f1: 0.5056
 epoch: 68, train_loss: 0.5490, test_loss: 1.6034, test_f1: 0.5257
 epoch: 69, train_loss: 0.5566, test_loss: 1.5816, test_f1: 0.5267
 epoch: 70, train_loss: 0.5111, test_loss: 1.5568, test_f1: 0.5341
 epoch: 71, train_loss: 0.5316, test_loss: 1.6433, test_f1: 0.5269
 epoch: 72, train_loss: 0.5439, test_loss: 1.7366, test_f1: 0.5112
 epoch: 73, train_loss: 0.5181, test_loss: 1.8736, test_f1: 0.5077
 epoch: 74, train_loss: 0.5174, test_loss: 1.5941, test_f1: 0.5405
 epoch: 75, train_loss: 0.5326, test_loss: 1.8695, test_f1: 0.4959
 epoch: 76, train_loss: 0.5336, test_loss: 1.5289, test_f1: 0.5444
 epoch: 77, train_loss: 0.5124, test_loss: 1.7382, test_f1: 0.5201
 epoch: 78, train_loss: 0.5053, test_loss: 1.6504, test_f1: 0.5317
 epoch: 79, train_loss: 0.4833, test_loss: 1.6225, test_f1: 0.5583
 epoch: 80, train_loss: 0.5079, test_loss: 1.7973, test_f1: 0.5260
 epoch: 81, train_loss: 0.5086, test_loss: 1.6648, test_f1: 0.5497
 epoch: 82, train_loss: 0.4892, test_loss: 1.7169, test_f1: 0.5373
 epoch: 83, train_loss: 0.4756, test_loss: 1.6398, test_f1: 0.5516
 epoch: 84, train_loss: 0.4775, test_loss: 1.6037, test_f1: 0.5484
 epoch: 85, train_loss: 0.5191, test_loss: 1.5844, test_f1: 0.5311
 epoch: 86, train_loss: 0.4711, test_loss: 1.6523, test_f1: 0.5623
 epoch: 87, train_loss: 0.4757, test_loss: 1.7088, test_f1: 0.5676
 epoch: 88, train_loss: 0.4559, test_loss: 1.6346, test_f1: 0.5710
 epoch: 89, train_loss: 0.4612, test_loss: 1.7159, test_f1: 0.5457
 epoch: 90, train_loss: 0.4539, test_loss: 1.8559, test_f1: 0.5570
 epoch: 91, train_loss: 0.4647, test_loss: 1.7643, test_f1: 0.5312
 epoch: 92, train_loss: 0.4640, test_loss: 1.7594, test_f1: 0.5197
 epoch: 93, train_loss: 0.4573, test_loss: 1.8289, test_f1: 0.5323
 epoch: 94, train_loss: 0.4731, test_loss: 1.6039, test_f1: 0.5597
 epoch: 95, train_loss: 0.4586, test_loss: 1.6738, test_f1: 0.5485
 epoch: 96, train_loss: 0.4474, test_loss: 1.8135, test_f1: 0.5374
 epoch: 97, train_loss: 0.4422, test_loss: 1.7940, test_f1: 0.5296
 epoch: 98, train_loss: 0.4815, test_loss: 1.5521, test_f1: 0.5566
 epoch: 99, train_loss: 0.4631, test_loss: 1.7253, test_f1: 0.5579
##################ITERATION #3 ****************************************
 epoch: 0, train_loss: 1.2837, test_loss: 1.1455, test_f1: 0.3837
 epoch: 1, train_loss: 1.1852, test_loss: 1.1464, test_f1: 0.4345
 epoch: 2, train_loss: 1.1256, test_loss: 1.0858, test_f1: 0.4659
 epoch: 3, train_loss: 1.0946, test_loss: 1.0360, test_f1: 0.4673
 epoch: 4, train_loss: 1.0601, test_loss: 1.0383, test_f1: 0.4312
 epoch: 5, train_loss: 1.0266, test_loss: 0.9905, test_f1: 0.4897
 epoch: 6, train_loss: 1.0057, test_loss: 0.9873, test_f1: 0.4998
 epoch: 7, train_loss: 0.9928, test_loss: 0.9742, test_f1: 0.4670
 epoch: 8, train_loss: 0.9672, test_loss: 0.9778, test_f1: 0.4888
 epoch: 9, train_loss: 0.9573, test_loss: 1.0359, test_f1: 0.4478
 epoch: 10, train_loss: 0.9442, test_loss: 1.0440, test_f1: 0.4578
 epoch: 11, train_loss: 0.9319, test_loss: 0.9539, test_f1: 0.4965
 epoch: 12, train_loss: 0.9100, test_loss: 1.1197, test_f1: 0.4738
 epoch: 13, train_loss: 0.9023, test_loss: 0.9359, test_f1: 0.5031
 epoch: 14, train_loss: 0.8849, test_loss: 0.9310, test_f1: 0.4946
 epoch: 15, train_loss: 0.8956, test_loss: 0.9843, test_f1: 0.4930
 epoch: 16, train_loss: 0.8832, test_loss: 0.9575, test_f1: 0.4946
 epoch: 17, train_loss: 0.8697, test_loss: 0.9735, test_f1: 0.5055
 epoch: 18, train_loss: 0.8759, test_loss: 0.9557, test_f1: 0.4900
 epoch: 19, train_loss: 0.8553, test_loss: 0.9710, test_f1: 0.5029
 epoch: 20, train_loss: 0.8332, test_loss: 1.1043, test_f1: 0.4864
 epoch: 21, train_loss: 0.8370, test_loss: 0.9845, test_f1: 0.5112
 epoch: 22, train_loss: 0.8395, test_loss: 1.1106, test_f1: 0.4973
 epoch: 23, train_loss: 0.8318, test_loss: 1.0927, test_f1: 0.5129
 epoch: 24, train_loss: 0.8170, test_loss: 1.0054, test_f1: 0.5302
 epoch: 25, train_loss: 0.8107, test_loss: 1.0461, test_f1: 0.5351
 epoch: 26, train_loss: 0.8191, test_loss: 1.0892, test_f1: 0.5041
 epoch: 27, train_loss: 0.8080, test_loss: 1.0507, test_f1: 0.5129
 epoch: 28, train_loss: 0.7868, test_loss: 1.1190, test_f1: 0.5020
 epoch: 29, train_loss: 0.7817, test_loss: 1.1898, test_f1: 0.5152
 epoch: 30, train_loss: 0.7732, test_loss: 1.0755, test_f1: 0.5154
 epoch: 31, train_loss: 0.7703, test_loss: 1.0896, test_f1: 0.5613
 epoch: 32, train_loss: 0.7794, test_loss: 1.0731, test_f1: 0.5132
 epoch: 33, train_loss: 0.7580, test_loss: 1.0064, test_f1: 0.5365
 epoch: 34, train_loss: 0.7477, test_loss: 1.0180, test_f1: 0.5205
 epoch: 35, train_loss: 0.7524, test_loss: 1.0483, test_f1: 0.5478
 epoch: 36, train_loss: 0.7501, test_loss: 1.1014, test_f1: 0.5146
 epoch: 37, train_loss: 0.7552, test_loss: 1.1319, test_f1: 0.5152
 epoch: 38, train_loss: 0.7398, test_loss: 1.1884, test_f1: 0.5199
 epoch: 39, train_loss: 0.7345, test_loss: 1.0995, test_f1: 0.5410
 epoch: 40, train_loss: 0.7557, test_loss: 1.1347, test_f1: 0.4999
 epoch: 41, train_loss: 0.7425, test_loss: 1.2041, test_f1: 0.5101
 epoch: 42, train_loss: 0.7283, test_loss: 1.2049, test_f1: 0.5126
 epoch: 43, train_loss: 0.6996, test_loss: 1.2444, test_f1: 0.5002
 epoch: 44, train_loss: 0.7224, test_loss: 1.1065, test_f1: 0.5277
 epoch: 45, train_loss: 0.7075, test_loss: 1.2026, test_f1: 0.5229
 epoch: 46, train_loss: 0.6892, test_loss: 1.1851, test_f1: 0.5413
 epoch: 47, train_loss: 0.6767, test_loss: 1.2234, test_f1: 0.5307
 epoch: 48, train_loss: 0.6665, test_loss: 1.2510, test_f1: 0.5255
 epoch: 49, train_loss: 0.6761, test_loss: 1.1771, test_f1: 0.5489
 epoch: 50, train_loss: 0.6696, test_loss: 1.2551, test_f1: 0.5517
 epoch: 51, train_loss: 0.6403, test_loss: 1.2351, test_f1: 0.5301
 epoch: 52, train_loss: 0.6102, test_loss: 1.3033, test_f1: 0.5514
 epoch: 53, train_loss: 0.6102, test_loss: 1.2844, test_f1: 0.5124
 epoch: 54, train_loss: 0.5892, test_loss: 1.3492, test_f1: 0.5463
 epoch: 55, train_loss: 0.5829, test_loss: 1.4657, test_f1: 0.5459
 epoch: 56, train_loss: 0.5722, test_loss: 1.4747, test_f1: 0.5236
 epoch: 57, train_loss: 0.5907, test_loss: 1.4482, test_f1: 0.5384
 epoch: 58, train_loss: 0.5765, test_loss: 1.3530, test_f1: 0.5460
 epoch: 59, train_loss: 0.5550, test_loss: 1.4183, test_f1: 0.5315
 epoch: 60, train_loss: 0.5473, test_loss: 1.4473, test_f1: 0.5311
 epoch: 61, train_loss: 0.5644, test_loss: 1.4821, test_f1: 0.5561
 epoch: 62, train_loss: 0.5534, test_loss: 1.5428, test_f1: 0.5580
 epoch: 63, train_loss: 0.5575, test_loss: 1.4292, test_f1: 0.5393
 epoch: 64, train_loss: 0.5457, test_loss: 1.4135, test_f1: 0.5441
 epoch: 65, train_loss: 0.5518, test_loss: 1.4350, test_f1: 0.5252
 epoch: 66, train_loss: 0.5330, test_loss: 1.4403, test_f1: 0.5599
 epoch: 67, train_loss: 0.5416, test_loss: 1.5334, test_f1: 0.5176
 epoch: 68, train_loss: 0.5238, test_loss: 1.5049, test_f1: 0.5351
 epoch: 69, train_loss: 0.5195, test_loss: 1.5644, test_f1: 0.5465
 epoch: 70, train_loss: 0.5136, test_loss: 1.4481, test_f1: 0.5539
 epoch: 71, train_loss: 0.5398, test_loss: 1.5944, test_f1: 0.5552
 epoch: 72, train_loss: 0.5023, test_loss: 1.4997, test_f1: 0.5549
 epoch: 73, train_loss: 0.4994, test_loss: 1.5975, test_f1: 0.5548
 epoch: 74, train_loss: 0.4908, test_loss: 1.6157, test_f1: 0.5274
 epoch: 75, train_loss: 0.5367, test_loss: 1.4988, test_f1: 0.5457
 epoch: 76, train_loss: 0.4965, test_loss: 1.5923, test_f1: 0.5607
 epoch: 77, train_loss: 0.4808, test_loss: 1.7300, test_f1: 0.5545
 epoch: 78, train_loss: 0.4803, test_loss: 1.5334, test_f1: 0.5548
 epoch: 79, train_loss: 0.4899, test_loss: 1.6198, test_f1: 0.5525
 epoch: 80, train_loss: 0.4765, test_loss: 1.6252, test_f1: 0.5497
 epoch: 81, train_loss: 0.4865, test_loss: 1.5094, test_f1: 0.5620
 epoch: 82, train_loss: 0.4687, test_loss: 1.6359, test_f1: 0.5429
 epoch: 83, train_loss: 0.4702, test_loss: 1.6641, test_f1: 0.5726
 epoch: 84, train_loss: 0.4674, test_loss: 1.6409, test_f1: 0.5613
 epoch: 85, train_loss: 0.4706, test_loss: 1.7605, test_f1: 0.5379
 epoch: 86, train_loss: 0.4638, test_loss: 1.6924, test_f1: 0.5603
 epoch: 87, train_loss: 0.4659, test_loss: 1.6517, test_f1: 0.5649
 epoch: 88, train_loss: 0.4620, test_loss: 1.5836, test_f1: 0.5541
 epoch: 89, train_loss: 0.4424, test_loss: 1.7228, test_f1: 0.5591
 epoch: 90, train_loss: 0.4452, test_loss: 1.9087, test_f1: 0.5447
 epoch: 91, train_loss: 0.4512, test_loss: 1.8376, test_f1: 0.5611
 epoch: 92, train_loss: 0.4506, test_loss: 1.7625, test_f1: 0.5514
 epoch: 93, train_loss: 0.4393, test_loss: 1.6631, test_f1: 0.5536
 epoch: 94, train_loss: 0.4290, test_loss: 1.7613, test_f1: 0.5571
 epoch: 95, train_loss: 0.4545, test_loss: 1.8895, test_f1: 0.5406
 epoch: 96, train_loss: 0.4350, test_loss: 1.7204, test_f1: 0.5533
 epoch: 97, train_loss: 0.4295, test_loss: 1.9058, test_f1: 0.5362
 epoch: 98, train_loss: 0.4278, test_loss: 1.7526, test_f1: 0.5653
 epoch: 99, train_loss: 0.4129, test_loss: 1.8698, test_f1: 0.5798
##################ITERATION #4 ****************************************
 epoch: 0, train_loss: 1.3379, test_loss: 1.1708, test_f1: 0.4298
 epoch: 1, train_loss: 1.1967, test_loss: 1.1099, test_f1: 0.4466
 epoch: 2, train_loss: 1.1441, test_loss: 1.0867, test_f1: 0.4561
 epoch: 3, train_loss: 1.1138, test_loss: 1.0701, test_f1: 0.4467
 epoch: 4, train_loss: 1.1023, test_loss: 1.0332, test_f1: 0.4678
 epoch: 5, train_loss: 1.0654, test_loss: 1.0348, test_f1: 0.4584
 epoch: 6, train_loss: 1.0573, test_loss: 1.0079, test_f1: 0.4623
 epoch: 7, train_loss: 1.0363, test_loss: 0.9783, test_f1: 0.5036
 epoch: 8, train_loss: 1.0221, test_loss: 0.9841, test_f1: 0.4865
 epoch: 9, train_loss: 1.0140, test_loss: 1.0005, test_f1: 0.4668
 epoch: 10, train_loss: 0.9894, test_loss: 0.9786, test_f1: 0.4639
 epoch: 11, train_loss: 0.9879, test_loss: 1.0501, test_f1: 0.4467
 epoch: 12, train_loss: 0.9677, test_loss: 1.0006, test_f1: 0.4872
 epoch: 13, train_loss: 0.9731, test_loss: 1.0222, test_f1: 0.4985
 epoch: 14, train_loss: 0.9516, test_loss: 0.9975, test_f1: 0.5112
 epoch: 15, train_loss: 0.9350, test_loss: 0.9586, test_f1: 0.4984
 epoch: 16, train_loss: 0.9339, test_loss: 0.9493, test_f1: 0.4864
 epoch: 17, train_loss: 0.9284, test_loss: 1.0105, test_f1: 0.4554
 epoch: 18, train_loss: 0.9153, test_loss: 0.9702, test_f1: 0.5042
 epoch: 19, train_loss: 0.8964, test_loss: 1.0390, test_f1: 0.4917
 epoch: 20, train_loss: 0.8778, test_loss: 1.0390, test_f1: 0.5177
 epoch: 21, train_loss: 0.8673, test_loss: 0.9472, test_f1: 0.4996
 epoch: 22, train_loss: 0.8773, test_loss: 0.9570, test_f1: 0.4919
 epoch: 23, train_loss: 0.8471, test_loss: 1.0182, test_f1: 0.5256
 epoch: 24, train_loss: 0.8619, test_loss: 1.0105, test_f1: 0.5345
 epoch: 25, train_loss: 0.8463, test_loss: 1.0344, test_f1: 0.5191
 epoch: 26, train_loss: 0.8436, test_loss: 1.0304, test_f1: 0.5162
 epoch: 27, train_loss: 0.8592, test_loss: 1.0178, test_f1: 0.5503
 epoch: 28, train_loss: 0.8396, test_loss: 1.0337, test_f1: 0.5099
 epoch: 29, train_loss: 0.8436, test_loss: 1.0690, test_f1: 0.5061
 epoch: 30, train_loss: 0.8231, test_loss: 1.0159, test_f1: 0.5136
 epoch: 31, train_loss: 0.8113, test_loss: 1.1355, test_f1: 0.5306
 epoch: 32, train_loss: 0.8304, test_loss: 1.0461, test_f1: 0.5510
 epoch: 33, train_loss: 0.8179, test_loss: 1.0319, test_f1: 0.5513
 epoch: 34, train_loss: 0.7893, test_loss: 1.0301, test_f1: 0.5428
 epoch: 35, train_loss: 0.7953, test_loss: 1.0231, test_f1: 0.5401
 epoch: 36, train_loss: 0.7899, test_loss: 1.1085, test_f1: 0.5362
 epoch: 37, train_loss: 0.7627, test_loss: 1.1443, test_f1: 0.5438
 epoch: 38, train_loss: 0.7759, test_loss: 1.0780, test_f1: 0.5600
 epoch: 39, train_loss: 0.7778, test_loss: 1.0893, test_f1: 0.5442
 epoch: 40, train_loss: 0.7603, test_loss: 1.1236, test_f1: 0.5575
 epoch: 41, train_loss: 0.7613, test_loss: 1.1324, test_f1: 0.5038
 epoch: 42, train_loss: 0.7594, test_loss: 1.1253, test_f1: 0.5231
 epoch: 43, train_loss: 0.7527, test_loss: 1.0509, test_f1: 0.5631
 epoch: 44, train_loss: 0.7381, test_loss: 1.1303, test_f1: 0.5530
 epoch: 45, train_loss: 0.7394, test_loss: 1.1229, test_f1: 0.5351
 epoch: 46, train_loss: 0.7279, test_loss: 1.1886, test_f1: 0.4898
 epoch: 47, train_loss: 0.7160, test_loss: 1.1061, test_f1: 0.5413
 epoch: 48, train_loss: 0.7053, test_loss: 1.1388, test_f1: 0.5250
 epoch: 49, train_loss: 0.7093, test_loss: 1.1447, test_f1: 0.5371
 epoch: 50, train_loss: 0.7129, test_loss: 1.1234, test_f1: 0.5594
 epoch: 51, train_loss: 0.6903, test_loss: 1.1144, test_f1: 0.5417
 epoch: 52, train_loss: 0.6511, test_loss: 1.1676, test_f1: 0.5476
 epoch: 53, train_loss: 0.6490, test_loss: 1.1054, test_f1: 0.5657
 epoch: 54, train_loss: 0.6446, test_loss: 1.1728, test_f1: 0.5375
 epoch: 55, train_loss: 0.6459, test_loss: 1.1898, test_f1: 0.5285
 epoch: 56, train_loss: 0.6284, test_loss: 1.1687, test_f1: 0.5599
 epoch: 57, train_loss: 0.6299, test_loss: 1.2698, test_f1: 0.5311
 epoch: 58, train_loss: 0.6232, test_loss: 1.2296, test_f1: 0.5587
 epoch: 59, train_loss: 0.6149, test_loss: 1.2547, test_f1: 0.5210
 epoch: 60, train_loss: 0.6369, test_loss: 1.2124, test_f1: 0.5470
 epoch: 61, train_loss: 0.6230, test_loss: 1.1909, test_f1: 0.5779
 epoch: 62, train_loss: 0.6258, test_loss: 1.1765, test_f1: 0.5579
 epoch: 63, train_loss: 0.6174, test_loss: 1.2294, test_f1: 0.5533
 epoch: 64, train_loss: 0.6103, test_loss: 1.2819, test_f1: 0.5379
 epoch: 65, train_loss: 0.5947, test_loss: 1.2745, test_f1: 0.5446
 epoch: 66, train_loss: 0.5941, test_loss: 1.2876, test_f1: 0.5443
 epoch: 67, train_loss: 0.6112, test_loss: 1.2411, test_f1: 0.5552
 epoch: 68, train_loss: 0.5945, test_loss: 1.3214, test_f1: 0.5245
 epoch: 69, train_loss: 0.6023, test_loss: 1.2535, test_f1: 0.5625
 epoch: 70, train_loss: 0.5686, test_loss: 1.2926, test_f1: 0.5817
 epoch: 71, train_loss: 0.5688, test_loss: 1.2599, test_f1: 0.5441
 epoch: 72, train_loss: 0.5788, test_loss: 1.3011, test_f1: 0.5625
 epoch: 73, train_loss: 0.5805, test_loss: 1.2671, test_f1: 0.5680
 epoch: 74, train_loss: 0.5758, test_loss: 1.3152, test_f1: 0.5542
 epoch: 75, train_loss: 0.5819, test_loss: 1.3095, test_f1: 0.5427
 epoch: 76, train_loss: 0.5598, test_loss: 1.3169, test_f1: 0.5565
 epoch: 77, train_loss: 0.5643, test_loss: 1.3610, test_f1: 0.5642
 epoch: 78, train_loss: 0.5582, test_loss: 1.3515, test_f1: 0.5501
 epoch: 79, train_loss: 0.5704, test_loss: 1.3532, test_f1: 0.5428
 epoch: 80, train_loss: 0.5522, test_loss: 1.2887, test_f1: 0.5744
 epoch: 81, train_loss: 0.5459, test_loss: 1.3214, test_f1: 0.5535
 epoch: 82, train_loss: 0.5521, test_loss: 1.3663, test_f1: 0.5687
 epoch: 83, train_loss: 0.5362, test_loss: 1.3883, test_f1: 0.5588
 epoch: 84, train_loss: 0.5376, test_loss: 1.3753, test_f1: 0.5500
 epoch: 85, train_loss: 0.5590, test_loss: 1.3426, test_f1: 0.5459
 epoch: 86, train_loss: 0.5275, test_loss: 1.3529, test_f1: 0.5645
 epoch: 87, train_loss: 0.5343, test_loss: 1.3707, test_f1: 0.5586
 epoch: 88, train_loss: 0.5286, test_loss: 1.4517, test_f1: 0.5619
 epoch: 89, train_loss: 0.5145, test_loss: 1.3826, test_f1: 0.5381
 epoch: 90, train_loss: 0.5025, test_loss: 1.4790, test_f1: 0.5641
 epoch: 91, train_loss: 0.5049, test_loss: 1.3864, test_f1: 0.5800
 epoch: 92, train_loss: 0.5102, test_loss: 1.4110, test_f1: 0.5456
 epoch: 93, train_loss: 0.5057, test_loss: 1.4389, test_f1: 0.5588
 epoch: 94, train_loss: 0.5383, test_loss: 1.4389, test_f1: 0.5631
 epoch: 95, train_loss: 0.5221, test_loss: 1.4684, test_f1: 0.5706
 epoch: 96, train_loss: 0.5029, test_loss: 1.4178, test_f1: 0.5499
 epoch: 97, train_loss: 0.4998, test_loss: 1.4665, test_f1: 0.5909
 epoch: 98, train_loss: 0.4933, test_loss: 1.5030, test_f1: 0.5455
 epoch: 99, train_loss: 0.5075, test_loss: 1.3891, test_f1: 0.5542
##################ITERATION #5 ****************************************
 epoch: 0, train_loss: 1.3529, test_loss: 1.1502, test_f1: 0.3778
 epoch: 1, train_loss: 1.1854, test_loss: 1.1254, test_f1: 0.3907
 epoch: 2, train_loss: 1.1464, test_loss: 1.0864, test_f1: 0.4010
 epoch: 3, train_loss: 1.1285, test_loss: 1.0775, test_f1: 0.4185
 epoch: 4, train_loss: 1.1026, test_loss: 1.0545, test_f1: 0.4099
 epoch: 5, train_loss: 1.0868, test_loss: 1.0462, test_f1: 0.4332
 epoch: 6, train_loss: 1.0682, test_loss: 1.0102, test_f1: 0.4537
 epoch: 7, train_loss: 1.0358, test_loss: 0.9949, test_f1: 0.4571
 epoch: 8, train_loss: 1.0438, test_loss: 0.9988, test_f1: 0.4283
 epoch: 9, train_loss: 1.0293, test_loss: 0.9914, test_f1: 0.4471
 epoch: 10, train_loss: 0.9860, test_loss: 1.0008, test_f1: 0.4516
 epoch: 11, train_loss: 0.9830, test_loss: 1.0182, test_f1: 0.4597
 epoch: 12, train_loss: 0.9813, test_loss: 1.1039, test_f1: 0.4329
 epoch: 13, train_loss: 0.9680, test_loss: 0.9706, test_f1: 0.4674
 epoch: 14, train_loss: 0.9506, test_loss: 0.9542, test_f1: 0.4813
 epoch: 15, train_loss: 0.9478, test_loss: 1.0126, test_f1: 0.4462
 epoch: 16, train_loss: 0.9452, test_loss: 0.9927, test_f1: 0.4625
 epoch: 17, train_loss: 0.9132, test_loss: 1.0972, test_f1: 0.4596
 epoch: 18, train_loss: 0.9175, test_loss: 1.0250, test_f1: 0.4794
 epoch: 19, train_loss: 0.9192, test_loss: 1.0634, test_f1: 0.4543
 epoch: 20, train_loss: 0.8911, test_loss: 1.0269, test_f1: 0.4751
 epoch: 21, train_loss: 0.8897, test_loss: 0.9873, test_f1: 0.4956
 epoch: 22, train_loss: 0.8847, test_loss: 1.1085, test_f1: 0.4779
 epoch: 23, train_loss: 0.8690, test_loss: 1.0806, test_f1: 0.4761
 epoch: 24, train_loss: 0.8653, test_loss: 1.0360, test_f1: 0.4921
 epoch: 25, train_loss: 0.8541, test_loss: 1.0309, test_f1: 0.4977
 epoch: 26, train_loss: 0.8409, test_loss: 1.0574, test_f1: 0.4873
 epoch: 27, train_loss: 0.8418, test_loss: 1.1112, test_f1: 0.4806
 epoch: 28, train_loss: 0.8460, test_loss: 1.0838, test_f1: 0.4715
 epoch: 29, train_loss: 0.8291, test_loss: 1.1801, test_f1: 0.4493
 epoch: 30, train_loss: 0.8142, test_loss: 1.1270, test_f1: 0.4864
 epoch: 31, train_loss: 0.8191, test_loss: 1.0997, test_f1: 0.4974
 epoch: 32, train_loss: 0.8252, test_loss: 1.0321, test_f1: 0.5002
 epoch: 33, train_loss: 0.8036, test_loss: 1.1127, test_f1: 0.4904
 epoch: 34, train_loss: 0.7949, test_loss: 1.1296, test_f1: 0.4870
 epoch: 35, train_loss: 0.7809, test_loss: 1.1498, test_f1: 0.4739
 epoch: 36, train_loss: 0.7702, test_loss: 1.1194, test_f1: 0.4818
 epoch: 37, train_loss: 0.7790, test_loss: 1.1283, test_f1: 0.5068
 epoch: 38, train_loss: 0.7643, test_loss: 1.1591, test_f1: 0.4936
 epoch: 39, train_loss: 0.7883, test_loss: 1.0587, test_f1: 0.4990
 epoch: 40, train_loss: 0.7702, test_loss: 1.1270, test_f1: 0.4925
 epoch: 41, train_loss: 0.7718, test_loss: 1.1620, test_f1: 0.4943
 epoch: 42, train_loss: 0.7492, test_loss: 1.1936, test_f1: 0.5001
 epoch: 43, train_loss: 0.7420, test_loss: 1.1935, test_f1: 0.5015
 epoch: 44, train_loss: 0.7385, test_loss: 1.1248, test_f1: 0.5066
 epoch: 45, train_loss: 0.7310, test_loss: 1.2049, test_f1: 0.4919
 epoch: 46, train_loss: 0.7281, test_loss: 1.1328, test_f1: 0.5419
 epoch: 47, train_loss: 0.7137, test_loss: 1.2715, test_f1: 0.5049
 epoch: 48, train_loss: 0.7242, test_loss: 1.2218, test_f1: 0.4927
 epoch: 49, train_loss: 0.7258, test_loss: 1.2163, test_f1: 0.5388
 epoch: 50, train_loss: 0.7012, test_loss: 1.1904, test_f1: 0.5389
 epoch: 51, train_loss: 0.6705, test_loss: 1.1942, test_f1: 0.5465
 epoch: 52, train_loss: 0.6523, test_loss: 1.2369, test_f1: 0.5506
 epoch: 53, train_loss: 0.6417, test_loss: 1.2607, test_f1: 0.5301
 epoch: 54, train_loss: 0.6295, test_loss: 1.3266, test_f1: 0.5379
 epoch: 55, train_loss: 0.6341, test_loss: 1.2371, test_f1: 0.5487
 epoch: 56, train_loss: 0.6363, test_loss: 1.2348, test_f1: 0.5331
 epoch: 57, train_loss: 0.6355, test_loss: 1.2411, test_f1: 0.5154
 epoch: 58, train_loss: 0.6232, test_loss: 1.2757, test_f1: 0.5378
 epoch: 59, train_loss: 0.6161, test_loss: 1.2822, test_f1: 0.5435
 epoch: 60, train_loss: 0.6176, test_loss: 1.2939, test_f1: 0.5147
 epoch: 61, train_loss: 0.5969, test_loss: 1.2753, test_f1: 0.5325
 epoch: 62, train_loss: 0.6027, test_loss: 1.3199, test_f1: 0.5366
 epoch: 63, train_loss: 0.6164, test_loss: 1.3107, test_f1: 0.5339
 epoch: 64, train_loss: 0.6089, test_loss: 1.3636, test_f1: 0.5263
 epoch: 65, train_loss: 0.5845, test_loss: 1.3285, test_f1: 0.5323
 epoch: 66, train_loss: 0.6047, test_loss: 1.3104, test_f1: 0.5332
 epoch: 67, train_loss: 0.5795, test_loss: 1.3500, test_f1: 0.5215
 epoch: 68, train_loss: 0.5856, test_loss: 1.3530, test_f1: 0.5459
 epoch: 69, train_loss: 0.5731, test_loss: 1.3426, test_f1: 0.5527
 epoch: 70, train_loss: 0.5890, test_loss: 1.3507, test_f1: 0.5353
 epoch: 71, train_loss: 0.5621, test_loss: 1.2990, test_f1: 0.5178
 epoch: 72, train_loss: 0.5573, test_loss: 1.3947, test_f1: 0.5652
 epoch: 73, train_loss: 0.5720, test_loss: 1.3403, test_f1: 0.5438
 epoch: 74, train_loss: 0.5647, test_loss: 1.3768, test_f1: 0.5595
 epoch: 75, train_loss: 0.5652, test_loss: 1.3785, test_f1: 0.5576
 epoch: 76, train_loss: 0.5512, test_loss: 1.3864, test_f1: 0.5363
 epoch: 77, train_loss: 0.5562, test_loss: 1.4277, test_f1: 0.5607
 epoch: 78, train_loss: 0.5568, test_loss: 1.3830, test_f1: 0.5477
 epoch: 79, train_loss: 0.5629, test_loss: 1.3894, test_f1: 0.5734
 epoch: 80, train_loss: 0.5412, test_loss: 1.4050, test_f1: 0.5511
 epoch: 81, train_loss: 0.5424, test_loss: 1.3444, test_f1: 0.5594
 epoch: 82, train_loss: 0.5332, test_loss: 1.4177, test_f1: 0.5459
 epoch: 83, train_loss: 0.5376, test_loss: 1.5048, test_f1: 0.5518
 epoch: 84, train_loss: 0.5281, test_loss: 1.4383, test_f1: 0.5508
 epoch: 85, train_loss: 0.5261, test_loss: 1.4397, test_f1: 0.5605
 epoch: 86, train_loss: 0.5234, test_loss: 1.4018, test_f1: 0.5435
 epoch: 87, train_loss: 0.5128, test_loss: 1.4205, test_f1: 0.5662
 epoch: 88, train_loss: 0.5173, test_loss: 1.4552, test_f1: 0.5351
 epoch: 89, train_loss: 0.5062, test_loss: 1.5520, test_f1: 0.5311
 epoch: 90, train_loss: 0.5130, test_loss: 1.4735, test_f1: 0.5659
 epoch: 91, train_loss: 0.4996, test_loss: 1.4473, test_f1: 0.5602
 epoch: 92, train_loss: 0.5053, test_loss: 1.4117, test_f1: 0.5484
 epoch: 93, train_loss: 0.5070, test_loss: 1.3637, test_f1: 0.5790
 epoch: 94, train_loss: 0.5000, test_loss: 1.4033, test_f1: 0.5622
 epoch: 95, train_loss: 0.4642, test_loss: 1.4772, test_f1: 0.5656
 epoch: 96, train_loss: 0.4891, test_loss: 1.4269, test_f1: 0.5633
 epoch: 97, train_loss: 0.5037, test_loss: 1.4332, test_f1: 0.5518
 epoch: 98, train_loss: 0.4831, test_loss: 1.5191, test_f1: 0.5559
 epoch: 99, train_loss: 0.4846, test_loss: 1.7044, test_f1: 0.5620
##################ITERATION #6 ****************************************
 epoch: 0, train_loss: 1.3469, test_loss: 1.1945, test_f1: 0.3107
 epoch: 1, train_loss: 1.2080, test_loss: 1.1035, test_f1: 0.4305
 epoch: 2, train_loss: 1.1487, test_loss: 1.0691, test_f1: 0.4618
 epoch: 3, train_loss: 1.1131, test_loss: 1.0406, test_f1: 0.4605
 epoch: 4, train_loss: 1.0960, test_loss: 1.0308, test_f1: 0.4590
 epoch: 5, train_loss: 1.0757, test_loss: 1.0314, test_f1: 0.4754
 epoch: 6, train_loss: 1.0537, test_loss: 1.1025, test_f1: 0.4448
 epoch: 7, train_loss: 1.0404, test_loss: 1.0064, test_f1: 0.4594
 epoch: 8, train_loss: 1.0397, test_loss: 0.9965, test_f1: 0.4448
 epoch: 9, train_loss: 1.0275, test_loss: 1.0018, test_f1: 0.4665
 epoch: 10, train_loss: 1.0090, test_loss: 0.9713, test_f1: 0.4827
 epoch: 11, train_loss: 0.9826, test_loss: 0.9634, test_f1: 0.4941
 epoch: 12, train_loss: 0.9823, test_loss: 0.9657, test_f1: 0.4936
 epoch: 13, train_loss: 0.9587, test_loss: 0.9731, test_f1: 0.4881
 epoch: 14, train_loss: 0.9474, test_loss: 0.9891, test_f1: 0.4404
 epoch: 15, train_loss: 0.9208, test_loss: 1.0263, test_f1: 0.4796
 epoch: 16, train_loss: 0.9365, test_loss: 0.9934, test_f1: 0.4799
 epoch: 17, train_loss: 0.9247, test_loss: 1.0297, test_f1: 0.4791
 epoch: 18, train_loss: 0.9179, test_loss: 0.9593, test_f1: 0.4910
 epoch: 19, train_loss: 0.8890, test_loss: 1.0348, test_f1: 0.4788
 epoch: 20, train_loss: 0.8820, test_loss: 1.1201, test_f1: 0.4662
 epoch: 21, train_loss: 0.8738, test_loss: 1.0837, test_f1: 0.5116
 epoch: 22, train_loss: 0.8636, test_loss: 1.0541, test_f1: 0.5152
 epoch: 23, train_loss: 0.8760, test_loss: 0.9560, test_f1: 0.5118
 epoch: 24, train_loss: 0.8508, test_loss: 0.9591, test_f1: 0.5121
 epoch: 25, train_loss: 0.8527, test_loss: 1.0056, test_f1: 0.4863
 epoch: 26, train_loss: 0.8443, test_loss: 1.0715, test_f1: 0.4836
 epoch: 27, train_loss: 0.8410, test_loss: 1.0664, test_f1: 0.5104
 epoch: 28, train_loss: 0.8145, test_loss: 1.0665, test_f1: 0.5158
 epoch: 29, train_loss: 0.8253, test_loss: 1.0720, test_f1: 0.5039
 epoch: 30, train_loss: 0.8145, test_loss: 1.0747, test_f1: 0.5012
 epoch: 31, train_loss: 0.7915, test_loss: 1.0131, test_f1: 0.5106
 epoch: 32, train_loss: 0.8018, test_loss: 1.0136, test_f1: 0.5070
 epoch: 33, train_loss: 0.7953, test_loss: 1.1593, test_f1: 0.4787
 epoch: 34, train_loss: 0.7977, test_loss: 1.0223, test_f1: 0.4841
 epoch: 35, train_loss: 0.7849, test_loss: 1.0603, test_f1: 0.5132
 epoch: 36, train_loss: 0.7707, test_loss: 1.1031, test_f1: 0.5224
 epoch: 37, train_loss: 0.7702, test_loss: 1.0781, test_f1: 0.5215
 epoch: 38, train_loss: 0.7746, test_loss: 1.0741, test_f1: 0.5399
 epoch: 39, train_loss: 0.7554, test_loss: 1.0942, test_f1: 0.5031
 epoch: 40, train_loss: 0.7591, test_loss: 1.1018, test_f1: 0.5417
 epoch: 41, train_loss: 0.7621, test_loss: 1.0966, test_f1: 0.5178
 epoch: 42, train_loss: 0.7430, test_loss: 1.0991, test_f1: 0.5469
 epoch: 43, train_loss: 0.7382, test_loss: 1.1422, test_f1: 0.5254
 epoch: 44, train_loss: 0.7330, test_loss: 1.2211, test_f1: 0.5064
 epoch: 45, train_loss: 0.7357, test_loss: 1.1405, test_f1: 0.5258
 epoch: 46, train_loss: 0.7264, test_loss: 1.1080, test_f1: 0.5520
 epoch: 47, train_loss: 0.7125, test_loss: 1.1702, test_f1: 0.5416
 epoch: 48, train_loss: 0.7268, test_loss: 1.1852, test_f1: 0.5352
 epoch: 49, train_loss: 0.7314, test_loss: 1.0990, test_f1: 0.5113
 epoch: 50, train_loss: 0.7135, test_loss: 1.1189, test_f1: 0.5421
 epoch: 51, train_loss: 0.6801, test_loss: 1.1557, test_f1: 0.5311
 epoch: 52, train_loss: 0.6441, test_loss: 1.2491, test_f1: 0.5005
 epoch: 53, train_loss: 0.6514, test_loss: 1.1816, test_f1: 0.5352
 epoch: 54, train_loss: 0.6651, test_loss: 1.3094, test_f1: 0.5284
 epoch: 55, train_loss: 0.6404, test_loss: 1.2468, test_f1: 0.5121
 epoch: 56, train_loss: 0.6291, test_loss: 1.2770, test_f1: 0.5449
 epoch: 57, train_loss: 0.6451, test_loss: 1.2603, test_f1: 0.5473
 epoch: 58, train_loss: 0.6269, test_loss: 1.2796, test_f1: 0.5593
 epoch: 59, train_loss: 0.6263, test_loss: 1.2587, test_f1: 0.5400
 epoch: 60, train_loss: 0.6318, test_loss: 1.3251, test_f1: 0.5386
 epoch: 61, train_loss: 0.6015, test_loss: 1.2986, test_f1: 0.5552
 epoch: 62, train_loss: 0.6051, test_loss: 1.3411, test_f1: 0.5564
 epoch: 63, train_loss: 0.6062, test_loss: 1.3225, test_f1: 0.5597
 epoch: 64, train_loss: 0.6026, test_loss: 1.2967, test_f1: 0.5583
 epoch: 65, train_loss: 0.5973, test_loss: 1.2683, test_f1: 0.5410
 epoch: 66, train_loss: 0.5851, test_loss: 1.3393, test_f1: 0.5391
 epoch: 67, train_loss: 0.5994, test_loss: 1.3441, test_f1: 0.5169
 epoch: 68, train_loss: 0.5896, test_loss: 1.3417, test_f1: 0.5672
 epoch: 69, train_loss: 0.5772, test_loss: 1.3549, test_f1: 0.5371
 epoch: 70, train_loss: 0.5920, test_loss: 1.3001, test_f1: 0.5446
 epoch: 71, train_loss: 0.5756, test_loss: 1.2946, test_f1: 0.5598
 epoch: 72, train_loss: 0.5677, test_loss: 1.3643, test_f1: 0.5446
 epoch: 73, train_loss: 0.5644, test_loss: 1.3296, test_f1: 0.5525
 epoch: 74, train_loss: 0.5816, test_loss: 1.3906, test_f1: 0.5514
 epoch: 75, train_loss: 0.5660, test_loss: 1.2861, test_f1: 0.5580
 epoch: 76, train_loss: 0.5538, test_loss: 1.2908, test_f1: 0.5552
 epoch: 77, train_loss: 0.5466, test_loss: 1.3655, test_f1: 0.5455
 epoch: 78, train_loss: 0.5410, test_loss: 1.3968, test_f1: 0.5486
 epoch: 79, train_loss: 0.5542, test_loss: 1.3208, test_f1: 0.5777
 epoch: 80, train_loss: 0.5348, test_loss: 1.3804, test_f1: 0.5458
 epoch: 81, train_loss: 0.5480, test_loss: 1.3993, test_f1: 0.5591
 epoch: 82, train_loss: 0.5357, test_loss: 1.3920, test_f1: 0.5221
 epoch: 83, train_loss: 0.5221, test_loss: 1.3558, test_f1: 0.5419
 epoch: 84, train_loss: 0.5421, test_loss: 1.3643, test_f1: 0.5579
 epoch: 85, train_loss: 0.5123, test_loss: 1.4471, test_f1: 0.5487
 epoch: 86, train_loss: 0.5222, test_loss: 1.4245, test_f1: 0.5296
 epoch: 87, train_loss: 0.5154, test_loss: 1.3698, test_f1: 0.5787
 epoch: 88, train_loss: 0.5121, test_loss: 1.3600, test_f1: 0.5342
 epoch: 89, train_loss: 0.5042, test_loss: 1.4628, test_f1: 0.5401
 epoch: 90, train_loss: 0.4920, test_loss: 1.3991, test_f1: 0.5455
 epoch: 91, train_loss: 0.5146, test_loss: 1.4300, test_f1: 0.5396
 epoch: 92, train_loss: 0.5131, test_loss: 1.4956, test_f1: 0.5531
 epoch: 93, train_loss: 0.5221, test_loss: 1.4572, test_f1: 0.5467
 epoch: 94, train_loss: 0.4992, test_loss: 1.4335, test_f1: 0.5565
 epoch: 95, train_loss: 0.5146, test_loss: 1.3950, test_f1: 0.5654
 epoch: 96, train_loss: 0.5105, test_loss: 1.5117, test_f1: 0.5487
 epoch: 97, train_loss: 0.4904, test_loss: 1.3707, test_f1: 0.5656
 epoch: 98, train_loss: 0.4813, test_loss: 1.4963, test_f1: 0.5664
 epoch: 99, train_loss: 0.4813, test_loss: 1.4687, test_f1: 0.5493
##################ITERATION #7 ****************************************
 epoch: 0, train_loss: 1.4006, test_loss: 1.1854, test_f1: 0.3911
 epoch: 1, train_loss: 1.2027, test_loss: 1.1192, test_f1: 0.4212
 epoch: 2, train_loss: 1.1617, test_loss: 1.1133, test_f1: 0.4092
 epoch: 3, train_loss: 1.1152, test_loss: 1.0264, test_f1: 0.4540
 epoch: 4, train_loss: 1.0922, test_loss: 1.0286, test_f1: 0.4741
 epoch: 5, train_loss: 1.0682, test_loss: 1.0380, test_f1: 0.4358
 epoch: 6, train_loss: 1.0381, test_loss: 0.9942, test_f1: 0.4680
 epoch: 7, train_loss: 1.0425, test_loss: 0.9718, test_f1: 0.5066
 epoch: 8, train_loss: 1.0042, test_loss: 0.9741, test_f1: 0.4826
 epoch: 9, train_loss: 1.0012, test_loss: 0.9455, test_f1: 0.4756
 epoch: 10, train_loss: 1.0038, test_loss: 0.9952, test_f1: 0.5068
 epoch: 11, train_loss: 0.9690, test_loss: 1.0874, test_f1: 0.4449
 epoch: 12, train_loss: 0.9661, test_loss: 0.9377, test_f1: 0.5088
 epoch: 13, train_loss: 0.9489, test_loss: 0.9136, test_f1: 0.5397
 epoch: 14, train_loss: 0.9518, test_loss: 0.9433, test_f1: 0.5493
 epoch: 15, train_loss: 0.9540, test_loss: 0.9940, test_f1: 0.4928
 epoch: 16, train_loss: 0.9352, test_loss: 0.9348, test_f1: 0.5122
 epoch: 17, train_loss: 0.9280, test_loss: 0.9647, test_f1: 0.5142
 epoch: 18, train_loss: 0.9071, test_loss: 1.0590, test_f1: 0.4838
 epoch: 19, train_loss: 0.9064, test_loss: 0.9905, test_f1: 0.5095
 epoch: 20, train_loss: 0.8979, test_loss: 1.0264, test_f1: 0.4840
 epoch: 21, train_loss: 0.9094, test_loss: 0.9911, test_f1: 0.5131
 epoch: 22, train_loss: 0.8884, test_loss: 1.0000, test_f1: 0.4738
 epoch: 23, train_loss: 0.8822, test_loss: 0.9810, test_f1: 0.5076
 epoch: 24, train_loss: 0.8695, test_loss: 0.9566, test_f1: 0.4883
 epoch: 25, train_loss: 0.8747, test_loss: 0.9862, test_f1: 0.5123
 epoch: 26, train_loss: 0.8621, test_loss: 1.0065, test_f1: 0.5104
 epoch: 27, train_loss: 0.8470, test_loss: 1.0735, test_f1: 0.4888
 epoch: 28, train_loss: 0.8417, test_loss: 1.0573, test_f1: 0.5023
 epoch: 29, train_loss: 0.8276, test_loss: 1.0415, test_f1: 0.5223
 epoch: 30, train_loss: 0.8327, test_loss: 1.1042, test_f1: 0.4855
 epoch: 31, train_loss: 0.8290, test_loss: 1.0132, test_f1: 0.5369
 epoch: 32, train_loss: 0.8255, test_loss: 0.9578, test_f1: 0.5207
 epoch: 33, train_loss: 0.8022, test_loss: 0.9940, test_f1: 0.5219
 epoch: 34, train_loss: 0.7934, test_loss: 0.9636, test_f1: 0.5429
 epoch: 35, train_loss: 0.7965, test_loss: 1.0650, test_f1: 0.4872
 epoch: 36, train_loss: 0.8004, test_loss: 1.0334, test_f1: 0.5185
 epoch: 37, train_loss: 0.7913, test_loss: 1.1057, test_f1: 0.4945
 epoch: 38, train_loss: 0.7892, test_loss: 1.0256, test_f1: 0.5276
 epoch: 39, train_loss: 0.7831, test_loss: 1.1407, test_f1: 0.5076
 epoch: 40, train_loss: 0.7700, test_loss: 1.1634, test_f1: 0.5176
 epoch: 41, train_loss: 0.7487, test_loss: 1.0968, test_f1: 0.5308
 epoch: 42, train_loss: 0.7468, test_loss: 1.1161, test_f1: 0.5240
 epoch: 43, train_loss: 0.7654, test_loss: 1.1073, test_f1: 0.4852
 epoch: 44, train_loss: 0.7795, test_loss: 1.2089, test_f1: 0.5345
 epoch: 45, train_loss: 0.7505, test_loss: 1.2000, test_f1: 0.4965
 epoch: 46, train_loss: 0.7293, test_loss: 1.2073, test_f1: 0.5216
 epoch: 47, train_loss: 0.7294, test_loss: 1.1437, test_f1: 0.5061
 epoch: 48, train_loss: 0.7252, test_loss: 1.1195, test_f1: 0.5107
 epoch: 49, train_loss: 0.7242, test_loss: 1.1638, test_f1: 0.5242
 epoch: 50, train_loss: 0.7176, test_loss: 1.0486, test_f1: 0.5197
 epoch: 51, train_loss: 0.6707, test_loss: 1.1409, test_f1: 0.5217
 epoch: 52, train_loss: 0.6610, test_loss: 1.2226, test_f1: 0.5287
 epoch: 53, train_loss: 0.6655, test_loss: 1.1927, test_f1: 0.5101
 epoch: 54, train_loss: 0.6427, test_loss: 1.3190, test_f1: 0.5291
 epoch: 55, train_loss: 0.6606, test_loss: 1.3559, test_f1: 0.5222
 epoch: 56, train_loss: 0.6563, test_loss: 1.2747, test_f1: 0.5159
 epoch: 57, train_loss: 0.6352, test_loss: 1.3304, test_f1: 0.5142
 epoch: 58, train_loss: 0.6179, test_loss: 1.3010, test_f1: 0.5242
 epoch: 59, train_loss: 0.6262, test_loss: 1.3548, test_f1: 0.5189
 epoch: 60, train_loss: 0.6128, test_loss: 1.3325, test_f1: 0.5163
 epoch: 61, train_loss: 0.6037, test_loss: 1.3366, test_f1: 0.5211
 epoch: 62, train_loss: 0.6152, test_loss: 1.2542, test_f1: 0.5366
 epoch: 63, train_loss: 0.6054, test_loss: 1.3505, test_f1: 0.5370
 epoch: 64, train_loss: 0.6088, test_loss: 1.3207, test_f1: 0.5163
 epoch: 65, train_loss: 0.6110, test_loss: 1.2642, test_f1: 0.5473
 epoch: 66, train_loss: 0.6174, test_loss: 1.2423, test_f1: 0.5204
 epoch: 67, train_loss: 0.5983, test_loss: 1.2806, test_f1: 0.5111
 epoch: 68, train_loss: 0.5981, test_loss: 1.3300, test_f1: 0.5187
 epoch: 69, train_loss: 0.6062, test_loss: 1.3252, test_f1: 0.5324
 epoch: 70, train_loss: 0.6176, test_loss: 1.3207, test_f1: 0.5263
 epoch: 71, train_loss: 0.5882, test_loss: 1.3287, test_f1: 0.5310
 epoch: 72, train_loss: 0.5689, test_loss: 1.3448, test_f1: 0.5548
 epoch: 73, train_loss: 0.5647, test_loss: 1.3342, test_f1: 0.5383
 epoch: 74, train_loss: 0.5759, test_loss: 1.2898, test_f1: 0.5364
 epoch: 75, train_loss: 0.5739, test_loss: 1.5709, test_f1: 0.5338
 epoch: 76, train_loss: 0.5902, test_loss: 1.2876, test_f1: 0.5310
 epoch: 77, train_loss: 0.5594, test_loss: 1.3608, test_f1: 0.5261
 epoch: 78, train_loss: 0.5656, test_loss: 1.3352, test_f1: 0.5422
 epoch: 79, train_loss: 0.5601, test_loss: 1.3509, test_f1: 0.5263
 epoch: 80, train_loss: 0.5484, test_loss: 1.3106, test_f1: 0.5470
 epoch: 81, train_loss: 0.5520, test_loss: 1.3418, test_f1: 0.5265
 epoch: 82, train_loss: 0.5618, test_loss: 1.4038, test_f1: 0.5328
 epoch: 83, train_loss: 0.5577, test_loss: 1.3836, test_f1: 0.5226
 epoch: 84, train_loss: 0.5377, test_loss: 1.3467, test_f1: 0.5258
 epoch: 85, train_loss: 0.5349, test_loss: 1.4253, test_f1: 0.5406
 epoch: 86, train_loss: 0.5196, test_loss: 1.6006, test_f1: 0.5214
 epoch: 87, train_loss: 0.5282, test_loss: 1.3253, test_f1: 0.5497
 epoch: 88, train_loss: 0.5466, test_loss: 1.3959, test_f1: 0.5484
 epoch: 89, train_loss: 0.5321, test_loss: 1.2933, test_f1: 0.5306
 epoch: 90, train_loss: 0.5265, test_loss: 1.3969, test_f1: 0.5324
 epoch: 91, train_loss: 0.5252, test_loss: 1.5180, test_f1: 0.5060
 epoch: 92, train_loss: 0.5134, test_loss: 1.5222, test_f1: 0.5260
 epoch: 93, train_loss: 0.5243, test_loss: 1.3830, test_f1: 0.5355
 epoch: 94, train_loss: 0.5214, test_loss: 1.4404, test_f1: 0.5461
 epoch: 95, train_loss: 0.5266, test_loss: 1.5380, test_f1: 0.5342
 epoch: 96, train_loss: 0.5313, test_loss: 1.5646, test_f1: 0.5272
 epoch: 97, train_loss: 0.5207, test_loss: 1.3598, test_f1: 0.5456
 epoch: 98, train_loss: 0.4965, test_loss: 1.3855, test_f1: 0.5336
 epoch: 99, train_loss: 0.4929, test_loss: 1.4376, test_f1: 0.5539
##################ITERATION #8 ****************************************
 epoch: 0, train_loss: 1.4060, test_loss: 1.2044, test_f1: 0.3406
 epoch: 1, train_loss: 1.2192, test_loss: 1.1325, test_f1: 0.4090
 epoch: 2, train_loss: 1.1686, test_loss: 1.1201, test_f1: 0.4433
 epoch: 3, train_loss: 1.1275, test_loss: 1.1283, test_f1: 0.3971
 epoch: 4, train_loss: 1.1015, test_loss: 1.0967, test_f1: 0.4371
 epoch: 5, train_loss: 1.0737, test_loss: 1.0615, test_f1: 0.4266
 epoch: 6, train_loss: 1.0522, test_loss: 0.9892, test_f1: 0.4663
 epoch: 7, train_loss: 1.0354, test_loss: 0.9949, test_f1: 0.4400
 epoch: 8, train_loss: 1.0124, test_loss: 0.9910, test_f1: 0.4934
 epoch: 9, train_loss: 0.9879, test_loss: 0.9925, test_f1: 0.4863
 epoch: 10, train_loss: 0.9787, test_loss: 0.9819, test_f1: 0.4798
 epoch: 11, train_loss: 0.9728, test_loss: 0.9334, test_f1: 0.5146
 epoch: 12, train_loss: 0.9450, test_loss: 0.9805, test_f1: 0.4764
 epoch: 13, train_loss: 0.9334, test_loss: 1.0185, test_f1: 0.4848
 epoch: 14, train_loss: 0.9262, test_loss: 0.9751, test_f1: 0.4714
 epoch: 15, train_loss: 0.9144, test_loss: 1.0532, test_f1: 0.4813
 epoch: 16, train_loss: 0.9046, test_loss: 1.0057, test_f1: 0.4853
 epoch: 17, train_loss: 0.9047, test_loss: 0.9216, test_f1: 0.5045
 epoch: 18, train_loss: 0.8708, test_loss: 0.9533, test_f1: 0.5141
 epoch: 19, train_loss: 0.8659, test_loss: 0.9281, test_f1: 0.5272
 epoch: 20, train_loss: 0.8744, test_loss: 1.0062, test_f1: 0.5065
 epoch: 21, train_loss: 0.8656, test_loss: 1.1011, test_f1: 0.4714
 epoch: 22, train_loss: 0.8337, test_loss: 1.0364, test_f1: 0.5151
 epoch: 23, train_loss: 0.8466, test_loss: 1.0742, test_f1: 0.5004
 epoch: 24, train_loss: 0.8496, test_loss: 1.0547, test_f1: 0.4915
 epoch: 25, train_loss: 0.8168, test_loss: 1.1068, test_f1: 0.5187
 epoch: 26, train_loss: 0.8113, test_loss: 1.0514, test_f1: 0.5122
 epoch: 27, train_loss: 0.8053, test_loss: 1.0441, test_f1: 0.5167
 epoch: 28, train_loss: 0.7870, test_loss: 1.1115, test_f1: 0.4927
 epoch: 29, train_loss: 0.7983, test_loss: 1.2225, test_f1: 0.4703
 epoch: 30, train_loss: 0.7796, test_loss: 1.1450, test_f1: 0.4829
 epoch: 31, train_loss: 0.7930, test_loss: 1.1084, test_f1: 0.5041
 epoch: 32, train_loss: 0.7699, test_loss: 1.1300, test_f1: 0.4998
 epoch: 33, train_loss: 0.7623, test_loss: 1.1721, test_f1: 0.5123
 epoch: 34, train_loss: 0.7488, test_loss: 1.1790, test_f1: 0.5114
 epoch: 35, train_loss: 0.7449, test_loss: 1.1748, test_f1: 0.5005
 epoch: 36, train_loss: 0.7480, test_loss: 1.1056, test_f1: 0.5230
 epoch: 37, train_loss: 0.7436, test_loss: 1.1353, test_f1: 0.5155
 epoch: 38, train_loss: 0.7428, test_loss: 1.1090, test_f1: 0.5125
 epoch: 39, train_loss: 0.7218, test_loss: 1.1649, test_f1: 0.5137
 epoch: 40, train_loss: 0.7310, test_loss: 1.1857, test_f1: 0.5030
 epoch: 41, train_loss: 0.7042, test_loss: 1.2004, test_f1: 0.5049
 epoch: 42, train_loss: 0.7044, test_loss: 1.2512, test_f1: 0.5024
 epoch: 43, train_loss: 0.7223, test_loss: 1.2436, test_f1: 0.4851
 epoch: 44, train_loss: 0.7029, test_loss: 1.2048, test_f1: 0.5123
 epoch: 45, train_loss: 0.6974, test_loss: 1.1616, test_f1: 0.5045
 epoch: 46, train_loss: 0.7007, test_loss: 1.1488, test_f1: 0.5333
 epoch: 47, train_loss: 0.6787, test_loss: 1.2071, test_f1: 0.5515
 epoch: 48, train_loss: 0.6690, test_loss: 1.2213, test_f1: 0.5306
 epoch: 49, train_loss: 0.6837, test_loss: 1.1717, test_f1: 0.5168
 epoch: 50, train_loss: 0.6672, test_loss: 1.2701, test_f1: 0.5082
 epoch: 51, train_loss: 0.6400, test_loss: 1.1802, test_f1: 0.5363
 epoch: 52, train_loss: 0.6303, test_loss: 1.2200, test_f1: 0.5235
 epoch: 53, train_loss: 0.6182, test_loss: 1.2566, test_f1: 0.5161
 epoch: 54, train_loss: 0.6079, test_loss: 1.2520, test_f1: 0.5399
 epoch: 55, train_loss: 0.5936, test_loss: 1.2866, test_f1: 0.5308
 epoch: 56, train_loss: 0.5971, test_loss: 1.2356, test_f1: 0.5367
 epoch: 57, train_loss: 0.5959, test_loss: 1.2483, test_f1: 0.5206
 epoch: 58, train_loss: 0.5800, test_loss: 1.3043, test_f1: 0.5411
 epoch: 59, train_loss: 0.5773, test_loss: 1.2453, test_f1: 0.5472
 epoch: 60, train_loss: 0.5693, test_loss: 1.3091, test_f1: 0.5588
 epoch: 61, train_loss: 0.5621, test_loss: 1.3519, test_f1: 0.5578
 epoch: 62, train_loss: 0.5825, test_loss: 1.3096, test_f1: 0.5317
 epoch: 63, train_loss: 0.5522, test_loss: 1.5101, test_f1: 0.5159
 epoch: 64, train_loss: 0.5715, test_loss: 1.3146, test_f1: 0.5505
 epoch: 65, train_loss: 0.5610, test_loss: 1.3113, test_f1: 0.5445
 epoch: 66, train_loss: 0.5419, test_loss: 1.3689, test_f1: 0.5264
 epoch: 67, train_loss: 0.5426, test_loss: 1.4604, test_f1: 0.5285
 epoch: 68, train_loss: 0.5237, test_loss: 1.3685, test_f1: 0.5612
 epoch: 69, train_loss: 0.5463, test_loss: 1.2897, test_f1: 0.5397
 epoch: 70, train_loss: 0.5208, test_loss: 1.5168, test_f1: 0.5391
 epoch: 71, train_loss: 0.5256, test_loss: 1.5509, test_f1: 0.5261
 epoch: 72, train_loss: 0.5269, test_loss: 1.3745, test_f1: 0.5619
 epoch: 73, train_loss: 0.5126, test_loss: 1.4336, test_f1: 0.5336
 epoch: 74, train_loss: 0.5097, test_loss: 1.4488, test_f1: 0.5388
 epoch: 75, train_loss: 0.4991, test_loss: 1.4710, test_f1: 0.5468
 epoch: 76, train_loss: 0.5054, test_loss: 1.3736, test_f1: 0.5436
 epoch: 77, train_loss: 0.5086, test_loss: 1.3843, test_f1: 0.5424
 epoch: 78, train_loss: 0.5023, test_loss: 1.4660, test_f1: 0.5335
 epoch: 79, train_loss: 0.4903, test_loss: 1.3379, test_f1: 0.5589
 epoch: 80, train_loss: 0.5031, test_loss: 1.4486, test_f1: 0.5551
 epoch: 81, train_loss: 0.4878, test_loss: 1.4973, test_f1: 0.5195
 epoch: 82, train_loss: 0.5009, test_loss: 1.5081, test_f1: 0.5473
 epoch: 83, train_loss: 0.4925, test_loss: 1.4478, test_f1: 0.5527
 epoch: 84, train_loss: 0.4775, test_loss: 1.4724, test_f1: 0.5366
 epoch: 85, train_loss: 0.4871, test_loss: 1.5176, test_f1: 0.5429
 epoch: 86, train_loss: 0.4754, test_loss: 1.4833, test_f1: 0.5501
 epoch: 87, train_loss: 0.4756, test_loss: 1.5100, test_f1: 0.5520
 epoch: 88, train_loss: 0.4732, test_loss: 1.5944, test_f1: 0.5275
 epoch: 89, train_loss: 0.4615, test_loss: 1.5911, test_f1: 0.5405
 epoch: 90, train_loss: 0.4494, test_loss: 1.6519, test_f1: 0.5247
 epoch: 91, train_loss: 0.4518, test_loss: 1.5538, test_f1: 0.5520
 epoch: 92, train_loss: 0.4420, test_loss: 1.6502, test_f1: 0.5227
 epoch: 93, train_loss: 0.4549, test_loss: 1.4589, test_f1: 0.5548
 epoch: 94, train_loss: 0.4580, test_loss: 1.5870, test_f1: 0.5542
 epoch: 95, train_loss: 0.4485, test_loss: 1.5851, test_f1: 0.5485
 epoch: 96, train_loss: 0.4648, test_loss: 1.5911, test_f1: 0.5438
 epoch: 97, train_loss: 0.4523, test_loss: 1.5723, test_f1: 0.5364
 epoch: 98, train_loss: 0.4416, test_loss: 1.5252, test_f1: 0.5657
 epoch: 99, train_loss: 0.4287, test_loss: 1.6705, test_f1: 0.5405
##################ITERATION #9 ****************************************
 epoch: 0, train_loss: 1.4141, test_loss: 1.2010, test_f1: 0.4010
 epoch: 1, train_loss: 1.2122, test_loss: 1.1389, test_f1: 0.3913
 epoch: 2, train_loss: 1.1638, test_loss: 1.1189, test_f1: 0.4172
 epoch: 3, train_loss: 1.1081, test_loss: 1.0434, test_f1: 0.4577
 epoch: 4, train_loss: 1.0821, test_loss: 1.0486, test_f1: 0.4413
 epoch: 5, train_loss: 1.0608, test_loss: 0.9806, test_f1: 0.4896
 epoch: 6, train_loss: 1.0464, test_loss: 0.9886, test_f1: 0.4950
 epoch: 7, train_loss: 1.0412, test_loss: 0.9781, test_f1: 0.5167
 epoch: 8, train_loss: 1.0004, test_loss: 0.9749, test_f1: 0.4729
 epoch: 9, train_loss: 0.9888, test_loss: 0.9910, test_f1: 0.4630
 epoch: 10, train_loss: 0.9821, test_loss: 0.9850, test_f1: 0.4971
 epoch: 11, train_loss: 0.9654, test_loss: 1.0230, test_f1: 0.4819
 epoch: 12, train_loss: 0.9819, test_loss: 0.9869, test_f1: 0.4796
 epoch: 13, train_loss: 0.9488, test_loss: 0.9667, test_f1: 0.5408
 epoch: 14, train_loss: 0.9326, test_loss: 0.9681, test_f1: 0.4946
 epoch: 15, train_loss: 0.9154, test_loss: 1.0612, test_f1: 0.4729
 epoch: 16, train_loss: 0.8975, test_loss: 0.9713, test_f1: 0.4968
 epoch: 17, train_loss: 0.9092, test_loss: 1.0162, test_f1: 0.4989
 epoch: 18, train_loss: 0.8884, test_loss: 0.9847, test_f1: 0.5393
 epoch: 19, train_loss: 0.8732, test_loss: 1.0054, test_f1: 0.5055
 epoch: 20, train_loss: 0.8709, test_loss: 1.0065, test_f1: 0.5473
 epoch: 21, train_loss: 0.8577, test_loss: 1.0572, test_f1: 0.5186
 epoch: 22, train_loss: 0.8498, test_loss: 0.9705, test_f1: 0.5386
 epoch: 23, train_loss: 0.8682, test_loss: 1.0134, test_f1: 0.5266
 epoch: 24, train_loss: 0.8504, test_loss: 1.0036, test_f1: 0.5393
 epoch: 25, train_loss: 0.8249, test_loss: 1.0296, test_f1: 0.5110
 epoch: 26, train_loss: 0.8231, test_loss: 0.9858, test_f1: 0.5349
 epoch: 27, train_loss: 0.8166, test_loss: 1.0273, test_f1: 0.5397
 epoch: 28, train_loss: 0.8047, test_loss: 1.0255, test_f1: 0.5504
 epoch: 29, train_loss: 0.8175, test_loss: 1.0860, test_f1: 0.5112
 epoch: 30, train_loss: 0.8054, test_loss: 0.9420, test_f1: 0.5606
 epoch: 31, train_loss: 0.7952, test_loss: 1.0604, test_f1: 0.5022
 epoch: 32, train_loss: 0.7769, test_loss: 1.0502, test_f1: 0.5358
 epoch: 33, train_loss: 0.7866, test_loss: 1.0274, test_f1: 0.5466
 epoch: 34, train_loss: 0.7687, test_loss: 1.0795, test_f1: 0.5264
 epoch: 35, train_loss: 0.7635, test_loss: 1.1679, test_f1: 0.5183
 epoch: 36, train_loss: 0.7625, test_loss: 1.1023, test_f1: 0.5387
 epoch: 37, train_loss: 0.7647, test_loss: 1.0378, test_f1: 0.5291
 epoch: 38, train_loss: 0.7379, test_loss: 1.0719, test_f1: 0.5183
 epoch: 39, train_loss: 0.7569, test_loss: 1.1282, test_f1: 0.5254
 epoch: 40, train_loss: 0.7341, test_loss: 1.1338, test_f1: 0.5284
 epoch: 41, train_loss: 0.7056, test_loss: 1.1262, test_f1: 0.5180
 epoch: 42, train_loss: 0.7351, test_loss: 1.1234, test_f1: 0.5501
 epoch: 43, train_loss: 0.7186, test_loss: 1.1440, test_f1: 0.5184
 epoch: 44, train_loss: 0.7296, test_loss: 1.1157, test_f1: 0.5326
 epoch: 45, train_loss: 0.7199, test_loss: 1.1568, test_f1: 0.5369
 epoch: 46, train_loss: 0.6989, test_loss: 1.1493, test_f1: 0.5410
 epoch: 47, train_loss: 0.6903, test_loss: 1.1664, test_f1: 0.5537
 epoch: 48, train_loss: 0.6930, test_loss: 1.1581, test_f1: 0.5296
 epoch: 49, train_loss: 0.6839, test_loss: 1.1258, test_f1: 0.5333
 epoch: 50, train_loss: 0.6907, test_loss: 1.1521, test_f1: 0.5213
 epoch: 51, train_loss: 0.6600, test_loss: 1.1804, test_f1: 0.5496
 epoch: 52, train_loss: 0.5966, test_loss: 1.2511, test_f1: 0.5423
 epoch: 53, train_loss: 0.6271, test_loss: 1.2621, test_f1: 0.5346
 epoch: 54, train_loss: 0.5967, test_loss: 1.2542, test_f1: 0.5545
 epoch: 55, train_loss: 0.5989, test_loss: 1.2412, test_f1: 0.5441
 epoch: 56, train_loss: 0.5900, test_loss: 1.2913, test_f1: 0.5391
 epoch: 57, train_loss: 0.5977, test_loss: 1.3674, test_f1: 0.5210
 epoch: 58, train_loss: 0.5853, test_loss: 1.3690, test_f1: 0.5325
 epoch: 59, train_loss: 0.5717, test_loss: 1.3390, test_f1: 0.5476
 epoch: 60, train_loss: 0.5752, test_loss: 1.3419, test_f1: 0.5437
 epoch: 61, train_loss: 0.5602, test_loss: 1.3197, test_f1: 0.5470
 epoch: 62, train_loss: 0.5831, test_loss: 1.3206, test_f1: 0.5597
 epoch: 63, train_loss: 0.5815, test_loss: 1.3319, test_f1: 0.5407
 epoch: 64, train_loss: 0.5770, test_loss: 1.3958, test_f1: 0.5346
 epoch: 65, train_loss: 0.5565, test_loss: 1.3809, test_f1: 0.5357
 epoch: 66, train_loss: 0.5372, test_loss: 1.3576, test_f1: 0.5573
 epoch: 67, train_loss: 0.5447, test_loss: 1.3645, test_f1: 0.5492
 epoch: 68, train_loss: 0.5367, test_loss: 1.4957, test_f1: 0.5419
 epoch: 69, train_loss: 0.5427, test_loss: 1.4601, test_f1: 0.5607
 epoch: 70, train_loss: 0.5244, test_loss: 1.3891, test_f1: 0.5515
 epoch: 71, train_loss: 0.5218, test_loss: 1.4554, test_f1: 0.5506
 epoch: 72, train_loss: 0.5328, test_loss: 1.4781, test_f1: 0.5195
 epoch: 73, train_loss: 0.5260, test_loss: 1.4995, test_f1: 0.5295
 epoch: 74, train_loss: 0.5196, test_loss: 1.4573, test_f1: 0.5509
 epoch: 75, train_loss: 0.4897, test_loss: 1.6577, test_f1: 0.5389
 epoch: 76, train_loss: 0.5110, test_loss: 1.4947, test_f1: 0.5532
 epoch: 77, train_loss: 0.5092, test_loss: 1.4845, test_f1: 0.5701
 epoch: 78, train_loss: 0.5232, test_loss: 1.4689, test_f1: 0.5560
 epoch: 79, train_loss: 0.5159, test_loss: 1.4854, test_f1: 0.5667
 epoch: 80, train_loss: 0.5048, test_loss: 1.4670, test_f1: 0.5679
 epoch: 81, train_loss: 0.4941, test_loss: 1.5743, test_f1: 0.5459
 epoch: 82, train_loss: 0.5049, test_loss: 1.6594, test_f1: 0.5425
 epoch: 83, train_loss: 0.4902, test_loss: 1.6602, test_f1: 0.5290
 epoch: 84, train_loss: 0.4822, test_loss: 1.6661, test_f1: 0.5378
 epoch: 85, train_loss: 0.4953, test_loss: 1.5993, test_f1: 0.5475
 epoch: 86, train_loss: 0.4857, test_loss: 1.5411, test_f1: 0.5226
 epoch: 87, train_loss: 0.4682, test_loss: 1.5940, test_f1: 0.5537
 epoch: 88, train_loss: 0.4711, test_loss: 1.6389, test_f1: 0.5618
 epoch: 89, train_loss: 0.4664, test_loss: 1.5270, test_f1: 0.5830
 epoch: 90, train_loss: 0.4676, test_loss: 1.6166, test_f1: 0.5766
 epoch: 91, train_loss: 0.4608, test_loss: 1.6270, test_f1: 0.5731
 epoch: 92, train_loss: 0.4659, test_loss: 1.6392, test_f1: 0.5582
 epoch: 93, train_loss: 0.4646, test_loss: 1.6325, test_f1: 0.5713
 epoch: 94, train_loss: 0.4792, test_loss: 1.5168, test_f1: 0.5465
 epoch: 95, train_loss: 0.4648, test_loss: 1.6484, test_f1: 0.5473
 epoch: 96, train_loss: 0.4479, test_loss: 1.6549, test_f1: 0.5598
 epoch: 97, train_loss: 0.4636, test_loss: 1.6888, test_f1: 0.5454
 epoch: 98, train_loss: 0.4453, test_loss: 1.6773, test_f1: 0.5277
 epoch: 99, train_loss: 0.4396, test_loss: 1.7311, test_f1: 0.5347

Training completed in 868.45 seconds
Best F1: 0.6033 at epoch 87
Mean F1 across iterations: 0.5796  0.0130
========================FINAL RESULTS================================
FEGIN weighted F1: 0.6033  0.0130
python main.py --data ltspice_examples --representation component_component --model FEGIN --layers 6 --hiddens 64 --batch_size 64 --lr 0.001 --emb_size 512 --epochs 100 --save_appendix component_component_L6_H64_BS64_LR0.001_E512 --no_val
-----



STDERR:
  File "main.py", line 370, in <module>
    main()
  File "main.py", line 254, in main
    dataset = dataset_class(
  File "/home/philip/projects/ltspice_examples_code_repo/Circuit-Completion-Using-GNNs/component_classification_with_link_prediction_head/evaluation/FEGIN/kernel/circuit_datasets.py", line 15, in __init__
    self.data, self.slices = torch.load(self.processed_paths[0])
  File "/home/philip/.local/lib/python3.8/site-packages/torch/serialization.py", line 1040, in load
    warnings.warn(
  File "/usr/lib/python3.8/warnings.py", line 109, in _showwarnmsg
    sw(msg.message, msg.category, msg.filename, msg.lineno,
  File "main.py", line 47, in warn_with_traceback
    traceback.print_stack(file=log)
/home/philip/projects/ltspice_examples_code_repo/Circuit-Completion-Using-GNNs/component_classification_with_link_prediction_head/evaluation/FEGIN/kernel/circuit_datasets.py:15: FutureWarning: You are using `torch.load` with `weights_only=False` (the current default value), which uses the default pickle module implicitly. It is possible to construct malicious pickle data which will execute arbitrary code during unpickling (See https://github.com/pytorch/pytorch/blob/main/SECURITY.md#untrusted-models for more details). In a future release, the default value for `weights_only` will be flipped to `True`. This limits the functions that could be executed during unpickling. Arbitrary objects will no longer be allowed to be loaded via this mode unless they are explicitly allowlisted by the user via `torch.serialization.add_safe_globals`. We recommend you start setting `weights_only=True` for any use case where you don't have full control of the loaded file. Please open an issue on GitHub for any issues related to this experimental feature.
  self.data, self.slices = torch.load(self.processed_paths[0])
