STDOUT:
Results will be saved in /home/philip/projects/ltspice_examples_code_repo/Circuit-Completion-Using-GNNs/component_classification_with_link_prediction_head/evaluation/FEGIN/results/model_FEGIN_dataset_ltspice_demos
Command line input: python main.py --data ltspice_demos --representation component_net --model FEGIN --layers 5 --hiddens 16 --batch_size 256 --lr 0.001 --emb_size 512 --epochs 100 --save_appendix component_net_L5_H16_BS256_LR0.001_E512 --no_val
 is saved.
-----
ltspice_demos - FEGIN
Using 5 layers, 16 hidden units, h = 2
Loading component_net representation dataset
ENTERED
Training FEGIN on component_net representation
Train: 1565, Test: 383
##################ITERATION #0 ****************************************
 epoch: 0, train_loss: 1.4551, test_loss: 1.4354, test_f1: 0.0507
 epoch: 1, train_loss: 1.4397, test_loss: 1.4300, test_f1: 0.0507
 epoch: 2, train_loss: 1.4298, test_loss: 1.4246, test_f1: 0.0507
 epoch: 3, train_loss: 1.4205, test_loss: 1.4190, test_f1: 0.0507
 epoch: 4, train_loss: 1.4084, test_loss: 1.4132, test_f1: 0.0507
 epoch: 5, train_loss: 1.3956, test_loss: 1.4051, test_f1: 0.0876
 epoch: 6, train_loss: 1.3827, test_loss: 1.3933, test_f1: 0.1934
 epoch: 7, train_loss: 1.3634, test_loss: 1.3767, test_f1: 0.2452
 epoch: 8, train_loss: 1.3445, test_loss: 1.3594, test_f1: 0.2615
 epoch: 9, train_loss: 1.3195, test_loss: 1.3420, test_f1: 0.3025
 epoch: 10, train_loss: 1.2959, test_loss: 1.3243, test_f1: 0.3090
 epoch: 11, train_loss: 1.2653, test_loss: 1.3044, test_f1: 0.3221
 epoch: 12, train_loss: 1.2489, test_loss: 1.2808, test_f1: 0.2972
 epoch: 13, train_loss: 1.2289, test_loss: 1.2680, test_f1: 0.3084
 epoch: 14, train_loss: 1.2133, test_loss: 1.2651, test_f1: 0.3243
 epoch: 15, train_loss: 1.2032, test_loss: 1.2511, test_f1: 0.3408
 epoch: 16, train_loss: 1.1871, test_loss: 1.2496, test_f1: 0.3331
 epoch: 17, train_loss: 1.1755, test_loss: 1.2373, test_f1: 0.3286
 epoch: 18, train_loss: 1.1838, test_loss: 1.2248, test_f1: 0.3328
 epoch: 19, train_loss: 1.1709, test_loss: 1.2188, test_f1: 0.3195
 epoch: 20, train_loss: 1.1559, test_loss: 1.2147, test_f1: 0.3231
 epoch: 21, train_loss: 1.1551, test_loss: 1.2099, test_f1: 0.3274
 epoch: 22, train_loss: 1.1428, test_loss: 1.2124, test_f1: 0.3534
 epoch: 23, train_loss: 1.1367, test_loss: 1.2251, test_f1: 0.3495
 epoch: 24, train_loss: 1.1297, test_loss: 1.2000, test_f1: 0.3488
 epoch: 25, train_loss: 1.1184, test_loss: 1.1890, test_f1: 0.3489
 epoch: 26, train_loss: 1.1260, test_loss: 1.1838, test_f1: 0.3508
 epoch: 27, train_loss: 1.1293, test_loss: 1.1819, test_f1: 0.3623
 epoch: 28, train_loss: 1.1103, test_loss: 1.1823, test_f1: 0.3586
 epoch: 29, train_loss: 1.1133, test_loss: 1.1876, test_f1: 0.3851
 epoch: 30, train_loss: 1.1085, test_loss: 1.1755, test_f1: 0.3878
 epoch: 31, train_loss: 1.0992, test_loss: 1.1730, test_f1: 0.3857
 epoch: 32, train_loss: 1.1034, test_loss: 1.1745, test_f1: 0.3853
 epoch: 33, train_loss: 1.1064, test_loss: 1.1785, test_f1: 0.3769
 epoch: 34, train_loss: 1.1148, test_loss: 1.1794, test_f1: 0.3762
 epoch: 35, train_loss: 1.0904, test_loss: 1.1914, test_f1: 0.3766
 epoch: 36, train_loss: 1.0775, test_loss: 1.1908, test_f1: 0.3819
 epoch: 37, train_loss: 1.0870, test_loss: 1.1918, test_f1: 0.3703
 epoch: 38, train_loss: 1.0808, test_loss: 1.1628, test_f1: 0.3713
 epoch: 39, train_loss: 1.0790, test_loss: 1.1721, test_f1: 0.3717
 epoch: 40, train_loss: 1.0726, test_loss: 1.1813, test_f1: 0.3783
 epoch: 41, train_loss: 1.0668, test_loss: 1.1748, test_f1: 0.3855
 epoch: 42, train_loss: 1.0686, test_loss: 1.1574, test_f1: 0.4073
 epoch: 43, train_loss: 1.0576, test_loss: 1.1564, test_f1: 0.4006
 epoch: 44, train_loss: 1.0596, test_loss: 1.1556, test_f1: 0.4038
 epoch: 45, train_loss: 1.0622, test_loss: 1.1957, test_f1: 0.4065
 epoch: 46, train_loss: 1.0552, test_loss: 1.2059, test_f1: 0.4211
 epoch: 47, train_loss: 1.0493, test_loss: 1.1645, test_f1: 0.4129
 epoch: 48, train_loss: 1.0618, test_loss: 1.1479, test_f1: 0.4120
 epoch: 49, train_loss: 1.0573, test_loss: 1.1415, test_f1: 0.4166
 epoch: 50, train_loss: 1.0617, test_loss: 1.1369, test_f1: 0.4148
 epoch: 51, train_loss: 1.0554, test_loss: 1.1339, test_f1: 0.4077
 epoch: 52, train_loss: 1.0544, test_loss: 1.1235, test_f1: 0.4232
 epoch: 53, train_loss: 1.0418, test_loss: 1.1433, test_f1: 0.4212
 epoch: 54, train_loss: 1.0437, test_loss: 1.1403, test_f1: 0.4077
 epoch: 55, train_loss: 1.0447, test_loss: 1.1262, test_f1: 0.4156
 epoch: 56, train_loss: 1.0378, test_loss: 1.1412, test_f1: 0.4129
 epoch: 57, train_loss: 1.0321, test_loss: 1.1416, test_f1: 0.4304
 epoch: 58, train_loss: 1.0425, test_loss: 1.1341, test_f1: 0.4403
 epoch: 59, train_loss: 1.0328, test_loss: 1.1353, test_f1: 0.4376
 epoch: 60, train_loss: 1.0289, test_loss: 1.1458, test_f1: 0.4343
 epoch: 61, train_loss: 1.0233, test_loss: 1.1635, test_f1: 0.4306
 epoch: 62, train_loss: 1.0174, test_loss: 1.1630, test_f1: 0.4460
 epoch: 63, train_loss: 1.0264, test_loss: 1.1385, test_f1: 0.4480
 epoch: 64, train_loss: 1.0304, test_loss: 1.1336, test_f1: 0.4470
 epoch: 65, train_loss: 1.0352, test_loss: 1.1332, test_f1: 0.4323
 epoch: 66, train_loss: 1.0265, test_loss: 1.1535, test_f1: 0.4314
 epoch: 67, train_loss: 1.0298, test_loss: 1.1380, test_f1: 0.4517
 epoch: 68, train_loss: 1.0117, test_loss: 1.1391, test_f1: 0.4597
 epoch: 69, train_loss: 1.0154, test_loss: 1.1377, test_f1: 0.4550
 epoch: 70, train_loss: 1.0178, test_loss: 1.1423, test_f1: 0.4336
 epoch: 71, train_loss: 1.0151, test_loss: 1.1537, test_f1: 0.4454
 epoch: 72, train_loss: 1.0117, test_loss: 1.1641, test_f1: 0.4575
 epoch: 73, train_loss: 1.0101, test_loss: 1.1582, test_f1: 0.4529
 epoch: 74, train_loss: 1.0162, test_loss: 1.1695, test_f1: 0.4473
 epoch: 75, train_loss: 1.0175, test_loss: 1.1656, test_f1: 0.4647
 epoch: 76, train_loss: 1.0090, test_loss: 1.1688, test_f1: 0.4888
 epoch: 77, train_loss: 1.0063, test_loss: 1.1697, test_f1: 0.4997
 epoch: 78, train_loss: 1.0152, test_loss: 1.1718, test_f1: 0.5295
 epoch: 79, train_loss: 1.0060, test_loss: 1.1686, test_f1: 0.5336
 epoch: 80, train_loss: 1.0021, test_loss: 1.1852, test_f1: 0.5142
 epoch: 81, train_loss: 1.0095, test_loss: 1.1813, test_f1: 0.5289
 epoch: 82, train_loss: 1.0139, test_loss: 1.1614, test_f1: 0.5202
 epoch: 83, train_loss: 1.0075, test_loss: 1.1601, test_f1: 0.5259
 epoch: 84, train_loss: 1.0063, test_loss: 1.1683, test_f1: 0.5166
 epoch: 85, train_loss: 0.9979, test_loss: 1.1870, test_f1: 0.5140
 epoch: 86, train_loss: 0.9934, test_loss: 1.1723, test_f1: 0.5223
 epoch: 87, train_loss: 0.9978, test_loss: 1.1713, test_f1: 0.5167
 epoch: 88, train_loss: 1.0006, test_loss: 1.1670, test_f1: 0.5258
 epoch: 89, train_loss: 0.9940, test_loss: 1.1478, test_f1: 0.5232
 epoch: 90, train_loss: 0.9937, test_loss: 1.1522, test_f1: 0.5241
 epoch: 91, train_loss: 0.9829, test_loss: 1.1484, test_f1: 0.5186
 epoch: 92, train_loss: 0.9884, test_loss: 1.1445, test_f1: 0.5210
 epoch: 93, train_loss: 0.9848, test_loss: 1.1634, test_f1: 0.5332
 epoch: 94, train_loss: 0.9751, test_loss: 1.1701, test_f1: 0.5323
 epoch: 95, train_loss: 0.9886, test_loss: 1.1841, test_f1: 0.5211
 epoch: 96, train_loss: 0.9810, test_loss: 1.2150, test_f1: 0.5108
 epoch: 97, train_loss: 0.9804, test_loss: 1.2104, test_f1: 0.5136
 epoch: 98, train_loss: 0.9833, test_loss: 1.1896, test_f1: 0.5362
 epoch: 99, train_loss: 0.9797, test_loss: 1.1631, test_f1: 0.5407
##################ITERATION #1 ****************************************
 epoch: 0, train_loss: 1.3588, test_loss: 1.3674, test_f1: 0.1365
 epoch: 1, train_loss: 1.3071, test_loss: 1.3512, test_f1: 0.1365
 epoch: 2, train_loss: 1.2848, test_loss: 1.3397, test_f1: 0.1365
 epoch: 3, train_loss: 1.2559, test_loss: 1.3284, test_f1: 0.3212
 epoch: 4, train_loss: 1.2359, test_loss: 1.3161, test_f1: 0.2722
 epoch: 5, train_loss: 1.2190, test_loss: 1.3023, test_f1: 0.2722
 epoch: 6, train_loss: 1.2023, test_loss: 1.2784, test_f1: 0.2458
 epoch: 7, train_loss: 1.1884, test_loss: 1.2630, test_f1: 0.2462
 epoch: 8, train_loss: 1.1835, test_loss: 1.2508, test_f1: 0.2574
 epoch: 9, train_loss: 1.1602, test_loss: 1.2362, test_f1: 0.2302
 epoch: 10, train_loss: 1.1563, test_loss: 1.2261, test_f1: 0.2336
 epoch: 11, train_loss: 1.1498, test_loss: 1.2177, test_f1: 0.2336
 epoch: 12, train_loss: 1.1373, test_loss: 1.2084, test_f1: 0.2480
 epoch: 13, train_loss: 1.1388, test_loss: 1.2048, test_f1: 0.2621
 epoch: 14, train_loss: 1.1230, test_loss: 1.2001, test_f1: 0.3278
 epoch: 15, train_loss: 1.1179, test_loss: 1.1924, test_f1: 0.3499
 epoch: 16, train_loss: 1.1135, test_loss: 1.1859, test_f1: 0.3718
 epoch: 17, train_loss: 1.1102, test_loss: 1.1822, test_f1: 0.3825
 epoch: 18, train_loss: 1.1079, test_loss: 1.1709, test_f1: 0.3841
 epoch: 19, train_loss: 1.1012, test_loss: 1.1719, test_f1: 0.3483
 epoch: 20, train_loss: 1.0938, test_loss: 1.1706, test_f1: 0.3896
 epoch: 21, train_loss: 1.0830, test_loss: 1.1748, test_f1: 0.3893
 epoch: 22, train_loss: 1.0952, test_loss: 1.1786, test_f1: 0.4095
 epoch: 23, train_loss: 1.0815, test_loss: 1.1673, test_f1: 0.4039
 epoch: 24, train_loss: 1.0907, test_loss: 1.1520, test_f1: 0.3763
 epoch: 25, train_loss: 1.0813, test_loss: 1.1549, test_f1: 0.3934
 epoch: 26, train_loss: 1.0731, test_loss: 1.1666, test_f1: 0.3629
 epoch: 27, train_loss: 1.0684, test_loss: 1.1747, test_f1: 0.4137
 epoch: 28, train_loss: 1.0694, test_loss: 1.1699, test_f1: 0.4075
 epoch: 29, train_loss: 1.0597, test_loss: 1.1649, test_f1: 0.3934
 epoch: 30, train_loss: 1.0611, test_loss: 1.1678, test_f1: 0.4028
 epoch: 31, train_loss: 1.0432, test_loss: 1.1614, test_f1: 0.3895
 epoch: 32, train_loss: 1.0515, test_loss: 1.1691, test_f1: 0.3995
 epoch: 33, train_loss: 1.0445, test_loss: 1.1817, test_f1: 0.3985
 epoch: 34, train_loss: 1.0454, test_loss: 1.1776, test_f1: 0.3985
 epoch: 35, train_loss: 1.0365, test_loss: 1.1816, test_f1: 0.4010
 epoch: 36, train_loss: 1.0364, test_loss: 1.1912, test_f1: 0.4010
 epoch: 37, train_loss: 1.0319, test_loss: 1.1835, test_f1: 0.3918
 epoch: 38, train_loss: 1.0237, test_loss: 1.1745, test_f1: 0.3968
 epoch: 39, train_loss: 1.0292, test_loss: 1.1865, test_f1: 0.4071
 epoch: 40, train_loss: 1.0279, test_loss: 1.1973, test_f1: 0.4009
 epoch: 41, train_loss: 1.0099, test_loss: 1.2086, test_f1: 0.4162
 epoch: 42, train_loss: 1.0110, test_loss: 1.2041, test_f1: 0.4226
 epoch: 43, train_loss: 1.0148, test_loss: 1.1818, test_f1: 0.4353
 epoch: 44, train_loss: 1.0045, test_loss: 1.1681, test_f1: 0.4316
 epoch: 45, train_loss: 0.9962, test_loss: 1.1800, test_f1: 0.4244
 epoch: 46, train_loss: 1.0051, test_loss: 1.1845, test_f1: 0.4375
 epoch: 47, train_loss: 0.9991, test_loss: 1.1844, test_f1: 0.4297
 epoch: 48, train_loss: 0.9862, test_loss: 1.2098, test_f1: 0.4060
 epoch: 49, train_loss: 1.0052, test_loss: 1.2270, test_f1: 0.4058
 epoch: 50, train_loss: 0.9905, test_loss: 1.2630, test_f1: 0.4346
 epoch: 51, train_loss: 0.9994, test_loss: 1.2153, test_f1: 0.4242
 epoch: 52, train_loss: 1.0028, test_loss: 1.2099, test_f1: 0.4257
 epoch: 53, train_loss: 0.9891, test_loss: 1.1859, test_f1: 0.4371
 epoch: 54, train_loss: 0.9848, test_loss: 1.1828, test_f1: 0.4566
 epoch: 55, train_loss: 0.9838, test_loss: 1.1862, test_f1: 0.4509
 epoch: 56, train_loss: 0.9768, test_loss: 1.2012, test_f1: 0.4189
 epoch: 57, train_loss: 0.9673, test_loss: 1.2158, test_f1: 0.4234
 epoch: 58, train_loss: 0.9724, test_loss: 1.2198, test_f1: 0.4315
 epoch: 59, train_loss: 0.9694, test_loss: 1.2179, test_f1: 0.4268
 epoch: 60, train_loss: 0.9590, test_loss: 1.2063, test_f1: 0.4482
 epoch: 61, train_loss: 0.9730, test_loss: 1.2110, test_f1: 0.4336
 epoch: 62, train_loss: 0.9763, test_loss: 1.2140, test_f1: 0.4251
 epoch: 63, train_loss: 0.9675, test_loss: 1.2005, test_f1: 0.4339
 epoch: 64, train_loss: 0.9704, test_loss: 1.2015, test_f1: 0.4460
 epoch: 65, train_loss: 0.9650, test_loss: 1.1936, test_f1: 0.4472
 epoch: 66, train_loss: 0.9552, test_loss: 1.1991, test_f1: 0.4301
 epoch: 67, train_loss: 0.9571, test_loss: 1.2012, test_f1: 0.4404
 epoch: 68, train_loss: 0.9569, test_loss: 1.1926, test_f1: 0.4525
 epoch: 69, train_loss: 0.9596, test_loss: 1.1787, test_f1: 0.4552
 epoch: 70, train_loss: 0.9606, test_loss: 1.1742, test_f1: 0.4389
 epoch: 71, train_loss: 0.9549, test_loss: 1.1846, test_f1: 0.4414
 epoch: 72, train_loss: 0.9495, test_loss: 1.2047, test_f1: 0.4214
 epoch: 73, train_loss: 0.9599, test_loss: 1.2023, test_f1: 0.4168
 epoch: 74, train_loss: 0.9480, test_loss: 1.1971, test_f1: 0.4544
 epoch: 75, train_loss: 0.9517, test_loss: 1.1740, test_f1: 0.4692
 epoch: 76, train_loss: 0.9542, test_loss: 1.1785, test_f1: 0.4648
 epoch: 77, train_loss: 0.9499, test_loss: 1.1725, test_f1: 0.4671
 epoch: 78, train_loss: 0.9455, test_loss: 1.1847, test_f1: 0.4663
 epoch: 79, train_loss: 0.9496, test_loss: 1.2041, test_f1: 0.4472
 epoch: 80, train_loss: 0.9505, test_loss: 1.1831, test_f1: 0.4659
 epoch: 81, train_loss: 0.9371, test_loss: 1.1960, test_f1: 0.4558
 epoch: 82, train_loss: 0.9520, test_loss: 1.2034, test_f1: 0.4674
 epoch: 83, train_loss: 0.9417, test_loss: 1.1795, test_f1: 0.4535
 epoch: 84, train_loss: 0.9523, test_loss: 1.1772, test_f1: 0.4550
 epoch: 85, train_loss: 0.9348, test_loss: 1.1773, test_f1: 0.4548
 epoch: 86, train_loss: 0.9284, test_loss: 1.1849, test_f1: 0.4640
 epoch: 87, train_loss: 0.9388, test_loss: 1.1841, test_f1: 0.4642
 epoch: 88, train_loss: 0.9305, test_loss: 1.1834, test_f1: 0.4621
 epoch: 89, train_loss: 0.9385, test_loss: 1.1822, test_f1: 0.4463
 epoch: 90, train_loss: 0.9375, test_loss: 1.1730, test_f1: 0.4577
 epoch: 91, train_loss: 0.9406, test_loss: 1.1714, test_f1: 0.4596
 epoch: 92, train_loss: 0.9307, test_loss: 1.1502, test_f1: 0.4893
 epoch: 93, train_loss: 0.9255, test_loss: 1.1656, test_f1: 0.4782
 epoch: 94, train_loss: 0.9223, test_loss: 1.1926, test_f1: 0.4821
 epoch: 95, train_loss: 0.9343, test_loss: 1.2031, test_f1: 0.4831
 epoch: 96, train_loss: 0.9213, test_loss: 1.1747, test_f1: 0.4890
 epoch: 97, train_loss: 0.9203, test_loss: 1.1733, test_f1: 0.4917
 epoch: 98, train_loss: 0.9171, test_loss: 1.1878, test_f1: 0.4944
 epoch: 99, train_loss: 0.9204, test_loss: 1.2224, test_f1: 0.4791
##################ITERATION #2 ****************************************
 epoch: 0, train_loss: 1.3149, test_loss: 1.3493, test_f1: 0.2281
 epoch: 1, train_loss: 1.2486, test_loss: 1.3388, test_f1: 0.2281
 epoch: 2, train_loss: 1.2199, test_loss: 1.3300, test_f1: 0.2281
 epoch: 3, train_loss: 1.2034, test_loss: 1.3162, test_f1: 0.2281
 epoch: 4, train_loss: 1.1916, test_loss: 1.3032, test_f1: 0.2281
 epoch: 5, train_loss: 1.1710, test_loss: 1.2926, test_f1: 0.2281
 epoch: 6, train_loss: 1.1586, test_loss: 1.2772, test_f1: 0.2281
 epoch: 7, train_loss: 1.1452, test_loss: 1.2596, test_f1: 0.2723
 epoch: 8, train_loss: 1.1389, test_loss: 1.2273, test_f1: 0.3092
 epoch: 9, train_loss: 1.1377, test_loss: 1.2099, test_f1: 0.3493
 epoch: 10, train_loss: 1.1210, test_loss: 1.2075, test_f1: 0.3753
 epoch: 11, train_loss: 1.1279, test_loss: 1.2235, test_f1: 0.3932
 epoch: 12, train_loss: 1.1131, test_loss: 1.2594, test_f1: 0.3854
 epoch: 13, train_loss: 1.1122, test_loss: 1.2310, test_f1: 0.4407
 epoch: 14, train_loss: 1.1097, test_loss: 1.2013, test_f1: 0.4284
 epoch: 15, train_loss: 1.0920, test_loss: 1.1904, test_f1: 0.4278
 epoch: 16, train_loss: 1.0880, test_loss: 1.2011, test_f1: 0.4076
 epoch: 17, train_loss: 1.0798, test_loss: 1.2272, test_f1: 0.4067
 epoch: 18, train_loss: 1.0883, test_loss: 1.1913, test_f1: 0.4158
 epoch: 19, train_loss: 1.0713, test_loss: 1.1859, test_f1: 0.4264
 epoch: 20, train_loss: 1.0812, test_loss: 1.1778, test_f1: 0.4235
 epoch: 21, train_loss: 1.0721, test_loss: 1.1994, test_f1: 0.4306
 epoch: 22, train_loss: 1.0591, test_loss: 1.1823, test_f1: 0.4397
 epoch: 23, train_loss: 1.0612, test_loss: 1.1800, test_f1: 0.4317
 epoch: 24, train_loss: 1.0492, test_loss: 1.1871, test_f1: 0.4424
 epoch: 25, train_loss: 1.0535, test_loss: 1.2066, test_f1: 0.4302
 epoch: 26, train_loss: 1.0641, test_loss: 1.1995, test_f1: 0.4471
 epoch: 27, train_loss: 1.0492, test_loss: 1.1880, test_f1: 0.4352
 epoch: 28, train_loss: 1.0458, test_loss: 1.1856, test_f1: 0.4383
 epoch: 29, train_loss: 1.0434, test_loss: 1.1833, test_f1: 0.4060
 epoch: 30, train_loss: 1.0382, test_loss: 1.1789, test_f1: 0.4220
 epoch: 31, train_loss: 1.0446, test_loss: 1.1962, test_f1: 0.3911
 epoch: 32, train_loss: 1.0337, test_loss: 1.1911, test_f1: 0.4515
 epoch: 33, train_loss: 1.0369, test_loss: 1.1895, test_f1: 0.4439
 epoch: 34, train_loss: 1.0171, test_loss: 1.2155, test_f1: 0.4342
 epoch: 35, train_loss: 1.0236, test_loss: 1.2221, test_f1: 0.4545
 epoch: 36, train_loss: 1.0283, test_loss: 1.2401, test_f1: 0.4471
 epoch: 37, train_loss: 1.0303, test_loss: 1.3017, test_f1: 0.4419
 epoch: 38, train_loss: 1.0220, test_loss: 1.2998, test_f1: 0.3900
 epoch: 39, train_loss: 1.0218, test_loss: 1.2550, test_f1: 0.4402
 epoch: 40, train_loss: 1.0180, test_loss: 1.2652, test_f1: 0.4174
 epoch: 41, train_loss: 1.0070, test_loss: 1.3014, test_f1: 0.4124
 epoch: 42, train_loss: 1.0010, test_loss: 1.2451, test_f1: 0.4382
 epoch: 43, train_loss: 1.0029, test_loss: 1.2277, test_f1: 0.4400
 epoch: 44, train_loss: 1.0021, test_loss: 1.2100, test_f1: 0.4343
 epoch: 45, train_loss: 1.0001, test_loss: 1.1948, test_f1: 0.4218
 epoch: 46, train_loss: 0.9949, test_loss: 1.1888, test_f1: 0.4178
 epoch: 47, train_loss: 1.0089, test_loss: 1.1731, test_f1: 0.4480
 epoch: 48, train_loss: 1.0048, test_loss: 1.2422, test_f1: 0.4363
 epoch: 49, train_loss: 1.0081, test_loss: 1.2860, test_f1: 0.3955
 epoch: 50, train_loss: 1.0025, test_loss: 1.2384, test_f1: 0.4263
 epoch: 51, train_loss: 0.9965, test_loss: 1.2140, test_f1: 0.4360
 epoch: 52, train_loss: 0.9958, test_loss: 1.1658, test_f1: 0.4465
 epoch: 53, train_loss: 0.9874, test_loss: 1.1673, test_f1: 0.4494
 epoch: 54, train_loss: 0.9822, test_loss: 1.1618, test_f1: 0.4542
 epoch: 55, train_loss: 0.9901, test_loss: 1.1616, test_f1: 0.4492
 epoch: 56, train_loss: 0.9923, test_loss: 1.1699, test_f1: 0.4380
 epoch: 57, train_loss: 0.9850, test_loss: 1.1615, test_f1: 0.4389
 epoch: 58, train_loss: 0.9848, test_loss: 1.1771, test_f1: 0.4489
 epoch: 59, train_loss: 0.9774, test_loss: 1.1779, test_f1: 0.4402
 epoch: 60, train_loss: 0.9767, test_loss: 1.1769, test_f1: 0.4439
 epoch: 61, train_loss: 0.9675, test_loss: 1.1813, test_f1: 0.4515
 epoch: 62, train_loss: 0.9705, test_loss: 1.1803, test_f1: 0.4571
 epoch: 63, train_loss: 0.9730, test_loss: 1.2173, test_f1: 0.4500
 epoch: 64, train_loss: 0.9714, test_loss: 1.2237, test_f1: 0.4579
 epoch: 65, train_loss: 0.9598, test_loss: 1.1933, test_f1: 0.4580
 epoch: 66, train_loss: 0.9635, test_loss: 1.1847, test_f1: 0.4676
 epoch: 67, train_loss: 0.9599, test_loss: 1.1915, test_f1: 0.4554
 epoch: 68, train_loss: 0.9520, test_loss: 1.1953, test_f1: 0.4654
 epoch: 69, train_loss: 0.9550, test_loss: 1.2066, test_f1: 0.4726
 epoch: 70, train_loss: 0.9528, test_loss: 1.1990, test_f1: 0.4679
 epoch: 71, train_loss: 0.9508, test_loss: 1.1895, test_f1: 0.4547
 epoch: 72, train_loss: 0.9555, test_loss: 1.2187, test_f1: 0.4531
 epoch: 73, train_loss: 0.9547, test_loss: 1.2221, test_f1: 0.4492
 epoch: 74, train_loss: 0.9517, test_loss: 1.1954, test_f1: 0.4647
 epoch: 75, train_loss: 0.9482, test_loss: 1.2019, test_f1: 0.4469
 epoch: 76, train_loss: 0.9432, test_loss: 1.1967, test_f1: 0.4496
 epoch: 77, train_loss: 0.9557, test_loss: 1.1817, test_f1: 0.4547
 epoch: 78, train_loss: 0.9451, test_loss: 1.1796, test_f1: 0.4368
 epoch: 79, train_loss: 0.9595, test_loss: 1.2106, test_f1: 0.4341
 epoch: 80, train_loss: 0.9443, test_loss: 1.2161, test_f1: 0.4621
 epoch: 81, train_loss: 0.9420, test_loss: 1.2175, test_f1: 0.4483
 epoch: 82, train_loss: 0.9452, test_loss: 1.2280, test_f1: 0.4450
 epoch: 83, train_loss: 0.9479, test_loss: 1.2546, test_f1: 0.4463
 epoch: 84, train_loss: 0.9449, test_loss: 1.2439, test_f1: 0.4548
 epoch: 85, train_loss: 0.9456, test_loss: 1.2629, test_f1: 0.4613
 epoch: 86, train_loss: 0.9427, test_loss: 1.2720, test_f1: 0.4479
 epoch: 87, train_loss: 0.9510, test_loss: 1.2735, test_f1: 0.4536
 epoch: 88, train_loss: 0.9363, test_loss: 1.2869, test_f1: 0.4465
 epoch: 89, train_loss: 0.9360, test_loss: 1.2499, test_f1: 0.4455
 epoch: 90, train_loss: 0.9324, test_loss: 1.2468, test_f1: 0.4369
 epoch: 91, train_loss: 0.9498, test_loss: 1.2594, test_f1: 0.4383
 epoch: 92, train_loss: 0.9414, test_loss: 1.3577, test_f1: 0.4601
 epoch: 93, train_loss: 0.9343, test_loss: 1.2942, test_f1: 0.4575
 epoch: 94, train_loss: 0.9363, test_loss: 1.2594, test_f1: 0.4677
 epoch: 95, train_loss: 0.9239, test_loss: 1.2391, test_f1: 0.4717
 epoch: 96, train_loss: 0.9248, test_loss: 1.2275, test_f1: 0.4648
 epoch: 97, train_loss: 0.9376, test_loss: 1.2426, test_f1: 0.4581
 epoch: 98, train_loss: 0.9277, test_loss: 1.2631, test_f1: 0.4661
 epoch: 99, train_loss: 0.9167, test_loss: 1.2704, test_f1: 0.4643
##################ITERATION #3 ****************************************
 epoch: 0, train_loss: 1.3203, test_loss: 1.3136, test_f1: 0.2281
 epoch: 1, train_loss: 1.2178, test_loss: 1.3011, test_f1: 0.2281
 epoch: 2, train_loss: 1.1879, test_loss: 1.2968, test_f1: 0.2281
 epoch: 3, train_loss: 1.1721, test_loss: 1.2913, test_f1: 0.2281
 epoch: 4, train_loss: 1.1484, test_loss: 1.2828, test_f1: 0.2281
 epoch: 5, train_loss: 1.1401, test_loss: 1.2655, test_f1: 0.2441
 epoch: 6, train_loss: 1.1239, test_loss: 1.2350, test_f1: 0.2735
 epoch: 7, train_loss: 1.1110, test_loss: 1.2118, test_f1: 0.2809
 epoch: 8, train_loss: 1.1160, test_loss: 1.1845, test_f1: 0.2870
 epoch: 9, train_loss: 1.0948, test_loss: 1.1627, test_f1: 0.3166
 epoch: 10, train_loss: 1.1052, test_loss: 1.1527, test_f1: 0.4007
 epoch: 11, train_loss: 1.0874, test_loss: 1.1449, test_f1: 0.4359
 epoch: 12, train_loss: 1.0786, test_loss: 1.1380, test_f1: 0.4488
 epoch: 13, train_loss: 1.0728, test_loss: 1.1317, test_f1: 0.4469
 epoch: 14, train_loss: 1.0635, test_loss: 1.1332, test_f1: 0.4313
 epoch: 15, train_loss: 1.0634, test_loss: 1.1084, test_f1: 0.4212
 epoch: 16, train_loss: 1.0660, test_loss: 1.1031, test_f1: 0.4072
 epoch: 17, train_loss: 1.0452, test_loss: 1.0947, test_f1: 0.4404
 epoch: 18, train_loss: 1.0446, test_loss: 1.0985, test_f1: 0.4448
 epoch: 19, train_loss: 1.0339, test_loss: 1.1329, test_f1: 0.4423
 epoch: 20, train_loss: 1.0409, test_loss: 1.1752, test_f1: 0.4424
 epoch: 21, train_loss: 1.0217, test_loss: 1.1721, test_f1: 0.4294
 epoch: 22, train_loss: 1.0195, test_loss: 1.1723, test_f1: 0.4048
 epoch: 23, train_loss: 1.0219, test_loss: 1.1435, test_f1: 0.4220
 epoch: 24, train_loss: 1.0218, test_loss: 1.1388, test_f1: 0.4565
 epoch: 25, train_loss: 1.0130, test_loss: 1.1047, test_f1: 0.4533
 epoch: 26, train_loss: 1.0038, test_loss: 1.0980, test_f1: 0.4606
 epoch: 27, train_loss: 1.0012, test_loss: 1.0992, test_f1: 0.4450
 epoch: 28, train_loss: 0.9925, test_loss: 1.1331, test_f1: 0.4450
 epoch: 29, train_loss: 0.9949, test_loss: 1.0773, test_f1: 0.4479
 epoch: 30, train_loss: 0.9827, test_loss: 1.0487, test_f1: 0.4361
 epoch: 31, train_loss: 0.9869, test_loss: 1.0600, test_f1: 0.4320
 epoch: 32, train_loss: 0.9864, test_loss: 1.0624, test_f1: 0.4317
 epoch: 33, train_loss: 0.9743, test_loss: 1.0790, test_f1: 0.4416
 epoch: 34, train_loss: 0.9723, test_loss: 1.0895, test_f1: 0.4317
 epoch: 35, train_loss: 0.9702, test_loss: 1.0649, test_f1: 0.4318
 epoch: 36, train_loss: 0.9700, test_loss: 1.0879, test_f1: 0.4555
 epoch: 37, train_loss: 0.9776, test_loss: 1.1039, test_f1: 0.4564
 epoch: 38, train_loss: 0.9741, test_loss: 1.0939, test_f1: 0.4522
 epoch: 39, train_loss: 0.9613, test_loss: 1.0769, test_f1: 0.4538
 epoch: 40, train_loss: 0.9623, test_loss: 1.0704, test_f1: 0.4622
 epoch: 41, train_loss: 0.9589, test_loss: 1.0519, test_f1: 0.4711
 epoch: 42, train_loss: 0.9444, test_loss: 1.0584, test_f1: 0.4806
 epoch: 43, train_loss: 0.9502, test_loss: 1.0713, test_f1: 0.4745
 epoch: 44, train_loss: 0.9460, test_loss: 1.0948, test_f1: 0.4748
 epoch: 45, train_loss: 0.9367, test_loss: 1.0732, test_f1: 0.4690
 epoch: 46, train_loss: 0.9304, test_loss: 1.0594, test_f1: 0.4497
 epoch: 47, train_loss: 0.9388, test_loss: 1.0608, test_f1: 0.4399
 epoch: 48, train_loss: 0.9290, test_loss: 1.0883, test_f1: 0.4483
 epoch: 49, train_loss: 0.9377, test_loss: 1.1006, test_f1: 0.4648
 epoch: 50, train_loss: 0.9328, test_loss: 1.1033, test_f1: 0.4852
 epoch: 51, train_loss: 0.9188, test_loss: 1.0998, test_f1: 0.4919
 epoch: 52, train_loss: 0.9119, test_loss: 1.0796, test_f1: 0.4970
 epoch: 53, train_loss: 0.9245, test_loss: 1.0660, test_f1: 0.4901
 epoch: 54, train_loss: 0.9137, test_loss: 1.0833, test_f1: 0.4978
 epoch: 55, train_loss: 0.9194, test_loss: 1.0948, test_f1: 0.4945
 epoch: 56, train_loss: 0.9117, test_loss: 1.0798, test_f1: 0.4858
 epoch: 57, train_loss: 0.9088, test_loss: 1.0939, test_f1: 0.4633
 epoch: 58, train_loss: 0.9184, test_loss: 1.0812, test_f1: 0.4765
 epoch: 59, train_loss: 0.9034, test_loss: 1.0893, test_f1: 0.4923
 epoch: 60, train_loss: 0.9163, test_loss: 1.0931, test_f1: 0.4949
 epoch: 61, train_loss: 0.9076, test_loss: 1.0893, test_f1: 0.4989
 epoch: 62, train_loss: 0.9147, test_loss: 1.0951, test_f1: 0.4887
 epoch: 63, train_loss: 0.9079, test_loss: 1.1021, test_f1: 0.5027
 epoch: 64, train_loss: 0.9016, test_loss: 1.0961, test_f1: 0.4935
 epoch: 65, train_loss: 0.8990, test_loss: 1.0921, test_f1: 0.4631
 epoch: 66, train_loss: 0.9119, test_loss: 1.0998, test_f1: 0.4833
 epoch: 67, train_loss: 0.9214, test_loss: 1.0625, test_f1: 0.4905
 epoch: 68, train_loss: 0.9035, test_loss: 1.1030, test_f1: 0.5118
 epoch: 69, train_loss: 0.9108, test_loss: 1.1056, test_f1: 0.5312
 epoch: 70, train_loss: 0.9117, test_loss: 1.1205, test_f1: 0.5104
 epoch: 71, train_loss: 0.9102, test_loss: 1.1176, test_f1: 0.5089
 epoch: 72, train_loss: 0.8922, test_loss: 1.1255, test_f1: 0.5129
 epoch: 73, train_loss: 0.8875, test_loss: 1.1254, test_f1: 0.5085
 epoch: 74, train_loss: 0.8914, test_loss: 1.1186, test_f1: 0.5073
 epoch: 75, train_loss: 0.8885, test_loss: 1.1118, test_f1: 0.5162
 epoch: 76, train_loss: 0.9017, test_loss: 1.1094, test_f1: 0.5053
 epoch: 77, train_loss: 0.8992, test_loss: 1.1077, test_f1: 0.5194
 epoch: 78, train_loss: 0.8958, test_loss: 1.1029, test_f1: 0.5309
 epoch: 79, train_loss: 0.8931, test_loss: 1.0857, test_f1: 0.5438
 epoch: 80, train_loss: 0.8952, test_loss: 1.1007, test_f1: 0.5415
 epoch: 81, train_loss: 0.8885, test_loss: 1.1152, test_f1: 0.5255
 epoch: 82, train_loss: 0.8870, test_loss: 1.1193, test_f1: 0.5289
 epoch: 83, train_loss: 0.8869, test_loss: 1.1564, test_f1: 0.5203
 epoch: 84, train_loss: 0.8858, test_loss: 1.1300, test_f1: 0.5423
 epoch: 85, train_loss: 0.8822, test_loss: 1.1132, test_f1: 0.5395
 epoch: 86, train_loss: 0.8894, test_loss: 1.1348, test_f1: 0.5372
 epoch: 87, train_loss: 0.8969, test_loss: 1.1213, test_f1: 0.5435
 epoch: 88, train_loss: 0.8826, test_loss: 1.1266, test_f1: 0.5542
 epoch: 89, train_loss: 0.8821, test_loss: 1.1206, test_f1: 0.5434
 epoch: 90, train_loss: 0.8814, test_loss: 1.1211, test_f1: 0.5340
 epoch: 91, train_loss: 0.8822, test_loss: 1.1461, test_f1: 0.5129
 epoch: 92, train_loss: 0.8886, test_loss: 1.1531, test_f1: 0.5065
 epoch: 93, train_loss: 0.8839, test_loss: 1.1392, test_f1: 0.5276
 epoch: 94, train_loss: 0.8803, test_loss: 1.1222, test_f1: 0.5281
 epoch: 95, train_loss: 0.8810, test_loss: 1.1281, test_f1: 0.5128
 epoch: 96, train_loss: 0.8775, test_loss: 1.1365, test_f1: 0.5182
 epoch: 97, train_loss: 0.8805, test_loss: 1.1425, test_f1: 0.5195
 epoch: 98, train_loss: 0.8739, test_loss: 1.1143, test_f1: 0.5124
 epoch: 99, train_loss: 0.8703, test_loss: 1.1231, test_f1: 0.5276
##################ITERATION #4 ****************************************
 epoch: 0, train_loss: 1.3026, test_loss: 1.3128, test_f1: 0.2281
 epoch: 1, train_loss: 1.2384, test_loss: 1.3077, test_f1: 0.2281
 epoch: 2, train_loss: 1.2171, test_loss: 1.3025, test_f1: 0.2281
 epoch: 3, train_loss: 1.2010, test_loss: 1.2942, test_f1: 0.2281
 epoch: 4, train_loss: 1.1761, test_loss: 1.2864, test_f1: 0.2281
 epoch: 5, train_loss: 1.1667, test_loss: 1.2779, test_f1: 0.2281
 epoch: 6, train_loss: 1.1411, test_loss: 1.2579, test_f1: 0.2392
 epoch: 7, train_loss: 1.1350, test_loss: 1.2420, test_f1: 0.2722
 epoch: 8, train_loss: 1.1249, test_loss: 1.2161, test_f1: 0.2910
 epoch: 9, train_loss: 1.1179, test_loss: 1.1844, test_f1: 0.2974
 epoch: 10, train_loss: 1.0912, test_loss: 1.1762, test_f1: 0.3073
 epoch: 11, train_loss: 1.1086, test_loss: 1.1762, test_f1: 0.3197
 epoch: 12, train_loss: 1.0989, test_loss: 1.1648, test_f1: 0.3160
 epoch: 13, train_loss: 1.0911, test_loss: 1.1537, test_f1: 0.3627
 epoch: 14, train_loss: 1.1005, test_loss: 1.1459, test_f1: 0.3854
 epoch: 15, train_loss: 1.0864, test_loss: 1.1582, test_f1: 0.3708
 epoch: 16, train_loss: 1.0865, test_loss: 1.1675, test_f1: 0.3667
 epoch: 17, train_loss: 1.0924, test_loss: 1.1587, test_f1: 0.3672
 epoch: 18, train_loss: 1.0762, test_loss: 1.1531, test_f1: 0.3591
 epoch: 19, train_loss: 1.0627, test_loss: 1.1433, test_f1: 0.3686
 epoch: 20, train_loss: 1.0521, test_loss: 1.1325, test_f1: 0.3734
 epoch: 21, train_loss: 1.0451, test_loss: 1.1306, test_f1: 0.3753
 epoch: 22, train_loss: 1.0545, test_loss: 1.1243, test_f1: 0.3836
 epoch: 23, train_loss: 1.0541, test_loss: 1.1255, test_f1: 0.4195
 epoch: 24, train_loss: 1.0522, test_loss: 1.1192, test_f1: 0.4114
 epoch: 25, train_loss: 1.0372, test_loss: 1.1095, test_f1: 0.4630
 epoch: 26, train_loss: 1.0347, test_loss: 1.1025, test_f1: 0.4383
 epoch: 27, train_loss: 1.0335, test_loss: 1.0953, test_f1: 0.4620
 epoch: 28, train_loss: 1.0460, test_loss: 1.0915, test_f1: 0.4167
 epoch: 29, train_loss: 1.0241, test_loss: 1.0953, test_f1: 0.4071
 epoch: 30, train_loss: 1.0385, test_loss: 1.0973, test_f1: 0.4582
 epoch: 31, train_loss: 1.0200, test_loss: 1.0984, test_f1: 0.4337
 epoch: 32, train_loss: 1.0141, test_loss: 1.1152, test_f1: 0.4065
 epoch: 33, train_loss: 1.0264, test_loss: 1.1195, test_f1: 0.4001
 epoch: 34, train_loss: 1.0177, test_loss: 1.1106, test_f1: 0.3882
 epoch: 35, train_loss: 1.0039, test_loss: 1.1136, test_f1: 0.4061
 epoch: 36, train_loss: 1.0126, test_loss: 1.1294, test_f1: 0.3896
 epoch: 37, train_loss: 1.0151, test_loss: 1.1068, test_f1: 0.4180
 epoch: 38, train_loss: 1.0186, test_loss: 1.1204, test_f1: 0.4449
 epoch: 39, train_loss: 1.0104, test_loss: 1.1104, test_f1: 0.4439
 epoch: 40, train_loss: 0.9938, test_loss: 1.1140, test_f1: 0.4467
 epoch: 41, train_loss: 1.0089, test_loss: 1.0979, test_f1: 0.4680
 epoch: 42, train_loss: 0.9917, test_loss: 1.1033, test_f1: 0.4774
 epoch: 43, train_loss: 0.9782, test_loss: 1.0873, test_f1: 0.4575
 epoch: 44, train_loss: 0.9827, test_loss: 1.0733, test_f1: 0.4508
 epoch: 45, train_loss: 0.9719, test_loss: 1.0687, test_f1: 0.4421
 epoch: 46, train_loss: 0.9752, test_loss: 1.0624, test_f1: 0.4481
 epoch: 47, train_loss: 0.9775, test_loss: 1.0814, test_f1: 0.4464
 epoch: 48, train_loss: 0.9822, test_loss: 1.1088, test_f1: 0.4139
 epoch: 49, train_loss: 0.9788, test_loss: 1.0883, test_f1: 0.4312
 epoch: 50, train_loss: 0.9829, test_loss: 1.0930, test_f1: 0.4594
 epoch: 51, train_loss: 0.9767, test_loss: 1.0938, test_f1: 0.4711
 epoch: 52, train_loss: 0.9737, test_loss: 1.0890, test_f1: 0.4542
 epoch: 53, train_loss: 0.9659, test_loss: 1.0916, test_f1: 0.4575
 epoch: 54, train_loss: 0.9635, test_loss: 1.1023, test_f1: 0.4748
 epoch: 55, train_loss: 0.9709, test_loss: 1.1004, test_f1: 0.4684
 epoch: 56, train_loss: 0.9626, test_loss: 1.1004, test_f1: 0.4678
 epoch: 57, train_loss: 0.9603, test_loss: 1.0879, test_f1: 0.4717
 epoch: 58, train_loss: 0.9567, test_loss: 1.0879, test_f1: 0.4731
 epoch: 59, train_loss: 0.9540, test_loss: 1.0793, test_f1: 0.4839
 epoch: 60, train_loss: 0.9529, test_loss: 1.0741, test_f1: 0.4839
 epoch: 61, train_loss: 0.9625, test_loss: 1.0944, test_f1: 0.4294
 epoch: 62, train_loss: 0.9495, test_loss: 1.1140, test_f1: 0.4756
 epoch: 63, train_loss: 0.9539, test_loss: 1.1196, test_f1: 0.4938
 epoch: 64, train_loss: 0.9453, test_loss: 1.0998, test_f1: 0.4892
 epoch: 65, train_loss: 0.9552, test_loss: 1.0973, test_f1: 0.4839
 epoch: 66, train_loss: 0.9529, test_loss: 1.0855, test_f1: 0.4892
 epoch: 67, train_loss: 0.9439, test_loss: 1.0896, test_f1: 0.4825
 epoch: 68, train_loss: 0.9526, test_loss: 1.0922, test_f1: 0.4834
 epoch: 69, train_loss: 0.9470, test_loss: 1.0827, test_f1: 0.4814
 epoch: 70, train_loss: 0.9411, test_loss: 1.0794, test_f1: 0.4921
 epoch: 71, train_loss: 0.9445, test_loss: 1.0878, test_f1: 0.4857
 epoch: 72, train_loss: 0.9356, test_loss: 1.1122, test_f1: 0.4768
 epoch: 73, train_loss: 0.9370, test_loss: 1.1353, test_f1: 0.4845
 epoch: 74, train_loss: 0.9506, test_loss: 1.1266, test_f1: 0.4804
 epoch: 75, train_loss: 0.9408, test_loss: 1.1189, test_f1: 0.4910
 epoch: 76, train_loss: 0.9255, test_loss: 1.1025, test_f1: 0.5130
 epoch: 77, train_loss: 0.9292, test_loss: 1.0931, test_f1: 0.5106
 epoch: 78, train_loss: 0.9290, test_loss: 1.0848, test_f1: 0.5130
 epoch: 79, train_loss: 0.9366, test_loss: 1.0881, test_f1: 0.5036
 epoch: 80, train_loss: 0.9379, test_loss: 1.1019, test_f1: 0.5108
 epoch: 81, train_loss: 0.9315, test_loss: 1.1146, test_f1: 0.5140
 epoch: 82, train_loss: 0.9289, test_loss: 1.1173, test_f1: 0.5176
 epoch: 83, train_loss: 0.9232, test_loss: 1.1108, test_f1: 0.5249
 epoch: 84, train_loss: 0.9175, test_loss: 1.0940, test_f1: 0.5113
 epoch: 85, train_loss: 0.9229, test_loss: 1.0974, test_f1: 0.5221
 epoch: 86, train_loss: 0.9189, test_loss: 1.1107, test_f1: 0.5181
 epoch: 87, train_loss: 0.9238, test_loss: 1.1170, test_f1: 0.5256
 epoch: 88, train_loss: 0.9204, test_loss: 1.1240, test_f1: 0.5164
 epoch: 89, train_loss: 0.9168, test_loss: 1.1507, test_f1: 0.5259
 epoch: 90, train_loss: 0.9077, test_loss: 1.1502, test_f1: 0.5205
 epoch: 91, train_loss: 0.9216, test_loss: 1.1208, test_f1: 0.5173
 epoch: 92, train_loss: 0.9034, test_loss: 1.1065, test_f1: 0.5152
 epoch: 93, train_loss: 0.9216, test_loss: 1.1051, test_f1: 0.5224
 epoch: 94, train_loss: 0.9254, test_loss: 1.1365, test_f1: 0.5047
 epoch: 95, train_loss: 0.9165, test_loss: 1.1298, test_f1: 0.5176
 epoch: 96, train_loss: 0.9083, test_loss: 1.1133, test_f1: 0.5264
 epoch: 97, train_loss: 0.9073, test_loss: 1.0975, test_f1: 0.5234
 epoch: 98, train_loss: 0.9165, test_loss: 1.0916, test_f1: 0.5195
 epoch: 99, train_loss: 0.9151, test_loss: 1.0947, test_f1: 0.5223
##################ITERATION #5 ****************************************
 epoch: 0, train_loss: 1.2644, test_loss: 1.3192, test_f1: 0.2281
 epoch: 1, train_loss: 1.2065, test_loss: 1.3083, test_f1: 0.2281
 epoch: 2, train_loss: 1.1804, test_loss: 1.3056, test_f1: 0.2281
 epoch: 3, train_loss: 1.1541, test_loss: 1.3028, test_f1: 0.2281
 epoch: 4, train_loss: 1.1503, test_loss: 1.2855, test_f1: 0.2585
 epoch: 5, train_loss: 1.1434, test_loss: 1.2800, test_f1: 0.2749
 epoch: 6, train_loss: 1.1348, test_loss: 1.2468, test_f1: 0.2883
 epoch: 7, train_loss: 1.1251, test_loss: 1.2278, test_f1: 0.3501
 epoch: 8, train_loss: 1.1086, test_loss: 1.2143, test_f1: 0.3709
 epoch: 9, train_loss: 1.0995, test_loss: 1.1970, test_f1: 0.3930
 epoch: 10, train_loss: 1.0986, test_loss: 1.1724, test_f1: 0.3932
 epoch: 11, train_loss: 1.0966, test_loss: 1.1598, test_f1: 0.4009
 epoch: 12, train_loss: 1.0971, test_loss: 1.1521, test_f1: 0.3903
 epoch: 13, train_loss: 1.0792, test_loss: 1.1483, test_f1: 0.4009
 epoch: 14, train_loss: 1.0789, test_loss: 1.1494, test_f1: 0.4018
 epoch: 15, train_loss: 1.0619, test_loss: 1.1490, test_f1: 0.4335
 epoch: 16, train_loss: 1.0660, test_loss: 1.1145, test_f1: 0.4188
 epoch: 17, train_loss: 1.0599, test_loss: 1.1173, test_f1: 0.4141
 epoch: 18, train_loss: 1.0772, test_loss: 1.1243, test_f1: 0.4262
 epoch: 19, train_loss: 1.0682, test_loss: 1.1352, test_f1: 0.4269
 epoch: 20, train_loss: 1.0554, test_loss: 1.1200, test_f1: 0.4206
 epoch: 21, train_loss: 1.0444, test_loss: 1.1292, test_f1: 0.4266
 epoch: 22, train_loss: 1.0449, test_loss: 1.1185, test_f1: 0.4329
 epoch: 23, train_loss: 1.0540, test_loss: 1.1266, test_f1: 0.4110
 epoch: 24, train_loss: 1.0396, test_loss: 1.1328, test_f1: 0.4375
 epoch: 25, train_loss: 1.0510, test_loss: 1.1603, test_f1: 0.4357
 epoch: 26, train_loss: 1.0485, test_loss: 1.1128, test_f1: 0.4444
 epoch: 27, train_loss: 1.0467, test_loss: 1.0969, test_f1: 0.4554
 epoch: 28, train_loss: 1.0522, test_loss: 1.1172, test_f1: 0.4394
 epoch: 29, train_loss: 1.0415, test_loss: 1.1141, test_f1: 0.4318
 epoch: 30, train_loss: 1.0477, test_loss: 1.1154, test_f1: 0.4228
 epoch: 31, train_loss: 1.0417, test_loss: 1.1069, test_f1: 0.4311
 epoch: 32, train_loss: 1.0229, test_loss: 1.1118, test_f1: 0.4321
 epoch: 33, train_loss: 1.0285, test_loss: 1.1007, test_f1: 0.4233
 epoch: 34, train_loss: 1.0322, test_loss: 1.1099, test_f1: 0.3984
 epoch: 35, train_loss: 1.0226, test_loss: 1.1086, test_f1: 0.4274
 epoch: 36, train_loss: 1.0201, test_loss: 1.1034, test_f1: 0.4390
 epoch: 37, train_loss: 1.0204, test_loss: 1.0894, test_f1: 0.4565
 epoch: 38, train_loss: 1.0266, test_loss: 1.1251, test_f1: 0.4224
 epoch: 39, train_loss: 1.0290, test_loss: 1.1225, test_f1: 0.4239
 epoch: 40, train_loss: 1.0144, test_loss: 1.1356, test_f1: 0.4262
 epoch: 41, train_loss: 1.0123, test_loss: 1.1408, test_f1: 0.4279
 epoch: 42, train_loss: 1.0097, test_loss: 1.1241, test_f1: 0.4521
 epoch: 43, train_loss: 1.0234, test_loss: 1.1114, test_f1: 0.4402
 epoch: 44, train_loss: 1.0058, test_loss: 1.1045, test_f1: 0.4570
 epoch: 45, train_loss: 0.9999, test_loss: 1.0870, test_f1: 0.4590
 epoch: 46, train_loss: 0.9989, test_loss: 1.0879, test_f1: 0.4595
 epoch: 47, train_loss: 0.9951, test_loss: 1.0934, test_f1: 0.4548
 epoch: 48, train_loss: 0.9897, test_loss: 1.0973, test_f1: 0.4616
 epoch: 49, train_loss: 0.9885, test_loss: 1.1250, test_f1: 0.4328
 epoch: 50, train_loss: 0.9849, test_loss: 1.1084, test_f1: 0.4623
 epoch: 51, train_loss: 0.9799, test_loss: 1.0937, test_f1: 0.4621
 epoch: 52, train_loss: 0.9770, test_loss: 1.0955, test_f1: 0.4333
 epoch: 53, train_loss: 0.9884, test_loss: 1.1113, test_f1: 0.4301
 epoch: 54, train_loss: 0.9681, test_loss: 1.1146, test_f1: 0.4338
 epoch: 55, train_loss: 0.9751, test_loss: 1.1144, test_f1: 0.4389
 epoch: 56, train_loss: 0.9783, test_loss: 1.1002, test_f1: 0.4169
 epoch: 57, train_loss: 0.9777, test_loss: 1.0883, test_f1: 0.4486
 epoch: 58, train_loss: 0.9697, test_loss: 1.0956, test_f1: 0.4469
 epoch: 59, train_loss: 0.9795, test_loss: 1.0963, test_f1: 0.4303
 epoch: 60, train_loss: 0.9740, test_loss: 1.0972, test_f1: 0.4276
 epoch: 61, train_loss: 0.9825, test_loss: 1.1034, test_f1: 0.4314
 epoch: 62, train_loss: 0.9659, test_loss: 1.1057, test_f1: 0.4345
 epoch: 63, train_loss: 0.9625, test_loss: 1.0940, test_f1: 0.4433
 epoch: 64, train_loss: 0.9630, test_loss: 1.0987, test_f1: 0.4634
 epoch: 65, train_loss: 0.9577, test_loss: 1.1073, test_f1: 0.4625
 epoch: 66, train_loss: 0.9565, test_loss: 1.1219, test_f1: 0.4541
 epoch: 67, train_loss: 0.9626, test_loss: 1.1078, test_f1: 0.4475
 epoch: 68, train_loss: 0.9639, test_loss: 1.0987, test_f1: 0.4570
 epoch: 69, train_loss: 0.9533, test_loss: 1.0900, test_f1: 0.4599
 epoch: 70, train_loss: 0.9688, test_loss: 1.1027, test_f1: 0.4511
 epoch: 71, train_loss: 0.9708, test_loss: 1.1207, test_f1: 0.4488
 epoch: 72, train_loss: 0.9741, test_loss: 1.1192, test_f1: 0.4584
 epoch: 73, train_loss: 0.9631, test_loss: 1.1033, test_f1: 0.4572
 epoch: 74, train_loss: 0.9639, test_loss: 1.1017, test_f1: 0.4638
 epoch: 75, train_loss: 0.9584, test_loss: 1.0916, test_f1: 0.4859
 epoch: 76, train_loss: 0.9532, test_loss: 1.0755, test_f1: 0.4890
 epoch: 77, train_loss: 0.9523, test_loss: 1.0799, test_f1: 0.4705
 epoch: 78, train_loss: 0.9510, test_loss: 1.0855, test_f1: 0.4769
 epoch: 79, train_loss: 0.9529, test_loss: 1.0754, test_f1: 0.4655
 epoch: 80, train_loss: 0.9522, test_loss: 1.0835, test_f1: 0.4633
 epoch: 81, train_loss: 0.9430, test_loss: 1.0913, test_f1: 0.4693
 epoch: 82, train_loss: 0.9394, test_loss: 1.1188, test_f1: 0.4731
 epoch: 83, train_loss: 0.9441, test_loss: 1.1104, test_f1: 0.4669
 epoch: 84, train_loss: 0.9459, test_loss: 1.1038, test_f1: 0.4717
 epoch: 85, train_loss: 0.9380, test_loss: 1.1097, test_f1: 0.4757
 epoch: 86, train_loss: 0.9324, test_loss: 1.1003, test_f1: 0.4763
 epoch: 87, train_loss: 0.9376, test_loss: 1.0992, test_f1: 0.4939
 epoch: 88, train_loss: 0.9227, test_loss: 1.0982, test_f1: 0.4977
 epoch: 89, train_loss: 0.9294, test_loss: 1.0963, test_f1: 0.5146
 epoch: 90, train_loss: 0.9284, test_loss: 1.1024, test_f1: 0.5128
 epoch: 91, train_loss: 0.9369, test_loss: 1.1106, test_f1: 0.4968
 epoch: 92, train_loss: 0.9229, test_loss: 1.1019, test_f1: 0.4927
 epoch: 93, train_loss: 0.9374, test_loss: 1.0903, test_f1: 0.4904
 epoch: 94, train_loss: 0.9286, test_loss: 1.1051, test_f1: 0.4970
 epoch: 95, train_loss: 0.9262, test_loss: 1.1100, test_f1: 0.4782
 epoch: 96, train_loss: 0.9363, test_loss: 1.1043, test_f1: 0.4856
 epoch: 97, train_loss: 0.9303, test_loss: 1.1064, test_f1: 0.5037
 epoch: 98, train_loss: 0.9292, test_loss: 1.1068, test_f1: 0.5097
 epoch: 99, train_loss: 0.9298, test_loss: 1.0998, test_f1: 0.5105
##################ITERATION #6 ****************************************
 epoch: 0, train_loss: 1.2736, test_loss: 1.3032, test_f1: 0.2281
 epoch: 1, train_loss: 1.2115, test_loss: 1.3007, test_f1: 0.2281
 epoch: 2, train_loss: 1.1753, test_loss: 1.3075, test_f1: 0.2281
 epoch: 3, train_loss: 1.1726, test_loss: 1.3320, test_f1: 0.2282
 epoch: 4, train_loss: 1.1619, test_loss: 1.3536, test_f1: 0.2347
 epoch: 5, train_loss: 1.1420, test_loss: 1.3083, test_f1: 0.2682
 epoch: 6, train_loss: 1.1422, test_loss: 1.2504, test_f1: 0.2822
 epoch: 7, train_loss: 1.1298, test_loss: 1.2136, test_f1: 0.2712
 epoch: 8, train_loss: 1.1152, test_loss: 1.1991, test_f1: 0.3731
 epoch: 9, train_loss: 1.1079, test_loss: 1.1993, test_f1: 0.3906
 epoch: 10, train_loss: 1.0954, test_loss: 1.1911, test_f1: 0.3933
 epoch: 11, train_loss: 1.0945, test_loss: 1.1732, test_f1: 0.4310
 epoch: 12, train_loss: 1.0867, test_loss: 1.1588, test_f1: 0.4335
 epoch: 13, train_loss: 1.0824, test_loss: 1.1566, test_f1: 0.4459
 epoch: 14, train_loss: 1.0710, test_loss: 1.1613, test_f1: 0.4209
 epoch: 15, train_loss: 1.0630, test_loss: 1.1715, test_f1: 0.4106
 epoch: 16, train_loss: 1.0472, test_loss: 1.1441, test_f1: 0.4402
 epoch: 17, train_loss: 1.0558, test_loss: 1.1285, test_f1: 0.4335
 epoch: 18, train_loss: 1.0452, test_loss: 1.1362, test_f1: 0.4366
 epoch: 19, train_loss: 1.0289, test_loss: 1.1383, test_f1: 0.4271
 epoch: 20, train_loss: 1.0318, test_loss: 1.1418, test_f1: 0.4432
 epoch: 21, train_loss: 1.0394, test_loss: 1.1492, test_f1: 0.4230
 epoch: 22, train_loss: 1.0240, test_loss: 1.1528, test_f1: 0.4384
 epoch: 23, train_loss: 1.0296, test_loss: 1.1435, test_f1: 0.4383
 epoch: 24, train_loss: 1.0243, test_loss: 1.1442, test_f1: 0.4514
 epoch: 25, train_loss: 1.0143, test_loss: 1.1287, test_f1: 0.4649
 epoch: 26, train_loss: 1.0120, test_loss: 1.1437, test_f1: 0.4467
 epoch: 27, train_loss: 1.0144, test_loss: 1.1531, test_f1: 0.4477
 epoch: 28, train_loss: 1.0007, test_loss: 1.1642, test_f1: 0.4448
 epoch: 29, train_loss: 1.0084, test_loss: 1.1382, test_f1: 0.4524
 epoch: 30, train_loss: 1.0012, test_loss: 1.1399, test_f1: 0.4461
 epoch: 31, train_loss: 0.9960, test_loss: 1.1723, test_f1: 0.4541
 epoch: 32, train_loss: 0.9908, test_loss: 1.1598, test_f1: 0.4604
 epoch: 33, train_loss: 0.9941, test_loss: 1.1331, test_f1: 0.4577
 epoch: 34, train_loss: 0.9878, test_loss: 1.1617, test_f1: 0.4453
 epoch: 35, train_loss: 0.9801, test_loss: 1.1814, test_f1: 0.4536
 epoch: 36, train_loss: 0.9748, test_loss: 1.1627, test_f1: 0.4524
 epoch: 37, train_loss: 0.9935, test_loss: 1.1663, test_f1: 0.4278
 epoch: 38, train_loss: 0.9860, test_loss: 1.1386, test_f1: 0.4325
 epoch: 39, train_loss: 0.9988, test_loss: 1.1647, test_f1: 0.4218
 epoch: 40, train_loss: 0.9978, test_loss: 1.1417, test_f1: 0.4414
 epoch: 41, train_loss: 0.9914, test_loss: 1.1438, test_f1: 0.4422
 epoch: 42, train_loss: 0.9838, test_loss: 1.1233, test_f1: 0.4527
 epoch: 43, train_loss: 0.9789, test_loss: 1.1241, test_f1: 0.4541
 epoch: 44, train_loss: 0.9736, test_loss: 1.1386, test_f1: 0.4719
 epoch: 45, train_loss: 0.9683, test_loss: 1.1202, test_f1: 0.4596
 epoch: 46, train_loss: 0.9680, test_loss: 1.0992, test_f1: 0.4724
 epoch: 47, train_loss: 0.9755, test_loss: 1.1186, test_f1: 0.4734
 epoch: 48, train_loss: 0.9636, test_loss: 1.1492, test_f1: 0.4528
 epoch: 49, train_loss: 0.9668, test_loss: 1.1228, test_f1: 0.4399
 epoch: 50, train_loss: 0.9481, test_loss: 1.1851, test_f1: 0.4654
 epoch: 51, train_loss: 0.9536, test_loss: 1.1905, test_f1: 0.4443
 epoch: 52, train_loss: 0.9544, test_loss: 1.1952, test_f1: 0.4388
 epoch: 53, train_loss: 0.9493, test_loss: 1.1311, test_f1: 0.4661
 epoch: 54, train_loss: 0.9442, test_loss: 1.1276, test_f1: 0.4742
 epoch: 55, train_loss: 0.9479, test_loss: 1.1345, test_f1: 0.4652
 epoch: 56, train_loss: 0.9357, test_loss: 1.1438, test_f1: 0.4705
 epoch: 57, train_loss: 0.9311, test_loss: 1.1251, test_f1: 0.4809
 epoch: 58, train_loss: 0.9356, test_loss: 1.1216, test_f1: 0.4773
 epoch: 59, train_loss: 0.9420, test_loss: 1.1166, test_f1: 0.4732
 epoch: 60, train_loss: 0.9362, test_loss: 1.1334, test_f1: 0.4716
 epoch: 61, train_loss: 0.9485, test_loss: 1.1405, test_f1: 0.4648
 epoch: 62, train_loss: 0.9343, test_loss: 1.1304, test_f1: 0.4722
 epoch: 63, train_loss: 0.9369, test_loss: 1.1218, test_f1: 0.4522
 epoch: 64, train_loss: 0.9536, test_loss: 1.0895, test_f1: 0.4632
 epoch: 65, train_loss: 0.9556, test_loss: 1.0952, test_f1: 0.4628
 epoch: 66, train_loss: 0.9483, test_loss: 1.0926, test_f1: 0.4693
 epoch: 67, train_loss: 0.9454, test_loss: 1.1065, test_f1: 0.4859
 epoch: 68, train_loss: 0.9470, test_loss: 1.1015, test_f1: 0.4635
 epoch: 69, train_loss: 0.9402, test_loss: 1.1104, test_f1: 0.4645
 epoch: 70, train_loss: 0.9447, test_loss: 1.1305, test_f1: 0.4641
 epoch: 71, train_loss: 0.9272, test_loss: 1.1540, test_f1: 0.4651
 epoch: 72, train_loss: 0.9244, test_loss: 1.1620, test_f1: 0.4655
 epoch: 73, train_loss: 0.9298, test_loss: 1.1486, test_f1: 0.4787
 epoch: 74, train_loss: 0.9210, test_loss: 1.1549, test_f1: 0.4701
 epoch: 75, train_loss: 0.9266, test_loss: 1.1616, test_f1: 0.4687
 epoch: 76, train_loss: 0.9219, test_loss: 1.1538, test_f1: 0.4766
 epoch: 77, train_loss: 0.9360, test_loss: 1.1907, test_f1: 0.4771
 epoch: 78, train_loss: 0.9086, test_loss: 1.1575, test_f1: 0.4761
 epoch: 79, train_loss: 0.9224, test_loss: 1.1135, test_f1: 0.4913
 epoch: 80, train_loss: 0.9320, test_loss: 1.1144, test_f1: 0.4864
 epoch: 81, train_loss: 0.9239, test_loss: 1.1172, test_f1: 0.4963
 epoch: 82, train_loss: 0.9195, test_loss: 1.1105, test_f1: 0.5033
 epoch: 83, train_loss: 0.9214, test_loss: 1.1404, test_f1: 0.4983
 epoch: 84, train_loss: 0.9162, test_loss: 1.1784, test_f1: 0.4746
 epoch: 85, train_loss: 0.9142, test_loss: 1.1772, test_f1: 0.4848
 epoch: 86, train_loss: 0.9097, test_loss: 1.1746, test_f1: 0.4856
 epoch: 87, train_loss: 0.9218, test_loss: 1.1940, test_f1: 0.4907
 epoch: 88, train_loss: 0.9180, test_loss: 1.1678, test_f1: 0.4964
 epoch: 89, train_loss: 0.9099, test_loss: 1.1320, test_f1: 0.5162
 epoch: 90, train_loss: 0.9059, test_loss: 1.1240, test_f1: 0.5252
 epoch: 91, train_loss: 0.9039, test_loss: 1.1145, test_f1: 0.5297
 epoch: 92, train_loss: 0.9135, test_loss: 1.1189, test_f1: 0.5223
 epoch: 93, train_loss: 0.9144, test_loss: 1.1068, test_f1: 0.5237
 epoch: 94, train_loss: 0.9075, test_loss: 1.0909, test_f1: 0.5207
 epoch: 95, train_loss: 0.9028, test_loss: 1.1066, test_f1: 0.5154
 epoch: 96, train_loss: 0.9067, test_loss: 1.1376, test_f1: 0.5173
 epoch: 97, train_loss: 0.9156, test_loss: 1.1896, test_f1: 0.5104
 epoch: 98, train_loss: 0.8999, test_loss: 1.2127, test_f1: 0.5029
 epoch: 99, train_loss: 0.8964, test_loss: 1.2031, test_f1: 0.4942
##################ITERATION #7 ****************************************
 epoch: 0, train_loss: 1.3072, test_loss: 1.3385, test_f1: 0.2281
 epoch: 1, train_loss: 1.1948, test_loss: 1.3178, test_f1: 0.2281
 epoch: 2, train_loss: 1.1537, test_loss: 1.2758, test_f1: 0.2281
 epoch: 3, train_loss: 1.1337, test_loss: 1.2596, test_f1: 0.2281
 epoch: 4, train_loss: 1.1156, test_loss: 1.2528, test_f1: 0.2658
 epoch: 5, train_loss: 1.1105, test_loss: 1.2510, test_f1: 0.3110
 epoch: 6, train_loss: 1.1051, test_loss: 1.2584, test_f1: 0.3075
 epoch: 7, train_loss: 1.0950, test_loss: 1.2182, test_f1: 0.3172
 epoch: 8, train_loss: 1.0769, test_loss: 1.1848, test_f1: 0.3260
 epoch: 9, train_loss: 1.0754, test_loss: 1.1532, test_f1: 0.3494
 epoch: 10, train_loss: 1.0687, test_loss: 1.1179, test_f1: 0.3880
 epoch: 11, train_loss: 1.0538, test_loss: 1.1094, test_f1: 0.4364
 epoch: 12, train_loss: 1.0504, test_loss: 1.1127, test_f1: 0.4424
 epoch: 13, train_loss: 1.0552, test_loss: 1.1139, test_f1: 0.4081
 epoch: 14, train_loss: 1.0492, test_loss: 1.1264, test_f1: 0.3822
 epoch: 15, train_loss: 1.0330, test_loss: 1.1214, test_f1: 0.4071
 epoch: 16, train_loss: 1.0132, test_loss: 1.1034, test_f1: 0.4390
 epoch: 17, train_loss: 1.0368, test_loss: 1.0955, test_f1: 0.4540
 epoch: 18, train_loss: 1.0229, test_loss: 1.0870, test_f1: 0.4270
 epoch: 19, train_loss: 1.0201, test_loss: 1.0776, test_f1: 0.3888
 epoch: 20, train_loss: 1.0276, test_loss: 1.0806, test_f1: 0.3891
 epoch: 21, train_loss: 1.0106, test_loss: 1.0808, test_f1: 0.3999
 epoch: 22, train_loss: 1.0082, test_loss: 1.1026, test_f1: 0.4662
 epoch: 23, train_loss: 0.9825, test_loss: 1.1029, test_f1: 0.4363
 epoch: 24, train_loss: 0.9961, test_loss: 1.0905, test_f1: 0.4007
 epoch: 25, train_loss: 0.9919, test_loss: 1.0959, test_f1: 0.4123
 epoch: 26, train_loss: 0.9908, test_loss: 1.0927, test_f1: 0.4573
 epoch: 27, train_loss: 0.9828, test_loss: 1.1114, test_f1: 0.4240
 epoch: 28, train_loss: 0.9858, test_loss: 1.1494, test_f1: 0.3898
 epoch: 29, train_loss: 0.9745, test_loss: 1.1472, test_f1: 0.4274
 epoch: 30, train_loss: 0.9753, test_loss: 1.0955, test_f1: 0.4443
 epoch: 31, train_loss: 0.9664, test_loss: 1.0739, test_f1: 0.4553
 epoch: 32, train_loss: 0.9478, test_loss: 1.0849, test_f1: 0.4373
 epoch: 33, train_loss: 0.9610, test_loss: 1.0745, test_f1: 0.4496
 epoch: 34, train_loss: 0.9603, test_loss: 1.0788, test_f1: 0.4613
 epoch: 35, train_loss: 0.9393, test_loss: 1.1030, test_f1: 0.4572
 epoch: 36, train_loss: 0.9470, test_loss: 1.1058, test_f1: 0.4357
 epoch: 37, train_loss: 0.9448, test_loss: 1.0777, test_f1: 0.4697
 epoch: 38, train_loss: 0.9594, test_loss: 1.0940, test_f1: 0.4738
 epoch: 39, train_loss: 0.9485, test_loss: 1.1131, test_f1: 0.5023
 epoch: 40, train_loss: 0.9327, test_loss: 1.1074, test_f1: 0.4928
 epoch: 41, train_loss: 0.9346, test_loss: 1.1123, test_f1: 0.4528
 epoch: 42, train_loss: 0.9305, test_loss: 1.0850, test_f1: 0.4769
 epoch: 43, train_loss: 0.9332, test_loss: 1.0882, test_f1: 0.4816
 epoch: 44, train_loss: 0.9269, test_loss: 1.0812, test_f1: 0.4927
 epoch: 45, train_loss: 0.9226, test_loss: 1.0832, test_f1: 0.5064
 epoch: 46, train_loss: 0.9196, test_loss: 1.0961, test_f1: 0.4973
 epoch: 47, train_loss: 0.9135, test_loss: 1.1111, test_f1: 0.4982
 epoch: 48, train_loss: 0.9143, test_loss: 1.1399, test_f1: 0.4948
 epoch: 49, train_loss: 0.9208, test_loss: 1.1439, test_f1: 0.4729
 epoch: 50, train_loss: 0.9174, test_loss: 1.1470, test_f1: 0.4918
 epoch: 51, train_loss: 0.9157, test_loss: 1.1290, test_f1: 0.4919
 epoch: 52, train_loss: 0.9146, test_loss: 1.1202, test_f1: 0.4757
 epoch: 53, train_loss: 0.8991, test_loss: 1.1150, test_f1: 0.4621
 epoch: 54, train_loss: 0.9063, test_loss: 1.1268, test_f1: 0.4821
 epoch: 55, train_loss: 0.9178, test_loss: 1.1281, test_f1: 0.4796
 epoch: 56, train_loss: 0.8903, test_loss: 1.1235, test_f1: 0.4733
 epoch: 57, train_loss: 0.8944, test_loss: 1.1275, test_f1: 0.4786
 epoch: 58, train_loss: 0.9027, test_loss: 1.1289, test_f1: 0.4828
 epoch: 59, train_loss: 0.8926, test_loss: 1.1270, test_f1: 0.4811
 epoch: 60, train_loss: 0.8908, test_loss: 1.1150, test_f1: 0.4878
 epoch: 61, train_loss: 0.9065, test_loss: 1.1276, test_f1: 0.4935
 epoch: 62, train_loss: 0.9054, test_loss: 1.1637, test_f1: 0.4940
 epoch: 63, train_loss: 0.9117, test_loss: 1.1189, test_f1: 0.4965
 epoch: 64, train_loss: 0.9017, test_loss: 1.1208, test_f1: 0.4753
 epoch: 65, train_loss: 0.9015, test_loss: 1.1143, test_f1: 0.4708
 epoch: 66, train_loss: 0.9050, test_loss: 1.1120, test_f1: 0.4886
 epoch: 67, train_loss: 0.8947, test_loss: 1.1322, test_f1: 0.4787
 epoch: 68, train_loss: 0.9019, test_loss: 1.1451, test_f1: 0.4789
 epoch: 69, train_loss: 0.8891, test_loss: 1.1404, test_f1: 0.4881
 epoch: 70, train_loss: 0.8944, test_loss: 1.1398, test_f1: 0.4966
 epoch: 71, train_loss: 0.8895, test_loss: 1.1239, test_f1: 0.5062
 epoch: 72, train_loss: 0.8958, test_loss: 1.1265, test_f1: 0.4937
 epoch: 73, train_loss: 0.8794, test_loss: 1.1365, test_f1: 0.4655
 epoch: 74, train_loss: 0.8980, test_loss: 1.1754, test_f1: 0.4692
 epoch: 75, train_loss: 0.8930, test_loss: 1.1471, test_f1: 0.4698
 epoch: 76, train_loss: 0.8946, test_loss: 1.1454, test_f1: 0.4594
 epoch: 77, train_loss: 0.8947, test_loss: 1.1620, test_f1: 0.4609
 epoch: 78, train_loss: 0.8934, test_loss: 1.1318, test_f1: 0.4806
 epoch: 79, train_loss: 0.8819, test_loss: 1.1334, test_f1: 0.4924
 epoch: 80, train_loss: 0.8810, test_loss: 1.1442, test_f1: 0.4814
 epoch: 81, train_loss: 0.8914, test_loss: 1.1751, test_f1: 0.4833
 epoch: 82, train_loss: 0.8927, test_loss: 1.1724, test_f1: 0.4808
 epoch: 83, train_loss: 0.8743, test_loss: 1.1645, test_f1: 0.4820
 epoch: 84, train_loss: 0.8926, test_loss: 1.1612, test_f1: 0.4902
 epoch: 85, train_loss: 0.8788, test_loss: 1.1538, test_f1: 0.4880
 epoch: 86, train_loss: 0.8880, test_loss: 1.1530, test_f1: 0.4867
 epoch: 87, train_loss: 0.8800, test_loss: 1.1531, test_f1: 0.4937
 epoch: 88, train_loss: 0.9087, test_loss: 1.1540, test_f1: 0.4739
 epoch: 89, train_loss: 0.8810, test_loss: 1.1300, test_f1: 0.4546
 epoch: 90, train_loss: 0.8941, test_loss: 1.1359, test_f1: 0.4755
 epoch: 91, train_loss: 0.8708, test_loss: 1.1626, test_f1: 0.4796
 epoch: 92, train_loss: 0.8844, test_loss: 1.1802, test_f1: 0.4695
 epoch: 93, train_loss: 0.8840, test_loss: 1.1755, test_f1: 0.4817
 epoch: 94, train_loss: 0.8667, test_loss: 1.1651, test_f1: 0.4887
 epoch: 95, train_loss: 0.8633, test_loss: 1.1523, test_f1: 0.4679
 epoch: 96, train_loss: 0.8700, test_loss: 1.1488, test_f1: 0.4657
 epoch: 97, train_loss: 0.8568, test_loss: 1.1573, test_f1: 0.4564
 epoch: 98, train_loss: 0.8598, test_loss: 1.1605, test_f1: 0.4530
 epoch: 99, train_loss: 0.8702, test_loss: 1.1573, test_f1: 0.4719
##################ITERATION #8 ****************************************
 epoch: 0, train_loss: 1.2736, test_loss: 1.3080, test_f1: 0.2281
 epoch: 1, train_loss: 1.1969, test_loss: 1.3015, test_f1: 0.2281
 epoch: 2, train_loss: 1.1726, test_loss: 1.3058, test_f1: 0.2281
 epoch: 3, train_loss: 1.1566, test_loss: 1.3043, test_f1: 0.2281
 epoch: 4, train_loss: 1.1281, test_loss: 1.2883, test_f1: 0.2281
 epoch: 5, train_loss: 1.1193, test_loss: 1.2516, test_f1: 0.2654
 epoch: 6, train_loss: 1.1138, test_loss: 1.2240, test_f1: 0.3273
 epoch: 7, train_loss: 1.0986, test_loss: 1.1925, test_f1: 0.3419
 epoch: 8, train_loss: 1.0903, test_loss: 1.1704, test_f1: 0.3907
 epoch: 9, train_loss: 1.0813, test_loss: 1.1531, test_f1: 0.4066
 epoch: 10, train_loss: 1.0821, test_loss: 1.1487, test_f1: 0.4446
 epoch: 11, train_loss: 1.0676, test_loss: 1.1315, test_f1: 0.4579
 epoch: 12, train_loss: 1.0644, test_loss: 1.1266, test_f1: 0.4689
 epoch: 13, train_loss: 1.0485, test_loss: 1.1146, test_f1: 0.4767
 epoch: 14, train_loss: 1.0476, test_loss: 1.1111, test_f1: 0.4746
 epoch: 15, train_loss: 1.0422, test_loss: 1.1175, test_f1: 0.4321
 epoch: 16, train_loss: 1.0260, test_loss: 1.1187, test_f1: 0.4884
 epoch: 17, train_loss: 1.0379, test_loss: 1.1083, test_f1: 0.4776
 epoch: 18, train_loss: 1.0211, test_loss: 1.0819, test_f1: 0.4879
 epoch: 19, train_loss: 1.0134, test_loss: 1.0959, test_f1: 0.4812
 epoch: 20, train_loss: 1.0030, test_loss: 1.1089, test_f1: 0.4721
 epoch: 21, train_loss: 1.0037, test_loss: 1.1124, test_f1: 0.4838
 epoch: 22, train_loss: 0.9946, test_loss: 1.1010, test_f1: 0.4969
 epoch: 23, train_loss: 1.0010, test_loss: 1.0994, test_f1: 0.5173
 epoch: 24, train_loss: 0.9923, test_loss: 1.1087, test_f1: 0.5114
 epoch: 25, train_loss: 0.9994, test_loss: 1.1003, test_f1: 0.5024
 epoch: 26, train_loss: 0.9916, test_loss: 1.0834, test_f1: 0.4994
 epoch: 27, train_loss: 0.9770, test_loss: 1.0931, test_f1: 0.5074
 epoch: 28, train_loss: 0.9877, test_loss: 1.0817, test_f1: 0.4889
 epoch: 29, train_loss: 0.9941, test_loss: 1.0865, test_f1: 0.4925
 epoch: 30, train_loss: 0.9805, test_loss: 1.0839, test_f1: 0.4987
 epoch: 31, train_loss: 0.9698, test_loss: 1.1031, test_f1: 0.5052
 epoch: 32, train_loss: 0.9719, test_loss: 1.0981, test_f1: 0.5110
 epoch: 33, train_loss: 0.9647, test_loss: 1.0880, test_f1: 0.5179
 epoch: 34, train_loss: 0.9644, test_loss: 1.1006, test_f1: 0.5264
 epoch: 35, train_loss: 0.9675, test_loss: 1.1147, test_f1: 0.5254
 epoch: 36, train_loss: 0.9609, test_loss: 1.0658, test_f1: 0.5328
 epoch: 37, train_loss: 0.9630, test_loss: 1.0453, test_f1: 0.5298
 epoch: 38, train_loss: 0.9590, test_loss: 1.0607, test_f1: 0.5404
 epoch: 39, train_loss: 0.9543, test_loss: 1.0705, test_f1: 0.5241
 epoch: 40, train_loss: 0.9508, test_loss: 1.0757, test_f1: 0.5218
 epoch: 41, train_loss: 0.9517, test_loss: 1.0932, test_f1: 0.5377
 epoch: 42, train_loss: 0.9422, test_loss: 1.1024, test_f1: 0.5398
 epoch: 43, train_loss: 0.9297, test_loss: 1.0964, test_f1: 0.5203
 epoch: 44, train_loss: 0.9339, test_loss: 1.0830, test_f1: 0.5216
 epoch: 45, train_loss: 0.9486, test_loss: 1.0767, test_f1: 0.5245
 epoch: 46, train_loss: 0.9306, test_loss: 1.0793, test_f1: 0.5440
 epoch: 47, train_loss: 0.9220, test_loss: 1.0619, test_f1: 0.5449
 epoch: 48, train_loss: 0.9331, test_loss: 1.0552, test_f1: 0.5533
 epoch: 49, train_loss: 0.9372, test_loss: 1.0799, test_f1: 0.5474
 epoch: 50, train_loss: 0.9483, test_loss: 1.0719, test_f1: 0.5366
 epoch: 51, train_loss: 0.9204, test_loss: 1.0329, test_f1: 0.5189
 epoch: 52, train_loss: 0.9364, test_loss: 1.0378, test_f1: 0.5261
 epoch: 53, train_loss: 0.9250, test_loss: 1.0451, test_f1: 0.5293
 epoch: 54, train_loss: 0.9147, test_loss: 1.0511, test_f1: 0.5283
 epoch: 55, train_loss: 0.9140, test_loss: 1.0535, test_f1: 0.5206
 epoch: 56, train_loss: 0.9077, test_loss: 1.0575, test_f1: 0.5297
 epoch: 57, train_loss: 0.9086, test_loss: 1.0578, test_f1: 0.5319
 epoch: 58, train_loss: 0.9178, test_loss: 1.0576, test_f1: 0.5396
 epoch: 59, train_loss: 0.9014, test_loss: 1.0599, test_f1: 0.5316
 epoch: 60, train_loss: 0.9091, test_loss: 1.0568, test_f1: 0.5326
 epoch: 61, train_loss: 0.9106, test_loss: 1.0639, test_f1: 0.5320
 epoch: 62, train_loss: 0.9017, test_loss: 1.0670, test_f1: 0.5297
 epoch: 63, train_loss: 0.9124, test_loss: 1.0593, test_f1: 0.5371
 epoch: 64, train_loss: 0.9100, test_loss: 1.0577, test_f1: 0.5361
 epoch: 65, train_loss: 0.9091, test_loss: 1.0539, test_f1: 0.5376
 epoch: 66, train_loss: 0.9036, test_loss: 1.0456, test_f1: 0.5361
 epoch: 67, train_loss: 0.9004, test_loss: 1.0581, test_f1: 0.5383
 epoch: 68, train_loss: 0.9044, test_loss: 1.0688, test_f1: 0.5399
 epoch: 69, train_loss: 0.8911, test_loss: 1.0736, test_f1: 0.5478
 epoch: 70, train_loss: 0.9034, test_loss: 1.0772, test_f1: 0.5501
 epoch: 71, train_loss: 0.9059, test_loss: 1.0563, test_f1: 0.5367
 epoch: 72, train_loss: 0.8938, test_loss: 1.0363, test_f1: 0.5449
 epoch: 73, train_loss: 0.9096, test_loss: 1.0295, test_f1: 0.5478
 epoch: 74, train_loss: 0.8955, test_loss: 1.0340, test_f1: 0.5321
 epoch: 75, train_loss: 0.9068, test_loss: 1.0416, test_f1: 0.5338
 epoch: 76, train_loss: 0.8891, test_loss: 1.0488, test_f1: 0.5387
 epoch: 77, train_loss: 0.8876, test_loss: 1.0405, test_f1: 0.5418
 epoch: 78, train_loss: 0.8799, test_loss: 1.0412, test_f1: 0.5459
 epoch: 79, train_loss: 0.8948, test_loss: 1.0444, test_f1: 0.5413
 epoch: 80, train_loss: 0.8900, test_loss: 1.0470, test_f1: 0.5369
 epoch: 81, train_loss: 0.8845, test_loss: 1.0407, test_f1: 0.5420
 epoch: 82, train_loss: 0.8950, test_loss: 1.0385, test_f1: 0.5316
 epoch: 83, train_loss: 0.8898, test_loss: 1.0365, test_f1: 0.5318
 epoch: 84, train_loss: 0.8791, test_loss: 1.0547, test_f1: 0.5510
 epoch: 85, train_loss: 0.8851, test_loss: 1.0738, test_f1: 0.5617
 epoch: 86, train_loss: 0.8800, test_loss: 1.0666, test_f1: 0.5427
 epoch: 87, train_loss: 0.8793, test_loss: 1.0490, test_f1: 0.5411
 epoch: 88, train_loss: 0.8756, test_loss: 1.0512, test_f1: 0.5532
 epoch: 89, train_loss: 0.8859, test_loss: 1.0730, test_f1: 0.5551
 epoch: 90, train_loss: 0.8862, test_loss: 1.0589, test_f1: 0.5538
 epoch: 91, train_loss: 0.8790, test_loss: 1.0433, test_f1: 0.5594
 epoch: 92, train_loss: 0.8752, test_loss: 1.0496, test_f1: 0.5487
 epoch: 93, train_loss: 0.8783, test_loss: 1.0488, test_f1: 0.5469
 epoch: 94, train_loss: 0.8764, test_loss: 1.0465, test_f1: 0.5453
 epoch: 95, train_loss: 0.8801, test_loss: 1.0220, test_f1: 0.5497
 epoch: 96, train_loss: 0.8698, test_loss: 1.0229, test_f1: 0.5510
 epoch: 97, train_loss: 0.8780, test_loss: 1.0448, test_f1: 0.5603
 epoch: 98, train_loss: 0.8866, test_loss: 1.0695, test_f1: 0.5535
 epoch: 99, train_loss: 0.8787, test_loss: 1.0517, test_f1: 0.5480
##################ITERATION #9 ****************************************
 epoch: 0, train_loss: 1.6911, test_loss: 1.4461, test_f1: 0.0507
 epoch: 1, train_loss: 1.3946, test_loss: 1.4134, test_f1: 0.0507
 epoch: 2, train_loss: 1.3214, test_loss: 1.4030, test_f1: 0.0507
 epoch: 3, train_loss: 1.2688, test_loss: 1.3735, test_f1: 0.0507
 epoch: 4, train_loss: 1.2519, test_loss: 1.3662, test_f1: 0.0960
 epoch: 5, train_loss: 1.2228, test_loss: 1.3350, test_f1: 0.3010
 epoch: 6, train_loss: 1.1985, test_loss: 1.2855, test_f1: 0.3100
 epoch: 7, train_loss: 1.1624, test_loss: 1.2418, test_f1: 0.3510
 epoch: 8, train_loss: 1.1609, test_loss: 1.1827, test_f1: 0.4317
 epoch: 9, train_loss: 1.1396, test_loss: 1.1712, test_f1: 0.4567
 epoch: 10, train_loss: 1.1216, test_loss: 1.1471, test_f1: 0.4777
 epoch: 11, train_loss: 1.1145, test_loss: 1.1588, test_f1: 0.4432
 epoch: 12, train_loss: 1.1213, test_loss: 1.1432, test_f1: 0.4664
 epoch: 13, train_loss: 1.0992, test_loss: 1.1353, test_f1: 0.4742
 epoch: 14, train_loss: 1.0961, test_loss: 1.1265, test_f1: 0.4814
 epoch: 15, train_loss: 1.0807, test_loss: 1.1173, test_f1: 0.4677
 epoch: 16, train_loss: 1.0768, test_loss: 1.1193, test_f1: 0.4684
 epoch: 17, train_loss: 1.0780, test_loss: 1.1152, test_f1: 0.4908
 epoch: 18, train_loss: 1.0598, test_loss: 1.1058, test_f1: 0.4869
 epoch: 19, train_loss: 1.0578, test_loss: 1.0917, test_f1: 0.4668
 epoch: 20, train_loss: 1.0518, test_loss: 1.1063, test_f1: 0.4892
 epoch: 21, train_loss: 1.0525, test_loss: 1.1267, test_f1: 0.4617
 epoch: 22, train_loss: 1.0457, test_loss: 1.1056, test_f1: 0.4885
 epoch: 23, train_loss: 1.0501, test_loss: 1.0957, test_f1: 0.4776
 epoch: 24, train_loss: 1.0320, test_loss: 1.0960, test_f1: 0.4985
 epoch: 25, train_loss: 1.0254, test_loss: 1.1046, test_f1: 0.5230
 epoch: 26, train_loss: 1.0193, test_loss: 1.0835, test_f1: 0.5164
 epoch: 27, train_loss: 1.0183, test_loss: 1.1045, test_f1: 0.5159
 epoch: 28, train_loss: 1.0359, test_loss: 1.0741, test_f1: 0.5252
 epoch: 29, train_loss: 1.0155, test_loss: 1.0899, test_f1: 0.5088
 epoch: 30, train_loss: 1.0010, test_loss: 1.0863, test_f1: 0.4909
 epoch: 31, train_loss: 1.0170, test_loss: 1.0918, test_f1: 0.4934
 epoch: 32, train_loss: 1.0130, test_loss: 1.0969, test_f1: 0.4778
 epoch: 33, train_loss: 1.0000, test_loss: 1.0951, test_f1: 0.5435
 epoch: 34, train_loss: 0.9989, test_loss: 1.0842, test_f1: 0.5291
 epoch: 35, train_loss: 1.0035, test_loss: 1.0950, test_f1: 0.5172
 epoch: 36, train_loss: 0.9873, test_loss: 1.0940, test_f1: 0.5183
 epoch: 37, train_loss: 0.9986, test_loss: 1.1031, test_f1: 0.5164
 epoch: 38, train_loss: 0.9781, test_loss: 1.0967, test_f1: 0.5104
 epoch: 39, train_loss: 0.9833, test_loss: 1.0844, test_f1: 0.5385
 epoch: 40, train_loss: 0.9779, test_loss: 1.0564, test_f1: 0.5067
 epoch: 41, train_loss: 0.9888, test_loss: 1.0808, test_f1: 0.5029
 epoch: 42, train_loss: 0.9908, test_loss: 1.0942, test_f1: 0.5064
 epoch: 43, train_loss: 0.9917, test_loss: 1.0887, test_f1: 0.5075
 epoch: 44, train_loss: 0.9800, test_loss: 1.0977, test_f1: 0.5050
 epoch: 45, train_loss: 0.9824, test_loss: 1.1296, test_f1: 0.5175
 epoch: 46, train_loss: 0.9795, test_loss: 1.1300, test_f1: 0.5015
 epoch: 47, train_loss: 0.9627, test_loss: 1.1022, test_f1: 0.4916
 epoch: 48, train_loss: 0.9684, test_loss: 1.0941, test_f1: 0.4972
 epoch: 49, train_loss: 0.9820, test_loss: 1.0924, test_f1: 0.5152
 epoch: 50, train_loss: 0.9785, test_loss: 1.1134, test_f1: 0.4951
 epoch: 51, train_loss: 0.9692, test_loss: 1.0834, test_f1: 0.5025
 epoch: 52, train_loss: 0.9766, test_loss: 1.0854, test_f1: 0.5245
 epoch: 53, train_loss: 0.9497, test_loss: 1.0919, test_f1: 0.5206
 epoch: 54, train_loss: 0.9696, test_loss: 1.0862, test_f1: 0.5240
 epoch: 55, train_loss: 0.9508, test_loss: 1.0726, test_f1: 0.5375
 epoch: 56, train_loss: 0.9545, test_loss: 1.0695, test_f1: 0.5346
 epoch: 57, train_loss: 0.9519, test_loss: 1.0759, test_f1: 0.5452
 epoch: 58, train_loss: 0.9363, test_loss: 1.1082, test_f1: 0.5144
 epoch: 59, train_loss: 0.9330, test_loss: 1.1092, test_f1: 0.5024
 epoch: 60, train_loss: 0.9415, test_loss: 1.1072, test_f1: 0.5156
 epoch: 61, train_loss: 0.9309, test_loss: 1.1021, test_f1: 0.5095
 epoch: 62, train_loss: 0.9367, test_loss: 1.0951, test_f1: 0.5175
 epoch: 63, train_loss: 0.9356, test_loss: 1.0776, test_f1: 0.5224
 epoch: 64, train_loss: 0.9357, test_loss: 1.0850, test_f1: 0.5426
 epoch: 65, train_loss: 0.9322, test_loss: 1.0919, test_f1: 0.5430
 epoch: 66, train_loss: 0.9420, test_loss: 1.0942, test_f1: 0.5476
 epoch: 67, train_loss: 0.9295, test_loss: 1.0968, test_f1: 0.5485
 epoch: 68, train_loss: 0.9371, test_loss: 1.0860, test_f1: 0.5364
 epoch: 69, train_loss: 0.9352, test_loss: 1.0847, test_f1: 0.5363
 epoch: 70, train_loss: 0.9240, test_loss: 1.1048, test_f1: 0.5265
 epoch: 71, train_loss: 0.9306, test_loss: 1.0958, test_f1: 0.5195
 epoch: 72, train_loss: 0.9339, test_loss: 1.0789, test_f1: 0.5112
 epoch: 73, train_loss: 0.9367, test_loss: 1.0735, test_f1: 0.5303
 epoch: 74, train_loss: 0.9281, test_loss: 1.0892, test_f1: 0.5347
 epoch: 75, train_loss: 0.9345, test_loss: 1.0843, test_f1: 0.5336
 epoch: 76, train_loss: 0.9293, test_loss: 1.1196, test_f1: 0.5246
 epoch: 77, train_loss: 0.9347, test_loss: 1.1391, test_f1: 0.5375
 epoch: 78, train_loss: 0.9247, test_loss: 1.1372, test_f1: 0.5101
 epoch: 79, train_loss: 0.9172, test_loss: 1.1577, test_f1: 0.5179
 epoch: 80, train_loss: 0.9300, test_loss: 1.1482, test_f1: 0.5268
 epoch: 81, train_loss: 0.9138, test_loss: 1.1283, test_f1: 0.5328
 epoch: 82, train_loss: 0.9254, test_loss: 1.1027, test_f1: 0.5465
 epoch: 83, train_loss: 0.9253, test_loss: 1.1025, test_f1: 0.5495
 epoch: 84, train_loss: 0.9303, test_loss: 1.1188, test_f1: 0.5263
 epoch: 85, train_loss: 0.9278, test_loss: 1.1159, test_f1: 0.5085
 epoch: 86, train_loss: 0.9131, test_loss: 1.1136, test_f1: 0.5120
 epoch: 87, train_loss: 0.9177, test_loss: 1.1148, test_f1: 0.5187
 epoch: 88, train_loss: 0.9082, test_loss: 1.1178, test_f1: 0.5050
 epoch: 89, train_loss: 0.9134, test_loss: 1.1219, test_f1: 0.5023
 epoch: 90, train_loss: 0.9146, test_loss: 1.1005, test_f1: 0.5205
 epoch: 91, train_loss: 0.9124, test_loss: 1.0813, test_f1: 0.5202
 epoch: 92, train_loss: 0.9125, test_loss: 1.0898, test_f1: 0.5180
 epoch: 93, train_loss: 0.9200, test_loss: 1.0998, test_f1: 0.5137
 epoch: 94, train_loss: 0.9061, test_loss: 1.1208, test_f1: 0.5296
 epoch: 95, train_loss: 0.9124, test_loss: 1.1169, test_f1: 0.5350
 epoch: 96, train_loss: 0.9092, test_loss: 1.1098, test_f1: 0.5391
 epoch: 97, train_loss: 0.9078, test_loss: 1.0931, test_f1: 0.5350
 epoch: 98, train_loss: 0.9099, test_loss: 1.0897, test_f1: 0.5360
 epoch: 99, train_loss: 0.9019, test_loss: 1.1041, test_f1: 0.5475

Training completed in 384.08 seconds
Best F1: 0.5617 at epoch 85
Mean F1 across iterations: 0.5250  0.0269
========================FINAL RESULTS================================
FEGIN weighted F1: 0.5617  0.0269
python main.py --data ltspice_demos --representation component_net --model FEGIN --layers 5 --hiddens 16 --batch_size 256 --lr 0.001 --emb_size 512 --epochs 100 --save_appendix component_net_L5_H16_BS256_LR0.001_E512 --no_val
-----



STDERR:
  File "main.py", line 370, in <module>
    main()
  File "main.py", line 254, in main
    dataset = dataset_class(
  File "/home/philip/projects/ltspice_examples_code_repo/Circuit-Completion-Using-GNNs/component_classification_with_link_prediction_head/evaluation/FEGIN/kernel/circuit_datasets.py", line 15, in __init__
    self.data, self.slices = torch.load(self.processed_paths[0])
  File "/home/philip/.local/lib/python3.8/site-packages/torch/serialization.py", line 1040, in load
    warnings.warn(
  File "/usr/lib/python3.8/warnings.py", line 109, in _showwarnmsg
    sw(msg.message, msg.category, msg.filename, msg.lineno,
  File "main.py", line 47, in warn_with_traceback
    traceback.print_stack(file=log)
/home/philip/projects/ltspice_examples_code_repo/Circuit-Completion-Using-GNNs/component_classification_with_link_prediction_head/evaluation/FEGIN/kernel/circuit_datasets.py:15: FutureWarning: You are using `torch.load` with `weights_only=False` (the current default value), which uses the default pickle module implicitly. It is possible to construct malicious pickle data which will execute arbitrary code during unpickling (See https://github.com/pytorch/pytorch/blob/main/SECURITY.md#untrusted-models for more details). In a future release, the default value for `weights_only` will be flipped to `True`. This limits the functions that could be executed during unpickling. Arbitrary objects will no longer be allowed to be loaded via this mode unless they are explicitly allowlisted by the user via `torch.serialization.add_safe_globals`. We recommend you start setting `weights_only=True` for any use case where you don't have full control of the loaded file. Please open an issue on GitHub for any issues related to this experimental feature.
  self.data, self.slices = torch.load(self.processed_paths[0])
