STDOUT:
Results will be saved in /home/philip/projects/ltspice_examples_code_repo/Circuit-Completion-Using-GNNs/component_classification_with_link_prediction_head/evaluation/FEGIN/results/model_FEGIN_dataset_ltspice_examples
Command line input: python main.py --data ltspice_examples --representation component_pin_net --model FEGIN --layers 6 --hiddens 32 --batch_size 128 --lr 0.0001 --emb_size 128 --epochs 100 --save_appendix component_pin_net_L6_H32_BS128_LR0.0001_E128 --no_val
 is saved.
-----
ltspice_examples - FEGIN
Using 6 layers, 32 hidden units, h = 2
Loading component_pin_net representation dataset
ENTERED
Training FEGIN on component_pin_net representation
Train: 3558, Test: 846
##################ITERATION #0 ****************************************
 epoch: 0, train_loss: 1.3891, test_loss: 1.3903, test_f1: 0.0304
 epoch: 1, train_loss: 1.3820, test_loss: 1.3851, test_f1: 0.1347
 epoch: 2, train_loss: 1.3770, test_loss: 1.3767, test_f1: 0.2430
 epoch: 3, train_loss: 1.3724, test_loss: 1.3694, test_f1: 0.4053
 epoch: 4, train_loss: 1.3660, test_loss: 1.3614, test_f1: 0.4427
 epoch: 5, train_loss: 1.3586, test_loss: 1.3525, test_f1: 0.4131
 epoch: 6, train_loss: 1.3473, test_loss: 1.3413, test_f1: 0.3935
 epoch: 7, train_loss: 1.3353, test_loss: 1.3266, test_f1: 0.3372
 epoch: 8, train_loss: 1.3212, test_loss: 1.3116, test_f1: 0.3308
 epoch: 9, train_loss: 1.3036, test_loss: 1.2934, test_f1: 0.3138
 epoch: 10, train_loss: 1.2895, test_loss: 1.2754, test_f1: 0.3293
 epoch: 11, train_loss: 1.2709, test_loss: 1.2580, test_f1: 0.3334
 epoch: 12, train_loss: 1.2595, test_loss: 1.2412, test_f1: 0.3413
 epoch: 13, train_loss: 1.2431, test_loss: 1.2244, test_f1: 0.3413
 epoch: 14, train_loss: 1.2261, test_loss: 1.2067, test_f1: 0.3422
 epoch: 15, train_loss: 1.2147, test_loss: 1.1902, test_f1: 0.3422
 epoch: 16, train_loss: 1.1972, test_loss: 1.1706, test_f1: 0.3422
 epoch: 17, train_loss: 1.1805, test_loss: 1.1529, test_f1: 0.3460
 epoch: 18, train_loss: 1.1577, test_loss: 1.1361, test_f1: 0.3460
 epoch: 19, train_loss: 1.1484, test_loss: 1.1217, test_f1: 0.3450
 epoch: 20, train_loss: 1.1285, test_loss: 1.1093, test_f1: 0.3450
 epoch: 21, train_loss: 1.1184, test_loss: 1.1002, test_f1: 0.3430
 epoch: 22, train_loss: 1.1026, test_loss: 1.0910, test_f1: 0.3440
 epoch: 23, train_loss: 1.0909, test_loss: 1.0875, test_f1: 0.3440
 epoch: 24, train_loss: 1.0788, test_loss: 1.0825, test_f1: 0.3440
 epoch: 25, train_loss: 1.0671, test_loss: 1.0866, test_f1: 0.3341
 epoch: 26, train_loss: 1.0604, test_loss: 1.0731, test_f1: 0.3449
 epoch: 27, train_loss: 1.0532, test_loss: 1.0690, test_f1: 0.3418
 epoch: 28, train_loss: 1.0432, test_loss: 1.0761, test_f1: 0.3376
 epoch: 29, train_loss: 1.0362, test_loss: 1.0643, test_f1: 0.3551
 epoch: 30, train_loss: 1.0331, test_loss: 1.0607, test_f1: 0.3852
 epoch: 31, train_loss: 1.0317, test_loss: 1.0616, test_f1: 0.3947
 epoch: 32, train_loss: 1.0214, test_loss: 1.0553, test_f1: 0.4276
 epoch: 33, train_loss: 1.0152, test_loss: 1.0503, test_f1: 0.4228
 epoch: 34, train_loss: 1.0103, test_loss: 1.0525, test_f1: 0.4308
 epoch: 35, train_loss: 1.0015, test_loss: 1.0531, test_f1: 0.4567
 epoch: 36, train_loss: 1.0009, test_loss: 1.0430, test_f1: 0.4589
 epoch: 37, train_loss: 1.0004, test_loss: 1.0412, test_f1: 0.4625
 epoch: 38, train_loss: 0.9869, test_loss: 1.0355, test_f1: 0.4659
 epoch: 39, train_loss: 0.9849, test_loss: 1.0260, test_f1: 0.4736
 epoch: 40, train_loss: 0.9785, test_loss: 1.0194, test_f1: 0.4980
 epoch: 41, train_loss: 0.9695, test_loss: 1.0213, test_f1: 0.4904
 epoch: 42, train_loss: 0.9610, test_loss: 1.0252, test_f1: 0.5039
 epoch: 43, train_loss: 0.9567, test_loss: 1.0234, test_f1: 0.5008
 epoch: 44, train_loss: 0.9566, test_loss: 1.0176, test_f1: 0.4900
 epoch: 45, train_loss: 0.9540, test_loss: 1.0188, test_f1: 0.4961
 epoch: 46, train_loss: 0.9478, test_loss: 1.0055, test_f1: 0.4906
 epoch: 47, train_loss: 0.9485, test_loss: 1.0060, test_f1: 0.4828
 epoch: 48, train_loss: 0.9364, test_loss: 0.9970, test_f1: 0.4940
 epoch: 49, train_loss: 0.9347, test_loss: 0.9985, test_f1: 0.5007
 epoch: 50, train_loss: 0.9279, test_loss: 1.0007, test_f1: 0.4934
 epoch: 51, train_loss: 0.9373, test_loss: 1.0017, test_f1: 0.4995
 epoch: 52, train_loss: 0.9251, test_loss: 0.9943, test_f1: 0.4967
 epoch: 53, train_loss: 0.9179, test_loss: 0.9900, test_f1: 0.4929
 epoch: 54, train_loss: 0.9250, test_loss: 0.9922, test_f1: 0.4986
 epoch: 55, train_loss: 0.9280, test_loss: 0.9982, test_f1: 0.4914
 epoch: 56, train_loss: 0.9222, test_loss: 1.0002, test_f1: 0.4963
 epoch: 57, train_loss: 0.9185, test_loss: 0.9942, test_f1: 0.4998
 epoch: 58, train_loss: 0.9227, test_loss: 0.9820, test_f1: 0.4951
 epoch: 59, train_loss: 0.9238, test_loss: 0.9915, test_f1: 0.4922
 epoch: 60, train_loss: 0.9094, test_loss: 0.9969, test_f1: 0.4960
 epoch: 61, train_loss: 0.9143, test_loss: 0.9862, test_f1: 0.4961
 epoch: 62, train_loss: 0.9111, test_loss: 0.9897, test_f1: 0.4981
 epoch: 63, train_loss: 0.9185, test_loss: 0.9905, test_f1: 0.4932
 epoch: 64, train_loss: 0.9092, test_loss: 0.9948, test_f1: 0.4977
 epoch: 65, train_loss: 0.9057, test_loss: 0.9933, test_f1: 0.4918
 epoch: 66, train_loss: 0.9122, test_loss: 0.9916, test_f1: 0.5044
 epoch: 67, train_loss: 0.9140, test_loss: 0.9808, test_f1: 0.4954
 epoch: 68, train_loss: 0.9097, test_loss: 0.9927, test_f1: 0.4982
 epoch: 69, train_loss: 0.9160, test_loss: 0.9895, test_f1: 0.4982
 epoch: 70, train_loss: 0.9096, test_loss: 0.9914, test_f1: 0.5023
 epoch: 71, train_loss: 0.9031, test_loss: 0.9851, test_f1: 0.4994
 epoch: 72, train_loss: 0.8907, test_loss: 0.9964, test_f1: 0.4962
 epoch: 73, train_loss: 0.9120, test_loss: 0.9904, test_f1: 0.5042
 epoch: 74, train_loss: 0.8968, test_loss: 1.0043, test_f1: 0.4981
 epoch: 75, train_loss: 0.8990, test_loss: 0.9967, test_f1: 0.5021
 epoch: 76, train_loss: 0.9034, test_loss: 1.0057, test_f1: 0.4980
 epoch: 77, train_loss: 0.9027, test_loss: 0.9866, test_f1: 0.5017
 epoch: 78, train_loss: 0.8968, test_loss: 0.9944, test_f1: 0.4971
 epoch: 79, train_loss: 0.8961, test_loss: 0.9928, test_f1: 0.4976
 epoch: 80, train_loss: 0.8989, test_loss: 0.9888, test_f1: 0.4989
 epoch: 81, train_loss: 0.8997, test_loss: 0.9918, test_f1: 0.5032
 epoch: 82, train_loss: 0.8925, test_loss: 0.9843, test_f1: 0.4977
 epoch: 83, train_loss: 0.8965, test_loss: 0.9910, test_f1: 0.4971
 epoch: 84, train_loss: 0.8890, test_loss: 0.9898, test_f1: 0.5056
 epoch: 85, train_loss: 0.8921, test_loss: 0.9846, test_f1: 0.5028
 epoch: 86, train_loss: 0.8830, test_loss: 0.9720, test_f1: 0.4973
 epoch: 87, train_loss: 0.8846, test_loss: 0.9926, test_f1: 0.5001
 epoch: 88, train_loss: 0.8850, test_loss: 0.9838, test_f1: 0.5020
 epoch: 89, train_loss: 0.8938, test_loss: 0.9708, test_f1: 0.5070
 epoch: 90, train_loss: 0.8906, test_loss: 0.9746, test_f1: 0.5015
 epoch: 91, train_loss: 0.8913, test_loss: 0.9818, test_f1: 0.4990
 epoch: 92, train_loss: 0.8850, test_loss: 0.9871, test_f1: 0.4982
 epoch: 93, train_loss: 0.8788, test_loss: 0.9897, test_f1: 0.5017
 epoch: 94, train_loss: 0.8809, test_loss: 0.9823, test_f1: 0.5018
 epoch: 95, train_loss: 0.8760, test_loss: 0.9799, test_f1: 0.4999
 epoch: 96, train_loss: 0.8800, test_loss: 0.9760, test_f1: 0.5025
 epoch: 97, train_loss: 0.8862, test_loss: 0.9783, test_f1: 0.5011
 epoch: 98, train_loss: 0.8861, test_loss: 0.9780, test_f1: 0.4978
 epoch: 99, train_loss: 0.8837, test_loss: 0.9822, test_f1: 0.5045
##################ITERATION #1 ****************************************
 epoch: 0, train_loss: 1.3554, test_loss: 1.3734, test_f1: 0.2270
 epoch: 1, train_loss: 1.3334, test_loss: 1.3530, test_f1: 0.2651
 epoch: 2, train_loss: 1.3161, test_loss: 1.3071, test_f1: 0.3825
 epoch: 3, train_loss: 1.2985, test_loss: 1.2785, test_f1: 0.3961
 epoch: 4, train_loss: 1.2781, test_loss: 1.2539, test_f1: 0.4062
 epoch: 5, train_loss: 1.2565, test_loss: 1.2306, test_f1: 0.3953
 epoch: 6, train_loss: 1.2275, test_loss: 1.2048, test_f1: 0.3707
 epoch: 7, train_loss: 1.2088, test_loss: 1.1828, test_f1: 0.3736
 epoch: 8, train_loss: 1.1816, test_loss: 1.1588, test_f1: 0.3841
 epoch: 9, train_loss: 1.1626, test_loss: 1.1408, test_f1: 0.3764
 epoch: 10, train_loss: 1.1437, test_loss: 1.1258, test_f1: 0.3778
 epoch: 11, train_loss: 1.1235, test_loss: 1.1129, test_f1: 0.3698
 epoch: 12, train_loss: 1.1120, test_loss: 1.0991, test_f1: 0.3526
 epoch: 13, train_loss: 1.0961, test_loss: 1.0887, test_f1: 0.3614
 epoch: 14, train_loss: 1.0899, test_loss: 1.0875, test_f1: 0.3856
 epoch: 15, train_loss: 1.0815, test_loss: 1.0817, test_f1: 0.3752
 epoch: 16, train_loss: 1.0670, test_loss: 1.0720, test_f1: 0.3887
 epoch: 17, train_loss: 1.0632, test_loss: 1.0553, test_f1: 0.4059
 epoch: 18, train_loss: 1.0529, test_loss: 1.0621, test_f1: 0.4067
 epoch: 19, train_loss: 1.0473, test_loss: 1.0519, test_f1: 0.4138
 epoch: 20, train_loss: 1.0426, test_loss: 1.0506, test_f1: 0.4085
 epoch: 21, train_loss: 1.0321, test_loss: 1.0455, test_f1: 0.4258
 epoch: 22, train_loss: 1.0342, test_loss: 1.0501, test_f1: 0.4233
 epoch: 23, train_loss: 1.0221, test_loss: 1.0386, test_f1: 0.4383
 epoch: 24, train_loss: 1.0203, test_loss: 1.0356, test_f1: 0.4405
 epoch: 25, train_loss: 1.0114, test_loss: 1.0275, test_f1: 0.4511
 epoch: 26, train_loss: 1.0135, test_loss: 1.0263, test_f1: 0.4552
 epoch: 27, train_loss: 1.0056, test_loss: 1.0174, test_f1: 0.4560
 epoch: 28, train_loss: 1.0080, test_loss: 1.0251, test_f1: 0.4428
 epoch: 29, train_loss: 0.9975, test_loss: 1.0106, test_f1: 0.4720
 epoch: 30, train_loss: 0.9911, test_loss: 1.0034, test_f1: 0.4620
 epoch: 31, train_loss: 0.9904, test_loss: 1.0060, test_f1: 0.4727
 epoch: 32, train_loss: 0.9800, test_loss: 1.0027, test_f1: 0.4697
 epoch: 33, train_loss: 0.9887, test_loss: 1.0005, test_f1: 0.4678
 epoch: 34, train_loss: 0.9752, test_loss: 0.9977, test_f1: 0.4713
 epoch: 35, train_loss: 0.9693, test_loss: 1.0019, test_f1: 0.4719
 epoch: 36, train_loss: 0.9709, test_loss: 0.9937, test_f1: 0.4744
 epoch: 37, train_loss: 0.9772, test_loss: 0.9957, test_f1: 0.4799
 epoch: 38, train_loss: 0.9688, test_loss: 0.9983, test_f1: 0.4831
 epoch: 39, train_loss: 0.9655, test_loss: 0.9776, test_f1: 0.4802
 epoch: 40, train_loss: 0.9598, test_loss: 0.9823, test_f1: 0.4791
 epoch: 41, train_loss: 0.9575, test_loss: 0.9861, test_f1: 0.4897
 epoch: 42, train_loss: 0.9586, test_loss: 0.9864, test_f1: 0.4988
 epoch: 43, train_loss: 0.9479, test_loss: 0.9904, test_f1: 0.4903
 epoch: 44, train_loss: 0.9479, test_loss: 0.9827, test_f1: 0.4951
 epoch: 45, train_loss: 0.9560, test_loss: 0.9789, test_f1: 0.4980
 epoch: 46, train_loss: 0.9430, test_loss: 0.9763, test_f1: 0.4988
 epoch: 47, train_loss: 0.9471, test_loss: 0.9794, test_f1: 0.4994
 epoch: 48, train_loss: 0.9419, test_loss: 0.9632, test_f1: 0.5034
 epoch: 49, train_loss: 0.9411, test_loss: 0.9659, test_f1: 0.5000
 epoch: 50, train_loss: 0.9348, test_loss: 0.9732, test_f1: 0.4965
 epoch: 51, train_loss: 0.9294, test_loss: 0.9539, test_f1: 0.5050
 epoch: 52, train_loss: 0.9283, test_loss: 0.9563, test_f1: 0.5178
 epoch: 53, train_loss: 0.9318, test_loss: 0.9567, test_f1: 0.5130
 epoch: 54, train_loss: 0.9305, test_loss: 0.9562, test_f1: 0.5094
 epoch: 55, train_loss: 0.9320, test_loss: 0.9665, test_f1: 0.5088
 epoch: 56, train_loss: 0.9208, test_loss: 0.9552, test_f1: 0.5092
 epoch: 57, train_loss: 0.9249, test_loss: 0.9619, test_f1: 0.5103
 epoch: 58, train_loss: 0.9289, test_loss: 0.9688, test_f1: 0.5048
 epoch: 59, train_loss: 0.9275, test_loss: 0.9747, test_f1: 0.5080
 epoch: 60, train_loss: 0.9183, test_loss: 0.9658, test_f1: 0.5185
 epoch: 61, train_loss: 0.9205, test_loss: 0.9629, test_f1: 0.5152
 epoch: 62, train_loss: 0.9141, test_loss: 0.9501, test_f1: 0.5163
 epoch: 63, train_loss: 0.9202, test_loss: 0.9555, test_f1: 0.5133
 epoch: 64, train_loss: 0.9176, test_loss: 0.9641, test_f1: 0.5139
 epoch: 65, train_loss: 0.9198, test_loss: 0.9581, test_f1: 0.5295
 epoch: 66, train_loss: 0.9185, test_loss: 0.9522, test_f1: 0.5259
 epoch: 67, train_loss: 0.9188, test_loss: 0.9543, test_f1: 0.5223
 epoch: 68, train_loss: 0.9071, test_loss: 0.9550, test_f1: 0.5198
 epoch: 69, train_loss: 0.9137, test_loss: 0.9616, test_f1: 0.5210
 epoch: 70, train_loss: 0.9141, test_loss: 0.9605, test_f1: 0.5238
 epoch: 71, train_loss: 0.9052, test_loss: 0.9498, test_f1: 0.5271
 epoch: 72, train_loss: 0.9072, test_loss: 0.9433, test_f1: 0.5224
 epoch: 73, train_loss: 0.9031, test_loss: 0.9418, test_f1: 0.5255
 epoch: 74, train_loss: 0.9080, test_loss: 0.9481, test_f1: 0.5338
 epoch: 75, train_loss: 0.9103, test_loss: 0.9539, test_f1: 0.5230
 epoch: 76, train_loss: 0.9069, test_loss: 0.9516, test_f1: 0.5338
 epoch: 77, train_loss: 0.9077, test_loss: 0.9443, test_f1: 0.5333
 epoch: 78, train_loss: 0.9005, test_loss: 0.9466, test_f1: 0.5318
 epoch: 79, train_loss: 0.9090, test_loss: 0.9472, test_f1: 0.5222
 epoch: 80, train_loss: 0.8992, test_loss: 0.9506, test_f1: 0.5203
 epoch: 81, train_loss: 0.9021, test_loss: 0.9554, test_f1: 0.5228
 epoch: 82, train_loss: 0.8972, test_loss: 0.9453, test_f1: 0.5324
 epoch: 83, train_loss: 0.9032, test_loss: 0.9424, test_f1: 0.5195
 epoch: 84, train_loss: 0.8964, test_loss: 0.9365, test_f1: 0.5282
 epoch: 85, train_loss: 0.8907, test_loss: 0.9419, test_f1: 0.5243
 epoch: 86, train_loss: 0.9047, test_loss: 0.9482, test_f1: 0.5185
 epoch: 87, train_loss: 0.8937, test_loss: 0.9434, test_f1: 0.5267
 epoch: 88, train_loss: 0.8950, test_loss: 0.9448, test_f1: 0.5191
 epoch: 89, train_loss: 0.8939, test_loss: 0.9411, test_f1: 0.5383
 epoch: 90, train_loss: 0.8874, test_loss: 0.9384, test_f1: 0.5496
 epoch: 91, train_loss: 0.8971, test_loss: 0.9411, test_f1: 0.5198
 epoch: 92, train_loss: 0.8912, test_loss: 0.9460, test_f1: 0.5241
 epoch: 93, train_loss: 0.8917, test_loss: 0.9449, test_f1: 0.5269
 epoch: 94, train_loss: 0.8900, test_loss: 0.9325, test_f1: 0.5274
 epoch: 95, train_loss: 0.8951, test_loss: 0.9355, test_f1: 0.5318
 epoch: 96, train_loss: 0.8941, test_loss: 0.9328, test_f1: 0.5416
 epoch: 97, train_loss: 0.8861, test_loss: 0.9394, test_f1: 0.5434
 epoch: 98, train_loss: 0.8935, test_loss: 0.9505, test_f1: 0.5306
 epoch: 99, train_loss: 0.8963, test_loss: 0.9303, test_f1: 0.5339
##################ITERATION #2 ****************************************
 epoch: 0, train_loss: 1.3217, test_loss: 1.3351, test_f1: 0.2270
 epoch: 1, train_loss: 1.2984, test_loss: 1.3097, test_f1: 0.2270
 epoch: 2, train_loss: 1.2885, test_loss: 1.2869, test_f1: 0.2270
 epoch: 3, train_loss: 1.2752, test_loss: 1.2684, test_f1: 0.2270
 epoch: 4, train_loss: 1.2645, test_loss: 1.2518, test_f1: 0.2270
 epoch: 5, train_loss: 1.2488, test_loss: 1.2352, test_f1: 0.2270
 epoch: 6, train_loss: 1.2374, test_loss: 1.2204, test_f1: 0.2295
 epoch: 7, train_loss: 1.2248, test_loss: 1.2047, test_f1: 0.2405
 epoch: 8, train_loss: 1.2131, test_loss: 1.1891, test_f1: 0.2453
 epoch: 9, train_loss: 1.1958, test_loss: 1.1725, test_f1: 0.2640
 epoch: 10, train_loss: 1.1869, test_loss: 1.1575, test_f1: 0.2998
 epoch: 11, train_loss: 1.1737, test_loss: 1.1435, test_f1: 0.3542
 epoch: 12, train_loss: 1.1582, test_loss: 1.1281, test_f1: 0.4027
 epoch: 13, train_loss: 1.1443, test_loss: 1.1164, test_f1: 0.4027
 epoch: 14, train_loss: 1.1268, test_loss: 1.0978, test_f1: 0.4210
 epoch: 15, train_loss: 1.1181, test_loss: 1.0811, test_f1: 0.4369
 epoch: 16, train_loss: 1.1035, test_loss: 1.0665, test_f1: 0.4447
 epoch: 17, train_loss: 1.0902, test_loss: 1.0538, test_f1: 0.4486
 epoch: 18, train_loss: 1.0764, test_loss: 1.0413, test_f1: 0.4513
 epoch: 19, train_loss: 1.0629, test_loss: 1.0336, test_f1: 0.4474
 epoch: 20, train_loss: 1.0466, test_loss: 1.0247, test_f1: 0.4712
 epoch: 21, train_loss: 1.0445, test_loss: 1.0131, test_f1: 0.4649
 epoch: 22, train_loss: 1.0337, test_loss: 1.0118, test_f1: 0.4578
 epoch: 23, train_loss: 1.0257, test_loss: 1.0048, test_f1: 0.4826
 epoch: 24, train_loss: 1.0178, test_loss: 1.0018, test_f1: 0.4940
 epoch: 25, train_loss: 1.0060, test_loss: 0.9994, test_f1: 0.4586
 epoch: 26, train_loss: 1.0055, test_loss: 0.9915, test_f1: 0.4861
 epoch: 27, train_loss: 0.9903, test_loss: 0.9881, test_f1: 0.4755
 epoch: 28, train_loss: 0.9934, test_loss: 0.9835, test_f1: 0.4936
 epoch: 29, train_loss: 0.9906, test_loss: 0.9849, test_f1: 0.4905
 epoch: 30, train_loss: 0.9824, test_loss: 0.9789, test_f1: 0.4907
 epoch: 31, train_loss: 0.9736, test_loss: 0.9845, test_f1: 0.4811
 epoch: 32, train_loss: 0.9701, test_loss: 0.9838, test_f1: 0.5047
 epoch: 33, train_loss: 0.9687, test_loss: 0.9740, test_f1: 0.4971
 epoch: 34, train_loss: 0.9616, test_loss: 0.9742, test_f1: 0.5066
 epoch: 35, train_loss: 0.9565, test_loss: 0.9698, test_f1: 0.5111
 epoch: 36, train_loss: 0.9645, test_loss: 0.9712, test_f1: 0.4967
 epoch: 37, train_loss: 0.9538, test_loss: 0.9734, test_f1: 0.5091
 epoch: 38, train_loss: 0.9457, test_loss: 0.9683, test_f1: 0.5107
 epoch: 39, train_loss: 0.9450, test_loss: 0.9729, test_f1: 0.5067
 epoch: 40, train_loss: 0.9437, test_loss: 0.9772, test_f1: 0.4939
 epoch: 41, train_loss: 0.9478, test_loss: 0.9731, test_f1: 0.4968
 epoch: 42, train_loss: 0.9350, test_loss: 0.9582, test_f1: 0.5239
 epoch: 43, train_loss: 0.9415, test_loss: 0.9629, test_f1: 0.5085
 epoch: 44, train_loss: 0.9448, test_loss: 0.9620, test_f1: 0.5119
 epoch: 45, train_loss: 0.9269, test_loss: 0.9835, test_f1: 0.5121
 epoch: 46, train_loss: 0.9312, test_loss: 0.9594, test_f1: 0.5068
 epoch: 47, train_loss: 0.9253, test_loss: 0.9569, test_f1: 0.5073
 epoch: 48, train_loss: 0.9331, test_loss: 0.9633, test_f1: 0.5185
 epoch: 49, train_loss: 0.9171, test_loss: 0.9557, test_f1: 0.5173
 epoch: 50, train_loss: 0.9244, test_loss: 0.9703, test_f1: 0.5148
 epoch: 51, train_loss: 0.9169, test_loss: 0.9502, test_f1: 0.5230
 epoch: 52, train_loss: 0.9158, test_loss: 0.9520, test_f1: 0.5122
 epoch: 53, train_loss: 0.9099, test_loss: 0.9629, test_f1: 0.5134
 epoch: 54, train_loss: 0.9125, test_loss: 0.9533, test_f1: 0.5204
 epoch: 55, train_loss: 0.9056, test_loss: 0.9563, test_f1: 0.5114
 epoch: 56, train_loss: 0.9059, test_loss: 0.9529, test_f1: 0.5091
 epoch: 57, train_loss: 0.8994, test_loss: 0.9459, test_f1: 0.5230
 epoch: 58, train_loss: 0.9025, test_loss: 0.9469, test_f1: 0.5138
 epoch: 59, train_loss: 0.9001, test_loss: 0.9518, test_f1: 0.5114
 epoch: 60, train_loss: 0.9031, test_loss: 0.9468, test_f1: 0.5163
 epoch: 61, train_loss: 0.9004, test_loss: 0.9493, test_f1: 0.5200
 epoch: 62, train_loss: 0.9022, test_loss: 0.9487, test_f1: 0.5171
 epoch: 63, train_loss: 0.8983, test_loss: 0.9501, test_f1: 0.5117
 epoch: 64, train_loss: 0.9001, test_loss: 0.9595, test_f1: 0.5170
 epoch: 65, train_loss: 0.9076, test_loss: 0.9444, test_f1: 0.5210
 epoch: 66, train_loss: 0.9001, test_loss: 0.9462, test_f1: 0.5266
 epoch: 67, train_loss: 0.8977, test_loss: 0.9447, test_f1: 0.5335
 epoch: 68, train_loss: 0.8995, test_loss: 0.9432, test_f1: 0.5182
 epoch: 69, train_loss: 0.8961, test_loss: 0.9413, test_f1: 0.5231
 epoch: 70, train_loss: 0.8971, test_loss: 0.9448, test_f1: 0.5180
 epoch: 71, train_loss: 0.8963, test_loss: 0.9558, test_f1: 0.5092
 epoch: 72, train_loss: 0.8911, test_loss: 0.9473, test_f1: 0.5225
 epoch: 73, train_loss: 0.8856, test_loss: 0.9527, test_f1: 0.5035
 epoch: 74, train_loss: 0.8924, test_loss: 0.9435, test_f1: 0.5178
 epoch: 75, train_loss: 0.8911, test_loss: 0.9367, test_f1: 0.5156
 epoch: 76, train_loss: 0.8952, test_loss: 0.9417, test_f1: 0.5158
 epoch: 77, train_loss: 0.8942, test_loss: 0.9430, test_f1: 0.5195
 epoch: 78, train_loss: 0.8919, test_loss: 0.9420, test_f1: 0.5302
 epoch: 79, train_loss: 0.8945, test_loss: 0.9428, test_f1: 0.5190
 epoch: 80, train_loss: 0.8901, test_loss: 0.9377, test_f1: 0.5203
 epoch: 81, train_loss: 0.8919, test_loss: 0.9535, test_f1: 0.5148
 epoch: 82, train_loss: 0.8862, test_loss: 0.9371, test_f1: 0.5249
 epoch: 83, train_loss: 0.8841, test_loss: 0.9396, test_f1: 0.5224
 epoch: 84, train_loss: 0.8796, test_loss: 0.9454, test_f1: 0.5113
 epoch: 85, train_loss: 0.8822, test_loss: 0.9355, test_f1: 0.5245
 epoch: 86, train_loss: 0.8853, test_loss: 0.9444, test_f1: 0.5119
 epoch: 87, train_loss: 0.8791, test_loss: 0.9342, test_f1: 0.5426
 epoch: 88, train_loss: 0.8816, test_loss: 0.9392, test_f1: 0.5233
 epoch: 89, train_loss: 0.8732, test_loss: 0.9395, test_f1: 0.5130
 epoch: 90, train_loss: 0.8852, test_loss: 0.9437, test_f1: 0.5193
 epoch: 91, train_loss: 0.8819, test_loss: 0.9324, test_f1: 0.5137
 epoch: 92, train_loss: 0.8746, test_loss: 0.9312, test_f1: 0.5205
 epoch: 93, train_loss: 0.8763, test_loss: 0.9368, test_f1: 0.5283
 epoch: 94, train_loss: 0.8799, test_loss: 0.9333, test_f1: 0.5279
 epoch: 95, train_loss: 0.8720, test_loss: 0.9363, test_f1: 0.5154
 epoch: 96, train_loss: 0.8758, test_loss: 0.9308, test_f1: 0.5263
 epoch: 97, train_loss: 0.8669, test_loss: 0.9323, test_f1: 0.5334
 epoch: 98, train_loss: 0.8680, test_loss: 0.9240, test_f1: 0.5271
 epoch: 99, train_loss: 0.8733, test_loss: 0.9281, test_f1: 0.5268
##################ITERATION #3 ****************************************
 epoch: 0, train_loss: 1.3072, test_loss: 1.3399, test_f1: 0.2270
 epoch: 1, train_loss: 1.2692, test_loss: 1.3118, test_f1: 0.2270
 epoch: 2, train_loss: 1.2406, test_loss: 1.2506, test_f1: 0.3158
 epoch: 3, train_loss: 1.2175, test_loss: 1.1967, test_f1: 0.3354
 epoch: 4, train_loss: 1.1954, test_loss: 1.1722, test_f1: 0.3466
 epoch: 5, train_loss: 1.1721, test_loss: 1.1503, test_f1: 0.3512
 epoch: 6, train_loss: 1.1491, test_loss: 1.1372, test_f1: 0.3522
 epoch: 7, train_loss: 1.1298, test_loss: 1.1189, test_f1: 0.3584
 epoch: 8, train_loss: 1.1186, test_loss: 1.1098, test_f1: 0.3581
 epoch: 9, train_loss: 1.1047, test_loss: 1.0995, test_f1: 0.3646
 epoch: 10, train_loss: 1.0892, test_loss: 1.0817, test_f1: 0.3792
 epoch: 11, train_loss: 1.0773, test_loss: 1.0713, test_f1: 0.3807
 epoch: 12, train_loss: 1.0651, test_loss: 1.0700, test_f1: 0.4016
 epoch: 13, train_loss: 1.0580, test_loss: 1.0558, test_f1: 0.4058
 epoch: 14, train_loss: 1.0460, test_loss: 1.0586, test_f1: 0.4254
 epoch: 15, train_loss: 1.0346, test_loss: 1.0370, test_f1: 0.4359
 epoch: 16, train_loss: 1.0259, test_loss: 1.0373, test_f1: 0.4439
 epoch: 17, train_loss: 1.0169, test_loss: 1.0325, test_f1: 0.4539
 epoch: 18, train_loss: 1.0117, test_loss: 1.0267, test_f1: 0.4562
 epoch: 19, train_loss: 1.0066, test_loss: 1.0222, test_f1: 0.4627
 epoch: 20, train_loss: 0.9942, test_loss: 1.0224, test_f1: 0.4658
 epoch: 21, train_loss: 0.9916, test_loss: 1.0038, test_f1: 0.4787
 epoch: 22, train_loss: 0.9866, test_loss: 1.0177, test_f1: 0.4903
 epoch: 23, train_loss: 0.9810, test_loss: 0.9890, test_f1: 0.4910
 epoch: 24, train_loss: 0.9771, test_loss: 1.0067, test_f1: 0.4731
 epoch: 25, train_loss: 0.9681, test_loss: 0.9885, test_f1: 0.5001
 epoch: 26, train_loss: 0.9671, test_loss: 0.9899, test_f1: 0.4935
 epoch: 27, train_loss: 0.9545, test_loss: 0.9768, test_f1: 0.4876
 epoch: 28, train_loss: 0.9617, test_loss: 0.9775, test_f1: 0.5008
 epoch: 29, train_loss: 0.9476, test_loss: 0.9623, test_f1: 0.4993
 epoch: 30, train_loss: 0.9508, test_loss: 0.9464, test_f1: 0.5117
 epoch: 31, train_loss: 0.9436, test_loss: 0.9696, test_f1: 0.5035
 epoch: 32, train_loss: 0.9394, test_loss: 0.9758, test_f1: 0.4983
 epoch: 33, train_loss: 0.9439, test_loss: 0.9425, test_f1: 0.5072
 epoch: 34, train_loss: 0.9318, test_loss: 0.9326, test_f1: 0.5073
 epoch: 35, train_loss: 0.9288, test_loss: 0.9469, test_f1: 0.5032
 epoch: 36, train_loss: 0.9201, test_loss: 0.9216, test_f1: 0.5220
 epoch: 37, train_loss: 0.9210, test_loss: 0.9228, test_f1: 0.5129
 epoch: 38, train_loss: 0.9226, test_loss: 0.9043, test_f1: 0.5137
 epoch: 39, train_loss: 0.9210, test_loss: 0.9115, test_f1: 0.5076
 epoch: 40, train_loss: 0.9112, test_loss: 0.9233, test_f1: 0.5053
 epoch: 41, train_loss: 0.9135, test_loss: 0.9068, test_f1: 0.5108
 epoch: 42, train_loss: 0.9152, test_loss: 0.9215, test_f1: 0.5141
 epoch: 43, train_loss: 0.9082, test_loss: 0.9130, test_f1: 0.5203
 epoch: 44, train_loss: 0.9051, test_loss: 0.8951, test_f1: 0.5222
 epoch: 45, train_loss: 0.9092, test_loss: 0.8966, test_f1: 0.5190
 epoch: 46, train_loss: 0.9039, test_loss: 0.9151, test_f1: 0.5049
 epoch: 47, train_loss: 0.8961, test_loss: 0.8923, test_f1: 0.5259
 epoch: 48, train_loss: 0.8955, test_loss: 0.8940, test_f1: 0.5230
 epoch: 49, train_loss: 0.8978, test_loss: 0.8964, test_f1: 0.5318
 epoch: 50, train_loss: 0.8965, test_loss: 0.8887, test_f1: 0.5274
 epoch: 51, train_loss: 0.8915, test_loss: 0.8868, test_f1: 0.5278
 epoch: 52, train_loss: 0.8899, test_loss: 0.8827, test_f1: 0.5232
 epoch: 53, train_loss: 0.8815, test_loss: 0.8855, test_f1: 0.5315
 epoch: 54, train_loss: 0.8854, test_loss: 0.8850, test_f1: 0.5268
 epoch: 55, train_loss: 0.8793, test_loss: 0.8929, test_f1: 0.5208
 epoch: 56, train_loss: 0.8721, test_loss: 0.8935, test_f1: 0.5234
 epoch: 57, train_loss: 0.8777, test_loss: 0.8885, test_f1: 0.5280
 epoch: 58, train_loss: 0.8829, test_loss: 0.8856, test_f1: 0.5348
 epoch: 59, train_loss: 0.8836, test_loss: 0.8865, test_f1: 0.5302
 epoch: 60, train_loss: 0.8735, test_loss: 0.8858, test_f1: 0.5293
 epoch: 61, train_loss: 0.8812, test_loss: 0.8874, test_f1: 0.5262
 epoch: 62, train_loss: 0.8786, test_loss: 0.8833, test_f1: 0.5268
 epoch: 63, train_loss: 0.8754, test_loss: 0.8916, test_f1: 0.5207
 epoch: 64, train_loss: 0.8726, test_loss: 0.8841, test_f1: 0.5341
 epoch: 65, train_loss: 0.8708, test_loss: 0.8860, test_f1: 0.5312
 epoch: 66, train_loss: 0.8771, test_loss: 0.8883, test_f1: 0.5184
 epoch: 67, train_loss: 0.8789, test_loss: 0.8861, test_f1: 0.5263
 epoch: 68, train_loss: 0.8703, test_loss: 0.8793, test_f1: 0.5306
 epoch: 69, train_loss: 0.8675, test_loss: 0.8805, test_f1: 0.5363
 epoch: 70, train_loss: 0.8748, test_loss: 0.8864, test_f1: 0.5321
 epoch: 71, train_loss: 0.8747, test_loss: 0.8817, test_f1: 0.5283
 epoch: 72, train_loss: 0.8603, test_loss: 0.8764, test_f1: 0.5367
 epoch: 73, train_loss: 0.8675, test_loss: 0.8798, test_f1: 0.5289
 epoch: 74, train_loss: 0.8607, test_loss: 0.8806, test_f1: 0.5353
 epoch: 75, train_loss: 0.8597, test_loss: 0.8895, test_f1: 0.5271
 epoch: 76, train_loss: 0.8589, test_loss: 0.8790, test_f1: 0.5359
 epoch: 77, train_loss: 0.8629, test_loss: 0.8831, test_f1: 0.5286
 epoch: 78, train_loss: 0.8596, test_loss: 0.8815, test_f1: 0.5344
 epoch: 79, train_loss: 0.8679, test_loss: 0.8795, test_f1: 0.5391
 epoch: 80, train_loss: 0.8559, test_loss: 0.8792, test_f1: 0.5467
 epoch: 81, train_loss: 0.8615, test_loss: 0.8764, test_f1: 0.5340
 epoch: 82, train_loss: 0.8596, test_loss: 0.8785, test_f1: 0.5359
 epoch: 83, train_loss: 0.8593, test_loss: 0.8823, test_f1: 0.5397
 epoch: 84, train_loss: 0.8545, test_loss: 0.8749, test_f1: 0.5362
 epoch: 85, train_loss: 0.8602, test_loss: 0.8683, test_f1: 0.5366
 epoch: 86, train_loss: 0.8626, test_loss: 0.8877, test_f1: 0.5375
 epoch: 87, train_loss: 0.8556, test_loss: 0.8835, test_f1: 0.5397
 epoch: 88, train_loss: 0.8568, test_loss: 0.8763, test_f1: 0.5412
 epoch: 89, train_loss: 0.8538, test_loss: 0.8764, test_f1: 0.5286
 epoch: 90, train_loss: 0.8583, test_loss: 0.8743, test_f1: 0.5526
 epoch: 91, train_loss: 0.8526, test_loss: 0.8721, test_f1: 0.5502
 epoch: 92, train_loss: 0.8518, test_loss: 0.8825, test_f1: 0.5338
 epoch: 93, train_loss: 0.8440, test_loss: 0.8759, test_f1: 0.5464
 epoch: 94, train_loss: 0.8494, test_loss: 0.8791, test_f1: 0.5333
 epoch: 95, train_loss: 0.8477, test_loss: 0.8711, test_f1: 0.5388
 epoch: 96, train_loss: 0.8408, test_loss: 0.8800, test_f1: 0.5432
 epoch: 97, train_loss: 0.8453, test_loss: 0.8677, test_f1: 0.5437
 epoch: 98, train_loss: 0.8442, test_loss: 0.8871, test_f1: 0.5426
 epoch: 99, train_loss: 0.8477, test_loss: 0.8782, test_f1: 0.5419
##################ITERATION #4 ****************************************
 epoch: 0, train_loss: 1.2836, test_loss: 1.3122, test_f1: 0.2270
 epoch: 1, train_loss: 1.2321, test_loss: 1.2463, test_f1: 0.2270
 epoch: 2, train_loss: 1.2066, test_loss: 1.1929, test_f1: 0.3215
 epoch: 3, train_loss: 1.1788, test_loss: 1.1550, test_f1: 0.3859
 epoch: 4, train_loss: 1.1545, test_loss: 1.1351, test_f1: 0.4019
 epoch: 5, train_loss: 1.1413, test_loss: 1.1171, test_f1: 0.4236
 epoch: 6, train_loss: 1.1242, test_loss: 1.1027, test_f1: 0.4327
 epoch: 7, train_loss: 1.1090, test_loss: 1.0968, test_f1: 0.4346
 epoch: 8, train_loss: 1.0901, test_loss: 1.0897, test_f1: 0.4370
 epoch: 9, train_loss: 1.0830, test_loss: 1.0815, test_f1: 0.4380
 epoch: 10, train_loss: 1.0672, test_loss: 1.0719, test_f1: 0.4315
 epoch: 11, train_loss: 1.0614, test_loss: 1.0608, test_f1: 0.4405
 epoch: 12, train_loss: 1.0500, test_loss: 1.0668, test_f1: 0.4396
 epoch: 13, train_loss: 1.0515, test_loss: 1.0494, test_f1: 0.4366
 epoch: 14, train_loss: 1.0385, test_loss: 1.0538, test_f1: 0.4476
 epoch: 15, train_loss: 1.0329, test_loss: 1.0415, test_f1: 0.4701
 epoch: 16, train_loss: 1.0280, test_loss: 1.0346, test_f1: 0.4543
 epoch: 17, train_loss: 1.0198, test_loss: 1.0229, test_f1: 0.4708
 epoch: 18, train_loss: 1.0150, test_loss: 1.0239, test_f1: 0.4593
 epoch: 19, train_loss: 1.0151, test_loss: 1.0121, test_f1: 0.4744
 epoch: 20, train_loss: 1.0090, test_loss: 1.0090, test_f1: 0.4715
 epoch: 21, train_loss: 1.0021, test_loss: 1.0021, test_f1: 0.4799
 epoch: 22, train_loss: 0.9993, test_loss: 0.9982, test_f1: 0.4868
 epoch: 23, train_loss: 0.9924, test_loss: 0.9965, test_f1: 0.4810
 epoch: 24, train_loss: 0.9893, test_loss: 0.9993, test_f1: 0.4807
 epoch: 25, train_loss: 0.9817, test_loss: 0.9918, test_f1: 0.4759
 epoch: 26, train_loss: 0.9889, test_loss: 0.9825, test_f1: 0.5029
 epoch: 27, train_loss: 0.9796, test_loss: 0.9787, test_f1: 0.4910
 epoch: 28, train_loss: 0.9695, test_loss: 0.9798, test_f1: 0.4930
 epoch: 29, train_loss: 0.9655, test_loss: 0.9750, test_f1: 0.4945
 epoch: 30, train_loss: 0.9626, test_loss: 0.9748, test_f1: 0.4917
 epoch: 31, train_loss: 0.9597, test_loss: 0.9682, test_f1: 0.4853
 epoch: 32, train_loss: 0.9544, test_loss: 0.9655, test_f1: 0.4830
 epoch: 33, train_loss: 0.9556, test_loss: 0.9528, test_f1: 0.4878
 epoch: 34, train_loss: 0.9550, test_loss: 0.9473, test_f1: 0.4944
 epoch: 35, train_loss: 0.9493, test_loss: 0.9653, test_f1: 0.4924
 epoch: 36, train_loss: 0.9516, test_loss: 0.9567, test_f1: 0.4978
 epoch: 37, train_loss: 0.9394, test_loss: 0.9562, test_f1: 0.4914
 epoch: 38, train_loss: 0.9403, test_loss: 0.9519, test_f1: 0.4996
 epoch: 39, train_loss: 0.9310, test_loss: 0.9405, test_f1: 0.5091
 epoch: 40, train_loss: 0.9322, test_loss: 0.9341, test_f1: 0.4983
 epoch: 41, train_loss: 0.9314, test_loss: 0.9403, test_f1: 0.5047
 epoch: 42, train_loss: 0.9277, test_loss: 0.9368, test_f1: 0.5014
 epoch: 43, train_loss: 0.9180, test_loss: 0.9459, test_f1: 0.5050
 epoch: 44, train_loss: 0.9186, test_loss: 0.9276, test_f1: 0.5038
 epoch: 45, train_loss: 0.9099, test_loss: 0.9262, test_f1: 0.5051
 epoch: 46, train_loss: 0.9243, test_loss: 0.9472, test_f1: 0.4970
 epoch: 47, train_loss: 0.9178, test_loss: 0.9310, test_f1: 0.4996
 epoch: 48, train_loss: 0.9065, test_loss: 0.9200, test_f1: 0.5034
 epoch: 49, train_loss: 0.9126, test_loss: 0.9249, test_f1: 0.5194
 epoch: 50, train_loss: 0.9094, test_loss: 0.9292, test_f1: 0.5133
 epoch: 51, train_loss: 0.8996, test_loss: 0.9250, test_f1: 0.5200
 epoch: 52, train_loss: 0.8999, test_loss: 0.9240, test_f1: 0.5309
 epoch: 53, train_loss: 0.8970, test_loss: 0.9211, test_f1: 0.5261
 epoch: 54, train_loss: 0.8935, test_loss: 0.9235, test_f1: 0.5204
 epoch: 55, train_loss: 0.8969, test_loss: 0.9321, test_f1: 0.5292
 epoch: 56, train_loss: 0.8902, test_loss: 0.9150, test_f1: 0.5275
 epoch: 57, train_loss: 0.9000, test_loss: 0.9167, test_f1: 0.5212
 epoch: 58, train_loss: 0.8942, test_loss: 0.9119, test_f1: 0.5222
 epoch: 59, train_loss: 0.8912, test_loss: 0.9079, test_f1: 0.5193
 epoch: 60, train_loss: 0.8933, test_loss: 0.9087, test_f1: 0.5243
 epoch: 61, train_loss: 0.8851, test_loss: 0.9149, test_f1: 0.5219
 epoch: 62, train_loss: 0.8857, test_loss: 0.9153, test_f1: 0.5219
 epoch: 63, train_loss: 0.8858, test_loss: 0.9107, test_f1: 0.5231
 epoch: 64, train_loss: 0.8922, test_loss: 0.9224, test_f1: 0.5221
 epoch: 65, train_loss: 0.8876, test_loss: 0.9190, test_f1: 0.5222
 epoch: 66, train_loss: 0.8815, test_loss: 0.9093, test_f1: 0.5224
 epoch: 67, train_loss: 0.8800, test_loss: 0.9053, test_f1: 0.5222
 epoch: 68, train_loss: 0.8771, test_loss: 0.9153, test_f1: 0.5242
 epoch: 69, train_loss: 0.8713, test_loss: 0.9023, test_f1: 0.5251
 epoch: 70, train_loss: 0.8825, test_loss: 0.8983, test_f1: 0.5251
 epoch: 71, train_loss: 0.8743, test_loss: 0.8960, test_f1: 0.5200
 epoch: 72, train_loss: 0.8841, test_loss: 0.9011, test_f1: 0.5191
 epoch: 73, train_loss: 0.8769, test_loss: 0.9001, test_f1: 0.5264
 epoch: 74, train_loss: 0.8758, test_loss: 0.9057, test_f1: 0.5247
 epoch: 75, train_loss: 0.8738, test_loss: 0.8900, test_f1: 0.5243
 epoch: 76, train_loss: 0.8664, test_loss: 0.8998, test_f1: 0.5210
 epoch: 77, train_loss: 0.8794, test_loss: 0.8903, test_f1: 0.5279
 epoch: 78, train_loss: 0.8773, test_loss: 0.9145, test_f1: 0.5179
 epoch: 79, train_loss: 0.8743, test_loss: 0.9063, test_f1: 0.5169
 epoch: 80, train_loss: 0.8761, test_loss: 0.8939, test_f1: 0.5244
 epoch: 81, train_loss: 0.8741, test_loss: 0.9101, test_f1: 0.5307
 epoch: 82, train_loss: 0.8757, test_loss: 0.9015, test_f1: 0.5259
 epoch: 83, train_loss: 0.8724, test_loss: 0.9080, test_f1: 0.5288
 epoch: 84, train_loss: 0.8668, test_loss: 0.9099, test_f1: 0.5301
 epoch: 85, train_loss: 0.8715, test_loss: 0.9056, test_f1: 0.5273
 epoch: 86, train_loss: 0.8632, test_loss: 0.8915, test_f1: 0.5329
 epoch: 87, train_loss: 0.8624, test_loss: 0.9079, test_f1: 0.5282
 epoch: 88, train_loss: 0.8687, test_loss: 0.8978, test_f1: 0.5305
 epoch: 89, train_loss: 0.8623, test_loss: 0.8978, test_f1: 0.5257
 epoch: 90, train_loss: 0.8576, test_loss: 0.8984, test_f1: 0.5281
 epoch: 91, train_loss: 0.8623, test_loss: 0.8924, test_f1: 0.5351
 epoch: 92, train_loss: 0.8633, test_loss: 0.8941, test_f1: 0.5334
 epoch: 93, train_loss: 0.8636, test_loss: 0.8936, test_f1: 0.5370
 epoch: 94, train_loss: 0.8583, test_loss: 0.8907, test_f1: 0.5369
 epoch: 95, train_loss: 0.8598, test_loss: 0.8957, test_f1: 0.5298
 epoch: 96, train_loss: 0.8613, test_loss: 0.8915, test_f1: 0.5359
 epoch: 97, train_loss: 0.8517, test_loss: 0.8826, test_f1: 0.5299
 epoch: 98, train_loss: 0.8586, test_loss: 0.8950, test_f1: 0.5339
 epoch: 99, train_loss: 0.8530, test_loss: 0.8928, test_f1: 0.5331
##################ITERATION #5 ****************************************
 epoch: 0, train_loss: 1.2459, test_loss: 1.3596, test_f1: 0.2270
 epoch: 1, train_loss: 1.1803, test_loss: 1.2634, test_f1: 0.3127
 epoch: 2, train_loss: 1.1523, test_loss: 1.1298, test_f1: 0.3422
 epoch: 3, train_loss: 1.1281, test_loss: 1.0874, test_f1: 0.3469
 epoch: 4, train_loss: 1.1157, test_loss: 1.0759, test_f1: 0.3619
 epoch: 5, train_loss: 1.0936, test_loss: 1.0631, test_f1: 0.3698
 epoch: 6, train_loss: 1.0797, test_loss: 1.0547, test_f1: 0.3777
 epoch: 7, train_loss: 1.0703, test_loss: 1.0459, test_f1: 0.3864
 epoch: 8, train_loss: 1.0600, test_loss: 1.0474, test_f1: 0.4054
 epoch: 9, train_loss: 1.0516, test_loss: 1.0387, test_f1: 0.4180
 epoch: 10, train_loss: 1.0379, test_loss: 1.0372, test_f1: 0.4284
 epoch: 11, train_loss: 1.0283, test_loss: 1.0160, test_f1: 0.4332
 epoch: 12, train_loss: 1.0303, test_loss: 1.0209, test_f1: 0.4520
 epoch: 13, train_loss: 1.0144, test_loss: 1.0083, test_f1: 0.4651
 epoch: 14, train_loss: 1.0092, test_loss: 1.0027, test_f1: 0.4687
 epoch: 15, train_loss: 0.9957, test_loss: 0.9956, test_f1: 0.4837
 epoch: 16, train_loss: 0.9950, test_loss: 1.0045, test_f1: 0.4802
 epoch: 17, train_loss: 0.9884, test_loss: 1.0031, test_f1: 0.4839
 epoch: 18, train_loss: 0.9819, test_loss: 0.9637, test_f1: 0.4915
 epoch: 19, train_loss: 0.9793, test_loss: 0.9642, test_f1: 0.4946
 epoch: 20, train_loss: 0.9696, test_loss: 0.9705, test_f1: 0.4895
 epoch: 21, train_loss: 0.9621, test_loss: 0.9660, test_f1: 0.4929
 epoch: 22, train_loss: 0.9585, test_loss: 0.9838, test_f1: 0.4889
 epoch: 23, train_loss: 0.9531, test_loss: 0.9553, test_f1: 0.4961
 epoch: 24, train_loss: 0.9616, test_loss: 0.9922, test_f1: 0.5016
 epoch: 25, train_loss: 0.9398, test_loss: 0.9798, test_f1: 0.5044
 epoch: 26, train_loss: 0.9455, test_loss: 0.9617, test_f1: 0.5079
 epoch: 27, train_loss: 0.9326, test_loss: 0.9675, test_f1: 0.4991
 epoch: 28, train_loss: 0.9196, test_loss: 0.9597, test_f1: 0.5067
 epoch: 29, train_loss: 0.9302, test_loss: 0.9487, test_f1: 0.5063
 epoch: 30, train_loss: 0.9206, test_loss: 0.9632, test_f1: 0.5084
 epoch: 31, train_loss: 0.9184, test_loss: 0.9600, test_f1: 0.5168
 epoch: 32, train_loss: 0.9036, test_loss: 0.9617, test_f1: 0.5035
 epoch: 33, train_loss: 0.9021, test_loss: 0.9595, test_f1: 0.5291
 epoch: 34, train_loss: 0.9076, test_loss: 0.9604, test_f1: 0.5221
 epoch: 35, train_loss: 0.9094, test_loss: 0.9600, test_f1: 0.5253
 epoch: 36, train_loss: 0.8995, test_loss: 0.9631, test_f1: 0.5245
 epoch: 37, train_loss: 0.8951, test_loss: 0.9522, test_f1: 0.5269
 epoch: 38, train_loss: 0.8965, test_loss: 0.9702, test_f1: 0.5295
 epoch: 39, train_loss: 0.8922, test_loss: 0.9638, test_f1: 0.5343
 epoch: 40, train_loss: 0.8855, test_loss: 0.9322, test_f1: 0.5308
 epoch: 41, train_loss: 0.8908, test_loss: 0.9735, test_f1: 0.5303
 epoch: 42, train_loss: 0.8770, test_loss: 0.9613, test_f1: 0.5334
 epoch: 43, train_loss: 0.8800, test_loss: 0.9623, test_f1: 0.5396
 epoch: 44, train_loss: 0.8751, test_loss: 0.9531, test_f1: 0.5253
 epoch: 45, train_loss: 0.8730, test_loss: 0.9584, test_f1: 0.5371
 epoch: 46, train_loss: 0.8799, test_loss: 0.9485, test_f1: 0.5339
 epoch: 47, train_loss: 0.8693, test_loss: 0.9519, test_f1: 0.5263
 epoch: 48, train_loss: 0.8654, test_loss: 0.9574, test_f1: 0.5349
 epoch: 49, train_loss: 0.8643, test_loss: 0.9622, test_f1: 0.5303
 epoch: 50, train_loss: 0.8649, test_loss: 0.9541, test_f1: 0.5349
 epoch: 51, train_loss: 0.8575, test_loss: 0.9564, test_f1: 0.5371
 epoch: 52, train_loss: 0.8560, test_loss: 0.9532, test_f1: 0.5351
 epoch: 53, train_loss: 0.8521, test_loss: 0.9596, test_f1: 0.5421
 epoch: 54, train_loss: 0.8579, test_loss: 0.9534, test_f1: 0.5381
 epoch: 55, train_loss: 0.8509, test_loss: 0.9548, test_f1: 0.5383
 epoch: 56, train_loss: 0.8488, test_loss: 0.9510, test_f1: 0.5367
 epoch: 57, train_loss: 0.8540, test_loss: 0.9562, test_f1: 0.5379
 epoch: 58, train_loss: 0.8477, test_loss: 0.9554, test_f1: 0.5380
 epoch: 59, train_loss: 0.8540, test_loss: 0.9594, test_f1: 0.5451
 epoch: 60, train_loss: 0.8540, test_loss: 0.9557, test_f1: 0.5400
 epoch: 61, train_loss: 0.8455, test_loss: 0.9622, test_f1: 0.5382
 epoch: 62, train_loss: 0.8366, test_loss: 0.9632, test_f1: 0.5293
 epoch: 63, train_loss: 0.8444, test_loss: 0.9611, test_f1: 0.5414
 epoch: 64, train_loss: 0.8447, test_loss: 0.9610, test_f1: 0.5355
 epoch: 65, train_loss: 0.8415, test_loss: 0.9675, test_f1: 0.5460
 epoch: 66, train_loss: 0.8424, test_loss: 0.9639, test_f1: 0.5460
 epoch: 67, train_loss: 0.8358, test_loss: 0.9561, test_f1: 0.5458
 epoch: 68, train_loss: 0.8412, test_loss: 0.9577, test_f1: 0.5430
 epoch: 69, train_loss: 0.8363, test_loss: 0.9569, test_f1: 0.5376
 epoch: 70, train_loss: 0.8386, test_loss: 0.9509, test_f1: 0.5449
 epoch: 71, train_loss: 0.8287, test_loss: 0.9511, test_f1: 0.5461
 epoch: 72, train_loss: 0.8278, test_loss: 0.9607, test_f1: 0.5470
 epoch: 73, train_loss: 0.8333, test_loss: 0.9588, test_f1: 0.5485
 epoch: 74, train_loss: 0.8390, test_loss: 0.9489, test_f1: 0.5478
 epoch: 75, train_loss: 0.8302, test_loss: 0.9633, test_f1: 0.5400
 epoch: 76, train_loss: 0.8319, test_loss: 0.9508, test_f1: 0.5451
 epoch: 77, train_loss: 0.8315, test_loss: 0.9521, test_f1: 0.5488
 epoch: 78, train_loss: 0.8197, test_loss: 0.9587, test_f1: 0.5515
 epoch: 79, train_loss: 0.8293, test_loss: 0.9542, test_f1: 0.5479
 epoch: 80, train_loss: 0.8286, test_loss: 0.9583, test_f1: 0.5562
 epoch: 81, train_loss: 0.8232, test_loss: 0.9660, test_f1: 0.5476
 epoch: 82, train_loss: 0.8275, test_loss: 0.9559, test_f1: 0.5556
 epoch: 83, train_loss: 0.8243, test_loss: 0.9519, test_f1: 0.5537
 epoch: 84, train_loss: 0.8310, test_loss: 0.9557, test_f1: 0.5541
 epoch: 85, train_loss: 0.8240, test_loss: 0.9419, test_f1: 0.5548
 epoch: 86, train_loss: 0.8149, test_loss: 0.9592, test_f1: 0.5545
 epoch: 87, train_loss: 0.8165, test_loss: 0.9530, test_f1: 0.5465
 epoch: 88, train_loss: 0.8175, test_loss: 0.9559, test_f1: 0.5563
 epoch: 89, train_loss: 0.8143, test_loss: 0.9411, test_f1: 0.5559
 epoch: 90, train_loss: 0.8131, test_loss: 0.9669, test_f1: 0.5555
 epoch: 91, train_loss: 0.8267, test_loss: 0.9442, test_f1: 0.5499
 epoch: 92, train_loss: 0.8147, test_loss: 0.9603, test_f1: 0.5566
 epoch: 93, train_loss: 0.8072, test_loss: 0.9610, test_f1: 0.5563
 epoch: 94, train_loss: 0.8087, test_loss: 0.9465, test_f1: 0.5606
 epoch: 95, train_loss: 0.8075, test_loss: 0.9661, test_f1: 0.5575
 epoch: 96, train_loss: 0.8049, test_loss: 0.9566, test_f1: 0.5473
 epoch: 97, train_loss: 0.8079, test_loss: 0.9690, test_f1: 0.5522
 epoch: 98, train_loss: 0.8028, test_loss: 0.9518, test_f1: 0.5573
 epoch: 99, train_loss: 0.8120, test_loss: 0.9462, test_f1: 0.5562
##################ITERATION #6 ****************************************
 epoch: 0, train_loss: 1.3064, test_loss: 1.3494, test_f1: 0.2270
 epoch: 1, train_loss: 1.2317, test_loss: 1.2342, test_f1: 0.3242
 epoch: 2, train_loss: 1.1977, test_loss: 1.1708, test_f1: 0.3444
 epoch: 3, train_loss: 1.1752, test_loss: 1.1338, test_f1: 0.3501
 epoch: 4, train_loss: 1.1443, test_loss: 1.1181, test_f1: 0.3582
 epoch: 5, train_loss: 1.1282, test_loss: 1.0978, test_f1: 0.3782
 epoch: 6, train_loss: 1.1116, test_loss: 1.0661, test_f1: 0.4340
 epoch: 7, train_loss: 1.1003, test_loss: 1.0462, test_f1: 0.4271
 epoch: 8, train_loss: 1.0780, test_loss: 1.0670, test_f1: 0.4232
 epoch: 9, train_loss: 1.0638, test_loss: 1.0631, test_f1: 0.4376
 epoch: 10, train_loss: 1.0606, test_loss: 1.0556, test_f1: 0.4404
 epoch: 11, train_loss: 1.0484, test_loss: 1.0514, test_f1: 0.4583
 epoch: 12, train_loss: 1.0396, test_loss: 1.0493, test_f1: 0.4605
 epoch: 13, train_loss: 1.0363, test_loss: 1.0359, test_f1: 0.4626
 epoch: 14, train_loss: 1.0239, test_loss: 1.0334, test_f1: 0.4650
 epoch: 15, train_loss: 1.0169, test_loss: 1.0275, test_f1: 0.4721
 epoch: 16, train_loss: 1.0155, test_loss: 1.0210, test_f1: 0.4764
 epoch: 17, train_loss: 1.0121, test_loss: 0.9995, test_f1: 0.4702
 epoch: 18, train_loss: 0.9914, test_loss: 1.0018, test_f1: 0.4665
 epoch: 19, train_loss: 0.9968, test_loss: 1.0065, test_f1: 0.4725
 epoch: 20, train_loss: 0.9956, test_loss: 1.0077, test_f1: 0.4739
 epoch: 21, train_loss: 0.9777, test_loss: 0.9922, test_f1: 0.4863
 epoch: 22, train_loss: 0.9794, test_loss: 0.9898, test_f1: 0.4858
 epoch: 23, train_loss: 0.9825, test_loss: 0.9913, test_f1: 0.4836
 epoch: 24, train_loss: 0.9708, test_loss: 0.9739, test_f1: 0.4942
 epoch: 25, train_loss: 0.9601, test_loss: 0.9728, test_f1: 0.4901
 epoch: 26, train_loss: 0.9588, test_loss: 0.9559, test_f1: 0.4954
 epoch: 27, train_loss: 0.9616, test_loss: 0.9573, test_f1: 0.5007
 epoch: 28, train_loss: 0.9461, test_loss: 0.9674, test_f1: 0.5019
 epoch: 29, train_loss: 0.9543, test_loss: 0.9428, test_f1: 0.5035
 epoch: 30, train_loss: 0.9515, test_loss: 0.9523, test_f1: 0.5230
 epoch: 31, train_loss: 0.9461, test_loss: 0.9612, test_f1: 0.5047
 epoch: 32, train_loss: 0.9485, test_loss: 0.9545, test_f1: 0.5082
 epoch: 33, train_loss: 0.9354, test_loss: 0.9273, test_f1: 0.5193
 epoch: 34, train_loss: 0.9462, test_loss: 0.9241, test_f1: 0.5193
 epoch: 35, train_loss: 0.9384, test_loss: 0.9185, test_f1: 0.5324
 epoch: 36, train_loss: 0.9306, test_loss: 0.9110, test_f1: 0.5294
 epoch: 37, train_loss: 0.9231, test_loss: 0.9128, test_f1: 0.5269
 epoch: 38, train_loss: 0.9300, test_loss: 0.9076, test_f1: 0.5302
 epoch: 39, train_loss: 0.9233, test_loss: 0.9026, test_f1: 0.5272
 epoch: 40, train_loss: 0.9167, test_loss: 0.9161, test_f1: 0.5195
 epoch: 41, train_loss: 0.9169, test_loss: 0.9007, test_f1: 0.5380
 epoch: 42, train_loss: 0.9092, test_loss: 0.8986, test_f1: 0.5404
 epoch: 43, train_loss: 0.9098, test_loss: 0.8979, test_f1: 0.5331
 epoch: 44, train_loss: 0.9045, test_loss: 0.9131, test_f1: 0.5280
 epoch: 45, train_loss: 0.9073, test_loss: 0.8931, test_f1: 0.5376
 epoch: 46, train_loss: 0.9025, test_loss: 0.9027, test_f1: 0.5313
 epoch: 47, train_loss: 0.9078, test_loss: 0.8978, test_f1: 0.5383
 epoch: 48, train_loss: 0.9017, test_loss: 0.8907, test_f1: 0.5396
 epoch: 49, train_loss: 0.9027, test_loss: 0.8979, test_f1: 0.5203
 epoch: 50, train_loss: 0.8965, test_loss: 0.9082, test_f1: 0.5252
 epoch: 51, train_loss: 0.8831, test_loss: 0.8945, test_f1: 0.5329
 epoch: 52, train_loss: 0.8846, test_loss: 0.8936, test_f1: 0.5326
 epoch: 53, train_loss: 0.8805, test_loss: 0.8844, test_f1: 0.5435
 epoch: 54, train_loss: 0.8779, test_loss: 0.8794, test_f1: 0.5493
 epoch: 55, train_loss: 0.8852, test_loss: 0.8863, test_f1: 0.5546
 epoch: 56, train_loss: 0.8760, test_loss: 0.8821, test_f1: 0.5522
 epoch: 57, train_loss: 0.8746, test_loss: 0.9026, test_f1: 0.5336
 epoch: 58, train_loss: 0.8748, test_loss: 0.8910, test_f1: 0.5455
 epoch: 59, train_loss: 0.8808, test_loss: 0.9130, test_f1: 0.5403
 epoch: 60, train_loss: 0.8715, test_loss: 0.8902, test_f1: 0.5554
 epoch: 61, train_loss: 0.8728, test_loss: 0.8811, test_f1: 0.5504
 epoch: 62, train_loss: 0.8747, test_loss: 0.8872, test_f1: 0.5441
 epoch: 63, train_loss: 0.8706, test_loss: 0.8846, test_f1: 0.5458
 epoch: 64, train_loss: 0.8747, test_loss: 0.8879, test_f1: 0.5506
 epoch: 65, train_loss: 0.8680, test_loss: 0.8925, test_f1: 0.5408
 epoch: 66, train_loss: 0.8666, test_loss: 0.8921, test_f1: 0.5500
 epoch: 67, train_loss: 0.8710, test_loss: 0.9006, test_f1: 0.5374
 epoch: 68, train_loss: 0.8704, test_loss: 0.8750, test_f1: 0.5641
 epoch: 69, train_loss: 0.8651, test_loss: 0.8741, test_f1: 0.5633
 epoch: 70, train_loss: 0.8636, test_loss: 0.8759, test_f1: 0.5589
 epoch: 71, train_loss: 0.8642, test_loss: 0.8882, test_f1: 0.5443
 epoch: 72, train_loss: 0.8590, test_loss: 0.8857, test_f1: 0.5434
 epoch: 73, train_loss: 0.8533, test_loss: 0.8798, test_f1: 0.5542
 epoch: 74, train_loss: 0.8558, test_loss: 0.8814, test_f1: 0.5484
 epoch: 75, train_loss: 0.8597, test_loss: 0.8898, test_f1: 0.5516
 epoch: 76, train_loss: 0.8584, test_loss: 0.8825, test_f1: 0.5428
 epoch: 77, train_loss: 0.8556, test_loss: 0.8760, test_f1: 0.5507
 epoch: 78, train_loss: 0.8597, test_loss: 0.8764, test_f1: 0.5538
 epoch: 79, train_loss: 0.8529, test_loss: 0.8769, test_f1: 0.5426
 epoch: 80, train_loss: 0.8503, test_loss: 0.8799, test_f1: 0.5483
 epoch: 81, train_loss: 0.8418, test_loss: 0.8793, test_f1: 0.5466
 epoch: 82, train_loss: 0.8564, test_loss: 0.8731, test_f1: 0.5418
 epoch: 83, train_loss: 0.8397, test_loss: 0.8650, test_f1: 0.5457
 epoch: 84, train_loss: 0.8527, test_loss: 0.8685, test_f1: 0.5561
 epoch: 85, train_loss: 0.8479, test_loss: 0.8607, test_f1: 0.5506
 epoch: 86, train_loss: 0.8378, test_loss: 0.8886, test_f1: 0.5442
 epoch: 87, train_loss: 0.8452, test_loss: 0.8800, test_f1: 0.5470
 epoch: 88, train_loss: 0.8396, test_loss: 0.8893, test_f1: 0.5449
 epoch: 89, train_loss: 0.8423, test_loss: 0.8948, test_f1: 0.5442
 epoch: 90, train_loss: 0.8482, test_loss: 0.8823, test_f1: 0.5507
 epoch: 91, train_loss: 0.8333, test_loss: 0.8686, test_f1: 0.5516
 epoch: 92, train_loss: 0.8384, test_loss: 0.8837, test_f1: 0.5488
 epoch: 93, train_loss: 0.8324, test_loss: 0.8676, test_f1: 0.5520
 epoch: 94, train_loss: 0.8488, test_loss: 0.8857, test_f1: 0.5447
 epoch: 95, train_loss: 0.8346, test_loss: 0.8778, test_f1: 0.5469
 epoch: 96, train_loss: 0.8236, test_loss: 0.8643, test_f1: 0.5494
 epoch: 97, train_loss: 0.8321, test_loss: 0.8793, test_f1: 0.5532
 epoch: 98, train_loss: 0.8293, test_loss: 0.8661, test_f1: 0.5580
 epoch: 99, train_loss: 0.8291, test_loss: 0.8588, test_f1: 0.5572
##################ITERATION #7 ****************************************
 epoch: 0, train_loss: 1.2804, test_loss: 1.3150, test_f1: 0.2270
 epoch: 1, train_loss: 1.1910, test_loss: 1.2501, test_f1: 0.2368
 epoch: 2, train_loss: 1.1635, test_loss: 1.1276, test_f1: 0.3503
 epoch: 3, train_loss: 1.1392, test_loss: 1.0957, test_f1: 0.3506
 epoch: 4, train_loss: 1.1151, test_loss: 1.0795, test_f1: 0.3557
 epoch: 5, train_loss: 1.1018, test_loss: 1.0650, test_f1: 0.3786
 epoch: 6, train_loss: 1.0775, test_loss: 1.0557, test_f1: 0.3950
 epoch: 7, train_loss: 1.0721, test_loss: 1.0500, test_f1: 0.4111
 epoch: 8, train_loss: 1.0525, test_loss: 1.0469, test_f1: 0.4028
 epoch: 9, train_loss: 1.0468, test_loss: 1.0397, test_f1: 0.4298
 epoch: 10, train_loss: 1.0398, test_loss: 1.0376, test_f1: 0.4280
 epoch: 11, train_loss: 1.0333, test_loss: 1.0405, test_f1: 0.4301
 epoch: 12, train_loss: 1.0222, test_loss: 1.0318, test_f1: 0.4388
 epoch: 13, train_loss: 1.0143, test_loss: 1.0256, test_f1: 0.4584
 epoch: 14, train_loss: 1.0016, test_loss: 1.0209, test_f1: 0.4614
 epoch: 15, train_loss: 1.0016, test_loss: 1.0185, test_f1: 0.4663
 epoch: 16, train_loss: 0.9957, test_loss: 1.0135, test_f1: 0.4739
 epoch: 17, train_loss: 0.9913, test_loss: 1.0062, test_f1: 0.4727
 epoch: 18, train_loss: 0.9882, test_loss: 1.0088, test_f1: 0.4666
 epoch: 19, train_loss: 0.9761, test_loss: 0.9971, test_f1: 0.4800
 epoch: 20, train_loss: 0.9759, test_loss: 1.0016, test_f1: 0.4689
 epoch: 21, train_loss: 0.9716, test_loss: 1.0118, test_f1: 0.4646
 epoch: 22, train_loss: 0.9649, test_loss: 0.9990, test_f1: 0.4661
 epoch: 23, train_loss: 0.9692, test_loss: 0.9892, test_f1: 0.4863
 epoch: 24, train_loss: 0.9597, test_loss: 0.9845, test_f1: 0.4913
 epoch: 25, train_loss: 0.9468, test_loss: 0.9823, test_f1: 0.4875
 epoch: 26, train_loss: 0.9510, test_loss: 0.9806, test_f1: 0.4957
 epoch: 27, train_loss: 0.9436, test_loss: 0.9864, test_f1: 0.4827
 epoch: 28, train_loss: 0.9380, test_loss: 0.9781, test_f1: 0.4907
 epoch: 29, train_loss: 0.9295, test_loss: 0.9812, test_f1: 0.4870
 epoch: 30, train_loss: 0.9313, test_loss: 0.9632, test_f1: 0.5007
 epoch: 31, train_loss: 0.9270, test_loss: 0.9693, test_f1: 0.4958
 epoch: 32, train_loss: 0.9244, test_loss: 0.9640, test_f1: 0.5080
 epoch: 33, train_loss: 0.9251, test_loss: 0.9600, test_f1: 0.5115
 epoch: 34, train_loss: 0.9233, test_loss: 0.9647, test_f1: 0.5131
 epoch: 35, train_loss: 0.9161, test_loss: 0.9593, test_f1: 0.5077
 epoch: 36, train_loss: 0.9132, test_loss: 0.9573, test_f1: 0.5048
 epoch: 37, train_loss: 0.9135, test_loss: 0.9655, test_f1: 0.5049
 epoch: 38, train_loss: 0.9118, test_loss: 0.9648, test_f1: 0.4982
 epoch: 39, train_loss: 0.8979, test_loss: 0.9481, test_f1: 0.5143
 epoch: 40, train_loss: 0.9077, test_loss: 0.9446, test_f1: 0.5203
 epoch: 41, train_loss: 0.8993, test_loss: 0.9453, test_f1: 0.5202
 epoch: 42, train_loss: 0.8998, test_loss: 0.9393, test_f1: 0.5262
 epoch: 43, train_loss: 0.8940, test_loss: 0.9330, test_f1: 0.5094
 epoch: 44, train_loss: 0.8942, test_loss: 0.9466, test_f1: 0.5147
 epoch: 45, train_loss: 0.8870, test_loss: 0.9340, test_f1: 0.5186
 epoch: 46, train_loss: 0.8836, test_loss: 0.9222, test_f1: 0.5287
 epoch: 47, train_loss: 0.8827, test_loss: 0.9119, test_f1: 0.5205
 epoch: 48, train_loss: 0.8811, test_loss: 0.9150, test_f1: 0.5209
 epoch: 49, train_loss: 0.8681, test_loss: 0.9318, test_f1: 0.5210
 epoch: 50, train_loss: 0.8704, test_loss: 0.8993, test_f1: 0.5233
 epoch: 51, train_loss: 0.8712, test_loss: 0.9014, test_f1: 0.5254
 epoch: 52, train_loss: 0.8756, test_loss: 0.9016, test_f1: 0.5259
 epoch: 53, train_loss: 0.8659, test_loss: 0.9076, test_f1: 0.5310
 epoch: 54, train_loss: 0.8585, test_loss: 0.9068, test_f1: 0.5308
 epoch: 55, train_loss: 0.8655, test_loss: 0.9089, test_f1: 0.5193
 epoch: 56, train_loss: 0.8626, test_loss: 0.9162, test_f1: 0.5339
 epoch: 57, train_loss: 0.8583, test_loss: 0.9200, test_f1: 0.5142
 epoch: 58, train_loss: 0.8672, test_loss: 0.9081, test_f1: 0.5308
 epoch: 59, train_loss: 0.8574, test_loss: 0.9168, test_f1: 0.5339
 epoch: 60, train_loss: 0.8687, test_loss: 0.9158, test_f1: 0.5256
 epoch: 61, train_loss: 0.8612, test_loss: 0.9049, test_f1: 0.5199
 epoch: 62, train_loss: 0.8509, test_loss: 0.9138, test_f1: 0.5258
 epoch: 63, train_loss: 0.8559, test_loss: 0.8985, test_f1: 0.5272
 epoch: 64, train_loss: 0.8584, test_loss: 0.8934, test_f1: 0.5254
 epoch: 65, train_loss: 0.8552, test_loss: 0.8916, test_f1: 0.5358
 epoch: 66, train_loss: 0.8479, test_loss: 0.9046, test_f1: 0.5262
 epoch: 67, train_loss: 0.8447, test_loss: 0.8984, test_f1: 0.5299
 epoch: 68, train_loss: 0.8543, test_loss: 0.8937, test_f1: 0.5275
 epoch: 69, train_loss: 0.8500, test_loss: 0.9050, test_f1: 0.5274
 epoch: 70, train_loss: 0.8491, test_loss: 0.9013, test_f1: 0.5274
 epoch: 71, train_loss: 0.8428, test_loss: 0.8912, test_f1: 0.5259
 epoch: 72, train_loss: 0.8495, test_loss: 0.8829, test_f1: 0.5272
 epoch: 73, train_loss: 0.8454, test_loss: 0.8781, test_f1: 0.5465
 epoch: 74, train_loss: 0.8460, test_loss: 0.8816, test_f1: 0.5320
 epoch: 75, train_loss: 0.8407, test_loss: 0.8787, test_f1: 0.5381
 epoch: 76, train_loss: 0.8419, test_loss: 0.8789, test_f1: 0.5357
 epoch: 77, train_loss: 0.8426, test_loss: 0.8815, test_f1: 0.5330
 epoch: 78, train_loss: 0.8421, test_loss: 0.8820, test_f1: 0.5299
 epoch: 79, train_loss: 0.8317, test_loss: 0.8839, test_f1: 0.5299
 epoch: 80, train_loss: 0.8318, test_loss: 0.8815, test_f1: 0.5327
 epoch: 81, train_loss: 0.8389, test_loss: 0.8847, test_f1: 0.5300
 epoch: 82, train_loss: 0.8321, test_loss: 0.8822, test_f1: 0.5298
 epoch: 83, train_loss: 0.8345, test_loss: 0.8783, test_f1: 0.5242
 epoch: 84, train_loss: 0.8388, test_loss: 0.8816, test_f1: 0.5353
 epoch: 85, train_loss: 0.8401, test_loss: 0.8834, test_f1: 0.5288
 epoch: 86, train_loss: 0.8364, test_loss: 0.8761, test_f1: 0.5383
 epoch: 87, train_loss: 0.8279, test_loss: 0.8887, test_f1: 0.5317
 epoch: 88, train_loss: 0.8269, test_loss: 0.8822, test_f1: 0.5298
 epoch: 89, train_loss: 0.8351, test_loss: 0.8743, test_f1: 0.5405
 epoch: 90, train_loss: 0.8366, test_loss: 0.8706, test_f1: 0.5425
 epoch: 91, train_loss: 0.8326, test_loss: 0.8853, test_f1: 0.5349
 epoch: 92, train_loss: 0.8273, test_loss: 0.8804, test_f1: 0.5271
 epoch: 93, train_loss: 0.8272, test_loss: 0.8778, test_f1: 0.5370
 epoch: 94, train_loss: 0.8282, test_loss: 0.8699, test_f1: 0.5427
 epoch: 95, train_loss: 0.8243, test_loss: 0.8714, test_f1: 0.5423
 epoch: 96, train_loss: 0.8219, test_loss: 0.8741, test_f1: 0.5425
 epoch: 97, train_loss: 0.8192, test_loss: 0.8792, test_f1: 0.5274
 epoch: 98, train_loss: 0.8188, test_loss: 0.8908, test_f1: 0.5192
 epoch: 99, train_loss: 0.8190, test_loss: 0.8730, test_f1: 0.5413
##################ITERATION #8 ****************************************
 epoch: 0, train_loss: 1.3627, test_loss: 1.3570, test_f1: 0.2270
 epoch: 1, train_loss: 1.2501, test_loss: 1.2701, test_f1: 0.2270
 epoch: 2, train_loss: 1.2131, test_loss: 1.1668, test_f1: 0.3420
 epoch: 3, train_loss: 1.1769, test_loss: 1.1215, test_f1: 0.3632
 epoch: 4, train_loss: 1.1505, test_loss: 1.0961, test_f1: 0.3899
 epoch: 5, train_loss: 1.1325, test_loss: 1.0775, test_f1: 0.4024
 epoch: 6, train_loss: 1.1151, test_loss: 1.0618, test_f1: 0.4110
 epoch: 7, train_loss: 1.0940, test_loss: 1.0535, test_f1: 0.4179
 epoch: 8, train_loss: 1.0860, test_loss: 1.0417, test_f1: 0.4310
 epoch: 9, train_loss: 1.0629, test_loss: 1.0347, test_f1: 0.4388
 epoch: 10, train_loss: 1.0504, test_loss: 1.0241, test_f1: 0.4576
 epoch: 11, train_loss: 1.0445, test_loss: 1.0153, test_f1: 0.4608
 epoch: 12, train_loss: 1.0319, test_loss: 1.0147, test_f1: 0.4525
 epoch: 13, train_loss: 1.0222, test_loss: 1.0111, test_f1: 0.4545
 epoch: 14, train_loss: 1.0195, test_loss: 1.0012, test_f1: 0.4645
 epoch: 15, train_loss: 1.0060, test_loss: 1.0024, test_f1: 0.4716
 epoch: 16, train_loss: 1.0030, test_loss: 0.9987, test_f1: 0.4733
 epoch: 17, train_loss: 0.9990, test_loss: 0.9933, test_f1: 0.4834
 epoch: 18, train_loss: 0.9984, test_loss: 0.9854, test_f1: 0.4773
 epoch: 19, train_loss: 0.9759, test_loss: 0.9831, test_f1: 0.4869
 epoch: 20, train_loss: 0.9834, test_loss: 0.9759, test_f1: 0.4840
 epoch: 21, train_loss: 0.9759, test_loss: 0.9736, test_f1: 0.4843
 epoch: 22, train_loss: 0.9791, test_loss: 0.9713, test_f1: 0.4997
 epoch: 23, train_loss: 0.9642, test_loss: 0.9665, test_f1: 0.4946
 epoch: 24, train_loss: 0.9599, test_loss: 0.9710, test_f1: 0.4907
 epoch: 25, train_loss: 0.9528, test_loss: 0.9666, test_f1: 0.4963
 epoch: 26, train_loss: 0.9504, test_loss: 0.9651, test_f1: 0.4900
 epoch: 27, train_loss: 0.9508, test_loss: 0.9586, test_f1: 0.4789
 epoch: 28, train_loss: 0.9387, test_loss: 0.9328, test_f1: 0.4969
 epoch: 29, train_loss: 0.9502, test_loss: 0.9408, test_f1: 0.4953
 epoch: 30, train_loss: 0.9419, test_loss: 0.9516, test_f1: 0.5119
 epoch: 31, train_loss: 0.9369, test_loss: 0.9493, test_f1: 0.4927
 epoch: 32, train_loss: 0.9328, test_loss: 0.9259, test_f1: 0.5012
 epoch: 33, train_loss: 0.9243, test_loss: 0.9441, test_f1: 0.4985
 epoch: 34, train_loss: 0.9330, test_loss: 0.9612, test_f1: 0.4876
 epoch: 35, train_loss: 0.9174, test_loss: 0.9450, test_f1: 0.5169
 epoch: 36, train_loss: 0.9292, test_loss: 0.9567, test_f1: 0.5110
 epoch: 37, train_loss: 0.9206, test_loss: 0.9319, test_f1: 0.5047
 epoch: 38, train_loss: 0.9134, test_loss: 0.9179, test_f1: 0.5020
 epoch: 39, train_loss: 0.9187, test_loss: 0.9136, test_f1: 0.5093
 epoch: 40, train_loss: 0.9155, test_loss: 0.9200, test_f1: 0.5171
 epoch: 41, train_loss: 0.9056, test_loss: 0.9092, test_f1: 0.5214
 epoch: 42, train_loss: 0.9066, test_loss: 0.8997, test_f1: 0.5330
 epoch: 43, train_loss: 0.8985, test_loss: 0.9159, test_f1: 0.5096
 epoch: 44, train_loss: 0.9034, test_loss: 0.9157, test_f1: 0.5152
 epoch: 45, train_loss: 0.8984, test_loss: 0.9124, test_f1: 0.5076
 epoch: 46, train_loss: 0.8955, test_loss: 0.8986, test_f1: 0.5205
 epoch: 47, train_loss: 0.8989, test_loss: 0.8832, test_f1: 0.5321
 epoch: 48, train_loss: 0.8913, test_loss: 0.8969, test_f1: 0.5180
 epoch: 49, train_loss: 0.8932, test_loss: 0.8873, test_f1: 0.5299
 epoch: 50, train_loss: 0.8921, test_loss: 0.8872, test_f1: 0.5293
 epoch: 51, train_loss: 0.8911, test_loss: 0.8738, test_f1: 0.5390
 epoch: 52, train_loss: 0.8918, test_loss: 0.8743, test_f1: 0.5211
 epoch: 53, train_loss: 0.8755, test_loss: 0.8927, test_f1: 0.5129
 epoch: 54, train_loss: 0.8802, test_loss: 0.8776, test_f1: 0.5374
 epoch: 55, train_loss: 0.8772, test_loss: 0.8703, test_f1: 0.5412
 epoch: 56, train_loss: 0.8797, test_loss: 0.8650, test_f1: 0.5456
 epoch: 57, train_loss: 0.8825, test_loss: 0.8604, test_f1: 0.5414
 epoch: 58, train_loss: 0.8838, test_loss: 0.8828, test_f1: 0.5295
 epoch: 59, train_loss: 0.8813, test_loss: 0.8738, test_f1: 0.5365
 epoch: 60, train_loss: 0.8788, test_loss: 0.8737, test_f1: 0.5356
 epoch: 61, train_loss: 0.8708, test_loss: 0.8754, test_f1: 0.5404
 epoch: 62, train_loss: 0.8787, test_loss: 0.8753, test_f1: 0.5344
 epoch: 63, train_loss: 0.8708, test_loss: 0.8944, test_f1: 0.5310
 epoch: 64, train_loss: 0.8671, test_loss: 0.8839, test_f1: 0.5249
 epoch: 65, train_loss: 0.8700, test_loss: 0.8760, test_f1: 0.5328
 epoch: 66, train_loss: 0.8748, test_loss: 0.8765, test_f1: 0.5440
 epoch: 67, train_loss: 0.8761, test_loss: 0.8897, test_f1: 0.5274
 epoch: 68, train_loss: 0.8659, test_loss: 0.8705, test_f1: 0.5386
 epoch: 69, train_loss: 0.8695, test_loss: 0.8757, test_f1: 0.5438
 epoch: 70, train_loss: 0.8698, test_loss: 0.8724, test_f1: 0.5447
 epoch: 71, train_loss: 0.8686, test_loss: 0.8666, test_f1: 0.5454
 epoch: 72, train_loss: 0.8622, test_loss: 0.8671, test_f1: 0.5425
 epoch: 73, train_loss: 0.8573, test_loss: 0.8577, test_f1: 0.5454
 epoch: 74, train_loss: 0.8665, test_loss: 0.8705, test_f1: 0.5392
 epoch: 75, train_loss: 0.8607, test_loss: 0.8754, test_f1: 0.5359
 epoch: 76, train_loss: 0.8588, test_loss: 0.8732, test_f1: 0.5376
 epoch: 77, train_loss: 0.8568, test_loss: 0.8690, test_f1: 0.5427
 epoch: 78, train_loss: 0.8623, test_loss: 0.8727, test_f1: 0.5388
 epoch: 79, train_loss: 0.8524, test_loss: 0.8576, test_f1: 0.5375
 epoch: 80, train_loss: 0.8579, test_loss: 0.8788, test_f1: 0.5282
 epoch: 81, train_loss: 0.8573, test_loss: 0.8604, test_f1: 0.5395
 epoch: 82, train_loss: 0.8544, test_loss: 0.8625, test_f1: 0.5390
 epoch: 83, train_loss: 0.8587, test_loss: 0.8556, test_f1: 0.5453
 epoch: 84, train_loss: 0.8450, test_loss: 0.8586, test_f1: 0.5495
 epoch: 85, train_loss: 0.8532, test_loss: 0.8575, test_f1: 0.5389
 epoch: 86, train_loss: 0.8554, test_loss: 0.8692, test_f1: 0.5287
 epoch: 87, train_loss: 0.8592, test_loss: 0.8599, test_f1: 0.5359
 epoch: 88, train_loss: 0.8564, test_loss: 0.8782, test_f1: 0.5251
 epoch: 89, train_loss: 0.8497, test_loss: 0.8584, test_f1: 0.5397
 epoch: 90, train_loss: 0.8605, test_loss: 0.8750, test_f1: 0.5377
 epoch: 91, train_loss: 0.8507, test_loss: 0.8788, test_f1: 0.5265
 epoch: 92, train_loss: 0.8528, test_loss: 0.8732, test_f1: 0.5353
 epoch: 93, train_loss: 0.8560, test_loss: 0.8507, test_f1: 0.5482
 epoch: 94, train_loss: 0.8447, test_loss: 0.8525, test_f1: 0.5382
 epoch: 95, train_loss: 0.8550, test_loss: 0.8506, test_f1: 0.5391
 epoch: 96, train_loss: 0.8404, test_loss: 0.8486, test_f1: 0.5479
 epoch: 97, train_loss: 0.8481, test_loss: 0.8572, test_f1: 0.5416
 epoch: 98, train_loss: 0.8411, test_loss: 0.8748, test_f1: 0.5337
 epoch: 99, train_loss: 0.8425, test_loss: 0.8510, test_f1: 0.5396
##################ITERATION #9 ****************************************
 epoch: 0, train_loss: 1.3354, test_loss: 1.3874, test_f1: 0.2270
 epoch: 1, train_loss: 1.2037, test_loss: 1.2162, test_f1: 0.2295
 epoch: 2, train_loss: 1.1608, test_loss: 1.0981, test_f1: 0.3617
 epoch: 3, train_loss: 1.1328, test_loss: 1.0557, test_f1: 0.3924
 epoch: 4, train_loss: 1.1107, test_loss: 1.0390, test_f1: 0.4028
 epoch: 5, train_loss: 1.0877, test_loss: 1.0229, test_f1: 0.4226
 epoch: 6, train_loss: 1.0775, test_loss: 1.0098, test_f1: 0.4332
 epoch: 7, train_loss: 1.0585, test_loss: 0.9985, test_f1: 0.4478
 epoch: 8, train_loss: 1.0489, test_loss: 0.9899, test_f1: 0.4447
 epoch: 9, train_loss: 1.0384, test_loss: 0.9808, test_f1: 0.4541
 epoch: 10, train_loss: 1.0286, test_loss: 0.9767, test_f1: 0.4536
 epoch: 11, train_loss: 1.0184, test_loss: 0.9688, test_f1: 0.4622
 epoch: 12, train_loss: 1.0088, test_loss: 0.9625, test_f1: 0.4813
 epoch: 13, train_loss: 1.0018, test_loss: 0.9590, test_f1: 0.4816
 epoch: 14, train_loss: 0.9946, test_loss: 0.9498, test_f1: 0.4825
 epoch: 15, train_loss: 0.9826, test_loss: 0.9494, test_f1: 0.4903
 epoch: 16, train_loss: 0.9831, test_loss: 0.9470, test_f1: 0.4798
 epoch: 17, train_loss: 0.9853, test_loss: 0.9396, test_f1: 0.4987
 epoch: 18, train_loss: 0.9754, test_loss: 0.9348, test_f1: 0.5004
 epoch: 19, train_loss: 0.9686, test_loss: 0.9368, test_f1: 0.5044
 epoch: 20, train_loss: 0.9695, test_loss: 0.9322, test_f1: 0.4894
 epoch: 21, train_loss: 0.9620, test_loss: 0.9336, test_f1: 0.5039
 epoch: 22, train_loss: 0.9632, test_loss: 0.9262, test_f1: 0.5086
 epoch: 23, train_loss: 0.9520, test_loss: 0.9258, test_f1: 0.4965
 epoch: 24, train_loss: 0.9533, test_loss: 0.9176, test_f1: 0.4943
 epoch: 25, train_loss: 0.9471, test_loss: 0.9250, test_f1: 0.4885
 epoch: 26, train_loss: 0.9459, test_loss: 0.9202, test_f1: 0.5236
 epoch: 27, train_loss: 0.9461, test_loss: 0.9273, test_f1: 0.4815
 epoch: 28, train_loss: 0.9390, test_loss: 0.9145, test_f1: 0.5144
 epoch: 29, train_loss: 0.9332, test_loss: 0.9149, test_f1: 0.5063
 epoch: 30, train_loss: 0.9402, test_loss: 0.9174, test_f1: 0.5181
 epoch: 31, train_loss: 0.9210, test_loss: 0.9071, test_f1: 0.5297
 epoch: 32, train_loss: 0.9245, test_loss: 0.9110, test_f1: 0.5157
 epoch: 33, train_loss: 0.9234, test_loss: 0.9002, test_f1: 0.5225
 epoch: 34, train_loss: 0.9163, test_loss: 0.9013, test_f1: 0.5146
 epoch: 35, train_loss: 0.9149, test_loss: 0.9086, test_f1: 0.5189
 epoch: 36, train_loss: 0.9079, test_loss: 0.8904, test_f1: 0.5169
 epoch: 37, train_loss: 0.9125, test_loss: 0.8933, test_f1: 0.5379
 epoch: 38, train_loss: 0.9145, test_loss: 0.8865, test_f1: 0.5284
 epoch: 39, train_loss: 0.9028, test_loss: 0.8965, test_f1: 0.5142
 epoch: 40, train_loss: 0.9043, test_loss: 0.9048, test_f1: 0.5101
 epoch: 41, train_loss: 0.8943, test_loss: 0.8887, test_f1: 0.5157
 epoch: 42, train_loss: 0.8945, test_loss: 0.8935, test_f1: 0.5095
 epoch: 43, train_loss: 0.8952, test_loss: 0.8973, test_f1: 0.5148
 epoch: 44, train_loss: 0.8956, test_loss: 0.8985, test_f1: 0.5160
 epoch: 45, train_loss: 0.8902, test_loss: 0.8887, test_f1: 0.5127
 epoch: 46, train_loss: 0.8884, test_loss: 0.8802, test_f1: 0.5346
 epoch: 47, train_loss: 0.8828, test_loss: 0.8806, test_f1: 0.5350
 epoch: 48, train_loss: 0.8790, test_loss: 0.8814, test_f1: 0.5310
 epoch: 49, train_loss: 0.8781, test_loss: 0.8846, test_f1: 0.5337
 epoch: 50, train_loss: 0.8702, test_loss: 0.8788, test_f1: 0.5220
 epoch: 51, train_loss: 0.8731, test_loss: 0.8855, test_f1: 0.5213
 epoch: 52, train_loss: 0.8753, test_loss: 0.8822, test_f1: 0.5219
 epoch: 53, train_loss: 0.8676, test_loss: 0.8847, test_f1: 0.5334
 epoch: 54, train_loss: 0.8648, test_loss: 0.8805, test_f1: 0.5153
 epoch: 55, train_loss: 0.8735, test_loss: 0.8879, test_f1: 0.5342
 epoch: 56, train_loss: 0.8693, test_loss: 0.8841, test_f1: 0.5393
 epoch: 57, train_loss: 0.8643, test_loss: 0.8775, test_f1: 0.5352
 epoch: 58, train_loss: 0.8592, test_loss: 0.8780, test_f1: 0.5248
 epoch: 59, train_loss: 0.8580, test_loss: 0.8729, test_f1: 0.5357
 epoch: 60, train_loss: 0.8550, test_loss: 0.8794, test_f1: 0.5354
 epoch: 61, train_loss: 0.8599, test_loss: 0.8840, test_f1: 0.5255
 epoch: 62, train_loss: 0.8524, test_loss: 0.8831, test_f1: 0.5292
 epoch: 63, train_loss: 0.8544, test_loss: 0.8863, test_f1: 0.5331
 epoch: 64, train_loss: 0.8611, test_loss: 0.8813, test_f1: 0.5365
 epoch: 65, train_loss: 0.8516, test_loss: 0.8772, test_f1: 0.5236
 epoch: 66, train_loss: 0.8405, test_loss: 0.8770, test_f1: 0.5361
 epoch: 67, train_loss: 0.8512, test_loss: 0.8737, test_f1: 0.5423
 epoch: 68, train_loss: 0.8380, test_loss: 0.8788, test_f1: 0.5320
 epoch: 69, train_loss: 0.8532, test_loss: 0.8918, test_f1: 0.5392
 epoch: 70, train_loss: 0.8426, test_loss: 0.8831, test_f1: 0.5350
 epoch: 71, train_loss: 0.8421, test_loss: 0.8834, test_f1: 0.5391
 epoch: 72, train_loss: 0.8398, test_loss: 0.8804, test_f1: 0.5377
 epoch: 73, train_loss: 0.8461, test_loss: 0.8794, test_f1: 0.5353
 epoch: 74, train_loss: 0.8417, test_loss: 0.8869, test_f1: 0.5427
 epoch: 75, train_loss: 0.8360, test_loss: 0.8739, test_f1: 0.5331
 epoch: 76, train_loss: 0.8465, test_loss: 0.8741, test_f1: 0.5390
 epoch: 77, train_loss: 0.8490, test_loss: 0.8777, test_f1: 0.5457
 epoch: 78, train_loss: 0.8417, test_loss: 0.8790, test_f1: 0.5462
 epoch: 79, train_loss: 0.8433, test_loss: 0.8723, test_f1: 0.5461
 epoch: 80, train_loss: 0.8390, test_loss: 0.8764, test_f1: 0.5409
 epoch: 81, train_loss: 0.8325, test_loss: 0.8745, test_f1: 0.5419
 epoch: 82, train_loss: 0.8315, test_loss: 0.8598, test_f1: 0.5385
 epoch: 83, train_loss: 0.8293, test_loss: 0.8706, test_f1: 0.5435
 epoch: 84, train_loss: 0.8362, test_loss: 0.8801, test_f1: 0.5429
 epoch: 85, train_loss: 0.8477, test_loss: 0.8768, test_f1: 0.5458
 epoch: 86, train_loss: 0.8280, test_loss: 0.8761, test_f1: 0.5406
 epoch: 87, train_loss: 0.8271, test_loss: 0.8705, test_f1: 0.5476
 epoch: 88, train_loss: 0.8298, test_loss: 0.8837, test_f1: 0.5443
 epoch: 89, train_loss: 0.8294, test_loss: 0.8831, test_f1: 0.5378
 epoch: 90, train_loss: 0.8299, test_loss: 0.8798, test_f1: 0.5465
 epoch: 91, train_loss: 0.8270, test_loss: 0.8810, test_f1: 0.5470
 epoch: 92, train_loss: 0.8158, test_loss: 0.8703, test_f1: 0.5480
 epoch: 93, train_loss: 0.8245, test_loss: 0.8725, test_f1: 0.5463
 epoch: 94, train_loss: 0.8283, test_loss: 0.8704, test_f1: 0.5465
 epoch: 95, train_loss: 0.8135, test_loss: 0.8760, test_f1: 0.5513
 epoch: 96, train_loss: 0.8207, test_loss: 0.8716, test_f1: 0.5488
 epoch: 97, train_loss: 0.8156, test_loss: 0.8783, test_f1: 0.5423
 epoch: 98, train_loss: 0.8185, test_loss: 0.8774, test_f1: 0.5479
 epoch: 99, train_loss: 0.8119, test_loss: 0.8732, test_f1: 0.5395

Training completed in 1007.41 seconds
Best F1: 0.5641 at epoch 68
Mean F1 across iterations: 0.5461  0.0150
========================FINAL RESULTS================================
FEGIN weighted F1: 0.5641  0.0150
python main.py --data ltspice_examples --representation component_pin_net --model FEGIN --layers 6 --hiddens 32 --batch_size 128 --lr 0.0001 --emb_size 128 --epochs 100 --save_appendix component_pin_net_L6_H32_BS128_LR0.0001_E128 --no_val
-----



STDERR:
  File "main.py", line 370, in <module>
    main()
  File "main.py", line 254, in main
    dataset = dataset_class(
  File "/home/philip/projects/ltspice_examples_code_repo/Circuit-Completion-Using-GNNs/component_classification_with_link_prediction_head/evaluation/FEGIN/kernel/circuit_datasets.py", line 15, in __init__
    self.data, self.slices = torch.load(self.processed_paths[0])
  File "/home/philip/.local/lib/python3.8/site-packages/torch/serialization.py", line 1040, in load
    warnings.warn(
  File "/usr/lib/python3.8/warnings.py", line 109, in _showwarnmsg
    sw(msg.message, msg.category, msg.filename, msg.lineno,
  File "main.py", line 47, in warn_with_traceback
    traceback.print_stack(file=log)
/home/philip/projects/ltspice_examples_code_repo/Circuit-Completion-Using-GNNs/component_classification_with_link_prediction_head/evaluation/FEGIN/kernel/circuit_datasets.py:15: FutureWarning: You are using `torch.load` with `weights_only=False` (the current default value), which uses the default pickle module implicitly. It is possible to construct malicious pickle data which will execute arbitrary code during unpickling (See https://github.com/pytorch/pytorch/blob/main/SECURITY.md#untrusted-models for more details). In a future release, the default value for `weights_only` will be flipped to `True`. This limits the functions that could be executed during unpickling. Arbitrary objects will no longer be allowed to be loaded via this mode unless they are explicitly allowlisted by the user via `torch.serialization.add_safe_globals`. We recommend you start setting `weights_only=True` for any use case where you don't have full control of the loaded file. Please open an issue on GitHub for any issues related to this experimental feature.
  self.data, self.slices = torch.load(self.processed_paths[0])
