STDOUT:
Results will be saved in /home/philip/projects/ltspice_examples_code_repo/Circuit-Completion-Using-GNNs/component_classification_with_link_prediction_head/evaluation/FEGIN/results/model_FEGIN_dataset_ltspice_examples
Command line input: python main.py --data ltspice_examples --representation component_net --model FEGIN --layers 4 --hiddens 128 --batch_size 64 --lr 0.001 --emb_size 128 --epochs 100 --save_appendix component_net_L4_H128_BS64_LR0.001_E128 --no_val
 is saved.
-----
ltspice_examples - FEGIN
Using 4 layers, 128 hidden units, h = 2
Loading component_net representation dataset
Loading component_net representation data...
Loaded 4404 examples (component_net)
saving path: data/processed/ltspice_examples_component_net_processed.pt
ENTERED
Training FEGIN on component_net representation
Train: 3558, Test: 846
##################ITERATION #0 ****************************************
 epoch: 0, train_loss: 1.1809, test_loss: 1.0773, test_f1: 0.4577
 epoch: 1, train_loss: 0.9958, test_loss: 0.9749, test_f1: 0.4947
 epoch: 2, train_loss: 0.9463, test_loss: 0.9578, test_f1: 0.5256
 epoch: 3, train_loss: 0.9261, test_loss: 0.9355, test_f1: 0.5361
 epoch: 4, train_loss: 0.9009, test_loss: 0.8896, test_f1: 0.5650
 epoch: 5, train_loss: 0.8790, test_loss: 0.9283, test_f1: 0.5257
 epoch: 6, train_loss: 0.8558, test_loss: 1.0077, test_f1: 0.5231
 epoch: 7, train_loss: 0.8442, test_loss: 0.9060, test_f1: 0.5708
 epoch: 8, train_loss: 0.8288, test_loss: 0.8631, test_f1: 0.5356
 epoch: 9, train_loss: 0.8113, test_loss: 0.9082, test_f1: 0.5754
 epoch: 10, train_loss: 0.7934, test_loss: 0.9631, test_f1: 0.5501
 epoch: 11, train_loss: 0.7978, test_loss: 0.9618, test_f1: 0.5821
 epoch: 12, train_loss: 0.7920, test_loss: 0.9631, test_f1: 0.6089
 epoch: 13, train_loss: 0.7708, test_loss: 0.9104, test_f1: 0.6256
 epoch: 14, train_loss: 0.7617, test_loss: 0.9371, test_f1: 0.6073
 epoch: 15, train_loss: 0.7594, test_loss: 0.9049, test_f1: 0.5917
 epoch: 16, train_loss: 0.7527, test_loss: 0.9109, test_f1: 0.6040
 epoch: 17, train_loss: 0.7319, test_loss: 0.9415, test_f1: 0.5701
 epoch: 18, train_loss: 0.7321, test_loss: 0.9511, test_f1: 0.5937
 epoch: 19, train_loss: 0.7218, test_loss: 1.0173, test_f1: 0.5919
 epoch: 20, train_loss: 0.7076, test_loss: 0.9288, test_f1: 0.6003
 epoch: 21, train_loss: 0.6839, test_loss: 0.9692, test_f1: 0.6151
 epoch: 22, train_loss: 0.6778, test_loss: 1.0231, test_f1: 0.6271
 epoch: 23, train_loss: 0.6648, test_loss: 1.0095, test_f1: 0.6220
 epoch: 24, train_loss: 0.6585, test_loss: 0.9998, test_f1: 0.6011
 epoch: 25, train_loss: 0.6326, test_loss: 1.0096, test_f1: 0.6209
 epoch: 26, train_loss: 0.6211, test_loss: 1.0807, test_f1: 0.5987
 epoch: 27, train_loss: 0.6217, test_loss: 0.9896, test_f1: 0.6449
 epoch: 28, train_loss: 0.5940, test_loss: 1.0847, test_f1: 0.6573
 epoch: 29, train_loss: 0.5989, test_loss: 1.0093, test_f1: 0.6380
 epoch: 30, train_loss: 0.6015, test_loss: 1.0347, test_f1: 0.6366
 epoch: 31, train_loss: 0.5828, test_loss: 0.9969, test_f1: 0.6633
 epoch: 32, train_loss: 0.5712, test_loss: 0.9534, test_f1: 0.6665
 epoch: 33, train_loss: 0.5663, test_loss: 1.0555, test_f1: 0.6030
 epoch: 34, train_loss: 0.5582, test_loss: 1.0558, test_f1: 0.6236
 epoch: 35, train_loss: 0.5608, test_loss: 1.1797, test_f1: 0.5931
 epoch: 36, train_loss: 0.5229, test_loss: 1.0381, test_f1: 0.6587
 epoch: 37, train_loss: 0.5320, test_loss: 1.0924, test_f1: 0.6765
 epoch: 38, train_loss: 0.5066, test_loss: 1.1658, test_f1: 0.6359
 epoch: 39, train_loss: 0.4917, test_loss: 1.1608, test_f1: 0.6658
 epoch: 40, train_loss: 0.4956, test_loss: 1.0845, test_f1: 0.6444
 epoch: 41, train_loss: 0.4709, test_loss: 1.1549, test_f1: 0.6255
 epoch: 42, train_loss: 0.4792, test_loss: 1.1098, test_f1: 0.6846
 epoch: 43, train_loss: 0.4711, test_loss: 1.2477, test_f1: 0.6326
 epoch: 44, train_loss: 0.4392, test_loss: 1.2807, test_f1: 0.6356
 epoch: 45, train_loss: 0.4643, test_loss: 1.2297, test_f1: 0.6287
 epoch: 46, train_loss: 0.4558, test_loss: 1.2160, test_f1: 0.6803
 epoch: 47, train_loss: 0.4398, test_loss: 1.1933, test_f1: 0.6876
 epoch: 48, train_loss: 0.4177, test_loss: 1.3280, test_f1: 0.6612
 epoch: 49, train_loss: 0.3954, test_loss: 1.2796, test_f1: 0.6647
 epoch: 50, train_loss: 0.3994, test_loss: 1.2942, test_f1: 0.6759
 epoch: 51, train_loss: 0.3477, test_loss: 1.3299, test_f1: 0.6732
 epoch: 52, train_loss: 0.3451, test_loss: 1.3748, test_f1: 0.6450
 epoch: 53, train_loss: 0.3175, test_loss: 1.3900, test_f1: 0.6581
 epoch: 54, train_loss: 0.3168, test_loss: 1.3981, test_f1: 0.6368
 epoch: 55, train_loss: 0.3069, test_loss: 1.4563, test_f1: 0.7039
 epoch: 56, train_loss: 0.2992, test_loss: 1.4630, test_f1: 0.6771
 epoch: 57, train_loss: 0.2825, test_loss: 1.6225, test_f1: 0.6505
 epoch: 58, train_loss: 0.3171, test_loss: 1.5617, test_f1: 0.6598
 epoch: 59, train_loss: 0.2906, test_loss: 1.4749, test_f1: 0.6804
 epoch: 60, train_loss: 0.2923, test_loss: 1.6214, test_f1: 0.6697
 epoch: 61, train_loss: 0.2512, test_loss: 1.5952, test_f1: 0.6723
 epoch: 62, train_loss: 0.2853, test_loss: 1.5505, test_f1: 0.6702
 epoch: 63, train_loss: 0.2599, test_loss: 1.6062, test_f1: 0.6838
 epoch: 64, train_loss: 0.2521, test_loss: 1.6467, test_f1: 0.6761
 epoch: 65, train_loss: 0.2620, test_loss: 1.6611, test_f1: 0.6803
 epoch: 66, train_loss: 0.2579, test_loss: 1.7549, test_f1: 0.6699
 epoch: 67, train_loss: 0.2509, test_loss: 1.7887, test_f1: 0.6584
 epoch: 68, train_loss: 0.2479, test_loss: 1.8451, test_f1: 0.6863
 epoch: 69, train_loss: 0.2518, test_loss: 1.8325, test_f1: 0.6631
 epoch: 70, train_loss: 0.2383, test_loss: 1.8268, test_f1: 0.6729
 epoch: 71, train_loss: 0.2510, test_loss: 1.7916, test_f1: 0.6700
 epoch: 72, train_loss: 0.2407, test_loss: 1.9887, test_f1: 0.6624
 epoch: 73, train_loss: 0.2357, test_loss: 1.9435, test_f1: 0.6663
 epoch: 74, train_loss: 0.2267, test_loss: 1.7836, test_f1: 0.6590
 epoch: 75, train_loss: 0.2244, test_loss: 1.9816, test_f1: 0.6500
 epoch: 76, train_loss: 0.2464, test_loss: 1.8831, test_f1: 0.6445
 epoch: 77, train_loss: 0.2343, test_loss: 1.9824, test_f1: 0.6917
 epoch: 78, train_loss: 0.2168, test_loss: 2.0643, test_f1: 0.6605
 epoch: 79, train_loss: 0.2246, test_loss: 2.0729, test_f1: 0.6500
 epoch: 80, train_loss: 0.2060, test_loss: 1.9569, test_f1: 0.6558
 epoch: 81, train_loss: 0.1938, test_loss: 1.9783, test_f1: 0.6743
 epoch: 82, train_loss: 0.2135, test_loss: 2.1612, test_f1: 0.6599
 epoch: 83, train_loss: 0.2553, test_loss: 1.9497, test_f1: 0.6629
 epoch: 84, train_loss: 0.1824, test_loss: 1.9966, test_f1: 0.6567
 epoch: 85, train_loss: 0.1931, test_loss: 2.0792, test_f1: 0.6384
 epoch: 86, train_loss: 0.1939, test_loss: 2.1459, test_f1: 0.6629
 epoch: 87, train_loss: 0.2040, test_loss: 2.1473, test_f1: 0.6547
 epoch: 88, train_loss: 0.1859, test_loss: 2.1889, test_f1: 0.6412
 epoch: 89, train_loss: 0.1793, test_loss: 2.1640, test_f1: 0.6656
 epoch: 90, train_loss: 0.1954, test_loss: 2.1290, test_f1: 0.6706
 epoch: 91, train_loss: 0.1851, test_loss: 2.1244, test_f1: 0.6477
 epoch: 92, train_loss: 0.1964, test_loss: 2.3445, test_f1: 0.6543
 epoch: 93, train_loss: 0.1879, test_loss: 2.2775, test_f1: 0.6452
 epoch: 94, train_loss: 0.1802, test_loss: 2.2731, test_f1: 0.6432
 epoch: 95, train_loss: 0.1682, test_loss: 2.3453, test_f1: 0.6446
 epoch: 96, train_loss: 0.1765, test_loss: 2.3304, test_f1: 0.6410
 epoch: 97, train_loss: 0.1883, test_loss: 2.3469, test_f1: 0.6488
 epoch: 98, train_loss: 0.1770, test_loss: 2.3244, test_f1: 0.6562
 epoch: 99, train_loss: 0.1760, test_loss: 2.2818, test_f1: 0.6327
##################ITERATION #1 ****************************************
 epoch: 0, train_loss: 1.1212, test_loss: 1.0068, test_f1: 0.4601
 epoch: 1, train_loss: 0.9761, test_loss: 0.9232, test_f1: 0.5050
 epoch: 2, train_loss: 0.9189, test_loss: 0.9260, test_f1: 0.5439
 epoch: 3, train_loss: 0.9099, test_loss: 0.9249, test_f1: 0.5406
 epoch: 4, train_loss: 0.8821, test_loss: 0.9575, test_f1: 0.5534
 epoch: 5, train_loss: 0.8682, test_loss: 0.9119, test_f1: 0.5341
 epoch: 6, train_loss: 0.8551, test_loss: 0.9190, test_f1: 0.5759
 epoch: 7, train_loss: 0.8336, test_loss: 0.9667, test_f1: 0.5427
 epoch: 8, train_loss: 0.8111, test_loss: 1.0159, test_f1: 0.5784
 epoch: 9, train_loss: 0.7991, test_loss: 0.9538, test_f1: 0.5797
 epoch: 10, train_loss: 0.7943, test_loss: 0.9509, test_f1: 0.5786
 epoch: 11, train_loss: 0.7726, test_loss: 0.9361, test_f1: 0.5679
 epoch: 12, train_loss: 0.7582, test_loss: 1.0087, test_f1: 0.5758
 epoch: 13, train_loss: 0.7410, test_loss: 0.9723, test_f1: 0.5783
 epoch: 14, train_loss: 0.7423, test_loss: 0.9613, test_f1: 0.5846
 epoch: 15, train_loss: 0.7231, test_loss: 0.9823, test_f1: 0.6018
 epoch: 16, train_loss: 0.7036, test_loss: 0.9149, test_f1: 0.5711
 epoch: 17, train_loss: 0.6999, test_loss: 0.9886, test_f1: 0.6262
 epoch: 18, train_loss: 0.7127, test_loss: 1.0139, test_f1: 0.6041
 epoch: 19, train_loss: 0.6832, test_loss: 1.0234, test_f1: 0.6203
 epoch: 20, train_loss: 0.6841, test_loss: 0.9512, test_f1: 0.6286
 epoch: 21, train_loss: 0.6546, test_loss: 0.9793, test_f1: 0.6091
 epoch: 22, train_loss: 0.6497, test_loss: 0.9253, test_f1: 0.5922
 epoch: 23, train_loss: 0.6312, test_loss: 0.9924, test_f1: 0.5904
 epoch: 24, train_loss: 0.6217, test_loss: 0.9554, test_f1: 0.6478
 epoch: 25, train_loss: 0.6005, test_loss: 1.0607, test_f1: 0.6192
 epoch: 26, train_loss: 0.6166, test_loss: 1.0294, test_f1: 0.6276
 epoch: 27, train_loss: 0.5812, test_loss: 1.1225, test_f1: 0.6515
 epoch: 28, train_loss: 0.5925, test_loss: 1.0375, test_f1: 0.6575
 epoch: 29, train_loss: 0.5722, test_loss: 1.0511, test_f1: 0.6173
 epoch: 30, train_loss: 0.5748, test_loss: 1.1321, test_f1: 0.6514
 epoch: 31, train_loss: 0.5559, test_loss: 1.0560, test_f1: 0.6564
 epoch: 32, train_loss: 0.5452, test_loss: 1.1057, test_f1: 0.6270
 epoch: 33, train_loss: 0.5258, test_loss: 1.2249, test_f1: 0.6749
 epoch: 34, train_loss: 0.5152, test_loss: 1.1603, test_f1: 0.6495
 epoch: 35, train_loss: 0.5218, test_loss: 1.1628, test_f1: 0.6409
 epoch: 36, train_loss: 0.5089, test_loss: 1.1875, test_f1: 0.6582
 epoch: 37, train_loss: 0.4908, test_loss: 1.1106, test_f1: 0.6361
 epoch: 38, train_loss: 0.4754, test_loss: 1.1908, test_f1: 0.6313
 epoch: 39, train_loss: 0.4803, test_loss: 1.0780, test_f1: 0.6339
 epoch: 40, train_loss: 0.4535, test_loss: 1.3043, test_f1: 0.6212
 epoch: 41, train_loss: 0.4617, test_loss: 1.2894, test_f1: 0.6385
 epoch: 42, train_loss: 0.4692, test_loss: 1.4114, test_f1: 0.6295
 epoch: 43, train_loss: 0.4843, test_loss: 1.1868, test_f1: 0.6141
 epoch: 44, train_loss: 0.4253, test_loss: 1.2738, test_f1: 0.6389
 epoch: 45, train_loss: 0.4186, test_loss: 1.2655, test_f1: 0.6375
 epoch: 46, train_loss: 0.4189, test_loss: 1.1152, test_f1: 0.6218
 epoch: 47, train_loss: 0.4218, test_loss: 1.2940, test_f1: 0.6637
 epoch: 48, train_loss: 0.4335, test_loss: 1.2123, test_f1: 0.6568
 epoch: 49, train_loss: 0.4111, test_loss: 1.3254, test_f1: 0.6388
 epoch: 50, train_loss: 0.3989, test_loss: 1.3343, test_f1: 0.6408
 epoch: 51, train_loss: 0.3389, test_loss: 1.4549, test_f1: 0.6684
 epoch: 52, train_loss: 0.3333, test_loss: 1.3898, test_f1: 0.6551
 epoch: 53, train_loss: 0.3099, test_loss: 1.5685, test_f1: 0.6438
 epoch: 54, train_loss: 0.3071, test_loss: 1.4860, test_f1: 0.6807
 epoch: 55, train_loss: 0.2915, test_loss: 1.5180, test_f1: 0.6485
 epoch: 56, train_loss: 0.2830, test_loss: 1.5841, test_f1: 0.6659
 epoch: 57, train_loss: 0.2920, test_loss: 1.5391, test_f1: 0.6599
 epoch: 58, train_loss: 0.2882, test_loss: 1.5255, test_f1: 0.6680
 epoch: 59, train_loss: 0.2631, test_loss: 1.5351, test_f1: 0.6551
 epoch: 60, train_loss: 0.2612, test_loss: 1.6055, test_f1: 0.6697
 epoch: 61, train_loss: 0.2487, test_loss: 1.6996, test_f1: 0.6412
 epoch: 62, train_loss: 0.2503, test_loss: 1.5296, test_f1: 0.6567
 epoch: 63, train_loss: 0.2668, test_loss: 1.6278, test_f1: 0.6734
 epoch: 64, train_loss: 0.2482, test_loss: 2.0696, test_f1: 0.6304
 epoch: 65, train_loss: 0.2742, test_loss: 1.6555, test_f1: 0.6227
 epoch: 66, train_loss: 0.2563, test_loss: 1.7387, test_f1: 0.6620
 epoch: 67, train_loss: 0.2350, test_loss: 1.8013, test_f1: 0.6396
 epoch: 68, train_loss: 0.2416, test_loss: 1.7422, test_f1: 0.6710
 epoch: 69, train_loss: 0.2476, test_loss: 1.7242, test_f1: 0.6566
 epoch: 70, train_loss: 0.2360, test_loss: 1.8087, test_f1: 0.6509
 epoch: 71, train_loss: 0.2416, test_loss: 1.7734, test_f1: 0.6632
 epoch: 72, train_loss: 0.2249, test_loss: 1.8041, test_f1: 0.6478
 epoch: 73, train_loss: 0.2221, test_loss: 1.8561, test_f1: 0.6456
 epoch: 74, train_loss: 0.2111, test_loss: 1.7888, test_f1: 0.6581
 epoch: 75, train_loss: 0.1971, test_loss: 1.7196, test_f1: 0.6548
 epoch: 76, train_loss: 0.2133, test_loss: 1.9856, test_f1: 0.6481
 epoch: 77, train_loss: 0.2049, test_loss: 1.9399, test_f1: 0.6568
 epoch: 78, train_loss: 0.2065, test_loss: 1.9853, test_f1: 0.6360
 epoch: 79, train_loss: 0.1937, test_loss: 1.8285, test_f1: 0.6606
 epoch: 80, train_loss: 0.1931, test_loss: 1.8402, test_f1: 0.6710
 epoch: 81, train_loss: 0.2056, test_loss: 1.8385, test_f1: 0.6527
 epoch: 82, train_loss: 0.1925, test_loss: 1.9481, test_f1: 0.6556
 epoch: 83, train_loss: 0.1925, test_loss: 2.1213, test_f1: 0.6614
 epoch: 84, train_loss: 0.1913, test_loss: 2.2648, test_f1: 0.6381
 epoch: 85, train_loss: 0.1987, test_loss: 2.0458, test_f1: 0.6586
 epoch: 86, train_loss: 0.2093, test_loss: 2.0375, test_f1: 0.6797
 epoch: 87, train_loss: 0.1937, test_loss: 1.9859, test_f1: 0.6695
 epoch: 88, train_loss: 0.1940, test_loss: 1.9904, test_f1: 0.6658
 epoch: 89, train_loss: 0.2033, test_loss: 2.1256, test_f1: 0.6298
 epoch: 90, train_loss: 0.2086, test_loss: 1.9211, test_f1: 0.6478
 epoch: 91, train_loss: 0.1955, test_loss: 1.9530, test_f1: 0.6520
 epoch: 92, train_loss: 0.1860, test_loss: 2.0657, test_f1: 0.6618
 epoch: 93, train_loss: 0.1783, test_loss: 2.1070, test_f1: 0.6589
 epoch: 94, train_loss: 0.1774, test_loss: 2.1677, test_f1: 0.6561
 epoch: 95, train_loss: 0.1651, test_loss: 2.1676, test_f1: 0.6331
 epoch: 96, train_loss: 0.1872, test_loss: 2.1364, test_f1: 0.6625
 epoch: 97, train_loss: 0.1674, test_loss: 2.1580, test_f1: 0.6309
 epoch: 98, train_loss: 0.1627, test_loss: 2.1573, test_f1: 0.6630
 epoch: 99, train_loss: 0.1696, test_loss: 2.2932, test_f1: 0.6433
##################ITERATION #2 ****************************************
 epoch: 0, train_loss: 1.1869, test_loss: 1.1015, test_f1: 0.4377
 epoch: 1, train_loss: 0.9811, test_loss: 0.9507, test_f1: 0.4784
 epoch: 2, train_loss: 0.9437, test_loss: 0.9501, test_f1: 0.5040
 epoch: 3, train_loss: 0.9179, test_loss: 0.9822, test_f1: 0.4872
 epoch: 4, train_loss: 0.8977, test_loss: 0.9963, test_f1: 0.5169
 epoch: 5, train_loss: 0.8737, test_loss: 0.9674, test_f1: 0.5558
 epoch: 6, train_loss: 0.8727, test_loss: 0.9490, test_f1: 0.5683
 epoch: 7, train_loss: 0.8381, test_loss: 0.8978, test_f1: 0.5915
 epoch: 8, train_loss: 0.8321, test_loss: 1.0184, test_f1: 0.5096
 epoch: 9, train_loss: 0.8293, test_loss: 1.0199, test_f1: 0.5352
 epoch: 10, train_loss: 0.8014, test_loss: 0.9849, test_f1: 0.5502
 epoch: 11, train_loss: 0.8027, test_loss: 1.0812, test_f1: 0.4990
 epoch: 12, train_loss: 0.8046, test_loss: 1.0040, test_f1: 0.5706
 epoch: 13, train_loss: 0.7663, test_loss: 0.9253, test_f1: 0.5601
 epoch: 14, train_loss: 0.7670, test_loss: 0.9800, test_f1: 0.6053
 epoch: 15, train_loss: 0.7428, test_loss: 0.9989, test_f1: 0.5862
 epoch: 16, train_loss: 0.7373, test_loss: 1.0094, test_f1: 0.6092
 epoch: 17, train_loss: 0.7325, test_loss: 0.9187, test_f1: 0.6139
 epoch: 18, train_loss: 0.7159, test_loss: 0.9577, test_f1: 0.6119
 epoch: 19, train_loss: 0.7102, test_loss: 0.9897, test_f1: 0.5948
 epoch: 20, train_loss: 0.6939, test_loss: 0.9425, test_f1: 0.6225
 epoch: 21, train_loss: 0.6796, test_loss: 0.9420, test_f1: 0.6186
 epoch: 22, train_loss: 0.6590, test_loss: 0.9438, test_f1: 0.6160
 epoch: 23, train_loss: 0.6387, test_loss: 1.0019, test_f1: 0.6277
 epoch: 24, train_loss: 0.6692, test_loss: 0.9971, test_f1: 0.6306
 epoch: 25, train_loss: 0.6366, test_loss: 1.0416, test_f1: 0.6397
 epoch: 26, train_loss: 0.6079, test_loss: 0.9890, test_f1: 0.6559
 epoch: 27, train_loss: 0.6124, test_loss: 0.9644, test_f1: 0.6585
 epoch: 28, train_loss: 0.5894, test_loss: 1.0253, test_f1: 0.6678
 epoch: 29, train_loss: 0.5998, test_loss: 1.1127, test_f1: 0.5993
 epoch: 30, train_loss: 0.5861, test_loss: 1.1022, test_f1: 0.6211
 epoch: 31, train_loss: 0.5768, test_loss: 1.0597, test_f1: 0.6325
 epoch: 32, train_loss: 0.5791, test_loss: 1.0563, test_f1: 0.6622
 epoch: 33, train_loss: 0.5549, test_loss: 1.1116, test_f1: 0.6271
 epoch: 34, train_loss: 0.5523, test_loss: 1.2919, test_f1: 0.5784
 epoch: 35, train_loss: 0.5443, test_loss: 1.2819, test_f1: 0.5649
 epoch: 36, train_loss: 0.5352, test_loss: 1.1699, test_f1: 0.6079
 epoch: 37, train_loss: 0.4974, test_loss: 1.0810, test_f1: 0.6663
 epoch: 38, train_loss: 0.4992, test_loss: 1.0047, test_f1: 0.6511
 epoch: 39, train_loss: 0.5058, test_loss: 1.2464, test_f1: 0.6174
 epoch: 40, train_loss: 0.4929, test_loss: 1.1184, test_f1: 0.6783
 epoch: 41, train_loss: 0.4872, test_loss: 1.2924, test_f1: 0.6503
 epoch: 42, train_loss: 0.4673, test_loss: 1.1753, test_f1: 0.6465
 epoch: 43, train_loss: 0.4778, test_loss: 1.1841, test_f1: 0.6610
 epoch: 44, train_loss: 0.4742, test_loss: 1.1424, test_f1: 0.6197
 epoch: 45, train_loss: 0.4480, test_loss: 1.2649, test_f1: 0.6686
 epoch: 46, train_loss: 0.4259, test_loss: 1.2833, test_f1: 0.6576
 epoch: 47, train_loss: 0.4364, test_loss: 1.2796, test_f1: 0.6225
 epoch: 48, train_loss: 0.4380, test_loss: 1.1838, test_f1: 0.6471
 epoch: 49, train_loss: 0.4143, test_loss: 1.2031, test_f1: 0.6469
 epoch: 50, train_loss: 0.4183, test_loss: 1.3028, test_f1: 0.6608
 epoch: 51, train_loss: 0.3711, test_loss: 1.3054, test_f1: 0.6387
 epoch: 52, train_loss: 0.3246, test_loss: 1.3931, test_f1: 0.6550
 epoch: 53, train_loss: 0.3216, test_loss: 1.3314, test_f1: 0.6373
 epoch: 54, train_loss: 0.3331, test_loss: 1.3854, test_f1: 0.6509
 epoch: 55, train_loss: 0.3167, test_loss: 1.4434, test_f1: 0.6691
 epoch: 56, train_loss: 0.3080, test_loss: 1.3448, test_f1: 0.6321
 epoch: 57, train_loss: 0.2883, test_loss: 1.5438, test_f1: 0.6309
 epoch: 58, train_loss: 0.2934, test_loss: 1.5346, test_f1: 0.6463
 epoch: 59, train_loss: 0.2855, test_loss: 1.5366, test_f1: 0.6306
 epoch: 60, train_loss: 0.2735, test_loss: 1.4721, test_f1: 0.6502
 epoch: 61, train_loss: 0.2689, test_loss: 1.5055, test_f1: 0.6510
 epoch: 62, train_loss: 0.2594, test_loss: 1.6208, test_f1: 0.6457
 epoch: 63, train_loss: 0.2531, test_loss: 1.7043, test_f1: 0.6599
 epoch: 64, train_loss: 0.2703, test_loss: 1.5016, test_f1: 0.6606
 epoch: 65, train_loss: 0.2574, test_loss: 1.5596, test_f1: 0.6638
 epoch: 66, train_loss: 0.2422, test_loss: 1.7273, test_f1: 0.6297
 epoch: 67, train_loss: 0.2383, test_loss: 1.5269, test_f1: 0.6594
 epoch: 68, train_loss: 0.2584, test_loss: 1.5710, test_f1: 0.6529
 epoch: 69, train_loss: 0.2272, test_loss: 1.7528, test_f1: 0.6354
 epoch: 70, train_loss: 0.2461, test_loss: 1.6769, test_f1: 0.6474
 epoch: 71, train_loss: 0.2396, test_loss: 1.6813, test_f1: 0.6439
 epoch: 72, train_loss: 0.2255, test_loss: 1.6443, test_f1: 0.6598
 epoch: 73, train_loss: 0.2309, test_loss: 1.7831, test_f1: 0.6364
 epoch: 74, train_loss: 0.2378, test_loss: 1.7186, test_f1: 0.6416
 epoch: 75, train_loss: 0.2095, test_loss: 1.8730, test_f1: 0.6355
 epoch: 76, train_loss: 0.2304, test_loss: 2.0216, test_f1: 0.6327
 epoch: 77, train_loss: 0.2215, test_loss: 1.7610, test_f1: 0.6333
 epoch: 78, train_loss: 0.2304, test_loss: 1.8963, test_f1: 0.6354
 epoch: 79, train_loss: 0.2351, test_loss: 1.8191, test_f1: 0.6281
 epoch: 80, train_loss: 0.2420, test_loss: 1.6150, test_f1: 0.6759
 epoch: 81, train_loss: 0.2202, test_loss: 1.7539, test_f1: 0.6380
 epoch: 82, train_loss: 0.1895, test_loss: 1.9041, test_f1: 0.6434
 epoch: 83, train_loss: 0.2002, test_loss: 1.7944, test_f1: 0.6448
 epoch: 84, train_loss: 0.2113, test_loss: 2.0741, test_f1: 0.6180
 epoch: 85, train_loss: 0.2305, test_loss: 1.8425, test_f1: 0.6320
 epoch: 86, train_loss: 0.2215, test_loss: 1.9079, test_f1: 0.6345
 epoch: 87, train_loss: 0.2022, test_loss: 1.8819, test_f1: 0.6480
 epoch: 88, train_loss: 0.1961, test_loss: 1.9979, test_f1: 0.6351
 epoch: 89, train_loss: 0.1895, test_loss: 1.8284, test_f1: 0.6439
 epoch: 90, train_loss: 0.1780, test_loss: 2.0510, test_f1: 0.6359
 epoch: 91, train_loss: 0.1814, test_loss: 2.0218, test_f1: 0.6378
 epoch: 92, train_loss: 0.1903, test_loss: 2.2070, test_f1: 0.6368
 epoch: 93, train_loss: 0.1791, test_loss: 2.0241, test_f1: 0.6416
 epoch: 94, train_loss: 0.1820, test_loss: 2.1327, test_f1: 0.6496
 epoch: 95, train_loss: 0.1807, test_loss: 2.0525, test_f1: 0.6283
 epoch: 96, train_loss: 0.1885, test_loss: 1.9673, test_f1: 0.6320
 epoch: 97, train_loss: 0.1845, test_loss: 2.0122, test_f1: 0.6309
 epoch: 98, train_loss: 0.1897, test_loss: 2.0011, test_f1: 0.6353
 epoch: 99, train_loss: 0.1873, test_loss: 1.9519, test_f1: 0.6497
##################ITERATION #3 ****************************************
 epoch: 0, train_loss: 1.2561, test_loss: 1.0273, test_f1: 0.4706
 epoch: 1, train_loss: 0.9768, test_loss: 0.9517, test_f1: 0.5242
 epoch: 2, train_loss: 0.9382, test_loss: 0.9458, test_f1: 0.5164
 epoch: 3, train_loss: 0.9160, test_loss: 0.9572, test_f1: 0.4949
 epoch: 4, train_loss: 0.9065, test_loss: 0.9856, test_f1: 0.5700
 epoch: 5, train_loss: 0.8647, test_loss: 0.9181, test_f1: 0.5503
 epoch: 6, train_loss: 0.8605, test_loss: 0.9611, test_f1: 0.5472
 epoch: 7, train_loss: 0.8377, test_loss: 0.9542, test_f1: 0.5396
 epoch: 8, train_loss: 0.8217, test_loss: 0.9285, test_f1: 0.6062
 epoch: 9, train_loss: 0.8281, test_loss: 0.9338, test_f1: 0.5584
 epoch: 10, train_loss: 0.8104, test_loss: 0.8983, test_f1: 0.5621
 epoch: 11, train_loss: 0.7918, test_loss: 0.9643, test_f1: 0.5906
 epoch: 12, train_loss: 0.7846, test_loss: 1.0019, test_f1: 0.5961
 epoch: 13, train_loss: 0.7722, test_loss: 0.9386, test_f1: 0.5640
 epoch: 14, train_loss: 0.7538, test_loss: 0.9774, test_f1: 0.5968
 epoch: 15, train_loss: 0.7588, test_loss: 0.9281, test_f1: 0.6017
 epoch: 16, train_loss: 0.7241, test_loss: 0.9331, test_f1: 0.6198
 epoch: 17, train_loss: 0.7188, test_loss: 0.9363, test_f1: 0.5575
 epoch: 18, train_loss: 0.7296, test_loss: 0.8954, test_f1: 0.5942
 epoch: 19, train_loss: 0.7128, test_loss: 0.9186, test_f1: 0.6318
 epoch: 20, train_loss: 0.6926, test_loss: 0.9156, test_f1: 0.6111
 epoch: 21, train_loss: 0.6782, test_loss: 0.9352, test_f1: 0.6003
 epoch: 22, train_loss: 0.6797, test_loss: 0.9261, test_f1: 0.5607
 epoch: 23, train_loss: 0.6730, test_loss: 0.9227, test_f1: 0.6572
 epoch: 24, train_loss: 0.6481, test_loss: 1.0136, test_f1: 0.6253
 epoch: 25, train_loss: 0.6277, test_loss: 0.9520, test_f1: 0.6430
 epoch: 26, train_loss: 0.6476, test_loss: 0.9845, test_f1: 0.6466
 epoch: 27, train_loss: 0.6180, test_loss: 1.2226, test_f1: 0.6085
 epoch: 28, train_loss: 0.6280, test_loss: 0.9416, test_f1: 0.6811
 epoch: 29, train_loss: 0.6162, test_loss: 0.9515, test_f1: 0.6373
 epoch: 30, train_loss: 0.5775, test_loss: 1.0221, test_f1: 0.6027
 epoch: 31, train_loss: 0.5896, test_loss: 1.0461, test_f1: 0.6084
 epoch: 32, train_loss: 0.5780, test_loss: 1.1722, test_f1: 0.6334
 epoch: 33, train_loss: 0.5706, test_loss: 0.9695, test_f1: 0.6479
 epoch: 34, train_loss: 0.5588, test_loss: 1.0318, test_f1: 0.6308
 epoch: 35, train_loss: 0.5519, test_loss: 1.0281, test_f1: 0.6725
 epoch: 36, train_loss: 0.5402, test_loss: 1.1428, test_f1: 0.6356
 epoch: 37, train_loss: 0.5369, test_loss: 1.0936, test_f1: 0.6535
 epoch: 38, train_loss: 0.5202, test_loss: 1.1545, test_f1: 0.6601
 epoch: 39, train_loss: 0.5186, test_loss: 1.0268, test_f1: 0.6405
 epoch: 40, train_loss: 0.4994, test_loss: 1.1483, test_f1: 0.6339
 epoch: 41, train_loss: 0.5068, test_loss: 1.2265, test_f1: 0.6221
 epoch: 42, train_loss: 0.4750, test_loss: 1.1666, test_f1: 0.6569
 epoch: 43, train_loss: 0.4607, test_loss: 1.1803, test_f1: 0.6580
 epoch: 44, train_loss: 0.4714, test_loss: 1.1278, test_f1: 0.6692
 epoch: 45, train_loss: 0.4396, test_loss: 1.2278, test_f1: 0.6568
 epoch: 46, train_loss: 0.4625, test_loss: 1.1289, test_f1: 0.6409
 epoch: 47, train_loss: 0.4630, test_loss: 1.2062, test_f1: 0.6638
 epoch: 48, train_loss: 0.4363, test_loss: 1.1474, test_f1: 0.6481
 epoch: 49, train_loss: 0.4497, test_loss: 1.1858, test_f1: 0.6574
 epoch: 50, train_loss: 0.4356, test_loss: 1.2668, test_f1: 0.6310
 epoch: 51, train_loss: 0.3758, test_loss: 1.2634, test_f1: 0.6727
 epoch: 52, train_loss: 0.3484, test_loss: 1.2848, test_f1: 0.6413
 epoch: 53, train_loss: 0.3421, test_loss: 1.5136, test_f1: 0.6450
 epoch: 54, train_loss: 0.3473, test_loss: 1.4548, test_f1: 0.6339
 epoch: 55, train_loss: 0.3366, test_loss: 1.3562, test_f1: 0.6771
 epoch: 56, train_loss: 0.3130, test_loss: 1.4731, test_f1: 0.6480
 epoch: 57, train_loss: 0.3226, test_loss: 1.4624, test_f1: 0.6636
 epoch: 58, train_loss: 0.3170, test_loss: 1.4977, test_f1: 0.6535
 epoch: 59, train_loss: 0.3231, test_loss: 1.5178, test_f1: 0.6333
 epoch: 60, train_loss: 0.2928, test_loss: 1.5001, test_f1: 0.6508
 epoch: 61, train_loss: 0.3066, test_loss: 1.4970, test_f1: 0.6451
 epoch: 62, train_loss: 0.3019, test_loss: 1.5563, test_f1: 0.6657
 epoch: 63, train_loss: 0.3220, test_loss: 1.5051, test_f1: 0.6644
 epoch: 64, train_loss: 0.2906, test_loss: 1.6642, test_f1: 0.6539
 epoch: 65, train_loss: 0.2855, test_loss: 1.5225, test_f1: 0.6722
 epoch: 66, train_loss: 0.2940, test_loss: 1.6720, test_f1: 0.6643
 epoch: 67, train_loss: 0.2746, test_loss: 1.5885, test_f1: 0.6451
 epoch: 68, train_loss: 0.2635, test_loss: 1.6161, test_f1: 0.6526
 epoch: 69, train_loss: 0.2679, test_loss: 1.9182, test_f1: 0.6469
 epoch: 70, train_loss: 0.2703, test_loss: 1.7792, test_f1: 0.6629
 epoch: 71, train_loss: 0.2612, test_loss: 1.9005, test_f1: 0.6247
 epoch: 72, train_loss: 0.2776, test_loss: 1.7728, test_f1: 0.6517
 epoch: 73, train_loss: 0.2495, test_loss: 1.9209, test_f1: 0.6279
 epoch: 74, train_loss: 0.2486, test_loss: 1.7110, test_f1: 0.6633
 epoch: 75, train_loss: 0.2459, test_loss: 1.9294, test_f1: 0.6287
 epoch: 76, train_loss: 0.2497, test_loss: 1.8204, test_f1: 0.6396
 epoch: 77, train_loss: 0.2487, test_loss: 1.7693, test_f1: 0.6345
 epoch: 78, train_loss: 0.2246, test_loss: 1.9123, test_f1: 0.6477
 epoch: 79, train_loss: 0.2417, test_loss: 1.9214, test_f1: 0.6272
 epoch: 80, train_loss: 0.2440, test_loss: 1.7308, test_f1: 0.6550
 epoch: 81, train_loss: 0.2431, test_loss: 1.9339, test_f1: 0.6462
 epoch: 82, train_loss: 0.2307, test_loss: 1.7262, test_f1: 0.6544
 epoch: 83, train_loss: 0.2373, test_loss: 2.0108, test_f1: 0.6395
 epoch: 84, train_loss: 0.2415, test_loss: 1.8660, test_f1: 0.6560
 epoch: 85, train_loss: 0.2152, test_loss: 1.8845, test_f1: 0.6564
 epoch: 86, train_loss: 0.2278, test_loss: 1.9840, test_f1: 0.6362
 epoch: 87, train_loss: 0.2097, test_loss: 1.9653, test_f1: 0.6522
 epoch: 88, train_loss: 0.2100, test_loss: 2.0227, test_f1: 0.6539
 epoch: 89, train_loss: 0.2197, test_loss: 1.9368, test_f1: 0.6376
 epoch: 90, train_loss: 0.2234, test_loss: 1.7570, test_f1: 0.6545
 epoch: 91, train_loss: 0.2201, test_loss: 2.0708, test_f1: 0.6404
 epoch: 92, train_loss: 0.2051, test_loss: 2.0153, test_f1: 0.6439
 epoch: 93, train_loss: 0.1991, test_loss: 2.0119, test_f1: 0.6600
 epoch: 94, train_loss: 0.2142, test_loss: 1.8895, test_f1: 0.6382
 epoch: 95, train_loss: 0.2110, test_loss: 1.9826, test_f1: 0.6350
 epoch: 96, train_loss: 0.2072, test_loss: 1.9739, test_f1: 0.6420
 epoch: 97, train_loss: 0.1863, test_loss: 2.1068, test_f1: 0.6437
 epoch: 98, train_loss: 0.1937, test_loss: 2.1033, test_f1: 0.6563
 epoch: 99, train_loss: 0.1753, test_loss: 2.1886, test_f1: 0.6428
##################ITERATION #4 ****************************************
 epoch: 0, train_loss: 1.3139, test_loss: 1.0437, test_f1: 0.4611
 epoch: 1, train_loss: 1.0012, test_loss: 0.9595, test_f1: 0.4732
 epoch: 2, train_loss: 0.9597, test_loss: 0.9438, test_f1: 0.4692
 epoch: 3, train_loss: 0.9382, test_loss: 0.9315, test_f1: 0.5411
 epoch: 4, train_loss: 0.9127, test_loss: 0.9322, test_f1: 0.5562
 epoch: 5, train_loss: 0.8811, test_loss: 0.9125, test_f1: 0.5316
 epoch: 6, train_loss: 0.8839, test_loss: 0.9458, test_f1: 0.5299
 epoch: 7, train_loss: 0.8584, test_loss: 0.9529, test_f1: 0.5471
 epoch: 8, train_loss: 0.8391, test_loss: 0.9531, test_f1: 0.5664
 epoch: 9, train_loss: 0.8399, test_loss: 0.8955, test_f1: 0.5539
 epoch: 10, train_loss: 0.8212, test_loss: 0.9097, test_f1: 0.5849
 epoch: 11, train_loss: 0.7957, test_loss: 0.9011, test_f1: 0.5817
 epoch: 12, train_loss: 0.7897, test_loss: 0.9099, test_f1: 0.6025
 epoch: 13, train_loss: 0.7848, test_loss: 0.9191, test_f1: 0.5812
 epoch: 14, train_loss: 0.7713, test_loss: 0.9661, test_f1: 0.5722
 epoch: 15, train_loss: 0.7575, test_loss: 0.9031, test_f1: 0.6170
 epoch: 16, train_loss: 0.7551, test_loss: 0.9190, test_f1: 0.5773
 epoch: 17, train_loss: 0.7334, test_loss: 0.9461, test_f1: 0.5906
 epoch: 18, train_loss: 0.7583, test_loss: 0.8588, test_f1: 0.6035
 epoch: 19, train_loss: 0.7148, test_loss: 0.9437, test_f1: 0.6179
 epoch: 20, train_loss: 0.7172, test_loss: 0.9153, test_f1: 0.6214
 epoch: 21, train_loss: 0.7120, test_loss: 0.9673, test_f1: 0.5773
 epoch: 22, train_loss: 0.6975, test_loss: 0.9221, test_f1: 0.6000
 epoch: 23, train_loss: 0.6833, test_loss: 0.9129, test_f1: 0.5965
 epoch: 24, train_loss: 0.6878, test_loss: 0.9014, test_f1: 0.6433
 epoch: 25, train_loss: 0.6645, test_loss: 1.0089, test_f1: 0.6090
 epoch: 26, train_loss: 0.6604, test_loss: 0.9714, test_f1: 0.5812
 epoch: 27, train_loss: 0.6475, test_loss: 0.9745, test_f1: 0.6473
 epoch: 28, train_loss: 0.6411, test_loss: 0.9842, test_f1: 0.6140
 epoch: 29, train_loss: 0.6348, test_loss: 0.9811, test_f1: 0.6190
 epoch: 30, train_loss: 0.6264, test_loss: 0.9796, test_f1: 0.6122
 epoch: 31, train_loss: 0.6022, test_loss: 0.8861, test_f1: 0.6415
 epoch: 32, train_loss: 0.5905, test_loss: 0.9097, test_f1: 0.6139
 epoch: 33, train_loss: 0.6026, test_loss: 1.0644, test_f1: 0.5884
 epoch: 34, train_loss: 0.5856, test_loss: 0.9785, test_f1: 0.6350
 epoch: 35, train_loss: 0.5712, test_loss: 1.0506, test_f1: 0.6108
 epoch: 36, train_loss: 0.5694, test_loss: 1.0859, test_f1: 0.6273
 epoch: 37, train_loss: 0.5659, test_loss: 1.0311, test_f1: 0.6431
 epoch: 38, train_loss: 0.5759, test_loss: 1.0419, test_f1: 0.6123
 epoch: 39, train_loss: 0.5340, test_loss: 0.9866, test_f1: 0.6314
 epoch: 40, train_loss: 0.5283, test_loss: 1.1285, test_f1: 0.6379
 epoch: 41, train_loss: 0.5225, test_loss: 0.9724, test_f1: 0.6456
 epoch: 42, train_loss: 0.5180, test_loss: 1.0150, test_f1: 0.6354
 epoch: 43, train_loss: 0.5106, test_loss: 1.0774, test_f1: 0.6152
 epoch: 44, train_loss: 0.5063, test_loss: 1.0955, test_f1: 0.6417
 epoch: 45, train_loss: 0.5056, test_loss: 0.9633, test_f1: 0.6589
 epoch: 46, train_loss: 0.4744, test_loss: 0.9582, test_f1: 0.6759
 epoch: 47, train_loss: 0.4939, test_loss: 0.9841, test_f1: 0.6646
 epoch: 48, train_loss: 0.4552, test_loss: 1.0563, test_f1: 0.6572
 epoch: 49, train_loss: 0.4503, test_loss: 1.0973, test_f1: 0.6631
 epoch: 50, train_loss: 0.4413, test_loss: 1.0685, test_f1: 0.6695
 epoch: 51, train_loss: 0.4152, test_loss: 1.0957, test_f1: 0.6438
 epoch: 52, train_loss: 0.3688, test_loss: 1.0852, test_f1: 0.6801
 epoch: 53, train_loss: 0.3684, test_loss: 1.1968, test_f1: 0.6632
 epoch: 54, train_loss: 0.3559, test_loss: 1.1671, test_f1: 0.6698
 epoch: 55, train_loss: 0.3649, test_loss: 1.1347, test_f1: 0.6367
 epoch: 56, train_loss: 0.3490, test_loss: 1.1980, test_f1: 0.6864
 epoch: 57, train_loss: 0.3309, test_loss: 1.1433, test_f1: 0.6696
 epoch: 58, train_loss: 0.3359, test_loss: 1.2492, test_f1: 0.6632
 epoch: 59, train_loss: 0.3258, test_loss: 1.1752, test_f1: 0.6730
 epoch: 60, train_loss: 0.3291, test_loss: 1.2088, test_f1: 0.6693
 epoch: 61, train_loss: 0.3276, test_loss: 1.2979, test_f1: 0.6365
 epoch: 62, train_loss: 0.3185, test_loss: 1.2278, test_f1: 0.6682
 epoch: 63, train_loss: 0.3057, test_loss: 1.2963, test_f1: 0.6737
 epoch: 64, train_loss: 0.3113, test_loss: 1.3888, test_f1: 0.6568
 epoch: 65, train_loss: 0.3061, test_loss: 1.2848, test_f1: 0.6516
 epoch: 66, train_loss: 0.2967, test_loss: 1.3284, test_f1: 0.6448
 epoch: 67, train_loss: 0.2819, test_loss: 1.3461, test_f1: 0.6676
 epoch: 68, train_loss: 0.2802, test_loss: 1.3640, test_f1: 0.6537
 epoch: 69, train_loss: 0.2806, test_loss: 1.3998, test_f1: 0.6345
 epoch: 70, train_loss: 0.2873, test_loss: 1.3902, test_f1: 0.6704
 epoch: 71, train_loss: 0.2863, test_loss: 1.3935, test_f1: 0.6786
 epoch: 72, train_loss: 0.2897, test_loss: 1.4042, test_f1: 0.6411
 epoch: 73, train_loss: 0.2657, test_loss: 1.4543, test_f1: 0.6454
 epoch: 74, train_loss: 0.2652, test_loss: 1.4870, test_f1: 0.6693
 epoch: 75, train_loss: 0.2637, test_loss: 1.5000, test_f1: 0.6433
 epoch: 76, train_loss: 0.2590, test_loss: 1.5141, test_f1: 0.6493
 epoch: 77, train_loss: 0.2548, test_loss: 1.4479, test_f1: 0.6521
 epoch: 78, train_loss: 0.2621, test_loss: 1.5285, test_f1: 0.6466
 epoch: 79, train_loss: 0.2486, test_loss: 1.5482, test_f1: 0.6497
 epoch: 80, train_loss: 0.2566, test_loss: 1.4539, test_f1: 0.6516
 epoch: 81, train_loss: 0.2482, test_loss: 1.4379, test_f1: 0.6886
 epoch: 82, train_loss: 0.2554, test_loss: 1.4690, test_f1: 0.6456
 epoch: 83, train_loss: 0.2373, test_loss: 1.5073, test_f1: 0.6345
 epoch: 84, train_loss: 0.2318, test_loss: 1.5944, test_f1: 0.6465
 epoch: 85, train_loss: 0.2335, test_loss: 1.6100, test_f1: 0.6320
 epoch: 86, train_loss: 0.2432, test_loss: 1.6720, test_f1: 0.6360
 epoch: 87, train_loss: 0.2514, test_loss: 1.5774, test_f1: 0.6436
 epoch: 88, train_loss: 0.2394, test_loss: 1.5455, test_f1: 0.6717
 epoch: 89, train_loss: 0.2264, test_loss: 1.7293, test_f1: 0.6357
 epoch: 90, train_loss: 0.2440, test_loss: 1.7419, test_f1: 0.6473
 epoch: 91, train_loss: 0.2206, test_loss: 1.7054, test_f1: 0.6542
 epoch: 92, train_loss: 0.2182, test_loss: 1.5572, test_f1: 0.6668
 epoch: 93, train_loss: 0.2306, test_loss: 1.8381, test_f1: 0.6348
 epoch: 94, train_loss: 0.2329, test_loss: 1.7363, test_f1: 0.6463
 epoch: 95, train_loss: 0.2143, test_loss: 1.7431, test_f1: 0.6465
 epoch: 96, train_loss: 0.2157, test_loss: 1.6972, test_f1: 0.6414
 epoch: 97, train_loss: 0.2139, test_loss: 1.6516, test_f1: 0.6361
 epoch: 98, train_loss: 0.2130, test_loss: 1.7911, test_f1: 0.6218
 epoch: 99, train_loss: 0.2087, test_loss: 1.5826, test_f1: 0.6654
##################ITERATION #5 ****************************************
 epoch: 0, train_loss: 1.2765, test_loss: 1.0173, test_f1: 0.4190
 epoch: 1, train_loss: 0.9826, test_loss: 0.9530, test_f1: 0.4688
 epoch: 2, train_loss: 0.9704, test_loss: 0.9946, test_f1: 0.4683
 epoch: 3, train_loss: 0.9283, test_loss: 0.9641, test_f1: 0.4692
 epoch: 4, train_loss: 0.9107, test_loss: 0.9524, test_f1: 0.5061
 epoch: 5, train_loss: 0.8898, test_loss: 0.9705, test_f1: 0.5322
 epoch: 6, train_loss: 0.8814, test_loss: 0.9383, test_f1: 0.5722
 epoch: 7, train_loss: 0.8578, test_loss: 0.9395, test_f1: 0.5279
 epoch: 8, train_loss: 0.8417, test_loss: 0.9153, test_f1: 0.5349
 epoch: 9, train_loss: 0.8496, test_loss: 0.9267, test_f1: 0.5550
 epoch: 10, train_loss: 0.8169, test_loss: 1.0158, test_f1: 0.5466
 epoch: 11, train_loss: 0.8210, test_loss: 0.9213, test_f1: 0.5747
 epoch: 12, train_loss: 0.8026, test_loss: 0.9137, test_f1: 0.5813
 epoch: 13, train_loss: 0.7849, test_loss: 0.9551, test_f1: 0.5573
 epoch: 14, train_loss: 0.7785, test_loss: 0.9435, test_f1: 0.5526
 epoch: 15, train_loss: 0.7686, test_loss: 0.9328, test_f1: 0.5565
 epoch: 16, train_loss: 0.7657, test_loss: 0.9673, test_f1: 0.6050
 epoch: 17, train_loss: 0.7635, test_loss: 0.8893, test_f1: 0.5984
 epoch: 18, train_loss: 0.7374, test_loss: 0.9402, test_f1: 0.6180
 epoch: 19, train_loss: 0.7414, test_loss: 0.9318, test_f1: 0.5768
 epoch: 20, train_loss: 0.7291, test_loss: 0.9349, test_f1: 0.5775
 epoch: 21, train_loss: 0.7002, test_loss: 0.9668, test_f1: 0.6415
 epoch: 22, train_loss: 0.6976, test_loss: 0.9448, test_f1: 0.5845
 epoch: 23, train_loss: 0.6918, test_loss: 1.0086, test_f1: 0.5978
 epoch: 24, train_loss: 0.6798, test_loss: 1.0406, test_f1: 0.6040
 epoch: 25, train_loss: 0.6893, test_loss: 0.9918, test_f1: 0.6245
 epoch: 26, train_loss: 0.6709, test_loss: 0.9183, test_f1: 0.6213
 epoch: 27, train_loss: 0.6727, test_loss: 1.0106, test_f1: 0.5685
 epoch: 28, train_loss: 0.6479, test_loss: 1.0915, test_f1: 0.5926
 epoch: 29, train_loss: 0.6151, test_loss: 0.9950, test_f1: 0.5813
 epoch: 30, train_loss: 0.6190, test_loss: 0.9890, test_f1: 0.6239
 epoch: 31, train_loss: 0.6137, test_loss: 1.0132, test_f1: 0.6389
 epoch: 32, train_loss: 0.6221, test_loss: 1.0158, test_f1: 0.6579
 epoch: 33, train_loss: 0.5956, test_loss: 1.0068, test_f1: 0.6252
 epoch: 34, train_loss: 0.5893, test_loss: 1.0813, test_f1: 0.6168
 epoch: 35, train_loss: 0.5594, test_loss: 1.0481, test_f1: 0.6578
 epoch: 36, train_loss: 0.5807, test_loss: 0.9650, test_f1: 0.6233
 epoch: 37, train_loss: 0.5501, test_loss: 0.9770, test_f1: 0.6346
 epoch: 38, train_loss: 0.5447, test_loss: 1.0847, test_f1: 0.6282
 epoch: 39, train_loss: 0.5337, test_loss: 0.9984, test_f1: 0.6662
 epoch: 40, train_loss: 0.5327, test_loss: 1.0422, test_f1: 0.6251
 epoch: 41, train_loss: 0.5076, test_loss: 0.9893, test_f1: 0.6445
 epoch: 42, train_loss: 0.5033, test_loss: 1.1821, test_f1: 0.6278
 epoch: 43, train_loss: 0.4985, test_loss: 1.0998, test_f1: 0.6537
 epoch: 44, train_loss: 0.4704, test_loss: 1.3429, test_f1: 0.5920
 epoch: 45, train_loss: 0.4823, test_loss: 1.2763, test_f1: 0.6311
 epoch: 46, train_loss: 0.4741, test_loss: 1.1439, test_f1: 0.6629
 epoch: 47, train_loss: 0.4810, test_loss: 1.1192, test_f1: 0.6229
 epoch: 48, train_loss: 0.4515, test_loss: 1.1628, test_f1: 0.6478
 epoch: 49, train_loss: 0.4466, test_loss: 1.1615, test_f1: 0.6231
 epoch: 50, train_loss: 0.4425, test_loss: 1.1501, test_f1: 0.6327
 epoch: 51, train_loss: 0.4170, test_loss: 1.2590, test_f1: 0.6478
 epoch: 52, train_loss: 0.3659, test_loss: 1.2901, test_f1: 0.6277
 epoch: 53, train_loss: 0.3429, test_loss: 1.3355, test_f1: 0.6633
 epoch: 54, train_loss: 0.3569, test_loss: 1.3080, test_f1: 0.6466
 epoch: 55, train_loss: 0.3304, test_loss: 1.4227, test_f1: 0.6418
 epoch: 56, train_loss: 0.3291, test_loss: 1.3062, test_f1: 0.6488
 epoch: 57, train_loss: 0.3313, test_loss: 1.3161, test_f1: 0.6486
 epoch: 58, train_loss: 0.3174, test_loss: 1.5045, test_f1: 0.6475
 epoch: 59, train_loss: 0.3019, test_loss: 1.5295, test_f1: 0.6429
 epoch: 60, train_loss: 0.3107, test_loss: 1.5036, test_f1: 0.6317
 epoch: 61, train_loss: 0.2943, test_loss: 1.5138, test_f1: 0.6501
 epoch: 62, train_loss: 0.3177, test_loss: 1.3518, test_f1: 0.6576
 epoch: 63, train_loss: 0.2898, test_loss: 1.5271, test_f1: 0.6368
 epoch: 64, train_loss: 0.3081, test_loss: 1.5704, test_f1: 0.6607
 epoch: 65, train_loss: 0.3057, test_loss: 1.5197, test_f1: 0.6294
 epoch: 66, train_loss: 0.2826, test_loss: 1.5458, test_f1: 0.6367
 epoch: 67, train_loss: 0.2805, test_loss: 1.6298, test_f1: 0.6387
 epoch: 68, train_loss: 0.2951, test_loss: 1.4239, test_f1: 0.6404
 epoch: 69, train_loss: 0.2750, test_loss: 1.5846, test_f1: 0.6283
 epoch: 70, train_loss: 0.2720, test_loss: 1.6203, test_f1: 0.6463
 epoch: 71, train_loss: 0.2666, test_loss: 1.6291, test_f1: 0.6272
 epoch: 72, train_loss: 0.2540, test_loss: 1.6072, test_f1: 0.6458
 epoch: 73, train_loss: 0.2633, test_loss: 1.7501, test_f1: 0.6365
 epoch: 74, train_loss: 0.2537, test_loss: 1.6508, test_f1: 0.6413
 epoch: 75, train_loss: 0.2477, test_loss: 1.6862, test_f1: 0.6496
 epoch: 76, train_loss: 0.2421, test_loss: 1.7251, test_f1: 0.6364
 epoch: 77, train_loss: 0.2579, test_loss: 1.5987, test_f1: 0.6297
 epoch: 78, train_loss: 0.2569, test_loss: 1.6791, test_f1: 0.6551
 epoch: 79, train_loss: 0.2388, test_loss: 1.7023, test_f1: 0.6346
 epoch: 80, train_loss: 0.2406, test_loss: 1.5228, test_f1: 0.6564
 epoch: 81, train_loss: 0.2244, test_loss: 1.8736, test_f1: 0.6345
 epoch: 82, train_loss: 0.2145, test_loss: 1.7493, test_f1: 0.6400
 epoch: 83, train_loss: 0.2243, test_loss: 1.7097, test_f1: 0.6388
 epoch: 84, train_loss: 0.2260, test_loss: 1.6579, test_f1: 0.6348
 epoch: 85, train_loss: 0.2131, test_loss: 1.7544, test_f1: 0.6304
 epoch: 86, train_loss: 0.2066, test_loss: 1.7593, test_f1: 0.6377
 epoch: 87, train_loss: 0.2122, test_loss: 1.7185, test_f1: 0.6375
 epoch: 88, train_loss: 0.2331, test_loss: 1.5448, test_f1: 0.6379
 epoch: 89, train_loss: 0.2234, test_loss: 1.6355, test_f1: 0.6466
 epoch: 90, train_loss: 0.2079, test_loss: 1.6783, test_f1: 0.6599
 epoch: 91, train_loss: 0.2038, test_loss: 1.8253, test_f1: 0.6347
 epoch: 92, train_loss: 0.1935, test_loss: 1.9365, test_f1: 0.6402
 epoch: 93, train_loss: 0.1919, test_loss: 1.7780, test_f1: 0.6346
 epoch: 94, train_loss: 0.1919, test_loss: 2.0028, test_f1: 0.6129
 epoch: 95, train_loss: 0.2079, test_loss: 1.7863, test_f1: 0.6557
 epoch: 96, train_loss: 0.2365, test_loss: 1.7895, test_f1: 0.6370
 epoch: 97, train_loss: 0.2177, test_loss: 1.7322, test_f1: 0.6498
 epoch: 98, train_loss: 0.1992, test_loss: 1.7379, test_f1: 0.6530
 epoch: 99, train_loss: 0.1689, test_loss: 1.8935, test_f1: 0.6595
##################ITERATION #6 ****************************************
 epoch: 0, train_loss: 1.2453, test_loss: 1.0034, test_f1: 0.4182
 epoch: 1, train_loss: 0.9791, test_loss: 0.9306, test_f1: 0.4839
 epoch: 2, train_loss: 0.9544, test_loss: 0.9410, test_f1: 0.4841
 epoch: 3, train_loss: 0.9262, test_loss: 0.8950, test_f1: 0.4892
 epoch: 4, train_loss: 0.9007, test_loss: 0.9239, test_f1: 0.5128
 epoch: 5, train_loss: 0.8959, test_loss: 0.9134, test_f1: 0.5548
 epoch: 6, train_loss: 0.8668, test_loss: 0.9441, test_f1: 0.5270
 epoch: 7, train_loss: 0.8601, test_loss: 0.9193, test_f1: 0.5432
 epoch: 8, train_loss: 0.8350, test_loss: 0.9731, test_f1: 0.5033
 epoch: 9, train_loss: 0.8357, test_loss: 0.9351, test_f1: 0.5657
 epoch: 10, train_loss: 0.8108, test_loss: 0.9197, test_f1: 0.5848
 epoch: 11, train_loss: 0.8094, test_loss: 0.9462, test_f1: 0.5541
 epoch: 12, train_loss: 0.7893, test_loss: 0.9363, test_f1: 0.5537
 epoch: 13, train_loss: 0.7676, test_loss: 0.9693, test_f1: 0.5434
 epoch: 14, train_loss: 0.7743, test_loss: 0.9208, test_f1: 0.5818
 epoch: 15, train_loss: 0.7656, test_loss: 0.8974, test_f1: 0.5488
 epoch: 16, train_loss: 0.7485, test_loss: 0.9619, test_f1: 0.5684
 epoch: 17, train_loss: 0.7164, test_loss: 0.9723, test_f1: 0.5775
 epoch: 18, train_loss: 0.7311, test_loss: 0.9641, test_f1: 0.6016
 epoch: 19, train_loss: 0.7128, test_loss: 0.9824, test_f1: 0.5833
 epoch: 20, train_loss: 0.7031, test_loss: 0.9648, test_f1: 0.5808
 epoch: 21, train_loss: 0.7144, test_loss: 0.8785, test_f1: 0.5991
 epoch: 22, train_loss: 0.6905, test_loss: 1.0288, test_f1: 0.5745
 epoch: 23, train_loss: 0.6871, test_loss: 0.9697, test_f1: 0.5946
 epoch: 24, train_loss: 0.6503, test_loss: 1.0581, test_f1: 0.5704
 epoch: 25, train_loss: 0.6520, test_loss: 0.9792, test_f1: 0.6322
 epoch: 26, train_loss: 0.6503, test_loss: 0.8422, test_f1: 0.6338
 epoch: 27, train_loss: 0.6418, test_loss: 0.9096, test_f1: 0.6244
 epoch: 28, train_loss: 0.6323, test_loss: 1.0382, test_f1: 0.6069
 epoch: 29, train_loss: 0.6225, test_loss: 1.0087, test_f1: 0.6085
 epoch: 30, train_loss: 0.6074, test_loss: 0.9962, test_f1: 0.6039
 epoch: 31, train_loss: 0.5958, test_loss: 0.9332, test_f1: 0.6343
 epoch: 32, train_loss: 0.5968, test_loss: 1.0472, test_f1: 0.6458
 epoch: 33, train_loss: 0.5697, test_loss: 0.9433, test_f1: 0.6338
 epoch: 34, train_loss: 0.5587, test_loss: 1.0819, test_f1: 0.6184
 epoch: 35, train_loss: 0.5621, test_loss: 0.9488, test_f1: 0.6305
 epoch: 36, train_loss: 0.5657, test_loss: 0.8917, test_f1: 0.6698
 epoch: 37, train_loss: 0.5497, test_loss: 1.0368, test_f1: 0.6212
 epoch: 38, train_loss: 0.5427, test_loss: 1.0471, test_f1: 0.6202
 epoch: 39, train_loss: 0.5296, test_loss: 0.9746, test_f1: 0.6458
 epoch: 40, train_loss: 0.5284, test_loss: 1.0324, test_f1: 0.6299
 epoch: 41, train_loss: 0.5161, test_loss: 0.9693, test_f1: 0.6353
 epoch: 42, train_loss: 0.5138, test_loss: 1.0501, test_f1: 0.6380
 epoch: 43, train_loss: 0.4984, test_loss: 0.9934, test_f1: 0.6675
 epoch: 44, train_loss: 0.5256, test_loss: 1.0560, test_f1: 0.6853
 epoch: 45, train_loss: 0.4876, test_loss: 1.0090, test_f1: 0.6650
 epoch: 46, train_loss: 0.4752, test_loss: 1.0145, test_f1: 0.6599
 epoch: 47, train_loss: 0.4604, test_loss: 1.0336, test_f1: 0.6607
 epoch: 48, train_loss: 0.4782, test_loss: 1.1296, test_f1: 0.6547
 epoch: 49, train_loss: 0.4543, test_loss: 1.1348, test_f1: 0.6461
 epoch: 50, train_loss: 0.4621, test_loss: 1.1745, test_f1: 0.6347
 epoch: 51, train_loss: 0.3883, test_loss: 1.1642, test_f1: 0.6372
 epoch: 52, train_loss: 0.3760, test_loss: 1.2246, test_f1: 0.6564
 epoch: 53, train_loss: 0.3658, test_loss: 1.1000, test_f1: 0.6785
 epoch: 54, train_loss: 0.3424, test_loss: 1.2047, test_f1: 0.6382
 epoch: 55, train_loss: 0.3321, test_loss: 1.2640, test_f1: 0.6426
 epoch: 56, train_loss: 0.3310, test_loss: 1.2236, test_f1: 0.6744
 epoch: 57, train_loss: 0.3374, test_loss: 1.3038, test_f1: 0.6640
 epoch: 58, train_loss: 0.3229, test_loss: 1.3542, test_f1: 0.6386
 epoch: 59, train_loss: 0.3213, test_loss: 1.2352, test_f1: 0.6424
 epoch: 60, train_loss: 0.3203, test_loss: 1.2307, test_f1: 0.6521
 epoch: 61, train_loss: 0.3120, test_loss: 1.2500, test_f1: 0.6624
 epoch: 62, train_loss: 0.2844, test_loss: 1.2750, test_f1: 0.6514
 epoch: 63, train_loss: 0.3167, test_loss: 1.2276, test_f1: 0.6542
 epoch: 64, train_loss: 0.2896, test_loss: 1.2448, test_f1: 0.6849
 epoch: 65, train_loss: 0.2906, test_loss: 1.2975, test_f1: 0.6786
 epoch: 66, train_loss: 0.2750, test_loss: 1.3062, test_f1: 0.6635
 epoch: 67, train_loss: 0.2892, test_loss: 1.3969, test_f1: 0.6840
 epoch: 68, train_loss: 0.3039, test_loss: 1.4450, test_f1: 0.6439
 epoch: 69, train_loss: 0.2816, test_loss: 1.3353, test_f1: 0.6550
 epoch: 70, train_loss: 0.2711, test_loss: 1.3021, test_f1: 0.6657
 epoch: 71, train_loss: 0.2630, test_loss: 1.4049, test_f1: 0.6657
 epoch: 72, train_loss: 0.2642, test_loss: 1.3655, test_f1: 0.6742
 epoch: 73, train_loss: 0.2785, test_loss: 1.4328, test_f1: 0.6609
 epoch: 74, train_loss: 0.2548, test_loss: 1.4417, test_f1: 0.6623
 epoch: 75, train_loss: 0.2571, test_loss: 1.4107, test_f1: 0.6681
 epoch: 76, train_loss: 0.2459, test_loss: 1.4715, test_f1: 0.6349
 epoch: 77, train_loss: 0.2315, test_loss: 1.3755, test_f1: 0.6486
 epoch: 78, train_loss: 0.2399, test_loss: 1.5182, test_f1: 0.6474
 epoch: 79, train_loss: 0.2571, test_loss: 1.4297, test_f1: 0.6497
 epoch: 80, train_loss: 0.2377, test_loss: 1.5340, test_f1: 0.6371
 epoch: 81, train_loss: 0.2247, test_loss: 1.5664, test_f1: 0.6363
 epoch: 82, train_loss: 0.2104, test_loss: 1.6491, test_f1: 0.6342
 epoch: 83, train_loss: 0.2429, test_loss: 1.6291, test_f1: 0.6568
 epoch: 84, train_loss: 0.2250, test_loss: 1.4616, test_f1: 0.6380
 epoch: 85, train_loss: 0.2132, test_loss: 1.5967, test_f1: 0.6367
 epoch: 86, train_loss: 0.2378, test_loss: 1.5465, test_f1: 0.6698
 epoch: 87, train_loss: 0.2252, test_loss: 1.5951, test_f1: 0.6742
 epoch: 88, train_loss: 0.2105, test_loss: 1.5939, test_f1: 0.6428
 epoch: 89, train_loss: 0.2031, test_loss: 1.8176, test_f1: 0.6421
 epoch: 90, train_loss: 0.2237, test_loss: 1.7054, test_f1: 0.6570
 epoch: 91, train_loss: 0.2224, test_loss: 1.6267, test_f1: 0.6727
 epoch: 92, train_loss: 0.2072, test_loss: 1.7127, test_f1: 0.6602
 epoch: 93, train_loss: 0.2143, test_loss: 1.6343, test_f1: 0.6632
 epoch: 94, train_loss: 0.1905, test_loss: 1.6110, test_f1: 0.6550
 epoch: 95, train_loss: 0.1878, test_loss: 1.6276, test_f1: 0.6523
 epoch: 96, train_loss: 0.1877, test_loss: 1.7255, test_f1: 0.6478
 epoch: 97, train_loss: 0.1892, test_loss: 1.8205, test_f1: 0.6404
 epoch: 98, train_loss: 0.1947, test_loss: 1.8032, test_f1: 0.6465
 epoch: 99, train_loss: 0.1909, test_loss: 1.7835, test_f1: 0.6661
##################ITERATION #7 ****************************************
 epoch: 0, train_loss: 1.2856, test_loss: 1.0354, test_f1: 0.4438
 epoch: 1, train_loss: 0.9963, test_loss: 0.9472, test_f1: 0.4658
 epoch: 2, train_loss: 0.9411, test_loss: 0.9463, test_f1: 0.4923
 epoch: 3, train_loss: 0.9068, test_loss: 0.9418, test_f1: 0.5113
 epoch: 4, train_loss: 0.9053, test_loss: 0.8887, test_f1: 0.5392
 epoch: 5, train_loss: 0.8610, test_loss: 0.9072, test_f1: 0.5387
 epoch: 6, train_loss: 0.8702, test_loss: 0.9786, test_f1: 0.5312
 epoch: 7, train_loss: 0.8611, test_loss: 0.9494, test_f1: 0.5260
 epoch: 8, train_loss: 0.8304, test_loss: 0.9438, test_f1: 0.5689
 epoch: 9, train_loss: 0.8184, test_loss: 0.9123, test_f1: 0.5260
 epoch: 10, train_loss: 0.8299, test_loss: 0.8342, test_f1: 0.5465
 epoch: 11, train_loss: 0.8019, test_loss: 0.9215, test_f1: 0.5262
 epoch: 12, train_loss: 0.7976, test_loss: 0.9732, test_f1: 0.5258
 epoch: 13, train_loss: 0.7752, test_loss: 0.9092, test_f1: 0.5987
 epoch: 14, train_loss: 0.7669, test_loss: 0.9110, test_f1: 0.6000
 epoch: 15, train_loss: 0.7724, test_loss: 0.9023, test_f1: 0.5646
 epoch: 16, train_loss: 0.7415, test_loss: 0.9285, test_f1: 0.5996
 epoch: 17, train_loss: 0.7383, test_loss: 0.9224, test_f1: 0.6006
 epoch: 18, train_loss: 0.7282, test_loss: 0.9552, test_f1: 0.5971
 epoch: 19, train_loss: 0.7275, test_loss: 0.9989, test_f1: 0.5602
 epoch: 20, train_loss: 0.7180, test_loss: 0.9792, test_f1: 0.5698
 epoch: 21, train_loss: 0.7183, test_loss: 0.9088, test_f1: 0.5876
 epoch: 22, train_loss: 0.6997, test_loss: 0.8963, test_f1: 0.6142
 epoch: 23, train_loss: 0.6920, test_loss: 0.8058, test_f1: 0.6159
 epoch: 24, train_loss: 0.6787, test_loss: 0.8972, test_f1: 0.5711
 epoch: 25, train_loss: 0.6632, test_loss: 0.8951, test_f1: 0.6554
 epoch: 26, train_loss: 0.6602, test_loss: 0.9623, test_f1: 0.5862
 epoch: 27, train_loss: 0.6630, test_loss: 0.9585, test_f1: 0.6281
 epoch: 28, train_loss: 0.6386, test_loss: 0.9116, test_f1: 0.6520
 epoch: 29, train_loss: 0.6096, test_loss: 0.9443, test_f1: 0.6387
 epoch: 30, train_loss: 0.6291, test_loss: 0.8818, test_f1: 0.6459
 epoch: 31, train_loss: 0.6011, test_loss: 0.9530, test_f1: 0.6604
 epoch: 32, train_loss: 0.6156, test_loss: 0.8899, test_f1: 0.6768
 epoch: 33, train_loss: 0.5971, test_loss: 1.0876, test_f1: 0.6082
 epoch: 34, train_loss: 0.5800, test_loss: 1.0030, test_f1: 0.6571
 epoch: 35, train_loss: 0.5605, test_loss: 0.9416, test_f1: 0.6512
 epoch: 36, train_loss: 0.5709, test_loss: 1.1016, test_f1: 0.6582
 epoch: 37, train_loss: 0.5662, test_loss: 1.0690, test_f1: 0.6629
 epoch: 38, train_loss: 0.5523, test_loss: 0.9538, test_f1: 0.6676
 epoch: 39, train_loss: 0.5282, test_loss: 1.0744, test_f1: 0.6181
 epoch: 40, train_loss: 0.5186, test_loss: 1.0111, test_f1: 0.6509
 epoch: 41, train_loss: 0.5076, test_loss: 1.1190, test_f1: 0.6248
 epoch: 42, train_loss: 0.5279, test_loss: 1.0962, test_f1: 0.6490
 epoch: 43, train_loss: 0.4933, test_loss: 1.0530, test_f1: 0.6567
 epoch: 44, train_loss: 0.4766, test_loss: 1.1227, test_f1: 0.6235
 epoch: 45, train_loss: 0.4898, test_loss: 1.2085, test_f1: 0.6346
 epoch: 46, train_loss: 0.4813, test_loss: 1.0906, test_f1: 0.6445
 epoch: 47, train_loss: 0.4658, test_loss: 1.0836, test_f1: 0.6347
 epoch: 48, train_loss: 0.4367, test_loss: 1.1302, test_f1: 0.6253
 epoch: 49, train_loss: 0.4702, test_loss: 1.1087, test_f1: 0.6405
 epoch: 50, train_loss: 0.4506, test_loss: 1.1547, test_f1: 0.6227
 epoch: 51, train_loss: 0.4095, test_loss: 1.1901, test_f1: 0.6388
 epoch: 52, train_loss: 0.3727, test_loss: 1.2127, test_f1: 0.6810
 epoch: 53, train_loss: 0.3467, test_loss: 1.1817, test_f1: 0.6429
 epoch: 54, train_loss: 0.3706, test_loss: 1.2083, test_f1: 0.6420
 epoch: 55, train_loss: 0.3542, test_loss: 1.2153, test_f1: 0.6280
 epoch: 56, train_loss: 0.3472, test_loss: 1.1940, test_f1: 0.6386
 epoch: 57, train_loss: 0.3242, test_loss: 1.2729, test_f1: 0.6655
 epoch: 58, train_loss: 0.3477, test_loss: 1.2452, test_f1: 0.6703
 epoch: 59, train_loss: 0.3439, test_loss: 1.2791, test_f1: 0.6413
 epoch: 60, train_loss: 0.3145, test_loss: 1.3069, test_f1: 0.6764
 epoch: 61, train_loss: 0.3137, test_loss: 1.2528, test_f1: 0.6756
 epoch: 62, train_loss: 0.3083, test_loss: 1.3732, test_f1: 0.6510
 epoch: 63, train_loss: 0.2933, test_loss: 1.3684, test_f1: 0.6617
 epoch: 64, train_loss: 0.3023, test_loss: 1.3832, test_f1: 0.6483
 epoch: 65, train_loss: 0.3036, test_loss: 1.3733, test_f1: 0.6991
 epoch: 66, train_loss: 0.2899, test_loss: 1.2677, test_f1: 0.6582
 epoch: 67, train_loss: 0.2801, test_loss: 1.3304, test_f1: 0.6361
 epoch: 68, train_loss: 0.3109, test_loss: 1.3694, test_f1: 0.6464
 epoch: 69, train_loss: 0.3073, test_loss: 1.3591, test_f1: 0.6844
 epoch: 70, train_loss: 0.2856, test_loss: 1.4175, test_f1: 0.6564
 epoch: 71, train_loss: 0.2831, test_loss: 1.3619, test_f1: 0.6462
 epoch: 72, train_loss: 0.2805, test_loss: 1.5171, test_f1: 0.6596
 epoch: 73, train_loss: 0.2555, test_loss: 1.5401, test_f1: 0.6593
 epoch: 74, train_loss: 0.2542, test_loss: 1.6930, test_f1: 0.6416
 epoch: 75, train_loss: 0.2538, test_loss: 1.5808, test_f1: 0.6482
 epoch: 76, train_loss: 0.2447, test_loss: 1.6312, test_f1: 0.6475
 epoch: 77, train_loss: 0.2638, test_loss: 1.4710, test_f1: 0.6418
 epoch: 78, train_loss: 0.2528, test_loss: 1.5426, test_f1: 0.6581
 epoch: 79, train_loss: 0.2581, test_loss: 1.4713, test_f1: 0.6262
 epoch: 80, train_loss: 0.2640, test_loss: 1.3742, test_f1: 0.6615
 epoch: 81, train_loss: 0.2316, test_loss: 1.5052, test_f1: 0.6744
 epoch: 82, train_loss: 0.2213, test_loss: 1.5633, test_f1: 0.6518
 epoch: 83, train_loss: 0.2362, test_loss: 1.5183, test_f1: 0.6555
 epoch: 84, train_loss: 0.2393, test_loss: 1.5259, test_f1: 0.6621
 epoch: 85, train_loss: 0.2374, test_loss: 1.5682, test_f1: 0.6552
 epoch: 86, train_loss: 0.2293, test_loss: 1.5879, test_f1: 0.6692
 epoch: 87, train_loss: 0.2249, test_loss: 1.5490, test_f1: 0.6769
 epoch: 88, train_loss: 0.2179, test_loss: 1.6962, test_f1: 0.6455
 epoch: 89, train_loss: 0.2373, test_loss: 1.6219, test_f1: 0.6561
 epoch: 90, train_loss: 0.2370, test_loss: 1.6877, test_f1: 0.6441
 epoch: 91, train_loss: 0.2348, test_loss: 1.7037, test_f1: 0.6548
 epoch: 92, train_loss: 0.2173, test_loss: 1.6758, test_f1: 0.6435
 epoch: 93, train_loss: 0.1992, test_loss: 1.8442, test_f1: 0.6430
 epoch: 94, train_loss: 0.2203, test_loss: 1.7878, test_f1: 0.6453
 epoch: 95, train_loss: 0.2115, test_loss: 1.7895, test_f1: 0.6375
 epoch: 96, train_loss: 0.2130, test_loss: 1.7057, test_f1: 0.6708
 epoch: 97, train_loss: 0.2249, test_loss: 1.6489, test_f1: 0.6512
 epoch: 98, train_loss: 0.2181, test_loss: 1.7314, test_f1: 0.6436
 epoch: 99, train_loss: 0.2016, test_loss: 1.7757, test_f1: 0.6340
##################ITERATION #8 ****************************************
 epoch: 0, train_loss: 1.3301, test_loss: 1.0693, test_f1: 0.4387
 epoch: 1, train_loss: 1.0095, test_loss: 0.9804, test_f1: 0.4986
 epoch: 2, train_loss: 0.9501, test_loss: 0.9320, test_f1: 0.5245
 epoch: 3, train_loss: 0.9099, test_loss: 0.9163, test_f1: 0.5328
 epoch: 4, train_loss: 0.8930, test_loss: 0.9595, test_f1: 0.5227
 epoch: 5, train_loss: 0.8868, test_loss: 0.9119, test_f1: 0.5357
 epoch: 6, train_loss: 0.8728, test_loss: 0.9637, test_f1: 0.5117
 epoch: 7, train_loss: 0.8671, test_loss: 0.9092, test_f1: 0.5514
 epoch: 8, train_loss: 0.8452, test_loss: 0.9508, test_f1: 0.5218
 epoch: 9, train_loss: 0.8452, test_loss: 0.8912, test_f1: 0.5467
 epoch: 10, train_loss: 0.8183, test_loss: 0.9950, test_f1: 0.5277
 epoch: 11, train_loss: 0.8021, test_loss: 0.9397, test_f1: 0.5642
 epoch: 12, train_loss: 0.7943, test_loss: 0.9478, test_f1: 0.5600
 epoch: 13, train_loss: 0.7894, test_loss: 1.0082, test_f1: 0.5856
 epoch: 14, train_loss: 0.7903, test_loss: 1.0159, test_f1: 0.5476
 epoch: 15, train_loss: 0.7773, test_loss: 0.9193, test_f1: 0.5599
 epoch: 16, train_loss: 0.7540, test_loss: 0.9801, test_f1: 0.5505
 epoch: 17, train_loss: 0.7679, test_loss: 1.0457, test_f1: 0.5708
 epoch: 18, train_loss: 0.7349, test_loss: 0.9919, test_f1: 0.5938
 epoch: 19, train_loss: 0.7403, test_loss: 0.9958, test_f1: 0.5981
 epoch: 20, train_loss: 0.7426, test_loss: 0.9892, test_f1: 0.5919
 epoch: 21, train_loss: 0.7186, test_loss: 0.9668, test_f1: 0.5962
 epoch: 22, train_loss: 0.7035, test_loss: 0.9469, test_f1: 0.6102
 epoch: 23, train_loss: 0.7012, test_loss: 1.0312, test_f1: 0.6014
 epoch: 24, train_loss: 0.6842, test_loss: 1.0145, test_f1: 0.6168
 epoch: 25, train_loss: 0.6724, test_loss: 1.0113, test_f1: 0.5997
 epoch: 26, train_loss: 0.6844, test_loss: 1.0071, test_f1: 0.5931
 epoch: 27, train_loss: 0.6714, test_loss: 1.0304, test_f1: 0.6110
 epoch: 28, train_loss: 0.6606, test_loss: 1.0759, test_f1: 0.6105
 epoch: 29, train_loss: 0.6517, test_loss: 1.0695, test_f1: 0.5691
 epoch: 30, train_loss: 0.6436, test_loss: 1.0366, test_f1: 0.6069
 epoch: 31, train_loss: 0.6372, test_loss: 1.0933, test_f1: 0.6061
 epoch: 32, train_loss: 0.6241, test_loss: 1.0266, test_f1: 0.5737
 epoch: 33, train_loss: 0.6111, test_loss: 1.0471, test_f1: 0.6149
 epoch: 34, train_loss: 0.6151, test_loss: 1.1343, test_f1: 0.6228
 epoch: 35, train_loss: 0.6051, test_loss: 1.0970, test_f1: 0.6211
 epoch: 36, train_loss: 0.5920, test_loss: 1.1935, test_f1: 0.6184
 epoch: 37, train_loss: 0.5887, test_loss: 1.0444, test_f1: 0.6091
 epoch: 38, train_loss: 0.5841, test_loss: 1.0956, test_f1: 0.6058
 epoch: 39, train_loss: 0.5912, test_loss: 1.0553, test_f1: 0.6349
 epoch: 40, train_loss: 0.5822, test_loss: 1.0288, test_f1: 0.6269
 epoch: 41, train_loss: 0.5566, test_loss: 1.1294, test_f1: 0.6151
 epoch: 42, train_loss: 0.5536, test_loss: 1.0524, test_f1: 0.6618
 epoch: 43, train_loss: 0.5585, test_loss: 1.0856, test_f1: 0.6026
 epoch: 44, train_loss: 0.5268, test_loss: 1.1587, test_f1: 0.6547
 epoch: 45, train_loss: 0.5079, test_loss: 1.1598, test_f1: 0.6498
 epoch: 46, train_loss: 0.5116, test_loss: 1.1407, test_f1: 0.6678
 epoch: 47, train_loss: 0.5164, test_loss: 1.0986, test_f1: 0.6481
 epoch: 48, train_loss: 0.4895, test_loss: 1.1177, test_f1: 0.6581
 epoch: 49, train_loss: 0.5054, test_loss: 1.0957, test_f1: 0.6694
 epoch: 50, train_loss: 0.4880, test_loss: 1.2697, test_f1: 0.6226
 epoch: 51, train_loss: 0.4351, test_loss: 1.1934, test_f1: 0.6597
 epoch: 52, train_loss: 0.4140, test_loss: 1.2762, test_f1: 0.6518
 epoch: 53, train_loss: 0.3966, test_loss: 1.2638, test_f1: 0.6465
 epoch: 54, train_loss: 0.3909, test_loss: 1.3146, test_f1: 0.6398
 epoch: 55, train_loss: 0.3962, test_loss: 1.2637, test_f1: 0.6438
 epoch: 56, train_loss: 0.3782, test_loss: 1.2175, test_f1: 0.6448
 epoch: 57, train_loss: 0.3713, test_loss: 1.2250, test_f1: 0.6534
 epoch: 58, train_loss: 0.3499, test_loss: 1.3518, test_f1: 0.6527
 epoch: 59, train_loss: 0.3420, test_loss: 1.3768, test_f1: 0.6486
 epoch: 60, train_loss: 0.3424, test_loss: 1.3371, test_f1: 0.6590
 epoch: 61, train_loss: 0.3494, test_loss: 1.4150, test_f1: 0.6344
 epoch: 62, train_loss: 0.3512, test_loss: 1.3015, test_f1: 0.6480
 epoch: 63, train_loss: 0.3539, test_loss: 1.3677, test_f1: 0.6451
 epoch: 64, train_loss: 0.3427, test_loss: 1.3538, test_f1: 0.6699
 epoch: 65, train_loss: 0.3313, test_loss: 1.3928, test_f1: 0.6283
 epoch: 66, train_loss: 0.3211, test_loss: 1.2967, test_f1: 0.6501
 epoch: 67, train_loss: 0.3287, test_loss: 1.4336, test_f1: 0.6220
 epoch: 68, train_loss: 0.3282, test_loss: 1.3900, test_f1: 0.6548
 epoch: 69, train_loss: 0.3169, test_loss: 1.3706, test_f1: 0.6620
 epoch: 70, train_loss: 0.3132, test_loss: 1.4932, test_f1: 0.6482
 epoch: 71, train_loss: 0.2824, test_loss: 1.5460, test_f1: 0.6654
 epoch: 72, train_loss: 0.3115, test_loss: 1.4033, test_f1: 0.6623
 epoch: 73, train_loss: 0.2949, test_loss: 1.4031, test_f1: 0.6745
 epoch: 74, train_loss: 0.2900, test_loss: 1.4358, test_f1: 0.6619
 epoch: 75, train_loss: 0.3121, test_loss: 1.5309, test_f1: 0.6395
 epoch: 76, train_loss: 0.2859, test_loss: 1.4794, test_f1: 0.6785
 epoch: 77, train_loss: 0.2631, test_loss: 1.4468, test_f1: 0.6791
 epoch: 78, train_loss: 0.2870, test_loss: 1.5436, test_f1: 0.6515
 epoch: 79, train_loss: 0.2747, test_loss: 1.5520, test_f1: 0.6509
 epoch: 80, train_loss: 0.2582, test_loss: 1.4445, test_f1: 0.7062
 epoch: 81, train_loss: 0.2605, test_loss: 1.5533, test_f1: 0.6720
 epoch: 82, train_loss: 0.2843, test_loss: 1.7113, test_f1: 0.6401
 epoch: 83, train_loss: 0.2546, test_loss: 1.7107, test_f1: 0.6482
 epoch: 84, train_loss: 0.2575, test_loss: 1.7616, test_f1: 0.6427
 epoch: 85, train_loss: 0.2403, test_loss: 1.6940, test_f1: 0.6506
 epoch: 86, train_loss: 0.2324, test_loss: 1.6116, test_f1: 0.6614
 epoch: 87, train_loss: 0.2254, test_loss: 1.8187, test_f1: 0.6509
 epoch: 88, train_loss: 0.2567, test_loss: 1.8198, test_f1: 0.6372
 epoch: 89, train_loss: 0.2421, test_loss: 1.7174, test_f1: 0.6815
 epoch: 90, train_loss: 0.2518, test_loss: 1.6569, test_f1: 0.6607
 epoch: 91, train_loss: 0.2474, test_loss: 1.6197, test_f1: 0.6675
 epoch: 92, train_loss: 0.2526, test_loss: 1.7493, test_f1: 0.6393
 epoch: 93, train_loss: 0.2325, test_loss: 1.7406, test_f1: 0.6418
 epoch: 94, train_loss: 0.2276, test_loss: 1.7230, test_f1: 0.6417
 epoch: 95, train_loss: 0.2190, test_loss: 1.7632, test_f1: 0.6594
 epoch: 96, train_loss: 0.2139, test_loss: 1.7934, test_f1: 0.6397
 epoch: 97, train_loss: 0.2075, test_loss: 1.8265, test_f1: 0.6376
 epoch: 98, train_loss: 0.2177, test_loss: 1.8246, test_f1: 0.6413
 epoch: 99, train_loss: 0.2194, test_loss: 1.7797, test_f1: 0.6517
##################ITERATION #9 ****************************************
 epoch: 0, train_loss: 1.2792, test_loss: 1.0527, test_f1: 0.4029
 epoch: 1, train_loss: 1.0032, test_loss: 0.9230, test_f1: 0.4776
 epoch: 2, train_loss: 0.9520, test_loss: 0.9565, test_f1: 0.4972
 epoch: 3, train_loss: 0.9357, test_loss: 0.9808, test_f1: 0.5073
 epoch: 4, train_loss: 0.9201, test_loss: 0.9092, test_f1: 0.4962
 epoch: 5, train_loss: 0.9005, test_loss: 0.9341, test_f1: 0.5080
 epoch: 6, train_loss: 0.8731, test_loss: 0.9581, test_f1: 0.5302
 epoch: 7, train_loss: 0.8590, test_loss: 0.9268, test_f1: 0.4931
 epoch: 8, train_loss: 0.8335, test_loss: 0.9755, test_f1: 0.5294
 epoch: 9, train_loss: 0.8318, test_loss: 0.8677, test_f1: 0.5542
 epoch: 10, train_loss: 0.8204, test_loss: 0.9440, test_f1: 0.5317
 epoch: 11, train_loss: 0.8281, test_loss: 0.9085, test_f1: 0.5549
 epoch: 12, train_loss: 0.8248, test_loss: 0.9518, test_f1: 0.5241
 epoch: 13, train_loss: 0.7961, test_loss: 0.9344, test_f1: 0.5577
 epoch: 14, train_loss: 0.7870, test_loss: 0.9247, test_f1: 0.5593
 epoch: 15, train_loss: 0.7616, test_loss: 0.9279, test_f1: 0.5919
 epoch: 16, train_loss: 0.7687, test_loss: 0.9481, test_f1: 0.5764
 epoch: 17, train_loss: 0.7563, test_loss: 0.8995, test_f1: 0.5902
 epoch: 18, train_loss: 0.7578, test_loss: 0.9072, test_f1: 0.5953
 epoch: 19, train_loss: 0.7429, test_loss: 0.9945, test_f1: 0.5529
 epoch: 20, train_loss: 0.7372, test_loss: 1.0282, test_f1: 0.5438
 epoch: 21, train_loss: 0.7232, test_loss: 0.9502, test_f1: 0.5805
 epoch: 22, train_loss: 0.6972, test_loss: 0.9719, test_f1: 0.5867
 epoch: 23, train_loss: 0.6992, test_loss: 1.0341, test_f1: 0.5958
 epoch: 24, train_loss: 0.7051, test_loss: 1.0247, test_f1: 0.6122
 epoch: 25, train_loss: 0.7071, test_loss: 0.9921, test_f1: 0.5675
 epoch: 26, train_loss: 0.6799, test_loss: 0.9879, test_f1: 0.5624
 epoch: 27, train_loss: 0.6771, test_loss: 0.9991, test_f1: 0.6445
 epoch: 28, train_loss: 0.6565, test_loss: 1.0600, test_f1: 0.6047
 epoch: 29, train_loss: 0.6379, test_loss: 1.0153, test_f1: 0.6189
 epoch: 30, train_loss: 0.6462, test_loss: 0.8908, test_f1: 0.6102
 epoch: 31, train_loss: 0.6114, test_loss: 0.8590, test_f1: 0.6203
 epoch: 32, train_loss: 0.6322, test_loss: 0.9966, test_f1: 0.5973
 epoch: 33, train_loss: 0.6207, test_loss: 0.9434, test_f1: 0.6301
 epoch: 34, train_loss: 0.6252, test_loss: 1.0987, test_f1: 0.5750
 epoch: 35, train_loss: 0.6084, test_loss: 1.0466, test_f1: 0.6454
 epoch: 36, train_loss: 0.5735, test_loss: 1.0967, test_f1: 0.5910
 epoch: 37, train_loss: 0.6079, test_loss: 0.9389, test_f1: 0.6417
 epoch: 38, train_loss: 0.5857, test_loss: 0.9297, test_f1: 0.6531
 epoch: 39, train_loss: 0.5787, test_loss: 1.0151, test_f1: 0.6610
 epoch: 40, train_loss: 0.5543, test_loss: 1.1049, test_f1: 0.5741
 epoch: 41, train_loss: 0.5425, test_loss: 1.1929, test_f1: 0.6327
 epoch: 42, train_loss: 0.5529, test_loss: 1.0141, test_f1: 0.6244
 epoch: 43, train_loss: 0.5215, test_loss: 0.9367, test_f1: 0.6776
 epoch: 44, train_loss: 0.5503, test_loss: 1.1539, test_f1: 0.6136
 epoch: 45, train_loss: 0.5089, test_loss: 1.0402, test_f1: 0.6524
 epoch: 46, train_loss: 0.5037, test_loss: 1.0864, test_f1: 0.5943
 epoch: 47, train_loss: 0.4945, test_loss: 0.9953, test_f1: 0.6081
 epoch: 48, train_loss: 0.5203, test_loss: 1.1290, test_f1: 0.6372
 epoch: 49, train_loss: 0.4764, test_loss: 1.1154, test_f1: 0.6305
 epoch: 50, train_loss: 0.4663, test_loss: 1.0450, test_f1: 0.6169
 epoch: 51, train_loss: 0.4263, test_loss: 1.1242, test_f1: 0.6333
 epoch: 52, train_loss: 0.4021, test_loss: 1.1028, test_f1: 0.6604
 epoch: 53, train_loss: 0.3966, test_loss: 1.1780, test_f1: 0.6489
 epoch: 54, train_loss: 0.3892, test_loss: 1.2815, test_f1: 0.6363
 epoch: 55, train_loss: 0.3891, test_loss: 1.1594, test_f1: 0.6701
 epoch: 56, train_loss: 0.4035, test_loss: 1.1435, test_f1: 0.6385
 epoch: 57, train_loss: 0.3739, test_loss: 1.1804, test_f1: 0.6624
 epoch: 58, train_loss: 0.3490, test_loss: 1.2818, test_f1: 0.6803
 epoch: 59, train_loss: 0.3549, test_loss: 1.3017, test_f1: 0.6491
 epoch: 60, train_loss: 0.3496, test_loss: 1.2932, test_f1: 0.6613
 epoch: 61, train_loss: 0.3470, test_loss: 1.3290, test_f1: 0.6381
 epoch: 62, train_loss: 0.3386, test_loss: 1.3525, test_f1: 0.6727
 epoch: 63, train_loss: 0.3184, test_loss: 1.3086, test_f1: 0.6695
 epoch: 64, train_loss: 0.3201, test_loss: 1.2796, test_f1: 0.6542
 epoch: 65, train_loss: 0.3470, test_loss: 1.2836, test_f1: 0.6772
 epoch: 66, train_loss: 0.3321, test_loss: 1.3698, test_f1: 0.6703
 epoch: 67, train_loss: 0.3284, test_loss: 1.2011, test_f1: 0.6531
 epoch: 68, train_loss: 0.3169, test_loss: 1.3070, test_f1: 0.6533
 epoch: 69, train_loss: 0.3228, test_loss: 1.2831, test_f1: 0.6658
 epoch: 70, train_loss: 0.2940, test_loss: 1.4628, test_f1: 0.6568
 epoch: 71, train_loss: 0.3187, test_loss: 1.3788, test_f1: 0.6494
 epoch: 72, train_loss: 0.2899, test_loss: 1.3469, test_f1: 0.6729
 epoch: 73, train_loss: 0.2999, test_loss: 1.3743, test_f1: 0.6566
 epoch: 74, train_loss: 0.2794, test_loss: 1.3621, test_f1: 0.6675
 epoch: 75, train_loss: 0.2865, test_loss: 1.3768, test_f1: 0.6478
 epoch: 76, train_loss: 0.2995, test_loss: 1.2360, test_f1: 0.6727
 epoch: 77, train_loss: 0.2742, test_loss: 1.3436, test_f1: 0.6514
 epoch: 78, train_loss: 0.2907, test_loss: 1.3678, test_f1: 0.6788
 epoch: 79, train_loss: 0.2683, test_loss: 1.4465, test_f1: 0.6595
 epoch: 80, train_loss: 0.2674, test_loss: 1.3722, test_f1: 0.6704
 epoch: 81, train_loss: 0.2557, test_loss: 1.4158, test_f1: 0.6543
 epoch: 82, train_loss: 0.2549, test_loss: 1.4939, test_f1: 0.6485
 epoch: 83, train_loss: 0.2586, test_loss: 1.3166, test_f1: 0.6531
 epoch: 84, train_loss: 0.2499, test_loss: 1.4619, test_f1: 0.6396
 epoch: 85, train_loss: 0.2550, test_loss: 1.4660, test_f1: 0.6657
 epoch: 86, train_loss: 0.2595, test_loss: 1.4964, test_f1: 0.6552
 epoch: 87, train_loss: 0.2542, test_loss: 1.5707, test_f1: 0.6508
 epoch: 88, train_loss: 0.2498, test_loss: 1.5180, test_f1: 0.6374
 epoch: 89, train_loss: 0.2457, test_loss: 1.4605, test_f1: 0.6562
 epoch: 90, train_loss: 0.2352, test_loss: 1.5639, test_f1: 0.6606
 epoch: 91, train_loss: 0.2670, test_loss: 1.5919, test_f1: 0.6678
 epoch: 92, train_loss: 0.2372, test_loss: 1.5314, test_f1: 0.6516
 epoch: 93, train_loss: 0.2451, test_loss: 1.4155, test_f1: 0.6669
 epoch: 94, train_loss: 0.2384, test_loss: 1.4984, test_f1: 0.6581
 epoch: 95, train_loss: 0.2346, test_loss: 1.5045, test_f1: 0.6381
 epoch: 96, train_loss: 0.2563, test_loss: 1.4261, test_f1: 0.6675
 epoch: 97, train_loss: 0.2186, test_loss: 1.5937, test_f1: 0.6382
 epoch: 98, train_loss: 0.2226, test_loss: 1.5972, test_f1: 0.6542
 epoch: 99, train_loss: 0.2145, test_loss: 1.5549, test_f1: 0.6470

Training completed in 691.70 seconds
Best F1: 0.7062 at epoch 80
Mean F1 across iterations: 0.6870  0.0120
========================FINAL RESULTS================================
FEGIN weighted F1: 0.7062  0.0120
python main.py --data ltspice_examples --representation component_net --model FEGIN --layers 4 --hiddens 128 --batch_size 64 --lr 0.001 --emb_size 128 --epochs 100 --save_appendix component_net_L4_H128_BS64_LR0.001_E128 --no_val
-----



STDERR:
Processing...
Done!
  File "main.py", line 370, in <module>
    main()
  File "main.py", line 254, in main
    dataset = dataset_class(
  File "/home/philip/projects/ltspice_examples_code_repo/Circuit-Completion-Using-GNNs/component_classification_with_link_prediction_head/evaluation/FEGIN/kernel/circuit_datasets.py", line 15, in __init__
    self.data, self.slices = torch.load(self.processed_paths[0])
  File "/home/philip/.local/lib/python3.8/site-packages/torch/serialization.py", line 1040, in load
    warnings.warn(
  File "/usr/lib/python3.8/warnings.py", line 109, in _showwarnmsg
    sw(msg.message, msg.category, msg.filename, msg.lineno,
  File "main.py", line 47, in warn_with_traceback
    traceback.print_stack(file=log)
/home/philip/projects/ltspice_examples_code_repo/Circuit-Completion-Using-GNNs/component_classification_with_link_prediction_head/evaluation/FEGIN/kernel/circuit_datasets.py:15: FutureWarning: You are using `torch.load` with `weights_only=False` (the current default value), which uses the default pickle module implicitly. It is possible to construct malicious pickle data which will execute arbitrary code during unpickling (See https://github.com/pytorch/pytorch/blob/main/SECURITY.md#untrusted-models for more details). In a future release, the default value for `weights_only` will be flipped to `True`. This limits the functions that could be executed during unpickling. Arbitrary objects will no longer be allowed to be loaded via this mode unless they are explicitly allowlisted by the user via `torch.serialization.add_safe_globals`. We recommend you start setting `weights_only=True` for any use case where you don't have full control of the loaded file. Please open an issue on GitHub for any issues related to this experimental feature.
  self.data, self.slices = torch.load(self.processed_paths[0])
