STDOUT:
Results will be saved in /home/philip/projects/ltspice_examples_code_repo/Circuit-Completion-Using-GNNs/component_classification_with_link_prediction_head/evaluation/FEGIN/results/model_FEGIN_dataset_ltspice_demos
Command line input: python main.py --data ltspice_demos --representation component_component --model FEGIN --layers 4 --hiddens 16 --batch_size 128 --lr 0.001 --emb_size 250 --epochs 100 --save_appendix component_component_L4_H16_BS128_LR0.001_E250 --no_val
 is saved.
-----
ltspice_demos - FEGIN
Using 4 layers, 16 hidden units, h = 2
Loading component_component representation dataset
ENTERED
Training FEGIN on component_component representation
Train: 1565, Test: 383
##################ITERATION #0 ****************************************
 epoch: 0, train_loss: 1.3654, test_loss: 1.3583, test_f1: 0.2281
 epoch: 1, train_loss: 1.3497, test_loss: 1.3519, test_f1: 0.2281
 epoch: 2, train_loss: 1.3403, test_loss: 1.3455, test_f1: 0.2281
 epoch: 3, train_loss: 1.3303, test_loss: 1.3367, test_f1: 0.2281
 epoch: 4, train_loss: 1.3160, test_loss: 1.3265, test_f1: 0.2281
 epoch: 5, train_loss: 1.2971, test_loss: 1.3136, test_f1: 0.2281
 epoch: 6, train_loss: 1.2790, test_loss: 1.2983, test_f1: 0.2281
 epoch: 7, train_loss: 1.2560, test_loss: 1.2806, test_f1: 0.2281
 epoch: 8, train_loss: 1.2279, test_loss: 1.2668, test_f1: 0.2281
 epoch: 9, train_loss: 1.2137, test_loss: 1.2556, test_f1: 0.2281
 epoch: 10, train_loss: 1.2030, test_loss: 1.2483, test_f1: 0.2636
 epoch: 11, train_loss: 1.1877, test_loss: 1.2406, test_f1: 0.3159
 epoch: 12, train_loss: 1.1803, test_loss: 1.2399, test_f1: 0.3127
 epoch: 13, train_loss: 1.1673, test_loss: 1.2387, test_f1: 0.3506
 epoch: 14, train_loss: 1.1530, test_loss: 1.2439, test_f1: 0.3895
 epoch: 15, train_loss: 1.1525, test_loss: 1.2480, test_f1: 0.3426
 epoch: 16, train_loss: 1.1333, test_loss: 1.2736, test_f1: 0.3264
 epoch: 17, train_loss: 1.1352, test_loss: 1.3178, test_f1: 0.3285
 epoch: 18, train_loss: 1.1323, test_loss: 1.2866, test_f1: 0.3356
 epoch: 19, train_loss: 1.1115, test_loss: 1.2829, test_f1: 0.3361
 epoch: 20, train_loss: 1.1151, test_loss: 1.3264, test_f1: 0.3424
 epoch: 21, train_loss: 1.0975, test_loss: 1.3246, test_f1: 0.3158
 epoch: 22, train_loss: 1.0935, test_loss: 1.2754, test_f1: 0.3259
 epoch: 23, train_loss: 1.0925, test_loss: 1.2608, test_f1: 0.3325
 epoch: 24, train_loss: 1.0706, test_loss: 1.2736, test_f1: 0.3401
 epoch: 25, train_loss: 1.0712, test_loss: 1.2638, test_f1: 0.3844
 epoch: 26, train_loss: 1.0667, test_loss: 1.2591, test_f1: 0.3862
 epoch: 27, train_loss: 1.0651, test_loss: 1.2683, test_f1: 0.3665
 epoch: 28, train_loss: 1.0541, test_loss: 1.3205, test_f1: 0.3719
 epoch: 29, train_loss: 1.0679, test_loss: 1.2783, test_f1: 0.3733
 epoch: 30, train_loss: 1.0443, test_loss: 1.2776, test_f1: 0.3864
 epoch: 31, train_loss: 1.0416, test_loss: 1.3054, test_f1: 0.3932
 epoch: 32, train_loss: 1.0398, test_loss: 1.3071, test_f1: 0.4037
 epoch: 33, train_loss: 1.0231, test_loss: 1.2584, test_f1: 0.4046
 epoch: 34, train_loss: 1.0223, test_loss: 1.3020, test_f1: 0.3931
 epoch: 35, train_loss: 1.0245, test_loss: 1.3063, test_f1: 0.4145
 epoch: 36, train_loss: 1.0068, test_loss: 1.3064, test_f1: 0.4183
 epoch: 37, train_loss: 1.0065, test_loss: 1.3504, test_f1: 0.4321
 epoch: 38, train_loss: 1.0001, test_loss: 1.3236, test_f1: 0.4329
 epoch: 39, train_loss: 1.0049, test_loss: 1.3244, test_f1: 0.4206
 epoch: 40, train_loss: 0.9856, test_loss: 1.3313, test_f1: 0.4129
 epoch: 41, train_loss: 0.9916, test_loss: 1.2838, test_f1: 0.4231
 epoch: 42, train_loss: 0.9821, test_loss: 1.3154, test_f1: 0.4387
 epoch: 43, train_loss: 0.9831, test_loss: 1.3005, test_f1: 0.4662
 epoch: 44, train_loss: 0.9863, test_loss: 1.2980, test_f1: 0.4614
 epoch: 45, train_loss: 0.9672, test_loss: 1.2651, test_f1: 0.4525
 epoch: 46, train_loss: 0.9649, test_loss: 1.3442, test_f1: 0.4581
 epoch: 47, train_loss: 0.9587, test_loss: 1.3026, test_f1: 0.4851
 epoch: 48, train_loss: 0.9486, test_loss: 1.2445, test_f1: 0.4865
 epoch: 49, train_loss: 0.9499, test_loss: 1.2780, test_f1: 0.4705
 epoch: 50, train_loss: 0.9581, test_loss: 1.2388, test_f1: 0.4699
 epoch: 51, train_loss: 0.9448, test_loss: 1.2770, test_f1: 0.4631
 epoch: 52, train_loss: 0.9218, test_loss: 1.2436, test_f1: 0.4750
 epoch: 53, train_loss: 0.9284, test_loss: 1.2534, test_f1: 0.4758
 epoch: 54, train_loss: 0.9268, test_loss: 1.2866, test_f1: 0.4839
 epoch: 55, train_loss: 0.9239, test_loss: 1.2770, test_f1: 0.4850
 epoch: 56, train_loss: 0.9187, test_loss: 1.2696, test_f1: 0.4726
 epoch: 57, train_loss: 0.9004, test_loss: 1.2743, test_f1: 0.4913
 epoch: 58, train_loss: 0.8998, test_loss: 1.2718, test_f1: 0.4857
 epoch: 59, train_loss: 0.9075, test_loss: 1.2907, test_f1: 0.4842
 epoch: 60, train_loss: 0.9049, test_loss: 1.2968, test_f1: 0.4713
 epoch: 61, train_loss: 0.9137, test_loss: 1.2620, test_f1: 0.4885
 epoch: 62, train_loss: 0.8972, test_loss: 1.2448, test_f1: 0.4627
 epoch: 63, train_loss: 0.9222, test_loss: 1.2812, test_f1: 0.4321
 epoch: 64, train_loss: 0.9024, test_loss: 1.2829, test_f1: 0.4808
 epoch: 65, train_loss: 0.8823, test_loss: 1.2796, test_f1: 0.4860
 epoch: 66, train_loss: 0.8965, test_loss: 1.2612, test_f1: 0.4741
 epoch: 67, train_loss: 0.8898, test_loss: 1.2780, test_f1: 0.4471
 epoch: 68, train_loss: 0.8775, test_loss: 1.2865, test_f1: 0.4617
 epoch: 69, train_loss: 0.8764, test_loss: 1.2606, test_f1: 0.4889
 epoch: 70, train_loss: 0.8757, test_loss: 1.2682, test_f1: 0.4706
 epoch: 71, train_loss: 0.8680, test_loss: 1.3121, test_f1: 0.4390
 epoch: 72, train_loss: 0.8729, test_loss: 1.2861, test_f1: 0.4495
 epoch: 73, train_loss: 0.8806, test_loss: 1.3188, test_f1: 0.4839
 epoch: 74, train_loss: 0.8789, test_loss: 1.2842, test_f1: 0.4858
 epoch: 75, train_loss: 0.8528, test_loss: 1.3158, test_f1: 0.4856
 epoch: 76, train_loss: 0.8779, test_loss: 1.3372, test_f1: 0.4812
 epoch: 77, train_loss: 0.8652, test_loss: 1.3687, test_f1: 0.4738
 epoch: 78, train_loss: 0.8561, test_loss: 1.4200, test_f1: 0.4891
 epoch: 79, train_loss: 0.8595, test_loss: 1.3826, test_f1: 0.4400
 epoch: 80, train_loss: 0.8543, test_loss: 1.3318, test_f1: 0.4652
 epoch: 81, train_loss: 0.8587, test_loss: 1.3762, test_f1: 0.4405
 epoch: 82, train_loss: 0.8507, test_loss: 1.3589, test_f1: 0.4712
 epoch: 83, train_loss: 0.8581, test_loss: 1.3387, test_f1: 0.4676
 epoch: 84, train_loss: 0.8571, test_loss: 1.3894, test_f1: 0.4576
 epoch: 85, train_loss: 0.8473, test_loss: 1.3622, test_f1: 0.5034
 epoch: 86, train_loss: 0.8493, test_loss: 1.3729, test_f1: 0.4968
 epoch: 87, train_loss: 0.8507, test_loss: 1.3582, test_f1: 0.4637
 epoch: 88, train_loss: 0.8465, test_loss: 1.4049, test_f1: 0.4446
 epoch: 89, train_loss: 0.8388, test_loss: 1.4007, test_f1: 0.4605
 epoch: 90, train_loss: 0.8475, test_loss: 1.3935, test_f1: 0.4560
 epoch: 91, train_loss: 0.8281, test_loss: 1.3896, test_f1: 0.4542
 epoch: 92, train_loss: 0.8531, test_loss: 1.3338, test_f1: 0.5004
 epoch: 93, train_loss: 0.8286, test_loss: 1.3817, test_f1: 0.4791
 epoch: 94, train_loss: 0.8324, test_loss: 1.3585, test_f1: 0.4433
 epoch: 95, train_loss: 0.8364, test_loss: 1.3881, test_f1: 0.4666
 epoch: 96, train_loss: 0.8150, test_loss: 1.3919, test_f1: 0.4652
 epoch: 97, train_loss: 0.8165, test_loss: 1.3623, test_f1: 0.4815
 epoch: 98, train_loss: 0.8290, test_loss: 1.3342, test_f1: 0.4940
 epoch: 99, train_loss: 0.8204, test_loss: 1.3576, test_f1: 0.4980
##################ITERATION #1 ****************************************
 epoch: 0, train_loss: 1.3211, test_loss: 1.3232, test_f1: 0.2281
 epoch: 1, train_loss: 1.2717, test_loss: 1.3123, test_f1: 0.2281
 epoch: 2, train_loss: 1.2529, test_loss: 1.3079, test_f1: 0.2281
 epoch: 3, train_loss: 1.2314, test_loss: 1.2973, test_f1: 0.2281
 epoch: 4, train_loss: 1.2185, test_loss: 1.2865, test_f1: 0.2685
 epoch: 5, train_loss: 1.2168, test_loss: 1.2766, test_f1: 0.3336
 epoch: 6, train_loss: 1.2055, test_loss: 1.2714, test_f1: 0.3261
 epoch: 7, train_loss: 1.1956, test_loss: 1.2675, test_f1: 0.3220
 epoch: 8, train_loss: 1.1915, test_loss: 1.2616, test_f1: 0.3334
 epoch: 9, train_loss: 1.1817, test_loss: 1.2568, test_f1: 0.3211
 epoch: 10, train_loss: 1.1776, test_loss: 1.2511, test_f1: 0.3364
 epoch: 11, train_loss: 1.1668, test_loss: 1.2457, test_f1: 0.3431
 epoch: 12, train_loss: 1.1582, test_loss: 1.2386, test_f1: 0.3580
 epoch: 13, train_loss: 1.1548, test_loss: 1.2469, test_f1: 0.3501
 epoch: 14, train_loss: 1.1407, test_loss: 1.2305, test_f1: 0.3744
 epoch: 15, train_loss: 1.1286, test_loss: 1.2255, test_f1: 0.4157
 epoch: 16, train_loss: 1.1196, test_loss: 1.2151, test_f1: 0.4284
 epoch: 17, train_loss: 1.1052, test_loss: 1.2152, test_f1: 0.4289
 epoch: 18, train_loss: 1.1017, test_loss: 1.2216, test_f1: 0.4193
 epoch: 19, train_loss: 1.0838, test_loss: 1.2197, test_f1: 0.4347
 epoch: 20, train_loss: 1.0788, test_loss: 1.2111, test_f1: 0.4372
 epoch: 21, train_loss: 1.0673, test_loss: 1.2300, test_f1: 0.4289
 epoch: 22, train_loss: 1.0686, test_loss: 1.2161, test_f1: 0.4541
 epoch: 23, train_loss: 1.0544, test_loss: 1.1989, test_f1: 0.4455
 epoch: 24, train_loss: 1.0484, test_loss: 1.1882, test_f1: 0.4640
 epoch: 25, train_loss: 1.0374, test_loss: 1.1984, test_f1: 0.4521
 epoch: 26, train_loss: 1.0352, test_loss: 1.2227, test_f1: 0.4245
 epoch: 27, train_loss: 1.0235, test_loss: 1.2083, test_f1: 0.4356
 epoch: 28, train_loss: 1.0198, test_loss: 1.2285, test_f1: 0.4464
 epoch: 29, train_loss: 1.0002, test_loss: 1.2296, test_f1: 0.4533
 epoch: 30, train_loss: 1.0052, test_loss: 1.2127, test_f1: 0.4719
 epoch: 31, train_loss: 0.9909, test_loss: 1.2132, test_f1: 0.4734
 epoch: 32, train_loss: 0.9960, test_loss: 1.2587, test_f1: 0.5016
 epoch: 33, train_loss: 0.9744, test_loss: 1.2097, test_f1: 0.4976
 epoch: 34, train_loss: 0.9695, test_loss: 1.2054, test_f1: 0.4952
 epoch: 35, train_loss: 0.9679, test_loss: 1.1988, test_f1: 0.4820
 epoch: 36, train_loss: 0.9723, test_loss: 1.2444, test_f1: 0.5059
 epoch: 37, train_loss: 0.9703, test_loss: 1.2448, test_f1: 0.5063
 epoch: 38, train_loss: 0.9651, test_loss: 1.2951, test_f1: 0.5034
 epoch: 39, train_loss: 0.9652, test_loss: 1.2308, test_f1: 0.4884
 epoch: 40, train_loss: 0.9608, test_loss: 1.1834, test_f1: 0.5334
 epoch: 41, train_loss: 0.9586, test_loss: 1.2408, test_f1: 0.5184
 epoch: 42, train_loss: 0.9476, test_loss: 1.3477, test_f1: 0.5147
 epoch: 43, train_loss: 0.9482, test_loss: 1.3184, test_f1: 0.5272
 epoch: 44, train_loss: 0.9246, test_loss: 1.2716, test_f1: 0.5138
 epoch: 45, train_loss: 0.9266, test_loss: 1.2684, test_f1: 0.5143
 epoch: 46, train_loss: 0.9280, test_loss: 1.2513, test_f1: 0.5331
 epoch: 47, train_loss: 0.9133, test_loss: 1.3055, test_f1: 0.5223
 epoch: 48, train_loss: 0.9297, test_loss: 1.3158, test_f1: 0.5144
 epoch: 49, train_loss: 0.9212, test_loss: 1.2548, test_f1: 0.5156
 epoch: 50, train_loss: 0.9100, test_loss: 1.1924, test_f1: 0.5380
 epoch: 51, train_loss: 0.8939, test_loss: 1.1902, test_f1: 0.5217
 epoch: 52, train_loss: 0.8945, test_loss: 1.2279, test_f1: 0.5462
 epoch: 53, train_loss: 0.8927, test_loss: 1.2265, test_f1: 0.5357
 epoch: 54, train_loss: 0.8756, test_loss: 1.2212, test_f1: 0.5449
 epoch: 55, train_loss: 0.9013, test_loss: 1.2547, test_f1: 0.5534
 epoch: 56, train_loss: 0.8839, test_loss: 1.2387, test_f1: 0.5547
 epoch: 57, train_loss: 0.8880, test_loss: 1.2373, test_f1: 0.5348
 epoch: 58, train_loss: 0.8925, test_loss: 1.2338, test_f1: 0.5267
 epoch: 59, train_loss: 0.8709, test_loss: 1.2058, test_f1: 0.5383
 epoch: 60, train_loss: 0.8911, test_loss: 1.2159, test_f1: 0.5471
 epoch: 61, train_loss: 0.8771, test_loss: 1.2537, test_f1: 0.5315
 epoch: 62, train_loss: 0.8811, test_loss: 1.2633, test_f1: 0.5225
 epoch: 63, train_loss: 0.8627, test_loss: 1.2482, test_f1: 0.5081
 epoch: 64, train_loss: 0.8816, test_loss: 1.2654, test_f1: 0.5084
 epoch: 65, train_loss: 0.8721, test_loss: 1.2754, test_f1: 0.5163
 epoch: 66, train_loss: 0.8757, test_loss: 1.2405, test_f1: 0.5098
 epoch: 67, train_loss: 0.8918, test_loss: 1.2794, test_f1: 0.5005
 epoch: 68, train_loss: 0.8765, test_loss: 1.2924, test_f1: 0.5196
 epoch: 69, train_loss: 0.8681, test_loss: 1.2795, test_f1: 0.5076
 epoch: 70, train_loss: 0.8710, test_loss: 1.2638, test_f1: 0.5161
 epoch: 71, train_loss: 0.8679, test_loss: 1.2211, test_f1: 0.5087
 epoch: 72, train_loss: 0.8656, test_loss: 1.2656, test_f1: 0.5019
 epoch: 73, train_loss: 0.8654, test_loss: 1.2890, test_f1: 0.5134
 epoch: 74, train_loss: 0.8636, test_loss: 1.2620, test_f1: 0.5303
 epoch: 75, train_loss: 0.8696, test_loss: 1.3052, test_f1: 0.5271
 epoch: 76, train_loss: 0.8690, test_loss: 1.3218, test_f1: 0.4966
 epoch: 77, train_loss: 0.8574, test_loss: 1.3179, test_f1: 0.5062
 epoch: 78, train_loss: 0.8659, test_loss: 1.3047, test_f1: 0.5151
 epoch: 79, train_loss: 0.8515, test_loss: 1.2928, test_f1: 0.5093
 epoch: 80, train_loss: 0.8455, test_loss: 1.2555, test_f1: 0.4995
 epoch: 81, train_loss: 0.8597, test_loss: 1.3393, test_f1: 0.5017
 epoch: 82, train_loss: 0.8389, test_loss: 1.2846, test_f1: 0.4806
 epoch: 83, train_loss: 0.8591, test_loss: 1.3294, test_f1: 0.5081
 epoch: 84, train_loss: 0.8427, test_loss: 1.2763, test_f1: 0.5149
 epoch: 85, train_loss: 0.8317, test_loss: 1.3153, test_f1: 0.5111
 epoch: 86, train_loss: 0.8408, test_loss: 1.3335, test_f1: 0.4901
 epoch: 87, train_loss: 0.8424, test_loss: 1.2924, test_f1: 0.5042
 epoch: 88, train_loss: 0.8388, test_loss: 1.3546, test_f1: 0.4987
 epoch: 89, train_loss: 0.8382, test_loss: 1.3000, test_f1: 0.5231
 epoch: 90, train_loss: 0.8402, test_loss: 1.4140, test_f1: 0.4984
 epoch: 91, train_loss: 0.8356, test_loss: 1.3948, test_f1: 0.4990
 epoch: 92, train_loss: 0.8381, test_loss: 1.3605, test_f1: 0.4804
 epoch: 93, train_loss: 0.8345, test_loss: 1.3611, test_f1: 0.5024
 epoch: 94, train_loss: 0.8314, test_loss: 1.3760, test_f1: 0.5133
 epoch: 95, train_loss: 0.8298, test_loss: 1.3916, test_f1: 0.4988
 epoch: 96, train_loss: 0.8518, test_loss: 1.3018, test_f1: 0.5011
 epoch: 97, train_loss: 0.8396, test_loss: 1.2856, test_f1: 0.5167
 epoch: 98, train_loss: 0.8289, test_loss: 1.3965, test_f1: 0.5045
 epoch: 99, train_loss: 0.8408, test_loss: 1.3379, test_f1: 0.4909
##################ITERATION #2 ****************************************
 epoch: 0, train_loss: 1.3816, test_loss: 1.3712, test_f1: 0.2281
 epoch: 1, train_loss: 1.2845, test_loss: 1.3257, test_f1: 0.2281
 epoch: 2, train_loss: 1.2621, test_loss: 1.3016, test_f1: 0.2281
 epoch: 3, train_loss: 1.2422, test_loss: 1.2893, test_f1: 0.2281
 epoch: 4, train_loss: 1.2285, test_loss: 1.2816, test_f1: 0.2281
 epoch: 5, train_loss: 1.2193, test_loss: 1.2724, test_f1: 0.2259
 epoch: 6, train_loss: 1.2133, test_loss: 1.2642, test_f1: 0.2362
 epoch: 7, train_loss: 1.2028, test_loss: 1.2563, test_f1: 0.2327
 epoch: 8, train_loss: 1.1903, test_loss: 1.2484, test_f1: 0.2340
 epoch: 9, train_loss: 1.1896, test_loss: 1.2440, test_f1: 0.2427
 epoch: 10, train_loss: 1.1789, test_loss: 1.2318, test_f1: 0.2432
 epoch: 11, train_loss: 1.1674, test_loss: 1.2174, test_f1: 0.2585
 epoch: 12, train_loss: 1.1551, test_loss: 1.2122, test_f1: 0.2874
 epoch: 13, train_loss: 1.1470, test_loss: 1.2053, test_f1: 0.2789
 epoch: 14, train_loss: 1.1304, test_loss: 1.2057, test_f1: 0.3072
 epoch: 15, train_loss: 1.1324, test_loss: 1.2067, test_f1: 0.3535
 epoch: 16, train_loss: 1.1276, test_loss: 1.2055, test_f1: 0.3240
 epoch: 17, train_loss: 1.1188, test_loss: 1.1921, test_f1: 0.3229
 epoch: 18, train_loss: 1.1095, test_loss: 1.1882, test_f1: 0.3237
 epoch: 19, train_loss: 1.1059, test_loss: 1.1780, test_f1: 0.3373
 epoch: 20, train_loss: 1.0954, test_loss: 1.1818, test_f1: 0.3246
 epoch: 21, train_loss: 1.0887, test_loss: 1.1880, test_f1: 0.3671
 epoch: 22, train_loss: 1.0970, test_loss: 1.1811, test_f1: 0.3313
 epoch: 23, train_loss: 1.0774, test_loss: 1.1724, test_f1: 0.3789
 epoch: 24, train_loss: 1.0683, test_loss: 1.1778, test_f1: 0.3953
 epoch: 25, train_loss: 1.0645, test_loss: 1.1679, test_f1: 0.4089
 epoch: 26, train_loss: 1.0449, test_loss: 1.1749, test_f1: 0.4211
 epoch: 27, train_loss: 1.0529, test_loss: 1.1877, test_f1: 0.4597
 epoch: 28, train_loss: 1.0397, test_loss: 1.1644, test_f1: 0.4136
 epoch: 29, train_loss: 1.0280, test_loss: 1.1511, test_f1: 0.4406
 epoch: 30, train_loss: 1.0192, test_loss: 1.1519, test_f1: 0.4161
 epoch: 31, train_loss: 1.0131, test_loss: 1.1565, test_f1: 0.4373
 epoch: 32, train_loss: 0.9902, test_loss: 1.1561, test_f1: 0.4411
 epoch: 33, train_loss: 0.9923, test_loss: 1.1624, test_f1: 0.4657
 epoch: 34, train_loss: 0.9875, test_loss: 1.1630, test_f1: 0.4584
 epoch: 35, train_loss: 0.9887, test_loss: 1.1656, test_f1: 0.4478
 epoch: 36, train_loss: 0.9820, test_loss: 1.1839, test_f1: 0.4753
 epoch: 37, train_loss: 0.9709, test_loss: 1.1903, test_f1: 0.4532
 epoch: 38, train_loss: 0.9645, test_loss: 1.1976, test_f1: 0.4223
 epoch: 39, train_loss: 0.9636, test_loss: 1.1811, test_f1: 0.4319
 epoch: 40, train_loss: 0.9622, test_loss: 1.2050, test_f1: 0.4187
 epoch: 41, train_loss: 0.9520, test_loss: 1.2040, test_f1: 0.4325
 epoch: 42, train_loss: 0.9540, test_loss: 1.2302, test_f1: 0.4287
 epoch: 43, train_loss: 0.9618, test_loss: 1.2143, test_f1: 0.4579
 epoch: 44, train_loss: 0.9417, test_loss: 1.3096, test_f1: 0.4508
 epoch: 45, train_loss: 0.9449, test_loss: 1.2939, test_f1: 0.4613
 epoch: 46, train_loss: 0.9251, test_loss: 1.2844, test_f1: 0.4599
 epoch: 47, train_loss: 0.9223, test_loss: 1.2532, test_f1: 0.4795
 epoch: 48, train_loss: 0.9255, test_loss: 1.3695, test_f1: 0.4618
 epoch: 49, train_loss: 0.9237, test_loss: 1.2614, test_f1: 0.4626
 epoch: 50, train_loss: 0.9105, test_loss: 1.4349, test_f1: 0.4250
 epoch: 51, train_loss: 0.9240, test_loss: 1.3358, test_f1: 0.4515
 epoch: 52, train_loss: 0.9154, test_loss: 1.3085, test_f1: 0.4663
 epoch: 53, train_loss: 0.8889, test_loss: 1.3350, test_f1: 0.4552
 epoch: 54, train_loss: 0.9016, test_loss: 1.3613, test_f1: 0.4487
 epoch: 55, train_loss: 0.8974, test_loss: 1.3635, test_f1: 0.4527
 epoch: 56, train_loss: 0.8979, test_loss: 1.3458, test_f1: 0.4463
 epoch: 57, train_loss: 0.8963, test_loss: 1.3251, test_f1: 0.4599
 epoch: 58, train_loss: 0.9004, test_loss: 1.4204, test_f1: 0.4522
 epoch: 59, train_loss: 0.8939, test_loss: 1.3582, test_f1: 0.4609
 epoch: 60, train_loss: 0.9000, test_loss: 1.3372, test_f1: 0.4414
 epoch: 61, train_loss: 0.8826, test_loss: 1.3437, test_f1: 0.4404
 epoch: 62, train_loss: 0.8843, test_loss: 1.3693, test_f1: 0.4479
 epoch: 63, train_loss: 0.8691, test_loss: 1.3358, test_f1: 0.4584
 epoch: 64, train_loss: 0.8855, test_loss: 1.4098, test_f1: 0.4372
 epoch: 65, train_loss: 0.8832, test_loss: 1.3559, test_f1: 0.4404
 epoch: 66, train_loss: 0.8747, test_loss: 1.3152, test_f1: 0.4371
 epoch: 67, train_loss: 0.8832, test_loss: 1.3858, test_f1: 0.4362
 epoch: 68, train_loss: 0.8711, test_loss: 1.3922, test_f1: 0.4232
 epoch: 69, train_loss: 0.8673, test_loss: 1.4217, test_f1: 0.4417
 epoch: 70, train_loss: 0.8697, test_loss: 1.4099, test_f1: 0.4405
 epoch: 71, train_loss: 0.8536, test_loss: 1.4475, test_f1: 0.4502
 epoch: 72, train_loss: 0.8717, test_loss: 1.3947, test_f1: 0.4449
 epoch: 73, train_loss: 0.8627, test_loss: 1.3349, test_f1: 0.4507
 epoch: 74, train_loss: 0.8616, test_loss: 1.3566, test_f1: 0.4511
 epoch: 75, train_loss: 0.8422, test_loss: 1.3451, test_f1: 0.4603
 epoch: 76, train_loss: 0.8621, test_loss: 1.3708, test_f1: 0.4565
 epoch: 77, train_loss: 0.8455, test_loss: 1.4334, test_f1: 0.4544
 epoch: 78, train_loss: 0.8526, test_loss: 1.4010, test_f1: 0.4334
 epoch: 79, train_loss: 0.8460, test_loss: 1.4052, test_f1: 0.4446
 epoch: 80, train_loss: 0.8523, test_loss: 1.4498, test_f1: 0.4529
 epoch: 81, train_loss: 0.8542, test_loss: 1.4954, test_f1: 0.4523
 epoch: 82, train_loss: 0.8440, test_loss: 1.4489, test_f1: 0.4533
 epoch: 83, train_loss: 0.8366, test_loss: 1.4422, test_f1: 0.4529
 epoch: 84, train_loss: 0.8351, test_loss: 1.4430, test_f1: 0.4493
 epoch: 85, train_loss: 0.8499, test_loss: 1.4496, test_f1: 0.4385
 epoch: 86, train_loss: 0.8391, test_loss: 1.4774, test_f1: 0.4386
 epoch: 87, train_loss: 0.8599, test_loss: 1.4231, test_f1: 0.4373
 epoch: 88, train_loss: 0.8463, test_loss: 1.4309, test_f1: 0.4928
 epoch: 89, train_loss: 0.8265, test_loss: 1.4964, test_f1: 0.4570
 epoch: 90, train_loss: 0.8262, test_loss: 1.4589, test_f1: 0.4657
 epoch: 91, train_loss: 0.8344, test_loss: 1.4878, test_f1: 0.4436
 epoch: 92, train_loss: 0.8609, test_loss: 1.6070, test_f1: 0.4552
 epoch: 93, train_loss: 0.8430, test_loss: 1.5285, test_f1: 0.4821
 epoch: 94, train_loss: 0.8433, test_loss: 1.4377, test_f1: 0.4763
 epoch: 95, train_loss: 0.8423, test_loss: 1.4427, test_f1: 0.4535
 epoch: 96, train_loss: 0.8385, test_loss: 1.4687, test_f1: 0.4327
 epoch: 97, train_loss: 0.8175, test_loss: 1.5947, test_f1: 0.4451
 epoch: 98, train_loss: 0.8349, test_loss: 1.5763, test_f1: 0.4467
 epoch: 99, train_loss: 0.8093, test_loss: 1.5538, test_f1: 0.4383
##################ITERATION #3 ****************************************
 epoch: 0, train_loss: 1.3448, test_loss: 1.3573, test_f1: 0.2281
 epoch: 1, train_loss: 1.2451, test_loss: 1.3067, test_f1: 0.2281
 epoch: 2, train_loss: 1.2058, test_loss: 1.2854, test_f1: 0.2205
 epoch: 3, train_loss: 1.1963, test_loss: 1.2696, test_f1: 0.2714
 epoch: 4, train_loss: 1.1678, test_loss: 1.2554, test_f1: 0.3164
 epoch: 5, train_loss: 1.1472, test_loss: 1.2351, test_f1: 0.3121
 epoch: 6, train_loss: 1.1259, test_loss: 1.2230, test_f1: 0.3312
 epoch: 7, train_loss: 1.1137, test_loss: 1.2064, test_f1: 0.3529
 epoch: 8, train_loss: 1.1007, test_loss: 1.2074, test_f1: 0.3802
 epoch: 9, train_loss: 1.0912, test_loss: 1.2046, test_f1: 0.3833
 epoch: 10, train_loss: 1.0919, test_loss: 1.1893, test_f1: 0.3841
 epoch: 11, train_loss: 1.0698, test_loss: 1.1912, test_f1: 0.4065
 epoch: 12, train_loss: 1.0591, test_loss: 1.1962, test_f1: 0.4200
 epoch: 13, train_loss: 1.0633, test_loss: 1.1657, test_f1: 0.4479
 epoch: 14, train_loss: 1.0423, test_loss: 1.1673, test_f1: 0.4533
 epoch: 15, train_loss: 1.0301, test_loss: 1.1720, test_f1: 0.4600
 epoch: 16, train_loss: 1.0382, test_loss: 1.1653, test_f1: 0.4580
 epoch: 17, train_loss: 1.0151, test_loss: 1.1769, test_f1: 0.4547
 epoch: 18, train_loss: 1.0236, test_loss: 1.1723, test_f1: 0.4599
 epoch: 19, train_loss: 1.0053, test_loss: 1.1669, test_f1: 0.4931
 epoch: 20, train_loss: 1.0020, test_loss: 1.1509, test_f1: 0.5109
 epoch: 21, train_loss: 1.0033, test_loss: 1.1441, test_f1: 0.5083
 epoch: 22, train_loss: 0.9917, test_loss: 1.1497, test_f1: 0.4813
 epoch: 23, train_loss: 1.0024, test_loss: 1.1768, test_f1: 0.5006
 epoch: 24, train_loss: 0.9794, test_loss: 1.1488, test_f1: 0.5296
 epoch: 25, train_loss: 0.9670, test_loss: 1.1541, test_f1: 0.5227
 epoch: 26, train_loss: 0.9641, test_loss: 1.1544, test_f1: 0.5123
 epoch: 27, train_loss: 0.9508, test_loss: 1.1581, test_f1: 0.5266
 epoch: 28, train_loss: 0.9698, test_loss: 1.1774, test_f1: 0.5394
 epoch: 29, train_loss: 0.9577, test_loss: 1.1827, test_f1: 0.5113
 epoch: 30, train_loss: 0.9546, test_loss: 1.1615, test_f1: 0.5198
 epoch: 31, train_loss: 0.9403, test_loss: 1.1375, test_f1: 0.5245
 epoch: 32, train_loss: 0.9377, test_loss: 1.1443, test_f1: 0.5191
 epoch: 33, train_loss: 0.9316, test_loss: 1.1352, test_f1: 0.5206
 epoch: 34, train_loss: 0.9242, test_loss: 1.1351, test_f1: 0.5214
 epoch: 35, train_loss: 0.9162, test_loss: 1.1667, test_f1: 0.4908
 epoch: 36, train_loss: 0.9237, test_loss: 1.1516, test_f1: 0.5448
 epoch: 37, train_loss: 0.9191, test_loss: 1.1572, test_f1: 0.5005
 epoch: 38, train_loss: 0.9099, test_loss: 1.1402, test_f1: 0.5026
 epoch: 39, train_loss: 0.9023, test_loss: 1.1226, test_f1: 0.5184
 epoch: 40, train_loss: 0.9024, test_loss: 1.1484, test_f1: 0.5238
 epoch: 41, train_loss: 0.8999, test_loss: 1.1769, test_f1: 0.5457
 epoch: 42, train_loss: 0.9219, test_loss: 1.2304, test_f1: 0.4822
 epoch: 43, train_loss: 0.8889, test_loss: 1.2474, test_f1: 0.4541
 epoch: 44, train_loss: 0.9009, test_loss: 1.1825, test_f1: 0.4996
 epoch: 45, train_loss: 0.8957, test_loss: 1.2012, test_f1: 0.5130
 epoch: 46, train_loss: 0.8934, test_loss: 1.2151, test_f1: 0.4589
 epoch: 47, train_loss: 0.8840, test_loss: 1.2205, test_f1: 0.4681
 epoch: 48, train_loss: 0.8717, test_loss: 1.2000, test_f1: 0.4724
 epoch: 49, train_loss: 0.8824, test_loss: 1.1912, test_f1: 0.4724
 epoch: 50, train_loss: 0.8539, test_loss: 1.2133, test_f1: 0.4673
 epoch: 51, train_loss: 0.8661, test_loss: 1.2091, test_f1: 0.4890
 epoch: 52, train_loss: 0.8541, test_loss: 1.1954, test_f1: 0.4816
 epoch: 53, train_loss: 0.8573, test_loss: 1.2015, test_f1: 0.4998
 epoch: 54, train_loss: 0.8556, test_loss: 1.2122, test_f1: 0.4890
 epoch: 55, train_loss: 0.8468, test_loss: 1.2338, test_f1: 0.4936
 epoch: 56, train_loss: 0.8560, test_loss: 1.2192, test_f1: 0.4952
 epoch: 57, train_loss: 0.8634, test_loss: 1.2205, test_f1: 0.5015
 epoch: 58, train_loss: 0.8504, test_loss: 1.2393, test_f1: 0.5153
 epoch: 59, train_loss: 0.8467, test_loss: 1.2121, test_f1: 0.5110
 epoch: 60, train_loss: 0.8366, test_loss: 1.2319, test_f1: 0.5070
 epoch: 61, train_loss: 0.8413, test_loss: 1.2560, test_f1: 0.5005
 epoch: 62, train_loss: 0.8429, test_loss: 1.2415, test_f1: 0.4942
 epoch: 63, train_loss: 0.8248, test_loss: 1.2433, test_f1: 0.4961
 epoch: 64, train_loss: 0.8378, test_loss: 1.2572, test_f1: 0.4842
 epoch: 65, train_loss: 0.8302, test_loss: 1.2643, test_f1: 0.4851
 epoch: 66, train_loss: 0.8290, test_loss: 1.2702, test_f1: 0.4951
 epoch: 67, train_loss: 0.8247, test_loss: 1.2606, test_f1: 0.5252
 epoch: 68, train_loss: 0.8236, test_loss: 1.2531, test_f1: 0.5168
 epoch: 69, train_loss: 0.8270, test_loss: 1.2359, test_f1: 0.5122
 epoch: 70, train_loss: 0.8443, test_loss: 1.2656, test_f1: 0.4855
 epoch: 71, train_loss: 0.8509, test_loss: 1.2755, test_f1: 0.4939
 epoch: 72, train_loss: 0.8240, test_loss: 1.2715, test_f1: 0.5016
 epoch: 73, train_loss: 0.8276, test_loss: 1.2492, test_f1: 0.4968
 epoch: 74, train_loss: 0.8391, test_loss: 1.2126, test_f1: 0.4878
 epoch: 75, train_loss: 0.8328, test_loss: 1.2213, test_f1: 0.4873
 epoch: 76, train_loss: 0.8276, test_loss: 1.2274, test_f1: 0.5122
 epoch: 77, train_loss: 0.8097, test_loss: 1.2622, test_f1: 0.4970
 epoch: 78, train_loss: 0.8145, test_loss: 1.2394, test_f1: 0.5046
 epoch: 79, train_loss: 0.8284, test_loss: 1.2617, test_f1: 0.5009
 epoch: 80, train_loss: 0.8016, test_loss: 1.2913, test_f1: 0.4994
 epoch: 81, train_loss: 0.8356, test_loss: 1.2952, test_f1: 0.4856
 epoch: 82, train_loss: 0.8031, test_loss: 1.2816, test_f1: 0.4977
 epoch: 83, train_loss: 0.8124, test_loss: 1.2721, test_f1: 0.5034
 epoch: 84, train_loss: 0.8072, test_loss: 1.3034, test_f1: 0.4914
 epoch: 85, train_loss: 0.8051, test_loss: 1.2981, test_f1: 0.4911
 epoch: 86, train_loss: 0.8113, test_loss: 1.3204, test_f1: 0.4776
 epoch: 87, train_loss: 0.8083, test_loss: 1.2847, test_f1: 0.4901
 epoch: 88, train_loss: 0.8108, test_loss: 1.2823, test_f1: 0.4935
 epoch: 89, train_loss: 0.8007, test_loss: 1.3276, test_f1: 0.4509
 epoch: 90, train_loss: 0.7973, test_loss: 1.3088, test_f1: 0.4600
 epoch: 91, train_loss: 0.8068, test_loss: 1.3308, test_f1: 0.4792
 epoch: 92, train_loss: 0.8117, test_loss: 1.3252, test_f1: 0.4887
 epoch: 93, train_loss: 0.8042, test_loss: 1.3062, test_f1: 0.4858
 epoch: 94, train_loss: 0.7991, test_loss: 1.2853, test_f1: 0.4946
 epoch: 95, train_loss: 0.8168, test_loss: 1.3132, test_f1: 0.4973
 epoch: 96, train_loss: 0.7969, test_loss: 1.3326, test_f1: 0.4878
 epoch: 97, train_loss: 0.8002, test_loss: 1.3233, test_f1: 0.4797
 epoch: 98, train_loss: 0.8091, test_loss: 1.3017, test_f1: 0.5011
 epoch: 99, train_loss: 0.8001, test_loss: 1.3517, test_f1: 0.4944
##################ITERATION #4 ****************************************
 epoch: 0, train_loss: 1.3431, test_loss: 1.3609, test_f1: 0.2404
 epoch: 1, train_loss: 1.2496, test_loss: 1.3816, test_f1: 0.2404
 epoch: 2, train_loss: 1.2376, test_loss: 1.3760, test_f1: 0.2404
 epoch: 3, train_loss: 1.2219, test_loss: 1.3783, test_f1: 0.2699
 epoch: 4, train_loss: 1.1945, test_loss: 1.3466, test_f1: 0.2410
 epoch: 5, train_loss: 1.1974, test_loss: 1.3119, test_f1: 0.2629
 epoch: 6, train_loss: 1.1843, test_loss: 1.2946, test_f1: 0.2932
 epoch: 7, train_loss: 1.1628, test_loss: 1.2990, test_f1: 0.3184
 epoch: 8, train_loss: 1.1573, test_loss: 1.2974, test_f1: 0.2962
 epoch: 9, train_loss: 1.1522, test_loss: 1.2609, test_f1: 0.3032
 epoch: 10, train_loss: 1.1486, test_loss: 1.2431, test_f1: 0.3013
 epoch: 11, train_loss: 1.1295, test_loss: 1.2427, test_f1: 0.3153
 epoch: 12, train_loss: 1.1338, test_loss: 1.2344, test_f1: 0.3230
 epoch: 13, train_loss: 1.1289, test_loss: 1.2377, test_f1: 0.3248
 epoch: 14, train_loss: 1.1194, test_loss: 1.2220, test_f1: 0.3279
 epoch: 15, train_loss: 1.1129, test_loss: 1.2136, test_f1: 0.3176
 epoch: 16, train_loss: 1.0987, test_loss: 1.2056, test_f1: 0.3313
 epoch: 17, train_loss: 1.0910, test_loss: 1.2013, test_f1: 0.3427
 epoch: 18, train_loss: 1.0929, test_loss: 1.1971, test_f1: 0.3396
 epoch: 19, train_loss: 1.0739, test_loss: 1.2035, test_f1: 0.3416
 epoch: 20, train_loss: 1.0724, test_loss: 1.2112, test_f1: 0.3366
 epoch: 21, train_loss: 1.0622, test_loss: 1.2102, test_f1: 0.3642
 epoch: 22, train_loss: 1.0576, test_loss: 1.1953, test_f1: 0.3668
 epoch: 23, train_loss: 1.0608, test_loss: 1.1909, test_f1: 0.3622
 epoch: 24, train_loss: 1.0474, test_loss: 1.1819, test_f1: 0.4006
 epoch: 25, train_loss: 1.0366, test_loss: 1.1930, test_f1: 0.4364
 epoch: 26, train_loss: 1.0416, test_loss: 1.2085, test_f1: 0.4345
 epoch: 27, train_loss: 1.0277, test_loss: 1.1819, test_f1: 0.4168
 epoch: 28, train_loss: 1.0192, test_loss: 1.1867, test_f1: 0.4032
 epoch: 29, train_loss: 1.0345, test_loss: 1.2010, test_f1: 0.4445
 epoch: 30, train_loss: 1.0168, test_loss: 1.1772, test_f1: 0.3895
 epoch: 31, train_loss: 1.0087, test_loss: 1.1982, test_f1: 0.4646
 epoch: 32, train_loss: 1.0125, test_loss: 1.2517, test_f1: 0.4734
 epoch: 33, train_loss: 1.0028, test_loss: 1.2688, test_f1: 0.4691
 epoch: 34, train_loss: 1.0028, test_loss: 1.2949, test_f1: 0.4607
 epoch: 35, train_loss: 0.9925, test_loss: 1.2157, test_f1: 0.4547
 epoch: 36, train_loss: 0.9959, test_loss: 1.2253, test_f1: 0.4563
 epoch: 37, train_loss: 0.9849, test_loss: 1.2363, test_f1: 0.4455
 epoch: 38, train_loss: 0.9602, test_loss: 1.2306, test_f1: 0.4453
 epoch: 39, train_loss: 0.9777, test_loss: 1.2117, test_f1: 0.4315
 epoch: 40, train_loss: 0.9646, test_loss: 1.2209, test_f1: 0.4463
 epoch: 41, train_loss: 0.9639, test_loss: 1.2217, test_f1: 0.4625
 epoch: 42, train_loss: 0.9503, test_loss: 1.2318, test_f1: 0.4695
 epoch: 43, train_loss: 0.9580, test_loss: 1.1949, test_f1: 0.4583
 epoch: 44, train_loss: 0.9461, test_loss: 1.1790, test_f1: 0.4818
 epoch: 45, train_loss: 0.9537, test_loss: 1.1885, test_f1: 0.4715
 epoch: 46, train_loss: 0.9454, test_loss: 1.2528, test_f1: 0.4538
 epoch: 47, train_loss: 0.9500, test_loss: 1.2982, test_f1: 0.4747
 epoch: 48, train_loss: 0.9438, test_loss: 1.3240, test_f1: 0.4841
 epoch: 49, train_loss: 0.9236, test_loss: 1.3986, test_f1: 0.4806
 epoch: 50, train_loss: 0.9258, test_loss: 1.3198, test_f1: 0.4998
 epoch: 51, train_loss: 0.9151, test_loss: 1.3657, test_f1: 0.4943
 epoch: 52, train_loss: 0.9125, test_loss: 1.3838, test_f1: 0.5128
 epoch: 53, train_loss: 0.9167, test_loss: 1.3127, test_f1: 0.4913
 epoch: 54, train_loss: 0.9163, test_loss: 1.2991, test_f1: 0.4634
 epoch: 55, train_loss: 0.9063, test_loss: 1.3076, test_f1: 0.4939
 epoch: 56, train_loss: 0.9070, test_loss: 1.2933, test_f1: 0.4971
 epoch: 57, train_loss: 0.9014, test_loss: 1.2709, test_f1: 0.5071
 epoch: 58, train_loss: 0.8934, test_loss: 1.2359, test_f1: 0.4962
 epoch: 59, train_loss: 0.9066, test_loss: 1.2422, test_f1: 0.5026
 epoch: 60, train_loss: 0.8873, test_loss: 1.3753, test_f1: 0.5212
 epoch: 61, train_loss: 0.8916, test_loss: 1.4127, test_f1: 0.5084
 epoch: 62, train_loss: 0.8848, test_loss: 1.4070, test_f1: 0.5061
 epoch: 63, train_loss: 0.8882, test_loss: 1.4266, test_f1: 0.5119
 epoch: 64, train_loss: 0.8915, test_loss: 1.3799, test_f1: 0.5010
 epoch: 65, train_loss: 0.8873, test_loss: 1.3341, test_f1: 0.5290
 epoch: 66, train_loss: 0.8821, test_loss: 1.3631, test_f1: 0.4953
 epoch: 67, train_loss: 0.8785, test_loss: 1.2853, test_f1: 0.5181
 epoch: 68, train_loss: 0.8813, test_loss: 1.2377, test_f1: 0.5211
 epoch: 69, train_loss: 0.8799, test_loss: 1.2397, test_f1: 0.5246
 epoch: 70, train_loss: 0.8843, test_loss: 1.2479, test_f1: 0.5136
 epoch: 71, train_loss: 0.8915, test_loss: 1.2544, test_f1: 0.5090
 epoch: 72, train_loss: 0.8740, test_loss: 1.2666, test_f1: 0.5233
 epoch: 73, train_loss: 0.8693, test_loss: 1.2462, test_f1: 0.5322
 epoch: 74, train_loss: 0.8700, test_loss: 1.2020, test_f1: 0.5082
 epoch: 75, train_loss: 0.8779, test_loss: 1.2642, test_f1: 0.5318
 epoch: 76, train_loss: 0.8702, test_loss: 1.3153, test_f1: 0.5254
 epoch: 77, train_loss: 0.8659, test_loss: 1.3288, test_f1: 0.5238
 epoch: 78, train_loss: 0.8585, test_loss: 1.3150, test_f1: 0.5285
 epoch: 79, train_loss: 0.8595, test_loss: 1.2597, test_f1: 0.5390
 epoch: 80, train_loss: 0.8420, test_loss: 1.2744, test_f1: 0.5233
 epoch: 81, train_loss: 0.8606, test_loss: 1.3609, test_f1: 0.5229
 epoch: 82, train_loss: 0.8527, test_loss: 1.3330, test_f1: 0.5236
 epoch: 83, train_loss: 0.8451, test_loss: 1.3015, test_f1: 0.5248
 epoch: 84, train_loss: 0.8503, test_loss: 1.3015, test_f1: 0.5241
 epoch: 85, train_loss: 0.8292, test_loss: 1.2591, test_f1: 0.5518
 epoch: 86, train_loss: 0.8382, test_loss: 1.2832, test_f1: 0.5662
 epoch: 87, train_loss: 0.8586, test_loss: 1.3876, test_f1: 0.5684
 epoch: 88, train_loss: 0.8528, test_loss: 1.3037, test_f1: 0.5478
 epoch: 89, train_loss: 0.8374, test_loss: 1.3647, test_f1: 0.5514
 epoch: 90, train_loss: 0.8460, test_loss: 1.4224, test_f1: 0.5406
 epoch: 91, train_loss: 0.8319, test_loss: 1.3430, test_f1: 0.5295
 epoch: 92, train_loss: 0.8288, test_loss: 1.3589, test_f1: 0.5312
 epoch: 93, train_loss: 0.8371, test_loss: 1.4680, test_f1: 0.5240
 epoch: 94, train_loss: 0.8407, test_loss: 1.4916, test_f1: 0.5587
 epoch: 95, train_loss: 0.8447, test_loss: 1.3766, test_f1: 0.5391
 epoch: 96, train_loss: 0.8204, test_loss: 1.3218, test_f1: 0.5481
 epoch: 97, train_loss: 0.8112, test_loss: 1.3744, test_f1: 0.5530
 epoch: 98, train_loss: 0.8444, test_loss: 1.4044, test_f1: 0.5532
 epoch: 99, train_loss: 0.8389, test_loss: 1.4105, test_f1: 0.5562
##################ITERATION #5 ****************************************
 epoch: 0, train_loss: 1.3042, test_loss: 1.3508, test_f1: 0.2281
 epoch: 1, train_loss: 1.2741, test_loss: 1.3282, test_f1: 0.2281
 epoch: 2, train_loss: 1.2521, test_loss: 1.3150, test_f1: 0.2281
 epoch: 3, train_loss: 1.2254, test_loss: 1.3039, test_f1: 0.2272
 epoch: 4, train_loss: 1.2214, test_loss: 1.3007, test_f1: 0.2416
 epoch: 5, train_loss: 1.2091, test_loss: 1.2962, test_f1: 0.2533
 epoch: 6, train_loss: 1.2059, test_loss: 1.2855, test_f1: 0.2575
 epoch: 7, train_loss: 1.1952, test_loss: 1.2792, test_f1: 0.2547
 epoch: 8, train_loss: 1.1953, test_loss: 1.2752, test_f1: 0.2715
 epoch: 9, train_loss: 1.1784, test_loss: 1.2608, test_f1: 0.2694
 epoch: 10, train_loss: 1.1760, test_loss: 1.2463, test_f1: 0.2913
 epoch: 11, train_loss: 1.1850, test_loss: 1.2335, test_f1: 0.2702
 epoch: 12, train_loss: 1.1693, test_loss: 1.2328, test_f1: 0.2979
 epoch: 13, train_loss: 1.1731, test_loss: 1.2520, test_f1: 0.2885
 epoch: 14, train_loss: 1.1597, test_loss: 1.2532, test_f1: 0.2963
 epoch: 15, train_loss: 1.1696, test_loss: 1.2279, test_f1: 0.3086
 epoch: 16, train_loss: 1.1604, test_loss: 1.2279, test_f1: 0.2981
 epoch: 17, train_loss: 1.1612, test_loss: 1.2363, test_f1: 0.2833
 epoch: 18, train_loss: 1.1536, test_loss: 1.2335, test_f1: 0.3088
 epoch: 19, train_loss: 1.1421, test_loss: 1.2231, test_f1: 0.2886
 epoch: 20, train_loss: 1.1524, test_loss: 1.2185, test_f1: 0.3075
 epoch: 21, train_loss: 1.1170, test_loss: 1.2098, test_f1: 0.3294
 epoch: 22, train_loss: 1.1321, test_loss: 1.2177, test_f1: 0.3254
 epoch: 23, train_loss: 1.1269, test_loss: 1.2035, test_f1: 0.2954
 epoch: 24, train_loss: 1.1370, test_loss: 1.2008, test_f1: 0.3504
 epoch: 25, train_loss: 1.1387, test_loss: 1.2060, test_f1: 0.3667
 epoch: 26, train_loss: 1.1081, test_loss: 1.2187, test_f1: 0.3357
 epoch: 27, train_loss: 1.1213, test_loss: 1.2403, test_f1: 0.3183
 epoch: 28, train_loss: 1.1005, test_loss: 1.2112, test_f1: 0.3440
 epoch: 29, train_loss: 1.1115, test_loss: 1.2020, test_f1: 0.3869
 epoch: 30, train_loss: 1.0940, test_loss: 1.2126, test_f1: 0.3519
 epoch: 31, train_loss: 1.1091, test_loss: 1.2054, test_f1: 0.3358
 epoch: 32, train_loss: 1.0788, test_loss: 1.1871, test_f1: 0.4045
 epoch: 33, train_loss: 1.0881, test_loss: 1.1958, test_f1: 0.3732
 epoch: 34, train_loss: 1.0829, test_loss: 1.1830, test_f1: 0.3515
 epoch: 35, train_loss: 1.0863, test_loss: 1.1828, test_f1: 0.3837
 epoch: 36, train_loss: 1.0859, test_loss: 1.2025, test_f1: 0.4016
 epoch: 37, train_loss: 1.0860, test_loss: 1.1584, test_f1: 0.4157
 epoch: 38, train_loss: 1.0741, test_loss: 1.1594, test_f1: 0.3965
 epoch: 39, train_loss: 1.0525, test_loss: 1.1554, test_f1: 0.4331
 epoch: 40, train_loss: 1.0554, test_loss: 1.1567, test_f1: 0.4226
 epoch: 41, train_loss: 1.0405, test_loss: 1.1496, test_f1: 0.4179
 epoch: 42, train_loss: 1.0356, test_loss: 1.1617, test_f1: 0.3990
 epoch: 43, train_loss: 1.0221, test_loss: 1.1697, test_f1: 0.4190
 epoch: 44, train_loss: 1.0459, test_loss: 1.1683, test_f1: 0.4668
 epoch: 45, train_loss: 1.0309, test_loss: 1.1742, test_f1: 0.4292
 epoch: 46, train_loss: 1.0304, test_loss: 1.1661, test_f1: 0.4619
 epoch: 47, train_loss: 1.0316, test_loss: 1.1736, test_f1: 0.4562
 epoch: 48, train_loss: 1.0061, test_loss: 1.1660, test_f1: 0.4647
 epoch: 49, train_loss: 1.0092, test_loss: 1.1838, test_f1: 0.4730
 epoch: 50, train_loss: 1.0147, test_loss: 1.1675, test_f1: 0.4724
 epoch: 51, train_loss: 1.0009, test_loss: 1.1553, test_f1: 0.4865
 epoch: 52, train_loss: 0.9875, test_loss: 1.1578, test_f1: 0.4579
 epoch: 53, train_loss: 0.9883, test_loss: 1.1445, test_f1: 0.4526
 epoch: 54, train_loss: 0.9882, test_loss: 1.1504, test_f1: 0.4764
 epoch: 55, train_loss: 0.9904, test_loss: 1.1489, test_f1: 0.4583
 epoch: 56, train_loss: 0.9817, test_loss: 1.1450, test_f1: 0.4584
 epoch: 57, train_loss: 0.9893, test_loss: 1.1563, test_f1: 0.5021
 epoch: 58, train_loss: 0.9759, test_loss: 1.1512, test_f1: 0.4933
 epoch: 59, train_loss: 0.9751, test_loss: 1.1601, test_f1: 0.4818
 epoch: 60, train_loss: 0.9855, test_loss: 1.1580, test_f1: 0.4894
 epoch: 61, train_loss: 0.9658, test_loss: 1.1594, test_f1: 0.4884
 epoch: 62, train_loss: 0.9763, test_loss: 1.1694, test_f1: 0.4512
 epoch: 63, train_loss: 0.9657, test_loss: 1.1464, test_f1: 0.5089
 epoch: 64, train_loss: 0.9635, test_loss: 1.1515, test_f1: 0.4927
 epoch: 65, train_loss: 0.9817, test_loss: 1.1600, test_f1: 0.4854
 epoch: 66, train_loss: 0.9635, test_loss: 1.1568, test_f1: 0.4999
 epoch: 67, train_loss: 0.9607, test_loss: 1.1543, test_f1: 0.4883
 epoch: 68, train_loss: 0.9482, test_loss: 1.1524, test_f1: 0.4782
 epoch: 69, train_loss: 0.9484, test_loss: 1.1695, test_f1: 0.4937
 epoch: 70, train_loss: 0.9825, test_loss: 1.1733, test_f1: 0.5292
 epoch: 71, train_loss: 0.9531, test_loss: 1.1555, test_f1: 0.5063
 epoch: 72, train_loss: 0.9575, test_loss: 1.1550, test_f1: 0.5092
 epoch: 73, train_loss: 0.9534, test_loss: 1.1583, test_f1: 0.4948
 epoch: 74, train_loss: 0.9526, test_loss: 1.1990, test_f1: 0.4206
 epoch: 75, train_loss: 0.9459, test_loss: 1.1741, test_f1: 0.5098
 epoch: 76, train_loss: 0.9483, test_loss: 1.1749, test_f1: 0.4724
 epoch: 77, train_loss: 0.9399, test_loss: 1.1821, test_f1: 0.5183
 epoch: 78, train_loss: 0.9384, test_loss: 1.1662, test_f1: 0.5152
 epoch: 79, train_loss: 0.9535, test_loss: 1.1577, test_f1: 0.5025
 epoch: 80, train_loss: 0.9591, test_loss: 1.1536, test_f1: 0.5020
 epoch: 81, train_loss: 0.9450, test_loss: 1.1654, test_f1: 0.4542
 epoch: 82, train_loss: 0.9422, test_loss: 1.1503, test_f1: 0.5415
 epoch: 83, train_loss: 0.9310, test_loss: 1.1619, test_f1: 0.5337
 epoch: 84, train_loss: 0.9305, test_loss: 1.1332, test_f1: 0.5183
 epoch: 85, train_loss: 0.9436, test_loss: 1.1658, test_f1: 0.5271
 epoch: 86, train_loss: 0.9491, test_loss: 1.2032, test_f1: 0.4718
 epoch: 87, train_loss: 0.9289, test_loss: 1.1659, test_f1: 0.4953
 epoch: 88, train_loss: 0.9268, test_loss: 1.1745, test_f1: 0.5259
 epoch: 89, train_loss: 0.9056, test_loss: 1.1622, test_f1: 0.5369
 epoch: 90, train_loss: 0.9118, test_loss: 1.1696, test_f1: 0.5312
 epoch: 91, train_loss: 0.9282, test_loss: 1.1961, test_f1: 0.5188
 epoch: 92, train_loss: 0.9097, test_loss: 1.1902, test_f1: 0.5016
 epoch: 93, train_loss: 0.9314, test_loss: 1.1922, test_f1: 0.5408
 epoch: 94, train_loss: 0.9161, test_loss: 1.1824, test_f1: 0.5286
 epoch: 95, train_loss: 0.9236, test_loss: 1.2025, test_f1: 0.5430
 epoch: 96, train_loss: 0.9194, test_loss: 1.1776, test_f1: 0.4991
 epoch: 97, train_loss: 0.9025, test_loss: 1.1787, test_f1: 0.5277
 epoch: 98, train_loss: 0.9012, test_loss: 1.1813, test_f1: 0.5062
 epoch: 99, train_loss: 0.9049, test_loss: 1.1898, test_f1: 0.4542
##################ITERATION #6 ****************************************
 epoch: 0, train_loss: 1.3058, test_loss: 1.3855, test_f1: 0.2404
 epoch: 1, train_loss: 1.2517, test_loss: 1.3698, test_f1: 0.2404
 epoch: 2, train_loss: 1.2511, test_loss: 1.3452, test_f1: 0.2404
 epoch: 3, train_loss: 1.2245, test_loss: 1.3530, test_f1: 0.2354
 epoch: 4, train_loss: 1.2114, test_loss: 1.3380, test_f1: 0.2699
 epoch: 5, train_loss: 1.2105, test_loss: 1.3377, test_f1: 0.2917
 epoch: 6, train_loss: 1.1965, test_loss: 1.3294, test_f1: 0.2975
 epoch: 7, train_loss: 1.1937, test_loss: 1.3157, test_f1: 0.2797
 epoch: 8, train_loss: 1.1874, test_loss: 1.3000, test_f1: 0.3043
 epoch: 9, train_loss: 1.1792, test_loss: 1.2922, test_f1: 0.3291
 epoch: 10, train_loss: 1.1721, test_loss: 1.2969, test_f1: 0.3486
 epoch: 11, train_loss: 1.1725, test_loss: 1.2795, test_f1: 0.3391
 epoch: 12, train_loss: 1.1637, test_loss: 1.3012, test_f1: 0.3535
 epoch: 13, train_loss: 1.1691, test_loss: 1.2910, test_f1: 0.3417
 epoch: 14, train_loss: 1.1529, test_loss: 1.2815, test_f1: 0.3571
 epoch: 15, train_loss: 1.1440, test_loss: 1.2591, test_f1: 0.3716
 epoch: 16, train_loss: 1.1315, test_loss: 1.2614, test_f1: 0.3753
 epoch: 17, train_loss: 1.1291, test_loss: 1.2426, test_f1: 0.3706
 epoch: 18, train_loss: 1.1195, test_loss: 1.2425, test_f1: 0.3982
 epoch: 19, train_loss: 1.1223, test_loss: 1.2412, test_f1: 0.3862
 epoch: 20, train_loss: 1.1277, test_loss: 1.2418, test_f1: 0.3622
 epoch: 21, train_loss: 1.1206, test_loss: 1.2520, test_f1: 0.3722
 epoch: 22, train_loss: 1.1088, test_loss: 1.2499, test_f1: 0.3747
 epoch: 23, train_loss: 1.1083, test_loss: 1.2450, test_f1: 0.4016
 epoch: 24, train_loss: 1.0892, test_loss: 1.2614, test_f1: 0.3762
 epoch: 25, train_loss: 1.0927, test_loss: 1.2477, test_f1: 0.3947
 epoch: 26, train_loss: 1.0820, test_loss: 1.2596, test_f1: 0.3742
 epoch: 27, train_loss: 1.0883, test_loss: 1.2949, test_f1: 0.3935
 epoch: 28, train_loss: 1.0840, test_loss: 1.2842, test_f1: 0.4161
 epoch: 29, train_loss: 1.0692, test_loss: 1.2726, test_f1: 0.3937
 epoch: 30, train_loss: 1.0680, test_loss: 1.2338, test_f1: 0.4087
 epoch: 31, train_loss: 1.0629, test_loss: 1.2474, test_f1: 0.3664
 epoch: 32, train_loss: 1.0513, test_loss: 1.2953, test_f1: 0.3758
 epoch: 33, train_loss: 1.0608, test_loss: 1.2984, test_f1: 0.3960
 epoch: 34, train_loss: 1.0504, test_loss: 1.3061, test_f1: 0.3798
 epoch: 35, train_loss: 1.0454, test_loss: 1.2562, test_f1: 0.4020
 epoch: 36, train_loss: 1.0527, test_loss: 1.2449, test_f1: 0.4036
 epoch: 37, train_loss: 1.0424, test_loss: 1.2836, test_f1: 0.3794
 epoch: 38, train_loss: 1.0233, test_loss: 1.2811, test_f1: 0.3987
 epoch: 39, train_loss: 1.0291, test_loss: 1.2901, test_f1: 0.4444
 epoch: 40, train_loss: 1.0219, test_loss: 1.2768, test_f1: 0.4278
 epoch: 41, train_loss: 1.0257, test_loss: 1.2756, test_f1: 0.4185
 epoch: 42, train_loss: 1.0143, test_loss: 1.2608, test_f1: 0.3834
 epoch: 43, train_loss: 1.0079, test_loss: 1.2802, test_f1: 0.3892
 epoch: 44, train_loss: 1.0102, test_loss: 1.2581, test_f1: 0.4115
 epoch: 45, train_loss: 1.0084, test_loss: 1.2858, test_f1: 0.4368
 epoch: 46, train_loss: 0.9965, test_loss: 1.2826, test_f1: 0.4396
 epoch: 47, train_loss: 0.9916, test_loss: 1.2892, test_f1: 0.4125
 epoch: 48, train_loss: 0.9958, test_loss: 1.3038, test_f1: 0.4415
 epoch: 49, train_loss: 0.9907, test_loss: 1.3607, test_f1: 0.4453
 epoch: 50, train_loss: 0.9870, test_loss: 1.2956, test_f1: 0.4734
 epoch: 51, train_loss: 0.9632, test_loss: 1.2998, test_f1: 0.4590
 epoch: 52, train_loss: 0.9588, test_loss: 1.3233, test_f1: 0.4555
 epoch: 53, train_loss: 0.9811, test_loss: 1.3365, test_f1: 0.4503
 epoch: 54, train_loss: 0.9811, test_loss: 1.3125, test_f1: 0.4484
 epoch: 55, train_loss: 0.9781, test_loss: 1.3076, test_f1: 0.4438
 epoch: 56, train_loss: 0.9735, test_loss: 1.3164, test_f1: 0.4379
 epoch: 57, train_loss: 0.9749, test_loss: 1.3346, test_f1: 0.4604
 epoch: 58, train_loss: 0.9640, test_loss: 1.3083, test_f1: 0.4527
 epoch: 59, train_loss: 0.9452, test_loss: 1.3088, test_f1: 0.4517
 epoch: 60, train_loss: 0.9552, test_loss: 1.3065, test_f1: 0.4733
 epoch: 61, train_loss: 0.9440, test_loss: 1.3164, test_f1: 0.4591
 epoch: 62, train_loss: 0.9604, test_loss: 1.3035, test_f1: 0.4705
 epoch: 63, train_loss: 0.9405, test_loss: 1.3240, test_f1: 0.4683
 epoch: 64, train_loss: 0.9440, test_loss: 1.3164, test_f1: 0.4420
 epoch: 65, train_loss: 0.9370, test_loss: 1.3287, test_f1: 0.4625
 epoch: 66, train_loss: 0.9143, test_loss: 1.3094, test_f1: 0.4506
 epoch: 67, train_loss: 0.9288, test_loss: 1.3432, test_f1: 0.4549
 epoch: 68, train_loss: 0.9408, test_loss: 1.3464, test_f1: 0.4811
 epoch: 69, train_loss: 0.9186, test_loss: 1.3239, test_f1: 0.4736
 epoch: 70, train_loss: 0.9212, test_loss: 1.3120, test_f1: 0.4837
 epoch: 71, train_loss: 0.9285, test_loss: 1.3479, test_f1: 0.4688
 epoch: 72, train_loss: 0.9246, test_loss: 1.3314, test_f1: 0.4978
 epoch: 73, train_loss: 0.9249, test_loss: 1.3144, test_f1: 0.4702
 epoch: 74, train_loss: 0.9272, test_loss: 1.3298, test_f1: 0.4783
 epoch: 75, train_loss: 0.9179, test_loss: 1.3131, test_f1: 0.5011
 epoch: 76, train_loss: 0.9093, test_loss: 1.3175, test_f1: 0.4765
 epoch: 77, train_loss: 0.9248, test_loss: 1.3532, test_f1: 0.3963
 epoch: 78, train_loss: 0.9250, test_loss: 1.3388, test_f1: 0.4402
 epoch: 79, train_loss: 0.9249, test_loss: 1.3089, test_f1: 0.4652
 epoch: 80, train_loss: 0.9116, test_loss: 1.3414, test_f1: 0.4841
 epoch: 81, train_loss: 0.9084, test_loss: 1.3236, test_f1: 0.4715
 epoch: 82, train_loss: 0.8962, test_loss: 1.3359, test_f1: 0.4837
 epoch: 83, train_loss: 0.9040, test_loss: 1.3444, test_f1: 0.4864
 epoch: 84, train_loss: 0.9080, test_loss: 1.3329, test_f1: 0.4775
 epoch: 85, train_loss: 0.8971, test_loss: 1.3685, test_f1: 0.4672
 epoch: 86, train_loss: 0.8847, test_loss: 1.3526, test_f1: 0.4671
 epoch: 87, train_loss: 0.9121, test_loss: 1.3141, test_f1: 0.4822
 epoch: 88, train_loss: 0.9086, test_loss: 1.3613, test_f1: 0.4773
 epoch: 89, train_loss: 0.8965, test_loss: 1.3595, test_f1: 0.4621
 epoch: 90, train_loss: 0.9035, test_loss: 1.3245, test_f1: 0.4900
 epoch: 91, train_loss: 0.8917, test_loss: 1.3480, test_f1: 0.4739
 epoch: 92, train_loss: 0.9009, test_loss: 1.3488, test_f1: 0.4662
 epoch: 93, train_loss: 0.8898, test_loss: 1.3301, test_f1: 0.4312
 epoch: 94, train_loss: 0.8792, test_loss: 1.3293, test_f1: 0.4824
 epoch: 95, train_loss: 0.8688, test_loss: 1.3775, test_f1: 0.4762
 epoch: 96, train_loss: 0.8791, test_loss: 1.3449, test_f1: 0.4823
 epoch: 97, train_loss: 0.8812, test_loss: 1.3568, test_f1: 0.4490
 epoch: 98, train_loss: 0.8731, test_loss: 1.3543, test_f1: 0.4791
 epoch: 99, train_loss: 0.8712, test_loss: 1.3313, test_f1: 0.4839
##################ITERATION #7 ****************************************
 epoch: 0, train_loss: 1.3230, test_loss: 1.3223, test_f1: 0.2281
 epoch: 1, train_loss: 1.2404, test_loss: 1.3010, test_f1: 0.2248
 epoch: 2, train_loss: 1.2150, test_loss: 1.2606, test_f1: 0.2248
 epoch: 3, train_loss: 1.2012, test_loss: 1.2644, test_f1: 0.3002
 epoch: 4, train_loss: 1.1809, test_loss: 1.2475, test_f1: 0.3059
 epoch: 5, train_loss: 1.1530, test_loss: 1.2379, test_f1: 0.3017
 epoch: 6, train_loss: 1.1656, test_loss: 1.2488, test_f1: 0.2976
 epoch: 7, train_loss: 1.1604, test_loss: 1.2392, test_f1: 0.3094
 epoch: 8, train_loss: 1.1619, test_loss: 1.2446, test_f1: 0.3007
 epoch: 9, train_loss: 1.1396, test_loss: 1.2373, test_f1: 0.3027
 epoch: 10, train_loss: 1.1418, test_loss: 1.2299, test_f1: 0.2984
 epoch: 11, train_loss: 1.1236, test_loss: 1.2317, test_f1: 0.3059
 epoch: 12, train_loss: 1.1271, test_loss: 1.2258, test_f1: 0.3089
 epoch: 13, train_loss: 1.1029, test_loss: 1.2400, test_f1: 0.3085
 epoch: 14, train_loss: 1.0979, test_loss: 1.2274, test_f1: 0.3255
 epoch: 15, train_loss: 1.1031, test_loss: 1.2307, test_f1: 0.3613
 epoch: 16, train_loss: 1.1044, test_loss: 1.2116, test_f1: 0.3318
 epoch: 17, train_loss: 1.0821, test_loss: 1.2025, test_f1: 0.3313
 epoch: 18, train_loss: 1.0908, test_loss: 1.2083, test_f1: 0.3320
 epoch: 19, train_loss: 1.0748, test_loss: 1.1916, test_f1: 0.3554
 epoch: 20, train_loss: 1.0789, test_loss: 1.2234, test_f1: 0.3399
 epoch: 21, train_loss: 1.0659, test_loss: 1.2223, test_f1: 0.3442
 epoch: 22, train_loss: 1.0736, test_loss: 1.2154, test_f1: 0.3694
 epoch: 23, train_loss: 1.0603, test_loss: 1.1905, test_f1: 0.3996
 epoch: 24, train_loss: 1.0468, test_loss: 1.2069, test_f1: 0.3814
 epoch: 25, train_loss: 1.0396, test_loss: 1.2313, test_f1: 0.4064
 epoch: 26, train_loss: 1.0334, test_loss: 1.2155, test_f1: 0.3624
 epoch: 27, train_loss: 1.0393, test_loss: 1.1957, test_f1: 0.3929
 epoch: 28, train_loss: 1.0336, test_loss: 1.1702, test_f1: 0.4347
 epoch: 29, train_loss: 1.0116, test_loss: 1.2043, test_f1: 0.4016
 epoch: 30, train_loss: 1.0027, test_loss: 1.1706, test_f1: 0.4080
 epoch: 31, train_loss: 1.0078, test_loss: 1.1835, test_f1: 0.4236
 epoch: 32, train_loss: 0.9894, test_loss: 1.1677, test_f1: 0.4375
 epoch: 33, train_loss: 0.9981, test_loss: 1.1782, test_f1: 0.4287
 epoch: 34, train_loss: 0.9788, test_loss: 1.1414, test_f1: 0.4303
 epoch: 35, train_loss: 0.9876, test_loss: 1.1460, test_f1: 0.4263
 epoch: 36, train_loss: 0.9662, test_loss: 1.1334, test_f1: 0.4345
 epoch: 37, train_loss: 0.9806, test_loss: 1.1313, test_f1: 0.4743
 epoch: 38, train_loss: 0.9679, test_loss: 1.1401, test_f1: 0.4234
 epoch: 39, train_loss: 0.9624, test_loss: 1.1402, test_f1: 0.4054
 epoch: 40, train_loss: 0.9636, test_loss: 1.1341, test_f1: 0.5123
 epoch: 41, train_loss: 0.9634, test_loss: 1.1506, test_f1: 0.4367
 epoch: 42, train_loss: 0.9591, test_loss: 1.1482, test_f1: 0.4181
 epoch: 43, train_loss: 0.9265, test_loss: 1.1862, test_f1: 0.3991
 epoch: 44, train_loss: 0.9685, test_loss: 1.1358, test_f1: 0.4444
 epoch: 45, train_loss: 0.9360, test_loss: 1.1424, test_f1: 0.3982
 epoch: 46, train_loss: 0.9448, test_loss: 1.1641, test_f1: 0.4291
 epoch: 47, train_loss: 0.9409, test_loss: 1.1266, test_f1: 0.4553
 epoch: 48, train_loss: 0.9364, test_loss: 1.1222, test_f1: 0.5093
 epoch: 49, train_loss: 0.9315, test_loss: 1.1680, test_f1: 0.4303
 epoch: 50, train_loss: 0.9276, test_loss: 1.1550, test_f1: 0.5250
 epoch: 51, train_loss: 0.9232, test_loss: 1.1658, test_f1: 0.4209
 epoch: 52, train_loss: 0.9132, test_loss: 1.1818, test_f1: 0.4424
 epoch: 53, train_loss: 0.9307, test_loss: 1.1565, test_f1: 0.4489
 epoch: 54, train_loss: 0.9097, test_loss: 1.1697, test_f1: 0.4599
 epoch: 55, train_loss: 0.9152, test_loss: 1.1568, test_f1: 0.4716
 epoch: 56, train_loss: 0.8966, test_loss: 1.1618, test_f1: 0.4503
 epoch: 57, train_loss: 0.8989, test_loss: 1.1525, test_f1: 0.4597
 epoch: 58, train_loss: 0.8945, test_loss: 1.1666, test_f1: 0.4421
 epoch: 59, train_loss: 0.9216, test_loss: 1.1185, test_f1: 0.4858
 epoch: 60, train_loss: 0.8942, test_loss: 1.1338, test_f1: 0.4685
 epoch: 61, train_loss: 0.8921, test_loss: 1.1295, test_f1: 0.4572
 epoch: 62, train_loss: 0.9002, test_loss: 1.1293, test_f1: 0.4622
 epoch: 63, train_loss: 0.8808, test_loss: 1.1157, test_f1: 0.4678
 epoch: 64, train_loss: 0.8888, test_loss: 1.1447, test_f1: 0.5018
 epoch: 65, train_loss: 0.9048, test_loss: 1.1033, test_f1: 0.4856
 epoch: 66, train_loss: 0.8891, test_loss: 1.1335, test_f1: 0.4395
 epoch: 67, train_loss: 0.8759, test_loss: 1.0839, test_f1: 0.4912
 epoch: 68, train_loss: 0.8914, test_loss: 1.1030, test_f1: 0.4634
 epoch: 69, train_loss: 0.8783, test_loss: 1.1412, test_f1: 0.4340
 epoch: 70, train_loss: 0.8846, test_loss: 1.1211, test_f1: 0.4557
 epoch: 71, train_loss: 0.8881, test_loss: 1.1017, test_f1: 0.5083
 epoch: 72, train_loss: 0.8782, test_loss: 1.1011, test_f1: 0.4716
 epoch: 73, train_loss: 0.8871, test_loss: 1.1261, test_f1: 0.4915
 epoch: 74, train_loss: 0.8617, test_loss: 1.0940, test_f1: 0.5079
 epoch: 75, train_loss: 0.8788, test_loss: 1.1078, test_f1: 0.5320
 epoch: 76, train_loss: 0.8588, test_loss: 1.1229, test_f1: 0.4743
 epoch: 77, train_loss: 0.8632, test_loss: 1.1266, test_f1: 0.4487
 epoch: 78, train_loss: 0.8721, test_loss: 1.1087, test_f1: 0.5255
 epoch: 79, train_loss: 0.8624, test_loss: 1.1074, test_f1: 0.4860
 epoch: 80, train_loss: 0.8629, test_loss: 1.0957, test_f1: 0.4971
 epoch: 81, train_loss: 0.8674, test_loss: 1.0943, test_f1: 0.4749
 epoch: 82, train_loss: 0.8466, test_loss: 1.0814, test_f1: 0.4886
 epoch: 83, train_loss: 0.8574, test_loss: 1.1113, test_f1: 0.4665
 epoch: 84, train_loss: 0.8514, test_loss: 1.1127, test_f1: 0.4909
 epoch: 85, train_loss: 0.8354, test_loss: 1.1029, test_f1: 0.4908
 epoch: 86, train_loss: 0.8526, test_loss: 1.0854, test_f1: 0.4774
 epoch: 87, train_loss: 0.8613, test_loss: 1.1086, test_f1: 0.4783
 epoch: 88, train_loss: 0.8612, test_loss: 1.0981, test_f1: 0.5302
 epoch: 89, train_loss: 0.8458, test_loss: 1.1160, test_f1: 0.5106
 epoch: 90, train_loss: 0.9074, test_loss: 1.2015, test_f1: 0.4991
 epoch: 91, train_loss: 0.8550, test_loss: 1.1000, test_f1: 0.4530
 epoch: 92, train_loss: 0.8767, test_loss: 1.0975, test_f1: 0.4960
 epoch: 93, train_loss: 0.8445, test_loss: 1.1184, test_f1: 0.4813
 epoch: 94, train_loss: 0.8649, test_loss: 1.1122, test_f1: 0.4701
 epoch: 95, train_loss: 0.8422, test_loss: 1.1073, test_f1: 0.4463
 epoch: 96, train_loss: 0.8563, test_loss: 1.1137, test_f1: 0.4664
 epoch: 97, train_loss: 0.8448, test_loss: 1.1139, test_f1: 0.4582
 epoch: 98, train_loss: 0.8563, test_loss: 1.1026, test_f1: 0.4823
 epoch: 99, train_loss: 0.8556, test_loss: 1.1169, test_f1: 0.4803
##################ITERATION #8 ****************************************
 epoch: 0, train_loss: 1.3020, test_loss: 1.3918, test_f1: 0.2319
 epoch: 1, train_loss: 1.2643, test_loss: 1.3739, test_f1: 0.2329
 epoch: 2, train_loss: 1.2346, test_loss: 1.3429, test_f1: 0.2628
 epoch: 3, train_loss: 1.2297, test_loss: 1.3466, test_f1: 0.2628
 epoch: 4, train_loss: 1.2143, test_loss: 1.3470, test_f1: 0.2612
 epoch: 5, train_loss: 1.2127, test_loss: 1.3380, test_f1: 0.2893
 epoch: 6, train_loss: 1.2077, test_loss: 1.3212, test_f1: 0.2755
 epoch: 7, train_loss: 1.1892, test_loss: 1.2944, test_f1: 0.2699
 epoch: 8, train_loss: 1.1652, test_loss: 1.2924, test_f1: 0.3402
 epoch: 9, train_loss: 1.1526, test_loss: 1.2805, test_f1: 0.3223
 epoch: 10, train_loss: 1.1397, test_loss: 1.2754, test_f1: 0.3231
 epoch: 11, train_loss: 1.1218, test_loss: 1.2520, test_f1: 0.3817
 epoch: 12, train_loss: 1.1275, test_loss: 1.2522, test_f1: 0.3800
 epoch: 13, train_loss: 1.1208, test_loss: 1.2386, test_f1: 0.3868
 epoch: 14, train_loss: 1.0991, test_loss: 1.2482, test_f1: 0.3901
 epoch: 15, train_loss: 1.0951, test_loss: 1.2565, test_f1: 0.3889
 epoch: 16, train_loss: 1.0864, test_loss: 1.2022, test_f1: 0.4428
 epoch: 17, train_loss: 1.0615, test_loss: 1.1878, test_f1: 0.4282
 epoch: 18, train_loss: 1.0616, test_loss: 1.1819, test_f1: 0.4690
 epoch: 19, train_loss: 1.0505, test_loss: 1.1875, test_f1: 0.4468
 epoch: 20, train_loss: 1.0421, test_loss: 1.1869, test_f1: 0.4722
 epoch: 21, train_loss: 1.0396, test_loss: 1.1772, test_f1: 0.4661
 epoch: 22, train_loss: 1.0169, test_loss: 1.1746, test_f1: 0.4783
 epoch: 23, train_loss: 1.0218, test_loss: 1.1816, test_f1: 0.4695
 epoch: 24, train_loss: 1.0100, test_loss: 1.1589, test_f1: 0.5142
 epoch: 25, train_loss: 0.9927, test_loss: 1.1655, test_f1: 0.4931
 epoch: 26, train_loss: 1.0006, test_loss: 1.1586, test_f1: 0.4915
 epoch: 27, train_loss: 0.9960, test_loss: 1.1364, test_f1: 0.5106
 epoch: 28, train_loss: 0.9978, test_loss: 1.1408, test_f1: 0.5051
 epoch: 29, train_loss: 0.9727, test_loss: 1.1316, test_f1: 0.4973
 epoch: 30, train_loss: 0.9806, test_loss: 1.1425, test_f1: 0.4739
 epoch: 31, train_loss: 0.9723, test_loss: 1.1531, test_f1: 0.5035
 epoch: 32, train_loss: 0.9590, test_loss: 1.1375, test_f1: 0.5007
 epoch: 33, train_loss: 0.9738, test_loss: 1.1589, test_f1: 0.5093
 epoch: 34, train_loss: 0.9523, test_loss: 1.2283, test_f1: 0.4949
 epoch: 35, train_loss: 0.9503, test_loss: 1.1691, test_f1: 0.5101
 epoch: 36, train_loss: 0.9543, test_loss: 1.1600, test_f1: 0.4897
 epoch: 37, train_loss: 0.9401, test_loss: 1.1406, test_f1: 0.4851
 epoch: 38, train_loss: 0.9494, test_loss: 1.1537, test_f1: 0.5214
 epoch: 39, train_loss: 0.9510, test_loss: 1.1517, test_f1: 0.5297
 epoch: 40, train_loss: 0.9288, test_loss: 1.1827, test_f1: 0.4987
 epoch: 41, train_loss: 0.9232, test_loss: 1.1452, test_f1: 0.5212
 epoch: 42, train_loss: 0.9174, test_loss: 1.1647, test_f1: 0.5091
 epoch: 43, train_loss: 0.9302, test_loss: 1.1706, test_f1: 0.5135
 epoch: 44, train_loss: 0.9162, test_loss: 1.1476, test_f1: 0.5013
 epoch: 45, train_loss: 0.9275, test_loss: 1.1594, test_f1: 0.5138
 epoch: 46, train_loss: 0.9144, test_loss: 1.1860, test_f1: 0.4881
 epoch: 47, train_loss: 0.9103, test_loss: 1.1482, test_f1: 0.5063
 epoch: 48, train_loss: 0.9062, test_loss: 1.1763, test_f1: 0.5085
 epoch: 49, train_loss: 0.9020, test_loss: 1.1697, test_f1: 0.5097
 epoch: 50, train_loss: 0.8997, test_loss: 1.1858, test_f1: 0.5235
 epoch: 51, train_loss: 0.8779, test_loss: 1.1552, test_f1: 0.5182
 epoch: 52, train_loss: 0.8856, test_loss: 1.1320, test_f1: 0.5305
 epoch: 53, train_loss: 0.8795, test_loss: 1.1634, test_f1: 0.5042
 epoch: 54, train_loss: 0.8838, test_loss: 1.1696, test_f1: 0.5150
 epoch: 55, train_loss: 0.8778, test_loss: 1.1400, test_f1: 0.5366
 epoch: 56, train_loss: 0.8705, test_loss: 1.1437, test_f1: 0.5499
 epoch: 57, train_loss: 0.8691, test_loss: 1.1361, test_f1: 0.5395
 epoch: 58, train_loss: 0.8754, test_loss: 1.1265, test_f1: 0.5151
 epoch: 59, train_loss: 0.8720, test_loss: 1.1202, test_f1: 0.5265
 epoch: 60, train_loss: 0.8811, test_loss: 1.1202, test_f1: 0.5304
 epoch: 61, train_loss: 0.8674, test_loss: 1.1233, test_f1: 0.5371
 epoch: 62, train_loss: 0.8666, test_loss: 1.1233, test_f1: 0.5282
 epoch: 63, train_loss: 0.8753, test_loss: 1.1173, test_f1: 0.5292
 epoch: 64, train_loss: 0.8747, test_loss: 1.1071, test_f1: 0.5397
 epoch: 65, train_loss: 0.8571, test_loss: 1.1104, test_f1: 0.5338
 epoch: 66, train_loss: 0.8610, test_loss: 1.1222, test_f1: 0.5310
 epoch: 67, train_loss: 0.8581, test_loss: 1.1184, test_f1: 0.5472
 epoch: 68, train_loss: 0.8637, test_loss: 1.1498, test_f1: 0.5354
 epoch: 69, train_loss: 0.8679, test_loss: 1.1699, test_f1: 0.5112
 epoch: 70, train_loss: 0.8589, test_loss: 1.1492, test_f1: 0.5234
 epoch: 71, train_loss: 0.8615, test_loss: 1.1290, test_f1: 0.5325
 epoch: 72, train_loss: 0.8597, test_loss: 1.1328, test_f1: 0.5416
 epoch: 73, train_loss: 0.8654, test_loss: 1.1538, test_f1: 0.5445
 epoch: 74, train_loss: 0.8332, test_loss: 1.1610, test_f1: 0.5366
 epoch: 75, train_loss: 0.8493, test_loss: 1.1754, test_f1: 0.5297
 epoch: 76, train_loss: 0.8699, test_loss: 1.1566, test_f1: 0.5363
 epoch: 77, train_loss: 0.8460, test_loss: 1.1465, test_f1: 0.5443
 epoch: 78, train_loss: 0.8405, test_loss: 1.1528, test_f1: 0.5416
 epoch: 79, train_loss: 0.8485, test_loss: 1.1332, test_f1: 0.5348
 epoch: 80, train_loss: 0.8397, test_loss: 1.1492, test_f1: 0.5387
 epoch: 81, train_loss: 0.8464, test_loss: 1.1703, test_f1: 0.5465
 epoch: 82, train_loss: 0.8364, test_loss: 1.1508, test_f1: 0.5538
 epoch: 83, train_loss: 0.8404, test_loss: 1.1632, test_f1: 0.5580
 epoch: 84, train_loss: 0.8432, test_loss: 1.1614, test_f1: 0.5314
 epoch: 85, train_loss: 0.8564, test_loss: 1.1479, test_f1: 0.5481
 epoch: 86, train_loss: 0.8354, test_loss: 1.1576, test_f1: 0.5408
 epoch: 87, train_loss: 0.8476, test_loss: 1.1726, test_f1: 0.5328
 epoch: 88, train_loss: 0.8373, test_loss: 1.1785, test_f1: 0.5193
 epoch: 89, train_loss: 0.8276, test_loss: 1.1673, test_f1: 0.5411
 epoch: 90, train_loss: 0.8310, test_loss: 1.1652, test_f1: 0.5409
 epoch: 91, train_loss: 0.8202, test_loss: 1.1739, test_f1: 0.5522
 epoch: 92, train_loss: 0.8371, test_loss: 1.1617, test_f1: 0.5445
 epoch: 93, train_loss: 0.8364, test_loss: 1.1883, test_f1: 0.5419
 epoch: 94, train_loss: 0.8312, test_loss: 1.1723, test_f1: 0.5492
 epoch: 95, train_loss: 0.8397, test_loss: 1.1765, test_f1: 0.5544
 epoch: 96, train_loss: 0.8128, test_loss: 1.1804, test_f1: 0.5318
 epoch: 97, train_loss: 0.8198, test_loss: 1.1696, test_f1: 0.5301
 epoch: 98, train_loss: 0.8168, test_loss: 1.2118, test_f1: 0.5381
 epoch: 99, train_loss: 0.8160, test_loss: 1.2026, test_f1: 0.5399
##################ITERATION #9 ****************************************
 epoch: 0, train_loss: 2.2874, test_loss: 1.7791, test_f1: 0.0523
 epoch: 1, train_loss: 1.5224, test_loss: 1.4863, test_f1: 0.1968
 epoch: 2, train_loss: 1.3955, test_loss: 1.4288, test_f1: 0.2431
 epoch: 3, train_loss: 1.3307, test_loss: 1.4253, test_f1: 0.2628
 epoch: 4, train_loss: 1.2763, test_loss: 1.3900, test_f1: 0.2680
 epoch: 5, train_loss: 1.2583, test_loss: 1.3794, test_f1: 0.2917
 epoch: 6, train_loss: 1.2470, test_loss: 1.3771, test_f1: 0.2727
 epoch: 7, train_loss: 1.2480, test_loss: 1.3422, test_f1: 0.2796
 epoch: 8, train_loss: 1.2280, test_loss: 1.3240, test_f1: 0.2921
 epoch: 9, train_loss: 1.2059, test_loss: 1.2890, test_f1: 0.3094
 epoch: 10, train_loss: 1.1828, test_loss: 1.3114, test_f1: 0.3124
 epoch: 11, train_loss: 1.1860, test_loss: 1.2770, test_f1: 0.3095
 epoch: 12, train_loss: 1.1582, test_loss: 1.2485, test_f1: 0.3249
 epoch: 13, train_loss: 1.1619, test_loss: 1.2674, test_f1: 0.3428
 epoch: 14, train_loss: 1.1392, test_loss: 1.2687, test_f1: 0.3185
 epoch: 15, train_loss: 1.1356, test_loss: 1.2674, test_f1: 0.3579
 epoch: 16, train_loss: 1.1101, test_loss: 1.2631, test_f1: 0.3506
 epoch: 17, train_loss: 1.1191, test_loss: 1.2477, test_f1: 0.3647
 epoch: 18, train_loss: 1.1020, test_loss: 1.2668, test_f1: 0.3443
 epoch: 19, train_loss: 1.1109, test_loss: 1.2634, test_f1: 0.3956
 epoch: 20, train_loss: 1.0960, test_loss: 1.2432, test_f1: 0.4196
 epoch: 21, train_loss: 1.0742, test_loss: 1.2169, test_f1: 0.4233
 epoch: 22, train_loss: 1.0815, test_loss: 1.2106, test_f1: 0.4102
 epoch: 23, train_loss: 1.0811, test_loss: 1.2014, test_f1: 0.4109
 epoch: 24, train_loss: 1.0732, test_loss: 1.2040, test_f1: 0.4271
 epoch: 25, train_loss: 1.0634, test_loss: 1.1987, test_f1: 0.4385
 epoch: 26, train_loss: 1.0634, test_loss: 1.2125, test_f1: 0.4273
 epoch: 27, train_loss: 1.0502, test_loss: 1.2221, test_f1: 0.4454
 epoch: 28, train_loss: 1.0467, test_loss: 1.2169, test_f1: 0.4293
 epoch: 29, train_loss: 1.0465, test_loss: 1.1989, test_f1: 0.4371
 epoch: 30, train_loss: 1.0429, test_loss: 1.1933, test_f1: 0.4525
 epoch: 31, train_loss: 1.0282, test_loss: 1.2037, test_f1: 0.4584
 epoch: 32, train_loss: 1.0423, test_loss: 1.2065, test_f1: 0.4532
 epoch: 33, train_loss: 1.0272, test_loss: 1.2165, test_f1: 0.4565
 epoch: 34, train_loss: 1.0160, test_loss: 1.2159, test_f1: 0.4832
 epoch: 35, train_loss: 1.0249, test_loss: 1.2079, test_f1: 0.4836
 epoch: 36, train_loss: 1.0214, test_loss: 1.1885, test_f1: 0.4729
 epoch: 37, train_loss: 1.0118, test_loss: 1.1925, test_f1: 0.4724
 epoch: 38, train_loss: 1.0202, test_loss: 1.2336, test_f1: 0.4752
 epoch: 39, train_loss: 0.9918, test_loss: 1.1938, test_f1: 0.4809
 epoch: 40, train_loss: 1.0090, test_loss: 1.1826, test_f1: 0.4833
 epoch: 41, train_loss: 0.9850, test_loss: 1.1632, test_f1: 0.4802
 epoch: 42, train_loss: 0.9923, test_loss: 1.2117, test_f1: 0.4707
 epoch: 43, train_loss: 0.9791, test_loss: 1.1784, test_f1: 0.4683
 epoch: 44, train_loss: 0.9811, test_loss: 1.1627, test_f1: 0.5013
 epoch: 45, train_loss: 0.9836, test_loss: 1.1913, test_f1: 0.5284
 epoch: 46, train_loss: 0.9790, test_loss: 1.2080, test_f1: 0.5236
 epoch: 47, train_loss: 0.9590, test_loss: 1.2000, test_f1: 0.4980
 epoch: 48, train_loss: 0.9612, test_loss: 1.1792, test_f1: 0.5285
 epoch: 49, train_loss: 0.9590, test_loss: 1.1759, test_f1: 0.5270
 epoch: 50, train_loss: 0.9560, test_loss: 1.2315, test_f1: 0.4956
 epoch: 51, train_loss: 0.9616, test_loss: 1.2089, test_f1: 0.4835
 epoch: 52, train_loss: 0.9610, test_loss: 1.2089, test_f1: 0.4717
 epoch: 53, train_loss: 0.9457, test_loss: 1.2010, test_f1: 0.4943
 epoch: 54, train_loss: 0.9550, test_loss: 1.2011, test_f1: 0.5035
 epoch: 55, train_loss: 0.9356, test_loss: 1.2372, test_f1: 0.5221
 epoch: 56, train_loss: 0.9395, test_loss: 1.2294, test_f1: 0.5184
 epoch: 57, train_loss: 0.9272, test_loss: 1.2470, test_f1: 0.4886
 epoch: 58, train_loss: 0.9432, test_loss: 1.2581, test_f1: 0.5032
 epoch: 59, train_loss: 0.9368, test_loss: 1.2025, test_f1: 0.5052
 epoch: 60, train_loss: 0.9263, test_loss: 1.2422, test_f1: 0.4874
 epoch: 61, train_loss: 0.9273, test_loss: 1.2328, test_f1: 0.5126
 epoch: 62, train_loss: 0.9296, test_loss: 1.2206, test_f1: 0.5195
 epoch: 63, train_loss: 0.9382, test_loss: 1.2550, test_f1: 0.5047
 epoch: 64, train_loss: 0.9253, test_loss: 1.2494, test_f1: 0.4983
 epoch: 65, train_loss: 0.9156, test_loss: 1.2178, test_f1: 0.5259
 epoch: 66, train_loss: 0.9345, test_loss: 1.2288, test_f1: 0.5244
 epoch: 67, train_loss: 0.9351, test_loss: 1.2365, test_f1: 0.5227
 epoch: 68, train_loss: 0.9189, test_loss: 1.2683, test_f1: 0.5153
 epoch: 69, train_loss: 0.9336, test_loss: 1.2552, test_f1: 0.5142
 epoch: 70, train_loss: 0.9224, test_loss: 1.2468, test_f1: 0.4991
 epoch: 71, train_loss: 0.9180, test_loss: 1.2644, test_f1: 0.4983
 epoch: 72, train_loss: 0.9059, test_loss: 1.2876, test_f1: 0.5048
 epoch: 73, train_loss: 0.9137, test_loss: 1.2875, test_f1: 0.4964
 epoch: 74, train_loss: 0.9151, test_loss: 1.2909, test_f1: 0.4843
 epoch: 75, train_loss: 0.9052, test_loss: 1.2303, test_f1: 0.5127
 epoch: 76, train_loss: 0.8900, test_loss: 1.1998, test_f1: 0.5114
 epoch: 77, train_loss: 0.8895, test_loss: 1.2525, test_f1: 0.5136
 epoch: 78, train_loss: 0.9001, test_loss: 1.2866, test_f1: 0.4890
 epoch: 79, train_loss: 0.9123, test_loss: 1.2594, test_f1: 0.4843
 epoch: 80, train_loss: 0.9063, test_loss: 1.2355, test_f1: 0.4907
 epoch: 81, train_loss: 0.8850, test_loss: 1.2355, test_f1: 0.5071
 epoch: 82, train_loss: 0.8947, test_loss: 1.2668, test_f1: 0.5020
 epoch: 83, train_loss: 0.8990, test_loss: 1.3215, test_f1: 0.5248
 epoch: 84, train_loss: 0.8882, test_loss: 1.2972, test_f1: 0.5207
 epoch: 85, train_loss: 0.8857, test_loss: 1.2768, test_f1: 0.5138
 epoch: 86, train_loss: 0.8931, test_loss: 1.3115, test_f1: 0.5175
 epoch: 87, train_loss: 0.8897, test_loss: 1.3151, test_f1: 0.5116
 epoch: 88, train_loss: 0.8988, test_loss: 1.3464, test_f1: 0.5164
 epoch: 89, train_loss: 0.8779, test_loss: 1.3286, test_f1: 0.4870
 epoch: 90, train_loss: 0.8931, test_loss: 1.3112, test_f1: 0.4821
 epoch: 91, train_loss: 0.8746, test_loss: 1.3715, test_f1: 0.4819
 epoch: 92, train_loss: 0.8853, test_loss: 1.3996, test_f1: 0.4740
 epoch: 93, train_loss: 0.8890, test_loss: 1.3877, test_f1: 0.4729
 epoch: 94, train_loss: 0.8771, test_loss: 1.3343, test_f1: 0.5039
 epoch: 95, train_loss: 0.8742, test_loss: 1.3631, test_f1: 0.4835
 epoch: 96, train_loss: 0.8628, test_loss: 1.3263, test_f1: 0.5051
 epoch: 97, train_loss: 0.8759, test_loss: 1.3583, test_f1: 0.4945
 epoch: 98, train_loss: 0.8749, test_loss: 1.3739, test_f1: 0.5190
 epoch: 99, train_loss: 0.8730, test_loss: 1.3766, test_f1: 0.4971

Training completed in 342.03 seconds
Best F1: 0.5684 at epoch 87
Mean F1 across iterations: 0.5328  0.0248
========================FINAL RESULTS================================
FEGIN weighted F1: 0.5684  0.0248
python main.py --data ltspice_demos --representation component_component --model FEGIN --layers 4 --hiddens 16 --batch_size 128 --lr 0.001 --emb_size 250 --epochs 100 --save_appendix component_component_L4_H16_BS128_LR0.001_E250 --no_val
-----



STDERR:
  File "main.py", line 370, in <module>
    main()
  File "main.py", line 254, in main
    dataset = dataset_class(
  File "/home/philip/projects/ltspice_examples_code_repo/Circuit-Completion-Using-GNNs/component_classification_with_link_prediction_head/evaluation/FEGIN/kernel/circuit_datasets.py", line 15, in __init__
    self.data, self.slices = torch.load(self.processed_paths[0])
  File "/home/philip/.local/lib/python3.8/site-packages/torch/serialization.py", line 1040, in load
    warnings.warn(
  File "/usr/lib/python3.8/warnings.py", line 109, in _showwarnmsg
    sw(msg.message, msg.category, msg.filename, msg.lineno,
  File "main.py", line 47, in warn_with_traceback
    traceback.print_stack(file=log)
/home/philip/projects/ltspice_examples_code_repo/Circuit-Completion-Using-GNNs/component_classification_with_link_prediction_head/evaluation/FEGIN/kernel/circuit_datasets.py:15: FutureWarning: You are using `torch.load` with `weights_only=False` (the current default value), which uses the default pickle module implicitly. It is possible to construct malicious pickle data which will execute arbitrary code during unpickling (See https://github.com/pytorch/pytorch/blob/main/SECURITY.md#untrusted-models for more details). In a future release, the default value for `weights_only` will be flipped to `True`. This limits the functions that could be executed during unpickling. Arbitrary objects will no longer be allowed to be loaded via this mode unless they are explicitly allowlisted by the user via `torch.serialization.add_safe_globals`. We recommend you start setting `weights_only=True` for any use case where you don't have full control of the loaded file. Please open an issue on GitHub for any issues related to this experimental feature.
  self.data, self.slices = torch.load(self.processed_paths[0])
