STDOUT:
Results will be saved in /home/philip/projects/ltspice_examples_code_repo/Circuit-Completion-Using-GNNs/component_classification_with_link_prediction_head/evaluation/FEGIN/results/model_FEGIN_dataset_ltspice_demos
Command line input: python main.py --data ltspice_demos --representation component_pin_net --model FEGIN --layers 2 --hiddens 128 --batch_size 64 --lr 0.001 --emb_size 128 --epochs 100 --save_appendix component_pin_net_L2_H128_BS64_LR0.001_E128 --no_val
 is saved.
-----
ltspice_demos - FEGIN
Using 2 layers, 128 hidden units, h = 2
Loading component_pin_net representation dataset
ENTERED
Training FEGIN on component_pin_net representation
Train: 1565, Test: 383
##################ITERATION #0 ****************************************
 epoch: 0, train_loss: 1.2124, test_loss: 1.3817, test_f1: 0.1365
 epoch: 1, train_loss: 1.0392, test_loss: 1.1148, test_f1: 0.4280
 epoch: 2, train_loss: 0.9919, test_loss: 1.0584, test_f1: 0.4635
 epoch: 3, train_loss: 0.9536, test_loss: 1.0254, test_f1: 0.5211
 epoch: 4, train_loss: 0.9327, test_loss: 1.0143, test_f1: 0.5340
 epoch: 5, train_loss: 0.9099, test_loss: 0.9962, test_f1: 0.5390
 epoch: 6, train_loss: 0.8735, test_loss: 0.9977, test_f1: 0.5784
 epoch: 7, train_loss: 0.8499, test_loss: 0.9448, test_f1: 0.5786
 epoch: 8, train_loss: 0.8233, test_loss: 0.9253, test_f1: 0.5783
 epoch: 9, train_loss: 0.8166, test_loss: 0.9214, test_f1: 0.6100
 epoch: 10, train_loss: 0.7671, test_loss: 0.9353, test_f1: 0.6321
 epoch: 11, train_loss: 0.7653, test_loss: 0.9038, test_f1: 0.5895
 epoch: 12, train_loss: 0.7298, test_loss: 0.9044, test_f1: 0.6262
 epoch: 13, train_loss: 0.7016, test_loss: 0.9834, test_f1: 0.5812
 epoch: 14, train_loss: 0.6971, test_loss: 0.9606, test_f1: 0.6230
 epoch: 15, train_loss: 0.6767, test_loss: 0.9561, test_f1: 0.5982
 epoch: 16, train_loss: 0.6790, test_loss: 0.9341, test_f1: 0.6221
 epoch: 17, train_loss: 0.6519, test_loss: 0.9720, test_f1: 0.6129
 epoch: 18, train_loss: 0.6507, test_loss: 0.9978, test_f1: 0.6399
 epoch: 19, train_loss: 0.6034, test_loss: 0.8850, test_f1: 0.6878
 epoch: 20, train_loss: 0.5872, test_loss: 1.0170, test_f1: 0.6485
 epoch: 21, train_loss: 0.5642, test_loss: 0.9653, test_f1: 0.6608
 epoch: 22, train_loss: 0.5629, test_loss: 0.9720, test_f1: 0.6528
 epoch: 23, train_loss: 0.5595, test_loss: 0.9953, test_f1: 0.6498
 epoch: 24, train_loss: 0.5590, test_loss: 1.1217, test_f1: 0.6491
 epoch: 25, train_loss: 0.5280, test_loss: 1.0607, test_f1: 0.6510
 epoch: 26, train_loss: 0.5339, test_loss: 1.0595, test_f1: 0.6830
 epoch: 27, train_loss: 0.4917, test_loss: 1.1300, test_f1: 0.6173
 epoch: 28, train_loss: 0.5322, test_loss: 1.0655, test_f1: 0.6488
 epoch: 29, train_loss: 0.5103, test_loss: 1.0557, test_f1: 0.6842
 epoch: 30, train_loss: 0.4852, test_loss: 1.1281, test_f1: 0.6416
 epoch: 31, train_loss: 0.4792, test_loss: 1.1031, test_f1: 0.6469
 epoch: 32, train_loss: 0.4248, test_loss: 1.1856, test_f1: 0.6495
 epoch: 33, train_loss: 0.4584, test_loss: 1.2372, test_f1: 0.6418
 epoch: 34, train_loss: 0.4980, test_loss: 1.2603, test_f1: 0.6129
 epoch: 35, train_loss: 0.4231, test_loss: 1.2309, test_f1: 0.6023
 epoch: 36, train_loss: 0.4462, test_loss: 1.3152, test_f1: 0.6212
 epoch: 37, train_loss: 0.4392, test_loss: 1.3072, test_f1: 0.6447
 epoch: 38, train_loss: 0.3975, test_loss: 1.2484, test_f1: 0.6516
 epoch: 39, train_loss: 0.3975, test_loss: 1.3276, test_f1: 0.6178
 epoch: 40, train_loss: 0.4121, test_loss: 1.3709, test_f1: 0.6445
 epoch: 41, train_loss: 0.3710, test_loss: 1.4532, test_f1: 0.6251
 epoch: 42, train_loss: 0.3533, test_loss: 1.5034, test_f1: 0.6345
 epoch: 43, train_loss: 0.3843, test_loss: 1.5145, test_f1: 0.6407
 epoch: 44, train_loss: 0.3544, test_loss: 1.4479, test_f1: 0.6611
 epoch: 45, train_loss: 0.3538, test_loss: 1.4533, test_f1: 0.6166
 epoch: 46, train_loss: 0.3336, test_loss: 1.7207, test_f1: 0.6214
 epoch: 47, train_loss: 0.3549, test_loss: 1.6288, test_f1: 0.6229
 epoch: 48, train_loss: 0.3254, test_loss: 1.6222, test_f1: 0.5820
 epoch: 49, train_loss: 0.3615, test_loss: 1.6898, test_f1: 0.6343
 epoch: 50, train_loss: 0.3328, test_loss: 1.6630, test_f1: 0.6290
 epoch: 51, train_loss: 0.2803, test_loss: 1.7180, test_f1: 0.6349
 epoch: 52, train_loss: 0.2463, test_loss: 1.7255, test_f1: 0.6331
 epoch: 53, train_loss: 0.2632, test_loss: 1.7773, test_f1: 0.6286
 epoch: 54, train_loss: 0.2514, test_loss: 1.7568, test_f1: 0.6148
 epoch: 55, train_loss: 0.2404, test_loss: 1.8081, test_f1: 0.6269
 epoch: 56, train_loss: 0.2096, test_loss: 1.9468, test_f1: 0.6303
 epoch: 57, train_loss: 0.2200, test_loss: 1.8524, test_f1: 0.6228
 epoch: 58, train_loss: 0.2215, test_loss: 2.1782, test_f1: 0.6180
 epoch: 59, train_loss: 0.2597, test_loss: 1.9723, test_f1: 0.6333
 epoch: 60, train_loss: 0.2634, test_loss: 1.9221, test_f1: 0.6230
 epoch: 61, train_loss: 0.2285, test_loss: 2.0109, test_f1: 0.6252
 epoch: 62, train_loss: 0.1969, test_loss: 1.9014, test_f1: 0.6380
 epoch: 63, train_loss: 0.2066, test_loss: 1.8500, test_f1: 0.6619
 epoch: 64, train_loss: 0.2106, test_loss: 2.0483, test_f1: 0.6408
 epoch: 65, train_loss: 0.1984, test_loss: 2.0717, test_f1: 0.6414
 epoch: 66, train_loss: 0.1860, test_loss: 2.1166, test_f1: 0.6400
 epoch: 67, train_loss: 0.2047, test_loss: 2.0379, test_f1: 0.6150
 epoch: 68, train_loss: 0.1737, test_loss: 2.1784, test_f1: 0.6328
 epoch: 69, train_loss: 0.1840, test_loss: 2.1267, test_f1: 0.6066
 epoch: 70, train_loss: 0.1722, test_loss: 2.3578, test_f1: 0.6385
 epoch: 71, train_loss: 0.1700, test_loss: 2.2376, test_f1: 0.6243
 epoch: 72, train_loss: 0.1852, test_loss: 2.0819, test_f1: 0.6388
 epoch: 73, train_loss: 0.1852, test_loss: 2.1500, test_f1: 0.6304
 epoch: 74, train_loss: 0.1527, test_loss: 2.5331, test_f1: 0.6166
 epoch: 75, train_loss: 0.1752, test_loss: 2.5213, test_f1: 0.6163
 epoch: 76, train_loss: 0.1336, test_loss: 2.4387, test_f1: 0.6151
 epoch: 77, train_loss: 0.1748, test_loss: 2.5186, test_f1: 0.6195
 epoch: 78, train_loss: 0.1512, test_loss: 2.3433, test_f1: 0.6366
 epoch: 79, train_loss: 0.1595, test_loss: 2.5210, test_f1: 0.6332
 epoch: 80, train_loss: 0.2089, test_loss: 2.5048, test_f1: 0.6026
 epoch: 81, train_loss: 0.1500, test_loss: 2.3987, test_f1: 0.6063
 epoch: 82, train_loss: 0.1396, test_loss: 2.4749, test_f1: 0.6172
 epoch: 83, train_loss: 0.1663, test_loss: 2.4168, test_f1: 0.6031
 epoch: 84, train_loss: 0.1692, test_loss: 2.4412, test_f1: 0.6302
 epoch: 85, train_loss: 0.1533, test_loss: 2.5391, test_f1: 0.6125
 epoch: 86, train_loss: 0.1448, test_loss: 2.7576, test_f1: 0.6112
 epoch: 87, train_loss: 0.1551, test_loss: 2.5827, test_f1: 0.6189
 epoch: 88, train_loss: 0.1525, test_loss: 2.7993, test_f1: 0.6090
 epoch: 89, train_loss: 0.1754, test_loss: 2.4842, test_f1: 0.6419
 epoch: 90, train_loss: 0.1271, test_loss: 2.5804, test_f1: 0.6089
 epoch: 91, train_loss: 0.1387, test_loss: 2.6341, test_f1: 0.6264
 epoch: 92, train_loss: 0.1797, test_loss: 2.6205, test_f1: 0.6384
 epoch: 93, train_loss: 0.1429, test_loss: 2.9049, test_f1: 0.5928
 epoch: 94, train_loss: 0.1446, test_loss: 2.5331, test_f1: 0.6156
 epoch: 95, train_loss: 0.1206, test_loss: 2.6804, test_f1: 0.6168
 epoch: 96, train_loss: 0.1458, test_loss: 3.0235, test_f1: 0.6388
 epoch: 97, train_loss: 0.1137, test_loss: 2.9519, test_f1: 0.6173
 epoch: 98, train_loss: 0.1503, test_loss: 2.8446, test_f1: 0.6148
 epoch: 99, train_loss: 0.1322, test_loss: 2.8135, test_f1: 0.6053
##################ITERATION #1 ****************************************
 epoch: 0, train_loss: 1.0789, test_loss: 1.4728, test_f1: 0.2281
 epoch: 1, train_loss: 0.9563, test_loss: 1.1884, test_f1: 0.4447
 epoch: 2, train_loss: 0.9000, test_loss: 1.0176, test_f1: 0.4849
 epoch: 3, train_loss: 0.8639, test_loss: 1.0129, test_f1: 0.5578
 epoch: 4, train_loss: 0.8243, test_loss: 1.0315, test_f1: 0.5514
 epoch: 5, train_loss: 0.7800, test_loss: 1.0387, test_f1: 0.5484
 epoch: 6, train_loss: 0.7728, test_loss: 1.1096, test_f1: 0.5316
 epoch: 7, train_loss: 0.7129, test_loss: 1.0629, test_f1: 0.5657
 epoch: 8, train_loss: 0.7152, test_loss: 1.0529, test_f1: 0.5579
 epoch: 9, train_loss: 0.6968, test_loss: 1.0643, test_f1: 0.6237
 epoch: 10, train_loss: 0.6819, test_loss: 1.0301, test_f1: 0.6136
 epoch: 11, train_loss: 0.6736, test_loss: 1.0268, test_f1: 0.6057
 epoch: 12, train_loss: 0.6280, test_loss: 1.0749, test_f1: 0.5683
 epoch: 13, train_loss: 0.6225, test_loss: 1.1015, test_f1: 0.6058
 epoch: 14, train_loss: 0.6148, test_loss: 1.0617, test_f1: 0.5891
 epoch: 15, train_loss: 0.6017, test_loss: 1.0384, test_f1: 0.6096
 epoch: 16, train_loss: 0.5630, test_loss: 1.1962, test_f1: 0.5949
 epoch: 17, train_loss: 0.5617, test_loss: 1.5596, test_f1: 0.5639
 epoch: 18, train_loss: 0.5665, test_loss: 1.1464, test_f1: 0.5620
 epoch: 19, train_loss: 0.5267, test_loss: 1.2776, test_f1: 0.5831
 epoch: 20, train_loss: 0.5246, test_loss: 1.1834, test_f1: 0.6759
 epoch: 21, train_loss: 0.5342, test_loss: 1.4663, test_f1: 0.5791
 epoch: 22, train_loss: 0.4814, test_loss: 1.3163, test_f1: 0.6133
 epoch: 23, train_loss: 0.5171, test_loss: 1.2995, test_f1: 0.5956
 epoch: 24, train_loss: 0.4909, test_loss: 1.4128, test_f1: 0.5840
 epoch: 25, train_loss: 0.4502, test_loss: 1.5235, test_f1: 0.6145
 epoch: 26, train_loss: 0.4581, test_loss: 1.3915, test_f1: 0.6036
 epoch: 27, train_loss: 0.4679, test_loss: 1.3592, test_f1: 0.5863
 epoch: 28, train_loss: 0.4571, test_loss: 1.3057, test_f1: 0.6053
 epoch: 29, train_loss: 0.4235, test_loss: 1.7887, test_f1: 0.5727
 epoch: 30, train_loss: 0.4460, test_loss: 1.4650, test_f1: 0.6110
 epoch: 31, train_loss: 0.4211, test_loss: 1.8606, test_f1: 0.5401
 epoch: 32, train_loss: 0.4124, test_loss: 1.4739, test_f1: 0.6334
 epoch: 33, train_loss: 0.4413, test_loss: 1.5323, test_f1: 0.5790
 epoch: 34, train_loss: 0.4334, test_loss: 1.4257, test_f1: 0.6030
 epoch: 35, train_loss: 0.3913, test_loss: 1.4014, test_f1: 0.6264
 epoch: 36, train_loss: 0.3807, test_loss: 1.4429, test_f1: 0.6251
 epoch: 37, train_loss: 0.3832, test_loss: 1.6411, test_f1: 0.6293
 epoch: 38, train_loss: 0.3342, test_loss: 1.6119, test_f1: 0.5906
 epoch: 39, train_loss: 0.3458, test_loss: 1.6258, test_f1: 0.6236
 epoch: 40, train_loss: 0.3235, test_loss: 1.8250, test_f1: 0.5923
 epoch: 41, train_loss: 0.3581, test_loss: 1.6847, test_f1: 0.6167
 epoch: 42, train_loss: 0.2996, test_loss: 1.6441, test_f1: 0.6439
 epoch: 43, train_loss: 0.3116, test_loss: 1.7163, test_f1: 0.6088
 epoch: 44, train_loss: 0.3085, test_loss: 1.8136, test_f1: 0.6212
 epoch: 45, train_loss: 0.3393, test_loss: 2.4984, test_f1: 0.5243
 epoch: 46, train_loss: 0.2963, test_loss: 1.6407, test_f1: 0.6476
 epoch: 47, train_loss: 0.3062, test_loss: 1.9548, test_f1: 0.5883
 epoch: 48, train_loss: 0.2888, test_loss: 1.9365, test_f1: 0.5721
 epoch: 49, train_loss: 0.3029, test_loss: 2.0035, test_f1: 0.6017
 epoch: 50, train_loss: 0.2595, test_loss: 1.7461, test_f1: 0.6267
 epoch: 51, train_loss: 0.2479, test_loss: 1.8891, test_f1: 0.5923
 epoch: 52, train_loss: 0.2245, test_loss: 1.8328, test_f1: 0.6153
 epoch: 53, train_loss: 0.2005, test_loss: 1.9418, test_f1: 0.6211
 epoch: 54, train_loss: 0.2036, test_loss: 2.1846, test_f1: 0.5909
 epoch: 55, train_loss: 0.1993, test_loss: 1.9933, test_f1: 0.6544
 epoch: 56, train_loss: 0.1911, test_loss: 2.1467, test_f1: 0.6209
 epoch: 57, train_loss: 0.2034, test_loss: 2.1040, test_f1: 0.6047
 epoch: 58, train_loss: 0.2192, test_loss: 2.2045, test_f1: 0.6189
 epoch: 59, train_loss: 0.1758, test_loss: 2.1020, test_f1: 0.5943
 epoch: 60, train_loss: 0.1899, test_loss: 2.0674, test_f1: 0.6414
 epoch: 61, train_loss: 0.1886, test_loss: 2.0578, test_f1: 0.6486
 epoch: 62, train_loss: 0.1640, test_loss: 2.1984, test_f1: 0.6164
 epoch: 63, train_loss: 0.2002, test_loss: 1.9638, test_f1: 0.6519
 epoch: 64, train_loss: 0.1823, test_loss: 2.1149, test_f1: 0.6222
 epoch: 65, train_loss: 0.2006, test_loss: 2.2253, test_f1: 0.5883
 epoch: 66, train_loss: 0.1508, test_loss: 2.0869, test_f1: 0.6606
 epoch: 67, train_loss: 0.1876, test_loss: 2.1808, test_f1: 0.6417
 epoch: 68, train_loss: 0.1558, test_loss: 2.2997, test_f1: 0.5821
 epoch: 69, train_loss: 0.1369, test_loss: 2.4833, test_f1: 0.5851
 epoch: 70, train_loss: 0.1637, test_loss: 2.2944, test_f1: 0.6041
 epoch: 71, train_loss: 0.1430, test_loss: 2.4301, test_f1: 0.6139
 epoch: 72, train_loss: 0.1669, test_loss: 2.3650, test_f1: 0.5918
 epoch: 73, train_loss: 0.1549, test_loss: 2.4252, test_f1: 0.6143
 epoch: 74, train_loss: 0.1556, test_loss: 2.5560, test_f1: 0.6036
 epoch: 75, train_loss: 0.1539, test_loss: 2.6061, test_f1: 0.5975
 epoch: 76, train_loss: 0.1508, test_loss: 2.4183, test_f1: 0.6085
 epoch: 77, train_loss: 0.1350, test_loss: 2.6461, test_f1: 0.5874
 epoch: 78, train_loss: 0.1757, test_loss: 2.4056, test_f1: 0.6390
 epoch: 79, train_loss: 0.1756, test_loss: 2.3682, test_f1: 0.6215
 epoch: 80, train_loss: 0.1535, test_loss: 2.7182, test_f1: 0.5518
 epoch: 81, train_loss: 0.1556, test_loss: 2.4225, test_f1: 0.6128
 epoch: 82, train_loss: 0.1383, test_loss: 2.5234, test_f1: 0.6157
 epoch: 83, train_loss: 0.1417, test_loss: 2.6407, test_f1: 0.5748
 epoch: 84, train_loss: 0.1181, test_loss: 2.8311, test_f1: 0.5792
 epoch: 85, train_loss: 0.1327, test_loss: 2.6112, test_f1: 0.6114
 epoch: 86, train_loss: 0.1430, test_loss: 2.3993, test_f1: 0.6342
 epoch: 87, train_loss: 0.1246, test_loss: 2.7456, test_f1: 0.5777
 epoch: 88, train_loss: 0.1088, test_loss: 2.5171, test_f1: 0.6365
 epoch: 89, train_loss: 0.1326, test_loss: 2.7567, test_f1: 0.6057
 epoch: 90, train_loss: 0.1132, test_loss: 2.8148, test_f1: 0.5902
 epoch: 91, train_loss: 0.1158, test_loss: 3.0789, test_f1: 0.5801
 epoch: 92, train_loss: 0.1132, test_loss: 2.7315, test_f1: 0.6218
 epoch: 93, train_loss: 0.1206, test_loss: 3.2526, test_f1: 0.5839
 epoch: 94, train_loss: 0.1157, test_loss: 2.6533, test_f1: 0.6460
 epoch: 95, train_loss: 0.1315, test_loss: 3.0838, test_f1: 0.5867
 epoch: 96, train_loss: 0.1360, test_loss: 2.8777, test_f1: 0.6036
 epoch: 97, train_loss: 0.1189, test_loss: 2.8728, test_f1: 0.6074
 epoch: 98, train_loss: 0.1167, test_loss: 2.7244, test_f1: 0.6409
 epoch: 99, train_loss: 0.1198, test_loss: 2.8097, test_f1: 0.5799
##################ITERATION #2 ****************************************
 epoch: 0, train_loss: 1.1126, test_loss: 1.8081, test_f1: 0.1365
 epoch: 1, train_loss: 0.9883, test_loss: 1.2893, test_f1: 0.3282
 epoch: 2, train_loss: 0.9027, test_loss: 1.0747, test_f1: 0.5205
 epoch: 3, train_loss: 0.8502, test_loss: 1.0316, test_f1: 0.5597
 epoch: 4, train_loss: 0.8248, test_loss: 1.0422, test_f1: 0.5558
 epoch: 5, train_loss: 0.8072, test_loss: 1.0207, test_f1: 0.5968
 epoch: 6, train_loss: 0.7622, test_loss: 1.0081, test_f1: 0.5881
 epoch: 7, train_loss: 0.7490, test_loss: 1.0313, test_f1: 0.5717
 epoch: 8, train_loss: 0.7209, test_loss: 1.0403, test_f1: 0.6118
 epoch: 9, train_loss: 0.7101, test_loss: 1.1584, test_f1: 0.5748
 epoch: 10, train_loss: 0.6661, test_loss: 1.1201, test_f1: 0.5820
 epoch: 11, train_loss: 0.6796, test_loss: 1.0963, test_f1: 0.5960
 epoch: 12, train_loss: 0.6551, test_loss: 1.0891, test_f1: 0.5623
 epoch: 13, train_loss: 0.6182, test_loss: 1.1437, test_f1: 0.5398
 epoch: 14, train_loss: 0.6077, test_loss: 1.1261, test_f1: 0.5836
 epoch: 15, train_loss: 0.5801, test_loss: 1.1947, test_f1: 0.6226
 epoch: 16, train_loss: 0.5823, test_loss: 1.1095, test_f1: 0.5910
 epoch: 17, train_loss: 0.5752, test_loss: 1.1390, test_f1: 0.5874
 epoch: 18, train_loss: 0.5503, test_loss: 1.0919, test_f1: 0.6196
 epoch: 19, train_loss: 0.5413, test_loss: 1.2876, test_f1: 0.5620
 epoch: 20, train_loss: 0.5562, test_loss: 1.1873, test_f1: 0.6420
 epoch: 21, train_loss: 0.5132, test_loss: 1.1686, test_f1: 0.6311
 epoch: 22, train_loss: 0.5088, test_loss: 1.2653, test_f1: 0.6007
 epoch: 23, train_loss: 0.4892, test_loss: 1.2123, test_f1: 0.6122
 epoch: 24, train_loss: 0.4911, test_loss: 1.2850, test_f1: 0.5995
 epoch: 25, train_loss: 0.4884, test_loss: 1.2748, test_f1: 0.5809
 epoch: 26, train_loss: 0.4814, test_loss: 1.2169, test_f1: 0.6209
 epoch: 27, train_loss: 0.4396, test_loss: 1.4584, test_f1: 0.6234
 epoch: 28, train_loss: 0.4420, test_loss: 1.2927, test_f1: 0.6387
 epoch: 29, train_loss: 0.4496, test_loss: 1.2206, test_f1: 0.6413
 epoch: 30, train_loss: 0.4297, test_loss: 1.2174, test_f1: 0.6414
 epoch: 31, train_loss: 0.4017, test_loss: 1.5863, test_f1: 0.5588
 epoch: 32, train_loss: 0.3930, test_loss: 1.5200, test_f1: 0.5828
 epoch: 33, train_loss: 0.4152, test_loss: 1.4547, test_f1: 0.5690
 epoch: 34, train_loss: 0.4084, test_loss: 1.5518, test_f1: 0.5806
 epoch: 35, train_loss: 0.3924, test_loss: 1.4530, test_f1: 0.5781
 epoch: 36, train_loss: 0.3688, test_loss: 1.4783, test_f1: 0.6056
 epoch: 37, train_loss: 0.3559, test_loss: 1.4115, test_f1: 0.6086
 epoch: 38, train_loss: 0.3684, test_loss: 1.6069, test_f1: 0.6299
 epoch: 39, train_loss: 0.3422, test_loss: 1.7628, test_f1: 0.5279
 epoch: 40, train_loss: 0.3385, test_loss: 1.5416, test_f1: 0.6167
 epoch: 41, train_loss: 0.3335, test_loss: 1.7082, test_f1: 0.6488
 epoch: 42, train_loss: 0.3263, test_loss: 1.7108, test_f1: 0.5749
 epoch: 43, train_loss: 0.3160, test_loss: 1.7477, test_f1: 0.6076
 epoch: 44, train_loss: 0.3157, test_loss: 1.5740, test_f1: 0.6002
 epoch: 45, train_loss: 0.2891, test_loss: 1.8611, test_f1: 0.5709
 epoch: 46, train_loss: 0.2760, test_loss: 1.9180, test_f1: 0.5959
 epoch: 47, train_loss: 0.2731, test_loss: 1.7962, test_f1: 0.6026
 epoch: 48, train_loss: 0.2737, test_loss: 1.7171, test_f1: 0.6045
 epoch: 49, train_loss: 0.2731, test_loss: 1.7571, test_f1: 0.6200
 epoch: 50, train_loss: 0.2926, test_loss: 1.8958, test_f1: 0.6136
 epoch: 51, train_loss: 0.2518, test_loss: 1.6795, test_f1: 0.6266
 epoch: 52, train_loss: 0.2260, test_loss: 1.9483, test_f1: 0.6080
 epoch: 53, train_loss: 0.2056, test_loss: 1.8412, test_f1: 0.6164
 epoch: 54, train_loss: 0.2168, test_loss: 1.8657, test_f1: 0.6021
 epoch: 55, train_loss: 0.2128, test_loss: 1.8562, test_f1: 0.6240
 epoch: 56, train_loss: 0.1960, test_loss: 2.0654, test_f1: 0.5882
 epoch: 57, train_loss: 0.1882, test_loss: 2.0453, test_f1: 0.5927
 epoch: 58, train_loss: 0.2068, test_loss: 1.9326, test_f1: 0.6087
 epoch: 59, train_loss: 0.1896, test_loss: 1.9421, test_f1: 0.6096
 epoch: 60, train_loss: 0.1873, test_loss: 1.8850, test_f1: 0.6472
 epoch: 61, train_loss: 0.1852, test_loss: 2.0654, test_f1: 0.6187
 epoch: 62, train_loss: 0.1773, test_loss: 2.1077, test_f1: 0.5839
 epoch: 63, train_loss: 0.1607, test_loss: 2.1704, test_f1: 0.6195
 epoch: 64, train_loss: 0.1474, test_loss: 2.1041, test_f1: 0.6354
 epoch: 65, train_loss: 0.1603, test_loss: 2.2461, test_f1: 0.6061
 epoch: 66, train_loss: 0.1495, test_loss: 2.1226, test_f1: 0.6329
 epoch: 67, train_loss: 0.1915, test_loss: 2.2335, test_f1: 0.6299
 epoch: 68, train_loss: 0.1536, test_loss: 2.2222, test_f1: 0.6239
 epoch: 69, train_loss: 0.1345, test_loss: 2.2883, test_f1: 0.6107
 epoch: 70, train_loss: 0.1420, test_loss: 2.1355, test_f1: 0.6193
 epoch: 71, train_loss: 0.1387, test_loss: 2.2946, test_f1: 0.5981
 epoch: 72, train_loss: 0.1337, test_loss: 2.2939, test_f1: 0.6145
 epoch: 73, train_loss: 0.1364, test_loss: 2.3843, test_f1: 0.6154
 epoch: 74, train_loss: 0.1328, test_loss: 2.3482, test_f1: 0.6098
 epoch: 75, train_loss: 0.1498, test_loss: 2.3881, test_f1: 0.6045
 epoch: 76, train_loss: 0.1608, test_loss: 2.2123, test_f1: 0.6580
 epoch: 77, train_loss: 0.1193, test_loss: 2.4497, test_f1: 0.6179
 epoch: 78, train_loss: 0.1396, test_loss: 2.2925, test_f1: 0.6075
 epoch: 79, train_loss: 0.1308, test_loss: 2.4647, test_f1: 0.6296
 epoch: 80, train_loss: 0.1328, test_loss: 2.4564, test_f1: 0.6478
 epoch: 81, train_loss: 0.1448, test_loss: 2.3638, test_f1: 0.6702
 epoch: 82, train_loss: 0.1186, test_loss: 2.3444, test_f1: 0.6174
 epoch: 83, train_loss: 0.1240, test_loss: 2.3516, test_f1: 0.6350
 epoch: 84, train_loss: 0.1341, test_loss: 2.8209, test_f1: 0.5993
 epoch: 85, train_loss: 0.1360, test_loss: 2.5128, test_f1: 0.5854
 epoch: 86, train_loss: 0.1614, test_loss: 2.2057, test_f1: 0.6404
 epoch: 87, train_loss: 0.1309, test_loss: 2.6576, test_f1: 0.6065
 epoch: 88, train_loss: 0.1300, test_loss: 2.4700, test_f1: 0.6217
 epoch: 89, train_loss: 0.1248, test_loss: 2.5404, test_f1: 0.5996
 epoch: 90, train_loss: 0.0935, test_loss: 2.3937, test_f1: 0.6359
 epoch: 91, train_loss: 0.1099, test_loss: 2.4739, test_f1: 0.6299
 epoch: 92, train_loss: 0.1131, test_loss: 2.6138, test_f1: 0.6206
 epoch: 93, train_loss: 0.1262, test_loss: 2.6771, test_f1: 0.6030
 epoch: 94, train_loss: 0.1343, test_loss: 2.5050, test_f1: 0.6532
 epoch: 95, train_loss: 0.1312, test_loss: 2.4694, test_f1: 0.6643
 epoch: 96, train_loss: 0.1147, test_loss: 2.5957, test_f1: 0.6050
 epoch: 97, train_loss: 0.0873, test_loss: 2.6276, test_f1: 0.6389
 epoch: 98, train_loss: 0.1002, test_loss: 2.5846, test_f1: 0.6315
 epoch: 99, train_loss: 0.1206, test_loss: 2.7038, test_f1: 0.6188
##################ITERATION #3 ****************************************
 epoch: 0, train_loss: 1.2263, test_loss: 1.5163, test_f1: 0.2396
 epoch: 1, train_loss: 0.9452, test_loss: 1.1604, test_f1: 0.4834
 epoch: 2, train_loss: 0.8898, test_loss: 1.1083, test_f1: 0.4802
 epoch: 3, train_loss: 0.8740, test_loss: 1.0155, test_f1: 0.5985
 epoch: 4, train_loss: 0.8306, test_loss: 0.9881, test_f1: 0.6080
 epoch: 5, train_loss: 0.7821, test_loss: 1.0104, test_f1: 0.5680
 epoch: 6, train_loss: 0.7512, test_loss: 1.0009, test_f1: 0.6009
 epoch: 7, train_loss: 0.7395, test_loss: 1.0350, test_f1: 0.5860
 epoch: 8, train_loss: 0.7385, test_loss: 1.0467, test_f1: 0.6134
 epoch: 9, train_loss: 0.7114, test_loss: 1.0715, test_f1: 0.6008
 epoch: 10, train_loss: 0.6826, test_loss: 1.0992, test_f1: 0.5595
 epoch: 11, train_loss: 0.6611, test_loss: 1.0714, test_f1: 0.6040
 epoch: 12, train_loss: 0.6276, test_loss: 1.1074, test_f1: 0.5694
 epoch: 13, train_loss: 0.6345, test_loss: 1.1637, test_f1: 0.6197
 epoch: 14, train_loss: 0.6159, test_loss: 1.2122, test_f1: 0.5721
 epoch: 15, train_loss: 0.6218, test_loss: 1.1538, test_f1: 0.6157
 epoch: 16, train_loss: 0.5899, test_loss: 1.2793, test_f1: 0.6166
 epoch: 17, train_loss: 0.5771, test_loss: 1.2273, test_f1: 0.5952
 epoch: 18, train_loss: 0.5525, test_loss: 1.2620, test_f1: 0.5679
 epoch: 19, train_loss: 0.5258, test_loss: 1.1595, test_f1: 0.6502
 epoch: 20, train_loss: 0.5058, test_loss: 1.3928, test_f1: 0.6077
 epoch: 21, train_loss: 0.5027, test_loss: 1.3818, test_f1: 0.6065
 epoch: 22, train_loss: 0.4966, test_loss: 1.3737, test_f1: 0.5812
 epoch: 23, train_loss: 0.4978, test_loss: 1.3760, test_f1: 0.6025
 epoch: 24, train_loss: 0.4843, test_loss: 1.4053, test_f1: 0.6456
 epoch: 25, train_loss: 0.4909, test_loss: 1.5515, test_f1: 0.5543
 epoch: 26, train_loss: 0.4597, test_loss: 1.4822, test_f1: 0.5747
 epoch: 27, train_loss: 0.4425, test_loss: 1.4423, test_f1: 0.6570
 epoch: 28, train_loss: 0.4021, test_loss: 1.4658, test_f1: 0.6252
 epoch: 29, train_loss: 0.4059, test_loss: 1.4048, test_f1: 0.6468
 epoch: 30, train_loss: 0.3881, test_loss: 1.6631, test_f1: 0.6152
 epoch: 31, train_loss: 0.4048, test_loss: 1.7423, test_f1: 0.5649
 epoch: 32, train_loss: 0.4107, test_loss: 1.7364, test_f1: 0.5831
 epoch: 33, train_loss: 0.3852, test_loss: 1.4810, test_f1: 0.6132
 epoch: 34, train_loss: 0.3751, test_loss: 1.6528, test_f1: 0.6267
 epoch: 35, train_loss: 0.3663, test_loss: 1.8556, test_f1: 0.5533
 epoch: 36, train_loss: 0.3809, test_loss: 1.5024, test_f1: 0.6628
 epoch: 37, train_loss: 0.3559, test_loss: 1.8982, test_f1: 0.5699
 epoch: 38, train_loss: 0.3667, test_loss: 1.7798, test_f1: 0.5970
 epoch: 39, train_loss: 0.3165, test_loss: 1.7327, test_f1: 0.6378
 epoch: 40, train_loss: 0.3057, test_loss: 1.7548, test_f1: 0.5953
 epoch: 41, train_loss: 0.2815, test_loss: 1.9462, test_f1: 0.6114
 epoch: 42, train_loss: 0.2825, test_loss: 1.9299, test_f1: 0.5871
 epoch: 43, train_loss: 0.2813, test_loss: 1.8947, test_f1: 0.5975
 epoch: 44, train_loss: 0.2819, test_loss: 1.8634, test_f1: 0.6493
 epoch: 45, train_loss: 0.2855, test_loss: 1.9906, test_f1: 0.6129
 epoch: 46, train_loss: 0.2732, test_loss: 2.0739, test_f1: 0.6256
 epoch: 47, train_loss: 0.2823, test_loss: 2.0959, test_f1: 0.5988
 epoch: 48, train_loss: 0.2418, test_loss: 2.0771, test_f1: 0.5943
 epoch: 49, train_loss: 0.2531, test_loss: 1.9318, test_f1: 0.6215
 epoch: 50, train_loss: 0.2597, test_loss: 2.1020, test_f1: 0.5954
 epoch: 51, train_loss: 0.2338, test_loss: 2.0700, test_f1: 0.6011
 epoch: 52, train_loss: 0.1949, test_loss: 2.0463, test_f1: 0.6486
 epoch: 53, train_loss: 0.2348, test_loss: 1.9666, test_f1: 0.6421
 epoch: 54, train_loss: 0.2064, test_loss: 2.1687, test_f1: 0.5980
 epoch: 55, train_loss: 0.1888, test_loss: 2.1863, test_f1: 0.6306
 epoch: 56, train_loss: 0.1760, test_loss: 2.2958, test_f1: 0.5909
 epoch: 57, train_loss: 0.2047, test_loss: 2.3129, test_f1: 0.6210
 epoch: 58, train_loss: 0.1729, test_loss: 2.4015, test_f1: 0.5769
 epoch: 59, train_loss: 0.1771, test_loss: 2.2639, test_f1: 0.6505
 epoch: 60, train_loss: 0.1657, test_loss: 2.3801, test_f1: 0.5891
 epoch: 61, train_loss: 0.1469, test_loss: 2.3132, test_f1: 0.6087
 epoch: 62, train_loss: 0.1690, test_loss: 2.4767, test_f1: 0.6146
 epoch: 63, train_loss: 0.1466, test_loss: 2.3376, test_f1: 0.6428
 epoch: 64, train_loss: 0.1487, test_loss: 2.4250, test_f1: 0.6403
 epoch: 65, train_loss: 0.1422, test_loss: 2.5550, test_f1: 0.6198
 epoch: 66, train_loss: 0.1860, test_loss: 2.4498, test_f1: 0.5943
 epoch: 67, train_loss: 0.1642, test_loss: 2.6281, test_f1: 0.5709
 epoch: 68, train_loss: 0.1725, test_loss: 2.5379, test_f1: 0.6322
 epoch: 69, train_loss: 0.1593, test_loss: 2.4343, test_f1: 0.6335
 epoch: 70, train_loss: 0.1679, test_loss: 2.5672, test_f1: 0.5626
 epoch: 71, train_loss: 0.1353, test_loss: 2.4886, test_f1: 0.6373
 epoch: 72, train_loss: 0.1372, test_loss: 2.5987, test_f1: 0.6165
 epoch: 73, train_loss: 0.1506, test_loss: 2.4151, test_f1: 0.6460
 epoch: 74, train_loss: 0.1283, test_loss: 2.5701, test_f1: 0.6029
 epoch: 75, train_loss: 0.1416, test_loss: 2.4933, test_f1: 0.6198
 epoch: 76, train_loss: 0.1451, test_loss: 2.7228, test_f1: 0.5866
 epoch: 77, train_loss: 0.1275, test_loss: 2.5511, test_f1: 0.6423
 epoch: 78, train_loss: 0.1297, test_loss: 2.4665, test_f1: 0.6213
 epoch: 79, train_loss: 0.1168, test_loss: 2.6717, test_f1: 0.5962
 epoch: 80, train_loss: 0.1275, test_loss: 2.7714, test_f1: 0.6097
 epoch: 81, train_loss: 0.1342, test_loss: 2.8157, test_f1: 0.5935
 epoch: 82, train_loss: 0.1445, test_loss: 2.6846, test_f1: 0.6126
 epoch: 83, train_loss: 0.1403, test_loss: 2.7970, test_f1: 0.6254
 epoch: 84, train_loss: 0.1156, test_loss: 2.9213, test_f1: 0.5992
 epoch: 85, train_loss: 0.1183, test_loss: 2.7695, test_f1: 0.5971
 epoch: 86, train_loss: 0.1084, test_loss: 2.8967, test_f1: 0.5973
 epoch: 87, train_loss: 0.1106, test_loss: 2.7193, test_f1: 0.6287
 epoch: 88, train_loss: 0.0943, test_loss: 2.9001, test_f1: 0.5949
 epoch: 89, train_loss: 0.1235, test_loss: 3.2391, test_f1: 0.5719
 epoch: 90, train_loss: 0.1355, test_loss: 2.9551, test_f1: 0.5777
 epoch: 91, train_loss: 0.0949, test_loss: 2.9796, test_f1: 0.6170
 epoch: 92, train_loss: 0.1051, test_loss: 2.7831, test_f1: 0.6619
 epoch: 93, train_loss: 0.1234, test_loss: 3.1654, test_f1: 0.6010
 epoch: 94, train_loss: 0.0968, test_loss: 3.0773, test_f1: 0.5946
 epoch: 95, train_loss: 0.1104, test_loss: 2.9298, test_f1: 0.6018
 epoch: 96, train_loss: 0.1211, test_loss: 2.8460, test_f1: 0.6279
 epoch: 97, train_loss: 0.1261, test_loss: 3.1043, test_f1: 0.5551
 epoch: 98, train_loss: 0.1291, test_loss: 3.0823, test_f1: 0.5724
 epoch: 99, train_loss: 0.0993, test_loss: 2.7751, test_f1: 0.6201
##################ITERATION #4 ****************************************
 epoch: 0, train_loss: 1.3444, test_loss: 1.6925, test_f1: 0.1738
 epoch: 1, train_loss: 1.0377, test_loss: 1.4863, test_f1: 0.1430
 epoch: 2, train_loss: 0.8911, test_loss: 1.0920, test_f1: 0.5204
 epoch: 3, train_loss: 0.8586, test_loss: 1.0660, test_f1: 0.5391
 epoch: 4, train_loss: 0.8117, test_loss: 1.1230, test_f1: 0.5583
 epoch: 5, train_loss: 0.7888, test_loss: 1.0589, test_f1: 0.5942
 epoch: 6, train_loss: 0.7597, test_loss: 1.0927, test_f1: 0.5438
 epoch: 7, train_loss: 0.7479, test_loss: 1.0882, test_f1: 0.5958
 epoch: 8, train_loss: 0.7557, test_loss: 1.1617, test_f1: 0.5572
 epoch: 9, train_loss: 0.7000, test_loss: 1.0666, test_f1: 0.6425
 epoch: 10, train_loss: 0.7028, test_loss: 1.1811, test_f1: 0.5275
 epoch: 11, train_loss: 0.6789, test_loss: 1.1221, test_f1: 0.5831
 epoch: 12, train_loss: 0.6537, test_loss: 1.1041, test_f1: 0.5823
 epoch: 13, train_loss: 0.6265, test_loss: 1.2399, test_f1: 0.5335
 epoch: 14, train_loss: 0.6109, test_loss: 1.1640, test_f1: 0.6184
 epoch: 15, train_loss: 0.5960, test_loss: 1.3232, test_f1: 0.5303
 epoch: 16, train_loss: 0.5647, test_loss: 1.2367, test_f1: 0.6128
 epoch: 17, train_loss: 0.6095, test_loss: 1.2884, test_f1: 0.6289
 epoch: 18, train_loss: 0.5728, test_loss: 1.2497, test_f1: 0.5850
 epoch: 19, train_loss: 0.5398, test_loss: 1.4356, test_f1: 0.4923
 epoch: 20, train_loss: 0.5292, test_loss: 1.4219, test_f1: 0.5232
 epoch: 21, train_loss: 0.5406, test_loss: 1.3624, test_f1: 0.5683
 epoch: 22, train_loss: 0.5271, test_loss: 1.3410, test_f1: 0.5788
 epoch: 23, train_loss: 0.4966, test_loss: 1.2119, test_f1: 0.6460
 epoch: 24, train_loss: 0.4818, test_loss: 1.3406, test_f1: 0.6028
 epoch: 25, train_loss: 0.4727, test_loss: 1.3253, test_f1: 0.5607
 epoch: 26, train_loss: 0.4408, test_loss: 1.2962, test_f1: 0.6544
 epoch: 27, train_loss: 0.4611, test_loss: 1.3655, test_f1: 0.5298
 epoch: 28, train_loss: 0.4534, test_loss: 1.4351, test_f1: 0.6003
 epoch: 29, train_loss: 0.4474, test_loss: 1.3268, test_f1: 0.6078
 epoch: 30, train_loss: 0.3989, test_loss: 1.4490, test_f1: 0.6189
 epoch: 31, train_loss: 0.4038, test_loss: 1.5461, test_f1: 0.5930
 epoch: 32, train_loss: 0.4171, test_loss: 1.4265, test_f1: 0.5860
 epoch: 33, train_loss: 0.3724, test_loss: 1.4723, test_f1: 0.6185
 epoch: 34, train_loss: 0.3849, test_loss: 1.4140, test_f1: 0.6170
 epoch: 35, train_loss: 0.3713, test_loss: 1.6156, test_f1: 0.5863
 epoch: 36, train_loss: 0.4200, test_loss: 1.5320, test_f1: 0.6307
 epoch: 37, train_loss: 0.3648, test_loss: 1.5541, test_f1: 0.6021
 epoch: 38, train_loss: 0.3806, test_loss: 1.6724, test_f1: 0.5688
 epoch: 39, train_loss: 0.3463, test_loss: 1.5544, test_f1: 0.6503
 epoch: 40, train_loss: 0.3172, test_loss: 2.0759, test_f1: 0.4894
 epoch: 41, train_loss: 0.3351, test_loss: 1.6759, test_f1: 0.5939
 epoch: 42, train_loss: 0.3224, test_loss: 1.7180, test_f1: 0.6243
 epoch: 43, train_loss: 0.2874, test_loss: 1.7588, test_f1: 0.5946
 epoch: 44, train_loss: 0.2751, test_loss: 1.9173, test_f1: 0.5753
 epoch: 45, train_loss: 0.3021, test_loss: 1.8031, test_f1: 0.6427
 epoch: 46, train_loss: 0.3218, test_loss: 1.7512, test_f1: 0.6227
 epoch: 47, train_loss: 0.2897, test_loss: 1.7796, test_f1: 0.5954
 epoch: 48, train_loss: 0.3355, test_loss: 1.7345, test_f1: 0.6372
 epoch: 49, train_loss: 0.2791, test_loss: 1.9463, test_f1: 0.5775
 epoch: 50, train_loss: 0.3119, test_loss: 1.7696, test_f1: 0.5978
 epoch: 51, train_loss: 0.2646, test_loss: 1.8942, test_f1: 0.5941
 epoch: 52, train_loss: 0.2089, test_loss: 1.8752, test_f1: 0.6011
 epoch: 53, train_loss: 0.1948, test_loss: 2.0776, test_f1: 0.5894
 epoch: 54, train_loss: 0.2145, test_loss: 1.9976, test_f1: 0.5919
 epoch: 55, train_loss: 0.2057, test_loss: 1.9728, test_f1: 0.5979
 epoch: 56, train_loss: 0.1764, test_loss: 2.0022, test_f1: 0.6220
 epoch: 57, train_loss: 0.1835, test_loss: 2.0182, test_f1: 0.6021
 epoch: 58, train_loss: 0.1787, test_loss: 2.0580, test_f1: 0.6183
 epoch: 59, train_loss: 0.1739, test_loss: 2.0212, test_f1: 0.5986
 epoch: 60, train_loss: 0.1725, test_loss: 2.1487, test_f1: 0.5881
 epoch: 61, train_loss: 0.1767, test_loss: 2.1803, test_f1: 0.5741
 epoch: 62, train_loss: 0.1731, test_loss: 2.1748, test_f1: 0.6318
 epoch: 63, train_loss: 0.1938, test_loss: 2.1353, test_f1: 0.6070
 epoch: 64, train_loss: 0.1753, test_loss: 2.1731, test_f1: 0.5995
 epoch: 65, train_loss: 0.1637, test_loss: 2.0361, test_f1: 0.6149
 epoch: 66, train_loss: 0.1753, test_loss: 2.2557, test_f1: 0.5679
 epoch: 67, train_loss: 0.1681, test_loss: 2.2379, test_f1: 0.6176
 epoch: 68, train_loss: 0.1774, test_loss: 2.1750, test_f1: 0.6039
 epoch: 69, train_loss: 0.1437, test_loss: 2.1571, test_f1: 0.6292
 epoch: 70, train_loss: 0.1414, test_loss: 2.2537, test_f1: 0.6017
 epoch: 71, train_loss: 0.1542, test_loss: 2.4228, test_f1: 0.6036
 epoch: 72, train_loss: 0.1540, test_loss: 2.2100, test_f1: 0.6061
 epoch: 73, train_loss: 0.1455, test_loss: 2.4046, test_f1: 0.6063
 epoch: 74, train_loss: 0.1376, test_loss: 2.3402, test_f1: 0.6222
 epoch: 75, train_loss: 0.1250, test_loss: 2.4270, test_f1: 0.5909
 epoch: 76, train_loss: 0.1308, test_loss: 2.4806, test_f1: 0.5975
 epoch: 77, train_loss: 0.1465, test_loss: 2.4919, test_f1: 0.5762
 epoch: 78, train_loss: 0.1599, test_loss: 2.3599, test_f1: 0.6217
 epoch: 79, train_loss: 0.1405, test_loss: 2.6705, test_f1: 0.5621
 epoch: 80, train_loss: 0.1370, test_loss: 2.5065, test_f1: 0.6061
 epoch: 81, train_loss: 0.1763, test_loss: 2.5373, test_f1: 0.6068
 epoch: 82, train_loss: 0.1263, test_loss: 2.3482, test_f1: 0.6247
 epoch: 83, train_loss: 0.1461, test_loss: 2.4797, test_f1: 0.6051
 epoch: 84, train_loss: 0.1196, test_loss: 2.3225, test_f1: 0.6157
 epoch: 85, train_loss: 0.1382, test_loss: 2.3614, test_f1: 0.5945
 epoch: 86, train_loss: 0.1211, test_loss: 2.4509, test_f1: 0.6002
 epoch: 87, train_loss: 0.1337, test_loss: 2.3801, test_f1: 0.5984
 epoch: 88, train_loss: 0.1171, test_loss: 2.4997, test_f1: 0.6236
 epoch: 89, train_loss: 0.1060, test_loss: 2.6254, test_f1: 0.5984
 epoch: 90, train_loss: 0.1363, test_loss: 2.6244, test_f1: 0.5970
 epoch: 91, train_loss: 0.1344, test_loss: 2.4908, test_f1: 0.6183
 epoch: 92, train_loss: 0.1508, test_loss: 2.5189, test_f1: 0.6135
 epoch: 93, train_loss: 0.1177, test_loss: 2.4577, test_f1: 0.5938
 epoch: 94, train_loss: 0.1427, test_loss: 2.5598, test_f1: 0.6129
 epoch: 95, train_loss: 0.1517, test_loss: 2.5519, test_f1: 0.5974
 epoch: 96, train_loss: 0.1268, test_loss: 2.4288, test_f1: 0.6059
 epoch: 97, train_loss: 0.1051, test_loss: 2.4092, test_f1: 0.6068
 epoch: 98, train_loss: 0.1017, test_loss: 2.5643, test_f1: 0.6143
 epoch: 99, train_loss: 0.1313, test_loss: 2.5701, test_f1: 0.6070
##################ITERATION #5 ****************************************
 epoch: 0, train_loss: 1.4563, test_loss: 1.5842, test_f1: 0.1911
 epoch: 1, train_loss: 1.0129, test_loss: 1.2301, test_f1: 0.4336
 epoch: 2, train_loss: 0.9341, test_loss: 1.1234, test_f1: 0.5609
 epoch: 3, train_loss: 0.8758, test_loss: 1.1170, test_f1: 0.5283
 epoch: 4, train_loss: 0.8242, test_loss: 1.0798, test_f1: 0.5676
 epoch: 5, train_loss: 0.8120, test_loss: 1.0854, test_f1: 0.5237
 epoch: 6, train_loss: 0.7604, test_loss: 1.1000, test_f1: 0.5324
 epoch: 7, train_loss: 0.7362, test_loss: 1.1337, test_f1: 0.5841
 epoch: 8, train_loss: 0.7131, test_loss: 1.1328, test_f1: 0.5576
 epoch: 9, train_loss: 0.6863, test_loss: 1.1618, test_f1: 0.5429
 epoch: 10, train_loss: 0.7018, test_loss: 1.1440, test_f1: 0.5958
 epoch: 11, train_loss: 0.6679, test_loss: 1.1994, test_f1: 0.6100
 epoch: 12, train_loss: 0.6352, test_loss: 1.1514, test_f1: 0.5912
 epoch: 13, train_loss: 0.6415, test_loss: 1.1645, test_f1: 0.5512
 epoch: 14, train_loss: 0.6240, test_loss: 1.1725, test_f1: 0.5835
 epoch: 15, train_loss: 0.6235, test_loss: 1.2194, test_f1: 0.5609
 epoch: 16, train_loss: 0.5885, test_loss: 1.2093, test_f1: 0.5735
 epoch: 17, train_loss: 0.5746, test_loss: 1.2412, test_f1: 0.6198
 epoch: 18, train_loss: 0.5845, test_loss: 1.1811, test_f1: 0.6406
 epoch: 19, train_loss: 0.5844, test_loss: 1.1936, test_f1: 0.6013
 epoch: 20, train_loss: 0.5498, test_loss: 1.3052, test_f1: 0.6052
 epoch: 21, train_loss: 0.5132, test_loss: 1.3751, test_f1: 0.5888
 epoch: 22, train_loss: 0.5056, test_loss: 1.3452, test_f1: 0.6170
 epoch: 23, train_loss: 0.5005, test_loss: 1.4389, test_f1: 0.5903
 epoch: 24, train_loss: 0.5165, test_loss: 1.4704, test_f1: 0.5845
 epoch: 25, train_loss: 0.4821, test_loss: 1.3519, test_f1: 0.5887
 epoch: 26, train_loss: 0.5017, test_loss: 1.3790, test_f1: 0.5842
 epoch: 27, train_loss: 0.4471, test_loss: 1.4868, test_f1: 0.5889
 epoch: 28, train_loss: 0.4753, test_loss: 1.4365, test_f1: 0.6094
 epoch: 29, train_loss: 0.4623, test_loss: 1.4407, test_f1: 0.5854
 epoch: 30, train_loss: 0.4335, test_loss: 1.6107, test_f1: 0.5974
 epoch: 31, train_loss: 0.4071, test_loss: 1.5978, test_f1: 0.5966
 epoch: 32, train_loss: 0.4384, test_loss: 1.5504, test_f1: 0.5901
 epoch: 33, train_loss: 0.4137, test_loss: 1.5021, test_f1: 0.6140
 epoch: 34, train_loss: 0.3922, test_loss: 1.4247, test_f1: 0.6502
 epoch: 35, train_loss: 0.3946, test_loss: 1.6487, test_f1: 0.6264
 epoch: 36, train_loss: 0.3984, test_loss: 1.6188, test_f1: 0.5981
 epoch: 37, train_loss: 0.3810, test_loss: 1.6014, test_f1: 0.5983
 epoch: 38, train_loss: 0.3741, test_loss: 1.9910, test_f1: 0.5797
 epoch: 39, train_loss: 0.3726, test_loss: 1.7983, test_f1: 0.6210
 epoch: 40, train_loss: 0.3601, test_loss: 1.8104, test_f1: 0.5330
 epoch: 41, train_loss: 0.3367, test_loss: 1.8155, test_f1: 0.5796
 epoch: 42, train_loss: 0.3299, test_loss: 1.6153, test_f1: 0.5831
 epoch: 43, train_loss: 0.3143, test_loss: 1.8016, test_f1: 0.5909
 epoch: 44, train_loss: 0.3362, test_loss: 2.0752, test_f1: 0.5495
 epoch: 45, train_loss: 0.3170, test_loss: 1.7646, test_f1: 0.6268
 epoch: 46, train_loss: 0.2950, test_loss: 1.8368, test_f1: 0.5723
 epoch: 47, train_loss: 0.3146, test_loss: 1.8296, test_f1: 0.6118
 epoch: 48, train_loss: 0.3071, test_loss: 1.8406, test_f1: 0.6459
 epoch: 49, train_loss: 0.2978, test_loss: 1.9441, test_f1: 0.6077
 epoch: 50, train_loss: 0.3147, test_loss: 2.1739, test_f1: 0.5647
 epoch: 51, train_loss: 0.2866, test_loss: 1.8829, test_f1: 0.5874
 epoch: 52, train_loss: 0.2598, test_loss: 1.9831, test_f1: 0.6151
 epoch: 53, train_loss: 0.2249, test_loss: 2.1004, test_f1: 0.6049
 epoch: 54, train_loss: 0.1985, test_loss: 2.0370, test_f1: 0.6107
 epoch: 55, train_loss: 0.2192, test_loss: 2.0671, test_f1: 0.5905
 epoch: 56, train_loss: 0.2175, test_loss: 2.1473, test_f1: 0.6192
 epoch: 57, train_loss: 0.1800, test_loss: 2.1962, test_f1: 0.5752
 epoch: 58, train_loss: 0.1871, test_loss: 2.0961, test_f1: 0.6135
 epoch: 59, train_loss: 0.1961, test_loss: 2.3019, test_f1: 0.5972
 epoch: 60, train_loss: 0.1778, test_loss: 2.3612, test_f1: 0.5890
 epoch: 61, train_loss: 0.1769, test_loss: 2.4050, test_f1: 0.6003
 epoch: 62, train_loss: 0.1670, test_loss: 2.2280, test_f1: 0.5975
 epoch: 63, train_loss: 0.2012, test_loss: 2.3399, test_f1: 0.6043
 epoch: 64, train_loss: 0.2004, test_loss: 2.2838, test_f1: 0.5658
 epoch: 65, train_loss: 0.2015, test_loss: 2.4407, test_f1: 0.5791
 epoch: 66, train_loss: 0.2121, test_loss: 2.3235, test_f1: 0.5959
 epoch: 67, train_loss: 0.1696, test_loss: 2.3008, test_f1: 0.6017
 epoch: 68, train_loss: 0.1861, test_loss: 2.3251, test_f1: 0.5887
 epoch: 69, train_loss: 0.1893, test_loss: 2.4028, test_f1: 0.5969
 epoch: 70, train_loss: 0.1661, test_loss: 2.3235, test_f1: 0.6009
 epoch: 71, train_loss: 0.1679, test_loss: 2.2796, test_f1: 0.5904
 epoch: 72, train_loss: 0.1748, test_loss: 2.4540, test_f1: 0.5943
 epoch: 73, train_loss: 0.1738, test_loss: 2.8436, test_f1: 0.5614
 epoch: 74, train_loss: 0.1822, test_loss: 2.3050, test_f1: 0.5838
 epoch: 75, train_loss: 0.1626, test_loss: 2.4047, test_f1: 0.5780
 epoch: 76, train_loss: 0.1527, test_loss: 2.3472, test_f1: 0.5973
 epoch: 77, train_loss: 0.1680, test_loss: 2.6024, test_f1: 0.5959
 epoch: 78, train_loss: 0.1772, test_loss: 2.4573, test_f1: 0.6018
 epoch: 79, train_loss: 0.1604, test_loss: 2.3718, test_f1: 0.6113
 epoch: 80, train_loss: 0.1558, test_loss: 2.5364, test_f1: 0.6038
 epoch: 81, train_loss: 0.1437, test_loss: 2.6680, test_f1: 0.6044
 epoch: 82, train_loss: 0.1574, test_loss: 2.5912, test_f1: 0.5613
 epoch: 83, train_loss: 0.1584, test_loss: 2.7092, test_f1: 0.6014
 epoch: 84, train_loss: 0.1371, test_loss: 2.6551, test_f1: 0.5807
 epoch: 85, train_loss: 0.1232, test_loss: 2.6750, test_f1: 0.5781
 epoch: 86, train_loss: 0.1249, test_loss: 2.6846, test_f1: 0.6027
 epoch: 87, train_loss: 0.1338, test_loss: 2.9106, test_f1: 0.5787
 epoch: 88, train_loss: 0.1356, test_loss: 2.7953, test_f1: 0.6075
 epoch: 89, train_loss: 0.1437, test_loss: 3.1374, test_f1: 0.5399
 epoch: 90, train_loss: 0.1921, test_loss: 2.7397, test_f1: 0.5904
 epoch: 91, train_loss: 0.1746, test_loss: 2.7664, test_f1: 0.5796
 epoch: 92, train_loss: 0.1487, test_loss: 2.7340, test_f1: 0.5837
 epoch: 93, train_loss: 0.1340, test_loss: 2.9435, test_f1: 0.5551
 epoch: 94, train_loss: 0.1381, test_loss: 2.5947, test_f1: 0.6003
 epoch: 95, train_loss: 0.1190, test_loss: 2.7470, test_f1: 0.6148
 epoch: 96, train_loss: 0.1289, test_loss: 2.8503, test_f1: 0.6150
 epoch: 97, train_loss: 0.1228, test_loss: 2.6688, test_f1: 0.6032
 epoch: 98, train_loss: 0.1308, test_loss: 2.7879, test_f1: 0.6042
 epoch: 99, train_loss: 0.1405, test_loss: 2.6999, test_f1: 0.6039
##################ITERATION #6 ****************************************
 epoch: 0, train_loss: 1.5082, test_loss: 1.7437, test_f1: 0.3223
 epoch: 1, train_loss: 1.0702, test_loss: 1.2781, test_f1: 0.4677
 epoch: 2, train_loss: 0.9335, test_loss: 1.0626, test_f1: 0.5814
 epoch: 3, train_loss: 0.8818, test_loss: 1.0411, test_f1: 0.5440
 epoch: 4, train_loss: 0.8392, test_loss: 1.1069, test_f1: 0.5459
 epoch: 5, train_loss: 0.7782, test_loss: 1.0751, test_f1: 0.6022
 epoch: 6, train_loss: 0.7660, test_loss: 1.1174, test_f1: 0.5487
 epoch: 7, train_loss: 0.7290, test_loss: 1.0738, test_f1: 0.6202
 epoch: 8, train_loss: 0.7026, test_loss: 1.1664, test_f1: 0.5799
 epoch: 9, train_loss: 0.6991, test_loss: 1.0894, test_f1: 0.5997
 epoch: 10, train_loss: 0.6834, test_loss: 1.1233, test_f1: 0.6109
 epoch: 11, train_loss: 0.6679, test_loss: 1.1516, test_f1: 0.5906
 epoch: 12, train_loss: 0.6347, test_loss: 1.1291, test_f1: 0.6234
 epoch: 13, train_loss: 0.6443, test_loss: 1.0988, test_f1: 0.6019
 epoch: 14, train_loss: 0.6161, test_loss: 1.2185, test_f1: 0.5794
 epoch: 15, train_loss: 0.5836, test_loss: 1.2269, test_f1: 0.5991
 epoch: 16, train_loss: 0.5752, test_loss: 1.1500, test_f1: 0.6104
 epoch: 17, train_loss: 0.5586, test_loss: 1.2577, test_f1: 0.6350
 epoch: 18, train_loss: 0.5650, test_loss: 1.1512, test_f1: 0.5911
 epoch: 19, train_loss: 0.5671, test_loss: 1.3288, test_f1: 0.5666
 epoch: 20, train_loss: 0.5123, test_loss: 1.2696, test_f1: 0.6000
 epoch: 21, train_loss: 0.5294, test_loss: 1.2515, test_f1: 0.6317
 epoch: 22, train_loss: 0.5536, test_loss: 1.2995, test_f1: 0.5920
 epoch: 23, train_loss: 0.5186, test_loss: 1.2153, test_f1: 0.6291
 epoch: 24, train_loss: 0.4853, test_loss: 1.3292, test_f1: 0.6549
 epoch: 25, train_loss: 0.4647, test_loss: 1.3470, test_f1: 0.6433
 epoch: 26, train_loss: 0.5011, test_loss: 1.3183, test_f1: 0.6365
 epoch: 27, train_loss: 0.4808, test_loss: 1.2787, test_f1: 0.6484
 epoch: 28, train_loss: 0.4557, test_loss: 1.3079, test_f1: 0.6127
 epoch: 29, train_loss: 0.4412, test_loss: 1.3929, test_f1: 0.5982
 epoch: 30, train_loss: 0.4313, test_loss: 1.4198, test_f1: 0.6193
 epoch: 31, train_loss: 0.4488, test_loss: 1.3623, test_f1: 0.6237
 epoch: 32, train_loss: 0.4306, test_loss: 1.4491, test_f1: 0.5966
 epoch: 33, train_loss: 0.4065, test_loss: 1.5255, test_f1: 0.6046
 epoch: 34, train_loss: 0.4015, test_loss: 1.4955, test_f1: 0.6147
 epoch: 35, train_loss: 0.3946, test_loss: 1.4618, test_f1: 0.6480
 epoch: 36, train_loss: 0.4088, test_loss: 1.3260, test_f1: 0.6314
 epoch: 37, train_loss: 0.3724, test_loss: 1.5079, test_f1: 0.6376
 epoch: 38, train_loss: 0.3802, test_loss: 1.4936, test_f1: 0.6302
 epoch: 39, train_loss: 0.3577, test_loss: 1.7516, test_f1: 0.5831
 epoch: 40, train_loss: 0.3251, test_loss: 1.5574, test_f1: 0.6280
 epoch: 41, train_loss: 0.3352, test_loss: 1.6581, test_f1: 0.6154
 epoch: 42, train_loss: 0.3250, test_loss: 1.5270, test_f1: 0.6398
 epoch: 43, train_loss: 0.3326, test_loss: 1.6312, test_f1: 0.5973
 epoch: 44, train_loss: 0.3024, test_loss: 1.5711, test_f1: 0.6717
 epoch: 45, train_loss: 0.3083, test_loss: 1.6089, test_f1: 0.6232
 epoch: 46, train_loss: 0.3280, test_loss: 1.6866, test_f1: 0.5988
 epoch: 47, train_loss: 0.3071, test_loss: 1.8002, test_f1: 0.6143
 epoch: 48, train_loss: 0.3017, test_loss: 1.6185, test_f1: 0.6202
 epoch: 49, train_loss: 0.3004, test_loss: 1.7690, test_f1: 0.6339
 epoch: 50, train_loss: 0.2849, test_loss: 1.6604, test_f1: 0.6222
 epoch: 51, train_loss: 0.2712, test_loss: 1.6708, test_f1: 0.6421
 epoch: 52, train_loss: 0.2159, test_loss: 1.6718, test_f1: 0.6502
 epoch: 53, train_loss: 0.2116, test_loss: 1.7023, test_f1: 0.6559
 epoch: 54, train_loss: 0.2237, test_loss: 1.7307, test_f1: 0.6651
 epoch: 55, train_loss: 0.1987, test_loss: 1.7275, test_f1: 0.6225
 epoch: 56, train_loss: 0.2008, test_loss: 1.7692, test_f1: 0.6058
 epoch: 57, train_loss: 0.1750, test_loss: 1.8099, test_f1: 0.6446
 epoch: 58, train_loss: 0.1923, test_loss: 1.9550, test_f1: 0.6461
 epoch: 59, train_loss: 0.1995, test_loss: 1.9316, test_f1: 0.6125
 epoch: 60, train_loss: 0.1871, test_loss: 2.1034, test_f1: 0.6071
 epoch: 61, train_loss: 0.1813, test_loss: 2.0049, test_f1: 0.6166
 epoch: 62, train_loss: 0.1960, test_loss: 1.9833, test_f1: 0.6540
 epoch: 63, train_loss: 0.1893, test_loss: 2.0090, test_f1: 0.6268
 epoch: 64, train_loss: 0.1967, test_loss: 1.9616, test_f1: 0.5985
 epoch: 65, train_loss: 0.1937, test_loss: 2.0878, test_f1: 0.6057
 epoch: 66, train_loss: 0.1941, test_loss: 2.0387, test_f1: 0.6339
 epoch: 67, train_loss: 0.1548, test_loss: 1.9057, test_f1: 0.6553
 epoch: 68, train_loss: 0.1541, test_loss: 2.0166, test_f1: 0.6263
 epoch: 69, train_loss: 0.1586, test_loss: 2.0893, test_f1: 0.6239
 epoch: 70, train_loss: 0.1629, test_loss: 2.3318, test_f1: 0.6123
 epoch: 71, train_loss: 0.1506, test_loss: 2.1372, test_f1: 0.6500
 epoch: 72, train_loss: 0.1859, test_loss: 2.2197, test_f1: 0.6244
 epoch: 73, train_loss: 0.1563, test_loss: 2.3113, test_f1: 0.6166
 epoch: 74, train_loss: 0.1548, test_loss: 2.2888, test_f1: 0.6226
 epoch: 75, train_loss: 0.1549, test_loss: 2.2656, test_f1: 0.5901
 epoch: 76, train_loss: 0.1424, test_loss: 2.4703, test_f1: 0.5945
 epoch: 77, train_loss: 0.1603, test_loss: 2.1700, test_f1: 0.6252
 epoch: 78, train_loss: 0.1742, test_loss: 2.1707, test_f1: 0.6231
 epoch: 79, train_loss: 0.1632, test_loss: 2.2210, test_f1: 0.6162
 epoch: 80, train_loss: 0.1691, test_loss: 2.2787, test_f1: 0.6157
 epoch: 81, train_loss: 0.1826, test_loss: 2.3194, test_f1: 0.6418
 epoch: 82, train_loss: 0.1675, test_loss: 2.4116, test_f1: 0.6151
 epoch: 83, train_loss: 0.1729, test_loss: 2.5029, test_f1: 0.6004
 epoch: 84, train_loss: 0.1772, test_loss: 2.4280, test_f1: 0.6224
 epoch: 85, train_loss: 0.1488, test_loss: 2.1504, test_f1: 0.6485
 epoch: 86, train_loss: 0.1484, test_loss: 2.1622, test_f1: 0.6139
 epoch: 87, train_loss: 0.1371, test_loss: 2.3967, test_f1: 0.6040
 epoch: 88, train_loss: 0.1258, test_loss: 2.5274, test_f1: 0.6116
 epoch: 89, train_loss: 0.1574, test_loss: 2.5096, test_f1: 0.5880
 epoch: 90, train_loss: 0.1326, test_loss: 2.4559, test_f1: 0.6078
 epoch: 91, train_loss: 0.1263, test_loss: 2.4011, test_f1: 0.6147
 epoch: 92, train_loss: 0.1529, test_loss: 2.3641, test_f1: 0.6139
 epoch: 93, train_loss: 0.1322, test_loss: 2.5499, test_f1: 0.6085
 epoch: 94, train_loss: 0.1397, test_loss: 2.5984, test_f1: 0.6193
 epoch: 95, train_loss: 0.1290, test_loss: 2.3433, test_f1: 0.6448
 epoch: 96, train_loss: 0.1174, test_loss: 2.6563, test_f1: 0.5980
 epoch: 97, train_loss: 0.1367, test_loss: 2.5701, test_f1: 0.6096
 epoch: 98, train_loss: 0.1306, test_loss: 2.2235, test_f1: 0.6326
 epoch: 99, train_loss: 0.1356, test_loss: 2.4048, test_f1: 0.6049
##################ITERATION #7 ****************************************
 epoch: 0, train_loss: 1.5407, test_loss: 1.9529, test_f1: 0.1865
 epoch: 1, train_loss: 1.0314, test_loss: 1.2652, test_f1: 0.4027
 epoch: 2, train_loss: 0.9651, test_loss: 1.0847, test_f1: 0.5184
 epoch: 3, train_loss: 0.8679, test_loss: 1.0910, test_f1: 0.5491
 epoch: 4, train_loss: 0.8393, test_loss: 1.1379, test_f1: 0.5469
 epoch: 5, train_loss: 0.7953, test_loss: 1.1553, test_f1: 0.5610
 epoch: 6, train_loss: 0.8012, test_loss: 1.1497, test_f1: 0.6023
 epoch: 7, train_loss: 0.7538, test_loss: 1.2101, test_f1: 0.5455
 epoch: 8, train_loss: 0.7527, test_loss: 1.1859, test_f1: 0.6063
 epoch: 9, train_loss: 0.7269, test_loss: 1.1250, test_f1: 0.6146
 epoch: 10, train_loss: 0.7090, test_loss: 1.0974, test_f1: 0.5981
 epoch: 11, train_loss: 0.6622, test_loss: 1.1645, test_f1: 0.5985
 epoch: 12, train_loss: 0.6874, test_loss: 1.1815, test_f1: 0.5902
 epoch: 13, train_loss: 0.6425, test_loss: 1.2136, test_f1: 0.5895
 epoch: 14, train_loss: 0.6108, test_loss: 1.2755, test_f1: 0.5744
 epoch: 15, train_loss: 0.6134, test_loss: 1.2483, test_f1: 0.6060
 epoch: 16, train_loss: 0.6017, test_loss: 1.2167, test_f1: 0.5876
 epoch: 17, train_loss: 0.5804, test_loss: 1.2895, test_f1: 0.5588
 epoch: 18, train_loss: 0.5531, test_loss: 1.3554, test_f1: 0.5852
 epoch: 19, train_loss: 0.5544, test_loss: 1.3843, test_f1: 0.6314
 epoch: 20, train_loss: 0.5415, test_loss: 1.3313, test_f1: 0.5839
 epoch: 21, train_loss: 0.5440, test_loss: 1.3470, test_f1: 0.6159
 epoch: 22, train_loss: 0.5438, test_loss: 1.3871, test_f1: 0.5539
 epoch: 23, train_loss: 0.5264, test_loss: 1.4668, test_f1: 0.5723
 epoch: 24, train_loss: 0.5432, test_loss: 1.4605, test_f1: 0.5344
 epoch: 25, train_loss: 0.5139, test_loss: 1.5818, test_f1: 0.5236
 epoch: 26, train_loss: 0.4749, test_loss: 1.4367, test_f1: 0.5736
 epoch: 27, train_loss: 0.4864, test_loss: 1.4779, test_f1: 0.5444
 epoch: 28, train_loss: 0.4796, test_loss: 1.6606, test_f1: 0.5830
 epoch: 29, train_loss: 0.4815, test_loss: 1.4367, test_f1: 0.6024
 epoch: 30, train_loss: 0.4541, test_loss: 1.4369, test_f1: 0.5997
 epoch: 31, train_loss: 0.4490, test_loss: 1.3953, test_f1: 0.5969
 epoch: 32, train_loss: 0.4239, test_loss: 1.8507, test_f1: 0.5754
 epoch: 33, train_loss: 0.4053, test_loss: 1.6242, test_f1: 0.6052
 epoch: 34, train_loss: 0.4340, test_loss: 1.5387, test_f1: 0.5840
 epoch: 35, train_loss: 0.4103, test_loss: 1.8744, test_f1: 0.5947
 epoch: 36, train_loss: 0.3828, test_loss: 1.7369, test_f1: 0.5835
 epoch: 37, train_loss: 0.3992, test_loss: 1.5860, test_f1: 0.6213
 epoch: 38, train_loss: 0.3602, test_loss: 1.9837, test_f1: 0.5902
 epoch: 39, train_loss: 0.3812, test_loss: 1.7368, test_f1: 0.5977
 epoch: 40, train_loss: 0.3508, test_loss: 1.9094, test_f1: 0.5463
 epoch: 41, train_loss: 0.3471, test_loss: 1.9879, test_f1: 0.5718
 epoch: 42, train_loss: 0.3385, test_loss: 1.9867, test_f1: 0.5914
 epoch: 43, train_loss: 0.3543, test_loss: 1.8710, test_f1: 0.6111
 epoch: 44, train_loss: 0.3326, test_loss: 2.3213, test_f1: 0.5386
 epoch: 45, train_loss: 0.3458, test_loss: 1.9705, test_f1: 0.5978
 epoch: 46, train_loss: 0.3171, test_loss: 2.0275, test_f1: 0.5995
 epoch: 47, train_loss: 0.3305, test_loss: 2.2809, test_f1: 0.6084
 epoch: 48, train_loss: 0.3178, test_loss: 2.2985, test_f1: 0.6168
 epoch: 49, train_loss: 0.3394, test_loss: 2.1888, test_f1: 0.5437
 epoch: 50, train_loss: 0.3104, test_loss: 1.9124, test_f1: 0.6204
 epoch: 51, train_loss: 0.2463, test_loss: 1.9541, test_f1: 0.5811
 epoch: 52, train_loss: 0.2479, test_loss: 2.0189, test_f1: 0.5924
 epoch: 53, train_loss: 0.2334, test_loss: 2.1796, test_f1: 0.5904
 epoch: 54, train_loss: 0.2135, test_loss: 2.2284, test_f1: 0.5785
 epoch: 55, train_loss: 0.2073, test_loss: 2.0974, test_f1: 0.5884
 epoch: 56, train_loss: 0.2270, test_loss: 2.2808, test_f1: 0.5698
 epoch: 57, train_loss: 0.2242, test_loss: 2.3644, test_f1: 0.5833
 epoch: 58, train_loss: 0.2211, test_loss: 2.3036, test_f1: 0.5923
 epoch: 59, train_loss: 0.1931, test_loss: 2.1586, test_f1: 0.5988
 epoch: 60, train_loss: 0.1867, test_loss: 2.3786, test_f1: 0.5888
 epoch: 61, train_loss: 0.1976, test_loss: 2.3490, test_f1: 0.5743
 epoch: 62, train_loss: 0.1975, test_loss: 2.3881, test_f1: 0.5688
 epoch: 63, train_loss: 0.2087, test_loss: 2.2449, test_f1: 0.6088
 epoch: 64, train_loss: 0.1984, test_loss: 2.5137, test_f1: 0.5880
 epoch: 65, train_loss: 0.1635, test_loss: 2.3055, test_f1: 0.5957
 epoch: 66, train_loss: 0.1760, test_loss: 2.4834, test_f1: 0.5540
 epoch: 67, train_loss: 0.1924, test_loss: 2.4576, test_f1: 0.5777
 epoch: 68, train_loss: 0.1719, test_loss: 2.5037, test_f1: 0.5938
 epoch: 69, train_loss: 0.1734, test_loss: 2.3729, test_f1: 0.6144
 epoch: 70, train_loss: 0.1707, test_loss: 2.4431, test_f1: 0.5697
 epoch: 71, train_loss: 0.1731, test_loss: 2.3637, test_f1: 0.6091
 epoch: 72, train_loss: 0.1940, test_loss: 2.2792, test_f1: 0.6035
 epoch: 73, train_loss: 0.1858, test_loss: 2.4177, test_f1: 0.6015
 epoch: 74, train_loss: 0.1741, test_loss: 2.2918, test_f1: 0.6004
 epoch: 75, train_loss: 0.1530, test_loss: 2.4779, test_f1: 0.5776
 epoch: 76, train_loss: 0.1635, test_loss: 2.6355, test_f1: 0.5514
 epoch: 77, train_loss: 0.1403, test_loss: 2.5310, test_f1: 0.5795
 epoch: 78, train_loss: 0.1488, test_loss: 2.5260, test_f1: 0.5722
 epoch: 79, train_loss: 0.1493, test_loss: 2.4910, test_f1: 0.5763
 epoch: 80, train_loss: 0.1497, test_loss: 2.7415, test_f1: 0.6017
 epoch: 81, train_loss: 0.1254, test_loss: 2.7393, test_f1: 0.5813
 epoch: 82, train_loss: 0.1613, test_loss: 2.6543, test_f1: 0.5992
 epoch: 83, train_loss: 0.1745, test_loss: 2.5275, test_f1: 0.6069
 epoch: 84, train_loss: 0.1867, test_loss: 2.4597, test_f1: 0.6114
 epoch: 85, train_loss: 0.1810, test_loss: 2.6865, test_f1: 0.6164
 epoch: 86, train_loss: 0.1643, test_loss: 2.7356, test_f1: 0.6048
 epoch: 87, train_loss: 0.1242, test_loss: 2.7191, test_f1: 0.5744
 epoch: 88, train_loss: 0.1556, test_loss: 2.8777, test_f1: 0.5852
 epoch: 89, train_loss: 0.1302, test_loss: 2.6837, test_f1: 0.5951
 epoch: 90, train_loss: 0.1309, test_loss: 2.9244, test_f1: 0.5778
 epoch: 91, train_loss: 0.1339, test_loss: 2.8105, test_f1: 0.5825
 epoch: 92, train_loss: 0.1345, test_loss: 2.7573, test_f1: 0.5697
 epoch: 93, train_loss: 0.1084, test_loss: 2.7476, test_f1: 0.5854
 epoch: 94, train_loss: 0.1794, test_loss: 2.6524, test_f1: 0.5768
 epoch: 95, train_loss: 0.1231, test_loss: 2.8061, test_f1: 0.5868
 epoch: 96, train_loss: 0.1301, test_loss: 2.8840, test_f1: 0.5800
 epoch: 97, train_loss: 0.1376, test_loss: 2.8142, test_f1: 0.5756
 epoch: 98, train_loss: 0.1083, test_loss: 3.0245, test_f1: 0.5797
 epoch: 99, train_loss: 0.1409, test_loss: 2.5838, test_f1: 0.5932
##################ITERATION #8 ****************************************
 epoch: 0, train_loss: 1.7228, test_loss: 1.8145, test_f1: 0.2351
 epoch: 1, train_loss: 1.1767, test_loss: 1.2844, test_f1: 0.4373
 epoch: 2, train_loss: 0.9863, test_loss: 1.1783, test_f1: 0.5417
 epoch: 3, train_loss: 0.9398, test_loss: 1.1158, test_f1: 0.5645
 epoch: 4, train_loss: 0.8600, test_loss: 1.1200, test_f1: 0.5799
 epoch: 5, train_loss: 0.8259, test_loss: 1.1417, test_f1: 0.5546
 epoch: 6, train_loss: 0.8093, test_loss: 1.1025, test_f1: 0.5763
 epoch: 7, train_loss: 0.7947, test_loss: 1.1893, test_f1: 0.5239
 epoch: 8, train_loss: 0.7886, test_loss: 1.1610, test_f1: 0.5733
 epoch: 9, train_loss: 0.7307, test_loss: 1.1313, test_f1: 0.6060
 epoch: 10, train_loss: 0.7581, test_loss: 1.1154, test_f1: 0.5736
 epoch: 11, train_loss: 0.6942, test_loss: 1.1527, test_f1: 0.6054
 epoch: 12, train_loss: 0.6732, test_loss: 1.1719, test_f1: 0.5729
 epoch: 13, train_loss: 0.6518, test_loss: 1.1773, test_f1: 0.5960
 epoch: 14, train_loss: 0.6412, test_loss: 1.2191, test_f1: 0.6128
 epoch: 15, train_loss: 0.6810, test_loss: 1.2213, test_f1: 0.5466
 epoch: 16, train_loss: 0.6416, test_loss: 1.2669, test_f1: 0.5580
 epoch: 17, train_loss: 0.6537, test_loss: 1.3118, test_f1: 0.5549
 epoch: 18, train_loss: 0.6232, test_loss: 1.3267, test_f1: 0.5428
 epoch: 19, train_loss: 0.6374, test_loss: 1.2543, test_f1: 0.5885
 epoch: 20, train_loss: 0.5822, test_loss: 1.2444, test_f1: 0.6504
 epoch: 21, train_loss: 0.5722, test_loss: 1.2146, test_f1: 0.5975
 epoch: 22, train_loss: 0.5500, test_loss: 1.4423, test_f1: 0.5532
 epoch: 23, train_loss: 0.5675, test_loss: 1.3006, test_f1: 0.5887
 epoch: 24, train_loss: 0.5550, test_loss: 1.3653, test_f1: 0.5887
 epoch: 25, train_loss: 0.5344, test_loss: 1.2786, test_f1: 0.6252
 epoch: 26, train_loss: 0.5347, test_loss: 1.2662, test_f1: 0.6257
 epoch: 27, train_loss: 0.5176, test_loss: 1.4101, test_f1: 0.6136
 epoch: 28, train_loss: 0.4880, test_loss: 1.3036, test_f1: 0.5885
 epoch: 29, train_loss: 0.5228, test_loss: 1.2849, test_f1: 0.6159
 epoch: 30, train_loss: 0.4746, test_loss: 1.5795, test_f1: 0.5336
 epoch: 31, train_loss: 0.4762, test_loss: 1.5448, test_f1: 0.5805
 epoch: 32, train_loss: 0.4774, test_loss: 1.4579, test_f1: 0.6370
 epoch: 33, train_loss: 0.4250, test_loss: 1.4817, test_f1: 0.6288
 epoch: 34, train_loss: 0.4545, test_loss: 1.5285, test_f1: 0.6161
 epoch: 35, train_loss: 0.4424, test_loss: 1.4398, test_f1: 0.6225
 epoch: 36, train_loss: 0.4227, test_loss: 1.7751, test_f1: 0.5527
 epoch: 37, train_loss: 0.4258, test_loss: 1.4824, test_f1: 0.6046
 epoch: 38, train_loss: 0.4050, test_loss: 1.5616, test_f1: 0.5851
 epoch: 39, train_loss: 0.3914, test_loss: 1.5718, test_f1: 0.6146
 epoch: 40, train_loss: 0.3834, test_loss: 1.5771, test_f1: 0.5708
 epoch: 41, train_loss: 0.4138, test_loss: 1.5353, test_f1: 0.5761
 epoch: 42, train_loss: 0.3875, test_loss: 1.6529, test_f1: 0.5956
 epoch: 43, train_loss: 0.3424, test_loss: 1.6265, test_f1: 0.5925
 epoch: 44, train_loss: 0.3886, test_loss: 1.5308, test_f1: 0.6333
 epoch: 45, train_loss: 0.3801, test_loss: 1.5972, test_f1: 0.6016
 epoch: 46, train_loss: 0.3688, test_loss: 1.7844, test_f1: 0.5860
 epoch: 47, train_loss: 0.3522, test_loss: 1.6594, test_f1: 0.6246
 epoch: 48, train_loss: 0.3602, test_loss: 1.5038, test_f1: 0.6130
 epoch: 49, train_loss: 0.3569, test_loss: 1.9011, test_f1: 0.5502
 epoch: 50, train_loss: 0.3413, test_loss: 1.7338, test_f1: 0.6237
 epoch: 51, train_loss: 0.3136, test_loss: 1.7627, test_f1: 0.5763
 epoch: 52, train_loss: 0.2723, test_loss: 1.7285, test_f1: 0.6201
 epoch: 53, train_loss: 0.2657, test_loss: 1.7053, test_f1: 0.5919
 epoch: 54, train_loss: 0.2411, test_loss: 1.7983, test_f1: 0.6021
 epoch: 55, train_loss: 0.2397, test_loss: 1.8586, test_f1: 0.5811
 epoch: 56, train_loss: 0.2563, test_loss: 1.8967, test_f1: 0.5813
 epoch: 57, train_loss: 0.2235, test_loss: 2.0242, test_f1: 0.5932
 epoch: 58, train_loss: 0.2474, test_loss: 1.9187, test_f1: 0.5978
 epoch: 59, train_loss: 0.2250, test_loss: 1.9540, test_f1: 0.5851
 epoch: 60, train_loss: 0.2394, test_loss: 1.9470, test_f1: 0.5904
 epoch: 61, train_loss: 0.2321, test_loss: 1.8868, test_f1: 0.5926
 epoch: 62, train_loss: 0.2302, test_loss: 2.0648, test_f1: 0.5897
 epoch: 63, train_loss: 0.2050, test_loss: 2.0422, test_f1: 0.6152
 epoch: 64, train_loss: 0.2032, test_loss: 2.0198, test_f1: 0.5864
 epoch: 65, train_loss: 0.2253, test_loss: 2.0097, test_f1: 0.5969
 epoch: 66, train_loss: 0.1926, test_loss: 2.1957, test_f1: 0.5781
 epoch: 67, train_loss: 0.2372, test_loss: 2.1245, test_f1: 0.6011
 epoch: 68, train_loss: 0.2117, test_loss: 2.0689, test_f1: 0.5779
 epoch: 69, train_loss: 0.1832, test_loss: 2.0796, test_f1: 0.5990
 epoch: 70, train_loss: 0.2009, test_loss: 2.1161, test_f1: 0.6142
 epoch: 71, train_loss: 0.1695, test_loss: 2.2060, test_f1: 0.5692
 epoch: 72, train_loss: 0.1942, test_loss: 2.1625, test_f1: 0.5628
 epoch: 73, train_loss: 0.1909, test_loss: 2.2129, test_f1: 0.5724
 epoch: 74, train_loss: 0.1746, test_loss: 2.2163, test_f1: 0.5958
 epoch: 75, train_loss: 0.1810, test_loss: 2.3534, test_f1: 0.6005
 epoch: 76, train_loss: 0.1921, test_loss: 2.1434, test_f1: 0.6191
 epoch: 77, train_loss: 0.1815, test_loss: 2.2094, test_f1: 0.6102
 epoch: 78, train_loss: 0.1916, test_loss: 2.3755, test_f1: 0.5696
 epoch: 79, train_loss: 0.1651, test_loss: 2.0918, test_f1: 0.5973
 epoch: 80, train_loss: 0.1897, test_loss: 2.3386, test_f1: 0.5925
 epoch: 81, train_loss: 0.1691, test_loss: 2.5102, test_f1: 0.5642
 epoch: 82, train_loss: 0.1673, test_loss: 2.2570, test_f1: 0.5921
 epoch: 83, train_loss: 0.1577, test_loss: 2.3175, test_f1: 0.5961
 epoch: 84, train_loss: 0.1700, test_loss: 2.3715, test_f1: 0.5839
 epoch: 85, train_loss: 0.1583, test_loss: 2.3143, test_f1: 0.5715
 epoch: 86, train_loss: 0.1607, test_loss: 2.3862, test_f1: 0.5755
 epoch: 87, train_loss: 0.1665, test_loss: 2.2047, test_f1: 0.6217
 epoch: 88, train_loss: 0.1814, test_loss: 2.2369, test_f1: 0.5718
 epoch: 89, train_loss: 0.1709, test_loss: 2.3181, test_f1: 0.5802
 epoch: 90, train_loss: 0.1929, test_loss: 2.3526, test_f1: 0.5774
 epoch: 91, train_loss: 0.2031, test_loss: 2.2564, test_f1: 0.5808
 epoch: 92, train_loss: 0.1874, test_loss: 2.2935, test_f1: 0.6016
 epoch: 93, train_loss: 0.1483, test_loss: 2.3984, test_f1: 0.5765
 epoch: 94, train_loss: 0.1583, test_loss: 2.3769, test_f1: 0.5778
 epoch: 95, train_loss: 0.1271, test_loss: 2.5375, test_f1: 0.5682
 epoch: 96, train_loss: 0.1331, test_loss: 2.4016, test_f1: 0.6117
 epoch: 97, train_loss: 0.1597, test_loss: 2.4906, test_f1: 0.6112
 epoch: 98, train_loss: 0.1411, test_loss: 2.5048, test_f1: 0.5973
 epoch: 99, train_loss: 0.1479, test_loss: 2.2738, test_f1: 0.6079
##################ITERATION #9 ****************************************
 epoch: 0, train_loss: 1.7331, test_loss: 1.6486, test_f1: 0.2460
 epoch: 1, train_loss: 1.1270, test_loss: 1.2895, test_f1: 0.3797
 epoch: 2, train_loss: 0.9593, test_loss: 1.1262, test_f1: 0.5948
 epoch: 3, train_loss: 0.9105, test_loss: 1.1882, test_f1: 0.5738
 epoch: 4, train_loss: 0.8738, test_loss: 1.0867, test_f1: 0.5884
 epoch: 5, train_loss: 0.8256, test_loss: 1.1061, test_f1: 0.5726
 epoch: 6, train_loss: 0.7920, test_loss: 1.1216, test_f1: 0.5787
 epoch: 7, train_loss: 0.7727, test_loss: 1.1472, test_f1: 0.5736
 epoch: 8, train_loss: 0.7387, test_loss: 1.1352, test_f1: 0.5502
 epoch: 9, train_loss: 0.7250, test_loss: 1.1699, test_f1: 0.5917
 epoch: 10, train_loss: 0.7055, test_loss: 1.2208, test_f1: 0.5866
 epoch: 11, train_loss: 0.6738, test_loss: 1.1795, test_f1: 0.5785
 epoch: 12, train_loss: 0.6726, test_loss: 1.2105, test_f1: 0.5528
 epoch: 13, train_loss: 0.6549, test_loss: 1.2153, test_f1: 0.5914
 epoch: 14, train_loss: 0.6458, test_loss: 1.1883, test_f1: 0.5816
 epoch: 15, train_loss: 0.6422, test_loss: 1.2344, test_f1: 0.6052
 epoch: 16, train_loss: 0.6251, test_loss: 1.1505, test_f1: 0.5739
 epoch: 17, train_loss: 0.6331, test_loss: 1.1307, test_f1: 0.6532
 epoch: 18, train_loss: 0.6060, test_loss: 1.2533, test_f1: 0.5956
 epoch: 19, train_loss: 0.6064, test_loss: 1.2732, test_f1: 0.5557
 epoch: 20, train_loss: 0.5789, test_loss: 1.2185, test_f1: 0.6153
 epoch: 21, train_loss: 0.5603, test_loss: 1.2663, test_f1: 0.6095
 epoch: 22, train_loss: 0.5471, test_loss: 1.2841, test_f1: 0.5813
 epoch: 23, train_loss: 0.5177, test_loss: 1.3380, test_f1: 0.5927
 epoch: 24, train_loss: 0.5124, test_loss: 1.3585, test_f1: 0.6203
 epoch: 25, train_loss: 0.5314, test_loss: 1.3572, test_f1: 0.5667
 epoch: 26, train_loss: 0.4994, test_loss: 1.3760, test_f1: 0.5660
 epoch: 27, train_loss: 0.5027, test_loss: 1.3266, test_f1: 0.6380
 epoch: 28, train_loss: 0.4692, test_loss: 1.3633, test_f1: 0.6316
 epoch: 29, train_loss: 0.4914, test_loss: 1.3936, test_f1: 0.6194
 epoch: 30, train_loss: 0.4565, test_loss: 1.4892, test_f1: 0.6275
 epoch: 31, train_loss: 0.4029, test_loss: 1.6469, test_f1: 0.5881
 epoch: 32, train_loss: 0.4098, test_loss: 1.5859, test_f1: 0.6207
 epoch: 33, train_loss: 0.4194, test_loss: 1.6236, test_f1: 0.6181
 epoch: 34, train_loss: 0.4194, test_loss: 1.6799, test_f1: 0.6007
 epoch: 35, train_loss: 0.4117, test_loss: 1.5985, test_f1: 0.6228
 epoch: 36, train_loss: 0.3943, test_loss: 1.5620, test_f1: 0.6405
 epoch: 37, train_loss: 0.3654, test_loss: 1.6210, test_f1: 0.6037
 epoch: 38, train_loss: 0.3543, test_loss: 1.6921, test_f1: 0.5897
 epoch: 39, train_loss: 0.3379, test_loss: 1.7270, test_f1: 0.6026
 epoch: 40, train_loss: 0.3459, test_loss: 1.7921, test_f1: 0.5748
 epoch: 41, train_loss: 0.3627, test_loss: 1.7725, test_f1: 0.5683
 epoch: 42, train_loss: 0.3134, test_loss: 1.7090, test_f1: 0.5888
 epoch: 43, train_loss: 0.3427, test_loss: 1.8524, test_f1: 0.6044
 epoch: 44, train_loss: 0.3633, test_loss: 1.7988, test_f1: 0.5922
 epoch: 45, train_loss: 0.3269, test_loss: 1.7914, test_f1: 0.5762
 epoch: 46, train_loss: 0.3113, test_loss: 1.8686, test_f1: 0.5900
 epoch: 47, train_loss: 0.3585, test_loss: 2.0310, test_f1: 0.5434
 epoch: 48, train_loss: 0.2948, test_loss: 2.0211, test_f1: 0.6036
 epoch: 49, train_loss: 0.3061, test_loss: 2.0087, test_f1: 0.5873
 epoch: 50, train_loss: 0.2819, test_loss: 2.0679, test_f1: 0.5851
 epoch: 51, train_loss: 0.2641, test_loss: 2.0993, test_f1: 0.5717
 epoch: 52, train_loss: 0.2402, test_loss: 2.0700, test_f1: 0.5751
 epoch: 53, train_loss: 0.2117, test_loss: 2.0867, test_f1: 0.5935
 epoch: 54, train_loss: 0.2414, test_loss: 2.1291, test_f1: 0.5859
 epoch: 55, train_loss: 0.2141, test_loss: 2.1779, test_f1: 0.5846
 epoch: 56, train_loss: 0.2220, test_loss: 2.1213, test_f1: 0.5866
 epoch: 57, train_loss: 0.2063, test_loss: 2.2188, test_f1: 0.5747
 epoch: 58, train_loss: 0.1863, test_loss: 2.2212, test_f1: 0.5676
 epoch: 59, train_loss: 0.1964, test_loss: 2.2193, test_f1: 0.6012
 epoch: 60, train_loss: 0.1891, test_loss: 2.2459, test_f1: 0.5979
 epoch: 61, train_loss: 0.1653, test_loss: 2.2480, test_f1: 0.6056
 epoch: 62, train_loss: 0.1989, test_loss: 2.1421, test_f1: 0.5950
 epoch: 63, train_loss: 0.1688, test_loss: 2.3054, test_f1: 0.6325
 epoch: 64, train_loss: 0.1806, test_loss: 2.3390, test_f1: 0.5948
 epoch: 65, train_loss: 0.1739, test_loss: 2.2964, test_f1: 0.5906
 epoch: 66, train_loss: 0.1667, test_loss: 2.4132, test_f1: 0.5783
 epoch: 67, train_loss: 0.1827, test_loss: 2.4176, test_f1: 0.5869
 epoch: 68, train_loss: 0.2124, test_loss: 2.3605, test_f1: 0.6098
 epoch: 69, train_loss: 0.1704, test_loss: 2.3851, test_f1: 0.5998
 epoch: 70, train_loss: 0.1705, test_loss: 2.5429, test_f1: 0.5909
 epoch: 71, train_loss: 0.1664, test_loss: 2.5745, test_f1: 0.5829
 epoch: 72, train_loss: 0.1555, test_loss: 2.5842, test_f1: 0.5483
 epoch: 73, train_loss: 0.1638, test_loss: 2.4807, test_f1: 0.5679
 epoch: 74, train_loss: 0.1805, test_loss: 2.6713, test_f1: 0.5693
 epoch: 75, train_loss: 0.1694, test_loss: 2.6479, test_f1: 0.5940
 epoch: 76, train_loss: 0.1613, test_loss: 2.4006, test_f1: 0.6160
 epoch: 77, train_loss: 0.1689, test_loss: 2.5377, test_f1: 0.5888
 epoch: 78, train_loss: 0.1412, test_loss: 2.5990, test_f1: 0.6091
 epoch: 79, train_loss: 0.1398, test_loss: 2.5919, test_f1: 0.5585
 epoch: 80, train_loss: 0.1740, test_loss: 2.5355, test_f1: 0.5848
 epoch: 81, train_loss: 0.1467, test_loss: 2.5757, test_f1: 0.5695
 epoch: 82, train_loss: 0.1486, test_loss: 2.7026, test_f1: 0.5572
 epoch: 83, train_loss: 0.1421, test_loss: 2.5560, test_f1: 0.6080
 epoch: 84, train_loss: 0.1353, test_loss: 2.7527, test_f1: 0.5928
 epoch: 85, train_loss: 0.1419, test_loss: 2.7183, test_f1: 0.6010
 epoch: 86, train_loss: 0.1430, test_loss: 2.6211, test_f1: 0.5996
 epoch: 87, train_loss: 0.1316, test_loss: 2.6189, test_f1: 0.5764
 epoch: 88, train_loss: 0.1175, test_loss: 2.6529, test_f1: 0.5973
 epoch: 89, train_loss: 0.1328, test_loss: 2.6769, test_f1: 0.5874
 epoch: 90, train_loss: 0.1637, test_loss: 2.5494, test_f1: 0.6077
 epoch: 91, train_loss: 0.1527, test_loss: 2.8351, test_f1: 0.5937
 epoch: 92, train_loss: 0.1254, test_loss: 2.7719, test_f1: 0.6189
 epoch: 93, train_loss: 0.1256, test_loss: 2.4961, test_f1: 0.6175
 epoch: 94, train_loss: 0.1490, test_loss: 2.6338, test_f1: 0.6351
 epoch: 95, train_loss: 0.1425, test_loss: 2.6374, test_f1: 0.5966
 epoch: 96, train_loss: 0.1159, test_loss: 2.6402, test_f1: 0.6106
 epoch: 97, train_loss: 0.1194, test_loss: 2.8858, test_f1: 0.5918
 epoch: 98, train_loss: 0.1099, test_loss: 2.7881, test_f1: 0.5704
 epoch: 99, train_loss: 0.1264, test_loss: 2.6672, test_f1: 0.6149

Training completed in 550.18 seconds
Best F1: 0.6878 at epoch 19
Mean F1 across iterations: 0.6608  0.0153
========================FINAL RESULTS================================
FEGIN weighted F1: 0.6878  0.0153
python main.py --data ltspice_demos --representation component_pin_net --model FEGIN --layers 2 --hiddens 128 --batch_size 64 --lr 0.001 --emb_size 128 --epochs 100 --save_appendix component_pin_net_L2_H128_BS64_LR0.001_E128 --no_val
-----



STDERR:
  File "main.py", line 370, in <module>
    main()
  File "main.py", line 254, in main
    dataset = dataset_class(
  File "/home/philip/projects/ltspice_examples_code_repo/Circuit-Completion-Using-GNNs/component_classification_with_link_prediction_head/evaluation/FEGIN/kernel/circuit_datasets.py", line 15, in __init__
    self.data, self.slices = torch.load(self.processed_paths[0])
  File "/home/philip/.local/lib/python3.8/site-packages/torch/serialization.py", line 1040, in load
    warnings.warn(
  File "/usr/lib/python3.8/warnings.py", line 109, in _showwarnmsg
    sw(msg.message, msg.category, msg.filename, msg.lineno,
  File "main.py", line 47, in warn_with_traceback
    traceback.print_stack(file=log)
/home/philip/projects/ltspice_examples_code_repo/Circuit-Completion-Using-GNNs/component_classification_with_link_prediction_head/evaluation/FEGIN/kernel/circuit_datasets.py:15: FutureWarning: You are using `torch.load` with `weights_only=False` (the current default value), which uses the default pickle module implicitly. It is possible to construct malicious pickle data which will execute arbitrary code during unpickling (See https://github.com/pytorch/pytorch/blob/main/SECURITY.md#untrusted-models for more details). In a future release, the default value for `weights_only` will be flipped to `True`. This limits the functions that could be executed during unpickling. Arbitrary objects will no longer be allowed to be loaded via this mode unless they are explicitly allowlisted by the user via `torch.serialization.add_safe_globals`. We recommend you start setting `weights_only=True` for any use case where you don't have full control of the loaded file. Please open an issue on GitHub for any issues related to this experimental feature.
  self.data, self.slices = torch.load(self.processed_paths[0])
