STDOUT:
Results will be saved in /home/philip/projects/llm_inference_code_repo/Circuit-Completion-Using-GNNs/component_classification_with_link_prediction_head/evaluation/FEGIN/results/model_FEGIN_dataset_ltspice_examples
Command line input: python main.py --data ltspice_examples --representation component_component --model FEGIN --layers 5 --hiddens 32 --batch_size 64 --lr 0.01 --emb_size 250 --epochs 100 --save_appendix component_component_L5_H32_BS64_LR0.01_E250 --no_val
 is saved.
-----
ltspice_examples - FEGIN
Using 5 layers, 32 hidden units, h = 2
Loading component_component representation dataset
ENTERED
Training FEGIN on component_component representation
Train: 3556, Test: 845
##################ITERATION #0 ****************************************
 epoch: 0, train_loss: 1.2756, test_loss: 1.2374, test_f1: 0.3221
 epoch: 1, train_loss: 1.1939, test_loss: 1.1475, test_f1: 0.4359
 epoch: 2, train_loss: 1.1303, test_loss: 1.0348, test_f1: 0.4756
 epoch: 3, train_loss: 1.1056, test_loss: 0.9746, test_f1: 0.4997
 epoch: 4, train_loss: 1.1045, test_loss: 0.9829, test_f1: 0.4624
 epoch: 5, train_loss: 1.0536, test_loss: 1.0207, test_f1: 0.4543
 epoch: 6, train_loss: 1.0245, test_loss: 1.0979, test_f1: 0.4282
 epoch: 7, train_loss: 1.0311, test_loss: 0.9099, test_f1: 0.5009
 epoch: 8, train_loss: 0.9870, test_loss: 0.9434, test_f1: 0.5023
 epoch: 9, train_loss: 0.9725, test_loss: 0.8881, test_f1: 0.5101
 epoch: 10, train_loss: 0.9778, test_loss: 0.9272, test_f1: 0.4724
 epoch: 11, train_loss: 0.9751, test_loss: 1.0628, test_f1: 0.4988
 epoch: 12, train_loss: 0.9453, test_loss: 1.0384, test_f1: 0.5097
 epoch: 13, train_loss: 0.9635, test_loss: 0.9150, test_f1: 0.5078
 epoch: 14, train_loss: 0.9628, test_loss: 0.8685, test_f1: 0.5064
 epoch: 15, train_loss: 0.9410, test_loss: 0.9742, test_f1: 0.4830
 epoch: 16, train_loss: 0.9398, test_loss: 0.8929, test_f1: 0.5017
 epoch: 17, train_loss: 0.9310, test_loss: 0.8988, test_f1: 0.5241
 epoch: 18, train_loss: 0.9155, test_loss: 0.8497, test_f1: 0.5301
 epoch: 19, train_loss: 0.9171, test_loss: 0.9095, test_f1: 0.4948
 epoch: 20, train_loss: 0.9043, test_loss: 0.8946, test_f1: 0.5274
 epoch: 21, train_loss: 0.8868, test_loss: 0.8768, test_f1: 0.5398
 epoch: 22, train_loss: 0.8877, test_loss: 0.9008, test_f1: 0.5000
 epoch: 23, train_loss: 0.8927, test_loss: 0.9210, test_f1: 0.5318
 epoch: 24, train_loss: 0.8906, test_loss: 0.8946, test_f1: 0.5257
 epoch: 25, train_loss: 0.8942, test_loss: 0.9356, test_f1: 0.5446
 epoch: 26, train_loss: 0.8985, test_loss: 0.8688, test_f1: 0.5459
 epoch: 27, train_loss: 0.8762, test_loss: 0.9140, test_f1: 0.5439
 epoch: 28, train_loss: 0.8661, test_loss: 0.9270, test_f1: 0.5231
 epoch: 29, train_loss: 0.8596, test_loss: 0.9352, test_f1: 0.5156
 epoch: 30, train_loss: 0.8594, test_loss: 1.0260, test_f1: 0.5115
 epoch: 31, train_loss: 0.8553, test_loss: 0.9818, test_f1: 0.5302
 epoch: 32, train_loss: 0.8501, test_loss: 0.8625, test_f1: 0.5721
 epoch: 33, train_loss: 0.8380, test_loss: 0.8490, test_f1: 0.5899
 epoch: 34, train_loss: 0.8738, test_loss: 0.9373, test_f1: 0.5480
 epoch: 35, train_loss: 0.8392, test_loss: 0.9332, test_f1: 0.5668
 epoch: 36, train_loss: 0.8352, test_loss: 0.8835, test_f1: 0.5756
 epoch: 37, train_loss: 0.8217, test_loss: 0.9041, test_f1: 0.5661
 epoch: 38, train_loss: 0.8247, test_loss: 0.9248, test_f1: 0.5462
 epoch: 39, train_loss: 0.8129, test_loss: 1.0154, test_f1: 0.5165
 epoch: 40, train_loss: 0.8331, test_loss: 0.9193, test_f1: 0.5404
 epoch: 41, train_loss: 0.8288, test_loss: 0.8961, test_f1: 0.5562
 epoch: 42, train_loss: 0.8228, test_loss: 0.9438, test_f1: 0.5615
 epoch: 43, train_loss: 0.8075, test_loss: 0.9159, test_f1: 0.5598
 epoch: 44, train_loss: 0.7996, test_loss: 0.9201, test_f1: 0.5593
 epoch: 45, train_loss: 0.8024, test_loss: 0.8715, test_f1: 0.5821
 epoch: 46, train_loss: 0.8100, test_loss: 0.9459, test_f1: 0.5709
 epoch: 47, train_loss: 0.7994, test_loss: 0.9239, test_f1: 0.5588
 epoch: 48, train_loss: 0.7915, test_loss: 0.9336, test_f1: 0.5783
 epoch: 49, train_loss: 0.8205, test_loss: 1.0384, test_f1: 0.5004
 epoch: 50, train_loss: 0.7841, test_loss: 1.0145, test_f1: 0.5702
 epoch: 51, train_loss: 0.7633, test_loss: 0.9699, test_f1: 0.5623
 epoch: 52, train_loss: 0.7422, test_loss: 0.9257, test_f1: 0.5663
 epoch: 53, train_loss: 0.7216, test_loss: 0.9991, test_f1: 0.5728
 epoch: 54, train_loss: 0.7352, test_loss: 1.0032, test_f1: 0.5738
 epoch: 55, train_loss: 0.7192, test_loss: 1.1454, test_f1: 0.5452
 epoch: 56, train_loss: 0.7385, test_loss: 1.0113, test_f1: 0.5705
 epoch: 57, train_loss: 0.7311, test_loss: 1.0522, test_f1: 0.5402
 epoch: 58, train_loss: 0.7174, test_loss: 1.0648, test_f1: 0.5601
 epoch: 59, train_loss: 0.7171, test_loss: 1.0609, test_f1: 0.5335
 epoch: 60, train_loss: 0.7031, test_loss: 1.0416, test_f1: 0.5680
 epoch: 61, train_loss: 0.7174, test_loss: 0.9803, test_f1: 0.5635
 epoch: 62, train_loss: 0.7170, test_loss: 1.2029, test_f1: 0.5424
 epoch: 63, train_loss: 0.7059, test_loss: 1.1728, test_f1: 0.5655
 epoch: 64, train_loss: 0.7082, test_loss: 1.0591, test_f1: 0.5796
 epoch: 65, train_loss: 0.7053, test_loss: 1.0880, test_f1: 0.5519
 epoch: 66, train_loss: 0.7038, test_loss: 0.9968, test_f1: 0.5715
 epoch: 67, train_loss: 0.7253, test_loss: 0.9981, test_f1: 0.5631
 epoch: 68, train_loss: 0.7123, test_loss: 1.0951, test_f1: 0.5572
 epoch: 69, train_loss: 0.7077, test_loss: 1.0449, test_f1: 0.5492
 epoch: 70, train_loss: 0.7075, test_loss: 0.9195, test_f1: 0.5854
 epoch: 71, train_loss: 0.7057, test_loss: 1.0374, test_f1: 0.5657
 epoch: 72, train_loss: 0.6879, test_loss: 0.9911, test_f1: 0.5916
 epoch: 73, train_loss: 0.6824, test_loss: 0.9678, test_f1: 0.5907
 epoch: 74, train_loss: 0.6721, test_loss: 1.1539, test_f1: 0.5565
 epoch: 75, train_loss: 0.6877, test_loss: 0.9552, test_f1: 0.5824
 epoch: 76, train_loss: 0.6790, test_loss: 1.0618, test_f1: 0.5766
 epoch: 77, train_loss: 0.6591, test_loss: 1.0205, test_f1: 0.6028
 epoch: 78, train_loss: 0.6683, test_loss: 1.1326, test_f1: 0.5852
 epoch: 79, train_loss: 0.6803, test_loss: 0.9552, test_f1: 0.5801
 epoch: 80, train_loss: 0.6664, test_loss: 1.1363, test_f1: 0.5790
 epoch: 81, train_loss: 0.6780, test_loss: 0.9203, test_f1: 0.5882
 epoch: 82, train_loss: 0.6683, test_loss: 1.0924, test_f1: 0.5748
 epoch: 83, train_loss: 0.6466, test_loss: 1.1229, test_f1: 0.5663
 epoch: 84, train_loss: 0.6478, test_loss: 1.1290, test_f1: 0.5550
 epoch: 85, train_loss: 0.6676, test_loss: 1.0512, test_f1: 0.5643
 epoch: 86, train_loss: 0.6471, test_loss: 1.1796, test_f1: 0.5740
 epoch: 87, train_loss: 0.6547, test_loss: 1.2130, test_f1: 0.5668
 epoch: 88, train_loss: 0.6483, test_loss: 1.0891, test_f1: 0.5586
 epoch: 89, train_loss: 0.6599, test_loss: 1.0893, test_f1: 0.5551
 epoch: 90, train_loss: 0.6465, test_loss: 1.3560, test_f1: 0.5834
 epoch: 91, train_loss: 0.6650, test_loss: 1.1470, test_f1: 0.5710
 epoch: 92, train_loss: 0.6293, test_loss: 1.1102, test_f1: 0.5844
 epoch: 93, train_loss: 0.6326, test_loss: 1.1210, test_f1: 0.5364
 epoch: 94, train_loss: 0.6316, test_loss: 1.0376, test_f1: 0.5900
 epoch: 95, train_loss: 0.6216, test_loss: 1.1215, test_f1: 0.5576
 epoch: 96, train_loss: 0.6305, test_loss: 1.0864, test_f1: 0.5927
 epoch: 97, train_loss: 0.6474, test_loss: 1.0679, test_f1: 0.5778
 epoch: 98, train_loss: 0.6408, test_loss: 1.2600, test_f1: 0.5723
 epoch: 99, train_loss: 0.6388, test_loss: 1.1660, test_f1: 0.5796
##################ITERATION #1 ****************************************
 epoch: 0, train_loss: 1.2677, test_loss: 1.2033, test_f1: 0.3395
 epoch: 1, train_loss: 1.1807, test_loss: 1.1030, test_f1: 0.4322
 epoch: 2, train_loss: 1.1185, test_loss: 1.0291, test_f1: 0.4518
 epoch: 3, train_loss: 1.0841, test_loss: 1.0945, test_f1: 0.4400
 epoch: 4, train_loss: 1.0597, test_loss: 0.9647, test_f1: 0.4783
 epoch: 5, train_loss: 1.0478, test_loss: 0.9652, test_f1: 0.4547
 epoch: 6, train_loss: 1.0243, test_loss: 0.9817, test_f1: 0.4627
 epoch: 7, train_loss: 0.9994, test_loss: 1.0472, test_f1: 0.4875
 epoch: 8, train_loss: 0.9860, test_loss: 1.0162, test_f1: 0.4682
 epoch: 9, train_loss: 0.9881, test_loss: 0.9905, test_f1: 0.4418
 epoch: 10, train_loss: 0.9817, test_loss: 0.9925, test_f1: 0.4782
 epoch: 11, train_loss: 0.9428, test_loss: 1.0705, test_f1: 0.4720
 epoch: 12, train_loss: 0.9392, test_loss: 1.1266, test_f1: 0.4522
 epoch: 13, train_loss: 0.9468, test_loss: 1.0216, test_f1: 0.4916
 epoch: 14, train_loss: 0.9468, test_loss: 0.9969, test_f1: 0.4946
 epoch: 15, train_loss: 0.9158, test_loss: 1.0623, test_f1: 0.4481
 epoch: 16, train_loss: 0.8984, test_loss: 0.9955, test_f1: 0.5003
 epoch: 17, train_loss: 0.8931, test_loss: 1.0107, test_f1: 0.5185
 epoch: 18, train_loss: 0.8977, test_loss: 1.0204, test_f1: 0.5415
 epoch: 19, train_loss: 0.9045, test_loss: 0.9932, test_f1: 0.5396
 epoch: 20, train_loss: 0.8971, test_loss: 1.0168, test_f1: 0.5408
 epoch: 21, train_loss: 0.8879, test_loss: 1.0473, test_f1: 0.5355
 epoch: 22, train_loss: 0.8880, test_loss: 1.0637, test_f1: 0.5231
 epoch: 23, train_loss: 0.8772, test_loss: 1.0124, test_f1: 0.5635
 epoch: 24, train_loss: 0.8678, test_loss: 1.1934, test_f1: 0.5285
 epoch: 25, train_loss: 0.8784, test_loss: 1.0846, test_f1: 0.5205
 epoch: 26, train_loss: 0.8657, test_loss: 1.0157, test_f1: 0.5439
 epoch: 27, train_loss: 0.8722, test_loss: 1.0011, test_f1: 0.5656
 epoch: 28, train_loss: 0.8589, test_loss: 0.9889, test_f1: 0.5652
 epoch: 29, train_loss: 0.8544, test_loss: 1.0422, test_f1: 0.5794
 epoch: 30, train_loss: 0.8561, test_loss: 1.0810, test_f1: 0.5388
 epoch: 31, train_loss: 0.8498, test_loss: 1.1658, test_f1: 0.5030
 epoch: 32, train_loss: 0.8412, test_loss: 1.1914, test_f1: 0.5160
 epoch: 33, train_loss: 0.8321, test_loss: 0.9740, test_f1: 0.5724
 epoch: 34, train_loss: 0.8525, test_loss: 1.0461, test_f1: 0.5668
 epoch: 35, train_loss: 0.8643, test_loss: 1.0339, test_f1: 0.5307
 epoch: 36, train_loss: 0.8035, test_loss: 1.0465, test_f1: 0.5525
 epoch: 37, train_loss: 0.8173, test_loss: 0.9891, test_f1: 0.5478
 epoch: 38, train_loss: 0.8251, test_loss: 1.0366, test_f1: 0.5382
 epoch: 39, train_loss: 0.8160, test_loss: 0.9583, test_f1: 0.5524
 epoch: 40, train_loss: 0.8174, test_loss: 1.0524, test_f1: 0.5589
 epoch: 41, train_loss: 0.8014, test_loss: 1.0069, test_f1: 0.5486
 epoch: 42, train_loss: 0.8438, test_loss: 0.9984, test_f1: 0.5168
 epoch: 43, train_loss: 0.8098, test_loss: 1.0549, test_f1: 0.5455
 epoch: 44, train_loss: 0.7924, test_loss: 1.0322, test_f1: 0.5387
 epoch: 45, train_loss: 0.8153, test_loss: 1.0657, test_f1: 0.5411
 epoch: 46, train_loss: 0.8151, test_loss: 1.0176, test_f1: 0.5294
 epoch: 47, train_loss: 0.8136, test_loss: 0.9995, test_f1: 0.5585
 epoch: 48, train_loss: 0.7969, test_loss: 1.0105, test_f1: 0.5477
 epoch: 49, train_loss: 0.7862, test_loss: 1.0353, test_f1: 0.5789
 epoch: 50, train_loss: 0.7830, test_loss: 0.9744, test_f1: 0.5574
 epoch: 51, train_loss: 0.7555, test_loss: 1.0281, test_f1: 0.5797
 epoch: 52, train_loss: 0.7436, test_loss: 1.0261, test_f1: 0.5830
 epoch: 53, train_loss: 0.7257, test_loss: 0.9990, test_f1: 0.5660
 epoch: 54, train_loss: 0.7429, test_loss: 0.9850, test_f1: 0.5639
 epoch: 55, train_loss: 0.7231, test_loss: 1.0265, test_f1: 0.5706
 epoch: 56, train_loss: 0.7226, test_loss: 1.0572, test_f1: 0.5899
 epoch: 57, train_loss: 0.7369, test_loss: 1.0210, test_f1: 0.5654
 epoch: 58, train_loss: 0.7160, test_loss: 1.0569, test_f1: 0.5579
 epoch: 59, train_loss: 0.7247, test_loss: 1.0808, test_f1: 0.5618
 epoch: 60, train_loss: 0.7247, test_loss: 1.0832, test_f1: 0.5664
 epoch: 61, train_loss: 0.7226, test_loss: 1.0142, test_f1: 0.5638
 epoch: 62, train_loss: 0.7053, test_loss: 1.0635, test_f1: 0.5806
 epoch: 63, train_loss: 0.7055, test_loss: 1.0696, test_f1: 0.5658
 epoch: 64, train_loss: 0.7201, test_loss: 1.0587, test_f1: 0.5705
 epoch: 65, train_loss: 0.6987, test_loss: 1.0052, test_f1: 0.5927
 epoch: 66, train_loss: 0.7102, test_loss: 1.0984, test_f1: 0.5681
 epoch: 67, train_loss: 0.7047, test_loss: 1.0793, test_f1: 0.5751
 epoch: 68, train_loss: 0.7083, test_loss: 1.0758, test_f1: 0.5766
 epoch: 69, train_loss: 0.6926, test_loss: 1.0612, test_f1: 0.5816
 epoch: 70, train_loss: 0.6870, test_loss: 1.0274, test_f1: 0.5761
 epoch: 71, train_loss: 0.6984, test_loss: 1.0824, test_f1: 0.5799
 epoch: 72, train_loss: 0.6753, test_loss: 1.1178, test_f1: 0.5802
 epoch: 73, train_loss: 0.6984, test_loss: 1.0492, test_f1: 0.5528
 epoch: 74, train_loss: 0.6948, test_loss: 1.1998, test_f1: 0.5430
 epoch: 75, train_loss: 0.7044, test_loss: 1.1065, test_f1: 0.5663
 epoch: 76, train_loss: 0.6771, test_loss: 1.1184, test_f1: 0.5892
 epoch: 77, train_loss: 0.6703, test_loss: 1.1185, test_f1: 0.5940
 epoch: 78, train_loss: 0.6807, test_loss: 1.2165, test_f1: 0.5741
 epoch: 79, train_loss: 0.6785, test_loss: 1.1802, test_f1: 0.5689
 epoch: 80, train_loss: 0.6843, test_loss: 1.0420, test_f1: 0.5660
 epoch: 81, train_loss: 0.6733, test_loss: 1.0749, test_f1: 0.5824
 epoch: 82, train_loss: 0.6696, test_loss: 1.1606, test_f1: 0.5674
 epoch: 83, train_loss: 0.6732, test_loss: 1.0701, test_f1: 0.5850
 epoch: 84, train_loss: 0.6650, test_loss: 1.1647, test_f1: 0.5540
 epoch: 85, train_loss: 0.6561, test_loss: 1.1633, test_f1: 0.5728
 epoch: 86, train_loss: 0.6661, test_loss: 1.1493, test_f1: 0.5512
 epoch: 87, train_loss: 0.6656, test_loss: 1.2502, test_f1: 0.5766
 epoch: 88, train_loss: 0.6774, test_loss: 1.0666, test_f1: 0.5907
 epoch: 89, train_loss: 0.6718, test_loss: 1.0776, test_f1: 0.5826
 epoch: 90, train_loss: 0.6656, test_loss: 1.1972, test_f1: 0.5852
 epoch: 91, train_loss: 0.6616, test_loss: 1.1148, test_f1: 0.5781
 epoch: 92, train_loss: 0.6532, test_loss: 1.0949, test_f1: 0.5872
 epoch: 93, train_loss: 0.6399, test_loss: 1.2616, test_f1: 0.5821
 epoch: 94, train_loss: 0.6489, test_loss: 1.1249, test_f1: 0.5890
 epoch: 95, train_loss: 0.6463, test_loss: 1.1892, test_f1: 0.5801
 epoch: 96, train_loss: 0.6457, test_loss: 1.1509, test_f1: 0.5795
 epoch: 97, train_loss: 0.6303, test_loss: 1.2226, test_f1: 0.5709
 epoch: 98, train_loss: 0.6292, test_loss: 1.2420, test_f1: 0.5799
 epoch: 99, train_loss: 0.6338, test_loss: 1.1682, test_f1: 0.5787
##################ITERATION #2 ****************************************
 epoch: 0, train_loss: 1.2936, test_loss: 1.2164, test_f1: 0.2274
 epoch: 1, train_loss: 1.1899, test_loss: 1.1176, test_f1: 0.4263
 epoch: 2, train_loss: 1.1272, test_loss: 1.0453, test_f1: 0.4939
 epoch: 3, train_loss: 1.0979, test_loss: 1.0103, test_f1: 0.4467
 epoch: 4, train_loss: 1.0586, test_loss: 1.0869, test_f1: 0.4728
 epoch: 5, train_loss: 1.0593, test_loss: 1.0542, test_f1: 0.4550
 epoch: 6, train_loss: 1.0364, test_loss: 0.9881, test_f1: 0.4932
 epoch: 7, train_loss: 1.0192, test_loss: 0.9905, test_f1: 0.4852
 epoch: 8, train_loss: 1.0120, test_loss: 1.0073, test_f1: 0.4624
 epoch: 9, train_loss: 0.9939, test_loss: 1.0110, test_f1: 0.5151
 epoch: 10, train_loss: 0.9699, test_loss: 1.0954, test_f1: 0.4748
 epoch: 11, train_loss: 0.9598, test_loss: 1.0741, test_f1: 0.4878
 epoch: 12, train_loss: 0.9584, test_loss: 0.9820, test_f1: 0.4858
 epoch: 13, train_loss: 0.9685, test_loss: 1.0248, test_f1: 0.4787
 epoch: 14, train_loss: 0.9510, test_loss: 0.9667, test_f1: 0.4848
 epoch: 15, train_loss: 0.9475, test_loss: 1.0208, test_f1: 0.5021
 epoch: 16, train_loss: 0.9382, test_loss: 0.9497, test_f1: 0.4744
 epoch: 17, train_loss: 0.9327, test_loss: 0.9771, test_f1: 0.5113
 epoch: 18, train_loss: 0.9238, test_loss: 1.0644, test_f1: 0.5074
 epoch: 19, train_loss: 0.9206, test_loss: 1.0348, test_f1: 0.5119
 epoch: 20, train_loss: 0.9153, test_loss: 1.0026, test_f1: 0.4985
 epoch: 21, train_loss: 0.9364, test_loss: 1.0966, test_f1: 0.5127
 epoch: 22, train_loss: 0.9368, test_loss: 0.9403, test_f1: 0.5050
 epoch: 23, train_loss: 0.9027, test_loss: 1.0291, test_f1: 0.4984
 epoch: 24, train_loss: 0.9143, test_loss: 1.0346, test_f1: 0.5121
 epoch: 25, train_loss: 0.9106, test_loss: 1.0655, test_f1: 0.4877
 epoch: 26, train_loss: 0.9213, test_loss: 1.0885, test_f1: 0.4998
 epoch: 27, train_loss: 0.9048, test_loss: 1.0068, test_f1: 0.5016
 epoch: 28, train_loss: 0.8904, test_loss: 1.0542, test_f1: 0.5215
 epoch: 29, train_loss: 0.8809, test_loss: 0.9716, test_f1: 0.5076
 epoch: 30, train_loss: 0.8892, test_loss: 0.9501, test_f1: 0.5331
 epoch: 31, train_loss: 0.8805, test_loss: 1.0463, test_f1: 0.5184
 epoch: 32, train_loss: 0.8671, test_loss: 0.9820, test_f1: 0.5478
 epoch: 33, train_loss: 0.8742, test_loss: 1.0246, test_f1: 0.5082
 epoch: 34, train_loss: 0.8585, test_loss: 1.0405, test_f1: 0.5388
 epoch: 35, train_loss: 0.8596, test_loss: 1.0418, test_f1: 0.5407
 epoch: 36, train_loss: 0.8689, test_loss: 0.9780, test_f1: 0.5667
 epoch: 37, train_loss: 0.8478, test_loss: 1.2030, test_f1: 0.5293
 epoch: 38, train_loss: 0.8777, test_loss: 1.1251, test_f1: 0.4798
 epoch: 39, train_loss: 0.8554, test_loss: 1.0067, test_f1: 0.5568
 epoch: 40, train_loss: 0.8568, test_loss: 0.8977, test_f1: 0.5266
 epoch: 41, train_loss: 0.8637, test_loss: 1.0158, test_f1: 0.5642
 epoch: 42, train_loss: 0.8392, test_loss: 0.9661, test_f1: 0.5497
 epoch: 43, train_loss: 0.8299, test_loss: 0.9497, test_f1: 0.5654
 epoch: 44, train_loss: 0.8362, test_loss: 1.0543, test_f1: 0.5416
 epoch: 45, train_loss: 0.8293, test_loss: 0.9697, test_f1: 0.5397
 epoch: 46, train_loss: 0.8331, test_loss: 1.0254, test_f1: 0.5647
 epoch: 47, train_loss: 0.8197, test_loss: 1.0996, test_f1: 0.5351
 epoch: 48, train_loss: 0.8485, test_loss: 1.0579, test_f1: 0.5154
 epoch: 49, train_loss: 0.8416, test_loss: 1.0358, test_f1: 0.5549
 epoch: 50, train_loss: 0.8143, test_loss: 0.9625, test_f1: 0.5592
 epoch: 51, train_loss: 0.7885, test_loss: 1.0124, test_f1: 0.5507
 epoch: 52, train_loss: 0.7682, test_loss: 1.1805, test_f1: 0.4973
 epoch: 53, train_loss: 0.7792, test_loss: 1.0372, test_f1: 0.5366
 epoch: 54, train_loss: 0.7587, test_loss: 1.0229, test_f1: 0.5606
 epoch: 55, train_loss: 0.7620, test_loss: 1.0278, test_f1: 0.5617
 epoch: 56, train_loss: 0.7581, test_loss: 1.0571, test_f1: 0.5569
 epoch: 57, train_loss: 0.7681, test_loss: 1.0427, test_f1: 0.5109
 epoch: 58, train_loss: 0.7565, test_loss: 1.0881, test_f1: 0.5229
 epoch: 59, train_loss: 0.7495, test_loss: 0.9691, test_f1: 0.5597
 epoch: 60, train_loss: 0.7388, test_loss: 1.0550, test_f1: 0.5638
 epoch: 61, train_loss: 0.7251, test_loss: 1.0266, test_f1: 0.5334
 epoch: 62, train_loss: 0.7303, test_loss: 1.0433, test_f1: 0.5749
 epoch: 63, train_loss: 0.7374, test_loss: 1.0378, test_f1: 0.5582
 epoch: 64, train_loss: 0.7431, test_loss: 1.0630, test_f1: 0.5833
 epoch: 65, train_loss: 0.7231, test_loss: 1.0008, test_f1: 0.5897
 epoch: 66, train_loss: 0.7239, test_loss: 1.0610, test_f1: 0.5747
 epoch: 67, train_loss: 0.7342, test_loss: 1.0434, test_f1: 0.5633
 epoch: 68, train_loss: 0.7238, test_loss: 1.0515, test_f1: 0.5623
 epoch: 69, train_loss: 0.7247, test_loss: 1.0971, test_f1: 0.5922
 epoch: 70, train_loss: 0.7275, test_loss: 1.1382, test_f1: 0.5114
 epoch: 71, train_loss: 0.7107, test_loss: 1.2002, test_f1: 0.5145
 epoch: 72, train_loss: 0.7182, test_loss: 1.0925, test_f1: 0.5588
 epoch: 73, train_loss: 0.7165, test_loss: 1.0958, test_f1: 0.5618
 epoch: 74, train_loss: 0.7221, test_loss: 1.0487, test_f1: 0.5707
 epoch: 75, train_loss: 0.7004, test_loss: 1.0532, test_f1: 0.5628
 epoch: 76, train_loss: 0.7039, test_loss: 1.1469, test_f1: 0.5482
 epoch: 77, train_loss: 0.7092, test_loss: 1.2046, test_f1: 0.5602
 epoch: 78, train_loss: 0.7112, test_loss: 0.9859, test_f1: 0.5585
 epoch: 79, train_loss: 0.7081, test_loss: 1.1235, test_f1: 0.5368
 epoch: 80, train_loss: 0.7045, test_loss: 1.0762, test_f1: 0.5698
 epoch: 81, train_loss: 0.7073, test_loss: 1.0885, test_f1: 0.5593
 epoch: 82, train_loss: 0.6913, test_loss: 1.0532, test_f1: 0.5770
 epoch: 83, train_loss: 0.6954, test_loss: 1.0607, test_f1: 0.5663
 epoch: 84, train_loss: 0.6952, test_loss: 1.0180, test_f1: 0.5813
 epoch: 85, train_loss: 0.6976, test_loss: 1.0715, test_f1: 0.5476
 epoch: 86, train_loss: 0.6850, test_loss: 1.0576, test_f1: 0.5839
 epoch: 87, train_loss: 0.6670, test_loss: 1.1938, test_f1: 0.5405
 epoch: 88, train_loss: 0.6782, test_loss: 1.1087, test_f1: 0.5514
 epoch: 89, train_loss: 0.6695, test_loss: 1.1189, test_f1: 0.5581
 epoch: 90, train_loss: 0.6610, test_loss: 1.0472, test_f1: 0.5578
 epoch: 91, train_loss: 0.6629, test_loss: 1.0603, test_f1: 0.5684
 epoch: 92, train_loss: 0.6643, test_loss: 1.0411, test_f1: 0.5777
 epoch: 93, train_loss: 0.6600, test_loss: 1.0470, test_f1: 0.5714
 epoch: 94, train_loss: 0.6581, test_loss: 1.0585, test_f1: 0.5769
 epoch: 95, train_loss: 0.6611, test_loss: 1.1003, test_f1: 0.5736
 epoch: 96, train_loss: 0.6696, test_loss: 1.0629, test_f1: 0.5818
 epoch: 97, train_loss: 0.6296, test_loss: 1.1550, test_f1: 0.5517
 epoch: 98, train_loss: 0.6473, test_loss: 1.1224, test_f1: 0.5636
 epoch: 99, train_loss: 0.6737, test_loss: 1.1744, test_f1: 0.5642
##################ITERATION #3 ****************************************
 epoch: 0, train_loss: 1.2862, test_loss: 1.2445, test_f1: 0.3349
 epoch: 1, train_loss: 1.2307, test_loss: 1.1683, test_f1: 0.3931
 epoch: 2, train_loss: 1.1953, test_loss: 1.2135, test_f1: 0.4240
 epoch: 3, train_loss: 1.1571, test_loss: 1.0812, test_f1: 0.4757
 epoch: 4, train_loss: 1.1105, test_loss: 1.0625, test_f1: 0.4447
 epoch: 5, train_loss: 1.1306, test_loss: 1.0100, test_f1: 0.4575
 epoch: 6, train_loss: 1.0782, test_loss: 1.2509, test_f1: 0.3992
 epoch: 7, train_loss: 1.0609, test_loss: 0.9373, test_f1: 0.5002
 epoch: 8, train_loss: 1.0396, test_loss: 0.9883, test_f1: 0.4954
 epoch: 9, train_loss: 1.0346, test_loss: 0.9839, test_f1: 0.4530
 epoch: 10, train_loss: 1.0099, test_loss: 0.9308, test_f1: 0.4779
 epoch: 11, train_loss: 0.9915, test_loss: 0.9327, test_f1: 0.4841
 epoch: 12, train_loss: 1.0009, test_loss: 0.9318, test_f1: 0.5110
 epoch: 13, train_loss: 0.9818, test_loss: 0.9251, test_f1: 0.5053
 epoch: 14, train_loss: 0.9702, test_loss: 0.8943, test_f1: 0.4808
 epoch: 15, train_loss: 0.9658, test_loss: 0.9641, test_f1: 0.5072
 epoch: 16, train_loss: 0.9627, test_loss: 0.8893, test_f1: 0.4919
 epoch: 17, train_loss: 0.9743, test_loss: 0.9246, test_f1: 0.4914
 epoch: 18, train_loss: 0.9566, test_loss: 0.9877, test_f1: 0.5106
 epoch: 19, train_loss: 0.9477, test_loss: 1.0168, test_f1: 0.4791
 epoch: 20, train_loss: 0.9398, test_loss: 0.9578, test_f1: 0.4789
 epoch: 21, train_loss: 0.9267, test_loss: 0.9760, test_f1: 0.4852
 epoch: 22, train_loss: 0.9361, test_loss: 0.9565, test_f1: 0.5024
 epoch: 23, train_loss: 0.9274, test_loss: 1.0779, test_f1: 0.4703
 epoch: 24, train_loss: 0.9369, test_loss: 1.0045, test_f1: 0.5034
 epoch: 25, train_loss: 0.9121, test_loss: 0.9443, test_f1: 0.5220
 epoch: 26, train_loss: 0.9224, test_loss: 1.0144, test_f1: 0.5008
 epoch: 27, train_loss: 0.9148, test_loss: 1.0234, test_f1: 0.4936
 epoch: 28, train_loss: 0.9130, test_loss: 0.9909, test_f1: 0.5020
 epoch: 29, train_loss: 0.8927, test_loss: 1.0214, test_f1: 0.5072
 epoch: 30, train_loss: 0.9035, test_loss: 0.9961, test_f1: 0.4923
 epoch: 31, train_loss: 0.8844, test_loss: 0.9830, test_f1: 0.4989
 epoch: 32, train_loss: 0.8825, test_loss: 1.0117, test_f1: 0.4962
 epoch: 33, train_loss: 0.8824, test_loss: 0.9963, test_f1: 0.5005
 epoch: 34, train_loss: 0.8743, test_loss: 0.9897, test_f1: 0.5165
 epoch: 35, train_loss: 0.8762, test_loss: 0.9919, test_f1: 0.5116
 epoch: 36, train_loss: 0.8761, test_loss: 0.9951, test_f1: 0.5225
 epoch: 37, train_loss: 0.8714, test_loss: 0.9489, test_f1: 0.5047
 epoch: 38, train_loss: 0.8633, test_loss: 0.9334, test_f1: 0.5164
 epoch: 39, train_loss: 0.8592, test_loss: 1.0085, test_f1: 0.5128
 epoch: 40, train_loss: 0.8613, test_loss: 0.9583, test_f1: 0.5538
 epoch: 41, train_loss: 0.8413, test_loss: 1.0654, test_f1: 0.5301
 epoch: 42, train_loss: 0.8606, test_loss: 1.1384, test_f1: 0.5214
 epoch: 43, train_loss: 0.8391, test_loss: 1.0722, test_f1: 0.5380
 epoch: 44, train_loss: 0.8593, test_loss: 1.1195, test_f1: 0.5168
 epoch: 45, train_loss: 0.8735, test_loss: 1.0323, test_f1: 0.5070
 epoch: 46, train_loss: 0.8553, test_loss: 1.0222, test_f1: 0.5335
 epoch: 47, train_loss: 0.8328, test_loss: 1.0092, test_f1: 0.5100
 epoch: 48, train_loss: 0.8346, test_loss: 1.0285, test_f1: 0.5493
 epoch: 49, train_loss: 0.8350, test_loss: 1.1244, test_f1: 0.5115
 epoch: 50, train_loss: 0.8373, test_loss: 0.9845, test_f1: 0.5369
 epoch: 51, train_loss: 0.8169, test_loss: 0.9979, test_f1: 0.5560
 epoch: 52, train_loss: 0.7921, test_loss: 1.0595, test_f1: 0.5536
 epoch: 53, train_loss: 0.7918, test_loss: 1.0892, test_f1: 0.5516
 epoch: 54, train_loss: 0.7801, test_loss: 1.0953, test_f1: 0.5585
 epoch: 55, train_loss: 0.7885, test_loss: 1.1383, test_f1: 0.5630
 epoch: 56, train_loss: 0.7673, test_loss: 1.0946, test_f1: 0.5622
 epoch: 57, train_loss: 0.7749, test_loss: 1.0708, test_f1: 0.5629
 epoch: 58, train_loss: 0.7948, test_loss: 1.0036, test_f1: 0.5874
 epoch: 59, train_loss: 0.7590, test_loss: 1.0519, test_f1: 0.5730
 epoch: 60, train_loss: 0.7638, test_loss: 1.2172, test_f1: 0.5428
 epoch: 61, train_loss: 0.7596, test_loss: 1.0905, test_f1: 0.5526
 epoch: 62, train_loss: 0.7545, test_loss: 1.0455, test_f1: 0.5584
 epoch: 63, train_loss: 0.7593, test_loss: 1.0561, test_f1: 0.5518
 epoch: 64, train_loss: 0.7498, test_loss: 1.1395, test_f1: 0.5579
 epoch: 65, train_loss: 0.7420, test_loss: 1.1139, test_f1: 0.5709
 epoch: 66, train_loss: 0.7525, test_loss: 1.0851, test_f1: 0.5481
 epoch: 67, train_loss: 0.7490, test_loss: 1.0968, test_f1: 0.5716
 epoch: 68, train_loss: 0.7510, test_loss: 1.0897, test_f1: 0.5475
 epoch: 69, train_loss: 0.7465, test_loss: 1.0937, test_f1: 0.5475
 epoch: 70, train_loss: 0.7461, test_loss: 1.0879, test_f1: 0.5568
 epoch: 71, train_loss: 0.7345, test_loss: 1.1090, test_f1: 0.5323
 epoch: 72, train_loss: 0.7097, test_loss: 1.1787, test_f1: 0.5204
 epoch: 73, train_loss: 0.7278, test_loss: 1.1972, test_f1: 0.5724
 epoch: 74, train_loss: 0.7359, test_loss: 1.1074, test_f1: 0.5574
 epoch: 75, train_loss: 0.7423, test_loss: 1.1026, test_f1: 0.5603
 epoch: 76, train_loss: 0.7237, test_loss: 1.1679, test_f1: 0.5452
 epoch: 77, train_loss: 0.7341, test_loss: 1.0928, test_f1: 0.5426
 epoch: 78, train_loss: 0.7227, test_loss: 1.0609, test_f1: 0.5717
 epoch: 79, train_loss: 0.7269, test_loss: 1.1901, test_f1: 0.5313
 epoch: 80, train_loss: 0.7229, test_loss: 1.1309, test_f1: 0.5703
 epoch: 81, train_loss: 0.7129, test_loss: 1.1291, test_f1: 0.5401
 epoch: 82, train_loss: 0.7085, test_loss: 1.2099, test_f1: 0.5537
 epoch: 83, train_loss: 0.7156, test_loss: 1.1633, test_f1: 0.5535
 epoch: 84, train_loss: 0.7197, test_loss: 1.1533, test_f1: 0.5732
 epoch: 85, train_loss: 0.6965, test_loss: 1.2224, test_f1: 0.5535
 epoch: 86, train_loss: 0.7283, test_loss: 1.1290, test_f1: 0.5485
 epoch: 87, train_loss: 0.7162, test_loss: 1.1678, test_f1: 0.5525
 epoch: 88, train_loss: 0.7063, test_loss: 1.2299, test_f1: 0.5799
 epoch: 89, train_loss: 0.6840, test_loss: 1.3099, test_f1: 0.5327
 epoch: 90, train_loss: 0.7286, test_loss: 1.0930, test_f1: 0.5596
 epoch: 91, train_loss: 0.7224, test_loss: 1.1273, test_f1: 0.5624
 epoch: 92, train_loss: 0.7106, test_loss: 1.1882, test_f1: 0.5838
 epoch: 93, train_loss: 0.6900, test_loss: 1.1603, test_f1: 0.5665
 epoch: 94, train_loss: 0.6901, test_loss: 1.2060, test_f1: 0.5562
 epoch: 95, train_loss: 0.6981, test_loss: 1.2488, test_f1: 0.5432
 epoch: 96, train_loss: 0.6895, test_loss: 1.2920, test_f1: 0.5530
 epoch: 97, train_loss: 0.6838, test_loss: 1.2470, test_f1: 0.5646
 epoch: 98, train_loss: 0.6849, test_loss: 1.2959, test_f1: 0.5684
 epoch: 99, train_loss: 0.6729, test_loss: 1.2356, test_f1: 0.5625
##################ITERATION #4 ****************************************
 epoch: 0, train_loss: 1.2822, test_loss: 1.1963, test_f1: 0.2940
 epoch: 1, train_loss: 1.1973, test_loss: 1.1433, test_f1: 0.4097
 epoch: 2, train_loss: 1.1529, test_loss: 1.0728, test_f1: 0.4575
 epoch: 3, train_loss: 1.1280, test_loss: 1.0281, test_f1: 0.4488
 epoch: 4, train_loss: 1.0892, test_loss: 0.9886, test_f1: 0.5125
 epoch: 5, train_loss: 1.0631, test_loss: 0.9795, test_f1: 0.4861
 epoch: 6, train_loss: 1.0359, test_loss: 0.9565, test_f1: 0.4836
 epoch: 7, train_loss: 1.0091, test_loss: 0.9994, test_f1: 0.4668
 epoch: 8, train_loss: 1.0247, test_loss: 0.9051, test_f1: 0.5107
 epoch: 9, train_loss: 0.9937, test_loss: 0.9074, test_f1: 0.4819
 epoch: 10, train_loss: 0.9824, test_loss: 0.9245, test_f1: 0.4874
 epoch: 11, train_loss: 0.9781, test_loss: 0.9557, test_f1: 0.4834
 epoch: 12, train_loss: 0.9534, test_loss: 1.0165, test_f1: 0.4702
 epoch: 13, train_loss: 0.9558, test_loss: 1.1979, test_f1: 0.4320
 epoch: 14, train_loss: 0.9539, test_loss: 0.9172, test_f1: 0.4967
 epoch: 15, train_loss: 0.9358, test_loss: 0.9547, test_f1: 0.5059
 epoch: 16, train_loss: 0.9357, test_loss: 0.9197, test_f1: 0.4975
 epoch: 17, train_loss: 0.9320, test_loss: 0.9776, test_f1: 0.4809
 epoch: 18, train_loss: 0.9313, test_loss: 0.9597, test_f1: 0.5030
 epoch: 19, train_loss: 0.9141, test_loss: 0.9090, test_f1: 0.4995
 epoch: 20, train_loss: 0.9126, test_loss: 0.9415, test_f1: 0.5321
 epoch: 21, train_loss: 0.9016, test_loss: 0.9660, test_f1: 0.5009
 epoch: 22, train_loss: 0.9065, test_loss: 0.9725, test_f1: 0.4948
 epoch: 23, train_loss: 0.9044, test_loss: 0.9962, test_f1: 0.4741
 epoch: 24, train_loss: 0.8936, test_loss: 0.9540, test_f1: 0.4953
 epoch: 25, train_loss: 0.9035, test_loss: 0.9742, test_f1: 0.5023
 epoch: 26, train_loss: 0.8783, test_loss: 0.9403, test_f1: 0.5196
 epoch: 27, train_loss: 0.8796, test_loss: 0.9486, test_f1: 0.5050
 epoch: 28, train_loss: 0.8884, test_loss: 0.9484, test_f1: 0.5064
 epoch: 29, train_loss: 0.8832, test_loss: 0.9270, test_f1: 0.5385
 epoch: 30, train_loss: 0.8770, test_loss: 1.0023, test_f1: 0.4917
 epoch: 31, train_loss: 0.8744, test_loss: 1.0119, test_f1: 0.5066
 epoch: 32, train_loss: 0.8714, test_loss: 1.0189, test_f1: 0.4862
 epoch: 33, train_loss: 0.8663, test_loss: 0.9329, test_f1: 0.5068
 epoch: 34, train_loss: 0.8615, test_loss: 0.9700, test_f1: 0.5052
 epoch: 35, train_loss: 0.8660, test_loss: 0.9645, test_f1: 0.4933
 epoch: 36, train_loss: 0.8774, test_loss: 0.9777, test_f1: 0.5101
 epoch: 37, train_loss: 0.8532, test_loss: 0.9636, test_f1: 0.5057
 epoch: 38, train_loss: 0.8395, test_loss: 0.9571, test_f1: 0.5098
 epoch: 39, train_loss: 0.8575, test_loss: 0.9586, test_f1: 0.5028
 epoch: 40, train_loss: 0.8622, test_loss: 0.9696, test_f1: 0.5243
 epoch: 41, train_loss: 0.8595, test_loss: 0.9443, test_f1: 0.5150
 epoch: 42, train_loss: 0.8397, test_loss: 0.9656, test_f1: 0.5276
 epoch: 43, train_loss: 0.8338, test_loss: 0.9415, test_f1: 0.5096
 epoch: 44, train_loss: 0.8197, test_loss: 1.0289, test_f1: 0.4803
 epoch: 45, train_loss: 0.8343, test_loss: 1.0142, test_f1: 0.4907
 epoch: 46, train_loss: 0.8417, test_loss: 0.9405, test_f1: 0.5127
 epoch: 47, train_loss: 0.8411, test_loss: 0.9627, test_f1: 0.5481
 epoch: 48, train_loss: 0.8471, test_loss: 1.0536, test_f1: 0.5033
 epoch: 49, train_loss: 0.8346, test_loss: 0.9591, test_f1: 0.5486
 epoch: 50, train_loss: 0.8132, test_loss: 0.9663, test_f1: 0.5224
 epoch: 51, train_loss: 0.8004, test_loss: 0.9697, test_f1: 0.5509
 epoch: 52, train_loss: 0.7958, test_loss: 0.9473, test_f1: 0.5579
 epoch: 53, train_loss: 0.7690, test_loss: 0.9581, test_f1: 0.5419
 epoch: 54, train_loss: 0.7719, test_loss: 1.0151, test_f1: 0.4839
 epoch: 55, train_loss: 0.7765, test_loss: 0.9753, test_f1: 0.5364
 epoch: 56, train_loss: 0.7751, test_loss: 0.9599, test_f1: 0.5645
 epoch: 57, train_loss: 0.7598, test_loss: 0.9804, test_f1: 0.5624
 epoch: 58, train_loss: 0.7738, test_loss: 0.9666, test_f1: 0.5636
 epoch: 59, train_loss: 0.7648, test_loss: 0.9914, test_f1: 0.5655
 epoch: 60, train_loss: 0.7545, test_loss: 0.9631, test_f1: 0.5207
 epoch: 61, train_loss: 0.7586, test_loss: 0.9974, test_f1: 0.5776
 epoch: 62, train_loss: 0.7541, test_loss: 1.0863, test_f1: 0.5239
 epoch: 63, train_loss: 0.7610, test_loss: 0.9592, test_f1: 0.5505
 epoch: 64, train_loss: 0.7592, test_loss: 0.9591, test_f1: 0.5458
 epoch: 65, train_loss: 0.7561, test_loss: 1.0188, test_f1: 0.5576
 epoch: 66, train_loss: 0.7396, test_loss: 0.9818, test_f1: 0.5331
 epoch: 67, train_loss: 0.7405, test_loss: 0.9949, test_f1: 0.5297
 epoch: 68, train_loss: 0.7392, test_loss: 1.0039, test_f1: 0.5506
 epoch: 69, train_loss: 0.7422, test_loss: 0.9834, test_f1: 0.5527
 epoch: 70, train_loss: 0.7294, test_loss: 1.0224, test_f1: 0.5371
 epoch: 71, train_loss: 0.7484, test_loss: 0.9410, test_f1: 0.5834
 epoch: 72, train_loss: 0.7379, test_loss: 0.9786, test_f1: 0.5883
 epoch: 73, train_loss: 0.7272, test_loss: 0.9353, test_f1: 0.5804
 epoch: 74, train_loss: 0.7401, test_loss: 1.0304, test_f1: 0.5612
 epoch: 75, train_loss: 0.7437, test_loss: 0.9864, test_f1: 0.5548
 epoch: 76, train_loss: 0.7184, test_loss: 1.1156, test_f1: 0.5509
 epoch: 77, train_loss: 0.7191, test_loss: 1.0424, test_f1: 0.5387
 epoch: 78, train_loss: 0.7088, test_loss: 1.0287, test_f1: 0.5672
 epoch: 79, train_loss: 0.7145, test_loss: 1.0188, test_f1: 0.5695
 epoch: 80, train_loss: 0.7125, test_loss: 1.0578, test_f1: 0.5730
 epoch: 81, train_loss: 0.7298, test_loss: 1.0081, test_f1: 0.5762
 epoch: 82, train_loss: 0.7253, test_loss: 1.0854, test_f1: 0.5404
 epoch: 83, train_loss: 0.7185, test_loss: 1.0392, test_f1: 0.5719
 epoch: 84, train_loss: 0.7293, test_loss: 1.0347, test_f1: 0.5651
 epoch: 85, train_loss: 0.7063, test_loss: 0.9798, test_f1: 0.6075
 epoch: 86, train_loss: 0.7164, test_loss: 1.0567, test_f1: 0.5789
 epoch: 87, train_loss: 0.7013, test_loss: 1.2192, test_f1: 0.5331
 epoch: 88, train_loss: 0.7087, test_loss: 1.0441, test_f1: 0.5744
 epoch: 89, train_loss: 0.7142, test_loss: 0.9845, test_f1: 0.5885
 epoch: 90, train_loss: 0.7070, test_loss: 1.0559, test_f1: 0.5549
 epoch: 91, train_loss: 0.7115, test_loss: 1.2199, test_f1: 0.5549
 epoch: 92, train_loss: 0.7063, test_loss: 1.0531, test_f1: 0.5814
 epoch: 93, train_loss: 0.7085, test_loss: 1.0589, test_f1: 0.5772
 epoch: 94, train_loss: 0.6889, test_loss: 1.1106, test_f1: 0.5573
 epoch: 95, train_loss: 0.7045, test_loss: 1.1220, test_f1: 0.5624
 epoch: 96, train_loss: 0.6930, test_loss: 1.1457, test_f1: 0.5729
 epoch: 97, train_loss: 0.6876, test_loss: 1.0502, test_f1: 0.5669
 epoch: 98, train_loss: 0.6923, test_loss: 1.1540, test_f1: 0.5576
 epoch: 99, train_loss: 0.6844, test_loss: 1.0655, test_f1: 0.5562
##################ITERATION #5 ****************************************
 epoch: 0, train_loss: 1.2885, test_loss: 1.1876, test_f1: 0.3143
 epoch: 1, train_loss: 1.2049, test_loss: 1.1165, test_f1: 0.3930
 epoch: 2, train_loss: 1.1789, test_loss: 1.1087, test_f1: 0.4038
 epoch: 3, train_loss: 1.1229, test_loss: 1.0300, test_f1: 0.4682
 epoch: 4, train_loss: 1.0869, test_loss: 1.0027, test_f1: 0.4848
 epoch: 5, train_loss: 1.0702, test_loss: 0.9670, test_f1: 0.4720
 epoch: 6, train_loss: 1.0462, test_loss: 1.5317, test_f1: 0.3641
 epoch: 7, train_loss: 1.0329, test_loss: 1.0415, test_f1: 0.4612
 epoch: 8, train_loss: 1.0205, test_loss: 1.0730, test_f1: 0.4527
 epoch: 9, train_loss: 1.0245, test_loss: 0.9051, test_f1: 0.5096
 epoch: 10, train_loss: 0.9878, test_loss: 0.9948, test_f1: 0.4889
 epoch: 11, train_loss: 0.9917, test_loss: 0.9895, test_f1: 0.4915
 epoch: 12, train_loss: 0.9796, test_loss: 0.8974, test_f1: 0.4967
 epoch: 13, train_loss: 0.9773, test_loss: 0.9961, test_f1: 0.4807
 epoch: 14, train_loss: 0.9493, test_loss: 0.9594, test_f1: 0.4987
 epoch: 15, train_loss: 0.9464, test_loss: 0.9649, test_f1: 0.4999
 epoch: 16, train_loss: 0.9411, test_loss: 1.0183, test_f1: 0.5480
 epoch: 17, train_loss: 0.9247, test_loss: 0.9896, test_f1: 0.5141
 epoch: 18, train_loss: 0.9252, test_loss: 1.0239, test_f1: 0.5090
 epoch: 19, train_loss: 0.9200, test_loss: 0.9743, test_f1: 0.4999
 epoch: 20, train_loss: 0.9079, test_loss: 0.9915, test_f1: 0.5185
 epoch: 21, train_loss: 0.9066, test_loss: 0.9959, test_f1: 0.4960
 epoch: 22, train_loss: 0.9002, test_loss: 1.0230, test_f1: 0.5235
 epoch: 23, train_loss: 0.9069, test_loss: 0.9949, test_f1: 0.5032
 epoch: 24, train_loss: 0.9003, test_loss: 1.1717, test_f1: 0.4746
 epoch: 25, train_loss: 0.8915, test_loss: 1.0139, test_f1: 0.5018
 epoch: 26, train_loss: 0.8956, test_loss: 1.0755, test_f1: 0.4847
 epoch: 27, train_loss: 0.8783, test_loss: 0.9914, test_f1: 0.5007
 epoch: 28, train_loss: 0.8783, test_loss: 1.0233, test_f1: 0.5261
 epoch: 29, train_loss: 0.8723, test_loss: 1.0404, test_f1: 0.5355
 epoch: 30, train_loss: 0.8542, test_loss: 1.0374, test_f1: 0.5167
 epoch: 31, train_loss: 0.8631, test_loss: 0.9488, test_f1: 0.5081
 epoch: 32, train_loss: 0.8511, test_loss: 1.0816, test_f1: 0.5295
 epoch: 33, train_loss: 0.8571, test_loss: 1.5158, test_f1: 0.4786
 epoch: 34, train_loss: 0.8636, test_loss: 1.0396, test_f1: 0.5314
 epoch: 35, train_loss: 0.8396, test_loss: 1.0888, test_f1: 0.5214
 epoch: 36, train_loss: 0.8440, test_loss: 1.0347, test_f1: 0.5256
 epoch: 37, train_loss: 0.8484, test_loss: 0.9687, test_f1: 0.5293
 epoch: 38, train_loss: 0.8440, test_loss: 1.0348, test_f1: 0.5219
 epoch: 39, train_loss: 0.8229, test_loss: 1.0304, test_f1: 0.5239
 epoch: 40, train_loss: 0.8442, test_loss: 1.0488, test_f1: 0.5154
 epoch: 41, train_loss: 0.8135, test_loss: 1.0528, test_f1: 0.5420
 epoch: 42, train_loss: 0.8248, test_loss: 1.0554, test_f1: 0.5305
 epoch: 43, train_loss: 0.8349, test_loss: 1.0591, test_f1: 0.5072
 epoch: 44, train_loss: 0.8168, test_loss: 1.1372, test_f1: 0.5103
 epoch: 45, train_loss: 0.8142, test_loss: 1.1106, test_f1: 0.5162
 epoch: 46, train_loss: 0.8043, test_loss: 1.1813, test_f1: 0.5182
 epoch: 47, train_loss: 0.8142, test_loss: 1.3563, test_f1: 0.4916
 epoch: 48, train_loss: 0.7972, test_loss: 1.0729, test_f1: 0.5043
 epoch: 49, train_loss: 0.8397, test_loss: 1.1218, test_f1: 0.4969
 epoch: 50, train_loss: 0.8345, test_loss: 0.9550, test_f1: 0.5091
 epoch: 51, train_loss: 0.7998, test_loss: 1.0102, test_f1: 0.5189
 epoch: 52, train_loss: 0.7805, test_loss: 1.0498, test_f1: 0.5152
 epoch: 53, train_loss: 0.7757, test_loss: 1.0272, test_f1: 0.5391
 epoch: 54, train_loss: 0.7635, test_loss: 1.0029, test_f1: 0.5518
 epoch: 55, train_loss: 0.7655, test_loss: 1.0370, test_f1: 0.5485
 epoch: 56, train_loss: 0.7569, test_loss: 1.0036, test_f1: 0.5529
 epoch: 57, train_loss: 0.7537, test_loss: 1.0231, test_f1: 0.5243
 epoch: 58, train_loss: 0.7495, test_loss: 1.0748, test_f1: 0.5455
 epoch: 59, train_loss: 0.7600, test_loss: 1.0224, test_f1: 0.5345
 epoch: 60, train_loss: 0.7486, test_loss: 1.0581, test_f1: 0.5312
 epoch: 61, train_loss: 0.7389, test_loss: 1.0271, test_f1: 0.5361
 epoch: 62, train_loss: 0.7304, test_loss: 1.0436, test_f1: 0.5302
 epoch: 63, train_loss: 0.7358, test_loss: 1.0861, test_f1: 0.5347
 epoch: 64, train_loss: 0.7354, test_loss: 1.0292, test_f1: 0.5375
 epoch: 65, train_loss: 0.7353, test_loss: 1.0610, test_f1: 0.5315
 epoch: 66, train_loss: 0.7419, test_loss: 1.1135, test_f1: 0.5472
 epoch: 67, train_loss: 0.7192, test_loss: 1.0296, test_f1: 0.5440
 epoch: 68, train_loss: 0.7300, test_loss: 1.0584, test_f1: 0.5340
 epoch: 69, train_loss: 0.7247, test_loss: 1.1369, test_f1: 0.5353
 epoch: 70, train_loss: 0.7296, test_loss: 1.0429, test_f1: 0.5455
 epoch: 71, train_loss: 0.7075, test_loss: 1.0270, test_f1: 0.5636
 epoch: 72, train_loss: 0.7212, test_loss: 1.1387, test_f1: 0.5202
 epoch: 73, train_loss: 0.7225, test_loss: 1.0913, test_f1: 0.5455
 epoch: 74, train_loss: 0.7162, test_loss: 1.1637, test_f1: 0.5467
 epoch: 75, train_loss: 0.7080, test_loss: 1.0993, test_f1: 0.5382
 epoch: 76, train_loss: 0.7172, test_loss: 1.1831, test_f1: 0.5060
 epoch: 77, train_loss: 0.7182, test_loss: 1.1494, test_f1: 0.5136
 epoch: 78, train_loss: 0.7184, test_loss: 1.1706, test_f1: 0.5381
 epoch: 79, train_loss: 0.7097, test_loss: 1.1512, test_f1: 0.5234
 epoch: 80, train_loss: 0.7046, test_loss: 1.1040, test_f1: 0.5578
 epoch: 81, train_loss: 0.6940, test_loss: 1.1383, test_f1: 0.5444
 epoch: 82, train_loss: 0.7059, test_loss: 1.2189, test_f1: 0.5362
 epoch: 83, train_loss: 0.6945, test_loss: 1.0988, test_f1: 0.5562
 epoch: 84, train_loss: 0.7047, test_loss: 1.1324, test_f1: 0.5153
 epoch: 85, train_loss: 0.7038, test_loss: 1.2628, test_f1: 0.5536
 epoch: 86, train_loss: 0.6999, test_loss: 1.2633, test_f1: 0.5474
 epoch: 87, train_loss: 0.6998, test_loss: 1.1634, test_f1: 0.5570
 epoch: 88, train_loss: 0.6819, test_loss: 1.1619, test_f1: 0.5530
 epoch: 89, train_loss: 0.6966, test_loss: 1.1947, test_f1: 0.5474
 epoch: 90, train_loss: 0.7059, test_loss: 1.1510, test_f1: 0.5424
 epoch: 91, train_loss: 0.6800, test_loss: 1.2040, test_f1: 0.5483
 epoch: 92, train_loss: 0.6981, test_loss: 1.1750, test_f1: 0.5339
 epoch: 93, train_loss: 0.6973, test_loss: 1.1891, test_f1: 0.5852
 epoch: 94, train_loss: 0.6837, test_loss: 1.2127, test_f1: 0.5667
 epoch: 95, train_loss: 0.6679, test_loss: 1.1230, test_f1: 0.5759
 epoch: 96, train_loss: 0.6888, test_loss: 1.1689, test_f1: 0.5422
 epoch: 97, train_loss: 0.6957, test_loss: 1.2086, test_f1: 0.5264
 epoch: 98, train_loss: 0.6964, test_loss: 1.1335, test_f1: 0.5570
 epoch: 99, train_loss: 0.6783, test_loss: 1.1752, test_f1: 0.5398
##################ITERATION #6 ****************************************
 epoch: 0, train_loss: 1.2707, test_loss: 1.1984, test_f1: 0.3270
 epoch: 1, train_loss: 1.1586, test_loss: 1.0859, test_f1: 0.4771
 epoch: 2, train_loss: 1.1264, test_loss: 1.2007, test_f1: 0.4215
 epoch: 3, train_loss: 1.0916, test_loss: 1.1184, test_f1: 0.4319
 epoch: 4, train_loss: 1.0649, test_loss: 1.0645, test_f1: 0.4570
 epoch: 5, train_loss: 1.0424, test_loss: 1.2612, test_f1: 0.4045
 epoch: 6, train_loss: 1.0135, test_loss: 1.0604, test_f1: 0.4906
 epoch: 7, train_loss: 0.9964, test_loss: 1.0861, test_f1: 0.4402
 epoch: 8, train_loss: 0.9895, test_loss: 1.0762, test_f1: 0.4676
 epoch: 9, train_loss: 0.9790, test_loss: 1.0522, test_f1: 0.4730
 epoch: 10, train_loss: 0.9725, test_loss: 0.9381, test_f1: 0.5011
 epoch: 11, train_loss: 0.9464, test_loss: 1.0713, test_f1: 0.4796
 epoch: 12, train_loss: 0.9468, test_loss: 0.9798, test_f1: 0.4972
 epoch: 13, train_loss: 0.9506, test_loss: 1.0338, test_f1: 0.4755
 epoch: 14, train_loss: 0.9393, test_loss: 1.0407, test_f1: 0.5046
 epoch: 15, train_loss: 0.9421, test_loss: 0.9652, test_f1: 0.4915
 epoch: 16, train_loss: 0.9326, test_loss: 0.9419, test_f1: 0.5008
 epoch: 17, train_loss: 0.9458, test_loss: 0.9740, test_f1: 0.5123
 epoch: 18, train_loss: 0.9259, test_loss: 1.0494, test_f1: 0.4816
 epoch: 19, train_loss: 0.9106, test_loss: 1.1168, test_f1: 0.4972
 epoch: 20, train_loss: 0.9148, test_loss: 1.0391, test_f1: 0.5196
 epoch: 21, train_loss: 0.8909, test_loss: 1.0506, test_f1: 0.5399
 epoch: 22, train_loss: 0.8868, test_loss: 0.9850, test_f1: 0.5358
 epoch: 23, train_loss: 0.8897, test_loss: 1.1600, test_f1: 0.4896
 epoch: 24, train_loss: 0.8786, test_loss: 1.0961, test_f1: 0.5441
 epoch: 25, train_loss: 0.8713, test_loss: 1.1539, test_f1: 0.4809
 epoch: 26, train_loss: 0.8678, test_loss: 1.0544, test_f1: 0.5318
 epoch: 27, train_loss: 0.8681, test_loss: 1.0481, test_f1: 0.5436
 epoch: 28, train_loss: 0.8647, test_loss: 1.0209, test_f1: 0.5278
 epoch: 29, train_loss: 0.8622, test_loss: 1.0523, test_f1: 0.5204
 epoch: 30, train_loss: 0.8492, test_loss: 1.1409, test_f1: 0.4916
 epoch: 31, train_loss: 0.8621, test_loss: 1.1621, test_f1: 0.4883
 epoch: 32, train_loss: 0.8788, test_loss: 1.2630, test_f1: 0.4996
 epoch: 33, train_loss: 0.8403, test_loss: 1.1020, test_f1: 0.4888
 epoch: 34, train_loss: 0.8361, test_loss: 1.0172, test_f1: 0.5425
 epoch: 35, train_loss: 0.8586, test_loss: 1.0584, test_f1: 0.4900
 epoch: 36, train_loss: 0.8334, test_loss: 1.0407, test_f1: 0.5071
 epoch: 37, train_loss: 0.8349, test_loss: 1.0186, test_f1: 0.5332
 epoch: 38, train_loss: 0.8296, test_loss: 1.0155, test_f1: 0.5106
 epoch: 39, train_loss: 0.8277, test_loss: 1.0920, test_f1: 0.5153
 epoch: 40, train_loss: 0.8210, test_loss: 1.0247, test_f1: 0.5515
 epoch: 41, train_loss: 0.8155, test_loss: 1.0592, test_f1: 0.5149
 epoch: 42, train_loss: 0.8126, test_loss: 1.0682, test_f1: 0.5030
 epoch: 43, train_loss: 0.8081, test_loss: 1.1057, test_f1: 0.5381
 epoch: 44, train_loss: 0.8065, test_loss: 1.0859, test_f1: 0.5433
 epoch: 45, train_loss: 0.8081, test_loss: 1.0217, test_f1: 0.5506
 epoch: 46, train_loss: 0.8144, test_loss: 1.1139, test_f1: 0.4960
 epoch: 47, train_loss: 0.8138, test_loss: 1.0171, test_f1: 0.5570
 epoch: 48, train_loss: 0.8141, test_loss: 1.1384, test_f1: 0.4936
 epoch: 49, train_loss: 0.8044, test_loss: 1.0274, test_f1: 0.5137
 epoch: 50, train_loss: 0.7918, test_loss: 1.0813, test_f1: 0.5131
 epoch: 51, train_loss: 0.7828, test_loss: 1.0992, test_f1: 0.5383
 epoch: 52, train_loss: 0.7583, test_loss: 1.0561, test_f1: 0.5424
 epoch: 53, train_loss: 0.7438, test_loss: 1.1595, test_f1: 0.5147
 epoch: 54, train_loss: 0.7501, test_loss: 1.1723, test_f1: 0.5284
 epoch: 55, train_loss: 0.7561, test_loss: 1.1102, test_f1: 0.5419
 epoch: 56, train_loss: 0.7362, test_loss: 1.1391, test_f1: 0.5280
 epoch: 57, train_loss: 0.7366, test_loss: 1.0746, test_f1: 0.5579
 epoch: 58, train_loss: 0.7311, test_loss: 1.1329, test_f1: 0.5407
 epoch: 59, train_loss: 0.7327, test_loss: 1.1222, test_f1: 0.5357
 epoch: 60, train_loss: 0.7445, test_loss: 1.2517, test_f1: 0.5327
 epoch: 61, train_loss: 0.7153, test_loss: 1.1733, test_f1: 0.5523
 epoch: 62, train_loss: 0.7168, test_loss: 1.0946, test_f1: 0.5568
 epoch: 63, train_loss: 0.7243, test_loss: 1.2140, test_f1: 0.5379
 epoch: 64, train_loss: 0.7173, test_loss: 1.1163, test_f1: 0.5313
 epoch: 65, train_loss: 0.7179, test_loss: 1.1545, test_f1: 0.5455
 epoch: 66, train_loss: 0.7289, test_loss: 1.1489, test_f1: 0.5440
 epoch: 67, train_loss: 0.7143, test_loss: 1.2259, test_f1: 0.5620
 epoch: 68, train_loss: 0.7017, test_loss: 1.0599, test_f1: 0.5454
 epoch: 69, train_loss: 0.7121, test_loss: 1.1158, test_f1: 0.5506
 epoch: 70, train_loss: 0.7116, test_loss: 1.1907, test_f1: 0.5359
 epoch: 71, train_loss: 0.7263, test_loss: 1.1444, test_f1: 0.5589
 epoch: 72, train_loss: 0.7217, test_loss: 1.0885, test_f1: 0.5451
 epoch: 73, train_loss: 0.7033, test_loss: 1.1395, test_f1: 0.5503
 epoch: 74, train_loss: 0.6954, test_loss: 1.0813, test_f1: 0.5248
 epoch: 75, train_loss: 0.7059, test_loss: 1.1149, test_f1: 0.5628
 epoch: 76, train_loss: 0.6905, test_loss: 1.1317, test_f1: 0.5694
 epoch: 77, train_loss: 0.6847, test_loss: 1.1635, test_f1: 0.5652
 epoch: 78, train_loss: 0.7023, test_loss: 1.2788, test_f1: 0.5136
 epoch: 79, train_loss: 0.6893, test_loss: 1.0722, test_f1: 0.5796
 epoch: 80, train_loss: 0.6836, test_loss: 1.1257, test_f1: 0.5397
 epoch: 81, train_loss: 0.7041, test_loss: 1.1764, test_f1: 0.5214
 epoch: 82, train_loss: 0.6681, test_loss: 1.2329, test_f1: 0.5439
 epoch: 83, train_loss: 0.6850, test_loss: 1.2780, test_f1: 0.5710
 epoch: 84, train_loss: 0.6738, test_loss: 1.1639, test_f1: 0.5709
 epoch: 85, train_loss: 0.6757, test_loss: 1.2072, test_f1: 0.5695
 epoch: 86, train_loss: 0.6557, test_loss: 1.3054, test_f1: 0.5320
 epoch: 87, train_loss: 0.6791, test_loss: 1.1905, test_f1: 0.5561
 epoch: 88, train_loss: 0.6561, test_loss: 1.3035, test_f1: 0.5509
 epoch: 89, train_loss: 0.6621, test_loss: 1.1694, test_f1: 0.5734
 epoch: 90, train_loss: 0.6717, test_loss: 1.1358, test_f1: 0.5367
 epoch: 91, train_loss: 0.6715, test_loss: 1.2114, test_f1: 0.5556
 epoch: 92, train_loss: 0.6608, test_loss: 1.1288, test_f1: 0.5659
 epoch: 93, train_loss: 0.6718, test_loss: 1.3113, test_f1: 0.5256
 epoch: 94, train_loss: 0.6635, test_loss: 1.1869, test_f1: 0.5628
 epoch: 95, train_loss: 0.6465, test_loss: 1.3547, test_f1: 0.5438
 epoch: 96, train_loss: 0.6625, test_loss: 1.2099, test_f1: 0.5511
 epoch: 97, train_loss: 0.6655, test_loss: 1.2007, test_f1: 0.5546
 epoch: 98, train_loss: 0.6601, test_loss: 1.1620, test_f1: 0.5631
 epoch: 99, train_loss: 0.6471, test_loss: 1.3272, test_f1: 0.5295
##################ITERATION #7 ****************************************
 epoch: 0, train_loss: 1.2586, test_loss: 1.2074, test_f1: 0.4136
 epoch: 1, train_loss: 1.1419, test_loss: 1.0181, test_f1: 0.4529
 epoch: 2, train_loss: 1.0769, test_loss: 0.9958, test_f1: 0.5055
 epoch: 3, train_loss: 1.0303, test_loss: 0.9655, test_f1: 0.4497
 epoch: 4, train_loss: 1.0470, test_loss: 1.0198, test_f1: 0.4549
 epoch: 5, train_loss: 1.0430, test_loss: 1.0977, test_f1: 0.4848
 epoch: 6, train_loss: 1.0037, test_loss: 1.0169, test_f1: 0.4892
 epoch: 7, train_loss: 0.9870, test_loss: 0.9367, test_f1: 0.4902
 epoch: 8, train_loss: 0.9701, test_loss: 0.9307, test_f1: 0.5327
 epoch: 9, train_loss: 0.9559, test_loss: 1.0977, test_f1: 0.4752
 epoch: 10, train_loss: 0.9584, test_loss: 0.9778, test_f1: 0.4895
 epoch: 11, train_loss: 0.9439, test_loss: 1.1572, test_f1: 0.4547
 epoch: 12, train_loss: 0.9411, test_loss: 1.0121, test_f1: 0.4427
 epoch: 13, train_loss: 0.9201, test_loss: 1.0055, test_f1: 0.4914
 epoch: 14, train_loss: 0.9141, test_loss: 0.9948, test_f1: 0.4862
 epoch: 15, train_loss: 0.9520, test_loss: 1.0459, test_f1: 0.4922
 epoch: 16, train_loss: 0.9252, test_loss: 1.0025, test_f1: 0.5316
 epoch: 17, train_loss: 0.9044, test_loss: 0.9427, test_f1: 0.4931
 epoch: 18, train_loss: 0.9122, test_loss: 1.0658, test_f1: 0.4284
 epoch: 19, train_loss: 0.8972, test_loss: 1.0127, test_f1: 0.4917
 epoch: 20, train_loss: 0.8805, test_loss: 0.9579, test_f1: 0.5219
 epoch: 21, train_loss: 0.8945, test_loss: 0.9527, test_f1: 0.5126
 epoch: 22, train_loss: 0.8682, test_loss: 0.9412, test_f1: 0.5063
 epoch: 23, train_loss: 0.8758, test_loss: 0.9478, test_f1: 0.5039
 epoch: 24, train_loss: 0.8641, test_loss: 1.0031, test_f1: 0.5114
 epoch: 25, train_loss: 0.8598, test_loss: 0.9684, test_f1: 0.4864
 epoch: 26, train_loss: 0.8882, test_loss: 1.0241, test_f1: 0.4777
 epoch: 27, train_loss: 0.8653, test_loss: 0.9193, test_f1: 0.5108
 epoch: 28, train_loss: 0.8595, test_loss: 1.0391, test_f1: 0.5268
 epoch: 29, train_loss: 0.8517, test_loss: 1.0656, test_f1: 0.4832
 epoch: 30, train_loss: 0.8388, test_loss: 0.9516, test_f1: 0.5229
 epoch: 31, train_loss: 0.8446, test_loss: 0.9463, test_f1: 0.5078
 epoch: 32, train_loss: 0.8242, test_loss: 1.0010, test_f1: 0.5037
 epoch: 33, train_loss: 0.8504, test_loss: 0.9325, test_f1: 0.5604
 epoch: 34, train_loss: 0.8296, test_loss: 1.0305, test_f1: 0.4938
 epoch: 35, train_loss: 0.8373, test_loss: 1.0716, test_f1: 0.5159
 epoch: 36, train_loss: 0.8455, test_loss: 0.9593, test_f1: 0.5247
 epoch: 37, train_loss: 0.8257, test_loss: 1.0371, test_f1: 0.5182
 epoch: 38, train_loss: 0.8524, test_loss: 1.0882, test_f1: 0.4917
 epoch: 39, train_loss: 0.8204, test_loss: 1.0266, test_f1: 0.5232
 epoch: 40, train_loss: 0.8168, test_loss: 0.9657, test_f1: 0.5104
 epoch: 41, train_loss: 0.8224, test_loss: 1.0410, test_f1: 0.5220
 epoch: 42, train_loss: 0.8272, test_loss: 0.9697, test_f1: 0.5161
 epoch: 43, train_loss: 0.8137, test_loss: 1.0498, test_f1: 0.4936
 epoch: 44, train_loss: 0.8141, test_loss: 1.0289, test_f1: 0.5373
 epoch: 45, train_loss: 0.8101, test_loss: 1.0771, test_f1: 0.5085
 epoch: 46, train_loss: 0.8022, test_loss: 1.1181, test_f1: 0.5007
 epoch: 47, train_loss: 0.8164, test_loss: 1.0093, test_f1: 0.5136
 epoch: 48, train_loss: 0.8057, test_loss: 1.1589, test_f1: 0.5361
 epoch: 49, train_loss: 0.7995, test_loss: 1.0510, test_f1: 0.5245
 epoch: 50, train_loss: 0.7768, test_loss: 1.1102, test_f1: 0.5301
 epoch: 51, train_loss: 0.7632, test_loss: 1.0989, test_f1: 0.5460
 epoch: 52, train_loss: 0.7610, test_loss: 1.0758, test_f1: 0.5546
 epoch: 53, train_loss: 0.7498, test_loss: 1.1777, test_f1: 0.5264
 epoch: 54, train_loss: 0.7498, test_loss: 1.1849, test_f1: 0.5132
 epoch: 55, train_loss: 0.7360, test_loss: 1.1096, test_f1: 0.5232
 epoch: 56, train_loss: 0.7390, test_loss: 1.1229, test_f1: 0.5377
 epoch: 57, train_loss: 0.7232, test_loss: 1.0958, test_f1: 0.5287
 epoch: 58, train_loss: 0.7357, test_loss: 1.1121, test_f1: 0.5360
 epoch: 59, train_loss: 0.7372, test_loss: 1.0753, test_f1: 0.5324
 epoch: 60, train_loss: 0.7374, test_loss: 1.2397, test_f1: 0.5005
 epoch: 61, train_loss: 0.7257, test_loss: 1.1027, test_f1: 0.5439
 epoch: 62, train_loss: 0.7213, test_loss: 1.2080, test_f1: 0.5040
 epoch: 63, train_loss: 0.7346, test_loss: 1.1015, test_f1: 0.5524
 epoch: 64, train_loss: 0.7299, test_loss: 1.1795, test_f1: 0.5487
 epoch: 65, train_loss: 0.7304, test_loss: 1.0827, test_f1: 0.5355
 epoch: 66, train_loss: 0.7133, test_loss: 1.2207, test_f1: 0.5307
 epoch: 67, train_loss: 0.7283, test_loss: 1.1046, test_f1: 0.5514
 epoch: 68, train_loss: 0.7051, test_loss: 1.0802, test_f1: 0.5557
 epoch: 69, train_loss: 0.7088, test_loss: 1.2575, test_f1: 0.5016
 epoch: 70, train_loss: 0.7144, test_loss: 1.1100, test_f1: 0.5417
 epoch: 71, train_loss: 0.7201, test_loss: 1.1234, test_f1: 0.5580
 epoch: 72, train_loss: 0.7088, test_loss: 1.2245, test_f1: 0.5331
 epoch: 73, train_loss: 0.6980, test_loss: 1.1545, test_f1: 0.5529
 epoch: 74, train_loss: 0.7051, test_loss: 1.1000, test_f1: 0.5853
 epoch: 75, train_loss: 0.6994, test_loss: 1.1331, test_f1: 0.5529
 epoch: 76, train_loss: 0.6741, test_loss: 1.3513, test_f1: 0.5157
 epoch: 77, train_loss: 0.6862, test_loss: 1.4600, test_f1: 0.5246
 epoch: 78, train_loss: 0.6763, test_loss: 1.1925, test_f1: 0.5595
 epoch: 79, train_loss: 0.6924, test_loss: 1.3838, test_f1: 0.5445
 epoch: 80, train_loss: 0.6947, test_loss: 1.2109, test_f1: 0.5744
 epoch: 81, train_loss: 0.6950, test_loss: 1.2361, test_f1: 0.5489
 epoch: 82, train_loss: 0.6843, test_loss: 1.3755, test_f1: 0.5452
 epoch: 83, train_loss: 0.6919, test_loss: 1.2316, test_f1: 0.5257
 epoch: 84, train_loss: 0.6864, test_loss: 1.3060, test_f1: 0.5140
 epoch: 85, train_loss: 0.6810, test_loss: 1.2165, test_f1: 0.5434
 epoch: 86, train_loss: 0.6715, test_loss: 1.2222, test_f1: 0.5716
 epoch: 87, train_loss: 0.6715, test_loss: 1.3391, test_f1: 0.5590
 epoch: 88, train_loss: 0.6865, test_loss: 1.1279, test_f1: 0.5858
 epoch: 89, train_loss: 0.6759, test_loss: 1.2706, test_f1: 0.5514
 epoch: 90, train_loss: 0.6797, test_loss: 1.2673, test_f1: 0.5463
 epoch: 91, train_loss: 0.6654, test_loss: 1.1410, test_f1: 0.5752
 epoch: 92, train_loss: 0.6727, test_loss: 1.2753, test_f1: 0.5614
 epoch: 93, train_loss: 0.6693, test_loss: 1.1721, test_f1: 0.5818
 epoch: 94, train_loss: 0.6512, test_loss: 1.7459, test_f1: 0.5274
 epoch: 95, train_loss: 0.6723, test_loss: 1.1000, test_f1: 0.5667
 epoch: 96, train_loss: 0.6533, test_loss: 1.1607, test_f1: 0.5640
 epoch: 97, train_loss: 0.6600, test_loss: 1.3475, test_f1: 0.5386
 epoch: 98, train_loss: 0.6683, test_loss: 1.1818, test_f1: 0.5611
 epoch: 99, train_loss: 0.6682, test_loss: 1.2133, test_f1: 0.5632
##################ITERATION #8 ****************************************
 epoch: 0, train_loss: 1.2859, test_loss: 1.2924, test_f1: 0.3105
 epoch: 1, train_loss: 1.2054, test_loss: 1.1381, test_f1: 0.3565
 epoch: 2, train_loss: 1.1382, test_loss: 1.1074, test_f1: 0.4271
 epoch: 3, train_loss: 1.1063, test_loss: 1.0857, test_f1: 0.4310
 epoch: 4, train_loss: 1.0845, test_loss: 1.0176, test_f1: 0.4595
 epoch: 5, train_loss: 1.0387, test_loss: 1.0554, test_f1: 0.4494
 epoch: 6, train_loss: 1.0246, test_loss: 0.9952, test_f1: 0.4672
 epoch: 7, train_loss: 1.0020, test_loss: 1.0640, test_f1: 0.4867
 epoch: 8, train_loss: 1.0164, test_loss: 1.0243, test_f1: 0.4824
 epoch: 9, train_loss: 0.9801, test_loss: 1.0304, test_f1: 0.4762
 epoch: 10, train_loss: 0.9886, test_loss: 0.9971, test_f1: 0.5088
 epoch: 11, train_loss: 0.9675, test_loss: 0.9527, test_f1: 0.4619
 epoch: 12, train_loss: 0.9473, test_loss: 0.9885, test_f1: 0.4917
 epoch: 13, train_loss: 0.9584, test_loss: 0.9490, test_f1: 0.4867
 epoch: 14, train_loss: 0.9287, test_loss: 1.0006, test_f1: 0.4812
 epoch: 15, train_loss: 0.9339, test_loss: 1.0030, test_f1: 0.5113
 epoch: 16, train_loss: 0.9413, test_loss: 0.9653, test_f1: 0.5086
 epoch: 17, train_loss: 0.9136, test_loss: 1.0114, test_f1: 0.4855
 epoch: 18, train_loss: 0.9168, test_loss: 1.1000, test_f1: 0.4756
 epoch: 19, train_loss: 0.9135, test_loss: 1.0326, test_f1: 0.4925
 epoch: 20, train_loss: 0.9115, test_loss: 1.2443, test_f1: 0.4745
 epoch: 21, train_loss: 0.9085, test_loss: 0.9733, test_f1: 0.5149
 epoch: 22, train_loss: 0.8895, test_loss: 1.1925, test_f1: 0.4720
 epoch: 23, train_loss: 0.8804, test_loss: 1.0182, test_f1: 0.4724
 epoch: 24, train_loss: 0.9109, test_loss: 0.9976, test_f1: 0.4797
 epoch: 25, train_loss: 0.8952, test_loss: 0.9776, test_f1: 0.5013
 epoch: 26, train_loss: 0.8754, test_loss: 0.9913, test_f1: 0.5139
 epoch: 27, train_loss: 0.8653, test_loss: 0.9943, test_f1: 0.5056
 epoch: 28, train_loss: 0.8797, test_loss: 1.1502, test_f1: 0.4982
 epoch: 29, train_loss: 0.8462, test_loss: 1.0030, test_f1: 0.5073
 epoch: 30, train_loss: 0.8543, test_loss: 1.0696, test_f1: 0.5218
 epoch: 31, train_loss: 0.8636, test_loss: 0.9753, test_f1: 0.5054
 epoch: 32, train_loss: 0.8504, test_loss: 0.9904, test_f1: 0.5128
 epoch: 33, train_loss: 0.8413, test_loss: 1.2132, test_f1: 0.4505
 epoch: 34, train_loss: 0.8356, test_loss: 1.0347, test_f1: 0.5083
 epoch: 35, train_loss: 0.8542, test_loss: 1.0425, test_f1: 0.4895
 epoch: 36, train_loss: 0.8561, test_loss: 1.0358, test_f1: 0.5204
 epoch: 37, train_loss: 0.8301, test_loss: 0.9896, test_f1: 0.5268
 epoch: 38, train_loss: 0.8334, test_loss: 0.9400, test_f1: 0.5082
 epoch: 39, train_loss: 0.8385, test_loss: 1.0042, test_f1: 0.5209
 epoch: 40, train_loss: 0.8290, test_loss: 1.0410, test_f1: 0.5266
 epoch: 41, train_loss: 0.8417, test_loss: 1.0817, test_f1: 0.4916
 epoch: 42, train_loss: 0.8277, test_loss: 0.9810, test_f1: 0.5185
 epoch: 43, train_loss: 0.8256, test_loss: 0.9671, test_f1: 0.5363
 epoch: 44, train_loss: 0.8290, test_loss: 1.0774, test_f1: 0.4930
 epoch: 45, train_loss: 0.8206, test_loss: 1.0083, test_f1: 0.5165
 epoch: 46, train_loss: 0.7969, test_loss: 1.0519, test_f1: 0.5432
 epoch: 47, train_loss: 0.8237, test_loss: 1.0091, test_f1: 0.5653
 epoch: 48, train_loss: 0.8095, test_loss: 0.9795, test_f1: 0.5384
 epoch: 49, train_loss: 0.7952, test_loss: 1.0294, test_f1: 0.5280
 epoch: 50, train_loss: 0.7895, test_loss: 1.0285, test_f1: 0.5090
 epoch: 51, train_loss: 0.7766, test_loss: 1.0017, test_f1: 0.5498
 epoch: 52, train_loss: 0.7565, test_loss: 0.9873, test_f1: 0.5512
 epoch: 53, train_loss: 0.7614, test_loss: 0.9953, test_f1: 0.5497
 epoch: 54, train_loss: 0.7565, test_loss: 0.9464, test_f1: 0.5266
 epoch: 55, train_loss: 0.7475, test_loss: 1.0167, test_f1: 0.5290
 epoch: 56, train_loss: 0.7414, test_loss: 0.9397, test_f1: 0.5541
 epoch: 57, train_loss: 0.7484, test_loss: 0.9374, test_f1: 0.5685
 epoch: 58, train_loss: 0.7375, test_loss: 0.9339, test_f1: 0.5565
 epoch: 59, train_loss: 0.7334, test_loss: 1.0104, test_f1: 0.5391
 epoch: 60, train_loss: 0.7650, test_loss: 1.0003, test_f1: 0.5591
 epoch: 61, train_loss: 0.7270, test_loss: 0.9737, test_f1: 0.5605
 epoch: 62, train_loss: 0.7496, test_loss: 0.9986, test_f1: 0.5327
 epoch: 63, train_loss: 0.7321, test_loss: 0.9603, test_f1: 0.5486
 epoch: 64, train_loss: 0.7351, test_loss: 0.9848, test_f1: 0.5436
 epoch: 65, train_loss: 0.7258, test_loss: 0.9863, test_f1: 0.5600
 epoch: 66, train_loss: 0.7292, test_loss: 0.9951, test_f1: 0.5570
 epoch: 67, train_loss: 0.7322, test_loss: 0.9894, test_f1: 0.5623
 epoch: 68, train_loss: 0.7113, test_loss: 0.9957, test_f1: 0.5614
 epoch: 69, train_loss: 0.7357, test_loss: 0.9895, test_f1: 0.5277
 epoch: 70, train_loss: 0.7243, test_loss: 1.0087, test_f1: 0.5530
 epoch: 71, train_loss: 0.7079, test_loss: 1.0112, test_f1: 0.5608
 epoch: 72, train_loss: 0.7331, test_loss: 0.9992, test_f1: 0.5715
 epoch: 73, train_loss: 0.7252, test_loss: 1.0010, test_f1: 0.5645
 epoch: 74, train_loss: 0.7139, test_loss: 1.0072, test_f1: 0.5678
 epoch: 75, train_loss: 0.7113, test_loss: 1.0279, test_f1: 0.5453
 epoch: 76, train_loss: 0.6921, test_loss: 1.1249, test_f1: 0.5191
 epoch: 77, train_loss: 0.6909, test_loss: 1.0085, test_f1: 0.5515
 epoch: 78, train_loss: 0.6962, test_loss: 1.0073, test_f1: 0.5619
 epoch: 79, train_loss: 0.6733, test_loss: 1.0926, test_f1: 0.5322
 epoch: 80, train_loss: 0.7048, test_loss: 1.0260, test_f1: 0.5456
 epoch: 81, train_loss: 0.6924, test_loss: 1.1007, test_f1: 0.5295
 epoch: 82, train_loss: 0.7110, test_loss: 1.0698, test_f1: 0.5513
 epoch: 83, train_loss: 0.6915, test_loss: 1.1808, test_f1: 0.5080
 epoch: 84, train_loss: 0.7171, test_loss: 1.1219, test_f1: 0.5272
 epoch: 85, train_loss: 0.6913, test_loss: 0.9917, test_f1: 0.5440
 epoch: 86, train_loss: 0.6916, test_loss: 1.0027, test_f1: 0.5915
 epoch: 87, train_loss: 0.6945, test_loss: 1.0050, test_f1: 0.5581
 epoch: 88, train_loss: 0.6808, test_loss: 1.0359, test_f1: 0.5390
 epoch: 89, train_loss: 0.6880, test_loss: 1.0334, test_f1: 0.5543
 epoch: 90, train_loss: 0.6726, test_loss: 1.0293, test_f1: 0.5382
 epoch: 91, train_loss: 0.6788, test_loss: 0.9826, test_f1: 0.5632
 epoch: 92, train_loss: 0.6747, test_loss: 1.0364, test_f1: 0.5492
 epoch: 93, train_loss: 0.6673, test_loss: 1.0403, test_f1: 0.5445
 epoch: 94, train_loss: 0.6622, test_loss: 1.0463, test_f1: 0.5704
 epoch: 95, train_loss: 0.6796, test_loss: 1.0395, test_f1: 0.5383
 epoch: 96, train_loss: 0.6590, test_loss: 1.0538, test_f1: 0.5431
 epoch: 97, train_loss: 0.6730, test_loss: 0.9915, test_f1: 0.5740
 epoch: 98, train_loss: 0.6577, test_loss: 1.0890, test_f1: 0.5652
 epoch: 99, train_loss: 0.6666, test_loss: 1.1027, test_f1: 0.5365
##################ITERATION #9 ****************************************
 epoch: 0, train_loss: 1.2760, test_loss: 1.2234, test_f1: 0.2859
 epoch: 1, train_loss: 1.1923, test_loss: 1.1147, test_f1: 0.4179
 epoch: 2, train_loss: 1.1312, test_loss: 1.0558, test_f1: 0.4713
 epoch: 3, train_loss: 1.0937, test_loss: 0.9981, test_f1: 0.4611
 epoch: 4, train_loss: 1.0459, test_loss: 1.0081, test_f1: 0.4719
 epoch: 5, train_loss: 1.0462, test_loss: 0.9533, test_f1: 0.4803
 epoch: 6, train_loss: 1.0034, test_loss: 0.9854, test_f1: 0.4633
 epoch: 7, train_loss: 1.0187, test_loss: 0.9670, test_f1: 0.4742
 epoch: 8, train_loss: 0.9827, test_loss: 1.0304, test_f1: 0.4894
 epoch: 9, train_loss: 0.9675, test_loss: 1.0688, test_f1: 0.4710
 epoch: 10, train_loss: 0.9700, test_loss: 1.0045, test_f1: 0.5160
 epoch: 11, train_loss: 0.9540, test_loss: 1.0057, test_f1: 0.4849
 epoch: 12, train_loss: 0.9661, test_loss: 1.0193, test_f1: 0.4585
 epoch: 13, train_loss: 0.9451, test_loss: 1.0288, test_f1: 0.4758
 epoch: 14, train_loss: 0.9394, test_loss: 1.0201, test_f1: 0.4882
 epoch: 15, train_loss: 0.9399, test_loss: 0.9883, test_f1: 0.4995
 epoch: 16, train_loss: 0.9285, test_loss: 1.0239, test_f1: 0.4800
 epoch: 17, train_loss: 0.9303, test_loss: 0.9903, test_f1: 0.5084
 epoch: 18, train_loss: 0.9261, test_loss: 0.9807, test_f1: 0.5186
 epoch: 19, train_loss: 0.9145, test_loss: 0.9980, test_f1: 0.5216
 epoch: 20, train_loss: 0.9139, test_loss: 0.9830, test_f1: 0.5025
 epoch: 21, train_loss: 0.8957, test_loss: 1.0065, test_f1: 0.4872
 epoch: 22, train_loss: 0.8925, test_loss: 1.0104, test_f1: 0.5117
 epoch: 23, train_loss: 0.8992, test_loss: 1.0288, test_f1: 0.4839
 epoch: 24, train_loss: 0.8806, test_loss: 0.9432, test_f1: 0.5496
 epoch: 25, train_loss: 0.8971, test_loss: 0.9877, test_f1: 0.5400
 epoch: 26, train_loss: 0.8921, test_loss: 0.9730, test_f1: 0.5524
 epoch: 27, train_loss: 0.8848, test_loss: 0.9719, test_f1: 0.5277
 epoch: 28, train_loss: 0.8999, test_loss: 0.9876, test_f1: 0.5091
 epoch: 29, train_loss: 0.8952, test_loss: 0.9663, test_f1: 0.5153
 epoch: 30, train_loss: 0.8740, test_loss: 1.0669, test_f1: 0.4501
 epoch: 31, train_loss: 0.9064, test_loss: 0.9663, test_f1: 0.5490
 epoch: 32, train_loss: 0.8739, test_loss: 0.9834, test_f1: 0.5264
 epoch: 33, train_loss: 0.8782, test_loss: 0.9669, test_f1: 0.5328
 epoch: 34, train_loss: 0.8682, test_loss: 1.0721, test_f1: 0.4715
 epoch: 35, train_loss: 0.8741, test_loss: 0.9474, test_f1: 0.5227
 epoch: 36, train_loss: 0.8570, test_loss: 0.9866, test_f1: 0.5309
 epoch: 37, train_loss: 0.8532, test_loss: 0.9623, test_f1: 0.5524
 epoch: 38, train_loss: 0.8719, test_loss: 0.9959, test_f1: 0.5407
 epoch: 39, train_loss: 0.8701, test_loss: 0.9546, test_f1: 0.5429
 epoch: 40, train_loss: 0.8470, test_loss: 0.9510, test_f1: 0.5473
 epoch: 41, train_loss: 0.8442, test_loss: 0.9795, test_f1: 0.5315
 epoch: 42, train_loss: 0.8320, test_loss: 0.9829, test_f1: 0.5199
 epoch: 43, train_loss: 0.8231, test_loss: 1.0085, test_f1: 0.5230
 epoch: 44, train_loss: 0.8292, test_loss: 1.0743, test_f1: 0.5237
 epoch: 45, train_loss: 0.8437, test_loss: 1.0146, test_f1: 0.5322
 epoch: 46, train_loss: 0.8344, test_loss: 0.9914, test_f1: 0.5366
 epoch: 47, train_loss: 0.8377, test_loss: 0.9711, test_f1: 0.5700
 epoch: 48, train_loss: 0.8399, test_loss: 1.1647, test_f1: 0.4845
 epoch: 49, train_loss: 0.8398, test_loss: 1.0065, test_f1: 0.5519
 epoch: 50, train_loss: 0.8321, test_loss: 0.9700, test_f1: 0.5144
 epoch: 51, train_loss: 0.8069, test_loss: 0.9885, test_f1: 0.5592
 epoch: 52, train_loss: 0.7854, test_loss: 0.9559, test_f1: 0.5700
 epoch: 53, train_loss: 0.7693, test_loss: 0.9528, test_f1: 0.5428
 epoch: 54, train_loss: 0.7696, test_loss: 0.9743, test_f1: 0.5468
 epoch: 55, train_loss: 0.7827, test_loss: 0.9336, test_f1: 0.5582
 epoch: 56, train_loss: 0.7861, test_loss: 0.9637, test_f1: 0.5293
 epoch: 57, train_loss: 0.7723, test_loss: 1.0953, test_f1: 0.5273
 epoch: 58, train_loss: 0.7634, test_loss: 1.0022, test_f1: 0.5473
 epoch: 59, train_loss: 0.7646, test_loss: 1.0558, test_f1: 0.5269
 epoch: 60, train_loss: 0.7792, test_loss: 1.0106, test_f1: 0.5293
 epoch: 61, train_loss: 0.7611, test_loss: 1.0351, test_f1: 0.5218
 epoch: 62, train_loss: 0.7665, test_loss: 1.0441, test_f1: 0.5412
 epoch: 63, train_loss: 0.7551, test_loss: 1.0258, test_f1: 0.5376
 epoch: 64, train_loss: 0.7425, test_loss: 1.1554, test_f1: 0.5458
 epoch: 65, train_loss: 0.7546, test_loss: 1.0059, test_f1: 0.5481
 epoch: 66, train_loss: 0.7480, test_loss: 0.9992, test_f1: 0.5440
 epoch: 67, train_loss: 0.7456, test_loss: 0.9741, test_f1: 0.5461
 epoch: 68, train_loss: 0.7535, test_loss: 0.9663, test_f1: 0.5675
 epoch: 69, train_loss: 0.7487, test_loss: 1.0301, test_f1: 0.5382
 epoch: 70, train_loss: 0.7476, test_loss: 0.9734, test_f1: 0.5606
 epoch: 71, train_loss: 0.7549, test_loss: 0.9771, test_f1: 0.5690
 epoch: 72, train_loss: 0.7429, test_loss: 0.9985, test_f1: 0.5321
 epoch: 73, train_loss: 0.7543, test_loss: 1.0505, test_f1: 0.5394
 epoch: 74, train_loss: 0.7448, test_loss: 0.9949, test_f1: 0.5207
 epoch: 75, train_loss: 0.7429, test_loss: 0.9839, test_f1: 0.5426
 epoch: 76, train_loss: 0.7349, test_loss: 1.1486, test_f1: 0.5276
 epoch: 77, train_loss: 0.7344, test_loss: 1.0679, test_f1: 0.5323
 epoch: 78, train_loss: 0.7363, test_loss: 1.2340, test_f1: 0.5178
 epoch: 79, train_loss: 0.7382, test_loss: 1.0072, test_f1: 0.5536
 epoch: 80, train_loss: 0.7458, test_loss: 1.2254, test_f1: 0.5211
 epoch: 81, train_loss: 0.7336, test_loss: 1.1969, test_f1: 0.5510
 epoch: 82, train_loss: 0.7210, test_loss: 1.1473, test_f1: 0.5591
 epoch: 83, train_loss: 0.7335, test_loss: 1.0883, test_f1: 0.5532
 epoch: 84, train_loss: 0.7286, test_loss: 1.1573, test_f1: 0.5439
 epoch: 85, train_loss: 0.7369, test_loss: 1.0167, test_f1: 0.5557
 epoch: 86, train_loss: 0.7154, test_loss: 1.1951, test_f1: 0.5361
 epoch: 87, train_loss: 0.7281, test_loss: 1.0979, test_f1: 0.5580
 epoch: 88, train_loss: 0.7194, test_loss: 1.0918, test_f1: 0.5300
 epoch: 89, train_loss: 0.7181, test_loss: 1.3307, test_f1: 0.5217
 epoch: 90, train_loss: 0.7160, test_loss: 1.1298, test_f1: 0.5538
 epoch: 91, train_loss: 0.7008, test_loss: 1.1583, test_f1: 0.5248
 epoch: 92, train_loss: 0.7175, test_loss: 1.2007, test_f1: 0.5475
 epoch: 93, train_loss: 0.7093, test_loss: 1.2821, test_f1: 0.5220
 epoch: 94, train_loss: 0.7211, test_loss: 1.1608, test_f1: 0.5240
 epoch: 95, train_loss: 0.7150, test_loss: 1.1556, test_f1: 0.5517
 epoch: 96, train_loss: 0.6999, test_loss: 1.0392, test_f1: 0.5552
 epoch: 97, train_loss: 0.7087, test_loss: 1.2083, test_f1: 0.5525
 epoch: 98, train_loss: 0.6910, test_loss: 1.1927, test_f1: 0.5551
 epoch: 99, train_loss: 0.7079, test_loss: 1.2095, test_f1: 0.5520

Training completed in 837.35 seconds
Best F1: 0.6075 at epoch 85
Mean F1 across iterations: 0.5896  0.0102
========================FINAL RESULTS================================
FEGIN weighted F1: 0.6075  0.0102
python main.py --data ltspice_examples --representation component_component --model FEGIN --layers 5 --hiddens 32 --batch_size 64 --lr 0.01 --emb_size 250 --epochs 100 --save_appendix component_component_L5_H32_BS64_LR0.01_E250 --no_val
-----



STDERR:
  File "main.py", line 370, in <module>
    main()
  File "main.py", line 254, in main
    dataset = dataset_class(
  File "/home/philip/projects/llm_inference_code_repo/Circuit-Completion-Using-GNNs/component_classification_with_link_prediction_head/evaluation/FEGIN/kernel/circuit_datasets.py", line 15, in __init__
    self.data, self.slices = torch.load(self.processed_paths[0])
  File "/home/philip/.local/lib/python3.8/site-packages/torch/serialization.py", line 1040, in load
    warnings.warn(
  File "/usr/lib/python3.8/warnings.py", line 109, in _showwarnmsg
    sw(msg.message, msg.category, msg.filename, msg.lineno,
  File "main.py", line 47, in warn_with_traceback
    traceback.print_stack(file=log)
/home/philip/projects/llm_inference_code_repo/Circuit-Completion-Using-GNNs/component_classification_with_link_prediction_head/evaluation/FEGIN/kernel/circuit_datasets.py:15: FutureWarning: You are using `torch.load` with `weights_only=False` (the current default value), which uses the default pickle module implicitly. It is possible to construct malicious pickle data which will execute arbitrary code during unpickling (See https://github.com/pytorch/pytorch/blob/main/SECURITY.md#untrusted-models for more details). In a future release, the default value for `weights_only` will be flipped to `True`. This limits the functions that could be executed during unpickling. Arbitrary objects will no longer be allowed to be loaded via this mode unless they are explicitly allowlisted by the user via `torch.serialization.add_safe_globals`. We recommend you start setting `weights_only=True` for any use case where you don't have full control of the loaded file. Please open an issue on GitHub for any issues related to this experimental feature.
  self.data, self.slices = torch.load(self.processed_paths[0])
