STDOUT:
Results will be saved in /home/philip/projects/ltspice_examples_code_repo/Circuit-Completion-Using-GNNs/component_classification_with_link_prediction_head/evaluation/FEGIN/results/model_FEGIN_dataset_ltspice_examples
Command line input: python main.py --data ltspice_examples --representation component_pin_net --model FEGIN --layers 6 --hiddens 128 --batch_size 32 --lr 0.001 --emb_size 128 --epochs 100 --save_appendix component_pin_net_L6_H128_BS32_LR0.001_E128 --no_val
 is saved.
-----
ltspice_examples - FEGIN
Using 6 layers, 128 hidden units, h = 2
Loading component_pin_net representation dataset
ENTERED
Training FEGIN on component_pin_net representation
Train: 3558, Test: 846
##################ITERATION #0 ****************************************
 epoch: 0, train_loss: 1.1290, test_loss: 1.0593, test_f1: 0.4467
 epoch: 1, train_loss: 0.9908, test_loss: 0.9544, test_f1: 0.5039
 epoch: 2, train_loss: 0.9465, test_loss: 0.9246, test_f1: 0.5641
 epoch: 3, train_loss: 0.9194, test_loss: 0.9330, test_f1: 0.4896
 epoch: 4, train_loss: 0.9089, test_loss: 0.9195, test_f1: 0.5261
 epoch: 5, train_loss: 0.8924, test_loss: 0.9006, test_f1: 0.5190
 epoch: 6, train_loss: 0.8601, test_loss: 0.8455, test_f1: 0.5483
 epoch: 7, train_loss: 0.8522, test_loss: 0.8367, test_f1: 0.6087
 epoch: 8, train_loss: 0.8119, test_loss: 0.8485, test_f1: 0.5231
 epoch: 9, train_loss: 0.8184, test_loss: 0.8277, test_f1: 0.5899
 epoch: 10, train_loss: 0.7854, test_loss: 0.7838, test_f1: 0.6148
 epoch: 11, train_loss: 0.7768, test_loss: 0.7783, test_f1: 0.6255
 epoch: 12, train_loss: 0.7649, test_loss: 0.7755, test_f1: 0.5869
 epoch: 13, train_loss: 0.7425, test_loss: 0.7593, test_f1: 0.6383
 epoch: 14, train_loss: 0.7329, test_loss: 0.7232, test_f1: 0.6454
 epoch: 15, train_loss: 0.7406, test_loss: 0.7910, test_f1: 0.6457
 epoch: 16, train_loss: 0.7215, test_loss: 0.8049, test_f1: 0.6089
 epoch: 17, train_loss: 0.6945, test_loss: 0.8128, test_f1: 0.6375
 epoch: 18, train_loss: 0.6728, test_loss: 0.7766, test_f1: 0.6258
 epoch: 19, train_loss: 0.6722, test_loss: 0.8595, test_f1: 0.6170
 epoch: 20, train_loss: 0.6533, test_loss: 0.7103, test_f1: 0.6650
 epoch: 21, train_loss: 0.6390, test_loss: 0.7490, test_f1: 0.6597
 epoch: 22, train_loss: 0.6326, test_loss: 0.8059, test_f1: 0.6575
 epoch: 23, train_loss: 0.6116, test_loss: 0.8232, test_f1: 0.6337
 epoch: 24, train_loss: 0.6326, test_loss: 0.7636, test_f1: 0.6701
 epoch: 25, train_loss: 0.6015, test_loss: 0.7914, test_f1: 0.6610
 epoch: 26, train_loss: 0.5953, test_loss: 0.8212, test_f1: 0.6648
 epoch: 27, train_loss: 0.5839, test_loss: 0.7230, test_f1: 0.6785
 epoch: 28, train_loss: 0.5870, test_loss: 0.7736, test_f1: 0.6601
 epoch: 29, train_loss: 0.5837, test_loss: 0.7576, test_f1: 0.6631
 epoch: 30, train_loss: 0.5615, test_loss: 0.7749, test_f1: 0.6626
 epoch: 31, train_loss: 0.5543, test_loss: 0.8619, test_f1: 0.6477
 epoch: 32, train_loss: 0.5393, test_loss: 0.8326, test_f1: 0.6794
 epoch: 33, train_loss: 0.5409, test_loss: 0.8265, test_f1: 0.6519
 epoch: 34, train_loss: 0.5345, test_loss: 0.7979, test_f1: 0.6721
 epoch: 35, train_loss: 0.5290, test_loss: 0.7022, test_f1: 0.7196
 epoch: 36, train_loss: 0.5218, test_loss: 0.7688, test_f1: 0.6687
 epoch: 37, train_loss: 0.5143, test_loss: 0.7119, test_f1: 0.6790
 epoch: 38, train_loss: 0.4882, test_loss: 0.9075, test_f1: 0.6955
 epoch: 39, train_loss: 0.4801, test_loss: 0.7524, test_f1: 0.6743
 epoch: 40, train_loss: 0.4730, test_loss: 0.7677, test_f1: 0.6749
 epoch: 41, train_loss: 0.4971, test_loss: 0.8404, test_f1: 0.6364
 epoch: 42, train_loss: 0.4862, test_loss: 0.8647, test_f1: 0.6687
 epoch: 43, train_loss: 0.5371, test_loss: 0.8916, test_f1: 0.7150
 epoch: 44, train_loss: 0.4789, test_loss: 0.9419, test_f1: 0.6639
 epoch: 45, train_loss: 0.4553, test_loss: 0.8808, test_f1: 0.6630
 epoch: 46, train_loss: 0.4455, test_loss: 0.9442, test_f1: 0.6791
 epoch: 47, train_loss: 0.4604, test_loss: 0.9908, test_f1: 0.6387
 epoch: 48, train_loss: 0.4357, test_loss: 1.0101, test_f1: 0.6819
 epoch: 49, train_loss: 0.4409, test_loss: 0.8632, test_f1: 0.6787
 epoch: 50, train_loss: 0.4248, test_loss: 0.9157, test_f1: 0.6708
 epoch: 51, train_loss: 0.3807, test_loss: 0.8781, test_f1: 0.6981
 epoch: 52, train_loss: 0.3489, test_loss: 0.9421, test_f1: 0.6870
 epoch: 53, train_loss: 0.3454, test_loss: 1.1185, test_f1: 0.6722
 epoch: 54, train_loss: 0.3398, test_loss: 1.2101, test_f1: 0.6785
 epoch: 55, train_loss: 0.3409, test_loss: 1.2165, test_f1: 0.6845
 epoch: 56, train_loss: 0.3384, test_loss: 1.0997, test_f1: 0.6988
 epoch: 57, train_loss: 0.3255, test_loss: 1.0943, test_f1: 0.6789
 epoch: 58, train_loss: 0.3142, test_loss: 1.1095, test_f1: 0.7103
 epoch: 59, train_loss: 0.3197, test_loss: 1.1549, test_f1: 0.6857
 epoch: 60, train_loss: 0.3084, test_loss: 1.2175, test_f1: 0.6767
 epoch: 61, train_loss: 0.2959, test_loss: 1.2045, test_f1: 0.6882
 epoch: 62, train_loss: 0.3180, test_loss: 1.0928, test_f1: 0.6712
 epoch: 63, train_loss: 0.3123, test_loss: 1.2116, test_f1: 0.6774
 epoch: 64, train_loss: 0.2994, test_loss: 1.2530, test_f1: 0.7023
 epoch: 65, train_loss: 0.3119, test_loss: 1.1900, test_f1: 0.6819
 epoch: 66, train_loss: 0.2800, test_loss: 1.3851, test_f1: 0.6907
 epoch: 67, train_loss: 0.2927, test_loss: 1.3617, test_f1: 0.6731
 epoch: 68, train_loss: 0.2966, test_loss: 1.1950, test_f1: 0.6694
 epoch: 69, train_loss: 0.2992, test_loss: 1.3090, test_f1: 0.6828
 epoch: 70, train_loss: 0.2892, test_loss: 1.3741, test_f1: 0.6823
 epoch: 71, train_loss: 0.2815, test_loss: 1.3644, test_f1: 0.6839
 epoch: 72, train_loss: 0.2665, test_loss: 1.3494, test_f1: 0.6818
 epoch: 73, train_loss: 0.2571, test_loss: 1.2879, test_f1: 0.6799
 epoch: 74, train_loss: 0.2628, test_loss: 1.4397, test_f1: 0.6687
 epoch: 75, train_loss: 0.2519, test_loss: 1.3399, test_f1: 0.6833
 epoch: 76, train_loss: 0.2578, test_loss: 1.2920, test_f1: 0.6716
 epoch: 77, train_loss: 0.2451, test_loss: 1.4168, test_f1: 0.6869
 epoch: 78, train_loss: 0.2489, test_loss: 1.3732, test_f1: 0.6881
 epoch: 79, train_loss: 0.2591, test_loss: 1.3753, test_f1: 0.6748
 epoch: 80, train_loss: 0.2404, test_loss: 1.3882, test_f1: 0.6829
 epoch: 81, train_loss: 0.2459, test_loss: 1.4909, test_f1: 0.6797
 epoch: 82, train_loss: 0.2455, test_loss: 1.5252, test_f1: 0.6946
 epoch: 83, train_loss: 0.2338, test_loss: 1.4820, test_f1: 0.6591
 epoch: 84, train_loss: 0.2226, test_loss: 1.4696, test_f1: 0.6821
 epoch: 85, train_loss: 0.2298, test_loss: 1.6049, test_f1: 0.6792
 epoch: 86, train_loss: 0.2405, test_loss: 1.4134, test_f1: 0.7040
 epoch: 87, train_loss: 0.2230, test_loss: 1.3604, test_f1: 0.6918
 epoch: 88, train_loss: 0.2184, test_loss: 1.5194, test_f1: 0.6696
 epoch: 89, train_loss: 0.2187, test_loss: 1.5948, test_f1: 0.6791
 epoch: 90, train_loss: 0.1998, test_loss: 1.6253, test_f1: 0.6667
 epoch: 91, train_loss: 0.2467, test_loss: 1.4468, test_f1: 0.6621
 epoch: 92, train_loss: 0.2035, test_loss: 1.5420, test_f1: 0.6677
 epoch: 93, train_loss: 0.2172, test_loss: 1.3626, test_f1: 0.6755
 epoch: 94, train_loss: 0.2232, test_loss: 1.3953, test_f1: 0.6930
 epoch: 95, train_loss: 0.2029, test_loss: 1.6671, test_f1: 0.6697
 epoch: 96, train_loss: 0.2291, test_loss: 1.5147, test_f1: 0.6801
 epoch: 97, train_loss: 0.2120, test_loss: 1.6164, test_f1: 0.6784
 epoch: 98, train_loss: 0.2011, test_loss: 1.6255, test_f1: 0.6805
 epoch: 99, train_loss: 0.2068, test_loss: 1.6179, test_f1: 0.6945
##################ITERATION #1 ****************************************
 epoch: 0, train_loss: 1.0687, test_loss: 1.1038, test_f1: 0.4590
 epoch: 1, train_loss: 0.9561, test_loss: 0.9146, test_f1: 0.5305
 epoch: 2, train_loss: 0.9240, test_loss: 0.9046, test_f1: 0.5646
 epoch: 3, train_loss: 0.8942, test_loss: 0.8539, test_f1: 0.5793
 epoch: 4, train_loss: 0.8555, test_loss: 0.8558, test_f1: 0.5764
 epoch: 5, train_loss: 0.8606, test_loss: 0.8788, test_f1: 0.5744
 epoch: 6, train_loss: 0.8199, test_loss: 0.8210, test_f1: 0.5911
 epoch: 7, train_loss: 0.8101, test_loss: 0.7495, test_f1: 0.6416
 epoch: 8, train_loss: 0.7887, test_loss: 0.7611, test_f1: 0.6415
 epoch: 9, train_loss: 0.7698, test_loss: 0.8093, test_f1: 0.6261
 epoch: 10, train_loss: 0.7579, test_loss: 0.7149, test_f1: 0.6732
 epoch: 11, train_loss: 0.7467, test_loss: 0.8708, test_f1: 0.6194
 epoch: 12, train_loss: 0.7160, test_loss: 0.8086, test_f1: 0.6386
 epoch: 13, train_loss: 0.7165, test_loss: 0.7296, test_f1: 0.6375
 epoch: 14, train_loss: 0.7016, test_loss: 0.7071, test_f1: 0.6653
 epoch: 15, train_loss: 0.6914, test_loss: 0.7712, test_f1: 0.6502
 epoch: 16, train_loss: 0.6734, test_loss: 0.7581, test_f1: 0.6558
 epoch: 17, train_loss: 0.6680, test_loss: 0.7445, test_f1: 0.6725
 epoch: 18, train_loss: 0.6482, test_loss: 0.7647, test_f1: 0.6207
 epoch: 19, train_loss: 0.6290, test_loss: 0.6958, test_f1: 0.7127
 epoch: 20, train_loss: 0.6109, test_loss: 0.8187, test_f1: 0.6609
 epoch: 21, train_loss: 0.6055, test_loss: 0.8326, test_f1: 0.6556
 epoch: 22, train_loss: 0.5973, test_loss: 0.7749, test_f1: 0.6571
 epoch: 23, train_loss: 0.5922, test_loss: 0.7471, test_f1: 0.6481
 epoch: 24, train_loss: 0.5879, test_loss: 0.7685, test_f1: 0.6953
 epoch: 25, train_loss: 0.5714, test_loss: 0.8447, test_f1: 0.6130
 epoch: 26, train_loss: 0.5599, test_loss: 0.8690, test_f1: 0.6659
 epoch: 27, train_loss: 0.5478, test_loss: 0.7572, test_f1: 0.6520
 epoch: 28, train_loss: 0.5410, test_loss: 0.8611, test_f1: 0.6583
 epoch: 29, train_loss: 0.5210, test_loss: 0.8878, test_f1: 0.6453
 epoch: 30, train_loss: 0.5360, test_loss: 0.8495, test_f1: 0.6375
 epoch: 31, train_loss: 0.5205, test_loss: 0.8384, test_f1: 0.6519
 epoch: 32, train_loss: 0.5050, test_loss: 0.7851, test_f1: 0.6591
 epoch: 33, train_loss: 0.4851, test_loss: 0.9159, test_f1: 0.6456
 epoch: 34, train_loss: 0.5016, test_loss: 0.8328, test_f1: 0.6530
 epoch: 35, train_loss: 0.4948, test_loss: 0.8866, test_f1: 0.6593
 epoch: 36, train_loss: 0.5061, test_loss: 0.8065, test_f1: 0.6975
 epoch: 37, train_loss: 0.4797, test_loss: 0.8555, test_f1: 0.6346
 epoch: 38, train_loss: 0.4857, test_loss: 0.8826, test_f1: 0.6412
 epoch: 39, train_loss: 0.4462, test_loss: 0.9445, test_f1: 0.6540
 epoch: 40, train_loss: 0.4518, test_loss: 0.9776, test_f1: 0.6609
 epoch: 41, train_loss: 0.4510, test_loss: 0.9315, test_f1: 0.6603
 epoch: 42, train_loss: 0.4288, test_loss: 0.8553, test_f1: 0.6710
 epoch: 43, train_loss: 0.4275, test_loss: 0.9593, test_f1: 0.6711
 epoch: 44, train_loss: 0.4154, test_loss: 0.9704, test_f1: 0.6588
 epoch: 45, train_loss: 0.4174, test_loss: 0.9147, test_f1: 0.6502
 epoch: 46, train_loss: 0.4035, test_loss: 0.8548, test_f1: 0.6847
 epoch: 47, train_loss: 0.3950, test_loss: 0.9808, test_f1: 0.6827
 epoch: 48, train_loss: 0.4351, test_loss: 0.9456, test_f1: 0.6533
 epoch: 49, train_loss: 0.3871, test_loss: 0.9930, test_f1: 0.6793
 epoch: 50, train_loss: 0.3796, test_loss: 1.1610, test_f1: 0.6529
 epoch: 51, train_loss: 0.3250, test_loss: 1.1050, test_f1: 0.6420
 epoch: 52, train_loss: 0.3185, test_loss: 1.0670, test_f1: 0.6702
 epoch: 53, train_loss: 0.3175, test_loss: 1.0645, test_f1: 0.6737
 epoch: 54, train_loss: 0.2982, test_loss: 1.0791, test_f1: 0.6854
 epoch: 55, train_loss: 0.3029, test_loss: 1.1300, test_f1: 0.6653
 epoch: 56, train_loss: 0.2898, test_loss: 1.0565, test_f1: 0.6638
 epoch: 57, train_loss: 0.2866, test_loss: 1.1462, test_f1: 0.6567
 epoch: 58, train_loss: 0.2807, test_loss: 1.2661, test_f1: 0.6579
 epoch: 59, train_loss: 0.2674, test_loss: 1.0630, test_f1: 0.6825
 epoch: 60, train_loss: 0.2577, test_loss: 1.2300, test_f1: 0.6801
 epoch: 61, train_loss: 0.2616, test_loss: 1.2543, test_f1: 0.6682
 epoch: 62, train_loss: 0.2654, test_loss: 1.3403, test_f1: 0.6535
 epoch: 63, train_loss: 0.2567, test_loss: 1.3549, test_f1: 0.6449
 epoch: 64, train_loss: 0.2674, test_loss: 1.2744, test_f1: 0.6729
 epoch: 65, train_loss: 0.2422, test_loss: 1.3156, test_f1: 0.6610
 epoch: 66, train_loss: 0.2525, test_loss: 1.3016, test_f1: 0.6593
 epoch: 67, train_loss: 0.2396, test_loss: 1.3814, test_f1: 0.6474
 epoch: 68, train_loss: 0.2639, test_loss: 1.3508, test_f1: 0.6580
 epoch: 69, train_loss: 0.2450, test_loss: 1.3576, test_f1: 0.6717
 epoch: 70, train_loss: 0.2647, test_loss: 1.5203, test_f1: 0.6523
 epoch: 71, train_loss: 0.2458, test_loss: 1.3932, test_f1: 0.6678
 epoch: 72, train_loss: 0.2396, test_loss: 1.3378, test_f1: 0.6840
 epoch: 73, train_loss: 0.2255, test_loss: 1.3629, test_f1: 0.6883
 epoch: 74, train_loss: 0.2446, test_loss: 1.4724, test_f1: 0.6725
 epoch: 75, train_loss: 0.2516, test_loss: 1.4316, test_f1: 0.6544
 epoch: 76, train_loss: 0.2253, test_loss: 1.4691, test_f1: 0.6617
 epoch: 77, train_loss: 0.2322, test_loss: 1.5121, test_f1: 0.6700
 epoch: 78, train_loss: 0.2047, test_loss: 1.5187, test_f1: 0.6710
 epoch: 79, train_loss: 0.2157, test_loss: 1.6022, test_f1: 0.6601
 epoch: 80, train_loss: 0.2285, test_loss: 1.4197, test_f1: 0.6462
 epoch: 81, train_loss: 0.2080, test_loss: 1.5772, test_f1: 0.6465
 epoch: 82, train_loss: 0.2042, test_loss: 1.6803, test_f1: 0.6640
 epoch: 83, train_loss: 0.2236, test_loss: 1.3369, test_f1: 0.6791
 epoch: 84, train_loss: 0.1937, test_loss: 1.5357, test_f1: 0.6861
 epoch: 85, train_loss: 0.1821, test_loss: 1.5840, test_f1: 0.6874
 epoch: 86, train_loss: 0.1950, test_loss: 1.5495, test_f1: 0.6818
 epoch: 87, train_loss: 0.1973, test_loss: 1.5352, test_f1: 0.6644
 epoch: 88, train_loss: 0.1858, test_loss: 1.5165, test_f1: 0.6718
 epoch: 89, train_loss: 0.2044, test_loss: 1.6519, test_f1: 0.6562
 epoch: 90, train_loss: 0.1917, test_loss: 1.5836, test_f1: 0.6596
 epoch: 91, train_loss: 0.1822, test_loss: 1.6542, test_f1: 0.6627
 epoch: 92, train_loss: 0.2169, test_loss: 1.5917, test_f1: 0.6888
 epoch: 93, train_loss: 0.1870, test_loss: 1.7942, test_f1: 0.6597
 epoch: 94, train_loss: 0.1888, test_loss: 1.8281, test_f1: 0.6738
 epoch: 95, train_loss: 0.1880, test_loss: 1.9052, test_f1: 0.6549
 epoch: 96, train_loss: 0.1727, test_loss: 1.7540, test_f1: 0.6642
 epoch: 97, train_loss: 0.1609, test_loss: 1.7724, test_f1: 0.6629
 epoch: 98, train_loss: 0.1650, test_loss: 1.8616, test_f1: 0.6639
 epoch: 99, train_loss: 0.1727, test_loss: 1.7592, test_f1: 0.6728
##################ITERATION #2 ****************************************
 epoch: 0, train_loss: 1.1185, test_loss: 0.9755, test_f1: 0.5064
 epoch: 1, train_loss: 0.9527, test_loss: 0.8894, test_f1: 0.5224
 epoch: 2, train_loss: 0.9171, test_loss: 0.9833, test_f1: 0.5412
 epoch: 3, train_loss: 0.8921, test_loss: 0.8539, test_f1: 0.5648
 epoch: 4, train_loss: 0.8699, test_loss: 0.8886, test_f1: 0.5655
 epoch: 5, train_loss: 0.8502, test_loss: 0.8274, test_f1: 0.5733
 epoch: 6, train_loss: 0.8196, test_loss: 0.8030, test_f1: 0.6271
 epoch: 7, train_loss: 0.7812, test_loss: 0.7938, test_f1: 0.5985
 epoch: 8, train_loss: 0.7738, test_loss: 0.8414, test_f1: 0.5863
 epoch: 9, train_loss: 0.7568, test_loss: 0.7531, test_f1: 0.6550
 epoch: 10, train_loss: 0.7331, test_loss: 0.7967, test_f1: 0.5931
 epoch: 11, train_loss: 0.7175, test_loss: 0.7205, test_f1: 0.6498
 epoch: 12, train_loss: 0.7079, test_loss: 0.7218, test_f1: 0.6470
 epoch: 13, train_loss: 0.7130, test_loss: 0.7181, test_f1: 0.6336
 epoch: 14, train_loss: 0.6727, test_loss: 0.7492, test_f1: 0.7079
 epoch: 15, train_loss: 0.6694, test_loss: 0.7125, test_f1: 0.6692
 epoch: 16, train_loss: 0.6697, test_loss: 0.7221, test_f1: 0.6542
 epoch: 17, train_loss: 0.6470, test_loss: 0.7660, test_f1: 0.6532
 epoch: 18, train_loss: 0.6542, test_loss: 0.7168, test_f1: 0.6698
 epoch: 19, train_loss: 0.6330, test_loss: 0.6739, test_f1: 0.6667
 epoch: 20, train_loss: 0.6028, test_loss: 0.7338, test_f1: 0.6857
 epoch: 21, train_loss: 0.5953, test_loss: 0.8070, test_f1: 0.6560
 epoch: 22, train_loss: 0.5793, test_loss: 0.7803, test_f1: 0.6646
 epoch: 23, train_loss: 0.5832, test_loss: 0.6748, test_f1: 0.6898
 epoch: 24, train_loss: 0.5706, test_loss: 0.8493, test_f1: 0.6561
 epoch: 25, train_loss: 0.5859, test_loss: 0.6359, test_f1: 0.6915
 epoch: 26, train_loss: 0.5401, test_loss: 0.6950, test_f1: 0.6588
 epoch: 27, train_loss: 0.5487, test_loss: 0.7439, test_f1: 0.6788
 epoch: 28, train_loss: 0.5380, test_loss: 0.7218, test_f1: 0.6706
 epoch: 29, train_loss: 0.5467, test_loss: 0.7329, test_f1: 0.6677
 epoch: 30, train_loss: 0.5103, test_loss: 0.7084, test_f1: 0.6753
 epoch: 31, train_loss: 0.5160, test_loss: 0.6798, test_f1: 0.6781
 epoch: 32, train_loss: 0.5173, test_loss: 0.6799, test_f1: 0.6990
 epoch: 33, train_loss: 0.5055, test_loss: 0.7037, test_f1: 0.6826
 epoch: 34, train_loss: 0.4874, test_loss: 0.7570, test_f1: 0.6939
 epoch: 35, train_loss: 0.4888, test_loss: 0.7847, test_f1: 0.6631
 epoch: 36, train_loss: 0.4610, test_loss: 0.7547, test_f1: 0.6884
 epoch: 37, train_loss: 0.4706, test_loss: 0.6812, test_f1: 0.7062
 epoch: 38, train_loss: 0.4572, test_loss: 0.8265, test_f1: 0.6879
 epoch: 39, train_loss: 0.4496, test_loss: 0.8158, test_f1: 0.6695
 epoch: 40, train_loss: 0.4396, test_loss: 0.7564, test_f1: 0.6675
 epoch: 41, train_loss: 0.4645, test_loss: 0.8810, test_f1: 0.6688
 epoch: 42, train_loss: 0.4203, test_loss: 0.6862, test_f1: 0.6990
 epoch: 43, train_loss: 0.4296, test_loss: 0.7572, test_f1: 0.6983
 epoch: 44, train_loss: 0.4185, test_loss: 0.8977, test_f1: 0.6736
 epoch: 45, train_loss: 0.4002, test_loss: 0.8193, test_f1: 0.7069
 epoch: 46, train_loss: 0.4113, test_loss: 0.8324, test_f1: 0.6489
 epoch: 47, train_loss: 0.4031, test_loss: 0.9062, test_f1: 0.6745
 epoch: 48, train_loss: 0.4234, test_loss: 0.8555, test_f1: 0.6488
 epoch: 49, train_loss: 0.3918, test_loss: 0.9500, test_f1: 0.6814
 epoch: 50, train_loss: 0.3603, test_loss: 0.8216, test_f1: 0.6857
 epoch: 51, train_loss: 0.3591, test_loss: 0.9027, test_f1: 0.6959
 epoch: 52, train_loss: 0.3029, test_loss: 1.0338, test_f1: 0.6617
 epoch: 53, train_loss: 0.3089, test_loss: 0.9780, test_f1: 0.6795
 epoch: 54, train_loss: 0.2997, test_loss: 1.0074, test_f1: 0.6942
 epoch: 55, train_loss: 0.2962, test_loss: 0.9174, test_f1: 0.7035
 epoch: 56, train_loss: 0.2779, test_loss: 1.0420, test_f1: 0.6902
 epoch: 57, train_loss: 0.2796, test_loss: 1.0769, test_f1: 0.6768
 epoch: 58, train_loss: 0.2751, test_loss: 1.1059, test_f1: 0.6738
 epoch: 59, train_loss: 0.2760, test_loss: 1.0613, test_f1: 0.6882
 epoch: 60, train_loss: 0.2532, test_loss: 1.0023, test_f1: 0.6971
 epoch: 61, train_loss: 0.2737, test_loss: 1.0218, test_f1: 0.6824
 epoch: 62, train_loss: 0.2524, test_loss: 1.2869, test_f1: 0.6676
 epoch: 63, train_loss: 0.2567, test_loss: 1.0724, test_f1: 0.6753
 epoch: 64, train_loss: 0.2518, test_loss: 1.1500, test_f1: 0.6713
 epoch: 65, train_loss: 0.2421, test_loss: 1.2343, test_f1: 0.6600
 epoch: 66, train_loss: 0.2389, test_loss: 1.0985, test_f1: 0.6839
 epoch: 67, train_loss: 0.2559, test_loss: 1.2024, test_f1: 0.6668
 epoch: 68, train_loss: 0.2450, test_loss: 1.2412, test_f1: 0.6847
 epoch: 69, train_loss: 0.2281, test_loss: 1.3278, test_f1: 0.6806
 epoch: 70, train_loss: 0.2953, test_loss: 1.0489, test_f1: 0.6883
 epoch: 71, train_loss: 0.2559, test_loss: 1.1279, test_f1: 0.6904
 epoch: 72, train_loss: 0.2464, test_loss: 1.1582, test_f1: 0.6987
 epoch: 73, train_loss: 0.2285, test_loss: 1.1053, test_f1: 0.6856
 epoch: 74, train_loss: 0.2054, test_loss: 1.1847, test_f1: 0.6963
 epoch: 75, train_loss: 0.2364, test_loss: 1.1656, test_f1: 0.6941
 epoch: 76, train_loss: 0.2097, test_loss: 1.3324, test_f1: 0.6855
 epoch: 77, train_loss: 0.2278, test_loss: 1.3009, test_f1: 0.6838
 epoch: 78, train_loss: 0.2127, test_loss: 1.2414, test_f1: 0.6782
 epoch: 79, train_loss: 0.2273, test_loss: 1.2674, test_f1: 0.6870
 epoch: 80, train_loss: 0.2020, test_loss: 1.3195, test_f1: 0.6779
 epoch: 81, train_loss: 0.2112, test_loss: 1.2085, test_f1: 0.6700
 epoch: 82, train_loss: 0.1977, test_loss: 1.2534, test_f1: 0.6725
 epoch: 83, train_loss: 0.1939, test_loss: 1.3373, test_f1: 0.6744
 epoch: 84, train_loss: 0.1948, test_loss: 1.1526, test_f1: 0.6802
 epoch: 85, train_loss: 0.1908, test_loss: 1.2109, test_f1: 0.6861
 epoch: 86, train_loss: 0.1831, test_loss: 1.3447, test_f1: 0.6878
 epoch: 87, train_loss: 0.1881, test_loss: 1.4109, test_f1: 0.6860
 epoch: 88, train_loss: 0.1988, test_loss: 1.4902, test_f1: 0.6700
 epoch: 89, train_loss: 0.1995, test_loss: 1.3655, test_f1: 0.6591
 epoch: 90, train_loss: 0.1970, test_loss: 1.3065, test_f1: 0.6878
 epoch: 91, train_loss: 0.1775, test_loss: 1.3383, test_f1: 0.6804
 epoch: 92, train_loss: 0.1943, test_loss: 1.3563, test_f1: 0.6660
 epoch: 93, train_loss: 0.1674, test_loss: 1.3435, test_f1: 0.6800
 epoch: 94, train_loss: 0.1754, test_loss: 1.2971, test_f1: 0.6776
 epoch: 95, train_loss: 0.1884, test_loss: 1.2019, test_f1: 0.6773
 epoch: 96, train_loss: 0.1950, test_loss: 1.2896, test_f1: 0.6819
 epoch: 97, train_loss: 0.1885, test_loss: 1.2528, test_f1: 0.6810
 epoch: 98, train_loss: 0.1784, test_loss: 1.2978, test_f1: 0.6732
 epoch: 99, train_loss: 0.1803, test_loss: 1.3112, test_f1: 0.6784
##################ITERATION #3 ****************************************
 epoch: 0, train_loss: 1.1577, test_loss: 1.0387, test_f1: 0.4567
 epoch: 1, train_loss: 0.9734, test_loss: 0.9110, test_f1: 0.5128
 epoch: 2, train_loss: 0.9312, test_loss: 0.8649, test_f1: 0.5479
 epoch: 3, train_loss: 0.8975, test_loss: 0.8725, test_f1: 0.5649
 epoch: 4, train_loss: 0.8712, test_loss: 0.8572, test_f1: 0.5410
 epoch: 5, train_loss: 0.8528, test_loss: 0.8297, test_f1: 0.5676
 epoch: 6, train_loss: 0.8201, test_loss: 0.7959, test_f1: 0.6269
 epoch: 7, train_loss: 0.7965, test_loss: 0.8178, test_f1: 0.5980
 epoch: 8, train_loss: 0.7820, test_loss: 0.8050, test_f1: 0.6302
 epoch: 9, train_loss: 0.7774, test_loss: 0.7947, test_f1: 0.6057
 epoch: 10, train_loss: 0.7372, test_loss: 0.7430, test_f1: 0.6364
 epoch: 11, train_loss: 0.7395, test_loss: 0.7523, test_f1: 0.6174
 epoch: 12, train_loss: 0.7106, test_loss: 0.7166, test_f1: 0.6804
 epoch: 13, train_loss: 0.7007, test_loss: 0.7661, test_f1: 0.6136
 epoch: 14, train_loss: 0.6925, test_loss: 0.7896, test_f1: 0.6446
 epoch: 15, train_loss: 0.6843, test_loss: 0.7498, test_f1: 0.6478
 epoch: 16, train_loss: 0.6645, test_loss: 0.7619, test_f1: 0.6382
 epoch: 17, train_loss: 0.6610, test_loss: 0.7920, test_f1: 0.6167
 epoch: 18, train_loss: 0.6423, test_loss: 0.7726, test_f1: 0.6618
 epoch: 19, train_loss: 0.6406, test_loss: 0.7745, test_f1: 0.6543
 epoch: 20, train_loss: 0.6221, test_loss: 0.7476, test_f1: 0.6477
 epoch: 21, train_loss: 0.6056, test_loss: 0.7294, test_f1: 0.6616
 epoch: 22, train_loss: 0.5953, test_loss: 0.7665, test_f1: 0.6486
 epoch: 23, train_loss: 0.6190, test_loss: 0.7906, test_f1: 0.6370
 epoch: 24, train_loss: 0.5924, test_loss: 0.6786, test_f1: 0.7058
 epoch: 25, train_loss: 0.5789, test_loss: 0.7505, test_f1: 0.6804
 epoch: 26, train_loss: 0.5697, test_loss: 0.7793, test_f1: 0.6579
 epoch: 27, train_loss: 0.5558, test_loss: 0.8627, test_f1: 0.6885
 epoch: 28, train_loss: 0.5453, test_loss: 0.7909, test_f1: 0.6589
 epoch: 29, train_loss: 0.5350, test_loss: 0.7029, test_f1: 0.7081
 epoch: 30, train_loss: 0.5230, test_loss: 0.7837, test_f1: 0.6610
 epoch: 31, train_loss: 0.5159, test_loss: 0.8804, test_f1: 0.6465
 epoch: 32, train_loss: 0.5443, test_loss: 0.7263, test_f1: 0.6989
 epoch: 33, train_loss: 0.4821, test_loss: 0.7835, test_f1: 0.6755
 epoch: 34, train_loss: 0.5165, test_loss: 0.7948, test_f1: 0.6787
 epoch: 35, train_loss: 0.4913, test_loss: 0.8004, test_f1: 0.6727
 epoch: 36, train_loss: 0.4767, test_loss: 0.8570, test_f1: 0.6797
 epoch: 37, train_loss: 0.4738, test_loss: 0.8951, test_f1: 0.6702
 epoch: 38, train_loss: 0.4677, test_loss: 0.8314, test_f1: 0.6846
 epoch: 39, train_loss: 0.4620, test_loss: 0.8459, test_f1: 0.6956
 epoch: 40, train_loss: 0.4525, test_loss: 0.8179, test_f1: 0.6636
 epoch: 41, train_loss: 0.4629, test_loss: 0.8466, test_f1: 0.6743
 epoch: 42, train_loss: 0.4223, test_loss: 0.9594, test_f1: 0.6677
 epoch: 43, train_loss: 0.4439, test_loss: 0.9519, test_f1: 0.6826
 epoch: 44, train_loss: 0.4590, test_loss: 0.8473, test_f1: 0.6938
 epoch: 45, train_loss: 0.4272, test_loss: 0.9167, test_f1: 0.6561
 epoch: 46, train_loss: 0.4410, test_loss: 0.9570, test_f1: 0.6871
 epoch: 47, train_loss: 0.4273, test_loss: 0.9217, test_f1: 0.6870
 epoch: 48, train_loss: 0.4064, test_loss: 0.8897, test_f1: 0.6963
 epoch: 49, train_loss: 0.3899, test_loss: 1.0527, test_f1: 0.6693
 epoch: 50, train_loss: 0.4166, test_loss: 0.8944, test_f1: 0.7084
 epoch: 51, train_loss: 0.3627, test_loss: 0.8698, test_f1: 0.6905
 epoch: 52, train_loss: 0.3126, test_loss: 0.9995, test_f1: 0.7014
 epoch: 53, train_loss: 0.3073, test_loss: 0.9287, test_f1: 0.7026
 epoch: 54, train_loss: 0.2990, test_loss: 0.9466, test_f1: 0.6883
 epoch: 55, train_loss: 0.2875, test_loss: 0.9316, test_f1: 0.6851
 epoch: 56, train_loss: 0.2943, test_loss: 0.9740, test_f1: 0.7015
 epoch: 57, train_loss: 0.3079, test_loss: 0.8584, test_f1: 0.6820
 epoch: 58, train_loss: 0.2829, test_loss: 0.9286, test_f1: 0.7073
 epoch: 59, train_loss: 0.2728, test_loss: 0.9196, test_f1: 0.6996
 epoch: 60, train_loss: 0.2703, test_loss: 1.0953, test_f1: 0.6814
 epoch: 61, train_loss: 0.2678, test_loss: 1.0809, test_f1: 0.7010
 epoch: 62, train_loss: 0.2909, test_loss: 1.0825, test_f1: 0.6914
 epoch: 63, train_loss: 0.2600, test_loss: 1.0805, test_f1: 0.6842
 epoch: 64, train_loss: 0.2558, test_loss: 1.0445, test_f1: 0.6806
 epoch: 65, train_loss: 0.2798, test_loss: 1.1990, test_f1: 0.6792
 epoch: 66, train_loss: 0.2870, test_loss: 1.0257, test_f1: 0.6847
 epoch: 67, train_loss: 0.2540, test_loss: 1.0270, test_f1: 0.6768
 epoch: 68, train_loss: 0.2530, test_loss: 1.0544, test_f1: 0.6757
 epoch: 69, train_loss: 0.2541, test_loss: 1.2871, test_f1: 0.6734
 epoch: 70, train_loss: 0.2596, test_loss: 1.1311, test_f1: 0.6791
 epoch: 71, train_loss: 0.2497, test_loss: 1.1038, test_f1: 0.6789
 epoch: 72, train_loss: 0.2392, test_loss: 1.2877, test_f1: 0.6925
 epoch: 73, train_loss: 0.2315, test_loss: 1.2832, test_f1: 0.6604
 epoch: 74, train_loss: 0.2526, test_loss: 1.1725, test_f1: 0.7002
 epoch: 75, train_loss: 0.2417, test_loss: 1.2275, test_f1: 0.6934
 epoch: 76, train_loss: 0.2419, test_loss: 1.2357, test_f1: 0.6980
 epoch: 77, train_loss: 0.2321, test_loss: 1.3138, test_f1: 0.6767
 epoch: 78, train_loss: 0.2099, test_loss: 1.2457, test_f1: 0.6843
 epoch: 79, train_loss: 0.2057, test_loss: 1.4588, test_f1: 0.6822
 epoch: 80, train_loss: 0.2195, test_loss: 1.2934, test_f1: 0.6722
 epoch: 81, train_loss: 0.2022, test_loss: 1.4157, test_f1: 0.6878
 epoch: 82, train_loss: 0.2069, test_loss: 1.4304, test_f1: 0.6831
 epoch: 83, train_loss: 0.2220, test_loss: 1.5739, test_f1: 0.6735
 epoch: 84, train_loss: 0.2471, test_loss: 1.2975, test_f1: 0.6891
 epoch: 85, train_loss: 0.2229, test_loss: 1.3283, test_f1: 0.6842
 epoch: 86, train_loss: 0.2279, test_loss: 1.3520, test_f1: 0.6829
 epoch: 87, train_loss: 0.2026, test_loss: 1.3145, test_f1: 0.6891
 epoch: 88, train_loss: 0.2140, test_loss: 1.3940, test_f1: 0.6908
 epoch: 89, train_loss: 0.1909, test_loss: 1.4374, test_f1: 0.6797
 epoch: 90, train_loss: 0.1915, test_loss: 1.3511, test_f1: 0.6975
 epoch: 91, train_loss: 0.2133, test_loss: 1.4388, test_f1: 0.6861
 epoch: 92, train_loss: 0.1806, test_loss: 1.2786, test_f1: 0.6793
 epoch: 93, train_loss: 0.1944, test_loss: 1.3697, test_f1: 0.6678
 epoch: 94, train_loss: 0.2087, test_loss: 1.3656, test_f1: 0.6972
 epoch: 95, train_loss: 0.1891, test_loss: 1.4609, test_f1: 0.6745
 epoch: 96, train_loss: 0.1956, test_loss: 1.4759, test_f1: 0.6821
 epoch: 97, train_loss: 0.1994, test_loss: 1.3612, test_f1: 0.6808
 epoch: 98, train_loss: 0.1819, test_loss: 1.3829, test_f1: 0.6734
 epoch: 99, train_loss: 0.1925, test_loss: 1.3505, test_f1: 0.6735
##################ITERATION #4 ****************************************
 epoch: 0, train_loss: 1.1651, test_loss: 0.9655, test_f1: 0.5031
 epoch: 1, train_loss: 0.9748, test_loss: 0.9022, test_f1: 0.5471
 epoch: 2, train_loss: 0.9356, test_loss: 0.9029, test_f1: 0.5171
 epoch: 3, train_loss: 0.8944, test_loss: 0.8802, test_f1: 0.5465
 epoch: 4, train_loss: 0.8628, test_loss: 0.8133, test_f1: 0.6029
 epoch: 5, train_loss: 0.8507, test_loss: 0.8031, test_f1: 0.5810
 epoch: 6, train_loss: 0.8242, test_loss: 0.7973, test_f1: 0.5731
 epoch: 7, train_loss: 0.8179, test_loss: 0.7863, test_f1: 0.5914
 epoch: 8, train_loss: 0.7718, test_loss: 0.7599, test_f1: 0.6165
 epoch: 9, train_loss: 0.7858, test_loss: 0.7616, test_f1: 0.6090
 epoch: 10, train_loss: 0.7450, test_loss: 0.7624, test_f1: 0.6225
 epoch: 11, train_loss: 0.7503, test_loss: 0.7802, test_f1: 0.6277
 epoch: 12, train_loss: 0.7210, test_loss: 0.6979, test_f1: 0.6431
 epoch: 13, train_loss: 0.7157, test_loss: 0.7126, test_f1: 0.6434
 epoch: 14, train_loss: 0.7017, test_loss: 0.7432, test_f1: 0.6403
 epoch: 15, train_loss: 0.6952, test_loss: 0.7268, test_f1: 0.6419
 epoch: 16, train_loss: 0.7041, test_loss: 0.7828, test_f1: 0.6564
 epoch: 17, train_loss: 0.6747, test_loss: 0.6949, test_f1: 0.6764
 epoch: 18, train_loss: 0.6624, test_loss: 0.7499, test_f1: 0.6293
 epoch: 19, train_loss: 0.6368, test_loss: 0.8181, test_f1: 0.6058
 epoch: 20, train_loss: 0.6422, test_loss: 0.7396, test_f1: 0.6414
 epoch: 21, train_loss: 0.6207, test_loss: 0.6812, test_f1: 0.6792
 epoch: 22, train_loss: 0.6203, test_loss: 0.7899, test_f1: 0.6476
 epoch: 23, train_loss: 0.5993, test_loss: 0.7171, test_f1: 0.6645
 epoch: 24, train_loss: 0.5937, test_loss: 0.8357, test_f1: 0.6360
 epoch: 25, train_loss: 0.6009, test_loss: 0.7694, test_f1: 0.6575
 epoch: 26, train_loss: 0.5717, test_loss: 0.7867, test_f1: 0.6598
 epoch: 27, train_loss: 0.5679, test_loss: 0.8304, test_f1: 0.6496
 epoch: 28, train_loss: 0.5450, test_loss: 0.8150, test_f1: 0.6666
 epoch: 29, train_loss: 0.5416, test_loss: 0.8265, test_f1: 0.6629
 epoch: 30, train_loss: 0.5360, test_loss: 0.7695, test_f1: 0.6552
 epoch: 31, train_loss: 0.5528, test_loss: 1.0627, test_f1: 0.6260
 epoch: 32, train_loss: 0.5565, test_loss: 0.9442, test_f1: 0.6500
 epoch: 33, train_loss: 0.5114, test_loss: 0.7996, test_f1: 0.6562
 epoch: 34, train_loss: 0.5023, test_loss: 0.8841, test_f1: 0.6517
 epoch: 35, train_loss: 0.5111, test_loss: 0.8354, test_f1: 0.6414
 epoch: 36, train_loss: 0.4868, test_loss: 0.9073, test_f1: 0.6796
 epoch: 37, train_loss: 0.4936, test_loss: 0.9763, test_f1: 0.6625
 epoch: 38, train_loss: 0.4779, test_loss: 0.9761, test_f1: 0.6621
 epoch: 39, train_loss: 0.4757, test_loss: 0.9361, test_f1: 0.6505
 epoch: 40, train_loss: 0.4572, test_loss: 1.0810, test_f1: 0.6485
 epoch: 41, train_loss: 0.4539, test_loss: 0.9698, test_f1: 0.6761
 epoch: 42, train_loss: 0.4517, test_loss: 0.9661, test_f1: 0.6681
 epoch: 43, train_loss: 0.4566, test_loss: 1.0043, test_f1: 0.6594
 epoch: 44, train_loss: 0.4681, test_loss: 0.8870, test_f1: 0.6743
 epoch: 45, train_loss: 0.4470, test_loss: 0.9830, test_f1: 0.6583
 epoch: 46, train_loss: 0.4267, test_loss: 0.9999, test_f1: 0.6756
 epoch: 47, train_loss: 0.4118, test_loss: 1.0551, test_f1: 0.6790
 epoch: 48, train_loss: 0.4061, test_loss: 1.0080, test_f1: 0.6768
 epoch: 49, train_loss: 0.4055, test_loss: 1.0863, test_f1: 0.6807
 epoch: 50, train_loss: 0.4295, test_loss: 0.9687, test_f1: 0.6878
 epoch: 51, train_loss: 0.3688, test_loss: 1.0363, test_f1: 0.6984
 epoch: 52, train_loss: 0.3359, test_loss: 1.0589, test_f1: 0.6898
 epoch: 53, train_loss: 0.3551, test_loss: 1.0854, test_f1: 0.6795
 epoch: 54, train_loss: 0.3170, test_loss: 1.1255, test_f1: 0.6744
 epoch: 55, train_loss: 0.3110, test_loss: 1.0670, test_f1: 0.6824
 epoch: 56, train_loss: 0.3180, test_loss: 1.0953, test_f1: 0.6936
 epoch: 57, train_loss: 0.3135, test_loss: 1.1276, test_f1: 0.6809
 epoch: 58, train_loss: 0.2900, test_loss: 1.1344, test_f1: 0.6905
 epoch: 59, train_loss: 0.3046, test_loss: 1.1483, test_f1: 0.6801
 epoch: 60, train_loss: 0.2977, test_loss: 1.1963, test_f1: 0.6772
 epoch: 61, train_loss: 0.2873, test_loss: 1.3189, test_f1: 0.6673
 epoch: 62, train_loss: 0.2974, test_loss: 1.1266, test_f1: 0.6975
 epoch: 63, train_loss: 0.2674, test_loss: 1.2361, test_f1: 0.6895
 epoch: 64, train_loss: 0.2796, test_loss: 1.1762, test_f1: 0.6978
 epoch: 65, train_loss: 0.2887, test_loss: 1.0631, test_f1: 0.6920
 epoch: 66, train_loss: 0.2678, test_loss: 1.2295, test_f1: 0.7022
 epoch: 67, train_loss: 0.2677, test_loss: 1.2740, test_f1: 0.6776
 epoch: 68, train_loss: 0.2587, test_loss: 1.2839, test_f1: 0.6793
 epoch: 69, train_loss: 0.2782, test_loss: 1.3456, test_f1: 0.6810
 epoch: 70, train_loss: 0.2741, test_loss: 1.2412, test_f1: 0.6818
 epoch: 71, train_loss: 0.2718, test_loss: 1.3271, test_f1: 0.6707
 epoch: 72, train_loss: 0.2533, test_loss: 1.4750, test_f1: 0.6741
 epoch: 73, train_loss: 0.2323, test_loss: 1.2622, test_f1: 0.6862
 epoch: 74, train_loss: 0.2458, test_loss: 1.3390, test_f1: 0.6736
 epoch: 75, train_loss: 0.2587, test_loss: 1.3079, test_f1: 0.6757
 epoch: 76, train_loss: 0.2344, test_loss: 1.3797, test_f1: 0.6830
 epoch: 77, train_loss: 0.2589, test_loss: 1.3891, test_f1: 0.7025
 epoch: 78, train_loss: 0.2304, test_loss: 1.4228, test_f1: 0.6693
 epoch: 79, train_loss: 0.2224, test_loss: 1.3981, test_f1: 0.6987
 epoch: 80, train_loss: 0.2222, test_loss: 1.4062, test_f1: 0.6789
 epoch: 81, train_loss: 0.2477, test_loss: 1.4007, test_f1: 0.6726
 epoch: 82, train_loss: 0.2224, test_loss: 1.5002, test_f1: 0.6807
 epoch: 83, train_loss: 0.2380, test_loss: 1.3713, test_f1: 0.6978
 epoch: 84, train_loss: 0.2283, test_loss: 1.4699, test_f1: 0.6641
 epoch: 85, train_loss: 0.2355, test_loss: 1.5832, test_f1: 0.6621
 epoch: 86, train_loss: 0.2029, test_loss: 1.5554, test_f1: 0.6840
 epoch: 87, train_loss: 0.2254, test_loss: 1.5095, test_f1: 0.6627
 epoch: 88, train_loss: 0.2136, test_loss: 1.5495, test_f1: 0.6728
 epoch: 89, train_loss: 0.2190, test_loss: 1.5556, test_f1: 0.6558
 epoch: 90, train_loss: 0.2111, test_loss: 1.5231, test_f1: 0.6615
 epoch: 91, train_loss: 0.2279, test_loss: 1.4924, test_f1: 0.6586
 epoch: 92, train_loss: 0.2226, test_loss: 1.4995, test_f1: 0.6800
 epoch: 93, train_loss: 0.2468, test_loss: 1.3440, test_f1: 0.6893
 epoch: 94, train_loss: 0.2102, test_loss: 1.4455, test_f1: 0.6757
 epoch: 95, train_loss: 0.1971, test_loss: 1.6230, test_f1: 0.6778
 epoch: 96, train_loss: 0.1783, test_loss: 1.4654, test_f1: 0.6854
 epoch: 97, train_loss: 0.2096, test_loss: 1.5550, test_f1: 0.6815
 epoch: 98, train_loss: 0.1964, test_loss: 1.5141, test_f1: 0.6649
 epoch: 99, train_loss: 0.2093, test_loss: 1.5884, test_f1: 0.6674
##################ITERATION #5 ****************************************
 epoch: 0, train_loss: 1.2026, test_loss: 0.9670, test_f1: 0.4684
 epoch: 1, train_loss: 0.9739, test_loss: 0.9948, test_f1: 0.5012
 epoch: 2, train_loss: 0.9540, test_loss: 0.9466, test_f1: 0.5192
 epoch: 3, train_loss: 0.9246, test_loss: 0.9345, test_f1: 0.5187
 epoch: 4, train_loss: 0.8871, test_loss: 0.9160, test_f1: 0.5282
 epoch: 5, train_loss: 0.8496, test_loss: 0.8744, test_f1: 0.5950
 epoch: 6, train_loss: 0.8368, test_loss: 0.8414, test_f1: 0.5951
 epoch: 7, train_loss: 0.7895, test_loss: 0.8023, test_f1: 0.6222
 epoch: 8, train_loss: 0.7945, test_loss: 0.9275, test_f1: 0.5346
 epoch: 9, train_loss: 0.7620, test_loss: 0.7920, test_f1: 0.5748
 epoch: 10, train_loss: 0.7473, test_loss: 0.7917, test_f1: 0.6286
 epoch: 11, train_loss: 0.7236, test_loss: 0.7719, test_f1: 0.6193
 epoch: 12, train_loss: 0.6833, test_loss: 0.7031, test_f1: 0.6642
 epoch: 13, train_loss: 0.7081, test_loss: 0.7898, test_f1: 0.6508
 epoch: 14, train_loss: 0.7207, test_loss: 0.8672, test_f1: 0.6357
 epoch: 15, train_loss: 0.7010, test_loss: 0.7639, test_f1: 0.6359
 epoch: 16, train_loss: 0.6657, test_loss: 0.7701, test_f1: 0.6430
 epoch: 17, train_loss: 0.6511, test_loss: 0.8137, test_f1: 0.6438
 epoch: 18, train_loss: 0.6440, test_loss: 0.7247, test_f1: 0.6609
 epoch: 19, train_loss: 0.6205, test_loss: 0.8104, test_f1: 0.6637
 epoch: 20, train_loss: 0.6061, test_loss: 0.7432, test_f1: 0.6587
 epoch: 21, train_loss: 0.6076, test_loss: 0.7111, test_f1: 0.6771
 epoch: 22, train_loss: 0.5955, test_loss: 0.8316, test_f1: 0.6660
 epoch: 23, train_loss: 0.5854, test_loss: 0.7366, test_f1: 0.6585
 epoch: 24, train_loss: 0.5578, test_loss: 0.7746, test_f1: 0.6764
 epoch: 25, train_loss: 0.5768, test_loss: 0.8358, test_f1: 0.6280
 epoch: 26, train_loss: 0.5585, test_loss: 0.7316, test_f1: 0.6915
 epoch: 27, train_loss: 0.5378, test_loss: 0.7486, test_f1: 0.6928
 epoch: 28, train_loss: 0.5460, test_loss: 0.7820, test_f1: 0.6659
 epoch: 29, train_loss: 0.5376, test_loss: 0.8118, test_f1: 0.6683
 epoch: 30, train_loss: 0.5256, test_loss: 0.8348, test_f1: 0.6997
 epoch: 31, train_loss: 0.4942, test_loss: 0.8511, test_f1: 0.6851
 epoch: 32, train_loss: 0.4986, test_loss: 0.7542, test_f1: 0.6877
 epoch: 33, train_loss: 0.5165, test_loss: 0.8680, test_f1: 0.6699
 epoch: 34, train_loss: 0.5042, test_loss: 0.9348, test_f1: 0.6586
 epoch: 35, train_loss: 0.4775, test_loss: 0.8270, test_f1: 0.6858
 epoch: 36, train_loss: 0.4752, test_loss: 0.9374, test_f1: 0.6524
 epoch: 37, train_loss: 0.4638, test_loss: 0.9756, test_f1: 0.6665
 epoch: 38, train_loss: 0.4546, test_loss: 0.8955, test_f1: 0.6802
 epoch: 39, train_loss: 0.4606, test_loss: 0.9335, test_f1: 0.6499
 epoch: 40, train_loss: 0.4482, test_loss: 0.8896, test_f1: 0.6637
 epoch: 41, train_loss: 0.4273, test_loss: 0.8968, test_f1: 0.6814
 epoch: 42, train_loss: 0.4340, test_loss: 0.9951, test_f1: 0.6614
 epoch: 43, train_loss: 0.4096, test_loss: 1.1182, test_f1: 0.6654
 epoch: 44, train_loss: 0.4264, test_loss: 0.8875, test_f1: 0.6791
 epoch: 45, train_loss: 0.4418, test_loss: 0.9816, test_f1: 0.6551
 epoch: 46, train_loss: 0.4216, test_loss: 1.0532, test_f1: 0.6731
 epoch: 47, train_loss: 0.4342, test_loss: 1.1190, test_f1: 0.6567
 epoch: 48, train_loss: 0.3981, test_loss: 1.2195, test_f1: 0.6373
 epoch: 49, train_loss: 0.4171, test_loss: 1.0527, test_f1: 0.6575
 epoch: 50, train_loss: 0.3988, test_loss: 1.1944, test_f1: 0.6589
 epoch: 51, train_loss: 0.3615, test_loss: 1.0757, test_f1: 0.6743
 epoch: 52, train_loss: 0.3465, test_loss: 1.0440, test_f1: 0.6767
 epoch: 53, train_loss: 0.3389, test_loss: 1.1022, test_f1: 0.6607
 epoch: 54, train_loss: 0.3096, test_loss: 1.1706, test_f1: 0.6735
 epoch: 55, train_loss: 0.3160, test_loss: 1.1713, test_f1: 0.6803
 epoch: 56, train_loss: 0.2783, test_loss: 1.2818, test_f1: 0.6687
 epoch: 57, train_loss: 0.2668, test_loss: 1.3306, test_f1: 0.6888
 epoch: 58, train_loss: 0.2798, test_loss: 1.2876, test_f1: 0.6701
 epoch: 59, train_loss: 0.2982, test_loss: 1.1677, test_f1: 0.6803
 epoch: 60, train_loss: 0.2836, test_loss: 1.1916, test_f1: 0.6798
 epoch: 61, train_loss: 0.2716, test_loss: 1.3718, test_f1: 0.6743
 epoch: 62, train_loss: 0.2711, test_loss: 1.3887, test_f1: 0.6683
 epoch: 63, train_loss: 0.2670, test_loss: 1.2427, test_f1: 0.6665
 epoch: 64, train_loss: 0.2810, test_loss: 1.2830, test_f1: 0.6546
 epoch: 65, train_loss: 0.2553, test_loss: 1.2847, test_f1: 0.6608
 epoch: 66, train_loss: 0.2472, test_loss: 1.3790, test_f1: 0.6635
 epoch: 67, train_loss: 0.2486, test_loss: 1.2961, test_f1: 0.6822
 epoch: 68, train_loss: 0.2538, test_loss: 1.4631, test_f1: 0.6621
 epoch: 69, train_loss: 0.2456, test_loss: 1.3623, test_f1: 0.6886
 epoch: 70, train_loss: 0.2673, test_loss: 1.3232, test_f1: 0.6614
 epoch: 71, train_loss: 0.2309, test_loss: 1.4819, test_f1: 0.6753
 epoch: 72, train_loss: 0.2397, test_loss: 1.4522, test_f1: 0.6745
 epoch: 73, train_loss: 0.2396, test_loss: 1.3239, test_f1: 0.6762
 epoch: 74, train_loss: 0.2317, test_loss: 1.3776, test_f1: 0.6623
 epoch: 75, train_loss: 0.2344, test_loss: 1.4634, test_f1: 0.6756
 epoch: 76, train_loss: 0.2255, test_loss: 1.3798, test_f1: 0.6642
 epoch: 77, train_loss: 0.2219, test_loss: 1.4098, test_f1: 0.6787
 epoch: 78, train_loss: 0.2274, test_loss: 1.5454, test_f1: 0.6612
 epoch: 79, train_loss: 0.2228, test_loss: 1.5075, test_f1: 0.6724
 epoch: 80, train_loss: 0.2187, test_loss: 1.4880, test_f1: 0.6607
 epoch: 81, train_loss: 0.2095, test_loss: 1.5524, test_f1: 0.6662
 epoch: 82, train_loss: 0.2134, test_loss: 1.5636, test_f1: 0.6824
 epoch: 83, train_loss: 0.2132, test_loss: 1.5620, test_f1: 0.6474
 epoch: 84, train_loss: 0.1942, test_loss: 1.5244, test_f1: 0.6660
 epoch: 85, train_loss: 0.1950, test_loss: 1.5287, test_f1: 0.6751
 epoch: 86, train_loss: 0.2001, test_loss: 1.5527, test_f1: 0.6736
 epoch: 87, train_loss: 0.2118, test_loss: 1.4402, test_f1: 0.6772
 epoch: 88, train_loss: 0.2257, test_loss: 1.5204, test_f1: 0.6546
 epoch: 89, train_loss: 0.2015, test_loss: 1.5051, test_f1: 0.6703
 epoch: 90, train_loss: 0.1855, test_loss: 1.5639, test_f1: 0.6707
 epoch: 91, train_loss: 0.1887, test_loss: 1.5050, test_f1: 0.6742
 epoch: 92, train_loss: 0.2040, test_loss: 1.4948, test_f1: 0.6583
 epoch: 93, train_loss: 0.1697, test_loss: 1.6989, test_f1: 0.6858
 epoch: 94, train_loss: 0.1920, test_loss: 1.6693, test_f1: 0.6648
 epoch: 95, train_loss: 0.1826, test_loss: 1.6037, test_f1: 0.6765
 epoch: 96, train_loss: 0.1988, test_loss: 1.6106, test_f1: 0.6775
 epoch: 97, train_loss: 0.1732, test_loss: 1.6686, test_f1: 0.6779
 epoch: 98, train_loss: 0.1585, test_loss: 1.7312, test_f1: 0.6737
 epoch: 99, train_loss: 0.1757, test_loss: 1.6924, test_f1: 0.6734
##################ITERATION #6 ****************************************
 epoch: 0, train_loss: 1.1965, test_loss: 0.9771, test_f1: 0.5008
 epoch: 1, train_loss: 0.9709, test_loss: 0.9107, test_f1: 0.5381
 epoch: 2, train_loss: 0.9120, test_loss: 0.8781, test_f1: 0.5800
 epoch: 3, train_loss: 0.9009, test_loss: 0.8570, test_f1: 0.5709
 epoch: 4, train_loss: 0.8623, test_loss: 0.8279, test_f1: 0.5696
 epoch: 5, train_loss: 0.8377, test_loss: 0.8275, test_f1: 0.6032
 epoch: 6, train_loss: 0.8100, test_loss: 0.7828, test_f1: 0.6235
 epoch: 7, train_loss: 0.7854, test_loss: 0.8181, test_f1: 0.5963
 epoch: 8, train_loss: 0.7742, test_loss: 0.7434, test_f1: 0.6277
 epoch: 9, train_loss: 0.7491, test_loss: 0.7591, test_f1: 0.6370
 epoch: 10, train_loss: 0.7374, test_loss: 0.8013, test_f1: 0.6320
 epoch: 11, train_loss: 0.7350, test_loss: 0.7947, test_f1: 0.6064
 epoch: 12, train_loss: 0.6970, test_loss: 0.7617, test_f1: 0.6253
 epoch: 13, train_loss: 0.7101, test_loss: 0.7064, test_f1: 0.6908
 epoch: 14, train_loss: 0.6754, test_loss: 0.7289, test_f1: 0.6583
 epoch: 15, train_loss: 0.6750, test_loss: 0.6980, test_f1: 0.6700
 epoch: 16, train_loss: 0.6595, test_loss: 0.7616, test_f1: 0.6433
 epoch: 17, train_loss: 0.6343, test_loss: 0.7328, test_f1: 0.6621
 epoch: 18, train_loss: 0.6380, test_loss: 0.7543, test_f1: 0.6485
 epoch: 19, train_loss: 0.6230, test_loss: 0.6821, test_f1: 0.6804
 epoch: 20, train_loss: 0.6169, test_loss: 0.7381, test_f1: 0.6553
 epoch: 21, train_loss: 0.6061, test_loss: 0.8580, test_f1: 0.6595
 epoch: 22, train_loss: 0.5875, test_loss: 0.7365, test_f1: 0.6428
 epoch: 23, train_loss: 0.6247, test_loss: 0.7593, test_f1: 0.6746
 epoch: 24, train_loss: 0.5802, test_loss: 0.7465, test_f1: 0.6580
 epoch: 25, train_loss: 0.5968, test_loss: 0.7990, test_f1: 0.6386
 epoch: 26, train_loss: 0.5659, test_loss: 0.8006, test_f1: 0.6568
 epoch: 27, train_loss: 0.5651, test_loss: 0.7133, test_f1: 0.6947
 epoch: 28, train_loss: 0.5392, test_loss: 0.7439, test_f1: 0.6571
 epoch: 29, train_loss: 0.5265, test_loss: 0.6885, test_f1: 0.6943
 epoch: 30, train_loss: 0.5117, test_loss: 0.7412, test_f1: 0.6530
 epoch: 31, train_loss: 0.5251, test_loss: 0.8856, test_f1: 0.6518
 epoch: 32, train_loss: 0.5253, test_loss: 0.8140, test_f1: 0.6639
 epoch: 33, train_loss: 0.4853, test_loss: 0.7618, test_f1: 0.6670
 epoch: 34, train_loss: 0.5027, test_loss: 0.7872, test_f1: 0.6938
 epoch: 35, train_loss: 0.4817, test_loss: 0.7644, test_f1: 0.6924
 epoch: 36, train_loss: 0.4819, test_loss: 0.8552, test_f1: 0.6679
 epoch: 37, train_loss: 0.4719, test_loss: 0.9241, test_f1: 0.6884
 epoch: 38, train_loss: 0.4722, test_loss: 0.8207, test_f1: 0.6792
 epoch: 39, train_loss: 0.4559, test_loss: 0.8371, test_f1: 0.6675
 epoch: 40, train_loss: 0.4486, test_loss: 0.8443, test_f1: 0.6790
 epoch: 41, train_loss: 0.4531, test_loss: 0.8046, test_f1: 0.6722
 epoch: 42, train_loss: 0.4374, test_loss: 0.8502, test_f1: 0.6654
 epoch: 43, train_loss: 0.4514, test_loss: 0.8559, test_f1: 0.6804
 epoch: 44, train_loss: 0.4516, test_loss: 0.9022, test_f1: 0.6975
 epoch: 45, train_loss: 0.4199, test_loss: 0.8743, test_f1: 0.6900
 epoch: 46, train_loss: 0.4106, test_loss: 0.8364, test_f1: 0.6842
 epoch: 47, train_loss: 0.3968, test_loss: 0.8780, test_f1: 0.6999
 epoch: 48, train_loss: 0.4240, test_loss: 0.9033, test_f1: 0.6951
 epoch: 49, train_loss: 0.4029, test_loss: 0.8936, test_f1: 0.6671
 epoch: 50, train_loss: 0.3880, test_loss: 0.9306, test_f1: 0.6748
 epoch: 51, train_loss: 0.3329, test_loss: 0.9613, test_f1: 0.6825
 epoch: 52, train_loss: 0.3178, test_loss: 1.0907, test_f1: 0.6797
 epoch: 53, train_loss: 0.3225, test_loss: 0.9774, test_f1: 0.6672
 epoch: 54, train_loss: 0.3071, test_loss: 1.0770, test_f1: 0.6936
 epoch: 55, train_loss: 0.3058, test_loss: 1.0294, test_f1: 0.6813
 epoch: 56, train_loss: 0.3104, test_loss: 1.1227, test_f1: 0.6765
 epoch: 57, train_loss: 0.2769, test_loss: 1.0828, test_f1: 0.6782
 epoch: 58, train_loss: 0.2911, test_loss: 1.2081, test_f1: 0.6784
 epoch: 59, train_loss: 0.2780, test_loss: 1.1389, test_f1: 0.6788
 epoch: 60, train_loss: 0.2809, test_loss: 1.1438, test_f1: 0.6878
 epoch: 61, train_loss: 0.2737, test_loss: 1.0972, test_f1: 0.6787
 epoch: 62, train_loss: 0.2741, test_loss: 1.0797, test_f1: 0.6686
 epoch: 63, train_loss: 0.2986, test_loss: 1.0743, test_f1: 0.6740
 epoch: 64, train_loss: 0.2577, test_loss: 1.1177, test_f1: 0.6752
 epoch: 65, train_loss: 0.2530, test_loss: 1.2037, test_f1: 0.6724
 epoch: 66, train_loss: 0.2652, test_loss: 1.1805, test_f1: 0.6764
 epoch: 67, train_loss: 0.2553, test_loss: 1.1605, test_f1: 0.6815
 epoch: 68, train_loss: 0.2549, test_loss: 1.2564, test_f1: 0.6811
 epoch: 69, train_loss: 0.2608, test_loss: 1.2335, test_f1: 0.6903
 epoch: 70, train_loss: 0.2412, test_loss: 1.2908, test_f1: 0.6928
 epoch: 71, train_loss: 0.2508, test_loss: 1.2312, test_f1: 0.6834
 epoch: 72, train_loss: 0.2524, test_loss: 1.3037, test_f1: 0.6853
 epoch: 73, train_loss: 0.2458, test_loss: 1.2146, test_f1: 0.6962
 epoch: 74, train_loss: 0.2278, test_loss: 1.1904, test_f1: 0.6865
 epoch: 75, train_loss: 0.2233, test_loss: 1.3762, test_f1: 0.6871
 epoch: 76, train_loss: 0.2315, test_loss: 1.2315, test_f1: 0.6728
 epoch: 77, train_loss: 0.2257, test_loss: 1.3803, test_f1: 0.6848
 epoch: 78, train_loss: 0.2263, test_loss: 1.2630, test_f1: 0.6683
 epoch: 79, train_loss: 0.2359, test_loss: 1.1977, test_f1: 0.6846
 epoch: 80, train_loss: 0.2204, test_loss: 1.1723, test_f1: 0.6766
 epoch: 81, train_loss: 0.2365, test_loss: 1.1445, test_f1: 0.6933
 epoch: 82, train_loss: 0.2326, test_loss: 1.2632, test_f1: 0.6798
 epoch: 83, train_loss: 0.2141, test_loss: 1.4740, test_f1: 0.6672
 epoch: 84, train_loss: 0.2292, test_loss: 1.3634, test_f1: 0.6848
 epoch: 85, train_loss: 0.2116, test_loss: 1.2994, test_f1: 0.6756
 epoch: 86, train_loss: 0.2213, test_loss: 1.4840, test_f1: 0.6728
 epoch: 87, train_loss: 0.2166, test_loss: 1.2569, test_f1: 0.6722
 epoch: 88, train_loss: 0.2112, test_loss: 1.2661, test_f1: 0.6798
 epoch: 89, train_loss: 0.2247, test_loss: 1.2847, test_f1: 0.6588
 epoch: 90, train_loss: 0.2084, test_loss: 1.5670, test_f1: 0.6737
 epoch: 91, train_loss: 0.1929, test_loss: 1.3674, test_f1: 0.6671
 epoch: 92, train_loss: 0.1891, test_loss: 1.4155, test_f1: 0.6715
 epoch: 93, train_loss: 0.1977, test_loss: 1.3445, test_f1: 0.6714
 epoch: 94, train_loss: 0.2011, test_loss: 1.2986, test_f1: 0.6958
 epoch: 95, train_loss: 0.1829, test_loss: 1.3371, test_f1: 0.6925
 epoch: 96, train_loss: 0.1941, test_loss: 1.4537, test_f1: 0.6857
 epoch: 97, train_loss: 0.1955, test_loss: 1.3367, test_f1: 0.6831
 epoch: 98, train_loss: 0.2168, test_loss: 1.4609, test_f1: 0.6752
 epoch: 99, train_loss: 0.1923, test_loss: 1.4848, test_f1: 0.6795
##################ITERATION #7 ****************************************
 epoch: 0, train_loss: 1.2074, test_loss: 1.0087, test_f1: 0.5300
 epoch: 1, train_loss: 0.9781, test_loss: 0.9299, test_f1: 0.5656
 epoch: 2, train_loss: 0.9322, test_loss: 0.9043, test_f1: 0.5402
 epoch: 3, train_loss: 0.9027, test_loss: 0.8744, test_f1: 0.6034
 epoch: 4, train_loss: 0.8824, test_loss: 0.8576, test_f1: 0.5775
 epoch: 5, train_loss: 0.8442, test_loss: 0.8480, test_f1: 0.5784
 epoch: 6, train_loss: 0.8259, test_loss: 0.9382, test_f1: 0.5829
 epoch: 7, train_loss: 0.8003, test_loss: 0.7871, test_f1: 0.5761
 epoch: 8, train_loss: 0.7882, test_loss: 0.8270, test_f1: 0.6238
 epoch: 9, train_loss: 0.7758, test_loss: 0.7812, test_f1: 0.5939
 epoch: 10, train_loss: 0.7554, test_loss: 0.7620, test_f1: 0.6410
 epoch: 11, train_loss: 0.7252, test_loss: 0.7493, test_f1: 0.6124
 epoch: 12, train_loss: 0.7190, test_loss: 0.7233, test_f1: 0.6305
 epoch: 13, train_loss: 0.6986, test_loss: 0.7556, test_f1: 0.6657
 epoch: 14, train_loss: 0.7037, test_loss: 0.7420, test_f1: 0.6594
 epoch: 15, train_loss: 0.6691, test_loss: 0.7416, test_f1: 0.6717
 epoch: 16, train_loss: 0.6830, test_loss: 0.7569, test_f1: 0.6263
 epoch: 17, train_loss: 0.6634, test_loss: 0.7590, test_f1: 0.6537
 epoch: 18, train_loss: 0.6670, test_loss: 0.7311, test_f1: 0.6651
 epoch: 19, train_loss: 0.6428, test_loss: 0.7162, test_f1: 0.6541
 epoch: 20, train_loss: 0.6309, test_loss: 0.7596, test_f1: 0.6730
 epoch: 21, train_loss: 0.6185, test_loss: 0.8707, test_f1: 0.6551
 epoch: 22, train_loss: 0.6082, test_loss: 0.7718, test_f1: 0.6682
 epoch: 23, train_loss: 0.5983, test_loss: 0.7264, test_f1: 0.6606
 epoch: 24, train_loss: 0.5937, test_loss: 0.7093, test_f1: 0.6794
 epoch: 25, train_loss: 0.5813, test_loss: 0.7461, test_f1: 0.6731
 epoch: 26, train_loss: 0.5852, test_loss: 0.6854, test_f1: 0.6847
 epoch: 27, train_loss: 0.5424, test_loss: 0.8134, test_f1: 0.6926
 epoch: 28, train_loss: 0.5635, test_loss: 0.7557, test_f1: 0.6818
 epoch: 29, train_loss: 0.5681, test_loss: 0.7854, test_f1: 0.6774
 epoch: 30, train_loss: 0.5621, test_loss: 0.7902, test_f1: 0.6744
 epoch: 31, train_loss: 0.5264, test_loss: 0.7549, test_f1: 0.6585
 epoch: 32, train_loss: 0.5161, test_loss: 0.7845, test_f1: 0.6472
 epoch: 33, train_loss: 0.5242, test_loss: 0.7470, test_f1: 0.6667
 epoch: 34, train_loss: 0.5154, test_loss: 0.8665, test_f1: 0.6327
 epoch: 35, train_loss: 0.5205, test_loss: 0.7678, test_f1: 0.6754
 epoch: 36, train_loss: 0.4983, test_loss: 0.7607, test_f1: 0.6988
 epoch: 37, train_loss: 0.5071, test_loss: 0.7592, test_f1: 0.6842
 epoch: 38, train_loss: 0.4826, test_loss: 0.7739, test_f1: 0.6819
 epoch: 39, train_loss: 0.4805, test_loss: 0.8760, test_f1: 0.6755
 epoch: 40, train_loss: 0.4730, test_loss: 0.7223, test_f1: 0.6962
 epoch: 41, train_loss: 0.4371, test_loss: 0.8699, test_f1: 0.6674
 epoch: 42, train_loss: 0.4822, test_loss: 0.8337, test_f1: 0.6763
 epoch: 43, train_loss: 0.4383, test_loss: 0.8184, test_f1: 0.6564
 epoch: 44, train_loss: 0.4204, test_loss: 0.8567, test_f1: 0.6767
 epoch: 45, train_loss: 0.4305, test_loss: 0.9865, test_f1: 0.6360
 epoch: 46, train_loss: 0.4242, test_loss: 0.8823, test_f1: 0.6827
 epoch: 47, train_loss: 0.4199, test_loss: 0.9477, test_f1: 0.6393
 epoch: 48, train_loss: 0.4078, test_loss: 0.8543, test_f1: 0.6920
 epoch: 49, train_loss: 0.4180, test_loss: 0.8869, test_f1: 0.6741
 epoch: 50, train_loss: 0.3966, test_loss: 0.9013, test_f1: 0.6435
 epoch: 51, train_loss: 0.3591, test_loss: 0.8762, test_f1: 0.6775
 epoch: 52, train_loss: 0.3244, test_loss: 0.9465, test_f1: 0.6875
 epoch: 53, train_loss: 0.3171, test_loss: 1.0114, test_f1: 0.6696
 epoch: 54, train_loss: 0.3310, test_loss: 0.9291, test_f1: 0.6906
 epoch: 55, train_loss: 0.3136, test_loss: 0.9240, test_f1: 0.6990
 epoch: 56, train_loss: 0.3178, test_loss: 1.0615, test_f1: 0.6597
 epoch: 57, train_loss: 0.2964, test_loss: 0.9385, test_f1: 0.6949
 epoch: 58, train_loss: 0.3106, test_loss: 1.0355, test_f1: 0.6752
 epoch: 59, train_loss: 0.2999, test_loss: 0.9898, test_f1: 0.6800
 epoch: 60, train_loss: 0.2899, test_loss: 0.9564, test_f1: 0.6815
 epoch: 61, train_loss: 0.2873, test_loss: 0.9252, test_f1: 0.6840
 epoch: 62, train_loss: 0.2830, test_loss: 1.0280, test_f1: 0.7003
 epoch: 63, train_loss: 0.2580, test_loss: 1.0900, test_f1: 0.6727
 epoch: 64, train_loss: 0.2713, test_loss: 1.0580, test_f1: 0.6838
 epoch: 65, train_loss: 0.2779, test_loss: 1.1104, test_f1: 0.6831
 epoch: 66, train_loss: 0.2517, test_loss: 1.0789, test_f1: 0.6882
 epoch: 67, train_loss: 0.2512, test_loss: 1.1115, test_f1: 0.6851
 epoch: 68, train_loss: 0.2623, test_loss: 1.1246, test_f1: 0.6662
 epoch: 69, train_loss: 0.2410, test_loss: 1.2061, test_f1: 0.6840
 epoch: 70, train_loss: 0.2749, test_loss: 1.1480, test_f1: 0.6652
 epoch: 71, train_loss: 0.2458, test_loss: 1.2538, test_f1: 0.6835
 epoch: 72, train_loss: 0.2330, test_loss: 1.2819, test_f1: 0.6650
 epoch: 73, train_loss: 0.2388, test_loss: 1.2255, test_f1: 0.6705
 epoch: 74, train_loss: 0.2380, test_loss: 1.2429, test_f1: 0.6804
 epoch: 75, train_loss: 0.2348, test_loss: 1.2593, test_f1: 0.6637
 epoch: 76, train_loss: 0.2598, test_loss: 1.1240, test_f1: 0.6902
 epoch: 77, train_loss: 0.2243, test_loss: 1.2273, test_f1: 0.6565
 epoch: 78, train_loss: 0.2134, test_loss: 1.2909, test_f1: 0.6848
 epoch: 79, train_loss: 0.2246, test_loss: 1.1272, test_f1: 0.6867
 epoch: 80, train_loss: 0.2335, test_loss: 1.1408, test_f1: 0.6885
 epoch: 81, train_loss: 0.2176, test_loss: 1.2896, test_f1: 0.6748
 epoch: 82, train_loss: 0.2202, test_loss: 1.2957, test_f1: 0.6914
 epoch: 83, train_loss: 0.2235, test_loss: 1.2311, test_f1: 0.7018
 epoch: 84, train_loss: 0.2150, test_loss: 1.2469, test_f1: 0.6882
 epoch: 85, train_loss: 0.2113, test_loss: 1.3072, test_f1: 0.6870
 epoch: 86, train_loss: 0.2059, test_loss: 1.2007, test_f1: 0.6822
 epoch: 87, train_loss: 0.1839, test_loss: 1.2329, test_f1: 0.6797
 epoch: 88, train_loss: 0.2234, test_loss: 1.3225, test_f1: 0.6878
 epoch: 89, train_loss: 0.1895, test_loss: 1.4328, test_f1: 0.6659
 epoch: 90, train_loss: 0.2042, test_loss: 1.3564, test_f1: 0.6851
 epoch: 91, train_loss: 0.2193, test_loss: 1.1276, test_f1: 0.6903
 epoch: 92, train_loss: 0.2082, test_loss: 1.2358, test_f1: 0.6778
 epoch: 93, train_loss: 0.1908, test_loss: 1.4167, test_f1: 0.6845
 epoch: 94, train_loss: 0.1946, test_loss: 1.4134, test_f1: 0.6741
 epoch: 95, train_loss: 0.2030, test_loss: 1.2893, test_f1: 0.6668
 epoch: 96, train_loss: 0.1883, test_loss: 1.2848, test_f1: 0.6845
 epoch: 97, train_loss: 0.2239, test_loss: 1.1307, test_f1: 0.7070
 epoch: 98, train_loss: 0.1745, test_loss: 1.1351, test_f1: 0.7090
 epoch: 99, train_loss: 0.1951, test_loss: 1.2496, test_f1: 0.6727
##################ITERATION #8 ****************************************
 epoch: 0, train_loss: 1.1825, test_loss: 1.0122, test_f1: 0.4669
 epoch: 1, train_loss: 0.9710, test_loss: 0.9183, test_f1: 0.5581
 epoch: 2, train_loss: 0.9566, test_loss: 0.9115, test_f1: 0.5498
 epoch: 3, train_loss: 0.9125, test_loss: 0.8780, test_f1: 0.5454
 epoch: 4, train_loss: 0.8859, test_loss: 0.8934, test_f1: 0.5288
 epoch: 5, train_loss: 0.8592, test_loss: 0.8264, test_f1: 0.6388
 epoch: 6, train_loss: 0.8270, test_loss: 0.8225, test_f1: 0.5865
 epoch: 7, train_loss: 0.8033, test_loss: 0.7882, test_f1: 0.5891
 epoch: 8, train_loss: 0.7870, test_loss: 0.7584, test_f1: 0.6257
 epoch: 9, train_loss: 0.7626, test_loss: 0.7825, test_f1: 0.6030
 epoch: 10, train_loss: 0.7631, test_loss: 0.8087, test_f1: 0.6057
 epoch: 11, train_loss: 0.7539, test_loss: 0.7556, test_f1: 0.5985
 epoch: 12, train_loss: 0.7220, test_loss: 0.7524, test_f1: 0.6622
 epoch: 13, train_loss: 0.7126, test_loss: 0.7470, test_f1: 0.6357
 epoch: 14, train_loss: 0.6746, test_loss: 0.6948, test_f1: 0.6467
 epoch: 15, train_loss: 0.6659, test_loss: 0.7238, test_f1: 0.6392
 epoch: 16, train_loss: 0.6586, test_loss: 0.6951, test_f1: 0.6684
 epoch: 17, train_loss: 0.6415, test_loss: 0.6885, test_f1: 0.6676
 epoch: 18, train_loss: 0.6339, test_loss: 0.7336, test_f1: 0.6486
 epoch: 19, train_loss: 0.6209, test_loss: 0.7365, test_f1: 0.6597
 epoch: 20, train_loss: 0.6070, test_loss: 0.7721, test_f1: 0.6516
 epoch: 21, train_loss: 0.6052, test_loss: 0.6461, test_f1: 0.6998
 epoch: 22, train_loss: 0.5902, test_loss: 0.7725, test_f1: 0.6760
 epoch: 23, train_loss: 0.6057, test_loss: 0.6757, test_f1: 0.6828
 epoch: 24, train_loss: 0.6241, test_loss: 0.6525, test_f1: 0.7024
 epoch: 25, train_loss: 0.6350, test_loss: 0.7875, test_f1: 0.6687
 epoch: 26, train_loss: 0.5586, test_loss: 0.7388, test_f1: 0.6913
 epoch: 27, train_loss: 0.5563, test_loss: 0.7089, test_f1: 0.6771
 epoch: 28, train_loss: 0.5486, test_loss: 0.7897, test_f1: 0.6541
 epoch: 29, train_loss: 0.5378, test_loss: 0.7964, test_f1: 0.6761
 epoch: 30, train_loss: 0.5268, test_loss: 0.8727, test_f1: 0.6590
 epoch: 31, train_loss: 0.5217, test_loss: 0.6972, test_f1: 0.6749
 epoch: 32, train_loss: 0.5102, test_loss: 0.7627, test_f1: 0.6933
 epoch: 33, train_loss: 0.5103, test_loss: 0.7884, test_f1: 0.6720
 epoch: 34, train_loss: 0.4740, test_loss: 0.8272, test_f1: 0.6660
 epoch: 35, train_loss: 0.4885, test_loss: 0.8682, test_f1: 0.6825
 epoch: 36, train_loss: 0.5036, test_loss: 0.7227, test_f1: 0.6811
 epoch: 37, train_loss: 0.4942, test_loss: 0.7542, test_f1: 0.6660
 epoch: 38, train_loss: 0.4547, test_loss: 0.7695, test_f1: 0.6637
 epoch: 39, train_loss: 0.4683, test_loss: 0.8205, test_f1: 0.6508
 epoch: 40, train_loss: 0.4410, test_loss: 0.8078, test_f1: 0.6698
 epoch: 41, train_loss: 0.4326, test_loss: 0.9092, test_f1: 0.6444
 epoch: 42, train_loss: 0.4415, test_loss: 1.0452, test_f1: 0.6594
 epoch: 43, train_loss: 0.4606, test_loss: 0.8696, test_f1: 0.6962
 epoch: 44, train_loss: 0.4499, test_loss: 0.9658, test_f1: 0.6820
 epoch: 45, train_loss: 0.4496, test_loss: 0.9062, test_f1: 0.6569
 epoch: 46, train_loss: 0.4350, test_loss: 0.8298, test_f1: 0.6646
 epoch: 47, train_loss: 0.4188, test_loss: 0.8631, test_f1: 0.6850
 epoch: 48, train_loss: 0.4004, test_loss: 0.9726, test_f1: 0.6619
 epoch: 49, train_loss: 0.3993, test_loss: 0.9719, test_f1: 0.6661
 epoch: 50, train_loss: 0.4010, test_loss: 0.9597, test_f1: 0.6550
 epoch: 51, train_loss: 0.3574, test_loss: 1.0073, test_f1: 0.6707
 epoch: 52, train_loss: 0.3412, test_loss: 0.9588, test_f1: 0.6708
 epoch: 53, train_loss: 0.3343, test_loss: 1.0537, test_f1: 0.6893
 epoch: 54, train_loss: 0.3074, test_loss: 1.0236, test_f1: 0.6845
 epoch: 55, train_loss: 0.3269, test_loss: 1.0943, test_f1: 0.6694
 epoch: 56, train_loss: 0.3221, test_loss: 1.0658, test_f1: 0.6738
 epoch: 57, train_loss: 0.3061, test_loss: 1.0566, test_f1: 0.6749
 epoch: 58, train_loss: 0.3163, test_loss: 1.0658, test_f1: 0.6692
 epoch: 59, train_loss: 0.3052, test_loss: 1.0344, test_f1: 0.6739
 epoch: 60, train_loss: 0.2796, test_loss: 1.1208, test_f1: 0.6688
 epoch: 61, train_loss: 0.3133, test_loss: 1.1380, test_f1: 0.6764
 epoch: 62, train_loss: 0.2825, test_loss: 1.0689, test_f1: 0.6773
 epoch: 63, train_loss: 0.2826, test_loss: 1.1812, test_f1: 0.6741
 epoch: 64, train_loss: 0.2855, test_loss: 1.1505, test_f1: 0.6773
 epoch: 65, train_loss: 0.3016, test_loss: 1.1162, test_f1: 0.6762
 epoch: 66, train_loss: 0.2991, test_loss: 1.0992, test_f1: 0.6824
 epoch: 67, train_loss: 0.2779, test_loss: 1.2373, test_f1: 0.6733
 epoch: 68, train_loss: 0.2737, test_loss: 1.2505, test_f1: 0.6819
 epoch: 69, train_loss: 0.2569, test_loss: 1.2114, test_f1: 0.6903
 epoch: 70, train_loss: 0.2663, test_loss: 1.2835, test_f1: 0.6841
 epoch: 71, train_loss: 0.2669, test_loss: 1.2748, test_f1: 0.6675
 epoch: 72, train_loss: 0.2765, test_loss: 1.2388, test_f1: 0.6811
 epoch: 73, train_loss: 0.2580, test_loss: 1.3111, test_f1: 0.6702
 epoch: 74, train_loss: 0.2445, test_loss: 1.2746, test_f1: 0.6631
 epoch: 75, train_loss: 0.2582, test_loss: 1.2632, test_f1: 0.6866
 epoch: 76, train_loss: 0.2404, test_loss: 1.4033, test_f1: 0.6690
 epoch: 77, train_loss: 0.2572, test_loss: 1.2687, test_f1: 0.6750
 epoch: 78, train_loss: 0.2433, test_loss: 1.4308, test_f1: 0.6791
 epoch: 79, train_loss: 0.2498, test_loss: 1.4936, test_f1: 0.6833
 epoch: 80, train_loss: 0.2354, test_loss: 1.3540, test_f1: 0.6641
 epoch: 81, train_loss: 0.2187, test_loss: 1.3833, test_f1: 0.6963
 epoch: 82, train_loss: 0.2299, test_loss: 1.3686, test_f1: 0.6620
 epoch: 83, train_loss: 0.2326, test_loss: 1.4196, test_f1: 0.6616
 epoch: 84, train_loss: 0.2298, test_loss: 1.4497, test_f1: 0.6594
 epoch: 85, train_loss: 0.2563, test_loss: 1.3082, test_f1: 0.6764
 epoch: 86, train_loss: 0.2190, test_loss: 1.2946, test_f1: 0.6934
 epoch: 87, train_loss: 0.2276, test_loss: 1.4286, test_f1: 0.6847
 epoch: 88, train_loss: 0.2276, test_loss: 1.4336, test_f1: 0.6693
 epoch: 89, train_loss: 0.2165, test_loss: 1.4559, test_f1: 0.6776
 epoch: 90, train_loss: 0.2040, test_loss: 1.4615, test_f1: 0.6773
 epoch: 91, train_loss: 0.2133, test_loss: 1.4417, test_f1: 0.6763
 epoch: 92, train_loss: 0.2007, test_loss: 1.4826, test_f1: 0.6834
 epoch: 93, train_loss: 0.2124, test_loss: 1.5178, test_f1: 0.6823
 epoch: 94, train_loss: 0.1987, test_loss: 1.4869, test_f1: 0.6810
 epoch: 95, train_loss: 0.2063, test_loss: 1.5609, test_f1: 0.6912
 epoch: 96, train_loss: 0.1960, test_loss: 1.5523, test_f1: 0.6604
 epoch: 97, train_loss: 0.2149, test_loss: 1.5502, test_f1: 0.6746
 epoch: 98, train_loss: 0.2136, test_loss: 1.5809, test_f1: 0.6666
 epoch: 99, train_loss: 0.2057, test_loss: 1.5332, test_f1: 0.6673
##################ITERATION #9 ****************************************
 epoch: 0, train_loss: 1.2489, test_loss: 1.0844, test_f1: 0.4856
 epoch: 1, train_loss: 0.9938, test_loss: 1.0045, test_f1: 0.4749
 epoch: 2, train_loss: 0.9447, test_loss: 0.9520, test_f1: 0.5393
 epoch: 3, train_loss: 0.9193, test_loss: 0.9822, test_f1: 0.5309
 epoch: 4, train_loss: 0.8908, test_loss: 0.8848, test_f1: 0.5261
 epoch: 5, train_loss: 0.8862, test_loss: 0.9137, test_f1: 0.5244
 epoch: 6, train_loss: 0.8539, test_loss: 0.8589, test_f1: 0.6231
 epoch: 7, train_loss: 0.8106, test_loss: 0.8041, test_f1: 0.6424
 epoch: 8, train_loss: 0.7986, test_loss: 0.8338, test_f1: 0.5822
 epoch: 9, train_loss: 0.7637, test_loss: 0.8260, test_f1: 0.5967
 epoch: 10, train_loss: 0.7614, test_loss: 0.8422, test_f1: 0.5821
 epoch: 11, train_loss: 0.7480, test_loss: 0.7720, test_f1: 0.6710
 epoch: 12, train_loss: 0.7460, test_loss: 0.7767, test_f1: 0.6279
 epoch: 13, train_loss: 0.7248, test_loss: 0.8054, test_f1: 0.6175
 epoch: 14, train_loss: 0.7046, test_loss: 0.7685, test_f1: 0.6531
 epoch: 15, train_loss: 0.6862, test_loss: 0.7439, test_f1: 0.6441
 epoch: 16, train_loss: 0.6984, test_loss: 0.7912, test_f1: 0.6149
 epoch: 17, train_loss: 0.6773, test_loss: 0.7808, test_f1: 0.6313
 epoch: 18, train_loss: 0.6561, test_loss: 0.8325, test_f1: 0.6325
 epoch: 19, train_loss: 0.6684, test_loss: 0.7476, test_f1: 0.6541
 epoch: 20, train_loss: 0.6385, test_loss: 0.7182, test_f1: 0.6519
 epoch: 21, train_loss: 0.6514, test_loss: 0.7941, test_f1: 0.6360
 epoch: 22, train_loss: 0.6381, test_loss: 0.8427, test_f1: 0.6411
 epoch: 23, train_loss: 0.6197, test_loss: 0.8039, test_f1: 0.6529
 epoch: 24, train_loss: 0.6073, test_loss: 0.8731, test_f1: 0.6227
 epoch: 25, train_loss: 0.5914, test_loss: 0.7295, test_f1: 0.6729
 epoch: 26, train_loss: 0.5887, test_loss: 0.8107, test_f1: 0.6356
 epoch: 27, train_loss: 0.5687, test_loss: 0.7206, test_f1: 0.6707
 epoch: 28, train_loss: 0.5756, test_loss: 0.8350, test_f1: 0.6481
 epoch: 29, train_loss: 0.5562, test_loss: 0.9540, test_f1: 0.6235
 epoch: 30, train_loss: 0.5366, test_loss: 0.9176, test_f1: 0.6467
 epoch: 31, train_loss: 0.5537, test_loss: 0.9133, test_f1: 0.6019
 epoch: 32, train_loss: 0.5845, test_loss: 0.7539, test_f1: 0.6529
 epoch: 33, train_loss: 0.5347, test_loss: 0.8220, test_f1: 0.6500
 epoch: 34, train_loss: 0.5123, test_loss: 0.7894, test_f1: 0.6344
 epoch: 35, train_loss: 0.5471, test_loss: 0.8247, test_f1: 0.6718
 epoch: 36, train_loss: 0.4975, test_loss: 0.8776, test_f1: 0.6411
 epoch: 37, train_loss: 0.5174, test_loss: 0.9268, test_f1: 0.6240
 epoch: 38, train_loss: 0.4781, test_loss: 0.9678, test_f1: 0.6534
 epoch: 39, train_loss: 0.4992, test_loss: 0.9082, test_f1: 0.6537
 epoch: 40, train_loss: 0.4686, test_loss: 0.9252, test_f1: 0.6542
 epoch: 41, train_loss: 0.4833, test_loss: 0.8752, test_f1: 0.6373
 epoch: 42, train_loss: 0.4809, test_loss: 1.0099, test_f1: 0.6065
 epoch: 43, train_loss: 0.4576, test_loss: 0.9212, test_f1: 0.6471
 epoch: 44, train_loss: 0.4497, test_loss: 0.9300, test_f1: 0.6944
 epoch: 45, train_loss: 0.4606, test_loss: 1.0014, test_f1: 0.6187
 epoch: 46, train_loss: 0.4364, test_loss: 1.0643, test_f1: 0.6328
 epoch: 47, train_loss: 0.4486, test_loss: 1.0589, test_f1: 0.6468
 epoch: 48, train_loss: 0.4343, test_loss: 1.0920, test_f1: 0.6529
 epoch: 49, train_loss: 0.4526, test_loss: 1.0335, test_f1: 0.6557
 epoch: 50, train_loss: 0.4388, test_loss: 1.0340, test_f1: 0.6626
 epoch: 51, train_loss: 0.3779, test_loss: 1.0707, test_f1: 0.6640
 epoch: 52, train_loss: 0.3578, test_loss: 1.1621, test_f1: 0.6678
 epoch: 53, train_loss: 0.3292, test_loss: 1.0481, test_f1: 0.6805
 epoch: 54, train_loss: 0.3316, test_loss: 1.1244, test_f1: 0.6492
 epoch: 55, train_loss: 0.3440, test_loss: 1.1060, test_f1: 0.6622
 epoch: 56, train_loss: 0.3129, test_loss: 1.1465, test_f1: 0.6570
 epoch: 57, train_loss: 0.3039, test_loss: 1.1937, test_f1: 0.6614
 epoch: 58, train_loss: 0.3090, test_loss: 1.2177, test_f1: 0.6672
 epoch: 59, train_loss: 0.3336, test_loss: 1.1502, test_f1: 0.6593
 epoch: 60, train_loss: 0.3103, test_loss: 1.1899, test_f1: 0.6648
 epoch: 61, train_loss: 0.3046, test_loss: 1.1841, test_f1: 0.6683
 epoch: 62, train_loss: 0.2945, test_loss: 1.1483, test_f1: 0.6508
 epoch: 63, train_loss: 0.2997, test_loss: 1.2632, test_f1: 0.6475
 epoch: 64, train_loss: 0.2762, test_loss: 1.2961, test_f1: 0.6544
 epoch: 65, train_loss: 0.2761, test_loss: 1.3408, test_f1: 0.6474
 epoch: 66, train_loss: 0.2810, test_loss: 1.3569, test_f1: 0.6459
 epoch: 67, train_loss: 0.2807, test_loss: 1.2529, test_f1: 0.6530
 epoch: 68, train_loss: 0.2712, test_loss: 1.2041, test_f1: 0.6693
 epoch: 69, train_loss: 0.2744, test_loss: 1.3013, test_f1: 0.6627
 epoch: 70, train_loss: 0.2825, test_loss: 1.3406, test_f1: 0.6589
 epoch: 71, train_loss: 0.2670, test_loss: 1.4534, test_f1: 0.6570
 epoch: 72, train_loss: 0.2748, test_loss: 1.3321, test_f1: 0.6502
 epoch: 73, train_loss: 0.2586, test_loss: 1.4342, test_f1: 0.6550
 epoch: 74, train_loss: 0.2452, test_loss: 1.2814, test_f1: 0.6533
 epoch: 75, train_loss: 0.2412, test_loss: 1.5359, test_f1: 0.6578
 epoch: 76, train_loss: 0.2551, test_loss: 1.4397, test_f1: 0.6544
 epoch: 77, train_loss: 0.2505, test_loss: 1.4375, test_f1: 0.6436
 epoch: 78, train_loss: 0.2464, test_loss: 1.5003, test_f1: 0.6574
 epoch: 79, train_loss: 0.2627, test_loss: 1.5203, test_f1: 0.6580
 epoch: 80, train_loss: 0.2354, test_loss: 1.4034, test_f1: 0.6571
 epoch: 81, train_loss: 0.2140, test_loss: 1.6220, test_f1: 0.6461
 epoch: 82, train_loss: 0.2344, test_loss: 1.4489, test_f1: 0.6528
 epoch: 83, train_loss: 0.2329, test_loss: 1.6480, test_f1: 0.6423
 epoch: 84, train_loss: 0.2301, test_loss: 1.5264, test_f1: 0.6523
 epoch: 85, train_loss: 0.2344, test_loss: 1.5332, test_f1: 0.6488
 epoch: 86, train_loss: 0.2320, test_loss: 1.5512, test_f1: 0.6429
 epoch: 87, train_loss: 0.2321, test_loss: 1.7176, test_f1: 0.6369
 epoch: 88, train_loss: 0.2754, test_loss: 1.4674, test_f1: 0.6522
 epoch: 89, train_loss: 0.2288, test_loss: 1.5162, test_f1: 0.6397
 epoch: 90, train_loss: 0.2330, test_loss: 1.5498, test_f1: 0.6609
 epoch: 91, train_loss: 0.2252, test_loss: 1.5274, test_f1: 0.6372
 epoch: 92, train_loss: 0.2201, test_loss: 1.4617, test_f1: 0.6636
 epoch: 93, train_loss: 0.1975, test_loss: 1.4585, test_f1: 0.6588
 epoch: 94, train_loss: 0.2246, test_loss: 1.4594, test_f1: 0.6610
 epoch: 95, train_loss: 0.2034, test_loss: 1.6617, test_f1: 0.6483
 epoch: 96, train_loss: 0.1930, test_loss: 1.6886, test_f1: 0.6564
 epoch: 97, train_loss: 0.1994, test_loss: 1.6074, test_f1: 0.6590
 epoch: 98, train_loss: 0.2401, test_loss: 1.5613, test_f1: 0.6605
 epoch: 99, train_loss: 0.2356, test_loss: 1.6202, test_f1: 0.6511

Training completed in 1441.61 seconds
Best F1: 0.7196 at epoch 35
Mean F1 across iterations: 0.7057  0.0070
========================FINAL RESULTS================================
FEGIN weighted F1: 0.7196  0.0070
python main.py --data ltspice_examples --representation component_pin_net --model FEGIN --layers 6 --hiddens 128 --batch_size 32 --lr 0.001 --emb_size 128 --epochs 100 --save_appendix component_pin_net_L6_H128_BS32_LR0.001_E128 --no_val
-----



STDERR:
  File "main.py", line 370, in <module>
    main()
  File "main.py", line 254, in main
    dataset = dataset_class(
  File "/home/philip/projects/ltspice_examples_code_repo/Circuit-Completion-Using-GNNs/component_classification_with_link_prediction_head/evaluation/FEGIN/kernel/circuit_datasets.py", line 15, in __init__
    self.data, self.slices = torch.load(self.processed_paths[0])
  File "/home/philip/.local/lib/python3.8/site-packages/torch/serialization.py", line 1040, in load
    warnings.warn(
  File "/usr/lib/python3.8/warnings.py", line 109, in _showwarnmsg
    sw(msg.message, msg.category, msg.filename, msg.lineno,
  File "main.py", line 47, in warn_with_traceback
    traceback.print_stack(file=log)
/home/philip/projects/ltspice_examples_code_repo/Circuit-Completion-Using-GNNs/component_classification_with_link_prediction_head/evaluation/FEGIN/kernel/circuit_datasets.py:15: FutureWarning: You are using `torch.load` with `weights_only=False` (the current default value), which uses the default pickle module implicitly. It is possible to construct malicious pickle data which will execute arbitrary code during unpickling (See https://github.com/pytorch/pytorch/blob/main/SECURITY.md#untrusted-models for more details). In a future release, the default value for `weights_only` will be flipped to `True`. This limits the functions that could be executed during unpickling. Arbitrary objects will no longer be allowed to be loaded via this mode unless they are explicitly allowlisted by the user via `torch.serialization.add_safe_globals`. We recommend you start setting `weights_only=True` for any use case where you don't have full control of the loaded file. Please open an issue on GitHub for any issues related to this experimental feature.
  self.data, self.slices = torch.load(self.processed_paths[0])
