STDOUT:
Results will be saved in /home/philip/projects/ltspice_examples_code_repo/Circuit-Completion-Using-GNNs/component_classification_with_link_prediction_head/evaluation/FEGIN/results/model_FEGIN_dataset_ltspice_demos
Command line input: python main.py --data ltspice_demos --representation component_pin --model FEGIN --layers 6 --hiddens 64 --batch_size 256 --lr 0.001 --emb_size 128 --epochs 100 --save_appendix component_pin_L6_H64_BS256_LR0.001_E128 --no_val
 is saved.
-----
ltspice_demos - FEGIN
Using 6 layers, 64 hidden units, h = 2
Loading component_pin representation dataset
ENTERED
Training FEGIN on component_pin representation
Train: 1565, Test: 383
##################ITERATION #0 ****************************************
 epoch: 0, train_loss: 1.3756, test_loss: 1.3743, test_f1: 0.1365
 epoch: 1, train_loss: 1.3188, test_loss: 1.3503, test_f1: 0.3036
 epoch: 2, train_loss: 1.2639, test_loss: 1.3219, test_f1: 0.2849
 epoch: 3, train_loss: 1.2135, test_loss: 1.3027, test_f1: 0.3017
 epoch: 4, train_loss: 1.1812, test_loss: 1.2936, test_f1: 0.3407
 epoch: 5, train_loss: 1.1652, test_loss: 1.2854, test_f1: 0.2642
 epoch: 6, train_loss: 1.1528, test_loss: 1.2709, test_f1: 0.3108
 epoch: 7, train_loss: 1.1313, test_loss: 1.2609, test_f1: 0.3451
 epoch: 8, train_loss: 1.1167, test_loss: 1.2747, test_f1: 0.3808
 epoch: 9, train_loss: 1.0957, test_loss: 1.2395, test_f1: 0.3909
 epoch: 10, train_loss: 1.0790, test_loss: 1.2040, test_f1: 0.4170
 epoch: 11, train_loss: 1.0364, test_loss: 1.1474, test_f1: 0.4487
 epoch: 12, train_loss: 1.0181, test_loss: 1.0950, test_f1: 0.5199
 epoch: 13, train_loss: 0.9781, test_loss: 1.0660, test_f1: 0.4978
 epoch: 14, train_loss: 0.9351, test_loss: 1.0964, test_f1: 0.5276
 epoch: 15, train_loss: 0.9116, test_loss: 1.0549, test_f1: 0.5571
 epoch: 16, train_loss: 0.8799, test_loss: 1.1422, test_f1: 0.4907
 epoch: 17, train_loss: 0.8595, test_loss: 1.0874, test_f1: 0.5463
 epoch: 18, train_loss: 0.8426, test_loss: 1.1992, test_f1: 0.5235
 epoch: 19, train_loss: 0.8253, test_loss: 1.0435, test_f1: 0.5536
 epoch: 20, train_loss: 0.8028, test_loss: 1.0588, test_f1: 0.5618
 epoch: 21, train_loss: 0.7887, test_loss: 1.1492, test_f1: 0.5512
 epoch: 22, train_loss: 0.7814, test_loss: 1.0617, test_f1: 0.5448
 epoch: 23, train_loss: 0.7877, test_loss: 1.0989, test_f1: 0.5646
 epoch: 24, train_loss: 0.7680, test_loss: 1.0486, test_f1: 0.5488
 epoch: 25, train_loss: 0.7491, test_loss: 1.0427, test_f1: 0.5857
 epoch: 26, train_loss: 0.7234, test_loss: 1.0640, test_f1: 0.5569
 epoch: 27, train_loss: 0.7321, test_loss: 1.1261, test_f1: 0.5568
 epoch: 28, train_loss: 0.7207, test_loss: 1.0665, test_f1: 0.5899
 epoch: 29, train_loss: 0.7432, test_loss: 1.1698, test_f1: 0.5129
 epoch: 30, train_loss: 0.7644, test_loss: 2.9255, test_f1: 0.2952
 epoch: 31, train_loss: 0.7399, test_loss: 1.1651, test_f1: 0.4914
 epoch: 32, train_loss: 0.7018, test_loss: 1.0557, test_f1: 0.5775
 epoch: 33, train_loss: 0.6847, test_loss: 1.0770, test_f1: 0.5685
 epoch: 34, train_loss: 0.7014, test_loss: 1.0498, test_f1: 0.5766
 epoch: 35, train_loss: 0.6874, test_loss: 0.9906, test_f1: 0.6080
 epoch: 36, train_loss: 0.6616, test_loss: 1.0306, test_f1: 0.6238
 epoch: 37, train_loss: 0.6443, test_loss: 1.0573, test_f1: 0.5996
 epoch: 38, train_loss: 0.6283, test_loss: 1.1130, test_f1: 0.5634
 epoch: 39, train_loss: 0.6923, test_loss: 1.1962, test_f1: 0.5086
 epoch: 40, train_loss: 0.6535, test_loss: 1.1869, test_f1: 0.5310
 epoch: 41, train_loss: 0.6323, test_loss: 1.1191, test_f1: 0.5683
 epoch: 42, train_loss: 0.6120, test_loss: 1.0179, test_f1: 0.6431
 epoch: 43, train_loss: 0.6150, test_loss: 1.0496, test_f1: 0.5548
 epoch: 44, train_loss: 0.5943, test_loss: 1.1245, test_f1: 0.5737
 epoch: 45, train_loss: 0.6084, test_loss: 1.3314, test_f1: 0.4871
 epoch: 46, train_loss: 0.6062, test_loss: 1.1984, test_f1: 0.5566
 epoch: 47, train_loss: 0.6169, test_loss: 1.2285, test_f1: 0.5266
 epoch: 48, train_loss: 0.5953, test_loss: 1.2597, test_f1: 0.5330
 epoch: 49, train_loss: 0.5800, test_loss: 1.2170, test_f1: 0.5249
 epoch: 50, train_loss: 0.5664, test_loss: 1.2627, test_f1: 0.4870
 epoch: 51, train_loss: 0.5532, test_loss: 1.1951, test_f1: 0.5388
 epoch: 52, train_loss: 0.5310, test_loss: 1.2080, test_f1: 0.5479
 epoch: 53, train_loss: 0.5275, test_loss: 1.2679, test_f1: 0.5176
 epoch: 54, train_loss: 0.5570, test_loss: 1.3007, test_f1: 0.5088
 epoch: 55, train_loss: 0.5392, test_loss: 1.3511, test_f1: 0.5275
 epoch: 56, train_loss: 0.5296, test_loss: 1.3395, test_f1: 0.5402
 epoch: 57, train_loss: 0.5163, test_loss: 1.3012, test_f1: 0.5215
 epoch: 58, train_loss: 0.5228, test_loss: 1.3866, test_f1: 0.5331
 epoch: 59, train_loss: 0.5185, test_loss: 1.2821, test_f1: 0.5189
 epoch: 60, train_loss: 0.5033, test_loss: 1.2420, test_f1: 0.5461
 epoch: 61, train_loss: 0.4918, test_loss: 1.2320, test_f1: 0.5490
 epoch: 62, train_loss: 0.4823, test_loss: 1.1918, test_f1: 0.5848
 epoch: 63, train_loss: 0.4707, test_loss: 1.2700, test_f1: 0.5677
 epoch: 64, train_loss: 0.4662, test_loss: 1.3535, test_f1: 0.5181
 epoch: 65, train_loss: 0.4544, test_loss: 1.3758, test_f1: 0.5375
 epoch: 66, train_loss: 0.4611, test_loss: 1.4603, test_f1: 0.5179
 epoch: 67, train_loss: 0.4519, test_loss: 1.4212, test_f1: 0.5177
 epoch: 68, train_loss: 0.4516, test_loss: 1.4041, test_f1: 0.5495
 epoch: 69, train_loss: 0.4531, test_loss: 1.3521, test_f1: 0.5324
 epoch: 70, train_loss: 0.4437, test_loss: 1.4156, test_f1: 0.5505
 epoch: 71, train_loss: 0.4527, test_loss: 1.4349, test_f1: 0.5292
 epoch: 72, train_loss: 0.4435, test_loss: 1.4375, test_f1: 0.5390
 epoch: 73, train_loss: 0.4230, test_loss: 1.4795, test_f1: 0.5598
 epoch: 74, train_loss: 0.4490, test_loss: 1.4185, test_f1: 0.5670
 epoch: 75, train_loss: 0.4076, test_loss: 1.5224, test_f1: 0.5556
 epoch: 76, train_loss: 0.4155, test_loss: 1.5336, test_f1: 0.5481
 epoch: 77, train_loss: 0.4219, test_loss: 1.5685, test_f1: 0.5751
 epoch: 78, train_loss: 0.4123, test_loss: 1.5373, test_f1: 0.5772
 epoch: 79, train_loss: 0.4096, test_loss: 1.5638, test_f1: 0.5830
 epoch: 80, train_loss: 0.3844, test_loss: 1.5972, test_f1: 0.5789
 epoch: 81, train_loss: 0.3732, test_loss: 1.5114, test_f1: 0.6039
 epoch: 82, train_loss: 0.3750, test_loss: 1.5915, test_f1: 0.5615
 epoch: 83, train_loss: 0.3707, test_loss: 1.6693, test_f1: 0.5651
 epoch: 84, train_loss: 0.3935, test_loss: 1.8280, test_f1: 0.5785
 epoch: 85, train_loss: 0.4216, test_loss: 1.7533, test_f1: 0.5584
 epoch: 86, train_loss: 0.3995, test_loss: 1.6827, test_f1: 0.5645
 epoch: 87, train_loss: 0.3940, test_loss: 1.6790, test_f1: 0.5907
 epoch: 88, train_loss: 0.3873, test_loss: 1.8171, test_f1: 0.5466
 epoch: 89, train_loss: 0.4184, test_loss: 1.7997, test_f1: 0.5683
 epoch: 90, train_loss: 0.3700, test_loss: 1.6559, test_f1: 0.5670
 epoch: 91, train_loss: 0.3780, test_loss: 1.6692, test_f1: 0.5624
 epoch: 92, train_loss: 0.3728, test_loss: 1.8573, test_f1: 0.5165
 epoch: 93, train_loss: 0.3539, test_loss: 1.7925, test_f1: 0.5479
 epoch: 94, train_loss: 0.3525, test_loss: 1.8786, test_f1: 0.5382
 epoch: 95, train_loss: 0.3463, test_loss: 1.9044, test_f1: 0.5555
 epoch: 96, train_loss: 0.3593, test_loss: 1.8233, test_f1: 0.5715
 epoch: 97, train_loss: 0.3713, test_loss: 1.6934, test_f1: 0.5810
 epoch: 98, train_loss: 0.3826, test_loss: 1.6780, test_f1: 0.5425
 epoch: 99, train_loss: 0.3652, test_loss: 1.7395, test_f1: 0.5639
##################ITERATION #1 ****************************************
 epoch: 0, train_loss: 1.2986, test_loss: 1.3223, test_f1: 0.1365
 epoch: 1, train_loss: 1.1867, test_loss: 1.3078, test_f1: 0.3228
 epoch: 2, train_loss: 1.1353, test_loss: 1.3132, test_f1: 0.3066
 epoch: 3, train_loss: 1.0882, test_loss: 1.3197, test_f1: 0.3283
 epoch: 4, train_loss: 1.0389, test_loss: 1.3248, test_f1: 0.1645
 epoch: 5, train_loss: 0.9904, test_loss: 1.2586, test_f1: 0.4037
 epoch: 6, train_loss: 0.9395, test_loss: 1.1722, test_f1: 0.4929
 epoch: 7, train_loss: 0.8959, test_loss: 1.1299, test_f1: 0.5159
 epoch: 8, train_loss: 0.8764, test_loss: 1.1427, test_f1: 0.4579
 epoch: 9, train_loss: 0.8367, test_loss: 1.0499, test_f1: 0.5490
 epoch: 10, train_loss: 0.8110, test_loss: 1.1610, test_f1: 0.4549
 epoch: 11, train_loss: 0.7938, test_loss: 0.9849, test_f1: 0.5496
 epoch: 12, train_loss: 0.7671, test_loss: 0.9580, test_f1: 0.5831
 epoch: 13, train_loss: 0.7774, test_loss: 1.1880, test_f1: 0.5467
 epoch: 14, train_loss: 0.7737, test_loss: 1.0554, test_f1: 0.5983
 epoch: 15, train_loss: 0.7531, test_loss: 1.0891, test_f1: 0.5614
 epoch: 16, train_loss: 0.7388, test_loss: 1.0288, test_f1: 0.5665
 epoch: 17, train_loss: 0.7238, test_loss: 1.0262, test_f1: 0.5925
 epoch: 18, train_loss: 0.7345, test_loss: 1.0032, test_f1: 0.5760
 epoch: 19, train_loss: 0.7047, test_loss: 1.0324, test_f1: 0.5999
 epoch: 20, train_loss: 0.6929, test_loss: 1.0713, test_f1: 0.5382
 epoch: 21, train_loss: 0.7061, test_loss: 1.0764, test_f1: 0.5620
 epoch: 22, train_loss: 0.6759, test_loss: 1.0610, test_f1: 0.5799
 epoch: 23, train_loss: 0.6616, test_loss: 1.0434, test_f1: 0.5691
 epoch: 24, train_loss: 0.6584, test_loss: 1.0568, test_f1: 0.5856
 epoch: 25, train_loss: 0.6495, test_loss: 1.1212, test_f1: 0.6130
 epoch: 26, train_loss: 0.6571, test_loss: 1.1678, test_f1: 0.5437
 epoch: 27, train_loss: 0.6370, test_loss: 1.2891, test_f1: 0.5479
 epoch: 28, train_loss: 0.6274, test_loss: 1.1878, test_f1: 0.5907
 epoch: 29, train_loss: 0.6140, test_loss: 1.2845, test_f1: 0.5526
 epoch: 30, train_loss: 0.6519, test_loss: 1.2104, test_f1: 0.5684
 epoch: 31, train_loss: 0.6286, test_loss: 1.2400, test_f1: 0.5219
 epoch: 32, train_loss: 0.6367, test_loss: 1.3616, test_f1: 0.5027
 epoch: 33, train_loss: 0.6195, test_loss: 1.3012, test_f1: 0.5551
 epoch: 34, train_loss: 0.6128, test_loss: 1.1895, test_f1: 0.5701
 epoch: 35, train_loss: 0.6055, test_loss: 1.1896, test_f1: 0.5483
 epoch: 36, train_loss: 0.5668, test_loss: 1.1918, test_f1: 0.6047
 epoch: 37, train_loss: 0.5652, test_loss: 1.2357, test_f1: 0.6022
 epoch: 38, train_loss: 0.5681, test_loss: 1.2439, test_f1: 0.5872
 epoch: 39, train_loss: 0.5495, test_loss: 1.1822, test_f1: 0.5929
 epoch: 40, train_loss: 0.5683, test_loss: 1.1739, test_f1: 0.5831
 epoch: 41, train_loss: 0.5727, test_loss: 1.1749, test_f1: 0.5723
 epoch: 42, train_loss: 0.5566, test_loss: 1.1900, test_f1: 0.5949
 epoch: 43, train_loss: 0.5523, test_loss: 1.3923, test_f1: 0.5357
 epoch: 44, train_loss: 0.5670, test_loss: 1.4548, test_f1: 0.5089
 epoch: 45, train_loss: 0.5792, test_loss: 1.3865, test_f1: 0.5580
 epoch: 46, train_loss: 0.5452, test_loss: 1.3863, test_f1: 0.5957
 epoch: 47, train_loss: 0.5521, test_loss: 1.3670, test_f1: 0.6047
 epoch: 48, train_loss: 0.5151, test_loss: 1.4740, test_f1: 0.5855
 epoch: 49, train_loss: 0.5161, test_loss: 1.4213, test_f1: 0.5480
 epoch: 50, train_loss: 0.5567, test_loss: 1.4223, test_f1: 0.5386
 epoch: 51, train_loss: 0.5403, test_loss: 1.7045, test_f1: 0.4970
 epoch: 52, train_loss: 0.5099, test_loss: 1.4384, test_f1: 0.5744
 epoch: 53, train_loss: 0.5019, test_loss: 1.4572, test_f1: 0.5869
 epoch: 54, train_loss: 0.4739, test_loss: 1.5287, test_f1: 0.5540
 epoch: 55, train_loss: 0.4681, test_loss: 1.5766, test_f1: 0.5554
 epoch: 56, train_loss: 0.4518, test_loss: 1.6069, test_f1: 0.5685
 epoch: 57, train_loss: 0.4370, test_loss: 1.7012, test_f1: 0.5522
 epoch: 58, train_loss: 0.4312, test_loss: 1.7160, test_f1: 0.5742
 epoch: 59, train_loss: 0.4265, test_loss: 1.8129, test_f1: 0.5750
 epoch: 60, train_loss: 0.4253, test_loss: 1.7831, test_f1: 0.5939
 epoch: 61, train_loss: 0.4084, test_loss: 1.7475, test_f1: 0.5367
 epoch: 62, train_loss: 0.4074, test_loss: 1.6969, test_f1: 0.5440
 epoch: 63, train_loss: 0.4032, test_loss: 1.7218, test_f1: 0.5538
 epoch: 64, train_loss: 0.3993, test_loss: 1.7914, test_f1: 0.5412
 epoch: 65, train_loss: 0.3792, test_loss: 1.8586, test_f1: 0.5875
 epoch: 66, train_loss: 0.3921, test_loss: 1.9948, test_f1: 0.5632
 epoch: 67, train_loss: 0.4034, test_loss: 1.8795, test_f1: 0.5654
 epoch: 68, train_loss: 0.3882, test_loss: 1.8736, test_f1: 0.5472
 epoch: 69, train_loss: 0.3684, test_loss: 1.9020, test_f1: 0.5587
 epoch: 70, train_loss: 0.3556, test_loss: 1.8821, test_f1: 0.5562
 epoch: 71, train_loss: 0.3866, test_loss: 1.8529, test_f1: 0.6056
 epoch: 72, train_loss: 0.3574, test_loss: 1.9428, test_f1: 0.5943
 epoch: 73, train_loss: 0.3846, test_loss: 1.9491, test_f1: 0.5741
 epoch: 74, train_loss: 0.3647, test_loss: 2.0511, test_f1: 0.6011
 epoch: 75, train_loss: 0.3268, test_loss: 2.1776, test_f1: 0.5407
 epoch: 76, train_loss: 0.3355, test_loss: 2.0928, test_f1: 0.5453
 epoch: 77, train_loss: 0.3532, test_loss: 2.1476, test_f1: 0.5510
 epoch: 78, train_loss: 0.3362, test_loss: 2.3761, test_f1: 0.5163
 epoch: 79, train_loss: 0.3501, test_loss: 2.5000, test_f1: 0.5289
 epoch: 80, train_loss: 0.3616, test_loss: 2.4876, test_f1: 0.5542
 epoch: 81, train_loss: 0.4052, test_loss: 1.9962, test_f1: 0.5639
 epoch: 82, train_loss: 0.3818, test_loss: 2.0195, test_f1: 0.5535
 epoch: 83, train_loss: 0.3493, test_loss: 2.0199, test_f1: 0.5566
 epoch: 84, train_loss: 0.3569, test_loss: 2.3067, test_f1: 0.5033
 epoch: 85, train_loss: 0.3753, test_loss: 2.1609, test_f1: 0.5535
 epoch: 86, train_loss: 0.3524, test_loss: 2.0431, test_f1: 0.5420
 epoch: 87, train_loss: 0.3231, test_loss: 2.1670, test_f1: 0.5327
 epoch: 88, train_loss: 0.3039, test_loss: 2.0401, test_f1: 0.5582
 epoch: 89, train_loss: 0.3168, test_loss: 2.1496, test_f1: 0.5531
 epoch: 90, train_loss: 0.3059, test_loss: 2.2385, test_f1: 0.5396
 epoch: 91, train_loss: 0.3350, test_loss: 2.2625, test_f1: 0.5734
 epoch: 92, train_loss: 0.3579, test_loss: 2.2295, test_f1: 0.5593
 epoch: 93, train_loss: 0.3350, test_loss: 2.1164, test_f1: 0.5897
 epoch: 94, train_loss: 0.2972, test_loss: 2.1328, test_f1: 0.6016
 epoch: 95, train_loss: 0.3000, test_loss: 2.0615, test_f1: 0.6254
 epoch: 96, train_loss: 0.2978, test_loss: 2.1895, test_f1: 0.6032
 epoch: 97, train_loss: 0.2764, test_loss: 2.1913, test_f1: 0.5762
 epoch: 98, train_loss: 0.2885, test_loss: 2.2931, test_f1: 0.5799
 epoch: 99, train_loss: 0.2827, test_loss: 2.2972, test_f1: 0.5602
##################ITERATION #2 ****************************************
 epoch: 0, train_loss: 1.2409, test_loss: 1.3041, test_f1: 0.2357
 epoch: 1, train_loss: 1.1629, test_loss: 1.2935, test_f1: 0.2312
 epoch: 2, train_loss: 1.1091, test_loss: 1.3020, test_f1: 0.2281
 epoch: 3, train_loss: 1.0708, test_loss: 1.3167, test_f1: 0.2454
 epoch: 4, train_loss: 1.0088, test_loss: 1.3367, test_f1: 0.3090
 epoch: 5, train_loss: 0.9751, test_loss: 1.2814, test_f1: 0.3214
 epoch: 6, train_loss: 0.9390, test_loss: 1.2500, test_f1: 0.3854
 epoch: 7, train_loss: 0.8962, test_loss: 1.2745, test_f1: 0.3835
 epoch: 8, train_loss: 0.8764, test_loss: 1.2393, test_f1: 0.3944
 epoch: 9, train_loss: 0.8547, test_loss: 1.2267, test_f1: 0.4398
 epoch: 10, train_loss: 0.8328, test_loss: 1.1454, test_f1: 0.4732
 epoch: 11, train_loss: 0.8105, test_loss: 1.0994, test_f1: 0.5160
 epoch: 12, train_loss: 0.7987, test_loss: 1.0201, test_f1: 0.5521
 epoch: 13, train_loss: 0.7774, test_loss: 1.0484, test_f1: 0.5663
 epoch: 14, train_loss: 0.7702, test_loss: 1.0118, test_f1: 0.5818
 epoch: 15, train_loss: 0.7581, test_loss: 1.0423, test_f1: 0.5551
 epoch: 16, train_loss: 0.7610, test_loss: 1.0783, test_f1: 0.5420
 epoch: 17, train_loss: 0.7362, test_loss: 1.2157, test_f1: 0.4537
 epoch: 18, train_loss: 0.7283, test_loss: 1.0638, test_f1: 0.5751
 epoch: 19, train_loss: 0.7280, test_loss: 1.1244, test_f1: 0.5420
 epoch: 20, train_loss: 0.7219, test_loss: 1.2149, test_f1: 0.5174
 epoch: 21, train_loss: 0.7089, test_loss: 1.0679, test_f1: 0.5791
 epoch: 22, train_loss: 0.7062, test_loss: 1.1723, test_f1: 0.5566
 epoch: 23, train_loss: 0.6983, test_loss: 1.2273, test_f1: 0.5673
 epoch: 24, train_loss: 0.6720, test_loss: 1.0164, test_f1: 0.5703
 epoch: 25, train_loss: 0.6592, test_loss: 1.1111, test_f1: 0.5571
 epoch: 26, train_loss: 0.6998, test_loss: 1.1793, test_f1: 0.5015
 epoch: 27, train_loss: 0.6642, test_loss: 1.0906, test_f1: 0.5723
 epoch: 28, train_loss: 0.6652, test_loss: 1.1741, test_f1: 0.5912
 epoch: 29, train_loss: 0.6510, test_loss: 0.9922, test_f1: 0.6110
 epoch: 30, train_loss: 0.6441, test_loss: 1.0047, test_f1: 0.5878
 epoch: 31, train_loss: 0.6275, test_loss: 1.0574, test_f1: 0.5882
 epoch: 32, train_loss: 0.6252, test_loss: 1.1876, test_f1: 0.5558
 epoch: 33, train_loss: 0.6210, test_loss: 1.1081, test_f1: 0.5867
 epoch: 34, train_loss: 0.5875, test_loss: 1.2670, test_f1: 0.5822
 epoch: 35, train_loss: 0.6111, test_loss: 1.3846, test_f1: 0.4971
 epoch: 36, train_loss: 0.6066, test_loss: 1.1730, test_f1: 0.5550
 epoch: 37, train_loss: 0.5970, test_loss: 1.1094, test_f1: 0.5648
 epoch: 38, train_loss: 0.5933, test_loss: 1.0512, test_f1: 0.5996
 epoch: 39, train_loss: 0.5955, test_loss: 1.0034, test_f1: 0.6376
 epoch: 40, train_loss: 0.5934, test_loss: 1.1770, test_f1: 0.5572
 epoch: 41, train_loss: 0.5636, test_loss: 1.1732, test_f1: 0.5989
 epoch: 42, train_loss: 0.5928, test_loss: 1.2973, test_f1: 0.5391
 epoch: 43, train_loss: 0.5504, test_loss: 1.2855, test_f1: 0.5823
 epoch: 44, train_loss: 0.5487, test_loss: 1.3050, test_f1: 0.5697
 epoch: 45, train_loss: 0.5619, test_loss: 1.4976, test_f1: 0.5338
 epoch: 46, train_loss: 0.5375, test_loss: 1.2843, test_f1: 0.6040
 epoch: 47, train_loss: 0.5501, test_loss: 1.5121, test_f1: 0.5669
 epoch: 48, train_loss: 0.5365, test_loss: 1.4119, test_f1: 0.6094
 epoch: 49, train_loss: 0.5530, test_loss: 1.3975, test_f1: 0.6056
 epoch: 50, train_loss: 0.5145, test_loss: 1.2817, test_f1: 0.5740
 epoch: 51, train_loss: 0.5400, test_loss: 1.2830, test_f1: 0.5707
 epoch: 52, train_loss: 0.4902, test_loss: 1.2515, test_f1: 0.6049
 epoch: 53, train_loss: 0.4784, test_loss: 1.2770, test_f1: 0.5974
 epoch: 54, train_loss: 0.4623, test_loss: 1.2754, test_f1: 0.5837
 epoch: 55, train_loss: 0.4366, test_loss: 1.3382, test_f1: 0.5655
 epoch: 56, train_loss: 0.4423, test_loss: 1.4236, test_f1: 0.5474
 epoch: 57, train_loss: 0.4285, test_loss: 1.4269, test_f1: 0.5731
 epoch: 58, train_loss: 0.4368, test_loss: 1.6054, test_f1: 0.5505
 epoch: 59, train_loss: 0.4212, test_loss: 1.6654, test_f1: 0.5395
 epoch: 60, train_loss: 0.4215, test_loss: 1.3335, test_f1: 0.5859
 epoch: 61, train_loss: 0.4073, test_loss: 1.3233, test_f1: 0.5890
 epoch: 62, train_loss: 0.4037, test_loss: 1.3396, test_f1: 0.5876
 epoch: 63, train_loss: 0.4048, test_loss: 1.5520, test_f1: 0.5778
 epoch: 64, train_loss: 0.4038, test_loss: 1.5370, test_f1: 0.5712
 epoch: 65, train_loss: 0.3966, test_loss: 1.4839, test_f1: 0.5764
 epoch: 66, train_loss: 0.3892, test_loss: 1.4147, test_f1: 0.5783
 epoch: 67, train_loss: 0.3867, test_loss: 1.5254, test_f1: 0.6044
 epoch: 68, train_loss: 0.4012, test_loss: 1.6645, test_f1: 0.6085
 epoch: 69, train_loss: 0.3888, test_loss: 1.6551, test_f1: 0.6204
 epoch: 70, train_loss: 0.3885, test_loss: 1.7767, test_f1: 0.5887
 epoch: 71, train_loss: 0.3862, test_loss: 1.8116, test_f1: 0.5548
 epoch: 72, train_loss: 0.3945, test_loss: 1.5975, test_f1: 0.6058
 epoch: 73, train_loss: 0.3701, test_loss: 1.6478, test_f1: 0.6132
 epoch: 74, train_loss: 0.3687, test_loss: 1.5498, test_f1: 0.5855
 epoch: 75, train_loss: 0.3475, test_loss: 1.6117, test_f1: 0.6009
 epoch: 76, train_loss: 0.3475, test_loss: 1.6036, test_f1: 0.5922
 epoch: 77, train_loss: 0.3466, test_loss: 1.6840, test_f1: 0.5845
 epoch: 78, train_loss: 0.3484, test_loss: 1.9471, test_f1: 0.5743
 epoch: 79, train_loss: 0.3558, test_loss: 1.9352, test_f1: 0.5869
 epoch: 80, train_loss: 0.3428, test_loss: 1.6252, test_f1: 0.6119
 epoch: 81, train_loss: 0.3559, test_loss: 1.5908, test_f1: 0.6154
 epoch: 82, train_loss: 0.3157, test_loss: 1.6228, test_f1: 0.6028
 epoch: 83, train_loss: 0.3191, test_loss: 1.6613, test_f1: 0.6059
 epoch: 84, train_loss: 0.3170, test_loss: 1.6646, test_f1: 0.5762
 epoch: 85, train_loss: 0.3264, test_loss: 1.8077, test_f1: 0.5802
 epoch: 86, train_loss: 0.3233, test_loss: 2.1110, test_f1: 0.5692
 epoch: 87, train_loss: 0.3298, test_loss: 2.1526, test_f1: 0.5899
 epoch: 88, train_loss: 0.3164, test_loss: 2.2273, test_f1: 0.5982
 epoch: 89, train_loss: 0.3046, test_loss: 2.2077, test_f1: 0.6051
 epoch: 90, train_loss: 0.3109, test_loss: 1.9467, test_f1: 0.5759
 epoch: 91, train_loss: 0.3129, test_loss: 2.3478, test_f1: 0.6033
 epoch: 92, train_loss: 0.3407, test_loss: 2.0041, test_f1: 0.5804
 epoch: 93, train_loss: 0.3221, test_loss: 1.9047, test_f1: 0.5606
 epoch: 94, train_loss: 0.3156, test_loss: 2.0166, test_f1: 0.5952
 epoch: 95, train_loss: 0.3048, test_loss: 1.9904, test_f1: 0.5679
 epoch: 96, train_loss: 0.2790, test_loss: 1.9785, test_f1: 0.5730
 epoch: 97, train_loss: 0.2610, test_loss: 2.1957, test_f1: 0.5822
 epoch: 98, train_loss: 0.2623, test_loss: 2.1626, test_f1: 0.5772
 epoch: 99, train_loss: 0.2721, test_loss: 2.1223, test_f1: 0.5886
##################ITERATION #3 ****************************************
 epoch: 0, train_loss: 1.2247, test_loss: 1.3033, test_f1: 0.3271
 epoch: 1, train_loss: 1.0954, test_loss: 1.2931, test_f1: 0.2781
 epoch: 2, train_loss: 1.0135, test_loss: 1.2819, test_f1: 0.3064
 epoch: 3, train_loss: 0.9623, test_loss: 1.2383, test_f1: 0.3251
 epoch: 4, train_loss: 0.9120, test_loss: 1.2283, test_f1: 0.3136
 epoch: 5, train_loss: 0.8828, test_loss: 1.2063, test_f1: 0.3297
 epoch: 6, train_loss: 0.8654, test_loss: 1.1756, test_f1: 0.4276
 epoch: 7, train_loss: 0.8278, test_loss: 1.0942, test_f1: 0.5439
 epoch: 8, train_loss: 0.8268, test_loss: 1.1890, test_f1: 0.4558
 epoch: 9, train_loss: 0.7854, test_loss: 1.0710, test_f1: 0.4499
 epoch: 10, train_loss: 0.7725, test_loss: 1.0529, test_f1: 0.4892
 epoch: 11, train_loss: 0.7597, test_loss: 1.0468, test_f1: 0.5871
 epoch: 12, train_loss: 0.7816, test_loss: 1.0662, test_f1: 0.5562
 epoch: 13, train_loss: 0.7504, test_loss: 1.1248, test_f1: 0.5370
 epoch: 14, train_loss: 0.7163, test_loss: 1.0293, test_f1: 0.5726
 epoch: 15, train_loss: 0.7151, test_loss: 0.9891, test_f1: 0.5769
 epoch: 16, train_loss: 0.7315, test_loss: 1.0301, test_f1: 0.6346
 epoch: 17, train_loss: 0.7074, test_loss: 1.0991, test_f1: 0.5320
 epoch: 18, train_loss: 0.6878, test_loss: 0.9721, test_f1: 0.5814
 epoch: 19, train_loss: 0.6885, test_loss: 1.0148, test_f1: 0.6243
 epoch: 20, train_loss: 0.6673, test_loss: 0.9993, test_f1: 0.5857
 epoch: 21, train_loss: 0.6673, test_loss: 1.0115, test_f1: 0.5645
 epoch: 22, train_loss: 0.6361, test_loss: 1.1101, test_f1: 0.5536
 epoch: 23, train_loss: 0.6318, test_loss: 1.2147, test_f1: 0.5585
 epoch: 24, train_loss: 0.6283, test_loss: 1.0468, test_f1: 0.5967
 epoch: 25, train_loss: 0.6039, test_loss: 1.1485, test_f1: 0.5866
 epoch: 26, train_loss: 0.6134, test_loss: 1.0653, test_f1: 0.5842
 epoch: 27, train_loss: 0.6221, test_loss: 1.1280, test_f1: 0.5767
 epoch: 28, train_loss: 0.6265, test_loss: 1.0992, test_f1: 0.5386
 epoch: 29, train_loss: 0.6428, test_loss: 1.0885, test_f1: 0.5780
 epoch: 30, train_loss: 0.6485, test_loss: 1.0687, test_f1: 0.5772
 epoch: 31, train_loss: 0.6086, test_loss: 1.0556, test_f1: 0.5890
 epoch: 32, train_loss: 0.5891, test_loss: 1.1129, test_f1: 0.5809
 epoch: 33, train_loss: 0.5844, test_loss: 1.1340, test_f1: 0.6082
 epoch: 34, train_loss: 0.5569, test_loss: 1.1110, test_f1: 0.5814
 epoch: 35, train_loss: 0.5537, test_loss: 1.1931, test_f1: 0.5989
 epoch: 36, train_loss: 0.5334, test_loss: 1.2182, test_f1: 0.6036
 epoch: 37, train_loss: 0.5327, test_loss: 1.1016, test_f1: 0.6337
 epoch: 38, train_loss: 0.5209, test_loss: 1.1922, test_f1: 0.5985
 epoch: 39, train_loss: 0.5017, test_loss: 1.0372, test_f1: 0.6245
 epoch: 40, train_loss: 0.5376, test_loss: 1.2301, test_f1: 0.5795
 epoch: 41, train_loss: 0.5328, test_loss: 1.1174, test_f1: 0.5528
 epoch: 42, train_loss: 0.5765, test_loss: 1.1677, test_f1: 0.5689
 epoch: 43, train_loss: 0.5299, test_loss: 1.4509, test_f1: 0.4963
 epoch: 44, train_loss: 0.5681, test_loss: 1.4501, test_f1: 0.5007
 epoch: 45, train_loss: 0.5660, test_loss: 1.1536, test_f1: 0.5867
 epoch: 46, train_loss: 0.5224, test_loss: 1.1708, test_f1: 0.5332
 epoch: 47, train_loss: 0.5054, test_loss: 1.0943, test_f1: 0.6208
 epoch: 48, train_loss: 0.4899, test_loss: 1.0725, test_f1: 0.6087
 epoch: 49, train_loss: 0.5369, test_loss: 1.2286, test_f1: 0.6053
 epoch: 50, train_loss: 0.5772, test_loss: 1.3818, test_f1: 0.5639
 epoch: 51, train_loss: 0.5203, test_loss: 1.4477, test_f1: 0.5687
 epoch: 52, train_loss: 0.4711, test_loss: 1.3247, test_f1: 0.5516
 epoch: 53, train_loss: 0.4523, test_loss: 1.1381, test_f1: 0.6146
 epoch: 54, train_loss: 0.4402, test_loss: 1.1092, test_f1: 0.6104
 epoch: 55, train_loss: 0.4225, test_loss: 1.2336, test_f1: 0.6206
 epoch: 56, train_loss: 0.4043, test_loss: 1.1590, test_f1: 0.6330
 epoch: 57, train_loss: 0.4082, test_loss: 1.1563, test_f1: 0.5992
 epoch: 58, train_loss: 0.4146, test_loss: 1.1835, test_f1: 0.6257
 epoch: 59, train_loss: 0.4158, test_loss: 1.2402, test_f1: 0.6069
 epoch: 60, train_loss: 0.3922, test_loss: 1.1666, test_f1: 0.6305
 epoch: 61, train_loss: 0.4170, test_loss: 1.3454, test_f1: 0.6013
 epoch: 62, train_loss: 0.3678, test_loss: 1.4203, test_f1: 0.6011
 epoch: 63, train_loss: 0.3910, test_loss: 1.4108, test_f1: 0.5925
 epoch: 64, train_loss: 0.3724, test_loss: 1.3144, test_f1: 0.5968
 epoch: 65, train_loss: 0.3794, test_loss: 1.3496, test_f1: 0.5993
 epoch: 66, train_loss: 0.3527, test_loss: 1.5185, test_f1: 0.5783
 epoch: 67, train_loss: 0.3614, test_loss: 1.5355, test_f1: 0.5826
 epoch: 68, train_loss: 0.3530, test_loss: 1.5152, test_f1: 0.5743
 epoch: 69, train_loss: 0.3642, test_loss: 1.4890, test_f1: 0.5745
 epoch: 70, train_loss: 0.3536, test_loss: 1.4930, test_f1: 0.5934
 epoch: 71, train_loss: 0.3414, test_loss: 1.5571, test_f1: 0.5536
 epoch: 72, train_loss: 0.3737, test_loss: 1.3913, test_f1: 0.5861
 epoch: 73, train_loss: 0.3540, test_loss: 1.3570, test_f1: 0.6233
 epoch: 74, train_loss: 0.3444, test_loss: 1.5900, test_f1: 0.5989
 epoch: 75, train_loss: 0.3460, test_loss: 1.5657, test_f1: 0.5976
 epoch: 76, train_loss: 0.3160, test_loss: 1.6894, test_f1: 0.5812
 epoch: 77, train_loss: 0.3249, test_loss: 1.6769, test_f1: 0.6060
 epoch: 78, train_loss: 0.3099, test_loss: 1.6187, test_f1: 0.6234
 epoch: 79, train_loss: 0.3181, test_loss: 1.7105, test_f1: 0.5635
 epoch: 80, train_loss: 0.3285, test_loss: 1.6117, test_f1: 0.5953
 epoch: 81, train_loss: 0.3238, test_loss: 1.5663, test_f1: 0.6092
 epoch: 82, train_loss: 0.2920, test_loss: 1.6022, test_f1: 0.6118
 epoch: 83, train_loss: 0.2866, test_loss: 1.6571, test_f1: 0.5846
 epoch: 84, train_loss: 0.3119, test_loss: 1.6695, test_f1: 0.5963
 epoch: 85, train_loss: 0.3074, test_loss: 1.7111, test_f1: 0.5773
 epoch: 86, train_loss: 0.3337, test_loss: 1.5756, test_f1: 0.5880
 epoch: 87, train_loss: 0.2812, test_loss: 1.6052, test_f1: 0.5951
 epoch: 88, train_loss: 0.2982, test_loss: 1.7309, test_f1: 0.5724
 epoch: 89, train_loss: 0.2754, test_loss: 1.6971, test_f1: 0.6021
 epoch: 90, train_loss: 0.2870, test_loss: 1.6008, test_f1: 0.5904
 epoch: 91, train_loss: 0.3134, test_loss: 1.7212, test_f1: 0.5630
 epoch: 92, train_loss: 0.3184, test_loss: 1.6342, test_f1: 0.6017
 epoch: 93, train_loss: 0.3174, test_loss: 1.6740, test_f1: 0.6048
 epoch: 94, train_loss: 0.2937, test_loss: 1.7550, test_f1: 0.6142
 epoch: 95, train_loss: 0.2850, test_loss: 1.7974, test_f1: 0.5874
 epoch: 96, train_loss: 0.2787, test_loss: 1.9212, test_f1: 0.5801
 epoch: 97, train_loss: 0.2526, test_loss: 1.8857, test_f1: 0.5994
 epoch: 98, train_loss: 0.2506, test_loss: 1.8223, test_f1: 0.5970
 epoch: 99, train_loss: 0.2507, test_loss: 1.9021, test_f1: 0.6120
##################ITERATION #4 ****************************************
 epoch: 0, train_loss: 1.2160, test_loss: 1.3198, test_f1: 0.2670
 epoch: 1, train_loss: 1.1160, test_loss: 1.2806, test_f1: 0.3320
 epoch: 2, train_loss: 1.0541, test_loss: 1.2592, test_f1: 0.3365
 epoch: 3, train_loss: 0.9957, test_loss: 1.2377, test_f1: 0.2643
 epoch: 4, train_loss: 0.9648, test_loss: 1.2080, test_f1: 0.3183
 epoch: 5, train_loss: 0.9428, test_loss: 1.1653, test_f1: 0.4611
 epoch: 6, train_loss: 0.9156, test_loss: 1.1748, test_f1: 0.4185
 epoch: 7, train_loss: 0.8972, test_loss: 1.1811, test_f1: 0.4761
 epoch: 8, train_loss: 0.8650, test_loss: 1.2096, test_f1: 0.4982
 epoch: 9, train_loss: 0.8410, test_loss: 1.1883, test_f1: 0.5036
 epoch: 10, train_loss: 0.8499, test_loss: 1.0734, test_f1: 0.5305
 epoch: 11, train_loss: 0.8207, test_loss: 1.0470, test_f1: 0.5800
 epoch: 12, train_loss: 0.7993, test_loss: 1.0572, test_f1: 0.5625
 epoch: 13, train_loss: 0.7977, test_loss: 0.9997, test_f1: 0.5897
 epoch: 14, train_loss: 0.7616, test_loss: 0.9664, test_f1: 0.5978
 epoch: 15, train_loss: 0.7438, test_loss: 1.0847, test_f1: 0.5314
 epoch: 16, train_loss: 0.7474, test_loss: 1.0472, test_f1: 0.5885
 epoch: 17, train_loss: 0.7234, test_loss: 1.0702, test_f1: 0.5691
 epoch: 18, train_loss: 0.7013, test_loss: 1.0645, test_f1: 0.5547
 epoch: 19, train_loss: 0.6947, test_loss: 1.0688, test_f1: 0.5601
 epoch: 20, train_loss: 0.7163, test_loss: 1.1931, test_f1: 0.5321
 epoch: 21, train_loss: 0.7067, test_loss: 1.1091, test_f1: 0.5808
 epoch: 22, train_loss: 0.6902, test_loss: 1.1952, test_f1: 0.5542
 epoch: 23, train_loss: 0.6792, test_loss: 1.1294, test_f1: 0.5897
 epoch: 24, train_loss: 0.6590, test_loss: 1.1238, test_f1: 0.5588
 epoch: 25, train_loss: 0.7108, test_loss: 0.9769, test_f1: 0.6452
 epoch: 26, train_loss: 0.7136, test_loss: 1.2281, test_f1: 0.4972
 epoch: 27, train_loss: 0.6547, test_loss: 1.0433, test_f1: 0.5747
 epoch: 28, train_loss: 0.6374, test_loss: 1.0014, test_f1: 0.6041
 epoch: 29, train_loss: 0.6082, test_loss: 1.0540, test_f1: 0.6071
 epoch: 30, train_loss: 0.6086, test_loss: 1.1124, test_f1: 0.5939
 epoch: 31, train_loss: 0.6024, test_loss: 1.2020, test_f1: 0.5789
 epoch: 32, train_loss: 0.6233, test_loss: 1.0788, test_f1: 0.5896
 epoch: 33, train_loss: 0.6201, test_loss: 1.1209, test_f1: 0.5603
 epoch: 34, train_loss: 0.6451, test_loss: 1.2368, test_f1: 0.5330
 epoch: 35, train_loss: 0.6092, test_loss: 1.2117, test_f1: 0.5491
 epoch: 36, train_loss: 0.5920, test_loss: 1.1416, test_f1: 0.5491
 epoch: 37, train_loss: 0.5632, test_loss: 1.1466, test_f1: 0.6126
 epoch: 38, train_loss: 0.5578, test_loss: 1.2406, test_f1: 0.5660
 epoch: 39, train_loss: 0.5538, test_loss: 1.2466, test_f1: 0.5658
 epoch: 40, train_loss: 0.5371, test_loss: 1.2152, test_f1: 0.6060
 epoch: 41, train_loss: 0.5248, test_loss: 1.3526, test_f1: 0.5341
 epoch: 42, train_loss: 0.5733, test_loss: 1.2405, test_f1: 0.5362
 epoch: 43, train_loss: 0.5611, test_loss: 1.2614, test_f1: 0.5745
 epoch: 44, train_loss: 0.5747, test_loss: 1.1786, test_f1: 0.5946
 epoch: 45, train_loss: 0.5503, test_loss: 1.2926, test_f1: 0.5515
 epoch: 46, train_loss: 0.5392, test_loss: 1.1928, test_f1: 0.5966
 epoch: 47, train_loss: 0.5253, test_loss: 1.0901, test_f1: 0.6017
 epoch: 48, train_loss: 0.5406, test_loss: 1.1615, test_f1: 0.5943
 epoch: 49, train_loss: 0.5184, test_loss: 1.3235, test_f1: 0.5610
 epoch: 50, train_loss: 0.5051, test_loss: 1.2648, test_f1: 0.6312
 epoch: 51, train_loss: 0.4624, test_loss: 1.2621, test_f1: 0.5900
 epoch: 52, train_loss: 0.4695, test_loss: 1.2999, test_f1: 0.6110
 epoch: 53, train_loss: 0.4650, test_loss: 1.3851, test_f1: 0.5877
 epoch: 54, train_loss: 0.4652, test_loss: 1.3240, test_f1: 0.6247
 epoch: 55, train_loss: 0.4669, test_loss: 1.2930, test_f1: 0.6073
 epoch: 56, train_loss: 0.4495, test_loss: 1.2821, test_f1: 0.5796
 epoch: 57, train_loss: 0.4411, test_loss: 1.2556, test_f1: 0.5784
 epoch: 58, train_loss: 0.4335, test_loss: 1.2878, test_f1: 0.6082
 epoch: 59, train_loss: 0.4332, test_loss: 1.3464, test_f1: 0.6047
 epoch: 60, train_loss: 0.4239, test_loss: 1.4483, test_f1: 0.6042
 epoch: 61, train_loss: 0.4128, test_loss: 1.4502, test_f1: 0.6037
 epoch: 62, train_loss: 0.4277, test_loss: 1.4561, test_f1: 0.5805
 epoch: 63, train_loss: 0.4254, test_loss: 1.4592, test_f1: 0.5735
 epoch: 64, train_loss: 0.4171, test_loss: 1.4569, test_f1: 0.5988
 epoch: 65, train_loss: 0.4319, test_loss: 1.3126, test_f1: 0.6500
 epoch: 66, train_loss: 0.4316, test_loss: 1.3340, test_f1: 0.6393
 epoch: 67, train_loss: 0.4271, test_loss: 1.3527, test_f1: 0.5897
 epoch: 68, train_loss: 0.4289, test_loss: 1.3062, test_f1: 0.6597
 epoch: 69, train_loss: 0.4240, test_loss: 1.3449, test_f1: 0.6110
 epoch: 70, train_loss: 0.4180, test_loss: 1.3679, test_f1: 0.6259
 epoch: 71, train_loss: 0.4140, test_loss: 1.4001, test_f1: 0.6590
 epoch: 72, train_loss: 0.3891, test_loss: 1.3988, test_f1: 0.6289
 epoch: 73, train_loss: 0.3925, test_loss: 1.4136, test_f1: 0.6510
 epoch: 74, train_loss: 0.3740, test_loss: 1.3845, test_f1: 0.6546
 epoch: 75, train_loss: 0.3817, test_loss: 1.4267, test_f1: 0.6469
 epoch: 76, train_loss: 0.3876, test_loss: 1.4637, test_f1: 0.6139
 epoch: 77, train_loss: 0.3882, test_loss: 1.3636, test_f1: 0.6190
 epoch: 78, train_loss: 0.3632, test_loss: 1.4861, test_f1: 0.6255
 epoch: 79, train_loss: 0.3865, test_loss: 1.5571, test_f1: 0.5795
 epoch: 80, train_loss: 0.3823, test_loss: 1.4743, test_f1: 0.5990
 epoch: 81, train_loss: 0.3761, test_loss: 1.4950, test_f1: 0.6134
 epoch: 82, train_loss: 0.3753, test_loss: 1.5043, test_f1: 0.6526
 epoch: 83, train_loss: 0.3882, test_loss: 1.4399, test_f1: 0.6668
 epoch: 84, train_loss: 0.3743, test_loss: 1.6069, test_f1: 0.6245
 epoch: 85, train_loss: 0.3554, test_loss: 1.5705, test_f1: 0.6475
 epoch: 86, train_loss: 0.3585, test_loss: 1.6308, test_f1: 0.5672
 epoch: 87, train_loss: 0.3746, test_loss: 1.5186, test_f1: 0.5877
 epoch: 88, train_loss: 0.3543, test_loss: 1.6887, test_f1: 0.6034
 epoch: 89, train_loss: 0.3342, test_loss: 1.7159, test_f1: 0.6073
 epoch: 90, train_loss: 0.3289, test_loss: 1.7147, test_f1: 0.5889
 epoch: 91, train_loss: 0.3358, test_loss: 1.6459, test_f1: 0.6454
 epoch: 92, train_loss: 0.3978, test_loss: 1.6478, test_f1: 0.5521
 epoch: 93, train_loss: 0.3911, test_loss: 1.6398, test_f1: 0.5721
 epoch: 94, train_loss: 0.3516, test_loss: 1.6909, test_f1: 0.5935
 epoch: 95, train_loss: 0.3385, test_loss: 1.4983, test_f1: 0.6083
 epoch: 96, train_loss: 0.3285, test_loss: 1.3805, test_f1: 0.6416
 epoch: 97, train_loss: 0.3130, test_loss: 1.4215, test_f1: 0.6522
 epoch: 98, train_loss: 0.3143, test_loss: 1.4847, test_f1: 0.6037
 epoch: 99, train_loss: 0.3067, test_loss: 1.6919, test_f1: 0.5684
##################ITERATION #5 ****************************************
 epoch: 0, train_loss: 1.2596, test_loss: 1.3103, test_f1: 0.3362
 epoch: 1, train_loss: 1.1119, test_loss: 1.3630, test_f1: 0.1365
 epoch: 2, train_loss: 1.0121, test_loss: 1.3926, test_f1: 0.1365
 epoch: 3, train_loss: 0.9689, test_loss: 1.4303, test_f1: 0.2278
 epoch: 4, train_loss: 0.9353, test_loss: 1.4584, test_f1: 0.2365
 epoch: 5, train_loss: 0.9382, test_loss: 1.4117, test_f1: 0.3433
 epoch: 6, train_loss: 0.9043, test_loss: 1.3549, test_f1: 0.4187
 epoch: 7, train_loss: 0.8709, test_loss: 1.2385, test_f1: 0.4932
 epoch: 8, train_loss: 0.8429, test_loss: 1.2685, test_f1: 0.4877
 epoch: 9, train_loss: 0.8280, test_loss: 1.1096, test_f1: 0.5433
 epoch: 10, train_loss: 0.7993, test_loss: 1.1538, test_f1: 0.5475
 epoch: 11, train_loss: 0.7792, test_loss: 1.1693, test_f1: 0.6118
 epoch: 12, train_loss: 0.7606, test_loss: 1.2716, test_f1: 0.5849
 epoch: 13, train_loss: 0.7363, test_loss: 1.1240, test_f1: 0.5525
 epoch: 14, train_loss: 0.7401, test_loss: 1.1544, test_f1: 0.5119
 epoch: 15, train_loss: 0.7453, test_loss: 1.1040, test_f1: 0.5801
 epoch: 16, train_loss: 0.7107, test_loss: 1.0487, test_f1: 0.6115
 epoch: 17, train_loss: 0.7326, test_loss: 1.1805, test_f1: 0.5410
 epoch: 18, train_loss: 0.7141, test_loss: 1.1367, test_f1: 0.5864
 epoch: 19, train_loss: 0.7257, test_loss: 1.2773, test_f1: 0.5403
 epoch: 20, train_loss: 0.7173, test_loss: 1.0222, test_f1: 0.6014
 epoch: 21, train_loss: 0.6899, test_loss: 1.6685, test_f1: 0.4449
 epoch: 22, train_loss: 0.6809, test_loss: 1.3690, test_f1: 0.4978
 epoch: 23, train_loss: 0.6940, test_loss: 1.2706, test_f1: 0.5987
 epoch: 24, train_loss: 0.6926, test_loss: 1.4310, test_f1: 0.5777
 epoch: 25, train_loss: 0.6425, test_loss: 1.3378, test_f1: 0.5231
 epoch: 26, train_loss: 0.6278, test_loss: 1.4868, test_f1: 0.4614
 epoch: 27, train_loss: 0.6298, test_loss: 1.3740, test_f1: 0.5635
 epoch: 28, train_loss: 0.6281, test_loss: 1.3109, test_f1: 0.5962
 epoch: 29, train_loss: 0.6121, test_loss: 1.4689, test_f1: 0.5745
 epoch: 30, train_loss: 0.6183, test_loss: 1.4570, test_f1: 0.5421
 epoch: 31, train_loss: 0.6090, test_loss: 1.2320, test_f1: 0.5942
 epoch: 32, train_loss: 0.5904, test_loss: 1.3233, test_f1: 0.6055
 epoch: 33, train_loss: 0.5728, test_loss: 1.5058, test_f1: 0.5741
 epoch: 34, train_loss: 0.5823, test_loss: 1.4803, test_f1: 0.5812
 epoch: 35, train_loss: 0.5815, test_loss: 1.2069, test_f1: 0.5901
 epoch: 36, train_loss: 0.5924, test_loss: 1.4883, test_f1: 0.5412
 epoch: 37, train_loss: 0.5589, test_loss: 1.3316, test_f1: 0.5391
 epoch: 38, train_loss: 0.5780, test_loss: 1.4962, test_f1: 0.4335
 epoch: 39, train_loss: 0.5560, test_loss: 1.2922, test_f1: 0.5523
 epoch: 40, train_loss: 0.5539, test_loss: 1.3040, test_f1: 0.5837
 epoch: 41, train_loss: 0.5581, test_loss: 1.4213, test_f1: 0.5735
 epoch: 42, train_loss: 0.5379, test_loss: 1.3773, test_f1: 0.5707
 epoch: 43, train_loss: 0.5547, test_loss: 1.4859, test_f1: 0.5597
 epoch: 44, train_loss: 0.5397, test_loss: 1.2381, test_f1: 0.5927
 epoch: 45, train_loss: 0.5140, test_loss: 1.2926, test_f1: 0.6026
 epoch: 46, train_loss: 0.5104, test_loss: 1.3266, test_f1: 0.5509
 epoch: 47, train_loss: 0.5467, test_loss: 1.3092, test_f1: 0.5821
 epoch: 48, train_loss: 0.5320, test_loss: 1.6291, test_f1: 0.5595
 epoch: 49, train_loss: 0.5349, test_loss: 1.4012, test_f1: 0.5788
 epoch: 50, train_loss: 0.5171, test_loss: 1.4252, test_f1: 0.5536
 epoch: 51, train_loss: 0.4734, test_loss: 1.4939, test_f1: 0.5730
 epoch: 52, train_loss: 0.4808, test_loss: 1.3989, test_f1: 0.5704
 epoch: 53, train_loss: 0.4545, test_loss: 1.3689, test_f1: 0.5754
 epoch: 54, train_loss: 0.4564, test_loss: 1.3554, test_f1: 0.5758
 epoch: 55, train_loss: 0.4624, test_loss: 1.5878, test_f1: 0.5977
 epoch: 56, train_loss: 0.4413, test_loss: 1.5137, test_f1: 0.5981
 epoch: 57, train_loss: 0.4312, test_loss: 1.5265, test_f1: 0.5974
 epoch: 58, train_loss: 0.4237, test_loss: 1.5356, test_f1: 0.5863
 epoch: 59, train_loss: 0.4002, test_loss: 1.4706, test_f1: 0.5947
 epoch: 60, train_loss: 0.3988, test_loss: 1.4617, test_f1: 0.5968
 epoch: 61, train_loss: 0.3961, test_loss: 1.5035, test_f1: 0.5986
 epoch: 62, train_loss: 0.3735, test_loss: 1.6756, test_f1: 0.6150
 epoch: 63, train_loss: 0.3802, test_loss: 1.7398, test_f1: 0.5847
 epoch: 64, train_loss: 0.3699, test_loss: 1.6050, test_f1: 0.5789
 epoch: 65, train_loss: 0.3453, test_loss: 1.8171, test_f1: 0.5837
 epoch: 66, train_loss: 0.3473, test_loss: 1.8839, test_f1: 0.5792
 epoch: 67, train_loss: 0.3546, test_loss: 1.7031, test_f1: 0.5688
 epoch: 68, train_loss: 0.3432, test_loss: 1.4625, test_f1: 0.6000
 epoch: 69, train_loss: 0.3302, test_loss: 1.4655, test_f1: 0.6055
 epoch: 70, train_loss: 0.3532, test_loss: 1.5497, test_f1: 0.6204
 epoch: 71, train_loss: 0.3172, test_loss: 1.7028, test_f1: 0.5962
 epoch: 72, train_loss: 0.3494, test_loss: 1.6858, test_f1: 0.6164
 epoch: 73, train_loss: 0.3439, test_loss: 1.6214, test_f1: 0.6111
 epoch: 74, train_loss: 0.3344, test_loss: 1.7247, test_f1: 0.5341
 epoch: 75, train_loss: 0.3319, test_loss: 1.6006, test_f1: 0.6084
 epoch: 76, train_loss: 0.3229, test_loss: 1.4098, test_f1: 0.6398
 epoch: 77, train_loss: 0.3262, test_loss: 1.4671, test_f1: 0.6436
 epoch: 78, train_loss: 0.3194, test_loss: 1.7342, test_f1: 0.6020
 epoch: 79, train_loss: 0.3228, test_loss: 1.8941, test_f1: 0.5850
 epoch: 80, train_loss: 0.3426, test_loss: 1.7345, test_f1: 0.6311
 epoch: 81, train_loss: 0.3329, test_loss: 1.6137, test_f1: 0.6319
 epoch: 82, train_loss: 0.3388, test_loss: 1.6883, test_f1: 0.5848
 epoch: 83, train_loss: 0.3372, test_loss: 1.8343, test_f1: 0.5693
 epoch: 84, train_loss: 0.3401, test_loss: 1.6574, test_f1: 0.6082
 epoch: 85, train_loss: 0.3562, test_loss: 1.8124, test_f1: 0.5981
 epoch: 86, train_loss: 0.3627, test_loss: 1.5440, test_f1: 0.6185
 epoch: 87, train_loss: 0.3345, test_loss: 1.5868, test_f1: 0.6295
 epoch: 88, train_loss: 0.3396, test_loss: 1.7800, test_f1: 0.5995
 epoch: 89, train_loss: 0.3315, test_loss: 1.8715, test_f1: 0.5899
 epoch: 90, train_loss: 0.3149, test_loss: 1.6487, test_f1: 0.5655
 epoch: 91, train_loss: 0.3701, test_loss: 1.8981, test_f1: 0.5074
 epoch: 92, train_loss: 0.3552, test_loss: 1.5283, test_f1: 0.6068
 epoch: 93, train_loss: 0.3378, test_loss: 1.3956, test_f1: 0.6071
 epoch: 94, train_loss: 0.3113, test_loss: 1.6281, test_f1: 0.5639
 epoch: 95, train_loss: 0.3059, test_loss: 1.6340, test_f1: 0.6115
 epoch: 96, train_loss: 0.2955, test_loss: 1.6706, test_f1: 0.6214
 epoch: 97, train_loss: 0.2937, test_loss: 1.8053, test_f1: 0.6212
 epoch: 98, train_loss: 0.2853, test_loss: 1.8288, test_f1: 0.6182
 epoch: 99, train_loss: 0.2717, test_loss: 1.7741, test_f1: 0.5946
##################ITERATION #6 ****************************************
 epoch: 0, train_loss: 1.2988, test_loss: 1.3407, test_f1: 0.1365
 epoch: 1, train_loss: 1.1351, test_loss: 1.3182, test_f1: 0.1482
 epoch: 2, train_loss: 1.0822, test_loss: 1.3042, test_f1: 0.3356
 epoch: 3, train_loss: 1.0269, test_loss: 1.3220, test_f1: 0.3192
 epoch: 4, train_loss: 0.9662, test_loss: 1.3475, test_f1: 0.3387
 epoch: 5, train_loss: 0.9428, test_loss: 1.3502, test_f1: 0.3247
 epoch: 6, train_loss: 0.9208, test_loss: 1.2748, test_f1: 0.3763
 epoch: 7, train_loss: 0.8810, test_loss: 1.1374, test_f1: 0.4901
 epoch: 8, train_loss: 0.8794, test_loss: 1.0995, test_f1: 0.5157
 epoch: 9, train_loss: 0.8554, test_loss: 1.0028, test_f1: 0.5739
 epoch: 10, train_loss: 0.8463, test_loss: 0.9911, test_f1: 0.5556
 epoch: 11, train_loss: 0.8074, test_loss: 0.9990, test_f1: 0.5451
 epoch: 12, train_loss: 0.8057, test_loss: 1.0132, test_f1: 0.5050
 epoch: 13, train_loss: 0.7889, test_loss: 1.0011, test_f1: 0.5670
 epoch: 14, train_loss: 0.7619, test_loss: 1.0275, test_f1: 0.5817
 epoch: 15, train_loss: 0.7608, test_loss: 1.0368, test_f1: 0.5863
 epoch: 16, train_loss: 0.7314, test_loss: 1.0964, test_f1: 0.5891
 epoch: 17, train_loss: 0.7326, test_loss: 1.1483, test_f1: 0.5023
 epoch: 18, train_loss: 0.7352, test_loss: 1.3122, test_f1: 0.4910
 epoch: 19, train_loss: 0.6999, test_loss: 1.2455, test_f1: 0.5178
 epoch: 20, train_loss: 0.6825, test_loss: 1.1566, test_f1: 0.5519
 epoch: 21, train_loss: 0.6935, test_loss: 1.1177, test_f1: 0.5264
 epoch: 22, train_loss: 0.6930, test_loss: 1.0640, test_f1: 0.5695
 epoch: 23, train_loss: 0.7100, test_loss: 1.2277, test_f1: 0.5500
 epoch: 24, train_loss: 0.7042, test_loss: 1.1752, test_f1: 0.5613
 epoch: 25, train_loss: 0.6602, test_loss: 1.1727, test_f1: 0.5630
 epoch: 26, train_loss: 0.6679, test_loss: 1.0967, test_f1: 0.5927
 epoch: 27, train_loss: 0.6286, test_loss: 1.1172, test_f1: 0.5964
 epoch: 28, train_loss: 0.6177, test_loss: 1.0614, test_f1: 0.5294
 epoch: 29, train_loss: 0.6098, test_loss: 1.4802, test_f1: 0.4715
 epoch: 30, train_loss: 0.6336, test_loss: 1.2203, test_f1: 0.5481
 epoch: 31, train_loss: 0.6211, test_loss: 1.2330, test_f1: 0.5386
 epoch: 32, train_loss: 0.6137, test_loss: 1.1343, test_f1: 0.5780
 epoch: 33, train_loss: 0.5933, test_loss: 1.1572, test_f1: 0.5924
 epoch: 34, train_loss: 0.5841, test_loss: 1.2257, test_f1: 0.5519
 epoch: 35, train_loss: 0.5903, test_loss: 1.1533, test_f1: 0.5466
 epoch: 36, train_loss: 0.5841, test_loss: 1.2956, test_f1: 0.5136
 epoch: 37, train_loss: 0.5581, test_loss: 1.5260, test_f1: 0.5440
 epoch: 38, train_loss: 0.5705, test_loss: 1.3299, test_f1: 0.5607
 epoch: 39, train_loss: 0.5410, test_loss: 1.3313, test_f1: 0.5837
 epoch: 40, train_loss: 0.5171, test_loss: 1.2045, test_f1: 0.5830
 epoch: 41, train_loss: 0.5234, test_loss: 1.0841, test_f1: 0.6244
 epoch: 42, train_loss: 0.5478, test_loss: 1.1602, test_f1: 0.6145
 epoch: 43, train_loss: 0.5316, test_loss: 1.3497, test_f1: 0.5110
 epoch: 44, train_loss: 0.5410, test_loss: 1.1513, test_f1: 0.5728
 epoch: 45, train_loss: 0.5443, test_loss: 1.2886, test_f1: 0.5442
 epoch: 46, train_loss: 0.5154, test_loss: 1.4071, test_f1: 0.5249
 epoch: 47, train_loss: 0.5297, test_loss: 1.2730, test_f1: 0.5639
 epoch: 48, train_loss: 0.5176, test_loss: 1.3280, test_f1: 0.5770
 epoch: 49, train_loss: 0.5406, test_loss: 1.2090, test_f1: 0.5504
 epoch: 50, train_loss: 0.5296, test_loss: 1.3206, test_f1: 0.6169
 epoch: 51, train_loss: 0.4983, test_loss: 1.1988, test_f1: 0.6249
 epoch: 52, train_loss: 0.4577, test_loss: 1.1754, test_f1: 0.5829
 epoch: 53, train_loss: 0.4692, test_loss: 1.2565, test_f1: 0.5523
 epoch: 54, train_loss: 0.4652, test_loss: 1.3636, test_f1: 0.5608
 epoch: 55, train_loss: 0.4291, test_loss: 1.3673, test_f1: 0.5771
 epoch: 56, train_loss: 0.4255, test_loss: 1.3004, test_f1: 0.5569
 epoch: 57, train_loss: 0.4237, test_loss: 1.2797, test_f1: 0.5467
 epoch: 58, train_loss: 0.4055, test_loss: 1.3465, test_f1: 0.5272
 epoch: 59, train_loss: 0.3961, test_loss: 1.3568, test_f1: 0.5516
 epoch: 60, train_loss: 0.4290, test_loss: 1.3325, test_f1: 0.5884
 epoch: 61, train_loss: 0.4001, test_loss: 1.4162, test_f1: 0.5775
 epoch: 62, train_loss: 0.4105, test_loss: 1.3654, test_f1: 0.5855
 epoch: 63, train_loss: 0.4097, test_loss: 1.4345, test_f1: 0.5534
 epoch: 64, train_loss: 0.4021, test_loss: 1.5322, test_f1: 0.5433
 epoch: 65, train_loss: 0.3923, test_loss: 1.5260, test_f1: 0.5530
 epoch: 66, train_loss: 0.3788, test_loss: 1.4352, test_f1: 0.5819
 epoch: 67, train_loss: 0.3716, test_loss: 1.3884, test_f1: 0.5855
 epoch: 68, train_loss: 0.3455, test_loss: 1.3533, test_f1: 0.5831
 epoch: 69, train_loss: 0.3640, test_loss: 1.4152, test_f1: 0.5789
 epoch: 70, train_loss: 0.3589, test_loss: 1.4124, test_f1: 0.6228
 epoch: 71, train_loss: 0.3687, test_loss: 1.3890, test_f1: 0.5877
 epoch: 72, train_loss: 0.3500, test_loss: 1.6859, test_f1: 0.5221
 epoch: 73, train_loss: 0.3513, test_loss: 1.4272, test_f1: 0.5791
 epoch: 74, train_loss: 0.3916, test_loss: 1.3099, test_f1: 0.5716
 epoch: 75, train_loss: 0.3846, test_loss: 1.2924, test_f1: 0.5719
 epoch: 76, train_loss: 0.3621, test_loss: 1.4210, test_f1: 0.5306
 epoch: 77, train_loss: 0.3824, test_loss: 1.4321, test_f1: 0.5736
 epoch: 78, train_loss: 0.3693, test_loss: 1.3758, test_f1: 0.5858
 epoch: 79, train_loss: 0.3747, test_loss: 1.5245, test_f1: 0.5531
 epoch: 80, train_loss: 0.3700, test_loss: 1.3481, test_f1: 0.5870
 epoch: 81, train_loss: 0.3510, test_loss: 1.3168, test_f1: 0.6124
 epoch: 82, train_loss: 0.3454, test_loss: 1.3526, test_f1: 0.5962
 epoch: 83, train_loss: 0.3411, test_loss: 1.4043, test_f1: 0.5711
 epoch: 84, train_loss: 0.3084, test_loss: 1.3001, test_f1: 0.6471
 epoch: 85, train_loss: 0.3154, test_loss: 1.3692, test_f1: 0.6201
 epoch: 86, train_loss: 0.3042, test_loss: 1.3991, test_f1: 0.6254
 epoch: 87, train_loss: 0.2990, test_loss: 1.4882, test_f1: 0.5921
 epoch: 88, train_loss: 0.3131, test_loss: 1.6331, test_f1: 0.5596
 epoch: 89, train_loss: 0.2980, test_loss: 1.7010, test_f1: 0.5426
 epoch: 90, train_loss: 0.2861, test_loss: 1.6892, test_f1: 0.5437
 epoch: 91, train_loss: 0.2756, test_loss: 1.8352, test_f1: 0.5309
 epoch: 92, train_loss: 0.2964, test_loss: 1.8645, test_f1: 0.5399
 epoch: 93, train_loss: 0.2796, test_loss: 1.6453, test_f1: 0.5704
 epoch: 94, train_loss: 0.2689, test_loss: 1.6008, test_f1: 0.5824
 epoch: 95, train_loss: 0.2771, test_loss: 1.4948, test_f1: 0.5923
 epoch: 96, train_loss: 0.3148, test_loss: 1.6999, test_f1: 0.5508
 epoch: 97, train_loss: 0.2957, test_loss: 1.6025, test_f1: 0.5987
 epoch: 98, train_loss: 0.2829, test_loss: 1.5597, test_f1: 0.5773
 epoch: 99, train_loss: 0.2710, test_loss: 1.6448, test_f1: 0.5658
##################ITERATION #7 ****************************************
 epoch: 0, train_loss: 1.2356, test_loss: 1.3800, test_f1: 0.1893
 epoch: 1, train_loss: 1.0811, test_loss: 1.3952, test_f1: 0.1541
 epoch: 2, train_loss: 1.0271, test_loss: 1.4560, test_f1: 0.2475
 epoch: 3, train_loss: 0.9576, test_loss: 1.5234, test_f1: 0.2489
 epoch: 4, train_loss: 0.9683, test_loss: 1.4677, test_f1: 0.2644
 epoch: 5, train_loss: 0.9076, test_loss: 1.4845, test_f1: 0.2588
 epoch: 6, train_loss: 0.9040, test_loss: 1.4986, test_f1: 0.2817
 epoch: 7, train_loss: 0.8813, test_loss: 1.2296, test_f1: 0.4157
 epoch: 8, train_loss: 0.8585, test_loss: 1.1801, test_f1: 0.4519
 epoch: 9, train_loss: 0.8399, test_loss: 1.1744, test_f1: 0.5130
 epoch: 10, train_loss: 0.8181, test_loss: 1.0722, test_f1: 0.5561
 epoch: 11, train_loss: 0.8206, test_loss: 1.0883, test_f1: 0.5963
 epoch: 12, train_loss: 0.7958, test_loss: 1.0561, test_f1: 0.5469
 epoch: 13, train_loss: 0.7771, test_loss: 0.9961, test_f1: 0.6059
 epoch: 14, train_loss: 0.7595, test_loss: 1.0060, test_f1: 0.5625
 epoch: 15, train_loss: 0.7488, test_loss: 1.0022, test_f1: 0.5889
 epoch: 16, train_loss: 0.7296, test_loss: 1.0315, test_f1: 0.5708
 epoch: 17, train_loss: 0.7106, test_loss: 1.0211, test_f1: 0.5822
 epoch: 18, train_loss: 0.6788, test_loss: 1.0341, test_f1: 0.5568
 epoch: 19, train_loss: 0.6786, test_loss: 1.0931, test_f1: 0.5342
 epoch: 20, train_loss: 0.6904, test_loss: 1.0774, test_f1: 0.5323
 epoch: 21, train_loss: 0.6617, test_loss: 1.1012, test_f1: 0.5358
 epoch: 22, train_loss: 0.6821, test_loss: 1.0616, test_f1: 0.6140
 epoch: 23, train_loss: 0.6580, test_loss: 1.1894, test_f1: 0.5583
 epoch: 24, train_loss: 0.6448, test_loss: 1.1039, test_f1: 0.6025
 epoch: 25, train_loss: 0.6377, test_loss: 1.1971, test_f1: 0.5404
 epoch: 26, train_loss: 0.6216, test_loss: 1.1331, test_f1: 0.5409
 epoch: 27, train_loss: 0.6440, test_loss: 1.0798, test_f1: 0.6205
 epoch: 28, train_loss: 0.6367, test_loss: 1.1675, test_f1: 0.5670
 epoch: 29, train_loss: 0.5943, test_loss: 1.0612, test_f1: 0.5596
 epoch: 30, train_loss: 0.5948, test_loss: 1.1654, test_f1: 0.5676
 epoch: 31, train_loss: 0.5977, test_loss: 1.0597, test_f1: 0.6286
 epoch: 32, train_loss: 0.5900, test_loss: 1.5166, test_f1: 0.5010
 epoch: 33, train_loss: 0.5594, test_loss: 1.1918, test_f1: 0.5437
 epoch: 34, train_loss: 0.5596, test_loss: 1.1970, test_f1: 0.5897
 epoch: 35, train_loss: 0.5304, test_loss: 1.2098, test_f1: 0.6104
 epoch: 36, train_loss: 0.5307, test_loss: 1.2269, test_f1: 0.5789
 epoch: 37, train_loss: 0.5371, test_loss: 1.2597, test_f1: 0.5445
 epoch: 38, train_loss: 0.5396, test_loss: 1.2187, test_f1: 0.5886
 epoch: 39, train_loss: 0.5609, test_loss: 1.4075, test_f1: 0.5523
 epoch: 40, train_loss: 0.5759, test_loss: 1.3337, test_f1: 0.5396
 epoch: 41, train_loss: 0.5899, test_loss: 1.3027, test_f1: 0.5577
 epoch: 42, train_loss: 0.5688, test_loss: 1.3443, test_f1: 0.5162
 epoch: 43, train_loss: 0.5536, test_loss: 1.2935, test_f1: 0.5713
 epoch: 44, train_loss: 0.5373, test_loss: 1.3805, test_f1: 0.5493
 epoch: 45, train_loss: 0.5140, test_loss: 1.3946, test_f1: 0.5461
 epoch: 46, train_loss: 0.4917, test_loss: 1.3477, test_f1: 0.6186
 epoch: 47, train_loss: 0.5119, test_loss: 1.3600, test_f1: 0.5611
 epoch: 48, train_loss: 0.5027, test_loss: 1.2399, test_f1: 0.5785
 epoch: 49, train_loss: 0.5472, test_loss: 3.8862, test_f1: 0.3236
 epoch: 50, train_loss: 0.5285, test_loss: 1.2757, test_f1: 0.6012
 epoch: 51, train_loss: 0.4768, test_loss: 1.2311, test_f1: 0.6119
 epoch: 52, train_loss: 0.4736, test_loss: 1.4327, test_f1: 0.5485
 epoch: 53, train_loss: 0.4664, test_loss: 1.3836, test_f1: 0.5912
 epoch: 54, train_loss: 0.4295, test_loss: 1.2768, test_f1: 0.5927
 epoch: 55, train_loss: 0.4427, test_loss: 1.3669, test_f1: 0.5688
 epoch: 56, train_loss: 0.4188, test_loss: 1.4627, test_f1: 0.5381
 epoch: 57, train_loss: 0.4117, test_loss: 1.3752, test_f1: 0.5565
 epoch: 58, train_loss: 0.4322, test_loss: 1.4465, test_f1: 0.5879
 epoch: 59, train_loss: 0.4274, test_loss: 1.3619, test_f1: 0.6059
 epoch: 60, train_loss: 0.4196, test_loss: 1.3641, test_f1: 0.6002
 epoch: 61, train_loss: 0.4239, test_loss: 1.3130, test_f1: 0.6174
 epoch: 62, train_loss: 0.4253, test_loss: 1.3272, test_f1: 0.5675
 epoch: 63, train_loss: 0.4173, test_loss: 1.4334, test_f1: 0.5601
 epoch: 64, train_loss: 0.4270, test_loss: 1.4178, test_f1: 0.5678
 epoch: 65, train_loss: 0.3914, test_loss: 1.3717, test_f1: 0.6053
 epoch: 66, train_loss: 0.3991, test_loss: 1.4615, test_f1: 0.5852
 epoch: 67, train_loss: 0.3770, test_loss: 1.4198, test_f1: 0.5980
 epoch: 68, train_loss: 0.3676, test_loss: 1.4046, test_f1: 0.6125
 epoch: 69, train_loss: 0.3582, test_loss: 1.4765, test_f1: 0.5677
 epoch: 70, train_loss: 0.3560, test_loss: 1.2898, test_f1: 0.5851
 epoch: 71, train_loss: 0.3859, test_loss: 1.3501, test_f1: 0.5958
 epoch: 72, train_loss: 0.3672, test_loss: 1.4878, test_f1: 0.6022
 epoch: 73, train_loss: 0.3451, test_loss: 1.5040, test_f1: 0.6104
 epoch: 74, train_loss: 0.3178, test_loss: 1.5130, test_f1: 0.5841
 epoch: 75, train_loss: 0.3411, test_loss: 1.5541, test_f1: 0.5851
 epoch: 76, train_loss: 0.3580, test_loss: 1.7542, test_f1: 0.5588
 epoch: 77, train_loss: 0.3568, test_loss: 1.5125, test_f1: 0.6063
 epoch: 78, train_loss: 0.3671, test_loss: 1.4781, test_f1: 0.5583
 epoch: 79, train_loss: 0.3935, test_loss: 1.3972, test_f1: 0.6402
 epoch: 80, train_loss: 0.3549, test_loss: 1.5050, test_f1: 0.6017
 epoch: 81, train_loss: 0.3521, test_loss: 1.5239, test_f1: 0.6251
 epoch: 82, train_loss: 0.3371, test_loss: 1.4723, test_f1: 0.6585
 epoch: 83, train_loss: 0.3417, test_loss: 1.5847, test_f1: 0.5815
 epoch: 84, train_loss: 0.3586, test_loss: 1.4936, test_f1: 0.6346
 epoch: 85, train_loss: 0.3713, test_loss: 1.8359, test_f1: 0.5257
 epoch: 86, train_loss: 0.3309, test_loss: 1.4486, test_f1: 0.5890
 epoch: 87, train_loss: 0.3376, test_loss: 1.4528, test_f1: 0.6456
 epoch: 88, train_loss: 0.3373, test_loss: 1.5829, test_f1: 0.6335
 epoch: 89, train_loss: 0.3274, test_loss: 1.7603, test_f1: 0.5543
 epoch: 90, train_loss: 0.3163, test_loss: 1.5831, test_f1: 0.5898
 epoch: 91, train_loss: 0.2959, test_loss: 1.4850, test_f1: 0.6078
 epoch: 92, train_loss: 0.3064, test_loss: 1.3850, test_f1: 0.6305
 epoch: 93, train_loss: 0.3123, test_loss: 1.4410, test_f1: 0.6298
 epoch: 94, train_loss: 0.3248, test_loss: 1.4436, test_f1: 0.6545
 epoch: 95, train_loss: 0.3088, test_loss: 1.4488, test_f1: 0.6318
 epoch: 96, train_loss: 0.2715, test_loss: 1.6680, test_f1: 0.5588
 epoch: 97, train_loss: 0.2719, test_loss: 1.7524, test_f1: 0.5516
 epoch: 98, train_loss: 0.2967, test_loss: 1.6605, test_f1: 0.5878
 epoch: 99, train_loss: 0.2754, test_loss: 1.6607, test_f1: 0.5891
##################ITERATION #8 ****************************************
 epoch: 0, train_loss: 1.3923, test_loss: 1.3346, test_f1: 0.3282
 epoch: 1, train_loss: 1.1169, test_loss: 1.3164, test_f1: 0.2833
 epoch: 2, train_loss: 1.0596, test_loss: 1.3147, test_f1: 0.2654
 epoch: 3, train_loss: 1.0022, test_loss: 1.2694, test_f1: 0.2281
 epoch: 4, train_loss: 0.9480, test_loss: 1.2574, test_f1: 0.2404
 epoch: 5, train_loss: 0.9127, test_loss: 1.1839, test_f1: 0.3648
 epoch: 6, train_loss: 0.8836, test_loss: 1.1434, test_f1: 0.4455
 epoch: 7, train_loss: 0.8698, test_loss: 1.1036, test_f1: 0.4441
 epoch: 8, train_loss: 0.8509, test_loss: 1.0611, test_f1: 0.5192
 epoch: 9, train_loss: 0.8175, test_loss: 1.0263, test_f1: 0.4863
 epoch: 10, train_loss: 0.8153, test_loss: 1.0650, test_f1: 0.5121
 epoch: 11, train_loss: 0.7748, test_loss: 1.0673, test_f1: 0.5065
 epoch: 12, train_loss: 0.7679, test_loss: 1.1257, test_f1: 0.4950
 epoch: 13, train_loss: 0.7613, test_loss: 1.0773, test_f1: 0.5361
 epoch: 14, train_loss: 0.7591, test_loss: 1.1353, test_f1: 0.4948
 epoch: 15, train_loss: 0.7500, test_loss: 1.0714, test_f1: 0.5757
 epoch: 16, train_loss: 0.7526, test_loss: 1.0718, test_f1: 0.5831
 epoch: 17, train_loss: 0.7258, test_loss: 1.3253, test_f1: 0.5915
 epoch: 18, train_loss: 0.7087, test_loss: 1.3503, test_f1: 0.5267
 epoch: 19, train_loss: 0.6658, test_loss: 1.1440, test_f1: 0.5429
 epoch: 20, train_loss: 0.6539, test_loss: 1.3328, test_f1: 0.5461
 epoch: 21, train_loss: 0.6810, test_loss: 1.2148, test_f1: 0.5546
 epoch: 22, train_loss: 0.6695, test_loss: 1.1453, test_f1: 0.5767
 epoch: 23, train_loss: 0.6818, test_loss: 1.1214, test_f1: 0.5776
 epoch: 24, train_loss: 0.6502, test_loss: 1.2464, test_f1: 0.5392
 epoch: 25, train_loss: 0.6597, test_loss: 1.2762, test_f1: 0.5541
 epoch: 26, train_loss: 0.6536, test_loss: 1.0812, test_f1: 0.5572
 epoch: 27, train_loss: 0.6368, test_loss: 1.1203, test_f1: 0.5394
 epoch: 28, train_loss: 0.6109, test_loss: 1.0050, test_f1: 0.5855
 epoch: 29, train_loss: 0.6189, test_loss: 1.2509, test_f1: 0.5440
 epoch: 30, train_loss: 0.5930, test_loss: 1.1742, test_f1: 0.5411
 epoch: 31, train_loss: 0.6079, test_loss: 1.2197, test_f1: 0.5860
 epoch: 32, train_loss: 0.5900, test_loss: 1.1003, test_f1: 0.5846
 epoch: 33, train_loss: 0.5855, test_loss: 1.3643, test_f1: 0.5684
 epoch: 34, train_loss: 0.5976, test_loss: 1.2381, test_f1: 0.5858
 epoch: 35, train_loss: 0.5986, test_loss: 1.2632, test_f1: 0.5261
 epoch: 36, train_loss: 0.5803, test_loss: 1.1792, test_f1: 0.6141
 epoch: 37, train_loss: 0.5733, test_loss: 1.2407, test_f1: 0.5611
 epoch: 38, train_loss: 0.5580, test_loss: 1.1919, test_f1: 0.5555
 epoch: 39, train_loss: 0.5559, test_loss: 1.1126, test_f1: 0.6006
 epoch: 40, train_loss: 0.5326, test_loss: 1.1702, test_f1: 0.5823
 epoch: 41, train_loss: 0.5296, test_loss: 1.2345, test_f1: 0.5856
 epoch: 42, train_loss: 0.5320, test_loss: 1.2151, test_f1: 0.6095
 epoch: 43, train_loss: 0.5347, test_loss: 1.2283, test_f1: 0.5822
 epoch: 44, train_loss: 0.4883, test_loss: 1.3470, test_f1: 0.5610
 epoch: 45, train_loss: 0.5100, test_loss: 1.2548, test_f1: 0.5894
 epoch: 46, train_loss: 0.4745, test_loss: 1.4757, test_f1: 0.5837
 epoch: 47, train_loss: 0.4746, test_loss: 1.4061, test_f1: 0.6042
 epoch: 48, train_loss: 0.4798, test_loss: 1.3536, test_f1: 0.5919
 epoch: 49, train_loss: 0.4800, test_loss: 1.2936, test_f1: 0.5710
 epoch: 50, train_loss: 0.4464, test_loss: 1.3308, test_f1: 0.5778
 epoch: 51, train_loss: 0.4450, test_loss: 1.3166, test_f1: 0.5885
 epoch: 52, train_loss: 0.4060, test_loss: 1.2296, test_f1: 0.6198
 epoch: 53, train_loss: 0.4190, test_loss: 1.2499, test_f1: 0.6269
 epoch: 54, train_loss: 0.4016, test_loss: 1.3797, test_f1: 0.6117
 epoch: 55, train_loss: 0.3841, test_loss: 1.3254, test_f1: 0.6227
 epoch: 56, train_loss: 0.3991, test_loss: 1.3045, test_f1: 0.6256
 epoch: 57, train_loss: 0.3950, test_loss: 1.2362, test_f1: 0.5898
 epoch: 58, train_loss: 0.3829, test_loss: 1.3270, test_f1: 0.6251
 epoch: 59, train_loss: 0.3762, test_loss: 1.4788, test_f1: 0.6073
 epoch: 60, train_loss: 0.3727, test_loss: 1.4874, test_f1: 0.5803
 epoch: 61, train_loss: 0.3734, test_loss: 1.4061, test_f1: 0.6075
 epoch: 62, train_loss: 0.3604, test_loss: 1.3688, test_f1: 0.6245
 epoch: 63, train_loss: 0.3532, test_loss: 1.3067, test_f1: 0.6299
 epoch: 64, train_loss: 0.3466, test_loss: 1.3444, test_f1: 0.6063
 epoch: 65, train_loss: 0.3280, test_loss: 1.3668, test_f1: 0.6175
 epoch: 66, train_loss: 0.3034, test_loss: 1.3919, test_f1: 0.6243
 epoch: 67, train_loss: 0.3321, test_loss: 1.5037, test_f1: 0.5758
 epoch: 68, train_loss: 0.3168, test_loss: 1.4822, test_f1: 0.5862
 epoch: 69, train_loss: 0.3013, test_loss: 1.4793, test_f1: 0.6190
 epoch: 70, train_loss: 0.2942, test_loss: 1.4215, test_f1: 0.5766
 epoch: 71, train_loss: 0.2913, test_loss: 1.4581, test_f1: 0.5945
 epoch: 72, train_loss: 0.3193, test_loss: 1.4876, test_f1: 0.6349
 epoch: 73, train_loss: 0.3279, test_loss: 1.5456, test_f1: 0.5861
 epoch: 74, train_loss: 0.3415, test_loss: 1.4510, test_f1: 0.5846
 epoch: 75, train_loss: 0.3221, test_loss: 1.2902, test_f1: 0.6192
 epoch: 76, train_loss: 0.2947, test_loss: 1.3855, test_f1: 0.6419
 epoch: 77, train_loss: 0.3287, test_loss: 1.5224, test_f1: 0.5627
 epoch: 78, train_loss: 0.3013, test_loss: 1.6417, test_f1: 0.6058
 epoch: 79, train_loss: 0.2966, test_loss: 1.6049, test_f1: 0.5937
 epoch: 80, train_loss: 0.2876, test_loss: 1.5502, test_f1: 0.5664
 epoch: 81, train_loss: 0.2734, test_loss: 1.5171, test_f1: 0.5891
 epoch: 82, train_loss: 0.2581, test_loss: 1.5708, test_f1: 0.5914
 epoch: 83, train_loss: 0.2494, test_loss: 1.6500, test_f1: 0.5503
 epoch: 84, train_loss: 0.2429, test_loss: 1.5318, test_f1: 0.5825
 epoch: 85, train_loss: 0.2593, test_loss: 1.6443, test_f1: 0.5894
 epoch: 86, train_loss: 0.2981, test_loss: 1.6835, test_f1: 0.5834
 epoch: 87, train_loss: 0.3006, test_loss: 1.9550, test_f1: 0.5642
 epoch: 88, train_loss: 0.2677, test_loss: 1.7960, test_f1: 0.5803
 epoch: 89, train_loss: 0.2746, test_loss: 1.6290, test_f1: 0.6075
 epoch: 90, train_loss: 0.2535, test_loss: 1.5174, test_f1: 0.5996
 epoch: 91, train_loss: 0.2845, test_loss: 1.5456, test_f1: 0.5761
 epoch: 92, train_loss: 0.2845, test_loss: 1.5380, test_f1: 0.6082
 epoch: 93, train_loss: 0.2602, test_loss: 1.5137, test_f1: 0.5905
 epoch: 94, train_loss: 0.2636, test_loss: 1.6313, test_f1: 0.5665
 epoch: 95, train_loss: 0.2508, test_loss: 1.6066, test_f1: 0.5921
 epoch: 96, train_loss: 0.2758, test_loss: 1.7679, test_f1: 0.6251
 epoch: 97, train_loss: 0.2696, test_loss: 1.8257, test_f1: 0.5820
 epoch: 98, train_loss: 0.2664, test_loss: 1.7115, test_f1: 0.5837
 epoch: 99, train_loss: 0.2444, test_loss: 1.5995, test_f1: 0.6023
##################ITERATION #9 ****************************************
 epoch: 0, train_loss: 1.3427, test_loss: 1.3525, test_f1: 0.1365
 epoch: 1, train_loss: 1.1011, test_loss: 1.3349, test_f1: 0.2478
 epoch: 2, train_loss: 1.0497, test_loss: 1.3848, test_f1: 0.3292
 epoch: 3, train_loss: 1.0029, test_loss: 1.4446, test_f1: 0.2234
 epoch: 4, train_loss: 0.9619, test_loss: 1.3975, test_f1: 0.3716
 epoch: 5, train_loss: 0.9126, test_loss: 1.3135, test_f1: 0.3808
 epoch: 6, train_loss: 0.9062, test_loss: 1.1398, test_f1: 0.4697
 epoch: 7, train_loss: 0.8499, test_loss: 1.1102, test_f1: 0.4789
 epoch: 8, train_loss: 0.8396, test_loss: 1.1166, test_f1: 0.4761
 epoch: 9, train_loss: 0.8346, test_loss: 1.0493, test_f1: 0.6043
 epoch: 10, train_loss: 0.8394, test_loss: 1.0494, test_f1: 0.5919
 epoch: 11, train_loss: 0.7931, test_loss: 1.0571, test_f1: 0.5485
 epoch: 12, train_loss: 0.8003, test_loss: 1.1731, test_f1: 0.5233
 epoch: 13, train_loss: 0.7638, test_loss: 1.1136, test_f1: 0.5426
 epoch: 14, train_loss: 0.7563, test_loss: 1.1748, test_f1: 0.5077
 epoch: 15, train_loss: 0.7457, test_loss: 1.2410, test_f1: 0.5082
 epoch: 16, train_loss: 0.7248, test_loss: 1.1379, test_f1: 0.5420
 epoch: 17, train_loss: 0.7099, test_loss: 1.2568, test_f1: 0.4761
 epoch: 18, train_loss: 0.7064, test_loss: 1.2741, test_f1: 0.5125
 epoch: 19, train_loss: 0.6793, test_loss: 1.2799, test_f1: 0.5379
 epoch: 20, train_loss: 0.6717, test_loss: 1.1228, test_f1: 0.5698
 epoch: 21, train_loss: 0.6917, test_loss: 1.2040, test_f1: 0.5438
 epoch: 22, train_loss: 0.6527, test_loss: 1.2856, test_f1: 0.5733
 epoch: 23, train_loss: 0.6424, test_loss: 1.3543, test_f1: 0.5532
 epoch: 24, train_loss: 0.6464, test_loss: 1.2545, test_f1: 0.5482
 epoch: 25, train_loss: 0.6195, test_loss: 1.2622, test_f1: 0.5640
 epoch: 26, train_loss: 0.6101, test_loss: 1.2506, test_f1: 0.5435
 epoch: 27, train_loss: 0.6030, test_loss: 1.3236, test_f1: 0.5352
 epoch: 28, train_loss: 0.5954, test_loss: 1.3702, test_f1: 0.5695
 epoch: 29, train_loss: 0.6053, test_loss: 1.3037, test_f1: 0.5443
 epoch: 30, train_loss: 0.6114, test_loss: 1.3457, test_f1: 0.5568
 epoch: 31, train_loss: 0.6111, test_loss: 1.2019, test_f1: 0.6063
 epoch: 32, train_loss: 0.6134, test_loss: 1.1698, test_f1: 0.5673
 epoch: 33, train_loss: 0.5644, test_loss: 1.2360, test_f1: 0.5265
 epoch: 34, train_loss: 0.5835, test_loss: 1.2421, test_f1: 0.5536
 epoch: 35, train_loss: 0.5594, test_loss: 1.1870, test_f1: 0.5804
 epoch: 36, train_loss: 0.5499, test_loss: 1.3753, test_f1: 0.5834
 epoch: 37, train_loss: 0.5518, test_loss: 1.6162, test_f1: 0.4973
 epoch: 38, train_loss: 0.5617, test_loss: 1.5162, test_f1: 0.5445
 epoch: 39, train_loss: 0.5494, test_loss: 1.2170, test_f1: 0.5864
 epoch: 40, train_loss: 0.5632, test_loss: 1.4382, test_f1: 0.5304
 epoch: 41, train_loss: 0.5934, test_loss: 1.3454, test_f1: 0.5663
 epoch: 42, train_loss: 0.5775, test_loss: 1.5225, test_f1: 0.4879
 epoch: 43, train_loss: 0.5405, test_loss: 1.6258, test_f1: 0.5227
 epoch: 44, train_loss: 0.5530, test_loss: 1.4667, test_f1: 0.5974
 epoch: 45, train_loss: 0.5419, test_loss: 1.4883, test_f1: 0.5259
 epoch: 46, train_loss: 0.5329, test_loss: 1.3335, test_f1: 0.6471
 epoch: 47, train_loss: 0.5227, test_loss: 1.3223, test_f1: 0.6101
 epoch: 48, train_loss: 0.5395, test_loss: 1.3546, test_f1: 0.6029
 epoch: 49, train_loss: 0.4972, test_loss: 1.4634, test_f1: 0.5667
 epoch: 50, train_loss: 0.4970, test_loss: 1.2264, test_f1: 0.5737
 epoch: 51, train_loss: 0.4470, test_loss: 1.3199, test_f1: 0.5702
 epoch: 52, train_loss: 0.4462, test_loss: 1.3944, test_f1: 0.5820
 epoch: 53, train_loss: 0.4223, test_loss: 1.4604, test_f1: 0.5821
 epoch: 54, train_loss: 0.4180, test_loss: 1.4734, test_f1: 0.5809
 epoch: 55, train_loss: 0.4050, test_loss: 1.5160, test_f1: 0.6007
 epoch: 56, train_loss: 0.3952, test_loss: 1.5810, test_f1: 0.5822
 epoch: 57, train_loss: 0.3996, test_loss: 1.4758, test_f1: 0.5760
 epoch: 58, train_loss: 0.3873, test_loss: 1.3728, test_f1: 0.5779
 epoch: 59, train_loss: 0.3744, test_loss: 1.4300, test_f1: 0.5825
 epoch: 60, train_loss: 0.3781, test_loss: 1.4509, test_f1: 0.5884
 epoch: 61, train_loss: 0.3653, test_loss: 1.4959, test_f1: 0.5823
 epoch: 62, train_loss: 0.3606, test_loss: 1.5616, test_f1: 0.5582
 epoch: 63, train_loss: 0.3751, test_loss: 1.5930, test_f1: 0.5564
 epoch: 64, train_loss: 0.3802, test_loss: 1.5788, test_f1: 0.5794
 epoch: 65, train_loss: 0.3705, test_loss: 1.5742, test_f1: 0.5890
 epoch: 66, train_loss: 0.3563, test_loss: 1.5292, test_f1: 0.5631
 epoch: 67, train_loss: 0.3547, test_loss: 1.7167, test_f1: 0.5629
 epoch: 68, train_loss: 0.3446, test_loss: 1.7781, test_f1: 0.5717
 epoch: 69, train_loss: 0.3212, test_loss: 1.5957, test_f1: 0.6052
 epoch: 70, train_loss: 0.3421, test_loss: 1.5803, test_f1: 0.6239
 epoch: 71, train_loss: 0.3531, test_loss: 1.6890, test_f1: 0.5768
 epoch: 72, train_loss: 0.3443, test_loss: 1.7675, test_f1: 0.5823
 epoch: 73, train_loss: 0.3440, test_loss: 1.8469, test_f1: 0.5625
 epoch: 74, train_loss: 0.3324, test_loss: 1.8597, test_f1: 0.5837
 epoch: 75, train_loss: 0.3403, test_loss: 1.8292, test_f1: 0.5760
 epoch: 76, train_loss: 0.3234, test_loss: 1.7599, test_f1: 0.5904
 epoch: 77, train_loss: 0.3174, test_loss: 1.9121, test_f1: 0.5732
 epoch: 78, train_loss: 0.3190, test_loss: 1.6344, test_f1: 0.6080
 epoch: 79, train_loss: 0.3665, test_loss: 1.6622, test_f1: 0.6126
 epoch: 80, train_loss: 0.4090, test_loss: 1.9043, test_f1: 0.6060
 epoch: 81, train_loss: 0.3739, test_loss: 1.6726, test_f1: 0.5849
 epoch: 82, train_loss: 0.3575, test_loss: 1.7219, test_f1: 0.5421
 epoch: 83, train_loss: 0.3380, test_loss: 1.6594, test_f1: 0.5629
 epoch: 84, train_loss: 0.3302, test_loss: 1.6719, test_f1: 0.5930
 epoch: 85, train_loss: 0.3494, test_loss: 1.7647, test_f1: 0.5997
 epoch: 86, train_loss: 0.3306, test_loss: 1.7716, test_f1: 0.5434
 epoch: 87, train_loss: 0.2965, test_loss: 1.7962, test_f1: 0.5644
 epoch: 88, train_loss: 0.2804, test_loss: 1.7720, test_f1: 0.5971
 epoch: 89, train_loss: 0.2859, test_loss: 1.8314, test_f1: 0.5825
 epoch: 90, train_loss: 0.2689, test_loss: 1.8819, test_f1: 0.5980
 epoch: 91, train_loss: 0.2984, test_loss: 2.0097, test_f1: 0.5680
 epoch: 92, train_loss: 0.2870, test_loss: 1.9023, test_f1: 0.5675
 epoch: 93, train_loss: 0.2526, test_loss: 1.8963, test_f1: 0.5973
 epoch: 94, train_loss: 0.2512, test_loss: 1.9457, test_f1: 0.5524
 epoch: 95, train_loss: 0.2743, test_loss: 1.8113, test_f1: 0.5808
 epoch: 96, train_loss: 0.2557, test_loss: 1.8403, test_f1: 0.5906
 epoch: 97, train_loss: 0.2696, test_loss: 1.9241, test_f1: 0.5926
 epoch: 98, train_loss: 0.2647, test_loss: 2.0832, test_f1: 0.5815
 epoch: 99, train_loss: 0.2592, test_loss: 1.8771, test_f1: 0.5671

Training completed in 338.57 seconds
Best F1: 0.6668 at epoch 83
Mean F1 across iterations: 0.6446  0.0111
========================FINAL RESULTS================================
FEGIN weighted F1: 0.6668  0.0111
python main.py --data ltspice_demos --representation component_pin --model FEGIN --layers 6 --hiddens 64 --batch_size 256 --lr 0.001 --emb_size 128 --epochs 100 --save_appendix component_pin_L6_H64_BS256_LR0.001_E128 --no_val
-----



STDERR:
  File "main.py", line 370, in <module>
    main()
  File "main.py", line 254, in main
    dataset = dataset_class(
  File "/home/philip/projects/ltspice_examples_code_repo/Circuit-Completion-Using-GNNs/component_classification_with_link_prediction_head/evaluation/FEGIN/kernel/circuit_datasets.py", line 15, in __init__
    self.data, self.slices = torch.load(self.processed_paths[0])
  File "/home/philip/.local/lib/python3.8/site-packages/torch/serialization.py", line 1040, in load
    warnings.warn(
  File "/usr/lib/python3.8/warnings.py", line 109, in _showwarnmsg
    sw(msg.message, msg.category, msg.filename, msg.lineno,
  File "main.py", line 47, in warn_with_traceback
    traceback.print_stack(file=log)
/home/philip/projects/ltspice_examples_code_repo/Circuit-Completion-Using-GNNs/component_classification_with_link_prediction_head/evaluation/FEGIN/kernel/circuit_datasets.py:15: FutureWarning: You are using `torch.load` with `weights_only=False` (the current default value), which uses the default pickle module implicitly. It is possible to construct malicious pickle data which will execute arbitrary code during unpickling (See https://github.com/pytorch/pytorch/blob/main/SECURITY.md#untrusted-models for more details). In a future release, the default value for `weights_only` will be flipped to `True`. This limits the functions that could be executed during unpickling. Arbitrary objects will no longer be allowed to be loaded via this mode unless they are explicitly allowlisted by the user via `torch.serialization.add_safe_globals`. We recommend you start setting `weights_only=True` for any use case where you don't have full control of the loaded file. Please open an issue on GitHub for any issues related to this experimental feature.
  self.data, self.slices = torch.load(self.processed_paths[0])
