STDOUT:
Results will be saved in /home/philip/projects/ltspice_examples_code_repo/Circuit-Completion-Using-GNNs/component_classification_with_link_prediction_head/evaluation/FEGIN/results/model_FEGIN_dataset_ltspice_examples
Command line input: python main.py --data ltspice_examples --representation component_net --model FEGIN --layers 6 --hiddens 64 --batch_size 256 --lr 0.0001 --emb_size 512 --epochs 100 --save_appendix component_net_L6_H64_BS256_LR0.0001_E512 --no_val
 is saved.
-----
ltspice_examples - FEGIN
Using 6 layers, 64 hidden units, h = 2
Loading component_net representation dataset
ENTERED
Training FEGIN on component_net representation
Train: 3558, Test: 846
##################ITERATION #0 ****************************************
 epoch: 0, train_loss: 1.3994, test_loss: 1.3987, test_f1: 0.0793
 epoch: 1, train_loss: 1.3881, test_loss: 1.3938, test_f1: 0.0793
 epoch: 2, train_loss: 1.3800, test_loss: 1.3858, test_f1: 0.0793
 epoch: 3, train_loss: 1.3715, test_loss: 1.3749, test_f1: 0.0793
 epoch: 4, train_loss: 1.3607, test_loss: 1.3575, test_f1: 0.1636
 epoch: 5, train_loss: 1.3492, test_loss: 1.3406, test_f1: 0.2089
 epoch: 6, train_loss: 1.3364, test_loss: 1.3236, test_f1: 0.2300
 epoch: 7, train_loss: 1.3222, test_loss: 1.3071, test_f1: 0.2589
 epoch: 8, train_loss: 1.3080, test_loss: 1.2899, test_f1: 0.3194
 epoch: 9, train_loss: 1.2936, test_loss: 1.2759, test_f1: 0.3414
 epoch: 10, train_loss: 1.2787, test_loss: 1.2614, test_f1: 0.3373
 epoch: 11, train_loss: 1.2653, test_loss: 1.2457, test_f1: 0.3253
 epoch: 12, train_loss: 1.2524, test_loss: 1.2311, test_f1: 0.3221
 epoch: 13, train_loss: 1.2414, test_loss: 1.2188, test_f1: 0.2809
 epoch: 14, train_loss: 1.2291, test_loss: 1.2067, test_f1: 0.2866
 epoch: 15, train_loss: 1.2188, test_loss: 1.1957, test_f1: 0.2922
 epoch: 16, train_loss: 1.2116, test_loss: 1.1834, test_f1: 0.2970
 epoch: 17, train_loss: 1.2015, test_loss: 1.1753, test_f1: 0.3041
 epoch: 18, train_loss: 1.1907, test_loss: 1.1626, test_f1: 0.3093
 epoch: 19, train_loss: 1.1787, test_loss: 1.1548, test_f1: 0.3218
 epoch: 20, train_loss: 1.1666, test_loss: 1.1405, test_f1: 0.3241
 epoch: 21, train_loss: 1.1597, test_loss: 1.1301, test_f1: 0.3413
 epoch: 22, train_loss: 1.1499, test_loss: 1.1187, test_f1: 0.3692
 epoch: 23, train_loss: 1.1364, test_loss: 1.1135, test_f1: 0.4108
 epoch: 24, train_loss: 1.1257, test_loss: 1.1053, test_f1: 0.4298
 epoch: 25, train_loss: 1.1149, test_loss: 1.0907, test_f1: 0.4599
 epoch: 26, train_loss: 1.1054, test_loss: 1.0788, test_f1: 0.4767
 epoch: 27, train_loss: 1.0970, test_loss: 1.0690, test_f1: 0.4738
 epoch: 28, train_loss: 1.0815, test_loss: 1.0604, test_f1: 0.5181
 epoch: 29, train_loss: 1.0721, test_loss: 1.0511, test_f1: 0.5212
 epoch: 30, train_loss: 1.0649, test_loss: 1.0453, test_f1: 0.5482
 epoch: 31, train_loss: 1.0520, test_loss: 1.0342, test_f1: 0.5456
 epoch: 32, train_loss: 1.0468, test_loss: 1.0220, test_f1: 0.5330
 epoch: 33, train_loss: 1.0323, test_loss: 1.0121, test_f1: 0.5472
 epoch: 34, train_loss: 1.0244, test_loss: 1.0065, test_f1: 0.5313
 epoch: 35, train_loss: 1.0123, test_loss: 0.9998, test_f1: 0.5353
 epoch: 36, train_loss: 0.9986, test_loss: 0.9844, test_f1: 0.5497
 epoch: 37, train_loss: 0.9944, test_loss: 0.9809, test_f1: 0.5403
 epoch: 38, train_loss: 0.9831, test_loss: 0.9696, test_f1: 0.5279
 epoch: 39, train_loss: 0.9713, test_loss: 0.9569, test_f1: 0.5412
 epoch: 40, train_loss: 0.9670, test_loss: 0.9588, test_f1: 0.5468
 epoch: 41, train_loss: 0.9594, test_loss: 0.9475, test_f1: 0.5422
 epoch: 42, train_loss: 0.9384, test_loss: 0.9403, test_f1: 0.5497
 epoch: 43, train_loss: 0.9264, test_loss: 0.9347, test_f1: 0.5495
 epoch: 44, train_loss: 0.9251, test_loss: 0.9277, test_f1: 0.5618
 epoch: 45, train_loss: 0.9197, test_loss: 0.9220, test_f1: 0.5371
 epoch: 46, train_loss: 0.8998, test_loss: 0.9144, test_f1: 0.5432
 epoch: 47, train_loss: 0.8928, test_loss: 0.9248, test_f1: 0.5536
 epoch: 48, train_loss: 0.8863, test_loss: 0.9027, test_f1: 0.5596
 epoch: 49, train_loss: 0.8836, test_loss: 0.9141, test_f1: 0.5492
 epoch: 50, train_loss: 0.8825, test_loss: 0.8968, test_f1: 0.5667
 epoch: 51, train_loss: 0.8718, test_loss: 0.9041, test_f1: 0.5577
 epoch: 52, train_loss: 0.8667, test_loss: 0.9023, test_f1: 0.5644
 epoch: 53, train_loss: 0.8555, test_loss: 0.8955, test_f1: 0.5691
 epoch: 54, train_loss: 0.8481, test_loss: 0.9007, test_f1: 0.5636
 epoch: 55, train_loss: 0.8567, test_loss: 0.8943, test_f1: 0.5603
 epoch: 56, train_loss: 0.8436, test_loss: 0.8918, test_f1: 0.5644
 epoch: 57, train_loss: 0.8418, test_loss: 0.8955, test_f1: 0.5562
 epoch: 58, train_loss: 0.8454, test_loss: 0.9030, test_f1: 0.5519
 epoch: 59, train_loss: 0.8412, test_loss: 0.8876, test_f1: 0.5662
 epoch: 60, train_loss: 0.8405, test_loss: 0.9009, test_f1: 0.5533
 epoch: 61, train_loss: 0.8229, test_loss: 0.8969, test_f1: 0.5622
 epoch: 62, train_loss: 0.8323, test_loss: 0.8913, test_f1: 0.5713
 epoch: 63, train_loss: 0.8255, test_loss: 0.8950, test_f1: 0.5584
 epoch: 64, train_loss: 0.8211, test_loss: 0.8862, test_f1: 0.5573
 epoch: 65, train_loss: 0.8185, test_loss: 0.8992, test_f1: 0.5644
 epoch: 66, train_loss: 0.8106, test_loss: 0.8915, test_f1: 0.5621
 epoch: 67, train_loss: 0.8044, test_loss: 0.9033, test_f1: 0.5593
 epoch: 68, train_loss: 0.8080, test_loss: 0.8972, test_f1: 0.5530
 epoch: 69, train_loss: 0.8101, test_loss: 0.8927, test_f1: 0.5665
 epoch: 70, train_loss: 0.8082, test_loss: 0.9015, test_f1: 0.5610
 epoch: 71, train_loss: 0.7934, test_loss: 0.9003, test_f1: 0.5474
 epoch: 72, train_loss: 0.8029, test_loss: 0.8986, test_f1: 0.5622
 epoch: 73, train_loss: 0.7951, test_loss: 0.9087, test_f1: 0.5616
 epoch: 74, train_loss: 0.8020, test_loss: 0.9002, test_f1: 0.5573
 epoch: 75, train_loss: 0.7976, test_loss: 0.9000, test_f1: 0.5562
 epoch: 76, train_loss: 0.7893, test_loss: 0.9034, test_f1: 0.5516
 epoch: 77, train_loss: 0.8080, test_loss: 0.9026, test_f1: 0.5612
 epoch: 78, train_loss: 0.7950, test_loss: 0.9109, test_f1: 0.5452
 epoch: 79, train_loss: 0.7982, test_loss: 0.9007, test_f1: 0.5577
 epoch: 80, train_loss: 0.7795, test_loss: 0.9068, test_f1: 0.5585
 epoch: 81, train_loss: 0.7853, test_loss: 0.9008, test_f1: 0.5523
 epoch: 82, train_loss: 0.7818, test_loss: 0.8944, test_f1: 0.5631
 epoch: 83, train_loss: 0.7861, test_loss: 0.9183, test_f1: 0.5433
 epoch: 84, train_loss: 0.7762, test_loss: 0.9027, test_f1: 0.5600
 epoch: 85, train_loss: 0.7798, test_loss: 0.9071, test_f1: 0.5578
 epoch: 86, train_loss: 0.7901, test_loss: 0.8997, test_f1: 0.5570
 epoch: 87, train_loss: 0.7660, test_loss: 0.9119, test_f1: 0.5591
 epoch: 88, train_loss: 0.7727, test_loss: 0.9011, test_f1: 0.5605
 epoch: 89, train_loss: 0.7650, test_loss: 0.9104, test_f1: 0.5587
 epoch: 90, train_loss: 0.7776, test_loss: 0.9163, test_f1: 0.5599
 epoch: 91, train_loss: 0.7621, test_loss: 0.9186, test_f1: 0.5531
 epoch: 92, train_loss: 0.7632, test_loss: 0.9205, test_f1: 0.5521
 epoch: 93, train_loss: 0.7574, test_loss: 0.9266, test_f1: 0.5493
 epoch: 94, train_loss: 0.7590, test_loss: 0.9199, test_f1: 0.5510
 epoch: 95, train_loss: 0.7617, test_loss: 0.9269, test_f1: 0.5379
 epoch: 96, train_loss: 0.7568, test_loss: 0.9278, test_f1: 0.5372
 epoch: 97, train_loss: 0.7510, test_loss: 0.9246, test_f1: 0.5599
 epoch: 98, train_loss: 0.7570, test_loss: 0.9201, test_f1: 0.5570
 epoch: 99, train_loss: 0.7530, test_loss: 0.9232, test_f1: 0.5547
##################ITERATION #1 ****************************************
 epoch: 0, train_loss: 1.3566, test_loss: 1.3845, test_f1: 0.1004
 epoch: 1, train_loss: 1.3240, test_loss: 1.3682, test_f1: 0.2319
 epoch: 2, train_loss: 1.3066, test_loss: 1.3356, test_f1: 0.2390
 epoch: 3, train_loss: 1.2878, test_loss: 1.3076, test_f1: 0.2319
 epoch: 4, train_loss: 1.2663, test_loss: 1.2709, test_f1: 0.2469
 epoch: 5, train_loss: 1.2481, test_loss: 1.2412, test_f1: 0.3326
 epoch: 6, train_loss: 1.2281, test_loss: 1.2142, test_f1: 0.3704
 epoch: 7, train_loss: 1.2144, test_loss: 1.1876, test_f1: 0.3799
 epoch: 8, train_loss: 1.1957, test_loss: 1.1669, test_f1: 0.3880
 epoch: 9, train_loss: 1.1796, test_loss: 1.1468, test_f1: 0.3912
 epoch: 10, train_loss: 1.1638, test_loss: 1.1213, test_f1: 0.4113
 epoch: 11, train_loss: 1.1465, test_loss: 1.1061, test_f1: 0.4219
 epoch: 12, train_loss: 1.1325, test_loss: 1.0904, test_f1: 0.4259
 epoch: 13, train_loss: 1.1116, test_loss: 1.0662, test_f1: 0.4287
 epoch: 14, train_loss: 1.0978, test_loss: 1.0570, test_f1: 0.4557
 epoch: 15, train_loss: 1.0812, test_loss: 1.0412, test_f1: 0.4528
 epoch: 16, train_loss: 1.0716, test_loss: 1.0248, test_f1: 0.4767
 epoch: 17, train_loss: 1.0517, test_loss: 1.0137, test_f1: 0.4732
 epoch: 18, train_loss: 1.0428, test_loss: 1.0054, test_f1: 0.4854
 epoch: 19, train_loss: 1.0331, test_loss: 0.9952, test_f1: 0.4839
 epoch: 20, train_loss: 1.0156, test_loss: 0.9771, test_f1: 0.4917
 epoch: 21, train_loss: 1.0057, test_loss: 0.9773, test_f1: 0.4824
 epoch: 22, train_loss: 0.9916, test_loss: 0.9637, test_f1: 0.4886
 epoch: 23, train_loss: 0.9831, test_loss: 0.9564, test_f1: 0.4953
 epoch: 24, train_loss: 0.9645, test_loss: 0.9511, test_f1: 0.4833
 epoch: 25, train_loss: 0.9557, test_loss: 0.9440, test_f1: 0.4931
 epoch: 26, train_loss: 0.9487, test_loss: 0.9408, test_f1: 0.4973
 epoch: 27, train_loss: 0.9368, test_loss: 0.9405, test_f1: 0.4962
 epoch: 28, train_loss: 0.9279, test_loss: 0.9292, test_f1: 0.4929
 epoch: 29, train_loss: 0.9169, test_loss: 0.9380, test_f1: 0.4967
 epoch: 30, train_loss: 0.9043, test_loss: 0.9309, test_f1: 0.5013
 epoch: 31, train_loss: 0.9030, test_loss: 0.9257, test_f1: 0.5049
 epoch: 32, train_loss: 0.8956, test_loss: 0.9185, test_f1: 0.5028
 epoch: 33, train_loss: 0.8755, test_loss: 0.9151, test_f1: 0.5090
 epoch: 34, train_loss: 0.8843, test_loss: 0.9296, test_f1: 0.5080
 epoch: 35, train_loss: 0.8736, test_loss: 0.9088, test_f1: 0.5054
 epoch: 36, train_loss: 0.8661, test_loss: 0.9250, test_f1: 0.5136
 epoch: 37, train_loss: 0.8657, test_loss: 0.9249, test_f1: 0.5111
 epoch: 38, train_loss: 0.8543, test_loss: 0.9118, test_f1: 0.5222
 epoch: 39, train_loss: 0.8468, test_loss: 0.9201, test_f1: 0.5200
 epoch: 40, train_loss: 0.8438, test_loss: 0.9091, test_f1: 0.5225
 epoch: 41, train_loss: 0.8434, test_loss: 0.9075, test_f1: 0.5323
 epoch: 42, train_loss: 0.8287, test_loss: 0.9072, test_f1: 0.5196
 epoch: 43, train_loss: 0.8242, test_loss: 0.8995, test_f1: 0.5219
 epoch: 44, train_loss: 0.8205, test_loss: 0.9138, test_f1: 0.5255
 epoch: 45, train_loss: 0.8248, test_loss: 0.9249, test_f1: 0.5071
 epoch: 46, train_loss: 0.8129, test_loss: 0.9170, test_f1: 0.5391
 epoch: 47, train_loss: 0.8135, test_loss: 0.8963, test_f1: 0.5298
 epoch: 48, train_loss: 0.8034, test_loss: 0.9168, test_f1: 0.5171
 epoch: 49, train_loss: 0.8012, test_loss: 0.8999, test_f1: 0.5315
 epoch: 50, train_loss: 0.7982, test_loss: 0.9251, test_f1: 0.5223
 epoch: 51, train_loss: 0.7980, test_loss: 0.9182, test_f1: 0.5250
 epoch: 52, train_loss: 0.7814, test_loss: 0.9063, test_f1: 0.5275
 epoch: 53, train_loss: 0.7856, test_loss: 0.9196, test_f1: 0.5277
 epoch: 54, train_loss: 0.7846, test_loss: 0.9393, test_f1: 0.5297
 epoch: 55, train_loss: 0.7782, test_loss: 0.9236, test_f1: 0.5310
 epoch: 56, train_loss: 0.7804, test_loss: 0.9180, test_f1: 0.5342
 epoch: 57, train_loss: 0.7756, test_loss: 0.9195, test_f1: 0.5256
 epoch: 58, train_loss: 0.7800, test_loss: 0.9147, test_f1: 0.5271
 epoch: 59, train_loss: 0.7747, test_loss: 0.9168, test_f1: 0.5298
 epoch: 60, train_loss: 0.7700, test_loss: 0.9079, test_f1: 0.5294
 epoch: 61, train_loss: 0.7711, test_loss: 0.9255, test_f1: 0.5244
 epoch: 62, train_loss: 0.7699, test_loss: 0.9144, test_f1: 0.5303
 epoch: 63, train_loss: 0.7699, test_loss: 0.9153, test_f1: 0.5310
 epoch: 64, train_loss: 0.7651, test_loss: 0.9262, test_f1: 0.5220
 epoch: 65, train_loss: 0.7679, test_loss: 0.9363, test_f1: 0.5272
 epoch: 66, train_loss: 0.7546, test_loss: 0.9139, test_f1: 0.5362
 epoch: 67, train_loss: 0.7483, test_loss: 0.9227, test_f1: 0.5289
 epoch: 68, train_loss: 0.7628, test_loss: 0.9365, test_f1: 0.5414
 epoch: 69, train_loss: 0.7617, test_loss: 0.9345, test_f1: 0.5386
 epoch: 70, train_loss: 0.7545, test_loss: 0.9163, test_f1: 0.5281
 epoch: 71, train_loss: 0.7533, test_loss: 0.9192, test_f1: 0.5278
 epoch: 72, train_loss: 0.7536, test_loss: 0.9333, test_f1: 0.5268
 epoch: 73, train_loss: 0.7433, test_loss: 0.9319, test_f1: 0.5322
 epoch: 74, train_loss: 0.7491, test_loss: 0.9249, test_f1: 0.5206
 epoch: 75, train_loss: 0.7452, test_loss: 0.9374, test_f1: 0.5383
 epoch: 76, train_loss: 0.7533, test_loss: 0.9459, test_f1: 0.5366
 epoch: 77, train_loss: 0.7499, test_loss: 0.9398, test_f1: 0.5294
 epoch: 78, train_loss: 0.7411, test_loss: 0.9383, test_f1: 0.5308
 epoch: 79, train_loss: 0.7403, test_loss: 0.9384, test_f1: 0.5339
 epoch: 80, train_loss: 0.7367, test_loss: 0.9399, test_f1: 0.5273
 epoch: 81, train_loss: 0.7314, test_loss: 0.9393, test_f1: 0.5294
 epoch: 82, train_loss: 0.7390, test_loss: 0.9403, test_f1: 0.5390
 epoch: 83, train_loss: 0.7330, test_loss: 0.9451, test_f1: 0.5380
 epoch: 84, train_loss: 0.7414, test_loss: 0.9383, test_f1: 0.5424
 epoch: 85, train_loss: 0.7291, test_loss: 0.9397, test_f1: 0.5361
 epoch: 86, train_loss: 0.7301, test_loss: 0.9320, test_f1: 0.5402
 epoch: 87, train_loss: 0.7305, test_loss: 0.9363, test_f1: 0.5484
 epoch: 88, train_loss: 0.7341, test_loss: 0.9385, test_f1: 0.5365
 epoch: 89, train_loss: 0.7230, test_loss: 0.9356, test_f1: 0.5502
 epoch: 90, train_loss: 0.7387, test_loss: 0.9332, test_f1: 0.5450
 epoch: 91, train_loss: 0.7233, test_loss: 0.9252, test_f1: 0.5620
 epoch: 92, train_loss: 0.7200, test_loss: 0.9375, test_f1: 0.5526
 epoch: 93, train_loss: 0.7150, test_loss: 0.9337, test_f1: 0.5593
 epoch: 94, train_loss: 0.7205, test_loss: 0.9364, test_f1: 0.5556
 epoch: 95, train_loss: 0.7271, test_loss: 0.9649, test_f1: 0.5476
 epoch: 96, train_loss: 0.7226, test_loss: 0.9497, test_f1: 0.5453
 epoch: 97, train_loss: 0.7198, test_loss: 0.9518, test_f1: 0.5698
 epoch: 98, train_loss: 0.7187, test_loss: 0.9550, test_f1: 0.5587
 epoch: 99, train_loss: 0.7108, test_loss: 0.9505, test_f1: 0.5669
##################ITERATION #2 ****************************************
 epoch: 0, train_loss: 1.3074, test_loss: 1.3574, test_f1: 0.2270
 epoch: 1, train_loss: 1.2668, test_loss: 1.3226, test_f1: 0.2270
 epoch: 2, train_loss: 1.2458, test_loss: 1.2937, test_f1: 0.2270
 epoch: 3, train_loss: 1.2283, test_loss: 1.2764, test_f1: 0.2265
 epoch: 4, train_loss: 1.2098, test_loss: 1.2320, test_f1: 0.3301
 epoch: 5, train_loss: 1.1919, test_loss: 1.1935, test_f1: 0.3922
 epoch: 6, train_loss: 1.1753, test_loss: 1.1534, test_f1: 0.4137
 epoch: 7, train_loss: 1.1563, test_loss: 1.1282, test_f1: 0.4284
 epoch: 8, train_loss: 1.1401, test_loss: 1.1082, test_f1: 0.4389
 epoch: 9, train_loss: 1.1188, test_loss: 1.0904, test_f1: 0.4452
 epoch: 10, train_loss: 1.1020, test_loss: 1.0691, test_f1: 0.4537
 epoch: 11, train_loss: 1.0850, test_loss: 1.0503, test_f1: 0.4564
 epoch: 12, train_loss: 1.0731, test_loss: 1.0320, test_f1: 0.4599
 epoch: 13, train_loss: 1.0551, test_loss: 1.0209, test_f1: 0.4637
 epoch: 14, train_loss: 1.0455, test_loss: 0.9992, test_f1: 0.4696
 epoch: 15, train_loss: 1.0256, test_loss: 0.9959, test_f1: 0.4646
 epoch: 16, train_loss: 1.0159, test_loss: 0.9862, test_f1: 0.4694
 epoch: 17, train_loss: 1.0063, test_loss: 0.9738, test_f1: 0.4826
 epoch: 18, train_loss: 0.9921, test_loss: 0.9580, test_f1: 0.4942
 epoch: 19, train_loss: 0.9846, test_loss: 0.9590, test_f1: 0.4962
 epoch: 20, train_loss: 0.9744, test_loss: 0.9521, test_f1: 0.4989
 epoch: 21, train_loss: 0.9596, test_loss: 0.9421, test_f1: 0.5046
 epoch: 22, train_loss: 0.9525, test_loss: 0.9372, test_f1: 0.4993
 epoch: 23, train_loss: 0.9528, test_loss: 0.9304, test_f1: 0.5081
 epoch: 24, train_loss: 0.9371, test_loss: 0.9238, test_f1: 0.5030
 epoch: 25, train_loss: 0.9282, test_loss: 0.9292, test_f1: 0.5077
 epoch: 26, train_loss: 0.9263, test_loss: 0.9256, test_f1: 0.5070
 epoch: 27, train_loss: 0.9126, test_loss: 0.9269, test_f1: 0.5012
 epoch: 28, train_loss: 0.9091, test_loss: 0.9380, test_f1: 0.4995
 epoch: 29, train_loss: 0.9046, test_loss: 0.9256, test_f1: 0.5046
 epoch: 30, train_loss: 0.9024, test_loss: 0.9235, test_f1: 0.5028
 epoch: 31, train_loss: 0.8952, test_loss: 0.9262, test_f1: 0.5113
 epoch: 32, train_loss: 0.8798, test_loss: 0.9169, test_f1: 0.5163
 epoch: 33, train_loss: 0.8758, test_loss: 0.9248, test_f1: 0.5066
 epoch: 34, train_loss: 0.8724, test_loss: 0.9359, test_f1: 0.5178
 epoch: 35, train_loss: 0.8692, test_loss: 0.9051, test_f1: 0.5260
 epoch: 36, train_loss: 0.8663, test_loss: 0.9157, test_f1: 0.5229
 epoch: 37, train_loss: 0.8597, test_loss: 0.9142, test_f1: 0.5282
 epoch: 38, train_loss: 0.8596, test_loss: 0.9220, test_f1: 0.5151
 epoch: 39, train_loss: 0.8551, test_loss: 0.9181, test_f1: 0.5186
 epoch: 40, train_loss: 0.8537, test_loss: 0.9159, test_f1: 0.5153
 epoch: 41, train_loss: 0.8544, test_loss: 0.9311, test_f1: 0.5229
 epoch: 42, train_loss: 0.8592, test_loss: 0.9169, test_f1: 0.5231
 epoch: 43, train_loss: 0.8341, test_loss: 0.9069, test_f1: 0.5385
 epoch: 44, train_loss: 0.8277, test_loss: 0.9068, test_f1: 0.5242
 epoch: 45, train_loss: 0.8317, test_loss: 0.9266, test_f1: 0.5281
 epoch: 46, train_loss: 0.8260, test_loss: 0.9241, test_f1: 0.5152
 epoch: 47, train_loss: 0.8211, test_loss: 0.9317, test_f1: 0.5142
 epoch: 48, train_loss: 0.8180, test_loss: 0.9226, test_f1: 0.5183
 epoch: 49, train_loss: 0.8092, test_loss: 0.9251, test_f1: 0.5231
 epoch: 50, train_loss: 0.8050, test_loss: 0.9293, test_f1: 0.5237
 epoch: 51, train_loss: 0.7953, test_loss: 0.9228, test_f1: 0.5165
 epoch: 52, train_loss: 0.7959, test_loss: 0.9079, test_f1: 0.5194
 epoch: 53, train_loss: 0.8012, test_loss: 0.9117, test_f1: 0.5222
 epoch: 54, train_loss: 0.8036, test_loss: 0.9167, test_f1: 0.5154
 epoch: 55, train_loss: 0.7951, test_loss: 0.9215, test_f1: 0.5230
 epoch: 56, train_loss: 0.7920, test_loss: 0.9345, test_f1: 0.5137
 epoch: 57, train_loss: 0.7926, test_loss: 0.9216, test_f1: 0.5251
 epoch: 58, train_loss: 0.7900, test_loss: 0.9207, test_f1: 0.5167
 epoch: 59, train_loss: 0.7890, test_loss: 0.9155, test_f1: 0.5304
 epoch: 60, train_loss: 0.7858, test_loss: 0.9206, test_f1: 0.5209
 epoch: 61, train_loss: 0.7909, test_loss: 0.9214, test_f1: 0.5318
 epoch: 62, train_loss: 0.7784, test_loss: 0.9262, test_f1: 0.5289
 epoch: 63, train_loss: 0.7841, test_loss: 0.9249, test_f1: 0.5310
 epoch: 64, train_loss: 0.7777, test_loss: 0.9302, test_f1: 0.5229
 epoch: 65, train_loss: 0.7749, test_loss: 0.9256, test_f1: 0.5283
 epoch: 66, train_loss: 0.7772, test_loss: 0.9198, test_f1: 0.5360
 epoch: 67, train_loss: 0.7715, test_loss: 0.9138, test_f1: 0.5318
 epoch: 68, train_loss: 0.7657, test_loss: 0.9233, test_f1: 0.5273
 epoch: 69, train_loss: 0.7723, test_loss: 0.9358, test_f1: 0.5211
 epoch: 70, train_loss: 0.7652, test_loss: 0.9309, test_f1: 0.5345
 epoch: 71, train_loss: 0.7631, test_loss: 0.9245, test_f1: 0.5230
 epoch: 72, train_loss: 0.7671, test_loss: 0.9157, test_f1: 0.5385
 epoch: 73, train_loss: 0.7675, test_loss: 0.9232, test_f1: 0.5358
 epoch: 74, train_loss: 0.7665, test_loss: 0.9257, test_f1: 0.5436
 epoch: 75, train_loss: 0.7529, test_loss: 0.9258, test_f1: 0.5446
 epoch: 76, train_loss: 0.7578, test_loss: 0.9222, test_f1: 0.5438
 epoch: 77, train_loss: 0.7568, test_loss: 0.9322, test_f1: 0.5465
 epoch: 78, train_loss: 0.7464, test_loss: 0.9249, test_f1: 0.5379
 epoch: 79, train_loss: 0.7514, test_loss: 0.9298, test_f1: 0.5375
 epoch: 80, train_loss: 0.7481, test_loss: 0.9339, test_f1: 0.5351
 epoch: 81, train_loss: 0.7474, test_loss: 0.9328, test_f1: 0.5509
 epoch: 82, train_loss: 0.7500, test_loss: 0.9381, test_f1: 0.5513
 epoch: 83, train_loss: 0.7448, test_loss: 0.9330, test_f1: 0.5444
 epoch: 84, train_loss: 0.7476, test_loss: 0.9321, test_f1: 0.5599
 epoch: 85, train_loss: 0.7409, test_loss: 0.9392, test_f1: 0.5717
 epoch: 86, train_loss: 0.7451, test_loss: 0.9386, test_f1: 0.5440
 epoch: 87, train_loss: 0.7316, test_loss: 0.9471, test_f1: 0.5651
 epoch: 88, train_loss: 0.7373, test_loss: 0.9398, test_f1: 0.5581
 epoch: 89, train_loss: 0.7346, test_loss: 0.9376, test_f1: 0.5685
 epoch: 90, train_loss: 0.7419, test_loss: 0.9487, test_f1: 0.5511
 epoch: 91, train_loss: 0.7315, test_loss: 0.9501, test_f1: 0.5389
 epoch: 92, train_loss: 0.7404, test_loss: 0.9433, test_f1: 0.5551
 epoch: 93, train_loss: 0.7359, test_loss: 0.9339, test_f1: 0.5765
 epoch: 94, train_loss: 0.7301, test_loss: 0.9353, test_f1: 0.5586
 epoch: 95, train_loss: 0.7370, test_loss: 0.9383, test_f1: 0.5529
 epoch: 96, train_loss: 0.7306, test_loss: 0.9374, test_f1: 0.5737
 epoch: 97, train_loss: 0.7247, test_loss: 0.9295, test_f1: 0.5637
 epoch: 98, train_loss: 0.7263, test_loss: 0.9417, test_f1: 0.5780
 epoch: 99, train_loss: 0.7269, test_loss: 0.9325, test_f1: 0.5747
##################ITERATION #3 ****************************************
 epoch: 0, train_loss: 1.3313, test_loss: 1.3915, test_f1: 0.0304
 epoch: 1, train_loss: 1.2810, test_loss: 1.3760, test_f1: 0.2315
 epoch: 2, train_loss: 1.2581, test_loss: 1.3207, test_f1: 0.3211
 epoch: 3, train_loss: 1.2324, test_loss: 1.2635, test_f1: 0.3198
 epoch: 4, train_loss: 1.2183, test_loss: 1.2200, test_f1: 0.3414
 epoch: 5, train_loss: 1.1973, test_loss: 1.1829, test_f1: 0.3893
 epoch: 6, train_loss: 1.1793, test_loss: 1.1480, test_f1: 0.4238
 epoch: 7, train_loss: 1.1571, test_loss: 1.1175, test_f1: 0.4297
 epoch: 8, train_loss: 1.1466, test_loss: 1.0977, test_f1: 0.4421
 epoch: 9, train_loss: 1.1272, test_loss: 1.0806, test_f1: 0.4546
 epoch: 10, train_loss: 1.1122, test_loss: 1.0626, test_f1: 0.4689
 epoch: 11, train_loss: 1.0942, test_loss: 1.0504, test_f1: 0.4677
 epoch: 12, train_loss: 1.0795, test_loss: 1.0366, test_f1: 0.4755
 epoch: 13, train_loss: 1.0597, test_loss: 1.0204, test_f1: 0.4826
 epoch: 14, train_loss: 1.0525, test_loss: 1.0132, test_f1: 0.4793
 epoch: 15, train_loss: 1.0385, test_loss: 0.9989, test_f1: 0.4738
 epoch: 16, train_loss: 1.0248, test_loss: 0.9826, test_f1: 0.4794
 epoch: 17, train_loss: 1.0180, test_loss: 0.9875, test_f1: 0.4794
 epoch: 18, train_loss: 1.0144, test_loss: 0.9909, test_f1: 0.4821
 epoch: 19, train_loss: 0.9922, test_loss: 0.9720, test_f1: 0.4857
 epoch: 20, train_loss: 0.9778, test_loss: 0.9624, test_f1: 0.5049
 epoch: 21, train_loss: 0.9809, test_loss: 0.9589, test_f1: 0.5004
 epoch: 22, train_loss: 0.9678, test_loss: 0.9586, test_f1: 0.5073
 epoch: 23, train_loss: 0.9591, test_loss: 0.9433, test_f1: 0.5046
 epoch: 24, train_loss: 0.9514, test_loss: 0.9638, test_f1: 0.4970
 epoch: 25, train_loss: 0.9468, test_loss: 0.9572, test_f1: 0.4955
 epoch: 26, train_loss: 0.9373, test_loss: 0.9401, test_f1: 0.5095
 epoch: 27, train_loss: 0.9258, test_loss: 0.9498, test_f1: 0.4897
 epoch: 28, train_loss: 0.9157, test_loss: 0.9325, test_f1: 0.5058
 epoch: 29, train_loss: 0.9078, test_loss: 0.9448, test_f1: 0.4964
 epoch: 30, train_loss: 0.9027, test_loss: 0.9346, test_f1: 0.5068
 epoch: 31, train_loss: 0.9016, test_loss: 0.9326, test_f1: 0.4994
 epoch: 32, train_loss: 0.8912, test_loss: 0.9249, test_f1: 0.5139
 epoch: 33, train_loss: 0.8824, test_loss: 0.9284, test_f1: 0.5014
 epoch: 34, train_loss: 0.8838, test_loss: 0.9499, test_f1: 0.4935
 epoch: 35, train_loss: 0.8854, test_loss: 0.9331, test_f1: 0.4971
 epoch: 36, train_loss: 0.8740, test_loss: 0.9126, test_f1: 0.5121
 epoch: 37, train_loss: 0.8601, test_loss: 0.9335, test_f1: 0.4963
 epoch: 38, train_loss: 0.8741, test_loss: 0.9179, test_f1: 0.5023
 epoch: 39, train_loss: 0.8561, test_loss: 0.9213, test_f1: 0.5030
 epoch: 40, train_loss: 0.8574, test_loss: 0.9394, test_f1: 0.5080
 epoch: 41, train_loss: 0.8444, test_loss: 0.9284, test_f1: 0.5152
 epoch: 42, train_loss: 0.8383, test_loss: 0.9374, test_f1: 0.4984
 epoch: 43, train_loss: 0.8456, test_loss: 0.9343, test_f1: 0.5023
 epoch: 44, train_loss: 0.8312, test_loss: 0.9301, test_f1: 0.5078
 epoch: 45, train_loss: 0.8350, test_loss: 0.9375, test_f1: 0.5086
 epoch: 46, train_loss: 0.8289, test_loss: 0.9329, test_f1: 0.5059
 epoch: 47, train_loss: 0.8225, test_loss: 0.9345, test_f1: 0.5069
 epoch: 48, train_loss: 0.8202, test_loss: 0.9410, test_f1: 0.5004
 epoch: 49, train_loss: 0.8137, test_loss: 0.9379, test_f1: 0.5091
 epoch: 50, train_loss: 0.8069, test_loss: 0.9248, test_f1: 0.5229
 epoch: 51, train_loss: 0.8117, test_loss: 0.9308, test_f1: 0.5160
 epoch: 52, train_loss: 0.8036, test_loss: 0.9402, test_f1: 0.5101
 epoch: 53, train_loss: 0.7950, test_loss: 0.9437, test_f1: 0.5089
 epoch: 54, train_loss: 0.8091, test_loss: 0.9455, test_f1: 0.5050
 epoch: 55, train_loss: 0.7966, test_loss: 0.9355, test_f1: 0.5134
 epoch: 56, train_loss: 0.8024, test_loss: 0.9412, test_f1: 0.5084
 epoch: 57, train_loss: 0.8034, test_loss: 0.9415, test_f1: 0.5141
 epoch: 58, train_loss: 0.7923, test_loss: 0.9462, test_f1: 0.5130
 epoch: 59, train_loss: 0.7973, test_loss: 0.9468, test_f1: 0.5085
 epoch: 60, train_loss: 0.7942, test_loss: 0.9402, test_f1: 0.5155
 epoch: 61, train_loss: 0.7851, test_loss: 0.9394, test_f1: 0.5206
 epoch: 62, train_loss: 0.7818, test_loss: 0.9412, test_f1: 0.5219
 epoch: 63, train_loss: 0.7834, test_loss: 0.9411, test_f1: 0.5187
 epoch: 64, train_loss: 0.7863, test_loss: 0.9487, test_f1: 0.5070
 epoch: 65, train_loss: 0.7763, test_loss: 0.9587, test_f1: 0.5151
 epoch: 66, train_loss: 0.7820, test_loss: 0.9533, test_f1: 0.5192
 epoch: 67, train_loss: 0.7811, test_loss: 0.9620, test_f1: 0.5115
 epoch: 68, train_loss: 0.7856, test_loss: 0.9600, test_f1: 0.5179
 epoch: 69, train_loss: 0.7730, test_loss: 0.9557, test_f1: 0.5271
 epoch: 70, train_loss: 0.7661, test_loss: 0.9553, test_f1: 0.5281
 epoch: 71, train_loss: 0.7714, test_loss: 0.9647, test_f1: 0.5250
 epoch: 72, train_loss: 0.7598, test_loss: 0.9698, test_f1: 0.5272
 epoch: 73, train_loss: 0.7770, test_loss: 0.9655, test_f1: 0.5133
 epoch: 74, train_loss: 0.7704, test_loss: 0.9623, test_f1: 0.5156
 epoch: 75, train_loss: 0.7632, test_loss: 0.9579, test_f1: 0.5230
 epoch: 76, train_loss: 0.7670, test_loss: 0.9690, test_f1: 0.5149
 epoch: 77, train_loss: 0.7550, test_loss: 0.9700, test_f1: 0.5165
 epoch: 78, train_loss: 0.7536, test_loss: 0.9663, test_f1: 0.5158
 epoch: 79, train_loss: 0.7637, test_loss: 0.9682, test_f1: 0.5122
 epoch: 80, train_loss: 0.7578, test_loss: 0.9673, test_f1: 0.5155
 epoch: 81, train_loss: 0.7638, test_loss: 0.9672, test_f1: 0.5272
 epoch: 82, train_loss: 0.7451, test_loss: 0.9647, test_f1: 0.5269
 epoch: 83, train_loss: 0.7502, test_loss: 0.9731, test_f1: 0.5141
 epoch: 84, train_loss: 0.7449, test_loss: 0.9718, test_f1: 0.5302
 epoch: 85, train_loss: 0.7493, test_loss: 0.9690, test_f1: 0.5311
 epoch: 86, train_loss: 0.7543, test_loss: 0.9767, test_f1: 0.5273
 epoch: 87, train_loss: 0.7499, test_loss: 0.9805, test_f1: 0.5271
 epoch: 88, train_loss: 0.7542, test_loss: 0.9726, test_f1: 0.5352
 epoch: 89, train_loss: 0.7445, test_loss: 0.9764, test_f1: 0.5360
 epoch: 90, train_loss: 0.7432, test_loss: 0.9670, test_f1: 0.5389
 epoch: 91, train_loss: 0.7417, test_loss: 0.9733, test_f1: 0.5393
 epoch: 92, train_loss: 0.7413, test_loss: 0.9814, test_f1: 0.5299
 epoch: 93, train_loss: 0.7416, test_loss: 0.9850, test_f1: 0.5280
 epoch: 94, train_loss: 0.7378, test_loss: 0.9968, test_f1: 0.5218
 epoch: 95, train_loss: 0.7362, test_loss: 0.9815, test_f1: 0.5430
 epoch: 96, train_loss: 0.7473, test_loss: 0.9777, test_f1: 0.5389
 epoch: 97, train_loss: 0.7458, test_loss: 0.9789, test_f1: 0.5501
 epoch: 98, train_loss: 0.7344, test_loss: 0.9872, test_f1: 0.5333
 epoch: 99, train_loss: 0.7314, test_loss: 0.9820, test_f1: 0.5280
##################ITERATION #4 ****************************************
 epoch: 0, train_loss: 1.2930, test_loss: 1.3884, test_f1: 0.1038
 epoch: 1, train_loss: 1.2312, test_loss: 1.3686, test_f1: 0.2402
 epoch: 2, train_loss: 1.2059, test_loss: 1.3288, test_f1: 0.3226
 epoch: 3, train_loss: 1.1799, test_loss: 1.2433, test_f1: 0.3871
 epoch: 4, train_loss: 1.1662, test_loss: 1.1637, test_f1: 0.4218
 epoch: 5, train_loss: 1.1395, test_loss: 1.1182, test_f1: 0.4404
 epoch: 6, train_loss: 1.1176, test_loss: 1.0902, test_f1: 0.4439
 epoch: 7, train_loss: 1.1062, test_loss: 1.0575, test_f1: 0.4555
 epoch: 8, train_loss: 1.0904, test_loss: 1.0355, test_f1: 0.4663
 epoch: 9, train_loss: 1.0812, test_loss: 1.0194, test_f1: 0.4739
 epoch: 10, train_loss: 1.0625, test_loss: 1.0095, test_f1: 0.4624
 epoch: 11, train_loss: 1.0533, test_loss: 1.0048, test_f1: 0.4644
 epoch: 12, train_loss: 1.0430, test_loss: 0.9947, test_f1: 0.4607
 epoch: 13, train_loss: 1.0313, test_loss: 0.9796, test_f1: 0.4720
 epoch: 14, train_loss: 1.0192, test_loss: 0.9785, test_f1: 0.4782
 epoch: 15, train_loss: 1.0098, test_loss: 0.9746, test_f1: 0.4734
 epoch: 16, train_loss: 0.9943, test_loss: 0.9655, test_f1: 0.4756
 epoch: 17, train_loss: 0.9881, test_loss: 0.9544, test_f1: 0.4851
 epoch: 18, train_loss: 0.9829, test_loss: 0.9560, test_f1: 0.4734
 epoch: 19, train_loss: 0.9732, test_loss: 0.9449, test_f1: 0.4862
 epoch: 20, train_loss: 0.9727, test_loss: 0.9401, test_f1: 0.4787
 epoch: 21, train_loss: 0.9636, test_loss: 0.9410, test_f1: 0.4884
 epoch: 22, train_loss: 0.9445, test_loss: 0.9403, test_f1: 0.4772
 epoch: 23, train_loss: 0.9428, test_loss: 0.9398, test_f1: 0.4967
 epoch: 24, train_loss: 0.9262, test_loss: 0.9418, test_f1: 0.4890
 epoch: 25, train_loss: 0.9320, test_loss: 0.9330, test_f1: 0.4821
 epoch: 26, train_loss: 0.9278, test_loss: 0.9258, test_f1: 0.4935
 epoch: 27, train_loss: 0.9203, test_loss: 0.9442, test_f1: 0.5011
 epoch: 28, train_loss: 0.9142, test_loss: 0.9367, test_f1: 0.5066
 epoch: 29, train_loss: 0.9124, test_loss: 0.9396, test_f1: 0.5084
 epoch: 30, train_loss: 0.9060, test_loss: 0.9285, test_f1: 0.5062
 epoch: 31, train_loss: 0.8870, test_loss: 0.9408, test_f1: 0.5008
 epoch: 32, train_loss: 0.8988, test_loss: 0.9284, test_f1: 0.5230
 epoch: 33, train_loss: 0.8826, test_loss: 0.9176, test_f1: 0.5145
 epoch: 34, train_loss: 0.8767, test_loss: 0.9279, test_f1: 0.5243
 epoch: 35, train_loss: 0.8764, test_loss: 0.9408, test_f1: 0.5216
 epoch: 36, train_loss: 0.8612, test_loss: 0.9144, test_f1: 0.5201
 epoch: 37, train_loss: 0.8622, test_loss: 0.9276, test_f1: 0.5280
 epoch: 38, train_loss: 0.8665, test_loss: 0.9432, test_f1: 0.5141
 epoch: 39, train_loss: 0.8551, test_loss: 0.9292, test_f1: 0.5046
 epoch: 40, train_loss: 0.8540, test_loss: 0.9235, test_f1: 0.5316
 epoch: 41, train_loss: 0.8522, test_loss: 0.9466, test_f1: 0.5233
 epoch: 42, train_loss: 0.8423, test_loss: 0.9267, test_f1: 0.5281
 epoch: 43, train_loss: 0.8360, test_loss: 0.9178, test_f1: 0.5401
 epoch: 44, train_loss: 0.8351, test_loss: 0.9337, test_f1: 0.5220
 epoch: 45, train_loss: 0.8412, test_loss: 0.9365, test_f1: 0.5110
 epoch: 46, train_loss: 0.8331, test_loss: 0.9288, test_f1: 0.5316
 epoch: 47, train_loss: 0.8380, test_loss: 0.9408, test_f1: 0.5163
 epoch: 48, train_loss: 0.8198, test_loss: 0.9335, test_f1: 0.5358
 epoch: 49, train_loss: 0.8180, test_loss: 0.9276, test_f1: 0.5238
 epoch: 50, train_loss: 0.8176, test_loss: 0.9266, test_f1: 0.5251
 epoch: 51, train_loss: 0.8150, test_loss: 0.9315, test_f1: 0.5208
 epoch: 52, train_loss: 0.8041, test_loss: 0.9238, test_f1: 0.5236
 epoch: 53, train_loss: 0.8138, test_loss: 0.9239, test_f1: 0.5257
 epoch: 54, train_loss: 0.7968, test_loss: 0.9282, test_f1: 0.5375
 epoch: 55, train_loss: 0.8024, test_loss: 0.9277, test_f1: 0.5346
 epoch: 56, train_loss: 0.8006, test_loss: 0.9251, test_f1: 0.5365
 epoch: 57, train_loss: 0.7970, test_loss: 0.9345, test_f1: 0.5237
 epoch: 58, train_loss: 0.8031, test_loss: 0.9285, test_f1: 0.5259
 epoch: 59, train_loss: 0.7964, test_loss: 0.9371, test_f1: 0.5286
 epoch: 60, train_loss: 0.7951, test_loss: 0.9364, test_f1: 0.5309
 epoch: 61, train_loss: 0.7841, test_loss: 0.9361, test_f1: 0.5299
 epoch: 62, train_loss: 0.7916, test_loss: 0.9374, test_f1: 0.5350
 epoch: 63, train_loss: 0.7850, test_loss: 0.9347, test_f1: 0.5262
 epoch: 64, train_loss: 0.7885, test_loss: 0.9327, test_f1: 0.5279
 epoch: 65, train_loss: 0.7871, test_loss: 0.9357, test_f1: 0.5283
 epoch: 66, train_loss: 0.7799, test_loss: 0.9475, test_f1: 0.5185
 epoch: 67, train_loss: 0.7838, test_loss: 0.9375, test_f1: 0.5308
 epoch: 68, train_loss: 0.7698, test_loss: 0.9411, test_f1: 0.5311
 epoch: 69, train_loss: 0.7866, test_loss: 0.9376, test_f1: 0.5337
 epoch: 70, train_loss: 0.7762, test_loss: 0.9516, test_f1: 0.5108
 epoch: 71, train_loss: 0.7687, test_loss: 0.9428, test_f1: 0.5419
 epoch: 72, train_loss: 0.7706, test_loss: 0.9306, test_f1: 0.5416
 epoch: 73, train_loss: 0.7739, test_loss: 0.9431, test_f1: 0.5316
 epoch: 74, train_loss: 0.7619, test_loss: 0.9408, test_f1: 0.5533
 epoch: 75, train_loss: 0.7622, test_loss: 0.9440, test_f1: 0.5487
 epoch: 76, train_loss: 0.7643, test_loss: 0.9396, test_f1: 0.5406
 epoch: 77, train_loss: 0.7565, test_loss: 0.9413, test_f1: 0.5516
 epoch: 78, train_loss: 0.7739, test_loss: 0.9433, test_f1: 0.5517
 epoch: 79, train_loss: 0.7610, test_loss: 0.9522, test_f1: 0.5325
 epoch: 80, train_loss: 0.7611, test_loss: 0.9488, test_f1: 0.5322
 epoch: 81, train_loss: 0.7678, test_loss: 0.9427, test_f1: 0.5327
 epoch: 82, train_loss: 0.7652, test_loss: 0.9430, test_f1: 0.5499
 epoch: 83, train_loss: 0.7619, test_loss: 0.9437, test_f1: 0.5431
 epoch: 84, train_loss: 0.7542, test_loss: 0.9341, test_f1: 0.5552
 epoch: 85, train_loss: 0.7589, test_loss: 0.9346, test_f1: 0.5509
 epoch: 86, train_loss: 0.7517, test_loss: 0.9435, test_f1: 0.5508
 epoch: 87, train_loss: 0.7456, test_loss: 0.9435, test_f1: 0.5487
 epoch: 88, train_loss: 0.7483, test_loss: 0.9439, test_f1: 0.5556
 epoch: 89, train_loss: 0.7474, test_loss: 0.9363, test_f1: 0.5559
 epoch: 90, train_loss: 0.7600, test_loss: 0.9410, test_f1: 0.5652
 epoch: 91, train_loss: 0.7442, test_loss: 0.9584, test_f1: 0.5310
 epoch: 92, train_loss: 0.7363, test_loss: 0.9520, test_f1: 0.5498
 epoch: 93, train_loss: 0.7491, test_loss: 0.9445, test_f1: 0.5570
 epoch: 94, train_loss: 0.7524, test_loss: 0.9559, test_f1: 0.5346
 epoch: 95, train_loss: 0.7556, test_loss: 0.9582, test_f1: 0.5459
 epoch: 96, train_loss: 0.7416, test_loss: 0.9551, test_f1: 0.5493
 epoch: 97, train_loss: 0.7502, test_loss: 0.9510, test_f1: 0.5425
 epoch: 98, train_loss: 0.7432, test_loss: 0.9479, test_f1: 0.5489
 epoch: 99, train_loss: 0.7498, test_loss: 0.9586, test_f1: 0.5417
##################ITERATION #5 ****************************************
 epoch: 0, train_loss: 1.2827, test_loss: 1.3390, test_f1: 0.2270
 epoch: 1, train_loss: 1.2058, test_loss: 1.3137, test_f1: 0.2368
 epoch: 2, train_loss: 1.1750, test_loss: 1.2499, test_f1: 0.3050
 epoch: 3, train_loss: 1.1544, test_loss: 1.1896, test_f1: 0.3738
 epoch: 4, train_loss: 1.1311, test_loss: 1.1403, test_f1: 0.4341
 epoch: 5, train_loss: 1.1130, test_loss: 1.0865, test_f1: 0.4585
 epoch: 6, train_loss: 1.0912, test_loss: 1.0496, test_f1: 0.4699
 epoch: 7, train_loss: 1.0829, test_loss: 1.0323, test_f1: 0.4729
 epoch: 8, train_loss: 1.0698, test_loss: 1.0191, test_f1: 0.4729
 epoch: 9, train_loss: 1.0518, test_loss: 1.0052, test_f1: 0.4822
 epoch: 10, train_loss: 1.0396, test_loss: 0.9953, test_f1: 0.4939
 epoch: 11, train_loss: 1.0264, test_loss: 0.9839, test_f1: 0.4924
 epoch: 12, train_loss: 1.0103, test_loss: 0.9767, test_f1: 0.4942
 epoch: 13, train_loss: 1.0076, test_loss: 0.9673, test_f1: 0.5204
 epoch: 14, train_loss: 1.0021, test_loss: 0.9606, test_f1: 0.5242
 epoch: 15, train_loss: 0.9824, test_loss: 0.9547, test_f1: 0.5102
 epoch: 16, train_loss: 0.9799, test_loss: 0.9389, test_f1: 0.5232
 epoch: 17, train_loss: 0.9647, test_loss: 0.9453, test_f1: 0.5201
 epoch: 18, train_loss: 0.9636, test_loss: 0.9390, test_f1: 0.5309
 epoch: 19, train_loss: 0.9415, test_loss: 0.9288, test_f1: 0.5306
 epoch: 20, train_loss: 0.9391, test_loss: 0.9336, test_f1: 0.5217
 epoch: 21, train_loss: 0.9289, test_loss: 0.9339, test_f1: 0.5144
 epoch: 22, train_loss: 0.9258, test_loss: 0.9227, test_f1: 0.5358
 epoch: 23, train_loss: 0.9262, test_loss: 0.9171, test_f1: 0.5215
 epoch: 24, train_loss: 0.9197, test_loss: 0.9233, test_f1: 0.5338
 epoch: 25, train_loss: 0.9099, test_loss: 0.9285, test_f1: 0.5237
 epoch: 26, train_loss: 0.9071, test_loss: 0.9116, test_f1: 0.5428
 epoch: 27, train_loss: 0.8978, test_loss: 0.9169, test_f1: 0.5318
 epoch: 28, train_loss: 0.8930, test_loss: 0.9243, test_f1: 0.5354
 epoch: 29, train_loss: 0.8803, test_loss: 0.9188, test_f1: 0.5326
 epoch: 30, train_loss: 0.8792, test_loss: 0.9108, test_f1: 0.5368
 epoch: 31, train_loss: 0.8779, test_loss: 0.9132, test_f1: 0.5359
 epoch: 32, train_loss: 0.8672, test_loss: 0.9195, test_f1: 0.5210
 epoch: 33, train_loss: 0.8607, test_loss: 0.9147, test_f1: 0.5283
 epoch: 34, train_loss: 0.8604, test_loss: 0.9153, test_f1: 0.5422
 epoch: 35, train_loss: 0.8644, test_loss: 0.9140, test_f1: 0.5357
 epoch: 36, train_loss: 0.8675, test_loss: 0.9216, test_f1: 0.5172
 epoch: 37, train_loss: 0.8505, test_loss: 0.9230, test_f1: 0.5190
 epoch: 38, train_loss: 0.8458, test_loss: 0.9223, test_f1: 0.5483
 epoch: 39, train_loss: 0.8448, test_loss: 0.9075, test_f1: 0.5309
 epoch: 40, train_loss: 0.8356, test_loss: 0.9043, test_f1: 0.5341
 epoch: 41, train_loss: 0.8323, test_loss: 0.9109, test_f1: 0.5326
 epoch: 42, train_loss: 0.8226, test_loss: 0.9110, test_f1: 0.5342
 epoch: 43, train_loss: 0.8243, test_loss: 0.9137, test_f1: 0.5339
 epoch: 44, train_loss: 0.8265, test_loss: 0.9099, test_f1: 0.5353
 epoch: 45, train_loss: 0.8136, test_loss: 0.9004, test_f1: 0.5393
 epoch: 46, train_loss: 0.8134, test_loss: 0.9109, test_f1: 0.5403
 epoch: 47, train_loss: 0.7990, test_loss: 0.9085, test_f1: 0.5359
 epoch: 48, train_loss: 0.8035, test_loss: 0.9152, test_f1: 0.5386
 epoch: 49, train_loss: 0.8009, test_loss: 0.9044, test_f1: 0.5442
 epoch: 50, train_loss: 0.7891, test_loss: 0.9066, test_f1: 0.5400
 epoch: 51, train_loss: 0.7999, test_loss: 0.9023, test_f1: 0.5534
 epoch: 52, train_loss: 0.7819, test_loss: 0.9088, test_f1: 0.5468
 epoch: 53, train_loss: 0.7925, test_loss: 0.9084, test_f1: 0.5446
 epoch: 54, train_loss: 0.7769, test_loss: 0.9094, test_f1: 0.5514
 epoch: 55, train_loss: 0.7960, test_loss: 0.9077, test_f1: 0.5456
 epoch: 56, train_loss: 0.7796, test_loss: 0.9039, test_f1: 0.5511
 epoch: 57, train_loss: 0.7897, test_loss: 0.9014, test_f1: 0.5496
 epoch: 58, train_loss: 0.7823, test_loss: 0.9121, test_f1: 0.5430
 epoch: 59, train_loss: 0.7720, test_loss: 0.9089, test_f1: 0.5642
 epoch: 60, train_loss: 0.7725, test_loss: 0.8975, test_f1: 0.5606
 epoch: 61, train_loss: 0.7780, test_loss: 0.9063, test_f1: 0.5601
 epoch: 62, train_loss: 0.7666, test_loss: 0.9006, test_f1: 0.5650
 epoch: 63, train_loss: 0.7796, test_loss: 0.9104, test_f1: 0.5591
 epoch: 64, train_loss: 0.7667, test_loss: 0.8967, test_f1: 0.5608
 epoch: 65, train_loss: 0.7662, test_loss: 0.8982, test_f1: 0.5693
 epoch: 66, train_loss: 0.7644, test_loss: 0.9077, test_f1: 0.5682
 epoch: 67, train_loss: 0.7683, test_loss: 0.9017, test_f1: 0.5640
 epoch: 68, train_loss: 0.7594, test_loss: 0.9079, test_f1: 0.5558
 epoch: 69, train_loss: 0.7645, test_loss: 0.9030, test_f1: 0.5752
 epoch: 70, train_loss: 0.7535, test_loss: 0.9076, test_f1: 0.5718
 epoch: 71, train_loss: 0.7573, test_loss: 0.9076, test_f1: 0.5585
 epoch: 72, train_loss: 0.7427, test_loss: 0.9034, test_f1: 0.5723
 epoch: 73, train_loss: 0.7552, test_loss: 0.9047, test_f1: 0.5810
 epoch: 74, train_loss: 0.7484, test_loss: 0.9025, test_f1: 0.5624
 epoch: 75, train_loss: 0.7496, test_loss: 0.9065, test_f1: 0.5813
 epoch: 76, train_loss: 0.7414, test_loss: 0.9035, test_f1: 0.5725
 epoch: 77, train_loss: 0.7458, test_loss: 0.9078, test_f1: 0.5649
 epoch: 78, train_loss: 0.7408, test_loss: 0.9170, test_f1: 0.5667
 epoch: 79, train_loss: 0.7415, test_loss: 0.9100, test_f1: 0.5745
 epoch: 80, train_loss: 0.7501, test_loss: 0.9177, test_f1: 0.5673
 epoch: 81, train_loss: 0.7462, test_loss: 0.9088, test_f1: 0.5727
 epoch: 82, train_loss: 0.7339, test_loss: 0.9072, test_f1: 0.5638
 epoch: 83, train_loss: 0.7350, test_loss: 0.8990, test_f1: 0.5760
 epoch: 84, train_loss: 0.7435, test_loss: 0.9239, test_f1: 0.5688
 epoch: 85, train_loss: 0.7288, test_loss: 0.9108, test_f1: 0.5715
 epoch: 86, train_loss: 0.7371, test_loss: 0.9076, test_f1: 0.5748
 epoch: 87, train_loss: 0.7279, test_loss: 0.9100, test_f1: 0.5805
 epoch: 88, train_loss: 0.7260, test_loss: 0.9043, test_f1: 0.6010
 epoch: 89, train_loss: 0.7189, test_loss: 0.9101, test_f1: 0.5957
 epoch: 90, train_loss: 0.7276, test_loss: 0.9109, test_f1: 0.5913
 epoch: 91, train_loss: 0.7233, test_loss: 0.9131, test_f1: 0.5889
 epoch: 92, train_loss: 0.7299, test_loss: 0.9159, test_f1: 0.5876
 epoch: 93, train_loss: 0.7352, test_loss: 0.8886, test_f1: 0.5918
 epoch: 94, train_loss: 0.7258, test_loss: 0.9122, test_f1: 0.5868
 epoch: 95, train_loss: 0.7112, test_loss: 0.9097, test_f1: 0.5868
 epoch: 96, train_loss: 0.7089, test_loss: 0.8977, test_f1: 0.5889
 epoch: 97, train_loss: 0.7194, test_loss: 0.9074, test_f1: 0.5814
 epoch: 98, train_loss: 0.7055, test_loss: 0.8947, test_f1: 0.6011
 epoch: 99, train_loss: 0.7087, test_loss: 0.9000, test_f1: 0.6005
##################ITERATION #6 ****************************************
 epoch: 0, train_loss: 1.2669, test_loss: 1.3509, test_f1: 0.2270
 epoch: 1, train_loss: 1.2073, test_loss: 1.3732, test_f1: 0.2332
 epoch: 2, train_loss: 1.1717, test_loss: 1.3013, test_f1: 0.3124
 epoch: 3, train_loss: 1.1510, test_loss: 1.2101, test_f1: 0.3755
 epoch: 4, train_loss: 1.1267, test_loss: 1.1543, test_f1: 0.3767
 epoch: 5, train_loss: 1.1055, test_loss: 1.1163, test_f1: 0.4131
 epoch: 6, train_loss: 1.0927, test_loss: 1.0620, test_f1: 0.4634
 epoch: 7, train_loss: 1.0809, test_loss: 1.0403, test_f1: 0.4878
 epoch: 8, train_loss: 1.0622, test_loss: 1.0181, test_f1: 0.5069
 epoch: 9, train_loss: 1.0522, test_loss: 1.0182, test_f1: 0.5081
 epoch: 10, train_loss: 1.0359, test_loss: 1.0079, test_f1: 0.5109
 epoch: 11, train_loss: 1.0275, test_loss: 1.0082, test_f1: 0.5075
 epoch: 12, train_loss: 1.0172, test_loss: 0.9968, test_f1: 0.5079
 epoch: 13, train_loss: 1.0067, test_loss: 0.9945, test_f1: 0.5062
 epoch: 14, train_loss: 0.9979, test_loss: 0.9892, test_f1: 0.5076
 epoch: 15, train_loss: 0.9919, test_loss: 0.9822, test_f1: 0.5119
 epoch: 16, train_loss: 0.9775, test_loss: 0.9896, test_f1: 0.5050
 epoch: 17, train_loss: 0.9716, test_loss: 0.9814, test_f1: 0.5034
 epoch: 18, train_loss: 0.9547, test_loss: 0.9719, test_f1: 0.5217
 epoch: 19, train_loss: 0.9525, test_loss: 0.9750, test_f1: 0.5090
 epoch: 20, train_loss: 0.9562, test_loss: 0.9907, test_f1: 0.4985
 epoch: 21, train_loss: 0.9449, test_loss: 0.9735, test_f1: 0.5124
 epoch: 22, train_loss: 0.9343, test_loss: 0.9762, test_f1: 0.5191
 epoch: 23, train_loss: 0.9284, test_loss: 0.9890, test_f1: 0.4986
 epoch: 24, train_loss: 0.9268, test_loss: 0.9737, test_f1: 0.5342
 epoch: 25, train_loss: 0.9119, test_loss: 0.9636, test_f1: 0.5243
 epoch: 26, train_loss: 0.9135, test_loss: 0.9920, test_f1: 0.5030
 epoch: 27, train_loss: 0.9110, test_loss: 0.9570, test_f1: 0.5413
 epoch: 28, train_loss: 0.9004, test_loss: 0.9752, test_f1: 0.5165
 epoch: 29, train_loss: 0.8966, test_loss: 0.9763, test_f1: 0.5185
 epoch: 30, train_loss: 0.8861, test_loss: 0.9617, test_f1: 0.5349
 epoch: 31, train_loss: 0.8806, test_loss: 0.9638, test_f1: 0.5434
 epoch: 32, train_loss: 0.8900, test_loss: 0.9907, test_f1: 0.5238
 epoch: 33, train_loss: 0.8737, test_loss: 0.9997, test_f1: 0.5249
 epoch: 34, train_loss: 0.8651, test_loss: 0.9637, test_f1: 0.5505
 epoch: 35, train_loss: 0.8711, test_loss: 0.9735, test_f1: 0.5408
 epoch: 36, train_loss: 0.8635, test_loss: 0.9810, test_f1: 0.5339
 epoch: 37, train_loss: 0.8589, test_loss: 0.9780, test_f1: 0.5442
 epoch: 38, train_loss: 0.8566, test_loss: 0.9667, test_f1: 0.5521
 epoch: 39, train_loss: 0.8526, test_loss: 0.9669, test_f1: 0.5533
 epoch: 40, train_loss: 0.8380, test_loss: 0.9869, test_f1: 0.5402
 epoch: 41, train_loss: 0.8389, test_loss: 0.9974, test_f1: 0.5215
 epoch: 42, train_loss: 0.8319, test_loss: 0.9737, test_f1: 0.5503
 epoch: 43, train_loss: 0.8294, test_loss: 0.9811, test_f1: 0.5494
 epoch: 44, train_loss: 0.8231, test_loss: 0.9846, test_f1: 0.5205
 epoch: 45, train_loss: 0.8231, test_loss: 1.0152, test_f1: 0.5208
 epoch: 46, train_loss: 0.8231, test_loss: 0.9812, test_f1: 0.5403
 epoch: 47, train_loss: 0.8162, test_loss: 0.9870, test_f1: 0.5382
 epoch: 48, train_loss: 0.8116, test_loss: 0.9778, test_f1: 0.5431
 epoch: 49, train_loss: 0.8138, test_loss: 0.9714, test_f1: 0.5577
 epoch: 50, train_loss: 0.8110, test_loss: 1.0029, test_f1: 0.5327
 epoch: 51, train_loss: 0.8057, test_loss: 0.9696, test_f1: 0.5588
 epoch: 52, train_loss: 0.7965, test_loss: 0.9793, test_f1: 0.5490
 epoch: 53, train_loss: 0.7956, test_loss: 0.9881, test_f1: 0.5454
 epoch: 54, train_loss: 0.7829, test_loss: 0.9871, test_f1: 0.5495
 epoch: 55, train_loss: 0.7923, test_loss: 0.9922, test_f1: 0.5412
 epoch: 56, train_loss: 0.7788, test_loss: 1.0168, test_f1: 0.5406
 epoch: 57, train_loss: 0.7785, test_loss: 0.9964, test_f1: 0.5486
 epoch: 58, train_loss: 0.7940, test_loss: 0.9924, test_f1: 0.5505
 epoch: 59, train_loss: 0.7864, test_loss: 1.0205, test_f1: 0.5248
 epoch: 60, train_loss: 0.7755, test_loss: 0.9994, test_f1: 0.5406
 epoch: 61, train_loss: 0.7753, test_loss: 0.9974, test_f1: 0.5576
 epoch: 62, train_loss: 0.7813, test_loss: 1.0003, test_f1: 0.5515
 epoch: 63, train_loss: 0.7730, test_loss: 1.0046, test_f1: 0.5425
 epoch: 64, train_loss: 0.7613, test_loss: 0.9939, test_f1: 0.5471
 epoch: 65, train_loss: 0.7869, test_loss: 1.0091, test_f1: 0.5461
 epoch: 66, train_loss: 0.7783, test_loss: 1.0147, test_f1: 0.5365
 epoch: 67, train_loss: 0.7733, test_loss: 1.0067, test_f1: 0.5375
 epoch: 68, train_loss: 0.7733, test_loss: 1.0062, test_f1: 0.5420
 epoch: 69, train_loss: 0.7618, test_loss: 1.0210, test_f1: 0.5392
 epoch: 70, train_loss: 0.7529, test_loss: 1.0079, test_f1: 0.5519
 epoch: 71, train_loss: 0.7622, test_loss: 1.0094, test_f1: 0.5416
 epoch: 72, train_loss: 0.7633, test_loss: 1.0136, test_f1: 0.5477
 epoch: 73, train_loss: 0.7535, test_loss: 1.0039, test_f1: 0.5519
 epoch: 74, train_loss: 0.7534, test_loss: 1.0121, test_f1: 0.5427
 epoch: 75, train_loss: 0.7551, test_loss: 1.0036, test_f1: 0.5551
 epoch: 76, train_loss: 0.7493, test_loss: 1.0035, test_f1: 0.5522
 epoch: 77, train_loss: 0.7522, test_loss: 1.0056, test_f1: 0.5531
 epoch: 78, train_loss: 0.7431, test_loss: 1.0107, test_f1: 0.5472
 epoch: 79, train_loss: 0.7415, test_loss: 1.0090, test_f1: 0.5599
 epoch: 80, train_loss: 0.7333, test_loss: 1.0205, test_f1: 0.5504
 epoch: 81, train_loss: 0.7452, test_loss: 1.0029, test_f1: 0.5543
 epoch: 82, train_loss: 0.7394, test_loss: 1.0132, test_f1: 0.5550
 epoch: 83, train_loss: 0.7440, test_loss: 1.0140, test_f1: 0.5596
 epoch: 84, train_loss: 0.7457, test_loss: 1.0191, test_f1: 0.5545
 epoch: 85, train_loss: 0.7401, test_loss: 1.0389, test_f1: 0.5465
 epoch: 86, train_loss: 0.7474, test_loss: 1.0321, test_f1: 0.5612
 epoch: 87, train_loss: 0.7263, test_loss: 1.0143, test_f1: 0.5588
 epoch: 88, train_loss: 0.7380, test_loss: 1.0097, test_f1: 0.5539
 epoch: 89, train_loss: 0.7239, test_loss: 1.0123, test_f1: 0.5574
 epoch: 90, train_loss: 0.7400, test_loss: 1.0055, test_f1: 0.5577
 epoch: 91, train_loss: 0.7236, test_loss: 1.0035, test_f1: 0.5570
 epoch: 92, train_loss: 0.7254, test_loss: 1.0476, test_f1: 0.5455
 epoch: 93, train_loss: 0.7242, test_loss: 1.0143, test_f1: 0.5619
 epoch: 94, train_loss: 0.7164, test_loss: 1.0228, test_f1: 0.5639
 epoch: 95, train_loss: 0.7173, test_loss: 1.0447, test_f1: 0.5559
 epoch: 96, train_loss: 0.7292, test_loss: 1.0265, test_f1: 0.5563
 epoch: 97, train_loss: 0.7298, test_loss: 1.0215, test_f1: 0.5683
 epoch: 98, train_loss: 0.7228, test_loss: 1.0315, test_f1: 0.5565
 epoch: 99, train_loss: 0.7199, test_loss: 1.0116, test_f1: 0.5594
##################ITERATION #7 ****************************************
 epoch: 0, train_loss: 1.3000, test_loss: 1.3910, test_f1: 0.2500
 epoch: 1, train_loss: 1.2283, test_loss: 1.3481, test_f1: 0.2833
 epoch: 2, train_loss: 1.2035, test_loss: 1.2788, test_f1: 0.3109
 epoch: 3, train_loss: 1.1749, test_loss: 1.2152, test_f1: 0.3487
 epoch: 4, train_loss: 1.1489, test_loss: 1.1683, test_f1: 0.3898
 epoch: 5, train_loss: 1.1338, test_loss: 1.1421, test_f1: 0.3837
 epoch: 6, train_loss: 1.1174, test_loss: 1.1254, test_f1: 0.4073
 epoch: 7, train_loss: 1.0924, test_loss: 1.0579, test_f1: 0.4919
 epoch: 8, train_loss: 1.0755, test_loss: 1.0350, test_f1: 0.5062
 epoch: 9, train_loss: 1.0683, test_loss: 1.0245, test_f1: 0.5087
 epoch: 10, train_loss: 1.0597, test_loss: 1.0057, test_f1: 0.5027
 epoch: 11, train_loss: 1.0428, test_loss: 0.9941, test_f1: 0.5137
 epoch: 12, train_loss: 1.0328, test_loss: 0.9787, test_f1: 0.5226
 epoch: 13, train_loss: 1.0238, test_loss: 0.9791, test_f1: 0.5243
 epoch: 14, train_loss: 1.0100, test_loss: 0.9673, test_f1: 0.5077
 epoch: 15, train_loss: 0.9934, test_loss: 0.9601, test_f1: 0.5021
 epoch: 16, train_loss: 0.9873, test_loss: 0.9474, test_f1: 0.5147
 epoch: 17, train_loss: 0.9812, test_loss: 0.9457, test_f1: 0.5215
 epoch: 18, train_loss: 0.9654, test_loss: 0.9384, test_f1: 0.5191
 epoch: 19, train_loss: 0.9635, test_loss: 0.9330, test_f1: 0.5400
 epoch: 20, train_loss: 0.9463, test_loss: 0.9277, test_f1: 0.5424
 epoch: 21, train_loss: 0.9448, test_loss: 0.9282, test_f1: 0.5413
 epoch: 22, train_loss: 0.9302, test_loss: 0.9209, test_f1: 0.5239
 epoch: 23, train_loss: 0.9276, test_loss: 0.9265, test_f1: 0.5334
 epoch: 24, train_loss: 0.9141, test_loss: 0.8998, test_f1: 0.5474
 epoch: 25, train_loss: 0.9196, test_loss: 0.9190, test_f1: 0.5398
 epoch: 26, train_loss: 0.9118, test_loss: 0.9102, test_f1: 0.5441
 epoch: 27, train_loss: 0.9045, test_loss: 0.9067, test_f1: 0.5487
 epoch: 28, train_loss: 0.8994, test_loss: 0.9146, test_f1: 0.5404
 epoch: 29, train_loss: 0.8876, test_loss: 0.8942, test_f1: 0.5456
 epoch: 30, train_loss: 0.8844, test_loss: 0.9052, test_f1: 0.5574
 epoch: 31, train_loss: 0.8847, test_loss: 0.9071, test_f1: 0.5337
 epoch: 32, train_loss: 0.8728, test_loss: 0.8830, test_f1: 0.5537
 epoch: 33, train_loss: 0.8772, test_loss: 0.8922, test_f1: 0.5500
 epoch: 34, train_loss: 0.8731, test_loss: 0.8897, test_f1: 0.5597
 epoch: 35, train_loss: 0.8637, test_loss: 0.8937, test_f1: 0.5559
 epoch: 36, train_loss: 0.8518, test_loss: 0.8775, test_f1: 0.5529
 epoch: 37, train_loss: 0.8609, test_loss: 0.8813, test_f1: 0.5595
 epoch: 38, train_loss: 0.8438, test_loss: 0.8934, test_f1: 0.5631
 epoch: 39, train_loss: 0.8525, test_loss: 0.8861, test_f1: 0.5635
 epoch: 40, train_loss: 0.8521, test_loss: 0.8800, test_f1: 0.5707
 epoch: 41, train_loss: 0.8415, test_loss: 0.8877, test_f1: 0.5725
 epoch: 42, train_loss: 0.8308, test_loss: 0.8679, test_f1: 0.5724
 epoch: 43, train_loss: 0.8273, test_loss: 0.8819, test_f1: 0.5643
 epoch: 44, train_loss: 0.8310, test_loss: 0.8998, test_f1: 0.5619
 epoch: 45, train_loss: 0.8174, test_loss: 0.8897, test_f1: 0.5629
 epoch: 46, train_loss: 0.8167, test_loss: 0.8969, test_f1: 0.5634
 epoch: 47, train_loss: 0.8039, test_loss: 0.8998, test_f1: 0.5620
 epoch: 48, train_loss: 0.8124, test_loss: 0.8676, test_f1: 0.5819
 epoch: 49, train_loss: 0.8059, test_loss: 0.8783, test_f1: 0.5786
 epoch: 50, train_loss: 0.8012, test_loss: 0.8780, test_f1: 0.5822
 epoch: 51, train_loss: 0.7896, test_loss: 0.8838, test_f1: 0.5946
 epoch: 52, train_loss: 0.7885, test_loss: 0.8756, test_f1: 0.5940
 epoch: 53, train_loss: 0.7848, test_loss: 0.8898, test_f1: 0.5959
 epoch: 54, train_loss: 0.7877, test_loss: 0.8791, test_f1: 0.5879
 epoch: 55, train_loss: 0.7687, test_loss: 0.8770, test_f1: 0.5825
 epoch: 56, train_loss: 0.7747, test_loss: 0.8816, test_f1: 0.5722
 epoch: 57, train_loss: 0.7887, test_loss: 0.8856, test_f1: 0.5756
 epoch: 58, train_loss: 0.7776, test_loss: 0.8901, test_f1: 0.5993
 epoch: 59, train_loss: 0.7777, test_loss: 0.8917, test_f1: 0.5866
 epoch: 60, train_loss: 0.7768, test_loss: 0.8922, test_f1: 0.5935
 epoch: 61, train_loss: 0.7765, test_loss: 0.8945, test_f1: 0.5957
 epoch: 62, train_loss: 0.7739, test_loss: 0.8942, test_f1: 0.5982
 epoch: 63, train_loss: 0.7628, test_loss: 0.8841, test_f1: 0.5997
 epoch: 64, train_loss: 0.7729, test_loss: 0.8845, test_f1: 0.5647
 epoch: 65, train_loss: 0.7623, test_loss: 0.8982, test_f1: 0.5854
 epoch: 66, train_loss: 0.7613, test_loss: 0.9066, test_f1: 0.5670
 epoch: 67, train_loss: 0.7681, test_loss: 0.8936, test_f1: 0.5900
 epoch: 68, train_loss: 0.7586, test_loss: 0.8940, test_f1: 0.5889
 epoch: 69, train_loss: 0.7624, test_loss: 0.8967, test_f1: 0.5904
 epoch: 70, train_loss: 0.7541, test_loss: 0.8984, test_f1: 0.5778
 epoch: 71, train_loss: 0.7490, test_loss: 0.8909, test_f1: 0.5851
 epoch: 72, train_loss: 0.7614, test_loss: 0.8939, test_f1: 0.5802
 epoch: 73, train_loss: 0.7447, test_loss: 0.9000, test_f1: 0.5901
 epoch: 74, train_loss: 0.7488, test_loss: 0.9055, test_f1: 0.5869
 epoch: 75, train_loss: 0.7520, test_loss: 0.9010, test_f1: 0.5984
 epoch: 76, train_loss: 0.7470, test_loss: 0.8961, test_f1: 0.5923
 epoch: 77, train_loss: 0.7448, test_loss: 0.9024, test_f1: 0.5908
 epoch: 78, train_loss: 0.7395, test_loss: 0.9014, test_f1: 0.5938
 epoch: 79, train_loss: 0.7437, test_loss: 0.8929, test_f1: 0.5982
 epoch: 80, train_loss: 0.7428, test_loss: 0.9147, test_f1: 0.5876
 epoch: 81, train_loss: 0.7398, test_loss: 0.9082, test_f1: 0.5879
 epoch: 82, train_loss: 0.7419, test_loss: 0.9069, test_f1: 0.5922
 epoch: 83, train_loss: 0.7296, test_loss: 0.9141, test_f1: 0.6005
 epoch: 84, train_loss: 0.7381, test_loss: 0.9127, test_f1: 0.6022
 epoch: 85, train_loss: 0.7369, test_loss: 0.9089, test_f1: 0.5900
 epoch: 86, train_loss: 0.7343, test_loss: 0.9181, test_f1: 0.5922
 epoch: 87, train_loss: 0.7243, test_loss: 0.9158, test_f1: 0.5969
 epoch: 88, train_loss: 0.7293, test_loss: 0.9225, test_f1: 0.5984
 epoch: 89, train_loss: 0.7280, test_loss: 0.9201, test_f1: 0.5980
 epoch: 90, train_loss: 0.7226, test_loss: 0.9188, test_f1: 0.5995
 epoch: 91, train_loss: 0.7300, test_loss: 0.9208, test_f1: 0.5930
 epoch: 92, train_loss: 0.7285, test_loss: 0.9108, test_f1: 0.5999
 epoch: 93, train_loss: 0.7279, test_loss: 0.9186, test_f1: 0.6000
 epoch: 94, train_loss: 0.7188, test_loss: 0.9056, test_f1: 0.6038
 epoch: 95, train_loss: 0.7180, test_loss: 0.9150, test_f1: 0.5974
 epoch: 96, train_loss: 0.7191, test_loss: 0.9097, test_f1: 0.5983
 epoch: 97, train_loss: 0.7177, test_loss: 0.9162, test_f1: 0.5952
 epoch: 98, train_loss: 0.7131, test_loss: 0.9159, test_f1: 0.6029
 epoch: 99, train_loss: 0.7131, test_loss: 0.9101, test_f1: 0.6016
##################ITERATION #8 ****************************************
 epoch: 0, train_loss: 1.3346, test_loss: 1.3220, test_f1: 0.2270
 epoch: 1, train_loss: 1.2467, test_loss: 1.3479, test_f1: 0.2127
 epoch: 2, train_loss: 1.2057, test_loss: 1.3038, test_f1: 0.2847
 epoch: 3, train_loss: 1.1820, test_loss: 1.2270, test_f1: 0.4009
 epoch: 4, train_loss: 1.1619, test_loss: 1.1589, test_f1: 0.4250
 epoch: 5, train_loss: 1.1493, test_loss: 1.1112, test_f1: 0.4472
 epoch: 6, train_loss: 1.1232, test_loss: 1.0718, test_f1: 0.4464
 epoch: 7, train_loss: 1.1067, test_loss: 1.0437, test_f1: 0.4566
 epoch: 8, train_loss: 1.0809, test_loss: 1.0301, test_f1: 0.4581
 epoch: 9, train_loss: 1.0740, test_loss: 1.0141, test_f1: 0.4687
 epoch: 10, train_loss: 1.0724, test_loss: 1.0119, test_f1: 0.4654
 epoch: 11, train_loss: 1.0666, test_loss: 0.9968, test_f1: 0.4764
 epoch: 12, train_loss: 1.0394, test_loss: 0.9911, test_f1: 0.4722
 epoch: 13, train_loss: 1.0325, test_loss: 0.9825, test_f1: 0.4802
 epoch: 14, train_loss: 1.0276, test_loss: 0.9736, test_f1: 0.4887
 epoch: 15, train_loss: 1.0199, test_loss: 0.9682, test_f1: 0.4845
 epoch: 16, train_loss: 1.0060, test_loss: 0.9624, test_f1: 0.4791
 epoch: 17, train_loss: 0.9909, test_loss: 0.9596, test_f1: 0.4999
 epoch: 18, train_loss: 0.9881, test_loss: 0.9496, test_f1: 0.4919
 epoch: 19, train_loss: 0.9811, test_loss: 0.9548, test_f1: 0.4877
 epoch: 20, train_loss: 0.9728, test_loss: 0.9298, test_f1: 0.5018
 epoch: 21, train_loss: 0.9571, test_loss: 0.9510, test_f1: 0.5016
 epoch: 22, train_loss: 0.9607, test_loss: 0.9331, test_f1: 0.4895
 epoch: 23, train_loss: 0.9538, test_loss: 0.9465, test_f1: 0.4969
 epoch: 24, train_loss: 0.9380, test_loss: 0.9373, test_f1: 0.5066
 epoch: 25, train_loss: 0.9294, test_loss: 0.9639, test_f1: 0.4953
 epoch: 26, train_loss: 0.9337, test_loss: 0.9289, test_f1: 0.5158
 epoch: 27, train_loss: 0.9224, test_loss: 0.9585, test_f1: 0.5070
 epoch: 28, train_loss: 0.9150, test_loss: 0.9591, test_f1: 0.5036
 epoch: 29, train_loss: 0.9124, test_loss: 0.9508, test_f1: 0.5100
 epoch: 30, train_loss: 0.9025, test_loss: 0.9228, test_f1: 0.5130
 epoch: 31, train_loss: 0.9039, test_loss: 0.9475, test_f1: 0.5090
 epoch: 32, train_loss: 0.9052, test_loss: 0.9414, test_f1: 0.5164
 epoch: 33, train_loss: 0.8915, test_loss: 0.9552, test_f1: 0.5018
 epoch: 34, train_loss: 0.8887, test_loss: 0.9395, test_f1: 0.5111
 epoch: 35, train_loss: 0.8812, test_loss: 0.9615, test_f1: 0.5056
 epoch: 36, train_loss: 0.8687, test_loss: 0.9569, test_f1: 0.5172
 epoch: 37, train_loss: 0.8829, test_loss: 0.9504, test_f1: 0.5212
 epoch: 38, train_loss: 0.8658, test_loss: 0.9404, test_f1: 0.5168
 epoch: 39, train_loss: 0.8678, test_loss: 0.9698, test_f1: 0.5127
 epoch: 40, train_loss: 0.8661, test_loss: 0.9571, test_f1: 0.5237
 epoch: 41, train_loss: 0.8633, test_loss: 0.9657, test_f1: 0.4963
 epoch: 42, train_loss: 0.8577, test_loss: 0.9736, test_f1: 0.5086
 epoch: 43, train_loss: 0.8499, test_loss: 0.9425, test_f1: 0.5285
 epoch: 44, train_loss: 0.8563, test_loss: 0.9380, test_f1: 0.5334
 epoch: 45, train_loss: 0.8459, test_loss: 0.9384, test_f1: 0.5141
 epoch: 46, train_loss: 0.8378, test_loss: 0.9510, test_f1: 0.5127
 epoch: 47, train_loss: 0.8422, test_loss: 0.9585, test_f1: 0.5029
 epoch: 48, train_loss: 0.8335, test_loss: 0.9428, test_f1: 0.5048
 epoch: 49, train_loss: 0.8278, test_loss: 1.0043, test_f1: 0.5068
 epoch: 50, train_loss: 0.8221, test_loss: 0.9278, test_f1: 0.5301
 epoch: 51, train_loss: 0.8181, test_loss: 0.9595, test_f1: 0.5164
 epoch: 52, train_loss: 0.8250, test_loss: 0.9298, test_f1: 0.5213
 epoch: 53, train_loss: 0.8238, test_loss: 0.9446, test_f1: 0.5075
 epoch: 54, train_loss: 0.8034, test_loss: 0.9605, test_f1: 0.5119
 epoch: 55, train_loss: 0.8131, test_loss: 0.9489, test_f1: 0.5097
 epoch: 56, train_loss: 0.8118, test_loss: 0.9471, test_f1: 0.5166
 epoch: 57, train_loss: 0.8187, test_loss: 0.9648, test_f1: 0.5154
 epoch: 58, train_loss: 0.8037, test_loss: 0.9369, test_f1: 0.5174
 epoch: 59, train_loss: 0.8064, test_loss: 0.9485, test_f1: 0.5384
 epoch: 60, train_loss: 0.8047, test_loss: 0.9338, test_f1: 0.5218
 epoch: 61, train_loss: 0.8008, test_loss: 0.9520, test_f1: 0.5210
 epoch: 62, train_loss: 0.8050, test_loss: 0.9480, test_f1: 0.5254
 epoch: 63, train_loss: 0.8043, test_loss: 0.9259, test_f1: 0.5270
 epoch: 64, train_loss: 0.7970, test_loss: 0.9537, test_f1: 0.5138
 epoch: 65, train_loss: 0.7898, test_loss: 0.9631, test_f1: 0.5288
 epoch: 66, train_loss: 0.7907, test_loss: 0.9693, test_f1: 0.5144
 epoch: 67, train_loss: 0.7904, test_loss: 0.9720, test_f1: 0.5162
 epoch: 68, train_loss: 0.7843, test_loss: 0.9477, test_f1: 0.5276
 epoch: 69, train_loss: 0.7880, test_loss: 0.9539, test_f1: 0.5365
 epoch: 70, train_loss: 0.7882, test_loss: 0.9651, test_f1: 0.5292
 epoch: 71, train_loss: 0.7957, test_loss: 0.9769, test_f1: 0.5197
 epoch: 72, train_loss: 0.7797, test_loss: 0.9621, test_f1: 0.5269
 epoch: 73, train_loss: 0.7836, test_loss: 0.9713, test_f1: 0.5159
 epoch: 74, train_loss: 0.7796, test_loss: 0.9755, test_f1: 0.5205
 epoch: 75, train_loss: 0.7779, test_loss: 0.9636, test_f1: 0.5450
 epoch: 76, train_loss: 0.7802, test_loss: 0.9709, test_f1: 0.5280
 epoch: 77, train_loss: 0.7871, test_loss: 0.9608, test_f1: 0.5280
 epoch: 78, train_loss: 0.7765, test_loss: 0.9646, test_f1: 0.5461
 epoch: 79, train_loss: 0.7740, test_loss: 0.9652, test_f1: 0.5404
 epoch: 80, train_loss: 0.7648, test_loss: 0.9637, test_f1: 0.5334
 epoch: 81, train_loss: 0.7787, test_loss: 0.9491, test_f1: 0.5402
 epoch: 82, train_loss: 0.7663, test_loss: 0.9623, test_f1: 0.5414
 epoch: 83, train_loss: 0.7691, test_loss: 0.9598, test_f1: 0.5412
 epoch: 84, train_loss: 0.7756, test_loss: 0.9529, test_f1: 0.5437
 epoch: 85, train_loss: 0.7715, test_loss: 0.9549, test_f1: 0.5382
 epoch: 86, train_loss: 0.7614, test_loss: 0.9467, test_f1: 0.5392
 epoch: 87, train_loss: 0.7574, test_loss: 0.9605, test_f1: 0.5494
 epoch: 88, train_loss: 0.7556, test_loss: 0.9582, test_f1: 0.5415
 epoch: 89, train_loss: 0.7745, test_loss: 0.9604, test_f1: 0.5387
 epoch: 90, train_loss: 0.7565, test_loss: 0.9664, test_f1: 0.5552
 epoch: 91, train_loss: 0.7546, test_loss: 0.9487, test_f1: 0.5580
 epoch: 92, train_loss: 0.7646, test_loss: 0.9508, test_f1: 0.5641
 epoch: 93, train_loss: 0.7585, test_loss: 0.9561, test_f1: 0.5610
 epoch: 94, train_loss: 0.7553, test_loss: 0.9589, test_f1: 0.5567
 epoch: 95, train_loss: 0.7545, test_loss: 0.9615, test_f1: 0.5447
 epoch: 96, train_loss: 0.7453, test_loss: 0.9714, test_f1: 0.5540
 epoch: 97, train_loss: 0.7529, test_loss: 0.9597, test_f1: 0.5542
 epoch: 98, train_loss: 0.7496, test_loss: 0.9735, test_f1: 0.5589
 epoch: 99, train_loss: 0.7494, test_loss: 0.9546, test_f1: 0.5613
##################ITERATION #9 ****************************************
 epoch: 0, train_loss: 1.3106, test_loss: 1.3725, test_f1: 0.2219
 epoch: 1, train_loss: 1.2130, test_loss: 1.3046, test_f1: 0.2270
 epoch: 2, train_loss: 1.1839, test_loss: 1.2339, test_f1: 0.3343
 epoch: 3, train_loss: 1.1510, test_loss: 1.1696, test_f1: 0.3806
 epoch: 4, train_loss: 1.1339, test_loss: 1.1001, test_f1: 0.4063
 epoch: 5, train_loss: 1.1109, test_loss: 1.0529, test_f1: 0.4422
 epoch: 6, train_loss: 1.0902, test_loss: 1.0318, test_f1: 0.4456
 epoch: 7, train_loss: 1.0691, test_loss: 1.0163, test_f1: 0.4678
 epoch: 8, train_loss: 1.0625, test_loss: 1.0151, test_f1: 0.4511
 epoch: 9, train_loss: 1.0473, test_loss: 1.0019, test_f1: 0.4741
 epoch: 10, train_loss: 1.0431, test_loss: 0.9867, test_f1: 0.4704
 epoch: 11, train_loss: 1.0215, test_loss: 0.9734, test_f1: 0.4976
 epoch: 12, train_loss: 1.0151, test_loss: 0.9675, test_f1: 0.4970
 epoch: 13, train_loss: 1.0022, test_loss: 0.9631, test_f1: 0.5044
 epoch: 14, train_loss: 0.9993, test_loss: 0.9560, test_f1: 0.5025
 epoch: 15, train_loss: 0.9891, test_loss: 0.9593, test_f1: 0.4930
 epoch: 16, train_loss: 0.9838, test_loss: 0.9448, test_f1: 0.5106
 epoch: 17, train_loss: 0.9698, test_loss: 0.9506, test_f1: 0.5034
 epoch: 18, train_loss: 0.9684, test_loss: 0.9527, test_f1: 0.5012
 epoch: 19, train_loss: 0.9571, test_loss: 0.9387, test_f1: 0.5176
 epoch: 20, train_loss: 0.9481, test_loss: 0.9341, test_f1: 0.5245
 epoch: 21, train_loss: 0.9513, test_loss: 0.9325, test_f1: 0.5283
 epoch: 22, train_loss: 0.9415, test_loss: 0.9384, test_f1: 0.5276
 epoch: 23, train_loss: 0.9415, test_loss: 0.9328, test_f1: 0.5287
 epoch: 24, train_loss: 0.9381, test_loss: 0.9483, test_f1: 0.5213
 epoch: 25, train_loss: 0.9288, test_loss: 0.9399, test_f1: 0.5255
 epoch: 26, train_loss: 0.9212, test_loss: 0.9462, test_f1: 0.5292
 epoch: 27, train_loss: 0.9134, test_loss: 0.9454, test_f1: 0.5344
 epoch: 28, train_loss: 0.9092, test_loss: 0.9383, test_f1: 0.5453
 epoch: 29, train_loss: 0.9201, test_loss: 0.9266, test_f1: 0.5382
 epoch: 30, train_loss: 0.9013, test_loss: 0.9357, test_f1: 0.5348
 epoch: 31, train_loss: 0.8852, test_loss: 0.9407, test_f1: 0.5472
 epoch: 32, train_loss: 0.8925, test_loss: 0.9409, test_f1: 0.5432
 epoch: 33, train_loss: 0.8912, test_loss: 0.9330, test_f1: 0.5441
 epoch: 34, train_loss: 0.8930, test_loss: 0.9309, test_f1: 0.5412
 epoch: 35, train_loss: 0.8775, test_loss: 0.9289, test_f1: 0.5478
 epoch: 36, train_loss: 0.8558, test_loss: 0.9339, test_f1: 0.5344
 epoch: 37, train_loss: 0.8740, test_loss: 0.9411, test_f1: 0.5417
 epoch: 38, train_loss: 0.8752, test_loss: 0.9398, test_f1: 0.5496
 epoch: 39, train_loss: 0.8724, test_loss: 0.9353, test_f1: 0.5414
 epoch: 40, train_loss: 0.8527, test_loss: 0.9150, test_f1: 0.5509
 epoch: 41, train_loss: 0.8662, test_loss: 0.9379, test_f1: 0.5395
 epoch: 42, train_loss: 0.8643, test_loss: 0.9357, test_f1: 0.5398
 epoch: 43, train_loss: 0.8500, test_loss: 0.9244, test_f1: 0.5457
 epoch: 44, train_loss: 0.8505, test_loss: 0.9380, test_f1: 0.5476
 epoch: 45, train_loss: 0.8496, test_loss: 0.9346, test_f1: 0.5402
 epoch: 46, train_loss: 0.8382, test_loss: 0.9220, test_f1: 0.5569
 epoch: 47, train_loss: 0.8391, test_loss: 0.9307, test_f1: 0.5482
 epoch: 48, train_loss: 0.8407, test_loss: 0.9390, test_f1: 0.5522
 epoch: 49, train_loss: 0.8269, test_loss: 0.9276, test_f1: 0.5653
 epoch: 50, train_loss: 0.8387, test_loss: 0.9242, test_f1: 0.5576
 epoch: 51, train_loss: 0.8283, test_loss: 0.9286, test_f1: 0.5474
 epoch: 52, train_loss: 0.8146, test_loss: 0.9244, test_f1: 0.5556
 epoch: 53, train_loss: 0.8176, test_loss: 0.9240, test_f1: 0.5583
 epoch: 54, train_loss: 0.8159, test_loss: 0.9357, test_f1: 0.5546
 epoch: 55, train_loss: 0.8066, test_loss: 0.9387, test_f1: 0.5518
 epoch: 56, train_loss: 0.8052, test_loss: 0.9291, test_f1: 0.5480
 epoch: 57, train_loss: 0.8090, test_loss: 0.9364, test_f1: 0.5501
 epoch: 58, train_loss: 0.8088, test_loss: 0.9311, test_f1: 0.5511
 epoch: 59, train_loss: 0.8000, test_loss: 0.9311, test_f1: 0.5478
 epoch: 60, train_loss: 0.8095, test_loss: 0.9284, test_f1: 0.5583
 epoch: 61, train_loss: 0.8115, test_loss: 0.9222, test_f1: 0.5563
 epoch: 62, train_loss: 0.8044, test_loss: 0.9313, test_f1: 0.5524
 epoch: 63, train_loss: 0.8036, test_loss: 0.9386, test_f1: 0.5458
 epoch: 64, train_loss: 0.8040, test_loss: 0.9261, test_f1: 0.5650
 epoch: 65, train_loss: 0.8003, test_loss: 0.9358, test_f1: 0.5516
 epoch: 66, train_loss: 0.7946, test_loss: 0.9357, test_f1: 0.5473
 epoch: 67, train_loss: 0.7858, test_loss: 0.9278, test_f1: 0.5507
 epoch: 68, train_loss: 0.7906, test_loss: 0.9402, test_f1: 0.5462
 epoch: 69, train_loss: 0.7827, test_loss: 0.9382, test_f1: 0.5613
 epoch: 70, train_loss: 0.7851, test_loss: 0.9323, test_f1: 0.5564
 epoch: 71, train_loss: 0.7956, test_loss: 0.9348, test_f1: 0.5501
 epoch: 72, train_loss: 0.7841, test_loss: 0.9412, test_f1: 0.5577
 epoch: 73, train_loss: 0.7898, test_loss: 0.9341, test_f1: 0.5693
 epoch: 74, train_loss: 0.7891, test_loss: 0.9448, test_f1: 0.5490
 epoch: 75, train_loss: 0.7777, test_loss: 0.9320, test_f1: 0.5608
 epoch: 76, train_loss: 0.7896, test_loss: 0.9292, test_f1: 0.5623
 epoch: 77, train_loss: 0.7772, test_loss: 0.9369, test_f1: 0.5548
 epoch: 78, train_loss: 0.7752, test_loss: 0.9341, test_f1: 0.5698
 epoch: 79, train_loss: 0.7693, test_loss: 0.9436, test_f1: 0.5548
 epoch: 80, train_loss: 0.7649, test_loss: 0.9289, test_f1: 0.5619
 epoch: 81, train_loss: 0.7617, test_loss: 0.9461, test_f1: 0.5674
 epoch: 82, train_loss: 0.7812, test_loss: 0.9534, test_f1: 0.5566
 epoch: 83, train_loss: 0.7669, test_loss: 0.9415, test_f1: 0.5609
 epoch: 84, train_loss: 0.7701, test_loss: 0.9451, test_f1: 0.5647
 epoch: 85, train_loss: 0.7634, test_loss: 0.9369, test_f1: 0.5672
 epoch: 86, train_loss: 0.7573, test_loss: 0.9395, test_f1: 0.5714
 epoch: 87, train_loss: 0.7644, test_loss: 0.9400, test_f1: 0.5703
 epoch: 88, train_loss: 0.7581, test_loss: 0.9403, test_f1: 0.5748
 epoch: 89, train_loss: 0.7565, test_loss: 0.9379, test_f1: 0.5988
 epoch: 90, train_loss: 0.7476, test_loss: 0.9412, test_f1: 0.5854
 epoch: 91, train_loss: 0.7535, test_loss: 0.9410, test_f1: 0.5902
 epoch: 92, train_loss: 0.7605, test_loss: 0.9476, test_f1: 0.5799
 epoch: 93, train_loss: 0.7533, test_loss: 0.9417, test_f1: 0.5911
 epoch: 94, train_loss: 0.7538, test_loss: 0.9525, test_f1: 0.5966
 epoch: 95, train_loss: 0.7600, test_loss: 0.9554, test_f1: 0.5987
 epoch: 96, train_loss: 0.7530, test_loss: 0.9585, test_f1: 0.5926
 epoch: 97, train_loss: 0.7455, test_loss: 0.9447, test_f1: 0.5790
 epoch: 98, train_loss: 0.7333, test_loss: 0.9547, test_f1: 0.5791
 epoch: 99, train_loss: 0.7356, test_loss: 0.9590, test_f1: 0.5710

Training completed in 435.04 seconds
Best F1: 0.6038 at epoch 94
Mean F1 across iterations: 0.5770  0.0172
========================FINAL RESULTS================================
FEGIN weighted F1: 0.6038  0.0172
python main.py --data ltspice_examples --representation component_net --model FEGIN --layers 6 --hiddens 64 --batch_size 256 --lr 0.0001 --emb_size 512 --epochs 100 --save_appendix component_net_L6_H64_BS256_LR0.0001_E512 --no_val
-----



STDERR:
  File "main.py", line 370, in <module>
    main()
  File "main.py", line 254, in main
    dataset = dataset_class(
  File "/home/philip/projects/ltspice_examples_code_repo/Circuit-Completion-Using-GNNs/component_classification_with_link_prediction_head/evaluation/FEGIN/kernel/circuit_datasets.py", line 15, in __init__
    self.data, self.slices = torch.load(self.processed_paths[0])
  File "/home/philip/.local/lib/python3.8/site-packages/torch/serialization.py", line 1040, in load
    warnings.warn(
  File "/usr/lib/python3.8/warnings.py", line 109, in _showwarnmsg
    sw(msg.message, msg.category, msg.filename, msg.lineno,
  File "main.py", line 47, in warn_with_traceback
    traceback.print_stack(file=log)
/home/philip/projects/ltspice_examples_code_repo/Circuit-Completion-Using-GNNs/component_classification_with_link_prediction_head/evaluation/FEGIN/kernel/circuit_datasets.py:15: FutureWarning: You are using `torch.load` with `weights_only=False` (the current default value), which uses the default pickle module implicitly. It is possible to construct malicious pickle data which will execute arbitrary code during unpickling (See https://github.com/pytorch/pytorch/blob/main/SECURITY.md#untrusted-models for more details). In a future release, the default value for `weights_only` will be flipped to `True`. This limits the functions that could be executed during unpickling. Arbitrary objects will no longer be allowed to be loaded via this mode unless they are explicitly allowlisted by the user via `torch.serialization.add_safe_globals`. We recommend you start setting `weights_only=True` for any use case where you don't have full control of the loaded file. Please open an issue on GitHub for any issues related to this experimental feature.
  self.data, self.slices = torch.load(self.processed_paths[0])
