STDOUT:
Results will be saved in /home/philip/projects/ltspice_examples_code_repo/Circuit-Completion-Using-GNNs/component_classification_with_link_prediction_head/evaluation/FEGIN/results/model_FEGIN_dataset_ltspice_demos
Command line input: python main.py --data ltspice_demos --representation component_pin --model FEGIN --layers 6 --hiddens 64 --batch_size 128 --lr 0.0001 --emb_size 250 --epochs 100 --save_appendix component_pin_L6_H64_BS128_LR0.0001_E250 --no_val
 is saved.
-----
ltspice_demos - FEGIN
Using 6 layers, 64 hidden units, h = 2
Loading component_pin representation dataset
ENTERED
Training FEGIN on component_pin representation
Train: 1565, Test: 383
##################ITERATION #0 ****************************************
 epoch: 0, train_loss: 1.3906, test_loss: 1.3906, test_f1: 0.1365
 epoch: 1, train_loss: 1.3841, test_loss: 1.3875, test_f1: 0.1365
 epoch: 2, train_loss: 1.3796, test_loss: 1.3846, test_f1: 0.1365
 epoch: 3, train_loss: 1.3753, test_loss: 1.3815, test_f1: 0.1365
 epoch: 4, train_loss: 1.3697, test_loss: 1.3781, test_f1: 0.1365
 epoch: 5, train_loss: 1.3636, test_loss: 1.3735, test_f1: 0.1633
 epoch: 6, train_loss: 1.3567, test_loss: 1.3675, test_f1: 0.2890
 epoch: 7, train_loss: 1.3488, test_loss: 1.3606, test_f1: 0.3329
 epoch: 8, train_loss: 1.3387, test_loss: 1.3526, test_f1: 0.3295
 epoch: 9, train_loss: 1.3259, test_loss: 1.3431, test_f1: 0.3353
 epoch: 10, train_loss: 1.3111, test_loss: 1.3324, test_f1: 0.3284
 epoch: 11, train_loss: 1.2940, test_loss: 1.3208, test_f1: 0.3370
 epoch: 12, train_loss: 1.2736, test_loss: 1.3074, test_f1: 0.3391
 epoch: 13, train_loss: 1.2578, test_loss: 1.2942, test_f1: 0.3305
 epoch: 14, train_loss: 1.2389, test_loss: 1.2820, test_f1: 0.3306
 epoch: 15, train_loss: 1.2209, test_loss: 1.2725, test_f1: 0.3341
 epoch: 16, train_loss: 1.2026, test_loss: 1.2632, test_f1: 0.3359
 epoch: 17, train_loss: 1.1898, test_loss: 1.2519, test_f1: 0.3369
 epoch: 18, train_loss: 1.1851, test_loss: 1.2437, test_f1: 0.3341
 epoch: 19, train_loss: 1.1703, test_loss: 1.2370, test_f1: 0.3343
 epoch: 20, train_loss: 1.1643, test_loss: 1.2310, test_f1: 0.3341
 epoch: 21, train_loss: 1.1574, test_loss: 1.2335, test_f1: 0.3339
 epoch: 22, train_loss: 1.1511, test_loss: 1.2218, test_f1: 0.3339
 epoch: 23, train_loss: 1.1426, test_loss: 1.2206, test_f1: 0.3339
 epoch: 24, train_loss: 1.1339, test_loss: 1.2120, test_f1: 0.3650
 epoch: 25, train_loss: 1.1268, test_loss: 1.2104, test_f1: 0.3843
 epoch: 26, train_loss: 1.1218, test_loss: 1.2050, test_f1: 0.4119
 epoch: 27, train_loss: 1.1174, test_loss: 1.2000, test_f1: 0.4032
 epoch: 28, train_loss: 1.1099, test_loss: 1.1905, test_f1: 0.4167
 epoch: 29, train_loss: 1.1086, test_loss: 1.1887, test_f1: 0.4319
 epoch: 30, train_loss: 1.1001, test_loss: 1.1833, test_f1: 0.4242
 epoch: 31, train_loss: 1.0945, test_loss: 1.1723, test_f1: 0.4434
 epoch: 32, train_loss: 1.0876, test_loss: 1.1744, test_f1: 0.4418
 epoch: 33, train_loss: 1.0850, test_loss: 1.1653, test_f1: 0.4375
 epoch: 34, train_loss: 1.0742, test_loss: 1.1658, test_f1: 0.4277
 epoch: 35, train_loss: 1.0726, test_loss: 1.1684, test_f1: 0.4376
 epoch: 36, train_loss: 1.0620, test_loss: 1.1490, test_f1: 0.4504
 epoch: 37, train_loss: 1.0519, test_loss: 1.1351, test_f1: 0.4507
 epoch: 38, train_loss: 1.0433, test_loss: 1.1568, test_f1: 0.4510
 epoch: 39, train_loss: 1.0352, test_loss: 1.1251, test_f1: 0.4413
 epoch: 40, train_loss: 1.0298, test_loss: 1.1337, test_f1: 0.4477
 epoch: 41, train_loss: 1.0203, test_loss: 1.1115, test_f1: 0.4505
 epoch: 42, train_loss: 1.0155, test_loss: 1.1123, test_f1: 0.4529
 epoch: 43, train_loss: 1.0027, test_loss: 1.1193, test_f1: 0.4483
 epoch: 44, train_loss: 0.9996, test_loss: 1.1013, test_f1: 0.4424
 epoch: 45, train_loss: 0.9872, test_loss: 1.0919, test_f1: 0.4558
 epoch: 46, train_loss: 0.9830, test_loss: 1.1154, test_f1: 0.4256
 epoch: 47, train_loss: 0.9765, test_loss: 1.0920, test_f1: 0.4505
 epoch: 48, train_loss: 0.9622, test_loss: 1.0982, test_f1: 0.4509
 epoch: 49, train_loss: 0.9486, test_loss: 1.0861, test_f1: 0.4308
 epoch: 50, train_loss: 0.9546, test_loss: 1.0889, test_f1: 0.4459
 epoch: 51, train_loss: 0.9325, test_loss: 1.0692, test_f1: 0.4387
 epoch: 52, train_loss: 0.9250, test_loss: 1.0608, test_f1: 0.4497
 epoch: 53, train_loss: 0.9179, test_loss: 1.0746, test_f1: 0.4515
 epoch: 54, train_loss: 0.9140, test_loss: 1.0573, test_f1: 0.4562
 epoch: 55, train_loss: 0.9061, test_loss: 1.0601, test_f1: 0.4673
 epoch: 56, train_loss: 0.9050, test_loss: 1.0668, test_f1: 0.4507
 epoch: 57, train_loss: 0.9063, test_loss: 1.0522, test_f1: 0.4498
 epoch: 58, train_loss: 0.8913, test_loss: 1.0544, test_f1: 0.4678
 epoch: 59, train_loss: 0.8906, test_loss: 1.0571, test_f1: 0.4570
 epoch: 60, train_loss: 0.8918, test_loss: 1.0726, test_f1: 0.4508
 epoch: 61, train_loss: 0.8915, test_loss: 1.0542, test_f1: 0.4615
 epoch: 62, train_loss: 0.8872, test_loss: 1.0457, test_f1: 0.4638
 epoch: 63, train_loss: 0.8837, test_loss: 1.0559, test_f1: 0.4658
 epoch: 64, train_loss: 0.8692, test_loss: 1.0492, test_f1: 0.4666
 epoch: 65, train_loss: 0.8751, test_loss: 1.0638, test_f1: 0.4721
 epoch: 66, train_loss: 0.8813, test_loss: 1.0709, test_f1: 0.4716
 epoch: 67, train_loss: 0.8643, test_loss: 1.0441, test_f1: 0.4881
 epoch: 68, train_loss: 0.8662, test_loss: 1.0689, test_f1: 0.4769
 epoch: 69, train_loss: 0.8576, test_loss: 1.0557, test_f1: 0.4875
 epoch: 70, train_loss: 0.8571, test_loss: 1.0461, test_f1: 0.5074
 epoch: 71, train_loss: 0.8576, test_loss: 1.0695, test_f1: 0.4923
 epoch: 72, train_loss: 0.8581, test_loss: 1.0424, test_f1: 0.5192
 epoch: 73, train_loss: 0.8482, test_loss: 1.0400, test_f1: 0.5226
 epoch: 74, train_loss: 0.8439, test_loss: 1.0549, test_f1: 0.5240
 epoch: 75, train_loss: 0.8438, test_loss: 1.0496, test_f1: 0.5177
 epoch: 76, train_loss: 0.8485, test_loss: 1.0706, test_f1: 0.5123
 epoch: 77, train_loss: 0.8323, test_loss: 1.0715, test_f1: 0.5148
 epoch: 78, train_loss: 0.8402, test_loss: 1.0475, test_f1: 0.5288
 epoch: 79, train_loss: 0.8326, test_loss: 1.0406, test_f1: 0.5391
 epoch: 80, train_loss: 0.8296, test_loss: 1.0502, test_f1: 0.5533
 epoch: 81, train_loss: 0.8307, test_loss: 1.0600, test_f1: 0.5446
 epoch: 82, train_loss: 0.8213, test_loss: 1.0450, test_f1: 0.5457
 epoch: 83, train_loss: 0.8262, test_loss: 1.0585, test_f1: 0.5358
 epoch: 84, train_loss: 0.8256, test_loss: 1.0686, test_f1: 0.5479
 epoch: 85, train_loss: 0.8116, test_loss: 1.0492, test_f1: 0.5564
 epoch: 86, train_loss: 0.8192, test_loss: 1.0411, test_f1: 0.5588
 epoch: 87, train_loss: 0.8028, test_loss: 1.0594, test_f1: 0.5555
 epoch: 88, train_loss: 0.8011, test_loss: 1.0603, test_f1: 0.5540
 epoch: 89, train_loss: 0.7965, test_loss: 1.0500, test_f1: 0.5468
 epoch: 90, train_loss: 0.7975, test_loss: 1.0497, test_f1: 0.5648
 epoch: 91, train_loss: 0.7964, test_loss: 1.0753, test_f1: 0.5541
 epoch: 92, train_loss: 0.7916, test_loss: 1.0574, test_f1: 0.5527
 epoch: 93, train_loss: 0.7850, test_loss: 1.0589, test_f1: 0.5418
 epoch: 94, train_loss: 0.7955, test_loss: 1.0454, test_f1: 0.5553
 epoch: 95, train_loss: 0.7856, test_loss: 1.0419, test_f1: 0.5565
 epoch: 96, train_loss: 0.7860, test_loss: 1.0465, test_f1: 0.5474
 epoch: 97, train_loss: 0.7954, test_loss: 1.0668, test_f1: 0.5471
 epoch: 98, train_loss: 0.7793, test_loss: 1.0640, test_f1: 0.5405
 epoch: 99, train_loss: 0.7788, test_loss: 1.0369, test_f1: 0.5484
##################ITERATION #1 ****************************************
 epoch: 0, train_loss: 1.3583, test_loss: 1.3696, test_f1: 0.1365
 epoch: 1, train_loss: 1.3378, test_loss: 1.3602, test_f1: 0.1365
 epoch: 2, train_loss: 1.3236, test_loss: 1.3491, test_f1: 0.1365
 epoch: 3, train_loss: 1.3053, test_loss: 1.3363, test_f1: 0.2992
 epoch: 4, train_loss: 1.2905, test_loss: 1.3241, test_f1: 0.3368
 epoch: 5, train_loss: 1.2709, test_loss: 1.3107, test_f1: 0.3435
 epoch: 6, train_loss: 1.2533, test_loss: 1.2982, test_f1: 0.3483
 epoch: 7, train_loss: 1.2350, test_loss: 1.2859, test_f1: 0.3488
 epoch: 8, train_loss: 1.2172, test_loss: 1.2747, test_f1: 0.3482
 epoch: 9, train_loss: 1.2017, test_loss: 1.2644, test_f1: 0.3513
 epoch: 10, train_loss: 1.1921, test_loss: 1.2576, test_f1: 0.3512
 epoch: 11, train_loss: 1.1830, test_loss: 1.2517, test_f1: 0.3534
 epoch: 12, train_loss: 1.1692, test_loss: 1.2424, test_f1: 0.3522
 epoch: 13, train_loss: 1.1624, test_loss: 1.2361, test_f1: 0.3717
 epoch: 14, train_loss: 1.1551, test_loss: 1.2272, test_f1: 0.3936
 epoch: 15, train_loss: 1.1496, test_loss: 1.2230, test_f1: 0.4180
 epoch: 16, train_loss: 1.1380, test_loss: 1.2143, test_f1: 0.4342
 epoch: 17, train_loss: 1.1285, test_loss: 1.2085, test_f1: 0.4483
 epoch: 18, train_loss: 1.1178, test_loss: 1.2052, test_f1: 0.4614
 epoch: 19, train_loss: 1.1154, test_loss: 1.1914, test_f1: 0.4586
 epoch: 20, train_loss: 1.1097, test_loss: 1.1871, test_f1: 0.4615
 epoch: 21, train_loss: 1.0951, test_loss: 1.1880, test_f1: 0.4611
 epoch: 22, train_loss: 1.0874, test_loss: 1.1730, test_f1: 0.4611
 epoch: 23, train_loss: 1.0793, test_loss: 1.1642, test_f1: 0.4586
 epoch: 24, train_loss: 1.0732, test_loss: 1.1612, test_f1: 0.4603
 epoch: 25, train_loss: 1.0599, test_loss: 1.1489, test_f1: 0.4592
 epoch: 26, train_loss: 1.0501, test_loss: 1.1427, test_f1: 0.4586
 epoch: 27, train_loss: 1.0420, test_loss: 1.1333, test_f1: 0.4604
 epoch: 28, train_loss: 1.0381, test_loss: 1.1342, test_f1: 0.4538
 epoch: 29, train_loss: 1.0270, test_loss: 1.1152, test_f1: 0.4592
 epoch: 30, train_loss: 1.0128, test_loss: 1.1096, test_f1: 0.4587
 epoch: 31, train_loss: 0.9998, test_loss: 1.1135, test_f1: 0.4541
 epoch: 32, train_loss: 1.0006, test_loss: 1.0953, test_f1: 0.4603
 epoch: 33, train_loss: 0.9855, test_loss: 1.1036, test_f1: 0.4541
 epoch: 34, train_loss: 0.9753, test_loss: 1.0971, test_f1: 0.4567
 epoch: 35, train_loss: 0.9736, test_loss: 1.0937, test_f1: 0.4572
 epoch: 36, train_loss: 0.9649, test_loss: 1.0853, test_f1: 0.4531
 epoch: 37, train_loss: 0.9519, test_loss: 1.0906, test_f1: 0.4486
 epoch: 38, train_loss: 0.9450, test_loss: 1.0842, test_f1: 0.4485
 epoch: 39, train_loss: 0.9427, test_loss: 1.0912, test_f1: 0.4592
 epoch: 40, train_loss: 0.9345, test_loss: 1.0739, test_f1: 0.4651
 epoch: 41, train_loss: 0.9227, test_loss: 1.0834, test_f1: 0.4597
 epoch: 42, train_loss: 0.9170, test_loss: 1.0771, test_f1: 0.4600
 epoch: 43, train_loss: 0.9146, test_loss: 1.0853, test_f1: 0.4621
 epoch: 44, train_loss: 0.9059, test_loss: 1.0539, test_f1: 0.4788
 epoch: 45, train_loss: 0.8962, test_loss: 1.0754, test_f1: 0.4846
 epoch: 46, train_loss: 0.8962, test_loss: 1.0780, test_f1: 0.5317
 epoch: 47, train_loss: 0.8806, test_loss: 1.0696, test_f1: 0.4970
 epoch: 48, train_loss: 0.8781, test_loss: 1.0717, test_f1: 0.5087
 epoch: 49, train_loss: 0.8938, test_loss: 1.0497, test_f1: 0.5345
 epoch: 50, train_loss: 0.8799, test_loss: 1.0673, test_f1: 0.5105
 epoch: 51, train_loss: 0.8610, test_loss: 1.0867, test_f1: 0.5327
 epoch: 52, train_loss: 0.8623, test_loss: 1.0664, test_f1: 0.5363
 epoch: 53, train_loss: 0.8588, test_loss: 1.0833, test_f1: 0.5280
 epoch: 54, train_loss: 0.8479, test_loss: 1.0858, test_f1: 0.5290
 epoch: 55, train_loss: 0.8443, test_loss: 1.0897, test_f1: 0.5107
 epoch: 56, train_loss: 0.8549, test_loss: 1.0779, test_f1: 0.5289
 epoch: 57, train_loss: 0.8436, test_loss: 1.0670, test_f1: 0.5290
 epoch: 58, train_loss: 0.8413, test_loss: 1.0756, test_f1: 0.5212
 epoch: 59, train_loss: 0.8402, test_loss: 1.0701, test_f1: 0.5370
 epoch: 60, train_loss: 0.8479, test_loss: 1.0704, test_f1: 0.5250
 epoch: 61, train_loss: 0.8284, test_loss: 1.0711, test_f1: 0.5555
 epoch: 62, train_loss: 0.8253, test_loss: 1.0688, test_f1: 0.5462
 epoch: 63, train_loss: 0.8254, test_loss: 1.0647, test_f1: 0.5459
 epoch: 64, train_loss: 0.8222, test_loss: 1.0810, test_f1: 0.5431
 epoch: 65, train_loss: 0.8326, test_loss: 1.0958, test_f1: 0.5600
 epoch: 66, train_loss: 0.8203, test_loss: 1.0696, test_f1: 0.5400
 epoch: 67, train_loss: 0.8223, test_loss: 1.0535, test_f1: 0.5462
 epoch: 68, train_loss: 0.8142, test_loss: 1.0640, test_f1: 0.5457
 epoch: 69, train_loss: 0.8196, test_loss: 1.0762, test_f1: 0.5381
 epoch: 70, train_loss: 0.8102, test_loss: 1.0732, test_f1: 0.5359
 epoch: 71, train_loss: 0.8102, test_loss: 1.0657, test_f1: 0.5398
 epoch: 72, train_loss: 0.8109, test_loss: 1.0506, test_f1: 0.5459
 epoch: 73, train_loss: 0.8106, test_loss: 1.0820, test_f1: 0.5518
 epoch: 74, train_loss: 0.7987, test_loss: 1.0739, test_f1: 0.5470
 epoch: 75, train_loss: 0.8009, test_loss: 1.0818, test_f1: 0.5492
 epoch: 76, train_loss: 0.7960, test_loss: 1.0846, test_f1: 0.5455
 epoch: 77, train_loss: 0.7916, test_loss: 1.0856, test_f1: 0.5452
 epoch: 78, train_loss: 0.7959, test_loss: 1.0920, test_f1: 0.5467
 epoch: 79, train_loss: 0.7925, test_loss: 1.0928, test_f1: 0.5490
 epoch: 80, train_loss: 0.7832, test_loss: 1.0890, test_f1: 0.5482
 epoch: 81, train_loss: 0.7933, test_loss: 1.0913, test_f1: 0.5485
 epoch: 82, train_loss: 0.7838, test_loss: 1.0904, test_f1: 0.5558
 epoch: 83, train_loss: 0.7832, test_loss: 1.0791, test_f1: 0.5566
 epoch: 84, train_loss: 0.7767, test_loss: 1.0720, test_f1: 0.5571
 epoch: 85, train_loss: 0.7821, test_loss: 1.0828, test_f1: 0.5487
 epoch: 86, train_loss: 0.7703, test_loss: 1.0902, test_f1: 0.5564
 epoch: 87, train_loss: 0.7641, test_loss: 1.1058, test_f1: 0.5612
 epoch: 88, train_loss: 0.7692, test_loss: 1.1227, test_f1: 0.5479
 epoch: 89, train_loss: 0.7768, test_loss: 1.1007, test_f1: 0.5611
 epoch: 90, train_loss: 0.7715, test_loss: 1.0916, test_f1: 0.5493
 epoch: 91, train_loss: 0.7776, test_loss: 1.0682, test_f1: 0.5724
 epoch: 92, train_loss: 0.7671, test_loss: 1.0823, test_f1: 0.5616
 epoch: 93, train_loss: 0.7735, test_loss: 1.0954, test_f1: 0.5489
 epoch: 94, train_loss: 0.7557, test_loss: 1.1115, test_f1: 0.5600
 epoch: 95, train_loss: 0.7556, test_loss: 1.0955, test_f1: 0.5747
 epoch: 96, train_loss: 0.7524, test_loss: 1.1258, test_f1: 0.5612
 epoch: 97, train_loss: 0.7515, test_loss: 1.1163, test_f1: 0.5515
 epoch: 98, train_loss: 0.7473, test_loss: 1.1285, test_f1: 0.5608
 epoch: 99, train_loss: 0.7448, test_loss: 1.1286, test_f1: 0.5529
##################ITERATION #2 ****************************************
 epoch: 0, train_loss: 1.3432, test_loss: 1.3622, test_f1: 0.1365
 epoch: 1, train_loss: 1.3104, test_loss: 1.3518, test_f1: 0.1365
 epoch: 2, train_loss: 1.2916, test_loss: 1.3436, test_f1: 0.1365
 epoch: 3, train_loss: 1.2746, test_loss: 1.3339, test_f1: 0.1365
 epoch: 4, train_loss: 1.2561, test_loss: 1.3172, test_f1: 0.1365
 epoch: 5, train_loss: 1.2418, test_loss: 1.2971, test_f1: 0.1480
 epoch: 6, train_loss: 1.2216, test_loss: 1.2780, test_f1: 0.1781
 epoch: 7, train_loss: 1.2088, test_loss: 1.2657, test_f1: 0.2223
 epoch: 8, train_loss: 1.1885, test_loss: 1.2517, test_f1: 0.3269
 epoch: 9, train_loss: 1.1767, test_loss: 1.2389, test_f1: 0.4448
 epoch: 10, train_loss: 1.1633, test_loss: 1.2287, test_f1: 0.4670
 epoch: 11, train_loss: 1.1465, test_loss: 1.2141, test_f1: 0.4486
 epoch: 12, train_loss: 1.1295, test_loss: 1.1983, test_f1: 0.4066
 epoch: 13, train_loss: 1.1200, test_loss: 1.1866, test_f1: 0.3877
 epoch: 14, train_loss: 1.0997, test_loss: 1.1692, test_f1: 0.3791
 epoch: 15, train_loss: 1.0860, test_loss: 1.1523, test_f1: 0.3849
 epoch: 16, train_loss: 1.0716, test_loss: 1.1393, test_f1: 0.3830
 epoch: 17, train_loss: 1.0604, test_loss: 1.1268, test_f1: 0.3822
 epoch: 18, train_loss: 1.0444, test_loss: 1.1117, test_f1: 0.3765
 epoch: 19, train_loss: 1.0333, test_loss: 1.0988, test_f1: 0.3800
 epoch: 20, train_loss: 1.0255, test_loss: 1.1038, test_f1: 0.3568
 epoch: 21, train_loss: 1.0176, test_loss: 1.0814, test_f1: 0.3893
 epoch: 22, train_loss: 0.9971, test_loss: 1.0691, test_f1: 0.4016
 epoch: 23, train_loss: 0.9980, test_loss: 1.0694, test_f1: 0.4106
 epoch: 24, train_loss: 0.9813, test_loss: 1.0531, test_f1: 0.4154
 epoch: 25, train_loss: 0.9696, test_loss: 1.0474, test_f1: 0.4243
 epoch: 26, train_loss: 0.9613, test_loss: 1.0355, test_f1: 0.4033
 epoch: 27, train_loss: 0.9558, test_loss: 1.0237, test_f1: 0.4279
 epoch: 28, train_loss: 0.9449, test_loss: 1.0339, test_f1: 0.4522
 epoch: 29, train_loss: 0.9387, test_loss: 1.0232, test_f1: 0.4442
 epoch: 30, train_loss: 0.9286, test_loss: 1.0093, test_f1: 0.4897
 epoch: 31, train_loss: 0.9197, test_loss: 1.0152, test_f1: 0.4562
 epoch: 32, train_loss: 0.9143, test_loss: 1.0131, test_f1: 0.4925
 epoch: 33, train_loss: 0.9112, test_loss: 1.0111, test_f1: 0.4796
 epoch: 34, train_loss: 0.9012, test_loss: 1.0052, test_f1: 0.4772
 epoch: 35, train_loss: 0.8894, test_loss: 0.9896, test_f1: 0.4926
 epoch: 36, train_loss: 0.8953, test_loss: 0.9953, test_f1: 0.4805
 epoch: 37, train_loss: 0.8868, test_loss: 0.9793, test_f1: 0.5115
 epoch: 38, train_loss: 0.8735, test_loss: 0.9709, test_f1: 0.4990
 epoch: 39, train_loss: 0.8655, test_loss: 0.9736, test_f1: 0.5043
 epoch: 40, train_loss: 0.8576, test_loss: 0.9742, test_f1: 0.5236
 epoch: 41, train_loss: 0.8500, test_loss: 0.9659, test_f1: 0.5399
 epoch: 42, train_loss: 0.8450, test_loss: 0.9674, test_f1: 0.5439
 epoch: 43, train_loss: 0.8311, test_loss: 0.9623, test_f1: 0.5388
 epoch: 44, train_loss: 0.8327, test_loss: 0.9524, test_f1: 0.5512
 epoch: 45, train_loss: 0.8245, test_loss: 0.9633, test_f1: 0.5495
 epoch: 46, train_loss: 0.8226, test_loss: 0.9878, test_f1: 0.5492
 epoch: 47, train_loss: 0.8096, test_loss: 0.9597, test_f1: 0.5482
 epoch: 48, train_loss: 0.7955, test_loss: 0.9324, test_f1: 0.5545
 epoch: 49, train_loss: 0.8061, test_loss: 0.9354, test_f1: 0.5667
 epoch: 50, train_loss: 0.7873, test_loss: 0.9653, test_f1: 0.5576
 epoch: 51, train_loss: 0.7886, test_loss: 0.9372, test_f1: 0.5699
 epoch: 52, train_loss: 0.7852, test_loss: 0.9289, test_f1: 0.5835
 epoch: 53, train_loss: 0.7806, test_loss: 0.9354, test_f1: 0.5841
 epoch: 54, train_loss: 0.7669, test_loss: 0.9274, test_f1: 0.5793
 epoch: 55, train_loss: 0.7678, test_loss: 0.9278, test_f1: 0.5813
 epoch: 56, train_loss: 0.7551, test_loss: 0.9287, test_f1: 0.5749
 epoch: 57, train_loss: 0.7558, test_loss: 0.9329, test_f1: 0.5769
 epoch: 58, train_loss: 0.7574, test_loss: 0.9438, test_f1: 0.5699
 epoch: 59, train_loss: 0.7569, test_loss: 0.9368, test_f1: 0.5685
 epoch: 60, train_loss: 0.7549, test_loss: 0.9317, test_f1: 0.5768
 epoch: 61, train_loss: 0.7484, test_loss: 0.9310, test_f1: 0.5690
 epoch: 62, train_loss: 0.7495, test_loss: 0.9250, test_f1: 0.5805
 epoch: 63, train_loss: 0.7489, test_loss: 0.9215, test_f1: 0.5505
 epoch: 64, train_loss: 0.7395, test_loss: 0.9339, test_f1: 0.5738
 epoch: 65, train_loss: 0.7411, test_loss: 0.9530, test_f1: 0.5457
 epoch: 66, train_loss: 0.7426, test_loss: 0.9767, test_f1: 0.5362
 epoch: 67, train_loss: 0.7454, test_loss: 0.9454, test_f1: 0.5642
 epoch: 68, train_loss: 0.7392, test_loss: 0.9418, test_f1: 0.5513
 epoch: 69, train_loss: 0.7305, test_loss: 0.9458, test_f1: 0.5438
 epoch: 70, train_loss: 0.7316, test_loss: 0.9454, test_f1: 0.5513
 epoch: 71, train_loss: 0.7279, test_loss: 0.9347, test_f1: 0.5692
 epoch: 72, train_loss: 0.7223, test_loss: 0.9359, test_f1: 0.5522
 epoch: 73, train_loss: 0.7334, test_loss: 0.9485, test_f1: 0.5422
 epoch: 74, train_loss: 0.7223, test_loss: 0.9475, test_f1: 0.5594
 epoch: 75, train_loss: 0.7273, test_loss: 0.9504, test_f1: 0.5323
 epoch: 76, train_loss: 0.7127, test_loss: 0.9435, test_f1: 0.5501
 epoch: 77, train_loss: 0.7171, test_loss: 0.9541, test_f1: 0.5313
 epoch: 78, train_loss: 0.7114, test_loss: 0.9623, test_f1: 0.5145
 epoch: 79, train_loss: 0.7153, test_loss: 0.9737, test_f1: 0.5421
 epoch: 80, train_loss: 0.7013, test_loss: 0.9663, test_f1: 0.5425
 epoch: 81, train_loss: 0.7037, test_loss: 0.9485, test_f1: 0.5437
 epoch: 82, train_loss: 0.7138, test_loss: 0.9499, test_f1: 0.5330
 epoch: 83, train_loss: 0.7030, test_loss: 0.9372, test_f1: 0.5486
 epoch: 84, train_loss: 0.6957, test_loss: 0.9632, test_f1: 0.5373
 epoch: 85, train_loss: 0.7011, test_loss: 0.9655, test_f1: 0.5541
 epoch: 86, train_loss: 0.6952, test_loss: 0.9486, test_f1: 0.5593
 epoch: 87, train_loss: 0.6924, test_loss: 0.9476, test_f1: 0.5467
 epoch: 88, train_loss: 0.6891, test_loss: 0.9508, test_f1: 0.5457
 epoch: 89, train_loss: 0.6914, test_loss: 0.9655, test_f1: 0.5606
 epoch: 90, train_loss: 0.6894, test_loss: 0.9484, test_f1: 0.5592
 epoch: 91, train_loss: 0.6977, test_loss: 0.9569, test_f1: 0.5566
 epoch: 92, train_loss: 0.6938, test_loss: 0.9714, test_f1: 0.5603
 epoch: 93, train_loss: 0.6935, test_loss: 0.9626, test_f1: 0.5542
 epoch: 94, train_loss: 0.6844, test_loss: 0.9669, test_f1: 0.5450
 epoch: 95, train_loss: 0.7043, test_loss: 0.9656, test_f1: 0.5434
 epoch: 96, train_loss: 0.6754, test_loss: 0.9720, test_f1: 0.5495
 epoch: 97, train_loss: 0.6825, test_loss: 0.9480, test_f1: 0.5588
 epoch: 98, train_loss: 0.6748, test_loss: 0.9880, test_f1: 0.5324
 epoch: 99, train_loss: 0.6792, test_loss: 0.9823, test_f1: 0.5435
##################ITERATION #3 ****************************************
 epoch: 0, train_loss: 1.2985, test_loss: 1.3185, test_f1: 0.1527
 epoch: 1, train_loss: 1.2544, test_loss: 1.3060, test_f1: 0.1527
 epoch: 2, train_loss: 1.2364, test_loss: 1.3049, test_f1: 0.1836
 epoch: 3, train_loss: 1.2199, test_loss: 1.2914, test_f1: 0.1995
 epoch: 4, train_loss: 1.2025, test_loss: 1.2661, test_f1: 0.3195
 epoch: 5, train_loss: 1.1872, test_loss: 1.2495, test_f1: 0.4051
 epoch: 6, train_loss: 1.1727, test_loss: 1.2363, test_f1: 0.4158
 epoch: 7, train_loss: 1.1591, test_loss: 1.2238, test_f1: 0.3823
 epoch: 8, train_loss: 1.1455, test_loss: 1.2133, test_f1: 0.3866
 epoch: 9, train_loss: 1.1275, test_loss: 1.1972, test_f1: 0.3634
 epoch: 10, train_loss: 1.1124, test_loss: 1.1825, test_f1: 0.3761
 epoch: 11, train_loss: 1.1023, test_loss: 1.1723, test_f1: 0.3697
 epoch: 12, train_loss: 1.0863, test_loss: 1.1580, test_f1: 0.3629
 epoch: 13, train_loss: 1.0715, test_loss: 1.1470, test_f1: 0.3443
 epoch: 14, train_loss: 1.0640, test_loss: 1.1375, test_f1: 0.3816
 epoch: 15, train_loss: 1.0476, test_loss: 1.1242, test_f1: 0.3880
 epoch: 16, train_loss: 1.0382, test_loss: 1.1207, test_f1: 0.3825
 epoch: 17, train_loss: 1.0226, test_loss: 1.1087, test_f1: 0.3828
 epoch: 18, train_loss: 1.0160, test_loss: 1.0964, test_f1: 0.3969
 epoch: 19, train_loss: 1.0092, test_loss: 1.0982, test_f1: 0.3909
 epoch: 20, train_loss: 0.9949, test_loss: 1.0790, test_f1: 0.4053
 epoch: 21, train_loss: 0.9906, test_loss: 1.0701, test_f1: 0.4414
 epoch: 22, train_loss: 0.9715, test_loss: 1.0781, test_f1: 0.4655
 epoch: 23, train_loss: 0.9589, test_loss: 1.0582, test_f1: 0.4748
 epoch: 24, train_loss: 0.9594, test_loss: 1.0479, test_f1: 0.5004
 epoch: 25, train_loss: 0.9497, test_loss: 1.0444, test_f1: 0.5324
 epoch: 26, train_loss: 0.9432, test_loss: 1.0419, test_f1: 0.5105
 epoch: 27, train_loss: 0.9268, test_loss: 1.0381, test_f1: 0.5042
 epoch: 28, train_loss: 0.9161, test_loss: 1.0336, test_f1: 0.5087
 epoch: 29, train_loss: 0.9153, test_loss: 1.0234, test_f1: 0.5456
 epoch: 30, train_loss: 0.9148, test_loss: 1.0211, test_f1: 0.5321
 epoch: 31, train_loss: 0.9033, test_loss: 0.9987, test_f1: 0.5470
 epoch: 32, train_loss: 0.8925, test_loss: 1.0068, test_f1: 0.5339
 epoch: 33, train_loss: 0.8894, test_loss: 1.0023, test_f1: 0.5519
 epoch: 34, train_loss: 0.8737, test_loss: 1.0030, test_f1: 0.5561
 epoch: 35, train_loss: 0.8699, test_loss: 0.9889, test_f1: 0.5467
 epoch: 36, train_loss: 0.8593, test_loss: 0.9942, test_f1: 0.5491
 epoch: 37, train_loss: 0.8565, test_loss: 0.9835, test_f1: 0.5527
 epoch: 38, train_loss: 0.8392, test_loss: 0.9781, test_f1: 0.5528
 epoch: 39, train_loss: 0.8435, test_loss: 0.9963, test_f1: 0.5487
 epoch: 40, train_loss: 0.8261, test_loss: 0.9926, test_f1: 0.5498
 epoch: 41, train_loss: 0.8279, test_loss: 0.9689, test_f1: 0.5562
 epoch: 42, train_loss: 0.8123, test_loss: 0.9846, test_f1: 0.5500
 epoch: 43, train_loss: 0.8149, test_loss: 0.9912, test_f1: 0.5783
 epoch: 44, train_loss: 0.8081, test_loss: 0.9771, test_f1: 0.5493
 epoch: 45, train_loss: 0.8045, test_loss: 0.9751, test_f1: 0.5744
 epoch: 46, train_loss: 0.7970, test_loss: 0.9744, test_f1: 0.5722
 epoch: 47, train_loss: 0.7876, test_loss: 0.9660, test_f1: 0.5708
 epoch: 48, train_loss: 0.7763, test_loss: 0.9720, test_f1: 0.5728
 epoch: 49, train_loss: 0.7875, test_loss: 0.9778, test_f1: 0.5760
 epoch: 50, train_loss: 0.7676, test_loss: 0.9954, test_f1: 0.5753
 epoch: 51, train_loss: 0.7703, test_loss: 0.9993, test_f1: 0.5615
 epoch: 52, train_loss: 0.7729, test_loss: 0.9956, test_f1: 0.5602
 epoch: 53, train_loss: 0.7630, test_loss: 1.0106, test_f1: 0.5558
 epoch: 54, train_loss: 0.7557, test_loss: 1.0048, test_f1: 0.5539
 epoch: 55, train_loss: 0.7424, test_loss: 0.9941, test_f1: 0.5691
 epoch: 56, train_loss: 0.7428, test_loss: 1.0067, test_f1: 0.5501
 epoch: 57, train_loss: 0.7469, test_loss: 0.9876, test_f1: 0.5636
 epoch: 58, train_loss: 0.7486, test_loss: 0.9968, test_f1: 0.5766
 epoch: 59, train_loss: 0.7440, test_loss: 0.9797, test_f1: 0.5654
 epoch: 60, train_loss: 0.7439, test_loss: 0.9853, test_f1: 0.5662
 epoch: 61, train_loss: 0.7283, test_loss: 0.9792, test_f1: 0.5834
 epoch: 62, train_loss: 0.7362, test_loss: 0.9770, test_f1: 0.5952
 epoch: 63, train_loss: 0.7272, test_loss: 0.9916, test_f1: 0.5826
 epoch: 64, train_loss: 0.7377, test_loss: 1.0077, test_f1: 0.5761
 epoch: 65, train_loss: 0.7391, test_loss: 1.0028, test_f1: 0.5737
 epoch: 66, train_loss: 0.7109, test_loss: 1.0056, test_f1: 0.5783
 epoch: 67, train_loss: 0.7221, test_loss: 0.9687, test_f1: 0.6017
 epoch: 68, train_loss: 0.7003, test_loss: 0.9794, test_f1: 0.5848
 epoch: 69, train_loss: 0.7178, test_loss: 0.9905, test_f1: 0.5874
 epoch: 70, train_loss: 0.7092, test_loss: 1.0084, test_f1: 0.5925
 epoch: 71, train_loss: 0.7081, test_loss: 1.0287, test_f1: 0.5780
 epoch: 72, train_loss: 0.7103, test_loss: 1.0001, test_f1: 0.5876
 epoch: 73, train_loss: 0.7104, test_loss: 0.9880, test_f1: 0.5928
 epoch: 74, train_loss: 0.6936, test_loss: 1.0237, test_f1: 0.5782
 epoch: 75, train_loss: 0.7165, test_loss: 1.0094, test_f1: 0.5959
 epoch: 76, train_loss: 0.7040, test_loss: 1.0027, test_f1: 0.5895
 epoch: 77, train_loss: 0.6928, test_loss: 1.0110, test_f1: 0.5731
 epoch: 78, train_loss: 0.6905, test_loss: 1.0071, test_f1: 0.6044
 epoch: 79, train_loss: 0.6975, test_loss: 1.0283, test_f1: 0.5683
 epoch: 80, train_loss: 0.6906, test_loss: 0.9891, test_f1: 0.6074
 epoch: 81, train_loss: 0.6938, test_loss: 1.0037, test_f1: 0.6116
 epoch: 82, train_loss: 0.6901, test_loss: 0.9923, test_f1: 0.6020
 epoch: 83, train_loss: 0.6795, test_loss: 1.0367, test_f1: 0.5727
 epoch: 84, train_loss: 0.6789, test_loss: 1.0385, test_f1: 0.5735
 epoch: 85, train_loss: 0.6831, test_loss: 1.0271, test_f1: 0.5767
 epoch: 86, train_loss: 0.6725, test_loss: 1.0039, test_f1: 0.5908
 epoch: 87, train_loss: 0.6774, test_loss: 1.0063, test_f1: 0.6090
 epoch: 88, train_loss: 0.6811, test_loss: 1.0083, test_f1: 0.5935
 epoch: 89, train_loss: 0.6797, test_loss: 1.0324, test_f1: 0.5907
 epoch: 90, train_loss: 0.6691, test_loss: 1.0371, test_f1: 0.5754
 epoch: 91, train_loss: 0.6664, test_loss: 1.0064, test_f1: 0.6100
 epoch: 92, train_loss: 0.6724, test_loss: 1.0272, test_f1: 0.5878
 epoch: 93, train_loss: 0.6704, test_loss: 1.0832, test_f1: 0.5881
 epoch: 94, train_loss: 0.6766, test_loss: 1.0224, test_f1: 0.5937
 epoch: 95, train_loss: 0.6607, test_loss: 1.0006, test_f1: 0.5960
 epoch: 96, train_loss: 0.6694, test_loss: 1.0046, test_f1: 0.6050
 epoch: 97, train_loss: 0.6565, test_loss: 1.0150, test_f1: 0.6126
 epoch: 98, train_loss: 0.6614, test_loss: 1.0177, test_f1: 0.5972
 epoch: 99, train_loss: 0.6661, test_loss: 1.0342, test_f1: 0.5780
##################ITERATION #4 ****************************************
 epoch: 0, train_loss: 1.2860, test_loss: 1.3311, test_f1: 0.2281
 epoch: 1, train_loss: 1.2431, test_loss: 1.3149, test_f1: 0.2281
 epoch: 2, train_loss: 1.2148, test_loss: 1.3047, test_f1: 0.2281
 epoch: 3, train_loss: 1.2048, test_loss: 1.2896, test_f1: 0.2281
 epoch: 4, train_loss: 1.1865, test_loss: 1.2699, test_f1: 0.2529
 epoch: 5, train_loss: 1.1733, test_loss: 1.2586, test_f1: 0.2837
 epoch: 6, train_loss: 1.1583, test_loss: 1.2477, test_f1: 0.3489
 epoch: 7, train_loss: 1.1414, test_loss: 1.2332, test_f1: 0.3880
 epoch: 8, train_loss: 1.1275, test_loss: 1.2150, test_f1: 0.3403
 epoch: 9, train_loss: 1.1185, test_loss: 1.2128, test_f1: 0.3971
 epoch: 10, train_loss: 1.1129, test_loss: 1.2005, test_f1: 0.4019
 epoch: 11, train_loss: 1.0915, test_loss: 1.2034, test_f1: 0.4130
 epoch: 12, train_loss: 1.0860, test_loss: 1.1800, test_f1: 0.4226
 epoch: 13, train_loss: 1.0659, test_loss: 1.1659, test_f1: 0.4596
 epoch: 14, train_loss: 1.0560, test_loss: 1.1489, test_f1: 0.4347
 epoch: 15, train_loss: 1.0471, test_loss: 1.1499, test_f1: 0.4512
 epoch: 16, train_loss: 1.0335, test_loss: 1.1485, test_f1: 0.4652
 epoch: 17, train_loss: 1.0250, test_loss: 1.1478, test_f1: 0.4599
 epoch: 18, train_loss: 1.0101, test_loss: 1.1307, test_f1: 0.4837
 epoch: 19, train_loss: 0.9930, test_loss: 1.1021, test_f1: 0.4875
 epoch: 20, train_loss: 0.9919, test_loss: 1.1050, test_f1: 0.4935
 epoch: 21, train_loss: 0.9791, test_loss: 1.1290, test_f1: 0.4903
 epoch: 22, train_loss: 0.9698, test_loss: 1.1082, test_f1: 0.5056
 epoch: 23, train_loss: 0.9554, test_loss: 1.1038, test_f1: 0.5027
 epoch: 24, train_loss: 0.9438, test_loss: 1.1145, test_f1: 0.5048
 epoch: 25, train_loss: 0.9494, test_loss: 1.0833, test_f1: 0.4994
 epoch: 26, train_loss: 0.9316, test_loss: 1.1140, test_f1: 0.4991
 epoch: 27, train_loss: 0.9291, test_loss: 1.0853, test_f1: 0.5085
 epoch: 28, train_loss: 0.9028, test_loss: 1.0808, test_f1: 0.5152
 epoch: 29, train_loss: 0.9085, test_loss: 1.0873, test_f1: 0.5151
 epoch: 30, train_loss: 0.8961, test_loss: 1.1070, test_f1: 0.5171
 epoch: 31, train_loss: 0.8887, test_loss: 1.0545, test_f1: 0.5235
 epoch: 32, train_loss: 0.8879, test_loss: 1.0729, test_f1: 0.5157
 epoch: 33, train_loss: 0.8728, test_loss: 1.0825, test_f1: 0.5290
 epoch: 34, train_loss: 0.8757, test_loss: 1.0680, test_f1: 0.5367
 epoch: 35, train_loss: 0.8684, test_loss: 1.0948, test_f1: 0.5396
 epoch: 36, train_loss: 0.8508, test_loss: 1.0923, test_f1: 0.5204
 epoch: 37, train_loss: 0.8508, test_loss: 1.0565, test_f1: 0.5117
 epoch: 38, train_loss: 0.8474, test_loss: 1.0948, test_f1: 0.5205
 epoch: 39, train_loss: 0.8339, test_loss: 1.0814, test_f1: 0.5226
 epoch: 40, train_loss: 0.8220, test_loss: 1.0754, test_f1: 0.5226
 epoch: 41, train_loss: 0.8178, test_loss: 1.0685, test_f1: 0.5427
 epoch: 42, train_loss: 0.8085, test_loss: 1.1088, test_f1: 0.5452
 epoch: 43, train_loss: 0.8115, test_loss: 1.0935, test_f1: 0.5500
 epoch: 44, train_loss: 0.8076, test_loss: 1.1097, test_f1: 0.5395
 epoch: 45, train_loss: 0.8115, test_loss: 1.1016, test_f1: 0.5456
 epoch: 46, train_loss: 0.7978, test_loss: 1.1056, test_f1: 0.5460
 epoch: 47, train_loss: 0.7835, test_loss: 1.0931, test_f1: 0.5377
 epoch: 48, train_loss: 0.7784, test_loss: 1.0898, test_f1: 0.5495
 epoch: 49, train_loss: 0.7704, test_loss: 1.0862, test_f1: 0.5447
 epoch: 50, train_loss: 0.7655, test_loss: 1.0919, test_f1: 0.5382
 epoch: 51, train_loss: 0.7573, test_loss: 1.0708, test_f1: 0.5539
 epoch: 52, train_loss: 0.7595, test_loss: 1.0905, test_f1: 0.5435
 epoch: 53, train_loss: 0.7473, test_loss: 1.0876, test_f1: 0.5500
 epoch: 54, train_loss: 0.7601, test_loss: 1.1054, test_f1: 0.5437
 epoch: 55, train_loss: 0.7547, test_loss: 1.1172, test_f1: 0.5494
 epoch: 56, train_loss: 0.7535, test_loss: 1.1229, test_f1: 0.5435
 epoch: 57, train_loss: 0.7364, test_loss: 1.1224, test_f1: 0.5368
 epoch: 58, train_loss: 0.7486, test_loss: 1.1154, test_f1: 0.5451
 epoch: 59, train_loss: 0.7552, test_loss: 1.1316, test_f1: 0.5444
 epoch: 60, train_loss: 0.7447, test_loss: 1.1055, test_f1: 0.5385
 epoch: 61, train_loss: 0.7327, test_loss: 1.1357, test_f1: 0.5334
 epoch: 62, train_loss: 0.7291, test_loss: 1.1221, test_f1: 0.5411
 epoch: 63, train_loss: 0.7360, test_loss: 1.1179, test_f1: 0.5431
 epoch: 64, train_loss: 0.7278, test_loss: 1.1371, test_f1: 0.5262
 epoch: 65, train_loss: 0.7095, test_loss: 1.1436, test_f1: 0.5402
 epoch: 66, train_loss: 0.7221, test_loss: 1.1463, test_f1: 0.5463
 epoch: 67, train_loss: 0.7215, test_loss: 1.1567, test_f1: 0.5346
 epoch: 68, train_loss: 0.7274, test_loss: 1.1441, test_f1: 0.5343
 epoch: 69, train_loss: 0.7151, test_loss: 1.1561, test_f1: 0.5254
 epoch: 70, train_loss: 0.7073, test_loss: 1.1915, test_f1: 0.5231
 epoch: 71, train_loss: 0.7242, test_loss: 1.2125, test_f1: 0.5197
 epoch: 72, train_loss: 0.7164, test_loss: 1.2018, test_f1: 0.5287
 epoch: 73, train_loss: 0.7089, test_loss: 1.1702, test_f1: 0.5414
 epoch: 74, train_loss: 0.7004, test_loss: 1.1571, test_f1: 0.5237
 epoch: 75, train_loss: 0.7030, test_loss: 1.2028, test_f1: 0.5231
 epoch: 76, train_loss: 0.6942, test_loss: 1.2240, test_f1: 0.5199
 epoch: 77, train_loss: 0.7083, test_loss: 1.2104, test_f1: 0.5331
 epoch: 78, train_loss: 0.6956, test_loss: 1.1980, test_f1: 0.5223
 epoch: 79, train_loss: 0.7043, test_loss: 1.2175, test_f1: 0.5271
 epoch: 80, train_loss: 0.6869, test_loss: 1.2185, test_f1: 0.5313
 epoch: 81, train_loss: 0.6906, test_loss: 1.2207, test_f1: 0.5250
 epoch: 82, train_loss: 0.6877, test_loss: 1.2318, test_f1: 0.5272
 epoch: 83, train_loss: 0.6926, test_loss: 1.2118, test_f1: 0.5255
 epoch: 84, train_loss: 0.6822, test_loss: 1.2239, test_f1: 0.5271
 epoch: 85, train_loss: 0.6818, test_loss: 1.1842, test_f1: 0.5478
 epoch: 86, train_loss: 0.6662, test_loss: 1.1946, test_f1: 0.5346
 epoch: 87, train_loss: 0.6726, test_loss: 1.2398, test_f1: 0.5271
 epoch: 88, train_loss: 0.6865, test_loss: 1.2553, test_f1: 0.5306
 epoch: 89, train_loss: 0.6823, test_loss: 1.2176, test_f1: 0.5410
 epoch: 90, train_loss: 0.6782, test_loss: 1.2618, test_f1: 0.5394
 epoch: 91, train_loss: 0.6728, test_loss: 1.2666, test_f1: 0.5316
 epoch: 92, train_loss: 0.6771, test_loss: 1.2859, test_f1: 0.5295
 epoch: 93, train_loss: 0.6692, test_loss: 1.2659, test_f1: 0.5490
 epoch: 94, train_loss: 0.6859, test_loss: 1.2410, test_f1: 0.5429
 epoch: 95, train_loss: 0.6635, test_loss: 1.2382, test_f1: 0.5446
 epoch: 96, train_loss: 0.6660, test_loss: 1.2295, test_f1: 0.5606
 epoch: 97, train_loss: 0.6620, test_loss: 1.2311, test_f1: 0.5425
 epoch: 98, train_loss: 0.6740, test_loss: 1.2438, test_f1: 0.5217
 epoch: 99, train_loss: 0.6607, test_loss: 1.2217, test_f1: 0.5508
##################ITERATION #5 ****************************************
 epoch: 0, train_loss: 1.2503, test_loss: 1.3055, test_f1: 0.2281
 epoch: 1, train_loss: 1.2114, test_loss: 1.3013, test_f1: 0.2281
 epoch: 2, train_loss: 1.1929, test_loss: 1.2931, test_f1: 0.2281
 epoch: 3, train_loss: 1.1822, test_loss: 1.2735, test_f1: 0.2270
 epoch: 4, train_loss: 1.1649, test_loss: 1.2511, test_f1: 0.2562
 epoch: 5, train_loss: 1.1535, test_loss: 1.2337, test_f1: 0.2982
 epoch: 6, train_loss: 1.1312, test_loss: 1.2114, test_f1: 0.3948
 epoch: 7, train_loss: 1.1234, test_loss: 1.2208, test_f1: 0.4525
 epoch: 8, train_loss: 1.1122, test_loss: 1.2010, test_f1: 0.4635
 epoch: 9, train_loss: 1.1039, test_loss: 1.2151, test_f1: 0.4729
 epoch: 10, train_loss: 1.0883, test_loss: 1.2122, test_f1: 0.4986
 epoch: 11, train_loss: 1.0704, test_loss: 1.2118, test_f1: 0.4827
 epoch: 12, train_loss: 1.0608, test_loss: 1.2016, test_f1: 0.4978
 epoch: 13, train_loss: 1.0412, test_loss: 1.1540, test_f1: 0.5040
 epoch: 14, train_loss: 1.0319, test_loss: 1.1481, test_f1: 0.5063
 epoch: 15, train_loss: 1.0260, test_loss: 1.1504, test_f1: 0.5239
 epoch: 16, train_loss: 1.0080, test_loss: 1.1332, test_f1: 0.5148
 epoch: 17, train_loss: 1.0021, test_loss: 1.1295, test_f1: 0.5286
 epoch: 18, train_loss: 0.9865, test_loss: 1.1047, test_f1: 0.5276
 epoch: 19, train_loss: 0.9654, test_loss: 1.1096, test_f1: 0.5343
 epoch: 20, train_loss: 0.9668, test_loss: 1.1199, test_f1: 0.5264
 epoch: 21, train_loss: 0.9532, test_loss: 1.1020, test_f1: 0.5152
 epoch: 22, train_loss: 0.9436, test_loss: 1.0965, test_f1: 0.5342
 epoch: 23, train_loss: 0.9318, test_loss: 1.0943, test_f1: 0.5371
 epoch: 24, train_loss: 0.9205, test_loss: 1.1064, test_f1: 0.5324
 epoch: 25, train_loss: 0.9143, test_loss: 1.0911, test_f1: 0.5435
 epoch: 26, train_loss: 0.9171, test_loss: 1.0976, test_f1: 0.5538
 epoch: 27, train_loss: 0.8960, test_loss: 1.0836, test_f1: 0.5302
 epoch: 28, train_loss: 0.8939, test_loss: 1.0830, test_f1: 0.5487
 epoch: 29, train_loss: 0.8943, test_loss: 1.0431, test_f1: 0.5375
 epoch: 30, train_loss: 0.8758, test_loss: 1.0814, test_f1: 0.5409
 epoch: 31, train_loss: 0.8647, test_loss: 1.1044, test_f1: 0.5490
 epoch: 32, train_loss: 0.8576, test_loss: 1.0874, test_f1: 0.5576
 epoch: 33, train_loss: 0.8474, test_loss: 1.0347, test_f1: 0.5620
 epoch: 34, train_loss: 0.8406, test_loss: 1.0357, test_f1: 0.5649
 epoch: 35, train_loss: 0.8366, test_loss: 1.0352, test_f1: 0.5665
 epoch: 36, train_loss: 0.8426, test_loss: 1.0362, test_f1: 0.5716
 epoch: 37, train_loss: 0.8293, test_loss: 1.0592, test_f1: 0.5611
 epoch: 38, train_loss: 0.8208, test_loss: 1.0539, test_f1: 0.5737
 epoch: 39, train_loss: 0.8032, test_loss: 1.0674, test_f1: 0.5634
 epoch: 40, train_loss: 0.7855, test_loss: 1.0319, test_f1: 0.5722
 epoch: 41, train_loss: 0.7854, test_loss: 1.0278, test_f1: 0.5658
 epoch: 42, train_loss: 0.7717, test_loss: 1.0203, test_f1: 0.5649
 epoch: 43, train_loss: 0.7707, test_loss: 1.0199, test_f1: 0.5790
 epoch: 44, train_loss: 0.7855, test_loss: 1.0322, test_f1: 0.5730
 epoch: 45, train_loss: 0.7689, test_loss: 1.0343, test_f1: 0.5739
 epoch: 46, train_loss: 0.7614, test_loss: 1.0498, test_f1: 0.5737
 epoch: 47, train_loss: 0.7574, test_loss: 1.0642, test_f1: 0.5540
 epoch: 48, train_loss: 0.7454, test_loss: 1.0368, test_f1: 0.5621
 epoch: 49, train_loss: 0.7437, test_loss: 1.0429, test_f1: 0.5702
 epoch: 50, train_loss: 0.7436, test_loss: 1.0538, test_f1: 0.5665
 epoch: 51, train_loss: 0.7274, test_loss: 1.0190, test_f1: 0.5743
 epoch: 52, train_loss: 0.7321, test_loss: 1.0063, test_f1: 0.5826
 epoch: 53, train_loss: 0.7268, test_loss: 1.0213, test_f1: 0.5536
 epoch: 54, train_loss: 0.7349, test_loss: 1.0332, test_f1: 0.5614
 epoch: 55, train_loss: 0.7218, test_loss: 1.0413, test_f1: 0.5672
 epoch: 56, train_loss: 0.7221, test_loss: 1.0494, test_f1: 0.5606
 epoch: 57, train_loss: 0.7061, test_loss: 1.0322, test_f1: 0.5583
 epoch: 58, train_loss: 0.7024, test_loss: 1.0266, test_f1: 0.5648
 epoch: 59, train_loss: 0.6988, test_loss: 1.0361, test_f1: 0.5681
 epoch: 60, train_loss: 0.7002, test_loss: 1.0575, test_f1: 0.5558
 epoch: 61, train_loss: 0.7015, test_loss: 1.0586, test_f1: 0.5494
 epoch: 62, train_loss: 0.6904, test_loss: 1.0559, test_f1: 0.5515
 epoch: 63, train_loss: 0.6959, test_loss: 1.0473, test_f1: 0.5741
 epoch: 64, train_loss: 0.7047, test_loss: 1.0487, test_f1: 0.5780
 epoch: 65, train_loss: 0.6939, test_loss: 1.0682, test_f1: 0.5634
 epoch: 66, train_loss: 0.6908, test_loss: 1.0632, test_f1: 0.5636
 epoch: 67, train_loss: 0.6802, test_loss: 1.0613, test_f1: 0.5546
 epoch: 68, train_loss: 0.6901, test_loss: 1.0419, test_f1: 0.5659
 epoch: 69, train_loss: 0.6821, test_loss: 1.0682, test_f1: 0.5607
 epoch: 70, train_loss: 0.6712, test_loss: 1.0816, test_f1: 0.5692
 epoch: 71, train_loss: 0.6675, test_loss: 1.0710, test_f1: 0.5712
 epoch: 72, train_loss: 0.6746, test_loss: 1.0757, test_f1: 0.5709
 epoch: 73, train_loss: 0.6750, test_loss: 1.0765, test_f1: 0.5757
 epoch: 74, train_loss: 0.6588, test_loss: 1.0821, test_f1: 0.5734
 epoch: 75, train_loss: 0.6653, test_loss: 1.0740, test_f1: 0.5675
 epoch: 76, train_loss: 0.6682, test_loss: 1.0770, test_f1: 0.5617
 epoch: 77, train_loss: 0.6595, test_loss: 1.0865, test_f1: 0.5597
 epoch: 78, train_loss: 0.6552, test_loss: 1.0923, test_f1: 0.5653
 epoch: 79, train_loss: 0.6597, test_loss: 1.0965, test_f1: 0.5537
 epoch: 80, train_loss: 0.6584, test_loss: 1.1045, test_f1: 0.5669
 epoch: 81, train_loss: 0.6683, test_loss: 1.1016, test_f1: 0.5708
 epoch: 82, train_loss: 0.6592, test_loss: 1.1083, test_f1: 0.5498
 epoch: 83, train_loss: 0.6583, test_loss: 1.0984, test_f1: 0.5620
 epoch: 84, train_loss: 0.6683, test_loss: 1.0889, test_f1: 0.5833
 epoch: 85, train_loss: 0.6470, test_loss: 1.1027, test_f1: 0.5693
 epoch: 86, train_loss: 0.6523, test_loss: 1.0949, test_f1: 0.5791
 epoch: 87, train_loss: 0.6369, test_loss: 1.1199, test_f1: 0.5707
 epoch: 88, train_loss: 0.6526, test_loss: 1.1013, test_f1: 0.5756
 epoch: 89, train_loss: 0.6406, test_loss: 1.1113, test_f1: 0.5569
 epoch: 90, train_loss: 0.6398, test_loss: 1.0872, test_f1: 0.5774
 epoch: 91, train_loss: 0.6394, test_loss: 1.1155, test_f1: 0.5692
 epoch: 92, train_loss: 0.6506, test_loss: 1.1429, test_f1: 0.5597
 epoch: 93, train_loss: 0.6400, test_loss: 1.1519, test_f1: 0.5613
 epoch: 94, train_loss: 0.6332, test_loss: 1.1596, test_f1: 0.5545
 epoch: 95, train_loss: 0.6298, test_loss: 1.1327, test_f1: 0.5591
 epoch: 96, train_loss: 0.6450, test_loss: 1.1154, test_f1: 0.5693
 epoch: 97, train_loss: 0.6352, test_loss: 1.1464, test_f1: 0.5571
 epoch: 98, train_loss: 0.6297, test_loss: 1.1350, test_f1: 0.5660
 epoch: 99, train_loss: 0.6266, test_loss: 1.1198, test_f1: 0.5670
##################ITERATION #6 ****************************************
 epoch: 0, train_loss: 1.2507, test_loss: 1.3035, test_f1: 0.2248
 epoch: 1, train_loss: 1.2092, test_loss: 1.3045, test_f1: 0.2404
 epoch: 2, train_loss: 1.1991, test_loss: 1.2895, test_f1: 0.2419
 epoch: 3, train_loss: 1.1827, test_loss: 1.2653, test_f1: 0.2569
 epoch: 4, train_loss: 1.1602, test_loss: 1.2417, test_f1: 0.2611
 epoch: 5, train_loss: 1.1426, test_loss: 1.2212, test_f1: 0.3064
 epoch: 6, train_loss: 1.1377, test_loss: 1.1970, test_f1: 0.3512
 epoch: 7, train_loss: 1.1172, test_loss: 1.1770, test_f1: 0.4395
 epoch: 8, train_loss: 1.0947, test_loss: 1.1566, test_f1: 0.4478
 epoch: 9, train_loss: 1.0687, test_loss: 1.1291, test_f1: 0.4385
 epoch: 10, train_loss: 1.0612, test_loss: 1.1072, test_f1: 0.4341
 epoch: 11, train_loss: 1.0485, test_loss: 1.0991, test_f1: 0.4466
 epoch: 12, train_loss: 1.0227, test_loss: 1.0963, test_f1: 0.4318
 epoch: 13, train_loss: 1.0134, test_loss: 1.0777, test_f1: 0.4346
 epoch: 14, train_loss: 1.0020, test_loss: 1.0747, test_f1: 0.4554
 epoch: 15, train_loss: 0.9774, test_loss: 1.0577, test_f1: 0.4629
 epoch: 16, train_loss: 0.9746, test_loss: 1.0668, test_f1: 0.4787
 epoch: 17, train_loss: 0.9453, test_loss: 1.0505, test_f1: 0.4837
 epoch: 18, train_loss: 0.9498, test_loss: 1.0337, test_f1: 0.4686
 epoch: 19, train_loss: 0.9351, test_loss: 1.0250, test_f1: 0.5221
 epoch: 20, train_loss: 0.9194, test_loss: 1.0447, test_f1: 0.5266
 epoch: 21, train_loss: 0.9165, test_loss: 1.0141, test_f1: 0.5179
 epoch: 22, train_loss: 0.9036, test_loss: 1.0187, test_f1: 0.5171
 epoch: 23, train_loss: 0.8894, test_loss: 1.0072, test_f1: 0.5282
 epoch: 24, train_loss: 0.8858, test_loss: 1.0017, test_f1: 0.5187
 epoch: 25, train_loss: 0.8727, test_loss: 1.0307, test_f1: 0.5624
 epoch: 26, train_loss: 0.8678, test_loss: 1.0743, test_f1: 0.5348
 epoch: 27, train_loss: 0.8744, test_loss: 1.0391, test_f1: 0.5196
 epoch: 28, train_loss: 0.8485, test_loss: 1.0079, test_f1: 0.5654
 epoch: 29, train_loss: 0.8555, test_loss: 1.0073, test_f1: 0.5720
 epoch: 30, train_loss: 0.8378, test_loss: 0.9991, test_f1: 0.5747
 epoch: 31, train_loss: 0.8206, test_loss: 0.9861, test_f1: 0.5767
 epoch: 32, train_loss: 0.8221, test_loss: 0.9939, test_f1: 0.5774
 epoch: 33, train_loss: 0.8142, test_loss: 0.9916, test_f1: 0.5833
 epoch: 34, train_loss: 0.8011, test_loss: 0.9934, test_f1: 0.5888
 epoch: 35, train_loss: 0.8055, test_loss: 0.9896, test_f1: 0.5808
 epoch: 36, train_loss: 0.7999, test_loss: 1.0116, test_f1: 0.5803
 epoch: 37, train_loss: 0.7958, test_loss: 1.0321, test_f1: 0.5642
 epoch: 38, train_loss: 0.7765, test_loss: 1.0069, test_f1: 0.5642
 epoch: 39, train_loss: 0.7757, test_loss: 1.0104, test_f1: 0.5707
 epoch: 40, train_loss: 0.7746, test_loss: 0.9934, test_f1: 0.5823
 epoch: 41, train_loss: 0.7728, test_loss: 0.9665, test_f1: 0.5793
 epoch: 42, train_loss: 0.7748, test_loss: 0.9705, test_f1: 0.5766
 epoch: 43, train_loss: 0.7549, test_loss: 0.9924, test_f1: 0.5895
 epoch: 44, train_loss: 0.7431, test_loss: 0.9857, test_f1: 0.6043
 epoch: 45, train_loss: 0.7594, test_loss: 0.9921, test_f1: 0.5867
 epoch: 46, train_loss: 0.7329, test_loss: 0.9921, test_f1: 0.5713
 epoch: 47, train_loss: 0.7383, test_loss: 1.0085, test_f1: 0.5700
 epoch: 48, train_loss: 0.7260, test_loss: 1.0395, test_f1: 0.5779
 epoch: 49, train_loss: 0.7191, test_loss: 1.0441, test_f1: 0.5766
 epoch: 50, train_loss: 0.7196, test_loss: 1.0387, test_f1: 0.5767
 epoch: 51, train_loss: 0.6986, test_loss: 1.0729, test_f1: 0.5730
 epoch: 52, train_loss: 0.7093, test_loss: 1.0475, test_f1: 0.5841
 epoch: 53, train_loss: 0.6929, test_loss: 1.0242, test_f1: 0.5888
 epoch: 54, train_loss: 0.7033, test_loss: 1.0362, test_f1: 0.5810
 epoch: 55, train_loss: 0.7083, test_loss: 1.0324, test_f1: 0.5771
 epoch: 56, train_loss: 0.6893, test_loss: 1.0200, test_f1: 0.5790
 epoch: 57, train_loss: 0.6947, test_loss: 1.0533, test_f1: 0.5869
 epoch: 58, train_loss: 0.6792, test_loss: 1.0380, test_f1: 0.5740
 epoch: 59, train_loss: 0.6930, test_loss: 1.0806, test_f1: 0.5782
 epoch: 60, train_loss: 0.6815, test_loss: 1.0563, test_f1: 0.5709
 epoch: 61, train_loss: 0.6743, test_loss: 1.0170, test_f1: 0.5864
 epoch: 62, train_loss: 0.6760, test_loss: 1.0421, test_f1: 0.5875
 epoch: 63, train_loss: 0.6723, test_loss: 1.0616, test_f1: 0.5748
 epoch: 64, train_loss: 0.6799, test_loss: 1.0664, test_f1: 0.5778
 epoch: 65, train_loss: 0.6681, test_loss: 1.0550, test_f1: 0.5897
 epoch: 66, train_loss: 0.6674, test_loss: 1.0313, test_f1: 0.5872
 epoch: 67, train_loss: 0.6548, test_loss: 1.0597, test_f1: 0.5796
 epoch: 68, train_loss: 0.6700, test_loss: 1.0420, test_f1: 0.5942
 epoch: 69, train_loss: 0.6525, test_loss: 1.0601, test_f1: 0.5763
 epoch: 70, train_loss: 0.6630, test_loss: 1.0989, test_f1: 0.5776
 epoch: 71, train_loss: 0.6633, test_loss: 1.0733, test_f1: 0.5813
 epoch: 72, train_loss: 0.6662, test_loss: 1.0878, test_f1: 0.5894
 epoch: 73, train_loss: 0.6577, test_loss: 1.1180, test_f1: 0.5837
 epoch: 74, train_loss: 0.6546, test_loss: 1.1314, test_f1: 0.5932
 epoch: 75, train_loss: 0.6555, test_loss: 1.1021, test_f1: 0.5946
 epoch: 76, train_loss: 0.6430, test_loss: 1.1198, test_f1: 0.5814
 epoch: 77, train_loss: 0.6461, test_loss: 1.1293, test_f1: 0.5817
 epoch: 78, train_loss: 0.6510, test_loss: 1.0881, test_f1: 0.5814
 epoch: 79, train_loss: 0.6457, test_loss: 1.0552, test_f1: 0.5637
 epoch: 80, train_loss: 0.6415, test_loss: 1.1255, test_f1: 0.5825
 epoch: 81, train_loss: 0.6355, test_loss: 1.1310, test_f1: 0.5820
 epoch: 82, train_loss: 0.6394, test_loss: 1.0780, test_f1: 0.5906
 epoch: 83, train_loss: 0.6416, test_loss: 1.1206, test_f1: 0.5916
 epoch: 84, train_loss: 0.6391, test_loss: 1.0353, test_f1: 0.5971
 epoch: 85, train_loss: 0.6368, test_loss: 1.0422, test_f1: 0.5845
 epoch: 86, train_loss: 0.6319, test_loss: 1.0495, test_f1: 0.5840
 epoch: 87, train_loss: 0.6330, test_loss: 1.0830, test_f1: 0.5670
 epoch: 88, train_loss: 0.6419, test_loss: 1.0702, test_f1: 0.5845
 epoch: 89, train_loss: 0.6274, test_loss: 1.0631, test_f1: 0.6009
 epoch: 90, train_loss: 0.6367, test_loss: 1.0478, test_f1: 0.5935
 epoch: 91, train_loss: 0.6315, test_loss: 1.0590, test_f1: 0.5869
 epoch: 92, train_loss: 0.6303, test_loss: 1.0293, test_f1: 0.6004
 epoch: 93, train_loss: 0.6317, test_loss: 1.0329, test_f1: 0.5894
 epoch: 94, train_loss: 0.6244, test_loss: 1.0400, test_f1: 0.5976
 epoch: 95, train_loss: 0.6124, test_loss: 1.0197, test_f1: 0.6074
 epoch: 96, train_loss: 0.6208, test_loss: 1.0397, test_f1: 0.5954
 epoch: 97, train_loss: 0.6259, test_loss: 1.0495, test_f1: 0.5718
 epoch: 98, train_loss: 0.6071, test_loss: 1.0732, test_f1: 0.5670
 epoch: 99, train_loss: 0.6081, test_loss: 1.0603, test_f1: 0.5843
##################ITERATION #7 ****************************************
 epoch: 0, train_loss: 1.2506, test_loss: 1.3022, test_f1: 0.2354
 epoch: 1, train_loss: 1.2055, test_loss: 1.3058, test_f1: 0.2404
 epoch: 2, train_loss: 1.1750, test_loss: 1.3056, test_f1: 0.2178
 epoch: 3, train_loss: 1.1563, test_loss: 1.2846, test_f1: 0.2552
 epoch: 4, train_loss: 1.1386, test_loss: 1.2512, test_f1: 0.2639
 epoch: 5, train_loss: 1.1301, test_loss: 1.2179, test_f1: 0.3496
 epoch: 6, train_loss: 1.1136, test_loss: 1.1944, test_f1: 0.3810
 epoch: 7, train_loss: 1.0991, test_loss: 1.1829, test_f1: 0.3918
 epoch: 8, train_loss: 1.0892, test_loss: 1.1676, test_f1: 0.4108
 epoch: 9, train_loss: 1.0818, test_loss: 1.1547, test_f1: 0.4252
 epoch: 10, train_loss: 1.0674, test_loss: 1.1561, test_f1: 0.4192
 epoch: 11, train_loss: 1.0492, test_loss: 1.1533, test_f1: 0.4277
 epoch: 12, train_loss: 1.0478, test_loss: 1.1451, test_f1: 0.4483
 epoch: 13, train_loss: 1.0300, test_loss: 1.1271, test_f1: 0.4602
 epoch: 14, train_loss: 1.0192, test_loss: 1.1227, test_f1: 0.4528
 epoch: 15, train_loss: 1.0085, test_loss: 1.1233, test_f1: 0.4615
 epoch: 16, train_loss: 0.9990, test_loss: 1.1016, test_f1: 0.4787
 epoch: 17, train_loss: 0.9841, test_loss: 1.1053, test_f1: 0.4763
 epoch: 18, train_loss: 0.9730, test_loss: 1.0976, test_f1: 0.4923
 epoch: 19, train_loss: 0.9655, test_loss: 1.0803, test_f1: 0.5036
 epoch: 20, train_loss: 0.9671, test_loss: 1.0980, test_f1: 0.4932
 epoch: 21, train_loss: 0.9465, test_loss: 1.0622, test_f1: 0.5038
 epoch: 22, train_loss: 0.9439, test_loss: 1.0553, test_f1: 0.5097
 epoch: 23, train_loss: 0.9417, test_loss: 1.0483, test_f1: 0.5103
 epoch: 24, train_loss: 0.9294, test_loss: 1.0500, test_f1: 0.5063
 epoch: 25, train_loss: 0.9155, test_loss: 1.0594, test_f1: 0.5352
 epoch: 26, train_loss: 0.8981, test_loss: 1.0359, test_f1: 0.5350
 epoch: 27, train_loss: 0.9018, test_loss: 1.0226, test_f1: 0.5456
 epoch: 28, train_loss: 0.8972, test_loss: 1.0206, test_f1: 0.5600
 epoch: 29, train_loss: 0.8865, test_loss: 1.0327, test_f1: 0.5522
 epoch: 30, train_loss: 0.8838, test_loss: 1.0260, test_f1: 0.5595
 epoch: 31, train_loss: 0.8765, test_loss: 1.0254, test_f1: 0.5505
 epoch: 32, train_loss: 0.8710, test_loss: 1.0181, test_f1: 0.5484
 epoch: 33, train_loss: 0.8660, test_loss: 1.0246, test_f1: 0.5649
 epoch: 34, train_loss: 0.8474, test_loss: 1.0687, test_f1: 0.5248
 epoch: 35, train_loss: 0.8439, test_loss: 1.0247, test_f1: 0.5550
 epoch: 36, train_loss: 0.8407, test_loss: 1.0251, test_f1: 0.5638
 epoch: 37, train_loss: 0.8401, test_loss: 1.0379, test_f1: 0.5442
 epoch: 38, train_loss: 0.8314, test_loss: 1.0362, test_f1: 0.5503
 epoch: 39, train_loss: 0.8278, test_loss: 1.0670, test_f1: 0.5395
 epoch: 40, train_loss: 0.8217, test_loss: 1.0682, test_f1: 0.5326
 epoch: 41, train_loss: 0.8156, test_loss: 1.0514, test_f1: 0.5369
 epoch: 42, train_loss: 0.8052, test_loss: 1.0614, test_f1: 0.5392
 epoch: 43, train_loss: 0.8157, test_loss: 1.0724, test_f1: 0.5511
 epoch: 44, train_loss: 0.8005, test_loss: 1.0466, test_f1: 0.5394
 epoch: 45, train_loss: 0.8086, test_loss: 1.1182, test_f1: 0.4708
 epoch: 46, train_loss: 0.7990, test_loss: 1.0903, test_f1: 0.5458
 epoch: 47, train_loss: 0.7834, test_loss: 1.0650, test_f1: 0.5650
 epoch: 48, train_loss: 0.7764, test_loss: 1.0453, test_f1: 0.5548
 epoch: 49, train_loss: 0.7686, test_loss: 1.0292, test_f1: 0.5696
 epoch: 50, train_loss: 0.7692, test_loss: 1.0177, test_f1: 0.5668
 epoch: 51, train_loss: 0.7646, test_loss: 1.0120, test_f1: 0.5735
 epoch: 52, train_loss: 0.7739, test_loss: 1.0117, test_f1: 0.5507
 epoch: 53, train_loss: 0.7479, test_loss: 1.0253, test_f1: 0.5681
 epoch: 54, train_loss: 0.7581, test_loss: 1.0171, test_f1: 0.5798
 epoch: 55, train_loss: 0.7556, test_loss: 1.0087, test_f1: 0.5783
 epoch: 56, train_loss: 0.7526, test_loss: 1.0036, test_f1: 0.5885
 epoch: 57, train_loss: 0.7564, test_loss: 1.0068, test_f1: 0.5863
 epoch: 58, train_loss: 0.7422, test_loss: 1.0240, test_f1: 0.5715
 epoch: 59, train_loss: 0.7400, test_loss: 1.0286, test_f1: 0.5574
 epoch: 60, train_loss: 0.7427, test_loss: 1.0101, test_f1: 0.5738
 epoch: 61, train_loss: 0.7376, test_loss: 1.0291, test_f1: 0.5609
 epoch: 62, train_loss: 0.7236, test_loss: 1.0139, test_f1: 0.5802
 epoch: 63, train_loss: 0.7258, test_loss: 1.0201, test_f1: 0.5643
 epoch: 64, train_loss: 0.7404, test_loss: 1.0144, test_f1: 0.5805
 epoch: 65, train_loss: 0.7224, test_loss: 1.0245, test_f1: 0.5648
 epoch: 66, train_loss: 0.7372, test_loss: 1.0308, test_f1: 0.5661
 epoch: 67, train_loss: 0.7256, test_loss: 1.0452, test_f1: 0.5530
 epoch: 68, train_loss: 0.7198, test_loss: 1.0336, test_f1: 0.5579
 epoch: 69, train_loss: 0.7218, test_loss: 1.0328, test_f1: 0.5699
 epoch: 70, train_loss: 0.7028, test_loss: 1.0198, test_f1: 0.5727
 epoch: 71, train_loss: 0.7144, test_loss: 1.0440, test_f1: 0.5736
 epoch: 72, train_loss: 0.7135, test_loss: 1.0405, test_f1: 0.5754
 epoch: 73, train_loss: 0.7011, test_loss: 1.0382, test_f1: 0.5576
 epoch: 74, train_loss: 0.6957, test_loss: 1.0380, test_f1: 0.5646
 epoch: 75, train_loss: 0.7058, test_loss: 1.0132, test_f1: 0.6031
 epoch: 76, train_loss: 0.7096, test_loss: 1.0333, test_f1: 0.5821
 epoch: 77, train_loss: 0.7061, test_loss: 1.0587, test_f1: 0.5671
 epoch: 78, train_loss: 0.7011, test_loss: 1.0815, test_f1: 0.5722
 epoch: 79, train_loss: 0.7124, test_loss: 1.0779, test_f1: 0.5731
 epoch: 80, train_loss: 0.6999, test_loss: 1.0479, test_f1: 0.5902
 epoch: 81, train_loss: 0.6892, test_loss: 1.0666, test_f1: 0.5673
 epoch: 82, train_loss: 0.6808, test_loss: 1.0738, test_f1: 0.5641
 epoch: 83, train_loss: 0.6848, test_loss: 1.0561, test_f1: 0.5761
 epoch: 84, train_loss: 0.6970, test_loss: 1.0708, test_f1: 0.5752
 epoch: 85, train_loss: 0.6858, test_loss: 1.0599, test_f1: 0.5741
 epoch: 86, train_loss: 0.6856, test_loss: 1.0387, test_f1: 0.5953
 epoch: 87, train_loss: 0.6902, test_loss: 1.0483, test_f1: 0.5705
 epoch: 88, train_loss: 0.6774, test_loss: 1.0799, test_f1: 0.5665
 epoch: 89, train_loss: 0.6804, test_loss: 1.0952, test_f1: 0.5771
 epoch: 90, train_loss: 0.6623, test_loss: 1.0850, test_f1: 0.5677
 epoch: 91, train_loss: 0.6699, test_loss: 1.0722, test_f1: 0.5623
 epoch: 92, train_loss: 0.6752, test_loss: 1.0665, test_f1: 0.5941
 epoch: 93, train_loss: 0.6685, test_loss: 1.0597, test_f1: 0.5843
 epoch: 94, train_loss: 0.6696, test_loss: 1.0693, test_f1: 0.5863
 epoch: 95, train_loss: 0.6634, test_loss: 1.0812, test_f1: 0.5692
 epoch: 96, train_loss: 0.6625, test_loss: 1.0844, test_f1: 0.5808
 epoch: 97, train_loss: 0.6578, test_loss: 1.0901, test_f1: 0.5838
 epoch: 98, train_loss: 0.6560, test_loss: 1.1039, test_f1: 0.5836
 epoch: 99, train_loss: 0.6648, test_loss: 1.0811, test_f1: 0.5833
##################ITERATION #8 ****************************************
 epoch: 0, train_loss: 1.2605, test_loss: 1.3005, test_f1: 0.2407
 epoch: 1, train_loss: 1.2001, test_loss: 1.2910, test_f1: 0.2443
 epoch: 2, train_loss: 1.1764, test_loss: 1.2832, test_f1: 0.2480
 epoch: 3, train_loss: 1.1656, test_loss: 1.2522, test_f1: 0.2536
 epoch: 4, train_loss: 1.1286, test_loss: 1.2322, test_f1: 0.2754
 epoch: 5, train_loss: 1.1255, test_loss: 1.2212, test_f1: 0.3568
 epoch: 6, train_loss: 1.1132, test_loss: 1.2281, test_f1: 0.3781
 epoch: 7, train_loss: 1.0935, test_loss: 1.2224, test_f1: 0.3818
 epoch: 8, train_loss: 1.0684, test_loss: 1.2013, test_f1: 0.4490
 epoch: 9, train_loss: 1.0505, test_loss: 1.1766, test_f1: 0.4800
 epoch: 10, train_loss: 1.0425, test_loss: 1.1633, test_f1: 0.4774
 epoch: 11, train_loss: 1.0286, test_loss: 1.1714, test_f1: 0.4805
 epoch: 12, train_loss: 0.9960, test_loss: 1.1498, test_f1: 0.5089
 epoch: 13, train_loss: 0.9913, test_loss: 1.1486, test_f1: 0.5204
 epoch: 14, train_loss: 0.9788, test_loss: 1.0857, test_f1: 0.5223
 epoch: 15, train_loss: 0.9716, test_loss: 1.0800, test_f1: 0.5302
 epoch: 16, train_loss: 0.9706, test_loss: 1.0613, test_f1: 0.5319
 epoch: 17, train_loss: 0.9426, test_loss: 1.0651, test_f1: 0.5273
 epoch: 18, train_loss: 0.9326, test_loss: 1.0442, test_f1: 0.5274
 epoch: 19, train_loss: 0.9238, test_loss: 1.0312, test_f1: 0.5434
 epoch: 20, train_loss: 0.9179, test_loss: 1.0281, test_f1: 0.5476
 epoch: 21, train_loss: 0.9148, test_loss: 1.0227, test_f1: 0.5476
 epoch: 22, train_loss: 0.8988, test_loss: 1.0142, test_f1: 0.5515
 epoch: 23, train_loss: 0.9005, test_loss: 1.0099, test_f1: 0.5330
 epoch: 24, train_loss: 0.8848, test_loss: 1.0071, test_f1: 0.5437
 epoch: 25, train_loss: 0.8680, test_loss: 1.0232, test_f1: 0.5348
 epoch: 26, train_loss: 0.8648, test_loss: 1.0077, test_f1: 0.5467
 epoch: 27, train_loss: 0.8548, test_loss: 1.0101, test_f1: 0.5374
 epoch: 28, train_loss: 0.8463, test_loss: 1.0007, test_f1: 0.5291
 epoch: 29, train_loss: 0.8435, test_loss: 0.9986, test_f1: 0.5396
 epoch: 30, train_loss: 0.8399, test_loss: 0.9955, test_f1: 0.5586
 epoch: 31, train_loss: 0.8324, test_loss: 0.9895, test_f1: 0.5492
 epoch: 32, train_loss: 0.8318, test_loss: 0.9953, test_f1: 0.5515
 epoch: 33, train_loss: 0.8195, test_loss: 0.9929, test_f1: 0.5729
 epoch: 34, train_loss: 0.8100, test_loss: 0.9877, test_f1: 0.5420
 epoch: 35, train_loss: 0.8047, test_loss: 0.9853, test_f1: 0.5530
 epoch: 36, train_loss: 0.8037, test_loss: 0.9945, test_f1: 0.5482
 epoch: 37, train_loss: 0.7946, test_loss: 0.9882, test_f1: 0.5495
 epoch: 38, train_loss: 0.7797, test_loss: 0.9919, test_f1: 0.5449
 epoch: 39, train_loss: 0.7966, test_loss: 0.9906, test_f1: 0.5488
 epoch: 40, train_loss: 0.7689, test_loss: 0.9875, test_f1: 0.5550
 epoch: 41, train_loss: 0.7626, test_loss: 0.9876, test_f1: 0.5232
 epoch: 42, train_loss: 0.7716, test_loss: 1.0054, test_f1: 0.5055
 epoch: 43, train_loss: 0.7485, test_loss: 0.9959, test_f1: 0.5288
 epoch: 44, train_loss: 0.7450, test_loss: 0.9895, test_f1: 0.5424
 epoch: 45, train_loss: 0.7351, test_loss: 0.9825, test_f1: 0.5405
 epoch: 46, train_loss: 0.7370, test_loss: 1.0046, test_f1: 0.5524
 epoch: 47, train_loss: 0.7336, test_loss: 1.0129, test_f1: 0.5380
 epoch: 48, train_loss: 0.7320, test_loss: 1.0182, test_f1: 0.5429
 epoch: 49, train_loss: 0.7196, test_loss: 1.0007, test_f1: 0.5683
 epoch: 50, train_loss: 0.7142, test_loss: 1.0242, test_f1: 0.5633
 epoch: 51, train_loss: 0.7324, test_loss: 1.0079, test_f1: 0.5663
 epoch: 52, train_loss: 0.6984, test_loss: 1.0304, test_f1: 0.5270
 epoch: 53, train_loss: 0.6980, test_loss: 1.0384, test_f1: 0.5168
 epoch: 54, train_loss: 0.6982, test_loss: 1.0135, test_f1: 0.5697
 epoch: 55, train_loss: 0.6875, test_loss: 1.0222, test_f1: 0.5679
 epoch: 56, train_loss: 0.6780, test_loss: 1.0207, test_f1: 0.5491
 epoch: 57, train_loss: 0.6940, test_loss: 1.0450, test_f1: 0.5377
 epoch: 58, train_loss: 0.6799, test_loss: 1.0430, test_f1: 0.5707
 epoch: 59, train_loss: 0.6960, test_loss: 1.0328, test_f1: 0.5390
 epoch: 60, train_loss: 0.6926, test_loss: 1.0368, test_f1: 0.5348
 epoch: 61, train_loss: 0.6740, test_loss: 1.0431, test_f1: 0.5380
 epoch: 62, train_loss: 0.6844, test_loss: 1.0243, test_f1: 0.5752
 epoch: 63, train_loss: 0.6921, test_loss: 1.0190, test_f1: 0.5502
 epoch: 64, train_loss: 0.6851, test_loss: 1.0671, test_f1: 0.5507
 epoch: 65, train_loss: 0.6547, test_loss: 1.0712, test_f1: 0.5516
 epoch: 66, train_loss: 0.6804, test_loss: 1.1111, test_f1: 0.5339
 epoch: 67, train_loss: 0.6768, test_loss: 1.0520, test_f1: 0.5507
 epoch: 68, train_loss: 0.6639, test_loss: 1.0494, test_f1: 0.5563
 epoch: 69, train_loss: 0.6592, test_loss: 1.0500, test_f1: 0.5590
 epoch: 70, train_loss: 0.6572, test_loss: 1.0916, test_f1: 0.5509
 epoch: 71, train_loss: 0.6688, test_loss: 1.0847, test_f1: 0.5467
 epoch: 72, train_loss: 0.6545, test_loss: 1.1115, test_f1: 0.5633
 epoch: 73, train_loss: 0.6560, test_loss: 1.0931, test_f1: 0.5687
 epoch: 74, train_loss: 0.6616, test_loss: 1.0899, test_f1: 0.5647
 epoch: 75, train_loss: 0.6466, test_loss: 1.1033, test_f1: 0.5603
 epoch: 76, train_loss: 0.6536, test_loss: 1.0829, test_f1: 0.5730
 epoch: 77, train_loss: 0.6392, test_loss: 1.1142, test_f1: 0.5578
 epoch: 78, train_loss: 0.6547, test_loss: 1.1063, test_f1: 0.5637
 epoch: 79, train_loss: 0.6539, test_loss: 1.1079, test_f1: 0.5469
 epoch: 80, train_loss: 0.6337, test_loss: 1.1463, test_f1: 0.5541
 epoch: 81, train_loss: 0.6292, test_loss: 1.1353, test_f1: 0.5539
 epoch: 82, train_loss: 0.6437, test_loss: 1.1302, test_f1: 0.5735
 epoch: 83, train_loss: 0.6240, test_loss: 1.1411, test_f1: 0.5564
 epoch: 84, train_loss: 0.6192, test_loss: 1.1261, test_f1: 0.5715
 epoch: 85, train_loss: 0.6359, test_loss: 1.1598, test_f1: 0.5669
 epoch: 86, train_loss: 0.6290, test_loss: 1.1466, test_f1: 0.5683
 epoch: 87, train_loss: 0.6283, test_loss: 1.1615, test_f1: 0.5564
 epoch: 88, train_loss: 0.6154, test_loss: 1.1434, test_f1: 0.5664
 epoch: 89, train_loss: 0.6308, test_loss: 1.1873, test_f1: 0.5686
 epoch: 90, train_loss: 0.6271, test_loss: 1.2032, test_f1: 0.5584
 epoch: 91, train_loss: 0.6314, test_loss: 1.2012, test_f1: 0.5419
 epoch: 92, train_loss: 0.6165, test_loss: 1.2308, test_f1: 0.5606
 epoch: 93, train_loss: 0.6171, test_loss: 1.1859, test_f1: 0.5431
 epoch: 94, train_loss: 0.6129, test_loss: 1.1467, test_f1: 0.5692
 epoch: 95, train_loss: 0.6247, test_loss: 1.1394, test_f1: 0.5600
 epoch: 96, train_loss: 0.6114, test_loss: 1.1974, test_f1: 0.5437
 epoch: 97, train_loss: 0.6262, test_loss: 1.1642, test_f1: 0.5598
 epoch: 98, train_loss: 0.6055, test_loss: 1.1329, test_f1: 0.5615
 epoch: 99, train_loss: 0.6101, test_loss: 1.1613, test_f1: 0.5577
##################ITERATION #9 ****************************************
 epoch: 0, train_loss: 1.2648, test_loss: 1.3174, test_f1: 0.2281
 epoch: 1, train_loss: 1.2110, test_loss: 1.3063, test_f1: 0.2281
 epoch: 2, train_loss: 1.1840, test_loss: 1.2967, test_f1: 0.2281
 epoch: 3, train_loss: 1.1739, test_loss: 1.2723, test_f1: 0.2640
 epoch: 4, train_loss: 1.1541, test_loss: 1.2584, test_f1: 0.2844
 epoch: 5, train_loss: 1.1368, test_loss: 1.2288, test_f1: 0.3904
 epoch: 6, train_loss: 1.1205, test_loss: 1.1975, test_f1: 0.3957
 epoch: 7, train_loss: 1.0965, test_loss: 1.1695, test_f1: 0.4125
 epoch: 8, train_loss: 1.0796, test_loss: 1.1495, test_f1: 0.4183
 epoch: 9, train_loss: 1.0502, test_loss: 1.1271, test_f1: 0.4396
 epoch: 10, train_loss: 1.0475, test_loss: 1.1202, test_f1: 0.4354
 epoch: 11, train_loss: 1.0310, test_loss: 1.1215, test_f1: 0.4868
 epoch: 12, train_loss: 1.0277, test_loss: 1.1134, test_f1: 0.4894
 epoch: 13, train_loss: 1.0036, test_loss: 1.0882, test_f1: 0.4888
 epoch: 14, train_loss: 0.9958, test_loss: 1.0823, test_f1: 0.5218
 epoch: 15, train_loss: 0.9767, test_loss: 1.0696, test_f1: 0.5313
 epoch: 16, train_loss: 0.9787, test_loss: 1.0662, test_f1: 0.5225
 epoch: 17, train_loss: 0.9655, test_loss: 1.0639, test_f1: 0.5352
 epoch: 18, train_loss: 0.9508, test_loss: 1.0626, test_f1: 0.5302
 epoch: 19, train_loss: 0.9456, test_loss: 1.0696, test_f1: 0.5277
 epoch: 20, train_loss: 0.9389, test_loss: 1.0538, test_f1: 0.5377
 epoch: 21, train_loss: 0.9187, test_loss: 1.0511, test_f1: 0.5418
 epoch: 22, train_loss: 0.9214, test_loss: 1.0515, test_f1: 0.5464
 epoch: 23, train_loss: 0.9086, test_loss: 1.0598, test_f1: 0.5659
 epoch: 24, train_loss: 0.9030, test_loss: 1.0479, test_f1: 0.5563
 epoch: 25, train_loss: 0.8966, test_loss: 1.0445, test_f1: 0.5592
 epoch: 26, train_loss: 0.8918, test_loss: 1.0483, test_f1: 0.5530
 epoch: 27, train_loss: 0.8881, test_loss: 1.0593, test_f1: 0.5599
 epoch: 28, train_loss: 0.8731, test_loss: 1.0475, test_f1: 0.5540
 epoch: 29, train_loss: 0.8686, test_loss: 1.0445, test_f1: 0.5544
 epoch: 30, train_loss: 0.8541, test_loss: 1.0506, test_f1: 0.5549
 epoch: 31, train_loss: 0.8632, test_loss: 1.0459, test_f1: 0.5512
 epoch: 32, train_loss: 0.8428, test_loss: 1.0487, test_f1: 0.5638
 epoch: 33, train_loss: 0.8370, test_loss: 1.0368, test_f1: 0.5481
 epoch: 34, train_loss: 0.8487, test_loss: 1.0428, test_f1: 0.5572
 epoch: 35, train_loss: 0.8217, test_loss: 1.0290, test_f1: 0.5400
 epoch: 36, train_loss: 0.8174, test_loss: 1.0492, test_f1: 0.5498
 epoch: 37, train_loss: 0.8107, test_loss: 1.0433, test_f1: 0.5490
 epoch: 38, train_loss: 0.7964, test_loss: 1.0503, test_f1: 0.5521
 epoch: 39, train_loss: 0.8140, test_loss: 1.0437, test_f1: 0.5465
 epoch: 40, train_loss: 0.7913, test_loss: 1.0464, test_f1: 0.5494
 epoch: 41, train_loss: 0.7849, test_loss: 1.0466, test_f1: 0.5524
 epoch: 42, train_loss: 0.7889, test_loss: 1.0515, test_f1: 0.5556
 epoch: 43, train_loss: 0.7754, test_loss: 1.0578, test_f1: 0.5654
 epoch: 44, train_loss: 0.7736, test_loss: 1.0482, test_f1: 0.5600
 epoch: 45, train_loss: 0.7557, test_loss: 1.0632, test_f1: 0.5595
 epoch: 46, train_loss: 0.7641, test_loss: 1.0417, test_f1: 0.5635
 epoch: 47, train_loss: 0.7552, test_loss: 1.0516, test_f1: 0.5739
 epoch: 48, train_loss: 0.7489, test_loss: 1.0489, test_f1: 0.5622
 epoch: 49, train_loss: 0.7591, test_loss: 1.0525, test_f1: 0.5546
 epoch: 50, train_loss: 0.7405, test_loss: 1.0428, test_f1: 0.5543
 epoch: 51, train_loss: 0.7459, test_loss: 1.0666, test_f1: 0.5594
 epoch: 52, train_loss: 0.7291, test_loss: 1.0581, test_f1: 0.5601
 epoch: 53, train_loss: 0.7307, test_loss: 1.0733, test_f1: 0.5522
 epoch: 54, train_loss: 0.7302, test_loss: 1.0706, test_f1: 0.5431
 epoch: 55, train_loss: 0.7213, test_loss: 1.0781, test_f1: 0.5525
 epoch: 56, train_loss: 0.7249, test_loss: 1.0741, test_f1: 0.5494
 epoch: 57, train_loss: 0.7035, test_loss: 1.0937, test_f1: 0.5536
 epoch: 58, train_loss: 0.7170, test_loss: 1.0924, test_f1: 0.5492
 epoch: 59, train_loss: 0.7181, test_loss: 1.0939, test_f1: 0.5525
 epoch: 60, train_loss: 0.7079, test_loss: 1.0847, test_f1: 0.5549
 epoch: 61, train_loss: 0.7049, test_loss: 1.0779, test_f1: 0.5695
 epoch: 62, train_loss: 0.7063, test_loss: 1.0798, test_f1: 0.5607
 epoch: 63, train_loss: 0.6957, test_loss: 1.0943, test_f1: 0.5557
 epoch: 64, train_loss: 0.6890, test_loss: 1.0997, test_f1: 0.5422
 epoch: 65, train_loss: 0.7009, test_loss: 1.0844, test_f1: 0.5407
 epoch: 66, train_loss: 0.6956, test_loss: 1.0859, test_f1: 0.5612
 epoch: 67, train_loss: 0.6966, test_loss: 1.1007, test_f1: 0.5497
 epoch: 68, train_loss: 0.6987, test_loss: 1.1130, test_f1: 0.5199
 epoch: 69, train_loss: 0.6792, test_loss: 1.0959, test_f1: 0.5469
 epoch: 70, train_loss: 0.6921, test_loss: 1.1079, test_f1: 0.5373
 epoch: 71, train_loss: 0.6852, test_loss: 1.1154, test_f1: 0.5341
 epoch: 72, train_loss: 0.6838, test_loss: 1.1100, test_f1: 0.5374
 epoch: 73, train_loss: 0.6749, test_loss: 1.0907, test_f1: 0.5612
 epoch: 74, train_loss: 0.6656, test_loss: 1.1019, test_f1: 0.5588
 epoch: 75, train_loss: 0.6778, test_loss: 1.1079, test_f1: 0.5426
 epoch: 76, train_loss: 0.6715, test_loss: 1.1388, test_f1: 0.5253
 epoch: 77, train_loss: 0.6640, test_loss: 1.1175, test_f1: 0.5591
 epoch: 78, train_loss: 0.6840, test_loss: 1.1248, test_f1: 0.5324
 epoch: 79, train_loss: 0.6601, test_loss: 1.1093, test_f1: 0.5196
 epoch: 80, train_loss: 0.6609, test_loss: 1.1424, test_f1: 0.5421
 epoch: 81, train_loss: 0.6523, test_loss: 1.1478, test_f1: 0.5098
 epoch: 82, train_loss: 0.6659, test_loss: 1.1297, test_f1: 0.5330
 epoch: 83, train_loss: 0.6602, test_loss: 1.1144, test_f1: 0.5321
 epoch: 84, train_loss: 0.6583, test_loss: 1.1033, test_f1: 0.5551
 epoch: 85, train_loss: 0.6582, test_loss: 1.1184, test_f1: 0.5407
 epoch: 86, train_loss: 0.6517, test_loss: 1.1440, test_f1: 0.5234
 epoch: 87, train_loss: 0.6491, test_loss: 1.1425, test_f1: 0.5410
 epoch: 88, train_loss: 0.6608, test_loss: 1.1373, test_f1: 0.5442
 epoch: 89, train_loss: 0.6511, test_loss: 1.1385, test_f1: 0.5419
 epoch: 90, train_loss: 0.6355, test_loss: 1.1480, test_f1: 0.5320
 epoch: 91, train_loss: 0.6395, test_loss: 1.1507, test_f1: 0.5478
 epoch: 92, train_loss: 0.6388, test_loss: 1.1680, test_f1: 0.5266
 epoch: 93, train_loss: 0.6290, test_loss: 1.1701, test_f1: 0.5291
 epoch: 94, train_loss: 0.6292, test_loss: 1.1493, test_f1: 0.5354
 epoch: 95, train_loss: 0.6339, test_loss: 1.1593, test_f1: 0.5313
 epoch: 96, train_loss: 0.6436, test_loss: 1.1443, test_f1: 0.5413
 epoch: 97, train_loss: 0.6446, test_loss: 1.1411, test_f1: 0.5443
 epoch: 98, train_loss: 0.6283, test_loss: 1.1612, test_f1: 0.5433
 epoch: 99, train_loss: 0.6380, test_loss: 1.1699, test_f1: 0.5532

Training completed in 393.44 seconds
Best F1: 0.6126 at epoch 97
Mean F1 across iterations: 0.5840  0.0171
========================FINAL RESULTS================================
FEGIN weighted F1: 0.6126  0.0171
python main.py --data ltspice_demos --representation component_pin --model FEGIN --layers 6 --hiddens 64 --batch_size 128 --lr 0.0001 --emb_size 250 --epochs 100 --save_appendix component_pin_L6_H64_BS128_LR0.0001_E250 --no_val
-----



STDERR:
  File "main.py", line 370, in <module>
    main()
  File "main.py", line 254, in main
    dataset = dataset_class(
  File "/home/philip/projects/ltspice_examples_code_repo/Circuit-Completion-Using-GNNs/component_classification_with_link_prediction_head/evaluation/FEGIN/kernel/circuit_datasets.py", line 15, in __init__
    self.data, self.slices = torch.load(self.processed_paths[0])
  File "/home/philip/.local/lib/python3.8/site-packages/torch/serialization.py", line 1040, in load
    warnings.warn(
  File "/usr/lib/python3.8/warnings.py", line 109, in _showwarnmsg
    sw(msg.message, msg.category, msg.filename, msg.lineno,
  File "main.py", line 47, in warn_with_traceback
    traceback.print_stack(file=log)
/home/philip/projects/ltspice_examples_code_repo/Circuit-Completion-Using-GNNs/component_classification_with_link_prediction_head/evaluation/FEGIN/kernel/circuit_datasets.py:15: FutureWarning: You are using `torch.load` with `weights_only=False` (the current default value), which uses the default pickle module implicitly. It is possible to construct malicious pickle data which will execute arbitrary code during unpickling (See https://github.com/pytorch/pytorch/blob/main/SECURITY.md#untrusted-models for more details). In a future release, the default value for `weights_only` will be flipped to `True`. This limits the functions that could be executed during unpickling. Arbitrary objects will no longer be allowed to be loaded via this mode unless they are explicitly allowlisted by the user via `torch.serialization.add_safe_globals`. We recommend you start setting `weights_only=True` for any use case where you don't have full control of the loaded file. Please open an issue on GitHub for any issues related to this experimental feature.
  self.data, self.slices = torch.load(self.processed_paths[0])
