STDOUT:
Results will be saved in /home/philip/projects/ltspice_examples_code_repo/Circuit-Completion-Using-GNNs/component_classification_with_link_prediction_head/evaluation/FEGIN/results/model_FEGIN_dataset_ltspice_demos
Command line input: python main.py --data ltspice_demos --representation component_pin --model FEGIN --layers 6 --hiddens 64 --batch_size 256 --lr 0.001 --emb_size 128 --epochs 100 --save_appendix component_pin_L6_H64_BS256_LR0.001_E128 --no_val
 is saved.
-----
ltspice_demos - FEGIN
Using 6 layers, 64 hidden units, h = 2
Loading component_pin representation dataset
ENTERED
Training FEGIN on component_pin representation
Train: 1565, Test: 383
##################ITERATION #0 ****************************************
 epoch: 0, train_loss: 1.3757, test_loss: 1.3743, test_f1: 0.1365
 epoch: 1, train_loss: 1.3194, test_loss: 1.3506, test_f1: 0.3190
 epoch: 2, train_loss: 1.2631, test_loss: 1.3225, test_f1: 0.3017
 epoch: 3, train_loss: 1.2116, test_loss: 1.3013, test_f1: 0.3141
 epoch: 4, train_loss: 1.1772, test_loss: 1.2874, test_f1: 0.3497
 epoch: 5, train_loss: 1.1622, test_loss: 1.2712, test_f1: 0.3214
 epoch: 6, train_loss: 1.1446, test_loss: 1.2544, test_f1: 0.3350
 epoch: 7, train_loss: 1.1253, test_loss: 1.2491, test_f1: 0.3647
 epoch: 8, train_loss: 1.1129, test_loss: 1.2552, test_f1: 0.3979
 epoch: 9, train_loss: 1.0869, test_loss: 1.2202, test_f1: 0.4142
 epoch: 10, train_loss: 1.0723, test_loss: 1.2142, test_f1: 0.3994
 epoch: 11, train_loss: 1.0305, test_loss: 1.1986, test_f1: 0.4361
 epoch: 12, train_loss: 1.0051, test_loss: 1.1183, test_f1: 0.4560
 epoch: 13, train_loss: 0.9691, test_loss: 1.1091, test_f1: 0.4758
 epoch: 14, train_loss: 0.9180, test_loss: 1.0617, test_f1: 0.5401
 epoch: 15, train_loss: 0.9079, test_loss: 1.0747, test_f1: 0.5247
 epoch: 16, train_loss: 0.8721, test_loss: 1.0655, test_f1: 0.5412
 epoch: 17, train_loss: 0.8616, test_loss: 1.2681, test_f1: 0.4952
 epoch: 18, train_loss: 0.8445, test_loss: 1.1228, test_f1: 0.5207
 epoch: 19, train_loss: 0.8258, test_loss: 1.0617, test_f1: 0.5449
 epoch: 20, train_loss: 0.8095, test_loss: 1.0375, test_f1: 0.5245
 epoch: 21, train_loss: 0.7930, test_loss: 1.0642, test_f1: 0.5241
 epoch: 22, train_loss: 0.7713, test_loss: 1.1127, test_f1: 0.5627
 epoch: 23, train_loss: 0.7761, test_loss: 1.0533, test_f1: 0.5128
 epoch: 24, train_loss: 0.7538, test_loss: 1.4602, test_f1: 0.4817
 epoch: 25, train_loss: 0.7194, test_loss: 1.3016, test_f1: 0.5225
 epoch: 26, train_loss: 0.7128, test_loss: 1.4237, test_f1: 0.4548
 epoch: 27, train_loss: 0.7199, test_loss: 1.0459, test_f1: 0.5533
 epoch: 28, train_loss: 0.7508, test_loss: 1.0259, test_f1: 0.5310
 epoch: 29, train_loss: 0.7423, test_loss: 1.1477, test_f1: 0.4753
 epoch: 30, train_loss: 0.7432, test_loss: 1.0724, test_f1: 0.4800
 epoch: 31, train_loss: 0.7308, test_loss: 1.0271, test_f1: 0.5619
 epoch: 32, train_loss: 0.7029, test_loss: 1.0493, test_f1: 0.5344
 epoch: 33, train_loss: 0.6859, test_loss: 1.0056, test_f1: 0.5752
 epoch: 34, train_loss: 0.6634, test_loss: 0.9937, test_f1: 0.5884
 epoch: 35, train_loss: 0.6850, test_loss: 1.1965, test_f1: 0.4915
 epoch: 36, train_loss: 0.6831, test_loss: 1.0884, test_f1: 0.5072
 epoch: 37, train_loss: 0.6501, test_loss: 1.0937, test_f1: 0.5255
 epoch: 38, train_loss: 0.6572, test_loss: 1.1626, test_f1: 0.5098
 epoch: 39, train_loss: 0.6393, test_loss: 1.0168, test_f1: 0.5687
 epoch: 40, train_loss: 0.6274, test_loss: 1.1426, test_f1: 0.5522
 epoch: 41, train_loss: 0.6237, test_loss: 1.1533, test_f1: 0.4548
 epoch: 42, train_loss: 0.6182, test_loss: 1.0790, test_f1: 0.5325
 epoch: 43, train_loss: 0.6167, test_loss: 1.0852, test_f1: 0.5550
 epoch: 44, train_loss: 0.6099, test_loss: 1.2202, test_f1: 0.4973
 epoch: 45, train_loss: 0.6095, test_loss: 1.0941, test_f1: 0.5738
 epoch: 46, train_loss: 0.5893, test_loss: 1.1031, test_f1: 0.5714
 epoch: 47, train_loss: 0.6038, test_loss: 1.4008, test_f1: 0.4797
 epoch: 48, train_loss: 0.5863, test_loss: 1.1532, test_f1: 0.5351
 epoch: 49, train_loss: 0.5769, test_loss: 1.2290, test_f1: 0.5226
 epoch: 50, train_loss: 0.5530, test_loss: 1.2758, test_f1: 0.5462
 epoch: 51, train_loss: 0.5735, test_loss: 1.2300, test_f1: 0.5568
 epoch: 52, train_loss: 0.5480, test_loss: 1.3337, test_f1: 0.5127
 epoch: 53, train_loss: 0.5347, test_loss: 1.2255, test_f1: 0.5416
 epoch: 54, train_loss: 0.5447, test_loss: 1.1741, test_f1: 0.5623
 epoch: 55, train_loss: 0.5201, test_loss: 1.4518, test_f1: 0.4924
 epoch: 56, train_loss: 0.5129, test_loss: 1.3646, test_f1: 0.5170
 epoch: 57, train_loss: 0.4894, test_loss: 1.2833, test_f1: 0.5307
 epoch: 58, train_loss: 0.4921, test_loss: 1.2540, test_f1: 0.5796
 epoch: 59, train_loss: 0.4775, test_loss: 1.3271, test_f1: 0.5652
 epoch: 60, train_loss: 0.4931, test_loss: 1.2888, test_f1: 0.5401
 epoch: 61, train_loss: 0.4925, test_loss: 1.3177, test_f1: 0.5436
 epoch: 62, train_loss: 0.4672, test_loss: 1.2938, test_f1: 0.5545
 epoch: 63, train_loss: 0.4659, test_loss: 1.2436, test_f1: 0.5855
 epoch: 64, train_loss: 0.4647, test_loss: 1.3672, test_f1: 0.5447
 epoch: 65, train_loss: 0.4533, test_loss: 1.2678, test_f1: 0.5868
 epoch: 66, train_loss: 0.4431, test_loss: 1.3503, test_f1: 0.5649
 epoch: 67, train_loss: 0.4171, test_loss: 1.4028, test_f1: 0.5303
 epoch: 68, train_loss: 0.4388, test_loss: 1.2682, test_f1: 0.6053
 epoch: 69, train_loss: 0.4239, test_loss: 1.4007, test_f1: 0.5958
 epoch: 70, train_loss: 0.4347, test_loss: 1.3972, test_f1: 0.5293
 epoch: 71, train_loss: 0.4268, test_loss: 1.3475, test_f1: 0.5581
 epoch: 72, train_loss: 0.4021, test_loss: 1.4294, test_f1: 0.5824
 epoch: 73, train_loss: 0.4058, test_loss: 1.5078, test_f1: 0.5670
 epoch: 74, train_loss: 0.4245, test_loss: 1.4447, test_f1: 0.5892
 epoch: 75, train_loss: 0.4287, test_loss: 1.4750, test_f1: 0.5354
 epoch: 76, train_loss: 0.4136, test_loss: 1.5886, test_f1: 0.5730
 epoch: 77, train_loss: 0.4083, test_loss: 1.5257, test_f1: 0.5763
 epoch: 78, train_loss: 0.4020, test_loss: 1.5164, test_f1: 0.6083
 epoch: 79, train_loss: 0.3849, test_loss: 1.5036, test_f1: 0.5201
 epoch: 80, train_loss: 0.3572, test_loss: 1.5653, test_f1: 0.5655
 epoch: 81, train_loss: 0.3637, test_loss: 1.6059, test_f1: 0.5809
 epoch: 82, train_loss: 0.3607, test_loss: 1.5562, test_f1: 0.5197
 epoch: 83, train_loss: 0.3629, test_loss: 1.5743, test_f1: 0.5553
 epoch: 84, train_loss: 0.3549, test_loss: 1.6756, test_f1: 0.5093
 epoch: 85, train_loss: 0.3618, test_loss: 1.5458, test_f1: 0.5893
 epoch: 86, train_loss: 0.4235, test_loss: 1.6291, test_f1: 0.6080
 epoch: 87, train_loss: 0.3941, test_loss: 1.6131, test_f1: 0.5704
 epoch: 88, train_loss: 0.3821, test_loss: 1.6518, test_f1: 0.5694
 epoch: 89, train_loss: 0.3807, test_loss: 1.5199, test_f1: 0.6234
 epoch: 90, train_loss: 0.3503, test_loss: 1.6442, test_f1: 0.5576
 epoch: 91, train_loss: 0.3646, test_loss: 1.6202, test_f1: 0.5783
 epoch: 92, train_loss: 0.3667, test_loss: 1.5836, test_f1: 0.5688
 epoch: 93, train_loss: 0.3407, test_loss: 1.6792, test_f1: 0.5497
 epoch: 94, train_loss: 0.3322, test_loss: 1.6028, test_f1: 0.6093
 epoch: 95, train_loss: 0.3275, test_loss: 1.5524, test_f1: 0.5921
 epoch: 96, train_loss: 0.3249, test_loss: 1.5731, test_f1: 0.6073
 epoch: 97, train_loss: 0.3651, test_loss: 1.7582, test_f1: 0.5435
 epoch: 98, train_loss: 0.3366, test_loss: 1.6795, test_f1: 0.5394
 epoch: 99, train_loss: 0.3636, test_loss: 1.8972, test_f1: 0.5364
##################ITERATION #1 ****************************************
 epoch: 0, train_loss: 1.3069, test_loss: 1.3256, test_f1: 0.1365
 epoch: 1, train_loss: 1.1979, test_loss: 1.3045, test_f1: 0.3048
 epoch: 2, train_loss: 1.1518, test_loss: 1.3088, test_f1: 0.2849
 epoch: 3, train_loss: 1.1056, test_loss: 1.3218, test_f1: 0.2903
 epoch: 4, train_loss: 1.0568, test_loss: 1.3376, test_f1: 0.1631
 epoch: 5, train_loss: 1.0043, test_loss: 1.3031, test_f1: 0.3508
 epoch: 6, train_loss: 0.9522, test_loss: 1.1600, test_f1: 0.4673
 epoch: 7, train_loss: 0.9105, test_loss: 1.0977, test_f1: 0.5311
 epoch: 8, train_loss: 0.8977, test_loss: 1.1057, test_f1: 0.4995
 epoch: 9, train_loss: 0.8563, test_loss: 1.0826, test_f1: 0.5100
 epoch: 10, train_loss: 0.8340, test_loss: 1.0599, test_f1: 0.5438
 epoch: 11, train_loss: 0.8145, test_loss: 1.0098, test_f1: 0.5768
 epoch: 12, train_loss: 0.7942, test_loss: 1.0235, test_f1: 0.5559
 epoch: 13, train_loss: 0.7961, test_loss: 1.0180, test_f1: 0.5769
 epoch: 14, train_loss: 0.7902, test_loss: 0.9607, test_f1: 0.5738
 epoch: 15, train_loss: 0.7700, test_loss: 0.9997, test_f1: 0.5897
 epoch: 16, train_loss: 0.7484, test_loss: 1.0151, test_f1: 0.5682
 epoch: 17, train_loss: 0.7309, test_loss: 1.0640, test_f1: 0.5593
 epoch: 18, train_loss: 0.7370, test_loss: 0.9871, test_f1: 0.5995
 epoch: 19, train_loss: 0.7266, test_loss: 1.0402, test_f1: 0.5600
 epoch: 20, train_loss: 0.7030, test_loss: 1.0271, test_f1: 0.5643
 epoch: 21, train_loss: 0.6882, test_loss: 1.1179, test_f1: 0.5111
 epoch: 22, train_loss: 0.6734, test_loss: 1.1458, test_f1: 0.5202
 epoch: 23, train_loss: 0.6674, test_loss: 1.1966, test_f1: 0.5120
 epoch: 24, train_loss: 0.6810, test_loss: 1.2125, test_f1: 0.5202
 epoch: 25, train_loss: 0.6840, test_loss: 1.1706, test_f1: 0.5086
 epoch: 26, train_loss: 0.6609, test_loss: 1.1272, test_f1: 0.5435
 epoch: 27, train_loss: 0.6322, test_loss: 1.1168, test_f1: 0.5707
 epoch: 28, train_loss: 0.6323, test_loss: 1.1262, test_f1: 0.5806
 epoch: 29, train_loss: 0.6265, test_loss: 1.1196, test_f1: 0.5908
 epoch: 30, train_loss: 0.6064, test_loss: 1.1409, test_f1: 0.5774
 epoch: 31, train_loss: 0.5935, test_loss: 1.1975, test_f1: 0.5847
 epoch: 32, train_loss: 0.5914, test_loss: 1.1775, test_f1: 0.5797
 epoch: 33, train_loss: 0.5745, test_loss: 1.3044, test_f1: 0.5366
 epoch: 34, train_loss: 0.5671, test_loss: 1.2562, test_f1: 0.5541
 epoch: 35, train_loss: 0.5735, test_loss: 1.4219, test_f1: 0.5125
 epoch: 36, train_loss: 0.5811, test_loss: 1.3228, test_f1: 0.5400
 epoch: 37, train_loss: 0.5721, test_loss: 1.4348, test_f1: 0.5548
 epoch: 38, train_loss: 0.5835, test_loss: 1.2801, test_f1: 0.5603
 epoch: 39, train_loss: 0.5970, test_loss: 1.3873, test_f1: 0.5578
 epoch: 40, train_loss: 0.6330, test_loss: 1.2372, test_f1: 0.5255
 epoch: 41, train_loss: 0.6002, test_loss: 1.2277, test_f1: 0.5597
 epoch: 42, train_loss: 0.5825, test_loss: 1.2694, test_f1: 0.5403
 epoch: 43, train_loss: 0.5670, test_loss: 1.2574, test_f1: 0.5626
 epoch: 44, train_loss: 0.5519, test_loss: 1.4611, test_f1: 0.5481
 epoch: 45, train_loss: 0.5482, test_loss: 1.3644, test_f1: 0.5290
 epoch: 46, train_loss: 0.5204, test_loss: 1.3668, test_f1: 0.5636
 epoch: 47, train_loss: 0.5036, test_loss: 1.4048, test_f1: 0.5926
 epoch: 48, train_loss: 0.4867, test_loss: 1.5145, test_f1: 0.5447
 epoch: 49, train_loss: 0.4860, test_loss: 1.4385, test_f1: 0.5529
 epoch: 50, train_loss: 0.4914, test_loss: 1.3953, test_f1: 0.5581
 epoch: 51, train_loss: 0.4786, test_loss: 1.4842, test_f1: 0.5271
 epoch: 52, train_loss: 0.4664, test_loss: 1.3535, test_f1: 0.5800
 epoch: 53, train_loss: 0.4631, test_loss: 1.4048, test_f1: 0.5860
 epoch: 54, train_loss: 0.4487, test_loss: 1.3274, test_f1: 0.5735
 epoch: 55, train_loss: 0.4718, test_loss: 1.3528, test_f1: 0.5891
 epoch: 56, train_loss: 0.4380, test_loss: 1.3785, test_f1: 0.5809
 epoch: 57, train_loss: 0.4195, test_loss: 1.3844, test_f1: 0.5883
 epoch: 58, train_loss: 0.4099, test_loss: 1.4075, test_f1: 0.5860
 epoch: 59, train_loss: 0.4188, test_loss: 1.3999, test_f1: 0.5569
 epoch: 60, train_loss: 0.4329, test_loss: 1.3941, test_f1: 0.5891
 epoch: 61, train_loss: 0.3940, test_loss: 1.5215, test_f1: 0.5807
 epoch: 62, train_loss: 0.3884, test_loss: 1.3993, test_f1: 0.5803
 epoch: 63, train_loss: 0.3758, test_loss: 1.4095, test_f1: 0.5902
 epoch: 64, train_loss: 0.3613, test_loss: 1.4696, test_f1: 0.6130
 epoch: 65, train_loss: 0.3598, test_loss: 1.5313, test_f1: 0.5663
 epoch: 66, train_loss: 0.3926, test_loss: 1.7634, test_f1: 0.5396
 epoch: 67, train_loss: 0.3850, test_loss: 1.6475, test_f1: 0.5540
 epoch: 68, train_loss: 0.3763, test_loss: 1.5699, test_f1: 0.5758
 epoch: 69, train_loss: 0.3641, test_loss: 1.6047, test_f1: 0.5622
 epoch: 70, train_loss: 0.3567, test_loss: 1.5330, test_f1: 0.5550
 epoch: 71, train_loss: 0.3569, test_loss: 1.5986, test_f1: 0.5501
 epoch: 72, train_loss: 0.3368, test_loss: 1.6800, test_f1: 0.5551
 epoch: 73, train_loss: 0.3281, test_loss: 1.6032, test_f1: 0.5838
 epoch: 74, train_loss: 0.3182, test_loss: 1.7739, test_f1: 0.5614
 epoch: 75, train_loss: 0.3210, test_loss: 1.7733, test_f1: 0.5670
 epoch: 76, train_loss: 0.3336, test_loss: 1.6397, test_f1: 0.5927
 epoch: 77, train_loss: 0.3596, test_loss: 1.9410, test_f1: 0.5687
 epoch: 78, train_loss: 0.3536, test_loss: 1.8104, test_f1: 0.5945
 epoch: 79, train_loss: 0.3488, test_loss: 1.7580, test_f1: 0.5802
 epoch: 80, train_loss: 0.3517, test_loss: 1.9846, test_f1: 0.5563
 epoch: 81, train_loss: 0.3393, test_loss: 1.7473, test_f1: 0.5790
 epoch: 82, train_loss: 0.3402, test_loss: 1.9028, test_f1: 0.5839
 epoch: 83, train_loss: 0.3013, test_loss: 1.8959, test_f1: 0.5758
 epoch: 84, train_loss: 0.3104, test_loss: 1.7654, test_f1: 0.5877
 epoch: 85, train_loss: 0.3264, test_loss: 1.8294, test_f1: 0.5889
 epoch: 86, train_loss: 0.3030, test_loss: 1.8316, test_f1: 0.5866
 epoch: 87, train_loss: 0.2744, test_loss: 2.0123, test_f1: 0.5896
 epoch: 88, train_loss: 0.2925, test_loss: 2.0002, test_f1: 0.6266
 epoch: 89, train_loss: 0.2932, test_loss: 1.9944, test_f1: 0.5938
 epoch: 90, train_loss: 0.2972, test_loss: 2.1143, test_f1: 0.5992
 epoch: 91, train_loss: 0.2817, test_loss: 2.1240, test_f1: 0.5486
 epoch: 92, train_loss: 0.3192, test_loss: 1.9784, test_f1: 0.5909
 epoch: 93, train_loss: 0.3246, test_loss: 1.9392, test_f1: 0.5936
 epoch: 94, train_loss: 0.2865, test_loss: 1.9593, test_f1: 0.5607
 epoch: 95, train_loss: 0.2880, test_loss: 1.9348, test_f1: 0.5487
 epoch: 96, train_loss: 0.2605, test_loss: 1.8627, test_f1: 0.5619
 epoch: 97, train_loss: 0.2849, test_loss: 1.9434, test_f1: 0.5880
 epoch: 98, train_loss: 0.2746, test_loss: 2.2595, test_f1: 0.5615
 epoch: 99, train_loss: 0.2839, test_loss: 2.1961, test_f1: 0.5746
##################ITERATION #2 ****************************************
 epoch: 0, train_loss: 1.2385, test_loss: 1.3004, test_f1: 0.2404
 epoch: 1, train_loss: 1.1571, test_loss: 1.2908, test_f1: 0.2281
 epoch: 2, train_loss: 1.1149, test_loss: 1.2963, test_f1: 0.2281
 epoch: 3, train_loss: 1.0729, test_loss: 1.2903, test_f1: 0.2281
 epoch: 4, train_loss: 1.0161, test_loss: 1.3306, test_f1: 0.2719
 epoch: 5, train_loss: 0.9704, test_loss: 1.3347, test_f1: 0.2924
 epoch: 6, train_loss: 0.9393, test_loss: 1.3286, test_f1: 0.3356
 epoch: 7, train_loss: 0.8900, test_loss: 1.3489, test_f1: 0.3158
 epoch: 8, train_loss: 0.8587, test_loss: 1.2936, test_f1: 0.3494
 epoch: 9, train_loss: 0.8409, test_loss: 1.1781, test_f1: 0.4481
 epoch: 10, train_loss: 0.8307, test_loss: 1.1428, test_f1: 0.4775
 epoch: 11, train_loss: 0.8008, test_loss: 1.0709, test_f1: 0.5254
 epoch: 12, train_loss: 0.8369, test_loss: 1.0331, test_f1: 0.5588
 epoch: 13, train_loss: 0.7983, test_loss: 1.0075, test_f1: 0.5996
 epoch: 14, train_loss: 0.7869, test_loss: 1.0550, test_f1: 0.5717
 epoch: 15, train_loss: 0.7904, test_loss: 1.0672, test_f1: 0.4964
 epoch: 16, train_loss: 0.7692, test_loss: 1.0179, test_f1: 0.5535
 epoch: 17, train_loss: 0.7505, test_loss: 1.0099, test_f1: 0.5662
 epoch: 18, train_loss: 0.7369, test_loss: 1.0076, test_f1: 0.5782
 epoch: 19, train_loss: 0.7276, test_loss: 1.0010, test_f1: 0.5482
 epoch: 20, train_loss: 0.7126, test_loss: 1.2188, test_f1: 0.4826
 epoch: 21, train_loss: 0.7153, test_loss: 1.0598, test_f1: 0.5701
 epoch: 22, train_loss: 0.7410, test_loss: 1.0754, test_f1: 0.5701
 epoch: 23, train_loss: 0.7198, test_loss: 1.1097, test_f1: 0.4952
 epoch: 24, train_loss: 0.6947, test_loss: 1.0738, test_f1: 0.5243
 epoch: 25, train_loss: 0.6664, test_loss: 1.1312, test_f1: 0.5361
 epoch: 26, train_loss: 0.6964, test_loss: 1.1487, test_f1: 0.5538
 epoch: 27, train_loss: 0.6785, test_loss: 1.2104, test_f1: 0.5233
 epoch: 28, train_loss: 0.6779, test_loss: 1.1662, test_f1: 0.5406
 epoch: 29, train_loss: 0.6709, test_loss: 0.9884, test_f1: 0.6099
 epoch: 30, train_loss: 0.6488, test_loss: 1.0835, test_f1: 0.5792
 epoch: 31, train_loss: 0.6267, test_loss: 1.0477, test_f1: 0.5815
 epoch: 32, train_loss: 0.6390, test_loss: 1.0666, test_f1: 0.6005
 epoch: 33, train_loss: 0.6155, test_loss: 1.1602, test_f1: 0.5201
 epoch: 34, train_loss: 0.6036, test_loss: 1.3009, test_f1: 0.5490
 epoch: 35, train_loss: 0.6356, test_loss: 1.3351, test_f1: 0.5003
 epoch: 36, train_loss: 0.6296, test_loss: 1.4721, test_f1: 0.4800
 epoch: 37, train_loss: 0.6386, test_loss: 1.3312, test_f1: 0.5303
 epoch: 38, train_loss: 0.6477, test_loss: 1.1703, test_f1: 0.5825
 epoch: 39, train_loss: 0.6156, test_loss: 1.1696, test_f1: 0.5557
 epoch: 40, train_loss: 0.5982, test_loss: 1.1313, test_f1: 0.5552
 epoch: 41, train_loss: 0.5876, test_loss: 1.0874, test_f1: 0.5643
 epoch: 42, train_loss: 0.5883, test_loss: 1.0801, test_f1: 0.5713
 epoch: 43, train_loss: 0.5750, test_loss: 1.2767, test_f1: 0.4707
 epoch: 44, train_loss: 0.5878, test_loss: 1.1233, test_f1: 0.6169
 epoch: 45, train_loss: 0.6115, test_loss: 1.2486, test_f1: 0.5478
 epoch: 46, train_loss: 0.5947, test_loss: 1.1780, test_f1: 0.5979
 epoch: 47, train_loss: 0.5942, test_loss: 1.1486, test_f1: 0.6018
 epoch: 48, train_loss: 0.5762, test_loss: 1.3245, test_f1: 0.5598
 epoch: 49, train_loss: 0.5624, test_loss: 1.0405, test_f1: 0.5992
 epoch: 50, train_loss: 0.5324, test_loss: 1.1564, test_f1: 0.6111
 epoch: 51, train_loss: 0.5429, test_loss: 1.1545, test_f1: 0.6153
 epoch: 52, train_loss: 0.5136, test_loss: 1.0933, test_f1: 0.6227
 epoch: 53, train_loss: 0.4980, test_loss: 1.1399, test_f1: 0.6164
 epoch: 54, train_loss: 0.4842, test_loss: 1.1217, test_f1: 0.5899
 epoch: 55, train_loss: 0.4710, test_loss: 1.1222, test_f1: 0.6222
 epoch: 56, train_loss: 0.4812, test_loss: 1.2540, test_f1: 0.5947
 epoch: 57, train_loss: 0.4645, test_loss: 1.3663, test_f1: 0.5948
 epoch: 58, train_loss: 0.4689, test_loss: 1.2394, test_f1: 0.6028
 epoch: 59, train_loss: 0.4607, test_loss: 1.2131, test_f1: 0.6413
 epoch: 60, train_loss: 0.4490, test_loss: 1.2804, test_f1: 0.6130
 epoch: 61, train_loss: 0.4437, test_loss: 1.2977, test_f1: 0.5832
 epoch: 62, train_loss: 0.4323, test_loss: 1.1621, test_f1: 0.6419
 epoch: 63, train_loss: 0.4382, test_loss: 1.2603, test_f1: 0.6080
 epoch: 64, train_loss: 0.4291, test_loss: 1.3288, test_f1: 0.5787
 epoch: 65, train_loss: 0.4163, test_loss: 1.2649, test_f1: 0.6047
 epoch: 66, train_loss: 0.4056, test_loss: 1.3320, test_f1: 0.5980
 epoch: 67, train_loss: 0.4057, test_loss: 1.3690, test_f1: 0.5818
 epoch: 68, train_loss: 0.3890, test_loss: 1.3687, test_f1: 0.5780
 epoch: 69, train_loss: 0.4107, test_loss: 1.3268, test_f1: 0.6061
 epoch: 70, train_loss: 0.3866, test_loss: 1.4766, test_f1: 0.5977
 epoch: 71, train_loss: 0.3903, test_loss: 1.3655, test_f1: 0.5725
 epoch: 72, train_loss: 0.3888, test_loss: 1.3858, test_f1: 0.5833
 epoch: 73, train_loss: 0.3814, test_loss: 1.4038, test_f1: 0.5947
 epoch: 74, train_loss: 0.3875, test_loss: 1.4998, test_f1: 0.6165
 epoch: 75, train_loss: 0.3936, test_loss: 1.7245, test_f1: 0.5901
 epoch: 76, train_loss: 0.4093, test_loss: 1.5425, test_f1: 0.5663
 epoch: 77, train_loss: 0.4055, test_loss: 1.5368, test_f1: 0.5405
 epoch: 78, train_loss: 0.3945, test_loss: 1.4738, test_f1: 0.5971
 epoch: 79, train_loss: 0.3664, test_loss: 1.3897, test_f1: 0.5932
 epoch: 80, train_loss: 0.3530, test_loss: 1.3635, test_f1: 0.5975
 epoch: 81, train_loss: 0.3669, test_loss: 1.3578, test_f1: 0.6077
 epoch: 82, train_loss: 0.3295, test_loss: 1.4513, test_f1: 0.6059
 epoch: 83, train_loss: 0.3405, test_loss: 1.4319, test_f1: 0.6246
 epoch: 84, train_loss: 0.3308, test_loss: 1.5277, test_f1: 0.6254
 epoch: 85, train_loss: 0.3378, test_loss: 1.6552, test_f1: 0.6089
 epoch: 86, train_loss: 0.3318, test_loss: 1.5852, test_f1: 0.5559
 epoch: 87, train_loss: 0.3449, test_loss: 1.4859, test_f1: 0.6047
 epoch: 88, train_loss: 0.3359, test_loss: 1.6744, test_f1: 0.5708
 epoch: 89, train_loss: 0.3295, test_loss: 1.5360, test_f1: 0.5963
 epoch: 90, train_loss: 0.3239, test_loss: 1.5990, test_f1: 0.6025
 epoch: 91, train_loss: 0.3218, test_loss: 1.8855, test_f1: 0.5962
 epoch: 92, train_loss: 0.3247, test_loss: 1.6362, test_f1: 0.6002
 epoch: 93, train_loss: 0.3160, test_loss: 1.5806, test_f1: 0.6470
 epoch: 94, train_loss: 0.3112, test_loss: 1.7804, test_f1: 0.5897
 epoch: 95, train_loss: 0.3551, test_loss: 1.7508, test_f1: 0.5674
 epoch: 96, train_loss: 0.3447, test_loss: 1.6507, test_f1: 0.6165
 epoch: 97, train_loss: 0.3247, test_loss: 1.6552, test_f1: 0.6070
 epoch: 98, train_loss: 0.3248, test_loss: 1.5772, test_f1: 0.6001
 epoch: 99, train_loss: 0.3242, test_loss: 1.5819, test_f1: 0.6120
##################ITERATION #3 ****************************************
 epoch: 0, train_loss: 1.2345, test_loss: 1.3029, test_f1: 0.2839
 epoch: 1, train_loss: 1.1113, test_loss: 1.3024, test_f1: 0.1426
 epoch: 2, train_loss: 1.0226, test_loss: 1.3088, test_f1: 0.2300
 epoch: 3, train_loss: 0.9739, test_loss: 1.3080, test_f1: 0.1813
 epoch: 4, train_loss: 0.9386, test_loss: 1.4262, test_f1: 0.1773
 epoch: 5, train_loss: 0.8970, test_loss: 1.4185, test_f1: 0.2123
 epoch: 6, train_loss: 0.8938, test_loss: 1.4955, test_f1: 0.3010
 epoch: 7, train_loss: 0.8568, test_loss: 1.3209, test_f1: 0.3661
 epoch: 8, train_loss: 0.8345, test_loss: 1.3441, test_f1: 0.3210
 epoch: 9, train_loss: 0.7854, test_loss: 1.0923, test_f1: 0.4939
 epoch: 10, train_loss: 0.7917, test_loss: 1.0360, test_f1: 0.5368
 epoch: 11, train_loss: 0.7666, test_loss: 1.0552, test_f1: 0.5687
 epoch: 12, train_loss: 0.7605, test_loss: 1.1794, test_f1: 0.6085
 epoch: 13, train_loss: 0.7617, test_loss: 1.2633, test_f1: 0.5541
 epoch: 14, train_loss: 0.7150, test_loss: 1.0394, test_f1: 0.5620
 epoch: 15, train_loss: 0.7113, test_loss: 1.0179, test_f1: 0.5882
 epoch: 16, train_loss: 0.7231, test_loss: 1.0190, test_f1: 0.5889
 epoch: 17, train_loss: 0.6866, test_loss: 1.0128, test_f1: 0.6225
 epoch: 18, train_loss: 0.6666, test_loss: 1.0234, test_f1: 0.5712
 epoch: 19, train_loss: 0.6636, test_loss: 1.2278, test_f1: 0.5640
 epoch: 20, train_loss: 0.6324, test_loss: 1.0983, test_f1: 0.5777
 epoch: 21, train_loss: 0.6419, test_loss: 1.0787, test_f1: 0.5717
 epoch: 22, train_loss: 0.6158, test_loss: 1.1596, test_f1: 0.5624
 epoch: 23, train_loss: 0.6067, test_loss: 1.3517, test_f1: 0.5458
 epoch: 24, train_loss: 0.6110, test_loss: 1.1681, test_f1: 0.5786
 epoch: 25, train_loss: 0.5840, test_loss: 1.3600, test_f1: 0.5386
 epoch: 26, train_loss: 0.5950, test_loss: 1.1672, test_f1: 0.5511
 epoch: 27, train_loss: 0.6236, test_loss: 1.2505, test_f1: 0.5676
 epoch: 28, train_loss: 0.5851, test_loss: 1.0977, test_f1: 0.5799
 epoch: 29, train_loss: 0.5857, test_loss: 1.1044, test_f1: 0.5966
 epoch: 30, train_loss: 0.5767, test_loss: 1.2845, test_f1: 0.5352
 epoch: 31, train_loss: 0.5529, test_loss: 1.3048, test_f1: 0.5354
 epoch: 32, train_loss: 0.5347, test_loss: 1.1011, test_f1: 0.5724
 epoch: 33, train_loss: 0.5407, test_loss: 1.2735, test_f1: 0.5524
 epoch: 34, train_loss: 0.5159, test_loss: 1.1445, test_f1: 0.6310
 epoch: 35, train_loss: 0.5141, test_loss: 1.2268, test_f1: 0.5641
 epoch: 36, train_loss: 0.4923, test_loss: 1.2778, test_f1: 0.5377
 epoch: 37, train_loss: 0.4757, test_loss: 1.2926, test_f1: 0.5774
 epoch: 38, train_loss: 0.4906, test_loss: 1.5121, test_f1: 0.4956
 epoch: 39, train_loss: 0.4927, test_loss: 1.3412, test_f1: 0.5921
 epoch: 40, train_loss: 0.4755, test_loss: 1.2330, test_f1: 0.5828
 epoch: 41, train_loss: 0.4741, test_loss: 1.4549, test_f1: 0.5366
 epoch: 42, train_loss: 0.5114, test_loss: 1.4034, test_f1: 0.5584
 epoch: 43, train_loss: 0.5163, test_loss: 1.3405, test_f1: 0.5744
 epoch: 44, train_loss: 0.5235, test_loss: 1.2476, test_f1: 0.5262
 epoch: 45, train_loss: 0.4996, test_loss: 1.1973, test_f1: 0.6037
 epoch: 46, train_loss: 0.4741, test_loss: 1.2043, test_f1: 0.5810
 epoch: 47, train_loss: 0.4651, test_loss: 1.4215, test_f1: 0.5802
 epoch: 48, train_loss: 0.4714, test_loss: 1.5344, test_f1: 0.5300
 epoch: 49, train_loss: 0.4649, test_loss: 1.4532, test_f1: 0.5499
 epoch: 50, train_loss: 0.4488, test_loss: 1.3301, test_f1: 0.5732
 epoch: 51, train_loss: 0.4354, test_loss: 1.3201, test_f1: 0.6067
 epoch: 52, train_loss: 0.3942, test_loss: 1.3882, test_f1: 0.5608
 epoch: 53, train_loss: 0.3787, test_loss: 1.5262, test_f1: 0.5447
 epoch: 54, train_loss: 0.3801, test_loss: 1.5384, test_f1: 0.5442
 epoch: 55, train_loss: 0.3587, test_loss: 1.5604, test_f1: 0.5562
 epoch: 56, train_loss: 0.3547, test_loss: 1.4629, test_f1: 0.5568
 epoch: 57, train_loss: 0.3529, test_loss: 1.6061, test_f1: 0.5348
 epoch: 58, train_loss: 0.3533, test_loss: 1.8131, test_f1: 0.5606
 epoch: 59, train_loss: 0.3620, test_loss: 1.8723, test_f1: 0.5375
 epoch: 60, train_loss: 0.3539, test_loss: 1.6329, test_f1: 0.5113
 epoch: 61, train_loss: 0.3832, test_loss: 1.6538, test_f1: 0.5798
 epoch: 62, train_loss: 0.3523, test_loss: 1.6278, test_f1: 0.5871
 epoch: 63, train_loss: 0.3706, test_loss: 1.6312, test_f1: 0.6052
 epoch: 64, train_loss: 0.3680, test_loss: 1.4635, test_f1: 0.6111
 epoch: 65, train_loss: 0.3451, test_loss: 1.6131, test_f1: 0.5799
 epoch: 66, train_loss: 0.3008, test_loss: 1.6090, test_f1: 0.5961
 epoch: 67, train_loss: 0.2885, test_loss: 1.6482, test_f1: 0.6088
 epoch: 68, train_loss: 0.2846, test_loss: 1.6154, test_f1: 0.5960
 epoch: 69, train_loss: 0.2848, test_loss: 1.7565, test_f1: 0.5747
 epoch: 70, train_loss: 0.2762, test_loss: 2.0068, test_f1: 0.5386
 epoch: 71, train_loss: 0.2661, test_loss: 1.9825, test_f1: 0.5686
 epoch: 72, train_loss: 0.2865, test_loss: 1.9218, test_f1: 0.5664
 epoch: 73, train_loss: 0.2914, test_loss: 1.8297, test_f1: 0.5584
 epoch: 74, train_loss: 0.2748, test_loss: 1.9161, test_f1: 0.5732
 epoch: 75, train_loss: 0.3050, test_loss: 1.9138, test_f1: 0.5663
 epoch: 76, train_loss: 0.2803, test_loss: 1.9029, test_f1: 0.5849
 epoch: 77, train_loss: 0.2591, test_loss: 1.9235, test_f1: 0.6020
 epoch: 78, train_loss: 0.2528, test_loss: 1.9514, test_f1: 0.5766
 epoch: 79, train_loss: 0.2251, test_loss: 2.0234, test_f1: 0.5635
 epoch: 80, train_loss: 0.2495, test_loss: 1.9330, test_f1: 0.5605
 epoch: 81, train_loss: 0.2449, test_loss: 1.8593, test_f1: 0.5707
 epoch: 82, train_loss: 0.2202, test_loss: 1.8232, test_f1: 0.5858
 epoch: 83, train_loss: 0.2090, test_loss: 1.9049, test_f1: 0.5900
 epoch: 84, train_loss: 0.2214, test_loss: 2.1465, test_f1: 0.5584
 epoch: 85, train_loss: 0.2227, test_loss: 2.2420, test_f1: 0.5615
 epoch: 86, train_loss: 0.2121, test_loss: 2.0347, test_f1: 0.5856
 epoch: 87, train_loss: 0.2851, test_loss: 2.0985, test_f1: 0.5727
 epoch: 88, train_loss: 0.3265, test_loss: 2.5308, test_f1: 0.4886
 epoch: 89, train_loss: 0.2884, test_loss: 2.1857, test_f1: 0.5447
 epoch: 90, train_loss: 0.2876, test_loss: 2.0713, test_f1: 0.5625
 epoch: 91, train_loss: 0.2645, test_loss: 2.0158, test_f1: 0.5872
 epoch: 92, train_loss: 0.2458, test_loss: 2.0430, test_f1: 0.5696
 epoch: 93, train_loss: 0.2267, test_loss: 2.0575, test_f1: 0.5803
 epoch: 94, train_loss: 0.2219, test_loss: 2.1272, test_f1: 0.5902
 epoch: 95, train_loss: 0.2191, test_loss: 2.2349, test_f1: 0.5880
 epoch: 96, train_loss: 0.1960, test_loss: 2.2995, test_f1: 0.5839
 epoch: 97, train_loss: 0.1633, test_loss: 2.2751, test_f1: 0.5887
 epoch: 98, train_loss: 0.2050, test_loss: 2.1206, test_f1: 0.6076
 epoch: 99, train_loss: 0.2004, test_loss: 2.2196, test_f1: 0.6201
##################ITERATION #4 ****************************************
 epoch: 0, train_loss: 1.2205, test_loss: 1.3176, test_f1: 0.1606
 epoch: 1, train_loss: 1.0965, test_loss: 1.3026, test_f1: 0.1533
 epoch: 2, train_loss: 1.0463, test_loss: 1.3119, test_f1: 0.1839
 epoch: 3, train_loss: 0.9821, test_loss: 1.2915, test_f1: 0.2841
 epoch: 4, train_loss: 0.9374, test_loss: 1.2867, test_f1: 0.3122
 epoch: 5, train_loss: 0.9232, test_loss: 1.2622, test_f1: 0.3938
 epoch: 6, train_loss: 0.8992, test_loss: 1.2571, test_f1: 0.4065
 epoch: 7, train_loss: 0.8883, test_loss: 1.1721, test_f1: 0.4545
 epoch: 8, train_loss: 0.8589, test_loss: 1.1868, test_f1: 0.5231
 epoch: 9, train_loss: 0.8483, test_loss: 1.0577, test_f1: 0.5564
 epoch: 10, train_loss: 0.8320, test_loss: 1.0797, test_f1: 0.5593
 epoch: 11, train_loss: 0.8077, test_loss: 1.0544, test_f1: 0.5507
 epoch: 12, train_loss: 0.8008, test_loss: 1.0096, test_f1: 0.5782
 epoch: 13, train_loss: 0.7581, test_loss: 1.0163, test_f1: 0.5952
 epoch: 14, train_loss: 0.7604, test_loss: 1.0701, test_f1: 0.5789
 epoch: 15, train_loss: 0.7258, test_loss: 1.0041, test_f1: 0.6008
 epoch: 16, train_loss: 0.7491, test_loss: 0.9830, test_f1: 0.5683
 epoch: 17, train_loss: 0.7614, test_loss: 1.0413, test_f1: 0.5549
 epoch: 18, train_loss: 0.7327, test_loss: 1.0472, test_f1: 0.5561
 epoch: 19, train_loss: 0.7093, test_loss: 1.0113, test_f1: 0.6209
 epoch: 20, train_loss: 0.6996, test_loss: 0.9941, test_f1: 0.6242
 epoch: 21, train_loss: 0.6815, test_loss: 1.0211, test_f1: 0.5893
 epoch: 22, train_loss: 0.6674, test_loss: 1.0656, test_f1: 0.5411
 epoch: 23, train_loss: 0.6518, test_loss: 0.9742, test_f1: 0.6171
 epoch: 24, train_loss: 0.6674, test_loss: 1.0720, test_f1: 0.5522
 epoch: 25, train_loss: 0.6873, test_loss: 1.1603, test_f1: 0.5041
 epoch: 26, train_loss: 0.7196, test_loss: 1.1979, test_f1: 0.5277
 epoch: 27, train_loss: 0.6678, test_loss: 1.1490, test_f1: 0.5402
 epoch: 28, train_loss: 0.6428, test_loss: 1.1395, test_f1: 0.5736
 epoch: 29, train_loss: 0.6617, test_loss: 1.1353, test_f1: 0.5564
 epoch: 30, train_loss: 0.6479, test_loss: 1.1098, test_f1: 0.5487
 epoch: 31, train_loss: 0.6475, test_loss: 1.1517, test_f1: 0.5573
 epoch: 32, train_loss: 0.6779, test_loss: 1.0157, test_f1: 0.5905
 epoch: 33, train_loss: 0.6495, test_loss: 1.0071, test_f1: 0.6185
 epoch: 34, train_loss: 0.6703, test_loss: 1.1166, test_f1: 0.5711
 epoch: 35, train_loss: 0.6585, test_loss: 1.0196, test_f1: 0.6085
 epoch: 36, train_loss: 0.6398, test_loss: 1.1253, test_f1: 0.6000
 epoch: 37, train_loss: 0.5954, test_loss: 1.0609, test_f1: 0.6003
 epoch: 38, train_loss: 0.6052, test_loss: 1.1030, test_f1: 0.5777
 epoch: 39, train_loss: 0.6287, test_loss: 1.1847, test_f1: 0.5546
 epoch: 40, train_loss: 0.6030, test_loss: 1.1572, test_f1: 0.5526
 epoch: 41, train_loss: 0.5677, test_loss: 1.1889, test_f1: 0.5811
 epoch: 42, train_loss: 0.5797, test_loss: 1.1739, test_f1: 0.5512
 epoch: 43, train_loss: 0.5506, test_loss: 1.2079, test_f1: 0.5218
 epoch: 44, train_loss: 0.5659, test_loss: 1.2062, test_f1: 0.5597
 epoch: 45, train_loss: 0.5442, test_loss: 1.1136, test_f1: 0.5941
 epoch: 46, train_loss: 0.5564, test_loss: 1.2248, test_f1: 0.5326
 epoch: 47, train_loss: 0.5405, test_loss: 1.2760, test_f1: 0.5670
 epoch: 48, train_loss: 0.5651, test_loss: 1.2203, test_f1: 0.5834
 epoch: 49, train_loss: 0.5887, test_loss: 1.2386, test_f1: 0.5724
 epoch: 50, train_loss: 0.5866, test_loss: 1.2388, test_f1: 0.6105
 epoch: 51, train_loss: 0.5637, test_loss: 1.1469, test_f1: 0.5625
 epoch: 52, train_loss: 0.5381, test_loss: 1.1156, test_f1: 0.5902
 epoch: 53, train_loss: 0.5359, test_loss: 1.1428, test_f1: 0.5895
 epoch: 54, train_loss: 0.5048, test_loss: 1.1392, test_f1: 0.5814
 epoch: 55, train_loss: 0.5123, test_loss: 1.1946, test_f1: 0.5552
 epoch: 56, train_loss: 0.4959, test_loss: 1.1633, test_f1: 0.5815
 epoch: 57, train_loss: 0.4812, test_loss: 1.2430, test_f1: 0.5655
 epoch: 58, train_loss: 0.4668, test_loss: 1.2717, test_f1: 0.5577
 epoch: 59, train_loss: 0.4571, test_loss: 1.2331, test_f1: 0.5649
 epoch: 60, train_loss: 0.4591, test_loss: 1.2618, test_f1: 0.5772
 epoch: 61, train_loss: 0.4380, test_loss: 1.3284, test_f1: 0.5946
 epoch: 62, train_loss: 0.4457, test_loss: 1.3416, test_f1: 0.5891
 epoch: 63, train_loss: 0.4489, test_loss: 1.3005, test_f1: 0.5700
 epoch: 64, train_loss: 0.4340, test_loss: 1.4425, test_f1: 0.5824
 epoch: 65, train_loss: 0.4485, test_loss: 1.3902, test_f1: 0.5635
 epoch: 66, train_loss: 0.4321, test_loss: 1.3398, test_f1: 0.5688
 epoch: 67, train_loss: 0.4373, test_loss: 1.3182, test_f1: 0.5586
 epoch: 68, train_loss: 0.4289, test_loss: 1.3532, test_f1: 0.5702
 epoch: 69, train_loss: 0.4094, test_loss: 1.3109, test_f1: 0.5795
 epoch: 70, train_loss: 0.4029, test_loss: 1.2960, test_f1: 0.5775
 epoch: 71, train_loss: 0.4104, test_loss: 1.3161, test_f1: 0.5687
 epoch: 72, train_loss: 0.4226, test_loss: 1.4017, test_f1: 0.5677
 epoch: 73, train_loss: 0.4066, test_loss: 1.4346, test_f1: 0.5516
 epoch: 74, train_loss: 0.4146, test_loss: 1.4449, test_f1: 0.5839
 epoch: 75, train_loss: 0.4071, test_loss: 1.4482, test_f1: 0.5957
 epoch: 76, train_loss: 0.3995, test_loss: 1.4626, test_f1: 0.5504
 epoch: 77, train_loss: 0.4086, test_loss: 1.4196, test_f1: 0.6129
 epoch: 78, train_loss: 0.3813, test_loss: 1.5471, test_f1: 0.5740
 epoch: 79, train_loss: 0.3776, test_loss: 1.3913, test_f1: 0.6011
 epoch: 80, train_loss: 0.3991, test_loss: 1.4924, test_f1: 0.5981
 epoch: 81, train_loss: 0.4149, test_loss: 1.4472, test_f1: 0.6081
 epoch: 82, train_loss: 0.4030, test_loss: 1.4914, test_f1: 0.5954
 epoch: 83, train_loss: 0.4075, test_loss: 1.3230, test_f1: 0.6416
 epoch: 84, train_loss: 0.4239, test_loss: 1.4196, test_f1: 0.5935
 epoch: 85, train_loss: 0.3850, test_loss: 1.5612, test_f1: 0.5451
 epoch: 86, train_loss: 0.3832, test_loss: 1.5031, test_f1: 0.5980
 epoch: 87, train_loss: 0.3695, test_loss: 1.3976, test_f1: 0.6002
 epoch: 88, train_loss: 0.3535, test_loss: 1.4063, test_f1: 0.5991
 epoch: 89, train_loss: 0.3344, test_loss: 1.3148, test_f1: 0.6026
 epoch: 90, train_loss: 0.3445, test_loss: 1.4275, test_f1: 0.5916
 epoch: 91, train_loss: 0.3293, test_loss: 1.4758, test_f1: 0.5784
 epoch: 92, train_loss: 0.3676, test_loss: 1.5845, test_f1: 0.5630
 epoch: 93, train_loss: 0.3493, test_loss: 1.7000, test_f1: 0.5661
 epoch: 94, train_loss: 0.3479, test_loss: 1.5817, test_f1: 0.5814
 epoch: 95, train_loss: 0.3358, test_loss: 1.6128, test_f1: 0.5775
 epoch: 96, train_loss: 0.3545, test_loss: 1.6437, test_f1: 0.5889
 epoch: 97, train_loss: 0.3214, test_loss: 1.5826, test_f1: 0.5794
 epoch: 98, train_loss: 0.3292, test_loss: 1.8047, test_f1: 0.5754
 epoch: 99, train_loss: 0.3337, test_loss: 1.7282, test_f1: 0.5787
##################ITERATION #5 ****************************************
 epoch: 0, train_loss: 1.2556, test_loss: 1.3124, test_f1: 0.3051
 epoch: 1, train_loss: 1.0867, test_loss: 1.3161, test_f1: 0.3287
 epoch: 2, train_loss: 1.0127, test_loss: 1.3513, test_f1: 0.1368
 epoch: 3, train_loss: 0.9603, test_loss: 1.4523, test_f1: 0.1919
 epoch: 4, train_loss: 0.9322, test_loss: 1.4770, test_f1: 0.2109
 epoch: 5, train_loss: 0.9265, test_loss: 1.5110, test_f1: 0.2210
 epoch: 6, train_loss: 0.8901, test_loss: 1.4434, test_f1: 0.2380
 epoch: 7, train_loss: 0.8602, test_loss: 1.3033, test_f1: 0.2868
 epoch: 8, train_loss: 0.8524, test_loss: 1.2572, test_f1: 0.3302
 epoch: 9, train_loss: 0.8289, test_loss: 1.1700, test_f1: 0.4367
 epoch: 10, train_loss: 0.8020, test_loss: 1.2125, test_f1: 0.4790
 epoch: 11, train_loss: 0.7991, test_loss: 1.0873, test_f1: 0.5545
 epoch: 12, train_loss: 0.7847, test_loss: 0.9906, test_f1: 0.5898
 epoch: 13, train_loss: 0.7482, test_loss: 1.0297, test_f1: 0.5857
 epoch: 14, train_loss: 0.7361, test_loss: 0.9821, test_f1: 0.6000
 epoch: 15, train_loss: 0.7197, test_loss: 1.0239, test_f1: 0.5924
 epoch: 16, train_loss: 0.7012, test_loss: 1.0132, test_f1: 0.5919
 epoch: 17, train_loss: 0.7081, test_loss: 1.0858, test_f1: 0.5452
 epoch: 18, train_loss: 0.6907, test_loss: 1.0868, test_f1: 0.5760
 epoch: 19, train_loss: 0.7080, test_loss: 1.2169, test_f1: 0.5318
 epoch: 20, train_loss: 0.6923, test_loss: 1.0434, test_f1: 0.6076
 epoch: 21, train_loss: 0.6669, test_loss: 1.1994, test_f1: 0.5258
 epoch: 22, train_loss: 0.6765, test_loss: 0.9971, test_f1: 0.6283
 epoch: 23, train_loss: 0.6848, test_loss: 1.1257, test_f1: 0.6155
 epoch: 24, train_loss: 0.7172, test_loss: 0.9937, test_f1: 0.6413
 epoch: 25, train_loss: 0.6497, test_loss: 1.1784, test_f1: 0.5479
 epoch: 26, train_loss: 0.6599, test_loss: 1.0505, test_f1: 0.6117
 epoch: 27, train_loss: 0.6702, test_loss: 1.2065, test_f1: 0.5852
 epoch: 28, train_loss: 0.6358, test_loss: 1.2210, test_f1: 0.5822
 epoch: 29, train_loss: 0.6606, test_loss: 1.1692, test_f1: 0.6471
 epoch: 30, train_loss: 0.6355, test_loss: 1.1503, test_f1: 0.6049
 epoch: 31, train_loss: 0.6333, test_loss: 1.1439, test_f1: 0.6521
 epoch: 32, train_loss: 0.6153, test_loss: 1.1121, test_f1: 0.5820
 epoch: 33, train_loss: 0.6014, test_loss: 1.2594, test_f1: 0.5972
 epoch: 34, train_loss: 0.5906, test_loss: 1.1810, test_f1: 0.6147
 epoch: 35, train_loss: 0.5755, test_loss: 1.2081, test_f1: 0.5954
 epoch: 36, train_loss: 0.5605, test_loss: 1.3290, test_f1: 0.5242
 epoch: 37, train_loss: 0.5524, test_loss: 1.1059, test_f1: 0.6145
 epoch: 38, train_loss: 0.5649, test_loss: 1.0615, test_f1: 0.6421
 epoch: 39, train_loss: 0.5526, test_loss: 1.2331, test_f1: 0.5876
 epoch: 40, train_loss: 0.5275, test_loss: 1.1992, test_f1: 0.6366
 epoch: 41, train_loss: 0.5037, test_loss: 1.4748, test_f1: 0.5822
 epoch: 42, train_loss: 0.5236, test_loss: 1.3460, test_f1: 0.5461
 epoch: 43, train_loss: 0.5564, test_loss: 1.2677, test_f1: 0.5831
 epoch: 44, train_loss: 0.5626, test_loss: 1.2512, test_f1: 0.5952
 epoch: 45, train_loss: 0.5168, test_loss: 1.2013, test_f1: 0.6352
 epoch: 46, train_loss: 0.5128, test_loss: 1.2487, test_f1: 0.6345
 epoch: 47, train_loss: 0.4926, test_loss: 1.3822, test_f1: 0.5858
 epoch: 48, train_loss: 0.4675, test_loss: 1.3729, test_f1: 0.5532
 epoch: 49, train_loss: 0.4545, test_loss: 1.3741, test_f1: 0.6077
 epoch: 50, train_loss: 0.4461, test_loss: 1.3955, test_f1: 0.6073
 epoch: 51, train_loss: 0.4254, test_loss: 1.3209, test_f1: 0.6466
 epoch: 52, train_loss: 0.4359, test_loss: 1.3206, test_f1: 0.6267
 epoch: 53, train_loss: 0.4097, test_loss: 1.3673, test_f1: 0.6553
 epoch: 54, train_loss: 0.4168, test_loss: 1.3090, test_f1: 0.6631
 epoch: 55, train_loss: 0.4236, test_loss: 1.4254, test_f1: 0.6229
 epoch: 56, train_loss: 0.4104, test_loss: 1.3675, test_f1: 0.6341
 epoch: 57, train_loss: 0.4082, test_loss: 1.4480, test_f1: 0.6367
 epoch: 58, train_loss: 0.3939, test_loss: 1.4138, test_f1: 0.6194
 epoch: 59, train_loss: 0.3903, test_loss: 1.4478, test_f1: 0.6509
 epoch: 60, train_loss: 0.3778, test_loss: 1.4870, test_f1: 0.6463
 epoch: 61, train_loss: 0.3670, test_loss: 1.4700, test_f1: 0.6314
 epoch: 62, train_loss: 0.3522, test_loss: 1.5125, test_f1: 0.6528
 epoch: 63, train_loss: 0.3618, test_loss: 1.5522, test_f1: 0.6102
 epoch: 64, train_loss: 0.3248, test_loss: 1.6072, test_f1: 0.5877
 epoch: 65, train_loss: 0.3244, test_loss: 1.6427, test_f1: 0.6125
 epoch: 66, train_loss: 0.3317, test_loss: 1.7335, test_f1: 0.6550
 epoch: 67, train_loss: 0.3236, test_loss: 1.7099, test_f1: 0.6256
 epoch: 68, train_loss: 0.3405, test_loss: 1.6126, test_f1: 0.6202
 epoch: 69, train_loss: 0.3558, test_loss: 1.9218, test_f1: 0.5078
 epoch: 70, train_loss: 0.3418, test_loss: 1.6088, test_f1: 0.5909
 epoch: 71, train_loss: 0.3303, test_loss: 1.6738, test_f1: 0.6335
 epoch: 72, train_loss: 0.3390, test_loss: 1.5925, test_f1: 0.6226
 epoch: 73, train_loss: 0.3150, test_loss: 1.5720, test_f1: 0.6129
 epoch: 74, train_loss: 0.3219, test_loss: 1.6486, test_f1: 0.6386
 epoch: 75, train_loss: 0.3355, test_loss: 1.6843, test_f1: 0.6225
 epoch: 76, train_loss: 0.3185, test_loss: 1.5786, test_f1: 0.6401
 epoch: 77, train_loss: 0.3026, test_loss: 1.9646, test_f1: 0.5755
 epoch: 78, train_loss: 0.3104, test_loss: 1.7795, test_f1: 0.6273
 epoch: 79, train_loss: 0.2897, test_loss: 1.8126, test_f1: 0.6218
 epoch: 80, train_loss: 0.2970, test_loss: 2.0091, test_f1: 0.5890
 epoch: 81, train_loss: 0.3039, test_loss: 1.8815, test_f1: 0.6498
 epoch: 82, train_loss: 0.2869, test_loss: 1.9027, test_f1: 0.6477
 epoch: 83, train_loss: 0.2652, test_loss: 1.8195, test_f1: 0.6384
 epoch: 84, train_loss: 0.2919, test_loss: 1.8398, test_f1: 0.6079
 epoch: 85, train_loss: 0.3136, test_loss: 1.8940, test_f1: 0.5722
 epoch: 86, train_loss: 0.2919, test_loss: 1.7508, test_f1: 0.5949
 epoch: 87, train_loss: 0.2612, test_loss: 1.7732, test_f1: 0.6411
 epoch: 88, train_loss: 0.2845, test_loss: 1.8302, test_f1: 0.6369
 epoch: 89, train_loss: 0.3178, test_loss: 2.0075, test_f1: 0.5736
 epoch: 90, train_loss: 0.2934, test_loss: 1.9516, test_f1: 0.5927
 epoch: 91, train_loss: 0.2659, test_loss: 1.7453, test_f1: 0.6350
 epoch: 92, train_loss: 0.2864, test_loss: 1.7489, test_f1: 0.6641
 epoch: 93, train_loss: 0.2595, test_loss: 1.8542, test_f1: 0.6538
 epoch: 94, train_loss: 0.2637, test_loss: 2.0133, test_f1: 0.6237
 epoch: 95, train_loss: 0.2511, test_loss: 2.2213, test_f1: 0.5438
 epoch: 96, train_loss: 0.2571, test_loss: 2.1630, test_f1: 0.5478
 epoch: 97, train_loss: 0.2448, test_loss: 2.1655, test_f1: 0.5731
 epoch: 98, train_loss: 0.2427, test_loss: 1.9797, test_f1: 0.6347
 epoch: 99, train_loss: 0.2469, test_loss: 1.9856, test_f1: 0.6304
##################ITERATION #6 ****************************************
 epoch: 0, train_loss: 1.2816, test_loss: 1.3183, test_f1: 0.1365
 epoch: 1, train_loss: 1.1307, test_loss: 1.2918, test_f1: 0.3515
 epoch: 2, train_loss: 1.0719, test_loss: 1.2783, test_f1: 0.3356
 epoch: 3, train_loss: 1.0148, test_loss: 1.2854, test_f1: 0.3356
 epoch: 4, train_loss: 0.9644, test_loss: 1.2842, test_f1: 0.3698
 epoch: 5, train_loss: 0.9540, test_loss: 1.2641, test_f1: 0.3435
 epoch: 6, train_loss: 0.9278, test_loss: 1.2359, test_f1: 0.3528
 epoch: 7, train_loss: 0.8800, test_loss: 1.1570, test_f1: 0.4390
 epoch: 8, train_loss: 0.8927, test_loss: 1.1672, test_f1: 0.4772
 epoch: 9, train_loss: 0.8597, test_loss: 1.0877, test_f1: 0.5003
 epoch: 10, train_loss: 0.8436, test_loss: 1.0870, test_f1: 0.5144
 epoch: 11, train_loss: 0.8103, test_loss: 1.1709, test_f1: 0.4724
 epoch: 12, train_loss: 0.8037, test_loss: 1.1325, test_f1: 0.5132
 epoch: 13, train_loss: 0.7873, test_loss: 1.0663, test_f1: 0.5025
 epoch: 14, train_loss: 0.7735, test_loss: 1.1013, test_f1: 0.5466
 epoch: 15, train_loss: 0.7762, test_loss: 1.1034, test_f1: 0.5589
 epoch: 16, train_loss: 0.7401, test_loss: 1.0617, test_f1: 0.5654
 epoch: 17, train_loss: 0.7298, test_loss: 1.1264, test_f1: 0.5699
 epoch: 18, train_loss: 0.7261, test_loss: 1.2506, test_f1: 0.5535
 epoch: 19, train_loss: 0.7019, test_loss: 1.3006, test_f1: 0.5755
 epoch: 20, train_loss: 0.6829, test_loss: 1.3386, test_f1: 0.5854
 epoch: 21, train_loss: 0.6825, test_loss: 1.3186, test_f1: 0.6139
 epoch: 22, train_loss: 0.6760, test_loss: 1.1781, test_f1: 0.5479
 epoch: 23, train_loss: 0.6796, test_loss: 1.1453, test_f1: 0.5653
 epoch: 24, train_loss: 0.6809, test_loss: 1.2079, test_f1: 0.5556
 epoch: 25, train_loss: 0.6972, test_loss: 1.1121, test_f1: 0.5300
 epoch: 26, train_loss: 0.6763, test_loss: 1.2309, test_f1: 0.5581
 epoch: 27, train_loss: 0.6526, test_loss: 1.4609, test_f1: 0.5623
 epoch: 28, train_loss: 0.6422, test_loss: 1.4269, test_f1: 0.5179
 epoch: 29, train_loss: 0.6441, test_loss: 1.4025, test_f1: 0.5487
 epoch: 30, train_loss: 0.6393, test_loss: 1.4183, test_f1: 0.5453
 epoch: 31, train_loss: 0.6638, test_loss: 1.4540, test_f1: 0.5225
 epoch: 32, train_loss: 0.6168, test_loss: 1.4301, test_f1: 0.5473
 epoch: 33, train_loss: 0.5999, test_loss: 1.1903, test_f1: 0.5663
 epoch: 34, train_loss: 0.6030, test_loss: 1.2633, test_f1: 0.5481
 epoch: 35, train_loss: 0.6031, test_loss: 1.3063, test_f1: 0.5554
 epoch: 36, train_loss: 0.5806, test_loss: 1.2331, test_f1: 0.5942
 epoch: 37, train_loss: 0.5647, test_loss: 1.6109, test_f1: 0.5533
 epoch: 38, train_loss: 0.5594, test_loss: 1.1767, test_f1: 0.6237
 epoch: 39, train_loss: 0.5575, test_loss: 1.2993, test_f1: 0.6011
 epoch: 40, train_loss: 0.5223, test_loss: 1.4026, test_f1: 0.5559
 epoch: 41, train_loss: 0.5229, test_loss: 1.5094, test_f1: 0.5460
 epoch: 42, train_loss: 0.5883, test_loss: 1.2958, test_f1: 0.5593
 epoch: 43, train_loss: 0.5533, test_loss: 1.5047, test_f1: 0.6036
 epoch: 44, train_loss: 0.5732, test_loss: 1.4738, test_f1: 0.5348
 epoch: 45, train_loss: 0.6141, test_loss: 1.4834, test_f1: 0.4845
 epoch: 46, train_loss: 0.5845, test_loss: 1.4111, test_f1: 0.5489
 epoch: 47, train_loss: 0.5615, test_loss: 1.3414, test_f1: 0.5604
 epoch: 48, train_loss: 0.5343, test_loss: 1.2116, test_f1: 0.5842
 epoch: 49, train_loss: 0.5514, test_loss: 1.2466, test_f1: 0.5681
 epoch: 50, train_loss: 0.5182, test_loss: 1.2723, test_f1: 0.5674
 epoch: 51, train_loss: 0.4925, test_loss: 1.1439, test_f1: 0.6007
 epoch: 52, train_loss: 0.4745, test_loss: 1.2590, test_f1: 0.5612
 epoch: 53, train_loss: 0.4687, test_loss: 1.2442, test_f1: 0.5488
 epoch: 54, train_loss: 0.4548, test_loss: 1.2205, test_f1: 0.6048
 epoch: 55, train_loss: 0.4445, test_loss: 1.2581, test_f1: 0.6121
 epoch: 56, train_loss: 0.4510, test_loss: 1.4524, test_f1: 0.5733
 epoch: 57, train_loss: 0.4508, test_loss: 1.4379, test_f1: 0.5744
 epoch: 58, train_loss: 0.4338, test_loss: 1.4533, test_f1: 0.5393
 epoch: 59, train_loss: 0.4419, test_loss: 1.2702, test_f1: 0.5677
 epoch: 60, train_loss: 0.4495, test_loss: 1.2601, test_f1: 0.5616
 epoch: 61, train_loss: 0.4096, test_loss: 1.3943, test_f1: 0.5292
 epoch: 62, train_loss: 0.3861, test_loss: 1.3885, test_f1: 0.5437
 epoch: 63, train_loss: 0.4018, test_loss: 1.4432, test_f1: 0.5808
 epoch: 64, train_loss: 0.3812, test_loss: 1.5013, test_f1: 0.5834
 epoch: 65, train_loss: 0.4018, test_loss: 1.4864, test_f1: 0.5950
 epoch: 66, train_loss: 0.3741, test_loss: 1.4396, test_f1: 0.5984
 epoch: 67, train_loss: 0.3738, test_loss: 1.4932, test_f1: 0.5816
 epoch: 68, train_loss: 0.3784, test_loss: 1.5485, test_f1: 0.5748
 epoch: 69, train_loss: 0.3733, test_loss: 1.6202, test_f1: 0.6030
 epoch: 70, train_loss: 0.3786, test_loss: 1.8016, test_f1: 0.5706
 epoch: 71, train_loss: 0.3890, test_loss: 1.6310, test_f1: 0.5971
 epoch: 72, train_loss: 0.3540, test_loss: 1.5869, test_f1: 0.5774
 epoch: 73, train_loss: 0.3492, test_loss: 1.5526, test_f1: 0.5926
 epoch: 74, train_loss: 0.3597, test_loss: 1.7700, test_f1: 0.5740
 epoch: 75, train_loss: 0.3580, test_loss: 1.7073, test_f1: 0.5831
 epoch: 76, train_loss: 0.3476, test_loss: 1.4820, test_f1: 0.6247
 epoch: 77, train_loss: 0.3577, test_loss: 1.5402, test_f1: 0.6038
 epoch: 78, train_loss: 0.3643, test_loss: 1.6113, test_f1: 0.5788
 epoch: 79, train_loss: 0.3653, test_loss: 1.5721, test_f1: 0.5978
 epoch: 80, train_loss: 0.3411, test_loss: 1.5446, test_f1: 0.6291
 epoch: 81, train_loss: 0.3307, test_loss: 1.5807, test_f1: 0.5865
 epoch: 82, train_loss: 0.3509, test_loss: 1.7159, test_f1: 0.5670
 epoch: 83, train_loss: 0.3421, test_loss: 1.8645, test_f1: 0.5895
 epoch: 84, train_loss: 0.3147, test_loss: 1.8368, test_f1: 0.6024
 epoch: 85, train_loss: 0.3291, test_loss: 1.9380, test_f1: 0.5765
 epoch: 86, train_loss: 0.3148, test_loss: 1.8812, test_f1: 0.5989
 epoch: 87, train_loss: 0.3208, test_loss: 1.9670, test_f1: 0.5851
 epoch: 88, train_loss: 0.3017, test_loss: 2.0000, test_f1: 0.5771
 epoch: 89, train_loss: 0.3115, test_loss: 1.8334, test_f1: 0.5627
 epoch: 90, train_loss: 0.2963, test_loss: 1.8810, test_f1: 0.5240
 epoch: 91, train_loss: 0.2916, test_loss: 1.9406, test_f1: 0.5415
 epoch: 92, train_loss: 0.2793, test_loss: 1.8188, test_f1: 0.5678
 epoch: 93, train_loss: 0.2923, test_loss: 1.7698, test_f1: 0.5870
 epoch: 94, train_loss: 0.3049, test_loss: 1.8978, test_f1: 0.5425
 epoch: 95, train_loss: 0.2864, test_loss: 2.0379, test_f1: 0.5330
 epoch: 96, train_loss: 0.2908, test_loss: 1.9229, test_f1: 0.5553
 epoch: 97, train_loss: 0.2811, test_loss: 1.8363, test_f1: 0.5927
 epoch: 98, train_loss: 0.2651, test_loss: 1.8150, test_f1: 0.5904
 epoch: 99, train_loss: 0.2580, test_loss: 1.9252, test_f1: 0.5428
##################ITERATION #7 ****************************************
 epoch: 0, train_loss: 1.2354, test_loss: 1.3781, test_f1: 0.1706
 epoch: 1, train_loss: 1.0835, test_loss: 1.4212, test_f1: 0.1385
 epoch: 2, train_loss: 1.0505, test_loss: 1.4838, test_f1: 0.2391
 epoch: 3, train_loss: 0.9679, test_loss: 1.5250, test_f1: 0.2618
 epoch: 4, train_loss: 0.9686, test_loss: 1.5115, test_f1: 0.2882
 epoch: 5, train_loss: 0.9080, test_loss: 1.5413, test_f1: 0.2396
 epoch: 6, train_loss: 0.8941, test_loss: 1.4983, test_f1: 0.3003
 epoch: 7, train_loss: 0.8702, test_loss: 1.3185, test_f1: 0.3381
 epoch: 8, train_loss: 0.8682, test_loss: 1.2249, test_f1: 0.4108
 epoch: 9, train_loss: 0.8343, test_loss: 1.2075, test_f1: 0.4437
 epoch: 10, train_loss: 0.8285, test_loss: 1.1179, test_f1: 0.4865
 epoch: 11, train_loss: 0.8188, test_loss: 1.0290, test_f1: 0.5346
 epoch: 12, train_loss: 0.7954, test_loss: 1.0263, test_f1: 0.5736
 epoch: 13, train_loss: 0.7816, test_loss: 1.0023, test_f1: 0.6003
 epoch: 14, train_loss: 0.7698, test_loss: 1.0586, test_f1: 0.5156
 epoch: 15, train_loss: 0.7605, test_loss: 1.0101, test_f1: 0.5149
 epoch: 16, train_loss: 0.7551, test_loss: 1.0140, test_f1: 0.5573
 epoch: 17, train_loss: 0.7411, test_loss: 1.2703, test_f1: 0.5172
 epoch: 18, train_loss: 0.7487, test_loss: 1.1985, test_f1: 0.5357
 epoch: 19, train_loss: 0.7143, test_loss: 1.0518, test_f1: 0.5896
 epoch: 20, train_loss: 0.7172, test_loss: 0.9999, test_f1: 0.5739
 epoch: 21, train_loss: 0.6770, test_loss: 1.0616, test_f1: 0.5704
 epoch: 22, train_loss: 0.6708, test_loss: 1.0656, test_f1: 0.5774
 epoch: 23, train_loss: 0.6613, test_loss: 1.0815, test_f1: 0.6104
 epoch: 24, train_loss: 0.6834, test_loss: 1.0755, test_f1: 0.5522
 epoch: 25, train_loss: 0.6553, test_loss: 1.1246, test_f1: 0.5458
 epoch: 26, train_loss: 0.6723, test_loss: 1.0760, test_f1: 0.5594
 epoch: 27, train_loss: 0.6607, test_loss: 1.0349, test_f1: 0.5722
 epoch: 28, train_loss: 0.6431, test_loss: 1.1623, test_f1: 0.5656
 epoch: 29, train_loss: 0.6056, test_loss: 0.9842, test_f1: 0.6068
 epoch: 30, train_loss: 0.5892, test_loss: 1.0258, test_f1: 0.5770
 epoch: 31, train_loss: 0.5987, test_loss: 1.0671, test_f1: 0.5689
 epoch: 32, train_loss: 0.5911, test_loss: 1.1851, test_f1: 0.5485
 epoch: 33, train_loss: 0.5870, test_loss: 1.1943, test_f1: 0.5721
 epoch: 34, train_loss: 0.6002, test_loss: 1.3257, test_f1: 0.5771
 epoch: 35, train_loss: 0.6142, test_loss: 1.1350, test_f1: 0.5713
 epoch: 36, train_loss: 0.6179, test_loss: 1.4418, test_f1: 0.6111
 epoch: 37, train_loss: 0.5905, test_loss: 2.5326, test_f1: 0.5734
 epoch: 38, train_loss: 0.5553, test_loss: 1.7306, test_f1: 0.6468
 epoch: 39, train_loss: 0.5699, test_loss: 1.0956, test_f1: 0.6042
 epoch: 40, train_loss: 0.5357, test_loss: 1.0414, test_f1: 0.5614
 epoch: 41, train_loss: 0.5368, test_loss: 1.1410, test_f1: 0.5597
 epoch: 42, train_loss: 0.5640, test_loss: 1.7074, test_f1: 0.5497
 epoch: 43, train_loss: 0.5637, test_loss: 1.1605, test_f1: 0.5708
 epoch: 44, train_loss: 0.5639, test_loss: 1.0950, test_f1: 0.5836
 epoch: 45, train_loss: 0.5400, test_loss: 1.2702, test_f1: 0.5258
 epoch: 46, train_loss: 0.5391, test_loss: 1.2673, test_f1: 0.5242
 epoch: 47, train_loss: 0.5242, test_loss: 1.1542, test_f1: 0.5928
 epoch: 48, train_loss: 0.5483, test_loss: 1.5466, test_f1: 0.5949
 epoch: 49, train_loss: 0.5791, test_loss: 1.5334, test_f1: 0.5890
 epoch: 50, train_loss: 0.5901, test_loss: 1.3644, test_f1: 0.5631
 epoch: 51, train_loss: 0.5392, test_loss: 1.4645, test_f1: 0.6385
 epoch: 52, train_loss: 0.5180, test_loss: 1.1466, test_f1: 0.6397
 epoch: 53, train_loss: 0.5081, test_loss: 1.1077, test_f1: 0.6021
 epoch: 54, train_loss: 0.4856, test_loss: 1.1129, test_f1: 0.6240
 epoch: 55, train_loss: 0.4744, test_loss: 1.1433, test_f1: 0.6222
 epoch: 56, train_loss: 0.4555, test_loss: 1.1304, test_f1: 0.6245
 epoch: 57, train_loss: 0.4319, test_loss: 1.0863, test_f1: 0.6538
 epoch: 58, train_loss: 0.4461, test_loss: 1.1025, test_f1: 0.6373
 epoch: 59, train_loss: 0.4380, test_loss: 1.1771, test_f1: 0.5946
 epoch: 60, train_loss: 0.4391, test_loss: 1.1171, test_f1: 0.6387
 epoch: 61, train_loss: 0.4080, test_loss: 1.2321, test_f1: 0.5893
 epoch: 62, train_loss: 0.4342, test_loss: 1.1734, test_f1: 0.6054
 epoch: 63, train_loss: 0.4306, test_loss: 1.1596, test_f1: 0.6194
 epoch: 64, train_loss: 0.4255, test_loss: 1.1441, test_f1: 0.6318
 epoch: 65, train_loss: 0.4064, test_loss: 1.1385, test_f1: 0.6448
 epoch: 66, train_loss: 0.4136, test_loss: 1.1389, test_f1: 0.6297
 epoch: 67, train_loss: 0.3802, test_loss: 1.2131, test_f1: 0.6433
 epoch: 68, train_loss: 0.3836, test_loss: 1.2554, test_f1: 0.6333
 epoch: 69, train_loss: 0.4022, test_loss: 1.2082, test_f1: 0.6114
 epoch: 70, train_loss: 0.3842, test_loss: 1.1729, test_f1: 0.6232
 epoch: 71, train_loss: 0.3868, test_loss: 1.1977, test_f1: 0.6203
 epoch: 72, train_loss: 0.3750, test_loss: 1.1310, test_f1: 0.6364
 epoch: 73, train_loss: 0.3570, test_loss: 1.1354, test_f1: 0.6483
 epoch: 74, train_loss: 0.3428, test_loss: 1.2632, test_f1: 0.6147
 epoch: 75, train_loss: 0.3768, test_loss: 1.2491, test_f1: 0.6284
 epoch: 76, train_loss: 0.3731, test_loss: 1.2812, test_f1: 0.6207
 epoch: 77, train_loss: 0.3822, test_loss: 1.3431, test_f1: 0.6321
 epoch: 78, train_loss: 0.3583, test_loss: 1.2881, test_f1: 0.6400
 epoch: 79, train_loss: 0.3709, test_loss: 1.3504, test_f1: 0.6403
 epoch: 80, train_loss: 0.3372, test_loss: 1.4142, test_f1: 0.6384
 epoch: 81, train_loss: 0.3303, test_loss: 1.3588, test_f1: 0.6398
 epoch: 82, train_loss: 0.3360, test_loss: 1.3824, test_f1: 0.6239
 epoch: 83, train_loss: 0.3236, test_loss: 2.0780, test_f1: 0.6041
 epoch: 84, train_loss: 0.3523, test_loss: 1.5800, test_f1: 0.6139
 epoch: 85, train_loss: 0.3562, test_loss: 2.0241, test_f1: 0.5999
 epoch: 86, train_loss: 0.3289, test_loss: 1.4545, test_f1: 0.6020
 epoch: 87, train_loss: 0.3253, test_loss: 1.4139, test_f1: 0.6033
 epoch: 88, train_loss: 0.3080, test_loss: 1.3822, test_f1: 0.6631
 epoch: 89, train_loss: 0.3236, test_loss: 1.3891, test_f1: 0.6379
 epoch: 90, train_loss: 0.3070, test_loss: 1.3637, test_f1: 0.6368
 epoch: 91, train_loss: 0.3205, test_loss: 1.4466, test_f1: 0.6437
 epoch: 92, train_loss: 0.3001, test_loss: 1.4312, test_f1: 0.6268
 epoch: 93, train_loss: 0.3105, test_loss: 1.4116, test_f1: 0.6316
 epoch: 94, train_loss: 0.3160, test_loss: 1.4715, test_f1: 0.6265
 epoch: 95, train_loss: 0.3054, test_loss: 1.4702, test_f1: 0.6306
 epoch: 96, train_loss: 0.2966, test_loss: 1.4982, test_f1: 0.6462
 epoch: 97, train_loss: 0.3048, test_loss: 1.4187, test_f1: 0.6540
 epoch: 98, train_loss: 0.3139, test_loss: 1.4586, test_f1: 0.6240
 epoch: 99, train_loss: 0.2876, test_loss: 1.4578, test_f1: 0.6461
##################ITERATION #8 ****************************************
 epoch: 0, train_loss: 1.3943, test_loss: 1.3447, test_f1: 0.3231
 epoch: 1, train_loss: 1.1218, test_loss: 1.3134, test_f1: 0.2834
 epoch: 2, train_loss: 1.0411, test_loss: 1.2895, test_f1: 0.2587
 epoch: 3, train_loss: 1.0100, test_loss: 1.2773, test_f1: 0.2952
 epoch: 4, train_loss: 0.9524, test_loss: 1.2641, test_f1: 0.3357
 epoch: 5, train_loss: 0.9049, test_loss: 1.2509, test_f1: 0.3451
 epoch: 6, train_loss: 0.8864, test_loss: 1.2073, test_f1: 0.3908
 epoch: 7, train_loss: 0.8744, test_loss: 1.1870, test_f1: 0.4376
 epoch: 8, train_loss: 0.8474, test_loss: 1.1959, test_f1: 0.4783
 epoch: 9, train_loss: 0.8046, test_loss: 1.1315, test_f1: 0.4753
 epoch: 10, train_loss: 0.8126, test_loss: 1.0718, test_f1: 0.5230
 epoch: 11, train_loss: 0.7854, test_loss: 1.0836, test_f1: 0.5627
 epoch: 12, train_loss: 0.7736, test_loss: 1.0897, test_f1: 0.5578
 epoch: 13, train_loss: 0.7580, test_loss: 1.0833, test_f1: 0.5553
 epoch: 14, train_loss: 0.7504, test_loss: 1.0550, test_f1: 0.5573
 epoch: 15, train_loss: 0.7203, test_loss: 0.9738, test_f1: 0.5970
 epoch: 16, train_loss: 0.7263, test_loss: 1.3031, test_f1: 0.5115
 epoch: 17, train_loss: 0.7112, test_loss: 0.9994, test_f1: 0.5790
 epoch: 18, train_loss: 0.6813, test_loss: 1.0213, test_f1: 0.5580
 epoch: 19, train_loss: 0.6550, test_loss: 1.0535, test_f1: 0.5441
 epoch: 20, train_loss: 0.6453, test_loss: 1.1413, test_f1: 0.5434
 epoch: 21, train_loss: 0.6682, test_loss: 1.1281, test_f1: 0.5734
 epoch: 22, train_loss: 0.6502, test_loss: 1.0073, test_f1: 0.5690
 epoch: 23, train_loss: 0.6298, test_loss: 1.0158, test_f1: 0.5931
 epoch: 24, train_loss: 0.6376, test_loss: 1.0562, test_f1: 0.5815
 epoch: 25, train_loss: 0.6410, test_loss: 1.1287, test_f1: 0.5691
 epoch: 26, train_loss: 0.6005, test_loss: 1.1087, test_f1: 0.5845
 epoch: 27, train_loss: 0.5858, test_loss: 1.1414, test_f1: 0.5734
 epoch: 28, train_loss: 0.5931, test_loss: 1.1309, test_f1: 0.6068
 epoch: 29, train_loss: 0.6074, test_loss: 1.2748, test_f1: 0.5602
 epoch: 30, train_loss: 0.5557, test_loss: 1.1806, test_f1: 0.5948
 epoch: 31, train_loss: 0.5626, test_loss: 1.2750, test_f1: 0.5864
 epoch: 32, train_loss: 0.5172, test_loss: 1.1566, test_f1: 0.5597
 epoch: 33, train_loss: 0.5072, test_loss: 1.2003, test_f1: 0.5818
 epoch: 34, train_loss: 0.5062, test_loss: 1.2349, test_f1: 0.5827
 epoch: 35, train_loss: 0.4874, test_loss: 1.3718, test_f1: 0.5533
 epoch: 36, train_loss: 0.4961, test_loss: 1.3839, test_f1: 0.6010
 epoch: 37, train_loss: 0.5114, test_loss: 1.3498, test_f1: 0.5871
 epoch: 38, train_loss: 0.5534, test_loss: 1.4445, test_f1: 0.4901
 epoch: 39, train_loss: 0.5378, test_loss: 1.4321, test_f1: 0.6114
 epoch: 40, train_loss: 0.5523, test_loss: 1.4077, test_f1: 0.5526
 epoch: 41, train_loss: 0.5177, test_loss: 1.3007, test_f1: 0.5887
 epoch: 42, train_loss: 0.4805, test_loss: 1.2472, test_f1: 0.5933
 epoch: 43, train_loss: 0.4838, test_loss: 1.2105, test_f1: 0.6275
 epoch: 44, train_loss: 0.4381, test_loss: 1.2651, test_f1: 0.6182
 epoch: 45, train_loss: 0.4631, test_loss: 1.3714, test_f1: 0.5864
 epoch: 46, train_loss: 0.4904, test_loss: 1.2660, test_f1: 0.5976
 epoch: 47, train_loss: 0.4928, test_loss: 1.4399, test_f1: 0.6039
 epoch: 48, train_loss: 0.4725, test_loss: 1.5296, test_f1: 0.6138
 epoch: 49, train_loss: 0.4395, test_loss: 1.4379, test_f1: 0.6350
 epoch: 50, train_loss: 0.4396, test_loss: 1.4355, test_f1: 0.6134
 epoch: 51, train_loss: 0.4156, test_loss: 1.2571, test_f1: 0.6366
 epoch: 52, train_loss: 0.3909, test_loss: 1.2995, test_f1: 0.6339
 epoch: 53, train_loss: 0.3773, test_loss: 1.4638, test_f1: 0.6142
 epoch: 54, train_loss: 0.3820, test_loss: 1.3693, test_f1: 0.6201
 epoch: 55, train_loss: 0.3727, test_loss: 1.2904, test_f1: 0.6138
 epoch: 56, train_loss: 0.3722, test_loss: 1.4309, test_f1: 0.6250
 epoch: 57, train_loss: 0.3686, test_loss: 1.5129, test_f1: 0.6103
 epoch: 58, train_loss: 0.3493, test_loss: 1.4859, test_f1: 0.6049
 epoch: 59, train_loss: 0.3522, test_loss: 1.5457, test_f1: 0.5890
 epoch: 60, train_loss: 0.3329, test_loss: 1.5399, test_f1: 0.5771
 epoch: 61, train_loss: 0.3280, test_loss: 1.5021, test_f1: 0.5764
 epoch: 62, train_loss: 0.3333, test_loss: 1.5365, test_f1: 0.5853
 epoch: 63, train_loss: 0.2974, test_loss: 1.5570, test_f1: 0.6006
 epoch: 64, train_loss: 0.2972, test_loss: 1.6170, test_f1: 0.5963
 epoch: 65, train_loss: 0.3085, test_loss: 1.5595, test_f1: 0.6060
 epoch: 66, train_loss: 0.2985, test_loss: 1.6710, test_f1: 0.5610
 epoch: 67, train_loss: 0.3269, test_loss: 1.4753, test_f1: 0.5943
 epoch: 68, train_loss: 0.2988, test_loss: 1.5638, test_f1: 0.5984
 epoch: 69, train_loss: 0.2875, test_loss: 1.6621, test_f1: 0.5940
 epoch: 70, train_loss: 0.2830, test_loss: 1.5795, test_f1: 0.5757
 epoch: 71, train_loss: 0.2777, test_loss: 1.5769, test_f1: 0.5840
 epoch: 72, train_loss: 0.2846, test_loss: 1.5749, test_f1: 0.6255
 epoch: 73, train_loss: 0.2806, test_loss: 1.6841, test_f1: 0.5996
 epoch: 74, train_loss: 0.2880, test_loss: 1.5470, test_f1: 0.6234
 epoch: 75, train_loss: 0.2889, test_loss: 1.5410, test_f1: 0.6318
 epoch: 76, train_loss: 0.2740, test_loss: 1.6626, test_f1: 0.5998
 epoch: 77, train_loss: 0.2805, test_loss: 1.6329, test_f1: 0.5939
 epoch: 78, train_loss: 0.2661, test_loss: 1.7081, test_f1: 0.6124
 epoch: 79, train_loss: 0.3136, test_loss: 1.8591, test_f1: 0.5963
 epoch: 80, train_loss: 0.2535, test_loss: 1.6789, test_f1: 0.6145
 epoch: 81, train_loss: 0.2723, test_loss: 1.8016, test_f1: 0.6217
 epoch: 82, train_loss: 0.2628, test_loss: 1.6709, test_f1: 0.5943
 epoch: 83, train_loss: 0.2427, test_loss: 1.6387, test_f1: 0.5793
 epoch: 84, train_loss: 0.2457, test_loss: 1.6552, test_f1: 0.5807
 epoch: 85, train_loss: 0.2543, test_loss: 1.7253, test_f1: 0.5766
 epoch: 86, train_loss: 0.2318, test_loss: 1.7754, test_f1: 0.5852
 epoch: 87, train_loss: 0.2355, test_loss: 1.7493, test_f1: 0.5865
 epoch: 88, train_loss: 0.2390, test_loss: 1.5894, test_f1: 0.5790
 epoch: 89, train_loss: 0.2375, test_loss: 1.5742, test_f1: 0.5860
 epoch: 90, train_loss: 0.2627, test_loss: 1.6508, test_f1: 0.6184
 epoch: 91, train_loss: 0.3246, test_loss: 1.8518, test_f1: 0.5975
 epoch: 92, train_loss: 0.3269, test_loss: 1.7720, test_f1: 0.5792
 epoch: 93, train_loss: 0.2547, test_loss: 1.6978, test_f1: 0.6213
 epoch: 94, train_loss: 0.2640, test_loss: 1.6776, test_f1: 0.6326
 epoch: 95, train_loss: 0.2658, test_loss: 1.7250, test_f1: 0.5826
 epoch: 96, train_loss: 0.2288, test_loss: 1.7018, test_f1: 0.5891
 epoch: 97, train_loss: 0.2307, test_loss: 1.7143, test_f1: 0.5877
 epoch: 98, train_loss: 0.2274, test_loss: 1.5743, test_f1: 0.6071
 epoch: 99, train_loss: 0.2263, test_loss: 1.6489, test_f1: 0.6158
##################ITERATION #9 ****************************************
 epoch: 0, train_loss: 1.3170, test_loss: 1.3408, test_f1: 0.1835
 epoch: 1, train_loss: 1.0862, test_loss: 1.3413, test_f1: 0.1396
 epoch: 2, train_loss: 1.0319, test_loss: 1.4006, test_f1: 0.1807
 epoch: 3, train_loss: 0.9737, test_loss: 1.4701, test_f1: 0.2418
 epoch: 4, train_loss: 0.9462, test_loss: 1.5243, test_f1: 0.1678
 epoch: 5, train_loss: 0.9087, test_loss: 1.5710, test_f1: 0.1928
 epoch: 6, train_loss: 0.8924, test_loss: 1.4887, test_f1: 0.2528
 epoch: 7, train_loss: 0.8526, test_loss: 1.2337, test_f1: 0.4023
 epoch: 8, train_loss: 0.8464, test_loss: 1.1075, test_f1: 0.4608
 epoch: 9, train_loss: 0.8356, test_loss: 1.0600, test_f1: 0.5039
 epoch: 10, train_loss: 0.8309, test_loss: 1.0484, test_f1: 0.5362
 epoch: 11, train_loss: 0.7984, test_loss: 1.0148, test_f1: 0.5635
 epoch: 12, train_loss: 0.8050, test_loss: 1.0439, test_f1: 0.5722
 epoch: 13, train_loss: 0.7778, test_loss: 1.0475, test_f1: 0.5573
 epoch: 14, train_loss: 0.7570, test_loss: 0.9816, test_f1: 0.5845
 epoch: 15, train_loss: 0.7600, test_loss: 1.0581, test_f1: 0.5565
 epoch: 16, train_loss: 0.7417, test_loss: 1.0962, test_f1: 0.6006
 epoch: 17, train_loss: 0.7136, test_loss: 1.0526, test_f1: 0.5668
 epoch: 18, train_loss: 0.7062, test_loss: 1.0145, test_f1: 0.5765
 epoch: 19, train_loss: 0.7025, test_loss: 0.9912, test_f1: 0.6267
 epoch: 20, train_loss: 0.7027, test_loss: 1.1361, test_f1: 0.6300
 epoch: 21, train_loss: 0.6914, test_loss: 1.0610, test_f1: 0.5762
 epoch: 22, train_loss: 0.6713, test_loss: 1.0561, test_f1: 0.5983
 epoch: 23, train_loss: 0.6675, test_loss: 1.2725, test_f1: 0.5620
 epoch: 24, train_loss: 0.7172, test_loss: 1.1422, test_f1: 0.5714
 epoch: 25, train_loss: 0.6655, test_loss: 1.1450, test_f1: 0.6376
 epoch: 26, train_loss: 0.6618, test_loss: 1.1562, test_f1: 0.6234
 epoch: 27, train_loss: 0.6262, test_loss: 1.1326, test_f1: 0.5510
 epoch: 28, train_loss: 0.6059, test_loss: 1.1866, test_f1: 0.5631
 epoch: 29, train_loss: 0.5944, test_loss: 1.1422, test_f1: 0.6017
 epoch: 30, train_loss: 0.5935, test_loss: 1.1828, test_f1: 0.5981
 epoch: 31, train_loss: 0.5828, test_loss: 1.1634, test_f1: 0.5885
 epoch: 32, train_loss: 0.5750, test_loss: 1.2350, test_f1: 0.5596
 epoch: 33, train_loss: 0.5591, test_loss: 1.2835, test_f1: 0.5752
 epoch: 34, train_loss: 0.5776, test_loss: 1.1292, test_f1: 0.6018
 epoch: 35, train_loss: 0.5649, test_loss: 1.0394, test_f1: 0.6278
 epoch: 36, train_loss: 0.5545, test_loss: 1.2473, test_f1: 0.5822
 epoch: 37, train_loss: 0.5739, test_loss: 1.3576, test_f1: 0.5635
 epoch: 38, train_loss: 0.6075, test_loss: 1.3503, test_f1: 0.5815
 epoch: 39, train_loss: 0.5593, test_loss: 1.2466, test_f1: 0.5987
 epoch: 40, train_loss: 0.5585, test_loss: 1.2801, test_f1: 0.5968
 epoch: 41, train_loss: 0.5634, test_loss: 1.2208, test_f1: 0.5495
 epoch: 42, train_loss: 0.5368, test_loss: 1.2404, test_f1: 0.5908
 epoch: 43, train_loss: 0.5440, test_loss: 1.2895, test_f1: 0.6054
 epoch: 44, train_loss: 0.5775, test_loss: 1.2445, test_f1: 0.5732
 epoch: 45, train_loss: 0.5252, test_loss: 1.2631, test_f1: 0.5581
 epoch: 46, train_loss: 0.5249, test_loss: 1.3438, test_f1: 0.5966
 epoch: 47, train_loss: 0.4989, test_loss: 1.2488, test_f1: 0.6068
 epoch: 48, train_loss: 0.4788, test_loss: 1.3453, test_f1: 0.5961
 epoch: 49, train_loss: 0.4786, test_loss: 1.4196, test_f1: 0.5943
 epoch: 50, train_loss: 0.4674, test_loss: 1.3148, test_f1: 0.6294
 epoch: 51, train_loss: 0.4476, test_loss: 1.3835, test_f1: 0.6393
 epoch: 52, train_loss: 0.4206, test_loss: 1.4330, test_f1: 0.6208
 epoch: 53, train_loss: 0.4211, test_loss: 1.4546, test_f1: 0.5642
 epoch: 54, train_loss: 0.4064, test_loss: 1.4588, test_f1: 0.5659
 epoch: 55, train_loss: 0.4012, test_loss: 1.4556, test_f1: 0.5746
 epoch: 56, train_loss: 0.3879, test_loss: 1.4862, test_f1: 0.5771
 epoch: 57, train_loss: 0.3990, test_loss: 1.5466, test_f1: 0.5589
 epoch: 58, train_loss: 0.3938, test_loss: 1.6481, test_f1: 0.5513
 epoch: 59, train_loss: 0.3903, test_loss: 1.5428, test_f1: 0.5796
 epoch: 60, train_loss: 0.3959, test_loss: 1.5121, test_f1: 0.5420
 epoch: 61, train_loss: 0.3753, test_loss: 1.5412, test_f1: 0.5844
 epoch: 62, train_loss: 0.3680, test_loss: 1.6089, test_f1: 0.5834
 epoch: 63, train_loss: 0.3863, test_loss: 1.5265, test_f1: 0.5929
 epoch: 64, train_loss: 0.3743, test_loss: 1.4630, test_f1: 0.5724
 epoch: 65, train_loss: 0.3891, test_loss: 1.6257, test_f1: 0.5669
 epoch: 66, train_loss: 0.3903, test_loss: 1.5499, test_f1: 0.5902
 epoch: 67, train_loss: 0.3821, test_loss: 1.7053, test_f1: 0.5758
 epoch: 68, train_loss: 0.3823, test_loss: 1.5573, test_f1: 0.5842
 epoch: 69, train_loss: 0.3656, test_loss: 1.4114, test_f1: 0.6038
 epoch: 70, train_loss: 0.3574, test_loss: 1.6242, test_f1: 0.6224
 epoch: 71, train_loss: 0.3697, test_loss: 1.6935, test_f1: 0.6074
 epoch: 72, train_loss: 0.3552, test_loss: 1.6321, test_f1: 0.5871
 epoch: 73, train_loss: 0.3524, test_loss: 1.5845, test_f1: 0.6141
 epoch: 74, train_loss: 0.3647, test_loss: 1.6976, test_f1: 0.5668
 epoch: 75, train_loss: 0.3405, test_loss: 1.7661, test_f1: 0.5993
 epoch: 76, train_loss: 0.3576, test_loss: 1.6555, test_f1: 0.6071
 epoch: 77, train_loss: 0.3532, test_loss: 1.6385, test_f1: 0.5815
 epoch: 78, train_loss: 0.3452, test_loss: 1.5791, test_f1: 0.5757
 epoch: 79, train_loss: 0.3826, test_loss: 1.5977, test_f1: 0.6117
 epoch: 80, train_loss: 0.3660, test_loss: 1.9452, test_f1: 0.5583
 epoch: 81, train_loss: 0.3612, test_loss: 1.8209, test_f1: 0.5466
 epoch: 82, train_loss: 0.3792, test_loss: 1.6527, test_f1: 0.5657
 epoch: 83, train_loss: 0.3310, test_loss: 1.6138, test_f1: 0.6289
 epoch: 84, train_loss: 0.3490, test_loss: 1.6870, test_f1: 0.6131
 epoch: 85, train_loss: 0.3513, test_loss: 1.7843, test_f1: 0.5954
 epoch: 86, train_loss: 0.3288, test_loss: 1.6854, test_f1: 0.5995
 epoch: 87, train_loss: 0.3042, test_loss: 1.6798, test_f1: 0.5903
 epoch: 88, train_loss: 0.2964, test_loss: 1.8270, test_f1: 0.6041
 epoch: 89, train_loss: 0.2957, test_loss: 1.7904, test_f1: 0.6098
 epoch: 90, train_loss: 0.3065, test_loss: 1.6503, test_f1: 0.6205
 epoch: 91, train_loss: 0.3172, test_loss: 1.7187, test_f1: 0.5960
 epoch: 92, train_loss: 0.3364, test_loss: 1.7581, test_f1: 0.6042
 epoch: 93, train_loss: 0.3036, test_loss: 1.8313, test_f1: 0.6111
 epoch: 94, train_loss: 0.2872, test_loss: 1.8070, test_f1: 0.6348
 epoch: 95, train_loss: 0.2852, test_loss: 1.7718, test_f1: 0.6381
 epoch: 96, train_loss: 0.2895, test_loss: 1.8794, test_f1: 0.6020
 epoch: 97, train_loss: 0.2901, test_loss: 1.9235, test_f1: 0.5631
 epoch: 98, train_loss: 0.2945, test_loss: 1.9998, test_f1: 0.5686
 epoch: 99, train_loss: 0.2785, test_loss: 1.9287, test_f1: 0.5959

Training completed in 337.74 seconds
Best F1: 0.6641 at epoch 92
Mean F1 across iterations: 0.6402  0.0135
========================FINAL RESULTS================================
FEGIN weighted F1: 0.6641  0.0135
python main.py --data ltspice_demos --representation component_pin --model FEGIN --layers 6 --hiddens 64 --batch_size 256 --lr 0.001 --emb_size 128 --epochs 100 --save_appendix component_pin_L6_H64_BS256_LR0.001_E128 --no_val
-----



STDERR:
  File "main.py", line 370, in <module>
    main()
  File "main.py", line 254, in main
    dataset = dataset_class(
  File "/home/philip/projects/ltspice_examples_code_repo/Circuit-Completion-Using-GNNs/component_classification_with_link_prediction_head/evaluation/FEGIN/kernel/circuit_datasets.py", line 15, in __init__
    self.data, self.slices = torch.load(self.processed_paths[0])
  File "/home/philip/.local/lib/python3.8/site-packages/torch/serialization.py", line 1040, in load
    warnings.warn(
  File "/usr/lib/python3.8/warnings.py", line 109, in _showwarnmsg
    sw(msg.message, msg.category, msg.filename, msg.lineno,
  File "main.py", line 47, in warn_with_traceback
    traceback.print_stack(file=log)
/home/philip/projects/ltspice_examples_code_repo/Circuit-Completion-Using-GNNs/component_classification_with_link_prediction_head/evaluation/FEGIN/kernel/circuit_datasets.py:15: FutureWarning: You are using `torch.load` with `weights_only=False` (the current default value), which uses the default pickle module implicitly. It is possible to construct malicious pickle data which will execute arbitrary code during unpickling (See https://github.com/pytorch/pytorch/blob/main/SECURITY.md#untrusted-models for more details). In a future release, the default value for `weights_only` will be flipped to `True`. This limits the functions that could be executed during unpickling. Arbitrary objects will no longer be allowed to be loaded via this mode unless they are explicitly allowlisted by the user via `torch.serialization.add_safe_globals`. We recommend you start setting `weights_only=True` for any use case where you don't have full control of the loaded file. Please open an issue on GitHub for any issues related to this experimental feature.
  self.data, self.slices = torch.load(self.processed_paths[0])
