STDOUT:
Results will be saved in /home/philip/projects/ltspice_examples_code_repo/Circuit-Completion-Using-GNNs/component_classification_with_link_prediction_head/evaluation/FEGIN/results/model_FEGIN_dataset_ltspice_examples
Command line input: python main.py --data ltspice_examples --representation component_net --model FEGIN --layers 5 --hiddens 128 --batch_size 64 --lr 0.0001 --emb_size 128 --epochs 100 --save_appendix component_net_L5_H128_BS64_LR0.0001_E128 --no_val
 is saved.
-----
ltspice_examples - FEGIN
Using 5 layers, 128 hidden units, h = 2
Loading component_net representation dataset
ENTERED
Training FEGIN on component_net representation
Train: 3558, Test: 846
##################ITERATION #0 ****************************************
 epoch: 0, train_loss: 1.3413, test_loss: 1.3238, test_f1: 0.2270
 epoch: 1, train_loss: 1.2626, test_loss: 1.2350, test_f1: 0.2295
 epoch: 2, train_loss: 1.2202, test_loss: 1.1800, test_f1: 0.3027
 epoch: 3, train_loss: 1.1767, test_loss: 1.1391, test_f1: 0.3815
 epoch: 4, train_loss: 1.1311, test_loss: 1.0810, test_f1: 0.4972
 epoch: 5, train_loss: 1.0831, test_loss: 1.0300, test_f1: 0.5304
 epoch: 6, train_loss: 1.0347, test_loss: 0.9836, test_f1: 0.5244
 epoch: 7, train_loss: 0.9897, test_loss: 0.9481, test_f1: 0.5135
 epoch: 8, train_loss: 0.9476, test_loss: 0.9218, test_f1: 0.5183
 epoch: 9, train_loss: 0.9334, test_loss: 0.9444, test_f1: 0.5187
 epoch: 10, train_loss: 0.9029, test_loss: 0.9155, test_f1: 0.5116
 epoch: 11, train_loss: 0.8878, test_loss: 0.9143, test_f1: 0.5121
 epoch: 12, train_loss: 0.8780, test_loss: 0.9119, test_f1: 0.5493
 epoch: 13, train_loss: 0.8590, test_loss: 0.9200, test_f1: 0.5452
 epoch: 14, train_loss: 0.8534, test_loss: 0.9245, test_f1: 0.5554
 epoch: 15, train_loss: 0.8418, test_loss: 0.9223, test_f1: 0.5313
 epoch: 16, train_loss: 0.8339, test_loss: 0.9239, test_f1: 0.5300
 epoch: 17, train_loss: 0.8193, test_loss: 0.9271, test_f1: 0.5241
 epoch: 18, train_loss: 0.8164, test_loss: 0.9255, test_f1: 0.5442
 epoch: 19, train_loss: 0.8134, test_loss: 0.9292, test_f1: 0.5182
 epoch: 20, train_loss: 0.8029, test_loss: 0.9173, test_f1: 0.5356
 epoch: 21, train_loss: 0.8003, test_loss: 0.9179, test_f1: 0.5617
 epoch: 22, train_loss: 0.7861, test_loss: 0.9312, test_f1: 0.5720
 epoch: 23, train_loss: 0.7835, test_loss: 0.9491, test_f1: 0.5330
 epoch: 24, train_loss: 0.7771, test_loss: 0.9226, test_f1: 0.5736
 epoch: 25, train_loss: 0.7640, test_loss: 0.9339, test_f1: 0.5729
 epoch: 26, train_loss: 0.7590, test_loss: 0.9528, test_f1: 0.5560
 epoch: 27, train_loss: 0.7568, test_loss: 0.9279, test_f1: 0.5909
 epoch: 28, train_loss: 0.7400, test_loss: 0.9451, test_f1: 0.5852
 epoch: 29, train_loss: 0.7417, test_loss: 0.9828, test_f1: 0.5775
 epoch: 30, train_loss: 0.7395, test_loss: 0.9298, test_f1: 0.5887
 epoch: 31, train_loss: 0.7229, test_loss: 0.9300, test_f1: 0.5646
 epoch: 32, train_loss: 0.7234, test_loss: 0.9526, test_f1: 0.5622
 epoch: 33, train_loss: 0.7215, test_loss: 0.9489, test_f1: 0.5806
 epoch: 34, train_loss: 0.7070, test_loss: 0.9661, test_f1: 0.5908
 epoch: 35, train_loss: 0.7156, test_loss: 0.9410, test_f1: 0.5936
 epoch: 36, train_loss: 0.7036, test_loss: 0.9279, test_f1: 0.5824
 epoch: 37, train_loss: 0.6926, test_loss: 0.9375, test_f1: 0.5784
 epoch: 38, train_loss: 0.6921, test_loss: 0.9271, test_f1: 0.5723
 epoch: 39, train_loss: 0.6862, test_loss: 0.9547, test_f1: 0.5825
 epoch: 40, train_loss: 0.6830, test_loss: 0.9409, test_f1: 0.5916
 epoch: 41, train_loss: 0.6704, test_loss: 0.9423, test_f1: 0.5812
 epoch: 42, train_loss: 0.6656, test_loss: 0.9752, test_f1: 0.6172
 epoch: 43, train_loss: 0.6511, test_loss: 0.9308, test_f1: 0.5679
 epoch: 44, train_loss: 0.6589, test_loss: 0.9652, test_f1: 0.6020
 epoch: 45, train_loss: 0.6463, test_loss: 0.9246, test_f1: 0.6190
 epoch: 46, train_loss: 0.6524, test_loss: 0.9559, test_f1: 0.5931
 epoch: 47, train_loss: 0.6353, test_loss: 0.9256, test_f1: 0.6176
 epoch: 48, train_loss: 0.6275, test_loss: 0.9950, test_f1: 0.5838
 epoch: 49, train_loss: 0.6438, test_loss: 0.9501, test_f1: 0.6049
 epoch: 50, train_loss: 0.6181, test_loss: 0.9562, test_f1: 0.6155
 epoch: 51, train_loss: 0.6207, test_loss: 0.9571, test_f1: 0.6305
 epoch: 52, train_loss: 0.5949, test_loss: 0.9402, test_f1: 0.6136
 epoch: 53, train_loss: 0.5916, test_loss: 0.9363, test_f1: 0.6250
 epoch: 54, train_loss: 0.5825, test_loss: 0.9579, test_f1: 0.6066
 epoch: 55, train_loss: 0.5841, test_loss: 0.9688, test_f1: 0.6142
 epoch: 56, train_loss: 0.5765, test_loss: 0.9553, test_f1: 0.6321
 epoch: 57, train_loss: 0.5778, test_loss: 0.9684, test_f1: 0.6323
 epoch: 58, train_loss: 0.5689, test_loss: 0.9519, test_f1: 0.6365
 epoch: 59, train_loss: 0.5744, test_loss: 0.9838, test_f1: 0.6299
 epoch: 60, train_loss: 0.5758, test_loss: 0.9686, test_f1: 0.6434
 epoch: 61, train_loss: 0.5616, test_loss: 0.9691, test_f1: 0.6430
 epoch: 62, train_loss: 0.5530, test_loss: 0.9657, test_f1: 0.6511
 epoch: 63, train_loss: 0.5523, test_loss: 0.9516, test_f1: 0.6490
 epoch: 64, train_loss: 0.5599, test_loss: 0.9748, test_f1: 0.6275
 epoch: 65, train_loss: 0.5622, test_loss: 0.9836, test_f1: 0.6267
 epoch: 66, train_loss: 0.5552, test_loss: 0.9886, test_f1: 0.6264
 epoch: 67, train_loss: 0.5443, test_loss: 0.9789, test_f1: 0.6256
 epoch: 68, train_loss: 0.5437, test_loss: 0.9880, test_f1: 0.6340
 epoch: 69, train_loss: 0.5369, test_loss: 0.9795, test_f1: 0.6411
 epoch: 70, train_loss: 0.5316, test_loss: 1.0102, test_f1: 0.6441
 epoch: 71, train_loss: 0.5367, test_loss: 1.0027, test_f1: 0.6502
 epoch: 72, train_loss: 0.5252, test_loss: 0.9935, test_f1: 0.6375
 epoch: 73, train_loss: 0.5316, test_loss: 0.9822, test_f1: 0.6382
 epoch: 74, train_loss: 0.5389, test_loss: 0.9997, test_f1: 0.6320
 epoch: 75, train_loss: 0.5188, test_loss: 1.0055, test_f1: 0.6340
 epoch: 76, train_loss: 0.5150, test_loss: 0.9925, test_f1: 0.6416
 epoch: 77, train_loss: 0.5193, test_loss: 1.0100, test_f1: 0.6356
 epoch: 78, train_loss: 0.5179, test_loss: 1.0375, test_f1: 0.6519
 epoch: 79, train_loss: 0.5110, test_loss: 1.0295, test_f1: 0.6465
 epoch: 80, train_loss: 0.5279, test_loss: 1.0391, test_f1: 0.6439
 epoch: 81, train_loss: 0.5075, test_loss: 1.0177, test_f1: 0.6362
 epoch: 82, train_loss: 0.5009, test_loss: 1.0095, test_f1: 0.6469
 epoch: 83, train_loss: 0.4994, test_loss: 1.0523, test_f1: 0.6489
 epoch: 84, train_loss: 0.4962, test_loss: 1.0800, test_f1: 0.6398
 epoch: 85, train_loss: 0.5108, test_loss: 1.0098, test_f1: 0.6466
 epoch: 86, train_loss: 0.5092, test_loss: 1.0479, test_f1: 0.6418
 epoch: 87, train_loss: 0.4941, test_loss: 1.0453, test_f1: 0.6423
 epoch: 88, train_loss: 0.4997, test_loss: 1.0124, test_f1: 0.6454
 epoch: 89, train_loss: 0.4968, test_loss: 1.0174, test_f1: 0.6632
 epoch: 90, train_loss: 0.4954, test_loss: 1.0655, test_f1: 0.6361
 epoch: 91, train_loss: 0.4853, test_loss: 1.0526, test_f1: 0.6380
 epoch: 92, train_loss: 0.4822, test_loss: 1.0767, test_f1: 0.6321
 epoch: 93, train_loss: 0.4746, test_loss: 1.0879, test_f1: 0.6308
 epoch: 94, train_loss: 0.4853, test_loss: 1.1043, test_f1: 0.6372
 epoch: 95, train_loss: 0.4718, test_loss: 1.0428, test_f1: 0.6587
 epoch: 96, train_loss: 0.4601, test_loss: 1.0521, test_f1: 0.6606
 epoch: 97, train_loss: 0.4673, test_loss: 1.0731, test_f1: 0.6566
 epoch: 98, train_loss: 0.4675, test_loss: 1.0607, test_f1: 0.6579
 epoch: 99, train_loss: 0.4648, test_loss: 1.0539, test_f1: 0.6572
##################ITERATION #1 ****************************************
 epoch: 0, train_loss: 1.2403, test_loss: 1.2263, test_f1: 0.3834
 epoch: 1, train_loss: 1.1281, test_loss: 1.0611, test_f1: 0.4545
 epoch: 2, train_loss: 1.0770, test_loss: 1.0073, test_f1: 0.4870
 epoch: 3, train_loss: 1.0288, test_loss: 0.9621, test_f1: 0.4920
 epoch: 4, train_loss: 0.9884, test_loss: 0.9547, test_f1: 0.4940
 epoch: 5, train_loss: 0.9618, test_loss: 0.9102, test_f1: 0.5047
 epoch: 6, train_loss: 0.9420, test_loss: 0.9131, test_f1: 0.5071
 epoch: 7, train_loss: 0.9144, test_loss: 0.8889, test_f1: 0.5309
 epoch: 8, train_loss: 0.9036, test_loss: 0.9098, test_f1: 0.5242
 epoch: 9, train_loss: 0.8846, test_loss: 0.8813, test_f1: 0.5370
 epoch: 10, train_loss: 0.8733, test_loss: 0.8847, test_f1: 0.5249
 epoch: 11, train_loss: 0.8605, test_loss: 0.9100, test_f1: 0.5331
 epoch: 12, train_loss: 0.8543, test_loss: 0.9360, test_f1: 0.5289
 epoch: 13, train_loss: 0.8372, test_loss: 0.8948, test_f1: 0.5291
 epoch: 14, train_loss: 0.8244, test_loss: 0.9041, test_f1: 0.5310
 epoch: 15, train_loss: 0.8221, test_loss: 0.8938, test_f1: 0.5559
 epoch: 16, train_loss: 0.7981, test_loss: 0.8601, test_f1: 0.5711
 epoch: 17, train_loss: 0.8007, test_loss: 0.9192, test_f1: 0.5772
 epoch: 18, train_loss: 0.7854, test_loss: 0.9049, test_f1: 0.5784
 epoch: 19, train_loss: 0.7829, test_loss: 0.9238, test_f1: 0.5647
 epoch: 20, train_loss: 0.7709, test_loss: 0.9238, test_f1: 0.5874
 epoch: 21, train_loss: 0.7698, test_loss: 0.9241, test_f1: 0.5847
 epoch: 22, train_loss: 0.7460, test_loss: 0.8912, test_f1: 0.5722
 epoch: 23, train_loss: 0.7488, test_loss: 0.8798, test_f1: 0.5863
 epoch: 24, train_loss: 0.7397, test_loss: 0.9047, test_f1: 0.5867
 epoch: 25, train_loss: 0.7228, test_loss: 0.9212, test_f1: 0.5930
 epoch: 26, train_loss: 0.7287, test_loss: 0.9082, test_f1: 0.5844
 epoch: 27, train_loss: 0.7274, test_loss: 0.8820, test_f1: 0.5877
 epoch: 28, train_loss: 0.7232, test_loss: 0.9087, test_f1: 0.6102
 epoch: 29, train_loss: 0.7073, test_loss: 0.9366, test_f1: 0.5992
 epoch: 30, train_loss: 0.7005, test_loss: 0.8959, test_f1: 0.6247
 epoch: 31, train_loss: 0.6968, test_loss: 0.9214, test_f1: 0.5943
 epoch: 32, train_loss: 0.7014, test_loss: 0.8948, test_f1: 0.6202
 epoch: 33, train_loss: 0.6818, test_loss: 0.9292, test_f1: 0.6109
 epoch: 34, train_loss: 0.6899, test_loss: 0.9421, test_f1: 0.6165
 epoch: 35, train_loss: 0.6673, test_loss: 0.9171, test_f1: 0.6258
 epoch: 36, train_loss: 0.6680, test_loss: 0.8992, test_f1: 0.6221
 epoch: 37, train_loss: 0.6538, test_loss: 0.9307, test_f1: 0.6323
 epoch: 38, train_loss: 0.6484, test_loss: 0.9117, test_f1: 0.6422
 epoch: 39, train_loss: 0.6513, test_loss: 0.9237, test_f1: 0.6042
 epoch: 40, train_loss: 0.6418, test_loss: 0.9019, test_f1: 0.6253
 epoch: 41, train_loss: 0.6426, test_loss: 0.9834, test_f1: 0.6275
 epoch: 42, train_loss: 0.6396, test_loss: 0.8866, test_f1: 0.6439
 epoch: 43, train_loss: 0.6276, test_loss: 0.9457, test_f1: 0.6399
 epoch: 44, train_loss: 0.6221, test_loss: 0.9297, test_f1: 0.6266
 epoch: 45, train_loss: 0.6135, test_loss: 0.9054, test_f1: 0.6460
 epoch: 46, train_loss: 0.5998, test_loss: 0.9285, test_f1: 0.6356
 epoch: 47, train_loss: 0.6034, test_loss: 0.9086, test_f1: 0.6272
 epoch: 48, train_loss: 0.6005, test_loss: 0.9401, test_f1: 0.6267
 epoch: 49, train_loss: 0.5918, test_loss: 0.9759, test_f1: 0.6230
 epoch: 50, train_loss: 0.5887, test_loss: 0.9602, test_f1: 0.6353
 epoch: 51, train_loss: 0.5747, test_loss: 0.9428, test_f1: 0.6191
 epoch: 52, train_loss: 0.5810, test_loss: 0.9860, test_f1: 0.6215
 epoch: 53, train_loss: 0.5497, test_loss: 0.9341, test_f1: 0.6273
 epoch: 54, train_loss: 0.5489, test_loss: 0.9353, test_f1: 0.6257
 epoch: 55, train_loss: 0.5360, test_loss: 0.9799, test_f1: 0.6321
 epoch: 56, train_loss: 0.5389, test_loss: 0.9583, test_f1: 0.6125
 epoch: 57, train_loss: 0.5566, test_loss: 0.9672, test_f1: 0.6382
 epoch: 58, train_loss: 0.5412, test_loss: 0.9928, test_f1: 0.6274
 epoch: 59, train_loss: 0.5333, test_loss: 0.9806, test_f1: 0.6302
 epoch: 60, train_loss: 0.5217, test_loss: 0.9668, test_f1: 0.6180
 epoch: 61, train_loss: 0.5248, test_loss: 0.9988, test_f1: 0.6238
 epoch: 62, train_loss: 0.5209, test_loss: 0.9957, test_f1: 0.6522
 epoch: 63, train_loss: 0.5168, test_loss: 0.9875, test_f1: 0.6390
 epoch: 64, train_loss: 0.5182, test_loss: 0.9786, test_f1: 0.6447
 epoch: 65, train_loss: 0.5071, test_loss: 0.9822, test_f1: 0.6358
 epoch: 66, train_loss: 0.5197, test_loss: 1.0130, test_f1: 0.6215
 epoch: 67, train_loss: 0.4973, test_loss: 1.0133, test_f1: 0.6506
 epoch: 68, train_loss: 0.5088, test_loss: 1.0315, test_f1: 0.6480
 epoch: 69, train_loss: 0.5132, test_loss: 1.0162, test_f1: 0.6416
 epoch: 70, train_loss: 0.5019, test_loss: 1.0012, test_f1: 0.6475
 epoch: 71, train_loss: 0.5023, test_loss: 1.0083, test_f1: 0.6442
 epoch: 72, train_loss: 0.5008, test_loss: 1.0389, test_f1: 0.6320
 epoch: 73, train_loss: 0.4899, test_loss: 1.0730, test_f1: 0.6436
 epoch: 74, train_loss: 0.4866, test_loss: 1.0482, test_f1: 0.6464
 epoch: 75, train_loss: 0.4747, test_loss: 1.0547, test_f1: 0.6488
 epoch: 76, train_loss: 0.4887, test_loss: 1.0433, test_f1: 0.6387
 epoch: 77, train_loss: 0.4778, test_loss: 1.0899, test_f1: 0.6323
 epoch: 78, train_loss: 0.4751, test_loss: 1.0714, test_f1: 0.6390
 epoch: 79, train_loss: 0.4612, test_loss: 1.0664, test_f1: 0.6253
 epoch: 80, train_loss: 0.4660, test_loss: 1.0642, test_f1: 0.6397
 epoch: 81, train_loss: 0.4633, test_loss: 1.0831, test_f1: 0.6375
 epoch: 82, train_loss: 0.4737, test_loss: 1.0773, test_f1: 0.6695
 epoch: 83, train_loss: 0.4625, test_loss: 1.0840, test_f1: 0.6702
 epoch: 84, train_loss: 0.4662, test_loss: 1.0636, test_f1: 0.6345
 epoch: 85, train_loss: 0.4519, test_loss: 1.0597, test_f1: 0.6400
 epoch: 86, train_loss: 0.4504, test_loss: 1.0919, test_f1: 0.6227
 epoch: 87, train_loss: 0.4525, test_loss: 1.1341, test_f1: 0.6272
 epoch: 88, train_loss: 0.4540, test_loss: 1.1292, test_f1: 0.6398
 epoch: 89, train_loss: 0.4445, test_loss: 1.0800, test_f1: 0.6524
 epoch: 90, train_loss: 0.4459, test_loss: 1.1034, test_f1: 0.6325
 epoch: 91, train_loss: 0.4502, test_loss: 1.1168, test_f1: 0.6378
 epoch: 92, train_loss: 0.4497, test_loss: 1.1267, test_f1: 0.6391
 epoch: 93, train_loss: 0.4302, test_loss: 1.1549, test_f1: 0.6127
 epoch: 94, train_loss: 0.4608, test_loss: 1.1171, test_f1: 0.6414
 epoch: 95, train_loss: 0.4474, test_loss: 1.1325, test_f1: 0.6230
 epoch: 96, train_loss: 0.4377, test_loss: 1.1528, test_f1: 0.6394
 epoch: 97, train_loss: 0.4315, test_loss: 1.1310, test_f1: 0.6611
 epoch: 98, train_loss: 0.4295, test_loss: 1.1337, test_f1: 0.6404
 epoch: 99, train_loss: 0.4276, test_loss: 1.1785, test_f1: 0.6567
##################ITERATION #2 ****************************************
 epoch: 0, train_loss: 1.2215, test_loss: 1.1962, test_f1: 0.3749
 epoch: 1, train_loss: 1.1101, test_loss: 1.0519, test_f1: 0.4549
 epoch: 2, train_loss: 1.0576, test_loss: 0.9964, test_f1: 0.4987
 epoch: 3, train_loss: 1.0225, test_loss: 0.9548, test_f1: 0.4868
 epoch: 4, train_loss: 0.9952, test_loss: 0.9340, test_f1: 0.4871
 epoch: 5, train_loss: 0.9714, test_loss: 0.9432, test_f1: 0.5208
 epoch: 6, train_loss: 0.9450, test_loss: 0.9233, test_f1: 0.4982
 epoch: 7, train_loss: 0.9294, test_loss: 0.9134, test_f1: 0.4968
 epoch: 8, train_loss: 0.9135, test_loss: 0.9032, test_f1: 0.5242
 epoch: 9, train_loss: 0.9071, test_loss: 0.9140, test_f1: 0.5407
 epoch: 10, train_loss: 0.8898, test_loss: 0.8984, test_f1: 0.5330
 epoch: 11, train_loss: 0.8687, test_loss: 0.9031, test_f1: 0.5479
 epoch: 12, train_loss: 0.8700, test_loss: 0.8798, test_f1: 0.5553
 epoch: 13, train_loss: 0.8598, test_loss: 0.9004, test_f1: 0.5816
 epoch: 14, train_loss: 0.8471, test_loss: 0.8983, test_f1: 0.5754
 epoch: 15, train_loss: 0.8384, test_loss: 0.9135, test_f1: 0.5616
 epoch: 16, train_loss: 0.8214, test_loss: 0.8874, test_f1: 0.5903
 epoch: 17, train_loss: 0.8136, test_loss: 0.9043, test_f1: 0.5666
 epoch: 18, train_loss: 0.8070, test_loss: 0.8968, test_f1: 0.5586
 epoch: 19, train_loss: 0.7980, test_loss: 0.8852, test_f1: 0.5932
 epoch: 20, train_loss: 0.7992, test_loss: 0.8383, test_f1: 0.5904
 epoch: 21, train_loss: 0.7842, test_loss: 0.9035, test_f1: 0.5959
 epoch: 22, train_loss: 0.7744, test_loss: 0.8736, test_f1: 0.5919
 epoch: 23, train_loss: 0.7726, test_loss: 0.8855, test_f1: 0.6042
 epoch: 24, train_loss: 0.7531, test_loss: 0.8619, test_f1: 0.5991
 epoch: 25, train_loss: 0.7544, test_loss: 0.9688, test_f1: 0.5989
 epoch: 26, train_loss: 0.7530, test_loss: 0.8807, test_f1: 0.6080
 epoch: 27, train_loss: 0.7379, test_loss: 0.9252, test_f1: 0.5942
 epoch: 28, train_loss: 0.7426, test_loss: 0.9050, test_f1: 0.5740
 epoch: 29, train_loss: 0.7252, test_loss: 0.8614, test_f1: 0.6189
 epoch: 30, train_loss: 0.7222, test_loss: 0.9085, test_f1: 0.6128
 epoch: 31, train_loss: 0.7124, test_loss: 0.9520, test_f1: 0.5964
 epoch: 32, train_loss: 0.7224, test_loss: 0.8956, test_f1: 0.6081
 epoch: 33, train_loss: 0.7030, test_loss: 0.8555, test_f1: 0.6222
 epoch: 34, train_loss: 0.6967, test_loss: 0.8831, test_f1: 0.6371
 epoch: 35, train_loss: 0.6934, test_loss: 0.9158, test_f1: 0.6007
 epoch: 36, train_loss: 0.6994, test_loss: 0.8840, test_f1: 0.6234
 epoch: 37, train_loss: 0.6774, test_loss: 0.8850, test_f1: 0.6226
 epoch: 38, train_loss: 0.6783, test_loss: 0.9143, test_f1: 0.6283
 epoch: 39, train_loss: 0.6735, test_loss: 0.8938, test_f1: 0.6248
 epoch: 40, train_loss: 0.6605, test_loss: 0.8767, test_f1: 0.6067
 epoch: 41, train_loss: 0.6552, test_loss: 0.8361, test_f1: 0.6215
 epoch: 42, train_loss: 0.6545, test_loss: 0.9375, test_f1: 0.6088
 epoch: 43, train_loss: 0.6387, test_loss: 0.8598, test_f1: 0.6411
 epoch: 44, train_loss: 0.6360, test_loss: 0.9354, test_f1: 0.6112
 epoch: 45, train_loss: 0.6337, test_loss: 0.9158, test_f1: 0.6437
 epoch: 46, train_loss: 0.6266, test_loss: 0.9381, test_f1: 0.6427
 epoch: 47, train_loss: 0.6164, test_loss: 0.9429, test_f1: 0.6223
 epoch: 48, train_loss: 0.6120, test_loss: 0.9681, test_f1: 0.6270
 epoch: 49, train_loss: 0.6088, test_loss: 0.9362, test_f1: 0.6426
 epoch: 50, train_loss: 0.6098, test_loss: 0.8713, test_f1: 0.6210
 epoch: 51, train_loss: 0.5888, test_loss: 0.9185, test_f1: 0.6320
 epoch: 52, train_loss: 0.5739, test_loss: 0.9130, test_f1: 0.6671
 epoch: 53, train_loss: 0.5762, test_loss: 0.9561, test_f1: 0.6648
 epoch: 54, train_loss: 0.5752, test_loss: 0.9341, test_f1: 0.6700
 epoch: 55, train_loss: 0.5748, test_loss: 0.9183, test_f1: 0.6585
 epoch: 56, train_loss: 0.5672, test_loss: 0.9598, test_f1: 0.6328
 epoch: 57, train_loss: 0.5679, test_loss: 0.9827, test_f1: 0.6531
 epoch: 58, train_loss: 0.5603, test_loss: 0.9820, test_f1: 0.6384
 epoch: 59, train_loss: 0.5590, test_loss: 0.9674, test_f1: 0.6384
 epoch: 60, train_loss: 0.5588, test_loss: 0.9221, test_f1: 0.6528
 epoch: 61, train_loss: 0.5412, test_loss: 0.9405, test_f1: 0.6595
 epoch: 62, train_loss: 0.5477, test_loss: 0.9732, test_f1: 0.6574
 epoch: 63, train_loss: 0.5379, test_loss: 0.9718, test_f1: 0.6550
 epoch: 64, train_loss: 0.5229, test_loss: 0.9613, test_f1: 0.6445
 epoch: 65, train_loss: 0.5450, test_loss: 0.9702, test_f1: 0.6518
 epoch: 66, train_loss: 0.5317, test_loss: 0.9752, test_f1: 0.6421
 epoch: 67, train_loss: 0.5301, test_loss: 0.9707, test_f1: 0.6418
 epoch: 68, train_loss: 0.5212, test_loss: 0.9621, test_f1: 0.6650
 epoch: 69, train_loss: 0.5222, test_loss: 1.0040, test_f1: 0.6278
 epoch: 70, train_loss: 0.5132, test_loss: 0.9449, test_f1: 0.6489
 epoch: 71, train_loss: 0.5176, test_loss: 1.0120, test_f1: 0.6705
 epoch: 72, train_loss: 0.5153, test_loss: 0.9833, test_f1: 0.6532
 epoch: 73, train_loss: 0.5144, test_loss: 0.9847, test_f1: 0.6773
 epoch: 74, train_loss: 0.5177, test_loss: 0.9859, test_f1: 0.6458
 epoch: 75, train_loss: 0.5013, test_loss: 1.0427, test_f1: 0.6368
 epoch: 76, train_loss: 0.4950, test_loss: 1.0031, test_f1: 0.6525
 epoch: 77, train_loss: 0.4972, test_loss: 1.0244, test_f1: 0.6733
 epoch: 78, train_loss: 0.4977, test_loss: 0.9819, test_f1: 0.6679
 epoch: 79, train_loss: 0.5086, test_loss: 1.0207, test_f1: 0.6561
 epoch: 80, train_loss: 0.4940, test_loss: 1.0284, test_f1: 0.6453
 epoch: 81, train_loss: 0.4902, test_loss: 1.0145, test_f1: 0.6583
 epoch: 82, train_loss: 0.4843, test_loss: 1.0046, test_f1: 0.6540
 epoch: 83, train_loss: 0.4874, test_loss: 1.0380, test_f1: 0.6441
 epoch: 84, train_loss: 0.4755, test_loss: 1.0516, test_f1: 0.6556
 epoch: 85, train_loss: 0.4894, test_loss: 1.0544, test_f1: 0.6612
 epoch: 86, train_loss: 0.4698, test_loss: 1.0464, test_f1: 0.6514
 epoch: 87, train_loss: 0.4796, test_loss: 1.0816, test_f1: 0.6332
 epoch: 88, train_loss: 0.4821, test_loss: 1.0620, test_f1: 0.6113
 epoch: 89, train_loss: 0.4811, test_loss: 1.0919, test_f1: 0.6401
 epoch: 90, train_loss: 0.4746, test_loss: 1.0813, test_f1: 0.6477
 epoch: 91, train_loss: 0.4739, test_loss: 1.0451, test_f1: 0.6610
 epoch: 92, train_loss: 0.4690, test_loss: 1.1090, test_f1: 0.6301
 epoch: 93, train_loss: 0.4728, test_loss: 1.0995, test_f1: 0.6536
 epoch: 94, train_loss: 0.4594, test_loss: 1.1320, test_f1: 0.6387
 epoch: 95, train_loss: 0.4730, test_loss: 1.0814, test_f1: 0.6585
 epoch: 96, train_loss: 0.4674, test_loss: 1.1539, test_f1: 0.6329
 epoch: 97, train_loss: 0.4617, test_loss: 1.1331, test_f1: 0.6363
 epoch: 98, train_loss: 0.4542, test_loss: 1.1361, test_f1: 0.6433
 epoch: 99, train_loss: 0.4647, test_loss: 1.1101, test_f1: 0.6452
##################ITERATION #3 ****************************************
 epoch: 0, train_loss: 1.2025, test_loss: 1.1346, test_f1: 0.4802
 epoch: 1, train_loss: 1.0900, test_loss: 1.0221, test_f1: 0.4694
 epoch: 2, train_loss: 1.0431, test_loss: 0.9986, test_f1: 0.5000
 epoch: 3, train_loss: 1.0115, test_loss: 0.9680, test_f1: 0.5098
 epoch: 4, train_loss: 0.9851, test_loss: 0.9509, test_f1: 0.5212
 epoch: 5, train_loss: 0.9667, test_loss: 0.9376, test_f1: 0.5528
 epoch: 6, train_loss: 0.9342, test_loss: 0.9283, test_f1: 0.5442
 epoch: 7, train_loss: 0.9217, test_loss: 0.9262, test_f1: 0.5441
 epoch: 8, train_loss: 0.8958, test_loss: 0.9341, test_f1: 0.5341
 epoch: 9, train_loss: 0.8905, test_loss: 0.9168, test_f1: 0.5461
 epoch: 10, train_loss: 0.8791, test_loss: 0.9240, test_f1: 0.5584
 epoch: 11, train_loss: 0.8631, test_loss: 0.9027, test_f1: 0.5776
 epoch: 12, train_loss: 0.8639, test_loss: 0.9215, test_f1: 0.5491
 epoch: 13, train_loss: 0.8468, test_loss: 0.9130, test_f1: 0.5891
 epoch: 14, train_loss: 0.8381, test_loss: 0.9256, test_f1: 0.5772
 epoch: 15, train_loss: 0.8218, test_loss: 0.9164, test_f1: 0.5894
 epoch: 16, train_loss: 0.8150, test_loss: 0.9164, test_f1: 0.5717
 epoch: 17, train_loss: 0.7947, test_loss: 0.9316, test_f1: 0.5722
 epoch: 18, train_loss: 0.8054, test_loss: 0.9235, test_f1: 0.5792
 epoch: 19, train_loss: 0.7810, test_loss: 0.9372, test_f1: 0.5918
 epoch: 20, train_loss: 0.7799, test_loss: 0.9215, test_f1: 0.5869
 epoch: 21, train_loss: 0.7691, test_loss: 0.9149, test_f1: 0.5994
 epoch: 22, train_loss: 0.7719, test_loss: 0.8983, test_f1: 0.6043
 epoch: 23, train_loss: 0.7676, test_loss: 0.8978, test_f1: 0.5940
 epoch: 24, train_loss: 0.7473, test_loss: 0.9438, test_f1: 0.5859
 epoch: 25, train_loss: 0.7557, test_loss: 0.9462, test_f1: 0.5722
 epoch: 26, train_loss: 0.7323, test_loss: 0.9426, test_f1: 0.5993
 epoch: 27, train_loss: 0.7310, test_loss: 0.9383, test_f1: 0.6085
 epoch: 28, train_loss: 0.7312, test_loss: 0.9535, test_f1: 0.6063
 epoch: 29, train_loss: 0.7207, test_loss: 0.9492, test_f1: 0.5862
 epoch: 30, train_loss: 0.7045, test_loss: 0.9430, test_f1: 0.6121
 epoch: 31, train_loss: 0.7076, test_loss: 0.9075, test_f1: 0.6266
 epoch: 32, train_loss: 0.6998, test_loss: 0.9043, test_f1: 0.6218
 epoch: 33, train_loss: 0.6935, test_loss: 0.9184, test_f1: 0.6206
 epoch: 34, train_loss: 0.6837, test_loss: 0.9683, test_f1: 0.5884
 epoch: 35, train_loss: 0.6846, test_loss: 0.9215, test_f1: 0.6143
 epoch: 36, train_loss: 0.6750, test_loss: 0.9195, test_f1: 0.6298
 epoch: 37, train_loss: 0.6593, test_loss: 0.9650, test_f1: 0.6120
 epoch: 38, train_loss: 0.6725, test_loss: 0.9370, test_f1: 0.6183
 epoch: 39, train_loss: 0.6609, test_loss: 0.9347, test_f1: 0.6382
 epoch: 40, train_loss: 0.6436, test_loss: 0.9312, test_f1: 0.6368
 epoch: 41, train_loss: 0.6394, test_loss: 0.9522, test_f1: 0.6359
 epoch: 42, train_loss: 0.6482, test_loss: 0.9726, test_f1: 0.6053
 epoch: 43, train_loss: 0.6349, test_loss: 0.9704, test_f1: 0.6473
 epoch: 44, train_loss: 0.6326, test_loss: 1.0082, test_f1: 0.6136
 epoch: 45, train_loss: 0.6295, test_loss: 0.9645, test_f1: 0.6377
 epoch: 46, train_loss: 0.6187, test_loss: 0.9839, test_f1: 0.6168
 epoch: 47, train_loss: 0.6147, test_loss: 0.9335, test_f1: 0.6392
 epoch: 48, train_loss: 0.6074, test_loss: 0.9711, test_f1: 0.6190
 epoch: 49, train_loss: 0.5949, test_loss: 0.9901, test_f1: 0.6273
 epoch: 50, train_loss: 0.6149, test_loss: 0.9305, test_f1: 0.6260
 epoch: 51, train_loss: 0.5772, test_loss: 0.9458, test_f1: 0.6345
 epoch: 52, train_loss: 0.5788, test_loss: 0.9746, test_f1: 0.6311
 epoch: 53, train_loss: 0.5639, test_loss: 0.9598, test_f1: 0.6421
 epoch: 54, train_loss: 0.5478, test_loss: 1.0039, test_f1: 0.6298
 epoch: 55, train_loss: 0.5571, test_loss: 1.0030, test_f1: 0.6407
 epoch: 56, train_loss: 0.5550, test_loss: 0.9815, test_f1: 0.6323
 epoch: 57, train_loss: 0.5493, test_loss: 1.0109, test_f1: 0.6157
 epoch: 58, train_loss: 0.5478, test_loss: 1.0096, test_f1: 0.6291
 epoch: 59, train_loss: 0.5270, test_loss: 0.9945, test_f1: 0.6330
 epoch: 60, train_loss: 0.5310, test_loss: 1.0506, test_f1: 0.6020
 epoch: 61, train_loss: 0.5404, test_loss: 1.0649, test_f1: 0.6125
 epoch: 62, train_loss: 0.5357, test_loss: 1.0509, test_f1: 0.5911
 epoch: 63, train_loss: 0.5368, test_loss: 1.0533, test_f1: 0.5982
 epoch: 64, train_loss: 0.5270, test_loss: 1.0508, test_f1: 0.6036
 epoch: 65, train_loss: 0.5112, test_loss: 1.0347, test_f1: 0.6314
 epoch: 66, train_loss: 0.5227, test_loss: 1.0435, test_f1: 0.6240
 epoch: 67, train_loss: 0.5130, test_loss: 1.0730, test_f1: 0.5929
 epoch: 68, train_loss: 0.4953, test_loss: 1.0822, test_f1: 0.6193
 epoch: 69, train_loss: 0.5012, test_loss: 1.0841, test_f1: 0.5976
 epoch: 70, train_loss: 0.4969, test_loss: 1.1126, test_f1: 0.5891
 epoch: 71, train_loss: 0.4985, test_loss: 1.0609, test_f1: 0.6323
 epoch: 72, train_loss: 0.5014, test_loss: 1.0886, test_f1: 0.6130
 epoch: 73, train_loss: 0.5089, test_loss: 1.0716, test_f1: 0.6105
 epoch: 74, train_loss: 0.4940, test_loss: 1.1016, test_f1: 0.6131
 epoch: 75, train_loss: 0.5074, test_loss: 1.0971, test_f1: 0.6233
 epoch: 76, train_loss: 0.4914, test_loss: 1.0520, test_f1: 0.6455
 epoch: 77, train_loss: 0.4836, test_loss: 1.0956, test_f1: 0.6040
 epoch: 78, train_loss: 0.4881, test_loss: 1.0985, test_f1: 0.6369
 epoch: 79, train_loss: 0.4778, test_loss: 1.0500, test_f1: 0.6524
 epoch: 80, train_loss: 0.4660, test_loss: 1.1194, test_f1: 0.6224
 epoch: 81, train_loss: 0.4684, test_loss: 1.0935, test_f1: 0.6289
 epoch: 82, train_loss: 0.4731, test_loss: 1.0748, test_f1: 0.6518
 epoch: 83, train_loss: 0.4734, test_loss: 1.0776, test_f1: 0.6168
 epoch: 84, train_loss: 0.4747, test_loss: 1.1478, test_f1: 0.6088
 epoch: 85, train_loss: 0.4614, test_loss: 1.0765, test_f1: 0.6495
 epoch: 86, train_loss: 0.4692, test_loss: 1.0920, test_f1: 0.6425
 epoch: 87, train_loss: 0.4523, test_loss: 1.1415, test_f1: 0.6511
 epoch: 88, train_loss: 0.4542, test_loss: 1.2082, test_f1: 0.6104
 epoch: 89, train_loss: 0.4573, test_loss: 1.1426, test_f1: 0.6218
 epoch: 90, train_loss: 0.4605, test_loss: 1.1650, test_f1: 0.6353
 epoch: 91, train_loss: 0.4470, test_loss: 1.1900, test_f1: 0.6438
 epoch: 92, train_loss: 0.4559, test_loss: 1.1780, test_f1: 0.6109
 epoch: 93, train_loss: 0.4415, test_loss: 1.1478, test_f1: 0.6216
 epoch: 94, train_loss: 0.4425, test_loss: 1.1611, test_f1: 0.6337
 epoch: 95, train_loss: 0.4457, test_loss: 1.1765, test_f1: 0.6219
 epoch: 96, train_loss: 0.4628, test_loss: 1.1374, test_f1: 0.6426
 epoch: 97, train_loss: 0.4407, test_loss: 1.2046, test_f1: 0.6099
 epoch: 98, train_loss: 0.4338, test_loss: 1.2075, test_f1: 0.6211
 epoch: 99, train_loss: 0.4406, test_loss: 1.1678, test_f1: 0.6359
##################ITERATION #4 ****************************************
 epoch: 0, train_loss: 1.1962, test_loss: 1.1155, test_f1: 0.4199
 epoch: 1, train_loss: 1.0674, test_loss: 0.9789, test_f1: 0.4697
 epoch: 2, train_loss: 1.0360, test_loss: 0.9575, test_f1: 0.5029
 epoch: 3, train_loss: 1.0025, test_loss: 0.9387, test_f1: 0.5092
 epoch: 4, train_loss: 0.9774, test_loss: 0.9286, test_f1: 0.5324
 epoch: 5, train_loss: 0.9500, test_loss: 0.9215, test_f1: 0.5379
 epoch: 6, train_loss: 0.9178, test_loss: 0.9070, test_f1: 0.5439
 epoch: 7, train_loss: 0.9077, test_loss: 0.9231, test_f1: 0.5524
 epoch: 8, train_loss: 0.9026, test_loss: 0.8900, test_f1: 0.5571
 epoch: 9, train_loss: 0.8883, test_loss: 0.9381, test_f1: 0.5514
 epoch: 10, train_loss: 0.8730, test_loss: 0.9098, test_f1: 0.5632
 epoch: 11, train_loss: 0.8696, test_loss: 0.9247, test_f1: 0.5657
 epoch: 12, train_loss: 0.8455, test_loss: 0.8946, test_f1: 0.5857
 epoch: 13, train_loss: 0.8373, test_loss: 0.8883, test_f1: 0.5820
 epoch: 14, train_loss: 0.8157, test_loss: 0.8761, test_f1: 0.5892
 epoch: 15, train_loss: 0.8053, test_loss: 0.8886, test_f1: 0.5937
 epoch: 16, train_loss: 0.8259, test_loss: 0.8724, test_f1: 0.5835
 epoch: 17, train_loss: 0.8076, test_loss: 0.8838, test_f1: 0.5992
 epoch: 18, train_loss: 0.7950, test_loss: 0.8949, test_f1: 0.5920
 epoch: 19, train_loss: 0.7739, test_loss: 0.8940, test_f1: 0.5830
 epoch: 20, train_loss: 0.7817, test_loss: 0.8919, test_f1: 0.5993
 epoch: 21, train_loss: 0.7598, test_loss: 0.8981, test_f1: 0.5928
 epoch: 22, train_loss: 0.7529, test_loss: 0.8819, test_f1: 0.5954
 epoch: 23, train_loss: 0.7593, test_loss: 0.8845, test_f1: 0.5976
 epoch: 24, train_loss: 0.7378, test_loss: 0.9001, test_f1: 0.5975
 epoch: 25, train_loss: 0.7387, test_loss: 0.8840, test_f1: 0.5847
 epoch: 26, train_loss: 0.7377, test_loss: 0.8925, test_f1: 0.5976
 epoch: 27, train_loss: 0.7184, test_loss: 0.9037, test_f1: 0.6056
 epoch: 28, train_loss: 0.7253, test_loss: 0.8959, test_f1: 0.5805
 epoch: 29, train_loss: 0.7178, test_loss: 0.8843, test_f1: 0.5904
 epoch: 30, train_loss: 0.7065, test_loss: 0.9189, test_f1: 0.6039
 epoch: 31, train_loss: 0.6921, test_loss: 0.9143, test_f1: 0.6051
 epoch: 32, train_loss: 0.6969, test_loss: 0.9074, test_f1: 0.6059
 epoch: 33, train_loss: 0.6859, test_loss: 0.8979, test_f1: 0.6018
 epoch: 34, train_loss: 0.6903, test_loss: 0.8996, test_f1: 0.6366
 epoch: 35, train_loss: 0.6747, test_loss: 0.8886, test_f1: 0.6120
 epoch: 36, train_loss: 0.6889, test_loss: 0.9113, test_f1: 0.6432
 epoch: 37, train_loss: 0.6710, test_loss: 0.9056, test_f1: 0.6003
 epoch: 38, train_loss: 0.6598, test_loss: 0.8980, test_f1: 0.6428
 epoch: 39, train_loss: 0.6567, test_loss: 0.9249, test_f1: 0.6106
 epoch: 40, train_loss: 0.6519, test_loss: 0.9137, test_f1: 0.6175
 epoch: 41, train_loss: 0.6523, test_loss: 0.9186, test_f1: 0.6180
 epoch: 42, train_loss: 0.6527, test_loss: 0.9234, test_f1: 0.6039
 epoch: 43, train_loss: 0.6441, test_loss: 0.9201, test_f1: 0.6551
 epoch: 44, train_loss: 0.6236, test_loss: 0.9240, test_f1: 0.6199
 epoch: 45, train_loss: 0.6210, test_loss: 0.9554, test_f1: 0.6219
 epoch: 46, train_loss: 0.6250, test_loss: 0.9015, test_f1: 0.6105
 epoch: 47, train_loss: 0.6101, test_loss: 0.9147, test_f1: 0.6363
 epoch: 48, train_loss: 0.6052, test_loss: 0.9657, test_f1: 0.5978
 epoch: 49, train_loss: 0.6037, test_loss: 0.9338, test_f1: 0.6243
 epoch: 50, train_loss: 0.6013, test_loss: 0.9460, test_f1: 0.6629
 epoch: 51, train_loss: 0.5791, test_loss: 0.9611, test_f1: 0.6178
 epoch: 52, train_loss: 0.5631, test_loss: 0.9467, test_f1: 0.6386
 epoch: 53, train_loss: 0.5667, test_loss: 0.9519, test_f1: 0.6295
 epoch: 54, train_loss: 0.5586, test_loss: 0.9147, test_f1: 0.6481
 epoch: 55, train_loss: 0.5578, test_loss: 0.9106, test_f1: 0.6530
 epoch: 56, train_loss: 0.5421, test_loss: 0.9162, test_f1: 0.6608
 epoch: 57, train_loss: 0.5407, test_loss: 0.9523, test_f1: 0.6549
 epoch: 58, train_loss: 0.5520, test_loss: 0.9452, test_f1: 0.6518
 epoch: 59, train_loss: 0.5367, test_loss: 0.9453, test_f1: 0.6396
 epoch: 60, train_loss: 0.5346, test_loss: 0.9608, test_f1: 0.6643
 epoch: 61, train_loss: 0.5378, test_loss: 0.9525, test_f1: 0.6470
 epoch: 62, train_loss: 0.5465, test_loss: 0.9757, test_f1: 0.6660
 epoch: 63, train_loss: 0.5239, test_loss: 0.9707, test_f1: 0.6791
 epoch: 64, train_loss: 0.5270, test_loss: 0.9725, test_f1: 0.6435
 epoch: 65, train_loss: 0.5126, test_loss: 0.9800, test_f1: 0.6566
 epoch: 66, train_loss: 0.5192, test_loss: 0.9784, test_f1: 0.6531
 epoch: 67, train_loss: 0.5212, test_loss: 0.9813, test_f1: 0.6474
 epoch: 68, train_loss: 0.5204, test_loss: 0.9627, test_f1: 0.6494
 epoch: 69, train_loss: 0.5183, test_loss: 0.9920, test_f1: 0.6866
 epoch: 70, train_loss: 0.5062, test_loss: 0.9816, test_f1: 0.6666
 epoch: 71, train_loss: 0.5040, test_loss: 1.0075, test_f1: 0.6369
 epoch: 72, train_loss: 0.4926, test_loss: 0.9607, test_f1: 0.6458
 epoch: 73, train_loss: 0.4985, test_loss: 0.9772, test_f1: 0.6634
 epoch: 74, train_loss: 0.4855, test_loss: 1.0412, test_f1: 0.6475
 epoch: 75, train_loss: 0.4915, test_loss: 1.0079, test_f1: 0.6487
 epoch: 76, train_loss: 0.4908, test_loss: 1.0281, test_f1: 0.6435
 epoch: 77, train_loss: 0.4836, test_loss: 1.0178, test_f1: 0.6593
 epoch: 78, train_loss: 0.4836, test_loss: 1.0285, test_f1: 0.6434
 epoch: 79, train_loss: 0.4723, test_loss: 1.0281, test_f1: 0.6324
 epoch: 80, train_loss: 0.4711, test_loss: 1.0141, test_f1: 0.6688
 epoch: 81, train_loss: 0.4672, test_loss: 0.9958, test_f1: 0.6522
 epoch: 82, train_loss: 0.4739, test_loss: 1.0478, test_f1: 0.6495
 epoch: 83, train_loss: 0.4640, test_loss: 1.0053, test_f1: 0.6678
 epoch: 84, train_loss: 0.4763, test_loss: 1.0646, test_f1: 0.6604
 epoch: 85, train_loss: 0.4574, test_loss: 1.0271, test_f1: 0.6584
 epoch: 86, train_loss: 0.4583, test_loss: 1.0516, test_f1: 0.6712
 epoch: 87, train_loss: 0.4726, test_loss: 1.0852, test_f1: 0.6584
 epoch: 88, train_loss: 0.4482, test_loss: 1.0489, test_f1: 0.6667
 epoch: 89, train_loss: 0.4602, test_loss: 1.0840, test_f1: 0.6572
 epoch: 90, train_loss: 0.4656, test_loss: 1.0646, test_f1: 0.6600
 epoch: 91, train_loss: 0.4571, test_loss: 1.0607, test_f1: 0.6549
 epoch: 92, train_loss: 0.4489, test_loss: 1.0986, test_f1: 0.6468
 epoch: 93, train_loss: 0.4546, test_loss: 1.0695, test_f1: 0.6652
 epoch: 94, train_loss: 0.4450, test_loss: 1.0879, test_f1: 0.6535
 epoch: 95, train_loss: 0.4304, test_loss: 1.0978, test_f1: 0.6694
 epoch: 96, train_loss: 0.4441, test_loss: 1.0898, test_f1: 0.6420
 epoch: 97, train_loss: 0.4388, test_loss: 1.1200, test_f1: 0.6649
 epoch: 98, train_loss: 0.4316, test_loss: 1.1010, test_f1: 0.6731
 epoch: 99, train_loss: 0.4405, test_loss: 1.1128, test_f1: 0.6597
##################ITERATION #5 ****************************************
 epoch: 0, train_loss: 1.2332, test_loss: 1.1570, test_f1: 0.4227
 epoch: 1, train_loss: 1.0835, test_loss: 0.9948, test_f1: 0.4802
 epoch: 2, train_loss: 1.0241, test_loss: 0.9631, test_f1: 0.4906
 epoch: 3, train_loss: 1.0035, test_loss: 0.9144, test_f1: 0.5046
 epoch: 4, train_loss: 0.9776, test_loss: 0.9322, test_f1: 0.5042
 epoch: 5, train_loss: 0.9521, test_loss: 0.9189, test_f1: 0.5154
 epoch: 6, train_loss: 0.9410, test_loss: 0.9054, test_f1: 0.5128
 epoch: 7, train_loss: 0.9306, test_loss: 0.8973, test_f1: 0.5238
 epoch: 8, train_loss: 0.9053, test_loss: 0.9001, test_f1: 0.5559
 epoch: 9, train_loss: 0.8961, test_loss: 0.8687, test_f1: 0.5525
 epoch: 10, train_loss: 0.8963, test_loss: 0.8908, test_f1: 0.5285
 epoch: 11, train_loss: 0.8681, test_loss: 0.8759, test_f1: 0.5572
 epoch: 12, train_loss: 0.8578, test_loss: 0.8675, test_f1: 0.5628
 epoch: 13, train_loss: 0.8545, test_loss: 0.8651, test_f1: 0.5736
 epoch: 14, train_loss: 0.8396, test_loss: 0.8536, test_f1: 0.5871
 epoch: 15, train_loss: 0.8337, test_loss: 0.8776, test_f1: 0.5787
 epoch: 16, train_loss: 0.8197, test_loss: 0.8703, test_f1: 0.5644
 epoch: 17, train_loss: 0.7992, test_loss: 0.8774, test_f1: 0.5799
 epoch: 18, train_loss: 0.7927, test_loss: 0.8652, test_f1: 0.5837
 epoch: 19, train_loss: 0.7925, test_loss: 0.8503, test_f1: 0.5939
 epoch: 20, train_loss: 0.7907, test_loss: 0.8427, test_f1: 0.6036
 epoch: 21, train_loss: 0.7722, test_loss: 0.8919, test_f1: 0.5885
 epoch: 22, train_loss: 0.7661, test_loss: 0.8607, test_f1: 0.5936
 epoch: 23, train_loss: 0.7700, test_loss: 0.8621, test_f1: 0.6128
 epoch: 24, train_loss: 0.7403, test_loss: 0.8549, test_f1: 0.5899
 epoch: 25, train_loss: 0.7411, test_loss: 0.8756, test_f1: 0.6042
 epoch: 26, train_loss: 0.7453, test_loss: 0.8910, test_f1: 0.5927
 epoch: 27, train_loss: 0.7347, test_loss: 0.8841, test_f1: 0.6155
 epoch: 28, train_loss: 0.7198, test_loss: 0.8595, test_f1: 0.6368
 epoch: 29, train_loss: 0.7156, test_loss: 0.8929, test_f1: 0.6177
 epoch: 30, train_loss: 0.7170, test_loss: 0.8717, test_f1: 0.6250
 epoch: 31, train_loss: 0.7141, test_loss: 0.8805, test_f1: 0.6092
 epoch: 32, train_loss: 0.6952, test_loss: 0.8643, test_f1: 0.6164
 epoch: 33, train_loss: 0.6961, test_loss: 0.8839, test_f1: 0.6266
 epoch: 34, train_loss: 0.6910, test_loss: 0.8713, test_f1: 0.6503
 epoch: 35, train_loss: 0.6826, test_loss: 0.8936, test_f1: 0.6327
 epoch: 36, train_loss: 0.6811, test_loss: 0.9034, test_f1: 0.6139
 epoch: 37, train_loss: 0.6816, test_loss: 0.8773, test_f1: 0.6190
 epoch: 38, train_loss: 0.6555, test_loss: 0.8920, test_f1: 0.6189
 epoch: 39, train_loss: 0.6596, test_loss: 0.8911, test_f1: 0.6493
 epoch: 40, train_loss: 0.6370, test_loss: 0.8604, test_f1: 0.6631
 epoch: 41, train_loss: 0.6638, test_loss: 0.8882, test_f1: 0.6302
 epoch: 42, train_loss: 0.6493, test_loss: 0.8980, test_f1: 0.6084
 epoch: 43, train_loss: 0.6371, test_loss: 0.8946, test_f1: 0.6504
 epoch: 44, train_loss: 0.6261, test_loss: 0.9055, test_f1: 0.6502
 epoch: 45, train_loss: 0.6298, test_loss: 0.8656, test_f1: 0.6274
 epoch: 46, train_loss: 0.6340, test_loss: 0.9059, test_f1: 0.6232
 epoch: 47, train_loss: 0.6371, test_loss: 0.8606, test_f1: 0.6463
 epoch: 48, train_loss: 0.6069, test_loss: 0.8983, test_f1: 0.6370
 epoch: 49, train_loss: 0.6099, test_loss: 0.9156, test_f1: 0.6149
 epoch: 50, train_loss: 0.6055, test_loss: 0.8880, test_f1: 0.6458
 epoch: 51, train_loss: 0.5865, test_loss: 0.8977, test_f1: 0.6440
 epoch: 52, train_loss: 0.5681, test_loss: 0.9146, test_f1: 0.6526
 epoch: 53, train_loss: 0.5776, test_loss: 0.9073, test_f1: 0.6479
 epoch: 54, train_loss: 0.5569, test_loss: 0.9251, test_f1: 0.6484
 epoch: 55, train_loss: 0.5588, test_loss: 0.9093, test_f1: 0.6668
 epoch: 56, train_loss: 0.5634, test_loss: 0.9339, test_f1: 0.6609
 epoch: 57, train_loss: 0.5555, test_loss: 0.9300, test_f1: 0.6566
 epoch: 58, train_loss: 0.5424, test_loss: 0.9418, test_f1: 0.6571
 epoch: 59, train_loss: 0.5435, test_loss: 0.9460, test_f1: 0.6517
 epoch: 60, train_loss: 0.5381, test_loss: 0.9236, test_f1: 0.6644
 epoch: 61, train_loss: 0.5506, test_loss: 0.9359, test_f1: 0.6650
 epoch: 62, train_loss: 0.5289, test_loss: 0.9686, test_f1: 0.6600
 epoch: 63, train_loss: 0.5416, test_loss: 0.9965, test_f1: 0.6571
 epoch: 64, train_loss: 0.5361, test_loss: 0.9659, test_f1: 0.6581
 epoch: 65, train_loss: 0.5323, test_loss: 0.9566, test_f1: 0.6618
 epoch: 66, train_loss: 0.5449, test_loss: 0.9684, test_f1: 0.6581
 epoch: 67, train_loss: 0.5243, test_loss: 0.9505, test_f1: 0.6612
 epoch: 68, train_loss: 0.5338, test_loss: 0.9703, test_f1: 0.6606
 epoch: 69, train_loss: 0.5064, test_loss: 0.9392, test_f1: 0.6670
 epoch: 70, train_loss: 0.5211, test_loss: 0.9955, test_f1: 0.6592
 epoch: 71, train_loss: 0.5120, test_loss: 0.9919, test_f1: 0.6507
 epoch: 72, train_loss: 0.5076, test_loss: 0.9485, test_f1: 0.6571
 epoch: 73, train_loss: 0.5025, test_loss: 0.9904, test_f1: 0.6649
 epoch: 74, train_loss: 0.5176, test_loss: 1.0066, test_f1: 0.6578
 epoch: 75, train_loss: 0.5040, test_loss: 0.9764, test_f1: 0.6490
 epoch: 76, train_loss: 0.5018, test_loss: 1.0130, test_f1: 0.6538
 epoch: 77, train_loss: 0.4995, test_loss: 1.0233, test_f1: 0.6646
 epoch: 78, train_loss: 0.4880, test_loss: 1.0059, test_f1: 0.6630
 epoch: 79, train_loss: 0.4795, test_loss: 0.9923, test_f1: 0.6627
 epoch: 80, train_loss: 0.4768, test_loss: 1.0045, test_f1: 0.6599
 epoch: 81, train_loss: 0.4841, test_loss: 1.0281, test_f1: 0.6493
 epoch: 82, train_loss: 0.4872, test_loss: 1.0117, test_f1: 0.6590
 epoch: 83, train_loss: 0.4813, test_loss: 1.0430, test_f1: 0.6399
 epoch: 84, train_loss: 0.4820, test_loss: 1.0190, test_f1: 0.6530
 epoch: 85, train_loss: 0.4752, test_loss: 1.0146, test_f1: 0.6465
 epoch: 86, train_loss: 0.4796, test_loss: 1.0270, test_f1: 0.6619
 epoch: 87, train_loss: 0.4743, test_loss: 1.0215, test_f1: 0.6737
 epoch: 88, train_loss: 0.4742, test_loss: 1.0573, test_f1: 0.6457
 epoch: 89, train_loss: 0.4627, test_loss: 1.0545, test_f1: 0.6533
 epoch: 90, train_loss: 0.4696, test_loss: 1.0498, test_f1: 0.6558
 epoch: 91, train_loss: 0.4662, test_loss: 1.0618, test_f1: 0.6665
 epoch: 92, train_loss: 0.4586, test_loss: 1.0818, test_f1: 0.6579
 epoch: 93, train_loss: 0.4674, test_loss: 1.0519, test_f1: 0.6428
 epoch: 94, train_loss: 0.4582, test_loss: 1.1166, test_f1: 0.6560
 epoch: 95, train_loss: 0.4562, test_loss: 1.0893, test_f1: 0.6503
 epoch: 96, train_loss: 0.4507, test_loss: 1.0722, test_f1: 0.6562
 epoch: 97, train_loss: 0.4394, test_loss: 1.1014, test_f1: 0.6499
 epoch: 98, train_loss: 0.4473, test_loss: 1.0909, test_f1: 0.6515
 epoch: 99, train_loss: 0.4405, test_loss: 1.1132, test_f1: 0.6717
##################ITERATION #6 ****************************************
 epoch: 0, train_loss: 1.2365, test_loss: 1.2366, test_f1: 0.3787
 epoch: 1, train_loss: 1.1118, test_loss: 1.0090, test_f1: 0.4935
 epoch: 2, train_loss: 1.0646, test_loss: 0.9873, test_f1: 0.4823
 epoch: 3, train_loss: 1.0286, test_loss: 0.9538, test_f1: 0.5205
 epoch: 4, train_loss: 0.9967, test_loss: 0.9430, test_f1: 0.5158
 epoch: 5, train_loss: 0.9802, test_loss: 0.9640, test_f1: 0.5131
 epoch: 6, train_loss: 0.9727, test_loss: 0.9287, test_f1: 0.5310
 epoch: 7, train_loss: 0.9424, test_loss: 0.9221, test_f1: 0.5193
 epoch: 8, train_loss: 0.9213, test_loss: 0.9253, test_f1: 0.5354
 epoch: 9, train_loss: 0.9258, test_loss: 0.9129, test_f1: 0.5279
 epoch: 10, train_loss: 0.9051, test_loss: 0.9031, test_f1: 0.5468
 epoch: 11, train_loss: 0.8889, test_loss: 0.9180, test_f1: 0.5460
 epoch: 12, train_loss: 0.8916, test_loss: 0.9302, test_f1: 0.5645
 epoch: 13, train_loss: 0.8688, test_loss: 0.8898, test_f1: 0.5907
 epoch: 14, train_loss: 0.8550, test_loss: 0.9523, test_f1: 0.5252
 epoch: 15, train_loss: 0.8471, test_loss: 0.9092, test_f1: 0.5472
 epoch: 16, train_loss: 0.8482, test_loss: 0.9129, test_f1: 0.5655
 epoch: 17, train_loss: 0.8376, test_loss: 0.9182, test_f1: 0.5733
 epoch: 18, train_loss: 0.8196, test_loss: 0.9265, test_f1: 0.5568
 epoch: 19, train_loss: 0.8294, test_loss: 0.8962, test_f1: 0.5964
 epoch: 20, train_loss: 0.8101, test_loss: 0.8905, test_f1: 0.5735
 epoch: 21, train_loss: 0.8065, test_loss: 0.9082, test_f1: 0.5970
 epoch: 22, train_loss: 0.8021, test_loss: 0.9092, test_f1: 0.5632
 epoch: 23, train_loss: 0.7974, test_loss: 0.9371, test_f1: 0.5725
 epoch: 24, train_loss: 0.7900, test_loss: 0.8902, test_f1: 0.5973
 epoch: 25, train_loss: 0.7700, test_loss: 0.9143, test_f1: 0.5950
 epoch: 26, train_loss: 0.7706, test_loss: 0.9182, test_f1: 0.5646
 epoch: 27, train_loss: 0.7678, test_loss: 0.9167, test_f1: 0.5694
 epoch: 28, train_loss: 0.7564, test_loss: 0.8971, test_f1: 0.5913
 epoch: 29, train_loss: 0.7433, test_loss: 0.9125, test_f1: 0.5930
 epoch: 30, train_loss: 0.7661, test_loss: 0.9363, test_f1: 0.5599
 epoch: 31, train_loss: 0.7618, test_loss: 0.9404, test_f1: 0.5770
 epoch: 32, train_loss: 0.7430, test_loss: 0.9500, test_f1: 0.5868
 epoch: 33, train_loss: 0.7276, test_loss: 0.9282, test_f1: 0.5897
 epoch: 34, train_loss: 0.7288, test_loss: 0.9371, test_f1: 0.5945
 epoch: 35, train_loss: 0.7176, test_loss: 0.9860, test_f1: 0.5703
 epoch: 36, train_loss: 0.7147, test_loss: 0.9607, test_f1: 0.6011
 epoch: 37, train_loss: 0.7072, test_loss: 0.9323, test_f1: 0.6089
 epoch: 38, train_loss: 0.7138, test_loss: 0.9927, test_f1: 0.5451
 epoch: 39, train_loss: 0.6984, test_loss: 0.9268, test_f1: 0.6043
 epoch: 40, train_loss: 0.6990, test_loss: 0.9540, test_f1: 0.5901
 epoch: 41, train_loss: 0.6888, test_loss: 0.9444, test_f1: 0.5985
 epoch: 42, train_loss: 0.6939, test_loss: 0.9547, test_f1: 0.6042
 epoch: 43, train_loss: 0.6743, test_loss: 0.9649, test_f1: 0.5897
 epoch: 44, train_loss: 0.6729, test_loss: 0.9970, test_f1: 0.5914
 epoch: 45, train_loss: 0.6634, test_loss: 0.9843, test_f1: 0.5936
 epoch: 46, train_loss: 0.6624, test_loss: 0.9664, test_f1: 0.5893
 epoch: 47, train_loss: 0.6617, test_loss: 0.9833, test_f1: 0.5924
 epoch: 48, train_loss: 0.6603, test_loss: 0.9772, test_f1: 0.5921
 epoch: 49, train_loss: 0.6454, test_loss: 1.0102, test_f1: 0.5899
 epoch: 50, train_loss: 0.6489, test_loss: 0.9760, test_f1: 0.6018
 epoch: 51, train_loss: 0.6409, test_loss: 0.9542, test_f1: 0.6148
 epoch: 52, train_loss: 0.6158, test_loss: 0.9809, test_f1: 0.6188
 epoch: 53, train_loss: 0.6177, test_loss: 0.9887, test_f1: 0.6069
 epoch: 54, train_loss: 0.6120, test_loss: 0.9740, test_f1: 0.5951
 epoch: 55, train_loss: 0.5955, test_loss: 0.9475, test_f1: 0.6191
 epoch: 56, train_loss: 0.6037, test_loss: 1.0074, test_f1: 0.5758
 epoch: 57, train_loss: 0.5906, test_loss: 1.0060, test_f1: 0.5955
 epoch: 58, train_loss: 0.5951, test_loss: 1.0024, test_f1: 0.5962
 epoch: 59, train_loss: 0.5953, test_loss: 1.0215, test_f1: 0.5921
 epoch: 60, train_loss: 0.5779, test_loss: 1.0000, test_f1: 0.6027
 epoch: 61, train_loss: 0.5847, test_loss: 1.0003, test_f1: 0.6190
 epoch: 62, train_loss: 0.5811, test_loss: 1.0005, test_f1: 0.6050
 epoch: 63, train_loss: 0.5784, test_loss: 0.9998, test_f1: 0.6178
 epoch: 64, train_loss: 0.5676, test_loss: 1.0127, test_f1: 0.6144
 epoch: 65, train_loss: 0.5645, test_loss: 0.9950, test_f1: 0.6100
 epoch: 66, train_loss: 0.5626, test_loss: 0.9979, test_f1: 0.6175
 epoch: 67, train_loss: 0.5611, test_loss: 1.0030, test_f1: 0.6137
 epoch: 68, train_loss: 0.5635, test_loss: 0.9877, test_f1: 0.6308
 epoch: 69, train_loss: 0.5602, test_loss: 1.0106, test_f1: 0.6310
 epoch: 70, train_loss: 0.5561, test_loss: 1.0258, test_f1: 0.6167
 epoch: 71, train_loss: 0.5591, test_loss: 1.0222, test_f1: 0.6059
 epoch: 72, train_loss: 0.5609, test_loss: 1.0254, test_f1: 0.6090
 epoch: 73, train_loss: 0.5455, test_loss: 1.0262, test_f1: 0.6273
 epoch: 74, train_loss: 0.5459, test_loss: 1.0007, test_f1: 0.6239
 epoch: 75, train_loss: 0.5557, test_loss: 1.0128, test_f1: 0.6076
 epoch: 76, train_loss: 0.5385, test_loss: 1.0177, test_f1: 0.6288
 epoch: 77, train_loss: 0.5392, test_loss: 1.0228, test_f1: 0.6055
 epoch: 78, train_loss: 0.5277, test_loss: 1.0277, test_f1: 0.6092
 epoch: 79, train_loss: 0.5251, test_loss: 1.0310, test_f1: 0.6208
 epoch: 80, train_loss: 0.5236, test_loss: 1.0193, test_f1: 0.6229
 epoch: 81, train_loss: 0.5315, test_loss: 1.0628, test_f1: 0.6158
 epoch: 82, train_loss: 0.5321, test_loss: 1.0690, test_f1: 0.6195
 epoch: 83, train_loss: 0.5258, test_loss: 1.0741, test_f1: 0.6238
 epoch: 84, train_loss: 0.5095, test_loss: 1.0513, test_f1: 0.6157
 epoch: 85, train_loss: 0.5200, test_loss: 1.0351, test_f1: 0.6304
 epoch: 86, train_loss: 0.5143, test_loss: 1.1077, test_f1: 0.6129
 epoch: 87, train_loss: 0.5188, test_loss: 1.0609, test_f1: 0.6212
 epoch: 88, train_loss: 0.4864, test_loss: 1.0477, test_f1: 0.6304
 epoch: 89, train_loss: 0.5045, test_loss: 1.0947, test_f1: 0.6133
 epoch: 90, train_loss: 0.5059, test_loss: 1.0464, test_f1: 0.6323
 epoch: 91, train_loss: 0.4975, test_loss: 1.0752, test_f1: 0.5994
 epoch: 92, train_loss: 0.4958, test_loss: 1.0497, test_f1: 0.6182
 epoch: 93, train_loss: 0.4893, test_loss: 1.0515, test_f1: 0.6318
 epoch: 94, train_loss: 0.4876, test_loss: 1.0766, test_f1: 0.6245
 epoch: 95, train_loss: 0.4990, test_loss: 1.0707, test_f1: 0.6304
 epoch: 96, train_loss: 0.4943, test_loss: 1.1064, test_f1: 0.6147
 epoch: 97, train_loss: 0.4920, test_loss: 1.1150, test_f1: 0.6124
 epoch: 98, train_loss: 0.4750, test_loss: 1.0885, test_f1: 0.6249
 epoch: 99, train_loss: 0.4842, test_loss: 1.0865, test_f1: 0.6245
##################ITERATION #7 ****************************************
 epoch: 0, train_loss: 1.2571, test_loss: 1.1323, test_f1: 0.4247
 epoch: 1, train_loss: 1.0990, test_loss: 0.9926, test_f1: 0.4813
 epoch: 2, train_loss: 1.0564, test_loss: 0.9427, test_f1: 0.5034
 epoch: 3, train_loss: 1.0167, test_loss: 0.9389, test_f1: 0.5290
 epoch: 4, train_loss: 0.9965, test_loss: 0.9181, test_f1: 0.5035
 epoch: 5, train_loss: 0.9660, test_loss: 0.9194, test_f1: 0.5407
 epoch: 6, train_loss: 0.9537, test_loss: 0.9240, test_f1: 0.5077
 epoch: 7, train_loss: 0.9365, test_loss: 0.8912, test_f1: 0.5575
 epoch: 8, train_loss: 0.9262, test_loss: 0.8845, test_f1: 0.5600
 epoch: 9, train_loss: 0.9110, test_loss: 0.8789, test_f1: 0.5657
 epoch: 10, train_loss: 0.8925, test_loss: 0.8850, test_f1: 0.5752
 epoch: 11, train_loss: 0.8799, test_loss: 0.8651, test_f1: 0.5819
 epoch: 12, train_loss: 0.8880, test_loss: 0.8583, test_f1: 0.6009
 epoch: 13, train_loss: 0.8745, test_loss: 0.8891, test_f1: 0.6049
 epoch: 14, train_loss: 0.8600, test_loss: 0.8732, test_f1: 0.5776
 epoch: 15, train_loss: 0.8524, test_loss: 0.8863, test_f1: 0.5853
 epoch: 16, train_loss: 0.8492, test_loss: 0.8847, test_f1: 0.5684
 epoch: 17, train_loss: 0.8285, test_loss: 0.8973, test_f1: 0.5963
 epoch: 18, train_loss: 0.8282, test_loss: 0.8919, test_f1: 0.5805
 epoch: 19, train_loss: 0.8233, test_loss: 0.8712, test_f1: 0.5922
 epoch: 20, train_loss: 0.8113, test_loss: 0.8836, test_f1: 0.5700
 epoch: 21, train_loss: 0.7981, test_loss: 0.8931, test_f1: 0.5917
 epoch: 22, train_loss: 0.7936, test_loss: 0.8783, test_f1: 0.6066
 epoch: 23, train_loss: 0.7818, test_loss: 0.8712, test_f1: 0.5762
 epoch: 24, train_loss: 0.7765, test_loss: 0.8650, test_f1: 0.6139
 epoch: 25, train_loss: 0.7765, test_loss: 0.8625, test_f1: 0.6022
 epoch: 26, train_loss: 0.7556, test_loss: 0.8624, test_f1: 0.6141
 epoch: 27, train_loss: 0.7560, test_loss: 0.8979, test_f1: 0.5983
 epoch: 28, train_loss: 0.7649, test_loss: 0.8603, test_f1: 0.6193
 epoch: 29, train_loss: 0.7561, test_loss: 0.8591, test_f1: 0.6179
 epoch: 30, train_loss: 0.7398, test_loss: 0.8571, test_f1: 0.6040
 epoch: 31, train_loss: 0.7456, test_loss: 0.8765, test_f1: 0.6248
 epoch: 32, train_loss: 0.7263, test_loss: 0.8807, test_f1: 0.6063
 epoch: 33, train_loss: 0.7278, test_loss: 0.8939, test_f1: 0.6124
 epoch: 34, train_loss: 0.7177, test_loss: 0.8973, test_f1: 0.6343
 epoch: 35, train_loss: 0.7168, test_loss: 0.9229, test_f1: 0.6008
 epoch: 36, train_loss: 0.7174, test_loss: 0.9315, test_f1: 0.5876
 epoch: 37, train_loss: 0.7018, test_loss: 0.9169, test_f1: 0.6355
 epoch: 38, train_loss: 0.7034, test_loss: 0.9166, test_f1: 0.6342
 epoch: 39, train_loss: 0.6916, test_loss: 0.9366, test_f1: 0.6200
 epoch: 40, train_loss: 0.6748, test_loss: 0.9177, test_f1: 0.6520
 epoch: 41, train_loss: 0.6891, test_loss: 0.9460, test_f1: 0.6001
 epoch: 42, train_loss: 0.6878, test_loss: 0.9564, test_f1: 0.6136
 epoch: 43, train_loss: 0.6705, test_loss: 0.9181, test_f1: 0.6410
 epoch: 44, train_loss: 0.6708, test_loss: 0.9216, test_f1: 0.5983
 epoch: 45, train_loss: 0.6537, test_loss: 0.9244, test_f1: 0.6094
 epoch: 46, train_loss: 0.6590, test_loss: 0.9406, test_f1: 0.6402
 epoch: 47, train_loss: 0.6412, test_loss: 0.9264, test_f1: 0.6535
 epoch: 48, train_loss: 0.6330, test_loss: 0.9405, test_f1: 0.6472
 epoch: 49, train_loss: 0.6312, test_loss: 0.9284, test_f1: 0.6376
 epoch: 50, train_loss: 0.6389, test_loss: 0.9789, test_f1: 0.6251
 epoch: 51, train_loss: 0.6008, test_loss: 0.9674, test_f1: 0.6460
 epoch: 52, train_loss: 0.5923, test_loss: 0.9681, test_f1: 0.6354
 epoch: 53, train_loss: 0.5982, test_loss: 0.9415, test_f1: 0.6396
 epoch: 54, train_loss: 0.6030, test_loss: 0.9735, test_f1: 0.6275
 epoch: 55, train_loss: 0.5978, test_loss: 0.9826, test_f1: 0.6397
 epoch: 56, train_loss: 0.5694, test_loss: 0.9831, test_f1: 0.6331
 epoch: 57, train_loss: 0.5725, test_loss: 0.9750, test_f1: 0.6499
 epoch: 58, train_loss: 0.5713, test_loss: 1.0075, test_f1: 0.6234
 epoch: 59, train_loss: 0.5757, test_loss: 0.9874, test_f1: 0.6140
 epoch: 60, train_loss: 0.5686, test_loss: 1.0041, test_f1: 0.6293
 epoch: 61, train_loss: 0.5698, test_loss: 0.9912, test_f1: 0.6447
 epoch: 62, train_loss: 0.5651, test_loss: 1.0007, test_f1: 0.6293
 epoch: 63, train_loss: 0.5540, test_loss: 1.0238, test_f1: 0.6275
 epoch: 64, train_loss: 0.5618, test_loss: 1.0488, test_f1: 0.6209
 epoch: 65, train_loss: 0.5532, test_loss: 1.0419, test_f1: 0.6212
 epoch: 66, train_loss: 0.5422, test_loss: 1.0339, test_f1: 0.6382
 epoch: 67, train_loss: 0.5516, test_loss: 1.0121, test_f1: 0.6339
 epoch: 68, train_loss: 0.5524, test_loss: 1.0508, test_f1: 0.6266
 epoch: 69, train_loss: 0.5543, test_loss: 1.0252, test_f1: 0.6397
 epoch: 70, train_loss: 0.5345, test_loss: 1.0144, test_f1: 0.6445
 epoch: 71, train_loss: 0.5364, test_loss: 1.0179, test_f1: 0.6291
 epoch: 72, train_loss: 0.5321, test_loss: 0.9859, test_f1: 0.6464
 epoch: 73, train_loss: 0.5394, test_loss: 1.0713, test_f1: 0.6269
 epoch: 74, train_loss: 0.5240, test_loss: 1.0626, test_f1: 0.6292
 epoch: 75, train_loss: 0.5258, test_loss: 1.0654, test_f1: 0.6305
 epoch: 76, train_loss: 0.5194, test_loss: 1.0601, test_f1: 0.6339
 epoch: 77, train_loss: 0.5224, test_loss: 1.0555, test_f1: 0.6286
 epoch: 78, train_loss: 0.5068, test_loss: 1.0670, test_f1: 0.6417
 epoch: 79, train_loss: 0.5096, test_loss: 1.0369, test_f1: 0.6494
 epoch: 80, train_loss: 0.5131, test_loss: 1.0804, test_f1: 0.6224
 epoch: 81, train_loss: 0.5004, test_loss: 1.0556, test_f1: 0.6234
 epoch: 82, train_loss: 0.5080, test_loss: 1.0835, test_f1: 0.6441
 epoch: 83, train_loss: 0.4871, test_loss: 1.1091, test_f1: 0.6313
 epoch: 84, train_loss: 0.4952, test_loss: 1.1153, test_f1: 0.6385
 epoch: 85, train_loss: 0.4913, test_loss: 1.1400, test_f1: 0.6355
 epoch: 86, train_loss: 0.4886, test_loss: 1.0880, test_f1: 0.6334
 epoch: 87, train_loss: 0.4892, test_loss: 1.0743, test_f1: 0.6398
 epoch: 88, train_loss: 0.5017, test_loss: 1.0884, test_f1: 0.6434
 epoch: 89, train_loss: 0.4882, test_loss: 1.1094, test_f1: 0.6376
 epoch: 90, train_loss: 0.4780, test_loss: 1.0773, test_f1: 0.6507
 epoch: 91, train_loss: 0.4738, test_loss: 1.1523, test_f1: 0.6301
 epoch: 92, train_loss: 0.4744, test_loss: 1.0698, test_f1: 0.6607
 epoch: 93, train_loss: 0.4686, test_loss: 1.1190, test_f1: 0.6406
 epoch: 94, train_loss: 0.4865, test_loss: 1.0710, test_f1: 0.6455
 epoch: 95, train_loss: 0.4537, test_loss: 1.0915, test_f1: 0.6406
 epoch: 96, train_loss: 0.4612, test_loss: 1.1195, test_f1: 0.6398
 epoch: 97, train_loss: 0.4602, test_loss: 1.1179, test_f1: 0.6483
 epoch: 98, train_loss: 0.4620, test_loss: 1.0948, test_f1: 0.6626
 epoch: 99, train_loss: 0.4555, test_loss: 1.1059, test_f1: 0.6531
##################ITERATION #8 ****************************************
 epoch: 0, train_loss: 1.2566, test_loss: 1.1178, test_f1: 0.4372
 epoch: 1, train_loss: 1.0902, test_loss: 0.9781, test_f1: 0.5203
 epoch: 2, train_loss: 1.0467, test_loss: 0.9829, test_f1: 0.4980
 epoch: 3, train_loss: 1.0172, test_loss: 0.9425, test_f1: 0.4986
 epoch: 4, train_loss: 0.9983, test_loss: 0.9579, test_f1: 0.5145
 epoch: 5, train_loss: 0.9794, test_loss: 0.9485, test_f1: 0.5267
 epoch: 6, train_loss: 0.9509, test_loss: 0.9423, test_f1: 0.5173
 epoch: 7, train_loss: 0.9322, test_loss: 0.8880, test_f1: 0.5574
 epoch: 8, train_loss: 0.9198, test_loss: 0.9221, test_f1: 0.5442
 epoch: 9, train_loss: 0.9106, test_loss: 0.9118, test_f1: 0.5470
 epoch: 10, train_loss: 0.8972, test_loss: 0.8978, test_f1: 0.5732
 epoch: 11, train_loss: 0.8882, test_loss: 0.9169, test_f1: 0.5490
 epoch: 12, train_loss: 0.8774, test_loss: 0.9132, test_f1: 0.5423
 epoch: 13, train_loss: 0.8684, test_loss: 0.9068, test_f1: 0.5726
 epoch: 14, train_loss: 0.8425, test_loss: 0.8927, test_f1: 0.5734
 epoch: 15, train_loss: 0.8433, test_loss: 0.8754, test_f1: 0.5790
 epoch: 16, train_loss: 0.8341, test_loss: 0.8808, test_f1: 0.5846
 epoch: 17, train_loss: 0.8297, test_loss: 0.8736, test_f1: 0.5848
 epoch: 18, train_loss: 0.8127, test_loss: 0.8930, test_f1: 0.5793
 epoch: 19, train_loss: 0.8170, test_loss: 0.9075, test_f1: 0.5993
 epoch: 20, train_loss: 0.8015, test_loss: 0.8671, test_f1: 0.6052
 epoch: 21, train_loss: 0.7937, test_loss: 0.8615, test_f1: 0.5855
 epoch: 22, train_loss: 0.7865, test_loss: 0.8825, test_f1: 0.6009
 epoch: 23, train_loss: 0.7746, test_loss: 0.8915, test_f1: 0.5963
 epoch: 24, train_loss: 0.7837, test_loss: 0.8993, test_f1: 0.5849
 epoch: 25, train_loss: 0.7677, test_loss: 0.8943, test_f1: 0.5919
 epoch: 26, train_loss: 0.7667, test_loss: 0.9145, test_f1: 0.6033
 epoch: 27, train_loss: 0.7492, test_loss: 0.8782, test_f1: 0.6076
 epoch: 28, train_loss: 0.7514, test_loss: 0.8875, test_f1: 0.5974
 epoch: 29, train_loss: 0.7404, test_loss: 0.8909, test_f1: 0.6035
 epoch: 30, train_loss: 0.7349, test_loss: 0.8774, test_f1: 0.6114
 epoch: 31, train_loss: 0.7233, test_loss: 0.8866, test_f1: 0.6293
 epoch: 32, train_loss: 0.7192, test_loss: 0.8862, test_f1: 0.6087
 epoch: 33, train_loss: 0.7152, test_loss: 0.8774, test_f1: 0.6239
 epoch: 34, train_loss: 0.7142, test_loss: 0.8907, test_f1: 0.6131
 epoch: 35, train_loss: 0.7089, test_loss: 0.8994, test_f1: 0.5955
 epoch: 36, train_loss: 0.7012, test_loss: 0.9016, test_f1: 0.5994
 epoch: 37, train_loss: 0.6843, test_loss: 0.8887, test_f1: 0.6261
 epoch: 38, train_loss: 0.6786, test_loss: 0.8840, test_f1: 0.6351
 epoch: 39, train_loss: 0.6855, test_loss: 0.9207, test_f1: 0.6144
 epoch: 40, train_loss: 0.6832, test_loss: 0.9006, test_f1: 0.6343
 epoch: 41, train_loss: 0.6724, test_loss: 0.8979, test_f1: 0.6202
 epoch: 42, train_loss: 0.6763, test_loss: 0.9006, test_f1: 0.6274
 epoch: 43, train_loss: 0.6519, test_loss: 0.9472, test_f1: 0.6187
 epoch: 44, train_loss: 0.6586, test_loss: 0.9191, test_f1: 0.6224
 epoch: 45, train_loss: 0.6563, test_loss: 0.9172, test_f1: 0.6239
 epoch: 46, train_loss: 0.6492, test_loss: 0.9047, test_f1: 0.6269
 epoch: 47, train_loss: 0.6450, test_loss: 0.9094, test_f1: 0.6415
 epoch: 48, train_loss: 0.6308, test_loss: 0.9009, test_f1: 0.6405
 epoch: 49, train_loss: 0.6408, test_loss: 0.9039, test_f1: 0.6494
 epoch: 50, train_loss: 0.6383, test_loss: 0.8973, test_f1: 0.6256
 epoch: 51, train_loss: 0.6220, test_loss: 0.8904, test_f1: 0.6460
 epoch: 52, train_loss: 0.6089, test_loss: 0.8962, test_f1: 0.6337
 epoch: 53, train_loss: 0.6073, test_loss: 0.9027, test_f1: 0.6443
 epoch: 54, train_loss: 0.5954, test_loss: 0.8926, test_f1: 0.6485
 epoch: 55, train_loss: 0.5924, test_loss: 0.9142, test_f1: 0.6214
 epoch: 56, train_loss: 0.5886, test_loss: 0.9137, test_f1: 0.6362
 epoch: 57, train_loss: 0.5822, test_loss: 0.9171, test_f1: 0.6405
 epoch: 58, train_loss: 0.5812, test_loss: 0.9346, test_f1: 0.6311
 epoch: 59, train_loss: 0.5801, test_loss: 0.9227, test_f1: 0.6290
 epoch: 60, train_loss: 0.5765, test_loss: 0.9213, test_f1: 0.6373
 epoch: 61, train_loss: 0.5757, test_loss: 0.9375, test_f1: 0.6311
 epoch: 62, train_loss: 0.5673, test_loss: 0.9503, test_f1: 0.6452
 epoch: 63, train_loss: 0.5776, test_loss: 0.9397, test_f1: 0.6432
 epoch: 64, train_loss: 0.5668, test_loss: 0.9319, test_f1: 0.6298
 epoch: 65, train_loss: 0.5624, test_loss: 0.9356, test_f1: 0.6314
 epoch: 66, train_loss: 0.5621, test_loss: 0.9304, test_f1: 0.6375
 epoch: 67, train_loss: 0.5611, test_loss: 0.9136, test_f1: 0.6524
 epoch: 68, train_loss: 0.5576, test_loss: 0.9412, test_f1: 0.6543
 epoch: 69, train_loss: 0.5465, test_loss: 0.9965, test_f1: 0.6321
 epoch: 70, train_loss: 0.5443, test_loss: 0.9676, test_f1: 0.6404
 epoch: 71, train_loss: 0.5533, test_loss: 0.9409, test_f1: 0.6657
 epoch: 72, train_loss: 0.5468, test_loss: 0.9711, test_f1: 0.6255
 epoch: 73, train_loss: 0.5273, test_loss: 0.9550, test_f1: 0.6484
 epoch: 74, train_loss: 0.5451, test_loss: 0.9534, test_f1: 0.6369
 epoch: 75, train_loss: 0.5369, test_loss: 0.9346, test_f1: 0.6503
 epoch: 76, train_loss: 0.5342, test_loss: 0.9398, test_f1: 0.6443
 epoch: 77, train_loss: 0.5396, test_loss: 0.9831, test_f1: 0.6521
 epoch: 78, train_loss: 0.5382, test_loss: 0.9835, test_f1: 0.6408
 epoch: 79, train_loss: 0.5335, test_loss: 1.0071, test_f1: 0.6335
 epoch: 80, train_loss: 0.5220, test_loss: 0.9927, test_f1: 0.6394
 epoch: 81, train_loss: 0.5270, test_loss: 0.9438, test_f1: 0.6540
 epoch: 82, train_loss: 0.5199, test_loss: 1.0245, test_f1: 0.6363
 epoch: 83, train_loss: 0.5084, test_loss: 0.9511, test_f1: 0.6513
 epoch: 84, train_loss: 0.5143, test_loss: 0.9504, test_f1: 0.6456
 epoch: 85, train_loss: 0.5072, test_loss: 0.9953, test_f1: 0.6589
 epoch: 86, train_loss: 0.5229, test_loss: 0.9980, test_f1: 0.6335
 epoch: 87, train_loss: 0.5119, test_loss: 1.0064, test_f1: 0.6525
 epoch: 88, train_loss: 0.5003, test_loss: 1.0307, test_f1: 0.6534
 epoch: 89, train_loss: 0.4907, test_loss: 1.0291, test_f1: 0.6445
 epoch: 90, train_loss: 0.4867, test_loss: 0.9895, test_f1: 0.6716
 epoch: 91, train_loss: 0.5100, test_loss: 1.0347, test_f1: 0.6579
 epoch: 92, train_loss: 0.4982, test_loss: 0.9912, test_f1: 0.6610
 epoch: 93, train_loss: 0.4840, test_loss: 1.0027, test_f1: 0.6591
 epoch: 94, train_loss: 0.4880, test_loss: 1.0308, test_f1: 0.6646
 epoch: 95, train_loss: 0.4951, test_loss: 1.0328, test_f1: 0.6556
 epoch: 96, train_loss: 0.4684, test_loss: 1.0423, test_f1: 0.6604
 epoch: 97, train_loss: 0.4754, test_loss: 1.0197, test_f1: 0.6664
 epoch: 98, train_loss: 0.4806, test_loss: 1.0443, test_f1: 0.6614
 epoch: 99, train_loss: 0.4925, test_loss: 1.0847, test_f1: 0.6870
##################ITERATION #9 ****************************************
 epoch: 0, train_loss: 1.2892, test_loss: 1.1002, test_f1: 0.4133
 epoch: 1, train_loss: 1.1130, test_loss: 0.9736, test_f1: 0.4916
 epoch: 2, train_loss: 1.0528, test_loss: 0.9647, test_f1: 0.4658
 epoch: 3, train_loss: 1.0203, test_loss: 0.9345, test_f1: 0.4868
 epoch: 4, train_loss: 0.9976, test_loss: 0.9145, test_f1: 0.5067
 epoch: 5, train_loss: 0.9737, test_loss: 0.8911, test_f1: 0.5167
 epoch: 6, train_loss: 0.9644, test_loss: 0.9006, test_f1: 0.5222
 epoch: 7, train_loss: 0.9500, test_loss: 0.9104, test_f1: 0.5120
 epoch: 8, train_loss: 0.9266, test_loss: 0.9309, test_f1: 0.4789
 epoch: 9, train_loss: 0.9145, test_loss: 0.8887, test_f1: 0.5290
 epoch: 10, train_loss: 0.9162, test_loss: 0.9005, test_f1: 0.5297
 epoch: 11, train_loss: 0.9025, test_loss: 0.8996, test_f1: 0.5359
 epoch: 12, train_loss: 0.8856, test_loss: 0.8967, test_f1: 0.5477
 epoch: 13, train_loss: 0.8844, test_loss: 0.8872, test_f1: 0.5306
 epoch: 14, train_loss: 0.8772, test_loss: 0.8789, test_f1: 0.5675
 epoch: 15, train_loss: 0.8697, test_loss: 0.8761, test_f1: 0.5637
 epoch: 16, train_loss: 0.8462, test_loss: 0.8754, test_f1: 0.5759
 epoch: 17, train_loss: 0.8558, test_loss: 0.8789, test_f1: 0.5577
 epoch: 18, train_loss: 0.8363, test_loss: 0.8747, test_f1: 0.5618
 epoch: 19, train_loss: 0.8203, test_loss: 0.8722, test_f1: 0.5783
 epoch: 20, train_loss: 0.8326, test_loss: 0.8947, test_f1: 0.5759
 epoch: 21, train_loss: 0.8179, test_loss: 0.9197, test_f1: 0.5647
 epoch: 22, train_loss: 0.8174, test_loss: 0.8765, test_f1: 0.5848
 epoch: 23, train_loss: 0.8000, test_loss: 0.8845, test_f1: 0.5932
 epoch: 24, train_loss: 0.8043, test_loss: 0.8850, test_f1: 0.5840
 epoch: 25, train_loss: 0.7968, test_loss: 0.8912, test_f1: 0.5834
 epoch: 26, train_loss: 0.7885, test_loss: 0.8926, test_f1: 0.5873
 epoch: 27, train_loss: 0.7856, test_loss: 0.8845, test_f1: 0.5774
 epoch: 28, train_loss: 0.7682, test_loss: 0.8725, test_f1: 0.5898
 epoch: 29, train_loss: 0.7695, test_loss: 0.8650, test_f1: 0.5809
 epoch: 30, train_loss: 0.7630, test_loss: 0.8706, test_f1: 0.6129
 epoch: 31, train_loss: 0.7501, test_loss: 0.8800, test_f1: 0.6080
 epoch: 32, train_loss: 0.7493, test_loss: 0.8913, test_f1: 0.6284
 epoch: 33, train_loss: 0.7626, test_loss: 0.8585, test_f1: 0.6231
 epoch: 34, train_loss: 0.7359, test_loss: 0.9029, test_f1: 0.5992
 epoch: 35, train_loss: 0.7335, test_loss: 0.8866, test_f1: 0.6154
 epoch: 36, train_loss: 0.7203, test_loss: 0.8797, test_f1: 0.6343
 epoch: 37, train_loss: 0.7338, test_loss: 0.8718, test_f1: 0.6290
 epoch: 38, train_loss: 0.7263, test_loss: 0.8963, test_f1: 0.6352
 epoch: 39, train_loss: 0.7121, test_loss: 0.9067, test_f1: 0.6353
 epoch: 40, train_loss: 0.7052, test_loss: 0.8757, test_f1: 0.5949
 epoch: 41, train_loss: 0.6989, test_loss: 0.8722, test_f1: 0.6325
 epoch: 42, train_loss: 0.6936, test_loss: 0.8978, test_f1: 0.6249
 epoch: 43, train_loss: 0.6931, test_loss: 0.9039, test_f1: 0.5850
 epoch: 44, train_loss: 0.6954, test_loss: 0.8926, test_f1: 0.6207
 epoch: 45, train_loss: 0.6816, test_loss: 0.8721, test_f1: 0.6296
 epoch: 46, train_loss: 0.6715, test_loss: 0.8866, test_f1: 0.6378
 epoch: 47, train_loss: 0.6822, test_loss: 0.8920, test_f1: 0.6132
 epoch: 48, train_loss: 0.6718, test_loss: 0.9074, test_f1: 0.6143
 epoch: 49, train_loss: 0.6711, test_loss: 0.8941, test_f1: 0.6374
 epoch: 50, train_loss: 0.6624, test_loss: 0.8881, test_f1: 0.6253
 epoch: 51, train_loss: 0.6596, test_loss: 0.8780, test_f1: 0.6262
 epoch: 52, train_loss: 0.6402, test_loss: 0.8819, test_f1: 0.6332
 epoch: 53, train_loss: 0.6359, test_loss: 0.8942, test_f1: 0.6379
 epoch: 54, train_loss: 0.6195, test_loss: 0.8810, test_f1: 0.6183
 epoch: 55, train_loss: 0.6266, test_loss: 0.9011, test_f1: 0.6212
 epoch: 56, train_loss: 0.6178, test_loss: 0.8783, test_f1: 0.6365
 epoch: 57, train_loss: 0.6192, test_loss: 0.9022, test_f1: 0.6369
 epoch: 58, train_loss: 0.6180, test_loss: 0.9236, test_f1: 0.6304
 epoch: 59, train_loss: 0.6095, test_loss: 0.9250, test_f1: 0.6276
 epoch: 60, train_loss: 0.6178, test_loss: 0.9171, test_f1: 0.6531
 epoch: 61, train_loss: 0.6097, test_loss: 0.9077, test_f1: 0.6377
 epoch: 62, train_loss: 0.6046, test_loss: 0.8974, test_f1: 0.6279
 epoch: 63, train_loss: 0.5944, test_loss: 0.9272, test_f1: 0.6389
 epoch: 64, train_loss: 0.6047, test_loss: 0.9046, test_f1: 0.6368
 epoch: 65, train_loss: 0.5927, test_loss: 0.9128, test_f1: 0.6431
 epoch: 66, train_loss: 0.5827, test_loss: 0.9027, test_f1: 0.6428
 epoch: 67, train_loss: 0.5820, test_loss: 0.9105, test_f1: 0.6368
 epoch: 68, train_loss: 0.5847, test_loss: 0.9001, test_f1: 0.6217
 epoch: 69, train_loss: 0.5781, test_loss: 0.9168, test_f1: 0.6176
 epoch: 70, train_loss: 0.5776, test_loss: 0.9164, test_f1: 0.6409
 epoch: 71, train_loss: 0.5818, test_loss: 0.9524, test_f1: 0.6249
 epoch: 72, train_loss: 0.5701, test_loss: 0.9231, test_f1: 0.6483
 epoch: 73, train_loss: 0.5682, test_loss: 0.9359, test_f1: 0.6077
 epoch: 74, train_loss: 0.5602, test_loss: 0.9385, test_f1: 0.6518
 epoch: 75, train_loss: 0.5648, test_loss: 0.9528, test_f1: 0.6336
 epoch: 76, train_loss: 0.5621, test_loss: 0.9299, test_f1: 0.6342
 epoch: 77, train_loss: 0.5612, test_loss: 0.9360, test_f1: 0.6190
 epoch: 78, train_loss: 0.5512, test_loss: 0.9311, test_f1: 0.6151
 epoch: 79, train_loss: 0.5460, test_loss: 0.9581, test_f1: 0.6267
 epoch: 80, train_loss: 0.5478, test_loss: 0.9645, test_f1: 0.6323
 epoch: 81, train_loss: 0.5512, test_loss: 0.9661, test_f1: 0.6243
 epoch: 82, train_loss: 0.5506, test_loss: 0.9924, test_f1: 0.6313
 epoch: 83, train_loss: 0.5494, test_loss: 0.9893, test_f1: 0.6173
 epoch: 84, train_loss: 0.5333, test_loss: 0.9450, test_f1: 0.6277
 epoch: 85, train_loss: 0.5262, test_loss: 0.9520, test_f1: 0.6383
 epoch: 86, train_loss: 0.5396, test_loss: 0.9711, test_f1: 0.6370
 epoch: 87, train_loss: 0.5321, test_loss: 0.9716, test_f1: 0.6368
 epoch: 88, train_loss: 0.5332, test_loss: 0.9747, test_f1: 0.6065
 epoch: 89, train_loss: 0.5231, test_loss: 0.9717, test_f1: 0.6432
 epoch: 90, train_loss: 0.5372, test_loss: 0.9987, test_f1: 0.6347
 epoch: 91, train_loss: 0.5229, test_loss: 0.9823, test_f1: 0.6276
 epoch: 92, train_loss: 0.5208, test_loss: 0.9972, test_f1: 0.6292
 epoch: 93, train_loss: 0.5180, test_loss: 0.9821, test_f1: 0.6394
 epoch: 94, train_loss: 0.5096, test_loss: 0.9892, test_f1: 0.6438
 epoch: 95, train_loss: 0.5113, test_loss: 1.0085, test_f1: 0.6357
 epoch: 96, train_loss: 0.5098, test_loss: 1.0200, test_f1: 0.6320
 epoch: 97, train_loss: 0.5263, test_loss: 1.0227, test_f1: 0.6347
 epoch: 98, train_loss: 0.5077, test_loss: 0.9857, test_f1: 0.6390
 epoch: 99, train_loss: 0.5012, test_loss: 1.0249, test_f1: 0.6342

Training completed in 793.92 seconds
Best F1: 0.6870 at epoch 99
Mean F1 across iterations: 0.6658  0.0160
========================FINAL RESULTS================================
FEGIN weighted F1: 0.6870  0.0160
python main.py --data ltspice_examples --representation component_net --model FEGIN --layers 5 --hiddens 128 --batch_size 64 --lr 0.0001 --emb_size 128 --epochs 100 --save_appendix component_net_L5_H128_BS64_LR0.0001_E128 --no_val
-----



STDERR:
  File "main.py", line 370, in <module>
    main()
  File "main.py", line 254, in main
    dataset = dataset_class(
  File "/home/philip/projects/ltspice_examples_code_repo/Circuit-Completion-Using-GNNs/component_classification_with_link_prediction_head/evaluation/FEGIN/kernel/circuit_datasets.py", line 15, in __init__
    self.data, self.slices = torch.load(self.processed_paths[0])
  File "/home/philip/.local/lib/python3.8/site-packages/torch/serialization.py", line 1040, in load
    warnings.warn(
  File "/usr/lib/python3.8/warnings.py", line 109, in _showwarnmsg
    sw(msg.message, msg.category, msg.filename, msg.lineno,
  File "main.py", line 47, in warn_with_traceback
    traceback.print_stack(file=log)
/home/philip/projects/ltspice_examples_code_repo/Circuit-Completion-Using-GNNs/component_classification_with_link_prediction_head/evaluation/FEGIN/kernel/circuit_datasets.py:15: FutureWarning: You are using `torch.load` with `weights_only=False` (the current default value), which uses the default pickle module implicitly. It is possible to construct malicious pickle data which will execute arbitrary code during unpickling (See https://github.com/pytorch/pytorch/blob/main/SECURITY.md#untrusted-models for more details). In a future release, the default value for `weights_only` will be flipped to `True`. This limits the functions that could be executed during unpickling. Arbitrary objects will no longer be allowed to be loaded via this mode unless they are explicitly allowlisted by the user via `torch.serialization.add_safe_globals`. We recommend you start setting `weights_only=True` for any use case where you don't have full control of the loaded file. Please open an issue on GitHub for any issues related to this experimental feature.
  self.data, self.slices = torch.load(self.processed_paths[0])
