STDOUT:
Results will be saved in /home/philip/projects/ltspice_examples_code_repo/Circuit-Completion-Using-GNNs/component_classification_with_link_prediction_head/evaluation/FEGIN/results/model_FEGIN_dataset_ltspice_demos
Command line input: python main.py --data ltspice_demos --representation component_pin_net --model FEGIN --layers 2 --hiddens 32 --batch_size 256 --lr 0.1 --emb_size 250 --epochs 100 --save_appendix component_pin_net_L2_H32_BS256_LR0.1_E250 --no_val
 is saved.
-----
ltspice_demos - FEGIN
Using 2 layers, 32 hidden units, h = 2
Loading component_pin_net representation dataset
ENTERED
Training FEGIN on component_pin_net representation
Train: 1565, Test: 383
##################ITERATION #0 ****************************************
 epoch: 0, train_loss: 1.2931, test_loss: 1.4319, test_f1: 0.1975
 epoch: 1, train_loss: 1.1306, test_loss: 1.4947, test_f1: 0.3550
 epoch: 2, train_loss: 1.0802, test_loss: 1.1598, test_f1: 0.4090
 epoch: 3, train_loss: 1.0857, test_loss: 1.2038, test_f1: 0.4036
 epoch: 4, train_loss: 1.1293, test_loss: 1.1243, test_f1: 0.3405
 epoch: 5, train_loss: 1.0993, test_loss: 1.3089, test_f1: 0.2390
 epoch: 6, train_loss: 1.0663, test_loss: 1.1936, test_f1: 0.3902
 epoch: 7, train_loss: 1.0446, test_loss: 1.1050, test_f1: 0.3310
 epoch: 8, train_loss: 1.0238, test_loss: 1.1178, test_f1: 0.4385
 epoch: 9, train_loss: 1.0346, test_loss: 1.1009, test_f1: 0.3422
 epoch: 10, train_loss: 1.0392, test_loss: 1.0974, test_f1: 0.3700
 epoch: 11, train_loss: 1.0246, test_loss: 1.1143, test_f1: 0.3834
 epoch: 12, train_loss: 1.0237, test_loss: 1.1176, test_f1: 0.3395
 epoch: 13, train_loss: 1.0442, test_loss: 1.1068, test_f1: 0.3399
 epoch: 14, train_loss: 1.0416, test_loss: 1.1308, test_f1: 0.3353
 epoch: 15, train_loss: 1.0420, test_loss: 1.1216, test_f1: 0.3675
 epoch: 16, train_loss: 1.0319, test_loss: 1.1130, test_f1: 0.3374
 epoch: 17, train_loss: 1.0274, test_loss: 1.7202, test_f1: 0.2912
 epoch: 18, train_loss: 1.0269, test_loss: 1.0978, test_f1: 0.4392
 epoch: 19, train_loss: 1.0347, test_loss: 1.2965, test_f1: 0.3284
 epoch: 20, train_loss: 1.0342, test_loss: 1.1681, test_f1: 0.4272
 epoch: 21, train_loss: 1.0280, test_loss: 1.1646, test_f1: 0.4275
 epoch: 22, train_loss: 1.0084, test_loss: 1.4866, test_f1: 0.2987
 epoch: 23, train_loss: 1.0108, test_loss: 1.2734, test_f1: 0.3597
 epoch: 24, train_loss: 1.0551, test_loss: 1.9753, test_f1: 0.3658
 epoch: 25, train_loss: 1.0405, test_loss: 2.0979, test_f1: 0.3762
 epoch: 26, train_loss: 1.0424, test_loss: 1.4857, test_f1: 0.3001
 epoch: 27, train_loss: 1.0369, test_loss: 1.2922, test_f1: 0.3018
 epoch: 28, train_loss: 1.0813, test_loss: 1.1760, test_f1: 0.3244
 epoch: 29, train_loss: 1.0682, test_loss: 1.1195, test_f1: 0.3405
 epoch: 30, train_loss: 1.0425, test_loss: 8.2712, test_f1: 0.2512
 epoch: 31, train_loss: 1.0205, test_loss: 1.1650, test_f1: 0.3842
 epoch: 32, train_loss: 1.0149, test_loss: 4.0259, test_f1: 0.3914
 epoch: 33, train_loss: 1.0084, test_loss: 1.1164, test_f1: 0.3801
 epoch: 34, train_loss: 1.0090, test_loss: 1.1009, test_f1: 0.3691
 epoch: 35, train_loss: 1.0108, test_loss: 1.0836, test_f1: 0.3407
 epoch: 36, train_loss: 1.0136, test_loss: 1.1815, test_f1: 0.3300
 epoch: 37, train_loss: 1.0278, test_loss: 1.4373, test_f1: 0.3134
 epoch: 38, train_loss: 1.0182, test_loss: 1.5517, test_f1: 0.2326
 epoch: 39, train_loss: 0.9974, test_loss: 1.0819, test_f1: 0.4421
 epoch: 40, train_loss: 0.9936, test_loss: 1.1812, test_f1: 0.3348
 epoch: 41, train_loss: 0.9996, test_loss: 1.3965, test_f1: 0.3281
 epoch: 42, train_loss: 0.9930, test_loss: 1.1093, test_f1: 0.4682
 epoch: 43, train_loss: 0.9796, test_loss: 1.0582, test_f1: 0.3409
 epoch: 44, train_loss: 0.9793, test_loss: 1.0358, test_f1: 0.3529
 epoch: 45, train_loss: 0.9631, test_loss: 1.0472, test_f1: 0.4199
 epoch: 46, train_loss: 0.9865, test_loss: 1.0965, test_f1: 0.3370
 epoch: 47, train_loss: 1.0189, test_loss: 1.2052, test_f1: 0.3083
 epoch: 48, train_loss: 1.0749, test_loss: 1.4908, test_f1: 0.3464
 epoch: 49, train_loss: 1.0372, test_loss: 1.9882, test_f1: 0.2413
 epoch: 50, train_loss: 1.0376, test_loss: 1.1035, test_f1: 0.3362
 epoch: 51, train_loss: 1.0344, test_loss: 1.1080, test_f1: 0.3395
 epoch: 52, train_loss: 1.0191, test_loss: 1.1059, test_f1: 0.3512
 epoch: 53, train_loss: 1.0359, test_loss: 1.1763, test_f1: 0.3234
 epoch: 54, train_loss: 1.0401, test_loss: 1.1623, test_f1: 0.3290
 epoch: 55, train_loss: 1.0251, test_loss: 1.1356, test_f1: 0.3777
 epoch: 56, train_loss: 1.0142, test_loss: 1.3763, test_f1: 0.2766
 epoch: 57, train_loss: 1.0217, test_loss: 1.2481, test_f1: 0.3395
 epoch: 58, train_loss: 1.0150, test_loss: 1.1625, test_f1: 0.3469
 epoch: 59, train_loss: 1.0024, test_loss: 1.2987, test_f1: 0.3449
 epoch: 60, train_loss: 0.9900, test_loss: 1.2950, test_f1: 0.3439
 epoch: 61, train_loss: 0.9813, test_loss: 1.1661, test_f1: 0.3464
 epoch: 62, train_loss: 0.9736, test_loss: 1.0707, test_f1: 0.3451
 epoch: 63, train_loss: 0.9792, test_loss: 1.0727, test_f1: 0.3439
 epoch: 64, train_loss: 0.9761, test_loss: 1.0609, test_f1: 0.3535
 epoch: 65, train_loss: 0.9659, test_loss: 1.0773, test_f1: 0.3512
 epoch: 66, train_loss: 0.9749, test_loss: 1.0511, test_f1: 0.3441
 epoch: 67, train_loss: 0.9777, test_loss: 1.1326, test_f1: 0.4071
 epoch: 68, train_loss: 0.9826, test_loss: 1.0851, test_f1: 0.3395
 epoch: 69, train_loss: 0.9573, test_loss: 1.5575, test_f1: 0.2884
 epoch: 70, train_loss: 0.9649, test_loss: 1.3982, test_f1: 0.3084
 epoch: 71, train_loss: 0.9554, test_loss: 1.1846, test_f1: 0.3420
 epoch: 72, train_loss: 0.9561, test_loss: 1.0853, test_f1: 0.3425
 epoch: 73, train_loss: 0.9631, test_loss: 1.0327, test_f1: 0.3461
 epoch: 74, train_loss: 0.9559, test_loss: 1.0536, test_f1: 0.3316
 epoch: 75, train_loss: 0.9499, test_loss: 1.0259, test_f1: 0.3428
 epoch: 76, train_loss: 0.9389, test_loss: 1.0974, test_f1: 0.4201
 epoch: 77, train_loss: 0.9302, test_loss: 1.2185, test_f1: 0.4430
 epoch: 78, train_loss: 0.9359, test_loss: 1.1154, test_f1: 0.3348
 epoch: 79, train_loss: 0.9349, test_loss: 1.0642, test_f1: 0.4431
 epoch: 80, train_loss: 0.9259, test_loss: 1.0640, test_f1: 0.3750
 epoch: 81, train_loss: 0.9298, test_loss: 1.0397, test_f1: 0.3445
 epoch: 82, train_loss: 0.9241, test_loss: 1.0912, test_f1: 0.3813
 epoch: 83, train_loss: 0.9574, test_loss: 1.0911, test_f1: 0.3353
 epoch: 84, train_loss: 0.9424, test_loss: 1.1614, test_f1: 0.3905
 epoch: 85, train_loss: 0.9601, test_loss: 1.0805, test_f1: 0.3344
 epoch: 86, train_loss: 0.9501, test_loss: 1.1048, test_f1: 0.4209
 epoch: 87, train_loss: 0.9406, test_loss: 1.1249, test_f1: 0.4126
 epoch: 88, train_loss: 0.9533, test_loss: 1.0674, test_f1: 0.3578
 epoch: 89, train_loss: 0.9760, test_loss: 1.1312, test_f1: 0.3314
 epoch: 90, train_loss: 0.9793, test_loss: 1.1768, test_f1: 0.3302
 epoch: 91, train_loss: 0.9674, test_loss: 1.1056, test_f1: 0.3344
 epoch: 92, train_loss: 0.9728, test_loss: 1.0787, test_f1: 0.3344
 epoch: 93, train_loss: 0.9537, test_loss: 1.0557, test_f1: 0.3999
 epoch: 94, train_loss: 0.9492, test_loss: 1.0807, test_f1: 0.4224
 epoch: 95, train_loss: 0.9338, test_loss: 1.0963, test_f1: 0.3006
 epoch: 96, train_loss: 0.9446, test_loss: 1.0363, test_f1: 0.4417
 epoch: 97, train_loss: 0.9451, test_loss: 1.0660, test_f1: 0.4297
 epoch: 98, train_loss: 0.9668, test_loss: 1.0098, test_f1: 0.3527
 epoch: 99, train_loss: 0.9679, test_loss: 1.0187, test_f1: 0.3487
##################ITERATION #1 ****************************************
 epoch: 0, train_loss: 1.2969, test_loss: 1.6815, test_f1: 0.2281
 epoch: 1, train_loss: 1.2471, test_loss: 1.3923, test_f1: 0.2281
 epoch: 2, train_loss: 1.2306, test_loss: 1.3745, test_f1: 0.2007
 epoch: 3, train_loss: 1.2162, test_loss: 1.5153, test_f1: 0.1377
 epoch: 4, train_loss: 1.1993, test_loss: 1.3943, test_f1: 0.2624
 epoch: 5, train_loss: 1.1868, test_loss: 1.2590, test_f1: 0.3200
 epoch: 6, train_loss: 1.1758, test_loss: 1.3849, test_f1: 0.2734
 epoch: 7, train_loss: 1.1259, test_loss: 1.3050, test_f1: 0.2281
 epoch: 8, train_loss: 1.1150, test_loss: 1.3241, test_f1: 0.3867
 epoch: 9, train_loss: 1.0979, test_loss: 1.1783, test_f1: 0.3229
 epoch: 10, train_loss: 1.0944, test_loss: 1.2026, test_f1: 0.4193
 epoch: 11, train_loss: 1.0795, test_loss: 1.2478, test_f1: 0.3340
 epoch: 12, train_loss: 1.0687, test_loss: 1.1527, test_f1: 0.3321
 epoch: 13, train_loss: 1.0535, test_loss: 1.2872, test_f1: 0.2823
 epoch: 14, train_loss: 1.0903, test_loss: 1.4269, test_f1: 0.2705
 epoch: 15, train_loss: 1.0836, test_loss: 1.2553, test_f1: 0.4309
 epoch: 16, train_loss: 1.0501, test_loss: 1.1058, test_f1: 0.3751
 epoch: 17, train_loss: 1.0325, test_loss: 1.2155, test_f1: 0.3979
 epoch: 18, train_loss: 1.0806, test_loss: 2.2601, test_f1: 0.1368
 epoch: 19, train_loss: 1.0392, test_loss: 1.4375, test_f1: 0.4574
 epoch: 20, train_loss: 1.0681, test_loss: 1.2796, test_f1: 0.4223
 epoch: 21, train_loss: 1.0484, test_loss: 1.1646, test_f1: 0.3262
 epoch: 22, train_loss: 1.0518, test_loss: 1.2589, test_f1: 0.3290
 epoch: 23, train_loss: 1.0343, test_loss: 1.3751, test_f1: 0.2507
 epoch: 24, train_loss: 1.0132, test_loss: 1.3736, test_f1: 0.4356
 epoch: 25, train_loss: 1.0106, test_loss: 1.4985, test_f1: 0.2749
 epoch: 26, train_loss: 1.0012, test_loss: 1.2225, test_f1: 0.3152
 epoch: 27, train_loss: 1.0049, test_loss: 1.1067, test_f1: 0.4518
 epoch: 28, train_loss: 1.0262, test_loss: 1.1957, test_f1: 0.4445
 epoch: 29, train_loss: 1.0220, test_loss: 1.1831, test_f1: 0.4557
 epoch: 30, train_loss: 1.0230, test_loss: 1.3666, test_f1: 0.2586
 epoch: 31, train_loss: 1.0131, test_loss: 1.3512, test_f1: 0.2762
 epoch: 32, train_loss: 1.0523, test_loss: 1.1327, test_f1: 0.4157
 epoch: 33, train_loss: 1.0187, test_loss: 1.1028, test_f1: 0.3290
 epoch: 34, train_loss: 0.9897, test_loss: 1.1953, test_f1: 0.4341
 epoch: 35, train_loss: 1.0110, test_loss: 1.3141, test_f1: 0.4650
 epoch: 36, train_loss: 1.0001, test_loss: 1.1232, test_f1: 0.4802
 epoch: 37, train_loss: 1.0077, test_loss: 1.0973, test_f1: 0.3258
 epoch: 38, train_loss: 0.9996, test_loss: 1.0886, test_f1: 0.4739
 epoch: 39, train_loss: 1.0224, test_loss: 1.1667, test_f1: 0.3311
 epoch: 40, train_loss: 1.0025, test_loss: 1.1170, test_f1: 0.4402
 epoch: 41, train_loss: 1.0075, test_loss: 1.1115, test_f1: 0.3333
 epoch: 42, train_loss: 1.0117, test_loss: 1.4289, test_f1: 0.2548
 epoch: 43, train_loss: 1.1264, test_loss: 1.8209, test_f1: 0.0759
 epoch: 44, train_loss: 1.1113, test_loss: 1.3478, test_f1: 0.3083
 epoch: 45, train_loss: 1.0825, test_loss: 1.2501, test_f1: 0.2908
 epoch: 46, train_loss: 1.0446, test_loss: 1.4194, test_f1: 0.3176
 epoch: 47, train_loss: 1.0433, test_loss: 1.2743, test_f1: 0.2379
 epoch: 48, train_loss: 1.0483, test_loss: 1.1179, test_f1: 0.3633
 epoch: 49, train_loss: 1.0510, test_loss: 1.1941, test_f1: 0.3004
 epoch: 50, train_loss: 1.0453, test_loss: 1.1316, test_f1: 0.4255
 epoch: 51, train_loss: 1.0436, test_loss: 1.1478, test_f1: 0.3285
 epoch: 52, train_loss: 1.0426, test_loss: 1.1324, test_f1: 0.3290
 epoch: 53, train_loss: 1.0286, test_loss: 1.1335, test_f1: 0.4373
 epoch: 54, train_loss: 1.0160, test_loss: 1.1413, test_f1: 0.4450
 epoch: 55, train_loss: 1.0161, test_loss: 1.1141, test_f1: 0.4286
 epoch: 56, train_loss: 1.0033, test_loss: 1.1070, test_f1: 0.3321
 epoch: 57, train_loss: 1.0026, test_loss: 1.0981, test_f1: 0.4107
 epoch: 58, train_loss: 0.9981, test_loss: 1.0941, test_f1: 0.3855
 epoch: 59, train_loss: 0.9972, test_loss: 1.1574, test_f1: 0.4295
 epoch: 60, train_loss: 1.0004, test_loss: 1.1144, test_f1: 0.3988
 epoch: 61, train_loss: 1.0036, test_loss: 1.1109, test_f1: 0.3250
 epoch: 62, train_loss: 0.9918, test_loss: 1.1188, test_f1: 0.4531
 epoch: 63, train_loss: 1.0082, test_loss: 1.1244, test_f1: 0.4018
 epoch: 64, train_loss: 0.9845, test_loss: 1.0961, test_f1: 0.3598
 epoch: 65, train_loss: 0.9974, test_loss: 1.2365, test_f1: 0.4282
 epoch: 66, train_loss: 0.9872, test_loss: 1.2328, test_f1: 0.3370
 epoch: 67, train_loss: 0.9790, test_loss: 1.1471, test_f1: 0.3639
 epoch: 68, train_loss: 0.9951, test_loss: 1.0745, test_f1: 0.3395
 epoch: 69, train_loss: 0.9804, test_loss: 1.0627, test_f1: 0.4043
 epoch: 70, train_loss: 0.9701, test_loss: 1.0888, test_f1: 0.3762
 epoch: 71, train_loss: 0.9853, test_loss: 1.0754, test_f1: 0.4136
 epoch: 72, train_loss: 0.9983, test_loss: 1.1189, test_f1: 0.4569
 epoch: 73, train_loss: 0.9848, test_loss: 1.2095, test_f1: 0.3807
 epoch: 74, train_loss: 0.9768, test_loss: 1.1654, test_f1: 0.4932
 epoch: 75, train_loss: 0.9803, test_loss: 1.0641, test_f1: 0.4079
 epoch: 76, train_loss: 0.9550, test_loss: 1.1303, test_f1: 0.4738
 epoch: 77, train_loss: 0.9708, test_loss: 1.0832, test_f1: 0.4827
 epoch: 78, train_loss: 0.9614, test_loss: 1.0556, test_f1: 0.3942
 epoch: 79, train_loss: 0.9769, test_loss: 1.0742, test_f1: 0.3943
 epoch: 80, train_loss: 1.0129, test_loss: 1.1014, test_f1: 0.3697
 epoch: 81, train_loss: 1.0069, test_loss: 1.1415, test_f1: 0.4688
 epoch: 82, train_loss: 0.9855, test_loss: 1.1969, test_f1: 0.3972
 epoch: 83, train_loss: 0.9895, test_loss: 1.1049, test_f1: 0.4829
 epoch: 84, train_loss: 0.9899, test_loss: 1.5108, test_f1: 0.4343
 epoch: 85, train_loss: 0.9895, test_loss: 1.5126, test_f1: 0.3949
 epoch: 86, train_loss: 0.9668, test_loss: 1.1857, test_f1: 0.4380
 epoch: 87, train_loss: 0.9621, test_loss: 1.1408, test_f1: 0.4614
 epoch: 88, train_loss: 0.9629, test_loss: 1.0889, test_f1: 0.4279
 epoch: 89, train_loss: 0.9639, test_loss: 1.0712, test_f1: 0.4317
 epoch: 90, train_loss: 0.9554, test_loss: 1.1204, test_f1: 0.4714
 epoch: 91, train_loss: 0.9791, test_loss: 1.1330, test_f1: 0.4472
 epoch: 92, train_loss: 0.9657, test_loss: 1.0766, test_f1: 0.3342
 epoch: 93, train_loss: 0.9553, test_loss: 1.0741, test_f1: 0.3995
 epoch: 94, train_loss: 0.9704, test_loss: 1.2088, test_f1: 0.4330
 epoch: 95, train_loss: 0.9675, test_loss: 1.1694, test_f1: 0.3882
 epoch: 96, train_loss: 0.9607, test_loss: 1.1735, test_f1: 0.4198
 epoch: 97, train_loss: 0.9562, test_loss: 1.1362, test_f1: 0.4124
 epoch: 98, train_loss: 0.9467, test_loss: 1.0835, test_f1: 0.4726
 epoch: 99, train_loss: 0.9559, test_loss: 1.0576, test_f1: 0.4390
##################ITERATION #2 ****************************************
 epoch: 0, train_loss: 1.4416, test_loss: 3.8768, test_f1: 0.1365
 epoch: 1, train_loss: 1.1271, test_loss: 3.2594, test_f1: 0.0848
 epoch: 2, train_loss: 1.0692, test_loss: 2.4474, test_f1: 0.1964
 epoch: 3, train_loss: 1.0563, test_loss: 1.6969, test_f1: 0.2559
 epoch: 4, train_loss: 1.0429, test_loss: 1.1934, test_f1: 0.3319
 epoch: 5, train_loss: 1.0532, test_loss: 1.1551, test_f1: 0.4261
 epoch: 6, train_loss: 1.0423, test_loss: 1.5338, test_f1: 0.3575
 epoch: 7, train_loss: 1.0381, test_loss: 1.3508, test_f1: 0.2930
 epoch: 8, train_loss: 1.0265, test_loss: 1.1490, test_f1: 0.3791
 epoch: 9, train_loss: 1.0269, test_loss: 1.1722, test_f1: 0.3786
 epoch: 10, train_loss: 1.0254, test_loss: 1.1799, test_f1: 0.3539
 epoch: 11, train_loss: 1.0216, test_loss: 1.2016, test_f1: 0.4210
 epoch: 12, train_loss: 1.0270, test_loss: 1.2574, test_f1: 0.3525
 epoch: 13, train_loss: 1.0430, test_loss: 1.1705, test_f1: 0.4335
 epoch: 14, train_loss: 1.0340, test_loss: 1.1410, test_f1: 0.3345
 epoch: 15, train_loss: 1.0236, test_loss: 1.1297, test_f1: 0.3382
 epoch: 16, train_loss: 1.0291, test_loss: 2.6934, test_f1: 0.1595
 epoch: 17, train_loss: 1.0273, test_loss: 1.2439, test_f1: 0.3072
 epoch: 18, train_loss: 1.0298, test_loss: 1.1024, test_f1: 0.3420
 epoch: 19, train_loss: 1.0224, test_loss: 1.1401, test_f1: 0.4280
 epoch: 20, train_loss: 1.0199, test_loss: 1.1886, test_f1: 0.3317
 epoch: 21, train_loss: 1.0474, test_loss: 1.2288, test_f1: 0.3112
 epoch: 22, train_loss: 1.0226, test_loss: 1.1184, test_f1: 0.3395
 epoch: 23, train_loss: 1.0040, test_loss: 1.1206, test_f1: 0.3717
 epoch: 24, train_loss: 1.0047, test_loss: 1.1456, test_f1: 0.3986
 epoch: 25, train_loss: 1.0272, test_loss: 2.3021, test_f1: 0.2214
 epoch: 26, train_loss: 1.0094, test_loss: 1.8313, test_f1: 0.3643
 epoch: 27, train_loss: 1.0069, test_loss: 2.3952, test_f1: 0.2263
 epoch: 28, train_loss: 1.0188, test_loss: 1.2448, test_f1: 0.3627
 epoch: 29, train_loss: 0.9991, test_loss: 1.1262, test_f1: 0.4015
 epoch: 30, train_loss: 0.9948, test_loss: 1.0753, test_f1: 0.3323
 epoch: 31, train_loss: 0.9912, test_loss: 1.1094, test_f1: 0.3345
 epoch: 32, train_loss: 1.0094, test_loss: 1.0900, test_f1: 0.3717
 epoch: 33, train_loss: 1.0113, test_loss: 1.0802, test_f1: 0.3682
 epoch: 34, train_loss: 0.9981, test_loss: 1.6960, test_f1: 0.2602
 epoch: 35, train_loss: 1.0195, test_loss: 2.5726, test_f1: 0.2056
 epoch: 36, train_loss: 1.0162, test_loss: 1.4134, test_f1: 0.3535
 epoch: 37, train_loss: 0.9927, test_loss: 1.1591, test_f1: 0.3344
 epoch: 38, train_loss: 1.0063, test_loss: 1.2282, test_f1: 0.3817
 epoch: 39, train_loss: 0.9945, test_loss: 1.0964, test_f1: 0.3291
 epoch: 40, train_loss: 1.0022, test_loss: 1.1423, test_f1: 0.3262
 epoch: 41, train_loss: 1.0011, test_loss: 1.1385, test_f1: 0.3168
 epoch: 42, train_loss: 0.9833, test_loss: 1.2623, test_f1: 0.3057
 epoch: 43, train_loss: 0.9942, test_loss: 1.1034, test_f1: 0.3344
 epoch: 44, train_loss: 0.9945, test_loss: 1.1001, test_f1: 0.3267
 epoch: 45, train_loss: 0.9910, test_loss: 1.1367, test_f1: 0.4355
 epoch: 46, train_loss: 1.0210, test_loss: 1.4677, test_f1: 0.3827
 epoch: 47, train_loss: 0.9965, test_loss: 1.1348, test_f1: 0.4708
 epoch: 48, train_loss: 1.0049, test_loss: 1.0784, test_f1: 0.3347
 epoch: 49, train_loss: 1.0148, test_loss: 1.1588, test_f1: 0.3957
 epoch: 50, train_loss: 0.9817, test_loss: 1.1151, test_f1: 0.3381
 epoch: 51, train_loss: 0.9706, test_loss: 1.0959, test_f1: 0.4485
 epoch: 52, train_loss: 0.9585, test_loss: 1.0659, test_f1: 0.4005
 epoch: 53, train_loss: 0.9530, test_loss: 1.0656, test_f1: 0.4479
 epoch: 54, train_loss: 0.9529, test_loss: 1.0447, test_f1: 0.3372
 epoch: 55, train_loss: 0.9474, test_loss: 1.0725, test_f1: 0.3344
 epoch: 56, train_loss: 0.9660, test_loss: 1.0613, test_f1: 0.3395
 epoch: 57, train_loss: 0.9573, test_loss: 1.0757, test_f1: 0.4795
 epoch: 58, train_loss: 0.9592, test_loss: 1.1591, test_f1: 0.4446
 epoch: 59, train_loss: 0.9556, test_loss: 1.1781, test_f1: 0.4477
 epoch: 60, train_loss: 0.9514, test_loss: 1.0839, test_f1: 0.4434
 epoch: 61, train_loss: 0.9509, test_loss: 1.0773, test_f1: 0.3397
 epoch: 62, train_loss: 0.9538, test_loss: 1.0624, test_f1: 0.3492
 epoch: 63, train_loss: 0.9827, test_loss: 1.0650, test_f1: 0.4989
 epoch: 64, train_loss: 0.9424, test_loss: 1.0575, test_f1: 0.4526
 epoch: 65, train_loss: 0.9676, test_loss: 1.0924, test_f1: 0.3390
 epoch: 66, train_loss: 0.9456, test_loss: 1.1295, test_f1: 0.4597
 epoch: 67, train_loss: 0.9840, test_loss: 1.2324, test_f1: 0.3010
 epoch: 68, train_loss: 0.9577, test_loss: 1.1849, test_f1: 0.4406
 epoch: 69, train_loss: 0.9554, test_loss: 1.0686, test_f1: 0.4844
 epoch: 70, train_loss: 0.9546, test_loss: 1.0576, test_f1: 0.3603
 epoch: 71, train_loss: 0.9406, test_loss: 1.0631, test_f1: 0.3397
 epoch: 72, train_loss: 0.9505, test_loss: 1.1041, test_f1: 0.3228
 epoch: 73, train_loss: 0.9969, test_loss: 1.0615, test_f1: 0.3420
 epoch: 74, train_loss: 0.9707, test_loss: 1.0700, test_f1: 0.4814
 epoch: 75, train_loss: 0.9557, test_loss: 1.0941, test_f1: 0.3302
 epoch: 76, train_loss: 0.9462, test_loss: 1.0888, test_f1: 0.3231
 epoch: 77, train_loss: 0.9460, test_loss: 1.1590, test_f1: 0.4015
 epoch: 78, train_loss: 0.9414, test_loss: 1.1913, test_f1: 0.3385
 epoch: 79, train_loss: 0.9449, test_loss: 1.1558, test_f1: 0.3344
 epoch: 80, train_loss: 0.9558, test_loss: 1.0483, test_f1: 0.3914
 epoch: 81, train_loss: 0.9790, test_loss: 1.0513, test_f1: 0.4223
 epoch: 82, train_loss: 0.9647, test_loss: 1.0848, test_f1: 0.3420
 epoch: 83, train_loss: 0.9568, test_loss: 1.0760, test_f1: 0.3420
 epoch: 84, train_loss: 0.9479, test_loss: 1.0557, test_f1: 0.3428
 epoch: 85, train_loss: 0.9503, test_loss: 1.1607, test_f1: 0.3532
 epoch: 86, train_loss: 0.9415, test_loss: 1.2808, test_f1: 0.2959
 epoch: 87, train_loss: 0.9385, test_loss: 1.0667, test_f1: 0.3310
 epoch: 88, train_loss: 0.9454, test_loss: 1.0758, test_f1: 0.3332
 epoch: 89, train_loss: 0.9355, test_loss: 1.1044, test_f1: 0.4518
 epoch: 90, train_loss: 0.9459, test_loss: 1.1408, test_f1: 0.4590
 epoch: 91, train_loss: 0.9281, test_loss: 1.1017, test_f1: 0.4315
 epoch: 92, train_loss: 0.9344, test_loss: 1.1153, test_f1: 0.3574
 epoch: 93, train_loss: 0.9441, test_loss: 1.2587, test_f1: 0.4384
 epoch: 94, train_loss: 0.9490, test_loss: 1.1168, test_f1: 0.3856
 epoch: 95, train_loss: 0.9400, test_loss: 1.1299, test_f1: 0.3395
 epoch: 96, train_loss: 0.9378, test_loss: 1.0790, test_f1: 0.3694
 epoch: 97, train_loss: 0.9354, test_loss: 1.0677, test_f1: 0.3805
 epoch: 98, train_loss: 0.9521, test_loss: 1.0435, test_f1: 0.4380
 epoch: 99, train_loss: 0.9413, test_loss: 1.0919, test_f1: 0.3395
##################ITERATION #3 ****************************************
 epoch: 0, train_loss: 1.9283, test_loss: 11.3919, test_f1: 0.1365
 epoch: 1, train_loss: 1.1852, test_loss: 1.6422, test_f1: 0.2186
 epoch: 2, train_loss: 1.1045, test_loss: 1.4263, test_f1: 0.2651
 epoch: 3, train_loss: 1.0685, test_loss: 1.4331, test_f1: 0.2897
 epoch: 4, train_loss: 1.0644, test_loss: 1.1667, test_f1: 0.3317
 epoch: 5, train_loss: 1.0751, test_loss: 1.2785, test_f1: 0.2343
 epoch: 6, train_loss: 1.0583, test_loss: 1.1340, test_f1: 0.3333
 epoch: 7, train_loss: 1.0716, test_loss: 1.1724, test_f1: 0.4360
 epoch: 8, train_loss: 1.0697, test_loss: 1.2690, test_f1: 0.2905
 epoch: 9, train_loss: 1.0485, test_loss: 1.1715, test_f1: 0.3209
 epoch: 10, train_loss: 1.0521, test_loss: 1.2808, test_f1: 0.2913
 epoch: 11, train_loss: 1.0377, test_loss: 1.1725, test_f1: 0.3283
 epoch: 12, train_loss: 1.0574, test_loss: 1.2396, test_f1: 0.3051
 epoch: 13, train_loss: 1.0591, test_loss: 1.1557, test_f1: 0.3262
 epoch: 14, train_loss: 1.0512, test_loss: 1.1774, test_f1: 0.4084
 epoch: 15, train_loss: 1.0508, test_loss: 1.3181, test_f1: 0.3225
 epoch: 16, train_loss: 1.0510, test_loss: 1.2762, test_f1: 0.2925
 epoch: 17, train_loss: 1.0312, test_loss: 1.1895, test_f1: 0.4456
 epoch: 18, train_loss: 1.0513, test_loss: 1.1096, test_f1: 0.3706
 epoch: 19, train_loss: 1.0286, test_loss: 1.1225, test_f1: 0.3668
 epoch: 20, train_loss: 1.0245, test_loss: 1.1236, test_f1: 0.3278
 epoch: 21, train_loss: 1.0480, test_loss: 1.1720, test_f1: 0.4507
 epoch: 22, train_loss: 1.0453, test_loss: 1.1171, test_f1: 0.4611
 epoch: 23, train_loss: 1.0469, test_loss: 1.1159, test_f1: 0.3328
 epoch: 24, train_loss: 1.0531, test_loss: 1.1991, test_f1: 0.3795
 epoch: 25, train_loss: 1.0460, test_loss: 1.3885, test_f1: 0.2782
 epoch: 26, train_loss: 1.0400, test_loss: 1.1379, test_f1: 0.3287
 epoch: 27, train_loss: 1.0078, test_loss: 1.1182, test_f1: 0.4594
 epoch: 28, train_loss: 1.0013, test_loss: 1.2076, test_f1: 0.3290
 epoch: 29, train_loss: 1.0046, test_loss: 1.2526, test_f1: 0.4343
 epoch: 30, train_loss: 1.0050, test_loss: 1.1721, test_f1: 0.3610
 epoch: 31, train_loss: 0.9969, test_loss: 1.2585, test_f1: 0.4577
 epoch: 32, train_loss: 0.9914, test_loss: 1.1624, test_f1: 0.4392
 epoch: 33, train_loss: 0.9963, test_loss: 1.1143, test_f1: 0.3716
 epoch: 34, train_loss: 0.9869, test_loss: 1.1934, test_f1: 0.4656
 epoch: 35, train_loss: 0.9839, test_loss: 1.1081, test_f1: 0.3716
 epoch: 36, train_loss: 0.9817, test_loss: 1.1963, test_f1: 0.4447
 epoch: 37, train_loss: 0.9817, test_loss: 1.1035, test_f1: 0.3395
 epoch: 38, train_loss: 0.9802, test_loss: 1.1562, test_f1: 0.3738
 epoch: 39, train_loss: 0.9962, test_loss: 1.1611, test_f1: 0.4656
 epoch: 40, train_loss: 0.9893, test_loss: 1.0954, test_f1: 0.3395
 epoch: 41, train_loss: 0.9973, test_loss: 1.2589, test_f1: 0.4239
 epoch: 42, train_loss: 0.9986, test_loss: 1.2029, test_f1: 0.3146
 epoch: 43, train_loss: 0.9945, test_loss: 1.3237, test_f1: 0.4399
 epoch: 44, train_loss: 0.9754, test_loss: 3.7800, test_f1: 0.0406
 epoch: 45, train_loss: 0.9872, test_loss: 1.1812, test_f1: 0.4334
 epoch: 46, train_loss: 1.0015, test_loss: 1.1464, test_f1: 0.4480
 epoch: 47, train_loss: 0.9961, test_loss: 1.4824, test_f1: 0.3376
 epoch: 48, train_loss: 0.9913, test_loss: 1.1127, test_f1: 0.4425
 epoch: 49, train_loss: 0.9795, test_loss: 1.1248, test_f1: 0.3310
 epoch: 50, train_loss: 0.9880, test_loss: 1.1087, test_f1: 0.4681
 epoch: 51, train_loss: 0.9656, test_loss: 1.0820, test_f1: 0.3924
 epoch: 52, train_loss: 0.9625, test_loss: 1.1081, test_f1: 0.3349
 epoch: 53, train_loss: 0.9612, test_loss: 1.1043, test_f1: 0.4070
 epoch: 54, train_loss: 0.9601, test_loss: 1.1059, test_f1: 0.4204
 epoch: 55, train_loss: 0.9608, test_loss: 1.1232, test_f1: 0.4240
 epoch: 56, train_loss: 0.9411, test_loss: 1.1304, test_f1: 0.4580
 epoch: 57, train_loss: 0.9517, test_loss: 1.1555, test_f1: 0.4773
 epoch: 58, train_loss: 0.9463, test_loss: 1.2501, test_f1: 0.4359
 epoch: 59, train_loss: 0.9528, test_loss: 1.1156, test_f1: 0.4161
 epoch: 60, train_loss: 0.9346, test_loss: 1.1432, test_f1: 0.4600
 epoch: 61, train_loss: 0.9471, test_loss: 1.1381, test_f1: 0.3354
 epoch: 62, train_loss: 0.9534, test_loss: 1.1407, test_f1: 0.3295
 epoch: 63, train_loss: 0.9657, test_loss: 1.1049, test_f1: 0.3708
 epoch: 64, train_loss: 0.9540, test_loss: 1.1092, test_f1: 0.4682
 epoch: 65, train_loss: 0.9557, test_loss: 1.1391, test_f1: 0.3336
 epoch: 66, train_loss: 0.9605, test_loss: 1.1020, test_f1: 0.4828
 epoch: 67, train_loss: 0.9413, test_loss: 1.1404, test_f1: 0.3578
 epoch: 68, train_loss: 0.9559, test_loss: 1.1339, test_f1: 0.4805
 epoch: 69, train_loss: 0.9586, test_loss: 1.0804, test_f1: 0.4732
 epoch: 70, train_loss: 0.9447, test_loss: 1.0945, test_f1: 0.3395
 epoch: 71, train_loss: 0.9467, test_loss: 1.1721, test_f1: 0.4343
 epoch: 72, train_loss: 0.9421, test_loss: 1.1097, test_f1: 0.4700
 epoch: 73, train_loss: 0.9533, test_loss: 1.0894, test_f1: 0.3353
 epoch: 74, train_loss: 0.9702, test_loss: 1.0519, test_f1: 0.3708
 epoch: 75, train_loss: 0.9590, test_loss: 1.1567, test_f1: 0.4009
 epoch: 76, train_loss: 0.9694, test_loss: 1.0872, test_f1: 0.3316
 epoch: 77, train_loss: 0.9485, test_loss: 1.1742, test_f1: 0.4402
 epoch: 78, train_loss: 0.9391, test_loss: 1.2250, test_f1: 0.4782
 epoch: 79, train_loss: 0.9315, test_loss: 1.2698, test_f1: 0.5022
 epoch: 80, train_loss: 0.9264, test_loss: 1.0933, test_f1: 0.5028
 epoch: 81, train_loss: 0.9374, test_loss: 1.0367, test_f1: 0.3847
 epoch: 82, train_loss: 0.9280, test_loss: 1.3167, test_f1: 0.4511
 epoch: 83, train_loss: 0.9351, test_loss: 1.2243, test_f1: 0.4739
 epoch: 84, train_loss: 0.9405, test_loss: 1.2296, test_f1: 0.3653
 epoch: 85, train_loss: 0.9308, test_loss: 1.1277, test_f1: 0.3451
 epoch: 86, train_loss: 0.9592, test_loss: 1.1072, test_f1: 0.3849
 epoch: 87, train_loss: 0.9365, test_loss: 1.0802, test_f1: 0.5030
 epoch: 88, train_loss: 0.9215, test_loss: 1.0904, test_f1: 0.5096
 epoch: 89, train_loss: 0.9585, test_loss: 1.1926, test_f1: 0.5023
 epoch: 90, train_loss: 0.9518, test_loss: 1.2857, test_f1: 0.3925
 epoch: 91, train_loss: 0.9567, test_loss: 1.1079, test_f1: 0.4426
 epoch: 92, train_loss: 0.9793, test_loss: 1.1394, test_f1: 0.3504
 epoch: 93, train_loss: 0.9349, test_loss: 1.1018, test_f1: 0.4804
 epoch: 94, train_loss: 0.9470, test_loss: 1.1262, test_f1: 0.3524
 epoch: 95, train_loss: 1.0083, test_loss: 1.2060, test_f1: 0.2885
 epoch: 96, train_loss: 0.9768, test_loss: 1.1016, test_f1: 0.3833
 epoch: 97, train_loss: 0.9641, test_loss: 1.0664, test_f1: 0.3663
 epoch: 98, train_loss: 0.9588, test_loss: 1.1350, test_f1: 0.4560
 epoch: 99, train_loss: 0.9548, test_loss: 1.0849, test_f1: 0.4754
##################ITERATION #4 ****************************************
 epoch: 0, train_loss: 1.6241, test_loss: 3.0763, test_f1: 0.1382
 epoch: 1, train_loss: 1.2315, test_loss: 2.4037, test_f1: 0.1365
 epoch: 2, train_loss: 1.1273, test_loss: 1.7905, test_f1: 0.2832
 epoch: 3, train_loss: 1.0897, test_loss: 1.3292, test_f1: 0.2625
 epoch: 4, train_loss: 1.0551, test_loss: 1.1754, test_f1: 0.4548
 epoch: 5, train_loss: 1.0728, test_loss: 1.2031, test_f1: 0.3262
 epoch: 6, train_loss: 1.0521, test_loss: 1.1289, test_f1: 0.3335
 epoch: 7, train_loss: 1.0332, test_loss: 1.0968, test_f1: 0.4453
 epoch: 8, train_loss: 1.0253, test_loss: 1.0885, test_f1: 0.3395
 epoch: 9, train_loss: 1.0061, test_loss: 1.0625, test_f1: 0.4541
 epoch: 10, train_loss: 1.0133, test_loss: 1.0949, test_f1: 0.3395
 epoch: 11, train_loss: 1.0074, test_loss: 1.1101, test_f1: 0.4426
 epoch: 12, train_loss: 0.9948, test_loss: 1.1114, test_f1: 0.4570
 epoch: 13, train_loss: 0.9935, test_loss: 1.1074, test_f1: 0.3432
 epoch: 14, train_loss: 1.0379, test_loss: 1.5076, test_f1: 0.3802
 epoch: 15, train_loss: 1.0303, test_loss: 1.4566, test_f1: 0.2852
 epoch: 16, train_loss: 1.0197, test_loss: 1.1257, test_f1: 0.4418
 epoch: 17, train_loss: 1.0095, test_loss: 1.2238, test_f1: 0.4445
 epoch: 18, train_loss: 1.0093, test_loss: 1.1809, test_f1: 0.3395
 epoch: 19, train_loss: 1.0017, test_loss: 1.1484, test_f1: 0.4433
 epoch: 20, train_loss: 0.9860, test_loss: 1.0862, test_f1: 0.3373
 epoch: 21, train_loss: 1.0072, test_loss: 1.1075, test_f1: 0.3812
 epoch: 22, train_loss: 1.0120, test_loss: 1.1615, test_f1: 0.3290
 epoch: 23, train_loss: 1.0006, test_loss: 1.1490, test_f1: 0.3778
 epoch: 24, train_loss: 1.0089, test_loss: 1.1003, test_f1: 0.3322
 epoch: 25, train_loss: 1.0416, test_loss: 1.1255, test_f1: 0.3395
 epoch: 26, train_loss: 1.0293, test_loss: 1.1729, test_f1: 0.2432
 epoch: 27, train_loss: 1.0476, test_loss: 1.1369, test_f1: 0.3344
 epoch: 28, train_loss: 1.0308, test_loss: 1.1451, test_f1: 0.3395
 epoch: 29, train_loss: 1.0129, test_loss: 1.1954, test_f1: 0.3297
 epoch: 30, train_loss: 1.0265, test_loss: 1.2200, test_f1: 0.3254
 epoch: 31, train_loss: 1.0274, test_loss: 1.1754, test_f1: 0.3262
 epoch: 32, train_loss: 1.0157, test_loss: 1.1256, test_f1: 0.3344
 epoch: 33, train_loss: 1.0012, test_loss: 1.2554, test_f1: 0.4004
 epoch: 34, train_loss: 1.0233, test_loss: 1.2415, test_f1: 0.2876
 epoch: 35, train_loss: 1.0120, test_loss: 1.1343, test_f1: 0.3290
 epoch: 36, train_loss: 1.0313, test_loss: 1.0750, test_f1: 0.3395
 epoch: 37, train_loss: 1.0566, test_loss: 1.0741, test_f1: 0.3375
 epoch: 38, train_loss: 1.0584, test_loss: 1.3044, test_f1: 0.3057
 epoch: 39, train_loss: 1.0182, test_loss: 1.1830, test_f1: 0.2834
 epoch: 40, train_loss: 1.0742, test_loss: 1.1758, test_f1: 0.3146
 epoch: 41, train_loss: 1.0337, test_loss: 1.1320, test_f1: 0.3603
 epoch: 42, train_loss: 1.0121, test_loss: 1.1217, test_f1: 0.3317
 epoch: 43, train_loss: 1.0018, test_loss: 1.1276, test_f1: 0.4110
 epoch: 44, train_loss: 1.0194, test_loss: 1.1624, test_f1: 0.3205
 epoch: 45, train_loss: 1.1245, test_loss: 1.3113, test_f1: 0.2281
 epoch: 46, train_loss: 1.0775, test_loss: 1.2474, test_f1: 0.2799
 epoch: 47, train_loss: 1.0376, test_loss: 1.1598, test_f1: 0.3290
 epoch: 48, train_loss: 1.0366, test_loss: 1.1499, test_f1: 0.3295
 epoch: 49, train_loss: 1.0181, test_loss: 1.1296, test_f1: 0.3589
 epoch: 50, train_loss: 1.0096, test_loss: 1.1218, test_f1: 0.3639
 epoch: 51, train_loss: 1.0140, test_loss: 1.1023, test_f1: 0.3344
 epoch: 52, train_loss: 0.9909, test_loss: 1.1141, test_f1: 0.4313
 epoch: 53, train_loss: 0.9919, test_loss: 1.1541, test_f1: 0.4432
 epoch: 54, train_loss: 0.9836, test_loss: 1.1264, test_f1: 0.3656
 epoch: 55, train_loss: 0.9802, test_loss: 1.1261, test_f1: 0.4345
 epoch: 56, train_loss: 0.9742, test_loss: 1.1606, test_f1: 0.4626
 epoch: 57, train_loss: 0.9791, test_loss: 1.1247, test_f1: 0.3395
 epoch: 58, train_loss: 0.9837, test_loss: 1.1868, test_f1: 0.4369
 epoch: 59, train_loss: 0.9770, test_loss: 1.1238, test_f1: 0.3553
 epoch: 60, train_loss: 0.9793, test_loss: 1.0828, test_f1: 0.4404
 epoch: 61, train_loss: 0.9801, test_loss: 1.1070, test_f1: 0.3644
 epoch: 62, train_loss: 0.9829, test_loss: 1.0858, test_f1: 0.3656
 epoch: 63, train_loss: 0.9742, test_loss: 1.0840, test_f1: 0.4516
 epoch: 64, train_loss: 0.9781, test_loss: 1.0839, test_f1: 0.3395
 epoch: 65, train_loss: 0.9612, test_loss: 1.0791, test_f1: 0.3912
 epoch: 66, train_loss: 0.9718, test_loss: 1.0706, test_f1: 0.3395
 epoch: 67, train_loss: 0.9716, test_loss: 1.0937, test_f1: 0.4459
 epoch: 68, train_loss: 0.9693, test_loss: 1.1073, test_f1: 0.4519
 epoch: 69, train_loss: 0.9555, test_loss: 1.0909, test_f1: 0.3372
 epoch: 70, train_loss: 0.9575, test_loss: 1.0687, test_f1: 0.4677
 epoch: 71, train_loss: 0.9523, test_loss: 1.0637, test_f1: 0.3400
 epoch: 72, train_loss: 0.9564, test_loss: 1.1009, test_f1: 0.4545
 epoch: 73, train_loss: 1.0053, test_loss: 1.0623, test_f1: 0.3418
 epoch: 74, train_loss: 1.0219, test_loss: 1.0761, test_f1: 0.3344
 epoch: 75, train_loss: 0.9895, test_loss: 1.2095, test_f1: 0.4307
 epoch: 76, train_loss: 0.9818, test_loss: 1.0588, test_f1: 0.3395
 epoch: 77, train_loss: 0.9802, test_loss: 1.0748, test_f1: 0.3683
 epoch: 78, train_loss: 0.9672, test_loss: 1.0644, test_f1: 0.3971
 epoch: 79, train_loss: 0.9686, test_loss: 1.1268, test_f1: 0.4474
 epoch: 80, train_loss: 0.9880, test_loss: 1.0636, test_f1: 0.3445
 epoch: 81, train_loss: 0.9822, test_loss: 1.0546, test_f1: 0.4435
 epoch: 82, train_loss: 0.9607, test_loss: 1.0489, test_f1: 0.3395
 epoch: 83, train_loss: 0.9989, test_loss: 1.1271, test_f1: 0.3300
 epoch: 84, train_loss: 1.0389, test_loss: 1.0869, test_f1: 0.4028
 epoch: 85, train_loss: 1.0145, test_loss: 1.1861, test_f1: 0.3146
 epoch: 86, train_loss: 0.9865, test_loss: 1.1456, test_f1: 0.3290
 epoch: 87, train_loss: 1.0235, test_loss: 1.1395, test_f1: 0.3290
 epoch: 88, train_loss: 0.9954, test_loss: 1.1558, test_f1: 0.4563
 epoch: 89, train_loss: 0.9799, test_loss: 1.1440, test_f1: 0.4014
 epoch: 90, train_loss: 0.9852, test_loss: 1.0623, test_f1: 0.3344
 epoch: 91, train_loss: 0.9927, test_loss: 1.0562, test_f1: 0.4756
 epoch: 92, train_loss: 0.9923, test_loss: 1.0471, test_f1: 0.3347
 epoch: 93, train_loss: 0.9757, test_loss: 1.1076, test_f1: 0.4560
 epoch: 94, train_loss: 0.9914, test_loss: 1.0522, test_f1: 0.3389
 epoch: 95, train_loss: 1.0044, test_loss: 1.1184, test_f1: 0.3395
 epoch: 96, train_loss: 0.9907, test_loss: 1.1261, test_f1: 0.4486
 epoch: 97, train_loss: 0.9687, test_loss: 1.1956, test_f1: 0.4642
 epoch: 98, train_loss: 0.9753, test_loss: 1.0709, test_f1: 0.3395
 epoch: 99, train_loss: 0.9697, test_loss: 1.0479, test_f1: 0.4344
##################ITERATION #5 ****************************************
 epoch: 0, train_loss: 1.6940, test_loss: 14.7221, test_f1: 0.1365
 epoch: 1, train_loss: 1.4194, test_loss: 1.7609, test_f1: 0.0450
 epoch: 2, train_loss: 1.2044, test_loss: 1.3445, test_f1: 0.2440
 epoch: 3, train_loss: 1.1229, test_loss: 1.2104, test_f1: 0.3951
 epoch: 4, train_loss: 1.0716, test_loss: 1.1410, test_f1: 0.4320
 epoch: 5, train_loss: 1.0508, test_loss: 1.1721, test_f1: 0.3005
 epoch: 6, train_loss: 1.0401, test_loss: 1.1281, test_f1: 0.3769
 epoch: 7, train_loss: 1.0483, test_loss: 1.1556, test_f1: 0.4334
 epoch: 8, train_loss: 1.0310, test_loss: 1.1894, test_f1: 0.3594
 epoch: 9, train_loss: 1.0252, test_loss: 1.1792, test_f1: 0.3922
 epoch: 10, train_loss: 1.0309, test_loss: 1.2378, test_f1: 0.3051
 epoch: 11, train_loss: 1.1201, test_loss: 1.4904, test_f1: 0.3595
 epoch: 12, train_loss: 1.0807, test_loss: 1.2082, test_f1: 0.4116
 epoch: 13, train_loss: 1.0481, test_loss: 1.2026, test_f1: 0.3594
 epoch: 14, train_loss: 1.0475, test_loss: 1.2189, test_f1: 0.3004
 epoch: 15, train_loss: 1.0305, test_loss: 1.2286, test_f1: 0.3373
 epoch: 16, train_loss: 1.0476, test_loss: 1.1518, test_f1: 0.4247
 epoch: 17, train_loss: 1.0153, test_loss: 1.1138, test_f1: 0.4461
 epoch: 18, train_loss: 1.0162, test_loss: 1.2877, test_f1: 0.3146
 epoch: 19, train_loss: 1.0106, test_loss: 1.1381, test_f1: 0.4393
 epoch: 20, train_loss: 0.9978, test_loss: 1.2384, test_f1: 0.3975
 epoch: 21, train_loss: 0.9947, test_loss: 1.1084, test_f1: 0.3317
 epoch: 22, train_loss: 1.0213, test_loss: 1.2891, test_f1: 0.3371
 epoch: 23, train_loss: 1.0025, test_loss: 1.2304, test_f1: 0.4624
 epoch: 24, train_loss: 1.0059, test_loss: 1.0929, test_f1: 0.4706
 epoch: 25, train_loss: 1.0089, test_loss: 1.0823, test_f1: 0.4518
 epoch: 26, train_loss: 0.9971, test_loss: 1.1230, test_f1: 0.4448
 epoch: 27, train_loss: 0.9843, test_loss: 1.1832, test_f1: 0.4588
 epoch: 28, train_loss: 0.9867, test_loss: 1.0816, test_f1: 0.4320
 epoch: 29, train_loss: 0.9961, test_loss: 1.1208, test_f1: 0.4611
 epoch: 30, train_loss: 1.0138, test_loss: 1.1959, test_f1: 0.4348
 epoch: 31, train_loss: 1.0035, test_loss: 1.1222, test_f1: 0.4745
 epoch: 32, train_loss: 0.9718, test_loss: 1.1128, test_f1: 0.3370
 epoch: 33, train_loss: 1.0078, test_loss: 1.1225, test_f1: 0.3383
 epoch: 34, train_loss: 0.9994, test_loss: 2.0473, test_f1: 0.3057
 epoch: 35, train_loss: 0.9817, test_loss: 1.7517, test_f1: 0.3794
 epoch: 36, train_loss: 0.9901, test_loss: 1.1004, test_f1: 0.4554
 epoch: 37, train_loss: 1.0801, test_loss: 1.0957, test_f1: 0.4492
 epoch: 38, train_loss: 1.0587, test_loss: 1.3572, test_f1: 0.4087
 epoch: 39, train_loss: 1.0447, test_loss: 1.2042, test_f1: 0.3225
 epoch: 40, train_loss: 1.0292, test_loss: 1.1924, test_f1: 0.4523
 epoch: 41, train_loss: 1.0165, test_loss: 1.3407, test_f1: 0.4262
 epoch: 42, train_loss: 1.0224, test_loss: 1.0932, test_f1: 0.3395
 epoch: 43, train_loss: 1.0002, test_loss: 1.0862, test_f1: 0.3388
 epoch: 44, train_loss: 0.9889, test_loss: 1.3724, test_f1: 0.4324
 epoch: 45, train_loss: 1.0064, test_loss: 1.6298, test_f1: 0.2458
 epoch: 46, train_loss: 0.9938, test_loss: 1.1838, test_f1: 0.4119
 epoch: 47, train_loss: 0.9849, test_loss: 1.0762, test_f1: 0.4525
 epoch: 48, train_loss: 0.9924, test_loss: 1.0872, test_f1: 0.3420
 epoch: 49, train_loss: 0.9933, test_loss: 1.1526, test_f1: 0.4371
 epoch: 50, train_loss: 0.9968, test_loss: 1.1004, test_f1: 0.3344
 epoch: 51, train_loss: 0.9729, test_loss: 1.1625, test_f1: 0.3987
 epoch: 52, train_loss: 0.9589, test_loss: 1.2466, test_f1: 0.4812
 epoch: 53, train_loss: 0.9502, test_loss: 1.0647, test_f1: 0.4744
 epoch: 54, train_loss: 0.9602, test_loss: 1.0472, test_f1: 0.4552
 epoch: 55, train_loss: 0.9435, test_loss: 1.0267, test_f1: 0.3420
 epoch: 56, train_loss: 0.9558, test_loss: 1.1057, test_f1: 0.4230
 epoch: 57, train_loss: 0.9742, test_loss: 1.0905, test_f1: 0.3440
 epoch: 58, train_loss: 0.9618, test_loss: 1.0731, test_f1: 0.3468
 epoch: 59, train_loss: 0.9590, test_loss: 1.0886, test_f1: 0.4685
 epoch: 60, train_loss: 0.9542, test_loss: 1.0454, test_f1: 0.4105
 epoch: 61, train_loss: 0.9508, test_loss: 1.1120, test_f1: 0.4661
 epoch: 62, train_loss: 0.9553, test_loss: 1.2390, test_f1: 0.4463
 epoch: 63, train_loss: 0.9642, test_loss: 1.0612, test_f1: 0.3400
 epoch: 64, train_loss: 0.9529, test_loss: 1.0460, test_f1: 0.3444
 epoch: 65, train_loss: 0.9367, test_loss: 1.0446, test_f1: 0.4441
 epoch: 66, train_loss: 0.9519, test_loss: 1.2444, test_f1: 0.4497
 epoch: 67, train_loss: 0.9484, test_loss: 1.1688, test_f1: 0.4237
 epoch: 68, train_loss: 0.9479, test_loss: 1.0077, test_f1: 0.3702
 epoch: 69, train_loss: 0.9427, test_loss: 1.1598, test_f1: 0.4418
 epoch: 70, train_loss: 0.9560, test_loss: 1.1288, test_f1: 0.4235
 epoch: 71, train_loss: 0.9567, test_loss: 1.0553, test_f1: 0.4182
 epoch: 72, train_loss: 0.9413, test_loss: 1.1193, test_f1: 0.3550
 epoch: 73, train_loss: 0.9539, test_loss: 1.0625, test_f1: 0.3526
 epoch: 74, train_loss: 0.9480, test_loss: 1.0228, test_f1: 0.4327
 epoch: 75, train_loss: 0.9364, test_loss: 1.0548, test_f1: 0.3425
 epoch: 76, train_loss: 0.9354, test_loss: 1.0258, test_f1: 0.3614
 epoch: 77, train_loss: 0.9428, test_loss: 1.1757, test_f1: 0.4119
 epoch: 78, train_loss: 0.9505, test_loss: 1.3621, test_f1: 0.3195
 epoch: 79, train_loss: 0.9560, test_loss: 1.0843, test_f1: 0.3562
 epoch: 80, train_loss: 0.9575, test_loss: 1.1389, test_f1: 0.3377
 epoch: 81, train_loss: 0.9436, test_loss: 1.2383, test_f1: 0.4288
 epoch: 82, train_loss: 0.9366, test_loss: 1.1048, test_f1: 0.4299
 epoch: 83, train_loss: 0.9272, test_loss: 1.2289, test_f1: 0.4478
 epoch: 84, train_loss: 0.9111, test_loss: 1.0700, test_f1: 0.3926
 epoch: 85, train_loss: 0.9210, test_loss: 1.1146, test_f1: 0.4058
 epoch: 86, train_loss: 0.9141, test_loss: 1.1494, test_f1: 0.4160
 epoch: 87, train_loss: 0.9451, test_loss: 1.2941, test_f1: 0.4477
 epoch: 88, train_loss: 0.9517, test_loss: 1.1201, test_f1: 0.4029
 epoch: 89, train_loss: 0.9477, test_loss: 1.1062, test_f1: 0.3509
 epoch: 90, train_loss: 0.9245, test_loss: 1.2080, test_f1: 0.4216
 epoch: 91, train_loss: 0.9394, test_loss: 1.0014, test_f1: 0.4218
 epoch: 92, train_loss: 0.9298, test_loss: 1.0487, test_f1: 0.3848
 epoch: 93, train_loss: 0.9061, test_loss: 0.9997, test_f1: 0.5235
 epoch: 94, train_loss: 0.9053, test_loss: 1.1437, test_f1: 0.3895
 epoch: 95, train_loss: 0.8995, test_loss: 1.2149, test_f1: 0.5378
 epoch: 96, train_loss: 0.9081, test_loss: 1.0179, test_f1: 0.4251
 epoch: 97, train_loss: 0.9133, test_loss: 1.1918, test_f1: 0.3852
 epoch: 98, train_loss: 0.9093, test_loss: 1.2033, test_f1: 0.3773
 epoch: 99, train_loss: 0.9110, test_loss: 1.0118, test_f1: 0.4382
##################ITERATION #6 ****************************************
 epoch: 0, train_loss: 1.6394, test_loss: 2.7381, test_f1: 0.2281
 epoch: 1, train_loss: 1.2462, test_loss: 4.8334, test_f1: 0.1365
 epoch: 2, train_loss: 1.1583, test_loss: 1.8224, test_f1: 0.3199
 epoch: 3, train_loss: 1.1024, test_loss: 1.4473, test_f1: 0.3912
 epoch: 4, train_loss: 1.1067, test_loss: 1.2011, test_f1: 0.3368
 epoch: 5, train_loss: 1.0520, test_loss: 1.2520, test_f1: 0.3725
 epoch: 6, train_loss: 1.0422, test_loss: 1.3877, test_f1: 0.3089
 epoch: 7, train_loss: 1.0423, test_loss: 1.2527, test_f1: 0.4254
 epoch: 8, train_loss: 1.0341, test_loss: 1.3250, test_f1: 0.4119
 epoch: 9, train_loss: 1.0196, test_loss: 1.4411, test_f1: 0.4344
 epoch: 10, train_loss: 1.0181, test_loss: 1.1555, test_f1: 0.3272
 epoch: 11, train_loss: 1.0257, test_loss: 1.2115, test_f1: 0.3607
 epoch: 12, train_loss: 1.0104, test_loss: 1.1800, test_f1: 0.4171
 epoch: 13, train_loss: 1.0132, test_loss: 1.1913, test_f1: 0.4345
 epoch: 14, train_loss: 0.9943, test_loss: 1.1721, test_f1: 0.4500
 epoch: 15, train_loss: 0.9934, test_loss: 1.1394, test_f1: 0.3400
 epoch: 16, train_loss: 1.0293, test_loss: 1.0970, test_f1: 0.4307
 epoch: 17, train_loss: 1.0246, test_loss: 1.1190, test_f1: 0.3896
 epoch: 18, train_loss: 1.0132, test_loss: 1.0898, test_f1: 0.4235
 epoch: 19, train_loss: 1.0109, test_loss: 1.0976, test_f1: 0.3327
 epoch: 20, train_loss: 1.0042, test_loss: 1.2986, test_f1: 0.3755
 epoch: 21, train_loss: 0.9893, test_loss: 1.1663, test_f1: 0.4538
 epoch: 22, train_loss: 0.9912, test_loss: 1.1527, test_f1: 0.3317
 epoch: 23, train_loss: 1.0625, test_loss: 1.5645, test_f1: 0.2803
 epoch: 24, train_loss: 1.0544, test_loss: 1.1694, test_f1: 0.2960
 epoch: 25, train_loss: 1.0400, test_loss: 1.1150, test_f1: 0.3290
 epoch: 26, train_loss: 1.0188, test_loss: 1.1270, test_f1: 0.4541
 epoch: 27, train_loss: 1.0146, test_loss: 1.1964, test_f1: 0.3373
 epoch: 28, train_loss: 1.0010, test_loss: 1.5027, test_f1: 0.2536
 epoch: 29, train_loss: 1.0029, test_loss: 1.1037, test_f1: 0.3451
 epoch: 30, train_loss: 0.9855, test_loss: 1.2974, test_f1: 0.4497
 epoch: 31, train_loss: 0.9951, test_loss: 1.3237, test_f1: 0.4413
 epoch: 32, train_loss: 0.9747, test_loss: 1.2984, test_f1: 0.3428
 epoch: 33, train_loss: 0.9829, test_loss: 1.0954, test_f1: 0.4732
 epoch: 34, train_loss: 0.9819, test_loss: 1.1253, test_f1: 0.4883
 epoch: 35, train_loss: 0.9643, test_loss: 1.1965, test_f1: 0.4544
 epoch: 36, train_loss: 0.9709, test_loss: 1.2834, test_f1: 0.4358
 epoch: 37, train_loss: 0.9836, test_loss: 1.5394, test_f1: 0.3239
 epoch: 38, train_loss: 1.0432, test_loss: 1.3759, test_f1: 0.3493
 epoch: 39, train_loss: 1.0221, test_loss: 5.4679, test_f1: 0.2067
 epoch: 40, train_loss: 1.0084, test_loss: 1.3259, test_f1: 0.3420
 epoch: 41, train_loss: 0.9983, test_loss: 1.1070, test_f1: 0.4521
 epoch: 42, train_loss: 0.9784, test_loss: 1.2972, test_f1: 0.4318
 epoch: 43, train_loss: 0.9594, test_loss: 1.2804, test_f1: 0.3813
 epoch: 44, train_loss: 0.9745, test_loss: 1.7039, test_f1: 0.3599
 epoch: 45, train_loss: 0.9758, test_loss: 1.2716, test_f1: 0.4076
 epoch: 46, train_loss: 0.9728, test_loss: 1.1490, test_f1: 0.4562
 epoch: 47, train_loss: 0.9671, test_loss: 1.1013, test_f1: 0.3598
 epoch: 48, train_loss: 0.9947, test_loss: 1.0885, test_f1: 0.3295
 epoch: 49, train_loss: 0.9972, test_loss: 1.0945, test_f1: 0.4455
 epoch: 50, train_loss: 0.9787, test_loss: 1.1077, test_f1: 0.3771
 epoch: 51, train_loss: 0.9747, test_loss: 1.0987, test_f1: 0.3542
 epoch: 52, train_loss: 0.9474, test_loss: 1.1678, test_f1: 0.4608
 epoch: 53, train_loss: 0.9405, test_loss: 1.1586, test_f1: 0.4509
 epoch: 54, train_loss: 0.9476, test_loss: 1.0984, test_f1: 0.4709
 epoch: 55, train_loss: 0.9458, test_loss: 1.2735, test_f1: 0.4257
 epoch: 56, train_loss: 0.9482, test_loss: 1.0892, test_f1: 0.4780
 epoch: 57, train_loss: 0.9503, test_loss: 1.3168, test_f1: 0.3903
 epoch: 58, train_loss: 0.9648, test_loss: 1.0756, test_f1: 0.3729
 epoch: 59, train_loss: 0.9400, test_loss: 1.0794, test_f1: 0.4830
 epoch: 60, train_loss: 0.9479, test_loss: 1.0808, test_f1: 0.4589
 epoch: 61, train_loss: 0.9297, test_loss: 1.1142, test_f1: 0.4657
 epoch: 62, train_loss: 0.9230, test_loss: 1.0762, test_f1: 0.4708
 epoch: 63, train_loss: 0.9275, test_loss: 1.0876, test_f1: 0.4180
 epoch: 64, train_loss: 0.9291, test_loss: 1.1591, test_f1: 0.4490
 epoch: 65, train_loss: 0.9325, test_loss: 1.1313, test_f1: 0.4634
 epoch: 66, train_loss: 0.9237, test_loss: 1.1820, test_f1: 0.4721
 epoch: 67, train_loss: 0.9457, test_loss: 1.1608, test_f1: 0.4838
 epoch: 68, train_loss: 0.9458, test_loss: 1.1197, test_f1: 0.5012
 epoch: 69, train_loss: 0.9419, test_loss: 1.0975, test_f1: 0.4502
 epoch: 70, train_loss: 0.9394, test_loss: 1.0474, test_f1: 0.4415
 epoch: 71, train_loss: 0.9420, test_loss: 1.0549, test_f1: 0.5082
 epoch: 72, train_loss: 0.9411, test_loss: 1.0602, test_f1: 0.4297
 epoch: 73, train_loss: 0.9373, test_loss: 1.1321, test_f1: 0.4590
 epoch: 74, train_loss: 0.9440, test_loss: 1.1681, test_f1: 0.4365
 epoch: 75, train_loss: 0.9313, test_loss: 1.4647, test_f1: 0.3609
 epoch: 76, train_loss: 0.9192, test_loss: 1.1995, test_f1: 0.4444
 epoch: 77, train_loss: 0.9082, test_loss: 1.4768, test_f1: 0.3367
 epoch: 78, train_loss: 0.9182, test_loss: 1.1718, test_f1: 0.4905
 epoch: 79, train_loss: 0.9154, test_loss: 1.0469, test_f1: 0.4731
 epoch: 80, train_loss: 0.9125, test_loss: 1.0478, test_f1: 0.5368
 epoch: 81, train_loss: 0.8991, test_loss: 1.1331, test_f1: 0.4767
 epoch: 82, train_loss: 0.9055, test_loss: 1.0644, test_f1: 0.5157
 epoch: 83, train_loss: 0.9065, test_loss: 1.0737, test_f1: 0.5084
 epoch: 84, train_loss: 0.9168, test_loss: 1.1548, test_f1: 0.5061
 epoch: 85, train_loss: 0.9347, test_loss: 1.0132, test_f1: 0.4770
 epoch: 86, train_loss: 0.9358, test_loss: 1.1217, test_f1: 0.4846
 epoch: 87, train_loss: 0.9177, test_loss: 1.0741, test_f1: 0.4737
 epoch: 88, train_loss: 0.9285, test_loss: 1.1251, test_f1: 0.4859
 epoch: 89, train_loss: 0.9290, test_loss: 1.1091, test_f1: 0.4727
 epoch: 90, train_loss: 0.9183, test_loss: 1.0479, test_f1: 0.4141
 epoch: 91, train_loss: 0.9016, test_loss: 1.3381, test_f1: 0.4141
 epoch: 92, train_loss: 0.9129, test_loss: 1.0487, test_f1: 0.5365
 epoch: 93, train_loss: 0.9177, test_loss: 1.2509, test_f1: 0.3506
 epoch: 94, train_loss: 0.9323, test_loss: 1.0742, test_f1: 0.4853
 epoch: 95, train_loss: 0.9207, test_loss: 1.9911, test_f1: 0.2577
 epoch: 96, train_loss: 0.9114, test_loss: 1.8442, test_f1: 0.3404
 epoch: 97, train_loss: 0.8939, test_loss: 1.2574, test_f1: 0.4723
 epoch: 98, train_loss: 0.9077, test_loss: 29.3958, test_f1: 0.2304
 epoch: 99, train_loss: 0.9023, test_loss: 7.6154, test_f1: 0.3995
##################ITERATION #7 ****************************************
 epoch: 0, train_loss: 1.4692, test_loss: 3.3803, test_f1: 0.1365
 epoch: 1, train_loss: 1.2164, test_loss: 1.3583, test_f1: 0.3226
 epoch: 2, train_loss: 1.1525, test_loss: 1.1887, test_f1: 0.3629
 epoch: 3, train_loss: 1.0892, test_loss: 1.1637, test_f1: 0.4403
 epoch: 4, train_loss: 1.0863, test_loss: 1.1504, test_f1: 0.3353
 epoch: 5, train_loss: 1.0675, test_loss: 1.2385, test_f1: 0.3176
 epoch: 6, train_loss: 1.0260, test_loss: 1.1746, test_f1: 0.4195
 epoch: 7, train_loss: 1.0309, test_loss: 1.1178, test_f1: 0.3472
 epoch: 8, train_loss: 1.0267, test_loss: 1.2149, test_f1: 0.3150
 epoch: 9, train_loss: 1.0634, test_loss: 1.3209, test_f1: 0.2450
 epoch: 10, train_loss: 1.0484, test_loss: 1.2453, test_f1: 0.2913
 epoch: 11, train_loss: 1.0428, test_loss: 1.1612, test_f1: 0.3290
 epoch: 12, train_loss: 1.0524, test_loss: 1.1811, test_f1: 0.3267
 epoch: 13, train_loss: 1.0402, test_loss: 1.1755, test_f1: 0.3267
 epoch: 14, train_loss: 1.0327, test_loss: 1.2737, test_f1: 0.3836
 epoch: 15, train_loss: 1.0206, test_loss: 1.1372, test_f1: 0.3747
 epoch: 16, train_loss: 1.0212, test_loss: 1.1152, test_f1: 0.3741
 epoch: 17, train_loss: 1.0144, test_loss: 1.1492, test_f1: 0.3840
 epoch: 18, train_loss: 1.0159, test_loss: 1.1352, test_f1: 0.3943
 epoch: 19, train_loss: 1.0038, test_loss: 1.1126, test_f1: 0.4099
 epoch: 20, train_loss: 1.0003, test_loss: 1.0787, test_f1: 0.4656
 epoch: 21, train_loss: 0.9899, test_loss: 1.1087, test_f1: 0.4537
 epoch: 22, train_loss: 0.9921, test_loss: 1.1477, test_f1: 0.3701
 epoch: 23, train_loss: 0.9901, test_loss: 1.1297, test_f1: 0.3563
 epoch: 24, train_loss: 1.0076, test_loss: 1.1525, test_f1: 0.3794
 epoch: 25, train_loss: 0.9872, test_loss: 1.0996, test_f1: 0.4226
 epoch: 26, train_loss: 1.0049, test_loss: 1.2588, test_f1: 0.3267
 epoch: 27, train_loss: 1.0033, test_loss: 1.1177, test_f1: 0.3854
 epoch: 28, train_loss: 0.9978, test_loss: 1.6019, test_f1: 0.2386
 epoch: 29, train_loss: 0.9871, test_loss: 1.2569, test_f1: 0.3630
 epoch: 30, train_loss: 0.9866, test_loss: 1.4004, test_f1: 0.2279
 epoch: 31, train_loss: 0.9911, test_loss: 1.1855, test_f1: 0.3789
 epoch: 32, train_loss: 0.9882, test_loss: 1.9692, test_f1: 0.3174
 epoch: 33, train_loss: 0.9848, test_loss: 3.3427, test_f1: 0.3082
 epoch: 34, train_loss: 1.0340, test_loss: 1.2224, test_f1: 0.4217
 epoch: 35, train_loss: 1.0097, test_loss: 1.1164, test_f1: 0.4055
 epoch: 36, train_loss: 0.9957, test_loss: 1.0734, test_f1: 0.4570
 epoch: 37, train_loss: 0.9934, test_loss: 1.0891, test_f1: 0.3742
 epoch: 38, train_loss: 0.9799, test_loss: 1.1052, test_f1: 0.4790
 epoch: 39, train_loss: 0.9616, test_loss: 1.0558, test_f1: 0.4883
 epoch: 40, train_loss: 0.9633, test_loss: 1.1363, test_f1: 0.4038
 epoch: 41, train_loss: 1.1309, test_loss: 1.2920, test_f1: 0.3197
 epoch: 42, train_loss: 1.0704, test_loss: 1.2212, test_f1: 0.3172
 epoch: 43, train_loss: 1.0360, test_loss: 1.1300, test_f1: 0.3290
 epoch: 44, train_loss: 1.0161, test_loss: 1.5650, test_f1: 0.2691
 epoch: 45, train_loss: 1.0454, test_loss: 1.1538, test_f1: 0.3882
 epoch: 46, train_loss: 1.0490, test_loss: 1.1366, test_f1: 0.4590
 epoch: 47, train_loss: 1.0213, test_loss: 1.2922, test_f1: 0.4439
 epoch: 48, train_loss: 1.0127, test_loss: 1.1767, test_f1: 0.4184
 epoch: 49, train_loss: 0.9879, test_loss: 1.1854, test_f1: 0.4686
 epoch: 50, train_loss: 1.0076, test_loss: 1.2037, test_f1: 0.3994
 epoch: 51, train_loss: 1.0315, test_loss: 1.1135, test_f1: 0.4368
 epoch: 52, train_loss: 1.0160, test_loss: 1.1089, test_f1: 0.4039
 epoch: 53, train_loss: 0.9881, test_loss: 1.0688, test_f1: 0.5313
 epoch: 54, train_loss: 0.9675, test_loss: 1.1070, test_f1: 0.4666
 epoch: 55, train_loss: 0.9603, test_loss: 1.1180, test_f1: 0.4947
 epoch: 56, train_loss: 0.9564, test_loss: 1.1226, test_f1: 0.4710
 epoch: 57, train_loss: 0.9378, test_loss: 1.0750, test_f1: 0.4206
 epoch: 58, train_loss: 0.9452, test_loss: 1.0797, test_f1: 0.4246
 epoch: 59, train_loss: 0.9487, test_loss: 1.0573, test_f1: 0.5389
 epoch: 60, train_loss: 0.9366, test_loss: 1.0590, test_f1: 0.5539
 epoch: 61, train_loss: 0.9326, test_loss: 1.0438, test_f1: 0.4221
 epoch: 62, train_loss: 0.9389, test_loss: 1.0539, test_f1: 0.5166
 epoch: 63, train_loss: 0.9458, test_loss: 1.0496, test_f1: 0.4250
 epoch: 64, train_loss: 0.9367, test_loss: 1.0241, test_f1: 0.4503
 epoch: 65, train_loss: 0.9327, test_loss: 1.0520, test_f1: 0.4257
 epoch: 66, train_loss: 0.9546, test_loss: 1.0701, test_f1: 0.4182
 epoch: 67, train_loss: 0.9384, test_loss: 1.0126, test_f1: 0.5125
 epoch: 68, train_loss: 0.9422, test_loss: 1.0279, test_f1: 0.4804
 epoch: 69, train_loss: 0.9214, test_loss: 1.0117, test_f1: 0.4294
 epoch: 70, train_loss: 0.9179, test_loss: 1.0084, test_f1: 0.4507
 epoch: 71, train_loss: 0.9202, test_loss: 1.0196, test_f1: 0.4767
 epoch: 72, train_loss: 0.9296, test_loss: 1.0304, test_f1: 0.5004
 epoch: 73, train_loss: 0.9256, test_loss: 0.9925, test_f1: 0.4881
 epoch: 74, train_loss: 0.9102, test_loss: 0.9960, test_f1: 0.5688
 epoch: 75, train_loss: 0.9016, test_loss: 0.9933, test_f1: 0.4467
 epoch: 76, train_loss: 0.9151, test_loss: 2.9119, test_f1: 0.4059
 epoch: 77, train_loss: 0.9903, test_loss: 4.4593, test_f1: 0.1934
 epoch: 78, train_loss: 0.9711, test_loss: 1.1425, test_f1: 0.3886
 epoch: 79, train_loss: 0.9751, test_loss: 1.0677, test_f1: 0.5149
 epoch: 80, train_loss: 0.9749, test_loss: 1.0781, test_f1: 0.4062
 epoch: 81, train_loss: 0.9604, test_loss: 1.0970, test_f1: 0.5089
 epoch: 82, train_loss: 0.9472, test_loss: 1.0813, test_f1: 0.4160
 epoch: 83, train_loss: 0.9313, test_loss: 1.0776, test_f1: 0.5369
 epoch: 84, train_loss: 0.9152, test_loss: 1.0451, test_f1: 0.4327
 epoch: 85, train_loss: 0.9257, test_loss: 1.0455, test_f1: 0.5784
 epoch: 86, train_loss: 0.9274, test_loss: 1.0607, test_f1: 0.5460
 epoch: 87, train_loss: 0.9258, test_loss: 1.0137, test_f1: 0.4464
 epoch: 88, train_loss: 0.9224, test_loss: 1.0217, test_f1: 0.5250
 epoch: 89, train_loss: 0.9201, test_loss: 1.0102, test_f1: 0.4429
 epoch: 90, train_loss: 0.9380, test_loss: 1.0712, test_f1: 0.5394
 epoch: 91, train_loss: 0.9386, test_loss: 1.0224, test_f1: 0.5346
 epoch: 92, train_loss: 0.9381, test_loss: 1.0041, test_f1: 0.4259
 epoch: 93, train_loss: 0.9115, test_loss: 1.0137, test_f1: 0.4401
 epoch: 94, train_loss: 0.9061, test_loss: 0.9927, test_f1: 0.4380
 epoch: 95, train_loss: 0.9079, test_loss: 0.9888, test_f1: 0.4364
 epoch: 96, train_loss: 0.9138, test_loss: 0.9883, test_f1: 0.4408
 epoch: 97, train_loss: 0.9028, test_loss: 1.0848, test_f1: 0.4288
 epoch: 98, train_loss: 0.8970, test_loss: 0.9812, test_f1: 0.5599
 epoch: 99, train_loss: 0.8815, test_loss: 0.9917, test_f1: 0.4535
##################ITERATION #8 ****************************************
 epoch: 0, train_loss: 1.4677, test_loss: 3.4926, test_f1: 0.1365
 epoch: 1, train_loss: 1.1685, test_loss: 3.3329, test_f1: 0.1985
 epoch: 2, train_loss: 1.0594, test_loss: 18.4439, test_f1: 0.1434
 epoch: 3, train_loss: 1.0898, test_loss: 2.3214, test_f1: 0.2011
 epoch: 4, train_loss: 1.0356, test_loss: 1.6696, test_f1: 0.2314
 epoch: 5, train_loss: 1.0549, test_loss: 1.4157, test_f1: 0.3040
 epoch: 6, train_loss: 1.0294, test_loss: 1.8699, test_f1: 0.2496
 epoch: 7, train_loss: 1.0692, test_loss: 1.0783, test_f1: 0.4366
 epoch: 8, train_loss: 1.0650, test_loss: 1.2418, test_f1: 0.3685
 epoch: 9, train_loss: 1.0107, test_loss: 1.0550, test_f1: 0.4453
 epoch: 10, train_loss: 1.0032, test_loss: 1.0935, test_f1: 0.3618
 epoch: 11, train_loss: 0.9894, test_loss: 1.1756, test_f1: 0.3370
 epoch: 12, train_loss: 0.9917, test_loss: 1.3141, test_f1: 0.3952
 epoch: 13, train_loss: 1.0171, test_loss: 1.3161, test_f1: 0.2985
 epoch: 14, train_loss: 0.9859, test_loss: 1.2018, test_f1: 0.3333
 epoch: 15, train_loss: 1.0030, test_loss: 1.0866, test_f1: 0.3317
 epoch: 16, train_loss: 0.9900, test_loss: 1.4465, test_f1: 0.4029
 epoch: 17, train_loss: 1.0035, test_loss: 1.2651, test_f1: 0.3317
 epoch: 18, train_loss: 0.9895, test_loss: 1.2909, test_f1: 0.3431
 epoch: 19, train_loss: 0.9995, test_loss: 1.1284, test_f1: 0.3290
 epoch: 20, train_loss: 0.9959, test_loss: 1.1017, test_f1: 0.4534
 epoch: 21, train_loss: 0.9974, test_loss: 1.1520, test_f1: 0.3461
 epoch: 22, train_loss: 1.0194, test_loss: 1.0851, test_f1: 0.4281
 epoch: 23, train_loss: 0.9846, test_loss: 1.0619, test_f1: 0.4043
 epoch: 24, train_loss: 0.9793, test_loss: 1.2451, test_f1: 0.3431
 epoch: 25, train_loss: 0.9970, test_loss: 1.2295, test_f1: 0.3290
 epoch: 26, train_loss: 0.9902, test_loss: 1.0748, test_f1: 0.3750
 epoch: 27, train_loss: 0.9961, test_loss: 1.0704, test_f1: 0.3694
 epoch: 28, train_loss: 0.9891, test_loss: 1.0407, test_f1: 0.3904
 epoch: 29, train_loss: 0.9960, test_loss: 1.2512, test_f1: 0.2910
 epoch: 30, train_loss: 0.9981, test_loss: 1.0642, test_f1: 0.3395
 epoch: 31, train_loss: 0.9928, test_loss: 1.0943, test_f1: 0.3173
 epoch: 32, train_loss: 1.0048, test_loss: 1.1553, test_f1: 0.3493
 epoch: 33, train_loss: 1.0037, test_loss: 1.2235, test_f1: 0.3990
 epoch: 34, train_loss: 0.9844, test_loss: 1.1933, test_f1: 0.3394
 epoch: 35, train_loss: 0.9544, test_loss: 1.5537, test_f1: 0.4391
 epoch: 36, train_loss: 0.9863, test_loss: 1.4626, test_f1: 0.2956
 epoch: 37, train_loss: 0.9742, test_loss: 1.2419, test_f1: 0.4012
 epoch: 38, train_loss: 0.9718, test_loss: 1.1854, test_f1: 0.4336
 epoch: 39, train_loss: 0.9559, test_loss: 1.1372, test_f1: 0.4316
 epoch: 40, train_loss: 0.9478, test_loss: 1.1192, test_f1: 0.4720
 epoch: 41, train_loss: 0.9548, test_loss: 1.0722, test_f1: 0.4145
 epoch: 42, train_loss: 0.9729, test_loss: 1.1837, test_f1: 0.4847
 epoch: 43, train_loss: 0.9721, test_loss: 1.2908, test_f1: 0.4349
 epoch: 44, train_loss: 0.9662, test_loss: 1.7213, test_f1: 0.3085
 epoch: 45, train_loss: 0.9627, test_loss: 14.0906, test_f1: 0.2075
 epoch: 46, train_loss: 0.9646, test_loss: 9.4120, test_f1: 0.2844
 epoch: 47, train_loss: 0.9849, test_loss: 1.6345, test_f1: 0.3759
 epoch: 48, train_loss: 0.9973, test_loss: 1.1470, test_f1: 0.3509
 epoch: 49, train_loss: 0.9754, test_loss: 1.1368, test_f1: 0.3870
 epoch: 50, train_loss: 0.9953, test_loss: 1.4671, test_f1: 0.4196
 epoch: 51, train_loss: 0.9560, test_loss: 2.0189, test_f1: 0.2518
 epoch: 52, train_loss: 0.9564, test_loss: 2.0112, test_f1: 0.2677
 epoch: 53, train_loss: 0.9370, test_loss: 1.6553, test_f1: 0.3800
 epoch: 54, train_loss: 0.9345, test_loss: 1.2675, test_f1: 0.4660
 epoch: 55, train_loss: 0.9383, test_loss: 1.1095, test_f1: 0.5017
 epoch: 56, train_loss: 0.9227, test_loss: 1.0768, test_f1: 0.4813
 epoch: 57, train_loss: 0.9308, test_loss: 1.0248, test_f1: 0.5368
 epoch: 58, train_loss: 0.9302, test_loss: 1.0766, test_f1: 0.4057
 epoch: 59, train_loss: 0.9153, test_loss: 1.0803, test_f1: 0.4777
 epoch: 60, train_loss: 0.9236, test_loss: 1.0702, test_f1: 0.4250
 epoch: 61, train_loss: 0.9166, test_loss: 1.0574, test_f1: 0.4311
 epoch: 62, train_loss: 0.9305, test_loss: 1.0564, test_f1: 0.4519
 epoch: 63, train_loss: 0.9300, test_loss: 1.0633, test_f1: 0.3469
 epoch: 64, train_loss: 0.9667, test_loss: 1.0769, test_f1: 0.3862
 epoch: 65, train_loss: 0.9468, test_loss: 1.0633, test_f1: 0.5090
 epoch: 66, train_loss: 0.9393, test_loss: 1.0370, test_f1: 0.4929
 epoch: 67, train_loss: 0.9275, test_loss: 1.0330, test_f1: 0.5334
 epoch: 68, train_loss: 0.9385, test_loss: 1.0991, test_f1: 0.4789
 epoch: 69, train_loss: 0.9451, test_loss: 1.0660, test_f1: 0.4232
 epoch: 70, train_loss: 0.9199, test_loss: 1.0537, test_f1: 0.5128
 epoch: 71, train_loss: 0.9250, test_loss: 1.1159, test_f1: 0.4924
 epoch: 72, train_loss: 0.9643, test_loss: 1.1839, test_f1: 0.3097
 epoch: 73, train_loss: 0.9884, test_loss: 1.1191, test_f1: 0.3452
 epoch: 74, train_loss: 0.9655, test_loss: 1.0298, test_f1: 0.5357
 epoch: 75, train_loss: 0.9377, test_loss: 1.3682, test_f1: 0.4939
 epoch: 76, train_loss: 0.9183, test_loss: 1.0021, test_f1: 0.5384
 epoch: 77, train_loss: 0.9269, test_loss: 1.0635, test_f1: 0.4287
 epoch: 78, train_loss: 0.9618, test_loss: 1.3229, test_f1: 0.2497
 epoch: 79, train_loss: 0.9720, test_loss: 1.0822, test_f1: 0.4176
 epoch: 80, train_loss: 0.9536, test_loss: 1.0298, test_f1: 0.5080
 epoch: 81, train_loss: 0.9590, test_loss: 1.0541, test_f1: 0.5193
 epoch: 82, train_loss: 0.9473, test_loss: 1.0235, test_f1: 0.4174
 epoch: 83, train_loss: 0.9232, test_loss: 1.0229, test_f1: 0.5103
 epoch: 84, train_loss: 0.9105, test_loss: 1.0243, test_f1: 0.5410
 epoch: 85, train_loss: 0.9118, test_loss: 1.1879, test_f1: 0.2507
 epoch: 86, train_loss: 0.9242, test_loss: 1.0365, test_f1: 0.5105
 epoch: 87, train_loss: 0.9258, test_loss: 1.0544, test_f1: 0.4982
 epoch: 88, train_loss: 0.9193, test_loss: 1.0326, test_f1: 0.4859
 epoch: 89, train_loss: 0.9171, test_loss: 1.0860, test_f1: 0.4853
 epoch: 90, train_loss: 0.9116, test_loss: 1.0056, test_f1: 0.4330
 epoch: 91, train_loss: 0.8962, test_loss: 1.0390, test_f1: 0.4213
 epoch: 92, train_loss: 0.9259, test_loss: 1.1713, test_f1: 0.3771
 epoch: 93, train_loss: 0.9394, test_loss: 1.0102, test_f1: 0.4275
 epoch: 94, train_loss: 0.9321, test_loss: 1.0389, test_f1: 0.4180
 epoch: 95, train_loss: 0.8869, test_loss: 1.1087, test_f1: 0.3894
 epoch: 96, train_loss: 0.9013, test_loss: 1.0932, test_f1: 0.4257
 epoch: 97, train_loss: 0.8933, test_loss: 1.0269, test_f1: 0.4704
 epoch: 98, train_loss: 0.8877, test_loss: 1.0419, test_f1: 0.5199
 epoch: 99, train_loss: 0.8783, test_loss: 1.0578, test_f1: 0.5373
##################ITERATION #9 ****************************************
 epoch: 0, train_loss: 1.5539, test_loss: 1.5455, test_f1: 0.0827
 epoch: 1, train_loss: 1.3376, test_loss: 1.3046, test_f1: 0.3260
 epoch: 2, train_loss: 1.2669, test_loss: 1.3334, test_f1: 0.2281
 epoch: 3, train_loss: 1.2693, test_loss: 1.3795, test_f1: 0.2281
 epoch: 4, train_loss: 1.2615, test_loss: 1.3121, test_f1: 0.3253
 epoch: 5, train_loss: 1.2581, test_loss: 1.2979, test_f1: 0.2281
 epoch: 6, train_loss: 1.2385, test_loss: 1.5859, test_f1: 0.3510
 epoch: 7, train_loss: 1.2361, test_loss: 1.6882, test_f1: 0.1368
 epoch: 8, train_loss: 1.2037, test_loss: 1.6723, test_f1: 0.2281
 epoch: 9, train_loss: 1.1824, test_loss: 2.4638, test_f1: 0.1368
 epoch: 10, train_loss: 1.1633, test_loss: 1.5252, test_f1: 0.3015
 epoch: 11, train_loss: 1.1391, test_loss: 1.4115, test_f1: 0.2092
 epoch: 12, train_loss: 1.1244, test_loss: 1.2325, test_f1: 0.2749
 epoch: 13, train_loss: 1.1366, test_loss: 1.3141, test_f1: 0.2791
 epoch: 14, train_loss: 1.1284, test_loss: 1.2310, test_f1: 0.2907
 epoch: 15, train_loss: 1.1574, test_loss: 1.6744, test_f1: 0.3402
 epoch: 16, train_loss: 1.1075, test_loss: 1.1716, test_f1: 0.3262
 epoch: 17, train_loss: 1.0955, test_loss: 1.3625, test_f1: 0.2576
 epoch: 18, train_loss: 1.0874, test_loss: 1.1550, test_f1: 0.3290
 epoch: 19, train_loss: 1.0482, test_loss: 1.4688, test_f1: 0.3535
 epoch: 20, train_loss: 1.0845, test_loss: 1.2784, test_f1: 0.3290
 epoch: 21, train_loss: 1.0527, test_loss: 1.1791, test_f1: 0.3033
 epoch: 22, train_loss: 1.0288, test_loss: 1.1710, test_f1: 0.3317
 epoch: 23, train_loss: 1.0209, test_loss: 1.1987, test_f1: 0.3328
 epoch: 24, train_loss: 1.0171, test_loss: 1.1521, test_f1: 0.3521
 epoch: 25, train_loss: 1.0033, test_loss: 1.1586, test_f1: 0.4246
 epoch: 26, train_loss: 1.0146, test_loss: 1.1283, test_f1: 0.4513
 epoch: 27, train_loss: 1.0263, test_loss: 1.1947, test_f1: 0.3142
 epoch: 28, train_loss: 1.0062, test_loss: 1.2275, test_f1: 0.3234
 epoch: 29, train_loss: 1.0347, test_loss: 1.1604, test_f1: 0.3829
 epoch: 30, train_loss: 1.0274, test_loss: 1.1482, test_f1: 0.4058
 epoch: 31, train_loss: 1.0505, test_loss: 1.2472, test_f1: 0.4478
 epoch: 32, train_loss: 1.0313, test_loss: 1.3229, test_f1: 0.4156
 epoch: 33, train_loss: 1.0423, test_loss: 1.1691, test_f1: 0.3176
 epoch: 34, train_loss: 1.0533, test_loss: 1.2635, test_f1: 0.3692
 epoch: 35, train_loss: 1.0246, test_loss: 1.1395, test_f1: 0.4448
 epoch: 36, train_loss: 1.0153, test_loss: 1.2086, test_f1: 0.3808
 epoch: 37, train_loss: 0.9814, test_loss: 1.1175, test_f1: 0.4577
 epoch: 38, train_loss: 0.9844, test_loss: 1.0922, test_f1: 0.3849
 epoch: 39, train_loss: 0.9863, test_loss: 1.1051, test_f1: 0.3463
 epoch: 40, train_loss: 0.9814, test_loss: 1.1122, test_f1: 0.4920
 epoch: 41, train_loss: 0.9679, test_loss: 1.3136, test_f1: 0.4582
 epoch: 42, train_loss: 0.9961, test_loss: 1.1755, test_f1: 0.4094
 epoch: 43, train_loss: 0.9976, test_loss: 1.1532, test_f1: 0.3532
 epoch: 44, train_loss: 1.1157, test_loss: 1.3869, test_f1: 0.3310
 epoch: 45, train_loss: 1.0586, test_loss: 1.1811, test_f1: 0.4170
 epoch: 46, train_loss: 1.0044, test_loss: 1.4328, test_f1: 0.3838
 epoch: 47, train_loss: 1.0485, test_loss: 1.1264, test_f1: 0.3379
 epoch: 48, train_loss: 1.0440, test_loss: 1.1067, test_f1: 0.4457
 epoch: 49, train_loss: 1.0255, test_loss: 1.1806, test_f1: 0.3562
 epoch: 50, train_loss: 1.0132, test_loss: 1.1779, test_f1: 0.3661
 epoch: 51, train_loss: 1.0036, test_loss: 1.2678, test_f1: 0.3443
 epoch: 52, train_loss: 0.9920, test_loss: 1.2321, test_f1: 0.4260
 epoch: 53, train_loss: 0.9957, test_loss: 1.1048, test_f1: 0.4517
 epoch: 54, train_loss: 0.9950, test_loss: 1.2200, test_f1: 0.3346
 epoch: 55, train_loss: 0.9781, test_loss: 1.1234, test_f1: 0.4564
 epoch: 56, train_loss: 0.9807, test_loss: 1.1229, test_f1: 0.4786
 epoch: 57, train_loss: 0.9781, test_loss: 1.0929, test_f1: 0.4929
 epoch: 58, train_loss: 0.9718, test_loss: 1.1395, test_f1: 0.4818
 epoch: 59, train_loss: 0.9631, test_loss: 1.1244, test_f1: 0.4507
 epoch: 60, train_loss: 0.9607, test_loss: 1.1632, test_f1: 0.3802
 epoch: 61, train_loss: 0.9663, test_loss: 1.0939, test_f1: 0.3752
 epoch: 62, train_loss: 0.9707, test_loss: 1.0851, test_f1: 0.3578
 epoch: 63, train_loss: 0.9806, test_loss: 1.1472, test_f1: 0.3580
 epoch: 64, train_loss: 0.9680, test_loss: 1.1287, test_f1: 0.3931
 epoch: 65, train_loss: 0.9935, test_loss: 1.1524, test_f1: 0.3733
 epoch: 66, train_loss: 0.9857, test_loss: 1.0853, test_f1: 0.4649
 epoch: 67, train_loss: 1.0060, test_loss: 1.0806, test_f1: 0.3869
 epoch: 68, train_loss: 0.9934, test_loss: 1.0914, test_f1: 0.4308
 epoch: 69, train_loss: 1.0019, test_loss: 1.0911, test_f1: 0.4608
 epoch: 70, train_loss: 0.9930, test_loss: 1.4508, test_f1: 0.3477
 epoch: 71, train_loss: 0.9888, test_loss: 1.1716, test_f1: 0.4477
 epoch: 72, train_loss: 0.9894, test_loss: 1.2155, test_f1: 0.4441
 epoch: 73, train_loss: 0.9726, test_loss: 1.1029, test_f1: 0.4604
 epoch: 74, train_loss: 0.9803, test_loss: 1.1316, test_f1: 0.4489
 epoch: 75, train_loss: 0.9746, test_loss: 1.1254, test_f1: 0.3381
 epoch: 76, train_loss: 0.9732, test_loss: 1.1371, test_f1: 0.4632
 epoch: 77, train_loss: 0.9674, test_loss: 1.1056, test_f1: 0.4363
 epoch: 78, train_loss: 1.0296, test_loss: 1.4326, test_f1: 0.3718
 epoch: 79, train_loss: 1.0692, test_loss: 1.4517, test_f1: 0.3630
 epoch: 80, train_loss: 1.0874, test_loss: 1.2498, test_f1: 0.3666
 epoch: 81, train_loss: 1.0883, test_loss: 1.1250, test_f1: 0.3388
 epoch: 82, train_loss: 1.0293, test_loss: 1.1226, test_f1: 0.3298
 epoch: 83, train_loss: 0.9803, test_loss: 1.3948, test_f1: 0.3122
 epoch: 84, train_loss: 1.0039, test_loss: 1.1321, test_f1: 0.3670
 epoch: 85, train_loss: 0.9845, test_loss: 1.1394, test_f1: 0.4561
 epoch: 86, train_loss: 0.9736, test_loss: 1.0891, test_f1: 0.3597
 epoch: 87, train_loss: 0.9734, test_loss: 1.0826, test_f1: 0.4711
 epoch: 88, train_loss: 0.9884, test_loss: 1.0924, test_f1: 0.3467
 epoch: 89, train_loss: 0.9686, test_loss: 1.0909, test_f1: 0.4153
 epoch: 90, train_loss: 0.9659, test_loss: 1.1102, test_f1: 0.3667
 epoch: 91, train_loss: 0.9650, test_loss: 1.1184, test_f1: 0.4642
 epoch: 92, train_loss: 0.9587, test_loss: 1.1196, test_f1: 0.4471
 epoch: 93, train_loss: 0.9794, test_loss: 1.0863, test_f1: 0.3677
 epoch: 94, train_loss: 0.9643, test_loss: 1.0931, test_f1: 0.3741
 epoch: 95, train_loss: 0.9637, test_loss: 1.0928, test_f1: 0.4892
 epoch: 96, train_loss: 0.9703, test_loss: 1.2959, test_f1: 0.3916
 epoch: 97, train_loss: 0.9696, test_loss: 1.1145, test_f1: 0.4641
 epoch: 98, train_loss: 0.9669, test_loss: 1.1165, test_f1: 0.3815
 epoch: 99, train_loss: 0.9729, test_loss: 1.1035, test_f1: 0.3819

Training completed in 365.06 seconds
Best F1: 0.5784 at epoch 85
Mean F1 across iterations: 0.5132  0.0326
========================FINAL RESULTS================================
FEGIN weighted F1: 0.5784  0.0326
python main.py --data ltspice_demos --representation component_pin_net --model FEGIN --layers 2 --hiddens 32 --batch_size 256 --lr 0.1 --emb_size 250 --epochs 100 --save_appendix component_pin_net_L2_H32_BS256_LR0.1_E250 --no_val
-----



STDERR:
  File "main.py", line 370, in <module>
    main()
  File "main.py", line 254, in main
    dataset = dataset_class(
  File "/home/philip/projects/ltspice_examples_code_repo/Circuit-Completion-Using-GNNs/component_classification_with_link_prediction_head/evaluation/FEGIN/kernel/circuit_datasets.py", line 15, in __init__
    self.data, self.slices = torch.load(self.processed_paths[0])
  File "/home/philip/.local/lib/python3.8/site-packages/torch/serialization.py", line 1040, in load
    warnings.warn(
  File "/usr/lib/python3.8/warnings.py", line 109, in _showwarnmsg
    sw(msg.message, msg.category, msg.filename, msg.lineno,
  File "main.py", line 47, in warn_with_traceback
    traceback.print_stack(file=log)
/home/philip/projects/ltspice_examples_code_repo/Circuit-Completion-Using-GNNs/component_classification_with_link_prediction_head/evaluation/FEGIN/kernel/circuit_datasets.py:15: FutureWarning: You are using `torch.load` with `weights_only=False` (the current default value), which uses the default pickle module implicitly. It is possible to construct malicious pickle data which will execute arbitrary code during unpickling (See https://github.com/pytorch/pytorch/blob/main/SECURITY.md#untrusted-models for more details). In a future release, the default value for `weights_only` will be flipped to `True`. This limits the functions that could be executed during unpickling. Arbitrary objects will no longer be allowed to be loaded via this mode unless they are explicitly allowlisted by the user via `torch.serialization.add_safe_globals`. We recommend you start setting `weights_only=True` for any use case where you don't have full control of the loaded file. Please open an issue on GitHub for any issues related to this experimental feature.
  self.data, self.slices = torch.load(self.processed_paths[0])
