STDOUT:
Results will be saved in /home/philip/projects/ltspice_examples_code_repo/Circuit-Completion-Using-GNNs/component_classification_with_link_prediction_head/evaluation/FEGIN/results/model_FEGIN_dataset_ltspice_demos
Command line input: python main.py --data ltspice_demos --representation component_component --model FEGIN --layers 4 --hiddens 16 --batch_size 32 --lr 0.01 --emb_size 512 --epochs 100 --save_appendix component_component_L4_H16_BS32_LR0.01_E512 --no_val
 is saved.
-----
ltspice_demos - FEGIN
Using 4 layers, 16 hidden units, h = 2
Loading component_component representation dataset
ENTERED
Training FEGIN on component_component representation
Train: 1565, Test: 383
##################ITERATION #0 ****************************************
 epoch: 0, train_loss: 1.2534, test_loss: 1.3263, test_f1: 0.3305
 epoch: 1, train_loss: 1.1831, test_loss: 1.1792, test_f1: 0.4245
 epoch: 2, train_loss: 1.1304, test_loss: 1.1617, test_f1: 0.3484
 epoch: 3, train_loss: 1.0583, test_loss: 1.1696, test_f1: 0.3947
 epoch: 4, train_loss: 1.0439, test_loss: 1.1341, test_f1: 0.4229
 epoch: 5, train_loss: 0.9969, test_loss: 1.2348, test_f1: 0.4993
 epoch: 6, train_loss: 0.9857, test_loss: 1.1361, test_f1: 0.5162
 epoch: 7, train_loss: 0.9327, test_loss: 1.0542, test_f1: 0.5294
 epoch: 8, train_loss: 0.9173, test_loss: 1.1337, test_f1: 0.5446
 epoch: 9, train_loss: 0.9122, test_loss: 1.1857, test_f1: 0.5087
 epoch: 10, train_loss: 0.9100, test_loss: 1.0828, test_f1: 0.5545
 epoch: 11, train_loss: 0.9195, test_loss: 1.2099, test_f1: 0.4830
 epoch: 12, train_loss: 0.8957, test_loss: 1.0798, test_f1: 0.5643
 epoch: 13, train_loss: 0.9075, test_loss: 1.0599, test_f1: 0.5117
 epoch: 14, train_loss: 0.8757, test_loss: 1.1213, test_f1: 0.5166
 epoch: 15, train_loss: 0.8755, test_loss: 1.1939, test_f1: 0.5590
 epoch: 16, train_loss: 0.9205, test_loss: 1.0510, test_f1: 0.5207
 epoch: 17, train_loss: 0.8914, test_loss: 1.0753, test_f1: 0.5640
 epoch: 18, train_loss: 0.9155, test_loss: 1.1886, test_f1: 0.4920
 epoch: 19, train_loss: 0.9005, test_loss: 1.0695, test_f1: 0.5542
 epoch: 20, train_loss: 0.8726, test_loss: 1.0489, test_f1: 0.5249
 epoch: 21, train_loss: 0.8778, test_loss: 1.0604, test_f1: 0.5232
 epoch: 22, train_loss: 0.8660, test_loss: 1.0447, test_f1: 0.5502
 epoch: 23, train_loss: 0.8853, test_loss: 1.0315, test_f1: 0.4269
 epoch: 24, train_loss: 0.8639, test_loss: 1.0892, test_f1: 0.5855
 epoch: 25, train_loss: 0.8455, test_loss: 1.0761, test_f1: 0.5755
 epoch: 26, train_loss: 0.8583, test_loss: 1.0342, test_f1: 0.5148
 epoch: 27, train_loss: 0.8794, test_loss: 1.0885, test_f1: 0.5423
 epoch: 28, train_loss: 0.8486, test_loss: 1.0849, test_f1: 0.5876
 epoch: 29, train_loss: 0.8544, test_loss: 1.1296, test_f1: 0.5777
 epoch: 30, train_loss: 0.8528, test_loss: 1.0704, test_f1: 0.5525
 epoch: 31, train_loss: 0.8432, test_loss: 1.0445, test_f1: 0.5771
 epoch: 32, train_loss: 0.8719, test_loss: 1.0756, test_f1: 0.5691
 epoch: 33, train_loss: 0.8275, test_loss: 1.0501, test_f1: 0.5496
 epoch: 34, train_loss: 0.8309, test_loss: 1.0921, test_f1: 0.5714
 epoch: 35, train_loss: 0.8562, test_loss: 1.0877, test_f1: 0.4912
 epoch: 36, train_loss: 0.8405, test_loss: 1.1789, test_f1: 0.5677
 epoch: 37, train_loss: 0.8316, test_loss: 1.1627, test_f1: 0.5726
 epoch: 38, train_loss: 0.8117, test_loss: 1.1225, test_f1: 0.5347
 epoch: 39, train_loss: 0.8437, test_loss: 1.0462, test_f1: 0.5811
 epoch: 40, train_loss: 0.8128, test_loss: 1.1302, test_f1: 0.5974
 epoch: 41, train_loss: 0.8273, test_loss: 1.0810, test_f1: 0.5496
 epoch: 42, train_loss: 0.8376, test_loss: 1.0951, test_f1: 0.5074
 epoch: 43, train_loss: 0.8250, test_loss: 1.0338, test_f1: 0.5829
 epoch: 44, train_loss: 0.8169, test_loss: 1.0737, test_f1: 0.5949
 epoch: 45, train_loss: 0.8129, test_loss: 1.1499, test_f1: 0.5773
 epoch: 46, train_loss: 0.8332, test_loss: 1.0597, test_f1: 0.6195
 epoch: 47, train_loss: 0.8079, test_loss: 1.0175, test_f1: 0.5785
 epoch: 48, train_loss: 0.7926, test_loss: 1.0591, test_f1: 0.5546
 epoch: 49, train_loss: 0.8048, test_loss: 1.0026, test_f1: 0.5189
 epoch: 50, train_loss: 0.8078, test_loss: 1.1348, test_f1: 0.5817
 epoch: 51, train_loss: 0.7855, test_loss: 1.1035, test_f1: 0.5844
 epoch: 52, train_loss: 0.7842, test_loss: 1.1376, test_f1: 0.6015
 epoch: 53, train_loss: 0.7746, test_loss: 1.0866, test_f1: 0.5852
 epoch: 54, train_loss: 0.7567, test_loss: 1.1273, test_f1: 0.6028
 epoch: 55, train_loss: 0.7805, test_loss: 1.1570, test_f1: 0.6166
 epoch: 56, train_loss: 0.7743, test_loss: 1.0846, test_f1: 0.5869
 epoch: 57, train_loss: 0.7503, test_loss: 1.1334, test_f1: 0.6017
 epoch: 58, train_loss: 0.7447, test_loss: 1.1419, test_f1: 0.6129
 epoch: 59, train_loss: 0.7403, test_loss: 1.1047, test_f1: 0.5970
 epoch: 60, train_loss: 0.7667, test_loss: 1.0684, test_f1: 0.5723
 epoch: 61, train_loss: 0.7695, test_loss: 1.1172, test_f1: 0.5931
 epoch: 62, train_loss: 0.7472, test_loss: 1.1382, test_f1: 0.5809
 epoch: 63, train_loss: 0.7642, test_loss: 1.1194, test_f1: 0.6139
 epoch: 64, train_loss: 0.7636, test_loss: 1.0001, test_f1: 0.5932
 epoch: 65, train_loss: 0.7621, test_loss: 1.0844, test_f1: 0.5999
 epoch: 66, train_loss: 0.7571, test_loss: 1.1420, test_f1: 0.5968
 epoch: 67, train_loss: 0.7363, test_loss: 1.0952, test_f1: 0.5918
 epoch: 68, train_loss: 0.7439, test_loss: 1.0747, test_f1: 0.5997
 epoch: 69, train_loss: 0.7411, test_loss: 1.1403, test_f1: 0.6016
 epoch: 70, train_loss: 0.7565, test_loss: 1.0630, test_f1: 0.6132
 epoch: 71, train_loss: 0.7321, test_loss: 1.2041, test_f1: 0.6300
 epoch: 72, train_loss: 0.7291, test_loss: 1.2940, test_f1: 0.5655
 epoch: 73, train_loss: 0.7556, test_loss: 1.1115, test_f1: 0.6181
 epoch: 74, train_loss: 0.7504, test_loss: 1.2918, test_f1: 0.5820
 epoch: 75, train_loss: 0.7390, test_loss: 1.3474, test_f1: 0.5649
 epoch: 76, train_loss: 0.7440, test_loss: 1.1138, test_f1: 0.5591
 epoch: 77, train_loss: 0.7391, test_loss: 1.1467, test_f1: 0.5812
 epoch: 78, train_loss: 0.7447, test_loss: 1.1697, test_f1: 0.5762
 epoch: 79, train_loss: 0.7291, test_loss: 1.1263, test_f1: 0.5661
 epoch: 80, train_loss: 0.7249, test_loss: 1.0847, test_f1: 0.5739
 epoch: 81, train_loss: 0.7303, test_loss: 1.1381, test_f1: 0.5893
 epoch: 82, train_loss: 0.7362, test_loss: 1.1299, test_f1: 0.5970
 epoch: 83, train_loss: 0.7362, test_loss: 1.0669, test_f1: 0.6016
 epoch: 84, train_loss: 0.7092, test_loss: 1.0985, test_f1: 0.6015
 epoch: 85, train_loss: 0.7167, test_loss: 1.2823, test_f1: 0.6123
 epoch: 86, train_loss: 0.7147, test_loss: 1.1379, test_f1: 0.6092
 epoch: 87, train_loss: 0.7611, test_loss: 1.1712, test_f1: 0.5922
 epoch: 88, train_loss: 0.7320, test_loss: 1.1535, test_f1: 0.5547
 epoch: 89, train_loss: 0.7326, test_loss: 1.0730, test_f1: 0.6139
 epoch: 90, train_loss: 0.7073, test_loss: 1.1753, test_f1: 0.5983
 epoch: 91, train_loss: 0.7162, test_loss: 1.0941, test_f1: 0.6112
 epoch: 92, train_loss: 0.7246, test_loss: 1.0803, test_f1: 0.6138
 epoch: 93, train_loss: 0.6964, test_loss: 1.1462, test_f1: 0.5765
 epoch: 94, train_loss: 0.7096, test_loss: 1.0859, test_f1: 0.5550
 epoch: 95, train_loss: 0.7096, test_loss: 1.0943, test_f1: 0.6167
 epoch: 96, train_loss: 0.7199, test_loss: 1.1331, test_f1: 0.5865
 epoch: 97, train_loss: 0.7072, test_loss: 1.0722, test_f1: 0.6221
 epoch: 98, train_loss: 0.6899, test_loss: 1.1686, test_f1: 0.6235
 epoch: 99, train_loss: 0.7054, test_loss: 1.1691, test_f1: 0.5968
##################ITERATION #1 ****************************************
 epoch: 0, train_loss: 1.2574, test_loss: 1.3179, test_f1: 0.2501
 epoch: 1, train_loss: 1.1580, test_loss: 1.2041, test_f1: 0.3375
 epoch: 2, train_loss: 1.1070, test_loss: 1.2127, test_f1: 0.4575
 epoch: 3, train_loss: 1.0697, test_loss: 1.1998, test_f1: 0.4284
 epoch: 4, train_loss: 1.0446, test_loss: 1.1195, test_f1: 0.5086
 epoch: 5, train_loss: 1.0143, test_loss: 1.1058, test_f1: 0.5311
 epoch: 6, train_loss: 0.9753, test_loss: 1.1807, test_f1: 0.4643
 epoch: 7, train_loss: 0.9811, test_loss: 1.0368, test_f1: 0.5145
 epoch: 8, train_loss: 0.9667, test_loss: 1.1920, test_f1: 0.4380
 epoch: 9, train_loss: 0.9358, test_loss: 1.0910, test_f1: 0.5074
 epoch: 10, train_loss: 0.9414, test_loss: 1.0860, test_f1: 0.4585
 epoch: 11, train_loss: 0.9738, test_loss: 1.0689, test_f1: 0.5101
 epoch: 12, train_loss: 0.9319, test_loss: 1.0480, test_f1: 0.4377
 epoch: 13, train_loss: 0.9351, test_loss: 1.0312, test_f1: 0.5368
 epoch: 14, train_loss: 0.9235, test_loss: 1.0209, test_f1: 0.5353
 epoch: 15, train_loss: 0.9036, test_loss: 1.0526, test_f1: 0.5256
 epoch: 16, train_loss: 0.8915, test_loss: 1.0622, test_f1: 0.4970
 epoch: 17, train_loss: 0.8945, test_loss: 1.1076, test_f1: 0.5048
 epoch: 18, train_loss: 0.9093, test_loss: 1.4849, test_f1: 0.4420
 epoch: 19, train_loss: 0.9178, test_loss: 0.9841, test_f1: 0.5403
 epoch: 20, train_loss: 0.9074, test_loss: 1.0560, test_f1: 0.5083
 epoch: 21, train_loss: 0.8881, test_loss: 0.9613, test_f1: 0.5588
 epoch: 22, train_loss: 0.8883, test_loss: 0.9722, test_f1: 0.5190
 epoch: 23, train_loss: 0.8589, test_loss: 0.9982, test_f1: 0.5062
 epoch: 24, train_loss: 0.8733, test_loss: 1.1307, test_f1: 0.5254
 epoch: 25, train_loss: 0.8630, test_loss: 1.0120, test_f1: 0.5172
 epoch: 26, train_loss: 0.8874, test_loss: 1.0054, test_f1: 0.4529
 epoch: 27, train_loss: 0.8673, test_loss: 1.0031, test_f1: 0.6023
 epoch: 28, train_loss: 0.8457, test_loss: 1.0509, test_f1: 0.5743
 epoch: 29, train_loss: 0.8525, test_loss: 1.0915, test_f1: 0.5214
 epoch: 30, train_loss: 0.8572, test_loss: 1.0041, test_f1: 0.5723
 epoch: 31, train_loss: 0.8439, test_loss: 1.0537, test_f1: 0.5020
 epoch: 32, train_loss: 0.8565, test_loss: 0.9824, test_f1: 0.5526
 epoch: 33, train_loss: 0.8741, test_loss: 0.9766, test_f1: 0.5657
 epoch: 34, train_loss: 0.8626, test_loss: 1.0427, test_f1: 0.5132
 epoch: 35, train_loss: 0.8611, test_loss: 1.1075, test_f1: 0.5120
 epoch: 36, train_loss: 0.8821, test_loss: 1.0336, test_f1: 0.5605
 epoch: 37, train_loss: 0.8457, test_loss: 1.6514, test_f1: 0.5502
 epoch: 38, train_loss: 0.8490, test_loss: 1.0811, test_f1: 0.5375
 epoch: 39, train_loss: 0.8468, test_loss: 1.1823, test_f1: 0.5812
 epoch: 40, train_loss: 0.8599, test_loss: 1.0101, test_f1: 0.5575
 epoch: 41, train_loss: 0.8279, test_loss: 1.0032, test_f1: 0.6121
 epoch: 42, train_loss: 0.8275, test_loss: 1.0204, test_f1: 0.5918
 epoch: 43, train_loss: 0.8444, test_loss: 0.9628, test_f1: 0.5922
 epoch: 44, train_loss: 0.8162, test_loss: 1.0624, test_f1: 0.5913
 epoch: 45, train_loss: 0.8388, test_loss: 1.0223, test_f1: 0.5897
 epoch: 46, train_loss: 0.8157, test_loss: 1.0250, test_f1: 0.5845
 epoch: 47, train_loss: 0.8122, test_loss: 1.1537, test_f1: 0.5218
 epoch: 48, train_loss: 0.8080, test_loss: 1.0042, test_f1: 0.5596
 epoch: 49, train_loss: 0.8159, test_loss: 1.3610, test_f1: 0.4686
 epoch: 50, train_loss: 0.8248, test_loss: 1.0818, test_f1: 0.5677
 epoch: 51, train_loss: 0.8059, test_loss: 1.0674, test_f1: 0.5774
 epoch: 52, train_loss: 0.7861, test_loss: 1.1014, test_f1: 0.5769
 epoch: 53, train_loss: 0.7806, test_loss: 1.0404, test_f1: 0.5949
 epoch: 54, train_loss: 0.7703, test_loss: 1.1485, test_f1: 0.5816
 epoch: 55, train_loss: 0.7849, test_loss: 1.0851, test_f1: 0.5952
 epoch: 56, train_loss: 0.7784, test_loss: 1.0979, test_f1: 0.5735
 epoch: 57, train_loss: 0.7703, test_loss: 1.0557, test_f1: 0.5823
 epoch: 58, train_loss: 0.7732, test_loss: 1.0584, test_f1: 0.5713
 epoch: 59, train_loss: 0.7825, test_loss: 1.0948, test_f1: 0.5821
 epoch: 60, train_loss: 0.7697, test_loss: 1.1662, test_f1: 0.5528
 epoch: 61, train_loss: 0.7610, test_loss: 1.1305, test_f1: 0.5994
 epoch: 62, train_loss: 0.7577, test_loss: 1.2024, test_f1: 0.5945
 epoch: 63, train_loss: 0.7611, test_loss: 1.0559, test_f1: 0.6013
 epoch: 64, train_loss: 0.7685, test_loss: 1.0963, test_f1: 0.5879
 epoch: 65, train_loss: 0.7558, test_loss: 1.1712, test_f1: 0.6068
 epoch: 66, train_loss: 0.7400, test_loss: 1.2580, test_f1: 0.5844
 epoch: 67, train_loss: 0.7769, test_loss: 1.0838, test_f1: 0.5816
 epoch: 68, train_loss: 0.7768, test_loss: 1.0117, test_f1: 0.5847
 epoch: 69, train_loss: 0.7580, test_loss: 1.0612, test_f1: 0.5521
 epoch: 70, train_loss: 0.7432, test_loss: 1.0352, test_f1: 0.5646
 epoch: 71, train_loss: 0.7464, test_loss: 1.1350, test_f1: 0.5418
 epoch: 72, train_loss: 0.7454, test_loss: 1.0554, test_f1: 0.5468
 epoch: 73, train_loss: 0.7513, test_loss: 1.1470, test_f1: 0.5258
 epoch: 74, train_loss: 0.7489, test_loss: 1.0008, test_f1: 0.6057
 epoch: 75, train_loss: 0.7596, test_loss: 1.1210, test_f1: 0.5797
 epoch: 76, train_loss: 0.7340, test_loss: 1.0845, test_f1: 0.5625
 epoch: 77, train_loss: 0.7535, test_loss: 1.2481, test_f1: 0.5816
 epoch: 78, train_loss: 0.7314, test_loss: 1.0861, test_f1: 0.5873
 epoch: 79, train_loss: 0.7409, test_loss: 1.1816, test_f1: 0.5227
 epoch: 80, train_loss: 0.7525, test_loss: 1.1386, test_f1: 0.5502
 epoch: 81, train_loss: 0.7460, test_loss: 1.1809, test_f1: 0.5842
 epoch: 82, train_loss: 0.7468, test_loss: 1.0596, test_f1: 0.5679
 epoch: 83, train_loss: 0.7293, test_loss: 1.2618, test_f1: 0.5744
 epoch: 84, train_loss: 0.7303, test_loss: 1.1955, test_f1: 0.5977
 epoch: 85, train_loss: 0.7371, test_loss: 1.2628, test_f1: 0.5719
 epoch: 86, train_loss: 0.7237, test_loss: 1.1477, test_f1: 0.5919
 epoch: 87, train_loss: 0.7221, test_loss: 1.2309, test_f1: 0.5818
 epoch: 88, train_loss: 0.7582, test_loss: 1.2190, test_f1: 0.5890
 epoch: 89, train_loss: 0.7270, test_loss: 1.2931, test_f1: 0.5783
 epoch: 90, train_loss: 0.7562, test_loss: 1.1212, test_f1: 0.5906
 epoch: 91, train_loss: 0.7213, test_loss: 1.1919, test_f1: 0.5942
 epoch: 92, train_loss: 0.7401, test_loss: 1.3471, test_f1: 0.6102
 epoch: 93, train_loss: 0.7271, test_loss: 1.2716, test_f1: 0.5816
 epoch: 94, train_loss: 0.7202, test_loss: 1.2470, test_f1: 0.5948
 epoch: 95, train_loss: 0.7230, test_loss: 1.1370, test_f1: 0.5981
 epoch: 96, train_loss: 0.7250, test_loss: 1.1977, test_f1: 0.5919
 epoch: 97, train_loss: 0.7141, test_loss: 1.4281, test_f1: 0.5975
 epoch: 98, train_loss: 0.7671, test_loss: 1.3450, test_f1: 0.5634
 epoch: 99, train_loss: 0.7238, test_loss: 1.2855, test_f1: 0.5918
##################ITERATION #2 ****************************************
 epoch: 0, train_loss: 1.2703, test_loss: 1.2522, test_f1: 0.3027
 epoch: 1, train_loss: 1.2047, test_loss: 1.2396, test_f1: 0.3997
 epoch: 2, train_loss: 1.1579, test_loss: 1.2069, test_f1: 0.3859
 epoch: 3, train_loss: 1.1141, test_loss: 1.2619, test_f1: 0.3759
 epoch: 4, train_loss: 1.1083, test_loss: 1.1678, test_f1: 0.3381
 epoch: 5, train_loss: 1.0847, test_loss: 1.1174, test_f1: 0.4291
 epoch: 6, train_loss: 1.0537, test_loss: 1.1550, test_f1: 0.3974
 epoch: 7, train_loss: 1.0394, test_loss: 1.1542, test_f1: 0.3499
 epoch: 8, train_loss: 1.0205, test_loss: 1.2620, test_f1: 0.3453
 epoch: 9, train_loss: 0.9763, test_loss: 1.1437, test_f1: 0.3857
 epoch: 10, train_loss: 0.9699, test_loss: 1.0713, test_f1: 0.4879
 epoch: 11, train_loss: 0.9434, test_loss: 1.0167, test_f1: 0.5583
 epoch: 12, train_loss: 0.9248, test_loss: 1.7793, test_f1: 0.5556
 epoch: 13, train_loss: 0.9176, test_loss: 1.0631, test_f1: 0.4977
 epoch: 14, train_loss: 0.9101, test_loss: 1.1612, test_f1: 0.4780
 epoch: 15, train_loss: 0.9009, test_loss: 1.0927, test_f1: 0.4906
 epoch: 16, train_loss: 0.8974, test_loss: 1.0477, test_f1: 0.4868
 epoch: 17, train_loss: 0.8871, test_loss: 1.0790, test_f1: 0.4588
 epoch: 18, train_loss: 0.8889, test_loss: 1.0892, test_f1: 0.4326
 epoch: 19, train_loss: 0.8820, test_loss: 1.0925, test_f1: 0.4865
 epoch: 20, train_loss: 0.8683, test_loss: 1.0823, test_f1: 0.4526
 epoch: 21, train_loss: 0.8485, test_loss: 1.0829, test_f1: 0.5223
 epoch: 22, train_loss: 0.8722, test_loss: 1.0933, test_f1: 0.3944
 epoch: 23, train_loss: 0.8489, test_loss: 1.1405, test_f1: 0.4554
 epoch: 24, train_loss: 0.8857, test_loss: 1.0778, test_f1: 0.5148
 epoch: 25, train_loss: 0.8749, test_loss: 1.2435, test_f1: 0.3948
 epoch: 26, train_loss: 0.8808, test_loss: 1.3550, test_f1: 0.4012
 epoch: 27, train_loss: 0.8625, test_loss: 1.1650, test_f1: 0.4505
 epoch: 28, train_loss: 0.8381, test_loss: 1.0389, test_f1: 0.5545
 epoch: 29, train_loss: 0.8171, test_loss: 1.0895, test_f1: 0.4970
 epoch: 30, train_loss: 0.8498, test_loss: 1.2810, test_f1: 0.5095
 epoch: 31, train_loss: 0.8430, test_loss: 1.0683, test_f1: 0.4988
 epoch: 32, train_loss: 0.8496, test_loss: 1.0614, test_f1: 0.5337
 epoch: 33, train_loss: 0.8377, test_loss: 1.1190, test_f1: 0.4568
 epoch: 34, train_loss: 0.8136, test_loss: 1.0267, test_f1: 0.5208
 epoch: 35, train_loss: 0.8260, test_loss: 1.0919, test_f1: 0.5012
 epoch: 36, train_loss: 0.8459, test_loss: 1.1954, test_f1: 0.4867
 epoch: 37, train_loss: 0.8330, test_loss: 0.9901, test_f1: 0.5760
 epoch: 38, train_loss: 0.8122, test_loss: 1.0024, test_f1: 0.5594
 epoch: 39, train_loss: 0.8145, test_loss: 1.0505, test_f1: 0.5693
 epoch: 40, train_loss: 0.8113, test_loss: 1.1192, test_f1: 0.5100
 epoch: 41, train_loss: 0.8258, test_loss: 2.3066, test_f1: 0.2574
 epoch: 42, train_loss: 0.8804, test_loss: 1.0778, test_f1: 0.4990
 epoch: 43, train_loss: 0.8335, test_loss: 1.1439, test_f1: 0.4982
 epoch: 44, train_loss: 0.8413, test_loss: 1.0643, test_f1: 0.5225
 epoch: 45, train_loss: 0.8126, test_loss: 1.0983, test_f1: 0.5203
 epoch: 46, train_loss: 0.8276, test_loss: 1.0371, test_f1: 0.5730
 epoch: 47, train_loss: 0.8354, test_loss: 1.0185, test_f1: 0.5566
 epoch: 48, train_loss: 0.8303, test_loss: 1.0905, test_f1: 0.5342
 epoch: 49, train_loss: 0.8149, test_loss: 1.1922, test_f1: 0.4677
 epoch: 50, train_loss: 0.8061, test_loss: 1.0822, test_f1: 0.5105
 epoch: 51, train_loss: 0.8283, test_loss: 1.1315, test_f1: 0.5383
 epoch: 52, train_loss: 0.8054, test_loss: 1.0821, test_f1: 0.5199
 epoch: 53, train_loss: 0.7878, test_loss: 1.0959, test_f1: 0.5103
 epoch: 54, train_loss: 0.7703, test_loss: 1.1993, test_f1: 0.5300
 epoch: 55, train_loss: 0.7570, test_loss: 1.2518, test_f1: 0.5071
 epoch: 56, train_loss: 0.7616, test_loss: 1.1557, test_f1: 0.5256
 epoch: 57, train_loss: 0.7676, test_loss: 1.1232, test_f1: 0.5591
 epoch: 58, train_loss: 0.7544, test_loss: 1.1261, test_f1: 0.5700
 epoch: 59, train_loss: 0.7645, test_loss: 1.1978, test_f1: 0.5034
 epoch: 60, train_loss: 0.7615, test_loss: 1.1006, test_f1: 0.5535
 epoch: 61, train_loss: 0.7646, test_loss: 1.0904, test_f1: 0.5520
 epoch: 62, train_loss: 0.7718, test_loss: 1.2071, test_f1: 0.5262
 epoch: 63, train_loss: 0.7604, test_loss: 1.1159, test_f1: 0.5282
 epoch: 64, train_loss: 0.7346, test_loss: 1.1173, test_f1: 0.5587
 epoch: 65, train_loss: 0.7501, test_loss: 1.2239, test_f1: 0.5283
 epoch: 66, train_loss: 0.7610, test_loss: 1.1891, test_f1: 0.5171
 epoch: 67, train_loss: 0.7428, test_loss: 1.1257, test_f1: 0.5457
 epoch: 68, train_loss: 0.7345, test_loss: 1.1556, test_f1: 0.5430
 epoch: 69, train_loss: 0.7549, test_loss: 1.1579, test_f1: 0.5773
 epoch: 70, train_loss: 0.7359, test_loss: 1.1465, test_f1: 0.5885
 epoch: 71, train_loss: 0.7574, test_loss: 1.2100, test_f1: 0.5373
 epoch: 72, train_loss: 0.7453, test_loss: 1.1870, test_f1: 0.5502
 epoch: 73, train_loss: 0.7516, test_loss: 1.2106, test_f1: 0.5524
 epoch: 74, train_loss: 0.7422, test_loss: 1.1714, test_f1: 0.5359
 epoch: 75, train_loss: 0.7187, test_loss: 1.1518, test_f1: 0.5638
 epoch: 76, train_loss: 0.7357, test_loss: 1.2537, test_f1: 0.5384
 epoch: 77, train_loss: 0.7293, test_loss: 1.2143, test_f1: 0.5346
 epoch: 78, train_loss: 0.7272, test_loss: 1.1986, test_f1: 0.5569
 epoch: 79, train_loss: 0.7430, test_loss: 1.1744, test_f1: 0.5403
 epoch: 80, train_loss: 0.7361, test_loss: 1.1493, test_f1: 0.5721
 epoch: 81, train_loss: 0.7475, test_loss: 1.1623, test_f1: 0.5828
 epoch: 82, train_loss: 0.7149, test_loss: 1.1663, test_f1: 0.5355
 epoch: 83, train_loss: 0.7247, test_loss: 1.2134, test_f1: 0.5339
 epoch: 84, train_loss: 0.7258, test_loss: 1.3689, test_f1: 0.4962
 epoch: 85, train_loss: 0.7959, test_loss: 1.1766, test_f1: 0.5438
 epoch: 86, train_loss: 0.7540, test_loss: 1.1756, test_f1: 0.5293
 epoch: 87, train_loss: 0.7457, test_loss: 1.1422, test_f1: 0.5132
 epoch: 88, train_loss: 0.7536, test_loss: 1.2129, test_f1: 0.5049
 epoch: 89, train_loss: 0.7270, test_loss: 1.3150, test_f1: 0.5091
 epoch: 90, train_loss: 0.7355, test_loss: 1.2669, test_f1: 0.5103
 epoch: 91, train_loss: 0.7154, test_loss: 1.1819, test_f1: 0.5533
 epoch: 92, train_loss: 0.7236, test_loss: 1.3316, test_f1: 0.4875
 epoch: 93, train_loss: 0.7205, test_loss: 1.2795, test_f1: 0.5110
 epoch: 94, train_loss: 0.7197, test_loss: 1.2317, test_f1: 0.5375
 epoch: 95, train_loss: 0.7318, test_loss: 1.1579, test_f1: 0.5537
 epoch: 96, train_loss: 0.7088, test_loss: 1.2249, test_f1: 0.5267
 epoch: 97, train_loss: 0.7193, test_loss: 1.3073, test_f1: 0.5324
 epoch: 98, train_loss: 0.7065, test_loss: 1.2924, test_f1: 0.5016
 epoch: 99, train_loss: 0.6988, test_loss: 1.3020, test_f1: 0.5408
##################ITERATION #3 ****************************************
 epoch: 0, train_loss: 1.2629, test_loss: 1.3025, test_f1: 0.2391
 epoch: 1, train_loss: 1.1997, test_loss: 1.3544, test_f1: 0.3314
 epoch: 2, train_loss: 1.1563, test_loss: 1.2729, test_f1: 0.3455
 epoch: 3, train_loss: 1.1035, test_loss: 1.2036, test_f1: 0.4266
 epoch: 4, train_loss: 1.1047, test_loss: 1.1810, test_f1: 0.3705
 epoch: 5, train_loss: 1.0847, test_loss: 1.1778, test_f1: 0.4791
 epoch: 6, train_loss: 1.0753, test_loss: 1.2386, test_f1: 0.4202
 epoch: 7, train_loss: 1.0650, test_loss: 1.1453, test_f1: 0.4918
 epoch: 8, train_loss: 1.0228, test_loss: 1.1747, test_f1: 0.5218
 epoch: 9, train_loss: 1.0411, test_loss: 1.2599, test_f1: 0.4142
 epoch: 10, train_loss: 1.0163, test_loss: 1.1760, test_f1: 0.4637
 epoch: 11, train_loss: 0.9914, test_loss: 1.2020, test_f1: 0.4147
 epoch: 12, train_loss: 1.0139, test_loss: 1.1560, test_f1: 0.4826
 epoch: 13, train_loss: 0.9679, test_loss: 1.3214, test_f1: 0.4285
 epoch: 14, train_loss: 0.9730, test_loss: 1.1038, test_f1: 0.4424
 epoch: 15, train_loss: 0.9379, test_loss: 1.1236, test_f1: 0.4424
 epoch: 16, train_loss: 0.9376, test_loss: 1.1574, test_f1: 0.4546
 epoch: 17, train_loss: 0.9571, test_loss: 1.0605, test_f1: 0.4634
 epoch: 18, train_loss: 0.9441, test_loss: 1.0389, test_f1: 0.5213
 epoch: 19, train_loss: 0.9263, test_loss: 1.0671, test_f1: 0.5266
 epoch: 20, train_loss: 0.9342, test_loss: 1.0599, test_f1: 0.5342
 epoch: 21, train_loss: 0.9175, test_loss: 1.2656, test_f1: 0.4398
 epoch: 22, train_loss: 0.9172, test_loss: 1.1165, test_f1: 0.5235
 epoch: 23, train_loss: 0.9555, test_loss: 1.1261, test_f1: 0.5076
 epoch: 24, train_loss: 0.9154, test_loss: 1.0210, test_f1: 0.4699
 epoch: 25, train_loss: 0.9069, test_loss: 1.0819, test_f1: 0.4930
 epoch: 26, train_loss: 0.9159, test_loss: 1.0568, test_f1: 0.5436
 epoch: 27, train_loss: 0.9119, test_loss: 1.0128, test_f1: 0.5569
 epoch: 28, train_loss: 0.8824, test_loss: 1.1779, test_f1: 0.4623
 epoch: 29, train_loss: 0.9122, test_loss: 1.0570, test_f1: 0.4858
 epoch: 30, train_loss: 0.9090, test_loss: 1.0554, test_f1: 0.5046
 epoch: 31, train_loss: 0.8809, test_loss: 1.0931, test_f1: 0.5420
 epoch: 32, train_loss: 0.8850, test_loss: 1.1159, test_f1: 0.5472
 epoch: 33, train_loss: 0.8815, test_loss: 1.1353, test_f1: 0.5515
 epoch: 34, train_loss: 0.8708, test_loss: 1.0573, test_f1: 0.5596
 epoch: 35, train_loss: 0.8767, test_loss: 1.0276, test_f1: 0.5520
 epoch: 36, train_loss: 0.8666, test_loss: 1.1243, test_f1: 0.5404
 epoch: 37, train_loss: 0.8733, test_loss: 1.0242, test_f1: 0.5688
 epoch: 38, train_loss: 0.8797, test_loss: 1.0859, test_f1: 0.5321
 epoch: 39, train_loss: 0.9030, test_loss: 1.0832, test_f1: 0.5250
 epoch: 40, train_loss: 0.8938, test_loss: 1.0712, test_f1: 0.5535
 epoch: 41, train_loss: 0.8773, test_loss: 1.0840, test_f1: 0.5201
 epoch: 42, train_loss: 0.8689, test_loss: 1.0828, test_f1: 0.5645
 epoch: 43, train_loss: 0.8600, test_loss: 1.1261, test_f1: 0.5492
 epoch: 44, train_loss: 0.8724, test_loss: 1.2113, test_f1: 0.5054
 epoch: 45, train_loss: 0.8734, test_loss: 1.1936, test_f1: 0.4677
 epoch: 46, train_loss: 0.8607, test_loss: 1.2863, test_f1: 0.4429
 epoch: 47, train_loss: 0.8690, test_loss: 1.3409, test_f1: 0.5140
 epoch: 48, train_loss: 0.8804, test_loss: 1.0862, test_f1: 0.5553
 epoch: 49, train_loss: 0.8557, test_loss: 1.0466, test_f1: 0.5687
 epoch: 50, train_loss: 0.8641, test_loss: 1.0604, test_f1: 0.5475
 epoch: 51, train_loss: 0.8458, test_loss: 1.2068, test_f1: 0.5298
 epoch: 52, train_loss: 0.8426, test_loss: 1.1341, test_f1: 0.5496
 epoch: 53, train_loss: 0.8329, test_loss: 1.2003, test_f1: 0.5405
 epoch: 54, train_loss: 0.8277, test_loss: 1.1406, test_f1: 0.5053
 epoch: 55, train_loss: 0.8377, test_loss: 1.1478, test_f1: 0.5349
 epoch: 56, train_loss: 0.8238, test_loss: 1.2661, test_f1: 0.4896
 epoch: 57, train_loss: 0.8426, test_loss: 1.1804, test_f1: 0.5367
 epoch: 58, train_loss: 0.8257, test_loss: 1.1632, test_f1: 0.5733
 epoch: 59, train_loss: 0.8332, test_loss: 1.1880, test_f1: 0.5713
 epoch: 60, train_loss: 0.8336, test_loss: 1.2293, test_f1: 0.5541
 epoch: 61, train_loss: 0.8174, test_loss: 1.2038, test_f1: 0.5407
 epoch: 62, train_loss: 0.8333, test_loss: 1.1727, test_f1: 0.5027
 epoch: 63, train_loss: 0.8237, test_loss: 1.1511, test_f1: 0.5343
 epoch: 64, train_loss: 0.8114, test_loss: 1.1554, test_f1: 0.5517
 epoch: 65, train_loss: 0.8151, test_loss: 1.2641, test_f1: 0.5666
 epoch: 66, train_loss: 0.8148, test_loss: 1.1833, test_f1: 0.5665
 epoch: 67, train_loss: 0.8180, test_loss: 1.2398, test_f1: 0.5661
 epoch: 68, train_loss: 0.8270, test_loss: 1.1626, test_f1: 0.5513
 epoch: 69, train_loss: 0.8162, test_loss: 1.1769, test_f1: 0.5338
 epoch: 70, train_loss: 0.8067, test_loss: 1.1547, test_f1: 0.5158
 epoch: 71, train_loss: 0.8092, test_loss: 1.1508, test_f1: 0.5507
 epoch: 72, train_loss: 0.8061, test_loss: 1.2030, test_f1: 0.5663
 epoch: 73, train_loss: 0.8050, test_loss: 1.2408, test_f1: 0.5243
 epoch: 74, train_loss: 0.8089, test_loss: 1.1571, test_f1: 0.5464
 epoch: 75, train_loss: 0.8123, test_loss: 1.1313, test_f1: 0.5344
 epoch: 76, train_loss: 0.8054, test_loss: 1.1813, test_f1: 0.5848
 epoch: 77, train_loss: 0.8161, test_loss: 1.1877, test_f1: 0.5635
 epoch: 78, train_loss: 0.8094, test_loss: 1.2901, test_f1: 0.5239
 epoch: 79, train_loss: 0.8181, test_loss: 1.2183, test_f1: 0.5615
 epoch: 80, train_loss: 0.8022, test_loss: 1.2167, test_f1: 0.5880
 epoch: 81, train_loss: 0.8108, test_loss: 1.2066, test_f1: 0.5800
 epoch: 82, train_loss: 0.8009, test_loss: 1.1225, test_f1: 0.5728
 epoch: 83, train_loss: 0.8002, test_loss: 1.1678, test_f1: 0.5881
 epoch: 84, train_loss: 0.7892, test_loss: 1.2114, test_f1: 0.5540
 epoch: 85, train_loss: 0.7935, test_loss: 1.2275, test_f1: 0.5498
 epoch: 86, train_loss: 0.8068, test_loss: 1.1863, test_f1: 0.5481
 epoch: 87, train_loss: 0.7716, test_loss: 1.1994, test_f1: 0.5695
 epoch: 88, train_loss: 0.7835, test_loss: 1.1795, test_f1: 0.5624
 epoch: 89, train_loss: 0.7959, test_loss: 1.3390, test_f1: 0.5368
 epoch: 90, train_loss: 0.8083, test_loss: 1.1219, test_f1: 0.5981
 epoch: 91, train_loss: 0.7836, test_loss: 1.2550, test_f1: 0.5598
 epoch: 92, train_loss: 0.8024, test_loss: 1.1098, test_f1: 0.5958
 epoch: 93, train_loss: 0.8216, test_loss: 1.1496, test_f1: 0.5686
 epoch: 94, train_loss: 0.7761, test_loss: 1.1519, test_f1: 0.5858
 epoch: 95, train_loss: 0.7966, test_loss: 1.1604, test_f1: 0.5498
 epoch: 96, train_loss: 0.7775, test_loss: 1.2293, test_f1: 0.4946
 epoch: 97, train_loss: 0.7879, test_loss: 1.1838, test_f1: 0.5718
 epoch: 98, train_loss: 0.7754, test_loss: 1.3703, test_f1: 0.5623
 epoch: 99, train_loss: 0.7711, test_loss: 1.2174, test_f1: 0.5774
##################ITERATION #4 ****************************************
 epoch: 0, train_loss: 1.2482, test_loss: 1.2919, test_f1: 0.2882
 epoch: 1, train_loss: 1.1581, test_loss: 1.2072, test_f1: 0.4445
 epoch: 2, train_loss: 1.1069, test_loss: 1.2112, test_f1: 0.4142
 epoch: 3, train_loss: 1.0544, test_loss: 1.1704, test_f1: 0.3644
 epoch: 4, train_loss: 1.0284, test_loss: 1.0984, test_f1: 0.4430
 epoch: 5, train_loss: 0.9979, test_loss: 1.2129, test_f1: 0.3799
 epoch: 6, train_loss: 0.9628, test_loss: 1.0923, test_f1: 0.4229
 epoch: 7, train_loss: 0.9779, test_loss: 1.0549, test_f1: 0.5439
 epoch: 8, train_loss: 0.9290, test_loss: 1.0355, test_f1: 0.5509
 epoch: 9, train_loss: 0.9418, test_loss: 1.0466, test_f1: 0.4991
 epoch: 10, train_loss: 0.9352, test_loss: 1.1033, test_f1: 0.4924
 epoch: 11, train_loss: 0.9229, test_loss: 1.0626, test_f1: 0.4123
 epoch: 12, train_loss: 0.9453, test_loss: 1.0161, test_f1: 0.4411
 epoch: 13, train_loss: 0.9048, test_loss: 1.1580, test_f1: 0.5246
 epoch: 14, train_loss: 0.9424, test_loss: 1.0097, test_f1: 0.5277
 epoch: 15, train_loss: 0.9089, test_loss: 1.0040, test_f1: 0.5340
 epoch: 16, train_loss: 0.9185, test_loss: 0.9908, test_f1: 0.4642
 epoch: 17, train_loss: 0.9040, test_loss: 1.0046, test_f1: 0.5245
 epoch: 18, train_loss: 0.8800, test_loss: 1.0236, test_f1: 0.4402
 epoch: 19, train_loss: 0.8882, test_loss: 1.0267, test_f1: 0.4106
 epoch: 20, train_loss: 0.8855, test_loss: 1.0282, test_f1: 0.5586
 epoch: 21, train_loss: 0.8831, test_loss: 1.0094, test_f1: 0.5857
 epoch: 22, train_loss: 0.8929, test_loss: 0.9994, test_f1: 0.5847
 epoch: 23, train_loss: 0.8689, test_loss: 1.0738, test_f1: 0.5217
 epoch: 24, train_loss: 0.8643, test_loss: 1.0130, test_f1: 0.5702
 epoch: 25, train_loss: 0.8693, test_loss: 0.9979, test_f1: 0.5772
 epoch: 26, train_loss: 0.8763, test_loss: 1.0041, test_f1: 0.5869
 epoch: 27, train_loss: 0.8704, test_loss: 1.0372, test_f1: 0.5629
 epoch: 28, train_loss: 0.8656, test_loss: 1.0227, test_f1: 0.6198
 epoch: 29, train_loss: 0.8795, test_loss: 0.9999, test_f1: 0.5997
 epoch: 30, train_loss: 0.8623, test_loss: 1.0806, test_f1: 0.5264
 epoch: 31, train_loss: 0.8835, test_loss: 1.0118, test_f1: 0.5850
 epoch: 32, train_loss: 0.8604, test_loss: 1.1171, test_f1: 0.5474
 epoch: 33, train_loss: 0.8523, test_loss: 1.0333, test_f1: 0.5878
 epoch: 34, train_loss: 0.8586, test_loss: 1.0752, test_f1: 0.6019
 epoch: 35, train_loss: 0.8800, test_loss: 1.0718, test_f1: 0.5444
 epoch: 36, train_loss: 0.8805, test_loss: 1.0155, test_f1: 0.5835
 epoch: 37, train_loss: 0.8572, test_loss: 1.0295, test_f1: 0.5659
 epoch: 38, train_loss: 0.8458, test_loss: 1.0515, test_f1: 0.6075
 epoch: 39, train_loss: 0.8372, test_loss: 1.1448, test_f1: 0.5777
 epoch: 40, train_loss: 0.8799, test_loss: 1.0280, test_f1: 0.5856
 epoch: 41, train_loss: 0.8562, test_loss: 1.0339, test_f1: 0.5814
 epoch: 42, train_loss: 0.8449, test_loss: 1.0197, test_f1: 0.5535
 epoch: 43, train_loss: 0.8581, test_loss: 1.0707, test_f1: 0.5470
 epoch: 44, train_loss: 0.8378, test_loss: 1.0495, test_f1: 0.6055
 epoch: 45, train_loss: 0.8209, test_loss: 0.9797, test_f1: 0.6250
 epoch: 46, train_loss: 0.8516, test_loss: 1.0028, test_f1: 0.5840
 epoch: 47, train_loss: 0.8506, test_loss: 1.0003, test_f1: 0.6116
 epoch: 48, train_loss: 0.8417, test_loss: 0.9850, test_f1: 0.5973
 epoch: 49, train_loss: 0.8338, test_loss: 1.0101, test_f1: 0.5926
 epoch: 50, train_loss: 0.8200, test_loss: 1.2349, test_f1: 0.5211
 epoch: 51, train_loss: 0.8308, test_loss: 1.0811, test_f1: 0.6037
 epoch: 52, train_loss: 0.8138, test_loss: 1.0730, test_f1: 0.6175
 epoch: 53, train_loss: 0.8158, test_loss: 1.1112, test_f1: 0.6057
 epoch: 54, train_loss: 0.7977, test_loss: 1.1949, test_f1: 0.6314
 epoch: 55, train_loss: 0.8086, test_loss: 1.0774, test_f1: 0.6127
 epoch: 56, train_loss: 0.7845, test_loss: 1.1449, test_f1: 0.5916
 epoch: 57, train_loss: 0.8097, test_loss: 1.0767, test_f1: 0.6271
 epoch: 58, train_loss: 0.7954, test_loss: 1.0684, test_f1: 0.5917
 epoch: 59, train_loss: 0.7930, test_loss: 1.1327, test_f1: 0.6193
 epoch: 60, train_loss: 0.7962, test_loss: 1.0731, test_f1: 0.6415
 epoch: 61, train_loss: 0.7823, test_loss: 1.1027, test_f1: 0.5941
 epoch: 62, train_loss: 0.8018, test_loss: 1.6669, test_f1: 0.5507
 epoch: 63, train_loss: 0.7792, test_loss: 1.1545, test_f1: 0.5541
 epoch: 64, train_loss: 0.7873, test_loss: 1.1577, test_f1: 0.6306
 epoch: 65, train_loss: 0.7732, test_loss: 1.2195, test_f1: 0.6057
 epoch: 66, train_loss: 0.7797, test_loss: 1.2337, test_f1: 0.6096
 epoch: 67, train_loss: 0.7741, test_loss: 1.0720, test_f1: 0.6351
 epoch: 68, train_loss: 0.7751, test_loss: 1.1343, test_f1: 0.5916
 epoch: 69, train_loss: 0.7919, test_loss: 1.1764, test_f1: 0.5901
 epoch: 70, train_loss: 0.7844, test_loss: 1.1270, test_f1: 0.6000
 epoch: 71, train_loss: 0.7672, test_loss: 1.2643, test_f1: 0.6153
 epoch: 72, train_loss: 0.7665, test_loss: 1.1980, test_f1: 0.6354
 epoch: 73, train_loss: 0.7681, test_loss: 1.1336, test_f1: 0.6376
 epoch: 74, train_loss: 0.7907, test_loss: 1.2120, test_f1: 0.6130
 epoch: 75, train_loss: 0.7791, test_loss: 1.2023, test_f1: 0.5971
 epoch: 76, train_loss: 0.7632, test_loss: 1.2242, test_f1: 0.6098
 epoch: 77, train_loss: 0.7854, test_loss: 1.2466, test_f1: 0.6436
 epoch: 78, train_loss: 0.7592, test_loss: 1.2532, test_f1: 0.6035
 epoch: 79, train_loss: 0.7497, test_loss: 1.1298, test_f1: 0.6396
 epoch: 80, train_loss: 0.7424, test_loss: 1.2126, test_f1: 0.6582
 epoch: 81, train_loss: 0.7586, test_loss: 1.1332, test_f1: 0.5987
 epoch: 82, train_loss: 0.7745, test_loss: 1.1597, test_f1: 0.5986
 epoch: 83, train_loss: 0.7397, test_loss: 1.1144, test_f1: 0.6462
 epoch: 84, train_loss: 0.7635, test_loss: 1.3369, test_f1: 0.5540
 epoch: 85, train_loss: 0.7496, test_loss: 1.2668, test_f1: 0.6397
 epoch: 86, train_loss: 0.7487, test_loss: 1.2032, test_f1: 0.6205
 epoch: 87, train_loss: 0.7546, test_loss: 1.2541, test_f1: 0.6272
 epoch: 88, train_loss: 0.7277, test_loss: 1.2440, test_f1: 0.6323
 epoch: 89, train_loss: 0.7216, test_loss: 1.3171, test_f1: 0.5692
 epoch: 90, train_loss: 0.7406, test_loss: 1.1567, test_f1: 0.6083
 epoch: 91, train_loss: 0.7218, test_loss: 1.2710, test_f1: 0.6271
 epoch: 92, train_loss: 0.7193, test_loss: 1.2319, test_f1: 0.6237
 epoch: 93, train_loss: 0.7437, test_loss: 1.2282, test_f1: 0.5833
 epoch: 94, train_loss: 0.7547, test_loss: 1.2929, test_f1: 0.5892
 epoch: 95, train_loss: 0.7340, test_loss: 1.2212, test_f1: 0.6494
 epoch: 96, train_loss: 0.7318, test_loss: 1.2375, test_f1: 0.6205
 epoch: 97, train_loss: 0.7147, test_loss: 1.2782, test_f1: 0.6186
 epoch: 98, train_loss: 0.7355, test_loss: 1.2301, test_f1: 0.6464
 epoch: 99, train_loss: 0.7601, test_loss: 1.3455, test_f1: 0.5824
##################ITERATION #5 ****************************************
 epoch: 0, train_loss: 1.2416, test_loss: 1.2977, test_f1: 0.2854
 epoch: 1, train_loss: 1.1642, test_loss: 1.2296, test_f1: 0.2902
 epoch: 2, train_loss: 1.1753, test_loss: 1.2954, test_f1: 0.3193
 epoch: 3, train_loss: 1.1071, test_loss: 1.1924, test_f1: 0.3509
 epoch: 4, train_loss: 1.0915, test_loss: 1.1933, test_f1: 0.3731
 epoch: 5, train_loss: 1.0650, test_loss: 1.1708, test_f1: 0.3405
 epoch: 6, train_loss: 1.0398, test_loss: 1.1531, test_f1: 0.3815
 epoch: 7, train_loss: 1.0113, test_loss: 1.3574, test_f1: 0.3335
 epoch: 8, train_loss: 1.0086, test_loss: 1.2070, test_f1: 0.3699
 epoch: 9, train_loss: 0.9745, test_loss: 1.1044, test_f1: 0.4798
 epoch: 10, train_loss: 0.9735, test_loss: 1.1202, test_f1: 0.4178
 epoch: 11, train_loss: 0.9682, test_loss: 1.1277, test_f1: 0.4174
 epoch: 12, train_loss: 0.9693, test_loss: 1.1543, test_f1: 0.4436
 epoch: 13, train_loss: 0.9297, test_loss: 1.1493, test_f1: 0.4494
 epoch: 14, train_loss: 0.9422, test_loss: 1.3634, test_f1: 0.4211
 epoch: 15, train_loss: 0.9783, test_loss: 1.2358, test_f1: 0.4477
 epoch: 16, train_loss: 0.9853, test_loss: 1.1100, test_f1: 0.4152
 epoch: 17, train_loss: 0.9380, test_loss: 1.0732, test_f1: 0.4931
 epoch: 18, train_loss: 0.9387, test_loss: 1.0660, test_f1: 0.4388
 epoch: 19, train_loss: 0.9246, test_loss: 1.0667, test_f1: 0.4885
 epoch: 20, train_loss: 0.9069, test_loss: 1.0524, test_f1: 0.4895
 epoch: 21, train_loss: 0.9003, test_loss: 1.0607, test_f1: 0.5194
 epoch: 22, train_loss: 0.8935, test_loss: 1.0558, test_f1: 0.4342
 epoch: 23, train_loss: 0.8873, test_loss: 1.0438, test_f1: 0.5577
 epoch: 24, train_loss: 0.8863, test_loss: 1.0812, test_f1: 0.5202
 epoch: 25, train_loss: 0.8925, test_loss: 1.0391, test_f1: 0.5242
 epoch: 26, train_loss: 0.8917, test_loss: 1.0714, test_f1: 0.5375
 epoch: 27, train_loss: 0.8705, test_loss: 1.0576, test_f1: 0.5268
 epoch: 28, train_loss: 0.8651, test_loss: 1.0629, test_f1: 0.5285
 epoch: 29, train_loss: 0.8697, test_loss: 1.0699, test_f1: 0.4359
 epoch: 30, train_loss: 0.8675, test_loss: 1.1122, test_f1: 0.5421
 epoch: 31, train_loss: 0.8701, test_loss: 1.0730, test_f1: 0.5519
 epoch: 32, train_loss: 0.8636, test_loss: 1.1050, test_f1: 0.5345
 epoch: 33, train_loss: 0.8599, test_loss: 1.0858, test_f1: 0.5145
 epoch: 34, train_loss: 0.8412, test_loss: 1.0983, test_f1: 0.5270
 epoch: 35, train_loss: 0.8571, test_loss: 1.0455, test_f1: 0.5644
 epoch: 36, train_loss: 0.8604, test_loss: 1.0581, test_f1: 0.5388
 epoch: 37, train_loss: 0.8571, test_loss: 1.0672, test_f1: 0.5382
 epoch: 38, train_loss: 0.8500, test_loss: 1.0668, test_f1: 0.4576
 epoch: 39, train_loss: 0.8532, test_loss: 1.0810, test_f1: 0.5322
 epoch: 40, train_loss: 0.8470, test_loss: 1.0433, test_f1: 0.5494
 epoch: 41, train_loss: 0.8307, test_loss: 1.0852, test_f1: 0.5417
 epoch: 42, train_loss: 0.8412, test_loss: 1.1430, test_f1: 0.5294
 epoch: 43, train_loss: 0.8502, test_loss: 1.0751, test_f1: 0.5902
 epoch: 44, train_loss: 0.8279, test_loss: 1.0788, test_f1: 0.5959
 epoch: 45, train_loss: 0.8215, test_loss: 1.0971, test_f1: 0.5615
 epoch: 46, train_loss: 0.8292, test_loss: 1.0578, test_f1: 0.5761
 epoch: 47, train_loss: 0.8360, test_loss: 1.1228, test_f1: 0.5563
 epoch: 48, train_loss: 0.8417, test_loss: 1.0213, test_f1: 0.5638
 epoch: 49, train_loss: 0.8425, test_loss: 1.0657, test_f1: 0.5851
 epoch: 50, train_loss: 0.8243, test_loss: 1.0701, test_f1: 0.6187
 epoch: 51, train_loss: 0.8033, test_loss: 1.0618, test_f1: 0.5875
 epoch: 52, train_loss: 0.7867, test_loss: 1.0697, test_f1: 0.5744
 epoch: 53, train_loss: 0.7929, test_loss: 1.0695, test_f1: 0.5718
 epoch: 54, train_loss: 0.7895, test_loss: 1.1413, test_f1: 0.5722
 epoch: 55, train_loss: 0.7932, test_loss: 1.1017, test_f1: 0.5648
 epoch: 56, train_loss: 0.7748, test_loss: 1.1038, test_f1: 0.5599
 epoch: 57, train_loss: 0.7834, test_loss: 1.1123, test_f1: 0.5811
 epoch: 58, train_loss: 0.7851, test_loss: 1.0877, test_f1: 0.5647
 epoch: 59, train_loss: 0.7876, test_loss: 1.0930, test_f1: 0.5863
 epoch: 60, train_loss: 0.7815, test_loss: 1.0916, test_f1: 0.5939
 epoch: 61, train_loss: 0.7757, test_loss: 1.1198, test_f1: 0.5914
 epoch: 62, train_loss: 0.7830, test_loss: 1.2422, test_f1: 0.5535
 epoch: 63, train_loss: 0.7679, test_loss: 1.1046, test_f1: 0.5594
 epoch: 64, train_loss: 0.7535, test_loss: 1.1815, test_f1: 0.5452
 epoch: 65, train_loss: 0.7584, test_loss: 1.1314, test_f1: 0.5600
 epoch: 66, train_loss: 0.7610, test_loss: 1.1828, test_f1: 0.5718
 epoch: 67, train_loss: 0.7521, test_loss: 1.0936, test_f1: 0.5777
 epoch: 68, train_loss: 0.7502, test_loss: 1.3032, test_f1: 0.5851
 epoch: 69, train_loss: 0.7439, test_loss: 1.1695, test_f1: 0.5808
 epoch: 70, train_loss: 0.7442, test_loss: 1.1567, test_f1: 0.5900
 epoch: 71, train_loss: 0.7403, test_loss: 1.1123, test_f1: 0.5916
 epoch: 72, train_loss: 0.7518, test_loss: 1.2392, test_f1: 0.5179
 epoch: 73, train_loss: 0.7419, test_loss: 1.1522, test_f1: 0.5767
 epoch: 74, train_loss: 0.7336, test_loss: 1.1538, test_f1: 0.5716
 epoch: 75, train_loss: 0.7381, test_loss: 1.1845, test_f1: 0.5647
 epoch: 76, train_loss: 0.7378, test_loss: 1.0923, test_f1: 0.5878
 epoch: 77, train_loss: 0.7275, test_loss: 1.1281, test_f1: 0.5670
 epoch: 78, train_loss: 0.7189, test_loss: 1.1974, test_f1: 0.5840
 epoch: 79, train_loss: 0.7216, test_loss: 1.1715, test_f1: 0.5844
 epoch: 80, train_loss: 0.7414, test_loss: 1.1390, test_f1: 0.5742
 epoch: 81, train_loss: 0.7334, test_loss: 1.1768, test_f1: 0.5566
 epoch: 82, train_loss: 0.7158, test_loss: 1.1529, test_f1: 0.5819
 epoch: 83, train_loss: 0.7179, test_loss: 1.2544, test_f1: 0.5758
 epoch: 84, train_loss: 0.7247, test_loss: 1.1661, test_f1: 0.5658
 epoch: 85, train_loss: 0.7254, test_loss: 1.1741, test_f1: 0.5782
 epoch: 86, train_loss: 0.7248, test_loss: 1.1746, test_f1: 0.6109
 epoch: 87, train_loss: 0.7028, test_loss: 1.1912, test_f1: 0.5942
 epoch: 88, train_loss: 0.6980, test_loss: 1.1968, test_f1: 0.5698
 epoch: 89, train_loss: 0.6879, test_loss: 1.1861, test_f1: 0.5881
 epoch: 90, train_loss: 0.7074, test_loss: 1.2114, test_f1: 0.6118
 epoch: 91, train_loss: 0.7138, test_loss: 1.2082, test_f1: 0.5888
 epoch: 92, train_loss: 0.6946, test_loss: 1.2834, test_f1: 0.5736
 epoch: 93, train_loss: 0.6854, test_loss: 1.2745, test_f1: 0.5490
 epoch: 94, train_loss: 0.6868, test_loss: 1.3012, test_f1: 0.5535
 epoch: 95, train_loss: 0.6891, test_loss: 1.2183, test_f1: 0.5736
 epoch: 96, train_loss: 0.7292, test_loss: 1.2934, test_f1: 0.5852
 epoch: 97, train_loss: 0.6949, test_loss: 1.2796, test_f1: 0.5481
 epoch: 98, train_loss: 0.6784, test_loss: 1.2792, test_f1: 0.5822
 epoch: 99, train_loss: 0.6827, test_loss: 1.2288, test_f1: 0.6055
##################ITERATION #6 ****************************************
 epoch: 0, train_loss: 1.2855, test_loss: 1.2956, test_f1: 0.2963
 epoch: 1, train_loss: 1.1517, test_loss: 1.2087, test_f1: 0.3928
 epoch: 2, train_loss: 1.0832, test_loss: 1.2758, test_f1: 0.3653
 epoch: 3, train_loss: 1.0569, test_loss: 1.1968, test_f1: 0.3733
 epoch: 4, train_loss: 1.0099, test_loss: 1.2996, test_f1: 0.3813
 epoch: 5, train_loss: 1.0018, test_loss: 1.0697, test_f1: 0.4918
 epoch: 6, train_loss: 0.9850, test_loss: 1.0482, test_f1: 0.4079
 epoch: 7, train_loss: 1.0115, test_loss: 1.1118, test_f1: 0.4164
 epoch: 8, train_loss: 1.0175, test_loss: 1.0839, test_f1: 0.5450
 epoch: 9, train_loss: 0.9616, test_loss: 1.0580, test_f1: 0.5280
 epoch: 10, train_loss: 0.9655, test_loss: 1.1207, test_f1: 0.3916
 epoch: 11, train_loss: 0.9359, test_loss: 1.1179, test_f1: 0.4256
 epoch: 12, train_loss: 0.9395, test_loss: 1.0729, test_f1: 0.3974
 epoch: 13, train_loss: 0.9525, test_loss: 0.9972, test_f1: 0.5538
 epoch: 14, train_loss: 0.9396, test_loss: 1.0885, test_f1: 0.4755
 epoch: 15, train_loss: 0.9047, test_loss: 1.0220, test_f1: 0.5127
 epoch: 16, train_loss: 0.8993, test_loss: 1.0218, test_f1: 0.5202
 epoch: 17, train_loss: 0.9309, test_loss: 1.1692, test_f1: 0.4624
 epoch: 18, train_loss: 0.9041, test_loss: 1.0741, test_f1: 0.4228
 epoch: 19, train_loss: 0.9146, test_loss: 1.0595, test_f1: 0.4312
 epoch: 20, train_loss: 0.8963, test_loss: 1.1069, test_f1: 0.4424
 epoch: 21, train_loss: 0.9058, test_loss: 0.9810, test_f1: 0.5609
 epoch: 22, train_loss: 0.8947, test_loss: 1.0149, test_f1: 0.5401
 epoch: 23, train_loss: 0.9245, test_loss: 1.0024, test_f1: 0.4826
 epoch: 24, train_loss: 0.8948, test_loss: 0.9853, test_f1: 0.5498
 epoch: 25, train_loss: 0.9070, test_loss: 1.0210, test_f1: 0.5350
 epoch: 26, train_loss: 0.8828, test_loss: 0.9570, test_f1: 0.5642
 epoch: 27, train_loss: 0.8889, test_loss: 0.9908, test_f1: 0.5653
 epoch: 28, train_loss: 0.8604, test_loss: 1.2706, test_f1: 0.5455
 epoch: 29, train_loss: 0.9157, test_loss: 1.2648, test_f1: 0.4668
 epoch: 30, train_loss: 0.8915, test_loss: 0.9979, test_f1: 0.5726
 epoch: 31, train_loss: 0.8719, test_loss: 0.9993, test_f1: 0.4499
 epoch: 32, train_loss: 0.8778, test_loss: 1.0527, test_f1: 0.5134
 epoch: 33, train_loss: 0.8848, test_loss: 1.0308, test_f1: 0.5810
 epoch: 34, train_loss: 0.8910, test_loss: 1.0499, test_f1: 0.4259
 epoch: 35, train_loss: 0.8798, test_loss: 0.9614, test_f1: 0.5318
 epoch: 36, train_loss: 0.8669, test_loss: 1.0686, test_f1: 0.5448
 epoch: 37, train_loss: 0.8663, test_loss: 1.0372, test_f1: 0.5531
 epoch: 38, train_loss: 0.8724, test_loss: 0.9957, test_f1: 0.6000
 epoch: 39, train_loss: 0.8670, test_loss: 1.0508, test_f1: 0.5609
 epoch: 40, train_loss: 0.8616, test_loss: 1.0142, test_f1: 0.5802
 epoch: 41, train_loss: 0.8621, test_loss: 1.0373, test_f1: 0.6160
 epoch: 42, train_loss: 0.8655, test_loss: 1.0217, test_f1: 0.5990
 epoch: 43, train_loss: 0.8711, test_loss: 1.0789, test_f1: 0.5592
 epoch: 44, train_loss: 0.8616, test_loss: 1.0508, test_f1: 0.5667
 epoch: 45, train_loss: 0.8574, test_loss: 1.0383, test_f1: 0.5691
 epoch: 46, train_loss: 0.8815, test_loss: 0.9918, test_f1: 0.5824
 epoch: 47, train_loss: 0.8621, test_loss: 1.1488, test_f1: 0.5558
 epoch: 48, train_loss: 0.8643, test_loss: 1.0067, test_f1: 0.5678
 epoch: 49, train_loss: 0.8321, test_loss: 1.1262, test_f1: 0.5682
 epoch: 50, train_loss: 0.8530, test_loss: 1.0613, test_f1: 0.5781
 epoch: 51, train_loss: 0.8359, test_loss: 1.0773, test_f1: 0.5753
 epoch: 52, train_loss: 0.8264, test_loss: 1.0299, test_f1: 0.5820
 epoch: 53, train_loss: 0.8232, test_loss: 1.0302, test_f1: 0.5767
 epoch: 54, train_loss: 0.8165, test_loss: 1.0580, test_f1: 0.6229
 epoch: 55, train_loss: 0.8269, test_loss: 0.9903, test_f1: 0.6114
 epoch: 56, train_loss: 0.8316, test_loss: 1.0648, test_f1: 0.6012
 epoch: 57, train_loss: 0.8386, test_loss: 1.0374, test_f1: 0.5809
 epoch: 58, train_loss: 0.8319, test_loss: 1.0584, test_f1: 0.5532
 epoch: 59, train_loss: 0.8163, test_loss: 1.0502, test_f1: 0.5830
 epoch: 60, train_loss: 0.8071, test_loss: 1.0938, test_f1: 0.5707
 epoch: 61, train_loss: 0.8134, test_loss: 1.0336, test_f1: 0.5675
 epoch: 62, train_loss: 0.8155, test_loss: 1.1042, test_f1: 0.5690
 epoch: 63, train_loss: 0.8223, test_loss: 1.0294, test_f1: 0.5965
 epoch: 64, train_loss: 0.8189, test_loss: 1.1372, test_f1: 0.5595
 epoch: 65, train_loss: 0.7949, test_loss: 1.1112, test_f1: 0.5883
 epoch: 66, train_loss: 0.8168, test_loss: 1.0289, test_f1: 0.5645
 epoch: 67, train_loss: 0.8067, test_loss: 1.0875, test_f1: 0.5736
 epoch: 68, train_loss: 0.8096, test_loss: 1.0629, test_f1: 0.5825
 epoch: 69, train_loss: 0.7909, test_loss: 1.1827, test_f1: 0.5557
 epoch: 70, train_loss: 0.7991, test_loss: 1.0975, test_f1: 0.5631
 epoch: 71, train_loss: 0.8130, test_loss: 1.1005, test_f1: 0.5689
 epoch: 72, train_loss: 0.7817, test_loss: 1.0957, test_f1: 0.5728
 epoch: 73, train_loss: 0.7958, test_loss: 1.1219, test_f1: 0.5594
 epoch: 74, train_loss: 0.8209, test_loss: 1.0817, test_f1: 0.5485
 epoch: 75, train_loss: 0.7975, test_loss: 1.0767, test_f1: 0.6135
 epoch: 76, train_loss: 0.7765, test_loss: 1.1170, test_f1: 0.5532
 epoch: 77, train_loss: 0.7997, test_loss: 1.0867, test_f1: 0.6018
 epoch: 78, train_loss: 0.7799, test_loss: 1.1384, test_f1: 0.5936
 epoch: 79, train_loss: 0.7932, test_loss: 1.0729, test_f1: 0.6134
 epoch: 80, train_loss: 0.7804, test_loss: 1.0884, test_f1: 0.6183
 epoch: 81, train_loss: 0.7930, test_loss: 1.0746, test_f1: 0.6264
 epoch: 82, train_loss: 0.8044, test_loss: 1.0357, test_f1: 0.6429
 epoch: 83, train_loss: 0.7981, test_loss: 1.1355, test_f1: 0.5536
 epoch: 84, train_loss: 0.7686, test_loss: 1.3443, test_f1: 0.5444
 epoch: 85, train_loss: 0.7987, test_loss: 1.1332, test_f1: 0.5522
 epoch: 86, train_loss: 0.7787, test_loss: 1.1403, test_f1: 0.5931
 epoch: 87, train_loss: 0.7928, test_loss: 1.0858, test_f1: 0.5856
 epoch: 88, train_loss: 0.7757, test_loss: 1.1077, test_f1: 0.5729
 epoch: 89, train_loss: 0.7632, test_loss: 1.1471, test_f1: 0.5520
 epoch: 90, train_loss: 0.7871, test_loss: 1.1847, test_f1: 0.5477
 epoch: 91, train_loss: 0.7809, test_loss: 1.1438, test_f1: 0.6083
 epoch: 92, train_loss: 0.7681, test_loss: 1.0795, test_f1: 0.5855
 epoch: 93, train_loss: 0.7580, test_loss: 1.0915, test_f1: 0.5960
 epoch: 94, train_loss: 0.7704, test_loss: 1.2152, test_f1: 0.5582
 epoch: 95, train_loss: 0.7503, test_loss: 1.1594, test_f1: 0.5708
 epoch: 96, train_loss: 0.7566, test_loss: 1.0901, test_f1: 0.5725
 epoch: 97, train_loss: 0.7614, test_loss: 1.2020, test_f1: 0.5482
 epoch: 98, train_loss: 0.7537, test_loss: 1.0740, test_f1: 0.6266
 epoch: 99, train_loss: 0.7500, test_loss: 1.2222, test_f1: 0.5934
##################ITERATION #7 ****************************************
 epoch: 0, train_loss: 1.2839, test_loss: 1.2698, test_f1: 0.3196
 epoch: 1, train_loss: 1.2148, test_loss: 1.3013, test_f1: 0.2539
 epoch: 2, train_loss: 1.1525, test_loss: 1.2381, test_f1: 0.4356
 epoch: 3, train_loss: 1.0882, test_loss: 1.2454, test_f1: 0.2767
 epoch: 4, train_loss: 1.0494, test_loss: 1.4259, test_f1: 0.3072
 epoch: 5, train_loss: 1.0555, test_loss: 1.0678, test_f1: 0.4978
 epoch: 6, train_loss: 1.0044, test_loss: 1.2059, test_f1: 0.3169
 epoch: 7, train_loss: 1.0113, test_loss: 1.2272, test_f1: 0.3256
 epoch: 8, train_loss: 0.9643, test_loss: 1.3545, test_f1: 0.4565
 epoch: 9, train_loss: 0.9655, test_loss: 1.1098, test_f1: 0.5091
 epoch: 10, train_loss: 0.9376, test_loss: 1.0876, test_f1: 0.5417
 epoch: 11, train_loss: 0.9624, test_loss: 1.2374, test_f1: 0.3513
 epoch: 12, train_loss: 0.9385, test_loss: 1.1031, test_f1: 0.5362
 epoch: 13, train_loss: 0.9068, test_loss: 1.1196, test_f1: 0.4775
 epoch: 14, train_loss: 0.9017, test_loss: 1.0906, test_f1: 0.5294
 epoch: 15, train_loss: 0.8922, test_loss: 1.0548, test_f1: 0.5395
 epoch: 16, train_loss: 0.9103, test_loss: 1.2057, test_f1: 0.4589
 epoch: 17, train_loss: 0.9108, test_loss: 1.0422, test_f1: 0.5462
 epoch: 18, train_loss: 0.9333, test_loss: 1.1484, test_f1: 0.4363
 epoch: 19, train_loss: 0.9016, test_loss: 1.3265, test_f1: 0.4527
 epoch: 20, train_loss: 0.8789, test_loss: 1.0416, test_f1: 0.5569
 epoch: 21, train_loss: 0.8890, test_loss: 1.0494, test_f1: 0.4238
 epoch: 22, train_loss: 0.8743, test_loss: 1.0572, test_f1: 0.5102
 epoch: 23, train_loss: 0.8695, test_loss: 1.0224, test_f1: 0.5839
 epoch: 24, train_loss: 0.8684, test_loss: 1.0283, test_f1: 0.5438
 epoch: 25, train_loss: 0.8889, test_loss: 1.0324, test_f1: 0.5322
 epoch: 26, train_loss: 0.8820, test_loss: 1.0609, test_f1: 0.5793
 epoch: 27, train_loss: 0.8642, test_loss: 1.0424, test_f1: 0.4664
 epoch: 28, train_loss: 0.8665, test_loss: 1.1175, test_f1: 0.5446
 epoch: 29, train_loss: 0.8662, test_loss: 1.1281, test_f1: 0.5104
 epoch: 30, train_loss: 0.8601, test_loss: 1.0485, test_f1: 0.5383
 epoch: 31, train_loss: 0.8547, test_loss: 1.0635, test_f1: 0.5528
 epoch: 32, train_loss: 0.8185, test_loss: 1.1050, test_f1: 0.5359
 epoch: 33, train_loss: 0.8733, test_loss: 1.0129, test_f1: 0.5706
 epoch: 34, train_loss: 0.8344, test_loss: 1.0471, test_f1: 0.4421
 epoch: 35, train_loss: 0.8363, test_loss: 1.0184, test_f1: 0.5346
 epoch: 36, train_loss: 0.8397, test_loss: 1.0728, test_f1: 0.4520
 epoch: 37, train_loss: 0.8505, test_loss: 1.0400, test_f1: 0.4650
 epoch: 38, train_loss: 0.8635, test_loss: 1.0969, test_f1: 0.5227
 epoch: 39, train_loss: 0.8544, test_loss: 1.0411, test_f1: 0.5574
 epoch: 40, train_loss: 0.8450, test_loss: 1.1320, test_f1: 0.4423
 epoch: 41, train_loss: 0.8452, test_loss: 1.0634, test_f1: 0.5333
 epoch: 42, train_loss: 0.8635, test_loss: 1.0236, test_f1: 0.5286
 epoch: 43, train_loss: 0.8494, test_loss: 1.0189, test_f1: 0.5655
 epoch: 44, train_loss: 0.8408, test_loss: 1.0820, test_f1: 0.5019
 epoch: 45, train_loss: 0.8417, test_loss: 1.0512, test_f1: 0.5334
 epoch: 46, train_loss: 0.8357, test_loss: 1.0616, test_f1: 0.5471
 epoch: 47, train_loss: 0.8161, test_loss: 1.1131, test_f1: 0.5367
 epoch: 48, train_loss: 0.8357, test_loss: 1.0500, test_f1: 0.5294
 epoch: 49, train_loss: 0.8228, test_loss: 1.0359, test_f1: 0.5330
 epoch: 50, train_loss: 0.8386, test_loss: 1.1126, test_f1: 0.4948
 epoch: 51, train_loss: 0.8158, test_loss: 1.1503, test_f1: 0.4613
 epoch: 52, train_loss: 0.8012, test_loss: 1.0462, test_f1: 0.5340
 epoch: 53, train_loss: 0.8142, test_loss: 1.0467, test_f1: 0.5325
 epoch: 54, train_loss: 0.8016, test_loss: 1.0041, test_f1: 0.5790
 epoch: 55, train_loss: 0.7893, test_loss: 1.0229, test_f1: 0.5744
 epoch: 56, train_loss: 0.7962, test_loss: 1.0474, test_f1: 0.5634
 epoch: 57, train_loss: 0.7845, test_loss: 1.0792, test_f1: 0.5690
 epoch: 58, train_loss: 0.7778, test_loss: 1.0992, test_f1: 0.5732
 epoch: 59, train_loss: 0.7766, test_loss: 1.0901, test_f1: 0.5754
 epoch: 60, train_loss: 0.7773, test_loss: 1.0649, test_f1: 0.5485
 epoch: 61, train_loss: 0.7873, test_loss: 1.0725, test_f1: 0.5080
 epoch: 62, train_loss: 0.7924, test_loss: 1.1222, test_f1: 0.5491
 epoch: 63, train_loss: 0.7842, test_loss: 1.1084, test_f1: 0.5462
 epoch: 64, train_loss: 0.7902, test_loss: 1.0489, test_f1: 0.5836
 epoch: 65, train_loss: 0.7941, test_loss: 1.1544, test_f1: 0.5008
 epoch: 66, train_loss: 0.7948, test_loss: 1.0105, test_f1: 0.5806
 epoch: 67, train_loss: 0.7823, test_loss: 1.1062, test_f1: 0.5461
 epoch: 68, train_loss: 0.7834, test_loss: 1.0501, test_f1: 0.5756
 epoch: 69, train_loss: 0.7874, test_loss: 1.1194, test_f1: 0.4716
 epoch: 70, train_loss: 0.7700, test_loss: 1.1118, test_f1: 0.5211
 epoch: 71, train_loss: 0.7887, test_loss: 1.1025, test_f1: 0.5638
 epoch: 72, train_loss: 0.7783, test_loss: 1.0877, test_f1: 0.5783
 epoch: 73, train_loss: 0.7749, test_loss: 1.0881, test_f1: 0.5926
 epoch: 74, train_loss: 0.7736, test_loss: 1.0801, test_f1: 0.5314
 epoch: 75, train_loss: 0.7675, test_loss: 1.1137, test_f1: 0.5783
 epoch: 76, train_loss: 0.7788, test_loss: 1.1175, test_f1: 0.5001
 epoch: 77, train_loss: 0.7697, test_loss: 1.1494, test_f1: 0.5026
 epoch: 78, train_loss: 0.7658, test_loss: 1.1014, test_f1: 0.5413
 epoch: 79, train_loss: 0.7751, test_loss: 1.1254, test_f1: 0.5563
 epoch: 80, train_loss: 0.7783, test_loss: 1.1239, test_f1: 0.5586
 epoch: 81, train_loss: 0.7644, test_loss: 1.0857, test_f1: 0.5351
 epoch: 82, train_loss: 0.7646, test_loss: 1.0671, test_f1: 0.5604
 epoch: 83, train_loss: 0.7661, test_loss: 1.1437, test_f1: 0.5069
 epoch: 84, train_loss: 0.7638, test_loss: 1.0865, test_f1: 0.5432
 epoch: 85, train_loss: 0.7751, test_loss: 1.0789, test_f1: 0.5532
 epoch: 86, train_loss: 0.7603, test_loss: 1.1291, test_f1: 0.5488
 epoch: 87, train_loss: 0.7616, test_loss: 1.1238, test_f1: 0.5325
 epoch: 88, train_loss: 0.7563, test_loss: 1.0871, test_f1: 0.5696
 epoch: 89, train_loss: 0.7563, test_loss: 1.1221, test_f1: 0.5450
 epoch: 90, train_loss: 0.7597, test_loss: 1.1613, test_f1: 0.5762
 epoch: 91, train_loss: 0.7438, test_loss: 1.2853, test_f1: 0.5046
 epoch: 92, train_loss: 0.7632, test_loss: 1.1474, test_f1: 0.5504
 epoch: 93, train_loss: 0.7755, test_loss: 1.2994, test_f1: 0.4999
 epoch: 94, train_loss: 0.7678, test_loss: 1.1582, test_f1: 0.5536
 epoch: 95, train_loss: 0.7675, test_loss: 1.0796, test_f1: 0.5481
 epoch: 96, train_loss: 0.7614, test_loss: 1.1159, test_f1: 0.5209
 epoch: 97, train_loss: 0.7599, test_loss: 1.0665, test_f1: 0.5873
 epoch: 98, train_loss: 0.7601, test_loss: 1.1641, test_f1: 0.5296
 epoch: 99, train_loss: 0.7610, test_loss: 1.1502, test_f1: 0.5488
##################ITERATION #8 ****************************************
 epoch: 0, train_loss: 1.2728, test_loss: 1.2683, test_f1: 0.3730
 epoch: 1, train_loss: 1.1813, test_loss: 1.2120, test_f1: 0.3359
 epoch: 2, train_loss: 1.1278, test_loss: 1.1974, test_f1: 0.3731
 epoch: 3, train_loss: 1.0954, test_loss: 1.2465, test_f1: 0.4177
 epoch: 4, train_loss: 1.0674, test_loss: 1.1753, test_f1: 0.3962
 epoch: 5, train_loss: 1.0208, test_loss: 1.1171, test_f1: 0.4247
 epoch: 6, train_loss: 0.9932, test_loss: 1.1448, test_f1: 0.4002
 epoch: 7, train_loss: 0.9718, test_loss: 1.1337, test_f1: 0.3950
 epoch: 8, train_loss: 0.9552, test_loss: 1.2021, test_f1: 0.4277
 epoch: 9, train_loss: 0.9822, test_loss: 1.1552, test_f1: 0.4426
 epoch: 10, train_loss: 0.9524, test_loss: 1.0608, test_f1: 0.4332
 epoch: 11, train_loss: 0.9159, test_loss: 1.0671, test_f1: 0.4381
 epoch: 12, train_loss: 0.9166, test_loss: 1.0185, test_f1: 0.5199
 epoch: 13, train_loss: 0.9051, test_loss: 1.0011, test_f1: 0.5436
 epoch: 14, train_loss: 0.8987, test_loss: 1.0879, test_f1: 0.4885
 epoch: 15, train_loss: 0.9147, test_loss: 1.0463, test_f1: 0.4261
 epoch: 16, train_loss: 0.8863, test_loss: 0.9983, test_f1: 0.5302
 epoch: 17, train_loss: 0.8807, test_loss: 0.9982, test_f1: 0.5634
 epoch: 18, train_loss: 0.8744, test_loss: 1.0878, test_f1: 0.4237
 epoch: 19, train_loss: 0.8955, test_loss: 1.0091, test_f1: 0.5093
 epoch: 20, train_loss: 0.8692, test_loss: 1.0294, test_f1: 0.5440
 epoch: 21, train_loss: 0.8775, test_loss: 0.9822, test_f1: 0.5198
 epoch: 22, train_loss: 0.8692, test_loss: 1.0585, test_f1: 0.4406
 epoch: 23, train_loss: 0.8836, test_loss: 0.9989, test_f1: 0.5283
 epoch: 24, train_loss: 0.8686, test_loss: 0.9918, test_f1: 0.4385
 epoch: 25, train_loss: 0.8847, test_loss: 1.0931, test_f1: 0.5816
 epoch: 26, train_loss: 0.8582, test_loss: 0.9799, test_f1: 0.5174
 epoch: 27, train_loss: 0.8474, test_loss: 1.0063, test_f1: 0.5013
 epoch: 28, train_loss: 0.8690, test_loss: 0.9862, test_f1: 0.5480
 epoch: 29, train_loss: 0.8729, test_loss: 0.9737, test_f1: 0.5741
 epoch: 30, train_loss: 0.8574, test_loss: 1.0082, test_f1: 0.4914
 epoch: 31, train_loss: 0.8644, test_loss: 1.0303, test_f1: 0.5816
 epoch: 32, train_loss: 0.8634, test_loss: 0.9841, test_f1: 0.5713
 epoch: 33, train_loss: 0.8664, test_loss: 0.9983, test_f1: 0.5429
 epoch: 34, train_loss: 0.8603, test_loss: 0.9882, test_f1: 0.5680
 epoch: 35, train_loss: 0.8407, test_loss: 1.0445, test_f1: 0.5068
 epoch: 36, train_loss: 0.8463, test_loss: 0.9993, test_f1: 0.5841
 epoch: 37, train_loss: 0.8458, test_loss: 0.9790, test_f1: 0.5568
 epoch: 38, train_loss: 0.8329, test_loss: 1.0616, test_f1: 0.5377
 epoch: 39, train_loss: 0.8613, test_loss: 1.0086, test_f1: 0.5460
 epoch: 40, train_loss: 0.8506, test_loss: 1.0094, test_f1: 0.5743
 epoch: 41, train_loss: 0.8751, test_loss: 0.9742, test_f1: 0.5941
 epoch: 42, train_loss: 0.8321, test_loss: 0.9999, test_f1: 0.5432
 epoch: 43, train_loss: 0.8441, test_loss: 1.0072, test_f1: 0.5669
 epoch: 44, train_loss: 0.8349, test_loss: 1.1595, test_f1: 0.5084
 epoch: 45, train_loss: 0.8296, test_loss: 1.1135, test_f1: 0.4751
 epoch: 46, train_loss: 0.8362, test_loss: 1.0012, test_f1: 0.5472
 epoch: 47, train_loss: 0.8292, test_loss: 0.9751, test_f1: 0.5691
 epoch: 48, train_loss: 0.8369, test_loss: 0.9846, test_f1: 0.5563
 epoch: 49, train_loss: 0.8217, test_loss: 1.0008, test_f1: 0.5367
 epoch: 50, train_loss: 0.8440, test_loss: 1.0248, test_f1: 0.5261
 epoch: 51, train_loss: 0.8184, test_loss: 1.0011, test_f1: 0.5702
 epoch: 52, train_loss: 0.8020, test_loss: 1.0212, test_f1: 0.5622
 epoch: 53, train_loss: 0.8101, test_loss: 0.9654, test_f1: 0.5887
 epoch: 54, train_loss: 0.7880, test_loss: 0.9763, test_f1: 0.5671
 epoch: 55, train_loss: 0.7803, test_loss: 0.9921, test_f1: 0.5842
 epoch: 56, train_loss: 0.7836, test_loss: 0.9967, test_f1: 0.5893
 epoch: 57, train_loss: 0.7918, test_loss: 1.0451, test_f1: 0.5598
 epoch: 58, train_loss: 0.8062, test_loss: 1.0025, test_f1: 0.5670
 epoch: 59, train_loss: 0.7820, test_loss: 0.9978, test_f1: 0.5890
 epoch: 60, train_loss: 0.7947, test_loss: 0.9362, test_f1: 0.5916
 epoch: 61, train_loss: 0.7872, test_loss: 1.0065, test_f1: 0.5686
 epoch: 62, train_loss: 0.8076, test_loss: 0.9487, test_f1: 0.5977
 epoch: 63, train_loss: 0.7774, test_loss: 1.0311, test_f1: 0.5498
 epoch: 64, train_loss: 0.7858, test_loss: 0.9671, test_f1: 0.5779
 epoch: 65, train_loss: 0.7607, test_loss: 1.0480, test_f1: 0.5938
 epoch: 66, train_loss: 0.7923, test_loss: 0.9784, test_f1: 0.5987
 epoch: 67, train_loss: 0.7555, test_loss: 1.0506, test_f1: 0.5354
 epoch: 68, train_loss: 0.7650, test_loss: 1.0198, test_f1: 0.5960
 epoch: 69, train_loss: 0.7743, test_loss: 1.0064, test_f1: 0.5666
 epoch: 70, train_loss: 0.7830, test_loss: 0.9224, test_f1: 0.6126
 epoch: 71, train_loss: 0.7813, test_loss: 1.0293, test_f1: 0.5869
 epoch: 72, train_loss: 0.7856, test_loss: 0.9896, test_f1: 0.6057
 epoch: 73, train_loss: 0.7886, test_loss: 0.9782, test_f1: 0.6065
 epoch: 74, train_loss: 0.7844, test_loss: 1.0144, test_f1: 0.5850
 epoch: 75, train_loss: 0.7743, test_loss: 0.9684, test_f1: 0.6024
 epoch: 76, train_loss: 0.7711, test_loss: 0.9995, test_f1: 0.5768
 epoch: 77, train_loss: 0.7610, test_loss: 0.9533, test_f1: 0.6012
 epoch: 78, train_loss: 0.7580, test_loss: 0.9579, test_f1: 0.5853
 epoch: 79, train_loss: 0.7682, test_loss: 0.9929, test_f1: 0.5993
 epoch: 80, train_loss: 0.7401, test_loss: 1.0193, test_f1: 0.5698
 epoch: 81, train_loss: 0.7697, test_loss: 1.0197, test_f1: 0.5985
 epoch: 82, train_loss: 0.7601, test_loss: 0.9974, test_f1: 0.6117
 epoch: 83, train_loss: 0.7380, test_loss: 1.0998, test_f1: 0.5795
 epoch: 84, train_loss: 0.7651, test_loss: 0.9938, test_f1: 0.5874
 epoch: 85, train_loss: 0.7618, test_loss: 1.0693, test_f1: 0.5561
 epoch: 86, train_loss: 0.7449, test_loss: 1.0697, test_f1: 0.5627
 epoch: 87, train_loss: 0.7570, test_loss: 1.0506, test_f1: 0.5666
 epoch: 88, train_loss: 0.7576, test_loss: 1.0191, test_f1: 0.5593
 epoch: 89, train_loss: 0.7411, test_loss: 1.0408, test_f1: 0.5685
 epoch: 90, train_loss: 0.7393, test_loss: 1.0803, test_f1: 0.5453
 epoch: 91, train_loss: 0.7464, test_loss: 0.9938, test_f1: 0.5815
 epoch: 92, train_loss: 0.7539, test_loss: 1.0485, test_f1: 0.5496
 epoch: 93, train_loss: 0.7383, test_loss: 1.0384, test_f1: 0.5653
 epoch: 94, train_loss: 0.7340, test_loss: 1.0959, test_f1: 0.5640
 epoch: 95, train_loss: 0.7496, test_loss: 1.0412, test_f1: 0.5762
 epoch: 96, train_loss: 0.7420, test_loss: 1.0160, test_f1: 0.5970
 epoch: 97, train_loss: 0.7515, test_loss: 1.0732, test_f1: 0.5861
 epoch: 98, train_loss: 0.7312, test_loss: 0.9779, test_f1: 0.6293
 epoch: 99, train_loss: 0.7614, test_loss: 1.0631, test_f1: 0.6356
##################ITERATION #9 ****************************************
 epoch: 0, train_loss: 1.2678, test_loss: 1.3325, test_f1: 0.2755
 epoch: 1, train_loss: 1.1905, test_loss: 1.2429, test_f1: 0.3431
 epoch: 2, train_loss: 1.1481, test_loss: 1.2057, test_f1: 0.3761
 epoch: 3, train_loss: 1.1328, test_loss: 1.1972, test_f1: 0.3743
 epoch: 4, train_loss: 1.0925, test_loss: 1.1989, test_f1: 0.4275
 epoch: 5, train_loss: 1.1034, test_loss: 1.4693, test_f1: 0.3502
 epoch: 6, train_loss: 1.0473, test_loss: 1.2128, test_f1: 0.4123
 epoch: 7, train_loss: 1.0329, test_loss: 1.1799, test_f1: 0.4459
 epoch: 8, train_loss: 1.0271, test_loss: 1.2190, test_f1: 0.3446
 epoch: 9, train_loss: 0.9936, test_loss: 1.1423, test_f1: 0.4546
 epoch: 10, train_loss: 0.9846, test_loss: 1.1731, test_f1: 0.5146
 epoch: 11, train_loss: 0.9621, test_loss: 1.1544, test_f1: 0.4993
 epoch: 12, train_loss: 0.9656, test_loss: 1.2793, test_f1: 0.4553
 epoch: 13, train_loss: 0.9477, test_loss: 1.4542, test_f1: 0.3985
 epoch: 14, train_loss: 0.9349, test_loss: 1.1722, test_f1: 0.5435
 epoch: 15, train_loss: 0.9326, test_loss: 1.3427, test_f1: 0.4015
 epoch: 16, train_loss: 0.9018, test_loss: 1.1669, test_f1: 0.4990
 epoch: 17, train_loss: 0.9075, test_loss: 1.0600, test_f1: 0.5303
 epoch: 18, train_loss: 0.8964, test_loss: 0.9975, test_f1: 0.5949
 epoch: 19, train_loss: 0.8918, test_loss: 1.0705, test_f1: 0.5167
 epoch: 20, train_loss: 0.8850, test_loss: 1.0161, test_f1: 0.5044
 epoch: 21, train_loss: 0.8868, test_loss: 1.0659, test_f1: 0.4129
 epoch: 22, train_loss: 0.9094, test_loss: 1.0212, test_f1: 0.5454
 epoch: 23, train_loss: 0.8735, test_loss: 1.0021, test_f1: 0.5485
 epoch: 24, train_loss: 0.8928, test_loss: 1.0737, test_f1: 0.5030
 epoch: 25, train_loss: 0.8686, test_loss: 1.0734, test_f1: 0.5515
 epoch: 26, train_loss: 0.8585, test_loss: 1.1953, test_f1: 0.5194
 epoch: 27, train_loss: 0.8584, test_loss: 1.0506, test_f1: 0.5478
 epoch: 28, train_loss: 0.8592, test_loss: 1.0742, test_f1: 0.5418
 epoch: 29, train_loss: 0.8508, test_loss: 1.1300, test_f1: 0.5133
 epoch: 30, train_loss: 0.8463, test_loss: 1.0614, test_f1: 0.5101
 epoch: 31, train_loss: 0.8482, test_loss: 1.1316, test_f1: 0.4942
 epoch: 32, train_loss: 0.8641, test_loss: 1.0129, test_f1: 0.5484
 epoch: 33, train_loss: 0.8586, test_loss: 1.0220, test_f1: 0.5462
 epoch: 34, train_loss: 0.8555, test_loss: 1.0698, test_f1: 0.4928
 epoch: 35, train_loss: 0.8558, test_loss: 1.2219, test_f1: 0.5013
 epoch: 36, train_loss: 0.8477, test_loss: 1.0173, test_f1: 0.5506
 epoch: 37, train_loss: 0.8296, test_loss: 1.0482, test_f1: 0.5631
 epoch: 38, train_loss: 0.8379, test_loss: 1.1799, test_f1: 0.5058
 epoch: 39, train_loss: 0.8540, test_loss: 1.4606, test_f1: 0.5389
 epoch: 40, train_loss: 0.8328, test_loss: 1.0260, test_f1: 0.5456
 epoch: 41, train_loss: 0.8639, test_loss: 1.0925, test_f1: 0.5147
 epoch: 42, train_loss: 0.8275, test_loss: 1.3720, test_f1: 0.4815
 epoch: 43, train_loss: 0.8519, test_loss: 1.1398, test_f1: 0.5381
 epoch: 44, train_loss: 0.8076, test_loss: 1.3150, test_f1: 0.5247
 epoch: 45, train_loss: 0.8252, test_loss: 1.0165, test_f1: 0.5669
 epoch: 46, train_loss: 0.8169, test_loss: 0.9997, test_f1: 0.5746
 epoch: 47, train_loss: 0.8341, test_loss: 1.0436, test_f1: 0.5048
 epoch: 48, train_loss: 0.8425, test_loss: 1.0329, test_f1: 0.5650
 epoch: 49, train_loss: 0.8310, test_loss: 1.0248, test_f1: 0.5639
 epoch: 50, train_loss: 0.8185, test_loss: 1.0659, test_f1: 0.5218
 epoch: 51, train_loss: 0.8032, test_loss: 1.0760, test_f1: 0.5607
 epoch: 52, train_loss: 0.8046, test_loss: 1.0476, test_f1: 0.5624
 epoch: 53, train_loss: 0.7989, test_loss: 1.0591, test_f1: 0.5486
 epoch: 54, train_loss: 0.7850, test_loss: 1.1494, test_f1: 0.5121
 epoch: 55, train_loss: 0.7681, test_loss: 1.2671, test_f1: 0.5711
 epoch: 56, train_loss: 0.7870, test_loss: 1.0468, test_f1: 0.5460
 epoch: 57, train_loss: 0.7694, test_loss: 1.2326, test_f1: 0.5311
 epoch: 58, train_loss: 0.7939, test_loss: 1.2437, test_f1: 0.5465
 epoch: 59, train_loss: 0.7520, test_loss: 1.2234, test_f1: 0.5575
 epoch: 60, train_loss: 0.7614, test_loss: 1.3323, test_f1: 0.5502
 epoch: 61, train_loss: 0.7602, test_loss: 1.4704, test_f1: 0.5610
 epoch: 62, train_loss: 0.7867, test_loss: 1.1971, test_f1: 0.5476
 epoch: 63, train_loss: 0.7741, test_loss: 1.0844, test_f1: 0.5423
 epoch: 64, train_loss: 0.7605, test_loss: 1.1646, test_f1: 0.5174
 epoch: 65, train_loss: 0.7625, test_loss: 1.2233, test_f1: 0.5952
 epoch: 66, train_loss: 0.7864, test_loss: 1.2981, test_f1: 0.4922
 epoch: 67, train_loss: 0.7692, test_loss: 1.0659, test_f1: 0.5712
 epoch: 68, train_loss: 0.7473, test_loss: 1.2308, test_f1: 0.5393
 epoch: 69, train_loss: 0.7602, test_loss: 1.2862, test_f1: 0.4789
 epoch: 70, train_loss: 0.7474, test_loss: 1.1797, test_f1: 0.5642
 epoch: 71, train_loss: 0.7534, test_loss: 1.4464, test_f1: 0.5118
 epoch: 72, train_loss: 0.7206, test_loss: 1.3229, test_f1: 0.5481
 epoch: 73, train_loss: 0.7672, test_loss: 1.3821, test_f1: 0.5167
 epoch: 74, train_loss: 0.7383, test_loss: 1.4530, test_f1: 0.5865
 epoch: 75, train_loss: 0.7468, test_loss: 1.6114, test_f1: 0.4871
 epoch: 76, train_loss: 0.7424, test_loss: 1.3174, test_f1: 0.5834
 epoch: 77, train_loss: 0.7440, test_loss: 1.2280, test_f1: 0.5303
 epoch: 78, train_loss: 0.7674, test_loss: 1.1374, test_f1: 0.5140
 epoch: 79, train_loss: 0.7302, test_loss: 1.2039, test_f1: 0.5256
 epoch: 80, train_loss: 0.7240, test_loss: 1.5063, test_f1: 0.5360
 epoch: 81, train_loss: 0.7413, test_loss: 1.3479, test_f1: 0.5737
 epoch: 82, train_loss: 0.7240, test_loss: 1.1245, test_f1: 0.5360
 epoch: 83, train_loss: 0.7188, test_loss: 1.3200, test_f1: 0.5197
 epoch: 84, train_loss: 0.7207, test_loss: 1.1811, test_f1: 0.5666
 epoch: 85, train_loss: 0.7243, test_loss: 1.1717, test_f1: 0.5392
 epoch: 86, train_loss: 0.7318, test_loss: 1.1328, test_f1: 0.5290
 epoch: 87, train_loss: 0.7357, test_loss: 1.1032, test_f1: 0.5441
 epoch: 88, train_loss: 0.7146, test_loss: 1.2630, test_f1: 0.4979
 epoch: 89, train_loss: 0.7107, test_loss: 1.1799, test_f1: 0.5157
 epoch: 90, train_loss: 0.7274, test_loss: 1.1814, test_f1: 0.5360
 epoch: 91, train_loss: 0.7191, test_loss: 1.3782, test_f1: 0.5358
 epoch: 92, train_loss: 0.7112, test_loss: 1.1806, test_f1: 0.5214
 epoch: 93, train_loss: 0.6914, test_loss: 1.2399, test_f1: 0.5281
 epoch: 94, train_loss: 0.6983, test_loss: 1.3333, test_f1: 0.5310
 epoch: 95, train_loss: 0.7072, test_loss: 1.1456, test_f1: 0.5368
 epoch: 96, train_loss: 0.7245, test_loss: 1.1855, test_f1: 0.5502
 epoch: 97, train_loss: 0.6968, test_loss: 1.2179, test_f1: 0.5402
 epoch: 98, train_loss: 0.7121, test_loss: 1.2932, test_f1: 0.5162
 epoch: 99, train_loss: 0.7043, test_loss: 1.0816, test_f1: 0.5745

Training completed in 663.21 seconds
Best F1: 0.6582 at epoch 80
Mean F1 across iterations: 0.6172  0.0227
========================FINAL RESULTS================================
FEGIN weighted F1: 0.6582  0.0227
python main.py --data ltspice_demos --representation component_component --model FEGIN --layers 4 --hiddens 16 --batch_size 32 --lr 0.01 --emb_size 512 --epochs 100 --save_appendix component_component_L4_H16_BS32_LR0.01_E512 --no_val
-----



STDERR:
  File "main.py", line 370, in <module>
    main()
  File "main.py", line 254, in main
    dataset = dataset_class(
  File "/home/philip/projects/ltspice_examples_code_repo/Circuit-Completion-Using-GNNs/component_classification_with_link_prediction_head/evaluation/FEGIN/kernel/circuit_datasets.py", line 15, in __init__
    self.data, self.slices = torch.load(self.processed_paths[0])
  File "/home/philip/.local/lib/python3.8/site-packages/torch/serialization.py", line 1040, in load
    warnings.warn(
  File "/usr/lib/python3.8/warnings.py", line 109, in _showwarnmsg
    sw(msg.message, msg.category, msg.filename, msg.lineno,
  File "main.py", line 47, in warn_with_traceback
    traceback.print_stack(file=log)
/home/philip/projects/ltspice_examples_code_repo/Circuit-Completion-Using-GNNs/component_classification_with_link_prediction_head/evaluation/FEGIN/kernel/circuit_datasets.py:15: FutureWarning: You are using `torch.load` with `weights_only=False` (the current default value), which uses the default pickle module implicitly. It is possible to construct malicious pickle data which will execute arbitrary code during unpickling (See https://github.com/pytorch/pytorch/blob/main/SECURITY.md#untrusted-models for more details). In a future release, the default value for `weights_only` will be flipped to `True`. This limits the functions that could be executed during unpickling. Arbitrary objects will no longer be allowed to be loaded via this mode unless they are explicitly allowlisted by the user via `torch.serialization.add_safe_globals`. We recommend you start setting `weights_only=True` for any use case where you don't have full control of the loaded file. Please open an issue on GitHub for any issues related to this experimental feature.
  self.data, self.slices = torch.load(self.processed_paths[0])
