STDOUT:
Results will be saved in /home/philip/projects/ltspice_examples_code_repo/Circuit-Completion-Using-GNNs/component_classification_with_link_prediction_head/evaluation/FEGIN/results/model_FEGIN_dataset_ltspice_examples
Command line input: python main.py --data ltspice_examples --representation component_net --model FEGIN --layers 5 --hiddens 16 --batch_size 256 --lr 0.001 --emb_size 512 --epochs 100 --save_appendix component_net_L5_H16_BS256_LR0.001_E512 --no_val
 is saved.
-----
ltspice_examples - FEGIN
Using 5 layers, 16 hidden units, h = 2
Loading component_net representation dataset
ENTERED
Training FEGIN on component_net representation
Train: 3558, Test: 846
##################ITERATION #0 ****************************************
 epoch: 0, train_loss: 1.4114, test_loss: 1.4057, test_f1: 0.1004
 epoch: 1, train_loss: 1.3882, test_loss: 1.3946, test_f1: 0.1004
 epoch: 2, train_loss: 1.3663, test_loss: 1.3771, test_f1: 0.2193
 epoch: 3, train_loss: 1.3429, test_loss: 1.3418, test_f1: 0.2976
 epoch: 4, train_loss: 1.3149, test_loss: 1.3120, test_f1: 0.2756
 epoch: 5, train_loss: 1.2870, test_loss: 1.2817, test_f1: 0.2780
 epoch: 6, train_loss: 1.2721, test_loss: 1.2612, test_f1: 0.2834
 epoch: 7, train_loss: 1.2548, test_loss: 1.2387, test_f1: 0.3370
 epoch: 8, train_loss: 1.2413, test_loss: 1.2243, test_f1: 0.3393
 epoch: 9, train_loss: 1.2295, test_loss: 1.2100, test_f1: 0.3241
 epoch: 10, train_loss: 1.2220, test_loss: 1.1968, test_f1: 0.3067
 epoch: 11, train_loss: 1.2095, test_loss: 1.1952, test_f1: 0.3570
 epoch: 12, train_loss: 1.2066, test_loss: 1.1744, test_f1: 0.3518
 epoch: 13, train_loss: 1.1891, test_loss: 1.1634, test_f1: 0.3565
 epoch: 14, train_loss: 1.1815, test_loss: 1.1564, test_f1: 0.3308
 epoch: 15, train_loss: 1.1667, test_loss: 1.1391, test_f1: 0.3524
 epoch: 16, train_loss: 1.1601, test_loss: 1.1243, test_f1: 0.3501
 epoch: 17, train_loss: 1.1462, test_loss: 1.1159, test_f1: 0.3584
 epoch: 18, train_loss: 1.1288, test_loss: 1.1127, test_f1: 0.4026
 epoch: 19, train_loss: 1.1260, test_loss: 1.0924, test_f1: 0.3716
 epoch: 20, train_loss: 1.1212, test_loss: 1.0838, test_f1: 0.3609
 epoch: 21, train_loss: 1.1038, test_loss: 1.0646, test_f1: 0.3735
 epoch: 22, train_loss: 1.0832, test_loss: 1.0479, test_f1: 0.4113
 epoch: 23, train_loss: 1.0884, test_loss: 1.0513, test_f1: 0.4266
 epoch: 24, train_loss: 1.0753, test_loss: 1.0324, test_f1: 0.4608
 epoch: 25, train_loss: 1.0669, test_loss: 1.0365, test_f1: 0.4600
 epoch: 26, train_loss: 1.0620, test_loss: 1.0216, test_f1: 0.4886
 epoch: 27, train_loss: 1.0454, test_loss: 1.0012, test_f1: 0.4932
 epoch: 28, train_loss: 1.0396, test_loss: 0.9973, test_f1: 0.4905
 epoch: 29, train_loss: 1.0321, test_loss: 0.9983, test_f1: 0.4904
 epoch: 30, train_loss: 1.0139, test_loss: 0.9757, test_f1: 0.5117
 epoch: 31, train_loss: 1.0124, test_loss: 0.9650, test_f1: 0.5046
 epoch: 32, train_loss: 0.9999, test_loss: 0.9697, test_f1: 0.5187
 epoch: 33, train_loss: 0.9909, test_loss: 0.9545, test_f1: 0.5038
 epoch: 34, train_loss: 0.9849, test_loss: 0.9451, test_f1: 0.5403
 epoch: 35, train_loss: 0.9823, test_loss: 0.9677, test_f1: 0.4854
 epoch: 36, train_loss: 0.9674, test_loss: 0.9487, test_f1: 0.5380
 epoch: 37, train_loss: 0.9689, test_loss: 0.9321, test_f1: 0.5565
 epoch: 38, train_loss: 0.9536, test_loss: 0.9557, test_f1: 0.5116
 epoch: 39, train_loss: 0.9549, test_loss: 0.9317, test_f1: 0.5417
 epoch: 40, train_loss: 0.9496, test_loss: 0.9347, test_f1: 0.5448
 epoch: 41, train_loss: 0.9498, test_loss: 0.9563, test_f1: 0.5374
 epoch: 42, train_loss: 0.9407, test_loss: 0.9127, test_f1: 0.5519
 epoch: 43, train_loss: 0.9404, test_loss: 0.9032, test_f1: 0.5632
 epoch: 44, train_loss: 0.9460, test_loss: 0.9430, test_f1: 0.5249
 epoch: 45, train_loss: 0.9446, test_loss: 0.9337, test_f1: 0.5176
 epoch: 46, train_loss: 0.9372, test_loss: 0.9287, test_f1: 0.5330
 epoch: 47, train_loss: 0.9145, test_loss: 0.8995, test_f1: 0.5714
 epoch: 48, train_loss: 0.9229, test_loss: 0.9057, test_f1: 0.5570
 epoch: 49, train_loss: 0.9271, test_loss: 0.8910, test_f1: 0.5663
 epoch: 50, train_loss: 0.9155, test_loss: 0.9157, test_f1: 0.5702
 epoch: 51, train_loss: 0.8946, test_loss: 0.9009, test_f1: 0.5520
 epoch: 52, train_loss: 0.8972, test_loss: 0.8957, test_f1: 0.5675
 epoch: 53, train_loss: 0.8880, test_loss: 0.8960, test_f1: 0.5626
 epoch: 54, train_loss: 0.8892, test_loss: 0.9048, test_f1: 0.5671
 epoch: 55, train_loss: 0.8936, test_loss: 0.9209, test_f1: 0.5649
 epoch: 56, train_loss: 0.8894, test_loss: 0.9216, test_f1: 0.5619
 epoch: 57, train_loss: 0.8890, test_loss: 0.9158, test_f1: 0.5738
 epoch: 58, train_loss: 0.8773, test_loss: 0.9319, test_f1: 0.5629
 epoch: 59, train_loss: 0.8831, test_loss: 0.9440, test_f1: 0.5595
 epoch: 60, train_loss: 0.8802, test_loss: 0.9544, test_f1: 0.5460
 epoch: 61, train_loss: 0.8735, test_loss: 0.9292, test_f1: 0.5548
 epoch: 62, train_loss: 0.8710, test_loss: 0.9347, test_f1: 0.5684
 epoch: 63, train_loss: 0.8829, test_loss: 0.9504, test_f1: 0.5539
 epoch: 64, train_loss: 0.8692, test_loss: 0.9247, test_f1: 0.5569
 epoch: 65, train_loss: 0.8667, test_loss: 0.9485, test_f1: 0.5569
 epoch: 66, train_loss: 0.8701, test_loss: 0.9196, test_f1: 0.5679
 epoch: 67, train_loss: 0.8737, test_loss: 0.9502, test_f1: 0.5496
 epoch: 68, train_loss: 0.8711, test_loss: 0.9219, test_f1: 0.5641
 epoch: 69, train_loss: 0.8667, test_loss: 0.9538, test_f1: 0.5588
 epoch: 70, train_loss: 0.8686, test_loss: 0.9433, test_f1: 0.5657
 epoch: 71, train_loss: 0.8644, test_loss: 0.9551, test_f1: 0.5637
 epoch: 72, train_loss: 0.8649, test_loss: 0.9621, test_f1: 0.5600
 epoch: 73, train_loss: 0.8538, test_loss: 0.9675, test_f1: 0.5544
 epoch: 74, train_loss: 0.8607, test_loss: 0.9483, test_f1: 0.5581
 epoch: 75, train_loss: 0.8542, test_loss: 0.9678, test_f1: 0.5448
 epoch: 76, train_loss: 0.8580, test_loss: 0.9597, test_f1: 0.5667
 epoch: 77, train_loss: 0.8523, test_loss: 0.9463, test_f1: 0.5635
 epoch: 78, train_loss: 0.8462, test_loss: 0.9985, test_f1: 0.5359
 epoch: 79, train_loss: 0.8487, test_loss: 0.9877, test_f1: 0.5462
 epoch: 80, train_loss: 0.8539, test_loss: 0.9843, test_f1: 0.5546
 epoch: 81, train_loss: 0.8493, test_loss: 0.9711, test_f1: 0.5590
 epoch: 82, train_loss: 0.8422, test_loss: 0.9328, test_f1: 0.5715
 epoch: 83, train_loss: 0.8506, test_loss: 0.9644, test_f1: 0.5708
 epoch: 84, train_loss: 0.8490, test_loss: 0.9419, test_f1: 0.5503
 epoch: 85, train_loss: 0.8494, test_loss: 0.9580, test_f1: 0.5512
 epoch: 86, train_loss: 0.8425, test_loss: 0.9784, test_f1: 0.5544
 epoch: 87, train_loss: 0.8278, test_loss: 0.9831, test_f1: 0.5571
 epoch: 88, train_loss: 0.8384, test_loss: 0.9527, test_f1: 0.5583
 epoch: 89, train_loss: 0.8459, test_loss: 0.9782, test_f1: 0.5519
 epoch: 90, train_loss: 0.8448, test_loss: 0.9766, test_f1: 0.5576
 epoch: 91, train_loss: 0.8346, test_loss: 0.9617, test_f1: 0.5603
 epoch: 92, train_loss: 0.8415, test_loss: 0.9212, test_f1: 0.5662
 epoch: 93, train_loss: 0.8341, test_loss: 0.9695, test_f1: 0.5543
 epoch: 94, train_loss: 0.8324, test_loss: 0.9557, test_f1: 0.5550
 epoch: 95, train_loss: 0.8360, test_loss: 0.9944, test_f1: 0.5408
 epoch: 96, train_loss: 0.8297, test_loss: 0.9438, test_f1: 0.5586
 epoch: 97, train_loss: 0.8377, test_loss: 1.0015, test_f1: 0.5434
 epoch: 98, train_loss: 0.8239, test_loss: 0.9619, test_f1: 0.5635
 epoch: 99, train_loss: 0.8208, test_loss: 0.9239, test_f1: 0.5717
##################ITERATION #1 ****************************************
 epoch: 0, train_loss: 1.3800, test_loss: 1.3786, test_f1: 0.2119
 epoch: 1, train_loss: 1.2805, test_loss: 1.3288, test_f1: 0.2270
 epoch: 2, train_loss: 1.2572, test_loss: 1.2899, test_f1: 0.2270
 epoch: 3, train_loss: 1.2242, test_loss: 1.2547, test_f1: 0.2724
 epoch: 4, train_loss: 1.2001, test_loss: 1.2001, test_f1: 0.3515
 epoch: 5, train_loss: 1.1760, test_loss: 1.1538, test_f1: 0.3986
 epoch: 6, train_loss: 1.1496, test_loss: 1.1046, test_f1: 0.4190
 epoch: 7, train_loss: 1.1202, test_loss: 1.0796, test_f1: 0.4314
 epoch: 8, train_loss: 1.0968, test_loss: 1.0434, test_f1: 0.4441
 epoch: 9, train_loss: 1.0687, test_loss: 1.0221, test_f1: 0.4460
 epoch: 10, train_loss: 1.0462, test_loss: 1.0106, test_f1: 0.4616
 epoch: 11, train_loss: 1.0254, test_loss: 0.9896, test_f1: 0.4592
 epoch: 12, train_loss: 1.0204, test_loss: 0.9745, test_f1: 0.4677
 epoch: 13, train_loss: 1.0011, test_loss: 0.9652, test_f1: 0.4705
 epoch: 14, train_loss: 0.9936, test_loss: 0.9681, test_f1: 0.4756
 epoch: 15, train_loss: 0.9873, test_loss: 0.9556, test_f1: 0.4813
 epoch: 16, train_loss: 0.9674, test_loss: 0.9580, test_f1: 0.4680
 epoch: 17, train_loss: 0.9763, test_loss: 0.9931, test_f1: 0.4613
 epoch: 18, train_loss: 0.9633, test_loss: 0.9593, test_f1: 0.4840
 epoch: 19, train_loss: 0.9663, test_loss: 0.9607, test_f1: 0.4812
 epoch: 20, train_loss: 0.9506, test_loss: 0.9536, test_f1: 0.4856
 epoch: 21, train_loss: 0.9481, test_loss: 0.9535, test_f1: 0.4811
 epoch: 22, train_loss: 0.9480, test_loss: 0.9564, test_f1: 0.4852
 epoch: 23, train_loss: 0.9307, test_loss: 0.9531, test_f1: 0.4959
 epoch: 24, train_loss: 0.9224, test_loss: 0.9660, test_f1: 0.4964
 epoch: 25, train_loss: 0.9157, test_loss: 0.9422, test_f1: 0.5093
 epoch: 26, train_loss: 0.9065, test_loss: 0.9322, test_f1: 0.5006
 epoch: 27, train_loss: 0.9170, test_loss: 0.9293, test_f1: 0.5173
 epoch: 28, train_loss: 0.9156, test_loss: 0.9344, test_f1: 0.5013
 epoch: 29, train_loss: 0.9130, test_loss: 0.9371, test_f1: 0.5100
 epoch: 30, train_loss: 0.9021, test_loss: 0.9367, test_f1: 0.4941
 epoch: 31, train_loss: 0.8986, test_loss: 0.9360, test_f1: 0.5209
 epoch: 32, train_loss: 0.9015, test_loss: 0.9481, test_f1: 0.5060
 epoch: 33, train_loss: 0.8975, test_loss: 0.9571, test_f1: 0.5314
 epoch: 34, train_loss: 0.8917, test_loss: 0.9428, test_f1: 0.5155
 epoch: 35, train_loss: 0.8847, test_loss: 0.9647, test_f1: 0.5087
 epoch: 36, train_loss: 0.8877, test_loss: 0.9607, test_f1: 0.5230
 epoch: 37, train_loss: 0.8730, test_loss: 0.9339, test_f1: 0.5339
 epoch: 38, train_loss: 0.8653, test_loss: 0.9434, test_f1: 0.5300
 epoch: 39, train_loss: 0.8694, test_loss: 0.9269, test_f1: 0.5186
 epoch: 40, train_loss: 0.8641, test_loss: 0.9395, test_f1: 0.5246
 epoch: 41, train_loss: 0.8617, test_loss: 0.9380, test_f1: 0.5417
 epoch: 42, train_loss: 0.8698, test_loss: 0.9621, test_f1: 0.5281
 epoch: 43, train_loss: 0.8579, test_loss: 0.9378, test_f1: 0.5324
 epoch: 44, train_loss: 0.8616, test_loss: 0.9314, test_f1: 0.5260
 epoch: 45, train_loss: 0.8546, test_loss: 0.9906, test_f1: 0.5013
 epoch: 46, train_loss: 0.8534, test_loss: 0.9399, test_f1: 0.5345
 epoch: 47, train_loss: 0.8499, test_loss: 0.9495, test_f1: 0.5412
 epoch: 48, train_loss: 0.8378, test_loss: 0.9412, test_f1: 0.5381
 epoch: 49, train_loss: 0.8464, test_loss: 0.9293, test_f1: 0.5389
 epoch: 50, train_loss: 0.8298, test_loss: 0.9502, test_f1: 0.5427
 epoch: 51, train_loss: 0.8384, test_loss: 0.9428, test_f1: 0.5408
 epoch: 52, train_loss: 0.8282, test_loss: 0.9481, test_f1: 0.5320
 epoch: 53, train_loss: 0.8244, test_loss: 0.9400, test_f1: 0.5427
 epoch: 54, train_loss: 0.8219, test_loss: 0.9529, test_f1: 0.5380
 epoch: 55, train_loss: 0.8273, test_loss: 0.9553, test_f1: 0.5333
 epoch: 56, train_loss: 0.8242, test_loss: 0.9383, test_f1: 0.5423
 epoch: 57, train_loss: 0.8258, test_loss: 0.9412, test_f1: 0.5435
 epoch: 58, train_loss: 0.8117, test_loss: 0.9323, test_f1: 0.5496
 epoch: 59, train_loss: 0.8149, test_loss: 0.9242, test_f1: 0.5522
 epoch: 60, train_loss: 0.8046, test_loss: 0.9378, test_f1: 0.5691
 epoch: 61, train_loss: 0.8104, test_loss: 0.9594, test_f1: 0.5365
 epoch: 62, train_loss: 0.8158, test_loss: 0.9660, test_f1: 0.5323
 epoch: 63, train_loss: 0.8126, test_loss: 0.9282, test_f1: 0.5506
 epoch: 64, train_loss: 0.8095, test_loss: 0.9427, test_f1: 0.5407
 epoch: 65, train_loss: 0.8062, test_loss: 0.9521, test_f1: 0.5488
 epoch: 66, train_loss: 0.8062, test_loss: 1.0026, test_f1: 0.5493
 epoch: 67, train_loss: 0.8060, test_loss: 0.9344, test_f1: 0.5550
 epoch: 68, train_loss: 0.8082, test_loss: 0.9490, test_f1: 0.5512
 epoch: 69, train_loss: 0.8095, test_loss: 0.9484, test_f1: 0.5520
 epoch: 70, train_loss: 0.7957, test_loss: 0.9509, test_f1: 0.5438
 epoch: 71, train_loss: 0.8008, test_loss: 0.9359, test_f1: 0.5567
 epoch: 72, train_loss: 0.8094, test_loss: 0.9365, test_f1: 0.5597
 epoch: 73, train_loss: 0.7985, test_loss: 0.9301, test_f1: 0.5681
 epoch: 74, train_loss: 0.8018, test_loss: 0.9534, test_f1: 0.5496
 epoch: 75, train_loss: 0.8014, test_loss: 0.9428, test_f1: 0.5627
 epoch: 76, train_loss: 0.7926, test_loss: 0.9351, test_f1: 0.5697
 epoch: 77, train_loss: 0.7949, test_loss: 0.9450, test_f1: 0.5703
 epoch: 78, train_loss: 0.8001, test_loss: 0.9475, test_f1: 0.5636
 epoch: 79, train_loss: 0.7945, test_loss: 0.9724, test_f1: 0.5619
 epoch: 80, train_loss: 0.7962, test_loss: 0.9971, test_f1: 0.5583
 epoch: 81, train_loss: 0.8020, test_loss: 0.9575, test_f1: 0.5538
 epoch: 82, train_loss: 0.7964, test_loss: 0.9539, test_f1: 0.5618
 epoch: 83, train_loss: 0.7909, test_loss: 0.9400, test_f1: 0.5542
 epoch: 84, train_loss: 0.7968, test_loss: 0.9739, test_f1: 0.5747
 epoch: 85, train_loss: 0.8091, test_loss: 0.9531, test_f1: 0.5615
 epoch: 86, train_loss: 0.7908, test_loss: 0.9448, test_f1: 0.5638
 epoch: 87, train_loss: 0.7871, test_loss: 0.9492, test_f1: 0.5586
 epoch: 88, train_loss: 0.7901, test_loss: 0.9394, test_f1: 0.5681
 epoch: 89, train_loss: 0.7821, test_loss: 0.9379, test_f1: 0.5783
 epoch: 90, train_loss: 0.7860, test_loss: 0.9639, test_f1: 0.5556
 epoch: 91, train_loss: 0.7872, test_loss: 0.9389, test_f1: 0.5813
 epoch: 92, train_loss: 0.7847, test_loss: 0.9464, test_f1: 0.5609
 epoch: 93, train_loss: 0.7756, test_loss: 0.9514, test_f1: 0.5565
 epoch: 94, train_loss: 0.7780, test_loss: 0.9432, test_f1: 0.5673
 epoch: 95, train_loss: 0.7726, test_loss: 0.9381, test_f1: 0.5690
 epoch: 96, train_loss: 0.7831, test_loss: 0.9541, test_f1: 0.5621
 epoch: 97, train_loss: 0.7788, test_loss: 0.9728, test_f1: 0.5591
 epoch: 98, train_loss: 0.7768, test_loss: 0.9729, test_f1: 0.5766
 epoch: 99, train_loss: 0.7797, test_loss: 0.9341, test_f1: 0.5774
##################ITERATION #2 ****************************************
 epoch: 0, train_loss: 1.3258, test_loss: 1.3631, test_f1: 0.2270
 epoch: 1, train_loss: 1.2709, test_loss: 1.3448, test_f1: 0.2270
 epoch: 2, train_loss: 1.2423, test_loss: 1.3082, test_f1: 0.2270
 epoch: 3, train_loss: 1.2203, test_loss: 1.2492, test_f1: 0.2809
 epoch: 4, train_loss: 1.2011, test_loss: 1.1823, test_f1: 0.3613
 epoch: 5, train_loss: 1.1702, test_loss: 1.1314, test_f1: 0.4030
 epoch: 6, train_loss: 1.1530, test_loss: 1.0927, test_f1: 0.4202
 epoch: 7, train_loss: 1.1264, test_loss: 1.0676, test_f1: 0.4405
 epoch: 8, train_loss: 1.1096, test_loss: 1.0534, test_f1: 0.4367
 epoch: 9, train_loss: 1.0891, test_loss: 1.0315, test_f1: 0.4623
 epoch: 10, train_loss: 1.0743, test_loss: 1.0134, test_f1: 0.4585
 epoch: 11, train_loss: 1.0569, test_loss: 1.0089, test_f1: 0.4720
 epoch: 12, train_loss: 1.0386, test_loss: 0.9853, test_f1: 0.4804
 epoch: 13, train_loss: 1.0276, test_loss: 0.9714, test_f1: 0.4828
 epoch: 14, train_loss: 1.0195, test_loss: 0.9677, test_f1: 0.4896
 epoch: 15, train_loss: 0.9981, test_loss: 0.9513, test_f1: 0.4944
 epoch: 16, train_loss: 0.9980, test_loss: 0.9543, test_f1: 0.4888
 epoch: 17, train_loss: 0.9869, test_loss: 0.9377, test_f1: 0.4964
 epoch: 18, train_loss: 0.9698, test_loss: 0.9383, test_f1: 0.5034
 epoch: 19, train_loss: 0.9810, test_loss: 0.9337, test_f1: 0.5121
 epoch: 20, train_loss: 0.9608, test_loss: 0.9407, test_f1: 0.5061
 epoch: 21, train_loss: 0.9570, test_loss: 0.9244, test_f1: 0.5134
 epoch: 22, train_loss: 0.9473, test_loss: 0.9333, test_f1: 0.5030
 epoch: 23, train_loss: 0.9507, test_loss: 0.9282, test_f1: 0.5033
 epoch: 24, train_loss: 0.9440, test_loss: 0.9331, test_f1: 0.4899
 epoch: 25, train_loss: 0.9357, test_loss: 0.9342, test_f1: 0.5029
 epoch: 26, train_loss: 0.9344, test_loss: 0.9387, test_f1: 0.5018
 epoch: 27, train_loss: 0.9266, test_loss: 0.9175, test_f1: 0.5161
 epoch: 28, train_loss: 0.9194, test_loss: 0.9437, test_f1: 0.4935
 epoch: 29, train_loss: 0.9074, test_loss: 0.9169, test_f1: 0.5161
 epoch: 30, train_loss: 0.9185, test_loss: 0.9162, test_f1: 0.5156
 epoch: 31, train_loss: 0.9124, test_loss: 0.9363, test_f1: 0.4985
 epoch: 32, train_loss: 0.9006, test_loss: 0.9147, test_f1: 0.5211
 epoch: 33, train_loss: 0.8982, test_loss: 0.9297, test_f1: 0.5140
 epoch: 34, train_loss: 0.8941, test_loss: 0.9198, test_f1: 0.5122
 epoch: 35, train_loss: 0.9023, test_loss: 0.9459, test_f1: 0.5053
 epoch: 36, train_loss: 0.8967, test_loss: 0.9170, test_f1: 0.5242
 epoch: 37, train_loss: 0.8994, test_loss: 0.9221, test_f1: 0.5108
 epoch: 38, train_loss: 0.8828, test_loss: 0.9378, test_f1: 0.4958
 epoch: 39, train_loss: 0.8903, test_loss: 0.9264, test_f1: 0.5188
 epoch: 40, train_loss: 0.8851, test_loss: 0.9218, test_f1: 0.5157
 epoch: 41, train_loss: 0.8872, test_loss: 0.9170, test_f1: 0.5125
 epoch: 42, train_loss: 0.8843, test_loss: 0.9251, test_f1: 0.5126
 epoch: 43, train_loss: 0.8794, test_loss: 0.9317, test_f1: 0.5130
 epoch: 44, train_loss: 0.8709, test_loss: 0.9314, test_f1: 0.5112
 epoch: 45, train_loss: 0.8700, test_loss: 0.9411, test_f1: 0.5011
 epoch: 46, train_loss: 0.8757, test_loss: 0.9394, test_f1: 0.5114
 epoch: 47, train_loss: 0.8690, test_loss: 0.9274, test_f1: 0.5027
 epoch: 48, train_loss: 0.8556, test_loss: 0.9248, test_f1: 0.4979
 epoch: 49, train_loss: 0.8672, test_loss: 0.9632, test_f1: 0.5143
 epoch: 50, train_loss: 0.8609, test_loss: 0.9301, test_f1: 0.5160
 epoch: 51, train_loss: 0.8591, test_loss: 0.9339, test_f1: 0.4924
 epoch: 52, train_loss: 0.8503, test_loss: 0.9196, test_f1: 0.5152
 epoch: 53, train_loss: 0.8609, test_loss: 0.9181, test_f1: 0.5122
 epoch: 54, train_loss: 0.8448, test_loss: 0.9283, test_f1: 0.5059
 epoch: 55, train_loss: 0.8532, test_loss: 0.9311, test_f1: 0.5148
 epoch: 56, train_loss: 0.8469, test_loss: 0.9352, test_f1: 0.5074
 epoch: 57, train_loss: 0.8489, test_loss: 0.9234, test_f1: 0.5078
 epoch: 58, train_loss: 0.8440, test_loss: 0.9368, test_f1: 0.5074
 epoch: 59, train_loss: 0.8336, test_loss: 0.9250, test_f1: 0.5093
 epoch: 60, train_loss: 0.8454, test_loss: 0.9213, test_f1: 0.5094
 epoch: 61, train_loss: 0.8353, test_loss: 0.9283, test_f1: 0.4938
 epoch: 62, train_loss: 0.8293, test_loss: 0.9182, test_f1: 0.5275
 epoch: 63, train_loss: 0.8339, test_loss: 0.9312, test_f1: 0.5132
 epoch: 64, train_loss: 0.8474, test_loss: 0.9450, test_f1: 0.5015
 epoch: 65, train_loss: 0.8302, test_loss: 0.9305, test_f1: 0.5081
 epoch: 66, train_loss: 0.8327, test_loss: 0.9295, test_f1: 0.5164
 epoch: 67, train_loss: 0.8317, test_loss: 0.9293, test_f1: 0.5231
 epoch: 68, train_loss: 0.8346, test_loss: 0.9249, test_f1: 0.5229
 epoch: 69, train_loss: 0.8405, test_loss: 0.9546, test_f1: 0.4934
 epoch: 70, train_loss: 0.8302, test_loss: 0.9350, test_f1: 0.5130
 epoch: 71, train_loss: 0.8281, test_loss: 0.9575, test_f1: 0.4958
 epoch: 72, train_loss: 0.8357, test_loss: 0.9409, test_f1: 0.5059
 epoch: 73, train_loss: 0.8343, test_loss: 0.9339, test_f1: 0.5094
 epoch: 74, train_loss: 0.8241, test_loss: 0.9273, test_f1: 0.5237
 epoch: 75, train_loss: 0.8250, test_loss: 0.9314, test_f1: 0.5194
 epoch: 76, train_loss: 0.8277, test_loss: 0.9439, test_f1: 0.5000
 epoch: 77, train_loss: 0.8258, test_loss: 0.9498, test_f1: 0.5173
 epoch: 78, train_loss: 0.8200, test_loss: 0.9374, test_f1: 0.5217
 epoch: 79, train_loss: 0.8305, test_loss: 0.9388, test_f1: 0.5098
 epoch: 80, train_loss: 0.8206, test_loss: 0.9331, test_f1: 0.5167
 epoch: 81, train_loss: 0.8171, test_loss: 0.9325, test_f1: 0.5242
 epoch: 82, train_loss: 0.8213, test_loss: 0.9534, test_f1: 0.5102
 epoch: 83, train_loss: 0.8162, test_loss: 0.9344, test_f1: 0.5044
 epoch: 84, train_loss: 0.8166, test_loss: 0.9449, test_f1: 0.5039
 epoch: 85, train_loss: 0.8100, test_loss: 0.9477, test_f1: 0.5069
 epoch: 86, train_loss: 0.8118, test_loss: 0.9578, test_f1: 0.5052
 epoch: 87, train_loss: 0.8212, test_loss: 0.9413, test_f1: 0.5062
 epoch: 88, train_loss: 0.8179, test_loss: 0.9622, test_f1: 0.4880
 epoch: 89, train_loss: 0.8210, test_loss: 0.9486, test_f1: 0.5149
 epoch: 90, train_loss: 0.8175, test_loss: 0.9577, test_f1: 0.5050
 epoch: 91, train_loss: 0.8138, test_loss: 0.9459, test_f1: 0.5125
 epoch: 92, train_loss: 0.8220, test_loss: 0.9523, test_f1: 0.5189
 epoch: 93, train_loss: 0.8059, test_loss: 0.9581, test_f1: 0.5011
 epoch: 94, train_loss: 0.8207, test_loss: 0.9680, test_f1: 0.5039
 epoch: 95, train_loss: 0.8016, test_loss: 0.9529, test_f1: 0.5098
 epoch: 96, train_loss: 0.8082, test_loss: 0.9726, test_f1: 0.5095
 epoch: 97, train_loss: 0.7985, test_loss: 0.9671, test_f1: 0.5223
 epoch: 98, train_loss: 0.8035, test_loss: 0.9501, test_f1: 0.5186
 epoch: 99, train_loss: 0.8045, test_loss: 0.9526, test_f1: 0.5125
##################ITERATION #3 ****************************************
 epoch: 0, train_loss: 1.3238, test_loss: 1.3076, test_f1: 0.2270
 epoch: 1, train_loss: 1.2342, test_loss: 1.2874, test_f1: 0.2270
 epoch: 2, train_loss: 1.2038, test_loss: 1.2506, test_f1: 0.2270
 epoch: 3, train_loss: 1.1891, test_loss: 1.2069, test_f1: 0.3137
 epoch: 4, train_loss: 1.1598, test_loss: 1.1507, test_f1: 0.4008
 epoch: 5, train_loss: 1.1386, test_loss: 1.1019, test_f1: 0.4110
 epoch: 6, train_loss: 1.1186, test_loss: 1.0714, test_f1: 0.4365
 epoch: 7, train_loss: 1.1003, test_loss: 1.0650, test_f1: 0.4379
 epoch: 8, train_loss: 1.0859, test_loss: 1.0335, test_f1: 0.4614
 epoch: 9, train_loss: 1.0656, test_loss: 1.0514, test_f1: 0.4645
 epoch: 10, train_loss: 1.0611, test_loss: 1.0212, test_f1: 0.4664
 epoch: 11, train_loss: 1.0552, test_loss: 1.0026, test_f1: 0.4946
 epoch: 12, train_loss: 1.0405, test_loss: 0.9887, test_f1: 0.4928
 epoch: 13, train_loss: 1.0372, test_loss: 1.0076, test_f1: 0.4843
 epoch: 14, train_loss: 1.0244, test_loss: 0.9888, test_f1: 0.4727
 epoch: 15, train_loss: 0.9998, test_loss: 0.9897, test_f1: 0.5017
 epoch: 16, train_loss: 1.0085, test_loss: 0.9894, test_f1: 0.4815
 epoch: 17, train_loss: 0.9955, test_loss: 0.9809, test_f1: 0.4959
 epoch: 18, train_loss: 0.9889, test_loss: 0.9709, test_f1: 0.4974
 epoch: 19, train_loss: 0.9892, test_loss: 0.9933, test_f1: 0.4995
 epoch: 20, train_loss: 0.9835, test_loss: 1.0052, test_f1: 0.4918
 epoch: 21, train_loss: 0.9717, test_loss: 0.9940, test_f1: 0.4752
 epoch: 22, train_loss: 0.9614, test_loss: 0.9902, test_f1: 0.5039
 epoch: 23, train_loss: 0.9630, test_loss: 0.9857, test_f1: 0.4837
 epoch: 24, train_loss: 0.9750, test_loss: 1.0061, test_f1: 0.4685
 epoch: 25, train_loss: 0.9501, test_loss: 0.9827, test_f1: 0.4998
 epoch: 26, train_loss: 0.9536, test_loss: 0.9679, test_f1: 0.5029
 epoch: 27, train_loss: 0.9521, test_loss: 0.9560, test_f1: 0.4986
 epoch: 28, train_loss: 0.9446, test_loss: 0.9676, test_f1: 0.5006
 epoch: 29, train_loss: 0.9523, test_loss: 0.9849, test_f1: 0.4940
 epoch: 30, train_loss: 0.9435, test_loss: 0.9764, test_f1: 0.5023
 epoch: 31, train_loss: 0.9509, test_loss: 0.9822, test_f1: 0.5087
 epoch: 32, train_loss: 0.9349, test_loss: 0.9702, test_f1: 0.5053
 epoch: 33, train_loss: 0.9240, test_loss: 0.9871, test_f1: 0.5077
 epoch: 34, train_loss: 0.9186, test_loss: 0.9912, test_f1: 0.5096
 epoch: 35, train_loss: 0.9160, test_loss: 0.9618, test_f1: 0.5082
 epoch: 36, train_loss: 0.9347, test_loss: 0.9950, test_f1: 0.5059
 epoch: 37, train_loss: 0.9148, test_loss: 0.9818, test_f1: 0.5240
 epoch: 38, train_loss: 0.9150, test_loss: 0.9634, test_f1: 0.5117
 epoch: 39, train_loss: 0.9022, test_loss: 0.9608, test_f1: 0.5150
 epoch: 40, train_loss: 0.9100, test_loss: 0.9967, test_f1: 0.4976
 epoch: 41, train_loss: 0.9070, test_loss: 0.9945, test_f1: 0.5045
 epoch: 42, train_loss: 0.9199, test_loss: 0.9524, test_f1: 0.5278
 epoch: 43, train_loss: 0.9067, test_loss: 0.9990, test_f1: 0.5143
 epoch: 44, train_loss: 0.8970, test_loss: 0.9602, test_f1: 0.5166
 epoch: 45, train_loss: 0.9062, test_loss: 0.9564, test_f1: 0.5163
 epoch: 46, train_loss: 0.8934, test_loss: 0.9771, test_f1: 0.5241
 epoch: 47, train_loss: 0.9020, test_loss: 0.9808, test_f1: 0.5027
 epoch: 48, train_loss: 0.8863, test_loss: 0.9636, test_f1: 0.5272
 epoch: 49, train_loss: 0.8940, test_loss: 0.9698, test_f1: 0.5195
 epoch: 50, train_loss: 0.8912, test_loss: 0.9979, test_f1: 0.4923
 epoch: 51, train_loss: 0.8851, test_loss: 0.9785, test_f1: 0.4985
 epoch: 52, train_loss: 0.8810, test_loss: 0.9631, test_f1: 0.5173
 epoch: 53, train_loss: 0.8723, test_loss: 0.9681, test_f1: 0.5235
 epoch: 54, train_loss: 0.8834, test_loss: 0.9721, test_f1: 0.5311
 epoch: 55, train_loss: 0.8717, test_loss: 0.9691, test_f1: 0.5258
 epoch: 56, train_loss: 0.8835, test_loss: 0.9689, test_f1: 0.5319
 epoch: 57, train_loss: 0.8632, test_loss: 0.9784, test_f1: 0.5280
 epoch: 58, train_loss: 0.8619, test_loss: 0.9668, test_f1: 0.5278
 epoch: 59, train_loss: 0.8766, test_loss: 0.9875, test_f1: 0.5261
 epoch: 60, train_loss: 0.8699, test_loss: 0.9774, test_f1: 0.5198
 epoch: 61, train_loss: 0.8722, test_loss: 0.9672, test_f1: 0.5229
 epoch: 62, train_loss: 0.8658, test_loss: 0.9705, test_f1: 0.5214
 epoch: 63, train_loss: 0.8680, test_loss: 0.9640, test_f1: 0.5200
 epoch: 64, train_loss: 0.8691, test_loss: 0.9757, test_f1: 0.5182
 epoch: 65, train_loss: 0.8626, test_loss: 0.9816, test_f1: 0.5232
 epoch: 66, train_loss: 0.8696, test_loss: 0.9758, test_f1: 0.5400
 epoch: 67, train_loss: 0.8609, test_loss: 0.9758, test_f1: 0.5399
 epoch: 68, train_loss: 0.8585, test_loss: 0.9764, test_f1: 0.5181
 epoch: 69, train_loss: 0.8567, test_loss: 0.9647, test_f1: 0.5431
 epoch: 70, train_loss: 0.8642, test_loss: 0.9743, test_f1: 0.5326
 epoch: 71, train_loss: 0.8546, test_loss: 0.9661, test_f1: 0.5443
 epoch: 72, train_loss: 0.8423, test_loss: 0.9594, test_f1: 0.5312
 epoch: 73, train_loss: 0.8493, test_loss: 0.9717, test_f1: 0.5207
 epoch: 74, train_loss: 0.8523, test_loss: 0.9626, test_f1: 0.5352
 epoch: 75, train_loss: 0.8425, test_loss: 0.9828, test_f1: 0.5399
 epoch: 76, train_loss: 0.8563, test_loss: 0.9619, test_f1: 0.5326
 epoch: 77, train_loss: 0.8526, test_loss: 0.9565, test_f1: 0.5438
 epoch: 78, train_loss: 0.8446, test_loss: 0.9690, test_f1: 0.5315
 epoch: 79, train_loss: 0.8420, test_loss: 0.9599, test_f1: 0.5372
 epoch: 80, train_loss: 0.8436, test_loss: 0.9667, test_f1: 0.5375
 epoch: 81, train_loss: 0.8368, test_loss: 0.9642, test_f1: 0.5393
 epoch: 82, train_loss: 0.8347, test_loss: 0.9660, test_f1: 0.5336
 epoch: 83, train_loss: 0.8364, test_loss: 0.9638, test_f1: 0.5358
 epoch: 84, train_loss: 0.8396, test_loss: 0.9677, test_f1: 0.5407
 epoch: 85, train_loss: 0.8465, test_loss: 0.9530, test_f1: 0.5409
 epoch: 86, train_loss: 0.8427, test_loss: 0.9617, test_f1: 0.5309
 epoch: 87, train_loss: 0.8344, test_loss: 0.9674, test_f1: 0.5325
 epoch: 88, train_loss: 0.8423, test_loss: 0.9848, test_f1: 0.5340
 epoch: 89, train_loss: 0.8444, test_loss: 0.9589, test_f1: 0.5368
 epoch: 90, train_loss: 0.8431, test_loss: 0.9800, test_f1: 0.5335
 epoch: 91, train_loss: 0.8331, test_loss: 0.9636, test_f1: 0.5363
 epoch: 92, train_loss: 0.8421, test_loss: 0.9591, test_f1: 0.5432
 epoch: 93, train_loss: 0.8332, test_loss: 0.9776, test_f1: 0.5290
 epoch: 94, train_loss: 0.8335, test_loss: 0.9675, test_f1: 0.5303
 epoch: 95, train_loss: 0.8263, test_loss: 0.9609, test_f1: 0.5422
 epoch: 96, train_loss: 0.8364, test_loss: 0.9749, test_f1: 0.5443
 epoch: 97, train_loss: 0.8322, test_loss: 0.9665, test_f1: 0.5413
 epoch: 98, train_loss: 0.8253, test_loss: 0.9634, test_f1: 0.5482
 epoch: 99, train_loss: 0.8278, test_loss: 0.9691, test_f1: 0.5406
##################ITERATION #4 ****************************************
 epoch: 0, train_loss: 1.2967, test_loss: 1.3707, test_f1: 0.2270
 epoch: 1, train_loss: 1.2329, test_loss: 1.3357, test_f1: 0.2270
 epoch: 2, train_loss: 1.2061, test_loss: 1.2737, test_f1: 0.2270
 epoch: 3, train_loss: 1.1844, test_loss: 1.2354, test_f1: 0.2399
 epoch: 4, train_loss: 1.1630, test_loss: 1.1899, test_f1: 0.3424
 epoch: 5, train_loss: 1.1462, test_loss: 1.1284, test_f1: 0.3658
 epoch: 6, train_loss: 1.1213, test_loss: 1.0785, test_f1: 0.4580
 epoch: 7, train_loss: 1.1051, test_loss: 1.0585, test_f1: 0.4843
 epoch: 8, train_loss: 1.0947, test_loss: 1.0465, test_f1: 0.4728
 epoch: 9, train_loss: 1.0795, test_loss: 1.0390, test_f1: 0.4785
 epoch: 10, train_loss: 1.0604, test_loss: 1.0254, test_f1: 0.4820
 epoch: 11, train_loss: 1.0502, test_loss: 1.0057, test_f1: 0.4787
 epoch: 12, train_loss: 1.0480, test_loss: 0.9969, test_f1: 0.4956
 epoch: 13, train_loss: 1.0460, test_loss: 0.9894, test_f1: 0.5088
 epoch: 14, train_loss: 1.0355, test_loss: 0.9980, test_f1: 0.4739
 epoch: 15, train_loss: 1.0302, test_loss: 0.9987, test_f1: 0.4987
 epoch: 16, train_loss: 1.0143, test_loss: 0.9785, test_f1: 0.5119
 epoch: 17, train_loss: 1.0080, test_loss: 0.9824, test_f1: 0.5092
 epoch: 18, train_loss: 0.9887, test_loss: 0.9789, test_f1: 0.4937
 epoch: 19, train_loss: 0.9841, test_loss: 0.9594, test_f1: 0.5048
 epoch: 20, train_loss: 0.9801, test_loss: 0.9809, test_f1: 0.5077
 epoch: 21, train_loss: 0.9679, test_loss: 0.9697, test_f1: 0.5183
 epoch: 22, train_loss: 0.9686, test_loss: 0.9494, test_f1: 0.5218
 epoch: 23, train_loss: 0.9512, test_loss: 0.9517, test_f1: 0.5284
 epoch: 24, train_loss: 0.9532, test_loss: 0.9619, test_f1: 0.5197
 epoch: 25, train_loss: 0.9463, test_loss: 0.9624, test_f1: 0.5167
 epoch: 26, train_loss: 0.9426, test_loss: 0.9699, test_f1: 0.5004
 epoch: 27, train_loss: 0.9423, test_loss: 0.9727, test_f1: 0.5021
 epoch: 28, train_loss: 0.9385, test_loss: 0.9580, test_f1: 0.5210
 epoch: 29, train_loss: 0.9414, test_loss: 0.9572, test_f1: 0.5149
 epoch: 30, train_loss: 0.9344, test_loss: 0.9524, test_f1: 0.4996
 epoch: 31, train_loss: 0.9387, test_loss: 0.9513, test_f1: 0.5199
 epoch: 32, train_loss: 0.9224, test_loss: 0.9713, test_f1: 0.5118
 epoch: 33, train_loss: 0.9215, test_loss: 0.9462, test_f1: 0.5173
 epoch: 34, train_loss: 0.9079, test_loss: 0.9568, test_f1: 0.5135
 epoch: 35, train_loss: 0.9192, test_loss: 0.9518, test_f1: 0.5153
 epoch: 36, train_loss: 0.9155, test_loss: 0.9564, test_f1: 0.5203
 epoch: 37, train_loss: 0.9236, test_loss: 0.9522, test_f1: 0.5192
 epoch: 38, train_loss: 0.9153, test_loss: 0.9521, test_f1: 0.5165
 epoch: 39, train_loss: 0.9122, test_loss: 0.9607, test_f1: 0.5237
 epoch: 40, train_loss: 0.8995, test_loss: 0.9564, test_f1: 0.5250
 epoch: 41, train_loss: 0.9082, test_loss: 0.9569, test_f1: 0.5190
 epoch: 42, train_loss: 0.8904, test_loss: 0.9598, test_f1: 0.5387
 epoch: 43, train_loss: 0.8944, test_loss: 0.9597, test_f1: 0.5293
 epoch: 44, train_loss: 0.8887, test_loss: 0.9666, test_f1: 0.5324
 epoch: 45, train_loss: 0.8859, test_loss: 0.9618, test_f1: 0.5238
 epoch: 46, train_loss: 0.8738, test_loss: 0.9619, test_f1: 0.5207
 epoch: 47, train_loss: 0.8787, test_loss: 0.9721, test_f1: 0.5281
 epoch: 48, train_loss: 0.8719, test_loss: 0.9586, test_f1: 0.5218
 epoch: 49, train_loss: 0.8849, test_loss: 0.9651, test_f1: 0.5441
 epoch: 50, train_loss: 0.8891, test_loss: 0.9687, test_f1: 0.5430
 epoch: 51, train_loss: 0.8713, test_loss: 0.9567, test_f1: 0.5403
 epoch: 52, train_loss: 0.8661, test_loss: 0.9609, test_f1: 0.5331
 epoch: 53, train_loss: 0.8604, test_loss: 0.9579, test_f1: 0.5315
 epoch: 54, train_loss: 0.8647, test_loss: 0.9624, test_f1: 0.5371
 epoch: 55, train_loss: 0.8615, test_loss: 0.9657, test_f1: 0.5378
 epoch: 56, train_loss: 0.8612, test_loss: 0.9686, test_f1: 0.5254
 epoch: 57, train_loss: 0.8586, test_loss: 0.9556, test_f1: 0.5356
 epoch: 58, train_loss: 0.8561, test_loss: 0.9533, test_f1: 0.5481
 epoch: 59, train_loss: 0.8664, test_loss: 0.9750, test_f1: 0.5271
 epoch: 60, train_loss: 0.8659, test_loss: 0.9574, test_f1: 0.5412
 epoch: 61, train_loss: 0.8502, test_loss: 0.9599, test_f1: 0.5450
 epoch: 62, train_loss: 0.8642, test_loss: 0.9531, test_f1: 0.5492
 epoch: 63, train_loss: 0.8583, test_loss: 0.9573, test_f1: 0.5635
 epoch: 64, train_loss: 0.8525, test_loss: 0.9580, test_f1: 0.5521
 epoch: 65, train_loss: 0.8615, test_loss: 0.9590, test_f1: 0.5486
 epoch: 66, train_loss: 0.8578, test_loss: 0.9537, test_f1: 0.5603
 epoch: 67, train_loss: 0.8476, test_loss: 0.9533, test_f1: 0.5546
 epoch: 68, train_loss: 0.8445, test_loss: 0.9537, test_f1: 0.5484
 epoch: 69, train_loss: 0.8527, test_loss: 0.9706, test_f1: 0.5440
 epoch: 70, train_loss: 0.8603, test_loss: 0.9604, test_f1: 0.5540
 epoch: 71, train_loss: 0.8402, test_loss: 0.9488, test_f1: 0.5619
 epoch: 72, train_loss: 0.8383, test_loss: 0.9531, test_f1: 0.5590
 epoch: 73, train_loss: 0.8484, test_loss: 0.9547, test_f1: 0.5514
 epoch: 74, train_loss: 0.8504, test_loss: 0.9593, test_f1: 0.5465
 epoch: 75, train_loss: 0.8386, test_loss: 0.9648, test_f1: 0.5390
 epoch: 76, train_loss: 0.8344, test_loss: 0.9643, test_f1: 0.5431
 epoch: 77, train_loss: 0.8324, test_loss: 0.9564, test_f1: 0.5429
 epoch: 78, train_loss: 0.8307, test_loss: 0.9676, test_f1: 0.5327
 epoch: 79, train_loss: 0.8362, test_loss: 0.9566, test_f1: 0.5524
 epoch: 80, train_loss: 0.8294, test_loss: 0.9647, test_f1: 0.5388
 epoch: 81, train_loss: 0.8382, test_loss: 0.9629, test_f1: 0.5395
 epoch: 82, train_loss: 0.8274, test_loss: 0.9550, test_f1: 0.5647
 epoch: 83, train_loss: 0.8379, test_loss: 0.9650, test_f1: 0.5585
 epoch: 84, train_loss: 0.8386, test_loss: 0.9748, test_f1: 0.5508
 epoch: 85, train_loss: 0.8412, test_loss: 0.9700, test_f1: 0.5425
 epoch: 86, train_loss: 0.8312, test_loss: 0.9708, test_f1: 0.5480
 epoch: 87, train_loss: 0.8325, test_loss: 0.9692, test_f1: 0.5464
 epoch: 88, train_loss: 0.8264, test_loss: 0.9777, test_f1: 0.5467
 epoch: 89, train_loss: 0.8272, test_loss: 0.9715, test_f1: 0.5564
 epoch: 90, train_loss: 0.8303, test_loss: 0.9748, test_f1: 0.5567
 epoch: 91, train_loss: 0.8338, test_loss: 0.9784, test_f1: 0.5593
 epoch: 92, train_loss: 0.8228, test_loss: 0.9825, test_f1: 0.5483
 epoch: 93, train_loss: 0.8335, test_loss: 0.9721, test_f1: 0.5474
 epoch: 94, train_loss: 0.8200, test_loss: 0.9805, test_f1: 0.5550
 epoch: 95, train_loss: 0.8214, test_loss: 0.9747, test_f1: 0.5573
 epoch: 96, train_loss: 0.8313, test_loss: 0.9645, test_f1: 0.5447
 epoch: 97, train_loss: 0.8306, test_loss: 0.9707, test_f1: 0.5536
 epoch: 98, train_loss: 0.8174, test_loss: 0.9842, test_f1: 0.5341
 epoch: 99, train_loss: 0.8199, test_loss: 0.9717, test_f1: 0.5481
##################ITERATION #5 ****************************************
 epoch: 0, train_loss: 1.3246, test_loss: 1.3314, test_f1: 0.2270
 epoch: 1, train_loss: 1.2072, test_loss: 1.2946, test_f1: 0.2270
 epoch: 2, train_loss: 1.1848, test_loss: 1.2537, test_f1: 0.2270
 epoch: 3, train_loss: 1.1449, test_loss: 1.1320, test_f1: 0.3883
 epoch: 4, train_loss: 1.1223, test_loss: 1.0651, test_f1: 0.4670
 epoch: 5, train_loss: 1.0980, test_loss: 1.0381, test_f1: 0.4829
 epoch: 6, train_loss: 1.0716, test_loss: 1.0037, test_f1: 0.4840
 epoch: 7, train_loss: 1.0626, test_loss: 0.9962, test_f1: 0.4823
 epoch: 8, train_loss: 1.0468, test_loss: 0.9828, test_f1: 0.4878
 epoch: 9, train_loss: 1.0376, test_loss: 0.9749, test_f1: 0.4829
 epoch: 10, train_loss: 1.0165, test_loss: 0.9718, test_f1: 0.4729
 epoch: 11, train_loss: 1.0109, test_loss: 0.9669, test_f1: 0.4866
 epoch: 12, train_loss: 1.0105, test_loss: 0.9665, test_f1: 0.4869
 epoch: 13, train_loss: 0.9920, test_loss: 0.9547, test_f1: 0.4833
 epoch: 14, train_loss: 0.9878, test_loss: 0.9650, test_f1: 0.4897
 epoch: 15, train_loss: 0.9862, test_loss: 0.9504, test_f1: 0.4984
 epoch: 16, train_loss: 0.9800, test_loss: 0.9701, test_f1: 0.4869
 epoch: 17, train_loss: 0.9808, test_loss: 0.9501, test_f1: 0.5050
 epoch: 18, train_loss: 0.9761, test_loss: 0.9731, test_f1: 0.5025
 epoch: 19, train_loss: 0.9799, test_loss: 0.9731, test_f1: 0.4898
 epoch: 20, train_loss: 0.9645, test_loss: 0.9932, test_f1: 0.4857
 epoch: 21, train_loss: 0.9566, test_loss: 0.9607, test_f1: 0.5068
 epoch: 22, train_loss: 0.9531, test_loss: 0.9838, test_f1: 0.5029
 epoch: 23, train_loss: 0.9462, test_loss: 0.9600, test_f1: 0.5131
 epoch: 24, train_loss: 0.9410, test_loss: 0.9717, test_f1: 0.5075
 epoch: 25, train_loss: 0.9465, test_loss: 0.9781, test_f1: 0.5033
 epoch: 26, train_loss: 0.9317, test_loss: 0.9661, test_f1: 0.5094
 epoch: 27, train_loss: 0.9355, test_loss: 0.9731, test_f1: 0.5035
 epoch: 28, train_loss: 0.9356, test_loss: 0.9659, test_f1: 0.5145
 epoch: 29, train_loss: 0.9358, test_loss: 0.9837, test_f1: 0.5154
 epoch: 30, train_loss: 0.9241, test_loss: 0.9880, test_f1: 0.5024
 epoch: 31, train_loss: 0.9260, test_loss: 0.9664, test_f1: 0.5183
 epoch: 32, train_loss: 0.9160, test_loss: 0.9950, test_f1: 0.4838
 epoch: 33, train_loss: 0.9067, test_loss: 0.9667, test_f1: 0.5016
 epoch: 34, train_loss: 0.9197, test_loss: 0.9764, test_f1: 0.4990
 epoch: 35, train_loss: 0.9124, test_loss: 0.9755, test_f1: 0.5111
 epoch: 36, train_loss: 0.9060, test_loss: 0.9686, test_f1: 0.5221
 epoch: 37, train_loss: 0.9048, test_loss: 0.9616, test_f1: 0.5253
 epoch: 38, train_loss: 0.9147, test_loss: 0.9790, test_f1: 0.5109
 epoch: 39, train_loss: 0.9190, test_loss: 0.9813, test_f1: 0.5096
 epoch: 40, train_loss: 0.9065, test_loss: 0.9604, test_f1: 0.5143
 epoch: 41, train_loss: 0.9045, test_loss: 0.9935, test_f1: 0.5019
 epoch: 42, train_loss: 0.9002, test_loss: 0.9686, test_f1: 0.5196
 epoch: 43, train_loss: 0.9009, test_loss: 0.9721, test_f1: 0.5159
 epoch: 44, train_loss: 0.8906, test_loss: 0.9615, test_f1: 0.5166
 epoch: 45, train_loss: 0.8814, test_loss: 0.9794, test_f1: 0.5195
 epoch: 46, train_loss: 0.8847, test_loss: 0.9717, test_f1: 0.5329
 epoch: 47, train_loss: 0.8889, test_loss: 0.9621, test_f1: 0.5288
 epoch: 48, train_loss: 0.8793, test_loss: 0.9717, test_f1: 0.5185
 epoch: 49, train_loss: 0.8837, test_loss: 0.9756, test_f1: 0.5180
 epoch: 50, train_loss: 0.8736, test_loss: 0.9557, test_f1: 0.5317
 epoch: 51, train_loss: 0.8684, test_loss: 0.9635, test_f1: 0.5185
 epoch: 52, train_loss: 0.8567, test_loss: 0.9620, test_f1: 0.5280
 epoch: 53, train_loss: 0.8636, test_loss: 0.9620, test_f1: 0.5403
 epoch: 54, train_loss: 0.8553, test_loss: 0.9633, test_f1: 0.5366
 epoch: 55, train_loss: 0.8675, test_loss: 0.9644, test_f1: 0.5212
 epoch: 56, train_loss: 0.8544, test_loss: 0.9578, test_f1: 0.5384
 epoch: 57, train_loss: 0.8546, test_loss: 0.9553, test_f1: 0.5552
 epoch: 58, train_loss: 0.8545, test_loss: 0.9705, test_f1: 0.5398
 epoch: 59, train_loss: 0.8610, test_loss: 0.9640, test_f1: 0.5358
 epoch: 60, train_loss: 0.8476, test_loss: 0.9546, test_f1: 0.5494
 epoch: 61, train_loss: 0.8598, test_loss: 0.9517, test_f1: 0.5416
 epoch: 62, train_loss: 0.8477, test_loss: 0.9648, test_f1: 0.5386
 epoch: 63, train_loss: 0.8484, test_loss: 0.9597, test_f1: 0.5442
 epoch: 64, train_loss: 0.8485, test_loss: 0.9604, test_f1: 0.5334
 epoch: 65, train_loss: 0.8432, test_loss: 0.9676, test_f1: 0.5243
 epoch: 66, train_loss: 0.8440, test_loss: 0.9541, test_f1: 0.5362
 epoch: 67, train_loss: 0.8423, test_loss: 0.9550, test_f1: 0.5304
 epoch: 68, train_loss: 0.8445, test_loss: 0.9424, test_f1: 0.5473
 epoch: 69, train_loss: 0.8370, test_loss: 0.9612, test_f1: 0.5395
 epoch: 70, train_loss: 0.8440, test_loss: 0.9559, test_f1: 0.5505
 epoch: 71, train_loss: 0.8378, test_loss: 0.9542, test_f1: 0.5483
 epoch: 72, train_loss: 0.8363, test_loss: 0.9553, test_f1: 0.5615
 epoch: 73, train_loss: 0.8263, test_loss: 0.9620, test_f1: 0.5263
 epoch: 74, train_loss: 0.8379, test_loss: 0.9588, test_f1: 0.5411
 epoch: 75, train_loss: 0.8237, test_loss: 0.9514, test_f1: 0.5549
 epoch: 76, train_loss: 0.8266, test_loss: 0.9548, test_f1: 0.5352
 epoch: 77, train_loss: 0.8285, test_loss: 0.9667, test_f1: 0.5459
 epoch: 78, train_loss: 0.8268, test_loss: 0.9574, test_f1: 0.5516
 epoch: 79, train_loss: 0.8412, test_loss: 0.9482, test_f1: 0.5545
 epoch: 80, train_loss: 0.8252, test_loss: 0.9596, test_f1: 0.5559
 epoch: 81, train_loss: 0.8333, test_loss: 0.9502, test_f1: 0.5493
 epoch: 82, train_loss: 0.8181, test_loss: 0.9555, test_f1: 0.5414
 epoch: 83, train_loss: 0.8197, test_loss: 0.9550, test_f1: 0.5502
 epoch: 84, train_loss: 0.8157, test_loss: 0.9656, test_f1: 0.5418
 epoch: 85, train_loss: 0.8289, test_loss: 0.9574, test_f1: 0.5471
 epoch: 86, train_loss: 0.8326, test_loss: 0.9652, test_f1: 0.5481
 epoch: 87, train_loss: 0.8137, test_loss: 0.9559, test_f1: 0.5483
 epoch: 88, train_loss: 0.8333, test_loss: 0.9691, test_f1: 0.5399
 epoch: 89, train_loss: 0.8158, test_loss: 0.9577, test_f1: 0.5487
 epoch: 90, train_loss: 0.8197, test_loss: 0.9561, test_f1: 0.5472
 epoch: 91, train_loss: 0.8198, test_loss: 0.9590, test_f1: 0.5498
 epoch: 92, train_loss: 0.8108, test_loss: 0.9649, test_f1: 0.5384
 epoch: 93, train_loss: 0.8115, test_loss: 0.9569, test_f1: 0.5462
 epoch: 94, train_loss: 0.8159, test_loss: 0.9606, test_f1: 0.5511
 epoch: 95, train_loss: 0.8089, test_loss: 0.9680, test_f1: 0.5514
 epoch: 96, train_loss: 0.8171, test_loss: 0.9738, test_f1: 0.5481
 epoch: 97, train_loss: 0.8180, test_loss: 0.9690, test_f1: 0.5407
 epoch: 98, train_loss: 0.8072, test_loss: 0.9729, test_f1: 0.5423
 epoch: 99, train_loss: 0.8127, test_loss: 0.9692, test_f1: 0.5457
##################ITERATION #6 ****************************************
 epoch: 0, train_loss: 1.4581, test_loss: 1.2946, test_f1: 0.2270
 epoch: 1, train_loss: 1.2611, test_loss: 1.2803, test_f1: 0.2270
 epoch: 2, train_loss: 1.2185, test_loss: 1.2377, test_f1: 0.2524
 epoch: 3, train_loss: 1.1820, test_loss: 1.1761, test_f1: 0.2663
 epoch: 4, train_loss: 1.1559, test_loss: 1.1110, test_f1: 0.3849
 epoch: 5, train_loss: 1.1354, test_loss: 1.0755, test_f1: 0.4487
 epoch: 6, train_loss: 1.1078, test_loss: 1.0308, test_f1: 0.4752
 epoch: 7, train_loss: 1.1060, test_loss: 1.0162, test_f1: 0.4720
 epoch: 8, train_loss: 1.0702, test_loss: 0.9960, test_f1: 0.4744
 epoch: 9, train_loss: 1.0652, test_loss: 0.9870, test_f1: 0.4812
 epoch: 10, train_loss: 1.0600, test_loss: 0.9911, test_f1: 0.4758
 epoch: 11, train_loss: 1.0369, test_loss: 0.9782, test_f1: 0.4889
 epoch: 12, train_loss: 1.0244, test_loss: 0.9645, test_f1: 0.4750
 epoch: 13, train_loss: 1.0197, test_loss: 0.9647, test_f1: 0.4742
 epoch: 14, train_loss: 1.0052, test_loss: 0.9646, test_f1: 0.4915
 epoch: 15, train_loss: 0.9886, test_loss: 0.9620, test_f1: 0.4903
 epoch: 16, train_loss: 0.9870, test_loss: 0.9502, test_f1: 0.5022
 epoch: 17, train_loss: 0.9801, test_loss: 0.9603, test_f1: 0.5016
 epoch: 18, train_loss: 0.9839, test_loss: 0.9926, test_f1: 0.4793
 epoch: 19, train_loss: 0.9823, test_loss: 0.9702, test_f1: 0.4722
 epoch: 20, train_loss: 0.9704, test_loss: 0.9587, test_f1: 0.4907
 epoch: 21, train_loss: 0.9712, test_loss: 0.9559, test_f1: 0.4901
 epoch: 22, train_loss: 0.9720, test_loss: 0.9681, test_f1: 0.4997
 epoch: 23, train_loss: 0.9581, test_loss: 0.9711, test_f1: 0.4776
 epoch: 24, train_loss: 0.9527, test_loss: 0.9578, test_f1: 0.4966
 epoch: 25, train_loss: 0.9501, test_loss: 0.9542, test_f1: 0.4947
 epoch: 26, train_loss: 0.9556, test_loss: 0.9918, test_f1: 0.4791
 epoch: 27, train_loss: 0.9481, test_loss: 0.9620, test_f1: 0.5010
 epoch: 28, train_loss: 0.9456, test_loss: 0.9621, test_f1: 0.4909
 epoch: 29, train_loss: 0.9362, test_loss: 0.9985, test_f1: 0.4766
 epoch: 30, train_loss: 0.9313, test_loss: 0.9696, test_f1: 0.4989
 epoch: 31, train_loss: 0.9375, test_loss: 0.9613, test_f1: 0.4912
 epoch: 32, train_loss: 0.9250, test_loss: 0.9819, test_f1: 0.4793
 epoch: 33, train_loss: 0.9258, test_loss: 0.9694, test_f1: 0.4794
 epoch: 34, train_loss: 0.9149, test_loss: 0.9779, test_f1: 0.4689
 epoch: 35, train_loss: 0.9146, test_loss: 0.9781, test_f1: 0.4955
 epoch: 36, train_loss: 0.9171, test_loss: 0.9824, test_f1: 0.4950
 epoch: 37, train_loss: 0.9293, test_loss: 0.9802, test_f1: 0.4749
 epoch: 38, train_loss: 0.9184, test_loss: 0.9842, test_f1: 0.4772
 epoch: 39, train_loss: 0.9221, test_loss: 0.9600, test_f1: 0.5032
 epoch: 40, train_loss: 0.9119, test_loss: 0.9781, test_f1: 0.4741
 epoch: 41, train_loss: 0.9074, test_loss: 0.9468, test_f1: 0.4862
 epoch: 42, train_loss: 0.9062, test_loss: 0.9555, test_f1: 0.4843
 epoch: 43, train_loss: 0.9094, test_loss: 0.9808, test_f1: 0.4793
 epoch: 44, train_loss: 0.9113, test_loss: 0.9959, test_f1: 0.4724
 epoch: 45, train_loss: 0.8994, test_loss: 0.9830, test_f1: 0.4770
 epoch: 46, train_loss: 0.8957, test_loss: 1.0012, test_f1: 0.4843
 epoch: 47, train_loss: 0.8886, test_loss: 0.9779, test_f1: 0.5018
 epoch: 48, train_loss: 0.9000, test_loss: 0.9829, test_f1: 0.4929
 epoch: 49, train_loss: 0.8937, test_loss: 0.9781, test_f1: 0.4957
 epoch: 50, train_loss: 0.8848, test_loss: 0.9792, test_f1: 0.4860
 epoch: 51, train_loss: 0.8781, test_loss: 0.9665, test_f1: 0.4933
 epoch: 52, train_loss: 0.8848, test_loss: 0.9672, test_f1: 0.4887
 epoch: 53, train_loss: 0.8674, test_loss: 0.9742, test_f1: 0.4846
 epoch: 54, train_loss: 0.8776, test_loss: 0.9653, test_f1: 0.4838
 epoch: 55, train_loss: 0.8811, test_loss: 0.9943, test_f1: 0.4793
 epoch: 56, train_loss: 0.8741, test_loss: 0.9942, test_f1: 0.4809
 epoch: 57, train_loss: 0.8660, test_loss: 0.9994, test_f1: 0.4588
 epoch: 58, train_loss: 0.8686, test_loss: 0.9671, test_f1: 0.4764
 epoch: 59, train_loss: 0.8692, test_loss: 0.9502, test_f1: 0.4902
 epoch: 60, train_loss: 0.8613, test_loss: 0.9524, test_f1: 0.4906
 epoch: 61, train_loss: 0.8589, test_loss: 0.9610, test_f1: 0.4753
 epoch: 62, train_loss: 0.8656, test_loss: 0.9570, test_f1: 0.4936
 epoch: 63, train_loss: 0.8533, test_loss: 0.9612, test_f1: 0.4830
 epoch: 64, train_loss: 0.8648, test_loss: 0.9736, test_f1: 0.4823
 epoch: 65, train_loss: 0.8598, test_loss: 0.9597, test_f1: 0.4886
 epoch: 66, train_loss: 0.8667, test_loss: 0.9621, test_f1: 0.4815
 epoch: 67, train_loss: 0.8544, test_loss: 0.9664, test_f1: 0.4752
 epoch: 68, train_loss: 0.8613, test_loss: 0.9691, test_f1: 0.4894
 epoch: 69, train_loss: 0.8565, test_loss: 0.9715, test_f1: 0.4826
 epoch: 70, train_loss: 0.8588, test_loss: 0.9584, test_f1: 0.4877
 epoch: 71, train_loss: 0.8503, test_loss: 0.9924, test_f1: 0.4681
 epoch: 72, train_loss: 0.8522, test_loss: 0.9549, test_f1: 0.4797
 epoch: 73, train_loss: 0.8596, test_loss: 0.9769, test_f1: 0.4682
 epoch: 74, train_loss: 0.8500, test_loss: 0.9665, test_f1: 0.4847
 epoch: 75, train_loss: 0.8584, test_loss: 0.9729, test_f1: 0.4671
 epoch: 76, train_loss: 0.8458, test_loss: 0.9767, test_f1: 0.4775
 epoch: 77, train_loss: 0.8389, test_loss: 0.9985, test_f1: 0.4782
 epoch: 78, train_loss: 0.8529, test_loss: 1.0188, test_f1: 0.4859
 epoch: 79, train_loss: 0.8369, test_loss: 0.9962, test_f1: 0.4972
 epoch: 80, train_loss: 0.8460, test_loss: 0.9984, test_f1: 0.4953
 epoch: 81, train_loss: 0.8434, test_loss: 1.0182, test_f1: 0.4747
 epoch: 82, train_loss: 0.8562, test_loss: 0.9691, test_f1: 0.4917
 epoch: 83, train_loss: 0.8422, test_loss: 1.0001, test_f1: 0.4662
 epoch: 84, train_loss: 0.8399, test_loss: 0.9888, test_f1: 0.4852
 epoch: 85, train_loss: 0.8534, test_loss: 0.9685, test_f1: 0.4983
 epoch: 86, train_loss: 0.8471, test_loss: 1.0010, test_f1: 0.4613
 epoch: 87, train_loss: 0.8410, test_loss: 1.0142, test_f1: 0.4995
 epoch: 88, train_loss: 0.8428, test_loss: 1.0201, test_f1: 0.4928
 epoch: 89, train_loss: 0.8358, test_loss: 0.9835, test_f1: 0.4880
 epoch: 90, train_loss: 0.8389, test_loss: 0.9670, test_f1: 0.5027
 epoch: 91, train_loss: 0.8311, test_loss: 0.9627, test_f1: 0.4849
 epoch: 92, train_loss: 0.8271, test_loss: 0.9696, test_f1: 0.4858
 epoch: 93, train_loss: 0.8303, test_loss: 0.9729, test_f1: 0.4877
 epoch: 94, train_loss: 0.8300, test_loss: 0.9956, test_f1: 0.4705
 epoch: 95, train_loss: 0.8305, test_loss: 1.0013, test_f1: 0.4693
 epoch: 96, train_loss: 0.8206, test_loss: 1.0001, test_f1: 0.4884
 epoch: 97, train_loss: 0.8282, test_loss: 0.9955, test_f1: 0.4857
 epoch: 98, train_loss: 0.8397, test_loss: 0.9916, test_f1: 0.4751
 epoch: 99, train_loss: 0.8373, test_loss: 1.0042, test_f1: 0.4872
##################ITERATION #7 ****************************************
 epoch: 0, train_loss: 1.3740, test_loss: 1.3384, test_f1: 0.2270
 epoch: 1, train_loss: 1.2509, test_loss: 1.3059, test_f1: 0.2270
 epoch: 2, train_loss: 1.2043, test_loss: 1.2158, test_f1: 0.2920
 epoch: 3, train_loss: 1.1812, test_loss: 1.1454, test_f1: 0.3594
 epoch: 4, train_loss: 1.1555, test_loss: 1.1049, test_f1: 0.3983
 epoch: 5, train_loss: 1.1376, test_loss: 1.0609, test_f1: 0.4184
 epoch: 6, train_loss: 1.1106, test_loss: 1.0321, test_f1: 0.4311
 epoch: 7, train_loss: 1.1029, test_loss: 1.0188, test_f1: 0.4492
 epoch: 8, train_loss: 1.0838, test_loss: 1.0280, test_f1: 0.4424
 epoch: 9, train_loss: 1.0720, test_loss: 0.9945, test_f1: 0.4589
 epoch: 10, train_loss: 1.0531, test_loss: 0.9898, test_f1: 0.4681
 epoch: 11, train_loss: 1.0319, test_loss: 0.9775, test_f1: 0.4783
 epoch: 12, train_loss: 1.0338, test_loss: 0.9719, test_f1: 0.4759
 epoch: 13, train_loss: 1.0160, test_loss: 0.9690, test_f1: 0.4847
 epoch: 14, train_loss: 1.0090, test_loss: 0.9599, test_f1: 0.4750
 epoch: 15, train_loss: 1.0085, test_loss: 0.9733, test_f1: 0.4797
 epoch: 16, train_loss: 0.9897, test_loss: 0.9625, test_f1: 0.4868
 epoch: 17, train_loss: 0.9861, test_loss: 0.9442, test_f1: 0.4794
 epoch: 18, train_loss: 0.9769, test_loss: 0.9698, test_f1: 0.4919
 epoch: 19, train_loss: 0.9741, test_loss: 0.9614, test_f1: 0.4901
 epoch: 20, train_loss: 0.9625, test_loss: 0.9275, test_f1: 0.4909
 epoch: 21, train_loss: 0.9611, test_loss: 0.9326, test_f1: 0.4945
 epoch: 22, train_loss: 0.9569, test_loss: 0.9519, test_f1: 0.4903
 epoch: 23, train_loss: 0.9502, test_loss: 0.9712, test_f1: 0.4806
 epoch: 24, train_loss: 0.9493, test_loss: 0.9291, test_f1: 0.5040
 epoch: 25, train_loss: 0.9498, test_loss: 1.0026, test_f1: 0.4842
 epoch: 26, train_loss: 0.9450, test_loss: 0.9618, test_f1: 0.5049
 epoch: 27, train_loss: 0.9258, test_loss: 0.9658, test_f1: 0.5101
 epoch: 28, train_loss: 0.9293, test_loss: 0.9929, test_f1: 0.5024
 epoch: 29, train_loss: 0.9155, test_loss: 0.9835, test_f1: 0.5124
 epoch: 30, train_loss: 0.9223, test_loss: 0.9823, test_f1: 0.5276
 epoch: 31, train_loss: 0.9212, test_loss: 0.9963, test_f1: 0.5021
 epoch: 32, train_loss: 0.9156, test_loss: 0.9294, test_f1: 0.5236
 epoch: 33, train_loss: 0.9128, test_loss: 0.9586, test_f1: 0.5100
 epoch: 34, train_loss: 0.9151, test_loss: 0.9878, test_f1: 0.5147
 epoch: 35, train_loss: 0.9148, test_loss: 0.9954, test_f1: 0.5214
 epoch: 36, train_loss: 0.9075, test_loss: 1.0000, test_f1: 0.5123
 epoch: 37, train_loss: 0.8976, test_loss: 1.0025, test_f1: 0.5138
 epoch: 38, train_loss: 0.9025, test_loss: 0.9883, test_f1: 0.5177
 epoch: 39, train_loss: 0.8899, test_loss: 0.9946, test_f1: 0.5264
 epoch: 40, train_loss: 0.9021, test_loss: 1.0036, test_f1: 0.5239
 epoch: 41, train_loss: 0.8954, test_loss: 0.9804, test_f1: 0.5135
 epoch: 42, train_loss: 0.8829, test_loss: 0.9738, test_f1: 0.5266
 epoch: 43, train_loss: 0.8849, test_loss: 0.9795, test_f1: 0.5268
 epoch: 44, train_loss: 0.8823, test_loss: 0.9751, test_f1: 0.5320
 epoch: 45, train_loss: 0.8723, test_loss: 0.9960, test_f1: 0.5222
 epoch: 46, train_loss: 0.8885, test_loss: 0.9873, test_f1: 0.5311
 epoch: 47, train_loss: 0.8799, test_loss: 1.0133, test_f1: 0.5084
 epoch: 48, train_loss: 0.8684, test_loss: 0.9854, test_f1: 0.5295
 epoch: 49, train_loss: 0.8767, test_loss: 0.9765, test_f1: 0.5204
 epoch: 50, train_loss: 0.8657, test_loss: 0.9753, test_f1: 0.5290
 epoch: 51, train_loss: 0.8467, test_loss: 0.9715, test_f1: 0.5326
 epoch: 52, train_loss: 0.8545, test_loss: 0.9719, test_f1: 0.5339
 epoch: 53, train_loss: 0.8624, test_loss: 0.9830, test_f1: 0.5325
 epoch: 54, train_loss: 0.8393, test_loss: 0.9786, test_f1: 0.5390
 epoch: 55, train_loss: 0.8519, test_loss: 0.9828, test_f1: 0.5401
 epoch: 56, train_loss: 0.8525, test_loss: 0.9795, test_f1: 0.5235
 epoch: 57, train_loss: 0.8462, test_loss: 0.9854, test_f1: 0.5248
 epoch: 58, train_loss: 0.8385, test_loss: 0.9686, test_f1: 0.5348
 epoch: 59, train_loss: 0.8445, test_loss: 0.9878, test_f1: 0.5348
 epoch: 60, train_loss: 0.8390, test_loss: 0.9736, test_f1: 0.5334
 epoch: 61, train_loss: 0.8369, test_loss: 0.9792, test_f1: 0.5305
 epoch: 62, train_loss: 0.8366, test_loss: 0.9762, test_f1: 0.5282
 epoch: 63, train_loss: 0.8415, test_loss: 0.9933, test_f1: 0.5272
 epoch: 64, train_loss: 0.8429, test_loss: 0.9687, test_f1: 0.5445
 epoch: 65, train_loss: 0.8358, test_loss: 0.9770, test_f1: 0.5295
 epoch: 66, train_loss: 0.8251, test_loss: 0.9844, test_f1: 0.5222
 epoch: 67, train_loss: 0.8250, test_loss: 0.9838, test_f1: 0.5226
 epoch: 68, train_loss: 0.8446, test_loss: 0.9923, test_f1: 0.5283
 epoch: 69, train_loss: 0.8256, test_loss: 0.9875, test_f1: 0.5172
 epoch: 70, train_loss: 0.8307, test_loss: 0.9835, test_f1: 0.5323
 epoch: 71, train_loss: 0.8246, test_loss: 0.9936, test_f1: 0.5358
 epoch: 72, train_loss: 0.8235, test_loss: 0.9703, test_f1: 0.5348
 epoch: 73, train_loss: 0.8230, test_loss: 0.9760, test_f1: 0.5288
 epoch: 74, train_loss: 0.8236, test_loss: 0.9966, test_f1: 0.5243
 epoch: 75, train_loss: 0.8248, test_loss: 0.9725, test_f1: 0.5374
 epoch: 76, train_loss: 0.8294, test_loss: 0.9818, test_f1: 0.5349
 epoch: 77, train_loss: 0.8209, test_loss: 0.9662, test_f1: 0.5409
 epoch: 78, train_loss: 0.8131, test_loss: 0.9784, test_f1: 0.5399
 epoch: 79, train_loss: 0.8287, test_loss: 0.9898, test_f1: 0.5224
 epoch: 80, train_loss: 0.8162, test_loss: 0.9932, test_f1: 0.5301
 epoch: 81, train_loss: 0.8091, test_loss: 0.9794, test_f1: 0.5388
 epoch: 82, train_loss: 0.8140, test_loss: 1.0268, test_f1: 0.5195
 epoch: 83, train_loss: 0.8138, test_loss: 0.9729, test_f1: 0.5351
 epoch: 84, train_loss: 0.8135, test_loss: 0.9883, test_f1: 0.5314
 epoch: 85, train_loss: 0.8019, test_loss: 0.9785, test_f1: 0.5374
 epoch: 86, train_loss: 0.8215, test_loss: 0.9667, test_f1: 0.5404
 epoch: 87, train_loss: 0.8176, test_loss: 0.9721, test_f1: 0.5300
 epoch: 88, train_loss: 0.8040, test_loss: 0.9790, test_f1: 0.5178
 epoch: 89, train_loss: 0.8091, test_loss: 0.9728, test_f1: 0.5288
 epoch: 90, train_loss: 0.8070, test_loss: 0.9737, test_f1: 0.5336
 epoch: 91, train_loss: 0.8144, test_loss: 0.9967, test_f1: 0.5319
 epoch: 92, train_loss: 0.8129, test_loss: 0.9932, test_f1: 0.5267
 epoch: 93, train_loss: 0.8070, test_loss: 0.9952, test_f1: 0.5048
 epoch: 94, train_loss: 0.8030, test_loss: 0.9859, test_f1: 0.5346
 epoch: 95, train_loss: 0.7977, test_loss: 0.9910, test_f1: 0.5253
 epoch: 96, train_loss: 0.8041, test_loss: 0.9852, test_f1: 0.5342
 epoch: 97, train_loss: 0.7970, test_loss: 0.9817, test_f1: 0.5293
 epoch: 98, train_loss: 0.8083, test_loss: 0.9751, test_f1: 0.5403
 epoch: 99, train_loss: 0.7957, test_loss: 0.9698, test_f1: 0.5496
##################ITERATION #8 ****************************************
 epoch: 0, train_loss: 1.6141, test_loss: 1.4458, test_f1: 0.2270
 epoch: 1, train_loss: 1.3203, test_loss: 1.3596, test_f1: 0.2295
 epoch: 2, train_loss: 1.2404, test_loss: 1.3053, test_f1: 0.2908
 epoch: 3, train_loss: 1.2064, test_loss: 1.2506, test_f1: 0.2574
 epoch: 4, train_loss: 1.1855, test_loss: 1.1831, test_f1: 0.3252
 epoch: 5, train_loss: 1.1613, test_loss: 1.1199, test_f1: 0.4106
 epoch: 6, train_loss: 1.1446, test_loss: 1.0851, test_f1: 0.4454
 epoch: 7, train_loss: 1.1362, test_loss: 1.0608, test_f1: 0.4664
 epoch: 8, train_loss: 1.1156, test_loss: 1.0498, test_f1: 0.4723
 epoch: 9, train_loss: 1.1042, test_loss: 1.0335, test_f1: 0.4601
 epoch: 10, train_loss: 1.0951, test_loss: 1.0183, test_f1: 0.4660
 epoch: 11, train_loss: 1.0746, test_loss: 1.0176, test_f1: 0.4611
 epoch: 12, train_loss: 1.0590, test_loss: 1.0033, test_f1: 0.4634
 epoch: 13, train_loss: 1.0532, test_loss: 1.0026, test_f1: 0.4701
 epoch: 14, train_loss: 1.0376, test_loss: 0.9996, test_f1: 0.4668
 epoch: 15, train_loss: 1.0288, test_loss: 1.0007, test_f1: 0.4723
 epoch: 16, train_loss: 1.0278, test_loss: 0.9881, test_f1: 0.4675
 epoch: 17, train_loss: 1.0169, test_loss: 0.9814, test_f1: 0.4781
 epoch: 18, train_loss: 1.0054, test_loss: 0.9742, test_f1: 0.4848
 epoch: 19, train_loss: 1.0042, test_loss: 0.9886, test_f1: 0.4794
 epoch: 20, train_loss: 0.9955, test_loss: 0.9937, test_f1: 0.4798
 epoch: 21, train_loss: 0.9896, test_loss: 0.9959, test_f1: 0.4848
 epoch: 22, train_loss: 0.9831, test_loss: 0.9774, test_f1: 0.4931
 epoch: 23, train_loss: 0.9684, test_loss: 0.9784, test_f1: 0.4762
 epoch: 24, train_loss: 0.9692, test_loss: 0.9850, test_f1: 0.4887
 epoch: 25, train_loss: 0.9738, test_loss: 0.9762, test_f1: 0.4898
 epoch: 26, train_loss: 0.9622, test_loss: 0.9710, test_f1: 0.4918
 epoch: 27, train_loss: 0.9596, test_loss: 0.9825, test_f1: 0.4918
 epoch: 28, train_loss: 0.9542, test_loss: 0.9674, test_f1: 0.5036
 epoch: 29, train_loss: 0.9521, test_loss: 0.9631, test_f1: 0.4746
 epoch: 30, train_loss: 0.9528, test_loss: 0.9682, test_f1: 0.4915
 epoch: 31, train_loss: 0.9395, test_loss: 0.9764, test_f1: 0.4834
 epoch: 32, train_loss: 0.9452, test_loss: 0.9709, test_f1: 0.4923
 epoch: 33, train_loss: 0.9444, test_loss: 0.9718, test_f1: 0.4810
 epoch: 34, train_loss: 0.9424, test_loss: 0.9625, test_f1: 0.4832
 epoch: 35, train_loss: 0.9373, test_loss: 0.9753, test_f1: 0.4766
 epoch: 36, train_loss: 0.9346, test_loss: 0.9768, test_f1: 0.4943
 epoch: 37, train_loss: 0.9243, test_loss: 0.9834, test_f1: 0.4739
 epoch: 38, train_loss: 0.9274, test_loss: 0.9675, test_f1: 0.4934
 epoch: 39, train_loss: 0.9210, test_loss: 0.9628, test_f1: 0.5043
 epoch: 40, train_loss: 0.9219, test_loss: 0.9585, test_f1: 0.5003
 epoch: 41, train_loss: 0.9206, test_loss: 0.9939, test_f1: 0.4904
 epoch: 42, train_loss: 0.9240, test_loss: 0.9766, test_f1: 0.4861
 epoch: 43, train_loss: 0.9142, test_loss: 0.9733, test_f1: 0.4999
 epoch: 44, train_loss: 0.9145, test_loss: 0.9794, test_f1: 0.5129
 epoch: 45, train_loss: 0.9174, test_loss: 0.9753, test_f1: 0.5016
 epoch: 46, train_loss: 0.9071, test_loss: 0.9796, test_f1: 0.4922
 epoch: 47, train_loss: 0.9117, test_loss: 0.9956, test_f1: 0.4854
 epoch: 48, train_loss: 0.9082, test_loss: 1.0041, test_f1: 0.4812
 epoch: 49, train_loss: 0.9121, test_loss: 0.9594, test_f1: 0.5066
 epoch: 50, train_loss: 0.8964, test_loss: 0.9894, test_f1: 0.4956
 epoch: 51, train_loss: 0.8880, test_loss: 0.9693, test_f1: 0.5022
 epoch: 52, train_loss: 0.8855, test_loss: 0.9752, test_f1: 0.5045
 epoch: 53, train_loss: 0.8851, test_loss: 0.9781, test_f1: 0.5001
 epoch: 54, train_loss: 0.8889, test_loss: 0.9722, test_f1: 0.4905
 epoch: 55, train_loss: 0.8922, test_loss: 0.9782, test_f1: 0.5077
 epoch: 56, train_loss: 0.8772, test_loss: 0.9699, test_f1: 0.5045
 epoch: 57, train_loss: 0.8873, test_loss: 0.9851, test_f1: 0.4909
 epoch: 58, train_loss: 0.8857, test_loss: 0.9813, test_f1: 0.4964
 epoch: 59, train_loss: 0.8848, test_loss: 0.9752, test_f1: 0.4972
 epoch: 60, train_loss: 0.8778, test_loss: 0.9812, test_f1: 0.4905
 epoch: 61, train_loss: 0.8735, test_loss: 0.9778, test_f1: 0.4951
 epoch: 62, train_loss: 0.8766, test_loss: 0.9806, test_f1: 0.4900
 epoch: 63, train_loss: 0.8735, test_loss: 0.9813, test_f1: 0.4970
 epoch: 64, train_loss: 0.8828, test_loss: 0.9762, test_f1: 0.4980
 epoch: 65, train_loss: 0.8743, test_loss: 0.9733, test_f1: 0.5066
 epoch: 66, train_loss: 0.8730, test_loss: 0.9662, test_f1: 0.4994
 epoch: 67, train_loss: 0.8701, test_loss: 0.9668, test_f1: 0.5011
 epoch: 68, train_loss: 0.8684, test_loss: 0.9701, test_f1: 0.4948
 epoch: 69, train_loss: 0.8682, test_loss: 0.9757, test_f1: 0.5061
 epoch: 70, train_loss: 0.8617, test_loss: 0.9645, test_f1: 0.5017
 epoch: 71, train_loss: 0.8713, test_loss: 0.9655, test_f1: 0.5135
 epoch: 72, train_loss: 0.8711, test_loss: 0.9710, test_f1: 0.5188
 epoch: 73, train_loss: 0.8679, test_loss: 0.9762, test_f1: 0.5102
 epoch: 74, train_loss: 0.8602, test_loss: 0.9704, test_f1: 0.5086
 epoch: 75, train_loss: 0.8594, test_loss: 0.9689, test_f1: 0.5141
 epoch: 76, train_loss: 0.8617, test_loss: 0.9761, test_f1: 0.5083
 epoch: 77, train_loss: 0.8552, test_loss: 0.9857, test_f1: 0.5039
 epoch: 78, train_loss: 0.8709, test_loss: 0.9721, test_f1: 0.5153
 epoch: 79, train_loss: 0.8583, test_loss: 0.9914, test_f1: 0.5007
 epoch: 80, train_loss: 0.8563, test_loss: 0.9641, test_f1: 0.4997
 epoch: 81, train_loss: 0.8550, test_loss: 0.9668, test_f1: 0.5113
 epoch: 82, train_loss: 0.8600, test_loss: 0.9729, test_f1: 0.5130
 epoch: 83, train_loss: 0.8558, test_loss: 0.9654, test_f1: 0.5037
 epoch: 84, train_loss: 0.8551, test_loss: 0.9830, test_f1: 0.5099
 epoch: 85, train_loss: 0.8489, test_loss: 0.9756, test_f1: 0.5223
 epoch: 86, train_loss: 0.8593, test_loss: 0.9688, test_f1: 0.5138
 epoch: 87, train_loss: 0.8569, test_loss: 0.9758, test_f1: 0.5241
 epoch: 88, train_loss: 0.8466, test_loss: 0.9770, test_f1: 0.5182
 epoch: 89, train_loss: 0.8512, test_loss: 0.9866, test_f1: 0.5096
 epoch: 90, train_loss: 0.8502, test_loss: 0.9740, test_f1: 0.5085
 epoch: 91, train_loss: 0.8539, test_loss: 0.9811, test_f1: 0.5053
 epoch: 92, train_loss: 0.8469, test_loss: 0.9867, test_f1: 0.5104
 epoch: 93, train_loss: 0.8486, test_loss: 0.9769, test_f1: 0.5120
 epoch: 94, train_loss: 0.8277, test_loss: 0.9603, test_f1: 0.5115
 epoch: 95, train_loss: 0.8425, test_loss: 0.9854, test_f1: 0.4980
 epoch: 96, train_loss: 0.8437, test_loss: 0.9717, test_f1: 0.5098
 epoch: 97, train_loss: 0.8469, test_loss: 0.9712, test_f1: 0.5282
 epoch: 98, train_loss: 0.8453, test_loss: 0.9618, test_f1: 0.5245
 epoch: 99, train_loss: 0.8400, test_loss: 0.9698, test_f1: 0.5315
##################ITERATION #9 ****************************************
 epoch: 0, train_loss: 1.4480, test_loss: 1.3457, test_f1: 0.2270
 epoch: 1, train_loss: 1.2633, test_loss: 1.3431, test_f1: 0.2270
 epoch: 2, train_loss: 1.2141, test_loss: 1.3293, test_f1: 0.2448
 epoch: 3, train_loss: 1.1973, test_loss: 1.2746, test_f1: 0.3078
 epoch: 4, train_loss: 1.1668, test_loss: 1.1687, test_f1: 0.3765
 epoch: 5, train_loss: 1.1582, test_loss: 1.1104, test_f1: 0.4193
 epoch: 6, train_loss: 1.1297, test_loss: 1.0667, test_f1: 0.4424
 epoch: 7, train_loss: 1.1042, test_loss: 1.0262, test_f1: 0.4554
 epoch: 8, train_loss: 1.0934, test_loss: 1.0095, test_f1: 0.4687
 epoch: 9, train_loss: 1.0741, test_loss: 1.0054, test_f1: 0.4865
 epoch: 10, train_loss: 1.0643, test_loss: 0.9766, test_f1: 0.4857
 epoch: 11, train_loss: 1.0455, test_loss: 0.9696, test_f1: 0.4887
 epoch: 12, train_loss: 1.0494, test_loss: 0.9631, test_f1: 0.4959
 epoch: 13, train_loss: 1.0319, test_loss: 0.9551, test_f1: 0.5065
 epoch: 14, train_loss: 1.0253, test_loss: 0.9553, test_f1: 0.5023
 epoch: 15, train_loss: 1.0150, test_loss: 0.9415, test_f1: 0.4973
 epoch: 16, train_loss: 0.9962, test_loss: 0.9316, test_f1: 0.5159
 epoch: 17, train_loss: 0.9921, test_loss: 0.9202, test_f1: 0.4991
 epoch: 18, train_loss: 0.9881, test_loss: 0.9241, test_f1: 0.5055
 epoch: 19, train_loss: 0.9869, test_loss: 0.9177, test_f1: 0.5091
 epoch: 20, train_loss: 0.9644, test_loss: 0.9249, test_f1: 0.5302
 epoch: 21, train_loss: 0.9710, test_loss: 0.9156, test_f1: 0.5347
 epoch: 22, train_loss: 0.9629, test_loss: 0.9068, test_f1: 0.5380
 epoch: 23, train_loss: 0.9560, test_loss: 0.9507, test_f1: 0.5158
 epoch: 24, train_loss: 0.9447, test_loss: 0.9338, test_f1: 0.5126
 epoch: 25, train_loss: 0.9424, test_loss: 0.9364, test_f1: 0.5122
 epoch: 26, train_loss: 0.9511, test_loss: 0.9467, test_f1: 0.5399
 epoch: 27, train_loss: 0.9476, test_loss: 0.9182, test_f1: 0.5059
 epoch: 28, train_loss: 0.9447, test_loss: 0.9222, test_f1: 0.5265
 epoch: 29, train_loss: 0.9211, test_loss: 0.9096, test_f1: 0.5107
 epoch: 30, train_loss: 0.9283, test_loss: 0.9330, test_f1: 0.5524
 epoch: 31, train_loss: 0.9213, test_loss: 0.9324, test_f1: 0.5149
 epoch: 32, train_loss: 0.9128, test_loss: 0.9603, test_f1: 0.5494
 epoch: 33, train_loss: 0.9193, test_loss: 0.9359, test_f1: 0.5503
 epoch: 34, train_loss: 0.9206, test_loss: 0.9347, test_f1: 0.5375
 epoch: 35, train_loss: 0.9130, test_loss: 0.9265, test_f1: 0.5344
 epoch: 36, train_loss: 0.9123, test_loss: 0.9361, test_f1: 0.5373
 epoch: 37, train_loss: 0.8923, test_loss: 0.9380, test_f1: 0.5365
 epoch: 38, train_loss: 0.9113, test_loss: 0.9195, test_f1: 0.5426
 epoch: 39, train_loss: 0.8991, test_loss: 0.9272, test_f1: 0.5332
 epoch: 40, train_loss: 0.8905, test_loss: 0.9534, test_f1: 0.5478
 epoch: 41, train_loss: 0.8980, test_loss: 0.9246, test_f1: 0.5571
 epoch: 42, train_loss: 0.8828, test_loss: 0.9269, test_f1: 0.5512
 epoch: 43, train_loss: 0.8848, test_loss: 0.9658, test_f1: 0.5569
 epoch: 44, train_loss: 0.8717, test_loss: 0.9464, test_f1: 0.5528
 epoch: 45, train_loss: 0.8668, test_loss: 0.9518, test_f1: 0.5482
 epoch: 46, train_loss: 0.8751, test_loss: 0.9471, test_f1: 0.5313
 epoch: 47, train_loss: 0.8762, test_loss: 0.9496, test_f1: 0.5472
 epoch: 48, train_loss: 0.8808, test_loss: 0.9760, test_f1: 0.5433
 epoch: 49, train_loss: 0.8715, test_loss: 0.9593, test_f1: 0.5588
 epoch: 50, train_loss: 0.8690, test_loss: 0.9561, test_f1: 0.5512
 epoch: 51, train_loss: 0.8765, test_loss: 0.9442, test_f1: 0.5647
 epoch: 52, train_loss: 0.8543, test_loss: 0.9301, test_f1: 0.5583
 epoch: 53, train_loss: 0.8460, test_loss: 0.9508, test_f1: 0.5587
 epoch: 54, train_loss: 0.8556, test_loss: 0.9440, test_f1: 0.5623
 epoch: 55, train_loss: 0.8593, test_loss: 0.9447, test_f1: 0.5683
 epoch: 56, train_loss: 0.8497, test_loss: 0.9349, test_f1: 0.5633
 epoch: 57, train_loss: 0.8519, test_loss: 0.9420, test_f1: 0.5652
 epoch: 58, train_loss: 0.8445, test_loss: 0.9507, test_f1: 0.5569
 epoch: 59, train_loss: 0.8361, test_loss: 0.9328, test_f1: 0.5796
 epoch: 60, train_loss: 0.8509, test_loss: 0.9362, test_f1: 0.5705
 epoch: 61, train_loss: 0.8445, test_loss: 0.9512, test_f1: 0.5644
 epoch: 62, train_loss: 0.8442, test_loss: 0.9362, test_f1: 0.5616
 epoch: 63, train_loss: 0.8305, test_loss: 0.9499, test_f1: 0.5593
 epoch: 64, train_loss: 0.8356, test_loss: 0.9408, test_f1: 0.5695
 epoch: 65, train_loss: 0.8354, test_loss: 0.9208, test_f1: 0.5713
 epoch: 66, train_loss: 0.8382, test_loss: 0.9340, test_f1: 0.5531
 epoch: 67, train_loss: 0.8498, test_loss: 0.9479, test_f1: 0.5649
 epoch: 68, train_loss: 0.8457, test_loss: 0.9206, test_f1: 0.5662
 epoch: 69, train_loss: 0.8402, test_loss: 0.9447, test_f1: 0.5615
 epoch: 70, train_loss: 0.8504, test_loss: 0.9254, test_f1: 0.5595
 epoch: 71, train_loss: 0.8216, test_loss: 0.9423, test_f1: 0.5709
 epoch: 72, train_loss: 0.8278, test_loss: 0.9414, test_f1: 0.5792
 epoch: 73, train_loss: 0.8400, test_loss: 0.9501, test_f1: 0.5743
 epoch: 74, train_loss: 0.8366, test_loss: 0.9349, test_f1: 0.5679
 epoch: 75, train_loss: 0.8348, test_loss: 0.9513, test_f1: 0.5595
 epoch: 76, train_loss: 0.8224, test_loss: 0.9393, test_f1: 0.5732
 epoch: 77, train_loss: 0.8412, test_loss: 0.9317, test_f1: 0.5759
 epoch: 78, train_loss: 0.8221, test_loss: 0.9252, test_f1: 0.5865
 epoch: 79, train_loss: 0.8193, test_loss: 0.9362, test_f1: 0.5725
 epoch: 80, train_loss: 0.8176, test_loss: 0.9354, test_f1: 0.5532
 epoch: 81, train_loss: 0.8181, test_loss: 0.9428, test_f1: 0.5684
 epoch: 82, train_loss: 0.8220, test_loss: 0.9369, test_f1: 0.5794
 epoch: 83, train_loss: 0.8257, test_loss: 0.9406, test_f1: 0.5834
 epoch: 84, train_loss: 0.8250, test_loss: 0.9363, test_f1: 0.5804
 epoch: 85, train_loss: 0.8211, test_loss: 0.9412, test_f1: 0.5791
 epoch: 86, train_loss: 0.8212, test_loss: 0.9315, test_f1: 0.5724
 epoch: 87, train_loss: 0.8143, test_loss: 0.9343, test_f1: 0.5767
 epoch: 88, train_loss: 0.8093, test_loss: 0.9407, test_f1: 0.5759
 epoch: 89, train_loss: 0.8200, test_loss: 0.9281, test_f1: 0.5674
 epoch: 90, train_loss: 0.8023, test_loss: 0.9403, test_f1: 0.5733
 epoch: 91, train_loss: 0.8115, test_loss: 0.9448, test_f1: 0.5768
 epoch: 92, train_loss: 0.8064, test_loss: 0.9445, test_f1: 0.5689
 epoch: 93, train_loss: 0.8077, test_loss: 0.9413, test_f1: 0.5836
 epoch: 94, train_loss: 0.8082, test_loss: 0.9419, test_f1: 0.5723
 epoch: 95, train_loss: 0.8173, test_loss: 0.9416, test_f1: 0.5891
 epoch: 96, train_loss: 0.7998, test_loss: 0.9516, test_f1: 0.5585
 epoch: 97, train_loss: 0.7987, test_loss: 0.9450, test_f1: 0.5843
 epoch: 98, train_loss: 0.7975, test_loss: 0.9461, test_f1: 0.5673
 epoch: 99, train_loss: 0.8055, test_loss: 0.9476, test_f1: 0.6019

Training completed in 426.73 seconds
Best F1: 0.6019 at epoch 99
Mean F1 across iterations: 0.5543  0.0273
========================FINAL RESULTS================================
FEGIN weighted F1: 0.6019  0.0273
python main.py --data ltspice_examples --representation component_net --model FEGIN --layers 5 --hiddens 16 --batch_size 256 --lr 0.001 --emb_size 512 --epochs 100 --save_appendix component_net_L5_H16_BS256_LR0.001_E512 --no_val
-----



STDERR:
  File "main.py", line 370, in <module>
    main()
  File "main.py", line 254, in main
    dataset = dataset_class(
  File "/home/philip/projects/ltspice_examples_code_repo/Circuit-Completion-Using-GNNs/component_classification_with_link_prediction_head/evaluation/FEGIN/kernel/circuit_datasets.py", line 15, in __init__
    self.data, self.slices = torch.load(self.processed_paths[0])
  File "/home/philip/.local/lib/python3.8/site-packages/torch/serialization.py", line 1040, in load
    warnings.warn(
  File "/usr/lib/python3.8/warnings.py", line 109, in _showwarnmsg
    sw(msg.message, msg.category, msg.filename, msg.lineno,
  File "main.py", line 47, in warn_with_traceback
    traceback.print_stack(file=log)
/home/philip/projects/ltspice_examples_code_repo/Circuit-Completion-Using-GNNs/component_classification_with_link_prediction_head/evaluation/FEGIN/kernel/circuit_datasets.py:15: FutureWarning: You are using `torch.load` with `weights_only=False` (the current default value), which uses the default pickle module implicitly. It is possible to construct malicious pickle data which will execute arbitrary code during unpickling (See https://github.com/pytorch/pytorch/blob/main/SECURITY.md#untrusted-models for more details). In a future release, the default value for `weights_only` will be flipped to `True`. This limits the functions that could be executed during unpickling. Arbitrary objects will no longer be allowed to be loaded via this mode unless they are explicitly allowlisted by the user via `torch.serialization.add_safe_globals`. We recommend you start setting `weights_only=True` for any use case where you don't have full control of the loaded file. Please open an issue on GitHub for any issues related to this experimental feature.
  self.data, self.slices = torch.load(self.processed_paths[0])
