STDOUT:
Results will be saved in /home/philip/projects/ltspice_examples_code_repo/Circuit-Completion-Using-GNNs/component_classification_with_link_prediction_head/evaluation/FEGIN/results/model_FEGIN_dataset_ltspice_demos
Command line input: python main.py --data ltspice_demos --representation component_pin --model FEGIN --layers 6 --hiddens 128 --batch_size 64 --lr 0.0001 --emb_size 512 --epochs 100 --save_appendix component_pin_L6_H128_BS64_LR0.0001_E512 --no_val
 is saved.
-----
ltspice_demos - FEGIN
Using 6 layers, 128 hidden units, h = 2
Loading component_pin representation dataset
ENTERED
Training FEGIN on component_pin representation
Train: 1565, Test: 383
##################ITERATION #0 ****************************************
 epoch: 0, train_loss: 1.3717, test_loss: 1.3675, test_f1: 0.2281
 epoch: 1, train_loss: 1.3489, test_loss: 1.3533, test_f1: 0.2281
 epoch: 2, train_loss: 1.3243, test_loss: 1.3336, test_f1: 0.2253
 epoch: 3, train_loss: 1.2880, test_loss: 1.2985, test_f1: 0.2341
 epoch: 4, train_loss: 1.2422, test_loss: 1.2640, test_f1: 0.2677
 epoch: 5, train_loss: 1.1946, test_loss: 1.2334, test_f1: 0.3426
 epoch: 6, train_loss: 1.1576, test_loss: 1.2038, test_f1: 0.3424
 epoch: 7, train_loss: 1.1256, test_loss: 1.1753, test_f1: 0.4116
 epoch: 8, train_loss: 1.0970, test_loss: 1.1466, test_f1: 0.4462
 epoch: 9, train_loss: 1.0634, test_loss: 1.1144, test_f1: 0.4811
 epoch: 10, train_loss: 1.0310, test_loss: 1.0774, test_f1: 0.4808
 epoch: 11, train_loss: 0.9905, test_loss: 1.0453, test_f1: 0.4693
 epoch: 12, train_loss: 0.9554, test_loss: 1.0294, test_f1: 0.4760
 epoch: 13, train_loss: 0.9255, test_loss: 1.0097, test_f1: 0.5087
 epoch: 14, train_loss: 0.9036, test_loss: 1.0055, test_f1: 0.5804
 epoch: 15, train_loss: 0.8741, test_loss: 0.9828, test_f1: 0.5851
 epoch: 16, train_loss: 0.8620, test_loss: 0.9815, test_f1: 0.5828
 epoch: 17, train_loss: 0.8376, test_loss: 0.9861, test_f1: 0.5819
 epoch: 18, train_loss: 0.8134, test_loss: 0.9634, test_f1: 0.5963
 epoch: 19, train_loss: 0.8102, test_loss: 0.9839, test_f1: 0.5967
 epoch: 20, train_loss: 0.7897, test_loss: 0.9628, test_f1: 0.6040
 epoch: 21, train_loss: 0.7629, test_loss: 0.9796, test_f1: 0.5737
 epoch: 22, train_loss: 0.7594, test_loss: 0.9986, test_f1: 0.5793
 epoch: 23, train_loss: 0.7354, test_loss: 0.9754, test_f1: 0.6091
 epoch: 24, train_loss: 0.7330, test_loss: 1.0043, test_f1: 0.6051
 epoch: 25, train_loss: 0.7208, test_loss: 0.9957, test_f1: 0.6195
 epoch: 26, train_loss: 0.7010, test_loss: 0.9597, test_f1: 0.6261
 epoch: 27, train_loss: 0.6786, test_loss: 1.0318, test_f1: 0.5708
 epoch: 28, train_loss: 0.6680, test_loss: 1.0365, test_f1: 0.6126
 epoch: 29, train_loss: 0.6595, test_loss: 0.9688, test_f1: 0.6053
 epoch: 30, train_loss: 0.6543, test_loss: 1.0186, test_f1: 0.5781
 epoch: 31, train_loss: 0.6387, test_loss: 1.0135, test_f1: 0.6077
 epoch: 32, train_loss: 0.6470, test_loss: 1.0858, test_f1: 0.5511
 epoch: 33, train_loss: 0.6282, test_loss: 1.0819, test_f1: 0.5678
 epoch: 34, train_loss: 0.6178, test_loss: 1.0656, test_f1: 0.6078
 epoch: 35, train_loss: 0.6090, test_loss: 1.1058, test_f1: 0.5781
 epoch: 36, train_loss: 0.6191, test_loss: 1.1328, test_f1: 0.5814
 epoch: 37, train_loss: 0.6227, test_loss: 1.0929, test_f1: 0.5622
 epoch: 38, train_loss: 0.6091, test_loss: 1.0755, test_f1: 0.6194
 epoch: 39, train_loss: 0.5885, test_loss: 1.0690, test_f1: 0.6075
 epoch: 40, train_loss: 0.5668, test_loss: 1.1075, test_f1: 0.6292
 epoch: 41, train_loss: 0.5733, test_loss: 1.1242, test_f1: 0.5992
 epoch: 42, train_loss: 0.5684, test_loss: 1.0859, test_f1: 0.6120
 epoch: 43, train_loss: 0.5492, test_loss: 1.0812, test_f1: 0.6015
 epoch: 44, train_loss: 0.5572, test_loss: 1.1188, test_f1: 0.6278
 epoch: 45, train_loss: 0.5447, test_loss: 1.1052, test_f1: 0.6051
 epoch: 46, train_loss: 0.5282, test_loss: 1.1915, test_f1: 0.5614
 epoch: 47, train_loss: 0.5254, test_loss: 1.1209, test_f1: 0.6003
 epoch: 48, train_loss: 0.5139, test_loss: 1.1912, test_f1: 0.5818
 epoch: 49, train_loss: 0.5152, test_loss: 1.1468, test_f1: 0.5831
 epoch: 50, train_loss: 0.5097, test_loss: 1.2346, test_f1: 0.5863
 epoch: 51, train_loss: 0.4714, test_loss: 1.2491, test_f1: 0.5683
 epoch: 52, train_loss: 0.4805, test_loss: 1.2307, test_f1: 0.5713
 epoch: 53, train_loss: 0.4706, test_loss: 1.2638, test_f1: 0.5388
 epoch: 54, train_loss: 0.4757, test_loss: 1.3011, test_f1: 0.5623
 epoch: 55, train_loss: 0.4569, test_loss: 1.2899, test_f1: 0.5511
 epoch: 56, train_loss: 0.4623, test_loss: 1.2778, test_f1: 0.5707
 epoch: 57, train_loss: 0.4522, test_loss: 1.2410, test_f1: 0.5634
 epoch: 58, train_loss: 0.4472, test_loss: 1.2389, test_f1: 0.5693
 epoch: 59, train_loss: 0.4420, test_loss: 1.2695, test_f1: 0.5700
 epoch: 60, train_loss: 0.4302, test_loss: 1.2898, test_f1: 0.5656
 epoch: 61, train_loss: 0.4338, test_loss: 1.2802, test_f1: 0.5653
 epoch: 62, train_loss: 0.4449, test_loss: 1.3355, test_f1: 0.5595
 epoch: 63, train_loss: 0.4239, test_loss: 1.3656, test_f1: 0.5630
 epoch: 64, train_loss: 0.4214, test_loss: 1.4186, test_f1: 0.5394
 epoch: 65, train_loss: 0.4209, test_loss: 1.3452, test_f1: 0.5782
 epoch: 66, train_loss: 0.4248, test_loss: 1.3234, test_f1: 0.5758
 epoch: 67, train_loss: 0.3976, test_loss: 1.3633, test_f1: 0.5839
 epoch: 68, train_loss: 0.4148, test_loss: 1.4162, test_f1: 0.5617
 epoch: 69, train_loss: 0.3994, test_loss: 1.4553, test_f1: 0.5364
 epoch: 70, train_loss: 0.3995, test_loss: 1.3532, test_f1: 0.5707
 epoch: 71, train_loss: 0.3940, test_loss: 1.4328, test_f1: 0.5613
 epoch: 72, train_loss: 0.3990, test_loss: 1.4725, test_f1: 0.5781
 epoch: 73, train_loss: 0.3947, test_loss: 1.4440, test_f1: 0.5912
 epoch: 74, train_loss: 0.3974, test_loss: 1.4980, test_f1: 0.5811
 epoch: 75, train_loss: 0.4098, test_loss: 1.4361, test_f1: 0.5851
 epoch: 76, train_loss: 0.3916, test_loss: 1.4384, test_f1: 0.5602
 epoch: 77, train_loss: 0.3887, test_loss: 1.5819, test_f1: 0.5684
 epoch: 78, train_loss: 0.3673, test_loss: 1.5910, test_f1: 0.5742
 epoch: 79, train_loss: 0.3681, test_loss: 1.5663, test_f1: 0.5781
 epoch: 80, train_loss: 0.3589, test_loss: 1.6193, test_f1: 0.5690
 epoch: 81, train_loss: 0.3590, test_loss: 1.6486, test_f1: 0.5654
 epoch: 82, train_loss: 0.3598, test_loss: 1.6704, test_f1: 0.5754
 epoch: 83, train_loss: 0.3393, test_loss: 1.5559, test_f1: 0.5826
 epoch: 84, train_loss: 0.3480, test_loss: 1.6146, test_f1: 0.5764
 epoch: 85, train_loss: 0.3403, test_loss: 1.7601, test_f1: 0.5833
 epoch: 86, train_loss: 0.3560, test_loss: 1.6162, test_f1: 0.5967
 epoch: 87, train_loss: 0.3353, test_loss: 1.5933, test_f1: 0.5892
 epoch: 88, train_loss: 0.3337, test_loss: 1.5618, test_f1: 0.5825
 epoch: 89, train_loss: 0.3404, test_loss: 1.6210, test_f1: 0.5976
 epoch: 90, train_loss: 0.3300, test_loss: 1.7212, test_f1: 0.5793
 epoch: 91, train_loss: 0.3354, test_loss: 1.7085, test_f1: 0.5806
 epoch: 92, train_loss: 0.3272, test_loss: 1.6577, test_f1: 0.6086
 epoch: 93, train_loss: 0.3307, test_loss: 1.6579, test_f1: 0.6075
 epoch: 94, train_loss: 0.3197, test_loss: 1.7628, test_f1: 0.5738
 epoch: 95, train_loss: 0.3138, test_loss: 1.7730, test_f1: 0.5874
 epoch: 96, train_loss: 0.3248, test_loss: 1.9228, test_f1: 0.5891
 epoch: 97, train_loss: 0.3090, test_loss: 1.8601, test_f1: 0.5848
 epoch: 98, train_loss: 0.3092, test_loss: 1.7784, test_f1: 0.6031
 epoch: 99, train_loss: 0.3207, test_loss: 1.7736, test_f1: 0.5958
##################ITERATION #1 ****************************************
 epoch: 0, train_loss: 1.3076, test_loss: 1.3153, test_f1: 0.2281
 epoch: 1, train_loss: 1.2291, test_loss: 1.2903, test_f1: 0.2281
 epoch: 2, train_loss: 1.1887, test_loss: 1.2468, test_f1: 0.2617
 epoch: 3, train_loss: 1.1501, test_loss: 1.2043, test_f1: 0.3472
 epoch: 4, train_loss: 1.1100, test_loss: 1.1614, test_f1: 0.4290
 epoch: 5, train_loss: 1.0746, test_loss: 1.1172, test_f1: 0.4628
 epoch: 6, train_loss: 1.0349, test_loss: 1.0800, test_f1: 0.5138
 epoch: 7, train_loss: 0.9976, test_loss: 1.0494, test_f1: 0.5140
 epoch: 8, train_loss: 0.9629, test_loss: 1.0288, test_f1: 0.5505
 epoch: 9, train_loss: 0.9221, test_loss: 1.0114, test_f1: 0.5804
 epoch: 10, train_loss: 0.9058, test_loss: 0.9900, test_f1: 0.5719
 epoch: 11, train_loss: 0.8696, test_loss: 0.9875, test_f1: 0.5869
 epoch: 12, train_loss: 0.8494, test_loss: 0.9875, test_f1: 0.5906
 epoch: 13, train_loss: 0.8273, test_loss: 0.9679, test_f1: 0.6081
 epoch: 14, train_loss: 0.8093, test_loss: 1.0033, test_f1: 0.5431
 epoch: 15, train_loss: 0.7833, test_loss: 0.9937, test_f1: 0.6066
 epoch: 16, train_loss: 0.7854, test_loss: 0.9606, test_f1: 0.6123
 epoch: 17, train_loss: 0.7522, test_loss: 0.9665, test_f1: 0.6395
 epoch: 18, train_loss: 0.7401, test_loss: 0.9617, test_f1: 0.6243
 epoch: 19, train_loss: 0.7135, test_loss: 0.9510, test_f1: 0.6426
 epoch: 20, train_loss: 0.7235, test_loss: 1.0033, test_f1: 0.6008
 epoch: 21, train_loss: 0.7199, test_loss: 0.9704, test_f1: 0.6364
 epoch: 22, train_loss: 0.6912, test_loss: 0.9706, test_f1: 0.5682
 epoch: 23, train_loss: 0.6739, test_loss: 1.0164, test_f1: 0.6174
 epoch: 24, train_loss: 0.6740, test_loss: 0.9626, test_f1: 0.6146
 epoch: 25, train_loss: 0.6527, test_loss: 0.9754, test_f1: 0.5782
 epoch: 26, train_loss: 0.6442, test_loss: 1.0008, test_f1: 0.5941
 epoch: 27, train_loss: 0.6410, test_loss: 1.0155, test_f1: 0.6188
 epoch: 28, train_loss: 0.6147, test_loss: 0.9724, test_f1: 0.6398
 epoch: 29, train_loss: 0.6041, test_loss: 1.0633, test_f1: 0.5646
 epoch: 30, train_loss: 0.5964, test_loss: 1.0308, test_f1: 0.6074
 epoch: 31, train_loss: 0.5941, test_loss: 0.9836, test_f1: 0.6416
 epoch: 32, train_loss: 0.5686, test_loss: 1.0260, test_f1: 0.6137
 epoch: 33, train_loss: 0.5833, test_loss: 1.1060, test_f1: 0.5485
 epoch: 34, train_loss: 0.5544, test_loss: 1.0576, test_f1: 0.5936
 epoch: 35, train_loss: 0.5730, test_loss: 1.0449, test_f1: 0.5891
 epoch: 36, train_loss: 0.5602, test_loss: 1.0457, test_f1: 0.6240
 epoch: 37, train_loss: 0.5388, test_loss: 1.0776, test_f1: 0.5918
 epoch: 38, train_loss: 0.5396, test_loss: 1.0686, test_f1: 0.5844
 epoch: 39, train_loss: 0.5283, test_loss: 1.0797, test_f1: 0.6037
 epoch: 40, train_loss: 0.5017, test_loss: 1.1020, test_f1: 0.5695
 epoch: 41, train_loss: 0.4990, test_loss: 1.0647, test_f1: 0.6152
 epoch: 42, train_loss: 0.5033, test_loss: 1.1655, test_f1: 0.5191
 epoch: 43, train_loss: 0.5006, test_loss: 1.0881, test_f1: 0.5920
 epoch: 44, train_loss: 0.5028, test_loss: 1.1607, test_f1: 0.6373
 epoch: 45, train_loss: 0.4791, test_loss: 1.0556, test_f1: 0.6231
 epoch: 46, train_loss: 0.5244, test_loss: 1.1645, test_f1: 0.6169
 epoch: 47, train_loss: 0.4855, test_loss: 1.0664, test_f1: 0.6513
 epoch: 48, train_loss: 0.4843, test_loss: 1.1347, test_f1: 0.6246
 epoch: 49, train_loss: 0.4600, test_loss: 1.1667, test_f1: 0.6339
 epoch: 50, train_loss: 0.4559, test_loss: 1.1043, test_f1: 0.6500
 epoch: 51, train_loss: 0.4322, test_loss: 1.1229, test_f1: 0.6240
 epoch: 52, train_loss: 0.4246, test_loss: 1.2259, test_f1: 0.5686
 epoch: 53, train_loss: 0.4145, test_loss: 1.1510, test_f1: 0.6050
 epoch: 54, train_loss: 0.4240, test_loss: 1.1734, test_f1: 0.5889
 epoch: 55, train_loss: 0.4030, test_loss: 1.1575, test_f1: 0.6283
 epoch: 56, train_loss: 0.3884, test_loss: 1.1899, test_f1: 0.5954
 epoch: 57, train_loss: 0.3888, test_loss: 1.1588, test_f1: 0.6333
 epoch: 58, train_loss: 0.3897, test_loss: 1.1939, test_f1: 0.6263
 epoch: 59, train_loss: 0.3714, test_loss: 1.1507, test_f1: 0.6320
 epoch: 60, train_loss: 0.3791, test_loss: 1.2180, test_f1: 0.6030
 epoch: 61, train_loss: 0.3763, test_loss: 1.1631, test_f1: 0.6173
 epoch: 62, train_loss: 0.3587, test_loss: 1.2525, test_f1: 0.6322
 epoch: 63, train_loss: 0.3740, test_loss: 1.1319, test_f1: 0.6422
 epoch: 64, train_loss: 0.3571, test_loss: 1.2620, test_f1: 0.6129
 epoch: 65, train_loss: 0.3522, test_loss: 1.2561, test_f1: 0.6286
 epoch: 66, train_loss: 0.3639, test_loss: 1.2338, test_f1: 0.6186
 epoch: 67, train_loss: 0.3458, test_loss: 1.2223, test_f1: 0.6693
 epoch: 68, train_loss: 0.3528, test_loss: 1.2385, test_f1: 0.6335
 epoch: 69, train_loss: 0.3551, test_loss: 1.3519, test_f1: 0.6190
 epoch: 70, train_loss: 0.3527, test_loss: 1.2878, test_f1: 0.6474
 epoch: 71, train_loss: 0.3374, test_loss: 1.2723, test_f1: 0.6331
 epoch: 72, train_loss: 0.3254, test_loss: 1.2742, test_f1: 0.6450
 epoch: 73, train_loss: 0.3312, test_loss: 1.3324, test_f1: 0.6366
 epoch: 74, train_loss: 0.3408, test_loss: 1.3001, test_f1: 0.6629
 epoch: 75, train_loss: 0.3370, test_loss: 1.3669, test_f1: 0.6110
 epoch: 76, train_loss: 0.3239, test_loss: 1.2870, test_f1: 0.6498
 epoch: 77, train_loss: 0.3130, test_loss: 1.3863, test_f1: 0.6285
 epoch: 78, train_loss: 0.3164, test_loss: 1.3525, test_f1: 0.6403
 epoch: 79, train_loss: 0.3133, test_loss: 1.2879, test_f1: 0.6307
 epoch: 80, train_loss: 0.2988, test_loss: 1.2770, test_f1: 0.6487
 epoch: 81, train_loss: 0.2969, test_loss: 1.4471, test_f1: 0.6041
 epoch: 82, train_loss: 0.2966, test_loss: 1.2315, test_f1: 0.6389
 epoch: 83, train_loss: 0.2962, test_loss: 1.3773, test_f1: 0.6044
 epoch: 84, train_loss: 0.2904, test_loss: 1.4521, test_f1: 0.6413
 epoch: 85, train_loss: 0.2893, test_loss: 1.3219, test_f1: 0.6454
 epoch: 86, train_loss: 0.2805, test_loss: 1.4057, test_f1: 0.6371
 epoch: 87, train_loss: 0.2861, test_loss: 1.3547, test_f1: 0.6642
 epoch: 88, train_loss: 0.2691, test_loss: 1.4734, test_f1: 0.6197
 epoch: 89, train_loss: 0.2679, test_loss: 1.5026, test_f1: 0.6239
 epoch: 90, train_loss: 0.2620, test_loss: 1.4278, test_f1: 0.6469
 epoch: 91, train_loss: 0.2653, test_loss: 1.4811, test_f1: 0.6559
 epoch: 92, train_loss: 0.2489, test_loss: 1.4062, test_f1: 0.6557
 epoch: 93, train_loss: 0.2609, test_loss: 1.3431, test_f1: 0.6538
 epoch: 94, train_loss: 0.2761, test_loss: 1.3926, test_f1: 0.6785
 epoch: 95, train_loss: 0.2845, test_loss: 1.3292, test_f1: 0.6785
 epoch: 96, train_loss: 0.2508, test_loss: 1.5345, test_f1: 0.6038
 epoch: 97, train_loss: 0.2615, test_loss: 1.4383, test_f1: 0.6292
 epoch: 98, train_loss: 0.2455, test_loss: 1.4672, test_f1: 0.6478
 epoch: 99, train_loss: 0.2474, test_loss: 1.5461, test_f1: 0.6295
##################ITERATION #2 ****************************************
 epoch: 0, train_loss: 1.2698, test_loss: 1.3022, test_f1: 0.2281
 epoch: 1, train_loss: 1.1972, test_loss: 1.2828, test_f1: 0.2944
 epoch: 2, train_loss: 1.1614, test_loss: 1.2658, test_f1: 0.3493
 epoch: 3, train_loss: 1.1187, test_loss: 1.1955, test_f1: 0.4225
 epoch: 4, train_loss: 1.0864, test_loss: 1.1606, test_f1: 0.4357
 epoch: 5, train_loss: 1.0490, test_loss: 1.1143, test_f1: 0.5027
 epoch: 6, train_loss: 1.0059, test_loss: 1.0858, test_f1: 0.5183
 epoch: 7, train_loss: 0.9786, test_loss: 1.0542, test_f1: 0.5143
 epoch: 8, train_loss: 0.9401, test_loss: 1.0343, test_f1: 0.5414
 epoch: 9, train_loss: 0.9044, test_loss: 1.0389, test_f1: 0.5560
 epoch: 10, train_loss: 0.8821, test_loss: 1.0083, test_f1: 0.5979
 epoch: 11, train_loss: 0.8724, test_loss: 0.9938, test_f1: 0.5912
 epoch: 12, train_loss: 0.8406, test_loss: 1.0073, test_f1: 0.5475
 epoch: 13, train_loss: 0.8204, test_loss: 0.9897, test_f1: 0.6027
 epoch: 14, train_loss: 0.8010, test_loss: 0.9827, test_f1: 0.5791
 epoch: 15, train_loss: 0.7736, test_loss: 0.9956, test_f1: 0.6084
 epoch: 16, train_loss: 0.7620, test_loss: 0.9913, test_f1: 0.6192
 epoch: 17, train_loss: 0.7528, test_loss: 0.9899, test_f1: 0.5933
 epoch: 18, train_loss: 0.7422, test_loss: 1.0018, test_f1: 0.5926
 epoch: 19, train_loss: 0.7163, test_loss: 0.9923, test_f1: 0.5940
 epoch: 20, train_loss: 0.7092, test_loss: 1.0128, test_f1: 0.5661
 epoch: 21, train_loss: 0.6838, test_loss: 1.0546, test_f1: 0.5813
 epoch: 22, train_loss: 0.6727, test_loss: 1.1154, test_f1: 0.5911
 epoch: 23, train_loss: 0.6747, test_loss: 1.0366, test_f1: 0.5991
 epoch: 24, train_loss: 0.6485, test_loss: 1.0438, test_f1: 0.5953
 epoch: 25, train_loss: 0.6298, test_loss: 1.0631, test_f1: 0.6126
 epoch: 26, train_loss: 0.6330, test_loss: 1.0659, test_f1: 0.6145
 epoch: 27, train_loss: 0.6238, test_loss: 1.0946, test_f1: 0.5831
 epoch: 28, train_loss: 0.5927, test_loss: 1.0430, test_f1: 0.6014
 epoch: 29, train_loss: 0.5819, test_loss: 1.0936, test_f1: 0.5877
 epoch: 30, train_loss: 0.5687, test_loss: 1.0877, test_f1: 0.6141
 epoch: 31, train_loss: 0.5619, test_loss: 1.0855, test_f1: 0.6403
 epoch: 32, train_loss: 0.5614, test_loss: 1.1525, test_f1: 0.6015
 epoch: 33, train_loss: 0.5385, test_loss: 1.2688, test_f1: 0.5941
 epoch: 34, train_loss: 0.5409, test_loss: 1.2035, test_f1: 0.5898
 epoch: 35, train_loss: 0.5140, test_loss: 1.1334, test_f1: 0.6315
 epoch: 36, train_loss: 0.5067, test_loss: 1.1850, test_f1: 0.6157
 epoch: 37, train_loss: 0.4910, test_loss: 1.1772, test_f1: 0.6225
 epoch: 38, train_loss: 0.4723, test_loss: 1.1524, test_f1: 0.5943
 epoch: 39, train_loss: 0.4732, test_loss: 1.1392, test_f1: 0.6302
 epoch: 40, train_loss: 0.4779, test_loss: 1.2435, test_f1: 0.5743
 epoch: 41, train_loss: 0.4570, test_loss: 1.2278, test_f1: 0.5910
 epoch: 42, train_loss: 0.4674, test_loss: 1.2380, test_f1: 0.5988
 epoch: 43, train_loss: 0.4469, test_loss: 1.2602, test_f1: 0.5872
 epoch: 44, train_loss: 0.4607, test_loss: 1.1406, test_f1: 0.6146
 epoch: 45, train_loss: 0.4329, test_loss: 1.2489, test_f1: 0.6295
 epoch: 46, train_loss: 0.4358, test_loss: 1.3508, test_f1: 0.5717
 epoch: 47, train_loss: 0.4145, test_loss: 1.3783, test_f1: 0.6196
 epoch: 48, train_loss: 0.4065, test_loss: 1.2418, test_f1: 0.6470
 epoch: 49, train_loss: 0.3947, test_loss: 1.2571, test_f1: 0.6344
 epoch: 50, train_loss: 0.3805, test_loss: 1.3499, test_f1: 0.6152
 epoch: 51, train_loss: 0.3594, test_loss: 1.3135, test_f1: 0.6202
 epoch: 52, train_loss: 0.3552, test_loss: 1.3143, test_f1: 0.6390
 epoch: 53, train_loss: 0.3631, test_loss: 1.3418, test_f1: 0.6046
 epoch: 54, train_loss: 0.3365, test_loss: 1.3479, test_f1: 0.6076
 epoch: 55, train_loss: 0.3183, test_loss: 1.3724, test_f1: 0.6172
 epoch: 56, train_loss: 0.3398, test_loss: 1.3466, test_f1: 0.6267
 epoch: 57, train_loss: 0.3219, test_loss: 1.3570, test_f1: 0.6347
 epoch: 58, train_loss: 0.3095, test_loss: 1.3786, test_f1: 0.6322
 epoch: 59, train_loss: 0.3133, test_loss: 1.4177, test_f1: 0.6339
 epoch: 60, train_loss: 0.3026, test_loss: 1.4163, test_f1: 0.6332
 epoch: 61, train_loss: 0.2991, test_loss: 1.4126, test_f1: 0.6294
 epoch: 62, train_loss: 0.2939, test_loss: 1.4468, test_f1: 0.6156
 epoch: 63, train_loss: 0.2987, test_loss: 1.4548, test_f1: 0.6094
 epoch: 64, train_loss: 0.2946, test_loss: 1.4936, test_f1: 0.6179
 epoch: 65, train_loss: 0.2927, test_loss: 1.4687, test_f1: 0.6249
 epoch: 66, train_loss: 0.2900, test_loss: 1.4600, test_f1: 0.6255
 epoch: 67, train_loss: 0.2726, test_loss: 1.5679, test_f1: 0.6166
 epoch: 68, train_loss: 0.2760, test_loss: 1.5299, test_f1: 0.6124
 epoch: 69, train_loss: 0.2991, test_loss: 1.5308, test_f1: 0.6092
 epoch: 70, train_loss: 0.2760, test_loss: 1.4967, test_f1: 0.6345
 epoch: 71, train_loss: 0.2884, test_loss: 1.4752, test_f1: 0.6290
 epoch: 72, train_loss: 0.2737, test_loss: 1.4815, test_f1: 0.6346
 epoch: 73, train_loss: 0.2701, test_loss: 1.5730, test_f1: 0.6337
 epoch: 74, train_loss: 0.2714, test_loss: 1.5151, test_f1: 0.6270
 epoch: 75, train_loss: 0.2558, test_loss: 1.5398, test_f1: 0.6244
 epoch: 76, train_loss: 0.2351, test_loss: 1.5875, test_f1: 0.6367
 epoch: 77, train_loss: 0.2462, test_loss: 1.6007, test_f1: 0.6241
 epoch: 78, train_loss: 0.2374, test_loss: 1.5899, test_f1: 0.6293
 epoch: 79, train_loss: 0.2504, test_loss: 1.6026, test_f1: 0.6363
 epoch: 80, train_loss: 0.2443, test_loss: 1.6122, test_f1: 0.6240
 epoch: 81, train_loss: 0.2517, test_loss: 1.5745, test_f1: 0.6350
 epoch: 82, train_loss: 0.2349, test_loss: 1.5947, test_f1: 0.6275
 epoch: 83, train_loss: 0.2330, test_loss: 1.5747, test_f1: 0.6511
 epoch: 84, train_loss: 0.2208, test_loss: 1.6129, test_f1: 0.6426
 epoch: 85, train_loss: 0.2167, test_loss: 1.6074, test_f1: 0.6205
 epoch: 86, train_loss: 0.2350, test_loss: 1.6455, test_f1: 0.6381
 epoch: 87, train_loss: 0.2155, test_loss: 1.7776, test_f1: 0.6174
 epoch: 88, train_loss: 0.2165, test_loss: 1.7113, test_f1: 0.6256
 epoch: 89, train_loss: 0.2210, test_loss: 1.6833, test_f1: 0.6461
 epoch: 90, train_loss: 0.2080, test_loss: 1.6538, test_f1: 0.6649
 epoch: 91, train_loss: 0.2246, test_loss: 1.6174, test_f1: 0.6536
 epoch: 92, train_loss: 0.2216, test_loss: 1.7454, test_f1: 0.6238
 epoch: 93, train_loss: 0.2086, test_loss: 1.6572, test_f1: 0.6323
 epoch: 94, train_loss: 0.2101, test_loss: 1.7216, test_f1: 0.6243
 epoch: 95, train_loss: 0.2188, test_loss: 1.6473, test_f1: 0.6465
 epoch: 96, train_loss: 0.2107, test_loss: 1.7146, test_f1: 0.6331
 epoch: 97, train_loss: 0.1817, test_loss: 1.7112, test_f1: 0.6235
 epoch: 98, train_loss: 0.1943, test_loss: 1.7659, test_f1: 0.6198
 epoch: 99, train_loss: 0.1976, test_loss: 1.7653, test_f1: 0.6374
##################ITERATION #3 ****************************************
 epoch: 0, train_loss: 1.2439, test_loss: 1.3066, test_f1: 0.2281
 epoch: 1, train_loss: 1.1519, test_loss: 1.2552, test_f1: 0.3178
 epoch: 2, train_loss: 1.1096, test_loss: 1.1937, test_f1: 0.3758
 epoch: 3, train_loss: 1.0687, test_loss: 1.1816, test_f1: 0.4782
 epoch: 4, train_loss: 1.0372, test_loss: 1.1123, test_f1: 0.5053
 epoch: 5, train_loss: 0.9831, test_loss: 1.0659, test_f1: 0.5165
 epoch: 6, train_loss: 0.9574, test_loss: 1.0478, test_f1: 0.5218
 epoch: 7, train_loss: 0.9289, test_loss: 1.0208, test_f1: 0.5467
 epoch: 8, train_loss: 0.8963, test_loss: 1.0051, test_f1: 0.5862
 epoch: 9, train_loss: 0.8754, test_loss: 0.9932, test_f1: 0.5929
 epoch: 10, train_loss: 0.8567, test_loss: 0.9919, test_f1: 0.5772
 epoch: 11, train_loss: 0.8482, test_loss: 0.9698, test_f1: 0.5990
 epoch: 12, train_loss: 0.8019, test_loss: 0.9766, test_f1: 0.5800
 epoch: 13, train_loss: 0.7911, test_loss: 0.9690, test_f1: 0.5710
 epoch: 14, train_loss: 0.7762, test_loss: 0.9335, test_f1: 0.6192
 epoch: 15, train_loss: 0.7389, test_loss: 0.9655, test_f1: 0.5596
 epoch: 16, train_loss: 0.7255, test_loss: 0.9702, test_f1: 0.5866
 epoch: 17, train_loss: 0.7216, test_loss: 0.9763, test_f1: 0.5800
 epoch: 18, train_loss: 0.6975, test_loss: 1.0293, test_f1: 0.5509
 epoch: 19, train_loss: 0.6845, test_loss: 0.9736, test_f1: 0.5593
 epoch: 20, train_loss: 0.6802, test_loss: 1.0076, test_f1: 0.5644
 epoch: 21, train_loss: 0.6425, test_loss: 1.0190, test_f1: 0.5570
 epoch: 22, train_loss: 0.6306, test_loss: 0.9874, test_f1: 0.5981
 epoch: 23, train_loss: 0.6331, test_loss: 1.0428, test_f1: 0.5645
 epoch: 24, train_loss: 0.6235, test_loss: 0.9650, test_f1: 0.6031
 epoch: 25, train_loss: 0.6028, test_loss: 1.0179, test_f1: 0.5684
 epoch: 26, train_loss: 0.6084, test_loss: 0.9729, test_f1: 0.5897
 epoch: 27, train_loss: 0.5933, test_loss: 1.0755, test_f1: 0.5869
 epoch: 28, train_loss: 0.5663, test_loss: 1.0335, test_f1: 0.6203
 epoch: 29, train_loss: 0.5448, test_loss: 1.0787, test_f1: 0.5961
 epoch: 30, train_loss: 0.5388, test_loss: 1.0552, test_f1: 0.5898
 epoch: 31, train_loss: 0.5482, test_loss: 1.0472, test_f1: 0.6104
 epoch: 32, train_loss: 0.5228, test_loss: 1.0540, test_f1: 0.6079
 epoch: 33, train_loss: 0.5156, test_loss: 1.1501, test_f1: 0.6118
 epoch: 34, train_loss: 0.5107, test_loss: 1.1124, test_f1: 0.6092
 epoch: 35, train_loss: 0.5111, test_loss: 1.0871, test_f1: 0.6215
 epoch: 36, train_loss: 0.5000, test_loss: 1.1667, test_f1: 0.5933
 epoch: 37, train_loss: 0.4794, test_loss: 1.1490, test_f1: 0.5950
 epoch: 38, train_loss: 0.4785, test_loss: 1.1137, test_f1: 0.6206
 epoch: 39, train_loss: 0.4509, test_loss: 1.1187, test_f1: 0.6251
 epoch: 40, train_loss: 0.4598, test_loss: 1.1693, test_f1: 0.6075
 epoch: 41, train_loss: 0.4530, test_loss: 1.1371, test_f1: 0.6159
 epoch: 42, train_loss: 0.4302, test_loss: 1.2506, test_f1: 0.6093
 epoch: 43, train_loss: 0.4236, test_loss: 1.2201, test_f1: 0.6159
 epoch: 44, train_loss: 0.4246, test_loss: 1.2092, test_f1: 0.5861
 epoch: 45, train_loss: 0.4182, test_loss: 1.2140, test_f1: 0.6272
 epoch: 46, train_loss: 0.3693, test_loss: 1.2442, test_f1: 0.6096
 epoch: 47, train_loss: 0.3875, test_loss: 1.2305, test_f1: 0.6055
 epoch: 48, train_loss: 0.3900, test_loss: 1.2551, test_f1: 0.6240
 epoch: 49, train_loss: 0.3638, test_loss: 1.3377, test_f1: 0.6009
 epoch: 50, train_loss: 0.3814, test_loss: 1.4111, test_f1: 0.6224
 epoch: 51, train_loss: 0.3686, test_loss: 1.3383, test_f1: 0.6262
 epoch: 52, train_loss: 0.3454, test_loss: 1.2756, test_f1: 0.6443
 epoch: 53, train_loss: 0.3302, test_loss: 1.3037, test_f1: 0.6343
 epoch: 54, train_loss: 0.3125, test_loss: 1.3566, test_f1: 0.6475
 epoch: 55, train_loss: 0.3234, test_loss: 1.3543, test_f1: 0.6340
 epoch: 56, train_loss: 0.3055, test_loss: 1.3828, test_f1: 0.6369
 epoch: 57, train_loss: 0.3038, test_loss: 1.3986, test_f1: 0.6279
 epoch: 58, train_loss: 0.3058, test_loss: 1.4561, test_f1: 0.6104
 epoch: 59, train_loss: 0.2986, test_loss: 1.4729, test_f1: 0.5986
 epoch: 60, train_loss: 0.2887, test_loss: 1.5139, test_f1: 0.6012
 epoch: 61, train_loss: 0.3012, test_loss: 1.5112, test_f1: 0.6131
 epoch: 62, train_loss: 0.2946, test_loss: 1.4549, test_f1: 0.6321
 epoch: 63, train_loss: 0.2857, test_loss: 1.4743, test_f1: 0.6341
 epoch: 64, train_loss: 0.2873, test_loss: 1.5184, test_f1: 0.6208
 epoch: 65, train_loss: 0.2770, test_loss: 1.5563, test_f1: 0.6202
 epoch: 66, train_loss: 0.2687, test_loss: 1.5199, test_f1: 0.6065
 epoch: 67, train_loss: 0.2813, test_loss: 1.5969, test_f1: 0.6078
 epoch: 68, train_loss: 0.2640, test_loss: 1.5669, test_f1: 0.6162
 epoch: 69, train_loss: 0.2679, test_loss: 1.5782, test_f1: 0.6226
 epoch: 70, train_loss: 0.2630, test_loss: 1.6131, test_f1: 0.6070
 epoch: 71, train_loss: 0.2666, test_loss: 1.5881, test_f1: 0.6033
 epoch: 72, train_loss: 0.2450, test_loss: 1.5458, test_f1: 0.6089
 epoch: 73, train_loss: 0.2394, test_loss: 1.6859, test_f1: 0.5729
 epoch: 74, train_loss: 0.2344, test_loss: 1.6936, test_f1: 0.5997
 epoch: 75, train_loss: 0.2531, test_loss: 1.6137, test_f1: 0.6061
 epoch: 76, train_loss: 0.2351, test_loss: 1.6291, test_f1: 0.6135
 epoch: 77, train_loss: 0.2386, test_loss: 1.6603, test_f1: 0.6147
 epoch: 78, train_loss: 0.2473, test_loss: 1.6827, test_f1: 0.6054
 epoch: 79, train_loss: 0.2521, test_loss: 1.6654, test_f1: 0.5930
 epoch: 80, train_loss: 0.2407, test_loss: 1.6676, test_f1: 0.6178
 epoch: 81, train_loss: 0.2266, test_loss: 1.7126, test_f1: 0.6278
 epoch: 82, train_loss: 0.2266, test_loss: 1.7425, test_f1: 0.6016
 epoch: 83, train_loss: 0.2243, test_loss: 1.7330, test_f1: 0.5993
 epoch: 84, train_loss: 0.2144, test_loss: 1.7720, test_f1: 0.6207
 epoch: 85, train_loss: 0.2161, test_loss: 1.8495, test_f1: 0.6145
 epoch: 86, train_loss: 0.2192, test_loss: 1.7489, test_f1: 0.6119
 epoch: 87, train_loss: 0.2231, test_loss: 1.7702, test_f1: 0.6147
 epoch: 88, train_loss: 0.2167, test_loss: 1.7229, test_f1: 0.6217
 epoch: 89, train_loss: 0.2222, test_loss: 1.7809, test_f1: 0.5934
 epoch: 90, train_loss: 0.2156, test_loss: 1.8092, test_f1: 0.6137
 epoch: 91, train_loss: 0.1915, test_loss: 1.7626, test_f1: 0.6380
 epoch: 92, train_loss: 0.1901, test_loss: 1.8014, test_f1: 0.6125
 epoch: 93, train_loss: 0.2047, test_loss: 1.7908, test_f1: 0.6124
 epoch: 94, train_loss: 0.2131, test_loss: 1.8499, test_f1: 0.5984
 epoch: 95, train_loss: 0.2116, test_loss: 1.8275, test_f1: 0.5876
 epoch: 96, train_loss: 0.1936, test_loss: 1.8244, test_f1: 0.5847
 epoch: 97, train_loss: 0.2041, test_loss: 1.8884, test_f1: 0.6033
 epoch: 98, train_loss: 0.1923, test_loss: 1.8678, test_f1: 0.5907
 epoch: 99, train_loss: 0.1966, test_loss: 1.8009, test_f1: 0.5936
##################ITERATION #4 ****************************************
 epoch: 0, train_loss: 1.2391, test_loss: 1.2863, test_f1: 0.2281
 epoch: 1, train_loss: 1.1490, test_loss: 1.2347, test_f1: 0.2716
 epoch: 2, train_loss: 1.1027, test_loss: 1.1801, test_f1: 0.3769
 epoch: 3, train_loss: 1.0699, test_loss: 1.1314, test_f1: 0.4318
 epoch: 4, train_loss: 1.0252, test_loss: 1.0997, test_f1: 0.4968
 epoch: 5, train_loss: 0.9915, test_loss: 1.0698, test_f1: 0.5466
 epoch: 6, train_loss: 0.9636, test_loss: 1.0722, test_f1: 0.5467
 epoch: 7, train_loss: 0.9345, test_loss: 1.0623, test_f1: 0.5222
 epoch: 8, train_loss: 0.9205, test_loss: 1.0494, test_f1: 0.5462
 epoch: 9, train_loss: 0.8877, test_loss: 1.0266, test_f1: 0.5702
 epoch: 10, train_loss: 0.8869, test_loss: 1.0410, test_f1: 0.5581
 epoch: 11, train_loss: 0.8539, test_loss: 1.0177, test_f1: 0.5821
 epoch: 12, train_loss: 0.8254, test_loss: 1.0315, test_f1: 0.5894
 epoch: 13, train_loss: 0.8176, test_loss: 1.0555, test_f1: 0.5460
 epoch: 14, train_loss: 0.7909, test_loss: 1.0293, test_f1: 0.5847
 epoch: 15, train_loss: 0.7854, test_loss: 1.0090, test_f1: 0.5713
 epoch: 16, train_loss: 0.7487, test_loss: 1.0594, test_f1: 0.5426
 epoch: 17, train_loss: 0.7337, test_loss: 1.0431, test_f1: 0.5754
 epoch: 18, train_loss: 0.7097, test_loss: 1.0935, test_f1: 0.5594
 epoch: 19, train_loss: 0.6997, test_loss: 1.0560, test_f1: 0.5652
 epoch: 20, train_loss: 0.6993, test_loss: 1.0010, test_f1: 0.5922
 epoch: 21, train_loss: 0.6803, test_loss: 1.0318, test_f1: 0.5761
 epoch: 22, train_loss: 0.6673, test_loss: 1.0227, test_f1: 0.6076
 epoch: 23, train_loss: 0.6222, test_loss: 1.0980, test_f1: 0.5494
 epoch: 24, train_loss: 0.6538, test_loss: 1.0618, test_f1: 0.5910
 epoch: 25, train_loss: 0.6245, test_loss: 1.0912, test_f1: 0.5339
 epoch: 26, train_loss: 0.6290, test_loss: 1.1399, test_f1: 0.5638
 epoch: 27, train_loss: 0.6060, test_loss: 1.0695, test_f1: 0.6013
 epoch: 28, train_loss: 0.5830, test_loss: 1.0308, test_f1: 0.5908
 epoch: 29, train_loss: 0.5705, test_loss: 1.1119, test_f1: 0.5915
 epoch: 30, train_loss: 0.5739, test_loss: 1.1910, test_f1: 0.5529
 epoch: 31, train_loss: 0.5633, test_loss: 1.0583, test_f1: 0.6084
 epoch: 32, train_loss: 0.5585, test_loss: 1.0914, test_f1: 0.6173
 epoch: 33, train_loss: 0.5649, test_loss: 1.1304, test_f1: 0.5631
 epoch: 34, train_loss: 0.5208, test_loss: 1.1559, test_f1: 0.5537
 epoch: 35, train_loss: 0.5377, test_loss: 1.1600, test_f1: 0.5457
 epoch: 36, train_loss: 0.5165, test_loss: 1.1288, test_f1: 0.5786
 epoch: 37, train_loss: 0.4966, test_loss: 1.1053, test_f1: 0.6347
 epoch: 38, train_loss: 0.4932, test_loss: 1.1973, test_f1: 0.5920
 epoch: 39, train_loss: 0.4913, test_loss: 1.1841, test_f1: 0.5758
 epoch: 40, train_loss: 0.4793, test_loss: 1.2053, test_f1: 0.5802
 epoch: 41, train_loss: 0.4690, test_loss: 1.2839, test_f1: 0.5632
 epoch: 42, train_loss: 0.4629, test_loss: 1.2714, test_f1: 0.5851
 epoch: 43, train_loss: 0.4625, test_loss: 1.4117, test_f1: 0.5551
 epoch: 44, train_loss: 0.4579, test_loss: 1.2762, test_f1: 0.5869
 epoch: 45, train_loss: 0.4409, test_loss: 1.2524, test_f1: 0.5833
 epoch: 46, train_loss: 0.4343, test_loss: 1.1806, test_f1: 0.5823
 epoch: 47, train_loss: 0.4261, test_loss: 1.2923, test_f1: 0.5929
 epoch: 48, train_loss: 0.4154, test_loss: 1.2084, test_f1: 0.6074
 epoch: 49, train_loss: 0.4039, test_loss: 1.2085, test_f1: 0.6406
 epoch: 50, train_loss: 0.4077, test_loss: 1.3089, test_f1: 0.6020
 epoch: 51, train_loss: 0.3878, test_loss: 1.3021, test_f1: 0.5806
 epoch: 52, train_loss: 0.3743, test_loss: 1.2844, test_f1: 0.5986
 epoch: 53, train_loss: 0.3351, test_loss: 1.3212, test_f1: 0.6070
 epoch: 54, train_loss: 0.3458, test_loss: 1.3969, test_f1: 0.6019
 epoch: 55, train_loss: 0.3471, test_loss: 1.3724, test_f1: 0.6178
 epoch: 56, train_loss: 0.3389, test_loss: 1.4522, test_f1: 0.5859
 epoch: 57, train_loss: 0.3344, test_loss: 1.4531, test_f1: 0.5928
 epoch: 58, train_loss: 0.3441, test_loss: 1.4368, test_f1: 0.5888
 epoch: 59, train_loss: 0.3364, test_loss: 1.4398, test_f1: 0.5895
 epoch: 60, train_loss: 0.3086, test_loss: 1.4050, test_f1: 0.6052
 epoch: 61, train_loss: 0.3133, test_loss: 1.4450, test_f1: 0.5900
 epoch: 62, train_loss: 0.3333, test_loss: 1.4706, test_f1: 0.6053
 epoch: 63, train_loss: 0.3222, test_loss: 1.4382, test_f1: 0.6028
 epoch: 64, train_loss: 0.3258, test_loss: 1.4522, test_f1: 0.6311
 epoch: 65, train_loss: 0.3015, test_loss: 1.4787, test_f1: 0.6024
 epoch: 66, train_loss: 0.2864, test_loss: 1.5405, test_f1: 0.6016
 epoch: 67, train_loss: 0.2961, test_loss: 1.4594, test_f1: 0.6411
 epoch: 68, train_loss: 0.2884, test_loss: 1.4886, test_f1: 0.6182
 epoch: 69, train_loss: 0.2892, test_loss: 1.5471, test_f1: 0.6198
 epoch: 70, train_loss: 0.2905, test_loss: 1.4833, test_f1: 0.6090
 epoch: 71, train_loss: 0.2734, test_loss: 1.5567, test_f1: 0.6020
 epoch: 72, train_loss: 0.2886, test_loss: 1.5524, test_f1: 0.5992
 epoch: 73, train_loss: 0.2656, test_loss: 1.5839, test_f1: 0.5922
 epoch: 74, train_loss: 0.2702, test_loss: 1.6297, test_f1: 0.5891
 epoch: 75, train_loss: 0.2630, test_loss: 1.6008, test_f1: 0.6047
 epoch: 76, train_loss: 0.2757, test_loss: 1.6296, test_f1: 0.5953
 epoch: 77, train_loss: 0.2589, test_loss: 1.6158, test_f1: 0.5876
 epoch: 78, train_loss: 0.2589, test_loss: 1.6877, test_f1: 0.5991
 epoch: 79, train_loss: 0.2384, test_loss: 1.6330, test_f1: 0.5933
 epoch: 80, train_loss: 0.2495, test_loss: 1.6868, test_f1: 0.5974
 epoch: 81, train_loss: 0.2513, test_loss: 1.5879, test_f1: 0.6302
 epoch: 82, train_loss: 0.2473, test_loss: 1.7505, test_f1: 0.5850
 epoch: 83, train_loss: 0.2436, test_loss: 1.7011, test_f1: 0.5841
 epoch: 84, train_loss: 0.2514, test_loss: 1.6749, test_f1: 0.6017
 epoch: 85, train_loss: 0.2441, test_loss: 1.6593, test_f1: 0.5812
 epoch: 86, train_loss: 0.2338, test_loss: 1.7619, test_f1: 0.5912
 epoch: 87, train_loss: 0.2356, test_loss: 1.7410, test_f1: 0.6210
 epoch: 88, train_loss: 0.2266, test_loss: 1.7321, test_f1: 0.5971
 epoch: 89, train_loss: 0.2162, test_loss: 1.6946, test_f1: 0.6072
 epoch: 90, train_loss: 0.2277, test_loss: 1.6820, test_f1: 0.6104
 epoch: 91, train_loss: 0.2265, test_loss: 1.7529, test_f1: 0.6054
 epoch: 92, train_loss: 0.2187, test_loss: 1.7412, test_f1: 0.6113
 epoch: 93, train_loss: 0.2329, test_loss: 1.8496, test_f1: 0.5827
 epoch: 94, train_loss: 0.2199, test_loss: 1.7696, test_f1: 0.6192
 epoch: 95, train_loss: 0.1934, test_loss: 1.7611, test_f1: 0.6038
 epoch: 96, train_loss: 0.2089, test_loss: 1.8354, test_f1: 0.6076
 epoch: 97, train_loss: 0.2190, test_loss: 1.8256, test_f1: 0.6135
 epoch: 98, train_loss: 0.2104, test_loss: 1.9371, test_f1: 0.5875
 epoch: 99, train_loss: 0.2337, test_loss: 1.8026, test_f1: 0.6205
##################ITERATION #5 ****************************************
 epoch: 0, train_loss: 1.2270, test_loss: 1.2948, test_f1: 0.3166
 epoch: 1, train_loss: 1.1220, test_loss: 1.2650, test_f1: 0.3850
 epoch: 2, train_loss: 1.0742, test_loss: 1.1882, test_f1: 0.4869
 epoch: 3, train_loss: 1.0266, test_loss: 1.1201, test_f1: 0.5187
 epoch: 4, train_loss: 1.0034, test_loss: 1.0876, test_f1: 0.5430
 epoch: 5, train_loss: 0.9616, test_loss: 1.0571, test_f1: 0.5662
 epoch: 6, train_loss: 0.9391, test_loss: 1.0521, test_f1: 0.5860
 epoch: 7, train_loss: 0.9202, test_loss: 1.0361, test_f1: 0.5525
 epoch: 8, train_loss: 0.8924, test_loss: 1.0107, test_f1: 0.5881
 epoch: 9, train_loss: 0.8735, test_loss: 1.0145, test_f1: 0.5690
 epoch: 10, train_loss: 0.8448, test_loss: 1.0036, test_f1: 0.5775
 epoch: 11, train_loss: 0.8115, test_loss: 1.0075, test_f1: 0.5833
 epoch: 12, train_loss: 0.7943, test_loss: 0.9847, test_f1: 0.6060
 epoch: 13, train_loss: 0.7888, test_loss: 0.9846, test_f1: 0.6012
 epoch: 14, train_loss: 0.7622, test_loss: 0.9989, test_f1: 0.5787
 epoch: 15, train_loss: 0.7615, test_loss: 1.0357, test_f1: 0.5181
 epoch: 16, train_loss: 0.7448, test_loss: 0.9982, test_f1: 0.5767
 epoch: 17, train_loss: 0.7147, test_loss: 1.0439, test_f1: 0.5583
 epoch: 18, train_loss: 0.7145, test_loss: 0.9577, test_f1: 0.6074
 epoch: 19, train_loss: 0.6809, test_loss: 1.0298, test_f1: 0.6099
 epoch: 20, train_loss: 0.6770, test_loss: 1.0713, test_f1: 0.5756
 epoch: 21, train_loss: 0.6659, test_loss: 1.0096, test_f1: 0.6244
 epoch: 22, train_loss: 0.6587, test_loss: 1.0203, test_f1: 0.5807
 epoch: 23, train_loss: 0.6352, test_loss: 1.0237, test_f1: 0.6017
 epoch: 24, train_loss: 0.6177, test_loss: 1.0334, test_f1: 0.5848
 epoch: 25, train_loss: 0.6172, test_loss: 1.1324, test_f1: 0.5966
 epoch: 26, train_loss: 0.5972, test_loss: 1.0402, test_f1: 0.6337
 epoch: 27, train_loss: 0.5890, test_loss: 1.0723, test_f1: 0.6384
 epoch: 28, train_loss: 0.5776, test_loss: 1.0595, test_f1: 0.6105
 epoch: 29, train_loss: 0.5577, test_loss: 1.0812, test_f1: 0.5954
 epoch: 30, train_loss: 0.5586, test_loss: 1.1150, test_f1: 0.5978
 epoch: 31, train_loss: 0.5531, test_loss: 1.1514, test_f1: 0.5867
 epoch: 32, train_loss: 0.5240, test_loss: 1.0891, test_f1: 0.6441
 epoch: 33, train_loss: 0.5093, test_loss: 1.0768, test_f1: 0.6031
 epoch: 34, train_loss: 0.5126, test_loss: 1.0955, test_f1: 0.6292
 epoch: 35, train_loss: 0.5105, test_loss: 1.1804, test_f1: 0.6476
 epoch: 36, train_loss: 0.4986, test_loss: 1.1675, test_f1: 0.6590
 epoch: 37, train_loss: 0.4851, test_loss: 1.2168, test_f1: 0.5978
 epoch: 38, train_loss: 0.4682, test_loss: 1.1950, test_f1: 0.6408
 epoch: 39, train_loss: 0.4730, test_loss: 1.2709, test_f1: 0.6301
 epoch: 40, train_loss: 0.4612, test_loss: 1.1947, test_f1: 0.6252
 epoch: 41, train_loss: 0.4393, test_loss: 1.2806, test_f1: 0.6110
 epoch: 42, train_loss: 0.4510, test_loss: 1.3042, test_f1: 0.6214
 epoch: 43, train_loss: 0.4500, test_loss: 1.3052, test_f1: 0.6205
 epoch: 44, train_loss: 0.4327, test_loss: 1.2756, test_f1: 0.6122
 epoch: 45, train_loss: 0.4105, test_loss: 1.3300, test_f1: 0.6499
 epoch: 46, train_loss: 0.4058, test_loss: 1.2948, test_f1: 0.6247
 epoch: 47, train_loss: 0.3949, test_loss: 1.2480, test_f1: 0.6628
 epoch: 48, train_loss: 0.4062, test_loss: 1.2907, test_f1: 0.6490
 epoch: 49, train_loss: 0.3760, test_loss: 1.4718, test_f1: 0.6256
 epoch: 50, train_loss: 0.3562, test_loss: 1.4351, test_f1: 0.6174
 epoch: 51, train_loss: 0.3504, test_loss: 1.3875, test_f1: 0.6235
 epoch: 52, train_loss: 0.3529, test_loss: 1.4229, test_f1: 0.6395
 epoch: 53, train_loss: 0.3332, test_loss: 1.5066, test_f1: 0.6286
 epoch: 54, train_loss: 0.3320, test_loss: 1.4389, test_f1: 0.6508
 epoch: 55, train_loss: 0.3239, test_loss: 1.4537, test_f1: 0.6257
 epoch: 56, train_loss: 0.3236, test_loss: 1.4924, test_f1: 0.6134
 epoch: 57, train_loss: 0.3259, test_loss: 1.4724, test_f1: 0.6201
 epoch: 58, train_loss: 0.3182, test_loss: 1.5536, test_f1: 0.6337
 epoch: 59, train_loss: 0.3020, test_loss: 1.4944, test_f1: 0.6343
 epoch: 60, train_loss: 0.3043, test_loss: 1.5074, test_f1: 0.6224
 epoch: 61, train_loss: 0.3072, test_loss: 1.5934, test_f1: 0.6040
 epoch: 62, train_loss: 0.3068, test_loss: 1.4873, test_f1: 0.6244
 epoch: 63, train_loss: 0.3066, test_loss: 1.5258, test_f1: 0.6050
 epoch: 64, train_loss: 0.2993, test_loss: 1.6365, test_f1: 0.6109
 epoch: 65, train_loss: 0.2932, test_loss: 1.5858, test_f1: 0.6101
 epoch: 66, train_loss: 0.2844, test_loss: 1.5401, test_f1: 0.6258
 epoch: 67, train_loss: 0.2697, test_loss: 1.6009, test_f1: 0.6123
 epoch: 68, train_loss: 0.2720, test_loss: 1.6717, test_f1: 0.6184
 epoch: 69, train_loss: 0.2703, test_loss: 1.5791, test_f1: 0.6338
 epoch: 70, train_loss: 0.2805, test_loss: 1.6630, test_f1: 0.6096
 epoch: 71, train_loss: 0.2794, test_loss: 1.7250, test_f1: 0.5872
 epoch: 72, train_loss: 0.2814, test_loss: 1.6630, test_f1: 0.6021
 epoch: 73, train_loss: 0.2710, test_loss: 1.7371, test_f1: 0.6164
 epoch: 74, train_loss: 0.2647, test_loss: 1.6641, test_f1: 0.6216
 epoch: 75, train_loss: 0.2722, test_loss: 1.6558, test_f1: 0.6322
 epoch: 76, train_loss: 0.2644, test_loss: 1.7257, test_f1: 0.6187
 epoch: 77, train_loss: 0.2538, test_loss: 1.7298, test_f1: 0.6118
 epoch: 78, train_loss: 0.2528, test_loss: 1.6452, test_f1: 0.6477
 epoch: 79, train_loss: 0.2401, test_loss: 1.6741, test_f1: 0.6455
 epoch: 80, train_loss: 0.2325, test_loss: 1.7236, test_f1: 0.6182
 epoch: 81, train_loss: 0.2246, test_loss: 1.9265, test_f1: 0.5998
 epoch: 82, train_loss: 0.2406, test_loss: 1.8435, test_f1: 0.6015
 epoch: 83, train_loss: 0.2390, test_loss: 1.8025, test_f1: 0.6094
 epoch: 84, train_loss: 0.2278, test_loss: 1.7453, test_f1: 0.6055
 epoch: 85, train_loss: 0.2263, test_loss: 1.8198, test_f1: 0.6123
 epoch: 86, train_loss: 0.2342, test_loss: 1.7695, test_f1: 0.5933
 epoch: 87, train_loss: 0.2344, test_loss: 1.8256, test_f1: 0.5983
 epoch: 88, train_loss: 0.2302, test_loss: 1.8269, test_f1: 0.6362
 epoch: 89, train_loss: 0.2304, test_loss: 1.7846, test_f1: 0.6131
 epoch: 90, train_loss: 0.2180, test_loss: 1.9677, test_f1: 0.5937
 epoch: 91, train_loss: 0.2119, test_loss: 1.8345, test_f1: 0.6166
 epoch: 92, train_loss: 0.2013, test_loss: 1.8961, test_f1: 0.6203
 epoch: 93, train_loss: 0.2148, test_loss: 1.8723, test_f1: 0.6204
 epoch: 94, train_loss: 0.2052, test_loss: 1.8886, test_f1: 0.6263
 epoch: 95, train_loss: 0.2032, test_loss: 1.9440, test_f1: 0.6004
 epoch: 96, train_loss: 0.1955, test_loss: 1.9346, test_f1: 0.6045
 epoch: 97, train_loss: 0.2004, test_loss: 2.0895, test_f1: 0.6199
 epoch: 98, train_loss: 0.2015, test_loss: 1.9773, test_f1: 0.6332
 epoch: 99, train_loss: 0.2129, test_loss: 2.0481, test_f1: 0.6225
##################ITERATION #6 ****************************************
 epoch: 0, train_loss: 1.2284, test_loss: 1.2874, test_f1: 0.2652
 epoch: 1, train_loss: 1.1187, test_loss: 1.2272, test_f1: 0.2898
 epoch: 2, train_loss: 1.0555, test_loss: 1.1460, test_f1: 0.4749
 epoch: 3, train_loss: 1.0244, test_loss: 1.1152, test_f1: 0.5178
 epoch: 4, train_loss: 0.9811, test_loss: 1.0820, test_f1: 0.5600
 epoch: 5, train_loss: 0.9478, test_loss: 1.0635, test_f1: 0.5555
 epoch: 6, train_loss: 0.9204, test_loss: 1.0679, test_f1: 0.5766
 epoch: 7, train_loss: 0.9006, test_loss: 1.0867, test_f1: 0.5412
 epoch: 8, train_loss: 0.8721, test_loss: 1.0183, test_f1: 0.5566
 epoch: 9, train_loss: 0.8690, test_loss: 1.0147, test_f1: 0.5728
 epoch: 10, train_loss: 0.8408, test_loss: 1.0166, test_f1: 0.6003
 epoch: 11, train_loss: 0.8201, test_loss: 1.0550, test_f1: 0.5741
 epoch: 12, train_loss: 0.8073, test_loss: 1.0012, test_f1: 0.5572
 epoch: 13, train_loss: 0.7849, test_loss: 1.0633, test_f1: 0.5563
 epoch: 14, train_loss: 0.7656, test_loss: 1.0496, test_f1: 0.5745
 epoch: 15, train_loss: 0.7575, test_loss: 1.1168, test_f1: 0.5692
 epoch: 16, train_loss: 0.7303, test_loss: 1.0504, test_f1: 0.5944
 epoch: 17, train_loss: 0.7291, test_loss: 1.0768, test_f1: 0.5740
 epoch: 18, train_loss: 0.7150, test_loss: 1.1163, test_f1: 0.5645
 epoch: 19, train_loss: 0.6924, test_loss: 1.0538, test_f1: 0.5727
 epoch: 20, train_loss: 0.6855, test_loss: 1.1084, test_f1: 0.5863
 epoch: 21, train_loss: 0.6572, test_loss: 1.0431, test_f1: 0.5970
 epoch: 22, train_loss: 0.6522, test_loss: 1.2034, test_f1: 0.5760
 epoch: 23, train_loss: 0.6417, test_loss: 1.1855, test_f1: 0.5794
 epoch: 24, train_loss: 0.6376, test_loss: 1.1310, test_f1: 0.5718
 epoch: 25, train_loss: 0.6116, test_loss: 1.1604, test_f1: 0.6019
 epoch: 26, train_loss: 0.6114, test_loss: 1.1466, test_f1: 0.6001
 epoch: 27, train_loss: 0.6051, test_loss: 1.1882, test_f1: 0.5986
 epoch: 28, train_loss: 0.5735, test_loss: 1.1330, test_f1: 0.5736
 epoch: 29, train_loss: 0.5785, test_loss: 1.1764, test_f1: 0.6267
 epoch: 30, train_loss: 0.5685, test_loss: 1.1661, test_f1: 0.6003
 epoch: 31, train_loss: 0.5565, test_loss: 1.1228, test_f1: 0.6255
 epoch: 32, train_loss: 0.5403, test_loss: 1.2621, test_f1: 0.6164
 epoch: 33, train_loss: 0.5243, test_loss: 1.3523, test_f1: 0.6390
 epoch: 34, train_loss: 0.5196, test_loss: 1.4367, test_f1: 0.6000
 epoch: 35, train_loss: 0.4978, test_loss: 1.2380, test_f1: 0.5974
 epoch: 36, train_loss: 0.4877, test_loss: 1.4720, test_f1: 0.6104
 epoch: 37, train_loss: 0.4951, test_loss: 1.3046, test_f1: 0.6010
 epoch: 38, train_loss: 0.4722, test_loss: 1.3479, test_f1: 0.6097
 epoch: 39, train_loss: 0.4755, test_loss: 1.3945, test_f1: 0.5921
 epoch: 40, train_loss: 0.4726, test_loss: 1.2718, test_f1: 0.5992
 epoch: 41, train_loss: 0.4432, test_loss: 1.3883, test_f1: 0.6055
 epoch: 42, train_loss: 0.4493, test_loss: 1.7675, test_f1: 0.5646
 epoch: 43, train_loss: 0.4408, test_loss: 1.4447, test_f1: 0.5872
 epoch: 44, train_loss: 0.4403, test_loss: 1.7294, test_f1: 0.5924
 epoch: 45, train_loss: 0.4407, test_loss: 1.3689, test_f1: 0.6091
 epoch: 46, train_loss: 0.4189, test_loss: 1.4153, test_f1: 0.5724
 epoch: 47, train_loss: 0.4137, test_loss: 1.3735, test_f1: 0.6028
 epoch: 48, train_loss: 0.4111, test_loss: 1.3896, test_f1: 0.5842
 epoch: 49, train_loss: 0.3914, test_loss: 1.4864, test_f1: 0.5731
 epoch: 50, train_loss: 0.3790, test_loss: 1.5182, test_f1: 0.5828
 epoch: 51, train_loss: 0.3501, test_loss: 1.5646, test_f1: 0.6008
 epoch: 52, train_loss: 0.3425, test_loss: 1.5920, test_f1: 0.5830
 epoch: 53, train_loss: 0.3519, test_loss: 1.4977, test_f1: 0.5914
 epoch: 54, train_loss: 0.3262, test_loss: 1.5185, test_f1: 0.5986
 epoch: 55, train_loss: 0.3380, test_loss: 1.5856, test_f1: 0.5997
 epoch: 56, train_loss: 0.3218, test_loss: 1.6290, test_f1: 0.5786
 epoch: 57, train_loss: 0.3384, test_loss: 1.5732, test_f1: 0.5774
 epoch: 58, train_loss: 0.3276, test_loss: 1.6628, test_f1: 0.5890
 epoch: 59, train_loss: 0.3320, test_loss: 1.5374, test_f1: 0.5757
 epoch: 60, train_loss: 0.3030, test_loss: 1.6331, test_f1: 0.6013
 epoch: 61, train_loss: 0.3091, test_loss: 1.6110, test_f1: 0.6041
 epoch: 62, train_loss: 0.3058, test_loss: 1.6686, test_f1: 0.6000
 epoch: 63, train_loss: 0.2933, test_loss: 1.8453, test_f1: 0.5949
 epoch: 64, train_loss: 0.3060, test_loss: 1.7075, test_f1: 0.5865
 epoch: 65, train_loss: 0.2942, test_loss: 1.8678, test_f1: 0.5838
 epoch: 66, train_loss: 0.2813, test_loss: 1.8157, test_f1: 0.5810
 epoch: 67, train_loss: 0.2906, test_loss: 1.7841, test_f1: 0.5981
 epoch: 68, train_loss: 0.2801, test_loss: 1.7521, test_f1: 0.5833
 epoch: 69, train_loss: 0.2926, test_loss: 1.8364, test_f1: 0.5989
 epoch: 70, train_loss: 0.2877, test_loss: 1.8749, test_f1: 0.5822
 epoch: 71, train_loss: 0.2718, test_loss: 1.8212, test_f1: 0.5628
 epoch: 72, train_loss: 0.2612, test_loss: 1.8385, test_f1: 0.5993
 epoch: 73, train_loss: 0.2701, test_loss: 1.9840, test_f1: 0.5776
 epoch: 74, train_loss: 0.2579, test_loss: 1.8124, test_f1: 0.5832
 epoch: 75, train_loss: 0.2706, test_loss: 2.0544, test_f1: 0.6020
 epoch: 76, train_loss: 0.2345, test_loss: 2.1433, test_f1: 0.6117
 epoch: 77, train_loss: 0.2715, test_loss: 1.9830, test_f1: 0.5725
 epoch: 78, train_loss: 0.2474, test_loss: 2.1683, test_f1: 0.6209
 epoch: 79, train_loss: 0.2533, test_loss: 1.9398, test_f1: 0.5900
 epoch: 80, train_loss: 0.2664, test_loss: 1.9517, test_f1: 0.5983
 epoch: 81, train_loss: 0.2426, test_loss: 2.0248, test_f1: 0.5890
 epoch: 82, train_loss: 0.2430, test_loss: 2.1402, test_f1: 0.6050
 epoch: 83, train_loss: 0.2402, test_loss: 2.0166, test_f1: 0.5982
 epoch: 84, train_loss: 0.2532, test_loss: 1.9386, test_f1: 0.5690
 epoch: 85, train_loss: 0.2316, test_loss: 2.0560, test_f1: 0.6019
 epoch: 86, train_loss: 0.2285, test_loss: 1.9874, test_f1: 0.5903
 epoch: 87, train_loss: 0.2371, test_loss: 2.1991, test_f1: 0.6044
 epoch: 88, train_loss: 0.2269, test_loss: 2.3320, test_f1: 0.5831
 epoch: 89, train_loss: 0.2157, test_loss: 2.1583, test_f1: 0.5861
 epoch: 90, train_loss: 0.2147, test_loss: 2.1401, test_f1: 0.5882
 epoch: 91, train_loss: 0.2233, test_loss: 2.2518, test_f1: 0.5668
 epoch: 92, train_loss: 0.2073, test_loss: 2.0732, test_f1: 0.6061
 epoch: 93, train_loss: 0.2251, test_loss: 2.2307, test_f1: 0.5745
 epoch: 94, train_loss: 0.2316, test_loss: 2.1280, test_f1: 0.5878
 epoch: 95, train_loss: 0.2192, test_loss: 2.1298, test_f1: 0.5836
 epoch: 96, train_loss: 0.2089, test_loss: 2.1550, test_f1: 0.6004
 epoch: 97, train_loss: 0.2250, test_loss: 2.1509, test_f1: 0.5920
 epoch: 98, train_loss: 0.2074, test_loss: 2.2487, test_f1: 0.6011
 epoch: 99, train_loss: 0.1860, test_loss: 2.0934, test_f1: 0.5984
##################ITERATION #7 ****************************************
 epoch: 0, train_loss: 1.2475, test_loss: 1.3385, test_f1: 0.2557
 epoch: 1, train_loss: 1.0895, test_loss: 1.2464, test_f1: 0.2756
 epoch: 2, train_loss: 1.0510, test_loss: 1.1354, test_f1: 0.4687
 epoch: 3, train_loss: 1.0107, test_loss: 1.0827, test_f1: 0.5020
 epoch: 4, train_loss: 0.9651, test_loss: 1.0531, test_f1: 0.5218
 epoch: 5, train_loss: 0.9396, test_loss: 1.0376, test_f1: 0.5515
 epoch: 6, train_loss: 0.9208, test_loss: 1.0272, test_f1: 0.5741
 epoch: 7, train_loss: 0.8916, test_loss: 1.0161, test_f1: 0.5449
 epoch: 8, train_loss: 0.8722, test_loss: 1.0115, test_f1: 0.5609
 epoch: 9, train_loss: 0.8385, test_loss: 1.0049, test_f1: 0.5951
 epoch: 10, train_loss: 0.8411, test_loss: 1.0112, test_f1: 0.6123
 epoch: 11, train_loss: 0.8104, test_loss: 0.9977, test_f1: 0.5933
 epoch: 12, train_loss: 0.8023, test_loss: 1.0170, test_f1: 0.5936
 epoch: 13, train_loss: 0.7950, test_loss: 1.0224, test_f1: 0.5465
 epoch: 14, train_loss: 0.7827, test_loss: 1.0398, test_f1: 0.5735
 epoch: 15, train_loss: 0.7519, test_loss: 1.0717, test_f1: 0.5645
 epoch: 16, train_loss: 0.7543, test_loss: 0.9974, test_f1: 0.5713
 epoch: 17, train_loss: 0.7383, test_loss: 1.0255, test_f1: 0.5866
 epoch: 18, train_loss: 0.7226, test_loss: 1.0339, test_f1: 0.5804
 epoch: 19, train_loss: 0.7036, test_loss: 1.0116, test_f1: 0.5799
 epoch: 20, train_loss: 0.7047, test_loss: 1.0081, test_f1: 0.5962
 epoch: 21, train_loss: 0.6777, test_loss: 1.0474, test_f1: 0.5562
 epoch: 22, train_loss: 0.6669, test_loss: 1.0338, test_f1: 0.5632
 epoch: 23, train_loss: 0.6316, test_loss: 1.0241, test_f1: 0.6091
 epoch: 24, train_loss: 0.6511, test_loss: 1.0445, test_f1: 0.5996
 epoch: 25, train_loss: 0.6455, test_loss: 1.0378, test_f1: 0.6044
 epoch: 26, train_loss: 0.6332, test_loss: 1.0655, test_f1: 0.5961
 epoch: 27, train_loss: 0.6178, test_loss: 1.1753, test_f1: 0.5394
 epoch: 28, train_loss: 0.5960, test_loss: 1.0479, test_f1: 0.5951
 epoch: 29, train_loss: 0.5878, test_loss: 1.1060, test_f1: 0.5637
 epoch: 30, train_loss: 0.6003, test_loss: 1.1582, test_f1: 0.5966
 epoch: 31, train_loss: 0.5912, test_loss: 1.0932, test_f1: 0.6040
 epoch: 32, train_loss: 0.5548, test_loss: 1.1499, test_f1: 0.5508
 epoch: 33, train_loss: 0.5489, test_loss: 1.1639, test_f1: 0.5856
 epoch: 34, train_loss: 0.5291, test_loss: 1.2113, test_f1: 0.5985
 epoch: 35, train_loss: 0.5162, test_loss: 1.2028, test_f1: 0.6005
 epoch: 36, train_loss: 0.5333, test_loss: 1.1896, test_f1: 0.5938
 epoch: 37, train_loss: 0.5153, test_loss: 1.2770, test_f1: 0.5718
 epoch: 38, train_loss: 0.5024, test_loss: 1.2816, test_f1: 0.5429
 epoch: 39, train_loss: 0.4844, test_loss: 1.2461, test_f1: 0.5765
 epoch: 40, train_loss: 0.4705, test_loss: 1.3591, test_f1: 0.5703
 epoch: 41, train_loss: 0.4806, test_loss: 1.3302, test_f1: 0.5601
 epoch: 42, train_loss: 0.4658, test_loss: 1.3603, test_f1: 0.5636
 epoch: 43, train_loss: 0.4723, test_loss: 1.4331, test_f1: 0.5715
 epoch: 44, train_loss: 0.4789, test_loss: 1.2991, test_f1: 0.5814
 epoch: 45, train_loss: 0.4442, test_loss: 1.2990, test_f1: 0.5679
 epoch: 46, train_loss: 0.4418, test_loss: 1.3349, test_f1: 0.5607
 epoch: 47, train_loss: 0.4105, test_loss: 1.4040, test_f1: 0.5729
 epoch: 48, train_loss: 0.4067, test_loss: 1.3196, test_f1: 0.5873
 epoch: 49, train_loss: 0.4194, test_loss: 1.3690, test_f1: 0.6058
 epoch: 50, train_loss: 0.4129, test_loss: 1.2770, test_f1: 0.5994
 epoch: 51, train_loss: 0.4095, test_loss: 1.3569, test_f1: 0.5992
 epoch: 52, train_loss: 0.3774, test_loss: 1.3647, test_f1: 0.6001
 epoch: 53, train_loss: 0.3667, test_loss: 1.4131, test_f1: 0.5781
 epoch: 54, train_loss: 0.3653, test_loss: 1.4569, test_f1: 0.5971
 epoch: 55, train_loss: 0.3684, test_loss: 1.3972, test_f1: 0.6245
 epoch: 56, train_loss: 0.3600, test_loss: 1.4982, test_f1: 0.6031
 epoch: 57, train_loss: 0.3478, test_loss: 1.4668, test_f1: 0.5846
 epoch: 58, train_loss: 0.3358, test_loss: 1.4744, test_f1: 0.5412
 epoch: 59, train_loss: 0.3279, test_loss: 1.4946, test_f1: 0.5635
 epoch: 60, train_loss: 0.3306, test_loss: 1.5008, test_f1: 0.5833
 epoch: 61, train_loss: 0.3431, test_loss: 1.5004, test_f1: 0.5936
 epoch: 62, train_loss: 0.3349, test_loss: 1.4613, test_f1: 0.5935
 epoch: 63, train_loss: 0.3162, test_loss: 1.5303, test_f1: 0.5805
 epoch: 64, train_loss: 0.3276, test_loss: 1.4965, test_f1: 0.5634
 epoch: 65, train_loss: 0.3343, test_loss: 1.5183, test_f1: 0.5743
 epoch: 66, train_loss: 0.3029, test_loss: 1.5015, test_f1: 0.5880
 epoch: 67, train_loss: 0.3010, test_loss: 1.5999, test_f1: 0.5760
 epoch: 68, train_loss: 0.3097, test_loss: 1.5888, test_f1: 0.5745
 epoch: 69, train_loss: 0.3002, test_loss: 1.5847, test_f1: 0.5924
 epoch: 70, train_loss: 0.2802, test_loss: 1.5543, test_f1: 0.6023
 epoch: 71, train_loss: 0.2754, test_loss: 1.6382, test_f1: 0.5835
 epoch: 72, train_loss: 0.2933, test_loss: 1.6747, test_f1: 0.5889
 epoch: 73, train_loss: 0.2979, test_loss: 1.6344, test_f1: 0.5895
 epoch: 74, train_loss: 0.2856, test_loss: 1.6900, test_f1: 0.5644
 epoch: 75, train_loss: 0.2941, test_loss: 1.6988, test_f1: 0.5895
 epoch: 76, train_loss: 0.2960, test_loss: 1.6923, test_f1: 0.5794
 epoch: 77, train_loss: 0.2962, test_loss: 1.7266, test_f1: 0.5838
 epoch: 78, train_loss: 0.2708, test_loss: 1.7900, test_f1: 0.5764
 epoch: 79, train_loss: 0.2696, test_loss: 1.7296, test_f1: 0.5891
 epoch: 80, train_loss: 0.2606, test_loss: 1.7818, test_f1: 0.6009
 epoch: 81, train_loss: 0.2570, test_loss: 1.7593, test_f1: 0.6059
 epoch: 82, train_loss: 0.2624, test_loss: 1.7320, test_f1: 0.5839
 epoch: 83, train_loss: 0.2694, test_loss: 1.9165, test_f1: 0.5544
 epoch: 84, train_loss: 0.2662, test_loss: 1.8535, test_f1: 0.5702
 epoch: 85, train_loss: 0.2621, test_loss: 1.8251, test_f1: 0.5756
 epoch: 86, train_loss: 0.2410, test_loss: 1.8823, test_f1: 0.5572
 epoch: 87, train_loss: 0.2450, test_loss: 1.9629, test_f1: 0.5522
 epoch: 88, train_loss: 0.2452, test_loss: 1.9715, test_f1: 0.5575
 epoch: 89, train_loss: 0.2564, test_loss: 1.9060, test_f1: 0.5608
 epoch: 90, train_loss: 0.2458, test_loss: 1.8396, test_f1: 0.5843
 epoch: 91, train_loss: 0.2322, test_loss: 1.8392, test_f1: 0.5562
 epoch: 92, train_loss: 0.2382, test_loss: 1.8559, test_f1: 0.5818
 epoch: 93, train_loss: 0.2465, test_loss: 1.8540, test_f1: 0.5699
 epoch: 94, train_loss: 0.2190, test_loss: 1.9241, test_f1: 0.5846
 epoch: 95, train_loss: 0.2203, test_loss: 1.9692, test_f1: 0.5414
 epoch: 96, train_loss: 0.2156, test_loss: 1.7648, test_f1: 0.6013
 epoch: 97, train_loss: 0.2394, test_loss: 2.0107, test_f1: 0.5452
 epoch: 98, train_loss: 0.2124, test_loss: 1.9222, test_f1: 0.5885
 epoch: 99, train_loss: 0.2060, test_loss: 1.9243, test_f1: 0.5592
##################ITERATION #8 ****************************************
 epoch: 0, train_loss: 1.2421, test_loss: 1.2987, test_f1: 0.2281
 epoch: 1, train_loss: 1.1160, test_loss: 1.3039, test_f1: 0.2954
 epoch: 2, train_loss: 1.0684, test_loss: 1.1922, test_f1: 0.4191
 epoch: 3, train_loss: 1.0246, test_loss: 1.1479, test_f1: 0.4762
 epoch: 4, train_loss: 1.0116, test_loss: 1.0862, test_f1: 0.5379
 epoch: 5, train_loss: 0.9732, test_loss: 1.0682, test_f1: 0.5413
 epoch: 6, train_loss: 0.9425, test_loss: 1.0272, test_f1: 0.5610
 epoch: 7, train_loss: 0.9212, test_loss: 1.0307, test_f1: 0.5710
 epoch: 8, train_loss: 0.8959, test_loss: 1.0192, test_f1: 0.5760
 epoch: 9, train_loss: 0.8574, test_loss: 1.0070, test_f1: 0.5765
 epoch: 10, train_loss: 0.8559, test_loss: 1.0194, test_f1: 0.5772
 epoch: 11, train_loss: 0.8315, test_loss: 1.0185, test_f1: 0.5685
 epoch: 12, train_loss: 0.8256, test_loss: 1.0463, test_f1: 0.5688
 epoch: 13, train_loss: 0.8074, test_loss: 1.0217, test_f1: 0.5980
 epoch: 14, train_loss: 0.8019, test_loss: 1.0510, test_f1: 0.5902
 epoch: 15, train_loss: 0.7854, test_loss: 1.0142, test_f1: 0.6033
 epoch: 16, train_loss: 0.7664, test_loss: 1.0041, test_f1: 0.6011
 epoch: 17, train_loss: 0.7534, test_loss: 1.0520, test_f1: 0.5658
 epoch: 18, train_loss: 0.7423, test_loss: 1.0814, test_f1: 0.5621
 epoch: 19, train_loss: 0.7351, test_loss: 1.0448, test_f1: 0.5642
 epoch: 20, train_loss: 0.7029, test_loss: 1.0682, test_f1: 0.5728
 epoch: 21, train_loss: 0.7016, test_loss: 1.0669, test_f1: 0.5723
 epoch: 22, train_loss: 0.7090, test_loss: 1.0665, test_f1: 0.5859
 epoch: 23, train_loss: 0.6799, test_loss: 1.0891, test_f1: 0.5694
 epoch: 24, train_loss: 0.6671, test_loss: 1.1053, test_f1: 0.5642
 epoch: 25, train_loss: 0.6370, test_loss: 1.1200, test_f1: 0.5722
 epoch: 26, train_loss: 0.6553, test_loss: 1.1142, test_f1: 0.5436
 epoch: 27, train_loss: 0.6284, test_loss: 1.1604, test_f1: 0.5571
 epoch: 28, train_loss: 0.6039, test_loss: 1.2093, test_f1: 0.5235
 epoch: 29, train_loss: 0.6137, test_loss: 1.1962, test_f1: 0.5393
 epoch: 30, train_loss: 0.6236, test_loss: 1.0796, test_f1: 0.5978
 epoch: 31, train_loss: 0.6022, test_loss: 1.1524, test_f1: 0.5635
 epoch: 32, train_loss: 0.5708, test_loss: 1.3418, test_f1: 0.5736
 epoch: 33, train_loss: 0.5717, test_loss: 1.3718, test_f1: 0.5734
 epoch: 34, train_loss: 0.5645, test_loss: 1.4209, test_f1: 0.5721
 epoch: 35, train_loss: 0.5458, test_loss: 1.3422, test_f1: 0.5649
 epoch: 36, train_loss: 0.5704, test_loss: 1.3878, test_f1: 0.5433
 epoch: 37, train_loss: 0.5412, test_loss: 1.3124, test_f1: 0.5326
 epoch: 38, train_loss: 0.5367, test_loss: 1.2838, test_f1: 0.5919
 epoch: 39, train_loss: 0.5225, test_loss: 1.4644, test_f1: 0.5627
 epoch: 40, train_loss: 0.5223, test_loss: 1.2617, test_f1: 0.6068
 epoch: 41, train_loss: 0.5101, test_loss: 1.2825, test_f1: 0.5693
 epoch: 42, train_loss: 0.4795, test_loss: 1.1725, test_f1: 0.5889
 epoch: 43, train_loss: 0.4862, test_loss: 1.2153, test_f1: 0.5910
 epoch: 44, train_loss: 0.4753, test_loss: 1.3390, test_f1: 0.5390
 epoch: 45, train_loss: 0.4895, test_loss: 1.2719, test_f1: 0.5371
 epoch: 46, train_loss: 0.4627, test_loss: 1.3211, test_f1: 0.5397
 epoch: 47, train_loss: 0.4638, test_loss: 1.2754, test_f1: 0.5488
 epoch: 48, train_loss: 0.4699, test_loss: 1.4553, test_f1: 0.5377
 epoch: 49, train_loss: 0.4356, test_loss: 1.3531, test_f1: 0.5514
 epoch: 50, train_loss: 0.4380, test_loss: 1.4910, test_f1: 0.5710
 epoch: 51, train_loss: 0.4082, test_loss: 1.4454, test_f1: 0.5898
 epoch: 52, train_loss: 0.4010, test_loss: 1.5962, test_f1: 0.5727
 epoch: 53, train_loss: 0.3868, test_loss: 1.7424, test_f1: 0.5337
 epoch: 54, train_loss: 0.3992, test_loss: 1.6973, test_f1: 0.5416
 epoch: 55, train_loss: 0.4007, test_loss: 1.8625, test_f1: 0.5257
 epoch: 56, train_loss: 0.3766, test_loss: 1.6558, test_f1: 0.5057
 epoch: 57, train_loss: 0.3742, test_loss: 1.6241, test_f1: 0.5569
 epoch: 58, train_loss: 0.3678, test_loss: 1.5430, test_f1: 0.5582
 epoch: 59, train_loss: 0.3785, test_loss: 1.5818, test_f1: 0.5414
 epoch: 60, train_loss: 0.3778, test_loss: 1.6713, test_f1: 0.5668
 epoch: 61, train_loss: 0.3685, test_loss: 1.6014, test_f1: 0.5306
 epoch: 62, train_loss: 0.3481, test_loss: 1.7182, test_f1: 0.5123
 epoch: 63, train_loss: 0.3496, test_loss: 1.6487, test_f1: 0.5378
 epoch: 64, train_loss: 0.3693, test_loss: 1.5882, test_f1: 0.5533
 epoch: 65, train_loss: 0.3569, test_loss: 1.6378, test_f1: 0.5516
 epoch: 66, train_loss: 0.3342, test_loss: 1.7338, test_f1: 0.5449
 epoch: 67, train_loss: 0.3366, test_loss: 1.6474, test_f1: 0.5442
 epoch: 68, train_loss: 0.3373, test_loss: 1.8767, test_f1: 0.5548
 epoch: 69, train_loss: 0.3219, test_loss: 1.8388, test_f1: 0.5319
 epoch: 70, train_loss: 0.3266, test_loss: 2.0714, test_f1: 0.5199
 epoch: 71, train_loss: 0.3372, test_loss: 1.7517, test_f1: 0.5188
 epoch: 72, train_loss: 0.3163, test_loss: 1.7600, test_f1: 0.5272
 epoch: 73, train_loss: 0.3284, test_loss: 1.7401, test_f1: 0.5421
 epoch: 74, train_loss: 0.3162, test_loss: 1.8261, test_f1: 0.5565
 epoch: 75, train_loss: 0.3162, test_loss: 1.8350, test_f1: 0.5420
 epoch: 76, train_loss: 0.3118, test_loss: 1.8318, test_f1: 0.5173
 epoch: 77, train_loss: 0.3075, test_loss: 1.8632, test_f1: 0.5477
 epoch: 78, train_loss: 0.3012, test_loss: 1.8205, test_f1: 0.5377
 epoch: 79, train_loss: 0.2968, test_loss: 1.9032, test_f1: 0.5297
 epoch: 80, train_loss: 0.2918, test_loss: 1.8649, test_f1: 0.5309
 epoch: 81, train_loss: 0.2750, test_loss: 1.7996, test_f1: 0.5534
 epoch: 82, train_loss: 0.3049, test_loss: 1.8504, test_f1: 0.5472
 epoch: 83, train_loss: 0.2810, test_loss: 2.0786, test_f1: 0.5560
 epoch: 84, train_loss: 0.2774, test_loss: 1.9694, test_f1: 0.5450
 epoch: 85, train_loss: 0.2732, test_loss: 2.0841, test_f1: 0.5558
 epoch: 86, train_loss: 0.2643, test_loss: 2.1110, test_f1: 0.5622
 epoch: 87, train_loss: 0.2781, test_loss: 2.2451, test_f1: 0.5551
 epoch: 88, train_loss: 0.2898, test_loss: 2.1057, test_f1: 0.5336
 epoch: 89, train_loss: 0.2874, test_loss: 1.9447, test_f1: 0.5382
 epoch: 90, train_loss: 0.2669, test_loss: 1.9616, test_f1: 0.5343
 epoch: 91, train_loss: 0.2574, test_loss: 1.9863, test_f1: 0.5561
 epoch: 92, train_loss: 0.2627, test_loss: 2.1394, test_f1: 0.5334
 epoch: 93, train_loss: 0.2789, test_loss: 2.2148, test_f1: 0.5404
 epoch: 94, train_loss: 0.2649, test_loss: 2.0645, test_f1: 0.5574
 epoch: 95, train_loss: 0.2617, test_loss: 2.0455, test_f1: 0.5263
 epoch: 96, train_loss: 0.2564, test_loss: 1.9656, test_f1: 0.5830
 epoch: 97, train_loss: 0.2477, test_loss: 2.0612, test_f1: 0.5377
 epoch: 98, train_loss: 0.2377, test_loss: 2.0552, test_f1: 0.5289
 epoch: 99, train_loss: 0.2408, test_loss: 2.0245, test_f1: 0.5234
##################ITERATION #9 ****************************************
 epoch: 0, train_loss: 1.2833, test_loss: 1.3129, test_f1: 0.2281
 epoch: 1, train_loss: 1.1059, test_loss: 1.3283, test_f1: 0.2915
 epoch: 2, train_loss: 1.0697, test_loss: 1.2482, test_f1: 0.5225
 epoch: 3, train_loss: 1.0295, test_loss: 1.1704, test_f1: 0.5506
 epoch: 4, train_loss: 0.9872, test_loss: 1.1012, test_f1: 0.4971
 epoch: 5, train_loss: 0.9575, test_loss: 1.0970, test_f1: 0.5483
 epoch: 6, train_loss: 0.9479, test_loss: 1.1485, test_f1: 0.5067
 epoch: 7, train_loss: 0.9194, test_loss: 1.1093, test_f1: 0.4914
 epoch: 8, train_loss: 0.9048, test_loss: 1.0526, test_f1: 0.5588
 epoch: 9, train_loss: 0.8553, test_loss: 1.0733, test_f1: 0.5798
 epoch: 10, train_loss: 0.8510, test_loss: 1.0933, test_f1: 0.5712
 epoch: 11, train_loss: 0.8325, test_loss: 1.1266, test_f1: 0.5709
 epoch: 12, train_loss: 0.8164, test_loss: 1.0641, test_f1: 0.5472
 epoch: 13, train_loss: 0.8137, test_loss: 1.0719, test_f1: 0.5679
 epoch: 14, train_loss: 0.7875, test_loss: 1.0920, test_f1: 0.5741
 epoch: 15, train_loss: 0.7853, test_loss: 1.0627, test_f1: 0.5582
 epoch: 16, train_loss: 0.7524, test_loss: 1.1085, test_f1: 0.5784
 epoch: 17, train_loss: 0.7487, test_loss: 1.0867, test_f1: 0.6104
 epoch: 18, train_loss: 0.7254, test_loss: 1.1102, test_f1: 0.6249
 epoch: 19, train_loss: 0.7231, test_loss: 1.0704, test_f1: 0.5986
 epoch: 20, train_loss: 0.7046, test_loss: 1.1024, test_f1: 0.5971
 epoch: 21, train_loss: 0.7036, test_loss: 1.1013, test_f1: 0.6027
 epoch: 22, train_loss: 0.7059, test_loss: 1.1439, test_f1: 0.5862
 epoch: 23, train_loss: 0.6797, test_loss: 1.1699, test_f1: 0.5857
 epoch: 24, train_loss: 0.6526, test_loss: 1.1362, test_f1: 0.5799
 epoch: 25, train_loss: 0.6638, test_loss: 1.1642, test_f1: 0.5796
 epoch: 26, train_loss: 0.6242, test_loss: 1.1924, test_f1: 0.5854
 epoch: 27, train_loss: 0.6428, test_loss: 1.1544, test_f1: 0.5978
 epoch: 28, train_loss: 0.6279, test_loss: 1.2187, test_f1: 0.5812
 epoch: 29, train_loss: 0.6081, test_loss: 1.1836, test_f1: 0.5774
 epoch: 30, train_loss: 0.6011, test_loss: 1.1945, test_f1: 0.6196
 epoch: 31, train_loss: 0.5701, test_loss: 1.2458, test_f1: 0.6008
 epoch: 32, train_loss: 0.5814, test_loss: 1.2015, test_f1: 0.6224
 epoch: 33, train_loss: 0.5777, test_loss: 1.1707, test_f1: 0.6059
 epoch: 34, train_loss: 0.5591, test_loss: 1.3554, test_f1: 0.5810
 epoch: 35, train_loss: 0.5589, test_loss: 1.4248, test_f1: 0.5940
 epoch: 36, train_loss: 0.5409, test_loss: 1.1888, test_f1: 0.6048
 epoch: 37, train_loss: 0.5628, test_loss: 1.2059, test_f1: 0.6123
 epoch: 38, train_loss: 0.5446, test_loss: 1.3115, test_f1: 0.6104
 epoch: 39, train_loss: 0.5266, test_loss: 1.2725, test_f1: 0.6134
 epoch: 40, train_loss: 0.5072, test_loss: 1.2682, test_f1: 0.6236
 epoch: 41, train_loss: 0.5001, test_loss: 1.2693, test_f1: 0.5907
 epoch: 42, train_loss: 0.4814, test_loss: 1.2597, test_f1: 0.6178
 epoch: 43, train_loss: 0.4884, test_loss: 1.2001, test_f1: 0.6415
 epoch: 44, train_loss: 0.4694, test_loss: 1.3405, test_f1: 0.6025
 epoch: 45, train_loss: 0.4856, test_loss: 1.4334, test_f1: 0.6055
 epoch: 46, train_loss: 0.4673, test_loss: 1.3036, test_f1: 0.6240
 epoch: 47, train_loss: 0.4350, test_loss: 1.3559, test_f1: 0.6064
 epoch: 48, train_loss: 0.4498, test_loss: 1.3858, test_f1: 0.6127
 epoch: 49, train_loss: 0.4316, test_loss: 1.3820, test_f1: 0.6116
 epoch: 50, train_loss: 0.4483, test_loss: 1.4720, test_f1: 0.6089
 epoch: 51, train_loss: 0.4125, test_loss: 1.5038, test_f1: 0.6307
 epoch: 52, train_loss: 0.3896, test_loss: 1.5613, test_f1: 0.5872
 epoch: 53, train_loss: 0.3833, test_loss: 1.6001, test_f1: 0.6075
 epoch: 54, train_loss: 0.3801, test_loss: 1.6499, test_f1: 0.6004
 epoch: 55, train_loss: 0.3785, test_loss: 1.6040, test_f1: 0.6266
 epoch: 56, train_loss: 0.3795, test_loss: 1.6513, test_f1: 0.5986
 epoch: 57, train_loss: 0.3726, test_loss: 1.5062, test_f1: 0.6170
 epoch: 58, train_loss: 0.3755, test_loss: 1.6250, test_f1: 0.6122
 epoch: 59, train_loss: 0.3729, test_loss: 1.6449, test_f1: 0.6156
 epoch: 60, train_loss: 0.3758, test_loss: 1.6739, test_f1: 0.6116
 epoch: 61, train_loss: 0.3721, test_loss: 1.5206, test_f1: 0.6397
 epoch: 62, train_loss: 0.3569, test_loss: 1.6482, test_f1: 0.6125
 epoch: 63, train_loss: 0.3490, test_loss: 1.6916, test_f1: 0.6061
 epoch: 64, train_loss: 0.3489, test_loss: 1.6192, test_f1: 0.6053
 epoch: 65, train_loss: 0.3224, test_loss: 1.6575, test_f1: 0.6136
 epoch: 66, train_loss: 0.3446, test_loss: 1.6135, test_f1: 0.6158
 epoch: 67, train_loss: 0.3256, test_loss: 1.6709, test_f1: 0.6138
 epoch: 68, train_loss: 0.3475, test_loss: 1.8932, test_f1: 0.6078
 epoch: 69, train_loss: 0.3318, test_loss: 1.7542, test_f1: 0.6088
 epoch: 70, train_loss: 0.3375, test_loss: 1.6872, test_f1: 0.6148
 epoch: 71, train_loss: 0.3259, test_loss: 1.7522, test_f1: 0.6081
 epoch: 72, train_loss: 0.3244, test_loss: 1.8443, test_f1: 0.6186
 epoch: 73, train_loss: 0.3153, test_loss: 1.8507, test_f1: 0.6197
 epoch: 74, train_loss: 0.3280, test_loss: 1.7639, test_f1: 0.6486
 epoch: 75, train_loss: 0.2997, test_loss: 1.8179, test_f1: 0.5979
 epoch: 76, train_loss: 0.2991, test_loss: 1.8805, test_f1: 0.6123
 epoch: 77, train_loss: 0.2978, test_loss: 1.7964, test_f1: 0.6419
 epoch: 78, train_loss: 0.3048, test_loss: 1.7043, test_f1: 0.6264
 epoch: 79, train_loss: 0.3071, test_loss: 1.7604, test_f1: 0.6212
 epoch: 80, train_loss: 0.2993, test_loss: 1.8828, test_f1: 0.6040
 epoch: 81, train_loss: 0.2960, test_loss: 1.8184, test_f1: 0.6124
 epoch: 82, train_loss: 0.2692, test_loss: 1.8659, test_f1: 0.6268
 epoch: 83, train_loss: 0.2762, test_loss: 1.9372, test_f1: 0.6100
 epoch: 84, train_loss: 0.2880, test_loss: 1.9370, test_f1: 0.6162
 epoch: 85, train_loss: 0.2743, test_loss: 1.8410, test_f1: 0.6017
 epoch: 86, train_loss: 0.3001, test_loss: 1.8924, test_f1: 0.6155
 epoch: 87, train_loss: 0.2797, test_loss: 1.8733, test_f1: 0.6126
 epoch: 88, train_loss: 0.2733, test_loss: 1.8616, test_f1: 0.5989
 epoch: 89, train_loss: 0.2662, test_loss: 1.8764, test_f1: 0.6091
 epoch: 90, train_loss: 0.2534, test_loss: 1.8392, test_f1: 0.6188
 epoch: 91, train_loss: 0.2766, test_loss: 2.0695, test_f1: 0.5907
 epoch: 92, train_loss: 0.2557, test_loss: 1.9737, test_f1: 0.5924
 epoch: 93, train_loss: 0.2622, test_loss: 1.9038, test_f1: 0.5971
 epoch: 94, train_loss: 0.2582, test_loss: 1.9157, test_f1: 0.6011
 epoch: 95, train_loss: 0.2775, test_loss: 1.8931, test_f1: 0.5921
 epoch: 96, train_loss: 0.2592, test_loss: 1.8713, test_f1: 0.6069
 epoch: 97, train_loss: 0.2585, test_loss: 1.9344, test_f1: 0.6023
 epoch: 98, train_loss: 0.2587, test_loss: 1.8774, test_f1: 0.6193
 epoch: 99, train_loss: 0.2389, test_loss: 1.9214, test_f1: 0.6122

Training completed in 559.44 seconds
Best F1: 0.6785 at epoch 94
Mean F1 across iterations: 0.6443  0.0201
========================FINAL RESULTS================================
FEGIN weighted F1: 0.6785  0.0201
python main.py --data ltspice_demos --representation component_pin --model FEGIN --layers 6 --hiddens 128 --batch_size 64 --lr 0.0001 --emb_size 512 --epochs 100 --save_appendix component_pin_L6_H128_BS64_LR0.0001_E512 --no_val
-----



STDERR:
  File "main.py", line 370, in <module>
    main()
  File "main.py", line 254, in main
    dataset = dataset_class(
  File "/home/philip/projects/ltspice_examples_code_repo/Circuit-Completion-Using-GNNs/component_classification_with_link_prediction_head/evaluation/FEGIN/kernel/circuit_datasets.py", line 15, in __init__
    self.data, self.slices = torch.load(self.processed_paths[0])
  File "/home/philip/.local/lib/python3.8/site-packages/torch/serialization.py", line 1040, in load
    warnings.warn(
  File "/usr/lib/python3.8/warnings.py", line 109, in _showwarnmsg
    sw(msg.message, msg.category, msg.filename, msg.lineno,
  File "main.py", line 47, in warn_with_traceback
    traceback.print_stack(file=log)
/home/philip/projects/ltspice_examples_code_repo/Circuit-Completion-Using-GNNs/component_classification_with_link_prediction_head/evaluation/FEGIN/kernel/circuit_datasets.py:15: FutureWarning: You are using `torch.load` with `weights_only=False` (the current default value), which uses the default pickle module implicitly. It is possible to construct malicious pickle data which will execute arbitrary code during unpickling (See https://github.com/pytorch/pytorch/blob/main/SECURITY.md#untrusted-models for more details). In a future release, the default value for `weights_only` will be flipped to `True`. This limits the functions that could be executed during unpickling. Arbitrary objects will no longer be allowed to be loaded via this mode unless they are explicitly allowlisted by the user via `torch.serialization.add_safe_globals`. We recommend you start setting `weights_only=True` for any use case where you don't have full control of the loaded file. Please open an issue on GitHub for any issues related to this experimental feature.
  self.data, self.slices = torch.load(self.processed_paths[0])
