STDOUT:
Results will be saved in /home/philip/projects/ltspice_examples_code_repo/Circuit-Completion-Using-GNNs/component_classification_with_link_prediction_head/evaluation/FEGIN/results/model_FEGIN_dataset_ltspice_demos
Command line input: python main.py --data ltspice_demos --representation component_pin --model FEGIN --layers 6 --hiddens 128 --batch_size 64 --lr 0.0001 --emb_size 512 --epochs 100 --save_appendix component_pin_L6_H128_BS64_LR0.0001_E512 --no_val
 is saved.
-----
ltspice_demos - FEGIN
Using 6 layers, 128 hidden units, h = 2
Loading component_pin representation dataset
ENTERED
Training FEGIN on component_pin representation
Train: 1565, Test: 383
##################ITERATION #0 ****************************************
 epoch: 0, train_loss: 1.3718, test_loss: 1.3675, test_f1: 0.2281
 epoch: 1, train_loss: 1.3487, test_loss: 1.3527, test_f1: 0.2281
 epoch: 2, train_loss: 1.3235, test_loss: 1.3317, test_f1: 0.2281
 epoch: 3, train_loss: 1.2862, test_loss: 1.2973, test_f1: 0.2583
 epoch: 4, train_loss: 1.2396, test_loss: 1.2622, test_f1: 0.2747
 epoch: 5, train_loss: 1.1907, test_loss: 1.2308, test_f1: 0.3214
 epoch: 6, train_loss: 1.1548, test_loss: 1.2012, test_f1: 0.3344
 epoch: 7, train_loss: 1.1226, test_loss: 1.1721, test_f1: 0.4101
 epoch: 8, train_loss: 1.0963, test_loss: 1.1463, test_f1: 0.4400
 epoch: 9, train_loss: 1.0627, test_loss: 1.1150, test_f1: 0.4760
 epoch: 10, train_loss: 1.0305, test_loss: 1.0851, test_f1: 0.4782
 epoch: 11, train_loss: 0.9917, test_loss: 1.0662, test_f1: 0.4613
 epoch: 12, train_loss: 0.9532, test_loss: 1.0523, test_f1: 0.4681
 epoch: 13, train_loss: 0.9254, test_loss: 1.0233, test_f1: 0.5135
 epoch: 14, train_loss: 0.9063, test_loss: 1.0178, test_f1: 0.5453
 epoch: 15, train_loss: 0.8743, test_loss: 1.0021, test_f1: 0.5577
 epoch: 16, train_loss: 0.8592, test_loss: 0.9980, test_f1: 0.5532
 epoch: 17, train_loss: 0.8343, test_loss: 0.9918, test_f1: 0.5626
 epoch: 18, train_loss: 0.8182, test_loss: 0.9820, test_f1: 0.5664
 epoch: 19, train_loss: 0.8065, test_loss: 1.0014, test_f1: 0.5723
 epoch: 20, train_loss: 0.7931, test_loss: 1.0174, test_f1: 0.5819
 epoch: 21, train_loss: 0.7641, test_loss: 0.9925, test_f1: 0.6021
 epoch: 22, train_loss: 0.7584, test_loss: 1.0103, test_f1: 0.5945
 epoch: 23, train_loss: 0.7363, test_loss: 1.0027, test_f1: 0.5902
 epoch: 24, train_loss: 0.7363, test_loss: 1.0480, test_f1: 0.5752
 epoch: 25, train_loss: 0.7189, test_loss: 1.0315, test_f1: 0.5794
 epoch: 26, train_loss: 0.7048, test_loss: 1.0250, test_f1: 0.5945
 epoch: 27, train_loss: 0.6741, test_loss: 1.0544, test_f1: 0.5569
 epoch: 28, train_loss: 0.6675, test_loss: 1.0788, test_f1: 0.5795
 epoch: 29, train_loss: 0.6654, test_loss: 1.0563, test_f1: 0.5722
 epoch: 30, train_loss: 0.6630, test_loss: 1.0700, test_f1: 0.5896
 epoch: 31, train_loss: 0.6493, test_loss: 1.0574, test_f1: 0.5904
 epoch: 32, train_loss: 0.6506, test_loss: 1.0975, test_f1: 0.5692
 epoch: 33, train_loss: 0.6319, test_loss: 1.1191, test_f1: 0.5867
 epoch: 34, train_loss: 0.6188, test_loss: 1.1360, test_f1: 0.5747
 epoch: 35, train_loss: 0.6168, test_loss: 1.2008, test_f1: 0.5544
 epoch: 36, train_loss: 0.6129, test_loss: 1.1802, test_f1: 0.5594
 epoch: 37, train_loss: 0.6217, test_loss: 1.1815, test_f1: 0.5684
 epoch: 38, train_loss: 0.6110, test_loss: 1.1409, test_f1: 0.5965
 epoch: 39, train_loss: 0.5829, test_loss: 1.0921, test_f1: 0.6370
 epoch: 40, train_loss: 0.5725, test_loss: 1.1686, test_f1: 0.6030
 epoch: 41, train_loss: 0.5698, test_loss: 1.2010, test_f1: 0.5918
 epoch: 42, train_loss: 0.5620, test_loss: 1.1719, test_f1: 0.6037
 epoch: 43, train_loss: 0.5476, test_loss: 1.2018, test_f1: 0.6167
 epoch: 44, train_loss: 0.5592, test_loss: 1.2508, test_f1: 0.6065
 epoch: 45, train_loss: 0.5444, test_loss: 1.1663, test_f1: 0.6215
 epoch: 46, train_loss: 0.5394, test_loss: 1.2821, test_f1: 0.6042
 epoch: 47, train_loss: 0.5383, test_loss: 1.2355, test_f1: 0.6193
 epoch: 48, train_loss: 0.5202, test_loss: 1.2683, test_f1: 0.5696
 epoch: 49, train_loss: 0.5195, test_loss: 1.3012, test_f1: 0.5919
 epoch: 50, train_loss: 0.5227, test_loss: 1.3234, test_f1: 0.5798
 epoch: 51, train_loss: 0.4897, test_loss: 1.3148, test_f1: 0.5801
 epoch: 52, train_loss: 0.5019, test_loss: 1.3001, test_f1: 0.6067
 epoch: 53, train_loss: 0.4887, test_loss: 1.3343, test_f1: 0.5837
 epoch: 54, train_loss: 0.4931, test_loss: 1.3410, test_f1: 0.5907
 epoch: 55, train_loss: 0.4643, test_loss: 1.3277, test_f1: 0.5934
 epoch: 56, train_loss: 0.4771, test_loss: 1.3488, test_f1: 0.6003
 epoch: 57, train_loss: 0.4603, test_loss: 1.3559, test_f1: 0.5852
 epoch: 58, train_loss: 0.4541, test_loss: 1.3939, test_f1: 0.5824
 epoch: 59, train_loss: 0.4583, test_loss: 1.3768, test_f1: 0.5983
 epoch: 60, train_loss: 0.4519, test_loss: 1.4461, test_f1: 0.5699
 epoch: 61, train_loss: 0.4465, test_loss: 1.4342, test_f1: 0.5818
 epoch: 62, train_loss: 0.4488, test_loss: 1.4028, test_f1: 0.6188
 epoch: 63, train_loss: 0.4517, test_loss: 1.5018, test_f1: 0.5826
 epoch: 64, train_loss: 0.4353, test_loss: 1.4738, test_f1: 0.6013
 epoch: 65, train_loss: 0.4398, test_loss: 1.4707, test_f1: 0.5857
 epoch: 66, train_loss: 0.4350, test_loss: 1.4252, test_f1: 0.6107
 epoch: 67, train_loss: 0.4089, test_loss: 1.4419, test_f1: 0.6089
 epoch: 68, train_loss: 0.4223, test_loss: 1.4858, test_f1: 0.6026
 epoch: 69, train_loss: 0.4169, test_loss: 1.5202, test_f1: 0.5621
 epoch: 70, train_loss: 0.4093, test_loss: 1.4547, test_f1: 0.6144
 epoch: 71, train_loss: 0.4083, test_loss: 1.5263, test_f1: 0.5979
 epoch: 72, train_loss: 0.4138, test_loss: 1.5365, test_f1: 0.6155
 epoch: 73, train_loss: 0.4136, test_loss: 1.5622, test_f1: 0.6069
 epoch: 74, train_loss: 0.4041, test_loss: 1.5732, test_f1: 0.6035
 epoch: 75, train_loss: 0.4172, test_loss: 1.5371, test_f1: 0.6015
 epoch: 76, train_loss: 0.4018, test_loss: 1.4985, test_f1: 0.6154
 epoch: 77, train_loss: 0.4057, test_loss: 1.5737, test_f1: 0.6092
 epoch: 78, train_loss: 0.3837, test_loss: 1.5911, test_f1: 0.6170
 epoch: 79, train_loss: 0.3810, test_loss: 1.6863, test_f1: 0.6074
 epoch: 80, train_loss: 0.3787, test_loss: 1.6077, test_f1: 0.6161
 epoch: 81, train_loss: 0.3711, test_loss: 1.6409, test_f1: 0.6058
 epoch: 82, train_loss: 0.3705, test_loss: 1.6821, test_f1: 0.6098
 epoch: 83, train_loss: 0.3614, test_loss: 1.7252, test_f1: 0.6156
 epoch: 84, train_loss: 0.3655, test_loss: 1.7176, test_f1: 0.5978
 epoch: 85, train_loss: 0.3595, test_loss: 1.7545, test_f1: 0.5919
 epoch: 86, train_loss: 0.3567, test_loss: 1.7864, test_f1: 0.5946
 epoch: 87, train_loss: 0.3548, test_loss: 1.8112, test_f1: 0.6039
 epoch: 88, train_loss: 0.3445, test_loss: 1.7307, test_f1: 0.5739
 epoch: 89, train_loss: 0.3517, test_loss: 1.8287, test_f1: 0.5992
 epoch: 90, train_loss: 0.3502, test_loss: 1.8573, test_f1: 0.5795
 epoch: 91, train_loss: 0.3555, test_loss: 1.8830, test_f1: 0.5587
 epoch: 92, train_loss: 0.3403, test_loss: 1.8862, test_f1: 0.5959
 epoch: 93, train_loss: 0.3380, test_loss: 1.8957, test_f1: 0.6033
 epoch: 94, train_loss: 0.3269, test_loss: 1.9439, test_f1: 0.5770
 epoch: 95, train_loss: 0.3452, test_loss: 2.0182, test_f1: 0.5938
 epoch: 96, train_loss: 0.3398, test_loss: 2.0618, test_f1: 0.5604
 epoch: 97, train_loss: 0.3246, test_loss: 1.9586, test_f1: 0.5627
 epoch: 98, train_loss: 0.3243, test_loss: 1.9645, test_f1: 0.5919
 epoch: 99, train_loss: 0.3208, test_loss: 1.9451, test_f1: 0.6104
##################ITERATION #1 ****************************************
 epoch: 0, train_loss: 1.3091, test_loss: 1.3162, test_f1: 0.2281
 epoch: 1, train_loss: 1.2313, test_loss: 1.2911, test_f1: 0.2281
 epoch: 2, train_loss: 1.1919, test_loss: 1.2464, test_f1: 0.2270
 epoch: 3, train_loss: 1.1552, test_loss: 1.2022, test_f1: 0.2857
 epoch: 4, train_loss: 1.1160, test_loss: 1.1666, test_f1: 0.4256
 epoch: 5, train_loss: 1.0809, test_loss: 1.1320, test_f1: 0.4875
 epoch: 6, train_loss: 1.0446, test_loss: 1.0887, test_f1: 0.5152
 epoch: 7, train_loss: 1.0069, test_loss: 1.0615, test_f1: 0.5344
 epoch: 8, train_loss: 0.9701, test_loss: 1.0316, test_f1: 0.5515
 epoch: 9, train_loss: 0.9333, test_loss: 1.0177, test_f1: 0.5649
 epoch: 10, train_loss: 0.9136, test_loss: 1.0122, test_f1: 0.5350
 epoch: 11, train_loss: 0.8769, test_loss: 0.9983, test_f1: 0.5531
 epoch: 12, train_loss: 0.8580, test_loss: 1.0051, test_f1: 0.5738
 epoch: 13, train_loss: 0.8332, test_loss: 1.0017, test_f1: 0.5873
 epoch: 14, train_loss: 0.8175, test_loss: 1.0086, test_f1: 0.5782
 epoch: 15, train_loss: 0.7887, test_loss: 1.0009, test_f1: 0.5788
 epoch: 16, train_loss: 0.7794, test_loss: 1.0116, test_f1: 0.5766
 epoch: 17, train_loss: 0.7534, test_loss: 1.0020, test_f1: 0.5772
 epoch: 18, train_loss: 0.7335, test_loss: 0.9873, test_f1: 0.5963
 epoch: 19, train_loss: 0.7111, test_loss: 1.0434, test_f1: 0.5585
 epoch: 20, train_loss: 0.7090, test_loss: 1.0003, test_f1: 0.5972
 epoch: 21, train_loss: 0.7167, test_loss: 1.0157, test_f1: 0.5912
 epoch: 22, train_loss: 0.7002, test_loss: 0.9745, test_f1: 0.6295
 epoch: 23, train_loss: 0.6674, test_loss: 1.0484, test_f1: 0.5873
 epoch: 24, train_loss: 0.6749, test_loss: 0.9873, test_f1: 0.6593
 epoch: 25, train_loss: 0.6521, test_loss: 1.0593, test_f1: 0.5927
 epoch: 26, train_loss: 0.6315, test_loss: 1.0539, test_f1: 0.6186
 epoch: 27, train_loss: 0.6509, test_loss: 1.0830, test_f1: 0.6175
 epoch: 28, train_loss: 0.6198, test_loss: 1.0136, test_f1: 0.6381
 epoch: 29, train_loss: 0.6150, test_loss: 1.1027, test_f1: 0.5658
 epoch: 30, train_loss: 0.5882, test_loss: 1.0161, test_f1: 0.5841
 epoch: 31, train_loss: 0.5908, test_loss: 1.0656, test_f1: 0.5873
 epoch: 32, train_loss: 0.5712, test_loss: 1.0462, test_f1: 0.5853
 epoch: 33, train_loss: 0.5842, test_loss: 1.0809, test_f1: 0.6169
 epoch: 34, train_loss: 0.5631, test_loss: 1.0497, test_f1: 0.6047
 epoch: 35, train_loss: 0.5685, test_loss: 1.1081, test_f1: 0.5472
 epoch: 36, train_loss: 0.5645, test_loss: 1.1236, test_f1: 0.5724
 epoch: 37, train_loss: 0.5432, test_loss: 1.0987, test_f1: 0.6010
 epoch: 38, train_loss: 0.5372, test_loss: 1.1483, test_f1: 0.5583
 epoch: 39, train_loss: 0.5132, test_loss: 1.0497, test_f1: 0.6245
 epoch: 40, train_loss: 0.4995, test_loss: 1.1673, test_f1: 0.5679
 epoch: 41, train_loss: 0.5029, test_loss: 1.1427, test_f1: 0.5528
 epoch: 42, train_loss: 0.5084, test_loss: 1.1552, test_f1: 0.5912
 epoch: 43, train_loss: 0.5074, test_loss: 1.0782, test_f1: 0.6077
 epoch: 44, train_loss: 0.4884, test_loss: 1.2361, test_f1: 0.5494
 epoch: 45, train_loss: 0.4800, test_loss: 1.1443, test_f1: 0.5878
 epoch: 46, train_loss: 0.4945, test_loss: 1.1592, test_f1: 0.5525
 epoch: 47, train_loss: 0.4784, test_loss: 1.0737, test_f1: 0.6315
 epoch: 48, train_loss: 0.4703, test_loss: 1.1259, test_f1: 0.6232
 epoch: 49, train_loss: 0.4551, test_loss: 1.1137, test_f1: 0.6288
 epoch: 50, train_loss: 0.4587, test_loss: 1.1104, test_f1: 0.6022
 epoch: 51, train_loss: 0.4226, test_loss: 1.1403, test_f1: 0.6074
 epoch: 52, train_loss: 0.4153, test_loss: 1.2216, test_f1: 0.5874
 epoch: 53, train_loss: 0.4031, test_loss: 1.1369, test_f1: 0.6092
 epoch: 54, train_loss: 0.4039, test_loss: 1.1400, test_f1: 0.6308
 epoch: 55, train_loss: 0.3991, test_loss: 1.1828, test_f1: 0.6465
 epoch: 56, train_loss: 0.3761, test_loss: 1.1934, test_f1: 0.6231
 epoch: 57, train_loss: 0.3823, test_loss: 1.2470, test_f1: 0.5900
 epoch: 58, train_loss: 0.3754, test_loss: 1.1983, test_f1: 0.6252
 epoch: 59, train_loss: 0.3548, test_loss: 1.1941, test_f1: 0.6081
 epoch: 60, train_loss: 0.3670, test_loss: 1.2910, test_f1: 0.6289
 epoch: 61, train_loss: 0.3801, test_loss: 1.1770, test_f1: 0.6383
 epoch: 62, train_loss: 0.3588, test_loss: 1.2217, test_f1: 0.6187
 epoch: 63, train_loss: 0.3691, test_loss: 1.2397, test_f1: 0.6051
 epoch: 64, train_loss: 0.3486, test_loss: 1.2947, test_f1: 0.6054
 epoch: 65, train_loss: 0.3516, test_loss: 1.2409, test_f1: 0.6367
 epoch: 66, train_loss: 0.3599, test_loss: 1.2146, test_f1: 0.6526
 epoch: 67, train_loss: 0.3406, test_loss: 1.3827, test_f1: 0.5964
 epoch: 68, train_loss: 0.3487, test_loss: 1.2011, test_f1: 0.6471
 epoch: 69, train_loss: 0.3289, test_loss: 1.4295, test_f1: 0.5934
 epoch: 70, train_loss: 0.3397, test_loss: 1.3102, test_f1: 0.6407
 epoch: 71, train_loss: 0.3322, test_loss: 1.3066, test_f1: 0.6299
 epoch: 72, train_loss: 0.3275, test_loss: 1.3712, test_f1: 0.5993
 epoch: 73, train_loss: 0.3225, test_loss: 1.5493, test_f1: 0.6164
 epoch: 74, train_loss: 0.3193, test_loss: 1.4087, test_f1: 0.6275
 epoch: 75, train_loss: 0.3332, test_loss: 1.4778, test_f1: 0.5990
 epoch: 76, train_loss: 0.3181, test_loss: 1.5940, test_f1: 0.6280
 epoch: 77, train_loss: 0.3117, test_loss: 1.5161, test_f1: 0.6290
 epoch: 78, train_loss: 0.3070, test_loss: 1.7323, test_f1: 0.6181
 epoch: 79, train_loss: 0.3055, test_loss: 1.4161, test_f1: 0.6400
 epoch: 80, train_loss: 0.3011, test_loss: 1.7102, test_f1: 0.6408
 epoch: 81, train_loss: 0.3045, test_loss: 1.3448, test_f1: 0.6306
 epoch: 82, train_loss: 0.2960, test_loss: 1.6843, test_f1: 0.6103
 epoch: 83, train_loss: 0.2942, test_loss: 1.3375, test_f1: 0.6499
 epoch: 84, train_loss: 0.2843, test_loss: 1.4853, test_f1: 0.6169
 epoch: 85, train_loss: 0.2749, test_loss: 1.3051, test_f1: 0.6729
 epoch: 86, train_loss: 0.2687, test_loss: 1.4538, test_f1: 0.6420
 epoch: 87, train_loss: 0.2884, test_loss: 1.4633, test_f1: 0.6175
 epoch: 88, train_loss: 0.2703, test_loss: 1.4682, test_f1: 0.6156
 epoch: 89, train_loss: 0.2728, test_loss: 1.6765, test_f1: 0.6209
 epoch: 90, train_loss: 0.2550, test_loss: 1.4045, test_f1: 0.6386
 epoch: 91, train_loss: 0.2527, test_loss: 1.4087, test_f1: 0.6522
 epoch: 92, train_loss: 0.2546, test_loss: 1.6765, test_f1: 0.6357
 epoch: 93, train_loss: 0.2463, test_loss: 1.4569, test_f1: 0.6266
 epoch: 94, train_loss: 0.2620, test_loss: 1.6172, test_f1: 0.6250
 epoch: 95, train_loss: 0.2784, test_loss: 1.5720, test_f1: 0.6311
 epoch: 96, train_loss: 0.2536, test_loss: 1.8521, test_f1: 0.6009
 epoch: 97, train_loss: 0.2521, test_loss: 1.8912, test_f1: 0.6187
 epoch: 98, train_loss: 0.2458, test_loss: 1.8755, test_f1: 0.6492
 epoch: 99, train_loss: 0.2473, test_loss: 2.0819, test_f1: 0.6376
##################ITERATION #2 ****************************************
 epoch: 0, train_loss: 1.2740, test_loss: 1.3022, test_f1: 0.2281
 epoch: 1, train_loss: 1.1996, test_loss: 1.2708, test_f1: 0.2904
 epoch: 2, train_loss: 1.1579, test_loss: 1.2250, test_f1: 0.3451
 epoch: 3, train_loss: 1.1130, test_loss: 1.1857, test_f1: 0.4046
 epoch: 4, train_loss: 1.0788, test_loss: 1.1323, test_f1: 0.4595
 epoch: 5, train_loss: 1.0385, test_loss: 1.0929, test_f1: 0.4982
 epoch: 6, train_loss: 0.9981, test_loss: 1.0595, test_f1: 0.5245
 epoch: 7, train_loss: 0.9706, test_loss: 1.0300, test_f1: 0.5419
 epoch: 8, train_loss: 0.9355, test_loss: 1.0089, test_f1: 0.5823
 epoch: 9, train_loss: 0.8964, test_loss: 1.0064, test_f1: 0.5544
 epoch: 10, train_loss: 0.8803, test_loss: 0.9988, test_f1: 0.5860
 epoch: 11, train_loss: 0.8656, test_loss: 0.9843, test_f1: 0.6099
 epoch: 12, train_loss: 0.8446, test_loss: 0.9741, test_f1: 0.5904
 epoch: 13, train_loss: 0.8142, test_loss: 0.9700, test_f1: 0.5752
 epoch: 14, train_loss: 0.7977, test_loss: 0.9726, test_f1: 0.5874
 epoch: 15, train_loss: 0.7727, test_loss: 0.9788, test_f1: 0.6294
 epoch: 16, train_loss: 0.7663, test_loss: 0.9677, test_f1: 0.6254
 epoch: 17, train_loss: 0.7426, test_loss: 0.9797, test_f1: 0.5935
 epoch: 18, train_loss: 0.7285, test_loss: 0.9816, test_f1: 0.6314
 epoch: 19, train_loss: 0.7140, test_loss: 0.9559, test_f1: 0.6327
 epoch: 20, train_loss: 0.7142, test_loss: 0.9849, test_f1: 0.6005
 epoch: 21, train_loss: 0.6790, test_loss: 0.9795, test_f1: 0.6253
 epoch: 22, train_loss: 0.6635, test_loss: 1.0744, test_f1: 0.5788
 epoch: 23, train_loss: 0.6749, test_loss: 1.0700, test_f1: 0.5401
 epoch: 24, train_loss: 0.6486, test_loss: 1.0366, test_f1: 0.5984
 epoch: 25, train_loss: 0.6303, test_loss: 1.0167, test_f1: 0.6030
 epoch: 26, train_loss: 0.6153, test_loss: 1.0330, test_f1: 0.6043
 epoch: 27, train_loss: 0.6219, test_loss: 1.0424, test_f1: 0.6330
 epoch: 28, train_loss: 0.5865, test_loss: 1.0218, test_f1: 0.6309
 epoch: 29, train_loss: 0.5815, test_loss: 1.1032, test_f1: 0.5393
 epoch: 30, train_loss: 0.5800, test_loss: 1.1011, test_f1: 0.5700
 epoch: 31, train_loss: 0.5678, test_loss: 1.0573, test_f1: 0.6432
 epoch: 32, train_loss: 0.5662, test_loss: 1.0841, test_f1: 0.6027
 epoch: 33, train_loss: 0.5478, test_loss: 1.1442, test_f1: 0.5999
 epoch: 34, train_loss: 0.5493, test_loss: 1.1997, test_f1: 0.5836
 epoch: 35, train_loss: 0.5169, test_loss: 1.1930, test_f1: 0.5697
 epoch: 36, train_loss: 0.5200, test_loss: 1.1707, test_f1: 0.6254
 epoch: 37, train_loss: 0.5116, test_loss: 1.0832, test_f1: 0.6372
 epoch: 38, train_loss: 0.4844, test_loss: 1.1529, test_f1: 0.5976
 epoch: 39, train_loss: 0.4871, test_loss: 1.1714, test_f1: 0.6135
 epoch: 40, train_loss: 0.4965, test_loss: 1.1343, test_f1: 0.6097
 epoch: 41, train_loss: 0.4732, test_loss: 1.2502, test_f1: 0.5601
 epoch: 42, train_loss: 0.4758, test_loss: 1.2089, test_f1: 0.5963
 epoch: 43, train_loss: 0.4699, test_loss: 1.2595, test_f1: 0.6010
 epoch: 44, train_loss: 0.4787, test_loss: 1.2967, test_f1: 0.5617
 epoch: 45, train_loss: 0.4530, test_loss: 1.2180, test_f1: 0.6207
 epoch: 46, train_loss: 0.4398, test_loss: 1.3935, test_f1: 0.5508
 epoch: 47, train_loss: 0.4292, test_loss: 1.3018, test_f1: 0.6199
 epoch: 48, train_loss: 0.4175, test_loss: 1.2623, test_f1: 0.5967
 epoch: 49, train_loss: 0.4112, test_loss: 1.2773, test_f1: 0.6103
 epoch: 50, train_loss: 0.3983, test_loss: 1.3104, test_f1: 0.6101
 epoch: 51, train_loss: 0.3871, test_loss: 1.3146, test_f1: 0.6126
 epoch: 52, train_loss: 0.3738, test_loss: 1.3112, test_f1: 0.5832
 epoch: 53, train_loss: 0.3843, test_loss: 1.4051, test_f1: 0.5767
 epoch: 54, train_loss: 0.3624, test_loss: 1.3476, test_f1: 0.5995
 epoch: 55, train_loss: 0.3383, test_loss: 1.3736, test_f1: 0.5963
 epoch: 56, train_loss: 0.3552, test_loss: 1.4088, test_f1: 0.5936
 epoch: 57, train_loss: 0.3465, test_loss: 1.4743, test_f1: 0.5883
 epoch: 58, train_loss: 0.3420, test_loss: 1.4391, test_f1: 0.6075
 epoch: 59, train_loss: 0.3433, test_loss: 1.4778, test_f1: 0.5876
 epoch: 60, train_loss: 0.3241, test_loss: 1.4401, test_f1: 0.6198
 epoch: 61, train_loss: 0.3148, test_loss: 1.5013, test_f1: 0.6013
 epoch: 62, train_loss: 0.3227, test_loss: 1.5060, test_f1: 0.5930
 epoch: 63, train_loss: 0.3304, test_loss: 1.4635, test_f1: 0.6164
 epoch: 64, train_loss: 0.3203, test_loss: 1.4662, test_f1: 0.6099
 epoch: 65, train_loss: 0.3248, test_loss: 1.5485, test_f1: 0.5770
 epoch: 66, train_loss: 0.3145, test_loss: 1.5467, test_f1: 0.6148
 epoch: 67, train_loss: 0.2997, test_loss: 1.6397, test_f1: 0.5830
 epoch: 68, train_loss: 0.2984, test_loss: 1.5874, test_f1: 0.6045
 epoch: 69, train_loss: 0.3194, test_loss: 1.5761, test_f1: 0.6261
 epoch: 70, train_loss: 0.3056, test_loss: 1.5968, test_f1: 0.6138
 epoch: 71, train_loss: 0.3072, test_loss: 1.5295, test_f1: 0.6354
 epoch: 72, train_loss: 0.2858, test_loss: 1.6119, test_f1: 0.6161
 epoch: 73, train_loss: 0.2851, test_loss: 1.6085, test_f1: 0.6203
 epoch: 74, train_loss: 0.2895, test_loss: 1.6194, test_f1: 0.6143
 epoch: 75, train_loss: 0.2860, test_loss: 1.6264, test_f1: 0.6006
 epoch: 76, train_loss: 0.2556, test_loss: 1.6813, test_f1: 0.6043
 epoch: 77, train_loss: 0.2745, test_loss: 1.7090, test_f1: 0.5916
 epoch: 78, train_loss: 0.2669, test_loss: 1.5991, test_f1: 0.6126
 epoch: 79, train_loss: 0.2688, test_loss: 1.6449, test_f1: 0.6103
 epoch: 80, train_loss: 0.2688, test_loss: 1.6450, test_f1: 0.6268
 epoch: 81, train_loss: 0.2543, test_loss: 1.6194, test_f1: 0.6280
 epoch: 82, train_loss: 0.2582, test_loss: 1.6738, test_f1: 0.5995
 epoch: 83, train_loss: 0.2673, test_loss: 1.6864, test_f1: 0.6253
 epoch: 84, train_loss: 0.2390, test_loss: 1.7509, test_f1: 0.6092
 epoch: 85, train_loss: 0.2373, test_loss: 1.7405, test_f1: 0.6013
 epoch: 86, train_loss: 0.2517, test_loss: 1.7708, test_f1: 0.5870
 epoch: 87, train_loss: 0.2396, test_loss: 1.8641, test_f1: 0.5826
 epoch: 88, train_loss: 0.2409, test_loss: 1.8853, test_f1: 0.6064
 epoch: 89, train_loss: 0.2489, test_loss: 1.8063, test_f1: 0.5713
 epoch: 90, train_loss: 0.2293, test_loss: 1.8435, test_f1: 0.6214
 epoch: 91, train_loss: 0.2391, test_loss: 1.8943, test_f1: 0.5638
 epoch: 92, train_loss: 0.2479, test_loss: 1.9196, test_f1: 0.5897
 epoch: 93, train_loss: 0.2345, test_loss: 1.8454, test_f1: 0.5948
 epoch: 94, train_loss: 0.2395, test_loss: 1.8397, test_f1: 0.6079
 epoch: 95, train_loss: 0.2350, test_loss: 1.8550, test_f1: 0.6101
 epoch: 96, train_loss: 0.2218, test_loss: 1.9174, test_f1: 0.6210
 epoch: 97, train_loss: 0.2122, test_loss: 1.8409, test_f1: 0.6073
 epoch: 98, train_loss: 0.2122, test_loss: 1.9388, test_f1: 0.5832
 epoch: 99, train_loss: 0.2200, test_loss: 1.9127, test_f1: 0.6122
##################ITERATION #3 ****************************************
 epoch: 0, train_loss: 1.2400, test_loss: 1.3071, test_f1: 0.2281
 epoch: 1, train_loss: 1.1520, test_loss: 1.2627, test_f1: 0.2935
 epoch: 2, train_loss: 1.1040, test_loss: 1.1875, test_f1: 0.4318
 epoch: 3, train_loss: 1.0635, test_loss: 1.1265, test_f1: 0.4676
 epoch: 4, train_loss: 1.0301, test_loss: 1.0918, test_f1: 0.5211
 epoch: 5, train_loss: 0.9790, test_loss: 1.0733, test_f1: 0.5339
 epoch: 6, train_loss: 0.9521, test_loss: 1.0441, test_f1: 0.5624
 epoch: 7, train_loss: 0.9255, test_loss: 1.0407, test_f1: 0.5728
 epoch: 8, train_loss: 0.8992, test_loss: 1.0171, test_f1: 0.6234
 epoch: 9, train_loss: 0.8809, test_loss: 1.0026, test_f1: 0.6149
 epoch: 10, train_loss: 0.8623, test_loss: 1.0105, test_f1: 0.5865
 epoch: 11, train_loss: 0.8440, test_loss: 0.9946, test_f1: 0.5857
 epoch: 12, train_loss: 0.8093, test_loss: 0.9694, test_f1: 0.5857
 epoch: 13, train_loss: 0.7897, test_loss: 1.0027, test_f1: 0.5699
 epoch: 14, train_loss: 0.7818, test_loss: 0.9569, test_f1: 0.6028
 epoch: 15, train_loss: 0.7407, test_loss: 0.9827, test_f1: 0.5816
 epoch: 16, train_loss: 0.7381, test_loss: 1.0385, test_f1: 0.5810
 epoch: 17, train_loss: 0.7296, test_loss: 1.0999, test_f1: 0.5523
 epoch: 18, train_loss: 0.7029, test_loss: 0.9939, test_f1: 0.5806
 epoch: 19, train_loss: 0.6923, test_loss: 1.1043, test_f1: 0.5643
 epoch: 20, train_loss: 0.6856, test_loss: 1.0566, test_f1: 0.5883
 epoch: 21, train_loss: 0.6529, test_loss: 1.0542, test_f1: 0.5624
 epoch: 22, train_loss: 0.6349, test_loss: 1.1019, test_f1: 0.5561
 epoch: 23, train_loss: 0.6367, test_loss: 1.2388, test_f1: 0.5548
 epoch: 24, train_loss: 0.6326, test_loss: 1.1391, test_f1: 0.5760
 epoch: 25, train_loss: 0.6124, test_loss: 1.0914, test_f1: 0.5761
 epoch: 26, train_loss: 0.6121, test_loss: 1.0485, test_f1: 0.5785
 epoch: 27, train_loss: 0.5901, test_loss: 1.1794, test_f1: 0.5764
 epoch: 28, train_loss: 0.5757, test_loss: 1.1931, test_f1: 0.5954
 epoch: 29, train_loss: 0.5466, test_loss: 1.1248, test_f1: 0.5906
 epoch: 30, train_loss: 0.5433, test_loss: 1.1732, test_f1: 0.6035
 epoch: 31, train_loss: 0.5483, test_loss: 1.2456, test_f1: 0.6096
 epoch: 32, train_loss: 0.5438, test_loss: 1.1706, test_f1: 0.6019
 epoch: 33, train_loss: 0.5172, test_loss: 1.2400, test_f1: 0.6083
 epoch: 34, train_loss: 0.5269, test_loss: 1.2231, test_f1: 0.6094
 epoch: 35, train_loss: 0.5231, test_loss: 1.2397, test_f1: 0.6020
 epoch: 36, train_loss: 0.4985, test_loss: 1.2521, test_f1: 0.6325
 epoch: 37, train_loss: 0.4918, test_loss: 1.2216, test_f1: 0.6425
 epoch: 38, train_loss: 0.4890, test_loss: 1.2369, test_f1: 0.6215
 epoch: 39, train_loss: 0.4734, test_loss: 1.2491, test_f1: 0.6233
 epoch: 40, train_loss: 0.4754, test_loss: 1.3032, test_f1: 0.6458
 epoch: 41, train_loss: 0.4635, test_loss: 1.1945, test_f1: 0.6148
 epoch: 42, train_loss: 0.4468, test_loss: 1.3002, test_f1: 0.6033
 epoch: 43, train_loss: 0.4446, test_loss: 1.2020, test_f1: 0.6260
 epoch: 44, train_loss: 0.4479, test_loss: 1.2434, test_f1: 0.6309
 epoch: 45, train_loss: 0.4243, test_loss: 1.2808, test_f1: 0.6168
 epoch: 46, train_loss: 0.4072, test_loss: 1.2621, test_f1: 0.6329
 epoch: 47, train_loss: 0.3999, test_loss: 1.3964, test_f1: 0.6132
 epoch: 48, train_loss: 0.3905, test_loss: 1.3248, test_f1: 0.6320
 epoch: 49, train_loss: 0.3610, test_loss: 1.4798, test_f1: 0.6057
 epoch: 50, train_loss: 0.3805, test_loss: 1.4471, test_f1: 0.6259
 epoch: 51, train_loss: 0.3801, test_loss: 1.5692, test_f1: 0.6300
 epoch: 52, train_loss: 0.3495, test_loss: 1.4703, test_f1: 0.6223
 epoch: 53, train_loss: 0.3475, test_loss: 1.4096, test_f1: 0.6322
 epoch: 54, train_loss: 0.3233, test_loss: 1.4730, test_f1: 0.6323
 epoch: 55, train_loss: 0.3312, test_loss: 1.5371, test_f1: 0.6084
 epoch: 56, train_loss: 0.3173, test_loss: 1.4223, test_f1: 0.6259
 epoch: 57, train_loss: 0.3203, test_loss: 1.5100, test_f1: 0.6267
 epoch: 58, train_loss: 0.3180, test_loss: 1.4838, test_f1: 0.6186
 epoch: 59, train_loss: 0.3124, test_loss: 1.5998, test_f1: 0.6128
 epoch: 60, train_loss: 0.3028, test_loss: 1.5195, test_f1: 0.6272
 epoch: 61, train_loss: 0.3146, test_loss: 1.5737, test_f1: 0.6235
 epoch: 62, train_loss: 0.2981, test_loss: 1.5855, test_f1: 0.6087
 epoch: 63, train_loss: 0.3076, test_loss: 1.5813, test_f1: 0.6230
 epoch: 64, train_loss: 0.3052, test_loss: 1.5922, test_f1: 0.6370
 epoch: 65, train_loss: 0.2827, test_loss: 1.6025, test_f1: 0.6369
 epoch: 66, train_loss: 0.2827, test_loss: 1.5811, test_f1: 0.6222
 epoch: 67, train_loss: 0.2822, test_loss: 1.6368, test_f1: 0.6068
 epoch: 68, train_loss: 0.2777, test_loss: 1.6905, test_f1: 0.6225
 epoch: 69, train_loss: 0.2715, test_loss: 1.6419, test_f1: 0.6313
 epoch: 70, train_loss: 0.2759, test_loss: 1.6634, test_f1: 0.6002
 epoch: 71, train_loss: 0.2867, test_loss: 1.7995, test_f1: 0.6336
 epoch: 72, train_loss: 0.2655, test_loss: 1.6932, test_f1: 0.6051
 epoch: 73, train_loss: 0.2432, test_loss: 1.7732, test_f1: 0.6309
 epoch: 74, train_loss: 0.2503, test_loss: 1.7008, test_f1: 0.6263
 epoch: 75, train_loss: 0.2532, test_loss: 1.6756, test_f1: 0.6351
 epoch: 76, train_loss: 0.2301, test_loss: 1.7655, test_f1: 0.6174
 epoch: 77, train_loss: 0.2434, test_loss: 1.8449, test_f1: 0.6392
 epoch: 78, train_loss: 0.2599, test_loss: 1.8272, test_f1: 0.6286
 epoch: 79, train_loss: 0.2561, test_loss: 1.8338, test_f1: 0.6165
 epoch: 80, train_loss: 0.2572, test_loss: 1.7615, test_f1: 0.6479
 epoch: 81, train_loss: 0.2502, test_loss: 1.8383, test_f1: 0.6390
 epoch: 82, train_loss: 0.2456, test_loss: 1.7506, test_f1: 0.6301
 epoch: 83, train_loss: 0.2325, test_loss: 1.8046, test_f1: 0.5920
 epoch: 84, train_loss: 0.2308, test_loss: 1.8970, test_f1: 0.6270
 epoch: 85, train_loss: 0.2228, test_loss: 1.8597, test_f1: 0.6153
 epoch: 86, train_loss: 0.2187, test_loss: 1.9700, test_f1: 0.6164
 epoch: 87, train_loss: 0.2325, test_loss: 1.9337, test_f1: 0.6233
 epoch: 88, train_loss: 0.2182, test_loss: 1.8782, test_f1: 0.6189
 epoch: 89, train_loss: 0.2314, test_loss: 2.0703, test_f1: 0.5995
 epoch: 90, train_loss: 0.2134, test_loss: 2.0049, test_f1: 0.6153
 epoch: 91, train_loss: 0.2010, test_loss: 1.9093, test_f1: 0.6178
 epoch: 92, train_loss: 0.1962, test_loss: 2.0108, test_f1: 0.6282
 epoch: 93, train_loss: 0.2147, test_loss: 2.1175, test_f1: 0.6051
 epoch: 94, train_loss: 0.1955, test_loss: 2.0066, test_f1: 0.6168
 epoch: 95, train_loss: 0.2158, test_loss: 2.1476, test_f1: 0.6275
 epoch: 96, train_loss: 0.1966, test_loss: 2.0525, test_f1: 0.6364
 epoch: 97, train_loss: 0.1938, test_loss: 2.1881, test_f1: 0.6276
 epoch: 98, train_loss: 0.1856, test_loss: 2.0409, test_f1: 0.6378
 epoch: 99, train_loss: 0.1976, test_loss: 2.0764, test_f1: 0.6214
##################ITERATION #4 ****************************************
 epoch: 0, train_loss: 1.2443, test_loss: 1.2907, test_f1: 0.2618
 epoch: 1, train_loss: 1.1509, test_loss: 1.2409, test_f1: 0.2253
 epoch: 2, train_loss: 1.1024, test_loss: 1.1786, test_f1: 0.4184
 epoch: 3, train_loss: 1.0745, test_loss: 1.1425, test_f1: 0.4545
 epoch: 4, train_loss: 1.0285, test_loss: 1.1151, test_f1: 0.4696
 epoch: 5, train_loss: 1.0032, test_loss: 1.0941, test_f1: 0.4901
 epoch: 6, train_loss: 0.9690, test_loss: 1.0751, test_f1: 0.5345
 epoch: 7, train_loss: 0.9393, test_loss: 1.0679, test_f1: 0.5139
 epoch: 8, train_loss: 0.9204, test_loss: 1.0302, test_f1: 0.5685
 epoch: 9, train_loss: 0.8904, test_loss: 1.0269, test_f1: 0.5745
 epoch: 10, train_loss: 0.8788, test_loss: 1.0234, test_f1: 0.5444
 epoch: 11, train_loss: 0.8540, test_loss: 0.9812, test_f1: 0.5791
 epoch: 12, train_loss: 0.8264, test_loss: 0.9761, test_f1: 0.6168
 epoch: 13, train_loss: 0.8066, test_loss: 0.9952, test_f1: 0.5842
 epoch: 14, train_loss: 0.7963, test_loss: 0.9853, test_f1: 0.5973
 epoch: 15, train_loss: 0.7838, test_loss: 0.9768, test_f1: 0.5877
 epoch: 16, train_loss: 0.7556, test_loss: 0.9940, test_f1: 0.5964
 epoch: 17, train_loss: 0.7317, test_loss: 0.9680, test_f1: 0.6065
 epoch: 18, train_loss: 0.7101, test_loss: 0.9869, test_f1: 0.5734
 epoch: 19, train_loss: 0.7063, test_loss: 0.9697, test_f1: 0.5826
 epoch: 20, train_loss: 0.6975, test_loss: 0.9624, test_f1: 0.5942
 epoch: 21, train_loss: 0.6785, test_loss: 0.9482, test_f1: 0.6167
 epoch: 22, train_loss: 0.6692, test_loss: 1.0124, test_f1: 0.5717
 epoch: 23, train_loss: 0.6368, test_loss: 1.0505, test_f1: 0.5661
 epoch: 24, train_loss: 0.6703, test_loss: 1.0199, test_f1: 0.5985
 epoch: 25, train_loss: 0.6427, test_loss: 0.9975, test_f1: 0.5663
 epoch: 26, train_loss: 0.6253, test_loss: 1.0833, test_f1: 0.5751
 epoch: 27, train_loss: 0.6005, test_loss: 1.0431, test_f1: 0.5903
 epoch: 28, train_loss: 0.5903, test_loss: 1.0229, test_f1: 0.5853
 epoch: 29, train_loss: 0.5779, test_loss: 1.0014, test_f1: 0.5954
 epoch: 30, train_loss: 0.5731, test_loss: 1.0396, test_f1: 0.5507
 epoch: 31, train_loss: 0.5641, test_loss: 1.0264, test_f1: 0.6372
 epoch: 32, train_loss: 0.5712, test_loss: 0.9609, test_f1: 0.6286
 epoch: 33, train_loss: 0.5637, test_loss: 1.0764, test_f1: 0.5999
 epoch: 34, train_loss: 0.5414, test_loss: 1.0598, test_f1: 0.6081
 epoch: 35, train_loss: 0.5431, test_loss: 1.1058, test_f1: 0.5527
 epoch: 36, train_loss: 0.5310, test_loss: 1.1005, test_f1: 0.6155
 epoch: 37, train_loss: 0.5106, test_loss: 1.0352, test_f1: 0.6352
 epoch: 38, train_loss: 0.5144, test_loss: 1.0952, test_f1: 0.6202
 epoch: 39, train_loss: 0.5051, test_loss: 1.1073, test_f1: 0.6074
 epoch: 40, train_loss: 0.4930, test_loss: 1.1435, test_f1: 0.6274
 epoch: 41, train_loss: 0.4743, test_loss: 1.2161, test_f1: 0.5859
 epoch: 42, train_loss: 0.4741, test_loss: 1.1790, test_f1: 0.5980
 epoch: 43, train_loss: 0.4612, test_loss: 1.1426, test_f1: 0.6138
 epoch: 44, train_loss: 0.4601, test_loss: 1.2171, test_f1: 0.5986
 epoch: 45, train_loss: 0.4397, test_loss: 1.1506, test_f1: 0.6205
 epoch: 46, train_loss: 0.4451, test_loss: 1.1878, test_f1: 0.5704
 epoch: 47, train_loss: 0.4217, test_loss: 1.1862, test_f1: 0.6301
 epoch: 48, train_loss: 0.4091, test_loss: 1.1976, test_f1: 0.5989
 epoch: 49, train_loss: 0.4063, test_loss: 1.2221, test_f1: 0.6035
 epoch: 50, train_loss: 0.3872, test_loss: 1.2856, test_f1: 0.5653
 epoch: 51, train_loss: 0.3979, test_loss: 1.2753, test_f1: 0.6116
 epoch: 52, train_loss: 0.3755, test_loss: 1.2598, test_f1: 0.6126
 epoch: 53, train_loss: 0.3495, test_loss: 1.2795, test_f1: 0.6144
 epoch: 54, train_loss: 0.3640, test_loss: 1.1616, test_f1: 0.6309
 epoch: 55, train_loss: 0.3620, test_loss: 1.1651, test_f1: 0.6217
 epoch: 56, train_loss: 0.3590, test_loss: 1.1851, test_f1: 0.6119
 epoch: 57, train_loss: 0.3385, test_loss: 1.2710, test_f1: 0.6342
 epoch: 58, train_loss: 0.3407, test_loss: 1.2616, test_f1: 0.6176
 epoch: 59, train_loss: 0.3388, test_loss: 1.3601, test_f1: 0.6042
 epoch: 60, train_loss: 0.3296, test_loss: 1.2593, test_f1: 0.6116
 epoch: 61, train_loss: 0.3227, test_loss: 1.2977, test_f1: 0.6217
 epoch: 62, train_loss: 0.3286, test_loss: 1.2744, test_f1: 0.6352
 epoch: 63, train_loss: 0.3236, test_loss: 1.3338, test_f1: 0.6047
 epoch: 64, train_loss: 0.3184, test_loss: 1.3044, test_f1: 0.6255
 epoch: 65, train_loss: 0.3070, test_loss: 1.3056, test_f1: 0.6258
 epoch: 66, train_loss: 0.2998, test_loss: 1.4099, test_f1: 0.6111
 epoch: 67, train_loss: 0.3093, test_loss: 1.4151, test_f1: 0.6050
 epoch: 68, train_loss: 0.3003, test_loss: 1.3325, test_f1: 0.6200
 epoch: 69, train_loss: 0.2954, test_loss: 1.4416, test_f1: 0.6039
 epoch: 70, train_loss: 0.2842, test_loss: 1.3757, test_f1: 0.6345
 epoch: 71, train_loss: 0.2884, test_loss: 1.4438, test_f1: 0.5998
 epoch: 72, train_loss: 0.2995, test_loss: 1.3732, test_f1: 0.6038
 epoch: 73, train_loss: 0.2983, test_loss: 1.4275, test_f1: 0.6271
 epoch: 74, train_loss: 0.2786, test_loss: 1.5208, test_f1: 0.6168
 epoch: 75, train_loss: 0.2523, test_loss: 1.3676, test_f1: 0.6453
 epoch: 76, train_loss: 0.2780, test_loss: 1.4347, test_f1: 0.6099
 epoch: 77, train_loss: 0.2571, test_loss: 1.5340, test_f1: 0.6163
 epoch: 78, train_loss: 0.2540, test_loss: 1.4972, test_f1: 0.6166
 epoch: 79, train_loss: 0.2668, test_loss: 1.3787, test_f1: 0.6128
 epoch: 80, train_loss: 0.2751, test_loss: 1.4670, test_f1: 0.6023
 epoch: 81, train_loss: 0.2544, test_loss: 1.4541, test_f1: 0.6160
 epoch: 82, train_loss: 0.2472, test_loss: 1.5348, test_f1: 0.6241
 epoch: 83, train_loss: 0.2554, test_loss: 1.4580, test_f1: 0.6186
 epoch: 84, train_loss: 0.2522, test_loss: 1.4662, test_f1: 0.6225
 epoch: 85, train_loss: 0.2526, test_loss: 1.4872, test_f1: 0.6243
 epoch: 86, train_loss: 0.2348, test_loss: 1.5426, test_f1: 0.6329
 epoch: 87, train_loss: 0.2402, test_loss: 1.7114, test_f1: 0.6020
 epoch: 88, train_loss: 0.2316, test_loss: 1.6058, test_f1: 0.5867
 epoch: 89, train_loss: 0.2169, test_loss: 1.6799, test_f1: 0.6218
 epoch: 90, train_loss: 0.2250, test_loss: 1.5951, test_f1: 0.6042
 epoch: 91, train_loss: 0.2183, test_loss: 1.6322, test_f1: 0.6264
 epoch: 92, train_loss: 0.2192, test_loss: 1.6869, test_f1: 0.6159
 epoch: 93, train_loss: 0.2372, test_loss: 1.6441, test_f1: 0.6133
 epoch: 94, train_loss: 0.2245, test_loss: 1.7209, test_f1: 0.6144
 epoch: 95, train_loss: 0.2050, test_loss: 1.5821, test_f1: 0.6231
 epoch: 96, train_loss: 0.2156, test_loss: 1.6602, test_f1: 0.6038
 epoch: 97, train_loss: 0.2277, test_loss: 1.6945, test_f1: 0.6159
 epoch: 98, train_loss: 0.2159, test_loss: 1.6637, test_f1: 0.6029
 epoch: 99, train_loss: 0.2286, test_loss: 1.6515, test_f1: 0.6053
##################ITERATION #5 ****************************************
 epoch: 0, train_loss: 1.2300, test_loss: 1.2956, test_f1: 0.2388
 epoch: 1, train_loss: 1.1181, test_loss: 1.2840, test_f1: 0.3370
 epoch: 2, train_loss: 1.0640, test_loss: 1.2277, test_f1: 0.4271
 epoch: 3, train_loss: 1.0349, test_loss: 1.1740, test_f1: 0.4958
 epoch: 4, train_loss: 1.0049, test_loss: 1.1164, test_f1: 0.5110
 epoch: 5, train_loss: 0.9674, test_loss: 1.0657, test_f1: 0.5344
 epoch: 6, train_loss: 0.9418, test_loss: 1.0406, test_f1: 0.5575
 epoch: 7, train_loss: 0.9219, test_loss: 1.0527, test_f1: 0.5828
 epoch: 8, train_loss: 0.8944, test_loss: 1.0430, test_f1: 0.6119
 epoch: 9, train_loss: 0.8710, test_loss: 1.0211, test_f1: 0.5913
 epoch: 10, train_loss: 0.8490, test_loss: 1.0278, test_f1: 0.5874
 epoch: 11, train_loss: 0.8101, test_loss: 1.0180, test_f1: 0.5799
 epoch: 12, train_loss: 0.7949, test_loss: 0.9946, test_f1: 0.5924
 epoch: 13, train_loss: 0.7930, test_loss: 0.9991, test_f1: 0.6027
 epoch: 14, train_loss: 0.7596, test_loss: 0.9990, test_f1: 0.5786
 epoch: 15, train_loss: 0.7620, test_loss: 1.0408, test_f1: 0.5604
 epoch: 16, train_loss: 0.7415, test_loss: 0.9968, test_f1: 0.5948
 epoch: 17, train_loss: 0.7210, test_loss: 1.0322, test_f1: 0.5761
 epoch: 18, train_loss: 0.7109, test_loss: 0.9796, test_f1: 0.6395
 epoch: 19, train_loss: 0.6807, test_loss: 0.9962, test_f1: 0.6325
 epoch: 20, train_loss: 0.6828, test_loss: 1.0469, test_f1: 0.5613
 epoch: 21, train_loss: 0.6627, test_loss: 1.0207, test_f1: 0.6004
 epoch: 22, train_loss: 0.6540, test_loss: 1.0275, test_f1: 0.5853
 epoch: 23, train_loss: 0.6248, test_loss: 1.0740, test_f1: 0.6055
 epoch: 24, train_loss: 0.6092, test_loss: 1.0615, test_f1: 0.6110
 epoch: 25, train_loss: 0.6214, test_loss: 1.1209, test_f1: 0.6235
 epoch: 26, train_loss: 0.5978, test_loss: 1.1019, test_f1: 0.5921
 epoch: 27, train_loss: 0.6006, test_loss: 1.0071, test_f1: 0.6231
 epoch: 28, train_loss: 0.5806, test_loss: 1.0984, test_f1: 0.5866
 epoch: 29, train_loss: 0.5665, test_loss: 1.0498, test_f1: 0.6152
 epoch: 30, train_loss: 0.5701, test_loss: 1.1512, test_f1: 0.5758
 epoch: 31, train_loss: 0.5586, test_loss: 1.0816, test_f1: 0.5919
 epoch: 32, train_loss: 0.5322, test_loss: 1.0961, test_f1: 0.6334
 epoch: 33, train_loss: 0.5259, test_loss: 1.1171, test_f1: 0.6257
 epoch: 34, train_loss: 0.5022, test_loss: 1.1258, test_f1: 0.6405
 epoch: 35, train_loss: 0.4934, test_loss: 1.1612, test_f1: 0.6204
 epoch: 36, train_loss: 0.4888, test_loss: 1.2188, test_f1: 0.6460
 epoch: 37, train_loss: 0.4842, test_loss: 1.2236, test_f1: 0.6151
 epoch: 38, train_loss: 0.4726, test_loss: 1.1479, test_f1: 0.6457
 epoch: 39, train_loss: 0.4832, test_loss: 1.2748, test_f1: 0.5622
 epoch: 40, train_loss: 0.4582, test_loss: 1.2624, test_f1: 0.6432
 epoch: 41, train_loss: 0.4564, test_loss: 1.2991, test_f1: 0.6245
 epoch: 42, train_loss: 0.4532, test_loss: 1.2976, test_f1: 0.5925
 epoch: 43, train_loss: 0.4444, test_loss: 1.3926, test_f1: 0.6104
 epoch: 44, train_loss: 0.4343, test_loss: 1.3422, test_f1: 0.6056
 epoch: 45, train_loss: 0.4343, test_loss: 1.2899, test_f1: 0.6323
 epoch: 46, train_loss: 0.4148, test_loss: 1.3761, test_f1: 0.6089
 epoch: 47, train_loss: 0.4150, test_loss: 1.2696, test_f1: 0.6546
 epoch: 48, train_loss: 0.4137, test_loss: 1.4848, test_f1: 0.5590
 epoch: 49, train_loss: 0.3850, test_loss: 1.4516, test_f1: 0.6459
 epoch: 50, train_loss: 0.3696, test_loss: 1.3830, test_f1: 0.6038
 epoch: 51, train_loss: 0.3648, test_loss: 1.4170, test_f1: 0.6232
 epoch: 52, train_loss: 0.3607, test_loss: 1.5143, test_f1: 0.5967
 epoch: 53, train_loss: 0.3380, test_loss: 1.4133, test_f1: 0.6283
 epoch: 54, train_loss: 0.3415, test_loss: 1.5060, test_f1: 0.6199
 epoch: 55, train_loss: 0.3230, test_loss: 1.4959, test_f1: 0.6200
 epoch: 56, train_loss: 0.3321, test_loss: 1.5660, test_f1: 0.5866
 epoch: 57, train_loss: 0.3281, test_loss: 1.5218, test_f1: 0.6001
 epoch: 58, train_loss: 0.3237, test_loss: 1.5422, test_f1: 0.6316
 epoch: 59, train_loss: 0.3017, test_loss: 1.5470, test_f1: 0.6303
 epoch: 60, train_loss: 0.3159, test_loss: 1.5577, test_f1: 0.6091
 epoch: 61, train_loss: 0.3214, test_loss: 1.5907, test_f1: 0.5975
 epoch: 62, train_loss: 0.3165, test_loss: 1.5888, test_f1: 0.6086
 epoch: 63, train_loss: 0.2970, test_loss: 1.7095, test_f1: 0.5794
 epoch: 64, train_loss: 0.3153, test_loss: 1.6700, test_f1: 0.6173
 epoch: 65, train_loss: 0.2919, test_loss: 1.5860, test_f1: 0.6310
 epoch: 66, train_loss: 0.2903, test_loss: 1.5764, test_f1: 0.6296
 epoch: 67, train_loss: 0.2710, test_loss: 1.6276, test_f1: 0.5872
 epoch: 68, train_loss: 0.2752, test_loss: 1.7031, test_f1: 0.6271
 epoch: 69, train_loss: 0.2897, test_loss: 1.6653, test_f1: 0.6101
 epoch: 70, train_loss: 0.2848, test_loss: 1.6499, test_f1: 0.6035
 epoch: 71, train_loss: 0.2931, test_loss: 1.6568, test_f1: 0.6031
 epoch: 72, train_loss: 0.2979, test_loss: 1.7274, test_f1: 0.6198
 epoch: 73, train_loss: 0.2632, test_loss: 1.7763, test_f1: 0.5967
 epoch: 74, train_loss: 0.2819, test_loss: 1.7567, test_f1: 0.6258
 epoch: 75, train_loss: 0.2786, test_loss: 1.8782, test_f1: 0.6008
 epoch: 76, train_loss: 0.2823, test_loss: 1.7575, test_f1: 0.5985
 epoch: 77, train_loss: 0.2545, test_loss: 1.7984, test_f1: 0.5733
 epoch: 78, train_loss: 0.2618, test_loss: 1.8601, test_f1: 0.6318
 epoch: 79, train_loss: 0.2476, test_loss: 1.8353, test_f1: 0.6219
 epoch: 80, train_loss: 0.2336, test_loss: 1.8716, test_f1: 0.6146
 epoch: 81, train_loss: 0.2417, test_loss: 1.8955, test_f1: 0.6031
 epoch: 82, train_loss: 0.2507, test_loss: 1.9537, test_f1: 0.5687
 epoch: 83, train_loss: 0.2309, test_loss: 1.8985, test_f1: 0.6040
 epoch: 84, train_loss: 0.2320, test_loss: 1.8722, test_f1: 0.5873
 epoch: 85, train_loss: 0.2268, test_loss: 1.9750, test_f1: 0.5903
 epoch: 86, train_loss: 0.2318, test_loss: 1.9832, test_f1: 0.5677
 epoch: 87, train_loss: 0.2335, test_loss: 1.9546, test_f1: 0.5999
 epoch: 88, train_loss: 0.2286, test_loss: 1.9441, test_f1: 0.6219
 epoch: 89, train_loss: 0.2328, test_loss: 1.9087, test_f1: 0.5936
 epoch: 90, train_loss: 0.2394, test_loss: 2.0076, test_f1: 0.6203
 epoch: 91, train_loss: 0.2131, test_loss: 1.9024, test_f1: 0.6288
 epoch: 92, train_loss: 0.2201, test_loss: 1.8948, test_f1: 0.6337
 epoch: 93, train_loss: 0.2108, test_loss: 1.9568, test_f1: 0.6176
 epoch: 94, train_loss: 0.2189, test_loss: 2.0958, test_f1: 0.6091
 epoch: 95, train_loss: 0.2024, test_loss: 2.1053, test_f1: 0.5925
 epoch: 96, train_loss: 0.2133, test_loss: 1.9627, test_f1: 0.6348
 epoch: 97, train_loss: 0.2106, test_loss: 2.0771, test_f1: 0.5943
 epoch: 98, train_loss: 0.2052, test_loss: 2.0312, test_f1: 0.6160
 epoch: 99, train_loss: 0.2111, test_loss: 2.1626, test_f1: 0.5945
##################ITERATION #6 ****************************************
 epoch: 0, train_loss: 1.2217, test_loss: 1.2801, test_f1: 0.2512
 epoch: 1, train_loss: 1.1146, test_loss: 1.2540, test_f1: 0.2695
 epoch: 2, train_loss: 1.0572, test_loss: 1.1450, test_f1: 0.4762
 epoch: 3, train_loss: 1.0298, test_loss: 1.0911, test_f1: 0.5629
 epoch: 4, train_loss: 0.9885, test_loss: 1.0639, test_f1: 0.5678
 epoch: 5, train_loss: 0.9474, test_loss: 1.0340, test_f1: 0.5930
 epoch: 6, train_loss: 0.9210, test_loss: 1.0255, test_f1: 0.6281
 epoch: 7, train_loss: 0.9033, test_loss: 1.0276, test_f1: 0.6107
 epoch: 8, train_loss: 0.8771, test_loss: 1.0192, test_f1: 0.6224
 epoch: 9, train_loss: 0.8708, test_loss: 1.0323, test_f1: 0.5995
 epoch: 10, train_loss: 0.8447, test_loss: 0.9947, test_f1: 0.6415
 epoch: 11, train_loss: 0.8212, test_loss: 1.0424, test_f1: 0.5553
 epoch: 12, train_loss: 0.8136, test_loss: 1.0164, test_f1: 0.6296
 epoch: 13, train_loss: 0.7977, test_loss: 0.9913, test_f1: 0.5970
 epoch: 14, train_loss: 0.7718, test_loss: 0.9954, test_f1: 0.5797
 epoch: 15, train_loss: 0.7658, test_loss: 1.0224, test_f1: 0.5895
 epoch: 16, train_loss: 0.7485, test_loss: 1.0081, test_f1: 0.6459
 epoch: 17, train_loss: 0.7397, test_loss: 1.0506, test_f1: 0.5686
 epoch: 18, train_loss: 0.7250, test_loss: 1.0413, test_f1: 0.5557
 epoch: 19, train_loss: 0.7127, test_loss: 1.0085, test_f1: 0.5760
 epoch: 20, train_loss: 0.6941, test_loss: 1.0416, test_f1: 0.5903
 epoch: 21, train_loss: 0.6696, test_loss: 1.0181, test_f1: 0.5942
 epoch: 22, train_loss: 0.6527, test_loss: 1.0607, test_f1: 0.5708
 epoch: 23, train_loss: 0.6435, test_loss: 1.0232, test_f1: 0.6006
 epoch: 24, train_loss: 0.6323, test_loss: 1.0770, test_f1: 0.5819
 epoch: 25, train_loss: 0.6278, test_loss: 1.0304, test_f1: 0.5838
 epoch: 26, train_loss: 0.6141, test_loss: 1.0265, test_f1: 0.6165
 epoch: 27, train_loss: 0.6109, test_loss: 1.0622, test_f1: 0.6135
 epoch: 28, train_loss: 0.6027, test_loss: 1.0333, test_f1: 0.5978
 epoch: 29, train_loss: 0.5882, test_loss: 1.1192, test_f1: 0.5803
 epoch: 30, train_loss: 0.5816, test_loss: 1.0641, test_f1: 0.6233
 epoch: 31, train_loss: 0.5527, test_loss: 1.1290, test_f1: 0.5948
 epoch: 32, train_loss: 0.5583, test_loss: 1.0635, test_f1: 0.6218
 epoch: 33, train_loss: 0.5425, test_loss: 1.1323, test_f1: 0.6142
 epoch: 34, train_loss: 0.5409, test_loss: 1.1590, test_f1: 0.5926
 epoch: 35, train_loss: 0.5193, test_loss: 1.1387, test_f1: 0.6197
 epoch: 36, train_loss: 0.5185, test_loss: 1.1453, test_f1: 0.5810
 epoch: 37, train_loss: 0.5246, test_loss: 1.1776, test_f1: 0.5991
 epoch: 38, train_loss: 0.5151, test_loss: 1.1561, test_f1: 0.6025
 epoch: 39, train_loss: 0.4938, test_loss: 1.1883, test_f1: 0.6148
 epoch: 40, train_loss: 0.4968, test_loss: 1.3140, test_f1: 0.5822
 epoch: 41, train_loss: 0.4870, test_loss: 1.1764, test_f1: 0.6323
 epoch: 42, train_loss: 0.4788, test_loss: 1.2862, test_f1: 0.5799
 epoch: 43, train_loss: 0.4737, test_loss: 1.2218, test_f1: 0.6177
 epoch: 44, train_loss: 0.4592, test_loss: 1.3851, test_f1: 0.5877
 epoch: 45, train_loss: 0.4514, test_loss: 1.3003, test_f1: 0.6207
 epoch: 46, train_loss: 0.4393, test_loss: 1.3837, test_f1: 0.5914
 epoch: 47, train_loss: 0.4191, test_loss: 1.4382, test_f1: 0.5646
 epoch: 48, train_loss: 0.4227, test_loss: 1.4241, test_f1: 0.5967
 epoch: 49, train_loss: 0.4052, test_loss: 1.3934, test_f1: 0.5945
 epoch: 50, train_loss: 0.4170, test_loss: 1.5116, test_f1: 0.6040
 epoch: 51, train_loss: 0.3838, test_loss: 1.5059, test_f1: 0.5885
 epoch: 52, train_loss: 0.3803, test_loss: 1.5176, test_f1: 0.5893
 epoch: 53, train_loss: 0.3677, test_loss: 1.4945, test_f1: 0.6105
 epoch: 54, train_loss: 0.3468, test_loss: 1.4670, test_f1: 0.6168
 epoch: 55, train_loss: 0.3545, test_loss: 1.4713, test_f1: 0.6314
 epoch: 56, train_loss: 0.3418, test_loss: 1.5061, test_f1: 0.6157
 epoch: 57, train_loss: 0.3541, test_loss: 1.5155, test_f1: 0.6094
 epoch: 58, train_loss: 0.3254, test_loss: 1.5397, test_f1: 0.6307
 epoch: 59, train_loss: 0.3478, test_loss: 1.6418, test_f1: 0.5819
 epoch: 60, train_loss: 0.3228, test_loss: 1.6221, test_f1: 0.6050
 epoch: 61, train_loss: 0.3425, test_loss: 1.6248, test_f1: 0.5995
 epoch: 62, train_loss: 0.3268, test_loss: 1.7320, test_f1: 0.5924
 epoch: 63, train_loss: 0.3226, test_loss: 1.6586, test_f1: 0.6110
 epoch: 64, train_loss: 0.3192, test_loss: 1.5855, test_f1: 0.6299
 epoch: 65, train_loss: 0.3109, test_loss: 1.7015, test_f1: 0.6190
 epoch: 66, train_loss: 0.3009, test_loss: 1.7153, test_f1: 0.6042
 epoch: 67, train_loss: 0.2972, test_loss: 1.7394, test_f1: 0.6256
 epoch: 68, train_loss: 0.2895, test_loss: 1.7279, test_f1: 0.6005
 epoch: 69, train_loss: 0.3042, test_loss: 1.7720, test_f1: 0.6028
 epoch: 70, train_loss: 0.2890, test_loss: 1.7284, test_f1: 0.6186
 epoch: 71, train_loss: 0.2999, test_loss: 1.8042, test_f1: 0.6057
 epoch: 72, train_loss: 0.2834, test_loss: 1.7921, test_f1: 0.6002
 epoch: 73, train_loss: 0.2875, test_loss: 1.8281, test_f1: 0.5954
 epoch: 74, train_loss: 0.2787, test_loss: 1.8892, test_f1: 0.5896
 epoch: 75, train_loss: 0.2903, test_loss: 1.9186, test_f1: 0.6083
 epoch: 76, train_loss: 0.2550, test_loss: 1.8580, test_f1: 0.6078
 epoch: 77, train_loss: 0.2728, test_loss: 1.9437, test_f1: 0.5955
 epoch: 78, train_loss: 0.2660, test_loss: 1.9691, test_f1: 0.6019
 epoch: 79, train_loss: 0.2733, test_loss: 1.9221, test_f1: 0.6031
 epoch: 80, train_loss: 0.2857, test_loss: 1.9316, test_f1: 0.6048
 epoch: 81, train_loss: 0.2511, test_loss: 1.9742, test_f1: 0.6288
 epoch: 82, train_loss: 0.2709, test_loss: 2.1258, test_f1: 0.5940
 epoch: 83, train_loss: 0.2575, test_loss: 2.1169, test_f1: 0.5964
 epoch: 84, train_loss: 0.2768, test_loss: 2.1154, test_f1: 0.6060
 epoch: 85, train_loss: 0.2536, test_loss: 2.1231, test_f1: 0.6022
 epoch: 86, train_loss: 0.2533, test_loss: 2.1209, test_f1: 0.5938
 epoch: 87, train_loss: 0.2529, test_loss: 2.1190, test_f1: 0.5832
 epoch: 88, train_loss: 0.2479, test_loss: 2.1198, test_f1: 0.5987
 epoch: 89, train_loss: 0.2298, test_loss: 2.0512, test_f1: 0.5920
 epoch: 90, train_loss: 0.2431, test_loss: 2.1047, test_f1: 0.6004
 epoch: 91, train_loss: 0.2267, test_loss: 2.0843, test_f1: 0.6042
 epoch: 92, train_loss: 0.2210, test_loss: 2.0725, test_f1: 0.6066
 epoch: 93, train_loss: 0.2399, test_loss: 2.2196, test_f1: 0.5957
 epoch: 94, train_loss: 0.2432, test_loss: 2.0666, test_f1: 0.6225
 epoch: 95, train_loss: 0.2322, test_loss: 2.0756, test_f1: 0.6137
 epoch: 96, train_loss: 0.2288, test_loss: 2.2042, test_f1: 0.5971
 epoch: 97, train_loss: 0.2331, test_loss: 2.0877, test_f1: 0.6191
 epoch: 98, train_loss: 0.2227, test_loss: 2.1489, test_f1: 0.6049
 epoch: 99, train_loss: 0.2069, test_loss: 2.1386, test_f1: 0.5846
##################ITERATION #7 ****************************************
 epoch: 0, train_loss: 1.2393, test_loss: 1.3402, test_f1: 0.2354
 epoch: 1, train_loss: 1.0959, test_loss: 1.2683, test_f1: 0.2555
 epoch: 2, train_loss: 1.0582, test_loss: 1.1013, test_f1: 0.4396
 epoch: 3, train_loss: 0.9946, test_loss: 1.0672, test_f1: 0.5140
 epoch: 4, train_loss: 0.9628, test_loss: 1.0372, test_f1: 0.5761
 epoch: 5, train_loss: 0.9363, test_loss: 1.0543, test_f1: 0.5460
 epoch: 6, train_loss: 0.9079, test_loss: 1.0321, test_f1: 0.5705
 epoch: 7, train_loss: 0.8887, test_loss: 0.9961, test_f1: 0.5789
 epoch: 8, train_loss: 0.8611, test_loss: 0.9818, test_f1: 0.6312
 epoch: 9, train_loss: 0.8345, test_loss: 0.9734, test_f1: 0.6250
 epoch: 10, train_loss: 0.8387, test_loss: 0.9918, test_f1: 0.6206
 epoch: 11, train_loss: 0.8157, test_loss: 0.9773, test_f1: 0.6020
 epoch: 12, train_loss: 0.7864, test_loss: 0.9571, test_f1: 0.6536
 epoch: 13, train_loss: 0.7757, test_loss: 0.9746, test_f1: 0.5894
 epoch: 14, train_loss: 0.7687, test_loss: 0.9787, test_f1: 0.6302
 epoch: 15, train_loss: 0.7469, test_loss: 1.0356, test_f1: 0.5575
 epoch: 16, train_loss: 0.7436, test_loss: 1.0042, test_f1: 0.5785
 epoch: 17, train_loss: 0.7205, test_loss: 1.0286, test_f1: 0.6024
 epoch: 18, train_loss: 0.7049, test_loss: 1.1385, test_f1: 0.5521
 epoch: 19, train_loss: 0.6960, test_loss: 1.0537, test_f1: 0.5668
 epoch: 20, train_loss: 0.6780, test_loss: 1.0762, test_f1: 0.5955
 epoch: 21, train_loss: 0.6604, test_loss: 1.0744, test_f1: 0.5898
 epoch: 22, train_loss: 0.6542, test_loss: 1.0298, test_f1: 0.6144
 epoch: 23, train_loss: 0.6212, test_loss: 1.0475, test_f1: 0.6421
 epoch: 24, train_loss: 0.6421, test_loss: 1.0946, test_f1: 0.6201
 epoch: 25, train_loss: 0.6284, test_loss: 1.0530, test_f1: 0.6247
 epoch: 26, train_loss: 0.6266, test_loss: 1.0705, test_f1: 0.6006
 epoch: 27, train_loss: 0.5958, test_loss: 1.1255, test_f1: 0.5933
 epoch: 28, train_loss: 0.5853, test_loss: 1.0634, test_f1: 0.6146
 epoch: 29, train_loss: 0.5857, test_loss: 1.0936, test_f1: 0.6092
 epoch: 30, train_loss: 0.5868, test_loss: 1.1260, test_f1: 0.6233
 epoch: 31, train_loss: 0.5679, test_loss: 1.1150, test_f1: 0.6057
 epoch: 32, train_loss: 0.5597, test_loss: 1.2106, test_f1: 0.5840
 epoch: 33, train_loss: 0.5393, test_loss: 1.2954, test_f1: 0.5873
 epoch: 34, train_loss: 0.5205, test_loss: 1.4088, test_f1: 0.5628
 epoch: 35, train_loss: 0.5110, test_loss: 1.2176, test_f1: 0.5775
 epoch: 36, train_loss: 0.5190, test_loss: 1.2678, test_f1: 0.5948
 epoch: 37, train_loss: 0.4947, test_loss: 1.3401, test_f1: 0.5729
 epoch: 38, train_loss: 0.4878, test_loss: 1.3754, test_f1: 0.5947
 epoch: 39, train_loss: 0.4864, test_loss: 1.3902, test_f1: 0.5963
 epoch: 40, train_loss: 0.4770, test_loss: 1.3304, test_f1: 0.6052
 epoch: 41, train_loss: 0.4597, test_loss: 1.4676, test_f1: 0.5815
 epoch: 42, train_loss: 0.4605, test_loss: 1.3232, test_f1: 0.5935
 epoch: 43, train_loss: 0.4698, test_loss: 1.3540, test_f1: 0.5766
 epoch: 44, train_loss: 0.4603, test_loss: 1.3392, test_f1: 0.5843
 epoch: 45, train_loss: 0.4360, test_loss: 1.3539, test_f1: 0.6019
 epoch: 46, train_loss: 0.4415, test_loss: 1.3751, test_f1: 0.5789
 epoch: 47, train_loss: 0.4199, test_loss: 1.4095, test_f1: 0.6187
 epoch: 48, train_loss: 0.4209, test_loss: 1.4246, test_f1: 0.5915
 epoch: 49, train_loss: 0.4248, test_loss: 1.4621, test_f1: 0.5520
 epoch: 50, train_loss: 0.3989, test_loss: 1.2965, test_f1: 0.6128
 epoch: 51, train_loss: 0.3759, test_loss: 1.4070, test_f1: 0.5925
 epoch: 52, train_loss: 0.3645, test_loss: 1.4023, test_f1: 0.5970
 epoch: 53, train_loss: 0.3607, test_loss: 1.4796, test_f1: 0.6028
 epoch: 54, train_loss: 0.3648, test_loss: 1.4568, test_f1: 0.6101
 epoch: 55, train_loss: 0.3782, test_loss: 1.4326, test_f1: 0.6061
 epoch: 56, train_loss: 0.3667, test_loss: 1.6052, test_f1: 0.5821
 epoch: 57, train_loss: 0.3322, test_loss: 1.5741, test_f1: 0.5815
 epoch: 58, train_loss: 0.3436, test_loss: 1.6187, test_f1: 0.5858
 epoch: 59, train_loss: 0.3405, test_loss: 1.5667, test_f1: 0.6119
 epoch: 60, train_loss: 0.3323, test_loss: 1.5806, test_f1: 0.6038
 epoch: 61, train_loss: 0.3170, test_loss: 1.5414, test_f1: 0.6127
 epoch: 62, train_loss: 0.3344, test_loss: 1.5881, test_f1: 0.6099
 epoch: 63, train_loss: 0.3193, test_loss: 1.6514, test_f1: 0.6016
 epoch: 64, train_loss: 0.3195, test_loss: 1.6272, test_f1: 0.5935
 epoch: 65, train_loss: 0.3132, test_loss: 1.5723, test_f1: 0.6089
 epoch: 66, train_loss: 0.3027, test_loss: 1.6563, test_f1: 0.5915
 epoch: 67, train_loss: 0.3029, test_loss: 1.5454, test_f1: 0.6058
 epoch: 68, train_loss: 0.2838, test_loss: 1.6454, test_f1: 0.6070
 epoch: 69, train_loss: 0.2861, test_loss: 1.6325, test_f1: 0.5929
 epoch: 70, train_loss: 0.2782, test_loss: 1.6623, test_f1: 0.5851
 epoch: 71, train_loss: 0.2699, test_loss: 1.6521, test_f1: 0.5862
 epoch: 72, train_loss: 0.2963, test_loss: 1.7530, test_f1: 0.6143
 epoch: 73, train_loss: 0.3048, test_loss: 1.7722, test_f1: 0.6068
 epoch: 74, train_loss: 0.2833, test_loss: 1.7847, test_f1: 0.5878
 epoch: 75, train_loss: 0.2935, test_loss: 1.7701, test_f1: 0.6107
 epoch: 76, train_loss: 0.2889, test_loss: 1.6818, test_f1: 0.6011
 epoch: 77, train_loss: 0.3015, test_loss: 1.7909, test_f1: 0.5874
 epoch: 78, train_loss: 0.2707, test_loss: 1.7301, test_f1: 0.6025
 epoch: 79, train_loss: 0.2528, test_loss: 1.8120, test_f1: 0.5833
 epoch: 80, train_loss: 0.2507, test_loss: 1.7150, test_f1: 0.5932
 epoch: 81, train_loss: 0.2693, test_loss: 1.8454, test_f1: 0.5628
 epoch: 82, train_loss: 0.2638, test_loss: 1.8277, test_f1: 0.5689
 epoch: 83, train_loss: 0.2558, test_loss: 1.8610, test_f1: 0.5801
 epoch: 84, train_loss: 0.2556, test_loss: 1.8438, test_f1: 0.6032
 epoch: 85, train_loss: 0.2571, test_loss: 1.7487, test_f1: 0.5847
 epoch: 86, train_loss: 0.2369, test_loss: 1.8265, test_f1: 0.5834
 epoch: 87, train_loss: 0.2379, test_loss: 1.8669, test_f1: 0.5883
 epoch: 88, train_loss: 0.2545, test_loss: 1.7953, test_f1: 0.5834
 epoch: 89, train_loss: 0.2706, test_loss: 1.8737, test_f1: 0.5940
 epoch: 90, train_loss: 0.2360, test_loss: 1.7519, test_f1: 0.5779
 epoch: 91, train_loss: 0.2277, test_loss: 1.9258, test_f1: 0.5853
 epoch: 92, train_loss: 0.2409, test_loss: 1.8230, test_f1: 0.5956
 epoch: 93, train_loss: 0.2373, test_loss: 1.8110, test_f1: 0.5979
 epoch: 94, train_loss: 0.2231, test_loss: 1.8470, test_f1: 0.5856
 epoch: 95, train_loss: 0.2208, test_loss: 1.9907, test_f1: 0.5770
 epoch: 96, train_loss: 0.2081, test_loss: 1.8702, test_f1: 0.5993
 epoch: 97, train_loss: 0.2336, test_loss: 1.8864, test_f1: 0.6047
 epoch: 98, train_loss: 0.2278, test_loss: 1.9827, test_f1: 0.5739
 epoch: 99, train_loss: 0.2187, test_loss: 1.8712, test_f1: 0.5822
##################ITERATION #8 ****************************************
 epoch: 0, train_loss: 1.2423, test_loss: 1.2905, test_f1: 0.2281
 epoch: 1, train_loss: 1.1285, test_loss: 1.2887, test_f1: 0.3322
 epoch: 2, train_loss: 1.0722, test_loss: 1.3685, test_f1: 0.3503
 epoch: 3, train_loss: 1.0363, test_loss: 1.1853, test_f1: 0.5013
 epoch: 4, train_loss: 1.0182, test_loss: 1.0945, test_f1: 0.5737
 epoch: 5, train_loss: 0.9686, test_loss: 1.0669, test_f1: 0.5489
 epoch: 6, train_loss: 0.9517, test_loss: 1.0279, test_f1: 0.5428
 epoch: 7, train_loss: 0.9356, test_loss: 1.0266, test_f1: 0.5544
 epoch: 8, train_loss: 0.8943, test_loss: 0.9955, test_f1: 0.5723
 epoch: 9, train_loss: 0.8798, test_loss: 0.9930, test_f1: 0.5882
 epoch: 10, train_loss: 0.8668, test_loss: 0.9929, test_f1: 0.6121
 epoch: 11, train_loss: 0.8729, test_loss: 0.9752, test_f1: 0.6011
 epoch: 12, train_loss: 0.8456, test_loss: 1.0082, test_f1: 0.5955
 epoch: 13, train_loss: 0.8232, test_loss: 0.9725, test_f1: 0.6110
 epoch: 14, train_loss: 0.8117, test_loss: 0.9621, test_f1: 0.5925
 epoch: 15, train_loss: 0.8025, test_loss: 1.1398, test_f1: 0.5864
 epoch: 16, train_loss: 0.7882, test_loss: 0.9634, test_f1: 0.6073
 epoch: 17, train_loss: 0.7698, test_loss: 0.9793, test_f1: 0.5662
 epoch: 18, train_loss: 0.7457, test_loss: 0.9635, test_f1: 0.6067
 epoch: 19, train_loss: 0.7366, test_loss: 0.9698, test_f1: 0.6016
 epoch: 20, train_loss: 0.7054, test_loss: 0.9794, test_f1: 0.6001
 epoch: 21, train_loss: 0.7073, test_loss: 1.0233, test_f1: 0.6079
 epoch: 22, train_loss: 0.7060, test_loss: 0.9846, test_f1: 0.5859
 epoch: 23, train_loss: 0.6875, test_loss: 1.0199, test_f1: 0.5683
 epoch: 24, train_loss: 0.6647, test_loss: 0.9453, test_f1: 0.6136
 epoch: 25, train_loss: 0.6477, test_loss: 0.9793, test_f1: 0.6210
 epoch: 26, train_loss: 0.6497, test_loss: 0.9885, test_f1: 0.5981
 epoch: 27, train_loss: 0.6245, test_loss: 0.9902, test_f1: 0.6009
 epoch: 28, train_loss: 0.6020, test_loss: 1.0149, test_f1: 0.6070
 epoch: 29, train_loss: 0.6152, test_loss: 1.0505, test_f1: 0.5793
 epoch: 30, train_loss: 0.6096, test_loss: 1.0265, test_f1: 0.5725
 epoch: 31, train_loss: 0.6061, test_loss: 1.0636, test_f1: 0.5958
 epoch: 32, train_loss: 0.5666, test_loss: 1.0465, test_f1: 0.5907
 epoch: 33, train_loss: 0.5706, test_loss: 1.0084, test_f1: 0.6093
 epoch: 34, train_loss: 0.5562, test_loss: 1.0244, test_f1: 0.6469
 epoch: 35, train_loss: 0.5460, test_loss: 1.0419, test_f1: 0.6172
 epoch: 36, train_loss: 0.5569, test_loss: 1.1924, test_f1: 0.5862
 epoch: 37, train_loss: 0.5514, test_loss: 1.0014, test_f1: 0.6064
 epoch: 38, train_loss: 0.5385, test_loss: 1.0644, test_f1: 0.6265
 epoch: 39, train_loss: 0.5078, test_loss: 1.0462, test_f1: 0.5991
 epoch: 40, train_loss: 0.5150, test_loss: 1.0716, test_f1: 0.6110
 epoch: 41, train_loss: 0.5070, test_loss: 1.1108, test_f1: 0.5977
 epoch: 42, train_loss: 0.4791, test_loss: 1.0943, test_f1: 0.6036
 epoch: 43, train_loss: 0.4608, test_loss: 1.1070, test_f1: 0.6123
 epoch: 44, train_loss: 0.4583, test_loss: 1.2238, test_f1: 0.5914
 epoch: 45, train_loss: 0.4776, test_loss: 1.1504, test_f1: 0.6170
 epoch: 46, train_loss: 0.4641, test_loss: 1.1141, test_f1: 0.6295
 epoch: 47, train_loss: 0.4424, test_loss: 1.1894, test_f1: 0.6069
 epoch: 48, train_loss: 0.4538, test_loss: 1.1574, test_f1: 0.6161
 epoch: 49, train_loss: 0.4341, test_loss: 1.1360, test_f1: 0.6173
 epoch: 50, train_loss: 0.4357, test_loss: 1.1720, test_f1: 0.6013
 epoch: 51, train_loss: 0.3918, test_loss: 1.1721, test_f1: 0.6106
 epoch: 52, train_loss: 0.4001, test_loss: 1.1962, test_f1: 0.6322
 epoch: 53, train_loss: 0.3899, test_loss: 1.1816, test_f1: 0.6363
 epoch: 54, train_loss: 0.4002, test_loss: 1.1673, test_f1: 0.6176
 epoch: 55, train_loss: 0.3867, test_loss: 1.2161, test_f1: 0.6334
 epoch: 56, train_loss: 0.3721, test_loss: 1.2379, test_f1: 0.6109
 epoch: 57, train_loss: 0.3708, test_loss: 1.3009, test_f1: 0.6124
 epoch: 58, train_loss: 0.3612, test_loss: 1.2645, test_f1: 0.6165
 epoch: 59, train_loss: 0.3560, test_loss: 1.3111, test_f1: 0.5949
 epoch: 60, train_loss: 0.3670, test_loss: 1.2405, test_f1: 0.6251
 epoch: 61, train_loss: 0.3627, test_loss: 1.2562, test_f1: 0.6336
 epoch: 62, train_loss: 0.3454, test_loss: 1.3238, test_f1: 0.6388
 epoch: 63, train_loss: 0.3289, test_loss: 1.3080, test_f1: 0.6249
 epoch: 64, train_loss: 0.3591, test_loss: 1.3043, test_f1: 0.6459
 epoch: 65, train_loss: 0.3361, test_loss: 1.2988, test_f1: 0.6161
 epoch: 66, train_loss: 0.3250, test_loss: 1.3376, test_f1: 0.6193
 epoch: 67, train_loss: 0.3247, test_loss: 1.3785, test_f1: 0.6142
 epoch: 68, train_loss: 0.3213, test_loss: 1.3935, test_f1: 0.5986
 epoch: 69, train_loss: 0.3126, test_loss: 1.4457, test_f1: 0.6004
 epoch: 70, train_loss: 0.3171, test_loss: 1.4288, test_f1: 0.5899
 epoch: 71, train_loss: 0.3155, test_loss: 1.4205, test_f1: 0.6078
 epoch: 72, train_loss: 0.3034, test_loss: 1.4054, test_f1: 0.6130
 epoch: 73, train_loss: 0.3084, test_loss: 1.4250, test_f1: 0.5940
 epoch: 74, train_loss: 0.3015, test_loss: 1.4109, test_f1: 0.6090
 epoch: 75, train_loss: 0.3055, test_loss: 1.4866, test_f1: 0.6026
 epoch: 76, train_loss: 0.2956, test_loss: 1.4722, test_f1: 0.5996
 epoch: 77, train_loss: 0.2948, test_loss: 1.4977, test_f1: 0.6173
 epoch: 78, train_loss: 0.2932, test_loss: 1.5540, test_f1: 0.6080
 epoch: 79, train_loss: 0.2719, test_loss: 1.5034, test_f1: 0.6198
 epoch: 80, train_loss: 0.2764, test_loss: 1.4787, test_f1: 0.6046
 epoch: 81, train_loss: 0.2908, test_loss: 1.5433, test_f1: 0.6023
 epoch: 82, train_loss: 0.2962, test_loss: 1.5688, test_f1: 0.6047
 epoch: 83, train_loss: 0.2755, test_loss: 1.6089, test_f1: 0.6069
 epoch: 84, train_loss: 0.2788, test_loss: 1.5854, test_f1: 0.6037
 epoch: 85, train_loss: 0.2760, test_loss: 1.5741, test_f1: 0.6058
 epoch: 86, train_loss: 0.2759, test_loss: 1.5797, test_f1: 0.6061
 epoch: 87, train_loss: 0.2643, test_loss: 1.6023, test_f1: 0.6018
 epoch: 88, train_loss: 0.2780, test_loss: 1.6748, test_f1: 0.6156
 epoch: 89, train_loss: 0.2641, test_loss: 1.5113, test_f1: 0.6132
 epoch: 90, train_loss: 0.2791, test_loss: 1.6757, test_f1: 0.6015
 epoch: 91, train_loss: 0.2573, test_loss: 1.6146, test_f1: 0.6351
 epoch: 92, train_loss: 0.2574, test_loss: 1.6244, test_f1: 0.6336
 epoch: 93, train_loss: 0.2544, test_loss: 1.6183, test_f1: 0.5984
 epoch: 94, train_loss: 0.2455, test_loss: 1.7132, test_f1: 0.6076
 epoch: 95, train_loss: 0.2620, test_loss: 1.6410, test_f1: 0.6033
 epoch: 96, train_loss: 0.2580, test_loss: 1.7191, test_f1: 0.5970
 epoch: 97, train_loss: 0.2392, test_loss: 1.6961, test_f1: 0.5948
 epoch: 98, train_loss: 0.2301, test_loss: 1.6490, test_f1: 0.6351
 epoch: 99, train_loss: 0.2363, test_loss: 1.6682, test_f1: 0.6175
##################ITERATION #9 ****************************************
 epoch: 0, train_loss: 1.2797, test_loss: 1.3206, test_f1: 0.2281
 epoch: 1, train_loss: 1.1106, test_loss: 1.3785, test_f1: 0.3326
 epoch: 2, train_loss: 1.0542, test_loss: 1.2212, test_f1: 0.4761
 epoch: 3, train_loss: 1.0212, test_loss: 1.1726, test_f1: 0.5335
 epoch: 4, train_loss: 1.0002, test_loss: 1.0940, test_f1: 0.5415
 epoch: 5, train_loss: 0.9438, test_loss: 1.1092, test_f1: 0.5547
 epoch: 6, train_loss: 0.9328, test_loss: 1.1169, test_f1: 0.5734
 epoch: 7, train_loss: 0.9080, test_loss: 1.1019, test_f1: 0.5649
 epoch: 8, train_loss: 0.8933, test_loss: 1.0399, test_f1: 0.5578
 epoch: 9, train_loss: 0.8605, test_loss: 1.2184, test_f1: 0.5836
 epoch: 10, train_loss: 0.8380, test_loss: 1.3391, test_f1: 0.5880
 epoch: 11, train_loss: 0.8241, test_loss: 1.0875, test_f1: 0.5978
 epoch: 12, train_loss: 0.8097, test_loss: 1.0844, test_f1: 0.5911
 epoch: 13, train_loss: 0.8141, test_loss: 1.0626, test_f1: 0.6055
 epoch: 14, train_loss: 0.7739, test_loss: 1.0560, test_f1: 0.6020
 epoch: 15, train_loss: 0.7707, test_loss: 1.0270, test_f1: 0.5876
 epoch: 16, train_loss: 0.7633, test_loss: 1.0625, test_f1: 0.6081
 epoch: 17, train_loss: 0.7524, test_loss: 1.0515, test_f1: 0.5950
 epoch: 18, train_loss: 0.7414, test_loss: 1.0340, test_f1: 0.6278
 epoch: 19, train_loss: 0.7241, test_loss: 1.0323, test_f1: 0.6394
 epoch: 20, train_loss: 0.6960, test_loss: 1.0420, test_f1: 0.6383
 epoch: 21, train_loss: 0.6884, test_loss: 1.0150, test_f1: 0.6352
 epoch: 22, train_loss: 0.6877, test_loss: 1.0506, test_f1: 0.6811
 epoch: 23, train_loss: 0.6573, test_loss: 1.0961, test_f1: 0.6326
 epoch: 24, train_loss: 0.6500, test_loss: 1.0865, test_f1: 0.5930
 epoch: 25, train_loss: 0.6379, test_loss: 1.0519, test_f1: 0.6377
 epoch: 26, train_loss: 0.6273, test_loss: 1.1910, test_f1: 0.6039
 epoch: 27, train_loss: 0.6345, test_loss: 1.1515, test_f1: 0.6179
 epoch: 28, train_loss: 0.6241, test_loss: 1.0819, test_f1: 0.6583
 epoch: 29, train_loss: 0.5924, test_loss: 1.1570, test_f1: 0.6291
 epoch: 30, train_loss: 0.6059, test_loss: 1.1643, test_f1: 0.6234
 epoch: 31, train_loss: 0.5716, test_loss: 1.1679, test_f1: 0.6550
 epoch: 32, train_loss: 0.5671, test_loss: 1.2064, test_f1: 0.6355
 epoch: 33, train_loss: 0.5765, test_loss: 1.1236, test_f1: 0.6538
 epoch: 34, train_loss: 0.5580, test_loss: 1.2937, test_f1: 0.6167
 epoch: 35, train_loss: 0.5389, test_loss: 1.3150, test_f1: 0.6231
 epoch: 36, train_loss: 0.5259, test_loss: 1.2067, test_f1: 0.6192
 epoch: 37, train_loss: 0.5350, test_loss: 1.1888, test_f1: 0.6346
 epoch: 38, train_loss: 0.5244, test_loss: 1.2031, test_f1: 0.6442
 epoch: 39, train_loss: 0.5164, test_loss: 1.2800, test_f1: 0.6339
 epoch: 40, train_loss: 0.4924, test_loss: 1.2560, test_f1: 0.6465
 epoch: 41, train_loss: 0.4802, test_loss: 1.2833, test_f1: 0.6451
 epoch: 42, train_loss: 0.4549, test_loss: 1.4477, test_f1: 0.6337
 epoch: 43, train_loss: 0.4752, test_loss: 1.3711, test_f1: 0.6470
 epoch: 44, train_loss: 0.4471, test_loss: 1.2758, test_f1: 0.6277
 epoch: 45, train_loss: 0.4750, test_loss: 1.4823, test_f1: 0.6281
 epoch: 46, train_loss: 0.4684, test_loss: 1.3493, test_f1: 0.6430
 epoch: 47, train_loss: 0.4273, test_loss: 1.4967, test_f1: 0.6498
 epoch: 48, train_loss: 0.4202, test_loss: 1.5028, test_f1: 0.6033
 epoch: 49, train_loss: 0.4276, test_loss: 1.4195, test_f1: 0.6311
 epoch: 50, train_loss: 0.4244, test_loss: 1.4295, test_f1: 0.6409
 epoch: 51, train_loss: 0.3871, test_loss: 1.6951, test_f1: 0.6222
 epoch: 52, train_loss: 0.3734, test_loss: 1.5698, test_f1: 0.6380
 epoch: 53, train_loss: 0.3663, test_loss: 1.5518, test_f1: 0.6407
 epoch: 54, train_loss: 0.3644, test_loss: 1.5440, test_f1: 0.6366
 epoch: 55, train_loss: 0.3621, test_loss: 1.5272, test_f1: 0.6286
 epoch: 56, train_loss: 0.3524, test_loss: 1.6071, test_f1: 0.6213
 epoch: 57, train_loss: 0.3585, test_loss: 1.5619, test_f1: 0.6197
 epoch: 58, train_loss: 0.3719, test_loss: 1.5203, test_f1: 0.6388
 epoch: 59, train_loss: 0.3435, test_loss: 1.6386, test_f1: 0.6460
 epoch: 60, train_loss: 0.3517, test_loss: 1.5389, test_f1: 0.6385
 epoch: 61, train_loss: 0.3593, test_loss: 1.5344, test_f1: 0.6649
 epoch: 62, train_loss: 0.3488, test_loss: 1.5636, test_f1: 0.5926
 epoch: 63, train_loss: 0.3424, test_loss: 1.5091, test_f1: 0.6213
 epoch: 64, train_loss: 0.3295, test_loss: 1.5683, test_f1: 0.6225
 epoch: 65, train_loss: 0.3156, test_loss: 1.5739, test_f1: 0.6324
 epoch: 66, train_loss: 0.3434, test_loss: 1.6653, test_f1: 0.6003
 epoch: 67, train_loss: 0.3383, test_loss: 1.6528, test_f1: 0.6289
 epoch: 68, train_loss: 0.3209, test_loss: 1.7825, test_f1: 0.6093
 epoch: 69, train_loss: 0.3133, test_loss: 1.7692, test_f1: 0.5977
 epoch: 70, train_loss: 0.3011, test_loss: 1.7056, test_f1: 0.6065
 epoch: 71, train_loss: 0.3078, test_loss: 1.6890, test_f1: 0.6141
 epoch: 72, train_loss: 0.2952, test_loss: 1.6453, test_f1: 0.6450
 epoch: 73, train_loss: 0.2988, test_loss: 1.6159, test_f1: 0.6139
 epoch: 74, train_loss: 0.3062, test_loss: 1.7374, test_f1: 0.5990
 epoch: 75, train_loss: 0.2966, test_loss: 1.8239, test_f1: 0.6040
 epoch: 76, train_loss: 0.3025, test_loss: 1.6341, test_f1: 0.6166
 epoch: 77, train_loss: 0.2913, test_loss: 1.7267, test_f1: 0.6230
 epoch: 78, train_loss: 0.2770, test_loss: 1.5556, test_f1: 0.6436
 epoch: 79, train_loss: 0.2897, test_loss: 1.6660, test_f1: 0.6308
 epoch: 80, train_loss: 0.2701, test_loss: 1.6883, test_f1: 0.6220
 epoch: 81, train_loss: 0.2817, test_loss: 1.7912, test_f1: 0.6245
 epoch: 82, train_loss: 0.2650, test_loss: 1.8585, test_f1: 0.5970
 epoch: 83, train_loss: 0.2617, test_loss: 1.7075, test_f1: 0.5911
 epoch: 84, train_loss: 0.2642, test_loss: 1.6918, test_f1: 0.6113
 epoch: 85, train_loss: 0.2700, test_loss: 1.7553, test_f1: 0.6001
 epoch: 86, train_loss: 0.2768, test_loss: 1.7127, test_f1: 0.6046
 epoch: 87, train_loss: 0.2552, test_loss: 1.7234, test_f1: 0.6037
 epoch: 88, train_loss: 0.2483, test_loss: 1.6926, test_f1: 0.6260
 epoch: 89, train_loss: 0.2562, test_loss: 1.7715, test_f1: 0.6007
 epoch: 90, train_loss: 0.2384, test_loss: 1.7839, test_f1: 0.6168
 epoch: 91, train_loss: 0.2743, test_loss: 1.8586, test_f1: 0.6056
 epoch: 92, train_loss: 0.2594, test_loss: 1.7493, test_f1: 0.6076
 epoch: 93, train_loss: 0.2538, test_loss: 1.7342, test_f1: 0.6139
 epoch: 94, train_loss: 0.2525, test_loss: 1.7852, test_f1: 0.6090
 epoch: 95, train_loss: 0.2340, test_loss: 1.8241, test_f1: 0.6323
 epoch: 96, train_loss: 0.2543, test_loss: 1.7745, test_f1: 0.6017
 epoch: 97, train_loss: 0.2457, test_loss: 1.7835, test_f1: 0.5925
 epoch: 98, train_loss: 0.2639, test_loss: 1.8771, test_f1: 0.6080
 epoch: 99, train_loss: 0.2237, test_loss: 1.8042, test_f1: 0.6123

Training completed in 564.39 seconds
Best F1: 0.6811 at epoch 22
Mean F1 across iterations: 0.6528  0.0131
========================FINAL RESULTS================================
FEGIN weighted F1: 0.6811  0.0131
python main.py --data ltspice_demos --representation component_pin --model FEGIN --layers 6 --hiddens 128 --batch_size 64 --lr 0.0001 --emb_size 512 --epochs 100 --save_appendix component_pin_L6_H128_BS64_LR0.0001_E512 --no_val
-----



STDERR:
  File "main.py", line 370, in <module>
    main()
  File "main.py", line 254, in main
    dataset = dataset_class(
  File "/home/philip/projects/ltspice_examples_code_repo/Circuit-Completion-Using-GNNs/component_classification_with_link_prediction_head/evaluation/FEGIN/kernel/circuit_datasets.py", line 15, in __init__
    self.data, self.slices = torch.load(self.processed_paths[0])
  File "/home/philip/.local/lib/python3.8/site-packages/torch/serialization.py", line 1040, in load
    warnings.warn(
  File "/usr/lib/python3.8/warnings.py", line 109, in _showwarnmsg
    sw(msg.message, msg.category, msg.filename, msg.lineno,
  File "main.py", line 47, in warn_with_traceback
    traceback.print_stack(file=log)
/home/philip/projects/ltspice_examples_code_repo/Circuit-Completion-Using-GNNs/component_classification_with_link_prediction_head/evaluation/FEGIN/kernel/circuit_datasets.py:15: FutureWarning: You are using `torch.load` with `weights_only=False` (the current default value), which uses the default pickle module implicitly. It is possible to construct malicious pickle data which will execute arbitrary code during unpickling (See https://github.com/pytorch/pytorch/blob/main/SECURITY.md#untrusted-models for more details). In a future release, the default value for `weights_only` will be flipped to `True`. This limits the functions that could be executed during unpickling. Arbitrary objects will no longer be allowed to be loaded via this mode unless they are explicitly allowlisted by the user via `torch.serialization.add_safe_globals`. We recommend you start setting `weights_only=True` for any use case where you don't have full control of the loaded file. Please open an issue on GitHub for any issues related to this experimental feature.
  self.data, self.slices = torch.load(self.processed_paths[0])
