STDOUT:
Results will be saved in /home/philip/projects/ltspice_examples_code_repo/Circuit-Completion-Using-GNNs/component_classification_with_link_prediction_head/evaluation/FEGIN/results/model_FEGIN_dataset_ltspice_demos
Command line input: python main.py --data ltspice_demos --representation component_pin --model FEGIN --layers 6 --hiddens 128 --batch_size 64 --lr 0.0001 --emb_size 512 --epochs 100 --save_appendix component_pin_L6_H128_BS64_LR0.0001_E512 --no_val
 is saved.
-----
ltspice_demos - FEGIN
Using 6 layers, 128 hidden units, h = 2
Loading component_pin representation dataset
ENTERED
Training FEGIN on component_pin representation
Train: 1565, Test: 383
##################ITERATION #0 ****************************************
 epoch: 0, train_loss: 1.3718, test_loss: 1.3675, test_f1: 0.2281
 epoch: 1, train_loss: 1.3487, test_loss: 1.3524, test_f1: 0.2281
 epoch: 2, train_loss: 1.3233, test_loss: 1.3327, test_f1: 0.2281
 epoch: 3, train_loss: 1.2862, test_loss: 1.2974, test_f1: 0.2583
 epoch: 4, train_loss: 1.2398, test_loss: 1.2632, test_f1: 0.2789
 epoch: 5, train_loss: 1.1923, test_loss: 1.2348, test_f1: 0.3426
 epoch: 6, train_loss: 1.1563, test_loss: 1.2038, test_f1: 0.3426
 epoch: 7, train_loss: 1.1255, test_loss: 1.1743, test_f1: 0.3951
 epoch: 8, train_loss: 1.0999, test_loss: 1.1506, test_f1: 0.4410
 epoch: 9, train_loss: 1.0653, test_loss: 1.1313, test_f1: 0.4702
 epoch: 10, train_loss: 1.0364, test_loss: 1.0949, test_f1: 0.4810
 epoch: 11, train_loss: 1.0001, test_loss: 1.0709, test_f1: 0.4616
 epoch: 12, train_loss: 0.9623, test_loss: 1.0564, test_f1: 0.4735
 epoch: 13, train_loss: 0.9345, test_loss: 1.0113, test_f1: 0.5249
 epoch: 14, train_loss: 0.9123, test_loss: 1.0192, test_f1: 0.5594
 epoch: 15, train_loss: 0.8779, test_loss: 0.9896, test_f1: 0.5731
 epoch: 16, train_loss: 0.8660, test_loss: 0.9889, test_f1: 0.5653
 epoch: 17, train_loss: 0.8436, test_loss: 0.9733, test_f1: 0.5720
 epoch: 18, train_loss: 0.8261, test_loss: 0.9773, test_f1: 0.5636
 epoch: 19, train_loss: 0.8197, test_loss: 0.9846, test_f1: 0.5786
 epoch: 20, train_loss: 0.8009, test_loss: 0.9781, test_f1: 0.5868
 epoch: 21, train_loss: 0.7732, test_loss: 0.9995, test_f1: 0.5663
 epoch: 22, train_loss: 0.7640, test_loss: 0.9999, test_f1: 0.5845
 epoch: 23, train_loss: 0.7423, test_loss: 0.9800, test_f1: 0.5764
 epoch: 24, train_loss: 0.7383, test_loss: 1.0246, test_f1: 0.5699
 epoch: 25, train_loss: 0.7233, test_loss: 0.9922, test_f1: 0.5925
 epoch: 26, train_loss: 0.7052, test_loss: 0.9946, test_f1: 0.6170
 epoch: 27, train_loss: 0.6789, test_loss: 1.0498, test_f1: 0.5837
 epoch: 28, train_loss: 0.6729, test_loss: 1.0550, test_f1: 0.5885
 epoch: 29, train_loss: 0.6649, test_loss: 1.0374, test_f1: 0.6054
 epoch: 30, train_loss: 0.6560, test_loss: 1.0597, test_f1: 0.6126
 epoch: 31, train_loss: 0.6501, test_loss: 1.0216, test_f1: 0.5963
 epoch: 32, train_loss: 0.6524, test_loss: 1.0609, test_f1: 0.5946
 epoch: 33, train_loss: 0.6325, test_loss: 1.0590, test_f1: 0.6021
 epoch: 34, train_loss: 0.6257, test_loss: 1.0950, test_f1: 0.6039
 epoch: 35, train_loss: 0.6052, test_loss: 1.0933, test_f1: 0.5968
 epoch: 36, train_loss: 0.6081, test_loss: 1.1454, test_f1: 0.5778
 epoch: 37, train_loss: 0.6074, test_loss: 1.0692, test_f1: 0.6114
 epoch: 38, train_loss: 0.6083, test_loss: 1.1002, test_f1: 0.5911
 epoch: 39, train_loss: 0.5844, test_loss: 1.1266, test_f1: 0.6026
 epoch: 40, train_loss: 0.5657, test_loss: 1.1315, test_f1: 0.6130
 epoch: 41, train_loss: 0.5683, test_loss: 1.1530, test_f1: 0.6089
 epoch: 42, train_loss: 0.5595, test_loss: 1.0851, test_f1: 0.6396
 epoch: 43, train_loss: 0.5414, test_loss: 1.1228, test_f1: 0.6057
 epoch: 44, train_loss: 0.5459, test_loss: 1.0985, test_f1: 0.6347
 epoch: 45, train_loss: 0.5374, test_loss: 1.1874, test_f1: 0.6106
 epoch: 46, train_loss: 0.5252, test_loss: 1.1774, test_f1: 0.6130
 epoch: 47, train_loss: 0.5329, test_loss: 1.2013, test_f1: 0.6288
 epoch: 48, train_loss: 0.5235, test_loss: 1.2130, test_f1: 0.5948
 epoch: 49, train_loss: 0.5263, test_loss: 1.1890, test_f1: 0.6069
 epoch: 50, train_loss: 0.5192, test_loss: 1.2771, test_f1: 0.5590
 epoch: 51, train_loss: 0.4839, test_loss: 1.2345, test_f1: 0.5758
 epoch: 52, train_loss: 0.4953, test_loss: 1.1871, test_f1: 0.6214
 epoch: 53, train_loss: 0.4858, test_loss: 1.2342, test_f1: 0.5928
 epoch: 54, train_loss: 0.4868, test_loss: 1.2081, test_f1: 0.6122
 epoch: 55, train_loss: 0.4584, test_loss: 1.1935, test_f1: 0.5955
 epoch: 56, train_loss: 0.4643, test_loss: 1.2173, test_f1: 0.5999
 epoch: 57, train_loss: 0.4524, test_loss: 1.2349, test_f1: 0.5817
 epoch: 58, train_loss: 0.4581, test_loss: 1.2460, test_f1: 0.5785
 epoch: 59, train_loss: 0.4387, test_loss: 1.2313, test_f1: 0.6097
 epoch: 60, train_loss: 0.4382, test_loss: 1.2939, test_f1: 0.5903
 epoch: 61, train_loss: 0.4358, test_loss: 1.2417, test_f1: 0.5801
 epoch: 62, train_loss: 0.4381, test_loss: 1.2680, test_f1: 0.6012
 epoch: 63, train_loss: 0.4318, test_loss: 1.3260, test_f1: 0.5819
 epoch: 64, train_loss: 0.4241, test_loss: 1.3129, test_f1: 0.6023
 epoch: 65, train_loss: 0.4356, test_loss: 1.3270, test_f1: 0.6048
 epoch: 66, train_loss: 0.4283, test_loss: 1.2735, test_f1: 0.5964
 epoch: 67, train_loss: 0.4028, test_loss: 1.3417, test_f1: 0.5842
 epoch: 68, train_loss: 0.4030, test_loss: 1.2904, test_f1: 0.5878
 epoch: 69, train_loss: 0.3909, test_loss: 1.3497, test_f1: 0.5889
 epoch: 70, train_loss: 0.3993, test_loss: 1.3012, test_f1: 0.6298
 epoch: 71, train_loss: 0.3930, test_loss: 1.3497, test_f1: 0.6098
 epoch: 72, train_loss: 0.3945, test_loss: 1.3643, test_f1: 0.6037
 epoch: 73, train_loss: 0.3960, test_loss: 1.3694, test_f1: 0.5952
 epoch: 74, train_loss: 0.3981, test_loss: 1.4573, test_f1: 0.5890
 epoch: 75, train_loss: 0.4035, test_loss: 1.3369, test_f1: 0.6055
 epoch: 76, train_loss: 0.3936, test_loss: 1.3373, test_f1: 0.6062
 epoch: 77, train_loss: 0.3864, test_loss: 1.4225, test_f1: 0.5972
 epoch: 78, train_loss: 0.3573, test_loss: 1.4041, test_f1: 0.6040
 epoch: 79, train_loss: 0.3741, test_loss: 1.4136, test_f1: 0.5916
 epoch: 80, train_loss: 0.3839, test_loss: 1.4045, test_f1: 0.5903
 epoch: 81, train_loss: 0.3579, test_loss: 1.4010, test_f1: 0.6210
 epoch: 82, train_loss: 0.3670, test_loss: 1.3939, test_f1: 0.6120
 epoch: 83, train_loss: 0.3471, test_loss: 1.4197, test_f1: 0.6084
 epoch: 84, train_loss: 0.3507, test_loss: 1.4375, test_f1: 0.6081
 epoch: 85, train_loss: 0.3381, test_loss: 1.4885, test_f1: 0.6089
 epoch: 86, train_loss: 0.3364, test_loss: 1.4492, test_f1: 0.6111
 epoch: 87, train_loss: 0.3404, test_loss: 1.4937, test_f1: 0.6008
 epoch: 88, train_loss: 0.3196, test_loss: 1.4562, test_f1: 0.6033
 epoch: 89, train_loss: 0.3436, test_loss: 1.4882, test_f1: 0.5895
 epoch: 90, train_loss: 0.3419, test_loss: 1.5264, test_f1: 0.6014
 epoch: 91, train_loss: 0.3291, test_loss: 1.5040, test_f1: 0.6008
 epoch: 92, train_loss: 0.3380, test_loss: 1.5704, test_f1: 0.6242
 epoch: 93, train_loss: 0.3407, test_loss: 1.6564, test_f1: 0.5869
 epoch: 94, train_loss: 0.3164, test_loss: 1.5607, test_f1: 0.6049
 epoch: 95, train_loss: 0.3197, test_loss: 1.5582, test_f1: 0.5943
 epoch: 96, train_loss: 0.3159, test_loss: 1.6564, test_f1: 0.5791
 epoch: 97, train_loss: 0.3052, test_loss: 1.5334, test_f1: 0.6058
 epoch: 98, train_loss: 0.3109, test_loss: 1.5971, test_f1: 0.5930
 epoch: 99, train_loss: 0.3108, test_loss: 1.6546, test_f1: 0.5962
##################ITERATION #1 ****************************************
 epoch: 0, train_loss: 1.3081, test_loss: 1.3163, test_f1: 0.2281
 epoch: 1, train_loss: 1.2302, test_loss: 1.2930, test_f1: 0.2285
 epoch: 2, train_loss: 1.1911, test_loss: 1.2475, test_f1: 0.2577
 epoch: 3, train_loss: 1.1521, test_loss: 1.2015, test_f1: 0.3131
 epoch: 4, train_loss: 1.1135, test_loss: 1.1672, test_f1: 0.4307
 epoch: 5, train_loss: 1.0768, test_loss: 1.1260, test_f1: 0.4677
 epoch: 6, train_loss: 1.0375, test_loss: 1.0750, test_f1: 0.5237
 epoch: 7, train_loss: 0.9987, test_loss: 1.0567, test_f1: 0.5197
 epoch: 8, train_loss: 0.9640, test_loss: 1.0329, test_f1: 0.5282
 epoch: 9, train_loss: 0.9245, test_loss: 1.0216, test_f1: 0.5568
 epoch: 10, train_loss: 0.9061, test_loss: 1.0018, test_f1: 0.5532
 epoch: 11, train_loss: 0.8725, test_loss: 0.9971, test_f1: 0.5839
 epoch: 12, train_loss: 0.8491, test_loss: 1.0078, test_f1: 0.5775
 epoch: 13, train_loss: 0.8213, test_loss: 1.0014, test_f1: 0.6008
 epoch: 14, train_loss: 0.8100, test_loss: 1.0245, test_f1: 0.5823
 epoch: 15, train_loss: 0.7850, test_loss: 1.0108, test_f1: 0.5833
 epoch: 16, train_loss: 0.7775, test_loss: 1.0342, test_f1: 0.5804
 epoch: 17, train_loss: 0.7543, test_loss: 1.0402, test_f1: 0.6109
 epoch: 18, train_loss: 0.7352, test_loss: 1.0002, test_f1: 0.6042
 epoch: 19, train_loss: 0.7202, test_loss: 1.0347, test_f1: 0.5901
 epoch: 20, train_loss: 0.7212, test_loss: 1.0504, test_f1: 0.5841
 epoch: 21, train_loss: 0.7066, test_loss: 1.0322, test_f1: 0.5951
 epoch: 22, train_loss: 0.6971, test_loss: 0.9968, test_f1: 0.5825
 epoch: 23, train_loss: 0.6689, test_loss: 1.0397, test_f1: 0.6100
 epoch: 24, train_loss: 0.6670, test_loss: 0.9846, test_f1: 0.6068
 epoch: 25, train_loss: 0.6488, test_loss: 1.0260, test_f1: 0.6060
 epoch: 26, train_loss: 0.6337, test_loss: 1.0861, test_f1: 0.5751
 epoch: 27, train_loss: 0.6545, test_loss: 1.0430, test_f1: 0.5963
 epoch: 28, train_loss: 0.6173, test_loss: 1.0474, test_f1: 0.5900
 epoch: 29, train_loss: 0.6042, test_loss: 1.0371, test_f1: 0.5879
 epoch: 30, train_loss: 0.5851, test_loss: 1.0442, test_f1: 0.5864
 epoch: 31, train_loss: 0.6014, test_loss: 1.0625, test_f1: 0.6081
 epoch: 32, train_loss: 0.5714, test_loss: 1.0300, test_f1: 0.6205
 epoch: 33, train_loss: 0.5724, test_loss: 1.0547, test_f1: 0.6158
 epoch: 34, train_loss: 0.5606, test_loss: 1.0894, test_f1: 0.6248
 epoch: 35, train_loss: 0.5650, test_loss: 1.0815, test_f1: 0.6030
 epoch: 36, train_loss: 0.5446, test_loss: 1.0828, test_f1: 0.6352
 epoch: 37, train_loss: 0.5276, test_loss: 1.1082, test_f1: 0.5746
 epoch: 38, train_loss: 0.5512, test_loss: 1.1014, test_f1: 0.6076
 epoch: 39, train_loss: 0.5197, test_loss: 1.0628, test_f1: 0.6239
 epoch: 40, train_loss: 0.5129, test_loss: 1.1584, test_f1: 0.5952
 epoch: 41, train_loss: 0.5035, test_loss: 1.1312, test_f1: 0.6158
 epoch: 42, train_loss: 0.5107, test_loss: 1.1943, test_f1: 0.5996
 epoch: 43, train_loss: 0.5099, test_loss: 1.0884, test_f1: 0.6128
 epoch: 44, train_loss: 0.5031, test_loss: 1.2504, test_f1: 0.5782
 epoch: 45, train_loss: 0.4888, test_loss: 1.1931, test_f1: 0.5883
 epoch: 46, train_loss: 0.4849, test_loss: 1.1931, test_f1: 0.5955
 epoch: 47, train_loss: 0.4677, test_loss: 1.1385, test_f1: 0.6076
 epoch: 48, train_loss: 0.4697, test_loss: 1.1885, test_f1: 0.6336
 epoch: 49, train_loss: 0.4609, test_loss: 1.1517, test_f1: 0.6256
 epoch: 50, train_loss: 0.4654, test_loss: 1.1742, test_f1: 0.6476
 epoch: 51, train_loss: 0.4292, test_loss: 1.1495, test_f1: 0.5995
 epoch: 52, train_loss: 0.4181, test_loss: 1.2305, test_f1: 0.6409
 epoch: 53, train_loss: 0.4249, test_loss: 1.1339, test_f1: 0.6399
 epoch: 54, train_loss: 0.4089, test_loss: 1.1669, test_f1: 0.5999
 epoch: 55, train_loss: 0.4026, test_loss: 1.1729, test_f1: 0.6326
 epoch: 56, train_loss: 0.3973, test_loss: 1.2042, test_f1: 0.6165
 epoch: 57, train_loss: 0.3906, test_loss: 1.1703, test_f1: 0.6335
 epoch: 58, train_loss: 0.3920, test_loss: 1.2124, test_f1: 0.5992
 epoch: 59, train_loss: 0.3706, test_loss: 1.2150, test_f1: 0.6386
 epoch: 60, train_loss: 0.3814, test_loss: 1.2783, test_f1: 0.6054
 epoch: 61, train_loss: 0.3770, test_loss: 1.2302, test_f1: 0.6292
 epoch: 62, train_loss: 0.3572, test_loss: 1.2843, test_f1: 0.6313
 epoch: 63, train_loss: 0.3709, test_loss: 1.1967, test_f1: 0.6406
 epoch: 64, train_loss: 0.3579, test_loss: 1.3155, test_f1: 0.6227
 epoch: 65, train_loss: 0.3606, test_loss: 1.2906, test_f1: 0.6330
 epoch: 66, train_loss: 0.3763, test_loss: 1.2796, test_f1: 0.6423
 epoch: 67, train_loss: 0.3530, test_loss: 1.3056, test_f1: 0.6351
 epoch: 68, train_loss: 0.3629, test_loss: 1.2966, test_f1: 0.6390
 epoch: 69, train_loss: 0.3404, test_loss: 1.2970, test_f1: 0.6333
 epoch: 70, train_loss: 0.3606, test_loss: 1.3438, test_f1: 0.6353
 epoch: 71, train_loss: 0.3448, test_loss: 1.2981, test_f1: 0.6394
 epoch: 72, train_loss: 0.3470, test_loss: 1.2429, test_f1: 0.6531
 epoch: 73, train_loss: 0.3413, test_loss: 1.3492, test_f1: 0.6552
 epoch: 74, train_loss: 0.3316, test_loss: 1.3667, test_f1: 0.6492
 epoch: 75, train_loss: 0.3458, test_loss: 1.4179, test_f1: 0.5854
 epoch: 76, train_loss: 0.3283, test_loss: 1.3634, test_f1: 0.6403
 epoch: 77, train_loss: 0.3320, test_loss: 1.3791, test_f1: 0.6537
 epoch: 78, train_loss: 0.3201, test_loss: 1.3592, test_f1: 0.6563
 epoch: 79, train_loss: 0.3151, test_loss: 1.3641, test_f1: 0.6348
 epoch: 80, train_loss: 0.3144, test_loss: 1.3254, test_f1: 0.6521
 epoch: 81, train_loss: 0.3079, test_loss: 1.4627, test_f1: 0.6096
 epoch: 82, train_loss: 0.3041, test_loss: 1.4280, test_f1: 0.6077
 epoch: 83, train_loss: 0.3055, test_loss: 1.4037, test_f1: 0.6566
 epoch: 84, train_loss: 0.3013, test_loss: 1.3941, test_f1: 0.6484
 epoch: 85, train_loss: 0.3028, test_loss: 1.3360, test_f1: 0.6485
 epoch: 86, train_loss: 0.2877, test_loss: 1.4106, test_f1: 0.6348
 epoch: 87, train_loss: 0.3040, test_loss: 1.4269, test_f1: 0.6366
 epoch: 88, train_loss: 0.2891, test_loss: 1.5477, test_f1: 0.6353
 epoch: 89, train_loss: 0.3012, test_loss: 1.4720, test_f1: 0.6422
 epoch: 90, train_loss: 0.2726, test_loss: 1.4807, test_f1: 0.6195
 epoch: 91, train_loss: 0.2721, test_loss: 1.4580, test_f1: 0.6607
 epoch: 92, train_loss: 0.2706, test_loss: 1.4664, test_f1: 0.6486
 epoch: 93, train_loss: 0.2746, test_loss: 1.4879, test_f1: 0.6300
 epoch: 94, train_loss: 0.2856, test_loss: 1.5161, test_f1: 0.6423
 epoch: 95, train_loss: 0.2885, test_loss: 1.5181, test_f1: 0.6306
 epoch: 96, train_loss: 0.2620, test_loss: 1.4835, test_f1: 0.6475
 epoch: 97, train_loss: 0.2618, test_loss: 1.4448, test_f1: 0.6222
 epoch: 98, train_loss: 0.2504, test_loss: 1.5024, test_f1: 0.6510
 epoch: 99, train_loss: 0.2545, test_loss: 1.5375, test_f1: 0.6192
##################ITERATION #2 ****************************************
 epoch: 0, train_loss: 1.2752, test_loss: 1.3009, test_f1: 0.2281
 epoch: 1, train_loss: 1.1978, test_loss: 1.2768, test_f1: 0.2635
 epoch: 2, train_loss: 1.1593, test_loss: 1.2416, test_f1: 0.3079
 epoch: 3, train_loss: 1.1160, test_loss: 1.2004, test_f1: 0.3736
 epoch: 4, train_loss: 1.0782, test_loss: 1.1537, test_f1: 0.4578
 epoch: 5, train_loss: 1.0413, test_loss: 1.1087, test_f1: 0.4968
 epoch: 6, train_loss: 1.0030, test_loss: 1.0754, test_f1: 0.5423
 epoch: 7, train_loss: 0.9722, test_loss: 1.0457, test_f1: 0.5318
 epoch: 8, train_loss: 0.9399, test_loss: 1.0545, test_f1: 0.5565
 epoch: 9, train_loss: 0.9056, test_loss: 1.0269, test_f1: 0.5502
 epoch: 10, train_loss: 0.8812, test_loss: 1.0030, test_f1: 0.5484
 epoch: 11, train_loss: 0.8716, test_loss: 1.0097, test_f1: 0.5871
 epoch: 12, train_loss: 0.8448, test_loss: 0.9908, test_f1: 0.5505
 epoch: 13, train_loss: 0.8220, test_loss: 0.9973, test_f1: 0.5927
 epoch: 14, train_loss: 0.7977, test_loss: 1.0133, test_f1: 0.5887
 epoch: 15, train_loss: 0.7732, test_loss: 1.0269, test_f1: 0.5482
 epoch: 16, train_loss: 0.7644, test_loss: 1.0108, test_f1: 0.6222
 epoch: 17, train_loss: 0.7446, test_loss: 1.0110, test_f1: 0.6088
 epoch: 18, train_loss: 0.7304, test_loss: 1.0005, test_f1: 0.6127
 epoch: 19, train_loss: 0.7186, test_loss: 0.9812, test_f1: 0.5900
 epoch: 20, train_loss: 0.7066, test_loss: 0.9885, test_f1: 0.6068
 epoch: 21, train_loss: 0.6784, test_loss: 0.9968, test_f1: 0.6168
 epoch: 22, train_loss: 0.6610, test_loss: 1.0616, test_f1: 0.5801
 epoch: 23, train_loss: 0.6731, test_loss: 1.0286, test_f1: 0.5990
 epoch: 24, train_loss: 0.6399, test_loss: 1.0217, test_f1: 0.5925
 epoch: 25, train_loss: 0.6367, test_loss: 1.0808, test_f1: 0.5801
 epoch: 26, train_loss: 0.6257, test_loss: 1.0200, test_f1: 0.6123
 epoch: 27, train_loss: 0.6225, test_loss: 1.0549, test_f1: 0.6057
 epoch: 28, train_loss: 0.5901, test_loss: 1.0601, test_f1: 0.6181
 epoch: 29, train_loss: 0.5863, test_loss: 1.0560, test_f1: 0.5890
 epoch: 30, train_loss: 0.5711, test_loss: 1.0589, test_f1: 0.5974
 epoch: 31, train_loss: 0.5645, test_loss: 1.0395, test_f1: 0.6358
 epoch: 32, train_loss: 0.5550, test_loss: 1.0823, test_f1: 0.5757
 epoch: 33, train_loss: 0.5380, test_loss: 1.0875, test_f1: 0.6004
 epoch: 34, train_loss: 0.5289, test_loss: 1.1136, test_f1: 0.6024
 epoch: 35, train_loss: 0.5107, test_loss: 1.1059, test_f1: 0.6003
 epoch: 36, train_loss: 0.5064, test_loss: 1.1625, test_f1: 0.5700
 epoch: 37, train_loss: 0.4961, test_loss: 1.1922, test_f1: 0.6126
 epoch: 38, train_loss: 0.4929, test_loss: 1.1962, test_f1: 0.5556
 epoch: 39, train_loss: 0.4713, test_loss: 1.2008, test_f1: 0.5671
 epoch: 40, train_loss: 0.4875, test_loss: 1.1049, test_f1: 0.6249
 epoch: 41, train_loss: 0.4656, test_loss: 1.2620, test_f1: 0.5586
 epoch: 42, train_loss: 0.4748, test_loss: 1.1923, test_f1: 0.6067
 epoch: 43, train_loss: 0.4441, test_loss: 1.3683, test_f1: 0.5753
 epoch: 44, train_loss: 0.4626, test_loss: 1.2689, test_f1: 0.5687
 epoch: 45, train_loss: 0.4306, test_loss: 1.2085, test_f1: 0.6195
 epoch: 46, train_loss: 0.4428, test_loss: 1.3292, test_f1: 0.5512
 epoch: 47, train_loss: 0.4177, test_loss: 1.2918, test_f1: 0.5964
 epoch: 48, train_loss: 0.4102, test_loss: 1.3192, test_f1: 0.5867
 epoch: 49, train_loss: 0.3956, test_loss: 1.2782, test_f1: 0.6137
 epoch: 50, train_loss: 0.3908, test_loss: 1.4679, test_f1: 0.5577
 epoch: 51, train_loss: 0.3753, test_loss: 1.3608, test_f1: 0.5795
 epoch: 52, train_loss: 0.3631, test_loss: 1.4322, test_f1: 0.5609
 epoch: 53, train_loss: 0.3757, test_loss: 1.3824, test_f1: 0.5824
 epoch: 54, train_loss: 0.3466, test_loss: 1.3043, test_f1: 0.6098
 epoch: 55, train_loss: 0.3450, test_loss: 1.3335, test_f1: 0.5746
 epoch: 56, train_loss: 0.3480, test_loss: 1.3434, test_f1: 0.6160
 epoch: 57, train_loss: 0.3287, test_loss: 1.3405, test_f1: 0.6146
 epoch: 58, train_loss: 0.3325, test_loss: 1.3892, test_f1: 0.5925
 epoch: 59, train_loss: 0.3272, test_loss: 1.4509, test_f1: 0.5618
 epoch: 60, train_loss: 0.3234, test_loss: 1.4534, test_f1: 0.6182
 epoch: 61, train_loss: 0.3068, test_loss: 1.5725, test_f1: 0.5796
 epoch: 62, train_loss: 0.3191, test_loss: 1.4518, test_f1: 0.6044
 epoch: 63, train_loss: 0.3083, test_loss: 1.3842, test_f1: 0.6103
 epoch: 64, train_loss: 0.3028, test_loss: 1.4377, test_f1: 0.6013
 epoch: 65, train_loss: 0.3031, test_loss: 1.4860, test_f1: 0.5889
 epoch: 66, train_loss: 0.3192, test_loss: 1.5308, test_f1: 0.5781
 epoch: 67, train_loss: 0.2969, test_loss: 1.4119, test_f1: 0.6063
 epoch: 68, train_loss: 0.2958, test_loss: 1.5184, test_f1: 0.5816
 epoch: 69, train_loss: 0.2908, test_loss: 1.4894, test_f1: 0.6276
 epoch: 70, train_loss: 0.2785, test_loss: 1.5277, test_f1: 0.6305
 epoch: 71, train_loss: 0.2973, test_loss: 1.6592, test_f1: 0.5686
 epoch: 72, train_loss: 0.2852, test_loss: 1.5875, test_f1: 0.5878
 epoch: 73, train_loss: 0.2771, test_loss: 1.5511, test_f1: 0.6286
 epoch: 74, train_loss: 0.2827, test_loss: 1.6224, test_f1: 0.5670
 epoch: 75, train_loss: 0.2817, test_loss: 1.5512, test_f1: 0.6134
 epoch: 76, train_loss: 0.2461, test_loss: 1.6178, test_f1: 0.6167
 epoch: 77, train_loss: 0.2566, test_loss: 1.6458, test_f1: 0.6129
 epoch: 78, train_loss: 0.2583, test_loss: 1.6200, test_f1: 0.5728
 epoch: 79, train_loss: 0.2591, test_loss: 1.7165, test_f1: 0.5749
 epoch: 80, train_loss: 0.2544, test_loss: 1.8045, test_f1: 0.5747
 epoch: 81, train_loss: 0.2611, test_loss: 1.6420, test_f1: 0.5881
 epoch: 82, train_loss: 0.2520, test_loss: 1.6055, test_f1: 0.5846
 epoch: 83, train_loss: 0.2492, test_loss: 1.6642, test_f1: 0.6138
 epoch: 84, train_loss: 0.2303, test_loss: 1.6651, test_f1: 0.6033
 epoch: 85, train_loss: 0.2353, test_loss: 1.6671, test_f1: 0.5997
 epoch: 86, train_loss: 0.2482, test_loss: 1.6776, test_f1: 0.6081
 epoch: 87, train_loss: 0.2364, test_loss: 1.7754, test_f1: 0.5997
 epoch: 88, train_loss: 0.2447, test_loss: 1.7400, test_f1: 0.6072
 epoch: 89, train_loss: 0.2402, test_loss: 1.6756, test_f1: 0.5785
 epoch: 90, train_loss: 0.2268, test_loss: 1.7541, test_f1: 0.5846
 epoch: 91, train_loss: 0.2416, test_loss: 1.6563, test_f1: 0.5987
 epoch: 92, train_loss: 0.2349, test_loss: 1.7237, test_f1: 0.6059
 epoch: 93, train_loss: 0.2194, test_loss: 1.7573, test_f1: 0.5846
 epoch: 94, train_loss: 0.2425, test_loss: 1.8179, test_f1: 0.5829
 epoch: 95, train_loss: 0.2266, test_loss: 1.8019, test_f1: 0.5615
 epoch: 96, train_loss: 0.2144, test_loss: 1.7325, test_f1: 0.6142
 epoch: 97, train_loss: 0.2008, test_loss: 1.7417, test_f1: 0.5848
 epoch: 98, train_loss: 0.2057, test_loss: 1.8196, test_f1: 0.6132
 epoch: 99, train_loss: 0.2053, test_loss: 1.8002, test_f1: 0.5845
##################ITERATION #3 ****************************************
 epoch: 0, train_loss: 1.2434, test_loss: 1.3109, test_f1: 0.2281
 epoch: 1, train_loss: 1.1537, test_loss: 1.2815, test_f1: 0.2776
 epoch: 2, train_loss: 1.1077, test_loss: 1.2013, test_f1: 0.3683
 epoch: 3, train_loss: 1.0614, test_loss: 1.1503, test_f1: 0.4396
 epoch: 4, train_loss: 1.0251, test_loss: 1.1249, test_f1: 0.4327
 epoch: 5, train_loss: 0.9822, test_loss: 1.0744, test_f1: 0.4887
 epoch: 6, train_loss: 0.9468, test_loss: 1.0562, test_f1: 0.5251
 epoch: 7, train_loss: 0.9174, test_loss: 1.0482, test_f1: 0.5284
 epoch: 8, train_loss: 0.8840, test_loss: 1.0280, test_f1: 0.5821
 epoch: 9, train_loss: 0.8634, test_loss: 1.0169, test_f1: 0.5774
 epoch: 10, train_loss: 0.8543, test_loss: 1.0011, test_f1: 0.5855
 epoch: 11, train_loss: 0.8384, test_loss: 1.0006, test_f1: 0.5619
 epoch: 12, train_loss: 0.7982, test_loss: 1.0183, test_f1: 0.5683
 epoch: 13, train_loss: 0.7823, test_loss: 0.9811, test_f1: 0.6043
 epoch: 14, train_loss: 0.7790, test_loss: 0.9982, test_f1: 0.5748
 epoch: 15, train_loss: 0.7354, test_loss: 0.9752, test_f1: 0.5723
 epoch: 16, train_loss: 0.7366, test_loss: 1.0787, test_f1: 0.5537
 epoch: 17, train_loss: 0.7276, test_loss: 1.0222, test_f1: 0.5826
 epoch: 18, train_loss: 0.6900, test_loss: 1.0707, test_f1: 0.5388
 epoch: 19, train_loss: 0.6831, test_loss: 1.0955, test_f1: 0.5367
 epoch: 20, train_loss: 0.6871, test_loss: 1.0546, test_f1: 0.5388
 epoch: 21, train_loss: 0.6483, test_loss: 1.0854, test_f1: 0.5432
 epoch: 22, train_loss: 0.6182, test_loss: 1.0910, test_f1: 0.5703
 epoch: 23, train_loss: 0.6431, test_loss: 1.1085, test_f1: 0.5671
 epoch: 24, train_loss: 0.6227, test_loss: 1.1093, test_f1: 0.5630
 epoch: 25, train_loss: 0.6077, test_loss: 1.0584, test_f1: 0.5783
 epoch: 26, train_loss: 0.6013, test_loss: 1.0427, test_f1: 0.5589
 epoch: 27, train_loss: 0.5810, test_loss: 1.1692, test_f1: 0.5679
 epoch: 28, train_loss: 0.5645, test_loss: 1.2066, test_f1: 0.5738
 epoch: 29, train_loss: 0.5510, test_loss: 1.1806, test_f1: 0.5812
 epoch: 30, train_loss: 0.5496, test_loss: 1.1500, test_f1: 0.5646
 epoch: 31, train_loss: 0.5515, test_loss: 1.1476, test_f1: 0.5891
 epoch: 32, train_loss: 0.5251, test_loss: 1.0891, test_f1: 0.5776
 epoch: 33, train_loss: 0.5145, test_loss: 1.2247, test_f1: 0.5156
 epoch: 34, train_loss: 0.5176, test_loss: 1.2208, test_f1: 0.6101
 epoch: 35, train_loss: 0.5252, test_loss: 1.1118, test_f1: 0.6010
 epoch: 36, train_loss: 0.5082, test_loss: 1.2009, test_f1: 0.5863
 epoch: 37, train_loss: 0.5025, test_loss: 1.1880, test_f1: 0.6134
 epoch: 38, train_loss: 0.4991, test_loss: 1.2507, test_f1: 0.5801
 epoch: 39, train_loss: 0.4691, test_loss: 1.2383, test_f1: 0.5588
 epoch: 40, train_loss: 0.4821, test_loss: 1.2420, test_f1: 0.6027
 epoch: 41, train_loss: 0.4514, test_loss: 1.3063, test_f1: 0.5823
 epoch: 42, train_loss: 0.4662, test_loss: 1.2653, test_f1: 0.5965
 epoch: 43, train_loss: 0.4372, test_loss: 1.1716, test_f1: 0.5914
 epoch: 44, train_loss: 0.4339, test_loss: 1.1942, test_f1: 0.6143
 epoch: 45, train_loss: 0.4241, test_loss: 1.3433, test_f1: 0.5977
 epoch: 46, train_loss: 0.3924, test_loss: 1.3362, test_f1: 0.6155
 epoch: 47, train_loss: 0.3935, test_loss: 1.3822, test_f1: 0.6068
 epoch: 48, train_loss: 0.3920, test_loss: 1.3076, test_f1: 0.6212
 epoch: 49, train_loss: 0.3539, test_loss: 1.3940, test_f1: 0.6214
 epoch: 50, train_loss: 0.3776, test_loss: 1.4479, test_f1: 0.6121
 epoch: 51, train_loss: 0.3821, test_loss: 1.5221, test_f1: 0.5916
 epoch: 52, train_loss: 0.3428, test_loss: 1.4072, test_f1: 0.5983
 epoch: 53, train_loss: 0.3404, test_loss: 1.3699, test_f1: 0.6167
 epoch: 54, train_loss: 0.3235, test_loss: 1.5184, test_f1: 0.5928
 epoch: 55, train_loss: 0.3321, test_loss: 1.5031, test_f1: 0.5950
 epoch: 56, train_loss: 0.3039, test_loss: 1.4699, test_f1: 0.5996
 epoch: 57, train_loss: 0.3127, test_loss: 1.5107, test_f1: 0.6090
 epoch: 58, train_loss: 0.3177, test_loss: 1.4865, test_f1: 0.6000
 epoch: 59, train_loss: 0.3115, test_loss: 1.5117, test_f1: 0.6197
 epoch: 60, train_loss: 0.2926, test_loss: 1.5149, test_f1: 0.6079
 epoch: 61, train_loss: 0.3165, test_loss: 1.5627, test_f1: 0.6059
 epoch: 62, train_loss: 0.2893, test_loss: 1.5137, test_f1: 0.5950
 epoch: 63, train_loss: 0.3002, test_loss: 1.5288, test_f1: 0.6048
 epoch: 64, train_loss: 0.2957, test_loss: 1.6494, test_f1: 0.6040
 epoch: 65, train_loss: 0.2865, test_loss: 1.5824, test_f1: 0.6149
 epoch: 66, train_loss: 0.2870, test_loss: 1.4811, test_f1: 0.6368
 epoch: 67, train_loss: 0.2833, test_loss: 1.5456, test_f1: 0.6128
 epoch: 68, train_loss: 0.2587, test_loss: 1.5690, test_f1: 0.6280
 epoch: 69, train_loss: 0.2610, test_loss: 1.6467, test_f1: 0.6129
 epoch: 70, train_loss: 0.2582, test_loss: 1.7477, test_f1: 0.5864
 epoch: 71, train_loss: 0.2609, test_loss: 1.7109, test_f1: 0.6123
 epoch: 72, train_loss: 0.2470, test_loss: 1.6409, test_f1: 0.6228
 epoch: 73, train_loss: 0.2498, test_loss: 1.7102, test_f1: 0.6253
 epoch: 74, train_loss: 0.2514, test_loss: 1.7064, test_f1: 0.6021
 epoch: 75, train_loss: 0.2525, test_loss: 1.7055, test_f1: 0.5907
 epoch: 76, train_loss: 0.2350, test_loss: 1.7613, test_f1: 0.5848
 epoch: 77, train_loss: 0.2480, test_loss: 1.8104, test_f1: 0.5953
 epoch: 78, train_loss: 0.2599, test_loss: 1.7488, test_f1: 0.6001
 epoch: 79, train_loss: 0.2582, test_loss: 1.7098, test_f1: 0.5973
 epoch: 80, train_loss: 0.2437, test_loss: 1.7577, test_f1: 0.5950
 epoch: 81, train_loss: 0.2349, test_loss: 1.8101, test_f1: 0.5816
 epoch: 82, train_loss: 0.2301, test_loss: 1.7925, test_f1: 0.5912
 epoch: 83, train_loss: 0.2259, test_loss: 1.8471, test_f1: 0.5871
 epoch: 84, train_loss: 0.2201, test_loss: 1.8932, test_f1: 0.6121
 epoch: 85, train_loss: 0.2178, test_loss: 1.8284, test_f1: 0.5817
 epoch: 86, train_loss: 0.2120, test_loss: 1.7965, test_f1: 0.6412
 epoch: 87, train_loss: 0.2264, test_loss: 1.7659, test_f1: 0.6197
 epoch: 88, train_loss: 0.2267, test_loss: 1.9368, test_f1: 0.5930
 epoch: 89, train_loss: 0.2415, test_loss: 1.8060, test_f1: 0.5924
 epoch: 90, train_loss: 0.2263, test_loss: 1.8256, test_f1: 0.6124
 epoch: 91, train_loss: 0.1982, test_loss: 1.8168, test_f1: 0.6041
 epoch: 92, train_loss: 0.1958, test_loss: 1.8548, test_f1: 0.6013
 epoch: 93, train_loss: 0.2079, test_loss: 1.8249, test_f1: 0.6151
 epoch: 94, train_loss: 0.2090, test_loss: 1.9410, test_f1: 0.5837
 epoch: 95, train_loss: 0.2012, test_loss: 1.8593, test_f1: 0.6305
 epoch: 96, train_loss: 0.1924, test_loss: 1.9110, test_f1: 0.5962
 epoch: 97, train_loss: 0.2026, test_loss: 2.0429, test_f1: 0.6057
 epoch: 98, train_loss: 0.2169, test_loss: 1.9798, test_f1: 0.6006
 epoch: 99, train_loss: 0.2097, test_loss: 2.0018, test_f1: 0.5940
##################ITERATION #4 ****************************************
 epoch: 0, train_loss: 1.2426, test_loss: 1.2885, test_f1: 0.2573
 epoch: 1, train_loss: 1.1517, test_loss: 1.2280, test_f1: 0.2334
 epoch: 2, train_loss: 1.0994, test_loss: 1.1547, test_f1: 0.3846
 epoch: 3, train_loss: 1.0564, test_loss: 1.1227, test_f1: 0.4682
 epoch: 4, train_loss: 1.0256, test_loss: 1.0935, test_f1: 0.5316
 epoch: 5, train_loss: 0.9895, test_loss: 1.0676, test_f1: 0.5709
 epoch: 6, train_loss: 0.9512, test_loss: 1.0451, test_f1: 0.5675
 epoch: 7, train_loss: 0.9260, test_loss: 1.0325, test_f1: 0.5842
 epoch: 8, train_loss: 0.9122, test_loss: 1.0255, test_f1: 0.5939
 epoch: 9, train_loss: 0.8823, test_loss: 1.0050, test_f1: 0.6058
 epoch: 10, train_loss: 0.8756, test_loss: 1.0045, test_f1: 0.5831
 epoch: 11, train_loss: 0.8371, test_loss: 0.9823, test_f1: 0.6040
 epoch: 12, train_loss: 0.8231, test_loss: 0.9699, test_f1: 0.6006
 epoch: 13, train_loss: 0.8107, test_loss: 0.9635, test_f1: 0.5846
 epoch: 14, train_loss: 0.7967, test_loss: 0.9688, test_f1: 0.5875
 epoch: 15, train_loss: 0.7737, test_loss: 0.9349, test_f1: 0.5929
 epoch: 16, train_loss: 0.7507, test_loss: 0.9583, test_f1: 0.5943
 epoch: 17, train_loss: 0.7325, test_loss: 0.9824, test_f1: 0.5974
 epoch: 18, train_loss: 0.7097, test_loss: 0.9778, test_f1: 0.5972
 epoch: 19, train_loss: 0.7113, test_loss: 0.9653, test_f1: 0.5809
 epoch: 20, train_loss: 0.7064, test_loss: 0.9536, test_f1: 0.6036
 epoch: 21, train_loss: 0.6795, test_loss: 0.9478, test_f1: 0.6136
 epoch: 22, train_loss: 0.6695, test_loss: 1.0077, test_f1: 0.6208
 epoch: 23, train_loss: 0.6443, test_loss: 0.9636, test_f1: 0.6056
 epoch: 24, train_loss: 0.6489, test_loss: 1.0734, test_f1: 0.5620
 epoch: 25, train_loss: 0.6324, test_loss: 0.9918, test_f1: 0.5994
 epoch: 26, train_loss: 0.6265, test_loss: 1.0709, test_f1: 0.5627
 epoch: 27, train_loss: 0.6016, test_loss: 1.0301, test_f1: 0.6321
 epoch: 28, train_loss: 0.5854, test_loss: 1.0647, test_f1: 0.6076
 epoch: 29, train_loss: 0.5739, test_loss: 1.0346, test_f1: 0.6285
 epoch: 30, train_loss: 0.5690, test_loss: 1.0365, test_f1: 0.5541
 epoch: 31, train_loss: 0.5538, test_loss: 1.0141, test_f1: 0.6366
 epoch: 32, train_loss: 0.5682, test_loss: 0.9443, test_f1: 0.6540
 epoch: 33, train_loss: 0.5744, test_loss: 0.9681, test_f1: 0.6396
 epoch: 34, train_loss: 0.5411, test_loss: 1.0648, test_f1: 0.5719
 epoch: 35, train_loss: 0.5412, test_loss: 1.0766, test_f1: 0.5827
 epoch: 36, train_loss: 0.5384, test_loss: 1.0686, test_f1: 0.6012
 epoch: 37, train_loss: 0.5131, test_loss: 1.1819, test_f1: 0.6021
 epoch: 38, train_loss: 0.5151, test_loss: 1.0219, test_f1: 0.5811
 epoch: 39, train_loss: 0.5069, test_loss: 1.1200, test_f1: 0.5580
 epoch: 40, train_loss: 0.5007, test_loss: 1.0996, test_f1: 0.6330
 epoch: 41, train_loss: 0.4789, test_loss: 1.2730, test_f1: 0.5727
 epoch: 42, train_loss: 0.4700, test_loss: 1.1271, test_f1: 0.6155
 epoch: 43, train_loss: 0.4731, test_loss: 1.2269, test_f1: 0.6103
 epoch: 44, train_loss: 0.4522, test_loss: 1.1674, test_f1: 0.6277
 epoch: 45, train_loss: 0.4501, test_loss: 1.3416, test_f1: 0.6126
 epoch: 46, train_loss: 0.4521, test_loss: 1.1846, test_f1: 0.6031
 epoch: 47, train_loss: 0.4444, test_loss: 1.2929, test_f1: 0.6029
 epoch: 48, train_loss: 0.4244, test_loss: 1.2882, test_f1: 0.5987
 epoch: 49, train_loss: 0.4007, test_loss: 1.3502, test_f1: 0.6010
 epoch: 50, train_loss: 0.3927, test_loss: 1.2231, test_f1: 0.6152
 epoch: 51, train_loss: 0.3868, test_loss: 1.3857, test_f1: 0.6007
 epoch: 52, train_loss: 0.3780, test_loss: 1.3355, test_f1: 0.6220
 epoch: 53, train_loss: 0.3469, test_loss: 1.3462, test_f1: 0.6219
 epoch: 54, train_loss: 0.3610, test_loss: 1.3298, test_f1: 0.5958
 epoch: 55, train_loss: 0.3589, test_loss: 1.2531, test_f1: 0.6153
 epoch: 56, train_loss: 0.3536, test_loss: 1.3633, test_f1: 0.5687
 epoch: 57, train_loss: 0.3332, test_loss: 1.4488, test_f1: 0.6225
 epoch: 58, train_loss: 0.3485, test_loss: 1.2970, test_f1: 0.6322
 epoch: 59, train_loss: 0.3471, test_loss: 1.4088, test_f1: 0.6147
 epoch: 60, train_loss: 0.3357, test_loss: 1.4257, test_f1: 0.6163
 epoch: 61, train_loss: 0.3222, test_loss: 1.3857, test_f1: 0.5985
 epoch: 62, train_loss: 0.3358, test_loss: 1.4186, test_f1: 0.6218
 epoch: 63, train_loss: 0.3292, test_loss: 1.4120, test_f1: 0.6217
 epoch: 64, train_loss: 0.3268, test_loss: 1.4823, test_f1: 0.6179
 epoch: 65, train_loss: 0.3115, test_loss: 1.4727, test_f1: 0.6107
 epoch: 66, train_loss: 0.3065, test_loss: 1.5432, test_f1: 0.6173
 epoch: 67, train_loss: 0.3187, test_loss: 1.4802, test_f1: 0.6163
 epoch: 68, train_loss: 0.3130, test_loss: 1.4804, test_f1: 0.6122
 epoch: 69, train_loss: 0.3055, test_loss: 1.5098, test_f1: 0.6174
 epoch: 70, train_loss: 0.2829, test_loss: 1.4415, test_f1: 0.6398
 epoch: 71, train_loss: 0.2928, test_loss: 1.4545, test_f1: 0.6214
 epoch: 72, train_loss: 0.2982, test_loss: 1.5438, test_f1: 0.6162
 epoch: 73, train_loss: 0.2784, test_loss: 1.5364, test_f1: 0.6364
 epoch: 74, train_loss: 0.2859, test_loss: 1.5214, test_f1: 0.6293
 epoch: 75, train_loss: 0.2736, test_loss: 1.5651, test_f1: 0.6387
 epoch: 76, train_loss: 0.2965, test_loss: 1.5994, test_f1: 0.6188
 epoch: 77, train_loss: 0.2744, test_loss: 1.5093, test_f1: 0.5963
 epoch: 78, train_loss: 0.2598, test_loss: 1.6092, test_f1: 0.6146
 epoch: 79, train_loss: 0.2727, test_loss: 1.6398, test_f1: 0.6030
 epoch: 80, train_loss: 0.2826, test_loss: 1.5674, test_f1: 0.5985
 epoch: 81, train_loss: 0.2654, test_loss: 1.6062, test_f1: 0.6083
 epoch: 82, train_loss: 0.2552, test_loss: 1.6416, test_f1: 0.6366
 epoch: 83, train_loss: 0.2560, test_loss: 1.7000, test_f1: 0.6134
 epoch: 84, train_loss: 0.2532, test_loss: 1.7232, test_f1: 0.6173
 epoch: 85, train_loss: 0.2556, test_loss: 1.6401, test_f1: 0.6105
 epoch: 86, train_loss: 0.2392, test_loss: 1.8013, test_f1: 0.6210
 epoch: 87, train_loss: 0.2454, test_loss: 1.6635, test_f1: 0.6339
 epoch: 88, train_loss: 0.2346, test_loss: 1.7902, test_f1: 0.6105
 epoch: 89, train_loss: 0.2222, test_loss: 1.9304, test_f1: 0.6086
 epoch: 90, train_loss: 0.2285, test_loss: 1.8043, test_f1: 0.6182
 epoch: 91, train_loss: 0.2347, test_loss: 1.8105, test_f1: 0.6066
 epoch: 92, train_loss: 0.2205, test_loss: 1.8278, test_f1: 0.6214
 epoch: 93, train_loss: 0.2365, test_loss: 2.0329, test_f1: 0.5848
 epoch: 94, train_loss: 0.2357, test_loss: 1.9750, test_f1: 0.6037
 epoch: 95, train_loss: 0.2088, test_loss: 1.8826, test_f1: 0.6193
 epoch: 96, train_loss: 0.2224, test_loss: 1.8402, test_f1: 0.6098
 epoch: 97, train_loss: 0.2224, test_loss: 1.9148, test_f1: 0.6093
 epoch: 98, train_loss: 0.2286, test_loss: 1.9772, test_f1: 0.6113
 epoch: 99, train_loss: 0.2251, test_loss: 2.0116, test_f1: 0.6062
##################ITERATION #5 ****************************************
 epoch: 0, train_loss: 1.2294, test_loss: 1.2923, test_f1: 0.3077
 epoch: 1, train_loss: 1.1215, test_loss: 1.2606, test_f1: 0.2678
 epoch: 2, train_loss: 1.0713, test_loss: 1.2118, test_f1: 0.4407
 epoch: 3, train_loss: 1.0305, test_loss: 1.1411, test_f1: 0.5098
 epoch: 4, train_loss: 1.0012, test_loss: 1.1032, test_f1: 0.5463
 epoch: 5, train_loss: 0.9599, test_loss: 1.0543, test_f1: 0.5680
 epoch: 6, train_loss: 0.9340, test_loss: 1.0620, test_f1: 0.5839
 epoch: 7, train_loss: 0.9267, test_loss: 1.0320, test_f1: 0.5733
 epoch: 8, train_loss: 0.8935, test_loss: 1.0038, test_f1: 0.6010
 epoch: 9, train_loss: 0.8732, test_loss: 1.0123, test_f1: 0.5735
 epoch: 10, train_loss: 0.8504, test_loss: 1.0100, test_f1: 0.5760
 epoch: 11, train_loss: 0.8112, test_loss: 1.0142, test_f1: 0.5602
 epoch: 12, train_loss: 0.8055, test_loss: 1.0146, test_f1: 0.5970
 epoch: 13, train_loss: 0.7920, test_loss: 0.9822, test_f1: 0.5890
 epoch: 14, train_loss: 0.7626, test_loss: 0.9965, test_f1: 0.6093
 epoch: 15, train_loss: 0.7585, test_loss: 1.0163, test_f1: 0.5889
 epoch: 16, train_loss: 0.7313, test_loss: 0.9851, test_f1: 0.6100
 epoch: 17, train_loss: 0.7179, test_loss: 0.9913, test_f1: 0.5900
 epoch: 18, train_loss: 0.7250, test_loss: 0.9651, test_f1: 0.6359
 epoch: 19, train_loss: 0.6752, test_loss: 1.0011, test_f1: 0.6163
 epoch: 20, train_loss: 0.6774, test_loss: 1.0315, test_f1: 0.6158
 epoch: 21, train_loss: 0.6597, test_loss: 1.0173, test_f1: 0.6514
 epoch: 22, train_loss: 0.6598, test_loss: 1.0975, test_f1: 0.5624
 epoch: 23, train_loss: 0.6199, test_loss: 1.0679, test_f1: 0.5905
 epoch: 24, train_loss: 0.6117, test_loss: 1.0565, test_f1: 0.6136
 epoch: 25, train_loss: 0.6156, test_loss: 1.1510, test_f1: 0.5795
 epoch: 26, train_loss: 0.5896, test_loss: 1.0974, test_f1: 0.5643
 epoch: 27, train_loss: 0.5979, test_loss: 1.1075, test_f1: 0.6210
 epoch: 28, train_loss: 0.5763, test_loss: 1.1312, test_f1: 0.5955
 epoch: 29, train_loss: 0.5568, test_loss: 1.1213, test_f1: 0.6238
 epoch: 30, train_loss: 0.5595, test_loss: 1.1158, test_f1: 0.6129
 epoch: 31, train_loss: 0.5526, test_loss: 1.1530, test_f1: 0.5786
 epoch: 32, train_loss: 0.5241, test_loss: 1.1684, test_f1: 0.5970
 epoch: 33, train_loss: 0.5152, test_loss: 1.1883, test_f1: 0.5874
 epoch: 34, train_loss: 0.4920, test_loss: 1.1962, test_f1: 0.6176
 epoch: 35, train_loss: 0.4982, test_loss: 1.1914, test_f1: 0.5984
 epoch: 36, train_loss: 0.4774, test_loss: 1.2786, test_f1: 0.5892
 epoch: 37, train_loss: 0.4732, test_loss: 1.3243, test_f1: 0.6114
 epoch: 38, train_loss: 0.4652, test_loss: 1.2813, test_f1: 0.6215
 epoch: 39, train_loss: 0.4561, test_loss: 1.3603, test_f1: 0.5939
 epoch: 40, train_loss: 0.4520, test_loss: 1.2908, test_f1: 0.5835
 epoch: 41, train_loss: 0.4545, test_loss: 1.3418, test_f1: 0.5749
 epoch: 42, train_loss: 0.4539, test_loss: 1.4021, test_f1: 0.5996
 epoch: 43, train_loss: 0.4454, test_loss: 1.3779, test_f1: 0.5917
 epoch: 44, train_loss: 0.4208, test_loss: 1.3523, test_f1: 0.5741
 epoch: 45, train_loss: 0.4169, test_loss: 1.3994, test_f1: 0.5945
 epoch: 46, train_loss: 0.3926, test_loss: 1.3498, test_f1: 0.6005
 epoch: 47, train_loss: 0.3938, test_loss: 1.3216, test_f1: 0.6312
 epoch: 48, train_loss: 0.3971, test_loss: 1.5167, test_f1: 0.5782
 epoch: 49, train_loss: 0.3658, test_loss: 1.4790, test_f1: 0.5942
 epoch: 50, train_loss: 0.3582, test_loss: 1.5275, test_f1: 0.5808
 epoch: 51, train_loss: 0.3530, test_loss: 1.5524, test_f1: 0.6076
 epoch: 52, train_loss: 0.3410, test_loss: 1.5496, test_f1: 0.5770
 epoch: 53, train_loss: 0.3298, test_loss: 1.5810, test_f1: 0.5951
 epoch: 54, train_loss: 0.3277, test_loss: 1.5038, test_f1: 0.5851
 epoch: 55, train_loss: 0.3149, test_loss: 1.5985, test_f1: 0.5722
 epoch: 56, train_loss: 0.3108, test_loss: 1.5899, test_f1: 0.5889
 epoch: 57, train_loss: 0.3245, test_loss: 1.5750, test_f1: 0.5829
 epoch: 58, train_loss: 0.3248, test_loss: 1.6090, test_f1: 0.5875
 epoch: 59, train_loss: 0.3002, test_loss: 1.5974, test_f1: 0.5936
 epoch: 60, train_loss: 0.3050, test_loss: 1.6221, test_f1: 0.5935
 epoch: 61, train_loss: 0.3023, test_loss: 1.6681, test_f1: 0.5769
 epoch: 62, train_loss: 0.3065, test_loss: 1.6253, test_f1: 0.5875
 epoch: 63, train_loss: 0.2855, test_loss: 1.6352, test_f1: 0.5883
 epoch: 64, train_loss: 0.2974, test_loss: 1.6297, test_f1: 0.5936
 epoch: 65, train_loss: 0.2894, test_loss: 1.6905, test_f1: 0.5909
 epoch: 66, train_loss: 0.2840, test_loss: 1.6737, test_f1: 0.5839
 epoch: 67, train_loss: 0.2734, test_loss: 1.8063, test_f1: 0.5666
 epoch: 68, train_loss: 0.2647, test_loss: 1.7672, test_f1: 0.5727
 epoch: 69, train_loss: 0.2772, test_loss: 1.7733, test_f1: 0.5722
 epoch: 70, train_loss: 0.2886, test_loss: 1.7853, test_f1: 0.5725
 epoch: 71, train_loss: 0.2891, test_loss: 1.8750, test_f1: 0.5546
 epoch: 72, train_loss: 0.2866, test_loss: 1.7717, test_f1: 0.5564
 epoch: 73, train_loss: 0.2669, test_loss: 1.8203, test_f1: 0.5754
 epoch: 74, train_loss: 0.2614, test_loss: 1.8150, test_f1: 0.5807
 epoch: 75, train_loss: 0.2693, test_loss: 1.7848, test_f1: 0.5678
 epoch: 76, train_loss: 0.2621, test_loss: 1.8515, test_f1: 0.5780
 epoch: 77, train_loss: 0.2481, test_loss: 1.8394, test_f1: 0.5849
 epoch: 78, train_loss: 0.2504, test_loss: 1.8947, test_f1: 0.5668
 epoch: 79, train_loss: 0.2365, test_loss: 1.8860, test_f1: 0.5728
 epoch: 80, train_loss: 0.2367, test_loss: 1.8098, test_f1: 0.6018
 epoch: 81, train_loss: 0.2171, test_loss: 1.9555, test_f1: 0.5731
 epoch: 82, train_loss: 0.2450, test_loss: 1.9078, test_f1: 0.5807
 epoch: 83, train_loss: 0.2252, test_loss: 1.8614, test_f1: 0.5860
 epoch: 84, train_loss: 0.2234, test_loss: 1.8620, test_f1: 0.5978
 epoch: 85, train_loss: 0.2287, test_loss: 1.9091, test_f1: 0.5923
 epoch: 86, train_loss: 0.2246, test_loss: 1.9600, test_f1: 0.5952
 epoch: 87, train_loss: 0.2174, test_loss: 2.0243, test_f1: 0.5769
 epoch: 88, train_loss: 0.2257, test_loss: 1.9409, test_f1: 0.5887
 epoch: 89, train_loss: 0.2161, test_loss: 1.9864, test_f1: 0.5850
 epoch: 90, train_loss: 0.2154, test_loss: 2.0422, test_f1: 0.5861
 epoch: 91, train_loss: 0.2175, test_loss: 1.9918, test_f1: 0.5881
 epoch: 92, train_loss: 0.2108, test_loss: 1.9918, test_f1: 0.5858
 epoch: 93, train_loss: 0.2106, test_loss: 2.0229, test_f1: 0.5767
 epoch: 94, train_loss: 0.2120, test_loss: 2.0893, test_f1: 0.5916
 epoch: 95, train_loss: 0.2043, test_loss: 2.1573, test_f1: 0.5662
 epoch: 96, train_loss: 0.2091, test_loss: 2.0866, test_f1: 0.5783
 epoch: 97, train_loss: 0.1893, test_loss: 2.1085, test_f1: 0.5856
 epoch: 98, train_loss: 0.1959, test_loss: 2.0948, test_f1: 0.5974
 epoch: 99, train_loss: 0.2057, test_loss: 2.0808, test_f1: 0.6097
##################ITERATION #6 ****************************************
 epoch: 0, train_loss: 1.2249, test_loss: 1.2867, test_f1: 0.2242
 epoch: 1, train_loss: 1.1150, test_loss: 1.2424, test_f1: 0.2712
 epoch: 2, train_loss: 1.0604, test_loss: 1.1547, test_f1: 0.4488
 epoch: 3, train_loss: 1.0370, test_loss: 1.1586, test_f1: 0.5271
 epoch: 4, train_loss: 0.9898, test_loss: 1.0685, test_f1: 0.5519
 epoch: 5, train_loss: 0.9499, test_loss: 1.0682, test_f1: 0.5570
 epoch: 6, train_loss: 0.9348, test_loss: 1.0457, test_f1: 0.5111
 epoch: 7, train_loss: 0.9056, test_loss: 1.0444, test_f1: 0.5345
 epoch: 8, train_loss: 0.8787, test_loss: 1.0276, test_f1: 0.5544
 epoch: 9, train_loss: 0.8847, test_loss: 1.0686, test_f1: 0.5348
 epoch: 10, train_loss: 0.8481, test_loss: 1.0208, test_f1: 0.5497
 epoch: 11, train_loss: 0.8368, test_loss: 1.0498, test_f1: 0.5597
 epoch: 12, train_loss: 0.8282, test_loss: 1.0114, test_f1: 0.5824
 epoch: 13, train_loss: 0.8034, test_loss: 1.0162, test_f1: 0.5997
 epoch: 14, train_loss: 0.7772, test_loss: 0.9924, test_f1: 0.5978
 epoch: 15, train_loss: 0.7782, test_loss: 1.0103, test_f1: 0.5728
 epoch: 16, train_loss: 0.7446, test_loss: 0.9984, test_f1: 0.5701
 epoch: 17, train_loss: 0.7338, test_loss: 1.0051, test_f1: 0.5633
 epoch: 18, train_loss: 0.7314, test_loss: 1.0301, test_f1: 0.5710
 epoch: 19, train_loss: 0.7132, test_loss: 1.0139, test_f1: 0.5985
 epoch: 20, train_loss: 0.7014, test_loss: 1.0107, test_f1: 0.5633
 epoch: 21, train_loss: 0.6732, test_loss: 0.9845, test_f1: 0.6195
 epoch: 22, train_loss: 0.6679, test_loss: 1.0142, test_f1: 0.5934
 epoch: 23, train_loss: 0.6422, test_loss: 1.0578, test_f1: 0.5575
 epoch: 24, train_loss: 0.6502, test_loss: 1.0431, test_f1: 0.5828
 epoch: 25, train_loss: 0.6266, test_loss: 0.9992, test_f1: 0.6248
 epoch: 26, train_loss: 0.6318, test_loss: 1.0009, test_f1: 0.5941
 epoch: 27, train_loss: 0.6084, test_loss: 1.0641, test_f1: 0.5970
 epoch: 28, train_loss: 0.6025, test_loss: 1.0303, test_f1: 0.6081
 epoch: 29, train_loss: 0.5942, test_loss: 1.0815, test_f1: 0.6017
 epoch: 30, train_loss: 0.5680, test_loss: 1.1215, test_f1: 0.5597
 epoch: 31, train_loss: 0.5657, test_loss: 1.0648, test_f1: 0.6277
 epoch: 32, train_loss: 0.5484, test_loss: 1.0870, test_f1: 0.6363
 epoch: 33, train_loss: 0.5339, test_loss: 1.0986, test_f1: 0.6139
 epoch: 34, train_loss: 0.5215, test_loss: 1.2071, test_f1: 0.6102
 epoch: 35, train_loss: 0.5218, test_loss: 1.1182, test_f1: 0.6103
 epoch: 36, train_loss: 0.5247, test_loss: 1.2193, test_f1: 0.6044
 epoch: 37, train_loss: 0.5196, test_loss: 1.1685, test_f1: 0.6387
 epoch: 38, train_loss: 0.5241, test_loss: 1.2040, test_f1: 0.5914
 epoch: 39, train_loss: 0.5009, test_loss: 1.3776, test_f1: 0.6259
 epoch: 40, train_loss: 0.4896, test_loss: 1.2330, test_f1: 0.5951
 epoch: 41, train_loss: 0.4711, test_loss: 1.2207, test_f1: 0.6399
 epoch: 42, train_loss: 0.4691, test_loss: 1.2234, test_f1: 0.6280
 epoch: 43, train_loss: 0.4528, test_loss: 1.1239, test_f1: 0.6487
 epoch: 44, train_loss: 0.4531, test_loss: 1.2727, test_f1: 0.5945
 epoch: 45, train_loss: 0.4455, test_loss: 1.2525, test_f1: 0.6321
 epoch: 46, train_loss: 0.4340, test_loss: 1.3331, test_f1: 0.5680
 epoch: 47, train_loss: 0.4325, test_loss: 1.3853, test_f1: 0.6132
 epoch: 48, train_loss: 0.4287, test_loss: 1.3213, test_f1: 0.6026
 epoch: 49, train_loss: 0.4015, test_loss: 1.3175, test_f1: 0.6106
 epoch: 50, train_loss: 0.3983, test_loss: 1.3530, test_f1: 0.6011
 epoch: 51, train_loss: 0.3761, test_loss: 1.4180, test_f1: 0.6366
 epoch: 52, train_loss: 0.3698, test_loss: 1.3663, test_f1: 0.6122
 epoch: 53, train_loss: 0.3683, test_loss: 1.4048, test_f1: 0.6066
 epoch: 54, train_loss: 0.3474, test_loss: 1.4344, test_f1: 0.6131
 epoch: 55, train_loss: 0.3348, test_loss: 1.4580, test_f1: 0.6427
 epoch: 56, train_loss: 0.3491, test_loss: 1.4497, test_f1: 0.6154
 epoch: 57, train_loss: 0.3473, test_loss: 1.4243, test_f1: 0.6185
 epoch: 58, train_loss: 0.3347, test_loss: 1.4166, test_f1: 0.6091
 epoch: 59, train_loss: 0.3542, test_loss: 1.3982, test_f1: 0.6121
 epoch: 60, train_loss: 0.3258, test_loss: 1.4813, test_f1: 0.6049
 epoch: 61, train_loss: 0.3414, test_loss: 1.5348, test_f1: 0.6197
 epoch: 62, train_loss: 0.3337, test_loss: 1.5763, test_f1: 0.6009
 epoch: 63, train_loss: 0.3215, test_loss: 1.5427, test_f1: 0.6000
 epoch: 64, train_loss: 0.3191, test_loss: 1.4182, test_f1: 0.6327
 epoch: 65, train_loss: 0.3140, test_loss: 1.5672, test_f1: 0.6124
 epoch: 66, train_loss: 0.2955, test_loss: 1.5752, test_f1: 0.6092
 epoch: 67, train_loss: 0.3121, test_loss: 1.5786, test_f1: 0.6217
 epoch: 68, train_loss: 0.3142, test_loss: 1.5464, test_f1: 0.6073
 epoch: 69, train_loss: 0.3114, test_loss: 1.5469, test_f1: 0.6330
 epoch: 70, train_loss: 0.2951, test_loss: 1.4818, test_f1: 0.6207
 epoch: 71, train_loss: 0.3005, test_loss: 1.5875, test_f1: 0.6079
 epoch: 72, train_loss: 0.2908, test_loss: 1.6139, test_f1: 0.6215
 epoch: 73, train_loss: 0.2832, test_loss: 1.6698, test_f1: 0.5970
 epoch: 74, train_loss: 0.2881, test_loss: 1.6243, test_f1: 0.6181
 epoch: 75, train_loss: 0.2898, test_loss: 1.8023, test_f1: 0.5958
 epoch: 76, train_loss: 0.2573, test_loss: 1.7305, test_f1: 0.5964
 epoch: 77, train_loss: 0.2880, test_loss: 1.7916, test_f1: 0.5795
 epoch: 78, train_loss: 0.2532, test_loss: 1.8103, test_f1: 0.6104
 epoch: 79, train_loss: 0.2748, test_loss: 1.8713, test_f1: 0.6092
 epoch: 80, train_loss: 0.2780, test_loss: 1.8306, test_f1: 0.6158
 epoch: 81, train_loss: 0.2611, test_loss: 1.9448, test_f1: 0.6226
 epoch: 82, train_loss: 0.2711, test_loss: 2.0057, test_f1: 0.5990
 epoch: 83, train_loss: 0.2662, test_loss: 1.9228, test_f1: 0.6371
 epoch: 84, train_loss: 0.2616, test_loss: 1.9979, test_f1: 0.6177
 epoch: 85, train_loss: 0.2644, test_loss: 1.8585, test_f1: 0.6112
 epoch: 86, train_loss: 0.2573, test_loss: 1.8831, test_f1: 0.6134
 epoch: 87, train_loss: 0.2636, test_loss: 1.8872, test_f1: 0.6103
 epoch: 88, train_loss: 0.2511, test_loss: 1.9333, test_f1: 0.6134
 epoch: 89, train_loss: 0.2290, test_loss: 1.8512, test_f1: 0.6201
 epoch: 90, train_loss: 0.2323, test_loss: 2.0614, test_f1: 0.6196
 epoch: 91, train_loss: 0.2525, test_loss: 2.0961, test_f1: 0.6110
 epoch: 92, train_loss: 0.2186, test_loss: 2.0687, test_f1: 0.6055
 epoch: 93, train_loss: 0.2431, test_loss: 2.1999, test_f1: 0.5761
 epoch: 94, train_loss: 0.2364, test_loss: 2.0530, test_f1: 0.6033
 epoch: 95, train_loss: 0.2249, test_loss: 2.0749, test_f1: 0.5821
 epoch: 96, train_loss: 0.2176, test_loss: 2.1490, test_f1: 0.5966
 epoch: 97, train_loss: 0.2366, test_loss: 2.1041, test_f1: 0.6122
 epoch: 98, train_loss: 0.2207, test_loss: 2.2785, test_f1: 0.5904
 epoch: 99, train_loss: 0.2066, test_loss: 2.0389, test_f1: 0.6165
##################ITERATION #7 ****************************************
 epoch: 0, train_loss: 1.2526, test_loss: 1.3358, test_f1: 0.2366
 epoch: 1, train_loss: 1.1021, test_loss: 1.2362, test_f1: 0.3193
 epoch: 2, train_loss: 1.0496, test_loss: 1.1019, test_f1: 0.4625
 epoch: 3, train_loss: 0.9963, test_loss: 1.0568, test_f1: 0.4865
 epoch: 4, train_loss: 0.9745, test_loss: 1.0369, test_f1: 0.5280
 epoch: 5, train_loss: 0.9333, test_loss: 1.0331, test_f1: 0.5614
 epoch: 6, train_loss: 0.9172, test_loss: 1.0123, test_f1: 0.5747
 epoch: 7, train_loss: 0.8979, test_loss: 1.0113, test_f1: 0.5897
 epoch: 8, train_loss: 0.8731, test_loss: 0.9895, test_f1: 0.6115
 epoch: 9, train_loss: 0.8436, test_loss: 0.9901, test_f1: 0.5963
 epoch: 10, train_loss: 0.8427, test_loss: 0.9874, test_f1: 0.5848
 epoch: 11, train_loss: 0.8206, test_loss: 0.9909, test_f1: 0.6006
 epoch: 12, train_loss: 0.8008, test_loss: 0.9766, test_f1: 0.6180
 epoch: 13, train_loss: 0.7800, test_loss: 0.9715, test_f1: 0.6320
 epoch: 14, train_loss: 0.7710, test_loss: 1.0244, test_f1: 0.6021
 epoch: 15, train_loss: 0.7341, test_loss: 1.0305, test_f1: 0.5619
 epoch: 16, train_loss: 0.7388, test_loss: 1.0058, test_f1: 0.6069
 epoch: 17, train_loss: 0.7314, test_loss: 1.0080, test_f1: 0.6084
 epoch: 18, train_loss: 0.7046, test_loss: 1.0243, test_f1: 0.5853
 epoch: 19, train_loss: 0.6844, test_loss: 1.0126, test_f1: 0.6044
 epoch: 20, train_loss: 0.6847, test_loss: 1.0551, test_f1: 0.5761
 epoch: 21, train_loss: 0.6707, test_loss: 1.0346, test_f1: 0.6146
 epoch: 22, train_loss: 0.6490, test_loss: 1.0365, test_f1: 0.5796
 epoch: 23, train_loss: 0.6290, test_loss: 1.0433, test_f1: 0.5909
 epoch: 24, train_loss: 0.6492, test_loss: 1.0908, test_f1: 0.5694
 epoch: 25, train_loss: 0.6185, test_loss: 1.0286, test_f1: 0.5934
 epoch: 26, train_loss: 0.6155, test_loss: 1.1267, test_f1: 0.5830
 epoch: 27, train_loss: 0.6027, test_loss: 1.1005, test_f1: 0.5884
 epoch: 28, train_loss: 0.5865, test_loss: 1.1065, test_f1: 0.6018
 epoch: 29, train_loss: 0.5887, test_loss: 1.1001, test_f1: 0.5811
 epoch: 30, train_loss: 0.5980, test_loss: 1.0822, test_f1: 0.6182
 epoch: 31, train_loss: 0.5688, test_loss: 1.2240, test_f1: 0.5740
 epoch: 32, train_loss: 0.5602, test_loss: 1.1393, test_f1: 0.5935
 epoch: 33, train_loss: 0.5444, test_loss: 1.2066, test_f1: 0.5906
 epoch: 34, train_loss: 0.5212, test_loss: 1.2243, test_f1: 0.5639
 epoch: 35, train_loss: 0.5141, test_loss: 1.2341, test_f1: 0.5934
 epoch: 36, train_loss: 0.5072, test_loss: 1.2009, test_f1: 0.5911
 epoch: 37, train_loss: 0.5039, test_loss: 1.3126, test_f1: 0.5816
 epoch: 38, train_loss: 0.5109, test_loss: 1.2866, test_f1: 0.6014
 epoch: 39, train_loss: 0.4910, test_loss: 1.1864, test_f1: 0.6129
 epoch: 40, train_loss: 0.4852, test_loss: 1.3311, test_f1: 0.6216
 epoch: 41, train_loss: 0.4727, test_loss: 1.3507, test_f1: 0.6190
 epoch: 42, train_loss: 0.4514, test_loss: 1.1881, test_f1: 0.6282
 epoch: 43, train_loss: 0.4651, test_loss: 1.3521, test_f1: 0.6120
 epoch: 44, train_loss: 0.4473, test_loss: 1.3732, test_f1: 0.6187
 epoch: 45, train_loss: 0.4293, test_loss: 1.3867, test_f1: 0.5868
 epoch: 46, train_loss: 0.4336, test_loss: 1.4430, test_f1: 0.6145
 epoch: 47, train_loss: 0.4156, test_loss: 1.4518, test_f1: 0.5974
 epoch: 48, train_loss: 0.4018, test_loss: 1.3738, test_f1: 0.6203
 epoch: 49, train_loss: 0.3845, test_loss: 1.4257, test_f1: 0.6367
 epoch: 50, train_loss: 0.3923, test_loss: 1.4218, test_f1: 0.6182
 epoch: 51, train_loss: 0.3661, test_loss: 1.4978, test_f1: 0.6034
 epoch: 52, train_loss: 0.3677, test_loss: 1.5056, test_f1: 0.6036
 epoch: 53, train_loss: 0.3493, test_loss: 1.5406, test_f1: 0.6080
 epoch: 54, train_loss: 0.3514, test_loss: 1.5695, test_f1: 0.6096
 epoch: 55, train_loss: 0.3615, test_loss: 1.4998, test_f1: 0.6599
 epoch: 56, train_loss: 0.3463, test_loss: 1.5841, test_f1: 0.6504
 epoch: 57, train_loss: 0.3310, test_loss: 1.5030, test_f1: 0.6425
 epoch: 58, train_loss: 0.3383, test_loss: 1.5861, test_f1: 0.6454
 epoch: 59, train_loss: 0.3301, test_loss: 1.5813, test_f1: 0.6284
 epoch: 60, train_loss: 0.3251, test_loss: 1.6121, test_f1: 0.6207
 epoch: 61, train_loss: 0.3193, test_loss: 1.5768, test_f1: 0.6166
 epoch: 62, train_loss: 0.3278, test_loss: 1.7061, test_f1: 0.6058
 epoch: 63, train_loss: 0.3264, test_loss: 1.7070, test_f1: 0.5771
 epoch: 64, train_loss: 0.3308, test_loss: 1.6984, test_f1: 0.6013
 epoch: 65, train_loss: 0.3185, test_loss: 1.6801, test_f1: 0.6114
 epoch: 66, train_loss: 0.2964, test_loss: 1.7430, test_f1: 0.5990
 epoch: 67, train_loss: 0.3036, test_loss: 1.6546, test_f1: 0.6162
 epoch: 68, train_loss: 0.3045, test_loss: 1.6539, test_f1: 0.6221
 epoch: 69, train_loss: 0.2825, test_loss: 1.7312, test_f1: 0.5906
 epoch: 70, train_loss: 0.2766, test_loss: 1.7564, test_f1: 0.5989
 epoch: 71, train_loss: 0.2740, test_loss: 1.7493, test_f1: 0.6320
 epoch: 72, train_loss: 0.2834, test_loss: 1.7866, test_f1: 0.6080
 epoch: 73, train_loss: 0.2956, test_loss: 1.7423, test_f1: 0.6185
 epoch: 74, train_loss: 0.2718, test_loss: 1.7458, test_f1: 0.6330
 epoch: 75, train_loss: 0.2667, test_loss: 1.7717, test_f1: 0.6308
 epoch: 76, train_loss: 0.2869, test_loss: 1.7534, test_f1: 0.6367
 epoch: 77, train_loss: 0.2995, test_loss: 1.7459, test_f1: 0.6518
 epoch: 78, train_loss: 0.2624, test_loss: 1.7201, test_f1: 0.6458
 epoch: 79, train_loss: 0.2533, test_loss: 1.7784, test_f1: 0.6196
 epoch: 80, train_loss: 0.2512, test_loss: 1.8246, test_f1: 0.6267
 epoch: 81, train_loss: 0.2593, test_loss: 1.7037, test_f1: 0.6319
 epoch: 82, train_loss: 0.2630, test_loss: 1.8029, test_f1: 0.6179
 epoch: 83, train_loss: 0.2546, test_loss: 1.8451, test_f1: 0.6342
 epoch: 84, train_loss: 0.2475, test_loss: 1.8584, test_f1: 0.6117
 epoch: 85, train_loss: 0.2604, test_loss: 1.7704, test_f1: 0.6188
 epoch: 86, train_loss: 0.2303, test_loss: 1.7346, test_f1: 0.6199
 epoch: 87, train_loss: 0.2409, test_loss: 1.8026, test_f1: 0.6241
 epoch: 88, train_loss: 0.2349, test_loss: 1.8428, test_f1: 0.6193
 epoch: 89, train_loss: 0.2547, test_loss: 1.8932, test_f1: 0.6068
 epoch: 90, train_loss: 0.2337, test_loss: 1.8380, test_f1: 0.6213
 epoch: 91, train_loss: 0.2311, test_loss: 1.9029, test_f1: 0.6256
 epoch: 92, train_loss: 0.2494, test_loss: 1.9229, test_f1: 0.6219
 epoch: 93, train_loss: 0.2389, test_loss: 1.9138, test_f1: 0.6437
 epoch: 94, train_loss: 0.2243, test_loss: 1.9330, test_f1: 0.6250
 epoch: 95, train_loss: 0.2201, test_loss: 1.9789, test_f1: 0.6216
 epoch: 96, train_loss: 0.2254, test_loss: 1.9906, test_f1: 0.6474
 epoch: 97, train_loss: 0.2261, test_loss: 1.9408, test_f1: 0.6259
 epoch: 98, train_loss: 0.2127, test_loss: 1.9241, test_f1: 0.6534
 epoch: 99, train_loss: 0.2202, test_loss: 1.9670, test_f1: 0.6240
##################ITERATION #8 ****************************************
 epoch: 0, train_loss: 1.2429, test_loss: 1.2946, test_f1: 0.2281
 epoch: 1, train_loss: 1.1204, test_loss: 1.2889, test_f1: 0.3199
 epoch: 2, train_loss: 1.0690, test_loss: 1.1776, test_f1: 0.3864
 epoch: 3, train_loss: 1.0381, test_loss: 1.1385, test_f1: 0.4937
 epoch: 4, train_loss: 1.0168, test_loss: 1.0809, test_f1: 0.5139
 epoch: 5, train_loss: 0.9649, test_loss: 1.0941, test_f1: 0.5585
 epoch: 6, train_loss: 0.9482, test_loss: 1.0262, test_f1: 0.5369
 epoch: 7, train_loss: 0.9296, test_loss: 1.0308, test_f1: 0.5754
 epoch: 8, train_loss: 0.8843, test_loss: 1.0310, test_f1: 0.5435
 epoch: 9, train_loss: 0.8756, test_loss: 1.0148, test_f1: 0.5860
 epoch: 10, train_loss: 0.8675, test_loss: 1.0348, test_f1: 0.5692
 epoch: 11, train_loss: 0.8667, test_loss: 1.0183, test_f1: 0.5939
 epoch: 12, train_loss: 0.8339, test_loss: 1.0185, test_f1: 0.5711
 epoch: 13, train_loss: 0.8262, test_loss: 1.0039, test_f1: 0.5749
 epoch: 14, train_loss: 0.8022, test_loss: 1.0646, test_f1: 0.5616
 epoch: 15, train_loss: 0.7996, test_loss: 1.0696, test_f1: 0.5924
 epoch: 16, train_loss: 0.7921, test_loss: 1.0311, test_f1: 0.5701
 epoch: 17, train_loss: 0.7692, test_loss: 1.0549, test_f1: 0.5677
 epoch: 18, train_loss: 0.7542, test_loss: 1.0189, test_f1: 0.6082
 epoch: 19, train_loss: 0.7373, test_loss: 1.0475, test_f1: 0.5926
 epoch: 20, train_loss: 0.7099, test_loss: 1.0178, test_f1: 0.5939
 epoch: 21, train_loss: 0.7140, test_loss: 1.0556, test_f1: 0.5787
 epoch: 22, train_loss: 0.7023, test_loss: 1.0675, test_f1: 0.5600
 epoch: 23, train_loss: 0.6878, test_loss: 1.1057, test_f1: 0.5737
 epoch: 24, train_loss: 0.6608, test_loss: 1.2274, test_f1: 0.5438
 epoch: 25, train_loss: 0.6617, test_loss: 1.1384, test_f1: 0.5663
 epoch: 26, train_loss: 0.6522, test_loss: 1.0900, test_f1: 0.5503
 epoch: 27, train_loss: 0.6375, test_loss: 1.1146, test_f1: 0.5644
 epoch: 28, train_loss: 0.6200, test_loss: 1.1817, test_f1: 0.5505
 epoch: 29, train_loss: 0.6067, test_loss: 1.1785, test_f1: 0.5787
 epoch: 30, train_loss: 0.6166, test_loss: 1.1987, test_f1: 0.5844
 epoch: 31, train_loss: 0.6230, test_loss: 1.1445, test_f1: 0.5663
 epoch: 32, train_loss: 0.5859, test_loss: 1.1603, test_f1: 0.5687
 epoch: 33, train_loss: 0.5773, test_loss: 1.1289, test_f1: 0.5633
 epoch: 34, train_loss: 0.5844, test_loss: 1.3517, test_f1: 0.5390
 epoch: 35, train_loss: 0.5675, test_loss: 1.1457, test_f1: 0.5995
 epoch: 36, train_loss: 0.5867, test_loss: 1.2419, test_f1: 0.5605
 epoch: 37, train_loss: 0.5505, test_loss: 1.1576, test_f1: 0.5826
 epoch: 38, train_loss: 0.5494, test_loss: 1.2482, test_f1: 0.5877
 epoch: 39, train_loss: 0.5086, test_loss: 1.2440, test_f1: 0.5857
 epoch: 40, train_loss: 0.5412, test_loss: 1.2116, test_f1: 0.5620
 epoch: 41, train_loss: 0.5268, test_loss: 1.2441, test_f1: 0.5501
 epoch: 42, train_loss: 0.5036, test_loss: 1.2083, test_f1: 0.6224
 epoch: 43, train_loss: 0.5046, test_loss: 1.1747, test_f1: 0.6075
 epoch: 44, train_loss: 0.4884, test_loss: 1.2872, test_f1: 0.5801
 epoch: 45, train_loss: 0.4919, test_loss: 1.2170, test_f1: 0.6232
 epoch: 46, train_loss: 0.4728, test_loss: 1.4359, test_f1: 0.5619
 epoch: 47, train_loss: 0.4810, test_loss: 1.5480, test_f1: 0.5437
 epoch: 48, train_loss: 0.4791, test_loss: 1.2766, test_f1: 0.6041
 epoch: 49, train_loss: 0.4395, test_loss: 1.2852, test_f1: 0.6107
 epoch: 50, train_loss: 0.4343, test_loss: 1.3234, test_f1: 0.5769
 epoch: 51, train_loss: 0.4102, test_loss: 1.2542, test_f1: 0.6126
 epoch: 52, train_loss: 0.4102, test_loss: 1.3758, test_f1: 0.5602
 epoch: 53, train_loss: 0.4054, test_loss: 1.3691, test_f1: 0.5760
 epoch: 54, train_loss: 0.4106, test_loss: 1.3314, test_f1: 0.5688
 epoch: 55, train_loss: 0.4030, test_loss: 1.3792, test_f1: 0.5714
 epoch: 56, train_loss: 0.3829, test_loss: 1.3782, test_f1: 0.5533
 epoch: 57, train_loss: 0.3834, test_loss: 1.3628, test_f1: 0.5704
 epoch: 58, train_loss: 0.3757, test_loss: 1.4031, test_f1: 0.5516
 epoch: 59, train_loss: 0.3938, test_loss: 1.3797, test_f1: 0.5733
 epoch: 60, train_loss: 0.3857, test_loss: 1.3719, test_f1: 0.5557
 epoch: 61, train_loss: 0.3856, test_loss: 1.4097, test_f1: 0.5819
 epoch: 62, train_loss: 0.3595, test_loss: 1.3983, test_f1: 0.5699
 epoch: 63, train_loss: 0.3521, test_loss: 1.4949, test_f1: 0.5553
 epoch: 64, train_loss: 0.3759, test_loss: 1.5055, test_f1: 0.5723
 epoch: 65, train_loss: 0.3577, test_loss: 1.5157, test_f1: 0.5716
 epoch: 66, train_loss: 0.3592, test_loss: 1.4909, test_f1: 0.6100
 epoch: 67, train_loss: 0.3686, test_loss: 1.4263, test_f1: 0.5858
 epoch: 68, train_loss: 0.3472, test_loss: 1.4533, test_f1: 0.5881
 epoch: 69, train_loss: 0.3354, test_loss: 1.5055, test_f1: 0.5855
 epoch: 70, train_loss: 0.3316, test_loss: 1.4908, test_f1: 0.6065
 epoch: 71, train_loss: 0.3360, test_loss: 1.5490, test_f1: 0.5658
 epoch: 72, train_loss: 0.3247, test_loss: 1.5393, test_f1: 0.5939
 epoch: 73, train_loss: 0.3330, test_loss: 1.5521, test_f1: 0.5753
 epoch: 74, train_loss: 0.3246, test_loss: 1.5509, test_f1: 0.5664
 epoch: 75, train_loss: 0.3291, test_loss: 1.5711, test_f1: 0.5835
 epoch: 76, train_loss: 0.3316, test_loss: 1.5837, test_f1: 0.5698
 epoch: 77, train_loss: 0.2958, test_loss: 1.5571, test_f1: 0.5999
 epoch: 78, train_loss: 0.2982, test_loss: 1.6087, test_f1: 0.5721
 epoch: 79, train_loss: 0.3094, test_loss: 1.5627, test_f1: 0.5882
 epoch: 80, train_loss: 0.2896, test_loss: 1.5621, test_f1: 0.5895
 epoch: 81, train_loss: 0.2962, test_loss: 1.6482, test_f1: 0.5523
 epoch: 82, train_loss: 0.2960, test_loss: 1.5842, test_f1: 0.5888
 epoch: 83, train_loss: 0.2717, test_loss: 1.5524, test_f1: 0.6023
 epoch: 84, train_loss: 0.3020, test_loss: 1.6629, test_f1: 0.5719
 epoch: 85, train_loss: 0.2945, test_loss: 1.7597, test_f1: 0.5945
 epoch: 86, train_loss: 0.2967, test_loss: 1.7027, test_f1: 0.5680
 epoch: 87, train_loss: 0.2891, test_loss: 1.6604, test_f1: 0.5460
 epoch: 88, train_loss: 0.2910, test_loss: 1.6660, test_f1: 0.5859
 epoch: 89, train_loss: 0.2833, test_loss: 1.6637, test_f1: 0.5451
 epoch: 90, train_loss: 0.2801, test_loss: 1.6879, test_f1: 0.5711
 epoch: 91, train_loss: 0.2666, test_loss: 1.7346, test_f1: 0.5816
 epoch: 92, train_loss: 0.2688, test_loss: 1.7464, test_f1: 0.5761
 epoch: 93, train_loss: 0.2731, test_loss: 1.7710, test_f1: 0.5704
 epoch: 94, train_loss: 0.2629, test_loss: 1.7747, test_f1: 0.5924
 epoch: 95, train_loss: 0.2692, test_loss: 1.7152, test_f1: 0.5781
 epoch: 96, train_loss: 0.2721, test_loss: 1.6826, test_f1: 0.6223
 epoch: 97, train_loss: 0.2642, test_loss: 1.7931, test_f1: 0.5836
 epoch: 98, train_loss: 0.2628, test_loss: 1.8400, test_f1: 0.5696
 epoch: 99, train_loss: 0.2555, test_loss: 1.7458, test_f1: 0.5719
##################ITERATION #9 ****************************************
 epoch: 0, train_loss: 1.2939, test_loss: 1.3034, test_f1: 0.2281
 epoch: 1, train_loss: 1.1054, test_loss: 1.2927, test_f1: 0.3227
 epoch: 2, train_loss: 1.0496, test_loss: 1.1860, test_f1: 0.5073
 epoch: 3, train_loss: 1.0286, test_loss: 1.1772, test_f1: 0.4735
 epoch: 4, train_loss: 0.9985, test_loss: 1.1428, test_f1: 0.5380
 epoch: 5, train_loss: 0.9575, test_loss: 1.1565, test_f1: 0.5189
 epoch: 6, train_loss: 0.9581, test_loss: 1.1017, test_f1: 0.5239
 epoch: 7, train_loss: 0.9141, test_loss: 1.1120, test_f1: 0.4964
 epoch: 8, train_loss: 0.9118, test_loss: 1.0434, test_f1: 0.5608
 epoch: 9, train_loss: 0.8585, test_loss: 1.0747, test_f1: 0.5723
 epoch: 10, train_loss: 0.8441, test_loss: 1.0820, test_f1: 0.5617
 epoch: 11, train_loss: 0.8361, test_loss: 1.1320, test_f1: 0.5531
 epoch: 12, train_loss: 0.8059, test_loss: 1.1376, test_f1: 0.5617
 epoch: 13, train_loss: 0.7924, test_loss: 1.0957, test_f1: 0.5603
 epoch: 14, train_loss: 0.7810, test_loss: 1.1008, test_f1: 0.5739
 epoch: 15, train_loss: 0.7664, test_loss: 1.0826, test_f1: 0.5561
 epoch: 16, train_loss: 0.7551, test_loss: 1.0976, test_f1: 0.5462
 epoch: 17, train_loss: 0.7553, test_loss: 1.1176, test_f1: 0.6004
 epoch: 18, train_loss: 0.7259, test_loss: 1.0907, test_f1: 0.6017
 epoch: 19, train_loss: 0.7164, test_loss: 1.0654, test_f1: 0.6228
 epoch: 20, train_loss: 0.7010, test_loss: 1.1655, test_f1: 0.5755
 epoch: 21, train_loss: 0.6909, test_loss: 1.1252, test_f1: 0.5801
 epoch: 22, train_loss: 0.6867, test_loss: 1.1342, test_f1: 0.5915
 epoch: 23, train_loss: 0.6583, test_loss: 1.1275, test_f1: 0.5790
 epoch: 24, train_loss: 0.6479, test_loss: 1.1457, test_f1: 0.5903
 epoch: 25, train_loss: 0.6568, test_loss: 1.2390, test_f1: 0.6042
 epoch: 26, train_loss: 0.6270, test_loss: 1.1646, test_f1: 0.5866
 epoch: 27, train_loss: 0.6163, test_loss: 1.1638, test_f1: 0.5868
 epoch: 28, train_loss: 0.6177, test_loss: 1.1110, test_f1: 0.6183
 epoch: 29, train_loss: 0.5818, test_loss: 1.2295, test_f1: 0.6218
 epoch: 30, train_loss: 0.5950, test_loss: 1.2480, test_f1: 0.6011
 epoch: 31, train_loss: 0.5791, test_loss: 1.2548, test_f1: 0.6009
 epoch: 32, train_loss: 0.5743, test_loss: 1.2604, test_f1: 0.6019
 epoch: 33, train_loss: 0.5686, test_loss: 1.2764, test_f1: 0.5895
 epoch: 34, train_loss: 0.5526, test_loss: 1.3303, test_f1: 0.6258
 epoch: 35, train_loss: 0.5571, test_loss: 1.3169, test_f1: 0.5956
 epoch: 36, train_loss: 0.5351, test_loss: 1.3233, test_f1: 0.6022
 epoch: 37, train_loss: 0.5330, test_loss: 1.3405, test_f1: 0.5688
 epoch: 38, train_loss: 0.5322, test_loss: 1.3922, test_f1: 0.6261
 epoch: 39, train_loss: 0.5102, test_loss: 1.3208, test_f1: 0.6442
 epoch: 40, train_loss: 0.4902, test_loss: 1.4168, test_f1: 0.6069
 epoch: 41, train_loss: 0.4845, test_loss: 1.3705, test_f1: 0.5884
 epoch: 42, train_loss: 0.4631, test_loss: 1.3929, test_f1: 0.5801
 epoch: 43, train_loss: 0.4736, test_loss: 1.3165, test_f1: 0.6047
 epoch: 44, train_loss: 0.4492, test_loss: 1.2754, test_f1: 0.6192
 epoch: 45, train_loss: 0.4672, test_loss: 1.3825, test_f1: 0.6199
 epoch: 46, train_loss: 0.4505, test_loss: 1.2960, test_f1: 0.6456
 epoch: 47, train_loss: 0.4472, test_loss: 1.4073, test_f1: 0.5855
 epoch: 48, train_loss: 0.4263, test_loss: 1.4180, test_f1: 0.6215
 epoch: 49, train_loss: 0.4146, test_loss: 1.4050, test_f1: 0.6181
 epoch: 50, train_loss: 0.4234, test_loss: 1.5739, test_f1: 0.6209
 epoch: 51, train_loss: 0.4020, test_loss: 1.4606, test_f1: 0.6152
 epoch: 52, train_loss: 0.3720, test_loss: 1.4744, test_f1: 0.6296
 epoch: 53, train_loss: 0.3588, test_loss: 1.4965, test_f1: 0.6225
 epoch: 54, train_loss: 0.3510, test_loss: 1.5399, test_f1: 0.6161
 epoch: 55, train_loss: 0.3616, test_loss: 1.5474, test_f1: 0.6285
 epoch: 56, train_loss: 0.3558, test_loss: 1.4839, test_f1: 0.6253
 epoch: 57, train_loss: 0.3598, test_loss: 1.4731, test_f1: 0.6271
 epoch: 58, train_loss: 0.3531, test_loss: 1.5267, test_f1: 0.6188
 epoch: 59, train_loss: 0.3496, test_loss: 1.4918, test_f1: 0.6198
 epoch: 60, train_loss: 0.3513, test_loss: 1.5450, test_f1: 0.6208
 epoch: 61, train_loss: 0.3599, test_loss: 1.6009, test_f1: 0.6390
 epoch: 62, train_loss: 0.3391, test_loss: 1.5387, test_f1: 0.6312
 epoch: 63, train_loss: 0.3256, test_loss: 1.5145, test_f1: 0.6472
 epoch: 64, train_loss: 0.3318, test_loss: 1.5241, test_f1: 0.6085
 epoch: 65, train_loss: 0.3098, test_loss: 1.5825, test_f1: 0.6188
 epoch: 66, train_loss: 0.3410, test_loss: 1.5775, test_f1: 0.6176
 epoch: 67, train_loss: 0.3292, test_loss: 1.5567, test_f1: 0.6279
 epoch: 68, train_loss: 0.3234, test_loss: 1.6748, test_f1: 0.6213
 epoch: 69, train_loss: 0.3120, test_loss: 1.6434, test_f1: 0.6100
 epoch: 70, train_loss: 0.3036, test_loss: 1.6725, test_f1: 0.6230
 epoch: 71, train_loss: 0.3038, test_loss: 1.7109, test_f1: 0.6239
 epoch: 72, train_loss: 0.2947, test_loss: 1.6472, test_f1: 0.6579
 epoch: 73, train_loss: 0.2865, test_loss: 1.6981, test_f1: 0.6357
 epoch: 74, train_loss: 0.2906, test_loss: 1.6395, test_f1: 0.6486
 epoch: 75, train_loss: 0.2734, test_loss: 1.7190, test_f1: 0.6534
 epoch: 76, train_loss: 0.2825, test_loss: 1.6696, test_f1: 0.6519
 epoch: 77, train_loss: 0.2734, test_loss: 1.6960, test_f1: 0.6210
 epoch: 78, train_loss: 0.2861, test_loss: 1.8027, test_f1: 0.6176
 epoch: 79, train_loss: 0.2911, test_loss: 1.7314, test_f1: 0.6314
 epoch: 80, train_loss: 0.2558, test_loss: 1.8046, test_f1: 0.6280
 epoch: 81, train_loss: 0.2750, test_loss: 1.7758, test_f1: 0.6486
 epoch: 82, train_loss: 0.2627, test_loss: 1.7343, test_f1: 0.6393
 epoch: 83, train_loss: 0.2575, test_loss: 1.7798, test_f1: 0.6359
 epoch: 84, train_loss: 0.2590, test_loss: 1.8065, test_f1: 0.6371
 epoch: 85, train_loss: 0.2581, test_loss: 1.8443, test_f1: 0.6435
 epoch: 86, train_loss: 0.2707, test_loss: 1.7945, test_f1: 0.6379
 epoch: 87, train_loss: 0.2777, test_loss: 1.8705, test_f1: 0.6421
 epoch: 88, train_loss: 0.2346, test_loss: 1.7561, test_f1: 0.6228
 epoch: 89, train_loss: 0.2595, test_loss: 1.9254, test_f1: 0.6140
 epoch: 90, train_loss: 0.2414, test_loss: 1.9085, test_f1: 0.6064
 epoch: 91, train_loss: 0.2461, test_loss: 2.0548, test_f1: 0.6099
 epoch: 92, train_loss: 0.2351, test_loss: 1.9663, test_f1: 0.6029
 epoch: 93, train_loss: 0.2494, test_loss: 1.9616, test_f1: 0.6215
 epoch: 94, train_loss: 0.2394, test_loss: 1.9606, test_f1: 0.6357
 epoch: 95, train_loss: 0.2345, test_loss: 1.9021, test_f1: 0.6499
 epoch: 96, train_loss: 0.2344, test_loss: 1.9842, test_f1: 0.6459
 epoch: 97, train_loss: 0.2221, test_loss: 1.9500, test_f1: 0.6435
 epoch: 98, train_loss: 0.2358, test_loss: 1.9599, test_f1: 0.6503
 epoch: 99, train_loss: 0.2190, test_loss: 1.9923, test_f1: 0.6476

Training completed in 561.93 seconds
Best F1: 0.6607 at epoch 91
Mean F1 across iterations: 0.6472  0.0115
========================FINAL RESULTS================================
FEGIN weighted F1: 0.6607  0.0115
python main.py --data ltspice_demos --representation component_pin --model FEGIN --layers 6 --hiddens 128 --batch_size 64 --lr 0.0001 --emb_size 512 --epochs 100 --save_appendix component_pin_L6_H128_BS64_LR0.0001_E512 --no_val
-----



STDERR:
  File "main.py", line 370, in <module>
    main()
  File "main.py", line 254, in main
    dataset = dataset_class(
  File "/home/philip/projects/ltspice_examples_code_repo/Circuit-Completion-Using-GNNs/component_classification_with_link_prediction_head/evaluation/FEGIN/kernel/circuit_datasets.py", line 15, in __init__
    self.data, self.slices = torch.load(self.processed_paths[0])
  File "/home/philip/.local/lib/python3.8/site-packages/torch/serialization.py", line 1040, in load
    warnings.warn(
  File "/usr/lib/python3.8/warnings.py", line 109, in _showwarnmsg
    sw(msg.message, msg.category, msg.filename, msg.lineno,
  File "main.py", line 47, in warn_with_traceback
    traceback.print_stack(file=log)
/home/philip/projects/ltspice_examples_code_repo/Circuit-Completion-Using-GNNs/component_classification_with_link_prediction_head/evaluation/FEGIN/kernel/circuit_datasets.py:15: FutureWarning: You are using `torch.load` with `weights_only=False` (the current default value), which uses the default pickle module implicitly. It is possible to construct malicious pickle data which will execute arbitrary code during unpickling (See https://github.com/pytorch/pytorch/blob/main/SECURITY.md#untrusted-models for more details). In a future release, the default value for `weights_only` will be flipped to `True`. This limits the functions that could be executed during unpickling. Arbitrary objects will no longer be allowed to be loaded via this mode unless they are explicitly allowlisted by the user via `torch.serialization.add_safe_globals`. We recommend you start setting `weights_only=True` for any use case where you don't have full control of the loaded file. Please open an issue on GitHub for any issues related to this experimental feature.
  self.data, self.slices = torch.load(self.processed_paths[0])
