STDOUT:
Results will be saved in /home/philip/projects/ltspice_examples_code_repo/Circuit-Completion-Using-GNNs/component_classification_with_link_prediction_head/evaluation/FEGIN/results/model_FEGIN_dataset_ltspice_examples
Command line input: python main.py --data ltspice_examples --representation component_net --model FEGIN --layers 5 --hiddens 64 --batch_size 128 --lr 0.0001 --emb_size 512 --epochs 100 --save_appendix component_net_L5_H64_BS128_LR0.0001_E512 --no_val
 is saved.
-----
ltspice_examples - FEGIN
Using 5 layers, 64 hidden units, h = 2
Loading component_net representation dataset
ENTERED
Training FEGIN on component_net representation
Train: 3558, Test: 846
##################ITERATION #0 ****************************************
 epoch: 0, train_loss: 1.4016, test_loss: 1.3970, test_f1: 0.0793
 epoch: 1, train_loss: 1.3828, test_loss: 1.3818, test_f1: 0.2029
 epoch: 2, train_loss: 1.3662, test_loss: 1.3569, test_f1: 0.3912
 epoch: 3, train_loss: 1.3442, test_loss: 1.3296, test_f1: 0.3620
 epoch: 4, train_loss: 1.3193, test_loss: 1.3020, test_f1: 0.3286
 epoch: 5, train_loss: 1.2909, test_loss: 1.2735, test_f1: 0.3149
 epoch: 6, train_loss: 1.2634, test_loss: 1.2480, test_f1: 0.3139
 epoch: 7, train_loss: 1.2384, test_loss: 1.2257, test_f1: 0.3286
 epoch: 8, train_loss: 1.2167, test_loss: 1.2032, test_f1: 0.3445
 epoch: 9, train_loss: 1.1953, test_loss: 1.1831, test_f1: 0.3333
 epoch: 10, train_loss: 1.1824, test_loss: 1.1658, test_f1: 0.3484
 epoch: 11, train_loss: 1.1655, test_loss: 1.1449, test_f1: 0.3521
 epoch: 12, train_loss: 1.1440, test_loss: 1.1259, test_f1: 0.3450
 epoch: 13, train_loss: 1.1319, test_loss: 1.1112, test_f1: 0.3621
 epoch: 14, train_loss: 1.1168, test_loss: 1.1017, test_f1: 0.3970
 epoch: 15, train_loss: 1.1026, test_loss: 1.0786, test_f1: 0.4518
 epoch: 16, train_loss: 1.0868, test_loss: 1.0703, test_f1: 0.4825
 epoch: 17, train_loss: 1.0777, test_loss: 1.0595, test_f1: 0.4875
 epoch: 18, train_loss: 1.0571, test_loss: 1.0472, test_f1: 0.4925
 epoch: 19, train_loss: 1.0510, test_loss: 1.0349, test_f1: 0.5130
 epoch: 20, train_loss: 1.0315, test_loss: 1.0116, test_f1: 0.5145
 epoch: 21, train_loss: 1.0172, test_loss: 0.9977, test_f1: 0.5265
 epoch: 22, train_loss: 1.0026, test_loss: 0.9832, test_f1: 0.5220
 epoch: 23, train_loss: 0.9991, test_loss: 0.9710, test_f1: 0.5079
 epoch: 24, train_loss: 0.9792, test_loss: 0.9595, test_f1: 0.5296
 epoch: 25, train_loss: 0.9632, test_loss: 0.9749, test_f1: 0.5184
 epoch: 26, train_loss: 0.9484, test_loss: 0.9600, test_f1: 0.5007
 epoch: 27, train_loss: 0.9396, test_loss: 0.9668, test_f1: 0.4975
 epoch: 28, train_loss: 0.9219, test_loss: 0.9387, test_f1: 0.5162
 epoch: 29, train_loss: 0.9132, test_loss: 0.9593, test_f1: 0.5020
 epoch: 30, train_loss: 0.9079, test_loss: 0.9304, test_f1: 0.5095
 epoch: 31, train_loss: 0.8967, test_loss: 0.9453, test_f1: 0.5254
 epoch: 32, train_loss: 0.8963, test_loss: 0.9527, test_f1: 0.5057
 epoch: 33, train_loss: 0.8897, test_loss: 0.9621, test_f1: 0.5083
 epoch: 34, train_loss: 0.8878, test_loss: 0.9203, test_f1: 0.5090
 epoch: 35, train_loss: 0.8759, test_loss: 0.9516, test_f1: 0.5169
 epoch: 36, train_loss: 0.8669, test_loss: 0.9377, test_f1: 0.5169
 epoch: 37, train_loss: 0.8622, test_loss: 0.9525, test_f1: 0.5157
 epoch: 38, train_loss: 0.8589, test_loss: 0.9504, test_f1: 0.5025
 epoch: 39, train_loss: 0.8568, test_loss: 0.9533, test_f1: 0.5108
 epoch: 40, train_loss: 0.8538, test_loss: 0.9624, test_f1: 0.5116
 epoch: 41, train_loss: 0.8463, test_loss: 0.9173, test_f1: 0.5342
 epoch: 42, train_loss: 0.8506, test_loss: 0.9502, test_f1: 0.5415
 epoch: 43, train_loss: 0.8364, test_loss: 0.9502, test_f1: 0.5183
 epoch: 44, train_loss: 0.8230, test_loss: 0.9609, test_f1: 0.5200
 epoch: 45, train_loss: 0.8380, test_loss: 0.9388, test_f1: 0.5449
 epoch: 46, train_loss: 0.8177, test_loss: 0.9586, test_f1: 0.5200
 epoch: 47, train_loss: 0.8163, test_loss: 0.9547, test_f1: 0.5114
 epoch: 48, train_loss: 0.8161, test_loss: 0.9561, test_f1: 0.5253
 epoch: 49, train_loss: 0.8093, test_loss: 0.9433, test_f1: 0.5523
 epoch: 50, train_loss: 0.8124, test_loss: 0.9562, test_f1: 0.5349
 epoch: 51, train_loss: 0.8102, test_loss: 0.9411, test_f1: 0.5319
 epoch: 52, train_loss: 0.7917, test_loss: 0.9414, test_f1: 0.5429
 epoch: 53, train_loss: 0.7852, test_loss: 0.9452, test_f1: 0.5347
 epoch: 54, train_loss: 0.7891, test_loss: 0.9562, test_f1: 0.5272
 epoch: 55, train_loss: 0.7835, test_loss: 0.9609, test_f1: 0.5524
 epoch: 56, train_loss: 0.7854, test_loss: 0.9587, test_f1: 0.5344
 epoch: 57, train_loss: 0.7850, test_loss: 0.9504, test_f1: 0.5435
 epoch: 58, train_loss: 0.7868, test_loss: 0.9665, test_f1: 0.5534
 epoch: 59, train_loss: 0.7904, test_loss: 0.9559, test_f1: 0.5372
 epoch: 60, train_loss: 0.7841, test_loss: 0.9625, test_f1: 0.5296
 epoch: 61, train_loss: 0.7773, test_loss: 0.9746, test_f1: 0.5326
 epoch: 62, train_loss: 0.7731, test_loss: 0.9766, test_f1: 0.5378
 epoch: 63, train_loss: 0.7877, test_loss: 0.9626, test_f1: 0.5383
 epoch: 64, train_loss: 0.7747, test_loss: 0.9747, test_f1: 0.5410
 epoch: 65, train_loss: 0.7652, test_loss: 0.9846, test_f1: 0.5421
 epoch: 66, train_loss: 0.7799, test_loss: 0.9646, test_f1: 0.5415
 epoch: 67, train_loss: 0.7731, test_loss: 0.9840, test_f1: 0.5405
 epoch: 68, train_loss: 0.7729, test_loss: 0.9685, test_f1: 0.5353
 epoch: 69, train_loss: 0.7682, test_loss: 0.9681, test_f1: 0.5439
 epoch: 70, train_loss: 0.7720, test_loss: 0.9593, test_f1: 0.5550
 epoch: 71, train_loss: 0.7706, test_loss: 0.9757, test_f1: 0.5401
 epoch: 72, train_loss: 0.7608, test_loss: 0.9833, test_f1: 0.5515
 epoch: 73, train_loss: 0.7596, test_loss: 0.9761, test_f1: 0.5509
 epoch: 74, train_loss: 0.7596, test_loss: 0.9780, test_f1: 0.5489
 epoch: 75, train_loss: 0.7599, test_loss: 0.9686, test_f1: 0.5610
 epoch: 76, train_loss: 0.7575, test_loss: 0.9804, test_f1: 0.5594
 epoch: 77, train_loss: 0.7574, test_loss: 0.9708, test_f1: 0.5546
 epoch: 78, train_loss: 0.7465, test_loss: 0.9667, test_f1: 0.5631
 epoch: 79, train_loss: 0.7535, test_loss: 0.9816, test_f1: 0.5496
 epoch: 80, train_loss: 0.7549, test_loss: 0.9644, test_f1: 0.5593
 epoch: 81, train_loss: 0.7539, test_loss: 0.9683, test_f1: 0.5539
 epoch: 82, train_loss: 0.7499, test_loss: 0.9723, test_f1: 0.5664
 epoch: 83, train_loss: 0.7548, test_loss: 0.9878, test_f1: 0.5597
 epoch: 84, train_loss: 0.7451, test_loss: 0.9822, test_f1: 0.5685
 epoch: 85, train_loss: 0.7519, test_loss: 0.9881, test_f1: 0.5536
 epoch: 86, train_loss: 0.7355, test_loss: 0.9868, test_f1: 0.5613
 epoch: 87, train_loss: 0.7495, test_loss: 0.9968, test_f1: 0.5568
 epoch: 88, train_loss: 0.7458, test_loss: 0.9744, test_f1: 0.5639
 epoch: 89, train_loss: 0.7372, test_loss: 0.9775, test_f1: 0.5669
 epoch: 90, train_loss: 0.7487, test_loss: 0.9707, test_f1: 0.5695
 epoch: 91, train_loss: 0.7319, test_loss: 0.9894, test_f1: 0.5707
 epoch: 92, train_loss: 0.7375, test_loss: 0.9848, test_f1: 0.5740
 epoch: 93, train_loss: 0.7316, test_loss: 0.9936, test_f1: 0.5516
 epoch: 94, train_loss: 0.7374, test_loss: 0.9964, test_f1: 0.5630
 epoch: 95, train_loss: 0.7320, test_loss: 0.9758, test_f1: 0.5677
 epoch: 96, train_loss: 0.7266, test_loss: 0.9655, test_f1: 0.5855
 epoch: 97, train_loss: 0.7424, test_loss: 0.9759, test_f1: 0.5761
 epoch: 98, train_loss: 0.7299, test_loss: 0.9815, test_f1: 0.5675
 epoch: 99, train_loss: 0.7335, test_loss: 0.9775, test_f1: 0.5803
##################ITERATION #1 ****************************************
 epoch: 0, train_loss: 1.3275, test_loss: 1.3647, test_f1: 0.2270
 epoch: 1, train_loss: 1.2844, test_loss: 1.3193, test_f1: 0.2489
 epoch: 2, train_loss: 1.2595, test_loss: 1.2599, test_f1: 0.3509
 epoch: 3, train_loss: 1.2370, test_loss: 1.2133, test_f1: 0.3881
 epoch: 4, train_loss: 1.2146, test_loss: 1.1847, test_f1: 0.4014
 epoch: 5, train_loss: 1.1915, test_loss: 1.1646, test_f1: 0.4135
 epoch: 6, train_loss: 1.1716, test_loss: 1.1413, test_f1: 0.4399
 epoch: 7, train_loss: 1.1508, test_loss: 1.1143, test_f1: 0.4409
 epoch: 8, train_loss: 1.1256, test_loss: 1.0929, test_f1: 0.4608
 epoch: 9, train_loss: 1.1036, test_loss: 1.0779, test_f1: 0.4670
 epoch: 10, train_loss: 1.0848, test_loss: 1.0534, test_f1: 0.4667
 epoch: 11, train_loss: 1.0607, test_loss: 1.0327, test_f1: 0.4636
 epoch: 12, train_loss: 1.0465, test_loss: 1.0201, test_f1: 0.4730
 epoch: 13, train_loss: 1.0224, test_loss: 1.0032, test_f1: 0.4759
 epoch: 14, train_loss: 1.0081, test_loss: 0.9937, test_f1: 0.4814
 epoch: 15, train_loss: 0.9989, test_loss: 0.9805, test_f1: 0.4833
 epoch: 16, train_loss: 0.9823, test_loss: 0.9679, test_f1: 0.4875
 epoch: 17, train_loss: 0.9688, test_loss: 0.9639, test_f1: 0.4831
 epoch: 18, train_loss: 0.9555, test_loss: 0.9737, test_f1: 0.4926
 epoch: 19, train_loss: 0.9442, test_loss: 0.9414, test_f1: 0.4934
 epoch: 20, train_loss: 0.9315, test_loss: 0.9394, test_f1: 0.4897
 epoch: 21, train_loss: 0.9332, test_loss: 0.9282, test_f1: 0.4976
 epoch: 22, train_loss: 0.9193, test_loss: 0.9433, test_f1: 0.5011
 epoch: 23, train_loss: 0.9202, test_loss: 0.9270, test_f1: 0.4981
 epoch: 24, train_loss: 0.9073, test_loss: 0.9335, test_f1: 0.4954
 epoch: 25, train_loss: 0.8886, test_loss: 0.9362, test_f1: 0.5073
 epoch: 26, train_loss: 0.8932, test_loss: 0.9364, test_f1: 0.5100
 epoch: 27, train_loss: 0.8838, test_loss: 0.9498, test_f1: 0.5057
 epoch: 28, train_loss: 0.8698, test_loss: 0.9227, test_f1: 0.5305
 epoch: 29, train_loss: 0.8687, test_loss: 0.9753, test_f1: 0.4899
 epoch: 30, train_loss: 0.8634, test_loss: 0.9485, test_f1: 0.5051
 epoch: 31, train_loss: 0.8615, test_loss: 0.9543, test_f1: 0.5041
 epoch: 32, train_loss: 0.8634, test_loss: 0.9327, test_f1: 0.5090
 epoch: 33, train_loss: 0.8484, test_loss: 0.9420, test_f1: 0.5110
 epoch: 34, train_loss: 0.8368, test_loss: 0.9195, test_f1: 0.5184
 epoch: 35, train_loss: 0.8278, test_loss: 0.9200, test_f1: 0.5189
 epoch: 36, train_loss: 0.8341, test_loss: 0.9242, test_f1: 0.5216
 epoch: 37, train_loss: 0.8330, test_loss: 0.9415, test_f1: 0.5401
 epoch: 38, train_loss: 0.8345, test_loss: 0.9265, test_f1: 0.5232
 epoch: 39, train_loss: 0.8145, test_loss: 0.9358, test_f1: 0.5198
 epoch: 40, train_loss: 0.8215, test_loss: 0.9282, test_f1: 0.5151
 epoch: 41, train_loss: 0.8201, test_loss: 0.9767, test_f1: 0.5111
 epoch: 42, train_loss: 0.8054, test_loss: 0.9407, test_f1: 0.5118
 epoch: 43, train_loss: 0.8102, test_loss: 0.9155, test_f1: 0.5365
 epoch: 44, train_loss: 0.8036, test_loss: 0.9570, test_f1: 0.5273
 epoch: 45, train_loss: 0.8039, test_loss: 0.9719, test_f1: 0.5173
 epoch: 46, train_loss: 0.7998, test_loss: 0.9556, test_f1: 0.5193
 epoch: 47, train_loss: 0.7892, test_loss: 0.9442, test_f1: 0.5381
 epoch: 48, train_loss: 0.8022, test_loss: 0.9479, test_f1: 0.5302
 epoch: 49, train_loss: 0.7890, test_loss: 0.9423, test_f1: 0.5348
 epoch: 50, train_loss: 0.7874, test_loss: 0.9341, test_f1: 0.5458
 epoch: 51, train_loss: 0.7760, test_loss: 0.9287, test_f1: 0.5283
 epoch: 52, train_loss: 0.7722, test_loss: 0.9465, test_f1: 0.5295
 epoch: 53, train_loss: 0.7654, test_loss: 0.9546, test_f1: 0.5440
 epoch: 54, train_loss: 0.7640, test_loss: 0.9474, test_f1: 0.5367
 epoch: 55, train_loss: 0.7754, test_loss: 0.9776, test_f1: 0.5280
 epoch: 56, train_loss: 0.7843, test_loss: 0.9531, test_f1: 0.5414
 epoch: 57, train_loss: 0.7738, test_loss: 0.9772, test_f1: 0.5356
 epoch: 58, train_loss: 0.7637, test_loss: 0.9412, test_f1: 0.5361
 epoch: 59, train_loss: 0.7680, test_loss: 0.9450, test_f1: 0.5477
 epoch: 60, train_loss: 0.7559, test_loss: 0.9731, test_f1: 0.5457
 epoch: 61, train_loss: 0.7694, test_loss: 0.9578, test_f1: 0.5461
 epoch: 62, train_loss: 0.7567, test_loss: 0.9378, test_f1: 0.5480
 epoch: 63, train_loss: 0.7500, test_loss: 0.9525, test_f1: 0.5396
 epoch: 64, train_loss: 0.7537, test_loss: 0.9504, test_f1: 0.5445
 epoch: 65, train_loss: 0.7546, test_loss: 0.9576, test_f1: 0.5435
 epoch: 66, train_loss: 0.7572, test_loss: 0.9675, test_f1: 0.5501
 epoch: 67, train_loss: 0.7548, test_loss: 0.9557, test_f1: 0.5420
 epoch: 68, train_loss: 0.7460, test_loss: 0.9586, test_f1: 0.5518
 epoch: 69, train_loss: 0.7503, test_loss: 0.9750, test_f1: 0.5409
 epoch: 70, train_loss: 0.7547, test_loss: 0.9541, test_f1: 0.5463
 epoch: 71, train_loss: 0.7457, test_loss: 0.9661, test_f1: 0.5483
 epoch: 72, train_loss: 0.7307, test_loss: 0.9696, test_f1: 0.5468
 epoch: 73, train_loss: 0.7377, test_loss: 0.9782, test_f1: 0.5555
 epoch: 74, train_loss: 0.7447, test_loss: 0.9853, test_f1: 0.5482
 epoch: 75, train_loss: 0.7397, test_loss: 0.9670, test_f1: 0.5714
 epoch: 76, train_loss: 0.7518, test_loss: 0.9648, test_f1: 0.5508
 epoch: 77, train_loss: 0.7406, test_loss: 0.9761, test_f1: 0.5549
 epoch: 78, train_loss: 0.7380, test_loss: 0.9762, test_f1: 0.5477
 epoch: 79, train_loss: 0.7329, test_loss: 1.0096, test_f1: 0.5527
 epoch: 80, train_loss: 0.7330, test_loss: 0.9693, test_f1: 0.5529
 epoch: 81, train_loss: 0.7377, test_loss: 0.9732, test_f1: 0.5529
 epoch: 82, train_loss: 0.7351, test_loss: 0.9874, test_f1: 0.5551
 epoch: 83, train_loss: 0.7324, test_loss: 0.9715, test_f1: 0.5474
 epoch: 84, train_loss: 0.7317, test_loss: 1.0032, test_f1: 0.5385
 epoch: 85, train_loss: 0.7352, test_loss: 0.9726, test_f1: 0.5563
 epoch: 86, train_loss: 0.7298, test_loss: 0.9770, test_f1: 0.5629
 epoch: 87, train_loss: 0.7313, test_loss: 0.9903, test_f1: 0.5565
 epoch: 88, train_loss: 0.7137, test_loss: 0.9867, test_f1: 0.5375
 epoch: 89, train_loss: 0.7333, test_loss: 0.9899, test_f1: 0.5534
 epoch: 90, train_loss: 0.7185, test_loss: 0.9639, test_f1: 0.5461
 epoch: 91, train_loss: 0.7139, test_loss: 0.9603, test_f1: 0.5446
 epoch: 92, train_loss: 0.7130, test_loss: 0.9893, test_f1: 0.5596
 epoch: 93, train_loss: 0.7132, test_loss: 0.9699, test_f1: 0.5619
 epoch: 94, train_loss: 0.7177, test_loss: 0.9766, test_f1: 0.5546
 epoch: 95, train_loss: 0.7143, test_loss: 0.9668, test_f1: 0.5548
 epoch: 96, train_loss: 0.7179, test_loss: 1.0057, test_f1: 0.5576
 epoch: 97, train_loss: 0.7121, test_loss: 0.9994, test_f1: 0.5652
 epoch: 98, train_loss: 0.7108, test_loss: 0.9867, test_f1: 0.5512
 epoch: 99, train_loss: 0.7231, test_loss: 0.9773, test_f1: 0.5661
##################ITERATION #2 ****************************************
 epoch: 0, train_loss: 1.2941, test_loss: 1.3288, test_f1: 0.2270
 epoch: 1, train_loss: 1.2384, test_loss: 1.2543, test_f1: 0.2801
 epoch: 2, train_loss: 1.2109, test_loss: 1.1892, test_f1: 0.3238
 epoch: 3, train_loss: 1.1863, test_loss: 1.1422, test_f1: 0.4227
 epoch: 4, train_loss: 1.1606, test_loss: 1.1129, test_f1: 0.4354
 epoch: 5, train_loss: 1.1332, test_loss: 1.0874, test_f1: 0.4488
 epoch: 6, train_loss: 1.1115, test_loss: 1.0596, test_f1: 0.4577
 epoch: 7, train_loss: 1.0889, test_loss: 1.0454, test_f1: 0.4716
 epoch: 8, train_loss: 1.0754, test_loss: 1.0198, test_f1: 0.4653
 epoch: 9, train_loss: 1.0526, test_loss: 1.0089, test_f1: 0.4684
 epoch: 10, train_loss: 1.0345, test_loss: 0.9882, test_f1: 0.4754
 epoch: 11, train_loss: 1.0153, test_loss: 0.9682, test_f1: 0.4938
 epoch: 12, train_loss: 1.0147, test_loss: 0.9568, test_f1: 0.4992
 epoch: 13, train_loss: 0.9910, test_loss: 0.9596, test_f1: 0.4896
 epoch: 14, train_loss: 0.9746, test_loss: 0.9506, test_f1: 0.4964
 epoch: 15, train_loss: 0.9662, test_loss: 0.9489, test_f1: 0.5003
 epoch: 16, train_loss: 0.9620, test_loss: 0.9420, test_f1: 0.4945
 epoch: 17, train_loss: 0.9573, test_loss: 0.9362, test_f1: 0.4871
 epoch: 18, train_loss: 0.9442, test_loss: 0.9419, test_f1: 0.4906
 epoch: 19, train_loss: 0.9331, test_loss: 0.9321, test_f1: 0.4985
 epoch: 20, train_loss: 0.9284, test_loss: 0.9293, test_f1: 0.4950
 epoch: 21, train_loss: 0.9300, test_loss: 0.9342, test_f1: 0.5096
 epoch: 22, train_loss: 0.9174, test_loss: 0.9261, test_f1: 0.5014
 epoch: 23, train_loss: 0.9128, test_loss: 0.9374, test_f1: 0.5186
 epoch: 24, train_loss: 0.8987, test_loss: 0.9442, test_f1: 0.5209
 epoch: 25, train_loss: 0.8994, test_loss: 0.9317, test_f1: 0.5184
 epoch: 26, train_loss: 0.8887, test_loss: 0.9633, test_f1: 0.5303
 epoch: 27, train_loss: 0.8889, test_loss: 0.9361, test_f1: 0.5281
 epoch: 28, train_loss: 0.8767, test_loss: 0.9256, test_f1: 0.5296
 epoch: 29, train_loss: 0.8697, test_loss: 0.9334, test_f1: 0.5257
 epoch: 30, train_loss: 0.8661, test_loss: 0.9471, test_f1: 0.5205
 epoch: 31, train_loss: 0.8659, test_loss: 0.9462, test_f1: 0.5418
 epoch: 32, train_loss: 0.8673, test_loss: 0.9384, test_f1: 0.5345
 epoch: 33, train_loss: 0.8586, test_loss: 0.9353, test_f1: 0.5305
 epoch: 34, train_loss: 0.8554, test_loss: 0.9522, test_f1: 0.5347
 epoch: 35, train_loss: 0.8473, test_loss: 0.9198, test_f1: 0.5452
 epoch: 36, train_loss: 0.8541, test_loss: 0.9365, test_f1: 0.5485
 epoch: 37, train_loss: 0.8507, test_loss: 0.9315, test_f1: 0.5487
 epoch: 38, train_loss: 0.8538, test_loss: 0.9355, test_f1: 0.5384
 epoch: 39, train_loss: 0.8308, test_loss: 0.9542, test_f1: 0.5415
 epoch: 40, train_loss: 0.8401, test_loss: 0.9276, test_f1: 0.5392
 epoch: 41, train_loss: 0.8400, test_loss: 0.9946, test_f1: 0.5318
 epoch: 42, train_loss: 0.8360, test_loss: 0.9467, test_f1: 0.5531
 epoch: 43, train_loss: 0.8275, test_loss: 0.9288, test_f1: 0.5476
 epoch: 44, train_loss: 0.8275, test_loss: 0.9414, test_f1: 0.5569
 epoch: 45, train_loss: 0.8289, test_loss: 0.9535, test_f1: 0.5473
 epoch: 46, train_loss: 0.8159, test_loss: 0.9382, test_f1: 0.5488
 epoch: 47, train_loss: 0.8232, test_loss: 0.9702, test_f1: 0.5444
 epoch: 48, train_loss: 0.8102, test_loss: 0.9414, test_f1: 0.5523
 epoch: 49, train_loss: 0.8132, test_loss: 0.9719, test_f1: 0.5475
 epoch: 50, train_loss: 0.8060, test_loss: 0.9503, test_f1: 0.5563
 epoch: 51, train_loss: 0.8049, test_loss: 0.9629, test_f1: 0.5570
 epoch: 52, train_loss: 0.8062, test_loss: 0.9354, test_f1: 0.5578
 epoch: 53, train_loss: 0.7970, test_loss: 0.9513, test_f1: 0.5585
 epoch: 54, train_loss: 0.7978, test_loss: 0.9603, test_f1: 0.5621
 epoch: 55, train_loss: 0.7930, test_loss: 0.9588, test_f1: 0.5634
 epoch: 56, train_loss: 0.7943, test_loss: 0.9428, test_f1: 0.5583
 epoch: 57, train_loss: 0.7892, test_loss: 0.9867, test_f1: 0.5431
 epoch: 58, train_loss: 0.7872, test_loss: 0.9591, test_f1: 0.5582
 epoch: 59, train_loss: 0.7898, test_loss: 0.9652, test_f1: 0.5647
 epoch: 60, train_loss: 0.7901, test_loss: 0.9756, test_f1: 0.5603
 epoch: 61, train_loss: 0.7916, test_loss: 0.9580, test_f1: 0.5628
 epoch: 62, train_loss: 0.7869, test_loss: 0.9514, test_f1: 0.5548
 epoch: 63, train_loss: 0.7699, test_loss: 0.9558, test_f1: 0.5533
 epoch: 64, train_loss: 0.7809, test_loss: 0.9674, test_f1: 0.5627
 epoch: 65, train_loss: 0.7859, test_loss: 0.9478, test_f1: 0.5505
 epoch: 66, train_loss: 0.7751, test_loss: 0.9413, test_f1: 0.5551
 epoch: 67, train_loss: 0.7788, test_loss: 0.9588, test_f1: 0.5558
 epoch: 68, train_loss: 0.7757, test_loss: 0.9612, test_f1: 0.5560
 epoch: 69, train_loss: 0.7744, test_loss: 0.9552, test_f1: 0.5620
 epoch: 70, train_loss: 0.7669, test_loss: 0.9642, test_f1: 0.5558
 epoch: 71, train_loss: 0.7806, test_loss: 0.9559, test_f1: 0.5571
 epoch: 72, train_loss: 0.7654, test_loss: 0.9639, test_f1: 0.5534
 epoch: 73, train_loss: 0.7656, test_loss: 0.9554, test_f1: 0.5595
 epoch: 74, train_loss: 0.7749, test_loss: 0.9683, test_f1: 0.5508
 epoch: 75, train_loss: 0.7734, test_loss: 0.9699, test_f1: 0.5521
 epoch: 76, train_loss: 0.7638, test_loss: 0.9706, test_f1: 0.5635
 epoch: 77, train_loss: 0.7631, test_loss: 0.9680, test_f1: 0.5554
 epoch: 78, train_loss: 0.7612, test_loss: 0.9880, test_f1: 0.5566
 epoch: 79, train_loss: 0.7604, test_loss: 0.9801, test_f1: 0.5482
 epoch: 80, train_loss: 0.7577, test_loss: 0.9788, test_f1: 0.5543
 epoch: 81, train_loss: 0.7520, test_loss: 0.9676, test_f1: 0.5606
 epoch: 82, train_loss: 0.7675, test_loss: 0.9721, test_f1: 0.5588
 epoch: 83, train_loss: 0.7498, test_loss: 0.9762, test_f1: 0.5656
 epoch: 84, train_loss: 0.7428, test_loss: 0.9656, test_f1: 0.5651
 epoch: 85, train_loss: 0.7541, test_loss: 0.9639, test_f1: 0.5653
 epoch: 86, train_loss: 0.7501, test_loss: 0.9584, test_f1: 0.5621
 epoch: 87, train_loss: 0.7548, test_loss: 0.9773, test_f1: 0.5607
 epoch: 88, train_loss: 0.7536, test_loss: 0.9650, test_f1: 0.5586
 epoch: 89, train_loss: 0.7491, test_loss: 0.9574, test_f1: 0.5627
 epoch: 90, train_loss: 0.7490, test_loss: 0.9630, test_f1: 0.5533
 epoch: 91, train_loss: 0.7449, test_loss: 0.9774, test_f1: 0.5501
 epoch: 92, train_loss: 0.7540, test_loss: 0.9616, test_f1: 0.5522
 epoch: 93, train_loss: 0.7498, test_loss: 0.9615, test_f1: 0.5501
 epoch: 94, train_loss: 0.7477, test_loss: 0.9547, test_f1: 0.5508
 epoch: 95, train_loss: 0.7429, test_loss: 0.9708, test_f1: 0.5566
 epoch: 96, train_loss: 0.7408, test_loss: 0.9614, test_f1: 0.5528
 epoch: 97, train_loss: 0.7532, test_loss: 0.9701, test_f1: 0.5545
 epoch: 98, train_loss: 0.7413, test_loss: 0.9717, test_f1: 0.5594
 epoch: 99, train_loss: 0.7362, test_loss: 0.9593, test_f1: 0.5681
##################ITERATION #3 ****************************************
 epoch: 0, train_loss: 1.2692, test_loss: 1.3293, test_f1: 0.2295
 epoch: 1, train_loss: 1.2126, test_loss: 1.2199, test_f1: 0.4044
 epoch: 2, train_loss: 1.1842, test_loss: 1.1501, test_f1: 0.3983
 epoch: 3, train_loss: 1.1593, test_loss: 1.1113, test_f1: 0.4352
 epoch: 4, train_loss: 1.1406, test_loss: 1.0845, test_f1: 0.4431
 epoch: 5, train_loss: 1.1196, test_loss: 1.0593, test_f1: 0.4546
 epoch: 6, train_loss: 1.0952, test_loss: 1.0381, test_f1: 0.4593
 epoch: 7, train_loss: 1.0784, test_loss: 1.0179, test_f1: 0.4793
 epoch: 8, train_loss: 1.0593, test_loss: 1.0022, test_f1: 0.4884
 epoch: 9, train_loss: 1.0425, test_loss: 0.9806, test_f1: 0.4961
 epoch: 10, train_loss: 1.0306, test_loss: 0.9701, test_f1: 0.4922
 epoch: 11, train_loss: 1.0182, test_loss: 0.9618, test_f1: 0.4891
 epoch: 12, train_loss: 0.9962, test_loss: 0.9491, test_f1: 0.4842
 epoch: 13, train_loss: 0.9939, test_loss: 0.9424, test_f1: 0.4923
 epoch: 14, train_loss: 0.9866, test_loss: 0.9287, test_f1: 0.5056
 epoch: 15, train_loss: 0.9670, test_loss: 0.9342, test_f1: 0.5020
 epoch: 16, train_loss: 0.9592, test_loss: 0.9215, test_f1: 0.5312
 epoch: 17, train_loss: 0.9493, test_loss: 0.9126, test_f1: 0.5163
 epoch: 18, train_loss: 0.9410, test_loss: 0.9076, test_f1: 0.5215
 epoch: 19, train_loss: 0.9328, test_loss: 0.9022, test_f1: 0.5241
 epoch: 20, train_loss: 0.9317, test_loss: 0.9027, test_f1: 0.5293
 epoch: 21, train_loss: 0.9198, test_loss: 0.9021, test_f1: 0.5352
 epoch: 22, train_loss: 0.9052, test_loss: 0.9020, test_f1: 0.5409
 epoch: 23, train_loss: 0.9057, test_loss: 0.8938, test_f1: 0.5313
 epoch: 24, train_loss: 0.8932, test_loss: 0.8911, test_f1: 0.5374
 epoch: 25, train_loss: 0.8941, test_loss: 0.8942, test_f1: 0.5273
 epoch: 26, train_loss: 0.8906, test_loss: 0.8906, test_f1: 0.5226
 epoch: 27, train_loss: 0.8821, test_loss: 0.9016, test_f1: 0.5150
 epoch: 28, train_loss: 0.8855, test_loss: 0.8967, test_f1: 0.5317
 epoch: 29, train_loss: 0.8732, test_loss: 0.8871, test_f1: 0.5330
 epoch: 30, train_loss: 0.8631, test_loss: 0.8850, test_f1: 0.5380
 epoch: 31, train_loss: 0.8630, test_loss: 0.8844, test_f1: 0.5451
 epoch: 32, train_loss: 0.8567, test_loss: 0.8813, test_f1: 0.5444
 epoch: 33, train_loss: 0.8490, test_loss: 0.8962, test_f1: 0.5379
 epoch: 34, train_loss: 0.8435, test_loss: 0.8897, test_f1: 0.5354
 epoch: 35, train_loss: 0.8504, test_loss: 0.9069, test_f1: 0.5272
 epoch: 36, train_loss: 0.8475, test_loss: 0.8810, test_f1: 0.5543
 epoch: 37, train_loss: 0.8369, test_loss: 0.8998, test_f1: 0.5498
 epoch: 38, train_loss: 0.8341, test_loss: 0.8975, test_f1: 0.5362
 epoch: 39, train_loss: 0.8406, test_loss: 0.8916, test_f1: 0.5643
 epoch: 40, train_loss: 0.8282, test_loss: 0.9073, test_f1: 0.5390
 epoch: 41, train_loss: 0.8264, test_loss: 0.8967, test_f1: 0.5499
 epoch: 42, train_loss: 0.8189, test_loss: 0.8891, test_f1: 0.5606
 epoch: 43, train_loss: 0.8188, test_loss: 0.8985, test_f1: 0.5536
 epoch: 44, train_loss: 0.8247, test_loss: 0.8965, test_f1: 0.5474
 epoch: 45, train_loss: 0.8117, test_loss: 0.9128, test_f1: 0.5602
 epoch: 46, train_loss: 0.8132, test_loss: 0.9027, test_f1: 0.5392
 epoch: 47, train_loss: 0.8117, test_loss: 0.9044, test_f1: 0.5347
 epoch: 48, train_loss: 0.8134, test_loss: 0.9075, test_f1: 0.5622
 epoch: 49, train_loss: 0.8031, test_loss: 0.8817, test_f1: 0.5625
 epoch: 50, train_loss: 0.8070, test_loss: 0.9106, test_f1: 0.5459
 epoch: 51, train_loss: 0.8029, test_loss: 0.9057, test_f1: 0.5685
 epoch: 52, train_loss: 0.7806, test_loss: 0.9029, test_f1: 0.5636
 epoch: 53, train_loss: 0.7936, test_loss: 0.9001, test_f1: 0.5657
 epoch: 54, train_loss: 0.7836, test_loss: 0.9167, test_f1: 0.5576
 epoch: 55, train_loss: 0.7879, test_loss: 0.8899, test_f1: 0.5788
 epoch: 56, train_loss: 0.7810, test_loss: 0.8959, test_f1: 0.5648
 epoch: 57, train_loss: 0.7827, test_loss: 0.8973, test_f1: 0.5604
 epoch: 58, train_loss: 0.7831, test_loss: 0.9089, test_f1: 0.5591
 epoch: 59, train_loss: 0.7860, test_loss: 0.9050, test_f1: 0.5591
 epoch: 60, train_loss: 0.7810, test_loss: 0.9163, test_f1: 0.5697
 epoch: 61, train_loss: 0.7823, test_loss: 0.9087, test_f1: 0.5562
 epoch: 62, train_loss: 0.7640, test_loss: 0.9180, test_f1: 0.5683
 epoch: 63, train_loss: 0.7672, test_loss: 0.9092, test_f1: 0.5705
 epoch: 64, train_loss: 0.7674, test_loss: 0.9130, test_f1: 0.5700
 epoch: 65, train_loss: 0.7684, test_loss: 0.9023, test_f1: 0.5720
 epoch: 66, train_loss: 0.7751, test_loss: 0.9118, test_f1: 0.5794
 epoch: 67, train_loss: 0.7663, test_loss: 0.9060, test_f1: 0.5721
 epoch: 68, train_loss: 0.7617, test_loss: 0.9078, test_f1: 0.5567
 epoch: 69, train_loss: 0.7634, test_loss: 0.8930, test_f1: 0.5849
 epoch: 70, train_loss: 0.7633, test_loss: 0.9128, test_f1: 0.5760
 epoch: 71, train_loss: 0.7600, test_loss: 0.9167, test_f1: 0.5567
 epoch: 72, train_loss: 0.7649, test_loss: 0.8968, test_f1: 0.5643
 epoch: 73, train_loss: 0.7634, test_loss: 0.9044, test_f1: 0.5721
 epoch: 74, train_loss: 0.7548, test_loss: 0.9206, test_f1: 0.5501
 epoch: 75, train_loss: 0.7509, test_loss: 0.9165, test_f1: 0.5767
 epoch: 76, train_loss: 0.7633, test_loss: 0.9001, test_f1: 0.5984
 epoch: 77, train_loss: 0.7474, test_loss: 0.9155, test_f1: 0.5710
 epoch: 78, train_loss: 0.7490, test_loss: 0.9109, test_f1: 0.5584
 epoch: 79, train_loss: 0.7505, test_loss: 0.9156, test_f1: 0.5525
 epoch: 80, train_loss: 0.7501, test_loss: 0.9282, test_f1: 0.5532
 epoch: 81, train_loss: 0.7520, test_loss: 0.9304, test_f1: 0.5537
 epoch: 82, train_loss: 0.7493, test_loss: 0.9196, test_f1: 0.5639
 epoch: 83, train_loss: 0.7418, test_loss: 0.9174, test_f1: 0.5634
 epoch: 84, train_loss: 0.7414, test_loss: 0.9175, test_f1: 0.5653
 epoch: 85, train_loss: 0.7435, test_loss: 0.9221, test_f1: 0.5815
 epoch: 86, train_loss: 0.7449, test_loss: 0.9265, test_f1: 0.5801
 epoch: 87, train_loss: 0.7422, test_loss: 0.9180, test_f1: 0.5659
 epoch: 88, train_loss: 0.7385, test_loss: 0.9295, test_f1: 0.5700
 epoch: 89, train_loss: 0.7298, test_loss: 0.9215, test_f1: 0.5394
 epoch: 90, train_loss: 0.7367, test_loss: 0.9409, test_f1: 0.5507
 epoch: 91, train_loss: 0.7354, test_loss: 0.9211, test_f1: 0.5527
 epoch: 92, train_loss: 0.7322, test_loss: 0.9216, test_f1: 0.5475
 epoch: 93, train_loss: 0.7369, test_loss: 0.9200, test_f1: 0.5689
 epoch: 94, train_loss: 0.7365, test_loss: 0.9226, test_f1: 0.5637
 epoch: 95, train_loss: 0.7401, test_loss: 0.9316, test_f1: 0.5673
 epoch: 96, train_loss: 0.7363, test_loss: 0.9344, test_f1: 0.5544
 epoch: 97, train_loss: 0.7286, test_loss: 0.9367, test_f1: 0.5665
 epoch: 98, train_loss: 0.7248, test_loss: 0.9432, test_f1: 0.5726
 epoch: 99, train_loss: 0.7287, test_loss: 0.9451, test_f1: 0.5582
##################ITERATION #4 ****************************************
 epoch: 0, train_loss: 1.2763, test_loss: 1.3362, test_f1: 0.3210
 epoch: 1, train_loss: 1.1920, test_loss: 1.2020, test_f1: 0.3382
 epoch: 2, train_loss: 1.1560, test_loss: 1.1190, test_f1: 0.4199
 epoch: 3, train_loss: 1.1336, test_loss: 1.0687, test_f1: 0.4399
 epoch: 4, train_loss: 1.1064, test_loss: 1.0423, test_f1: 0.4494
 epoch: 5, train_loss: 1.0784, test_loss: 1.0155, test_f1: 0.4634
 epoch: 6, train_loss: 1.0531, test_loss: 0.9956, test_f1: 0.4650
 epoch: 7, train_loss: 1.0400, test_loss: 0.9792, test_f1: 0.4868
 epoch: 8, train_loss: 1.0256, test_loss: 0.9661, test_f1: 0.4932
 epoch: 9, train_loss: 1.0074, test_loss: 0.9525, test_f1: 0.4901
 epoch: 10, train_loss: 0.9892, test_loss: 0.9451, test_f1: 0.4965
 epoch: 11, train_loss: 0.9835, test_loss: 0.9396, test_f1: 0.5024
 epoch: 12, train_loss: 0.9768, test_loss: 0.9231, test_f1: 0.4994
 epoch: 13, train_loss: 0.9636, test_loss: 0.9240, test_f1: 0.5084
 epoch: 14, train_loss: 0.9441, test_loss: 0.9161, test_f1: 0.5141
 epoch: 15, train_loss: 0.9435, test_loss: 0.9149, test_f1: 0.4983
 epoch: 16, train_loss: 0.9318, test_loss: 0.9089, test_f1: 0.5231
 epoch: 17, train_loss: 0.9321, test_loss: 0.9072, test_f1: 0.5159
 epoch: 18, train_loss: 0.9193, test_loss: 0.9079, test_f1: 0.5225
 epoch: 19, train_loss: 0.9214, test_loss: 0.9071, test_f1: 0.5336
 epoch: 20, train_loss: 0.9045, test_loss: 0.9098, test_f1: 0.5242
 epoch: 21, train_loss: 0.8909, test_loss: 0.9059, test_f1: 0.5397
 epoch: 22, train_loss: 0.8897, test_loss: 0.9094, test_f1: 0.5329
 epoch: 23, train_loss: 0.8922, test_loss: 0.8992, test_f1: 0.5292
 epoch: 24, train_loss: 0.8827, test_loss: 0.8970, test_f1: 0.5376
 epoch: 25, train_loss: 0.8908, test_loss: 0.9171, test_f1: 0.5422
 epoch: 26, train_loss: 0.8700, test_loss: 0.9197, test_f1: 0.5420
 epoch: 27, train_loss: 0.8726, test_loss: 0.9010, test_f1: 0.5405
 epoch: 28, train_loss: 0.8710, test_loss: 0.9111, test_f1: 0.5313
 epoch: 29, train_loss: 0.8557, test_loss: 0.9038, test_f1: 0.5436
 epoch: 30, train_loss: 0.8502, test_loss: 0.9057, test_f1: 0.5490
 epoch: 31, train_loss: 0.8572, test_loss: 0.9071, test_f1: 0.5515
 epoch: 32, train_loss: 0.8463, test_loss: 0.9144, test_f1: 0.5527
 epoch: 33, train_loss: 0.8412, test_loss: 0.9122, test_f1: 0.5437
 epoch: 34, train_loss: 0.8406, test_loss: 0.9189, test_f1: 0.5371
 epoch: 35, train_loss: 0.8360, test_loss: 0.9137, test_f1: 0.5501
 epoch: 36, train_loss: 0.8303, test_loss: 0.9079, test_f1: 0.5451
 epoch: 37, train_loss: 0.8351, test_loss: 0.9177, test_f1: 0.5456
 epoch: 38, train_loss: 0.8298, test_loss: 0.9285, test_f1: 0.5480
 epoch: 39, train_loss: 0.8229, test_loss: 0.9115, test_f1: 0.5456
 epoch: 40, train_loss: 0.8272, test_loss: 0.9186, test_f1: 0.5484
 epoch: 41, train_loss: 0.8142, test_loss: 0.9126, test_f1: 0.5413
 epoch: 42, train_loss: 0.8120, test_loss: 0.9133, test_f1: 0.5414
 epoch: 43, train_loss: 0.8046, test_loss: 0.9165, test_f1: 0.5533
 epoch: 44, train_loss: 0.8126, test_loss: 0.9253, test_f1: 0.5465
 epoch: 45, train_loss: 0.8072, test_loss: 0.9204, test_f1: 0.5612
 epoch: 46, train_loss: 0.8040, test_loss: 0.9136, test_f1: 0.5642
 epoch: 47, train_loss: 0.7963, test_loss: 0.9040, test_f1: 0.5815
 epoch: 48, train_loss: 0.7956, test_loss: 0.9088, test_f1: 0.5641
 epoch: 49, train_loss: 0.7937, test_loss: 0.9216, test_f1: 0.5821
 epoch: 50, train_loss: 0.7940, test_loss: 0.9156, test_f1: 0.5494
 epoch: 51, train_loss: 0.7837, test_loss: 0.9175, test_f1: 0.5822
 epoch: 52, train_loss: 0.7754, test_loss: 0.9130, test_f1: 0.5590
 epoch: 53, train_loss: 0.7711, test_loss: 0.9174, test_f1: 0.5659
 epoch: 54, train_loss: 0.7783, test_loss: 0.9034, test_f1: 0.5677
 epoch: 55, train_loss: 0.7739, test_loss: 0.9142, test_f1: 0.5613
 epoch: 56, train_loss: 0.7752, test_loss: 0.9206, test_f1: 0.5703
 epoch: 57, train_loss: 0.7625, test_loss: 0.9210, test_f1: 0.5843
 epoch: 58, train_loss: 0.7666, test_loss: 0.9167, test_f1: 0.5736
 epoch: 59, train_loss: 0.7668, test_loss: 0.9180, test_f1: 0.5807
 epoch: 60, train_loss: 0.7638, test_loss: 0.9077, test_f1: 0.5885
 epoch: 61, train_loss: 0.7706, test_loss: 0.9178, test_f1: 0.5805
 epoch: 62, train_loss: 0.7633, test_loss: 0.9181, test_f1: 0.5774
 epoch: 63, train_loss: 0.7704, test_loss: 0.9194, test_f1: 0.5652
 epoch: 64, train_loss: 0.7554, test_loss: 0.9127, test_f1: 0.5644
 epoch: 65, train_loss: 0.7613, test_loss: 0.9286, test_f1: 0.5646
 epoch: 66, train_loss: 0.7608, test_loss: 0.9181, test_f1: 0.5874
 epoch: 67, train_loss: 0.7510, test_loss: 0.9067, test_f1: 0.5768
 epoch: 68, train_loss: 0.7524, test_loss: 0.9229, test_f1: 0.5834
 epoch: 69, train_loss: 0.7542, test_loss: 0.9243, test_f1: 0.5631
 epoch: 70, train_loss: 0.7586, test_loss: 0.9224, test_f1: 0.5722
 epoch: 71, train_loss: 0.7549, test_loss: 0.9224, test_f1: 0.5691
 epoch: 72, train_loss: 0.7559, test_loss: 0.9306, test_f1: 0.5726
 epoch: 73, train_loss: 0.7431, test_loss: 0.9242, test_f1: 0.5739
 epoch: 74, train_loss: 0.7470, test_loss: 0.9361, test_f1: 0.5653
 epoch: 75, train_loss: 0.7385, test_loss: 0.9331, test_f1: 0.5931
 epoch: 76, train_loss: 0.7411, test_loss: 0.9148, test_f1: 0.5818
 epoch: 77, train_loss: 0.7490, test_loss: 0.9240, test_f1: 0.5914
 epoch: 78, train_loss: 0.7415, test_loss: 0.9353, test_f1: 0.5955
 epoch: 79, train_loss: 0.7411, test_loss: 0.9201, test_f1: 0.5830
 epoch: 80, train_loss: 0.7414, test_loss: 0.9171, test_f1: 0.5864
 epoch: 81, train_loss: 0.7339, test_loss: 0.9218, test_f1: 0.5938
 epoch: 82, train_loss: 0.7323, test_loss: 0.9285, test_f1: 0.5806
 epoch: 83, train_loss: 0.7368, test_loss: 0.9281, test_f1: 0.5873
 epoch: 84, train_loss: 0.7320, test_loss: 0.9329, test_f1: 0.6009
 epoch: 85, train_loss: 0.7299, test_loss: 0.9218, test_f1: 0.5959
 epoch: 86, train_loss: 0.7357, test_loss: 0.9376, test_f1: 0.5793
 epoch: 87, train_loss: 0.7437, test_loss: 0.9374, test_f1: 0.5890
 epoch: 88, train_loss: 0.7338, test_loss: 0.9215, test_f1: 0.6005
 epoch: 89, train_loss: 0.7290, test_loss: 0.9241, test_f1: 0.5912
 epoch: 90, train_loss: 0.7319, test_loss: 0.9249, test_f1: 0.6014
 epoch: 91, train_loss: 0.7326, test_loss: 0.9275, test_f1: 0.6058
 epoch: 92, train_loss: 0.7235, test_loss: 0.9321, test_f1: 0.6066
 epoch: 93, train_loss: 0.7355, test_loss: 0.9327, test_f1: 0.5958
 epoch: 94, train_loss: 0.7212, test_loss: 0.9245, test_f1: 0.5955
 epoch: 95, train_loss: 0.7251, test_loss: 0.9333, test_f1: 0.6027
 epoch: 96, train_loss: 0.7192, test_loss: 0.9414, test_f1: 0.5944
 epoch: 97, train_loss: 0.7265, test_loss: 0.9291, test_f1: 0.5986
 epoch: 98, train_loss: 0.7203, test_loss: 0.9277, test_f1: 0.6018
 epoch: 99, train_loss: 0.7115, test_loss: 0.9279, test_f1: 0.6011
##################ITERATION #5 ****************************************
 epoch: 0, train_loss: 1.2614, test_loss: 1.3490, test_f1: 0.3372
 epoch: 1, train_loss: 1.1926, test_loss: 1.2306, test_f1: 0.3422
 epoch: 2, train_loss: 1.1621, test_loss: 1.1409, test_f1: 0.3825
 epoch: 3, train_loss: 1.1447, test_loss: 1.1033, test_f1: 0.4031
 epoch: 4, train_loss: 1.1169, test_loss: 1.0777, test_f1: 0.4320
 epoch: 5, train_loss: 1.1068, test_loss: 1.0627, test_f1: 0.4522
 epoch: 6, train_loss: 1.0815, test_loss: 1.0399, test_f1: 0.4633
 epoch: 7, train_loss: 1.0674, test_loss: 1.0181, test_f1: 0.4906
 epoch: 8, train_loss: 1.0430, test_loss: 1.0131, test_f1: 0.4699
 epoch: 9, train_loss: 1.0450, test_loss: 0.9933, test_f1: 0.4867
 epoch: 10, train_loss: 1.0238, test_loss: 0.9913, test_f1: 0.4798
 epoch: 11, train_loss: 1.0146, test_loss: 0.9686, test_f1: 0.4771
 epoch: 12, train_loss: 1.0071, test_loss: 0.9734, test_f1: 0.4709
 epoch: 13, train_loss: 0.9972, test_loss: 0.9637, test_f1: 0.4898
 epoch: 14, train_loss: 0.9759, test_loss: 0.9414, test_f1: 0.4994
 epoch: 15, train_loss: 0.9677, test_loss: 0.9428, test_f1: 0.4956
 epoch: 16, train_loss: 0.9605, test_loss: 0.9337, test_f1: 0.5086
 epoch: 17, train_loss: 0.9541, test_loss: 0.9287, test_f1: 0.5109
 epoch: 18, train_loss: 0.9419, test_loss: 0.9257, test_f1: 0.5123
 epoch: 19, train_loss: 0.9323, test_loss: 0.9174, test_f1: 0.5179
 epoch: 20, train_loss: 0.9336, test_loss: 0.9272, test_f1: 0.5285
 epoch: 21, train_loss: 0.9193, test_loss: 0.9345, test_f1: 0.5315
 epoch: 22, train_loss: 0.9137, test_loss: 0.9224, test_f1: 0.5306
 epoch: 23, train_loss: 0.9109, test_loss: 0.9198, test_f1: 0.5332
 epoch: 24, train_loss: 0.9051, test_loss: 0.9243, test_f1: 0.5389
 epoch: 25, train_loss: 0.9043, test_loss: 0.9313, test_f1: 0.5411
 epoch: 26, train_loss: 0.8938, test_loss: 0.9243, test_f1: 0.5524
 epoch: 27, train_loss: 0.8791, test_loss: 0.9107, test_f1: 0.5600
 epoch: 28, train_loss: 0.8819, test_loss: 0.9126, test_f1: 0.5449
 epoch: 29, train_loss: 0.8860, test_loss: 0.9213, test_f1: 0.5527
 epoch: 30, train_loss: 0.8732, test_loss: 0.9162, test_f1: 0.5494
 epoch: 31, train_loss: 0.8659, test_loss: 0.9171, test_f1: 0.5459
 epoch: 32, train_loss: 0.8585, test_loss: 0.9199, test_f1: 0.5416
 epoch: 33, train_loss: 0.8597, test_loss: 0.9236, test_f1: 0.5633
 epoch: 34, train_loss: 0.8690, test_loss: 0.9257, test_f1: 0.5612
 epoch: 35, train_loss: 0.8593, test_loss: 0.9171, test_f1: 0.5388
 epoch: 36, train_loss: 0.8429, test_loss: 0.9058, test_f1: 0.5664
 epoch: 37, train_loss: 0.8423, test_loss: 0.9231, test_f1: 0.5553
 epoch: 38, train_loss: 0.8334, test_loss: 0.9179, test_f1: 0.5586
 epoch: 39, train_loss: 0.8272, test_loss: 0.9181, test_f1: 0.5669
 epoch: 40, train_loss: 0.8291, test_loss: 0.9141, test_f1: 0.5697
 epoch: 41, train_loss: 0.8334, test_loss: 0.9222, test_f1: 0.5587
 epoch: 42, train_loss: 0.8211, test_loss: 0.9146, test_f1: 0.5742
 epoch: 43, train_loss: 0.8206, test_loss: 0.9330, test_f1: 0.5534
 epoch: 44, train_loss: 0.8123, test_loss: 0.9283, test_f1: 0.5500
 epoch: 45, train_loss: 0.8095, test_loss: 0.9169, test_f1: 0.5719
 epoch: 46, train_loss: 0.8119, test_loss: 0.9228, test_f1: 0.5592
 epoch: 47, train_loss: 0.8038, test_loss: 0.9381, test_f1: 0.5618
 epoch: 48, train_loss: 0.8067, test_loss: 0.9380, test_f1: 0.5692
 epoch: 49, train_loss: 0.7993, test_loss: 0.9385, test_f1: 0.5537
 epoch: 50, train_loss: 0.8003, test_loss: 0.9384, test_f1: 0.5615
 epoch: 51, train_loss: 0.7879, test_loss: 0.9423, test_f1: 0.5753
 epoch: 52, train_loss: 0.7913, test_loss: 0.9326, test_f1: 0.5736
 epoch: 53, train_loss: 0.7792, test_loss: 0.9309, test_f1: 0.5726
 epoch: 54, train_loss: 0.7734, test_loss: 0.9368, test_f1: 0.5709
 epoch: 55, train_loss: 0.7750, test_loss: 0.9457, test_f1: 0.5624
 epoch: 56, train_loss: 0.7818, test_loss: 0.9452, test_f1: 0.5648
 epoch: 57, train_loss: 0.7690, test_loss: 0.9442, test_f1: 0.5624
 epoch: 58, train_loss: 0.7849, test_loss: 0.9362, test_f1: 0.5675
 epoch: 59, train_loss: 0.7709, test_loss: 0.9480, test_f1: 0.5649
 epoch: 60, train_loss: 0.7725, test_loss: 0.9477, test_f1: 0.5512
 epoch: 61, train_loss: 0.7676, test_loss: 0.9403, test_f1: 0.5646
 epoch: 62, train_loss: 0.7655, test_loss: 0.9518, test_f1: 0.5613
 epoch: 63, train_loss: 0.7680, test_loss: 0.9506, test_f1: 0.5507
 epoch: 64, train_loss: 0.7623, test_loss: 0.9578, test_f1: 0.5673
 epoch: 65, train_loss: 0.7597, test_loss: 0.9530, test_f1: 0.5630
 epoch: 66, train_loss: 0.7709, test_loss: 0.9558, test_f1: 0.5564
 epoch: 67, train_loss: 0.7620, test_loss: 0.9494, test_f1: 0.5673
 epoch: 68, train_loss: 0.7488, test_loss: 0.9566, test_f1: 0.5551
 epoch: 69, train_loss: 0.7496, test_loss: 0.9634, test_f1: 0.5523
 epoch: 70, train_loss: 0.7650, test_loss: 0.9536, test_f1: 0.5555
 epoch: 71, train_loss: 0.7584, test_loss: 0.9640, test_f1: 0.5429
 epoch: 72, train_loss: 0.7479, test_loss: 0.9545, test_f1: 0.5560
 epoch: 73, train_loss: 0.7550, test_loss: 0.9516, test_f1: 0.5525
 epoch: 74, train_loss: 0.7418, test_loss: 0.9569, test_f1: 0.5583
 epoch: 75, train_loss: 0.7522, test_loss: 0.9689, test_f1: 0.5551
 epoch: 76, train_loss: 0.7484, test_loss: 0.9591, test_f1: 0.5562
 epoch: 77, train_loss: 0.7466, test_loss: 0.9576, test_f1: 0.5627
 epoch: 78, train_loss: 0.7545, test_loss: 0.9445, test_f1: 0.5543
 epoch: 79, train_loss: 0.7379, test_loss: 0.9434, test_f1: 0.5758
 epoch: 80, train_loss: 0.7473, test_loss: 0.9541, test_f1: 0.5635
 epoch: 81, train_loss: 0.7397, test_loss: 0.9517, test_f1: 0.5645
 epoch: 82, train_loss: 0.7286, test_loss: 0.9630, test_f1: 0.5530
 epoch: 83, train_loss: 0.7384, test_loss: 0.9648, test_f1: 0.5520
 epoch: 84, train_loss: 0.7427, test_loss: 0.9653, test_f1: 0.5593
 epoch: 85, train_loss: 0.7208, test_loss: 0.9632, test_f1: 0.5589
 epoch: 86, train_loss: 0.7284, test_loss: 0.9626, test_f1: 0.5558
 epoch: 87, train_loss: 0.7274, test_loss: 0.9675, test_f1: 0.5624
 epoch: 88, train_loss: 0.7307, test_loss: 0.9707, test_f1: 0.5413
 epoch: 89, train_loss: 0.7356, test_loss: 0.9596, test_f1: 0.5679
 epoch: 90, train_loss: 0.7319, test_loss: 0.9720, test_f1: 0.5533
 epoch: 91, train_loss: 0.7256, test_loss: 0.9722, test_f1: 0.5548
 epoch: 92, train_loss: 0.7157, test_loss: 0.9617, test_f1: 0.5609
 epoch: 93, train_loss: 0.7119, test_loss: 0.9839, test_f1: 0.5472
 epoch: 94, train_loss: 0.7241, test_loss: 0.9797, test_f1: 0.5536
 epoch: 95, train_loss: 0.7268, test_loss: 0.9741, test_f1: 0.5518
 epoch: 96, train_loss: 0.7149, test_loss: 0.9747, test_f1: 0.5713
 epoch: 97, train_loss: 0.7184, test_loss: 0.9720, test_f1: 0.5660
 epoch: 98, train_loss: 0.7214, test_loss: 0.9860, test_f1: 0.5532
 epoch: 99, train_loss: 0.7157, test_loss: 0.9618, test_f1: 0.5673
##################ITERATION #6 ****************************************
 epoch: 0, train_loss: 1.3128, test_loss: 1.3489, test_f1: 0.2702
 epoch: 1, train_loss: 1.2053, test_loss: 1.2254, test_f1: 0.2977
 epoch: 2, train_loss: 1.1658, test_loss: 1.1168, test_f1: 0.4271
 epoch: 3, train_loss: 1.1333, test_loss: 1.0677, test_f1: 0.4393
 epoch: 4, train_loss: 1.1047, test_loss: 1.0429, test_f1: 0.4726
 epoch: 5, train_loss: 1.0826, test_loss: 1.0220, test_f1: 0.4705
 epoch: 6, train_loss: 1.0591, test_loss: 0.9960, test_f1: 0.4866
 epoch: 7, train_loss: 1.0391, test_loss: 0.9789, test_f1: 0.5003
 epoch: 8, train_loss: 1.0374, test_loss: 0.9663, test_f1: 0.4991
 epoch: 9, train_loss: 1.0130, test_loss: 0.9589, test_f1: 0.4980
 epoch: 10, train_loss: 1.0046, test_loss: 0.9445, test_f1: 0.5051
 epoch: 11, train_loss: 0.9958, test_loss: 0.9463, test_f1: 0.5040
 epoch: 12, train_loss: 0.9787, test_loss: 0.9315, test_f1: 0.5167
 epoch: 13, train_loss: 0.9762, test_loss: 0.9251, test_f1: 0.5184
 epoch: 14, train_loss: 0.9635, test_loss: 0.9207, test_f1: 0.5222
 epoch: 15, train_loss: 0.9496, test_loss: 0.9329, test_f1: 0.5014
 epoch: 16, train_loss: 0.9515, test_loss: 0.9320, test_f1: 0.5055
 epoch: 17, train_loss: 0.9261, test_loss: 0.9111, test_f1: 0.5214
 epoch: 18, train_loss: 0.9210, test_loss: 0.9120, test_f1: 0.5284
 epoch: 19, train_loss: 0.9142, test_loss: 0.9128, test_f1: 0.5092
 epoch: 20, train_loss: 0.9105, test_loss: 0.9026, test_f1: 0.5231
 epoch: 21, train_loss: 0.9130, test_loss: 0.9234, test_f1: 0.5176
 epoch: 22, train_loss: 0.8983, test_loss: 0.9017, test_f1: 0.5179
 epoch: 23, train_loss: 0.9002, test_loss: 0.9187, test_f1: 0.5122
 epoch: 24, train_loss: 0.8950, test_loss: 0.9235, test_f1: 0.5079
 epoch: 25, train_loss: 0.8921, test_loss: 0.9093, test_f1: 0.5161
 epoch: 26, train_loss: 0.8806, test_loss: 0.9014, test_f1: 0.5228
 epoch: 27, train_loss: 0.8746, test_loss: 0.9166, test_f1: 0.5209
 epoch: 28, train_loss: 0.8770, test_loss: 0.8963, test_f1: 0.5205
 epoch: 29, train_loss: 0.8649, test_loss: 0.9179, test_f1: 0.5183
 epoch: 30, train_loss: 0.8675, test_loss: 0.9147, test_f1: 0.5136
 epoch: 31, train_loss: 0.8587, test_loss: 0.9071, test_f1: 0.5262
 epoch: 32, train_loss: 0.8558, test_loss: 0.9075, test_f1: 0.5241
 epoch: 33, train_loss: 0.8579, test_loss: 0.9231, test_f1: 0.5200
 epoch: 34, train_loss: 0.8548, test_loss: 0.9249, test_f1: 0.5285
 epoch: 35, train_loss: 0.8473, test_loss: 0.9188, test_f1: 0.5403
 epoch: 36, train_loss: 0.8476, test_loss: 0.9123, test_f1: 0.5307
 epoch: 37, train_loss: 0.8455, test_loss: 0.9047, test_f1: 0.5262
 epoch: 38, train_loss: 0.8351, test_loss: 0.9218, test_f1: 0.5353
 epoch: 39, train_loss: 0.8323, test_loss: 0.9142, test_f1: 0.5414
 epoch: 40, train_loss: 0.8266, test_loss: 0.9170, test_f1: 0.5284
 epoch: 41, train_loss: 0.8291, test_loss: 0.9120, test_f1: 0.5309
 epoch: 42, train_loss: 0.8228, test_loss: 0.9601, test_f1: 0.5314
 epoch: 43, train_loss: 0.8252, test_loss: 0.9495, test_f1: 0.5345
 epoch: 44, train_loss: 0.8155, test_loss: 0.9413, test_f1: 0.5253
 epoch: 45, train_loss: 0.8320, test_loss: 0.9460, test_f1: 0.5322
 epoch: 46, train_loss: 0.8098, test_loss: 0.9405, test_f1: 0.5532
 epoch: 47, train_loss: 0.8195, test_loss: 0.9361, test_f1: 0.5419
 epoch: 48, train_loss: 0.8109, test_loss: 0.9517, test_f1: 0.5528
 epoch: 49, train_loss: 0.7991, test_loss: 0.9275, test_f1: 0.5582
 epoch: 50, train_loss: 0.8034, test_loss: 0.9372, test_f1: 0.5395
 epoch: 51, train_loss: 0.7942, test_loss: 0.9404, test_f1: 0.5537
 epoch: 52, train_loss: 0.8061, test_loss: 0.9713, test_f1: 0.5423
 epoch: 53, train_loss: 0.7940, test_loss: 0.9739, test_f1: 0.5415
 epoch: 54, train_loss: 0.7905, test_loss: 0.9511, test_f1: 0.5516
 epoch: 55, train_loss: 0.7874, test_loss: 0.9572, test_f1: 0.5505
 epoch: 56, train_loss: 0.7792, test_loss: 0.9537, test_f1: 0.5468
 epoch: 57, train_loss: 0.7898, test_loss: 0.9556, test_f1: 0.5509
 epoch: 58, train_loss: 0.7894, test_loss: 0.9586, test_f1: 0.5419
 epoch: 59, train_loss: 0.7706, test_loss: 0.9642, test_f1: 0.5437
 epoch: 60, train_loss: 0.7922, test_loss: 0.9478, test_f1: 0.5514
 epoch: 61, train_loss: 0.7784, test_loss: 0.9515, test_f1: 0.5450
 epoch: 62, train_loss: 0.7894, test_loss: 0.9761, test_f1: 0.5431
 epoch: 63, train_loss: 0.7823, test_loss: 0.9649, test_f1: 0.5551
 epoch: 64, train_loss: 0.7796, test_loss: 0.9641, test_f1: 0.5460
 epoch: 65, train_loss: 0.7771, test_loss: 0.9459, test_f1: 0.5611
 epoch: 66, train_loss: 0.7748, test_loss: 0.9494, test_f1: 0.5463
 epoch: 67, train_loss: 0.7663, test_loss: 0.9501, test_f1: 0.5499
 epoch: 68, train_loss: 0.7720, test_loss: 0.9461, test_f1: 0.5531
 epoch: 69, train_loss: 0.7728, test_loss: 0.9517, test_f1: 0.5686
 epoch: 70, train_loss: 0.7694, test_loss: 0.9595, test_f1: 0.5512
 epoch: 71, train_loss: 0.7721, test_loss: 0.9649, test_f1: 0.5593
 epoch: 72, train_loss: 0.7557, test_loss: 0.9672, test_f1: 0.5521
 epoch: 73, train_loss: 0.7656, test_loss: 0.9695, test_f1: 0.5537
 epoch: 74, train_loss: 0.7580, test_loss: 0.9715, test_f1: 0.5628
 epoch: 75, train_loss: 0.7614, test_loss: 0.9797, test_f1: 0.5471
 epoch: 76, train_loss: 0.7601, test_loss: 0.9692, test_f1: 0.5565
 epoch: 77, train_loss: 0.7688, test_loss: 0.9469, test_f1: 0.5697
 epoch: 78, train_loss: 0.7625, test_loss: 0.9546, test_f1: 0.5575
 epoch: 79, train_loss: 0.7690, test_loss: 0.9548, test_f1: 0.5749
 epoch: 80, train_loss: 0.7518, test_loss: 0.9595, test_f1: 0.5688
 epoch: 81, train_loss: 0.7565, test_loss: 0.9714, test_f1: 0.5531
 epoch: 82, train_loss: 0.7620, test_loss: 0.9669, test_f1: 0.5677
 epoch: 83, train_loss: 0.7512, test_loss: 0.9765, test_f1: 0.5573
 epoch: 84, train_loss: 0.7551, test_loss: 0.9886, test_f1: 0.5569
 epoch: 85, train_loss: 0.7472, test_loss: 0.9807, test_f1: 0.5655
 epoch: 86, train_loss: 0.7486, test_loss: 0.9720, test_f1: 0.5668
 epoch: 87, train_loss: 0.7564, test_loss: 0.9670, test_f1: 0.5773
 epoch: 88, train_loss: 0.7383, test_loss: 0.9604, test_f1: 0.5680
 epoch: 89, train_loss: 0.7513, test_loss: 0.9902, test_f1: 0.5524
 epoch: 90, train_loss: 0.7408, test_loss: 0.9606, test_f1: 0.5658
 epoch: 91, train_loss: 0.7458, test_loss: 0.9647, test_f1: 0.5694
 epoch: 92, train_loss: 0.7408, test_loss: 0.9715, test_f1: 0.5711
 epoch: 93, train_loss: 0.7314, test_loss: 0.9965, test_f1: 0.5739
 epoch: 94, train_loss: 0.7448, test_loss: 0.9816, test_f1: 0.5670
 epoch: 95, train_loss: 0.7476, test_loss: 0.9895, test_f1: 0.5886
 epoch: 96, train_loss: 0.7388, test_loss: 0.9874, test_f1: 0.5850
 epoch: 97, train_loss: 0.7352, test_loss: 0.9936, test_f1: 0.5686
 epoch: 98, train_loss: 0.7362, test_loss: 0.9929, test_f1: 0.5588
 epoch: 99, train_loss: 0.7224, test_loss: 0.9856, test_f1: 0.5688
##################ITERATION #7 ****************************************
 epoch: 0, train_loss: 1.2823, test_loss: 1.2991, test_f1: 0.2549
 epoch: 1, train_loss: 1.1832, test_loss: 1.1884, test_f1: 0.3521
 epoch: 2, train_loss: 1.1455, test_loss: 1.1063, test_f1: 0.4115
 epoch: 3, train_loss: 1.1280, test_loss: 1.0586, test_f1: 0.4439
 epoch: 4, train_loss: 1.0924, test_loss: 1.0329, test_f1: 0.4606
 epoch: 5, train_loss: 1.0829, test_loss: 1.0154, test_f1: 0.4716
 epoch: 6, train_loss: 1.0567, test_loss: 0.9968, test_f1: 0.4893
 epoch: 7, train_loss: 1.0389, test_loss: 0.9798, test_f1: 0.5029
 epoch: 8, train_loss: 1.0229, test_loss: 0.9656, test_f1: 0.5124
 epoch: 9, train_loss: 1.0133, test_loss: 0.9550, test_f1: 0.5020
 epoch: 10, train_loss: 1.0064, test_loss: 0.9453, test_f1: 0.5049
 epoch: 11, train_loss: 0.9926, test_loss: 0.9321, test_f1: 0.5213
 epoch: 12, train_loss: 0.9811, test_loss: 0.9224, test_f1: 0.5315
 epoch: 13, train_loss: 0.9700, test_loss: 0.9143, test_f1: 0.5275
 epoch: 14, train_loss: 0.9602, test_loss: 0.9166, test_f1: 0.5275
 epoch: 15, train_loss: 0.9415, test_loss: 0.9126, test_f1: 0.5258
 epoch: 16, train_loss: 0.9353, test_loss: 0.9075, test_f1: 0.5275
 epoch: 17, train_loss: 0.9285, test_loss: 0.9029, test_f1: 0.5255
 epoch: 18, train_loss: 0.9332, test_loss: 0.8995, test_f1: 0.5365
 epoch: 19, train_loss: 0.9262, test_loss: 0.8958, test_f1: 0.5421
 epoch: 20, train_loss: 0.9051, test_loss: 0.8958, test_f1: 0.5375
 epoch: 21, train_loss: 0.9116, test_loss: 0.8934, test_f1: 0.5458
 epoch: 22, train_loss: 0.9079, test_loss: 0.8887, test_f1: 0.5455
 epoch: 23, train_loss: 0.8830, test_loss: 0.9073, test_f1: 0.5319
 epoch: 24, train_loss: 0.8887, test_loss: 0.8714, test_f1: 0.5547
 epoch: 25, train_loss: 0.8790, test_loss: 0.8944, test_f1: 0.5419
 epoch: 26, train_loss: 0.8817, test_loss: 0.8799, test_f1: 0.5504
 epoch: 27, train_loss: 0.8690, test_loss: 0.8823, test_f1: 0.5469
 epoch: 28, train_loss: 0.8615, test_loss: 0.8901, test_f1: 0.5489
 epoch: 29, train_loss: 0.8591, test_loss: 0.8869, test_f1: 0.5507
 epoch: 30, train_loss: 0.8609, test_loss: 0.8742, test_f1: 0.5538
 epoch: 31, train_loss: 0.8567, test_loss: 0.8814, test_f1: 0.5595
 epoch: 32, train_loss: 0.8512, test_loss: 0.8728, test_f1: 0.5573
 epoch: 33, train_loss: 0.8445, test_loss: 0.8754, test_f1: 0.5575
 epoch: 34, train_loss: 0.8413, test_loss: 0.8731, test_f1: 0.5743
 epoch: 35, train_loss: 0.8331, test_loss: 0.8795, test_f1: 0.5607
 epoch: 36, train_loss: 0.8266, test_loss: 0.8806, test_f1: 0.5590
 epoch: 37, train_loss: 0.8288, test_loss: 0.8704, test_f1: 0.5598
 epoch: 38, train_loss: 0.8277, test_loss: 0.8695, test_f1: 0.5731
 epoch: 39, train_loss: 0.8226, test_loss: 0.8860, test_f1: 0.5728
 epoch: 40, train_loss: 0.8136, test_loss: 0.8683, test_f1: 0.5756
 epoch: 41, train_loss: 0.8215, test_loss: 0.8740, test_f1: 0.5730
 epoch: 42, train_loss: 0.8056, test_loss: 0.8846, test_f1: 0.5676
 epoch: 43, train_loss: 0.8008, test_loss: 0.8793, test_f1: 0.5804
 epoch: 44, train_loss: 0.8083, test_loss: 0.8812, test_f1: 0.5803
 epoch: 45, train_loss: 0.7946, test_loss: 0.8774, test_f1: 0.5755
 epoch: 46, train_loss: 0.7871, test_loss: 0.8832, test_f1: 0.5836
 epoch: 47, train_loss: 0.7883, test_loss: 0.8763, test_f1: 0.5842
 epoch: 48, train_loss: 0.7823, test_loss: 0.8998, test_f1: 0.5870
 epoch: 49, train_loss: 0.7791, test_loss: 0.8804, test_f1: 0.5915
 epoch: 50, train_loss: 0.7737, test_loss: 0.8775, test_f1: 0.5969
 epoch: 51, train_loss: 0.7633, test_loss: 0.8649, test_f1: 0.5917
 epoch: 52, train_loss: 0.7673, test_loss: 0.8659, test_f1: 0.5995
 epoch: 53, train_loss: 0.7611, test_loss: 0.8730, test_f1: 0.5943
 epoch: 54, train_loss: 0.7611, test_loss: 0.8843, test_f1: 0.5864
 epoch: 55, train_loss: 0.7613, test_loss: 0.8755, test_f1: 0.5944
 epoch: 56, train_loss: 0.7509, test_loss: 0.8813, test_f1: 0.5936
 epoch: 57, train_loss: 0.7548, test_loss: 0.8805, test_f1: 0.5950
 epoch: 58, train_loss: 0.7509, test_loss: 0.8849, test_f1: 0.5949
 epoch: 59, train_loss: 0.7652, test_loss: 0.8797, test_f1: 0.6060
 epoch: 60, train_loss: 0.7488, test_loss: 0.8830, test_f1: 0.5884
 epoch: 61, train_loss: 0.7469, test_loss: 0.8805, test_f1: 0.5878
 epoch: 62, train_loss: 0.7403, test_loss: 0.8866, test_f1: 0.5947
 epoch: 63, train_loss: 0.7528, test_loss: 0.8832, test_f1: 0.6011
 epoch: 64, train_loss: 0.7417, test_loss: 0.8914, test_f1: 0.5856
 epoch: 65, train_loss: 0.7477, test_loss: 0.8778, test_f1: 0.5961
 epoch: 66, train_loss: 0.7427, test_loss: 0.8865, test_f1: 0.5971
 epoch: 67, train_loss: 0.7487, test_loss: 0.8821, test_f1: 0.6033
 epoch: 68, train_loss: 0.7411, test_loss: 0.8740, test_f1: 0.6017
 epoch: 69, train_loss: 0.7372, test_loss: 0.8728, test_f1: 0.5950
 epoch: 70, train_loss: 0.7337, test_loss: 0.8830, test_f1: 0.6073
 epoch: 71, train_loss: 0.7320, test_loss: 0.8851, test_f1: 0.6011
 epoch: 72, train_loss: 0.7254, test_loss: 0.8840, test_f1: 0.5984
 epoch: 73, train_loss: 0.7320, test_loss: 0.8730, test_f1: 0.6042
 epoch: 74, train_loss: 0.7366, test_loss: 0.8913, test_f1: 0.6000
 epoch: 75, train_loss: 0.7330, test_loss: 0.8780, test_f1: 0.6030
 epoch: 76, train_loss: 0.7306, test_loss: 0.8804, test_f1: 0.6082
 epoch: 77, train_loss: 0.7177, test_loss: 0.8830, test_f1: 0.6033
 epoch: 78, train_loss: 0.7264, test_loss: 0.8833, test_f1: 0.5993
 epoch: 79, train_loss: 0.7176, test_loss: 0.8838, test_f1: 0.6065
 epoch: 80, train_loss: 0.7145, test_loss: 0.8899, test_f1: 0.6114
 epoch: 81, train_loss: 0.7297, test_loss: 0.8921, test_f1: 0.6022
 epoch: 82, train_loss: 0.7224, test_loss: 0.8920, test_f1: 0.6131
 epoch: 83, train_loss: 0.7239, test_loss: 0.9009, test_f1: 0.6131
 epoch: 84, train_loss: 0.7199, test_loss: 0.8877, test_f1: 0.6096
 epoch: 85, train_loss: 0.7172, test_loss: 0.8874, test_f1: 0.6052
 epoch: 86, train_loss: 0.7142, test_loss: 0.8892, test_f1: 0.5996
 epoch: 87, train_loss: 0.7122, test_loss: 0.8962, test_f1: 0.6064
 epoch: 88, train_loss: 0.7027, test_loss: 0.8823, test_f1: 0.6052
 epoch: 89, train_loss: 0.7150, test_loss: 0.8884, test_f1: 0.6036
 epoch: 90, train_loss: 0.7110, test_loss: 0.8906, test_f1: 0.6187
 epoch: 91, train_loss: 0.7009, test_loss: 0.8893, test_f1: 0.6088
 epoch: 92, train_loss: 0.7038, test_loss: 0.8854, test_f1: 0.6063
 epoch: 93, train_loss: 0.7097, test_loss: 0.8971, test_f1: 0.5980
 epoch: 94, train_loss: 0.6947, test_loss: 0.8954, test_f1: 0.6009
 epoch: 95, train_loss: 0.7038, test_loss: 0.8964, test_f1: 0.5976
 epoch: 96, train_loss: 0.6986, test_loss: 0.8987, test_f1: 0.5980
 epoch: 97, train_loss: 0.7139, test_loss: 0.9044, test_f1: 0.6034
 epoch: 98, train_loss: 0.7017, test_loss: 0.8941, test_f1: 0.6080
 epoch: 99, train_loss: 0.7165, test_loss: 0.8933, test_f1: 0.6130
##################ITERATION #8 ****************************************
 epoch: 0, train_loss: 1.3116, test_loss: 1.3225, test_f1: 0.2295
 epoch: 1, train_loss: 1.1871, test_loss: 1.1653, test_f1: 0.3587
 epoch: 2, train_loss: 1.1451, test_loss: 1.0492, test_f1: 0.5020
 epoch: 3, train_loss: 1.1130, test_loss: 1.0204, test_f1: 0.5064
 epoch: 4, train_loss: 1.0927, test_loss: 1.0056, test_f1: 0.5066
 epoch: 5, train_loss: 1.0748, test_loss: 0.9880, test_f1: 0.5136
 epoch: 6, train_loss: 1.0641, test_loss: 0.9777, test_f1: 0.5228
 epoch: 7, train_loss: 1.0496, test_loss: 0.9757, test_f1: 0.5078
 epoch: 8, train_loss: 1.0342, test_loss: 0.9640, test_f1: 0.5170
 epoch: 9, train_loss: 1.0165, test_loss: 0.9545, test_f1: 0.5123
 epoch: 10, train_loss: 1.0044, test_loss: 0.9567, test_f1: 0.5061
 epoch: 11, train_loss: 1.0052, test_loss: 0.9533, test_f1: 0.5078
 epoch: 12, train_loss: 0.9935, test_loss: 0.9521, test_f1: 0.5000
 epoch: 13, train_loss: 0.9830, test_loss: 0.9504, test_f1: 0.5024
 epoch: 14, train_loss: 0.9833, test_loss: 0.9468, test_f1: 0.5137
 epoch: 15, train_loss: 0.9705, test_loss: 0.9420, test_f1: 0.5154
 epoch: 16, train_loss: 0.9576, test_loss: 0.9385, test_f1: 0.5057
 epoch: 17, train_loss: 0.9599, test_loss: 0.9390, test_f1: 0.5176
 epoch: 18, train_loss: 0.9456, test_loss: 0.9392, test_f1: 0.5146
 epoch: 19, train_loss: 0.9477, test_loss: 0.9455, test_f1: 0.5230
 epoch: 20, train_loss: 0.9330, test_loss: 0.9376, test_f1: 0.5272
 epoch: 21, train_loss: 0.9270, test_loss: 0.9444, test_f1: 0.5184
 epoch: 22, train_loss: 0.9228, test_loss: 0.9400, test_f1: 0.5282
 epoch: 23, train_loss: 0.9280, test_loss: 0.9319, test_f1: 0.5288
 epoch: 24, train_loss: 0.9217, test_loss: 0.9435, test_f1: 0.5286
 epoch: 25, train_loss: 0.9023, test_loss: 0.9255, test_f1: 0.5372
 epoch: 26, train_loss: 0.9161, test_loss: 0.9445, test_f1: 0.5424
 epoch: 27, train_loss: 0.8967, test_loss: 0.9304, test_f1: 0.5304
 epoch: 28, train_loss: 0.8964, test_loss: 0.9429, test_f1: 0.5331
 epoch: 29, train_loss: 0.8894, test_loss: 0.9373, test_f1: 0.5349
 epoch: 30, train_loss: 0.8912, test_loss: 0.9375, test_f1: 0.5318
 epoch: 31, train_loss: 0.8892, test_loss: 0.9393, test_f1: 0.5552
 epoch: 32, train_loss: 0.8794, test_loss: 0.9471, test_f1: 0.5415
 epoch: 33, train_loss: 0.8724, test_loss: 0.9488, test_f1: 0.5464
 epoch: 34, train_loss: 0.8716, test_loss: 0.9426, test_f1: 0.5540
 epoch: 35, train_loss: 0.8634, test_loss: 0.9298, test_f1: 0.5557
 epoch: 36, train_loss: 0.8548, test_loss: 0.9541, test_f1: 0.5354
 epoch: 37, train_loss: 0.8600, test_loss: 0.9437, test_f1: 0.5560
 epoch: 38, train_loss: 0.8601, test_loss: 0.9461, test_f1: 0.5567
 epoch: 39, train_loss: 0.8537, test_loss: 0.9645, test_f1: 0.5412
 epoch: 40, train_loss: 0.8678, test_loss: 0.9601, test_f1: 0.5613
 epoch: 41, train_loss: 0.8436, test_loss: 0.9517, test_f1: 0.5490
 epoch: 42, train_loss: 0.8458, test_loss: 0.9479, test_f1: 0.5569
 epoch: 43, train_loss: 0.8339, test_loss: 0.9584, test_f1: 0.5484
 epoch: 44, train_loss: 0.8284, test_loss: 0.9460, test_f1: 0.5545
 epoch: 45, train_loss: 0.8292, test_loss: 0.9616, test_f1: 0.5512
 epoch: 46, train_loss: 0.8268, test_loss: 0.9517, test_f1: 0.5567
 epoch: 47, train_loss: 0.8230, test_loss: 0.9584, test_f1: 0.5519
 epoch: 48, train_loss: 0.8382, test_loss: 0.9634, test_f1: 0.5522
 epoch: 49, train_loss: 0.8197, test_loss: 0.9565, test_f1: 0.5638
 epoch: 50, train_loss: 0.8227, test_loss: 0.9633, test_f1: 0.5478
 epoch: 51, train_loss: 0.8155, test_loss: 0.9573, test_f1: 0.5603
 epoch: 52, train_loss: 0.8125, test_loss: 0.9629, test_f1: 0.5643
 epoch: 53, train_loss: 0.8089, test_loss: 0.9554, test_f1: 0.5676
 epoch: 54, train_loss: 0.8038, test_loss: 0.9541, test_f1: 0.5655
 epoch: 55, train_loss: 0.8015, test_loss: 0.9657, test_f1: 0.5613
 epoch: 56, train_loss: 0.8005, test_loss: 0.9559, test_f1: 0.5703
 epoch: 57, train_loss: 0.8031, test_loss: 0.9656, test_f1: 0.5476
 epoch: 58, train_loss: 0.7971, test_loss: 0.9534, test_f1: 0.5685
 epoch: 59, train_loss: 0.8061, test_loss: 0.9546, test_f1: 0.5691
 epoch: 60, train_loss: 0.8050, test_loss: 0.9570, test_f1: 0.5662
 epoch: 61, train_loss: 0.7965, test_loss: 0.9554, test_f1: 0.5649
 epoch: 62, train_loss: 0.7800, test_loss: 0.9460, test_f1: 0.5573
 epoch: 63, train_loss: 0.8056, test_loss: 0.9470, test_f1: 0.5663
 epoch: 64, train_loss: 0.8131, test_loss: 0.9544, test_f1: 0.5705
 epoch: 65, train_loss: 0.7957, test_loss: 0.9466, test_f1: 0.5637
 epoch: 66, train_loss: 0.7963, test_loss: 0.9522, test_f1: 0.5663
 epoch: 67, train_loss: 0.7890, test_loss: 0.9709, test_f1: 0.5577
 epoch: 68, train_loss: 0.8009, test_loss: 0.9657, test_f1: 0.5707
 epoch: 69, train_loss: 0.7941, test_loss: 0.9563, test_f1: 0.5664
 epoch: 70, train_loss: 0.7902, test_loss: 0.9521, test_f1: 0.5662
 epoch: 71, train_loss: 0.7804, test_loss: 0.9510, test_f1: 0.5617
 epoch: 72, train_loss: 0.7880, test_loss: 0.9597, test_f1: 0.5735
 epoch: 73, train_loss: 0.7838, test_loss: 0.9551, test_f1: 0.5753
 epoch: 74, train_loss: 0.7841, test_loss: 0.9534, test_f1: 0.5728
 epoch: 75, train_loss: 0.7770, test_loss: 0.9463, test_f1: 0.5800
 epoch: 76, train_loss: 0.7840, test_loss: 0.9586, test_f1: 0.5669
 epoch: 77, train_loss: 0.7777, test_loss: 0.9509, test_f1: 0.5860
 epoch: 78, train_loss: 0.7739, test_loss: 0.9567, test_f1: 0.5818
 epoch: 79, train_loss: 0.7762, test_loss: 0.9546, test_f1: 0.5690
 epoch: 80, train_loss: 0.7767, test_loss: 0.9576, test_f1: 0.5820
 epoch: 81, train_loss: 0.7663, test_loss: 0.9643, test_f1: 0.5822
 epoch: 82, train_loss: 0.7748, test_loss: 0.9598, test_f1: 0.5772
 epoch: 83, train_loss: 0.7736, test_loss: 0.9572, test_f1: 0.5789
 epoch: 84, train_loss: 0.7746, test_loss: 0.9625, test_f1: 0.5796
 epoch: 85, train_loss: 0.7622, test_loss: 0.9699, test_f1: 0.5752
 epoch: 86, train_loss: 0.7645, test_loss: 0.9714, test_f1: 0.5814
 epoch: 87, train_loss: 0.7646, test_loss: 0.9803, test_f1: 0.5668
 epoch: 88, train_loss: 0.7659, test_loss: 0.9586, test_f1: 0.5785
 epoch: 89, train_loss: 0.7737, test_loss: 0.9708, test_f1: 0.5722
 epoch: 90, train_loss: 0.7653, test_loss: 0.9750, test_f1: 0.5773
 epoch: 91, train_loss: 0.7656, test_loss: 0.9489, test_f1: 0.5941
 epoch: 92, train_loss: 0.7616, test_loss: 0.9641, test_f1: 0.5795
 epoch: 93, train_loss: 0.7613, test_loss: 0.9788, test_f1: 0.5739
 epoch: 94, train_loss: 0.7648, test_loss: 0.9702, test_f1: 0.5729
 epoch: 95, train_loss: 0.7501, test_loss: 0.9722, test_f1: 0.5638
 epoch: 96, train_loss: 0.7515, test_loss: 0.9725, test_f1: 0.5799
 epoch: 97, train_loss: 0.7590, test_loss: 0.9767, test_f1: 0.5785
 epoch: 98, train_loss: 0.7532, test_loss: 0.9785, test_f1: 0.5697
 epoch: 99, train_loss: 0.7503, test_loss: 0.9750, test_f1: 0.5801
##################ITERATION #9 ****************************************
 epoch: 0, train_loss: 1.2908, test_loss: 1.3544, test_f1: 0.2688
 epoch: 1, train_loss: 1.1807, test_loss: 1.1608, test_f1: 0.4313
 epoch: 2, train_loss: 1.1427, test_loss: 1.0703, test_f1: 0.4616
 epoch: 3, train_loss: 1.1169, test_loss: 1.0347, test_f1: 0.4707
 epoch: 4, train_loss: 1.0826, test_loss: 1.0064, test_f1: 0.4754
 epoch: 5, train_loss: 1.0777, test_loss: 0.9972, test_f1: 0.4757
 epoch: 6, train_loss: 1.0577, test_loss: 0.9820, test_f1: 0.4939
 epoch: 7, train_loss: 1.0361, test_loss: 0.9740, test_f1: 0.4689
 epoch: 8, train_loss: 1.0143, test_loss: 0.9657, test_f1: 0.4716
 epoch: 9, train_loss: 1.0112, test_loss: 0.9607, test_f1: 0.4973
 epoch: 10, train_loss: 1.0089, test_loss: 0.9548, test_f1: 0.4927
 epoch: 11, train_loss: 0.9948, test_loss: 0.9547, test_f1: 0.4879
 epoch: 12, train_loss: 0.9728, test_loss: 0.9552, test_f1: 0.4966
 epoch: 13, train_loss: 0.9754, test_loss: 0.9494, test_f1: 0.5089
 epoch: 14, train_loss: 0.9599, test_loss: 0.9424, test_f1: 0.5083
 epoch: 15, train_loss: 0.9499, test_loss: 0.9506, test_f1: 0.5020
 epoch: 16, train_loss: 0.9392, test_loss: 0.9441, test_f1: 0.5190
 epoch: 17, train_loss: 0.9405, test_loss: 0.9379, test_f1: 0.5024
 epoch: 18, train_loss: 0.9317, test_loss: 0.9282, test_f1: 0.5032
 epoch: 19, train_loss: 0.9216, test_loss: 0.9350, test_f1: 0.5180
 epoch: 20, train_loss: 0.9222, test_loss: 0.9345, test_f1: 0.5279
 epoch: 21, train_loss: 0.9136, test_loss: 0.9339, test_f1: 0.5334
 epoch: 22, train_loss: 0.9106, test_loss: 0.9325, test_f1: 0.5280
 epoch: 23, train_loss: 0.9004, test_loss: 0.9352, test_f1: 0.5443
 epoch: 24, train_loss: 0.9012, test_loss: 0.9324, test_f1: 0.5382
 epoch: 25, train_loss: 0.8904, test_loss: 0.9268, test_f1: 0.5574
 epoch: 26, train_loss: 0.8915, test_loss: 0.9352, test_f1: 0.5602
 epoch: 27, train_loss: 0.8802, test_loss: 0.9402, test_f1: 0.5600
 epoch: 28, train_loss: 0.8787, test_loss: 0.9450, test_f1: 0.5502
 epoch: 29, train_loss: 0.8778, test_loss: 0.9395, test_f1: 0.5663
 epoch: 30, train_loss: 0.8707, test_loss: 0.9363, test_f1: 0.5808
 epoch: 31, train_loss: 0.8661, test_loss: 0.9327, test_f1: 0.5878
 epoch: 32, train_loss: 0.8679, test_loss: 0.9354, test_f1: 0.5732
 epoch: 33, train_loss: 0.8572, test_loss: 0.9419, test_f1: 0.5711
 epoch: 34, train_loss: 0.8476, test_loss: 0.9341, test_f1: 0.5800
 epoch: 35, train_loss: 0.8444, test_loss: 0.9265, test_f1: 0.5811
 epoch: 36, train_loss: 0.8357, test_loss: 0.9261, test_f1: 0.5729
 epoch: 37, train_loss: 0.8448, test_loss: 0.9281, test_f1: 0.5966
 epoch: 38, train_loss: 0.8335, test_loss: 0.9434, test_f1: 0.5951
 epoch: 39, train_loss: 0.8432, test_loss: 0.9527, test_f1: 0.5719
 epoch: 40, train_loss: 0.8329, test_loss: 0.9288, test_f1: 0.5684
 epoch: 41, train_loss: 0.8289, test_loss: 0.9489, test_f1: 0.5777
 epoch: 42, train_loss: 0.8287, test_loss: 0.9436, test_f1: 0.5895
 epoch: 43, train_loss: 0.8195, test_loss: 0.9277, test_f1: 0.5822
 epoch: 44, train_loss: 0.8122, test_loss: 0.9440, test_f1: 0.5748
 epoch: 45, train_loss: 0.8126, test_loss: 0.9312, test_f1: 0.6033
 epoch: 46, train_loss: 0.8148, test_loss: 0.9422, test_f1: 0.6022
 epoch: 47, train_loss: 0.7978, test_loss: 0.9407, test_f1: 0.5927
 epoch: 48, train_loss: 0.8138, test_loss: 0.9506, test_f1: 0.5900
 epoch: 49, train_loss: 0.8003, test_loss: 0.9466, test_f1: 0.5886
 epoch: 50, train_loss: 0.7905, test_loss: 0.9498, test_f1: 0.5749
 epoch: 51, train_loss: 0.7906, test_loss: 0.9446, test_f1: 0.5830
 epoch: 52, train_loss: 0.7890, test_loss: 0.9386, test_f1: 0.5930
 epoch: 53, train_loss: 0.7763, test_loss: 0.9447, test_f1: 0.5938
 epoch: 54, train_loss: 0.7853, test_loss: 0.9481, test_f1: 0.5820
 epoch: 55, train_loss: 0.7761, test_loss: 0.9462, test_f1: 0.6090
 epoch: 56, train_loss: 0.7784, test_loss: 0.9514, test_f1: 0.5946
 epoch: 57, train_loss: 0.7686, test_loss: 0.9544, test_f1: 0.6004
 epoch: 58, train_loss: 0.7638, test_loss: 0.9603, test_f1: 0.5881
 epoch: 59, train_loss: 0.7650, test_loss: 0.9526, test_f1: 0.5812
 epoch: 60, train_loss: 0.7696, test_loss: 0.9637, test_f1: 0.5858
 epoch: 61, train_loss: 0.7707, test_loss: 0.9539, test_f1: 0.5956
 epoch: 62, train_loss: 0.7685, test_loss: 0.9483, test_f1: 0.6017
 epoch: 63, train_loss: 0.7558, test_loss: 0.9523, test_f1: 0.6019
 epoch: 64, train_loss: 0.7591, test_loss: 0.9528, test_f1: 0.6080
 epoch: 65, train_loss: 0.7606, test_loss: 0.9478, test_f1: 0.6114
 epoch: 66, train_loss: 0.7657, test_loss: 0.9476, test_f1: 0.6030
 epoch: 67, train_loss: 0.7560, test_loss: 0.9506, test_f1: 0.6063
 epoch: 68, train_loss: 0.7582, test_loss: 0.9497, test_f1: 0.5958
 epoch: 69, train_loss: 0.7562, test_loss: 0.9531, test_f1: 0.6050
 epoch: 70, train_loss: 0.7588, test_loss: 0.9580, test_f1: 0.6125
 epoch: 71, train_loss: 0.7571, test_loss: 0.9573, test_f1: 0.6016
 epoch: 72, train_loss: 0.7549, test_loss: 0.9510, test_f1: 0.5994
 epoch: 73, train_loss: 0.7474, test_loss: 0.9552, test_f1: 0.6098
 epoch: 74, train_loss: 0.7466, test_loss: 0.9570, test_f1: 0.6128
 epoch: 75, train_loss: 0.7498, test_loss: 0.9605, test_f1: 0.6103
 epoch: 76, train_loss: 0.7414, test_loss: 0.9626, test_f1: 0.6026
 epoch: 77, train_loss: 0.7419, test_loss: 0.9584, test_f1: 0.5984
 epoch: 78, train_loss: 0.7380, test_loss: 0.9617, test_f1: 0.5991
 epoch: 79, train_loss: 0.7301, test_loss: 0.9572, test_f1: 0.6072
 epoch: 80, train_loss: 0.7456, test_loss: 0.9563, test_f1: 0.6120
 epoch: 81, train_loss: 0.7352, test_loss: 0.9619, test_f1: 0.6030
 epoch: 82, train_loss: 0.7381, test_loss: 0.9603, test_f1: 0.6171
 epoch: 83, train_loss: 0.7265, test_loss: 0.9715, test_f1: 0.5981
 epoch: 84, train_loss: 0.7390, test_loss: 0.9655, test_f1: 0.6074
 epoch: 85, train_loss: 0.7246, test_loss: 0.9601, test_f1: 0.6088
 epoch: 86, train_loss: 0.7362, test_loss: 0.9706, test_f1: 0.6051
 epoch: 87, train_loss: 0.7257, test_loss: 0.9832, test_f1: 0.5993
 epoch: 88, train_loss: 0.7367, test_loss: 0.9772, test_f1: 0.5895
 epoch: 89, train_loss: 0.7167, test_loss: 0.9727, test_f1: 0.5938
 epoch: 90, train_loss: 0.7228, test_loss: 0.9735, test_f1: 0.6110
 epoch: 91, train_loss: 0.7154, test_loss: 0.9716, test_f1: 0.6007
 epoch: 92, train_loss: 0.7179, test_loss: 0.9880, test_f1: 0.5967
 epoch: 93, train_loss: 0.7247, test_loss: 0.9644, test_f1: 0.6097
 epoch: 94, train_loss: 0.7168, test_loss: 0.9717, test_f1: 0.6083
 epoch: 95, train_loss: 0.7163, test_loss: 0.9752, test_f1: 0.6079
 epoch: 96, train_loss: 0.7059, test_loss: 0.9680, test_f1: 0.6203
 epoch: 97, train_loss: 0.7196, test_loss: 0.9809, test_f1: 0.5898
 epoch: 98, train_loss: 0.7065, test_loss: 0.9690, test_f1: 0.6150
 epoch: 99, train_loss: 0.7115, test_loss: 0.9765, test_f1: 0.6154

Training completed in 522.04 seconds
Best F1: 0.6203 at epoch 96
Mean F1 across iterations: 0.5928  0.0175
========================FINAL RESULTS================================
FEGIN weighted F1: 0.6203  0.0175
python main.py --data ltspice_examples --representation component_net --model FEGIN --layers 5 --hiddens 64 --batch_size 128 --lr 0.0001 --emb_size 512 --epochs 100 --save_appendix component_net_L5_H64_BS128_LR0.0001_E512 --no_val
-----



STDERR:
  File "main.py", line 370, in <module>
    main()
  File "main.py", line 254, in main
    dataset = dataset_class(
  File "/home/philip/projects/ltspice_examples_code_repo/Circuit-Completion-Using-GNNs/component_classification_with_link_prediction_head/evaluation/FEGIN/kernel/circuit_datasets.py", line 15, in __init__
    self.data, self.slices = torch.load(self.processed_paths[0])
  File "/home/philip/.local/lib/python3.8/site-packages/torch/serialization.py", line 1040, in load
    warnings.warn(
  File "/usr/lib/python3.8/warnings.py", line 109, in _showwarnmsg
    sw(msg.message, msg.category, msg.filename, msg.lineno,
  File "main.py", line 47, in warn_with_traceback
    traceback.print_stack(file=log)
/home/philip/projects/ltspice_examples_code_repo/Circuit-Completion-Using-GNNs/component_classification_with_link_prediction_head/evaluation/FEGIN/kernel/circuit_datasets.py:15: FutureWarning: You are using `torch.load` with `weights_only=False` (the current default value), which uses the default pickle module implicitly. It is possible to construct malicious pickle data which will execute arbitrary code during unpickling (See https://github.com/pytorch/pytorch/blob/main/SECURITY.md#untrusted-models for more details). In a future release, the default value for `weights_only` will be flipped to `True`. This limits the functions that could be executed during unpickling. Arbitrary objects will no longer be allowed to be loaded via this mode unless they are explicitly allowlisted by the user via `torch.serialization.add_safe_globals`. We recommend you start setting `weights_only=True` for any use case where you don't have full control of the loaded file. Please open an issue on GitHub for any issues related to this experimental feature.
  self.data, self.slices = torch.load(self.processed_paths[0])
