STDOUT:
Results will be saved in /home/philip/projects/ltspice_examples_code_repo/Circuit-Completion-Using-GNNs/component_classification_with_link_prediction_head/evaluation/FEGIN/results/model_FEGIN_dataset_ltspice_examples
Command line input: python main.py --data ltspice_examples --representation component_pin --model FEGIN --layers 6 --hiddens 128 --batch_size 64 --lr 0.0001 --emb_size 512 --epochs 100 --save_appendix component_pin_L6_H128_BS64_LR0.0001_E512 --no_val
 is saved.
-----
ltspice_examples - FEGIN
Using 6 layers, 128 hidden units, h = 2
Loading component_pin representation dataset
ENTERED
Training FEGIN on component_pin representation
Train: 3560, Test: 848
##################ITERATION #0 ****************************************
 epoch: 0, train_loss: 1.3535, test_loss: 1.3297, test_f1: 0.2260
 epoch: 1, train_loss: 1.2751, test_loss: 1.2364, test_f1: 0.2260
 epoch: 2, train_loss: 1.2096, test_loss: 1.1631, test_f1: 0.3400
 epoch: 3, train_loss: 1.1396, test_loss: 1.1030, test_f1: 0.3507
 epoch: 4, train_loss: 1.0725, test_loss: 1.0516, test_f1: 0.3450
 epoch: 5, train_loss: 1.0263, test_loss: 1.0391, test_f1: 0.3454
 epoch: 6, train_loss: 1.0042, test_loss: 1.0242, test_f1: 0.3664
 epoch: 7, train_loss: 0.9834, test_loss: 1.0160, test_f1: 0.4075
 epoch: 8, train_loss: 0.9631, test_loss: 0.9869, test_f1: 0.4590
 epoch: 9, train_loss: 0.9425, test_loss: 1.0107, test_f1: 0.4627
 epoch: 10, train_loss: 0.9202, test_loss: 0.9892, test_f1: 0.4947
 epoch: 11, train_loss: 0.9137, test_loss: 0.9447, test_f1: 0.5156
 epoch: 12, train_loss: 0.8920, test_loss: 0.9379, test_f1: 0.5180
 epoch: 13, train_loss: 0.8832, test_loss: 0.9237, test_f1: 0.5196
 epoch: 14, train_loss: 0.8663, test_loss: 0.9191, test_f1: 0.5209
 epoch: 15, train_loss: 0.8446, test_loss: 0.9148, test_f1: 0.5054
 epoch: 16, train_loss: 0.8305, test_loss: 0.9159, test_f1: 0.5189
 epoch: 17, train_loss: 0.8138, test_loss: 0.9212, test_f1: 0.5228
 epoch: 18, train_loss: 0.7992, test_loss: 0.8931, test_f1: 0.5658
 epoch: 19, train_loss: 0.7900, test_loss: 0.9256, test_f1: 0.5307
 epoch: 20, train_loss: 0.7709, test_loss: 0.8762, test_f1: 0.5470
 epoch: 21, train_loss: 0.7736, test_loss: 0.9282, test_f1: 0.5206
 epoch: 22, train_loss: 0.7562, test_loss: 0.8695, test_f1: 0.5602
 epoch: 23, train_loss: 0.7327, test_loss: 0.9006, test_f1: 0.5454
 epoch: 24, train_loss: 0.7398, test_loss: 0.9067, test_f1: 0.5588
 epoch: 25, train_loss: 0.7256, test_loss: 0.8899, test_f1: 0.5484
 epoch: 26, train_loss: 0.7239, test_loss: 0.8891, test_f1: 0.5624
 epoch: 27, train_loss: 0.7122, test_loss: 0.8676, test_f1: 0.5507
 epoch: 28, train_loss: 0.6958, test_loss: 0.8929, test_f1: 0.5373
 epoch: 29, train_loss: 0.6940, test_loss: 0.9042, test_f1: 0.5463
 epoch: 30, train_loss: 0.6764, test_loss: 0.8677, test_f1: 0.5679
 epoch: 31, train_loss: 0.6676, test_loss: 0.8891, test_f1: 0.5662
 epoch: 32, train_loss: 0.6677, test_loss: 0.8677, test_f1: 0.5610
 epoch: 33, train_loss: 0.6556, test_loss: 0.8732, test_f1: 0.5620
 epoch: 34, train_loss: 0.6430, test_loss: 0.8792, test_f1: 0.5547
 epoch: 35, train_loss: 0.6343, test_loss: 0.8903, test_f1: 0.5853
 epoch: 36, train_loss: 0.6393, test_loss: 0.8919, test_f1: 0.5707
 epoch: 37, train_loss: 0.6186, test_loss: 0.8953, test_f1: 0.5719
 epoch: 38, train_loss: 0.6252, test_loss: 0.9055, test_f1: 0.5879
 epoch: 39, train_loss: 0.6166, test_loss: 0.9412, test_f1: 0.5745
 epoch: 40, train_loss: 0.6023, test_loss: 0.9397, test_f1: 0.5938
 epoch: 41, train_loss: 0.5943, test_loss: 0.9253, test_f1: 0.5669
 epoch: 42, train_loss: 0.5989, test_loss: 0.9501, test_f1: 0.5726
 epoch: 43, train_loss: 0.6017, test_loss: 0.9611, test_f1: 0.5863
 epoch: 44, train_loss: 0.5833, test_loss: 0.8844, test_f1: 0.5885
 epoch: 45, train_loss: 0.5698, test_loss: 0.8901, test_f1: 0.6020
 epoch: 46, train_loss: 0.5716, test_loss: 0.9121, test_f1: 0.5788
 epoch: 47, train_loss: 0.5662, test_loss: 0.9601, test_f1: 0.5831
 epoch: 48, train_loss: 0.5568, test_loss: 0.9107, test_f1: 0.6186
 epoch: 49, train_loss: 0.5482, test_loss: 0.9028, test_f1: 0.5954
 epoch: 50, train_loss: 0.5488, test_loss: 1.0020, test_f1: 0.5945
 epoch: 51, train_loss: 0.5234, test_loss: 0.9058, test_f1: 0.6040
 epoch: 52, train_loss: 0.5323, test_loss: 0.9302, test_f1: 0.5937
 epoch: 53, train_loss: 0.5019, test_loss: 0.9244, test_f1: 0.6062
 epoch: 54, train_loss: 0.5130, test_loss: 0.9572, test_f1: 0.5930
 epoch: 55, train_loss: 0.4999, test_loss: 0.9821, test_f1: 0.6125
 epoch: 56, train_loss: 0.5038, test_loss: 0.9960, test_f1: 0.6038
 epoch: 57, train_loss: 0.4996, test_loss: 0.9936, test_f1: 0.5937
 epoch: 58, train_loss: 0.4971, test_loss: 1.0120, test_f1: 0.5934
 epoch: 59, train_loss: 0.4916, test_loss: 1.0088, test_f1: 0.6026
 epoch: 60, train_loss: 0.4962, test_loss: 1.0269, test_f1: 0.5954
 epoch: 61, train_loss: 0.4851, test_loss: 1.0125, test_f1: 0.6145
 epoch: 62, train_loss: 0.4786, test_loss: 0.9134, test_f1: 0.6305
 epoch: 63, train_loss: 0.4792, test_loss: 0.9717, test_f1: 0.6195
 epoch: 64, train_loss: 0.4920, test_loss: 1.0233, test_f1: 0.6136
 epoch: 65, train_loss: 0.4845, test_loss: 1.0281, test_f1: 0.5988
 epoch: 66, train_loss: 0.4783, test_loss: 1.0534, test_f1: 0.6057
 epoch: 67, train_loss: 0.4759, test_loss: 1.0271, test_f1: 0.6180
 epoch: 68, train_loss: 0.4728, test_loss: 1.0324, test_f1: 0.6329
 epoch: 69, train_loss: 0.4668, test_loss: 1.0818, test_f1: 0.6228
 epoch: 70, train_loss: 0.4533, test_loss: 1.0393, test_f1: 0.6181
 epoch: 71, train_loss: 0.4562, test_loss: 1.0484, test_f1: 0.6092
 epoch: 72, train_loss: 0.4677, test_loss: 1.0424, test_f1: 0.6190
 epoch: 73, train_loss: 0.4706, test_loss: 1.0026, test_f1: 0.6195
 epoch: 74, train_loss: 0.4530, test_loss: 1.0667, test_f1: 0.6060
 epoch: 75, train_loss: 0.4565, test_loss: 1.0278, test_f1: 0.6194
 epoch: 76, train_loss: 0.4522, test_loss: 1.0378, test_f1: 0.6135
 epoch: 77, train_loss: 0.4396, test_loss: 1.0537, test_f1: 0.6185
 epoch: 78, train_loss: 0.4594, test_loss: 1.0373, test_f1: 0.6133
 epoch: 79, train_loss: 0.4394, test_loss: 1.0459, test_f1: 0.6125
 epoch: 80, train_loss: 0.4355, test_loss: 1.1457, test_f1: 0.6304
 epoch: 81, train_loss: 0.4398, test_loss: 1.0931, test_f1: 0.6287
 epoch: 82, train_loss: 0.4357, test_loss: 1.1048, test_f1: 0.6264
 epoch: 83, train_loss: 0.4428, test_loss: 1.1475, test_f1: 0.6170
 epoch: 84, train_loss: 0.4162, test_loss: 1.1051, test_f1: 0.6190
 epoch: 85, train_loss: 0.4261, test_loss: 1.0817, test_f1: 0.6147
 epoch: 86, train_loss: 0.4289, test_loss: 1.1456, test_f1: 0.6397
 epoch: 87, train_loss: 0.4289, test_loss: 1.1532, test_f1: 0.6228
 epoch: 88, train_loss: 0.4260, test_loss: 1.1656, test_f1: 0.6308
 epoch: 89, train_loss: 0.4134, test_loss: 1.1288, test_f1: 0.6349
 epoch: 90, train_loss: 0.4006, test_loss: 1.1710, test_f1: 0.6151
 epoch: 91, train_loss: 0.3974, test_loss: 1.1596, test_f1: 0.6295
 epoch: 92, train_loss: 0.4118, test_loss: 1.1493, test_f1: 0.6101
 epoch: 93, train_loss: 0.4153, test_loss: 1.2001, test_f1: 0.6203
 epoch: 94, train_loss: 0.4114, test_loss: 1.1117, test_f1: 0.6100
 epoch: 95, train_loss: 0.4166, test_loss: 1.1548, test_f1: 0.6262
 epoch: 96, train_loss: 0.4043, test_loss: 1.1189, test_f1: 0.6270
 epoch: 97, train_loss: 0.4158, test_loss: 1.1836, test_f1: 0.6312
 epoch: 98, train_loss: 0.3884, test_loss: 1.2004, test_f1: 0.6452
 epoch: 99, train_loss: 0.4095, test_loss: 1.2186, test_f1: 0.6030
##################ITERATION #1 ****************************************
 epoch: 0, train_loss: 1.2656, test_loss: 1.2142, test_f1: 0.2260
 epoch: 1, train_loss: 1.1239, test_loss: 1.0659, test_f1: 0.4481
 epoch: 2, train_loss: 1.0572, test_loss: 1.0356, test_f1: 0.4743
 epoch: 3, train_loss: 1.0069, test_loss: 1.0188, test_f1: 0.4778
 epoch: 4, train_loss: 0.9794, test_loss: 0.9836, test_f1: 0.4832
 epoch: 5, train_loss: 0.9418, test_loss: 0.9793, test_f1: 0.4885
 epoch: 6, train_loss: 0.9247, test_loss: 0.9790, test_f1: 0.5243
 epoch: 7, train_loss: 0.9093, test_loss: 0.9638, test_f1: 0.5257
 epoch: 8, train_loss: 0.8839, test_loss: 0.9515, test_f1: 0.5253
 epoch: 9, train_loss: 0.8549, test_loss: 0.9675, test_f1: 0.5124
 epoch: 10, train_loss: 0.8527, test_loss: 0.9628, test_f1: 0.5370
 epoch: 11, train_loss: 0.8295, test_loss: 0.9476, test_f1: 0.5409
 epoch: 12, train_loss: 0.8286, test_loss: 0.9748, test_f1: 0.5165
 epoch: 13, train_loss: 0.7983, test_loss: 0.9255, test_f1: 0.5478
 epoch: 14, train_loss: 0.7893, test_loss: 0.9348, test_f1: 0.5288
 epoch: 15, train_loss: 0.7765, test_loss: 1.0088, test_f1: 0.5386
 epoch: 16, train_loss: 0.7610, test_loss: 0.9459, test_f1: 0.5329
 epoch: 17, train_loss: 0.7567, test_loss: 0.9384, test_f1: 0.5557
 epoch: 18, train_loss: 0.7363, test_loss: 0.9759, test_f1: 0.5326
 epoch: 19, train_loss: 0.7258, test_loss: 0.9629, test_f1: 0.5496
 epoch: 20, train_loss: 0.7120, test_loss: 0.9443, test_f1: 0.5426
 epoch: 21, train_loss: 0.7172, test_loss: 0.9620, test_f1: 0.5419
 epoch: 22, train_loss: 0.6979, test_loss: 0.9199, test_f1: 0.5743
 epoch: 23, train_loss: 0.6923, test_loss: 0.9084, test_f1: 0.5690
 epoch: 24, train_loss: 0.6910, test_loss: 0.8860, test_f1: 0.5941
 epoch: 25, train_loss: 0.6760, test_loss: 0.9347, test_f1: 0.5801
 epoch: 26, train_loss: 0.6783, test_loss: 0.9500, test_f1: 0.5683
 epoch: 27, train_loss: 0.6508, test_loss: 0.9215, test_f1: 0.5953
 epoch: 28, train_loss: 0.6531, test_loss: 0.9238, test_f1: 0.5869
 epoch: 29, train_loss: 0.6426, test_loss: 0.9031, test_f1: 0.5748
 epoch: 30, train_loss: 0.6360, test_loss: 0.9588, test_f1: 0.5632
 epoch: 31, train_loss: 0.6224, test_loss: 0.9744, test_f1: 0.5596
 epoch: 32, train_loss: 0.6159, test_loss: 0.9256, test_f1: 0.6017
 epoch: 33, train_loss: 0.6165, test_loss: 0.9339, test_f1: 0.6148
 epoch: 34, train_loss: 0.6031, test_loss: 0.9098, test_f1: 0.5862
 epoch: 35, train_loss: 0.5975, test_loss: 0.9243, test_f1: 0.5957
 epoch: 36, train_loss: 0.5970, test_loss: 0.9333, test_f1: 0.5923
 epoch: 37, train_loss: 0.5858, test_loss: 0.9321, test_f1: 0.5938
 epoch: 38, train_loss: 0.5778, test_loss: 0.9193, test_f1: 0.6132
 epoch: 39, train_loss: 0.5907, test_loss: 0.9778, test_f1: 0.5928
 epoch: 40, train_loss: 0.5629, test_loss: 0.9771, test_f1: 0.5718
 epoch: 41, train_loss: 0.5621, test_loss: 0.9689, test_f1: 0.5895
 epoch: 42, train_loss: 0.5675, test_loss: 0.9877, test_f1: 0.6055
 epoch: 43, train_loss: 0.5551, test_loss: 0.9460, test_f1: 0.6078
 epoch: 44, train_loss: 0.5454, test_loss: 0.9619, test_f1: 0.6125
 epoch: 45, train_loss: 0.5359, test_loss: 0.9461, test_f1: 0.6214
 epoch: 46, train_loss: 0.5354, test_loss: 1.0208, test_f1: 0.6035
 epoch: 47, train_loss: 0.5387, test_loss: 1.0333, test_f1: 0.5952
 epoch: 48, train_loss: 0.5175, test_loss: 0.9786, test_f1: 0.5870
 epoch: 49, train_loss: 0.5216, test_loss: 1.0412, test_f1: 0.5938
 epoch: 50, train_loss: 0.5179, test_loss: 1.0118, test_f1: 0.6205
 epoch: 51, train_loss: 0.4906, test_loss: 1.0126, test_f1: 0.6222
 epoch: 52, train_loss: 0.4782, test_loss: 1.0624, test_f1: 0.6073
 epoch: 53, train_loss: 0.4749, test_loss: 1.0553, test_f1: 0.6056
 epoch: 54, train_loss: 0.4695, test_loss: 1.0512, test_f1: 0.6150
 epoch: 55, train_loss: 0.4641, test_loss: 1.0818, test_f1: 0.6070
 epoch: 56, train_loss: 0.4607, test_loss: 1.0169, test_f1: 0.6237
 epoch: 57, train_loss: 0.4565, test_loss: 1.0543, test_f1: 0.6287
 epoch: 58, train_loss: 0.4472, test_loss: 1.0717, test_f1: 0.6305
 epoch: 59, train_loss: 0.4463, test_loss: 1.0864, test_f1: 0.6182
 epoch: 60, train_loss: 0.4453, test_loss: 1.0875, test_f1: 0.6079
 epoch: 61, train_loss: 0.4425, test_loss: 1.0927, test_f1: 0.6214
 epoch: 62, train_loss: 0.4450, test_loss: 1.1192, test_f1: 0.6212
 epoch: 63, train_loss: 0.4417, test_loss: 1.0930, test_f1: 0.6408
 epoch: 64, train_loss: 0.4327, test_loss: 1.0630, test_f1: 0.6377
 epoch: 65, train_loss: 0.4459, test_loss: 1.1020, test_f1: 0.6121
 epoch: 66, train_loss: 0.4481, test_loss: 1.0694, test_f1: 0.6271
 epoch: 67, train_loss: 0.4208, test_loss: 1.0936, test_f1: 0.6220
 epoch: 68, train_loss: 0.4290, test_loss: 1.0986, test_f1: 0.6264
 epoch: 69, train_loss: 0.4188, test_loss: 1.1564, test_f1: 0.6439
 epoch: 70, train_loss: 0.4176, test_loss: 1.1627, test_f1: 0.6193
 epoch: 71, train_loss: 0.4160, test_loss: 1.1492, test_f1: 0.6290
 epoch: 72, train_loss: 0.4035, test_loss: 1.1320, test_f1: 0.6346
 epoch: 73, train_loss: 0.4168, test_loss: 1.1728, test_f1: 0.6287
 epoch: 74, train_loss: 0.4123, test_loss: 1.1437, test_f1: 0.6507
 epoch: 75, train_loss: 0.4219, test_loss: 1.1390, test_f1: 0.6370
 epoch: 76, train_loss: 0.4138, test_loss: 1.1852, test_f1: 0.6300
 epoch: 77, train_loss: 0.4011, test_loss: 1.2018, test_f1: 0.6240
 epoch: 78, train_loss: 0.4031, test_loss: 1.1742, test_f1: 0.6304
 epoch: 79, train_loss: 0.3997, test_loss: 1.1844, test_f1: 0.6347
 epoch: 80, train_loss: 0.4052, test_loss: 1.2285, test_f1: 0.6206
 epoch: 81, train_loss: 0.4007, test_loss: 1.2786, test_f1: 0.6098
 epoch: 82, train_loss: 0.3857, test_loss: 1.2718, test_f1: 0.6091
 epoch: 83, train_loss: 0.3890, test_loss: 1.2727, test_f1: 0.6311
 epoch: 84, train_loss: 0.3772, test_loss: 1.2896, test_f1: 0.6143
 epoch: 85, train_loss: 0.3815, test_loss: 1.2467, test_f1: 0.6255
 epoch: 86, train_loss: 0.3704, test_loss: 1.2557, test_f1: 0.6345
 epoch: 87, train_loss: 0.3751, test_loss: 1.2732, test_f1: 0.6438
 epoch: 88, train_loss: 0.3707, test_loss: 1.2462, test_f1: 0.6526
 epoch: 89, train_loss: 0.3585, test_loss: 1.3006, test_f1: 0.6320
 epoch: 90, train_loss: 0.3762, test_loss: 1.2553, test_f1: 0.6372
 epoch: 91, train_loss: 0.3637, test_loss: 1.3558, test_f1: 0.6356
 epoch: 92, train_loss: 0.3599, test_loss: 1.3346, test_f1: 0.6392
 epoch: 93, train_loss: 0.3639, test_loss: 1.2589, test_f1: 0.6262
 epoch: 94, train_loss: 0.3655, test_loss: 1.3250, test_f1: 0.6249
 epoch: 95, train_loss: 0.3637, test_loss: 1.2438, test_f1: 0.6382
 epoch: 96, train_loss: 0.3541, test_loss: 1.2370, test_f1: 0.6443
 epoch: 97, train_loss: 0.3550, test_loss: 1.3506, test_f1: 0.6325
 epoch: 98, train_loss: 0.3444, test_loss: 1.2723, test_f1: 0.6524
 epoch: 99, train_loss: 0.3499, test_loss: 1.3040, test_f1: 0.6336
##################ITERATION #2 ****************************************
 epoch: 0, train_loss: 1.2267, test_loss: 1.1982, test_f1: 0.3448
 epoch: 1, train_loss: 1.1090, test_loss: 1.0474, test_f1: 0.4725
 epoch: 2, train_loss: 1.0486, test_loss: 1.0176, test_f1: 0.5013
 epoch: 3, train_loss: 1.0105, test_loss: 1.0075, test_f1: 0.5028
 epoch: 4, train_loss: 0.9856, test_loss: 0.9793, test_f1: 0.5232
 epoch: 5, train_loss: 0.9646, test_loss: 0.9684, test_f1: 0.5132
 epoch: 6, train_loss: 0.9356, test_loss: 0.9843, test_f1: 0.5212
 epoch: 7, train_loss: 0.9214, test_loss: 1.0143, test_f1: 0.4830
 epoch: 8, train_loss: 0.9069, test_loss: 0.9506, test_f1: 0.5257
 epoch: 9, train_loss: 0.8836, test_loss: 0.9356, test_f1: 0.5610
 epoch: 10, train_loss: 0.8706, test_loss: 0.9647, test_f1: 0.5165
 epoch: 11, train_loss: 0.8534, test_loss: 0.9153, test_f1: 0.5677
 epoch: 12, train_loss: 0.8349, test_loss: 0.9414, test_f1: 0.5669
 epoch: 13, train_loss: 0.8293, test_loss: 0.9335, test_f1: 0.5516
 epoch: 14, train_loss: 0.8076, test_loss: 0.9143, test_f1: 0.5774
 epoch: 15, train_loss: 0.8007, test_loss: 0.9223, test_f1: 0.5926
 epoch: 16, train_loss: 0.7886, test_loss: 0.9005, test_f1: 0.5847
 epoch: 17, train_loss: 0.7800, test_loss: 0.9187, test_f1: 0.5914
 epoch: 18, train_loss: 0.7659, test_loss: 0.9435, test_f1: 0.5668
 epoch: 19, train_loss: 0.7560, test_loss: 0.9039, test_f1: 0.5933
 epoch: 20, train_loss: 0.7390, test_loss: 0.9084, test_f1: 0.5868
 epoch: 21, train_loss: 0.7235, test_loss: 0.9238, test_f1: 0.5999
 epoch: 22, train_loss: 0.7149, test_loss: 0.9305, test_f1: 0.6015
 epoch: 23, train_loss: 0.7241, test_loss: 0.9456, test_f1: 0.5732
 epoch: 24, train_loss: 0.7117, test_loss: 0.9228, test_f1: 0.5830
 epoch: 25, train_loss: 0.6881, test_loss: 1.0181, test_f1: 0.5903
 epoch: 26, train_loss: 0.6872, test_loss: 0.9083, test_f1: 0.6078
 epoch: 27, train_loss: 0.6636, test_loss: 0.9027, test_f1: 0.6298
 epoch: 28, train_loss: 0.6691, test_loss: 0.9158, test_f1: 0.5878
 epoch: 29, train_loss: 0.6404, test_loss: 0.9749, test_f1: 0.6088
 epoch: 30, train_loss: 0.6352, test_loss: 0.9217, test_f1: 0.6254
 epoch: 31, train_loss: 0.6519, test_loss: 0.9077, test_f1: 0.6340
 epoch: 32, train_loss: 0.6234, test_loss: 0.9093, test_f1: 0.5951
 epoch: 33, train_loss: 0.6187, test_loss: 0.9142, test_f1: 0.6494
 epoch: 34, train_loss: 0.6142, test_loss: 0.9399, test_f1: 0.5980
 epoch: 35, train_loss: 0.6230, test_loss: 0.9243, test_f1: 0.6190
 epoch: 36, train_loss: 0.6065, test_loss: 0.8849, test_f1: 0.6426
 epoch: 37, train_loss: 0.5949, test_loss: 0.9295, test_f1: 0.6293
 epoch: 38, train_loss: 0.5918, test_loss: 0.9595, test_f1: 0.6160
 epoch: 39, train_loss: 0.5843, test_loss: 0.9349, test_f1: 0.6392
 epoch: 40, train_loss: 0.5825, test_loss: 0.9226, test_f1: 0.6159
 epoch: 41, train_loss: 0.5727, test_loss: 0.8910, test_f1: 0.6467
 epoch: 42, train_loss: 0.5612, test_loss: 0.9411, test_f1: 0.6146
 epoch: 43, train_loss: 0.5529, test_loss: 0.9317, test_f1: 0.6448
 epoch: 44, train_loss: 0.5525, test_loss: 0.9182, test_f1: 0.6201
 epoch: 45, train_loss: 0.5507, test_loss: 0.9513, test_f1: 0.5988
 epoch: 46, train_loss: 0.5409, test_loss: 0.9259, test_f1: 0.6494
 epoch: 47, train_loss: 0.5421, test_loss: 0.8791, test_f1: 0.6425
 epoch: 48, train_loss: 0.5311, test_loss: 0.9540, test_f1: 0.6293
 epoch: 49, train_loss: 0.5277, test_loss: 1.0032, test_f1: 0.6319
 epoch: 50, train_loss: 0.5103, test_loss: 0.9705, test_f1: 0.6342
 epoch: 51, train_loss: 0.4870, test_loss: 0.8870, test_f1: 0.6566
 epoch: 52, train_loss: 0.4913, test_loss: 0.9259, test_f1: 0.6375
 epoch: 53, train_loss: 0.4883, test_loss: 0.9051, test_f1: 0.6402
 epoch: 54, train_loss: 0.4717, test_loss: 0.9524, test_f1: 0.6355
 epoch: 55, train_loss: 0.4743, test_loss: 0.8942, test_f1: 0.6580
 epoch: 56, train_loss: 0.4710, test_loss: 0.9454, test_f1: 0.6463
 epoch: 57, train_loss: 0.4661, test_loss: 0.9461, test_f1: 0.6606
 epoch: 58, train_loss: 0.4651, test_loss: 0.9302, test_f1: 0.6241
 epoch: 59, train_loss: 0.4607, test_loss: 0.9300, test_f1: 0.6389
 epoch: 60, train_loss: 0.4679, test_loss: 0.9066, test_f1: 0.6405
 epoch: 61, train_loss: 0.4537, test_loss: 0.9441, test_f1: 0.6506
 epoch: 62, train_loss: 0.4372, test_loss: 0.9575, test_f1: 0.6388
 epoch: 63, train_loss: 0.4433, test_loss: 0.9709, test_f1: 0.6423
 epoch: 64, train_loss: 0.4403, test_loss: 0.9456, test_f1: 0.6437
 epoch: 65, train_loss: 0.4314, test_loss: 0.9424, test_f1: 0.6344
 epoch: 66, train_loss: 0.4325, test_loss: 0.9219, test_f1: 0.6385
 epoch: 67, train_loss: 0.4352, test_loss: 1.0007, test_f1: 0.6431
 epoch: 68, train_loss: 0.4330, test_loss: 1.0093, test_f1: 0.6481
 epoch: 69, train_loss: 0.4190, test_loss: 1.0746, test_f1: 0.6225
 epoch: 70, train_loss: 0.4149, test_loss: 1.0072, test_f1: 0.6469
 epoch: 71, train_loss: 0.4143, test_loss: 1.0306, test_f1: 0.6345
 epoch: 72, train_loss: 0.4240, test_loss: 0.9687, test_f1: 0.6379
 epoch: 73, train_loss: 0.4044, test_loss: 0.9645, test_f1: 0.6531
 epoch: 74, train_loss: 0.4052, test_loss: 1.0173, test_f1: 0.6110
 epoch: 75, train_loss: 0.4013, test_loss: 0.9791, test_f1: 0.6656
 epoch: 76, train_loss: 0.3994, test_loss: 1.0466, test_f1: 0.6283
 epoch: 77, train_loss: 0.4067, test_loss: 0.9703, test_f1: 0.6457
 epoch: 78, train_loss: 0.3967, test_loss: 0.9916, test_f1: 0.6080
 epoch: 79, train_loss: 0.3923, test_loss: 1.1137, test_f1: 0.6419
 epoch: 80, train_loss: 0.3928, test_loss: 1.1440, test_f1: 0.6290
 epoch: 81, train_loss: 0.4027, test_loss: 1.0412, test_f1: 0.6514
 epoch: 82, train_loss: 0.3883, test_loss: 1.0514, test_f1: 0.6496
 epoch: 83, train_loss: 0.3909, test_loss: 1.1556, test_f1: 0.6236
 epoch: 84, train_loss: 0.3908, test_loss: 1.0467, test_f1: 0.6485
 epoch: 85, train_loss: 0.3875, test_loss: 1.0198, test_f1: 0.6470
 epoch: 86, train_loss: 0.3718, test_loss: 1.1015, test_f1: 0.6346
 epoch: 87, train_loss: 0.3772, test_loss: 1.1392, test_f1: 0.6271
 epoch: 88, train_loss: 0.3666, test_loss: 1.0428, test_f1: 0.6272
 epoch: 89, train_loss: 0.3690, test_loss: 1.1063, test_f1: 0.6377
 epoch: 90, train_loss: 0.3704, test_loss: 1.0221, test_f1: 0.6275
 epoch: 91, train_loss: 0.3641, test_loss: 1.1229, test_f1: 0.6141
 epoch: 92, train_loss: 0.3608, test_loss: 1.1490, test_f1: 0.6157
 epoch: 93, train_loss: 0.3628, test_loss: 1.0479, test_f1: 0.6417
 epoch: 94, train_loss: 0.3579, test_loss: 1.1951, test_f1: 0.6464
 epoch: 95, train_loss: 0.3534, test_loss: 1.1312, test_f1: 0.6472
 epoch: 96, train_loss: 0.3630, test_loss: 1.0969, test_f1: 0.6460
 epoch: 97, train_loss: 0.3412, test_loss: 1.1098, test_f1: 0.6382
 epoch: 98, train_loss: 0.3488, test_loss: 1.1049, test_f1: 0.6619
 epoch: 99, train_loss: 0.3460, test_loss: 1.1807, test_f1: 0.6485
##################ITERATION #3 ****************************************
 epoch: 0, train_loss: 1.2188, test_loss: 1.2044, test_f1: 0.3097
 epoch: 1, train_loss: 1.0917, test_loss: 1.0281, test_f1: 0.4778
 epoch: 2, train_loss: 1.0400, test_loss: 0.9970, test_f1: 0.5332
 epoch: 3, train_loss: 1.0076, test_loss: 0.9767, test_f1: 0.5281
 epoch: 4, train_loss: 0.9765, test_loss: 0.9635, test_f1: 0.5143
 epoch: 5, train_loss: 0.9572, test_loss: 0.9427, test_f1: 0.5170
 epoch: 6, train_loss: 0.9387, test_loss: 0.9524, test_f1: 0.5405
 epoch: 7, train_loss: 0.9086, test_loss: 0.9410, test_f1: 0.5213
 epoch: 8, train_loss: 0.8939, test_loss: 0.9621, test_f1: 0.5053
 epoch: 9, train_loss: 0.8731, test_loss: 0.9460, test_f1: 0.5340
 epoch: 10, train_loss: 0.8646, test_loss: 0.9048, test_f1: 0.5845
 epoch: 11, train_loss: 0.8469, test_loss: 0.9526, test_f1: 0.5725
 epoch: 12, train_loss: 0.8212, test_loss: 0.9254, test_f1: 0.5814
 epoch: 13, train_loss: 0.8268, test_loss: 0.9341, test_f1: 0.5888
 epoch: 14, train_loss: 0.8127, test_loss: 0.8994, test_f1: 0.5950
 epoch: 15, train_loss: 0.7985, test_loss: 0.9010, test_f1: 0.6049
 epoch: 16, train_loss: 0.7855, test_loss: 0.9144, test_f1: 0.5974
 epoch: 17, train_loss: 0.7723, test_loss: 0.9441, test_f1: 0.6071
 epoch: 18, train_loss: 0.7611, test_loss: 0.9339, test_f1: 0.5956
 epoch: 19, train_loss: 0.7375, test_loss: 0.9431, test_f1: 0.5922
 epoch: 20, train_loss: 0.7411, test_loss: 0.9735, test_f1: 0.6018
 epoch: 21, train_loss: 0.7208, test_loss: 0.9477, test_f1: 0.6016
 epoch: 22, train_loss: 0.7203, test_loss: 0.9627, test_f1: 0.5981
 epoch: 23, train_loss: 0.7018, test_loss: 0.9329, test_f1: 0.6187
 epoch: 24, train_loss: 0.6788, test_loss: 0.9709, test_f1: 0.6015
 epoch: 25, train_loss: 0.6974, test_loss: 0.9443, test_f1: 0.6298
 epoch: 26, train_loss: 0.6700, test_loss: 1.0115, test_f1: 0.5826
 epoch: 27, train_loss: 0.6605, test_loss: 0.9582, test_f1: 0.6060
 epoch: 28, train_loss: 0.6607, test_loss: 1.0003, test_f1: 0.6065
 epoch: 29, train_loss: 0.6467, test_loss: 0.9759, test_f1: 0.6228
 epoch: 30, train_loss: 0.6373, test_loss: 0.9881, test_f1: 0.5941
 epoch: 31, train_loss: 0.6293, test_loss: 1.0341, test_f1: 0.6208
 epoch: 32, train_loss: 0.6137, test_loss: 0.9904, test_f1: 0.6106
 epoch: 33, train_loss: 0.6240, test_loss: 0.9899, test_f1: 0.6183
 epoch: 34, train_loss: 0.5980, test_loss: 1.0326, test_f1: 0.6035
 epoch: 35, train_loss: 0.5964, test_loss: 1.0429, test_f1: 0.6226
 epoch: 36, train_loss: 0.6038, test_loss: 1.0544, test_f1: 0.6252
 epoch: 37, train_loss: 0.5834, test_loss: 1.0010, test_f1: 0.6145
 epoch: 38, train_loss: 0.5853, test_loss: 1.0707, test_f1: 0.6509
 epoch: 39, train_loss: 0.5828, test_loss: 1.0836, test_f1: 0.5992
 epoch: 40, train_loss: 0.5737, test_loss: 1.0744, test_f1: 0.6350
 epoch: 41, train_loss: 0.5625, test_loss: 1.1078, test_f1: 0.6081
 epoch: 42, train_loss: 0.5454, test_loss: 1.1518, test_f1: 0.6201
 epoch: 43, train_loss: 0.5569, test_loss: 1.0787, test_f1: 0.6327
 epoch: 44, train_loss: 0.5368, test_loss: 1.1777, test_f1: 0.5957
 epoch: 45, train_loss: 0.5215, test_loss: 1.1669, test_f1: 0.6562
 epoch: 46, train_loss: 0.5137, test_loss: 1.1356, test_f1: 0.6431
 epoch: 47, train_loss: 0.5204, test_loss: 1.2101, test_f1: 0.6346
 epoch: 48, train_loss: 0.5168, test_loss: 1.1625, test_f1: 0.6327
 epoch: 49, train_loss: 0.5061, test_loss: 1.1671, test_f1: 0.6370
 epoch: 50, train_loss: 0.5235, test_loss: 1.1903, test_f1: 0.6139
 epoch: 51, train_loss: 0.4798, test_loss: 1.1963, test_f1: 0.6500
 epoch: 52, train_loss: 0.4812, test_loss: 1.2161, test_f1: 0.6274
 epoch: 53, train_loss: 0.4612, test_loss: 1.2244, test_f1: 0.6579
 epoch: 54, train_loss: 0.4568, test_loss: 1.2369, test_f1: 0.6401
 epoch: 55, train_loss: 0.4673, test_loss: 1.2385, test_f1: 0.6310
 epoch: 56, train_loss: 0.4468, test_loss: 1.2333, test_f1: 0.6565
 epoch: 57, train_loss: 0.4630, test_loss: 1.3043, test_f1: 0.6428
 epoch: 58, train_loss: 0.4543, test_loss: 1.2584, test_f1: 0.6293
 epoch: 59, train_loss: 0.4547, test_loss: 1.2504, test_f1: 0.6568
 epoch: 60, train_loss: 0.4312, test_loss: 1.2787, test_f1: 0.6518
 epoch: 61, train_loss: 0.4426, test_loss: 1.2785, test_f1: 0.6568
 epoch: 62, train_loss: 0.4336, test_loss: 1.2670, test_f1: 0.6586
 epoch: 63, train_loss: 0.4283, test_loss: 1.3437, test_f1: 0.6450
 epoch: 64, train_loss: 0.4328, test_loss: 1.3070, test_f1: 0.6442
 epoch: 65, train_loss: 0.4256, test_loss: 1.3223, test_f1: 0.6351
 epoch: 66, train_loss: 0.4227, test_loss: 1.3123, test_f1: 0.6510
 epoch: 67, train_loss: 0.4161, test_loss: 1.3625, test_f1: 0.6387
 epoch: 68, train_loss: 0.4300, test_loss: 1.2837, test_f1: 0.6454
 epoch: 69, train_loss: 0.4104, test_loss: 1.2950, test_f1: 0.6726
 epoch: 70, train_loss: 0.4095, test_loss: 1.3227, test_f1: 0.6643
 epoch: 71, train_loss: 0.4210, test_loss: 1.3944, test_f1: 0.6380
 epoch: 72, train_loss: 0.4079, test_loss: 1.2934, test_f1: 0.6559
 epoch: 73, train_loss: 0.4068, test_loss: 1.3361, test_f1: 0.6458
 epoch: 74, train_loss: 0.4004, test_loss: 1.2974, test_f1: 0.6427
 epoch: 75, train_loss: 0.3964, test_loss: 1.3364, test_f1: 0.6515
 epoch: 76, train_loss: 0.3898, test_loss: 1.3930, test_f1: 0.6656
 epoch: 77, train_loss: 0.3906, test_loss: 1.3464, test_f1: 0.6800
 epoch: 78, train_loss: 0.3904, test_loss: 1.3845, test_f1: 0.6473
 epoch: 79, train_loss: 0.3955, test_loss: 1.3992, test_f1: 0.6750
 epoch: 80, train_loss: 0.3893, test_loss: 1.4079, test_f1: 0.6492
 epoch: 81, train_loss: 0.3796, test_loss: 1.3731, test_f1: 0.6641
 epoch: 82, train_loss: 0.3812, test_loss: 1.3591, test_f1: 0.6492
 epoch: 83, train_loss: 0.3794, test_loss: 1.3483, test_f1: 0.6681
 epoch: 84, train_loss: 0.3722, test_loss: 1.4400, test_f1: 0.6542
 epoch: 85, train_loss: 0.3746, test_loss: 1.3647, test_f1: 0.6693
 epoch: 86, train_loss: 0.3698, test_loss: 1.4269, test_f1: 0.6417
 epoch: 87, train_loss: 0.3587, test_loss: 1.3904, test_f1: 0.6458
 epoch: 88, train_loss: 0.3741, test_loss: 1.4393, test_f1: 0.6544
 epoch: 89, train_loss: 0.3523, test_loss: 1.4941, test_f1: 0.6432
 epoch: 90, train_loss: 0.3555, test_loss: 1.4343, test_f1: 0.6636
 epoch: 91, train_loss: 0.3586, test_loss: 1.4438, test_f1: 0.6429
 epoch: 92, train_loss: 0.3545, test_loss: 1.4265, test_f1: 0.6795
 epoch: 93, train_loss: 0.3680, test_loss: 1.4011, test_f1: 0.6569
 epoch: 94, train_loss: 0.3568, test_loss: 1.4545, test_f1: 0.6429
 epoch: 95, train_loss: 0.3502, test_loss: 1.4581, test_f1: 0.6689
 epoch: 96, train_loss: 0.3288, test_loss: 1.4634, test_f1: 0.6548
 epoch: 97, train_loss: 0.3347, test_loss: 1.4601, test_f1: 0.6475
 epoch: 98, train_loss: 0.3465, test_loss: 1.5453, test_f1: 0.6513
 epoch: 99, train_loss: 0.3426, test_loss: 1.6029, test_f1: 0.6526
##################ITERATION #4 ****************************************
 epoch: 0, train_loss: 1.1848, test_loss: 1.1460, test_f1: 0.4436
 epoch: 1, train_loss: 1.0665, test_loss: 1.0353, test_f1: 0.4608
 epoch: 2, train_loss: 1.0318, test_loss: 0.9921, test_f1: 0.5051
 epoch: 3, train_loss: 0.9914, test_loss: 0.9844, test_f1: 0.5178
 epoch: 4, train_loss: 0.9645, test_loss: 0.9739, test_f1: 0.5197
 epoch: 5, train_loss: 0.9420, test_loss: 0.9701, test_f1: 0.5019
 epoch: 6, train_loss: 0.9297, test_loss: 0.9500, test_f1: 0.5352
 epoch: 7, train_loss: 0.9027, test_loss: 0.9525, test_f1: 0.5404
 epoch: 8, train_loss: 0.8876, test_loss: 0.9547, test_f1: 0.5226
 epoch: 9, train_loss: 0.8813, test_loss: 0.9403, test_f1: 0.5294
 epoch: 10, train_loss: 0.8643, test_loss: 0.9324, test_f1: 0.5237
 epoch: 11, train_loss: 0.8401, test_loss: 0.9362, test_f1: 0.5520
 epoch: 12, train_loss: 0.8231, test_loss: 0.9222, test_f1: 0.5422
 epoch: 13, train_loss: 0.8145, test_loss: 0.9357, test_f1: 0.5388
 epoch: 14, train_loss: 0.7985, test_loss: 0.9284, test_f1: 0.5423
 epoch: 15, train_loss: 0.7887, test_loss: 0.9203, test_f1: 0.5574
 epoch: 16, train_loss: 0.7822, test_loss: 0.9992, test_f1: 0.5389
 epoch: 17, train_loss: 0.7682, test_loss: 0.9266, test_f1: 0.5746
 epoch: 18, train_loss: 0.7396, test_loss: 0.9495, test_f1: 0.5540
 epoch: 19, train_loss: 0.7335, test_loss: 0.9381, test_f1: 0.5826
 epoch: 20, train_loss: 0.7330, test_loss: 0.8963, test_f1: 0.5799
 epoch: 21, train_loss: 0.7085, test_loss: 0.9346, test_f1: 0.5522
 epoch: 22, train_loss: 0.7105, test_loss: 0.9623, test_f1: 0.5934
 epoch: 23, train_loss: 0.7042, test_loss: 0.9632, test_f1: 0.5601
 epoch: 24, train_loss: 0.6763, test_loss: 0.9396, test_f1: 0.5834
 epoch: 25, train_loss: 0.6757, test_loss: 0.9498, test_f1: 0.6033
 epoch: 26, train_loss: 0.6661, test_loss: 0.9811, test_f1: 0.5692
 epoch: 27, train_loss: 0.6893, test_loss: 0.9642, test_f1: 0.5718
 epoch: 28, train_loss: 0.6534, test_loss: 0.9149, test_f1: 0.6069
 epoch: 29, train_loss: 0.6585, test_loss: 0.9645, test_f1: 0.5788
 epoch: 30, train_loss: 0.6375, test_loss: 0.9719, test_f1: 0.5808
 epoch: 31, train_loss: 0.6260, test_loss: 0.9591, test_f1: 0.6065
 epoch: 32, train_loss: 0.6172, test_loss: 0.9717, test_f1: 0.6082
 epoch: 33, train_loss: 0.6306, test_loss: 1.0110, test_f1: 0.5893
 epoch: 34, train_loss: 0.6180, test_loss: 0.9625, test_f1: 0.5777
 epoch: 35, train_loss: 0.6053, test_loss: 0.9555, test_f1: 0.6066
 epoch: 36, train_loss: 0.5988, test_loss: 0.9657, test_f1: 0.6131
 epoch: 37, train_loss: 0.5930, test_loss: 0.9930, test_f1: 0.6063
 epoch: 38, train_loss: 0.5929, test_loss: 0.9845, test_f1: 0.6021
 epoch: 39, train_loss: 0.5783, test_loss: 0.9944, test_f1: 0.5896
 epoch: 40, train_loss: 0.5656, test_loss: 0.9948, test_f1: 0.6047
 epoch: 41, train_loss: 0.5635, test_loss: 0.9457, test_f1: 0.6244
 epoch: 42, train_loss: 0.5537, test_loss: 0.9728, test_f1: 0.5890
 epoch: 43, train_loss: 0.5506, test_loss: 0.9724, test_f1: 0.6332
 epoch: 44, train_loss: 0.5353, test_loss: 0.9794, test_f1: 0.6146
 epoch: 45, train_loss: 0.5397, test_loss: 0.9974, test_f1: 0.6154
 epoch: 46, train_loss: 0.5298, test_loss: 1.0123, test_f1: 0.6116
 epoch: 47, train_loss: 0.5266, test_loss: 0.9997, test_f1: 0.6211
 epoch: 48, train_loss: 0.5282, test_loss: 1.0672, test_f1: 0.6095
 epoch: 49, train_loss: 0.5190, test_loss: 0.9914, test_f1: 0.6162
 epoch: 50, train_loss: 0.5053, test_loss: 0.9900, test_f1: 0.6187
 epoch: 51, train_loss: 0.4950, test_loss: 0.9782, test_f1: 0.6152
 epoch: 52, train_loss: 0.4786, test_loss: 0.9550, test_f1: 0.6337
 epoch: 53, train_loss: 0.4761, test_loss: 1.0194, test_f1: 0.6369
 epoch: 54, train_loss: 0.4730, test_loss: 1.0330, test_f1: 0.6243
 epoch: 55, train_loss: 0.4812, test_loss: 1.0038, test_f1: 0.6281
 epoch: 56, train_loss: 0.4681, test_loss: 0.9875, test_f1: 0.6205
 epoch: 57, train_loss: 0.4581, test_loss: 1.0317, test_f1: 0.6472
 epoch: 58, train_loss: 0.4620, test_loss: 1.0011, test_f1: 0.6437
 epoch: 59, train_loss: 0.4543, test_loss: 1.0007, test_f1: 0.6265
 epoch: 60, train_loss: 0.4616, test_loss: 1.0219, test_f1: 0.6321
 epoch: 61, train_loss: 0.4556, test_loss: 1.0596, test_f1: 0.6396
 epoch: 62, train_loss: 0.4467, test_loss: 1.0016, test_f1: 0.6652
 epoch: 63, train_loss: 0.4317, test_loss: 1.0500, test_f1: 0.6223
 epoch: 64, train_loss: 0.4438, test_loss: 1.0751, test_f1: 0.6132
 epoch: 65, train_loss: 0.4336, test_loss: 1.0563, test_f1: 0.6185
 epoch: 66, train_loss: 0.4274, test_loss: 1.0556, test_f1: 0.6245
 epoch: 67, train_loss: 0.4339, test_loss: 1.0737, test_f1: 0.6009
 epoch: 68, train_loss: 0.4178, test_loss: 1.0752, test_f1: 0.6141
 epoch: 69, train_loss: 0.4228, test_loss: 1.0859, test_f1: 0.6216
 epoch: 70, train_loss: 0.4165, test_loss: 1.1108, test_f1: 0.6259
 epoch: 71, train_loss: 0.4293, test_loss: 1.0966, test_f1: 0.6335
 epoch: 72, train_loss: 0.4195, test_loss: 1.1277, test_f1: 0.6267
 epoch: 73, train_loss: 0.4040, test_loss: 1.1142, test_f1: 0.6271
 epoch: 74, train_loss: 0.4197, test_loss: 1.0701, test_f1: 0.6215
 epoch: 75, train_loss: 0.4046, test_loss: 1.0737, test_f1: 0.6415
 epoch: 76, train_loss: 0.3954, test_loss: 1.0566, test_f1: 0.6470
 epoch: 77, train_loss: 0.4024, test_loss: 1.1019, test_f1: 0.6237
 epoch: 78, train_loss: 0.4037, test_loss: 1.1467, test_f1: 0.6238
 epoch: 79, train_loss: 0.3977, test_loss: 1.1137, test_f1: 0.6200
 epoch: 80, train_loss: 0.3995, test_loss: 1.0445, test_f1: 0.6485
 epoch: 81, train_loss: 0.4081, test_loss: 1.1560, test_f1: 0.6113
 epoch: 82, train_loss: 0.3991, test_loss: 1.1228, test_f1: 0.6157
 epoch: 83, train_loss: 0.3941, test_loss: 1.1062, test_f1: 0.6199
 epoch: 84, train_loss: 0.3867, test_loss: 1.1155, test_f1: 0.6392
 epoch: 85, train_loss: 0.3924, test_loss: 1.0939, test_f1: 0.6398
 epoch: 86, train_loss: 0.3761, test_loss: 1.1143, test_f1: 0.6386
 epoch: 87, train_loss: 0.3822, test_loss: 1.0825, test_f1: 0.6476
 epoch: 88, train_loss: 0.3688, test_loss: 1.2037, test_f1: 0.6302
 epoch: 89, train_loss: 0.3759, test_loss: 1.1286, test_f1: 0.6373
 epoch: 90, train_loss: 0.3744, test_loss: 1.1748, test_f1: 0.6303
 epoch: 91, train_loss: 0.3615, test_loss: 1.1935, test_f1: 0.6342
 epoch: 92, train_loss: 0.3579, test_loss: 1.1693, test_f1: 0.6281
 epoch: 93, train_loss: 0.3570, test_loss: 1.1490, test_f1: 0.6287
 epoch: 94, train_loss: 0.3657, test_loss: 1.1638, test_f1: 0.6398
 epoch: 95, train_loss: 0.3566, test_loss: 1.1983, test_f1: 0.6366
 epoch: 96, train_loss: 0.3542, test_loss: 1.1583, test_f1: 0.6381
 epoch: 97, train_loss: 0.3404, test_loss: 1.2107, test_f1: 0.6404
 epoch: 98, train_loss: 0.3464, test_loss: 1.2024, test_f1: 0.6335
 epoch: 99, train_loss: 0.3640, test_loss: 1.2087, test_f1: 0.6414
##################ITERATION #5 ****************************************
 epoch: 0, train_loss: 1.2034, test_loss: 1.1246, test_f1: 0.3596
 epoch: 1, train_loss: 1.0697, test_loss: 1.0057, test_f1: 0.5348
 epoch: 2, train_loss: 1.0214, test_loss: 0.9781, test_f1: 0.5425
 epoch: 3, train_loss: 0.9917, test_loss: 0.9684, test_f1: 0.4994
 epoch: 4, train_loss: 0.9650, test_loss: 0.9533, test_f1: 0.5431
 epoch: 5, train_loss: 0.9455, test_loss: 0.9510, test_f1: 0.5423
 epoch: 6, train_loss: 0.9312, test_loss: 0.9302, test_f1: 0.5649
 epoch: 7, train_loss: 0.9047, test_loss: 0.9295, test_f1: 0.5428
 epoch: 8, train_loss: 0.8862, test_loss: 0.9327, test_f1: 0.5614
 epoch: 9, train_loss: 0.8770, test_loss: 0.9512, test_f1: 0.5630
 epoch: 10, train_loss: 0.8554, test_loss: 0.9109, test_f1: 0.5724
 epoch: 11, train_loss: 0.8434, test_loss: 0.8869, test_f1: 0.5666
 epoch: 12, train_loss: 0.8325, test_loss: 0.8618, test_f1: 0.5929
 epoch: 13, train_loss: 0.8307, test_loss: 0.8896, test_f1: 0.5949
 epoch: 14, train_loss: 0.8119, test_loss: 0.8877, test_f1: 0.5887
 epoch: 15, train_loss: 0.7988, test_loss: 0.8779, test_f1: 0.5991
 epoch: 16, train_loss: 0.7864, test_loss: 0.8923, test_f1: 0.5832
 epoch: 17, train_loss: 0.7673, test_loss: 0.9022, test_f1: 0.5834
 epoch: 18, train_loss: 0.7628, test_loss: 0.8976, test_f1: 0.5977
 epoch: 19, train_loss: 0.7420, test_loss: 0.8996, test_f1: 0.6104
 epoch: 20, train_loss: 0.7428, test_loss: 0.8819, test_f1: 0.5923
 epoch: 21, train_loss: 0.7346, test_loss: 0.9032, test_f1: 0.5653
 epoch: 22, train_loss: 0.7126, test_loss: 0.9232, test_f1: 0.5543
 epoch: 23, train_loss: 0.7137, test_loss: 0.9548, test_f1: 0.5692
 epoch: 24, train_loss: 0.7074, test_loss: 0.9499, test_f1: 0.5755
 epoch: 25, train_loss: 0.6863, test_loss: 0.9617, test_f1: 0.5720
 epoch: 26, train_loss: 0.6879, test_loss: 0.9750, test_f1: 0.5894
 epoch: 27, train_loss: 0.6737, test_loss: 0.9685, test_f1: 0.5834
 epoch: 28, train_loss: 0.6751, test_loss: 0.9663, test_f1: 0.5983
 epoch: 29, train_loss: 0.6581, test_loss: 0.9978, test_f1: 0.5808
 epoch: 30, train_loss: 0.6475, test_loss: 0.9928, test_f1: 0.6008
 epoch: 31, train_loss: 0.6384, test_loss: 0.9855, test_f1: 0.5997
 epoch: 32, train_loss: 0.6396, test_loss: 0.9248, test_f1: 0.6179
 epoch: 33, train_loss: 0.6213, test_loss: 0.9792, test_f1: 0.5723
 epoch: 34, train_loss: 0.6275, test_loss: 0.9354, test_f1: 0.5804
 epoch: 35, train_loss: 0.6264, test_loss: 0.9940, test_f1: 0.5811
 epoch: 36, train_loss: 0.6089, test_loss: 0.9698, test_f1: 0.5964
 epoch: 37, train_loss: 0.5931, test_loss: 1.0360, test_f1: 0.5900
 epoch: 38, train_loss: 0.5882, test_loss: 1.0248, test_f1: 0.6131
 epoch: 39, train_loss: 0.5856, test_loss: 1.0493, test_f1: 0.5990
 epoch: 40, train_loss: 0.5946, test_loss: 1.0174, test_f1: 0.5895
 epoch: 41, train_loss: 0.5803, test_loss: 0.9649, test_f1: 0.6251
 epoch: 42, train_loss: 0.5657, test_loss: 1.0345, test_f1: 0.6042
 epoch: 43, train_loss: 0.5677, test_loss: 1.0340, test_f1: 0.6100
 epoch: 44, train_loss: 0.5528, test_loss: 1.0651, test_f1: 0.6126
 epoch: 45, train_loss: 0.5472, test_loss: 1.0895, test_f1: 0.5920
 epoch: 46, train_loss: 0.5604, test_loss: 1.1065, test_f1: 0.6001
 epoch: 47, train_loss: 0.5368, test_loss: 1.1704, test_f1: 0.6021
 epoch: 48, train_loss: 0.5291, test_loss: 1.0509, test_f1: 0.6185
 epoch: 49, train_loss: 0.5322, test_loss: 1.0266, test_f1: 0.6187
 epoch: 50, train_loss: 0.5218, test_loss: 1.1285, test_f1: 0.6221
 epoch: 51, train_loss: 0.4959, test_loss: 1.0776, test_f1: 0.6276
 epoch: 52, train_loss: 0.4911, test_loss: 1.1270, test_f1: 0.6078
 epoch: 53, train_loss: 0.4909, test_loss: 1.1307, test_f1: 0.6209
 epoch: 54, train_loss: 0.4766, test_loss: 1.0906, test_f1: 0.6201
 epoch: 55, train_loss: 0.4826, test_loss: 1.1019, test_f1: 0.6256
 epoch: 56, train_loss: 0.4798, test_loss: 1.1085, test_f1: 0.6364
 epoch: 57, train_loss: 0.4687, test_loss: 1.0393, test_f1: 0.6282
 epoch: 58, train_loss: 0.4710, test_loss: 1.1816, test_f1: 0.6255
 epoch: 59, train_loss: 0.4730, test_loss: 1.1360, test_f1: 0.6336
 epoch: 60, train_loss: 0.4606, test_loss: 1.1164, test_f1: 0.6391
 epoch: 61, train_loss: 0.4532, test_loss: 1.1878, test_f1: 0.6106
 epoch: 62, train_loss: 0.4656, test_loss: 1.2115, test_f1: 0.6024
 epoch: 63, train_loss: 0.4603, test_loss: 1.1923, test_f1: 0.6209
 epoch: 64, train_loss: 0.4508, test_loss: 1.1884, test_f1: 0.6182
 epoch: 65, train_loss: 0.4536, test_loss: 1.1849, test_f1: 0.6326
 epoch: 66, train_loss: 0.4428, test_loss: 1.1766, test_f1: 0.6314
 epoch: 67, train_loss: 0.4249, test_loss: 1.1888, test_f1: 0.6384
 epoch: 68, train_loss: 0.4407, test_loss: 1.2946, test_f1: 0.6381
 epoch: 69, train_loss: 0.4383, test_loss: 1.2420, test_f1: 0.6433
 epoch: 70, train_loss: 0.4289, test_loss: 1.3005, test_f1: 0.6218
 epoch: 71, train_loss: 0.4187, test_loss: 1.2518, test_f1: 0.6304
 epoch: 72, train_loss: 0.4206, test_loss: 1.2979, test_f1: 0.6160
 epoch: 73, train_loss: 0.4326, test_loss: 1.2685, test_f1: 0.6279
 epoch: 74, train_loss: 0.4110, test_loss: 1.1616, test_f1: 0.6305
 epoch: 75, train_loss: 0.4081, test_loss: 1.2487, test_f1: 0.6309
 epoch: 76, train_loss: 0.4050, test_loss: 1.2242, test_f1: 0.6401
 epoch: 77, train_loss: 0.4141, test_loss: 1.2061, test_f1: 0.6405
 epoch: 78, train_loss: 0.4213, test_loss: 1.1794, test_f1: 0.6275
 epoch: 79, train_loss: 0.4127, test_loss: 1.1601, test_f1: 0.6342
 epoch: 80, train_loss: 0.4115, test_loss: 1.2402, test_f1: 0.6354
 epoch: 81, train_loss: 0.4052, test_loss: 1.2796, test_f1: 0.6464
 epoch: 82, train_loss: 0.4027, test_loss: 1.2772, test_f1: 0.6306
 epoch: 83, train_loss: 0.4025, test_loss: 1.3297, test_f1: 0.6107
 epoch: 84, train_loss: 0.3976, test_loss: 1.3099, test_f1: 0.6501
 epoch: 85, train_loss: 0.3903, test_loss: 1.2417, test_f1: 0.6328
 epoch: 86, train_loss: 0.3841, test_loss: 1.2822, test_f1: 0.6384
 epoch: 87, train_loss: 0.3830, test_loss: 1.2960, test_f1: 0.6329
 epoch: 88, train_loss: 0.3752, test_loss: 1.3119, test_f1: 0.6368
 epoch: 89, train_loss: 0.3862, test_loss: 1.2222, test_f1: 0.6580
 epoch: 90, train_loss: 0.3734, test_loss: 1.3595, test_f1: 0.6353
 epoch: 91, train_loss: 0.3748, test_loss: 1.2776, test_f1: 0.6268
 epoch: 92, train_loss: 0.3789, test_loss: 1.2831, test_f1: 0.6232
 epoch: 93, train_loss: 0.3695, test_loss: 1.3050, test_f1: 0.6321
 epoch: 94, train_loss: 0.3647, test_loss: 1.2747, test_f1: 0.6382
 epoch: 95, train_loss: 0.3634, test_loss: 1.2672, test_f1: 0.6332
 epoch: 96, train_loss: 0.3705, test_loss: 1.2631, test_f1: 0.6333
 epoch: 97, train_loss: 0.3696, test_loss: 1.2928, test_f1: 0.6396
 epoch: 98, train_loss: 0.3621, test_loss: 1.3183, test_f1: 0.6322
 epoch: 99, train_loss: 0.3656, test_loss: 1.3605, test_f1: 0.6571
##################ITERATION #6 ****************************************
 epoch: 0, train_loss: 1.2023, test_loss: 1.1339, test_f1: 0.3578
 epoch: 1, train_loss: 1.0757, test_loss: 0.9922, test_f1: 0.4908
 epoch: 2, train_loss: 1.0305, test_loss: 0.9910, test_f1: 0.4874
 epoch: 3, train_loss: 1.0116, test_loss: 0.9397, test_f1: 0.5271
 epoch: 4, train_loss: 0.9774, test_loss: 0.9132, test_f1: 0.5363
 epoch: 5, train_loss: 0.9606, test_loss: 0.9211, test_f1: 0.5304
 epoch: 6, train_loss: 0.9486, test_loss: 0.9037, test_f1: 0.5307
 epoch: 7, train_loss: 0.9256, test_loss: 0.8971, test_f1: 0.5500
 epoch: 8, train_loss: 0.9113, test_loss: 0.8778, test_f1: 0.5377
 epoch: 9, train_loss: 0.8904, test_loss: 0.8700, test_f1: 0.5504
 epoch: 10, train_loss: 0.8891, test_loss: 0.8608, test_f1: 0.5783
 epoch: 11, train_loss: 0.8749, test_loss: 0.8698, test_f1: 0.5844
 epoch: 12, train_loss: 0.8642, test_loss: 0.8864, test_f1: 0.5461
 epoch: 13, train_loss: 0.8548, test_loss: 0.8514, test_f1: 0.5806
 epoch: 14, train_loss: 0.8261, test_loss: 0.8759, test_f1: 0.5667
 epoch: 15, train_loss: 0.8232, test_loss: 0.8658, test_f1: 0.5866
 epoch: 16, train_loss: 0.8209, test_loss: 0.8639, test_f1: 0.5693
 epoch: 17, train_loss: 0.8096, test_loss: 0.8731, test_f1: 0.5732
 epoch: 18, train_loss: 0.7844, test_loss: 0.8926, test_f1: 0.5846
 epoch: 19, train_loss: 0.7805, test_loss: 0.9091, test_f1: 0.5954
 epoch: 20, train_loss: 0.7681, test_loss: 0.8895, test_f1: 0.5891
 epoch: 21, train_loss: 0.7658, test_loss: 0.8574, test_f1: 0.5988
 epoch: 22, train_loss: 0.7518, test_loss: 0.8997, test_f1: 0.6012
 epoch: 23, train_loss: 0.7521, test_loss: 0.9085, test_f1: 0.5890
 epoch: 24, train_loss: 0.7331, test_loss: 0.8846, test_f1: 0.6059
 epoch: 25, train_loss: 0.7299, test_loss: 0.8631, test_f1: 0.5867
 epoch: 26, train_loss: 0.7197, test_loss: 0.8632, test_f1: 0.5700
 epoch: 27, train_loss: 0.7050, test_loss: 0.8496, test_f1: 0.6035
 epoch: 28, train_loss: 0.7011, test_loss: 0.9173, test_f1: 0.5750
 epoch: 29, train_loss: 0.6974, test_loss: 0.8925, test_f1: 0.5918
 epoch: 30, train_loss: 0.6934, test_loss: 0.8944, test_f1: 0.5735
 epoch: 31, train_loss: 0.6749, test_loss: 0.9090, test_f1: 0.6057
 epoch: 32, train_loss: 0.6512, test_loss: 0.8865, test_f1: 0.6291
 epoch: 33, train_loss: 0.6582, test_loss: 0.8978, test_f1: 0.6044
 epoch: 34, train_loss: 0.6508, test_loss: 0.8808, test_f1: 0.6125
 epoch: 35, train_loss: 0.6522, test_loss: 0.9053, test_f1: 0.5947
 epoch: 36, train_loss: 0.6441, test_loss: 0.8810, test_f1: 0.5870
 epoch: 37, train_loss: 0.6292, test_loss: 0.8798, test_f1: 0.6014
 epoch: 38, train_loss: 0.6142, test_loss: 0.8819, test_f1: 0.6094
 epoch: 39, train_loss: 0.6244, test_loss: 0.8204, test_f1: 0.6304
 epoch: 40, train_loss: 0.5961, test_loss: 0.8868, test_f1: 0.6011
 epoch: 41, train_loss: 0.6079, test_loss: 0.9331, test_f1: 0.5986
 epoch: 42, train_loss: 0.5948, test_loss: 0.8802, test_f1: 0.6205
 epoch: 43, train_loss: 0.5922, test_loss: 0.8525, test_f1: 0.6161
 epoch: 44, train_loss: 0.5863, test_loss: 0.8673, test_f1: 0.6457
 epoch: 45, train_loss: 0.5762, test_loss: 0.8950, test_f1: 0.6031
 epoch: 46, train_loss: 0.5686, test_loss: 0.8612, test_f1: 0.6284
 epoch: 47, train_loss: 0.5691, test_loss: 0.9275, test_f1: 0.6079
 epoch: 48, train_loss: 0.5594, test_loss: 0.8364, test_f1: 0.6422
 epoch: 49, train_loss: 0.5498, test_loss: 0.8841, test_f1: 0.6317
 epoch: 50, train_loss: 0.5493, test_loss: 0.9229, test_f1: 0.6365
 epoch: 51, train_loss: 0.5269, test_loss: 0.8708, test_f1: 0.6390
 epoch: 52, train_loss: 0.5116, test_loss: 0.8880, test_f1: 0.6276
 epoch: 53, train_loss: 0.5020, test_loss: 0.8484, test_f1: 0.6341
 epoch: 54, train_loss: 0.5143, test_loss: 0.8961, test_f1: 0.6415
 epoch: 55, train_loss: 0.5018, test_loss: 0.9182, test_f1: 0.6430
 epoch: 56, train_loss: 0.4984, test_loss: 0.9432, test_f1: 0.6423
 epoch: 57, train_loss: 0.4874, test_loss: 0.8909, test_f1: 0.6481
 epoch: 58, train_loss: 0.4802, test_loss: 0.9162, test_f1: 0.6477
 epoch: 59, train_loss: 0.4739, test_loss: 0.9266, test_f1: 0.6404
 epoch: 60, train_loss: 0.4820, test_loss: 0.9181, test_f1: 0.6432
 epoch: 61, train_loss: 0.4762, test_loss: 0.9185, test_f1: 0.6699
 epoch: 62, train_loss: 0.4750, test_loss: 0.9277, test_f1: 0.6614
 epoch: 63, train_loss: 0.4755, test_loss: 0.9479, test_f1: 0.6508
 epoch: 64, train_loss: 0.4620, test_loss: 0.9538, test_f1: 0.6409
 epoch: 65, train_loss: 0.4571, test_loss: 0.9484, test_f1: 0.6562
 epoch: 66, train_loss: 0.4493, test_loss: 1.0061, test_f1: 0.6330
 epoch: 67, train_loss: 0.4603, test_loss: 0.9714, test_f1: 0.6396
 epoch: 68, train_loss: 0.4559, test_loss: 0.9824, test_f1: 0.6382
 epoch: 69, train_loss: 0.4513, test_loss: 0.9563, test_f1: 0.6717
 epoch: 70, train_loss: 0.4399, test_loss: 0.9791, test_f1: 0.6524
 epoch: 71, train_loss: 0.4392, test_loss: 1.0023, test_f1: 0.6327
 epoch: 72, train_loss: 0.4521, test_loss: 1.0497, test_f1: 0.6421
 epoch: 73, train_loss: 0.4349, test_loss: 1.0001, test_f1: 0.6579
 epoch: 74, train_loss: 0.4360, test_loss: 1.0123, test_f1: 0.6630
 epoch: 75, train_loss: 0.4216, test_loss: 1.0097, test_f1: 0.6416
 epoch: 76, train_loss: 0.4197, test_loss: 1.0423, test_f1: 0.6407
 epoch: 77, train_loss: 0.4158, test_loss: 1.0638, test_f1: 0.6615
 epoch: 78, train_loss: 0.4383, test_loss: 0.9868, test_f1: 0.6682
 epoch: 79, train_loss: 0.4119, test_loss: 1.0470, test_f1: 0.6500
 epoch: 80, train_loss: 0.4204, test_loss: 0.9980, test_f1: 0.6738
 epoch: 81, train_loss: 0.4135, test_loss: 1.0402, test_f1: 0.6636
 epoch: 82, train_loss: 0.4038, test_loss: 1.0407, test_f1: 0.6490
 epoch: 83, train_loss: 0.4017, test_loss: 1.0361, test_f1: 0.6596
 epoch: 84, train_loss: 0.4105, test_loss: 1.0667, test_f1: 0.6450
 epoch: 85, train_loss: 0.4012, test_loss: 1.0489, test_f1: 0.6754
 epoch: 86, train_loss: 0.4035, test_loss: 1.1188, test_f1: 0.6681
 epoch: 87, train_loss: 0.3998, test_loss: 1.0819, test_f1: 0.6306
 epoch: 88, train_loss: 0.4040, test_loss: 1.0442, test_f1: 0.6578
 epoch: 89, train_loss: 0.3967, test_loss: 1.0196, test_f1: 0.6610
 epoch: 90, train_loss: 0.4021, test_loss: 1.0727, test_f1: 0.6753
 epoch: 91, train_loss: 0.3888, test_loss: 1.0725, test_f1: 0.6648
 epoch: 92, train_loss: 0.3886, test_loss: 1.0941, test_f1: 0.6562
 epoch: 93, train_loss: 0.3749, test_loss: 1.0649, test_f1: 0.6767
 epoch: 94, train_loss: 0.3860, test_loss: 1.0719, test_f1: 0.6667
 epoch: 95, train_loss: 0.3889, test_loss: 1.0763, test_f1: 0.6563
 epoch: 96, train_loss: 0.3707, test_loss: 1.1349, test_f1: 0.6671
 epoch: 97, train_loss: 0.3844, test_loss: 1.1142, test_f1: 0.6866
 epoch: 98, train_loss: 0.3873, test_loss: 1.1570, test_f1: 0.6466
 epoch: 99, train_loss: 0.3683, test_loss: 1.0885, test_f1: 0.6707
##################ITERATION #7 ****************************************
 epoch: 0, train_loss: 1.2166, test_loss: 1.1015, test_f1: 0.4155
 epoch: 1, train_loss: 1.0764, test_loss: 0.9961, test_f1: 0.4504
 epoch: 2, train_loss: 1.0386, test_loss: 0.9634, test_f1: 0.5390
 epoch: 3, train_loss: 0.9995, test_loss: 0.9392, test_f1: 0.5005
 epoch: 4, train_loss: 0.9862, test_loss: 0.9373, test_f1: 0.5096
 epoch: 5, train_loss: 0.9490, test_loss: 0.9301, test_f1: 0.4955
 epoch: 6, train_loss: 0.9291, test_loss: 0.9496, test_f1: 0.5195
 epoch: 7, train_loss: 0.9129, test_loss: 0.9515, test_f1: 0.5250
 epoch: 8, train_loss: 0.9051, test_loss: 0.9315, test_f1: 0.5452
 epoch: 9, train_loss: 0.8861, test_loss: 0.8949, test_f1: 0.5675
 epoch: 10, train_loss: 0.8709, test_loss: 0.9081, test_f1: 0.5534
 epoch: 11, train_loss: 0.8623, test_loss: 0.9114, test_f1: 0.5570
 epoch: 12, train_loss: 0.8542, test_loss: 0.8931, test_f1: 0.5653
 epoch: 13, train_loss: 0.8344, test_loss: 0.9012, test_f1: 0.5577
 epoch: 14, train_loss: 0.8168, test_loss: 0.8943, test_f1: 0.5582
 epoch: 15, train_loss: 0.8160, test_loss: 0.9074, test_f1: 0.5635
 epoch: 16, train_loss: 0.8033, test_loss: 0.9097, test_f1: 0.5633
 epoch: 17, train_loss: 0.8039, test_loss: 0.9122, test_f1: 0.5668
 epoch: 18, train_loss: 0.7837, test_loss: 0.9041, test_f1: 0.5720
 epoch: 19, train_loss: 0.7650, test_loss: 0.8885, test_f1: 0.5885
 epoch: 20, train_loss: 0.7587, test_loss: 0.9314, test_f1: 0.5846
 epoch: 21, train_loss: 0.7452, test_loss: 0.9188, test_f1: 0.5830
 epoch: 22, train_loss: 0.7390, test_loss: 0.9055, test_f1: 0.5811
 epoch: 23, train_loss: 0.7377, test_loss: 0.9000, test_f1: 0.5935
 epoch: 24, train_loss: 0.7278, test_loss: 0.9452, test_f1: 0.5775
 epoch: 25, train_loss: 0.7149, test_loss: 0.9085, test_f1: 0.5905
 epoch: 26, train_loss: 0.7201, test_loss: 0.9272, test_f1: 0.5964
 epoch: 27, train_loss: 0.7019, test_loss: 0.9371, test_f1: 0.5962
 epoch: 28, train_loss: 0.6945, test_loss: 0.9268, test_f1: 0.6144
 epoch: 29, train_loss: 0.6868, test_loss: 0.9462, test_f1: 0.6086
 epoch: 30, train_loss: 0.6713, test_loss: 0.9352, test_f1: 0.5953
 epoch: 31, train_loss: 0.6740, test_loss: 0.9383, test_f1: 0.6164
 epoch: 32, train_loss: 0.6564, test_loss: 0.8863, test_f1: 0.6120
 epoch: 33, train_loss: 0.6563, test_loss: 0.9197, test_f1: 0.6162
 epoch: 34, train_loss: 0.6523, test_loss: 0.9537, test_f1: 0.6156
 epoch: 35, train_loss: 0.6449, test_loss: 0.8557, test_f1: 0.6083
 epoch: 36, train_loss: 0.6344, test_loss: 0.8771, test_f1: 0.6109
 epoch: 37, train_loss: 0.6337, test_loss: 0.9343, test_f1: 0.6055
 epoch: 38, train_loss: 0.6207, test_loss: 0.9525, test_f1: 0.6069
 epoch: 39, train_loss: 0.6103, test_loss: 0.9269, test_f1: 0.6270
 epoch: 40, train_loss: 0.6061, test_loss: 0.9339, test_f1: 0.6151
 epoch: 41, train_loss: 0.6032, test_loss: 0.9590, test_f1: 0.6221
 epoch: 42, train_loss: 0.5966, test_loss: 0.9302, test_f1: 0.6152
 epoch: 43, train_loss: 0.5849, test_loss: 0.9710, test_f1: 0.6042
 epoch: 44, train_loss: 0.5919, test_loss: 0.9389, test_f1: 0.6302
 epoch: 45, train_loss: 0.5606, test_loss: 0.9713, test_f1: 0.6273
 epoch: 46, train_loss: 0.5706, test_loss: 0.9354, test_f1: 0.6181
 epoch: 47, train_loss: 0.5619, test_loss: 0.9433, test_f1: 0.6125
 epoch: 48, train_loss: 0.5424, test_loss: 1.0004, test_f1: 0.6257
 epoch: 49, train_loss: 0.5490, test_loss: 1.0166, test_f1: 0.6264
 epoch: 50, train_loss: 0.5361, test_loss: 1.0368, test_f1: 0.6103
 epoch: 51, train_loss: 0.5264, test_loss: 1.0080, test_f1: 0.6270
 epoch: 52, train_loss: 0.5304, test_loss: 0.9879, test_f1: 0.6159
 epoch: 53, train_loss: 0.5174, test_loss: 1.0187, test_f1: 0.6198
 epoch: 54, train_loss: 0.5047, test_loss: 0.9846, test_f1: 0.6245
 epoch: 55, train_loss: 0.5020, test_loss: 1.0380, test_f1: 0.6353
 epoch: 56, train_loss: 0.4963, test_loss: 1.0085, test_f1: 0.6241
 epoch: 57, train_loss: 0.4948, test_loss: 1.0107, test_f1: 0.6158
 epoch: 58, train_loss: 0.4862, test_loss: 1.0397, test_f1: 0.6277
 epoch: 59, train_loss: 0.4906, test_loss: 1.0369, test_f1: 0.6407
 epoch: 60, train_loss: 0.4705, test_loss: 1.0500, test_f1: 0.6389
 epoch: 61, train_loss: 0.4787, test_loss: 1.0213, test_f1: 0.6398
 epoch: 62, train_loss: 0.4844, test_loss: 1.0868, test_f1: 0.6170
 epoch: 63, train_loss: 0.4836, test_loss: 1.0445, test_f1: 0.6205
 epoch: 64, train_loss: 0.4852, test_loss: 1.0457, test_f1: 0.6136
 epoch: 65, train_loss: 0.4765, test_loss: 1.0883, test_f1: 0.6464
 epoch: 66, train_loss: 0.4628, test_loss: 1.0833, test_f1: 0.6284
 epoch: 67, train_loss: 0.4604, test_loss: 1.1173, test_f1: 0.6227
 epoch: 68, train_loss: 0.4497, test_loss: 1.0827, test_f1: 0.6327
 epoch: 69, train_loss: 0.4419, test_loss: 1.0879, test_f1: 0.6394
 epoch: 70, train_loss: 0.4468, test_loss: 1.1128, test_f1: 0.6330
 epoch: 71, train_loss: 0.4501, test_loss: 1.1306, test_f1: 0.6296
 epoch: 72, train_loss: 0.4676, test_loss: 1.1698, test_f1: 0.6433
 epoch: 73, train_loss: 0.4418, test_loss: 1.1577, test_f1: 0.6291
 epoch: 74, train_loss: 0.4285, test_loss: 1.1806, test_f1: 0.6442
 epoch: 75, train_loss: 0.4539, test_loss: 1.1409, test_f1: 0.6340
 epoch: 76, train_loss: 0.4290, test_loss: 1.2229, test_f1: 0.6435
 epoch: 77, train_loss: 0.4362, test_loss: 1.1878, test_f1: 0.6404
 epoch: 78, train_loss: 0.4195, test_loss: 1.1853, test_f1: 0.6562
 epoch: 79, train_loss: 0.4208, test_loss: 1.2120, test_f1: 0.6504
 epoch: 80, train_loss: 0.4261, test_loss: 1.1795, test_f1: 0.6524
 epoch: 81, train_loss: 0.4203, test_loss: 1.1904, test_f1: 0.6409
 epoch: 82, train_loss: 0.4135, test_loss: 1.1509, test_f1: 0.6536
 epoch: 83, train_loss: 0.4108, test_loss: 1.1783, test_f1: 0.6401
 epoch: 84, train_loss: 0.4167, test_loss: 1.1897, test_f1: 0.6463
 epoch: 85, train_loss: 0.4197, test_loss: 1.1904, test_f1: 0.6494
 epoch: 86, train_loss: 0.4231, test_loss: 1.1714, test_f1: 0.6551
 epoch: 87, train_loss: 0.4205, test_loss: 1.1629, test_f1: 0.6360
 epoch: 88, train_loss: 0.4052, test_loss: 1.2365, test_f1: 0.6576
 epoch: 89, train_loss: 0.4061, test_loss: 1.1877, test_f1: 0.6510
 epoch: 90, train_loss: 0.4020, test_loss: 1.2476, test_f1: 0.6442
 epoch: 91, train_loss: 0.4024, test_loss: 1.1771, test_f1: 0.6546
 epoch: 92, train_loss: 0.3876, test_loss: 1.2469, test_f1: 0.6500
 epoch: 93, train_loss: 0.4005, test_loss: 1.2456, test_f1: 0.6489
 epoch: 94, train_loss: 0.3861, test_loss: 1.2408, test_f1: 0.6428
 epoch: 95, train_loss: 0.4021, test_loss: 1.2712, test_f1: 0.6593
 epoch: 96, train_loss: 0.3800, test_loss: 1.2719, test_f1: 0.6670
 epoch: 97, train_loss: 0.3912, test_loss: 1.2223, test_f1: 0.6580
 epoch: 98, train_loss: 0.3768, test_loss: 1.2557, test_f1: 0.6571
 epoch: 99, train_loss: 0.3799, test_loss: 1.3265, test_f1: 0.6588
##################ITERATION #8 ****************************************
 epoch: 0, train_loss: 1.2216, test_loss: 1.1301, test_f1: 0.3606
 epoch: 1, train_loss: 1.0754, test_loss: 0.9790, test_f1: 0.5037
 epoch: 2, train_loss: 1.0407, test_loss: 0.9748, test_f1: 0.4954
 epoch: 3, train_loss: 1.0174, test_loss: 0.9472, test_f1: 0.5017
 epoch: 4, train_loss: 0.9838, test_loss: 0.9463, test_f1: 0.4890
 epoch: 5, train_loss: 0.9718, test_loss: 0.9251, test_f1: 0.5132
 epoch: 6, train_loss: 0.9416, test_loss: 0.9116, test_f1: 0.5243
 epoch: 7, train_loss: 0.9174, test_loss: 0.9244, test_f1: 0.5247
 epoch: 8, train_loss: 0.9132, test_loss: 0.9037, test_f1: 0.5418
 epoch: 9, train_loss: 0.9028, test_loss: 0.9074, test_f1: 0.5445
 epoch: 10, train_loss: 0.8850, test_loss: 0.9026, test_f1: 0.5471
 epoch: 11, train_loss: 0.8710, test_loss: 0.9085, test_f1: 0.5445
 epoch: 12, train_loss: 0.8684, test_loss: 0.9283, test_f1: 0.5350
 epoch: 13, train_loss: 0.8558, test_loss: 0.9253, test_f1: 0.5442
 epoch: 14, train_loss: 0.8457, test_loss: 0.8801, test_f1: 0.5451
 epoch: 15, train_loss: 0.8247, test_loss: 0.8930, test_f1: 0.5644
 epoch: 16, train_loss: 0.8132, test_loss: 0.8857, test_f1: 0.5790
 epoch: 17, train_loss: 0.8087, test_loss: 0.9141, test_f1: 0.5523
 epoch: 18, train_loss: 0.7895, test_loss: 0.8568, test_f1: 0.5702
 epoch: 19, train_loss: 0.7934, test_loss: 0.8414, test_f1: 0.5865
 epoch: 20, train_loss: 0.7818, test_loss: 0.8712, test_f1: 0.5816
 epoch: 21, train_loss: 0.7767, test_loss: 0.8347, test_f1: 0.5746
 epoch: 22, train_loss: 0.7498, test_loss: 0.8966, test_f1: 0.5818
 epoch: 23, train_loss: 0.7522, test_loss: 0.8807, test_f1: 0.5749
 epoch: 24, train_loss: 0.7407, test_loss: 0.8525, test_f1: 0.6075
 epoch: 25, train_loss: 0.7359, test_loss: 0.8774, test_f1: 0.5845
 epoch: 26, train_loss: 0.7258, test_loss: 0.8437, test_f1: 0.6097
 epoch: 27, train_loss: 0.7170, test_loss: 0.8089, test_f1: 0.6274
 epoch: 28, train_loss: 0.7120, test_loss: 0.8580, test_f1: 0.6013
 epoch: 29, train_loss: 0.7092, test_loss: 0.8505, test_f1: 0.6176
 epoch: 30, train_loss: 0.6911, test_loss: 0.8679, test_f1: 0.5987
 epoch: 31, train_loss: 0.6952, test_loss: 0.8329, test_f1: 0.6176
 epoch: 32, train_loss: 0.6952, test_loss: 0.8422, test_f1: 0.6165
 epoch: 33, train_loss: 0.6710, test_loss: 0.8577, test_f1: 0.5931
 epoch: 34, train_loss: 0.6672, test_loss: 0.8719, test_f1: 0.6189
 epoch: 35, train_loss: 0.6728, test_loss: 0.8558, test_f1: 0.6120
 epoch: 36, train_loss: 0.6649, test_loss: 0.9092, test_f1: 0.6005
 epoch: 37, train_loss: 0.6444, test_loss: 0.8403, test_f1: 0.6324
 epoch: 38, train_loss: 0.6461, test_loss: 0.8782, test_f1: 0.6094
 epoch: 39, train_loss: 0.6390, test_loss: 0.8161, test_f1: 0.6232
 epoch: 40, train_loss: 0.6282, test_loss: 0.8400, test_f1: 0.6097
 epoch: 41, train_loss: 0.6252, test_loss: 0.8334, test_f1: 0.6133
 epoch: 42, train_loss: 0.6271, test_loss: 0.8483, test_f1: 0.6182
 epoch: 43, train_loss: 0.6186, test_loss: 0.8699, test_f1: 0.6042
 epoch: 44, train_loss: 0.6047, test_loss: 0.8231, test_f1: 0.6089
 epoch: 45, train_loss: 0.6050, test_loss: 0.8532, test_f1: 0.6154
 epoch: 46, train_loss: 0.5942, test_loss: 0.9516, test_f1: 0.6045
 epoch: 47, train_loss: 0.5941, test_loss: 0.9203, test_f1: 0.6189
 epoch: 48, train_loss: 0.5866, test_loss: 0.9090, test_f1: 0.6096
 epoch: 49, train_loss: 0.5882, test_loss: 0.8887, test_f1: 0.6131
 epoch: 50, train_loss: 0.5749, test_loss: 0.9428, test_f1: 0.5842
 epoch: 51, train_loss: 0.5743, test_loss: 0.9052, test_f1: 0.6053
 epoch: 52, train_loss: 0.5536, test_loss: 0.8730, test_f1: 0.6161
 epoch: 53, train_loss: 0.5365, test_loss: 0.8829, test_f1: 0.6212
 epoch: 54, train_loss: 0.5329, test_loss: 0.8823, test_f1: 0.6270
 epoch: 55, train_loss: 0.5434, test_loss: 0.9068, test_f1: 0.6145
 epoch: 56, train_loss: 0.5425, test_loss: 0.9426, test_f1: 0.5980
 epoch: 57, train_loss: 0.5267, test_loss: 0.8984, test_f1: 0.6281
 epoch: 58, train_loss: 0.5166, test_loss: 0.9740, test_f1: 0.6097
 epoch: 59, train_loss: 0.5085, test_loss: 0.9500, test_f1: 0.6218
 epoch: 60, train_loss: 0.5176, test_loss: 0.9870, test_f1: 0.6046
 epoch: 61, train_loss: 0.5079, test_loss: 0.9972, test_f1: 0.6013
 epoch: 62, train_loss: 0.5123, test_loss: 0.9394, test_f1: 0.6313
 epoch: 63, train_loss: 0.5046, test_loss: 0.9485, test_f1: 0.6243
 epoch: 64, train_loss: 0.5085, test_loss: 0.9354, test_f1: 0.6262
 epoch: 65, train_loss: 0.4928, test_loss: 0.9870, test_f1: 0.6007
 epoch: 66, train_loss: 0.4960, test_loss: 0.9609, test_f1: 0.6258
 epoch: 67, train_loss: 0.4811, test_loss: 0.9515, test_f1: 0.6239
 epoch: 68, train_loss: 0.4735, test_loss: 0.9583, test_f1: 0.6211
 epoch: 69, train_loss: 0.4844, test_loss: 0.9657, test_f1: 0.6355
 epoch: 70, train_loss: 0.4697, test_loss: 1.0009, test_f1: 0.6232
 epoch: 71, train_loss: 0.4850, test_loss: 0.9410, test_f1: 0.6484
 epoch: 72, train_loss: 0.4838, test_loss: 0.9141, test_f1: 0.6297
 epoch: 73, train_loss: 0.4725, test_loss: 0.9236, test_f1: 0.6429
 epoch: 74, train_loss: 0.4790, test_loss: 0.9647, test_f1: 0.6289
 epoch: 75, train_loss: 0.4741, test_loss: 0.9559, test_f1: 0.6150
 epoch: 76, train_loss: 0.4606, test_loss: 0.9997, test_f1: 0.6365
 epoch: 77, train_loss: 0.4631, test_loss: 1.0149, test_f1: 0.6291
 epoch: 78, train_loss: 0.4514, test_loss: 1.0042, test_f1: 0.6207
 epoch: 79, train_loss: 0.4607, test_loss: 0.9087, test_f1: 0.6545
 epoch: 80, train_loss: 0.4580, test_loss: 0.9527, test_f1: 0.6497
 epoch: 81, train_loss: 0.4526, test_loss: 0.9892, test_f1: 0.6186
 epoch: 82, train_loss: 0.4515, test_loss: 1.0616, test_f1: 0.6043
 epoch: 83, train_loss: 0.4566, test_loss: 0.9716, test_f1: 0.6269
 epoch: 84, train_loss: 0.4374, test_loss: 1.0365, test_f1: 0.6401
 epoch: 85, train_loss: 0.4320, test_loss: 0.9854, test_f1: 0.6257
 epoch: 86, train_loss: 0.4369, test_loss: 0.9817, test_f1: 0.6280
 epoch: 87, train_loss: 0.4264, test_loss: 1.0978, test_f1: 0.6277
 epoch: 88, train_loss: 0.4172, test_loss: 1.0356, test_f1: 0.6248
 epoch: 89, train_loss: 0.4373, test_loss: 1.0199, test_f1: 0.6306
 epoch: 90, train_loss: 0.4255, test_loss: 1.0440, test_f1: 0.6242
 epoch: 91, train_loss: 0.4212, test_loss: 1.0204, test_f1: 0.6317
 epoch: 92, train_loss: 0.4298, test_loss: 1.0338, test_f1: 0.6305
 epoch: 93, train_loss: 0.4059, test_loss: 1.1588, test_f1: 0.6337
 epoch: 94, train_loss: 0.4159, test_loss: 0.9359, test_f1: 0.6211
 epoch: 95, train_loss: 0.4064, test_loss: 1.0047, test_f1: 0.6144
 epoch: 96, train_loss: 0.4112, test_loss: 1.0891, test_f1: 0.6082
 epoch: 97, train_loss: 0.4119, test_loss: 1.1335, test_f1: 0.6196
 epoch: 98, train_loss: 0.3951, test_loss: 1.0698, test_f1: 0.6104
 epoch: 99, train_loss: 0.4020, test_loss: 1.0924, test_f1: 0.6286
##################ITERATION #9 ****************************************
 epoch: 0, train_loss: 1.2061, test_loss: 1.1149, test_f1: 0.3826
 epoch: 1, train_loss: 1.0307, test_loss: 0.9911, test_f1: 0.5144
 epoch: 2, train_loss: 0.9987, test_loss: 0.9778, test_f1: 0.5254
 epoch: 3, train_loss: 0.9714, test_loss: 0.9901, test_f1: 0.5393
 epoch: 4, train_loss: 0.9402, test_loss: 0.9682, test_f1: 0.5345
 epoch: 5, train_loss: 0.9210, test_loss: 0.9529, test_f1: 0.5507
 epoch: 6, train_loss: 0.9082, test_loss: 0.9375, test_f1: 0.5736
 epoch: 7, train_loss: 0.9010, test_loss: 0.9178, test_f1: 0.5814
 epoch: 8, train_loss: 0.8734, test_loss: 0.9424, test_f1: 0.5639
 epoch: 9, train_loss: 0.8610, test_loss: 0.9247, test_f1: 0.5635
 epoch: 10, train_loss: 0.8501, test_loss: 0.9282, test_f1: 0.5792
 epoch: 11, train_loss: 0.8194, test_loss: 0.9281, test_f1: 0.5648
 epoch: 12, train_loss: 0.8121, test_loss: 0.9238, test_f1: 0.5989
 epoch: 13, train_loss: 0.8044, test_loss: 0.9217, test_f1: 0.5708
 epoch: 14, train_loss: 0.8007, test_loss: 0.9169, test_f1: 0.5719
 epoch: 15, train_loss: 0.7844, test_loss: 0.9098, test_f1: 0.5566
 epoch: 16, train_loss: 0.7665, test_loss: 0.8822, test_f1: 0.6107
 epoch: 17, train_loss: 0.7569, test_loss: 0.8960, test_f1: 0.5852
 epoch: 18, train_loss: 0.7595, test_loss: 0.9198, test_f1: 0.5770
 epoch: 19, train_loss: 0.7367, test_loss: 0.8938, test_f1: 0.6045
 epoch: 20, train_loss: 0.7289, test_loss: 0.8839, test_f1: 0.6051
 epoch: 21, train_loss: 0.7220, test_loss: 0.9130, test_f1: 0.5980
 epoch: 22, train_loss: 0.7065, test_loss: 0.8706, test_f1: 0.6144
 epoch: 23, train_loss: 0.6966, test_loss: 0.8803, test_f1: 0.6065
 epoch: 24, train_loss: 0.7006, test_loss: 0.8910, test_f1: 0.6277
 epoch: 25, train_loss: 0.6865, test_loss: 0.8576, test_f1: 0.6207
 epoch: 26, train_loss: 0.6738, test_loss: 0.8760, test_f1: 0.6106
 epoch: 27, train_loss: 0.6770, test_loss: 0.8575, test_f1: 0.6279
 epoch: 28, train_loss: 0.6399, test_loss: 0.8486, test_f1: 0.6182
 epoch: 29, train_loss: 0.6517, test_loss: 0.8735, test_f1: 0.6165
 epoch: 30, train_loss: 0.6378, test_loss: 0.8703, test_f1: 0.6220
 epoch: 31, train_loss: 0.6435, test_loss: 0.8757, test_f1: 0.6207
 epoch: 32, train_loss: 0.6276, test_loss: 0.8716, test_f1: 0.6288
 epoch: 33, train_loss: 0.6214, test_loss: 0.8639, test_f1: 0.6271
 epoch: 34, train_loss: 0.6039, test_loss: 0.9157, test_f1: 0.6235
 epoch: 35, train_loss: 0.6174, test_loss: 0.8539, test_f1: 0.6470
 epoch: 36, train_loss: 0.5965, test_loss: 0.8935, test_f1: 0.6011
 epoch: 37, train_loss: 0.5954, test_loss: 0.8433, test_f1: 0.6351
 epoch: 38, train_loss: 0.5868, test_loss: 0.8209, test_f1: 0.6563
 epoch: 39, train_loss: 0.5892, test_loss: 0.8584, test_f1: 0.6230
 epoch: 40, train_loss: 0.5638, test_loss: 0.8467, test_f1: 0.6477
 epoch: 41, train_loss: 0.5680, test_loss: 0.8188, test_f1: 0.6325
 epoch: 42, train_loss: 0.5606, test_loss: 0.8850, test_f1: 0.6228
 epoch: 43, train_loss: 0.5530, test_loss: 0.8296, test_f1: 0.6596
 epoch: 44, train_loss: 0.5492, test_loss: 0.8552, test_f1: 0.6446
 epoch: 45, train_loss: 0.5282, test_loss: 0.8500, test_f1: 0.6411
 epoch: 46, train_loss: 0.5313, test_loss: 0.9149, test_f1: 0.6056
 epoch: 47, train_loss: 0.5361, test_loss: 0.8464, test_f1: 0.6334
 epoch: 48, train_loss: 0.5267, test_loss: 0.8526, test_f1: 0.6451
 epoch: 49, train_loss: 0.5199, test_loss: 0.8804, test_f1: 0.6318
 epoch: 50, train_loss: 0.5041, test_loss: 0.8825, test_f1: 0.6415
 epoch: 51, train_loss: 0.4873, test_loss: 0.8781, test_f1: 0.6228
 epoch: 52, train_loss: 0.4711, test_loss: 0.8700, test_f1: 0.6419
 epoch: 53, train_loss: 0.4750, test_loss: 0.8651, test_f1: 0.6512
 epoch: 54, train_loss: 0.4613, test_loss: 0.9044, test_f1: 0.6234
 epoch: 55, train_loss: 0.4696, test_loss: 0.8475, test_f1: 0.6520
 epoch: 56, train_loss: 0.4587, test_loss: 0.9061, test_f1: 0.6433
 epoch: 57, train_loss: 0.4449, test_loss: 0.9237, test_f1: 0.6376
 epoch: 58, train_loss: 0.4523, test_loss: 0.8662, test_f1: 0.6574
 epoch: 59, train_loss: 0.4508, test_loss: 0.8915, test_f1: 0.6534
 epoch: 60, train_loss: 0.4378, test_loss: 0.9146, test_f1: 0.6379
 epoch: 61, train_loss: 0.4422, test_loss: 0.9021, test_f1: 0.6380
 epoch: 62, train_loss: 0.4449, test_loss: 0.8564, test_f1: 0.6423
 epoch: 63, train_loss: 0.4343, test_loss: 0.8682, test_f1: 0.6706
 epoch: 64, train_loss: 0.4301, test_loss: 0.8804, test_f1: 0.6594
 epoch: 65, train_loss: 0.4200, test_loss: 0.9576, test_f1: 0.6273
 epoch: 66, train_loss: 0.4268, test_loss: 0.9284, test_f1: 0.6480
 epoch: 67, train_loss: 0.4272, test_loss: 0.9332, test_f1: 0.6505
 epoch: 68, train_loss: 0.4111, test_loss: 0.8874, test_f1: 0.6551
 epoch: 69, train_loss: 0.4026, test_loss: 0.9061, test_f1: 0.6487
 epoch: 70, train_loss: 0.3970, test_loss: 0.9566, test_f1: 0.6478
 epoch: 71, train_loss: 0.4113, test_loss: 0.9287, test_f1: 0.6712
 epoch: 72, train_loss: 0.3925, test_loss: 0.9144, test_f1: 0.6638
 epoch: 73, train_loss: 0.3868, test_loss: 0.9009, test_f1: 0.6773
 epoch: 74, train_loss: 0.3875, test_loss: 0.9543, test_f1: 0.6500
 epoch: 75, train_loss: 0.4025, test_loss: 0.9907, test_f1: 0.6398
 epoch: 76, train_loss: 0.3958, test_loss: 1.0331, test_f1: 0.6381
 epoch: 77, train_loss: 0.3965, test_loss: 0.9854, test_f1: 0.6362
 epoch: 78, train_loss: 0.3764, test_loss: 0.9282, test_f1: 0.6570
 epoch: 79, train_loss: 0.3680, test_loss: 0.9269, test_f1: 0.6690
 epoch: 80, train_loss: 0.3744, test_loss: 0.9453, test_f1: 0.6533
 epoch: 81, train_loss: 0.3623, test_loss: 1.0025, test_f1: 0.6536
 epoch: 82, train_loss: 0.3762, test_loss: 1.0024, test_f1: 0.6592
 epoch: 83, train_loss: 0.3629, test_loss: 1.0459, test_f1: 0.6690
 epoch: 84, train_loss: 0.3647, test_loss: 1.0251, test_f1: 0.6608
 epoch: 85, train_loss: 0.3476, test_loss: 1.0197, test_f1: 0.6568
 epoch: 86, train_loss: 0.3552, test_loss: 1.0649, test_f1: 0.6564
 epoch: 87, train_loss: 0.3601, test_loss: 1.0011, test_f1: 0.6692
 epoch: 88, train_loss: 0.3696, test_loss: 1.0692, test_f1: 0.6601
 epoch: 89, train_loss: 0.3581, test_loss: 1.0749, test_f1: 0.6641
 epoch: 90, train_loss: 0.3538, test_loss: 1.0763, test_f1: 0.6472
 epoch: 91, train_loss: 0.3391, test_loss: 1.0838, test_f1: 0.6510
 epoch: 92, train_loss: 0.3397, test_loss: 1.0658, test_f1: 0.6517
 epoch: 93, train_loss: 0.3330, test_loss: 1.1080, test_f1: 0.6453
 epoch: 94, train_loss: 0.3446, test_loss: 1.0455, test_f1: 0.6532
 epoch: 95, train_loss: 0.3387, test_loss: 1.0591, test_f1: 0.6480
 epoch: 96, train_loss: 0.3352, test_loss: 1.0363, test_f1: 0.6572
 epoch: 97, train_loss: 0.3277, test_loss: 1.1345, test_f1: 0.6532
 epoch: 98, train_loss: 0.3156, test_loss: 1.0745, test_f1: 0.6521
 epoch: 99, train_loss: 0.3227, test_loss: 1.0686, test_f1: 0.6662

Training completed in 896.71 seconds
Best F1: 0.6866 at epoch 97
Mean F1 across iterations: 0.6652  0.0124
========================FINAL RESULTS================================
FEGIN weighted F1: 0.6866  0.0124
python main.py --data ltspice_examples --representation component_pin --model FEGIN --layers 6 --hiddens 128 --batch_size 64 --lr 0.0001 --emb_size 512 --epochs 100 --save_appendix component_pin_L6_H128_BS64_LR0.0001_E512 --no_val
-----



STDERR:
  File "main.py", line 370, in <module>
    main()
  File "main.py", line 254, in main
    dataset = dataset_class(
  File "/home/philip/projects/ltspice_examples_code_repo/Circuit-Completion-Using-GNNs/component_classification_with_link_prediction_head/evaluation/FEGIN/kernel/circuit_datasets.py", line 15, in __init__
    self.data, self.slices = torch.load(self.processed_paths[0])
  File "/home/philip/.local/lib/python3.8/site-packages/torch/serialization.py", line 1040, in load
    warnings.warn(
  File "/usr/lib/python3.8/warnings.py", line 109, in _showwarnmsg
    sw(msg.message, msg.category, msg.filename, msg.lineno,
  File "main.py", line 47, in warn_with_traceback
    traceback.print_stack(file=log)
/home/philip/projects/ltspice_examples_code_repo/Circuit-Completion-Using-GNNs/component_classification_with_link_prediction_head/evaluation/FEGIN/kernel/circuit_datasets.py:15: FutureWarning: You are using `torch.load` with `weights_only=False` (the current default value), which uses the default pickle module implicitly. It is possible to construct malicious pickle data which will execute arbitrary code during unpickling (See https://github.com/pytorch/pytorch/blob/main/SECURITY.md#untrusted-models for more details). In a future release, the default value for `weights_only` will be flipped to `True`. This limits the functions that could be executed during unpickling. Arbitrary objects will no longer be allowed to be loaded via this mode unless they are explicitly allowlisted by the user via `torch.serialization.add_safe_globals`. We recommend you start setting `weights_only=True` for any use case where you don't have full control of the loaded file. Please open an issue on GitHub for any issues related to this experimental feature.
  self.data, self.slices = torch.load(self.processed_paths[0])
