STDOUT:
Results will be saved in /home/philip/projects/ltspice_examples_code_repo/Circuit-Completion-Using-GNNs/component_classification_with_link_prediction_head/evaluation/FEGIN/results/model_FEGIN_dataset_ltspice_examples
Command line input: python main.py --data ltspice_examples --representation component_pin --model FEGIN --layers 6 --hiddens 64 --batch_size 64 --lr 0.01 --emb_size 250 --epochs 100 --save_appendix component_pin_L6_H64_BS64_LR0.01_E250 --no_val
 is saved.
-----
ltspice_examples - FEGIN
Using 6 layers, 64 hidden units, h = 2
Loading component_pin representation dataset
ENTERED
Training FEGIN on component_pin representation
Train: 3560, Test: 848
##################ITERATION #0 ****************************************
 epoch: 0, train_loss: 1.1844, test_loss: 1.1369, test_f1: 0.3767
 epoch: 1, train_loss: 1.0349, test_loss: 1.1004, test_f1: 0.4318
 epoch: 2, train_loss: 0.9815, test_loss: 0.9734, test_f1: 0.4624
 epoch: 3, train_loss: 0.9596, test_loss: 0.9121, test_f1: 0.5406
 epoch: 4, train_loss: 0.9329, test_loss: 1.0201, test_f1: 0.4569
 epoch: 5, train_loss: 0.9086, test_loss: 1.0462, test_f1: 0.4831
 epoch: 6, train_loss: 0.9149, test_loss: 0.9590, test_f1: 0.4937
 epoch: 7, train_loss: 0.8893, test_loss: 0.9828, test_f1: 0.5647
 epoch: 8, train_loss: 0.8865, test_loss: 0.9157, test_f1: 0.5009
 epoch: 9, train_loss: 0.8671, test_loss: 0.9089, test_f1: 0.5425
 epoch: 10, train_loss: 0.8433, test_loss: 0.9572, test_f1: 0.4759
 epoch: 11, train_loss: 0.8578, test_loss: 1.1315, test_f1: 0.4599
 epoch: 12, train_loss: 0.8443, test_loss: 0.9184, test_f1: 0.5528
 epoch: 13, train_loss: 0.8079, test_loss: 0.8594, test_f1: 0.5213
 epoch: 14, train_loss: 0.7887, test_loss: 0.9205, test_f1: 0.5899
 epoch: 15, train_loss: 0.7897, test_loss: 0.9052, test_f1: 0.5470
 epoch: 16, train_loss: 0.7901, test_loss: 0.9456, test_f1: 0.5274
 epoch: 17, train_loss: 0.7777, test_loss: 0.8300, test_f1: 0.5592
 epoch: 18, train_loss: 0.7726, test_loss: 1.0243, test_f1: 0.4881
 epoch: 19, train_loss: 0.7566, test_loss: 0.8566, test_f1: 0.5459
 epoch: 20, train_loss: 0.7610, test_loss: 0.8897, test_f1: 0.5348
 epoch: 21, train_loss: 0.7573, test_loss: 0.8918, test_f1: 0.5828
 epoch: 22, train_loss: 0.7487, test_loss: 0.8328, test_f1: 0.6179
 epoch: 23, train_loss: 0.7395, test_loss: 0.8986, test_f1: 0.5563
 epoch: 24, train_loss: 0.7386, test_loss: 0.8087, test_f1: 0.6255
 epoch: 25, train_loss: 0.7260, test_loss: 0.8242, test_f1: 0.6619
 epoch: 26, train_loss: 0.7035, test_loss: 0.9266, test_f1: 0.5462
 epoch: 27, train_loss: 0.7180, test_loss: 0.9432, test_f1: 0.5641
 epoch: 28, train_loss: 0.7340, test_loss: 0.8303, test_f1: 0.6248
 epoch: 29, train_loss: 0.7143, test_loss: 0.8371, test_f1: 0.6074
 epoch: 30, train_loss: 0.6982, test_loss: 0.8390, test_f1: 0.6334
 epoch: 31, train_loss: 0.7000, test_loss: 0.8631, test_f1: 0.5693
 epoch: 32, train_loss: 0.6973, test_loss: 0.8379, test_f1: 0.5902
 epoch: 33, train_loss: 0.6777, test_loss: 1.2767, test_f1: 0.4575
 epoch: 34, train_loss: 0.6807, test_loss: 0.8686, test_f1: 0.5844
 epoch: 35, train_loss: 0.6722, test_loss: 0.9179, test_f1: 0.5733
 epoch: 36, train_loss: 0.6735, test_loss: 1.0827, test_f1: 0.5845
 epoch: 37, train_loss: 0.6933, test_loss: 0.9471, test_f1: 0.5033
 epoch: 38, train_loss: 0.6398, test_loss: 0.8663, test_f1: 0.6004
 epoch: 39, train_loss: 0.7037, test_loss: 1.0255, test_f1: 0.5919
 epoch: 40, train_loss: 0.6925, test_loss: 0.8395, test_f1: 0.6134
 epoch: 41, train_loss: 0.6447, test_loss: 1.0039, test_f1: 0.5839
 epoch: 42, train_loss: 0.6578, test_loss: 0.8489, test_f1: 0.6324
 epoch: 43, train_loss: 0.6487, test_loss: 0.8948, test_f1: 0.6548
 epoch: 44, train_loss: 0.6401, test_loss: 0.8373, test_f1: 0.6067
 epoch: 45, train_loss: 0.6331, test_loss: 1.1095, test_f1: 0.5840
 epoch: 46, train_loss: 0.6189, test_loss: 0.8534, test_f1: 0.6035
 epoch: 47, train_loss: 0.6197, test_loss: 0.8463, test_f1: 0.6074
 epoch: 48, train_loss: 0.6225, test_loss: 0.7657, test_f1: 0.6100
 epoch: 49, train_loss: 0.5960, test_loss: 1.0382, test_f1: 0.5593
 epoch: 50, train_loss: 0.6246, test_loss: 0.8540, test_f1: 0.6312
 epoch: 51, train_loss: 0.5687, test_loss: 0.9557, test_f1: 0.6475
 epoch: 52, train_loss: 0.5598, test_loss: 0.9789, test_f1: 0.6277
 epoch: 53, train_loss: 0.5304, test_loss: 1.0598, test_f1: 0.6424
 epoch: 54, train_loss: 0.5350, test_loss: 0.9514, test_f1: 0.6459
 epoch: 55, train_loss: 0.5261, test_loss: 0.9233, test_f1: 0.6430
 epoch: 56, train_loss: 0.5192, test_loss: 0.9644, test_f1: 0.6433
 epoch: 57, train_loss: 0.5343, test_loss: 0.9776, test_f1: 0.6683
 epoch: 58, train_loss: 0.5194, test_loss: 0.9276, test_f1: 0.6357
 epoch: 59, train_loss: 0.5180, test_loss: 1.0258, test_f1: 0.6234
 epoch: 60, train_loss: 0.5176, test_loss: 0.9835, test_f1: 0.6256
 epoch: 61, train_loss: 0.5128, test_loss: 0.9404, test_f1: 0.6669
 epoch: 62, train_loss: 0.4908, test_loss: 1.0016, test_f1: 0.6430
 epoch: 63, train_loss: 0.4983, test_loss: 0.9597, test_f1: 0.6476
 epoch: 64, train_loss: 0.5079, test_loss: 1.0073, test_f1: 0.6265
 epoch: 65, train_loss: 0.5003, test_loss: 1.0383, test_f1: 0.6603
 epoch: 66, train_loss: 0.4933, test_loss: 0.9915, test_f1: 0.6565
 epoch: 67, train_loss: 0.4911, test_loss: 0.9875, test_f1: 0.6554
 epoch: 68, train_loss: 0.4940, test_loss: 0.9300, test_f1: 0.6851
 epoch: 69, train_loss: 0.4828, test_loss: 0.9614, test_f1: 0.6751
 epoch: 70, train_loss: 0.4617, test_loss: 1.0811, test_f1: 0.6774
 epoch: 71, train_loss: 0.4884, test_loss: 1.0468, test_f1: 0.6409
 epoch: 72, train_loss: 0.4744, test_loss: 1.1169, test_f1: 0.6779
 epoch: 73, train_loss: 0.4684, test_loss: 1.0209, test_f1: 0.6485
 epoch: 74, train_loss: 0.4561, test_loss: 1.0275, test_f1: 0.6322
 epoch: 75, train_loss: 0.4633, test_loss: 0.9933, test_f1: 0.6713
 epoch: 76, train_loss: 0.4675, test_loss: 0.9666, test_f1: 0.6573
 epoch: 77, train_loss: 0.4402, test_loss: 1.0537, test_f1: 0.6422
 epoch: 78, train_loss: 0.4553, test_loss: 0.8819, test_f1: 0.6563
 epoch: 79, train_loss: 0.4647, test_loss: 1.0661, test_f1: 0.6323
 epoch: 80, train_loss: 0.4414, test_loss: 1.0674, test_f1: 0.6395
 epoch: 81, train_loss: 0.4437, test_loss: 1.0317, test_f1: 0.6488
 epoch: 82, train_loss: 0.4448, test_loss: 1.0021, test_f1: 0.6671
 epoch: 83, train_loss: 0.4327, test_loss: 0.8867, test_f1: 0.6650
 epoch: 84, train_loss: 0.4381, test_loss: 1.0009, test_f1: 0.6716
 epoch: 85, train_loss: 0.4290, test_loss: 0.9747, test_f1: 0.6803
 epoch: 86, train_loss: 0.4256, test_loss: 0.9465, test_f1: 0.6671
 epoch: 87, train_loss: 0.4333, test_loss: 1.1077, test_f1: 0.6691
 epoch: 88, train_loss: 0.4282, test_loss: 0.9423, test_f1: 0.6803
 epoch: 89, train_loss: 0.4177, test_loss: 1.1323, test_f1: 0.6632
 epoch: 90, train_loss: 0.4375, test_loss: 1.1548, test_f1: 0.6445
 epoch: 91, train_loss: 0.4412, test_loss: 0.8714, test_f1: 0.6681
 epoch: 92, train_loss: 0.4179, test_loss: 0.9389, test_f1: 0.6739
 epoch: 93, train_loss: 0.4234, test_loss: 1.0125, test_f1: 0.6814
 epoch: 94, train_loss: 0.4367, test_loss: 0.9994, test_f1: 0.6603
 epoch: 95, train_loss: 0.4201, test_loss: 0.9939, test_f1: 0.6782
 epoch: 96, train_loss: 0.4019, test_loss: 1.1551, test_f1: 0.6601
 epoch: 97, train_loss: 0.4072, test_loss: 1.0530, test_f1: 0.6618
 epoch: 98, train_loss: 0.4018, test_loss: 1.1292, test_f1: 0.6523
 epoch: 99, train_loss: 0.3881, test_loss: 1.0499, test_f1: 0.6522
##################ITERATION #1 ****************************************
 epoch: 0, train_loss: 1.1678, test_loss: 1.2094, test_f1: 0.3692
 epoch: 1, train_loss: 1.0514, test_loss: 1.1192, test_f1: 0.4180
 epoch: 2, train_loss: 0.9951, test_loss: 0.9587, test_f1: 0.4790
 epoch: 3, train_loss: 0.9652, test_loss: 1.0038, test_f1: 0.5134
 epoch: 4, train_loss: 0.9490, test_loss: 0.9474, test_f1: 0.4803
 epoch: 5, train_loss: 0.9169, test_loss: 1.0421, test_f1: 0.5167
 epoch: 6, train_loss: 0.9117, test_loss: 0.9046, test_f1: 0.5007
 epoch: 7, train_loss: 0.8796, test_loss: 0.9338, test_f1: 0.5247
 epoch: 8, train_loss: 0.8554, test_loss: 0.8760, test_f1: 0.5106
 epoch: 9, train_loss: 0.8503, test_loss: 0.9193, test_f1: 0.5226
 epoch: 10, train_loss: 0.8406, test_loss: 0.8784, test_f1: 0.5016
 epoch: 11, train_loss: 0.8543, test_loss: 0.8842, test_f1: 0.5236
 epoch: 12, train_loss: 0.8247, test_loss: 0.8400, test_f1: 0.5342
 epoch: 13, train_loss: 0.8377, test_loss: 0.9043, test_f1: 0.5334
 epoch: 14, train_loss: 0.8108, test_loss: 1.0194, test_f1: 0.4775
 epoch: 15, train_loss: 0.8057, test_loss: 0.9228, test_f1: 0.5315
 epoch: 16, train_loss: 0.7924, test_loss: 0.8402, test_f1: 0.6018
 epoch: 17, train_loss: 0.7947, test_loss: 0.8251, test_f1: 0.5970
 epoch: 18, train_loss: 0.7903, test_loss: 0.8425, test_f1: 0.5318
 epoch: 19, train_loss: 0.7711, test_loss: 0.8788, test_f1: 0.5819
 epoch: 20, train_loss: 0.7537, test_loss: 0.9298, test_f1: 0.5153
 epoch: 21, train_loss: 0.7486, test_loss: 0.8312, test_f1: 0.5691
 epoch: 22, train_loss: 0.7556, test_loss: 0.9017, test_f1: 0.5827
 epoch: 23, train_loss: 0.7441, test_loss: 0.7754, test_f1: 0.5546
 epoch: 24, train_loss: 0.7522, test_loss: 1.0410, test_f1: 0.5220
 epoch: 25, train_loss: 0.7317, test_loss: 0.8824, test_f1: 0.5462
 epoch: 26, train_loss: 0.7238, test_loss: 0.9138, test_f1: 0.5657
 epoch: 27, train_loss: 0.7080, test_loss: 0.8763, test_f1: 0.5963
 epoch: 28, train_loss: 0.7474, test_loss: 0.8891, test_f1: 0.5605
 epoch: 29, train_loss: 0.7328, test_loss: 0.8548, test_f1: 0.5719
 epoch: 30, train_loss: 0.7132, test_loss: 1.0514, test_f1: 0.5624
 epoch: 31, train_loss: 0.7069, test_loss: 0.8088, test_f1: 0.5989
 epoch: 32, train_loss: 0.7090, test_loss: 0.9207, test_f1: 0.5468
 epoch: 33, train_loss: 0.6914, test_loss: 0.9494, test_f1: 0.5879
 epoch: 34, train_loss: 0.6740, test_loss: 0.9520, test_f1: 0.5643
 epoch: 35, train_loss: 0.6818, test_loss: 0.9269, test_f1: 0.5714
 epoch: 36, train_loss: 0.6995, test_loss: 0.9725, test_f1: 0.5628
 epoch: 37, train_loss: 0.6839, test_loss: 0.8786, test_f1: 0.5550
 epoch: 38, train_loss: 0.6762, test_loss: 0.9354, test_f1: 0.5991
 epoch: 39, train_loss: 0.6908, test_loss: 0.7980, test_f1: 0.6196
 epoch: 40, train_loss: 0.6926, test_loss: 0.9139, test_f1: 0.5734
 epoch: 41, train_loss: 0.6643, test_loss: 0.8256, test_f1: 0.6367
 epoch: 42, train_loss: 0.6594, test_loss: 0.9439, test_f1: 0.5868
 epoch: 43, train_loss: 0.6553, test_loss: 0.9453, test_f1: 0.6319
 epoch: 44, train_loss: 0.6285, test_loss: 0.8274, test_f1: 0.6582
 epoch: 45, train_loss: 0.6432, test_loss: 0.8609, test_f1: 0.6579
 epoch: 46, train_loss: 0.6582, test_loss: 0.9655, test_f1: 0.6013
 epoch: 47, train_loss: 0.6316, test_loss: 0.7834, test_f1: 0.6292
 epoch: 48, train_loss: 0.6352, test_loss: 0.9401, test_f1: 0.6350
 epoch: 49, train_loss: 0.6259, test_loss: 0.8827, test_f1: 0.6185
 epoch: 50, train_loss: 0.6198, test_loss: 0.8944, test_f1: 0.6290
 epoch: 51, train_loss: 0.5770, test_loss: 0.9456, test_f1: 0.6419
 epoch: 52, train_loss: 0.5580, test_loss: 1.0728, test_f1: 0.6457
 epoch: 53, train_loss: 0.5526, test_loss: 1.0483, test_f1: 0.6708
 epoch: 54, train_loss: 0.5484, test_loss: 1.0651, test_f1: 0.6297
 epoch: 55, train_loss: 0.5315, test_loss: 1.0732, test_f1: 0.6787
 epoch: 56, train_loss: 0.5363, test_loss: 1.1117, test_f1: 0.6336
 epoch: 57, train_loss: 0.5282, test_loss: 0.8261, test_f1: 0.6470
 epoch: 58, train_loss: 0.5551, test_loss: 1.0630, test_f1: 0.6403
 epoch: 59, train_loss: 0.5362, test_loss: 1.0926, test_f1: 0.6245
 epoch: 60, train_loss: 0.5068, test_loss: 0.9820, test_f1: 0.6474
 epoch: 61, train_loss: 0.5186, test_loss: 0.9507, test_f1: 0.6613
 epoch: 62, train_loss: 0.5155, test_loss: 1.0407, test_f1: 0.6345
 epoch: 63, train_loss: 0.5164, test_loss: 0.9166, test_f1: 0.6467
 epoch: 64, train_loss: 0.5235, test_loss: 1.0529, test_f1: 0.6421
 epoch: 65, train_loss: 0.4984, test_loss: 0.9129, test_f1: 0.6547
 epoch: 66, train_loss: 0.5192, test_loss: 1.0379, test_f1: 0.6591
 epoch: 67, train_loss: 0.5070, test_loss: 0.9370, test_f1: 0.6579
 epoch: 68, train_loss: 0.4792, test_loss: 1.1587, test_f1: 0.6508
 epoch: 69, train_loss: 0.5010, test_loss: 0.9057, test_f1: 0.6592
 epoch: 70, train_loss: 0.4832, test_loss: 0.9467, test_f1: 0.6704
 epoch: 71, train_loss: 0.4836, test_loss: 0.9933, test_f1: 0.6612
 epoch: 72, train_loss: 0.4921, test_loss: 1.0550, test_f1: 0.6661
 epoch: 73, train_loss: 0.4585, test_loss: 1.1508, test_f1: 0.6432
 epoch: 74, train_loss: 0.4893, test_loss: 1.0520, test_f1: 0.6522
 epoch: 75, train_loss: 0.4738, test_loss: 1.1482, test_f1: 0.6565
 epoch: 76, train_loss: 0.4985, test_loss: 1.0912, test_f1: 0.6619
 epoch: 77, train_loss: 0.4735, test_loss: 1.0718, test_f1: 0.6567
 epoch: 78, train_loss: 0.4488, test_loss: 1.0312, test_f1: 0.6538
 epoch: 79, train_loss: 0.4751, test_loss: 0.8412, test_f1: 0.6864
 epoch: 80, train_loss: 0.4706, test_loss: 0.9743, test_f1: 0.6829
 epoch: 81, train_loss: 0.4425, test_loss: 1.0441, test_f1: 0.6306
 epoch: 82, train_loss: 0.4391, test_loss: 1.1038, test_f1: 0.6769
 epoch: 83, train_loss: 0.4593, test_loss: 1.0008, test_f1: 0.6509
 epoch: 84, train_loss: 0.4636, test_loss: 1.1793, test_f1: 0.6652
 epoch: 85, train_loss: 0.4379, test_loss: 1.2762, test_f1: 0.6504
 epoch: 86, train_loss: 0.4502, test_loss: 1.2397, test_f1: 0.6636
 epoch: 87, train_loss: 0.4424, test_loss: 1.1323, test_f1: 0.6534
 epoch: 88, train_loss: 0.4535, test_loss: 0.9819, test_f1: 0.6600
 epoch: 89, train_loss: 0.4165, test_loss: 0.8490, test_f1: 0.6948
 epoch: 90, train_loss: 0.4380, test_loss: 1.0558, test_f1: 0.6633
 epoch: 91, train_loss: 0.4248, test_loss: 1.1573, test_f1: 0.6650
 epoch: 92, train_loss: 0.4236, test_loss: 1.2124, test_f1: 0.6746
 epoch: 93, train_loss: 0.4299, test_loss: 1.3293, test_f1: 0.6509
 epoch: 94, train_loss: 0.4306, test_loss: 1.0862, test_f1: 0.6613
 epoch: 95, train_loss: 0.4239, test_loss: 1.3730, test_f1: 0.6501
 epoch: 96, train_loss: 0.4352, test_loss: 1.0296, test_f1: 0.6756
 epoch: 97, train_loss: 0.4216, test_loss: 1.1163, test_f1: 0.6642
 epoch: 98, train_loss: 0.4110, test_loss: 1.1895, test_f1: 0.6607
 epoch: 99, train_loss: 0.4192, test_loss: 1.3484, test_f1: 0.6379
##################ITERATION #2 ****************************************
 epoch: 0, train_loss: 1.1600, test_loss: 1.0796, test_f1: 0.3327
 epoch: 1, train_loss: 1.0270, test_loss: 1.0806, test_f1: 0.4124
 epoch: 2, train_loss: 1.0012, test_loss: 1.0520, test_f1: 0.4361
 epoch: 3, train_loss: 0.9874, test_loss: 1.0714, test_f1: 0.4577
 epoch: 4, train_loss: 0.9801, test_loss: 1.0405, test_f1: 0.4938
 epoch: 5, train_loss: 0.9611, test_loss: 1.0000, test_f1: 0.4863
 epoch: 6, train_loss: 0.9226, test_loss: 1.0862, test_f1: 0.4298
 epoch: 7, train_loss: 0.9407, test_loss: 1.0287, test_f1: 0.4767
 epoch: 8, train_loss: 0.9454, test_loss: 0.9248, test_f1: 0.4972
 epoch: 9, train_loss: 0.9082, test_loss: 0.9284, test_f1: 0.5083
 epoch: 10, train_loss: 0.8815, test_loss: 0.9251, test_f1: 0.5205
 epoch: 11, train_loss: 0.8779, test_loss: 0.8681, test_f1: 0.5043
 epoch: 12, train_loss: 0.8699, test_loss: 0.8878, test_f1: 0.5586
 epoch: 13, train_loss: 0.8476, test_loss: 0.8632, test_f1: 0.5214
 epoch: 14, train_loss: 0.8281, test_loss: 0.9018, test_f1: 0.5664
 epoch: 15, train_loss: 0.8148, test_loss: 0.8292, test_f1: 0.5706
 epoch: 16, train_loss: 0.8195, test_loss: 0.9739, test_f1: 0.5482
 epoch: 17, train_loss: 0.8186, test_loss: 1.0335, test_f1: 0.4870
 epoch: 18, train_loss: 0.8119, test_loss: 0.8593, test_f1: 0.5586
 epoch: 19, train_loss: 0.8057, test_loss: 0.8943, test_f1: 0.5252
 epoch: 20, train_loss: 0.7921, test_loss: 1.0675, test_f1: 0.5541
 epoch: 21, train_loss: 0.8110, test_loss: 0.8968, test_f1: 0.5165
 epoch: 22, train_loss: 0.7844, test_loss: 0.8836, test_f1: 0.5578
 epoch: 23, train_loss: 0.7587, test_loss: 0.9649, test_f1: 0.5245
 epoch: 24, train_loss: 0.7665, test_loss: 0.9452, test_f1: 0.5372
 epoch: 25, train_loss: 0.7854, test_loss: 0.8619, test_f1: 0.6079
 epoch: 26, train_loss: 0.7839, test_loss: 0.9710, test_f1: 0.5435
 epoch: 27, train_loss: 0.7736, test_loss: 0.8478, test_f1: 0.5898
 epoch: 28, train_loss: 0.7499, test_loss: 0.9859, test_f1: 0.5499
 epoch: 29, train_loss: 0.7398, test_loss: 0.9043, test_f1: 0.5866
 epoch: 30, train_loss: 0.7252, test_loss: 0.8094, test_f1: 0.4956
 epoch: 31, train_loss: 0.7684, test_loss: 0.8908, test_f1: 0.5153
 epoch: 32, train_loss: 0.7624, test_loss: 0.8733, test_f1: 0.5567
 epoch: 33, train_loss: 0.7402, test_loss: 0.8357, test_f1: 0.5746
 epoch: 34, train_loss: 0.7391, test_loss: 0.8848, test_f1: 0.5740
 epoch: 35, train_loss: 0.7407, test_loss: 0.9873, test_f1: 0.5279
 epoch: 36, train_loss: 0.7149, test_loss: 0.9604, test_f1: 0.5977
 epoch: 37, train_loss: 0.7281, test_loss: 0.8759, test_f1: 0.5740
 epoch: 38, train_loss: 0.7081, test_loss: 0.8321, test_f1: 0.6021
 epoch: 39, train_loss: 0.7152, test_loss: 0.8511, test_f1: 0.5643
 epoch: 40, train_loss: 0.6903, test_loss: 0.8100, test_f1: 0.6082
 epoch: 41, train_loss: 0.6898, test_loss: 0.8857, test_f1: 0.5961
 epoch: 42, train_loss: 0.7003, test_loss: 0.7379, test_f1: 0.6377
 epoch: 43, train_loss: 0.6869, test_loss: 0.9028, test_f1: 0.5955
 epoch: 44, train_loss: 0.6764, test_loss: 0.7641, test_f1: 0.6068
 epoch: 45, train_loss: 0.6723, test_loss: 0.8440, test_f1: 0.5736
 epoch: 46, train_loss: 0.6662, test_loss: 0.9122, test_f1: 0.5823
 epoch: 47, train_loss: 0.6907, test_loss: 0.9188, test_f1: 0.5476
 epoch: 48, train_loss: 0.6937, test_loss: 0.8572, test_f1: 0.5685
 epoch: 49, train_loss: 0.6735, test_loss: 0.8472, test_f1: 0.6298
 epoch: 50, train_loss: 0.6733, test_loss: 0.9661, test_f1: 0.5694
 epoch: 51, train_loss: 0.6407, test_loss: 0.8898, test_f1: 0.5936
 epoch: 52, train_loss: 0.6167, test_loss: 0.8525, test_f1: 0.6220
 epoch: 53, train_loss: 0.5898, test_loss: 0.8856, test_f1: 0.6343
 epoch: 54, train_loss: 0.5919, test_loss: 0.9277, test_f1: 0.6144
 epoch: 55, train_loss: 0.6053, test_loss: 0.9422, test_f1: 0.6016
 epoch: 56, train_loss: 0.5877, test_loss: 0.9529, test_f1: 0.6274
 epoch: 57, train_loss: 0.5787, test_loss: 0.9034, test_f1: 0.6328
 epoch: 58, train_loss: 0.5779, test_loss: 0.9260, test_f1: 0.5986
 epoch: 59, train_loss: 0.5611, test_loss: 0.9312, test_f1: 0.5923
 epoch: 60, train_loss: 0.5750, test_loss: 0.9491, test_f1: 0.5816
 epoch: 61, train_loss: 0.5712, test_loss: 0.9605, test_f1: 0.6007
 epoch: 62, train_loss: 0.5532, test_loss: 1.0301, test_f1: 0.6142
 epoch: 63, train_loss: 0.5598, test_loss: 0.9080, test_f1: 0.6312
 epoch: 64, train_loss: 0.5483, test_loss: 0.9766, test_f1: 0.6127
 epoch: 65, train_loss: 0.5510, test_loss: 0.9189, test_f1: 0.6009
 epoch: 66, train_loss: 0.5423, test_loss: 0.9542, test_f1: 0.6106
 epoch: 67, train_loss: 0.5433, test_loss: 0.9507, test_f1: 0.6058
 epoch: 68, train_loss: 0.5547, test_loss: 0.9063, test_f1: 0.6321
 epoch: 69, train_loss: 0.5267, test_loss: 0.9773, test_f1: 0.6278
 epoch: 70, train_loss: 0.5313, test_loss: 0.9596, test_f1: 0.6315
 epoch: 71, train_loss: 0.5366, test_loss: 0.9197, test_f1: 0.6313
 epoch: 72, train_loss: 0.5271, test_loss: 1.0760, test_f1: 0.6236
 epoch: 73, train_loss: 0.5201, test_loss: 0.9160, test_f1: 0.6197
 epoch: 74, train_loss: 0.5298, test_loss: 0.9421, test_f1: 0.6355
 epoch: 75, train_loss: 0.5324, test_loss: 0.9294, test_f1: 0.6164
 epoch: 76, train_loss: 0.5001, test_loss: 0.9118, test_f1: 0.6257
 epoch: 77, train_loss: 0.5240, test_loss: 1.0222, test_f1: 0.6608
 epoch: 78, train_loss: 0.5260, test_loss: 0.9603, test_f1: 0.6070
 epoch: 79, train_loss: 0.5074, test_loss: 0.9221, test_f1: 0.6488
 epoch: 80, train_loss: 0.4931, test_loss: 0.9172, test_f1: 0.6397
 epoch: 81, train_loss: 0.4897, test_loss: 0.9940, test_f1: 0.6263
 epoch: 82, train_loss: 0.4839, test_loss: 1.0136, test_f1: 0.5946
 epoch: 83, train_loss: 0.4752, test_loss: 0.9277, test_f1: 0.6178
 epoch: 84, train_loss: 0.4771, test_loss: 1.0598, test_f1: 0.6092
 epoch: 85, train_loss: 0.4785, test_loss: 0.9825, test_f1: 0.6520
 epoch: 86, train_loss: 0.4971, test_loss: 0.9643, test_f1: 0.6255
 epoch: 87, train_loss: 0.4863, test_loss: 0.9112, test_f1: 0.6558
 epoch: 88, train_loss: 0.4871, test_loss: 0.9646, test_f1: 0.6255
 epoch: 89, train_loss: 0.4850, test_loss: 0.9987, test_f1: 0.6531
 epoch: 90, train_loss: 0.4851, test_loss: 0.9942, test_f1: 0.6302
 epoch: 91, train_loss: 0.4859, test_loss: 0.9101, test_f1: 0.6538
 epoch: 92, train_loss: 0.4777, test_loss: 0.8993, test_f1: 0.6264
 epoch: 93, train_loss: 0.4427, test_loss: 0.9956, test_f1: 0.6312
 epoch: 94, train_loss: 0.4558, test_loss: 1.0203, test_f1: 0.6509
 epoch: 95, train_loss: 0.4766, test_loss: 0.9109, test_f1: 0.6488
 epoch: 96, train_loss: 0.4633, test_loss: 1.0325, test_f1: 0.6525
 epoch: 97, train_loss: 0.4542, test_loss: 0.9971, test_f1: 0.6566
 epoch: 98, train_loss: 0.4509, test_loss: 1.0244, test_f1: 0.6338
 epoch: 99, train_loss: 0.4524, test_loss: 0.9961, test_f1: 0.6513
##################ITERATION #3 ****************************************
 epoch: 0, train_loss: 1.1808, test_loss: 1.0877, test_f1: 0.4314
 epoch: 1, train_loss: 1.0130, test_loss: 1.0048, test_f1: 0.5104
 epoch: 2, train_loss: 0.9828, test_loss: 0.9834, test_f1: 0.4643
 epoch: 3, train_loss: 0.9520, test_loss: 1.1116, test_f1: 0.4729
 epoch: 4, train_loss: 0.9317, test_loss: 1.0961, test_f1: 0.4368
 epoch: 5, train_loss: 0.9047, test_loss: 1.0285, test_f1: 0.4940
 epoch: 6, train_loss: 0.8993, test_loss: 0.9605, test_f1: 0.5300
 epoch: 7, train_loss: 0.8770, test_loss: 0.9276, test_f1: 0.5134
 epoch: 8, train_loss: 0.8540, test_loss: 0.9227, test_f1: 0.5500
 epoch: 9, train_loss: 0.8508, test_loss: 0.8621, test_f1: 0.5066
 epoch: 10, train_loss: 0.8473, test_loss: 0.9097, test_f1: 0.5394
 epoch: 11, train_loss: 0.8268, test_loss: 0.9177, test_f1: 0.5025
 epoch: 12, train_loss: 0.8357, test_loss: 1.0412, test_f1: 0.4417
 epoch: 13, train_loss: 0.8055, test_loss: 0.9986, test_f1: 0.4898
 epoch: 14, train_loss: 0.8048, test_loss: 0.9983, test_f1: 0.5509
 epoch: 15, train_loss: 0.7881, test_loss: 0.8090, test_f1: 0.5710
 epoch: 16, train_loss: 0.7869, test_loss: 0.9032, test_f1: 0.5566
 epoch: 17, train_loss: 0.7935, test_loss: 0.9619, test_f1: 0.5338
 epoch: 18, train_loss: 0.7705, test_loss: 0.8451, test_f1: 0.5916
 epoch: 19, train_loss: 0.7582, test_loss: 1.0740, test_f1: 0.5747
 epoch: 20, train_loss: 0.7685, test_loss: 0.8077, test_f1: 0.5776
 epoch: 21, train_loss: 0.7349, test_loss: 0.9551, test_f1: 0.6139
 epoch: 22, train_loss: 0.7523, test_loss: 0.8413, test_f1: 0.6370
 epoch: 23, train_loss: 0.7325, test_loss: 0.7848, test_f1: 0.6213
 epoch: 24, train_loss: 0.7275, test_loss: 0.9318, test_f1: 0.5643
 epoch: 25, train_loss: 0.7284, test_loss: 0.9036, test_f1: 0.6266
 epoch: 26, train_loss: 0.7349, test_loss: 0.8856, test_f1: 0.5953
 epoch: 27, train_loss: 0.7169, test_loss: 1.0116, test_f1: 0.5392
 epoch: 28, train_loss: 0.7002, test_loss: 0.8222, test_f1: 0.6799
 epoch: 29, train_loss: 0.7035, test_loss: 0.9791, test_f1: 0.5938
 epoch: 30, train_loss: 0.7136, test_loss: 0.8096, test_f1: 0.6458
 epoch: 31, train_loss: 0.6905, test_loss: 0.8076, test_f1: 0.6581
 epoch: 32, train_loss: 0.6795, test_loss: 0.8387, test_f1: 0.6573
 epoch: 33, train_loss: 0.6866, test_loss: 0.7831, test_f1: 0.6402
 epoch: 34, train_loss: 0.6798, test_loss: 0.9032, test_f1: 0.5894
 epoch: 35, train_loss: 0.6596, test_loss: 0.8631, test_f1: 0.6406
 epoch: 36, train_loss: 0.6995, test_loss: 0.9165, test_f1: 0.6295
 epoch: 37, train_loss: 0.6728, test_loss: 0.7910, test_f1: 0.6277
 epoch: 38, train_loss: 0.6370, test_loss: 0.8638, test_f1: 0.6658
 epoch: 39, train_loss: 0.6600, test_loss: 0.9647, test_f1: 0.6121
 epoch: 40, train_loss: 0.6559, test_loss: 1.0428, test_f1: 0.5781
 epoch: 41, train_loss: 0.6666, test_loss: 0.8359, test_f1: 0.6239
 epoch: 42, train_loss: 0.6565, test_loss: 0.8396, test_f1: 0.6435
 epoch: 43, train_loss: 0.6551, test_loss: 0.8452, test_f1: 0.6115
 epoch: 44, train_loss: 0.6715, test_loss: 0.7797, test_f1: 0.6202
 epoch: 45, train_loss: 0.6313, test_loss: 0.8967, test_f1: 0.6151
 epoch: 46, train_loss: 0.6466, test_loss: 0.8664, test_f1: 0.5798
 epoch: 47, train_loss: 0.6255, test_loss: 0.8800, test_f1: 0.6451
 epoch: 48, train_loss: 0.6342, test_loss: 0.7960, test_f1: 0.6438
 epoch: 49, train_loss: 0.6075, test_loss: 0.8646, test_f1: 0.6480
 epoch: 50, train_loss: 0.6951, test_loss: 0.8870, test_f1: 0.6146
 epoch: 51, train_loss: 0.6270, test_loss: 0.8293, test_f1: 0.6639
 epoch: 52, train_loss: 0.5637, test_loss: 0.7669, test_f1: 0.6793
 epoch: 53, train_loss: 0.5527, test_loss: 0.7683, test_f1: 0.6785
 epoch: 54, train_loss: 0.5563, test_loss: 0.8924, test_f1: 0.6351
 epoch: 55, train_loss: 0.5553, test_loss: 0.8486, test_f1: 0.6286
 epoch: 56, train_loss: 0.5608, test_loss: 0.8065, test_f1: 0.6496
 epoch: 57, train_loss: 0.5411, test_loss: 0.8802, test_f1: 0.6512
 epoch: 58, train_loss: 0.5334, test_loss: 0.8258, test_f1: 0.6739
 epoch: 59, train_loss: 0.5281, test_loss: 0.7947, test_f1: 0.6602
 epoch: 60, train_loss: 0.5349, test_loss: 0.8195, test_f1: 0.6512
 epoch: 61, train_loss: 0.5408, test_loss: 0.8314, test_f1: 0.6660
 epoch: 62, train_loss: 0.5255, test_loss: 0.7820, test_f1: 0.6793
 epoch: 63, train_loss: 0.5195, test_loss: 0.7773, test_f1: 0.6817
 epoch: 64, train_loss: 0.4862, test_loss: 0.8274, test_f1: 0.6758
 epoch: 65, train_loss: 0.4964, test_loss: 0.8044, test_f1: 0.6741
 epoch: 66, train_loss: 0.5169, test_loss: 0.8568, test_f1: 0.6596
 epoch: 67, train_loss: 0.5094, test_loss: 0.7449, test_f1: 0.6810
 epoch: 68, train_loss: 0.4969, test_loss: 0.8083, test_f1: 0.6552
 epoch: 69, train_loss: 0.4911, test_loss: 0.7856, test_f1: 0.6564
 epoch: 70, train_loss: 0.4992, test_loss: 1.1399, test_f1: 0.6097
 epoch: 71, train_loss: 0.4929, test_loss: 0.8131, test_f1: 0.6662
 epoch: 72, train_loss: 0.4731, test_loss: 0.9143, test_f1: 0.6519
 epoch: 73, train_loss: 0.4871, test_loss: 0.8478, test_f1: 0.6641
 epoch: 74, train_loss: 0.4959, test_loss: 0.8859, test_f1: 0.6524
 epoch: 75, train_loss: 0.4847, test_loss: 0.8959, test_f1: 0.6812
 epoch: 76, train_loss: 0.4890, test_loss: 0.8521, test_f1: 0.6623
 epoch: 77, train_loss: 0.4776, test_loss: 0.8630, test_f1: 0.6679
 epoch: 78, train_loss: 0.4625, test_loss: 0.8853, test_f1: 0.6495
 epoch: 79, train_loss: 0.4741, test_loss: 0.8348, test_f1: 0.6494
 epoch: 80, train_loss: 0.4735, test_loss: 0.8914, test_f1: 0.6533
 epoch: 81, train_loss: 0.4449, test_loss: 0.9568, test_f1: 0.6553
 epoch: 82, train_loss: 0.4583, test_loss: 1.0232, test_f1: 0.6671
 epoch: 83, train_loss: 0.4726, test_loss: 0.7990, test_f1: 0.6651
 epoch: 84, train_loss: 0.4444, test_loss: 0.9491, test_f1: 0.6766
 epoch: 85, train_loss: 0.4610, test_loss: 0.8779, test_f1: 0.6440
 epoch: 86, train_loss: 0.4418, test_loss: 0.8700, test_f1: 0.7098
 epoch: 87, train_loss: 0.4364, test_loss: 0.8447, test_f1: 0.6726
 epoch: 88, train_loss: 0.4406, test_loss: 0.8659, test_f1: 0.6731
 epoch: 89, train_loss: 0.4458, test_loss: 0.8706, test_f1: 0.6889
 epoch: 90, train_loss: 0.4314, test_loss: 1.7516, test_f1: 0.5100
 epoch: 91, train_loss: 0.4511, test_loss: 0.9560, test_f1: 0.6551
 epoch: 92, train_loss: 0.4489, test_loss: 0.8227, test_f1: 0.6730
 epoch: 93, train_loss: 0.4236, test_loss: 0.8616, test_f1: 0.6690
 epoch: 94, train_loss: 0.4266, test_loss: 0.8971, test_f1: 0.6619
 epoch: 95, train_loss: 0.4250, test_loss: 0.9112, test_f1: 0.6514
 epoch: 96, train_loss: 0.4256, test_loss: 1.0233, test_f1: 0.6423
 epoch: 97, train_loss: 0.4262, test_loss: 0.8377, test_f1: 0.6812
 epoch: 98, train_loss: 0.4467, test_loss: 0.9517, test_f1: 0.6520
 epoch: 99, train_loss: 0.4160, test_loss: 0.8327, test_f1: 0.6621
##################ITERATION #4 ****************************************
 epoch: 0, train_loss: 1.1564, test_loss: 1.1300, test_f1: 0.4503
 epoch: 1, train_loss: 1.0098, test_loss: 1.0771, test_f1: 0.4859
 epoch: 2, train_loss: 0.9734, test_loss: 1.0423, test_f1: 0.4675
 epoch: 3, train_loss: 0.9616, test_loss: 1.1092, test_f1: 0.4321
 epoch: 4, train_loss: 0.9257, test_loss: 1.0097, test_f1: 0.5028
 epoch: 5, train_loss: 0.9150, test_loss: 1.0555, test_f1: 0.4723
 epoch: 6, train_loss: 0.8960, test_loss: 1.2522, test_f1: 0.4418
 epoch: 7, train_loss: 0.8771, test_loss: 0.8869, test_f1: 0.5651
 epoch: 8, train_loss: 0.8781, test_loss: 1.0256, test_f1: 0.5157
 epoch: 9, train_loss: 0.8611, test_loss: 0.9749, test_f1: 0.4850
 epoch: 10, train_loss: 0.8518, test_loss: 0.8355, test_f1: 0.5558
 epoch: 11, train_loss: 0.8525, test_loss: 0.8703, test_f1: 0.5943
 epoch: 12, train_loss: 0.8245, test_loss: 0.8821, test_f1: 0.5769
 epoch: 13, train_loss: 0.8465, test_loss: 1.1273, test_f1: 0.4812
 epoch: 14, train_loss: 0.8200, test_loss: 0.9547, test_f1: 0.5578
 epoch: 15, train_loss: 0.8132, test_loss: 0.9520, test_f1: 0.5480
 epoch: 16, train_loss: 0.7900, test_loss: 1.1926, test_f1: 0.4558
 epoch: 17, train_loss: 0.8057, test_loss: 0.8839, test_f1: 0.5565
 epoch: 18, train_loss: 0.8074, test_loss: 0.8430, test_f1: 0.5526
 epoch: 19, train_loss: 0.7630, test_loss: 0.8038, test_f1: 0.6300
 epoch: 20, train_loss: 0.7653, test_loss: 0.8760, test_f1: 0.5975
 epoch: 21, train_loss: 0.7589, test_loss: 0.7879, test_f1: 0.5976
 epoch: 22, train_loss: 0.7545, test_loss: 0.8156, test_f1: 0.5881
 epoch: 23, train_loss: 0.7545, test_loss: 0.9514, test_f1: 0.5110
 epoch: 24, train_loss: 0.7381, test_loss: 0.7579, test_f1: 0.5904
 epoch: 25, train_loss: 0.7310, test_loss: 0.8616, test_f1: 0.5992
 epoch: 26, train_loss: 0.7281, test_loss: 0.8121, test_f1: 0.6132
 epoch: 27, train_loss: 0.7150, test_loss: 0.8416, test_f1: 0.5844
 epoch: 28, train_loss: 0.7166, test_loss: 0.9202, test_f1: 0.5182
 epoch: 29, train_loss: 0.7184, test_loss: 0.7837, test_f1: 0.6396
 epoch: 30, train_loss: 0.6987, test_loss: 0.8340, test_f1: 0.5817
 epoch: 31, train_loss: 0.7043, test_loss: 0.9341, test_f1: 0.5896
 epoch: 32, train_loss: 0.7129, test_loss: 0.7826, test_f1: 0.5881
 epoch: 33, train_loss: 0.6883, test_loss: 0.8738, test_f1: 0.5728
 epoch: 34, train_loss: 0.6934, test_loss: 0.8707, test_f1: 0.6192
 epoch: 35, train_loss: 0.6772, test_loss: 0.8801, test_f1: 0.6434
 epoch: 36, train_loss: 0.7013, test_loss: 0.8260, test_f1: 0.5992
 epoch: 37, train_loss: 0.6770, test_loss: 0.9510, test_f1: 0.5814
 epoch: 38, train_loss: 0.6779, test_loss: 0.9336, test_f1: 0.5631
 epoch: 39, train_loss: 0.6653, test_loss: 0.8362, test_f1: 0.6199
 epoch: 40, train_loss: 0.6473, test_loss: 0.8527, test_f1: 0.5831
 epoch: 41, train_loss: 0.6707, test_loss: 0.8096, test_f1: 0.6273
 epoch: 42, train_loss: 0.6518, test_loss: 1.1052, test_f1: 0.5426
 epoch: 43, train_loss: 0.6323, test_loss: 0.9272, test_f1: 0.6179
 epoch: 44, train_loss: 0.6297, test_loss: 0.8979, test_f1: 0.5924
 epoch: 45, train_loss: 0.6353, test_loss: 0.8466, test_f1: 0.6151
 epoch: 46, train_loss: 0.6226, test_loss: 0.8732, test_f1: 0.5702
 epoch: 47, train_loss: 0.6400, test_loss: 0.8121, test_f1: 0.6447
 epoch: 48, train_loss: 0.6236, test_loss: 0.8782, test_f1: 0.6396
 epoch: 49, train_loss: 0.6078, test_loss: 0.8453, test_f1: 0.6104
 epoch: 50, train_loss: 0.6145, test_loss: 0.8622, test_f1: 0.6338
 epoch: 51, train_loss: 0.5836, test_loss: 0.8123, test_f1: 0.6284
 epoch: 52, train_loss: 0.5621, test_loss: 0.8683, test_f1: 0.6806
 epoch: 53, train_loss: 0.5519, test_loss: 0.9137, test_f1: 0.6580
 epoch: 54, train_loss: 0.5425, test_loss: 0.8069, test_f1: 0.6759
 epoch: 55, train_loss: 0.5347, test_loss: 0.8714, test_f1: 0.6115
 epoch: 56, train_loss: 0.5170, test_loss: 0.9611, test_f1: 0.6574
 epoch: 57, train_loss: 0.5238, test_loss: 0.9161, test_f1: 0.6292
 epoch: 58, train_loss: 0.5374, test_loss: 0.8429, test_f1: 0.6608
 epoch: 59, train_loss: 0.5171, test_loss: 0.8553, test_f1: 0.6754
 epoch: 60, train_loss: 0.5322, test_loss: 0.8657, test_f1: 0.6739
 epoch: 61, train_loss: 0.5067, test_loss: 0.8840, test_f1: 0.6859
 epoch: 62, train_loss: 0.5115, test_loss: 0.9781, test_f1: 0.6542
 epoch: 63, train_loss: 0.5143, test_loss: 1.0197, test_f1: 0.6597
 epoch: 64, train_loss: 0.4964, test_loss: 0.8856, test_f1: 0.6447
 epoch: 65, train_loss: 0.5113, test_loss: 0.8891, test_f1: 0.6567
 epoch: 66, train_loss: 0.5127, test_loss: 1.0099, test_f1: 0.6726
 epoch: 67, train_loss: 0.5045, test_loss: 0.9857, test_f1: 0.6568
 epoch: 68, train_loss: 0.5138, test_loss: 0.8041, test_f1: 0.6815
 epoch: 69, train_loss: 0.5003, test_loss: 0.9613, test_f1: 0.6522
 epoch: 70, train_loss: 0.4853, test_loss: 0.8936, test_f1: 0.6470
 epoch: 71, train_loss: 0.4757, test_loss: 0.8209, test_f1: 0.6672
 epoch: 72, train_loss: 0.5021, test_loss: 0.8222, test_f1: 0.6428
 epoch: 73, train_loss: 0.4690, test_loss: 0.8934, test_f1: 0.6385
 epoch: 74, train_loss: 0.4715, test_loss: 0.8706, test_f1: 0.6556
 epoch: 75, train_loss: 0.4750, test_loss: 0.9220, test_f1: 0.6577
 epoch: 76, train_loss: 0.4871, test_loss: 0.8536, test_f1: 0.6542
 epoch: 77, train_loss: 0.4806, test_loss: 0.9938, test_f1: 0.6430
 epoch: 78, train_loss: 0.4768, test_loss: 0.9722, test_f1: 0.6227
 epoch: 79, train_loss: 0.4850, test_loss: 0.8991, test_f1: 0.6639
 epoch: 80, train_loss: 0.4641, test_loss: 0.9761, test_f1: 0.6825
 epoch: 81, train_loss: 0.4575, test_loss: 0.8856, test_f1: 0.6553
 epoch: 82, train_loss: 0.4581, test_loss: 0.8664, test_f1: 0.6591
 epoch: 83, train_loss: 0.4667, test_loss: 0.9003, test_f1: 0.6637
 epoch: 84, train_loss: 0.4454, test_loss: 0.9637, test_f1: 0.6671
 epoch: 85, train_loss: 0.4527, test_loss: 0.8869, test_f1: 0.6844
 epoch: 86, train_loss: 0.4695, test_loss: 0.8744, test_f1: 0.6608
 epoch: 87, train_loss: 0.4524, test_loss: 0.8711, test_f1: 0.6661
 epoch: 88, train_loss: 0.4503, test_loss: 0.9310, test_f1: 0.6635
 epoch: 89, train_loss: 0.4386, test_loss: 0.8777, test_f1: 0.6809
 epoch: 90, train_loss: 0.4316, test_loss: 0.8303, test_f1: 0.6869
 epoch: 91, train_loss: 0.4253, test_loss: 0.9153, test_f1: 0.6739
 epoch: 92, train_loss: 0.4364, test_loss: 0.8582, test_f1: 0.6705
 epoch: 93, train_loss: 0.4362, test_loss: 0.9309, test_f1: 0.6805
 epoch: 94, train_loss: 0.4374, test_loss: 0.9015, test_f1: 0.6608
 epoch: 95, train_loss: 0.4287, test_loss: 1.0721, test_f1: 0.6542
 epoch: 96, train_loss: 0.4256, test_loss: 1.0010, test_f1: 0.6679
 epoch: 97, train_loss: 0.4149, test_loss: 0.9781, test_f1: 0.6765
 epoch: 98, train_loss: 0.4135, test_loss: 0.9681, test_f1: 0.6411
 epoch: 99, train_loss: 0.4149, test_loss: 0.9986, test_f1: 0.6818
##################ITERATION #5 ****************************************
 epoch: 0, train_loss: 1.1716, test_loss: 1.1167, test_f1: 0.4347
 epoch: 1, train_loss: 1.0107, test_loss: 1.0357, test_f1: 0.4755
 epoch: 2, train_loss: 0.9770, test_loss: 1.0031, test_f1: 0.4583
 epoch: 3, train_loss: 0.9435, test_loss: 0.9923, test_f1: 0.4945
 epoch: 4, train_loss: 0.9309, test_loss: 0.9493, test_f1: 0.5216
 epoch: 5, train_loss: 0.9031, test_loss: 0.9484, test_f1: 0.5253
 epoch: 6, train_loss: 0.8966, test_loss: 0.9228, test_f1: 0.5315
 epoch: 7, train_loss: 0.9111, test_loss: 0.9227, test_f1: 0.4584
 epoch: 8, train_loss: 0.8788, test_loss: 0.9822, test_f1: 0.5276
 epoch: 9, train_loss: 0.8493, test_loss: 0.9513, test_f1: 0.5308
 epoch: 10, train_loss: 0.8468, test_loss: 0.9062, test_f1: 0.5367
 epoch: 11, train_loss: 0.8276, test_loss: 0.9159, test_f1: 0.5416
 epoch: 12, train_loss: 0.8149, test_loss: 0.9318, test_f1: 0.5379
 epoch: 13, train_loss: 0.8422, test_loss: 0.9532, test_f1: 0.5086
 epoch: 14, train_loss: 0.8452, test_loss: 0.9051, test_f1: 0.5304
 epoch: 15, train_loss: 0.8128, test_loss: 0.9045, test_f1: 0.5619
 epoch: 16, train_loss: 0.8051, test_loss: 1.0170, test_f1: 0.5266
 epoch: 17, train_loss: 0.8249, test_loss: 0.9012, test_f1: 0.5432
 epoch: 18, train_loss: 0.8129, test_loss: 0.9914, test_f1: 0.4801
 epoch: 19, train_loss: 0.7950, test_loss: 0.9642, test_f1: 0.5299
 epoch: 20, train_loss: 0.7893, test_loss: 0.8365, test_f1: 0.5241
 epoch: 21, train_loss: 0.7869, test_loss: 0.8950, test_f1: 0.5650
 epoch: 22, train_loss: 0.7843, test_loss: 0.8692, test_f1: 0.5579
 epoch: 23, train_loss: 0.7543, test_loss: 0.9399, test_f1: 0.5507
 epoch: 24, train_loss: 0.7366, test_loss: 0.9943, test_f1: 0.5756
 epoch: 25, train_loss: 0.7363, test_loss: 0.9277, test_f1: 0.5661
 epoch: 26, train_loss: 0.7389, test_loss: 0.9474, test_f1: 0.6104
 epoch: 27, train_loss: 0.7245, test_loss: 0.8108, test_f1: 0.5924
 epoch: 28, train_loss: 0.7263, test_loss: 1.0748, test_f1: 0.5431
 epoch: 29, train_loss: 0.7454, test_loss: 0.8604, test_f1: 0.6231
 epoch: 30, train_loss: 0.7298, test_loss: 1.0194, test_f1: 0.5209
 epoch: 31, train_loss: 0.7188, test_loss: 0.8739, test_f1: 0.6516
 epoch: 32, train_loss: 0.7217, test_loss: 0.9524, test_f1: 0.5708
 epoch: 33, train_loss: 0.7361, test_loss: 0.8219, test_f1: 0.6188
 epoch: 34, train_loss: 0.7003, test_loss: 0.9068, test_f1: 0.6193
 epoch: 35, train_loss: 0.7053, test_loss: 0.8565, test_f1: 0.6223
 epoch: 36, train_loss: 0.7145, test_loss: 0.8261, test_f1: 0.6023
 epoch: 37, train_loss: 0.6971, test_loss: 0.8571, test_f1: 0.6158
 epoch: 38, train_loss: 0.7099, test_loss: 0.7860, test_f1: 0.6413
 epoch: 39, train_loss: 0.7116, test_loss: 0.9230, test_f1: 0.6140
 epoch: 40, train_loss: 0.7029, test_loss: 0.8804, test_f1: 0.6193
 epoch: 41, train_loss: 0.6720, test_loss: 0.9384, test_f1: 0.6176
 epoch: 42, train_loss: 0.6704, test_loss: 0.9757, test_f1: 0.5864
 epoch: 43, train_loss: 0.6314, test_loss: 0.9709, test_f1: 0.5549
 epoch: 44, train_loss: 0.6554, test_loss: 0.8844, test_f1: 0.6555
 epoch: 45, train_loss: 0.6491, test_loss: 0.9174, test_f1: 0.6211
 epoch: 46, train_loss: 0.6618, test_loss: 1.0091, test_f1: 0.5397
 epoch: 47, train_loss: 0.6353, test_loss: 0.9852, test_f1: 0.5750
 epoch: 48, train_loss: 0.6383, test_loss: 1.0576, test_f1: 0.6350
 epoch: 49, train_loss: 0.6527, test_loss: 0.9316, test_f1: 0.6038
 epoch: 50, train_loss: 0.6590, test_loss: 0.8870, test_f1: 0.6660
 epoch: 51, train_loss: 0.6087, test_loss: 0.8076, test_f1: 0.6610
 epoch: 52, train_loss: 0.5691, test_loss: 1.1016, test_f1: 0.6287
 epoch: 53, train_loss: 0.6086, test_loss: 0.8479, test_f1: 0.6527
 epoch: 54, train_loss: 0.5839, test_loss: 0.9554, test_f1: 0.6302
 epoch: 55, train_loss: 0.5639, test_loss: 0.9695, test_f1: 0.6337
 epoch: 56, train_loss: 0.5650, test_loss: 1.0176, test_f1: 0.6379
 epoch: 57, train_loss: 0.5367, test_loss: 1.0441, test_f1: 0.6378
 epoch: 58, train_loss: 0.5511, test_loss: 0.9037, test_f1: 0.6718
 epoch: 59, train_loss: 0.5568, test_loss: 0.9074, test_f1: 0.6561
 epoch: 60, train_loss: 0.5499, test_loss: 0.9815, test_f1: 0.6389
 epoch: 61, train_loss: 0.5390, test_loss: 0.9897, test_f1: 0.6742
 epoch: 62, train_loss: 0.5271, test_loss: 1.0748, test_f1: 0.6354
 epoch: 63, train_loss: 0.5397, test_loss: 1.0723, test_f1: 0.6376
 epoch: 64, train_loss: 0.5238, test_loss: 0.9952, test_f1: 0.6446
 epoch: 65, train_loss: 0.5140, test_loss: 0.9518, test_f1: 0.6210
 epoch: 66, train_loss: 0.4992, test_loss: 1.0411, test_f1: 0.6252
 epoch: 67, train_loss: 0.5093, test_loss: 1.0158, test_f1: 0.6402
 epoch: 68, train_loss: 0.5206, test_loss: 0.9726, test_f1: 0.6508
 epoch: 69, train_loss: 0.4992, test_loss: 1.0845, test_f1: 0.6501
 epoch: 70, train_loss: 0.5101, test_loss: 1.0673, test_f1: 0.6029
 epoch: 71, train_loss: 0.5088, test_loss: 1.1633, test_f1: 0.6203
 epoch: 72, train_loss: 0.4785, test_loss: 1.0748, test_f1: 0.6426
 epoch: 73, train_loss: 0.4843, test_loss: 1.1924, test_f1: 0.6474
 epoch: 74, train_loss: 0.4923, test_loss: 1.0073, test_f1: 0.6615
 epoch: 75, train_loss: 0.4879, test_loss: 1.0886, test_f1: 0.6303
 epoch: 76, train_loss: 0.4989, test_loss: 1.0432, test_f1: 0.6315
 epoch: 77, train_loss: 0.4847, test_loss: 0.9947, test_f1: 0.6309
 epoch: 78, train_loss: 0.4787, test_loss: 1.2638, test_f1: 0.5877
 epoch: 79, train_loss: 0.4745, test_loss: 1.2551, test_f1: 0.6352
 epoch: 80, train_loss: 0.4795, test_loss: 1.0702, test_f1: 0.6431
 epoch: 81, train_loss: 0.4750, test_loss: 1.1576, test_f1: 0.6390
 epoch: 82, train_loss: 0.4850, test_loss: 1.0444, test_f1: 0.6223
 epoch: 83, train_loss: 0.4647, test_loss: 1.1166, test_f1: 0.6363
 epoch: 84, train_loss: 0.4460, test_loss: 1.1568, test_f1: 0.6388
 epoch: 85, train_loss: 0.4458, test_loss: 1.0937, test_f1: 0.6652
 epoch: 86, train_loss: 0.4614, test_loss: 1.1685, test_f1: 0.6435
 epoch: 87, train_loss: 0.4522, test_loss: 1.1980, test_f1: 0.6419
 epoch: 88, train_loss: 0.4671, test_loss: 1.1151, test_f1: 0.6118
 epoch: 89, train_loss: 0.4516, test_loss: 1.2354, test_f1: 0.6004
 epoch: 90, train_loss: 0.4632, test_loss: 1.1081, test_f1: 0.6451
 epoch: 91, train_loss: 0.4545, test_loss: 1.0778, test_f1: 0.6405
 epoch: 92, train_loss: 0.4386, test_loss: 1.1061, test_f1: 0.6476
 epoch: 93, train_loss: 0.4342, test_loss: 1.0109, test_f1: 0.6667
 epoch: 94, train_loss: 0.4255, test_loss: 1.0540, test_f1: 0.6610
 epoch: 95, train_loss: 0.4548, test_loss: 1.0718, test_f1: 0.6494
 epoch: 96, train_loss: 0.4034, test_loss: 1.1692, test_f1: 0.6635
 epoch: 97, train_loss: 0.4052, test_loss: 1.0941, test_f1: 0.6528
 epoch: 98, train_loss: 0.4308, test_loss: 0.9992, test_f1: 0.6840
 epoch: 99, train_loss: 0.4534, test_loss: 1.0935, test_f1: 0.6535
##################ITERATION #6 ****************************************
 epoch: 0, train_loss: 1.2130, test_loss: 1.1103, test_f1: 0.3927
 epoch: 1, train_loss: 1.0363, test_loss: 1.0839, test_f1: 0.4132
 epoch: 2, train_loss: 1.0098, test_loss: 1.1037, test_f1: 0.4832
 epoch: 3, train_loss: 0.9687, test_loss: 0.9309, test_f1: 0.5109
 epoch: 4, train_loss: 0.9454, test_loss: 1.2791, test_f1: 0.4749
 epoch: 5, train_loss: 0.9346, test_loss: 0.8804, test_f1: 0.5453
 epoch: 6, train_loss: 0.8929, test_loss: 0.9913, test_f1: 0.5057
 epoch: 7, train_loss: 0.8837, test_loss: 0.9528, test_f1: 0.5531
 epoch: 8, train_loss: 0.8990, test_loss: 1.0551, test_f1: 0.5131
 epoch: 9, train_loss: 0.8784, test_loss: 1.1239, test_f1: 0.5267
 epoch: 10, train_loss: 0.8637, test_loss: 0.9470, test_f1: 0.5596
 epoch: 11, train_loss: 0.8362, test_loss: 1.0572, test_f1: 0.5124
 epoch: 12, train_loss: 0.8310, test_loss: 0.8559, test_f1: 0.5401
 epoch: 13, train_loss: 0.8344, test_loss: 0.8992, test_f1: 0.5727
 epoch: 14, train_loss: 0.9083, test_loss: 1.1383, test_f1: 0.4077
 epoch: 15, train_loss: 0.9122, test_loss: 0.9891, test_f1: 0.5405
 epoch: 16, train_loss: 0.8757, test_loss: 0.9213, test_f1: 0.5122
 epoch: 17, train_loss: 0.8447, test_loss: 0.9024, test_f1: 0.5517
 epoch: 18, train_loss: 0.8388, test_loss: 0.8675, test_f1: 0.5566
 epoch: 19, train_loss: 0.8299, test_loss: 0.9376, test_f1: 0.5331
 epoch: 20, train_loss: 0.8263, test_loss: 0.9119, test_f1: 0.4947
 epoch: 21, train_loss: 0.8187, test_loss: 0.9658, test_f1: 0.5346
 epoch: 22, train_loss: 0.8100, test_loss: 0.8050, test_f1: 0.5600
 epoch: 23, train_loss: 0.8016, test_loss: 0.9567, test_f1: 0.5050
 epoch: 24, train_loss: 0.7950, test_loss: 0.8896, test_f1: 0.5375
 epoch: 25, train_loss: 0.8053, test_loss: 0.8623, test_f1: 0.5945
 epoch: 26, train_loss: 0.7949, test_loss: 0.9609, test_f1: 0.5874
 epoch: 27, train_loss: 0.7992, test_loss: 0.9996, test_f1: 0.5149
 epoch: 28, train_loss: 0.7869, test_loss: 0.9438, test_f1: 0.5476
 epoch: 29, train_loss: 0.7668, test_loss: 0.9234, test_f1: 0.5599
 epoch: 30, train_loss: 0.7375, test_loss: 0.8930, test_f1: 0.5435
 epoch: 31, train_loss: 0.7353, test_loss: 0.9488, test_f1: 0.5346
 epoch: 32, train_loss: 0.7389, test_loss: 1.2583, test_f1: 0.4810
 epoch: 33, train_loss: 0.7468, test_loss: 0.8763, test_f1: 0.5493
 epoch: 34, train_loss: 0.7414, test_loss: 0.9070, test_f1: 0.5593
 epoch: 35, train_loss: 0.7198, test_loss: 1.1665, test_f1: 0.4819
 epoch: 36, train_loss: 0.7300, test_loss: 0.9691, test_f1: 0.5928
 epoch: 37, train_loss: 0.7453, test_loss: 0.9764, test_f1: 0.5832
 epoch: 38, train_loss: 0.7243, test_loss: 0.9783, test_f1: 0.5822
 epoch: 39, train_loss: 0.7111, test_loss: 1.0270, test_f1: 0.5439
 epoch: 40, train_loss: 0.7157, test_loss: 0.8879, test_f1: 0.5683
 epoch: 41, train_loss: 0.7178, test_loss: 1.1403, test_f1: 0.5026
 epoch: 42, train_loss: 0.7035, test_loss: 0.9658, test_f1: 0.6075
 epoch: 43, train_loss: 0.6997, test_loss: 0.9940, test_f1: 0.5953
 epoch: 44, train_loss: 0.6946, test_loss: 1.0485, test_f1: 0.5337
 epoch: 45, train_loss: 0.6805, test_loss: 0.9176, test_f1: 0.5913
 epoch: 46, train_loss: 0.6750, test_loss: 0.9316, test_f1: 0.5637
 epoch: 47, train_loss: 0.6913, test_loss: 1.9767, test_f1: 0.3549
 epoch: 48, train_loss: 0.6943, test_loss: 0.9810, test_f1: 0.5446
 epoch: 49, train_loss: 0.7089, test_loss: 0.9563, test_f1: 0.5985
 epoch: 50, train_loss: 0.6556, test_loss: 0.9901, test_f1: 0.5971
 epoch: 51, train_loss: 0.6502, test_loss: 0.9810, test_f1: 0.5477
 epoch: 52, train_loss: 0.6353, test_loss: 0.9627, test_f1: 0.6063
 epoch: 53, train_loss: 0.6088, test_loss: 0.9457, test_f1: 0.6221
 epoch: 54, train_loss: 0.6244, test_loss: 0.9070, test_f1: 0.5947
 epoch: 55, train_loss: 0.6132, test_loss: 0.8975, test_f1: 0.6180
 epoch: 56, train_loss: 0.5938, test_loss: 0.9600, test_f1: 0.5780
 epoch: 57, train_loss: 0.5941, test_loss: 0.8899, test_f1: 0.6382
 epoch: 58, train_loss: 0.5989, test_loss: 0.9958, test_f1: 0.5806
 epoch: 59, train_loss: 0.5874, test_loss: 0.9165, test_f1: 0.6094
 epoch: 60, train_loss: 0.5784, test_loss: 1.0080, test_f1: 0.5951
 epoch: 61, train_loss: 0.5768, test_loss: 1.0935, test_f1: 0.6002
 epoch: 62, train_loss: 0.5834, test_loss: 0.8796, test_f1: 0.6132
 epoch: 63, train_loss: 0.5683, test_loss: 0.9435, test_f1: 0.6158
 epoch: 64, train_loss: 0.5634, test_loss: 0.9479, test_f1: 0.6008
 epoch: 65, train_loss: 0.5584, test_loss: 0.9780, test_f1: 0.6115
 epoch: 66, train_loss: 0.5637, test_loss: 1.0012, test_f1: 0.6084
 epoch: 67, train_loss: 0.5669, test_loss: 0.9743, test_f1: 0.5952
 epoch: 68, train_loss: 0.5659, test_loss: 1.2119, test_f1: 0.6099
 epoch: 69, train_loss: 0.5535, test_loss: 0.9162, test_f1: 0.6359
 epoch: 70, train_loss: 0.5444, test_loss: 1.0264, test_f1: 0.6184
 epoch: 71, train_loss: 0.5380, test_loss: 1.0493, test_f1: 0.6227
 epoch: 72, train_loss: 0.5680, test_loss: 1.0209, test_f1: 0.6212
 epoch: 73, train_loss: 0.5429, test_loss: 1.0329, test_f1: 0.6218
 epoch: 74, train_loss: 0.5472, test_loss: 0.9560, test_f1: 0.6439
 epoch: 75, train_loss: 0.5316, test_loss: 0.9411, test_f1: 0.5858
 epoch: 76, train_loss: 0.5378, test_loss: 0.9075, test_f1: 0.6383
 epoch: 77, train_loss: 0.5510, test_loss: 0.9443, test_f1: 0.6168
 epoch: 78, train_loss: 0.5313, test_loss: 0.9458, test_f1: 0.6441
 epoch: 79, train_loss: 0.5295, test_loss: 0.8557, test_f1: 0.6812
 epoch: 80, train_loss: 0.5426, test_loss: 1.2392, test_f1: 0.6197
 epoch: 81, train_loss: 0.5243, test_loss: 0.9771, test_f1: 0.6597
 epoch: 82, train_loss: 0.5161, test_loss: 0.9476, test_f1: 0.6605
 epoch: 83, train_loss: 0.5169, test_loss: 0.9974, test_f1: 0.6597
 epoch: 84, train_loss: 0.5322, test_loss: 1.1077, test_f1: 0.6505
 epoch: 85, train_loss: 0.5297, test_loss: 1.0573, test_f1: 0.6485
 epoch: 86, train_loss: 0.5061, test_loss: 1.0991, test_f1: 0.6339
 epoch: 87, train_loss: 0.5142, test_loss: 1.0553, test_f1: 0.6463
 epoch: 88, train_loss: 0.4941, test_loss: 0.9868, test_f1: 0.6556
 epoch: 89, train_loss: 0.5211, test_loss: 0.9401, test_f1: 0.6560
 epoch: 90, train_loss: 0.5005, test_loss: 1.0412, test_f1: 0.6480
 epoch: 91, train_loss: 0.4988, test_loss: 0.9169, test_f1: 0.6285
 epoch: 92, train_loss: 0.4959, test_loss: 1.0306, test_f1: 0.5999
 epoch: 93, train_loss: 0.4921, test_loss: 0.9874, test_f1: 0.6502
 epoch: 94, train_loss: 0.4914, test_loss: 1.0108, test_f1: 0.6270
 epoch: 95, train_loss: 0.4936, test_loss: 1.2586, test_f1: 0.6064
 epoch: 96, train_loss: 0.4726, test_loss: 1.0494, test_f1: 0.6376
 epoch: 97, train_loss: 0.4847, test_loss: 1.1847, test_f1: 0.6464
 epoch: 98, train_loss: 0.4963, test_loss: 0.9473, test_f1: 0.6657
 epoch: 99, train_loss: 0.4973, test_loss: 1.0602, test_f1: 0.6293
##################ITERATION #7 ****************************************
 epoch: 0, train_loss: 1.1970, test_loss: 1.0919, test_f1: 0.4319
 epoch: 1, train_loss: 1.0233, test_loss: 1.0688, test_f1: 0.4165
 epoch: 2, train_loss: 0.9859, test_loss: 0.9871, test_f1: 0.4749
 epoch: 3, train_loss: 0.9610, test_loss: 0.9490, test_f1: 0.5236
 epoch: 4, train_loss: 0.9599, test_loss: 0.9936, test_f1: 0.4502
 epoch: 5, train_loss: 0.9259, test_loss: 1.0101, test_f1: 0.4871
 epoch: 6, train_loss: 0.9221, test_loss: 0.9976, test_f1: 0.5253
 epoch: 7, train_loss: 0.9099, test_loss: 1.0215, test_f1: 0.4576
 epoch: 8, train_loss: 0.9012, test_loss: 0.9744, test_f1: 0.4583
 epoch: 9, train_loss: 0.8784, test_loss: 0.9612, test_f1: 0.5331
 epoch: 10, train_loss: 0.8821, test_loss: 1.1011, test_f1: 0.4692
 epoch: 11, train_loss: 0.8629, test_loss: 0.8940, test_f1: 0.5301
 epoch: 12, train_loss: 0.8583, test_loss: 1.1241, test_f1: 0.4525
 epoch: 13, train_loss: 0.8512, test_loss: 0.8716, test_f1: 0.5630
 epoch: 14, train_loss: 0.8378, test_loss: 0.8969, test_f1: 0.5918
 epoch: 15, train_loss: 0.8467, test_loss: 0.8919, test_f1: 0.5989
 epoch: 16, train_loss: 0.8221, test_loss: 0.9732, test_f1: 0.5128
 epoch: 17, train_loss: 0.8083, test_loss: 0.8367, test_f1: 0.5774
 epoch: 18, train_loss: 0.8150, test_loss: 0.9874, test_f1: 0.4284
 epoch: 19, train_loss: 0.8013, test_loss: 0.8189, test_f1: 0.5724
 epoch: 20, train_loss: 0.7853, test_loss: 0.8582, test_f1: 0.5657
 epoch: 21, train_loss: 0.7870, test_loss: 0.9476, test_f1: 0.4744
 epoch: 22, train_loss: 0.7746, test_loss: 0.8950, test_f1: 0.5366
 epoch: 23, train_loss: 0.7769, test_loss: 0.9754, test_f1: 0.5441
 epoch: 24, train_loss: 0.8008, test_loss: 0.8743, test_f1: 0.5267
 epoch: 25, train_loss: 0.7828, test_loss: 0.9233, test_f1: 0.5220
 epoch: 26, train_loss: 0.7578, test_loss: 0.9952, test_f1: 0.5333
 epoch: 27, train_loss: 0.7604, test_loss: 0.9344, test_f1: 0.5658
 epoch: 28, train_loss: 0.7596, test_loss: 0.8633, test_f1: 0.5629
 epoch: 29, train_loss: 0.7340, test_loss: 0.9494, test_f1: 0.5710
 epoch: 30, train_loss: 0.7237, test_loss: 0.9250, test_f1: 0.5632
 epoch: 31, train_loss: 0.7184, test_loss: 0.8938, test_f1: 0.5616
 epoch: 32, train_loss: 0.7233, test_loss: 0.8377, test_f1: 0.5787
 epoch: 33, train_loss: 0.7295, test_loss: 1.0238, test_f1: 0.5350
 epoch: 34, train_loss: 0.6992, test_loss: 0.8658, test_f1: 0.5944
 epoch: 35, train_loss: 0.7034, test_loss: 0.9564, test_f1: 0.6111
 epoch: 36, train_loss: 0.7171, test_loss: 0.8861, test_f1: 0.6126
 epoch: 37, train_loss: 0.7329, test_loss: 0.9382, test_f1: 0.5549
 epoch: 38, train_loss: 0.7230, test_loss: 0.8777, test_f1: 0.5520
 epoch: 39, train_loss: 0.7126, test_loss: 0.9464, test_f1: 0.5601
 epoch: 40, train_loss: 0.6953, test_loss: 1.0741, test_f1: 0.5249
 epoch: 41, train_loss: 0.6988, test_loss: 0.9504, test_f1: 0.5835
 epoch: 42, train_loss: 0.7088, test_loss: 0.9566, test_f1: 0.6049
 epoch: 43, train_loss: 0.7206, test_loss: 0.8841, test_f1: 0.5789
 epoch: 44, train_loss: 0.7119, test_loss: 0.9680, test_f1: 0.5674
 epoch: 45, train_loss: 0.6919, test_loss: 0.8345, test_f1: 0.6256
 epoch: 46, train_loss: 0.6875, test_loss: 1.1241, test_f1: 0.5654
 epoch: 47, train_loss: 0.6774, test_loss: 0.9060, test_f1: 0.5966
 epoch: 48, train_loss: 0.6672, test_loss: 0.9681, test_f1: 0.6129
 epoch: 49, train_loss: 0.6615, test_loss: 1.1534, test_f1: 0.6136
 epoch: 50, train_loss: 0.6915, test_loss: 0.8640, test_f1: 0.6180
 epoch: 51, train_loss: 0.6375, test_loss: 0.9410, test_f1: 0.6289
 epoch: 52, train_loss: 0.6151, test_loss: 0.8825, test_f1: 0.6526
 epoch: 53, train_loss: 0.6116, test_loss: 0.8823, test_f1: 0.6358
 epoch: 54, train_loss: 0.6107, test_loss: 0.9686, test_f1: 0.6375
 epoch: 55, train_loss: 0.5965, test_loss: 0.9968, test_f1: 0.6294
 epoch: 56, train_loss: 0.6053, test_loss: 1.0372, test_f1: 0.6312
 epoch: 57, train_loss: 0.5981, test_loss: 1.0465, test_f1: 0.6096
 epoch: 58, train_loss: 0.5930, test_loss: 0.9264, test_f1: 0.6049
 epoch: 59, train_loss: 0.5903, test_loss: 1.0902, test_f1: 0.5884
 epoch: 60, train_loss: 0.5770, test_loss: 1.0750, test_f1: 0.6002
 epoch: 61, train_loss: 0.5773, test_loss: 0.9051, test_f1: 0.6261
 epoch: 62, train_loss: 0.5698, test_loss: 0.9407, test_f1: 0.6455
 epoch: 63, train_loss: 0.5570, test_loss: 1.0487, test_f1: 0.6296
 epoch: 64, train_loss: 0.5446, test_loss: 1.1780, test_f1: 0.6033
 epoch: 65, train_loss: 0.5847, test_loss: 0.9536, test_f1: 0.6263
 epoch: 66, train_loss: 0.5683, test_loss: 0.9204, test_f1: 0.6460
 epoch: 67, train_loss: 0.5758, test_loss: 1.1474, test_f1: 0.6050
 epoch: 68, train_loss: 0.5571, test_loss: 0.9691, test_f1: 0.6474
 epoch: 69, train_loss: 0.5569, test_loss: 1.0095, test_f1: 0.6387
 epoch: 70, train_loss: 0.5586, test_loss: 0.9433, test_f1: 0.6351
 epoch: 71, train_loss: 0.5473, test_loss: 1.0143, test_f1: 0.6082
 epoch: 72, train_loss: 0.5551, test_loss: 1.1611, test_f1: 0.6234
 epoch: 73, train_loss: 0.5290, test_loss: 1.1294, test_f1: 0.6305
 epoch: 74, train_loss: 0.5670, test_loss: 0.9877, test_f1: 0.6481
 epoch: 75, train_loss: 0.5384, test_loss: 1.1301, test_f1: 0.6263
 epoch: 76, train_loss: 0.5319, test_loss: 1.0573, test_f1: 0.6289
 epoch: 77, train_loss: 0.5374, test_loss: 1.0976, test_f1: 0.6355
 epoch: 78, train_loss: 0.5188, test_loss: 1.2090, test_f1: 0.6246
 epoch: 79, train_loss: 0.5348, test_loss: 1.1315, test_f1: 0.6596
 epoch: 80, train_loss: 0.5446, test_loss: 1.2065, test_f1: 0.5714
 epoch: 81, train_loss: 0.5388, test_loss: 1.0053, test_f1: 0.6201
 epoch: 82, train_loss: 0.5275, test_loss: 1.0492, test_f1: 0.6202
 epoch: 83, train_loss: 0.5168, test_loss: 1.0575, test_f1: 0.6329
 epoch: 84, train_loss: 0.5176, test_loss: 0.9206, test_f1: 0.6475
 epoch: 85, train_loss: 0.5165, test_loss: 1.2598, test_f1: 0.5968
 epoch: 86, train_loss: 0.5250, test_loss: 1.0217, test_f1: 0.6459
 epoch: 87, train_loss: 0.5146, test_loss: 1.3177, test_f1: 0.5369
 epoch: 88, train_loss: 0.5131, test_loss: 0.9815, test_f1: 0.6190
 epoch: 89, train_loss: 0.4939, test_loss: 0.9695, test_f1: 0.6466
 epoch: 90, train_loss: 0.5082, test_loss: 1.0619, test_f1: 0.6373
 epoch: 91, train_loss: 0.4840, test_loss: 1.0366, test_f1: 0.6096
 epoch: 92, train_loss: 0.4899, test_loss: 1.1039, test_f1: 0.6021
 epoch: 93, train_loss: 0.4952, test_loss: 1.1109, test_f1: 0.6401
 epoch: 94, train_loss: 0.5093, test_loss: 1.0921, test_f1: 0.6147
 epoch: 95, train_loss: 0.5114, test_loss: 1.1555, test_f1: 0.6253
 epoch: 96, train_loss: 0.4689, test_loss: 1.1915, test_f1: 0.5997
 epoch: 97, train_loss: 0.4767, test_loss: 1.0583, test_f1: 0.6313
 epoch: 98, train_loss: 0.4863, test_loss: 1.1233, test_f1: 0.6529
 epoch: 99, train_loss: 0.4945, test_loss: 1.1209, test_f1: 0.6337
##################ITERATION #8 ****************************************
 epoch: 0, train_loss: 1.1833, test_loss: 1.1493, test_f1: 0.4102
 epoch: 1, train_loss: 1.0756, test_loss: 1.0352, test_f1: 0.4299
 epoch: 2, train_loss: 1.0108, test_loss: 1.0073, test_f1: 0.4524
 epoch: 3, train_loss: 0.9854, test_loss: 1.2032, test_f1: 0.4517
 epoch: 4, train_loss: 0.9867, test_loss: 1.1164, test_f1: 0.4697
 epoch: 5, train_loss: 0.9500, test_loss: 0.9724, test_f1: 0.5000
 epoch: 6, train_loss: 0.9266, test_loss: 1.1067, test_f1: 0.4278
 epoch: 7, train_loss: 0.9474, test_loss: 1.0025, test_f1: 0.5649
 epoch: 8, train_loss: 0.9369, test_loss: 0.9925, test_f1: 0.4661
 epoch: 9, train_loss: 0.8900, test_loss: 0.9169, test_f1: 0.5176
 epoch: 10, train_loss: 0.8774, test_loss: 0.8525, test_f1: 0.5243
 epoch: 11, train_loss: 0.8847, test_loss: 0.9041, test_f1: 0.5420
 epoch: 12, train_loss: 0.8573, test_loss: 0.8989, test_f1: 0.5394
 epoch: 13, train_loss: 0.8728, test_loss: 0.8793, test_f1: 0.5404
 epoch: 14, train_loss: 0.8514, test_loss: 0.9260, test_f1: 0.5034
 epoch: 15, train_loss: 0.8204, test_loss: 1.0361, test_f1: 0.5463
 epoch: 16, train_loss: 0.8207, test_loss: 0.8975, test_f1: 0.5353
 epoch: 17, train_loss: 0.8168, test_loss: 0.8269, test_f1: 0.5777
 epoch: 18, train_loss: 0.8000, test_loss: 0.9849, test_f1: 0.5678
 epoch: 19, train_loss: 0.7897, test_loss: 1.1142, test_f1: 0.5173
 epoch: 20, train_loss: 0.7971, test_loss: 0.9745, test_f1: 0.5652
 epoch: 21, train_loss: 0.7966, test_loss: 0.8317, test_f1: 0.5629
 epoch: 22, train_loss: 0.7996, test_loss: 0.9640, test_f1: 0.5427
 epoch: 23, train_loss: 0.7755, test_loss: 0.8489, test_f1: 0.5795
 epoch: 24, train_loss: 0.7777, test_loss: 1.0994, test_f1: 0.5363
 epoch: 25, train_loss: 0.7447, test_loss: 0.8405, test_f1: 0.5638
 epoch: 26, train_loss: 0.7904, test_loss: 0.8266, test_f1: 0.6276
 epoch: 27, train_loss: 0.7694, test_loss: 0.8158, test_f1: 0.6349
 epoch: 28, train_loss: 0.7402, test_loss: 0.9076, test_f1: 0.5605
 epoch: 29, train_loss: 0.7635, test_loss: 0.8774, test_f1: 0.5679
 epoch: 30, train_loss: 0.7504, test_loss: 0.8672, test_f1: 0.5955
 epoch: 31, train_loss: 0.7173, test_loss: 0.8768, test_f1: 0.6272
 epoch: 32, train_loss: 0.7183, test_loss: 0.8178, test_f1: 0.5964
 epoch: 33, train_loss: 0.7387, test_loss: 0.8837, test_f1: 0.6101
 epoch: 34, train_loss: 0.7334, test_loss: 1.0032, test_f1: 0.5833
 epoch: 35, train_loss: 0.7176, test_loss: 0.8959, test_f1: 0.5731
 epoch: 36, train_loss: 0.7016, test_loss: 0.8528, test_f1: 0.5980
 epoch: 37, train_loss: 0.6855, test_loss: 0.8124, test_f1: 0.6277
 epoch: 38, train_loss: 0.7135, test_loss: 1.0380, test_f1: 0.5544
 epoch: 39, train_loss: 0.6892, test_loss: 0.8482, test_f1: 0.6042
 epoch: 40, train_loss: 0.6902, test_loss: 0.8714, test_f1: 0.6145
 epoch: 41, train_loss: 0.6726, test_loss: 0.9107, test_f1: 0.5750
 epoch: 42, train_loss: 0.6802, test_loss: 0.9514, test_f1: 0.5827
 epoch: 43, train_loss: 0.6886, test_loss: 0.8881, test_f1: 0.6187
 epoch: 44, train_loss: 0.6787, test_loss: 0.8367, test_f1: 0.6486
 epoch: 45, train_loss: 0.6878, test_loss: 0.9555, test_f1: 0.5927
 epoch: 46, train_loss: 0.6550, test_loss: 1.0825, test_f1: 0.5867
 epoch: 47, train_loss: 0.6661, test_loss: 0.9883, test_f1: 0.5708
 epoch: 48, train_loss: 0.6507, test_loss: 0.8486, test_f1: 0.5904
 epoch: 49, train_loss: 0.6562, test_loss: 1.0574, test_f1: 0.6158
 epoch: 50, train_loss: 0.6485, test_loss: 0.9022, test_f1: 0.5870
 epoch: 51, train_loss: 0.6145, test_loss: 0.8096, test_f1: 0.6440
 epoch: 52, train_loss: 0.5994, test_loss: 0.8937, test_f1: 0.6311
 epoch: 53, train_loss: 0.5891, test_loss: 1.0597, test_f1: 0.5926
 epoch: 54, train_loss: 0.5854, test_loss: 0.9819, test_f1: 0.6105
 epoch: 55, train_loss: 0.5768, test_loss: 0.9740, test_f1: 0.6196
 epoch: 56, train_loss: 0.5761, test_loss: 0.8649, test_f1: 0.6409
 epoch: 57, train_loss: 0.5826, test_loss: 0.9062, test_f1: 0.6141
 epoch: 58, train_loss: 0.5524, test_loss: 0.8612, test_f1: 0.6262
 epoch: 59, train_loss: 0.5567, test_loss: 0.9419, test_f1: 0.6251
 epoch: 60, train_loss: 0.5563, test_loss: 0.8464, test_f1: 0.6336
 epoch: 61, train_loss: 0.5690, test_loss: 0.9438, test_f1: 0.6392
 epoch: 62, train_loss: 0.5515, test_loss: 0.9080, test_f1: 0.6286
 epoch: 63, train_loss: 0.5509, test_loss: 0.9569, test_f1: 0.6301
 epoch: 64, train_loss: 0.5479, test_loss: 1.0170, test_f1: 0.6527
 epoch: 65, train_loss: 0.5342, test_loss: 0.8820, test_f1: 0.6422
 epoch: 66, train_loss: 0.5335, test_loss: 0.8605, test_f1: 0.6289
 epoch: 67, train_loss: 0.5430, test_loss: 1.2085, test_f1: 0.6010
 epoch: 68, train_loss: 0.5316, test_loss: 1.2525, test_f1: 0.5998
 epoch: 69, train_loss: 0.5364, test_loss: 1.1716, test_f1: 0.6173
 epoch: 70, train_loss: 0.5258, test_loss: 0.9217, test_f1: 0.6572
 epoch: 71, train_loss: 0.5218, test_loss: 1.1340, test_f1: 0.6120
 epoch: 72, train_loss: 0.5234, test_loss: 0.9902, test_f1: 0.6552
 epoch: 73, train_loss: 0.4989, test_loss: 0.9732, test_f1: 0.6643
 epoch: 74, train_loss: 0.5252, test_loss: 0.9230, test_f1: 0.6382
 epoch: 75, train_loss: 0.5161, test_loss: 0.9485, test_f1: 0.6357
 epoch: 76, train_loss: 0.5065, test_loss: 1.1108, test_f1: 0.6485
 epoch: 77, train_loss: 0.5127, test_loss: 1.0341, test_f1: 0.6594
 epoch: 78, train_loss: 0.4930, test_loss: 0.9465, test_f1: 0.6477
 epoch: 79, train_loss: 0.5070, test_loss: 1.1196, test_f1: 0.6357
 epoch: 80, train_loss: 0.5179, test_loss: 1.0354, test_f1: 0.6476
 epoch: 81, train_loss: 0.4892, test_loss: 1.1160, test_f1: 0.6218
 epoch: 82, train_loss: 0.4729, test_loss: 0.9840, test_f1: 0.6456
 epoch: 83, train_loss: 0.4607, test_loss: 1.1305, test_f1: 0.6651
 epoch: 84, train_loss: 0.4588, test_loss: 1.1885, test_f1: 0.6464
 epoch: 85, train_loss: 0.4933, test_loss: 1.0225, test_f1: 0.6463
 epoch: 86, train_loss: 0.5012, test_loss: 1.2956, test_f1: 0.6268
 epoch: 87, train_loss: 0.5108, test_loss: 1.1057, test_f1: 0.6427
 epoch: 88, train_loss: 0.4626, test_loss: 0.9964, test_f1: 0.6572
 epoch: 89, train_loss: 0.4547, test_loss: 1.0810, test_f1: 0.6557
 epoch: 90, train_loss: 0.4678, test_loss: 1.1366, test_f1: 0.6555
 epoch: 91, train_loss: 0.4513, test_loss: 1.1011, test_f1: 0.6240
 epoch: 92, train_loss: 0.4402, test_loss: 1.0599, test_f1: 0.6449
 epoch: 93, train_loss: 0.4381, test_loss: 1.2961, test_f1: 0.5805
 epoch: 94, train_loss: 0.5076, test_loss: 1.0292, test_f1: 0.6454
 epoch: 95, train_loss: 0.4818, test_loss: 1.1519, test_f1: 0.6557
 epoch: 96, train_loss: 0.4642, test_loss: 1.1523, test_f1: 0.6371
 epoch: 97, train_loss: 0.4627, test_loss: 0.9982, test_f1: 0.6379
 epoch: 98, train_loss: 0.4435, test_loss: 1.0862, test_f1: 0.6419
 epoch: 99, train_loss: 0.4561, test_loss: 1.0430, test_f1: 0.6317
##################ITERATION #9 ****************************************
 epoch: 0, train_loss: 1.1793, test_loss: 1.0917, test_f1: 0.4896
 epoch: 1, train_loss: 1.0509, test_loss: 1.0949, test_f1: 0.4931
 epoch: 2, train_loss: 1.0026, test_loss: 1.1017, test_f1: 0.4293
 epoch: 3, train_loss: 0.9918, test_loss: 1.3619, test_f1: 0.3940
 epoch: 4, train_loss: 0.9998, test_loss: 1.8333, test_f1: 0.2123
 epoch: 5, train_loss: 0.9749, test_loss: 1.0694, test_f1: 0.4787
 epoch: 6, train_loss: 0.9354, test_loss: 1.0419, test_f1: 0.4961
 epoch: 7, train_loss: 0.9460, test_loss: 1.0727, test_f1: 0.4838
 epoch: 8, train_loss: 0.9221, test_loss: 1.3761, test_f1: 0.4280
 epoch: 9, train_loss: 0.9130, test_loss: 0.9471, test_f1: 0.5182
 epoch: 10, train_loss: 0.9145, test_loss: 1.1877, test_f1: 0.4915
 epoch: 11, train_loss: 0.8943, test_loss: 1.0492, test_f1: 0.5086
 epoch: 12, train_loss: 0.8626, test_loss: 1.0062, test_f1: 0.4942
 epoch: 13, train_loss: 0.8803, test_loss: 0.9927, test_f1: 0.5596
 epoch: 14, train_loss: 0.8641, test_loss: 0.9916, test_f1: 0.5334
 epoch: 15, train_loss: 0.8579, test_loss: 1.0406, test_f1: 0.5128
 epoch: 16, train_loss: 0.8463, test_loss: 0.8947, test_f1: 0.5505
 epoch: 17, train_loss: 0.8323, test_loss: 0.9749, test_f1: 0.5331
 epoch: 18, train_loss: 0.8298, test_loss: 0.9105, test_f1: 0.5033
 epoch: 19, train_loss: 0.8227, test_loss: 0.9569, test_f1: 0.5281
 epoch: 20, train_loss: 0.8234, test_loss: 0.9060, test_f1: 0.5049
 epoch: 21, train_loss: 0.8216, test_loss: 0.9987, test_f1: 0.5168
 epoch: 22, train_loss: 0.7930, test_loss: 0.8956, test_f1: 0.5157
 epoch: 23, train_loss: 0.7880, test_loss: 0.9005, test_f1: 0.5147
 epoch: 24, train_loss: 0.7782, test_loss: 0.9376, test_f1: 0.5246
 epoch: 25, train_loss: 0.7870, test_loss: 0.8347, test_f1: 0.5712
 epoch: 26, train_loss: 0.7876, test_loss: 0.9041, test_f1: 0.6099
 epoch: 27, train_loss: 0.7697, test_loss: 0.8933, test_f1: 0.5875
 epoch: 28, train_loss: 0.7568, test_loss: 1.0739, test_f1: 0.5376
 epoch: 29, train_loss: 0.7788, test_loss: 0.9137, test_f1: 0.5117
 epoch: 30, train_loss: 0.7711, test_loss: 0.9154, test_f1: 0.5315
 epoch: 31, train_loss: 0.7759, test_loss: 0.8985, test_f1: 0.5775
 epoch: 32, train_loss: 0.7643, test_loss: 0.8524, test_f1: 0.5337
 epoch: 33, train_loss: 0.7461, test_loss: 0.8698, test_f1: 0.5860
 epoch: 34, train_loss: 0.7323, test_loss: 0.9924, test_f1: 0.5567
 epoch: 35, train_loss: 0.7582, test_loss: 0.8788, test_f1: 0.5737
 epoch: 36, train_loss: 0.7296, test_loss: 0.9263, test_f1: 0.6170
 epoch: 37, train_loss: 0.7180, test_loss: 1.0197, test_f1: 0.5582
 epoch: 38, train_loss: 0.7322, test_loss: 0.9307, test_f1: 0.6246
 epoch: 39, train_loss: 0.7162, test_loss: 0.9584, test_f1: 0.5632
 epoch: 40, train_loss: 0.7282, test_loss: 0.9100, test_f1: 0.5769
 epoch: 41, train_loss: 0.6976, test_loss: 1.0409, test_f1: 0.5411
 epoch: 42, train_loss: 0.6959, test_loss: 0.9277, test_f1: 0.5945
 epoch: 43, train_loss: 0.6992, test_loss: 1.0053, test_f1: 0.5632
 epoch: 44, train_loss: 0.7089, test_loss: 0.9132, test_f1: 0.6329
 epoch: 45, train_loss: 0.6705, test_loss: 1.0420, test_f1: 0.6179
 epoch: 46, train_loss: 0.6802, test_loss: 0.9218, test_f1: 0.6335
 epoch: 47, train_loss: 0.6726, test_loss: 0.9247, test_f1: 0.6035
 epoch: 48, train_loss: 0.6599, test_loss: 1.0486, test_f1: 0.6431
 epoch: 49, train_loss: 0.6698, test_loss: 0.9011, test_f1: 0.6628
 epoch: 50, train_loss: 0.6580, test_loss: 0.8775, test_f1: 0.6329
 epoch: 51, train_loss: 0.6217, test_loss: 0.8631, test_f1: 0.6648
 epoch: 52, train_loss: 0.5982, test_loss: 0.9112, test_f1: 0.6744
 epoch: 53, train_loss: 0.5945, test_loss: 0.8945, test_f1: 0.6381
 epoch: 54, train_loss: 0.5891, test_loss: 0.9143, test_f1: 0.6404
 epoch: 55, train_loss: 0.5707, test_loss: 0.9506, test_f1: 0.6650
 epoch: 56, train_loss: 0.5658, test_loss: 0.9255, test_f1: 0.6454
 epoch: 57, train_loss: 0.5764, test_loss: 0.9560, test_f1: 0.6569
 epoch: 58, train_loss: 0.5724, test_loss: 1.0105, test_f1: 0.6461
 epoch: 59, train_loss: 0.5646, test_loss: 1.1926, test_f1: 0.6370
 epoch: 60, train_loss: 0.5601, test_loss: 0.8996, test_f1: 0.6212
 epoch: 61, train_loss: 0.5476, test_loss: 1.0151, test_f1: 0.6214
 epoch: 62, train_loss: 0.5758, test_loss: 0.9869, test_f1: 0.6587
 epoch: 63, train_loss: 0.5508, test_loss: 0.9393, test_f1: 0.6343
 epoch: 64, train_loss: 0.5423, test_loss: 0.9323, test_f1: 0.6596
 epoch: 65, train_loss: 0.5493, test_loss: 0.9322, test_f1: 0.6420
 epoch: 66, train_loss: 0.5381, test_loss: 0.9581, test_f1: 0.6446
 epoch: 67, train_loss: 0.5300, test_loss: 0.8731, test_f1: 0.6597
 epoch: 68, train_loss: 0.5398, test_loss: 0.9250, test_f1: 0.6441
 epoch: 69, train_loss: 0.5151, test_loss: 0.9955, test_f1: 0.6269
 epoch: 70, train_loss: 0.5136, test_loss: 0.9268, test_f1: 0.6709
 epoch: 71, train_loss: 0.5434, test_loss: 0.9965, test_f1: 0.6284
 epoch: 72, train_loss: 0.5097, test_loss: 0.9172, test_f1: 0.6480
 epoch: 73, train_loss: 0.5407, test_loss: 0.9976, test_f1: 0.6474
 epoch: 74, train_loss: 0.5327, test_loss: 0.9321, test_f1: 0.6631
 epoch: 75, train_loss: 0.5183, test_loss: 0.8782, test_f1: 0.6749
 epoch: 76, train_loss: 0.5082, test_loss: 0.9680, test_f1: 0.6659
 epoch: 77, train_loss: 0.5153, test_loss: 0.8950, test_f1: 0.6428
 epoch: 78, train_loss: 0.5042, test_loss: 1.1231, test_f1: 0.6122
 epoch: 79, train_loss: 0.4918, test_loss: 0.9436, test_f1: 0.6493
 epoch: 80, train_loss: 0.4924, test_loss: 0.8193, test_f1: 0.6387
 epoch: 81, train_loss: 0.5168, test_loss: 0.9173, test_f1: 0.6291
 epoch: 82, train_loss: 0.5128, test_loss: 0.9152, test_f1: 0.6633
 epoch: 83, train_loss: 0.4695, test_loss: 1.0084, test_f1: 0.6721
 epoch: 84, train_loss: 0.4865, test_loss: 1.0286, test_f1: 0.6858
 epoch: 85, train_loss: 0.4658, test_loss: 1.0183, test_f1: 0.6647
 epoch: 86, train_loss: 0.4853, test_loss: 1.0549, test_f1: 0.6453
 epoch: 87, train_loss: 0.4827, test_loss: 0.9891, test_f1: 0.6531
 epoch: 88, train_loss: 0.4836, test_loss: 0.9746, test_f1: 0.6671
 epoch: 89, train_loss: 0.4866, test_loss: 0.8884, test_f1: 0.6722
 epoch: 90, train_loss: 0.4991, test_loss: 0.8240, test_f1: 0.6596
 epoch: 91, train_loss: 0.4586, test_loss: 0.9713, test_f1: 0.6517
 epoch: 92, train_loss: 0.4640, test_loss: 0.9630, test_f1: 0.6695
 epoch: 93, train_loss: 0.4644, test_loss: 0.9530, test_f1: 0.6367
 epoch: 94, train_loss: 0.4545, test_loss: 0.9294, test_f1: 0.6767
 epoch: 95, train_loss: 0.4905, test_loss: 0.8961, test_f1: 0.6676
 epoch: 96, train_loss: 0.4520, test_loss: 0.9797, test_f1: 0.6729
 epoch: 97, train_loss: 0.4690, test_loss: 0.9625, test_f1: 0.6559
 epoch: 98, train_loss: 0.4686, test_loss: 0.8721, test_f1: 0.6756
 epoch: 99, train_loss: 0.4565, test_loss: 0.9227, test_f1: 0.6794

Training completed in 880.91 seconds
Best F1: 0.7098 at epoch 86
Mean F1 across iterations: 0.6813  0.0149
========================FINAL RESULTS================================
FEGIN weighted F1: 0.7098  0.0149
python main.py --data ltspice_examples --representation component_pin --model FEGIN --layers 6 --hiddens 64 --batch_size 64 --lr 0.01 --emb_size 250 --epochs 100 --save_appendix component_pin_L6_H64_BS64_LR0.01_E250 --no_val
-----



STDERR:
  File "main.py", line 370, in <module>
    main()
  File "main.py", line 254, in main
    dataset = dataset_class(
  File "/home/philip/projects/ltspice_examples_code_repo/Circuit-Completion-Using-GNNs/component_classification_with_link_prediction_head/evaluation/FEGIN/kernel/circuit_datasets.py", line 15, in __init__
    self.data, self.slices = torch.load(self.processed_paths[0])
  File "/home/philip/.local/lib/python3.8/site-packages/torch/serialization.py", line 1040, in load
    warnings.warn(
  File "/usr/lib/python3.8/warnings.py", line 109, in _showwarnmsg
    sw(msg.message, msg.category, msg.filename, msg.lineno,
  File "main.py", line 47, in warn_with_traceback
    traceback.print_stack(file=log)
/home/philip/projects/ltspice_examples_code_repo/Circuit-Completion-Using-GNNs/component_classification_with_link_prediction_head/evaluation/FEGIN/kernel/circuit_datasets.py:15: FutureWarning: You are using `torch.load` with `weights_only=False` (the current default value), which uses the default pickle module implicitly. It is possible to construct malicious pickle data which will execute arbitrary code during unpickling (See https://github.com/pytorch/pytorch/blob/main/SECURITY.md#untrusted-models for more details). In a future release, the default value for `weights_only` will be flipped to `True`. This limits the functions that could be executed during unpickling. Arbitrary objects will no longer be allowed to be loaded via this mode unless they are explicitly allowlisted by the user via `torch.serialization.add_safe_globals`. We recommend you start setting `weights_only=True` for any use case where you don't have full control of the loaded file. Please open an issue on GitHub for any issues related to this experimental feature.
  self.data, self.slices = torch.load(self.processed_paths[0])
