STDOUT:
Results will be saved in /home/philip/projects/ltspice_examples_code_repo/Circuit-Completion-Using-GNNs/component_classification_with_link_prediction_head/evaluation/FEGIN/results/model_FEGIN_dataset_ltspice_demos
Command line input: python main.py --data ltspice_demos --representation component_pin_net --model FEGIN --layers 3 --hiddens 32 --batch_size 256 --lr 0.1 --emb_size 128 --epochs 100 --save_appendix component_pin_net_L3_H32_BS256_LR0.1_E128 --no_val
 is saved.
-----
ltspice_demos - FEGIN
Using 3 layers, 32 hidden units, h = 2
Loading component_pin_net representation dataset
ENTERED
Training FEGIN on component_pin_net representation
Train: 1565, Test: 383
##################ITERATION #0 ****************************************
 epoch: 0, train_loss: 1.7342, test_loss: 1.3076, test_f1: 0.2281
 epoch: 1, train_loss: 1.1646, test_loss: 1.3047, test_f1: 0.2281
 epoch: 2, train_loss: 1.1812, test_loss: 1.3352, test_f1: 0.2281
 epoch: 3, train_loss: 1.1269, test_loss: 1.3704, test_f1: 0.2281
 epoch: 4, train_loss: 1.1467, test_loss: 1.3123, test_f1: 0.2491
 epoch: 5, train_loss: 1.1085, test_loss: 1.1446, test_f1: 0.3290
 epoch: 6, train_loss: 1.0893, test_loss: 1.1462, test_f1: 0.3290
 epoch: 7, train_loss: 1.0997, test_loss: 1.1505, test_f1: 0.3290
 epoch: 8, train_loss: 1.0979, test_loss: 1.1531, test_f1: 0.3290
 epoch: 9, train_loss: 1.0715, test_loss: 1.1591, test_f1: 0.3290
 epoch: 10, train_loss: 1.0567, test_loss: 1.1677, test_f1: 0.3290
 epoch: 11, train_loss: 1.0806, test_loss: 1.1633, test_f1: 0.3290
 epoch: 12, train_loss: 1.0574, test_loss: 1.1196, test_f1: 0.3395
 epoch: 13, train_loss: 1.0717, test_loss: 1.1489, test_f1: 0.3290
 epoch: 14, train_loss: 1.0807, test_loss: 1.1539, test_f1: 0.3290
 epoch: 15, train_loss: 1.0740, test_loss: 1.1504, test_f1: 0.3290
 epoch: 16, train_loss: 1.0595, test_loss: 1.1582, test_f1: 0.3290
 epoch: 17, train_loss: 1.0696, test_loss: 1.1573, test_f1: 0.3290
 epoch: 18, train_loss: 1.0779, test_loss: 1.1554, test_f1: 0.3290
 epoch: 19, train_loss: 1.0743, test_loss: 1.1682, test_f1: 0.3234
 epoch: 20, train_loss: 1.1030, test_loss: 1.1475, test_f1: 0.3290
 epoch: 21, train_loss: 1.0879, test_loss: 1.1494, test_f1: 0.3290
 epoch: 22, train_loss: 1.0728, test_loss: 1.1535, test_f1: 0.3290
 epoch: 23, train_loss: 1.0724, test_loss: 1.1570, test_f1: 0.3290
 epoch: 24, train_loss: 1.0773, test_loss: 1.1580, test_f1: 0.3290
 epoch: 25, train_loss: 1.0704, test_loss: 1.1477, test_f1: 0.3290
 epoch: 26, train_loss: 1.0727, test_loss: 1.1483, test_f1: 0.3290
 epoch: 27, train_loss: 1.0681, test_loss: 1.1515, test_f1: 0.3290
 epoch: 28, train_loss: 1.0690, test_loss: 1.1557, test_f1: 0.3290
 epoch: 29, train_loss: 1.0677, test_loss: 1.1534, test_f1: 0.3290
 epoch: 30, train_loss: 1.0634, test_loss: 1.1516, test_f1: 0.3290
 epoch: 31, train_loss: 1.0616, test_loss: 1.1498, test_f1: 0.3290
 epoch: 32, train_loss: 1.0793, test_loss: 1.1239, test_f1: 0.2432
 epoch: 33, train_loss: 1.1892, test_loss: 1.3470, test_f1: 0.2281
 epoch: 34, train_loss: 1.2351, test_loss: 1.3080, test_f1: 0.2281
 epoch: 35, train_loss: 1.4530, test_loss: 1.3028, test_f1: 0.2281
 epoch: 36, train_loss: 1.2529, test_loss: 1.3026, test_f1: 0.2281
 epoch: 37, train_loss: 1.2526, test_loss: 1.3077, test_f1: 0.2281
 epoch: 38, train_loss: 1.2536, test_loss: 1.3125, test_f1: 0.2281
 epoch: 39, train_loss: 1.2551, test_loss: 1.3118, test_f1: 0.2281
 epoch: 40, train_loss: 1.2533, test_loss: 1.3044, test_f1: 0.2281
 epoch: 41, train_loss: 1.2524, test_loss: 1.3042, test_f1: 0.2281
 epoch: 42, train_loss: 1.2527, test_loss: 1.3062, test_f1: 0.2281
 epoch: 43, train_loss: 1.2524, test_loss: 1.3054, test_f1: 0.2281
 epoch: 44, train_loss: 1.2524, test_loss: 1.3057, test_f1: 0.2281
 epoch: 45, train_loss: 1.2521, test_loss: 1.3087, test_f1: 0.2281
 epoch: 46, train_loss: 1.2531, test_loss: 1.3049, test_f1: 0.2281
 epoch: 47, train_loss: 1.2527, test_loss: 1.3005, test_f1: 0.2281
 epoch: 48, train_loss: 1.2548, test_loss: 1.3047, test_f1: 0.2281
 epoch: 49, train_loss: 1.2529, test_loss: 1.3064, test_f1: 0.2281
 epoch: 50, train_loss: 1.2526, test_loss: 1.3079, test_f1: 0.2281
 epoch: 51, train_loss: 1.2525, test_loss: 1.3077, test_f1: 0.2281
 epoch: 52, train_loss: 1.2524, test_loss: 1.3063, test_f1: 0.2281
 epoch: 53, train_loss: 1.2522, test_loss: 1.3071, test_f1: 0.2281
 epoch: 54, train_loss: 1.2521, test_loss: 1.3069, test_f1: 0.2281
 epoch: 55, train_loss: 1.2524, test_loss: 1.3067, test_f1: 0.2281
 epoch: 56, train_loss: 1.2524, test_loss: 1.3048, test_f1: 0.2281
 epoch: 57, train_loss: 1.2521, test_loss: 1.3040, test_f1: 0.2281
 epoch: 58, train_loss: 1.2523, test_loss: 1.3040, test_f1: 0.2281
 epoch: 59, train_loss: 1.2524, test_loss: 1.3032, test_f1: 0.2281
 epoch: 60, train_loss: 1.2521, test_loss: 1.3060, test_f1: 0.2281
 epoch: 61, train_loss: 1.2524, test_loss: 1.3072, test_f1: 0.2281
 epoch: 62, train_loss: 1.2525, test_loss: 1.3067, test_f1: 0.2281
 epoch: 63, train_loss: 1.2524, test_loss: 1.3069, test_f1: 0.2281
 epoch: 64, train_loss: 1.2524, test_loss: 1.3059, test_f1: 0.2281
 epoch: 65, train_loss: 1.2525, test_loss: 1.3039, test_f1: 0.2281
 epoch: 66, train_loss: 1.2522, test_loss: 1.3036, test_f1: 0.2281
 epoch: 67, train_loss: 1.2524, test_loss: 1.3032, test_f1: 0.2281
 epoch: 68, train_loss: 1.2526, test_loss: 1.3019, test_f1: 0.2281
 epoch: 69, train_loss: 1.2525, test_loss: 1.3003, test_f1: 0.2281
 epoch: 70, train_loss: 1.2525, test_loss: 1.3018, test_f1: 0.2281
 epoch: 71, train_loss: 1.2523, test_loss: 1.3040, test_f1: 0.2281
 epoch: 72, train_loss: 1.2521, test_loss: 1.3063, test_f1: 0.2281
 epoch: 73, train_loss: 1.2523, test_loss: 1.3060, test_f1: 0.2281
 epoch: 74, train_loss: 1.2522, test_loss: 1.3046, test_f1: 0.2281
 epoch: 75, train_loss: 1.2522, test_loss: 1.3060, test_f1: 0.2281
 epoch: 76, train_loss: 1.2544, test_loss: 1.3084, test_f1: 0.2281
 epoch: 77, train_loss: 1.2537, test_loss: 1.3077, test_f1: 0.2281
 epoch: 78, train_loss: 1.2522, test_loss: 1.3064, test_f1: 0.2281
 epoch: 79, train_loss: 1.2528, test_loss: 1.3044, test_f1: 0.2281
 epoch: 80, train_loss: 1.2524, test_loss: 1.3028, test_f1: 0.2281
 epoch: 81, train_loss: 1.2522, test_loss: 1.3037, test_f1: 0.2281
 epoch: 82, train_loss: 1.2527, test_loss: 1.3053, test_f1: 0.2281
 epoch: 83, train_loss: 1.2525, test_loss: 1.3064, test_f1: 0.2281
 epoch: 84, train_loss: 1.2531, test_loss: 1.3083, test_f1: 0.2281
 epoch: 85, train_loss: 1.2527, test_loss: 1.3087, test_f1: 0.2281
 epoch: 86, train_loss: 1.2618, test_loss: 1.3070, test_f1: 0.2281
 epoch: 87, train_loss: 1.2526, test_loss: 1.3045, test_f1: 0.2281
 epoch: 88, train_loss: 1.2524, test_loss: 1.3036, test_f1: 0.2281
 epoch: 89, train_loss: 1.2533, test_loss: 1.3004, test_f1: 0.2281
 epoch: 90, train_loss: 1.2530, test_loss: 1.3016, test_f1: 0.2281
 epoch: 91, train_loss: 1.2527, test_loss: 1.3046, test_f1: 0.2281
 epoch: 92, train_loss: 1.2526, test_loss: 1.3069, test_f1: 0.2281
 epoch: 93, train_loss: 1.2523, test_loss: 1.3058, test_f1: 0.2281
 epoch: 94, train_loss: 1.2522, test_loss: 1.3050, test_f1: 0.2281
 epoch: 95, train_loss: 1.2522, test_loss: 1.3055, test_f1: 0.2281
 epoch: 96, train_loss: 1.2523, test_loss: 1.3045, test_f1: 0.2281
 epoch: 97, train_loss: 1.2521, test_loss: 1.3024, test_f1: 0.2281
 epoch: 98, train_loss: 1.2523, test_loss: 1.3032, test_f1: 0.2281
 epoch: 99, train_loss: 1.2523, test_loss: 1.3047, test_f1: 0.2281
##################ITERATION #1 ****************************************
 epoch: 0, train_loss: 1.3320, test_loss: 12.8147, test_f1: 0.0507
 epoch: 1, train_loss: 1.2627, test_loss: 2.0469, test_f1: 0.2285
 epoch: 2, train_loss: 1.2428, test_loss: 1.4484, test_f1: 0.2378
 epoch: 3, train_loss: 1.2502, test_loss: 1.4261, test_f1: 0.2338
 epoch: 4, train_loss: 1.2550, test_loss: 1.3092, test_f1: 0.3158
 epoch: 5, train_loss: 1.2476, test_loss: 1.3225, test_f1: 0.3081
 epoch: 6, train_loss: 1.2355, test_loss: 1.3084, test_f1: 0.2281
 epoch: 7, train_loss: 1.2273, test_loss: 1.3206, test_f1: 0.3179
 epoch: 8, train_loss: 1.2346, test_loss: 1.2922, test_f1: 0.3214
 epoch: 9, train_loss: 1.2304, test_loss: 1.3134, test_f1: 0.2583
 epoch: 10, train_loss: 1.2116, test_loss: 1.2790, test_f1: 0.2583
 epoch: 11, train_loss: 1.2050, test_loss: 1.5706, test_f1: 0.2281
 epoch: 12, train_loss: 1.1778, test_loss: 1.2855, test_f1: 0.2483
 epoch: 13, train_loss: 1.1802, test_loss: 1.2150, test_f1: 0.2281
 epoch: 14, train_loss: 1.1581, test_loss: 1.2092, test_f1: 0.3395
 epoch: 15, train_loss: 1.1250, test_loss: 1.2209, test_f1: 0.4293
 epoch: 16, train_loss: 1.1120, test_loss: 1.2030, test_f1: 0.4323
 epoch: 17, train_loss: 1.1033, test_loss: 1.1791, test_f1: 0.3257
 epoch: 18, train_loss: 1.1035, test_loss: 1.1694, test_f1: 0.4476
 epoch: 19, train_loss: 1.0924, test_loss: 1.1882, test_f1: 0.3290
 epoch: 20, train_loss: 1.0976, test_loss: 1.1471, test_f1: 0.4440
 epoch: 21, train_loss: 1.1038, test_loss: 1.2210, test_f1: 0.3290
 epoch: 22, train_loss: 1.1060, test_loss: 1.1632, test_f1: 0.3720
 epoch: 23, train_loss: 1.0735, test_loss: 1.2901, test_f1: 0.2829
 epoch: 24, train_loss: 1.1136, test_loss: 1.2395, test_f1: 0.2949
 epoch: 25, train_loss: 1.0691, test_loss: 1.4592, test_f1: 0.2520
 epoch: 26, train_loss: 1.0933, test_loss: 1.1706, test_f1: 0.3399
 epoch: 27, train_loss: 1.0922, test_loss: 1.2157, test_f1: 0.3797
 epoch: 28, train_loss: 1.0808, test_loss: 2.0724, test_f1: 0.1671
 epoch: 29, train_loss: 1.0635, test_loss: 1.2462, test_f1: 0.4264
 epoch: 30, train_loss: 1.0670, test_loss: 1.1559, test_f1: 0.3290
 epoch: 31, train_loss: 1.0363, test_loss: 1.3903, test_f1: 0.4063
 epoch: 32, train_loss: 1.0430, test_loss: 1.2283, test_f1: 0.3201
 epoch: 33, train_loss: 1.0856, test_loss: 1.1844, test_f1: 0.3370
 epoch: 34, train_loss: 1.0787, test_loss: 1.3501, test_f1: 0.2456
 epoch: 35, train_loss: 1.0844, test_loss: 1.1703, test_f1: 0.3290
 epoch: 36, train_loss: 1.0698, test_loss: 1.2885, test_f1: 0.2346
 epoch: 37, train_loss: 1.0665, test_loss: 1.1570, test_f1: 0.3758
 epoch: 38, train_loss: 1.0512, test_loss: 1.2461, test_f1: 0.3493
 epoch: 39, train_loss: 1.0621, test_loss: 1.1420, test_f1: 0.3290
 epoch: 40, train_loss: 1.0893, test_loss: 1.3139, test_f1: 0.4055
 epoch: 41, train_loss: 1.0622, test_loss: 1.1603, test_f1: 0.3290
 epoch: 42, train_loss: 1.0700, test_loss: 1.1750, test_f1: 0.3720
 epoch: 43, train_loss: 1.0501, test_loss: 1.8252, test_f1: 0.2380
 epoch: 44, train_loss: 1.0559, test_loss: 1.1393, test_f1: 0.3685
 epoch: 45, train_loss: 1.0581, test_loss: 1.1608, test_f1: 0.3344
 epoch: 46, train_loss: 1.0410, test_loss: 1.2053, test_f1: 0.4183
 epoch: 47, train_loss: 1.0403, test_loss: 1.2313, test_f1: 0.4143
 epoch: 48, train_loss: 1.0322, test_loss: 1.2721, test_f1: 0.3205
 epoch: 49, train_loss: 1.0446, test_loss: 1.1800, test_f1: 0.4101
 epoch: 50, train_loss: 1.0251, test_loss: 1.1646, test_f1: 0.3838
 epoch: 51, train_loss: 1.0274, test_loss: 1.1291, test_f1: 0.3515
 epoch: 52, train_loss: 1.0395, test_loss: 1.1922, test_f1: 0.4283
 epoch: 53, train_loss: 1.0474, test_loss: 1.1494, test_f1: 0.3290
 epoch: 54, train_loss: 1.0557, test_loss: 1.1773, test_f1: 0.4330
 epoch: 55, train_loss: 1.0372, test_loss: 1.2917, test_f1: 0.4256
 epoch: 56, train_loss: 1.0246, test_loss: 1.2158, test_f1: 0.4446
 epoch: 57, train_loss: 1.0209, test_loss: 1.2265, test_f1: 0.4135
 epoch: 58, train_loss: 1.0284, test_loss: 1.1550, test_f1: 0.3934
 epoch: 59, train_loss: 1.0436, test_loss: 1.1464, test_f1: 0.4066
 epoch: 60, train_loss: 1.0211, test_loss: 1.1352, test_f1: 0.4398
 epoch: 61, train_loss: 1.0232, test_loss: 1.1065, test_f1: 0.3921
 epoch: 62, train_loss: 1.0153, test_loss: 1.1326, test_f1: 0.3904
 epoch: 63, train_loss: 1.0382, test_loss: 1.1968, test_f1: 0.3771
 epoch: 64, train_loss: 1.0394, test_loss: 1.1522, test_f1: 0.3317
 epoch: 65, train_loss: 1.0417, test_loss: 1.1460, test_f1: 0.3729
 epoch: 66, train_loss: 1.0186, test_loss: 1.1977, test_f1: 0.4155
 epoch: 67, train_loss: 1.0248, test_loss: 1.1798, test_f1: 0.3777
 epoch: 68, train_loss: 1.0126, test_loss: 1.1144, test_f1: 0.4406
 epoch: 69, train_loss: 1.0116, test_loss: 1.1471, test_f1: 0.3824
 epoch: 70, train_loss: 1.0035, test_loss: 1.2513, test_f1: 0.3536
 epoch: 71, train_loss: 1.0031, test_loss: 1.1376, test_f1: 0.3860
 epoch: 72, train_loss: 1.0145, test_loss: 1.1552, test_f1: 0.3360
 epoch: 73, train_loss: 0.9999, test_loss: 1.1444, test_f1: 0.4413
 epoch: 74, train_loss: 1.0015, test_loss: 1.1476, test_f1: 0.3705
 epoch: 75, train_loss: 0.9981, test_loss: 156.2478, test_f1: 0.0301
 epoch: 76, train_loss: 0.9968, test_loss: 1.1930, test_f1: 0.4212
 epoch: 77, train_loss: 1.0415, test_loss: 1.2249, test_f1: 0.3517
 epoch: 78, train_loss: 1.0577, test_loss: 1.1356, test_f1: 0.3975
 epoch: 79, train_loss: 1.0216, test_loss: 1.1400, test_f1: 0.3865
 epoch: 80, train_loss: 1.0226, test_loss: 1.2300, test_f1: 0.4354
 epoch: 81, train_loss: 1.0363, test_loss: 1.1883, test_f1: 0.3786
 epoch: 82, train_loss: 1.0154, test_loss: 1.1537, test_f1: 0.3789
 epoch: 83, train_loss: 1.0193, test_loss: 1.1837, test_f1: 0.3811
 epoch: 84, train_loss: 1.0035, test_loss: 1.1574, test_f1: 0.3857
 epoch: 85, train_loss: 0.9992, test_loss: 1.1382, test_f1: 0.4399
 epoch: 86, train_loss: 0.9950, test_loss: 1.1261, test_f1: 0.3492
 epoch: 87, train_loss: 1.0003, test_loss: 1.1211, test_f1: 0.3485
 epoch: 88, train_loss: 0.9991, test_loss: 1.1366, test_f1: 0.4446
 epoch: 89, train_loss: 0.9940, test_loss: 1.1543, test_f1: 0.3935
 epoch: 90, train_loss: 1.0028, test_loss: 1.1485, test_f1: 0.3958
 epoch: 91, train_loss: 0.9855, test_loss: 1.2228, test_f1: 0.4154
 epoch: 92, train_loss: 1.0025, test_loss: 1.1523, test_f1: 0.4427
 epoch: 93, train_loss: 0.9929, test_loss: 1.1614, test_f1: 0.4453
 epoch: 94, train_loss: 1.0045, test_loss: 1.1754, test_f1: 0.3395
 epoch: 95, train_loss: 1.0016, test_loss: 1.1496, test_f1: 0.3714
 epoch: 96, train_loss: 0.9862, test_loss: 1.1476, test_f1: 0.4618
 epoch: 97, train_loss: 0.9878, test_loss: 1.1800, test_f1: 0.4254
 epoch: 98, train_loss: 0.9794, test_loss: 1.1242, test_f1: 0.4387
 epoch: 99, train_loss: 1.0024, test_loss: 1.1623, test_f1: 0.4481
##################ITERATION #2 ****************************************
 epoch: 0, train_loss: 1.9112, test_loss: 3.1864, test_f1: 0.0301
 epoch: 1, train_loss: 1.2975, test_loss: 1.8073, test_f1: 0.1784
 epoch: 2, train_loss: 1.2250, test_loss: 1.4182, test_f1: 0.3016
 epoch: 3, train_loss: 1.1611, test_loss: 1.3473, test_f1: 0.3620
 epoch: 4, train_loss: 1.0952, test_loss: 1.3734, test_f1: 0.4274
 epoch: 5, train_loss: 1.0682, test_loss: 1.2997, test_f1: 0.4160
 epoch: 6, train_loss: 1.0779, test_loss: 1.2436, test_f1: 0.4087
 epoch: 7, train_loss: 1.0787, test_loss: 1.1585, test_f1: 0.3317
 epoch: 8, train_loss: 1.0724, test_loss: 1.1375, test_f1: 0.3838
 epoch: 9, train_loss: 1.0662, test_loss: 1.1432, test_f1: 0.3700
 epoch: 10, train_loss: 1.0545, test_loss: 1.1617, test_f1: 0.3617
 epoch: 11, train_loss: 1.0486, test_loss: 1.1593, test_f1: 0.4313
 epoch: 12, train_loss: 1.1001, test_loss: 1.2732, test_f1: 0.2631
 epoch: 13, train_loss: 1.1291, test_loss: 1.3821, test_f1: 0.2845
 epoch: 14, train_loss: 1.0865, test_loss: 1.1559, test_f1: 0.4073
 epoch: 15, train_loss: 1.0562, test_loss: 1.1481, test_f1: 0.3424
 epoch: 16, train_loss: 1.0461, test_loss: 1.2043, test_f1: 0.4393
 epoch: 17, train_loss: 1.0367, test_loss: 1.1814, test_f1: 0.3699
 epoch: 18, train_loss: 1.0510, test_loss: 1.1264, test_f1: 0.3700
 epoch: 19, train_loss: 1.0354, test_loss: 1.1791, test_f1: 0.4134
 epoch: 20, train_loss: 1.0413, test_loss: 1.1564, test_f1: 0.3594
 epoch: 21, train_loss: 1.0408, test_loss: 1.2202, test_f1: 0.3408
 epoch: 22, train_loss: 1.0633, test_loss: 1.2475, test_f1: 0.2949
 epoch: 23, train_loss: 1.0427, test_loss: 1.1374, test_f1: 0.4234
 epoch: 24, train_loss: 1.0463, test_loss: 1.1717, test_f1: 0.4237
 epoch: 25, train_loss: 1.0349, test_loss: 1.1885, test_f1: 0.4041
 epoch: 26, train_loss: 1.0421, test_loss: 1.1299, test_f1: 0.4456
 epoch: 27, train_loss: 1.0491, test_loss: 1.1369, test_f1: 0.3290
 epoch: 28, train_loss: 1.0370, test_loss: 1.1093, test_f1: 0.4612
 epoch: 29, train_loss: 1.0283, test_loss: 1.1879, test_f1: 0.3146
 epoch: 30, train_loss: 1.0784, test_loss: 1.3114, test_f1: 0.2015
 epoch: 31, train_loss: 1.0570, test_loss: 1.1204, test_f1: 0.3395
 epoch: 32, train_loss: 1.0411, test_loss: 2.5984, test_f1: 0.2043
 epoch: 33, train_loss: 1.0514, test_loss: 2.1250, test_f1: 0.2638
 epoch: 34, train_loss: 1.0450, test_loss: 1.1435, test_f1: 0.3215
 epoch: 35, train_loss: 1.0438, test_loss: 1.1121, test_f1: 0.3395
 epoch: 36, train_loss: 1.0309, test_loss: 1.2115, test_f1: 0.4184
 epoch: 37, train_loss: 1.0264, test_loss: 1.1318, test_f1: 0.3395
 epoch: 38, train_loss: 1.0361, test_loss: 1.1679, test_f1: 0.4373
 epoch: 39, train_loss: 1.0222, test_loss: 1.1181, test_f1: 0.4490
 epoch: 40, train_loss: 1.0258, test_loss: 1.1160, test_f1: 0.3395
 epoch: 41, train_loss: 1.0219, test_loss: 1.1291, test_f1: 0.4420
 epoch: 42, train_loss: 1.0043, test_loss: 1.1189, test_f1: 0.3702
 epoch: 43, train_loss: 1.0099, test_loss: 1.1194, test_f1: 0.3841
 epoch: 44, train_loss: 1.0037, test_loss: 1.1087, test_f1: 0.4284
 epoch: 45, train_loss: 1.0074, test_loss: 1.1229, test_f1: 0.3390
 epoch: 46, train_loss: 1.0721, test_loss: 1.1800, test_f1: 0.3118
 epoch: 47, train_loss: 1.0287, test_loss: 1.2702, test_f1: 0.3893
 epoch: 48, train_loss: 1.0390, test_loss: 1.1052, test_f1: 0.3296
 epoch: 49, train_loss: 1.0177, test_loss: 1.1128, test_f1: 0.4002
 epoch: 50, train_loss: 1.0230, test_loss: 1.1275, test_f1: 0.3317
 epoch: 51, train_loss: 1.0146, test_loss: 1.1110, test_f1: 0.3694
 epoch: 52, train_loss: 1.0064, test_loss: 1.1162, test_f1: 0.3395
 epoch: 53, train_loss: 1.0004, test_loss: 1.1133, test_f1: 0.4042
 epoch: 54, train_loss: 0.9935, test_loss: 1.0942, test_f1: 0.3870
 epoch: 55, train_loss: 0.9969, test_loss: 1.1018, test_f1: 0.3702
 epoch: 56, train_loss: 0.9954, test_loss: 1.1082, test_f1: 0.3841
 epoch: 57, train_loss: 0.9920, test_loss: 1.1094, test_f1: 0.3344
 epoch: 58, train_loss: 1.0054, test_loss: 1.1234, test_f1: 0.3729
 epoch: 59, train_loss: 1.0296, test_loss: 1.1137, test_f1: 0.4447
 epoch: 60, train_loss: 1.0397, test_loss: 1.0872, test_f1: 0.4115
 epoch: 61, train_loss: 1.0165, test_loss: 1.1078, test_f1: 0.4464
 epoch: 62, train_loss: 1.0100, test_loss: 1.1217, test_f1: 0.4582
 epoch: 63, train_loss: 1.0075, test_loss: 1.1005, test_f1: 0.3701
 epoch: 64, train_loss: 1.0175, test_loss: 1.1127, test_f1: 0.4245
 epoch: 65, train_loss: 1.0068, test_loss: 1.1153, test_f1: 0.4326
 epoch: 66, train_loss: 1.0030, test_loss: 1.0915, test_f1: 0.4442
 epoch: 67, train_loss: 0.9887, test_loss: 1.0957, test_f1: 0.3761
 epoch: 68, train_loss: 0.9919, test_loss: 1.0596, test_f1: 0.3987
 epoch: 69, train_loss: 0.9926, test_loss: 1.2243, test_f1: 0.4296
 epoch: 70, train_loss: 0.9797, test_loss: 1.1195, test_f1: 0.3615
 epoch: 71, train_loss: 0.9657, test_loss: 1.1029, test_f1: 0.3736
 epoch: 72, train_loss: 0.9754, test_loss: 1.0918, test_f1: 0.4396
 epoch: 73, train_loss: 0.9882, test_loss: 1.0569, test_f1: 0.3468
 epoch: 74, train_loss: 0.9743, test_loss: 1.0635, test_f1: 0.4485
 epoch: 75, train_loss: 0.9591, test_loss: 1.0934, test_f1: 0.4390
 epoch: 76, train_loss: 0.9648, test_loss: 1.0630, test_f1: 0.3477
 epoch: 77, train_loss: 0.9772, test_loss: 1.1496, test_f1: 0.4463
 epoch: 78, train_loss: 0.9932, test_loss: 1.1893, test_f1: 0.3176
 epoch: 79, train_loss: 0.9872, test_loss: 1.3094, test_f1: 0.4125
 epoch: 80, train_loss: 0.9855, test_loss: 1.6201, test_f1: 0.3411
 epoch: 81, train_loss: 0.9873, test_loss: 1.2311, test_f1: 0.4108
 epoch: 82, train_loss: 0.9776, test_loss: 1.1692, test_f1: 0.3967
 epoch: 83, train_loss: 0.9772, test_loss: 1.0765, test_f1: 0.4152
 epoch: 84, train_loss: 0.9610, test_loss: 1.0891, test_f1: 0.4708
 epoch: 85, train_loss: 0.9529, test_loss: 1.0501, test_f1: 0.3507
 epoch: 86, train_loss: 0.9749, test_loss: 1.0665, test_f1: 0.3414
 epoch: 87, train_loss: 0.9803, test_loss: 1.1151, test_f1: 0.3317
 epoch: 88, train_loss: 0.9691, test_loss: 1.0634, test_f1: 0.4421
 epoch: 89, train_loss: 0.9630, test_loss: 1.0888, test_f1: 0.3449
 epoch: 90, train_loss: 0.9509, test_loss: 1.1506, test_f1: 0.4783
 epoch: 91, train_loss: 0.9540, test_loss: 1.1106, test_f1: 0.4089
 epoch: 92, train_loss: 0.9654, test_loss: 1.0560, test_f1: 0.3912
 epoch: 93, train_loss: 0.9928, test_loss: 1.0865, test_f1: 0.3439
 epoch: 94, train_loss: 1.0027, test_loss: 1.1146, test_f1: 0.4374
 epoch: 95, train_loss: 0.9865, test_loss: 1.2709, test_f1: 0.3212
 epoch: 96, train_loss: 0.9835, test_loss: 1.3814, test_f1: 0.4004
 epoch: 97, train_loss: 0.9773, test_loss: 1.0454, test_f1: 0.4518
 epoch: 98, train_loss: 0.9739, test_loss: 1.0768, test_f1: 0.3796
 epoch: 99, train_loss: 0.9951, test_loss: 1.0842, test_f1: 0.3364
##################ITERATION #3 ****************************************
 epoch: 0, train_loss: 1.5461, test_loss: 17.0398, test_f1: 0.1365
 epoch: 1, train_loss: 1.2170, test_loss: 2.7674, test_f1: 0.1365
 epoch: 2, train_loss: 1.1591, test_loss: 1.3424, test_f1: 0.2585
 epoch: 3, train_loss: 1.1034, test_loss: 1.8657, test_f1: 0.2722
 epoch: 4, train_loss: 1.0703, test_loss: 1.6366, test_f1: 0.1589
 epoch: 5, train_loss: 1.1880, test_loss: 1.3545, test_f1: 0.3208
 epoch: 6, train_loss: 1.1242, test_loss: 1.5368, test_f1: 0.2731
 epoch: 7, train_loss: 1.0820, test_loss: 1.1685, test_f1: 0.3594
 epoch: 8, train_loss: 1.0582, test_loss: 1.1776, test_f1: 0.4218
 epoch: 9, train_loss: 1.0529, test_loss: 1.2248, test_f1: 0.4155
 epoch: 10, train_loss: 1.0459, test_loss: 1.1089, test_f1: 0.3395
 epoch: 11, train_loss: 1.0491, test_loss: 1.1684, test_f1: 0.4450
 epoch: 12, train_loss: 1.0244, test_loss: 1.1303, test_f1: 0.3824
 epoch: 13, train_loss: 1.0320, test_loss: 1.1269, test_f1: 0.4580
 epoch: 14, train_loss: 1.0258, test_loss: 1.1265, test_f1: 0.3867
 epoch: 15, train_loss: 1.0123, test_loss: 1.1427, test_f1: 0.4335
 epoch: 16, train_loss: 1.0278, test_loss: 1.1758, test_f1: 0.4289
 epoch: 17, train_loss: 1.0290, test_loss: 1.1639, test_f1: 0.4286
 epoch: 18, train_loss: 1.0390, test_loss: 1.4011, test_f1: 0.2631
 epoch: 19, train_loss: 1.0421, test_loss: 1.3375, test_f1: 0.4471
 epoch: 20, train_loss: 1.0273, test_loss: 1.3156, test_f1: 0.3875
 epoch: 21, train_loss: 1.0216, test_loss: 1.2624, test_f1: 0.4196
 epoch: 22, train_loss: 1.0018, test_loss: 1.1459, test_f1: 0.4253
 epoch: 23, train_loss: 1.0095, test_loss: 1.0907, test_f1: 0.3374
 epoch: 24, train_loss: 1.0028, test_loss: 1.0965, test_f1: 0.4387
 epoch: 25, train_loss: 1.0145, test_loss: 1.0819, test_f1: 0.3395
 epoch: 26, train_loss: 1.0030, test_loss: 1.0899, test_f1: 0.4283
 epoch: 27, train_loss: 1.0013, test_loss: 1.1017, test_f1: 0.4585
 epoch: 28, train_loss: 1.0052, test_loss: 1.1018, test_f1: 0.4492
 epoch: 29, train_loss: 0.9952, test_loss: 1.1236, test_f1: 0.3290
 epoch: 30, train_loss: 0.9936, test_loss: 1.1440, test_f1: 0.4713
 epoch: 31, train_loss: 0.9974, test_loss: 1.1373, test_f1: 0.4543
 epoch: 32, train_loss: 0.9934, test_loss: 1.1115, test_f1: 0.4490
 epoch: 33, train_loss: 1.0004, test_loss: 1.1034, test_f1: 0.3370
 epoch: 34, train_loss: 1.0368, test_loss: 1.1126, test_f1: 0.3395
 epoch: 35, train_loss: 1.0051, test_loss: 1.1101, test_f1: 0.4683
 epoch: 36, train_loss: 0.9989, test_loss: 1.0954, test_f1: 0.3388
 epoch: 37, train_loss: 1.0171, test_loss: 1.1118, test_f1: 0.4502
 epoch: 38, train_loss: 0.9994, test_loss: 1.0921, test_f1: 0.4395
 epoch: 39, train_loss: 0.9814, test_loss: 1.1341, test_f1: 0.3317
 epoch: 40, train_loss: 0.9942, test_loss: 1.1303, test_f1: 0.4467
 epoch: 41, train_loss: 0.9884, test_loss: 1.1833, test_f1: 0.4223
 epoch: 42, train_loss: 0.9924, test_loss: 1.1270, test_f1: 0.3290
 epoch: 43, train_loss: 0.9969, test_loss: 1.1408, test_f1: 0.4540
 epoch: 44, train_loss: 1.0089, test_loss: 1.1090, test_f1: 0.3350
 epoch: 45, train_loss: 1.0217, test_loss: 1.1409, test_f1: 0.4183
 epoch: 46, train_loss: 1.0059, test_loss: 1.1206, test_f1: 0.3778
 epoch: 47, train_loss: 0.9921, test_loss: 1.1460, test_f1: 0.3323
 epoch: 48, train_loss: 1.0162, test_loss: 1.1729, test_f1: 0.4612
 epoch: 49, train_loss: 0.9910, test_loss: 1.1037, test_f1: 0.3676
 epoch: 50, train_loss: 0.9972, test_loss: 1.2813, test_f1: 0.3317
 epoch: 51, train_loss: 1.0036, test_loss: 1.2018, test_f1: 0.4450
 epoch: 52, train_loss: 1.0020, test_loss: 1.1762, test_f1: 0.4633
 epoch: 53, train_loss: 0.9969, test_loss: 1.1166, test_f1: 0.4276
 epoch: 54, train_loss: 0.9951, test_loss: 1.1057, test_f1: 0.4269
 epoch: 55, train_loss: 0.9904, test_loss: 1.1336, test_f1: 0.3111
 epoch: 56, train_loss: 0.9910, test_loss: 1.0640, test_f1: 0.4815
 epoch: 57, train_loss: 0.9939, test_loss: 1.0666, test_f1: 0.3506
 epoch: 58, train_loss: 1.0001, test_loss: 1.0729, test_f1: 0.3395
 epoch: 59, train_loss: 0.9664, test_loss: 1.0887, test_f1: 0.4515
 epoch: 60, train_loss: 0.9711, test_loss: 1.0986, test_f1: 0.3683
 epoch: 61, train_loss: 1.0000, test_loss: 1.1519, test_f1: 0.4456
 epoch: 62, train_loss: 0.9843, test_loss: 1.0675, test_f1: 0.4653
 epoch: 63, train_loss: 0.9870, test_loss: 1.1824, test_f1: 0.4072
 epoch: 64, train_loss: 0.9780, test_loss: 1.1164, test_f1: 0.3998
 epoch: 65, train_loss: 0.9728, test_loss: 1.0943, test_f1: 0.4691
 epoch: 66, train_loss: 0.9794, test_loss: 1.1089, test_f1: 0.3290
 epoch: 67, train_loss: 0.9894, test_loss: 1.0558, test_f1: 0.4659
 epoch: 68, train_loss: 0.9715, test_loss: 1.0637, test_f1: 0.4683
 epoch: 69, train_loss: 0.9682, test_loss: 1.0585, test_f1: 0.4748
 epoch: 70, train_loss: 0.9554, test_loss: 1.0790, test_f1: 0.4648
 epoch: 71, train_loss: 0.9509, test_loss: 1.0759, test_f1: 0.4716
 epoch: 72, train_loss: 0.9598, test_loss: 1.1400, test_f1: 0.4553
 epoch: 73, train_loss: 0.9564, test_loss: 1.0829, test_f1: 0.3431
 epoch: 74, train_loss: 0.9622, test_loss: 1.0831, test_f1: 0.3816
 epoch: 75, train_loss: 0.9708, test_loss: 1.1180, test_f1: 0.4061
 epoch: 76, train_loss: 0.9637, test_loss: 1.0683, test_f1: 0.4761
 epoch: 77, train_loss: 0.9543, test_loss: 1.0586, test_f1: 0.3451
 epoch: 78, train_loss: 0.9505, test_loss: 1.0551, test_f1: 0.4749
 epoch: 79, train_loss: 0.9655, test_loss: 1.0712, test_f1: 0.3812
 epoch: 80, train_loss: 0.9664, test_loss: 1.0782, test_f1: 0.3410
 epoch: 81, train_loss: 0.9535, test_loss: 1.0521, test_f1: 0.4769
 epoch: 82, train_loss: 0.9412, test_loss: 1.0959, test_f1: 0.4434
 epoch: 83, train_loss: 0.9386, test_loss: 1.0429, test_f1: 0.4651
 epoch: 84, train_loss: 0.9596, test_loss: 1.1134, test_f1: 0.4881
 epoch: 85, train_loss: 1.0069, test_loss: 1.1253, test_f1: 0.3395
 epoch: 86, train_loss: 0.9823, test_loss: 1.5275, test_f1: 0.3107
 epoch: 87, train_loss: 0.9691, test_loss: 1.4123, test_f1: 0.3731
 epoch: 88, train_loss: 0.9632, test_loss: 1.2782, test_f1: 0.4495
 epoch: 89, train_loss: 0.9970, test_loss: 1.3380, test_f1: 0.4101
 epoch: 90, train_loss: 0.9903, test_loss: 1.2444, test_f1: 0.4388
 epoch: 91, train_loss: 0.9616, test_loss: 1.2774, test_f1: 0.4201
 epoch: 92, train_loss: 0.9559, test_loss: 1.2402, test_f1: 0.4389
 epoch: 93, train_loss: 0.9736, test_loss: 1.1216, test_f1: 0.4486
 epoch: 94, train_loss: 0.9775, test_loss: 1.3742, test_f1: 0.3176
 epoch: 95, train_loss: 0.9809, test_loss: 1.1521, test_f1: 0.4352
 epoch: 96, train_loss: 0.9586, test_loss: 1.1635, test_f1: 0.3693
 epoch: 97, train_loss: 0.9498, test_loss: 1.1119, test_f1: 0.3653
 epoch: 98, train_loss: 0.9344, test_loss: 1.1613, test_f1: 0.4745
 epoch: 99, train_loss: 0.9488, test_loss: 1.0581, test_f1: 0.4008
##################ITERATION #4 ****************************************
 epoch: 0, train_loss: 1.4285, test_loss: 1.3913, test_f1: 0.2478
 epoch: 1, train_loss: 1.1460, test_loss: 1.8898, test_f1: 0.1780
 epoch: 2, train_loss: 1.1527, test_loss: 1.5502, test_f1: 0.3006
 epoch: 3, train_loss: 1.1277, test_loss: 1.5774, test_f1: 0.2491
 epoch: 4, train_loss: 1.1113, test_loss: 1.4934, test_f1: 0.3493
 epoch: 5, train_loss: 1.0831, test_loss: 1.2816, test_f1: 0.2734
 epoch: 6, train_loss: 1.0928, test_loss: 1.4275, test_f1: 0.3076
 epoch: 7, train_loss: 1.0986, test_loss: 1.2842, test_f1: 0.2491
 epoch: 8, train_loss: 1.0839, test_loss: 1.3506, test_f1: 0.3059
 epoch: 9, train_loss: 1.0674, test_loss: 1.2303, test_f1: 0.3290
 epoch: 10, train_loss: 1.0646, test_loss: 1.2226, test_f1: 0.3072
 epoch: 11, train_loss: 1.0817, test_loss: 1.1382, test_f1: 0.3243
 epoch: 12, train_loss: 1.1099, test_loss: 1.2670, test_f1: 0.4248
 epoch: 13, train_loss: 1.1023, test_loss: 1.2117, test_f1: 0.3518
 epoch: 14, train_loss: 1.0917, test_loss: 1.2257, test_f1: 0.3785
 epoch: 15, train_loss: 1.0665, test_loss: 1.1761, test_f1: 0.3719
 epoch: 16, train_loss: 1.0817, test_loss: 1.2343, test_f1: 0.3917
 epoch: 17, train_loss: 1.1172, test_loss: 1.2433, test_f1: 0.4007
 epoch: 18, train_loss: 1.0708, test_loss: 1.1657, test_f1: 0.3237
 epoch: 19, train_loss: 1.0604, test_loss: 1.2438, test_f1: 0.4036
 epoch: 20, train_loss: 1.0568, test_loss: 1.2520, test_f1: 0.2944
 epoch: 21, train_loss: 1.0496, test_loss: 1.2143, test_f1: 0.4176
 epoch: 22, train_loss: 1.0499, test_loss: 1.1420, test_f1: 0.3709
 epoch: 23, train_loss: 1.0336, test_loss: 1.1958, test_f1: 0.3660
 epoch: 24, train_loss: 1.0415, test_loss: 1.1643, test_f1: 0.3459
 epoch: 25, train_loss: 1.0363, test_loss: 1.1767, test_f1: 0.3122
 epoch: 26, train_loss: 1.0564, test_loss: 1.3558, test_f1: 0.4304
 epoch: 27, train_loss: 1.0542, test_loss: 1.3384, test_f1: 0.2441
 epoch: 28, train_loss: 1.1054, test_loss: 1.3842, test_f1: 0.2441
 epoch: 29, train_loss: 1.0992, test_loss: 1.2263, test_f1: 0.3256
 epoch: 30, train_loss: 1.0759, test_loss: 1.2185, test_f1: 0.3791
 epoch: 31, train_loss: 1.1282, test_loss: 1.2271, test_f1: 0.3078
 epoch: 32, train_loss: 1.0827, test_loss: 1.3999, test_f1: 0.3614
 epoch: 33, train_loss: 1.0749, test_loss: 1.1335, test_f1: 0.3412
 epoch: 34, train_loss: 1.0553, test_loss: 1.2154, test_f1: 0.4065
 epoch: 35, train_loss: 1.0670, test_loss: 1.1643, test_f1: 0.3290
 epoch: 36, train_loss: 1.0635, test_loss: 1.1682, test_f1: 0.4384
 epoch: 37, train_loss: 1.0787, test_loss: 1.4219, test_f1: 0.2707
 epoch: 38, train_loss: 1.1090, test_loss: 1.1561, test_f1: 0.3290
 epoch: 39, train_loss: 1.1003, test_loss: 1.2952, test_f1: 0.4371
 epoch: 40, train_loss: 1.1140, test_loss: 1.1740, test_f1: 0.3381
 epoch: 41, train_loss: 1.1228, test_loss: 1.1615, test_f1: 0.3309
 epoch: 42, train_loss: 1.0837, test_loss: 1.2185, test_f1: 0.3059
 epoch: 43, train_loss: 1.0896, test_loss: 1.1608, test_f1: 0.4530
 epoch: 44, train_loss: 1.0865, test_loss: 1.1835, test_f1: 0.3317
 epoch: 45, train_loss: 1.0847, test_loss: 1.1545, test_f1: 0.4084
 epoch: 46, train_loss: 1.0647, test_loss: 1.1397, test_f1: 0.3395
 epoch: 47, train_loss: 1.0650, test_loss: 1.2144, test_f1: 0.4176
 epoch: 48, train_loss: 1.0512, test_loss: 1.2165, test_f1: 0.3625
 epoch: 49, train_loss: 1.0440, test_loss: 1.1756, test_f1: 0.3290
 epoch: 50, train_loss: 1.0423, test_loss: 1.1463, test_f1: 0.3395
 epoch: 51, train_loss: 1.0396, test_loss: 1.1576, test_f1: 0.3697
 epoch: 52, train_loss: 1.0461, test_loss: 1.1240, test_f1: 0.3395
 epoch: 53, train_loss: 1.0632, test_loss: 1.1529, test_f1: 0.3697
 epoch: 54, train_loss: 1.0348, test_loss: 1.2382, test_f1: 0.4241
 epoch: 55, train_loss: 1.0500, test_loss: 1.1257, test_f1: 0.3395
 epoch: 56, train_loss: 1.0401, test_loss: 1.1423, test_f1: 0.4401
 epoch: 57, train_loss: 1.0427, test_loss: 1.1273, test_f1: 0.3468
 epoch: 58, train_loss: 1.0363, test_loss: 1.1331, test_f1: 0.3395
 epoch: 59, train_loss: 1.0285, test_loss: 1.1453, test_f1: 0.4179
 epoch: 60, train_loss: 1.0450, test_loss: 1.1195, test_f1: 0.4486
 epoch: 61, train_loss: 1.0369, test_loss: 1.1602, test_f1: 0.3395
 epoch: 62, train_loss: 1.0387, test_loss: 1.2027, test_f1: 0.3580
 epoch: 63, train_loss: 1.0334, test_loss: 1.2157, test_f1: 0.3146
 epoch: 64, train_loss: 1.0429, test_loss: 1.1542, test_f1: 0.3395
 epoch: 65, train_loss: 1.0354, test_loss: 1.1647, test_f1: 0.4255
 epoch: 66, train_loss: 1.0403, test_loss: 1.1436, test_f1: 0.3685
 epoch: 67, train_loss: 1.0286, test_loss: 1.2000, test_f1: 0.4245
 epoch: 68, train_loss: 1.0299, test_loss: 1.1508, test_f1: 0.3685
 epoch: 69, train_loss: 1.0280, test_loss: 1.1308, test_f1: 0.3395
 epoch: 70, train_loss: 1.0228, test_loss: 1.1546, test_f1: 0.4296
 epoch: 71, train_loss: 1.0292, test_loss: 1.1332, test_f1: 0.3395
 epoch: 72, train_loss: 1.0271, test_loss: 1.1397, test_f1: 0.3685
 epoch: 73, train_loss: 1.0362, test_loss: 1.1407, test_f1: 0.4460
 epoch: 74, train_loss: 1.0591, test_loss: 1.1197, test_f1: 0.3445
 epoch: 75, train_loss: 1.0351, test_loss: 1.1413, test_f1: 0.3794
 epoch: 76, train_loss: 1.0388, test_loss: 1.1654, test_f1: 0.4092
 epoch: 77, train_loss: 1.0465, test_loss: 1.1566, test_f1: 0.3317
 epoch: 78, train_loss: 1.0431, test_loss: 1.1603, test_f1: 0.4240
 epoch: 79, train_loss: 1.0498, test_loss: 1.1632, test_f1: 0.4182
 epoch: 80, train_loss: 1.0422, test_loss: 1.1641, test_f1: 0.3580
 epoch: 81, train_loss: 1.0405, test_loss: 1.2273, test_f1: 0.4108
 epoch: 82, train_loss: 1.0392, test_loss: 1.1650, test_f1: 0.3640
 epoch: 83, train_loss: 1.0292, test_loss: 1.1880, test_f1: 0.4136
 epoch: 84, train_loss: 1.0307, test_loss: 1.1821, test_f1: 0.4299
 epoch: 85, train_loss: 1.0329, test_loss: 1.1610, test_f1: 0.3619
 epoch: 86, train_loss: 1.0432, test_loss: 1.1996, test_f1: 0.4095
 epoch: 87, train_loss: 1.0287, test_loss: 1.1595, test_f1: 0.4056
 epoch: 88, train_loss: 1.0270, test_loss: 1.1952, test_f1: 0.4283
 epoch: 89, train_loss: 1.0251, test_loss: 1.1322, test_f1: 0.3662
 epoch: 90, train_loss: 1.0374, test_loss: 1.1643, test_f1: 0.3622
 epoch: 91, train_loss: 1.0306, test_loss: 1.1534, test_f1: 0.4255
 epoch: 92, train_loss: 1.0230, test_loss: 1.1657, test_f1: 0.3395
 epoch: 93, train_loss: 1.0372, test_loss: 1.1432, test_f1: 0.3867
 epoch: 94, train_loss: 1.0388, test_loss: 1.1378, test_f1: 0.4322
 epoch: 95, train_loss: 1.0220, test_loss: 1.1249, test_f1: 0.3395
 epoch: 96, train_loss: 1.0316, test_loss: 1.1306, test_f1: 0.3395
 epoch: 97, train_loss: 1.0250, test_loss: 1.5352, test_f1: 0.3346
 epoch: 98, train_loss: 1.0256, test_loss: 1.6860, test_f1: 0.2627
 epoch: 99, train_loss: 1.0434, test_loss: 1.5800, test_f1: 0.3155
##################ITERATION #5 ****************************************
 epoch: 0, train_loss: 1.5050, test_loss: 1.7841, test_f1: 0.2285
 epoch: 1, train_loss: 1.2686, test_loss: 1.3452, test_f1: 0.1844
 epoch: 2, train_loss: 1.2583, test_loss: 1.3960, test_f1: 0.3018
 epoch: 3, train_loss: 1.2131, test_loss: 1.4775, test_f1: 0.3197
 epoch: 4, train_loss: 1.1260, test_loss: 1.5235, test_f1: 0.2779
 epoch: 5, train_loss: 1.0589, test_loss: 1.5301, test_f1: 0.3037
 epoch: 6, train_loss: 1.0714, test_loss: 1.2488, test_f1: 0.4088
 epoch: 7, train_loss: 1.0407, test_loss: 1.2468, test_f1: 0.4280
 epoch: 8, train_loss: 1.0379, test_loss: 1.2020, test_f1: 0.4307
 epoch: 9, train_loss: 1.0425, test_loss: 1.2291, test_f1: 0.4313
 epoch: 10, train_loss: 1.0406, test_loss: 1.1469, test_f1: 0.3344
 epoch: 11, train_loss: 1.0578, test_loss: 1.2876, test_f1: 0.2894
 epoch: 12, train_loss: 1.0333, test_loss: 1.2087, test_f1: 0.3460
 epoch: 13, train_loss: 1.0418, test_loss: 1.1775, test_f1: 0.3789
 epoch: 14, train_loss: 1.0494, test_loss: 1.2288, test_f1: 0.4333
 epoch: 15, train_loss: 1.0476, test_loss: 1.2357, test_f1: 0.4276
 epoch: 16, train_loss: 1.0643, test_loss: 1.1502, test_f1: 0.3290
 epoch: 17, train_loss: 1.0712, test_loss: 1.1296, test_f1: 0.3370
 epoch: 18, train_loss: 1.0392, test_loss: 1.1590, test_f1: 0.4360
 epoch: 19, train_loss: 1.0446, test_loss: 1.1340, test_f1: 0.3700
 epoch: 20, train_loss: 1.0170, test_loss: 1.1717, test_f1: 0.4280
 epoch: 21, train_loss: 1.0212, test_loss: 1.3559, test_f1: 0.3730
 epoch: 22, train_loss: 1.0163, test_loss: 1.2209, test_f1: 0.4212
 epoch: 23, train_loss: 1.0296, test_loss: 1.2786, test_f1: 0.4131
 epoch: 24, train_loss: 1.0160, test_loss: 1.1722, test_f1: 0.3667
 epoch: 25, train_loss: 1.0219, test_loss: 1.1896, test_f1: 0.4284
 epoch: 26, train_loss: 1.0073, test_loss: 1.1576, test_f1: 0.4397
 epoch: 27, train_loss: 1.0185, test_loss: 1.3000, test_f1: 0.4183
 epoch: 28, train_loss: 1.0241, test_loss: 1.1655, test_f1: 0.4255
 epoch: 29, train_loss: 1.0137, test_loss: 1.1928, test_f1: 0.3646
 epoch: 30, train_loss: 1.0040, test_loss: 1.1106, test_f1: 0.3336
 epoch: 31, train_loss: 1.0093, test_loss: 1.3486, test_f1: 0.3035
 epoch: 32, train_loss: 1.0229, test_loss: 1.1037, test_f1: 0.3464
 epoch: 33, train_loss: 1.0248, test_loss: 1.1519, test_f1: 0.4375
 epoch: 34, train_loss: 1.0288, test_loss: 1.1403, test_f1: 0.3370
 epoch: 35, train_loss: 1.0180, test_loss: 1.2158, test_f1: 0.4109
 epoch: 36, train_loss: 1.0109, test_loss: 1.1046, test_f1: 0.3477
 epoch: 37, train_loss: 0.9993, test_loss: 1.1994, test_f1: 0.4184
 epoch: 38, train_loss: 1.0138, test_loss: 1.5793, test_f1: 0.3348
 epoch: 39, train_loss: 0.9962, test_loss: 1.7321, test_f1: 0.2570
 epoch: 40, train_loss: 1.0068, test_loss: 1.1817, test_f1: 0.4131
 epoch: 41, train_loss: 1.0304, test_loss: 1.1696, test_f1: 0.3344
 epoch: 42, train_loss: 1.0294, test_loss: 1.0968, test_f1: 0.3800
 epoch: 43, train_loss: 1.0210, test_loss: 1.1979, test_f1: 0.3262
 epoch: 44, train_loss: 1.0180, test_loss: 1.1309, test_f1: 0.4580
 epoch: 45, train_loss: 1.0692, test_loss: 1.1744, test_f1: 0.3395
 epoch: 46, train_loss: 1.0527, test_loss: 1.3025, test_f1: 0.2477
 epoch: 47, train_loss: 1.0325, test_loss: 1.3863, test_f1: 0.4224
 epoch: 48, train_loss: 1.0519, test_loss: 1.2024, test_f1: 0.4174
 epoch: 49, train_loss: 1.0713, test_loss: 1.1541, test_f1: 0.3833
 epoch: 50, train_loss: 1.0387, test_loss: 1.1408, test_f1: 0.3334
 epoch: 51, train_loss: 1.0242, test_loss: 1.1284, test_f1: 0.4518
 epoch: 52, train_loss: 1.0590, test_loss: 1.1435, test_f1: 0.3317
 epoch: 53, train_loss: 1.0549, test_loss: 1.1327, test_f1: 0.3317
 epoch: 54, train_loss: 1.0305, test_loss: 1.1328, test_f1: 0.4247
 epoch: 55, train_loss: 1.0117, test_loss: 1.0969, test_f1: 0.3792
 epoch: 56, train_loss: 1.0080, test_loss: 1.1000, test_f1: 0.3712
 epoch: 57, train_loss: 1.0041, test_loss: 1.0904, test_f1: 0.3395
 epoch: 58, train_loss: 1.0077, test_loss: 1.1149, test_f1: 0.3831
 epoch: 59, train_loss: 1.0032, test_loss: 1.1131, test_f1: 0.3901
 epoch: 60, train_loss: 1.0020, test_loss: 1.1033, test_f1: 0.3395
 epoch: 61, train_loss: 0.9852, test_loss: 1.1351, test_f1: 0.4386
 epoch: 62, train_loss: 0.9817, test_loss: 1.1917, test_f1: 0.4535
 epoch: 63, train_loss: 0.9782, test_loss: 1.1870, test_f1: 0.4672
 epoch: 64, train_loss: 0.9745, test_loss: 1.2248, test_f1: 0.4422
 epoch: 65, train_loss: 0.9747, test_loss: 1.1074, test_f1: 0.4629
 epoch: 66, train_loss: 0.9788, test_loss: 1.0600, test_f1: 0.4690
 epoch: 67, train_loss: 0.9786, test_loss: 1.1378, test_f1: 0.4460
 epoch: 68, train_loss: 0.9725, test_loss: 1.2169, test_f1: 0.3720
 epoch: 69, train_loss: 0.9695, test_loss: 1.2478, test_f1: 0.4281
 epoch: 70, train_loss: 0.9841, test_loss: 1.1604, test_f1: 0.3344
 epoch: 71, train_loss: 0.9762, test_loss: 1.0627, test_f1: 0.3421
 epoch: 72, train_loss: 0.9842, test_loss: 1.0834, test_f1: 0.3303
 epoch: 73, train_loss: 0.9625, test_loss: 1.1334, test_f1: 0.4178
 epoch: 74, train_loss: 0.9556, test_loss: 1.0847, test_f1: 0.3421
 epoch: 75, train_loss: 0.9598, test_loss: 1.1152, test_f1: 0.4874
 epoch: 76, train_loss: 0.9672, test_loss: 1.0626, test_f1: 0.3468
 epoch: 77, train_loss: 1.0032, test_loss: 1.0541, test_f1: 0.3753
 epoch: 78, train_loss: 0.9712, test_loss: 1.0483, test_f1: 0.4789
 epoch: 79, train_loss: 0.9559, test_loss: 1.1624, test_f1: 0.3066
 epoch: 80, train_loss: 0.9477, test_loss: 1.1349, test_f1: 0.4143
 epoch: 81, train_loss: 0.9467, test_loss: 1.0660, test_f1: 0.3923
 epoch: 82, train_loss: 0.9492, test_loss: 1.2139, test_f1: 0.3140
 epoch: 83, train_loss: 0.9611, test_loss: 1.0507, test_f1: 0.3467
 epoch: 84, train_loss: 0.9611, test_loss: 1.1075, test_f1: 0.4811
 epoch: 85, train_loss: 0.9743, test_loss: 1.1011, test_f1: 0.4590
 epoch: 86, train_loss: 0.9807, test_loss: 1.1433, test_f1: 0.3492
 epoch: 87, train_loss: 0.9609, test_loss: 1.1117, test_f1: 0.4401
 epoch: 88, train_loss: 0.9584, test_loss: 1.0823, test_f1: 0.3638
 epoch: 89, train_loss: 0.9561, test_loss: 1.0788, test_f1: 0.4644
 epoch: 90, train_loss: 0.9433, test_loss: 1.0646, test_f1: 0.3421
 epoch: 91, train_loss: 0.9326, test_loss: 1.0658, test_f1: 0.4262
 epoch: 92, train_loss: 0.9279, test_loss: 1.1229, test_f1: 0.4435
 epoch: 93, train_loss: 0.9340, test_loss: 1.0917, test_f1: 0.3550
 epoch: 94, train_loss: 0.9337, test_loss: 1.2988, test_f1: 0.4149
 epoch: 95, train_loss: 0.9372, test_loss: 1.1970, test_f1: 0.4554
 epoch: 96, train_loss: 0.9287, test_loss: 1.0853, test_f1: 0.3842
 epoch: 97, train_loss: 0.9217, test_loss: 1.1756, test_f1: 0.4123
 epoch: 98, train_loss: 0.9221, test_loss: 1.3704, test_f1: 0.4464
 epoch: 99, train_loss: 0.9208, test_loss: 1.4872, test_f1: 0.3804
##################ITERATION #6 ****************************************
 epoch: 0, train_loss: 1.7818, test_loss: 6.0491, test_f1: 0.2281
 epoch: 1, train_loss: 1.2670, test_loss: 1.3145, test_f1: 0.2267
 epoch: 2, train_loss: 1.1854, test_loss: 1.4095, test_f1: 0.1931
 epoch: 3, train_loss: 1.0658, test_loss: 1.5047, test_f1: 0.2336
 epoch: 4, train_loss: 1.0447, test_loss: 1.4179, test_f1: 0.3702
 epoch: 5, train_loss: 1.0275, test_loss: 1.2644, test_f1: 0.3630
 epoch: 6, train_loss: 1.0194, test_loss: 1.3702, test_f1: 0.4218
 epoch: 7, train_loss: 1.0315, test_loss: 1.1860, test_f1: 0.3490
 epoch: 8, train_loss: 1.0418, test_loss: 1.2289, test_f1: 0.4490
 epoch: 9, train_loss: 1.0372, test_loss: 1.4258, test_f1: 0.3636
 epoch: 10, train_loss: 1.0192, test_loss: 1.2041, test_f1: 0.3146
 epoch: 11, train_loss: 1.0271, test_loss: 1.2800, test_f1: 0.2913
 epoch: 12, train_loss: 1.0377, test_loss: 1.1229, test_f1: 0.3317
 epoch: 13, train_loss: 1.0023, test_loss: 1.1124, test_f1: 0.3738
 epoch: 14, train_loss: 0.9937, test_loss: 1.1539, test_f1: 0.4628
 epoch: 15, train_loss: 0.9964, test_loss: 1.3841, test_f1: 0.4448
 epoch: 16, train_loss: 0.9981, test_loss: 1.4688, test_f1: 0.2684
 epoch: 17, train_loss: 1.0583, test_loss: 1.1935, test_f1: 0.4278
 epoch: 18, train_loss: 1.0310, test_loss: 1.1968, test_f1: 0.4603
 epoch: 19, train_loss: 1.0115, test_loss: 1.3821, test_f1: 0.4511
 epoch: 20, train_loss: 1.0011, test_loss: 1.1208, test_f1: 0.4453
 epoch: 21, train_loss: 1.0259, test_loss: 1.1086, test_f1: 0.3344
 epoch: 22, train_loss: 1.0024, test_loss: 1.1268, test_f1: 0.4569
 epoch: 23, train_loss: 0.9868, test_loss: 1.4192, test_f1: 0.4405
 epoch: 24, train_loss: 0.9892, test_loss: 1.1133, test_f1: 0.3931
 epoch: 25, train_loss: 0.9926, test_loss: 1.0758, test_f1: 0.3480
 epoch: 26, train_loss: 0.9985, test_loss: 1.3944, test_f1: 0.2610
 epoch: 27, train_loss: 1.0096, test_loss: 1.2500, test_f1: 0.2814
 epoch: 28, train_loss: 0.9859, test_loss: 1.1125, test_f1: 0.3895
 epoch: 29, train_loss: 0.9984, test_loss: 1.1060, test_f1: 0.3317
 epoch: 30, train_loss: 1.0181, test_loss: 1.0730, test_f1: 0.4766
 epoch: 31, train_loss: 0.9901, test_loss: 1.0716, test_f1: 0.3395
 epoch: 32, train_loss: 1.0000, test_loss: 1.3698, test_f1: 0.3137
 epoch: 33, train_loss: 1.0252, test_loss: 1.5852, test_f1: 0.4090
 epoch: 34, train_loss: 1.0325, test_loss: 1.1370, test_f1: 0.4353
 epoch: 35, train_loss: 1.0415, test_loss: 1.1027, test_f1: 0.4259
 epoch: 36, train_loss: 1.0046, test_loss: 1.1018, test_f1: 0.4300
 epoch: 37, train_loss: 0.9921, test_loss: 1.0582, test_f1: 0.4689
 epoch: 38, train_loss: 0.9901, test_loss: 1.1096, test_f1: 0.4376
 epoch: 39, train_loss: 1.0070, test_loss: 1.0843, test_f1: 0.3395
 epoch: 40, train_loss: 1.0153, test_loss: 1.0844, test_f1: 0.4621
 epoch: 41, train_loss: 1.0077, test_loss: 1.0800, test_f1: 0.3461
 epoch: 42, train_loss: 1.0023, test_loss: 1.0756, test_f1: 0.3550
 epoch: 43, train_loss: 1.0042, test_loss: 1.0496, test_f1: 0.3372
 epoch: 44, train_loss: 0.9839, test_loss: 1.0918, test_f1: 0.4551
 epoch: 45, train_loss: 0.9914, test_loss: 1.0777, test_f1: 0.3395
 epoch: 46, train_loss: 0.9619, test_loss: 1.0786, test_f1: 0.4443
 epoch: 47, train_loss: 0.9714, test_loss: 1.1605, test_f1: 0.4069
 epoch: 48, train_loss: 0.9640, test_loss: 1.0741, test_f1: 0.3393
 epoch: 49, train_loss: 0.9792, test_loss: 1.1107, test_f1: 0.4047
 epoch: 50, train_loss: 0.9841, test_loss: 1.1112, test_f1: 0.4320
 epoch: 51, train_loss: 0.9746, test_loss: 1.1157, test_f1: 0.4181
 epoch: 52, train_loss: 0.9664, test_loss: 1.0496, test_f1: 0.4111
 epoch: 53, train_loss: 0.9697, test_loss: 1.0230, test_f1: 0.4784
 epoch: 54, train_loss: 0.9526, test_loss: 1.0232, test_f1: 0.3514
 epoch: 55, train_loss: 0.9555, test_loss: 1.0288, test_f1: 0.3468
 epoch: 56, train_loss: 0.9798, test_loss: 1.0632, test_f1: 0.3538
 epoch: 57, train_loss: 0.9803, test_loss: 1.1284, test_f1: 0.4560
 epoch: 58, train_loss: 0.9609, test_loss: 1.0837, test_f1: 0.4632
 epoch: 59, train_loss: 0.9589, test_loss: 1.0943, test_f1: 0.4559
 epoch: 60, train_loss: 0.9502, test_loss: 1.0774, test_f1: 0.4062
 epoch: 61, train_loss: 0.9562, test_loss: 1.0436, test_f1: 0.3828
 epoch: 62, train_loss: 0.9496, test_loss: 1.0960, test_f1: 0.4709
 epoch: 63, train_loss: 0.9536, test_loss: 1.0517, test_f1: 0.3525
 epoch: 64, train_loss: 0.9412, test_loss: 1.0832, test_f1: 0.4925
 epoch: 65, train_loss: 0.9382, test_loss: 1.0558, test_f1: 0.3634
 epoch: 66, train_loss: 0.9491, test_loss: 1.0985, test_f1: 0.4750
 epoch: 67, train_loss: 0.9878, test_loss: 1.1685, test_f1: 0.3290
 epoch: 68, train_loss: 0.9990, test_loss: 1.2336, test_f1: 0.3290
 epoch: 69, train_loss: 0.9806, test_loss: 1.1508, test_f1: 0.4251
 epoch: 70, train_loss: 0.9684, test_loss: 1.0950, test_f1: 0.3317
 epoch: 71, train_loss: 0.9757, test_loss: 1.0823, test_f1: 0.3842
 epoch: 72, train_loss: 0.9708, test_loss: 1.0752, test_f1: 0.4603
 epoch: 73, train_loss: 0.9569, test_loss: 1.0926, test_f1: 0.3377
 epoch: 74, train_loss: 0.9599, test_loss: 1.1008, test_f1: 0.4590
 epoch: 75, train_loss: 0.9575, test_loss: 1.0746, test_f1: 0.3363
 epoch: 76, train_loss: 0.9448, test_loss: 1.1144, test_f1: 0.3346
 epoch: 77, train_loss: 0.9381, test_loss: 1.0569, test_f1: 0.4728
 epoch: 78, train_loss: 0.9535, test_loss: 1.0621, test_f1: 0.3940
 epoch: 79, train_loss: 0.9306, test_loss: 1.0569, test_f1: 0.3477
 epoch: 80, train_loss: 0.9309, test_loss: 1.0302, test_f1: 0.3563
 epoch: 81, train_loss: 0.9411, test_loss: 1.1242, test_f1: 0.4836
 epoch: 82, train_loss: 0.9381, test_loss: 1.0741, test_f1: 0.3912
 epoch: 83, train_loss: 0.9426, test_loss: 1.1007, test_f1: 0.3567
 epoch: 84, train_loss: 0.9826, test_loss: 1.1125, test_f1: 0.4272
 epoch: 85, train_loss: 0.9694, test_loss: 1.2739, test_f1: 0.3403
 epoch: 86, train_loss: 0.9602, test_loss: 1.1490, test_f1: 0.4418
 epoch: 87, train_loss: 0.9448, test_loss: 1.2209, test_f1: 0.4273
 epoch: 88, train_loss: 0.9409, test_loss: 1.0995, test_f1: 0.3384
 epoch: 89, train_loss: 0.9572, test_loss: 1.0572, test_f1: 0.4437
 epoch: 90, train_loss: 0.9742, test_loss: 1.0906, test_f1: 0.3845
 epoch: 91, train_loss: 0.9544, test_loss: 1.0909, test_f1: 0.3366
 epoch: 92, train_loss: 0.9735, test_loss: 1.1549, test_f1: 0.4304
 epoch: 93, train_loss: 0.9576, test_loss: 1.1275, test_f1: 0.3687
 epoch: 94, train_loss: 0.9437, test_loss: 1.1881, test_f1: 0.4595
 epoch: 95, train_loss: 0.9342, test_loss: 1.3291, test_f1: 0.4658
 epoch: 96, train_loss: 0.9286, test_loss: 1.3164, test_f1: 0.4607
 epoch: 97, train_loss: 0.9436, test_loss: 1.2115, test_f1: 0.4643
 epoch: 98, train_loss: 0.9116, test_loss: 1.1402, test_f1: 0.4580
 epoch: 99, train_loss: 0.9209, test_loss: 1.1393, test_f1: 0.3618
##################ITERATION #7 ****************************************
 epoch: 0, train_loss: 1.4227, test_loss: 3.1713, test_f1: 0.1771
 epoch: 1, train_loss: 1.2766, test_loss: 1.3013, test_f1: 0.2281
 epoch: 2, train_loss: 1.2558, test_loss: 1.3047, test_f1: 0.2281
 epoch: 3, train_loss: 1.2505, test_loss: 1.3108, test_f1: 0.2281
 epoch: 4, train_loss: 1.2536, test_loss: 1.3038, test_f1: 0.1419
 epoch: 5, train_loss: 1.2213, test_loss: 1.3062, test_f1: 0.2572
 epoch: 6, train_loss: 1.2018, test_loss: 1.2851, test_f1: 0.2674
 epoch: 7, train_loss: 1.1742, test_loss: 1.1527, test_f1: 0.3290
 epoch: 8, train_loss: 1.1057, test_loss: 1.1468, test_f1: 0.3290
 epoch: 9, train_loss: 1.0741, test_loss: 1.1598, test_f1: 0.3290
 epoch: 10, train_loss: 1.0835, test_loss: 1.1798, test_f1: 0.3317
 epoch: 11, train_loss: 1.0792, test_loss: 1.1687, test_f1: 0.3290
 epoch: 12, train_loss: 1.1069, test_loss: 1.1182, test_f1: 0.3395
 epoch: 13, train_loss: 1.0583, test_loss: 1.1230, test_f1: 0.3395
 epoch: 14, train_loss: 1.0607, test_loss: 1.1561, test_f1: 0.3317
 epoch: 15, train_loss: 1.0735, test_loss: 1.2060, test_f1: 0.3205
 epoch: 16, train_loss: 1.0759, test_loss: 1.1884, test_f1: 0.3264
 epoch: 17, train_loss: 1.0784, test_loss: 1.2230, test_f1: 0.3115
 epoch: 18, train_loss: 1.0791, test_loss: 1.1776, test_f1: 0.3205
 epoch: 19, train_loss: 1.0633, test_loss: 1.1618, test_f1: 0.3290
 epoch: 20, train_loss: 1.0570, test_loss: 1.1637, test_f1: 0.3290
 epoch: 21, train_loss: 1.0512, test_loss: 1.1551, test_f1: 0.3290
 epoch: 22, train_loss: 1.0540, test_loss: 1.1596, test_f1: 0.3290
 epoch: 23, train_loss: 1.0578, test_loss: 1.2099, test_f1: 0.3146
 epoch: 24, train_loss: 1.0550, test_loss: 1.1502, test_f1: 0.3370
 epoch: 25, train_loss: 1.0636, test_loss: 1.2996, test_f1: 0.2838
 epoch: 26, train_loss: 1.0854, test_loss: 1.1266, test_f1: 0.3395
 epoch: 27, train_loss: 1.0549, test_loss: 1.1292, test_f1: 0.3395
 epoch: 28, train_loss: 1.0494, test_loss: 1.1352, test_f1: 0.3395
 epoch: 29, train_loss: 1.0509, test_loss: 1.1706, test_f1: 0.3234
 epoch: 30, train_loss: 1.0395, test_loss: 1.2060, test_f1: 0.3205
 epoch: 31, train_loss: 1.0438, test_loss: 1.1245, test_f1: 0.3395
 epoch: 32, train_loss: 1.0696, test_loss: 1.1406, test_f1: 0.3344
 epoch: 33, train_loss: 1.0767, test_loss: 1.1392, test_f1: 0.3388
 epoch: 34, train_loss: 1.0578, test_loss: 1.1558, test_f1: 0.3290
 epoch: 35, train_loss: 1.0770, test_loss: 1.1571, test_f1: 0.3290
 epoch: 36, train_loss: 1.0740, test_loss: 1.1496, test_f1: 0.3317
 epoch: 37, train_loss: 1.0475, test_loss: 1.1285, test_f1: 0.2432
 epoch: 38, train_loss: 1.0638, test_loss: 1.1695, test_f1: 0.3290
 epoch: 39, train_loss: 1.0770, test_loss: 1.1667, test_f1: 0.2334
 epoch: 40, train_loss: 1.0821, test_loss: 1.1429, test_f1: 0.3290
 epoch: 41, train_loss: 1.0715, test_loss: 1.1565, test_f1: 0.3317
 epoch: 42, train_loss: 1.0539, test_loss: 1.1208, test_f1: 0.3395
 epoch: 43, train_loss: 1.0434, test_loss: 1.1335, test_f1: 0.3395
 epoch: 44, train_loss: 1.0408, test_loss: 1.1325, test_f1: 0.3395
 epoch: 45, train_loss: 1.0423, test_loss: 1.1387, test_f1: 0.3395
 epoch: 46, train_loss: 1.0530, test_loss: 1.3878, test_f1: 0.2609
 epoch: 47, train_loss: 1.1007, test_loss: 1.1322, test_f1: 0.3344
 epoch: 48, train_loss: 1.0461, test_loss: 1.1171, test_f1: 0.3395
 epoch: 49, train_loss: 1.0451, test_loss: 1.1485, test_f1: 0.2432
 epoch: 50, train_loss: 1.1051, test_loss: 1.1475, test_f1: 0.3317
 epoch: 51, train_loss: 1.0541, test_loss: 1.1380, test_f1: 0.3344
 epoch: 52, train_loss: 1.0522, test_loss: 1.1322, test_f1: 0.2435
 epoch: 53, train_loss: 1.0478, test_loss: 1.1050, test_f1: 0.3444
 epoch: 54, train_loss: 1.0679, test_loss: 1.1305, test_f1: 0.3395
 epoch: 55, train_loss: 1.0494, test_loss: 1.1505, test_f1: 0.3344
 epoch: 56, train_loss: 1.0726, test_loss: 1.1306, test_f1: 0.3344
 epoch: 57, train_loss: 1.0555, test_loss: 1.1259, test_f1: 0.3395
 epoch: 58, train_loss: 1.0396, test_loss: 1.1126, test_f1: 0.3444
 epoch: 59, train_loss: 1.0450, test_loss: 1.1326, test_f1: 0.3395
 epoch: 60, train_loss: 1.0515, test_loss: 1.1419, test_f1: 0.3344
 epoch: 61, train_loss: 1.0654, test_loss: 1.1468, test_f1: 0.3317
 epoch: 62, train_loss: 1.0620, test_loss: 1.1362, test_f1: 0.3344
 epoch: 63, train_loss: 1.0521, test_loss: 1.1052, test_f1: 0.3444
 epoch: 64, train_loss: 1.0486, test_loss: 1.1140, test_f1: 0.3430
 epoch: 65, train_loss: 1.0320, test_loss: 1.1366, test_f1: 0.3395
 epoch: 66, train_loss: 1.0421, test_loss: 1.1393, test_f1: 0.3344
 epoch: 67, train_loss: 1.0528, test_loss: 1.1369, test_f1: 0.3344
 epoch: 68, train_loss: 1.0605, test_loss: 1.1377, test_f1: 0.3344
 epoch: 69, train_loss: 1.0534, test_loss: 1.1280, test_f1: 0.3395
 epoch: 70, train_loss: 1.0455, test_loss: 1.1180, test_f1: 0.3395
 epoch: 71, train_loss: 1.0406, test_loss: 1.1089, test_f1: 0.3420
 epoch: 72, train_loss: 1.0541, test_loss: 1.1254, test_f1: 0.3395
 epoch: 73, train_loss: 1.0471, test_loss: 1.1373, test_f1: 0.3344
 epoch: 74, train_loss: 1.0456, test_loss: 1.1301, test_f1: 0.3395
 epoch: 75, train_loss: 1.0483, test_loss: 1.2603, test_f1: 0.3282
 epoch: 76, train_loss: 1.3212, test_loss: 2.9960, test_f1: 0.1646
 epoch: 77, train_loss: 1.1547, test_loss: 1.1781, test_f1: 0.3290
 epoch: 78, train_loss: 1.0810, test_loss: 1.2683, test_f1: 0.2949
 epoch: 79, train_loss: 1.0784, test_loss: 1.1889, test_f1: 0.3176
 epoch: 80, train_loss: 1.0746, test_loss: 1.1647, test_f1: 0.3262
 epoch: 81, train_loss: 1.0796, test_loss: 1.1492, test_f1: 0.3290
 epoch: 82, train_loss: 1.0738, test_loss: 1.1568, test_f1: 0.3290
 epoch: 83, train_loss: 1.0707, test_loss: 1.1586, test_f1: 0.3290
 epoch: 84, train_loss: 1.0705, test_loss: 1.1584, test_f1: 0.3290
 epoch: 85, train_loss: 1.0703, test_loss: 1.1563, test_f1: 0.3290
 epoch: 86, train_loss: 1.0713, test_loss: 1.1496, test_f1: 0.3317
 epoch: 87, train_loss: 1.0967, test_loss: 1.1586, test_f1: 0.3290
 epoch: 88, train_loss: 1.0531, test_loss: 1.1696, test_f1: 0.3290
 epoch: 89, train_loss: 1.0641, test_loss: 1.1306, test_f1: 0.3395
 epoch: 90, train_loss: 1.0480, test_loss: 1.1164, test_f1: 0.3395
 epoch: 91, train_loss: 1.0612, test_loss: 1.1279, test_f1: 0.3395
 epoch: 92, train_loss: 1.0594, test_loss: 1.1253, test_f1: 0.3395
 epoch: 93, train_loss: 1.0582, test_loss: 1.1250, test_f1: 0.3395
 epoch: 94, train_loss: 1.0569, test_loss: 1.1225, test_f1: 0.3395
 epoch: 95, train_loss: 1.0581, test_loss: 1.1219, test_f1: 0.3395
 epoch: 96, train_loss: 1.0438, test_loss: 1.1223, test_f1: 0.3395
 epoch: 97, train_loss: 1.0465, test_loss: 1.1332, test_f1: 0.3395
 epoch: 98, train_loss: 1.0470, test_loss: 1.1348, test_f1: 0.3395
 epoch: 99, train_loss: 1.0430, test_loss: 1.1307, test_f1: 0.3395
##################ITERATION #8 ****************************************
 epoch: 0, train_loss: 2.0965, test_loss: 30.5109, test_f1: 0.0301
 epoch: 1, train_loss: 1.3267, test_loss: 2.7059, test_f1: 0.1906
 epoch: 2, train_loss: 1.2490, test_loss: 1.8135, test_f1: 0.2336
 epoch: 3, train_loss: 1.2429, test_loss: 1.3156, test_f1: 0.2718
 epoch: 4, train_loss: 1.2335, test_loss: 1.4987, test_f1: 0.2281
 epoch: 5, train_loss: 1.2086, test_loss: 1.3271, test_f1: 0.1603
 epoch: 6, train_loss: 1.1838, test_loss: 1.1847, test_f1: 0.3205
 epoch: 7, train_loss: 1.0969, test_loss: 1.6493, test_f1: 0.2572
 epoch: 8, train_loss: 1.1046, test_loss: 1.1795, test_f1: 0.4179
 epoch: 9, train_loss: 1.0709, test_loss: 1.2510, test_f1: 0.3968
 epoch: 10, train_loss: 1.0488, test_loss: 1.1290, test_f1: 0.4018
 epoch: 11, train_loss: 1.0457, test_loss: 1.2468, test_f1: 0.3674
 epoch: 12, train_loss: 1.0531, test_loss: 1.1129, test_f1: 0.3838
 epoch: 13, train_loss: 1.0280, test_loss: 1.1500, test_f1: 0.4016
 epoch: 14, train_loss: 1.0955, test_loss: 1.2058, test_f1: 0.4503
 epoch: 15, train_loss: 1.0655, test_loss: 1.0952, test_f1: 0.3386
 epoch: 16, train_loss: 1.0594, test_loss: 1.1971, test_f1: 0.3989
 epoch: 17, train_loss: 1.0555, test_loss: 1.1059, test_f1: 0.4249
 epoch: 18, train_loss: 1.0521, test_loss: 1.1455, test_f1: 0.4353
 epoch: 19, train_loss: 1.0424, test_loss: 1.1094, test_f1: 0.3581
 epoch: 20, train_loss: 1.0363, test_loss: 1.2204, test_f1: 0.4611
 epoch: 21, train_loss: 1.0622, test_loss: 1.1057, test_f1: 0.4190
 epoch: 22, train_loss: 1.0486, test_loss: 1.1028, test_f1: 0.3344
 epoch: 23, train_loss: 1.0389, test_loss: 1.1693, test_f1: 0.4359
 epoch: 24, train_loss: 1.0295, test_loss: 1.1071, test_f1: 0.3441
 epoch: 25, train_loss: 1.0052, test_loss: 1.3246, test_f1: 0.4064
 epoch: 26, train_loss: 1.0766, test_loss: 1.3112, test_f1: 0.4178
 epoch: 27, train_loss: 1.0594, test_loss: 1.1091, test_f1: 0.4321
 epoch: 28, train_loss: 1.0432, test_loss: 1.1460, test_f1: 0.3317
 epoch: 29, train_loss: 1.0647, test_loss: 1.1218, test_f1: 0.4157
 epoch: 30, train_loss: 1.0381, test_loss: 1.1318, test_f1: 0.3886
 epoch: 31, train_loss: 1.0457, test_loss: 1.1185, test_f1: 0.3395
 epoch: 32, train_loss: 1.0450, test_loss: 1.1534, test_f1: 0.4211
 epoch: 33, train_loss: 1.0356, test_loss: 1.1670, test_f1: 0.3290
 epoch: 34, train_loss: 1.0257, test_loss: 1.1541, test_f1: 0.4710
 epoch: 35, train_loss: 1.0503, test_loss: 1.1324, test_f1: 0.4211
 epoch: 36, train_loss: 1.0275, test_loss: 1.1280, test_f1: 0.3395
 epoch: 37, train_loss: 1.0221, test_loss: 1.1414, test_f1: 0.4480
 epoch: 38, train_loss: 1.0506, test_loss: 1.1508, test_f1: 0.3921
 epoch: 39, train_loss: 1.0294, test_loss: 1.1672, test_f1: 0.4424
 epoch: 40, train_loss: 1.0464, test_loss: 1.1151, test_f1: 0.3344
 epoch: 41, train_loss: 1.0215, test_loss: 1.1351, test_f1: 0.4346
 epoch: 42, train_loss: 1.0132, test_loss: 1.0913, test_f1: 0.4365
 epoch: 43, train_loss: 1.0162, test_loss: 1.2102, test_f1: 0.3317
 epoch: 44, train_loss: 1.0182, test_loss: 1.3888, test_f1: 0.3193
 epoch: 45, train_loss: 1.0149, test_loss: 1.1895, test_f1: 0.4480
 epoch: 46, train_loss: 1.0205, test_loss: 1.1933, test_f1: 0.3960
 epoch: 47, train_loss: 1.0081, test_loss: 1.2447, test_f1: 0.4592
 epoch: 48, train_loss: 1.0043, test_loss: 1.1269, test_f1: 0.4482
 epoch: 49, train_loss: 1.0184, test_loss: 1.1072, test_f1: 0.3344
 epoch: 50, train_loss: 1.0041, test_loss: 1.1637, test_f1: 0.4734
 epoch: 51, train_loss: 0.9995, test_loss: 1.1461, test_f1: 0.3808
 epoch: 52, train_loss: 0.9887, test_loss: 1.1822, test_f1: 0.4279
 epoch: 53, train_loss: 0.9900, test_loss: 1.0896, test_f1: 0.3395
 epoch: 54, train_loss: 0.9899, test_loss: 1.2333, test_f1: 0.4570
 epoch: 55, train_loss: 0.9840, test_loss: 1.1970, test_f1: 0.4773
 epoch: 56, train_loss: 0.9842, test_loss: 1.0979, test_f1: 0.4675
 epoch: 57, train_loss: 0.9813, test_loss: 1.2047, test_f1: 0.3040
 epoch: 58, train_loss: 0.9830, test_loss: 1.1982, test_f1: 0.3020
 epoch: 59, train_loss: 0.9822, test_loss: 1.1711, test_f1: 0.4475
 epoch: 60, train_loss: 0.9757, test_loss: 1.1426, test_f1: 0.3290
 epoch: 61, train_loss: 0.9597, test_loss: 1.1067, test_f1: 0.4745
 epoch: 62, train_loss: 0.9644, test_loss: 1.1230, test_f1: 0.4715
 epoch: 63, train_loss: 0.9614, test_loss: 1.0682, test_f1: 0.3377
 epoch: 64, train_loss: 0.9670, test_loss: 1.1303, test_f1: 0.4845
 epoch: 65, train_loss: 0.9608, test_loss: 1.1129, test_f1: 0.3824
 epoch: 66, train_loss: 0.9993, test_loss: 1.3090, test_f1: 0.4145
 epoch: 67, train_loss: 0.9922, test_loss: 1.2046, test_f1: 0.4594
 epoch: 68, train_loss: 0.9699, test_loss: 1.1640, test_f1: 0.4404
 epoch: 69, train_loss: 0.9566, test_loss: 1.2158, test_f1: 0.4533
 epoch: 70, train_loss: 0.9626, test_loss: 1.1549, test_f1: 0.3238
 epoch: 71, train_loss: 0.9571, test_loss: 1.0709, test_f1: 0.4335
 epoch: 72, train_loss: 0.9480, test_loss: 1.0735, test_f1: 0.3326
 epoch: 73, train_loss: 0.9492, test_loss: 1.2429, test_f1: 0.4299
 epoch: 74, train_loss: 0.9468, test_loss: 1.1655, test_f1: 0.4657
 epoch: 75, train_loss: 0.9335, test_loss: 1.0484, test_f1: 0.4200
 epoch: 76, train_loss: 0.9416, test_loss: 1.1450, test_f1: 0.3317
 epoch: 77, train_loss: 0.9882, test_loss: 1.1328, test_f1: 0.3344
 epoch: 78, train_loss: 0.9521, test_loss: 1.0705, test_f1: 0.4695
 epoch: 79, train_loss: 0.9492, test_loss: 1.2154, test_f1: 0.3654
 epoch: 80, train_loss: 0.9445, test_loss: 1.1421, test_f1: 0.4511
 epoch: 81, train_loss: 0.9429, test_loss: 1.1553, test_f1: 0.4733
 epoch: 82, train_loss: 0.9427, test_loss: 1.1525, test_f1: 0.3135
 epoch: 83, train_loss: 0.9671, test_loss: 1.1278, test_f1: 0.3344
 epoch: 84, train_loss: 0.9434, test_loss: 1.1139, test_f1: 0.4554
 epoch: 85, train_loss: 0.9321, test_loss: 1.0652, test_f1: 0.4801
 epoch: 86, train_loss: 0.9542, test_loss: 1.0640, test_f1: 0.3384
 epoch: 87, train_loss: 0.9607, test_loss: 1.1611, test_f1: 0.3989
 epoch: 88, train_loss: 0.9229, test_loss: 1.2624, test_f1: 0.3769
 epoch: 89, train_loss: 0.9309, test_loss: 1.2670, test_f1: 0.4405
 epoch: 90, train_loss: 0.9410, test_loss: 1.1182, test_f1: 0.4285
 epoch: 91, train_loss: 0.9560, test_loss: 1.0534, test_f1: 0.3400
 epoch: 92, train_loss: 0.9595, test_loss: 1.0622, test_f1: 0.3498
 epoch: 93, train_loss: 0.9477, test_loss: 1.0956, test_f1: 0.4592
 epoch: 94, train_loss: 0.9388, test_loss: 1.1032, test_f1: 0.3798
 epoch: 95, train_loss: 0.9384, test_loss: 1.2035, test_f1: 0.4787
 epoch: 96, train_loss: 0.9194, test_loss: 1.2238, test_f1: 0.4517
 epoch: 97, train_loss: 0.9078, test_loss: 1.0954, test_f1: 0.4318
 epoch: 98, train_loss: 0.9579, test_loss: 1.1377, test_f1: 0.3309
 epoch: 99, train_loss: 0.9631, test_loss: 1.5164, test_f1: 0.2620
##################ITERATION #9 ****************************************
 epoch: 0, train_loss: 2.0684, test_loss: 1.3860, test_f1: 0.2281
 epoch: 1, train_loss: 1.3253, test_loss: 4.0062, test_f1: 0.3272
 epoch: 2, train_loss: 1.1653, test_loss: 2.1846, test_f1: 0.1557
 epoch: 3, train_loss: 1.1086, test_loss: 3.3176, test_f1: 0.1284
 epoch: 4, train_loss: 1.0640, test_loss: 3.1036, test_f1: 0.1130
 epoch: 5, train_loss: 1.0638, test_loss: 1.1468, test_f1: 0.3299
 epoch: 6, train_loss: 1.0763, test_loss: 1.1669, test_f1: 0.4211
 epoch: 7, train_loss: 1.0898, test_loss: 1.2055, test_f1: 0.3299
 epoch: 8, train_loss: 1.0528, test_loss: 1.8709, test_f1: 0.2191
 epoch: 9, train_loss: 1.0518, test_loss: 1.2003, test_f1: 0.2961
 epoch: 10, train_loss: 1.0507, test_loss: 1.1130, test_f1: 0.3461
 epoch: 11, train_loss: 1.0429, test_loss: 1.1532, test_f1: 0.3317
 epoch: 12, train_loss: 1.0145, test_loss: 1.2028, test_f1: 0.3317
 epoch: 13, train_loss: 1.0155, test_loss: 1.2031, test_f1: 0.3146
 epoch: 14, train_loss: 1.0108, test_loss: 1.1667, test_f1: 0.3212
 epoch: 15, train_loss: 0.9981, test_loss: 1.1606, test_f1: 0.4355
 epoch: 16, train_loss: 1.0241, test_loss: 1.2314, test_f1: 0.3795
 epoch: 17, train_loss: 1.0319, test_loss: 1.1295, test_f1: 0.3171
 epoch: 18, train_loss: 1.0072, test_loss: 2.7632, test_f1: 0.1869
 epoch: 19, train_loss: 1.0013, test_loss: 8.2533, test_f1: 0.0727
 epoch: 20, train_loss: 0.9838, test_loss: 1.1735, test_f1: 0.3088
 epoch: 21, train_loss: 1.0087, test_loss: 3.7498, test_f1: 0.1643
 epoch: 22, train_loss: 1.0073, test_loss: 2.7823, test_f1: 0.2906
 epoch: 23, train_loss: 1.0057, test_loss: 1.4429, test_f1: 0.3673
 epoch: 24, train_loss: 1.0061, test_loss: 1.3785, test_f1: 0.4240
 epoch: 25, train_loss: 1.0001, test_loss: 1.3728, test_f1: 0.4548
 epoch: 26, train_loss: 0.9937, test_loss: 1.1543, test_f1: 0.4406
 epoch: 27, train_loss: 0.9698, test_loss: 1.1693, test_f1: 0.3628
 epoch: 28, train_loss: 0.9682, test_loss: 1.4523, test_f1: 0.3614
 epoch: 29, train_loss: 0.9767, test_loss: 3.2029, test_f1: 0.2545
 epoch: 30, train_loss: 0.9799, test_loss: 4.9637, test_f1: 0.2842
 epoch: 31, train_loss: 1.0960, test_loss: 23.1151, test_f1: 0.0301
 epoch: 32, train_loss: 1.0503, test_loss: 34.4561, test_f1: 0.0301
 epoch: 33, train_loss: 1.0422, test_loss: 13.4468, test_f1: 0.0355
 epoch: 34, train_loss: 1.0205, test_loss: 5.3520, test_f1: 0.1395
 epoch: 35, train_loss: 1.0060, test_loss: 1.2408, test_f1: 0.3342
 epoch: 36, train_loss: 1.0009, test_loss: 1.1311, test_f1: 0.3330
 epoch: 37, train_loss: 0.9921, test_loss: 1.1618, test_f1: 0.3158
 epoch: 38, train_loss: 1.0055, test_loss: 1.0877, test_f1: 0.3260
 epoch: 39, train_loss: 0.9877, test_loss: 1.1373, test_f1: 0.3748
 epoch: 40, train_loss: 0.9834, test_loss: 1.1117, test_f1: 0.4384
 epoch: 41, train_loss: 1.0013, test_loss: 1.1375, test_f1: 0.3351
 epoch: 42, train_loss: 0.9822, test_loss: 1.1165, test_f1: 0.4506
 epoch: 43, train_loss: 1.0090, test_loss: 1.1383, test_f1: 0.3372
 epoch: 44, train_loss: 0.9941, test_loss: 1.1144, test_f1: 0.4842
 epoch: 45, train_loss: 0.9780, test_loss: 1.1597, test_f1: 0.3494
 epoch: 46, train_loss: 0.9744, test_loss: 1.0958, test_f1: 0.4479
 epoch: 47, train_loss: 0.9629, test_loss: 1.0955, test_f1: 0.3298
 epoch: 48, train_loss: 0.9585, test_loss: 1.2477, test_f1: 0.3898
 epoch: 49, train_loss: 0.9769, test_loss: 1.1150, test_f1: 0.4666
 epoch: 50, train_loss: 0.9565, test_loss: 1.1033, test_f1: 0.4021
 epoch: 51, train_loss: 0.9699, test_loss: 1.1272, test_f1: 0.4761
 epoch: 52, train_loss: 0.9472, test_loss: 1.0753, test_f1: 0.4691
 epoch: 53, train_loss: 0.9405, test_loss: 1.0549, test_f1: 0.4081
 epoch: 54, train_loss: 0.9436, test_loss: 1.1193, test_f1: 0.5132
 epoch: 55, train_loss: 0.9340, test_loss: 1.1691, test_f1: 0.4908
 epoch: 56, train_loss: 0.9280, test_loss: 1.1738, test_f1: 0.5312
 epoch: 57, train_loss: 0.9646, test_loss: 1.2295, test_f1: 0.5011
 epoch: 58, train_loss: 0.9418, test_loss: 1.4288, test_f1: 0.4325
 epoch: 59, train_loss: 0.9364, test_loss: 1.1457, test_f1: 0.5133
 epoch: 60, train_loss: 0.9381, test_loss: 1.1587, test_f1: 0.4681
 epoch: 61, train_loss: 0.9272, test_loss: 1.1496, test_f1: 0.5218
 epoch: 62, train_loss: 0.9286, test_loss: 1.1786, test_f1: 0.5079
 epoch: 63, train_loss: 0.9333, test_loss: 1.0636, test_f1: 0.5471
 epoch: 64, train_loss: 0.9364, test_loss: 1.0718, test_f1: 0.4503
 epoch: 65, train_loss: 0.9436, test_loss: 1.0337, test_f1: 0.4667
 epoch: 66, train_loss: 0.9229, test_loss: 1.0700, test_f1: 0.4639
 epoch: 67, train_loss: 0.9135, test_loss: 1.0752, test_f1: 0.5510
 epoch: 68, train_loss: 0.9159, test_loss: 1.0646, test_f1: 0.5188
 epoch: 69, train_loss: 0.9083, test_loss: 1.1248, test_f1: 0.5238
 epoch: 70, train_loss: 0.9243, test_loss: 1.1243, test_f1: 0.4237
 epoch: 71, train_loss: 0.9281, test_loss: 1.0233, test_f1: 0.4714
 epoch: 72, train_loss: 0.9095, test_loss: 1.0467, test_f1: 0.5441
 epoch: 73, train_loss: 0.9046, test_loss: 1.0004, test_f1: 0.5489
 epoch: 74, train_loss: 0.8782, test_loss: 1.0486, test_f1: 0.5350
 epoch: 75, train_loss: 0.8688, test_loss: 1.0235, test_f1: 0.5481
 epoch: 76, train_loss: 0.8569, test_loss: 1.0912, test_f1: 0.4872
 epoch: 77, train_loss: 0.8908, test_loss: 1.0005, test_f1: 0.4574
 epoch: 78, train_loss: 0.8937, test_loss: 1.0640, test_f1: 0.5015
 epoch: 79, train_loss: 0.8648, test_loss: 1.0798, test_f1: 0.5360
 epoch: 80, train_loss: 0.8652, test_loss: 1.0311, test_f1: 0.5570
 epoch: 81, train_loss: 0.8539, test_loss: 1.0414, test_f1: 0.5511
 epoch: 82, train_loss: 0.8329, test_loss: 1.1551, test_f1: 0.5486
 epoch: 83, train_loss: 0.8317, test_loss: 0.9977, test_f1: 0.5641
 epoch: 84, train_loss: 0.8433, test_loss: 1.0355, test_f1: 0.5258
 epoch: 85, train_loss: 0.9575, test_loss: 1.4949, test_f1: 0.3366
 epoch: 86, train_loss: 0.9596, test_loss: 1.2264, test_f1: 0.4254
 epoch: 87, train_loss: 0.9328, test_loss: 1.0565, test_f1: 0.4350
 epoch: 88, train_loss: 0.9368, test_loss: 1.0948, test_f1: 0.4679
 epoch: 89, train_loss: 0.9396, test_loss: 1.0380, test_f1: 0.5099
 epoch: 90, train_loss: 0.9159, test_loss: 1.0587, test_f1: 0.4077
 epoch: 91, train_loss: 0.9364, test_loss: 1.1642, test_f1: 0.5323
 epoch: 92, train_loss: 0.9061, test_loss: 1.1015, test_f1: 0.4250
 epoch: 93, train_loss: 0.9025, test_loss: 1.0074, test_f1: 0.4826
 epoch: 94, train_loss: 0.9912, test_loss: 1.0793, test_f1: 0.3983
 epoch: 95, train_loss: 0.9749, test_loss: 1.0507, test_f1: 0.4422
 epoch: 96, train_loss: 0.9457, test_loss: 0.9826, test_f1: 0.4871
 epoch: 97, train_loss: 0.9330, test_loss: 0.9889, test_f1: 0.4552
 epoch: 98, train_loss: 0.9182, test_loss: 0.9793, test_f1: 0.5795
 epoch: 99, train_loss: 0.9062, test_loss: 1.0025, test_f1: 0.4553

Training completed in 302.23 seconds
Best F1: 0.5795 at epoch 98
Mean F1 across iterations: 0.4609  0.0676
========================FINAL RESULTS================================
FEGIN weighted F1: 0.5795  0.0676
python main.py --data ltspice_demos --representation component_pin_net --model FEGIN --layers 3 --hiddens 32 --batch_size 256 --lr 0.1 --emb_size 128 --epochs 100 --save_appendix component_pin_net_L3_H32_BS256_LR0.1_E128 --no_val
-----



STDERR:
  File "main.py", line 370, in <module>
    main()
  File "main.py", line 254, in main
    dataset = dataset_class(
  File "/home/philip/projects/ltspice_examples_code_repo/Circuit-Completion-Using-GNNs/component_classification_with_link_prediction_head/evaluation/FEGIN/kernel/circuit_datasets.py", line 15, in __init__
    self.data, self.slices = torch.load(self.processed_paths[0])
  File "/home/philip/.local/lib/python3.8/site-packages/torch/serialization.py", line 1040, in load
    warnings.warn(
  File "/usr/lib/python3.8/warnings.py", line 109, in _showwarnmsg
    sw(msg.message, msg.category, msg.filename, msg.lineno,
  File "main.py", line 47, in warn_with_traceback
    traceback.print_stack(file=log)
/home/philip/projects/ltspice_examples_code_repo/Circuit-Completion-Using-GNNs/component_classification_with_link_prediction_head/evaluation/FEGIN/kernel/circuit_datasets.py:15: FutureWarning: You are using `torch.load` with `weights_only=False` (the current default value), which uses the default pickle module implicitly. It is possible to construct malicious pickle data which will execute arbitrary code during unpickling (See https://github.com/pytorch/pytorch/blob/main/SECURITY.md#untrusted-models for more details). In a future release, the default value for `weights_only` will be flipped to `True`. This limits the functions that could be executed during unpickling. Arbitrary objects will no longer be allowed to be loaded via this mode unless they are explicitly allowlisted by the user via `torch.serialization.add_safe_globals`. We recommend you start setting `weights_only=True` for any use case where you don't have full control of the loaded file. Please open an issue on GitHub for any issues related to this experimental feature.
  self.data, self.slices = torch.load(self.processed_paths[0])
