STDOUT:
Results will be saved in /home/philip/projects/ltspice_examples_code_repo/Circuit-Completion-Using-GNNs/component_classification_with_link_prediction_head/evaluation/FEGIN/results/model_FEGIN_dataset_ltspice_examples
Command line input: python main.py --data ltspice_examples --representation component_pin_net --model FEGIN --layers 6 --hiddens 128 --batch_size 32 --lr 0.001 --emb_size 128 --epochs 100 --save_appendix component_pin_net_L6_H128_BS32_LR0.001_E128 --no_val
 is saved.
-----
ltspice_examples - FEGIN
Using 6 layers, 128 hidden units, h = 2
Loading component_pin_net representation dataset
ENTERED
Training FEGIN on component_pin_net representation
Train: 3558, Test: 846
##################ITERATION #0 ****************************************
 epoch: 0, train_loss: 1.1327, test_loss: 1.0825, test_f1: 0.4424
 epoch: 1, train_loss: 0.9903, test_loss: 0.9783, test_f1: 0.4732
 epoch: 2, train_loss: 0.9512, test_loss: 0.9448, test_f1: 0.5325
 epoch: 3, train_loss: 0.9280, test_loss: 0.9557, test_f1: 0.4638
 epoch: 4, train_loss: 0.9004, test_loss: 0.9478, test_f1: 0.5075
 epoch: 5, train_loss: 0.8798, test_loss: 0.9083, test_f1: 0.5287
 epoch: 6, train_loss: 0.8414, test_loss: 0.8426, test_f1: 0.5453
 epoch: 7, train_loss: 0.8307, test_loss: 0.8301, test_f1: 0.6106
 epoch: 8, train_loss: 0.7987, test_loss: 0.8644, test_f1: 0.5409
 epoch: 9, train_loss: 0.7891, test_loss: 0.8448, test_f1: 0.6047
 epoch: 10, train_loss: 0.7850, test_loss: 0.8285, test_f1: 0.6257
 epoch: 11, train_loss: 0.7582, test_loss: 0.8262, test_f1: 0.6377
 epoch: 12, train_loss: 0.7496, test_loss: 0.8034, test_f1: 0.6172
 epoch: 13, train_loss: 0.7355, test_loss: 0.8256, test_f1: 0.6070
 epoch: 14, train_loss: 0.7087, test_loss: 0.8386, test_f1: 0.6103
 epoch: 15, train_loss: 0.6913, test_loss: 0.8170, test_f1: 0.6430
 epoch: 16, train_loss: 0.6909, test_loss: 0.8075, test_f1: 0.6065
 epoch: 17, train_loss: 0.6735, test_loss: 0.8282, test_f1: 0.6069
 epoch: 18, train_loss: 0.6569, test_loss: 0.7681, test_f1: 0.6392
 epoch: 19, train_loss: 0.6609, test_loss: 0.8107, test_f1: 0.6203
 epoch: 20, train_loss: 0.6351, test_loss: 0.8688, test_f1: 0.6349
 epoch: 21, train_loss: 0.6229, test_loss: 0.8268, test_f1: 0.6472
 epoch: 22, train_loss: 0.6169, test_loss: 0.8577, test_f1: 0.6626
 epoch: 23, train_loss: 0.6066, test_loss: 0.9175, test_f1: 0.6119
 epoch: 24, train_loss: 0.5984, test_loss: 0.8760, test_f1: 0.6824
 epoch: 25, train_loss: 0.5947, test_loss: 0.8179, test_f1: 0.6506
 epoch: 26, train_loss: 0.5885, test_loss: 0.8013, test_f1: 0.6647
 epoch: 27, train_loss: 0.5733, test_loss: 0.9384, test_f1: 0.6360
 epoch: 28, train_loss: 0.5763, test_loss: 0.8654, test_f1: 0.6654
 epoch: 29, train_loss: 0.5790, test_loss: 0.8664, test_f1: 0.6509
 epoch: 30, train_loss: 0.5717, test_loss: 0.7743, test_f1: 0.7027
 epoch: 31, train_loss: 0.5410, test_loss: 0.8462, test_f1: 0.6822
 epoch: 32, train_loss: 0.5198, test_loss: 0.9365, test_f1: 0.6535
 epoch: 33, train_loss: 0.5296, test_loss: 0.8104, test_f1: 0.6562
 epoch: 34, train_loss: 0.5061, test_loss: 0.8597, test_f1: 0.6641
 epoch: 35, train_loss: 0.5148, test_loss: 0.8990, test_f1: 0.6567
 epoch: 36, train_loss: 0.5071, test_loss: 0.9341, test_f1: 0.6291
 epoch: 37, train_loss: 0.4863, test_loss: 0.9485, test_f1: 0.6808
 epoch: 38, train_loss: 0.4834, test_loss: 0.9332, test_f1: 0.7004
 epoch: 39, train_loss: 0.4599, test_loss: 0.9248, test_f1: 0.6791
 epoch: 40, train_loss: 0.4768, test_loss: 0.9002, test_f1: 0.6843
 epoch: 41, train_loss: 0.4769, test_loss: 0.9662, test_f1: 0.6582
 epoch: 42, train_loss: 0.4735, test_loss: 0.9102, test_f1: 0.6616
 epoch: 43, train_loss: 0.4468, test_loss: 0.9861, test_f1: 0.6828
 epoch: 44, train_loss: 0.4473, test_loss: 0.9230, test_f1: 0.6817
 epoch: 45, train_loss: 0.4354, test_loss: 1.2023, test_f1: 0.6498
 epoch: 46, train_loss: 0.4308, test_loss: 0.9451, test_f1: 0.6729
 epoch: 47, train_loss: 0.4261, test_loss: 1.1383, test_f1: 0.6505
 epoch: 48, train_loss: 0.4232, test_loss: 0.8524, test_f1: 0.6876
 epoch: 49, train_loss: 0.4148, test_loss: 0.9277, test_f1: 0.6607
 epoch: 50, train_loss: 0.3854, test_loss: 0.9190, test_f1: 0.6681
 epoch: 51, train_loss: 0.3612, test_loss: 1.1008, test_f1: 0.6727
 epoch: 52, train_loss: 0.3320, test_loss: 1.1144, test_f1: 0.6938
 epoch: 53, train_loss: 0.3213, test_loss: 1.1675, test_f1: 0.6753
 epoch: 54, train_loss: 0.3176, test_loss: 1.3090, test_f1: 0.6464
 epoch: 55, train_loss: 0.3200, test_loss: 1.2113, test_f1: 0.6899
 epoch: 56, train_loss: 0.3072, test_loss: 1.2754, test_f1: 0.6776
 epoch: 57, train_loss: 0.3377, test_loss: 1.1634, test_f1: 0.6821
 epoch: 58, train_loss: 0.2903, test_loss: 1.2093, test_f1: 0.6725
 epoch: 59, train_loss: 0.3035, test_loss: 1.2868, test_f1: 0.6788
 epoch: 60, train_loss: 0.2988, test_loss: 1.2939, test_f1: 0.6740
 epoch: 61, train_loss: 0.2791, test_loss: 1.3882, test_f1: 0.6654
 epoch: 62, train_loss: 0.2896, test_loss: 1.2871, test_f1: 0.6849
 epoch: 63, train_loss: 0.2703, test_loss: 1.3061, test_f1: 0.6868
 epoch: 64, train_loss: 0.2808, test_loss: 1.3546, test_f1: 0.6753
 epoch: 65, train_loss: 0.2746, test_loss: 1.3277, test_f1: 0.6978
 epoch: 66, train_loss: 0.2579, test_loss: 1.4971, test_f1: 0.6528
 epoch: 67, train_loss: 0.2616, test_loss: 1.4128, test_f1: 0.6691
 epoch: 68, train_loss: 0.2663, test_loss: 1.3350, test_f1: 0.6864
 epoch: 69, train_loss: 0.2672, test_loss: 1.3493, test_f1: 0.6945
 epoch: 70, train_loss: 0.2486, test_loss: 1.3429, test_f1: 0.6911
 epoch: 71, train_loss: 0.2535, test_loss: 1.3232, test_f1: 0.6774
 epoch: 72, train_loss: 0.2508, test_loss: 1.4568, test_f1: 0.6828
 epoch: 73, train_loss: 0.2496, test_loss: 1.2880, test_f1: 0.6871
 epoch: 74, train_loss: 0.2463, test_loss: 1.7858, test_f1: 0.6348
 epoch: 75, train_loss: 0.2458, test_loss: 1.4109, test_f1: 0.6722
 epoch: 76, train_loss: 0.2409, test_loss: 1.4828, test_f1: 0.6800
 epoch: 77, train_loss: 0.2286, test_loss: 1.5242, test_f1: 0.6788
 epoch: 78, train_loss: 0.2213, test_loss: 1.5390, test_f1: 0.6865
 epoch: 79, train_loss: 0.2134, test_loss: 1.5864, test_f1: 0.6682
 epoch: 80, train_loss: 0.2286, test_loss: 1.4685, test_f1: 0.6791
 epoch: 81, train_loss: 0.2176, test_loss: 1.4977, test_f1: 0.6924
 epoch: 82, train_loss: 0.2281, test_loss: 1.5136, test_f1: 0.6898
 epoch: 83, train_loss: 0.2110, test_loss: 1.6419, test_f1: 0.6516
 epoch: 84, train_loss: 0.2232, test_loss: 1.5550, test_f1: 0.6840
 epoch: 85, train_loss: 0.2042, test_loss: 1.5318, test_f1: 0.6840
 epoch: 86, train_loss: 0.2270, test_loss: 1.6440, test_f1: 0.6746
 epoch: 87, train_loss: 0.2037, test_loss: 1.5646, test_f1: 0.6750
 epoch: 88, train_loss: 0.2107, test_loss: 1.7104, test_f1: 0.6727
 epoch: 89, train_loss: 0.2347, test_loss: 1.7988, test_f1: 0.6710
 epoch: 90, train_loss: 0.1962, test_loss: 1.8619, test_f1: 0.6524
 epoch: 91, train_loss: 0.2202, test_loss: 1.7181, test_f1: 0.6544
 epoch: 92, train_loss: 0.1941, test_loss: 1.5512, test_f1: 0.6782
 epoch: 93, train_loss: 0.1969, test_loss: 1.5778, test_f1: 0.6650
 epoch: 94, train_loss: 0.2043, test_loss: 1.7473, test_f1: 0.6876
 epoch: 95, train_loss: 0.1935, test_loss: 1.7365, test_f1: 0.6707
 epoch: 96, train_loss: 0.1967, test_loss: 1.7187, test_f1: 0.6751
 epoch: 97, train_loss: 0.1881, test_loss: 1.6804, test_f1: 0.6595
 epoch: 98, train_loss: 0.1853, test_loss: 1.7506, test_f1: 0.6793
 epoch: 99, train_loss: 0.1773, test_loss: 1.9900, test_f1: 0.6608
##################ITERATION #1 ****************************************
 epoch: 0, train_loss: 1.0547, test_loss: 0.9702, test_f1: 0.5239
 epoch: 1, train_loss: 0.9498, test_loss: 0.9181, test_f1: 0.5149
 epoch: 2, train_loss: 0.9232, test_loss: 0.8607, test_f1: 0.5590
 epoch: 3, train_loss: 0.8843, test_loss: 0.8430, test_f1: 0.5714
 epoch: 4, train_loss: 0.8553, test_loss: 0.8784, test_f1: 0.5813
 epoch: 5, train_loss: 0.8338, test_loss: 0.8691, test_f1: 0.5836
 epoch: 6, train_loss: 0.8011, test_loss: 0.8228, test_f1: 0.5992
 epoch: 7, train_loss: 0.7915, test_loss: 0.8661, test_f1: 0.5963
 epoch: 8, train_loss: 0.7599, test_loss: 0.7917, test_f1: 0.6082
 epoch: 9, train_loss: 0.7657, test_loss: 0.8392, test_f1: 0.6315
 epoch: 10, train_loss: 0.7559, test_loss: 0.7780, test_f1: 0.6680
 epoch: 11, train_loss: 0.7432, test_loss: 0.7978, test_f1: 0.6439
 epoch: 12, train_loss: 0.7099, test_loss: 0.7931, test_f1: 0.6198
 epoch: 13, train_loss: 0.6937, test_loss: 0.7963, test_f1: 0.6232
 epoch: 14, train_loss: 0.6958, test_loss: 0.7780, test_f1: 0.6761
 epoch: 15, train_loss: 0.6818, test_loss: 0.8335, test_f1: 0.6411
 epoch: 16, train_loss: 0.6712, test_loss: 0.8401, test_f1: 0.6670
 epoch: 17, train_loss: 0.6672, test_loss: 0.7914, test_f1: 0.6553
 epoch: 18, train_loss: 0.6472, test_loss: 0.7793, test_f1: 0.6688
 epoch: 19, train_loss: 0.6316, test_loss: 0.7715, test_f1: 0.6674
 epoch: 20, train_loss: 0.6218, test_loss: 0.8032, test_f1: 0.6781
 epoch: 21, train_loss: 0.6132, test_loss: 0.8000, test_f1: 0.6420
 epoch: 22, train_loss: 0.6174, test_loss: 0.7244, test_f1: 0.6735
 epoch: 23, train_loss: 0.5731, test_loss: 0.8360, test_f1: 0.6688
 epoch: 24, train_loss: 0.5852, test_loss: 0.8333, test_f1: 0.6742
 epoch: 25, train_loss: 0.5630, test_loss: 0.8209, test_f1: 0.6932
 epoch: 26, train_loss: 0.5712, test_loss: 0.7918, test_f1: 0.6751
 epoch: 27, train_loss: 0.5375, test_loss: 0.7587, test_f1: 0.6657
 epoch: 28, train_loss: 0.5201, test_loss: 0.8606, test_f1: 0.6586
 epoch: 29, train_loss: 0.5223, test_loss: 0.8658, test_f1: 0.6606
 epoch: 30, train_loss: 0.5159, test_loss: 0.9279, test_f1: 0.6563
 epoch: 31, train_loss: 0.4972, test_loss: 0.9015, test_f1: 0.6801
 epoch: 32, train_loss: 0.4982, test_loss: 0.9059, test_f1: 0.6658
 epoch: 33, train_loss: 0.4954, test_loss: 0.9587, test_f1: 0.6877
 epoch: 34, train_loss: 0.4962, test_loss: 0.9802, test_f1: 0.6732
 epoch: 35, train_loss: 0.4806, test_loss: 0.8873, test_f1: 0.6759
 epoch: 36, train_loss: 0.4835, test_loss: 0.8819, test_f1: 0.6837
 epoch: 37, train_loss: 0.4778, test_loss: 0.9876, test_f1: 0.6510
 epoch: 38, train_loss: 0.4650, test_loss: 0.9419, test_f1: 0.6733
 epoch: 39, train_loss: 0.4367, test_loss: 0.9780, test_f1: 0.6816
 epoch: 40, train_loss: 0.4546, test_loss: 0.9218, test_f1: 0.6836
 epoch: 41, train_loss: 0.4444, test_loss: 0.9345, test_f1: 0.6706
 epoch: 42, train_loss: 0.4487, test_loss: 0.8453, test_f1: 0.7062
 epoch: 43, train_loss: 0.4209, test_loss: 0.9241, test_f1: 0.6750
 epoch: 44, train_loss: 0.4207, test_loss: 0.9617, test_f1: 0.6797
 epoch: 45, train_loss: 0.4176, test_loss: 0.9818, test_f1: 0.6715
 epoch: 46, train_loss: 0.3938, test_loss: 0.9518, test_f1: 0.6819
 epoch: 47, train_loss: 0.4071, test_loss: 0.9125, test_f1: 0.7006
 epoch: 48, train_loss: 0.3955, test_loss: 1.0332, test_f1: 0.6668
 epoch: 49, train_loss: 0.4164, test_loss: 0.9340, test_f1: 0.6960
 epoch: 50, train_loss: 0.3782, test_loss: 1.0447, test_f1: 0.6789
 epoch: 51, train_loss: 0.3160, test_loss: 1.0615, test_f1: 0.6880
 epoch: 52, train_loss: 0.3241, test_loss: 1.0775, test_f1: 0.6971
 epoch: 53, train_loss: 0.3096, test_loss: 1.0811, test_f1: 0.6851
 epoch: 54, train_loss: 0.2835, test_loss: 1.1599, test_f1: 0.7041
 epoch: 55, train_loss: 0.2815, test_loss: 1.2026, test_f1: 0.7107
 epoch: 56, train_loss: 0.2834, test_loss: 1.2611, test_f1: 0.6672
 epoch: 57, train_loss: 0.2922, test_loss: 1.2111, test_f1: 0.6804
 epoch: 58, train_loss: 0.2858, test_loss: 1.2649, test_f1: 0.7059
 epoch: 59, train_loss: 0.2632, test_loss: 1.1924, test_f1: 0.6865
 epoch: 60, train_loss: 0.2579, test_loss: 1.2885, test_f1: 0.6863
 epoch: 61, train_loss: 0.2639, test_loss: 1.2441, test_f1: 0.6945
 epoch: 62, train_loss: 0.2667, test_loss: 1.3945, test_f1: 0.6654
 epoch: 63, train_loss: 0.2735, test_loss: 1.2725, test_f1: 0.6899
 epoch: 64, train_loss: 0.2630, test_loss: 1.2881, test_f1: 0.6940
 epoch: 65, train_loss: 0.2425, test_loss: 1.3403, test_f1: 0.6991
 epoch: 66, train_loss: 0.2447, test_loss: 1.4131, test_f1: 0.6697
 epoch: 67, train_loss: 0.2425, test_loss: 1.3540, test_f1: 0.6876
 epoch: 68, train_loss: 0.2324, test_loss: 1.5002, test_f1: 0.7053
 epoch: 69, train_loss: 0.2442, test_loss: 1.4086, test_f1: 0.6778
 epoch: 70, train_loss: 0.2277, test_loss: 1.4849, test_f1: 0.6904
 epoch: 71, train_loss: 0.2519, test_loss: 1.5526, test_f1: 0.6553
 epoch: 72, train_loss: 0.2328, test_loss: 1.5477, test_f1: 0.6825
 epoch: 73, train_loss: 0.2063, test_loss: 1.5210, test_f1: 0.6842
 epoch: 74, train_loss: 0.2156, test_loss: 1.4338, test_f1: 0.6923
 epoch: 75, train_loss: 0.2462, test_loss: 1.4698, test_f1: 0.6809
 epoch: 76, train_loss: 0.2216, test_loss: 1.3839, test_f1: 0.6983
 epoch: 77, train_loss: 0.2356, test_loss: 1.4154, test_f1: 0.7006
 epoch: 78, train_loss: 0.2056, test_loss: 1.4065, test_f1: 0.6824
 epoch: 79, train_loss: 0.2031, test_loss: 1.5680, test_f1: 0.6896
 epoch: 80, train_loss: 0.2125, test_loss: 1.5420, test_f1: 0.6608
 epoch: 81, train_loss: 0.2050, test_loss: 1.4853, test_f1: 0.6854
 epoch: 82, train_loss: 0.1943, test_loss: 1.5917, test_f1: 0.6755
 epoch: 83, train_loss: 0.1952, test_loss: 1.5073, test_f1: 0.6899
 epoch: 84, train_loss: 0.1761, test_loss: 1.5730, test_f1: 0.6808
 epoch: 85, train_loss: 0.2301, test_loss: 1.5370, test_f1: 0.6760
 epoch: 86, train_loss: 0.2091, test_loss: 1.5772, test_f1: 0.6961
 epoch: 87, train_loss: 0.1938, test_loss: 1.4618, test_f1: 0.7103
 epoch: 88, train_loss: 0.1965, test_loss: 1.4052, test_f1: 0.6802
 epoch: 89, train_loss: 0.1752, test_loss: 1.6585, test_f1: 0.6755
 epoch: 90, train_loss: 0.1770, test_loss: 1.6580, test_f1: 0.6632
 epoch: 91, train_loss: 0.2099, test_loss: 1.5013, test_f1: 0.6674
 epoch: 92, train_loss: 0.1897, test_loss: 1.4654, test_f1: 0.6816
 epoch: 93, train_loss: 0.1969, test_loss: 1.6519, test_f1: 0.6830
 epoch: 94, train_loss: 0.1917, test_loss: 1.4816, test_f1: 0.6913
 epoch: 95, train_loss: 0.1689, test_loss: 1.6883, test_f1: 0.6812
 epoch: 96, train_loss: 0.1619, test_loss: 1.6575, test_f1: 0.6931
 epoch: 97, train_loss: 0.1590, test_loss: 1.5862, test_f1: 0.6708
 epoch: 98, train_loss: 0.1854, test_loss: 1.6223, test_f1: 0.6718
 epoch: 99, train_loss: 0.1847, test_loss: 1.6369, test_f1: 0.6663
##################ITERATION #2 ****************************************
 epoch: 0, train_loss: 1.1083, test_loss: 0.9838, test_f1: 0.5135
 epoch: 1, train_loss: 0.9630, test_loss: 0.8672, test_f1: 0.5315
 epoch: 2, train_loss: 0.9232, test_loss: 0.9536, test_f1: 0.5613
 epoch: 3, train_loss: 0.8881, test_loss: 0.9200, test_f1: 0.5499
 epoch: 4, train_loss: 0.8751, test_loss: 0.8923, test_f1: 0.5879
 epoch: 5, train_loss: 0.8467, test_loss: 0.8530, test_f1: 0.6107
 epoch: 6, train_loss: 0.8162, test_loss: 0.8412, test_f1: 0.5912
 epoch: 7, train_loss: 0.8050, test_loss: 0.7446, test_f1: 0.6355
 epoch: 8, train_loss: 0.7792, test_loss: 0.8419, test_f1: 0.6042
 epoch: 9, train_loss: 0.7642, test_loss: 0.7347, test_f1: 0.6572
 epoch: 10, train_loss: 0.7388, test_loss: 0.8198, test_f1: 0.6110
 epoch: 11, train_loss: 0.7214, test_loss: 0.7501, test_f1: 0.6328
 epoch: 12, train_loss: 0.7084, test_loss: 0.6992, test_f1: 0.6849
 epoch: 13, train_loss: 0.7091, test_loss: 0.7111, test_f1: 0.6466
 epoch: 14, train_loss: 0.6829, test_loss: 0.6829, test_f1: 0.6882
 epoch: 15, train_loss: 0.6754, test_loss: 0.7287, test_f1: 0.6712
 epoch: 16, train_loss: 0.6500, test_loss: 0.6652, test_f1: 0.6802
 epoch: 17, train_loss: 0.6518, test_loss: 0.7516, test_f1: 0.6606
 epoch: 18, train_loss: 0.6355, test_loss: 0.7210, test_f1: 0.6624
 epoch: 19, train_loss: 0.6348, test_loss: 0.6869, test_f1: 0.6627
 epoch: 20, train_loss: 0.6130, test_loss: 0.6527, test_f1: 0.6877
 epoch: 21, train_loss: 0.6009, test_loss: 0.7824, test_f1: 0.6376
 epoch: 22, train_loss: 0.5901, test_loss: 0.6211, test_f1: 0.7007
 epoch: 23, train_loss: 0.5953, test_loss: 0.7650, test_f1: 0.6415
 epoch: 24, train_loss: 0.5626, test_loss: 0.7084, test_f1: 0.6712
 epoch: 25, train_loss: 0.5652, test_loss: 0.7716, test_f1: 0.6764
 epoch: 26, train_loss: 0.5689, test_loss: 0.7543, test_f1: 0.6535
 epoch: 27, train_loss: 0.5257, test_loss: 0.7555, test_f1: 0.6593
 epoch: 28, train_loss: 0.5337, test_loss: 0.7051, test_f1: 0.6676
 epoch: 29, train_loss: 0.5358, test_loss: 0.7834, test_f1: 0.6784
 epoch: 30, train_loss: 0.5043, test_loss: 0.7113, test_f1: 0.6866
 epoch: 31, train_loss: 0.4967, test_loss: 0.7207, test_f1: 0.6626
 epoch: 32, train_loss: 0.4850, test_loss: 0.7330, test_f1: 0.6743
 epoch: 33, train_loss: 0.5451, test_loss: 0.8053, test_f1: 0.6493
 epoch: 34, train_loss: 0.5001, test_loss: 0.7663, test_f1: 0.6703
 epoch: 35, train_loss: 0.4989, test_loss: 0.7945, test_f1: 0.6656
 epoch: 36, train_loss: 0.4757, test_loss: 0.7182, test_f1: 0.7044
 epoch: 37, train_loss: 0.4790, test_loss: 0.7126, test_f1: 0.7042
 epoch: 38, train_loss: 0.4683, test_loss: 0.7560, test_f1: 0.6815
 epoch: 39, train_loss: 0.4563, test_loss: 0.7159, test_f1: 0.7178
 epoch: 40, train_loss: 0.4912, test_loss: 0.8555, test_f1: 0.6630
 epoch: 41, train_loss: 0.4657, test_loss: 0.8195, test_f1: 0.6708
 epoch: 42, train_loss: 0.4212, test_loss: 0.7965, test_f1: 0.6953
 epoch: 43, train_loss: 0.4184, test_loss: 0.7319, test_f1: 0.6957
 epoch: 44, train_loss: 0.4208, test_loss: 0.7727, test_f1: 0.6850
 epoch: 45, train_loss: 0.4056, test_loss: 0.8626, test_f1: 0.6970
 epoch: 46, train_loss: 0.3949, test_loss: 0.8958, test_f1: 0.6698
 epoch: 47, train_loss: 0.4111, test_loss: 0.8261, test_f1: 0.6506
 epoch: 48, train_loss: 0.4083, test_loss: 0.8227, test_f1: 0.6996
 epoch: 49, train_loss: 0.3855, test_loss: 0.8047, test_f1: 0.6963
 epoch: 50, train_loss: 0.3845, test_loss: 0.9052, test_f1: 0.6748
 epoch: 51, train_loss: 0.3719, test_loss: 0.8177, test_f1: 0.7003
 epoch: 52, train_loss: 0.3175, test_loss: 0.9386, test_f1: 0.6928
 epoch: 53, train_loss: 0.3148, test_loss: 0.8903, test_f1: 0.6899
 epoch: 54, train_loss: 0.3072, test_loss: 0.9331, test_f1: 0.6795
 epoch: 55, train_loss: 0.2931, test_loss: 0.8860, test_f1: 0.7038
 epoch: 56, train_loss: 0.2887, test_loss: 0.8809, test_f1: 0.7028
 epoch: 57, train_loss: 0.2855, test_loss: 0.9658, test_f1: 0.6872
 epoch: 58, train_loss: 0.2931, test_loss: 1.0063, test_f1: 0.6671
 epoch: 59, train_loss: 0.2754, test_loss: 1.0740, test_f1: 0.6915
 epoch: 60, train_loss: 0.2655, test_loss: 1.0136, test_f1: 0.6993
 epoch: 61, train_loss: 0.2596, test_loss: 1.1467, test_f1: 0.6747
 epoch: 62, train_loss: 0.2538, test_loss: 1.1359, test_f1: 0.6696
 epoch: 63, train_loss: 0.2631, test_loss: 0.9847, test_f1: 0.6946
 epoch: 64, train_loss: 0.2772, test_loss: 1.0041, test_f1: 0.6792
 epoch: 65, train_loss: 0.2559, test_loss: 1.1049, test_f1: 0.6667
 epoch: 66, train_loss: 0.2465, test_loss: 1.1368, test_f1: 0.7001
 epoch: 67, train_loss: 0.2721, test_loss: 1.0659, test_f1: 0.6839
 epoch: 68, train_loss: 0.2495, test_loss: 1.0023, test_f1: 0.6918
 epoch: 69, train_loss: 0.2437, test_loss: 1.1371, test_f1: 0.6898
 epoch: 70, train_loss: 0.2520, test_loss: 0.9937, test_f1: 0.7035
 epoch: 71, train_loss: 0.2322, test_loss: 1.1870, test_f1: 0.6907
 epoch: 72, train_loss: 0.2338, test_loss: 1.1444, test_f1: 0.6984
 epoch: 73, train_loss: 0.2344, test_loss: 1.0266, test_f1: 0.7032
 epoch: 74, train_loss: 0.2239, test_loss: 1.2594, test_f1: 0.6721
 epoch: 75, train_loss: 0.2289, test_loss: 1.0937, test_f1: 0.6969
 epoch: 76, train_loss: 0.2299, test_loss: 1.3140, test_f1: 0.6911
 epoch: 77, train_loss: 0.2218, test_loss: 1.3192, test_f1: 0.6937
 epoch: 78, train_loss: 0.2275, test_loss: 1.2844, test_f1: 0.6781
 epoch: 79, train_loss: 0.2300, test_loss: 1.3258, test_f1: 0.6907
 epoch: 80, train_loss: 0.2091, test_loss: 1.4108, test_f1: 0.6842
 epoch: 81, train_loss: 0.2014, test_loss: 1.4175, test_f1: 0.6775
 epoch: 82, train_loss: 0.2034, test_loss: 1.2125, test_f1: 0.7139
 epoch: 83, train_loss: 0.2175, test_loss: 1.4715, test_f1: 0.6770
 epoch: 84, train_loss: 0.1859, test_loss: 1.4472, test_f1: 0.6797
 epoch: 85, train_loss: 0.1839, test_loss: 1.4371, test_f1: 0.6860
 epoch: 86, train_loss: 0.1989, test_loss: 1.6091, test_f1: 0.6889
 epoch: 87, train_loss: 0.2048, test_loss: 1.4456, test_f1: 0.6902
 epoch: 88, train_loss: 0.1998, test_loss: 1.4048, test_f1: 0.6956
 epoch: 89, train_loss: 0.2041, test_loss: 1.3890, test_f1: 0.6930
 epoch: 90, train_loss: 0.1823, test_loss: 1.4106, test_f1: 0.6850
 epoch: 91, train_loss: 0.1878, test_loss: 1.2405, test_f1: 0.7115
 epoch: 92, train_loss: 0.1898, test_loss: 1.4426, test_f1: 0.6936
 epoch: 93, train_loss: 0.1995, test_loss: 1.3116, test_f1: 0.6950
 epoch: 94, train_loss: 0.1789, test_loss: 1.5393, test_f1: 0.6939
 epoch: 95, train_loss: 0.1887, test_loss: 1.3813, test_f1: 0.6949
 epoch: 96, train_loss: 0.1744, test_loss: 1.3834, test_f1: 0.7050
 epoch: 97, train_loss: 0.2034, test_loss: 1.4018, test_f1: 0.7015
 epoch: 98, train_loss: 0.1823, test_loss: 1.5379, test_f1: 0.6892
 epoch: 99, train_loss: 0.1744, test_loss: 1.4843, test_f1: 0.6993
##################ITERATION #3 ****************************************
 epoch: 0, train_loss: 1.1680, test_loss: 1.0339, test_f1: 0.4712
 epoch: 1, train_loss: 0.9776, test_loss: 0.9557, test_f1: 0.5083
 epoch: 2, train_loss: 0.9331, test_loss: 0.8970, test_f1: 0.5124
 epoch: 3, train_loss: 0.8981, test_loss: 0.8947, test_f1: 0.5536
 epoch: 4, train_loss: 0.8813, test_loss: 0.9530, test_f1: 0.5453
 epoch: 5, train_loss: 0.8478, test_loss: 0.8511, test_f1: 0.5923
 epoch: 6, train_loss: 0.8392, test_loss: 0.8038, test_f1: 0.5979
 epoch: 7, train_loss: 0.8097, test_loss: 0.7745, test_f1: 0.6396
 epoch: 8, train_loss: 0.7990, test_loss: 0.8233, test_f1: 0.6081
 epoch: 9, train_loss: 0.7771, test_loss: 0.9775, test_f1: 0.5471
 epoch: 10, train_loss: 0.7659, test_loss: 0.7203, test_f1: 0.6614
 epoch: 11, train_loss: 0.7425, test_loss: 0.8157, test_f1: 0.6473
 epoch: 12, train_loss: 0.7432, test_loss: 0.7489, test_f1: 0.6264
 epoch: 13, train_loss: 0.7123, test_loss: 0.7297, test_f1: 0.6458
 epoch: 14, train_loss: 0.7149, test_loss: 0.7684, test_f1: 0.6417
 epoch: 15, train_loss: 0.6838, test_loss: 0.7541, test_f1: 0.6403
 epoch: 16, train_loss: 0.6844, test_loss: 0.7370, test_f1: 0.6481
 epoch: 17, train_loss: 0.6830, test_loss: 0.7401, test_f1: 0.6262
 epoch: 18, train_loss: 0.6548, test_loss: 0.7709, test_f1: 0.6211
 epoch: 19, train_loss: 0.6276, test_loss: 0.7697, test_f1: 0.6463
 epoch: 20, train_loss: 0.6191, test_loss: 0.6739, test_f1: 0.6661
 epoch: 21, train_loss: 0.6150, test_loss: 0.8200, test_f1: 0.6292
 epoch: 22, train_loss: 0.6043, test_loss: 0.7292, test_f1: 0.6701
 epoch: 23, train_loss: 0.6047, test_loss: 0.8012, test_f1: 0.6317
 epoch: 24, train_loss: 0.6143, test_loss: 0.6891, test_f1: 0.6619
 epoch: 25, train_loss: 0.5814, test_loss: 0.7560, test_f1: 0.6414
 epoch: 26, train_loss: 0.5727, test_loss: 0.8239, test_f1: 0.6452
 epoch: 27, train_loss: 0.5685, test_loss: 0.8578, test_f1: 0.6663
 epoch: 28, train_loss: 0.5675, test_loss: 0.8126, test_f1: 0.6740
 epoch: 29, train_loss: 0.5193, test_loss: 0.7334, test_f1: 0.6973
 epoch: 30, train_loss: 0.5327, test_loss: 0.7348, test_f1: 0.6956
 epoch: 31, train_loss: 0.5058, test_loss: 0.7511, test_f1: 0.6756
 epoch: 32, train_loss: 0.5165, test_loss: 0.7667, test_f1: 0.6906
 epoch: 33, train_loss: 0.4878, test_loss: 0.8838, test_f1: 0.6517
 epoch: 34, train_loss: 0.4870, test_loss: 0.8512, test_f1: 0.6507
 epoch: 35, train_loss: 0.4895, test_loss: 0.7789, test_f1: 0.6839
 epoch: 36, train_loss: 0.4827, test_loss: 0.7891, test_f1: 0.6704
 epoch: 37, train_loss: 0.4900, test_loss: 0.7887, test_f1: 0.6919
 epoch: 38, train_loss: 0.4760, test_loss: 0.8196, test_f1: 0.6766
 epoch: 39, train_loss: 0.4481, test_loss: 0.7773, test_f1: 0.6744
 epoch: 40, train_loss: 0.4440, test_loss: 0.7186, test_f1: 0.7115
 epoch: 41, train_loss: 0.4435, test_loss: 0.7776, test_f1: 0.7120
 epoch: 42, train_loss: 0.4140, test_loss: 1.0136, test_f1: 0.6893
 epoch: 43, train_loss: 0.4518, test_loss: 0.9217, test_f1: 0.6730
 epoch: 44, train_loss: 0.4420, test_loss: 0.8892, test_f1: 0.6746
 epoch: 45, train_loss: 0.4348, test_loss: 0.8885, test_f1: 0.6647
 epoch: 46, train_loss: 0.4495, test_loss: 0.8975, test_f1: 0.6957
 epoch: 47, train_loss: 0.4116, test_loss: 0.8722, test_f1: 0.6713
 epoch: 48, train_loss: 0.4106, test_loss: 0.8230, test_f1: 0.6861
 epoch: 49, train_loss: 0.4090, test_loss: 0.9332, test_f1: 0.6551
 epoch: 50, train_loss: 0.4139, test_loss: 0.8500, test_f1: 0.6874
 epoch: 51, train_loss: 0.3534, test_loss: 0.9789, test_f1: 0.6716
 epoch: 52, train_loss: 0.3138, test_loss: 0.9837, test_f1: 0.6852
 epoch: 53, train_loss: 0.3103, test_loss: 1.0635, test_f1: 0.6772
 epoch: 54, train_loss: 0.3066, test_loss: 1.0557, test_f1: 0.6796
 epoch: 55, train_loss: 0.3016, test_loss: 0.9595, test_f1: 0.6822
 epoch: 56, train_loss: 0.2946, test_loss: 1.0036, test_f1: 0.6785
 epoch: 57, train_loss: 0.2858, test_loss: 0.9904, test_f1: 0.6763
 epoch: 58, train_loss: 0.2725, test_loss: 1.0241, test_f1: 0.6817
 epoch: 59, train_loss: 0.2781, test_loss: 1.0027, test_f1: 0.6746
 epoch: 60, train_loss: 0.2583, test_loss: 1.0340, test_f1: 0.6757
 epoch: 61, train_loss: 0.2570, test_loss: 1.0467, test_f1: 0.6729
 epoch: 62, train_loss: 0.2709, test_loss: 1.0802, test_f1: 0.6896
 epoch: 63, train_loss: 0.2716, test_loss: 1.1241, test_f1: 0.6574
 epoch: 64, train_loss: 0.2589, test_loss: 1.1009, test_f1: 0.6724
 epoch: 65, train_loss: 0.2698, test_loss: 1.0787, test_f1: 0.6787
 epoch: 66, train_loss: 0.2470, test_loss: 1.0683, test_f1: 0.6914
 epoch: 67, train_loss: 0.2566, test_loss: 0.9976, test_f1: 0.6814
 epoch: 68, train_loss: 0.2425, test_loss: 1.0886, test_f1: 0.6686
 epoch: 69, train_loss: 0.2489, test_loss: 1.1763, test_f1: 0.6692
 epoch: 70, train_loss: 0.2417, test_loss: 1.1472, test_f1: 0.6739
 epoch: 71, train_loss: 0.2379, test_loss: 1.2176, test_f1: 0.6697
 epoch: 72, train_loss: 0.2488, test_loss: 1.1789, test_f1: 0.6766
 epoch: 73, train_loss: 0.2203, test_loss: 1.1808, test_f1: 0.6691
 epoch: 74, train_loss: 0.2428, test_loss: 1.1019, test_f1: 0.6794
 epoch: 75, train_loss: 0.2358, test_loss: 1.1823, test_f1: 0.6726
 epoch: 76, train_loss: 0.2213, test_loss: 1.2672, test_f1: 0.6686
 epoch: 77, train_loss: 0.2149, test_loss: 1.2529, test_f1: 0.6645
 epoch: 78, train_loss: 0.2197, test_loss: 1.3549, test_f1: 0.6375
 epoch: 79, train_loss: 0.2161, test_loss: 1.3859, test_f1: 0.6572
 epoch: 80, train_loss: 0.2282, test_loss: 1.3800, test_f1: 0.6509
 epoch: 81, train_loss: 0.2007, test_loss: 1.3011, test_f1: 0.6734
 epoch: 82, train_loss: 0.2096, test_loss: 1.2968, test_f1: 0.6698
 epoch: 83, train_loss: 0.2045, test_loss: 1.2754, test_f1: 0.6787
 epoch: 84, train_loss: 0.2232, test_loss: 1.3454, test_f1: 0.6604
 epoch: 85, train_loss: 0.2208, test_loss: 1.3032, test_f1: 0.6614
 epoch: 86, train_loss: 0.2182, test_loss: 1.2847, test_f1: 0.6598
 epoch: 87, train_loss: 0.1823, test_loss: 1.2831, test_f1: 0.6923
 epoch: 88, train_loss: 0.1811, test_loss: 1.3383, test_f1: 0.6840
 epoch: 89, train_loss: 0.1697, test_loss: 1.4620, test_f1: 0.6702
 epoch: 90, train_loss: 0.2115, test_loss: 1.3655, test_f1: 0.6780
 epoch: 91, train_loss: 0.2152, test_loss: 1.2873, test_f1: 0.6814
 epoch: 92, train_loss: 0.1937, test_loss: 1.3214, test_f1: 0.6802
 epoch: 93, train_loss: 0.1977, test_loss: 1.2835, test_f1: 0.6861
 epoch: 94, train_loss: 0.1967, test_loss: 1.2600, test_f1: 0.6799
 epoch: 95, train_loss: 0.1752, test_loss: 1.4170, test_f1: 0.6859
 epoch: 96, train_loss: 0.1869, test_loss: 1.4044, test_f1: 0.6853
 epoch: 97, train_loss: 0.1658, test_loss: 1.3490, test_f1: 0.6737
 epoch: 98, train_loss: 0.1812, test_loss: 1.3839, test_f1: 0.6696
 epoch: 99, train_loss: 0.1896, test_loss: 1.3086, test_f1: 0.6845
##################ITERATION #4 ****************************************
 epoch: 0, train_loss: 1.1733, test_loss: 0.9812, test_f1: 0.5155
 epoch: 1, train_loss: 0.9666, test_loss: 0.8860, test_f1: 0.5695
 epoch: 2, train_loss: 0.9161, test_loss: 0.8538, test_f1: 0.5588
 epoch: 3, train_loss: 0.8800, test_loss: 0.9445, test_f1: 0.4962
 epoch: 4, train_loss: 0.8590, test_loss: 0.8460, test_f1: 0.5412
 epoch: 5, train_loss: 0.8529, test_loss: 0.8257, test_f1: 0.5567
 epoch: 6, train_loss: 0.8200, test_loss: 0.7632, test_f1: 0.6228
 epoch: 7, train_loss: 0.8003, test_loss: 0.8344, test_f1: 0.6134
 epoch: 8, train_loss: 0.7774, test_loss: 0.7606, test_f1: 0.6082
 epoch: 9, train_loss: 0.7677, test_loss: 0.7898, test_f1: 0.5841
 epoch: 10, train_loss: 0.7527, test_loss: 0.7556, test_f1: 0.5877
 epoch: 11, train_loss: 0.7295, test_loss: 0.7376, test_f1: 0.6198
 epoch: 12, train_loss: 0.7123, test_loss: 0.6721, test_f1: 0.6875
 epoch: 13, train_loss: 0.6868, test_loss: 0.6701, test_f1: 0.6660
 epoch: 14, train_loss: 0.6822, test_loss: 0.7250, test_f1: 0.6842
 epoch: 15, train_loss: 0.6766, test_loss: 0.7468, test_f1: 0.6539
 epoch: 16, train_loss: 0.6661, test_loss: 0.6677, test_f1: 0.6667
 epoch: 17, train_loss: 0.6572, test_loss: 0.6945, test_f1: 0.6620
 epoch: 18, train_loss: 0.6489, test_loss: 0.7531, test_f1: 0.6330
 epoch: 19, train_loss: 0.6389, test_loss: 0.7055, test_f1: 0.6524
 epoch: 20, train_loss: 0.6142, test_loss: 0.7476, test_f1: 0.6491
 epoch: 21, train_loss: 0.6278, test_loss: 0.6772, test_f1: 0.6931
 epoch: 22, train_loss: 0.6051, test_loss: 0.7637, test_f1: 0.6656
 epoch: 23, train_loss: 0.5735, test_loss: 0.7653, test_f1: 0.6657
 epoch: 24, train_loss: 0.5955, test_loss: 0.7586, test_f1: 0.6464
 epoch: 25, train_loss: 0.6058, test_loss: 0.7505, test_f1: 0.6806
 epoch: 26, train_loss: 0.5745, test_loss: 0.7445, test_f1: 0.6718
 epoch: 27, train_loss: 0.5475, test_loss: 0.6597, test_f1: 0.7054
 epoch: 28, train_loss: 0.5345, test_loss: 0.7546, test_f1: 0.6660
 epoch: 29, train_loss: 0.5501, test_loss: 0.6948, test_f1: 0.7146
 epoch: 30, train_loss: 0.5191, test_loss: 0.8029, test_f1: 0.6883
 epoch: 31, train_loss: 0.6532, test_loss: 0.7321, test_f1: 0.6885
 epoch: 32, train_loss: 0.6041, test_loss: 0.7752, test_f1: 0.6766
 epoch: 33, train_loss: 0.5550, test_loss: 0.7233, test_f1: 0.6798
 epoch: 34, train_loss: 0.5276, test_loss: 0.7016, test_f1: 0.7063
 epoch: 35, train_loss: 0.5240, test_loss: 0.7424, test_f1: 0.6936
 epoch: 36, train_loss: 0.4985, test_loss: 0.6809, test_f1: 0.6868
 epoch: 37, train_loss: 0.5087, test_loss: 0.8089, test_f1: 0.7015
 epoch: 38, train_loss: 0.5014, test_loss: 0.7535, test_f1: 0.6895
 epoch: 39, train_loss: 0.4878, test_loss: 0.7221, test_f1: 0.7061
 epoch: 40, train_loss: 0.4675, test_loss: 0.7595, test_f1: 0.6943
 epoch: 41, train_loss: 0.4650, test_loss: 0.7836, test_f1: 0.6738
 epoch: 42, train_loss: 0.4599, test_loss: 0.9146, test_f1: 0.6646
 epoch: 43, train_loss: 0.4544, test_loss: 0.8511, test_f1: 0.6601
 epoch: 44, train_loss: 0.4469, test_loss: 0.7229, test_f1: 0.6897
 epoch: 45, train_loss: 0.4466, test_loss: 0.8274, test_f1: 0.6730
 epoch: 46, train_loss: 0.4310, test_loss: 0.8376, test_f1: 0.6839
 epoch: 47, train_loss: 0.4237, test_loss: 0.7821, test_f1: 0.6885
 epoch: 48, train_loss: 0.4179, test_loss: 0.8138, test_f1: 0.6902
 epoch: 49, train_loss: 0.4278, test_loss: 0.8180, test_f1: 0.6871
 epoch: 50, train_loss: 0.3995, test_loss: 0.7663, test_f1: 0.6889
 epoch: 51, train_loss: 0.3647, test_loss: 0.8019, test_f1: 0.6866
 epoch: 52, train_loss: 0.3386, test_loss: 0.8631, test_f1: 0.6882
 epoch: 53, train_loss: 0.3376, test_loss: 0.8684, test_f1: 0.6735
 epoch: 54, train_loss: 0.3184, test_loss: 0.8785, test_f1: 0.7034
 epoch: 55, train_loss: 0.3083, test_loss: 0.8442, test_f1: 0.6973
 epoch: 56, train_loss: 0.2909, test_loss: 0.9473, test_f1: 0.6956
 epoch: 57, train_loss: 0.3090, test_loss: 0.9579, test_f1: 0.6906
 epoch: 58, train_loss: 0.2970, test_loss: 0.8632, test_f1: 0.7002
 epoch: 59, train_loss: 0.3037, test_loss: 1.0010, test_f1: 0.6819
 epoch: 60, train_loss: 0.3008, test_loss: 0.9435, test_f1: 0.6878
 epoch: 61, train_loss: 0.2843, test_loss: 1.0247, test_f1: 0.6887
 epoch: 62, train_loss: 0.2847, test_loss: 0.8920, test_f1: 0.7104
 epoch: 63, train_loss: 0.2827, test_loss: 0.9525, test_f1: 0.6922
 epoch: 64, train_loss: 0.2715, test_loss: 1.0490, test_f1: 0.6999
 epoch: 65, train_loss: 0.2566, test_loss: 0.9469, test_f1: 0.6952
 epoch: 66, train_loss: 0.2699, test_loss: 0.9093, test_f1: 0.7015
 epoch: 67, train_loss: 0.2596, test_loss: 1.0953, test_f1: 0.6990
 epoch: 68, train_loss: 0.2572, test_loss: 1.1546, test_f1: 0.6755
 epoch: 69, train_loss: 0.2649, test_loss: 1.1967, test_f1: 0.6713
 epoch: 70, train_loss: 0.2803, test_loss: 1.0747, test_f1: 0.6909
 epoch: 71, train_loss: 0.2708, test_loss: 1.0821, test_f1: 0.6954
 epoch: 72, train_loss: 0.2582, test_loss: 1.1510, test_f1: 0.6910
 epoch: 73, train_loss: 0.2535, test_loss: 1.0882, test_f1: 0.6902
 epoch: 74, train_loss: 0.2535, test_loss: 1.1609, test_f1: 0.6815
 epoch: 75, train_loss: 0.2467, test_loss: 1.0651, test_f1: 0.6833
 epoch: 76, train_loss: 0.2370, test_loss: 1.1485, test_f1: 0.6926
 epoch: 77, train_loss: 0.2481, test_loss: 1.0975, test_f1: 0.6858
 epoch: 78, train_loss: 0.2173, test_loss: 1.1242, test_f1: 0.6845
 epoch: 79, train_loss: 0.2263, test_loss: 1.1500, test_f1: 0.6750
 epoch: 80, train_loss: 0.2387, test_loss: 1.0904, test_f1: 0.7002
 epoch: 81, train_loss: 0.2455, test_loss: 1.1528, test_f1: 0.6719
 epoch: 82, train_loss: 0.2166, test_loss: 1.1905, test_f1: 0.6777
 epoch: 83, train_loss: 0.2519, test_loss: 1.2785, test_f1: 0.6818
 epoch: 84, train_loss: 0.2463, test_loss: 1.1122, test_f1: 0.6853
 epoch: 85, train_loss: 0.2336, test_loss: 1.2199, test_f1: 0.6993
 epoch: 86, train_loss: 0.1993, test_loss: 1.3689, test_f1: 0.6969
 epoch: 87, train_loss: 0.2049, test_loss: 1.2981, test_f1: 0.6829
 epoch: 88, train_loss: 0.2243, test_loss: 1.1858, test_f1: 0.6774
 epoch: 89, train_loss: 0.2154, test_loss: 1.2590, test_f1: 0.6831
 epoch: 90, train_loss: 0.2228, test_loss: 1.1212, test_f1: 0.6756
 epoch: 91, train_loss: 0.2109, test_loss: 1.2973, test_f1: 0.6887
 epoch: 92, train_loss: 0.2260, test_loss: 1.3786, test_f1: 0.6839
 epoch: 93, train_loss: 0.2145, test_loss: 1.1230, test_f1: 0.6856
 epoch: 94, train_loss: 0.1969, test_loss: 1.2670, test_f1: 0.6789
 epoch: 95, train_loss: 0.1735, test_loss: 1.3351, test_f1: 0.6874
 epoch: 96, train_loss: 0.1776, test_loss: 1.3150, test_f1: 0.6757
 epoch: 97, train_loss: 0.1990, test_loss: 1.2839, test_f1: 0.6800
 epoch: 98, train_loss: 0.2109, test_loss: 1.3045, test_f1: 0.6979
 epoch: 99, train_loss: 0.1998, test_loss: 1.2968, test_f1: 0.6866
##################ITERATION #5 ****************************************
 epoch: 0, train_loss: 1.2207, test_loss: 0.9987, test_f1: 0.4999
 epoch: 1, train_loss: 0.9614, test_loss: 0.9590, test_f1: 0.5468
 epoch: 2, train_loss: 0.9297, test_loss: 0.8941, test_f1: 0.5578
 epoch: 3, train_loss: 0.9161, test_loss: 0.9112, test_f1: 0.5376
 epoch: 4, train_loss: 0.8751, test_loss: 0.8759, test_f1: 0.5600
 epoch: 5, train_loss: 0.8486, test_loss: 0.8765, test_f1: 0.6352
 epoch: 6, train_loss: 0.8139, test_loss: 0.8292, test_f1: 0.6257
 epoch: 7, train_loss: 0.8160, test_loss: 0.7870, test_f1: 0.6161
 epoch: 8, train_loss: 0.7798, test_loss: 0.8816, test_f1: 0.5673
 epoch: 9, train_loss: 0.7627, test_loss: 0.7566, test_f1: 0.6424
 epoch: 10, train_loss: 0.7454, test_loss: 0.7887, test_f1: 0.6394
 epoch: 11, train_loss: 0.7301, test_loss: 0.7933, test_f1: 0.6278
 epoch: 12, train_loss: 0.6932, test_loss: 0.7366, test_f1: 0.6388
 epoch: 13, train_loss: 0.7148, test_loss: 0.8113, test_f1: 0.6237
 epoch: 14, train_loss: 0.6829, test_loss: 0.7913, test_f1: 0.6622
 epoch: 15, train_loss: 0.6742, test_loss: 0.7591, test_f1: 0.6500
 epoch: 16, train_loss: 0.6598, test_loss: 0.7924, test_f1: 0.6339
 epoch: 17, train_loss: 0.6523, test_loss: 0.7883, test_f1: 0.6554
 epoch: 18, train_loss: 0.6428, test_loss: 0.7961, test_f1: 0.6246
 epoch: 19, train_loss: 0.6244, test_loss: 0.8697, test_f1: 0.6418
 epoch: 20, train_loss: 0.6196, test_loss: 0.7637, test_f1: 0.6756
 epoch: 21, train_loss: 0.5948, test_loss: 0.7596, test_f1: 0.6782
 epoch: 22, train_loss: 0.5952, test_loss: 0.7896, test_f1: 0.6685
 epoch: 23, train_loss: 0.5780, test_loss: 0.7994, test_f1: 0.6465
 epoch: 24, train_loss: 0.5656, test_loss: 0.8448, test_f1: 0.6556
 epoch: 25, train_loss: 0.5489, test_loss: 0.8596, test_f1: 0.6578
 epoch: 26, train_loss: 0.5569, test_loss: 0.8031, test_f1: 0.6727
 epoch: 27, train_loss: 0.5426, test_loss: 0.8087, test_f1: 0.6474
 epoch: 28, train_loss: 0.5650, test_loss: 0.8498, test_f1: 0.6412
 epoch: 29, train_loss: 0.5530, test_loss: 0.8639, test_f1: 0.6676
 epoch: 30, train_loss: 0.5094, test_loss: 0.8267, test_f1: 0.6707
 epoch: 31, train_loss: 0.5149, test_loss: 0.7758, test_f1: 0.6961
 epoch: 32, train_loss: 0.5207, test_loss: 0.7716, test_f1: 0.6787
 epoch: 33, train_loss: 0.5180, test_loss: 0.9093, test_f1: 0.6644
 epoch: 34, train_loss: 0.5200, test_loss: 0.7913, test_f1: 0.6760
 epoch: 35, train_loss: 0.4904, test_loss: 0.7729, test_f1: 0.6798
 epoch: 36, train_loss: 0.4878, test_loss: 0.9005, test_f1: 0.6508
 epoch: 37, train_loss: 0.4932, test_loss: 0.8094, test_f1: 0.6789
 epoch: 38, train_loss: 0.4748, test_loss: 0.8548, test_f1: 0.6592
 epoch: 39, train_loss: 0.4581, test_loss: 0.9495, test_f1: 0.6624
 epoch: 40, train_loss: 0.4722, test_loss: 0.8320, test_f1: 0.6749
 epoch: 41, train_loss: 0.4342, test_loss: 0.7868, test_f1: 0.7003
 epoch: 42, train_loss: 0.4320, test_loss: 0.8745, test_f1: 0.6637
 epoch: 43, train_loss: 0.4471, test_loss: 0.9547, test_f1: 0.7020
 epoch: 44, train_loss: 0.4384, test_loss: 0.8329, test_f1: 0.6775
 epoch: 45, train_loss: 0.4432, test_loss: 0.8187, test_f1: 0.6677
 epoch: 46, train_loss: 0.4179, test_loss: 0.9170, test_f1: 0.6669
 epoch: 47, train_loss: 0.4081, test_loss: 0.9968, test_f1: 0.6979
 epoch: 48, train_loss: 0.3967, test_loss: 0.9309, test_f1: 0.6708
 epoch: 49, train_loss: 0.4101, test_loss: 0.9270, test_f1: 0.6538
 epoch: 50, train_loss: 0.3618, test_loss: 0.9839, test_f1: 0.6580
 epoch: 51, train_loss: 0.3428, test_loss: 0.9625, test_f1: 0.6617
 epoch: 52, train_loss: 0.3317, test_loss: 0.9345, test_f1: 0.6700
 epoch: 53, train_loss: 0.3292, test_loss: 0.9854, test_f1: 0.6622
 epoch: 54, train_loss: 0.2983, test_loss: 1.0930, test_f1: 0.6546
 epoch: 55, train_loss: 0.3026, test_loss: 1.0400, test_f1: 0.6725
 epoch: 56, train_loss: 0.2827, test_loss: 1.0804, test_f1: 0.6623
 epoch: 57, train_loss: 0.2920, test_loss: 1.1327, test_f1: 0.6676
 epoch: 58, train_loss: 0.2960, test_loss: 0.9903, test_f1: 0.6560
 epoch: 59, train_loss: 0.2865, test_loss: 1.0723, test_f1: 0.6578
 epoch: 60, train_loss: 0.2749, test_loss: 1.0742, test_f1: 0.6889
 epoch: 61, train_loss: 0.2707, test_loss: 1.1441, test_f1: 0.6591
 epoch: 62, train_loss: 0.2674, test_loss: 1.2578, test_f1: 0.6674
 epoch: 63, train_loss: 0.2698, test_loss: 1.2394, test_f1: 0.6689
 epoch: 64, train_loss: 0.2813, test_loss: 1.1731, test_f1: 0.6557
 epoch: 65, train_loss: 0.2580, test_loss: 1.2347, test_f1: 0.6599
 epoch: 66, train_loss: 0.2662, test_loss: 1.1545, test_f1: 0.6560
 epoch: 67, train_loss: 0.2616, test_loss: 1.1883, test_f1: 0.6671
 epoch: 68, train_loss: 0.2414, test_loss: 1.3657, test_f1: 0.6493
 epoch: 69, train_loss: 0.2331, test_loss: 1.3471, test_f1: 0.6565
 epoch: 70, train_loss: 0.2512, test_loss: 1.3862, test_f1: 0.6483
 epoch: 71, train_loss: 0.2497, test_loss: 1.2427, test_f1: 0.6641
 epoch: 72, train_loss: 0.2289, test_loss: 1.4443, test_f1: 0.6545
 epoch: 73, train_loss: 0.2522, test_loss: 1.2800, test_f1: 0.6539
 epoch: 74, train_loss: 0.2479, test_loss: 1.3439, test_f1: 0.6317
 epoch: 75, train_loss: 0.2337, test_loss: 1.4643, test_f1: 0.6284
 epoch: 76, train_loss: 0.2242, test_loss: 1.2428, test_f1: 0.6535
 epoch: 77, train_loss: 0.2374, test_loss: 1.3649, test_f1: 0.6528
 epoch: 78, train_loss: 0.2157, test_loss: 1.4240, test_f1: 0.6452
 epoch: 79, train_loss: 0.2105, test_loss: 1.4505, test_f1: 0.6480
 epoch: 80, train_loss: 0.2231, test_loss: 1.3398, test_f1: 0.6608
 epoch: 81, train_loss: 0.2039, test_loss: 1.4051, test_f1: 0.6518
 epoch: 82, train_loss: 0.2248, test_loss: 1.3858, test_f1: 0.6555
 epoch: 83, train_loss: 0.2121, test_loss: 1.4689, test_f1: 0.6532
 epoch: 84, train_loss: 0.2044, test_loss: 1.4307, test_f1: 0.6623
 epoch: 85, train_loss: 0.2008, test_loss: 1.3867, test_f1: 0.6637
 epoch: 86, train_loss: 0.2193, test_loss: 1.3977, test_f1: 0.6553
 epoch: 87, train_loss: 0.2147, test_loss: 1.3657, test_f1: 0.6618
 epoch: 88, train_loss: 0.2072, test_loss: 1.2892, test_f1: 0.6741
 epoch: 89, train_loss: 0.1964, test_loss: 1.4800, test_f1: 0.6635
 epoch: 90, train_loss: 0.2203, test_loss: 1.3888, test_f1: 0.6673
 epoch: 91, train_loss: 0.2023, test_loss: 1.5009, test_f1: 0.6591
 epoch: 92, train_loss: 0.2095, test_loss: 1.4275, test_f1: 0.6655
 epoch: 93, train_loss: 0.1893, test_loss: 1.5745, test_f1: 0.6623
 epoch: 94, train_loss: 0.1892, test_loss: 1.6085, test_f1: 0.6607
 epoch: 95, train_loss: 0.1851, test_loss: 1.5570, test_f1: 0.6509
 epoch: 96, train_loss: 0.2096, test_loss: 1.4173, test_f1: 0.6712
 epoch: 97, train_loss: 0.1965, test_loss: 1.4456, test_f1: 0.6619
 epoch: 98, train_loss: 0.1902, test_loss: 1.5592, test_f1: 0.6592
 epoch: 99, train_loss: 0.1847, test_loss: 1.5875, test_f1: 0.6566
##################ITERATION #6 ****************************************
 epoch: 0, train_loss: 1.2090, test_loss: 1.0180, test_f1: 0.4904
 epoch: 1, train_loss: 0.9728, test_loss: 0.9401, test_f1: 0.4922
 epoch: 2, train_loss: 0.9216, test_loss: 0.9115, test_f1: 0.5816
 epoch: 3, train_loss: 0.8919, test_loss: 0.8406, test_f1: 0.5495
 epoch: 4, train_loss: 0.8662, test_loss: 0.8364, test_f1: 0.5635
 epoch: 5, train_loss: 0.8471, test_loss: 0.8792, test_f1: 0.5458
 epoch: 6, train_loss: 0.8265, test_loss: 0.8129, test_f1: 0.5780
 epoch: 7, train_loss: 0.8185, test_loss: 0.8705, test_f1: 0.5473
 epoch: 8, train_loss: 0.7934, test_loss: 0.8781, test_f1: 0.6356
 epoch: 9, train_loss: 0.7794, test_loss: 0.7784, test_f1: 0.6421
 epoch: 10, train_loss: 0.7571, test_loss: 0.7761, test_f1: 0.6273
 epoch: 11, train_loss: 0.7592, test_loss: 0.8254, test_f1: 0.5886
 epoch: 12, train_loss: 0.7135, test_loss: 0.7510, test_f1: 0.6599
 epoch: 13, train_loss: 0.7193, test_loss: 0.7709, test_f1: 0.6401
 epoch: 14, train_loss: 0.6897, test_loss: 0.7439, test_f1: 0.6469
 epoch: 15, train_loss: 0.6881, test_loss: 0.6730, test_f1: 0.6742
 epoch: 16, train_loss: 0.6694, test_loss: 0.7801, test_f1: 0.6828
 epoch: 17, train_loss: 0.6623, test_loss: 0.7449, test_f1: 0.6617
 epoch: 18, train_loss: 0.6457, test_loss: 0.7265, test_f1: 0.6615
 epoch: 19, train_loss: 0.6137, test_loss: 0.7416, test_f1: 0.6631
 epoch: 20, train_loss: 0.6357, test_loss: 0.7195, test_f1: 0.6594
 epoch: 21, train_loss: 0.6229, test_loss: 0.7960, test_f1: 0.6506
 epoch: 22, train_loss: 0.6015, test_loss: 0.7949, test_f1: 0.6508
 epoch: 23, train_loss: 0.6163, test_loss: 0.7365, test_f1: 0.6553
 epoch: 24, train_loss: 0.6095, test_loss: 0.7293, test_f1: 0.6744
 epoch: 25, train_loss: 0.6048, test_loss: 0.7553, test_f1: 0.6581
 epoch: 26, train_loss: 0.5793, test_loss: 0.7664, test_f1: 0.6453
 epoch: 27, train_loss: 0.5968, test_loss: 0.8096, test_f1: 0.6779
 epoch: 28, train_loss: 0.5518, test_loss: 0.8164, test_f1: 0.6508
 epoch: 29, train_loss: 0.5535, test_loss: 0.7826, test_f1: 0.6535
 epoch: 30, train_loss: 0.5245, test_loss: 0.8940, test_f1: 0.6649
 epoch: 31, train_loss: 0.5324, test_loss: 0.9831, test_f1: 0.6001
 epoch: 32, train_loss: 0.5339, test_loss: 0.7762, test_f1: 0.6750
 epoch: 33, train_loss: 0.4900, test_loss: 0.8096, test_f1: 0.6837
 epoch: 34, train_loss: 0.4825, test_loss: 0.8128, test_f1: 0.6850
 epoch: 35, train_loss: 0.4798, test_loss: 0.8623, test_f1: 0.6821
 epoch: 36, train_loss: 0.4860, test_loss: 0.7753, test_f1: 0.6542
 epoch: 37, train_loss: 0.4800, test_loss: 0.8127, test_f1: 0.6584
 epoch: 38, train_loss: 0.4956, test_loss: 0.8492, test_f1: 0.6886
 epoch: 39, train_loss: 0.4585, test_loss: 0.7357, test_f1: 0.6817
 epoch: 40, train_loss: 0.4951, test_loss: 0.7409, test_f1: 0.6786
 epoch: 41, train_loss: 0.4755, test_loss: 0.7268, test_f1: 0.7043
 epoch: 42, train_loss: 0.4370, test_loss: 0.8916, test_f1: 0.6655
 epoch: 43, train_loss: 0.4426, test_loss: 0.7650, test_f1: 0.6757
 epoch: 44, train_loss: 0.4520, test_loss: 0.8419, test_f1: 0.6564
 epoch: 45, train_loss: 0.4285, test_loss: 0.9271, test_f1: 0.6614
 epoch: 46, train_loss: 0.4190, test_loss: 0.9173, test_f1: 0.6729
 epoch: 47, train_loss: 0.4249, test_loss: 0.7808, test_f1: 0.7008
 epoch: 48, train_loss: 0.4033, test_loss: 0.9511, test_f1: 0.6910
 epoch: 49, train_loss: 0.3894, test_loss: 0.9548, test_f1: 0.6610
 epoch: 50, train_loss: 0.3828, test_loss: 0.8749, test_f1: 0.6812
 epoch: 51, train_loss: 0.3324, test_loss: 0.9777, test_f1: 0.6702
 epoch: 52, train_loss: 0.3411, test_loss: 0.9179, test_f1: 0.6838
 epoch: 53, train_loss: 0.3094, test_loss: 0.9687, test_f1: 0.6718
 epoch: 54, train_loss: 0.3105, test_loss: 0.9997, test_f1: 0.6807
 epoch: 55, train_loss: 0.2858, test_loss: 1.2034, test_f1: 0.6816
 epoch: 56, train_loss: 0.3039, test_loss: 1.1312, test_f1: 0.6838
 epoch: 57, train_loss: 0.2651, test_loss: 1.2100, test_f1: 0.6655
 epoch: 58, train_loss: 0.2831, test_loss: 1.2710, test_f1: 0.6801
 epoch: 59, train_loss: 0.2816, test_loss: 1.1757, test_f1: 0.6959
 epoch: 60, train_loss: 0.2760, test_loss: 1.0719, test_f1: 0.6890
 epoch: 61, train_loss: 0.2659, test_loss: 1.2727, test_f1: 0.6742
 epoch: 62, train_loss: 0.2648, test_loss: 1.1058, test_f1: 0.6936
 epoch: 63, train_loss: 0.2676, test_loss: 1.1085, test_f1: 0.6884
 epoch: 64, train_loss: 0.2470, test_loss: 1.2336, test_f1: 0.6915
 epoch: 65, train_loss: 0.2548, test_loss: 1.2879, test_f1: 0.6874
 epoch: 66, train_loss: 0.2530, test_loss: 1.1356, test_f1: 0.6923
 epoch: 67, train_loss: 0.2633, test_loss: 1.0564, test_f1: 0.6936
 epoch: 68, train_loss: 0.2326, test_loss: 1.2198, test_f1: 0.6884
 epoch: 69, train_loss: 0.2496, test_loss: 1.2894, test_f1: 0.6837
 epoch: 70, train_loss: 0.2581, test_loss: 1.2315, test_f1: 0.6950
 epoch: 71, train_loss: 0.2398, test_loss: 1.2761, test_f1: 0.6922
 epoch: 72, train_loss: 0.2508, test_loss: 1.3169, test_f1: 0.6713
 epoch: 73, train_loss: 0.2492, test_loss: 1.1803, test_f1: 0.7020
 epoch: 74, train_loss: 0.2267, test_loss: 1.3181, test_f1: 0.6852
 epoch: 75, train_loss: 0.2106, test_loss: 1.4019, test_f1: 0.7009
 epoch: 76, train_loss: 0.2168, test_loss: 1.4393, test_f1: 0.6722
 epoch: 77, train_loss: 0.2210, test_loss: 1.4947, test_f1: 0.6751
 epoch: 78, train_loss: 0.2284, test_loss: 1.3684, test_f1: 0.6810
 epoch: 79, train_loss: 0.2239, test_loss: 1.3191, test_f1: 0.6838
 epoch: 80, train_loss: 0.2234, test_loss: 1.3783, test_f1: 0.6852
 epoch: 81, train_loss: 0.2461, test_loss: 1.3986, test_f1: 0.6759
 epoch: 82, train_loss: 0.2195, test_loss: 1.3438, test_f1: 0.6961
 epoch: 83, train_loss: 0.2067, test_loss: 1.4982, test_f1: 0.6824
 epoch: 84, train_loss: 0.2150, test_loss: 1.3458, test_f1: 0.6981
 epoch: 85, train_loss: 0.2020, test_loss: 1.6131, test_f1: 0.6851
 epoch: 86, train_loss: 0.1995, test_loss: 1.4915, test_f1: 0.6773
 epoch: 87, train_loss: 0.2050, test_loss: 1.5663, test_f1: 0.6808
 epoch: 88, train_loss: 0.2029, test_loss: 1.5176, test_f1: 0.7067
 epoch: 89, train_loss: 0.2008, test_loss: 1.4790, test_f1: 0.6956
 epoch: 90, train_loss: 0.1856, test_loss: 1.5934, test_f1: 0.6803
 epoch: 91, train_loss: 0.2009, test_loss: 1.6582, test_f1: 0.6769
 epoch: 92, train_loss: 0.1813, test_loss: 1.7407, test_f1: 0.6749
 epoch: 93, train_loss: 0.1894, test_loss: 1.7015, test_f1: 0.6864
 epoch: 94, train_loss: 0.1851, test_loss: 1.5675, test_f1: 0.6919
 epoch: 95, train_loss: 0.1749, test_loss: 1.7170, test_f1: 0.6677
 epoch: 96, train_loss: 0.1894, test_loss: 1.5013, test_f1: 0.6788
 epoch: 97, train_loss: 0.2140, test_loss: 1.5088, test_f1: 0.6699
 epoch: 98, train_loss: 0.1831, test_loss: 1.5865, test_f1: 0.6851
 epoch: 99, train_loss: 0.1909, test_loss: 1.5558, test_f1: 0.6915
##################ITERATION #7 ****************************************
 epoch: 0, train_loss: 1.1757, test_loss: 1.0060, test_f1: 0.5251
 epoch: 1, train_loss: 0.9673, test_loss: 0.9053, test_f1: 0.5222
 epoch: 2, train_loss: 0.9186, test_loss: 0.9086, test_f1: 0.5008
 epoch: 3, train_loss: 0.9065, test_loss: 0.8646, test_f1: 0.5905
 epoch: 4, train_loss: 0.8967, test_loss: 0.9014, test_f1: 0.5083
 epoch: 5, train_loss: 0.8446, test_loss: 0.8497, test_f1: 0.5993
 epoch: 6, train_loss: 0.8401, test_loss: 0.8555, test_f1: 0.6014
 epoch: 7, train_loss: 0.8104, test_loss: 0.8710, test_f1: 0.5884
 epoch: 8, train_loss: 0.7968, test_loss: 0.8773, test_f1: 0.5728
 epoch: 9, train_loss: 0.7769, test_loss: 0.7725, test_f1: 0.6281
 epoch: 10, train_loss: 0.7488, test_loss: 0.8039, test_f1: 0.6331
 epoch: 11, train_loss: 0.7309, test_loss: 0.7372, test_f1: 0.6377
 epoch: 12, train_loss: 0.7129, test_loss: 0.8082, test_f1: 0.5964
 epoch: 13, train_loss: 0.6855, test_loss: 0.8636, test_f1: 0.6515
 epoch: 14, train_loss: 0.6957, test_loss: 0.7905, test_f1: 0.6169
 epoch: 15, train_loss: 0.6828, test_loss: 0.7332, test_f1: 0.6700
 epoch: 16, train_loss: 0.6696, test_loss: 0.7899, test_f1: 0.6620
 epoch: 17, train_loss: 0.6569, test_loss: 0.7124, test_f1: 0.6755
 epoch: 18, train_loss: 0.6509, test_loss: 0.7761, test_f1: 0.6254
 epoch: 19, train_loss: 0.6270, test_loss: 0.7286, test_f1: 0.6667
 epoch: 20, train_loss: 0.6214, test_loss: 0.7204, test_f1: 0.6666
 epoch: 21, train_loss: 0.6263, test_loss: 0.7982, test_f1: 0.6887
 epoch: 22, train_loss: 0.6143, test_loss: 0.7659, test_f1: 0.6897
 epoch: 23, train_loss: 0.5899, test_loss: 0.7860, test_f1: 0.6530
 epoch: 24, train_loss: 0.5902, test_loss: 0.7044, test_f1: 0.6962
 epoch: 25, train_loss: 0.5659, test_loss: 0.7379, test_f1: 0.6659
 epoch: 26, train_loss: 0.5481, test_loss: 0.7657, test_f1: 0.6706
 epoch: 27, train_loss: 0.5477, test_loss: 0.8154, test_f1: 0.6804
 epoch: 28, train_loss: 0.5415, test_loss: 0.7817, test_f1: 0.6716
 epoch: 29, train_loss: 0.5407, test_loss: 0.8559, test_f1: 0.6833
 epoch: 30, train_loss: 0.5365, test_loss: 0.8113, test_f1: 0.6551
 epoch: 31, train_loss: 0.5216, test_loss: 0.9110, test_f1: 0.6976
 epoch: 32, train_loss: 0.5173, test_loss: 0.7950, test_f1: 0.6504
 epoch: 33, train_loss: 0.4902, test_loss: 0.8768, test_f1: 0.6603
 epoch: 34, train_loss: 0.5221, test_loss: 0.9332, test_f1: 0.7032
 epoch: 35, train_loss: 0.4985, test_loss: 0.9577, test_f1: 0.6712
 epoch: 36, train_loss: 0.5095, test_loss: 0.7686, test_f1: 0.6917
 epoch: 37, train_loss: 0.4854, test_loss: 0.9762, test_f1: 0.6877
 epoch: 38, train_loss: 0.4662, test_loss: 1.0211, test_f1: 0.6871
 epoch: 39, train_loss: 0.4681, test_loss: 0.8332, test_f1: 0.6944
 epoch: 40, train_loss: 0.4434, test_loss: 0.8891, test_f1: 0.6689
 epoch: 41, train_loss: 0.4393, test_loss: 0.9442, test_f1: 0.6770
 epoch: 42, train_loss: 0.4687, test_loss: 0.8683, test_f1: 0.6875
 epoch: 43, train_loss: 0.4395, test_loss: 0.9629, test_f1: 0.6872
 epoch: 44, train_loss: 0.4340, test_loss: 0.9117, test_f1: 0.6597
 epoch: 45, train_loss: 0.4033, test_loss: 1.1115, test_f1: 0.6841
 epoch: 46, train_loss: 0.4435, test_loss: 0.9913, test_f1: 0.6776
 epoch: 47, train_loss: 0.4103, test_loss: 0.8916, test_f1: 0.6776
 epoch: 48, train_loss: 0.4011, test_loss: 0.9896, test_f1: 0.6924
 epoch: 49, train_loss: 0.3971, test_loss: 0.9921, test_f1: 0.6881
 epoch: 50, train_loss: 0.3776, test_loss: 1.1194, test_f1: 0.6887
 epoch: 51, train_loss: 0.3426, test_loss: 1.0924, test_f1: 0.7083
 epoch: 52, train_loss: 0.3249, test_loss: 1.0862, test_f1: 0.6978
 epoch: 53, train_loss: 0.3108, test_loss: 1.0478, test_f1: 0.6997
 epoch: 54, train_loss: 0.3127, test_loss: 1.1822, test_f1: 0.7056
 epoch: 55, train_loss: 0.3027, test_loss: 1.0830, test_f1: 0.6933
 epoch: 56, train_loss: 0.2994, test_loss: 1.1514, test_f1: 0.6978
 epoch: 57, train_loss: 0.2950, test_loss: 1.1964, test_f1: 0.7077
 epoch: 58, train_loss: 0.2971, test_loss: 1.1322, test_f1: 0.7058
 epoch: 59, train_loss: 0.3023, test_loss: 1.1591, test_f1: 0.6909
 epoch: 60, train_loss: 0.2928, test_loss: 1.2308, test_f1: 0.6987
 epoch: 61, train_loss: 0.2761, test_loss: 1.1675, test_f1: 0.7010
 epoch: 62, train_loss: 0.2892, test_loss: 1.3775, test_f1: 0.6731
 epoch: 63, train_loss: 0.2750, test_loss: 1.1564, test_f1: 0.7177
 epoch: 64, train_loss: 0.2692, test_loss: 1.2783, test_f1: 0.7092
 epoch: 65, train_loss: 0.2890, test_loss: 1.2435, test_f1: 0.7085
 epoch: 66, train_loss: 0.2413, test_loss: 1.1742, test_f1: 0.7027
 epoch: 67, train_loss: 0.2759, test_loss: 1.3789, test_f1: 0.6913
 epoch: 68, train_loss: 0.2624, test_loss: 1.1792, test_f1: 0.7040
 epoch: 69, train_loss: 0.2334, test_loss: 1.3915, test_f1: 0.7060
 epoch: 70, train_loss: 0.2389, test_loss: 1.3152, test_f1: 0.7063
 epoch: 71, train_loss: 0.2333, test_loss: 1.2560, test_f1: 0.7020
 epoch: 72, train_loss: 0.2347, test_loss: 1.3303, test_f1: 0.7025
 epoch: 73, train_loss: 0.2308, test_loss: 1.2017, test_f1: 0.6942
 epoch: 74, train_loss: 0.2380, test_loss: 1.2896, test_f1: 0.6634
 epoch: 75, train_loss: 0.2287, test_loss: 1.3859, test_f1: 0.6983
 epoch: 76, train_loss: 0.2425, test_loss: 1.1163, test_f1: 0.7029
 epoch: 77, train_loss: 0.2400, test_loss: 1.2665, test_f1: 0.6934
 epoch: 78, train_loss: 0.2134, test_loss: 1.3546, test_f1: 0.6864
 epoch: 79, train_loss: 0.2083, test_loss: 1.1892, test_f1: 0.6905
 epoch: 80, train_loss: 0.2409, test_loss: 1.2452, test_f1: 0.6829
 epoch: 81, train_loss: 0.2262, test_loss: 1.3013, test_f1: 0.6840
 epoch: 82, train_loss: 0.2083, test_loss: 1.3958, test_f1: 0.6905
 epoch: 83, train_loss: 0.2172, test_loss: 1.3818, test_f1: 0.6777
 epoch: 84, train_loss: 0.1801, test_loss: 1.3838, test_f1: 0.6929
 epoch: 85, train_loss: 0.2151, test_loss: 1.3250, test_f1: 0.7013
 epoch: 86, train_loss: 0.2318, test_loss: 1.3544, test_f1: 0.6922
 epoch: 87, train_loss: 0.2186, test_loss: 1.3485, test_f1: 0.6968
 epoch: 88, train_loss: 0.2197, test_loss: 1.2747, test_f1: 0.6918
 epoch: 89, train_loss: 0.1941, test_loss: 1.3912, test_f1: 0.6936
 epoch: 90, train_loss: 0.1917, test_loss: 1.4899, test_f1: 0.7022
 epoch: 91, train_loss: 0.2007, test_loss: 1.3267, test_f1: 0.6927
 epoch: 92, train_loss: 0.1974, test_loss: 1.2739, test_f1: 0.7072
 epoch: 93, train_loss: 0.1803, test_loss: 1.4501, test_f1: 0.6952
 epoch: 94, train_loss: 0.1911, test_loss: 1.2738, test_f1: 0.6863
 epoch: 95, train_loss: 0.1654, test_loss: 1.3512, test_f1: 0.6872
 epoch: 96, train_loss: 0.2041, test_loss: 1.2938, test_f1: 0.6940
 epoch: 97, train_loss: 0.2037, test_loss: 1.1708, test_f1: 0.7110
 epoch: 98, train_loss: 0.1866, test_loss: 1.2310, test_f1: 0.7009
 epoch: 99, train_loss: 0.1823, test_loss: 1.2712, test_f1: 0.6781
##################ITERATION #8 ****************************************
 epoch: 0, train_loss: 1.1962, test_loss: 1.0347, test_f1: 0.4417
 epoch: 1, train_loss: 0.9855, test_loss: 0.9517, test_f1: 0.5458
 epoch: 2, train_loss: 0.9444, test_loss: 0.9400, test_f1: 0.5451
 epoch: 3, train_loss: 0.9160, test_loss: 0.8992, test_f1: 0.5565
 epoch: 4, train_loss: 0.8844, test_loss: 0.8665, test_f1: 0.5395
 epoch: 5, train_loss: 0.8608, test_loss: 0.8459, test_f1: 0.6029
 epoch: 6, train_loss: 0.8414, test_loss: 0.8228, test_f1: 0.5994
 epoch: 7, train_loss: 0.8010, test_loss: 0.8025, test_f1: 0.6000
 epoch: 8, train_loss: 0.8123, test_loss: 0.7459, test_f1: 0.6258
 epoch: 9, train_loss: 0.7752, test_loss: 0.7981, test_f1: 0.6349
 epoch: 10, train_loss: 0.7698, test_loss: 0.7649, test_f1: 0.6728
 epoch: 11, train_loss: 0.7536, test_loss: 0.7264, test_f1: 0.6427
 epoch: 12, train_loss: 0.7314, test_loss: 0.7341, test_f1: 0.6408
 epoch: 13, train_loss: 0.7161, test_loss: 0.7648, test_f1: 0.6296
 epoch: 14, train_loss: 0.7044, test_loss: 0.7214, test_f1: 0.6809
 epoch: 15, train_loss: 0.6997, test_loss: 0.7118, test_f1: 0.6451
 epoch: 16, train_loss: 0.6888, test_loss: 0.7440, test_f1: 0.6255
 epoch: 17, train_loss: 0.6617, test_loss: 0.7255, test_f1: 0.6770
 epoch: 18, train_loss: 0.6527, test_loss: 0.6840, test_f1: 0.6760
 epoch: 19, train_loss: 0.6249, test_loss: 0.6918, test_f1: 0.7048
 epoch: 20, train_loss: 0.6236, test_loss: 0.6988, test_f1: 0.6847
 epoch: 21, train_loss: 0.6029, test_loss: 0.7123, test_f1: 0.6496
 epoch: 22, train_loss: 0.6145, test_loss: 0.7033, test_f1: 0.6874
 epoch: 23, train_loss: 0.6167, test_loss: 0.6559, test_f1: 0.7065
 epoch: 24, train_loss: 0.5823, test_loss: 0.6488, test_f1: 0.7056
 epoch: 25, train_loss: 0.5936, test_loss: 0.6586, test_f1: 0.7162
 epoch: 26, train_loss: 0.5966, test_loss: 0.6949, test_f1: 0.6764
 epoch: 27, train_loss: 0.5668, test_loss: 0.6987, test_f1: 0.6862
 epoch: 28, train_loss: 0.5492, test_loss: 0.7288, test_f1: 0.6595
 epoch: 29, train_loss: 0.5725, test_loss: 0.7555, test_f1: 0.6990
 epoch: 30, train_loss: 0.5430, test_loss: 0.6576, test_f1: 0.6983
 epoch: 31, train_loss: 0.5258, test_loss: 0.7167, test_f1: 0.6915
 epoch: 32, train_loss: 0.5422, test_loss: 0.7013, test_f1: 0.7287
 epoch: 33, train_loss: 0.5147, test_loss: 0.6916, test_f1: 0.7024
 epoch: 34, train_loss: 0.5120, test_loss: 0.7681, test_f1: 0.6831
 epoch: 35, train_loss: 0.4791, test_loss: 0.7720, test_f1: 0.7010
 epoch: 36, train_loss: 0.5206, test_loss: 0.7208, test_f1: 0.6966
 epoch: 37, train_loss: 0.5103, test_loss: 0.7829, test_f1: 0.7069
 epoch: 38, train_loss: 0.4804, test_loss: 0.6985, test_f1: 0.7055
 epoch: 39, train_loss: 0.4694, test_loss: 0.7422, test_f1: 0.6923
 epoch: 40, train_loss: 0.4739, test_loss: 0.6988, test_f1: 0.6962
 epoch: 41, train_loss: 0.4528, test_loss: 0.7215, test_f1: 0.6914
 epoch: 42, train_loss: 0.4624, test_loss: 0.7465, test_f1: 0.7143
 epoch: 43, train_loss: 0.4560, test_loss: 0.7244, test_f1: 0.6950
 epoch: 44, train_loss: 0.4468, test_loss: 0.8413, test_f1: 0.6650
 epoch: 45, train_loss: 0.4362, test_loss: 0.8563, test_f1: 0.6996
 epoch: 46, train_loss: 0.4245, test_loss: 0.7720, test_f1: 0.7054
 epoch: 47, train_loss: 0.4174, test_loss: 0.8967, test_f1: 0.6486
 epoch: 48, train_loss: 0.4225, test_loss: 0.7414, test_f1: 0.7059
 epoch: 49, train_loss: 0.4088, test_loss: 0.7816, test_f1: 0.7182
 epoch: 50, train_loss: 0.4266, test_loss: 0.8029, test_f1: 0.6863
 epoch: 51, train_loss: 0.3620, test_loss: 0.8203, test_f1: 0.7013
 epoch: 52, train_loss: 0.3541, test_loss: 0.7981, test_f1: 0.7200
 epoch: 53, train_loss: 0.3476, test_loss: 0.7672, test_f1: 0.6956
 epoch: 54, train_loss: 0.3425, test_loss: 0.7174, test_f1: 0.7166
 epoch: 55, train_loss: 0.3374, test_loss: 0.8341, test_f1: 0.6836
 epoch: 56, train_loss: 0.3233, test_loss: 0.8997, test_f1: 0.6874
 epoch: 57, train_loss: 0.3182, test_loss: 0.8343, test_f1: 0.6988
 epoch: 58, train_loss: 0.3159, test_loss: 0.9209, test_f1: 0.6838
 epoch: 59, train_loss: 0.3043, test_loss: 0.9006, test_f1: 0.6779
 epoch: 60, train_loss: 0.2945, test_loss: 0.9284, test_f1: 0.6906
 epoch: 61, train_loss: 0.3157, test_loss: 0.8475, test_f1: 0.7053
 epoch: 62, train_loss: 0.2915, test_loss: 0.8802, test_f1: 0.6974
 epoch: 63, train_loss: 0.2966, test_loss: 0.9825, test_f1: 0.6742
 epoch: 64, train_loss: 0.2983, test_loss: 0.9637, test_f1: 0.6800
 epoch: 65, train_loss: 0.2956, test_loss: 0.9151, test_f1: 0.6851
 epoch: 66, train_loss: 0.2760, test_loss: 1.0316, test_f1: 0.6899
 epoch: 67, train_loss: 0.2823, test_loss: 1.0960, test_f1: 0.6729
 epoch: 68, train_loss: 0.2757, test_loss: 1.0552, test_f1: 0.6992
 epoch: 69, train_loss: 0.2777, test_loss: 1.0866, test_f1: 0.6820
 epoch: 70, train_loss: 0.2672, test_loss: 1.0022, test_f1: 0.6918
 epoch: 71, train_loss: 0.2714, test_loss: 1.0466, test_f1: 0.6796
 epoch: 72, train_loss: 0.2928, test_loss: 0.9654, test_f1: 0.6870
 epoch: 73, train_loss: 0.2617, test_loss: 1.1192, test_f1: 0.6718
 epoch: 74, train_loss: 0.2611, test_loss: 1.1745, test_f1: 0.6824
 epoch: 75, train_loss: 0.2575, test_loss: 1.1166, test_f1: 0.6767
 epoch: 76, train_loss: 0.2252, test_loss: 1.2028, test_f1: 0.6878
 epoch: 77, train_loss: 0.2452, test_loss: 0.9826, test_f1: 0.6712
 epoch: 78, train_loss: 0.2497, test_loss: 0.9860, test_f1: 0.6809
 epoch: 79, train_loss: 0.2542, test_loss: 1.1339, test_f1: 0.6773
 epoch: 80, train_loss: 0.2569, test_loss: 1.0916, test_f1: 0.6861
 epoch: 81, train_loss: 0.2316, test_loss: 1.0852, test_f1: 0.6849
 epoch: 82, train_loss: 0.2264, test_loss: 1.2551, test_f1: 0.6719
 epoch: 83, train_loss: 0.2458, test_loss: 1.2296, test_f1: 0.6650
 epoch: 84, train_loss: 0.2197, test_loss: 1.2508, test_f1: 0.6691
 epoch: 85, train_loss: 0.2442, test_loss: 1.2437, test_f1: 0.6837
 epoch: 86, train_loss: 0.2174, test_loss: 1.2054, test_f1: 0.6824
 epoch: 87, train_loss: 0.2153, test_loss: 1.2568, test_f1: 0.6787
 epoch: 88, train_loss: 0.2116, test_loss: 1.2922, test_f1: 0.6854
 epoch: 89, train_loss: 0.2252, test_loss: 1.3466, test_f1: 0.6795
 epoch: 90, train_loss: 0.2228, test_loss: 1.2535, test_f1: 0.6695
 epoch: 91, train_loss: 0.2302, test_loss: 1.4044, test_f1: 0.6692
 epoch: 92, train_loss: 0.2081, test_loss: 1.2884, test_f1: 0.6675
 epoch: 93, train_loss: 0.2076, test_loss: 1.3257, test_f1: 0.6665
 epoch: 94, train_loss: 0.1889, test_loss: 1.3874, test_f1: 0.6841
 epoch: 95, train_loss: 0.2025, test_loss: 1.5286, test_f1: 0.6448
 epoch: 96, train_loss: 0.2020, test_loss: 1.2538, test_f1: 0.6664
 epoch: 97, train_loss: 0.2017, test_loss: 1.2902, test_f1: 0.6764
 epoch: 98, train_loss: 0.2164, test_loss: 1.3481, test_f1: 0.6723
 epoch: 99, train_loss: 0.2146, test_loss: 1.4489, test_f1: 0.6585
##################ITERATION #9 ****************************************
 epoch: 0, train_loss: 1.2135, test_loss: 1.0459, test_f1: 0.5011
 epoch: 1, train_loss: 0.9751, test_loss: 0.9755, test_f1: 0.5142
 epoch: 2, train_loss: 0.9371, test_loss: 0.8990, test_f1: 0.5676
 epoch: 3, train_loss: 0.8989, test_loss: 0.9278, test_f1: 0.5290
 epoch: 4, train_loss: 0.8722, test_loss: 0.8410, test_f1: 0.5371
 epoch: 5, train_loss: 0.8635, test_loss: 0.8191, test_f1: 0.5601
 epoch: 6, train_loss: 0.8255, test_loss: 0.8215, test_f1: 0.5820
 epoch: 7, train_loss: 0.7877, test_loss: 0.8013, test_f1: 0.6024
 epoch: 8, train_loss: 0.7771, test_loss: 0.7442, test_f1: 0.6574
 epoch: 9, train_loss: 0.7632, test_loss: 0.7827, test_f1: 0.6045
 epoch: 10, train_loss: 0.7466, test_loss: 0.7742, test_f1: 0.5986
 epoch: 11, train_loss: 0.7309, test_loss: 0.7446, test_f1: 0.6438
 epoch: 12, train_loss: 0.7259, test_loss: 0.6922, test_f1: 0.6535
 epoch: 13, train_loss: 0.7170, test_loss: 0.7850, test_f1: 0.6531
 epoch: 14, train_loss: 0.6811, test_loss: 0.8018, test_f1: 0.6235
 epoch: 15, train_loss: 0.6782, test_loss: 0.6759, test_f1: 0.6718
 epoch: 16, train_loss: 0.6811, test_loss: 0.7641, test_f1: 0.6317
 epoch: 17, train_loss: 0.6598, test_loss: 0.8309, test_f1: 0.6414
 epoch: 18, train_loss: 0.6579, test_loss: 0.8290, test_f1: 0.6509
 epoch: 19, train_loss: 0.6533, test_loss: 0.7595, test_f1: 0.6245
 epoch: 20, train_loss: 0.6407, test_loss: 0.8284, test_f1: 0.6670
 epoch: 21, train_loss: 0.6213, test_loss: 0.9116, test_f1: 0.6772
 epoch: 22, train_loss: 0.5951, test_loss: 0.8306, test_f1: 0.6691
 epoch: 23, train_loss: 0.6031, test_loss: 0.8744, test_f1: 0.6672
 epoch: 24, train_loss: 0.6025, test_loss: 0.8401, test_f1: 0.6596
 epoch: 25, train_loss: 0.5869, test_loss: 0.9457, test_f1: 0.6859
 epoch: 26, train_loss: 0.5854, test_loss: 0.7511, test_f1: 0.6584
 epoch: 27, train_loss: 0.5707, test_loss: 0.8765, test_f1: 0.6548
 epoch: 28, train_loss: 0.5713, test_loss: 0.9652, test_f1: 0.6329
 epoch: 29, train_loss: 0.5638, test_loss: 0.9757, test_f1: 0.6463
 epoch: 30, train_loss: 0.5305, test_loss: 0.9141, test_f1: 0.6672
 epoch: 31, train_loss: 0.5503, test_loss: 0.9317, test_f1: 0.6612
 epoch: 32, train_loss: 0.5366, test_loss: 0.8567, test_f1: 0.6638
 epoch: 33, train_loss: 0.5047, test_loss: 0.9083, test_f1: 0.6628
 epoch: 34, train_loss: 0.5201, test_loss: 0.8660, test_f1: 0.6606
 epoch: 35, train_loss: 0.5333, test_loss: 0.9736, test_f1: 0.6586
 epoch: 36, train_loss: 0.4957, test_loss: 0.9744, test_f1: 0.6758
 epoch: 37, train_loss: 0.4936, test_loss: 0.9128, test_f1: 0.6648
 epoch: 38, train_loss: 0.4732, test_loss: 1.0201, test_f1: 0.6748
 epoch: 39, train_loss: 0.4892, test_loss: 0.8937, test_f1: 0.6942
 epoch: 40, train_loss: 0.4592, test_loss: 1.0288, test_f1: 0.6871
 epoch: 41, train_loss: 0.4461, test_loss: 1.1114, test_f1: 0.6583
 epoch: 42, train_loss: 0.4438, test_loss: 1.0064, test_f1: 0.6711
 epoch: 43, train_loss: 0.4289, test_loss: 0.9474, test_f1: 0.6647
 epoch: 44, train_loss: 0.4518, test_loss: 0.9602, test_f1: 0.6881
 epoch: 45, train_loss: 0.4317, test_loss: 1.0380, test_f1: 0.6683
 epoch: 46, train_loss: 0.4323, test_loss: 1.0254, test_f1: 0.6739
 epoch: 47, train_loss: 0.4533, test_loss: 0.9174, test_f1: 0.6736
 epoch: 48, train_loss: 0.4083, test_loss: 0.8404, test_f1: 0.6821
 epoch: 49, train_loss: 0.4251, test_loss: 0.9791, test_f1: 0.7278
 epoch: 50, train_loss: 0.4077, test_loss: 1.0411, test_f1: 0.6751
 epoch: 51, train_loss: 0.3478, test_loss: 1.0978, test_f1: 0.6920
 epoch: 52, train_loss: 0.3425, test_loss: 1.1748, test_f1: 0.6812
 epoch: 53, train_loss: 0.3240, test_loss: 1.0612, test_f1: 0.6914
 epoch: 54, train_loss: 0.3196, test_loss: 1.0582, test_f1: 0.6831
 epoch: 55, train_loss: 0.3086, test_loss: 1.2119, test_f1: 0.6856
 epoch: 56, train_loss: 0.3231, test_loss: 1.1993, test_f1: 0.6789
 epoch: 57, train_loss: 0.3165, test_loss: 1.2095, test_f1: 0.6696
 epoch: 58, train_loss: 0.3131, test_loss: 1.2232, test_f1: 0.6782
 epoch: 59, train_loss: 0.3239, test_loss: 1.1866, test_f1: 0.6699
 epoch: 60, train_loss: 0.3052, test_loss: 1.1687, test_f1: 0.6824
 epoch: 61, train_loss: 0.2902, test_loss: 1.2022, test_f1: 0.6929
 epoch: 62, train_loss: 0.2950, test_loss: 1.2426, test_f1: 0.6913
 epoch: 63, train_loss: 0.3021, test_loss: 1.3202, test_f1: 0.6623
 epoch: 64, train_loss: 0.2760, test_loss: 1.2280, test_f1: 0.6894
 epoch: 65, train_loss: 0.2749, test_loss: 1.2383, test_f1: 0.6788
 epoch: 66, train_loss: 0.2626, test_loss: 1.2712, test_f1: 0.6726
 epoch: 67, train_loss: 0.2779, test_loss: 1.3212, test_f1: 0.6654
 epoch: 68, train_loss: 0.2813, test_loss: 1.1468, test_f1: 0.6806
 epoch: 69, train_loss: 0.2692, test_loss: 1.2091, test_f1: 0.6670
 epoch: 70, train_loss: 0.2769, test_loss: 1.3299, test_f1: 0.6732
 epoch: 71, train_loss: 0.2493, test_loss: 1.3254, test_f1: 0.6624
 epoch: 72, train_loss: 0.2744, test_loss: 1.1808, test_f1: 0.6731
 epoch: 73, train_loss: 0.2660, test_loss: 1.2422, test_f1: 0.6696
 epoch: 74, train_loss: 0.2359, test_loss: 1.3296, test_f1: 0.6781
 epoch: 75, train_loss: 0.2524, test_loss: 1.5165, test_f1: 0.6657
 epoch: 76, train_loss: 0.2436, test_loss: 1.4132, test_f1: 0.6639
 epoch: 77, train_loss: 0.2613, test_loss: 1.5191, test_f1: 0.6546
 epoch: 78, train_loss: 0.2330, test_loss: 1.3569, test_f1: 0.6754
 epoch: 79, train_loss: 0.2355, test_loss: 1.3845, test_f1: 0.6856
 epoch: 80, train_loss: 0.2556, test_loss: 1.3708, test_f1: 0.6742
 epoch: 81, train_loss: 0.2294, test_loss: 1.5187, test_f1: 0.6687
 epoch: 82, train_loss: 0.2258, test_loss: 1.4430, test_f1: 0.6694
 epoch: 83, train_loss: 0.2412, test_loss: 1.5790, test_f1: 0.6756
 epoch: 84, train_loss: 0.2214, test_loss: 1.6981, test_f1: 0.6748
 epoch: 85, train_loss: 0.2167, test_loss: 1.4671, test_f1: 0.6502
 epoch: 86, train_loss: 0.2286, test_loss: 1.4828, test_f1: 0.6834
 epoch: 87, train_loss: 0.2165, test_loss: 1.6362, test_f1: 0.6650
 epoch: 88, train_loss: 0.2376, test_loss: 1.5414, test_f1: 0.6421
 epoch: 89, train_loss: 0.2072, test_loss: 1.6273, test_f1: 0.6734
 epoch: 90, train_loss: 0.2340, test_loss: 1.5111, test_f1: 0.6638
 epoch: 91, train_loss: 0.2078, test_loss: 1.4233, test_f1: 0.6670
 epoch: 92, train_loss: 0.1989, test_loss: 1.4680, test_f1: 0.6730
 epoch: 93, train_loss: 0.2064, test_loss: 1.7212, test_f1: 0.6677
 epoch: 94, train_loss: 0.2082, test_loss: 1.6273, test_f1: 0.6636
 epoch: 95, train_loss: 0.1941, test_loss: 1.7266, test_f1: 0.6480
 epoch: 96, train_loss: 0.2068, test_loss: 1.5411, test_f1: 0.6648
 epoch: 97, train_loss: 0.1959, test_loss: 1.5374, test_f1: 0.6753
 epoch: 98, train_loss: 0.2132, test_loss: 1.5089, test_f1: 0.6715
 epoch: 99, train_loss: 0.2176, test_loss: 1.6423, test_f1: 0.6669

Training completed in 1444.11 seconds
Best F1: 0.7287 at epoch 32
Mean F1 across iterations: 0.7141  0.0088
========================FINAL RESULTS================================
FEGIN weighted F1: 0.7287  0.0088
python main.py --data ltspice_examples --representation component_pin_net --model FEGIN --layers 6 --hiddens 128 --batch_size 32 --lr 0.001 --emb_size 128 --epochs 100 --save_appendix component_pin_net_L6_H128_BS32_LR0.001_E128 --no_val
-----



STDERR:
  File "main.py", line 370, in <module>
    main()
  File "main.py", line 254, in main
    dataset = dataset_class(
  File "/home/philip/projects/ltspice_examples_code_repo/Circuit-Completion-Using-GNNs/component_classification_with_link_prediction_head/evaluation/FEGIN/kernel/circuit_datasets.py", line 15, in __init__
    self.data, self.slices = torch.load(self.processed_paths[0])
  File "/home/philip/.local/lib/python3.8/site-packages/torch/serialization.py", line 1040, in load
    warnings.warn(
  File "/usr/lib/python3.8/warnings.py", line 109, in _showwarnmsg
    sw(msg.message, msg.category, msg.filename, msg.lineno,
  File "main.py", line 47, in warn_with_traceback
    traceback.print_stack(file=log)
/home/philip/projects/ltspice_examples_code_repo/Circuit-Completion-Using-GNNs/component_classification_with_link_prediction_head/evaluation/FEGIN/kernel/circuit_datasets.py:15: FutureWarning: You are using `torch.load` with `weights_only=False` (the current default value), which uses the default pickle module implicitly. It is possible to construct malicious pickle data which will execute arbitrary code during unpickling (See https://github.com/pytorch/pytorch/blob/main/SECURITY.md#untrusted-models for more details). In a future release, the default value for `weights_only` will be flipped to `True`. This limits the functions that could be executed during unpickling. Arbitrary objects will no longer be allowed to be loaded via this mode unless they are explicitly allowlisted by the user via `torch.serialization.add_safe_globals`. We recommend you start setting `weights_only=True` for any use case where you don't have full control of the loaded file. Please open an issue on GitHub for any issues related to this experimental feature.
  self.data, self.slices = torch.load(self.processed_paths[0])
