STDOUT:
Results will be saved in /home/philip/projects/ltspice_examples_code_repo/Circuit-Completion-Using-GNNs/component_classification_with_link_prediction_head/evaluation/FEGIN/results/model_FEGIN_dataset_ltspice_demos
Command line input: python main.py --data ltspice_demos --representation component_pin_net --model FEGIN --layers 2 --hiddens 128 --batch_size 32 --lr 0.01 --emb_size 128 --epochs 100 --save_appendix component_pin_net_L2_H128_BS32_LR0.01_E128 --no_val
 is saved.
-----
ltspice_demos - FEGIN
Using 2 layers, 128 hidden units, h = 2
Loading component_pin_net representation dataset
ENTERED
Training FEGIN on component_pin_net representation
Train: 1565, Test: 383
##################ITERATION #0 ****************************************
 epoch: 0, train_loss: 1.1213, test_loss: 1.4261, test_f1: 0.2336
 epoch: 1, train_loss: 1.0026, test_loss: 1.1864, test_f1: 0.3940
 epoch: 2, train_loss: 0.9274, test_loss: 1.0593, test_f1: 0.5090
 epoch: 3, train_loss: 0.9168, test_loss: 1.0103, test_f1: 0.5382
 epoch: 4, train_loss: 0.8774, test_loss: 1.1405, test_f1: 0.3936
 epoch: 5, train_loss: 0.8885, test_loss: 1.0269, test_f1: 0.4875
 epoch: 6, train_loss: 0.8725, test_loss: 1.1097, test_f1: 0.5426
 epoch: 7, train_loss: 0.8603, test_loss: 0.9776, test_f1: 0.5760
 epoch: 8, train_loss: 0.8594, test_loss: 1.3268, test_f1: 0.3871
 epoch: 9, train_loss: 0.8635, test_loss: 1.0118, test_f1: 0.5533
 epoch: 10, train_loss: 0.8356, test_loss: 0.9797, test_f1: 0.5827
 epoch: 11, train_loss: 0.8201, test_loss: 1.0870, test_f1: 0.5301
 epoch: 12, train_loss: 0.8526, test_loss: 1.2084, test_f1: 0.5149
 epoch: 13, train_loss: 0.8358, test_loss: 0.9765, test_f1: 0.5588
 epoch: 14, train_loss: 0.8136, test_loss: 1.0547, test_f1: 0.5455
 epoch: 15, train_loss: 0.7968, test_loss: 1.0335, test_f1: 0.5021
 epoch: 16, train_loss: 0.8321, test_loss: 0.9982, test_f1: 0.5597
 epoch: 17, train_loss: 0.8319, test_loss: 1.1319, test_f1: 0.4839
 epoch: 18, train_loss: 0.8036, test_loss: 0.9610, test_f1: 0.5904
 epoch: 19, train_loss: 0.7892, test_loss: 0.9595, test_f1: 0.6056
 epoch: 20, train_loss: 0.7851, test_loss: 1.1129, test_f1: 0.4911
 epoch: 21, train_loss: 0.7425, test_loss: 0.9903, test_f1: 0.6084
 epoch: 22, train_loss: 0.7301, test_loss: 1.1615, test_f1: 0.4152
 epoch: 23, train_loss: 0.7612, test_loss: 1.1830, test_f1: 0.5117
 epoch: 24, train_loss: 0.7448, test_loss: 1.0422, test_f1: 0.6363
 epoch: 25, train_loss: 0.6983, test_loss: 1.2426, test_f1: 0.4200
 epoch: 26, train_loss: 0.7582, test_loss: 1.0344, test_f1: 0.6183
 epoch: 27, train_loss: 0.7261, test_loss: 1.1674, test_f1: 0.4401
 epoch: 28, train_loss: 0.7019, test_loss: 1.2640, test_f1: 0.5501
 epoch: 29, train_loss: 0.6880, test_loss: 1.0461, test_f1: 0.6172
 epoch: 30, train_loss: 0.6887, test_loss: 1.1449, test_f1: 0.5508
 epoch: 31, train_loss: 0.7255, test_loss: 1.0986, test_f1: 0.5412
 epoch: 32, train_loss: 0.6825, test_loss: 0.9373, test_f1: 0.5693
 epoch: 33, train_loss: 0.6724, test_loss: 1.0877, test_f1: 0.5795
 epoch: 34, train_loss: 0.7034, test_loss: 1.4400, test_f1: 0.4972
 epoch: 35, train_loss: 0.6726, test_loss: 1.2560, test_f1: 0.6223
 epoch: 36, train_loss: 0.6804, test_loss: 1.1461, test_f1: 0.5518
 epoch: 37, train_loss: 0.6344, test_loss: 1.1683, test_f1: 0.6224
 epoch: 38, train_loss: 0.6552, test_loss: 1.3867, test_f1: 0.5678
 epoch: 39, train_loss: 0.6987, test_loss: 1.0255, test_f1: 0.5622
 epoch: 40, train_loss: 0.6458, test_loss: 1.1282, test_f1: 0.6558
 epoch: 41, train_loss: 0.6361, test_loss: 1.2299, test_f1: 0.5870
 epoch: 42, train_loss: 0.6055, test_loss: 1.3151, test_f1: 0.5773
 epoch: 43, train_loss: 0.6432, test_loss: 1.3606, test_f1: 0.6370
 epoch: 44, train_loss: 0.5888, test_loss: 1.0509, test_f1: 0.5891
 epoch: 45, train_loss: 0.6051, test_loss: 1.3672, test_f1: 0.6070
 epoch: 46, train_loss: 0.6061, test_loss: 1.2292, test_f1: 0.5482
 epoch: 47, train_loss: 0.6200, test_loss: 1.0239, test_f1: 0.5910
 epoch: 48, train_loss: 0.5783, test_loss: 1.2508, test_f1: 0.5726
 epoch: 49, train_loss: 0.5949, test_loss: 1.1341, test_f1: 0.5573
 epoch: 50, train_loss: 0.5721, test_loss: 1.3348, test_f1: 0.5941
 epoch: 51, train_loss: 0.5004, test_loss: 1.3029, test_f1: 0.6013
 epoch: 52, train_loss: 0.5179, test_loss: 1.2857, test_f1: 0.6167
 epoch: 53, train_loss: 0.5025, test_loss: 1.4742, test_f1: 0.6101
 epoch: 54, train_loss: 0.4727, test_loss: 1.4350, test_f1: 0.6013
 epoch: 55, train_loss: 0.4709, test_loss: 1.7107, test_f1: 0.5812
 epoch: 56, train_loss: 0.4743, test_loss: 1.3776, test_f1: 0.6414
 epoch: 57, train_loss: 0.4580, test_loss: 1.5084, test_f1: 0.6196
 epoch: 58, train_loss: 0.4620, test_loss: 1.6349, test_f1: 0.5662
 epoch: 59, train_loss: 0.4684, test_loss: 1.2973, test_f1: 0.6504
 epoch: 60, train_loss: 0.4700, test_loss: 1.4750, test_f1: 0.6160
 epoch: 61, train_loss: 0.4656, test_loss: 1.5329, test_f1: 0.6154
 epoch: 62, train_loss: 0.4215, test_loss: 1.6579, test_f1: 0.6155
 epoch: 63, train_loss: 0.4385, test_loss: 1.8386, test_f1: 0.5797
 epoch: 64, train_loss: 0.4388, test_loss: 1.5179, test_f1: 0.6375
 epoch: 65, train_loss: 0.4218, test_loss: 1.4420, test_f1: 0.6367
 epoch: 66, train_loss: 0.4014, test_loss: 1.8100, test_f1: 0.5949
 epoch: 67, train_loss: 0.4325, test_loss: 1.5466, test_f1: 0.5811
 epoch: 68, train_loss: 0.4202, test_loss: 1.7179, test_f1: 0.5475
 epoch: 69, train_loss: 0.4155, test_loss: 1.6039, test_f1: 0.5882
 epoch: 70, train_loss: 0.4366, test_loss: 1.6475, test_f1: 0.5937
 epoch: 71, train_loss: 0.3912, test_loss: 1.7520, test_f1: 0.6096
 epoch: 72, train_loss: 0.4196, test_loss: 1.4789, test_f1: 0.6190
 epoch: 73, train_loss: 0.3751, test_loss: 1.6622, test_f1: 0.6104
 epoch: 74, train_loss: 0.4110, test_loss: 1.6622, test_f1: 0.6372
 epoch: 75, train_loss: 0.4131, test_loss: 1.6733, test_f1: 0.5816
 epoch: 76, train_loss: 0.3653, test_loss: 1.6787, test_f1: 0.6113
 epoch: 77, train_loss: 0.3924, test_loss: 1.4947, test_f1: 0.6274
 epoch: 78, train_loss: 0.3513, test_loss: 1.7442, test_f1: 0.5852
 epoch: 79, train_loss: 0.3873, test_loss: 1.6168, test_f1: 0.6217
 epoch: 80, train_loss: 0.3958, test_loss: 1.6147, test_f1: 0.6406
 epoch: 81, train_loss: 0.3811, test_loss: 1.6321, test_f1: 0.5998
 epoch: 82, train_loss: 0.3333, test_loss: 1.5581, test_f1: 0.6164
 epoch: 83, train_loss: 0.3863, test_loss: 1.7694, test_f1: 0.6196
 epoch: 84, train_loss: 0.3485, test_loss: 1.8842, test_f1: 0.6390
 epoch: 85, train_loss: 0.4156, test_loss: 1.5715, test_f1: 0.6145
 epoch: 86, train_loss: 0.3764, test_loss: 1.5473, test_f1: 0.6073
 epoch: 87, train_loss: 0.3595, test_loss: 1.7938, test_f1: 0.6225
 epoch: 88, train_loss: 0.3871, test_loss: 1.7566, test_f1: 0.6189
 epoch: 89, train_loss: 0.3581, test_loss: 1.5790, test_f1: 0.6288
 epoch: 90, train_loss: 0.3430, test_loss: 1.7666, test_f1: 0.5918
 epoch: 91, train_loss: 0.3282, test_loss: 1.8510, test_f1: 0.6089
 epoch: 92, train_loss: 0.3594, test_loss: 1.6064, test_f1: 0.6193
 epoch: 93, train_loss: 0.3202, test_loss: 1.7315, test_f1: 0.6361
 epoch: 94, train_loss: 0.3048, test_loss: 1.7468, test_f1: 0.6592
 epoch: 95, train_loss: 0.3269, test_loss: 1.7611, test_f1: 0.6446
 epoch: 96, train_loss: 0.3298, test_loss: 1.7300, test_f1: 0.6314
 epoch: 97, train_loss: 0.2814, test_loss: 1.9065, test_f1: 0.6044
 epoch: 98, train_loss: 0.3386, test_loss: 1.7328, test_f1: 0.6112
 epoch: 99, train_loss: 0.3424, test_loss: 1.5843, test_f1: 0.6133
##################ITERATION #1 ****************************************
 epoch: 0, train_loss: 1.1287, test_loss: 1.1658, test_f1: 0.3721
 epoch: 1, train_loss: 0.9991, test_loss: 1.2283, test_f1: 0.4132
 epoch: 2, train_loss: 0.9519, test_loss: 1.0616, test_f1: 0.5234
 epoch: 3, train_loss: 0.9094, test_loss: 1.0213, test_f1: 0.5506
 epoch: 4, train_loss: 0.9142, test_loss: 1.0857, test_f1: 0.5262
 epoch: 5, train_loss: 0.8646, test_loss: 1.4521, test_f1: 0.4136
 epoch: 6, train_loss: 0.8758, test_loss: 1.0715, test_f1: 0.4578
 epoch: 7, train_loss: 0.8529, test_loss: 0.9707, test_f1: 0.5586
 epoch: 8, train_loss: 0.8317, test_loss: 1.0866, test_f1: 0.5264
 epoch: 9, train_loss: 0.8470, test_loss: 0.9800, test_f1: 0.5768
 epoch: 10, train_loss: 0.8032, test_loss: 1.5324, test_f1: 0.4860
 epoch: 11, train_loss: 0.8408, test_loss: 0.9333, test_f1: 0.5594
 epoch: 12, train_loss: 0.8215, test_loss: 1.0256, test_f1: 0.5548
 epoch: 13, train_loss: 0.7727, test_loss: 1.0970, test_f1: 0.5086
 epoch: 14, train_loss: 0.7841, test_loss: 1.1464, test_f1: 0.4832
 epoch: 15, train_loss: 0.7891, test_loss: 1.2533, test_f1: 0.5114
 epoch: 16, train_loss: 0.7765, test_loss: 1.3070, test_f1: 0.5180
 epoch: 17, train_loss: 0.7434, test_loss: 1.0595, test_f1: 0.5749
 epoch: 18, train_loss: 0.7624, test_loss: 1.3077, test_f1: 0.5109
 epoch: 19, train_loss: 0.7276, test_loss: 1.1220, test_f1: 0.5387
 epoch: 20, train_loss: 0.7185, test_loss: 1.1236, test_f1: 0.4750
 epoch: 21, train_loss: 0.7611, test_loss: 1.0377, test_f1: 0.5020
 epoch: 22, train_loss: 0.7021, test_loss: 1.2668, test_f1: 0.4992
 epoch: 23, train_loss: 0.7046, test_loss: 1.1668, test_f1: 0.5350
 epoch: 24, train_loss: 0.6880, test_loss: 1.2647, test_f1: 0.5125
 epoch: 25, train_loss: 0.7031, test_loss: 1.2796, test_f1: 0.4785
 epoch: 26, train_loss: 0.6865, test_loss: 1.1508, test_f1: 0.5181
 epoch: 27, train_loss: 0.7199, test_loss: 1.1500, test_f1: 0.5358
 epoch: 28, train_loss: 0.6601, test_loss: 1.3459, test_f1: 0.4494
 epoch: 29, train_loss: 0.6988, test_loss: 1.2836, test_f1: 0.4954
 epoch: 30, train_loss: 0.6746, test_loss: 1.4007, test_f1: 0.5023
 epoch: 31, train_loss: 0.6736, test_loss: 1.0351, test_f1: 0.5391
 epoch: 32, train_loss: 0.6562, test_loss: 1.1237, test_f1: 0.5694
 epoch: 33, train_loss: 0.6412, test_loss: 1.1346, test_f1: 0.5822
 epoch: 34, train_loss: 0.6822, test_loss: 1.1977, test_f1: 0.5083
 epoch: 35, train_loss: 0.6401, test_loss: 1.3089, test_f1: 0.5510
 epoch: 36, train_loss: 0.6433, test_loss: 1.0895, test_f1: 0.5775
 epoch: 37, train_loss: 0.6366, test_loss: 2.0940, test_f1: 0.4792
 epoch: 38, train_loss: 0.6230, test_loss: 1.1299, test_f1: 0.5669
 epoch: 39, train_loss: 0.6209, test_loss: 1.1365, test_f1: 0.6079
 epoch: 40, train_loss: 0.6299, test_loss: 1.1945, test_f1: 0.5586
 epoch: 41, train_loss: 0.6347, test_loss: 1.2563, test_f1: 0.5881
 epoch: 42, train_loss: 0.6182, test_loss: 1.5939, test_f1: 0.5545
 epoch: 43, train_loss: 0.5983, test_loss: 1.3175, test_f1: 0.5857
 epoch: 44, train_loss: 0.6167, test_loss: 1.1021, test_f1: 0.5643
 epoch: 45, train_loss: 0.6171, test_loss: 1.1480, test_f1: 0.6410
 epoch: 46, train_loss: 0.6120, test_loss: 1.1744, test_f1: 0.5994
 epoch: 47, train_loss: 0.6047, test_loss: 1.0733, test_f1: 0.6287
 epoch: 48, train_loss: 0.6261, test_loss: 1.2860, test_f1: 0.5332
 epoch: 49, train_loss: 0.5859, test_loss: 1.8131, test_f1: 0.4256
 epoch: 50, train_loss: 0.5752, test_loss: 1.5133, test_f1: 0.5105
 epoch: 51, train_loss: 0.5330, test_loss: 1.2827, test_f1: 0.6151
 epoch: 52, train_loss: 0.4885, test_loss: 1.4749, test_f1: 0.5854
 epoch: 53, train_loss: 0.4847, test_loss: 1.1970, test_f1: 0.6255
 epoch: 54, train_loss: 0.4789, test_loss: 1.4471, test_f1: 0.5604
 epoch: 55, train_loss: 0.4465, test_loss: 1.3668, test_f1: 0.6327
 epoch: 56, train_loss: 0.4545, test_loss: 1.4586, test_f1: 0.6009
 epoch: 57, train_loss: 0.4670, test_loss: 1.3589, test_f1: 0.6323
 epoch: 58, train_loss: 0.4570, test_loss: 1.7103, test_f1: 0.5355
 epoch: 59, train_loss: 0.4706, test_loss: 1.2033, test_f1: 0.6564
 epoch: 60, train_loss: 0.4184, test_loss: 1.3604, test_f1: 0.6225
 epoch: 61, train_loss: 0.4511, test_loss: 1.5217, test_f1: 0.6171
 epoch: 62, train_loss: 0.4119, test_loss: 1.4909, test_f1: 0.5959
 epoch: 63, train_loss: 0.4456, test_loss: 1.4253, test_f1: 0.6278
 epoch: 64, train_loss: 0.4211, test_loss: 1.3779, test_f1: 0.6373
 epoch: 65, train_loss: 0.4053, test_loss: 1.3034, test_f1: 0.6524
 epoch: 66, train_loss: 0.4066, test_loss: 1.4332, test_f1: 0.6406
 epoch: 67, train_loss: 0.4290, test_loss: 1.3807, test_f1: 0.6146
 epoch: 68, train_loss: 0.4021, test_loss: 1.5867, test_f1: 0.5641
 epoch: 69, train_loss: 0.4081, test_loss: 1.6412, test_f1: 0.5978
 epoch: 70, train_loss: 0.3723, test_loss: 1.5281, test_f1: 0.6166
 epoch: 71, train_loss: 0.3642, test_loss: 1.6591, test_f1: 0.6215
 epoch: 72, train_loss: 0.3980, test_loss: 1.7259, test_f1: 0.6240
 epoch: 73, train_loss: 0.3763, test_loss: 1.5314, test_f1: 0.6327
 epoch: 74, train_loss: 0.3725, test_loss: 1.8938, test_f1: 0.5673
 epoch: 75, train_loss: 0.3799, test_loss: 1.3702, test_f1: 0.6685
 epoch: 76, train_loss: 0.4549, test_loss: 1.4312, test_f1: 0.6074
 epoch: 77, train_loss: 0.3881, test_loss: 1.8162, test_f1: 0.5791
 epoch: 78, train_loss: 0.3785, test_loss: 1.5868, test_f1: 0.5863
 epoch: 79, train_loss: 0.3744, test_loss: 2.0021, test_f1: 0.5930
 epoch: 80, train_loss: 0.3536, test_loss: 1.6284, test_f1: 0.6142
 epoch: 81, train_loss: 0.3815, test_loss: 1.8670, test_f1: 0.5902
 epoch: 82, train_loss: 0.3475, test_loss: 1.6539, test_f1: 0.6695
 epoch: 83, train_loss: 0.3450, test_loss: 1.6462, test_f1: 0.6203
 epoch: 84, train_loss: 0.3687, test_loss: 1.8664, test_f1: 0.5760
 epoch: 85, train_loss: 0.3584, test_loss: 1.7030, test_f1: 0.5699
 epoch: 86, train_loss: 0.3453, test_loss: 1.6533, test_f1: 0.6379
 epoch: 87, train_loss: 0.3169, test_loss: 1.6933, test_f1: 0.6073
 epoch: 88, train_loss: 0.3446, test_loss: 1.7477, test_f1: 0.6206
 epoch: 89, train_loss: 0.3635, test_loss: 1.4826, test_f1: 0.6212
 epoch: 90, train_loss: 0.3032, test_loss: 1.9205, test_f1: 0.6023
 epoch: 91, train_loss: 0.3165, test_loss: 1.8605, test_f1: 0.5911
 epoch: 92, train_loss: 0.3003, test_loss: 1.4782, test_f1: 0.6157
 epoch: 93, train_loss: 0.3093, test_loss: 1.6506, test_f1: 0.6401
 epoch: 94, train_loss: 0.3171, test_loss: 1.5367, test_f1: 0.6260
 epoch: 95, train_loss: 0.3381, test_loss: 1.5319, test_f1: 0.5789
 epoch: 96, train_loss: 0.3523, test_loss: 1.5341, test_f1: 0.6444
 epoch: 97, train_loss: 0.3359, test_loss: 1.5135, test_f1: 0.6296
 epoch: 98, train_loss: 0.3037, test_loss: 1.6281, test_f1: 0.6011
 epoch: 99, train_loss: 0.3659, test_loss: 1.5447, test_f1: 0.6512
##################ITERATION #2 ****************************************
 epoch: 0, train_loss: 1.1227, test_loss: 1.2275, test_f1: 0.3668
 epoch: 1, train_loss: 1.0540, test_loss: 1.1159, test_f1: 0.3344
 epoch: 2, train_loss: 1.0340, test_loss: 1.1331, test_f1: 0.3317
 epoch: 3, train_loss: 1.0253, test_loss: 1.1777, test_f1: 0.3201
 epoch: 4, train_loss: 1.0293, test_loss: 1.1537, test_f1: 0.3184
 epoch: 5, train_loss: 1.0204, test_loss: 1.2732, test_f1: 0.2912
 epoch: 6, train_loss: 1.0122, test_loss: 1.1263, test_f1: 0.3357
 epoch: 7, train_loss: 1.0101, test_loss: 1.1149, test_f1: 0.3444
 epoch: 8, train_loss: 1.0115, test_loss: 1.1379, test_f1: 0.3313
 epoch: 9, train_loss: 1.0061, test_loss: 1.1632, test_f1: 0.3186
 epoch: 10, train_loss: 0.9991, test_loss: 1.1307, test_f1: 0.3346
 epoch: 11, train_loss: 1.0014, test_loss: 1.1560, test_f1: 0.3148
 epoch: 12, train_loss: 1.0162, test_loss: 1.1478, test_f1: 0.3573
 epoch: 13, train_loss: 0.9798, test_loss: 1.4231, test_f1: 0.3782
 epoch: 14, train_loss: 0.9780, test_loss: 1.1128, test_f1: 0.3837
 epoch: 15, train_loss: 0.9400, test_loss: 1.1679, test_f1: 0.4469
 epoch: 16, train_loss: 0.9331, test_loss: 1.1169, test_f1: 0.4368
 epoch: 17, train_loss: 0.9432, test_loss: 1.0847, test_f1: 0.3838
 epoch: 18, train_loss: 0.9148, test_loss: 1.4420, test_f1: 0.3750
 epoch: 19, train_loss: 0.8986, test_loss: 1.4420, test_f1: 0.3868
 epoch: 20, train_loss: 0.8943, test_loss: 1.0992, test_f1: 0.4208
 epoch: 21, train_loss: 0.9505, test_loss: 1.0575, test_f1: 0.4097
 epoch: 22, train_loss: 0.9162, test_loss: 1.0992, test_f1: 0.3891
 epoch: 23, train_loss: 0.8962, test_loss: 1.0568, test_f1: 0.4171
 epoch: 24, train_loss: 0.8594, test_loss: 1.0697, test_f1: 0.4952
 epoch: 25, train_loss: 0.8817, test_loss: 1.0444, test_f1: 0.4314
 epoch: 26, train_loss: 0.8436, test_loss: 1.0363, test_f1: 0.5028
 epoch: 27, train_loss: 0.8187, test_loss: 1.0878, test_f1: 0.4818
 epoch: 28, train_loss: 0.8058, test_loss: 1.0446, test_f1: 0.4882
 epoch: 29, train_loss: 0.8274, test_loss: 1.0953, test_f1: 0.5239
 epoch: 30, train_loss: 0.8235, test_loss: 1.0485, test_f1: 0.5574
 epoch: 31, train_loss: 0.8018, test_loss: 1.2100, test_f1: 0.5368
 epoch: 32, train_loss: 0.8046, test_loss: 1.1136, test_f1: 0.5244
 epoch: 33, train_loss: 0.7873, test_loss: 0.9712, test_f1: 0.6215
 epoch: 34, train_loss: 0.8018, test_loss: 1.1448, test_f1: 0.5605
 epoch: 35, train_loss: 0.8114, test_loss: 1.0207, test_f1: 0.5439
 epoch: 36, train_loss: 0.7920, test_loss: 1.0251, test_f1: 0.5379
 epoch: 37, train_loss: 0.7676, test_loss: 1.0967, test_f1: 0.5062
 epoch: 38, train_loss: 0.7601, test_loss: 0.9559, test_f1: 0.6264
 epoch: 39, train_loss: 0.7496, test_loss: 0.9296, test_f1: 0.6548
 epoch: 40, train_loss: 0.7452, test_loss: 1.1473, test_f1: 0.5660
 epoch: 41, train_loss: 0.7639, test_loss: 0.9677, test_f1: 0.5498
 epoch: 42, train_loss: 0.7368, test_loss: 0.9146, test_f1: 0.6066
 epoch: 43, train_loss: 0.7407, test_loss: 0.9623, test_f1: 0.6023
 epoch: 44, train_loss: 0.7492, test_loss: 0.9347, test_f1: 0.6477
 epoch: 45, train_loss: 0.6977, test_loss: 0.9363, test_f1: 0.6482
 epoch: 46, train_loss: 0.7361, test_loss: 0.9761, test_f1: 0.6152
 epoch: 47, train_loss: 0.7233, test_loss: 0.9739, test_f1: 0.5917
 epoch: 48, train_loss: 0.7440, test_loss: 0.9838, test_f1: 0.5798
 epoch: 49, train_loss: 0.7136, test_loss: 1.0248, test_f1: 0.6034
 epoch: 50, train_loss: 0.7193, test_loss: 1.0134, test_f1: 0.6488
 epoch: 51, train_loss: 0.7077, test_loss: 1.0403, test_f1: 0.6384
 epoch: 52, train_loss: 0.6514, test_loss: 0.9955, test_f1: 0.6533
 epoch: 53, train_loss: 0.6518, test_loss: 1.0801, test_f1: 0.5910
 epoch: 54, train_loss: 0.6414, test_loss: 1.2211, test_f1: 0.5782
 epoch: 55, train_loss: 0.6152, test_loss: 1.1692, test_f1: 0.6173
 epoch: 56, train_loss: 0.6232, test_loss: 1.0627, test_f1: 0.5835
 epoch: 57, train_loss: 0.6131, test_loss: 1.0876, test_f1: 0.6026
 epoch: 58, train_loss: 0.6039, test_loss: 1.1230, test_f1: 0.6231
 epoch: 59, train_loss: 0.5934, test_loss: 1.0573, test_f1: 0.6180
 epoch: 60, train_loss: 0.5913, test_loss: 1.7296, test_f1: 0.5949
 epoch: 61, train_loss: 0.5767, test_loss: 1.4503, test_f1: 0.5690
 epoch: 62, train_loss: 0.5753, test_loss: 1.3043, test_f1: 0.5656
 epoch: 63, train_loss: 0.6012, test_loss: 1.0426, test_f1: 0.6188
 epoch: 64, train_loss: 0.5885, test_loss: 1.0436, test_f1: 0.6238
 epoch: 65, train_loss: 0.5774, test_loss: 1.2679, test_f1: 0.6211
 epoch: 66, train_loss: 0.5910, test_loss: 1.0879, test_f1: 0.6330
 epoch: 67, train_loss: 0.5570, test_loss: 1.7566, test_f1: 0.6113
 epoch: 68, train_loss: 0.5819, test_loss: 1.1047, test_f1: 0.6076
 epoch: 69, train_loss: 0.5557, test_loss: 1.1738, test_f1: 0.6146
 epoch: 70, train_loss: 0.5453, test_loss: 1.0760, test_f1: 0.6341
 epoch: 71, train_loss: 0.5735, test_loss: 1.5619, test_f1: 0.6087
 epoch: 72, train_loss: 0.5250, test_loss: 1.1505, test_f1: 0.6540
 epoch: 73, train_loss: 0.5139, test_loss: 1.2405, test_f1: 0.6011
 epoch: 74, train_loss: 0.5625, test_loss: 1.8649, test_f1: 0.6194
 epoch: 75, train_loss: 0.5414, test_loss: 1.4543, test_f1: 0.6026
 epoch: 76, train_loss: 0.4893, test_loss: 1.4779, test_f1: 0.6157
 epoch: 77, train_loss: 0.4887, test_loss: 1.2917, test_f1: 0.6431
 epoch: 78, train_loss: 0.4977, test_loss: 1.2384, test_f1: 0.6460
 epoch: 79, train_loss: 0.4874, test_loss: 1.3945, test_f1: 0.6320
 epoch: 80, train_loss: 0.5270, test_loss: 1.2558, test_f1: 0.6150
 epoch: 81, train_loss: 0.4975, test_loss: 1.5713, test_f1: 0.6489
 epoch: 82, train_loss: 0.4886, test_loss: 1.1500, test_f1: 0.6179
 epoch: 83, train_loss: 0.4795, test_loss: 1.2746, test_f1: 0.6014
 epoch: 84, train_loss: 0.4882, test_loss: 1.6050, test_f1: 0.6205
 epoch: 85, train_loss: 0.4725, test_loss: 1.1092, test_f1: 0.6011
 epoch: 86, train_loss: 0.5317, test_loss: 1.6492, test_f1: 0.6091
 epoch: 87, train_loss: 0.4683, test_loss: 1.4773, test_f1: 0.5887
 epoch: 88, train_loss: 0.4347, test_loss: 1.9393, test_f1: 0.5963
 epoch: 89, train_loss: 0.4396, test_loss: 1.2809, test_f1: 0.6315
 epoch: 90, train_loss: 0.4096, test_loss: 1.2631, test_f1: 0.6247
 epoch: 91, train_loss: 0.4503, test_loss: 1.2422, test_f1: 0.6343
 epoch: 92, train_loss: 0.4492, test_loss: 1.9969, test_f1: 0.6064
 epoch: 93, train_loss: 0.4538, test_loss: 1.4759, test_f1: 0.6065
 epoch: 94, train_loss: 0.4149, test_loss: 1.3568, test_f1: 0.6129
 epoch: 95, train_loss: 0.4488, test_loss: 1.8370, test_f1: 0.6177
 epoch: 96, train_loss: 0.4286, test_loss: 2.1940, test_f1: 0.6009
 epoch: 97, train_loss: 0.4482, test_loss: 1.7336, test_f1: 0.5845
 epoch: 98, train_loss: 0.4253, test_loss: 2.2439, test_f1: 0.6099
 epoch: 99, train_loss: 0.4185, test_loss: 2.1244, test_f1: 0.6142
##################ITERATION #3 ****************************************
 epoch: 0, train_loss: 1.0783, test_loss: 1.1488, test_f1: 0.3861
 epoch: 1, train_loss: 0.9135, test_loss: 1.0410, test_f1: 0.5512
 epoch: 2, train_loss: 0.8782, test_loss: 1.1465, test_f1: 0.4752
 epoch: 3, train_loss: 0.8399, test_loss: 1.0618, test_f1: 0.4598
 epoch: 4, train_loss: 0.8457, test_loss: 1.0466, test_f1: 0.5078
 epoch: 5, train_loss: 0.8334, test_loss: 1.0229, test_f1: 0.5408
 epoch: 6, train_loss: 0.8099, test_loss: 1.1073, test_f1: 0.4797
 epoch: 7, train_loss: 0.7944, test_loss: 1.1266, test_f1: 0.5122
 epoch: 8, train_loss: 0.8274, test_loss: 1.4046, test_f1: 0.4925
 epoch: 9, train_loss: 0.8191, test_loss: 1.0333, test_f1: 0.4965
 epoch: 10, train_loss: 0.7839, test_loss: 1.0117, test_f1: 0.5479
 epoch: 11, train_loss: 0.7459, test_loss: 1.1109, test_f1: 0.6034
 epoch: 12, train_loss: 0.7759, test_loss: 1.2730, test_f1: 0.4226
 epoch: 13, train_loss: 0.7450, test_loss: 2.0408, test_f1: 0.4970
 epoch: 14, train_loss: 0.7439, test_loss: 0.9921, test_f1: 0.5282
 epoch: 15, train_loss: 0.7283, test_loss: 1.1694, test_f1: 0.5464
 epoch: 16, train_loss: 0.7553, test_loss: 1.6201, test_f1: 0.5512
 epoch: 17, train_loss: 0.7009, test_loss: 1.1068, test_f1: 0.5290
 epoch: 18, train_loss: 0.6886, test_loss: 1.2244, test_f1: 0.5663
 epoch: 19, train_loss: 0.7101, test_loss: 1.0745, test_f1: 0.5356
 epoch: 20, train_loss: 0.7344, test_loss: 1.1210, test_f1: 0.5522
 epoch: 21, train_loss: 0.7136, test_loss: 1.0099, test_f1: 0.5636
 epoch: 22, train_loss: 0.6735, test_loss: 0.9809, test_f1: 0.6559
 epoch: 23, train_loss: 0.6911, test_loss: 1.4591, test_f1: 0.5586
 epoch: 24, train_loss: 0.6824, test_loss: 1.0537, test_f1: 0.5687
 epoch: 25, train_loss: 0.6518, test_loss: 1.0349, test_f1: 0.6038
 epoch: 26, train_loss: 0.6642, test_loss: 1.2277, test_f1: 0.5797
 epoch: 27, train_loss: 0.6158, test_loss: 1.0973, test_f1: 0.6431
 epoch: 28, train_loss: 0.6070, test_loss: 1.0569, test_f1: 0.6283
 epoch: 29, train_loss: 0.6610, test_loss: 1.3444, test_f1: 0.6040
 epoch: 30, train_loss: 0.6482, test_loss: 2.2288, test_f1: 0.3775
 epoch: 31, train_loss: 0.6600, test_loss: 1.1547, test_f1: 0.5534
 epoch: 32, train_loss: 0.6372, test_loss: 1.1438, test_f1: 0.6223
 epoch: 33, train_loss: 0.6508, test_loss: 1.3476, test_f1: 0.5682
 epoch: 34, train_loss: 0.6130, test_loss: 1.6133, test_f1: 0.5773
 epoch: 35, train_loss: 0.6041, test_loss: 1.3808, test_f1: 0.5206
 epoch: 36, train_loss: 0.6176, test_loss: 1.2167, test_f1: 0.5153
 epoch: 37, train_loss: 0.5922, test_loss: 1.5492, test_f1: 0.5601
 epoch: 38, train_loss: 0.6139, test_loss: 1.3613, test_f1: 0.5969
 epoch: 39, train_loss: 0.5796, test_loss: 1.6303, test_f1: 0.5249
 epoch: 40, train_loss: 0.5936, test_loss: 1.6038, test_f1: 0.5573
 epoch: 41, train_loss: 0.6355, test_loss: 1.3743, test_f1: 0.6473
 epoch: 42, train_loss: 0.5368, test_loss: 1.5017, test_f1: 0.5499
 epoch: 43, train_loss: 0.5763, test_loss: 1.0614, test_f1: 0.6241
 epoch: 44, train_loss: 0.5427, test_loss: 1.3403, test_f1: 0.6290
 epoch: 45, train_loss: 0.5658, test_loss: 1.1818, test_f1: 0.5979
 epoch: 46, train_loss: 0.5052, test_loss: 1.7857, test_f1: 0.4531
 epoch: 47, train_loss: 0.5623, test_loss: 1.4212, test_f1: 0.6099
 epoch: 48, train_loss: 0.5403, test_loss: 1.3164, test_f1: 0.6108
 epoch: 49, train_loss: 0.5446, test_loss: 1.3790, test_f1: 0.5447
 epoch: 50, train_loss: 0.5706, test_loss: 1.2109, test_f1: 0.6569
 epoch: 51, train_loss: 0.4735, test_loss: 1.4214, test_f1: 0.6207
 epoch: 52, train_loss: 0.4692, test_loss: 1.2220, test_f1: 0.6403
 epoch: 53, train_loss: 0.4516, test_loss: 1.2716, test_f1: 0.6376
 epoch: 54, train_loss: 0.4223, test_loss: 1.3357, test_f1: 0.6080
 epoch: 55, train_loss: 0.4243, test_loss: 1.5066, test_f1: 0.6239
 epoch: 56, train_loss: 0.4334, test_loss: 1.4830, test_f1: 0.6052
 epoch: 57, train_loss: 0.4278, test_loss: 1.2729, test_f1: 0.6190
 epoch: 58, train_loss: 0.3861, test_loss: 1.7299, test_f1: 0.6296
 epoch: 59, train_loss: 0.4145, test_loss: 1.4329, test_f1: 0.6496
 epoch: 60, train_loss: 0.3855, test_loss: 1.3559, test_f1: 0.6637
 epoch: 61, train_loss: 0.4207, test_loss: 1.4741, test_f1: 0.6151
 epoch: 62, train_loss: 0.3901, test_loss: 1.4773, test_f1: 0.6285
 epoch: 63, train_loss: 0.3474, test_loss: 1.8275, test_f1: 0.6058
 epoch: 64, train_loss: 0.3820, test_loss: 1.3402, test_f1: 0.6333
 epoch: 65, train_loss: 0.3961, test_loss: 1.5707, test_f1: 0.5805
 epoch: 66, train_loss: 0.3902, test_loss: 1.3299, test_f1: 0.6397
 epoch: 67, train_loss: 0.3686, test_loss: 1.6250, test_f1: 0.6190
 epoch: 68, train_loss: 0.3639, test_loss: 1.4600, test_f1: 0.6156
 epoch: 69, train_loss: 0.3808, test_loss: 1.6066, test_f1: 0.6115
 epoch: 70, train_loss: 0.3747, test_loss: 1.5412, test_f1: 0.6074
 epoch: 71, train_loss: 0.3482, test_loss: 1.5367, test_f1: 0.6393
 epoch: 72, train_loss: 0.3064, test_loss: 1.5904, test_f1: 0.6388
 epoch: 73, train_loss: 0.3421, test_loss: 1.7208, test_f1: 0.6260
 epoch: 74, train_loss: 0.3003, test_loss: 1.7237, test_f1: 0.6126
 epoch: 75, train_loss: 0.3565, test_loss: 1.4993, test_f1: 0.6083
 epoch: 76, train_loss: 0.3955, test_loss: 1.8568, test_f1: 0.6187
 epoch: 77, train_loss: 0.3210, test_loss: 1.6701, test_f1: 0.6087
 epoch: 78, train_loss: 0.3660, test_loss: 1.8078, test_f1: 0.5908
 epoch: 79, train_loss: 0.3591, test_loss: 2.0102, test_f1: 0.5742
 epoch: 80, train_loss: 0.3734, test_loss: 1.9202, test_f1: 0.6116
 epoch: 81, train_loss: 0.3122, test_loss: 1.6119, test_f1: 0.6055
 epoch: 82, train_loss: 0.2781, test_loss: 1.8526, test_f1: 0.5986
 epoch: 83, train_loss: 0.3204, test_loss: 1.9269, test_f1: 0.5978
 epoch: 84, train_loss: 0.3149, test_loss: 1.9247, test_f1: 0.5770
 epoch: 85, train_loss: 0.2939, test_loss: 1.8832, test_f1: 0.5950
 epoch: 86, train_loss: 0.3135, test_loss: 1.5765, test_f1: 0.6052
 epoch: 87, train_loss: 0.3106, test_loss: 1.9877, test_f1: 0.6063
 epoch: 88, train_loss: 0.3119, test_loss: 2.1361, test_f1: 0.6295
 epoch: 89, train_loss: 0.3115, test_loss: 2.2850, test_f1: 0.5868
 epoch: 90, train_loss: 0.3345, test_loss: 1.7272, test_f1: 0.6212
 epoch: 91, train_loss: 0.2923, test_loss: 1.9896, test_f1: 0.6042
 epoch: 92, train_loss: 0.3084, test_loss: 2.1559, test_f1: 0.6156
 epoch: 93, train_loss: 0.3039, test_loss: 1.8228, test_f1: 0.6022
 epoch: 94, train_loss: 0.2850, test_loss: 2.0642, test_f1: 0.6393
 epoch: 95, train_loss: 0.2972, test_loss: 1.7930, test_f1: 0.6146
 epoch: 96, train_loss: 0.2930, test_loss: 1.6840, test_f1: 0.6532
 epoch: 97, train_loss: 0.3389, test_loss: 2.2309, test_f1: 0.5908
 epoch: 98, train_loss: 0.3351, test_loss: 1.9773, test_f1: 0.5755
 epoch: 99, train_loss: 0.3169, test_loss: 1.8569, test_f1: 0.6198
##################ITERATION #4 ****************************************
 epoch: 0, train_loss: 1.1427, test_loss: 1.2738, test_f1: 0.3427
 epoch: 1, train_loss: 0.9532, test_loss: 1.1427, test_f1: 0.3773
 epoch: 2, train_loss: 0.9008, test_loss: 1.0332, test_f1: 0.5174
 epoch: 3, train_loss: 0.8791, test_loss: 1.0433, test_f1: 0.4762
 epoch: 4, train_loss: 0.8646, test_loss: 1.1666, test_f1: 0.3793
 epoch: 5, train_loss: 0.8575, test_loss: 1.1336, test_f1: 0.5038
 epoch: 6, train_loss: 0.8530, test_loss: 1.0209, test_f1: 0.5683
 epoch: 7, train_loss: 0.8388, test_loss: 1.2023, test_f1: 0.4554
 epoch: 8, train_loss: 0.8339, test_loss: 1.6747, test_f1: 0.4800
 epoch: 9, train_loss: 0.7997, test_loss: 1.0337, test_f1: 0.5836
 epoch: 10, train_loss: 0.7979, test_loss: 1.0611, test_f1: 0.5535
 epoch: 11, train_loss: 0.8168, test_loss: 1.0647, test_f1: 0.5685
 epoch: 12, train_loss: 0.7723, test_loss: 1.1255, test_f1: 0.5242
 epoch: 13, train_loss: 0.7880, test_loss: 1.3304, test_f1: 0.5517
 epoch: 14, train_loss: 0.7560, test_loss: 2.3866, test_f1: 0.3380
 epoch: 15, train_loss: 0.8200, test_loss: 1.0508, test_f1: 0.5735
 epoch: 16, train_loss: 0.7691, test_loss: 1.2460, test_f1: 0.5194
 epoch: 17, train_loss: 0.7492, test_loss: 1.0863, test_f1: 0.5459
 epoch: 18, train_loss: 0.7681, test_loss: 1.0630, test_f1: 0.5810
 epoch: 19, train_loss: 0.7550, test_loss: 1.4791, test_f1: 0.4809
 epoch: 20, train_loss: 0.7436, test_loss: 1.1187, test_f1: 0.5044
 epoch: 21, train_loss: 0.7165, test_loss: 1.0689, test_f1: 0.5751
 epoch: 22, train_loss: 0.7222, test_loss: 1.0717, test_f1: 0.5451
 epoch: 23, train_loss: 0.7244, test_loss: 1.0592, test_f1: 0.6327
 epoch: 24, train_loss: 0.6828, test_loss: 1.5380, test_f1: 0.6046
 epoch: 25, train_loss: 0.6920, test_loss: 1.1222, test_f1: 0.5260
 epoch: 26, train_loss: 0.6851, test_loss: 1.3725, test_f1: 0.4788
 epoch: 27, train_loss: 0.7084, test_loss: 1.2291, test_f1: 0.4131
 epoch: 28, train_loss: 0.7177, test_loss: 1.1812, test_f1: 0.5771
 epoch: 29, train_loss: 0.7172, test_loss: 1.1261, test_f1: 0.5378
 epoch: 30, train_loss: 0.6579, test_loss: 1.9829, test_f1: 0.4950
 epoch: 31, train_loss: 0.6316, test_loss: 1.1732, test_f1: 0.5912
 epoch: 32, train_loss: 0.6568, test_loss: 1.4257, test_f1: 0.5881
 epoch: 33, train_loss: 0.6313, test_loss: 1.4355, test_f1: 0.5999
 epoch: 34, train_loss: 0.6444, test_loss: 1.1639, test_f1: 0.5272
 epoch: 35, train_loss: 0.6298, test_loss: 1.3302, test_f1: 0.5025
 epoch: 36, train_loss: 0.6407, test_loss: 1.5355, test_f1: 0.5454
 epoch: 37, train_loss: 0.6266, test_loss: 1.2480, test_f1: 0.4859
 epoch: 38, train_loss: 0.6977, test_loss: 1.1251, test_f1: 0.5558
 epoch: 39, train_loss: 0.6732, test_loss: 2.4313, test_f1: 0.4988
 epoch: 40, train_loss: 0.6218, test_loss: 1.3069, test_f1: 0.5858
 epoch: 41, train_loss: 0.6421, test_loss: 1.5571, test_f1: 0.5989
 epoch: 42, train_loss: 0.6144, test_loss: 1.3078, test_f1: 0.5000
 epoch: 43, train_loss: 0.5871, test_loss: 1.3842, test_f1: 0.6230
 epoch: 44, train_loss: 0.5641, test_loss: 1.8793, test_f1: 0.5378
 epoch: 45, train_loss: 0.5967, test_loss: 1.7848, test_f1: 0.5747
 epoch: 46, train_loss: 0.6319, test_loss: 1.2655, test_f1: 0.5595
 epoch: 47, train_loss: 0.6000, test_loss: 1.3064, test_f1: 0.5289
 epoch: 48, train_loss: 0.6011, test_loss: 1.3966, test_f1: 0.6083
 epoch: 49, train_loss: 0.5409, test_loss: 1.3219, test_f1: 0.6289
 epoch: 50, train_loss: 0.5619, test_loss: 1.4611, test_f1: 0.4769
 epoch: 51, train_loss: 0.5227, test_loss: 1.3442, test_f1: 0.5905
 epoch: 52, train_loss: 0.4732, test_loss: 1.6345, test_f1: 0.5565
 epoch: 53, train_loss: 0.4730, test_loss: 1.5915, test_f1: 0.5831
 epoch: 54, train_loss: 0.4742, test_loss: 1.9846, test_f1: 0.5849
 epoch: 55, train_loss: 0.4694, test_loss: 1.5240, test_f1: 0.6501
 epoch: 56, train_loss: 0.4352, test_loss: 1.6083, test_f1: 0.6349
 epoch: 57, train_loss: 0.4451, test_loss: 1.5347, test_f1: 0.5875
 epoch: 58, train_loss: 0.4538, test_loss: 1.4373, test_f1: 0.6389
 epoch: 59, train_loss: 0.4657, test_loss: 1.6592, test_f1: 0.6316
 epoch: 60, train_loss: 0.4275, test_loss: 1.8013, test_f1: 0.6615
 epoch: 61, train_loss: 0.4259, test_loss: 1.6268, test_f1: 0.6112
 epoch: 62, train_loss: 0.4454, test_loss: 1.6688, test_f1: 0.6430
 epoch: 63, train_loss: 0.4092, test_loss: 1.3327, test_f1: 0.6237
 epoch: 64, train_loss: 0.4574, test_loss: 1.5580, test_f1: 0.6461
 epoch: 65, train_loss: 0.4545, test_loss: 1.3127, test_f1: 0.6343
 epoch: 66, train_loss: 0.4116, test_loss: 1.5661, test_f1: 0.5819
 epoch: 67, train_loss: 0.3873, test_loss: 1.5082, test_f1: 0.6139
 epoch: 68, train_loss: 0.3874, test_loss: 1.6902, test_f1: 0.6073
 epoch: 69, train_loss: 0.3900, test_loss: 1.4200, test_f1: 0.6436
 epoch: 70, train_loss: 0.4026, test_loss: 1.8500, test_f1: 0.5812
 epoch: 71, train_loss: 0.3869, test_loss: 1.7860, test_f1: 0.6700
 epoch: 72, train_loss: 0.4043, test_loss: 1.5500, test_f1: 0.6380
 epoch: 73, train_loss: 0.3792, test_loss: 1.4105, test_f1: 0.6273
 epoch: 74, train_loss: 0.3483, test_loss: 1.5341, test_f1: 0.6149
 epoch: 75, train_loss: 0.3676, test_loss: 1.8597, test_f1: 0.6317
 epoch: 76, train_loss: 0.3624, test_loss: 1.7072, test_f1: 0.6033
 epoch: 77, train_loss: 0.3754, test_loss: 1.3117, test_f1: 0.6575
 epoch: 78, train_loss: 0.3704, test_loss: 1.6966, test_f1: 0.6161
 epoch: 79, train_loss: 0.3014, test_loss: 1.9433, test_f1: 0.6358
 epoch: 80, train_loss: 0.3415, test_loss: 1.9507, test_f1: 0.5680
 epoch: 81, train_loss: 0.3775, test_loss: 1.8019, test_f1: 0.6710
 epoch: 82, train_loss: 0.3366, test_loss: 2.1421, test_f1: 0.6322
 epoch: 83, train_loss: 0.3271, test_loss: 1.8322, test_f1: 0.6102
 epoch: 84, train_loss: 0.3243, test_loss: 1.7022, test_f1: 0.6488
 epoch: 85, train_loss: 0.3362, test_loss: 1.7604, test_f1: 0.5959
 epoch: 86, train_loss: 0.3407, test_loss: 1.7540, test_f1: 0.6024
 epoch: 87, train_loss: 0.3678, test_loss: 1.5683, test_f1: 0.6311
 epoch: 88, train_loss: 0.3450, test_loss: 1.9056, test_f1: 0.6056
 epoch: 89, train_loss: 0.3164, test_loss: 1.7808, test_f1: 0.5824
 epoch: 90, train_loss: 0.3407, test_loss: 2.2023, test_f1: 0.5799
 epoch: 91, train_loss: 0.3108, test_loss: 1.7402, test_f1: 0.6445
 epoch: 92, train_loss: 0.3479, test_loss: 1.5369, test_f1: 0.6551
 epoch: 93, train_loss: 0.3195, test_loss: 1.9908, test_f1: 0.5838
 epoch: 94, train_loss: 0.3194, test_loss: 1.6684, test_f1: 0.6156
 epoch: 95, train_loss: 0.3283, test_loss: 1.4715, test_f1: 0.6464
 epoch: 96, train_loss: 0.3322, test_loss: 1.7032, test_f1: 0.5930
 epoch: 97, train_loss: 0.3196, test_loss: 1.9304, test_f1: 0.6015
 epoch: 98, train_loss: 0.3338, test_loss: 2.1615, test_f1: 0.6607
 epoch: 99, train_loss: 0.3118, test_loss: 1.8772, test_f1: 0.6218
##################ITERATION #5 ****************************************
 epoch: 0, train_loss: 1.1340, test_loss: 1.3137, test_f1: 0.3319
 epoch: 1, train_loss: 0.9984, test_loss: 1.1327, test_f1: 0.5076
 epoch: 2, train_loss: 0.9161, test_loss: 1.0674, test_f1: 0.4476
 epoch: 3, train_loss: 0.8821, test_loss: 1.0948, test_f1: 0.4670
 epoch: 4, train_loss: 0.8635, test_loss: 1.0588, test_f1: 0.4999
 epoch: 5, train_loss: 0.8632, test_loss: 1.0072, test_f1: 0.5183
 epoch: 6, train_loss: 0.8543, test_loss: 1.0471, test_f1: 0.5225
 epoch: 7, train_loss: 0.8478, test_loss: 1.1574, test_f1: 0.4840
 epoch: 8, train_loss: 0.7967, test_loss: 1.0858, test_f1: 0.5352
 epoch: 9, train_loss: 0.7995, test_loss: 1.0779, test_f1: 0.5200
 epoch: 10, train_loss: 0.8161, test_loss: 1.2415, test_f1: 0.5092
 epoch: 11, train_loss: 0.7801, test_loss: 1.5051, test_f1: 0.5107
 epoch: 12, train_loss: 0.7805, test_loss: 1.3126, test_f1: 0.4759
 epoch: 13, train_loss: 0.7803, test_loss: 1.0811, test_f1: 0.5111
 epoch: 14, train_loss: 0.7504, test_loss: 1.3164, test_f1: 0.5327
 epoch: 15, train_loss: 0.7380, test_loss: 1.2108, test_f1: 0.5218
 epoch: 16, train_loss: 0.7431, test_loss: 1.0959, test_f1: 0.4854
 epoch: 17, train_loss: 0.7492, test_loss: 1.1113, test_f1: 0.4796
 epoch: 18, train_loss: 0.7303, test_loss: 1.2124, test_f1: 0.5375
 epoch: 19, train_loss: 0.7386, test_loss: 1.2582, test_f1: 0.5123
 epoch: 20, train_loss: 0.7341, test_loss: 1.2096, test_f1: 0.4530
 epoch: 21, train_loss: 0.7157, test_loss: 1.2211, test_f1: 0.5643
 epoch: 22, train_loss: 0.7083, test_loss: 1.0282, test_f1: 0.5693
 epoch: 23, train_loss: 0.7180, test_loss: 1.3891, test_f1: 0.5198
 epoch: 24, train_loss: 0.7211, test_loss: 1.0100, test_f1: 0.5440
 epoch: 25, train_loss: 0.7063, test_loss: 1.2919, test_f1: 0.5418
 epoch: 26, train_loss: 0.6982, test_loss: 1.4914, test_f1: 0.4957
 epoch: 27, train_loss: 0.6963, test_loss: 1.3379, test_f1: 0.5621
 epoch: 28, train_loss: 0.7020, test_loss: 1.5124, test_f1: 0.5497
 epoch: 29, train_loss: 0.6691, test_loss: 1.2540, test_f1: 0.5562
 epoch: 30, train_loss: 0.6755, test_loss: 1.1402, test_f1: 0.5538
 epoch: 31, train_loss: 0.6440, test_loss: 1.8198, test_f1: 0.5592
 epoch: 32, train_loss: 0.6627, test_loss: 1.6799, test_f1: 0.5216
 epoch: 33, train_loss: 0.6548, test_loss: 1.2876, test_f1: 0.5816
 epoch: 34, train_loss: 0.6513, test_loss: 1.1637, test_f1: 0.6424
 epoch: 35, train_loss: 0.6327, test_loss: 1.4483, test_f1: 0.5210
 epoch: 36, train_loss: 0.6406, test_loss: 2.0947, test_f1: 0.4660
 epoch: 37, train_loss: 0.6335, test_loss: 1.6795, test_f1: 0.4744
 epoch: 38, train_loss: 0.6350, test_loss: 1.2782, test_f1: 0.5233
 epoch: 39, train_loss: 0.6247, test_loss: 1.2276, test_f1: 0.5695
 epoch: 40, train_loss: 0.6208, test_loss: 1.2329, test_f1: 0.5630
 epoch: 41, train_loss: 0.6611, test_loss: 1.5990, test_f1: 0.5105
 epoch: 42, train_loss: 0.6051, test_loss: 1.4242, test_f1: 0.5456
 epoch: 43, train_loss: 0.6005, test_loss: 1.3297, test_f1: 0.6130
 epoch: 44, train_loss: 0.5671, test_loss: 1.2139, test_f1: 0.6402
 epoch: 45, train_loss: 0.5923, test_loss: 1.7839, test_f1: 0.4334
 epoch: 46, train_loss: 0.6063, test_loss: 1.1169, test_f1: 0.6258
 epoch: 47, train_loss: 0.5737, test_loss: 1.5194, test_f1: 0.6041
 epoch: 48, train_loss: 0.5977, test_loss: 1.1583, test_f1: 0.5721
 epoch: 49, train_loss: 0.5605, test_loss: 1.2536, test_f1: 0.6131
 epoch: 50, train_loss: 0.6126, test_loss: 1.1057, test_f1: 0.5749
 epoch: 51, train_loss: 0.5324, test_loss: 1.1059, test_f1: 0.6095
 epoch: 52, train_loss: 0.4926, test_loss: 1.5947, test_f1: 0.5857
 epoch: 53, train_loss: 0.4758, test_loss: 1.2674, test_f1: 0.5909
 epoch: 54, train_loss: 0.4831, test_loss: 1.5939, test_f1: 0.5310
 epoch: 55, train_loss: 0.4914, test_loss: 1.4460, test_f1: 0.6251
 epoch: 56, train_loss: 0.4624, test_loss: 1.6785, test_f1: 0.5530
 epoch: 57, train_loss: 0.4615, test_loss: 1.5477, test_f1: 0.5969
 epoch: 58, train_loss: 0.4658, test_loss: 1.6407, test_f1: 0.5660
 epoch: 59, train_loss: 0.4366, test_loss: 1.3310, test_f1: 0.5928
 epoch: 60, train_loss: 0.4194, test_loss: 1.6414, test_f1: 0.5792
 epoch: 61, train_loss: 0.4379, test_loss: 1.4225, test_f1: 0.5991
 epoch: 62, train_loss: 0.4434, test_loss: 1.5961, test_f1: 0.6216
 epoch: 63, train_loss: 0.4738, test_loss: 1.5685, test_f1: 0.6107
 epoch: 64, train_loss: 0.4424, test_loss: 1.4315, test_f1: 0.6148
 epoch: 65, train_loss: 0.4179, test_loss: 1.5714, test_f1: 0.6098
 epoch: 66, train_loss: 0.4338, test_loss: 1.6638, test_f1: 0.5795
 epoch: 67, train_loss: 0.3929, test_loss: 1.4457, test_f1: 0.5786
 epoch: 68, train_loss: 0.4285, test_loss: 1.7244, test_f1: 0.5681
 epoch: 69, train_loss: 0.3974, test_loss: 1.3987, test_f1: 0.6377
 epoch: 70, train_loss: 0.4264, test_loss: 1.5186, test_f1: 0.5620
 epoch: 71, train_loss: 0.4126, test_loss: 1.6803, test_f1: 0.6044
 epoch: 72, train_loss: 0.3940, test_loss: 1.6645, test_f1: 0.5531
 epoch: 73, train_loss: 0.3936, test_loss: 1.8598, test_f1: 0.5745
 epoch: 74, train_loss: 0.3715, test_loss: 1.7192, test_f1: 0.6130
 epoch: 75, train_loss: 0.3831, test_loss: 1.8001, test_f1: 0.6105
 epoch: 76, train_loss: 0.3929, test_loss: 1.5683, test_f1: 0.6318
 epoch: 77, train_loss: 0.3866, test_loss: 1.8591, test_f1: 0.6125
 epoch: 78, train_loss: 0.3949, test_loss: 1.7675, test_f1: 0.6288
 epoch: 79, train_loss: 0.3926, test_loss: 1.4252, test_f1: 0.6480
 epoch: 80, train_loss: 0.3962, test_loss: 1.7097, test_f1: 0.5456
 epoch: 81, train_loss: 0.3786, test_loss: 1.5485, test_f1: 0.6308
 epoch: 82, train_loss: 0.3598, test_loss: 1.6351, test_f1: 0.6026
 epoch: 83, train_loss: 0.3343, test_loss: 1.7064, test_f1: 0.5764
 epoch: 84, train_loss: 0.3858, test_loss: 1.4140, test_f1: 0.6307
 epoch: 85, train_loss: 0.3461, test_loss: 1.7690, test_f1: 0.5628
 epoch: 86, train_loss: 0.3560, test_loss: 1.8077, test_f1: 0.5706
 epoch: 87, train_loss: 0.3772, test_loss: 1.7733, test_f1: 0.6380
 epoch: 88, train_loss: 0.3397, test_loss: 1.7977, test_f1: 0.5922
 epoch: 89, train_loss: 0.3342, test_loss: 1.7402, test_f1: 0.6096
 epoch: 90, train_loss: 0.3674, test_loss: 1.9556, test_f1: 0.5911
 epoch: 91, train_loss: 0.3388, test_loss: 2.0727, test_f1: 0.5363
 epoch: 92, train_loss: 0.3704, test_loss: 1.7411, test_f1: 0.6527
 epoch: 93, train_loss: 0.3458, test_loss: 1.8441, test_f1: 0.5779
 epoch: 94, train_loss: 0.3833, test_loss: 1.5335, test_f1: 0.6322
 epoch: 95, train_loss: 0.3724, test_loss: 1.5319, test_f1: 0.6188
 epoch: 96, train_loss: 0.3555, test_loss: 2.0442, test_f1: 0.5970
 epoch: 97, train_loss: 0.3145, test_loss: 1.9533, test_f1: 0.5789
 epoch: 98, train_loss: 0.3148, test_loss: 1.7428, test_f1: 0.6158
 epoch: 99, train_loss: 0.3206, test_loss: 2.0131, test_f1: 0.5859
##################ITERATION #6 ****************************************
 epoch: 0, train_loss: 1.1045, test_loss: 1.3437, test_f1: 0.4144
 epoch: 1, train_loss: 0.8990, test_loss: 0.9921, test_f1: 0.5266
 epoch: 2, train_loss: 0.8471, test_loss: 1.0003, test_f1: 0.5516
 epoch: 3, train_loss: 0.8620, test_loss: 0.9836, test_f1: 0.5414
 epoch: 4, train_loss: 0.8489, test_loss: 0.9527, test_f1: 0.5915
 epoch: 5, train_loss: 0.8363, test_loss: 1.0319, test_f1: 0.4916
 epoch: 6, train_loss: 0.8208, test_loss: 0.9516, test_f1: 0.6130
 epoch: 7, train_loss: 0.8019, test_loss: 1.0693, test_f1: 0.5149
 epoch: 8, train_loss: 0.8038, test_loss: 1.0385, test_f1: 0.4355
 epoch: 9, train_loss: 0.7825, test_loss: 1.0528, test_f1: 0.5559
 epoch: 10, train_loss: 0.7929, test_loss: 0.9553, test_f1: 0.6183
 epoch: 11, train_loss: 0.7749, test_loss: 1.5138, test_f1: 0.3909
 epoch: 12, train_loss: 0.7827, test_loss: 1.6329, test_f1: 0.3591
 epoch: 13, train_loss: 0.7569, test_loss: 1.1198, test_f1: 0.4806
 epoch: 14, train_loss: 0.7494, test_loss: 1.0107, test_f1: 0.5599
 epoch: 15, train_loss: 0.7409, test_loss: 1.1717, test_f1: 0.5511
 epoch: 16, train_loss: 0.7253, test_loss: 1.0638, test_f1: 0.6332
 epoch: 17, train_loss: 0.7007, test_loss: 1.1600, test_f1: 0.5443
 epoch: 18, train_loss: 0.7097, test_loss: 1.2405, test_f1: 0.5156
 epoch: 19, train_loss: 0.7141, test_loss: 1.2326, test_f1: 0.4773
 epoch: 20, train_loss: 0.6767, test_loss: 0.9990, test_f1: 0.6017
 epoch: 21, train_loss: 0.6827, test_loss: 1.0613, test_f1: 0.5372
 epoch: 22, train_loss: 0.6911, test_loss: 1.0378, test_f1: 0.6231
 epoch: 23, train_loss: 0.6693, test_loss: 1.1320, test_f1: 0.5331
 epoch: 24, train_loss: 0.6666, test_loss: 1.0475, test_f1: 0.6076
 epoch: 25, train_loss: 0.6693, test_loss: 1.1861, test_f1: 0.5811
 epoch: 26, train_loss: 0.6596, test_loss: 1.4024, test_f1: 0.4996
 epoch: 27, train_loss: 0.6476, test_loss: 1.1745, test_f1: 0.6256
 epoch: 28, train_loss: 0.6568, test_loss: 1.8098, test_f1: 0.4412
 epoch: 29, train_loss: 0.6289, test_loss: 1.2310, test_f1: 0.5623
 epoch: 30, train_loss: 0.6075, test_loss: 1.0752, test_f1: 0.5636
 epoch: 31, train_loss: 0.6089, test_loss: 1.4000, test_f1: 0.5354
 epoch: 32, train_loss: 0.6234, test_loss: 1.4214, test_f1: 0.5739
 epoch: 33, train_loss: 0.5848, test_loss: 1.1021, test_f1: 0.6005
 epoch: 34, train_loss: 0.5535, test_loss: 1.1250, test_f1: 0.6377
 epoch: 35, train_loss: 0.6420, test_loss: 1.0814, test_f1: 0.6477
 epoch: 36, train_loss: 0.6062, test_loss: 1.4577, test_f1: 0.4926
 epoch: 37, train_loss: 0.5798, test_loss: 1.0861, test_f1: 0.6806
 epoch: 38, train_loss: 0.5700, test_loss: 1.0830, test_f1: 0.5783
 epoch: 39, train_loss: 0.5622, test_loss: 1.2565, test_f1: 0.6263
 epoch: 40, train_loss: 0.5811, test_loss: 1.0720, test_f1: 0.6091
 epoch: 41, train_loss: 0.5663, test_loss: 1.2119, test_f1: 0.6619
 epoch: 42, train_loss: 0.5113, test_loss: 1.2849, test_f1: 0.5957
 epoch: 43, train_loss: 0.5277, test_loss: 1.7224, test_f1: 0.5625
 epoch: 44, train_loss: 0.5364, test_loss: 1.1598, test_f1: 0.6278
 epoch: 45, train_loss: 0.5408, test_loss: 1.2386, test_f1: 0.6595
 epoch: 46, train_loss: 0.5660, test_loss: 1.3372, test_f1: 0.5963
 epoch: 47, train_loss: 0.5240, test_loss: 1.1884, test_f1: 0.6383
 epoch: 48, train_loss: 0.5198, test_loss: 1.4336, test_f1: 0.5711
 epoch: 49, train_loss: 0.5054, test_loss: 1.3953, test_f1: 0.5816
 epoch: 50, train_loss: 0.5015, test_loss: 1.2802, test_f1: 0.6028
 epoch: 51, train_loss: 0.4447, test_loss: 1.8072, test_f1: 0.5951
 epoch: 52, train_loss: 0.4063, test_loss: 1.5577, test_f1: 0.5842
 epoch: 53, train_loss: 0.4035, test_loss: 1.6396, test_f1: 0.6055
 epoch: 54, train_loss: 0.4137, test_loss: 1.5579, test_f1: 0.5926
 epoch: 55, train_loss: 0.4199, test_loss: 1.3253, test_f1: 0.6479
 epoch: 56, train_loss: 0.3897, test_loss: 1.3953, test_f1: 0.6105
 epoch: 57, train_loss: 0.3896, test_loss: 1.3406, test_f1: 0.6274
 epoch: 58, train_loss: 0.4063, test_loss: 1.4723, test_f1: 0.5983
 epoch: 59, train_loss: 0.3649, test_loss: 1.4957, test_f1: 0.5867
 epoch: 60, train_loss: 0.3500, test_loss: 1.2989, test_f1: 0.6612
 epoch: 61, train_loss: 0.3399, test_loss: 1.2856, test_f1: 0.6472
 epoch: 62, train_loss: 0.3724, test_loss: 1.4872, test_f1: 0.6227
 epoch: 63, train_loss: 0.3535, test_loss: 1.3778, test_f1: 0.6461
 epoch: 64, train_loss: 0.3922, test_loss: 1.3224, test_f1: 0.6196
 epoch: 65, train_loss: 0.3632, test_loss: 1.7886, test_f1: 0.5967
 epoch: 66, train_loss: 0.3492, test_loss: 1.4312, test_f1: 0.6264
 epoch: 67, train_loss: 0.3195, test_loss: 1.3960, test_f1: 0.6516
 epoch: 68, train_loss: 0.3609, test_loss: 1.3955, test_f1: 0.6190
 epoch: 69, train_loss: 0.3091, test_loss: 1.6839, test_f1: 0.6152
 epoch: 70, train_loss: 0.3261, test_loss: 1.5183, test_f1: 0.5930
 epoch: 71, train_loss: 0.3149, test_loss: 1.4313, test_f1: 0.6340
 epoch: 72, train_loss: 0.3576, test_loss: 1.6945, test_f1: 0.5906
 epoch: 73, train_loss: 0.3682, test_loss: 1.5470, test_f1: 0.6249
 epoch: 74, train_loss: 0.3297, test_loss: 1.4484, test_f1: 0.6307
 epoch: 75, train_loss: 0.2817, test_loss: 1.7180, test_f1: 0.6150
 epoch: 76, train_loss: 0.2943, test_loss: 1.6930, test_f1: 0.6644
 epoch: 77, train_loss: 0.3460, test_loss: 1.5504, test_f1: 0.6420
 epoch: 78, train_loss: 0.3435, test_loss: 1.6564, test_f1: 0.6256
 epoch: 79, train_loss: 0.3307, test_loss: 1.3474, test_f1: 0.6306
 epoch: 80, train_loss: 0.3215, test_loss: 1.3816, test_f1: 0.6586
 epoch: 81, train_loss: 0.3121, test_loss: 1.4941, test_f1: 0.6279
 epoch: 82, train_loss: 0.2824, test_loss: 1.6512, test_f1: 0.6235
 epoch: 83, train_loss: 0.3084, test_loss: 1.6995, test_f1: 0.6690
 epoch: 84, train_loss: 0.3417, test_loss: 1.6313, test_f1: 0.6283
 epoch: 85, train_loss: 0.2946, test_loss: 1.4001, test_f1: 0.6252
 epoch: 86, train_loss: 0.2846, test_loss: 1.5727, test_f1: 0.6231
 epoch: 87, train_loss: 0.2761, test_loss: 1.5865, test_f1: 0.6487
 epoch: 88, train_loss: 0.2742, test_loss: 1.8584, test_f1: 0.6311
 epoch: 89, train_loss: 0.3299, test_loss: 1.4781, test_f1: 0.6588
 epoch: 90, train_loss: 0.2914, test_loss: 1.6216, test_f1: 0.6273
 epoch: 91, train_loss: 0.2659, test_loss: 1.8297, test_f1: 0.6563
 epoch: 92, train_loss: 0.2902, test_loss: 1.7251, test_f1: 0.6148
 epoch: 93, train_loss: 0.2645, test_loss: 1.9899, test_f1: 0.5957
 epoch: 94, train_loss: 0.2820, test_loss: 1.8155, test_f1: 0.5550
 epoch: 95, train_loss: 0.3018, test_loss: 1.6031, test_f1: 0.6158
 epoch: 96, train_loss: 0.3040, test_loss: 1.5230, test_f1: 0.6205
 epoch: 97, train_loss: 0.2812, test_loss: 1.6499, test_f1: 0.6338
 epoch: 98, train_loss: 0.2840, test_loss: 1.6896, test_f1: 0.6507
 epoch: 99, train_loss: 0.2694, test_loss: 1.9096, test_f1: 0.5997
##################ITERATION #7 ****************************************
 epoch: 0, train_loss: 1.1957, test_loss: 1.3032, test_f1: 0.3779
 epoch: 1, train_loss: 0.9969, test_loss: 1.0826, test_f1: 0.4145
 epoch: 2, train_loss: 0.9294, test_loss: 1.0235, test_f1: 0.4601
 epoch: 3, train_loss: 0.9052, test_loss: 1.1828, test_f1: 0.4054
 epoch: 4, train_loss: 0.9168, test_loss: 1.1026, test_f1: 0.4496
 epoch: 5, train_loss: 0.8890, test_loss: 1.0609, test_f1: 0.4682
 epoch: 6, train_loss: 0.8139, test_loss: 1.0275, test_f1: 0.5345
 epoch: 7, train_loss: 0.8619, test_loss: 1.0354, test_f1: 0.4701
 epoch: 8, train_loss: 0.8165, test_loss: 1.0655, test_f1: 0.5145
 epoch: 9, train_loss: 0.8149, test_loss: 1.0171, test_f1: 0.5580
 epoch: 10, train_loss: 0.8030, test_loss: 1.9269, test_f1: 0.3842
 epoch: 11, train_loss: 0.7916, test_loss: 1.0645, test_f1: 0.5067
 epoch: 12, train_loss: 0.8063, test_loss: 1.0285, test_f1: 0.4849
 epoch: 13, train_loss: 0.7909, test_loss: 1.0910, test_f1: 0.4904
 epoch: 14, train_loss: 0.7625, test_loss: 1.0575, test_f1: 0.5697
 epoch: 15, train_loss: 0.7806, test_loss: 1.0377, test_f1: 0.5928
 epoch: 16, train_loss: 0.7372, test_loss: 1.0719, test_f1: 0.6115
 epoch: 17, train_loss: 0.7411, test_loss: 1.0829, test_f1: 0.5338
 epoch: 18, train_loss: 0.7448, test_loss: 1.0007, test_f1: 0.5796
 epoch: 19, train_loss: 0.7569, test_loss: 1.3106, test_f1: 0.5471
 epoch: 20, train_loss: 0.7389, test_loss: 1.1962, test_f1: 0.5333
 epoch: 21, train_loss: 0.7327, test_loss: 1.3250, test_f1: 0.5578
 epoch: 22, train_loss: 0.7367, test_loss: 1.1582, test_f1: 0.4855
 epoch: 23, train_loss: 0.7070, test_loss: 1.5562, test_f1: 0.4263
 epoch: 24, train_loss: 0.6823, test_loss: 1.2147, test_f1: 0.5502
 epoch: 25, train_loss: 0.7404, test_loss: 0.9741, test_f1: 0.6012
 epoch: 26, train_loss: 0.6733, test_loss: 1.0616, test_f1: 0.6042
 epoch: 27, train_loss: 0.6841, test_loss: 1.2359, test_f1: 0.5446
 epoch: 28, train_loss: 0.6654, test_loss: 1.9069, test_f1: 0.5162
 epoch: 29, train_loss: 0.6762, test_loss: 1.3253, test_f1: 0.5884
 epoch: 30, train_loss: 0.6567, test_loss: 1.4306, test_f1: 0.5464
 epoch: 31, train_loss: 0.6640, test_loss: 1.5830, test_f1: 0.5841
 epoch: 32, train_loss: 0.7039, test_loss: 1.2217, test_f1: 0.5632
 epoch: 33, train_loss: 0.6526, test_loss: 1.5683, test_f1: 0.5588
 epoch: 34, train_loss: 0.6732, test_loss: 1.0608, test_f1: 0.5924
 epoch: 35, train_loss: 0.6414, test_loss: 1.1593, test_f1: 0.5646
 epoch: 36, train_loss: 0.6166, test_loss: 1.1340, test_f1: 0.5507
 epoch: 37, train_loss: 0.6542, test_loss: 0.9949, test_f1: 0.6067
 epoch: 38, train_loss: 0.5922, test_loss: 1.3750, test_f1: 0.6005
 epoch: 39, train_loss: 0.6104, test_loss: 1.1782, test_f1: 0.5299
 epoch: 40, train_loss: 0.5975, test_loss: 1.7281, test_f1: 0.5220
 epoch: 41, train_loss: 0.6015, test_loss: 1.4902, test_f1: 0.4872
 epoch: 42, train_loss: 0.6632, test_loss: 1.1601, test_f1: 0.5863
 epoch: 43, train_loss: 0.5698, test_loss: 1.3432, test_f1: 0.5803
 epoch: 44, train_loss: 0.5666, test_loss: 1.3774, test_f1: 0.5928
 epoch: 45, train_loss: 0.5545, test_loss: 1.4159, test_f1: 0.6067
 epoch: 46, train_loss: 0.5818, test_loss: 1.2881, test_f1: 0.6066
 epoch: 47, train_loss: 0.5799, test_loss: 1.2609, test_f1: 0.5716
 epoch: 48, train_loss: 0.5625, test_loss: 1.4463, test_f1: 0.5870
 epoch: 49, train_loss: 0.5695, test_loss: 1.5930, test_f1: 0.5481
 epoch: 50, train_loss: 0.5261, test_loss: 2.0052, test_f1: 0.5733
 epoch: 51, train_loss: 0.5009, test_loss: 1.4417, test_f1: 0.5718
 epoch: 52, train_loss: 0.4610, test_loss: 1.6928, test_f1: 0.5836
 epoch: 53, train_loss: 0.4476, test_loss: 1.6194, test_f1: 0.5890
 epoch: 54, train_loss: 0.4573, test_loss: 2.0222, test_f1: 0.6029
 epoch: 55, train_loss: 0.4086, test_loss: 1.6941, test_f1: 0.6057
 epoch: 56, train_loss: 0.4167, test_loss: 1.7023, test_f1: 0.6063
 epoch: 57, train_loss: 0.4303, test_loss: 1.5914, test_f1: 0.5781
 epoch: 58, train_loss: 0.4501, test_loss: 1.8075, test_f1: 0.6066
 epoch: 59, train_loss: 0.4143, test_loss: 1.4752, test_f1: 0.6259
 epoch: 60, train_loss: 0.3877, test_loss: 1.6471, test_f1: 0.6088
 epoch: 61, train_loss: 0.4046, test_loss: 1.8593, test_f1: 0.6025
 epoch: 62, train_loss: 0.3968, test_loss: 2.3414, test_f1: 0.6047
 epoch: 63, train_loss: 0.4341, test_loss: 1.5013, test_f1: 0.6324
 epoch: 64, train_loss: 0.3986, test_loss: 1.5787, test_f1: 0.6234
 epoch: 65, train_loss: 0.3770, test_loss: 1.6115, test_f1: 0.6354
 epoch: 66, train_loss: 0.3759, test_loss: 1.9761, test_f1: 0.5957
 epoch: 67, train_loss: 0.3859, test_loss: 1.6046, test_f1: 0.5853
 epoch: 68, train_loss: 0.4070, test_loss: 1.4361, test_f1: 0.6013
 epoch: 69, train_loss: 0.3827, test_loss: 1.6222, test_f1: 0.6148
 epoch: 70, train_loss: 0.3808, test_loss: 2.3268, test_f1: 0.5757
 epoch: 71, train_loss: 0.3751, test_loss: 1.3181, test_f1: 0.6491
 epoch: 72, train_loss: 0.4118, test_loss: 1.6742, test_f1: 0.6177
 epoch: 73, train_loss: 0.3987, test_loss: 1.3084, test_f1: 0.6720
 epoch: 74, train_loss: 0.3791, test_loss: 1.5806, test_f1: 0.6085
 epoch: 75, train_loss: 0.3439, test_loss: 1.6255, test_f1: 0.6002
 epoch: 76, train_loss: 0.3483, test_loss: 1.7068, test_f1: 0.6299
 epoch: 77, train_loss: 0.3384, test_loss: 1.8325, test_f1: 0.6451
 epoch: 78, train_loss: 0.3348, test_loss: 1.8501, test_f1: 0.5854
 epoch: 79, train_loss: 0.3449, test_loss: 1.5434, test_f1: 0.6328
 epoch: 80, train_loss: 0.3384, test_loss: 1.3697, test_f1: 0.6532
 epoch: 81, train_loss: 0.3453, test_loss: 1.6082, test_f1: 0.6082
 epoch: 82, train_loss: 0.3486, test_loss: 1.7176, test_f1: 0.6436
 epoch: 83, train_loss: 0.3598, test_loss: 2.0709, test_f1: 0.6211
 epoch: 84, train_loss: 0.3145, test_loss: 1.9310, test_f1: 0.6534
 epoch: 85, train_loss: 0.3324, test_loss: 1.8571, test_f1: 0.6285
 epoch: 86, train_loss: 0.3577, test_loss: 1.3095, test_f1: 0.6620
 epoch: 87, train_loss: 0.3046, test_loss: 1.6931, test_f1: 0.6470
 epoch: 88, train_loss: 0.3084, test_loss: 1.9041, test_f1: 0.6098
 epoch: 89, train_loss: 0.3482, test_loss: 2.2317, test_f1: 0.5762
 epoch: 90, train_loss: 0.3132, test_loss: 1.7669, test_f1: 0.6025
 epoch: 91, train_loss: 0.3041, test_loss: 2.2351, test_f1: 0.5793
 epoch: 92, train_loss: 0.3171, test_loss: 2.1646, test_f1: 0.6044
 epoch: 93, train_loss: 0.3154, test_loss: 2.0287, test_f1: 0.5950
 epoch: 94, train_loss: 0.3215, test_loss: 1.9670, test_f1: 0.5570
 epoch: 95, train_loss: 0.3059, test_loss: 1.7448, test_f1: 0.6067
 epoch: 96, train_loss: 0.3076, test_loss: 2.0699, test_f1: 0.6187
 epoch: 97, train_loss: 0.3539, test_loss: 1.5351, test_f1: 0.6543
 epoch: 98, train_loss: 0.3106, test_loss: 2.3388, test_f1: 0.5660
 epoch: 99, train_loss: 0.3247, test_loss: 1.9373, test_f1: 0.6518
##################ITERATION #8 ****************************************
 epoch: 0, train_loss: 1.1440, test_loss: 1.2015, test_f1: 0.4122
 epoch: 1, train_loss: 0.9725, test_loss: 1.0527, test_f1: 0.4134
 epoch: 2, train_loss: 0.9108, test_loss: 1.1227, test_f1: 0.4611
 epoch: 3, train_loss: 0.8772, test_loss: 1.0243, test_f1: 0.5127
 epoch: 4, train_loss: 0.8552, test_loss: 1.0950, test_f1: 0.5283
 epoch: 5, train_loss: 0.8760, test_loss: 1.0004, test_f1: 0.5812
 epoch: 6, train_loss: 0.8127, test_loss: 1.0589, test_f1: 0.5063
 epoch: 7, train_loss: 0.8250, test_loss: 1.0672, test_f1: 0.5454
 epoch: 8, train_loss: 0.8247, test_loss: 1.2851, test_f1: 0.3940
 epoch: 9, train_loss: 0.7892, test_loss: 1.2026, test_f1: 0.4566
 epoch: 10, train_loss: 0.7873, test_loss: 1.0355, test_f1: 0.5261
 epoch: 11, train_loss: 0.7901, test_loss: 1.1571, test_f1: 0.5132
 epoch: 12, train_loss: 0.7901, test_loss: 1.5774, test_f1: 0.4451
 epoch: 13, train_loss: 0.7807, test_loss: 1.1068, test_f1: 0.5146
 epoch: 14, train_loss: 0.7642, test_loss: 1.2146, test_f1: 0.5418
 epoch: 15, train_loss: 0.7816, test_loss: 1.0734, test_f1: 0.5158
 epoch: 16, train_loss: 0.7151, test_loss: 1.3160, test_f1: 0.4442
 epoch: 17, train_loss: 0.7278, test_loss: 1.2988, test_f1: 0.5313
 epoch: 18, train_loss: 0.7328, test_loss: 1.2523, test_f1: 0.4989
 epoch: 19, train_loss: 0.7183, test_loss: 1.2296, test_f1: 0.4687
 epoch: 20, train_loss: 0.7356, test_loss: 1.7945, test_f1: 0.4825
 epoch: 21, train_loss: 0.6781, test_loss: 1.2301, test_f1: 0.4937
 epoch: 22, train_loss: 0.6785, test_loss: 1.0169, test_f1: 0.5991
 epoch: 23, train_loss: 0.6922, test_loss: 1.2350, test_f1: 0.5893
 epoch: 24, train_loss: 0.6657, test_loss: 1.2442, test_f1: 0.5296
 epoch: 25, train_loss: 0.6646, test_loss: 1.1617, test_f1: 0.5672
 epoch: 26, train_loss: 0.6632, test_loss: 7.1151, test_f1: 0.1886
 epoch: 27, train_loss: 0.6725, test_loss: 1.1433, test_f1: 0.5705
 epoch: 28, train_loss: 0.6544, test_loss: 1.1801, test_f1: 0.5356
 epoch: 29, train_loss: 0.6576, test_loss: 1.2046, test_f1: 0.5813
 epoch: 30, train_loss: 0.6665, test_loss: 1.1548, test_f1: 0.5900
 epoch: 31, train_loss: 0.6252, test_loss: 1.0779, test_f1: 0.5872
 epoch: 32, train_loss: 0.6117, test_loss: 1.4040, test_f1: 0.5525
 epoch: 33, train_loss: 0.6236, test_loss: 1.2898, test_f1: 0.5811
 epoch: 34, train_loss: 0.6171, test_loss: 1.0964, test_f1: 0.5721
 epoch: 35, train_loss: 0.6317, test_loss: 1.3295, test_f1: 0.4516
 epoch: 36, train_loss: 0.6258, test_loss: 1.1077, test_f1: 0.5807
 epoch: 37, train_loss: 0.6246, test_loss: 1.2676, test_f1: 0.5445
 epoch: 38, train_loss: 0.6119, test_loss: 1.5680, test_f1: 0.5360
 epoch: 39, train_loss: 0.6144, test_loss: 1.6467, test_f1: 0.4560
 epoch: 40, train_loss: 0.5887, test_loss: 1.2522, test_f1: 0.5620
 epoch: 41, train_loss: 0.5641, test_loss: 1.7252, test_f1: 0.5422
 epoch: 42, train_loss: 0.5742, test_loss: 1.4352, test_f1: 0.5518
 epoch: 43, train_loss: 0.5919, test_loss: 1.3221, test_f1: 0.5505
 epoch: 44, train_loss: 0.5717, test_loss: 1.2815, test_f1: 0.4942
 epoch: 45, train_loss: 0.5778, test_loss: 1.2921, test_f1: 0.5840
 epoch: 46, train_loss: 0.5640, test_loss: 2.1368, test_f1: 0.3935
 epoch: 47, train_loss: 0.5542, test_loss: 2.2154, test_f1: 0.4457
 epoch: 48, train_loss: 0.5848, test_loss: 1.8536, test_f1: 0.5444
 epoch: 49, train_loss: 0.6000, test_loss: 1.5071, test_f1: 0.5874
 epoch: 50, train_loss: 0.5621, test_loss: 1.6048, test_f1: 0.5805
 epoch: 51, train_loss: 0.5319, test_loss: 1.6601, test_f1: 0.5496
 epoch: 52, train_loss: 0.4588, test_loss: 1.4966, test_f1: 0.6294
 epoch: 53, train_loss: 0.4575, test_loss: 1.5423, test_f1: 0.5929
 epoch: 54, train_loss: 0.4550, test_loss: 1.7145, test_f1: 0.5865
 epoch: 55, train_loss: 0.4472, test_loss: 1.7166, test_f1: 0.5438
 epoch: 56, train_loss: 0.4630, test_loss: 1.8099, test_f1: 0.5470
 epoch: 57, train_loss: 0.4435, test_loss: 1.6032, test_f1: 0.5594
 epoch: 58, train_loss: 0.4089, test_loss: 1.5272, test_f1: 0.5960
 epoch: 59, train_loss: 0.4652, test_loss: 1.6974, test_f1: 0.5363
 epoch: 60, train_loss: 0.4261, test_loss: 1.7787, test_f1: 0.5557
 epoch: 61, train_loss: 0.3769, test_loss: 1.6066, test_f1: 0.5711
 epoch: 62, train_loss: 0.4202, test_loss: 1.8296, test_f1: 0.5754
 epoch: 63, train_loss: 0.4337, test_loss: 1.7631, test_f1: 0.5871
 epoch: 64, train_loss: 0.4145, test_loss: 1.5270, test_f1: 0.5863
 epoch: 65, train_loss: 0.4213, test_loss: 1.6933, test_f1: 0.5778
 epoch: 66, train_loss: 0.3884, test_loss: 1.7358, test_f1: 0.5491
 epoch: 67, train_loss: 0.4107, test_loss: 1.4587, test_f1: 0.5548
 epoch: 68, train_loss: 0.3977, test_loss: 1.4537, test_f1: 0.5869
 epoch: 69, train_loss: 0.3742, test_loss: 1.6417, test_f1: 0.5676
 epoch: 70, train_loss: 0.3857, test_loss: 1.9550, test_f1: 0.5915
 epoch: 71, train_loss: 0.3365, test_loss: 1.8853, test_f1: 0.5694
 epoch: 72, train_loss: 0.3727, test_loss: 1.7762, test_f1: 0.5790
 epoch: 73, train_loss: 0.3611, test_loss: 1.7581, test_f1: 0.6037
 epoch: 74, train_loss: 0.3642, test_loss: 1.6748, test_f1: 0.5645
 epoch: 75, train_loss: 0.3813, test_loss: 1.6224, test_f1: 0.6011
 epoch: 76, train_loss: 0.3424, test_loss: 2.3805, test_f1: 0.5917
 epoch: 77, train_loss: 0.3429, test_loss: 2.1406, test_f1: 0.5695
 epoch: 78, train_loss: 0.3574, test_loss: 1.8212, test_f1: 0.6157
 epoch: 79, train_loss: 0.3321, test_loss: 1.6030, test_f1: 0.6086
 epoch: 80, train_loss: 0.3951, test_loss: 1.5711, test_f1: 0.6119
 epoch: 81, train_loss: 0.3261, test_loss: 1.7879, test_f1: 0.5915
 epoch: 82, train_loss: 0.3493, test_loss: 1.6658, test_f1: 0.5693
 epoch: 83, train_loss: 0.3186, test_loss: 1.9034, test_f1: 0.5985
 epoch: 84, train_loss: 0.3504, test_loss: 1.9180, test_f1: 0.6333
 epoch: 85, train_loss: 0.3601, test_loss: 1.9192, test_f1: 0.6136
 epoch: 86, train_loss: 0.3435, test_loss: 1.7907, test_f1: 0.5697
 epoch: 87, train_loss: 0.3755, test_loss: 1.9370, test_f1: 0.5498
 epoch: 88, train_loss: 0.3337, test_loss: 1.8813, test_f1: 0.5824
 epoch: 89, train_loss: 0.3745, test_loss: 1.6840, test_f1: 0.6198
 epoch: 90, train_loss: 0.3247, test_loss: 2.7744, test_f1: 0.5727
 epoch: 91, train_loss: 0.3458, test_loss: 2.1608, test_f1: 0.5810
 epoch: 92, train_loss: 0.3425, test_loss: 1.8273, test_f1: 0.6377
 epoch: 93, train_loss: 0.3237, test_loss: 2.2497, test_f1: 0.5979
 epoch: 94, train_loss: 0.3329, test_loss: 1.8657, test_f1: 0.5586
 epoch: 95, train_loss: 0.3273, test_loss: 2.1288, test_f1: 0.5928
 epoch: 96, train_loss: 0.3056, test_loss: 3.0445, test_f1: 0.4994
 epoch: 97, train_loss: 0.3185, test_loss: 2.0113, test_f1: 0.5732
 epoch: 98, train_loss: 0.4185, test_loss: 2.4545, test_f1: 0.5890
 epoch: 99, train_loss: 0.3253, test_loss: 1.8977, test_f1: 0.5092
##################ITERATION #9 ****************************************
 epoch: 0, train_loss: 1.1012, test_loss: 1.3643, test_f1: 0.3970
 epoch: 1, train_loss: 0.9333, test_loss: 1.0236, test_f1: 0.5384
 epoch: 2, train_loss: 0.8629, test_loss: 1.0447, test_f1: 0.5258
 epoch: 3, train_loss: 0.8570, test_loss: 1.1314, test_f1: 0.5031
 epoch: 4, train_loss: 0.8319, test_loss: 1.0007, test_f1: 0.5509
 epoch: 5, train_loss: 0.7941, test_loss: 1.0025, test_f1: 0.6002
 epoch: 6, train_loss: 0.8284, test_loss: 1.0533, test_f1: 0.5574
 epoch: 7, train_loss: 0.8114, test_loss: 1.1273, test_f1: 0.5760
 epoch: 8, train_loss: 0.7943, test_loss: 1.0846, test_f1: 0.5661
 epoch: 9, train_loss: 0.7600, test_loss: 1.3680, test_f1: 0.5364
 epoch: 10, train_loss: 0.7479, test_loss: 1.1035, test_f1: 0.5880
 epoch: 11, train_loss: 0.7475, test_loss: 1.1350, test_f1: 0.5112
 epoch: 12, train_loss: 0.7338, test_loss: 1.3410, test_f1: 0.4666
 epoch: 13, train_loss: 0.7430, test_loss: 0.9949, test_f1: 0.5977
 epoch: 14, train_loss: 0.7364, test_loss: 1.3250, test_f1: 0.5472
 epoch: 15, train_loss: 0.7393, test_loss: 1.0433, test_f1: 0.5940
 epoch: 16, train_loss: 0.7170, test_loss: 1.0531, test_f1: 0.6056
 epoch: 17, train_loss: 0.7284, test_loss: 1.1528, test_f1: 0.5646
 epoch: 18, train_loss: 0.6799, test_loss: 1.2112, test_f1: 0.5301
 epoch: 19, train_loss: 0.7282, test_loss: 1.1231, test_f1: 0.5744
 epoch: 20, train_loss: 0.6973, test_loss: 1.4550, test_f1: 0.5498
 epoch: 21, train_loss: 0.6762, test_loss: 1.2544, test_f1: 0.5611
 epoch: 22, train_loss: 0.6730, test_loss: 1.0015, test_f1: 0.6299
 epoch: 23, train_loss: 0.6942, test_loss: 1.1145, test_f1: 0.5662
 epoch: 24, train_loss: 0.6442, test_loss: 1.0042, test_f1: 0.6434
 epoch: 25, train_loss: 0.6618, test_loss: 1.1269, test_f1: 0.5959
 epoch: 26, train_loss: 0.6129, test_loss: 1.4323, test_f1: 0.5756
 epoch: 27, train_loss: 0.6443, test_loss: 1.3258, test_f1: 0.5859
 epoch: 28, train_loss: 0.6194, test_loss: 1.1633, test_f1: 0.5918
 epoch: 29, train_loss: 0.6327, test_loss: 1.1164, test_f1: 0.6438
 epoch: 30, train_loss: 0.6248, test_loss: 1.1451, test_f1: 0.6285
 epoch: 31, train_loss: 0.6002, test_loss: 1.0596, test_f1: 0.6470
 epoch: 32, train_loss: 0.5853, test_loss: 1.5222, test_f1: 0.5421
 epoch: 33, train_loss: 0.5804, test_loss: 1.6456, test_f1: 0.4918
 epoch: 34, train_loss: 0.6044, test_loss: 1.2583, test_f1: 0.5556
 epoch: 35, train_loss: 0.5910, test_loss: 1.6231, test_f1: 0.5475
 epoch: 36, train_loss: 0.6100, test_loss: 1.1425, test_f1: 0.5877
 epoch: 37, train_loss: 0.5732, test_loss: 1.4050, test_f1: 0.4263
 epoch: 38, train_loss: 0.5816, test_loss: 1.0504, test_f1: 0.5892
 epoch: 39, train_loss: 0.5738, test_loss: 1.2521, test_f1: 0.6027
 epoch: 40, train_loss: 0.5645, test_loss: 1.3906, test_f1: 0.4856
 epoch: 41, train_loss: 0.5673, test_loss: 1.4338, test_f1: 0.5864
 epoch: 42, train_loss: 0.5046, test_loss: 1.5358, test_f1: 0.5684
 epoch: 43, train_loss: 0.5413, test_loss: 2.3595, test_f1: 0.5251
 epoch: 44, train_loss: 0.5649, test_loss: 1.5097, test_f1: 0.4874
 epoch: 45, train_loss: 0.5136, test_loss: 1.2933, test_f1: 0.5967
 epoch: 46, train_loss: 0.5313, test_loss: 1.3315, test_f1: 0.5446
 epoch: 47, train_loss: 0.5387, test_loss: 1.2734, test_f1: 0.5680
 epoch: 48, train_loss: 0.5412, test_loss: 1.1662, test_f1: 0.6223
 epoch: 49, train_loss: 0.5067, test_loss: 2.1144, test_f1: 0.4940
 epoch: 50, train_loss: 0.4948, test_loss: 1.1757, test_f1: 0.6066
 epoch: 51, train_loss: 0.4702, test_loss: 1.2128, test_f1: 0.6042
 epoch: 52, train_loss: 0.4606, test_loss: 1.4442, test_f1: 0.5670
 epoch: 53, train_loss: 0.4200, test_loss: 1.4955, test_f1: 0.5651
 epoch: 54, train_loss: 0.4010, test_loss: 1.4656, test_f1: 0.6082
 epoch: 55, train_loss: 0.4185, test_loss: 1.7741, test_f1: 0.5681
 epoch: 56, train_loss: 0.4193, test_loss: 1.4032, test_f1: 0.6217
 epoch: 57, train_loss: 0.3745, test_loss: 1.4363, test_f1: 0.6232
 epoch: 58, train_loss: 0.3921, test_loss: 1.4686, test_f1: 0.6257
 epoch: 59, train_loss: 0.3570, test_loss: 1.5386, test_f1: 0.6406
 epoch: 60, train_loss: 0.3693, test_loss: 1.8643, test_f1: 0.5788
 epoch: 61, train_loss: 0.3755, test_loss: 1.6327, test_f1: 0.6369
 epoch: 62, train_loss: 0.3776, test_loss: 1.4955, test_f1: 0.5985
 epoch: 63, train_loss: 0.3655, test_loss: 1.7220, test_f1: 0.6337
 epoch: 64, train_loss: 0.3721, test_loss: 1.9373, test_f1: 0.5782
 epoch: 65, train_loss: 0.3654, test_loss: 1.7579, test_f1: 0.6241
 epoch: 66, train_loss: 0.3530, test_loss: 1.9966, test_f1: 0.5833
 epoch: 67, train_loss: 0.3679, test_loss: 1.7376, test_f1: 0.5842
 epoch: 68, train_loss: 0.3735, test_loss: 1.5571, test_f1: 0.6203
 epoch: 69, train_loss: 0.3600, test_loss: 1.7388, test_f1: 0.6324
 epoch: 70, train_loss: 0.3544, test_loss: 1.6554, test_f1: 0.5582
 epoch: 71, train_loss: 0.3186, test_loss: 1.8753, test_f1: 0.5895
 epoch: 72, train_loss: 0.3227, test_loss: 1.9688, test_f1: 0.5825
 epoch: 73, train_loss: 0.3427, test_loss: 1.7047, test_f1: 0.6003
 epoch: 74, train_loss: 0.3615, test_loss: 1.7178, test_f1: 0.6220
 epoch: 75, train_loss: 0.3393, test_loss: 1.4049, test_f1: 0.6734
 epoch: 76, train_loss: 0.3280, test_loss: 1.9194, test_f1: 0.5712
 epoch: 77, train_loss: 0.3487, test_loss: 1.9669, test_f1: 0.5604
 epoch: 78, train_loss: 0.3469, test_loss: 1.6860, test_f1: 0.5890
 epoch: 79, train_loss: 0.3067, test_loss: 1.9291, test_f1: 0.5869
 epoch: 80, train_loss: 0.2953, test_loss: 1.8116, test_f1: 0.6143
 epoch: 81, train_loss: 0.3001, test_loss: 1.6878, test_f1: 0.6271
 epoch: 82, train_loss: 0.2979, test_loss: 1.8388, test_f1: 0.6038
 epoch: 83, train_loss: 0.2828, test_loss: 1.8715, test_f1: 0.5936
 epoch: 84, train_loss: 0.2944, test_loss: 1.9919, test_f1: 0.6131
 epoch: 85, train_loss: 0.2983, test_loss: 1.7873, test_f1: 0.5981
 epoch: 86, train_loss: 0.3135, test_loss: 1.8686, test_f1: 0.5868
 epoch: 87, train_loss: 0.2911, test_loss: 1.7860, test_f1: 0.6454
 epoch: 88, train_loss: 0.2886, test_loss: 1.9888, test_f1: 0.5941
 epoch: 89, train_loss: 0.3193, test_loss: 2.1754, test_f1: 0.5526
 epoch: 90, train_loss: 0.3159, test_loss: 1.8650, test_f1: 0.6021
 epoch: 91, train_loss: 0.2988, test_loss: 2.0601, test_f1: 0.5423
 epoch: 92, train_loss: 0.2812, test_loss: 1.8939, test_f1: 0.5803
 epoch: 93, train_loss: 0.2754, test_loss: 1.6801, test_f1: 0.6496
 epoch: 94, train_loss: 0.2800, test_loss: 2.4408, test_f1: 0.5671
 epoch: 95, train_loss: 0.2689, test_loss: 1.6818, test_f1: 0.6172
 epoch: 96, train_loss: 0.3251, test_loss: 2.0314, test_f1: 0.5841
 epoch: 97, train_loss: 0.2699, test_loss: 2.0774, test_f1: 0.6025
 epoch: 98, train_loss: 0.2856, test_loss: 1.8647, test_f1: 0.6352
 epoch: 99, train_loss: 0.2749, test_loss: 1.8694, test_f1: 0.5835

Training completed in 512.90 seconds
Best F1: 0.6806 at epoch 37
Mean F1 across iterations: 0.6635  0.0120
========================FINAL RESULTS================================
FEGIN weighted F1: 0.6806  0.0120
python main.py --data ltspice_demos --representation component_pin_net --model FEGIN --layers 2 --hiddens 128 --batch_size 32 --lr 0.01 --emb_size 128 --epochs 100 --save_appendix component_pin_net_L2_H128_BS32_LR0.01_E128 --no_val
-----



STDERR:
  File "main.py", line 370, in <module>
    main()
  File "main.py", line 254, in main
    dataset = dataset_class(
  File "/home/philip/projects/ltspice_examples_code_repo/Circuit-Completion-Using-GNNs/component_classification_with_link_prediction_head/evaluation/FEGIN/kernel/circuit_datasets.py", line 15, in __init__
    self.data, self.slices = torch.load(self.processed_paths[0])
  File "/home/philip/.local/lib/python3.8/site-packages/torch/serialization.py", line 1040, in load
    warnings.warn(
  File "/usr/lib/python3.8/warnings.py", line 109, in _showwarnmsg
    sw(msg.message, msg.category, msg.filename, msg.lineno,
  File "main.py", line 47, in warn_with_traceback
    traceback.print_stack(file=log)
/home/philip/projects/ltspice_examples_code_repo/Circuit-Completion-Using-GNNs/component_classification_with_link_prediction_head/evaluation/FEGIN/kernel/circuit_datasets.py:15: FutureWarning: You are using `torch.load` with `weights_only=False` (the current default value), which uses the default pickle module implicitly. It is possible to construct malicious pickle data which will execute arbitrary code during unpickling (See https://github.com/pytorch/pytorch/blob/main/SECURITY.md#untrusted-models for more details). In a future release, the default value for `weights_only` will be flipped to `True`. This limits the functions that could be executed during unpickling. Arbitrary objects will no longer be allowed to be loaded via this mode unless they are explicitly allowlisted by the user via `torch.serialization.add_safe_globals`. We recommend you start setting `weights_only=True` for any use case where you don't have full control of the loaded file. Please open an issue on GitHub for any issues related to this experimental feature.
  self.data, self.slices = torch.load(self.processed_paths[0])
