STDOUT:
Results will be saved in /home/philip/projects/llm_inference_code_repo/Circuit-Completion-Using-GNNs/component_classification_with_link_prediction_head/evaluation/FEGIN/results/model_FEGIN_dataset_ltspice_examples
Command line input: python main.py --data ltspice_examples --representation component_pin_net --model FEGIN --layers 3 --hiddens 32 --batch_size 64 --lr 0.01 --emb_size 512 --epochs 100 --save_appendix component_pin_net_L3_H32_BS64_LR0.01_E512 --no_val
 is saved.
-----
ltspice_examples - FEGIN
Using 3 layers, 32 hidden units, h = 2
Loading component_pin_net representation dataset
ENTERED
Training FEGIN on component_pin_net representation
Train: 3558, Test: 846
##################ITERATION #0 ****************************************
 epoch: 0, train_loss: 1.1240, test_loss: 1.0249, test_f1: 0.4066
 epoch: 1, train_loss: 1.0099, test_loss: 1.0483, test_f1: 0.4512
 epoch: 2, train_loss: 0.9840, test_loss: 1.0873, test_f1: 0.4021
 epoch: 3, train_loss: 0.9733, test_loss: 1.1005, test_f1: 0.4656
 epoch: 4, train_loss: 0.9533, test_loss: 1.0433, test_f1: 0.4462
 epoch: 5, train_loss: 0.9531, test_loss: 1.0761, test_f1: 0.4996
 epoch: 6, train_loss: 0.9401, test_loss: 1.0059, test_f1: 0.5236
 epoch: 7, train_loss: 0.9358, test_loss: 0.9625, test_f1: 0.4827
 epoch: 8, train_loss: 0.9208, test_loss: 1.0107, test_f1: 0.4491
 epoch: 9, train_loss: 0.9245, test_loss: 0.9780, test_f1: 0.5465
 epoch: 10, train_loss: 0.9114, test_loss: 0.9576, test_f1: 0.4960
 epoch: 11, train_loss: 0.8878, test_loss: 0.9424, test_f1: 0.5204
 epoch: 12, train_loss: 0.8805, test_loss: 0.9791, test_f1: 0.5105
 epoch: 13, train_loss: 0.8826, test_loss: 0.9141, test_f1: 0.5142
 epoch: 14, train_loss: 0.8557, test_loss: 0.9699, test_f1: 0.5508
 epoch: 15, train_loss: 0.8542, test_loss: 0.9455, test_f1: 0.5838
 epoch: 16, train_loss: 0.8511, test_loss: 1.0780, test_f1: 0.4538
 epoch: 17, train_loss: 0.8552, test_loss: 0.9119, test_f1: 0.5289
 epoch: 18, train_loss: 0.8327, test_loss: 0.9151, test_f1: 0.5274
 epoch: 19, train_loss: 0.8269, test_loss: 1.0440, test_f1: 0.5192
 epoch: 20, train_loss: 0.8177, test_loss: 0.9623, test_f1: 0.6030
 epoch: 21, train_loss: 0.8175, test_loss: 0.8700, test_f1: 0.5493
 epoch: 22, train_loss: 0.8239, test_loss: 0.8599, test_f1: 0.5485
 epoch: 23, train_loss: 0.8012, test_loss: 0.9996, test_f1: 0.5724
 epoch: 24, train_loss: 0.7918, test_loss: 0.9188, test_f1: 0.6054
 epoch: 25, train_loss: 0.7950, test_loss: 0.9150, test_f1: 0.6009
 epoch: 26, train_loss: 0.7946, test_loss: 0.8478, test_f1: 0.5709
 epoch: 27, train_loss: 0.7771, test_loss: 0.8792, test_f1: 0.6426
 epoch: 28, train_loss: 0.7792, test_loss: 0.9750, test_f1: 0.5479
 epoch: 29, train_loss: 0.7656, test_loss: 0.8575, test_f1: 0.6334
 epoch: 30, train_loss: 0.7541, test_loss: 0.8718, test_f1: 0.5462
 epoch: 31, train_loss: 0.7564, test_loss: 0.9982, test_f1: 0.6167
 epoch: 32, train_loss: 0.7732, test_loss: 0.8989, test_f1: 0.6445
 epoch: 33, train_loss: 0.7554, test_loss: 0.8633, test_f1: 0.6271
 epoch: 34, train_loss: 0.7385, test_loss: 0.8435, test_f1: 0.5989
 epoch: 35, train_loss: 0.7485, test_loss: 0.8338, test_f1: 0.6553
 epoch: 36, train_loss: 0.7284, test_loss: 0.8456, test_f1: 0.6230
 epoch: 37, train_loss: 0.7289, test_loss: 0.9070, test_f1: 0.6506
 epoch: 38, train_loss: 0.7387, test_loss: 0.9099, test_f1: 0.5680
 epoch: 39, train_loss: 0.7179, test_loss: 0.9003, test_f1: 0.6265
 epoch: 40, train_loss: 0.7148, test_loss: 0.8339, test_f1: 0.6003
 epoch: 41, train_loss: 0.7218, test_loss: 0.8600, test_f1: 0.6148
 epoch: 42, train_loss: 0.7180, test_loss: 0.9026, test_f1: 0.6297
 epoch: 43, train_loss: 0.7186, test_loss: 0.9285, test_f1: 0.5864
 epoch: 44, train_loss: 0.7024, test_loss: 0.8881, test_f1: 0.6436
 epoch: 45, train_loss: 0.6894, test_loss: 0.8926, test_f1: 0.6132
 epoch: 46, train_loss: 0.6974, test_loss: 0.8896, test_f1: 0.6071
 epoch: 47, train_loss: 0.7079, test_loss: 0.9888, test_f1: 0.6291
 epoch: 48, train_loss: 0.6994, test_loss: 0.8773, test_f1: 0.6458
 epoch: 49, train_loss: 0.6845, test_loss: 1.0588, test_f1: 0.6134
 epoch: 50, train_loss: 0.6751, test_loss: 0.9781, test_f1: 0.6225
 epoch: 51, train_loss: 0.6748, test_loss: 0.8634, test_f1: 0.6764
 epoch: 52, train_loss: 0.6436, test_loss: 0.8995, test_f1: 0.6615
 epoch: 53, train_loss: 0.6441, test_loss: 0.8742, test_f1: 0.6584
 epoch: 54, train_loss: 0.6358, test_loss: 0.9524, test_f1: 0.6465
 epoch: 55, train_loss: 0.6191, test_loss: 0.9621, test_f1: 0.6549
 epoch: 56, train_loss: 0.6083, test_loss: 0.8753, test_f1: 0.6847
 epoch: 57, train_loss: 0.6032, test_loss: 0.9779, test_f1: 0.6434
 epoch: 58, train_loss: 0.6079, test_loss: 0.8941, test_f1: 0.6692
 epoch: 59, train_loss: 0.6189, test_loss: 0.8973, test_f1: 0.6487
 epoch: 60, train_loss: 0.6052, test_loss: 0.8784, test_f1: 0.6598
 epoch: 61, train_loss: 0.5969, test_loss: 0.9399, test_f1: 0.6506
 epoch: 62, train_loss: 0.6093, test_loss: 0.9561, test_f1: 0.6672
 epoch: 63, train_loss: 0.5806, test_loss: 0.9335, test_f1: 0.6606
 epoch: 64, train_loss: 0.5951, test_loss: 0.8603, test_f1: 0.6689
 epoch: 65, train_loss: 0.5904, test_loss: 1.0580, test_f1: 0.6547
 epoch: 66, train_loss: 0.5961, test_loss: 0.9352, test_f1: 0.6726
 epoch: 67, train_loss: 0.5859, test_loss: 0.9539, test_f1: 0.6646
 epoch: 68, train_loss: 0.5871, test_loss: 0.9367, test_f1: 0.6729
 epoch: 69, train_loss: 0.5793, test_loss: 0.9312, test_f1: 0.6755
 epoch: 70, train_loss: 0.5654, test_loss: 1.0365, test_f1: 0.6380
 epoch: 71, train_loss: 0.5663, test_loss: 0.9616, test_f1: 0.6602
 epoch: 72, train_loss: 0.5546, test_loss: 0.9761, test_f1: 0.6476
 epoch: 73, train_loss: 0.5790, test_loss: 0.9348, test_f1: 0.6758
 epoch: 74, train_loss: 0.5758, test_loss: 0.9911, test_f1: 0.6558
 epoch: 75, train_loss: 0.5526, test_loss: 0.8950, test_f1: 0.6718
 epoch: 76, train_loss: 0.5481, test_loss: 0.9501, test_f1: 0.6741
 epoch: 77, train_loss: 0.5602, test_loss: 0.9599, test_f1: 0.6668
 epoch: 78, train_loss: 0.5587, test_loss: 0.9080, test_f1: 0.6853
 epoch: 79, train_loss: 0.5682, test_loss: 0.9525, test_f1: 0.6862
 epoch: 80, train_loss: 0.5699, test_loss: 0.9799, test_f1: 0.6778
 epoch: 81, train_loss: 0.5527, test_loss: 0.9009, test_f1: 0.6687
 epoch: 82, train_loss: 0.5634, test_loss: 0.9203, test_f1: 0.6729
 epoch: 83, train_loss: 0.5642, test_loss: 0.9054, test_f1: 0.6645
 epoch: 84, train_loss: 0.5173, test_loss: 0.9448, test_f1: 0.6646
 epoch: 85, train_loss: 0.5355, test_loss: 0.9330, test_f1: 0.6834
 epoch: 86, train_loss: 0.5495, test_loss: 0.9568, test_f1: 0.6548
 epoch: 87, train_loss: 0.5401, test_loss: 0.9604, test_f1: 0.6742
 epoch: 88, train_loss: 0.5427, test_loss: 0.9568, test_f1: 0.6576
 epoch: 89, train_loss: 0.5389, test_loss: 1.0139, test_f1: 0.6605
 epoch: 90, train_loss: 0.5233, test_loss: 1.0036, test_f1: 0.6692
 epoch: 91, train_loss: 0.5293, test_loss: 1.0322, test_f1: 0.6578
 epoch: 92, train_loss: 0.5471, test_loss: 0.9332, test_f1: 0.6939
 epoch: 93, train_loss: 0.5097, test_loss: 0.9215, test_f1: 0.6677
 epoch: 94, train_loss: 0.5282, test_loss: 1.0351, test_f1: 0.6720
 epoch: 95, train_loss: 0.5245, test_loss: 0.9486, test_f1: 0.6721
 epoch: 96, train_loss: 0.5261, test_loss: 1.0199, test_f1: 0.6830
 epoch: 97, train_loss: 0.5112, test_loss: 1.1189, test_f1: 0.6437
 epoch: 98, train_loss: 0.5189, test_loss: 1.0213, test_f1: 0.6717
 epoch: 99, train_loss: 0.5111, test_loss: 0.9658, test_f1: 0.6970
##################ITERATION #1 ****************************************
 epoch: 0, train_loss: 1.0906, test_loss: 1.0957, test_f1: 0.3488
 epoch: 1, train_loss: 1.0027, test_loss: 1.0366, test_f1: 0.4924
 epoch: 2, train_loss: 0.9731, test_loss: 1.2183, test_f1: 0.3661
 epoch: 3, train_loss: 0.9525, test_loss: 1.0108, test_f1: 0.5259
 epoch: 4, train_loss: 0.9302, test_loss: 0.8990, test_f1: 0.5570
 epoch: 5, train_loss: 0.9132, test_loss: 1.0517, test_f1: 0.4589
 epoch: 6, train_loss: 0.9142, test_loss: 0.9160, test_f1: 0.5038
 epoch: 7, train_loss: 0.8994, test_loss: 0.8564, test_f1: 0.5355
 epoch: 8, train_loss: 0.8853, test_loss: 1.0031, test_f1: 0.5564
 epoch: 9, train_loss: 0.8604, test_loss: 0.9361, test_f1: 0.5822
 epoch: 10, train_loss: 0.8569, test_loss: 0.8063, test_f1: 0.5661
 epoch: 11, train_loss: 0.8432, test_loss: 0.8969, test_f1: 0.5341
 epoch: 12, train_loss: 0.8387, test_loss: 0.9292, test_f1: 0.5728
 epoch: 13, train_loss: 0.8398, test_loss: 0.8893, test_f1: 0.5531
 epoch: 14, train_loss: 0.8408, test_loss: 1.1135, test_f1: 0.4758
 epoch: 15, train_loss: 0.8334, test_loss: 0.9406, test_f1: 0.5921
 epoch: 16, train_loss: 0.8220, test_loss: 0.9719, test_f1: 0.5685
 epoch: 17, train_loss: 0.8141, test_loss: 0.9193, test_f1: 0.5647
 epoch: 18, train_loss: 0.8032, test_loss: 0.9008, test_f1: 0.5710
 epoch: 19, train_loss: 0.8080, test_loss: 0.8946, test_f1: 0.5827
 epoch: 20, train_loss: 0.7975, test_loss: 0.8932, test_f1: 0.5779
 epoch: 21, train_loss: 0.7954, test_loss: 0.8876, test_f1: 0.6054
 epoch: 22, train_loss: 0.7817, test_loss: 0.7973, test_f1: 0.6534
 epoch: 23, train_loss: 0.7589, test_loss: 0.8025, test_f1: 0.6289
 epoch: 24, train_loss: 0.7609, test_loss: 0.8608, test_f1: 0.5749
 epoch: 25, train_loss: 0.7626, test_loss: 0.8428, test_f1: 0.6503
 epoch: 26, train_loss: 0.7626, test_loss: 0.8964, test_f1: 0.5907
 epoch: 27, train_loss: 0.7622, test_loss: 0.8899, test_f1: 0.5802
 epoch: 28, train_loss: 0.7491, test_loss: 0.8771, test_f1: 0.6190
 epoch: 29, train_loss: 0.7580, test_loss: 0.9075, test_f1: 0.5770
 epoch: 30, train_loss: 0.7536, test_loss: 0.8837, test_f1: 0.5831
 epoch: 31, train_loss: 0.7560, test_loss: 0.8351, test_f1: 0.6136
 epoch: 32, train_loss: 0.7422, test_loss: 0.8176, test_f1: 0.6057
 epoch: 33, train_loss: 0.7141, test_loss: 0.8587, test_f1: 0.5943
 epoch: 34, train_loss: 0.7393, test_loss: 0.8773, test_f1: 0.6018
 epoch: 35, train_loss: 0.7369, test_loss: 0.8103, test_f1: 0.6322
 epoch: 36, train_loss: 0.7178, test_loss: 0.7860, test_f1: 0.6210
 epoch: 37, train_loss: 0.7435, test_loss: 0.8375, test_f1: 0.6329
 epoch: 38, train_loss: 0.7153, test_loss: 0.7709, test_f1: 0.6222
 epoch: 39, train_loss: 0.7131, test_loss: 0.9037, test_f1: 0.5777
 epoch: 40, train_loss: 0.7245, test_loss: 0.7435, test_f1: 0.6714
 epoch: 41, train_loss: 0.6937, test_loss: 0.8531, test_f1: 0.6113
 epoch: 42, train_loss: 0.7234, test_loss: 0.8229, test_f1: 0.6596
 epoch: 43, train_loss: 0.6803, test_loss: 0.8783, test_f1: 0.6419
 epoch: 44, train_loss: 0.6905, test_loss: 0.8298, test_f1: 0.6540
 epoch: 45, train_loss: 0.7138, test_loss: 0.8167, test_f1: 0.6581
 epoch: 46, train_loss: 0.6807, test_loss: 0.8100, test_f1: 0.6887
 epoch: 47, train_loss: 0.6861, test_loss: 0.8452, test_f1: 0.6254
 epoch: 48, train_loss: 0.7001, test_loss: 1.0063, test_f1: 0.6028
 epoch: 49, train_loss: 0.6891, test_loss: 0.8692, test_f1: 0.6448
 epoch: 50, train_loss: 0.6858, test_loss: 0.8010, test_f1: 0.6576
 epoch: 51, train_loss: 0.6515, test_loss: 0.8111, test_f1: 0.6823
 epoch: 52, train_loss: 0.6365, test_loss: 0.8119, test_f1: 0.6554
 epoch: 53, train_loss: 0.6235, test_loss: 0.8485, test_f1: 0.6710
 epoch: 54, train_loss: 0.6147, test_loss: 0.7787, test_f1: 0.6483
 epoch: 55, train_loss: 0.6227, test_loss: 0.8124, test_f1: 0.6554
 epoch: 56, train_loss: 0.6244, test_loss: 0.7703, test_f1: 0.6709
 epoch: 57, train_loss: 0.6164, test_loss: 0.8717, test_f1: 0.6591
 epoch: 58, train_loss: 0.6012, test_loss: 0.8664, test_f1: 0.6629
 epoch: 59, train_loss: 0.5880, test_loss: 0.8244, test_f1: 0.6860
 epoch: 60, train_loss: 0.6146, test_loss: 0.8184, test_f1: 0.6787
 epoch: 61, train_loss: 0.6050, test_loss: 0.8372, test_f1: 0.6508
 epoch: 62, train_loss: 0.6006, test_loss: 0.8305, test_f1: 0.6493
 epoch: 63, train_loss: 0.6088, test_loss: 0.8772, test_f1: 0.6461
 epoch: 64, train_loss: 0.5871, test_loss: 0.8816, test_f1: 0.6646
 epoch: 65, train_loss: 0.5924, test_loss: 0.8622, test_f1: 0.6451
 epoch: 66, train_loss: 0.6058, test_loss: 0.9023, test_f1: 0.7067
 epoch: 67, train_loss: 0.5769, test_loss: 0.8269, test_f1: 0.6802
 epoch: 68, train_loss: 0.5714, test_loss: 0.9062, test_f1: 0.6181
 epoch: 69, train_loss: 0.5771, test_loss: 0.8434, test_f1: 0.6485
 epoch: 70, train_loss: 0.5842, test_loss: 0.8529, test_f1: 0.6442
 epoch: 71, train_loss: 0.5714, test_loss: 0.8549, test_f1: 0.6806
 epoch: 72, train_loss: 0.5920, test_loss: 0.8582, test_f1: 0.6645
 epoch: 73, train_loss: 0.5808, test_loss: 0.8107, test_f1: 0.6538
 epoch: 74, train_loss: 0.5769, test_loss: 0.8455, test_f1: 0.6607
 epoch: 75, train_loss: 0.5799, test_loss: 0.9117, test_f1: 0.6413
 epoch: 76, train_loss: 0.5574, test_loss: 0.8311, test_f1: 0.6814
 epoch: 77, train_loss: 0.5529, test_loss: 0.9251, test_f1: 0.6438
 epoch: 78, train_loss: 0.5533, test_loss: 0.8626, test_f1: 0.6145
 epoch: 79, train_loss: 0.5462, test_loss: 0.9367, test_f1: 0.6456
 epoch: 80, train_loss: 0.5697, test_loss: 0.9320, test_f1: 0.6251
 epoch: 81, train_loss: 0.5631, test_loss: 0.8569, test_f1: 0.6531
 epoch: 82, train_loss: 0.5597, test_loss: 0.9647, test_f1: 0.6467
 epoch: 83, train_loss: 0.5459, test_loss: 0.8697, test_f1: 0.6649
 epoch: 84, train_loss: 0.5473, test_loss: 0.9456, test_f1: 0.6556
 epoch: 85, train_loss: 0.5265, test_loss: 0.8772, test_f1: 0.6758
 epoch: 86, train_loss: 0.5423, test_loss: 0.9204, test_f1: 0.6640
 epoch: 87, train_loss: 0.5333, test_loss: 0.9300, test_f1: 0.6773
 epoch: 88, train_loss: 0.5466, test_loss: 0.9351, test_f1: 0.6614
 epoch: 89, train_loss: 0.5312, test_loss: 0.8631, test_f1: 0.6747
 epoch: 90, train_loss: 0.5396, test_loss: 0.9264, test_f1: 0.6673
 epoch: 91, train_loss: 0.5253, test_loss: 0.9125, test_f1: 0.6817
 epoch: 92, train_loss: 0.5391, test_loss: 0.9784, test_f1: 0.6638
 epoch: 93, train_loss: 0.5219, test_loss: 0.8948, test_f1: 0.6641
 epoch: 94, train_loss: 0.5364, test_loss: 0.8656, test_f1: 0.6585
 epoch: 95, train_loss: 0.5277, test_loss: 0.9017, test_f1: 0.6654
 epoch: 96, train_loss: 0.5143, test_loss: 0.9050, test_f1: 0.6441
 epoch: 97, train_loss: 0.5374, test_loss: 0.7721, test_f1: 0.6691
 epoch: 98, train_loss: 0.5173, test_loss: 0.8847, test_f1: 0.6684
 epoch: 99, train_loss: 0.5282, test_loss: 0.8922, test_f1: 0.6538
##################ITERATION #2 ****************************************
 epoch: 0, train_loss: 1.1353, test_loss: 1.0620, test_f1: 0.3600
 epoch: 1, train_loss: 1.0153, test_loss: 1.0070, test_f1: 0.4373
 epoch: 2, train_loss: 0.9826, test_loss: 1.0011, test_f1: 0.4739
 epoch: 3, train_loss: 0.9723, test_loss: 1.0916, test_f1: 0.4177
 epoch: 4, train_loss: 0.9433, test_loss: 1.0164, test_f1: 0.4551
 epoch: 5, train_loss: 0.9387, test_loss: 0.9488, test_f1: 0.4877
 epoch: 6, train_loss: 0.9142, test_loss: 0.9973, test_f1: 0.5179
 epoch: 7, train_loss: 0.9002, test_loss: 1.0674, test_f1: 0.4555
 epoch: 8, train_loss: 0.8949, test_loss: 1.0319, test_f1: 0.5012
 epoch: 9, train_loss: 0.8797, test_loss: 0.8963, test_f1: 0.5430
 epoch: 10, train_loss: 0.8702, test_loss: 1.0708, test_f1: 0.4903
 epoch: 11, train_loss: 0.8651, test_loss: 1.0148, test_f1: 0.4831
 epoch: 12, train_loss: 0.8553, test_loss: 0.8889, test_f1: 0.5475
 epoch: 13, train_loss: 0.8409, test_loss: 0.8557, test_f1: 0.5893
 epoch: 14, train_loss: 0.8248, test_loss: 0.8561, test_f1: 0.5510
 epoch: 15, train_loss: 0.8272, test_loss: 0.8928, test_f1: 0.5573
 epoch: 16, train_loss: 0.8203, test_loss: 0.9203, test_f1: 0.5832
 epoch: 17, train_loss: 0.8058, test_loss: 1.0225, test_f1: 0.5762
 epoch: 18, train_loss: 0.8022, test_loss: 0.7853, test_f1: 0.6053
 epoch: 19, train_loss: 0.8057, test_loss: 1.0323, test_f1: 0.5095
 epoch: 20, train_loss: 0.7993, test_loss: 0.8281, test_f1: 0.5562
 epoch: 21, train_loss: 0.7795, test_loss: 0.9174, test_f1: 0.5704
 epoch: 22, train_loss: 0.8003, test_loss: 0.9332, test_f1: 0.6089
 epoch: 23, train_loss: 0.7868, test_loss: 0.8309, test_f1: 0.5712
 epoch: 24, train_loss: 0.7639, test_loss: 0.9772, test_f1: 0.5845
 epoch: 25, train_loss: 0.7602, test_loss: 0.8395, test_f1: 0.6174
 epoch: 26, train_loss: 0.7834, test_loss: 0.8706, test_f1: 0.6225
 epoch: 27, train_loss: 0.7602, test_loss: 0.9316, test_f1: 0.5903
 epoch: 28, train_loss: 0.7416, test_loss: 0.8951, test_f1: 0.5885
 epoch: 29, train_loss: 0.7306, test_loss: 1.0578, test_f1: 0.6370
 epoch: 30, train_loss: 0.7482, test_loss: 1.0299, test_f1: 0.5990
 epoch: 31, train_loss: 0.7525, test_loss: 0.7888, test_f1: 0.5936
 epoch: 32, train_loss: 0.7389, test_loss: 0.9218, test_f1: 0.6443
 epoch: 33, train_loss: 0.7234, test_loss: 0.9804, test_f1: 0.5906
 epoch: 34, train_loss: 0.7354, test_loss: 0.9739, test_f1: 0.5774
 epoch: 35, train_loss: 0.7338, test_loss: 1.0386, test_f1: 0.5480
 epoch: 36, train_loss: 0.7179, test_loss: 1.0079, test_f1: 0.6386
 epoch: 37, train_loss: 0.7258, test_loss: 0.8391, test_f1: 0.6148
 epoch: 38, train_loss: 0.7177, test_loss: 0.9560, test_f1: 0.6009
 epoch: 39, train_loss: 0.7148, test_loss: 0.9419, test_f1: 0.6449
 epoch: 40, train_loss: 0.7046, test_loss: 1.1056, test_f1: 0.6259
 epoch: 41, train_loss: 0.6943, test_loss: 0.9466, test_f1: 0.6303
 epoch: 42, train_loss: 0.6923, test_loss: 1.2192, test_f1: 0.6008
 epoch: 43, train_loss: 0.6904, test_loss: 0.9728, test_f1: 0.6006
 epoch: 44, train_loss: 0.7025, test_loss: 1.1447, test_f1: 0.5944
 epoch: 45, train_loss: 0.7079, test_loss: 0.8859, test_f1: 0.6122
 epoch: 46, train_loss: 0.6866, test_loss: 0.9495, test_f1: 0.5987
 epoch: 47, train_loss: 0.6868, test_loss: 0.9430, test_f1: 0.6479
 epoch: 48, train_loss: 0.6838, test_loss: 0.9922, test_f1: 0.6289
 epoch: 49, train_loss: 0.6689, test_loss: 0.9502, test_f1: 0.6216
 epoch: 50, train_loss: 0.7024, test_loss: 0.8757, test_f1: 0.5879
 epoch: 51, train_loss: 0.6724, test_loss: 0.9428, test_f1: 0.6586
 epoch: 52, train_loss: 0.6302, test_loss: 1.0119, test_f1: 0.6688
 epoch: 53, train_loss: 0.6373, test_loss: 1.0035, test_f1: 0.6485
 epoch: 54, train_loss: 0.6236, test_loss: 1.0193, test_f1: 0.6227
 epoch: 55, train_loss: 0.6297, test_loss: 1.0218, test_f1: 0.6916
 epoch: 56, train_loss: 0.6099, test_loss: 1.0702, test_f1: 0.6741
 epoch: 57, train_loss: 0.6144, test_loss: 1.0306, test_f1: 0.6638
 epoch: 58, train_loss: 0.6218, test_loss: 0.9750, test_f1: 0.6677
 epoch: 59, train_loss: 0.5955, test_loss: 1.1321, test_f1: 0.6364
 epoch: 60, train_loss: 0.6133, test_loss: 1.1230, test_f1: 0.6580
 epoch: 61, train_loss: 0.6133, test_loss: 1.1345, test_f1: 0.6887
 epoch: 62, train_loss: 0.6132, test_loss: 1.0053, test_f1: 0.6482
 epoch: 63, train_loss: 0.6043, test_loss: 1.1473, test_f1: 0.6607
 epoch: 64, train_loss: 0.5969, test_loss: 1.0052, test_f1: 0.6997
 epoch: 65, train_loss: 0.6027, test_loss: 1.0276, test_f1: 0.6685
 epoch: 66, train_loss: 0.6183, test_loss: 1.1792, test_f1: 0.6290
 epoch: 67, train_loss: 0.5935, test_loss: 1.1918, test_f1: 0.6581
 epoch: 68, train_loss: 0.6163, test_loss: 1.1561, test_f1: 0.6901
 epoch: 69, train_loss: 0.5918, test_loss: 1.2484, test_f1: 0.6439
 epoch: 70, train_loss: 0.5932, test_loss: 1.1504, test_f1: 0.6602
 epoch: 71, train_loss: 0.5951, test_loss: 1.0824, test_f1: 0.6701
 epoch: 72, train_loss: 0.5809, test_loss: 0.9131, test_f1: 0.6706
 epoch: 73, train_loss: 0.5951, test_loss: 1.1427, test_f1: 0.6594
 epoch: 74, train_loss: 0.5864, test_loss: 1.1321, test_f1: 0.6953
 epoch: 75, train_loss: 0.5758, test_loss: 0.9473, test_f1: 0.6548
 epoch: 76, train_loss: 0.5833, test_loss: 0.9372, test_f1: 0.6797
 epoch: 77, train_loss: 0.5761, test_loss: 1.1821, test_f1: 0.6484
 epoch: 78, train_loss: 0.5643, test_loss: 1.1187, test_f1: 0.6812
 epoch: 79, train_loss: 0.5769, test_loss: 1.1278, test_f1: 0.6671
 epoch: 80, train_loss: 0.5751, test_loss: 1.0070, test_f1: 0.6859
 epoch: 81, train_loss: 0.5602, test_loss: 1.1847, test_f1: 0.6965
 epoch: 82, train_loss: 0.5548, test_loss: 1.1587, test_f1: 0.6782
 epoch: 83, train_loss: 0.5572, test_loss: 1.0607, test_f1: 0.6656
 epoch: 84, train_loss: 0.5563, test_loss: 1.2824, test_f1: 0.6572
 epoch: 85, train_loss: 0.5532, test_loss: 1.0861, test_f1: 0.6615
 epoch: 86, train_loss: 0.5505, test_loss: 1.0682, test_f1: 0.6860
 epoch: 87, train_loss: 0.5677, test_loss: 1.1520, test_f1: 0.6777
 epoch: 88, train_loss: 0.5513, test_loss: 1.1778, test_f1: 0.6837
 epoch: 89, train_loss: 0.5632, test_loss: 1.0166, test_f1: 0.6894
 epoch: 90, train_loss: 0.5654, test_loss: 1.1028, test_f1: 0.6731
 epoch: 91, train_loss: 0.5478, test_loss: 1.1097, test_f1: 0.6706
 epoch: 92, train_loss: 0.5373, test_loss: 1.1603, test_f1: 0.6739
 epoch: 93, train_loss: 0.5432, test_loss: 1.3904, test_f1: 0.6481
 epoch: 94, train_loss: 0.5459, test_loss: 1.1076, test_f1: 0.6920
 epoch: 95, train_loss: 0.5660, test_loss: 1.0994, test_f1: 0.6690
 epoch: 96, train_loss: 0.5527, test_loss: 1.0694, test_f1: 0.6762
 epoch: 97, train_loss: 0.5464, test_loss: 1.1133, test_f1: 0.6615
 epoch: 98, train_loss: 0.5422, test_loss: 1.1568, test_f1: 0.6775
 epoch: 99, train_loss: 0.5472, test_loss: 1.2519, test_f1: 0.6766
##################ITERATION #3 ****************************************
 epoch: 0, train_loss: 1.0964, test_loss: 1.0130, test_f1: 0.4171
 epoch: 1, train_loss: 0.9790, test_loss: 0.9576, test_f1: 0.4865
 epoch: 2, train_loss: 0.9623, test_loss: 0.9876, test_f1: 0.5229
 epoch: 3, train_loss: 0.9350, test_loss: 0.9265, test_f1: 0.5146
 epoch: 4, train_loss: 0.9153, test_loss: 0.9277, test_f1: 0.4714
 epoch: 5, train_loss: 0.9106, test_loss: 1.1602, test_f1: 0.4648
 epoch: 6, train_loss: 0.8972, test_loss: 0.9070, test_f1: 0.5398
 epoch: 7, train_loss: 0.8777, test_loss: 0.9527, test_f1: 0.5275
 epoch: 8, train_loss: 0.8685, test_loss: 0.9135, test_f1: 0.5228
 epoch: 9, train_loss: 0.8624, test_loss: 0.9281, test_f1: 0.5355
 epoch: 10, train_loss: 0.8549, test_loss: 0.8997, test_f1: 0.5588
 epoch: 11, train_loss: 0.8330, test_loss: 1.0038, test_f1: 0.5292
 epoch: 12, train_loss: 0.8533, test_loss: 0.8983, test_f1: 0.5299
 epoch: 13, train_loss: 0.8177, test_loss: 0.9030, test_f1: 0.5860
 epoch: 14, train_loss: 0.8262, test_loss: 0.8709, test_f1: 0.5532
 epoch: 15, train_loss: 0.8341, test_loss: 0.9189, test_f1: 0.6379
 epoch: 16, train_loss: 0.8235, test_loss: 0.8957, test_f1: 0.5931
 epoch: 17, train_loss: 0.8077, test_loss: 0.8679, test_f1: 0.5678
 epoch: 18, train_loss: 0.7930, test_loss: 0.8437, test_f1: 0.5724
 epoch: 19, train_loss: 0.8073, test_loss: 0.8872, test_f1: 0.5741
 epoch: 20, train_loss: 0.8074, test_loss: 0.8663, test_f1: 0.5433
 epoch: 21, train_loss: 0.8067, test_loss: 0.9007, test_f1: 0.5507
 epoch: 22, train_loss: 0.7889, test_loss: 1.0706, test_f1: 0.4861
 epoch: 23, train_loss: 0.7944, test_loss: 0.8374, test_f1: 0.6009
 epoch: 24, train_loss: 0.7961, test_loss: 0.8683, test_f1: 0.6246
 epoch: 25, train_loss: 0.7888, test_loss: 0.8117, test_f1: 0.6119
 epoch: 26, train_loss: 0.7744, test_loss: 0.9724, test_f1: 0.5454
 epoch: 27, train_loss: 0.7734, test_loss: 0.8773, test_f1: 0.5860
 epoch: 28, train_loss: 0.7889, test_loss: 0.8422, test_f1: 0.5754
 epoch: 29, train_loss: 0.7724, test_loss: 0.8216, test_f1: 0.6474
 epoch: 30, train_loss: 0.7694, test_loss: 0.8595, test_f1: 0.6378
 epoch: 31, train_loss: 0.7723, test_loss: 0.8089, test_f1: 0.6238
 epoch: 32, train_loss: 0.7569, test_loss: 0.8511, test_f1: 0.5797
 epoch: 33, train_loss: 0.7723, test_loss: 0.8213, test_f1: 0.5944
 epoch: 34, train_loss: 0.7496, test_loss: 0.7563, test_f1: 0.6038
 epoch: 35, train_loss: 0.7468, test_loss: 0.8153, test_f1: 0.6067
 epoch: 36, train_loss: 0.7576, test_loss: 0.8004, test_f1: 0.6480
 epoch: 37, train_loss: 0.7418, test_loss: 0.8718, test_f1: 0.6505
 epoch: 38, train_loss: 0.7288, test_loss: 0.7954, test_f1: 0.6622
 epoch: 39, train_loss: 0.7339, test_loss: 0.8346, test_f1: 0.6286
 epoch: 40, train_loss: 0.7314, test_loss: 0.8183, test_f1: 0.6124
 epoch: 41, train_loss: 0.7206, test_loss: 0.7803, test_f1: 0.6319
 epoch: 42, train_loss: 0.7090, test_loss: 0.7654, test_f1: 0.6287
 epoch: 43, train_loss: 0.7286, test_loss: 0.8746, test_f1: 0.6309
 epoch: 44, train_loss: 0.7135, test_loss: 0.8253, test_f1: 0.6012
 epoch: 45, train_loss: 0.7057, test_loss: 0.7982, test_f1: 0.6326
 epoch: 46, train_loss: 0.7029, test_loss: 0.9207, test_f1: 0.6278
 epoch: 47, train_loss: 0.7229, test_loss: 0.8208, test_f1: 0.6406
 epoch: 48, train_loss: 0.7007, test_loss: 0.8699, test_f1: 0.5851
 epoch: 49, train_loss: 0.6938, test_loss: 0.9656, test_f1: 0.5953
 epoch: 50, train_loss: 0.6782, test_loss: 0.8652, test_f1: 0.6621
 epoch: 51, train_loss: 0.6640, test_loss: 0.7989, test_f1: 0.6542
 epoch: 52, train_loss: 0.6414, test_loss: 0.8610, test_f1: 0.6298
 epoch: 53, train_loss: 0.6463, test_loss: 0.8108, test_f1: 0.6732
 epoch: 54, train_loss: 0.6317, test_loss: 0.8262, test_f1: 0.6636
 epoch: 55, train_loss: 0.6424, test_loss: 0.8750, test_f1: 0.6725
 epoch: 56, train_loss: 0.6168, test_loss: 0.8566, test_f1: 0.6638
 epoch: 57, train_loss: 0.6186, test_loss: 0.8642, test_f1: 0.6579
 epoch: 58, train_loss: 0.6299, test_loss: 0.8944, test_f1: 0.6504
 epoch: 59, train_loss: 0.6332, test_loss: 0.8866, test_f1: 0.6561
 epoch: 60, train_loss: 0.6220, test_loss: 0.8888, test_f1: 0.6276
 epoch: 61, train_loss: 0.6047, test_loss: 0.9097, test_f1: 0.6313
 epoch: 62, train_loss: 0.6139, test_loss: 0.8750, test_f1: 0.6696
 epoch: 63, train_loss: 0.6122, test_loss: 0.8931, test_f1: 0.6409
 epoch: 64, train_loss: 0.6092, test_loss: 0.8600, test_f1: 0.6461
 epoch: 65, train_loss: 0.6103, test_loss: 0.8906, test_f1: 0.6698
 epoch: 66, train_loss: 0.5959, test_loss: 0.8931, test_f1: 0.6875
 epoch: 67, train_loss: 0.5819, test_loss: 0.9235, test_f1: 0.6570
 epoch: 68, train_loss: 0.5962, test_loss: 0.8976, test_f1: 0.6420
 epoch: 69, train_loss: 0.5832, test_loss: 0.8920, test_f1: 0.6718
 epoch: 70, train_loss: 0.5967, test_loss: 0.9079, test_f1: 0.6691
 epoch: 71, train_loss: 0.5968, test_loss: 0.9020, test_f1: 0.6466
 epoch: 72, train_loss: 0.5830, test_loss: 0.9135, test_f1: 0.6530
 epoch: 73, train_loss: 0.5915, test_loss: 0.9528, test_f1: 0.6332
 epoch: 74, train_loss: 0.5839, test_loss: 0.9504, test_f1: 0.6402
 epoch: 75, train_loss: 0.5690, test_loss: 0.9683, test_f1: 0.6472
 epoch: 76, train_loss: 0.5990, test_loss: 0.8817, test_f1: 0.6555
 epoch: 77, train_loss: 0.5720, test_loss: 0.8851, test_f1: 0.6777
 epoch: 78, train_loss: 0.5765, test_loss: 0.9501, test_f1: 0.6660
 epoch: 79, train_loss: 0.5709, test_loss: 0.9305, test_f1: 0.6685
 epoch: 80, train_loss: 0.5644, test_loss: 0.9643, test_f1: 0.6516
 epoch: 81, train_loss: 0.5650, test_loss: 0.9184, test_f1: 0.6732
 epoch: 82, train_loss: 0.5706, test_loss: 0.9798, test_f1: 0.6761
 epoch: 83, train_loss: 0.5603, test_loss: 0.9195, test_f1: 0.6673
 epoch: 84, train_loss: 0.5642, test_loss: 0.9784, test_f1: 0.6549
 epoch: 85, train_loss: 0.5748, test_loss: 1.0204, test_f1: 0.6761
 epoch: 86, train_loss: 0.5491, test_loss: 1.0717, test_f1: 0.6714
 epoch: 87, train_loss: 0.5521, test_loss: 1.0074, test_f1: 0.6573
 epoch: 88, train_loss: 0.5715, test_loss: 0.9366, test_f1: 0.6574
 epoch: 89, train_loss: 0.5605, test_loss: 1.0473, test_f1: 0.6272
 epoch: 90, train_loss: 0.5634, test_loss: 0.9979, test_f1: 0.6548
 epoch: 91, train_loss: 0.5661, test_loss: 0.9628, test_f1: 0.6569
 epoch: 92, train_loss: 0.5368, test_loss: 0.9500, test_f1: 0.6694
 epoch: 93, train_loss: 0.5436, test_loss: 0.9678, test_f1: 0.6687
 epoch: 94, train_loss: 0.5377, test_loss: 0.9503, test_f1: 0.6786
 epoch: 95, train_loss: 0.5444, test_loss: 0.9866, test_f1: 0.6603
 epoch: 96, train_loss: 0.5486, test_loss: 1.0330, test_f1: 0.6579
 epoch: 97, train_loss: 0.5564, test_loss: 1.0365, test_f1: 0.6603
 epoch: 98, train_loss: 0.5357, test_loss: 1.0213, test_f1: 0.6489
 epoch: 99, train_loss: 0.5512, test_loss: 0.9680, test_f1: 0.6861
##################ITERATION #4 ****************************************
 epoch: 0, train_loss: 1.1190, test_loss: 1.1535, test_f1: 0.4437
 epoch: 1, train_loss: 0.9933, test_loss: 1.0873, test_f1: 0.4828
 epoch: 2, train_loss: 0.9736, test_loss: 0.9752, test_f1: 0.5104
 epoch: 3, train_loss: 0.9322, test_loss: 0.9363, test_f1: 0.5056
 epoch: 4, train_loss: 0.9150, test_loss: 0.8852, test_f1: 0.5747
 epoch: 5, train_loss: 0.9100, test_loss: 0.9939, test_f1: 0.4985
 epoch: 6, train_loss: 0.8798, test_loss: 0.9727, test_f1: 0.5171
 epoch: 7, train_loss: 0.8939, test_loss: 0.8202, test_f1: 0.5490
 epoch: 8, train_loss: 0.8648, test_loss: 0.8574, test_f1: 0.5438
 epoch: 9, train_loss: 0.8810, test_loss: 0.8636, test_f1: 0.5580
 epoch: 10, train_loss: 0.8605, test_loss: 0.8597, test_f1: 0.5330
 epoch: 11, train_loss: 0.8691, test_loss: 0.8416, test_f1: 0.5589
 epoch: 12, train_loss: 0.8452, test_loss: 1.2232, test_f1: 0.3865
 epoch: 13, train_loss: 0.8287, test_loss: 0.7754, test_f1: 0.6239
 epoch: 14, train_loss: 0.8244, test_loss: 0.7829, test_f1: 0.5741
 epoch: 15, train_loss: 0.8244, test_loss: 0.7636, test_f1: 0.6557
 epoch: 16, train_loss: 0.8061, test_loss: 0.7292, test_f1: 0.6161
 epoch: 17, train_loss: 0.7969, test_loss: 1.0928, test_f1: 0.4637
 epoch: 18, train_loss: 0.8167, test_loss: 0.7956, test_f1: 0.6197
 epoch: 19, train_loss: 0.7913, test_loss: 0.7333, test_f1: 0.6028
 epoch: 20, train_loss: 0.7861, test_loss: 0.7318, test_f1: 0.6193
 epoch: 21, train_loss: 0.7706, test_loss: 0.8204, test_f1: 0.6097
 epoch: 22, train_loss: 0.7909, test_loss: 0.7958, test_f1: 0.5792
 epoch: 23, train_loss: 0.7713, test_loss: 0.8297, test_f1: 0.6158
 epoch: 24, train_loss: 0.7717, test_loss: 0.7398, test_f1: 0.5988
 epoch: 25, train_loss: 0.7589, test_loss: 0.7804, test_f1: 0.5937
 epoch: 26, train_loss: 0.7636, test_loss: 0.8365, test_f1: 0.6347
 epoch: 27, train_loss: 0.7549, test_loss: 0.7485, test_f1: 0.6217
 epoch: 28, train_loss: 0.7539, test_loss: 0.9060, test_f1: 0.5502
 epoch: 29, train_loss: 0.7706, test_loss: 0.8044, test_f1: 0.5937
 epoch: 30, train_loss: 0.7589, test_loss: 0.7589, test_f1: 0.6047
 epoch: 31, train_loss: 0.7487, test_loss: 0.7876, test_f1: 0.6228
 epoch: 32, train_loss: 0.7473, test_loss: 0.7800, test_f1: 0.6250
 epoch: 33, train_loss: 0.7213, test_loss: 0.8339, test_f1: 0.6269
 epoch: 34, train_loss: 0.7293, test_loss: 0.8646, test_f1: 0.5891
 epoch: 35, train_loss: 0.7350, test_loss: 0.7713, test_f1: 0.5951
 epoch: 36, train_loss: 0.7505, test_loss: 0.8615, test_f1: 0.5959
 epoch: 37, train_loss: 0.7346, test_loss: 0.7311, test_f1: 0.6241
 epoch: 38, train_loss: 0.7212, test_loss: 0.7497, test_f1: 0.6285
 epoch: 39, train_loss: 0.7125, test_loss: 0.8261, test_f1: 0.6050
 epoch: 40, train_loss: 0.7295, test_loss: 0.8144, test_f1: 0.6245
 epoch: 41, train_loss: 0.7377, test_loss: 0.7740, test_f1: 0.6263
 epoch: 42, train_loss: 0.7051, test_loss: 0.8289, test_f1: 0.6062
 epoch: 43, train_loss: 0.7023, test_loss: 0.7820, test_f1: 0.6301
 epoch: 44, train_loss: 0.7095, test_loss: 0.7657, test_f1: 0.6517
 epoch: 45, train_loss: 0.7026, test_loss: 0.8038, test_f1: 0.6548
 epoch: 46, train_loss: 0.6767, test_loss: 0.7911, test_f1: 0.6646
 epoch: 47, train_loss: 0.6764, test_loss: 0.7857, test_f1: 0.6688
 epoch: 48, train_loss: 0.6839, test_loss: 0.8474, test_f1: 0.5816
 epoch: 49, train_loss: 0.7103, test_loss: 0.8511, test_f1: 0.6434
 epoch: 50, train_loss: 0.6864, test_loss: 0.9022, test_f1: 0.6399
 epoch: 51, train_loss: 0.6642, test_loss: 0.7544, test_f1: 0.6707
 epoch: 52, train_loss: 0.6343, test_loss: 0.8336, test_f1: 0.6686
 epoch: 53, train_loss: 0.6371, test_loss: 0.8066, test_f1: 0.6674
 epoch: 54, train_loss: 0.6454, test_loss: 0.8625, test_f1: 0.6795
 epoch: 55, train_loss: 0.6260, test_loss: 0.8124, test_f1: 0.6585
 epoch: 56, train_loss: 0.6291, test_loss: 0.7816, test_f1: 0.6437
 epoch: 57, train_loss: 0.6140, test_loss: 0.8028, test_f1: 0.6726
 epoch: 58, train_loss: 0.6186, test_loss: 0.7955, test_f1: 0.6457
 epoch: 59, train_loss: 0.6128, test_loss: 0.8182, test_f1: 0.6801
 epoch: 60, train_loss: 0.6143, test_loss: 0.8332, test_f1: 0.6580
 epoch: 61, train_loss: 0.6221, test_loss: 0.8041, test_f1: 0.6642
 epoch: 62, train_loss: 0.6062, test_loss: 0.7804, test_f1: 0.6792
 epoch: 63, train_loss: 0.6068, test_loss: 0.8564, test_f1: 0.6541
 epoch: 64, train_loss: 0.6093, test_loss: 0.6942, test_f1: 0.6748
 epoch: 65, train_loss: 0.5868, test_loss: 0.8223, test_f1: 0.6511
 epoch: 66, train_loss: 0.6070, test_loss: 0.7673, test_f1: 0.6570
 epoch: 67, train_loss: 0.6135, test_loss: 0.9042, test_f1: 0.6429
 epoch: 68, train_loss: 0.5946, test_loss: 0.6773, test_f1: 0.6924
 epoch: 69, train_loss: 0.6066, test_loss: 0.8079, test_f1: 0.6679
 epoch: 70, train_loss: 0.5784, test_loss: 0.8038, test_f1: 0.6814
 epoch: 71, train_loss: 0.5972, test_loss: 0.8217, test_f1: 0.6778
 epoch: 72, train_loss: 0.5842, test_loss: 0.8961, test_f1: 0.6695
 epoch: 73, train_loss: 0.5941, test_loss: 0.8617, test_f1: 0.6832
 epoch: 74, train_loss: 0.5835, test_loss: 0.9052, test_f1: 0.6741
 epoch: 75, train_loss: 0.5915, test_loss: 0.8259, test_f1: 0.6674
 epoch: 76, train_loss: 0.5671, test_loss: 0.8418, test_f1: 0.6713
 epoch: 77, train_loss: 0.5823, test_loss: 0.8282, test_f1: 0.6541
 epoch: 78, train_loss: 0.5801, test_loss: 0.8177, test_f1: 0.6772
 epoch: 79, train_loss: 0.5783, test_loss: 0.8374, test_f1: 0.6840
 epoch: 80, train_loss: 0.5808, test_loss: 0.8630, test_f1: 0.6632
 epoch: 81, train_loss: 0.5893, test_loss: 0.8388, test_f1: 0.6518
 epoch: 82, train_loss: 0.5677, test_loss: 0.9461, test_f1: 0.6524
 epoch: 83, train_loss: 0.5884, test_loss: 0.8065, test_f1: 0.6679
 epoch: 84, train_loss: 0.5889, test_loss: 0.7978, test_f1: 0.6565
 epoch: 85, train_loss: 0.5589, test_loss: 0.8360, test_f1: 0.6851
 epoch: 86, train_loss: 0.5689, test_loss: 0.8095, test_f1: 0.7072
 epoch: 87, train_loss: 0.5691, test_loss: 0.9594, test_f1: 0.6444
 epoch: 88, train_loss: 0.5653, test_loss: 0.8616, test_f1: 0.6773
 epoch: 89, train_loss: 0.5569, test_loss: 0.8930, test_f1: 0.6768
 epoch: 90, train_loss: 0.5535, test_loss: 1.0277, test_f1: 0.6675
 epoch: 91, train_loss: 0.5511, test_loss: 0.9720, test_f1: 0.6515
 epoch: 92, train_loss: 0.5492, test_loss: 0.8556, test_f1: 0.6787
 epoch: 93, train_loss: 0.5817, test_loss: 0.8432, test_f1: 0.6914
 epoch: 94, train_loss: 0.5569, test_loss: 0.9347, test_f1: 0.6589
 epoch: 95, train_loss: 0.5651, test_loss: 0.7379, test_f1: 0.6996
 epoch: 96, train_loss: 0.5609, test_loss: 0.7551, test_f1: 0.6751
 epoch: 97, train_loss: 0.5761, test_loss: 0.7809, test_f1: 0.6667
 epoch: 98, train_loss: 0.5564, test_loss: 0.8930, test_f1: 0.6767
 epoch: 99, train_loss: 0.5371, test_loss: 0.9537, test_f1: 0.6468
##################ITERATION #5 ****************************************
 epoch: 0, train_loss: 1.1340, test_loss: 1.0915, test_f1: 0.4826
 epoch: 1, train_loss: 0.9952, test_loss: 1.0839, test_f1: 0.4642
 epoch: 2, train_loss: 0.9649, test_loss: 0.9592, test_f1: 0.5178
 epoch: 3, train_loss: 0.9450, test_loss: 0.9404, test_f1: 0.5400
 epoch: 4, train_loss: 0.9131, test_loss: 0.8653, test_f1: 0.5625
 epoch: 5, train_loss: 0.9054, test_loss: 0.9031, test_f1: 0.5304
 epoch: 6, train_loss: 0.9111, test_loss: 0.9963, test_f1: 0.5190
 epoch: 7, train_loss: 0.8979, test_loss: 1.0227, test_f1: 0.5155
 epoch: 8, train_loss: 0.8905, test_loss: 0.9373, test_f1: 0.5443
 epoch: 9, train_loss: 0.8721, test_loss: 0.9938, test_f1: 0.5245
 epoch: 10, train_loss: 0.8602, test_loss: 0.8879, test_f1: 0.5629
 epoch: 11, train_loss: 0.8591, test_loss: 0.9580, test_f1: 0.5509
 epoch: 12, train_loss: 0.8551, test_loss: 0.8973, test_f1: 0.5482
 epoch: 13, train_loss: 0.8588, test_loss: 0.9096, test_f1: 0.5580
 epoch: 14, train_loss: 0.8326, test_loss: 0.9916, test_f1: 0.5463
 epoch: 15, train_loss: 0.8250, test_loss: 0.9599, test_f1: 0.5032
 epoch: 16, train_loss: 0.8268, test_loss: 0.8602, test_f1: 0.5919
 epoch: 17, train_loss: 0.8141, test_loss: 0.9230, test_f1: 0.5473
 epoch: 18, train_loss: 0.8108, test_loss: 0.9905, test_f1: 0.5478
 epoch: 19, train_loss: 0.7739, test_loss: 0.8238, test_f1: 0.5697
 epoch: 20, train_loss: 0.7954, test_loss: 0.9685, test_f1: 0.6185
 epoch: 21, train_loss: 0.7797, test_loss: 0.8722, test_f1: 0.6217
 epoch: 22, train_loss: 0.7851, test_loss: 0.8222, test_f1: 0.5747
 epoch: 23, train_loss: 0.7671, test_loss: 0.8658, test_f1: 0.5719
 epoch: 24, train_loss: 0.7554, test_loss: 0.8448, test_f1: 0.5673
 epoch: 25, train_loss: 0.7709, test_loss: 0.9678, test_f1: 0.5880
 epoch: 26, train_loss: 0.7691, test_loss: 0.8958, test_f1: 0.5411
 epoch: 27, train_loss: 0.7607, test_loss: 0.9569, test_f1: 0.6026
 epoch: 28, train_loss: 0.7530, test_loss: 0.8749, test_f1: 0.6515
 epoch: 29, train_loss: 0.7458, test_loss: 0.8960, test_f1: 0.6023
 epoch: 30, train_loss: 0.7451, test_loss: 0.8941, test_f1: 0.6205
 epoch: 31, train_loss: 0.7427, test_loss: 1.1261, test_f1: 0.5536
 epoch: 32, train_loss: 0.7471, test_loss: 0.9128, test_f1: 0.6265
 epoch: 33, train_loss: 0.7480, test_loss: 0.8422, test_f1: 0.6103
 epoch: 34, train_loss: 0.7372, test_loss: 0.8146, test_f1: 0.6376
 epoch: 35, train_loss: 0.7249, test_loss: 0.9200, test_f1: 0.5953
 epoch: 36, train_loss: 0.7255, test_loss: 0.9969, test_f1: 0.5745
 epoch: 37, train_loss: 0.7384, test_loss: 1.0344, test_f1: 0.6064
 epoch: 38, train_loss: 0.7381, test_loss: 0.8819, test_f1: 0.5937
 epoch: 39, train_loss: 0.7292, test_loss: 0.9546, test_f1: 0.5827
 epoch: 40, train_loss: 0.7181, test_loss: 0.9533, test_f1: 0.6304
 epoch: 41, train_loss: 0.7283, test_loss: 0.8465, test_f1: 0.6469
 epoch: 42, train_loss: 0.7271, test_loss: 0.9449, test_f1: 0.5929
 epoch: 43, train_loss: 0.7100, test_loss: 0.8998, test_f1: 0.6167
 epoch: 44, train_loss: 0.7065, test_loss: 0.9879, test_f1: 0.5647
 epoch: 45, train_loss: 0.7228, test_loss: 0.9588, test_f1: 0.6080
 epoch: 46, train_loss: 0.7062, test_loss: 0.8647, test_f1: 0.6270
 epoch: 47, train_loss: 0.6925, test_loss: 1.0504, test_f1: 0.6217
 epoch: 48, train_loss: 0.6923, test_loss: 0.8835, test_f1: 0.6263
 epoch: 49, train_loss: 0.7132, test_loss: 0.8786, test_f1: 0.6066
 epoch: 50, train_loss: 0.6802, test_loss: 0.8728, test_f1: 0.6436
 epoch: 51, train_loss: 0.6548, test_loss: 0.8855, test_f1: 0.6613
 epoch: 52, train_loss: 0.6443, test_loss: 0.9581, test_f1: 0.6538
 epoch: 53, train_loss: 0.6433, test_loss: 0.9591, test_f1: 0.6378
 epoch: 54, train_loss: 0.6302, test_loss: 0.9308, test_f1: 0.6626
 epoch: 55, train_loss: 0.6303, test_loss: 0.9384, test_f1: 0.6586
 epoch: 56, train_loss: 0.6209, test_loss: 0.9297, test_f1: 0.6450
 epoch: 57, train_loss: 0.6297, test_loss: 0.9179, test_f1: 0.6945
 epoch: 58, train_loss: 0.6276, test_loss: 1.0065, test_f1: 0.6581
 epoch: 59, train_loss: 0.5978, test_loss: 0.9415, test_f1: 0.6548
 epoch: 60, train_loss: 0.6136, test_loss: 0.9942, test_f1: 0.6771
 epoch: 61, train_loss: 0.6154, test_loss: 0.9435, test_f1: 0.6495
 epoch: 62, train_loss: 0.5892, test_loss: 0.9476, test_f1: 0.6860
 epoch: 63, train_loss: 0.6062, test_loss: 0.9769, test_f1: 0.6702
 epoch: 64, train_loss: 0.6059, test_loss: 0.9773, test_f1: 0.6654
 epoch: 65, train_loss: 0.6072, test_loss: 0.9317, test_f1: 0.6859
 epoch: 66, train_loss: 0.6023, test_loss: 0.8784, test_f1: 0.6699
 epoch: 67, train_loss: 0.5942, test_loss: 0.9322, test_f1: 0.6783
 epoch: 68, train_loss: 0.5848, test_loss: 1.0384, test_f1: 0.6443
 epoch: 69, train_loss: 0.5856, test_loss: 0.9884, test_f1: 0.6655
 epoch: 70, train_loss: 0.5900, test_loss: 1.2233, test_f1: 0.6406
 epoch: 71, train_loss: 0.5942, test_loss: 1.0507, test_f1: 0.7012
 epoch: 72, train_loss: 0.5938, test_loss: 0.9629, test_f1: 0.6944
 epoch: 73, train_loss: 0.5974, test_loss: 0.9857, test_f1: 0.6922
 epoch: 74, train_loss: 0.5601, test_loss: 1.0212, test_f1: 0.6689
 epoch: 75, train_loss: 0.5823, test_loss: 0.9413, test_f1: 0.6852
 epoch: 76, train_loss: 0.5842, test_loss: 1.0193, test_f1: 0.6750
 epoch: 77, train_loss: 0.5777, test_loss: 1.0610, test_f1: 0.6534
 epoch: 78, train_loss: 0.5869, test_loss: 0.9729, test_f1: 0.6875
 epoch: 79, train_loss: 0.5693, test_loss: 0.9951, test_f1: 0.6488
 epoch: 80, train_loss: 0.5814, test_loss: 1.0056, test_f1: 0.6702
 epoch: 81, train_loss: 0.5815, test_loss: 1.0055, test_f1: 0.6780
 epoch: 82, train_loss: 0.5677, test_loss: 0.9925, test_f1: 0.6607
 epoch: 83, train_loss: 0.5717, test_loss: 1.1121, test_f1: 0.6443
 epoch: 84, train_loss: 0.5736, test_loss: 1.0889, test_f1: 0.6491
 epoch: 85, train_loss: 0.5758, test_loss: 1.0087, test_f1: 0.6820
 epoch: 86, train_loss: 0.5504, test_loss: 0.9820, test_f1: 0.6630
 epoch: 87, train_loss: 0.5603, test_loss: 1.0003, test_f1: 0.6402
 epoch: 88, train_loss: 0.5485, test_loss: 1.0421, test_f1: 0.6650
 epoch: 89, train_loss: 0.5557, test_loss: 0.9421, test_f1: 0.6618
 epoch: 90, train_loss: 0.5471, test_loss: 1.0155, test_f1: 0.6936
 epoch: 91, train_loss: 0.5529, test_loss: 1.1833, test_f1: 0.6471
 epoch: 92, train_loss: 0.5461, test_loss: 0.9934, test_f1: 0.6671
 epoch: 93, train_loss: 0.5332, test_loss: 1.0267, test_f1: 0.6788
 epoch: 94, train_loss: 0.5447, test_loss: 1.0852, test_f1: 0.6492
 epoch: 95, train_loss: 0.5489, test_loss: 1.0416, test_f1: 0.6512
 epoch: 96, train_loss: 0.5656, test_loss: 0.9840, test_f1: 0.6942
 epoch: 97, train_loss: 0.5404, test_loss: 0.9562, test_f1: 0.6774
 epoch: 98, train_loss: 0.5404, test_loss: 1.1135, test_f1: 0.6446
 epoch: 99, train_loss: 0.5427, test_loss: 1.0119, test_f1: 0.6759
##################ITERATION #6 ****************************************
 epoch: 0, train_loss: 1.1152, test_loss: 1.0246, test_f1: 0.4548
 epoch: 1, train_loss: 0.9880, test_loss: 1.0021, test_f1: 0.5016
 epoch: 2, train_loss: 0.9382, test_loss: 0.9270, test_f1: 0.5190
 epoch: 3, train_loss: 0.9255, test_loss: 0.8900, test_f1: 0.5290
 epoch: 4, train_loss: 0.9171, test_loss: 0.9964, test_f1: 0.5424
 epoch: 5, train_loss: 0.8956, test_loss: 0.9233, test_f1: 0.5021
 epoch: 6, train_loss: 0.9096, test_loss: 0.9762, test_f1: 0.5136
 epoch: 7, train_loss: 0.8909, test_loss: 0.9829, test_f1: 0.5419
 epoch: 8, train_loss: 0.8777, test_loss: 0.9221, test_f1: 0.5258
 epoch: 9, train_loss: 0.8576, test_loss: 0.8937, test_f1: 0.5697
 epoch: 10, train_loss: 0.8466, test_loss: 0.9371, test_f1: 0.5262
 epoch: 11, train_loss: 0.8491, test_loss: 0.9169, test_f1: 0.5280
 epoch: 12, train_loss: 0.8571, test_loss: 0.9578, test_f1: 0.5194
 epoch: 13, train_loss: 0.8372, test_loss: 0.9310, test_f1: 0.5227
 epoch: 14, train_loss: 0.8165, test_loss: 0.9111, test_f1: 0.5682
 epoch: 15, train_loss: 0.8142, test_loss: 0.8866, test_f1: 0.6249
 epoch: 16, train_loss: 0.8171, test_loss: 0.9077, test_f1: 0.5430
 epoch: 17, train_loss: 0.8206, test_loss: 0.8857, test_f1: 0.6196
 epoch: 18, train_loss: 0.8123, test_loss: 0.9181, test_f1: 0.6064
 epoch: 19, train_loss: 0.7883, test_loss: 1.0945, test_f1: 0.5052
 epoch: 20, train_loss: 0.7899, test_loss: 1.0157, test_f1: 0.5751
 epoch: 21, train_loss: 0.7944, test_loss: 0.9309, test_f1: 0.5419
 epoch: 22, train_loss: 0.7970, test_loss: 0.8895, test_f1: 0.6390
 epoch: 23, train_loss: 0.7748, test_loss: 0.9863, test_f1: 0.5975
 epoch: 24, train_loss: 0.7731, test_loss: 0.9702, test_f1: 0.6091
 epoch: 25, train_loss: 0.7803, test_loss: 0.9095, test_f1: 0.5988
 epoch: 26, train_loss: 0.7706, test_loss: 0.9415, test_f1: 0.6156
 epoch: 27, train_loss: 0.7642, test_loss: 0.9502, test_f1: 0.5943
 epoch: 28, train_loss: 0.7679, test_loss: 0.8669, test_f1: 0.5914
 epoch: 29, train_loss: 0.7483, test_loss: 0.9179, test_f1: 0.6022
 epoch: 30, train_loss: 0.7376, test_loss: 0.9742, test_f1: 0.6303
 epoch: 31, train_loss: 0.7571, test_loss: 0.9982, test_f1: 0.6538
 epoch: 32, train_loss: 0.7674, test_loss: 0.9887, test_f1: 0.6441
 epoch: 33, train_loss: 0.7453, test_loss: 1.0489, test_f1: 0.6365
 epoch: 34, train_loss: 0.7308, test_loss: 0.9781, test_f1: 0.6410
 epoch: 35, train_loss: 0.7380, test_loss: 0.9525, test_f1: 0.6434
 epoch: 36, train_loss: 0.7262, test_loss: 0.9518, test_f1: 0.5601
 epoch: 37, train_loss: 0.7197, test_loss: 1.0822, test_f1: 0.5877
 epoch: 38, train_loss: 0.7306, test_loss: 0.9569, test_f1: 0.6149
 epoch: 39, train_loss: 0.7386, test_loss: 0.9991, test_f1: 0.6059
 epoch: 40, train_loss: 0.7228, test_loss: 0.9955, test_f1: 0.5955
 epoch: 41, train_loss: 0.7287, test_loss: 0.8748, test_f1: 0.6373
 epoch: 42, train_loss: 0.7342, test_loss: 0.9592, test_f1: 0.6133
 epoch: 43, train_loss: 0.7163, test_loss: 0.9040, test_f1: 0.6383
 epoch: 44, train_loss: 0.7127, test_loss: 0.9810, test_f1: 0.6210
 epoch: 45, train_loss: 0.7405, test_loss: 0.9070, test_f1: 0.6295
 epoch: 46, train_loss: 0.7223, test_loss: 0.9707, test_f1: 0.6344
 epoch: 47, train_loss: 0.7367, test_loss: 0.9296, test_f1: 0.5879
 epoch: 48, train_loss: 0.7055, test_loss: 0.9683, test_f1: 0.6307
 epoch: 49, train_loss: 0.6886, test_loss: 0.9873, test_f1: 0.5981
 epoch: 50, train_loss: 0.6844, test_loss: 0.9781, test_f1: 0.6402
 epoch: 51, train_loss: 0.6738, test_loss: 0.9313, test_f1: 0.6331
 epoch: 52, train_loss: 0.6684, test_loss: 0.9333, test_f1: 0.6329
 epoch: 53, train_loss: 0.6351, test_loss: 0.9353, test_f1: 0.6391
 epoch: 54, train_loss: 0.6519, test_loss: 0.9642, test_f1: 0.6463
 epoch: 55, train_loss: 0.6352, test_loss: 0.9031, test_f1: 0.6594
 epoch: 56, train_loss: 0.6361, test_loss: 0.9721, test_f1: 0.6271
 epoch: 57, train_loss: 0.6405, test_loss: 1.0014, test_f1: 0.6440
 epoch: 58, train_loss: 0.6263, test_loss: 1.0089, test_f1: 0.6265
 epoch: 59, train_loss: 0.6294, test_loss: 0.9665, test_f1: 0.6374
 epoch: 60, train_loss: 0.6237, test_loss: 0.9883, test_f1: 0.6497
 epoch: 61, train_loss: 0.6302, test_loss: 1.0361, test_f1: 0.6498
 epoch: 62, train_loss: 0.6304, test_loss: 0.9426, test_f1: 0.6499
 epoch: 63, train_loss: 0.6029, test_loss: 1.0336, test_f1: 0.6599
 epoch: 64, train_loss: 0.6124, test_loss: 1.0423, test_f1: 0.6429
 epoch: 65, train_loss: 0.6146, test_loss: 0.9936, test_f1: 0.6462
 epoch: 66, train_loss: 0.6224, test_loss: 0.9907, test_f1: 0.6669
 epoch: 67, train_loss: 0.6228, test_loss: 0.9874, test_f1: 0.6046
 epoch: 68, train_loss: 0.6202, test_loss: 0.9715, test_f1: 0.6611
 epoch: 69, train_loss: 0.6072, test_loss: 1.0223, test_f1: 0.6431
 epoch: 70, train_loss: 0.6267, test_loss: 1.0310, test_f1: 0.6525
 epoch: 71, train_loss: 0.6187, test_loss: 1.0105, test_f1: 0.6406
 epoch: 72, train_loss: 0.5976, test_loss: 1.0795, test_f1: 0.6632
 epoch: 73, train_loss: 0.6038, test_loss: 1.0230, test_f1: 0.6612
 epoch: 74, train_loss: 0.6052, test_loss: 1.0364, test_f1: 0.6604
 epoch: 75, train_loss: 0.6178, test_loss: 1.0863, test_f1: 0.6521
 epoch: 76, train_loss: 0.5930, test_loss: 1.0275, test_f1: 0.6581
 epoch: 77, train_loss: 0.5946, test_loss: 1.0055, test_f1: 0.6548
 epoch: 78, train_loss: 0.5879, test_loss: 1.0248, test_f1: 0.6500
 epoch: 79, train_loss: 0.5837, test_loss: 1.1022, test_f1: 0.6607
 epoch: 80, train_loss: 0.5969, test_loss: 1.0570, test_f1: 0.6460
 epoch: 81, train_loss: 0.6304, test_loss: 1.0401, test_f1: 0.6420
 epoch: 82, train_loss: 0.6162, test_loss: 0.9486, test_f1: 0.6679
 epoch: 83, train_loss: 0.5772, test_loss: 1.0172, test_f1: 0.6561
 epoch: 84, train_loss: 0.6018, test_loss: 1.0349, test_f1: 0.6530
 epoch: 85, train_loss: 0.5861, test_loss: 1.0508, test_f1: 0.6475
 epoch: 86, train_loss: 0.5720, test_loss: 1.0421, test_f1: 0.6548
 epoch: 87, train_loss: 0.5778, test_loss: 1.0898, test_f1: 0.6460
 epoch: 88, train_loss: 0.5506, test_loss: 1.1226, test_f1: 0.6434
 epoch: 89, train_loss: 0.5890, test_loss: 1.0069, test_f1: 0.6446
 epoch: 90, train_loss: 0.5739, test_loss: 1.1275, test_f1: 0.6400
 epoch: 91, train_loss: 0.5764, test_loss: 1.1105, test_f1: 0.6719
 epoch: 92, train_loss: 0.5794, test_loss: 1.0881, test_f1: 0.6694
 epoch: 93, train_loss: 0.5740, test_loss: 1.0798, test_f1: 0.6794
 epoch: 94, train_loss: 0.5581, test_loss: 1.1634, test_f1: 0.6524
 epoch: 95, train_loss: 0.5565, test_loss: 1.2298, test_f1: 0.6658
 epoch: 96, train_loss: 0.5579, test_loss: 1.1673, test_f1: 0.6416
 epoch: 97, train_loss: 0.5470, test_loss: 1.2554, test_f1: 0.6471
 epoch: 98, train_loss: 0.5752, test_loss: 1.2187, test_f1: 0.6352
 epoch: 99, train_loss: 0.5704, test_loss: 1.1223, test_f1: 0.6620
##################ITERATION #7 ****************************************
 epoch: 0, train_loss: 1.0857, test_loss: 1.0741, test_f1: 0.4421
 epoch: 1, train_loss: 0.9852, test_loss: 1.0029, test_f1: 0.4873
 epoch: 2, train_loss: 0.9480, test_loss: 1.0129, test_f1: 0.5088
 epoch: 3, train_loss: 0.9404, test_loss: 0.9242, test_f1: 0.4884
 epoch: 4, train_loss: 0.9392, test_loss: 1.0550, test_f1: 0.4954
 epoch: 5, train_loss: 0.9236, test_loss: 0.9456, test_f1: 0.4980
 epoch: 6, train_loss: 0.9126, test_loss: 1.1620, test_f1: 0.4473
 epoch: 7, train_loss: 0.9023, test_loss: 0.9288, test_f1: 0.5372
 epoch: 8, train_loss: 0.8734, test_loss: 1.0019, test_f1: 0.4726
 epoch: 9, train_loss: 0.8707, test_loss: 0.9434, test_f1: 0.5692
 epoch: 10, train_loss: 0.8587, test_loss: 0.9375, test_f1: 0.5215
 epoch: 11, train_loss: 0.8623, test_loss: 0.8918, test_f1: 0.6142
 epoch: 12, train_loss: 0.8409, test_loss: 0.8977, test_f1: 0.5575
 epoch: 13, train_loss: 0.8347, test_loss: 0.9901, test_f1: 0.5258
 epoch: 14, train_loss: 0.8527, test_loss: 0.8651, test_f1: 0.5652
 epoch: 15, train_loss: 0.8524, test_loss: 0.9135, test_f1: 0.5739
 epoch: 16, train_loss: 0.8330, test_loss: 0.8806, test_f1: 0.5731
 epoch: 17, train_loss: 0.8224, test_loss: 0.8736, test_f1: 0.5398
 epoch: 18, train_loss: 0.8162, test_loss: 0.9204, test_f1: 0.6082
 epoch: 19, train_loss: 0.8169, test_loss: 0.9741, test_f1: 0.5669
 epoch: 20, train_loss: 0.7964, test_loss: 0.9009, test_f1: 0.5851
 epoch: 21, train_loss: 0.8197, test_loss: 0.8862, test_f1: 0.5468
 epoch: 22, train_loss: 0.7952, test_loss: 0.9193, test_f1: 0.5901
 epoch: 23, train_loss: 0.8046, test_loss: 0.9448, test_f1: 0.5601
 epoch: 24, train_loss: 0.7998, test_loss: 0.9572, test_f1: 0.5479
 epoch: 25, train_loss: 0.7955, test_loss: 1.0015, test_f1: 0.5641
 epoch: 26, train_loss: 0.8139, test_loss: 0.9954, test_f1: 0.4791
 epoch: 27, train_loss: 0.8101, test_loss: 0.9102, test_f1: 0.5715
 epoch: 28, train_loss: 0.8042, test_loss: 0.8826, test_f1: 0.5556
 epoch: 29, train_loss: 0.7893, test_loss: 0.8286, test_f1: 0.5584
 epoch: 30, train_loss: 0.7908, test_loss: 1.1217, test_f1: 0.4686
 epoch: 31, train_loss: 0.7866, test_loss: 0.9065, test_f1: 0.5562
 epoch: 32, train_loss: 0.7827, test_loss: 0.8634, test_f1: 0.6135
 epoch: 33, train_loss: 0.7922, test_loss: 0.9444, test_f1: 0.5081
 epoch: 34, train_loss: 0.7791, test_loss: 0.8302, test_f1: 0.5888
 epoch: 35, train_loss: 0.7694, test_loss: 0.8349, test_f1: 0.6286
 epoch: 36, train_loss: 0.7704, test_loss: 0.8821, test_f1: 0.6233
 epoch: 37, train_loss: 0.7740, test_loss: 0.9013, test_f1: 0.6343
 epoch: 38, train_loss: 0.7662, test_loss: 0.8790, test_f1: 0.6454
 epoch: 39, train_loss: 0.7656, test_loss: 0.8994, test_f1: 0.6031
 epoch: 40, train_loss: 0.7593, test_loss: 0.8283, test_f1: 0.5972
 epoch: 41, train_loss: 0.7570, test_loss: 0.8585, test_f1: 0.5959
 epoch: 42, train_loss: 0.7598, test_loss: 0.8882, test_f1: 0.6223
 epoch: 43, train_loss: 0.7458, test_loss: 0.8802, test_f1: 0.5726
 epoch: 44, train_loss: 0.7326, test_loss: 0.7853, test_f1: 0.6054
 epoch: 45, train_loss: 0.7413, test_loss: 0.9307, test_f1: 0.6149
 epoch: 46, train_loss: 0.7376, test_loss: 0.9189, test_f1: 0.5801
 epoch: 47, train_loss: 0.7384, test_loss: 0.9487, test_f1: 0.6387
 epoch: 48, train_loss: 0.7325, test_loss: 0.9248, test_f1: 0.5889
 epoch: 49, train_loss: 0.7311, test_loss: 0.9093, test_f1: 0.6106
 epoch: 50, train_loss: 0.7175, test_loss: 0.9193, test_f1: 0.6252
 epoch: 51, train_loss: 0.7257, test_loss: 0.9150, test_f1: 0.6324
 epoch: 52, train_loss: 0.7047, test_loss: 0.9130, test_f1: 0.6295
 epoch: 53, train_loss: 0.6914, test_loss: 0.9047, test_f1: 0.6286
 epoch: 54, train_loss: 0.6909, test_loss: 0.8491, test_f1: 0.6374
 epoch: 55, train_loss: 0.6758, test_loss: 0.8596, test_f1: 0.6284
 epoch: 56, train_loss: 0.6732, test_loss: 0.8811, test_f1: 0.6481
 epoch: 57, train_loss: 0.6757, test_loss: 0.8517, test_f1: 0.6217
 epoch: 58, train_loss: 0.6633, test_loss: 0.9108, test_f1: 0.5993
 epoch: 59, train_loss: 0.6815, test_loss: 0.7981, test_f1: 0.6604
 epoch: 60, train_loss: 0.6625, test_loss: 0.7923, test_f1: 0.6402
 epoch: 61, train_loss: 0.6584, test_loss: 0.7571, test_f1: 0.6463
 epoch: 62, train_loss: 0.6609, test_loss: 0.9270, test_f1: 0.6468
 epoch: 63, train_loss: 0.6541, test_loss: 0.8343, test_f1: 0.6273
 epoch: 64, train_loss: 0.6577, test_loss: 0.9904, test_f1: 0.6571
 epoch: 65, train_loss: 0.6485, test_loss: 0.9669, test_f1: 0.6137
 epoch: 66, train_loss: 0.6495, test_loss: 0.8000, test_f1: 0.6427
 epoch: 67, train_loss: 0.6423, test_loss: 0.9899, test_f1: 0.6486
 epoch: 68, train_loss: 0.6587, test_loss: 0.9764, test_f1: 0.6471
 epoch: 69, train_loss: 0.6373, test_loss: 0.8854, test_f1: 0.6212
 epoch: 70, train_loss: 0.6465, test_loss: 0.9076, test_f1: 0.6352
 epoch: 71, train_loss: 0.6350, test_loss: 0.8742, test_f1: 0.6477
 epoch: 72, train_loss: 0.6265, test_loss: 0.8770, test_f1: 0.6549
 epoch: 73, train_loss: 0.6462, test_loss: 0.7592, test_f1: 0.6416
 epoch: 74, train_loss: 0.6241, test_loss: 0.9487, test_f1: 0.6395
 epoch: 75, train_loss: 0.6204, test_loss: 1.0018, test_f1: 0.6543
 epoch: 76, train_loss: 0.6407, test_loss: 0.8009, test_f1: 0.6409
 epoch: 77, train_loss: 0.6316, test_loss: 0.9319, test_f1: 0.6360
 epoch: 78, train_loss: 0.6300, test_loss: 0.9541, test_f1: 0.6537
 epoch: 79, train_loss: 0.6312, test_loss: 0.8386, test_f1: 0.6471
 epoch: 80, train_loss: 0.6154, test_loss: 0.9205, test_f1: 0.6671
 epoch: 81, train_loss: 0.6261, test_loss: 0.9137, test_f1: 0.6672
 epoch: 82, train_loss: 0.6119, test_loss: 0.9267, test_f1: 0.6633
 epoch: 83, train_loss: 0.6003, test_loss: 0.8990, test_f1: 0.6592
 epoch: 84, train_loss: 0.6214, test_loss: 0.8825, test_f1: 0.6379
 epoch: 85, train_loss: 0.6058, test_loss: 0.9583, test_f1: 0.6448
 epoch: 86, train_loss: 0.6051, test_loss: 0.9193, test_f1: 0.6099
 epoch: 87, train_loss: 0.5957, test_loss: 0.9785, test_f1: 0.6518
 epoch: 88, train_loss: 0.6105, test_loss: 0.8595, test_f1: 0.6552
 epoch: 89, train_loss: 0.6091, test_loss: 0.9790, test_f1: 0.6573
 epoch: 90, train_loss: 0.6048, test_loss: 0.9263, test_f1: 0.6454
 epoch: 91, train_loss: 0.6017, test_loss: 0.9650, test_f1: 0.6450
 epoch: 92, train_loss: 0.5724, test_loss: 0.9830, test_f1: 0.6580
 epoch: 93, train_loss: 0.5919, test_loss: 1.0984, test_f1: 0.6487
 epoch: 94, train_loss: 0.6060, test_loss: 1.0058, test_f1: 0.6446
 epoch: 95, train_loss: 0.6051, test_loss: 0.9320, test_f1: 0.6611
 epoch: 96, train_loss: 0.5894, test_loss: 1.0644, test_f1: 0.6679
 epoch: 97, train_loss: 0.5983, test_loss: 0.9159, test_f1: 0.6683
 epoch: 98, train_loss: 0.5859, test_loss: 1.0746, test_f1: 0.6416
 epoch: 99, train_loss: 0.5955, test_loss: 0.8622, test_f1: 0.6326
##################ITERATION #8 ****************************************
 epoch: 0, train_loss: 1.0966, test_loss: 1.0411, test_f1: 0.4024
 epoch: 1, train_loss: 0.9941, test_loss: 1.0144, test_f1: 0.5118
 epoch: 2, train_loss: 0.9535, test_loss: 0.9471, test_f1: 0.5031
 epoch: 3, train_loss: 0.9538, test_loss: 0.9625, test_f1: 0.5036
 epoch: 4, train_loss: 0.9220, test_loss: 0.9092, test_f1: 0.5531
 epoch: 5, train_loss: 0.9143, test_loss: 0.8936, test_f1: 0.5152
 epoch: 6, train_loss: 0.8863, test_loss: 0.8945, test_f1: 0.5406
 epoch: 7, train_loss: 0.8973, test_loss: 0.8935, test_f1: 0.5441
 epoch: 8, train_loss: 0.8711, test_loss: 0.8360, test_f1: 0.6073
 epoch: 9, train_loss: 0.8649, test_loss: 0.8870, test_f1: 0.5938
 epoch: 10, train_loss: 0.8384, test_loss: 0.8800, test_f1: 0.5536
 epoch: 11, train_loss: 0.8406, test_loss: 0.9152, test_f1: 0.5613
 epoch: 12, train_loss: 0.8432, test_loss: 1.0116, test_f1: 0.5285
 epoch: 13, train_loss: 0.8345, test_loss: 0.8338, test_f1: 0.5742
 epoch: 14, train_loss: 0.8143, test_loss: 0.8716, test_f1: 0.5528
 epoch: 15, train_loss: 0.7979, test_loss: 0.7824, test_f1: 0.5984
 epoch: 16, train_loss: 0.8264, test_loss: 0.8450, test_f1: 0.5379
 epoch: 17, train_loss: 0.7974, test_loss: 0.8830, test_f1: 0.6200
 epoch: 18, train_loss: 0.7757, test_loss: 0.9649, test_f1: 0.5700
 epoch: 19, train_loss: 0.7822, test_loss: 0.8408, test_f1: 0.5885
 epoch: 20, train_loss: 0.7766, test_loss: 1.0093, test_f1: 0.5124
 epoch: 21, train_loss: 0.7636, test_loss: 0.8627, test_f1: 0.6137
 epoch: 22, train_loss: 0.7813, test_loss: 0.8624, test_f1: 0.6302
 epoch: 23, train_loss: 0.7465, test_loss: 0.8539, test_f1: 0.6230
 epoch: 24, train_loss: 0.7491, test_loss: 1.0663, test_f1: 0.5490
 epoch: 25, train_loss: 0.7507, test_loss: 0.8866, test_f1: 0.6581
 epoch: 26, train_loss: 0.7463, test_loss: 0.9346, test_f1: 0.5907
 epoch: 27, train_loss: 0.7540, test_loss: 0.8545, test_f1: 0.6207
 epoch: 28, train_loss: 0.7294, test_loss: 0.7841, test_f1: 0.6096
 epoch: 29, train_loss: 0.7432, test_loss: 1.0515, test_f1: 0.5296
 epoch: 30, train_loss: 0.7309, test_loss: 0.8614, test_f1: 0.6220
 epoch: 31, train_loss: 0.7257, test_loss: 0.7803, test_f1: 0.6786
 epoch: 32, train_loss: 0.7214, test_loss: 0.8900, test_f1: 0.6277
 epoch: 33, train_loss: 0.7142, test_loss: 0.8156, test_f1: 0.5888
 epoch: 34, train_loss: 0.7320, test_loss: 0.8557, test_f1: 0.5792
 epoch: 35, train_loss: 0.7156, test_loss: 0.7079, test_f1: 0.6261
 epoch: 36, train_loss: 0.7044, test_loss: 0.7506, test_f1: 0.6772
 epoch: 37, train_loss: 0.7110, test_loss: 0.8788, test_f1: 0.6100
 epoch: 38, train_loss: 0.7137, test_loss: 0.7963, test_f1: 0.6154
 epoch: 39, train_loss: 0.7029, test_loss: 0.7288, test_f1: 0.6794
 epoch: 40, train_loss: 0.6957, test_loss: 0.8711, test_f1: 0.5811
 epoch: 41, train_loss: 0.6872, test_loss: 0.7575, test_f1: 0.6467
 epoch: 42, train_loss: 0.6973, test_loss: 0.6760, test_f1: 0.6652
 epoch: 43, train_loss: 0.6947, test_loss: 1.0901, test_f1: 0.5741
 epoch: 44, train_loss: 0.7026, test_loss: 0.8011, test_f1: 0.6731
 epoch: 45, train_loss: 0.6748, test_loss: 0.8395, test_f1: 0.6456
 epoch: 46, train_loss: 0.6798, test_loss: 0.8250, test_f1: 0.6374
 epoch: 47, train_loss: 0.6693, test_loss: 0.7597, test_f1: 0.6585
 epoch: 48, train_loss: 0.6584, test_loss: 0.8049, test_f1: 0.6310
 epoch: 49, train_loss: 0.6660, test_loss: 0.7440, test_f1: 0.6622
 epoch: 50, train_loss: 0.6568, test_loss: 0.8073, test_f1: 0.6635
 epoch: 51, train_loss: 0.6293, test_loss: 0.7775, test_f1: 0.6446
 epoch: 52, train_loss: 0.6230, test_loss: 0.7395, test_f1: 0.6822
 epoch: 53, train_loss: 0.6045, test_loss: 0.7521, test_f1: 0.6577
 epoch: 54, train_loss: 0.6156, test_loss: 0.6599, test_f1: 0.6774
 epoch: 55, train_loss: 0.5970, test_loss: 0.7271, test_f1: 0.6755
 epoch: 56, train_loss: 0.5895, test_loss: 0.7407, test_f1: 0.6960
 epoch: 57, train_loss: 0.5884, test_loss: 0.6836, test_f1: 0.6798
 epoch: 58, train_loss: 0.5921, test_loss: 0.8289, test_f1: 0.6087
 epoch: 59, train_loss: 0.5921, test_loss: 0.8053, test_f1: 0.6597
 epoch: 60, train_loss: 0.5977, test_loss: 0.7167, test_f1: 0.6633
 epoch: 61, train_loss: 0.6016, test_loss: 0.6808, test_f1: 0.6766
 epoch: 62, train_loss: 0.5884, test_loss: 0.7298, test_f1: 0.6965
 epoch: 63, train_loss: 0.6000, test_loss: 0.7175, test_f1: 0.6889
 epoch: 64, train_loss: 0.5818, test_loss: 0.7082, test_f1: 0.7109
 epoch: 65, train_loss: 0.5706, test_loss: 0.7337, test_f1: 0.6903
 epoch: 66, train_loss: 0.5776, test_loss: 0.6977, test_f1: 0.7179
 epoch: 67, train_loss: 0.5832, test_loss: 0.7329, test_f1: 0.7129
 epoch: 68, train_loss: 0.5783, test_loss: 0.7334, test_f1: 0.6698
 epoch: 69, train_loss: 0.5828, test_loss: 0.6972, test_f1: 0.6733
 epoch: 70, train_loss: 0.5994, test_loss: 0.7067, test_f1: 0.6756
 epoch: 71, train_loss: 0.5915, test_loss: 0.6894, test_f1: 0.7204
 epoch: 72, train_loss: 0.5732, test_loss: 0.6846, test_f1: 0.6864
 epoch: 73, train_loss: 0.5764, test_loss: 0.7809, test_f1: 0.6711
 epoch: 74, train_loss: 0.5693, test_loss: 0.7584, test_f1: 0.6727
 epoch: 75, train_loss: 0.5626, test_loss: 0.7246, test_f1: 0.6819
 epoch: 76, train_loss: 0.5492, test_loss: 0.7249, test_f1: 0.6657
 epoch: 77, train_loss: 0.5571, test_loss: 0.7342, test_f1: 0.6811
 epoch: 78, train_loss: 0.5704, test_loss: 0.7034, test_f1: 0.6859
 epoch: 79, train_loss: 0.5432, test_loss: 0.6975, test_f1: 0.6856
 epoch: 80, train_loss: 0.5448, test_loss: 0.6828, test_f1: 0.6978
 epoch: 81, train_loss: 0.5678, test_loss: 0.8043, test_f1: 0.6857
 epoch: 82, train_loss: 0.5293, test_loss: 0.7062, test_f1: 0.6813
 epoch: 83, train_loss: 0.5486, test_loss: 0.6736, test_f1: 0.6882
 epoch: 84, train_loss: 0.5383, test_loss: 0.7108, test_f1: 0.6884
 epoch: 85, train_loss: 0.5600, test_loss: 0.6618, test_f1: 0.7145
 epoch: 86, train_loss: 0.5575, test_loss: 0.6870, test_f1: 0.6998
 epoch: 87, train_loss: 0.5389, test_loss: 0.7037, test_f1: 0.7023
 epoch: 88, train_loss: 0.5362, test_loss: 0.7053, test_f1: 0.7024
 epoch: 89, train_loss: 0.5480, test_loss: 0.7229, test_f1: 0.6849
 epoch: 90, train_loss: 0.5493, test_loss: 0.7903, test_f1: 0.6610
 epoch: 91, train_loss: 0.5208, test_loss: 0.7090, test_f1: 0.6990
 epoch: 92, train_loss: 0.5374, test_loss: 0.7301, test_f1: 0.7007
 epoch: 93, train_loss: 0.5407, test_loss: 0.6895, test_f1: 0.7049
 epoch: 94, train_loss: 0.5472, test_loss: 0.7044, test_f1: 0.6796
 epoch: 95, train_loss: 0.5562, test_loss: 0.7841, test_f1: 0.6959
 epoch: 96, train_loss: 0.5289, test_loss: 0.7686, test_f1: 0.6792
 epoch: 97, train_loss: 0.5351, test_loss: 0.7434, test_f1: 0.7066
 epoch: 98, train_loss: 0.5303, test_loss: 0.7491, test_f1: 0.6624
 epoch: 99, train_loss: 0.5190, test_loss: 0.6959, test_f1: 0.6833
##################ITERATION #9 ****************************************
 epoch: 0, train_loss: 1.0934, test_loss: 1.0510, test_f1: 0.3448
 epoch: 1, train_loss: 1.0022, test_loss: 1.0689, test_f1: 0.4940
 epoch: 2, train_loss: 0.9632, test_loss: 0.9681, test_f1: 0.5031
 epoch: 3, train_loss: 0.9502, test_loss: 1.0099, test_f1: 0.5418
 epoch: 4, train_loss: 0.9562, test_loss: 1.0576, test_f1: 0.5003
 epoch: 5, train_loss: 0.9295, test_loss: 0.9479, test_f1: 0.5184
 epoch: 6, train_loss: 0.9166, test_loss: 0.8927, test_f1: 0.5329
 epoch: 7, train_loss: 0.8967, test_loss: 0.9688, test_f1: 0.5435
 epoch: 8, train_loss: 0.8919, test_loss: 0.9765, test_f1: 0.5003
 epoch: 9, train_loss: 0.8828, test_loss: 0.8349, test_f1: 0.5714
 epoch: 10, train_loss: 0.8557, test_loss: 1.1396, test_f1: 0.4698
 epoch: 11, train_loss: 0.8526, test_loss: 0.9244, test_f1: 0.5392
 epoch: 12, train_loss: 0.8546, test_loss: 0.8383, test_f1: 0.5359
 epoch: 13, train_loss: 0.8439, test_loss: 0.7780, test_f1: 0.5823
 epoch: 14, train_loss: 0.8455, test_loss: 0.9443, test_f1: 0.5399
 epoch: 15, train_loss: 0.8324, test_loss: 0.8701, test_f1: 0.5591
 epoch: 16, train_loss: 0.8196, test_loss: 0.7879, test_f1: 0.6141
 epoch: 17, train_loss: 0.8241, test_loss: 0.8535, test_f1: 0.5786
 epoch: 18, train_loss: 0.8320, test_loss: 0.7957, test_f1: 0.6065
 epoch: 19, train_loss: 0.8052, test_loss: 0.8563, test_f1: 0.5551
 epoch: 20, train_loss: 0.8173, test_loss: 0.8565, test_f1: 0.5719
 epoch: 21, train_loss: 0.8093, test_loss: 0.8634, test_f1: 0.5649
 epoch: 22, train_loss: 0.8060, test_loss: 0.9328, test_f1: 0.5599
 epoch: 23, train_loss: 0.8036, test_loss: 0.8615, test_f1: 0.5836
 epoch: 24, train_loss: 0.8035, test_loss: 0.8797, test_f1: 0.6075
 epoch: 25, train_loss: 0.7912, test_loss: 0.8752, test_f1: 0.5789
 epoch: 26, train_loss: 0.7894, test_loss: 0.8456, test_f1: 0.5812
 epoch: 27, train_loss: 0.7666, test_loss: 0.8527, test_f1: 0.6155
 epoch: 28, train_loss: 0.7711, test_loss: 0.9040, test_f1: 0.6005
 epoch: 29, train_loss: 0.7731, test_loss: 0.8100, test_f1: 0.5859
 epoch: 30, train_loss: 0.7548, test_loss: 0.8420, test_f1: 0.6381
 epoch: 31, train_loss: 0.7642, test_loss: 0.9834, test_f1: 0.5875
 epoch: 32, train_loss: 0.7801, test_loss: 0.8701, test_f1: 0.6132
 epoch: 33, train_loss: 0.7493, test_loss: 0.8556, test_f1: 0.6293
 epoch: 34, train_loss: 0.7658, test_loss: 0.8139, test_f1: 0.6319
 epoch: 35, train_loss: 0.7623, test_loss: 0.7974, test_f1: 0.5951
 epoch: 36, train_loss: 0.7389, test_loss: 1.0030, test_f1: 0.6280
 epoch: 37, train_loss: 0.7415, test_loss: 0.8912, test_f1: 0.6622
 epoch: 38, train_loss: 0.7260, test_loss: 0.9055, test_f1: 0.6080
 epoch: 39, train_loss: 0.7139, test_loss: 0.9352, test_f1: 0.6185
 epoch: 40, train_loss: 0.7329, test_loss: 0.9670, test_f1: 0.6115
 epoch: 41, train_loss: 0.7483, test_loss: 0.8960, test_f1: 0.6289
 epoch: 42, train_loss: 0.7231, test_loss: 0.8755, test_f1: 0.6428
 epoch: 43, train_loss: 0.7146, test_loss: 1.0343, test_f1: 0.5966
 epoch: 44, train_loss: 0.7243, test_loss: 0.9911, test_f1: 0.6033
 epoch: 45, train_loss: 0.7136, test_loss: 0.8930, test_f1: 0.6481
 epoch: 46, train_loss: 0.7117, test_loss: 1.0402, test_f1: 0.6275
 epoch: 47, train_loss: 0.7084, test_loss: 0.9531, test_f1: 0.6089
 epoch: 48, train_loss: 0.7203, test_loss: 0.9878, test_f1: 0.5820
 epoch: 49, train_loss: 0.7090, test_loss: 1.0416, test_f1: 0.6355
 epoch: 50, train_loss: 0.7007, test_loss: 0.9005, test_f1: 0.6062
 epoch: 51, train_loss: 0.6783, test_loss: 0.9137, test_f1: 0.6685
 epoch: 52, train_loss: 0.6573, test_loss: 1.0067, test_f1: 0.6327
 epoch: 53, train_loss: 0.6575, test_loss: 0.9439, test_f1: 0.6431
 epoch: 54, train_loss: 0.6616, test_loss: 0.9494, test_f1: 0.6375
 epoch: 55, train_loss: 0.6642, test_loss: 0.9221, test_f1: 0.6364
 epoch: 56, train_loss: 0.6329, test_loss: 0.9930, test_f1: 0.6149
 epoch: 57, train_loss: 0.6543, test_loss: 0.9076, test_f1: 0.6195
 epoch: 58, train_loss: 0.6496, test_loss: 1.0110, test_f1: 0.6453
 epoch: 59, train_loss: 0.6487, test_loss: 1.0353, test_f1: 0.6203
 epoch: 60, train_loss: 0.6310, test_loss: 1.0307, test_f1: 0.6375
 epoch: 61, train_loss: 0.6485, test_loss: 1.0076, test_f1: 0.6478
 epoch: 62, train_loss: 0.6468, test_loss: 0.9957, test_f1: 0.6386
 epoch: 63, train_loss: 0.6376, test_loss: 1.0362, test_f1: 0.6557
 epoch: 64, train_loss: 0.6348, test_loss: 1.1002, test_f1: 0.6301
 epoch: 65, train_loss: 0.6275, test_loss: 1.0044, test_f1: 0.6684
 epoch: 66, train_loss: 0.6270, test_loss: 0.9873, test_f1: 0.6521
 epoch: 67, train_loss: 0.6285, test_loss: 1.0517, test_f1: 0.6834
 epoch: 68, train_loss: 0.6266, test_loss: 1.0765, test_f1: 0.6497
 epoch: 69, train_loss: 0.6372, test_loss: 0.9629, test_f1: 0.6532
 epoch: 70, train_loss: 0.6305, test_loss: 0.9801, test_f1: 0.6785
 epoch: 71, train_loss: 0.6093, test_loss: 1.2257, test_f1: 0.6559
 epoch: 72, train_loss: 0.6378, test_loss: 1.0514, test_f1: 0.6669
 epoch: 73, train_loss: 0.6149, test_loss: 0.9548, test_f1: 0.6533
 epoch: 74, train_loss: 0.6196, test_loss: 1.0136, test_f1: 0.6847
 epoch: 75, train_loss: 0.6144, test_loss: 0.9763, test_f1: 0.6537
 epoch: 76, train_loss: 0.5977, test_loss: 0.9214, test_f1: 0.6509
 epoch: 77, train_loss: 0.6162, test_loss: 1.0607, test_f1: 0.6728
 epoch: 78, train_loss: 0.6136, test_loss: 1.0575, test_f1: 0.6783
 epoch: 79, train_loss: 0.6033, test_loss: 1.1134, test_f1: 0.6469
 epoch: 80, train_loss: 0.6083, test_loss: 0.9959, test_f1: 0.6682
 epoch: 81, train_loss: 0.6015, test_loss: 1.2058, test_f1: 0.6129
 epoch: 82, train_loss: 0.6180, test_loss: 1.0847, test_f1: 0.6596
 epoch: 83, train_loss: 0.6205, test_loss: 0.9573, test_f1: 0.6860
 epoch: 84, train_loss: 0.6019, test_loss: 0.9708, test_f1: 0.6521
 epoch: 85, train_loss: 0.5986, test_loss: 1.1823, test_f1: 0.6454
 epoch: 86, train_loss: 0.6047, test_loss: 1.0159, test_f1: 0.6397
 epoch: 87, train_loss: 0.5908, test_loss: 1.0048, test_f1: 0.6719
 epoch: 88, train_loss: 0.5857, test_loss: 1.0628, test_f1: 0.6547
 epoch: 89, train_loss: 0.5911, test_loss: 0.9840, test_f1: 0.6628
 epoch: 90, train_loss: 0.5960, test_loss: 1.0238, test_f1: 0.6730
 epoch: 91, train_loss: 0.5982, test_loss: 1.0260, test_f1: 0.6733
 epoch: 92, train_loss: 0.5779, test_loss: 0.9826, test_f1: 0.6562
 epoch: 93, train_loss: 0.5988, test_loss: 1.0774, test_f1: 0.6442
 epoch: 94, train_loss: 0.5844, test_loss: 0.9993, test_f1: 0.6717
 epoch: 95, train_loss: 0.5837, test_loss: 1.0239, test_f1: 0.6578
 epoch: 96, train_loss: 0.5878, test_loss: 1.1233, test_f1: 0.6198
 epoch: 97, train_loss: 0.6020, test_loss: 1.1072, test_f1: 0.6530
 epoch: 98, train_loss: 0.5787, test_loss: 1.1325, test_f1: 0.6391
 epoch: 99, train_loss: 0.5832, test_loss: 1.0648, test_f1: 0.6671

Training completed in 853.58 seconds
Best F1: 0.7204 at epoch 71
Mean F1 across iterations: 0.6954  0.0144
========================FINAL RESULTS================================
FEGIN weighted F1: 0.7204  0.0144
python main.py --data ltspice_examples --representation component_pin_net --model FEGIN --layers 3 --hiddens 32 --batch_size 64 --lr 0.01 --emb_size 512 --epochs 100 --save_appendix component_pin_net_L3_H32_BS64_LR0.01_E512 --no_val
-----



STDERR:
  File "main.py", line 370, in <module>
    main()
  File "main.py", line 254, in main
    dataset = dataset_class(
  File "/home/philip/projects/llm_inference_code_repo/Circuit-Completion-Using-GNNs/component_classification_with_link_prediction_head/evaluation/FEGIN/kernel/circuit_datasets.py", line 15, in __init__
    self.data, self.slices = torch.load(self.processed_paths[0])
  File "/home/philip/.local/lib/python3.8/site-packages/torch/serialization.py", line 1040, in load
    warnings.warn(
  File "/usr/lib/python3.8/warnings.py", line 109, in _showwarnmsg
    sw(msg.message, msg.category, msg.filename, msg.lineno,
  File "main.py", line 47, in warn_with_traceback
    traceback.print_stack(file=log)
/home/philip/projects/llm_inference_code_repo/Circuit-Completion-Using-GNNs/component_classification_with_link_prediction_head/evaluation/FEGIN/kernel/circuit_datasets.py:15: FutureWarning: You are using `torch.load` with `weights_only=False` (the current default value), which uses the default pickle module implicitly. It is possible to construct malicious pickle data which will execute arbitrary code during unpickling (See https://github.com/pytorch/pytorch/blob/main/SECURITY.md#untrusted-models for more details). In a future release, the default value for `weights_only` will be flipped to `True`. This limits the functions that could be executed during unpickling. Arbitrary objects will no longer be allowed to be loaded via this mode unless they are explicitly allowlisted by the user via `torch.serialization.add_safe_globals`. We recommend you start setting `weights_only=True` for any use case where you don't have full control of the loaded file. Please open an issue on GitHub for any issues related to this experimental feature.
  self.data, self.slices = torch.load(self.processed_paths[0])
