STDOUT:
Results will be saved in /home/philip/projects/ltspice_examples_code_repo/Circuit-Completion-Using-GNNs/component_classification_with_link_prediction_head/evaluation/FEGIN/results/model_FEGIN_dataset_ltspice_examples
Command line input: python main.py --data ltspice_examples --representation component_net --model FEGIN --layers 2 --hiddens 64 --batch_size 128 --lr 0.0001 --emb_size 512 --epochs 100 --save_appendix component_net_L2_H64_BS128_LR0.0001_E512 --no_val
 is saved.
-----
ltspice_examples - FEGIN
Using 2 layers, 64 hidden units, h = 2
Loading component_net representation dataset
ENTERED
Training FEGIN on component_net representation
Train: 3558, Test: 846
##################ITERATION #0 ****************************************
 epoch: 0, train_loss: 1.3645, test_loss: 1.3617, test_f1: 0.2270
 epoch: 1, train_loss: 1.3549, test_loss: 1.3554, test_f1: 0.2270
 epoch: 2, train_loss: 1.3486, test_loss: 1.3487, test_f1: 0.2270
 epoch: 3, train_loss: 1.3414, test_loss: 1.3414, test_f1: 0.2270
 epoch: 4, train_loss: 1.3329, test_loss: 1.3315, test_f1: 0.2270
 epoch: 5, train_loss: 1.3214, test_loss: 1.3189, test_f1: 0.2271
 epoch: 6, train_loss: 1.3075, test_loss: 1.3036, test_f1: 0.2271
 epoch: 7, train_loss: 1.2909, test_loss: 1.2847, test_f1: 0.2270
 epoch: 8, train_loss: 1.2739, test_loss: 1.2663, test_f1: 0.2275
 epoch: 9, train_loss: 1.2572, test_loss: 1.2491, test_f1: 0.2611
 epoch: 10, train_loss: 1.2394, test_loss: 1.2319, test_f1: 0.2709
 epoch: 11, train_loss: 1.2270, test_loss: 1.2148, test_f1: 0.2928
 epoch: 12, train_loss: 1.2155, test_loss: 1.1973, test_f1: 0.3182
 epoch: 13, train_loss: 1.1981, test_loss: 1.1794, test_f1: 0.3525
 epoch: 14, train_loss: 1.1843, test_loss: 1.1610, test_f1: 0.3683
 epoch: 15, train_loss: 1.1693, test_loss: 1.1435, test_f1: 0.3707
 epoch: 16, train_loss: 1.1506, test_loss: 1.1247, test_f1: 0.3899
 epoch: 17, train_loss: 1.1386, test_loss: 1.1059, test_f1: 0.4083
 epoch: 18, train_loss: 1.1245, test_loss: 1.0876, test_f1: 0.4293
 epoch: 19, train_loss: 1.1039, test_loss: 1.0716, test_f1: 0.4359
 epoch: 20, train_loss: 1.0888, test_loss: 1.0554, test_f1: 0.4448
 epoch: 21, train_loss: 1.0715, test_loss: 1.0382, test_f1: 0.4552
 epoch: 22, train_loss: 1.0551, test_loss: 1.0182, test_f1: 0.4627
 epoch: 23, train_loss: 1.0394, test_loss: 1.0059, test_f1: 0.4484
 epoch: 24, train_loss: 1.0309, test_loss: 0.9945, test_f1: 0.4676
 epoch: 25, train_loss: 1.0246, test_loss: 0.9862, test_f1: 0.4595
 epoch: 26, train_loss: 1.0097, test_loss: 0.9768, test_f1: 0.4702
 epoch: 27, train_loss: 1.0003, test_loss: 0.9702, test_f1: 0.4679
 epoch: 28, train_loss: 0.9875, test_loss: 0.9662, test_f1: 0.4662
 epoch: 29, train_loss: 0.9837, test_loss: 0.9621, test_f1: 0.4666
 epoch: 30, train_loss: 0.9723, test_loss: 0.9515, test_f1: 0.4772
 epoch: 31, train_loss: 0.9621, test_loss: 0.9521, test_f1: 0.4728
 epoch: 32, train_loss: 0.9561, test_loss: 0.9486, test_f1: 0.4814
 epoch: 33, train_loss: 0.9557, test_loss: 0.9404, test_f1: 0.4825
 epoch: 34, train_loss: 0.9499, test_loss: 0.9353, test_f1: 0.4843
 epoch: 35, train_loss: 0.9498, test_loss: 0.9388, test_f1: 0.4803
 epoch: 36, train_loss: 0.9484, test_loss: 0.9305, test_f1: 0.5027
 epoch: 37, train_loss: 0.9398, test_loss: 0.9299, test_f1: 0.4824
 epoch: 38, train_loss: 0.9351, test_loss: 0.9292, test_f1: 0.5057
 epoch: 39, train_loss: 0.9270, test_loss: 0.9217, test_f1: 0.5033
 epoch: 40, train_loss: 0.9257, test_loss: 0.9247, test_f1: 0.5022
 epoch: 41, train_loss: 0.9151, test_loss: 0.9322, test_f1: 0.5009
 epoch: 42, train_loss: 0.9197, test_loss: 0.9174, test_f1: 0.5056
 epoch: 43, train_loss: 0.9142, test_loss: 0.9132, test_f1: 0.5102
 epoch: 44, train_loss: 0.9133, test_loss: 0.9191, test_f1: 0.5052
 epoch: 45, train_loss: 0.9139, test_loss: 0.9131, test_f1: 0.5152
 epoch: 46, train_loss: 0.9094, test_loss: 0.9159, test_f1: 0.5082
 epoch: 47, train_loss: 0.8983, test_loss: 0.9145, test_f1: 0.5118
 epoch: 48, train_loss: 0.9008, test_loss: 0.9105, test_f1: 0.5071
 epoch: 49, train_loss: 0.9001, test_loss: 0.9099, test_f1: 0.5060
 epoch: 50, train_loss: 0.8979, test_loss: 0.9090, test_f1: 0.5134
 epoch: 51, train_loss: 0.8977, test_loss: 0.9075, test_f1: 0.5116
 epoch: 52, train_loss: 0.8911, test_loss: 0.9072, test_f1: 0.5172
 epoch: 53, train_loss: 0.8937, test_loss: 0.9106, test_f1: 0.5101
 epoch: 54, train_loss: 0.8911, test_loss: 0.9038, test_f1: 0.5162
 epoch: 55, train_loss: 0.8906, test_loss: 0.9021, test_f1: 0.5134
 epoch: 56, train_loss: 0.8934, test_loss: 0.9015, test_f1: 0.5121
 epoch: 57, train_loss: 0.8795, test_loss: 0.9003, test_f1: 0.5233
 epoch: 58, train_loss: 0.8870, test_loss: 0.9080, test_f1: 0.5113
 epoch: 59, train_loss: 0.8811, test_loss: 0.9063, test_f1: 0.5101
 epoch: 60, train_loss: 0.8751, test_loss: 0.9048, test_f1: 0.5151
 epoch: 61, train_loss: 0.8799, test_loss: 0.9083, test_f1: 0.5120
 epoch: 62, train_loss: 0.8828, test_loss: 0.9007, test_f1: 0.5229
 epoch: 63, train_loss: 0.8778, test_loss: 0.9030, test_f1: 0.5212
 epoch: 64, train_loss: 0.8749, test_loss: 0.9004, test_f1: 0.5155
 epoch: 65, train_loss: 0.8825, test_loss: 0.9059, test_f1: 0.5160
 epoch: 66, train_loss: 0.8680, test_loss: 0.8976, test_f1: 0.5207
 epoch: 67, train_loss: 0.8787, test_loss: 0.9068, test_f1: 0.5171
 epoch: 68, train_loss: 0.8711, test_loss: 0.9009, test_f1: 0.5130
 epoch: 69, train_loss: 0.8721, test_loss: 0.9078, test_f1: 0.5175
 epoch: 70, train_loss: 0.8708, test_loss: 0.8985, test_f1: 0.5258
 epoch: 71, train_loss: 0.8683, test_loss: 0.9026, test_f1: 0.5194
 epoch: 72, train_loss: 0.8694, test_loss: 0.9072, test_f1: 0.5127
 epoch: 73, train_loss: 0.8658, test_loss: 0.8954, test_f1: 0.5240
 epoch: 74, train_loss: 0.8704, test_loss: 0.9006, test_f1: 0.5158
 epoch: 75, train_loss: 0.8599, test_loss: 0.9045, test_f1: 0.5167
 epoch: 76, train_loss: 0.8651, test_loss: 0.9045, test_f1: 0.5149
 epoch: 77, train_loss: 0.8606, test_loss: 0.8975, test_f1: 0.5224
 epoch: 78, train_loss: 0.8636, test_loss: 0.9013, test_f1: 0.5268
 epoch: 79, train_loss: 0.8582, test_loss: 0.9027, test_f1: 0.5223
 epoch: 80, train_loss: 0.8548, test_loss: 0.8984, test_f1: 0.5174
 epoch: 81, train_loss: 0.8565, test_loss: 0.8968, test_f1: 0.5279
 epoch: 82, train_loss: 0.8642, test_loss: 0.9016, test_f1: 0.5267
 epoch: 83, train_loss: 0.8593, test_loss: 0.9064, test_f1: 0.5142
 epoch: 84, train_loss: 0.8567, test_loss: 0.9052, test_f1: 0.5235
 epoch: 85, train_loss: 0.8514, test_loss: 0.8972, test_f1: 0.5273
 epoch: 86, train_loss: 0.8517, test_loss: 0.9061, test_f1: 0.5229
 epoch: 87, train_loss: 0.8514, test_loss: 0.8912, test_f1: 0.5292
 epoch: 88, train_loss: 0.8472, test_loss: 0.9124, test_f1: 0.5221
 epoch: 89, train_loss: 0.8565, test_loss: 0.9015, test_f1: 0.5238
 epoch: 90, train_loss: 0.8524, test_loss: 0.9051, test_f1: 0.5255
 epoch: 91, train_loss: 0.8528, test_loss: 0.9048, test_f1: 0.5242
 epoch: 92, train_loss: 0.8514, test_loss: 0.9157, test_f1: 0.5201
 epoch: 93, train_loss: 0.8443, test_loss: 0.9039, test_f1: 0.5300
 epoch: 94, train_loss: 0.8438, test_loss: 0.9070, test_f1: 0.5253
 epoch: 95, train_loss: 0.8462, test_loss: 0.9001, test_f1: 0.5282
 epoch: 96, train_loss: 0.8471, test_loss: 0.8981, test_f1: 0.5292
 epoch: 97, train_loss: 0.8492, test_loss: 0.9103, test_f1: 0.5255
 epoch: 98, train_loss: 0.8417, test_loss: 0.9028, test_f1: 0.5268
 epoch: 99, train_loss: 0.8453, test_loss: 0.9066, test_f1: 0.5305
##################ITERATION #1 ****************************************
 epoch: 0, train_loss: 1.3193, test_loss: 1.3295, test_f1: 0.2270
 epoch: 1, train_loss: 1.2898, test_loss: 1.2960, test_f1: 0.2320
 epoch: 2, train_loss: 1.2696, test_loss: 1.2611, test_f1: 0.2819
 epoch: 3, train_loss: 1.2521, test_loss: 1.2381, test_f1: 0.2851
 epoch: 4, train_loss: 1.2376, test_loss: 1.2198, test_f1: 0.2936
 epoch: 5, train_loss: 1.2198, test_loss: 1.2020, test_f1: 0.2961
 epoch: 6, train_loss: 1.2029, test_loss: 1.1847, test_f1: 0.3049
 epoch: 7, train_loss: 1.1902, test_loss: 1.1672, test_f1: 0.3145
 epoch: 8, train_loss: 1.1777, test_loss: 1.1491, test_f1: 0.3421
 epoch: 9, train_loss: 1.1587, test_loss: 1.1307, test_f1: 0.3632
 epoch: 10, train_loss: 1.1414, test_loss: 1.1123, test_f1: 0.3844
 epoch: 11, train_loss: 1.1303, test_loss: 1.0937, test_f1: 0.3913
 epoch: 12, train_loss: 1.1126, test_loss: 1.0773, test_f1: 0.3938
 epoch: 13, train_loss: 1.0987, test_loss: 1.0626, test_f1: 0.3991
 epoch: 14, train_loss: 1.0800, test_loss: 1.0446, test_f1: 0.4217
 epoch: 15, train_loss: 1.0618, test_loss: 1.0325, test_f1: 0.4274
 epoch: 16, train_loss: 1.0507, test_loss: 1.0210, test_f1: 0.4308
 epoch: 17, train_loss: 1.0355, test_loss: 1.0105, test_f1: 0.4427
 epoch: 18, train_loss: 1.0257, test_loss: 0.9984, test_f1: 0.4427
 epoch: 19, train_loss: 1.0216, test_loss: 0.9942, test_f1: 0.4529
 epoch: 20, train_loss: 1.0092, test_loss: 0.9819, test_f1: 0.4614
 epoch: 21, train_loss: 1.0054, test_loss: 0.9803, test_f1: 0.4626
 epoch: 22, train_loss: 0.9890, test_loss: 0.9723, test_f1: 0.4704
 epoch: 23, train_loss: 0.9838, test_loss: 0.9783, test_f1: 0.4699
 epoch: 24, train_loss: 0.9783, test_loss: 0.9686, test_f1: 0.4715
 epoch: 25, train_loss: 0.9752, test_loss: 0.9663, test_f1: 0.4750
 epoch: 26, train_loss: 0.9707, test_loss: 0.9538, test_f1: 0.4836
 epoch: 27, train_loss: 0.9615, test_loss: 0.9582, test_f1: 0.4797
 epoch: 28, train_loss: 0.9552, test_loss: 0.9615, test_f1: 0.4957
 epoch: 29, train_loss: 0.9533, test_loss: 0.9527, test_f1: 0.4768
 epoch: 30, train_loss: 0.9460, test_loss: 0.9524, test_f1: 0.4771
 epoch: 31, train_loss: 0.9415, test_loss: 0.9481, test_f1: 0.4835
 epoch: 32, train_loss: 0.9403, test_loss: 0.9568, test_f1: 0.4773
 epoch: 33, train_loss: 0.9315, test_loss: 0.9445, test_f1: 0.4761
 epoch: 34, train_loss: 0.9358, test_loss: 0.9473, test_f1: 0.4781
 epoch: 35, train_loss: 0.9308, test_loss: 0.9470, test_f1: 0.4833
 epoch: 36, train_loss: 0.9206, test_loss: 0.9481, test_f1: 0.4767
 epoch: 37, train_loss: 0.9186, test_loss: 0.9466, test_f1: 0.5048
 epoch: 38, train_loss: 0.9160, test_loss: 0.9411, test_f1: 0.4943
 epoch: 39, train_loss: 0.9146, test_loss: 0.9490, test_f1: 0.4833
 epoch: 40, train_loss: 0.9087, test_loss: 0.9514, test_f1: 0.4898
 epoch: 41, train_loss: 0.9012, test_loss: 0.9488, test_f1: 0.4952
 epoch: 42, train_loss: 0.9122, test_loss: 0.9478, test_f1: 0.4837
 epoch: 43, train_loss: 0.8968, test_loss: 0.9459, test_f1: 0.4880
 epoch: 44, train_loss: 0.8947, test_loss: 0.9562, test_f1: 0.4909
 epoch: 45, train_loss: 0.8908, test_loss: 0.9354, test_f1: 0.4955
 epoch: 46, train_loss: 0.8955, test_loss: 0.9501, test_f1: 0.4847
 epoch: 47, train_loss: 0.8854, test_loss: 0.9618, test_f1: 0.4768
 epoch: 48, train_loss: 0.8884, test_loss: 0.9467, test_f1: 0.4837
 epoch: 49, train_loss: 0.8784, test_loss: 0.9455, test_f1: 0.5006
 epoch: 50, train_loss: 0.8792, test_loss: 0.9651, test_f1: 0.4954
 epoch: 51, train_loss: 0.8772, test_loss: 0.9583, test_f1: 0.4939
 epoch: 52, train_loss: 0.8783, test_loss: 0.9599, test_f1: 0.4918
 epoch: 53, train_loss: 0.8734, test_loss: 0.9545, test_f1: 0.4957
 epoch: 54, train_loss: 0.8721, test_loss: 0.9590, test_f1: 0.4809
 epoch: 55, train_loss: 0.8763, test_loss: 0.9570, test_f1: 0.4889
 epoch: 56, train_loss: 0.8709, test_loss: 0.9496, test_f1: 0.4972
 epoch: 57, train_loss: 0.8709, test_loss: 0.9533, test_f1: 0.4900
 epoch: 58, train_loss: 0.8705, test_loss: 0.9499, test_f1: 0.4963
 epoch: 59, train_loss: 0.8693, test_loss: 0.9526, test_f1: 0.4974
 epoch: 60, train_loss: 0.8653, test_loss: 0.9535, test_f1: 0.4919
 epoch: 61, train_loss: 0.8651, test_loss: 0.9460, test_f1: 0.5045
 epoch: 62, train_loss: 0.8620, test_loss: 0.9449, test_f1: 0.5006
 epoch: 63, train_loss: 0.8624, test_loss: 0.9577, test_f1: 0.4992
 epoch: 64, train_loss: 0.8587, test_loss: 0.9532, test_f1: 0.5095
 epoch: 65, train_loss: 0.8555, test_loss: 0.9558, test_f1: 0.5067
 epoch: 66, train_loss: 0.8532, test_loss: 0.9536, test_f1: 0.5074
 epoch: 67, train_loss: 0.8562, test_loss: 0.9521, test_f1: 0.5052
 epoch: 68, train_loss: 0.8557, test_loss: 0.9514, test_f1: 0.5041
 epoch: 69, train_loss: 0.8506, test_loss: 0.9590, test_f1: 0.5026
 epoch: 70, train_loss: 0.8512, test_loss: 0.9486, test_f1: 0.4911
 epoch: 71, train_loss: 0.8509, test_loss: 0.9526, test_f1: 0.5086
 epoch: 72, train_loss: 0.8493, test_loss: 0.9518, test_f1: 0.4946
 epoch: 73, train_loss: 0.8558, test_loss: 0.9547, test_f1: 0.5085
 epoch: 74, train_loss: 0.8423, test_loss: 0.9598, test_f1: 0.4945
 epoch: 75, train_loss: 0.8452, test_loss: 0.9600, test_f1: 0.5064
 epoch: 76, train_loss: 0.8539, test_loss: 0.9557, test_f1: 0.5016
 epoch: 77, train_loss: 0.8555, test_loss: 0.9477, test_f1: 0.5135
 epoch: 78, train_loss: 0.8449, test_loss: 0.9565, test_f1: 0.5082
 epoch: 79, train_loss: 0.8436, test_loss: 0.9458, test_f1: 0.5027
 epoch: 80, train_loss: 0.8429, test_loss: 0.9565, test_f1: 0.5013
 epoch: 81, train_loss: 0.8394, test_loss: 0.9610, test_f1: 0.5070
 epoch: 82, train_loss: 0.8460, test_loss: 0.9555, test_f1: 0.5054
 epoch: 83, train_loss: 0.8394, test_loss: 0.9618, test_f1: 0.5058
 epoch: 84, train_loss: 0.8361, test_loss: 0.9570, test_f1: 0.5072
 epoch: 85, train_loss: 0.8414, test_loss: 0.9578, test_f1: 0.5037
 epoch: 86, train_loss: 0.8319, test_loss: 0.9535, test_f1: 0.5058
 epoch: 87, train_loss: 0.8389, test_loss: 0.9477, test_f1: 0.5095
 epoch: 88, train_loss: 0.8389, test_loss: 0.9607, test_f1: 0.5155
 epoch: 89, train_loss: 0.8295, test_loss: 0.9515, test_f1: 0.5181
 epoch: 90, train_loss: 0.8415, test_loss: 0.9432, test_f1: 0.5137
 epoch: 91, train_loss: 0.8307, test_loss: 0.9477, test_f1: 0.5155
 epoch: 92, train_loss: 0.8316, test_loss: 0.9593, test_f1: 0.5123
 epoch: 93, train_loss: 0.8329, test_loss: 0.9616, test_f1: 0.5159
 epoch: 94, train_loss: 0.8334, test_loss: 0.9594, test_f1: 0.5113
 epoch: 95, train_loss: 0.8308, test_loss: 0.9624, test_f1: 0.5173
 epoch: 96, train_loss: 0.8368, test_loss: 0.9506, test_f1: 0.5188
 epoch: 97, train_loss: 0.8348, test_loss: 0.9572, test_f1: 0.5170
 epoch: 98, train_loss: 0.8300, test_loss: 0.9642, test_f1: 0.5167
 epoch: 99, train_loss: 0.8247, test_loss: 0.9676, test_f1: 0.5032
##################ITERATION #2 ****************************************
 epoch: 0, train_loss: 1.2810, test_loss: 1.3068, test_f1: 0.2270
 epoch: 1, train_loss: 1.2326, test_loss: 1.2529, test_f1: 0.2270
 epoch: 2, train_loss: 1.2107, test_loss: 1.1940, test_f1: 0.3142
 epoch: 3, train_loss: 1.1907, test_loss: 1.1646, test_f1: 0.3326
 epoch: 4, train_loss: 1.1746, test_loss: 1.1452, test_f1: 0.3407
 epoch: 5, train_loss: 1.1562, test_loss: 1.1234, test_f1: 0.3560
 epoch: 6, train_loss: 1.1359, test_loss: 1.1043, test_f1: 0.3546
 epoch: 7, train_loss: 1.1208, test_loss: 1.0818, test_f1: 0.3718
 epoch: 8, train_loss: 1.0990, test_loss: 1.0666, test_f1: 0.3885
 epoch: 9, train_loss: 1.0807, test_loss: 1.0503, test_f1: 0.3964
 epoch: 10, train_loss: 1.0642, test_loss: 1.0369, test_f1: 0.4078
 epoch: 11, train_loss: 1.0454, test_loss: 1.0218, test_f1: 0.4133
 epoch: 12, train_loss: 1.0328, test_loss: 1.0108, test_f1: 0.4322
 epoch: 13, train_loss: 1.0200, test_loss: 1.0005, test_f1: 0.4340
 epoch: 14, train_loss: 1.0073, test_loss: 0.9892, test_f1: 0.4342
 epoch: 15, train_loss: 1.0021, test_loss: 0.9873, test_f1: 0.4601
 epoch: 16, train_loss: 0.9896, test_loss: 0.9760, test_f1: 0.4604
 epoch: 17, train_loss: 0.9891, test_loss: 0.9651, test_f1: 0.4714
 epoch: 18, train_loss: 0.9744, test_loss: 0.9740, test_f1: 0.4677
 epoch: 19, train_loss: 0.9652, test_loss: 0.9791, test_f1: 0.4629
 epoch: 20, train_loss: 0.9665, test_loss: 0.9607, test_f1: 0.4713
 epoch: 21, train_loss: 0.9601, test_loss: 0.9583, test_f1: 0.4779
 epoch: 22, train_loss: 0.9498, test_loss: 0.9656, test_f1: 0.4789
 epoch: 23, train_loss: 0.9452, test_loss: 0.9526, test_f1: 0.4813
 epoch: 24, train_loss: 0.9439, test_loss: 0.9521, test_f1: 0.4860
 epoch: 25, train_loss: 0.9305, test_loss: 0.9575, test_f1: 0.4827
 epoch: 26, train_loss: 0.9252, test_loss: 0.9541, test_f1: 0.4865
 epoch: 27, train_loss: 0.9202, test_loss: 0.9558, test_f1: 0.4824
 epoch: 28, train_loss: 0.9259, test_loss: 0.9502, test_f1: 0.4913
 epoch: 29, train_loss: 0.9107, test_loss: 0.9589, test_f1: 0.4777
 epoch: 30, train_loss: 0.9117, test_loss: 0.9327, test_f1: 0.5070
 epoch: 31, train_loss: 0.9045, test_loss: 0.9575, test_f1: 0.4932
 epoch: 32, train_loss: 0.9015, test_loss: 0.9462, test_f1: 0.4956
 epoch: 33, train_loss: 0.8955, test_loss: 0.9454, test_f1: 0.5031
 epoch: 34, train_loss: 0.8941, test_loss: 0.9568, test_f1: 0.5140
 epoch: 35, train_loss: 0.8892, test_loss: 0.9380, test_f1: 0.5134
 epoch: 36, train_loss: 0.8904, test_loss: 0.9677, test_f1: 0.4944
 epoch: 37, train_loss: 0.8826, test_loss: 0.9385, test_f1: 0.5196
 epoch: 38, train_loss: 0.8753, test_loss: 0.9400, test_f1: 0.5206
 epoch: 39, train_loss: 0.8757, test_loss: 0.9645, test_f1: 0.5203
 epoch: 40, train_loss: 0.8719, test_loss: 0.9604, test_f1: 0.5228
 epoch: 41, train_loss: 0.8703, test_loss: 0.9632, test_f1: 0.5211
 epoch: 42, train_loss: 0.8668, test_loss: 0.9447, test_f1: 0.5237
 epoch: 43, train_loss: 0.8607, test_loss: 0.9320, test_f1: 0.5334
 epoch: 44, train_loss: 0.8553, test_loss: 0.9596, test_f1: 0.5226
 epoch: 45, train_loss: 0.8584, test_loss: 0.9619, test_f1: 0.5159
 epoch: 46, train_loss: 0.8584, test_loss: 0.9589, test_f1: 0.5305
 epoch: 47, train_loss: 0.8508, test_loss: 0.9482, test_f1: 0.5188
 epoch: 48, train_loss: 0.8440, test_loss: 0.9374, test_f1: 0.5237
 epoch: 49, train_loss: 0.8439, test_loss: 0.9427, test_f1: 0.5296
 epoch: 50, train_loss: 0.8383, test_loss: 0.9593, test_f1: 0.5301
 epoch: 51, train_loss: 0.8453, test_loss: 0.9528, test_f1: 0.5314
 epoch: 52, train_loss: 0.8377, test_loss: 0.9529, test_f1: 0.5307
 epoch: 53, train_loss: 0.8300, test_loss: 0.9775, test_f1: 0.5236
 epoch: 54, train_loss: 0.8407, test_loss: 0.9432, test_f1: 0.5337
 epoch: 55, train_loss: 0.8371, test_loss: 0.9424, test_f1: 0.5306
 epoch: 56, train_loss: 0.8269, test_loss: 0.9566, test_f1: 0.5339
 epoch: 57, train_loss: 0.8253, test_loss: 0.9446, test_f1: 0.5340
 epoch: 58, train_loss: 0.8303, test_loss: 0.9673, test_f1: 0.5265
 epoch: 59, train_loss: 0.8236, test_loss: 0.9752, test_f1: 0.5316
 epoch: 60, train_loss: 0.8222, test_loss: 0.9547, test_f1: 0.5375
 epoch: 61, train_loss: 0.8269, test_loss: 0.9530, test_f1: 0.5333
 epoch: 62, train_loss: 0.8285, test_loss: 0.9726, test_f1: 0.5350
 epoch: 63, train_loss: 0.8220, test_loss: 0.9742, test_f1: 0.5372
 epoch: 64, train_loss: 0.8149, test_loss: 0.9642, test_f1: 0.5365
 epoch: 65, train_loss: 0.8254, test_loss: 0.9612, test_f1: 0.5409
 epoch: 66, train_loss: 0.8188, test_loss: 0.9529, test_f1: 0.5361
 epoch: 67, train_loss: 0.8082, test_loss: 0.9574, test_f1: 0.5336
 epoch: 68, train_loss: 0.8170, test_loss: 0.9671, test_f1: 0.5386
 epoch: 69, train_loss: 0.8086, test_loss: 0.9615, test_f1: 0.5376
 epoch: 70, train_loss: 0.8129, test_loss: 0.9582, test_f1: 0.5384
 epoch: 71, train_loss: 0.8130, test_loss: 0.9681, test_f1: 0.5384
 epoch: 72, train_loss: 0.8089, test_loss: 0.9535, test_f1: 0.5386
 epoch: 73, train_loss: 0.8085, test_loss: 0.9608, test_f1: 0.5386
 epoch: 74, train_loss: 0.8172, test_loss: 0.9515, test_f1: 0.5318
 epoch: 75, train_loss: 0.8131, test_loss: 0.9580, test_f1: 0.5374
 epoch: 76, train_loss: 0.8052, test_loss: 0.9637, test_f1: 0.5358
 epoch: 77, train_loss: 0.8091, test_loss: 0.9817, test_f1: 0.5356
 epoch: 78, train_loss: 0.8007, test_loss: 0.9604, test_f1: 0.5280
 epoch: 79, train_loss: 0.8032, test_loss: 0.9740, test_f1: 0.5349
 epoch: 80, train_loss: 0.8037, test_loss: 0.9505, test_f1: 0.5417
 epoch: 81, train_loss: 0.7999, test_loss: 0.9719, test_f1: 0.5374
 epoch: 82, train_loss: 0.7934, test_loss: 0.9743, test_f1: 0.5284
 epoch: 83, train_loss: 0.7920, test_loss: 0.9615, test_f1: 0.5315
 epoch: 84, train_loss: 0.7952, test_loss: 0.9831, test_f1: 0.5325
 epoch: 85, train_loss: 0.7951, test_loss: 0.9918, test_f1: 0.5305
 epoch: 86, train_loss: 0.7990, test_loss: 0.9635, test_f1: 0.5382
 epoch: 87, train_loss: 0.7933, test_loss: 0.9757, test_f1: 0.5320
 epoch: 88, train_loss: 0.7897, test_loss: 0.9712, test_f1: 0.5239
 epoch: 89, train_loss: 0.7904, test_loss: 0.9928, test_f1: 0.5260
 epoch: 90, train_loss: 0.7984, test_loss: 0.9838, test_f1: 0.5308
 epoch: 91, train_loss: 0.7863, test_loss: 0.9708, test_f1: 0.5313
 epoch: 92, train_loss: 0.7867, test_loss: 0.9625, test_f1: 0.5371
 epoch: 93, train_loss: 0.7906, test_loss: 0.9749, test_f1: 0.5304
 epoch: 94, train_loss: 0.7999, test_loss: 0.9896, test_f1: 0.5259
 epoch: 95, train_loss: 0.7844, test_loss: 0.9764, test_f1: 0.5350
 epoch: 96, train_loss: 0.7894, test_loss: 0.9842, test_f1: 0.5254
 epoch: 97, train_loss: 0.7734, test_loss: 0.9663, test_f1: 0.5336
 epoch: 98, train_loss: 0.7755, test_loss: 0.9800, test_f1: 0.5258
 epoch: 99, train_loss: 0.7844, test_loss: 0.9758, test_f1: 0.5279
##################ITERATION #3 ****************************************
 epoch: 0, train_loss: 1.2873, test_loss: 1.2934, test_f1: 0.2270
 epoch: 1, train_loss: 1.2250, test_loss: 1.2383, test_f1: 0.2270
 epoch: 2, train_loss: 1.2049, test_loss: 1.1814, test_f1: 0.3073
 epoch: 3, train_loss: 1.1815, test_loss: 1.1501, test_f1: 0.3310
 epoch: 4, train_loss: 1.1596, test_loss: 1.1278, test_f1: 0.3400
 epoch: 5, train_loss: 1.1447, test_loss: 1.1061, test_f1: 0.3423
 epoch: 6, train_loss: 1.1229, test_loss: 1.0847, test_f1: 0.3501
 epoch: 7, train_loss: 1.1039, test_loss: 1.0671, test_f1: 0.3684
 epoch: 8, train_loss: 1.0951, test_loss: 1.0487, test_f1: 0.3737
 epoch: 9, train_loss: 1.0754, test_loss: 1.0375, test_f1: 0.4045
 epoch: 10, train_loss: 1.0577, test_loss: 1.0226, test_f1: 0.4126
 epoch: 11, train_loss: 1.0448, test_loss: 1.0117, test_f1: 0.4195
 epoch: 12, train_loss: 1.0347, test_loss: 1.0059, test_f1: 0.4348
 epoch: 13, train_loss: 1.0267, test_loss: 0.9991, test_f1: 0.4394
 epoch: 14, train_loss: 1.0105, test_loss: 0.9835, test_f1: 0.4461
 epoch: 15, train_loss: 1.0023, test_loss: 0.9745, test_f1: 0.4550
 epoch: 16, train_loss: 0.9920, test_loss: 0.9685, test_f1: 0.4581
 epoch: 17, train_loss: 0.9848, test_loss: 0.9599, test_f1: 0.4606
 epoch: 18, train_loss: 0.9879, test_loss: 0.9587, test_f1: 0.4622
 epoch: 19, train_loss: 0.9694, test_loss: 0.9534, test_f1: 0.4702
 epoch: 20, train_loss: 0.9699, test_loss: 0.9425, test_f1: 0.4796
 epoch: 21, train_loss: 0.9556, test_loss: 0.9370, test_f1: 0.4938
 epoch: 22, train_loss: 0.9527, test_loss: 0.9427, test_f1: 0.4898
 epoch: 23, train_loss: 0.9491, test_loss: 0.9319, test_f1: 0.4962
 epoch: 24, train_loss: 0.9386, test_loss: 0.9240, test_f1: 0.4998
 epoch: 25, train_loss: 0.9377, test_loss: 0.9216, test_f1: 0.4980
 epoch: 26, train_loss: 0.9316, test_loss: 0.9172, test_f1: 0.5077
 epoch: 27, train_loss: 0.9264, test_loss: 0.9228, test_f1: 0.5025
 epoch: 28, train_loss: 0.9231, test_loss: 0.9213, test_f1: 0.5057
 epoch: 29, train_loss: 0.9235, test_loss: 0.9117, test_f1: 0.5058
 epoch: 30, train_loss: 0.9147, test_loss: 0.9103, test_f1: 0.5210
 epoch: 31, train_loss: 0.9136, test_loss: 0.9149, test_f1: 0.5103
 epoch: 32, train_loss: 0.9131, test_loss: 0.9086, test_f1: 0.5135
 epoch: 33, train_loss: 0.9012, test_loss: 0.9059, test_f1: 0.5148
 epoch: 34, train_loss: 0.9009, test_loss: 0.9058, test_f1: 0.5184
 epoch: 35, train_loss: 0.8984, test_loss: 0.9021, test_f1: 0.5293
 epoch: 36, train_loss: 0.8923, test_loss: 0.9067, test_f1: 0.5060
 epoch: 37, train_loss: 0.8835, test_loss: 0.8952, test_f1: 0.5370
 epoch: 38, train_loss: 0.8918, test_loss: 0.8990, test_f1: 0.5316
 epoch: 39, train_loss: 0.8861, test_loss: 0.8956, test_f1: 0.5395
 epoch: 40, train_loss: 0.8786, test_loss: 0.8985, test_f1: 0.5166
 epoch: 41, train_loss: 0.8833, test_loss: 0.8930, test_f1: 0.5276
 epoch: 42, train_loss: 0.8785, test_loss: 0.8895, test_f1: 0.5309
 epoch: 43, train_loss: 0.8733, test_loss: 0.8947, test_f1: 0.5393
 epoch: 44, train_loss: 0.8680, test_loss: 0.8976, test_f1: 0.5265
 epoch: 45, train_loss: 0.8578, test_loss: 0.8920, test_f1: 0.5188
 epoch: 46, train_loss: 0.8679, test_loss: 0.8934, test_f1: 0.5249
 epoch: 47, train_loss: 0.8655, test_loss: 0.9008, test_f1: 0.5348
 epoch: 48, train_loss: 0.8634, test_loss: 0.8868, test_f1: 0.5327
 epoch: 49, train_loss: 0.8573, test_loss: 0.8967, test_f1: 0.5314
 epoch: 50, train_loss: 0.8615, test_loss: 0.9019, test_f1: 0.5374
 epoch: 51, train_loss: 0.8583, test_loss: 0.9017, test_f1: 0.5281
 epoch: 52, train_loss: 0.8543, test_loss: 0.8943, test_f1: 0.5369
 epoch: 53, train_loss: 0.8469, test_loss: 0.8992, test_f1: 0.5333
 epoch: 54, train_loss: 0.8359, test_loss: 0.8876, test_f1: 0.5331
 epoch: 55, train_loss: 0.8446, test_loss: 0.8930, test_f1: 0.5475
 epoch: 56, train_loss: 0.8428, test_loss: 0.8846, test_f1: 0.5455
 epoch: 57, train_loss: 0.8378, test_loss: 0.8912, test_f1: 0.5442
 epoch: 58, train_loss: 0.8383, test_loss: 0.8885, test_f1: 0.5337
 epoch: 59, train_loss: 0.8360, test_loss: 0.8945, test_f1: 0.5332
 epoch: 60, train_loss: 0.8382, test_loss: 0.8952, test_f1: 0.5356
 epoch: 61, train_loss: 0.8424, test_loss: 0.8892, test_f1: 0.5381
 epoch: 62, train_loss: 0.8331, test_loss: 0.8836, test_f1: 0.5396
 epoch: 63, train_loss: 0.8289, test_loss: 0.8897, test_f1: 0.5381
 epoch: 64, train_loss: 0.8396, test_loss: 0.8950, test_f1: 0.5467
 epoch: 65, train_loss: 0.8201, test_loss: 0.8943, test_f1: 0.5491
 epoch: 66, train_loss: 0.8406, test_loss: 0.8878, test_f1: 0.5450
 epoch: 67, train_loss: 0.8285, test_loss: 0.8898, test_f1: 0.5491
 epoch: 68, train_loss: 0.8306, test_loss: 0.8876, test_f1: 0.5511
 epoch: 69, train_loss: 0.8325, test_loss: 0.8820, test_f1: 0.5401
 epoch: 70, train_loss: 0.8266, test_loss: 0.8861, test_f1: 0.5396
 epoch: 71, train_loss: 0.8243, test_loss: 0.8955, test_f1: 0.5314
 epoch: 72, train_loss: 0.8307, test_loss: 0.8868, test_f1: 0.5347
 epoch: 73, train_loss: 0.8196, test_loss: 0.8865, test_f1: 0.5496
 epoch: 74, train_loss: 0.8129, test_loss: 0.8860, test_f1: 0.5430
 epoch: 75, train_loss: 0.8287, test_loss: 0.8822, test_f1: 0.5459
 epoch: 76, train_loss: 0.8131, test_loss: 0.8969, test_f1: 0.5496
 epoch: 77, train_loss: 0.8222, test_loss: 0.8941, test_f1: 0.5456
 epoch: 78, train_loss: 0.8149, test_loss: 0.8897, test_f1: 0.5451
 epoch: 79, train_loss: 0.8188, test_loss: 0.8952, test_f1: 0.5475
 epoch: 80, train_loss: 0.8139, test_loss: 0.8901, test_f1: 0.5471
 epoch: 81, train_loss: 0.8205, test_loss: 0.8993, test_f1: 0.5466
 epoch: 82, train_loss: 0.8117, test_loss: 0.8811, test_f1: 0.5477
 epoch: 83, train_loss: 0.8099, test_loss: 0.9030, test_f1: 0.5500
 epoch: 84, train_loss: 0.8097, test_loss: 0.8891, test_f1: 0.5461
 epoch: 85, train_loss: 0.8094, test_loss: 0.8901, test_f1: 0.5472
 epoch: 86, train_loss: 0.8065, test_loss: 0.8836, test_f1: 0.5526
 epoch: 87, train_loss: 0.8149, test_loss: 0.8996, test_f1: 0.5470
 epoch: 88, train_loss: 0.8114, test_loss: 0.8825, test_f1: 0.5493
 epoch: 89, train_loss: 0.8139, test_loss: 0.8891, test_f1: 0.5504
 epoch: 90, train_loss: 0.8026, test_loss: 0.8895, test_f1: 0.5497
 epoch: 91, train_loss: 0.8040, test_loss: 0.8830, test_f1: 0.5499
 epoch: 92, train_loss: 0.8020, test_loss: 0.9093, test_f1: 0.5547
 epoch: 93, train_loss: 0.8110, test_loss: 0.8975, test_f1: 0.5408
 epoch: 94, train_loss: 0.8043, test_loss: 0.9016, test_f1: 0.5559
 epoch: 95, train_loss: 0.8100, test_loss: 0.8925, test_f1: 0.5540
 epoch: 96, train_loss: 0.8072, test_loss: 0.8884, test_f1: 0.5576
 epoch: 97, train_loss: 0.8017, test_loss: 0.8904, test_f1: 0.5492
 epoch: 98, train_loss: 0.8001, test_loss: 0.8900, test_f1: 0.5541
 epoch: 99, train_loss: 0.7939, test_loss: 0.8964, test_f1: 0.5554
##################ITERATION #4 ****************************************
 epoch: 0, train_loss: 1.2805, test_loss: 1.2911, test_f1: 0.2270
 epoch: 1, train_loss: 1.2062, test_loss: 1.2068, test_f1: 0.3290
 epoch: 2, train_loss: 1.1854, test_loss: 1.1506, test_f1: 0.3682
 epoch: 3, train_loss: 1.1617, test_loss: 1.1201, test_f1: 0.3924
 epoch: 4, train_loss: 1.1427, test_loss: 1.0982, test_f1: 0.4150
 epoch: 5, train_loss: 1.1328, test_loss: 1.0816, test_f1: 0.4121
 epoch: 6, train_loss: 1.1056, test_loss: 1.0697, test_f1: 0.4185
 epoch: 7, train_loss: 1.0917, test_loss: 1.0501, test_f1: 0.4280
 epoch: 8, train_loss: 1.0777, test_loss: 1.0366, test_f1: 0.4295
 epoch: 9, train_loss: 1.0714, test_loss: 1.0270, test_f1: 0.4447
 epoch: 10, train_loss: 1.0515, test_loss: 1.0144, test_f1: 0.4519
 epoch: 11, train_loss: 1.0445, test_loss: 1.0038, test_f1: 0.4565
 epoch: 12, train_loss: 1.0271, test_loss: 0.9891, test_f1: 0.4719
 epoch: 13, train_loss: 1.0212, test_loss: 0.9862, test_f1: 0.4661
 epoch: 14, train_loss: 1.0105, test_loss: 0.9820, test_f1: 0.4681
 epoch: 15, train_loss: 0.9966, test_loss: 0.9688, test_f1: 0.4822
 epoch: 16, train_loss: 0.9908, test_loss: 0.9579, test_f1: 0.4840
 epoch: 17, train_loss: 0.9848, test_loss: 0.9583, test_f1: 0.4921
 epoch: 18, train_loss: 0.9735, test_loss: 0.9557, test_f1: 0.4849
 epoch: 19, train_loss: 0.9689, test_loss: 0.9473, test_f1: 0.4977
 epoch: 20, train_loss: 0.9592, test_loss: 0.9419, test_f1: 0.4956
 epoch: 21, train_loss: 0.9557, test_loss: 0.9383, test_f1: 0.4970
 epoch: 22, train_loss: 0.9491, test_loss: 0.9338, test_f1: 0.4930
 epoch: 23, train_loss: 0.9491, test_loss: 0.9311, test_f1: 0.4992
 epoch: 24, train_loss: 0.9348, test_loss: 0.9242, test_f1: 0.4954
 epoch: 25, train_loss: 0.9400, test_loss: 0.9180, test_f1: 0.4947
 epoch: 26, train_loss: 0.9309, test_loss: 0.9169, test_f1: 0.5052
 epoch: 27, train_loss: 0.9259, test_loss: 0.9143, test_f1: 0.5031
 epoch: 28, train_loss: 0.9307, test_loss: 0.9151, test_f1: 0.5141
 epoch: 29, train_loss: 0.9253, test_loss: 0.9084, test_f1: 0.5021
 epoch: 30, train_loss: 0.9131, test_loss: 0.9084, test_f1: 0.5126
 epoch: 31, train_loss: 0.9101, test_loss: 0.8965, test_f1: 0.5153
 epoch: 32, train_loss: 0.9078, test_loss: 0.8977, test_f1: 0.5184
 epoch: 33, train_loss: 0.9002, test_loss: 0.8985, test_f1: 0.5264
 epoch: 34, train_loss: 0.9014, test_loss: 0.8955, test_f1: 0.5148
 epoch: 35, train_loss: 0.8933, test_loss: 0.8919, test_f1: 0.5242
 epoch: 36, train_loss: 0.8931, test_loss: 0.8876, test_f1: 0.5309
 epoch: 37, train_loss: 0.8960, test_loss: 0.8842, test_f1: 0.5257
 epoch: 38, train_loss: 0.8980, test_loss: 0.8831, test_f1: 0.5252
 epoch: 39, train_loss: 0.8883, test_loss: 0.8863, test_f1: 0.5196
 epoch: 40, train_loss: 0.8822, test_loss: 0.8785, test_f1: 0.5253
 epoch: 41, train_loss: 0.8763, test_loss: 0.8840, test_f1: 0.5417
 epoch: 42, train_loss: 0.8724, test_loss: 0.8757, test_f1: 0.5284
 epoch: 43, train_loss: 0.8691, test_loss: 0.8832, test_f1: 0.5317
 epoch: 44, train_loss: 0.8653, test_loss: 0.8913, test_f1: 0.5299
 epoch: 45, train_loss: 0.8736, test_loss: 0.8805, test_f1: 0.5273
 epoch: 46, train_loss: 0.8739, test_loss: 0.8724, test_f1: 0.5296
 epoch: 47, train_loss: 0.8627, test_loss: 0.8708, test_f1: 0.5444
 epoch: 48, train_loss: 0.8602, test_loss: 0.8766, test_f1: 0.5297
 epoch: 49, train_loss: 0.8651, test_loss: 0.8712, test_f1: 0.5291
 epoch: 50, train_loss: 0.8524, test_loss: 0.8685, test_f1: 0.5469
 epoch: 51, train_loss: 0.8544, test_loss: 0.8695, test_f1: 0.5360
 epoch: 52, train_loss: 0.8501, test_loss: 0.8698, test_f1: 0.5361
 epoch: 53, train_loss: 0.8556, test_loss: 0.8671, test_f1: 0.5448
 epoch: 54, train_loss: 0.8492, test_loss: 0.8651, test_f1: 0.5450
 epoch: 55, train_loss: 0.8444, test_loss: 0.8645, test_f1: 0.5319
 epoch: 56, train_loss: 0.8545, test_loss: 0.8734, test_f1: 0.5480
 epoch: 57, train_loss: 0.8365, test_loss: 0.8672, test_f1: 0.5492
 epoch: 58, train_loss: 0.8527, test_loss: 0.8718, test_f1: 0.5405
 epoch: 59, train_loss: 0.8420, test_loss: 0.8736, test_f1: 0.5526
 epoch: 60, train_loss: 0.8450, test_loss: 0.8684, test_f1: 0.5468
 epoch: 61, train_loss: 0.8382, test_loss: 0.8726, test_f1: 0.5529
 epoch: 62, train_loss: 0.8444, test_loss: 0.8668, test_f1: 0.5449
 epoch: 63, train_loss: 0.8352, test_loss: 0.8640, test_f1: 0.5501
 epoch: 64, train_loss: 0.8413, test_loss: 0.8653, test_f1: 0.5543
 epoch: 65, train_loss: 0.8398, test_loss: 0.8636, test_f1: 0.5403
 epoch: 66, train_loss: 0.8292, test_loss: 0.8656, test_f1: 0.5495
 epoch: 67, train_loss: 0.8276, test_loss: 0.8630, test_f1: 0.5532
 epoch: 68, train_loss: 0.8309, test_loss: 0.8641, test_f1: 0.5495
 epoch: 69, train_loss: 0.8322, test_loss: 0.8660, test_f1: 0.5448
 epoch: 70, train_loss: 0.8376, test_loss: 0.8674, test_f1: 0.5496
 epoch: 71, train_loss: 0.8354, test_loss: 0.8670, test_f1: 0.5502
 epoch: 72, train_loss: 0.8264, test_loss: 0.8641, test_f1: 0.5610
 epoch: 73, train_loss: 0.8293, test_loss: 0.8633, test_f1: 0.5471
 epoch: 74, train_loss: 0.8258, test_loss: 0.8619, test_f1: 0.5516
 epoch: 75, train_loss: 0.8298, test_loss: 0.8656, test_f1: 0.5509
 epoch: 76, train_loss: 0.8211, test_loss: 0.8621, test_f1: 0.5500
 epoch: 77, train_loss: 0.8327, test_loss: 0.8695, test_f1: 0.5512
 epoch: 78, train_loss: 0.8204, test_loss: 0.8659, test_f1: 0.5462
 epoch: 79, train_loss: 0.8278, test_loss: 0.8698, test_f1: 0.5590
 epoch: 80, train_loss: 0.8208, test_loss: 0.8648, test_f1: 0.5474
 epoch: 81, train_loss: 0.8265, test_loss: 0.8713, test_f1: 0.5481
 epoch: 82, train_loss: 0.8248, test_loss: 0.8664, test_f1: 0.5553
 epoch: 83, train_loss: 0.8215, test_loss: 0.8582, test_f1: 0.5502
 epoch: 84, train_loss: 0.8143, test_loss: 0.8691, test_f1: 0.5612
 epoch: 85, train_loss: 0.8133, test_loss: 0.8607, test_f1: 0.5449
 epoch: 86, train_loss: 0.8110, test_loss: 0.8573, test_f1: 0.5566
 epoch: 87, train_loss: 0.8110, test_loss: 0.8621, test_f1: 0.5519
 epoch: 88, train_loss: 0.8160, test_loss: 0.8623, test_f1: 0.5573
 epoch: 89, train_loss: 0.8154, test_loss: 0.8616, test_f1: 0.5595
 epoch: 90, train_loss: 0.8157, test_loss: 0.8574, test_f1: 0.5591
 epoch: 91, train_loss: 0.8100, test_loss: 0.8656, test_f1: 0.5620
 epoch: 92, train_loss: 0.8119, test_loss: 0.8630, test_f1: 0.5573
 epoch: 93, train_loss: 0.8070, test_loss: 0.8622, test_f1: 0.5602
 epoch: 94, train_loss: 0.8101, test_loss: 0.8608, test_f1: 0.5620
 epoch: 95, train_loss: 0.8050, test_loss: 0.8600, test_f1: 0.5542
 epoch: 96, train_loss: 0.8075, test_loss: 0.8636, test_f1: 0.5576
 epoch: 97, train_loss: 0.8024, test_loss: 0.8667, test_f1: 0.5596
 epoch: 98, train_loss: 0.8061, test_loss: 0.8639, test_f1: 0.5600
 epoch: 99, train_loss: 0.8040, test_loss: 0.8635, test_f1: 0.5570
##################ITERATION #5 ****************************************
 epoch: 0, train_loss: 1.2778, test_loss: 1.2466, test_f1: 0.2270
 epoch: 1, train_loss: 1.2037, test_loss: 1.1668, test_f1: 0.3347
 epoch: 2, train_loss: 1.1684, test_loss: 1.1176, test_f1: 0.3707
 epoch: 3, train_loss: 1.1477, test_loss: 1.0944, test_f1: 0.3855
 epoch: 4, train_loss: 1.1342, test_loss: 1.0764, test_f1: 0.4061
 epoch: 5, train_loss: 1.1086, test_loss: 1.0611, test_f1: 0.4271
 epoch: 6, train_loss: 1.0962, test_loss: 1.0457, test_f1: 0.4472
 epoch: 7, train_loss: 1.0777, test_loss: 1.0360, test_f1: 0.4462
 epoch: 8, train_loss: 1.0651, test_loss: 1.0231, test_f1: 0.4629
 epoch: 9, train_loss: 1.0529, test_loss: 1.0131, test_f1: 0.4637
 epoch: 10, train_loss: 1.0396, test_loss: 0.9984, test_f1: 0.4794
 epoch: 11, train_loss: 1.0296, test_loss: 0.9869, test_f1: 0.4698
 epoch: 12, train_loss: 1.0185, test_loss: 0.9853, test_f1: 0.4718
 epoch: 13, train_loss: 1.0029, test_loss: 0.9734, test_f1: 0.4830
 epoch: 14, train_loss: 0.9887, test_loss: 0.9664, test_f1: 0.4903
 epoch: 15, train_loss: 0.9917, test_loss: 0.9681, test_f1: 0.4758
 epoch: 16, train_loss: 0.9853, test_loss: 0.9591, test_f1: 0.4935
 epoch: 17, train_loss: 0.9804, test_loss: 0.9538, test_f1: 0.4895
 epoch: 18, train_loss: 0.9728, test_loss: 0.9486, test_f1: 0.4856
 epoch: 19, train_loss: 0.9648, test_loss: 0.9499, test_f1: 0.4872
 epoch: 20, train_loss: 0.9584, test_loss: 0.9439, test_f1: 0.4907
 epoch: 21, train_loss: 0.9604, test_loss: 0.9466, test_f1: 0.4840
 epoch: 22, train_loss: 0.9499, test_loss: 0.9378, test_f1: 0.4818
 epoch: 23, train_loss: 0.9453, test_loss: 0.9357, test_f1: 0.4893
 epoch: 24, train_loss: 0.9444, test_loss: 0.9386, test_f1: 0.5017
 epoch: 25, train_loss: 0.9345, test_loss: 0.9395, test_f1: 0.4919
 epoch: 26, train_loss: 0.9374, test_loss: 0.9400, test_f1: 0.5123
 epoch: 27, train_loss: 0.9344, test_loss: 0.9391, test_f1: 0.5024
 epoch: 28, train_loss: 0.9318, test_loss: 0.9264, test_f1: 0.5102
 epoch: 29, train_loss: 0.9195, test_loss: 0.9299, test_f1: 0.4978
 epoch: 30, train_loss: 0.9164, test_loss: 0.9314, test_f1: 0.5131
 epoch: 31, train_loss: 0.9146, test_loss: 0.9309, test_f1: 0.5058
 epoch: 32, train_loss: 0.9181, test_loss: 0.9276, test_f1: 0.4976
 epoch: 33, train_loss: 0.9231, test_loss: 0.9312, test_f1: 0.5118
 epoch: 34, train_loss: 0.9166, test_loss: 0.9212, test_f1: 0.5166
 epoch: 35, train_loss: 0.9022, test_loss: 0.9306, test_f1: 0.5056
 epoch: 36, train_loss: 0.9031, test_loss: 0.9257, test_f1: 0.5153
 epoch: 37, train_loss: 0.9058, test_loss: 0.9284, test_f1: 0.5192
 epoch: 38, train_loss: 0.8997, test_loss: 0.9261, test_f1: 0.5162
 epoch: 39, train_loss: 0.8960, test_loss: 0.9152, test_f1: 0.5266
 epoch: 40, train_loss: 0.9000, test_loss: 0.9286, test_f1: 0.5060
 epoch: 41, train_loss: 0.8899, test_loss: 0.9310, test_f1: 0.5131
 epoch: 42, train_loss: 0.8928, test_loss: 0.9192, test_f1: 0.5264
 epoch: 43, train_loss: 0.8908, test_loss: 0.9333, test_f1: 0.5154
 epoch: 44, train_loss: 0.8834, test_loss: 0.9263, test_f1: 0.5079
 epoch: 45, train_loss: 0.8744, test_loss: 0.9258, test_f1: 0.5104
 epoch: 46, train_loss: 0.8789, test_loss: 0.9223, test_f1: 0.5095
 epoch: 47, train_loss: 0.8704, test_loss: 0.9169, test_f1: 0.5096
 epoch: 48, train_loss: 0.8783, test_loss: 0.9100, test_f1: 0.5199
 epoch: 49, train_loss: 0.8780, test_loss: 0.9235, test_f1: 0.5169
 epoch: 50, train_loss: 0.8693, test_loss: 0.9195, test_f1: 0.5290
 epoch: 51, train_loss: 0.8716, test_loss: 0.9122, test_f1: 0.5188
 epoch: 52, train_loss: 0.8677, test_loss: 0.9216, test_f1: 0.5090
 epoch: 53, train_loss: 0.8636, test_loss: 0.9193, test_f1: 0.5204
 epoch: 54, train_loss: 0.8585, test_loss: 0.9255, test_f1: 0.5083
 epoch: 55, train_loss: 0.8557, test_loss: 0.9288, test_f1: 0.5169
 epoch: 56, train_loss: 0.8538, test_loss: 0.9192, test_f1: 0.5186
 epoch: 57, train_loss: 0.8555, test_loss: 0.9226, test_f1: 0.5247
 epoch: 58, train_loss: 0.8580, test_loss: 0.9306, test_f1: 0.5229
 epoch: 59, train_loss: 0.8477, test_loss: 0.9205, test_f1: 0.5197
 epoch: 60, train_loss: 0.8528, test_loss: 0.9175, test_f1: 0.5261
 epoch: 61, train_loss: 0.8525, test_loss: 0.9205, test_f1: 0.5348
 epoch: 62, train_loss: 0.8582, test_loss: 0.9267, test_f1: 0.5286
 epoch: 63, train_loss: 0.8574, test_loss: 0.9133, test_f1: 0.5285
 epoch: 64, train_loss: 0.8569, test_loss: 0.9253, test_f1: 0.5336
 epoch: 65, train_loss: 0.8469, test_loss: 0.9202, test_f1: 0.5247
 epoch: 66, train_loss: 0.8476, test_loss: 0.9251, test_f1: 0.5316
 epoch: 67, train_loss: 0.8482, test_loss: 0.9161, test_f1: 0.5309
 epoch: 68, train_loss: 0.8488, test_loss: 0.9249, test_f1: 0.5248
 epoch: 69, train_loss: 0.8412, test_loss: 0.9243, test_f1: 0.5333
 epoch: 70, train_loss: 0.8394, test_loss: 0.9164, test_f1: 0.5299
 epoch: 71, train_loss: 0.8430, test_loss: 0.9171, test_f1: 0.5273
 epoch: 72, train_loss: 0.8475, test_loss: 0.9221, test_f1: 0.5182
 epoch: 73, train_loss: 0.8409, test_loss: 0.9236, test_f1: 0.5304
 epoch: 74, train_loss: 0.8393, test_loss: 0.9188, test_f1: 0.5200
 epoch: 75, train_loss: 0.8381, test_loss: 0.9219, test_f1: 0.5339
 epoch: 76, train_loss: 0.8348, test_loss: 0.9213, test_f1: 0.5310
 epoch: 77, train_loss: 0.8386, test_loss: 0.9287, test_f1: 0.5363
 epoch: 78, train_loss: 0.8355, test_loss: 0.9193, test_f1: 0.5271
 epoch: 79, train_loss: 0.8342, test_loss: 0.9205, test_f1: 0.5220
 epoch: 80, train_loss: 0.8329, test_loss: 0.9266, test_f1: 0.5326
 epoch: 81, train_loss: 0.8316, test_loss: 0.9246, test_f1: 0.5318
 epoch: 82, train_loss: 0.8415, test_loss: 0.9239, test_f1: 0.5306
 epoch: 83, train_loss: 0.8352, test_loss: 0.9231, test_f1: 0.5357
 epoch: 84, train_loss: 0.8236, test_loss: 0.9310, test_f1: 0.5344
 epoch: 85, train_loss: 0.8204, test_loss: 0.9288, test_f1: 0.5338
 epoch: 86, train_loss: 0.8275, test_loss: 0.9281, test_f1: 0.5394
 epoch: 87, train_loss: 0.8358, test_loss: 0.9301, test_f1: 0.5251
 epoch: 88, train_loss: 0.8319, test_loss: 0.9297, test_f1: 0.5360
 epoch: 89, train_loss: 0.8331, test_loss: 0.9216, test_f1: 0.5331
 epoch: 90, train_loss: 0.8228, test_loss: 0.9208, test_f1: 0.5333
 epoch: 91, train_loss: 0.8276, test_loss: 0.9387, test_f1: 0.5356
 epoch: 92, train_loss: 0.8249, test_loss: 0.9205, test_f1: 0.5339
 epoch: 93, train_loss: 0.8185, test_loss: 0.9267, test_f1: 0.5400
 epoch: 94, train_loss: 0.8203, test_loss: 0.9240, test_f1: 0.5449
 epoch: 95, train_loss: 0.8126, test_loss: 0.9269, test_f1: 0.5325
 epoch: 96, train_loss: 0.8178, test_loss: 0.9304, test_f1: 0.5262
 epoch: 97, train_loss: 0.8220, test_loss: 0.9167, test_f1: 0.5336
 epoch: 98, train_loss: 0.8178, test_loss: 0.9273, test_f1: 0.5326
 epoch: 99, train_loss: 0.8145, test_loss: 0.9389, test_f1: 0.5289
##################ITERATION #6 ****************************************
 epoch: 0, train_loss: 1.3169, test_loss: 1.3123, test_f1: 0.2270
 epoch: 1, train_loss: 1.2106, test_loss: 1.2120, test_f1: 0.2541
 epoch: 2, train_loss: 1.1802, test_loss: 1.1377, test_f1: 0.3419
 epoch: 3, train_loss: 1.1534, test_loss: 1.1046, test_f1: 0.3569
 epoch: 4, train_loss: 1.1375, test_loss: 1.0833, test_f1: 0.3821
 epoch: 5, train_loss: 1.1087, test_loss: 1.0683, test_f1: 0.4016
 epoch: 6, train_loss: 1.0922, test_loss: 1.0547, test_f1: 0.4149
 epoch: 7, train_loss: 1.0765, test_loss: 1.0405, test_f1: 0.4301
 epoch: 8, train_loss: 1.0580, test_loss: 1.0282, test_f1: 0.4412
 epoch: 9, train_loss: 1.0461, test_loss: 1.0250, test_f1: 0.4598
 epoch: 10, train_loss: 1.0326, test_loss: 1.0147, test_f1: 0.4536
 epoch: 11, train_loss: 1.0267, test_loss: 1.0091, test_f1: 0.4711
 epoch: 12, train_loss: 1.0163, test_loss: 1.0076, test_f1: 0.4542
 epoch: 13, train_loss: 1.0075, test_loss: 1.0016, test_f1: 0.4551
 epoch: 14, train_loss: 0.9977, test_loss: 0.9984, test_f1: 0.4768
 epoch: 15, train_loss: 0.9898, test_loss: 0.9936, test_f1: 0.4795
 epoch: 16, train_loss: 0.9866, test_loss: 0.9881, test_f1: 0.4773
 epoch: 17, train_loss: 0.9809, test_loss: 0.9834, test_f1: 0.4913
 epoch: 18, train_loss: 0.9732, test_loss: 0.9815, test_f1: 0.4808
 epoch: 19, train_loss: 0.9685, test_loss: 0.9811, test_f1: 0.4843
 epoch: 20, train_loss: 0.9584, test_loss: 0.9803, test_f1: 0.4873
 epoch: 21, train_loss: 0.9580, test_loss: 0.9856, test_f1: 0.4851
 epoch: 22, train_loss: 0.9417, test_loss: 0.9801, test_f1: 0.5137
 epoch: 23, train_loss: 0.9451, test_loss: 0.9688, test_f1: 0.5149
 epoch: 24, train_loss: 0.9376, test_loss: 0.9715, test_f1: 0.5156
 epoch: 25, train_loss: 0.9371, test_loss: 0.9735, test_f1: 0.5075
 epoch: 26, train_loss: 0.9322, test_loss: 0.9706, test_f1: 0.5159
 epoch: 27, train_loss: 0.9304, test_loss: 0.9655, test_f1: 0.5259
 epoch: 28, train_loss: 0.9218, test_loss: 0.9712, test_f1: 0.5115
 epoch: 29, train_loss: 0.9269, test_loss: 0.9756, test_f1: 0.5252
 epoch: 30, train_loss: 0.9240, test_loss: 0.9661, test_f1: 0.5292
 epoch: 31, train_loss: 0.9114, test_loss: 0.9694, test_f1: 0.5215
 epoch: 32, train_loss: 0.9107, test_loss: 0.9694, test_f1: 0.5192
 epoch: 33, train_loss: 0.9044, test_loss: 0.9627, test_f1: 0.5322
 epoch: 34, train_loss: 0.9028, test_loss: 0.9649, test_f1: 0.5371
 epoch: 35, train_loss: 0.9097, test_loss: 0.9733, test_f1: 0.5352
 epoch: 36, train_loss: 0.9015, test_loss: 0.9510, test_f1: 0.5350
 epoch: 37, train_loss: 0.8885, test_loss: 0.9597, test_f1: 0.5423
 epoch: 38, train_loss: 0.8851, test_loss: 0.9648, test_f1: 0.5330
 epoch: 39, train_loss: 0.8932, test_loss: 0.9665, test_f1: 0.5346
 epoch: 40, train_loss: 0.8853, test_loss: 0.9716, test_f1: 0.5279
 epoch: 41, train_loss: 0.8781, test_loss: 0.9618, test_f1: 0.5420
 epoch: 42, train_loss: 0.8742, test_loss: 0.9601, test_f1: 0.5329
 epoch: 43, train_loss: 0.8769, test_loss: 0.9710, test_f1: 0.5382
 epoch: 44, train_loss: 0.8735, test_loss: 0.9649, test_f1: 0.5273
 epoch: 45, train_loss: 0.8728, test_loss: 0.9718, test_f1: 0.5369
 epoch: 46, train_loss: 0.8663, test_loss: 0.9621, test_f1: 0.5388
 epoch: 47, train_loss: 0.8661, test_loss: 0.9715, test_f1: 0.5430
 epoch: 48, train_loss: 0.8563, test_loss: 0.9648, test_f1: 0.5409
 epoch: 49, train_loss: 0.8583, test_loss: 0.9700, test_f1: 0.5431
 epoch: 50, train_loss: 0.8547, test_loss: 0.9635, test_f1: 0.5415
 epoch: 51, train_loss: 0.8587, test_loss: 0.9669, test_f1: 0.5398
 epoch: 52, train_loss: 0.8464, test_loss: 0.9685, test_f1: 0.5396
 epoch: 53, train_loss: 0.8461, test_loss: 0.9700, test_f1: 0.5418
 epoch: 54, train_loss: 0.8475, test_loss: 0.9644, test_f1: 0.5375
 epoch: 55, train_loss: 0.8499, test_loss: 0.9649, test_f1: 0.5371
 epoch: 56, train_loss: 0.8460, test_loss: 0.9639, test_f1: 0.5325
 epoch: 57, train_loss: 0.8502, test_loss: 0.9691, test_f1: 0.5393
 epoch: 58, train_loss: 0.8403, test_loss: 0.9684, test_f1: 0.5338
 epoch: 59, train_loss: 0.8477, test_loss: 0.9718, test_f1: 0.5522
 epoch: 60, train_loss: 0.8421, test_loss: 0.9696, test_f1: 0.5469
 epoch: 61, train_loss: 0.8445, test_loss: 0.9692, test_f1: 0.5501
 epoch: 62, train_loss: 0.8340, test_loss: 0.9761, test_f1: 0.5407
 epoch: 63, train_loss: 0.8351, test_loss: 0.9737, test_f1: 0.5510
 epoch: 64, train_loss: 0.8349, test_loss: 0.9778, test_f1: 0.5343
 epoch: 65, train_loss: 0.8439, test_loss: 0.9784, test_f1: 0.5446
 epoch: 66, train_loss: 0.8372, test_loss: 0.9734, test_f1: 0.5401
 epoch: 67, train_loss: 0.8304, test_loss: 0.9822, test_f1: 0.5452
 epoch: 68, train_loss: 0.8341, test_loss: 0.9797, test_f1: 0.5446
 epoch: 69, train_loss: 0.8252, test_loss: 0.9769, test_f1: 0.5448
 epoch: 70, train_loss: 0.8331, test_loss: 0.9725, test_f1: 0.5512
 epoch: 71, train_loss: 0.8325, test_loss: 0.9877, test_f1: 0.5409
 epoch: 72, train_loss: 0.8275, test_loss: 0.9758, test_f1: 0.5468
 epoch: 73, train_loss: 0.8306, test_loss: 0.9854, test_f1: 0.5502
 epoch: 74, train_loss: 0.8351, test_loss: 0.9748, test_f1: 0.5476
 epoch: 75, train_loss: 0.8315, test_loss: 0.9880, test_f1: 0.5444
 epoch: 76, train_loss: 0.8310, test_loss: 0.9794, test_f1: 0.5543
 epoch: 77, train_loss: 0.8320, test_loss: 0.9849, test_f1: 0.5454
 epoch: 78, train_loss: 0.8212, test_loss: 0.9849, test_f1: 0.5510
 epoch: 79, train_loss: 0.8243, test_loss: 0.9769, test_f1: 0.5475
 epoch: 80, train_loss: 0.8242, test_loss: 0.9756, test_f1: 0.5496
 epoch: 81, train_loss: 0.8177, test_loss: 0.9734, test_f1: 0.5515
 epoch: 82, train_loss: 0.8098, test_loss: 0.9778, test_f1: 0.5517
 epoch: 83, train_loss: 0.8263, test_loss: 0.9768, test_f1: 0.5455
 epoch: 84, train_loss: 0.8228, test_loss: 0.9858, test_f1: 0.5454
 epoch: 85, train_loss: 0.8167, test_loss: 0.9867, test_f1: 0.5487
 epoch: 86, train_loss: 0.8212, test_loss: 0.9914, test_f1: 0.5536
 epoch: 87, train_loss: 0.8167, test_loss: 0.9805, test_f1: 0.5609
 epoch: 88, train_loss: 0.8114, test_loss: 0.9880, test_f1: 0.5624
 epoch: 89, train_loss: 0.8101, test_loss: 0.9853, test_f1: 0.5563
 epoch: 90, train_loss: 0.8098, test_loss: 0.9871, test_f1: 0.5581
 epoch: 91, train_loss: 0.8228, test_loss: 0.9876, test_f1: 0.5582
 epoch: 92, train_loss: 0.8085, test_loss: 0.9827, test_f1: 0.5612
 epoch: 93, train_loss: 0.8077, test_loss: 0.9835, test_f1: 0.5595
 epoch: 94, train_loss: 0.8136, test_loss: 0.9850, test_f1: 0.5606
 epoch: 95, train_loss: 0.8070, test_loss: 0.9893, test_f1: 0.5531
 epoch: 96, train_loss: 0.8073, test_loss: 0.9729, test_f1: 0.5591
 epoch: 97, train_loss: 0.8115, test_loss: 0.9771, test_f1: 0.5662
 epoch: 98, train_loss: 0.8009, test_loss: 0.9844, test_f1: 0.5652
 epoch: 99, train_loss: 0.8027, test_loss: 0.9879, test_f1: 0.5595
##################ITERATION #7 ****************************************
 epoch: 0, train_loss: 1.3410, test_loss: 1.3191, test_f1: 0.2270
 epoch: 1, train_loss: 1.2122, test_loss: 1.2123, test_f1: 0.2344
 epoch: 2, train_loss: 1.1826, test_loss: 1.1187, test_f1: 0.3491
 epoch: 3, train_loss: 1.1575, test_loss: 1.0866, test_f1: 0.3772
 epoch: 4, train_loss: 1.1350, test_loss: 1.0672, test_f1: 0.4105
 epoch: 5, train_loss: 1.1149, test_loss: 1.0547, test_f1: 0.4265
 epoch: 6, train_loss: 1.0988, test_loss: 1.0411, test_f1: 0.4436
 epoch: 7, train_loss: 1.0816, test_loss: 1.0292, test_f1: 0.4532
 epoch: 8, train_loss: 1.0696, test_loss: 1.0214, test_f1: 0.4513
 epoch: 9, train_loss: 1.0546, test_loss: 1.0090, test_f1: 0.4557
 epoch: 10, train_loss: 1.0592, test_loss: 1.0035, test_f1: 0.4518
 epoch: 11, train_loss: 1.0348, test_loss: 1.0036, test_f1: 0.4574
 epoch: 12, train_loss: 1.0206, test_loss: 0.9933, test_f1: 0.4600
 epoch: 13, train_loss: 1.0217, test_loss: 0.9892, test_f1: 0.4600
 epoch: 14, train_loss: 1.0073, test_loss: 0.9890, test_f1: 0.4636
 epoch: 15, train_loss: 1.0043, test_loss: 0.9792, test_f1: 0.4697
 epoch: 16, train_loss: 0.9869, test_loss: 0.9785, test_f1: 0.4703
 epoch: 17, train_loss: 0.9925, test_loss: 0.9741, test_f1: 0.4745
 epoch: 18, train_loss: 0.9805, test_loss: 0.9691, test_f1: 0.4702
 epoch: 19, train_loss: 0.9783, test_loss: 0.9684, test_f1: 0.4755
 epoch: 20, train_loss: 0.9735, test_loss: 0.9648, test_f1: 0.4780
 epoch: 21, train_loss: 0.9665, test_loss: 0.9621, test_f1: 0.4809
 epoch: 22, train_loss: 0.9613, test_loss: 0.9684, test_f1: 0.4817
 epoch: 23, train_loss: 0.9653, test_loss: 0.9562, test_f1: 0.4950
 epoch: 24, train_loss: 0.9472, test_loss: 0.9524, test_f1: 0.4949
 epoch: 25, train_loss: 0.9447, test_loss: 0.9544, test_f1: 0.4948
 epoch: 26, train_loss: 0.9430, test_loss: 0.9501, test_f1: 0.4954
 epoch: 27, train_loss: 0.9419, test_loss: 0.9466, test_f1: 0.5039
 epoch: 28, train_loss: 0.9334, test_loss: 0.9467, test_f1: 0.5096
 epoch: 29, train_loss: 0.9313, test_loss: 0.9433, test_f1: 0.5106
 epoch: 30, train_loss: 0.9285, test_loss: 0.9430, test_f1: 0.5098
 epoch: 31, train_loss: 0.9360, test_loss: 0.9429, test_f1: 0.5254
 epoch: 32, train_loss: 0.9198, test_loss: 0.9323, test_f1: 0.5304
 epoch: 33, train_loss: 0.9136, test_loss: 0.9350, test_f1: 0.5288
 epoch: 34, train_loss: 0.9115, test_loss: 0.9450, test_f1: 0.5164
 epoch: 35, train_loss: 0.9102, test_loss: 0.9308, test_f1: 0.5286
 epoch: 36, train_loss: 0.9039, test_loss: 0.9222, test_f1: 0.5305
 epoch: 37, train_loss: 0.9137, test_loss: 0.9267, test_f1: 0.5356
 epoch: 38, train_loss: 0.9012, test_loss: 0.9237, test_f1: 0.5350
 epoch: 39, train_loss: 0.9005, test_loss: 0.9315, test_f1: 0.5325
 epoch: 40, train_loss: 0.8970, test_loss: 0.9262, test_f1: 0.5324
 epoch: 41, train_loss: 0.8957, test_loss: 0.9131, test_f1: 0.5340
 epoch: 42, train_loss: 0.8861, test_loss: 0.9160, test_f1: 0.5417
 epoch: 43, train_loss: 0.8852, test_loss: 0.9234, test_f1: 0.5416
 epoch: 44, train_loss: 0.8824, test_loss: 0.9259, test_f1: 0.5320
 epoch: 45, train_loss: 0.8816, test_loss: 0.9194, test_f1: 0.5407
 epoch: 46, train_loss: 0.8854, test_loss: 0.9214, test_f1: 0.5366
 epoch: 47, train_loss: 0.8861, test_loss: 0.9089, test_f1: 0.5460
 epoch: 48, train_loss: 0.8715, test_loss: 0.9160, test_f1: 0.5392
 epoch: 49, train_loss: 0.8738, test_loss: 0.9265, test_f1: 0.5401
 epoch: 50, train_loss: 0.8705, test_loss: 0.9235, test_f1: 0.5382
 epoch: 51, train_loss: 0.8674, test_loss: 0.9138, test_f1: 0.5400
 epoch: 52, train_loss: 0.8593, test_loss: 0.9200, test_f1: 0.5402
 epoch: 53, train_loss: 0.8660, test_loss: 0.9152, test_f1: 0.5425
 epoch: 54, train_loss: 0.8627, test_loss: 0.9263, test_f1: 0.5397
 epoch: 55, train_loss: 0.8660, test_loss: 0.9233, test_f1: 0.5380
 epoch: 56, train_loss: 0.8554, test_loss: 0.9179, test_f1: 0.5472
 epoch: 57, train_loss: 0.8633, test_loss: 0.9162, test_f1: 0.5417
 epoch: 58, train_loss: 0.8607, test_loss: 0.9340, test_f1: 0.5374
 epoch: 59, train_loss: 0.8512, test_loss: 0.9085, test_f1: 0.5411
 epoch: 60, train_loss: 0.8544, test_loss: 0.9207, test_f1: 0.5371
 epoch: 61, train_loss: 0.8613, test_loss: 0.9222, test_f1: 0.5390
 epoch: 62, train_loss: 0.8519, test_loss: 0.9211, test_f1: 0.5484
 epoch: 63, train_loss: 0.8616, test_loss: 0.9176, test_f1: 0.5425
 epoch: 64, train_loss: 0.8486, test_loss: 0.9122, test_f1: 0.5370
 epoch: 65, train_loss: 0.8554, test_loss: 0.9168, test_f1: 0.5398
 epoch: 66, train_loss: 0.8428, test_loss: 0.9140, test_f1: 0.5425
 epoch: 67, train_loss: 0.8554, test_loss: 0.9150, test_f1: 0.5416
 epoch: 68, train_loss: 0.8472, test_loss: 0.9149, test_f1: 0.5379
 epoch: 69, train_loss: 0.8460, test_loss: 0.9116, test_f1: 0.5464
 epoch: 70, train_loss: 0.8447, test_loss: 0.9203, test_f1: 0.5416
 epoch: 71, train_loss: 0.8535, test_loss: 0.9193, test_f1: 0.5408
 epoch: 72, train_loss: 0.8467, test_loss: 0.9191, test_f1: 0.5401
 epoch: 73, train_loss: 0.8420, test_loss: 0.9244, test_f1: 0.5464
 epoch: 74, train_loss: 0.8436, test_loss: 0.9219, test_f1: 0.5387
 epoch: 75, train_loss: 0.8435, test_loss: 0.9182, test_f1: 0.5422
 epoch: 76, train_loss: 0.8423, test_loss: 0.9165, test_f1: 0.5352
 epoch: 77, train_loss: 0.8431, test_loss: 0.9167, test_f1: 0.5456
 epoch: 78, train_loss: 0.8401, test_loss: 0.9134, test_f1: 0.5375
 epoch: 79, train_loss: 0.8384, test_loss: 0.9127, test_f1: 0.5428
 epoch: 80, train_loss: 0.8406, test_loss: 0.9181, test_f1: 0.5427
 epoch: 81, train_loss: 0.8333, test_loss: 0.9081, test_f1: 0.5423
 epoch: 82, train_loss: 0.8329, test_loss: 0.9170, test_f1: 0.5426
 epoch: 83, train_loss: 0.8314, test_loss: 0.9181, test_f1: 0.5492
 epoch: 84, train_loss: 0.8309, test_loss: 0.9141, test_f1: 0.5391
 epoch: 85, train_loss: 0.8276, test_loss: 0.9214, test_f1: 0.5385
 epoch: 86, train_loss: 0.8388, test_loss: 0.9169, test_f1: 0.5422
 epoch: 87, train_loss: 0.8299, test_loss: 0.9122, test_f1: 0.5435
 epoch: 88, train_loss: 0.8281, test_loss: 0.9145, test_f1: 0.5390
 epoch: 89, train_loss: 0.8266, test_loss: 0.9111, test_f1: 0.5344
 epoch: 90, train_loss: 0.8246, test_loss: 0.9196, test_f1: 0.5437
 epoch: 91, train_loss: 0.8359, test_loss: 0.9172, test_f1: 0.5409
 epoch: 92, train_loss: 0.8352, test_loss: 0.9234, test_f1: 0.5398
 epoch: 93, train_loss: 0.8239, test_loss: 0.9187, test_f1: 0.5448
 epoch: 94, train_loss: 0.8235, test_loss: 0.9152, test_f1: 0.5377
 epoch: 95, train_loss: 0.8219, test_loss: 0.9277, test_f1: 0.5365
 epoch: 96, train_loss: 0.8211, test_loss: 0.9191, test_f1: 0.5427
 epoch: 97, train_loss: 0.8203, test_loss: 0.9208, test_f1: 0.5371
 epoch: 98, train_loss: 0.8095, test_loss: 0.9194, test_f1: 0.5398
 epoch: 99, train_loss: 0.8133, test_loss: 0.9130, test_f1: 0.5431
##################ITERATION #8 ****************************************
 epoch: 0, train_loss: 1.2850, test_loss: 1.2399, test_f1: 0.2295
 epoch: 1, train_loss: 1.1917, test_loss: 1.1649, test_f1: 0.3095
 epoch: 2, train_loss: 1.1692, test_loss: 1.0969, test_f1: 0.3761
 epoch: 3, train_loss: 1.1444, test_loss: 1.0763, test_f1: 0.3960
 epoch: 4, train_loss: 1.1072, test_loss: 1.0534, test_f1: 0.4079
 epoch: 5, train_loss: 1.1053, test_loss: 1.0349, test_f1: 0.4253
 epoch: 6, train_loss: 1.0742, test_loss: 1.0186, test_f1: 0.4250
 epoch: 7, train_loss: 1.0643, test_loss: 1.0095, test_f1: 0.4325
 epoch: 8, train_loss: 1.0434, test_loss: 0.9990, test_f1: 0.4446
 epoch: 9, train_loss: 1.0331, test_loss: 0.9910, test_f1: 0.4488
 epoch: 10, train_loss: 1.0279, test_loss: 0.9857, test_f1: 0.4433
 epoch: 11, train_loss: 1.0165, test_loss: 0.9756, test_f1: 0.4703
 epoch: 12, train_loss: 1.0008, test_loss: 0.9720, test_f1: 0.4636
 epoch: 13, train_loss: 0.9933, test_loss: 0.9646, test_f1: 0.4910
 epoch: 14, train_loss: 0.9885, test_loss: 0.9719, test_f1: 0.4693
 epoch: 15, train_loss: 0.9819, test_loss: 0.9657, test_f1: 0.5034
 epoch: 16, train_loss: 0.9749, test_loss: 0.9631, test_f1: 0.5027
 epoch: 17, train_loss: 0.9739, test_loss: 0.9631, test_f1: 0.5060
 epoch: 18, train_loss: 0.9683, test_loss: 0.9563, test_f1: 0.4995
 epoch: 19, train_loss: 0.9677, test_loss: 0.9551, test_f1: 0.5136
 epoch: 20, train_loss: 0.9530, test_loss: 0.9567, test_f1: 0.5227
 epoch: 21, train_loss: 0.9501, test_loss: 0.9499, test_f1: 0.5117
 epoch: 22, train_loss: 0.9479, test_loss: 0.9507, test_f1: 0.5110
 epoch: 23, train_loss: 0.9460, test_loss: 0.9604, test_f1: 0.5002
 epoch: 24, train_loss: 0.9359, test_loss: 0.9471, test_f1: 0.5178
 epoch: 25, train_loss: 0.9293, test_loss: 0.9490, test_f1: 0.5225
 epoch: 26, train_loss: 0.9338, test_loss: 0.9480, test_f1: 0.5263
 epoch: 27, train_loss: 0.9215, test_loss: 0.9620, test_f1: 0.5084
 epoch: 28, train_loss: 0.9207, test_loss: 0.9518, test_f1: 0.5079
 epoch: 29, train_loss: 0.9302, test_loss: 0.9509, test_f1: 0.5337
 epoch: 30, train_loss: 0.9175, test_loss: 0.9479, test_f1: 0.5182
 epoch: 31, train_loss: 0.9244, test_loss: 0.9490, test_f1: 0.5091
 epoch: 32, train_loss: 0.9121, test_loss: 0.9509, test_f1: 0.5241
 epoch: 33, train_loss: 0.9148, test_loss: 0.9429, test_f1: 0.5129
 epoch: 34, train_loss: 0.9055, test_loss: 0.9563, test_f1: 0.5058
 epoch: 35, train_loss: 0.9013, test_loss: 0.9477, test_f1: 0.5255
 epoch: 36, train_loss: 0.9107, test_loss: 0.9487, test_f1: 0.5222
 epoch: 37, train_loss: 0.9044, test_loss: 0.9551, test_f1: 0.5216
 epoch: 38, train_loss: 0.8927, test_loss: 0.9496, test_f1: 0.5293
 epoch: 39, train_loss: 0.8966, test_loss: 0.9540, test_f1: 0.5170
 epoch: 40, train_loss: 0.8886, test_loss: 0.9596, test_f1: 0.5283
 epoch: 41, train_loss: 0.8948, test_loss: 0.9500, test_f1: 0.5302
 epoch: 42, train_loss: 0.8888, test_loss: 0.9421, test_f1: 0.5262
 epoch: 43, train_loss: 0.8922, test_loss: 0.9606, test_f1: 0.5170
 epoch: 44, train_loss: 0.8852, test_loss: 0.9426, test_f1: 0.5246
 epoch: 45, train_loss: 0.8829, test_loss: 0.9438, test_f1: 0.5291
 epoch: 46, train_loss: 0.8818, test_loss: 0.9491, test_f1: 0.5243
 epoch: 47, train_loss: 0.8760, test_loss: 0.9496, test_f1: 0.5212
 epoch: 48, train_loss: 0.8752, test_loss: 0.9446, test_f1: 0.5212
 epoch: 49, train_loss: 0.8767, test_loss: 0.9570, test_f1: 0.5208
 epoch: 50, train_loss: 0.8711, test_loss: 0.9499, test_f1: 0.5334
 epoch: 51, train_loss: 0.8609, test_loss: 0.9442, test_f1: 0.5218
 epoch: 52, train_loss: 0.8761, test_loss: 0.9431, test_f1: 0.5317
 epoch: 53, train_loss: 0.8560, test_loss: 0.9488, test_f1: 0.5357
 epoch: 54, train_loss: 0.8603, test_loss: 0.9431, test_f1: 0.5345
 epoch: 55, train_loss: 0.8620, test_loss: 0.9455, test_f1: 0.5217
 epoch: 56, train_loss: 0.8638, test_loss: 0.9505, test_f1: 0.5296
 epoch: 57, train_loss: 0.8576, test_loss: 0.9529, test_f1: 0.5351
 epoch: 58, train_loss: 0.8541, test_loss: 0.9477, test_f1: 0.5231
 epoch: 59, train_loss: 0.8579, test_loss: 0.9508, test_f1: 0.5335
 epoch: 60, train_loss: 0.8537, test_loss: 0.9491, test_f1: 0.5235
 epoch: 61, train_loss: 0.8542, test_loss: 0.9525, test_f1: 0.5334
 epoch: 62, train_loss: 0.8561, test_loss: 0.9538, test_f1: 0.5203
 epoch: 63, train_loss: 0.8557, test_loss: 0.9551, test_f1: 0.5217
 epoch: 64, train_loss: 0.8543, test_loss: 0.9522, test_f1: 0.5289
 epoch: 65, train_loss: 0.8499, test_loss: 0.9513, test_f1: 0.5214
 epoch: 66, train_loss: 0.8543, test_loss: 0.9438, test_f1: 0.5272
 epoch: 67, train_loss: 0.8472, test_loss: 0.9477, test_f1: 0.5220
 epoch: 68, train_loss: 0.8489, test_loss: 0.9490, test_f1: 0.5255
 epoch: 69, train_loss: 0.8455, test_loss: 0.9506, test_f1: 0.5229
 epoch: 70, train_loss: 0.8414, test_loss: 0.9496, test_f1: 0.5265
 epoch: 71, train_loss: 0.8459, test_loss: 0.9544, test_f1: 0.5314
 epoch: 72, train_loss: 0.8421, test_loss: 0.9510, test_f1: 0.5318
 epoch: 73, train_loss: 0.8405, test_loss: 0.9480, test_f1: 0.5266
 epoch: 74, train_loss: 0.8535, test_loss: 0.9550, test_f1: 0.5311
 epoch: 75, train_loss: 0.8452, test_loss: 0.9565, test_f1: 0.5219
 epoch: 76, train_loss: 0.8405, test_loss: 0.9518, test_f1: 0.5215
 epoch: 77, train_loss: 0.8374, test_loss: 0.9539, test_f1: 0.5168
 epoch: 78, train_loss: 0.8446, test_loss: 0.9559, test_f1: 0.5166
 epoch: 79, train_loss: 0.8408, test_loss: 0.9581, test_f1: 0.5247
 epoch: 80, train_loss: 0.8349, test_loss: 0.9554, test_f1: 0.5232
 epoch: 81, train_loss: 0.8384, test_loss: 0.9542, test_f1: 0.5258
 epoch: 82, train_loss: 0.8363, test_loss: 0.9592, test_f1: 0.5267
 epoch: 83, train_loss: 0.8328, test_loss: 0.9605, test_f1: 0.5188
 epoch: 84, train_loss: 0.8434, test_loss: 0.9644, test_f1: 0.5129
 epoch: 85, train_loss: 0.8319, test_loss: 0.9590, test_f1: 0.5236
 epoch: 86, train_loss: 0.8335, test_loss: 0.9540, test_f1: 0.5265
 epoch: 87, train_loss: 0.8290, test_loss: 0.9617, test_f1: 0.5206
 epoch: 88, train_loss: 0.8306, test_loss: 0.9583, test_f1: 0.5179
 epoch: 89, train_loss: 0.8221, test_loss: 0.9616, test_f1: 0.5199
 epoch: 90, train_loss: 0.8344, test_loss: 0.9601, test_f1: 0.5239
 epoch: 91, train_loss: 0.8262, test_loss: 0.9626, test_f1: 0.5348
 epoch: 92, train_loss: 0.8221, test_loss: 0.9595, test_f1: 0.5209
 epoch: 93, train_loss: 0.8168, test_loss: 0.9537, test_f1: 0.5326
 epoch: 94, train_loss: 0.8377, test_loss: 0.9544, test_f1: 0.5247
 epoch: 95, train_loss: 0.8235, test_loss: 0.9656, test_f1: 0.5202
 epoch: 96, train_loss: 0.8211, test_loss: 0.9587, test_f1: 0.5210
 epoch: 97, train_loss: 0.8179, test_loss: 0.9580, test_f1: 0.5227
 epoch: 98, train_loss: 0.8211, test_loss: 0.9673, test_f1: 0.5140
 epoch: 99, train_loss: 0.8172, test_loss: 0.9573, test_f1: 0.5228
##################ITERATION #9 ****************************************
 epoch: 0, train_loss: 1.3762, test_loss: 1.2925, test_f1: 0.2270
 epoch: 1, train_loss: 1.2398, test_loss: 1.1591, test_f1: 0.3111
 epoch: 2, train_loss: 1.2010, test_loss: 1.1030, test_f1: 0.3747
 epoch: 3, train_loss: 1.1713, test_loss: 1.0694, test_f1: 0.3825
 epoch: 4, train_loss: 1.1441, test_loss: 1.0524, test_f1: 0.4006
 epoch: 5, train_loss: 1.1252, test_loss: 1.0376, test_f1: 0.4053
 epoch: 6, train_loss: 1.0967, test_loss: 1.0277, test_f1: 0.4082
 epoch: 7, train_loss: 1.0851, test_loss: 1.0145, test_f1: 0.4272
 epoch: 8, train_loss: 1.0770, test_loss: 1.0086, test_f1: 0.4364
 epoch: 9, train_loss: 1.0678, test_loss: 1.0041, test_f1: 0.4453
 epoch: 10, train_loss: 1.0533, test_loss: 0.9921, test_f1: 0.4537
 epoch: 11, train_loss: 1.0379, test_loss: 0.9898, test_f1: 0.4596
 epoch: 12, train_loss: 1.0372, test_loss: 0.9824, test_f1: 0.4619
 epoch: 13, train_loss: 1.0185, test_loss: 0.9769, test_f1: 0.4606
 epoch: 14, train_loss: 1.0117, test_loss: 0.9721, test_f1: 0.4597
 epoch: 15, train_loss: 1.0155, test_loss: 0.9666, test_f1: 0.4624
 epoch: 16, train_loss: 0.9939, test_loss: 0.9577, test_f1: 0.4628
 epoch: 17, train_loss: 1.0013, test_loss: 0.9604, test_f1: 0.4620
 epoch: 18, train_loss: 0.9843, test_loss: 0.9580, test_f1: 0.4713
 epoch: 19, train_loss: 0.9913, test_loss: 0.9541, test_f1: 0.4688
 epoch: 20, train_loss: 0.9785, test_loss: 0.9454, test_f1: 0.4742
 epoch: 21, train_loss: 0.9785, test_loss: 0.9501, test_f1: 0.4653
 epoch: 22, train_loss: 0.9664, test_loss: 0.9446, test_f1: 0.4768
 epoch: 23, train_loss: 0.9564, test_loss: 0.9436, test_f1: 0.4806
 epoch: 24, train_loss: 0.9639, test_loss: 0.9463, test_f1: 0.4824
 epoch: 25, train_loss: 0.9552, test_loss: 0.9359, test_f1: 0.4953
 epoch: 26, train_loss: 0.9539, test_loss: 0.9423, test_f1: 0.4922
 epoch: 27, train_loss: 0.9447, test_loss: 0.9371, test_f1: 0.4987
 epoch: 28, train_loss: 0.9435, test_loss: 0.9380, test_f1: 0.4833
 epoch: 29, train_loss: 0.9393, test_loss: 0.9241, test_f1: 0.4961
 epoch: 30, train_loss: 0.9342, test_loss: 0.9307, test_f1: 0.5004
 epoch: 31, train_loss: 0.9257, test_loss: 0.9280, test_f1: 0.5047
 epoch: 32, train_loss: 0.9179, test_loss: 0.9265, test_f1: 0.5048
 epoch: 33, train_loss: 0.9172, test_loss: 0.9279, test_f1: 0.4984
 epoch: 34, train_loss: 0.9280, test_loss: 0.9239, test_f1: 0.5011
 epoch: 35, train_loss: 0.9166, test_loss: 0.9246, test_f1: 0.4937
 epoch: 36, train_loss: 0.9242, test_loss: 0.9311, test_f1: 0.5126
 epoch: 37, train_loss: 0.9114, test_loss: 0.9265, test_f1: 0.5148
 epoch: 38, train_loss: 0.9106, test_loss: 0.9238, test_f1: 0.5149
 epoch: 39, train_loss: 0.9092, test_loss: 0.9169, test_f1: 0.5086
 epoch: 40, train_loss: 0.9017, test_loss: 0.9255, test_f1: 0.5170
 epoch: 41, train_loss: 0.9002, test_loss: 0.9171, test_f1: 0.5273
 epoch: 42, train_loss: 0.9035, test_loss: 0.9146, test_f1: 0.5254
 epoch: 43, train_loss: 0.8967, test_loss: 0.9175, test_f1: 0.5209
 epoch: 44, train_loss: 0.8921, test_loss: 0.9290, test_f1: 0.5195
 epoch: 45, train_loss: 0.8972, test_loss: 0.9141, test_f1: 0.5168
 epoch: 46, train_loss: 0.8897, test_loss: 0.9220, test_f1: 0.5208
 epoch: 47, train_loss: 0.8846, test_loss: 0.9188, test_f1: 0.5257
 epoch: 48, train_loss: 0.8816, test_loss: 0.9037, test_f1: 0.5249
 epoch: 49, train_loss: 0.8815, test_loss: 0.9067, test_f1: 0.5293
 epoch: 50, train_loss: 0.8741, test_loss: 0.9107, test_f1: 0.5297
 epoch: 51, train_loss: 0.8694, test_loss: 0.9100, test_f1: 0.5295
 epoch: 52, train_loss: 0.8713, test_loss: 0.9091, test_f1: 0.5288
 epoch: 53, train_loss: 0.8747, test_loss: 0.9062, test_f1: 0.5359
 epoch: 54, train_loss: 0.8727, test_loss: 0.9067, test_f1: 0.5330
 epoch: 55, train_loss: 0.8744, test_loss: 0.9132, test_f1: 0.5207
 epoch: 56, train_loss: 0.8620, test_loss: 0.9082, test_f1: 0.5268
 epoch: 57, train_loss: 0.8781, test_loss: 0.9080, test_f1: 0.5234
 epoch: 58, train_loss: 0.8627, test_loss: 0.9084, test_f1: 0.5241
 epoch: 59, train_loss: 0.8640, test_loss: 0.9190, test_f1: 0.5323
 epoch: 60, train_loss: 0.8602, test_loss: 0.9119, test_f1: 0.5278
 epoch: 61, train_loss: 0.8665, test_loss: 0.9055, test_f1: 0.5296
 epoch: 62, train_loss: 0.8531, test_loss: 0.9171, test_f1: 0.5313
 epoch: 63, train_loss: 0.8634, test_loss: 0.9127, test_f1: 0.5265
 epoch: 64, train_loss: 0.8689, test_loss: 0.9071, test_f1: 0.5329
 epoch: 65, train_loss: 0.8612, test_loss: 0.9078, test_f1: 0.5271
 epoch: 66, train_loss: 0.8538, test_loss: 0.9140, test_f1: 0.5275
 epoch: 67, train_loss: 0.8516, test_loss: 0.9074, test_f1: 0.5245
 epoch: 68, train_loss: 0.8524, test_loss: 0.9030, test_f1: 0.5315
 epoch: 69, train_loss: 0.8462, test_loss: 0.9112, test_f1: 0.5284
 epoch: 70, train_loss: 0.8460, test_loss: 0.9108, test_f1: 0.5269
 epoch: 71, train_loss: 0.8508, test_loss: 0.9173, test_f1: 0.5308
 epoch: 72, train_loss: 0.8520, test_loss: 0.9145, test_f1: 0.5259
 epoch: 73, train_loss: 0.8587, test_loss: 0.9189, test_f1: 0.5346
 epoch: 74, train_loss: 0.8520, test_loss: 0.9125, test_f1: 0.5257
 epoch: 75, train_loss: 0.8495, test_loss: 0.9088, test_f1: 0.5257
 epoch: 76, train_loss: 0.8477, test_loss: 0.9097, test_f1: 0.5267
 epoch: 77, train_loss: 0.8554, test_loss: 0.9108, test_f1: 0.5259
 epoch: 78, train_loss: 0.8472, test_loss: 0.9154, test_f1: 0.5307
 epoch: 79, train_loss: 0.8485, test_loss: 0.9207, test_f1: 0.5369
 epoch: 80, train_loss: 0.8421, test_loss: 0.9105, test_f1: 0.5277
 epoch: 81, train_loss: 0.8298, test_loss: 0.9108, test_f1: 0.5251
 epoch: 82, train_loss: 0.8480, test_loss: 0.9187, test_f1: 0.5292
 epoch: 83, train_loss: 0.8366, test_loss: 0.9208, test_f1: 0.5338
 epoch: 84, train_loss: 0.8452, test_loss: 0.9213, test_f1: 0.5277
 epoch: 85, train_loss: 0.8411, test_loss: 0.9136, test_f1: 0.5343
 epoch: 86, train_loss: 0.8426, test_loss: 0.9185, test_f1: 0.5247
 epoch: 87, train_loss: 0.8405, test_loss: 0.9315, test_f1: 0.5323
 epoch: 88, train_loss: 0.8374, test_loss: 0.9097, test_f1: 0.5319
 epoch: 89, train_loss: 0.8382, test_loss: 0.9157, test_f1: 0.5380
 epoch: 90, train_loss: 0.8257, test_loss: 0.9090, test_f1: 0.5279
 epoch: 91, train_loss: 0.8429, test_loss: 0.9180, test_f1: 0.5339
 epoch: 92, train_loss: 0.8374, test_loss: 0.9165, test_f1: 0.5300
 epoch: 93, train_loss: 0.8249, test_loss: 0.9184, test_f1: 0.5341
 epoch: 94, train_loss: 0.8330, test_loss: 0.9227, test_f1: 0.5304
 epoch: 95, train_loss: 0.8271, test_loss: 0.9042, test_f1: 0.5325
 epoch: 96, train_loss: 0.8276, test_loss: 0.9133, test_f1: 0.5315
 epoch: 97, train_loss: 0.8362, test_loss: 0.9120, test_f1: 0.5349
 epoch: 98, train_loss: 0.8365, test_loss: 0.9075, test_f1: 0.5278
 epoch: 99, train_loss: 0.8305, test_loss: 0.9148, test_f1: 0.5297

Training completed in 433.50 seconds
Best F1: 0.5662 at epoch 97
Mean F1 across iterations: 0.5445  0.0140
========================FINAL RESULTS================================
FEGIN weighted F1: 0.5662  0.0140
python main.py --data ltspice_examples --representation component_net --model FEGIN --layers 2 --hiddens 64 --batch_size 128 --lr 0.0001 --emb_size 512 --epochs 100 --save_appendix component_net_L2_H64_BS128_LR0.0001_E512 --no_val
-----



STDERR:
  File "main.py", line 370, in <module>
    main()
  File "main.py", line 254, in main
    dataset = dataset_class(
  File "/home/philip/projects/ltspice_examples_code_repo/Circuit-Completion-Using-GNNs/component_classification_with_link_prediction_head/evaluation/FEGIN/kernel/circuit_datasets.py", line 15, in __init__
    self.data, self.slices = torch.load(self.processed_paths[0])
  File "/home/philip/.local/lib/python3.8/site-packages/torch/serialization.py", line 1040, in load
    warnings.warn(
  File "/usr/lib/python3.8/warnings.py", line 109, in _showwarnmsg
    sw(msg.message, msg.category, msg.filename, msg.lineno,
  File "main.py", line 47, in warn_with_traceback
    traceback.print_stack(file=log)
/home/philip/projects/ltspice_examples_code_repo/Circuit-Completion-Using-GNNs/component_classification_with_link_prediction_head/evaluation/FEGIN/kernel/circuit_datasets.py:15: FutureWarning: You are using `torch.load` with `weights_only=False` (the current default value), which uses the default pickle module implicitly. It is possible to construct malicious pickle data which will execute arbitrary code during unpickling (See https://github.com/pytorch/pytorch/blob/main/SECURITY.md#untrusted-models for more details). In a future release, the default value for `weights_only` will be flipped to `True`. This limits the functions that could be executed during unpickling. Arbitrary objects will no longer be allowed to be loaded via this mode unless they are explicitly allowlisted by the user via `torch.serialization.add_safe_globals`. We recommend you start setting `weights_only=True` for any use case where you don't have full control of the loaded file. Please open an issue on GitHub for any issues related to this experimental feature.
  self.data, self.slices = torch.load(self.processed_paths[0])
