STDOUT:
Results will be saved in /home/philip/projects/ltspice_examples_code_repo/Circuit-Completion-Using-GNNs/component_classification_with_link_prediction_head/evaluation/FEGIN/results/model_FEGIN_dataset_ltspice_demos
Command line input: python main.py --data ltspice_demos --representation component_pin --model FEGIN --layers 2 --hiddens 128 --batch_size 128 --lr 0.001 --emb_size 250 --epochs 100 --save_appendix component_pin_L2_H128_BS128_LR0.001_E250 --no_val
 is saved.
-----
ltspice_demos - FEGIN
Using 2 layers, 128 hidden units, h = 2
Loading component_pin representation dataset
ENTERED
Training FEGIN on component_pin representation
Train: 1565, Test: 383
##################ITERATION #0 ****************************************
 epoch: 0, train_loss: 1.2919, test_loss: 1.3058, test_f1: 0.3083
 epoch: 1, train_loss: 1.1473, test_loss: 1.2830, test_f1: 0.3097
 epoch: 2, train_loss: 1.0624, test_loss: 1.2769, test_f1: 0.3480
 epoch: 3, train_loss: 0.9870, test_loss: 1.2072, test_f1: 0.3939
 epoch: 4, train_loss: 0.9227, test_loss: 1.1313, test_f1: 0.4454
 epoch: 5, train_loss: 0.8957, test_loss: 1.0278, test_f1: 0.5520
 epoch: 6, train_loss: 0.8478, test_loss: 1.0376, test_f1: 0.5668
 epoch: 7, train_loss: 0.8103, test_loss: 0.9636, test_f1: 0.5679
 epoch: 8, train_loss: 0.7757, test_loss: 0.9792, test_f1: 0.5948
 epoch: 9, train_loss: 0.7617, test_loss: 1.0179, test_f1: 0.5942
 epoch: 10, train_loss: 0.7406, test_loss: 0.9289, test_f1: 0.6331
 epoch: 11, train_loss: 0.6958, test_loss: 0.9912, test_f1: 0.5830
 epoch: 12, train_loss: 0.6746, test_loss: 0.9987, test_f1: 0.6008
 epoch: 13, train_loss: 0.6416, test_loss: 1.1628, test_f1: 0.5328
 epoch: 14, train_loss: 0.6502, test_loss: 1.2117, test_f1: 0.4868
 epoch: 15, train_loss: 0.6345, test_loss: 1.2074, test_f1: 0.5038
 epoch: 16, train_loss: 0.6101, test_loss: 0.9867, test_f1: 0.5538
 epoch: 17, train_loss: 0.6045, test_loss: 1.1254, test_f1: 0.6012
 epoch: 18, train_loss: 0.5852, test_loss: 1.1621, test_f1: 0.5673
 epoch: 19, train_loss: 0.5647, test_loss: 1.1353, test_f1: 0.5772
 epoch: 20, train_loss: 0.5259, test_loss: 1.3298, test_f1: 0.5356
 epoch: 21, train_loss: 0.5396, test_loss: 1.4183, test_f1: 0.5594
 epoch: 22, train_loss: 0.5368, test_loss: 1.1307, test_f1: 0.5925
 epoch: 23, train_loss: 0.5378, test_loss: 1.2036, test_f1: 0.5747
 epoch: 24, train_loss: 0.4984, test_loss: 1.2046, test_f1: 0.6151
 epoch: 25, train_loss: 0.4776, test_loss: 1.3440, test_f1: 0.6164
 epoch: 26, train_loss: 0.4691, test_loss: 1.4894, test_f1: 0.5809
 epoch: 27, train_loss: 0.4476, test_loss: 1.3386, test_f1: 0.5908
 epoch: 28, train_loss: 0.4545, test_loss: 1.4575, test_f1: 0.6199
 epoch: 29, train_loss: 0.4207, test_loss: 1.4820, test_f1: 0.5386
 epoch: 30, train_loss: 0.4048, test_loss: 1.3928, test_f1: 0.5936
 epoch: 31, train_loss: 0.3879, test_loss: 1.4675, test_f1: 0.6186
 epoch: 32, train_loss: 0.3671, test_loss: 1.3508, test_f1: 0.6216
 epoch: 33, train_loss: 0.3739, test_loss: 1.4322, test_f1: 0.5858
 epoch: 34, train_loss: 0.4042, test_loss: 1.7219, test_f1: 0.6143
 epoch: 35, train_loss: 0.3466, test_loss: 1.6578, test_f1: 0.6237
 epoch: 36, train_loss: 0.3334, test_loss: 1.9885, test_f1: 0.6040
 epoch: 37, train_loss: 0.3287, test_loss: 1.7116, test_f1: 0.6017
 epoch: 38, train_loss: 0.3607, test_loss: 1.8437, test_f1: 0.6250
 epoch: 39, train_loss: 0.3404, test_loss: 1.7972, test_f1: 0.6199
 epoch: 40, train_loss: 0.3186, test_loss: 1.7322, test_f1: 0.6575
 epoch: 41, train_loss: 0.3123, test_loss: 1.8009, test_f1: 0.5869
 epoch: 42, train_loss: 0.2761, test_loss: 1.9806, test_f1: 0.6326
 epoch: 43, train_loss: 0.2581, test_loss: 2.2295, test_f1: 0.6021
 epoch: 44, train_loss: 0.2877, test_loss: 2.3405, test_f1: 0.5737
 epoch: 45, train_loss: 0.2975, test_loss: 2.2504, test_f1: 0.6140
 epoch: 46, train_loss: 0.3066, test_loss: 1.9956, test_f1: 0.5856
 epoch: 47, train_loss: 0.3073, test_loss: 1.8646, test_f1: 0.6035
 epoch: 48, train_loss: 0.2454, test_loss: 1.6299, test_f1: 0.6404
 epoch: 49, train_loss: 0.2501, test_loss: 2.1782, test_f1: 0.5884
 epoch: 50, train_loss: 0.2347, test_loss: 2.3636, test_f1: 0.5620
 epoch: 51, train_loss: 0.2214, test_loss: 2.3371, test_f1: 0.6239
 epoch: 52, train_loss: 0.1814, test_loss: 2.2395, test_f1: 0.6142
 epoch: 53, train_loss: 0.1780, test_loss: 2.2351, test_f1: 0.6294
 epoch: 54, train_loss: 0.1752, test_loss: 2.4478, test_f1: 0.6131
 epoch: 55, train_loss: 0.1661, test_loss: 2.5159, test_f1: 0.6249
 epoch: 56, train_loss: 0.1717, test_loss: 2.3655, test_f1: 0.6152
 epoch: 57, train_loss: 0.1530, test_loss: 2.2336, test_f1: 0.6577
 epoch: 58, train_loss: 0.1546, test_loss: 2.1278, test_f1: 0.6060
 epoch: 59, train_loss: 0.1452, test_loss: 2.2323, test_f1: 0.6303
 epoch: 60, train_loss: 0.1588, test_loss: 2.3117, test_f1: 0.6496
 epoch: 61, train_loss: 0.1689, test_loss: 2.4724, test_f1: 0.6299
 epoch: 62, train_loss: 0.1623, test_loss: 2.3831, test_f1: 0.6283
 epoch: 63, train_loss: 0.1395, test_loss: 2.4820, test_f1: 0.6304
 epoch: 64, train_loss: 0.1380, test_loss: 2.4318, test_f1: 0.6294
 epoch: 65, train_loss: 0.1534, test_loss: 2.6225, test_f1: 0.6067
 epoch: 66, train_loss: 0.1416, test_loss: 2.7627, test_f1: 0.6108
 epoch: 67, train_loss: 0.1707, test_loss: 2.8273, test_f1: 0.6050
 epoch: 68, train_loss: 0.1662, test_loss: 2.6764, test_f1: 0.6258
 epoch: 69, train_loss: 0.1389, test_loss: 2.7662, test_f1: 0.6123
 epoch: 70, train_loss: 0.1160, test_loss: 2.7500, test_f1: 0.6246
 epoch: 71, train_loss: 0.1342, test_loss: 2.7574, test_f1: 0.5972
 epoch: 72, train_loss: 0.1152, test_loss: 2.5601, test_f1: 0.6173
 epoch: 73, train_loss: 0.1116, test_loss: 2.8900, test_f1: 0.6126
 epoch: 74, train_loss: 0.1070, test_loss: 3.0985, test_f1: 0.6110
 epoch: 75, train_loss: 0.1131, test_loss: 3.3123, test_f1: 0.6027
 epoch: 76, train_loss: 0.1078, test_loss: 3.0559, test_f1: 0.6141
 epoch: 77, train_loss: 0.1032, test_loss: 2.7355, test_f1: 0.6327
 epoch: 78, train_loss: 0.0856, test_loss: 3.1137, test_f1: 0.6132
 epoch: 79, train_loss: 0.0893, test_loss: 3.0229, test_f1: 0.6132
 epoch: 80, train_loss: 0.1023, test_loss: 2.8499, test_f1: 0.6257
 epoch: 81, train_loss: 0.1457, test_loss: 2.8137, test_f1: 0.6320
 epoch: 82, train_loss: 0.1362, test_loss: 3.0607, test_f1: 0.5875
 epoch: 83, train_loss: 0.1388, test_loss: 2.9762, test_f1: 0.6072
 epoch: 84, train_loss: 0.1241, test_loss: 2.7338, test_f1: 0.6114
 epoch: 85, train_loss: 0.1101, test_loss: 3.0744, test_f1: 0.6200
 epoch: 86, train_loss: 0.0959, test_loss: 2.8782, test_f1: 0.6202
 epoch: 87, train_loss: 0.0915, test_loss: 2.9798, test_f1: 0.6204
 epoch: 88, train_loss: 0.1056, test_loss: 3.0508, test_f1: 0.6347
 epoch: 89, train_loss: 0.1076, test_loss: 3.0874, test_f1: 0.6356
 epoch: 90, train_loss: 0.1043, test_loss: 2.9871, test_f1: 0.6289
 epoch: 91, train_loss: 0.0941, test_loss: 3.1169, test_f1: 0.6192
 epoch: 92, train_loss: 0.0833, test_loss: 3.1283, test_f1: 0.6296
 epoch: 93, train_loss: 0.0823, test_loss: 3.0189, test_f1: 0.6199
 epoch: 94, train_loss: 0.0902, test_loss: 2.9845, test_f1: 0.5846
 epoch: 95, train_loss: 0.1182, test_loss: 2.9566, test_f1: 0.6181
 epoch: 96, train_loss: 0.1254, test_loss: 2.9117, test_f1: 0.6386
 epoch: 97, train_loss: 0.1094, test_loss: 3.0916, test_f1: 0.6140
 epoch: 98, train_loss: 0.1268, test_loss: 3.2104, test_f1: 0.5970
 epoch: 99, train_loss: 0.0995, test_loss: 2.9975, test_f1: 0.6094
##################ITERATION #1 ****************************************
 epoch: 0, train_loss: 1.1610, test_loss: 1.3035, test_f1: 0.2802
 epoch: 1, train_loss: 0.9582, test_loss: 1.2998, test_f1: 0.2838
 epoch: 2, train_loss: 0.8990, test_loss: 1.2444, test_f1: 0.3610
 epoch: 3, train_loss: 0.8377, test_loss: 1.0883, test_f1: 0.5377
 epoch: 4, train_loss: 0.8021, test_loss: 1.0168, test_f1: 0.5374
 epoch: 5, train_loss: 0.7426, test_loss: 1.0377, test_f1: 0.5745
 epoch: 6, train_loss: 0.7125, test_loss: 0.9948, test_f1: 0.5869
 epoch: 7, train_loss: 0.6970, test_loss: 1.0786, test_f1: 0.5571
 epoch: 8, train_loss: 0.6896, test_loss: 1.1614, test_f1: 0.5322
 epoch: 9, train_loss: 0.6510, test_loss: 1.0931, test_f1: 0.5623
 epoch: 10, train_loss: 0.6411, test_loss: 1.2995, test_f1: 0.4790
 epoch: 11, train_loss: 0.6223, test_loss: 1.0895, test_f1: 0.5748
 epoch: 12, train_loss: 0.5978, test_loss: 1.0232, test_f1: 0.6002
 epoch: 13, train_loss: 0.5698, test_loss: 1.1496, test_f1: 0.5709
 epoch: 14, train_loss: 0.5604, test_loss: 1.1183, test_f1: 0.5727
 epoch: 15, train_loss: 0.5420, test_loss: 1.1501, test_f1: 0.5896
 epoch: 16, train_loss: 0.5421, test_loss: 1.1716, test_f1: 0.5531
 epoch: 17, train_loss: 0.5248, test_loss: 1.1735, test_f1: 0.5652
 epoch: 18, train_loss: 0.5159, test_loss: 1.1082, test_f1: 0.6160
 epoch: 19, train_loss: 0.4678, test_loss: 1.2842, test_f1: 0.6199
 epoch: 20, train_loss: 0.4940, test_loss: 1.2235, test_f1: 0.5745
 epoch: 21, train_loss: 0.4489, test_loss: 1.2344, test_f1: 0.6297
 epoch: 22, train_loss: 0.4714, test_loss: 1.2510, test_f1: 0.6541
 epoch: 23, train_loss: 0.5069, test_loss: 1.5373, test_f1: 0.5623
 epoch: 24, train_loss: 0.4539, test_loss: 1.3707, test_f1: 0.5973
 epoch: 25, train_loss: 0.4124, test_loss: 1.3873, test_f1: 0.5837
 epoch: 26, train_loss: 0.3885, test_loss: 1.4669, test_f1: 0.6046
 epoch: 27, train_loss: 0.3745, test_loss: 1.9794, test_f1: 0.5435
 epoch: 28, train_loss: 0.4153, test_loss: 1.3048, test_f1: 0.6216
 epoch: 29, train_loss: 0.3736, test_loss: 1.4190, test_f1: 0.6371
 epoch: 30, train_loss: 0.3458, test_loss: 1.4918, test_f1: 0.6552
 epoch: 31, train_loss: 0.3776, test_loss: 1.6747, test_f1: 0.6223
 epoch: 32, train_loss: 0.3476, test_loss: 1.5936, test_f1: 0.6186
 epoch: 33, train_loss: 0.3079, test_loss: 1.5094, test_f1: 0.6085
 epoch: 34, train_loss: 0.3659, test_loss: 1.7883, test_f1: 0.6341
 epoch: 35, train_loss: 0.3292, test_loss: 1.7617, test_f1: 0.5856
 epoch: 36, train_loss: 0.2950, test_loss: 1.7049, test_f1: 0.6161
 epoch: 37, train_loss: 0.3061, test_loss: 1.7360, test_f1: 0.6375
 epoch: 38, train_loss: 0.2630, test_loss: 1.8100, test_f1: 0.6354
 epoch: 39, train_loss: 0.2754, test_loss: 1.9834, test_f1: 0.5911
 epoch: 40, train_loss: 0.2717, test_loss: 1.8848, test_f1: 0.6603
 epoch: 41, train_loss: 0.2456, test_loss: 2.1304, test_f1: 0.6306
 epoch: 42, train_loss: 0.2439, test_loss: 2.2415, test_f1: 0.6190
 epoch: 43, train_loss: 0.2580, test_loss: 1.8828, test_f1: 0.6277
 epoch: 44, train_loss: 0.2329, test_loss: 1.9518, test_f1: 0.6189
 epoch: 45, train_loss: 0.2281, test_loss: 2.2048, test_f1: 0.6144
 epoch: 46, train_loss: 0.2464, test_loss: 2.5182, test_f1: 0.5803
 epoch: 47, train_loss: 0.2123, test_loss: 2.2174, test_f1: 0.5982
 epoch: 48, train_loss: 0.2041, test_loss: 2.2234, test_f1: 0.6283
 epoch: 49, train_loss: 0.2053, test_loss: 2.2653, test_f1: 0.6290
 epoch: 50, train_loss: 0.1900, test_loss: 2.4624, test_f1: 0.6071
 epoch: 51, train_loss: 0.1716, test_loss: 2.0789, test_f1: 0.6722
 epoch: 52, train_loss: 0.1507, test_loss: 2.2218, test_f1: 0.6314
 epoch: 53, train_loss: 0.1439, test_loss: 2.3078, test_f1: 0.6285
 epoch: 54, train_loss: 0.1424, test_loss: 2.2374, test_f1: 0.6598
 epoch: 55, train_loss: 0.1431, test_loss: 2.2293, test_f1: 0.6432
 epoch: 56, train_loss: 0.1352, test_loss: 2.2571, test_f1: 0.6719
 epoch: 57, train_loss: 0.1322, test_loss: 2.4431, test_f1: 0.6391
 epoch: 58, train_loss: 0.1421, test_loss: 2.6389, test_f1: 0.6340
 epoch: 59, train_loss: 0.1186, test_loss: 2.4391, test_f1: 0.6733
 epoch: 60, train_loss: 0.1057, test_loss: 2.4554, test_f1: 0.6484
 epoch: 61, train_loss: 0.1090, test_loss: 2.3985, test_f1: 0.6506
 epoch: 62, train_loss: 0.1238, test_loss: 2.7240, test_f1: 0.6448
 epoch: 63, train_loss: 0.1277, test_loss: 2.6417, test_f1: 0.6155
 epoch: 64, train_loss: 0.1174, test_loss: 2.5922, test_f1: 0.6605
 epoch: 65, train_loss: 0.1005, test_loss: 2.6882, test_f1: 0.6269
 epoch: 66, train_loss: 0.0942, test_loss: 2.7547, test_f1: 0.6264
 epoch: 67, train_loss: 0.1173, test_loss: 2.7657, test_f1: 0.6395
 epoch: 68, train_loss: 0.1053, test_loss: 2.7571, test_f1: 0.6384
 epoch: 69, train_loss: 0.0776, test_loss: 2.7900, test_f1: 0.6281
 epoch: 70, train_loss: 0.0967, test_loss: 2.9235, test_f1: 0.6189
 epoch: 71, train_loss: 0.1059, test_loss: 2.8671, test_f1: 0.6381
 epoch: 72, train_loss: 0.1067, test_loss: 2.8696, test_f1: 0.6341
 epoch: 73, train_loss: 0.1092, test_loss: 3.0531, test_f1: 0.6021
 epoch: 74, train_loss: 0.1071, test_loss: 2.8096, test_f1: 0.6547
 epoch: 75, train_loss: 0.0979, test_loss: 2.8179, test_f1: 0.6170
 epoch: 76, train_loss: 0.0850, test_loss: 2.5786, test_f1: 0.6565
 epoch: 77, train_loss: 0.0895, test_loss: 2.7635, test_f1: 0.6206
 epoch: 78, train_loss: 0.0817, test_loss: 2.8042, test_f1: 0.6331
 epoch: 79, train_loss: 0.0748, test_loss: 2.9041, test_f1: 0.6301
 epoch: 80, train_loss: 0.0782, test_loss: 2.7366, test_f1: 0.6691
 epoch: 81, train_loss: 0.0726, test_loss: 2.9186, test_f1: 0.6611
 epoch: 82, train_loss: 0.0748, test_loss: 3.0926, test_f1: 0.6567
 epoch: 83, train_loss: 0.0943, test_loss: 3.0844, test_f1: 0.6221
 epoch: 84, train_loss: 0.0675, test_loss: 3.1977, test_f1: 0.6217
 epoch: 85, train_loss: 0.0923, test_loss: 2.8297, test_f1: 0.6491
 epoch: 86, train_loss: 0.0678, test_loss: 3.1442, test_f1: 0.6029
 epoch: 87, train_loss: 0.1098, test_loss: 3.1780, test_f1: 0.6107
 epoch: 88, train_loss: 0.1042, test_loss: 2.9113, test_f1: 0.6480
 epoch: 89, train_loss: 0.0818, test_loss: 2.9989, test_f1: 0.6192
 epoch: 90, train_loss: 0.0749, test_loss: 3.0208, test_f1: 0.6365
 epoch: 91, train_loss: 0.0872, test_loss: 3.1779, test_f1: 0.6154
 epoch: 92, train_loss: 0.0885, test_loss: 3.3282, test_f1: 0.6294
 epoch: 93, train_loss: 0.1035, test_loss: 3.2915, test_f1: 0.6156
 epoch: 94, train_loss: 0.0795, test_loss: 3.1440, test_f1: 0.6618
 epoch: 95, train_loss: 0.0740, test_loss: 3.1741, test_f1: 0.6433
 epoch: 96, train_loss: 0.0780, test_loss: 3.1471, test_f1: 0.6549
 epoch: 97, train_loss: 0.0795, test_loss: 3.1951, test_f1: 0.6405
 epoch: 98, train_loss: 0.0947, test_loss: 3.3984, test_f1: 0.6301
 epoch: 99, train_loss: 0.1020, test_loss: 3.4200, test_f1: 0.5903
##################ITERATION #2 ****************************************
 epoch: 0, train_loss: 1.1217, test_loss: 1.3399, test_f1: 0.3143
 epoch: 1, train_loss: 0.9694, test_loss: 1.3318, test_f1: 0.2281
 epoch: 2, train_loss: 0.8912, test_loss: 1.1243, test_f1: 0.4378
 epoch: 3, train_loss: 0.8418, test_loss: 1.1153, test_f1: 0.4869
 epoch: 4, train_loss: 0.8017, test_loss: 1.0455, test_f1: 0.5886
 epoch: 5, train_loss: 0.7691, test_loss: 1.0154, test_f1: 0.5751
 epoch: 6, train_loss: 0.7442, test_loss: 1.1014, test_f1: 0.5935
 epoch: 7, train_loss: 0.7361, test_loss: 1.0692, test_f1: 0.5890
 epoch: 8, train_loss: 0.6964, test_loss: 0.9546, test_f1: 0.6259
 epoch: 9, train_loss: 0.6899, test_loss: 1.0866, test_f1: 0.5649
 epoch: 10, train_loss: 0.6708, test_loss: 1.0782, test_f1: 0.5816
 epoch: 11, train_loss: 0.6312, test_loss: 1.0705, test_f1: 0.5969
 epoch: 12, train_loss: 0.6250, test_loss: 0.9933, test_f1: 0.6277
 epoch: 13, train_loss: 0.5985, test_loss: 1.0514, test_f1: 0.5954
 epoch: 14, train_loss: 0.5864, test_loss: 1.1033, test_f1: 0.6158
 epoch: 15, train_loss: 0.5732, test_loss: 1.2000, test_f1: 0.5858
 epoch: 16, train_loss: 0.5799, test_loss: 1.0492, test_f1: 0.6260
 epoch: 17, train_loss: 0.5495, test_loss: 1.1738, test_f1: 0.6044
 epoch: 18, train_loss: 0.5120, test_loss: 1.3666, test_f1: 0.6046
 epoch: 19, train_loss: 0.5298, test_loss: 1.1242, test_f1: 0.6302
 epoch: 20, train_loss: 0.5095, test_loss: 1.2152, test_f1: 0.5833
 epoch: 21, train_loss: 0.4826, test_loss: 1.4058, test_f1: 0.5962
 epoch: 22, train_loss: 0.4734, test_loss: 1.2170, test_f1: 0.6467
 epoch: 23, train_loss: 0.4696, test_loss: 1.3082, test_f1: 0.6437
 epoch: 24, train_loss: 0.4184, test_loss: 1.4881, test_f1: 0.6108
 epoch: 25, train_loss: 0.4449, test_loss: 1.5036, test_f1: 0.5719
 epoch: 26, train_loss: 0.4447, test_loss: 1.4755, test_f1: 0.6078
 epoch: 27, train_loss: 0.4193, test_loss: 1.5755, test_f1: 0.5801
 epoch: 28, train_loss: 0.4087, test_loss: 1.3762, test_f1: 0.5780
 epoch: 29, train_loss: 0.3956, test_loss: 1.4133, test_f1: 0.6592
 epoch: 30, train_loss: 0.4173, test_loss: 1.7009, test_f1: 0.6051
 epoch: 31, train_loss: 0.3938, test_loss: 1.5567, test_f1: 0.6028
 epoch: 32, train_loss: 0.3617, test_loss: 1.8164, test_f1: 0.5776
 epoch: 33, train_loss: 0.3298, test_loss: 1.6425, test_f1: 0.6090
 epoch: 34, train_loss: 0.3288, test_loss: 1.8151, test_f1: 0.5923
 epoch: 35, train_loss: 0.3313, test_loss: 2.1110, test_f1: 0.5702
 epoch: 36, train_loss: 0.3382, test_loss: 1.6725, test_f1: 0.6209
 epoch: 37, train_loss: 0.3082, test_loss: 1.9815, test_f1: 0.5533
 epoch: 38, train_loss: 0.3247, test_loss: 1.8042, test_f1: 0.5894
 epoch: 39, train_loss: 0.3293, test_loss: 1.8383, test_f1: 0.6009
 epoch: 40, train_loss: 0.2917, test_loss: 2.0079, test_f1: 0.6041
 epoch: 41, train_loss: 0.3171, test_loss: 1.7982, test_f1: 0.6060
 epoch: 42, train_loss: 0.3053, test_loss: 2.1669, test_f1: 0.5884
 epoch: 43, train_loss: 0.2885, test_loss: 1.8568, test_f1: 0.5709
 epoch: 44, train_loss: 0.2862, test_loss: 2.1016, test_f1: 0.6228
 epoch: 45, train_loss: 0.2764, test_loss: 2.3380, test_f1: 0.5996
 epoch: 46, train_loss: 0.3035, test_loss: 1.8892, test_f1: 0.6273
 epoch: 47, train_loss: 0.3066, test_loss: 2.6113, test_f1: 0.5677
 epoch: 48, train_loss: 0.3357, test_loss: 1.8192, test_f1: 0.6116
 epoch: 49, train_loss: 0.2736, test_loss: 1.8211, test_f1: 0.5569
 epoch: 50, train_loss: 0.2425, test_loss: 2.1612, test_f1: 0.5655
 epoch: 51, train_loss: 0.2471, test_loss: 2.1110, test_f1: 0.5806
 epoch: 52, train_loss: 0.1827, test_loss: 2.1865, test_f1: 0.5989
 epoch: 53, train_loss: 0.1822, test_loss: 2.2358, test_f1: 0.5842
 epoch: 54, train_loss: 0.1719, test_loss: 2.4409, test_f1: 0.5657
 epoch: 55, train_loss: 0.1803, test_loss: 2.4209, test_f1: 0.5837
 epoch: 56, train_loss: 0.1618, test_loss: 2.5618, test_f1: 0.5673
 epoch: 57, train_loss: 0.1545, test_loss: 2.3627, test_f1: 0.5956
 epoch: 58, train_loss: 0.1572, test_loss: 2.2729, test_f1: 0.5926
 epoch: 59, train_loss: 0.1522, test_loss: 2.3382, test_f1: 0.6052
 epoch: 60, train_loss: 0.1306, test_loss: 2.6247, test_f1: 0.5707
 epoch: 61, train_loss: 0.1274, test_loss: 2.7275, test_f1: 0.5694
 epoch: 62, train_loss: 0.1480, test_loss: 2.5353, test_f1: 0.6118
 epoch: 63, train_loss: 0.1184, test_loss: 2.5680, test_f1: 0.6016
 epoch: 64, train_loss: 0.1269, test_loss: 2.7872, test_f1: 0.5733
 epoch: 65, train_loss: 0.1245, test_loss: 2.7245, test_f1: 0.6152
 epoch: 66, train_loss: 0.1460, test_loss: 2.7821, test_f1: 0.5538
 epoch: 67, train_loss: 0.1551, test_loss: 2.7169, test_f1: 0.5936
 epoch: 68, train_loss: 0.1293, test_loss: 2.7714, test_f1: 0.6043
 epoch: 69, train_loss: 0.1303, test_loss: 2.5689, test_f1: 0.5750
 epoch: 70, train_loss: 0.1197, test_loss: 2.8881, test_f1: 0.5666
 epoch: 71, train_loss: 0.1223, test_loss: 2.9948, test_f1: 0.5944
 epoch: 72, train_loss: 0.1298, test_loss: 2.8930, test_f1: 0.6174
 epoch: 73, train_loss: 0.1342, test_loss: 2.6774, test_f1: 0.6101
 epoch: 74, train_loss: 0.1322, test_loss: 2.7040, test_f1: 0.6287
 epoch: 75, train_loss: 0.1236, test_loss: 2.9887, test_f1: 0.5899
 epoch: 76, train_loss: 0.1170, test_loss: 2.9365, test_f1: 0.6007
 epoch: 77, train_loss: 0.1144, test_loss: 2.8319, test_f1: 0.6209
 epoch: 78, train_loss: 0.0989, test_loss: 2.8954, test_f1: 0.6260
 epoch: 79, train_loss: 0.1065, test_loss: 3.3009, test_f1: 0.5600
 epoch: 80, train_loss: 0.1200, test_loss: 3.3440, test_f1: 0.5885
 epoch: 81, train_loss: 0.1256, test_loss: 3.3038, test_f1: 0.5772
 epoch: 82, train_loss: 0.1135, test_loss: 2.9734, test_f1: 0.5662
 epoch: 83, train_loss: 0.1061, test_loss: 3.1166, test_f1: 0.5802
 epoch: 84, train_loss: 0.1062, test_loss: 2.9553, test_f1: 0.5753
 epoch: 85, train_loss: 0.0916, test_loss: 3.2455, test_f1: 0.5877
 epoch: 86, train_loss: 0.1163, test_loss: 3.2793, test_f1: 0.6091
 epoch: 87, train_loss: 0.1020, test_loss: 3.1970, test_f1: 0.5933
 epoch: 88, train_loss: 0.0960, test_loss: 3.4471, test_f1: 0.5624
 epoch: 89, train_loss: 0.0945, test_loss: 3.2232, test_f1: 0.5650
 epoch: 90, train_loss: 0.1045, test_loss: 3.3680, test_f1: 0.5811
 epoch: 91, train_loss: 0.0853, test_loss: 3.1873, test_f1: 0.5975
 epoch: 92, train_loss: 0.0740, test_loss: 3.1944, test_f1: 0.5743
 epoch: 93, train_loss: 0.0755, test_loss: 3.3642, test_f1: 0.6157
 epoch: 94, train_loss: 0.0899, test_loss: 3.5460, test_f1: 0.5695
 epoch: 95, train_loss: 0.1039, test_loss: 3.5930, test_f1: 0.5846
 epoch: 96, train_loss: 0.0970, test_loss: 3.5431, test_f1: 0.5749
 epoch: 97, train_loss: 0.1033, test_loss: 4.0903, test_f1: 0.5575
 epoch: 98, train_loss: 0.0808, test_loss: 3.6266, test_f1: 0.5595
 epoch: 99, train_loss: 0.0735, test_loss: 3.6062, test_f1: 0.5669
##################ITERATION #3 ****************************************
 epoch: 0, train_loss: 1.1492, test_loss: 1.3584, test_f1: 0.3475
 epoch: 1, train_loss: 0.9419, test_loss: 1.3662, test_f1: 0.2649
 epoch: 2, train_loss: 0.8601, test_loss: 1.2657, test_f1: 0.4254
 epoch: 3, train_loss: 0.8258, test_loss: 1.0436, test_f1: 0.5236
 epoch: 4, train_loss: 0.7851, test_loss: 1.0074, test_f1: 0.5514
 epoch: 5, train_loss: 0.7355, test_loss: 0.9645, test_f1: 0.6042
 epoch: 6, train_loss: 0.7110, test_loss: 1.0561, test_f1: 0.5757
 epoch: 7, train_loss: 0.7086, test_loss: 0.9321, test_f1: 0.6574
 epoch: 8, train_loss: 0.6815, test_loss: 0.9504, test_f1: 0.5691
 epoch: 9, train_loss: 0.6754, test_loss: 1.1280, test_f1: 0.5741
 epoch: 10, train_loss: 0.6488, test_loss: 1.0518, test_f1: 0.5841
 epoch: 11, train_loss: 0.6182, test_loss: 0.9497, test_f1: 0.6054
 epoch: 12, train_loss: 0.5955, test_loss: 1.0680, test_f1: 0.6413
 epoch: 13, train_loss: 0.5748, test_loss: 1.1251, test_f1: 0.5441
 epoch: 14, train_loss: 0.5713, test_loss: 1.2791, test_f1: 0.5519
 epoch: 15, train_loss: 0.5522, test_loss: 0.9759, test_f1: 0.6290
 epoch: 16, train_loss: 0.5635, test_loss: 1.0326, test_f1: 0.6216
 epoch: 17, train_loss: 0.5346, test_loss: 1.1479, test_f1: 0.5562
 epoch: 18, train_loss: 0.5050, test_loss: 1.1621, test_f1: 0.5881
 epoch: 19, train_loss: 0.4947, test_loss: 1.1895, test_f1: 0.6384
 epoch: 20, train_loss: 0.4765, test_loss: 1.4764, test_f1: 0.6197
 epoch: 21, train_loss: 0.4873, test_loss: 1.3049, test_f1: 0.5944
 epoch: 22, train_loss: 0.4614, test_loss: 1.1871, test_f1: 0.6437
 epoch: 23, train_loss: 0.5146, test_loss: 1.2136, test_f1: 0.5948
 epoch: 24, train_loss: 0.4752, test_loss: 1.3379, test_f1: 0.5831
 epoch: 25, train_loss: 0.4468, test_loss: 1.1934, test_f1: 0.6192
 epoch: 26, train_loss: 0.4250, test_loss: 1.2476, test_f1: 0.5823
 epoch: 27, train_loss: 0.4018, test_loss: 1.4273, test_f1: 0.5826
 epoch: 28, train_loss: 0.3709, test_loss: 1.5014, test_f1: 0.6186
 epoch: 29, train_loss: 0.3783, test_loss: 1.3251, test_f1: 0.6448
 epoch: 30, train_loss: 0.3889, test_loss: 1.2593, test_f1: 0.6116
 epoch: 31, train_loss: 0.3691, test_loss: 1.5551, test_f1: 0.5623
 epoch: 32, train_loss: 0.3770, test_loss: 1.2225, test_f1: 0.6266
 epoch: 33, train_loss: 0.3536, test_loss: 1.4462, test_f1: 0.6485
 epoch: 34, train_loss: 0.3643, test_loss: 1.6358, test_f1: 0.5956
 epoch: 35, train_loss: 0.3393, test_loss: 1.7191, test_f1: 0.5473
 epoch: 36, train_loss: 0.3471, test_loss: 1.5341, test_f1: 0.6445
 epoch: 37, train_loss: 0.3485, test_loss: 1.4628, test_f1: 0.5789
 epoch: 38, train_loss: 0.2886, test_loss: 1.7582, test_f1: 0.5755
 epoch: 39, train_loss: 0.3137, test_loss: 2.3191, test_f1: 0.5870
 epoch: 40, train_loss: 0.2883, test_loss: 1.7894, test_f1: 0.6070
 epoch: 41, train_loss: 0.2892, test_loss: 1.4240, test_f1: 0.6435
 epoch: 42, train_loss: 0.2742, test_loss: 1.7934, test_f1: 0.5951
 epoch: 43, train_loss: 0.2700, test_loss: 1.6758, test_f1: 0.6476
 epoch: 44, train_loss: 0.2281, test_loss: 1.6325, test_f1: 0.6545
 epoch: 45, train_loss: 0.2522, test_loss: 2.0524, test_f1: 0.5746
 epoch: 46, train_loss: 0.2597, test_loss: 1.7922, test_f1: 0.6215
 epoch: 47, train_loss: 0.2499, test_loss: 2.2378, test_f1: 0.5485
 epoch: 48, train_loss: 0.2565, test_loss: 1.7827, test_f1: 0.5744
 epoch: 49, train_loss: 0.2711, test_loss: 1.6569, test_f1: 0.6155
 epoch: 50, train_loss: 0.2145, test_loss: 1.8537, test_f1: 0.5999
 epoch: 51, train_loss: 0.2131, test_loss: 1.7981, test_f1: 0.6295
 epoch: 52, train_loss: 0.1846, test_loss: 1.8841, test_f1: 0.6299
 epoch: 53, train_loss: 0.1853, test_loss: 1.7940, test_f1: 0.6411
 epoch: 54, train_loss: 0.1690, test_loss: 2.1850, test_f1: 0.6001
 epoch: 55, train_loss: 0.1596, test_loss: 1.9620, test_f1: 0.6166
 epoch: 56, train_loss: 0.1765, test_loss: 2.0435, test_f1: 0.6001
 epoch: 57, train_loss: 0.1514, test_loss: 1.9968, test_f1: 0.6203
 epoch: 58, train_loss: 0.1368, test_loss: 2.3065, test_f1: 0.6117
 epoch: 59, train_loss: 0.1354, test_loss: 2.2121, test_f1: 0.6105
 epoch: 60, train_loss: 0.1266, test_loss: 2.4359, test_f1: 0.6171
 epoch: 61, train_loss: 0.1273, test_loss: 2.3015, test_f1: 0.6160
 epoch: 62, train_loss: 0.1338, test_loss: 2.2637, test_f1: 0.6226
 epoch: 63, train_loss: 0.1372, test_loss: 2.5247, test_f1: 0.6089
 epoch: 64, train_loss: 0.1212, test_loss: 2.3050, test_f1: 0.6210
 epoch: 65, train_loss: 0.1584, test_loss: 2.4107, test_f1: 0.6050
 epoch: 66, train_loss: 0.1530, test_loss: 2.1195, test_f1: 0.6175
 epoch: 67, train_loss: 0.1468, test_loss: 2.4096, test_f1: 0.6009
 epoch: 68, train_loss: 0.1303, test_loss: 2.3972, test_f1: 0.6050
 epoch: 69, train_loss: 0.1103, test_loss: 2.3947, test_f1: 0.6174
 epoch: 70, train_loss: 0.1382, test_loss: 2.3553, test_f1: 0.6304
 epoch: 71, train_loss: 0.1107, test_loss: 2.3569, test_f1: 0.6084
 epoch: 72, train_loss: 0.1198, test_loss: 2.3814, test_f1: 0.6283
 epoch: 73, train_loss: 0.1540, test_loss: 2.2415, test_f1: 0.6307
 epoch: 74, train_loss: 0.1248, test_loss: 2.3386, test_f1: 0.5967
 epoch: 75, train_loss: 0.1066, test_loss: 2.6116, test_f1: 0.5953
 epoch: 76, train_loss: 0.1016, test_loss: 2.6513, test_f1: 0.6165
 epoch: 77, train_loss: 0.1061, test_loss: 2.7331, test_f1: 0.6142
 epoch: 78, train_loss: 0.0855, test_loss: 2.8228, test_f1: 0.6087
 epoch: 79, train_loss: 0.1031, test_loss: 2.6190, test_f1: 0.6071
 epoch: 80, train_loss: 0.1048, test_loss: 2.8217, test_f1: 0.6058
 epoch: 81, train_loss: 0.0925, test_loss: 2.6431, test_f1: 0.6195
 epoch: 82, train_loss: 0.0898, test_loss: 2.5693, test_f1: 0.6045
 epoch: 83, train_loss: 0.0916, test_loss: 2.7197, test_f1: 0.5969
 epoch: 84, train_loss: 0.0951, test_loss: 2.7101, test_f1: 0.6115
 epoch: 85, train_loss: 0.1171, test_loss: 2.5301, test_f1: 0.6081
 epoch: 86, train_loss: 0.0743, test_loss: 2.5727, test_f1: 0.6195
 epoch: 87, train_loss: 0.0969, test_loss: 2.6332, test_f1: 0.5875
 epoch: 88, train_loss: 0.1035, test_loss: 2.6567, test_f1: 0.6180
 epoch: 89, train_loss: 0.1130, test_loss: 2.7336, test_f1: 0.6081
 epoch: 90, train_loss: 0.1108, test_loss: 2.6063, test_f1: 0.6384
 epoch: 91, train_loss: 0.1282, test_loss: 2.4589, test_f1: 0.6247
 epoch: 92, train_loss: 0.1194, test_loss: 2.7200, test_f1: 0.6232
 epoch: 93, train_loss: 0.1286, test_loss: 2.6382, test_f1: 0.6632
 epoch: 94, train_loss: 0.1212, test_loss: 2.9579, test_f1: 0.6093
 epoch: 95, train_loss: 0.0921, test_loss: 2.6614, test_f1: 0.6327
 epoch: 96, train_loss: 0.1301, test_loss: 2.7904, test_f1: 0.6399
 epoch: 97, train_loss: 0.1070, test_loss: 2.7229, test_f1: 0.6114
 epoch: 98, train_loss: 0.1174, test_loss: 2.6872, test_f1: 0.5921
 epoch: 99, train_loss: 0.0972, test_loss: 2.5968, test_f1: 0.6186
##################ITERATION #4 ****************************************
 epoch: 0, train_loss: 1.2528, test_loss: 1.3873, test_f1: 0.2147
 epoch: 1, train_loss: 1.0280, test_loss: 1.3695, test_f1: 0.3799
 epoch: 2, train_loss: 0.9430, test_loss: 1.3406, test_f1: 0.4205
 epoch: 3, train_loss: 0.9056, test_loss: 1.1653, test_f1: 0.5257
 epoch: 4, train_loss: 0.8601, test_loss: 1.0804, test_f1: 0.5431
 epoch: 5, train_loss: 0.8251, test_loss: 1.0853, test_f1: 0.5441
 epoch: 6, train_loss: 0.7950, test_loss: 1.0496, test_f1: 0.5751
 epoch: 7, train_loss: 0.7573, test_loss: 1.0728, test_f1: 0.5966
 epoch: 8, train_loss: 0.7259, test_loss: 1.0682, test_f1: 0.5391
 epoch: 9, train_loss: 0.6996, test_loss: 1.0031, test_f1: 0.5936
 epoch: 10, train_loss: 0.6608, test_loss: 1.0911, test_f1: 0.5655
 epoch: 11, train_loss: 0.6495, test_loss: 1.4155, test_f1: 0.5444
 epoch: 12, train_loss: 0.6282, test_loss: 1.0764, test_f1: 0.5763
 epoch: 13, train_loss: 0.6169, test_loss: 1.1693, test_f1: 0.6219
 epoch: 14, train_loss: 0.5987, test_loss: 1.3482, test_f1: 0.5739
 epoch: 15, train_loss: 0.5588, test_loss: 1.0149, test_f1: 0.6359
 epoch: 16, train_loss: 0.5494, test_loss: 1.2442, test_f1: 0.5554
 epoch: 17, train_loss: 0.5628, test_loss: 1.0817, test_f1: 0.5845
 epoch: 18, train_loss: 0.5250, test_loss: 1.1088, test_f1: 0.6151
 epoch: 19, train_loss: 0.4903, test_loss: 1.2386, test_f1: 0.5960
 epoch: 20, train_loss: 0.4800, test_loss: 1.3878, test_f1: 0.5426
 epoch: 21, train_loss: 0.4876, test_loss: 1.1441, test_f1: 0.6340
 epoch: 22, train_loss: 0.4504, test_loss: 1.2761, test_f1: 0.5728
 epoch: 23, train_loss: 0.4644, test_loss: 1.5824, test_f1: 0.5703
 epoch: 24, train_loss: 0.4244, test_loss: 1.4266, test_f1: 0.6066
 epoch: 25, train_loss: 0.4291, test_loss: 1.2256, test_f1: 0.6298
 epoch: 26, train_loss: 0.3980, test_loss: 1.3059, test_f1: 0.6606
 epoch: 27, train_loss: 0.4219, test_loss: 1.3893, test_f1: 0.6100
 epoch: 28, train_loss: 0.3961, test_loss: 1.4477, test_f1: 0.6052
 epoch: 29, train_loss: 0.3944, test_loss: 1.4493, test_f1: 0.5675
 epoch: 30, train_loss: 0.3684, test_loss: 1.6590, test_f1: 0.6206
 epoch: 31, train_loss: 0.4050, test_loss: 1.4695, test_f1: 0.5764
 epoch: 32, train_loss: 0.4046, test_loss: 1.7167, test_f1: 0.5900
 epoch: 33, train_loss: 0.3629, test_loss: 1.5390, test_f1: 0.6364
 epoch: 34, train_loss: 0.3404, test_loss: 1.3294, test_f1: 0.6658
 epoch: 35, train_loss: 0.3372, test_loss: 1.4818, test_f1: 0.6106
 epoch: 36, train_loss: 0.3358, test_loss: 1.3931, test_f1: 0.6048
 epoch: 37, train_loss: 0.3420, test_loss: 1.5713, test_f1: 0.6058
 epoch: 38, train_loss: 0.3297, test_loss: 1.6086, test_f1: 0.6296
 epoch: 39, train_loss: 0.3380, test_loss: 1.7615, test_f1: 0.5912
 epoch: 40, train_loss: 0.3289, test_loss: 1.5641, test_f1: 0.6165
 epoch: 41, train_loss: 0.3087, test_loss: 1.8188, test_f1: 0.5982
 epoch: 42, train_loss: 0.3069, test_loss: 1.6499, test_f1: 0.6344
 epoch: 43, train_loss: 0.2679, test_loss: 1.6319, test_f1: 0.6734
 epoch: 44, train_loss: 0.2611, test_loss: 1.7808, test_f1: 0.6298
 epoch: 45, train_loss: 0.2791, test_loss: 2.1147, test_f1: 0.6044
 epoch: 46, train_loss: 0.3157, test_loss: 2.1913, test_f1: 0.6056
 epoch: 47, train_loss: 0.3184, test_loss: 1.8921, test_f1: 0.5457
 epoch: 48, train_loss: 0.3126, test_loss: 1.6709, test_f1: 0.5871
 epoch: 49, train_loss: 0.2540, test_loss: 1.7900, test_f1: 0.6822
 epoch: 50, train_loss: 0.2580, test_loss: 1.7103, test_f1: 0.6313
 epoch: 51, train_loss: 0.2501, test_loss: 1.8081, test_f1: 0.6405
 epoch: 52, train_loss: 0.2391, test_loss: 1.9121, test_f1: 0.6337
 epoch: 53, train_loss: 0.2071, test_loss: 1.9756, test_f1: 0.6361
 epoch: 54, train_loss: 0.2041, test_loss: 1.9758, test_f1: 0.6650
 epoch: 55, train_loss: 0.1777, test_loss: 2.0849, test_f1: 0.6189
 epoch: 56, train_loss: 0.1970, test_loss: 2.0404, test_f1: 0.6740
 epoch: 57, train_loss: 0.1575, test_loss: 2.0544, test_f1: 0.6580
 epoch: 58, train_loss: 0.1538, test_loss: 2.1572, test_f1: 0.6531
 epoch: 59, train_loss: 0.1696, test_loss: 2.2072, test_f1: 0.6665
 epoch: 60, train_loss: 0.1829, test_loss: 2.1956, test_f1: 0.6693
 epoch: 61, train_loss: 0.1503, test_loss: 2.2727, test_f1: 0.6609
 epoch: 62, train_loss: 0.1563, test_loss: 2.2403, test_f1: 0.6395
 epoch: 63, train_loss: 0.1411, test_loss: 2.2860, test_f1: 0.6496
 epoch: 64, train_loss: 0.1541, test_loss: 2.2108, test_f1: 0.6833
 epoch: 65, train_loss: 0.1614, test_loss: 2.2190, test_f1: 0.6629
 epoch: 66, train_loss: 0.1448, test_loss: 2.2922, test_f1: 0.6754
 epoch: 67, train_loss: 0.1412, test_loss: 2.3070, test_f1: 0.6474
 epoch: 68, train_loss: 0.1644, test_loss: 2.2812, test_f1: 0.6276
 epoch: 69, train_loss: 0.1617, test_loss: 2.4649, test_f1: 0.6195
 epoch: 70, train_loss: 0.1513, test_loss: 2.4969, test_f1: 0.6521
 epoch: 71, train_loss: 0.1352, test_loss: 2.3434, test_f1: 0.6575
 epoch: 72, train_loss: 0.1538, test_loss: 2.4078, test_f1: 0.6460
 epoch: 73, train_loss: 0.1415, test_loss: 2.4607, test_f1: 0.6221
 epoch: 74, train_loss: 0.1468, test_loss: 2.3175, test_f1: 0.6606
 epoch: 75, train_loss: 0.1444, test_loss: 2.4053, test_f1: 0.6194
 epoch: 76, train_loss: 0.1404, test_loss: 2.5252, test_f1: 0.6333
 epoch: 77, train_loss: 0.1170, test_loss: 2.6288, test_f1: 0.6535
 epoch: 78, train_loss: 0.1473, test_loss: 2.4672, test_f1: 0.6601
 epoch: 79, train_loss: 0.1309, test_loss: 2.6382, test_f1: 0.6335
 epoch: 80, train_loss: 0.1301, test_loss: 2.6154, test_f1: 0.6292
 epoch: 81, train_loss: 0.1440, test_loss: 2.6779, test_f1: 0.6667
 epoch: 82, train_loss: 0.1503, test_loss: 2.7394, test_f1: 0.6181
 epoch: 83, train_loss: 0.1484, test_loss: 2.4892, test_f1: 0.6727
 epoch: 84, train_loss: 0.1564, test_loss: 2.6669, test_f1: 0.6580
 epoch: 85, train_loss: 0.1469, test_loss: 2.4376, test_f1: 0.6632
 epoch: 86, train_loss: 0.1427, test_loss: 2.7474, test_f1: 0.6601
 epoch: 87, train_loss: 0.1054, test_loss: 2.5350, test_f1: 0.6787
 epoch: 88, train_loss: 0.0988, test_loss: 2.6989, test_f1: 0.6512
 epoch: 89, train_loss: 0.0937, test_loss: 2.7378, test_f1: 0.6408
 epoch: 90, train_loss: 0.0882, test_loss: 2.7072, test_f1: 0.6641
 epoch: 91, train_loss: 0.1159, test_loss: 2.8951, test_f1: 0.6374
 epoch: 92, train_loss: 0.1291, test_loss: 2.7953, test_f1: 0.6275
 epoch: 93, train_loss: 0.1139, test_loss: 2.6519, test_f1: 0.6577
 epoch: 94, train_loss: 0.1039, test_loss: 2.9374, test_f1: 0.6655
 epoch: 95, train_loss: 0.1070, test_loss: 3.0293, test_f1: 0.6557
 epoch: 96, train_loss: 0.1343, test_loss: 2.8853, test_f1: 0.6579
 epoch: 97, train_loss: 0.1387, test_loss: 2.7115, test_f1: 0.6450
 epoch: 98, train_loss: 0.1384, test_loss: 2.8758, test_f1: 0.6475
 epoch: 99, train_loss: 0.1167, test_loss: 2.8902, test_f1: 0.6070
##################ITERATION #5 ****************************************
 epoch: 0, train_loss: 1.2476, test_loss: 1.4471, test_f1: 0.2373
 epoch: 1, train_loss: 1.0162, test_loss: 1.4444, test_f1: 0.2660
 epoch: 2, train_loss: 0.9147, test_loss: 1.2476, test_f1: 0.2953
 epoch: 3, train_loss: 0.8404, test_loss: 1.0647, test_f1: 0.5012
 epoch: 4, train_loss: 0.8115, test_loss: 0.9972, test_f1: 0.6024
 epoch: 5, train_loss: 0.7985, test_loss: 1.0172, test_f1: 0.6025
 epoch: 6, train_loss: 0.7770, test_loss: 1.0459, test_f1: 0.5858
 epoch: 7, train_loss: 0.7442, test_loss: 0.9895, test_f1: 0.5859
 epoch: 8, train_loss: 0.7274, test_loss: 1.0548, test_f1: 0.5628
 epoch: 9, train_loss: 0.6870, test_loss: 1.0437, test_f1: 0.5449
 epoch: 10, train_loss: 0.6581, test_loss: 1.0072, test_f1: 0.6334
 epoch: 11, train_loss: 0.6362, test_loss: 1.0863, test_f1: 0.5857
 epoch: 12, train_loss: 0.6247, test_loss: 1.1396, test_f1: 0.5625
 epoch: 13, train_loss: 0.6225, test_loss: 1.0158, test_f1: 0.5806
 epoch: 14, train_loss: 0.5960, test_loss: 1.0789, test_f1: 0.5933
 epoch: 15, train_loss: 0.5841, test_loss: 1.3013, test_f1: 0.5739
 epoch: 16, train_loss: 0.5388, test_loss: 1.1701, test_f1: 0.6405
 epoch: 17, train_loss: 0.5620, test_loss: 1.3131, test_f1: 0.6078
 epoch: 18, train_loss: 0.5566, test_loss: 1.1392, test_f1: 0.6219
 epoch: 19, train_loss: 0.5356, test_loss: 1.3631, test_f1: 0.5748
 epoch: 20, train_loss: 0.4998, test_loss: 1.3237, test_f1: 0.5959
 epoch: 21, train_loss: 0.5251, test_loss: 1.3699, test_f1: 0.5809
 epoch: 22, train_loss: 0.4883, test_loss: 1.3222, test_f1: 0.5909
 epoch: 23, train_loss: 0.4743, test_loss: 1.7248, test_f1: 0.5854
 epoch: 24, train_loss: 0.4564, test_loss: 1.5807, test_f1: 0.5572
 epoch: 25, train_loss: 0.4220, test_loss: 1.4097, test_f1: 0.5996
 epoch: 26, train_loss: 0.4774, test_loss: 1.4717, test_f1: 0.5699
 epoch: 27, train_loss: 0.4559, test_loss: 1.6360, test_f1: 0.5687
 epoch: 28, train_loss: 0.4148, test_loss: 1.4845, test_f1: 0.6349
 epoch: 29, train_loss: 0.3852, test_loss: 1.3802, test_f1: 0.6086
 epoch: 30, train_loss: 0.3595, test_loss: 1.6074, test_f1: 0.5853
 epoch: 31, train_loss: 0.3880, test_loss: 1.6464, test_f1: 0.5477
 epoch: 32, train_loss: 0.3676, test_loss: 1.6535, test_f1: 0.5838
 epoch: 33, train_loss: 0.3816, test_loss: 1.7608, test_f1: 0.5863
 epoch: 34, train_loss: 0.4184, test_loss: 1.8061, test_f1: 0.5813
 epoch: 35, train_loss: 0.3828, test_loss: 1.7253, test_f1: 0.5774
 epoch: 36, train_loss: 0.3818, test_loss: 2.0314, test_f1: 0.5622
 epoch: 37, train_loss: 0.3553, test_loss: 1.3688, test_f1: 0.6300
 epoch: 38, train_loss: 0.3177, test_loss: 1.7432, test_f1: 0.5566
 epoch: 39, train_loss: 0.3314, test_loss: 1.6133, test_f1: 0.6438
 epoch: 40, train_loss: 0.3346, test_loss: 1.9062, test_f1: 0.5767
 epoch: 41, train_loss: 0.3530, test_loss: 2.0656, test_f1: 0.5483
 epoch: 42, train_loss: 0.3207, test_loss: 2.0154, test_f1: 0.5738
 epoch: 43, train_loss: 0.2879, test_loss: 1.7922, test_f1: 0.6368
 epoch: 44, train_loss: 0.3009, test_loss: 1.7574, test_f1: 0.6165
 epoch: 45, train_loss: 0.2806, test_loss: 1.7564, test_f1: 0.6210
 epoch: 46, train_loss: 0.2768, test_loss: 2.1616, test_f1: 0.5773
 epoch: 47, train_loss: 0.2701, test_loss: 2.0658, test_f1: 0.6014
 epoch: 48, train_loss: 0.2532, test_loss: 2.0903, test_f1: 0.6121
 epoch: 49, train_loss: 0.2790, test_loss: 1.8595, test_f1: 0.6027
 epoch: 50, train_loss: 0.2927, test_loss: 2.2323, test_f1: 0.5964
 epoch: 51, train_loss: 0.2820, test_loss: 2.0133, test_f1: 0.6250
 epoch: 52, train_loss: 0.2352, test_loss: 2.0816, test_f1: 0.5982
 epoch: 53, train_loss: 0.2046, test_loss: 2.2666, test_f1: 0.6269
 epoch: 54, train_loss: 0.2023, test_loss: 2.1716, test_f1: 0.6393
 epoch: 55, train_loss: 0.2069, test_loss: 2.2549, test_f1: 0.6127
 epoch: 56, train_loss: 0.2270, test_loss: 2.1049, test_f1: 0.6272
 epoch: 57, train_loss: 0.1838, test_loss: 2.0898, test_f1: 0.6234
 epoch: 58, train_loss: 0.1867, test_loss: 2.1633, test_f1: 0.6508
 epoch: 59, train_loss: 0.1737, test_loss: 2.4372, test_f1: 0.6235
 epoch: 60, train_loss: 0.1440, test_loss: 2.3198, test_f1: 0.6451
 epoch: 61, train_loss: 0.1631, test_loss: 2.4562, test_f1: 0.6118
 epoch: 62, train_loss: 0.1440, test_loss: 2.3698, test_f1: 0.6345
 epoch: 63, train_loss: 0.1653, test_loss: 2.2712, test_f1: 0.6307
 epoch: 64, train_loss: 0.1457, test_loss: 2.4966, test_f1: 0.6205
 epoch: 65, train_loss: 0.1658, test_loss: 2.5923, test_f1: 0.6186
 epoch: 66, train_loss: 0.2116, test_loss: 2.4999, test_f1: 0.6265
 epoch: 67, train_loss: 0.1830, test_loss: 2.3594, test_f1: 0.6127
 epoch: 68, train_loss: 0.1486, test_loss: 2.4383, test_f1: 0.6009
 epoch: 69, train_loss: 0.1577, test_loss: 2.5362, test_f1: 0.6069
 epoch: 70, train_loss: 0.1450, test_loss: 2.4530, test_f1: 0.6113
 epoch: 71, train_loss: 0.1405, test_loss: 2.4847, test_f1: 0.6065
 epoch: 72, train_loss: 0.1184, test_loss: 2.6690, test_f1: 0.6169
 epoch: 73, train_loss: 0.1345, test_loss: 2.6156, test_f1: 0.6235
 epoch: 74, train_loss: 0.1326, test_loss: 2.5556, test_f1: 0.6488
 epoch: 75, train_loss: 0.1359, test_loss: 2.6782, test_f1: 0.6045
 epoch: 76, train_loss: 0.1164, test_loss: 2.7298, test_f1: 0.6096
 epoch: 77, train_loss: 0.1044, test_loss: 2.6716, test_f1: 0.6424
 epoch: 78, train_loss: 0.1286, test_loss: 2.6852, test_f1: 0.6168
 epoch: 79, train_loss: 0.1197, test_loss: 2.5575, test_f1: 0.6389
 epoch: 80, train_loss: 0.1037, test_loss: 2.8038, test_f1: 0.6321
 epoch: 81, train_loss: 0.1079, test_loss: 2.8833, test_f1: 0.6194
 epoch: 82, train_loss: 0.1201, test_loss: 2.8869, test_f1: 0.6312
 epoch: 83, train_loss: 0.1184, test_loss: 2.8468, test_f1: 0.6465
 epoch: 84, train_loss: 0.1049, test_loss: 2.8568, test_f1: 0.6067
 epoch: 85, train_loss: 0.1219, test_loss: 2.9204, test_f1: 0.6122
 epoch: 86, train_loss: 0.1055, test_loss: 2.9982, test_f1: 0.6138
 epoch: 87, train_loss: 0.1014, test_loss: 2.7755, test_f1: 0.6282
 epoch: 88, train_loss: 0.0907, test_loss: 2.9016, test_f1: 0.6248
 epoch: 89, train_loss: 0.1198, test_loss: 2.7845, test_f1: 0.6269
 epoch: 90, train_loss: 0.1409, test_loss: 2.9959, test_f1: 0.6277
 epoch: 91, train_loss: 0.1563, test_loss: 3.0991, test_f1: 0.6185
 epoch: 92, train_loss: 0.1321, test_loss: 2.7864, test_f1: 0.6231
 epoch: 93, train_loss: 0.1335, test_loss: 2.8174, test_f1: 0.6141
 epoch: 94, train_loss: 0.1091, test_loss: 2.7910, test_f1: 0.6284
 epoch: 95, train_loss: 0.1124, test_loss: 3.0528, test_f1: 0.6117
 epoch: 96, train_loss: 0.1153, test_loss: 3.0560, test_f1: 0.5998
 epoch: 97, train_loss: 0.1056, test_loss: 2.9826, test_f1: 0.6241
 epoch: 98, train_loss: 0.1160, test_loss: 2.8308, test_f1: 0.6275
 epoch: 99, train_loss: 0.1295, test_loss: 2.8650, test_f1: 0.6132
##################ITERATION #6 ****************************************
 epoch: 0, train_loss: 1.2612, test_loss: 1.3955, test_f1: 0.2630
 epoch: 1, train_loss: 0.9989, test_loss: 1.3246, test_f1: 0.2315
 epoch: 2, train_loss: 0.9402, test_loss: 1.2184, test_f1: 0.3277
 epoch: 3, train_loss: 0.8778, test_loss: 1.0788, test_f1: 0.5402
 epoch: 4, train_loss: 0.8627, test_loss: 1.1062, test_f1: 0.5060
 epoch: 5, train_loss: 0.8166, test_loss: 1.0546, test_f1: 0.5296
 epoch: 6, train_loss: 0.7575, test_loss: 1.0480, test_f1: 0.5605
 epoch: 7, train_loss: 0.7228, test_loss: 1.0573, test_f1: 0.5573
 epoch: 8, train_loss: 0.7113, test_loss: 1.1108, test_f1: 0.5313
 epoch: 9, train_loss: 0.6943, test_loss: 1.0898, test_f1: 0.5694
 epoch: 10, train_loss: 0.6783, test_loss: 1.0331, test_f1: 0.5989
 epoch: 11, train_loss: 0.6613, test_loss: 1.0859, test_f1: 0.5713
 epoch: 12, train_loss: 0.6318, test_loss: 1.0730, test_f1: 0.5874
 epoch: 13, train_loss: 0.6157, test_loss: 1.2160, test_f1: 0.5248
 epoch: 14, train_loss: 0.6799, test_loss: 1.3940, test_f1: 0.5816
 epoch: 15, train_loss: 0.6345, test_loss: 1.2873, test_f1: 0.5966
 epoch: 16, train_loss: 0.5979, test_loss: 1.1054, test_f1: 0.5486
 epoch: 17, train_loss: 0.5683, test_loss: 1.1026, test_f1: 0.6004
 epoch: 18, train_loss: 0.5521, test_loss: 1.4080, test_f1: 0.5601
 epoch: 19, train_loss: 0.5401, test_loss: 1.1851, test_f1: 0.6374
 epoch: 20, train_loss: 0.5394, test_loss: 1.0977, test_f1: 0.5863
 epoch: 21, train_loss: 0.5112, test_loss: 1.3453, test_f1: 0.6254
 epoch: 22, train_loss: 0.5036, test_loss: 1.3643, test_f1: 0.5628
 epoch: 23, train_loss: 0.4825, test_loss: 1.2105, test_f1: 0.5629
 epoch: 24, train_loss: 0.4412, test_loss: 1.1422, test_f1: 0.6082
 epoch: 25, train_loss: 0.4337, test_loss: 1.3611, test_f1: 0.5940
 epoch: 26, train_loss: 0.4348, test_loss: 1.1743, test_f1: 0.6253
 epoch: 27, train_loss: 0.4380, test_loss: 1.2920, test_f1: 0.6227
 epoch: 28, train_loss: 0.4731, test_loss: 1.5153, test_f1: 0.5522
 epoch: 29, train_loss: 0.4285, test_loss: 1.3603, test_f1: 0.6190
 epoch: 30, train_loss: 0.4174, test_loss: 1.3400, test_f1: 0.6014
 epoch: 31, train_loss: 0.4025, test_loss: 1.6930, test_f1: 0.5456
 epoch: 32, train_loss: 0.3872, test_loss: 1.2785, test_f1: 0.6403
 epoch: 33, train_loss: 0.4339, test_loss: 1.6211, test_f1: 0.5617
 epoch: 34, train_loss: 0.4402, test_loss: 1.3042, test_f1: 0.5987
 epoch: 35, train_loss: 0.3778, test_loss: 1.4492, test_f1: 0.5716
 epoch: 36, train_loss: 0.3653, test_loss: 1.5670, test_f1: 0.5522
 epoch: 37, train_loss: 0.3610, test_loss: 1.6074, test_f1: 0.5885
 epoch: 38, train_loss: 0.3605, test_loss: 1.6633, test_f1: 0.6389
 epoch: 39, train_loss: 0.3484, test_loss: 1.5247, test_f1: 0.6461
 epoch: 40, train_loss: 0.3335, test_loss: 1.6523, test_f1: 0.6083
 epoch: 41, train_loss: 0.3249, test_loss: 1.3312, test_f1: 0.6771
 epoch: 42, train_loss: 0.2771, test_loss: 1.8707, test_f1: 0.5974
 epoch: 43, train_loss: 0.3207, test_loss: 1.7793, test_f1: 0.6213
 epoch: 44, train_loss: 0.3050, test_loss: 1.5729, test_f1: 0.6125
 epoch: 45, train_loss: 0.3510, test_loss: 2.0157, test_f1: 0.6076
 epoch: 46, train_loss: 0.3179, test_loss: 1.4880, test_f1: 0.6346
 epoch: 47, train_loss: 0.3076, test_loss: 1.6537, test_f1: 0.5917
 epoch: 48, train_loss: 0.2615, test_loss: 1.7910, test_f1: 0.6308
 epoch: 49, train_loss: 0.2539, test_loss: 1.7447, test_f1: 0.6203
 epoch: 50, train_loss: 0.2793, test_loss: 1.6371, test_f1: 0.6304
 epoch: 51, train_loss: 0.2635, test_loss: 1.7606, test_f1: 0.6391
 epoch: 52, train_loss: 0.1997, test_loss: 1.7160, test_f1: 0.6059
 epoch: 53, train_loss: 0.1910, test_loss: 1.7312, test_f1: 0.6200
 epoch: 54, train_loss: 0.1665, test_loss: 1.7163, test_f1: 0.6252
 epoch: 55, train_loss: 0.1790, test_loss: 1.8649, test_f1: 0.6124
 epoch: 56, train_loss: 0.1742, test_loss: 1.9665, test_f1: 0.6239
 epoch: 57, train_loss: 0.1780, test_loss: 1.8733, test_f1: 0.6198
 epoch: 58, train_loss: 0.1729, test_loss: 1.9296, test_f1: 0.6441
 epoch: 59, train_loss: 0.1549, test_loss: 1.8381, test_f1: 0.6220
 epoch: 60, train_loss: 0.1542, test_loss: 1.8431, test_f1: 0.6387
 epoch: 61, train_loss: 0.1396, test_loss: 1.9095, test_f1: 0.6455
 epoch: 62, train_loss: 0.1595, test_loss: 2.0549, test_f1: 0.6145
 epoch: 63, train_loss: 0.1602, test_loss: 1.8739, test_f1: 0.6374
 epoch: 64, train_loss: 0.1691, test_loss: 1.7997, test_f1: 0.6195
 epoch: 65, train_loss: 0.1511, test_loss: 1.9519, test_f1: 0.6074
 epoch: 66, train_loss: 0.1377, test_loss: 2.0223, test_f1: 0.6285
 epoch: 67, train_loss: 0.1406, test_loss: 2.0988, test_f1: 0.6365
 epoch: 68, train_loss: 0.1312, test_loss: 2.0909, test_f1: 0.6281
 epoch: 69, train_loss: 0.1222, test_loss: 2.1990, test_f1: 0.6384
 epoch: 70, train_loss: 0.1318, test_loss: 2.1281, test_f1: 0.6272
 epoch: 71, train_loss: 0.1253, test_loss: 2.0267, test_f1: 0.6287
 epoch: 72, train_loss: 0.1487, test_loss: 2.0978, test_f1: 0.6405
 epoch: 73, train_loss: 0.1729, test_loss: 2.0437, test_f1: 0.6086
 epoch: 74, train_loss: 0.1415, test_loss: 2.0510, test_f1: 0.6363
 epoch: 75, train_loss: 0.1616, test_loss: 2.2301, test_f1: 0.6036
 epoch: 76, train_loss: 0.1548, test_loss: 2.1524, test_f1: 0.6092
 epoch: 77, train_loss: 0.1450, test_loss: 2.0864, test_f1: 0.6313
 epoch: 78, train_loss: 0.1226, test_loss: 2.2259, test_f1: 0.6405
 epoch: 79, train_loss: 0.1148, test_loss: 2.2221, test_f1: 0.6001
 epoch: 80, train_loss: 0.1187, test_loss: 2.0807, test_f1: 0.6286
 epoch: 81, train_loss: 0.1150, test_loss: 2.0619, test_f1: 0.6360
 epoch: 82, train_loss: 0.1055, test_loss: 2.3516, test_f1: 0.5955
 epoch: 83, train_loss: 0.1250, test_loss: 2.1994, test_f1: 0.6095
 epoch: 84, train_loss: 0.1186, test_loss: 2.2681, test_f1: 0.6147
 epoch: 85, train_loss: 0.1168, test_loss: 2.1508, test_f1: 0.6285
 epoch: 86, train_loss: 0.1062, test_loss: 2.3343, test_f1: 0.6305
 epoch: 87, train_loss: 0.1104, test_loss: 2.3541, test_f1: 0.6090
 epoch: 88, train_loss: 0.1028, test_loss: 2.3869, test_f1: 0.6156
 epoch: 89, train_loss: 0.1193, test_loss: 2.3741, test_f1: 0.6302
 epoch: 90, train_loss: 0.1056, test_loss: 2.4602, test_f1: 0.6162
 epoch: 91, train_loss: 0.1024, test_loss: 2.3509, test_f1: 0.6249
 epoch: 92, train_loss: 0.0785, test_loss: 2.2268, test_f1: 0.6486
 epoch: 93, train_loss: 0.0891, test_loss: 2.2918, test_f1: 0.6169
 epoch: 94, train_loss: 0.1000, test_loss: 2.4716, test_f1: 0.6160
 epoch: 95, train_loss: 0.1271, test_loss: 2.4688, test_f1: 0.6068
 epoch: 96, train_loss: 0.1182, test_loss: 2.6366, test_f1: 0.6183
 epoch: 97, train_loss: 0.1035, test_loss: 2.5004, test_f1: 0.5940
 epoch: 98, train_loss: 0.0910, test_loss: 2.6231, test_f1: 0.6122
 epoch: 99, train_loss: 0.0929, test_loss: 2.5575, test_f1: 0.6206
##################ITERATION #7 ****************************************
 epoch: 0, train_loss: 1.3797, test_loss: 1.5836, test_f1: 0.3201
 epoch: 1, train_loss: 1.0581, test_loss: 1.3040, test_f1: 0.2696
 epoch: 2, train_loss: 0.9824, test_loss: 1.2419, test_f1: 0.4207
 epoch: 3, train_loss: 0.9010, test_loss: 1.1832, test_f1: 0.5061
 epoch: 4, train_loss: 0.8263, test_loss: 1.0663, test_f1: 0.5752
 epoch: 5, train_loss: 0.7994, test_loss: 1.0283, test_f1: 0.5379
 epoch: 6, train_loss: 0.7620, test_loss: 0.9610, test_f1: 0.5913
 epoch: 7, train_loss: 0.7372, test_loss: 0.9126, test_f1: 0.6186
 epoch: 8, train_loss: 0.6839, test_loss: 0.9749, test_f1: 0.5915
 epoch: 9, train_loss: 0.6853, test_loss: 1.0069, test_f1: 0.5986
 epoch: 10, train_loss: 0.6726, test_loss: 1.0596, test_f1: 0.6299
 epoch: 11, train_loss: 0.6451, test_loss: 1.0586, test_f1: 0.5964
 epoch: 12, train_loss: 0.6364, test_loss: 1.0656, test_f1: 0.6067
 epoch: 13, train_loss: 0.6137, test_loss: 1.1292, test_f1: 0.5889
 epoch: 14, train_loss: 0.5964, test_loss: 1.1182, test_f1: 0.5833
 epoch: 15, train_loss: 0.5735, test_loss: 1.0754, test_f1: 0.5939
 epoch: 16, train_loss: 0.5608, test_loss: 1.0847, test_f1: 0.6139
 epoch: 17, train_loss: 0.5507, test_loss: 1.2164, test_f1: 0.5249
 epoch: 18, train_loss: 0.5688, test_loss: 1.1180, test_f1: 0.5770
 epoch: 19, train_loss: 0.5221, test_loss: 1.3607, test_f1: 0.5530
 epoch: 20, train_loss: 0.5029, test_loss: 1.1827, test_f1: 0.5919
 epoch: 21, train_loss: 0.4964, test_loss: 1.5091, test_f1: 0.5773
 epoch: 22, train_loss: 0.4865, test_loss: 1.2618, test_f1: 0.5850
 epoch: 23, train_loss: 0.5035, test_loss: 1.1242, test_f1: 0.6042
 epoch: 24, train_loss: 0.4904, test_loss: 1.1071, test_f1: 0.5702
 epoch: 25, train_loss: 0.4892, test_loss: 1.0220, test_f1: 0.6453
 epoch: 26, train_loss: 0.4430, test_loss: 1.2568, test_f1: 0.6037
 epoch: 27, train_loss: 0.4798, test_loss: 1.0888, test_f1: 0.5970
 epoch: 28, train_loss: 0.4485, test_loss: 1.6421, test_f1: 0.5189
 epoch: 29, train_loss: 0.4280, test_loss: 1.1510, test_f1: 0.6341
 epoch: 30, train_loss: 0.4235, test_loss: 1.2365, test_f1: 0.6031
 epoch: 31, train_loss: 0.4125, test_loss: 1.5211, test_f1: 0.5596
 epoch: 32, train_loss: 0.3802, test_loss: 1.2056, test_f1: 0.6083
 epoch: 33, train_loss: 0.3666, test_loss: 1.1440, test_f1: 0.6116
 epoch: 34, train_loss: 0.3642, test_loss: 1.1679, test_f1: 0.6443
 epoch: 35, train_loss: 0.4035, test_loss: 1.9075, test_f1: 0.5055
 epoch: 36, train_loss: 0.3589, test_loss: 1.1029, test_f1: 0.6467
 epoch: 37, train_loss: 0.3548, test_loss: 1.3197, test_f1: 0.5821
 epoch: 38, train_loss: 0.3591, test_loss: 1.4808, test_f1: 0.5777
 epoch: 39, train_loss: 0.3622, test_loss: 1.4771, test_f1: 0.6031
 epoch: 40, train_loss: 0.3582, test_loss: 1.6375, test_f1: 0.5576
 epoch: 41, train_loss: 0.3334, test_loss: 1.5542, test_f1: 0.6338
 epoch: 42, train_loss: 0.3302, test_loss: 1.4967, test_f1: 0.6223
 epoch: 43, train_loss: 0.3561, test_loss: 1.1638, test_f1: 0.6307
 epoch: 44, train_loss: 0.3942, test_loss: 1.8493, test_f1: 0.5535
 epoch: 45, train_loss: 0.3385, test_loss: 1.3490, test_f1: 0.6073
 epoch: 46, train_loss: 0.3055, test_loss: 1.4415, test_f1: 0.6221
 epoch: 47, train_loss: 0.3202, test_loss: 1.5154, test_f1: 0.6247
 epoch: 48, train_loss: 0.3141, test_loss: 1.4819, test_f1: 0.6004
 epoch: 49, train_loss: 0.2734, test_loss: 1.5136, test_f1: 0.6183
 epoch: 50, train_loss: 0.2872, test_loss: 1.4953, test_f1: 0.6129
 epoch: 51, train_loss: 0.2573, test_loss: 1.7088, test_f1: 0.6610
 epoch: 52, train_loss: 0.2243, test_loss: 1.7411, test_f1: 0.6065
 epoch: 53, train_loss: 0.2215, test_loss: 1.7983, test_f1: 0.6095
 epoch: 54, train_loss: 0.2140, test_loss: 1.6640, test_f1: 0.6166
 epoch: 55, train_loss: 0.2098, test_loss: 1.8445, test_f1: 0.6271
 epoch: 56, train_loss: 0.2260, test_loss: 1.8077, test_f1: 0.6302
 epoch: 57, train_loss: 0.2026, test_loss: 1.6088, test_f1: 0.6451
 epoch: 58, train_loss: 0.2393, test_loss: 1.8072, test_f1: 0.6639
 epoch: 59, train_loss: 0.2035, test_loss: 1.8401, test_f1: 0.6116
 epoch: 60, train_loss: 0.1867, test_loss: 2.1507, test_f1: 0.6005
 epoch: 61, train_loss: 0.2001, test_loss: 2.1419, test_f1: 0.5607
 epoch: 62, train_loss: 0.1777, test_loss: 2.1035, test_f1: 0.6235
 epoch: 63, train_loss: 0.1794, test_loss: 2.2491, test_f1: 0.6228
 epoch: 64, train_loss: 0.2158, test_loss: 2.0986, test_f1: 0.5999
 epoch: 65, train_loss: 0.1961, test_loss: 1.6329, test_f1: 0.6515
 epoch: 66, train_loss: 0.1937, test_loss: 2.0683, test_f1: 0.6219
 epoch: 67, train_loss: 0.1841, test_loss: 2.0918, test_f1: 0.6108
 epoch: 68, train_loss: 0.1917, test_loss: 2.0275, test_f1: 0.5989
 epoch: 69, train_loss: 0.1630, test_loss: 1.9604, test_f1: 0.6267
 epoch: 70, train_loss: 0.1659, test_loss: 1.9840, test_f1: 0.6340
 epoch: 71, train_loss: 0.1350, test_loss: 2.0334, test_f1: 0.6062
 epoch: 72, train_loss: 0.1729, test_loss: 2.0994, test_f1: 0.6122
 epoch: 73, train_loss: 0.1604, test_loss: 2.0111, test_f1: 0.6293
 epoch: 74, train_loss: 0.1446, test_loss: 2.0026, test_f1: 0.6466
 epoch: 75, train_loss: 0.1485, test_loss: 2.1897, test_f1: 0.5821
 epoch: 76, train_loss: 0.1406, test_loss: 2.2193, test_f1: 0.6151
 epoch: 77, train_loss: 0.1627, test_loss: 2.1494, test_f1: 0.5934
 epoch: 78, train_loss: 0.1652, test_loss: 2.1524, test_f1: 0.6117
 epoch: 79, train_loss: 0.1407, test_loss: 1.9948, test_f1: 0.6464
 epoch: 80, train_loss: 0.1454, test_loss: 2.3032, test_f1: 0.6066
 epoch: 81, train_loss: 0.1347, test_loss: 2.4603, test_f1: 0.6063
 epoch: 82, train_loss: 0.1449, test_loss: 2.4046, test_f1: 0.6147
 epoch: 83, train_loss: 0.1594, test_loss: 2.4362, test_f1: 0.6018
 epoch: 84, train_loss: 0.1782, test_loss: 2.4802, test_f1: 0.5945
 epoch: 85, train_loss: 0.1721, test_loss: 2.2098, test_f1: 0.5594
 epoch: 86, train_loss: 0.1762, test_loss: 1.9760, test_f1: 0.5994
 epoch: 87, train_loss: 0.1535, test_loss: 2.3942, test_f1: 0.5749
 epoch: 88, train_loss: 0.1505, test_loss: 2.3959, test_f1: 0.5857
 epoch: 89, train_loss: 0.1432, test_loss: 2.4479, test_f1: 0.5930
 epoch: 90, train_loss: 0.1316, test_loss: 2.3287, test_f1: 0.5936
 epoch: 91, train_loss: 0.1319, test_loss: 2.0492, test_f1: 0.6334
 epoch: 92, train_loss: 0.1296, test_loss: 2.3836, test_f1: 0.5935
 epoch: 93, train_loss: 0.1181, test_loss: 2.4340, test_f1: 0.5946
 epoch: 94, train_loss: 0.1217, test_loss: 2.3356, test_f1: 0.5970
 epoch: 95, train_loss: 0.1434, test_loss: 2.2862, test_f1: 0.6289
 epoch: 96, train_loss: 0.1606, test_loss: 2.2291, test_f1: 0.6332
 epoch: 97, train_loss: 0.1409, test_loss: 2.3037, test_f1: 0.5886
 epoch: 98, train_loss: 0.1286, test_loss: 2.2767, test_f1: 0.6187
 epoch: 99, train_loss: 0.1298, test_loss: 2.5442, test_f1: 0.5864
##################ITERATION #8 ****************************************
 epoch: 0, train_loss: 1.4344, test_loss: 1.4446, test_f1: 0.2208
 epoch: 1, train_loss: 1.0656, test_loss: 1.3537, test_f1: 0.2298
 epoch: 2, train_loss: 0.9454, test_loss: 1.1910, test_f1: 0.4196
 epoch: 3, train_loss: 0.8814, test_loss: 1.1651, test_f1: 0.3778
 epoch: 4, train_loss: 0.8277, test_loss: 1.0269, test_f1: 0.5543
 epoch: 5, train_loss: 0.8238, test_loss: 1.0233, test_f1: 0.5779
 epoch: 6, train_loss: 0.7662, test_loss: 0.9901, test_f1: 0.6248
 epoch: 7, train_loss: 0.7666, test_loss: 1.0386, test_f1: 0.5631
 epoch: 8, train_loss: 0.7412, test_loss: 0.9925, test_f1: 0.5904
 epoch: 9, train_loss: 0.7133, test_loss: 1.0350, test_f1: 0.5396
 epoch: 10, train_loss: 0.7046, test_loss: 1.0027, test_f1: 0.5797
 epoch: 11, train_loss: 0.6883, test_loss: 1.0914, test_f1: 0.5295
 epoch: 12, train_loss: 0.6524, test_loss: 1.1807, test_f1: 0.5208
 epoch: 13, train_loss: 0.6428, test_loss: 1.0798, test_f1: 0.5320
 epoch: 14, train_loss: 0.6341, test_loss: 1.0216, test_f1: 0.5575
 epoch: 15, train_loss: 0.6343, test_loss: 1.1054, test_f1: 0.5620
 epoch: 16, train_loss: 0.5853, test_loss: 1.0891, test_f1: 0.5738
 epoch: 17, train_loss: 0.5746, test_loss: 1.1719, test_f1: 0.5773
 epoch: 18, train_loss: 0.5670, test_loss: 1.1998, test_f1: 0.5221
 epoch: 19, train_loss: 0.5549, test_loss: 1.1570, test_f1: 0.6063
 epoch: 20, train_loss: 0.5685, test_loss: 1.3725, test_f1: 0.5052
 epoch: 21, train_loss: 0.5253, test_loss: 1.2061, test_f1: 0.5611
 epoch: 22, train_loss: 0.5475, test_loss: 1.2436, test_f1: 0.5673
 epoch: 23, train_loss: 0.5373, test_loss: 1.1407, test_f1: 0.5974
 epoch: 24, train_loss: 0.5048, test_loss: 1.3620, test_f1: 0.5332
 epoch: 25, train_loss: 0.5035, test_loss: 1.4632, test_f1: 0.5642
 epoch: 26, train_loss: 0.4867, test_loss: 1.1976, test_f1: 0.5916
 epoch: 27, train_loss: 0.4523, test_loss: 1.4033, test_f1: 0.5610
 epoch: 28, train_loss: 0.4594, test_loss: 1.2409, test_f1: 0.6075
 epoch: 29, train_loss: 0.4086, test_loss: 1.1568, test_f1: 0.6109
 epoch: 30, train_loss: 0.4142, test_loss: 1.3030, test_f1: 0.6116
 epoch: 31, train_loss: 0.4447, test_loss: 1.2563, test_f1: 0.6037
 epoch: 32, train_loss: 0.4296, test_loss: 1.1382, test_f1: 0.6147
 epoch: 33, train_loss: 0.4198, test_loss: 1.1767, test_f1: 0.6494
 epoch: 34, train_loss: 0.4321, test_loss: 1.3091, test_f1: 0.6046
 epoch: 35, train_loss: 0.4372, test_loss: 1.2436, test_f1: 0.6114
 epoch: 36, train_loss: 0.4466, test_loss: 1.3540, test_f1: 0.6247
 epoch: 37, train_loss: 0.3831, test_loss: 1.4928, test_f1: 0.5722
 epoch: 38, train_loss: 0.3631, test_loss: 1.4041, test_f1: 0.5876
 epoch: 39, train_loss: 0.3699, test_loss: 1.5017, test_f1: 0.5918
 epoch: 40, train_loss: 0.3653, test_loss: 1.4916, test_f1: 0.5937
 epoch: 41, train_loss: 0.4038, test_loss: 1.3349, test_f1: 0.6062
 epoch: 42, train_loss: 0.3886, test_loss: 1.2493, test_f1: 0.6614
 epoch: 43, train_loss: 0.3715, test_loss: 1.4685, test_f1: 0.5774
 epoch: 44, train_loss: 0.3451, test_loss: 1.3153, test_f1: 0.6404
 epoch: 45, train_loss: 0.3586, test_loss: 1.4024, test_f1: 0.6454
 epoch: 46, train_loss: 0.3540, test_loss: 1.5129, test_f1: 0.5949
 epoch: 47, train_loss: 0.3445, test_loss: 1.3869, test_f1: 0.6035
 epoch: 48, train_loss: 0.3065, test_loss: 1.3439, test_f1: 0.6050
 epoch: 49, train_loss: 0.2996, test_loss: 1.6725, test_f1: 0.6076
 epoch: 50, train_loss: 0.3299, test_loss: 1.6877, test_f1: 0.6048
 epoch: 51, train_loss: 0.2886, test_loss: 1.5205, test_f1: 0.6038
 epoch: 52, train_loss: 0.2405, test_loss: 1.6655, test_f1: 0.5870
 epoch: 53, train_loss: 0.2294, test_loss: 1.6526, test_f1: 0.6023
 epoch: 54, train_loss: 0.2338, test_loss: 1.6983, test_f1: 0.6021
 epoch: 55, train_loss: 0.2115, test_loss: 1.6143, test_f1: 0.6105
 epoch: 56, train_loss: 0.2183, test_loss: 1.7702, test_f1: 0.6068
 epoch: 57, train_loss: 0.1901, test_loss: 1.8062, test_f1: 0.6119
 epoch: 58, train_loss: 0.1830, test_loss: 1.9171, test_f1: 0.6173
 epoch: 59, train_loss: 0.1882, test_loss: 1.8504, test_f1: 0.6187
 epoch: 60, train_loss: 0.1977, test_loss: 1.7842, test_f1: 0.6197
 epoch: 61, train_loss: 0.2102, test_loss: 1.6651, test_f1: 0.6334
 epoch: 62, train_loss: 0.1904, test_loss: 1.7704, test_f1: 0.6279
 epoch: 63, train_loss: 0.1805, test_loss: 2.0229, test_f1: 0.5835
 epoch: 64, train_loss: 0.1883, test_loss: 1.7488, test_f1: 0.6149
 epoch: 65, train_loss: 0.1950, test_loss: 2.0087, test_f1: 0.5962
 epoch: 66, train_loss: 0.1665, test_loss: 1.8592, test_f1: 0.6416
 epoch: 67, train_loss: 0.1951, test_loss: 1.9430, test_f1: 0.6200
 epoch: 68, train_loss: 0.1827, test_loss: 1.9691, test_f1: 0.5994
 epoch: 69, train_loss: 0.1938, test_loss: 2.0875, test_f1: 0.5996
 epoch: 70, train_loss: 0.1678, test_loss: 1.9070, test_f1: 0.6062
 epoch: 71, train_loss: 0.1722, test_loss: 1.9765, test_f1: 0.6050
 epoch: 72, train_loss: 0.1692, test_loss: 2.0159, test_f1: 0.6134
 epoch: 73, train_loss: 0.1571, test_loss: 1.9324, test_f1: 0.6229
 epoch: 74, train_loss: 0.1610, test_loss: 1.9178, test_f1: 0.6405
 epoch: 75, train_loss: 0.1596, test_loss: 1.9702, test_f1: 0.6284
 epoch: 76, train_loss: 0.1422, test_loss: 2.0867, test_f1: 0.6071
 epoch: 77, train_loss: 0.1337, test_loss: 2.1377, test_f1: 0.6194
 epoch: 78, train_loss: 0.1366, test_loss: 2.1847, test_f1: 0.6113
 epoch: 79, train_loss: 0.1344, test_loss: 1.9606, test_f1: 0.6422
 epoch: 80, train_loss: 0.1386, test_loss: 1.9363, test_f1: 0.6467
 epoch: 81, train_loss: 0.1270, test_loss: 2.0620, test_f1: 0.6524
 epoch: 82, train_loss: 0.1355, test_loss: 2.1182, test_f1: 0.6333
 epoch: 83, train_loss: 0.1373, test_loss: 2.0510, test_f1: 0.6393
 epoch: 84, train_loss: 0.1206, test_loss: 2.1495, test_f1: 0.6231
 epoch: 85, train_loss: 0.1195, test_loss: 2.1974, test_f1: 0.6567
 epoch: 86, train_loss: 0.1177, test_loss: 2.2812, test_f1: 0.6221
 epoch: 87, train_loss: 0.1180, test_loss: 2.2645, test_f1: 0.6237
 epoch: 88, train_loss: 0.1394, test_loss: 2.3340, test_f1: 0.6220
 epoch: 89, train_loss: 0.1518, test_loss: 2.3145, test_f1: 0.6086
 epoch: 90, train_loss: 0.1688, test_loss: 2.4858, test_f1: 0.6150
 epoch: 91, train_loss: 0.1337, test_loss: 2.2672, test_f1: 0.6163
 epoch: 92, train_loss: 0.1324, test_loss: 2.2598, test_f1: 0.6505
 epoch: 93, train_loss: 0.1363, test_loss: 2.4686, test_f1: 0.6087
 epoch: 94, train_loss: 0.1373, test_loss: 2.3276, test_f1: 0.6284
 epoch: 95, train_loss: 0.1309, test_loss: 2.4071, test_f1: 0.6082
 epoch: 96, train_loss: 0.1330, test_loss: 2.6135, test_f1: 0.5641
 epoch: 97, train_loss: 0.1136, test_loss: 2.1880, test_f1: 0.6347
 epoch: 98, train_loss: 0.1032, test_loss: 2.3424, test_f1: 0.6221
 epoch: 99, train_loss: 0.1053, test_loss: 2.2524, test_f1: 0.6391
##################ITERATION #9 ****************************************
 epoch: 0, train_loss: 1.4203, test_loss: 1.5952, test_f1: 0.1662
 epoch: 1, train_loss: 1.0622, test_loss: 1.3833, test_f1: 0.4089
 epoch: 2, train_loss: 0.9490, test_loss: 1.2545, test_f1: 0.4709
 epoch: 3, train_loss: 0.8740, test_loss: 1.0924, test_f1: 0.5316
 epoch: 4, train_loss: 0.8131, test_loss: 1.0971, test_f1: 0.5551
 epoch: 5, train_loss: 0.7665, test_loss: 1.0599, test_f1: 0.5544
 epoch: 6, train_loss: 0.7616, test_loss: 1.0405, test_f1: 0.5593
 epoch: 7, train_loss: 0.7283, test_loss: 1.0134, test_f1: 0.6167
 epoch: 8, train_loss: 0.7202, test_loss: 1.1030, test_f1: 0.5902
 epoch: 9, train_loss: 0.6934, test_loss: 1.0820, test_f1: 0.5750
 epoch: 10, train_loss: 0.6802, test_loss: 1.0935, test_f1: 0.4743
 epoch: 11, train_loss: 0.6389, test_loss: 1.1258, test_f1: 0.5469
 epoch: 12, train_loss: 0.6363, test_loss: 1.1341, test_f1: 0.6192
 epoch: 13, train_loss: 0.6254, test_loss: 1.1144, test_f1: 0.6161
 epoch: 14, train_loss: 0.6153, test_loss: 1.1005, test_f1: 0.6275
 epoch: 15, train_loss: 0.5952, test_loss: 1.1234, test_f1: 0.6074
 epoch: 16, train_loss: 0.5787, test_loss: 1.1796, test_f1: 0.5826
 epoch: 17, train_loss: 0.5659, test_loss: 1.1950, test_f1: 0.5887
 epoch: 18, train_loss: 0.5286, test_loss: 1.1052, test_f1: 0.6201
 epoch: 19, train_loss: 0.5421, test_loss: 1.2059, test_f1: 0.6428
 epoch: 20, train_loss: 0.5249, test_loss: 1.1007, test_f1: 0.5754
 epoch: 21, train_loss: 0.5492, test_loss: 1.0600, test_f1: 0.6106
 epoch: 22, train_loss: 0.5118, test_loss: 1.2999, test_f1: 0.5723
 epoch: 23, train_loss: 0.5002, test_loss: 1.3340, test_f1: 0.5891
 epoch: 24, train_loss: 0.4713, test_loss: 1.3800, test_f1: 0.6052
 epoch: 25, train_loss: 0.4714, test_loss: 1.4357, test_f1: 0.5680
 epoch: 26, train_loss: 0.4584, test_loss: 1.2256, test_f1: 0.6051
 epoch: 27, train_loss: 0.4601, test_loss: 1.0986, test_f1: 0.6205
 epoch: 28, train_loss: 0.4254, test_loss: 1.4272, test_f1: 0.5904
 epoch: 29, train_loss: 0.4066, test_loss: 1.3649, test_f1: 0.6456
 epoch: 30, train_loss: 0.4197, test_loss: 1.2249, test_f1: 0.6056
 epoch: 31, train_loss: 0.4102, test_loss: 1.2936, test_f1: 0.6140
 epoch: 32, train_loss: 0.3776, test_loss: 1.4130, test_f1: 0.6021
 epoch: 33, train_loss: 0.3700, test_loss: 1.4585, test_f1: 0.5916
 epoch: 34, train_loss: 0.3745, test_loss: 1.2959, test_f1: 0.6058
 epoch: 35, train_loss: 0.3767, test_loss: 1.4916, test_f1: 0.6425
 epoch: 36, train_loss: 0.3534, test_loss: 1.5618, test_f1: 0.5980
 epoch: 37, train_loss: 0.3554, test_loss: 1.3444, test_f1: 0.6507
 epoch: 38, train_loss: 0.3505, test_loss: 1.6873, test_f1: 0.5956
 epoch: 39, train_loss: 0.3612, test_loss: 1.6076, test_f1: 0.6395
 epoch: 40, train_loss: 0.3224, test_loss: 1.5917, test_f1: 0.5861
 epoch: 41, train_loss: 0.3054, test_loss: 1.4578, test_f1: 0.6383
 epoch: 42, train_loss: 0.3097, test_loss: 1.6997, test_f1: 0.6017
 epoch: 43, train_loss: 0.3351, test_loss: 1.8360, test_f1: 0.5916
 epoch: 44, train_loss: 0.3381, test_loss: 1.8021, test_f1: 0.5644
 epoch: 45, train_loss: 0.3772, test_loss: 1.8870, test_f1: 0.5790
 epoch: 46, train_loss: 0.3238, test_loss: 1.6865, test_f1: 0.6245
 epoch: 47, train_loss: 0.2991, test_loss: 1.5650, test_f1: 0.6103
 epoch: 48, train_loss: 0.2571, test_loss: 1.6695, test_f1: 0.6481
 epoch: 49, train_loss: 0.2568, test_loss: 1.9208, test_f1: 0.6026
 epoch: 50, train_loss: 0.2524, test_loss: 1.7528, test_f1: 0.6360
 epoch: 51, train_loss: 0.2618, test_loss: 1.7825, test_f1: 0.6151
 epoch: 52, train_loss: 0.2267, test_loss: 1.8778, test_f1: 0.6184
 epoch: 53, train_loss: 0.1932, test_loss: 1.9600, test_f1: 0.5863
 epoch: 54, train_loss: 0.2323, test_loss: 1.8550, test_f1: 0.5982
 epoch: 55, train_loss: 0.2032, test_loss: 1.8263, test_f1: 0.6033
 epoch: 56, train_loss: 0.1898, test_loss: 1.8869, test_f1: 0.6042
 epoch: 57, train_loss: 0.1732, test_loss: 1.9734, test_f1: 0.6432
 epoch: 58, train_loss: 0.1841, test_loss: 1.8807, test_f1: 0.6036
 epoch: 59, train_loss: 0.1569, test_loss: 1.8316, test_f1: 0.6130
 epoch: 60, train_loss: 0.1453, test_loss: 1.9597, test_f1: 0.6240
 epoch: 61, train_loss: 0.1297, test_loss: 1.9757, test_f1: 0.6066
 epoch: 62, train_loss: 0.1298, test_loss: 1.9244, test_f1: 0.6179
 epoch: 63, train_loss: 0.1675, test_loss: 2.0215, test_f1: 0.6053
 epoch: 64, train_loss: 0.1545, test_loss: 2.1081, test_f1: 0.6192
 epoch: 65, train_loss: 0.1462, test_loss: 2.1825, test_f1: 0.6167
 epoch: 66, train_loss: 0.1558, test_loss: 2.3333, test_f1: 0.5986
 epoch: 67, train_loss: 0.1616, test_loss: 2.4825, test_f1: 0.6404
 epoch: 68, train_loss: 0.1600, test_loss: 2.2853, test_f1: 0.6150
 epoch: 69, train_loss: 0.1754, test_loss: 2.2582, test_f1: 0.5959
 epoch: 70, train_loss: 0.1500, test_loss: 2.3201, test_f1: 0.6173
 epoch: 71, train_loss: 0.1507, test_loss: 2.1399, test_f1: 0.6130
 epoch: 72, train_loss: 0.1306, test_loss: 2.3388, test_f1: 0.5896
 epoch: 73, train_loss: 0.1462, test_loss: 2.3485, test_f1: 0.6282
 epoch: 74, train_loss: 0.1487, test_loss: 2.2304, test_f1: 0.6209
 epoch: 75, train_loss: 0.1642, test_loss: 2.3336, test_f1: 0.5714
 epoch: 76, train_loss: 0.1641, test_loss: 2.1763, test_f1: 0.5978
 epoch: 77, train_loss: 0.1478, test_loss: 2.0790, test_f1: 0.6036
 epoch: 78, train_loss: 0.1397, test_loss: 2.1525, test_f1: 0.6036
 epoch: 79, train_loss: 0.1306, test_loss: 2.3690, test_f1: 0.6134
 epoch: 80, train_loss: 0.1157, test_loss: 2.1944, test_f1: 0.5953
 epoch: 81, train_loss: 0.1351, test_loss: 2.3853, test_f1: 0.6267
 epoch: 82, train_loss: 0.1202, test_loss: 2.2155, test_f1: 0.6165
 epoch: 83, train_loss: 0.1420, test_loss: 2.3221, test_f1: 0.5983
 epoch: 84, train_loss: 0.1296, test_loss: 2.2734, test_f1: 0.6293
 epoch: 85, train_loss: 0.1140, test_loss: 2.3967, test_f1: 0.6018
 epoch: 86, train_loss: 0.1094, test_loss: 2.0170, test_f1: 0.6380
 epoch: 87, train_loss: 0.1275, test_loss: 2.4526, test_f1: 0.6277
 epoch: 88, train_loss: 0.0995, test_loss: 2.4761, test_f1: 0.5900
 epoch: 89, train_loss: 0.1104, test_loss: 2.5663, test_f1: 0.6189
 epoch: 90, train_loss: 0.1356, test_loss: 2.6066, test_f1: 0.5899
 epoch: 91, train_loss: 0.1671, test_loss: 2.2355, test_f1: 0.6150
 epoch: 92, train_loss: 0.1348, test_loss: 2.2616, test_f1: 0.6199
 epoch: 93, train_loss: 0.1524, test_loss: 2.1273, test_f1: 0.6094
 epoch: 94, train_loss: 0.1694, test_loss: 2.1142, test_f1: 0.6129
 epoch: 95, train_loss: 0.1422, test_loss: 2.1439, test_f1: 0.6262
 epoch: 96, train_loss: 0.1084, test_loss: 2.4002, test_f1: 0.6230
 epoch: 97, train_loss: 0.1248, test_loss: 2.3965, test_f1: 0.6162
 epoch: 98, train_loss: 0.1278, test_loss: 2.9164, test_f1: 0.6054
 epoch: 99, train_loss: 0.1150, test_loss: 2.4997, test_f1: 0.6119

Training completed in 329.98 seconds
Best F1: 0.6833 at epoch 64
Mean F1 across iterations: 0.6641  0.0103
========================FINAL RESULTS================================
FEGIN weighted F1: 0.6833  0.0103
python main.py --data ltspice_demos --representation component_pin --model FEGIN --layers 2 --hiddens 128 --batch_size 128 --lr 0.001 --emb_size 250 --epochs 100 --save_appendix component_pin_L2_H128_BS128_LR0.001_E250 --no_val
-----



STDERR:
  File "main.py", line 370, in <module>
    main()
  File "main.py", line 254, in main
    dataset = dataset_class(
  File "/home/philip/projects/ltspice_examples_code_repo/Circuit-Completion-Using-GNNs/component_classification_with_link_prediction_head/evaluation/FEGIN/kernel/circuit_datasets.py", line 15, in __init__
    self.data, self.slices = torch.load(self.processed_paths[0])
  File "/home/philip/.local/lib/python3.8/site-packages/torch/serialization.py", line 1040, in load
    warnings.warn(
  File "/usr/lib/python3.8/warnings.py", line 109, in _showwarnmsg
    sw(msg.message, msg.category, msg.filename, msg.lineno,
  File "main.py", line 47, in warn_with_traceback
    traceback.print_stack(file=log)
/home/philip/projects/ltspice_examples_code_repo/Circuit-Completion-Using-GNNs/component_classification_with_link_prediction_head/evaluation/FEGIN/kernel/circuit_datasets.py:15: FutureWarning: You are using `torch.load` with `weights_only=False` (the current default value), which uses the default pickle module implicitly. It is possible to construct malicious pickle data which will execute arbitrary code during unpickling (See https://github.com/pytorch/pytorch/blob/main/SECURITY.md#untrusted-models for more details). In a future release, the default value for `weights_only` will be flipped to `True`. This limits the functions that could be executed during unpickling. Arbitrary objects will no longer be allowed to be loaded via this mode unless they are explicitly allowlisted by the user via `torch.serialization.add_safe_globals`. We recommend you start setting `weights_only=True` for any use case where you don't have full control of the loaded file. Please open an issue on GitHub for any issues related to this experimental feature.
  self.data, self.slices = torch.load(self.processed_paths[0])
