STDOUT:
Results will be saved in /home/philip/projects/ltspice_examples_code_repo/Circuit-Completion-Using-GNNs/component_classification_with_link_prediction_head/evaluation/FEGIN/results/model_FEGIN_dataset_ltspice_demos
Command line input: python main.py --data ltspice_demos --representation component_pin_net --model FEGIN --layers 3 --hiddens 128 --batch_size 32 --lr 0.0001 --emb_size 128 --epochs 100 --save_appendix component_pin_net_L3_H128_BS32_LR0.0001_E128 --no_val
 is saved.
-----
ltspice_demos - FEGIN
Using 3 layers, 128 hidden units, h = 2
Loading component_pin_net representation dataset
ENTERED
Training FEGIN on component_pin_net representation
Train: 1565, Test: 383
##################ITERATION #0 ****************************************
 epoch: 0, train_loss: 1.3644, test_loss: 1.3552, test_f1: 0.1425
 epoch: 1, train_loss: 1.2737, test_loss: 1.2659, test_f1: 0.3381
 epoch: 2, train_loss: 1.1895, test_loss: 1.2237, test_f1: 0.3530
 epoch: 3, train_loss: 1.1458, test_loss: 1.2059, test_f1: 0.4354
 epoch: 4, train_loss: 1.1236, test_loss: 1.1973, test_f1: 0.4328
 epoch: 5, train_loss: 1.1055, test_loss: 1.1905, test_f1: 0.4374
 epoch: 6, train_loss: 1.0866, test_loss: 1.1753, test_f1: 0.4530
 epoch: 7, train_loss: 1.0638, test_loss: 1.1670, test_f1: 0.4460
 epoch: 8, train_loss: 1.0487, test_loss: 1.1447, test_f1: 0.4505
 epoch: 9, train_loss: 1.0267, test_loss: 1.1270, test_f1: 0.4577
 epoch: 10, train_loss: 0.9987, test_loss: 1.1126, test_f1: 0.4650
 epoch: 11, train_loss: 0.9892, test_loss: 1.0934, test_f1: 0.4868
 epoch: 12, train_loss: 0.9727, test_loss: 1.0884, test_f1: 0.4954
 epoch: 13, train_loss: 0.9530, test_loss: 1.0940, test_f1: 0.4966
 epoch: 14, train_loss: 0.9446, test_loss: 1.0880, test_f1: 0.5084
 epoch: 15, train_loss: 0.9364, test_loss: 1.0645, test_f1: 0.5268
 epoch: 16, train_loss: 0.9366, test_loss: 1.0584, test_f1: 0.5534
 epoch: 17, train_loss: 0.9260, test_loss: 1.0438, test_f1: 0.5264
 epoch: 18, train_loss: 0.9094, test_loss: 1.0515, test_f1: 0.5437
 epoch: 19, train_loss: 0.8991, test_loss: 1.0538, test_f1: 0.5445
 epoch: 20, train_loss: 0.8964, test_loss: 1.0534, test_f1: 0.5443
 epoch: 21, train_loss: 0.8827, test_loss: 1.0477, test_f1: 0.5277
 epoch: 22, train_loss: 0.8856, test_loss: 1.0411, test_f1: 0.5299
 epoch: 23, train_loss: 0.8594, test_loss: 1.0091, test_f1: 0.5322
 epoch: 24, train_loss: 0.8477, test_loss: 1.0151, test_f1: 0.5157
 epoch: 25, train_loss: 0.8397, test_loss: 1.0373, test_f1: 0.5542
 epoch: 26, train_loss: 0.8344, test_loss: 1.0194, test_f1: 0.5468
 epoch: 27, train_loss: 0.8180, test_loss: 1.0237, test_f1: 0.5320
 epoch: 28, train_loss: 0.8183, test_loss: 1.0160, test_f1: 0.5473
 epoch: 29, train_loss: 0.7937, test_loss: 1.0250, test_f1: 0.5522
 epoch: 30, train_loss: 0.7836, test_loss: 1.0196, test_f1: 0.5426
 epoch: 31, train_loss: 0.7642, test_loss: 0.9745, test_f1: 0.5541
 epoch: 32, train_loss: 0.7576, test_loss: 1.0117, test_f1: 0.5781
 epoch: 33, train_loss: 0.7419, test_loss: 0.9772, test_f1: 0.5796
 epoch: 34, train_loss: 0.7299, test_loss: 1.0164, test_f1: 0.5931
 epoch: 35, train_loss: 0.7224, test_loss: 0.9945, test_f1: 0.5562
 epoch: 36, train_loss: 0.7035, test_loss: 0.9814, test_f1: 0.5924
 epoch: 37, train_loss: 0.6799, test_loss: 1.0291, test_f1: 0.6036
 epoch: 38, train_loss: 0.6737, test_loss: 1.0349, test_f1: 0.6278
 epoch: 39, train_loss: 0.6714, test_loss: 1.0452, test_f1: 0.5995
 epoch: 40, train_loss: 0.6580, test_loss: 1.0004, test_f1: 0.6016
 epoch: 41, train_loss: 0.6674, test_loss: 1.0017, test_f1: 0.6234
 epoch: 42, train_loss: 0.6250, test_loss: 1.0063, test_f1: 0.6282
 epoch: 43, train_loss: 0.6289, test_loss: 1.0133, test_f1: 0.6206
 epoch: 44, train_loss: 0.6255, test_loss: 1.0558, test_f1: 0.6118
 epoch: 45, train_loss: 0.6100, test_loss: 1.0339, test_f1: 0.6354
 epoch: 46, train_loss: 0.5962, test_loss: 1.0343, test_f1: 0.6126
 epoch: 47, train_loss: 0.5915, test_loss: 1.0893, test_f1: 0.6532
 epoch: 48, train_loss: 0.5754, test_loss: 1.0774, test_f1: 0.5935
 epoch: 49, train_loss: 0.5892, test_loss: 1.0340, test_f1: 0.6210
 epoch: 50, train_loss: 0.5721, test_loss: 1.0333, test_f1: 0.6507
 epoch: 51, train_loss: 0.5496, test_loss: 1.0428, test_f1: 0.6330
 epoch: 52, train_loss: 0.5301, test_loss: 1.0557, test_f1: 0.6386
 epoch: 53, train_loss: 0.5423, test_loss: 1.0346, test_f1: 0.6218
 epoch: 54, train_loss: 0.5228, test_loss: 1.0445, test_f1: 0.6466
 epoch: 55, train_loss: 0.5044, test_loss: 1.0715, test_f1: 0.6458
 epoch: 56, train_loss: 0.5184, test_loss: 1.0457, test_f1: 0.6503
 epoch: 57, train_loss: 0.5115, test_loss: 1.0597, test_f1: 0.6246
 epoch: 58, train_loss: 0.4893, test_loss: 1.0659, test_f1: 0.6391
 epoch: 59, train_loss: 0.4968, test_loss: 1.1007, test_f1: 0.6328
 epoch: 60, train_loss: 0.4900, test_loss: 1.0943, test_f1: 0.6532
 epoch: 61, train_loss: 0.4852, test_loss: 1.1514, test_f1: 0.6446
 epoch: 62, train_loss: 0.4949, test_loss: 1.1193, test_f1: 0.6562
 epoch: 63, train_loss: 0.4793, test_loss: 1.1303, test_f1: 0.6413
 epoch: 64, train_loss: 0.4746, test_loss: 1.1573, test_f1: 0.6426
 epoch: 65, train_loss: 0.4734, test_loss: 1.1395, test_f1: 0.6564
 epoch: 66, train_loss: 0.4737, test_loss: 1.1243, test_f1: 0.6551
 epoch: 67, train_loss: 0.4720, test_loss: 1.1596, test_f1: 0.6314
 epoch: 68, train_loss: 0.4559, test_loss: 1.1737, test_f1: 0.6554
 epoch: 69, train_loss: 0.4600, test_loss: 1.1857, test_f1: 0.6339
 epoch: 70, train_loss: 0.4533, test_loss: 1.1969, test_f1: 0.6314
 epoch: 71, train_loss: 0.4466, test_loss: 1.1936, test_f1: 0.6235
 epoch: 72, train_loss: 0.4444, test_loss: 1.1814, test_f1: 0.6321
 epoch: 73, train_loss: 0.4345, test_loss: 1.2117, test_f1: 0.6378
 epoch: 74, train_loss: 0.4406, test_loss: 1.2343, test_f1: 0.6368
 epoch: 75, train_loss: 0.4236, test_loss: 1.1972, test_f1: 0.6224
 epoch: 76, train_loss: 0.4368, test_loss: 1.2075, test_f1: 0.6336
 epoch: 77, train_loss: 0.4472, test_loss: 1.2755, test_f1: 0.6085
 epoch: 78, train_loss: 0.4219, test_loss: 1.2039, test_f1: 0.6567
 epoch: 79, train_loss: 0.4137, test_loss: 1.2477, test_f1: 0.6413
 epoch: 80, train_loss: 0.4034, test_loss: 1.2550, test_f1: 0.6500
 epoch: 81, train_loss: 0.4117, test_loss: 1.2646, test_f1: 0.6550
 epoch: 82, train_loss: 0.4124, test_loss: 1.2719, test_f1: 0.5931
 epoch: 83, train_loss: 0.3950, test_loss: 1.2844, test_f1: 0.6382
 epoch: 84, train_loss: 0.4005, test_loss: 1.2963, test_f1: 0.6284
 epoch: 85, train_loss: 0.3993, test_loss: 1.2960, test_f1: 0.6124
 epoch: 86, train_loss: 0.3897, test_loss: 1.2990, test_f1: 0.6016
 epoch: 87, train_loss: 0.4055, test_loss: 1.2487, test_f1: 0.6456
 epoch: 88, train_loss: 0.3925, test_loss: 1.3136, test_f1: 0.6247
 epoch: 89, train_loss: 0.3769, test_loss: 1.3343, test_f1: 0.6290
 epoch: 90, train_loss: 0.3798, test_loss: 1.3604, test_f1: 0.6129
 epoch: 91, train_loss: 0.3628, test_loss: 1.3912, test_f1: 0.6297
 epoch: 92, train_loss: 0.3635, test_loss: 1.3445, test_f1: 0.6116
 epoch: 93, train_loss: 0.3543, test_loss: 1.3489, test_f1: 0.6145
 epoch: 94, train_loss: 0.3680, test_loss: 1.4185, test_f1: 0.6278
 epoch: 95, train_loss: 0.3576, test_loss: 1.3871, test_f1: 0.6142
 epoch: 96, train_loss: 0.3774, test_loss: 1.3720, test_f1: 0.6152
 epoch: 97, train_loss: 0.3525, test_loss: 1.4420, test_f1: 0.5906
 epoch: 98, train_loss: 0.3622, test_loss: 1.4199, test_f1: 0.5827
 epoch: 99, train_loss: 0.3329, test_loss: 1.4532, test_f1: 0.6153
##################ITERATION #1 ****************************************
 epoch: 0, train_loss: 1.2474, test_loss: 1.2710, test_f1: 0.2996
 epoch: 1, train_loss: 1.1164, test_loss: 1.1546, test_f1: 0.4420
 epoch: 2, train_loss: 1.0602, test_loss: 1.1074, test_f1: 0.4712
 epoch: 3, train_loss: 1.0249, test_loss: 1.0879, test_f1: 0.5094
 epoch: 4, train_loss: 0.9973, test_loss: 1.0657, test_f1: 0.5239
 epoch: 5, train_loss: 0.9797, test_loss: 1.0510, test_f1: 0.5148
 epoch: 6, train_loss: 0.9559, test_loss: 1.0445, test_f1: 0.5470
 epoch: 7, train_loss: 0.9438, test_loss: 1.0317, test_f1: 0.5556
 epoch: 8, train_loss: 0.9303, test_loss: 1.0258, test_f1: 0.5513
 epoch: 9, train_loss: 0.9196, test_loss: 1.0164, test_f1: 0.5715
 epoch: 10, train_loss: 0.9036, test_loss: 1.0035, test_f1: 0.5711
 epoch: 11, train_loss: 0.8958, test_loss: 1.0079, test_f1: 0.5484
 epoch: 12, train_loss: 0.8808, test_loss: 1.0000, test_f1: 0.5621
 epoch: 13, train_loss: 0.8537, test_loss: 1.0058, test_f1: 0.5719
 epoch: 14, train_loss: 0.8441, test_loss: 1.0020, test_f1: 0.5692
 epoch: 15, train_loss: 0.8260, test_loss: 1.0056, test_f1: 0.5734
 epoch: 16, train_loss: 0.8277, test_loss: 0.9920, test_f1: 0.5637
 epoch: 17, train_loss: 0.8092, test_loss: 0.9797, test_f1: 0.5917
 epoch: 18, train_loss: 0.7968, test_loss: 1.0046, test_f1: 0.5858
 epoch: 19, train_loss: 0.7746, test_loss: 0.9749, test_f1: 0.6017
 epoch: 20, train_loss: 0.7572, test_loss: 0.9886, test_f1: 0.5929
 epoch: 21, train_loss: 0.7773, test_loss: 0.9780, test_f1: 0.6106
 epoch: 22, train_loss: 0.7394, test_loss: 1.0056, test_f1: 0.5866
 epoch: 23, train_loss: 0.7365, test_loss: 0.9801, test_f1: 0.6226
 epoch: 24, train_loss: 0.7165, test_loss: 0.9908, test_f1: 0.5997
 epoch: 25, train_loss: 0.7082, test_loss: 0.9894, test_f1: 0.6082
 epoch: 26, train_loss: 0.6915, test_loss: 0.9727, test_f1: 0.6414
 epoch: 27, train_loss: 0.6865, test_loss: 0.9887, test_f1: 0.6210
 epoch: 28, train_loss: 0.6773, test_loss: 1.0127, test_f1: 0.6130
 epoch: 29, train_loss: 0.6744, test_loss: 1.0567, test_f1: 0.5829
 epoch: 30, train_loss: 0.6642, test_loss: 1.0136, test_f1: 0.5893
 epoch: 31, train_loss: 0.6421, test_loss: 1.0258, test_f1: 0.6185
 epoch: 32, train_loss: 0.6539, test_loss: 0.9988, test_f1: 0.6235
 epoch: 33, train_loss: 0.6447, test_loss: 1.0452, test_f1: 0.6386
 epoch: 34, train_loss: 0.6128, test_loss: 1.0369, test_f1: 0.6251
 epoch: 35, train_loss: 0.6227, test_loss: 1.0408, test_f1: 0.6348
 epoch: 36, train_loss: 0.6004, test_loss: 1.0215, test_f1: 0.6164
 epoch: 37, train_loss: 0.6092, test_loss: 1.0426, test_f1: 0.6508
 epoch: 38, train_loss: 0.5885, test_loss: 1.0356, test_f1: 0.6187
 epoch: 39, train_loss: 0.5908, test_loss: 1.0659, test_f1: 0.6325
 epoch: 40, train_loss: 0.5852, test_loss: 1.1119, test_f1: 0.6298
 epoch: 41, train_loss: 0.5734, test_loss: 1.1211, test_f1: 0.6457
 epoch: 42, train_loss: 0.5855, test_loss: 1.0833, test_f1: 0.6223
 epoch: 43, train_loss: 0.5570, test_loss: 1.0665, test_f1: 0.6439
 epoch: 44, train_loss: 0.5514, test_loss: 1.0812, test_f1: 0.6598
 epoch: 45, train_loss: 0.5615, test_loss: 1.1126, test_f1: 0.6306
 epoch: 46, train_loss: 0.5569, test_loss: 1.0906, test_f1: 0.6160
 epoch: 47, train_loss: 0.5344, test_loss: 1.0653, test_f1: 0.6533
 epoch: 48, train_loss: 0.5361, test_loss: 1.0823, test_f1: 0.6501
 epoch: 49, train_loss: 0.5085, test_loss: 1.1299, test_f1: 0.6481
 epoch: 50, train_loss: 0.5172, test_loss: 1.1266, test_f1: 0.6457
 epoch: 51, train_loss: 0.4842, test_loss: 1.1239, test_f1: 0.6343
 epoch: 52, train_loss: 0.4805, test_loss: 1.1319, test_f1: 0.6557
 epoch: 53, train_loss: 0.4770, test_loss: 1.1446, test_f1: 0.6275
 epoch: 54, train_loss: 0.4702, test_loss: 1.1565, test_f1: 0.6525
 epoch: 55, train_loss: 0.4707, test_loss: 1.1650, test_f1: 0.6605
 epoch: 56, train_loss: 0.4649, test_loss: 1.1647, test_f1: 0.6686
 epoch: 57, train_loss: 0.4632, test_loss: 1.1422, test_f1: 0.6543
 epoch: 58, train_loss: 0.4545, test_loss: 1.2078, test_f1: 0.6427
 epoch: 59, train_loss: 0.4597, test_loss: 1.1720, test_f1: 0.6428
 epoch: 60, train_loss: 0.4589, test_loss: 1.1782, test_f1: 0.6508
 epoch: 61, train_loss: 0.4429, test_loss: 1.1836, test_f1: 0.6532
 epoch: 62, train_loss: 0.4423, test_loss: 1.2057, test_f1: 0.6442
 epoch: 63, train_loss: 0.4340, test_loss: 1.2214, test_f1: 0.6611
 epoch: 64, train_loss: 0.4310, test_loss: 1.2332, test_f1: 0.6470
 epoch: 65, train_loss: 0.4207, test_loss: 1.2580, test_f1: 0.6380
 epoch: 66, train_loss: 0.4285, test_loss: 1.2306, test_f1: 0.6361
 epoch: 67, train_loss: 0.4284, test_loss: 1.2195, test_f1: 0.6493
 epoch: 68, train_loss: 0.4320, test_loss: 1.2113, test_f1: 0.6420
 epoch: 69, train_loss: 0.4172, test_loss: 1.2687, test_f1: 0.6635
 epoch: 70, train_loss: 0.3986, test_loss: 1.2562, test_f1: 0.6565
 epoch: 71, train_loss: 0.4156, test_loss: 1.2895, test_f1: 0.6380
 epoch: 72, train_loss: 0.4137, test_loss: 1.2900, test_f1: 0.6519
 epoch: 73, train_loss: 0.3860, test_loss: 1.2997, test_f1: 0.6167
 epoch: 74, train_loss: 0.4004, test_loss: 1.2993, test_f1: 0.6236
 epoch: 75, train_loss: 0.4027, test_loss: 1.2839, test_f1: 0.6306
 epoch: 76, train_loss: 0.4162, test_loss: 1.2838, test_f1: 0.6494
 epoch: 77, train_loss: 0.3798, test_loss: 1.3246, test_f1: 0.6603
 epoch: 78, train_loss: 0.4005, test_loss: 1.3014, test_f1: 0.6478
 epoch: 79, train_loss: 0.3878, test_loss: 1.3991, test_f1: 0.6215
 epoch: 80, train_loss: 0.3849, test_loss: 1.2803, test_f1: 0.6611
 epoch: 81, train_loss: 0.3716, test_loss: 1.3048, test_f1: 0.6375
 epoch: 82, train_loss: 0.3687, test_loss: 1.3215, test_f1: 0.6403
 epoch: 83, train_loss: 0.3919, test_loss: 1.3427, test_f1: 0.6438
 epoch: 84, train_loss: 0.3709, test_loss: 1.3630, test_f1: 0.6272
 epoch: 85, train_loss: 0.3739, test_loss: 1.3806, test_f1: 0.6378
 epoch: 86, train_loss: 0.3556, test_loss: 1.3839, test_f1: 0.6419
 epoch: 87, train_loss: 0.3557, test_loss: 1.4243, test_f1: 0.6242
 epoch: 88, train_loss: 0.3494, test_loss: 1.4331, test_f1: 0.6289
 epoch: 89, train_loss: 0.3375, test_loss: 1.4173, test_f1: 0.6536
 epoch: 90, train_loss: 0.3532, test_loss: 1.3714, test_f1: 0.6500
 epoch: 91, train_loss: 0.3357, test_loss: 1.4467, test_f1: 0.6191
 epoch: 92, train_loss: 0.3479, test_loss: 1.4323, test_f1: 0.6281
 epoch: 93, train_loss: 0.3233, test_loss: 1.4531, test_f1: 0.6306
 epoch: 94, train_loss: 0.3418, test_loss: 1.4332, test_f1: 0.6337
 epoch: 95, train_loss: 0.3383, test_loss: 1.4388, test_f1: 0.6433
 epoch: 96, train_loss: 0.3155, test_loss: 1.5004, test_f1: 0.6489
 epoch: 97, train_loss: 0.3222, test_loss: 1.4923, test_f1: 0.6364
 epoch: 98, train_loss: 0.3271, test_loss: 1.4411, test_f1: 0.6412
 epoch: 99, train_loss: 0.3058, test_loss: 1.4599, test_f1: 0.6292
##################ITERATION #2 ****************************************
 epoch: 0, train_loss: 1.1807, test_loss: 1.2711, test_f1: 0.3197
 epoch: 1, train_loss: 1.0513, test_loss: 1.0923, test_f1: 0.4914
 epoch: 2, train_loss: 1.0197, test_loss: 1.0682, test_f1: 0.5130
 epoch: 3, train_loss: 0.9956, test_loss: 1.0553, test_f1: 0.5322
 epoch: 4, train_loss: 0.9749, test_loss: 1.0342, test_f1: 0.5278
 epoch: 5, train_loss: 0.9559, test_loss: 1.0337, test_f1: 0.5412
 epoch: 6, train_loss: 0.9303, test_loss: 1.0291, test_f1: 0.5288
 epoch: 7, train_loss: 0.9238, test_loss: 1.0143, test_f1: 0.5230
 epoch: 8, train_loss: 0.8978, test_loss: 1.0214, test_f1: 0.5540
 epoch: 9, train_loss: 0.9075, test_loss: 1.0056, test_f1: 0.5551
 epoch: 10, train_loss: 0.8852, test_loss: 0.9989, test_f1: 0.5532
 epoch: 11, train_loss: 0.8615, test_loss: 1.0011, test_f1: 0.5232
 epoch: 12, train_loss: 0.8606, test_loss: 0.9906, test_f1: 0.5655
 epoch: 13, train_loss: 0.8521, test_loss: 0.9863, test_f1: 0.5646
 epoch: 14, train_loss: 0.8320, test_loss: 0.9972, test_f1: 0.5657
 epoch: 15, train_loss: 0.8285, test_loss: 0.9900, test_f1: 0.5609
 epoch: 16, train_loss: 0.8101, test_loss: 1.0016, test_f1: 0.5480
 epoch: 17, train_loss: 0.8013, test_loss: 1.0075, test_f1: 0.5594
 epoch: 18, train_loss: 0.7893, test_loss: 1.0012, test_f1: 0.5758
 epoch: 19, train_loss: 0.7697, test_loss: 1.0141, test_f1: 0.5788
 epoch: 20, train_loss: 0.7611, test_loss: 0.9995, test_f1: 0.5831
 epoch: 21, train_loss: 0.7597, test_loss: 1.0090, test_f1: 0.6052
 epoch: 22, train_loss: 0.7443, test_loss: 1.0019, test_f1: 0.5816
 epoch: 23, train_loss: 0.7398, test_loss: 1.0157, test_f1: 0.5991
 epoch: 24, train_loss: 0.7203, test_loss: 1.0410, test_f1: 0.5783
 epoch: 25, train_loss: 0.7011, test_loss: 1.0374, test_f1: 0.5890
 epoch: 26, train_loss: 0.6970, test_loss: 1.0459, test_f1: 0.5909
 epoch: 27, train_loss: 0.6888, test_loss: 1.0362, test_f1: 0.6012
 epoch: 28, train_loss: 0.6882, test_loss: 1.0306, test_f1: 0.6205
 epoch: 29, train_loss: 0.6864, test_loss: 1.0345, test_f1: 0.6045
 epoch: 30, train_loss: 0.6668, test_loss: 1.0446, test_f1: 0.6164
 epoch: 31, train_loss: 0.6453, test_loss: 1.0453, test_f1: 0.6104
 epoch: 32, train_loss: 0.6156, test_loss: 1.0831, test_f1: 0.6024
 epoch: 33, train_loss: 0.6379, test_loss: 1.0330, test_f1: 0.6335
 epoch: 34, train_loss: 0.6201, test_loss: 1.0808, test_f1: 0.6137
 epoch: 35, train_loss: 0.6181, test_loss: 1.0849, test_f1: 0.6104
 epoch: 36, train_loss: 0.6204, test_loss: 1.0662, test_f1: 0.6240
 epoch: 37, train_loss: 0.6018, test_loss: 1.0826, test_f1: 0.6430
 epoch: 38, train_loss: 0.5802, test_loss: 1.1202, test_f1: 0.6033
 epoch: 39, train_loss: 0.5613, test_loss: 1.1245, test_f1: 0.6215
 epoch: 40, train_loss: 0.5735, test_loss: 1.1182, test_f1: 0.6075
 epoch: 41, train_loss: 0.5637, test_loss: 1.1657, test_f1: 0.6209
 epoch: 42, train_loss: 0.5550, test_loss: 1.1478, test_f1: 0.6282
 epoch: 43, train_loss: 0.5314, test_loss: 1.1534, test_f1: 0.6255
 epoch: 44, train_loss: 0.5360, test_loss: 1.1870, test_f1: 0.6279
 epoch: 45, train_loss: 0.5102, test_loss: 1.1519, test_f1: 0.6324
 epoch: 46, train_loss: 0.5101, test_loss: 1.2154, test_f1: 0.6102
 epoch: 47, train_loss: 0.5106, test_loss: 1.2031, test_f1: 0.6430
 epoch: 48, train_loss: 0.4865, test_loss: 1.1971, test_f1: 0.6334
 epoch: 49, train_loss: 0.4894, test_loss: 1.2248, test_f1: 0.6439
 epoch: 50, train_loss: 0.4813, test_loss: 1.2699, test_f1: 0.6330
 epoch: 51, train_loss: 0.4776, test_loss: 1.2376, test_f1: 0.6146
 epoch: 52, train_loss: 0.4592, test_loss: 1.2557, test_f1: 0.6316
 epoch: 53, train_loss: 0.4499, test_loss: 1.2219, test_f1: 0.6426
 epoch: 54, train_loss: 0.4372, test_loss: 1.2660, test_f1: 0.6303
 epoch: 55, train_loss: 0.4298, test_loss: 1.2508, test_f1: 0.6401
 epoch: 56, train_loss: 0.4361, test_loss: 1.2626, test_f1: 0.6289
 epoch: 57, train_loss: 0.4388, test_loss: 1.2894, test_f1: 0.6230
 epoch: 58, train_loss: 0.4237, test_loss: 1.2495, test_f1: 0.6606
 epoch: 59, train_loss: 0.4258, test_loss: 1.3389, test_f1: 0.6308
 epoch: 60, train_loss: 0.4102, test_loss: 1.3278, test_f1: 0.6557
 epoch: 61, train_loss: 0.4092, test_loss: 1.3225, test_f1: 0.6350
 epoch: 62, train_loss: 0.4074, test_loss: 1.3407, test_f1: 0.6441
 epoch: 63, train_loss: 0.4066, test_loss: 1.3758, test_f1: 0.6090
 epoch: 64, train_loss: 0.4013, test_loss: 1.3750, test_f1: 0.6295
 epoch: 65, train_loss: 0.4196, test_loss: 1.3414, test_f1: 0.6507
 epoch: 66, train_loss: 0.3934, test_loss: 1.4026, test_f1: 0.6179
 epoch: 67, train_loss: 0.3868, test_loss: 1.3982, test_f1: 0.6419
 epoch: 68, train_loss: 0.3763, test_loss: 1.3421, test_f1: 0.6739
 epoch: 69, train_loss: 0.3816, test_loss: 1.4233, test_f1: 0.6101
 epoch: 70, train_loss: 0.3769, test_loss: 1.3923, test_f1: 0.6626
 epoch: 71, train_loss: 0.3712, test_loss: 1.4468, test_f1: 0.5930
 epoch: 72, train_loss: 0.3735, test_loss: 1.4232, test_f1: 0.6316
 epoch: 73, train_loss: 0.3730, test_loss: 1.4025, test_f1: 0.6334
 epoch: 74, train_loss: 0.3570, test_loss: 1.4564, test_f1: 0.6479
 epoch: 75, train_loss: 0.3660, test_loss: 1.4173, test_f1: 0.6172
 epoch: 76, train_loss: 0.3517, test_loss: 1.4647, test_f1: 0.6138
 epoch: 77, train_loss: 0.3636, test_loss: 1.4457, test_f1: 0.6437
 epoch: 78, train_loss: 0.3413, test_loss: 1.4614, test_f1: 0.6421
 epoch: 79, train_loss: 0.3508, test_loss: 1.4491, test_f1: 0.6175
 epoch: 80, train_loss: 0.3280, test_loss: 1.5172, test_f1: 0.6284
 epoch: 81, train_loss: 0.3135, test_loss: 1.5337, test_f1: 0.6004
 epoch: 82, train_loss: 0.3382, test_loss: 1.5479, test_f1: 0.6264
 epoch: 83, train_loss: 0.3309, test_loss: 1.5347, test_f1: 0.6376
 epoch: 84, train_loss: 0.3239, test_loss: 1.5679, test_f1: 0.6151
 epoch: 85, train_loss: 0.3369, test_loss: 1.5502, test_f1: 0.5880
 epoch: 86, train_loss: 0.3273, test_loss: 1.4905, test_f1: 0.6224
 epoch: 87, train_loss: 0.3129, test_loss: 1.5218, test_f1: 0.6040
 epoch: 88, train_loss: 0.3011, test_loss: 1.5527, test_f1: 0.6211
 epoch: 89, train_loss: 0.3222, test_loss: 1.6860, test_f1: 0.5896
 epoch: 90, train_loss: 0.3137, test_loss: 1.5818, test_f1: 0.6313
 epoch: 91, train_loss: 0.3252, test_loss: 1.5572, test_f1: 0.6219
 epoch: 92, train_loss: 0.3300, test_loss: 1.6403, test_f1: 0.6137
 epoch: 93, train_loss: 0.2845, test_loss: 1.6601, test_f1: 0.6120
 epoch: 94, train_loss: 0.2828, test_loss: 1.6597, test_f1: 0.6273
 epoch: 95, train_loss: 0.2869, test_loss: 1.6327, test_f1: 0.6088
 epoch: 96, train_loss: 0.3047, test_loss: 1.6409, test_f1: 0.6341
 epoch: 97, train_loss: 0.2852, test_loss: 1.6677, test_f1: 0.6038
 epoch: 98, train_loss: 0.2779, test_loss: 1.7102, test_f1: 0.6103
 epoch: 99, train_loss: 0.2850, test_loss: 1.7183, test_f1: 0.6077
##################ITERATION #3 ****************************************
 epoch: 0, train_loss: 1.1745, test_loss: 1.2271, test_f1: 0.2722
 epoch: 1, train_loss: 1.0531, test_loss: 1.0819, test_f1: 0.4750
 epoch: 2, train_loss: 0.9989, test_loss: 1.0671, test_f1: 0.4946
 epoch: 3, train_loss: 0.9622, test_loss: 1.0492, test_f1: 0.5325
 epoch: 4, train_loss: 0.9478, test_loss: 1.0387, test_f1: 0.5277
 epoch: 5, train_loss: 0.9321, test_loss: 1.0252, test_f1: 0.5488
 epoch: 6, train_loss: 0.9104, test_loss: 1.0177, test_f1: 0.5573
 epoch: 7, train_loss: 0.8961, test_loss: 1.0155, test_f1: 0.5602
 epoch: 8, train_loss: 0.8724, test_loss: 1.0161, test_f1: 0.5562
 epoch: 9, train_loss: 0.8544, test_loss: 1.0207, test_f1: 0.5677
 epoch: 10, train_loss: 0.8601, test_loss: 1.0076, test_f1: 0.5388
 epoch: 11, train_loss: 0.8341, test_loss: 1.0120, test_f1: 0.5764
 epoch: 12, train_loss: 0.8409, test_loss: 0.9973, test_f1: 0.5871
 epoch: 13, train_loss: 0.7997, test_loss: 1.0168, test_f1: 0.5796
 epoch: 14, train_loss: 0.7924, test_loss: 0.9961, test_f1: 0.6015
 epoch: 15, train_loss: 0.7729, test_loss: 0.9848, test_f1: 0.6037
 epoch: 16, train_loss: 0.7606, test_loss: 1.0037, test_f1: 0.6069
 epoch: 17, train_loss: 0.7418, test_loss: 1.0102, test_f1: 0.6059
 epoch: 18, train_loss: 0.7307, test_loss: 0.9910, test_f1: 0.5961
 epoch: 19, train_loss: 0.7233, test_loss: 1.0115, test_f1: 0.5888
 epoch: 20, train_loss: 0.7015, test_loss: 1.0510, test_f1: 0.5967
 epoch: 21, train_loss: 0.6954, test_loss: 1.0285, test_f1: 0.5942
 epoch: 22, train_loss: 0.6774, test_loss: 1.0239, test_f1: 0.6271
 epoch: 23, train_loss: 0.6680, test_loss: 1.0230, test_f1: 0.6085
 epoch: 24, train_loss: 0.6543, test_loss: 1.0162, test_f1: 0.6094
 epoch: 25, train_loss: 0.6458, test_loss: 1.0582, test_f1: 0.6118
 epoch: 26, train_loss: 0.6359, test_loss: 1.0124, test_f1: 0.6065
 epoch: 27, train_loss: 0.6242, test_loss: 1.0204, test_f1: 0.6287
 epoch: 28, train_loss: 0.6196, test_loss: 1.0193, test_f1: 0.6468
 epoch: 29, train_loss: 0.5918, test_loss: 1.0809, test_f1: 0.6293
 epoch: 30, train_loss: 0.5797, test_loss: 1.1254, test_f1: 0.6310
 epoch: 31, train_loss: 0.5817, test_loss: 1.0651, test_f1: 0.6247
 epoch: 32, train_loss: 0.5652, test_loss: 1.0706, test_f1: 0.6288
 epoch: 33, train_loss: 0.5649, test_loss: 1.1305, test_f1: 0.6199
 epoch: 34, train_loss: 0.5676, test_loss: 1.0872, test_f1: 0.6565
 epoch: 35, train_loss: 0.5622, test_loss: 1.1095, test_f1: 0.6163
 epoch: 36, train_loss: 0.5447, test_loss: 1.1184, test_f1: 0.6259
 epoch: 37, train_loss: 0.5343, test_loss: 1.2027, test_f1: 0.6094
 epoch: 38, train_loss: 0.5172, test_loss: 1.1242, test_f1: 0.6206
 epoch: 39, train_loss: 0.5130, test_loss: 1.1140, test_f1: 0.6531
 epoch: 40, train_loss: 0.5048, test_loss: 1.1708, test_f1: 0.6431
 epoch: 41, train_loss: 0.5088, test_loss: 1.1639, test_f1: 0.6392
 epoch: 42, train_loss: 0.4827, test_loss: 1.1986, test_f1: 0.6380
 epoch: 43, train_loss: 0.4662, test_loss: 1.2105, test_f1: 0.6376
 epoch: 44, train_loss: 0.4622, test_loss: 1.2193, test_f1: 0.6517
 epoch: 45, train_loss: 0.4567, test_loss: 1.1700, test_f1: 0.6378
 epoch: 46, train_loss: 0.4609, test_loss: 1.2516, test_f1: 0.6358
 epoch: 47, train_loss: 0.4436, test_loss: 1.2413, test_f1: 0.6242
 epoch: 48, train_loss: 0.4581, test_loss: 1.2942, test_f1: 0.6597
 epoch: 49, train_loss: 0.4593, test_loss: 1.2213, test_f1: 0.6372
 epoch: 50, train_loss: 0.4328, test_loss: 1.2458, test_f1: 0.6583
 epoch: 51, train_loss: 0.4128, test_loss: 1.2603, test_f1: 0.6479
 epoch: 52, train_loss: 0.4165, test_loss: 1.2434, test_f1: 0.6712
 epoch: 53, train_loss: 0.3916, test_loss: 1.2843, test_f1: 0.6444
 epoch: 54, train_loss: 0.4074, test_loss: 1.3044, test_f1: 0.6714
 epoch: 55, train_loss: 0.3977, test_loss: 1.3330, test_f1: 0.6623
 epoch: 56, train_loss: 0.3917, test_loss: 1.2719, test_f1: 0.6724
 epoch: 57, train_loss: 0.3966, test_loss: 1.3250, test_f1: 0.6692
 epoch: 58, train_loss: 0.3888, test_loss: 1.2890, test_f1: 0.6702
 epoch: 59, train_loss: 0.3836, test_loss: 1.3463, test_f1: 0.6392
 epoch: 60, train_loss: 0.3673, test_loss: 1.3368, test_f1: 0.6599
 epoch: 61, train_loss: 0.3816, test_loss: 1.3552, test_f1: 0.6587
 epoch: 62, train_loss: 0.3769, test_loss: 1.3663, test_f1: 0.6559
 epoch: 63, train_loss: 0.3694, test_loss: 1.3595, test_f1: 0.6751
 epoch: 64, train_loss: 0.3440, test_loss: 1.3679, test_f1: 0.6729
 epoch: 65, train_loss: 0.3452, test_loss: 1.4029, test_f1: 0.6573
 epoch: 66, train_loss: 0.3528, test_loss: 1.4542, test_f1: 0.6477
 epoch: 67, train_loss: 0.3562, test_loss: 1.4130, test_f1: 0.6453
 epoch: 68, train_loss: 0.3593, test_loss: 1.3799, test_f1: 0.6680
 epoch: 69, train_loss: 0.3571, test_loss: 1.4071, test_f1: 0.6805
 epoch: 70, train_loss: 0.3329, test_loss: 1.4391, test_f1: 0.6743
 epoch: 71, train_loss: 0.3365, test_loss: 1.4092, test_f1: 0.6605
 epoch: 72, train_loss: 0.3318, test_loss: 1.4562, test_f1: 0.6721
 epoch: 73, train_loss: 0.3352, test_loss: 1.4761, test_f1: 0.6708
 epoch: 74, train_loss: 0.3214, test_loss: 1.5068, test_f1: 0.6751
 epoch: 75, train_loss: 0.3047, test_loss: 1.5382, test_f1: 0.6399
 epoch: 76, train_loss: 0.3165, test_loss: 1.5350, test_f1: 0.6578
 epoch: 77, train_loss: 0.3189, test_loss: 1.5173, test_f1: 0.6354
 epoch: 78, train_loss: 0.2975, test_loss: 1.5051, test_f1: 0.6488
 epoch: 79, train_loss: 0.3343, test_loss: 1.5147, test_f1: 0.6477
 epoch: 80, train_loss: 0.2904, test_loss: 1.5543, test_f1: 0.6794
 epoch: 81, train_loss: 0.2968, test_loss: 1.6031, test_f1: 0.6704
 epoch: 82, train_loss: 0.3240, test_loss: 1.5644, test_f1: 0.6760
 epoch: 83, train_loss: 0.2919, test_loss: 1.6352, test_f1: 0.6351
 epoch: 84, train_loss: 0.3031, test_loss: 1.5596, test_f1: 0.6543
 epoch: 85, train_loss: 0.3155, test_loss: 1.5529, test_f1: 0.6530
 epoch: 86, train_loss: 0.2804, test_loss: 1.5968, test_f1: 0.6455
 epoch: 87, train_loss: 0.2872, test_loss: 1.6077, test_f1: 0.6626
 epoch: 88, train_loss: 0.2746, test_loss: 1.5888, test_f1: 0.6687
 epoch: 89, train_loss: 0.2760, test_loss: 1.6600, test_f1: 0.6464
 epoch: 90, train_loss: 0.2809, test_loss: 1.5657, test_f1: 0.6635
 epoch: 91, train_loss: 0.2884, test_loss: 1.6524, test_f1: 0.6598
 epoch: 92, train_loss: 0.2931, test_loss: 1.6222, test_f1: 0.6536
 epoch: 93, train_loss: 0.2748, test_loss: 1.5972, test_f1: 0.6445
 epoch: 94, train_loss: 0.2674, test_loss: 1.7019, test_f1: 0.6323
 epoch: 95, train_loss: 0.2838, test_loss: 1.6338, test_f1: 0.6361
 epoch: 96, train_loss: 0.2763, test_loss: 1.6922, test_f1: 0.6716
 epoch: 97, train_loss: 0.2686, test_loss: 1.6790, test_f1: 0.6424
 epoch: 98, train_loss: 0.2744, test_loss: 1.6941, test_f1: 0.6618
 epoch: 99, train_loss: 0.2493, test_loss: 1.7412, test_f1: 0.6605
##################ITERATION #4 ****************************************
 epoch: 0, train_loss: 1.1435, test_loss: 1.1904, test_f1: 0.2682
 epoch: 1, train_loss: 1.0064, test_loss: 1.0462, test_f1: 0.4915
 epoch: 2, train_loss: 0.9775, test_loss: 1.0267, test_f1: 0.5094
 epoch: 3, train_loss: 0.9474, test_loss: 1.0192, test_f1: 0.5122
 epoch: 4, train_loss: 0.9428, test_loss: 1.0199, test_f1: 0.4908
 epoch: 5, train_loss: 0.9027, test_loss: 1.0124, test_f1: 0.5057
 epoch: 6, train_loss: 0.8825, test_loss: 0.9988, test_f1: 0.5315
 epoch: 7, train_loss: 0.8711, test_loss: 0.9948, test_f1: 0.5551
 epoch: 8, train_loss: 0.8496, test_loss: 0.9951, test_f1: 0.5573
 epoch: 9, train_loss: 0.8371, test_loss: 0.9946, test_f1: 0.5619
 epoch: 10, train_loss: 0.8165, test_loss: 0.9782, test_f1: 0.5855
 epoch: 11, train_loss: 0.7940, test_loss: 0.9587, test_f1: 0.6021
 epoch: 12, train_loss: 0.7901, test_loss: 0.9813, test_f1: 0.5825
 epoch: 13, train_loss: 0.7771, test_loss: 0.9884, test_f1: 0.5922
 epoch: 14, train_loss: 0.7516, test_loss: 0.9911, test_f1: 0.5868
 epoch: 15, train_loss: 0.7487, test_loss: 0.9826, test_f1: 0.5717
 epoch: 16, train_loss: 0.7230, test_loss: 0.9920, test_f1: 0.5743
 epoch: 17, train_loss: 0.7129, test_loss: 0.9734, test_f1: 0.5868
 epoch: 18, train_loss: 0.6973, test_loss: 0.9974, test_f1: 0.5940
 epoch: 19, train_loss: 0.6809, test_loss: 1.0002, test_f1: 0.6098
 epoch: 20, train_loss: 0.6754, test_loss: 0.9962, test_f1: 0.5891
 epoch: 21, train_loss: 0.6670, test_loss: 1.0172, test_f1: 0.6016
 epoch: 22, train_loss: 0.6487, test_loss: 1.0101, test_f1: 0.6092
 epoch: 23, train_loss: 0.6434, test_loss: 1.0062, test_f1: 0.6267
 epoch: 24, train_loss: 0.6274, test_loss: 1.0278, test_f1: 0.6090
 epoch: 25, train_loss: 0.6095, test_loss: 1.0343, test_f1: 0.6071
 epoch: 26, train_loss: 0.6087, test_loss: 1.0406, test_f1: 0.6025
 epoch: 27, train_loss: 0.6011, test_loss: 1.0228, test_f1: 0.6037
 epoch: 28, train_loss: 0.5971, test_loss: 1.0612, test_f1: 0.6172
 epoch: 29, train_loss: 0.5945, test_loss: 1.0498, test_f1: 0.6282
 epoch: 30, train_loss: 0.5683, test_loss: 1.0399, test_f1: 0.6292
 epoch: 31, train_loss: 0.5676, test_loss: 1.0890, test_f1: 0.5996
 epoch: 32, train_loss: 0.5507, test_loss: 1.0776, test_f1: 0.6263
 epoch: 33, train_loss: 0.5279, test_loss: 1.0581, test_f1: 0.6356
 epoch: 34, train_loss: 0.5340, test_loss: 1.1336, test_f1: 0.6356
 epoch: 35, train_loss: 0.5419, test_loss: 1.0700, test_f1: 0.6472
 epoch: 36, train_loss: 0.5245, test_loss: 1.1057, test_f1: 0.6072
 epoch: 37, train_loss: 0.5245, test_loss: 1.1230, test_f1: 0.5941
 epoch: 38, train_loss: 0.4848, test_loss: 1.1078, test_f1: 0.6420
 epoch: 39, train_loss: 0.4959, test_loss: 1.2163, test_f1: 0.5844
 epoch: 40, train_loss: 0.4926, test_loss: 1.1824, test_f1: 0.6449
 epoch: 41, train_loss: 0.4921, test_loss: 1.1627, test_f1: 0.6410
 epoch: 42, train_loss: 0.4753, test_loss: 1.1476, test_f1: 0.6615
 epoch: 43, train_loss: 0.4654, test_loss: 1.1909, test_f1: 0.6249
 epoch: 44, train_loss: 0.4821, test_loss: 1.2171, test_f1: 0.6289
 epoch: 45, train_loss: 0.4721, test_loss: 1.2081, test_f1: 0.6473
 epoch: 46, train_loss: 0.4526, test_loss: 1.2444, test_f1: 0.6043
 epoch: 47, train_loss: 0.4493, test_loss: 1.2579, test_f1: 0.6013
 epoch: 48, train_loss: 0.4331, test_loss: 1.2652, test_f1: 0.6172
 epoch: 49, train_loss: 0.4192, test_loss: 1.2794, test_f1: 0.6048
 epoch: 50, train_loss: 0.4417, test_loss: 1.2499, test_f1: 0.6316
 epoch: 51, train_loss: 0.4115, test_loss: 1.2528, test_f1: 0.6181
 epoch: 52, train_loss: 0.4045, test_loss: 1.2558, test_f1: 0.6473
 epoch: 53, train_loss: 0.3890, test_loss: 1.2528, test_f1: 0.6382
 epoch: 54, train_loss: 0.3867, test_loss: 1.2806, test_f1: 0.6406
 epoch: 55, train_loss: 0.3907, test_loss: 1.2688, test_f1: 0.6233
 epoch: 56, train_loss: 0.3758, test_loss: 1.3180, test_f1: 0.6422
 epoch: 57, train_loss: 0.3649, test_loss: 1.3166, test_f1: 0.6166
 epoch: 58, train_loss: 0.3515, test_loss: 1.3727, test_f1: 0.6011
 epoch: 59, train_loss: 0.3708, test_loss: 1.4052, test_f1: 0.5980
 epoch: 60, train_loss: 0.3538, test_loss: 1.3728, test_f1: 0.6209
 epoch: 61, train_loss: 0.3506, test_loss: 1.3659, test_f1: 0.6064
 epoch: 62, train_loss: 0.3500, test_loss: 1.4130, test_f1: 0.6079
 epoch: 63, train_loss: 0.3643, test_loss: 1.3933, test_f1: 0.6192
 epoch: 64, train_loss: 0.3476, test_loss: 1.3833, test_f1: 0.6268
 epoch: 65, train_loss: 0.3510, test_loss: 1.3974, test_f1: 0.6071
 epoch: 66, train_loss: 0.3457, test_loss: 1.4277, test_f1: 0.6004
 epoch: 67, train_loss: 0.3416, test_loss: 1.3678, test_f1: 0.6215
 epoch: 68, train_loss: 0.3506, test_loss: 1.4673, test_f1: 0.6018
 epoch: 69, train_loss: 0.3196, test_loss: 1.4425, test_f1: 0.6129
 epoch: 70, train_loss: 0.3367, test_loss: 1.4551, test_f1: 0.6393
 epoch: 71, train_loss: 0.3312, test_loss: 1.4971, test_f1: 0.6267
 epoch: 72, train_loss: 0.3207, test_loss: 1.4722, test_f1: 0.6118
 epoch: 73, train_loss: 0.3325, test_loss: 1.4923, test_f1: 0.6029
 epoch: 74, train_loss: 0.3268, test_loss: 1.4834, test_f1: 0.6069
 epoch: 75, train_loss: 0.3234, test_loss: 1.4881, test_f1: 0.5981
 epoch: 76, train_loss: 0.2988, test_loss: 1.4924, test_f1: 0.6031
 epoch: 77, train_loss: 0.3249, test_loss: 1.4526, test_f1: 0.6096
 epoch: 78, train_loss: 0.3104, test_loss: 1.4845, test_f1: 0.6101
 epoch: 79, train_loss: 0.3276, test_loss: 1.5718, test_f1: 0.5996
 epoch: 80, train_loss: 0.2981, test_loss: 1.5279, test_f1: 0.6155
 epoch: 81, train_loss: 0.3078, test_loss: 1.5619, test_f1: 0.6148
 epoch: 82, train_loss: 0.2810, test_loss: 1.5696, test_f1: 0.5963
 epoch: 83, train_loss: 0.3060, test_loss: 1.6250, test_f1: 0.5837
 epoch: 84, train_loss: 0.2843, test_loss: 1.5184, test_f1: 0.6202
 epoch: 85, train_loss: 0.2932, test_loss: 1.5869, test_f1: 0.5998
 epoch: 86, train_loss: 0.2913, test_loss: 1.6179, test_f1: 0.5775
 epoch: 87, train_loss: 0.2676, test_loss: 1.6095, test_f1: 0.6254
 epoch: 88, train_loss: 0.2744, test_loss: 1.6277, test_f1: 0.6143
 epoch: 89, train_loss: 0.2605, test_loss: 1.6389, test_f1: 0.5991
 epoch: 90, train_loss: 0.2713, test_loss: 1.6218, test_f1: 0.6026
 epoch: 91, train_loss: 0.2800, test_loss: 1.6550, test_f1: 0.6093
 epoch: 92, train_loss: 0.2844, test_loss: 1.7214, test_f1: 0.6038
 epoch: 93, train_loss: 0.2864, test_loss: 1.6193, test_f1: 0.6036
 epoch: 94, train_loss: 0.2690, test_loss: 1.6092, test_f1: 0.6169
 epoch: 95, train_loss: 0.2501, test_loss: 1.6751, test_f1: 0.6137
 epoch: 96, train_loss: 0.2812, test_loss: 1.7175, test_f1: 0.6285
 epoch: 97, train_loss: 0.2479, test_loss: 1.7107, test_f1: 0.6026
 epoch: 98, train_loss: 0.2600, test_loss: 1.7208, test_f1: 0.5913
 epoch: 99, train_loss: 0.2414, test_loss: 1.6436, test_f1: 0.6096
##################ITERATION #5 ****************************************
 epoch: 0, train_loss: 1.1716, test_loss: 1.3332, test_f1: 0.2786
 epoch: 1, train_loss: 1.0108, test_loss: 1.0549, test_f1: 0.5357
 epoch: 2, train_loss: 0.9794, test_loss: 1.0481, test_f1: 0.5326
 epoch: 3, train_loss: 0.9444, test_loss: 1.0253, test_f1: 0.5657
 epoch: 4, train_loss: 0.9247, test_loss: 1.0050, test_f1: 0.5539
 epoch: 5, train_loss: 0.9100, test_loss: 1.0100, test_f1: 0.5680
 epoch: 6, train_loss: 0.8767, test_loss: 0.9959, test_f1: 0.5898
 epoch: 7, train_loss: 0.8710, test_loss: 0.9916, test_f1: 0.5685
 epoch: 8, train_loss: 0.8568, test_loss: 0.9955, test_f1: 0.5707
 epoch: 9, train_loss: 0.8341, test_loss: 0.9733, test_f1: 0.5977
 epoch: 10, train_loss: 0.8175, test_loss: 0.9868, test_f1: 0.5857
 epoch: 11, train_loss: 0.8088, test_loss: 0.9857, test_f1: 0.6037
 epoch: 12, train_loss: 0.7823, test_loss: 0.9770, test_f1: 0.6143
 epoch: 13, train_loss: 0.7694, test_loss: 0.9749, test_f1: 0.6253
 epoch: 14, train_loss: 0.7495, test_loss: 0.9781, test_f1: 0.6299
 epoch: 15, train_loss: 0.7601, test_loss: 1.0014, test_f1: 0.6189
 epoch: 16, train_loss: 0.7150, test_loss: 0.9996, test_f1: 0.6342
 epoch: 17, train_loss: 0.7254, test_loss: 0.9815, test_f1: 0.6221
 epoch: 18, train_loss: 0.7274, test_loss: 0.9832, test_f1: 0.6084
 epoch: 19, train_loss: 0.7042, test_loss: 0.9925, test_f1: 0.6267
 epoch: 20, train_loss: 0.6842, test_loss: 1.0034, test_f1: 0.6225
 epoch: 21, train_loss: 0.6911, test_loss: 1.0565, test_f1: 0.6006
 epoch: 22, train_loss: 0.6967, test_loss: 1.0263, test_f1: 0.6374
 epoch: 23, train_loss: 0.6584, test_loss: 1.0263, test_f1: 0.6286
 epoch: 24, train_loss: 0.6368, test_loss: 1.0401, test_f1: 0.5937
 epoch: 25, train_loss: 0.6362, test_loss: 1.0294, test_f1: 0.6483
 epoch: 26, train_loss: 0.6351, test_loss: 1.0255, test_f1: 0.6106
 epoch: 27, train_loss: 0.6246, test_loss: 1.0701, test_f1: 0.6362
 epoch: 28, train_loss: 0.6160, test_loss: 1.1477, test_f1: 0.5729
 epoch: 29, train_loss: 0.5956, test_loss: 1.0758, test_f1: 0.6239
 epoch: 30, train_loss: 0.5791, test_loss: 1.0799, test_f1: 0.6208
 epoch: 31, train_loss: 0.5937, test_loss: 1.0695, test_f1: 0.6003
 epoch: 32, train_loss: 0.5736, test_loss: 1.1304, test_f1: 0.5971
 epoch: 33, train_loss: 0.5747, test_loss: 1.1434, test_f1: 0.5928
 epoch: 34, train_loss: 0.5500, test_loss: 1.1206, test_f1: 0.6205
 epoch: 35, train_loss: 0.5494, test_loss: 1.1924, test_f1: 0.5972
 epoch: 36, train_loss: 0.5425, test_loss: 1.1530, test_f1: 0.6008
 epoch: 37, train_loss: 0.5267, test_loss: 1.1754, test_f1: 0.5846
 epoch: 38, train_loss: 0.5182, test_loss: 1.1618, test_f1: 0.5982
 epoch: 39, train_loss: 0.5158, test_loss: 1.1658, test_f1: 0.5834
 epoch: 40, train_loss: 0.4998, test_loss: 1.1870, test_f1: 0.5799
 epoch: 41, train_loss: 0.4951, test_loss: 1.1605, test_f1: 0.5929
 epoch: 42, train_loss: 0.4900, test_loss: 1.1522, test_f1: 0.6107
 epoch: 43, train_loss: 0.4904, test_loss: 1.2017, test_f1: 0.5932
 epoch: 44, train_loss: 0.4928, test_loss: 1.2122, test_f1: 0.6065
 epoch: 45, train_loss: 0.4796, test_loss: 1.2315, test_f1: 0.5856
 epoch: 46, train_loss: 0.4740, test_loss: 1.2811, test_f1: 0.5973
 epoch: 47, train_loss: 0.4628, test_loss: 1.3456, test_f1: 0.5686
 epoch: 48, train_loss: 0.4543, test_loss: 1.3086, test_f1: 0.6039
 epoch: 49, train_loss: 0.4611, test_loss: 1.2786, test_f1: 0.6100
 epoch: 50, train_loss: 0.4395, test_loss: 1.3555, test_f1: 0.5961
 epoch: 51, train_loss: 0.4087, test_loss: 1.2986, test_f1: 0.5983
 epoch: 52, train_loss: 0.4040, test_loss: 1.2832, test_f1: 0.5987
 epoch: 53, train_loss: 0.3939, test_loss: 1.3241, test_f1: 0.5959
 epoch: 54, train_loss: 0.3903, test_loss: 1.2868, test_f1: 0.6140
 epoch: 55, train_loss: 0.3846, test_loss: 1.3426, test_f1: 0.6238
 epoch: 56, train_loss: 0.3823, test_loss: 1.3063, test_f1: 0.6122
 epoch: 57, train_loss: 0.3709, test_loss: 1.3357, test_f1: 0.5959
 epoch: 58, train_loss: 0.3779, test_loss: 1.3823, test_f1: 0.5933
 epoch: 59, train_loss: 0.3735, test_loss: 1.3233, test_f1: 0.6082
 epoch: 60, train_loss: 0.3650, test_loss: 1.3650, test_f1: 0.6059
 epoch: 61, train_loss: 0.3793, test_loss: 1.3807, test_f1: 0.5795
 epoch: 62, train_loss: 0.3552, test_loss: 1.3956, test_f1: 0.6230
 epoch: 63, train_loss: 0.3626, test_loss: 1.4070, test_f1: 0.5898
 epoch: 64, train_loss: 0.3537, test_loss: 1.3933, test_f1: 0.6126
 epoch: 65, train_loss: 0.3599, test_loss: 1.4598, test_f1: 0.5918
 epoch: 66, train_loss: 0.3614, test_loss: 1.4086, test_f1: 0.6002
 epoch: 67, train_loss: 0.3628, test_loss: 1.4698, test_f1: 0.6010
 epoch: 68, train_loss: 0.3286, test_loss: 1.4317, test_f1: 0.6165
 epoch: 69, train_loss: 0.3568, test_loss: 1.4908, test_f1: 0.5913
 epoch: 70, train_loss: 0.3513, test_loss: 1.4312, test_f1: 0.6070
 epoch: 71, train_loss: 0.3271, test_loss: 1.4798, test_f1: 0.6111
 epoch: 72, train_loss: 0.3320, test_loss: 1.5072, test_f1: 0.5993
 epoch: 73, train_loss: 0.3103, test_loss: 1.4969, test_f1: 0.5958
 epoch: 74, train_loss: 0.3198, test_loss: 1.5078, test_f1: 0.5780
 epoch: 75, train_loss: 0.3417, test_loss: 1.5627, test_f1: 0.5810
 epoch: 76, train_loss: 0.3217, test_loss: 1.4962, test_f1: 0.6069
 epoch: 77, train_loss: 0.3092, test_loss: 1.5142, test_f1: 0.5915
 epoch: 78, train_loss: 0.3218, test_loss: 1.5506, test_f1: 0.5901
 epoch: 79, train_loss: 0.2923, test_loss: 1.5082, test_f1: 0.5829
 epoch: 80, train_loss: 0.2919, test_loss: 1.5600, test_f1: 0.5939
 epoch: 81, train_loss: 0.2940, test_loss: 1.5946, test_f1: 0.6033
 epoch: 82, train_loss: 0.2917, test_loss: 1.5951, test_f1: 0.5965
 epoch: 83, train_loss: 0.3053, test_loss: 1.6177, test_f1: 0.6066
 epoch: 84, train_loss: 0.2956, test_loss: 1.6043, test_f1: 0.5752
 epoch: 85, train_loss: 0.2750, test_loss: 1.6720, test_f1: 0.5863
 epoch: 86, train_loss: 0.2854, test_loss: 1.6714, test_f1: 0.5802
 epoch: 87, train_loss: 0.2793, test_loss: 1.6588, test_f1: 0.6160
 epoch: 88, train_loss: 0.2769, test_loss: 1.7041, test_f1: 0.5910
 epoch: 89, train_loss: 0.2796, test_loss: 1.6051, test_f1: 0.6049
 epoch: 90, train_loss: 0.2927, test_loss: 1.6542, test_f1: 0.6007
 epoch: 91, train_loss: 0.2819, test_loss: 1.7234, test_f1: 0.5697
 epoch: 92, train_loss: 0.2579, test_loss: 1.6942, test_f1: 0.5838
 epoch: 93, train_loss: 0.2614, test_loss: 1.7433, test_f1: 0.6078
 epoch: 94, train_loss: 0.2819, test_loss: 1.7120, test_f1: 0.5955
 epoch: 95, train_loss: 0.2767, test_loss: 1.7863, test_f1: 0.5525
 epoch: 96, train_loss: 0.2672, test_loss: 1.7510, test_f1: 0.5824
 epoch: 97, train_loss: 0.2642, test_loss: 1.7666, test_f1: 0.5946
 epoch: 98, train_loss: 0.2535, test_loss: 1.6989, test_f1: 0.5984
 epoch: 99, train_loss: 0.2517, test_loss: 1.7943, test_f1: 0.5853
##################ITERATION #6 ****************************************
 epoch: 0, train_loss: 1.1665, test_loss: 1.2682, test_f1: 0.3271
 epoch: 1, train_loss: 1.0445, test_loss: 1.0676, test_f1: 0.4902
 epoch: 2, train_loss: 0.9913, test_loss: 1.0575, test_f1: 0.5076
 epoch: 3, train_loss: 0.9580, test_loss: 1.0535, test_f1: 0.5086
 epoch: 4, train_loss: 0.9208, test_loss: 1.0417, test_f1: 0.5199
 epoch: 5, train_loss: 0.9081, test_loss: 1.0238, test_f1: 0.5251
 epoch: 6, train_loss: 0.8850, test_loss: 1.0082, test_f1: 0.5586
 epoch: 7, train_loss: 0.8744, test_loss: 1.0024, test_f1: 0.5587
 epoch: 8, train_loss: 0.8510, test_loss: 0.9992, test_f1: 0.5609
 epoch: 9, train_loss: 0.8471, test_loss: 1.0044, test_f1: 0.5774
 epoch: 10, train_loss: 0.8222, test_loss: 0.9826, test_f1: 0.5807
 epoch: 11, train_loss: 0.7967, test_loss: 0.9904, test_f1: 0.5960
 epoch: 12, train_loss: 0.7895, test_loss: 0.9802, test_f1: 0.5748
 epoch: 13, train_loss: 0.7680, test_loss: 0.9604, test_f1: 0.6070
 epoch: 14, train_loss: 0.7597, test_loss: 0.9964, test_f1: 0.6089
 epoch: 15, train_loss: 0.7565, test_loss: 0.9975, test_f1: 0.6118
 epoch: 16, train_loss: 0.7506, test_loss: 0.9990, test_f1: 0.6111
 epoch: 17, train_loss: 0.7355, test_loss: 0.9859, test_f1: 0.5995
 epoch: 18, train_loss: 0.7262, test_loss: 1.0013, test_f1: 0.6197
 epoch: 19, train_loss: 0.7073, test_loss: 0.9878, test_f1: 0.5998
 epoch: 20, train_loss: 0.6941, test_loss: 1.0208, test_f1: 0.6201
 epoch: 21, train_loss: 0.6817, test_loss: 1.0260, test_f1: 0.6116
 epoch: 22, train_loss: 0.6824, test_loss: 1.0075, test_f1: 0.6061
 epoch: 23, train_loss: 0.6709, test_loss: 1.0003, test_f1: 0.6603
 epoch: 24, train_loss: 0.6634, test_loss: 1.0530, test_f1: 0.5934
 epoch: 25, train_loss: 0.6410, test_loss: 1.0280, test_f1: 0.6140
 epoch: 26, train_loss: 0.6534, test_loss: 1.0320, test_f1: 0.6446
 epoch: 27, train_loss: 0.6156, test_loss: 1.0131, test_f1: 0.6252
 epoch: 28, train_loss: 0.6084, test_loss: 1.0515, test_f1: 0.6346
 epoch: 29, train_loss: 0.6242, test_loss: 1.0461, test_f1: 0.6296
 epoch: 30, train_loss: 0.6030, test_loss: 1.0208, test_f1: 0.6237
 epoch: 31, train_loss: 0.5836, test_loss: 1.0417, test_f1: 0.6267
 epoch: 32, train_loss: 0.5857, test_loss: 1.0897, test_f1: 0.6019
 epoch: 33, train_loss: 0.5836, test_loss: 1.0848, test_f1: 0.6365
 epoch: 34, train_loss: 0.5690, test_loss: 1.1093, test_f1: 0.6166
 epoch: 35, train_loss: 0.5652, test_loss: 1.1063, test_f1: 0.6174
 epoch: 36, train_loss: 0.5449, test_loss: 1.1014, test_f1: 0.6105
 epoch: 37, train_loss: 0.5572, test_loss: 1.1408, test_f1: 0.6235
 epoch: 38, train_loss: 0.5406, test_loss: 1.1912, test_f1: 0.6184
 epoch: 39, train_loss: 0.5415, test_loss: 1.1810, test_f1: 0.6121
 epoch: 40, train_loss: 0.5101, test_loss: 1.1530, test_f1: 0.6171
 epoch: 41, train_loss: 0.5271, test_loss: 1.1590, test_f1: 0.6120
 epoch: 42, train_loss: 0.5094, test_loss: 1.1725, test_f1: 0.6283
 epoch: 43, train_loss: 0.5012, test_loss: 1.1856, test_f1: 0.6375
 epoch: 44, train_loss: 0.4766, test_loss: 1.1312, test_f1: 0.6334
 epoch: 45, train_loss: 0.4833, test_loss: 1.1456, test_f1: 0.6411
 epoch: 46, train_loss: 0.4847, test_loss: 1.1702, test_f1: 0.6226
 epoch: 47, train_loss: 0.4685, test_loss: 1.2189, test_f1: 0.6266
 epoch: 48, train_loss: 0.4753, test_loss: 1.2441, test_f1: 0.6504
 epoch: 49, train_loss: 0.4475, test_loss: 1.2436, test_f1: 0.6120
 epoch: 50, train_loss: 0.4256, test_loss: 1.2396, test_f1: 0.6094
 epoch: 51, train_loss: 0.4190, test_loss: 1.2274, test_f1: 0.6447
 epoch: 52, train_loss: 0.4201, test_loss: 1.2745, test_f1: 0.6361
 epoch: 53, train_loss: 0.4093, test_loss: 1.2512, test_f1: 0.6642
 epoch: 54, train_loss: 0.4120, test_loss: 1.2652, test_f1: 0.6585
 epoch: 55, train_loss: 0.3980, test_loss: 1.2942, test_f1: 0.6328
 epoch: 56, train_loss: 0.4153, test_loss: 1.3283, test_f1: 0.6281
 epoch: 57, train_loss: 0.3884, test_loss: 1.2619, test_f1: 0.6480
 epoch: 58, train_loss: 0.3872, test_loss: 1.3200, test_f1: 0.6229
 epoch: 59, train_loss: 0.3756, test_loss: 1.2813, test_f1: 0.6450
 epoch: 60, train_loss: 0.3856, test_loss: 1.2910, test_f1: 0.6438
 epoch: 61, train_loss: 0.3772, test_loss: 1.3261, test_f1: 0.6387
 epoch: 62, train_loss: 0.3520, test_loss: 1.3432, test_f1: 0.6291
 epoch: 63, train_loss: 0.3905, test_loss: 1.3395, test_f1: 0.6242
 epoch: 64, train_loss: 0.3690, test_loss: 1.3349, test_f1: 0.6294
 epoch: 65, train_loss: 0.3737, test_loss: 1.3593, test_f1: 0.6459
 epoch: 66, train_loss: 0.3638, test_loss: 1.3611, test_f1: 0.6342
 epoch: 67, train_loss: 0.3705, test_loss: 1.3734, test_f1: 0.6210
 epoch: 68, train_loss: 0.3697, test_loss: 1.3831, test_f1: 0.6281
 epoch: 69, train_loss: 0.3418, test_loss: 1.4210, test_f1: 0.6263
 epoch: 70, train_loss: 0.3534, test_loss: 1.4474, test_f1: 0.6230
 epoch: 71, train_loss: 0.3410, test_loss: 1.3908, test_f1: 0.6339
 epoch: 72, train_loss: 0.3365, test_loss: 1.3925, test_f1: 0.6236
 epoch: 73, train_loss: 0.3149, test_loss: 1.4341, test_f1: 0.6270
 epoch: 74, train_loss: 0.3180, test_loss: 1.4576, test_f1: 0.6253
 epoch: 75, train_loss: 0.3424, test_loss: 1.4026, test_f1: 0.6368
 epoch: 76, train_loss: 0.3219, test_loss: 1.4686, test_f1: 0.6369
 epoch: 77, train_loss: 0.3040, test_loss: 1.4486, test_f1: 0.6212
 epoch: 78, train_loss: 0.3238, test_loss: 1.4696, test_f1: 0.6340
 epoch: 79, train_loss: 0.3167, test_loss: 1.5046, test_f1: 0.6132
 epoch: 80, train_loss: 0.3066, test_loss: 1.4669, test_f1: 0.6286
 epoch: 81, train_loss: 0.3063, test_loss: 1.4882, test_f1: 0.6039
 epoch: 82, train_loss: 0.3188, test_loss: 1.4994, test_f1: 0.6275
 epoch: 83, train_loss: 0.3205, test_loss: 1.5046, test_f1: 0.6269
 epoch: 84, train_loss: 0.3022, test_loss: 1.4768, test_f1: 0.6264
 epoch: 85, train_loss: 0.3085, test_loss: 1.4877, test_f1: 0.6291
 epoch: 86, train_loss: 0.3098, test_loss: 1.4974, test_f1: 0.6314
 epoch: 87, train_loss: 0.2999, test_loss: 1.4880, test_f1: 0.6238
 epoch: 88, train_loss: 0.3192, test_loss: 1.5634, test_f1: 0.6238
 epoch: 89, train_loss: 0.2884, test_loss: 1.5823, test_f1: 0.6368
 epoch: 90, train_loss: 0.2833, test_loss: 1.5802, test_f1: 0.6241
 epoch: 91, train_loss: 0.3052, test_loss: 1.5504, test_f1: 0.6221
 epoch: 92, train_loss: 0.2941, test_loss: 1.5350, test_f1: 0.6368
 epoch: 93, train_loss: 0.2734, test_loss: 1.6165, test_f1: 0.6269
 epoch: 94, train_loss: 0.2702, test_loss: 1.6129, test_f1: 0.6168
 epoch: 95, train_loss: 0.2866, test_loss: 1.6241, test_f1: 0.6167
 epoch: 96, train_loss: 0.2943, test_loss: 1.6313, test_f1: 0.6145
 epoch: 97, train_loss: 0.2655, test_loss: 1.6439, test_f1: 0.6010
 epoch: 98, train_loss: 0.2699, test_loss: 1.6451, test_f1: 0.6245
 epoch: 99, train_loss: 0.2512, test_loss: 1.7280, test_f1: 0.6152
##################ITERATION #7 ****************************************
 epoch: 0, train_loss: 1.2175, test_loss: 1.2744, test_f1: 0.2722
 epoch: 1, train_loss: 1.0104, test_loss: 1.0454, test_f1: 0.5255
 epoch: 2, train_loss: 0.9781, test_loss: 1.0190, test_f1: 0.5510
 epoch: 3, train_loss: 0.9460, test_loss: 1.0151, test_f1: 0.5553
 epoch: 4, train_loss: 0.9071, test_loss: 1.0120, test_f1: 0.5611
 epoch: 5, train_loss: 0.9202, test_loss: 0.9979, test_f1: 0.5447
 epoch: 6, train_loss: 0.8991, test_loss: 1.0116, test_f1: 0.5860
 epoch: 7, train_loss: 0.8613, test_loss: 0.9958, test_f1: 0.5735
 epoch: 8, train_loss: 0.8529, test_loss: 0.9949, test_f1: 0.5760
 epoch: 9, train_loss: 0.8422, test_loss: 0.9899, test_f1: 0.5867
 epoch: 10, train_loss: 0.8371, test_loss: 0.9979, test_f1: 0.5555
 epoch: 11, train_loss: 0.8293, test_loss: 0.9991, test_f1: 0.5817
 epoch: 12, train_loss: 0.8028, test_loss: 1.0027, test_f1: 0.5850
 epoch: 13, train_loss: 0.7761, test_loss: 1.0004, test_f1: 0.6088
 epoch: 14, train_loss: 0.7534, test_loss: 1.0025, test_f1: 0.5738
 epoch: 15, train_loss: 0.7517, test_loss: 0.9871, test_f1: 0.6025
 epoch: 16, train_loss: 0.7255, test_loss: 1.0064, test_f1: 0.5748
 epoch: 17, train_loss: 0.7278, test_loss: 0.9979, test_f1: 0.6259
 epoch: 18, train_loss: 0.7147, test_loss: 0.9864, test_f1: 0.5998
 epoch: 19, train_loss: 0.7052, test_loss: 0.9907, test_f1: 0.6246
 epoch: 20, train_loss: 0.6933, test_loss: 1.0073, test_f1: 0.5928
 epoch: 21, train_loss: 0.6878, test_loss: 1.0167, test_f1: 0.6082
 epoch: 22, train_loss: 0.6687, test_loss: 0.9892, test_f1: 0.6254
 epoch: 23, train_loss: 0.6605, test_loss: 1.0093, test_f1: 0.6083
 epoch: 24, train_loss: 0.6420, test_loss: 1.0225, test_f1: 0.6261
 epoch: 25, train_loss: 0.6323, test_loss: 1.0445, test_f1: 0.6105
 epoch: 26, train_loss: 0.6207, test_loss: 1.0640, test_f1: 0.5894
 epoch: 27, train_loss: 0.6079, test_loss: 1.0428, test_f1: 0.6054
 epoch: 28, train_loss: 0.5941, test_loss: 1.0424, test_f1: 0.6181
 epoch: 29, train_loss: 0.5878, test_loss: 1.0599, test_f1: 0.6276
 epoch: 30, train_loss: 0.5788, test_loss: 1.0533, test_f1: 0.6239
 epoch: 31, train_loss: 0.6008, test_loss: 1.0954, test_f1: 0.6019
 epoch: 32, train_loss: 0.5776, test_loss: 1.0759, test_f1: 0.5777
 epoch: 33, train_loss: 0.5628, test_loss: 1.0963, test_f1: 0.6360
 epoch: 34, train_loss: 0.5387, test_loss: 1.0965, test_f1: 0.6275
 epoch: 35, train_loss: 0.5687, test_loss: 1.1043, test_f1: 0.6313
 epoch: 36, train_loss: 0.5356, test_loss: 1.1118, test_f1: 0.6318
 epoch: 37, train_loss: 0.5410, test_loss: 1.1259, test_f1: 0.6284
 epoch: 38, train_loss: 0.5189, test_loss: 1.1508, test_f1: 0.6382
 epoch: 39, train_loss: 0.4970, test_loss: 1.1468, test_f1: 0.6136
 epoch: 40, train_loss: 0.5138, test_loss: 1.1763, test_f1: 0.6141
 epoch: 41, train_loss: 0.5055, test_loss: 1.1783, test_f1: 0.6497
 epoch: 42, train_loss: 0.4982, test_loss: 1.1701, test_f1: 0.6309
 epoch: 43, train_loss: 0.4833, test_loss: 1.1860, test_f1: 0.6273
 epoch: 44, train_loss: 0.4893, test_loss: 1.2019, test_f1: 0.6305
 epoch: 45, train_loss: 0.4760, test_loss: 1.2142, test_f1: 0.6177
 epoch: 46, train_loss: 0.4740, test_loss: 1.2625, test_f1: 0.6160
 epoch: 47, train_loss: 0.4815, test_loss: 1.2503, test_f1: 0.6037
 epoch: 48, train_loss: 0.4773, test_loss: 1.2984, test_f1: 0.5988
 epoch: 49, train_loss: 0.4468, test_loss: 1.3130, test_f1: 0.6322
 epoch: 50, train_loss: 0.4520, test_loss: 1.2949, test_f1: 0.6319
 epoch: 51, train_loss: 0.4269, test_loss: 1.2942, test_f1: 0.6376
 epoch: 52, train_loss: 0.4140, test_loss: 1.2998, test_f1: 0.6200
 epoch: 53, train_loss: 0.4011, test_loss: 1.3175, test_f1: 0.6348
 epoch: 54, train_loss: 0.3899, test_loss: 1.3040, test_f1: 0.6141
 epoch: 55, train_loss: 0.4078, test_loss: 1.3101, test_f1: 0.6245
 epoch: 56, train_loss: 0.3938, test_loss: 1.3915, test_f1: 0.6187
 epoch: 57, train_loss: 0.3860, test_loss: 1.3583, test_f1: 0.6213
 epoch: 58, train_loss: 0.3786, test_loss: 1.3733, test_f1: 0.6099
 epoch: 59, train_loss: 0.3769, test_loss: 1.4137, test_f1: 0.6135
 epoch: 60, train_loss: 0.3761, test_loss: 1.4177, test_f1: 0.6090
 epoch: 61, train_loss: 0.3823, test_loss: 1.3973, test_f1: 0.6115
 epoch: 62, train_loss: 0.3785, test_loss: 1.4500, test_f1: 0.6188
 epoch: 63, train_loss: 0.3786, test_loss: 1.4223, test_f1: 0.6169
 epoch: 64, train_loss: 0.3685, test_loss: 1.4176, test_f1: 0.6037
 epoch: 65, train_loss: 0.3679, test_loss: 1.4996, test_f1: 0.5909
 epoch: 66, train_loss: 0.3665, test_loss: 1.4839, test_f1: 0.6184
 epoch: 67, train_loss: 0.3852, test_loss: 1.4702, test_f1: 0.6144
 epoch: 68, train_loss: 0.3391, test_loss: 1.5018, test_f1: 0.6399
 epoch: 69, train_loss: 0.3411, test_loss: 1.5079, test_f1: 0.6160
 epoch: 70, train_loss: 0.3423, test_loss: 1.4958, test_f1: 0.6358
 epoch: 71, train_loss: 0.3444, test_loss: 1.5622, test_f1: 0.5910
 epoch: 72, train_loss: 0.3414, test_loss: 1.5592, test_f1: 0.6203
 epoch: 73, train_loss: 0.3336, test_loss: 1.5349, test_f1: 0.6067
 epoch: 74, train_loss: 0.3206, test_loss: 1.5714, test_f1: 0.6012
 epoch: 75, train_loss: 0.3319, test_loss: 1.5551, test_f1: 0.6177
 epoch: 76, train_loss: 0.3136, test_loss: 1.6125, test_f1: 0.5810
 epoch: 77, train_loss: 0.3184, test_loss: 1.6304, test_f1: 0.6140
 epoch: 78, train_loss: 0.3203, test_loss: 1.6353, test_f1: 0.6106
 epoch: 79, train_loss: 0.3262, test_loss: 1.6216, test_f1: 0.6209
 epoch: 80, train_loss: 0.3138, test_loss: 1.6843, test_f1: 0.6077
 epoch: 81, train_loss: 0.2992, test_loss: 1.6201, test_f1: 0.6184
 epoch: 82, train_loss: 0.2827, test_loss: 1.7346, test_f1: 0.6115
 epoch: 83, train_loss: 0.2971, test_loss: 1.7009, test_f1: 0.6307
 epoch: 84, train_loss: 0.3082, test_loss: 1.7269, test_f1: 0.6311
 epoch: 85, train_loss: 0.2864, test_loss: 1.7316, test_f1: 0.6079
 epoch: 86, train_loss: 0.3232, test_loss: 1.7092, test_f1: 0.6453
 epoch: 87, train_loss: 0.2983, test_loss: 1.6785, test_f1: 0.6280
 epoch: 88, train_loss: 0.2984, test_loss: 1.7584, test_f1: 0.6010
 epoch: 89, train_loss: 0.2855, test_loss: 1.7653, test_f1: 0.6294
 epoch: 90, train_loss: 0.2746, test_loss: 1.8412, test_f1: 0.5834
 epoch: 91, train_loss: 0.2818, test_loss: 1.7763, test_f1: 0.6079
 epoch: 92, train_loss: 0.2883, test_loss: 1.7637, test_f1: 0.6343
 epoch: 93, train_loss: 0.2601, test_loss: 1.8062, test_f1: 0.6084
 epoch: 94, train_loss: 0.2735, test_loss: 1.7719, test_f1: 0.5950
 epoch: 95, train_loss: 0.2575, test_loss: 1.8467, test_f1: 0.6096
 epoch: 96, train_loss: 0.2695, test_loss: 1.8038, test_f1: 0.6198
 epoch: 97, train_loss: 0.2659, test_loss: 1.8386, test_f1: 0.6257
 epoch: 98, train_loss: 0.2563, test_loss: 1.9234, test_f1: 0.5788
 epoch: 99, train_loss: 0.2768, test_loss: 1.8845, test_f1: 0.6034
##################ITERATION #8 ****************************************
 epoch: 0, train_loss: 1.2397, test_loss: 1.5081, test_f1: 0.2722
 epoch: 1, train_loss: 1.0391, test_loss: 1.0473, test_f1: 0.5440
 epoch: 2, train_loss: 0.9899, test_loss: 1.0510, test_f1: 0.5639
 epoch: 3, train_loss: 0.9653, test_loss: 1.0399, test_f1: 0.5642
 epoch: 4, train_loss: 0.9136, test_loss: 1.0418, test_f1: 0.5704
 epoch: 5, train_loss: 0.9011, test_loss: 1.0260, test_f1: 0.5403
 epoch: 6, train_loss: 0.8901, test_loss: 1.0425, test_f1: 0.5604
 epoch: 7, train_loss: 0.8638, test_loss: 1.0149, test_f1: 0.5737
 epoch: 8, train_loss: 0.8676, test_loss: 1.0347, test_f1: 0.5731
 epoch: 9, train_loss: 0.8374, test_loss: 1.0289, test_f1: 0.5673
 epoch: 10, train_loss: 0.8125, test_loss: 1.0211, test_f1: 0.5785
 epoch: 11, train_loss: 0.7862, test_loss: 1.0056, test_f1: 0.6002
 epoch: 12, train_loss: 0.7937, test_loss: 1.0152, test_f1: 0.5795
 epoch: 13, train_loss: 0.7633, test_loss: 1.0062, test_f1: 0.5870
 epoch: 14, train_loss: 0.7529, test_loss: 1.0234, test_f1: 0.5652
 epoch: 15, train_loss: 0.7143, test_loss: 1.0386, test_f1: 0.5891
 epoch: 16, train_loss: 0.7381, test_loss: 1.0121, test_f1: 0.6103
 epoch: 17, train_loss: 0.7280, test_loss: 1.0415, test_f1: 0.5759
 epoch: 18, train_loss: 0.7027, test_loss: 1.0252, test_f1: 0.6051
 epoch: 19, train_loss: 0.7021, test_loss: 1.0593, test_f1: 0.5676
 epoch: 20, train_loss: 0.7114, test_loss: 1.0561, test_f1: 0.6060
 epoch: 21, train_loss: 0.6543, test_loss: 1.0871, test_f1: 0.6004
 epoch: 22, train_loss: 0.6616, test_loss: 1.0844, test_f1: 0.6156
 epoch: 23, train_loss: 0.6475, test_loss: 1.0717, test_f1: 0.6029
 epoch: 24, train_loss: 0.6351, test_loss: 1.1131, test_f1: 0.5872
 epoch: 25, train_loss: 0.6380, test_loss: 1.0655, test_f1: 0.6379
 epoch: 26, train_loss: 0.6145, test_loss: 1.0996, test_f1: 0.6229
 epoch: 27, train_loss: 0.6017, test_loss: 1.0905, test_f1: 0.6084
 epoch: 28, train_loss: 0.5976, test_loss: 1.1047, test_f1: 0.5913
 epoch: 29, train_loss: 0.5879, test_loss: 1.1157, test_f1: 0.6277
 epoch: 30, train_loss: 0.5712, test_loss: 1.1473, test_f1: 0.6212
 epoch: 31, train_loss: 0.5620, test_loss: 1.1515, test_f1: 0.6189
 epoch: 32, train_loss: 0.5574, test_loss: 1.1427, test_f1: 0.6366
 epoch: 33, train_loss: 0.5756, test_loss: 1.1640, test_f1: 0.6282
 epoch: 34, train_loss: 0.5419, test_loss: 1.1707, test_f1: 0.6073
 epoch: 35, train_loss: 0.5355, test_loss: 1.1853, test_f1: 0.6216
 epoch: 36, train_loss: 0.5232, test_loss: 1.1812, test_f1: 0.6303
 epoch: 37, train_loss: 0.5095, test_loss: 1.2613, test_f1: 0.5917
 epoch: 38, train_loss: 0.5023, test_loss: 1.2553, test_f1: 0.6271
 epoch: 39, train_loss: 0.5179, test_loss: 1.2776, test_f1: 0.5911
 epoch: 40, train_loss: 0.5023, test_loss: 1.2716, test_f1: 0.6445
 epoch: 41, train_loss: 0.4664, test_loss: 1.2735, test_f1: 0.6274
 epoch: 42, train_loss: 0.4682, test_loss: 1.3000, test_f1: 0.6215
 epoch: 43, train_loss: 0.4700, test_loss: 1.3252, test_f1: 0.6098
 epoch: 44, train_loss: 0.4549, test_loss: 1.3117, test_f1: 0.6239
 epoch: 45, train_loss: 0.4498, test_loss: 1.2973, test_f1: 0.6165
 epoch: 46, train_loss: 0.4496, test_loss: 1.3727, test_f1: 0.6165
 epoch: 47, train_loss: 0.4510, test_loss: 1.3574, test_f1: 0.6229
 epoch: 48, train_loss: 0.4247, test_loss: 1.4094, test_f1: 0.6164
 epoch: 49, train_loss: 0.4214, test_loss: 1.4195, test_f1: 0.6175
 epoch: 50, train_loss: 0.4184, test_loss: 1.4087, test_f1: 0.6257
 epoch: 51, train_loss: 0.3915, test_loss: 1.4657, test_f1: 0.5946
 epoch: 52, train_loss: 0.3954, test_loss: 1.4650, test_f1: 0.6150
 epoch: 53, train_loss: 0.3885, test_loss: 1.4827, test_f1: 0.6164
 epoch: 54, train_loss: 0.4016, test_loss: 1.4388, test_f1: 0.6247
 epoch: 55, train_loss: 0.3705, test_loss: 1.4289, test_f1: 0.6192
 epoch: 56, train_loss: 0.3808, test_loss: 1.4721, test_f1: 0.6014
 epoch: 57, train_loss: 0.3548, test_loss: 1.5125, test_f1: 0.6075
 epoch: 58, train_loss: 0.3898, test_loss: 1.5161, test_f1: 0.6040
 epoch: 59, train_loss: 0.3767, test_loss: 1.5031, test_f1: 0.6217
 epoch: 60, train_loss: 0.3626, test_loss: 1.5207, test_f1: 0.6147
 epoch: 61, train_loss: 0.3442, test_loss: 1.5862, test_f1: 0.6082
 epoch: 62, train_loss: 0.3525, test_loss: 1.5745, test_f1: 0.6081
 epoch: 63, train_loss: 0.3388, test_loss: 1.5642, test_f1: 0.6140
 epoch: 64, train_loss: 0.3328, test_loss: 1.5138, test_f1: 0.6162
 epoch: 65, train_loss: 0.3373, test_loss: 1.5434, test_f1: 0.6141
 epoch: 66, train_loss: 0.3288, test_loss: 1.5996, test_f1: 0.6096
 epoch: 67, train_loss: 0.3474, test_loss: 1.5468, test_f1: 0.6191
 epoch: 68, train_loss: 0.3299, test_loss: 1.6203, test_f1: 0.6091
 epoch: 69, train_loss: 0.3377, test_loss: 1.5387, test_f1: 0.6188
 epoch: 70, train_loss: 0.3337, test_loss: 1.6033, test_f1: 0.6010
 epoch: 71, train_loss: 0.3305, test_loss: 1.6413, test_f1: 0.6061
 epoch: 72, train_loss: 0.3093, test_loss: 1.6084, test_f1: 0.6113
 epoch: 73, train_loss: 0.3306, test_loss: 1.6368, test_f1: 0.6135
 epoch: 74, train_loss: 0.3031, test_loss: 1.6325, test_f1: 0.6135
 epoch: 75, train_loss: 0.3217, test_loss: 1.6908, test_f1: 0.6209
 epoch: 76, train_loss: 0.3127, test_loss: 1.7714, test_f1: 0.6291
 epoch: 77, train_loss: 0.3101, test_loss: 1.6637, test_f1: 0.6130
 epoch: 78, train_loss: 0.2951, test_loss: 1.6788, test_f1: 0.6058
 epoch: 79, train_loss: 0.2938, test_loss: 1.7183, test_f1: 0.6263
 epoch: 80, train_loss: 0.3178, test_loss: 1.7401, test_f1: 0.6202
 epoch: 81, train_loss: 0.2881, test_loss: 1.7903, test_f1: 0.6063
 epoch: 82, train_loss: 0.2826, test_loss: 1.7173, test_f1: 0.5985
 epoch: 83, train_loss: 0.2808, test_loss: 1.8056, test_f1: 0.6087
 epoch: 84, train_loss: 0.2658, test_loss: 1.7821, test_f1: 0.6133
 epoch: 85, train_loss: 0.2785, test_loss: 1.7842, test_f1: 0.6006
 epoch: 86, train_loss: 0.2751, test_loss: 1.7734, test_f1: 0.6093
 epoch: 87, train_loss: 0.2836, test_loss: 1.7988, test_f1: 0.6095
 epoch: 88, train_loss: 0.2715, test_loss: 1.8338, test_f1: 0.6178
 epoch: 89, train_loss: 0.2859, test_loss: 1.8002, test_f1: 0.6005
 epoch: 90, train_loss: 0.2769, test_loss: 1.8406, test_f1: 0.6152
 epoch: 91, train_loss: 0.2612, test_loss: 1.8667, test_f1: 0.6167
 epoch: 92, train_loss: 0.2459, test_loss: 1.8649, test_f1: 0.6202
 epoch: 93, train_loss: 0.2513, test_loss: 1.9463, test_f1: 0.6057
 epoch: 94, train_loss: 0.2650, test_loss: 1.8866, test_f1: 0.6058
 epoch: 95, train_loss: 0.2670, test_loss: 1.9418, test_f1: 0.6262
 epoch: 96, train_loss: 0.2774, test_loss: 1.8882, test_f1: 0.6264
 epoch: 97, train_loss: 0.2714, test_loss: 1.9439, test_f1: 0.6157
 epoch: 98, train_loss: 0.2770, test_loss: 1.9458, test_f1: 0.6112
 epoch: 99, train_loss: 0.2460, test_loss: 1.9986, test_f1: 0.6213
##################ITERATION #9 ****************************************
 epoch: 0, train_loss: 1.2506, test_loss: 1.2106, test_f1: 0.3871
 epoch: 1, train_loss: 1.0501, test_loss: 1.0965, test_f1: 0.4633
 epoch: 2, train_loss: 1.0006, test_loss: 1.0718, test_f1: 0.4957
 epoch: 3, train_loss: 0.9677, test_loss: 1.0482, test_f1: 0.5520
 epoch: 4, train_loss: 0.9237, test_loss: 1.0296, test_f1: 0.5351
 epoch: 5, train_loss: 0.9083, test_loss: 1.0308, test_f1: 0.5592
 epoch: 6, train_loss: 0.8821, test_loss: 1.0248, test_f1: 0.5528
 epoch: 7, train_loss: 0.8825, test_loss: 1.0232, test_f1: 0.5329
 epoch: 8, train_loss: 0.8443, test_loss: 1.0477, test_f1: 0.4981
 epoch: 9, train_loss: 0.8302, test_loss: 1.0630, test_f1: 0.5140
 epoch: 10, train_loss: 0.8057, test_loss: 1.0229, test_f1: 0.5625
 epoch: 11, train_loss: 0.8020, test_loss: 1.0194, test_f1: 0.5435
 epoch: 12, train_loss: 0.7788, test_loss: 1.0501, test_f1: 0.5389
 epoch: 13, train_loss: 0.7723, test_loss: 1.0504, test_f1: 0.5719
 epoch: 14, train_loss: 0.7513, test_loss: 1.0334, test_f1: 0.5363
 epoch: 15, train_loss: 0.7488, test_loss: 1.0785, test_f1: 0.5719
 epoch: 16, train_loss: 0.7358, test_loss: 1.0641, test_f1: 0.5368
 epoch: 17, train_loss: 0.7241, test_loss: 1.0568, test_f1: 0.5522
 epoch: 18, train_loss: 0.7234, test_loss: 1.0671, test_f1: 0.5293
 epoch: 19, train_loss: 0.7012, test_loss: 1.0585, test_f1: 0.5539
 epoch: 20, train_loss: 0.6744, test_loss: 1.0771, test_f1: 0.5865
 epoch: 21, train_loss: 0.6775, test_loss: 1.1303, test_f1: 0.5793
 epoch: 22, train_loss: 0.6707, test_loss: 1.0998, test_f1: 0.5441
 epoch: 23, train_loss: 0.6575, test_loss: 1.1163, test_f1: 0.5548
 epoch: 24, train_loss: 0.6391, test_loss: 1.1489, test_f1: 0.5842
 epoch: 25, train_loss: 0.6553, test_loss: 1.1340, test_f1: 0.5712
 epoch: 26, train_loss: 0.6367, test_loss: 1.1038, test_f1: 0.5687
 epoch: 27, train_loss: 0.5956, test_loss: 1.1690, test_f1: 0.5360
 epoch: 28, train_loss: 0.6012, test_loss: 1.1549, test_f1: 0.6128
 epoch: 29, train_loss: 0.5997, test_loss: 1.2195, test_f1: 0.5614
 epoch: 30, train_loss: 0.5939, test_loss: 1.1662, test_f1: 0.5575
 epoch: 31, train_loss: 0.5902, test_loss: 1.2323, test_f1: 0.5417
 epoch: 32, train_loss: 0.5745, test_loss: 1.2220, test_f1: 0.5494
 epoch: 33, train_loss: 0.5494, test_loss: 1.1580, test_f1: 0.5701
 epoch: 34, train_loss: 0.5618, test_loss: 1.1943, test_f1: 0.5728
 epoch: 35, train_loss: 0.5436, test_loss: 1.2245, test_f1: 0.5734
 epoch: 36, train_loss: 0.5420, test_loss: 1.2169, test_f1: 0.5880
 epoch: 37, train_loss: 0.5568, test_loss: 1.1684, test_f1: 0.6151
 epoch: 38, train_loss: 0.5122, test_loss: 1.2461, test_f1: 0.5786
 epoch: 39, train_loss: 0.5070, test_loss: 1.2321, test_f1: 0.6259
 epoch: 40, train_loss: 0.5037, test_loss: 1.2655, test_f1: 0.6366
 epoch: 41, train_loss: 0.4984, test_loss: 1.2645, test_f1: 0.5777
 epoch: 42, train_loss: 0.5087, test_loss: 1.2743, test_f1: 0.6249
 epoch: 43, train_loss: 0.4671, test_loss: 1.2553, test_f1: 0.6084
 epoch: 44, train_loss: 0.4774, test_loss: 1.3349, test_f1: 0.6275
 epoch: 45, train_loss: 0.4547, test_loss: 1.3423, test_f1: 0.5616
 epoch: 46, train_loss: 0.4578, test_loss: 1.3246, test_f1: 0.6076
 epoch: 47, train_loss: 0.4712, test_loss: 1.3686, test_f1: 0.6026
 epoch: 48, train_loss: 0.4386, test_loss: 1.3816, test_f1: 0.6218
 epoch: 49, train_loss: 0.4410, test_loss: 1.4458, test_f1: 0.5702
 epoch: 50, train_loss: 0.4515, test_loss: 1.2820, test_f1: 0.6056
 epoch: 51, train_loss: 0.4203, test_loss: 1.3729, test_f1: 0.6055
 epoch: 52, train_loss: 0.4044, test_loss: 1.3490, test_f1: 0.5975
 epoch: 53, train_loss: 0.4171, test_loss: 1.3817, test_f1: 0.5874
 epoch: 54, train_loss: 0.3950, test_loss: 1.3913, test_f1: 0.6203
 epoch: 55, train_loss: 0.4020, test_loss: 1.4420, test_f1: 0.5879
 epoch: 56, train_loss: 0.3881, test_loss: 1.4310, test_f1: 0.6134
 epoch: 57, train_loss: 0.3651, test_loss: 1.4616, test_f1: 0.6134
 epoch: 58, train_loss: 0.3834, test_loss: 1.4353, test_f1: 0.6123
 epoch: 59, train_loss: 0.3697, test_loss: 1.4249, test_f1: 0.6221
 epoch: 60, train_loss: 0.3707, test_loss: 1.5045, test_f1: 0.5864
 epoch: 61, train_loss: 0.3751, test_loss: 1.4507, test_f1: 0.6175
 epoch: 62, train_loss: 0.3781, test_loss: 1.5112, test_f1: 0.5882
 epoch: 63, train_loss: 0.3483, test_loss: 1.5056, test_f1: 0.5969
 epoch: 64, train_loss: 0.3532, test_loss: 1.5179, test_f1: 0.5898
 epoch: 65, train_loss: 0.3339, test_loss: 1.5721, test_f1: 0.5716
 epoch: 66, train_loss: 0.3583, test_loss: 1.4856, test_f1: 0.6362
 epoch: 67, train_loss: 0.3412, test_loss: 1.5368, test_f1: 0.6049
 epoch: 68, train_loss: 0.3324, test_loss: 1.5350, test_f1: 0.6210
 epoch: 69, train_loss: 0.3382, test_loss: 1.4967, test_f1: 0.6433
 epoch: 70, train_loss: 0.3318, test_loss: 1.5960, test_f1: 0.6249
 epoch: 71, train_loss: 0.3376, test_loss: 1.6009, test_f1: 0.6290
 epoch: 72, train_loss: 0.3324, test_loss: 1.5756, test_f1: 0.6299
 epoch: 73, train_loss: 0.3368, test_loss: 1.5656, test_f1: 0.6215
 epoch: 74, train_loss: 0.3394, test_loss: 1.6218, test_f1: 0.6085
 epoch: 75, train_loss: 0.3051, test_loss: 1.6590, test_f1: 0.6181
 epoch: 76, train_loss: 0.3212, test_loss: 1.6752, test_f1: 0.6181
 epoch: 77, train_loss: 0.3182, test_loss: 1.6598, test_f1: 0.6044
 epoch: 78, train_loss: 0.3070, test_loss: 1.6672, test_f1: 0.6054
 epoch: 79, train_loss: 0.3175, test_loss: 1.6921, test_f1: 0.6283
 epoch: 80, train_loss: 0.3108, test_loss: 1.6480, test_f1: 0.6464
 epoch: 81, train_loss: 0.2983, test_loss: 1.6317, test_f1: 0.6196
 epoch: 82, train_loss: 0.3216, test_loss: 1.6291, test_f1: 0.6125
 epoch: 83, train_loss: 0.2937, test_loss: 1.7252, test_f1: 0.6146
 epoch: 84, train_loss: 0.2918, test_loss: 1.7043, test_f1: 0.5928
 epoch: 85, train_loss: 0.2901, test_loss: 1.6715, test_f1: 0.6199
 epoch: 86, train_loss: 0.3229, test_loss: 1.7619, test_f1: 0.6385
 epoch: 87, train_loss: 0.2878, test_loss: 1.7581, test_f1: 0.5882
 epoch: 88, train_loss: 0.2771, test_loss: 1.7009, test_f1: 0.6287
 epoch: 89, train_loss: 0.2760, test_loss: 1.7733, test_f1: 0.5935
 epoch: 90, train_loss: 0.2663, test_loss: 1.7705, test_f1: 0.5869
 epoch: 91, train_loss: 0.2905, test_loss: 1.7732, test_f1: 0.6201
 epoch: 92, train_loss: 0.2783, test_loss: 1.7260, test_f1: 0.6362
 epoch: 93, train_loss: 0.2655, test_loss: 1.7706, test_f1: 0.5934
 epoch: 94, train_loss: 0.2719, test_loss: 1.7643, test_f1: 0.6427
 epoch: 95, train_loss: 0.2802, test_loss: 1.8183, test_f1: 0.5854
 epoch: 96, train_loss: 0.2869, test_loss: 1.7869, test_f1: 0.6373
 epoch: 97, train_loss: 0.2607, test_loss: 1.8668, test_f1: 0.6352
 epoch: 98, train_loss: 0.2262, test_loss: 1.8459, test_f1: 0.6262
 epoch: 99, train_loss: 0.2475, test_loss: 1.8817, test_f1: 0.5901

Training completed in 896.44 seconds
Best F1: 0.6805 at epoch 69
Mean F1 across iterations: 0.6594  0.0118
========================FINAL RESULTS================================
FEGIN weighted F1: 0.6805  0.0118
python main.py --data ltspice_demos --representation component_pin_net --model FEGIN --layers 3 --hiddens 128 --batch_size 32 --lr 0.0001 --emb_size 128 --epochs 100 --save_appendix component_pin_net_L3_H128_BS32_LR0.0001_E128 --no_val
-----



STDERR:
  File "main.py", line 370, in <module>
    main()
  File "main.py", line 254, in main
    dataset = dataset_class(
  File "/home/philip/projects/ltspice_examples_code_repo/Circuit-Completion-Using-GNNs/component_classification_with_link_prediction_head/evaluation/FEGIN/kernel/circuit_datasets.py", line 15, in __init__
    self.data, self.slices = torch.load(self.processed_paths[0])
  File "/home/philip/.local/lib/python3.8/site-packages/torch/serialization.py", line 1040, in load
    warnings.warn(
  File "/usr/lib/python3.8/warnings.py", line 109, in _showwarnmsg
    sw(msg.message, msg.category, msg.filename, msg.lineno,
  File "main.py", line 47, in warn_with_traceback
    traceback.print_stack(file=log)
/home/philip/projects/ltspice_examples_code_repo/Circuit-Completion-Using-GNNs/component_classification_with_link_prediction_head/evaluation/FEGIN/kernel/circuit_datasets.py:15: FutureWarning: You are using `torch.load` with `weights_only=False` (the current default value), which uses the default pickle module implicitly. It is possible to construct malicious pickle data which will execute arbitrary code during unpickling (See https://github.com/pytorch/pytorch/blob/main/SECURITY.md#untrusted-models for more details). In a future release, the default value for `weights_only` will be flipped to `True`. This limits the functions that could be executed during unpickling. Arbitrary objects will no longer be allowed to be loaded via this mode unless they are explicitly allowlisted by the user via `torch.serialization.add_safe_globals`. We recommend you start setting `weights_only=True` for any use case where you don't have full control of the loaded file. Please open an issue on GitHub for any issues related to this experimental feature.
  self.data, self.slices = torch.load(self.processed_paths[0])
