STDOUT:
Results will be saved in /home/philip/projects/ltspice_examples_code_repo/Circuit-Completion-Using-GNNs/component_classification_with_link_prediction_head/evaluation/FEGIN/results/model_FEGIN_dataset_ltspice_examples
Command line input: python main.py --data ltspice_examples --representation component_net --model FEGIN --layers 3 --hiddens 32 --batch_size 64 --lr 0.001 --emb_size 128 --epochs 100 --save_appendix component_net_L3_H32_BS64_LR0.001_E128 --no_val
 is saved.
-----
ltspice_examples - FEGIN
Using 3 layers, 32 hidden units, h = 2
Loading component_net representation dataset
ENTERED
Training FEGIN on component_net representation
Train: 3558, Test: 846
##################ITERATION #0 ****************************************
 epoch: 0, train_loss: 1.3113, test_loss: 1.2365, test_f1: 0.2392
 epoch: 1, train_loss: 1.1890, test_loss: 1.1290, test_f1: 0.3720
 epoch: 2, train_loss: 1.1146, test_loss: 1.0611, test_f1: 0.4510
 epoch: 3, train_loss: 1.0619, test_loss: 0.9953, test_f1: 0.4525
 epoch: 4, train_loss: 1.0052, test_loss: 1.0714, test_f1: 0.4472
 epoch: 5, train_loss: 0.9895, test_loss: 0.9610, test_f1: 0.4966
 epoch: 6, train_loss: 0.9620, test_loss: 1.0280, test_f1: 0.4563
 epoch: 7, train_loss: 0.9466, test_loss: 0.9579, test_f1: 0.4972
 epoch: 8, train_loss: 0.9282, test_loss: 0.9500, test_f1: 0.5115
 epoch: 9, train_loss: 0.9153, test_loss: 0.9556, test_f1: 0.5239
 epoch: 10, train_loss: 0.9191, test_loss: 0.9636, test_f1: 0.5084
 epoch: 11, train_loss: 0.9136, test_loss: 0.9593, test_f1: 0.5149
 epoch: 12, train_loss: 0.9009, test_loss: 0.9476, test_f1: 0.5308
 epoch: 13, train_loss: 0.8917, test_loss: 0.9662, test_f1: 0.5127
 epoch: 14, train_loss: 0.8861, test_loss: 0.9750, test_f1: 0.5403
 epoch: 15, train_loss: 0.8691, test_loss: 0.9541, test_f1: 0.5405
 epoch: 16, train_loss: 0.8637, test_loss: 0.9370, test_f1: 0.5393
 epoch: 17, train_loss: 0.8603, test_loss: 1.0100, test_f1: 0.4741
 epoch: 18, train_loss: 0.8528, test_loss: 0.9531, test_f1: 0.5295
 epoch: 19, train_loss: 0.8416, test_loss: 0.9491, test_f1: 0.5545
 epoch: 20, train_loss: 0.8426, test_loss: 0.9520, test_f1: 0.5511
 epoch: 21, train_loss: 0.8411, test_loss: 0.9442, test_f1: 0.5913
 epoch: 22, train_loss: 0.8219, test_loss: 0.9365, test_f1: 0.5808
 epoch: 23, train_loss: 0.8376, test_loss: 0.9304, test_f1: 0.5648
 epoch: 24, train_loss: 0.8084, test_loss: 0.9680, test_f1: 0.5723
 epoch: 25, train_loss: 0.8094, test_loss: 1.0262, test_f1: 0.5178
 epoch: 26, train_loss: 0.8086, test_loss: 0.9911, test_f1: 0.5685
 epoch: 27, train_loss: 0.8011, test_loss: 0.9882, test_f1: 0.5601
 epoch: 28, train_loss: 0.8026, test_loss: 0.9850, test_f1: 0.5732
 epoch: 29, train_loss: 0.7989, test_loss: 0.9745, test_f1: 0.5515
 epoch: 30, train_loss: 0.7972, test_loss: 0.9191, test_f1: 0.5878
 epoch: 31, train_loss: 0.7927, test_loss: 1.0291, test_f1: 0.5218
 epoch: 32, train_loss: 0.7980, test_loss: 0.9721, test_f1: 0.5776
 epoch: 33, train_loss: 0.7812, test_loss: 0.9803, test_f1: 0.5610
 epoch: 34, train_loss: 0.7856, test_loss: 1.0484, test_f1: 0.5111
 epoch: 35, train_loss: 0.7760, test_loss: 0.9208, test_f1: 0.5958
 epoch: 36, train_loss: 0.7749, test_loss: 0.9931, test_f1: 0.5406
 epoch: 37, train_loss: 0.7803, test_loss: 0.9366, test_f1: 0.5860
 epoch: 38, train_loss: 0.7627, test_loss: 0.9632, test_f1: 0.5694
 epoch: 39, train_loss: 0.7637, test_loss: 0.9662, test_f1: 0.5823
 epoch: 40, train_loss: 0.7570, test_loss: 1.0409, test_f1: 0.5423
 epoch: 41, train_loss: 0.7555, test_loss: 1.0055, test_f1: 0.5435
 epoch: 42, train_loss: 0.7576, test_loss: 1.0197, test_f1: 0.5492
 epoch: 43, train_loss: 0.7502, test_loss: 0.9564, test_f1: 0.5930
 epoch: 44, train_loss: 0.7404, test_loss: 0.9933, test_f1: 0.5688
 epoch: 45, train_loss: 0.7456, test_loss: 0.9913, test_f1: 0.5447
 epoch: 46, train_loss: 0.7454, test_loss: 0.9746, test_f1: 0.6065
 epoch: 47, train_loss: 0.7438, test_loss: 0.9738, test_f1: 0.5718
 epoch: 48, train_loss: 0.7283, test_loss: 1.0069, test_f1: 0.5936
 epoch: 49, train_loss: 0.7289, test_loss: 0.9462, test_f1: 0.6239
 epoch: 50, train_loss: 0.7246, test_loss: 0.9857, test_f1: 0.5701
 epoch: 51, train_loss: 0.7055, test_loss: 0.9464, test_f1: 0.6108
 epoch: 52, train_loss: 0.6930, test_loss: 0.9190, test_f1: 0.6142
 epoch: 53, train_loss: 0.6852, test_loss: 0.9721, test_f1: 0.5958
 epoch: 54, train_loss: 0.6953, test_loss: 0.9870, test_f1: 0.6073
 epoch: 55, train_loss: 0.6961, test_loss: 0.9310, test_f1: 0.6086
 epoch: 56, train_loss: 0.6872, test_loss: 0.9749, test_f1: 0.5887
 epoch: 57, train_loss: 0.6828, test_loss: 0.9383, test_f1: 0.6042
 epoch: 58, train_loss: 0.6839, test_loss: 0.9851, test_f1: 0.6004
 epoch: 59, train_loss: 0.6887, test_loss: 1.0267, test_f1: 0.6035
 epoch: 60, train_loss: 0.6710, test_loss: 0.9900, test_f1: 0.6030
 epoch: 61, train_loss: 0.6842, test_loss: 0.9040, test_f1: 0.6148
 epoch: 62, train_loss: 0.6663, test_loss: 0.9469, test_f1: 0.5872
 epoch: 63, train_loss: 0.6659, test_loss: 1.0005, test_f1: 0.5971
 epoch: 64, train_loss: 0.6754, test_loss: 0.9829, test_f1: 0.5781
 epoch: 65, train_loss: 0.6761, test_loss: 0.9825, test_f1: 0.5788
 epoch: 66, train_loss: 0.6701, test_loss: 0.9898, test_f1: 0.6096
 epoch: 67, train_loss: 0.6654, test_loss: 0.9706, test_f1: 0.6112
 epoch: 68, train_loss: 0.6696, test_loss: 0.9950, test_f1: 0.5868
 epoch: 69, train_loss: 0.6575, test_loss: 0.9799, test_f1: 0.5871
 epoch: 70, train_loss: 0.6528, test_loss: 0.9510, test_f1: 0.6215
 epoch: 71, train_loss: 0.6663, test_loss: 0.9859, test_f1: 0.5889
 epoch: 72, train_loss: 0.6462, test_loss: 1.0473, test_f1: 0.5836
 epoch: 73, train_loss: 0.6383, test_loss: 0.9672, test_f1: 0.6085
 epoch: 74, train_loss: 0.6668, test_loss: 0.9665, test_f1: 0.6177
 epoch: 75, train_loss: 0.6421, test_loss: 1.0259, test_f1: 0.5894
 epoch: 76, train_loss: 0.6445, test_loss: 0.9167, test_f1: 0.6052
 epoch: 77, train_loss: 0.6482, test_loss: 0.9829, test_f1: 0.6280
 epoch: 78, train_loss: 0.6376, test_loss: 0.9658, test_f1: 0.6131
 epoch: 79, train_loss: 0.6317, test_loss: 0.9591, test_f1: 0.6186
 epoch: 80, train_loss: 0.6343, test_loss: 1.0451, test_f1: 0.5965
 epoch: 81, train_loss: 0.6300, test_loss: 1.0669, test_f1: 0.5825
 epoch: 82, train_loss: 0.6402, test_loss: 0.9754, test_f1: 0.6268
 epoch: 83, train_loss: 0.6255, test_loss: 1.0433, test_f1: 0.5937
 epoch: 84, train_loss: 0.6334, test_loss: 1.0585, test_f1: 0.5936
 epoch: 85, train_loss: 0.6204, test_loss: 0.9907, test_f1: 0.6372
 epoch: 86, train_loss: 0.6329, test_loss: 1.0335, test_f1: 0.6039
 epoch: 87, train_loss: 0.6205, test_loss: 1.0218, test_f1: 0.5851
 epoch: 88, train_loss: 0.6271, test_loss: 1.1666, test_f1: 0.5860
 epoch: 89, train_loss: 0.6269, test_loss: 1.0901, test_f1: 0.5725
 epoch: 90, train_loss: 0.6137, test_loss: 1.0299, test_f1: 0.6075
 epoch: 91, train_loss: 0.6152, test_loss: 0.9783, test_f1: 0.6305
 epoch: 92, train_loss: 0.6177, test_loss: 1.0634, test_f1: 0.6042
 epoch: 93, train_loss: 0.6006, test_loss: 1.0815, test_f1: 0.5802
 epoch: 94, train_loss: 0.6044, test_loss: 1.0605, test_f1: 0.6128
 epoch: 95, train_loss: 0.6008, test_loss: 1.0327, test_f1: 0.6057
 epoch: 96, train_loss: 0.5970, test_loss: 1.0575, test_f1: 0.6161
 epoch: 97, train_loss: 0.6076, test_loss: 1.0823, test_f1: 0.5947
 epoch: 98, train_loss: 0.5902, test_loss: 1.0741, test_f1: 0.5791
 epoch: 99, train_loss: 0.5984, test_loss: 1.0977, test_f1: 0.6056
##################ITERATION #1 ****************************************
 epoch: 0, train_loss: 1.2055, test_loss: 1.1314, test_f1: 0.3896
 epoch: 1, train_loss: 1.0576, test_loss: 0.9820, test_f1: 0.4854
 epoch: 2, train_loss: 1.0110, test_loss: 0.9908, test_f1: 0.4467
 epoch: 3, train_loss: 0.9874, test_loss: 0.9647, test_f1: 0.4792
 epoch: 4, train_loss: 0.9655, test_loss: 0.9402, test_f1: 0.5001
 epoch: 5, train_loss: 0.9569, test_loss: 0.9558, test_f1: 0.4699
 epoch: 6, train_loss: 0.9483, test_loss: 0.9714, test_f1: 0.4861
 epoch: 7, train_loss: 0.9356, test_loss: 0.9483, test_f1: 0.4957
 epoch: 8, train_loss: 0.9294, test_loss: 0.9377, test_f1: 0.5113
 epoch: 9, train_loss: 0.9265, test_loss: 0.9270, test_f1: 0.5283
 epoch: 10, train_loss: 0.9141, test_loss: 0.9222, test_f1: 0.5065
 epoch: 11, train_loss: 0.9124, test_loss: 0.9099, test_f1: 0.5062
 epoch: 12, train_loss: 0.8935, test_loss: 0.9383, test_f1: 0.5280
 epoch: 13, train_loss: 0.8897, test_loss: 0.9223, test_f1: 0.5194
 epoch: 14, train_loss: 0.8767, test_loss: 0.9391, test_f1: 0.5696
 epoch: 15, train_loss: 0.8805, test_loss: 0.9888, test_f1: 0.4928
 epoch: 16, train_loss: 0.8807, test_loss: 0.9327, test_f1: 0.5411
 epoch: 17, train_loss: 0.8718, test_loss: 0.9003, test_f1: 0.5360
 epoch: 18, train_loss: 0.8662, test_loss: 0.9434, test_f1: 0.5382
 epoch: 19, train_loss: 0.8646, test_loss: 0.8997, test_f1: 0.5574
 epoch: 20, train_loss: 0.8566, test_loss: 0.9291, test_f1: 0.5402
 epoch: 21, train_loss: 0.8562, test_loss: 0.9711, test_f1: 0.5534
 epoch: 22, train_loss: 0.8535, test_loss: 0.9314, test_f1: 0.5587
 epoch: 23, train_loss: 0.8363, test_loss: 0.9626, test_f1: 0.5483
 epoch: 24, train_loss: 0.8434, test_loss: 0.9286, test_f1: 0.5627
 epoch: 25, train_loss: 0.8536, test_loss: 0.9691, test_f1: 0.5276
 epoch: 26, train_loss: 0.8375, test_loss: 0.9774, test_f1: 0.5562
 epoch: 27, train_loss: 0.8255, test_loss: 0.9438, test_f1: 0.5868
 epoch: 28, train_loss: 0.8237, test_loss: 0.9360, test_f1: 0.5658
 epoch: 29, train_loss: 0.8220, test_loss: 0.9525, test_f1: 0.5376
 epoch: 30, train_loss: 0.8230, test_loss: 0.9581, test_f1: 0.5629
 epoch: 31, train_loss: 0.8185, test_loss: 0.9405, test_f1: 0.5834
 epoch: 32, train_loss: 0.8053, test_loss: 0.9198, test_f1: 0.5532
 epoch: 33, train_loss: 0.7998, test_loss: 0.9669, test_f1: 0.5648
 epoch: 34, train_loss: 0.7911, test_loss: 0.9274, test_f1: 0.5618
 epoch: 35, train_loss: 0.8010, test_loss: 0.9464, test_f1: 0.5643
 epoch: 36, train_loss: 0.7988, test_loss: 0.9470, test_f1: 0.5593
 epoch: 37, train_loss: 0.7927, test_loss: 0.9706, test_f1: 0.5518
 epoch: 38, train_loss: 0.7823, test_loss: 0.9265, test_f1: 0.5693
 epoch: 39, train_loss: 0.7705, test_loss: 0.9180, test_f1: 0.5905
 epoch: 40, train_loss: 0.7676, test_loss: 0.9670, test_f1: 0.5963
 epoch: 41, train_loss: 0.7570, test_loss: 0.9410, test_f1: 0.5685
 epoch: 42, train_loss: 0.7731, test_loss: 0.9500, test_f1: 0.5669
 epoch: 43, train_loss: 0.7598, test_loss: 0.9307, test_f1: 0.5768
 epoch: 44, train_loss: 0.7696, test_loss: 0.9432, test_f1: 0.5833
 epoch: 45, train_loss: 0.7574, test_loss: 0.9368, test_f1: 0.5991
 epoch: 46, train_loss: 0.7565, test_loss: 0.9353, test_f1: 0.5589
 epoch: 47, train_loss: 0.7435, test_loss: 0.9030, test_f1: 0.5975
 epoch: 48, train_loss: 0.7302, test_loss: 0.9296, test_f1: 0.6292
 epoch: 49, train_loss: 0.7307, test_loss: 0.9527, test_f1: 0.5799
 epoch: 50, train_loss: 0.7399, test_loss: 0.9504, test_f1: 0.5583
 epoch: 51, train_loss: 0.7169, test_loss: 0.9245, test_f1: 0.5926
 epoch: 52, train_loss: 0.7153, test_loss: 0.9223, test_f1: 0.6383
 epoch: 53, train_loss: 0.7043, test_loss: 0.8994, test_f1: 0.5924
 epoch: 54, train_loss: 0.7107, test_loss: 0.9128, test_f1: 0.6156
 epoch: 55, train_loss: 0.7034, test_loss: 0.8685, test_f1: 0.6080
 epoch: 56, train_loss: 0.6963, test_loss: 0.8898, test_f1: 0.5991
 epoch: 57, train_loss: 0.6891, test_loss: 0.9003, test_f1: 0.5912
 epoch: 58, train_loss: 0.6927, test_loss: 0.8771, test_f1: 0.6301
 epoch: 59, train_loss: 0.6945, test_loss: 0.8695, test_f1: 0.6686
 epoch: 60, train_loss: 0.6794, test_loss: 0.8957, test_f1: 0.6043
 epoch: 61, train_loss: 0.6872, test_loss: 0.9120, test_f1: 0.6168
 epoch: 62, train_loss: 0.6828, test_loss: 0.9318, test_f1: 0.5944
 epoch: 63, train_loss: 0.6806, test_loss: 0.9301, test_f1: 0.6210
 epoch: 64, train_loss: 0.6858, test_loss: 0.9052, test_f1: 0.6476
 epoch: 65, train_loss: 0.6892, test_loss: 0.9109, test_f1: 0.6064
 epoch: 66, train_loss: 0.6829, test_loss: 0.9387, test_f1: 0.6263
 epoch: 67, train_loss: 0.6725, test_loss: 0.9009, test_f1: 0.6252
 epoch: 68, train_loss: 0.6730, test_loss: 0.8998, test_f1: 0.6270
 epoch: 69, train_loss: 0.6756, test_loss: 0.9157, test_f1: 0.6185
 epoch: 70, train_loss: 0.6643, test_loss: 0.9120, test_f1: 0.6117
 epoch: 71, train_loss: 0.6727, test_loss: 0.8868, test_f1: 0.6339
 epoch: 72, train_loss: 0.6580, test_loss: 0.9034, test_f1: 0.6024
 epoch: 73, train_loss: 0.6560, test_loss: 0.8916, test_f1: 0.6480
 epoch: 74, train_loss: 0.6501, test_loss: 0.9296, test_f1: 0.6124
 epoch: 75, train_loss: 0.6623, test_loss: 0.9127, test_f1: 0.6589
 epoch: 76, train_loss: 0.6497, test_loss: 0.9136, test_f1: 0.6514
 epoch: 77, train_loss: 0.6465, test_loss: 0.9117, test_f1: 0.6275
 epoch: 78, train_loss: 0.6536, test_loss: 0.9238, test_f1: 0.6254
 epoch: 79, train_loss: 0.6492, test_loss: 0.8771, test_f1: 0.6289
 epoch: 80, train_loss: 0.6591, test_loss: 0.9226, test_f1: 0.6674
 epoch: 81, train_loss: 0.6427, test_loss: 0.8943, test_f1: 0.6289
 epoch: 82, train_loss: 0.6481, test_loss: 0.9181, test_f1: 0.6455
 epoch: 83, train_loss: 0.6503, test_loss: 0.9150, test_f1: 0.6581
 epoch: 84, train_loss: 0.6471, test_loss: 0.8973, test_f1: 0.6573
 epoch: 85, train_loss: 0.6243, test_loss: 0.9202, test_f1: 0.6270
 epoch: 86, train_loss: 0.6473, test_loss: 0.9269, test_f1: 0.6110
 epoch: 87, train_loss: 0.6438, test_loss: 0.9206, test_f1: 0.6529
 epoch: 88, train_loss: 0.6508, test_loss: 0.9005, test_f1: 0.6518
 epoch: 89, train_loss: 0.6450, test_loss: 0.9057, test_f1: 0.6679
 epoch: 90, train_loss: 0.6406, test_loss: 0.9049, test_f1: 0.6491
 epoch: 91, train_loss: 0.6364, test_loss: 0.9193, test_f1: 0.6324
 epoch: 92, train_loss: 0.6257, test_loss: 0.9113, test_f1: 0.6473
 epoch: 93, train_loss: 0.6270, test_loss: 0.9526, test_f1: 0.6628
 epoch: 94, train_loss: 0.6278, test_loss: 0.8926, test_f1: 0.6657
 epoch: 95, train_loss: 0.6144, test_loss: 0.9164, test_f1: 0.6391
 epoch: 96, train_loss: 0.6264, test_loss: 0.8811, test_f1: 0.6274
 epoch: 97, train_loss: 0.6211, test_loss: 0.8946, test_f1: 0.6418
 epoch: 98, train_loss: 0.6204, test_loss: 0.9132, test_f1: 0.6314
 epoch: 99, train_loss: 0.6037, test_loss: 0.9285, test_f1: 0.6549
##################ITERATION #2 ****************************************
 epoch: 0, train_loss: 1.1793, test_loss: 1.1139, test_f1: 0.3850
 epoch: 1, train_loss: 1.0430, test_loss: 0.9966, test_f1: 0.4656
 epoch: 2, train_loss: 1.0028, test_loss: 0.9599, test_f1: 0.5078
 epoch: 3, train_loss: 0.9670, test_loss: 0.9466, test_f1: 0.4973
 epoch: 4, train_loss: 0.9461, test_loss: 0.9492, test_f1: 0.5589
 epoch: 5, train_loss: 0.9292, test_loss: 0.9526, test_f1: 0.5059
 epoch: 6, train_loss: 0.9290, test_loss: 0.9491, test_f1: 0.5375
 epoch: 7, train_loss: 0.8984, test_loss: 0.9421, test_f1: 0.5574
 epoch: 8, train_loss: 0.9024, test_loss: 0.8858, test_f1: 0.5551
 epoch: 9, train_loss: 0.8823, test_loss: 0.9077, test_f1: 0.5528
 epoch: 10, train_loss: 0.8766, test_loss: 0.9289, test_f1: 0.5567
 epoch: 11, train_loss: 0.8660, test_loss: 0.9414, test_f1: 0.5672
 epoch: 12, train_loss: 0.8603, test_loss: 0.9283, test_f1: 0.5201
 epoch: 13, train_loss: 0.8511, test_loss: 0.9646, test_f1: 0.5642
 epoch: 14, train_loss: 0.8482, test_loss: 0.9429, test_f1: 0.5574
 epoch: 15, train_loss: 0.8340, test_loss: 0.9384, test_f1: 0.5596
 epoch: 16, train_loss: 0.8411, test_loss: 0.9033, test_f1: 0.5659
 epoch: 17, train_loss: 0.8303, test_loss: 0.9257, test_f1: 0.5648
 epoch: 18, train_loss: 0.8197, test_loss: 0.9565, test_f1: 0.5590
 epoch: 19, train_loss: 0.8162, test_loss: 0.9418, test_f1: 0.5598
 epoch: 20, train_loss: 0.8204, test_loss: 0.9587, test_f1: 0.5695
 epoch: 21, train_loss: 0.8248, test_loss: 0.9076, test_f1: 0.5736
 epoch: 22, train_loss: 0.7894, test_loss: 0.9567, test_f1: 0.5644
 epoch: 23, train_loss: 0.7990, test_loss: 0.9516, test_f1: 0.5705
 epoch: 24, train_loss: 0.7977, test_loss: 0.9563, test_f1: 0.5540
 epoch: 25, train_loss: 0.7819, test_loss: 0.9162, test_f1: 0.5816
 epoch: 26, train_loss: 0.7762, test_loss: 0.9517, test_f1: 0.5605
 epoch: 27, train_loss: 0.7748, test_loss: 0.9435, test_f1: 0.5848
 epoch: 28, train_loss: 0.7603, test_loss: 0.9524, test_f1: 0.6080
 epoch: 29, train_loss: 0.7615, test_loss: 1.0001, test_f1: 0.5579
 epoch: 30, train_loss: 0.7626, test_loss: 0.9762, test_f1: 0.5627
 epoch: 31, train_loss: 0.7561, test_loss: 0.9417, test_f1: 0.5902
 epoch: 32, train_loss: 0.7467, test_loss: 0.9699, test_f1: 0.6121
 epoch: 33, train_loss: 0.7449, test_loss: 0.9767, test_f1: 0.5939
 epoch: 34, train_loss: 0.7346, test_loss: 0.9581, test_f1: 0.5800
 epoch: 35, train_loss: 0.7380, test_loss: 0.9580, test_f1: 0.5906
 epoch: 36, train_loss: 0.7222, test_loss: 0.9881, test_f1: 0.5907
 epoch: 37, train_loss: 0.7172, test_loss: 1.0329, test_f1: 0.5863
 epoch: 38, train_loss: 0.7187, test_loss: 0.9164, test_f1: 0.5705
 epoch: 39, train_loss: 0.7290, test_loss: 0.9966, test_f1: 0.5706
 epoch: 40, train_loss: 0.7198, test_loss: 1.0806, test_f1: 0.5626
 epoch: 41, train_loss: 0.7138, test_loss: 0.9682, test_f1: 0.5810
 epoch: 42, train_loss: 0.7075, test_loss: 0.9890, test_f1: 0.6029
 epoch: 43, train_loss: 0.7136, test_loss: 0.9575, test_f1: 0.5930
 epoch: 44, train_loss: 0.6999, test_loss: 0.9772, test_f1: 0.5856
 epoch: 45, train_loss: 0.7118, test_loss: 1.0367, test_f1: 0.6207
 epoch: 46, train_loss: 0.6941, test_loss: 1.0285, test_f1: 0.5758
 epoch: 47, train_loss: 0.6882, test_loss: 0.9697, test_f1: 0.6231
 epoch: 48, train_loss: 0.6905, test_loss: 0.9802, test_f1: 0.5640
 epoch: 49, train_loss: 0.6992, test_loss: 0.9926, test_f1: 0.5898
 epoch: 50, train_loss: 0.6784, test_loss: 1.1020, test_f1: 0.5823
 epoch: 51, train_loss: 0.6583, test_loss: 1.0244, test_f1: 0.6050
 epoch: 52, train_loss: 0.6489, test_loss: 0.9683, test_f1: 0.5791
 epoch: 53, train_loss: 0.6599, test_loss: 1.0293, test_f1: 0.5911
 epoch: 54, train_loss: 0.6555, test_loss: 1.0127, test_f1: 0.5967
 epoch: 55, train_loss: 0.6343, test_loss: 1.0508, test_f1: 0.6115
 epoch: 56, train_loss: 0.6454, test_loss: 1.0064, test_f1: 0.6238
 epoch: 57, train_loss: 0.6369, test_loss: 0.9876, test_f1: 0.6680
 epoch: 58, train_loss: 0.6236, test_loss: 1.0093, test_f1: 0.6168
 epoch: 59, train_loss: 0.6282, test_loss: 1.0183, test_f1: 0.6171
 epoch: 60, train_loss: 0.6113, test_loss: 1.0205, test_f1: 0.6572
 epoch: 61, train_loss: 0.6291, test_loss: 1.0260, test_f1: 0.6389
 epoch: 62, train_loss: 0.6430, test_loss: 1.0520, test_f1: 0.6126
 epoch: 63, train_loss: 0.6260, test_loss: 1.0111, test_f1: 0.6500
 epoch: 64, train_loss: 0.6284, test_loss: 1.0396, test_f1: 0.6071
 epoch: 65, train_loss: 0.6139, test_loss: 1.0472, test_f1: 0.5944
 epoch: 66, train_loss: 0.6051, test_loss: 1.1167, test_f1: 0.6294
 epoch: 67, train_loss: 0.6266, test_loss: 1.1231, test_f1: 0.6147
 epoch: 68, train_loss: 0.6159, test_loss: 1.1148, test_f1: 0.6124
 epoch: 69, train_loss: 0.6311, test_loss: 1.0595, test_f1: 0.6192
 epoch: 70, train_loss: 0.6231, test_loss: 1.0433, test_f1: 0.6567
 epoch: 71, train_loss: 0.6134, test_loss: 1.0385, test_f1: 0.6370
 epoch: 72, train_loss: 0.5869, test_loss: 1.1253, test_f1: 0.6132
 epoch: 73, train_loss: 0.6022, test_loss: 1.0420, test_f1: 0.6496
 epoch: 74, train_loss: 0.5946, test_loss: 1.0940, test_f1: 0.6220
 epoch: 75, train_loss: 0.6029, test_loss: 1.1129, test_f1: 0.6062
 epoch: 76, train_loss: 0.5931, test_loss: 1.1196, test_f1: 0.6081
 epoch: 77, train_loss: 0.5817, test_loss: 1.1174, test_f1: 0.6372
 epoch: 78, train_loss: 0.5878, test_loss: 1.0815, test_f1: 0.6365
 epoch: 79, train_loss: 0.5918, test_loss: 1.0900, test_f1: 0.6184
 epoch: 80, train_loss: 0.5848, test_loss: 1.1343, test_f1: 0.6334
 epoch: 81, train_loss: 0.5806, test_loss: 1.1216, test_f1: 0.6396
 epoch: 82, train_loss: 0.5841, test_loss: 1.1293, test_f1: 0.6000
 epoch: 83, train_loss: 0.5730, test_loss: 1.0664, test_f1: 0.6501
 epoch: 84, train_loss: 0.5936, test_loss: 1.0922, test_f1: 0.6340
 epoch: 85, train_loss: 0.5849, test_loss: 1.0820, test_f1: 0.6257
 epoch: 86, train_loss: 0.5762, test_loss: 1.2077, test_f1: 0.6142
 epoch: 87, train_loss: 0.5667, test_loss: 1.0488, test_f1: 0.6339
 epoch: 88, train_loss: 0.5802, test_loss: 1.1411, test_f1: 0.6497
 epoch: 89, train_loss: 0.5730, test_loss: 1.1150, test_f1: 0.6303
 epoch: 90, train_loss: 0.5782, test_loss: 1.0987, test_f1: 0.6308
 epoch: 91, train_loss: 0.5602, test_loss: 1.1823, test_f1: 0.6265
 epoch: 92, train_loss: 0.5653, test_loss: 1.1305, test_f1: 0.6292
 epoch: 93, train_loss: 0.5797, test_loss: 1.1275, test_f1: 0.6420
 epoch: 94, train_loss: 0.5711, test_loss: 1.0838, test_f1: 0.6310
 epoch: 95, train_loss: 0.5520, test_loss: 1.1692, test_f1: 0.6012
 epoch: 96, train_loss: 0.5691, test_loss: 1.0900, test_f1: 0.6506
 epoch: 97, train_loss: 0.5765, test_loss: 1.0886, test_f1: 0.6530
 epoch: 98, train_loss: 0.5523, test_loss: 1.0462, test_f1: 0.6491
 epoch: 99, train_loss: 0.5585, test_loss: 1.0965, test_f1: 0.6533
##################ITERATION #3 ****************************************
 epoch: 0, train_loss: 1.2411, test_loss: 1.1157, test_f1: 0.4342
 epoch: 1, train_loss: 1.0927, test_loss: 0.9934, test_f1: 0.4575
 epoch: 2, train_loss: 1.0545, test_loss: 0.9743, test_f1: 0.4544
 epoch: 3, train_loss: 1.0079, test_loss: 0.9506, test_f1: 0.4527
 epoch: 4, train_loss: 0.9948, test_loss: 0.9684, test_f1: 0.5016
 epoch: 5, train_loss: 0.9806, test_loss: 0.9483, test_f1: 0.4999
 epoch: 6, train_loss: 0.9698, test_loss: 0.8990, test_f1: 0.5350
 epoch: 7, train_loss: 0.9591, test_loss: 0.9540, test_f1: 0.4860
 epoch: 8, train_loss: 0.9527, test_loss: 0.9467, test_f1: 0.5027
 epoch: 9, train_loss: 0.9326, test_loss: 0.9389, test_f1: 0.4966
 epoch: 10, train_loss: 0.9231, test_loss: 0.9258, test_f1: 0.5233
 epoch: 11, train_loss: 0.9168, test_loss: 0.9249, test_f1: 0.5408
 epoch: 12, train_loss: 0.9004, test_loss: 0.9101, test_f1: 0.5670
 epoch: 13, train_loss: 0.9036, test_loss: 0.9231, test_f1: 0.5721
 epoch: 14, train_loss: 0.8986, test_loss: 0.9402, test_f1: 0.5555
 epoch: 15, train_loss: 0.8764, test_loss: 0.9378, test_f1: 0.5614
 epoch: 16, train_loss: 0.8749, test_loss: 0.9229, test_f1: 0.5638
 epoch: 17, train_loss: 0.8706, test_loss: 0.8997, test_f1: 0.5924
 epoch: 18, train_loss: 0.8636, test_loss: 0.8984, test_f1: 0.5662
 epoch: 19, train_loss: 0.8591, test_loss: 0.9229, test_f1: 0.5653
 epoch: 20, train_loss: 0.8490, test_loss: 0.9219, test_f1: 0.5446
 epoch: 21, train_loss: 0.8449, test_loss: 0.9244, test_f1: 0.5581
 epoch: 22, train_loss: 0.8287, test_loss: 0.9470, test_f1: 0.5786
 epoch: 23, train_loss: 0.8315, test_loss: 0.9079, test_f1: 0.5771
 epoch: 24, train_loss: 0.8280, test_loss: 0.9021, test_f1: 0.5903
 epoch: 25, train_loss: 0.8049, test_loss: 0.9001, test_f1: 0.5980
 epoch: 26, train_loss: 0.8103, test_loss: 0.9037, test_f1: 0.5881
 epoch: 27, train_loss: 0.8085, test_loss: 0.9247, test_f1: 0.5912
 epoch: 28, train_loss: 0.7984, test_loss: 0.8613, test_f1: 0.5571
 epoch: 29, train_loss: 0.8076, test_loss: 0.8996, test_f1: 0.5863
 epoch: 30, train_loss: 0.8001, test_loss: 0.8948, test_f1: 0.5829
 epoch: 31, train_loss: 0.7880, test_loss: 0.9101, test_f1: 0.5551
 epoch: 32, train_loss: 0.7855, test_loss: 0.9146, test_f1: 0.6005
 epoch: 33, train_loss: 0.7824, test_loss: 0.9516, test_f1: 0.5978
 epoch: 34, train_loss: 0.7875, test_loss: 0.9391, test_f1: 0.6047
 epoch: 35, train_loss: 0.7783, test_loss: 0.9183, test_f1: 0.6174
 epoch: 36, train_loss: 0.7640, test_loss: 0.9330, test_f1: 0.5981
 epoch: 37, train_loss: 0.7599, test_loss: 0.9257, test_f1: 0.5808
 epoch: 38, train_loss: 0.7541, test_loss: 0.9255, test_f1: 0.6025
 epoch: 39, train_loss: 0.7456, test_loss: 0.9036, test_f1: 0.6020
 epoch: 40, train_loss: 0.7522, test_loss: 0.9364, test_f1: 0.5920
 epoch: 41, train_loss: 0.7496, test_loss: 0.9190, test_f1: 0.5937
 epoch: 42, train_loss: 0.7524, test_loss: 0.9663, test_f1: 0.6146
 epoch: 43, train_loss: 0.7496, test_loss: 0.9288, test_f1: 0.6029
 epoch: 44, train_loss: 0.7382, test_loss: 0.9123, test_f1: 0.5825
 epoch: 45, train_loss: 0.7287, test_loss: 0.9672, test_f1: 0.5754
 epoch: 46, train_loss: 0.7309, test_loss: 0.9615, test_f1: 0.6017
 epoch: 47, train_loss: 0.7229, test_loss: 1.0002, test_f1: 0.6212
 epoch: 48, train_loss: 0.7222, test_loss: 0.9222, test_f1: 0.6057
 epoch: 49, train_loss: 0.7197, test_loss: 0.9718, test_f1: 0.6134
 epoch: 50, train_loss: 0.7127, test_loss: 0.9609, test_f1: 0.6173
 epoch: 51, train_loss: 0.7080, test_loss: 0.9092, test_f1: 0.6039
 epoch: 52, train_loss: 0.7022, test_loss: 0.9533, test_f1: 0.5995
 epoch: 53, train_loss: 0.6717, test_loss: 0.9617, test_f1: 0.6346
 epoch: 54, train_loss: 0.6678, test_loss: 0.9343, test_f1: 0.6274
 epoch: 55, train_loss: 0.6679, test_loss: 0.9531, test_f1: 0.6049
 epoch: 56, train_loss: 0.6831, test_loss: 0.9639, test_f1: 0.6228
 epoch: 57, train_loss: 0.6666, test_loss: 0.9565, test_f1: 0.6255
 epoch: 58, train_loss: 0.6820, test_loss: 0.9623, test_f1: 0.6047
 epoch: 59, train_loss: 0.6776, test_loss: 0.9779, test_f1: 0.6253
 epoch: 60, train_loss: 0.6649, test_loss: 0.9695, test_f1: 0.6306
 epoch: 61, train_loss: 0.6662, test_loss: 0.9300, test_f1: 0.6455
 epoch: 62, train_loss: 0.6662, test_loss: 0.9527, test_f1: 0.6075
 epoch: 63, train_loss: 0.6414, test_loss: 0.9350, test_f1: 0.6205
 epoch: 64, train_loss: 0.6583, test_loss: 0.9390, test_f1: 0.6224
 epoch: 65, train_loss: 0.6551, test_loss: 0.9379, test_f1: 0.6304
 epoch: 66, train_loss: 0.6425, test_loss: 0.9943, test_f1: 0.6435
 epoch: 67, train_loss: 0.6641, test_loss: 0.9628, test_f1: 0.6450
 epoch: 68, train_loss: 0.6546, test_loss: 0.9884, test_f1: 0.6041
 epoch: 69, train_loss: 0.6504, test_loss: 0.9452, test_f1: 0.6208
 epoch: 70, train_loss: 0.6593, test_loss: 0.9275, test_f1: 0.6389
 epoch: 71, train_loss: 0.6396, test_loss: 0.9503, test_f1: 0.6351
 epoch: 72, train_loss: 0.6461, test_loss: 0.9664, test_f1: 0.6384
 epoch: 73, train_loss: 0.6420, test_loss: 0.9646, test_f1: 0.6322
 epoch: 74, train_loss: 0.6286, test_loss: 0.9926, test_f1: 0.6488
 epoch: 75, train_loss: 0.6209, test_loss: 0.9914, test_f1: 0.6262
 epoch: 76, train_loss: 0.6269, test_loss: 0.9881, test_f1: 0.6221
 epoch: 77, train_loss: 0.6433, test_loss: 0.9895, test_f1: 0.6390
 epoch: 78, train_loss: 0.6118, test_loss: 1.0004, test_f1: 0.6316
 epoch: 79, train_loss: 0.6250, test_loss: 0.9688, test_f1: 0.6184
 epoch: 80, train_loss: 0.6261, test_loss: 0.9955, test_f1: 0.6144
 epoch: 81, train_loss: 0.6141, test_loss: 1.0103, test_f1: 0.6176
 epoch: 82, train_loss: 0.6217, test_loss: 0.9557, test_f1: 0.6425
 epoch: 83, train_loss: 0.6246, test_loss: 0.9856, test_f1: 0.6179
 epoch: 84, train_loss: 0.6304, test_loss: 1.0200, test_f1: 0.6095
 epoch: 85, train_loss: 0.6179, test_loss: 1.0206, test_f1: 0.6175
 epoch: 86, train_loss: 0.6187, test_loss: 0.9900, test_f1: 0.6095
 epoch: 87, train_loss: 0.6158, test_loss: 1.0168, test_f1: 0.5990
 epoch: 88, train_loss: 0.6120, test_loss: 1.0102, test_f1: 0.6045
 epoch: 89, train_loss: 0.6115, test_loss: 0.9777, test_f1: 0.6328
 epoch: 90, train_loss: 0.5933, test_loss: 0.9625, test_f1: 0.6406
 epoch: 91, train_loss: 0.5877, test_loss: 1.0116, test_f1: 0.6044
 epoch: 92, train_loss: 0.5927, test_loss: 0.9976, test_f1: 0.6124
 epoch: 93, train_loss: 0.5983, test_loss: 1.0310, test_f1: 0.6119
 epoch: 94, train_loss: 0.6028, test_loss: 0.9606, test_f1: 0.6305
 epoch: 95, train_loss: 0.5958, test_loss: 0.9974, test_f1: 0.6017
 epoch: 96, train_loss: 0.5946, test_loss: 1.0138, test_f1: 0.6370
 epoch: 97, train_loss: 0.5962, test_loss: 1.0408, test_f1: 0.6362
 epoch: 98, train_loss: 0.5896, test_loss: 0.9876, test_f1: 0.6142
 epoch: 99, train_loss: 0.6055, test_loss: 1.0130, test_f1: 0.6163
##################ITERATION #4 ****************************************
 epoch: 0, train_loss: 1.2660, test_loss: 1.0878, test_f1: 0.4379
 epoch: 1, train_loss: 1.0974, test_loss: 1.0061, test_f1: 0.4695
 epoch: 2, train_loss: 1.0501, test_loss: 0.9619, test_f1: 0.4863
 epoch: 3, train_loss: 1.0201, test_loss: 0.9544, test_f1: 0.5078
 epoch: 4, train_loss: 0.9813, test_loss: 1.0010, test_f1: 0.4715
 epoch: 5, train_loss: 0.9619, test_loss: 0.9500, test_f1: 0.5112
 epoch: 6, train_loss: 0.9562, test_loss: 0.9383, test_f1: 0.5102
 epoch: 7, train_loss: 0.9329, test_loss: 0.9378, test_f1: 0.5140
 epoch: 8, train_loss: 0.9218, test_loss: 0.9240, test_f1: 0.5204
 epoch: 9, train_loss: 0.9104, test_loss: 0.9481, test_f1: 0.5105
 epoch: 10, train_loss: 0.9061, test_loss: 0.9429, test_f1: 0.5297
 epoch: 11, train_loss: 0.9022, test_loss: 1.0554, test_f1: 0.4810
 epoch: 12, train_loss: 0.8993, test_loss: 0.9397, test_f1: 0.5218
 epoch: 13, train_loss: 0.8783, test_loss: 0.9727, test_f1: 0.4787
 epoch: 14, train_loss: 0.8880, test_loss: 0.9265, test_f1: 0.5365
 epoch: 15, train_loss: 0.8669, test_loss: 0.9474, test_f1: 0.5099
 epoch: 16, train_loss: 0.8663, test_loss: 0.9276, test_f1: 0.5304
 epoch: 17, train_loss: 0.8594, test_loss: 0.9610, test_f1: 0.5054
 epoch: 18, train_loss: 0.8472, test_loss: 0.9623, test_f1: 0.4915
 epoch: 19, train_loss: 0.8422, test_loss: 0.9458, test_f1: 0.5266
 epoch: 20, train_loss: 0.8494, test_loss: 0.9536, test_f1: 0.5126
 epoch: 21, train_loss: 0.8379, test_loss: 0.9197, test_f1: 0.5157
 epoch: 22, train_loss: 0.8271, test_loss: 0.9061, test_f1: 0.5657
 epoch: 23, train_loss: 0.8282, test_loss: 0.8818, test_f1: 0.5641
 epoch: 24, train_loss: 0.8277, test_loss: 0.9155, test_f1: 0.5373
 epoch: 25, train_loss: 0.8226, test_loss: 0.9294, test_f1: 0.5310
 epoch: 26, train_loss: 0.8251, test_loss: 0.9367, test_f1: 0.5241
 epoch: 27, train_loss: 0.8029, test_loss: 0.9227, test_f1: 0.5301
 epoch: 28, train_loss: 0.8259, test_loss: 0.8897, test_f1: 0.5509
 epoch: 29, train_loss: 0.8061, test_loss: 0.9249, test_f1: 0.5492
 epoch: 30, train_loss: 0.8084, test_loss: 0.9007, test_f1: 0.5401
 epoch: 31, train_loss: 0.7868, test_loss: 0.9101, test_f1: 0.5451
 epoch: 32, train_loss: 0.7832, test_loss: 0.8973, test_f1: 0.5485
 epoch: 33, train_loss: 0.8002, test_loss: 0.9438, test_f1: 0.5491
 epoch: 34, train_loss: 0.7754, test_loss: 0.9513, test_f1: 0.5291
 epoch: 35, train_loss: 0.7879, test_loss: 0.9155, test_f1: 0.5802
 epoch: 36, train_loss: 0.7768, test_loss: 0.9711, test_f1: 0.5236
 epoch: 37, train_loss: 0.7731, test_loss: 0.9267, test_f1: 0.5456
 epoch: 38, train_loss: 0.7579, test_loss: 0.9124, test_f1: 0.5587
 epoch: 39, train_loss: 0.7504, test_loss: 0.9285, test_f1: 0.5833
 epoch: 40, train_loss: 0.7743, test_loss: 0.9875, test_f1: 0.5549
 epoch: 41, train_loss: 0.7605, test_loss: 0.9290, test_f1: 0.5801
 epoch: 42, train_loss: 0.7491, test_loss: 0.9077, test_f1: 0.5861
 epoch: 43, train_loss: 0.7612, test_loss: 0.9302, test_f1: 0.5530
 epoch: 44, train_loss: 0.7580, test_loss: 0.9789, test_f1: 0.5512
 epoch: 45, train_loss: 0.7573, test_loss: 0.9971, test_f1: 0.5558
 epoch: 46, train_loss: 0.7574, test_loss: 0.9906, test_f1: 0.5536
 epoch: 47, train_loss: 0.7424, test_loss: 1.0290, test_f1: 0.5474
 epoch: 48, train_loss: 0.7347, test_loss: 0.9297, test_f1: 0.5736
 epoch: 49, train_loss: 0.7379, test_loss: 0.8648, test_f1: 0.5782
 epoch: 50, train_loss: 0.7363, test_loss: 0.9628, test_f1: 0.5573
 epoch: 51, train_loss: 0.7099, test_loss: 0.9213, test_f1: 0.5909
 epoch: 52, train_loss: 0.7039, test_loss: 0.9270, test_f1: 0.5875
 epoch: 53, train_loss: 0.7019, test_loss: 0.8999, test_f1: 0.5948
 epoch: 54, train_loss: 0.6948, test_loss: 0.9002, test_f1: 0.5978
 epoch: 55, train_loss: 0.6881, test_loss: 0.9174, test_f1: 0.5841
 epoch: 56, train_loss: 0.7030, test_loss: 0.9583, test_f1: 0.5708
 epoch: 57, train_loss: 0.7012, test_loss: 0.9110, test_f1: 0.6001
 epoch: 58, train_loss: 0.6949, test_loss: 0.9300, test_f1: 0.6090
 epoch: 59, train_loss: 0.6839, test_loss: 0.9509, test_f1: 0.5904
 epoch: 60, train_loss: 0.6887, test_loss: 0.9013, test_f1: 0.5858
 epoch: 61, train_loss: 0.6803, test_loss: 1.0118, test_f1: 0.5785
 epoch: 62, train_loss: 0.6773, test_loss: 0.9392, test_f1: 0.5826
 epoch: 63, train_loss: 0.6863, test_loss: 0.9345, test_f1: 0.5990
 epoch: 64, train_loss: 0.6850, test_loss: 0.9794, test_f1: 0.5635
 epoch: 65, train_loss: 0.6689, test_loss: 0.9676, test_f1: 0.5860
 epoch: 66, train_loss: 0.6616, test_loss: 0.9201, test_f1: 0.6003
 epoch: 67, train_loss: 0.6831, test_loss: 0.9628, test_f1: 0.6030
 epoch: 68, train_loss: 0.6740, test_loss: 0.9291, test_f1: 0.6085
 epoch: 69, train_loss: 0.6609, test_loss: 0.9711, test_f1: 0.5942
 epoch: 70, train_loss: 0.6700, test_loss: 0.9419, test_f1: 0.6027
 epoch: 71, train_loss: 0.6646, test_loss: 0.9497, test_f1: 0.6066
 epoch: 72, train_loss: 0.6570, test_loss: 0.9448, test_f1: 0.5988
 epoch: 73, train_loss: 0.6666, test_loss: 0.9357, test_f1: 0.6006
 epoch: 74, train_loss: 0.6654, test_loss: 0.9662, test_f1: 0.5903
 epoch: 75, train_loss: 0.6776, test_loss: 1.0017, test_f1: 0.5851
 epoch: 76, train_loss: 0.6712, test_loss: 0.9407, test_f1: 0.5933
 epoch: 77, train_loss: 0.6451, test_loss: 0.9640, test_f1: 0.5993
 epoch: 78, train_loss: 0.6514, test_loss: 0.9771, test_f1: 0.5933
 epoch: 79, train_loss: 0.6619, test_loss: 0.9126, test_f1: 0.5939
 epoch: 80, train_loss: 0.6470, test_loss: 0.9677, test_f1: 0.6013
 epoch: 81, train_loss: 0.6423, test_loss: 0.9867, test_f1: 0.6248
 epoch: 82, train_loss: 0.6665, test_loss: 0.9652, test_f1: 0.6146
 epoch: 83, train_loss: 0.6431, test_loss: 0.9654, test_f1: 0.6058
 epoch: 84, train_loss: 0.6478, test_loss: 0.9591, test_f1: 0.6387
 epoch: 85, train_loss: 0.6389, test_loss: 1.0695, test_f1: 0.5920
 epoch: 86, train_loss: 0.6277, test_loss: 0.9926, test_f1: 0.6254
 epoch: 87, train_loss: 0.6485, test_loss: 1.0126, test_f1: 0.5842
 epoch: 88, train_loss: 0.6472, test_loss: 0.9764, test_f1: 0.5802
 epoch: 89, train_loss: 0.6408, test_loss: 0.9841, test_f1: 0.6291
 epoch: 90, train_loss: 0.6319, test_loss: 0.9654, test_f1: 0.6205
 epoch: 91, train_loss: 0.6370, test_loss: 0.9652, test_f1: 0.5850
 epoch: 92, train_loss: 0.6381, test_loss: 0.9861, test_f1: 0.6320
 epoch: 93, train_loss: 0.6275, test_loss: 1.0073, test_f1: 0.6060
 epoch: 94, train_loss: 0.6410, test_loss: 0.9912, test_f1: 0.6016
 epoch: 95, train_loss: 0.6341, test_loss: 0.9794, test_f1: 0.6157
 epoch: 96, train_loss: 0.6322, test_loss: 1.0121, test_f1: 0.6003
 epoch: 97, train_loss: 0.6202, test_loss: 0.9867, test_f1: 0.5853
 epoch: 98, train_loss: 0.6225, test_loss: 0.9318, test_f1: 0.6297
 epoch: 99, train_loss: 0.6313, test_loss: 0.9716, test_f1: 0.6078
##################ITERATION #5 ****************************************
 epoch: 0, train_loss: 1.2482, test_loss: 1.0890, test_f1: 0.4841
 epoch: 1, train_loss: 1.0607, test_loss: 0.9818, test_f1: 0.4926
 epoch: 2, train_loss: 1.0268, test_loss: 0.9358, test_f1: 0.4744
 epoch: 3, train_loss: 0.9946, test_loss: 0.9242, test_f1: 0.5151
 epoch: 4, train_loss: 0.9705, test_loss: 0.9137, test_f1: 0.5503
 epoch: 5, train_loss: 0.9533, test_loss: 0.9273, test_f1: 0.5278
 epoch: 6, train_loss: 0.9387, test_loss: 0.9234, test_f1: 0.5656
 epoch: 7, train_loss: 0.9245, test_loss: 0.9146, test_f1: 0.5140
 epoch: 8, train_loss: 0.9249, test_loss: 0.8914, test_f1: 0.5487
 epoch: 9, train_loss: 0.9067, test_loss: 0.9547, test_f1: 0.5233
 epoch: 10, train_loss: 0.8959, test_loss: 0.9086, test_f1: 0.5008
 epoch: 11, train_loss: 0.8981, test_loss: 0.8913, test_f1: 0.5582
 epoch: 12, train_loss: 0.8736, test_loss: 0.8828, test_f1: 0.5690
 epoch: 13, train_loss: 0.8714, test_loss: 0.9020, test_f1: 0.5460
 epoch: 14, train_loss: 0.8637, test_loss: 0.8978, test_f1: 0.5336
 epoch: 15, train_loss: 0.8563, test_loss: 0.9065, test_f1: 0.5440
 epoch: 16, train_loss: 0.8520, test_loss: 0.9274, test_f1: 0.5651
 epoch: 17, train_loss: 0.8475, test_loss: 0.9202, test_f1: 0.5635
 epoch: 18, train_loss: 0.8429, test_loss: 0.9061, test_f1: 0.5385
 epoch: 19, train_loss: 0.8475, test_loss: 0.8869, test_f1: 0.5328
 epoch: 20, train_loss: 0.8367, test_loss: 0.9155, test_f1: 0.5403
 epoch: 21, train_loss: 0.8237, test_loss: 0.8920, test_f1: 0.5785
 epoch: 22, train_loss: 0.8218, test_loss: 0.9033, test_f1: 0.5502
 epoch: 23, train_loss: 0.8272, test_loss: 0.9175, test_f1: 0.5472
 epoch: 24, train_loss: 0.8188, test_loss: 0.9093, test_f1: 0.5790
 epoch: 25, train_loss: 0.8082, test_loss: 0.8844, test_f1: 0.5482
 epoch: 26, train_loss: 0.8098, test_loss: 0.9006, test_f1: 0.5425
 epoch: 27, train_loss: 0.7984, test_loss: 0.8956, test_f1: 0.5815
 epoch: 28, train_loss: 0.7887, test_loss: 0.8862, test_f1: 0.6148
 epoch: 29, train_loss: 0.7895, test_loss: 0.8976, test_f1: 0.5687
 epoch: 30, train_loss: 0.7962, test_loss: 0.9251, test_f1: 0.5863
 epoch: 31, train_loss: 0.7909, test_loss: 0.9070, test_f1: 0.5695
 epoch: 32, train_loss: 0.7808, test_loss: 0.8837, test_f1: 0.5876
 epoch: 33, train_loss: 0.7731, test_loss: 0.8798, test_f1: 0.5948
 epoch: 34, train_loss: 0.7696, test_loss: 0.8937, test_f1: 0.5997
 epoch: 35, train_loss: 0.7932, test_loss: 0.8813, test_f1: 0.5875
 epoch: 36, train_loss: 0.7724, test_loss: 0.8654, test_f1: 0.6066
 epoch: 37, train_loss: 0.7580, test_loss: 0.8787, test_f1: 0.5845
 epoch: 38, train_loss: 0.7613, test_loss: 0.8707, test_f1: 0.6001
 epoch: 39, train_loss: 0.7639, test_loss: 0.9016, test_f1: 0.6048
 epoch: 40, train_loss: 0.7576, test_loss: 0.9071, test_f1: 0.5924
 epoch: 41, train_loss: 0.7443, test_loss: 0.8966, test_f1: 0.6255
 epoch: 42, train_loss: 0.7526, test_loss: 0.8999, test_f1: 0.6107
 epoch: 43, train_loss: 0.7502, test_loss: 0.9074, test_f1: 0.5986
 epoch: 44, train_loss: 0.7388, test_loss: 0.8955, test_f1: 0.6245
 epoch: 45, train_loss: 0.7416, test_loss: 0.8920, test_f1: 0.6137
 epoch: 46, train_loss: 0.7359, test_loss: 0.8820, test_f1: 0.6148
 epoch: 47, train_loss: 0.7282, test_loss: 0.9321, test_f1: 0.5972
 epoch: 48, train_loss: 0.7239, test_loss: 0.8924, test_f1: 0.6192
 epoch: 49, train_loss: 0.7283, test_loss: 0.8965, test_f1: 0.6208
 epoch: 50, train_loss: 0.7241, test_loss: 0.8836, test_f1: 0.6215
 epoch: 51, train_loss: 0.7148, test_loss: 0.8815, test_f1: 0.6361
 epoch: 52, train_loss: 0.6984, test_loss: 0.8629, test_f1: 0.6457
 epoch: 53, train_loss: 0.6855, test_loss: 0.8865, test_f1: 0.6391
 epoch: 54, train_loss: 0.6888, test_loss: 0.8881, test_f1: 0.6392
 epoch: 55, train_loss: 0.6834, test_loss: 0.8715, test_f1: 0.6338
 epoch: 56, train_loss: 0.6773, test_loss: 0.8790, test_f1: 0.6406
 epoch: 57, train_loss: 0.6770, test_loss: 0.8761, test_f1: 0.6232
 epoch: 58, train_loss: 0.6776, test_loss: 0.8744, test_f1: 0.6379
 epoch: 59, train_loss: 0.6745, test_loss: 0.8747, test_f1: 0.6468
 epoch: 60, train_loss: 0.6609, test_loss: 0.8761, test_f1: 0.6404
 epoch: 61, train_loss: 0.6660, test_loss: 0.8944, test_f1: 0.6176
 epoch: 62, train_loss: 0.6618, test_loss: 0.8953, test_f1: 0.6328
 epoch: 63, train_loss: 0.6638, test_loss: 0.8897, test_f1: 0.6283
 epoch: 64, train_loss: 0.6617, test_loss: 0.8691, test_f1: 0.6349
 epoch: 65, train_loss: 0.6757, test_loss: 0.8907, test_f1: 0.6374
 epoch: 66, train_loss: 0.6512, test_loss: 0.8658, test_f1: 0.6352
 epoch: 67, train_loss: 0.6483, test_loss: 0.8880, test_f1: 0.6339
 epoch: 68, train_loss: 0.6440, test_loss: 0.9228, test_f1: 0.6338
 epoch: 69, train_loss: 0.6474, test_loss: 0.8642, test_f1: 0.6356
 epoch: 70, train_loss: 0.6557, test_loss: 0.9165, test_f1: 0.6091
 epoch: 71, train_loss: 0.6540, test_loss: 0.8775, test_f1: 0.6269
 epoch: 72, train_loss: 0.6460, test_loss: 0.9025, test_f1: 0.6304
 epoch: 73, train_loss: 0.6425, test_loss: 0.8960, test_f1: 0.6260
 epoch: 74, train_loss: 0.6454, test_loss: 0.8972, test_f1: 0.6365
 epoch: 75, train_loss: 0.6424, test_loss: 0.8890, test_f1: 0.6091
 epoch: 76, train_loss: 0.6465, test_loss: 0.8896, test_f1: 0.6396
 epoch: 77, train_loss: 0.6377, test_loss: 0.9064, test_f1: 0.6169
 epoch: 78, train_loss: 0.6395, test_loss: 0.9065, test_f1: 0.6330
 epoch: 79, train_loss: 0.6261, test_loss: 0.9047, test_f1: 0.6310
 epoch: 80, train_loss: 0.6363, test_loss: 0.9066, test_f1: 0.6415
 epoch: 81, train_loss: 0.6311, test_loss: 0.8758, test_f1: 0.6651
 epoch: 82, train_loss: 0.6307, test_loss: 0.9265, test_f1: 0.6374
 epoch: 83, train_loss: 0.6276, test_loss: 0.9010, test_f1: 0.6382
 epoch: 84, train_loss: 0.6374, test_loss: 0.8867, test_f1: 0.6321
 epoch: 85, train_loss: 0.6153, test_loss: 0.9226, test_f1: 0.6122
 epoch: 86, train_loss: 0.6203, test_loss: 0.9088, test_f1: 0.6344
 epoch: 87, train_loss: 0.6218, test_loss: 0.9224, test_f1: 0.6216
 epoch: 88, train_loss: 0.6143, test_loss: 0.9109, test_f1: 0.6317
 epoch: 89, train_loss: 0.6122, test_loss: 0.9119, test_f1: 0.6465
 epoch: 90, train_loss: 0.6173, test_loss: 0.9124, test_f1: 0.6287
 epoch: 91, train_loss: 0.6036, test_loss: 0.9238, test_f1: 0.6242
 epoch: 92, train_loss: 0.6273, test_loss: 0.9278, test_f1: 0.6338
 epoch: 93, train_loss: 0.6017, test_loss: 0.8949, test_f1: 0.6468
 epoch: 94, train_loss: 0.6198, test_loss: 0.9382, test_f1: 0.6357
 epoch: 95, train_loss: 0.6091, test_loss: 0.9128, test_f1: 0.6270
 epoch: 96, train_loss: 0.5932, test_loss: 0.9148, test_f1: 0.6391
 epoch: 97, train_loss: 0.5893, test_loss: 0.9520, test_f1: 0.6325
 epoch: 98, train_loss: 0.6054, test_loss: 0.9410, test_f1: 0.6396
 epoch: 99, train_loss: 0.5908, test_loss: 0.9171, test_f1: 0.6369
##################ITERATION #6 ****************************************
 epoch: 0, train_loss: 1.3261, test_loss: 1.1970, test_f1: 0.3040
 epoch: 1, train_loss: 1.1133, test_loss: 1.0363, test_f1: 0.4758
 epoch: 2, train_loss: 1.0674, test_loss: 1.0262, test_f1: 0.4704
 epoch: 3, train_loss: 1.0196, test_loss: 0.9958, test_f1: 0.4674
 epoch: 4, train_loss: 0.9878, test_loss: 1.0220, test_f1: 0.4638
 epoch: 5, train_loss: 0.9760, test_loss: 1.0030, test_f1: 0.5049
 epoch: 6, train_loss: 0.9664, test_loss: 0.9975, test_f1: 0.4548
 epoch: 7, train_loss: 0.9488, test_loss: 1.0133, test_f1: 0.4872
 epoch: 8, train_loss: 0.9285, test_loss: 0.9852, test_f1: 0.4953
 epoch: 9, train_loss: 0.9297, test_loss: 1.0093, test_f1: 0.5155
 epoch: 10, train_loss: 0.9102, test_loss: 0.9854, test_f1: 0.4873
 epoch: 11, train_loss: 0.9110, test_loss: 0.9907, test_f1: 0.4954
 epoch: 12, train_loss: 0.8981, test_loss: 0.9936, test_f1: 0.5401
 epoch: 13, train_loss: 0.8923, test_loss: 0.9516, test_f1: 0.5026
 epoch: 14, train_loss: 0.8805, test_loss: 0.9785, test_f1: 0.5192
 epoch: 15, train_loss: 0.8713, test_loss: 0.9848, test_f1: 0.5396
 epoch: 16, train_loss: 0.8622, test_loss: 0.9824, test_f1: 0.5282
 epoch: 17, train_loss: 0.8523, test_loss: 0.9606, test_f1: 0.5008
 epoch: 18, train_loss: 0.8584, test_loss: 0.9757, test_f1: 0.5232
 epoch: 19, train_loss: 0.8425, test_loss: 0.9604, test_f1: 0.5268
 epoch: 20, train_loss: 0.8294, test_loss: 0.9878, test_f1: 0.5322
 epoch: 21, train_loss: 0.8313, test_loss: 0.9930, test_f1: 0.5133
 epoch: 22, train_loss: 0.8335, test_loss: 0.9474, test_f1: 0.5314
 epoch: 23, train_loss: 0.8172, test_loss: 0.9719, test_f1: 0.5296
 epoch: 24, train_loss: 0.8066, test_loss: 0.9905, test_f1: 0.5421
 epoch: 25, train_loss: 0.8027, test_loss: 1.0143, test_f1: 0.5200
 epoch: 26, train_loss: 0.8126, test_loss: 1.0094, test_f1: 0.5448
 epoch: 27, train_loss: 0.7991, test_loss: 1.0362, test_f1: 0.5167
 epoch: 28, train_loss: 0.8004, test_loss: 0.9891, test_f1: 0.5684
 epoch: 29, train_loss: 0.7928, test_loss: 1.0052, test_f1: 0.5632
 epoch: 30, train_loss: 0.7899, test_loss: 0.9605, test_f1: 0.5460
 epoch: 31, train_loss: 0.7754, test_loss: 1.0515, test_f1: 0.5483
 epoch: 32, train_loss: 0.7863, test_loss: 0.9941, test_f1: 0.5622
 epoch: 33, train_loss: 0.7875, test_loss: 1.0218, test_f1: 0.5643
 epoch: 34, train_loss: 0.7699, test_loss: 0.9832, test_f1: 0.5684
 epoch: 35, train_loss: 0.7542, test_loss: 1.0091, test_f1: 0.5649
 epoch: 36, train_loss: 0.7779, test_loss: 0.9855, test_f1: 0.5772
 epoch: 37, train_loss: 0.7634, test_loss: 1.0101, test_f1: 0.5750
 epoch: 38, train_loss: 0.7581, test_loss: 0.9840, test_f1: 0.5559
 epoch: 39, train_loss: 0.7494, test_loss: 0.9690, test_f1: 0.5994
 epoch: 40, train_loss: 0.7532, test_loss: 1.0106, test_f1: 0.5829
 epoch: 41, train_loss: 0.7361, test_loss: 0.9606, test_f1: 0.5621
 epoch: 42, train_loss: 0.7405, test_loss: 1.0124, test_f1: 0.6048
 epoch: 43, train_loss: 0.7284, test_loss: 0.9640, test_f1: 0.6084
 epoch: 44, train_loss: 0.7258, test_loss: 0.9896, test_f1: 0.5949
 epoch: 45, train_loss: 0.7313, test_loss: 0.9998, test_f1: 0.6349
 epoch: 46, train_loss: 0.7222, test_loss: 0.9761, test_f1: 0.6106
 epoch: 47, train_loss: 0.7143, test_loss: 1.0024, test_f1: 0.6182
 epoch: 48, train_loss: 0.7100, test_loss: 1.0206, test_f1: 0.5983
 epoch: 49, train_loss: 0.7211, test_loss: 0.9776, test_f1: 0.6032
 epoch: 50, train_loss: 0.7110, test_loss: 0.9887, test_f1: 0.6069
 epoch: 51, train_loss: 0.6816, test_loss: 0.9733, test_f1: 0.6180
 epoch: 52, train_loss: 0.6667, test_loss: 1.0004, test_f1: 0.6173
 epoch: 53, train_loss: 0.6802, test_loss: 1.0101, test_f1: 0.6076
 epoch: 54, train_loss: 0.6721, test_loss: 0.9887, test_f1: 0.6292
 epoch: 55, train_loss: 0.6758, test_loss: 0.9866, test_f1: 0.6086
 epoch: 56, train_loss: 0.6747, test_loss: 0.9822, test_f1: 0.6202
 epoch: 57, train_loss: 0.6641, test_loss: 0.9699, test_f1: 0.6138
 epoch: 58, train_loss: 0.6600, test_loss: 0.9924, test_f1: 0.5934
 epoch: 59, train_loss: 0.6581, test_loss: 1.0179, test_f1: 0.5992
 epoch: 60, train_loss: 0.6580, test_loss: 1.0021, test_f1: 0.5909
 epoch: 61, train_loss: 0.6446, test_loss: 1.0171, test_f1: 0.5972
 epoch: 62, train_loss: 0.6483, test_loss: 1.0177, test_f1: 0.6304
 epoch: 63, train_loss: 0.6491, test_loss: 1.0158, test_f1: 0.6251
 epoch: 64, train_loss: 0.6292, test_loss: 0.9977, test_f1: 0.6141
 epoch: 65, train_loss: 0.6427, test_loss: 1.0021, test_f1: 0.6234
 epoch: 66, train_loss: 0.6433, test_loss: 1.0148, test_f1: 0.5988
 epoch: 67, train_loss: 0.6155, test_loss: 1.0088, test_f1: 0.6234
 epoch: 68, train_loss: 0.6300, test_loss: 1.0107, test_f1: 0.6282
 epoch: 69, train_loss: 0.6439, test_loss: 1.0099, test_f1: 0.6380
 epoch: 70, train_loss: 0.6392, test_loss: 0.9880, test_f1: 0.6396
 epoch: 71, train_loss: 0.6179, test_loss: 1.0089, test_f1: 0.6136
 epoch: 72, train_loss: 0.6151, test_loss: 1.0212, test_f1: 0.6034
 epoch: 73, train_loss: 0.6222, test_loss: 1.0063, test_f1: 0.6010
 epoch: 74, train_loss: 0.6259, test_loss: 1.0206, test_f1: 0.6382
 epoch: 75, train_loss: 0.6190, test_loss: 1.0001, test_f1: 0.6101
 epoch: 76, train_loss: 0.6228, test_loss: 1.0320, test_f1: 0.6111
 epoch: 77, train_loss: 0.6188, test_loss: 1.0257, test_f1: 0.6195
 epoch: 78, train_loss: 0.6170, test_loss: 1.0374, test_f1: 0.6318
 epoch: 79, train_loss: 0.6156, test_loss: 1.0075, test_f1: 0.6502
 epoch: 80, train_loss: 0.5971, test_loss: 1.0321, test_f1: 0.6358
 epoch: 81, train_loss: 0.6053, test_loss: 1.0315, test_f1: 0.6103
 epoch: 82, train_loss: 0.6131, test_loss: 1.0119, test_f1: 0.6201
 epoch: 83, train_loss: 0.6108, test_loss: 1.0408, test_f1: 0.6228
 epoch: 84, train_loss: 0.6108, test_loss: 1.0410, test_f1: 0.6198
 epoch: 85, train_loss: 0.6074, test_loss: 1.0590, test_f1: 0.6256
 epoch: 86, train_loss: 0.5983, test_loss: 1.0447, test_f1: 0.6193
 epoch: 87, train_loss: 0.5979, test_loss: 1.0174, test_f1: 0.6297
 epoch: 88, train_loss: 0.5988, test_loss: 1.0156, test_f1: 0.6465
 epoch: 89, train_loss: 0.5984, test_loss: 1.0195, test_f1: 0.6445
 epoch: 90, train_loss: 0.5864, test_loss: 1.0494, test_f1: 0.6428
 epoch: 91, train_loss: 0.5957, test_loss: 1.0355, test_f1: 0.6489
 epoch: 92, train_loss: 0.5969, test_loss: 0.9803, test_f1: 0.6493
 epoch: 93, train_loss: 0.5877, test_loss: 1.0311, test_f1: 0.6540
 epoch: 94, train_loss: 0.5862, test_loss: 1.0277, test_f1: 0.6439
 epoch: 95, train_loss: 0.5731, test_loss: 1.0324, test_f1: 0.6339
 epoch: 96, train_loss: 0.5813, test_loss: 1.0043, test_f1: 0.6460
 epoch: 97, train_loss: 0.5706, test_loss: 1.0259, test_f1: 0.6361
 epoch: 98, train_loss: 0.5797, test_loss: 1.0345, test_f1: 0.6483
 epoch: 99, train_loss: 0.5750, test_loss: 1.0572, test_f1: 0.6449
##################ITERATION #7 ****************************************
 epoch: 0, train_loss: 1.4121, test_loss: 1.0954, test_f1: 0.4539
 epoch: 1, train_loss: 1.1249, test_loss: 0.9863, test_f1: 0.4957
 epoch: 2, train_loss: 1.0733, test_loss: 0.9459, test_f1: 0.4928
 epoch: 3, train_loss: 1.0297, test_loss: 0.9337, test_f1: 0.4662
 epoch: 4, train_loss: 1.0035, test_loss: 0.9599, test_f1: 0.4507
 epoch: 5, train_loss: 0.9929, test_loss: 0.9268, test_f1: 0.5038
 epoch: 6, train_loss: 0.9840, test_loss: 0.9388, test_f1: 0.5012
 epoch: 7, train_loss: 0.9556, test_loss: 0.9004, test_f1: 0.4848
 epoch: 8, train_loss: 0.9426, test_loss: 0.8997, test_f1: 0.5100
 epoch: 9, train_loss: 0.9285, test_loss: 0.9169, test_f1: 0.5168
 epoch: 10, train_loss: 0.9235, test_loss: 0.9086, test_f1: 0.5233
 epoch: 11, train_loss: 0.9287, test_loss: 0.9124, test_f1: 0.5559
 epoch: 12, train_loss: 0.9065, test_loss: 0.9222, test_f1: 0.5225
 epoch: 13, train_loss: 0.8902, test_loss: 0.9200, test_f1: 0.5448
 epoch: 14, train_loss: 0.8731, test_loss: 0.9045, test_f1: 0.5530
 epoch: 15, train_loss: 0.8845, test_loss: 0.9052, test_f1: 0.5483
 epoch: 16, train_loss: 0.8747, test_loss: 0.8793, test_f1: 0.5496
 epoch: 17, train_loss: 0.8694, test_loss: 0.8769, test_f1: 0.5645
 epoch: 18, train_loss: 0.8648, test_loss: 0.8825, test_f1: 0.5489
 epoch: 19, train_loss: 0.8615, test_loss: 0.8823, test_f1: 0.5314
 epoch: 20, train_loss: 0.8606, test_loss: 0.8762, test_f1: 0.5654
 epoch: 21, train_loss: 0.8354, test_loss: 0.8806, test_f1: 0.5708
 epoch: 22, train_loss: 0.8352, test_loss: 0.9145, test_f1: 0.5418
 epoch: 23, train_loss: 0.8353, test_loss: 0.9054, test_f1: 0.5572
 epoch: 24, train_loss: 0.8280, test_loss: 0.8914, test_f1: 0.5558
 epoch: 25, train_loss: 0.8189, test_loss: 0.8897, test_f1: 0.5611
 epoch: 26, train_loss: 0.8249, test_loss: 0.9032, test_f1: 0.5654
 epoch: 27, train_loss: 0.8306, test_loss: 0.8954, test_f1: 0.5656
 epoch: 28, train_loss: 0.8118, test_loss: 0.8716, test_f1: 0.5690
 epoch: 29, train_loss: 0.8205, test_loss: 0.9088, test_f1: 0.5404
 epoch: 30, train_loss: 0.8138, test_loss: 0.8890, test_f1: 0.5788
 epoch: 31, train_loss: 0.8031, test_loss: 0.9040, test_f1: 0.5943
 epoch: 32, train_loss: 0.8097, test_loss: 0.8839, test_f1: 0.5916
 epoch: 33, train_loss: 0.7959, test_loss: 0.9106, test_f1: 0.5671
 epoch: 34, train_loss: 0.7941, test_loss: 0.8702, test_f1: 0.5811
 epoch: 35, train_loss: 0.7871, test_loss: 0.9156, test_f1: 0.5680
 epoch: 36, train_loss: 0.8061, test_loss: 0.9169, test_f1: 0.5761
 epoch: 37, train_loss: 0.7733, test_loss: 0.8912, test_f1: 0.5949
 epoch: 38, train_loss: 0.7817, test_loss: 0.9002, test_f1: 0.5810
 epoch: 39, train_loss: 0.7890, test_loss: 0.8809, test_f1: 0.5978
 epoch: 40, train_loss: 0.7678, test_loss: 0.9152, test_f1: 0.5735
 epoch: 41, train_loss: 0.7694, test_loss: 0.8923, test_f1: 0.5758
 epoch: 42, train_loss: 0.7715, test_loss: 0.8966, test_f1: 0.6012
 epoch: 43, train_loss: 0.7645, test_loss: 0.8765, test_f1: 0.6268
 epoch: 44, train_loss: 0.7640, test_loss: 0.8974, test_f1: 0.6048
 epoch: 45, train_loss: 0.7589, test_loss: 0.9010, test_f1: 0.6057
 epoch: 46, train_loss: 0.7462, test_loss: 0.9178, test_f1: 0.6226
 epoch: 47, train_loss: 0.7667, test_loss: 0.9015, test_f1: 0.6049
 epoch: 48, train_loss: 0.7603, test_loss: 0.8902, test_f1: 0.6243
 epoch: 49, train_loss: 0.7385, test_loss: 0.9376, test_f1: 0.6188
 epoch: 50, train_loss: 0.7342, test_loss: 0.9122, test_f1: 0.6305
 epoch: 51, train_loss: 0.7338, test_loss: 0.9014, test_f1: 0.6409
 epoch: 52, train_loss: 0.7093, test_loss: 0.9069, test_f1: 0.6472
 epoch: 53, train_loss: 0.7035, test_loss: 0.8925, test_f1: 0.6390
 epoch: 54, train_loss: 0.7172, test_loss: 0.9325, test_f1: 0.6120
 epoch: 55, train_loss: 0.7037, test_loss: 0.9601, test_f1: 0.6154
 epoch: 56, train_loss: 0.7038, test_loss: 0.9319, test_f1: 0.6182
 epoch: 57, train_loss: 0.6974, test_loss: 0.9230, test_f1: 0.6469
 epoch: 58, train_loss: 0.7083, test_loss: 0.9226, test_f1: 0.6201
 epoch: 59, train_loss: 0.7048, test_loss: 0.9230, test_f1: 0.6419
 epoch: 60, train_loss: 0.6900, test_loss: 0.9250, test_f1: 0.6481
 epoch: 61, train_loss: 0.6951, test_loss: 0.9265, test_f1: 0.6565
 epoch: 62, train_loss: 0.6892, test_loss: 0.9427, test_f1: 0.6473
 epoch: 63, train_loss: 0.6844, test_loss: 0.9680, test_f1: 0.6136
 epoch: 64, train_loss: 0.6759, test_loss: 0.9432, test_f1: 0.6253
 epoch: 65, train_loss: 0.6834, test_loss: 0.9285, test_f1: 0.6591
 epoch: 66, train_loss: 0.6997, test_loss: 0.9508, test_f1: 0.6499
 epoch: 67, train_loss: 0.6820, test_loss: 0.9367, test_f1: 0.6344
 epoch: 68, train_loss: 0.6718, test_loss: 0.9583, test_f1: 0.6183
 epoch: 69, train_loss: 0.6793, test_loss: 0.9440, test_f1: 0.6395
 epoch: 70, train_loss: 0.6839, test_loss: 0.9793, test_f1: 0.6518
 epoch: 71, train_loss: 0.6798, test_loss: 0.9571, test_f1: 0.6465
 epoch: 72, train_loss: 0.6773, test_loss: 0.9789, test_f1: 0.6378
 epoch: 73, train_loss: 0.6830, test_loss: 0.9564, test_f1: 0.6470
 epoch: 74, train_loss: 0.6847, test_loss: 0.9520, test_f1: 0.6661
 epoch: 75, train_loss: 0.6535, test_loss: 0.9448, test_f1: 0.6613
 epoch: 76, train_loss: 0.6640, test_loss: 0.9515, test_f1: 0.6435
 epoch: 77, train_loss: 0.6564, test_loss: 0.9994, test_f1: 0.6432
 epoch: 78, train_loss: 0.6538, test_loss: 0.9928, test_f1: 0.6610
 epoch: 79, train_loss: 0.6672, test_loss: 0.9731, test_f1: 0.6634
 epoch: 80, train_loss: 0.6450, test_loss: 0.9777, test_f1: 0.6438
 epoch: 81, train_loss: 0.6512, test_loss: 0.9314, test_f1: 0.6558
 epoch: 82, train_loss: 0.6649, test_loss: 0.9856, test_f1: 0.6731
 epoch: 83, train_loss: 0.6379, test_loss: 0.9620, test_f1: 0.6590
 epoch: 84, train_loss: 0.6498, test_loss: 0.9636, test_f1: 0.6598
 epoch: 85, train_loss: 0.6427, test_loss: 0.9634, test_f1: 0.6532
 epoch: 86, train_loss: 0.6369, test_loss: 0.9649, test_f1: 0.6440
 epoch: 87, train_loss: 0.6375, test_loss: 0.9956, test_f1: 0.6597
 epoch: 88, train_loss: 0.6321, test_loss: 0.9784, test_f1: 0.6598
 epoch: 89, train_loss: 0.6472, test_loss: 0.9708, test_f1: 0.6442
 epoch: 90, train_loss: 0.6251, test_loss: 0.9547, test_f1: 0.6507
 epoch: 91, train_loss: 0.6224, test_loss: 1.0123, test_f1: 0.6660
 epoch: 92, train_loss: 0.6142, test_loss: 1.0132, test_f1: 0.6285
 epoch: 93, train_loss: 0.6354, test_loss: 1.0311, test_f1: 0.6556
 epoch: 94, train_loss: 0.6287, test_loss: 1.0011, test_f1: 0.6418
 epoch: 95, train_loss: 0.6331, test_loss: 1.0004, test_f1: 0.6679
 epoch: 96, train_loss: 0.6183, test_loss: 0.9751, test_f1: 0.6494
 epoch: 97, train_loss: 0.6325, test_loss: 0.9817, test_f1: 0.6401
 epoch: 98, train_loss: 0.6241, test_loss: 1.0294, test_f1: 0.6190
 epoch: 99, train_loss: 0.6102, test_loss: 1.0270, test_f1: 0.6371
##################ITERATION #8 ****************************************
 epoch: 0, train_loss: 1.3431, test_loss: 1.0586, test_f1: 0.4182
 epoch: 1, train_loss: 1.0793, test_loss: 0.9585, test_f1: 0.4617
 epoch: 2, train_loss: 1.0151, test_loss: 0.9807, test_f1: 0.4945
 epoch: 3, train_loss: 0.9816, test_loss: 0.9357, test_f1: 0.4866
 epoch: 4, train_loss: 0.9578, test_loss: 0.9686, test_f1: 0.4919
 epoch: 5, train_loss: 0.9409, test_loss: 0.9452, test_f1: 0.4966
 epoch: 6, train_loss: 0.9332, test_loss: 0.9376, test_f1: 0.5328
 epoch: 7, train_loss: 0.9167, test_loss: 0.9608, test_f1: 0.4923
 epoch: 8, train_loss: 0.9039, test_loss: 0.9334, test_f1: 0.4958
 epoch: 9, train_loss: 0.8764, test_loss: 0.9422, test_f1: 0.5006
 epoch: 10, train_loss: 0.8804, test_loss: 0.9300, test_f1: 0.5425
 epoch: 11, train_loss: 0.8803, test_loss: 0.9015, test_f1: 0.5218
 epoch: 12, train_loss: 0.8610, test_loss: 0.9248, test_f1: 0.5532
 epoch: 13, train_loss: 0.8610, test_loss: 0.9309, test_f1: 0.5364
 epoch: 14, train_loss: 0.8523, test_loss: 0.9304, test_f1: 0.5392
 epoch: 15, train_loss: 0.8557, test_loss: 0.9234, test_f1: 0.5174
 epoch: 16, train_loss: 0.8349, test_loss: 0.9160, test_f1: 0.5345
 epoch: 17, train_loss: 0.8359, test_loss: 0.9190, test_f1: 0.5500
 epoch: 18, train_loss: 0.8309, test_loss: 0.8908, test_f1: 0.5605
 epoch: 19, train_loss: 0.8152, test_loss: 0.9548, test_f1: 0.5273
 epoch: 20, train_loss: 0.8095, test_loss: 0.9116, test_f1: 0.5424
 epoch: 21, train_loss: 0.8041, test_loss: 0.9579, test_f1: 0.5303
 epoch: 22, train_loss: 0.8033, test_loss: 0.9413, test_f1: 0.5659
 epoch: 23, train_loss: 0.8249, test_loss: 0.8916, test_f1: 0.5557
 epoch: 24, train_loss: 0.7921, test_loss: 0.9142, test_f1: 0.5394
 epoch: 25, train_loss: 0.7992, test_loss: 0.8964, test_f1: 0.6082
 epoch: 26, train_loss: 0.7991, test_loss: 0.9262, test_f1: 0.5634
 epoch: 27, train_loss: 0.7869, test_loss: 0.9413, test_f1: 0.5409
 epoch: 28, train_loss: 0.7580, test_loss: 0.9226, test_f1: 0.5482
 epoch: 29, train_loss: 0.7640, test_loss: 0.9253, test_f1: 0.5650
 epoch: 30, train_loss: 0.7681, test_loss: 0.9512, test_f1: 0.6020
 epoch: 31, train_loss: 0.7729, test_loss: 0.9250, test_f1: 0.5734
 epoch: 32, train_loss: 0.7605, test_loss: 0.9083, test_f1: 0.5703
 epoch: 33, train_loss: 0.7547, test_loss: 0.9019, test_f1: 0.5715
 epoch: 34, train_loss: 0.7617, test_loss: 1.0372, test_f1: 0.5755
 epoch: 35, train_loss: 0.7558, test_loss: 0.9345, test_f1: 0.5539
 epoch: 36, train_loss: 0.7396, test_loss: 0.9330, test_f1: 0.5820
 epoch: 37, train_loss: 0.7453, test_loss: 0.9920, test_f1: 0.5560
 epoch: 38, train_loss: 0.7313, test_loss: 0.9258, test_f1: 0.5698
 epoch: 39, train_loss: 0.7372, test_loss: 0.8953, test_f1: 0.5700
 epoch: 40, train_loss: 0.7338, test_loss: 0.9777, test_f1: 0.5931
 epoch: 41, train_loss: 0.7264, test_loss: 0.9018, test_f1: 0.5938
 epoch: 42, train_loss: 0.7335, test_loss: 0.9074, test_f1: 0.5949
 epoch: 43, train_loss: 0.7251, test_loss: 0.8910, test_f1: 0.5684
 epoch: 44, train_loss: 0.7194, test_loss: 0.9098, test_f1: 0.6063
 epoch: 45, train_loss: 0.7204, test_loss: 0.8915, test_f1: 0.5908
 epoch: 46, train_loss: 0.7047, test_loss: 0.9337, test_f1: 0.6187
 epoch: 47, train_loss: 0.7077, test_loss: 0.8889, test_f1: 0.6219
 epoch: 48, train_loss: 0.7132, test_loss: 0.9224, test_f1: 0.5959
 epoch: 49, train_loss: 0.7071, test_loss: 0.9047, test_f1: 0.6306
 epoch: 50, train_loss: 0.6985, test_loss: 0.8545, test_f1: 0.5927
 epoch: 51, train_loss: 0.6735, test_loss: 0.8833, test_f1: 0.6145
 epoch: 52, train_loss: 0.6829, test_loss: 0.9033, test_f1: 0.5935
 epoch: 53, train_loss: 0.6573, test_loss: 0.9114, test_f1: 0.6365
 epoch: 54, train_loss: 0.6653, test_loss: 0.8743, test_f1: 0.6293
 epoch: 55, train_loss: 0.6591, test_loss: 0.9305, test_f1: 0.6269
 epoch: 56, train_loss: 0.6464, test_loss: 0.9194, test_f1: 0.6342
 epoch: 57, train_loss: 0.6524, test_loss: 0.9062, test_f1: 0.6269
 epoch: 58, train_loss: 0.6478, test_loss: 0.9179, test_f1: 0.6237
 epoch: 59, train_loss: 0.6417, test_loss: 0.9259, test_f1: 0.6184
 epoch: 60, train_loss: 0.6525, test_loss: 0.9612, test_f1: 0.6368
 epoch: 61, train_loss: 0.6474, test_loss: 0.8981, test_f1: 0.6171
 epoch: 62, train_loss: 0.6527, test_loss: 0.9091, test_f1: 0.6285
 epoch: 63, train_loss: 0.6482, test_loss: 0.9952, test_f1: 0.6177
 epoch: 64, train_loss: 0.6348, test_loss: 0.9063, test_f1: 0.6236
 epoch: 65, train_loss: 0.6393, test_loss: 0.9219, test_f1: 0.6245
 epoch: 66, train_loss: 0.6393, test_loss: 0.9759, test_f1: 0.6209
 epoch: 67, train_loss: 0.6295, test_loss: 0.9360, test_f1: 0.6255
 epoch: 68, train_loss: 0.6262, test_loss: 0.9390, test_f1: 0.6414
 epoch: 69, train_loss: 0.6269, test_loss: 0.9395, test_f1: 0.6317
 epoch: 70, train_loss: 0.6221, test_loss: 0.9280, test_f1: 0.6495
 epoch: 71, train_loss: 0.6124, test_loss: 0.9774, test_f1: 0.6281
 epoch: 72, train_loss: 0.6281, test_loss: 0.9313, test_f1: 0.6477
 epoch: 73, train_loss: 0.6170, test_loss: 0.9527, test_f1: 0.6377
 epoch: 74, train_loss: 0.6039, test_loss: 0.9490, test_f1: 0.6353
 epoch: 75, train_loss: 0.6221, test_loss: 0.9303, test_f1: 0.6357
 epoch: 76, train_loss: 0.6168, test_loss: 0.9239, test_f1: 0.6442
 epoch: 77, train_loss: 0.6241, test_loss: 0.9924, test_f1: 0.6211
 epoch: 78, train_loss: 0.6197, test_loss: 0.9540, test_f1: 0.6346
 epoch: 79, train_loss: 0.6044, test_loss: 1.0004, test_f1: 0.6383
 epoch: 80, train_loss: 0.5995, test_loss: 0.9632, test_f1: 0.6378
 epoch: 81, train_loss: 0.5977, test_loss: 0.9470, test_f1: 0.6392
 epoch: 82, train_loss: 0.6098, test_loss: 0.9860, test_f1: 0.6133
 epoch: 83, train_loss: 0.6002, test_loss: 0.9574, test_f1: 0.6391
 epoch: 84, train_loss: 0.6111, test_loss: 0.9591, test_f1: 0.6334
 epoch: 85, train_loss: 0.5928, test_loss: 0.9375, test_f1: 0.6356
 epoch: 86, train_loss: 0.6039, test_loss: 0.9215, test_f1: 0.6473
 epoch: 87, train_loss: 0.5790, test_loss: 0.9134, test_f1: 0.6438
 epoch: 88, train_loss: 0.6038, test_loss: 0.9522, test_f1: 0.6466
 epoch: 89, train_loss: 0.5905, test_loss: 0.9232, test_f1: 0.6587
 epoch: 90, train_loss: 0.5904, test_loss: 0.9440, test_f1: 0.6273
 epoch: 91, train_loss: 0.5983, test_loss: 0.9634, test_f1: 0.6395
 epoch: 92, train_loss: 0.5791, test_loss: 1.0164, test_f1: 0.6239
 epoch: 93, train_loss: 0.5806, test_loss: 0.9724, test_f1: 0.6497
 epoch: 94, train_loss: 0.5777, test_loss: 0.9929, test_f1: 0.6335
 epoch: 95, train_loss: 0.5905, test_loss: 0.9705, test_f1: 0.6294
 epoch: 96, train_loss: 0.5837, test_loss: 0.9616, test_f1: 0.6540
 epoch: 97, train_loss: 0.5829, test_loss: 0.9750, test_f1: 0.6493
 epoch: 98, train_loss: 0.5825, test_loss: 0.9799, test_f1: 0.6318
 epoch: 99, train_loss: 0.5643, test_loss: 0.9938, test_f1: 0.6475
##################ITERATION #9 ****************************************
 epoch: 0, train_loss: 1.3430, test_loss: 1.1022, test_f1: 0.4602
 epoch: 1, train_loss: 1.1140, test_loss: 0.9900, test_f1: 0.5074
 epoch: 2, train_loss: 1.0570, test_loss: 0.9667, test_f1: 0.5245
 epoch: 3, train_loss: 1.0217, test_loss: 0.9614, test_f1: 0.5009
 epoch: 4, train_loss: 0.9890, test_loss: 0.9375, test_f1: 0.5107
 epoch: 5, train_loss: 0.9813, test_loss: 0.9543, test_f1: 0.5049
 epoch: 6, train_loss: 0.9534, test_loss: 0.9393, test_f1: 0.5089
 epoch: 7, train_loss: 0.9482, test_loss: 0.9377, test_f1: 0.5134
 epoch: 8, train_loss: 0.9344, test_loss: 0.9351, test_f1: 0.5342
 epoch: 9, train_loss: 0.9273, test_loss: 0.9304, test_f1: 0.5227
 epoch: 10, train_loss: 0.9147, test_loss: 0.9216, test_f1: 0.5479
 epoch: 11, train_loss: 0.9078, test_loss: 0.9101, test_f1: 0.5479
 epoch: 12, train_loss: 0.8968, test_loss: 0.9266, test_f1: 0.5205
 epoch: 13, train_loss: 0.8937, test_loss: 0.9140, test_f1: 0.5282
 epoch: 14, train_loss: 0.8820, test_loss: 0.9204, test_f1: 0.5391
 epoch: 15, train_loss: 0.8682, test_loss: 0.9112, test_f1: 0.5362
 epoch: 16, train_loss: 0.8733, test_loss: 0.9237, test_f1: 0.5187
 epoch: 17, train_loss: 0.8662, test_loss: 0.8921, test_f1: 0.5355
 epoch: 18, train_loss: 0.8595, test_loss: 0.8935, test_f1: 0.5409
 epoch: 19, train_loss: 0.8514, test_loss: 0.8619, test_f1: 0.5565
 epoch: 20, train_loss: 0.8425, test_loss: 0.9120, test_f1: 0.5234
 epoch: 21, train_loss: 0.8457, test_loss: 0.8845, test_f1: 0.5628
 epoch: 22, train_loss: 0.8459, test_loss: 0.9074, test_f1: 0.5595
 epoch: 23, train_loss: 0.8327, test_loss: 0.9004, test_f1: 0.5481
 epoch: 24, train_loss: 0.8290, test_loss: 0.8677, test_f1: 0.5609
 epoch: 25, train_loss: 0.8359, test_loss: 0.9140, test_f1: 0.5738
 epoch: 26, train_loss: 0.8245, test_loss: 0.8783, test_f1: 0.5883
 epoch: 27, train_loss: 0.8083, test_loss: 0.9008, test_f1: 0.5750
 epoch: 28, train_loss: 0.8114, test_loss: 0.9170, test_f1: 0.5768
 epoch: 29, train_loss: 0.8020, test_loss: 0.9042, test_f1: 0.5741
 epoch: 30, train_loss: 0.7941, test_loss: 0.9087, test_f1: 0.5682
 epoch: 31, train_loss: 0.7914, test_loss: 0.9153, test_f1: 0.5664
 epoch: 32, train_loss: 0.7808, test_loss: 0.9159, test_f1: 0.5709
 epoch: 33, train_loss: 0.8017, test_loss: 0.9870, test_f1: 0.5683
 epoch: 34, train_loss: 0.7836, test_loss: 0.9473, test_f1: 0.5719
 epoch: 35, train_loss: 0.7808, test_loss: 0.9276, test_f1: 0.5704
 epoch: 36, train_loss: 0.7802, test_loss: 0.9227, test_f1: 0.5796
 epoch: 37, train_loss: 0.7679, test_loss: 0.9054, test_f1: 0.5868
 epoch: 38, train_loss: 0.7614, test_loss: 0.9044, test_f1: 0.5797
 epoch: 39, train_loss: 0.7570, test_loss: 0.8766, test_f1: 0.5802
 epoch: 40, train_loss: 0.7595, test_loss: 0.9319, test_f1: 0.5672
 epoch: 41, train_loss: 0.7536, test_loss: 0.9695, test_f1: 0.5921
 epoch: 42, train_loss: 0.7589, test_loss: 0.9007, test_f1: 0.5903
 epoch: 43, train_loss: 0.7380, test_loss: 0.8962, test_f1: 0.5934
 epoch: 44, train_loss: 0.7351, test_loss: 0.8957, test_f1: 0.5833
 epoch: 45, train_loss: 0.7489, test_loss: 0.8891, test_f1: 0.5902
 epoch: 46, train_loss: 0.7311, test_loss: 0.9082, test_f1: 0.6025
 epoch: 47, train_loss: 0.7416, test_loss: 0.9211, test_f1: 0.6007
 epoch: 48, train_loss: 0.7110, test_loss: 0.9683, test_f1: 0.5848
 epoch: 49, train_loss: 0.7219, test_loss: 0.8877, test_f1: 0.6026
 epoch: 50, train_loss: 0.7351, test_loss: 0.9232, test_f1: 0.5848
 epoch: 51, train_loss: 0.6973, test_loss: 0.9427, test_f1: 0.5876
 epoch: 52, train_loss: 0.6952, test_loss: 0.9128, test_f1: 0.5937
 epoch: 53, train_loss: 0.6999, test_loss: 0.9318, test_f1: 0.6014
 epoch: 54, train_loss: 0.7013, test_loss: 0.9346, test_f1: 0.6051
 epoch: 55, train_loss: 0.6948, test_loss: 0.9114, test_f1: 0.5943
 epoch: 56, train_loss: 0.6908, test_loss: 0.9106, test_f1: 0.5879
 epoch: 57, train_loss: 0.6841, test_loss: 0.9287, test_f1: 0.6068
 epoch: 58, train_loss: 0.6859, test_loss: 0.9477, test_f1: 0.6386
 epoch: 59, train_loss: 0.6733, test_loss: 0.9209, test_f1: 0.6258
 epoch: 60, train_loss: 0.6710, test_loss: 0.9073, test_f1: 0.6166
 epoch: 61, train_loss: 0.6622, test_loss: 0.9587, test_f1: 0.5875
 epoch: 62, train_loss: 0.6593, test_loss: 0.9487, test_f1: 0.5974
 epoch: 63, train_loss: 0.6743, test_loss: 0.9375, test_f1: 0.6440
 epoch: 64, train_loss: 0.6616, test_loss: 0.9896, test_f1: 0.5912
 epoch: 65, train_loss: 0.6657, test_loss: 0.9593, test_f1: 0.6116
 epoch: 66, train_loss: 0.6602, test_loss: 0.9820, test_f1: 0.5975
 epoch: 67, train_loss: 0.6678, test_loss: 0.9914, test_f1: 0.6044
 epoch: 68, train_loss: 0.6570, test_loss: 0.9883, test_f1: 0.6079
 epoch: 69, train_loss: 0.6585, test_loss: 1.0083, test_f1: 0.5923
 epoch: 70, train_loss: 0.6543, test_loss: 0.9772, test_f1: 0.6065
 epoch: 71, train_loss: 0.6541, test_loss: 0.9678, test_f1: 0.5936
 epoch: 72, train_loss: 0.6535, test_loss: 0.9361, test_f1: 0.6374
 epoch: 73, train_loss: 0.6446, test_loss: 1.0100, test_f1: 0.6207
 epoch: 74, train_loss: 0.6545, test_loss: 1.0069, test_f1: 0.6184
 epoch: 75, train_loss: 0.6476, test_loss: 0.9701, test_f1: 0.6209
 epoch: 76, train_loss: 0.6427, test_loss: 1.0142, test_f1: 0.6430
 epoch: 77, train_loss: 0.6318, test_loss: 0.9342, test_f1: 0.6195
 epoch: 78, train_loss: 0.6418, test_loss: 0.9470, test_f1: 0.6273
 epoch: 79, train_loss: 0.6251, test_loss: 1.0026, test_f1: 0.6008
 epoch: 80, train_loss: 0.6327, test_loss: 0.9429, test_f1: 0.6360
 epoch: 81, train_loss: 0.6282, test_loss: 1.0127, test_f1: 0.5985
 epoch: 82, train_loss: 0.6331, test_loss: 0.9730, test_f1: 0.6395
 epoch: 83, train_loss: 0.6344, test_loss: 0.9931, test_f1: 0.6084
 epoch: 84, train_loss: 0.6210, test_loss: 1.0030, test_f1: 0.6348
 epoch: 85, train_loss: 0.6137, test_loss: 0.9644, test_f1: 0.6090
 epoch: 86, train_loss: 0.6277, test_loss: 0.9966, test_f1: 0.5942
 epoch: 87, train_loss: 0.6162, test_loss: 0.9787, test_f1: 0.6399
 epoch: 88, train_loss: 0.6178, test_loss: 0.9811, test_f1: 0.6280
 epoch: 89, train_loss: 0.6180, test_loss: 0.9977, test_f1: 0.6248
 epoch: 90, train_loss: 0.6194, test_loss: 1.0402, test_f1: 0.6087
 epoch: 91, train_loss: 0.6150, test_loss: 0.9876, test_f1: 0.6043
 epoch: 92, train_loss: 0.6223, test_loss: 1.0111, test_f1: 0.6216
 epoch: 93, train_loss: 0.6146, test_loss: 0.9846, test_f1: 0.6273
 epoch: 94, train_loss: 0.6066, test_loss: 1.0262, test_f1: 0.6305
 epoch: 95, train_loss: 0.6100, test_loss: 1.0268, test_f1: 0.6192
 epoch: 96, train_loss: 0.6016, test_loss: 1.0022, test_f1: 0.6577
 epoch: 97, train_loss: 0.6147, test_loss: 1.0278, test_f1: 0.6159
 epoch: 98, train_loss: 0.5902, test_loss: 0.9931, test_f1: 0.6397
 epoch: 99, train_loss: 0.5942, test_loss: 1.0120, test_f1: 0.6557

Training completed in 612.04 seconds
Best F1: 0.6731 at epoch 82
Mean F1 across iterations: 0.6570  0.0118
========================FINAL RESULTS================================
FEGIN weighted F1: 0.6731  0.0118
python main.py --data ltspice_examples --representation component_net --model FEGIN --layers 3 --hiddens 32 --batch_size 64 --lr 0.001 --emb_size 128 --epochs 100 --save_appendix component_net_L3_H32_BS64_LR0.001_E128 --no_val
-----



STDERR:
  File "main.py", line 370, in <module>
    main()
  File "main.py", line 254, in main
    dataset = dataset_class(
  File "/home/philip/projects/ltspice_examples_code_repo/Circuit-Completion-Using-GNNs/component_classification_with_link_prediction_head/evaluation/FEGIN/kernel/circuit_datasets.py", line 15, in __init__
    self.data, self.slices = torch.load(self.processed_paths[0])
  File "/home/philip/.local/lib/python3.8/site-packages/torch/serialization.py", line 1040, in load
    warnings.warn(
  File "/usr/lib/python3.8/warnings.py", line 109, in _showwarnmsg
    sw(msg.message, msg.category, msg.filename, msg.lineno,
  File "main.py", line 47, in warn_with_traceback
    traceback.print_stack(file=log)
/home/philip/projects/ltspice_examples_code_repo/Circuit-Completion-Using-GNNs/component_classification_with_link_prediction_head/evaluation/FEGIN/kernel/circuit_datasets.py:15: FutureWarning: You are using `torch.load` with `weights_only=False` (the current default value), which uses the default pickle module implicitly. It is possible to construct malicious pickle data which will execute arbitrary code during unpickling (See https://github.com/pytorch/pytorch/blob/main/SECURITY.md#untrusted-models for more details). In a future release, the default value for `weights_only` will be flipped to `True`. This limits the functions that could be executed during unpickling. Arbitrary objects will no longer be allowed to be loaded via this mode unless they are explicitly allowlisted by the user via `torch.serialization.add_safe_globals`. We recommend you start setting `weights_only=True` for any use case where you don't have full control of the loaded file. Please open an issue on GitHub for any issues related to this experimental feature.
  self.data, self.slices = torch.load(self.processed_paths[0])
