STDOUT:
Results will be saved in /home/philip/projects/llm_inference_code_repo/Circuit-Completion-Using-GNNs/component_classification_with_link_prediction_head/evaluation/FEGIN/results/model_FEGIN_dataset_ltspice_examples
Command line input: python main.py --data ltspice_examples --representation component_pin_net --model FEGIN --layers 3 --hiddens 16 --batch_size 128 --lr 0.1 --emb_size 128 --epochs 100 --save_appendix component_pin_net_L3_H16_BS128_LR0.1_E128 --no_val
 is saved.
-----
ltspice_examples - FEGIN
Using 3 layers, 16 hidden units, h = 2
Loading component_pin_net representation dataset
ENTERED
Training FEGIN on component_pin_net representation
Train: 3558, Test: 846
##################ITERATION #0 ****************************************
 epoch: 0, train_loss: 1.2352, test_loss: 1.4103, test_f1: 0.3704
 epoch: 1, train_loss: 1.1142, test_loss: 1.1302, test_f1: 0.3422
 epoch: 2, train_loss: 1.0923, test_loss: 1.2969, test_f1: 0.3341
 epoch: 3, train_loss: 1.0905, test_loss: 1.6740, test_f1: 0.3399
 epoch: 4, train_loss: 1.0960, test_loss: 1.0965, test_f1: 0.3356
 epoch: 5, train_loss: 1.0699, test_loss: 1.0922, test_f1: 0.3422
 epoch: 6, train_loss: 1.0938, test_loss: 1.0606, test_f1: 0.3797
 epoch: 7, train_loss: 1.0889, test_loss: 1.1956, test_f1: 0.3061
 epoch: 8, train_loss: 1.0823, test_loss: 1.1386, test_f1: 0.3450
 epoch: 9, train_loss: 1.0650, test_loss: 1.0949, test_f1: 0.3645
 epoch: 10, train_loss: 1.0755, test_loss: 1.1042, test_f1: 0.3681
 epoch: 11, train_loss: 1.0843, test_loss: 1.0793, test_f1: 0.3416
 epoch: 12, train_loss: 1.0663, test_loss: 1.0378, test_f1: 0.3563
 epoch: 13, train_loss: 1.0660, test_loss: 1.0480, test_f1: 0.3422
 epoch: 14, train_loss: 1.0894, test_loss: 5.1795, test_f1: 0.1534
 epoch: 15, train_loss: 1.1405, test_loss: 1.2222, test_f1: 0.3029
 epoch: 16, train_loss: 1.1072, test_loss: 1.0974, test_f1: 0.3481
 epoch: 17, train_loss: 1.1158, test_loss: 1.1053, test_f1: 0.3481
 epoch: 18, train_loss: 1.1147, test_loss: 1.4201, test_f1: 0.3336
 epoch: 19, train_loss: 1.0984, test_loss: 1.1850, test_f1: 0.3450
 epoch: 20, train_loss: 1.0960, test_loss: 1.1300, test_f1: 0.3413
 epoch: 21, train_loss: 1.0957, test_loss: 1.2370, test_f1: 0.3309
 epoch: 22, train_loss: 1.0955, test_loss: 1.0935, test_f1: 0.3422
 epoch: 23, train_loss: 1.1518, test_loss: 1.1032, test_f1: 0.3360
 epoch: 24, train_loss: 1.1079, test_loss: 1.1453, test_f1: 0.3413
 epoch: 25, train_loss: 1.1176, test_loss: 1.2121, test_f1: 0.3410
 epoch: 26, train_loss: 1.0911, test_loss: 1.1261, test_f1: 0.3402
 epoch: 27, train_loss: 1.0957, test_loss: 1.6415, test_f1: 0.2810
 epoch: 28, train_loss: 1.0941, test_loss: 1.1004, test_f1: 0.3413
 epoch: 29, train_loss: 1.0945, test_loss: 1.1242, test_f1: 0.3422
 epoch: 30, train_loss: 1.0951, test_loss: 1.2348, test_f1: 0.3354
 epoch: 31, train_loss: 1.0892, test_loss: 1.1823, test_f1: 0.3358
 epoch: 32, train_loss: 1.0821, test_loss: 1.1110, test_f1: 0.3432
 epoch: 33, train_loss: 1.0893, test_loss: 1.1095, test_f1: 0.3476
 epoch: 34, train_loss: 1.0739, test_loss: 1.1279, test_f1: 0.3400
 epoch: 35, train_loss: 1.0747, test_loss: 1.2033, test_f1: 0.3284
 epoch: 36, train_loss: 1.0832, test_loss: 1.3983, test_f1: 0.3176
 epoch: 37, train_loss: 1.0838, test_loss: 1.1059, test_f1: 0.3422
 epoch: 38, train_loss: 1.0833, test_loss: 1.1691, test_f1: 0.3497
 epoch: 39, train_loss: 1.0933, test_loss: 1.7263, test_f1: 0.2233
 epoch: 40, train_loss: 1.1043, test_loss: 1.1136, test_f1: 0.3393
 epoch: 41, train_loss: 1.0861, test_loss: 1.2973, test_f1: 0.3353
 epoch: 42, train_loss: 1.0854, test_loss: 1.2029, test_f1: 0.3381
 epoch: 43, train_loss: 1.0937, test_loss: 1.1482, test_f1: 0.3414
 epoch: 44, train_loss: 1.0773, test_loss: 1.1826, test_f1: 0.3400
 epoch: 45, train_loss: 1.0709, test_loss: 1.0999, test_f1: 0.3514
 epoch: 46, train_loss: 1.1286, test_loss: 1.2496, test_f1: 0.3354
 epoch: 47, train_loss: 1.1085, test_loss: 1.1207, test_f1: 0.3422
 epoch: 48, train_loss: 1.0975, test_loss: 1.1131, test_f1: 0.3413
 epoch: 49, train_loss: 1.0854, test_loss: 1.1508, test_f1: 0.3441
 epoch: 50, train_loss: 1.0835, test_loss: 1.7005, test_f1: 0.2519
 epoch: 51, train_loss: 1.0851, test_loss: 1.3127, test_f1: 0.3469
 epoch: 52, train_loss: 1.0725, test_loss: 1.1464, test_f1: 0.3413
 epoch: 53, train_loss: 1.0720, test_loss: 1.0935, test_f1: 0.3422
 epoch: 54, train_loss: 1.0599, test_loss: 1.0978, test_f1: 0.4081
 epoch: 55, train_loss: 1.0610, test_loss: 1.1039, test_f1: 0.3345
 epoch: 56, train_loss: 1.0632, test_loss: 1.2433, test_f1: 0.3233
 epoch: 57, train_loss: 1.0609, test_loss: 1.1778, test_f1: 0.3426
 epoch: 58, train_loss: 1.0545, test_loss: 1.1547, test_f1: 0.3414
 epoch: 59, train_loss: 1.0589, test_loss: 1.0664, test_f1: 0.3827
 epoch: 60, train_loss: 1.0587, test_loss: 1.0954, test_f1: 0.3684
 epoch: 61, train_loss: 1.0695, test_loss: 1.2135, test_f1: 0.3416
 epoch: 62, train_loss: 1.0690, test_loss: 1.1190, test_f1: 0.3522
 epoch: 63, train_loss: 1.0731, test_loss: 1.2358, test_f1: 0.3414
 epoch: 64, train_loss: 1.0693, test_loss: 1.2091, test_f1: 0.3434
 epoch: 65, train_loss: 1.0789, test_loss: 1.2507, test_f1: 0.3424
 epoch: 66, train_loss: 1.0784, test_loss: 1.1155, test_f1: 0.3441
 epoch: 67, train_loss: 1.0733, test_loss: 1.1204, test_f1: 0.3414
 epoch: 68, train_loss: 1.0773, test_loss: 1.3010, test_f1: 0.3426
 epoch: 69, train_loss: 1.0831, test_loss: 1.2052, test_f1: 0.3446
 epoch: 70, train_loss: 1.0775, test_loss: 1.4378, test_f1: 0.3128
 epoch: 71, train_loss: 1.0734, test_loss: 1.1627, test_f1: 0.3414
 epoch: 72, train_loss: 1.0775, test_loss: 1.1802, test_f1: 0.3426
 epoch: 73, train_loss: 1.0714, test_loss: 1.1325, test_f1: 0.3416
 epoch: 74, train_loss: 1.0797, test_loss: 1.1047, test_f1: 0.3445
 epoch: 75, train_loss: 1.0997, test_loss: 1.1562, test_f1: 0.3278
 epoch: 76, train_loss: 1.0687, test_loss: 1.1295, test_f1: 0.3405
 epoch: 77, train_loss: 1.0594, test_loss: 1.3476, test_f1: 0.3819
 epoch: 78, train_loss: 1.0728, test_loss: 1.0519, test_f1: 0.3974
 epoch: 79, train_loss: 1.0529, test_loss: 1.0725, test_f1: 0.4140
 epoch: 80, train_loss: 1.0545, test_loss: 1.0724, test_f1: 0.3892
 epoch: 81, train_loss: 1.0629, test_loss: 1.3561, test_f1: 0.4038
 epoch: 82, train_loss: 1.0621, test_loss: 1.2167, test_f1: 0.3424
 epoch: 83, train_loss: 1.0576, test_loss: 1.2720, test_f1: 0.3654
 epoch: 84, train_loss: 1.0654, test_loss: 1.1061, test_f1: 0.3451
 epoch: 85, train_loss: 1.0705, test_loss: 1.1246, test_f1: 0.3491
 epoch: 86, train_loss: 1.0609, test_loss: 1.0996, test_f1: 0.3649
 epoch: 87, train_loss: 1.0546, test_loss: 1.1011, test_f1: 0.3422
 epoch: 88, train_loss: 1.0494, test_loss: 1.1673, test_f1: 0.3567
 epoch: 89, train_loss: 1.0750, test_loss: 1.8984, test_f1: 0.2511
 epoch: 90, train_loss: 1.0840, test_loss: 1.3066, test_f1: 0.3403
 epoch: 91, train_loss: 1.0795, test_loss: 1.2031, test_f1: 0.3460
 epoch: 92, train_loss: 1.0843, test_loss: 1.2918, test_f1: 0.3460
 epoch: 93, train_loss: 1.0757, test_loss: 1.1985, test_f1: 0.3460
 epoch: 94, train_loss: 1.0734, test_loss: 1.1420, test_f1: 0.3422
 epoch: 95, train_loss: 1.0709, test_loss: 1.1701, test_f1: 0.3447
 epoch: 96, train_loss: 1.0769, test_loss: 1.1700, test_f1: 0.3450
 epoch: 97, train_loss: 1.0782, test_loss: 1.1969, test_f1: 0.3523
 epoch: 98, train_loss: 1.0610, test_loss: 1.1859, test_f1: 0.3690
 epoch: 99, train_loss: 1.0566, test_loss: 1.1448, test_f1: 0.3413
##################ITERATION #1 ****************************************
 epoch: 0, train_loss: 1.3736, test_loss: 1.3156, test_f1: 0.2270
 epoch: 1, train_loss: 1.3054, test_loss: 1.3179, test_f1: 0.2270
 epoch: 2, train_loss: 1.3031, test_loss: 1.3144, test_f1: 0.2270
 epoch: 3, train_loss: 1.3023, test_loss: 1.3142, test_f1: 0.2270
 epoch: 4, train_loss: 1.3022, test_loss: 1.3174, test_f1: 0.2270
 epoch: 5, train_loss: 1.3019, test_loss: 1.3138, test_f1: 0.2270
 epoch: 6, train_loss: 1.3027, test_loss: 1.3208, test_f1: 0.2270
 epoch: 7, train_loss: 1.3024, test_loss: 1.3140, test_f1: 0.2270
 epoch: 8, train_loss: 1.3026, test_loss: 1.3158, test_f1: 0.2270
 epoch: 9, train_loss: 1.3027, test_loss: 1.3141, test_f1: 0.2270
 epoch: 10, train_loss: 1.3029, test_loss: 1.3157, test_f1: 0.2270
 epoch: 11, train_loss: 1.3031, test_loss: 1.3155, test_f1: 0.2270
 epoch: 12, train_loss: 1.3041, test_loss: 1.3167, test_f1: 0.2270
 epoch: 13, train_loss: 1.3020, test_loss: 1.3135, test_f1: 0.2270
 epoch: 14, train_loss: 1.3034, test_loss: 1.3192, test_f1: 0.2270
 epoch: 15, train_loss: 1.3043, test_loss: 1.3171, test_f1: 0.2270
 epoch: 16, train_loss: 1.3028, test_loss: 1.3159, test_f1: 0.2270
 epoch: 17, train_loss: 1.3031, test_loss: 1.3154, test_f1: 0.2270
 epoch: 18, train_loss: 1.3032, test_loss: 1.3151, test_f1: 0.2270
 epoch: 19, train_loss: 1.3025, test_loss: 1.3174, test_f1: 0.2270
 epoch: 20, train_loss: 1.3031, test_loss: 1.3147, test_f1: 0.2270
 epoch: 21, train_loss: 1.3036, test_loss: 1.3155, test_f1: 0.2270
 epoch: 22, train_loss: 1.3028, test_loss: 1.3146, test_f1: 0.2270
 epoch: 23, train_loss: 1.3025, test_loss: 1.3159, test_f1: 0.2270
 epoch: 24, train_loss: 1.3032, test_loss: 1.3137, test_f1: 0.2270
 epoch: 25, train_loss: 1.3029, test_loss: 1.3158, test_f1: 0.2270
 epoch: 26, train_loss: 1.3027, test_loss: 1.3157, test_f1: 0.2270
 epoch: 27, train_loss: 1.3027, test_loss: 1.3155, test_f1: 0.2270
 epoch: 28, train_loss: 1.3031, test_loss: 1.3182, test_f1: 0.2270
 epoch: 29, train_loss: 1.3030, test_loss: 1.3204, test_f1: 0.2270
 epoch: 30, train_loss: 1.3030, test_loss: 1.3142, test_f1: 0.2270
 epoch: 31, train_loss: 1.3036, test_loss: 1.3144, test_f1: 0.2270
 epoch: 32, train_loss: 1.3024, test_loss: 1.3145, test_f1: 0.2270
 epoch: 33, train_loss: 1.3020, test_loss: 1.3225, test_f1: 0.2270
 epoch: 34, train_loss: 1.3037, test_loss: 1.3158, test_f1: 0.2270
 epoch: 35, train_loss: 1.3027, test_loss: 1.3151, test_f1: 0.2270
 epoch: 36, train_loss: 1.3030, test_loss: 1.3148, test_f1: 0.2270
 epoch: 37, train_loss: 1.3033, test_loss: 1.3179, test_f1: 0.2270
 epoch: 38, train_loss: 1.3017, test_loss: 1.3145, test_f1: 0.2270
 epoch: 39, train_loss: 1.3029, test_loss: 1.3167, test_f1: 0.2270
 epoch: 40, train_loss: 1.3023, test_loss: 1.3154, test_f1: 0.2270
 epoch: 41, train_loss: 1.3028, test_loss: 1.3148, test_f1: 0.2270
 epoch: 42, train_loss: 1.3030, test_loss: 1.3144, test_f1: 0.2270
 epoch: 43, train_loss: 1.3017, test_loss: 1.3165, test_f1: 0.2270
 epoch: 44, train_loss: 1.3027, test_loss: 1.3174, test_f1: 0.2270
 epoch: 45, train_loss: 1.3032, test_loss: 1.3187, test_f1: 0.2270
 epoch: 46, train_loss: 1.3043, test_loss: 1.3136, test_f1: 0.2270
 epoch: 47, train_loss: 1.3041, test_loss: 1.3150, test_f1: 0.2270
 epoch: 48, train_loss: 1.3034, test_loss: 1.3144, test_f1: 0.2270
 epoch: 49, train_loss: 1.3034, test_loss: 1.3147, test_f1: 0.2270
 epoch: 50, train_loss: 1.3029, test_loss: 1.3178, test_f1: 0.2270
 epoch: 51, train_loss: 1.3022, test_loss: 1.3157, test_f1: 0.2270
 epoch: 52, train_loss: 1.3021, test_loss: 1.3147, test_f1: 0.2270
 epoch: 53, train_loss: 1.3023, test_loss: 1.3154, test_f1: 0.2270
 epoch: 54, train_loss: 1.3030, test_loss: 1.3134, test_f1: 0.2270
 epoch: 55, train_loss: 1.3019, test_loss: 1.3161, test_f1: 0.2270
 epoch: 56, train_loss: 1.3017, test_loss: 1.3151, test_f1: 0.2270
 epoch: 57, train_loss: 1.3022, test_loss: 1.3167, test_f1: 0.2270
 epoch: 58, train_loss: 1.3027, test_loss: 1.3159, test_f1: 0.2270
 epoch: 59, train_loss: 1.3021, test_loss: 1.3144, test_f1: 0.2270
 epoch: 60, train_loss: 1.3027, test_loss: 1.3179, test_f1: 0.2270
 epoch: 61, train_loss: 1.3023, test_loss: 1.3150, test_f1: 0.2270
 epoch: 62, train_loss: 1.3024, test_loss: 1.3149, test_f1: 0.2270
 epoch: 63, train_loss: 1.3022, test_loss: 1.3147, test_f1: 0.2270
 epoch: 64, train_loss: 1.3022, test_loss: 1.3183, test_f1: 0.2270
 epoch: 65, train_loss: 1.3025, test_loss: 1.3142, test_f1: 0.2270
 epoch: 66, train_loss: 1.3017, test_loss: 1.3154, test_f1: 0.2270
 epoch: 67, train_loss: 1.3023, test_loss: 1.3176, test_f1: 0.2270
 epoch: 68, train_loss: 1.3019, test_loss: 1.3144, test_f1: 0.2270
 epoch: 69, train_loss: 1.3020, test_loss: 1.3155, test_f1: 0.2270
 epoch: 70, train_loss: 1.3016, test_loss: 1.3146, test_f1: 0.2270
 epoch: 71, train_loss: 1.3020, test_loss: 1.3151, test_f1: 0.2270
 epoch: 72, train_loss: 1.3017, test_loss: 1.3144, test_f1: 0.2270
 epoch: 73, train_loss: 1.3018, test_loss: 1.3161, test_f1: 0.2270
 epoch: 74, train_loss: 1.3021, test_loss: 1.3155, test_f1: 0.2270
 epoch: 75, train_loss: 1.3017, test_loss: 1.3151, test_f1: 0.2270
 epoch: 76, train_loss: 1.3023, test_loss: 1.3139, test_f1: 0.2270
 epoch: 77, train_loss: 1.3020, test_loss: 1.3149, test_f1: 0.2270
 epoch: 78, train_loss: 1.3019, test_loss: 1.3152, test_f1: 0.2270
 epoch: 79, train_loss: 1.3020, test_loss: 1.3157, test_f1: 0.2270
 epoch: 80, train_loss: 1.3023, test_loss: 1.3147, test_f1: 0.2270
 epoch: 81, train_loss: 1.3023, test_loss: 1.3159, test_f1: 0.2270
 epoch: 82, train_loss: 1.3019, test_loss: 1.3142, test_f1: 0.2270
 epoch: 83, train_loss: 1.3016, test_loss: 1.3161, test_f1: 0.2270
 epoch: 84, train_loss: 1.3020, test_loss: 1.3150, test_f1: 0.2270
 epoch: 85, train_loss: 1.3020, test_loss: 1.3150, test_f1: 0.2270
 epoch: 86, train_loss: 1.3026, test_loss: 1.3146, test_f1: 0.2270
 epoch: 87, train_loss: 1.3020, test_loss: 1.3141, test_f1: 0.2270
 epoch: 88, train_loss: 1.3019, test_loss: 1.3151, test_f1: 0.2270
 epoch: 89, train_loss: 1.3023, test_loss: 1.3158, test_f1: 0.2270
 epoch: 90, train_loss: 1.3022, test_loss: 1.3163, test_f1: 0.2270
 epoch: 91, train_loss: 1.3027, test_loss: 1.3147, test_f1: 0.2270
 epoch: 92, train_loss: 1.3024, test_loss: 1.3156, test_f1: 0.2270
 epoch: 93, train_loss: 1.3034, test_loss: 1.3156, test_f1: 0.2270
 epoch: 94, train_loss: 1.3022, test_loss: 1.3143, test_f1: 0.2270
 epoch: 95, train_loss: 1.3016, test_loss: 1.3152, test_f1: 0.2270
 epoch: 96, train_loss: 1.3019, test_loss: 1.3164, test_f1: 0.2270
 epoch: 97, train_loss: 1.3021, test_loss: 1.3147, test_f1: 0.2270
 epoch: 98, train_loss: 1.3027, test_loss: 1.3137, test_f1: 0.2270
 epoch: 99, train_loss: 1.3020, test_loss: 1.3166, test_f1: 0.2270
##################ITERATION #2 ****************************************
 epoch: 0, train_loss: 1.3096, test_loss: 1.3154, test_f1: 0.2270
 epoch: 1, train_loss: 1.3046, test_loss: 1.3142, test_f1: 0.2270
 epoch: 2, train_loss: 1.3038, test_loss: 1.3175, test_f1: 0.2270
 epoch: 3, train_loss: 1.3033, test_loss: 1.3166, test_f1: 0.2270
 epoch: 4, train_loss: 1.3024, test_loss: 1.3171, test_f1: 0.2270
 epoch: 5, train_loss: 1.3034, test_loss: 1.3151, test_f1: 0.2270
 epoch: 6, train_loss: 1.3025, test_loss: 1.3167, test_f1: 0.2270
 epoch: 7, train_loss: 1.3034, test_loss: 1.3143, test_f1: 0.2270
 epoch: 8, train_loss: 1.3028, test_loss: 1.3142, test_f1: 0.2270
 epoch: 9, train_loss: 1.3031, test_loss: 1.3161, test_f1: 0.2270
 epoch: 10, train_loss: 1.3031, test_loss: 1.3199, test_f1: 0.2270
 epoch: 11, train_loss: 1.3022, test_loss: 1.3140, test_f1: 0.2270
 epoch: 12, train_loss: 1.3021, test_loss: 1.3164, test_f1: 0.2270
 epoch: 13, train_loss: 1.3044, test_loss: 1.3209, test_f1: 0.2270
 epoch: 14, train_loss: 1.3036, test_loss: 1.3201, test_f1: 0.2270
 epoch: 15, train_loss: 1.3023, test_loss: 1.3133, test_f1: 0.2270
 epoch: 16, train_loss: 1.3041, test_loss: 1.3148, test_f1: 0.2270
 epoch: 17, train_loss: 1.3049, test_loss: 1.3153, test_f1: 0.2270
 epoch: 18, train_loss: 1.3052, test_loss: 1.3154, test_f1: 0.2270
 epoch: 19, train_loss: 1.3049, test_loss: 1.3147, test_f1: 0.2270
 epoch: 20, train_loss: 1.3019, test_loss: 1.3170, test_f1: 0.2270
 epoch: 21, train_loss: 1.3026, test_loss: 1.3165, test_f1: 0.2270
 epoch: 22, train_loss: 1.3029, test_loss: 1.3139, test_f1: 0.2270
 epoch: 23, train_loss: 1.3020, test_loss: 1.3141, test_f1: 0.2270
 epoch: 24, train_loss: 1.3063, test_loss: 1.3184, test_f1: 0.2270
 epoch: 25, train_loss: 1.3034, test_loss: 1.3175, test_f1: 0.2270
 epoch: 26, train_loss: 1.3030, test_loss: 1.3155, test_f1: 0.2270
 epoch: 27, train_loss: 1.3025, test_loss: 1.3151, test_f1: 0.2270
 epoch: 28, train_loss: 1.3033, test_loss: 1.3254, test_f1: 0.2270
 epoch: 29, train_loss: 1.3029, test_loss: 1.3180, test_f1: 0.2270
 epoch: 30, train_loss: 1.3038, test_loss: 1.3169, test_f1: 0.2270
 epoch: 31, train_loss: 1.3032, test_loss: 1.3132, test_f1: 0.2270
 epoch: 32, train_loss: 1.3027, test_loss: 1.3181, test_f1: 0.2270
 epoch: 33, train_loss: 1.3030, test_loss: 1.3149, test_f1: 0.2270
 epoch: 34, train_loss: 1.3030, test_loss: 1.3154, test_f1: 0.2270
 epoch: 35, train_loss: 1.3029, test_loss: 1.3146, test_f1: 0.2270
 epoch: 36, train_loss: 1.3036, test_loss: 1.3152, test_f1: 0.2270
 epoch: 37, train_loss: 1.3033, test_loss: 1.3155, test_f1: 0.2270
 epoch: 38, train_loss: 1.3019, test_loss: 1.3150, test_f1: 0.2270
 epoch: 39, train_loss: 1.3027, test_loss: 1.3171, test_f1: 0.2270
 epoch: 40, train_loss: 1.3025, test_loss: 1.3161, test_f1: 0.2270
 epoch: 41, train_loss: 1.3036, test_loss: 1.3146, test_f1: 0.2270
 epoch: 42, train_loss: 1.3027, test_loss: 1.3144, test_f1: 0.2270
 epoch: 43, train_loss: 1.3023, test_loss: 1.3159, test_f1: 0.2270
 epoch: 44, train_loss: 1.3025, test_loss: 1.3155, test_f1: 0.2270
 epoch: 45, train_loss: 1.3025, test_loss: 1.3138, test_f1: 0.2270
 epoch: 46, train_loss: 1.3021, test_loss: 1.3168, test_f1: 0.2270
 epoch: 47, train_loss: 1.3020, test_loss: 1.3173, test_f1: 0.2270
 epoch: 48, train_loss: 1.3026, test_loss: 1.3151, test_f1: 0.2270
 epoch: 49, train_loss: 1.3035, test_loss: 1.3169, test_f1: 0.2270
 epoch: 50, train_loss: 1.3028, test_loss: 1.3152, test_f1: 0.2270
 epoch: 51, train_loss: 1.3024, test_loss: 1.3159, test_f1: 0.2270
 epoch: 52, train_loss: 1.3025, test_loss: 1.3159, test_f1: 0.2270
 epoch: 53, train_loss: 1.3019, test_loss: 1.3155, test_f1: 0.2270
 epoch: 54, train_loss: 1.3017, test_loss: 1.3145, test_f1: 0.2270
 epoch: 55, train_loss: 1.3024, test_loss: 1.3140, test_f1: 0.2270
 epoch: 56, train_loss: 1.3024, test_loss: 1.3159, test_f1: 0.2270
 epoch: 57, train_loss: 1.3020, test_loss: 1.3152, test_f1: 0.2270
 epoch: 58, train_loss: 1.3021, test_loss: 1.3146, test_f1: 0.2270
 epoch: 59, train_loss: 1.3025, test_loss: 1.3159, test_f1: 0.2270
 epoch: 60, train_loss: 1.3030, test_loss: 1.3153, test_f1: 0.2270
 epoch: 61, train_loss: 1.3026, test_loss: 1.3148, test_f1: 0.2270
 epoch: 62, train_loss: 1.3023, test_loss: 1.3160, test_f1: 0.2270
 epoch: 63, train_loss: 1.3019, test_loss: 1.3149, test_f1: 0.2270
 epoch: 64, train_loss: 1.3028, test_loss: 1.3167, test_f1: 0.2270
 epoch: 65, train_loss: 1.3016, test_loss: 1.3148, test_f1: 0.2270
 epoch: 66, train_loss: 1.3020, test_loss: 1.3150, test_f1: 0.2270
 epoch: 67, train_loss: 1.3024, test_loss: 1.3145, test_f1: 0.2270
 epoch: 68, train_loss: 1.3026, test_loss: 1.3140, test_f1: 0.2270
 epoch: 69, train_loss: 1.3016, test_loss: 1.3152, test_f1: 0.2270
 epoch: 70, train_loss: 1.3016, test_loss: 1.3166, test_f1: 0.2270
 epoch: 71, train_loss: 1.3018, test_loss: 1.3150, test_f1: 0.2270
 epoch: 72, train_loss: 1.3020, test_loss: 1.3148, test_f1: 0.2270
 epoch: 73, train_loss: 1.3018, test_loss: 1.3160, test_f1: 0.2270
 epoch: 74, train_loss: 1.3028, test_loss: 1.3146, test_f1: 0.2270
 epoch: 75, train_loss: 1.3024, test_loss: 1.3168, test_f1: 0.2270
 epoch: 76, train_loss: 1.3017, test_loss: 1.3144, test_f1: 0.2270
 epoch: 77, train_loss: 1.3016, test_loss: 1.3153, test_f1: 0.2270
 epoch: 78, train_loss: 1.3021, test_loss: 1.3159, test_f1: 0.2270
 epoch: 79, train_loss: 1.3019, test_loss: 1.3144, test_f1: 0.2270
 epoch: 80, train_loss: 1.3023, test_loss: 1.3158, test_f1: 0.2270
 epoch: 81, train_loss: 1.3019, test_loss: 1.3144, test_f1: 0.2270
 epoch: 82, train_loss: 1.3040, test_loss: 1.3177, test_f1: 0.2270
 epoch: 83, train_loss: 1.3026, test_loss: 1.3161, test_f1: 0.2270
 epoch: 84, train_loss: 1.3022, test_loss: 1.3144, test_f1: 0.2270
 epoch: 85, train_loss: 1.3019, test_loss: 1.3155, test_f1: 0.2270
 epoch: 86, train_loss: 1.3028, test_loss: 1.3144, test_f1: 0.2270
 epoch: 87, train_loss: 1.3026, test_loss: 1.3158, test_f1: 0.2270
 epoch: 88, train_loss: 1.3028, test_loss: 1.3154, test_f1: 0.2270
 epoch: 89, train_loss: 1.3020, test_loss: 1.3148, test_f1: 0.2270
 epoch: 90, train_loss: 1.3021, test_loss: 1.3155, test_f1: 0.2270
 epoch: 91, train_loss: 1.3028, test_loss: 1.3157, test_f1: 0.2270
 epoch: 92, train_loss: 1.3020, test_loss: 1.3149, test_f1: 0.2270
 epoch: 93, train_loss: 1.3020, test_loss: 1.3154, test_f1: 0.2270
 epoch: 94, train_loss: 1.3018, test_loss: 1.3147, test_f1: 0.2270
 epoch: 95, train_loss: 1.3021, test_loss: 1.3149, test_f1: 0.2270
 epoch: 96, train_loss: 1.3018, test_loss: 1.3152, test_f1: 0.2270
 epoch: 97, train_loss: 1.3021, test_loss: 1.3149, test_f1: 0.2270
 epoch: 98, train_loss: 1.3021, test_loss: 1.3148, test_f1: 0.2270
 epoch: 99, train_loss: 1.3019, test_loss: 1.3149, test_f1: 0.2270
##################ITERATION #3 ****************************************
 epoch: 0, train_loss: 1.3086, test_loss: 1.3224, test_f1: 0.2270
 epoch: 1, train_loss: 1.3052, test_loss: 1.3131, test_f1: 0.2270
 epoch: 2, train_loss: 1.3141, test_loss: 1.3200, test_f1: 0.2270
 epoch: 3, train_loss: 1.3040, test_loss: 1.3197, test_f1: 0.2270
 epoch: 4, train_loss: 1.3020, test_loss: 1.3133, test_f1: 0.2270
 epoch: 5, train_loss: 1.3025, test_loss: 1.3192, test_f1: 0.2270
 epoch: 6, train_loss: 1.3027, test_loss: 1.3155, test_f1: 0.2270
 epoch: 7, train_loss: 1.3031, test_loss: 1.3154, test_f1: 0.2270
 epoch: 8, train_loss: 1.3019, test_loss: 1.3148, test_f1: 0.2270
 epoch: 9, train_loss: 1.3030, test_loss: 1.3142, test_f1: 0.2270
 epoch: 10, train_loss: 1.3024, test_loss: 1.3150, test_f1: 0.2270
 epoch: 11, train_loss: 1.3023, test_loss: 1.3152, test_f1: 0.2270
 epoch: 12, train_loss: 1.3028, test_loss: 1.3169, test_f1: 0.2270
 epoch: 13, train_loss: 1.3035, test_loss: 1.3182, test_f1: 0.2270
 epoch: 14, train_loss: 1.3029, test_loss: 1.3134, test_f1: 0.2270
 epoch: 15, train_loss: 1.3024, test_loss: 1.3177, test_f1: 0.2270
 epoch: 16, train_loss: 1.3044, test_loss: 1.3171, test_f1: 0.2270
 epoch: 17, train_loss: 1.3039, test_loss: 1.3148, test_f1: 0.2270
 epoch: 18, train_loss: 1.3021, test_loss: 1.3176, test_f1: 0.2270
 epoch: 19, train_loss: 1.3026, test_loss: 1.3210, test_f1: 0.2270
 epoch: 20, train_loss: 1.3044, test_loss: 1.3202, test_f1: 0.2270
 epoch: 21, train_loss: 1.3035, test_loss: 1.3162, test_f1: 0.2270
 epoch: 22, train_loss: 1.3030, test_loss: 1.3167, test_f1: 0.2270
 epoch: 23, train_loss: 1.3034, test_loss: 1.3152, test_f1: 0.2270
 epoch: 24, train_loss: 1.3033, test_loss: 1.3135, test_f1: 0.2270
 epoch: 25, train_loss: 1.3027, test_loss: 1.3144, test_f1: 0.2270
 epoch: 26, train_loss: 1.3044, test_loss: 1.3162, test_f1: 0.2270
 epoch: 27, train_loss: 1.3042, test_loss: 1.3175, test_f1: 0.2270
 epoch: 28, train_loss: 1.3029, test_loss: 1.3151, test_f1: 0.2270
 epoch: 29, train_loss: 1.3034, test_loss: 1.3170, test_f1: 0.2270
 epoch: 30, train_loss: 1.3022, test_loss: 1.3143, test_f1: 0.2270
 epoch: 31, train_loss: 1.3028, test_loss: 1.3146, test_f1: 0.2270
 epoch: 32, train_loss: 1.3024, test_loss: 1.3176, test_f1: 0.2270
 epoch: 33, train_loss: 1.3032, test_loss: 1.3190, test_f1: 0.2270
 epoch: 34, train_loss: 1.3036, test_loss: 1.3169, test_f1: 0.2270
 epoch: 35, train_loss: 1.3027, test_loss: 1.3162, test_f1: 0.2270
 epoch: 36, train_loss: 1.3029, test_loss: 1.3158, test_f1: 0.2270
 epoch: 37, train_loss: 1.3031, test_loss: 1.3158, test_f1: 0.2270
 epoch: 38, train_loss: 1.3024, test_loss: 1.3135, test_f1: 0.2270
 epoch: 39, train_loss: 1.3038, test_loss: 1.3156, test_f1: 0.2270
 epoch: 40, train_loss: 1.3044, test_loss: 1.3174, test_f1: 0.2270
 epoch: 41, train_loss: 1.3024, test_loss: 1.3196, test_f1: 0.2270
 epoch: 42, train_loss: 1.3025, test_loss: 1.3164, test_f1: 0.2270
 epoch: 43, train_loss: 1.3025, test_loss: 1.3138, test_f1: 0.2270
 epoch: 44, train_loss: 1.3033, test_loss: 1.3141, test_f1: 0.2270
 epoch: 45, train_loss: 1.3044, test_loss: 1.3153, test_f1: 0.2270
 epoch: 46, train_loss: 1.3029, test_loss: 1.3194, test_f1: 0.2270
 epoch: 47, train_loss: 1.3026, test_loss: 1.3186, test_f1: 0.2270
 epoch: 48, train_loss: 1.3028, test_loss: 1.3152, test_f1: 0.2270
 epoch: 49, train_loss: 1.3027, test_loss: 1.3184, test_f1: 0.2270
 epoch: 50, train_loss: 1.3041, test_loss: 1.3188, test_f1: 0.2270
 epoch: 51, train_loss: 1.3023, test_loss: 1.3151, test_f1: 0.2270
 epoch: 52, train_loss: 1.3033, test_loss: 1.3147, test_f1: 0.2270
 epoch: 53, train_loss: 1.3019, test_loss: 1.3155, test_f1: 0.2270
 epoch: 54, train_loss: 1.3024, test_loss: 1.3156, test_f1: 0.2270
 epoch: 55, train_loss: 1.3028, test_loss: 1.3155, test_f1: 0.2270
 epoch: 56, train_loss: 1.3025, test_loss: 1.3174, test_f1: 0.2270
 epoch: 57, train_loss: 1.3020, test_loss: 1.3144, test_f1: 0.2270
 epoch: 58, train_loss: 1.3020, test_loss: 1.3142, test_f1: 0.2270
 epoch: 59, train_loss: 1.3018, test_loss: 1.3164, test_f1: 0.2270
 epoch: 60, train_loss: 1.3024, test_loss: 1.3148, test_f1: 0.2270
 epoch: 61, train_loss: 1.3026, test_loss: 1.3161, test_f1: 0.2270
 epoch: 62, train_loss: 1.3018, test_loss: 1.3145, test_f1: 0.2270
 epoch: 63, train_loss: 1.3028, test_loss: 1.3153, test_f1: 0.2270
 epoch: 64, train_loss: 1.3022, test_loss: 1.3151, test_f1: 0.2270
 epoch: 65, train_loss: 1.3019, test_loss: 1.3168, test_f1: 0.2270
 epoch: 66, train_loss: 1.3018, test_loss: 1.3159, test_f1: 0.2270
 epoch: 67, train_loss: 1.3023, test_loss: 1.3146, test_f1: 0.2270
 epoch: 68, train_loss: 1.3020, test_loss: 1.3166, test_f1: 0.2270
 epoch: 69, train_loss: 1.3019, test_loss: 1.3145, test_f1: 0.2270
 epoch: 70, train_loss: 1.3017, test_loss: 1.3162, test_f1: 0.2270
 epoch: 71, train_loss: 1.3024, test_loss: 1.3160, test_f1: 0.2270
 epoch: 72, train_loss: 1.3019, test_loss: 1.3153, test_f1: 0.2270
 epoch: 73, train_loss: 1.3019, test_loss: 1.3160, test_f1: 0.2270
 epoch: 74, train_loss: 1.3017, test_loss: 1.3144, test_f1: 0.2270
 epoch: 75, train_loss: 1.3020, test_loss: 1.3148, test_f1: 0.2270
 epoch: 76, train_loss: 1.3021, test_loss: 1.3164, test_f1: 0.2270
 epoch: 77, train_loss: 1.3025, test_loss: 1.3138, test_f1: 0.2270
 epoch: 78, train_loss: 1.3023, test_loss: 1.3148, test_f1: 0.2270
 epoch: 79, train_loss: 1.3020, test_loss: 1.3151, test_f1: 0.2270
 epoch: 80, train_loss: 1.3025, test_loss: 1.3171, test_f1: 0.2270
 epoch: 81, train_loss: 1.3018, test_loss: 1.3144, test_f1: 0.2270
 epoch: 82, train_loss: 1.3017, test_loss: 1.3163, test_f1: 0.2270
 epoch: 83, train_loss: 1.3022, test_loss: 1.3148, test_f1: 0.2270
 epoch: 84, train_loss: 1.3025, test_loss: 1.3163, test_f1: 0.2270
 epoch: 85, train_loss: 1.3029, test_loss: 1.3153, test_f1: 0.2270
 epoch: 86, train_loss: 1.3022, test_loss: 1.3150, test_f1: 0.2270
 epoch: 87, train_loss: 1.3017, test_loss: 1.3153, test_f1: 0.2270
 epoch: 88, train_loss: 1.3029, test_loss: 1.3139, test_f1: 0.2270
 epoch: 89, train_loss: 1.3022, test_loss: 1.3146, test_f1: 0.2270
 epoch: 90, train_loss: 1.3029, test_loss: 1.3146, test_f1: 0.2270
 epoch: 91, train_loss: 1.3021, test_loss: 1.3141, test_f1: 0.2270
 epoch: 92, train_loss: 1.3021, test_loss: 1.3145, test_f1: 0.2270
 epoch: 93, train_loss: 1.3024, test_loss: 1.3173, test_f1: 0.2270
 epoch: 94, train_loss: 1.3025, test_loss: 1.3153, test_f1: 0.2270
 epoch: 95, train_loss: 1.3019, test_loss: 1.3166, test_f1: 0.2270
 epoch: 96, train_loss: 1.3020, test_loss: 1.3146, test_f1: 0.2270
 epoch: 97, train_loss: 1.3020, test_loss: 1.3149, test_f1: 0.2270
 epoch: 98, train_loss: 1.3021, test_loss: 1.3148, test_f1: 0.2270
 epoch: 99, train_loss: 1.3024, test_loss: 1.3141, test_f1: 0.2270
##################ITERATION #4 ****************************************
 epoch: 0, train_loss: 1.3060, test_loss: 1.3173, test_f1: 0.2270
 epoch: 1, train_loss: 1.3025, test_loss: 1.3151, test_f1: 0.2270
 epoch: 2, train_loss: 1.3029, test_loss: 1.3154, test_f1: 0.2270
 epoch: 3, train_loss: 1.3033, test_loss: 1.3158, test_f1: 0.2270
 epoch: 4, train_loss: 1.3031, test_loss: 1.3182, test_f1: 0.2270
 epoch: 5, train_loss: 1.3033, test_loss: 1.3179, test_f1: 0.2270
 epoch: 6, train_loss: 1.3032, test_loss: 1.3179, test_f1: 0.2270
 epoch: 7, train_loss: 1.3028, test_loss: 1.3150, test_f1: 0.2270
 epoch: 8, train_loss: 1.3037, test_loss: 1.3177, test_f1: 0.2270
 epoch: 9, train_loss: 1.3022, test_loss: 1.3151, test_f1: 0.2270
 epoch: 10, train_loss: 1.3039, test_loss: 1.3175, test_f1: 0.2270
 epoch: 11, train_loss: 1.3025, test_loss: 1.3147, test_f1: 0.2270
 epoch: 12, train_loss: 1.3026, test_loss: 1.3167, test_f1: 0.2270
 epoch: 13, train_loss: 1.3025, test_loss: 1.3187, test_f1: 0.2270
 epoch: 14, train_loss: 1.3027, test_loss: 1.3147, test_f1: 0.2270
 epoch: 15, train_loss: 1.3031, test_loss: 1.3135, test_f1: 0.2270
 epoch: 16, train_loss: 1.3043, test_loss: 1.3139, test_f1: 0.2270
 epoch: 17, train_loss: 1.3031, test_loss: 1.3163, test_f1: 0.2270
 epoch: 18, train_loss: 1.3033, test_loss: 1.3137, test_f1: 0.2270
 epoch: 19, train_loss: 1.3035, test_loss: 1.3171, test_f1: 0.2270
 epoch: 20, train_loss: 1.3023, test_loss: 1.3151, test_f1: 0.2270
 epoch: 21, train_loss: 1.3034, test_loss: 1.3179, test_f1: 0.2270
 epoch: 22, train_loss: 1.3038, test_loss: 1.3149, test_f1: 0.2270
 epoch: 23, train_loss: 1.3023, test_loss: 1.3139, test_f1: 0.2270
 epoch: 24, train_loss: 1.3025, test_loss: 1.3152, test_f1: 0.2270
 epoch: 25, train_loss: 1.3026, test_loss: 1.3143, test_f1: 0.2270
 epoch: 26, train_loss: 1.3030, test_loss: 1.3169, test_f1: 0.2270
 epoch: 27, train_loss: 1.3034, test_loss: 1.3170, test_f1: 0.2270
 epoch: 28, train_loss: 1.3033, test_loss: 1.3146, test_f1: 0.2270
 epoch: 29, train_loss: 1.3026, test_loss: 1.3133, test_f1: 0.2270
 epoch: 30, train_loss: 1.3033, test_loss: 1.3141, test_f1: 0.2270
 epoch: 31, train_loss: 1.3033, test_loss: 1.3159, test_f1: 0.2270
 epoch: 32, train_loss: 1.3016, test_loss: 1.3166, test_f1: 0.2270
 epoch: 33, train_loss: 1.3026, test_loss: 1.3185, test_f1: 0.2270
 epoch: 34, train_loss: 1.3038, test_loss: 1.3159, test_f1: 0.2270
 epoch: 35, train_loss: 1.3036, test_loss: 1.3180, test_f1: 0.2270
 epoch: 36, train_loss: 1.3036, test_loss: 1.3164, test_f1: 0.2270
 epoch: 37, train_loss: 1.3025, test_loss: 1.3152, test_f1: 0.2270
 epoch: 38, train_loss: 1.3021, test_loss: 1.3184, test_f1: 0.2270
 epoch: 39, train_loss: 1.3030, test_loss: 1.3195, test_f1: 0.2270
 epoch: 40, train_loss: 1.3022, test_loss: 1.3137, test_f1: 0.2270
 epoch: 41, train_loss: 1.3021, test_loss: 1.3201, test_f1: 0.2270
 epoch: 42, train_loss: 1.3034, test_loss: 1.3161, test_f1: 0.2270
 epoch: 43, train_loss: 1.3043, test_loss: 1.3155, test_f1: 0.2270
 epoch: 44, train_loss: 1.3048, test_loss: 1.3174, test_f1: 0.2270
 epoch: 45, train_loss: 1.3022, test_loss: 1.3172, test_f1: 0.2270
 epoch: 46, train_loss: 1.3030, test_loss: 1.3150, test_f1: 0.2270
 epoch: 47, train_loss: 1.3027, test_loss: 1.3169, test_f1: 0.2270
 epoch: 48, train_loss: 1.3020, test_loss: 1.3171, test_f1: 0.2270
 epoch: 49, train_loss: 1.3037, test_loss: 1.3150, test_f1: 0.2270
 epoch: 50, train_loss: 1.3049, test_loss: 1.3176, test_f1: 0.2270
 epoch: 51, train_loss: 1.3027, test_loss: 1.3162, test_f1: 0.2270
 epoch: 52, train_loss: 1.3021, test_loss: 1.3140, test_f1: 0.2270
 epoch: 53, train_loss: 1.3021, test_loss: 1.3158, test_f1: 0.2270
 epoch: 54, train_loss: 1.3019, test_loss: 1.3140, test_f1: 0.2270
 epoch: 55, train_loss: 1.3029, test_loss: 1.3169, test_f1: 0.2270
 epoch: 56, train_loss: 1.3020, test_loss: 1.3153, test_f1: 0.2270
 epoch: 57, train_loss: 1.3017, test_loss: 1.3154, test_f1: 0.2270
 epoch: 58, train_loss: 1.3023, test_loss: 1.3143, test_f1: 0.2270
 epoch: 59, train_loss: 1.3018, test_loss: 1.3156, test_f1: 0.2270
 epoch: 60, train_loss: 1.3022, test_loss: 1.3145, test_f1: 0.2270
 epoch: 61, train_loss: 1.3023, test_loss: 1.3144, test_f1: 0.2270
 epoch: 62, train_loss: 1.3022, test_loss: 1.3153, test_f1: 0.2270
 epoch: 63, train_loss: 1.3017, test_loss: 1.3164, test_f1: 0.2270
 epoch: 64, train_loss: 1.3023, test_loss: 1.3148, test_f1: 0.2270
 epoch: 65, train_loss: 1.3018, test_loss: 1.3153, test_f1: 0.2270
 epoch: 66, train_loss: 1.3022, test_loss: 1.3148, test_f1: 0.2270
 epoch: 67, train_loss: 1.3018, test_loss: 1.3150, test_f1: 0.2270
 epoch: 68, train_loss: 1.3021, test_loss: 1.3155, test_f1: 0.2270
 epoch: 69, train_loss: 1.3022, test_loss: 1.3141, test_f1: 0.2270
 epoch: 70, train_loss: 1.3021, test_loss: 1.3149, test_f1: 0.2270
 epoch: 71, train_loss: 1.3026, test_loss: 1.3164, test_f1: 0.2270
 epoch: 72, train_loss: 1.3020, test_loss: 1.3154, test_f1: 0.2270
 epoch: 73, train_loss: 1.3018, test_loss: 1.3144, test_f1: 0.2270
 epoch: 74, train_loss: 1.3018, test_loss: 1.3152, test_f1: 0.2270
 epoch: 75, train_loss: 1.3022, test_loss: 1.3136, test_f1: 0.2270
 epoch: 76, train_loss: 1.3029, test_loss: 1.3148, test_f1: 0.2270
 epoch: 77, train_loss: 1.3029, test_loss: 1.3142, test_f1: 0.2270
 epoch: 78, train_loss: 1.3020, test_loss: 1.3169, test_f1: 0.2270
 epoch: 79, train_loss: 1.3023, test_loss: 1.3165, test_f1: 0.2270
 epoch: 80, train_loss: 1.3021, test_loss: 1.3156, test_f1: 0.2270
 epoch: 81, train_loss: 1.3018, test_loss: 1.3143, test_f1: 0.2270
 epoch: 82, train_loss: 1.3025, test_loss: 1.3171, test_f1: 0.2270
 epoch: 83, train_loss: 1.3016, test_loss: 1.3139, test_f1: 0.2270
 epoch: 84, train_loss: 1.3019, test_loss: 1.3165, test_f1: 0.2270
 epoch: 85, train_loss: 1.3022, test_loss: 1.3144, test_f1: 0.2270
 epoch: 86, train_loss: 1.3021, test_loss: 1.3148, test_f1: 0.2270
 epoch: 87, train_loss: 1.3016, test_loss: 1.3163, test_f1: 0.2270
 epoch: 88, train_loss: 1.3017, test_loss: 1.3150, test_f1: 0.2270
 epoch: 89, train_loss: 1.3018, test_loss: 1.3155, test_f1: 0.2270
 epoch: 90, train_loss: 1.3021, test_loss: 1.3141, test_f1: 0.2270
 epoch: 91, train_loss: 1.3025, test_loss: 1.3163, test_f1: 0.2270
 epoch: 92, train_loss: 1.3022, test_loss: 1.3147, test_f1: 0.2270
 epoch: 93, train_loss: 1.3017, test_loss: 1.3150, test_f1: 0.2270
 epoch: 94, train_loss: 1.3018, test_loss: 1.3148, test_f1: 0.2270
 epoch: 95, train_loss: 1.3017, test_loss: 1.3146, test_f1: 0.2270
 epoch: 96, train_loss: 1.3020, test_loss: 1.3152, test_f1: 0.2270
 epoch: 97, train_loss: 1.3025, test_loss: 1.3150, test_f1: 0.2270
 epoch: 98, train_loss: 1.3023, test_loss: 1.3138, test_f1: 0.2270
 epoch: 99, train_loss: 1.3029, test_loss: 1.3177, test_f1: 0.2270
##################ITERATION #5 ****************************************
 epoch: 0, train_loss: 1.2803, test_loss: 1.3463, test_f1: 0.2270
 epoch: 1, train_loss: 1.2869, test_loss: 1.2753, test_f1: 0.2405
 epoch: 2, train_loss: 1.2687, test_loss: 1.1815, test_f1: 0.2574
 epoch: 3, train_loss: 1.2237, test_loss: 1.1650, test_f1: 0.3419
 epoch: 4, train_loss: 1.1733, test_loss: 1.1723, test_f1: 0.2953
 epoch: 5, train_loss: 1.1731, test_loss: 1.0992, test_f1: 0.3665
 epoch: 6, train_loss: 1.1415, test_loss: 1.1389, test_f1: 0.3422
 epoch: 7, train_loss: 1.1451, test_loss: 1.0993, test_f1: 0.3430
 epoch: 8, train_loss: 1.1181, test_loss: 1.1105, test_f1: 0.3718
 epoch: 9, train_loss: 1.1637, test_loss: 1.1658, test_f1: 0.3267
 epoch: 10, train_loss: 1.1608, test_loss: 1.1050, test_f1: 0.3638
 epoch: 11, train_loss: 1.1184, test_loss: 1.1521, test_f1: 0.3403
 epoch: 12, train_loss: 1.1038, test_loss: 1.0804, test_f1: 0.3460
 epoch: 13, train_loss: 1.0950, test_loss: 1.8368, test_f1: 0.2262
 epoch: 14, train_loss: 1.2220, test_loss: 1.2852, test_f1: 0.3108
 epoch: 15, train_loss: 1.2757, test_loss: 1.3405, test_f1: 0.2132
 epoch: 16, train_loss: 1.1960, test_loss: 1.1561, test_f1: 0.3185
 epoch: 17, train_loss: 1.1512, test_loss: 1.1550, test_f1: 0.3287
 epoch: 18, train_loss: 1.1233, test_loss: 1.1176, test_f1: 0.4084
 epoch: 19, train_loss: 1.1189, test_loss: 1.1081, test_f1: 0.3432
 epoch: 20, train_loss: 1.1281, test_loss: 1.1251, test_f1: 0.3393
 epoch: 21, train_loss: 1.0947, test_loss: 1.1180, test_f1: 0.3422
 epoch: 22, train_loss: 1.0832, test_loss: 1.1072, test_f1: 0.3403
 epoch: 23, train_loss: 1.0855, test_loss: 1.1468, test_f1: 0.3434
 epoch: 24, train_loss: 1.1318, test_loss: 1.1013, test_f1: 0.3419
 epoch: 25, train_loss: 1.1272, test_loss: 1.1727, test_f1: 0.3261
 epoch: 26, train_loss: 1.1885, test_loss: 1.1802, test_f1: 0.3244
 epoch: 27, train_loss: 1.1416, test_loss: 1.1576, test_f1: 0.3293
 epoch: 28, train_loss: 1.1520, test_loss: 1.1386, test_f1: 0.3195
 epoch: 29, train_loss: 1.0893, test_loss: 1.0989, test_f1: 0.4007
 epoch: 30, train_loss: 1.0840, test_loss: 1.0889, test_f1: 0.3821
 epoch: 31, train_loss: 1.0832, test_loss: 1.0941, test_f1: 0.3413
 epoch: 32, train_loss: 1.0884, test_loss: 1.0998, test_f1: 0.3634
 epoch: 33, train_loss: 1.0770, test_loss: 1.1077, test_f1: 0.3460
 epoch: 34, train_loss: 1.0886, test_loss: 1.2052, test_f1: 0.3377
 epoch: 35, train_loss: 1.1506, test_loss: 1.1213, test_f1: 0.3422
 epoch: 36, train_loss: 1.1149, test_loss: 1.1691, test_f1: 0.3422
 epoch: 37, train_loss: 1.1370, test_loss: 1.1386, test_f1: 0.3250
 epoch: 38, train_loss: 1.1303, test_loss: 1.1117, test_f1: 0.3422
 epoch: 39, train_loss: 1.1075, test_loss: 1.1126, test_f1: 0.3810
 epoch: 40, train_loss: 1.1609, test_loss: 1.2496, test_f1: 0.3075
 epoch: 41, train_loss: 1.1397, test_loss: 1.0968, test_f1: 0.3432
 epoch: 42, train_loss: 1.1554, test_loss: 1.1770, test_f1: 0.3100
 epoch: 43, train_loss: 1.1388, test_loss: 1.1058, test_f1: 0.3550
 epoch: 44, train_loss: 1.1236, test_loss: 1.1071, test_f1: 0.3545
 epoch: 45, train_loss: 1.1044, test_loss: 1.0981, test_f1: 0.3460
 epoch: 46, train_loss: 1.0958, test_loss: 1.1023, test_f1: 0.3460
 epoch: 47, train_loss: 1.0926, test_loss: 1.1175, test_f1: 0.3460
 epoch: 48, train_loss: 1.0890, test_loss: 1.1369, test_f1: 0.3413
 epoch: 49, train_loss: 1.0858, test_loss: 1.0926, test_f1: 0.3413
 epoch: 50, train_loss: 1.0857, test_loss: 1.1452, test_f1: 0.3403
 epoch: 51, train_loss: 1.0835, test_loss: 1.1116, test_f1: 0.3413
 epoch: 52, train_loss: 1.0784, test_loss: 1.0907, test_f1: 0.3602
 epoch: 53, train_loss: 1.0630, test_loss: 1.1093, test_f1: 0.3413
 epoch: 54, train_loss: 1.0711, test_loss: 1.1071, test_f1: 0.3413
 epoch: 55, train_loss: 1.0614, test_loss: 1.0966, test_f1: 0.3413
 epoch: 56, train_loss: 1.0543, test_loss: 1.1107, test_f1: 0.3536
 epoch: 57, train_loss: 1.0575, test_loss: 1.1125, test_f1: 0.3545
 epoch: 58, train_loss: 1.0873, test_loss: 1.1124, test_f1: 0.3656
 epoch: 59, train_loss: 1.0904, test_loss: 1.1474, test_f1: 0.3545
 epoch: 60, train_loss: 1.1114, test_loss: 1.1004, test_f1: 0.3773
 epoch: 61, train_loss: 1.0812, test_loss: 1.1030, test_f1: 0.3612
 epoch: 62, train_loss: 1.0826, test_loss: 1.0933, test_f1: 0.3460
 epoch: 63, train_loss: 1.0853, test_loss: 1.1037, test_f1: 0.3422
 epoch: 64, train_loss: 1.0663, test_loss: 1.0860, test_f1: 0.3800
 epoch: 65, train_loss: 1.0614, test_loss: 1.1070, test_f1: 0.3422
 epoch: 66, train_loss: 1.0687, test_loss: 1.1079, test_f1: 0.3422
 epoch: 67, train_loss: 1.0700, test_loss: 1.0993, test_f1: 0.3460
 epoch: 68, train_loss: 1.0964, test_loss: 1.0895, test_f1: 0.3422
 epoch: 69, train_loss: 1.0615, test_loss: 1.0791, test_f1: 0.3460
 epoch: 70, train_loss: 1.0848, test_loss: 1.0879, test_f1: 0.3460
 epoch: 71, train_loss: 1.0672, test_loss: 1.0969, test_f1: 0.3422
 epoch: 72, train_loss: 1.0725, test_loss: 1.0854, test_f1: 0.3413
 epoch: 73, train_loss: 1.0539, test_loss: 1.0940, test_f1: 0.3422
 epoch: 74, train_loss: 1.0716, test_loss: 1.0764, test_f1: 0.3444
 epoch: 75, train_loss: 1.0798, test_loss: 1.0985, test_f1: 0.3422
 epoch: 76, train_loss: 1.0718, test_loss: 1.0830, test_f1: 0.3659
 epoch: 77, train_loss: 1.0924, test_loss: 1.0685, test_f1: 0.3662
 epoch: 78, train_loss: 1.1021, test_loss: 1.1134, test_f1: 0.3684
 epoch: 79, train_loss: 1.0807, test_loss: 1.0816, test_f1: 0.3525
 epoch: 80, train_loss: 1.0612, test_loss: 1.0850, test_f1: 0.3805
 epoch: 81, train_loss: 1.0622, test_loss: 1.0878, test_f1: 0.3720
 epoch: 82, train_loss: 1.0648, test_loss: 1.0892, test_f1: 0.3805
 epoch: 83, train_loss: 1.0576, test_loss: 1.1016, test_f1: 0.3403
 epoch: 84, train_loss: 1.0547, test_loss: 1.1010, test_f1: 0.3403
 epoch: 85, train_loss: 1.0505, test_loss: 1.1009, test_f1: 0.3403
 epoch: 86, train_loss: 1.0663, test_loss: 1.1052, test_f1: 0.3413
 epoch: 87, train_loss: 1.0485, test_loss: 1.0926, test_f1: 0.3951
 epoch: 88, train_loss: 1.0547, test_loss: 1.0992, test_f1: 0.3413
 epoch: 89, train_loss: 1.0481, test_loss: 1.0976, test_f1: 0.3413
 epoch: 90, train_loss: 1.0404, test_loss: 1.1061, test_f1: 0.3413
 epoch: 91, train_loss: 1.0569, test_loss: 1.0913, test_f1: 0.3568
 epoch: 92, train_loss: 1.0599, test_loss: 1.0976, test_f1: 0.3619
 epoch: 93, train_loss: 1.0561, test_loss: 1.1394, test_f1: 0.3422
 epoch: 94, train_loss: 1.0482, test_loss: 1.0920, test_f1: 0.3422
 epoch: 95, train_loss: 1.0589, test_loss: 1.0995, test_f1: 0.3422
 epoch: 96, train_loss: 1.0501, test_loss: 1.0941, test_f1: 0.3422
 epoch: 97, train_loss: 1.0679, test_loss: 1.1164, test_f1: 0.3430
 epoch: 98, train_loss: 1.0775, test_loss: 1.1229, test_f1: 0.3422
 epoch: 99, train_loss: 1.0618, test_loss: 1.0859, test_f1: 0.3460
##################ITERATION #6 ****************************************
 epoch: 0, train_loss: 1.2693, test_loss: 1.1352, test_f1: 0.3766
 epoch: 1, train_loss: 1.1043, test_loss: 1.1002, test_f1: 0.3547
 epoch: 2, train_loss: 1.1115, test_loss: 1.1012, test_f1: 0.3661
 epoch: 3, train_loss: 1.1207, test_loss: 1.1449, test_f1: 0.3327
 epoch: 4, train_loss: 1.1030, test_loss: 1.1318, test_f1: 0.3384
 epoch: 5, train_loss: 1.0929, test_loss: 1.0985, test_f1: 0.3782
 epoch: 6, train_loss: 1.0819, test_loss: 1.1023, test_f1: 0.3594
 epoch: 7, train_loss: 1.0957, test_loss: 1.0687, test_f1: 0.3644
 epoch: 8, train_loss: 1.0734, test_loss: 1.1083, test_f1: 0.3422
 epoch: 9, train_loss: 1.0626, test_loss: 1.0495, test_f1: 0.3536
 epoch: 10, train_loss: 1.0662, test_loss: 1.2994, test_f1: 0.3280
 epoch: 11, train_loss: 1.0642, test_loss: 1.1158, test_f1: 0.3413
 epoch: 12, train_loss: 1.0641, test_loss: 1.2355, test_f1: 0.2709
 epoch: 13, train_loss: 1.0660, test_loss: 1.0958, test_f1: 0.3661
 epoch: 14, train_loss: 1.0660, test_loss: 1.0519, test_f1: 0.3503
 epoch: 15, train_loss: 1.0745, test_loss: 1.1139, test_f1: 0.3400
 epoch: 16, train_loss: 1.0593, test_loss: 1.1256, test_f1: 0.3707
 epoch: 17, train_loss: 1.0496, test_loss: 1.1251, test_f1: 0.3499
 epoch: 18, train_loss: 1.0683, test_loss: 1.1208, test_f1: 0.3422
 epoch: 19, train_loss: 1.0532, test_loss: 1.1039, test_f1: 0.3377
 epoch: 20, train_loss: 1.0573, test_loss: 1.4675, test_f1: 0.3422
 epoch: 21, train_loss: 1.1600, test_loss: 1.4508, test_f1: 0.3545
 epoch: 22, train_loss: 1.1200, test_loss: 1.1598, test_f1: 0.2936
 epoch: 23, train_loss: 1.1081, test_loss: 1.1277, test_f1: 0.3422
 epoch: 24, train_loss: 1.0832, test_loss: 1.0926, test_f1: 0.3440
 epoch: 25, train_loss: 1.0840, test_loss: 1.0937, test_f1: 0.3414
 epoch: 26, train_loss: 1.0622, test_loss: 1.0975, test_f1: 0.3412
 epoch: 27, train_loss: 1.0847, test_loss: 1.1743, test_f1: 0.3462
 epoch: 28, train_loss: 1.0858, test_loss: 1.1056, test_f1: 0.3654
 epoch: 29, train_loss: 1.0700, test_loss: 1.1192, test_f1: 0.3422
 epoch: 30, train_loss: 1.0785, test_loss: 1.1244, test_f1: 0.3403
 epoch: 31, train_loss: 1.0994, test_loss: 1.8426, test_f1: 0.2797
 epoch: 32, train_loss: 1.0961, test_loss: 1.1325, test_f1: 0.3439
 epoch: 33, train_loss: 1.0691, test_loss: 1.1105, test_f1: 0.3765
 epoch: 34, train_loss: 1.0681, test_loss: 1.1152, test_f1: 0.3541
 epoch: 35, train_loss: 1.0509, test_loss: 1.0962, test_f1: 0.3588
 epoch: 36, train_loss: 1.0552, test_loss: 1.1247, test_f1: 0.3458
 epoch: 37, train_loss: 1.0669, test_loss: 1.1111, test_f1: 0.3438
 epoch: 38, train_loss: 1.0659, test_loss: 1.2098, test_f1: 0.3696
 epoch: 39, train_loss: 1.0724, test_loss: 1.1070, test_f1: 0.3459
 epoch: 40, train_loss: 1.0659, test_loss: 1.1277, test_f1: 0.3635
 epoch: 41, train_loss: 1.0552, test_loss: 1.1129, test_f1: 0.3406
 epoch: 42, train_loss: 1.0740, test_loss: 1.1608, test_f1: 0.4058
 epoch: 43, train_loss: 1.0509, test_loss: 1.1264, test_f1: 0.3829
 epoch: 44, train_loss: 1.0508, test_loss: 1.3227, test_f1: 0.3264
 epoch: 45, train_loss: 1.0610, test_loss: 1.1545, test_f1: 0.3734
 epoch: 46, train_loss: 1.0451, test_loss: 1.1017, test_f1: 0.3420
 epoch: 47, train_loss: 1.0672, test_loss: 1.2429, test_f1: 0.3907
 epoch: 48, train_loss: 1.0535, test_loss: 1.1253, test_f1: 0.3422
 epoch: 49, train_loss: 1.0537, test_loss: 1.1225, test_f1: 0.3457
 epoch: 50, train_loss: 1.0640, test_loss: 1.1578, test_f1: 0.3422
 epoch: 51, train_loss: 1.0495, test_loss: 1.1143, test_f1: 0.4818
 epoch: 52, train_loss: 1.0714, test_loss: 1.1417, test_f1: 0.3422
 epoch: 53, train_loss: 1.0526, test_loss: 1.1049, test_f1: 0.3422
 epoch: 54, train_loss: 1.0353, test_loss: 1.0953, test_f1: 0.3941
 epoch: 55, train_loss: 1.0250, test_loss: 1.0976, test_f1: 0.3460
 epoch: 56, train_loss: 1.0272, test_loss: 1.0998, test_f1: 0.3420
 epoch: 57, train_loss: 1.0277, test_loss: 1.1074, test_f1: 0.3616
 epoch: 58, train_loss: 1.0395, test_loss: 1.4102, test_f1: 0.3112
 epoch: 59, train_loss: 1.0358, test_loss: 1.1045, test_f1: 0.3434
 epoch: 60, train_loss: 1.0290, test_loss: 1.1050, test_f1: 0.3422
 epoch: 61, train_loss: 1.0178, test_loss: 1.1254, test_f1: 0.3422
 epoch: 62, train_loss: 1.0382, test_loss: 1.1378, test_f1: 0.3398
 epoch: 63, train_loss: 1.0649, test_loss: 1.1584, test_f1: 0.3413
 epoch: 64, train_loss: 1.0313, test_loss: 1.1777, test_f1: 0.4123
 epoch: 65, train_loss: 1.0431, test_loss: 1.1270, test_f1: 0.3467
 epoch: 66, train_loss: 1.0367, test_loss: 1.1035, test_f1: 0.3855
 epoch: 67, train_loss: 1.0399, test_loss: 1.1140, test_f1: 0.3646
 epoch: 68, train_loss: 1.0366, test_loss: 1.1177, test_f1: 0.4035
 epoch: 69, train_loss: 1.0333, test_loss: 1.1214, test_f1: 0.3422
 epoch: 70, train_loss: 1.0221, test_loss: 1.1092, test_f1: 0.3553
 epoch: 71, train_loss: 1.0304, test_loss: 1.0907, test_f1: 0.3737
 epoch: 72, train_loss: 1.0384, test_loss: 1.1955, test_f1: 0.3470
 epoch: 73, train_loss: 1.0370, test_loss: 1.1039, test_f1: 0.3616
 epoch: 74, train_loss: 1.0316, test_loss: 1.0957, test_f1: 0.3755
 epoch: 75, train_loss: 1.0186, test_loss: 1.0695, test_f1: 0.3465
 epoch: 76, train_loss: 1.0181, test_loss: 1.1083, test_f1: 0.3422
 epoch: 77, train_loss: 1.0407, test_loss: 1.0904, test_f1: 0.3747
 epoch: 78, train_loss: 1.0171, test_loss: 1.1524, test_f1: 0.3846
 epoch: 79, train_loss: 1.0204, test_loss: 1.1493, test_f1: 0.3764
 epoch: 80, train_loss: 1.0268, test_loss: 1.1661, test_f1: 0.3577
 epoch: 81, train_loss: 1.0267, test_loss: 1.1148, test_f1: 0.4145
 epoch: 82, train_loss: 1.0115, test_loss: 1.2224, test_f1: 0.3863
 epoch: 83, train_loss: 1.0270, test_loss: 1.0950, test_f1: 0.3706
 epoch: 84, train_loss: 1.0277, test_loss: 1.0803, test_f1: 0.3755
 epoch: 85, train_loss: 1.0380, test_loss: 1.0945, test_f1: 0.3460
 epoch: 86, train_loss: 1.0395, test_loss: 1.1171, test_f1: 0.4292
 epoch: 87, train_loss: 1.0263, test_loss: 1.1452, test_f1: 0.3775
 epoch: 88, train_loss: 1.0200, test_loss: 1.1904, test_f1: 0.4128
 epoch: 89, train_loss: 1.0138, test_loss: 1.0974, test_f1: 0.3486
 epoch: 90, train_loss: 1.0058, test_loss: 1.0857, test_f1: 0.4282
 epoch: 91, train_loss: 1.0115, test_loss: 1.1015, test_f1: 0.3460
 epoch: 92, train_loss: 1.0145, test_loss: 1.0991, test_f1: 0.4373
 epoch: 93, train_loss: 1.0225, test_loss: 1.0929, test_f1: 0.4287
 epoch: 94, train_loss: 1.0116, test_loss: 1.1147, test_f1: 0.4248
 epoch: 95, train_loss: 1.0054, test_loss: 1.0866, test_f1: 0.4185
 epoch: 96, train_loss: 0.9987, test_loss: 1.0597, test_f1: 0.3923
 epoch: 97, train_loss: 1.0400, test_loss: 1.1847, test_f1: 0.3807
 epoch: 98, train_loss: 1.0459, test_loss: 1.1430, test_f1: 0.3733
 epoch: 99, train_loss: 1.0205, test_loss: 1.1635, test_f1: 0.3560
##################ITERATION #7 ****************************************
 epoch: 0, train_loss: 1.2369, test_loss: 7.4401, test_f1: 0.0845
 epoch: 1, train_loss: 1.0966, test_loss: 1.1421, test_f1: 0.3460
 epoch: 2, train_loss: 1.0727, test_loss: 1.1723, test_f1: 0.3539
 epoch: 3, train_loss: 1.0908, test_loss: 1.0383, test_f1: 0.3737
 epoch: 4, train_loss: 1.0756, test_loss: 1.1688, test_f1: 0.3539
 epoch: 5, train_loss: 1.0728, test_loss: 1.0847, test_f1: 0.3413
 epoch: 6, train_loss: 1.0625, test_loss: 1.1181, test_f1: 0.3458
 epoch: 7, train_loss: 1.0480, test_loss: 1.1365, test_f1: 0.3410
 epoch: 8, train_loss: 1.0546, test_loss: 1.4022, test_f1: 0.2836
 epoch: 9, train_loss: 1.0693, test_loss: 1.3837, test_f1: 0.2539
 epoch: 10, train_loss: 1.0556, test_loss: 1.1117, test_f1: 0.3482
 epoch: 11, train_loss: 1.0433, test_loss: 1.1205, test_f1: 0.3414
 epoch: 12, train_loss: 1.0622, test_loss: 1.1471, test_f1: 0.3415
 epoch: 13, train_loss: 1.0692, test_loss: 1.1699, test_f1: 0.3364
 epoch: 14, train_loss: 1.0492, test_loss: 1.1281, test_f1: 0.3422
 epoch: 15, train_loss: 1.0526, test_loss: 1.2099, test_f1: 0.3227
 epoch: 16, train_loss: 1.0552, test_loss: 1.1726, test_f1: 0.3372
 epoch: 17, train_loss: 1.0526, test_loss: 1.1167, test_f1: 0.3749
 epoch: 18, train_loss: 1.0494, test_loss: 1.1222, test_f1: 0.3561
 epoch: 19, train_loss: 1.0536, test_loss: 1.1260, test_f1: 0.3441
 epoch: 20, train_loss: 1.0371, test_loss: 1.1111, test_f1: 0.3480
 epoch: 21, train_loss: 1.0580, test_loss: 1.1241, test_f1: 0.3541
 epoch: 22, train_loss: 1.0602, test_loss: 1.1414, test_f1: 0.3405
 epoch: 23, train_loss: 1.0623, test_loss: 1.1194, test_f1: 0.3422
 epoch: 24, train_loss: 1.0429, test_loss: 1.1460, test_f1: 0.3431
 epoch: 25, train_loss: 1.0446, test_loss: 1.2005, test_f1: 0.4209
 epoch: 26, train_loss: 1.0436, test_loss: 1.1128, test_f1: 0.3830
 epoch: 27, train_loss: 1.0389, test_loss: 1.2083, test_f1: 0.3723
 epoch: 28, train_loss: 1.0498, test_loss: 1.1241, test_f1: 0.3927
 epoch: 29, train_loss: 1.0603, test_loss: 1.2330, test_f1: 0.3250
 epoch: 30, train_loss: 1.0763, test_loss: 1.1354, test_f1: 0.3865
 epoch: 31, train_loss: 1.1082, test_loss: 1.4895, test_f1: 0.3572
 epoch: 32, train_loss: 1.0724, test_loss: 1.2322, test_f1: 0.3326
 epoch: 33, train_loss: 1.0502, test_loss: 1.1689, test_f1: 0.3432
 epoch: 34, train_loss: 1.0715, test_loss: 1.6306, test_f1: 0.2980
 epoch: 35, train_loss: 1.0599, test_loss: 1.1099, test_f1: 0.3425
 epoch: 36, train_loss: 1.0850, test_loss: 2.4167, test_f1: 0.3259
 epoch: 37, train_loss: 1.1147, test_loss: 1.1421, test_f1: 0.3420
 epoch: 38, train_loss: 1.1555, test_loss: 1.0979, test_f1: 0.3874
 epoch: 39, train_loss: 1.0871, test_loss: 1.0323, test_f1: 0.3519
 epoch: 40, train_loss: 1.0629, test_loss: 1.0979, test_f1: 0.3425
 epoch: 41, train_loss: 1.0761, test_loss: 1.1401, test_f1: 0.3358
 epoch: 42, train_loss: 1.0780, test_loss: 1.1229, test_f1: 0.3354
 epoch: 43, train_loss: 1.0576, test_loss: 1.1272, test_f1: 0.3422
 epoch: 44, train_loss: 1.0526, test_loss: 1.0962, test_f1: 0.3385
 epoch: 45, train_loss: 1.0589, test_loss: 1.1112, test_f1: 0.3369
 epoch: 46, train_loss: 1.0437, test_loss: 1.1157, test_f1: 0.3427
 epoch: 47, train_loss: 1.0483, test_loss: 1.1052, test_f1: 0.3422
 epoch: 48, train_loss: 1.0447, test_loss: 1.1150, test_f1: 0.3453
 epoch: 49, train_loss: 1.0389, test_loss: 1.1041, test_f1: 0.3718
 epoch: 50, train_loss: 1.0480, test_loss: 1.1507, test_f1: 0.3422
 epoch: 51, train_loss: 1.0512, test_loss: 1.0850, test_f1: 0.3588
 epoch: 52, train_loss: 1.0305, test_loss: 1.0751, test_f1: 0.3469
 epoch: 53, train_loss: 1.0272, test_loss: 1.1297, test_f1: 0.3430
 epoch: 54, train_loss: 1.0243, test_loss: 1.1245, test_f1: 0.3515
 epoch: 55, train_loss: 1.0236, test_loss: 1.1241, test_f1: 0.3807
 epoch: 56, train_loss: 1.0293, test_loss: 1.0884, test_f1: 0.3450
 epoch: 57, train_loss: 1.0272, test_loss: 1.0743, test_f1: 0.3454
 epoch: 58, train_loss: 1.0244, test_loss: 1.0745, test_f1: 0.3538
 epoch: 59, train_loss: 1.0183, test_loss: 1.0878, test_f1: 0.3751
 epoch: 60, train_loss: 1.0260, test_loss: 1.0932, test_f1: 0.3403
 epoch: 61, train_loss: 1.0290, test_loss: 1.3688, test_f1: 0.3413
 epoch: 62, train_loss: 1.0366, test_loss: 1.3374, test_f1: 0.3422
 epoch: 63, train_loss: 1.0311, test_loss: 1.0863, test_f1: 0.3949
 epoch: 64, train_loss: 1.0313, test_loss: 1.0896, test_f1: 0.3428
 epoch: 65, train_loss: 1.0290, test_loss: 1.0990, test_f1: 0.3419
 epoch: 66, train_loss: 1.0187, test_loss: 1.0900, test_f1: 0.3855
 epoch: 67, train_loss: 1.0239, test_loss: 1.0762, test_f1: 0.4712
 epoch: 68, train_loss: 1.0138, test_loss: 1.1358, test_f1: 0.4440
 epoch: 69, train_loss: 1.0338, test_loss: 1.0914, test_f1: 0.3455
 epoch: 70, train_loss: 1.0164, test_loss: 1.1328, test_f1: 0.3422
 epoch: 71, train_loss: 1.0381, test_loss: 1.1119, test_f1: 0.4398
 epoch: 72, train_loss: 1.0139, test_loss: 1.1217, test_f1: 0.3498
 epoch: 73, train_loss: 1.0100, test_loss: 1.0917, test_f1: 0.3456
 epoch: 74, train_loss: 1.0116, test_loss: 1.1232, test_f1: 0.4473
 epoch: 75, train_loss: 1.0195, test_loss: 1.1285, test_f1: 0.4613
 epoch: 76, train_loss: 1.0129, test_loss: 1.0921, test_f1: 0.3763
 epoch: 77, train_loss: 1.0021, test_loss: 1.1047, test_f1: 0.4527
 epoch: 78, train_loss: 1.0108, test_loss: 1.2490, test_f1: 0.3840
 epoch: 79, train_loss: 1.0094, test_loss: 1.1318, test_f1: 0.3478
 epoch: 80, train_loss: 1.0107, test_loss: 1.0812, test_f1: 0.3465
 epoch: 81, train_loss: 0.9969, test_loss: 1.1633, test_f1: 0.3910
 epoch: 82, train_loss: 1.0168, test_loss: 1.0919, test_f1: 0.3462
 epoch: 83, train_loss: 1.0045, test_loss: 1.1932, test_f1: 0.3425
 epoch: 84, train_loss: 1.0082, test_loss: 1.1314, test_f1: 0.3491
 epoch: 85, train_loss: 1.0105, test_loss: 1.1211, test_f1: 0.3602
 epoch: 86, train_loss: 1.0143, test_loss: 1.0993, test_f1: 0.3626
 epoch: 87, train_loss: 1.0051, test_loss: 1.1319, test_f1: 0.3752
 epoch: 88, train_loss: 1.0189, test_loss: 1.1760, test_f1: 0.3741
 epoch: 89, train_loss: 1.0109, test_loss: 1.2104, test_f1: 0.3422
 epoch: 90, train_loss: 1.0002, test_loss: 1.1948, test_f1: 0.3586
 epoch: 91, train_loss: 1.0072, test_loss: 1.1058, test_f1: 0.3691
 epoch: 92, train_loss: 1.0097, test_loss: 1.1236, test_f1: 0.3427
 epoch: 93, train_loss: 1.0040, test_loss: 1.1622, test_f1: 0.3769
 epoch: 94, train_loss: 1.0177, test_loss: 1.1070, test_f1: 0.3848
 epoch: 95, train_loss: 1.0080, test_loss: 1.1383, test_f1: 0.3938
 epoch: 96, train_loss: 1.0035, test_loss: 1.1023, test_f1: 0.3539
 epoch: 97, train_loss: 1.0068, test_loss: 1.2075, test_f1: 0.3636
 epoch: 98, train_loss: 1.0350, test_loss: 1.2421, test_f1: 0.3732
 epoch: 99, train_loss: 1.0222, test_loss: 1.1229, test_f1: 0.3835
##################ITERATION #8 ****************************************
 epoch: 0, train_loss: 1.2636, test_loss: 1.3645, test_f1: 0.2299
 epoch: 1, train_loss: 1.1332, test_loss: 1.1970, test_f1: 0.3403
 epoch: 2, train_loss: 1.1143, test_loss: 1.1443, test_f1: 0.3403
 epoch: 3, train_loss: 1.1147, test_loss: 1.1989, test_f1: 0.3422
 epoch: 4, train_loss: 1.0895, test_loss: 1.0840, test_f1: 0.3405
 epoch: 5, train_loss: 1.0772, test_loss: 1.1587, test_f1: 0.3545
 epoch: 6, train_loss: 1.0941, test_loss: 1.1076, test_f1: 0.3413
 epoch: 7, train_loss: 1.0768, test_loss: 1.1547, test_f1: 0.3413
 epoch: 8, train_loss: 1.0577, test_loss: 1.1635, test_f1: 0.3422
 epoch: 9, train_loss: 1.0643, test_loss: 1.1280, test_f1: 0.3753
 epoch: 10, train_loss: 1.0611, test_loss: 1.1356, test_f1: 0.3460
 epoch: 11, train_loss: 1.0789, test_loss: 1.2394, test_f1: 0.3265
 epoch: 12, train_loss: 1.0736, test_loss: 1.2218, test_f1: 0.3422
 epoch: 13, train_loss: 1.0831, test_loss: 1.0495, test_f1: 0.3615
 epoch: 14, train_loss: 1.0686, test_loss: 1.1647, test_f1: 0.3613
 epoch: 15, train_loss: 1.0599, test_loss: 1.1542, test_f1: 0.3422
 epoch: 16, train_loss: 1.0609, test_loss: 1.1794, test_f1: 0.3544
 epoch: 17, train_loss: 1.0708, test_loss: 1.0408, test_f1: 0.3546
 epoch: 18, train_loss: 1.0922, test_loss: 1.1637, test_f1: 0.3638
 epoch: 19, train_loss: 1.0814, test_loss: 1.1603, test_f1: 0.3611
 epoch: 20, train_loss: 1.0524, test_loss: 1.0420, test_f1: 0.3550
 epoch: 21, train_loss: 1.0505, test_loss: 1.0921, test_f1: 0.3480
 epoch: 22, train_loss: 1.0502, test_loss: 1.1380, test_f1: 0.4105
 epoch: 23, train_loss: 1.0445, test_loss: 1.1418, test_f1: 0.3410
 epoch: 24, train_loss: 1.0492, test_loss: 1.1646, test_f1: 0.3596
 epoch: 25, train_loss: 1.0475, test_loss: 1.1538, test_f1: 0.3476
 epoch: 26, train_loss: 1.0606, test_loss: 1.0822, test_f1: 0.3516
 epoch: 27, train_loss: 1.0565, test_loss: 1.3513, test_f1: 0.3127
 epoch: 28, train_loss: 1.0639, test_loss: 1.1817, test_f1: 0.3431
 epoch: 29, train_loss: 1.0795, test_loss: 1.1718, test_f1: 0.3182
 epoch: 30, train_loss: 1.0648, test_loss: 1.1406, test_f1: 0.3413
 epoch: 31, train_loss: 1.0507, test_loss: 1.1642, test_f1: 0.3460
 epoch: 32, train_loss: 1.0504, test_loss: 1.1917, test_f1: 0.2965
 epoch: 33, train_loss: 1.0593, test_loss: 1.1805, test_f1: 0.3427
 epoch: 34, train_loss: 1.0664, test_loss: 1.1296, test_f1: 0.3413
 epoch: 35, train_loss: 1.0530, test_loss: 1.1657, test_f1: 0.3771
 epoch: 36, train_loss: 1.0525, test_loss: 1.1270, test_f1: 0.3460
 epoch: 37, train_loss: 1.0319, test_loss: 1.1405, test_f1: 0.3422
 epoch: 38, train_loss: 1.0591, test_loss: 1.1335, test_f1: 0.3544
 epoch: 39, train_loss: 1.0512, test_loss: 1.1302, test_f1: 0.3460
 epoch: 40, train_loss: 1.0450, test_loss: 1.1357, test_f1: 0.3430
 epoch: 41, train_loss: 1.0451, test_loss: 1.1800, test_f1: 0.3926
 epoch: 42, train_loss: 1.0428, test_loss: 1.1598, test_f1: 0.4204
 epoch: 43, train_loss: 1.0506, test_loss: 1.1383, test_f1: 0.3432
 epoch: 44, train_loss: 1.0413, test_loss: 1.1806, test_f1: 0.3410
 epoch: 45, train_loss: 1.0495, test_loss: 1.0183, test_f1: 0.3553
 epoch: 46, train_loss: 1.0466, test_loss: 1.2936, test_f1: 0.3813
 epoch: 47, train_loss: 1.0347, test_loss: 1.1714, test_f1: 0.3503
 epoch: 48, train_loss: 1.0314, test_loss: 1.1311, test_f1: 0.3683
 epoch: 49, train_loss: 1.0389, test_loss: 1.1173, test_f1: 0.4327
 epoch: 50, train_loss: 1.0396, test_loss: 1.1734, test_f1: 0.3375
 epoch: 51, train_loss: 1.0297, test_loss: 1.1157, test_f1: 0.3418
 epoch: 52, train_loss: 1.0125, test_loss: 1.1290, test_f1: 0.3594
 epoch: 53, train_loss: 1.0168, test_loss: 1.1703, test_f1: 0.3728
 epoch: 54, train_loss: 1.0135, test_loss: 1.1092, test_f1: 0.3705
 epoch: 55, train_loss: 1.0096, test_loss: 1.0957, test_f1: 0.3773
 epoch: 56, train_loss: 1.0094, test_loss: 1.0911, test_f1: 0.4044
 epoch: 57, train_loss: 1.0126, test_loss: 1.1116, test_f1: 0.3628
 epoch: 58, train_loss: 1.0161, test_loss: 1.0883, test_f1: 0.3823
 epoch: 59, train_loss: 1.0105, test_loss: 1.0975, test_f1: 0.3484
 epoch: 60, train_loss: 1.0022, test_loss: 1.1025, test_f1: 0.3919
 epoch: 61, train_loss: 1.0096, test_loss: 1.1463, test_f1: 0.3813
 epoch: 62, train_loss: 1.0320, test_loss: 1.1217, test_f1: 0.3488
 epoch: 63, train_loss: 1.0292, test_loss: 1.1092, test_f1: 0.3451
 epoch: 64, train_loss: 1.0170, test_loss: 1.0991, test_f1: 0.3414
 epoch: 65, train_loss: 1.0096, test_loss: 1.1082, test_f1: 0.4081
 epoch: 66, train_loss: 1.0026, test_loss: 1.1289, test_f1: 0.3604
 epoch: 67, train_loss: 1.0115, test_loss: 1.1236, test_f1: 0.4052
 epoch: 68, train_loss: 1.0019, test_loss: 1.1101, test_f1: 0.3495
 epoch: 69, train_loss: 1.0141, test_loss: 1.1245, test_f1: 0.3673
 epoch: 70, train_loss: 1.0097, test_loss: 1.1052, test_f1: 0.3644
 epoch: 71, train_loss: 1.0104, test_loss: 1.1269, test_f1: 0.4071
 epoch: 72, train_loss: 1.0227, test_loss: 1.1190, test_f1: 0.3969
 epoch: 73, train_loss: 1.0054, test_loss: 1.1253, test_f1: 0.4181
 epoch: 74, train_loss: 1.0123, test_loss: 1.1734, test_f1: 0.3697
 epoch: 75, train_loss: 1.0097, test_loss: 1.1656, test_f1: 0.3425
 epoch: 76, train_loss: 1.0061, test_loss: 1.1347, test_f1: 0.3460
 epoch: 77, train_loss: 1.0120, test_loss: 1.1304, test_f1: 0.3657
 epoch: 78, train_loss: 1.0242, test_loss: 1.1815, test_f1: 0.3926
 epoch: 79, train_loss: 1.0139, test_loss: 1.1205, test_f1: 0.3866
 epoch: 80, train_loss: 1.0082, test_loss: 1.0818, test_f1: 0.3883
 epoch: 81, train_loss: 1.0110, test_loss: 1.1153, test_f1: 0.3425
 epoch: 82, train_loss: 0.9968, test_loss: 1.0816, test_f1: 0.3797
 epoch: 83, train_loss: 1.0065, test_loss: 1.1070, test_f1: 0.4769
 epoch: 84, train_loss: 1.0151, test_loss: 1.0968, test_f1: 0.3853
 epoch: 85, train_loss: 1.0274, test_loss: 1.2095, test_f1: 0.4110
 epoch: 86, train_loss: 1.0117, test_loss: 1.1022, test_f1: 0.4008
 epoch: 87, train_loss: 1.0164, test_loss: 1.1110, test_f1: 0.3847
 epoch: 88, train_loss: 1.0157, test_loss: 1.1124, test_f1: 0.3420
 epoch: 89, train_loss: 1.0103, test_loss: 1.2040, test_f1: 0.3427
 epoch: 90, train_loss: 1.0008, test_loss: 1.0974, test_f1: 0.3926
 epoch: 91, train_loss: 0.9981, test_loss: 1.1043, test_f1: 0.3737
 epoch: 92, train_loss: 1.0045, test_loss: 1.1050, test_f1: 0.3896
 epoch: 93, train_loss: 0.9968, test_loss: 1.1158, test_f1: 0.4731
 epoch: 94, train_loss: 1.0209, test_loss: 1.1155, test_f1: 0.3770
 epoch: 95, train_loss: 0.9942, test_loss: 1.0887, test_f1: 0.4009
 epoch: 96, train_loss: 0.9938, test_loss: 1.1059, test_f1: 0.3785
 epoch: 97, train_loss: 0.9979, test_loss: 1.1060, test_f1: 0.3586
 epoch: 98, train_loss: 1.0130, test_loss: 1.1118, test_f1: 0.3819
 epoch: 99, train_loss: 1.0058, test_loss: 1.0859, test_f1: 0.3829
##################ITERATION #9 ****************************************
 epoch: 0, train_loss: 1.3184, test_loss: 1.5534, test_f1: 0.3147
 epoch: 1, train_loss: 1.2171, test_loss: 1.0873, test_f1: 0.3413
 epoch: 2, train_loss: 1.0859, test_loss: 1.4580, test_f1: 0.3831
 epoch: 3, train_loss: 1.0939, test_loss: 1.1322, test_f1: 0.3460
 epoch: 4, train_loss: 1.0655, test_loss: 1.1506, test_f1: 0.3611
 epoch: 5, train_loss: 1.0614, test_loss: 1.1211, test_f1: 0.3444
 epoch: 6, train_loss: 1.0627, test_loss: 1.1188, test_f1: 0.3511
 epoch: 7, train_loss: 1.0665, test_loss: 1.1413, test_f1: 0.3422
 epoch: 8, train_loss: 1.0564, test_loss: 1.1496, test_f1: 0.3422
 epoch: 9, train_loss: 1.0576, test_loss: 1.1026, test_f1: 0.3422
 epoch: 10, train_loss: 1.0600, test_loss: 1.1846, test_f1: 0.3422
 epoch: 11, train_loss: 1.0601, test_loss: 1.0322, test_f1: 0.3560
 epoch: 12, train_loss: 1.0451, test_loss: 1.1381, test_f1: 0.3469
 epoch: 13, train_loss: 1.0304, test_loss: 1.1914, test_f1: 0.3452
 epoch: 14, train_loss: 1.0505, test_loss: 1.1754, test_f1: 0.4754
 epoch: 15, train_loss: 1.0369, test_loss: 1.1576, test_f1: 0.4366
 epoch: 16, train_loss: 1.0475, test_loss: 1.1388, test_f1: 0.4074
 epoch: 17, train_loss: 1.0422, test_loss: 1.1263, test_f1: 0.3441
 epoch: 18, train_loss: 1.0390, test_loss: 1.1338, test_f1: 0.3422
 epoch: 19, train_loss: 1.0646, test_loss: 1.1371, test_f1: 0.3467
 epoch: 20, train_loss: 1.0424, test_loss: 1.1627, test_f1: 0.3422
 epoch: 21, train_loss: 1.0163, test_loss: 1.1230, test_f1: 0.4501
 epoch: 22, train_loss: 1.0250, test_loss: 1.1306, test_f1: 0.3674
 epoch: 23, train_loss: 1.0215, test_loss: 1.1208, test_f1: 0.3887
 epoch: 24, train_loss: 1.0216, test_loss: 1.1227, test_f1: 0.3959
 epoch: 25, train_loss: 1.0179, test_loss: 1.1876, test_f1: 0.3422
 epoch: 26, train_loss: 1.0372, test_loss: 1.1410, test_f1: 0.3422
 epoch: 27, train_loss: 1.0477, test_loss: 1.1355, test_f1: 0.4469
 epoch: 28, train_loss: 1.0296, test_loss: 1.1271, test_f1: 0.3422
 epoch: 29, train_loss: 1.0343, test_loss: 1.1104, test_f1: 0.3495
 epoch: 30, train_loss: 1.0247, test_loss: 1.1133, test_f1: 0.3479
 epoch: 31, train_loss: 1.0584, test_loss: 1.1840, test_f1: 0.3647
 epoch: 32, train_loss: 1.0404, test_loss: 1.1398, test_f1: 0.3422
 epoch: 33, train_loss: 1.0245, test_loss: 1.1329, test_f1: 0.3422
 epoch: 34, train_loss: 1.0303, test_loss: 1.1130, test_f1: 0.4442
 epoch: 35, train_loss: 1.0223, test_loss: 1.1126, test_f1: 0.3457
 epoch: 36, train_loss: 1.0203, test_loss: 1.1097, test_f1: 0.3661
 epoch: 37, train_loss: 1.0201, test_loss: 1.1331, test_f1: 0.3436
 epoch: 38, train_loss: 1.0223, test_loss: 1.1435, test_f1: 0.3782
 epoch: 39, train_loss: 1.0373, test_loss: 1.1079, test_f1: 0.3513
 epoch: 40, train_loss: 1.0477, test_loss: 1.1344, test_f1: 0.3531
 epoch: 41, train_loss: 1.0351, test_loss: 1.1409, test_f1: 0.3776
 epoch: 42, train_loss: 1.0204, test_loss: 1.1199, test_f1: 0.3789
 epoch: 43, train_loss: 1.0227, test_loss: 1.1319, test_f1: 0.3425
 epoch: 44, train_loss: 1.0145, test_loss: 1.1207, test_f1: 0.3429
 epoch: 45, train_loss: 1.0458, test_loss: 1.2027, test_f1: 0.3593
 epoch: 46, train_loss: 1.0459, test_loss: 1.1582, test_f1: 0.4338
 epoch: 47, train_loss: 1.0475, test_loss: 1.1178, test_f1: 0.3425
 epoch: 48, train_loss: 1.0385, test_loss: 1.1226, test_f1: 0.4486
 epoch: 49, train_loss: 1.0262, test_loss: 1.1060, test_f1: 0.3536
 epoch: 50, train_loss: 1.0640, test_loss: 1.1448, test_f1: 0.4119
 epoch: 51, train_loss: 1.0669, test_loss: 1.1235, test_f1: 0.3455
 epoch: 52, train_loss: 1.0378, test_loss: 1.1352, test_f1: 0.3560
 epoch: 53, train_loss: 1.0466, test_loss: 1.1146, test_f1: 0.3858
 epoch: 54, train_loss: 1.0471, test_loss: 1.1448, test_f1: 0.3441
 epoch: 55, train_loss: 1.0281, test_loss: 1.1214, test_f1: 0.3413
 epoch: 56, train_loss: 1.0357, test_loss: 1.1040, test_f1: 0.4731
 epoch: 57, train_loss: 1.0374, test_loss: 1.1278, test_f1: 0.3579
 epoch: 58, train_loss: 1.0271, test_loss: 1.1208, test_f1: 0.3662
 epoch: 59, train_loss: 1.0196, test_loss: 1.1226, test_f1: 0.3418
 epoch: 60, train_loss: 1.0296, test_loss: 1.1842, test_f1: 0.3442
 epoch: 61, train_loss: 1.0791, test_loss: 1.1565, test_f1: 0.3432
 epoch: 62, train_loss: 1.0602, test_loss: 1.1318, test_f1: 0.3422
 epoch: 63, train_loss: 1.0432, test_loss: 1.1316, test_f1: 0.4250
 epoch: 64, train_loss: 1.0293, test_loss: 1.1187, test_f1: 0.4597
 epoch: 65, train_loss: 1.0347, test_loss: 1.1067, test_f1: 0.3448
 epoch: 66, train_loss: 1.0233, test_loss: 1.0927, test_f1: 0.4226
 epoch: 67, train_loss: 1.0330, test_loss: 1.1098, test_f1: 0.4358
 epoch: 68, train_loss: 1.0209, test_loss: 1.1149, test_f1: 0.3439
 epoch: 69, train_loss: 1.0289, test_loss: 1.1024, test_f1: 0.3432
 epoch: 70, train_loss: 1.0231, test_loss: 1.0974, test_f1: 0.3441
 epoch: 71, train_loss: 1.0229, test_loss: 1.0958, test_f1: 0.4134
 epoch: 72, train_loss: 1.0065, test_loss: 1.0838, test_f1: 0.4255
 epoch: 73, train_loss: 1.0196, test_loss: 1.1140, test_f1: 0.3432
 epoch: 74, train_loss: 1.0095, test_loss: 1.1150, test_f1: 0.3444
 epoch: 75, train_loss: 1.0252, test_loss: 1.1172, test_f1: 0.3772
 epoch: 76, train_loss: 1.0198, test_loss: 1.1045, test_f1: 0.3999
 epoch: 77, train_loss: 1.0154, test_loss: 1.0831, test_f1: 0.3479
 epoch: 78, train_loss: 1.0159, test_loss: 1.0950, test_f1: 0.3512
 epoch: 79, train_loss: 1.0289, test_loss: 1.1266, test_f1: 0.3413
 epoch: 80, train_loss: 1.0310, test_loss: 1.1484, test_f1: 0.3467
 epoch: 81, train_loss: 1.0604, test_loss: 1.1515, test_f1: 0.3794
 epoch: 82, train_loss: 1.0526, test_loss: 1.1180, test_f1: 0.3513
 epoch: 83, train_loss: 1.0431, test_loss: 1.1202, test_f1: 0.3432
 epoch: 84, train_loss: 1.0486, test_loss: 1.1389, test_f1: 0.3413
 epoch: 85, train_loss: 1.0388, test_loss: 1.1231, test_f1: 0.3422
 epoch: 86, train_loss: 1.0229, test_loss: 1.1151, test_f1: 0.4490
 epoch: 87, train_loss: 1.0147, test_loss: 1.1259, test_f1: 0.3439
 epoch: 88, train_loss: 1.0270, test_loss: 1.1209, test_f1: 0.3437
 epoch: 89, train_loss: 1.0200, test_loss: 1.1407, test_f1: 0.3422
 epoch: 90, train_loss: 1.0135, test_loss: 1.1213, test_f1: 0.3439
 epoch: 91, train_loss: 1.0161, test_loss: 1.0804, test_f1: 0.3848
 epoch: 92, train_loss: 1.0124, test_loss: 1.0816, test_f1: 0.3746
 epoch: 93, train_loss: 1.0033, test_loss: 1.1230, test_f1: 0.3434
 epoch: 94, train_loss: 1.0240, test_loss: 1.1118, test_f1: 0.3473
 epoch: 95, train_loss: 1.0276, test_loss: 1.1071, test_f1: 0.3611
 epoch: 96, train_loss: 1.0262, test_loss: 1.0923, test_f1: 0.4042
 epoch: 97, train_loss: 1.0129, test_loss: 1.1656, test_f1: 0.3593
 epoch: 98, train_loss: 1.0439, test_loss: 1.1352, test_f1: 0.3983
 epoch: 99, train_loss: 1.0383, test_loss: 1.1313, test_f1: 0.3395

Training completed in 727.09 seconds
Best F1: 0.4818 at epoch 51
Mean F1 across iterations: 0.3636  0.1141
========================FINAL RESULTS================================
FEGIN weighted F1: 0.4818  0.1141
python main.py --data ltspice_examples --representation component_pin_net --model FEGIN --layers 3 --hiddens 16 --batch_size 128 --lr 0.1 --emb_size 128 --epochs 100 --save_appendix component_pin_net_L3_H16_BS128_LR0.1_E128 --no_val
-----



STDERR:
  File "main.py", line 370, in <module>
    main()
  File "main.py", line 254, in main
    dataset = dataset_class(
  File "/home/philip/projects/llm_inference_code_repo/Circuit-Completion-Using-GNNs/component_classification_with_link_prediction_head/evaluation/FEGIN/kernel/circuit_datasets.py", line 15, in __init__
    self.data, self.slices = torch.load(self.processed_paths[0])
  File "/home/philip/.local/lib/python3.8/site-packages/torch/serialization.py", line 1040, in load
    warnings.warn(
  File "/usr/lib/python3.8/warnings.py", line 109, in _showwarnmsg
    sw(msg.message, msg.category, msg.filename, msg.lineno,
  File "main.py", line 47, in warn_with_traceback
    traceback.print_stack(file=log)
/home/philip/projects/llm_inference_code_repo/Circuit-Completion-Using-GNNs/component_classification_with_link_prediction_head/evaluation/FEGIN/kernel/circuit_datasets.py:15: FutureWarning: You are using `torch.load` with `weights_only=False` (the current default value), which uses the default pickle module implicitly. It is possible to construct malicious pickle data which will execute arbitrary code during unpickling (See https://github.com/pytorch/pytorch/blob/main/SECURITY.md#untrusted-models for more details). In a future release, the default value for `weights_only` will be flipped to `True`. This limits the functions that could be executed during unpickling. Arbitrary objects will no longer be allowed to be loaded via this mode unless they are explicitly allowlisted by the user via `torch.serialization.add_safe_globals`. We recommend you start setting `weights_only=True` for any use case where you don't have full control of the loaded file. Please open an issue on GitHub for any issues related to this experimental feature.
  self.data, self.slices = torch.load(self.processed_paths[0])
