STDOUT:
Results will be saved in /home/philip/projects/ltspice_examples_code_repo/Circuit-Completion-Using-GNNs/component_classification_with_link_prediction_head/evaluation/FEGIN/results/model_FEGIN_dataset_ltspice_demos
Command line input: python main.py --data ltspice_demos --representation component_component --model FEGIN --layers 2 --hiddens 64 --batch_size 64 --lr 0.0001 --emb_size 128 --epochs 100 --save_appendix component_component_L2_H64_BS64_LR0.0001_E128 --no_val
 is saved.
-----
ltspice_demos - FEGIN
Using 2 layers, 64 hidden units, h = 2
Loading component_component representation dataset
ENTERED
Training FEGIN on component_component representation
Train: 1565, Test: 383
##################ITERATION #0 ****************************************
 epoch: 0, train_loss: 1.4045, test_loss: 1.3969, test_f1: 0.0457
 epoch: 1, train_loss: 1.3904, test_loss: 1.3866, test_f1: 0.1077
 epoch: 2, train_loss: 1.3808, test_loss: 1.3766, test_f1: 0.2691
 epoch: 3, train_loss: 1.3696, test_loss: 1.3659, test_f1: 0.2331
 epoch: 4, train_loss: 1.3539, test_loss: 1.3545, test_f1: 0.2281
 epoch: 5, train_loss: 1.3374, test_loss: 1.3416, test_f1: 0.2614
 epoch: 6, train_loss: 1.3159, test_loss: 1.3276, test_f1: 0.2587
 epoch: 7, train_loss: 1.2920, test_loss: 1.3127, test_f1: 0.2596
 epoch: 8, train_loss: 1.2685, test_loss: 1.3007, test_f1: 0.2634
 epoch: 9, train_loss: 1.2460, test_loss: 1.2913, test_f1: 0.2600
 epoch: 10, train_loss: 1.2249, test_loss: 1.2849, test_f1: 0.2618
 epoch: 11, train_loss: 1.2078, test_loss: 1.2793, test_f1: 0.2599
 epoch: 12, train_loss: 1.1962, test_loss: 1.2790, test_f1: 0.2607
 epoch: 13, train_loss: 1.1859, test_loss: 1.2800, test_f1: 0.2599
 epoch: 14, train_loss: 1.1736, test_loss: 1.2723, test_f1: 0.2653
 epoch: 15, train_loss: 1.1628, test_loss: 1.2742, test_f1: 0.2747
 epoch: 16, train_loss: 1.1570, test_loss: 1.2736, test_f1: 0.3291
 epoch: 17, train_loss: 1.1499, test_loss: 1.2767, test_f1: 0.3195
 epoch: 18, train_loss: 1.1468, test_loss: 1.2685, test_f1: 0.3709
 epoch: 19, train_loss: 1.1423, test_loss: 1.2694, test_f1: 0.4003
 epoch: 20, train_loss: 1.1255, test_loss: 1.2714, test_f1: 0.4092
 epoch: 21, train_loss: 1.1257, test_loss: 1.2659, test_f1: 0.3949
 epoch: 22, train_loss: 1.1147, test_loss: 1.2636, test_f1: 0.3976
 epoch: 23, train_loss: 1.1072, test_loss: 1.2459, test_f1: 0.3909
 epoch: 24, train_loss: 1.1025, test_loss: 1.2422, test_f1: 0.3885
 epoch: 25, train_loss: 1.0886, test_loss: 1.2382, test_f1: 0.3864
 epoch: 26, train_loss: 1.0769, test_loss: 1.2298, test_f1: 0.3885
 epoch: 27, train_loss: 1.0748, test_loss: 1.2291, test_f1: 0.3957
 epoch: 28, train_loss: 1.0628, test_loss: 1.2233, test_f1: 0.3952
 epoch: 29, train_loss: 1.0559, test_loss: 1.2324, test_f1: 0.4132
 epoch: 30, train_loss: 1.0516, test_loss: 1.2276, test_f1: 0.4059
 epoch: 31, train_loss: 1.0358, test_loss: 1.2292, test_f1: 0.4210
 epoch: 32, train_loss: 1.0260, test_loss: 1.2283, test_f1: 0.4308
 epoch: 33, train_loss: 1.0246, test_loss: 1.2226, test_f1: 0.4260
 epoch: 34, train_loss: 1.0090, test_loss: 1.2351, test_f1: 0.4247
 epoch: 35, train_loss: 1.0058, test_loss: 1.2192, test_f1: 0.4185
 epoch: 36, train_loss: 0.9976, test_loss: 1.2209, test_f1: 0.4366
 epoch: 37, train_loss: 0.9992, test_loss: 1.2297, test_f1: 0.4344
 epoch: 38, train_loss: 1.0005, test_loss: 1.2257, test_f1: 0.4382
 epoch: 39, train_loss: 0.9885, test_loss: 1.2279, test_f1: 0.4323
 epoch: 40, train_loss: 0.9813, test_loss: 1.2326, test_f1: 0.4366
 epoch: 41, train_loss: 0.9674, test_loss: 1.2416, test_f1: 0.4346
 epoch: 42, train_loss: 0.9799, test_loss: 1.2486, test_f1: 0.4432
 epoch: 43, train_loss: 0.9742, test_loss: 1.2546, test_f1: 0.4465
 epoch: 44, train_loss: 0.9638, test_loss: 1.2592, test_f1: 0.4406
 epoch: 45, train_loss: 0.9620, test_loss: 1.2698, test_f1: 0.4307
 epoch: 46, train_loss: 0.9603, test_loss: 1.2746, test_f1: 0.4479
 epoch: 47, train_loss: 0.9461, test_loss: 1.2751, test_f1: 0.4573
 epoch: 48, train_loss: 0.9452, test_loss: 1.2939, test_f1: 0.4442
 epoch: 49, train_loss: 0.9556, test_loss: 1.2975, test_f1: 0.4765
 epoch: 50, train_loss: 0.9359, test_loss: 1.2745, test_f1: 0.4449
 epoch: 51, train_loss: 0.9197, test_loss: 1.3033, test_f1: 0.4663
 epoch: 52, train_loss: 0.9268, test_loss: 1.3125, test_f1: 0.4715
 epoch: 53, train_loss: 0.9199, test_loss: 1.3147, test_f1: 0.4763
 epoch: 54, train_loss: 0.9185, test_loss: 1.3071, test_f1: 0.4645
 epoch: 55, train_loss: 0.9233, test_loss: 1.3161, test_f1: 0.4756
 epoch: 56, train_loss: 0.9182, test_loss: 1.3103, test_f1: 0.4725
 epoch: 57, train_loss: 0.9111, test_loss: 1.3113, test_f1: 0.4822
 epoch: 58, train_loss: 0.9174, test_loss: 1.3179, test_f1: 0.4917
 epoch: 59, train_loss: 0.9187, test_loss: 1.3194, test_f1: 0.4758
 epoch: 60, train_loss: 0.9101, test_loss: 1.3283, test_f1: 0.4833
 epoch: 61, train_loss: 0.9015, test_loss: 1.3329, test_f1: 0.5046
 epoch: 62, train_loss: 0.9079, test_loss: 1.3262, test_f1: 0.4958
 epoch: 63, train_loss: 0.9055, test_loss: 1.3352, test_f1: 0.5024
 epoch: 64, train_loss: 0.9012, test_loss: 1.3396, test_f1: 0.4656
 epoch: 65, train_loss: 0.9063, test_loss: 1.3494, test_f1: 0.4877
 epoch: 66, train_loss: 0.8947, test_loss: 1.3452, test_f1: 0.5117
 epoch: 67, train_loss: 0.8975, test_loss: 1.3522, test_f1: 0.5067
 epoch: 68, train_loss: 0.8996, test_loss: 1.3594, test_f1: 0.5115
 epoch: 69, train_loss: 0.8919, test_loss: 1.3512, test_f1: 0.5243
 epoch: 70, train_loss: 0.8947, test_loss: 1.3594, test_f1: 0.5266
 epoch: 71, train_loss: 0.8900, test_loss: 1.3531, test_f1: 0.5181
 epoch: 72, train_loss: 0.8793, test_loss: 1.3728, test_f1: 0.5174
 epoch: 73, train_loss: 0.8933, test_loss: 1.3997, test_f1: 0.5358
 epoch: 74, train_loss: 0.8923, test_loss: 1.3967, test_f1: 0.5244
 epoch: 75, train_loss: 0.8831, test_loss: 1.3964, test_f1: 0.5093
 epoch: 76, train_loss: 0.8828, test_loss: 1.3961, test_f1: 0.5028
 epoch: 77, train_loss: 0.8849, test_loss: 1.3809, test_f1: 0.5134
 epoch: 78, train_loss: 0.8826, test_loss: 1.4101, test_f1: 0.5209
 epoch: 79, train_loss: 0.8721, test_loss: 1.4289, test_f1: 0.5293
 epoch: 80, train_loss: 0.8736, test_loss: 1.3981, test_f1: 0.5321
 epoch: 81, train_loss: 0.8614, test_loss: 1.3907, test_f1: 0.5375
 epoch: 82, train_loss: 0.8639, test_loss: 1.3929, test_f1: 0.5426
 epoch: 83, train_loss: 0.8717, test_loss: 1.4045, test_f1: 0.5171
 epoch: 84, train_loss: 0.8580, test_loss: 1.4326, test_f1: 0.5375
 epoch: 85, train_loss: 0.8626, test_loss: 1.4494, test_f1: 0.5407
 epoch: 86, train_loss: 0.8542, test_loss: 1.4265, test_f1: 0.5236
 epoch: 87, train_loss: 0.8584, test_loss: 1.4423, test_f1: 0.5157
 epoch: 88, train_loss: 0.8562, test_loss: 1.4445, test_f1: 0.5256
 epoch: 89, train_loss: 0.8573, test_loss: 1.4075, test_f1: 0.5267
 epoch: 90, train_loss: 0.8631, test_loss: 1.4147, test_f1: 0.5411
 epoch: 91, train_loss: 0.8581, test_loss: 1.4359, test_f1: 0.5434
 epoch: 92, train_loss: 0.8456, test_loss: 1.4401, test_f1: 0.5408
 epoch: 93, train_loss: 0.8458, test_loss: 1.4679, test_f1: 0.5514
 epoch: 94, train_loss: 0.8425, test_loss: 1.4561, test_f1: 0.5456
 epoch: 95, train_loss: 0.8506, test_loss: 1.4558, test_f1: 0.5536
 epoch: 96, train_loss: 0.8443, test_loss: 1.4461, test_f1: 0.5339
 epoch: 97, train_loss: 0.8266, test_loss: 1.4748, test_f1: 0.5426
 epoch: 98, train_loss: 0.8343, test_loss: 1.4968, test_f1: 0.5453
 epoch: 99, train_loss: 0.8405, test_loss: 1.5053, test_f1: 0.5393
##################ITERATION #1 ****************************************
 epoch: 0, train_loss: 1.3773, test_loss: 1.3753, test_f1: 0.2115
 epoch: 1, train_loss: 1.3333, test_loss: 1.3529, test_f1: 0.2336
 epoch: 2, train_loss: 1.3026, test_loss: 1.3333, test_f1: 0.2281
 epoch: 3, train_loss: 1.2794, test_loss: 1.3141, test_f1: 0.2289
 epoch: 4, train_loss: 1.2551, test_loss: 1.3048, test_f1: 0.2281
 epoch: 5, train_loss: 1.2355, test_loss: 1.2919, test_f1: 0.2281
 epoch: 6, train_loss: 1.2196, test_loss: 1.2859, test_f1: 0.2285
 epoch: 7, train_loss: 1.2026, test_loss: 1.2779, test_f1: 0.2555
 epoch: 8, train_loss: 1.1964, test_loss: 1.2677, test_f1: 0.2974
 epoch: 9, train_loss: 1.1763, test_loss: 1.2598, test_f1: 0.3057
 epoch: 10, train_loss: 1.1706, test_loss: 1.2490, test_f1: 0.3658
 epoch: 11, train_loss: 1.1509, test_loss: 1.2467, test_f1: 0.3638
 epoch: 12, train_loss: 1.1462, test_loss: 1.2430, test_f1: 0.3933
 epoch: 13, train_loss: 1.1299, test_loss: 1.2390, test_f1: 0.4070
 epoch: 14, train_loss: 1.1210, test_loss: 1.2242, test_f1: 0.4068
 epoch: 15, train_loss: 1.1108, test_loss: 1.2190, test_f1: 0.4001
 epoch: 16, train_loss: 1.1079, test_loss: 1.2252, test_f1: 0.4434
 epoch: 17, train_loss: 1.0924, test_loss: 1.2033, test_f1: 0.4421
 epoch: 18, train_loss: 1.0818, test_loss: 1.2024, test_f1: 0.4400
 epoch: 19, train_loss: 1.0745, test_loss: 1.1941, test_f1: 0.4389
 epoch: 20, train_loss: 1.0608, test_loss: 1.1779, test_f1: 0.4371
 epoch: 21, train_loss: 1.0426, test_loss: 1.1778, test_f1: 0.4438
 epoch: 22, train_loss: 1.0391, test_loss: 1.1723, test_f1: 0.4474
 epoch: 23, train_loss: 1.0266, test_loss: 1.1660, test_f1: 0.4469
 epoch: 24, train_loss: 1.0282, test_loss: 1.1665, test_f1: 0.4342
 epoch: 25, train_loss: 1.0136, test_loss: 1.1541, test_f1: 0.4437
 epoch: 26, train_loss: 1.0090, test_loss: 1.1546, test_f1: 0.4636
 epoch: 27, train_loss: 1.0041, test_loss: 1.1542, test_f1: 0.4793
 epoch: 28, train_loss: 0.9936, test_loss: 1.1520, test_f1: 0.4830
 epoch: 29, train_loss: 0.9746, test_loss: 1.1526, test_f1: 0.4996
 epoch: 30, train_loss: 0.9716, test_loss: 1.1527, test_f1: 0.5012
 epoch: 31, train_loss: 0.9634, test_loss: 1.1465, test_f1: 0.5063
 epoch: 32, train_loss: 0.9638, test_loss: 1.1586, test_f1: 0.4949
 epoch: 33, train_loss: 0.9572, test_loss: 1.1585, test_f1: 0.5309
 epoch: 34, train_loss: 0.9518, test_loss: 1.1437, test_f1: 0.5154
 epoch: 35, train_loss: 0.9521, test_loss: 1.1588, test_f1: 0.5369
 epoch: 36, train_loss: 0.9372, test_loss: 1.1569, test_f1: 0.5322
 epoch: 37, train_loss: 0.9265, test_loss: 1.1730, test_f1: 0.5353
 epoch: 38, train_loss: 0.9223, test_loss: 1.1585, test_f1: 0.5484
 epoch: 39, train_loss: 0.9182, test_loss: 1.1448, test_f1: 0.5482
 epoch: 40, train_loss: 0.9053, test_loss: 1.1304, test_f1: 0.5765
 epoch: 41, train_loss: 0.9034, test_loss: 1.1647, test_f1: 0.5586
 epoch: 42, train_loss: 0.8938, test_loss: 1.1604, test_f1: 0.5599
 epoch: 43, train_loss: 0.8889, test_loss: 1.1967, test_f1: 0.5271
 epoch: 44, train_loss: 0.9036, test_loss: 1.1831, test_f1: 0.5555
 epoch: 45, train_loss: 0.8800, test_loss: 1.2125, test_f1: 0.5206
 epoch: 46, train_loss: 0.8902, test_loss: 1.2076, test_f1: 0.5272
 epoch: 47, train_loss: 0.8781, test_loss: 1.1823, test_f1: 0.5457
 epoch: 48, train_loss: 0.8801, test_loss: 1.1908, test_f1: 0.5498
 epoch: 49, train_loss: 0.8669, test_loss: 1.1793, test_f1: 0.5522
 epoch: 50, train_loss: 0.8489, test_loss: 1.1603, test_f1: 0.5690
 epoch: 51, train_loss: 0.8562, test_loss: 1.1776, test_f1: 0.5660
 epoch: 52, train_loss: 0.8493, test_loss: 1.1884, test_f1: 0.5556
 epoch: 53, train_loss: 0.8558, test_loss: 1.1907, test_f1: 0.5496
 epoch: 54, train_loss: 0.8431, test_loss: 1.1834, test_f1: 0.5634
 epoch: 55, train_loss: 0.8546, test_loss: 1.1944, test_f1: 0.5611
 epoch: 56, train_loss: 0.8468, test_loss: 1.1971, test_f1: 0.5605
 epoch: 57, train_loss: 0.8376, test_loss: 1.2084, test_f1: 0.5608
 epoch: 58, train_loss: 0.8335, test_loss: 1.2173, test_f1: 0.5708
 epoch: 59, train_loss: 0.8437, test_loss: 1.2340, test_f1: 0.5518
 epoch: 60, train_loss: 0.8366, test_loss: 1.2350, test_f1: 0.5502
 epoch: 61, train_loss: 0.8278, test_loss: 1.2027, test_f1: 0.5408
 epoch: 62, train_loss: 0.8260, test_loss: 1.2182, test_f1: 0.5392
 epoch: 63, train_loss: 0.8197, test_loss: 1.2253, test_f1: 0.5567
 epoch: 64, train_loss: 0.8309, test_loss: 1.2252, test_f1: 0.5627
 epoch: 65, train_loss: 0.8155, test_loss: 1.2329, test_f1: 0.5457
 epoch: 66, train_loss: 0.8219, test_loss: 1.2409, test_f1: 0.5415
 epoch: 67, train_loss: 0.8223, test_loss: 1.2571, test_f1: 0.5584
 epoch: 68, train_loss: 0.8269, test_loss: 1.2627, test_f1: 0.5722
 epoch: 69, train_loss: 0.8094, test_loss: 1.2750, test_f1: 0.5438
 epoch: 70, train_loss: 0.8175, test_loss: 1.2709, test_f1: 0.5411
 epoch: 71, train_loss: 0.8166, test_loss: 1.2662, test_f1: 0.5476
 epoch: 72, train_loss: 0.7990, test_loss: 1.2608, test_f1: 0.5763
 epoch: 73, train_loss: 0.8148, test_loss: 1.2557, test_f1: 0.5363
 epoch: 74, train_loss: 0.8111, test_loss: 1.2570, test_f1: 0.5416
 epoch: 75, train_loss: 0.8004, test_loss: 1.2609, test_f1: 0.5462
 epoch: 76, train_loss: 0.7972, test_loss: 1.2413, test_f1: 0.5497
 epoch: 77, train_loss: 0.7954, test_loss: 1.2597, test_f1: 0.5498
 epoch: 78, train_loss: 0.8098, test_loss: 1.2524, test_f1: 0.5351
 epoch: 79, train_loss: 0.7940, test_loss: 1.2595, test_f1: 0.5524
 epoch: 80, train_loss: 0.8036, test_loss: 1.2633, test_f1: 0.5497
 epoch: 81, train_loss: 0.7941, test_loss: 1.2798, test_f1: 0.5426
 epoch: 82, train_loss: 0.7785, test_loss: 1.2837, test_f1: 0.5383
 epoch: 83, train_loss: 0.7801, test_loss: 1.2867, test_f1: 0.5454
 epoch: 84, train_loss: 0.7855, test_loss: 1.2950, test_f1: 0.5517
 epoch: 85, train_loss: 0.7890, test_loss: 1.3004, test_f1: 0.5548
 epoch: 86, train_loss: 0.7928, test_loss: 1.2983, test_f1: 0.5523
 epoch: 87, train_loss: 0.7724, test_loss: 1.3104, test_f1: 0.5504
 epoch: 88, train_loss: 0.7966, test_loss: 1.2862, test_f1: 0.5551
 epoch: 89, train_loss: 0.7831, test_loss: 1.2836, test_f1: 0.5573
 epoch: 90, train_loss: 0.7667, test_loss: 1.2877, test_f1: 0.5445
 epoch: 91, train_loss: 0.7759, test_loss: 1.3004, test_f1: 0.5619
 epoch: 92, train_loss: 0.7830, test_loss: 1.2993, test_f1: 0.5406
 epoch: 93, train_loss: 0.7824, test_loss: 1.3022, test_f1: 0.5434
 epoch: 94, train_loss: 0.7712, test_loss: 1.3220, test_f1: 0.5481
 epoch: 95, train_loss: 0.7572, test_loss: 1.3169, test_f1: 0.5497
 epoch: 96, train_loss: 0.7928, test_loss: 1.3259, test_f1: 0.5455
 epoch: 97, train_loss: 0.7672, test_loss: 1.3135, test_f1: 0.5468
 epoch: 98, train_loss: 0.7567, test_loss: 1.3355, test_f1: 0.5521
 epoch: 99, train_loss: 0.7633, test_loss: 1.3327, test_f1: 0.5491
##################ITERATION #2 ****************************************
 epoch: 0, train_loss: 1.3159, test_loss: 1.3604, test_f1: 0.2383
 epoch: 1, train_loss: 1.2782, test_loss: 1.3407, test_f1: 0.2786
 epoch: 2, train_loss: 1.2584, test_loss: 1.3257, test_f1: 0.3007
 epoch: 3, train_loss: 1.2409, test_loss: 1.3214, test_f1: 0.3172
 epoch: 4, train_loss: 1.2216, test_loss: 1.3171, test_f1: 0.3188
 epoch: 5, train_loss: 1.2092, test_loss: 1.2985, test_f1: 0.3451
 epoch: 6, train_loss: 1.1946, test_loss: 1.2898, test_f1: 0.3420
 epoch: 7, train_loss: 1.1798, test_loss: 1.2813, test_f1: 0.3561
 epoch: 8, train_loss: 1.1647, test_loss: 1.2716, test_f1: 0.3859
 epoch: 9, train_loss: 1.1556, test_loss: 1.2588, test_f1: 0.4325
 epoch: 10, train_loss: 1.1397, test_loss: 1.2495, test_f1: 0.4354
 epoch: 11, train_loss: 1.1299, test_loss: 1.2404, test_f1: 0.4452
 epoch: 12, train_loss: 1.1146, test_loss: 1.2308, test_f1: 0.4473
 epoch: 13, train_loss: 1.1062, test_loss: 1.2274, test_f1: 0.4586
 epoch: 14, train_loss: 1.0837, test_loss: 1.2191, test_f1: 0.4498
 epoch: 15, train_loss: 1.0732, test_loss: 1.2163, test_f1: 0.4554
 epoch: 16, train_loss: 1.0661, test_loss: 1.2035, test_f1: 0.4607
 epoch: 17, train_loss: 1.0583, test_loss: 1.1980, test_f1: 0.4522
 epoch: 18, train_loss: 1.0468, test_loss: 1.2076, test_f1: 0.4575
 epoch: 19, train_loss: 1.0480, test_loss: 1.1967, test_f1: 0.4720
 epoch: 20, train_loss: 1.0291, test_loss: 1.1934, test_f1: 0.4497
 epoch: 21, train_loss: 1.0229, test_loss: 1.1806, test_f1: 0.4711
 epoch: 22, train_loss: 1.0160, test_loss: 1.1856, test_f1: 0.4741
 epoch: 23, train_loss: 1.0115, test_loss: 1.1947, test_f1: 0.4726
 epoch: 24, train_loss: 1.0071, test_loss: 1.1989, test_f1: 0.4710
 epoch: 25, train_loss: 1.0062, test_loss: 1.1946, test_f1: 0.4873
 epoch: 26, train_loss: 1.0014, test_loss: 1.1926, test_f1: 0.4697
 epoch: 27, train_loss: 0.9855, test_loss: 1.1940, test_f1: 0.4728
 epoch: 28, train_loss: 0.9870, test_loss: 1.1895, test_f1: 0.4798
 epoch: 29, train_loss: 0.9780, test_loss: 1.1937, test_f1: 0.4782
 epoch: 30, train_loss: 0.9697, test_loss: 1.1921, test_f1: 0.4804
 epoch: 31, train_loss: 0.9854, test_loss: 1.1846, test_f1: 0.4827
 epoch: 32, train_loss: 0.9742, test_loss: 1.2011, test_f1: 0.4923
 epoch: 33, train_loss: 0.9595, test_loss: 1.1883, test_f1: 0.4908
 epoch: 34, train_loss: 0.9639, test_loss: 1.1928, test_f1: 0.4958
 epoch: 35, train_loss: 0.9546, test_loss: 1.1928, test_f1: 0.4916
 epoch: 36, train_loss: 0.9426, test_loss: 1.1925, test_f1: 0.5020
 epoch: 37, train_loss: 0.9473, test_loss: 1.1894, test_f1: 0.4993
 epoch: 38, train_loss: 0.9489, test_loss: 1.1932, test_f1: 0.5015
 epoch: 39, train_loss: 0.9283, test_loss: 1.1927, test_f1: 0.5020
 epoch: 40, train_loss: 0.9341, test_loss: 1.1903, test_f1: 0.5016
 epoch: 41, train_loss: 0.9328, test_loss: 1.1933, test_f1: 0.5005
 epoch: 42, train_loss: 0.9299, test_loss: 1.2020, test_f1: 0.5016
 epoch: 43, train_loss: 0.9242, test_loss: 1.2139, test_f1: 0.4996
 epoch: 44, train_loss: 0.9135, test_loss: 1.1887, test_f1: 0.5020
 epoch: 45, train_loss: 0.9127, test_loss: 1.2039, test_f1: 0.5223
 epoch: 46, train_loss: 0.9018, test_loss: 1.2060, test_f1: 0.5119
 epoch: 47, train_loss: 0.9132, test_loss: 1.2118, test_f1: 0.5141
 epoch: 48, train_loss: 0.9152, test_loss: 1.1983, test_f1: 0.5015
 epoch: 49, train_loss: 0.9024, test_loss: 1.2027, test_f1: 0.5191
 epoch: 50, train_loss: 0.8921, test_loss: 1.2070, test_f1: 0.5145
 epoch: 51, train_loss: 0.8867, test_loss: 1.2150, test_f1: 0.4968
 epoch: 52, train_loss: 0.8881, test_loss: 1.2197, test_f1: 0.4932
 epoch: 53, train_loss: 0.8925, test_loss: 1.2190, test_f1: 0.5026
 epoch: 54, train_loss: 0.8902, test_loss: 1.2038, test_f1: 0.5151
 epoch: 55, train_loss: 0.8829, test_loss: 1.2037, test_f1: 0.5104
 epoch: 56, train_loss: 0.8741, test_loss: 1.2070, test_f1: 0.5065
 epoch: 57, train_loss: 0.8716, test_loss: 1.2116, test_f1: 0.5072
 epoch: 58, train_loss: 0.8828, test_loss: 1.2192, test_f1: 0.5099
 epoch: 59, train_loss: 0.8757, test_loss: 1.2071, test_f1: 0.5134
 epoch: 60, train_loss: 0.8687, test_loss: 1.2283, test_f1: 0.5123
 epoch: 61, train_loss: 0.8751, test_loss: 1.2140, test_f1: 0.5062
 epoch: 62, train_loss: 0.8686, test_loss: 1.2154, test_f1: 0.5083
 epoch: 63, train_loss: 0.8818, test_loss: 1.2148, test_f1: 0.5122
 epoch: 64, train_loss: 0.8683, test_loss: 1.2122, test_f1: 0.5380
 epoch: 65, train_loss: 0.8662, test_loss: 1.2237, test_f1: 0.5286
 epoch: 66, train_loss: 0.8647, test_loss: 1.2247, test_f1: 0.5437
 epoch: 67, train_loss: 0.8566, test_loss: 1.2036, test_f1: 0.5452
 epoch: 68, train_loss: 0.8589, test_loss: 1.2199, test_f1: 0.5412
 epoch: 69, train_loss: 0.8648, test_loss: 1.2208, test_f1: 0.5485
 epoch: 70, train_loss: 0.8449, test_loss: 1.2149, test_f1: 0.5324
 epoch: 71, train_loss: 0.8619, test_loss: 1.2235, test_f1: 0.5228
 epoch: 72, train_loss: 0.8507, test_loss: 1.2218, test_f1: 0.5353
 epoch: 73, train_loss: 0.8607, test_loss: 1.2040, test_f1: 0.5593
 epoch: 74, train_loss: 0.8551, test_loss: 1.2215, test_f1: 0.5403
 epoch: 75, train_loss: 0.8512, test_loss: 1.2312, test_f1: 0.5307
 epoch: 76, train_loss: 0.8583, test_loss: 1.2291, test_f1: 0.5353
 epoch: 77, train_loss: 0.8405, test_loss: 1.2189, test_f1: 0.5540
 epoch: 78, train_loss: 0.8496, test_loss: 1.2308, test_f1: 0.5538
 epoch: 79, train_loss: 0.8481, test_loss: 1.2307, test_f1: 0.5487
 epoch: 80, train_loss: 0.8467, test_loss: 1.2197, test_f1: 0.5456
 epoch: 81, train_loss: 0.8292, test_loss: 1.2283, test_f1: 0.5514
 epoch: 82, train_loss: 0.8341, test_loss: 1.2120, test_f1: 0.5463
 epoch: 83, train_loss: 0.8409, test_loss: 1.2324, test_f1: 0.5436
 epoch: 84, train_loss: 0.8336, test_loss: 1.2352, test_f1: 0.5328
 epoch: 85, train_loss: 0.8353, test_loss: 1.2306, test_f1: 0.5508
 epoch: 86, train_loss: 0.8367, test_loss: 1.2297, test_f1: 0.5458
 epoch: 87, train_loss: 0.8391, test_loss: 1.2577, test_f1: 0.5464
 epoch: 88, train_loss: 0.8310, test_loss: 1.2450, test_f1: 0.5438
 epoch: 89, train_loss: 0.8553, test_loss: 1.2368, test_f1: 0.5330
 epoch: 90, train_loss: 0.8309, test_loss: 1.2264, test_f1: 0.5436
 epoch: 91, train_loss: 0.8279, test_loss: 1.2242, test_f1: 0.5300
 epoch: 92, train_loss: 0.8235, test_loss: 1.2181, test_f1: 0.5511
 epoch: 93, train_loss: 0.8317, test_loss: 1.2272, test_f1: 0.5617
 epoch: 94, train_loss: 0.8166, test_loss: 1.2264, test_f1: 0.5508
 epoch: 95, train_loss: 0.8145, test_loss: 1.2365, test_f1: 0.5432
 epoch: 96, train_loss: 0.8232, test_loss: 1.2264, test_f1: 0.5461
 epoch: 97, train_loss: 0.8123, test_loss: 1.2185, test_f1: 0.5540
 epoch: 98, train_loss: 0.8259, test_loss: 1.2485, test_f1: 0.5406
 epoch: 99, train_loss: 0.8156, test_loss: 1.2263, test_f1: 0.5434
##################ITERATION #3 ****************************************
 epoch: 0, train_loss: 1.2909, test_loss: 1.3337, test_f1: 0.2285
 epoch: 1, train_loss: 1.2358, test_loss: 1.3066, test_f1: 0.2660
 epoch: 2, train_loss: 1.2262, test_loss: 1.2860, test_f1: 0.3278
 epoch: 3, train_loss: 1.1961, test_loss: 1.2688, test_f1: 0.3831
 epoch: 4, train_loss: 1.1763, test_loss: 1.2497, test_f1: 0.3956
 epoch: 5, train_loss: 1.1647, test_loss: 1.2372, test_f1: 0.4119
 epoch: 6, train_loss: 1.1469, test_loss: 1.2247, test_f1: 0.4362
 epoch: 7, train_loss: 1.1365, test_loss: 1.2133, test_f1: 0.4320
 epoch: 8, train_loss: 1.1219, test_loss: 1.2078, test_f1: 0.4570
 epoch: 9, train_loss: 1.1020, test_loss: 1.2007, test_f1: 0.4605
 epoch: 10, train_loss: 1.1016, test_loss: 1.1904, test_f1: 0.4830
 epoch: 11, train_loss: 1.0883, test_loss: 1.1877, test_f1: 0.4863
 epoch: 12, train_loss: 1.0703, test_loss: 1.1853, test_f1: 0.4936
 epoch: 13, train_loss: 1.0628, test_loss: 1.1870, test_f1: 0.4820
 epoch: 14, train_loss: 1.0570, test_loss: 1.1846, test_f1: 0.4869
 epoch: 15, train_loss: 1.0506, test_loss: 1.1876, test_f1: 0.4904
 epoch: 16, train_loss: 1.0391, test_loss: 1.1858, test_f1: 0.5100
 epoch: 17, train_loss: 1.0310, test_loss: 1.1842, test_f1: 0.5041
 epoch: 18, train_loss: 1.0303, test_loss: 1.1801, test_f1: 0.5173
 epoch: 19, train_loss: 1.0179, test_loss: 1.1786, test_f1: 0.5359
 epoch: 20, train_loss: 1.0130, test_loss: 1.1731, test_f1: 0.5442
 epoch: 21, train_loss: 1.0051, test_loss: 1.1769, test_f1: 0.5473
 epoch: 22, train_loss: 1.0080, test_loss: 1.1772, test_f1: 0.5525
 epoch: 23, train_loss: 0.9963, test_loss: 1.1737, test_f1: 0.5422
 epoch: 24, train_loss: 0.9801, test_loss: 1.1686, test_f1: 0.5599
 epoch: 25, train_loss: 0.9764, test_loss: 1.1792, test_f1: 0.5552
 epoch: 26, train_loss: 0.9718, test_loss: 1.1729, test_f1: 0.5640
 epoch: 27, train_loss: 0.9639, test_loss: 1.1714, test_f1: 0.5666
 epoch: 28, train_loss: 0.9563, test_loss: 1.1707, test_f1: 0.5694
 epoch: 29, train_loss: 0.9666, test_loss: 1.1756, test_f1: 0.5545
 epoch: 30, train_loss: 0.9448, test_loss: 1.1834, test_f1: 0.5441
 epoch: 31, train_loss: 0.9448, test_loss: 1.1905, test_f1: 0.5520
 epoch: 32, train_loss: 0.9446, test_loss: 1.1769, test_f1: 0.5563
 epoch: 33, train_loss: 0.9251, test_loss: 1.1796, test_f1: 0.5487
 epoch: 34, train_loss: 0.9129, test_loss: 1.1675, test_f1: 0.5596
 epoch: 35, train_loss: 0.9127, test_loss: 1.1657, test_f1: 0.5671
 epoch: 36, train_loss: 0.9204, test_loss: 1.1691, test_f1: 0.5622
 epoch: 37, train_loss: 0.9072, test_loss: 1.1757, test_f1: 0.5548
 epoch: 38, train_loss: 0.9063, test_loss: 1.1608, test_f1: 0.5678
 epoch: 39, train_loss: 0.8959, test_loss: 1.1697, test_f1: 0.5650
 epoch: 40, train_loss: 0.8976, test_loss: 1.1688, test_f1: 0.5497
 epoch: 41, train_loss: 0.8925, test_loss: 1.1591, test_f1: 0.5401
 epoch: 42, train_loss: 0.8883, test_loss: 1.1875, test_f1: 0.5507
 epoch: 43, train_loss: 0.8843, test_loss: 1.1772, test_f1: 0.5438
 epoch: 44, train_loss: 0.8805, test_loss: 1.1718, test_f1: 0.5574
 epoch: 45, train_loss: 0.8705, test_loss: 1.1649, test_f1: 0.5599
 epoch: 46, train_loss: 0.8598, test_loss: 1.1830, test_f1: 0.5552
 epoch: 47, train_loss: 0.8588, test_loss: 1.1829, test_f1: 0.5580
 epoch: 48, train_loss: 0.8566, test_loss: 1.1959, test_f1: 0.5372
 epoch: 49, train_loss: 0.8522, test_loss: 1.1986, test_f1: 0.5455
 epoch: 50, train_loss: 0.8521, test_loss: 1.1895, test_f1: 0.5629
 epoch: 51, train_loss: 0.8492, test_loss: 1.1784, test_f1: 0.5504
 epoch: 52, train_loss: 0.8220, test_loss: 1.1766, test_f1: 0.5489
 epoch: 53, train_loss: 0.8373, test_loss: 1.1916, test_f1: 0.5652
 epoch: 54, train_loss: 0.8418, test_loss: 1.2008, test_f1: 0.5423
 epoch: 55, train_loss: 0.8325, test_loss: 1.1806, test_f1: 0.5540
 epoch: 56, train_loss: 0.8339, test_loss: 1.1929, test_f1: 0.5473
 epoch: 57, train_loss: 0.8254, test_loss: 1.1814, test_f1: 0.5521
 epoch: 58, train_loss: 0.8354, test_loss: 1.1947, test_f1: 0.5375
 epoch: 59, train_loss: 0.8376, test_loss: 1.1961, test_f1: 0.5396
 epoch: 60, train_loss: 0.8138, test_loss: 1.2046, test_f1: 0.5446
 epoch: 61, train_loss: 0.8223, test_loss: 1.2066, test_f1: 0.5421
 epoch: 62, train_loss: 0.8181, test_loss: 1.1930, test_f1: 0.5374
 epoch: 63, train_loss: 0.8140, test_loss: 1.1995, test_f1: 0.5395
 epoch: 64, train_loss: 0.8157, test_loss: 1.2072, test_f1: 0.5425
 epoch: 65, train_loss: 0.8146, test_loss: 1.2054, test_f1: 0.5464
 epoch: 66, train_loss: 0.8163, test_loss: 1.2112, test_f1: 0.5509
 epoch: 67, train_loss: 0.7984, test_loss: 1.2008, test_f1: 0.5478
 epoch: 68, train_loss: 0.8038, test_loss: 1.1992, test_f1: 0.5599
 epoch: 69, train_loss: 0.8220, test_loss: 1.2112, test_f1: 0.5290
 epoch: 70, train_loss: 0.8011, test_loss: 1.2114, test_f1: 0.5489
 epoch: 71, train_loss: 0.7816, test_loss: 1.2239, test_f1: 0.5367
 epoch: 72, train_loss: 0.7919, test_loss: 1.2202, test_f1: 0.5386
 epoch: 73, train_loss: 0.7976, test_loss: 1.2085, test_f1: 0.5435
 epoch: 74, train_loss: 0.7959, test_loss: 1.2250, test_f1: 0.5395
 epoch: 75, train_loss: 0.7898, test_loss: 1.2146, test_f1: 0.5453
 epoch: 76, train_loss: 0.8018, test_loss: 1.2269, test_f1: 0.5367
 epoch: 77, train_loss: 0.7828, test_loss: 1.2359, test_f1: 0.5545
 epoch: 78, train_loss: 0.7870, test_loss: 1.2214, test_f1: 0.5359
 epoch: 79, train_loss: 0.7755, test_loss: 1.2200, test_f1: 0.5337
 epoch: 80, train_loss: 0.7753, test_loss: 1.2186, test_f1: 0.5451
 epoch: 81, train_loss: 0.7776, test_loss: 1.2487, test_f1: 0.5209
 epoch: 82, train_loss: 0.7770, test_loss: 1.2323, test_f1: 0.5436
 epoch: 83, train_loss: 0.7739, test_loss: 1.2379, test_f1: 0.5359
 epoch: 84, train_loss: 0.7808, test_loss: 1.2354, test_f1: 0.5528
 epoch: 85, train_loss: 0.7691, test_loss: 1.2489, test_f1: 0.5421
 epoch: 86, train_loss: 0.7603, test_loss: 1.2405, test_f1: 0.5470
 epoch: 87, train_loss: 0.7606, test_loss: 1.2242, test_f1: 0.5418
 epoch: 88, train_loss: 0.7597, test_loss: 1.2405, test_f1: 0.5258
 epoch: 89, train_loss: 0.7713, test_loss: 1.2609, test_f1: 0.5314
 epoch: 90, train_loss: 0.7636, test_loss: 1.2414, test_f1: 0.5473
 epoch: 91, train_loss: 0.7594, test_loss: 1.2553, test_f1: 0.5539
 epoch: 92, train_loss: 0.7560, test_loss: 1.2540, test_f1: 0.5437
 epoch: 93, train_loss: 0.7518, test_loss: 1.2685, test_f1: 0.5363
 epoch: 94, train_loss: 0.7497, test_loss: 1.2756, test_f1: 0.5336
 epoch: 95, train_loss: 0.7609, test_loss: 1.2881, test_f1: 0.5368
 epoch: 96, train_loss: 0.7488, test_loss: 1.2725, test_f1: 0.5418
 epoch: 97, train_loss: 0.7600, test_loss: 1.2721, test_f1: 0.5438
 epoch: 98, train_loss: 0.7468, test_loss: 1.2908, test_f1: 0.5375
 epoch: 99, train_loss: 0.7497, test_loss: 1.2984, test_f1: 0.5344
##################ITERATION #4 ****************************************
 epoch: 0, train_loss: 1.3026, test_loss: 1.3485, test_f1: 0.2967
 epoch: 1, train_loss: 1.2486, test_loss: 1.3242, test_f1: 0.3256
 epoch: 2, train_loss: 1.2220, test_loss: 1.3007, test_f1: 0.3507
 epoch: 3, train_loss: 1.1893, test_loss: 1.2934, test_f1: 0.3886
 epoch: 4, train_loss: 1.1772, test_loss: 1.2730, test_f1: 0.4279
 epoch: 5, train_loss: 1.1494, test_loss: 1.2696, test_f1: 0.4361
 epoch: 6, train_loss: 1.1358, test_loss: 1.2536, test_f1: 0.4359
 epoch: 7, train_loss: 1.1232, test_loss: 1.2357, test_f1: 0.4601
 epoch: 8, train_loss: 1.1068, test_loss: 1.2351, test_f1: 0.4617
 epoch: 9, train_loss: 1.0932, test_loss: 1.2051, test_f1: 0.4811
 epoch: 10, train_loss: 1.0711, test_loss: 1.1958, test_f1: 0.5046
 epoch: 11, train_loss: 1.0716, test_loss: 1.1913, test_f1: 0.4952
 epoch: 12, train_loss: 1.0626, test_loss: 1.1838, test_f1: 0.5192
 epoch: 13, train_loss: 1.0512, test_loss: 1.1874, test_f1: 0.5363
 epoch: 14, train_loss: 1.0352, test_loss: 1.1873, test_f1: 0.5387
 epoch: 15, train_loss: 1.0295, test_loss: 1.1880, test_f1: 0.5121
 epoch: 16, train_loss: 1.0196, test_loss: 1.1895, test_f1: 0.5381
 epoch: 17, train_loss: 1.0187, test_loss: 1.1881, test_f1: 0.5125
 epoch: 18, train_loss: 1.0065, test_loss: 1.1875, test_f1: 0.5044
 epoch: 19, train_loss: 1.0086, test_loss: 1.1877, test_f1: 0.5095
 epoch: 20, train_loss: 0.9945, test_loss: 1.1764, test_f1: 0.5327
 epoch: 21, train_loss: 0.9849, test_loss: 1.1810, test_f1: 0.5330
 epoch: 22, train_loss: 0.9743, test_loss: 1.1800, test_f1: 0.5349
 epoch: 23, train_loss: 0.9757, test_loss: 1.1810, test_f1: 0.5352
 epoch: 24, train_loss: 0.9751, test_loss: 1.1837, test_f1: 0.5274
 epoch: 25, train_loss: 0.9530, test_loss: 1.1871, test_f1: 0.5277
 epoch: 26, train_loss: 0.9651, test_loss: 1.1802, test_f1: 0.5404
 epoch: 27, train_loss: 0.9505, test_loss: 1.1678, test_f1: 0.5487
 epoch: 28, train_loss: 0.9461, test_loss: 1.1618, test_f1: 0.5616
 epoch: 29, train_loss: 0.9537, test_loss: 1.1651, test_f1: 0.5544
 epoch: 30, train_loss: 0.9456, test_loss: 1.2057, test_f1: 0.5407
 epoch: 31, train_loss: 0.9330, test_loss: 1.1919, test_f1: 0.5564
 epoch: 32, train_loss: 0.9269, test_loss: 1.1860, test_f1: 0.5571
 epoch: 33, train_loss: 0.9377, test_loss: 1.1926, test_f1: 0.5673
 epoch: 34, train_loss: 0.9249, test_loss: 1.1889, test_f1: 0.5693
 epoch: 35, train_loss: 0.9106, test_loss: 1.1797, test_f1: 0.5726
 epoch: 36, train_loss: 0.9161, test_loss: 1.1727, test_f1: 0.5792
 epoch: 37, train_loss: 0.9186, test_loss: 1.1986, test_f1: 0.5444
 epoch: 38, train_loss: 0.9046, test_loss: 1.1874, test_f1: 0.5798
 epoch: 39, train_loss: 0.8958, test_loss: 1.1861, test_f1: 0.5675
 epoch: 40, train_loss: 0.8930, test_loss: 1.1788, test_f1: 0.5822
 epoch: 41, train_loss: 0.8992, test_loss: 1.2023, test_f1: 0.5754
 epoch: 42, train_loss: 0.9059, test_loss: 1.1923, test_f1: 0.5645
 epoch: 43, train_loss: 0.8926, test_loss: 1.2137, test_f1: 0.5785
 epoch: 44, train_loss: 0.8856, test_loss: 1.2349, test_f1: 0.5751
 epoch: 45, train_loss: 0.8854, test_loss: 1.2214, test_f1: 0.5827
 epoch: 46, train_loss: 0.8732, test_loss: 1.2286, test_f1: 0.5668
 epoch: 47, train_loss: 0.8679, test_loss: 1.2376, test_f1: 0.5902
 epoch: 48, train_loss: 0.8721, test_loss: 1.2670, test_f1: 0.5726
 epoch: 49, train_loss: 0.8598, test_loss: 1.2298, test_f1: 0.5857
 epoch: 50, train_loss: 0.8530, test_loss: 1.2471, test_f1: 0.5824
 epoch: 51, train_loss: 0.8469, test_loss: 1.2445, test_f1: 0.5619
 epoch: 52, train_loss: 0.8560, test_loss: 1.2399, test_f1: 0.5855
 epoch: 53, train_loss: 0.8439, test_loss: 1.2185, test_f1: 0.5873
 epoch: 54, train_loss: 0.8535, test_loss: 1.2471, test_f1: 0.5830
 epoch: 55, train_loss: 0.8442, test_loss: 1.2410, test_f1: 0.5749
 epoch: 56, train_loss: 0.8433, test_loss: 1.2329, test_f1: 0.5699
 epoch: 57, train_loss: 0.8321, test_loss: 1.2224, test_f1: 0.5930
 epoch: 58, train_loss: 0.8381, test_loss: 1.2297, test_f1: 0.5722
 epoch: 59, train_loss: 0.8472, test_loss: 1.2249, test_f1: 0.5777
 epoch: 60, train_loss: 0.8380, test_loss: 1.2575, test_f1: 0.5804
 epoch: 61, train_loss: 0.8377, test_loss: 1.2520, test_f1: 0.5698
 epoch: 62, train_loss: 0.8389, test_loss: 1.2551, test_f1: 0.5699
 epoch: 63, train_loss: 0.8432, test_loss: 1.2416, test_f1: 0.5775
 epoch: 64, train_loss: 0.8223, test_loss: 1.2399, test_f1: 0.5852
 epoch: 65, train_loss: 0.8329, test_loss: 1.2431, test_f1: 0.5802
 epoch: 66, train_loss: 0.8194, test_loss: 1.2311, test_f1: 0.5831
 epoch: 67, train_loss: 0.8346, test_loss: 1.2462, test_f1: 0.5695
 epoch: 68, train_loss: 0.8276, test_loss: 1.2644, test_f1: 0.5779
 epoch: 69, train_loss: 0.8075, test_loss: 1.2684, test_f1: 0.5907
 epoch: 70, train_loss: 0.8067, test_loss: 1.2551, test_f1: 0.5752
 epoch: 71, train_loss: 0.8183, test_loss: 1.2889, test_f1: 0.5698
 epoch: 72, train_loss: 0.8136, test_loss: 1.2838, test_f1: 0.5545
 epoch: 73, train_loss: 0.8166, test_loss: 1.2591, test_f1: 0.5728
 epoch: 74, train_loss: 0.8130, test_loss: 1.2798, test_f1: 0.5699
 epoch: 75, train_loss: 0.8171, test_loss: 1.2825, test_f1: 0.5756
 epoch: 76, train_loss: 0.8007, test_loss: 1.2879, test_f1: 0.5803
 epoch: 77, train_loss: 0.8104, test_loss: 1.2601, test_f1: 0.5647
 epoch: 78, train_loss: 0.8074, test_loss: 1.2704, test_f1: 0.5864
 epoch: 79, train_loss: 0.8091, test_loss: 1.2695, test_f1: 0.5698
 epoch: 80, train_loss: 0.7889, test_loss: 1.2878, test_f1: 0.5752
 epoch: 81, train_loss: 0.8026, test_loss: 1.2771, test_f1: 0.5697
 epoch: 82, train_loss: 0.7910, test_loss: 1.2571, test_f1: 0.5803
 epoch: 83, train_loss: 0.8016, test_loss: 1.2674, test_f1: 0.5721
 epoch: 84, train_loss: 0.7972, test_loss: 1.2562, test_f1: 0.5671
 epoch: 85, train_loss: 0.7872, test_loss: 1.2673, test_f1: 0.5756
 epoch: 86, train_loss: 0.7795, test_loss: 1.2702, test_f1: 0.5725
 epoch: 87, train_loss: 0.7820, test_loss: 1.2830, test_f1: 0.5786
 epoch: 88, train_loss: 0.7924, test_loss: 1.2759, test_f1: 0.5813
 epoch: 89, train_loss: 0.7744, test_loss: 1.2731, test_f1: 0.5784
 epoch: 90, train_loss: 0.7890, test_loss: 1.2841, test_f1: 0.5698
 epoch: 91, train_loss: 0.7937, test_loss: 1.2661, test_f1: 0.5702
 epoch: 92, train_loss: 0.7795, test_loss: 1.2887, test_f1: 0.5684
 epoch: 93, train_loss: 0.7743, test_loss: 1.3021, test_f1: 0.5595
 epoch: 94, train_loss: 0.7825, test_loss: 1.2811, test_f1: 0.5785
 epoch: 95, train_loss: 0.7743, test_loss: 1.2924, test_f1: 0.5705
 epoch: 96, train_loss: 0.7718, test_loss: 1.2909, test_f1: 0.5807
 epoch: 97, train_loss: 0.7794, test_loss: 1.2854, test_f1: 0.5698
 epoch: 98, train_loss: 0.7789, test_loss: 1.3127, test_f1: 0.5752
 epoch: 99, train_loss: 0.7758, test_loss: 1.3035, test_f1: 0.5754
##################ITERATION #5 ****************************************
 epoch: 0, train_loss: 1.3147, test_loss: 1.3485, test_f1: 0.2418
 epoch: 1, train_loss: 1.2452, test_loss: 1.3268, test_f1: 0.2856
 epoch: 2, train_loss: 1.2198, test_loss: 1.2850, test_f1: 0.3695
 epoch: 3, train_loss: 1.1869, test_loss: 1.2697, test_f1: 0.4135
 epoch: 4, train_loss: 1.1832, test_loss: 1.2515, test_f1: 0.4337
 epoch: 5, train_loss: 1.1521, test_loss: 1.2346, test_f1: 0.4465
 epoch: 6, train_loss: 1.1428, test_loss: 1.2248, test_f1: 0.4451
 epoch: 7, train_loss: 1.1262, test_loss: 1.2147, test_f1: 0.4671
 epoch: 8, train_loss: 1.1109, test_loss: 1.2001, test_f1: 0.4237
 epoch: 9, train_loss: 1.1089, test_loss: 1.1993, test_f1: 0.4201
 epoch: 10, train_loss: 1.0830, test_loss: 1.1816, test_f1: 0.4396
 epoch: 11, train_loss: 1.0673, test_loss: 1.1710, test_f1: 0.4600
 epoch: 12, train_loss: 1.0584, test_loss: 1.1649, test_f1: 0.4639
 epoch: 13, train_loss: 1.0500, test_loss: 1.1782, test_f1: 0.4769
 epoch: 14, train_loss: 1.0384, test_loss: 1.1719, test_f1: 0.4776
 epoch: 15, train_loss: 1.0386, test_loss: 1.1719, test_f1: 0.4598
 epoch: 16, train_loss: 1.0241, test_loss: 1.1730, test_f1: 0.4992
 epoch: 17, train_loss: 1.0168, test_loss: 1.1746, test_f1: 0.4779
 epoch: 18, train_loss: 1.0076, test_loss: 1.1615, test_f1: 0.4950
 epoch: 19, train_loss: 1.0154, test_loss: 1.1613, test_f1: 0.4909
 epoch: 20, train_loss: 1.0005, test_loss: 1.1613, test_f1: 0.5056
 epoch: 21, train_loss: 0.9916, test_loss: 1.1663, test_f1: 0.4959
 epoch: 22, train_loss: 0.9872, test_loss: 1.1626, test_f1: 0.5123
 epoch: 23, train_loss: 0.9771, test_loss: 1.1807, test_f1: 0.4728
 epoch: 24, train_loss: 0.9561, test_loss: 1.1644, test_f1: 0.5140
 epoch: 25, train_loss: 0.9768, test_loss: 1.1622, test_f1: 0.5249
 epoch: 26, train_loss: 0.9636, test_loss: 1.1660, test_f1: 0.4949
 epoch: 27, train_loss: 0.9858, test_loss: 1.1559, test_f1: 0.5035
 epoch: 28, train_loss: 0.9604, test_loss: 1.1550, test_f1: 0.4944
 epoch: 29, train_loss: 0.9446, test_loss: 1.1672, test_f1: 0.4899
 epoch: 30, train_loss: 0.9401, test_loss: 1.1663, test_f1: 0.4953
 epoch: 31, train_loss: 0.9395, test_loss: 1.1824, test_f1: 0.4913
 epoch: 32, train_loss: 0.9271, test_loss: 1.1859, test_f1: 0.5025
 epoch: 33, train_loss: 0.9320, test_loss: 1.1633, test_f1: 0.5049
 epoch: 34, train_loss: 0.9287, test_loss: 1.1427, test_f1: 0.5202
 epoch: 35, train_loss: 0.9290, test_loss: 1.1533, test_f1: 0.5084
 epoch: 36, train_loss: 0.9221, test_loss: 1.1810, test_f1: 0.5145
 epoch: 37, train_loss: 0.9072, test_loss: 1.1414, test_f1: 0.5366
 epoch: 38, train_loss: 0.9071, test_loss: 1.1697, test_f1: 0.5135
 epoch: 39, train_loss: 0.9088, test_loss: 1.1567, test_f1: 0.5107
 epoch: 40, train_loss: 0.9134, test_loss: 1.1659, test_f1: 0.5281
 epoch: 41, train_loss: 0.8909, test_loss: 1.1691, test_f1: 0.4811
 epoch: 42, train_loss: 0.8862, test_loss: 1.1810, test_f1: 0.4894
 epoch: 43, train_loss: 0.8952, test_loss: 1.1534, test_f1: 0.4953
 epoch: 44, train_loss: 0.8803, test_loss: 1.1502, test_f1: 0.5026
 epoch: 45, train_loss: 0.8853, test_loss: 1.1347, test_f1: 0.5142
 epoch: 46, train_loss: 0.8823, test_loss: 1.1514, test_f1: 0.5218
 epoch: 47, train_loss: 0.8661, test_loss: 1.1821, test_f1: 0.5315
 epoch: 48, train_loss: 0.8661, test_loss: 1.1466, test_f1: 0.5350
 epoch: 49, train_loss: 0.8608, test_loss: 1.2008, test_f1: 0.5305
 epoch: 50, train_loss: 0.8636, test_loss: 1.1555, test_f1: 0.5432
 epoch: 51, train_loss: 0.8606, test_loss: 1.1637, test_f1: 0.5460
 epoch: 52, train_loss: 0.8499, test_loss: 1.1714, test_f1: 0.5333
 epoch: 53, train_loss: 0.8499, test_loss: 1.1726, test_f1: 0.5461
 epoch: 54, train_loss: 0.8419, test_loss: 1.1711, test_f1: 0.5403
 epoch: 55, train_loss: 0.8584, test_loss: 1.1733, test_f1: 0.5509
 epoch: 56, train_loss: 0.8317, test_loss: 1.2027, test_f1: 0.5243
 epoch: 57, train_loss: 0.8488, test_loss: 1.1871, test_f1: 0.5292
 epoch: 58, train_loss: 0.8299, test_loss: 1.1542, test_f1: 0.5562
 epoch: 59, train_loss: 0.8491, test_loss: 1.1659, test_f1: 0.5506
 epoch: 60, train_loss: 0.8423, test_loss: 1.2016, test_f1: 0.5486
 epoch: 61, train_loss: 0.8338, test_loss: 1.1695, test_f1: 0.5535
 epoch: 62, train_loss: 0.8229, test_loss: 1.1939, test_f1: 0.5274
 epoch: 63, train_loss: 0.8354, test_loss: 1.2222, test_f1: 0.5426
 epoch: 64, train_loss: 0.8225, test_loss: 1.2510, test_f1: 0.5355
 epoch: 65, train_loss: 0.8309, test_loss: 1.2344, test_f1: 0.5385
 epoch: 66, train_loss: 0.8411, test_loss: 1.2213, test_f1: 0.5405
 epoch: 67, train_loss: 0.8293, test_loss: 1.2224, test_f1: 0.5586
 epoch: 68, train_loss: 0.8178, test_loss: 1.2186, test_f1: 0.5354
 epoch: 69, train_loss: 0.8151, test_loss: 1.2498, test_f1: 0.5546
 epoch: 70, train_loss: 0.8138, test_loss: 1.2377, test_f1: 0.5488
 epoch: 71, train_loss: 0.8288, test_loss: 1.2506, test_f1: 0.5485
 epoch: 72, train_loss: 0.8264, test_loss: 1.2449, test_f1: 0.5536
 epoch: 73, train_loss: 0.8165, test_loss: 1.2269, test_f1: 0.5490
 epoch: 74, train_loss: 0.8169, test_loss: 1.2286, test_f1: 0.5463
 epoch: 75, train_loss: 0.8067, test_loss: 1.2108, test_f1: 0.5483
 epoch: 76, train_loss: 0.8074, test_loss: 1.1911, test_f1: 0.5434
 epoch: 77, train_loss: 0.7940, test_loss: 1.2204, test_f1: 0.5599
 epoch: 78, train_loss: 0.8081, test_loss: 1.2255, test_f1: 0.5485
 epoch: 79, train_loss: 0.8148, test_loss: 1.2253, test_f1: 0.5483
 epoch: 80, train_loss: 0.7975, test_loss: 1.2170, test_f1: 0.5537
 epoch: 81, train_loss: 0.7934, test_loss: 1.2785, test_f1: 0.5726
 epoch: 82, train_loss: 0.8011, test_loss: 1.2277, test_f1: 0.5617
 epoch: 83, train_loss: 0.7965, test_loss: 1.2315, test_f1: 0.5556
 epoch: 84, train_loss: 0.7980, test_loss: 1.2335, test_f1: 0.5675
 epoch: 85, train_loss: 0.8043, test_loss: 1.3075, test_f1: 0.5697
 epoch: 86, train_loss: 0.7936, test_loss: 1.2183, test_f1: 0.5543
 epoch: 87, train_loss: 0.7865, test_loss: 1.3057, test_f1: 0.5649
 epoch: 88, train_loss: 0.7846, test_loss: 1.3211, test_f1: 0.5746
 epoch: 89, train_loss: 0.7826, test_loss: 1.3013, test_f1: 0.5515
 epoch: 90, train_loss: 0.7708, test_loss: 1.2245, test_f1: 0.5485
 epoch: 91, train_loss: 0.7757, test_loss: 1.2770, test_f1: 0.5718
 epoch: 92, train_loss: 0.7817, test_loss: 1.3165, test_f1: 0.5675
 epoch: 93, train_loss: 0.7828, test_loss: 1.2390, test_f1: 0.5597
 epoch: 94, train_loss: 0.7913, test_loss: 1.2956, test_f1: 0.5590
 epoch: 95, train_loss: 0.7759, test_loss: 1.3053, test_f1: 0.5641
 epoch: 96, train_loss: 0.7841, test_loss: 1.2452, test_f1: 0.5590
 epoch: 97, train_loss: 0.7827, test_loss: 1.2582, test_f1: 0.5513
 epoch: 98, train_loss: 0.7879, test_loss: 1.2439, test_f1: 0.5519
 epoch: 99, train_loss: 0.7826, test_loss: 1.2918, test_f1: 0.5513
##################ITERATION #6 ****************************************
 epoch: 0, train_loss: 1.2951, test_loss: 1.3343, test_f1: 0.2556
 epoch: 1, train_loss: 1.2367, test_loss: 1.3036, test_f1: 0.2979
 epoch: 2, train_loss: 1.2016, test_loss: 1.2905, test_f1: 0.3547
 epoch: 3, train_loss: 1.1889, test_loss: 1.2744, test_f1: 0.3685
 epoch: 4, train_loss: 1.1729, test_loss: 1.2608, test_f1: 0.3870
 epoch: 5, train_loss: 1.1621, test_loss: 1.2484, test_f1: 0.4001
 epoch: 6, train_loss: 1.1442, test_loss: 1.2400, test_f1: 0.3958
 epoch: 7, train_loss: 1.1436, test_loss: 1.2209, test_f1: 0.4034
 epoch: 8, train_loss: 1.1165, test_loss: 1.2093, test_f1: 0.4109
 epoch: 9, train_loss: 1.1183, test_loss: 1.2041, test_f1: 0.4395
 epoch: 10, train_loss: 1.1012, test_loss: 1.1953, test_f1: 0.4571
 epoch: 11, train_loss: 1.0931, test_loss: 1.1929, test_f1: 0.4897
 epoch: 12, train_loss: 1.0636, test_loss: 1.1846, test_f1: 0.4889
 epoch: 13, train_loss: 1.0783, test_loss: 1.1697, test_f1: 0.4839
 epoch: 14, train_loss: 1.0534, test_loss: 1.1699, test_f1: 0.5019
 epoch: 15, train_loss: 1.0444, test_loss: 1.1577, test_f1: 0.5026
 epoch: 16, train_loss: 1.0341, test_loss: 1.1572, test_f1: 0.5047
 epoch: 17, train_loss: 1.0360, test_loss: 1.1564, test_f1: 0.5167
 epoch: 18, train_loss: 1.0229, test_loss: 1.1431, test_f1: 0.5126
 epoch: 19, train_loss: 1.0214, test_loss: 1.1406, test_f1: 0.5158
 epoch: 20, train_loss: 1.0117, test_loss: 1.1439, test_f1: 0.5024
 epoch: 21, train_loss: 0.9909, test_loss: 1.1408, test_f1: 0.5053
 epoch: 22, train_loss: 0.9953, test_loss: 1.1379, test_f1: 0.5126
 epoch: 23, train_loss: 1.0010, test_loss: 1.1330, test_f1: 0.5012
 epoch: 24, train_loss: 0.9847, test_loss: 1.1309, test_f1: 0.4811
 epoch: 25, train_loss: 0.9794, test_loss: 1.1281, test_f1: 0.4988
 epoch: 26, train_loss: 0.9685, test_loss: 1.1201, test_f1: 0.5269
 epoch: 27, train_loss: 0.9595, test_loss: 1.1156, test_f1: 0.5212
 epoch: 28, train_loss: 0.9528, test_loss: 1.1203, test_f1: 0.5145
 epoch: 29, train_loss: 0.9470, test_loss: 1.1250, test_f1: 0.4807
 epoch: 30, train_loss: 0.9446, test_loss: 1.1229, test_f1: 0.4876
 epoch: 31, train_loss: 0.9392, test_loss: 1.1091, test_f1: 0.5068
 epoch: 32, train_loss: 0.9354, test_loss: 1.1199, test_f1: 0.4961
 epoch: 33, train_loss: 0.9404, test_loss: 1.1342, test_f1: 0.4902
 epoch: 34, train_loss: 0.9427, test_loss: 1.1412, test_f1: 0.5070
 epoch: 35, train_loss: 0.9327, test_loss: 1.1244, test_f1: 0.4985
 epoch: 36, train_loss: 0.9301, test_loss: 1.1329, test_f1: 0.5020
 epoch: 37, train_loss: 0.9116, test_loss: 1.1465, test_f1: 0.5079
 epoch: 38, train_loss: 0.9181, test_loss: 1.1381, test_f1: 0.4949
 epoch: 39, train_loss: 0.9093, test_loss: 1.1728, test_f1: 0.4869
 epoch: 40, train_loss: 0.9021, test_loss: 1.1660, test_f1: 0.5104
 epoch: 41, train_loss: 0.8924, test_loss: 1.1531, test_f1: 0.5049
 epoch: 42, train_loss: 0.9083, test_loss: 1.1598, test_f1: 0.5104
 epoch: 43, train_loss: 0.8943, test_loss: 1.1684, test_f1: 0.5104
 epoch: 44, train_loss: 0.8831, test_loss: 1.1541, test_f1: 0.5304
 epoch: 45, train_loss: 0.8791, test_loss: 1.1671, test_f1: 0.5042
 epoch: 46, train_loss: 0.8785, test_loss: 1.1598, test_f1: 0.5194
 epoch: 47, train_loss: 0.8758, test_loss: 1.1791, test_f1: 0.5167
 epoch: 48, train_loss: 0.8674, test_loss: 1.1619, test_f1: 0.5283
 epoch: 49, train_loss: 0.8659, test_loss: 1.1703, test_f1: 0.5235
 epoch: 50, train_loss: 0.8699, test_loss: 1.1693, test_f1: 0.5441
 epoch: 51, train_loss: 0.8511, test_loss: 1.1813, test_f1: 0.5340
 epoch: 52, train_loss: 0.8479, test_loss: 1.1686, test_f1: 0.5307
 epoch: 53, train_loss: 0.8386, test_loss: 1.1813, test_f1: 0.5191
 epoch: 54, train_loss: 0.8595, test_loss: 1.1782, test_f1: 0.5323
 epoch: 55, train_loss: 0.8433, test_loss: 1.1674, test_f1: 0.5234
 epoch: 56, train_loss: 0.8320, test_loss: 1.1740, test_f1: 0.5252
 epoch: 57, train_loss: 0.8429, test_loss: 1.1779, test_f1: 0.5582
 epoch: 58, train_loss: 0.8332, test_loss: 1.1810, test_f1: 0.5253
 epoch: 59, train_loss: 0.8356, test_loss: 1.1754, test_f1: 0.5595
 epoch: 60, train_loss: 0.8334, test_loss: 1.1952, test_f1: 0.5381
 epoch: 61, train_loss: 0.8362, test_loss: 1.1738, test_f1: 0.5540
 epoch: 62, train_loss: 0.8417, test_loss: 1.2082, test_f1: 0.5517
 epoch: 63, train_loss: 0.8317, test_loss: 1.1839, test_f1: 0.5456
 epoch: 64, train_loss: 0.8387, test_loss: 1.2137, test_f1: 0.5246
 epoch: 65, train_loss: 0.8207, test_loss: 1.1914, test_f1: 0.5479
 epoch: 66, train_loss: 0.8295, test_loss: 1.2369, test_f1: 0.5351
 epoch: 67, train_loss: 0.8391, test_loss: 1.2307, test_f1: 0.5592
 epoch: 68, train_loss: 0.8157, test_loss: 1.1972, test_f1: 0.5585
 epoch: 69, train_loss: 0.8198, test_loss: 1.1927, test_f1: 0.5542
 epoch: 70, train_loss: 0.8285, test_loss: 1.2024, test_f1: 0.5562
 epoch: 71, train_loss: 0.8262, test_loss: 1.1949, test_f1: 0.5448
 epoch: 72, train_loss: 0.8238, test_loss: 1.2139, test_f1: 0.5483
 epoch: 73, train_loss: 0.8136, test_loss: 1.2175, test_f1: 0.5589
 epoch: 74, train_loss: 0.8103, test_loss: 1.2399, test_f1: 0.5515
 epoch: 75, train_loss: 0.8280, test_loss: 1.2066, test_f1: 0.5594
 epoch: 76, train_loss: 0.8162, test_loss: 1.2349, test_f1: 0.5571
 epoch: 77, train_loss: 0.8108, test_loss: 1.1897, test_f1: 0.5582
 epoch: 78, train_loss: 0.8205, test_loss: 1.2141, test_f1: 0.5562
 epoch: 79, train_loss: 0.8097, test_loss: 1.2251, test_f1: 0.5562
 epoch: 80, train_loss: 0.8067, test_loss: 1.2444, test_f1: 0.5534
 epoch: 81, train_loss: 0.8071, test_loss: 1.2179, test_f1: 0.5638
 epoch: 82, train_loss: 0.8022, test_loss: 1.2176, test_f1: 0.5640
 epoch: 83, train_loss: 0.8012, test_loss: 1.1941, test_f1: 0.5627
 epoch: 84, train_loss: 0.8012, test_loss: 1.2197, test_f1: 0.5591
 epoch: 85, train_loss: 0.8027, test_loss: 1.2073, test_f1: 0.5720
 epoch: 86, train_loss: 0.7840, test_loss: 1.2123, test_f1: 0.5644
 epoch: 87, train_loss: 0.7980, test_loss: 1.2113, test_f1: 0.5665
 epoch: 88, train_loss: 0.7901, test_loss: 1.2218, test_f1: 0.5589
 epoch: 89, train_loss: 0.7921, test_loss: 1.2347, test_f1: 0.5585
 epoch: 90, train_loss: 0.7896, test_loss: 1.2452, test_f1: 0.5637
 epoch: 91, train_loss: 0.7937, test_loss: 1.2555, test_f1: 0.5745
 epoch: 92, train_loss: 0.7976, test_loss: 1.2601, test_f1: 0.5618
 epoch: 93, train_loss: 0.7804, test_loss: 1.2425, test_f1: 0.5590
 epoch: 94, train_loss: 0.7744, test_loss: 1.2601, test_f1: 0.5777
 epoch: 95, train_loss: 0.7858, test_loss: 1.2362, test_f1: 0.5719
 epoch: 96, train_loss: 0.7744, test_loss: 1.2441, test_f1: 0.5687
 epoch: 97, train_loss: 0.7802, test_loss: 1.2098, test_f1: 0.5764
 epoch: 98, train_loss: 0.7812, test_loss: 1.2557, test_f1: 0.5786
 epoch: 99, train_loss: 0.7830, test_loss: 1.2451, test_f1: 0.5779
##################ITERATION #7 ****************************************
 epoch: 0, train_loss: 1.3066, test_loss: 1.3743, test_f1: 0.2868
 epoch: 1, train_loss: 1.2431, test_loss: 1.3217, test_f1: 0.3246
 epoch: 2, train_loss: 1.2005, test_loss: 1.2931, test_f1: 0.3591
 epoch: 3, train_loss: 1.1977, test_loss: 1.2660, test_f1: 0.3823
 epoch: 4, train_loss: 1.1786, test_loss: 1.2434, test_f1: 0.3871
 epoch: 5, train_loss: 1.1633, test_loss: 1.2377, test_f1: 0.3807
 epoch: 6, train_loss: 1.1472, test_loss: 1.2207, test_f1: 0.3926
 epoch: 7, train_loss: 1.1260, test_loss: 1.2162, test_f1: 0.3909
 epoch: 8, train_loss: 1.1344, test_loss: 1.1985, test_f1: 0.3975
 epoch: 9, train_loss: 1.1231, test_loss: 1.1931, test_f1: 0.3979
 epoch: 10, train_loss: 1.1090, test_loss: 1.1920, test_f1: 0.4189
 epoch: 11, train_loss: 1.0931, test_loss: 1.1789, test_f1: 0.4205
 epoch: 12, train_loss: 1.0852, test_loss: 1.1690, test_f1: 0.4210
 epoch: 13, train_loss: 1.0854, test_loss: 1.1634, test_f1: 0.4364
 epoch: 14, train_loss: 1.0615, test_loss: 1.1563, test_f1: 0.4292
 epoch: 15, train_loss: 1.0641, test_loss: 1.1506, test_f1: 0.4495
 epoch: 16, train_loss: 1.0535, test_loss: 1.1518, test_f1: 0.4640
 epoch: 17, train_loss: 1.0492, test_loss: 1.1445, test_f1: 0.4745
 epoch: 18, train_loss: 1.0401, test_loss: 1.1450, test_f1: 0.4754
 epoch: 19, train_loss: 1.0094, test_loss: 1.1458, test_f1: 0.4773
 epoch: 20, train_loss: 1.0092, test_loss: 1.1467, test_f1: 0.4825
 epoch: 21, train_loss: 1.0008, test_loss: 1.1368, test_f1: 0.4835
 epoch: 22, train_loss: 1.0220, test_loss: 1.1341, test_f1: 0.4810
 epoch: 23, train_loss: 0.9951, test_loss: 1.1375, test_f1: 0.4893
 epoch: 24, train_loss: 1.0053, test_loss: 1.1361, test_f1: 0.4967
 epoch: 25, train_loss: 0.9917, test_loss: 1.1172, test_f1: 0.4893
 epoch: 26, train_loss: 0.9624, test_loss: 1.1343, test_f1: 0.4814
 epoch: 27, train_loss: 0.9743, test_loss: 1.1207, test_f1: 0.4825
 epoch: 28, train_loss: 0.9639, test_loss: 1.1295, test_f1: 0.4913
 epoch: 29, train_loss: 0.9611, test_loss: 1.1199, test_f1: 0.5081
 epoch: 30, train_loss: 0.9480, test_loss: 1.1163, test_f1: 0.4998
 epoch: 31, train_loss: 0.9606, test_loss: 1.1267, test_f1: 0.5014
 epoch: 32, train_loss: 0.9490, test_loss: 1.1107, test_f1: 0.5056
 epoch: 33, train_loss: 0.9257, test_loss: 1.1183, test_f1: 0.4893
 epoch: 34, train_loss: 0.9255, test_loss: 1.1294, test_f1: 0.5017
 epoch: 35, train_loss: 0.9063, test_loss: 1.1191, test_f1: 0.5017
 epoch: 36, train_loss: 0.9350, test_loss: 1.1157, test_f1: 0.4943
 epoch: 37, train_loss: 0.9207, test_loss: 1.1249, test_f1: 0.5037
 epoch: 38, train_loss: 0.9225, test_loss: 1.1105, test_f1: 0.5064
 epoch: 39, train_loss: 0.8998, test_loss: 1.1287, test_f1: 0.4782
 epoch: 40, train_loss: 0.9197, test_loss: 1.1006, test_f1: 0.5365
 epoch: 41, train_loss: 0.9048, test_loss: 1.1291, test_f1: 0.5146
 epoch: 42, train_loss: 0.8933, test_loss: 1.1041, test_f1: 0.5204
 epoch: 43, train_loss: 0.8856, test_loss: 1.1147, test_f1: 0.5361
 epoch: 44, train_loss: 0.8919, test_loss: 1.1157, test_f1: 0.5301
 epoch: 45, train_loss: 0.8777, test_loss: 1.1210, test_f1: 0.5379
 epoch: 46, train_loss: 0.8830, test_loss: 1.1020, test_f1: 0.5333
 epoch: 47, train_loss: 0.8736, test_loss: 1.1205, test_f1: 0.5256
 epoch: 48, train_loss: 0.8672, test_loss: 1.1131, test_f1: 0.5188
 epoch: 49, train_loss: 0.8616, test_loss: 1.1122, test_f1: 0.5395
 epoch: 50, train_loss: 0.8743, test_loss: 1.1356, test_f1: 0.5237
 epoch: 51, train_loss: 0.8630, test_loss: 1.1092, test_f1: 0.5562
 epoch: 52, train_loss: 0.8563, test_loss: 1.1180, test_f1: 0.5425
 epoch: 53, train_loss: 0.8530, test_loss: 1.1213, test_f1: 0.5445
 epoch: 54, train_loss: 0.8556, test_loss: 1.1243, test_f1: 0.5295
 epoch: 55, train_loss: 0.8489, test_loss: 1.1130, test_f1: 0.5578
 epoch: 56, train_loss: 0.8609, test_loss: 1.1303, test_f1: 0.5380
 epoch: 57, train_loss: 0.8507, test_loss: 1.1175, test_f1: 0.5569
 epoch: 58, train_loss: 0.8545, test_loss: 1.1215, test_f1: 0.5515
 epoch: 59, train_loss: 0.8484, test_loss: 1.1207, test_f1: 0.5513
 epoch: 60, train_loss: 0.8497, test_loss: 1.1337, test_f1: 0.5456
 epoch: 61, train_loss: 0.8363, test_loss: 1.1482, test_f1: 0.5410
 epoch: 62, train_loss: 0.8413, test_loss: 1.1320, test_f1: 0.5568
 epoch: 63, train_loss: 0.8406, test_loss: 1.1235, test_f1: 0.5535
 epoch: 64, train_loss: 0.8481, test_loss: 1.1228, test_f1: 0.5662
 epoch: 65, train_loss: 0.8473, test_loss: 1.1306, test_f1: 0.5536
 epoch: 66, train_loss: 0.8367, test_loss: 1.1330, test_f1: 0.5536
 epoch: 67, train_loss: 0.8281, test_loss: 1.1332, test_f1: 0.5531
 epoch: 68, train_loss: 0.8210, test_loss: 1.1270, test_f1: 0.5659
 epoch: 69, train_loss: 0.8305, test_loss: 1.1416, test_f1: 0.5628
 epoch: 70, train_loss: 0.8258, test_loss: 1.1397, test_f1: 0.5544
 epoch: 71, train_loss: 0.8230, test_loss: 1.1373, test_f1: 0.5761
 epoch: 72, train_loss: 0.8377, test_loss: 1.1415, test_f1: 0.5728
 epoch: 73, train_loss: 0.8206, test_loss: 1.1236, test_f1: 0.5892
 epoch: 74, train_loss: 0.8201, test_loss: 1.1417, test_f1: 0.5807
 epoch: 75, train_loss: 0.8251, test_loss: 1.1409, test_f1: 0.5601
 epoch: 76, train_loss: 0.8210, test_loss: 1.1343, test_f1: 0.5841
 epoch: 77, train_loss: 0.8170, test_loss: 1.1316, test_f1: 0.5836
 epoch: 78, train_loss: 0.8252, test_loss: 1.1329, test_f1: 0.5634
 epoch: 79, train_loss: 0.8192, test_loss: 1.1480, test_f1: 0.5782
 epoch: 80, train_loss: 0.8092, test_loss: 1.1444, test_f1: 0.5734
 epoch: 81, train_loss: 0.8127, test_loss: 1.1500, test_f1: 0.5738
 epoch: 82, train_loss: 0.8085, test_loss: 1.1444, test_f1: 0.5652
 epoch: 83, train_loss: 0.8158, test_loss: 1.1435, test_f1: 0.5731
 epoch: 84, train_loss: 0.8154, test_loss: 1.1240, test_f1: 0.6075
 epoch: 85, train_loss: 0.8151, test_loss: 1.1439, test_f1: 0.5704
 epoch: 86, train_loss: 0.7985, test_loss: 1.1377, test_f1: 0.5942
 epoch: 87, train_loss: 0.8114, test_loss: 1.1598, test_f1: 0.5616
 epoch: 88, train_loss: 0.7909, test_loss: 1.1539, test_f1: 0.5621
 epoch: 89, train_loss: 0.8003, test_loss: 1.1688, test_f1: 0.5861
 epoch: 90, train_loss: 0.7810, test_loss: 1.1521, test_f1: 0.5732
 epoch: 91, train_loss: 0.7978, test_loss: 1.1566, test_f1: 0.5701
 epoch: 92, train_loss: 0.7906, test_loss: 1.1647, test_f1: 0.6020
 epoch: 93, train_loss: 0.7887, test_loss: 1.1638, test_f1: 0.5863
 epoch: 94, train_loss: 0.7867, test_loss: 1.1660, test_f1: 0.5733
 epoch: 95, train_loss: 0.7992, test_loss: 1.1494, test_f1: 0.5733
 epoch: 96, train_loss: 0.7960, test_loss: 1.1508, test_f1: 0.5837
 epoch: 97, train_loss: 0.7786, test_loss: 1.1629, test_f1: 0.5914
 epoch: 98, train_loss: 0.7667, test_loss: 1.1610, test_f1: 0.5840
 epoch: 99, train_loss: 0.8004, test_loss: 1.1785, test_f1: 0.5703
##################ITERATION #8 ****************************************
 epoch: 0, train_loss: 1.3080, test_loss: 1.3307, test_f1: 0.2588
 epoch: 1, train_loss: 1.2536, test_loss: 1.2930, test_f1: 0.2938
 epoch: 2, train_loss: 1.2283, test_loss: 1.2802, test_f1: 0.3526
 epoch: 3, train_loss: 1.2104, test_loss: 1.2608, test_f1: 0.3331
 epoch: 4, train_loss: 1.1809, test_loss: 1.2606, test_f1: 0.3757
 epoch: 5, train_loss: 1.1847, test_loss: 1.2485, test_f1: 0.3775
 epoch: 6, train_loss: 1.1710, test_loss: 1.2612, test_f1: 0.4025
 epoch: 7, train_loss: 1.1514, test_loss: 1.2464, test_f1: 0.4068
 epoch: 8, train_loss: 1.1405, test_loss: 1.2351, test_f1: 0.4112
 epoch: 9, train_loss: 1.1328, test_loss: 1.2314, test_f1: 0.4389
 epoch: 10, train_loss: 1.1238, test_loss: 1.2455, test_f1: 0.4781
 epoch: 11, train_loss: 1.1140, test_loss: 1.2175, test_f1: 0.4717
 epoch: 12, train_loss: 1.0947, test_loss: 1.2272, test_f1: 0.4735
 epoch: 13, train_loss: 1.0818, test_loss: 1.2271, test_f1: 0.5054
 epoch: 14, train_loss: 1.0773, test_loss: 1.2237, test_f1: 0.5034
 epoch: 15, train_loss: 1.0671, test_loss: 1.2180, test_f1: 0.5112
 epoch: 16, train_loss: 1.0572, test_loss: 1.2036, test_f1: 0.4912
 epoch: 17, train_loss: 1.0529, test_loss: 1.1986, test_f1: 0.4910
 epoch: 18, train_loss: 1.0450, test_loss: 1.2385, test_f1: 0.5081
 epoch: 19, train_loss: 1.0282, test_loss: 1.2703, test_f1: 0.4940
 epoch: 20, train_loss: 1.0216, test_loss: 1.2705, test_f1: 0.5003
 epoch: 21, train_loss: 1.0129, test_loss: 1.2635, test_f1: 0.4867
 epoch: 22, train_loss: 1.0084, test_loss: 1.2674, test_f1: 0.4959
 epoch: 23, train_loss: 1.0009, test_loss: 1.2719, test_f1: 0.4852
 epoch: 24, train_loss: 0.9967, test_loss: 1.2600, test_f1: 0.4956
 epoch: 25, train_loss: 0.9819, test_loss: 1.2502, test_f1: 0.5154
 epoch: 26, train_loss: 0.9811, test_loss: 1.2578, test_f1: 0.5232
 epoch: 27, train_loss: 0.9609, test_loss: 1.2844, test_f1: 0.5371
 epoch: 28, train_loss: 0.9594, test_loss: 1.3027, test_f1: 0.5399
 epoch: 29, train_loss: 0.9512, test_loss: 1.3478, test_f1: 0.5372
 epoch: 30, train_loss: 0.9559, test_loss: 1.3168, test_f1: 0.5219
 epoch: 31, train_loss: 0.9507, test_loss: 1.2942, test_f1: 0.5340
 epoch: 32, train_loss: 0.9576, test_loss: 1.2962, test_f1: 0.5294
 epoch: 33, train_loss: 0.9433, test_loss: 1.3035, test_f1: 0.5510
 epoch: 34, train_loss: 0.9170, test_loss: 1.3162, test_f1: 0.5477
 epoch: 35, train_loss: 0.9247, test_loss: 1.3201, test_f1: 0.5304
 epoch: 36, train_loss: 0.9078, test_loss: 1.3070, test_f1: 0.5277
 epoch: 37, train_loss: 0.9075, test_loss: 1.2957, test_f1: 0.5372
 epoch: 38, train_loss: 0.9089, test_loss: 1.2864, test_f1: 0.5408
 epoch: 39, train_loss: 0.8917, test_loss: 1.2980, test_f1: 0.5310
 epoch: 40, train_loss: 0.8878, test_loss: 1.3005, test_f1: 0.5355
 epoch: 41, train_loss: 0.8987, test_loss: 1.2891, test_f1: 0.5356
 epoch: 42, train_loss: 0.8868, test_loss: 1.3045, test_f1: 0.5303
 epoch: 43, train_loss: 0.8951, test_loss: 1.3063, test_f1: 0.5309
 epoch: 44, train_loss: 0.8742, test_loss: 1.2751, test_f1: 0.5303
 epoch: 45, train_loss: 0.8804, test_loss: 1.3053, test_f1: 0.5429
 epoch: 46, train_loss: 0.8745, test_loss: 1.2769, test_f1: 0.5380
 epoch: 47, train_loss: 0.8682, test_loss: 1.2817, test_f1: 0.5226
 epoch: 48, train_loss: 0.8672, test_loss: 1.3000, test_f1: 0.5384
 epoch: 49, train_loss: 0.8615, test_loss: 1.2862, test_f1: 0.5464
 epoch: 50, train_loss: 0.8492, test_loss: 1.2802, test_f1: 0.5280
 epoch: 51, train_loss: 0.8463, test_loss: 1.2983, test_f1: 0.5352
 epoch: 52, train_loss: 0.8443, test_loss: 1.3016, test_f1: 0.5359
 epoch: 53, train_loss: 0.8456, test_loss: 1.2940, test_f1: 0.5459
 epoch: 54, train_loss: 0.8366, test_loss: 1.3252, test_f1: 0.5282
 epoch: 55, train_loss: 0.8313, test_loss: 1.3128, test_f1: 0.5359
 epoch: 56, train_loss: 0.8354, test_loss: 1.3180, test_f1: 0.5438
 epoch: 57, train_loss: 0.8471, test_loss: 1.3276, test_f1: 0.5491
 epoch: 58, train_loss: 0.8394, test_loss: 1.2974, test_f1: 0.5519
 epoch: 59, train_loss: 0.8313, test_loss: 1.3136, test_f1: 0.5384
 epoch: 60, train_loss: 0.8318, test_loss: 1.3161, test_f1: 0.5489
 epoch: 61, train_loss: 0.8268, test_loss: 1.3384, test_f1: 0.5384
 epoch: 62, train_loss: 0.8333, test_loss: 1.2993, test_f1: 0.5490
 epoch: 63, train_loss: 0.8297, test_loss: 1.3091, test_f1: 0.5522
 epoch: 64, train_loss: 0.8365, test_loss: 1.3168, test_f1: 0.5410
 epoch: 65, train_loss: 0.8143, test_loss: 1.3197, test_f1: 0.5334
 epoch: 66, train_loss: 0.8067, test_loss: 1.3181, test_f1: 0.5420
 epoch: 67, train_loss: 0.8219, test_loss: 1.3517, test_f1: 0.5397
 epoch: 68, train_loss: 0.8224, test_loss: 1.3295, test_f1: 0.5529
 epoch: 69, train_loss: 0.8092, test_loss: 1.3277, test_f1: 0.5595
 epoch: 70, train_loss: 0.8147, test_loss: 1.3529, test_f1: 0.5680
 epoch: 71, train_loss: 0.8193, test_loss: 1.3723, test_f1: 0.5498
 epoch: 72, train_loss: 0.8139, test_loss: 1.3647, test_f1: 0.5385
 epoch: 73, train_loss: 0.7985, test_loss: 1.3910, test_f1: 0.5385
 epoch: 74, train_loss: 0.7961, test_loss: 1.3716, test_f1: 0.5410
 epoch: 75, train_loss: 0.7974, test_loss: 1.3621, test_f1: 0.5680
 epoch: 76, train_loss: 0.7951, test_loss: 1.3743, test_f1: 0.5755
 epoch: 77, train_loss: 0.7899, test_loss: 1.4072, test_f1: 0.5487
 epoch: 78, train_loss: 0.8060, test_loss: 1.4118, test_f1: 0.5408
 epoch: 79, train_loss: 0.7944, test_loss: 1.3994, test_f1: 0.5621
 epoch: 80, train_loss: 0.7989, test_loss: 1.3942, test_f1: 0.5492
 epoch: 81, train_loss: 0.7962, test_loss: 1.4131, test_f1: 0.5568
 epoch: 82, train_loss: 0.7928, test_loss: 1.4667, test_f1: 0.5439
 epoch: 83, train_loss: 0.7917, test_loss: 1.3963, test_f1: 0.5725
 epoch: 84, train_loss: 0.8016, test_loss: 1.4220, test_f1: 0.5832
 epoch: 85, train_loss: 0.7873, test_loss: 1.3823, test_f1: 0.5684
 epoch: 86, train_loss: 0.7928, test_loss: 1.4075, test_f1: 0.5548
 epoch: 87, train_loss: 0.8006, test_loss: 1.4446, test_f1: 0.5487
 epoch: 88, train_loss: 0.7725, test_loss: 1.3916, test_f1: 0.5604
 epoch: 89, train_loss: 0.7866, test_loss: 1.4455, test_f1: 0.5490
 epoch: 90, train_loss: 0.7859, test_loss: 1.4663, test_f1: 0.5525
 epoch: 91, train_loss: 0.7689, test_loss: 1.4344, test_f1: 0.5603
 epoch: 92, train_loss: 0.7924, test_loss: 1.4494, test_f1: 0.5454
 epoch: 93, train_loss: 0.7668, test_loss: 1.4411, test_f1: 0.5358
 epoch: 94, train_loss: 0.7870, test_loss: 1.4323, test_f1: 0.5468
 epoch: 95, train_loss: 0.7732, test_loss: 1.4655, test_f1: 0.5550
 epoch: 96, train_loss: 0.7696, test_loss: 1.4441, test_f1: 0.5569
 epoch: 97, train_loss: 0.7695, test_loss: 1.4233, test_f1: 0.5334
 epoch: 98, train_loss: 0.7829, test_loss: 1.4447, test_f1: 0.5513
 epoch: 99, train_loss: 0.7658, test_loss: 1.4312, test_f1: 0.5623
##################ITERATION #9 ****************************************
 epoch: 0, train_loss: 1.3568, test_loss: 1.3596, test_f1: 0.2185
 epoch: 1, train_loss: 1.2709, test_loss: 1.3241, test_f1: 0.3367
 epoch: 2, train_loss: 1.2303, test_loss: 1.3105, test_f1: 0.3551
 epoch: 3, train_loss: 1.2085, test_loss: 1.3075, test_f1: 0.4043
 epoch: 4, train_loss: 1.2094, test_loss: 1.2853, test_f1: 0.3919
 epoch: 5, train_loss: 1.1744, test_loss: 1.2767, test_f1: 0.4233
 epoch: 6, train_loss: 1.1632, test_loss: 1.2614, test_f1: 0.4621
 epoch: 7, train_loss: 1.1443, test_loss: 1.2408, test_f1: 0.4710
 epoch: 8, train_loss: 1.1496, test_loss: 1.2426, test_f1: 0.4639
 epoch: 9, train_loss: 1.0996, test_loss: 1.2436, test_f1: 0.4542
 epoch: 10, train_loss: 1.0990, test_loss: 1.2323, test_f1: 0.4673
 epoch: 11, train_loss: 1.0992, test_loss: 1.2260, test_f1: 0.4687
 epoch: 12, train_loss: 1.0920, test_loss: 1.2231, test_f1: 0.4739
 epoch: 13, train_loss: 1.0529, test_loss: 1.2078, test_f1: 0.4814
 epoch: 14, train_loss: 1.0589, test_loss: 1.1994, test_f1: 0.4896
 epoch: 15, train_loss: 1.0559, test_loss: 1.2028, test_f1: 0.4995
 epoch: 16, train_loss: 1.0446, test_loss: 1.1994, test_f1: 0.5062
 epoch: 17, train_loss: 1.0278, test_loss: 1.1934, test_f1: 0.5062
 epoch: 18, train_loss: 1.0101, test_loss: 1.1949, test_f1: 0.4908
 epoch: 19, train_loss: 1.0003, test_loss: 1.1980, test_f1: 0.4754
 epoch: 20, train_loss: 0.9970, test_loss: 1.1889, test_f1: 0.4880
 epoch: 21, train_loss: 1.0007, test_loss: 1.2049, test_f1: 0.4607
 epoch: 22, train_loss: 0.9867, test_loss: 1.1701, test_f1: 0.4981
 epoch: 23, train_loss: 0.9781, test_loss: 1.1792, test_f1: 0.4854
 epoch: 24, train_loss: 0.9848, test_loss: 1.1808, test_f1: 0.5116
 epoch: 25, train_loss: 0.9468, test_loss: 1.1777, test_f1: 0.5015
 epoch: 26, train_loss: 0.9521, test_loss: 1.1688, test_f1: 0.5039
 epoch: 27, train_loss: 0.9635, test_loss: 1.1618, test_f1: 0.4834
 epoch: 28, train_loss: 0.9541, test_loss: 1.1931, test_f1: 0.4785
 epoch: 29, train_loss: 0.9409, test_loss: 1.1742, test_f1: 0.4807
 epoch: 30, train_loss: 0.9447, test_loss: 1.1781, test_f1: 0.4851
 epoch: 31, train_loss: 0.9403, test_loss: 1.2065, test_f1: 0.4590
 epoch: 32, train_loss: 0.9255, test_loss: 1.2089, test_f1: 0.4771
 epoch: 33, train_loss: 0.9286, test_loss: 1.1968, test_f1: 0.4792
 epoch: 34, train_loss: 0.9202, test_loss: 1.1909, test_f1: 0.4755
 epoch: 35, train_loss: 0.9053, test_loss: 1.1626, test_f1: 0.4617
 epoch: 36, train_loss: 0.9198, test_loss: 1.1648, test_f1: 0.4767
 epoch: 37, train_loss: 0.9173, test_loss: 1.1579, test_f1: 0.4857
 epoch: 38, train_loss: 0.9132, test_loss: 1.1567, test_f1: 0.4848
 epoch: 39, train_loss: 0.8916, test_loss: 1.1563, test_f1: 0.4725
 epoch: 40, train_loss: 0.8929, test_loss: 1.1795, test_f1: 0.4774
 epoch: 41, train_loss: 0.8922, test_loss: 1.1607, test_f1: 0.4878
 epoch: 42, train_loss: 0.8898, test_loss: 1.2161, test_f1: 0.4425
 epoch: 43, train_loss: 0.8952, test_loss: 1.1586, test_f1: 0.4688
 epoch: 44, train_loss: 0.8696, test_loss: 1.1823, test_f1: 0.4620
 epoch: 45, train_loss: 0.8627, test_loss: 1.1864, test_f1: 0.4900
 epoch: 46, train_loss: 0.8705, test_loss: 1.1634, test_f1: 0.4751
 epoch: 47, train_loss: 0.8784, test_loss: 1.1908, test_f1: 0.4710
 epoch: 48, train_loss: 0.8572, test_loss: 1.1744, test_f1: 0.4755
 epoch: 49, train_loss: 0.8541, test_loss: 1.2049, test_f1: 0.4578
 epoch: 50, train_loss: 0.8517, test_loss: 1.1685, test_f1: 0.4633
 epoch: 51, train_loss: 0.8474, test_loss: 1.1662, test_f1: 0.4727
 epoch: 52, train_loss: 0.8537, test_loss: 1.1999, test_f1: 0.4808
 epoch: 53, train_loss: 0.8362, test_loss: 1.2236, test_f1: 0.4748
 epoch: 54, train_loss: 0.8427, test_loss: 1.2017, test_f1: 0.4711
 epoch: 55, train_loss: 0.8415, test_loss: 1.2144, test_f1: 0.4676
 epoch: 56, train_loss: 0.8459, test_loss: 1.2046, test_f1: 0.4668
 epoch: 57, train_loss: 0.8373, test_loss: 1.2065, test_f1: 0.4749
 epoch: 58, train_loss: 0.8405, test_loss: 1.2326, test_f1: 0.4551
 epoch: 59, train_loss: 0.8422, test_loss: 1.2148, test_f1: 0.4699
 epoch: 60, train_loss: 0.8295, test_loss: 1.2158, test_f1: 0.4730
 epoch: 61, train_loss: 0.8324, test_loss: 1.1957, test_f1: 0.4818
 epoch: 62, train_loss: 0.8221, test_loss: 1.2093, test_f1: 0.4820
 epoch: 63, train_loss: 0.8335, test_loss: 1.2043, test_f1: 0.4834
 epoch: 64, train_loss: 0.8238, test_loss: 1.2360, test_f1: 0.4648
 epoch: 65, train_loss: 0.8334, test_loss: 1.2101, test_f1: 0.4873
 epoch: 66, train_loss: 0.8293, test_loss: 1.2057, test_f1: 0.4940
 epoch: 67, train_loss: 0.8251, test_loss: 1.2312, test_f1: 0.4774
 epoch: 68, train_loss: 0.8213, test_loss: 1.2299, test_f1: 0.4767
 epoch: 69, train_loss: 0.8266, test_loss: 1.2371, test_f1: 0.4693
 epoch: 70, train_loss: 0.8264, test_loss: 1.2777, test_f1: 0.4874
 epoch: 71, train_loss: 0.8212, test_loss: 1.2357, test_f1: 0.4735
 epoch: 72, train_loss: 0.8217, test_loss: 1.2466, test_f1: 0.4802
 epoch: 73, train_loss: 0.8273, test_loss: 1.2204, test_f1: 0.4782
 epoch: 74, train_loss: 0.8147, test_loss: 1.2665, test_f1: 0.4697
 epoch: 75, train_loss: 0.7989, test_loss: 1.2465, test_f1: 0.4740
 epoch: 76, train_loss: 0.8078, test_loss: 1.2808, test_f1: 0.4712
 epoch: 77, train_loss: 0.8203, test_loss: 1.2808, test_f1: 0.4547
 epoch: 78, train_loss: 0.8115, test_loss: 1.2370, test_f1: 0.4901
 epoch: 79, train_loss: 0.8073, test_loss: 1.2826, test_f1: 0.4720
 epoch: 80, train_loss: 0.8164, test_loss: 1.2809, test_f1: 0.4551
 epoch: 81, train_loss: 0.8052, test_loss: 1.2606, test_f1: 0.4706
 epoch: 82, train_loss: 0.7992, test_loss: 1.2374, test_f1: 0.4813
 epoch: 83, train_loss: 0.8049, test_loss: 1.2569, test_f1: 0.4780
 epoch: 84, train_loss: 0.8018, test_loss: 1.2687, test_f1: 0.4839
 epoch: 85, train_loss: 0.7846, test_loss: 1.2733, test_f1: 0.4820
 epoch: 86, train_loss: 0.7917, test_loss: 1.2861, test_f1: 0.4758
 epoch: 87, train_loss: 0.7874, test_loss: 1.2707, test_f1: 0.5014
 epoch: 88, train_loss: 0.8034, test_loss: 1.2827, test_f1: 0.4896
 epoch: 89, train_loss: 0.7866, test_loss: 1.2680, test_f1: 0.4977
 epoch: 90, train_loss: 0.7904, test_loss: 1.2710, test_f1: 0.4731
 epoch: 91, train_loss: 0.7711, test_loss: 1.2916, test_f1: 0.4949
 epoch: 92, train_loss: 0.7798, test_loss: 1.3107, test_f1: 0.4982
 epoch: 93, train_loss: 0.7902, test_loss: 1.2730, test_f1: 0.5115
 epoch: 94, train_loss: 0.7839, test_loss: 1.2891, test_f1: 0.5011
 epoch: 95, train_loss: 0.7798, test_loss: 1.3238, test_f1: 0.5074
 epoch: 96, train_loss: 0.8031, test_loss: 1.2815, test_f1: 0.4978
 epoch: 97, train_loss: 0.7738, test_loss: 1.2971, test_f1: 0.4859
 epoch: 98, train_loss: 0.7744, test_loss: 1.3284, test_f1: 0.4845
 epoch: 99, train_loss: 0.7788, test_loss: 1.3005, test_f1: 0.4853

Training completed in 376.78 seconds
Best F1: 0.6075 at epoch 84
Mean F1 across iterations: 0.5710  0.0245
========================FINAL RESULTS================================
FEGIN weighted F1: 0.6075  0.0245
python main.py --data ltspice_demos --representation component_component --model FEGIN --layers 2 --hiddens 64 --batch_size 64 --lr 0.0001 --emb_size 128 --epochs 100 --save_appendix component_component_L2_H64_BS64_LR0.0001_E128 --no_val
-----



STDERR:
  File "main.py", line 370, in <module>
    main()
  File "main.py", line 254, in main
    dataset = dataset_class(
  File "/home/philip/projects/ltspice_examples_code_repo/Circuit-Completion-Using-GNNs/component_classification_with_link_prediction_head/evaluation/FEGIN/kernel/circuit_datasets.py", line 15, in __init__
    self.data, self.slices = torch.load(self.processed_paths[0])
  File "/home/philip/.local/lib/python3.8/site-packages/torch/serialization.py", line 1040, in load
    warnings.warn(
  File "/usr/lib/python3.8/warnings.py", line 109, in _showwarnmsg
    sw(msg.message, msg.category, msg.filename, msg.lineno,
  File "main.py", line 47, in warn_with_traceback
    traceback.print_stack(file=log)
/home/philip/projects/ltspice_examples_code_repo/Circuit-Completion-Using-GNNs/component_classification_with_link_prediction_head/evaluation/FEGIN/kernel/circuit_datasets.py:15: FutureWarning: You are using `torch.load` with `weights_only=False` (the current default value), which uses the default pickle module implicitly. It is possible to construct malicious pickle data which will execute arbitrary code during unpickling (See https://github.com/pytorch/pytorch/blob/main/SECURITY.md#untrusted-models for more details). In a future release, the default value for `weights_only` will be flipped to `True`. This limits the functions that could be executed during unpickling. Arbitrary objects will no longer be allowed to be loaded via this mode unless they are explicitly allowlisted by the user via `torch.serialization.add_safe_globals`. We recommend you start setting `weights_only=True` for any use case where you don't have full control of the loaded file. Please open an issue on GitHub for any issues related to this experimental feature.
  self.data, self.slices = torch.load(self.processed_paths[0])
