STDOUT:
Results will be saved in /home/philip/projects/ltspice_examples_code_repo/Circuit-Completion-Using-GNNs/component_classification_with_link_prediction_head/evaluation/FEGIN/results/model_FEGIN_dataset_ltspice_demos
Command line input: python main.py --data ltspice_demos --representation component_net --model FEGIN --layers 6 --hiddens 64 --batch_size 64 --lr 0.0001 --emb_size 512 --epochs 100 --save_appendix component_net_L6_H64_BS64_LR0.0001_E512 --no_val
 is saved.
-----
ltspice_demos - FEGIN
Using 6 layers, 64 hidden units, h = 2
Loading component_net representation dataset
ENTERED
Training FEGIN on component_net representation
Train: 1565, Test: 383
##################ITERATION #0 ****************************************
 epoch: 0, train_loss: 1.3760, test_loss: 1.3862, test_f1: 0.1365
 epoch: 1, train_loss: 1.3528, test_loss: 1.3745, test_f1: 0.1365
 epoch: 2, train_loss: 1.3337, test_loss: 1.3610, test_f1: 0.1365
 epoch: 3, train_loss: 1.3088, test_loss: 1.3360, test_f1: 0.1365
 epoch: 4, train_loss: 1.2802, test_loss: 1.3053, test_f1: 0.1365
 epoch: 5, train_loss: 1.2485, test_loss: 1.2789, test_f1: 0.1527
 epoch: 6, train_loss: 1.2164, test_loss: 1.2545, test_f1: 0.2072
 epoch: 7, train_loss: 1.1909, test_loss: 1.2325, test_f1: 0.3258
 epoch: 8, train_loss: 1.1678, test_loss: 1.2175, test_f1: 0.3539
 epoch: 9, train_loss: 1.1570, test_loss: 1.2052, test_f1: 0.3170
 epoch: 10, train_loss: 1.1458, test_loss: 1.1961, test_f1: 0.3457
 epoch: 11, train_loss: 1.1401, test_loss: 1.1896, test_f1: 0.3256
 epoch: 12, train_loss: 1.1329, test_loss: 1.1804, test_f1: 0.3086
 epoch: 13, train_loss: 1.1206, test_loss: 1.1745, test_f1: 0.3386
 epoch: 14, train_loss: 1.1148, test_loss: 1.1672, test_f1: 0.3421
 epoch: 15, train_loss: 1.1120, test_loss: 1.1690, test_f1: 0.3238
 epoch: 16, train_loss: 1.1028, test_loss: 1.1557, test_f1: 0.3403
 epoch: 17, train_loss: 1.0921, test_loss: 1.1536, test_f1: 0.3531
 epoch: 18, train_loss: 1.0916, test_loss: 1.1589, test_f1: 0.3633
 epoch: 19, train_loss: 1.0826, test_loss: 1.1449, test_f1: 0.4036
 epoch: 20, train_loss: 1.0747, test_loss: 1.1350, test_f1: 0.4348
 epoch: 21, train_loss: 1.0664, test_loss: 1.1367, test_f1: 0.4226
 epoch: 22, train_loss: 1.0622, test_loss: 1.1341, test_f1: 0.4313
 epoch: 23, train_loss: 1.0615, test_loss: 1.1353, test_f1: 0.4642
 epoch: 24, train_loss: 1.0550, test_loss: 1.1239, test_f1: 0.4728
 epoch: 25, train_loss: 1.0382, test_loss: 1.1132, test_f1: 0.4742
 epoch: 26, train_loss: 1.0336, test_loss: 1.1076, test_f1: 0.4976
 epoch: 27, train_loss: 1.0285, test_loss: 1.1129, test_f1: 0.4602
 epoch: 28, train_loss: 1.0209, test_loss: 1.1285, test_f1: 0.4953
 epoch: 29, train_loss: 1.0190, test_loss: 1.0934, test_f1: 0.5052
 epoch: 30, train_loss: 1.0068, test_loss: 1.0784, test_f1: 0.4965
 epoch: 31, train_loss: 1.0011, test_loss: 1.0820, test_f1: 0.5040
 epoch: 32, train_loss: 0.9897, test_loss: 1.0826, test_f1: 0.4931
 epoch: 33, train_loss: 0.9790, test_loss: 1.0816, test_f1: 0.5211
 epoch: 34, train_loss: 0.9757, test_loss: 1.0656, test_f1: 0.5048
 epoch: 35, train_loss: 0.9699, test_loss: 1.0710, test_f1: 0.5147
 epoch: 36, train_loss: 0.9715, test_loss: 1.0752, test_f1: 0.5004
 epoch: 37, train_loss: 0.9554, test_loss: 1.0657, test_f1: 0.5223
 epoch: 38, train_loss: 0.9417, test_loss: 1.0642, test_f1: 0.5182
 epoch: 39, train_loss: 0.9512, test_loss: 1.0703, test_f1: 0.5146
 epoch: 40, train_loss: 0.9356, test_loss: 1.0523, test_f1: 0.5314
 epoch: 41, train_loss: 0.9371, test_loss: 1.0638, test_f1: 0.5388
 epoch: 42, train_loss: 0.9223, test_loss: 1.0522, test_f1: 0.5293
 epoch: 43, train_loss: 0.9058, test_loss: 1.0739, test_f1: 0.5262
 epoch: 44, train_loss: 0.9118, test_loss: 1.0851, test_f1: 0.5202
 epoch: 45, train_loss: 0.8968, test_loss: 1.0731, test_f1: 0.5391
 epoch: 46, train_loss: 0.8882, test_loss: 1.0786, test_f1: 0.5369
 epoch: 47, train_loss: 0.8876, test_loss: 1.1004, test_f1: 0.5325
 epoch: 48, train_loss: 0.8775, test_loss: 1.1127, test_f1: 0.5191
 epoch: 49, train_loss: 0.8778, test_loss: 1.0828, test_f1: 0.5521
 epoch: 50, train_loss: 0.8766, test_loss: 1.0827, test_f1: 0.5446
 epoch: 51, train_loss: 0.8652, test_loss: 1.1419, test_f1: 0.5377
 epoch: 52, train_loss: 0.8530, test_loss: 1.1274, test_f1: 0.5478
 epoch: 53, train_loss: 0.8653, test_loss: 1.1286, test_f1: 0.5372
 epoch: 54, train_loss: 0.8574, test_loss: 1.1243, test_f1: 0.5375
 epoch: 55, train_loss: 0.8611, test_loss: 1.1292, test_f1: 0.5352
 epoch: 56, train_loss: 0.8494, test_loss: 1.1361, test_f1: 0.5500
 epoch: 57, train_loss: 0.8534, test_loss: 1.1558, test_f1: 0.5435
 epoch: 58, train_loss: 0.8449, test_loss: 1.1232, test_f1: 0.5486
 epoch: 59, train_loss: 0.8568, test_loss: 1.1586, test_f1: 0.5412
 epoch: 60, train_loss: 0.8458, test_loss: 1.1512, test_f1: 0.5414
 epoch: 61, train_loss: 0.8443, test_loss: 1.1340, test_f1: 0.5557
 epoch: 62, train_loss: 0.8503, test_loss: 1.1448, test_f1: 0.5528
 epoch: 63, train_loss: 0.8527, test_loss: 1.1513, test_f1: 0.5457
 epoch: 64, train_loss: 0.8434, test_loss: 1.1180, test_f1: 0.5578
 epoch: 65, train_loss: 0.8456, test_loss: 1.1379, test_f1: 0.5450
 epoch: 66, train_loss: 0.8436, test_loss: 1.1555, test_f1: 0.5520
 epoch: 67, train_loss: 0.8284, test_loss: 1.1719, test_f1: 0.5511
 epoch: 68, train_loss: 0.8293, test_loss: 1.1530, test_f1: 0.5512
 epoch: 69, train_loss: 0.8332, test_loss: 1.1755, test_f1: 0.5448
 epoch: 70, train_loss: 0.8327, test_loss: 1.1614, test_f1: 0.5512
 epoch: 71, train_loss: 0.8240, test_loss: 1.1780, test_f1: 0.5495
 epoch: 72, train_loss: 0.8316, test_loss: 1.1471, test_f1: 0.5461
 epoch: 73, train_loss: 0.8410, test_loss: 1.1908, test_f1: 0.5257
 epoch: 74, train_loss: 0.8135, test_loss: 1.1777, test_f1: 0.5439
 epoch: 75, train_loss: 0.8237, test_loss: 1.1710, test_f1: 0.5433
 epoch: 76, train_loss: 0.8296, test_loss: 1.1876, test_f1: 0.5385
 epoch: 77, train_loss: 0.8069, test_loss: 1.1882, test_f1: 0.5318
 epoch: 78, train_loss: 0.8043, test_loss: 1.2040, test_f1: 0.5257
 epoch: 79, train_loss: 0.8200, test_loss: 1.2019, test_f1: 0.5345
 epoch: 80, train_loss: 0.8301, test_loss: 1.1870, test_f1: 0.5384
 epoch: 81, train_loss: 0.8094, test_loss: 1.1726, test_f1: 0.5390
 epoch: 82, train_loss: 0.8121, test_loss: 1.2155, test_f1: 0.5481
 epoch: 83, train_loss: 0.7914, test_loss: 1.2012, test_f1: 0.5413
 epoch: 84, train_loss: 0.8073, test_loss: 1.2212, test_f1: 0.5440
 epoch: 85, train_loss: 0.8186, test_loss: 1.2100, test_f1: 0.5347
 epoch: 86, train_loss: 0.8013, test_loss: 1.2182, test_f1: 0.5457
 epoch: 87, train_loss: 0.7881, test_loss: 1.1964, test_f1: 0.5488
 epoch: 88, train_loss: 0.8230, test_loss: 1.2341, test_f1: 0.5561
 epoch: 89, train_loss: 0.8030, test_loss: 1.2249, test_f1: 0.5516
 epoch: 90, train_loss: 0.8020, test_loss: 1.2350, test_f1: 0.5341
 epoch: 91, train_loss: 0.7994, test_loss: 1.2764, test_f1: 0.5314
 epoch: 92, train_loss: 0.7943, test_loss: 1.2469, test_f1: 0.5337
 epoch: 93, train_loss: 0.7868, test_loss: 1.2355, test_f1: 0.5519
 epoch: 94, train_loss: 0.7846, test_loss: 1.2776, test_f1: 0.5190
 epoch: 95, train_loss: 0.8057, test_loss: 1.2205, test_f1: 0.5414
 epoch: 96, train_loss: 0.7799, test_loss: 1.2851, test_f1: 0.5316
 epoch: 97, train_loss: 0.7982, test_loss: 1.2687, test_f1: 0.5355
 epoch: 98, train_loss: 0.7919, test_loss: 1.2693, test_f1: 0.5415
 epoch: 99, train_loss: 0.8003, test_loss: 1.2527, test_f1: 0.5367
##################ITERATION #1 ****************************************
 epoch: 0, train_loss: 1.3365, test_loss: 1.3620, test_f1: 0.1365
 epoch: 1, train_loss: 1.2758, test_loss: 1.3227, test_f1: 0.2124
 epoch: 2, train_loss: 1.2322, test_loss: 1.2666, test_f1: 0.2773
 epoch: 3, train_loss: 1.2034, test_loss: 1.2338, test_f1: 0.3406
 epoch: 4, train_loss: 1.1769, test_loss: 1.2078, test_f1: 0.3660
 epoch: 5, train_loss: 1.1577, test_loss: 1.1901, test_f1: 0.3687
 epoch: 6, train_loss: 1.1371, test_loss: 1.1744, test_f1: 0.3774
 epoch: 7, train_loss: 1.1220, test_loss: 1.1633, test_f1: 0.4437
 epoch: 8, train_loss: 1.1075, test_loss: 1.1459, test_f1: 0.4311
 epoch: 9, train_loss: 1.0980, test_loss: 1.1339, test_f1: 0.4446
 epoch: 10, train_loss: 1.0864, test_loss: 1.1293, test_f1: 0.4717
 epoch: 11, train_loss: 1.0781, test_loss: 1.1203, test_f1: 0.4835
 epoch: 12, train_loss: 1.0647, test_loss: 1.1103, test_f1: 0.4889
 epoch: 13, train_loss: 1.0593, test_loss: 1.0992, test_f1: 0.4868
 epoch: 14, train_loss: 1.0453, test_loss: 1.0905, test_f1: 0.4981
 epoch: 15, train_loss: 1.0392, test_loss: 1.0843, test_f1: 0.5015
 epoch: 16, train_loss: 1.0338, test_loss: 1.0781, test_f1: 0.5001
 epoch: 17, train_loss: 1.0250, test_loss: 1.0690, test_f1: 0.5054
 epoch: 18, train_loss: 1.0121, test_loss: 1.0676, test_f1: 0.4934
 epoch: 19, train_loss: 1.0074, test_loss: 1.0614, test_f1: 0.4965
 epoch: 20, train_loss: 0.9918, test_loss: 1.0531, test_f1: 0.5078
 epoch: 21, train_loss: 0.9873, test_loss: 1.0567, test_f1: 0.5239
 epoch: 22, train_loss: 0.9773, test_loss: 1.0436, test_f1: 0.5210
 epoch: 23, train_loss: 0.9642, test_loss: 1.0455, test_f1: 0.5228
 epoch: 24, train_loss: 0.9728, test_loss: 1.0339, test_f1: 0.5304
 epoch: 25, train_loss: 0.9572, test_loss: 1.0283, test_f1: 0.5361
 epoch: 26, train_loss: 0.9490, test_loss: 1.0179, test_f1: 0.5394
 epoch: 27, train_loss: 0.9492, test_loss: 1.0264, test_f1: 0.5424
 epoch: 28, train_loss: 0.9395, test_loss: 1.0217, test_f1: 0.5391
 epoch: 29, train_loss: 0.9434, test_loss: 1.0325, test_f1: 0.5473
 epoch: 30, train_loss: 0.9290, test_loss: 1.0138, test_f1: 0.5360
 epoch: 31, train_loss: 0.9350, test_loss: 1.0358, test_f1: 0.5233
 epoch: 32, train_loss: 0.9174, test_loss: 1.0176, test_f1: 0.5385
 epoch: 33, train_loss: 0.9155, test_loss: 1.0148, test_f1: 0.5552
 epoch: 34, train_loss: 0.9116, test_loss: 1.0105, test_f1: 0.5372
 epoch: 35, train_loss: 0.9033, test_loss: 1.0010, test_f1: 0.5441
 epoch: 36, train_loss: 0.8973, test_loss: 1.0309, test_f1: 0.5491
 epoch: 37, train_loss: 0.8875, test_loss: 1.0325, test_f1: 0.5586
 epoch: 38, train_loss: 0.8808, test_loss: 1.0166, test_f1: 0.5453
 epoch: 39, train_loss: 0.8768, test_loss: 1.0219, test_f1: 0.5540
 epoch: 40, train_loss: 0.8806, test_loss: 1.0077, test_f1: 0.5455
 epoch: 41, train_loss: 0.8737, test_loss: 1.0226, test_f1: 0.5437
 epoch: 42, train_loss: 0.8697, test_loss: 1.0263, test_f1: 0.5601
 epoch: 43, train_loss: 0.8662, test_loss: 1.0016, test_f1: 0.5407
 epoch: 44, train_loss: 0.8601, test_loss: 1.0178, test_f1: 0.5566
 epoch: 45, train_loss: 0.8569, test_loss: 1.0046, test_f1: 0.5568
 epoch: 46, train_loss: 0.8529, test_loss: 1.0049, test_f1: 0.5519
 epoch: 47, train_loss: 0.8312, test_loss: 1.0080, test_f1: 0.5554
 epoch: 48, train_loss: 0.8388, test_loss: 0.9759, test_f1: 0.5758
 epoch: 49, train_loss: 0.8422, test_loss: 1.0216, test_f1: 0.5484
 epoch: 50, train_loss: 0.8402, test_loss: 1.0234, test_f1: 0.5622
 epoch: 51, train_loss: 0.8424, test_loss: 0.9897, test_f1: 0.5546
 epoch: 52, train_loss: 0.8389, test_loss: 1.0055, test_f1: 0.5779
 epoch: 53, train_loss: 0.8241, test_loss: 1.0043, test_f1: 0.5579
 epoch: 54, train_loss: 0.8187, test_loss: 1.0085, test_f1: 0.5580
 epoch: 55, train_loss: 0.8212, test_loss: 1.0071, test_f1: 0.5693
 epoch: 56, train_loss: 0.8174, test_loss: 1.0143, test_f1: 0.5588
 epoch: 57, train_loss: 0.8270, test_loss: 1.0152, test_f1: 0.5638
 epoch: 58, train_loss: 0.8227, test_loss: 1.0237, test_f1: 0.5668
 epoch: 59, train_loss: 0.8201, test_loss: 1.0074, test_f1: 0.5691
 epoch: 60, train_loss: 0.8064, test_loss: 1.0236, test_f1: 0.5731
 epoch: 61, train_loss: 0.8027, test_loss: 1.0020, test_f1: 0.5685
 epoch: 62, train_loss: 0.8097, test_loss: 1.0272, test_f1: 0.5602
 epoch: 63, train_loss: 0.8109, test_loss: 1.0168, test_f1: 0.5571
 epoch: 64, train_loss: 0.8013, test_loss: 1.0158, test_f1: 0.5532
 epoch: 65, train_loss: 0.8073, test_loss: 1.0061, test_f1: 0.5692
 epoch: 66, train_loss: 0.7998, test_loss: 1.0139, test_f1: 0.5639
 epoch: 67, train_loss: 0.8019, test_loss: 1.0318, test_f1: 0.5651
 epoch: 68, train_loss: 0.8090, test_loss: 1.0090, test_f1: 0.5651
 epoch: 69, train_loss: 0.7992, test_loss: 1.0216, test_f1: 0.5679
 epoch: 70, train_loss: 0.8073, test_loss: 1.0098, test_f1: 0.5634
 epoch: 71, train_loss: 0.7986, test_loss: 1.0206, test_f1: 0.5618
 epoch: 72, train_loss: 0.7806, test_loss: 1.0462, test_f1: 0.5734
 epoch: 73, train_loss: 0.7919, test_loss: 1.0382, test_f1: 0.5647
 epoch: 74, train_loss: 0.7875, test_loss: 1.0082, test_f1: 0.5597
 epoch: 75, train_loss: 0.7867, test_loss: 1.0080, test_f1: 0.5633
 epoch: 76, train_loss: 0.7863, test_loss: 1.0245, test_f1: 0.5742
 epoch: 77, train_loss: 0.7959, test_loss: 1.0195, test_f1: 0.5783
 epoch: 78, train_loss: 0.7829, test_loss: 1.0052, test_f1: 0.5807
 epoch: 79, train_loss: 0.7742, test_loss: 1.0219, test_f1: 0.5675
 epoch: 80, train_loss: 0.7709, test_loss: 1.0413, test_f1: 0.5642
 epoch: 81, train_loss: 0.7846, test_loss: 1.0147, test_f1: 0.5532
 epoch: 82, train_loss: 0.7803, test_loss: 1.0375, test_f1: 0.5694
 epoch: 83, train_loss: 0.7676, test_loss: 1.0621, test_f1: 0.5653
 epoch: 84, train_loss: 0.7768, test_loss: 1.0290, test_f1: 0.5615
 epoch: 85, train_loss: 0.7751, test_loss: 1.0319, test_f1: 0.5670
 epoch: 86, train_loss: 0.7735, test_loss: 1.0488, test_f1: 0.5598
 epoch: 87, train_loss: 0.7719, test_loss: 1.0398, test_f1: 0.5575
 epoch: 88, train_loss: 0.7734, test_loss: 1.0453, test_f1: 0.5633
 epoch: 89, train_loss: 0.7577, test_loss: 1.0513, test_f1: 0.5670
 epoch: 90, train_loss: 0.7771, test_loss: 1.0493, test_f1: 0.5624
 epoch: 91, train_loss: 0.7571, test_loss: 1.0638, test_f1: 0.5610
 epoch: 92, train_loss: 0.7598, test_loss: 1.0506, test_f1: 0.5750
 epoch: 93, train_loss: 0.7582, test_loss: 1.0611, test_f1: 0.5681
 epoch: 94, train_loss: 0.7693, test_loss: 1.0697, test_f1: 0.5710
 epoch: 95, train_loss: 0.7568, test_loss: 1.0556, test_f1: 0.5843
 epoch: 96, train_loss: 0.7636, test_loss: 1.0527, test_f1: 0.5869
 epoch: 97, train_loss: 0.7625, test_loss: 1.0832, test_f1: 0.5761
 epoch: 98, train_loss: 0.7719, test_loss: 1.0644, test_f1: 0.5622
 epoch: 99, train_loss: 0.7497, test_loss: 1.0630, test_f1: 0.5624
##################ITERATION #2 ****************************************
 epoch: 0, train_loss: 1.2754, test_loss: 1.3466, test_f1: 0.2281
 epoch: 1, train_loss: 1.2076, test_loss: 1.3187, test_f1: 0.2776
 epoch: 2, train_loss: 1.1762, test_loss: 1.2826, test_f1: 0.3317
 epoch: 3, train_loss: 1.1522, test_loss: 1.2209, test_f1: 0.3550
 epoch: 4, train_loss: 1.1324, test_loss: 1.1869, test_f1: 0.3743
 epoch: 5, train_loss: 1.1134, test_loss: 1.1626, test_f1: 0.4255
 epoch: 6, train_loss: 1.0974, test_loss: 1.1450, test_f1: 0.4655
 epoch: 7, train_loss: 1.0818, test_loss: 1.1310, test_f1: 0.4698
 epoch: 8, train_loss: 1.0673, test_loss: 1.1200, test_f1: 0.5133
 epoch: 9, train_loss: 1.0684, test_loss: 1.1088, test_f1: 0.4993
 epoch: 10, train_loss: 1.0344, test_loss: 1.1000, test_f1: 0.5105
 epoch: 11, train_loss: 1.0259, test_loss: 1.0886, test_f1: 0.5026
 epoch: 12, train_loss: 1.0173, test_loss: 1.0781, test_f1: 0.5023
 epoch: 13, train_loss: 1.0053, test_loss: 1.0844, test_f1: 0.4972
 epoch: 14, train_loss: 1.0001, test_loss: 1.0854, test_f1: 0.5194
 epoch: 15, train_loss: 0.9869, test_loss: 1.0685, test_f1: 0.5094
 epoch: 16, train_loss: 0.9703, test_loss: 1.0788, test_f1: 0.5120
 epoch: 17, train_loss: 0.9623, test_loss: 1.0717, test_f1: 0.5232
 epoch: 18, train_loss: 0.9511, test_loss: 1.0569, test_f1: 0.5374
 epoch: 19, train_loss: 0.9509, test_loss: 1.0600, test_f1: 0.5123
 epoch: 20, train_loss: 0.9409, test_loss: 1.0645, test_f1: 0.5358
 epoch: 21, train_loss: 0.9359, test_loss: 1.0647, test_f1: 0.5137
 epoch: 22, train_loss: 0.9433, test_loss: 1.0445, test_f1: 0.5100
 epoch: 23, train_loss: 0.9269, test_loss: 1.0759, test_f1: 0.5102
 epoch: 24, train_loss: 0.9198, test_loss: 1.0399, test_f1: 0.5385
 epoch: 25, train_loss: 0.9185, test_loss: 1.0424, test_f1: 0.5654
 epoch: 26, train_loss: 0.9022, test_loss: 1.0301, test_f1: 0.5480
 epoch: 27, train_loss: 0.9092, test_loss: 1.0316, test_f1: 0.5387
 epoch: 28, train_loss: 0.8991, test_loss: 1.0416, test_f1: 0.5417
 epoch: 29, train_loss: 0.8929, test_loss: 1.0479, test_f1: 0.5388
 epoch: 30, train_loss: 0.8900, test_loss: 1.0540, test_f1: 0.5492
 epoch: 31, train_loss: 0.8897, test_loss: 1.0428, test_f1: 0.5590
 epoch: 32, train_loss: 0.8727, test_loss: 1.0699, test_f1: 0.5625
 epoch: 33, train_loss: 0.8732, test_loss: 1.0468, test_f1: 0.5680
 epoch: 34, train_loss: 0.8734, test_loss: 1.0339, test_f1: 0.5651
 epoch: 35, train_loss: 0.8535, test_loss: 1.0362, test_f1: 0.5686
 epoch: 36, train_loss: 0.8621, test_loss: 1.0407, test_f1: 0.5742
 epoch: 37, train_loss: 0.8572, test_loss: 1.0506, test_f1: 0.5632
 epoch: 38, train_loss: 0.8536, test_loss: 1.0186, test_f1: 0.5728
 epoch: 39, train_loss: 0.8542, test_loss: 1.0241, test_f1: 0.5855
 epoch: 40, train_loss: 0.8442, test_loss: 1.0595, test_f1: 0.5607
 epoch: 41, train_loss: 0.8455, test_loss: 1.0480, test_f1: 0.5698
 epoch: 42, train_loss: 0.8455, test_loss: 1.0366, test_f1: 0.5823
 epoch: 43, train_loss: 0.8302, test_loss: 1.0279, test_f1: 0.5815
 epoch: 44, train_loss: 0.8369, test_loss: 1.0426, test_f1: 0.5926
 epoch: 45, train_loss: 0.8405, test_loss: 1.0662, test_f1: 0.5623
 epoch: 46, train_loss: 0.8159, test_loss: 1.0928, test_f1: 0.5684
 epoch: 47, train_loss: 0.8238, test_loss: 1.0416, test_f1: 0.5687
 epoch: 48, train_loss: 0.8173, test_loss: 1.0603, test_f1: 0.5684
 epoch: 49, train_loss: 0.8221, test_loss: 1.0305, test_f1: 0.5647
 epoch: 50, train_loss: 0.8253, test_loss: 1.0912, test_f1: 0.5643
 epoch: 51, train_loss: 0.8082, test_loss: 1.0441, test_f1: 0.5735
 epoch: 52, train_loss: 0.8030, test_loss: 1.0571, test_f1: 0.5750
 epoch: 53, train_loss: 0.7959, test_loss: 1.0804, test_f1: 0.5665
 epoch: 54, train_loss: 0.8004, test_loss: 1.0817, test_f1: 0.5646
 epoch: 55, train_loss: 0.7867, test_loss: 1.0787, test_f1: 0.5585
 epoch: 56, train_loss: 0.8043, test_loss: 1.0860, test_f1: 0.5623
 epoch: 57, train_loss: 0.7982, test_loss: 1.0563, test_f1: 0.5698
 epoch: 58, train_loss: 0.7900, test_loss: 1.0758, test_f1: 0.5583
 epoch: 59, train_loss: 0.7744, test_loss: 1.0768, test_f1: 0.5698
 epoch: 60, train_loss: 0.7996, test_loss: 1.0833, test_f1: 0.5623
 epoch: 61, train_loss: 0.7881, test_loss: 1.0863, test_f1: 0.5737
 epoch: 62, train_loss: 0.7967, test_loss: 1.0855, test_f1: 0.5533
 epoch: 63, train_loss: 0.7898, test_loss: 1.0857, test_f1: 0.5580
 epoch: 64, train_loss: 0.7779, test_loss: 1.0873, test_f1: 0.5660
 epoch: 65, train_loss: 0.7759, test_loss: 1.1124, test_f1: 0.5561
 epoch: 66, train_loss: 0.7724, test_loss: 1.0960, test_f1: 0.5701
 epoch: 67, train_loss: 0.7709, test_loss: 1.0844, test_f1: 0.5578
 epoch: 68, train_loss: 0.7687, test_loss: 1.1119, test_f1: 0.5595
 epoch: 69, train_loss: 0.7729, test_loss: 1.1194, test_f1: 0.5561
 epoch: 70, train_loss: 0.7706, test_loss: 1.1206, test_f1: 0.5559
 epoch: 71, train_loss: 0.7658, test_loss: 1.0899, test_f1: 0.5612
 epoch: 72, train_loss: 0.7617, test_loss: 1.0737, test_f1: 0.5667
 epoch: 73, train_loss: 0.7629, test_loss: 1.0958, test_f1: 0.5624
 epoch: 74, train_loss: 0.7527, test_loss: 1.1003, test_f1: 0.5569
 epoch: 75, train_loss: 0.7438, test_loss: 1.1143, test_f1: 0.5514
 epoch: 76, train_loss: 0.7363, test_loss: 1.1113, test_f1: 0.5560
 epoch: 77, train_loss: 0.7403, test_loss: 1.0990, test_f1: 0.5620
 epoch: 78, train_loss: 0.7602, test_loss: 1.1171, test_f1: 0.5544
 epoch: 79, train_loss: 0.7650, test_loss: 1.1166, test_f1: 0.5659
 epoch: 80, train_loss: 0.7440, test_loss: 1.1276, test_f1: 0.5594
 epoch: 81, train_loss: 0.7523, test_loss: 1.0970, test_f1: 0.5653
 epoch: 82, train_loss: 0.7462, test_loss: 1.1265, test_f1: 0.5563
 epoch: 83, train_loss: 0.7605, test_loss: 1.1489, test_f1: 0.5581
 epoch: 84, train_loss: 0.7449, test_loss: 1.1326, test_f1: 0.5656
 epoch: 85, train_loss: 0.7330, test_loss: 1.1351, test_f1: 0.5754
 epoch: 86, train_loss: 0.7424, test_loss: 1.1478, test_f1: 0.5532
 epoch: 87, train_loss: 0.7520, test_loss: 1.1419, test_f1: 0.5579
 epoch: 88, train_loss: 0.7493, test_loss: 1.1366, test_f1: 0.5679
 epoch: 89, train_loss: 0.7502, test_loss: 1.1563, test_f1: 0.5708
 epoch: 90, train_loss: 0.7431, test_loss: 1.1305, test_f1: 0.5774
 epoch: 91, train_loss: 0.7397, test_loss: 1.1608, test_f1: 0.5666
 epoch: 92, train_loss: 0.7361, test_loss: 1.1316, test_f1: 0.5602
 epoch: 93, train_loss: 0.7302, test_loss: 1.1785, test_f1: 0.5686
 epoch: 94, train_loss: 0.7531, test_loss: 1.1484, test_f1: 0.5762
 epoch: 95, train_loss: 0.7367, test_loss: 1.1713, test_f1: 0.5561
 epoch: 96, train_loss: 0.7295, test_loss: 1.1798, test_f1: 0.5749
 epoch: 97, train_loss: 0.7187, test_loss: 1.2019, test_f1: 0.5659
 epoch: 98, train_loss: 0.7211, test_loss: 1.1767, test_f1: 0.5595
 epoch: 99, train_loss: 0.7311, test_loss: 1.1777, test_f1: 0.5536
##################ITERATION #3 ****************************************
 epoch: 0, train_loss: 1.2622, test_loss: 1.3460, test_f1: 0.2281
 epoch: 1, train_loss: 1.2011, test_loss: 1.2829, test_f1: 0.2582
 epoch: 2, train_loss: 1.1727, test_loss: 1.2477, test_f1: 0.2293
 epoch: 3, train_loss: 1.1485, test_loss: 1.2124, test_f1: 0.3215
 epoch: 4, train_loss: 1.1314, test_loss: 1.1901, test_f1: 0.3738
 epoch: 5, train_loss: 1.1147, test_loss: 1.1784, test_f1: 0.4314
 epoch: 6, train_loss: 1.0993, test_loss: 1.1594, test_f1: 0.4316
 epoch: 7, train_loss: 1.0884, test_loss: 1.1423, test_f1: 0.4384
 epoch: 8, train_loss: 1.0769, test_loss: 1.1280, test_f1: 0.4690
 epoch: 9, train_loss: 1.0549, test_loss: 1.1179, test_f1: 0.4717
 epoch: 10, train_loss: 1.0398, test_loss: 1.1127, test_f1: 0.4704
 epoch: 11, train_loss: 1.0265, test_loss: 1.0938, test_f1: 0.4776
 epoch: 12, train_loss: 1.0331, test_loss: 1.0793, test_f1: 0.4932
 epoch: 13, train_loss: 1.0127, test_loss: 1.0692, test_f1: 0.4927
 epoch: 14, train_loss: 1.0005, test_loss: 1.0701, test_f1: 0.5122
 epoch: 15, train_loss: 1.0028, test_loss: 1.0651, test_f1: 0.5127
 epoch: 16, train_loss: 0.9809, test_loss: 1.0529, test_f1: 0.4917
 epoch: 17, train_loss: 0.9746, test_loss: 1.0551, test_f1: 0.4896
 epoch: 18, train_loss: 0.9711, test_loss: 1.0431, test_f1: 0.5201
 epoch: 19, train_loss: 0.9584, test_loss: 1.0228, test_f1: 0.5455
 epoch: 20, train_loss: 0.9608, test_loss: 1.0276, test_f1: 0.5110
 epoch: 21, train_loss: 0.9554, test_loss: 1.0550, test_f1: 0.5121
 epoch: 22, train_loss: 0.9483, test_loss: 1.0358, test_f1: 0.5266
 epoch: 23, train_loss: 0.9390, test_loss: 1.0354, test_f1: 0.5285
 epoch: 24, train_loss: 0.9313, test_loss: 1.0192, test_f1: 0.5277
 epoch: 25, train_loss: 0.9275, test_loss: 1.0218, test_f1: 0.5141
 epoch: 26, train_loss: 0.9167, test_loss: 1.0299, test_f1: 0.5199
 epoch: 27, train_loss: 0.9262, test_loss: 1.0393, test_f1: 0.5286
 epoch: 28, train_loss: 0.9030, test_loss: 1.0044, test_f1: 0.5211
 epoch: 29, train_loss: 0.9093, test_loss: 1.0223, test_f1: 0.5421
 epoch: 30, train_loss: 0.9038, test_loss: 1.0184, test_f1: 0.5276
 epoch: 31, train_loss: 0.8900, test_loss: 1.0051, test_f1: 0.5330
 epoch: 32, train_loss: 0.8876, test_loss: 1.0342, test_f1: 0.5513
 epoch: 33, train_loss: 0.8683, test_loss: 1.0301, test_f1: 0.5522
 epoch: 34, train_loss: 0.8751, test_loss: 1.0198, test_f1: 0.5470
 epoch: 35, train_loss: 0.8819, test_loss: 1.0173, test_f1: 0.5419
 epoch: 36, train_loss: 0.8548, test_loss: 1.0004, test_f1: 0.5391
 epoch: 37, train_loss: 0.8653, test_loss: 1.0381, test_f1: 0.5415
 epoch: 38, train_loss: 0.8677, test_loss: 1.0532, test_f1: 0.5573
 epoch: 39, train_loss: 0.8557, test_loss: 1.0220, test_f1: 0.5395
 epoch: 40, train_loss: 0.8464, test_loss: 1.0504, test_f1: 0.5402
 epoch: 41, train_loss: 0.8460, test_loss: 1.0681, test_f1: 0.5352
 epoch: 42, train_loss: 0.8458, test_loss: 1.0480, test_f1: 0.5522
 epoch: 43, train_loss: 0.8406, test_loss: 1.0693, test_f1: 0.5566
 epoch: 44, train_loss: 0.8455, test_loss: 1.0629, test_f1: 0.5452
 epoch: 45, train_loss: 0.8155, test_loss: 1.0688, test_f1: 0.5329
 epoch: 46, train_loss: 0.8282, test_loss: 1.0657, test_f1: 0.5427
 epoch: 47, train_loss: 0.8232, test_loss: 1.0670, test_f1: 0.5431
 epoch: 48, train_loss: 0.8220, test_loss: 1.0844, test_f1: 0.5564
 epoch: 49, train_loss: 0.8191, test_loss: 1.0974, test_f1: 0.5409
 epoch: 50, train_loss: 0.8171, test_loss: 1.1122, test_f1: 0.5408
 epoch: 51, train_loss: 0.8088, test_loss: 1.1225, test_f1: 0.5315
 epoch: 52, train_loss: 0.8055, test_loss: 1.1175, test_f1: 0.5255
 epoch: 53, train_loss: 0.7959, test_loss: 1.1072, test_f1: 0.5321
 epoch: 54, train_loss: 0.8113, test_loss: 1.0852, test_f1: 0.5616
 epoch: 55, train_loss: 0.7877, test_loss: 1.0810, test_f1: 0.5516
 epoch: 56, train_loss: 0.7909, test_loss: 1.0907, test_f1: 0.5362
 epoch: 57, train_loss: 0.7917, test_loss: 1.1020, test_f1: 0.5547
 epoch: 58, train_loss: 0.7914, test_loss: 1.1267, test_f1: 0.5301
 epoch: 59, train_loss: 0.8023, test_loss: 1.1400, test_f1: 0.5310
 epoch: 60, train_loss: 0.7765, test_loss: 1.1124, test_f1: 0.5522
 epoch: 61, train_loss: 0.7905, test_loss: 1.1278, test_f1: 0.5315
 epoch: 62, train_loss: 0.7860, test_loss: 1.1140, test_f1: 0.5360
 epoch: 63, train_loss: 0.7870, test_loss: 1.1408, test_f1: 0.5441
 epoch: 64, train_loss: 0.7787, test_loss: 1.1495, test_f1: 0.5440
 epoch: 65, train_loss: 0.7868, test_loss: 1.1070, test_f1: 0.5505
 epoch: 66, train_loss: 0.7872, test_loss: 1.1576, test_f1: 0.5538
 epoch: 67, train_loss: 0.7834, test_loss: 1.1449, test_f1: 0.5354
 epoch: 68, train_loss: 0.7888, test_loss: 1.1451, test_f1: 0.5497
 epoch: 69, train_loss: 0.7734, test_loss: 1.1681, test_f1: 0.5213
 epoch: 70, train_loss: 0.7727, test_loss: 1.1501, test_f1: 0.5324
 epoch: 71, train_loss: 0.7777, test_loss: 1.1574, test_f1: 0.5435
 epoch: 72, train_loss: 0.7993, test_loss: 1.1375, test_f1: 0.5373
 epoch: 73, train_loss: 0.7600, test_loss: 1.1240, test_f1: 0.5360
 epoch: 74, train_loss: 0.7624, test_loss: 1.1571, test_f1: 0.5401
 epoch: 75, train_loss: 0.7631, test_loss: 1.1299, test_f1: 0.5404
 epoch: 76, train_loss: 0.7573, test_loss: 1.1777, test_f1: 0.5492
 epoch: 77, train_loss: 0.7586, test_loss: 1.1674, test_f1: 0.5384
 epoch: 78, train_loss: 0.7692, test_loss: 1.1557, test_f1: 0.5457
 epoch: 79, train_loss: 0.7755, test_loss: 1.1460, test_f1: 0.5300
 epoch: 80, train_loss: 0.7735, test_loss: 1.1749, test_f1: 0.5524
 epoch: 81, train_loss: 0.7628, test_loss: 1.1768, test_f1: 0.5567
 epoch: 82, train_loss: 0.7707, test_loss: 1.1831, test_f1: 0.5600
 epoch: 83, train_loss: 0.7620, test_loss: 1.2050, test_f1: 0.5409
 epoch: 84, train_loss: 0.7588, test_loss: 1.1976, test_f1: 0.5588
 epoch: 85, train_loss: 0.7371, test_loss: 1.2076, test_f1: 0.5615
 epoch: 86, train_loss: 0.7497, test_loss: 1.2032, test_f1: 0.5341
 epoch: 87, train_loss: 0.7500, test_loss: 1.2139, test_f1: 0.5247
 epoch: 88, train_loss: 0.7515, test_loss: 1.2018, test_f1: 0.5358
 epoch: 89, train_loss: 0.7554, test_loss: 1.2208, test_f1: 0.5247
 epoch: 90, train_loss: 0.7518, test_loss: 1.1962, test_f1: 0.5345
 epoch: 91, train_loss: 0.7276, test_loss: 1.2127, test_f1: 0.5452
 epoch: 92, train_loss: 0.7251, test_loss: 1.2015, test_f1: 0.5484
 epoch: 93, train_loss: 0.7482, test_loss: 1.2315, test_f1: 0.5435
 epoch: 94, train_loss: 0.7386, test_loss: 1.2206, test_f1: 0.5479
 epoch: 95, train_loss: 0.7332, test_loss: 1.1931, test_f1: 0.5492
 epoch: 96, train_loss: 0.7536, test_loss: 1.2120, test_f1: 0.5450
 epoch: 97, train_loss: 0.7316, test_loss: 1.2246, test_f1: 0.5372
 epoch: 98, train_loss: 0.7259, test_loss: 1.2369, test_f1: 0.5450
 epoch: 99, train_loss: 0.7201, test_loss: 1.2700, test_f1: 0.5245
##################ITERATION #4 ****************************************
 epoch: 0, train_loss: 1.2626, test_loss: 1.3666, test_f1: 0.2540
 epoch: 1, train_loss: 1.1694, test_loss: 1.2830, test_f1: 0.2848
 epoch: 2, train_loss: 1.1397, test_loss: 1.2169, test_f1: 0.3309
 epoch: 3, train_loss: 1.1203, test_loss: 1.1786, test_f1: 0.3223
 epoch: 4, train_loss: 1.0994, test_loss: 1.1520, test_f1: 0.3713
 epoch: 5, train_loss: 1.0814, test_loss: 1.1399, test_f1: 0.4098
 epoch: 6, train_loss: 1.0697, test_loss: 1.1258, test_f1: 0.4053
 epoch: 7, train_loss: 1.0549, test_loss: 1.1299, test_f1: 0.4527
 epoch: 8, train_loss: 1.0477, test_loss: 1.1145, test_f1: 0.4508
 epoch: 9, train_loss: 1.0241, test_loss: 1.1024, test_f1: 0.4658
 epoch: 10, train_loss: 1.0089, test_loss: 1.0831, test_f1: 0.4795
 epoch: 11, train_loss: 1.0051, test_loss: 1.0815, test_f1: 0.4801
 epoch: 12, train_loss: 0.9891, test_loss: 1.0790, test_f1: 0.4922
 epoch: 13, train_loss: 0.9862, test_loss: 1.0711, test_f1: 0.5056
 epoch: 14, train_loss: 0.9837, test_loss: 1.0570, test_f1: 0.5118
 epoch: 15, train_loss: 0.9661, test_loss: 1.0596, test_f1: 0.5021
 epoch: 16, train_loss: 0.9687, test_loss: 1.0650, test_f1: 0.4893
 epoch: 17, train_loss: 0.9463, test_loss: 1.0448, test_f1: 0.5038
 epoch: 18, train_loss: 0.9370, test_loss: 1.0595, test_f1: 0.4900
 epoch: 19, train_loss: 0.9404, test_loss: 1.0676, test_f1: 0.5105
 epoch: 20, train_loss: 0.9306, test_loss: 1.0440, test_f1: 0.5049
 epoch: 21, train_loss: 0.9357, test_loss: 1.0566, test_f1: 0.4997
 epoch: 22, train_loss: 0.9102, test_loss: 1.0565, test_f1: 0.5159
 epoch: 23, train_loss: 0.9146, test_loss: 1.0479, test_f1: 0.5048
 epoch: 24, train_loss: 0.9055, test_loss: 1.0456, test_f1: 0.5333
 epoch: 25, train_loss: 0.8984, test_loss: 1.0522, test_f1: 0.5116
 epoch: 26, train_loss: 0.8979, test_loss: 1.0433, test_f1: 0.5111
 epoch: 27, train_loss: 0.8911, test_loss: 1.0496, test_f1: 0.5328
 epoch: 28, train_loss: 0.8953, test_loss: 1.0511, test_f1: 0.5174
 epoch: 29, train_loss: 0.8876, test_loss: 1.0456, test_f1: 0.5133
 epoch: 30, train_loss: 0.8708, test_loss: 1.0656, test_f1: 0.5072
 epoch: 31, train_loss: 0.8740, test_loss: 1.0541, test_f1: 0.5329
 epoch: 32, train_loss: 0.8618, test_loss: 1.0550, test_f1: 0.5298
 epoch: 33, train_loss: 0.8544, test_loss: 1.0674, test_f1: 0.5169
 epoch: 34, train_loss: 0.8628, test_loss: 1.0702, test_f1: 0.5482
 epoch: 35, train_loss: 0.8509, test_loss: 1.0733, test_f1: 0.5467
 epoch: 36, train_loss: 0.8534, test_loss: 1.0809, test_f1: 0.5457
 epoch: 37, train_loss: 0.8463, test_loss: 1.0666, test_f1: 0.5373
 epoch: 38, train_loss: 0.8410, test_loss: 1.0577, test_f1: 0.5472
 epoch: 39, train_loss: 0.8363, test_loss: 1.0850, test_f1: 0.5508
 epoch: 40, train_loss: 0.8350, test_loss: 1.0424, test_f1: 0.5608
 epoch: 41, train_loss: 0.8367, test_loss: 1.0701, test_f1: 0.5456
 epoch: 42, train_loss: 0.8328, test_loss: 1.0998, test_f1: 0.5529
 epoch: 43, train_loss: 0.8261, test_loss: 1.0688, test_f1: 0.5496
 epoch: 44, train_loss: 0.8200, test_loss: 1.0990, test_f1: 0.5406
 epoch: 45, train_loss: 0.8219, test_loss: 1.0721, test_f1: 0.5501
 epoch: 46, train_loss: 0.8186, test_loss: 1.0833, test_f1: 0.5636
 epoch: 47, train_loss: 0.7987, test_loss: 1.0687, test_f1: 0.5547
 epoch: 48, train_loss: 0.7914, test_loss: 1.0926, test_f1: 0.5341
 epoch: 49, train_loss: 0.7917, test_loss: 1.1157, test_f1: 0.5358
 epoch: 50, train_loss: 0.7958, test_loss: 1.1193, test_f1: 0.5529
 epoch: 51, train_loss: 0.7884, test_loss: 1.1161, test_f1: 0.5474
 epoch: 52, train_loss: 0.7795, test_loss: 1.1130, test_f1: 0.5451
 epoch: 53, train_loss: 0.7804, test_loss: 1.1238, test_f1: 0.5424
 epoch: 54, train_loss: 0.7579, test_loss: 1.1608, test_f1: 0.5325
 epoch: 55, train_loss: 0.7662, test_loss: 1.1581, test_f1: 0.5297
 epoch: 56, train_loss: 0.7651, test_loss: 1.1616, test_f1: 0.5397
 epoch: 57, train_loss: 0.7677, test_loss: 1.1501, test_f1: 0.5366
 epoch: 58, train_loss: 0.7607, test_loss: 1.1439, test_f1: 0.5380
 epoch: 59, train_loss: 0.7587, test_loss: 1.1685, test_f1: 0.5260
 epoch: 60, train_loss: 0.7565, test_loss: 1.1781, test_f1: 0.5321
 epoch: 61, train_loss: 0.7580, test_loss: 1.1502, test_f1: 0.5391
 epoch: 62, train_loss: 0.7537, test_loss: 1.2044, test_f1: 0.5227
 epoch: 63, train_loss: 0.7739, test_loss: 1.2027, test_f1: 0.5227
 epoch: 64, train_loss: 0.7467, test_loss: 1.1970, test_f1: 0.5533
 epoch: 65, train_loss: 0.7564, test_loss: 1.1587, test_f1: 0.5424
 epoch: 66, train_loss: 0.7569, test_loss: 1.1975, test_f1: 0.5395
 epoch: 67, train_loss: 0.7330, test_loss: 1.1852, test_f1: 0.5469
 epoch: 68, train_loss: 0.7376, test_loss: 1.1972, test_f1: 0.5396
 epoch: 69, train_loss: 0.7414, test_loss: 1.1996, test_f1: 0.5202
 epoch: 70, train_loss: 0.7466, test_loss: 1.2102, test_f1: 0.5293
 epoch: 71, train_loss: 0.7381, test_loss: 1.1597, test_f1: 0.5553
 epoch: 72, train_loss: 0.7332, test_loss: 1.1815, test_f1: 0.5543
 epoch: 73, train_loss: 0.7475, test_loss: 1.1983, test_f1: 0.5366
 epoch: 74, train_loss: 0.7341, test_loss: 1.2006, test_f1: 0.5442
 epoch: 75, train_loss: 0.7244, test_loss: 1.2064, test_f1: 0.5348
 epoch: 76, train_loss: 0.7332, test_loss: 1.1804, test_f1: 0.5416
 epoch: 77, train_loss: 0.7341, test_loss: 1.1893, test_f1: 0.5443
 epoch: 78, train_loss: 0.7451, test_loss: 1.2014, test_f1: 0.5554
 epoch: 79, train_loss: 0.7319, test_loss: 1.1577, test_f1: 0.5350
 epoch: 80, train_loss: 0.7233, test_loss: 1.1951, test_f1: 0.5400
 epoch: 81, train_loss: 0.7271, test_loss: 1.1176, test_f1: 0.5632
 epoch: 82, train_loss: 0.7226, test_loss: 1.1570, test_f1: 0.5606
 epoch: 83, train_loss: 0.7159, test_loss: 1.1429, test_f1: 0.5592
 epoch: 84, train_loss: 0.7318, test_loss: 1.1999, test_f1: 0.5611
 epoch: 85, train_loss: 0.7215, test_loss: 1.1677, test_f1: 0.5535
 epoch: 86, train_loss: 0.7139, test_loss: 1.1980, test_f1: 0.5428
 epoch: 87, train_loss: 0.7147, test_loss: 1.1804, test_f1: 0.5492
 epoch: 88, train_loss: 0.7196, test_loss: 1.1969, test_f1: 0.5443
 epoch: 89, train_loss: 0.7241, test_loss: 1.2038, test_f1: 0.5347
 epoch: 90, train_loss: 0.7176, test_loss: 1.2412, test_f1: 0.5476
 epoch: 91, train_loss: 0.7246, test_loss: 1.2205, test_f1: 0.5600
 epoch: 92, train_loss: 0.7055, test_loss: 1.1932, test_f1: 0.5537
 epoch: 93, train_loss: 0.7214, test_loss: 1.1718, test_f1: 0.5682
 epoch: 94, train_loss: 0.7018, test_loss: 1.1918, test_f1: 0.5633
 epoch: 95, train_loss: 0.7128, test_loss: 1.1741, test_f1: 0.5732
 epoch: 96, train_loss: 0.7113, test_loss: 1.2091, test_f1: 0.5632
 epoch: 97, train_loss: 0.7028, test_loss: 1.1945, test_f1: 0.5589
 epoch: 98, train_loss: 0.7003, test_loss: 1.2003, test_f1: 0.5669
 epoch: 99, train_loss: 0.6963, test_loss: 1.2639, test_f1: 0.5445
##################ITERATION #5 ****************************************
 epoch: 0, train_loss: 1.2189, test_loss: 1.3066, test_f1: 0.2281
 epoch: 1, train_loss: 1.1538, test_loss: 1.2713, test_f1: 0.2626
 epoch: 2, train_loss: 1.1268, test_loss: 1.2549, test_f1: 0.3321
 epoch: 3, train_loss: 1.1135, test_loss: 1.1778, test_f1: 0.3817
 epoch: 4, train_loss: 1.0820, test_loss: 1.1546, test_f1: 0.3944
 epoch: 5, train_loss: 1.0746, test_loss: 1.1425, test_f1: 0.4242
 epoch: 6, train_loss: 1.0711, test_loss: 1.1293, test_f1: 0.4810
 epoch: 7, train_loss: 1.0454, test_loss: 1.1262, test_f1: 0.4494
 epoch: 8, train_loss: 1.0440, test_loss: 1.1121, test_f1: 0.4504
 epoch: 9, train_loss: 1.0352, test_loss: 1.0955, test_f1: 0.4733
 epoch: 10, train_loss: 1.0215, test_loss: 1.0951, test_f1: 0.5039
 epoch: 11, train_loss: 1.0011, test_loss: 1.0980, test_f1: 0.4861
 epoch: 12, train_loss: 1.0030, test_loss: 1.0798, test_f1: 0.4839
 epoch: 13, train_loss: 0.9987, test_loss: 1.0719, test_f1: 0.5158
 epoch: 14, train_loss: 0.9856, test_loss: 1.0604, test_f1: 0.5105
 epoch: 15, train_loss: 0.9648, test_loss: 1.0673, test_f1: 0.5193
 epoch: 16, train_loss: 0.9702, test_loss: 1.0648, test_f1: 0.5136
 epoch: 17, train_loss: 0.9633, test_loss: 1.0655, test_f1: 0.5042
 epoch: 18, train_loss: 0.9586, test_loss: 1.0572, test_f1: 0.5179
 epoch: 19, train_loss: 0.9514, test_loss: 1.0632, test_f1: 0.5214
 epoch: 20, train_loss: 0.9445, test_loss: 1.0707, test_f1: 0.5084
 epoch: 21, train_loss: 0.9505, test_loss: 1.0633, test_f1: 0.5133
 epoch: 22, train_loss: 0.9473, test_loss: 1.0657, test_f1: 0.5142
 epoch: 23, train_loss: 0.9352, test_loss: 1.0664, test_f1: 0.5111
 epoch: 24, train_loss: 0.9350, test_loss: 1.0629, test_f1: 0.5276
 epoch: 25, train_loss: 0.9277, test_loss: 1.0650, test_f1: 0.5169
 epoch: 26, train_loss: 0.9159, test_loss: 1.0608, test_f1: 0.5219
 epoch: 27, train_loss: 0.9087, test_loss: 1.0739, test_f1: 0.5170
 epoch: 28, train_loss: 0.9123, test_loss: 1.0696, test_f1: 0.5242
 epoch: 29, train_loss: 0.9040, test_loss: 1.0592, test_f1: 0.5249
 epoch: 30, train_loss: 0.8876, test_loss: 1.0578, test_f1: 0.5240
 epoch: 31, train_loss: 0.8855, test_loss: 1.0649, test_f1: 0.5293
 epoch: 32, train_loss: 0.8796, test_loss: 1.0589, test_f1: 0.5423
 epoch: 33, train_loss: 0.8897, test_loss: 1.0612, test_f1: 0.5429
 epoch: 34, train_loss: 0.8790, test_loss: 1.0358, test_f1: 0.5402
 epoch: 35, train_loss: 0.8721, test_loss: 1.0791, test_f1: 0.5248
 epoch: 36, train_loss: 0.8667, test_loss: 1.0572, test_f1: 0.5289
 epoch: 37, train_loss: 0.8815, test_loss: 1.0598, test_f1: 0.5534
 epoch: 38, train_loss: 0.8685, test_loss: 1.0744, test_f1: 0.5289
 epoch: 39, train_loss: 0.8697, test_loss: 1.0661, test_f1: 0.5513
 epoch: 40, train_loss: 0.8621, test_loss: 1.0857, test_f1: 0.5614
 epoch: 41, train_loss: 0.8537, test_loss: 1.0419, test_f1: 0.5463
 epoch: 42, train_loss: 0.8500, test_loss: 1.0687, test_f1: 0.5614
 epoch: 43, train_loss: 0.8498, test_loss: 1.0410, test_f1: 0.5449
 epoch: 44, train_loss: 0.8492, test_loss: 1.0521, test_f1: 0.5656
 epoch: 45, train_loss: 0.8428, test_loss: 1.0572, test_f1: 0.5489
 epoch: 46, train_loss: 0.8470, test_loss: 1.0689, test_f1: 0.5690
 epoch: 47, train_loss: 0.8449, test_loss: 1.0516, test_f1: 0.5700
 epoch: 48, train_loss: 0.8468, test_loss: 1.0387, test_f1: 0.5476
 epoch: 49, train_loss: 0.8277, test_loss: 1.0717, test_f1: 0.5621
 epoch: 50, train_loss: 0.8410, test_loss: 1.0571, test_f1: 0.5587
 epoch: 51, train_loss: 0.8206, test_loss: 1.0472, test_f1: 0.5540
 epoch: 52, train_loss: 0.8203, test_loss: 1.0582, test_f1: 0.5540
 epoch: 53, train_loss: 0.8209, test_loss: 1.0454, test_f1: 0.5701
 epoch: 54, train_loss: 0.8072, test_loss: 1.0599, test_f1: 0.5639
 epoch: 55, train_loss: 0.8178, test_loss: 1.0480, test_f1: 0.5544
 epoch: 56, train_loss: 0.8114, test_loss: 1.0610, test_f1: 0.5572
 epoch: 57, train_loss: 0.8045, test_loss: 1.0602, test_f1: 0.5460
 epoch: 58, train_loss: 0.8067, test_loss: 1.0523, test_f1: 0.5668
 epoch: 59, train_loss: 0.7958, test_loss: 1.0597, test_f1: 0.5595
 epoch: 60, train_loss: 0.7956, test_loss: 1.0587, test_f1: 0.5628
 epoch: 61, train_loss: 0.7908, test_loss: 1.0631, test_f1: 0.5649
 epoch: 62, train_loss: 0.7867, test_loss: 1.0601, test_f1: 0.5544
 epoch: 63, train_loss: 0.7905, test_loss: 1.0749, test_f1: 0.5512
 epoch: 64, train_loss: 0.7777, test_loss: 1.0817, test_f1: 0.5636
 epoch: 65, train_loss: 0.7993, test_loss: 1.0636, test_f1: 0.5633
 epoch: 66, train_loss: 0.8038, test_loss: 1.0650, test_f1: 0.5686
 epoch: 67, train_loss: 0.7977, test_loss: 1.0686, test_f1: 0.5738
 epoch: 68, train_loss: 0.7955, test_loss: 1.0975, test_f1: 0.5605
 epoch: 69, train_loss: 0.7922, test_loss: 1.0838, test_f1: 0.5703
 epoch: 70, train_loss: 0.7840, test_loss: 1.0793, test_f1: 0.5640
 epoch: 71, train_loss: 0.7865, test_loss: 1.1045, test_f1: 0.5570
 epoch: 72, train_loss: 0.7699, test_loss: 1.0921, test_f1: 0.5649
 epoch: 73, train_loss: 0.7886, test_loss: 1.0849, test_f1: 0.5618
 epoch: 74, train_loss: 0.7848, test_loss: 1.0858, test_f1: 0.5590
 epoch: 75, train_loss: 0.7773, test_loss: 1.0956, test_f1: 0.5661
 epoch: 76, train_loss: 0.7718, test_loss: 1.0778, test_f1: 0.5764
 epoch: 77, train_loss: 0.7728, test_loss: 1.0716, test_f1: 0.5700
 epoch: 78, train_loss: 0.7755, test_loss: 1.0805, test_f1: 0.5796
 epoch: 79, train_loss: 0.7587, test_loss: 1.0716, test_f1: 0.5765
 epoch: 80, train_loss: 0.7776, test_loss: 1.0841, test_f1: 0.5698
 epoch: 81, train_loss: 0.7727, test_loss: 1.0911, test_f1: 0.5622
 epoch: 82, train_loss: 0.7833, test_loss: 1.0652, test_f1: 0.5668
 epoch: 83, train_loss: 0.7598, test_loss: 1.0863, test_f1: 0.5681
 epoch: 84, train_loss: 0.7711, test_loss: 1.0897, test_f1: 0.5704
 epoch: 85, train_loss: 0.7726, test_loss: 1.0706, test_f1: 0.5748
 epoch: 86, train_loss: 0.7607, test_loss: 1.0724, test_f1: 0.5698
 epoch: 87, train_loss: 0.7638, test_loss: 1.0802, test_f1: 0.5731
 epoch: 88, train_loss: 0.7582, test_loss: 1.1150, test_f1: 0.5518
 epoch: 89, train_loss: 0.7599, test_loss: 1.1066, test_f1: 0.5655
 epoch: 90, train_loss: 0.7489, test_loss: 1.0979, test_f1: 0.5848
 epoch: 91, train_loss: 0.7397, test_loss: 1.0949, test_f1: 0.5732
 epoch: 92, train_loss: 0.7630, test_loss: 1.1109, test_f1: 0.5686
 epoch: 93, train_loss: 0.7545, test_loss: 1.1267, test_f1: 0.5716
 epoch: 94, train_loss: 0.7493, test_loss: 1.1227, test_f1: 0.5725
 epoch: 95, train_loss: 0.7384, test_loss: 1.0981, test_f1: 0.5750
 epoch: 96, train_loss: 0.7366, test_loss: 1.1101, test_f1: 0.5724
 epoch: 97, train_loss: 0.7432, test_loss: 1.1094, test_f1: 0.5665
 epoch: 98, train_loss: 0.7454, test_loss: 1.1292, test_f1: 0.5650
 epoch: 99, train_loss: 0.7427, test_loss: 1.1120, test_f1: 0.5644
##################ITERATION #6 ****************************************
 epoch: 0, train_loss: 1.2110, test_loss: 1.3177, test_f1: 0.2281
 epoch: 1, train_loss: 1.1455, test_loss: 1.3061, test_f1: 0.2486
 epoch: 2, train_loss: 1.1133, test_loss: 1.2155, test_f1: 0.3036
 epoch: 3, train_loss: 1.0915, test_loss: 1.1470, test_f1: 0.4192
 epoch: 4, train_loss: 1.0800, test_loss: 1.1240, test_f1: 0.4538
 epoch: 5, train_loss: 1.0587, test_loss: 1.1135, test_f1: 0.4542
 epoch: 6, train_loss: 1.0469, test_loss: 1.0992, test_f1: 0.4694
 epoch: 7, train_loss: 1.0456, test_loss: 1.0888, test_f1: 0.4833
 epoch: 8, train_loss: 1.0192, test_loss: 1.0826, test_f1: 0.4727
 epoch: 9, train_loss: 1.0151, test_loss: 1.0608, test_f1: 0.4881
 epoch: 10, train_loss: 1.0098, test_loss: 1.0531, test_f1: 0.5053
 epoch: 11, train_loss: 1.0017, test_loss: 1.0543, test_f1: 0.5293
 epoch: 12, train_loss: 0.9883, test_loss: 1.0714, test_f1: 0.5100
 epoch: 13, train_loss: 0.9812, test_loss: 1.0492, test_f1: 0.5037
 epoch: 14, train_loss: 0.9761, test_loss: 1.0467, test_f1: 0.5095
 epoch: 15, train_loss: 0.9579, test_loss: 1.0425, test_f1: 0.5372
 epoch: 16, train_loss: 0.9568, test_loss: 1.0286, test_f1: 0.5562
 epoch: 17, train_loss: 0.9508, test_loss: 1.0418, test_f1: 0.5361
 epoch: 18, train_loss: 0.9500, test_loss: 1.0458, test_f1: 0.5539
 epoch: 19, train_loss: 0.9355, test_loss: 1.0506, test_f1: 0.5476
 epoch: 20, train_loss: 0.9332, test_loss: 1.0280, test_f1: 0.5606
 epoch: 21, train_loss: 0.9207, test_loss: 1.0488, test_f1: 0.5460
 epoch: 22, train_loss: 0.9256, test_loss: 1.0394, test_f1: 0.5597
 epoch: 23, train_loss: 0.9247, test_loss: 1.0388, test_f1: 0.5664
 epoch: 24, train_loss: 0.9016, test_loss: 1.0257, test_f1: 0.5471
 epoch: 25, train_loss: 0.8948, test_loss: 1.0203, test_f1: 0.5805
 epoch: 26, train_loss: 0.9041, test_loss: 1.0715, test_f1: 0.5524
 epoch: 27, train_loss: 0.8983, test_loss: 1.0339, test_f1: 0.5599
 epoch: 28, train_loss: 0.8901, test_loss: 1.0497, test_f1: 0.5810
 epoch: 29, train_loss: 0.8871, test_loss: 1.0458, test_f1: 0.5888
 epoch: 30, train_loss: 0.8788, test_loss: 1.0666, test_f1: 0.5734
 epoch: 31, train_loss: 0.8846, test_loss: 1.0839, test_f1: 0.5653
 epoch: 32, train_loss: 0.8719, test_loss: 1.0653, test_f1: 0.5821
 epoch: 33, train_loss: 0.8632, test_loss: 1.0983, test_f1: 0.5606
 epoch: 34, train_loss: 0.8550, test_loss: 1.0725, test_f1: 0.5793
 epoch: 35, train_loss: 0.8761, test_loss: 1.0822, test_f1: 0.5740
 epoch: 36, train_loss: 0.8423, test_loss: 1.0882, test_f1: 0.5702
 epoch: 37, train_loss: 0.8509, test_loss: 1.0906, test_f1: 0.5684
 epoch: 38, train_loss: 0.8531, test_loss: 1.0644, test_f1: 0.5809
 epoch: 39, train_loss: 0.8445, test_loss: 1.0856, test_f1: 0.5685
 epoch: 40, train_loss: 0.8469, test_loss: 1.0593, test_f1: 0.5736
 epoch: 41, train_loss: 0.8296, test_loss: 1.0651, test_f1: 0.5739
 epoch: 42, train_loss: 0.8302, test_loss: 1.0882, test_f1: 0.5707
 epoch: 43, train_loss: 0.8221, test_loss: 1.1151, test_f1: 0.5787
 epoch: 44, train_loss: 0.8179, test_loss: 1.1042, test_f1: 0.5813
 epoch: 45, train_loss: 0.8262, test_loss: 1.1146, test_f1: 0.5846
 epoch: 46, train_loss: 0.8295, test_loss: 1.0761, test_f1: 0.5743
 epoch: 47, train_loss: 0.8035, test_loss: 1.1002, test_f1: 0.5871
 epoch: 48, train_loss: 0.8016, test_loss: 1.1033, test_f1: 0.5873
 epoch: 49, train_loss: 0.8006, test_loss: 1.1125, test_f1: 0.5723
 epoch: 50, train_loss: 0.7954, test_loss: 1.0734, test_f1: 0.5868
 epoch: 51, train_loss: 0.7953, test_loss: 1.0950, test_f1: 0.5811
 epoch: 52, train_loss: 0.7917, test_loss: 1.0957, test_f1: 0.5782
 epoch: 53, train_loss: 0.7825, test_loss: 1.1157, test_f1: 0.5804
 epoch: 54, train_loss: 0.7779, test_loss: 1.1151, test_f1: 0.5835
 epoch: 55, train_loss: 0.7792, test_loss: 1.1190, test_f1: 0.5971
 epoch: 56, train_loss: 0.7955, test_loss: 1.1024, test_f1: 0.6014
 epoch: 57, train_loss: 0.7851, test_loss: 1.0839, test_f1: 0.5920
 epoch: 58, train_loss: 0.7872, test_loss: 1.1187, test_f1: 0.5972
 epoch: 59, train_loss: 0.7725, test_loss: 1.1197, test_f1: 0.5922
 epoch: 60, train_loss: 0.7752, test_loss: 1.1270, test_f1: 0.5861
 epoch: 61, train_loss: 0.7581, test_loss: 1.1332, test_f1: 0.5925
 epoch: 62, train_loss: 0.7744, test_loss: 1.1288, test_f1: 0.5948
 epoch: 63, train_loss: 0.7720, test_loss: 1.1207, test_f1: 0.5950
 epoch: 64, train_loss: 0.7767, test_loss: 1.1347, test_f1: 0.5984
 epoch: 65, train_loss: 0.7768, test_loss: 1.1138, test_f1: 0.5951
 epoch: 66, train_loss: 0.7696, test_loss: 1.1285, test_f1: 0.5816
 epoch: 67, train_loss: 0.7747, test_loss: 1.1460, test_f1: 0.5842
 epoch: 68, train_loss: 0.7575, test_loss: 1.1352, test_f1: 0.5825
 epoch: 69, train_loss: 0.7873, test_loss: 1.1358, test_f1: 0.5740
 epoch: 70, train_loss: 0.7659, test_loss: 1.1546, test_f1: 0.5848
 epoch: 71, train_loss: 0.7635, test_loss: 1.1429, test_f1: 0.5975
 epoch: 72, train_loss: 0.7569, test_loss: 1.1528, test_f1: 0.5895
 epoch: 73, train_loss: 0.7533, test_loss: 1.1461, test_f1: 0.5893
 epoch: 74, train_loss: 0.7536, test_loss: 1.1585, test_f1: 0.5951
 epoch: 75, train_loss: 0.7668, test_loss: 1.1271, test_f1: 0.5869
 epoch: 76, train_loss: 0.7389, test_loss: 1.1387, test_f1: 0.5925
 epoch: 77, train_loss: 0.7553, test_loss: 1.1391, test_f1: 0.6086
 epoch: 78, train_loss: 0.7362, test_loss: 1.1248, test_f1: 0.5962
 epoch: 79, train_loss: 0.7397, test_loss: 1.1580, test_f1: 0.5900
 epoch: 80, train_loss: 0.7414, test_loss: 1.1575, test_f1: 0.5998
 epoch: 81, train_loss: 0.7281, test_loss: 1.1711, test_f1: 0.6140
 epoch: 82, train_loss: 0.7334, test_loss: 1.1430, test_f1: 0.6016
 epoch: 83, train_loss: 0.7494, test_loss: 1.1338, test_f1: 0.6064
 epoch: 84, train_loss: 0.7328, test_loss: 1.1598, test_f1: 0.6031
 epoch: 85, train_loss: 0.7374, test_loss: 1.1969, test_f1: 0.5956
 epoch: 86, train_loss: 0.7368, test_loss: 1.2100, test_f1: 0.5858
 epoch: 87, train_loss: 0.7326, test_loss: 1.1945, test_f1: 0.5888
 epoch: 88, train_loss: 0.7182, test_loss: 1.1931, test_f1: 0.5903
 epoch: 89, train_loss: 0.7258, test_loss: 1.1862, test_f1: 0.5852
 epoch: 90, train_loss: 0.7336, test_loss: 1.1287, test_f1: 0.6010
 epoch: 91, train_loss: 0.7328, test_loss: 1.1808, test_f1: 0.6015
 epoch: 92, train_loss: 0.7332, test_loss: 1.1974, test_f1: 0.5943
 epoch: 93, train_loss: 0.7198, test_loss: 1.1991, test_f1: 0.5987
 epoch: 94, train_loss: 0.7270, test_loss: 1.2089, test_f1: 0.6037
 epoch: 95, train_loss: 0.7099, test_loss: 1.1970, test_f1: 0.6038
 epoch: 96, train_loss: 0.7095, test_loss: 1.1976, test_f1: 0.5931
 epoch: 97, train_loss: 0.7219, test_loss: 1.2062, test_f1: 0.5790
 epoch: 98, train_loss: 0.7164, test_loss: 1.1808, test_f1: 0.5850
 epoch: 99, train_loss: 0.7099, test_loss: 1.2183, test_f1: 0.5822
##################ITERATION #7 ****************************************
 epoch: 0, train_loss: 1.2275, test_loss: 1.3655, test_f1: 0.2242
 epoch: 1, train_loss: 1.1385, test_loss: 1.2599, test_f1: 0.3536
 epoch: 2, train_loss: 1.1135, test_loss: 1.2275, test_f1: 0.3793
 epoch: 3, train_loss: 1.0902, test_loss: 1.1659, test_f1: 0.4333
 epoch: 4, train_loss: 1.0776, test_loss: 1.1586, test_f1: 0.4126
 epoch: 5, train_loss: 1.0596, test_loss: 1.1253, test_f1: 0.3969
 epoch: 6, train_loss: 1.0435, test_loss: 1.1266, test_f1: 0.4091
 epoch: 7, train_loss: 1.0364, test_loss: 1.1090, test_f1: 0.4401
 epoch: 8, train_loss: 1.0161, test_loss: 1.0886, test_f1: 0.4489
 epoch: 9, train_loss: 1.0091, test_loss: 1.0915, test_f1: 0.4492
 epoch: 10, train_loss: 0.9968, test_loss: 1.0926, test_f1: 0.4806
 epoch: 11, train_loss: 0.9946, test_loss: 1.0878, test_f1: 0.4777
 epoch: 12, train_loss: 0.9862, test_loss: 1.0904, test_f1: 0.4806
 epoch: 13, train_loss: 0.9829, test_loss: 1.0670, test_f1: 0.4621
 epoch: 14, train_loss: 0.9514, test_loss: 1.0668, test_f1: 0.4915
 epoch: 15, train_loss: 0.9676, test_loss: 1.0852, test_f1: 0.5038
 epoch: 16, train_loss: 0.9539, test_loss: 1.0697, test_f1: 0.5054
 epoch: 17, train_loss: 0.9528, test_loss: 1.0662, test_f1: 0.5022
 epoch: 18, train_loss: 0.9492, test_loss: 1.0558, test_f1: 0.5000
 epoch: 19, train_loss: 0.9265, test_loss: 1.0534, test_f1: 0.5200
 epoch: 20, train_loss: 0.9291, test_loss: 1.0668, test_f1: 0.5125
 epoch: 21, train_loss: 0.9197, test_loss: 1.0538, test_f1: 0.5215
 epoch: 22, train_loss: 0.9322, test_loss: 1.0538, test_f1: 0.5295
 epoch: 23, train_loss: 0.9188, test_loss: 1.0445, test_f1: 0.5233
 epoch: 24, train_loss: 0.9114, test_loss: 1.0429, test_f1: 0.5210
 epoch: 25, train_loss: 0.8986, test_loss: 1.0373, test_f1: 0.5278
 epoch: 26, train_loss: 0.9000, test_loss: 1.0343, test_f1: 0.5274
 epoch: 27, train_loss: 0.8977, test_loss: 1.0336, test_f1: 0.5361
 epoch: 28, train_loss: 0.8884, test_loss: 1.0389, test_f1: 0.5470
 epoch: 29, train_loss: 0.8916, test_loss: 1.0347, test_f1: 0.5567
 epoch: 30, train_loss: 0.8867, test_loss: 1.0602, test_f1: 0.5365
 epoch: 31, train_loss: 0.8673, test_loss: 1.0557, test_f1: 0.5537
 epoch: 32, train_loss: 0.8792, test_loss: 1.0637, test_f1: 0.5450
 epoch: 33, train_loss: 0.8698, test_loss: 1.0530, test_f1: 0.5439
 epoch: 34, train_loss: 0.8604, test_loss: 1.0564, test_f1: 0.5555
 epoch: 35, train_loss: 0.8669, test_loss: 1.0995, test_f1: 0.5447
 epoch: 36, train_loss: 0.8493, test_loss: 1.0712, test_f1: 0.5562
 epoch: 37, train_loss: 0.8649, test_loss: 1.0930, test_f1: 0.5620
 epoch: 38, train_loss: 0.8543, test_loss: 1.0714, test_f1: 0.5763
 epoch: 39, train_loss: 0.8500, test_loss: 1.0614, test_f1: 0.5603
 epoch: 40, train_loss: 0.8403, test_loss: 1.0698, test_f1: 0.5501
 epoch: 41, train_loss: 0.8430, test_loss: 1.0960, test_f1: 0.5484
 epoch: 42, train_loss: 0.8356, test_loss: 1.0699, test_f1: 0.5637
 epoch: 43, train_loss: 0.8495, test_loss: 1.0798, test_f1: 0.5612
 epoch: 44, train_loss: 0.8381, test_loss: 1.0959, test_f1: 0.5662
 epoch: 45, train_loss: 0.8384, test_loss: 1.0865, test_f1: 0.5688
 epoch: 46, train_loss: 0.8329, test_loss: 1.0995, test_f1: 0.5510
 epoch: 47, train_loss: 0.8288, test_loss: 1.1064, test_f1: 0.5535
 epoch: 48, train_loss: 0.8334, test_loss: 1.1255, test_f1: 0.5570
 epoch: 49, train_loss: 0.8233, test_loss: 1.1165, test_f1: 0.5605
 epoch: 50, train_loss: 0.8228, test_loss: 1.0941, test_f1: 0.5507
 epoch: 51, train_loss: 0.8223, test_loss: 1.1030, test_f1: 0.5561
 epoch: 52, train_loss: 0.8237, test_loss: 1.1091, test_f1: 0.5479
 epoch: 53, train_loss: 0.8088, test_loss: 1.1263, test_f1: 0.5570
 epoch: 54, train_loss: 0.8059, test_loss: 1.1414, test_f1: 0.5555
 epoch: 55, train_loss: 0.8160, test_loss: 1.1453, test_f1: 0.5413
 epoch: 56, train_loss: 0.8096, test_loss: 1.1349, test_f1: 0.5525
 epoch: 57, train_loss: 0.7983, test_loss: 1.1336, test_f1: 0.5460
 epoch: 58, train_loss: 0.7926, test_loss: 1.1389, test_f1: 0.5485
 epoch: 59, train_loss: 0.8018, test_loss: 1.1377, test_f1: 0.5592
 epoch: 60, train_loss: 0.7869, test_loss: 1.1623, test_f1: 0.5490
 epoch: 61, train_loss: 0.7960, test_loss: 1.1364, test_f1: 0.5553
 epoch: 62, train_loss: 0.7916, test_loss: 1.1439, test_f1: 0.5536
 epoch: 63, train_loss: 0.7845, test_loss: 1.1379, test_f1: 0.5548
 epoch: 64, train_loss: 0.7865, test_loss: 1.1459, test_f1: 0.5448
 epoch: 65, train_loss: 0.7846, test_loss: 1.1491, test_f1: 0.5476
 epoch: 66, train_loss: 0.7912, test_loss: 1.1348, test_f1: 0.5494
 epoch: 67, train_loss: 0.7967, test_loss: 1.1429, test_f1: 0.5622
 epoch: 68, train_loss: 0.7818, test_loss: 1.1395, test_f1: 0.5643
 epoch: 69, train_loss: 0.7829, test_loss: 1.1714, test_f1: 0.5631
 epoch: 70, train_loss: 0.7785, test_loss: 1.1733, test_f1: 0.5613
 epoch: 71, train_loss: 0.7752, test_loss: 1.1674, test_f1: 0.5536
 epoch: 72, train_loss: 0.7739, test_loss: 1.1602, test_f1: 0.5556
 epoch: 73, train_loss: 0.7652, test_loss: 1.1528, test_f1: 0.5529
 epoch: 74, train_loss: 0.7649, test_loss: 1.1750, test_f1: 0.5505
 epoch: 75, train_loss: 0.7672, test_loss: 1.1655, test_f1: 0.5533
 epoch: 76, train_loss: 0.7717, test_loss: 1.1637, test_f1: 0.5553
 epoch: 77, train_loss: 0.7523, test_loss: 1.1992, test_f1: 0.5424
 epoch: 78, train_loss: 0.7718, test_loss: 1.2015, test_f1: 0.5360
 epoch: 79, train_loss: 0.7618, test_loss: 1.2069, test_f1: 0.5608
 epoch: 80, train_loss: 0.7682, test_loss: 1.2128, test_f1: 0.5486
 epoch: 81, train_loss: 0.7599, test_loss: 1.2115, test_f1: 0.5538
 epoch: 82, train_loss: 0.7445, test_loss: 1.1936, test_f1: 0.5526
 epoch: 83, train_loss: 0.7704, test_loss: 1.2027, test_f1: 0.5413
 epoch: 84, train_loss: 0.7591, test_loss: 1.2161, test_f1: 0.5514
 epoch: 85, train_loss: 0.7621, test_loss: 1.2047, test_f1: 0.5700
 epoch: 86, train_loss: 0.7607, test_loss: 1.2059, test_f1: 0.5730
 epoch: 87, train_loss: 0.7627, test_loss: 1.2030, test_f1: 0.5552
 epoch: 88, train_loss: 0.7404, test_loss: 1.2239, test_f1: 0.5440
 epoch: 89, train_loss: 0.7392, test_loss: 1.2106, test_f1: 0.5524
 epoch: 90, train_loss: 0.7519, test_loss: 1.1894, test_f1: 0.5661
 epoch: 91, train_loss: 0.7614, test_loss: 1.2173, test_f1: 0.5554
 epoch: 92, train_loss: 0.7354, test_loss: 1.1949, test_f1: 0.5677
 epoch: 93, train_loss: 0.7509, test_loss: 1.2297, test_f1: 0.5565
 epoch: 94, train_loss: 0.7473, test_loss: 1.2192, test_f1: 0.5588
 epoch: 95, train_loss: 0.7375, test_loss: 1.2074, test_f1: 0.5635
 epoch: 96, train_loss: 0.7314, test_loss: 1.2237, test_f1: 0.5561
 epoch: 97, train_loss: 0.7450, test_loss: 1.2194, test_f1: 0.5596
 epoch: 98, train_loss: 0.7388, test_loss: 1.2628, test_f1: 0.5462
 epoch: 99, train_loss: 0.7319, test_loss: 1.2403, test_f1: 0.5598
##################ITERATION #8 ****************************************
 epoch: 0, train_loss: 1.2383, test_loss: 1.3446, test_f1: 0.2885
 epoch: 1, train_loss: 1.1439, test_loss: 1.2609, test_f1: 0.3544
 epoch: 2, train_loss: 1.1340, test_loss: 1.2077, test_f1: 0.4388
 epoch: 3, train_loss: 1.1166, test_loss: 1.1798, test_f1: 0.4487
 epoch: 4, train_loss: 1.1034, test_loss: 1.1821, test_f1: 0.4652
 epoch: 5, train_loss: 1.0809, test_loss: 1.1938, test_f1: 0.4684
 epoch: 6, train_loss: 1.0693, test_loss: 1.1810, test_f1: 0.4756
 epoch: 7, train_loss: 1.0579, test_loss: 1.1583, test_f1: 0.4956
 epoch: 8, train_loss: 1.0513, test_loss: 1.1554, test_f1: 0.5044
 epoch: 9, train_loss: 1.0351, test_loss: 1.1590, test_f1: 0.5181
 epoch: 10, train_loss: 1.0273, test_loss: 1.1455, test_f1: 0.5218
 epoch: 11, train_loss: 1.0214, test_loss: 1.1503, test_f1: 0.5333
 epoch: 12, train_loss: 1.0108, test_loss: 1.1199, test_f1: 0.5342
 epoch: 13, train_loss: 1.0125, test_loss: 1.1092, test_f1: 0.5358
 epoch: 14, train_loss: 0.9952, test_loss: 1.1086, test_f1: 0.5282
 epoch: 15, train_loss: 1.0022, test_loss: 1.1088, test_f1: 0.5270
 epoch: 16, train_loss: 0.9820, test_loss: 1.1074, test_f1: 0.5076
 epoch: 17, train_loss: 0.9832, test_loss: 1.1010, test_f1: 0.5361
 epoch: 18, train_loss: 0.9765, test_loss: 1.0966, test_f1: 0.5441
 epoch: 19, train_loss: 0.9575, test_loss: 1.0931, test_f1: 0.5405
 epoch: 20, train_loss: 0.9614, test_loss: 1.0872, test_f1: 0.5446
 epoch: 21, train_loss: 0.9619, test_loss: 1.0988, test_f1: 0.5288
 epoch: 22, train_loss: 0.9368, test_loss: 1.0860, test_f1: 0.5514
 epoch: 23, train_loss: 0.9502, test_loss: 1.1194, test_f1: 0.5398
 epoch: 24, train_loss: 0.9322, test_loss: 1.1087, test_f1: 0.5550
 epoch: 25, train_loss: 0.9307, test_loss: 1.1245, test_f1: 0.5579
 epoch: 26, train_loss: 0.9320, test_loss: 1.1312, test_f1: 0.5526
 epoch: 27, train_loss: 0.9331, test_loss: 1.1126, test_f1: 0.5542
 epoch: 28, train_loss: 0.9173, test_loss: 1.1360, test_f1: 0.5486
 epoch: 29, train_loss: 0.9169, test_loss: 1.1215, test_f1: 0.5692
 epoch: 30, train_loss: 0.8996, test_loss: 1.1253, test_f1: 0.5853
 epoch: 31, train_loss: 0.9133, test_loss: 1.1015, test_f1: 0.5724
 epoch: 32, train_loss: 0.9098, test_loss: 1.0977, test_f1: 0.5693
 epoch: 33, train_loss: 0.8919, test_loss: 1.0968, test_f1: 0.5737
 epoch: 34, train_loss: 0.8904, test_loss: 1.0991, test_f1: 0.5730
 epoch: 35, train_loss: 0.8903, test_loss: 1.1212, test_f1: 0.5608
 epoch: 36, train_loss: 0.8924, test_loss: 1.1147, test_f1: 0.5893
 epoch: 37, train_loss: 0.8778, test_loss: 1.1417, test_f1: 0.5953
 epoch: 38, train_loss: 0.8821, test_loss: 1.1028, test_f1: 0.6018
 epoch: 39, train_loss: 0.8690, test_loss: 1.1063, test_f1: 0.5975
 epoch: 40, train_loss: 0.8835, test_loss: 1.1383, test_f1: 0.5729
 epoch: 41, train_loss: 0.8867, test_loss: 1.1034, test_f1: 0.5890
 epoch: 42, train_loss: 0.8471, test_loss: 1.1484, test_f1: 0.5826
 epoch: 43, train_loss: 0.8603, test_loss: 1.1331, test_f1: 0.5885
 epoch: 44, train_loss: 0.8448, test_loss: 1.1426, test_f1: 0.5921
 epoch: 45, train_loss: 0.8463, test_loss: 1.1164, test_f1: 0.5982
 epoch: 46, train_loss: 0.8487, test_loss: 1.1527, test_f1: 0.6062
 epoch: 47, train_loss: 0.8495, test_loss: 1.1944, test_f1: 0.5850
 epoch: 48, train_loss: 0.8353, test_loss: 1.1787, test_f1: 0.5956
 epoch: 49, train_loss: 0.8455, test_loss: 1.1889, test_f1: 0.6054
 epoch: 50, train_loss: 0.8384, test_loss: 1.1760, test_f1: 0.6073
 epoch: 51, train_loss: 0.8200, test_loss: 1.1967, test_f1: 0.6075
 epoch: 52, train_loss: 0.8210, test_loss: 1.1837, test_f1: 0.6045
 epoch: 53, train_loss: 0.8292, test_loss: 1.2008, test_f1: 0.5989
 epoch: 54, train_loss: 0.8210, test_loss: 1.1918, test_f1: 0.6021
 epoch: 55, train_loss: 0.8056, test_loss: 1.1926, test_f1: 0.5913
 epoch: 56, train_loss: 0.8114, test_loss: 1.2079, test_f1: 0.5972
 epoch: 57, train_loss: 0.8143, test_loss: 1.2163, test_f1: 0.5905
 epoch: 58, train_loss: 0.8185, test_loss: 1.2259, test_f1: 0.6180
 epoch: 59, train_loss: 0.8086, test_loss: 1.2308, test_f1: 0.6183
 epoch: 60, train_loss: 0.8125, test_loss: 1.2497, test_f1: 0.6019
 epoch: 61, train_loss: 0.8179, test_loss: 1.2261, test_f1: 0.6201
 epoch: 62, train_loss: 0.7933, test_loss: 1.2429, test_f1: 0.6168
 epoch: 63, train_loss: 0.7966, test_loss: 1.2594, test_f1: 0.6151
 epoch: 64, train_loss: 0.8033, test_loss: 1.2654, test_f1: 0.6019
 epoch: 65, train_loss: 0.8059, test_loss: 1.2442, test_f1: 0.6122
 epoch: 66, train_loss: 0.7972, test_loss: 1.2732, test_f1: 0.5968
 epoch: 67, train_loss: 0.7955, test_loss: 1.2349, test_f1: 0.6068
 epoch: 68, train_loss: 0.7912, test_loss: 1.2699, test_f1: 0.5954
 epoch: 69, train_loss: 0.7855, test_loss: 1.2422, test_f1: 0.5992
 epoch: 70, train_loss: 0.7880, test_loss: 1.2181, test_f1: 0.6021
 epoch: 71, train_loss: 0.7935, test_loss: 1.2246, test_f1: 0.5879
 epoch: 72, train_loss: 0.7894, test_loss: 1.2281, test_f1: 0.5957
 epoch: 73, train_loss: 0.7905, test_loss: 1.2344, test_f1: 0.5881
 epoch: 74, train_loss: 0.7904, test_loss: 1.2228, test_f1: 0.5978
 epoch: 75, train_loss: 0.7955, test_loss: 1.2173, test_f1: 0.5913
 epoch: 76, train_loss: 0.7716, test_loss: 1.2340, test_f1: 0.5869
 epoch: 77, train_loss: 0.7850, test_loss: 1.2368, test_f1: 0.5918
 epoch: 78, train_loss: 0.7713, test_loss: 1.2434, test_f1: 0.5918
 epoch: 79, train_loss: 0.8038, test_loss: 1.2551, test_f1: 0.5919
 epoch: 80, train_loss: 0.7757, test_loss: 1.2461, test_f1: 0.5943
 epoch: 81, train_loss: 0.7821, test_loss: 1.2329, test_f1: 0.5937
 epoch: 82, train_loss: 0.7833, test_loss: 1.2424, test_f1: 0.6019
 epoch: 83, train_loss: 0.7695, test_loss: 1.2571, test_f1: 0.5893
 epoch: 84, train_loss: 0.7836, test_loss: 1.2492, test_f1: 0.5940
 epoch: 85, train_loss: 0.7789, test_loss: 1.2847, test_f1: 0.5884
 epoch: 86, train_loss: 0.7700, test_loss: 1.2838, test_f1: 0.5982
 epoch: 87, train_loss: 0.7640, test_loss: 1.2995, test_f1: 0.5898
 epoch: 88, train_loss: 0.7627, test_loss: 1.3007, test_f1: 0.5778
 epoch: 89, train_loss: 0.7792, test_loss: 1.2879, test_f1: 0.5719
 epoch: 90, train_loss: 0.7706, test_loss: 1.3036, test_f1: 0.5833
 epoch: 91, train_loss: 0.7608, test_loss: 1.3238, test_f1: 0.5883
 epoch: 92, train_loss: 0.7706, test_loss: 1.2931, test_f1: 0.5975
 epoch: 93, train_loss: 0.7628, test_loss: 1.3095, test_f1: 0.5826
 epoch: 94, train_loss: 0.7630, test_loss: 1.2961, test_f1: 0.5986
 epoch: 95, train_loss: 0.7684, test_loss: 1.2652, test_f1: 0.5980
 epoch: 96, train_loss: 0.7689, test_loss: 1.2674, test_f1: 0.5872
 epoch: 97, train_loss: 0.7573, test_loss: 1.3157, test_f1: 0.5860
 epoch: 98, train_loss: 0.7487, test_loss: 1.3005, test_f1: 0.5763
 epoch: 99, train_loss: 0.7510, test_loss: 1.3249, test_f1: 0.5825
##################ITERATION #9 ****************************************
 epoch: 0, train_loss: 1.2399, test_loss: 1.2800, test_f1: 0.2281
 epoch: 1, train_loss: 1.1460, test_loss: 1.2492, test_f1: 0.2998
 epoch: 2, train_loss: 1.1117, test_loss: 1.2237, test_f1: 0.4026
 epoch: 3, train_loss: 1.0895, test_loss: 1.1516, test_f1: 0.4526
 epoch: 4, train_loss: 1.0734, test_loss: 1.1226, test_f1: 0.4606
 epoch: 5, train_loss: 1.0477, test_loss: 1.1117, test_f1: 0.4731
 epoch: 6, train_loss: 1.0517, test_loss: 1.0997, test_f1: 0.5000
 epoch: 7, train_loss: 1.0522, test_loss: 1.0913, test_f1: 0.4888
 epoch: 8, train_loss: 1.0124, test_loss: 1.0819, test_f1: 0.5017
 epoch: 9, train_loss: 1.0095, test_loss: 1.0865, test_f1: 0.5151
 epoch: 10, train_loss: 1.0092, test_loss: 1.0824, test_f1: 0.5180
 epoch: 11, train_loss: 1.0068, test_loss: 1.0648, test_f1: 0.5150
 epoch: 12, train_loss: 0.9888, test_loss: 1.0841, test_f1: 0.4972
 epoch: 13, train_loss: 0.9901, test_loss: 1.0788, test_f1: 0.5249
 epoch: 14, train_loss: 0.9762, test_loss: 1.0650, test_f1: 0.5210
 epoch: 15, train_loss: 0.9618, test_loss: 1.0493, test_f1: 0.5302
 epoch: 16, train_loss: 0.9496, test_loss: 1.0680, test_f1: 0.5260
 epoch: 17, train_loss: 0.9653, test_loss: 1.0624, test_f1: 0.5324
 epoch: 18, train_loss: 0.9588, test_loss: 1.0648, test_f1: 0.5043
 epoch: 19, train_loss: 0.9370, test_loss: 1.0618, test_f1: 0.5120
 epoch: 20, train_loss: 0.9484, test_loss: 1.0545, test_f1: 0.5281
 epoch: 21, train_loss: 0.9324, test_loss: 1.0598, test_f1: 0.5239
 epoch: 22, train_loss: 0.9329, test_loss: 1.0550, test_f1: 0.5279
 epoch: 23, train_loss: 0.9376, test_loss: 1.0512, test_f1: 0.5438
 epoch: 24, train_loss: 0.9346, test_loss: 1.0505, test_f1: 0.5508
 epoch: 25, train_loss: 0.9240, test_loss: 1.0459, test_f1: 0.5561
 epoch: 26, train_loss: 0.9242, test_loss: 1.0330, test_f1: 0.5516
 epoch: 27, train_loss: 0.9148, test_loss: 1.0416, test_f1: 0.5638
 epoch: 28, train_loss: 0.9123, test_loss: 1.0393, test_f1: 0.5609
 epoch: 29, train_loss: 0.9108, test_loss: 1.0534, test_f1: 0.5366
 epoch: 30, train_loss: 0.9084, test_loss: 1.0773, test_f1: 0.5546
 epoch: 31, train_loss: 0.9026, test_loss: 1.0583, test_f1: 0.5761
 epoch: 32, train_loss: 0.9002, test_loss: 1.0840, test_f1: 0.5796
 epoch: 33, train_loss: 0.8906, test_loss: 1.0730, test_f1: 0.5539
 epoch: 34, train_loss: 0.8877, test_loss: 1.0853, test_f1: 0.5654
 epoch: 35, train_loss: 0.8856, test_loss: 1.0750, test_f1: 0.5768
 epoch: 36, train_loss: 0.8844, test_loss: 1.0620, test_f1: 0.5585
 epoch: 37, train_loss: 0.8644, test_loss: 1.0843, test_f1: 0.5612
 epoch: 38, train_loss: 0.8743, test_loss: 1.0903, test_f1: 0.5808
 epoch: 39, train_loss: 0.8762, test_loss: 1.0908, test_f1: 0.5721
 epoch: 40, train_loss: 0.8590, test_loss: 1.0829, test_f1: 0.5771
 epoch: 41, train_loss: 0.8463, test_loss: 1.0850, test_f1: 0.5785
 epoch: 42, train_loss: 0.8524, test_loss: 1.0960, test_f1: 0.5627
 epoch: 43, train_loss: 0.8376, test_loss: 1.0982, test_f1: 0.5658
 epoch: 44, train_loss: 0.8527, test_loss: 1.1191, test_f1: 0.5608
 epoch: 45, train_loss: 0.8181, test_loss: 1.1078, test_f1: 0.5745
 epoch: 46, train_loss: 0.8328, test_loss: 1.1070, test_f1: 0.5637
 epoch: 47, train_loss: 0.8392, test_loss: 1.1352, test_f1: 0.5655
 epoch: 48, train_loss: 0.8459, test_loss: 1.1249, test_f1: 0.5761
 epoch: 49, train_loss: 0.8358, test_loss: 1.1283, test_f1: 0.5716
 epoch: 50, train_loss: 0.8239, test_loss: 1.1355, test_f1: 0.5641
 epoch: 51, train_loss: 0.8208, test_loss: 1.1152, test_f1: 0.5714
 epoch: 52, train_loss: 0.8211, test_loss: 1.1335, test_f1: 0.5798
 epoch: 53, train_loss: 0.8288, test_loss: 1.1045, test_f1: 0.5551
 epoch: 54, train_loss: 0.8011, test_loss: 1.1192, test_f1: 0.5660
 epoch: 55, train_loss: 0.8150, test_loss: 1.1640, test_f1: 0.5677
 epoch: 56, train_loss: 0.8047, test_loss: 1.1546, test_f1: 0.5685
 epoch: 57, train_loss: 0.8043, test_loss: 1.1560, test_f1: 0.5640
 epoch: 58, train_loss: 0.8064, test_loss: 1.1345, test_f1: 0.5668
 epoch: 59, train_loss: 0.7952, test_loss: 1.1165, test_f1: 0.5846
 epoch: 60, train_loss: 0.7960, test_loss: 1.1325, test_f1: 0.5619
 epoch: 61, train_loss: 0.7931, test_loss: 1.1281, test_f1: 0.5616
 epoch: 62, train_loss: 0.7941, test_loss: 1.1576, test_f1: 0.5751
 epoch: 63, train_loss: 0.7870, test_loss: 1.1585, test_f1: 0.5564
 epoch: 64, train_loss: 0.7983, test_loss: 1.1577, test_f1: 0.5619
 epoch: 65, train_loss: 0.7738, test_loss: 1.1513, test_f1: 0.5718
 epoch: 66, train_loss: 0.7871, test_loss: 1.1508, test_f1: 0.5677
 epoch: 67, train_loss: 0.7881, test_loss: 1.1551, test_f1: 0.5698
 epoch: 68, train_loss: 0.7833, test_loss: 1.1365, test_f1: 0.5757
 epoch: 69, train_loss: 0.7911, test_loss: 1.1599, test_f1: 0.5623
 epoch: 70, train_loss: 0.7755, test_loss: 1.1697, test_f1: 0.5655
 epoch: 71, train_loss: 0.7740, test_loss: 1.1821, test_f1: 0.5584
 epoch: 72, train_loss: 0.7718, test_loss: 1.1750, test_f1: 0.5609
 epoch: 73, train_loss: 0.7602, test_loss: 1.1805, test_f1: 0.5642
 epoch: 74, train_loss: 0.7668, test_loss: 1.1970, test_f1: 0.5660
 epoch: 75, train_loss: 0.7689, test_loss: 1.1724, test_f1: 0.5658
 epoch: 76, train_loss: 0.7813, test_loss: 1.1896, test_f1: 0.5708
 epoch: 77, train_loss: 0.7589, test_loss: 1.1767, test_f1: 0.5621
 epoch: 78, train_loss: 0.7630, test_loss: 1.1868, test_f1: 0.5665
 epoch: 79, train_loss: 0.7784, test_loss: 1.1842, test_f1: 0.5452
 epoch: 80, train_loss: 0.7670, test_loss: 1.1880, test_f1: 0.5571
 epoch: 81, train_loss: 0.7699, test_loss: 1.2025, test_f1: 0.5641
 epoch: 82, train_loss: 0.7520, test_loss: 1.1973, test_f1: 0.5583
 epoch: 83, train_loss: 0.7567, test_loss: 1.2025, test_f1: 0.5556
 epoch: 84, train_loss: 0.7474, test_loss: 1.1976, test_f1: 0.5682
 epoch: 85, train_loss: 0.7549, test_loss: 1.1873, test_f1: 0.5686
 epoch: 86, train_loss: 0.7505, test_loss: 1.2190, test_f1: 0.5599
 epoch: 87, train_loss: 0.7504, test_loss: 1.2078, test_f1: 0.5676
 epoch: 88, train_loss: 0.7485, test_loss: 1.2151, test_f1: 0.5696
 epoch: 89, train_loss: 0.7547, test_loss: 1.2158, test_f1: 0.5742
 epoch: 90, train_loss: 0.7606, test_loss: 1.2128, test_f1: 0.5672
 epoch: 91, train_loss: 0.7427, test_loss: 1.2058, test_f1: 0.5699
 epoch: 92, train_loss: 0.7596, test_loss: 1.1916, test_f1: 0.5772
 epoch: 93, train_loss: 0.7346, test_loss: 1.1942, test_f1: 0.5705
 epoch: 94, train_loss: 0.7506, test_loss: 1.1969, test_f1: 0.5732
 epoch: 95, train_loss: 0.7434, test_loss: 1.2250, test_f1: 0.5669
 epoch: 96, train_loss: 0.7318, test_loss: 1.2052, test_f1: 0.5842
 epoch: 97, train_loss: 0.7366, test_loss: 1.1953, test_f1: 0.5727
 epoch: 98, train_loss: 0.7398, test_loss: 1.2075, test_f1: 0.5799
 epoch: 99, train_loss: 0.7428, test_loss: 1.1881, test_f1: 0.5861

Training completed in 730.60 seconds
Best F1: 0.6201 at epoch 61
Mean F1 across iterations: 0.5853  0.0191
========================FINAL RESULTS================================
FEGIN weighted F1: 0.6201  0.0191
python main.py --data ltspice_demos --representation component_net --model FEGIN --layers 6 --hiddens 64 --batch_size 64 --lr 0.0001 --emb_size 512 --epochs 100 --save_appendix component_net_L6_H64_BS64_LR0.0001_E512 --no_val
-----



STDERR:
  File "main.py", line 370, in <module>
    main()
  File "main.py", line 254, in main
    dataset = dataset_class(
  File "/home/philip/projects/ltspice_examples_code_repo/Circuit-Completion-Using-GNNs/component_classification_with_link_prediction_head/evaluation/FEGIN/kernel/circuit_datasets.py", line 15, in __init__
    self.data, self.slices = torch.load(self.processed_paths[0])
  File "/home/philip/.local/lib/python3.8/site-packages/torch/serialization.py", line 1040, in load
    warnings.warn(
  File "/usr/lib/python3.8/warnings.py", line 109, in _showwarnmsg
    sw(msg.message, msg.category, msg.filename, msg.lineno,
  File "main.py", line 47, in warn_with_traceback
    traceback.print_stack(file=log)
/home/philip/projects/ltspice_examples_code_repo/Circuit-Completion-Using-GNNs/component_classification_with_link_prediction_head/evaluation/FEGIN/kernel/circuit_datasets.py:15: FutureWarning: You are using `torch.load` with `weights_only=False` (the current default value), which uses the default pickle module implicitly. It is possible to construct malicious pickle data which will execute arbitrary code during unpickling (See https://github.com/pytorch/pytorch/blob/main/SECURITY.md#untrusted-models for more details). In a future release, the default value for `weights_only` will be flipped to `True`. This limits the functions that could be executed during unpickling. Arbitrary objects will no longer be allowed to be loaded via this mode unless they are explicitly allowlisted by the user via `torch.serialization.add_safe_globals`. We recommend you start setting `weights_only=True` for any use case where you don't have full control of the loaded file. Please open an issue on GitHub for any issues related to this experimental feature.
  self.data, self.slices = torch.load(self.processed_paths[0])
