STDOUT:
Results will be saved in /home/philip/projects/ltspice_examples_code_repo/Circuit-Completion-Using-GNNs/component_classification_with_link_prediction_head/evaluation/FEGIN/results/model_FEGIN_dataset_ltspice_examples
Command line input: python main.py --data ltspice_examples --representation component_component --model FEGIN --layers 4 --hiddens 16 --batch_size 256 --lr 0.1 --emb_size 512 --epochs 100 --save_appendix component_component_L4_H16_BS256_LR0.1_E512 --no_val
 is saved.
-----
ltspice_examples - FEGIN
Using 4 layers, 16 hidden units, h = 2
Loading component_component representation dataset
ENTERED
Training FEGIN on component_component representation
Train: 3556, Test: 845
##################ITERATION #0 ****************************************
 epoch: 0, train_loss: 1.3183, test_loss: 1.3392, test_f1: 0.2274
 epoch: 1, train_loss: 1.2815, test_loss: 1.2783, test_f1: 0.2507
 epoch: 2, train_loss: 1.2772, test_loss: 1.2734, test_f1: 0.2721
 epoch: 3, train_loss: 1.2713, test_loss: 1.2584, test_f1: 0.3404
 epoch: 4, train_loss: 1.2537, test_loss: 1.2264, test_f1: 0.3097
 epoch: 5, train_loss: 1.2376, test_loss: 1.1956, test_f1: 0.3111
 epoch: 6, train_loss: 1.2231, test_loss: 1.1997, test_f1: 0.3161
 epoch: 7, train_loss: 1.2178, test_loss: 1.1931, test_f1: 0.3225
 epoch: 8, train_loss: 1.2017, test_loss: 1.1633, test_f1: 0.3321
 epoch: 9, train_loss: 1.1929, test_loss: 1.1970, test_f1: 0.3457
 epoch: 10, train_loss: 1.1980, test_loss: 1.2095, test_f1: 0.3687
 epoch: 11, train_loss: 1.1796, test_loss: 1.1635, test_f1: 0.4214
 epoch: 12, train_loss: 1.1667, test_loss: 1.1693, test_f1: 0.3587
 epoch: 13, train_loss: 1.1931, test_loss: 1.1916, test_f1: 0.3020
 epoch: 14, train_loss: 1.1998, test_loss: 1.1493, test_f1: 0.3382
 epoch: 15, train_loss: 1.1903, test_loss: 1.1941, test_f1: 0.3141
 epoch: 16, train_loss: 1.1901, test_loss: 1.1787, test_f1: 0.3279
 epoch: 17, train_loss: 1.1916, test_loss: 1.1731, test_f1: 0.3224
 epoch: 18, train_loss: 1.1771, test_loss: 1.1826, test_f1: 0.3074
 epoch: 19, train_loss: 1.1588, test_loss: 1.1699, test_f1: 0.3594
 epoch: 20, train_loss: 1.1523, test_loss: 1.1211, test_f1: 0.4110
 epoch: 21, train_loss: 1.1596, test_loss: 1.1056, test_f1: 0.3800
 epoch: 22, train_loss: 1.1187, test_loss: 1.0728, test_f1: 0.4302
 epoch: 23, train_loss: 1.1053, test_loss: 1.1040, test_f1: 0.4385
 epoch: 24, train_loss: 1.1024, test_loss: 1.2904, test_f1: 0.3731
 epoch: 25, train_loss: 1.0884, test_loss: 1.0772, test_f1: 0.4290
 epoch: 26, train_loss: 1.0882, test_loss: 1.0440, test_f1: 0.4298
 epoch: 27, train_loss: 1.0972, test_loss: 1.0823, test_f1: 0.4118
 epoch: 28, train_loss: 1.0696, test_loss: 1.0125, test_f1: 0.4614
 epoch: 29, train_loss: 1.0697, test_loss: 0.9978, test_f1: 0.4370
 epoch: 30, train_loss: 1.0670, test_loss: 1.0525, test_f1: 0.4261
 epoch: 31, train_loss: 1.0483, test_loss: 1.0219, test_f1: 0.4329
 epoch: 32, train_loss: 1.0275, test_loss: 1.0427, test_f1: 0.4273
 epoch: 33, train_loss: 1.0347, test_loss: 1.0284, test_f1: 0.4310
 epoch: 34, train_loss: 1.0548, test_loss: 1.0660, test_f1: 0.4204
 epoch: 35, train_loss: 1.0471, test_loss: 1.0425, test_f1: 0.4372
 epoch: 36, train_loss: 1.0244, test_loss: 1.0545, test_f1: 0.4173
 epoch: 37, train_loss: 1.0433, test_loss: 1.1506, test_f1: 0.3973
 epoch: 38, train_loss: 1.0487, test_loss: 1.0065, test_f1: 0.4405
 epoch: 39, train_loss: 1.0369, test_loss: 1.0284, test_f1: 0.4403
 epoch: 40, train_loss: 1.0282, test_loss: 1.0841, test_f1: 0.3900
 epoch: 41, train_loss: 1.0262, test_loss: 1.0404, test_f1: 0.4177
 epoch: 42, train_loss: 1.0311, test_loss: 1.0601, test_f1: 0.4448
 epoch: 43, train_loss: 1.0183, test_loss: 1.0636, test_f1: 0.4332
 epoch: 44, train_loss: 1.0214, test_loss: 1.0462, test_f1: 0.4243
 epoch: 45, train_loss: 1.0208, test_loss: 1.0643, test_f1: 0.4213
 epoch: 46, train_loss: 1.0119, test_loss: 1.0539, test_f1: 0.4223
 epoch: 47, train_loss: 1.0093, test_loss: 1.0298, test_f1: 0.4315
 epoch: 48, train_loss: 1.0165, test_loss: 1.0650, test_f1: 0.4223
 epoch: 49, train_loss: 1.0201, test_loss: 1.0628, test_f1: 0.4203
 epoch: 50, train_loss: 1.0256, test_loss: 1.0942, test_f1: 0.4118
 epoch: 51, train_loss: 1.0144, test_loss: 1.0795, test_f1: 0.4223
 epoch: 52, train_loss: 1.0095, test_loss: 1.0965, test_f1: 0.4102
 epoch: 53, train_loss: 1.0017, test_loss: 1.0276, test_f1: 0.4320
 epoch: 54, train_loss: 0.9961, test_loss: 1.0403, test_f1: 0.4320
 epoch: 55, train_loss: 1.0024, test_loss: 1.0354, test_f1: 0.4320
 epoch: 56, train_loss: 1.0023, test_loss: 1.0544, test_f1: 0.4349
 epoch: 57, train_loss: 1.0020, test_loss: 1.0308, test_f1: 0.4332
 epoch: 58, train_loss: 1.0011, test_loss: 1.0211, test_f1: 0.4349
 epoch: 59, train_loss: 1.0039, test_loss: 1.0436, test_f1: 0.4223
 epoch: 60, train_loss: 1.0119, test_loss: 1.0587, test_f1: 0.4223
 epoch: 61, train_loss: 0.9947, test_loss: 1.0383, test_f1: 0.4242
 epoch: 62, train_loss: 0.9942, test_loss: 1.0430, test_f1: 0.4263
 epoch: 63, train_loss: 0.9978, test_loss: 1.0243, test_f1: 0.4263
 epoch: 64, train_loss: 0.9938, test_loss: 1.0248, test_f1: 0.4349
 epoch: 65, train_loss: 0.9900, test_loss: 1.0282, test_f1: 0.4322
 epoch: 66, train_loss: 0.9953, test_loss: 1.0945, test_f1: 0.4215
 epoch: 67, train_loss: 1.0115, test_loss: 1.0301, test_f1: 0.4302
 epoch: 68, train_loss: 1.0020, test_loss: 1.0272, test_f1: 0.4349
 epoch: 69, train_loss: 1.0038, test_loss: 1.0257, test_f1: 0.4340
 epoch: 70, train_loss: 0.9971, test_loss: 1.0207, test_f1: 0.4331
 epoch: 71, train_loss: 0.9927, test_loss: 1.0224, test_f1: 0.4242
 epoch: 72, train_loss: 0.9926, test_loss: 1.0277, test_f1: 0.4261
 epoch: 73, train_loss: 0.9935, test_loss: 1.0346, test_f1: 0.4339
 epoch: 74, train_loss: 0.9994, test_loss: 1.0333, test_f1: 0.4280
 epoch: 75, train_loss: 0.9930, test_loss: 1.0599, test_f1: 0.4308
 epoch: 76, train_loss: 0.9941, test_loss: 1.0348, test_f1: 0.4309
 epoch: 77, train_loss: 0.9848, test_loss: 1.0396, test_f1: 0.4396
 epoch: 78, train_loss: 0.9865, test_loss: 1.0184, test_f1: 0.4502
 epoch: 79, train_loss: 0.9844, test_loss: 1.0145, test_f1: 0.4332
 epoch: 80, train_loss: 0.9773, test_loss: 1.0330, test_f1: 0.4439
 epoch: 81, train_loss: 0.9850, test_loss: 1.0292, test_f1: 0.4432
 epoch: 82, train_loss: 0.9927, test_loss: 1.0245, test_f1: 0.4510
 epoch: 83, train_loss: 0.9835, test_loss: 1.0137, test_f1: 0.4414
 epoch: 84, train_loss: 0.9893, test_loss: 1.0093, test_f1: 0.4342
 epoch: 85, train_loss: 0.9879, test_loss: 1.1583, test_f1: 0.4169
 epoch: 86, train_loss: 0.9833, test_loss: 1.0004, test_f1: 0.4368
 epoch: 87, train_loss: 0.9849, test_loss: 1.0291, test_f1: 0.4422
 epoch: 88, train_loss: 0.9937, test_loss: 1.0264, test_f1: 0.4422
 epoch: 89, train_loss: 0.9881, test_loss: 1.0110, test_f1: 0.4441
 epoch: 90, train_loss: 0.9823, test_loss: 1.0224, test_f1: 0.4508
 epoch: 91, train_loss: 0.9797, test_loss: 1.0282, test_f1: 0.4339
 epoch: 92, train_loss: 0.9847, test_loss: 1.0152, test_f1: 0.4431
 epoch: 93, train_loss: 0.9814, test_loss: 1.0371, test_f1: 0.4309
 epoch: 94, train_loss: 0.9893, test_loss: 1.0075, test_f1: 0.4557
 epoch: 95, train_loss: 0.9888, test_loss: 1.0331, test_f1: 0.4395
 epoch: 96, train_loss: 0.9823, test_loss: 1.0255, test_f1: 0.4358
 epoch: 97, train_loss: 0.9677, test_loss: 1.0308, test_f1: 0.4368
 epoch: 98, train_loss: 0.9715, test_loss: 1.0443, test_f1: 0.4368
 epoch: 99, train_loss: 0.9690, test_loss: 1.0333, test_f1: 0.4378
##################ITERATION #1 ****************************************
 epoch: 0, train_loss: 1.4063, test_loss: 1.3636, test_f1: 0.2274
 epoch: 1, train_loss: 1.2797, test_loss: 1.2894, test_f1: 0.2332
 epoch: 2, train_loss: 1.2781, test_loss: 1.2669, test_f1: 0.2274
 epoch: 3, train_loss: 1.2759, test_loss: 1.2552, test_f1: 0.2274
 epoch: 4, train_loss: 1.2725, test_loss: 1.2684, test_f1: 0.2274
 epoch: 5, train_loss: 1.2583, test_loss: 1.2576, test_f1: 0.2976
 epoch: 6, train_loss: 1.2479, test_loss: 1.2621, test_f1: 0.2918
 epoch: 7, train_loss: 1.2317, test_loss: 1.3252, test_f1: 0.2907
 epoch: 8, train_loss: 1.2197, test_loss: 1.2163, test_f1: 0.3497
 epoch: 9, train_loss: 1.1767, test_loss: 1.1949, test_f1: 0.3488
 epoch: 10, train_loss: 1.1703, test_loss: 1.1184, test_f1: 0.3404
 epoch: 11, train_loss: 1.1519, test_loss: 1.1587, test_f1: 0.3352
 epoch: 12, train_loss: 1.1575, test_loss: 2.1195, test_f1: 0.2150
 epoch: 13, train_loss: 1.1774, test_loss: 1.1454, test_f1: 0.3371
 epoch: 14, train_loss: 1.1532, test_loss: 1.1476, test_f1: 0.3447
 epoch: 15, train_loss: 1.1452, test_loss: 1.1635, test_f1: 0.3332
 epoch: 16, train_loss: 1.1397, test_loss: 1.0967, test_f1: 0.3448
 epoch: 17, train_loss: 1.1347, test_loss: 1.1661, test_f1: 0.3352
 epoch: 18, train_loss: 1.1534, test_loss: 1.1001, test_f1: 0.3437
 epoch: 19, train_loss: 1.1423, test_loss: 1.1952, test_f1: 0.3968
 epoch: 20, train_loss: 1.1623, test_loss: 1.1420, test_f1: 0.3430
 epoch: 21, train_loss: 1.1512, test_loss: 1.1730, test_f1: 0.3322
 epoch: 22, train_loss: 1.1462, test_loss: 1.1623, test_f1: 0.3352
 epoch: 23, train_loss: 1.1326, test_loss: 1.1746, test_f1: 0.3342
 epoch: 24, train_loss: 1.1214, test_loss: 1.1741, test_f1: 0.3352
 epoch: 25, train_loss: 1.1275, test_loss: 1.1546, test_f1: 0.3287
 epoch: 26, train_loss: 1.1327, test_loss: 1.1842, test_f1: 0.3342
 epoch: 27, train_loss: 1.1249, test_loss: 1.1765, test_f1: 0.3352
 epoch: 28, train_loss: 1.1225, test_loss: 1.1642, test_f1: 0.3381
 epoch: 29, train_loss: 1.1177, test_loss: 1.1696, test_f1: 0.3381
 epoch: 30, train_loss: 1.1208, test_loss: 1.2037, test_f1: 0.3190
 epoch: 31, train_loss: 1.1299, test_loss: 1.1921, test_f1: 0.3352
 epoch: 32, train_loss: 1.1187, test_loss: 1.1778, test_f1: 0.3381
 epoch: 33, train_loss: 1.1206, test_loss: 1.1805, test_f1: 0.3362
 epoch: 34, train_loss: 1.1211, test_loss: 1.1777, test_f1: 0.3352
 epoch: 35, train_loss: 1.1178, test_loss: 1.1717, test_f1: 0.3381
 epoch: 36, train_loss: 1.1244, test_loss: 1.1802, test_f1: 0.3352
 epoch: 37, train_loss: 1.1388, test_loss: 1.3032, test_f1: 0.3132
 epoch: 38, train_loss: 1.1229, test_loss: 1.1773, test_f1: 0.3352
 epoch: 39, train_loss: 1.1225, test_loss: 1.1844, test_f1: 0.3352
 epoch: 40, train_loss: 1.1171, test_loss: 1.2448, test_f1: 0.3190
 epoch: 41, train_loss: 1.1164, test_loss: 1.1692, test_f1: 0.3362
 epoch: 42, train_loss: 1.1155, test_loss: 1.3603, test_f1: 0.3114
 epoch: 43, train_loss: 1.1271, test_loss: 1.3114, test_f1: 0.3190
 epoch: 44, train_loss: 1.1174, test_loss: 1.1788, test_f1: 0.3362
 epoch: 45, train_loss: 1.1150, test_loss: 1.1724, test_f1: 0.3381
 epoch: 46, train_loss: 1.1230, test_loss: 1.3790, test_f1: 0.3053
 epoch: 47, train_loss: 1.1140, test_loss: 1.1763, test_f1: 0.3371
 epoch: 48, train_loss: 1.1130, test_loss: 1.1840, test_f1: 0.3352
 epoch: 49, train_loss: 1.1188, test_loss: 1.2046, test_f1: 0.3324
 epoch: 50, train_loss: 1.1175, test_loss: 1.1866, test_f1: 0.3369
 epoch: 51, train_loss: 1.1111, test_loss: 1.1933, test_f1: 0.3348
 epoch: 52, train_loss: 1.1128, test_loss: 1.2748, test_f1: 0.3199
 epoch: 53, train_loss: 1.1098, test_loss: 1.2795, test_f1: 0.3199
 epoch: 54, train_loss: 1.1093, test_loss: 1.1747, test_f1: 0.3381
 epoch: 55, train_loss: 1.1099, test_loss: 1.1764, test_f1: 0.3381
 epoch: 56, train_loss: 1.1101, test_loss: 1.2809, test_f1: 0.3190
 epoch: 57, train_loss: 1.1089, test_loss: 1.3049, test_f1: 0.3190
 epoch: 58, train_loss: 1.1087, test_loss: 1.3086, test_f1: 0.3190
 epoch: 59, train_loss: 1.1099, test_loss: 1.3134, test_f1: 0.3190
 epoch: 60, train_loss: 1.1065, test_loss: 1.3118, test_f1: 0.3190
 epoch: 61, train_loss: 1.1086, test_loss: 1.3064, test_f1: 0.3199
 epoch: 62, train_loss: 1.1069, test_loss: 1.2238, test_f1: 0.3262
 epoch: 63, train_loss: 1.1065, test_loss: 1.1810, test_f1: 0.3371
 epoch: 64, train_loss: 1.1060, test_loss: 1.1822, test_f1: 0.3371
 epoch: 65, train_loss: 1.1073, test_loss: 1.1836, test_f1: 0.3371
 epoch: 66, train_loss: 1.1078, test_loss: 1.1820, test_f1: 0.3381
 epoch: 67, train_loss: 1.1090, test_loss: 1.1790, test_f1: 0.3381
 epoch: 68, train_loss: 1.1063, test_loss: 1.1854, test_f1: 0.3381
 epoch: 69, train_loss: 1.1057, test_loss: 1.1814, test_f1: 0.3381
 epoch: 70, train_loss: 1.1099, test_loss: 1.1853, test_f1: 0.3371
 epoch: 71, train_loss: 1.1107, test_loss: 1.1976, test_f1: 0.3358
 epoch: 72, train_loss: 1.1086, test_loss: 1.1832, test_f1: 0.3381
 epoch: 73, train_loss: 1.1085, test_loss: 1.1862, test_f1: 0.3381
 epoch: 74, train_loss: 1.1067, test_loss: 1.3020, test_f1: 0.3190
 epoch: 75, train_loss: 1.1074, test_loss: 1.2027, test_f1: 0.3297
 epoch: 76, train_loss: 1.1075, test_loss: 1.2557, test_f1: 0.3190
 epoch: 77, train_loss: 1.1031, test_loss: 1.1982, test_f1: 0.3286
 epoch: 78, train_loss: 1.1025, test_loss: 1.1845, test_f1: 0.3371
 epoch: 79, train_loss: 1.1081, test_loss: 1.1901, test_f1: 0.3371
 epoch: 80, train_loss: 1.1046, test_loss: 1.3088, test_f1: 0.3218
 epoch: 81, train_loss: 1.1007, test_loss: 1.1712, test_f1: 0.3410
 epoch: 82, train_loss: 1.1065, test_loss: 1.1836, test_f1: 0.3381
 epoch: 83, train_loss: 1.1060, test_loss: 1.1875, test_f1: 0.3381
 epoch: 84, train_loss: 1.1035, test_loss: 1.1860, test_f1: 0.3371
 epoch: 85, train_loss: 1.1068, test_loss: 1.1938, test_f1: 0.3381
 epoch: 86, train_loss: 1.1108, test_loss: 1.1863, test_f1: 0.3381
 epoch: 87, train_loss: 1.1144, test_loss: 1.1806, test_f1: 0.3381
 epoch: 88, train_loss: 1.1138, test_loss: 1.1936, test_f1: 0.3362
 epoch: 89, train_loss: 1.1109, test_loss: 1.1825, test_f1: 0.3381
 epoch: 90, train_loss: 1.1055, test_loss: 1.1864, test_f1: 0.3371
 epoch: 91, train_loss: 1.1091, test_loss: 1.1877, test_f1: 0.3348
 epoch: 92, train_loss: 1.1136, test_loss: 1.1916, test_f1: 0.3381
 epoch: 93, train_loss: 1.1183, test_loss: 1.1929, test_f1: 0.3352
 epoch: 94, train_loss: 1.1196, test_loss: 1.2007, test_f1: 0.3352
 epoch: 95, train_loss: 1.1259, test_loss: 1.1926, test_f1: 0.3352
 epoch: 96, train_loss: 1.1139, test_loss: 1.1871, test_f1: 0.3371
 epoch: 97, train_loss: 1.1110, test_loss: 1.1845, test_f1: 0.3381
 epoch: 98, train_loss: 1.1088, test_loss: 1.1888, test_f1: 0.3362
 epoch: 99, train_loss: 1.1130, test_loss: 1.1848, test_f1: 0.3381
##################ITERATION #2 ****************************************
 epoch: 0, train_loss: 1.4891, test_loss: 1.3134, test_f1: 0.2274
 epoch: 1, train_loss: 1.2996, test_loss: 1.3152, test_f1: 0.2274
 epoch: 2, train_loss: 1.2757, test_loss: 1.3174, test_f1: 0.2274
 epoch: 3, train_loss: 1.2606, test_loss: 1.2347, test_f1: 0.2873
 epoch: 4, train_loss: 1.2278, test_loss: 1.1335, test_f1: 0.3374
 epoch: 5, train_loss: 1.1879, test_loss: 1.2305, test_f1: 0.2986
 epoch: 6, train_loss: 1.1580, test_loss: 1.1814, test_f1: 0.3352
 epoch: 7, train_loss: 1.1440, test_loss: 1.1766, test_f1: 0.3391
 epoch: 8, train_loss: 1.1378, test_loss: 1.1862, test_f1: 0.3352
 epoch: 9, train_loss: 1.1261, test_loss: 1.1791, test_f1: 0.3342
 epoch: 10, train_loss: 1.1432, test_loss: 1.1637, test_f1: 0.3342
 epoch: 11, train_loss: 1.1772, test_loss: 1.2341, test_f1: 0.3320
 epoch: 12, train_loss: 1.1585, test_loss: 1.1145, test_f1: 0.3444
 epoch: 13, train_loss: 1.1344, test_loss: 1.1841, test_f1: 0.3342
 epoch: 14, train_loss: 1.1276, test_loss: 1.1810, test_f1: 0.3362
 epoch: 15, train_loss: 1.1304, test_loss: 1.1667, test_f1: 0.3352
 epoch: 16, train_loss: 1.1261, test_loss: 1.1851, test_f1: 0.3352
 epoch: 17, train_loss: 1.1189, test_loss: 1.1872, test_f1: 0.3352
 epoch: 18, train_loss: 1.1156, test_loss: 1.1829, test_f1: 0.3352
 epoch: 19, train_loss: 1.1126, test_loss: 1.1603, test_f1: 0.3400
 epoch: 20, train_loss: 1.1134, test_loss: 1.1852, test_f1: 0.3362
 epoch: 21, train_loss: 1.1629, test_loss: 1.2055, test_f1: 0.3283
 epoch: 22, train_loss: 1.1234, test_loss: 1.1797, test_f1: 0.3352
 epoch: 23, train_loss: 1.1229, test_loss: 1.1708, test_f1: 0.3391
 epoch: 24, train_loss: 1.1116, test_loss: 1.2639, test_f1: 0.3191
 epoch: 25, train_loss: 1.1010, test_loss: 1.1711, test_f1: 0.3362
 epoch: 26, train_loss: 1.1062, test_loss: 1.1792, test_f1: 0.3362
 epoch: 27, train_loss: 1.1196, test_loss: 1.1324, test_f1: 0.3362
 epoch: 28, train_loss: 1.1074, test_loss: 1.1646, test_f1: 0.3400
 epoch: 29, train_loss: 1.1025, test_loss: 1.1704, test_f1: 0.3362
 epoch: 30, train_loss: 1.0999, test_loss: 1.2956, test_f1: 0.3009
 epoch: 31, train_loss: 1.1017, test_loss: 1.1574, test_f1: 0.3381
 epoch: 32, train_loss: 1.1057, test_loss: 1.1691, test_f1: 0.3381
 epoch: 33, train_loss: 1.0934, test_loss: 1.1751, test_f1: 0.3362
 epoch: 34, train_loss: 1.1004, test_loss: 1.1827, test_f1: 0.3381
 epoch: 35, train_loss: 1.1013, test_loss: 1.1703, test_f1: 0.3381
 epoch: 36, train_loss: 1.0967, test_loss: 1.1748, test_f1: 0.3381
 epoch: 37, train_loss: 1.0983, test_loss: 1.1664, test_f1: 0.3381
 epoch: 38, train_loss: 1.0944, test_loss: 1.1586, test_f1: 0.3420
 epoch: 39, train_loss: 1.0936, test_loss: 1.2641, test_f1: 0.3194
 epoch: 40, train_loss: 1.1012, test_loss: 1.3034, test_f1: 0.3190
 epoch: 41, train_loss: 1.1064, test_loss: 1.1746, test_f1: 0.3381
 epoch: 42, train_loss: 1.0948, test_loss: 1.1584, test_f1: 0.3420
 epoch: 43, train_loss: 1.1057, test_loss: 1.1936, test_f1: 0.3286
 epoch: 44, train_loss: 1.0970, test_loss: 1.1808, test_f1: 0.3362
 epoch: 45, train_loss: 1.0895, test_loss: 1.3020, test_f1: 0.3190
 epoch: 46, train_loss: 1.0918, test_loss: 1.2978, test_f1: 0.3209
 epoch: 47, train_loss: 1.0946, test_loss: 1.1587, test_f1: 0.3429
 epoch: 48, train_loss: 1.0988, test_loss: 1.3022, test_f1: 0.3245
 epoch: 49, train_loss: 1.0936, test_loss: 1.3041, test_f1: 0.3218
 epoch: 50, train_loss: 1.0967, test_loss: 1.2756, test_f1: 0.3176
 epoch: 51, train_loss: 1.0958, test_loss: 1.3171, test_f1: 0.3190
 epoch: 52, train_loss: 1.0891, test_loss: 1.3042, test_f1: 0.3190
 epoch: 53, train_loss: 1.0852, test_loss: 1.3043, test_f1: 0.3227
 epoch: 54, train_loss: 1.0852, test_loss: 1.3093, test_f1: 0.3209
 epoch: 55, train_loss: 1.0882, test_loss: 1.3049, test_f1: 0.3190
 epoch: 56, train_loss: 1.0898, test_loss: 1.3041, test_f1: 0.3190
 epoch: 57, train_loss: 1.0894, test_loss: 1.3033, test_f1: 0.3218
 epoch: 58, train_loss: 1.0836, test_loss: 1.2966, test_f1: 0.3218
 epoch: 59, train_loss: 1.0846, test_loss: 1.2347, test_f1: 0.3214
 epoch: 60, train_loss: 1.0842, test_loss: 1.3080, test_f1: 0.3190
 epoch: 61, train_loss: 1.0829, test_loss: 1.3108, test_f1: 0.3227
 epoch: 62, train_loss: 1.0812, test_loss: 1.3127, test_f1: 0.3209
 epoch: 63, train_loss: 1.0841, test_loss: 1.3122, test_f1: 0.3245
 epoch: 64, train_loss: 1.0831, test_loss: 1.3132, test_f1: 0.3211
 epoch: 65, train_loss: 1.0814, test_loss: 1.3148, test_f1: 0.3200
 epoch: 66, train_loss: 1.0843, test_loss: 1.3182, test_f1: 0.3218
 epoch: 67, train_loss: 1.0776, test_loss: 1.3104, test_f1: 0.3224
 epoch: 68, train_loss: 1.0788, test_loss: 1.3198, test_f1: 0.3200
 epoch: 69, train_loss: 1.0826, test_loss: 1.3111, test_f1: 0.3254
 epoch: 70, train_loss: 1.0820, test_loss: 1.3164, test_f1: 0.3242
 epoch: 71, train_loss: 1.0770, test_loss: 1.3216, test_f1: 0.3176
 epoch: 72, train_loss: 1.0826, test_loss: 1.3164, test_f1: 0.3207
 epoch: 73, train_loss: 1.0834, test_loss: 1.3219, test_f1: 0.3190
 epoch: 74, train_loss: 1.0785, test_loss: 1.3192, test_f1: 0.3227
 epoch: 75, train_loss: 1.0796, test_loss: 1.2131, test_f1: 0.3301
 epoch: 76, train_loss: 1.0775, test_loss: 1.1680, test_f1: 0.3358
 epoch: 77, train_loss: 1.0802, test_loss: 1.2595, test_f1: 0.3268
 epoch: 78, train_loss: 1.0794, test_loss: 1.3184, test_f1: 0.3245
 epoch: 79, train_loss: 1.0780, test_loss: 1.2496, test_f1: 0.3301
 epoch: 80, train_loss: 1.0763, test_loss: 1.1865, test_f1: 0.3343
 epoch: 81, train_loss: 1.0739, test_loss: 1.1755, test_f1: 0.3349
 epoch: 82, train_loss: 1.0723, test_loss: 1.2482, test_f1: 0.3283
 epoch: 83, train_loss: 1.0749, test_loss: 1.2147, test_f1: 0.3303
 epoch: 84, train_loss: 1.0895, test_loss: 1.2014, test_f1: 0.3307
 epoch: 85, train_loss: 1.1232, test_loss: 1.3971, test_f1: 0.3118
 epoch: 86, train_loss: 1.1010, test_loss: 1.3357, test_f1: 0.3209
 epoch: 87, train_loss: 1.0935, test_loss: 1.2585, test_f1: 0.3201
 epoch: 88, train_loss: 1.0926, test_loss: 1.1805, test_f1: 0.3329
 epoch: 89, train_loss: 1.0913, test_loss: 1.1762, test_f1: 0.3353
 epoch: 90, train_loss: 1.0847, test_loss: 1.2130, test_f1: 0.3203
 epoch: 91, train_loss: 1.0829, test_loss: 1.3188, test_f1: 0.3217
 epoch: 92, train_loss: 1.0843, test_loss: 1.2709, test_f1: 0.3236
 epoch: 93, train_loss: 1.0821, test_loss: 1.3381, test_f1: 0.3131
 epoch: 94, train_loss: 1.0817, test_loss: 1.1733, test_f1: 0.3381
 epoch: 95, train_loss: 1.0804, test_loss: 1.1710, test_f1: 0.3410
 epoch: 96, train_loss: 1.0825, test_loss: 1.1726, test_f1: 0.3429
 epoch: 97, train_loss: 1.0805, test_loss: 1.1763, test_f1: 0.3410
 epoch: 98, train_loss: 1.0774, test_loss: 1.1728, test_f1: 0.3429
 epoch: 99, train_loss: 1.0814, test_loss: 1.1685, test_f1: 0.3428
##################ITERATION #3 ****************************************
 epoch: 0, train_loss: 1.5761, test_loss: 1.4722, test_f1: 0.2589
 epoch: 1, train_loss: 1.3043, test_loss: 1.3041, test_f1: 0.2274
 epoch: 2, train_loss: 1.2821, test_loss: 1.2912, test_f1: 0.2274
 epoch: 3, train_loss: 1.2851, test_loss: 1.2752, test_f1: 0.2274
 epoch: 4, train_loss: 1.2693, test_loss: 1.2633, test_f1: 0.2274
 epoch: 5, train_loss: 1.2669, test_loss: 1.2888, test_f1: 0.2274
 epoch: 6, train_loss: 1.2669, test_loss: 1.2552, test_f1: 0.2274
 epoch: 7, train_loss: 1.2402, test_loss: 1.1890, test_f1: 0.3178
 epoch: 8, train_loss: 1.2309, test_loss: 1.1730, test_f1: 0.3225
 epoch: 9, train_loss: 1.2155, test_loss: 1.2372, test_f1: 0.2694
 epoch: 10, train_loss: 1.1896, test_loss: 1.1560, test_f1: 0.3381
 epoch: 11, train_loss: 1.1767, test_loss: 1.2124, test_f1: 0.3238
 epoch: 12, train_loss: 1.1772, test_loss: 1.1516, test_f1: 0.3370
 epoch: 13, train_loss: 1.1600, test_loss: 1.1880, test_f1: 0.3301
 epoch: 14, train_loss: 1.1467, test_loss: 1.2597, test_f1: 0.2574
 epoch: 15, train_loss: 1.1558, test_loss: 1.2349, test_f1: 0.2907
 epoch: 16, train_loss: 1.1616, test_loss: 1.1084, test_f1: 0.3444
 epoch: 17, train_loss: 1.1781, test_loss: 1.1265, test_f1: 0.3466
 epoch: 18, train_loss: 1.1535, test_loss: 1.1923, test_f1: 0.3391
 epoch: 19, train_loss: 1.1337, test_loss: 1.1756, test_f1: 0.3400
 epoch: 20, train_loss: 1.1303, test_loss: 1.1930, test_f1: 0.3352
 epoch: 21, train_loss: 1.1384, test_loss: 1.1940, test_f1: 0.3371
 epoch: 22, train_loss: 1.1383, test_loss: 1.2055, test_f1: 0.3362
 epoch: 23, train_loss: 1.1275, test_loss: 1.1473, test_f1: 0.3312
 epoch: 24, train_loss: 1.1389, test_loss: 1.1880, test_f1: 0.3342
 epoch: 25, train_loss: 1.1298, test_loss: 1.1906, test_f1: 0.3362
 epoch: 26, train_loss: 1.1252, test_loss: 1.1054, test_f1: 0.3487
 epoch: 27, train_loss: 1.1384, test_loss: 1.1996, test_f1: 0.3352
 epoch: 28, train_loss: 1.1251, test_loss: 1.1893, test_f1: 0.3322
 epoch: 29, train_loss: 1.1311, test_loss: 1.1559, test_f1: 0.3342
 epoch: 30, train_loss: 1.1316, test_loss: 1.1720, test_f1: 0.3400
 epoch: 31, train_loss: 1.1203, test_loss: 1.1921, test_f1: 0.3352
 epoch: 32, train_loss: 1.1198, test_loss: 1.1846, test_f1: 0.3362
 epoch: 33, train_loss: 1.1149, test_loss: 1.1936, test_f1: 0.3381
 epoch: 34, train_loss: 1.1135, test_loss: 1.1801, test_f1: 0.3381
 epoch: 35, train_loss: 1.1124, test_loss: 1.1908, test_f1: 0.3381
 epoch: 36, train_loss: 1.1123, test_loss: 1.1863, test_f1: 0.3381
 epoch: 37, train_loss: 1.1162, test_loss: 1.1920, test_f1: 0.3371
 epoch: 38, train_loss: 1.1151, test_loss: 1.3423, test_f1: 0.2274
 epoch: 39, train_loss: 1.1164, test_loss: 1.2399, test_f1: 0.2873
 epoch: 40, train_loss: 1.1267, test_loss: 1.1216, test_f1: 0.3426
 epoch: 41, train_loss: 1.1269, test_loss: 1.1961, test_f1: 0.3371
 epoch: 42, train_loss: 1.1200, test_loss: 1.1896, test_f1: 0.3371
 epoch: 43, train_loss: 1.1141, test_loss: 1.1833, test_f1: 0.3381
 epoch: 44, train_loss: 1.1142, test_loss: 1.2867, test_f1: 0.3227
 epoch: 45, train_loss: 1.1213, test_loss: 1.1920, test_f1: 0.3371
 epoch: 46, train_loss: 1.1136, test_loss: 1.2943, test_f1: 0.3227
 epoch: 47, train_loss: 1.1130, test_loss: 1.1830, test_f1: 0.3381
 epoch: 48, train_loss: 1.1176, test_loss: 1.1971, test_f1: 0.3352
 epoch: 49, train_loss: 1.1128, test_loss: 1.1811, test_f1: 0.3381
 epoch: 50, train_loss: 1.1107, test_loss: 1.1899, test_f1: 0.3371
 epoch: 51, train_loss: 1.1113, test_loss: 1.1927, test_f1: 0.3371
 epoch: 52, train_loss: 1.1115, test_loss: 1.1908, test_f1: 0.3371
 epoch: 53, train_loss: 1.1104, test_loss: 1.1922, test_f1: 0.3371
 epoch: 54, train_loss: 1.1108, test_loss: 1.1900, test_f1: 0.3371
 epoch: 55, train_loss: 1.1110, test_loss: 1.1954, test_f1: 0.3362
 epoch: 56, train_loss: 1.1121, test_loss: 1.1925, test_f1: 0.3362
 epoch: 57, train_loss: 1.1102, test_loss: 1.1880, test_f1: 0.3381
 epoch: 58, train_loss: 1.1069, test_loss: 1.2333, test_f1: 0.3251
 epoch: 59, train_loss: 1.1092, test_loss: 1.1825, test_f1: 0.3410
 epoch: 60, train_loss: 1.1075, test_loss: 1.1889, test_f1: 0.3381
 epoch: 61, train_loss: 1.1121, test_loss: 1.2091, test_f1: 0.3216
 epoch: 62, train_loss: 1.1085, test_loss: 1.2159, test_f1: 0.3213
 epoch: 63, train_loss: 1.1097, test_loss: 1.2101, test_f1: 0.3214
 epoch: 64, train_loss: 1.1086, test_loss: 1.1958, test_f1: 0.3358
 epoch: 65, train_loss: 1.1091, test_loss: 1.2092, test_f1: 0.3249
 epoch: 66, train_loss: 1.1078, test_loss: 1.2303, test_f1: 0.3195
 epoch: 67, train_loss: 1.1076, test_loss: 1.1874, test_f1: 0.3381
 epoch: 68, train_loss: 1.1080, test_loss: 1.1931, test_f1: 0.3381
 epoch: 69, train_loss: 1.1083, test_loss: 1.1893, test_f1: 0.3381
 epoch: 70, train_loss: 1.1073, test_loss: 1.1928, test_f1: 0.3381
 epoch: 71, train_loss: 1.1082, test_loss: 1.1922, test_f1: 0.3371
 epoch: 72, train_loss: 1.1101, test_loss: 1.1939, test_f1: 0.3371
 epoch: 73, train_loss: 1.1080, test_loss: 1.1922, test_f1: 0.3381
 epoch: 74, train_loss: 1.1089, test_loss: 1.2197, test_f1: 0.3197
 epoch: 75, train_loss: 1.1069, test_loss: 1.2941, test_f1: 0.3190
 epoch: 76, train_loss: 1.1100, test_loss: 1.2686, test_f1: 0.3190
 epoch: 77, train_loss: 1.1117, test_loss: 1.2437, test_f1: 0.3190
 epoch: 78, train_loss: 1.1074, test_loss: 1.2354, test_f1: 0.3190
 epoch: 79, train_loss: 1.1093, test_loss: 1.2234, test_f1: 0.3197
 epoch: 80, train_loss: 1.1056, test_loss: 1.2080, test_f1: 0.3232
 epoch: 81, train_loss: 1.1079, test_loss: 1.2261, test_f1: 0.3214
 epoch: 82, train_loss: 1.1075, test_loss: 1.2567, test_f1: 0.3190
 epoch: 83, train_loss: 1.1079, test_loss: 1.2031, test_f1: 0.3362
 epoch: 84, train_loss: 1.1121, test_loss: 1.2022, test_f1: 0.3371
 epoch: 85, train_loss: 1.1098, test_loss: 1.1954, test_f1: 0.3371
 epoch: 86, train_loss: 1.1104, test_loss: 1.2888, test_f1: 0.3181
 epoch: 87, train_loss: 1.1069, test_loss: 1.2870, test_f1: 0.3182
 epoch: 88, train_loss: 1.1086, test_loss: 1.2758, test_f1: 0.3182
 epoch: 89, train_loss: 1.1102, test_loss: 1.2926, test_f1: 0.3182
 epoch: 90, train_loss: 1.1087, test_loss: 1.3323, test_f1: 0.3181
 epoch: 91, train_loss: 1.1084, test_loss: 1.2840, test_f1: 0.3185
 epoch: 92, train_loss: 1.1079, test_loss: 1.2115, test_f1: 0.3299
 epoch: 93, train_loss: 1.1072, test_loss: 1.2056, test_f1: 0.3271
 epoch: 94, train_loss: 1.1088, test_loss: 1.2307, test_f1: 0.3205
 epoch: 95, train_loss: 1.1097, test_loss: 1.2248, test_f1: 0.3214
 epoch: 96, train_loss: 1.1078, test_loss: 1.2016, test_f1: 0.3365
 epoch: 97, train_loss: 1.1082, test_loss: 1.2003, test_f1: 0.3362
 epoch: 98, train_loss: 1.1107, test_loss: 1.1978, test_f1: 0.3371
 epoch: 99, train_loss: 1.1096, test_loss: 1.1990, test_f1: 0.3371
##################ITERATION #4 ****************************************
 epoch: 0, train_loss: 1.4046, test_loss: 1.3253, test_f1: 0.2405
 epoch: 1, train_loss: 1.3087, test_loss: 1.3259, test_f1: 0.2274
 epoch: 2, train_loss: 1.3034, test_loss: 1.3156, test_f1: 0.2274
 epoch: 3, train_loss: 1.3061, test_loss: 1.3142, test_f1: 0.2274
 epoch: 4, train_loss: 1.3044, test_loss: 1.3204, test_f1: 0.2274
 epoch: 5, train_loss: 1.3041, test_loss: 1.3134, test_f1: 0.2274
 epoch: 6, train_loss: 1.3053, test_loss: 1.3195, test_f1: 0.2274
 epoch: 7, train_loss: 1.3006, test_loss: 1.3165, test_f1: 0.2274
 epoch: 8, train_loss: 1.3060, test_loss: 1.3191, test_f1: 0.2274
 epoch: 9, train_loss: 1.3042, test_loss: 1.3154, test_f1: 0.2274
 epoch: 10, train_loss: 1.3049, test_loss: 1.3163, test_f1: 0.2274
 epoch: 11, train_loss: 1.3066, test_loss: 1.3212, test_f1: 0.2274
 epoch: 12, train_loss: 1.3113, test_loss: 1.3161, test_f1: 0.2274
 epoch: 13, train_loss: 1.3023, test_loss: 1.3214, test_f1: 0.2274
 epoch: 14, train_loss: 1.3045, test_loss: 1.3122, test_f1: 0.2274
 epoch: 15, train_loss: 1.3043, test_loss: 1.3141, test_f1: 0.2274
 epoch: 16, train_loss: 1.3050, test_loss: 1.3148, test_f1: 0.2274
 epoch: 17, train_loss: 1.3009, test_loss: 1.3150, test_f1: 0.2274
 epoch: 18, train_loss: 1.3008, test_loss: 1.3150, test_f1: 0.2274
 epoch: 19, train_loss: 1.2991, test_loss: 1.3188, test_f1: 0.2274
 epoch: 20, train_loss: 1.2994, test_loss: 1.3161, test_f1: 0.2274
 epoch: 21, train_loss: 1.2987, test_loss: 1.3202, test_f1: 0.2274
 epoch: 22, train_loss: 1.2998, test_loss: 1.3137, test_f1: 0.2274
 epoch: 23, train_loss: 1.2996, test_loss: 1.3120, test_f1: 0.2274
 epoch: 24, train_loss: 1.3014, test_loss: 1.3133, test_f1: 0.2274
 epoch: 25, train_loss: 1.3019, test_loss: 1.3156, test_f1: 0.2274
 epoch: 26, train_loss: 1.2998, test_loss: 1.3160, test_f1: 0.2274
 epoch: 27, train_loss: 1.3036, test_loss: 1.3144, test_f1: 0.2274
 epoch: 28, train_loss: 1.3009, test_loss: 1.3118, test_f1: 0.2274
 epoch: 29, train_loss: 1.2996, test_loss: 1.3158, test_f1: 0.2274
 epoch: 30, train_loss: 1.3018, test_loss: 1.3161, test_f1: 0.2274
 epoch: 31, train_loss: 1.3030, test_loss: 1.3145, test_f1: 0.2274
 epoch: 32, train_loss: 1.2985, test_loss: 1.3144, test_f1: 0.2274
 epoch: 33, train_loss: 1.3046, test_loss: 1.3567, test_f1: 0.2269
 epoch: 34, train_loss: 1.2985, test_loss: 1.3275, test_f1: 0.2274
 epoch: 35, train_loss: 1.3008, test_loss: 1.3201, test_f1: 0.2274
 epoch: 36, train_loss: 1.3001, test_loss: 1.3139, test_f1: 0.2274
 epoch: 37, train_loss: 1.2968, test_loss: 2.2117, test_f1: 0.2301
 epoch: 38, train_loss: 1.2996, test_loss: 1.3158, test_f1: 0.2274
 epoch: 39, train_loss: 1.3025, test_loss: 1.3153, test_f1: 0.2274
 epoch: 40, train_loss: 1.3083, test_loss: 1.3205, test_f1: 0.2274
 epoch: 41, train_loss: 1.3094, test_loss: 1.3129, test_f1: 0.2274
 epoch: 42, train_loss: 1.3034, test_loss: 1.3141, test_f1: 0.2274
 epoch: 43, train_loss: 1.3020, test_loss: 1.3223, test_f1: 0.2274
 epoch: 44, train_loss: 1.3047, test_loss: 1.3179, test_f1: 0.2274
 epoch: 45, train_loss: 1.3106, test_loss: 1.3198, test_f1: 0.2274
 epoch: 46, train_loss: 1.3042, test_loss: 1.3116, test_f1: 0.2274
 epoch: 47, train_loss: 1.3027, test_loss: 1.3194, test_f1: 0.2276
 epoch: 48, train_loss: 1.3047, test_loss: 1.3134, test_f1: 0.2274
 epoch: 49, train_loss: 1.3064, test_loss: 1.3177, test_f1: 0.2274
 epoch: 50, train_loss: 1.3018, test_loss: 1.3133, test_f1: 0.2274
 epoch: 51, train_loss: 1.2992, test_loss: 1.3133, test_f1: 0.2274
 epoch: 52, train_loss: 1.3019, test_loss: 1.3144, test_f1: 0.2274
 epoch: 53, train_loss: 1.3004, test_loss: 1.3123, test_f1: 0.2274
 epoch: 54, train_loss: 1.3001, test_loss: 1.3137, test_f1: 0.2274
 epoch: 55, train_loss: 1.3013, test_loss: 1.3157, test_f1: 0.2274
 epoch: 56, train_loss: 1.2990, test_loss: 1.3123, test_f1: 0.2274
 epoch: 57, train_loss: 1.2996, test_loss: 1.3139, test_f1: 0.2274
 epoch: 58, train_loss: 1.2985, test_loss: 1.3157, test_f1: 0.2274
 epoch: 59, train_loss: 1.2996, test_loss: 1.3147, test_f1: 0.2274
 epoch: 60, train_loss: 1.3009, test_loss: 1.3132, test_f1: 0.2274
 epoch: 61, train_loss: 1.2987, test_loss: 1.3143, test_f1: 0.2274
 epoch: 62, train_loss: 1.2964, test_loss: 1.3145, test_f1: 0.2274
 epoch: 63, train_loss: 1.2966, test_loss: 1.3149, test_f1: 0.2274
 epoch: 64, train_loss: 1.2989, test_loss: 1.3141, test_f1: 0.2274
 epoch: 65, train_loss: 1.3007, test_loss: 1.3131, test_f1: 0.2274
 epoch: 66, train_loss: 1.2990, test_loss: 1.3145, test_f1: 0.2274
 epoch: 67, train_loss: 1.3006, test_loss: 1.3179, test_f1: 0.2274
 epoch: 68, train_loss: 1.3021, test_loss: 1.3116, test_f1: 0.2274
 epoch: 69, train_loss: 1.3012, test_loss: 1.3218, test_f1: 0.2274
 epoch: 70, train_loss: 1.3016, test_loss: 1.3116, test_f1: 0.2274
 epoch: 71, train_loss: 1.2988, test_loss: 1.3158, test_f1: 0.2274
 epoch: 72, train_loss: 1.3002, test_loss: 1.3138, test_f1: 0.2274
 epoch: 73, train_loss: 1.2998, test_loss: 1.3191, test_f1: 0.2274
 epoch: 74, train_loss: 1.2997, test_loss: 1.3120, test_f1: 0.2274
 epoch: 75, train_loss: 1.3014, test_loss: 1.3148, test_f1: 0.2274
 epoch: 76, train_loss: 1.3005, test_loss: 1.3140, test_f1: 0.2274
 epoch: 77, train_loss: 1.3014, test_loss: 1.3141, test_f1: 0.2274
 epoch: 78, train_loss: 1.3038, test_loss: 1.3210, test_f1: 0.2274
 epoch: 79, train_loss: 1.3009, test_loss: 1.3133, test_f1: 0.2274
 epoch: 80, train_loss: 1.3015, test_loss: 1.3143, test_f1: 0.2274
 epoch: 81, train_loss: 1.3010, test_loss: 1.3179, test_f1: 0.2274
 epoch: 82, train_loss: 1.2987, test_loss: 1.3140, test_f1: 0.2274
 epoch: 83, train_loss: 1.3032, test_loss: 1.3146, test_f1: 0.2274
 epoch: 84, train_loss: 1.3004, test_loss: 1.3147, test_f1: 0.2274
 epoch: 85, train_loss: 1.2982, test_loss: 1.3143, test_f1: 0.2274
 epoch: 86, train_loss: 1.2988, test_loss: 1.3143, test_f1: 0.2274
 epoch: 87, train_loss: 1.3003, test_loss: 1.3176, test_f1: 0.2274
 epoch: 88, train_loss: 1.2989, test_loss: 1.3123, test_f1: 0.2274
 epoch: 89, train_loss: 1.2990, test_loss: 1.3151, test_f1: 0.2274
 epoch: 90, train_loss: 1.2990, test_loss: 1.3119, test_f1: 0.2274
 epoch: 91, train_loss: 1.3022, test_loss: 1.3171, test_f1: 0.2274
 epoch: 92, train_loss: 1.2971, test_loss: 1.3128, test_f1: 0.2274
 epoch: 93, train_loss: 1.2997, test_loss: 1.3174, test_f1: 0.2274
 epoch: 94, train_loss: 1.2996, test_loss: 1.3123, test_f1: 0.2274
 epoch: 95, train_loss: 1.3013, test_loss: 1.3202, test_f1: 0.2274
 epoch: 96, train_loss: 1.3027, test_loss: 1.3157, test_f1: 0.2274
 epoch: 97, train_loss: 1.3010, test_loss: 1.3145, test_f1: 0.2274
 epoch: 98, train_loss: 1.3019, test_loss: 1.3165, test_f1: 0.2274
 epoch: 99, train_loss: 1.2988, test_loss: 1.3137, test_f1: 0.2274
##################ITERATION #5 ****************************************
 epoch: 0, train_loss: 1.3399, test_loss: 1.2919, test_f1: 0.2274
 epoch: 1, train_loss: 1.2947, test_loss: 1.3124, test_f1: 0.2274
 epoch: 2, train_loss: 1.2853, test_loss: 1.2788, test_f1: 0.2274
 epoch: 3, train_loss: 1.2818, test_loss: 1.2945, test_f1: 0.2274
 epoch: 4, train_loss: 1.2707, test_loss: 1.2751, test_f1: 0.2274
 epoch: 5, train_loss: 1.2642, test_loss: 1.2698, test_f1: 0.2786
 epoch: 6, train_loss: 1.2590, test_loss: 1.2204, test_f1: 0.2992
 epoch: 7, train_loss: 1.2271, test_loss: 1.1960, test_f1: 0.3032
 epoch: 8, train_loss: 1.1957, test_loss: 1.1520, test_f1: 0.3312
 epoch: 9, train_loss: 1.1917, test_loss: 1.1639, test_f1: 0.3159
 epoch: 10, train_loss: 1.1763, test_loss: 1.2203, test_f1: 0.3283
 epoch: 11, train_loss: 1.1669, test_loss: 1.1720, test_f1: 0.3311
 epoch: 12, train_loss: 1.1646, test_loss: 1.3590, test_f1: 0.3010
 epoch: 13, train_loss: 1.1550, test_loss: 1.1211, test_f1: 0.3391
 epoch: 14, train_loss: 1.1476, test_loss: 1.1734, test_f1: 0.3269
 epoch: 15, train_loss: 1.1277, test_loss: 1.1711, test_f1: 0.3221
 epoch: 16, train_loss: 1.1378, test_loss: 1.1852, test_f1: 0.3199
 epoch: 17, train_loss: 1.1284, test_loss: 1.1247, test_f1: 0.3423
 epoch: 18, train_loss: 1.1094, test_loss: 1.1740, test_f1: 0.3349
 epoch: 19, train_loss: 1.1153, test_loss: 1.1904, test_f1: 0.4422
 epoch: 20, train_loss: 1.1031, test_loss: 1.1238, test_f1: 0.3381
 epoch: 21, train_loss: 1.1015, test_loss: 1.2840, test_f1: 0.3662
 epoch: 22, train_loss: 1.0904, test_loss: 1.1268, test_f1: 0.4426
 epoch: 23, train_loss: 1.0946, test_loss: 1.1764, test_f1: 0.3214
 epoch: 24, train_loss: 1.0840, test_loss: 1.1209, test_f1: 0.4174
 epoch: 25, train_loss: 1.0606, test_loss: 1.1525, test_f1: 0.3377
 epoch: 26, train_loss: 1.0613, test_loss: 1.1119, test_f1: 0.3352
 epoch: 27, train_loss: 1.0962, test_loss: 1.1066, test_f1: 0.3415
 epoch: 28, train_loss: 1.0861, test_loss: 1.1560, test_f1: 0.3356
 epoch: 29, train_loss: 1.0776, test_loss: 1.1759, test_f1: 0.3376
 epoch: 30, train_loss: 1.0494, test_loss: 1.1377, test_f1: 0.4592
 epoch: 31, train_loss: 1.0450, test_loss: 1.1710, test_f1: 0.4524
 epoch: 32, train_loss: 1.0372, test_loss: 1.1650, test_f1: 0.4464
 epoch: 33, train_loss: 1.0582, test_loss: 1.1895, test_f1: 0.3398
 epoch: 34, train_loss: 1.0439, test_loss: 1.1102, test_f1: 0.4395
 epoch: 35, train_loss: 1.0381, test_loss: 1.3427, test_f1: 0.3962
 epoch: 36, train_loss: 1.0401, test_loss: 1.1122, test_f1: 0.4759
 epoch: 37, train_loss: 1.0332, test_loss: 1.3310, test_f1: 0.4331
 epoch: 38, train_loss: 1.0410, test_loss: 1.1154, test_f1: 0.4513
 epoch: 39, train_loss: 1.0431, test_loss: 1.1325, test_f1: 0.3405
 epoch: 40, train_loss: 1.0386, test_loss: 1.1183, test_f1: 0.4500
 epoch: 41, train_loss: 1.0552, test_loss: 1.4127, test_f1: 0.3819
 epoch: 42, train_loss: 1.0533, test_loss: 1.1139, test_f1: 0.4708
 epoch: 43, train_loss: 1.0438, test_loss: 1.2987, test_f1: 0.3192
 epoch: 44, train_loss: 1.0383, test_loss: 1.2651, test_f1: 0.4195
 epoch: 45, train_loss: 1.0269, test_loss: 1.2881, test_f1: 0.4267
 epoch: 46, train_loss: 1.0258, test_loss: 1.2873, test_f1: 0.3192
 epoch: 47, train_loss: 1.0198, test_loss: 1.3160, test_f1: 0.4250
 epoch: 48, train_loss: 1.0290, test_loss: 1.2998, test_f1: 0.4357
 epoch: 49, train_loss: 1.0180, test_loss: 1.3160, test_f1: 0.4371
 epoch: 50, train_loss: 1.0120, test_loss: 1.3010, test_f1: 0.4416
 epoch: 51, train_loss: 1.0071, test_loss: 1.2919, test_f1: 0.4265
 epoch: 52, train_loss: 1.0116, test_loss: 1.2721, test_f1: 0.4360
 epoch: 53, train_loss: 1.0104, test_loss: 1.3155, test_f1: 0.4523
 epoch: 54, train_loss: 1.0188, test_loss: 1.2973, test_f1: 0.4397
 epoch: 55, train_loss: 1.0031, test_loss: 1.2440, test_f1: 0.4504
 epoch: 56, train_loss: 0.9943, test_loss: 1.2836, test_f1: 0.4464
 epoch: 57, train_loss: 0.9994, test_loss: 1.2845, test_f1: 0.4440
 epoch: 58, train_loss: 0.9978, test_loss: 1.2826, test_f1: 0.4409
 epoch: 59, train_loss: 0.9854, test_loss: 1.3005, test_f1: 0.4226
 epoch: 60, train_loss: 0.9822, test_loss: 1.3037, test_f1: 0.4323
 epoch: 61, train_loss: 0.9888, test_loss: 1.1651, test_f1: 0.4327
 epoch: 62, train_loss: 0.9992, test_loss: 1.3587, test_f1: 0.4015
 epoch: 63, train_loss: 0.9819, test_loss: 1.3006, test_f1: 0.4458
 epoch: 64, train_loss: 0.9891, test_loss: 1.2991, test_f1: 0.4225
 epoch: 65, train_loss: 0.9878, test_loss: 1.3185, test_f1: 0.4063
 epoch: 66, train_loss: 0.9919, test_loss: 1.3020, test_f1: 0.4387
 epoch: 67, train_loss: 0.9904, test_loss: 1.2994, test_f1: 0.4470
 epoch: 68, train_loss: 0.9788, test_loss: 1.2699, test_f1: 0.4489
 epoch: 69, train_loss: 0.9745, test_loss: 1.2877, test_f1: 0.4510
 epoch: 70, train_loss: 0.9928, test_loss: 1.3141, test_f1: 0.4501
 epoch: 71, train_loss: 0.9855, test_loss: 1.3247, test_f1: 0.4484
 epoch: 72, train_loss: 0.9857, test_loss: 1.3482, test_f1: 0.4370
 epoch: 73, train_loss: 0.9723, test_loss: 1.2976, test_f1: 0.4550
 epoch: 74, train_loss: 0.9732, test_loss: 1.3191, test_f1: 0.4474
 epoch: 75, train_loss: 0.9608, test_loss: 1.2976, test_f1: 0.4624
 epoch: 76, train_loss: 0.9556, test_loss: 1.3098, test_f1: 0.4549
 epoch: 77, train_loss: 0.9617, test_loss: 1.3100, test_f1: 0.4265
 epoch: 78, train_loss: 0.9723, test_loss: 1.3444, test_f1: 0.4332
 epoch: 79, train_loss: 0.9793, test_loss: 1.3652, test_f1: 0.4253
 epoch: 80, train_loss: 0.9744, test_loss: 1.3081, test_f1: 0.4757
 epoch: 81, train_loss: 0.9584, test_loss: 1.3157, test_f1: 0.4549
 epoch: 82, train_loss: 0.9646, test_loss: 1.3052, test_f1: 0.4507
 epoch: 83, train_loss: 0.9573, test_loss: 1.3243, test_f1: 0.4459
 epoch: 84, train_loss: 0.9606, test_loss: 1.2278, test_f1: 0.4485
 epoch: 85, train_loss: 0.9681, test_loss: 1.3181, test_f1: 0.4463
 epoch: 86, train_loss: 0.9634, test_loss: 1.3271, test_f1: 0.4504
 epoch: 87, train_loss: 0.9557, test_loss: 1.2612, test_f1: 0.4471
 epoch: 88, train_loss: 0.9472, test_loss: 1.3590, test_f1: 0.4405
 epoch: 89, train_loss: 0.9523, test_loss: 1.3321, test_f1: 0.4541
 epoch: 90, train_loss: 0.9415, test_loss: 1.3309, test_f1: 0.4292
 epoch: 91, train_loss: 0.9522, test_loss: 1.3244, test_f1: 0.4522
 epoch: 92, train_loss: 0.9565, test_loss: 1.4729, test_f1: 0.4117
 epoch: 93, train_loss: 0.9623, test_loss: 1.2887, test_f1: 0.4458
 epoch: 94, train_loss: 0.9597, test_loss: 1.3372, test_f1: 0.4408
 epoch: 95, train_loss: 0.9495, test_loss: 1.3621, test_f1: 0.4273
 epoch: 96, train_loss: 0.9626, test_loss: 1.3393, test_f1: 0.4437
 epoch: 97, train_loss: 0.9561, test_loss: 1.3395, test_f1: 0.4422
 epoch: 98, train_loss: 0.9426, test_loss: 1.3690, test_f1: 0.4439
 epoch: 99, train_loss: 0.9378, test_loss: 1.3276, test_f1: 0.4525
##################ITERATION #6 ****************************************
 epoch: 0, train_loss: 1.4156, test_loss: 1.2923, test_f1: 0.2274
 epoch: 1, train_loss: 1.2993, test_loss: 1.3115, test_f1: 0.2274
 epoch: 2, train_loss: 1.2836, test_loss: 1.2912, test_f1: 0.2274
 epoch: 3, train_loss: 1.2649, test_loss: 1.2622, test_f1: 0.3402
 epoch: 4, train_loss: 1.2584, test_loss: 1.2288, test_f1: 0.3010
 epoch: 5, train_loss: 1.2404, test_loss: 1.2139, test_f1: 0.3210
 epoch: 6, train_loss: 1.2065, test_loss: 1.1820, test_f1: 0.3186
 epoch: 7, train_loss: 1.1717, test_loss: 1.1267, test_f1: 0.3354
 epoch: 8, train_loss: 1.1619, test_loss: 1.2636, test_f1: 0.3209
 epoch: 9, train_loss: 1.1481, test_loss: 1.2272, test_f1: 0.3381
 epoch: 10, train_loss: 1.1539, test_loss: 1.1392, test_f1: 0.3342
 epoch: 11, train_loss: 1.1469, test_loss: 1.2222, test_f1: 0.3391
 epoch: 12, train_loss: 1.1177, test_loss: 1.2728, test_f1: 0.3239
 epoch: 13, train_loss: 1.1210, test_loss: 1.2262, test_f1: 0.3362
 epoch: 14, train_loss: 1.1268, test_loss: 1.2201, test_f1: 0.3364
 epoch: 15, train_loss: 1.1449, test_loss: 1.2114, test_f1: 0.3381
 epoch: 16, train_loss: 1.1256, test_loss: 1.2027, test_f1: 0.3391
 epoch: 17, train_loss: 1.1240, test_loss: 1.1973, test_f1: 0.3556
 epoch: 18, train_loss: 1.0995, test_loss: 1.3636, test_f1: 0.3227
 epoch: 19, train_loss: 1.1179, test_loss: 1.3812, test_f1: 0.3181
 epoch: 20, train_loss: 1.1159, test_loss: 1.1978, test_f1: 0.3352
 epoch: 21, train_loss: 1.1091, test_loss: 1.1907, test_f1: 0.3322
 epoch: 22, train_loss: 1.1068, test_loss: 1.1965, test_f1: 0.3352
 epoch: 23, train_loss: 1.1227, test_loss: 1.3039, test_f1: 0.3132
 epoch: 24, train_loss: 1.1202, test_loss: 1.2644, test_f1: 0.3279
 epoch: 25, train_loss: 1.1044, test_loss: 1.0792, test_f1: 0.3448
 epoch: 26, train_loss: 1.1137, test_loss: 1.1054, test_f1: 0.3417
 epoch: 27, train_loss: 1.1149, test_loss: 1.2334, test_f1: 0.3554
 epoch: 28, train_loss: 1.0984, test_loss: 1.1655, test_f1: 0.3422
 epoch: 29, train_loss: 1.0864, test_loss: 1.1623, test_f1: 0.3655
 epoch: 30, train_loss: 1.0916, test_loss: 1.3595, test_f1: 0.3283
 epoch: 31, train_loss: 1.0718, test_loss: 1.3363, test_f1: 0.3527
 epoch: 32, train_loss: 1.0779, test_loss: 1.3546, test_f1: 0.3229
 epoch: 33, train_loss: 1.0924, test_loss: 1.3502, test_f1: 0.3328
 epoch: 34, train_loss: 1.0825, test_loss: 1.1765, test_f1: 0.3521
 epoch: 35, train_loss: 1.0730, test_loss: 1.3519, test_f1: 0.3190
 epoch: 36, train_loss: 1.0612, test_loss: 1.1533, test_f1: 0.3405
 epoch: 37, train_loss: 1.0672, test_loss: 1.3619, test_f1: 0.3202
 epoch: 38, train_loss: 1.0668, test_loss: 1.3681, test_f1: 0.3761
 epoch: 39, train_loss: 1.0721, test_loss: 1.1631, test_f1: 0.3670
 epoch: 40, train_loss: 1.0635, test_loss: 1.3248, test_f1: 0.4110
 epoch: 41, train_loss: 1.0521, test_loss: 1.1429, test_f1: 0.3512
 epoch: 42, train_loss: 1.0448, test_loss: 1.1300, test_f1: 0.3955
 epoch: 43, train_loss: 1.0617, test_loss: 1.3320, test_f1: 0.3190
 epoch: 44, train_loss: 1.0468, test_loss: 1.3271, test_f1: 0.3183
 epoch: 45, train_loss: 1.0491, test_loss: 1.1382, test_f1: 0.3371
 epoch: 46, train_loss: 1.0447, test_loss: 1.1539, test_f1: 0.4763
 epoch: 47, train_loss: 1.0399, test_loss: 1.3583, test_f1: 0.4300
 epoch: 48, train_loss: 1.0401, test_loss: 1.3166, test_f1: 0.3190
 epoch: 49, train_loss: 1.0363, test_loss: 1.1276, test_f1: 0.3381
 epoch: 50, train_loss: 1.0288, test_loss: 1.3721, test_f1: 0.4399
 epoch: 51, train_loss: 1.0147, test_loss: 1.1291, test_f1: 0.3530
 epoch: 52, train_loss: 1.0100, test_loss: 1.2198, test_f1: 0.3348
 epoch: 53, train_loss: 1.0067, test_loss: 1.3184, test_f1: 0.3287
 epoch: 54, train_loss: 1.0187, test_loss: 1.3159, test_f1: 0.3560
 epoch: 55, train_loss: 1.0275, test_loss: 1.1234, test_f1: 0.4432
 epoch: 56, train_loss: 1.0046, test_loss: 1.1119, test_f1: 0.3399
 epoch: 57, train_loss: 1.0063, test_loss: 1.3147, test_f1: 0.4452
 epoch: 58, train_loss: 1.0062, test_loss: 1.2881, test_f1: 0.3326
 epoch: 59, train_loss: 1.0126, test_loss: 1.1254, test_f1: 0.4807
 epoch: 60, train_loss: 1.0133, test_loss: 1.3530, test_f1: 0.3220
 epoch: 61, train_loss: 1.0120, test_loss: 1.1021, test_f1: 0.4706
 epoch: 62, train_loss: 1.0064, test_loss: 1.3067, test_f1: 0.4356
 epoch: 63, train_loss: 1.0113, test_loss: 1.3214, test_f1: 0.3183
 epoch: 64, train_loss: 1.0098, test_loss: 1.3263, test_f1: 0.3329
 epoch: 65, train_loss: 1.0041, test_loss: 1.3114, test_f1: 0.4526
 epoch: 66, train_loss: 1.0177, test_loss: 1.2172, test_f1: 0.4689
 epoch: 67, train_loss: 1.0094, test_loss: 1.1245, test_f1: 0.3536
 epoch: 68, train_loss: 1.0142, test_loss: 1.1396, test_f1: 0.3331
 epoch: 69, train_loss: 1.0021, test_loss: 1.1100, test_f1: 0.3442
 epoch: 70, train_loss: 1.0024, test_loss: 1.1053, test_f1: 0.3375
 epoch: 71, train_loss: 1.0103, test_loss: 1.1549, test_f1: 0.3281
 epoch: 72, train_loss: 1.0197, test_loss: 1.1466, test_f1: 0.4838
 epoch: 73, train_loss: 1.0106, test_loss: 1.1824, test_f1: 0.3255
 epoch: 74, train_loss: 1.0036, test_loss: 1.2930, test_f1: 0.3654
 epoch: 75, train_loss: 0.9893, test_loss: 1.3276, test_f1: 0.4476
 epoch: 76, train_loss: 1.0007, test_loss: 1.3294, test_f1: 0.4468
 epoch: 77, train_loss: 0.9905, test_loss: 1.3226, test_f1: 0.4321
 epoch: 78, train_loss: 0.9907, test_loss: 1.3286, test_f1: 0.4562
 epoch: 79, train_loss: 0.9803, test_loss: 1.3297, test_f1: 0.3287
 epoch: 80, train_loss: 0.9994, test_loss: 1.3354, test_f1: 0.3309
 epoch: 81, train_loss: 0.9999, test_loss: 1.3212, test_f1: 0.3347
 epoch: 82, train_loss: 0.9887, test_loss: 1.3214, test_f1: 0.3365
 epoch: 83, train_loss: 0.9961, test_loss: 1.3467, test_f1: 0.4426
 epoch: 84, train_loss: 0.9961, test_loss: 1.3195, test_f1: 0.3282
 epoch: 85, train_loss: 0.9934, test_loss: 1.2556, test_f1: 0.4756
 epoch: 86, train_loss: 1.0021, test_loss: 1.3300, test_f1: 0.4450
 epoch: 87, train_loss: 0.9987, test_loss: 1.3408, test_f1: 0.3479
 epoch: 88, train_loss: 0.9783, test_loss: 1.2646, test_f1: 0.3227
 epoch: 89, train_loss: 1.0004, test_loss: 1.3413, test_f1: 0.3188
 epoch: 90, train_loss: 0.9919, test_loss: 1.3293, test_f1: 0.4195
 epoch: 91, train_loss: 0.9928, test_loss: 1.3092, test_f1: 0.4840
 epoch: 92, train_loss: 0.9855, test_loss: 1.2923, test_f1: 0.3399
 epoch: 93, train_loss: 0.9931, test_loss: 1.3276, test_f1: 0.3188
 epoch: 94, train_loss: 0.9950, test_loss: 1.3167, test_f1: 0.3183
 epoch: 95, train_loss: 0.9948, test_loss: 1.2831, test_f1: 0.3700
 epoch: 96, train_loss: 1.0052, test_loss: 1.3046, test_f1: 0.4599
 epoch: 97, train_loss: 0.9955, test_loss: 1.1728, test_f1: 0.4533
 epoch: 98, train_loss: 0.9934, test_loss: 1.3375, test_f1: 0.3254
 epoch: 99, train_loss: 0.9844, test_loss: 1.3352, test_f1: 0.4562
##################ITERATION #7 ****************************************
 epoch: 0, train_loss: 1.3453, test_loss: 1.6721, test_f1: 0.2750
 epoch: 1, train_loss: 1.2983, test_loss: 1.2962, test_f1: 0.2588
 epoch: 2, train_loss: 1.2773, test_loss: 1.2782, test_f1: 0.2274
 epoch: 3, train_loss: 1.2643, test_loss: 1.2788, test_f1: 0.2274
 epoch: 4, train_loss: 1.2546, test_loss: 1.2401, test_f1: 0.2615
 epoch: 5, train_loss: 1.2006, test_loss: 1.1295, test_f1: 0.3423
 epoch: 6, train_loss: 1.1734, test_loss: 1.2159, test_f1: 0.2983
 epoch: 7, train_loss: 1.1600, test_loss: 1.2346, test_f1: 0.3258
 epoch: 8, train_loss: 1.1262, test_loss: 1.1233, test_f1: 0.3363
 epoch: 9, train_loss: 1.1264, test_loss: 1.2242, test_f1: 0.3336
 epoch: 10, train_loss: 1.1360, test_loss: 1.1280, test_f1: 0.3325
 epoch: 11, train_loss: 1.1211, test_loss: 1.2225, test_f1: 0.3397
 epoch: 12, train_loss: 1.1424, test_loss: 1.1526, test_f1: 0.3240
 epoch: 13, train_loss: 1.1336, test_loss: 1.2199, test_f1: 0.3376
 epoch: 14, train_loss: 1.1056, test_loss: 1.2022, test_f1: 0.3371
 epoch: 15, train_loss: 1.0993, test_loss: 1.2427, test_f1: 0.3344
 epoch: 16, train_loss: 1.1094, test_loss: 1.2051, test_f1: 0.3354
 epoch: 17, train_loss: 1.1158, test_loss: 1.2170, test_f1: 0.3347
 epoch: 18, train_loss: 1.1119, test_loss: 1.1369, test_f1: 0.3287
 epoch: 19, train_loss: 1.1190, test_loss: 1.2218, test_f1: 0.3342
 epoch: 20, train_loss: 1.1027, test_loss: 1.2052, test_f1: 0.3371
 epoch: 21, train_loss: 1.0945, test_loss: 1.2249, test_f1: 0.3352
 epoch: 22, train_loss: 1.0814, test_loss: 1.1977, test_f1: 0.3328
 epoch: 23, train_loss: 1.0846, test_loss: 1.1886, test_f1: 0.3352
 epoch: 24, train_loss: 1.0810, test_loss: 1.1815, test_f1: 0.3342
 epoch: 25, train_loss: 1.0676, test_loss: 1.1634, test_f1: 0.3414
 epoch: 26, train_loss: 1.0549, test_loss: 1.1606, test_f1: 0.3416
 epoch: 27, train_loss: 1.0736, test_loss: 1.1667, test_f1: 0.3683
 epoch: 28, train_loss: 1.0952, test_loss: 1.0960, test_f1: 0.4204
 epoch: 29, train_loss: 1.1022, test_loss: 1.1674, test_f1: 0.3699
 epoch: 30, train_loss: 1.0700, test_loss: 1.1548, test_f1: 0.3393
 epoch: 31, train_loss: 1.0651, test_loss: 1.3159, test_f1: 0.3254
 epoch: 32, train_loss: 1.0640, test_loss: 1.1151, test_f1: 0.3371
 epoch: 33, train_loss: 1.0562, test_loss: 1.1404, test_f1: 0.3456
 epoch: 34, train_loss: 1.0506, test_loss: 1.1525, test_f1: 0.4010
 epoch: 35, train_loss: 1.0352, test_loss: 1.1251, test_f1: 0.3524
 epoch: 36, train_loss: 1.0375, test_loss: 1.1630, test_f1: 0.3376
 epoch: 37, train_loss: 1.0593, test_loss: 1.3893, test_f1: 0.3190
 epoch: 38, train_loss: 1.0708, test_loss: 1.0743, test_f1: 0.3659
 epoch: 39, train_loss: 1.0535, test_loss: 1.1532, test_f1: 0.3761
 epoch: 40, train_loss: 1.0517, test_loss: 1.1462, test_f1: 0.3539
 epoch: 41, train_loss: 1.0480, test_loss: 1.1055, test_f1: 0.4056
 epoch: 42, train_loss: 1.0889, test_loss: 1.0396, test_f1: 0.3490
 epoch: 43, train_loss: 1.0650, test_loss: 1.1551, test_f1: 0.3903
 epoch: 44, train_loss: 1.0502, test_loss: 1.1370, test_f1: 0.3456
 epoch: 45, train_loss: 1.0563, test_loss: 1.1194, test_f1: 0.3420
 epoch: 46, train_loss: 1.0704, test_loss: 1.1796, test_f1: 0.3950
 epoch: 47, train_loss: 1.0437, test_loss: 1.1320, test_f1: 0.3795
 epoch: 48, train_loss: 1.0508, test_loss: 1.1473, test_f1: 0.4655
 epoch: 49, train_loss: 1.0416, test_loss: 1.1713, test_f1: 0.4254
 epoch: 50, train_loss: 1.0424, test_loss: 1.1968, test_f1: 0.3917
 epoch: 51, train_loss: 1.0336, test_loss: 1.1489, test_f1: 0.3362
 epoch: 52, train_loss: 1.0201, test_loss: 1.1488, test_f1: 0.4220
 epoch: 53, train_loss: 1.0259, test_loss: 1.1275, test_f1: 0.3519
 epoch: 54, train_loss: 1.0126, test_loss: 1.1358, test_f1: 0.3493
 epoch: 55, train_loss: 1.0067, test_loss: 1.1211, test_f1: 0.4236
 epoch: 56, train_loss: 1.0115, test_loss: 1.1407, test_f1: 0.4164
 epoch: 57, train_loss: 1.0093, test_loss: 1.1274, test_f1: 0.4239
 epoch: 58, train_loss: 1.0143, test_loss: 1.1752, test_f1: 0.3300
 epoch: 59, train_loss: 1.0115, test_loss: 1.1502, test_f1: 0.4055
 epoch: 60, train_loss: 1.0132, test_loss: 1.1872, test_f1: 0.3324
 epoch: 61, train_loss: 1.0041, test_loss: 1.2197, test_f1: 0.3187
 epoch: 62, train_loss: 1.0132, test_loss: 1.1267, test_f1: 0.3487
 epoch: 63, train_loss: 1.0081, test_loss: 1.1299, test_f1: 0.3900
 epoch: 64, train_loss: 1.0053, test_loss: 1.1349, test_f1: 0.3364
 epoch: 65, train_loss: 0.9955, test_loss: 1.1423, test_f1: 0.3374
 epoch: 66, train_loss: 1.0009, test_loss: 1.1565, test_f1: 0.4043
 epoch: 67, train_loss: 1.0146, test_loss: 1.1407, test_f1: 0.3371
 epoch: 68, train_loss: 0.9979, test_loss: 1.1672, test_f1: 0.3366
 epoch: 69, train_loss: 1.0009, test_loss: 1.1448, test_f1: 0.3374
 epoch: 70, train_loss: 1.0093, test_loss: 1.1471, test_f1: 0.3390
 epoch: 71, train_loss: 0.9995, test_loss: 1.1170, test_f1: 0.4529
 epoch: 72, train_loss: 1.0054, test_loss: 1.3367, test_f1: 0.3339
 epoch: 73, train_loss: 1.0151, test_loss: 1.2477, test_f1: 0.4091
 epoch: 74, train_loss: 1.0036, test_loss: 1.1681, test_f1: 0.4212
 epoch: 75, train_loss: 0.9996, test_loss: 1.1782, test_f1: 0.3309
 epoch: 76, train_loss: 0.9953, test_loss: 1.1478, test_f1: 0.4031
 epoch: 77, train_loss: 1.0011, test_loss: 1.1299, test_f1: 0.3429
 epoch: 78, train_loss: 0.9901, test_loss: 1.1605, test_f1: 0.4372
 epoch: 79, train_loss: 0.9951, test_loss: 1.3050, test_f1: 0.3792
 epoch: 80, train_loss: 1.0016, test_loss: 1.1615, test_f1: 0.3397
 epoch: 81, train_loss: 0.9979, test_loss: 1.1583, test_f1: 0.3468
 epoch: 82, train_loss: 1.0017, test_loss: 1.2009, test_f1: 0.3402
 epoch: 83, train_loss: 1.0083, test_loss: 1.1617, test_f1: 0.3441
 epoch: 84, train_loss: 0.9980, test_loss: 1.1477, test_f1: 0.4439
 epoch: 85, train_loss: 0.9883, test_loss: 1.1427, test_f1: 0.4461
 epoch: 86, train_loss: 0.9911, test_loss: 1.1888, test_f1: 0.4347
 epoch: 87, train_loss: 1.0021, test_loss: 1.1294, test_f1: 0.3380
 epoch: 88, train_loss: 1.0039, test_loss: 1.1859, test_f1: 0.4505
 epoch: 89, train_loss: 0.9990, test_loss: 1.1680, test_f1: 0.3526
 epoch: 90, train_loss: 0.9960, test_loss: 1.1504, test_f1: 0.3926
 epoch: 91, train_loss: 0.9931, test_loss: 1.1517, test_f1: 0.4314
 epoch: 92, train_loss: 0.9910, test_loss: 1.1592, test_f1: 0.4693
 epoch: 93, train_loss: 0.9961, test_loss: 1.1223, test_f1: 0.3364
 epoch: 94, train_loss: 0.9815, test_loss: 1.1713, test_f1: 0.4269
 epoch: 95, train_loss: 0.9845, test_loss: 1.1901, test_f1: 0.4178
 epoch: 96, train_loss: 0.9946, test_loss: 1.1794, test_f1: 0.3349
 epoch: 97, train_loss: 1.0134, test_loss: 1.1595, test_f1: 0.3412
 epoch: 98, train_loss: 1.0116, test_loss: 1.1665, test_f1: 0.3690
 epoch: 99, train_loss: 0.9973, test_loss: 1.1702, test_f1: 0.4389
##################ITERATION #8 ****************************************
 epoch: 0, train_loss: 1.3412, test_loss: 1.5578, test_f1: 0.2589
 epoch: 1, train_loss: 1.2864, test_loss: 1.3063, test_f1: 0.2305
 epoch: 2, train_loss: 1.2744, test_loss: 1.2593, test_f1: 0.2326
 epoch: 3, train_loss: 1.2686, test_loss: 1.2621, test_f1: 0.2274
 epoch: 4, train_loss: 1.2685, test_loss: 1.2538, test_f1: 0.2619
 epoch: 5, train_loss: 1.2601, test_loss: 1.2464, test_f1: 0.2936
 epoch: 6, train_loss: 1.2596, test_loss: 1.2323, test_f1: 0.2510
 epoch: 7, train_loss: 1.2570, test_loss: 1.2705, test_f1: 0.2681
 epoch: 8, train_loss: 1.2350, test_loss: 1.2656, test_f1: 0.2713
 epoch: 9, train_loss: 1.2086, test_loss: 1.2200, test_f1: 0.2516
 epoch: 10, train_loss: 1.2061, test_loss: 1.2946, test_f1: 0.3304
 epoch: 11, train_loss: 1.1974, test_loss: 1.1041, test_f1: 0.3400
 epoch: 12, train_loss: 1.1708, test_loss: 1.1609, test_f1: 0.3311
 epoch: 13, train_loss: 1.1548, test_loss: 1.0974, test_f1: 0.3404
 epoch: 14, train_loss: 1.1643, test_loss: 1.1215, test_f1: 0.3384
 epoch: 15, train_loss: 1.1574, test_loss: 1.1128, test_f1: 0.3344
 epoch: 16, train_loss: 1.1457, test_loss: 1.2189, test_f1: 0.3344
 epoch: 17, train_loss: 1.1538, test_loss: 1.0954, test_f1: 0.3382
 epoch: 18, train_loss: 1.1332, test_loss: 1.2805, test_f1: 0.3352
 epoch: 19, train_loss: 1.1339, test_loss: 1.2101, test_f1: 0.3354
 epoch: 20, train_loss: 1.1239, test_loss: 1.2126, test_f1: 0.3362
 epoch: 21, train_loss: 1.1089, test_loss: 1.2833, test_f1: 0.3187
 epoch: 22, train_loss: 1.1164, test_loss: 1.1841, test_f1: 0.3342
 epoch: 23, train_loss: 1.1121, test_loss: 1.2004, test_f1: 0.4257
 epoch: 24, train_loss: 1.1160, test_loss: 1.2539, test_f1: 0.3371
 epoch: 25, train_loss: 1.1013, test_loss: 1.1766, test_f1: 0.3362
 epoch: 26, train_loss: 1.0913, test_loss: 1.1937, test_f1: 0.3371
 epoch: 27, train_loss: 1.0859, test_loss: 1.1526, test_f1: 0.4860
 epoch: 28, train_loss: 1.0892, test_loss: 1.3628, test_f1: 0.3200
 epoch: 29, train_loss: 1.0808, test_loss: 1.2874, test_f1: 0.3181
 epoch: 30, train_loss: 1.0659, test_loss: 1.1774, test_f1: 0.3371
 epoch: 31, train_loss: 1.0692, test_loss: 1.1921, test_f1: 0.3371
 epoch: 32, train_loss: 1.0784, test_loss: 1.2915, test_f1: 0.3642
 epoch: 33, train_loss: 1.0880, test_loss: 1.1555, test_f1: 0.3547
 epoch: 34, train_loss: 1.0452, test_loss: 1.1472, test_f1: 0.4388
 epoch: 35, train_loss: 1.0841, test_loss: 1.1512, test_f1: 0.3381
 epoch: 36, train_loss: 1.0808, test_loss: 1.1563, test_f1: 0.3334
 epoch: 37, train_loss: 1.0851, test_loss: 1.3651, test_f1: 0.3181
 epoch: 38, train_loss: 1.0712, test_loss: 1.1259, test_f1: 0.4470
 epoch: 39, train_loss: 1.0696, test_loss: 1.1405, test_f1: 0.4887
 epoch: 40, train_loss: 1.0671, test_loss: 1.1384, test_f1: 0.3811
 epoch: 41, train_loss: 1.0690, test_loss: 1.1863, test_f1: 0.4605
 epoch: 42, train_loss: 1.0592, test_loss: 1.1239, test_f1: 0.4591
 epoch: 43, train_loss: 1.0571, test_loss: 1.1908, test_f1: 0.4319
 epoch: 44, train_loss: 1.0673, test_loss: 1.1747, test_f1: 0.5047
 epoch: 45, train_loss: 1.0813, test_loss: 1.3810, test_f1: 0.4344
 epoch: 46, train_loss: 1.1047, test_loss: 1.0609, test_f1: 0.4290
 epoch: 47, train_loss: 1.0923, test_loss: 1.1625, test_f1: 0.3362
 epoch: 48, train_loss: 1.0726, test_loss: 1.1806, test_f1: 0.3729
 epoch: 49, train_loss: 1.0601, test_loss: 1.1725, test_f1: 0.4569
 epoch: 50, train_loss: 1.0562, test_loss: 1.1801, test_f1: 0.3397
 epoch: 51, train_loss: 1.0475, test_loss: 1.1198, test_f1: 0.4614
 epoch: 52, train_loss: 1.0366, test_loss: 1.1443, test_f1: 0.4567
 epoch: 53, train_loss: 1.0331, test_loss: 1.1314, test_f1: 0.4748
 epoch: 54, train_loss: 1.0338, test_loss: 1.1365, test_f1: 0.4718
 epoch: 55, train_loss: 1.0313, test_loss: 1.1382, test_f1: 0.4657
 epoch: 56, train_loss: 1.0326, test_loss: 1.1565, test_f1: 0.4602
 epoch: 57, train_loss: 1.0290, test_loss: 1.1321, test_f1: 0.4673
 epoch: 58, train_loss: 1.0431, test_loss: 1.1129, test_f1: 0.4670
 epoch: 59, train_loss: 1.0288, test_loss: 1.1266, test_f1: 0.4578
 epoch: 60, train_loss: 1.0270, test_loss: 1.1036, test_f1: 0.4637
 epoch: 61, train_loss: 1.0189, test_loss: 1.1211, test_f1: 0.4143
 epoch: 62, train_loss: 1.0223, test_loss: 1.1422, test_f1: 0.4544
 epoch: 63, train_loss: 1.0231, test_loss: 1.1283, test_f1: 0.4685
 epoch: 64, train_loss: 1.0281, test_loss: 1.1257, test_f1: 0.4704
 epoch: 65, train_loss: 1.0303, test_loss: 1.1589, test_f1: 0.4224
 epoch: 66, train_loss: 1.0178, test_loss: 1.1120, test_f1: 0.4688
 epoch: 67, train_loss: 1.0210, test_loss: 1.1327, test_f1: 0.4719
 epoch: 68, train_loss: 1.0273, test_loss: 1.1324, test_f1: 0.4541
 epoch: 69, train_loss: 1.0160, test_loss: 1.1453, test_f1: 0.4707
 epoch: 70, train_loss: 1.0347, test_loss: 1.1625, test_f1: 0.4688
 epoch: 71, train_loss: 1.0179, test_loss: 1.1071, test_f1: 0.4577
 epoch: 72, train_loss: 1.0112, test_loss: 1.1306, test_f1: 0.4659
 epoch: 73, train_loss: 1.0189, test_loss: 1.1204, test_f1: 0.4831
 epoch: 74, train_loss: 1.0257, test_loss: 1.1289, test_f1: 0.4575
 epoch: 75, train_loss: 1.0196, test_loss: 1.1298, test_f1: 0.4668
 epoch: 76, train_loss: 1.0137, test_loss: 1.1283, test_f1: 0.4673
 epoch: 77, train_loss: 1.0007, test_loss: 1.1184, test_f1: 0.4760
 epoch: 78, train_loss: 1.0274, test_loss: 1.1397, test_f1: 0.4693
 epoch: 79, train_loss: 1.0122, test_loss: 1.1120, test_f1: 0.4766
 epoch: 80, train_loss: 1.0197, test_loss: 1.1159, test_f1: 0.4832
 epoch: 81, train_loss: 1.0144, test_loss: 1.1175, test_f1: 0.4729
 epoch: 82, train_loss: 0.9995, test_loss: 1.1299, test_f1: 0.4686
 epoch: 83, train_loss: 1.0107, test_loss: 1.1342, test_f1: 0.4851
 epoch: 84, train_loss: 1.0127, test_loss: 1.1378, test_f1: 0.4531
 epoch: 85, train_loss: 1.0074, test_loss: 1.1107, test_f1: 0.4657
 epoch: 86, train_loss: 1.0169, test_loss: 1.1085, test_f1: 0.4690
 epoch: 87, train_loss: 0.9959, test_loss: 1.1409, test_f1: 0.4623
 epoch: 88, train_loss: 1.0048, test_loss: 1.1485, test_f1: 0.4613
 epoch: 89, train_loss: 1.0003, test_loss: 1.1293, test_f1: 0.4744
 epoch: 90, train_loss: 0.9880, test_loss: 1.1348, test_f1: 0.4808
 epoch: 91, train_loss: 1.0008, test_loss: 1.1391, test_f1: 0.4830
 epoch: 92, train_loss: 1.0207, test_loss: 1.1330, test_f1: 0.4714
 epoch: 93, train_loss: 1.0157, test_loss: 1.1316, test_f1: 0.4621
 epoch: 94, train_loss: 0.9831, test_loss: 1.1027, test_f1: 0.4695
 epoch: 95, train_loss: 0.9832, test_loss: 1.1207, test_f1: 0.4711
 epoch: 96, train_loss: 0.9745, test_loss: 1.1194, test_f1: 0.4777
 epoch: 97, train_loss: 0.9822, test_loss: 1.1200, test_f1: 0.4717
 epoch: 98, train_loss: 0.9965, test_loss: 1.1249, test_f1: 0.4416
 epoch: 99, train_loss: 0.9707, test_loss: 1.1365, test_f1: 0.4637
##################ITERATION #9 ****************************************
 epoch: 0, train_loss: 1.3879, test_loss: 1.4376, test_f1: 0.2580
 epoch: 1, train_loss: 1.2957, test_loss: 1.3142, test_f1: 0.2310
 epoch: 2, train_loss: 1.2898, test_loss: 1.3035, test_f1: 0.2274
 epoch: 3, train_loss: 1.2869, test_loss: 1.2892, test_f1: 0.2274
 epoch: 4, train_loss: 1.2770, test_loss: 1.2835, test_f1: 0.2274
 epoch: 5, train_loss: 1.2822, test_loss: 1.2821, test_f1: 0.2274
 epoch: 6, train_loss: 1.2875, test_loss: 1.2826, test_f1: 0.2274
 epoch: 7, train_loss: 1.2770, test_loss: 1.2793, test_f1: 0.2274
 epoch: 8, train_loss: 1.2753, test_loss: 1.2763, test_f1: 0.2274
 epoch: 9, train_loss: 1.2854, test_loss: 1.3039, test_f1: 0.2274
 epoch: 10, train_loss: 1.2817, test_loss: 1.2839, test_f1: 0.3187
 epoch: 11, train_loss: 1.2840, test_loss: 1.2711, test_f1: 0.2274
 epoch: 12, train_loss: 1.2714, test_loss: 1.2540, test_f1: 0.2274
 epoch: 13, train_loss: 1.2564, test_loss: 1.2668, test_f1: 0.3446
 epoch: 14, train_loss: 1.2765, test_loss: 1.3026, test_f1: 0.2274
 epoch: 15, train_loss: 1.2763, test_loss: 1.2753, test_f1: 0.2274
 epoch: 16, train_loss: 1.2683, test_loss: 1.2619, test_f1: 0.2274
 epoch: 17, train_loss: 1.2475, test_loss: 1.2696, test_f1: 0.2274
 epoch: 18, train_loss: 1.2406, test_loss: 1.2536, test_f1: 0.3243
 epoch: 19, train_loss: 1.2201, test_loss: 1.2712, test_f1: 0.3272
 epoch: 20, train_loss: 1.2378, test_loss: 1.2236, test_f1: 0.2274
 epoch: 21, train_loss: 1.2311, test_loss: 1.2060, test_f1: 0.2274
 epoch: 22, train_loss: 1.2164, test_loss: 1.2323, test_f1: 0.3315
 epoch: 23, train_loss: 1.2217, test_loss: 1.2272, test_f1: 0.2274
 epoch: 24, train_loss: 1.2194, test_loss: 1.2503, test_f1: 0.2997
 epoch: 25, train_loss: 1.2122, test_loss: 1.2043, test_f1: 0.3187
 epoch: 26, train_loss: 1.2207, test_loss: 1.2187, test_f1: 0.3204
 epoch: 27, train_loss: 1.2321, test_loss: 1.2304, test_f1: 0.2274
 epoch: 28, train_loss: 1.2137, test_loss: 1.2085, test_f1: 0.3355
 epoch: 29, train_loss: 1.2088, test_loss: 1.2418, test_f1: 0.2904
 epoch: 30, train_loss: 1.2100, test_loss: 1.2309, test_f1: 0.3435
 epoch: 31, train_loss: 1.2041, test_loss: 1.2550, test_f1: 0.3894
 epoch: 32, train_loss: 1.2157, test_loss: 1.1863, test_f1: 0.2985
 epoch: 33, train_loss: 1.1945, test_loss: 1.1817, test_f1: 0.4210
 epoch: 34, train_loss: 1.1948, test_loss: 1.1783, test_f1: 0.3798
 epoch: 35, train_loss: 1.1916, test_loss: 1.1714, test_f1: 0.4149
 epoch: 36, train_loss: 1.1905, test_loss: 1.1845, test_f1: 0.3118
 epoch: 37, train_loss: 1.1900, test_loss: 1.2060, test_f1: 0.3369
 epoch: 38, train_loss: 1.1954, test_loss: 1.2134, test_f1: 0.3811
 epoch: 39, train_loss: 1.1868, test_loss: 1.2175, test_f1: 0.3362
 epoch: 40, train_loss: 1.1894, test_loss: 1.2502, test_f1: 0.3598
 epoch: 41, train_loss: 1.1782, test_loss: 1.2508, test_f1: 0.2884
 epoch: 42, train_loss: 1.1678, test_loss: 1.3105, test_f1: 0.3617
 epoch: 43, train_loss: 1.1825, test_loss: 1.1722, test_f1: 0.3803
 epoch: 44, train_loss: 1.1669, test_loss: 1.1466, test_f1: 0.3262
 epoch: 45, train_loss: 1.1555, test_loss: 1.1366, test_f1: 0.3480
 epoch: 46, train_loss: 1.1764, test_loss: 1.2281, test_f1: 0.2920
 epoch: 47, train_loss: 1.1567, test_loss: 1.1594, test_f1: 0.3148
 epoch: 48, train_loss: 1.1582, test_loss: 1.1574, test_f1: 0.3181
 epoch: 49, train_loss: 1.1360, test_loss: 1.1573, test_f1: 0.4688
 epoch: 50, train_loss: 1.1580, test_loss: 1.2448, test_f1: 0.4157
 epoch: 51, train_loss: 1.1331, test_loss: 1.1867, test_f1: 0.3258
 epoch: 52, train_loss: 1.1148, test_loss: 1.2189, test_f1: 0.3514
 epoch: 53, train_loss: 1.1099, test_loss: 1.1883, test_f1: 0.3304
 epoch: 54, train_loss: 1.1050, test_loss: 1.2738, test_f1: 0.3802
 epoch: 55, train_loss: 1.0991, test_loss: 1.2087, test_f1: 0.4055
 epoch: 56, train_loss: 1.0851, test_loss: 1.1517, test_f1: 0.4136
 epoch: 57, train_loss: 1.0805, test_loss: 1.2363, test_f1: 0.3814
 epoch: 58, train_loss: 1.0760, test_loss: 1.2078, test_f1: 0.3676
 epoch: 59, train_loss: 1.0709, test_loss: 1.3323, test_f1: 0.2894
 epoch: 60, train_loss: 1.0618, test_loss: 1.1288, test_f1: 0.4576
 epoch: 61, train_loss: 1.0539, test_loss: 1.2210, test_f1: 0.3706
 epoch: 62, train_loss: 1.0462, test_loss: 1.1058, test_f1: 0.3336
 epoch: 63, train_loss: 1.0702, test_loss: 1.2903, test_f1: 0.3258
 epoch: 64, train_loss: 1.0614, test_loss: 1.1302, test_f1: 0.3502
 epoch: 65, train_loss: 1.0447, test_loss: 1.2362, test_f1: 0.3689
 epoch: 66, train_loss: 1.0446, test_loss: 1.2242, test_f1: 0.3571
 epoch: 67, train_loss: 1.0668, test_loss: 1.3502, test_f1: 0.3206
 epoch: 68, train_loss: 1.0441, test_loss: 1.2939, test_f1: 0.3595
 epoch: 69, train_loss: 1.0383, test_loss: 1.2561, test_f1: 0.4057
 epoch: 70, train_loss: 1.0335, test_loss: 1.1610, test_f1: 0.4291
 epoch: 71, train_loss: 1.0137, test_loss: 1.2682, test_f1: 0.3396
 epoch: 72, train_loss: 1.0177, test_loss: 1.3972, test_f1: 0.2638
 epoch: 73, train_loss: 1.0167, test_loss: 1.1537, test_f1: 0.4420
 epoch: 74, train_loss: 1.0230, test_loss: 1.5337, test_f1: 0.1921
 epoch: 75, train_loss: 1.0346, test_loss: 1.4102, test_f1: 0.3666
 epoch: 76, train_loss: 1.0065, test_loss: 1.4073, test_f1: 0.2785
 epoch: 77, train_loss: 1.0198, test_loss: 1.2604, test_f1: 0.3687
 epoch: 78, train_loss: 1.0168, test_loss: 1.1820, test_f1: 0.3801
 epoch: 79, train_loss: 1.0025, test_loss: 1.2083, test_f1: 0.4212
 epoch: 80, train_loss: 0.9984, test_loss: 1.2908, test_f1: 0.3819
 epoch: 81, train_loss: 0.9919, test_loss: 1.2851, test_f1: 0.3901
 epoch: 82, train_loss: 1.0048, test_loss: 1.3160, test_f1: 0.3814
 epoch: 83, train_loss: 0.9932, test_loss: 1.3253, test_f1: 0.3653
 epoch: 84, train_loss: 0.9957, test_loss: 1.4067, test_f1: 0.3310
 epoch: 85, train_loss: 1.0032, test_loss: 1.6293, test_f1: 0.2686
 epoch: 86, train_loss: 0.9970, test_loss: 1.4659, test_f1: 0.3673
 epoch: 87, train_loss: 0.9895, test_loss: 1.5210, test_f1: 0.3558
 epoch: 88, train_loss: 0.9978, test_loss: 1.2431, test_f1: 0.4007
 epoch: 89, train_loss: 1.0019, test_loss: 1.2953, test_f1: 0.3657
 epoch: 90, train_loss: 1.0168, test_loss: 1.4037, test_f1: 0.3197
 epoch: 91, train_loss: 0.9864, test_loss: 1.3769, test_f1: 0.3437
 epoch: 92, train_loss: 0.9812, test_loss: 1.2080, test_f1: 0.4171
 epoch: 93, train_loss: 0.9858, test_loss: 1.5764, test_f1: 0.2868
 epoch: 94, train_loss: 1.0141, test_loss: 1.3509, test_f1: 0.3473
 epoch: 95, train_loss: 1.0176, test_loss: 1.3615, test_f1: 0.3633
 epoch: 96, train_loss: 1.0056, test_loss: 1.3578, test_f1: 0.3627
 epoch: 97, train_loss: 1.0026, test_loss: 1.2632, test_f1: 0.3704
 epoch: 98, train_loss: 1.0017, test_loss: 1.2891, test_f1: 0.3520
 epoch: 99, train_loss: 0.9739, test_loss: 1.3093, test_f1: 0.3726

Training completed in 386.57 seconds
Best F1: 0.5047 at epoch 44
Mean F1 across iterations: 0.4194  0.0803
========================FINAL RESULTS================================
FEGIN weighted F1: 0.5047  0.0803
python main.py --data ltspice_examples --representation component_component --model FEGIN --layers 4 --hiddens 16 --batch_size 256 --lr 0.1 --emb_size 512 --epochs 100 --save_appendix component_component_L4_H16_BS256_LR0.1_E512 --no_val
-----



STDERR:
  File "main.py", line 370, in <module>
    main()
  File "main.py", line 254, in main
    dataset = dataset_class(
  File "/home/philip/projects/ltspice_examples_code_repo/Circuit-Completion-Using-GNNs/component_classification_with_link_prediction_head/evaluation/FEGIN/kernel/circuit_datasets.py", line 15, in __init__
    self.data, self.slices = torch.load(self.processed_paths[0])
  File "/home/philip/.local/lib/python3.8/site-packages/torch/serialization.py", line 1040, in load
    warnings.warn(
  File "/usr/lib/python3.8/warnings.py", line 109, in _showwarnmsg
    sw(msg.message, msg.category, msg.filename, msg.lineno,
  File "main.py", line 47, in warn_with_traceback
    traceback.print_stack(file=log)
/home/philip/projects/ltspice_examples_code_repo/Circuit-Completion-Using-GNNs/component_classification_with_link_prediction_head/evaluation/FEGIN/kernel/circuit_datasets.py:15: FutureWarning: You are using `torch.load` with `weights_only=False` (the current default value), which uses the default pickle module implicitly. It is possible to construct malicious pickle data which will execute arbitrary code during unpickling (See https://github.com/pytorch/pytorch/blob/main/SECURITY.md#untrusted-models for more details). In a future release, the default value for `weights_only` will be flipped to `True`. This limits the functions that could be executed during unpickling. Arbitrary objects will no longer be allowed to be loaded via this mode unless they are explicitly allowlisted by the user via `torch.serialization.add_safe_globals`. We recommend you start setting `weights_only=True` for any use case where you don't have full control of the loaded file. Please open an issue on GitHub for any issues related to this experimental feature.
  self.data, self.slices = torch.load(self.processed_paths[0])
