STDOUT:
Results will be saved in /home/philip/projects/ltspice_examples_code_repo/Circuit-Completion-Using-GNNs/component_classification_with_link_prediction_head/evaluation/FEGIN/results/model_FEGIN_dataset_ltspice_demos
Command line input: python main.py --data ltspice_demos --representation component_pin --model FEGIN --layers 4 --hiddens 16 --batch_size 64 --lr 0.001 --emb_size 250 --epochs 100 --save_appendix component_pin_L4_H16_BS64_LR0.001_E250 --no_val
 is saved.
-----
ltspice_demos - FEGIN
Using 4 layers, 16 hidden units, h = 2
Loading component_pin representation dataset
ENTERED
Training FEGIN on component_pin representation
Train: 1565, Test: 383
##################ITERATION #0 ****************************************
 epoch: 0, train_loss: 1.4364, test_loss: 1.4040, test_f1: 0.0497
 epoch: 1, train_loss: 1.3601, test_loss: 1.3605, test_f1: 0.1365
 epoch: 2, train_loss: 1.2940, test_loss: 1.3171, test_f1: 0.1365
 epoch: 3, train_loss: 1.2402, test_loss: 1.2761, test_f1: 0.1423
 epoch: 4, train_loss: 1.2020, test_loss: 1.2425, test_f1: 0.1839
 epoch: 5, train_loss: 1.1752, test_loss: 1.2368, test_f1: 0.3499
 epoch: 6, train_loss: 1.1556, test_loss: 1.2276, test_f1: 0.2604
 epoch: 7, train_loss: 1.1278, test_loss: 1.2246, test_f1: 0.2311
 epoch: 8, train_loss: 1.1173, test_loss: 1.1951, test_f1: 0.4038
 epoch: 9, train_loss: 1.0966, test_loss: 1.2050, test_f1: 0.4306
 epoch: 10, train_loss: 1.0961, test_loss: 1.2674, test_f1: 0.3908
 epoch: 11, train_loss: 1.0780, test_loss: 1.5257, test_f1: 0.3580
 epoch: 12, train_loss: 1.0708, test_loss: 1.3485, test_f1: 0.4026
 epoch: 13, train_loss: 1.0680, test_loss: 1.4316, test_f1: 0.1509
 epoch: 14, train_loss: 1.0432, test_loss: 1.1764, test_f1: 0.4487
 epoch: 15, train_loss: 1.0255, test_loss: 1.2402, test_f1: 0.4446
 epoch: 16, train_loss: 1.0086, test_loss: 1.1617, test_f1: 0.3972
 epoch: 17, train_loss: 0.9888, test_loss: 1.0456, test_f1: 0.4774
 epoch: 18, train_loss: 0.9740, test_loss: 1.0435, test_f1: 0.4793
 epoch: 19, train_loss: 0.9655, test_loss: 1.0365, test_f1: 0.4827
 epoch: 20, train_loss: 0.9412, test_loss: 1.0301, test_f1: 0.4874
 epoch: 21, train_loss: 0.9339, test_loss: 1.3594, test_f1: 0.3784
 epoch: 22, train_loss: 0.9239, test_loss: 1.0539, test_f1: 0.5091
 epoch: 23, train_loss: 0.9206, test_loss: 1.0677, test_f1: 0.4999
 epoch: 24, train_loss: 0.9209, test_loss: 1.0314, test_f1: 0.5171
 epoch: 25, train_loss: 0.9002, test_loss: 1.1173, test_f1: 0.5033
 epoch: 26, train_loss: 0.9001, test_loss: 1.1575, test_f1: 0.4681
 epoch: 27, train_loss: 0.8783, test_loss: 0.9655, test_f1: 0.5713
 epoch: 28, train_loss: 0.8800, test_loss: 0.9899, test_f1: 0.5513
 epoch: 29, train_loss: 0.8582, test_loss: 1.4699, test_f1: 0.3768
 epoch: 30, train_loss: 0.8640, test_loss: 1.0636, test_f1: 0.5602
 epoch: 31, train_loss: 0.8713, test_loss: 1.0153, test_f1: 0.5682
 epoch: 32, train_loss: 0.8653, test_loss: 1.1690, test_f1: 0.4818
 epoch: 33, train_loss: 0.8413, test_loss: 0.9602, test_f1: 0.5832
 epoch: 34, train_loss: 0.8431, test_loss: 0.9726, test_f1: 0.5808
 epoch: 35, train_loss: 0.8187, test_loss: 0.9785, test_f1: 0.5794
 epoch: 36, train_loss: 0.8189, test_loss: 1.0086, test_f1: 0.5798
 epoch: 37, train_loss: 0.8135, test_loss: 0.9682, test_f1: 0.5460
 epoch: 38, train_loss: 0.8201, test_loss: 1.1375, test_f1: 0.5552
 epoch: 39, train_loss: 0.7962, test_loss: 0.9814, test_f1: 0.5489
 epoch: 40, train_loss: 0.7855, test_loss: 1.0067, test_f1: 0.5817
 epoch: 41, train_loss: 0.7875, test_loss: 0.9815, test_f1: 0.5650
 epoch: 42, train_loss: 0.7922, test_loss: 1.0651, test_f1: 0.5883
 epoch: 43, train_loss: 0.7984, test_loss: 1.0606, test_f1: 0.5172
 epoch: 44, train_loss: 0.7982, test_loss: 1.0051, test_f1: 0.5666
 epoch: 45, train_loss: 0.7734, test_loss: 0.9323, test_f1: 0.5729
 epoch: 46, train_loss: 0.7640, test_loss: 1.0776, test_f1: 0.5762
 epoch: 47, train_loss: 0.7683, test_loss: 1.2114, test_f1: 0.5623
 epoch: 48, train_loss: 0.7633, test_loss: 1.0036, test_f1: 0.5915
 epoch: 49, train_loss: 0.7518, test_loss: 0.9749, test_f1: 0.5696
 epoch: 50, train_loss: 0.7493, test_loss: 1.0110, test_f1: 0.5656
 epoch: 51, train_loss: 0.7460, test_loss: 1.0787, test_f1: 0.5901
 epoch: 52, train_loss: 0.7482, test_loss: 0.9997, test_f1: 0.5879
 epoch: 53, train_loss: 0.7161, test_loss: 1.0167, test_f1: 0.5976
 epoch: 54, train_loss: 0.7200, test_loss: 1.0133, test_f1: 0.5705
 epoch: 55, train_loss: 0.7251, test_loss: 1.0284, test_f1: 0.5935
 epoch: 56, train_loss: 0.7120, test_loss: 1.0817, test_f1: 0.5607
 epoch: 57, train_loss: 0.7184, test_loss: 1.1573, test_f1: 0.5736
 epoch: 58, train_loss: 0.7041, test_loss: 1.0987, test_f1: 0.5631
 epoch: 59, train_loss: 0.7346, test_loss: 1.0347, test_f1: 0.5881
 epoch: 60, train_loss: 0.7281, test_loss: 1.0627, test_f1: 0.5817
 epoch: 61, train_loss: 0.7108, test_loss: 1.0274, test_f1: 0.5853
 epoch: 62, train_loss: 0.7142, test_loss: 1.0208, test_f1: 0.5902
 epoch: 63, train_loss: 0.7115, test_loss: 1.0930, test_f1: 0.5754
 epoch: 64, train_loss: 0.7181, test_loss: 1.0348, test_f1: 0.6022
 epoch: 65, train_loss: 0.6914, test_loss: 1.1411, test_f1: 0.5451
 epoch: 66, train_loss: 0.7017, test_loss: 1.1043, test_f1: 0.5760
 epoch: 67, train_loss: 0.7104, test_loss: 0.9791, test_f1: 0.6098
 epoch: 68, train_loss: 0.6887, test_loss: 1.0303, test_f1: 0.5715
 epoch: 69, train_loss: 0.7122, test_loss: 1.0825, test_f1: 0.5837
 epoch: 70, train_loss: 0.6944, test_loss: 1.1275, test_f1: 0.5789
 epoch: 71, train_loss: 0.7055, test_loss: 1.1041, test_f1: 0.5937
 epoch: 72, train_loss: 0.6855, test_loss: 1.0744, test_f1: 0.5801
 epoch: 73, train_loss: 0.7168, test_loss: 1.1560, test_f1: 0.5746
 epoch: 74, train_loss: 0.7016, test_loss: 1.0895, test_f1: 0.5903
 epoch: 75, train_loss: 0.6854, test_loss: 1.1732, test_f1: 0.5613
 epoch: 76, train_loss: 0.6856, test_loss: 1.1292, test_f1: 0.5730
 epoch: 77, train_loss: 0.6896, test_loss: 1.1082, test_f1: 0.5886
 epoch: 78, train_loss: 0.6786, test_loss: 1.2233, test_f1: 0.5522
 epoch: 79, train_loss: 0.6908, test_loss: 1.1905, test_f1: 0.5618
 epoch: 80, train_loss: 0.6863, test_loss: 1.1181, test_f1: 0.5879
 epoch: 81, train_loss: 0.6963, test_loss: 1.1586, test_f1: 0.5776
 epoch: 82, train_loss: 0.6836, test_loss: 1.1454, test_f1: 0.5881
 epoch: 83, train_loss: 0.6718, test_loss: 1.1511, test_f1: 0.5947
 epoch: 84, train_loss: 0.6652, test_loss: 1.1952, test_f1: 0.5815
 epoch: 85, train_loss: 0.6636, test_loss: 1.1545, test_f1: 0.6004
 epoch: 86, train_loss: 0.6733, test_loss: 1.1438, test_f1: 0.5674
 epoch: 87, train_loss: 0.6755, test_loss: 1.1327, test_f1: 0.5805
 epoch: 88, train_loss: 0.6744, test_loss: 1.1921, test_f1: 0.5764
 epoch: 89, train_loss: 0.6770, test_loss: 1.0445, test_f1: 0.6097
 epoch: 90, train_loss: 0.6608, test_loss: 1.1692, test_f1: 0.5675
 epoch: 91, train_loss: 0.6513, test_loss: 1.0900, test_f1: 0.5908
 epoch: 92, train_loss: 0.6665, test_loss: 1.1599, test_f1: 0.5905
 epoch: 93, train_loss: 0.6557, test_loss: 1.1538, test_f1: 0.5730
 epoch: 94, train_loss: 0.6598, test_loss: 1.1555, test_f1: 0.5923
 epoch: 95, train_loss: 0.6767, test_loss: 1.1873, test_f1: 0.5847
 epoch: 96, train_loss: 0.6662, test_loss: 1.1496, test_f1: 0.6038
 epoch: 97, train_loss: 0.6680, test_loss: 1.1940, test_f1: 0.5734
 epoch: 98, train_loss: 0.6595, test_loss: 1.1327, test_f1: 0.5825
 epoch: 99, train_loss: 0.6641, test_loss: 1.2635, test_f1: 0.5820
##################ITERATION #1 ****************************************
 epoch: 0, train_loss: 1.3975, test_loss: 1.3052, test_f1: 0.2281
 epoch: 1, train_loss: 1.2336, test_loss: 1.2579, test_f1: 0.2281
 epoch: 2, train_loss: 1.2033, test_loss: 1.2341, test_f1: 0.2281
 epoch: 3, train_loss: 1.1882, test_loss: 1.2209, test_f1: 0.2676
 epoch: 4, train_loss: 1.1545, test_loss: 1.2197, test_f1: 0.3370
 epoch: 5, train_loss: 1.1482, test_loss: 1.1998, test_f1: 0.3410
 epoch: 6, train_loss: 1.1216, test_loss: 1.1866, test_f1: 0.3642
 epoch: 7, train_loss: 1.0981, test_loss: 1.1467, test_f1: 0.4289
 epoch: 8, train_loss: 1.0729, test_loss: 1.1250, test_f1: 0.4089
 epoch: 9, train_loss: 1.0380, test_loss: 1.1079, test_f1: 0.4431
 epoch: 10, train_loss: 1.0261, test_loss: 1.0860, test_f1: 0.4693
 epoch: 11, train_loss: 1.0028, test_loss: 1.0891, test_f1: 0.4549
 epoch: 12, train_loss: 0.9754, test_loss: 1.0787, test_f1: 0.5109
 epoch: 13, train_loss: 0.9659, test_loss: 1.0583, test_f1: 0.5098
 epoch: 14, train_loss: 0.9473, test_loss: 1.0350, test_f1: 0.5270
 epoch: 15, train_loss: 0.9409, test_loss: 1.0644, test_f1: 0.5259
 epoch: 16, train_loss: 0.9228, test_loss: 1.0622, test_f1: 0.5030
 epoch: 17, train_loss: 0.9213, test_loss: 1.0582, test_f1: 0.4506
 epoch: 18, train_loss: 0.9077, test_loss: 1.0431, test_f1: 0.5482
 epoch: 19, train_loss: 0.8923, test_loss: 1.0493, test_f1: 0.5563
 epoch: 20, train_loss: 0.8751, test_loss: 1.0385, test_f1: 0.5811
 epoch: 21, train_loss: 0.8726, test_loss: 1.0590, test_f1: 0.4555
 epoch: 22, train_loss: 0.8427, test_loss: 1.0814, test_f1: 0.4899
 epoch: 23, train_loss: 0.8500, test_loss: 1.0107, test_f1: 0.5640
 epoch: 24, train_loss: 0.8558, test_loss: 1.0265, test_f1: 0.5348
 epoch: 25, train_loss: 0.8225, test_loss: 1.0669, test_f1: 0.5614
 epoch: 26, train_loss: 0.8351, test_loss: 1.0068, test_f1: 0.5554
 epoch: 27, train_loss: 0.8507, test_loss: 1.0335, test_f1: 0.5608
 epoch: 28, train_loss: 0.8387, test_loss: 1.0041, test_f1: 0.5586
 epoch: 29, train_loss: 0.8200, test_loss: 1.0232, test_f1: 0.5408
 epoch: 30, train_loss: 0.8195, test_loss: 1.1662, test_f1: 0.5094
 epoch: 31, train_loss: 0.8203, test_loss: 1.0448, test_f1: 0.5187
 epoch: 32, train_loss: 0.8436, test_loss: 1.0580, test_f1: 0.5402
 epoch: 33, train_loss: 0.8002, test_loss: 1.0098, test_f1: 0.5543
 epoch: 34, train_loss: 0.7913, test_loss: 0.9995, test_f1: 0.5791
 epoch: 35, train_loss: 0.7908, test_loss: 1.0182, test_f1: 0.5615
 epoch: 36, train_loss: 0.7958, test_loss: 1.0423, test_f1: 0.5367
 epoch: 37, train_loss: 0.7816, test_loss: 1.0519, test_f1: 0.5565
 epoch: 38, train_loss: 0.7869, test_loss: 1.0508, test_f1: 0.5636
 epoch: 39, train_loss: 0.7941, test_loss: 1.0513, test_f1: 0.5573
 epoch: 40, train_loss: 0.7914, test_loss: 1.0773, test_f1: 0.5428
 epoch: 41, train_loss: 0.7807, test_loss: 1.0506, test_f1: 0.5717
 epoch: 42, train_loss: 0.7695, test_loss: 1.0755, test_f1: 0.5336
 epoch: 43, train_loss: 0.7722, test_loss: 1.1066, test_f1: 0.5260
 epoch: 44, train_loss: 0.7748, test_loss: 1.1157, test_f1: 0.5016
 epoch: 45, train_loss: 0.7656, test_loss: 1.1025, test_f1: 0.5695
 epoch: 46, train_loss: 0.7564, test_loss: 1.1223, test_f1: 0.5265
 epoch: 47, train_loss: 0.7667, test_loss: 1.1119, test_f1: 0.5307
 epoch: 48, train_loss: 0.7484, test_loss: 1.1161, test_f1: 0.5156
 epoch: 49, train_loss: 0.7426, test_loss: 1.0991, test_f1: 0.5378
 epoch: 50, train_loss: 0.7594, test_loss: 1.1398, test_f1: 0.5515
 epoch: 51, train_loss: 0.7413, test_loss: 1.1628, test_f1: 0.5271
 epoch: 52, train_loss: 0.7596, test_loss: 1.1005, test_f1: 0.5351
 epoch: 53, train_loss: 0.7327, test_loss: 1.1314, test_f1: 0.5202
 epoch: 54, train_loss: 0.7331, test_loss: 1.1372, test_f1: 0.5252
 epoch: 55, train_loss: 0.7317, test_loss: 1.1350, test_f1: 0.5342
 epoch: 56, train_loss: 0.7303, test_loss: 1.0886, test_f1: 0.5489
 epoch: 57, train_loss: 0.7197, test_loss: 1.1308, test_f1: 0.5333
 epoch: 58, train_loss: 0.7347, test_loss: 1.0698, test_f1: 0.5306
 epoch: 59, train_loss: 0.7210, test_loss: 1.0666, test_f1: 0.5589
 epoch: 60, train_loss: 0.7205, test_loss: 1.0542, test_f1: 0.5478
 epoch: 61, train_loss: 0.7223, test_loss: 1.1023, test_f1: 0.5269
 epoch: 62, train_loss: 0.7071, test_loss: 1.0487, test_f1: 0.5620
 epoch: 63, train_loss: 0.7008, test_loss: 1.1319, test_f1: 0.5345
 epoch: 64, train_loss: 0.7218, test_loss: 1.1370, test_f1: 0.5423
 epoch: 65, train_loss: 0.7030, test_loss: 1.0957, test_f1: 0.5455
 epoch: 66, train_loss: 0.7091, test_loss: 1.0956, test_f1: 0.5318
 epoch: 67, train_loss: 0.7228, test_loss: 1.0910, test_f1: 0.5233
 epoch: 68, train_loss: 0.7121, test_loss: 1.0847, test_f1: 0.5392
 epoch: 69, train_loss: 0.7112, test_loss: 1.0738, test_f1: 0.5532
 epoch: 70, train_loss: 0.7214, test_loss: 1.0477, test_f1: 0.5679
 epoch: 71, train_loss: 0.6994, test_loss: 1.0980, test_f1: 0.5406
 epoch: 72, train_loss: 0.7084, test_loss: 1.1158, test_f1: 0.5397
 epoch: 73, train_loss: 0.7048, test_loss: 1.1395, test_f1: 0.5488
 epoch: 74, train_loss: 0.7005, test_loss: 1.1203, test_f1: 0.5361
 epoch: 75, train_loss: 0.7011, test_loss: 1.0796, test_f1: 0.5475
 epoch: 76, train_loss: 0.6877, test_loss: 1.0559, test_f1: 0.5709
 epoch: 77, train_loss: 0.6920, test_loss: 1.1318, test_f1: 0.5442
 epoch: 78, train_loss: 0.7090, test_loss: 1.1045, test_f1: 0.5484
 epoch: 79, train_loss: 0.6930, test_loss: 1.1216, test_f1: 0.5475
 epoch: 80, train_loss: 0.6866, test_loss: 1.1278, test_f1: 0.5501
 epoch: 81, train_loss: 0.7084, test_loss: 1.1108, test_f1: 0.5659
 epoch: 82, train_loss: 0.6977, test_loss: 1.1072, test_f1: 0.5527
 epoch: 83, train_loss: 0.7076, test_loss: 1.0987, test_f1: 0.5692
 epoch: 84, train_loss: 0.7015, test_loss: 1.1011, test_f1: 0.5679
 epoch: 85, train_loss: 0.7020, test_loss: 1.0599, test_f1: 0.5699
 epoch: 86, train_loss: 0.6912, test_loss: 1.1033, test_f1: 0.5754
 epoch: 87, train_loss: 0.6870, test_loss: 1.0858, test_f1: 0.5607
 epoch: 88, train_loss: 0.6891, test_loss: 1.1132, test_f1: 0.5544
 epoch: 89, train_loss: 0.6953, test_loss: 1.1432, test_f1: 0.5612
 epoch: 90, train_loss: 0.6842, test_loss: 1.2359, test_f1: 0.5378
 epoch: 91, train_loss: 0.6920, test_loss: 1.1290, test_f1: 0.5475
 epoch: 92, train_loss: 0.6820, test_loss: 1.1345, test_f1: 0.5670
 epoch: 93, train_loss: 0.6888, test_loss: 1.1586, test_f1: 0.5584
 epoch: 94, train_loss: 0.6915, test_loss: 1.1854, test_f1: 0.5616
 epoch: 95, train_loss: 0.6937, test_loss: 1.0865, test_f1: 0.5524
 epoch: 96, train_loss: 0.6825, test_loss: 1.1376, test_f1: 0.5661
 epoch: 97, train_loss: 0.6788, test_loss: 1.2204, test_f1: 0.5551
 epoch: 98, train_loss: 0.6831, test_loss: 1.2490, test_f1: 0.5419
 epoch: 99, train_loss: 0.6834, test_loss: 1.1362, test_f1: 0.5548
##################ITERATION #2 ****************************************
 epoch: 0, train_loss: 1.4248, test_loss: 1.3495, test_f1: 0.2281
 epoch: 1, train_loss: 1.2518, test_loss: 1.3097, test_f1: 0.2281
 epoch: 2, train_loss: 1.1927, test_loss: 1.2629, test_f1: 0.2599
 epoch: 3, train_loss: 1.1433, test_loss: 1.2451, test_f1: 0.3272
 epoch: 4, train_loss: 1.1015, test_loss: 1.1914, test_f1: 0.3618
 epoch: 5, train_loss: 1.0842, test_loss: 1.2330, test_f1: 0.3839
 epoch: 6, train_loss: 1.0631, test_loss: 1.1768, test_f1: 0.3856
 epoch: 7, train_loss: 1.0450, test_loss: 1.1313, test_f1: 0.4029
 epoch: 8, train_loss: 1.0355, test_loss: 1.2105, test_f1: 0.3990
 epoch: 9, train_loss: 1.0181, test_loss: 1.1417, test_f1: 0.3914
 epoch: 10, train_loss: 0.9997, test_loss: 1.1297, test_f1: 0.4076
 epoch: 11, train_loss: 0.9964, test_loss: 1.1521, test_f1: 0.3676
 epoch: 12, train_loss: 0.9779, test_loss: 1.1630, test_f1: 0.3887
 epoch: 13, train_loss: 0.9680, test_loss: 1.1780, test_f1: 0.4765
 epoch: 14, train_loss: 0.9569, test_loss: 1.1724, test_f1: 0.4563
 epoch: 15, train_loss: 0.9410, test_loss: 1.1606, test_f1: 0.4990
 epoch: 16, train_loss: 0.9318, test_loss: 1.2221, test_f1: 0.5030
 epoch: 17, train_loss: 0.9118, test_loss: 1.1511, test_f1: 0.5092
 epoch: 18, train_loss: 0.9054, test_loss: 1.2336, test_f1: 0.5235
 epoch: 19, train_loss: 0.8910, test_loss: 1.0987, test_f1: 0.5150
 epoch: 20, train_loss: 0.8837, test_loss: 1.1672, test_f1: 0.5116
 epoch: 21, train_loss: 0.8765, test_loss: 1.2888, test_f1: 0.5247
 epoch: 22, train_loss: 0.8632, test_loss: 1.1249, test_f1: 0.5315
 epoch: 23, train_loss: 0.8604, test_loss: 1.2244, test_f1: 0.5165
 epoch: 24, train_loss: 0.8416, test_loss: 1.0871, test_f1: 0.5570
 epoch: 25, train_loss: 0.8371, test_loss: 1.1464, test_f1: 0.5330
 epoch: 26, train_loss: 0.8319, test_loss: 1.0684, test_f1: 0.4902
 epoch: 27, train_loss: 0.8273, test_loss: 1.1313, test_f1: 0.5070
 epoch: 28, train_loss: 0.8260, test_loss: 1.0850, test_f1: 0.5574
 epoch: 29, train_loss: 0.8089, test_loss: 1.1167, test_f1: 0.5616
 epoch: 30, train_loss: 0.8304, test_loss: 1.0901, test_f1: 0.5923
 epoch: 31, train_loss: 0.8325, test_loss: 1.0539, test_f1: 0.5443
 epoch: 32, train_loss: 0.7911, test_loss: 1.0472, test_f1: 0.5232
 epoch: 33, train_loss: 0.7969, test_loss: 1.0743, test_f1: 0.5475
 epoch: 34, train_loss: 0.7756, test_loss: 1.0758, test_f1: 0.5685
 epoch: 35, train_loss: 0.7810, test_loss: 1.2495, test_f1: 0.5465
 epoch: 36, train_loss: 0.7879, test_loss: 1.1063, test_f1: 0.5184
 epoch: 37, train_loss: 0.7582, test_loss: 1.0526, test_f1: 0.5387
 epoch: 38, train_loss: 0.7606, test_loss: 1.1522, test_f1: 0.5493
 epoch: 39, train_loss: 0.7747, test_loss: 1.2062, test_f1: 0.5500
 epoch: 40, train_loss: 0.7693, test_loss: 1.1049, test_f1: 0.5564
 epoch: 41, train_loss: 0.7588, test_loss: 1.0833, test_f1: 0.5505
 epoch: 42, train_loss: 0.7366, test_loss: 1.2525, test_f1: 0.5103
 epoch: 43, train_loss: 0.7524, test_loss: 1.1462, test_f1: 0.5692
 epoch: 44, train_loss: 0.7601, test_loss: 1.0910, test_f1: 0.5577
 epoch: 45, train_loss: 0.7449, test_loss: 1.1108, test_f1: 0.5474
 epoch: 46, train_loss: 0.7213, test_loss: 1.1300, test_f1: 0.5348
 epoch: 47, train_loss: 0.7246, test_loss: 1.0887, test_f1: 0.5610
 epoch: 48, train_loss: 0.7337, test_loss: 1.1951, test_f1: 0.5116
 epoch: 49, train_loss: 0.7033, test_loss: 1.1785, test_f1: 0.5823
 epoch: 50, train_loss: 0.7246, test_loss: 1.4775, test_f1: 0.5653
 epoch: 51, train_loss: 0.6867, test_loss: 1.2506, test_f1: 0.5694
 epoch: 52, train_loss: 0.7082, test_loss: 1.3174, test_f1: 0.5710
 epoch: 53, train_loss: 0.6879, test_loss: 1.2888, test_f1: 0.5431
 epoch: 54, train_loss: 0.6743, test_loss: 1.2701, test_f1: 0.5309
 epoch: 55, train_loss: 0.6958, test_loss: 1.3647, test_f1: 0.5651
 epoch: 56, train_loss: 0.6711, test_loss: 1.3215, test_f1: 0.6120
 epoch: 57, train_loss: 0.6928, test_loss: 1.2510, test_f1: 0.5646
 epoch: 58, train_loss: 0.6908, test_loss: 1.2127, test_f1: 0.5704
 epoch: 59, train_loss: 0.6762, test_loss: 1.3698, test_f1: 0.5625
 epoch: 60, train_loss: 0.6610, test_loss: 1.3624, test_f1: 0.5749
 epoch: 61, train_loss: 0.6696, test_loss: 1.3424, test_f1: 0.5707
 epoch: 62, train_loss: 0.6734, test_loss: 1.2931, test_f1: 0.5664
 epoch: 63, train_loss: 0.6705, test_loss: 1.3640, test_f1: 0.5522
 epoch: 64, train_loss: 0.6579, test_loss: 1.3223, test_f1: 0.5854
 epoch: 65, train_loss: 0.6790, test_loss: 1.3780, test_f1: 0.5608
 epoch: 66, train_loss: 0.6668, test_loss: 1.3721, test_f1: 0.5571
 epoch: 67, train_loss: 0.6629, test_loss: 1.4197, test_f1: 0.5428
 epoch: 68, train_loss: 0.6743, test_loss: 1.4457, test_f1: 0.5713
 epoch: 69, train_loss: 0.6544, test_loss: 1.5213, test_f1: 0.5713
 epoch: 70, train_loss: 0.6679, test_loss: 1.5572, test_f1: 0.5444
 epoch: 71, train_loss: 0.6681, test_loss: 1.5067, test_f1: 0.5612
 epoch: 72, train_loss: 0.6667, test_loss: 1.4416, test_f1: 0.5091
 epoch: 73, train_loss: 0.6554, test_loss: 1.4634, test_f1: 0.5079
 epoch: 74, train_loss: 0.6644, test_loss: 1.2526, test_f1: 0.5718
 epoch: 75, train_loss: 0.6542, test_loss: 1.4368, test_f1: 0.5478
 epoch: 76, train_loss: 0.6532, test_loss: 1.4323, test_f1: 0.5450
 epoch: 77, train_loss: 0.6497, test_loss: 1.2583, test_f1: 0.5686
 epoch: 78, train_loss: 0.6588, test_loss: 1.4738, test_f1: 0.5394
 epoch: 79, train_loss: 0.6590, test_loss: 1.5128, test_f1: 0.5225
 epoch: 80, train_loss: 0.6462, test_loss: 1.3732, test_f1: 0.5565
 epoch: 81, train_loss: 0.6511, test_loss: 1.3978, test_f1: 0.5536
 epoch: 82, train_loss: 0.6477, test_loss: 1.3283, test_f1: 0.5459
 epoch: 83, train_loss: 0.6555, test_loss: 1.4934, test_f1: 0.5265
 epoch: 84, train_loss: 0.6429, test_loss: 1.2750, test_f1: 0.5690
 epoch: 85, train_loss: 0.6339, test_loss: 1.4406, test_f1: 0.5400
 epoch: 86, train_loss: 0.6282, test_loss: 1.3779, test_f1: 0.5516
 epoch: 87, train_loss: 0.6321, test_loss: 1.3607, test_f1: 0.5579
 epoch: 88, train_loss: 0.6393, test_loss: 1.5619, test_f1: 0.5420
 epoch: 89, train_loss: 0.6264, test_loss: 1.2616, test_f1: 0.5551
 epoch: 90, train_loss: 0.6343, test_loss: 1.3801, test_f1: 0.5324
 epoch: 91, train_loss: 0.6180, test_loss: 1.3629, test_f1: 0.5460
 epoch: 92, train_loss: 0.6202, test_loss: 1.4524, test_f1: 0.5376
 epoch: 93, train_loss: 0.6248, test_loss: 1.3444, test_f1: 0.5332
 epoch: 94, train_loss: 0.6187, test_loss: 1.4345, test_f1: 0.5349
 epoch: 95, train_loss: 0.6225, test_loss: 1.3674, test_f1: 0.5412
 epoch: 96, train_loss: 0.6240, test_loss: 1.3656, test_f1: 0.5344
 epoch: 97, train_loss: 0.6264, test_loss: 1.3661, test_f1: 0.5490
 epoch: 98, train_loss: 0.6438, test_loss: 1.4378, test_f1: 0.5421
 epoch: 99, train_loss: 0.6352, test_loss: 1.5441, test_f1: 0.5579
##################ITERATION #3 ****************************************
 epoch: 0, train_loss: 1.4175, test_loss: 1.3252, test_f1: 0.2281
 epoch: 1, train_loss: 1.2086, test_loss: 1.2798, test_f1: 0.2281
 epoch: 2, train_loss: 1.1700, test_loss: 1.2262, test_f1: 0.3290
 epoch: 3, train_loss: 1.1388, test_loss: 1.2283, test_f1: 0.3693
 epoch: 4, train_loss: 1.1065, test_loss: 1.1835, test_f1: 0.4054
 epoch: 5, train_loss: 1.0915, test_loss: 1.1907, test_f1: 0.4048
 epoch: 6, train_loss: 1.0927, test_loss: 1.1753, test_f1: 0.4021
 epoch: 7, train_loss: 1.0550, test_loss: 1.1650, test_f1: 0.4028
 epoch: 8, train_loss: 1.0594, test_loss: 1.1465, test_f1: 0.4155
 epoch: 9, train_loss: 1.0419, test_loss: 1.1336, test_f1: 0.4557
 epoch: 10, train_loss: 1.0222, test_loss: 1.1296, test_f1: 0.4461
 epoch: 11, train_loss: 1.0173, test_loss: 1.1266, test_f1: 0.4504
 epoch: 12, train_loss: 0.9990, test_loss: 1.1192, test_f1: 0.4617
 epoch: 13, train_loss: 0.9730, test_loss: 1.1233, test_f1: 0.4524
 epoch: 14, train_loss: 0.9818, test_loss: 1.1037, test_f1: 0.4598
 epoch: 15, train_loss: 0.9619, test_loss: 1.0977, test_f1: 0.5097
 epoch: 16, train_loss: 0.9465, test_loss: 1.0770, test_f1: 0.5211
 epoch: 17, train_loss: 0.9509, test_loss: 1.0886, test_f1: 0.5037
 epoch: 18, train_loss: 0.9414, test_loss: 1.0520, test_f1: 0.5280
 epoch: 19, train_loss: 0.9269, test_loss: 1.0785, test_f1: 0.5164
 epoch: 20, train_loss: 0.9212, test_loss: 1.0529, test_f1: 0.5245
 epoch: 21, train_loss: 0.9099, test_loss: 1.0768, test_f1: 0.5017
 epoch: 22, train_loss: 0.8999, test_loss: 1.0725, test_f1: 0.5090
 epoch: 23, train_loss: 0.9264, test_loss: 1.0485, test_f1: 0.5343
 epoch: 24, train_loss: 0.9083, test_loss: 1.1773, test_f1: 0.4757
 epoch: 25, train_loss: 0.9022, test_loss: 1.0536, test_f1: 0.5314
 epoch: 26, train_loss: 0.8933, test_loss: 1.0714, test_f1: 0.5186
 epoch: 27, train_loss: 0.8979, test_loss: 1.0499, test_f1: 0.5144
 epoch: 28, train_loss: 0.8823, test_loss: 1.0371, test_f1: 0.5813
 epoch: 29, train_loss: 0.8670, test_loss: 1.0518, test_f1: 0.5184
 epoch: 30, train_loss: 0.8851, test_loss: 1.0667, test_f1: 0.5086
 epoch: 31, train_loss: 0.8764, test_loss: 1.0123, test_f1: 0.5513
 epoch: 32, train_loss: 0.8522, test_loss: 1.0477, test_f1: 0.5466
 epoch: 33, train_loss: 0.8473, test_loss: 1.0343, test_f1: 0.5845
 epoch: 34, train_loss: 0.8480, test_loss: 1.0358, test_f1: 0.5492
 epoch: 35, train_loss: 0.8339, test_loss: 1.0123, test_f1: 0.5323
 epoch: 36, train_loss: 0.8498, test_loss: 1.0202, test_f1: 0.5640
 epoch: 37, train_loss: 0.8414, test_loss: 1.0010, test_f1: 0.5571
 epoch: 38, train_loss: 0.8302, test_loss: 1.0091, test_f1: 0.5407
 epoch: 39, train_loss: 0.8177, test_loss: 1.1052, test_f1: 0.5297
 epoch: 40, train_loss: 0.8364, test_loss: 1.0153, test_f1: 0.5490
 epoch: 41, train_loss: 0.8097, test_loss: 1.1430, test_f1: 0.4899
 epoch: 42, train_loss: 0.8152, test_loss: 1.0510, test_f1: 0.5623
 epoch: 43, train_loss: 0.8046, test_loss: 1.0228, test_f1: 0.5307
 epoch: 44, train_loss: 0.7976, test_loss: 1.1198, test_f1: 0.5450
 epoch: 45, train_loss: 0.8001, test_loss: 1.0618, test_f1: 0.5553
 epoch: 46, train_loss: 0.7981, test_loss: 1.0012, test_f1: 0.5330
 epoch: 47, train_loss: 0.8052, test_loss: 1.0830, test_f1: 0.5370
 epoch: 48, train_loss: 0.7914, test_loss: 1.0406, test_f1: 0.5724
 epoch: 49, train_loss: 0.7930, test_loss: 1.0251, test_f1: 0.5644
 epoch: 50, train_loss: 0.7897, test_loss: 1.0285, test_f1: 0.5450
 epoch: 51, train_loss: 0.7739, test_loss: 1.0364, test_f1: 0.5224
 epoch: 52, train_loss: 0.7717, test_loss: 1.0274, test_f1: 0.5458
 epoch: 53, train_loss: 0.7626, test_loss: 1.0069, test_f1: 0.5538
 epoch: 54, train_loss: 0.7442, test_loss: 1.0208, test_f1: 0.5470
 epoch: 55, train_loss: 0.7650, test_loss: 0.9878, test_f1: 0.5706
 epoch: 56, train_loss: 0.7666, test_loss: 1.0358, test_f1: 0.5697
 epoch: 57, train_loss: 0.7336, test_loss: 0.9971, test_f1: 0.5814
 epoch: 58, train_loss: 0.7518, test_loss: 1.0114, test_f1: 0.5679
 epoch: 59, train_loss: 0.7441, test_loss: 1.0070, test_f1: 0.5576
 epoch: 60, train_loss: 0.7393, test_loss: 1.0169, test_f1: 0.5675
 epoch: 61, train_loss: 0.7316, test_loss: 1.0277, test_f1: 0.5521
 epoch: 62, train_loss: 0.7383, test_loss: 1.0237, test_f1: 0.5707
 epoch: 63, train_loss: 0.7319, test_loss: 1.0318, test_f1: 0.5647
 epoch: 64, train_loss: 0.7531, test_loss: 0.9972, test_f1: 0.5625
 epoch: 65, train_loss: 0.7304, test_loss: 1.0531, test_f1: 0.5515
 epoch: 66, train_loss: 0.7489, test_loss: 1.0397, test_f1: 0.5532
 epoch: 67, train_loss: 0.7450, test_loss: 1.0406, test_f1: 0.5669
 epoch: 68, train_loss: 0.7283, test_loss: 1.0458, test_f1: 0.5681
 epoch: 69, train_loss: 0.7158, test_loss: 1.0201, test_f1: 0.5876
 epoch: 70, train_loss: 0.7132, test_loss: 1.0060, test_f1: 0.5689
 epoch: 71, train_loss: 0.7201, test_loss: 1.0223, test_f1: 0.5763
 epoch: 72, train_loss: 0.7307, test_loss: 1.0313, test_f1: 0.5738
 epoch: 73, train_loss: 0.7092, test_loss: 1.0148, test_f1: 0.5715
 epoch: 74, train_loss: 0.7130, test_loss: 1.0217, test_f1: 0.5849
 epoch: 75, train_loss: 0.7140, test_loss: 1.0140, test_f1: 0.5776
 epoch: 76, train_loss: 0.7171, test_loss: 1.0343, test_f1: 0.5733
 epoch: 77, train_loss: 0.6984, test_loss: 1.0355, test_f1: 0.5702
 epoch: 78, train_loss: 0.7126, test_loss: 1.0217, test_f1: 0.5721
 epoch: 79, train_loss: 0.7092, test_loss: 1.0363, test_f1: 0.5663
 epoch: 80, train_loss: 0.7161, test_loss: 1.0560, test_f1: 0.5613
 epoch: 81, train_loss: 0.7079, test_loss: 1.0551, test_f1: 0.5749
 epoch: 82, train_loss: 0.7208, test_loss: 1.0750, test_f1: 0.5729
 epoch: 83, train_loss: 0.7122, test_loss: 1.0680, test_f1: 0.5615
 epoch: 84, train_loss: 0.7215, test_loss: 1.0541, test_f1: 0.5735
 epoch: 85, train_loss: 0.7054, test_loss: 1.0428, test_f1: 0.5890
 epoch: 86, train_loss: 0.7219, test_loss: 1.0408, test_f1: 0.5701
 epoch: 87, train_loss: 0.7162, test_loss: 1.0504, test_f1: 0.5808
 epoch: 88, train_loss: 0.6976, test_loss: 1.0502, test_f1: 0.5533
 epoch: 89, train_loss: 0.6999, test_loss: 1.0804, test_f1: 0.5579
 epoch: 90, train_loss: 0.7387, test_loss: 1.0739, test_f1: 0.5783
 epoch: 91, train_loss: 0.6969, test_loss: 1.1010, test_f1: 0.5627
 epoch: 92, train_loss: 0.6979, test_loss: 1.0455, test_f1: 0.5578
 epoch: 93, train_loss: 0.6920, test_loss: 1.0601, test_f1: 0.5692
 epoch: 94, train_loss: 0.6956, test_loss: 1.0856, test_f1: 0.5451
 epoch: 95, train_loss: 0.7044, test_loss: 1.0575, test_f1: 0.5701
 epoch: 96, train_loss: 0.6827, test_loss: 1.0680, test_f1: 0.5524
 epoch: 97, train_loss: 0.7047, test_loss: 1.0472, test_f1: 0.5620
 epoch: 98, train_loss: 0.6968, test_loss: 1.0416, test_f1: 0.5718
 epoch: 99, train_loss: 0.6945, test_loss: 1.0509, test_f1: 0.5507
##################ITERATION #4 ****************************************
 epoch: 0, train_loss: 1.3714, test_loss: 1.3085, test_f1: 0.2281
 epoch: 1, train_loss: 1.2184, test_loss: 1.2448, test_f1: 0.2281
 epoch: 2, train_loss: 1.1494, test_loss: 1.2307, test_f1: 0.3101
 epoch: 3, train_loss: 1.1409, test_loss: 1.1925, test_f1: 0.3929
 epoch: 4, train_loss: 1.1082, test_loss: 1.1697, test_f1: 0.4511
 epoch: 5, train_loss: 1.0790, test_loss: 1.1509, test_f1: 0.4730
 epoch: 6, train_loss: 1.0550, test_loss: 1.1210, test_f1: 0.5053
 epoch: 7, train_loss: 1.0431, test_loss: 1.0987, test_f1: 0.4984
 epoch: 8, train_loss: 1.0230, test_loss: 1.0987, test_f1: 0.4861
 epoch: 9, train_loss: 1.0135, test_loss: 1.0794, test_f1: 0.4951
 epoch: 10, train_loss: 0.9807, test_loss: 1.0873, test_f1: 0.4994
 epoch: 11, train_loss: 0.9776, test_loss: 1.1007, test_f1: 0.5018
 epoch: 12, train_loss: 0.9530, test_loss: 1.1145, test_f1: 0.4913
 epoch: 13, train_loss: 0.9472, test_loss: 1.0428, test_f1: 0.5071
 epoch: 14, train_loss: 0.9228, test_loss: 1.0261, test_f1: 0.5039
 epoch: 15, train_loss: 0.9350, test_loss: 1.0309, test_f1: 0.5099
 epoch: 16, train_loss: 0.9244, test_loss: 1.0253, test_f1: 0.5224
 epoch: 17, train_loss: 0.9103, test_loss: 1.0096, test_f1: 0.5391
 epoch: 18, train_loss: 0.8890, test_loss: 0.9989, test_f1: 0.5638
 epoch: 19, train_loss: 0.8753, test_loss: 1.0205, test_f1: 0.5327
 epoch: 20, train_loss: 0.8752, test_loss: 1.0257, test_f1: 0.5193
 epoch: 21, train_loss: 0.8718, test_loss: 1.0005, test_f1: 0.5442
 epoch: 22, train_loss: 0.8605, test_loss: 1.0161, test_f1: 0.5513
 epoch: 23, train_loss: 0.8793, test_loss: 1.0213, test_f1: 0.5386
 epoch: 24, train_loss: 0.8273, test_loss: 0.9960, test_f1: 0.5153
 epoch: 25, train_loss: 0.8205, test_loss: 1.0482, test_f1: 0.5147
 epoch: 26, train_loss: 0.8387, test_loss: 1.0110, test_f1: 0.5263
 epoch: 27, train_loss: 0.8191, test_loss: 1.0373, test_f1: 0.5612
 epoch: 28, train_loss: 0.8159, test_loss: 1.0573, test_f1: 0.5188
 epoch: 29, train_loss: 0.8334, test_loss: 1.0702, test_f1: 0.5349
 epoch: 30, train_loss: 0.8172, test_loss: 1.0141, test_f1: 0.5475
 epoch: 31, train_loss: 0.8045, test_loss: 1.0299, test_f1: 0.5405
 epoch: 32, train_loss: 0.8077, test_loss: 1.0101, test_f1: 0.5459
 epoch: 33, train_loss: 0.8005, test_loss: 1.0152, test_f1: 0.5574
 epoch: 34, train_loss: 0.7869, test_loss: 1.0385, test_f1: 0.5270
 epoch: 35, train_loss: 0.7855, test_loss: 1.0290, test_f1: 0.5480
 epoch: 36, train_loss: 0.7861, test_loss: 1.0156, test_f1: 0.5458
 epoch: 37, train_loss: 0.7696, test_loss: 1.0237, test_f1: 0.5448
 epoch: 38, train_loss: 0.7954, test_loss: 1.0685, test_f1: 0.5687
 epoch: 39, train_loss: 0.7895, test_loss: 1.0579, test_f1: 0.5195
 epoch: 40, train_loss: 0.7784, test_loss: 1.0583, test_f1: 0.5649
 epoch: 41, train_loss: 0.7698, test_loss: 1.1344, test_f1: 0.5184
 epoch: 42, train_loss: 0.7619, test_loss: 1.0533, test_f1: 0.5542
 epoch: 43, train_loss: 0.7852, test_loss: 1.0615, test_f1: 0.5597
 epoch: 44, train_loss: 0.7761, test_loss: 1.0113, test_f1: 0.5588
 epoch: 45, train_loss: 0.7582, test_loss: 1.0722, test_f1: 0.5562
 epoch: 46, train_loss: 0.7666, test_loss: 1.0909, test_f1: 0.5370
 epoch: 47, train_loss: 0.7494, test_loss: 1.1016, test_f1: 0.5538
 epoch: 48, train_loss: 0.7400, test_loss: 1.0869, test_f1: 0.5366
 epoch: 49, train_loss: 0.7690, test_loss: 1.0556, test_f1: 0.5817
 epoch: 50, train_loss: 0.7462, test_loss: 1.1276, test_f1: 0.5325
 epoch: 51, train_loss: 0.7461, test_loss: 1.0640, test_f1: 0.5643
 epoch: 52, train_loss: 0.7366, test_loss: 1.1009, test_f1: 0.5567
 epoch: 53, train_loss: 0.7285, test_loss: 1.1677, test_f1: 0.5347
 epoch: 54, train_loss: 0.7239, test_loss: 1.0888, test_f1: 0.5672
 epoch: 55, train_loss: 0.7285, test_loss: 1.1130, test_f1: 0.5455
 epoch: 56, train_loss: 0.7343, test_loss: 1.1131, test_f1: 0.5690
 epoch: 57, train_loss: 0.7175, test_loss: 1.1694, test_f1: 0.5400
 epoch: 58, train_loss: 0.7354, test_loss: 1.0952, test_f1: 0.5688
 epoch: 59, train_loss: 0.7209, test_loss: 1.1050, test_f1: 0.5712
 epoch: 60, train_loss: 0.7082, test_loss: 1.0957, test_f1: 0.5716
 epoch: 61, train_loss: 0.7091, test_loss: 1.0754, test_f1: 0.5627
 epoch: 62, train_loss: 0.7104, test_loss: 1.0905, test_f1: 0.5686
 epoch: 63, train_loss: 0.7088, test_loss: 1.1325, test_f1: 0.5390
 epoch: 64, train_loss: 0.7172, test_loss: 1.0906, test_f1: 0.5593
 epoch: 65, train_loss: 0.7050, test_loss: 1.1543, test_f1: 0.5252
 epoch: 66, train_loss: 0.6907, test_loss: 1.1040, test_f1: 0.5612
 epoch: 67, train_loss: 0.7131, test_loss: 1.1829, test_f1: 0.5357
 epoch: 68, train_loss: 0.7087, test_loss: 1.1388, test_f1: 0.5350
 epoch: 69, train_loss: 0.7062, test_loss: 1.1772, test_f1: 0.5293
 epoch: 70, train_loss: 0.7010, test_loss: 1.1339, test_f1: 0.5533
 epoch: 71, train_loss: 0.6946, test_loss: 1.1141, test_f1: 0.5475
 epoch: 72, train_loss: 0.7046, test_loss: 1.1217, test_f1: 0.5682
 epoch: 73, train_loss: 0.6922, test_loss: 1.1547, test_f1: 0.5450
 epoch: 74, train_loss: 0.6942, test_loss: 1.1134, test_f1: 0.5497
 epoch: 75, train_loss: 0.6903, test_loss: 1.1461, test_f1: 0.5429
 epoch: 76, train_loss: 0.6910, test_loss: 1.2333, test_f1: 0.5253
 epoch: 77, train_loss: 0.6894, test_loss: 1.1810, test_f1: 0.5327
 epoch: 78, train_loss: 0.7110, test_loss: 1.1491, test_f1: 0.5432
 epoch: 79, train_loss: 0.6959, test_loss: 1.1860, test_f1: 0.5436
 epoch: 80, train_loss: 0.7085, test_loss: 1.1671, test_f1: 0.5539
 epoch: 81, train_loss: 0.6953, test_loss: 1.1530, test_f1: 0.5532
 epoch: 82, train_loss: 0.6936, test_loss: 1.1565, test_f1: 0.5335
 epoch: 83, train_loss: 0.6945, test_loss: 1.1825, test_f1: 0.5317
 epoch: 84, train_loss: 0.6884, test_loss: 1.1393, test_f1: 0.5787
 epoch: 85, train_loss: 0.7099, test_loss: 1.1311, test_f1: 0.5634
 epoch: 86, train_loss: 0.6921, test_loss: 1.1547, test_f1: 0.5405
 epoch: 87, train_loss: 0.6913, test_loss: 1.1213, test_f1: 0.5588
 epoch: 88, train_loss: 0.6794, test_loss: 1.1752, test_f1: 0.5417
 epoch: 89, train_loss: 0.6775, test_loss: 1.1518, test_f1: 0.5753
 epoch: 90, train_loss: 0.6993, test_loss: 1.1816, test_f1: 0.5495
 epoch: 91, train_loss: 0.6783, test_loss: 1.1913, test_f1: 0.5513
 epoch: 92, train_loss: 0.6754, test_loss: 1.2024, test_f1: 0.5716
 epoch: 93, train_loss: 0.6809, test_loss: 1.2439, test_f1: 0.5311
 epoch: 94, train_loss: 0.6696, test_loss: 1.2015, test_f1: 0.5703
 epoch: 95, train_loss: 0.6901, test_loss: 1.2697, test_f1: 0.5457
 epoch: 96, train_loss: 0.6599, test_loss: 1.3200, test_f1: 0.5165
 epoch: 97, train_loss: 0.6611, test_loss: 1.3664, test_f1: 0.5288
 epoch: 98, train_loss: 0.6563, test_loss: 1.3119, test_f1: 0.5224
 epoch: 99, train_loss: 0.6850, test_loss: 1.2200, test_f1: 0.5464
##################ITERATION #5 ****************************************
 epoch: 0, train_loss: 1.4202, test_loss: 1.3280, test_f1: 0.2281
 epoch: 1, train_loss: 1.2130, test_loss: 1.2578, test_f1: 0.2281
 epoch: 2, train_loss: 1.1671, test_loss: 1.2116, test_f1: 0.3315
 epoch: 3, train_loss: 1.1233, test_loss: 1.1903, test_f1: 0.3609
 epoch: 4, train_loss: 1.0927, test_loss: 1.1494, test_f1: 0.3737
 epoch: 5, train_loss: 1.0930, test_loss: 1.1169, test_f1: 0.4203
 epoch: 6, train_loss: 1.0658, test_loss: 1.0917, test_f1: 0.4496
 epoch: 7, train_loss: 1.0561, test_loss: 1.0653, test_f1: 0.4854
 epoch: 8, train_loss: 1.0226, test_loss: 1.0651, test_f1: 0.4546
 epoch: 9, train_loss: 0.9932, test_loss: 1.0682, test_f1: 0.5013
 epoch: 10, train_loss: 0.9879, test_loss: 1.0316, test_f1: 0.5385
 epoch: 11, train_loss: 0.9770, test_loss: 1.0453, test_f1: 0.5091
 epoch: 12, train_loss: 0.9564, test_loss: 1.0202, test_f1: 0.5557
 epoch: 13, train_loss: 0.9606, test_loss: 1.0314, test_f1: 0.5177
 epoch: 14, train_loss: 0.9448, test_loss: 1.0724, test_f1: 0.5521
 epoch: 15, train_loss: 0.9404, test_loss: 1.1093, test_f1: 0.5059
 epoch: 16, train_loss: 0.9285, test_loss: 1.0912, test_f1: 0.5125
 epoch: 17, train_loss: 0.9063, test_loss: 1.0144, test_f1: 0.5210
 epoch: 18, train_loss: 0.8950, test_loss: 1.0433, test_f1: 0.4985
 epoch: 19, train_loss: 0.8921, test_loss: 1.0835, test_f1: 0.5046
 epoch: 20, train_loss: 0.8818, test_loss: 1.0611, test_f1: 0.5357
 epoch: 21, train_loss: 0.8521, test_loss: 1.0921, test_f1: 0.5150
 epoch: 22, train_loss: 0.8442, test_loss: 1.0725, test_f1: 0.5232
 epoch: 23, train_loss: 0.8303, test_loss: 1.1875, test_f1: 0.5115
 epoch: 24, train_loss: 0.8396, test_loss: 1.1665, test_f1: 0.5098
 epoch: 25, train_loss: 0.8119, test_loss: 1.0803, test_f1: 0.5165
 epoch: 26, train_loss: 0.8112, test_loss: 1.1423, test_f1: 0.5192
 epoch: 27, train_loss: 0.8081, test_loss: 1.1393, test_f1: 0.5494
 epoch: 28, train_loss: 0.7987, test_loss: 1.1064, test_f1: 0.5285
 epoch: 29, train_loss: 0.7958, test_loss: 1.1300, test_f1: 0.5275
 epoch: 30, train_loss: 0.8074, test_loss: 1.2123, test_f1: 0.5106
 epoch: 31, train_loss: 0.7952, test_loss: 1.2511, test_f1: 0.5111
 epoch: 32, train_loss: 0.7947, test_loss: 1.1126, test_f1: 0.5569
 epoch: 33, train_loss: 0.7842, test_loss: 1.0937, test_f1: 0.5459
 epoch: 34, train_loss: 0.7850, test_loss: 1.2906, test_f1: 0.5262
 epoch: 35, train_loss: 0.8038, test_loss: 1.1561, test_f1: 0.5643
 epoch: 36, train_loss: 0.7695, test_loss: 1.2470, test_f1: 0.4738
 epoch: 37, train_loss: 0.7736, test_loss: 1.1678, test_f1: 0.5469
 epoch: 38, train_loss: 0.7672, test_loss: 1.1225, test_f1: 0.5501
 epoch: 39, train_loss: 0.7588, test_loss: 1.0877, test_f1: 0.5543
 epoch: 40, train_loss: 0.7428, test_loss: 1.1106, test_f1: 0.5837
 epoch: 41, train_loss: 0.7596, test_loss: 1.0788, test_f1: 0.5704
 epoch: 42, train_loss: 0.7538, test_loss: 1.1590, test_f1: 0.5732
 epoch: 43, train_loss: 0.7455, test_loss: 1.1288, test_f1: 0.5497
 epoch: 44, train_loss: 0.7534, test_loss: 1.1586, test_f1: 0.5562
 epoch: 45, train_loss: 0.7499, test_loss: 1.1047, test_f1: 0.5500
 epoch: 46, train_loss: 0.7448, test_loss: 1.1930, test_f1: 0.5458
 epoch: 47, train_loss: 0.7370, test_loss: 1.1734, test_f1: 0.5504
 epoch: 48, train_loss: 0.7324, test_loss: 1.3496, test_f1: 0.5400
 epoch: 49, train_loss: 0.7288, test_loss: 1.2589, test_f1: 0.5322
 epoch: 50, train_loss: 0.7282, test_loss: 1.3245, test_f1: 0.5598
 epoch: 51, train_loss: 0.7167, test_loss: 1.1778, test_f1: 0.5722
 epoch: 52, train_loss: 0.6936, test_loss: 1.1717, test_f1: 0.5729
 epoch: 53, train_loss: 0.7014, test_loss: 1.2704, test_f1: 0.5604
 epoch: 54, train_loss: 0.7160, test_loss: 1.3322, test_f1: 0.5582
 epoch: 55, train_loss: 0.7001, test_loss: 1.4009, test_f1: 0.5592
 epoch: 56, train_loss: 0.7063, test_loss: 1.4565, test_f1: 0.5475
 epoch: 57, train_loss: 0.6995, test_loss: 1.5341, test_f1: 0.5561
 epoch: 58, train_loss: 0.6823, test_loss: 1.4817, test_f1: 0.5777
 epoch: 59, train_loss: 0.6906, test_loss: 1.5074, test_f1: 0.5602
 epoch: 60, train_loss: 0.6848, test_loss: 1.4486, test_f1: 0.5812
 epoch: 61, train_loss: 0.6799, test_loss: 1.5143, test_f1: 0.5732
 epoch: 62, train_loss: 0.6921, test_loss: 1.3812, test_f1: 0.5873
 epoch: 63, train_loss: 0.6832, test_loss: 1.5138, test_f1: 0.5856
 epoch: 64, train_loss: 0.7025, test_loss: 1.4498, test_f1: 0.5692
 epoch: 65, train_loss: 0.6779, test_loss: 1.4042, test_f1: 0.5562
 epoch: 66, train_loss: 0.6749, test_loss: 1.4012, test_f1: 0.5931
 epoch: 67, train_loss: 0.6806, test_loss: 1.5671, test_f1: 0.5742
 epoch: 68, train_loss: 0.6766, test_loss: 1.4694, test_f1: 0.5940
 epoch: 69, train_loss: 0.6732, test_loss: 1.4685, test_f1: 0.5838
 epoch: 70, train_loss: 0.6785, test_loss: 1.4014, test_f1: 0.5716
 epoch: 71, train_loss: 0.6907, test_loss: 1.4032, test_f1: 0.5388
 epoch: 72, train_loss: 0.6771, test_loss: 1.4796, test_f1: 0.5762
 epoch: 73, train_loss: 0.6820, test_loss: 1.4104, test_f1: 0.5531
 epoch: 74, train_loss: 0.6682, test_loss: 1.5544, test_f1: 0.5640
 epoch: 75, train_loss: 0.6651, test_loss: 1.4817, test_f1: 0.5763
 epoch: 76, train_loss: 0.6758, test_loss: 1.4293, test_f1: 0.5713
 epoch: 77, train_loss: 0.6861, test_loss: 1.4760, test_f1: 0.5580
 epoch: 78, train_loss: 0.6602, test_loss: 1.4590, test_f1: 0.5800
 epoch: 79, train_loss: 0.6911, test_loss: 1.6161, test_f1: 0.5776
 epoch: 80, train_loss: 0.6671, test_loss: 1.6001, test_f1: 0.5616
 epoch: 81, train_loss: 0.6863, test_loss: 1.5852, test_f1: 0.5748
 epoch: 82, train_loss: 0.6569, test_loss: 1.5841, test_f1: 0.5967
 epoch: 83, train_loss: 0.6587, test_loss: 1.5876, test_f1: 0.5899
 epoch: 84, train_loss: 0.6498, test_loss: 1.6047, test_f1: 0.5882
 epoch: 85, train_loss: 0.6504, test_loss: 1.5274, test_f1: 0.5780
 epoch: 86, train_loss: 0.6523, test_loss: 1.5340, test_f1: 0.5868
 epoch: 87, train_loss: 0.6533, test_loss: 1.6026, test_f1: 0.6137
 epoch: 88, train_loss: 0.6633, test_loss: 1.7167, test_f1: 0.5520
 epoch: 89, train_loss: 0.6675, test_loss: 1.6438, test_f1: 0.5714
 epoch: 90, train_loss: 0.6787, test_loss: 1.6886, test_f1: 0.5940
 epoch: 91, train_loss: 0.6547, test_loss: 1.5735, test_f1: 0.5633
 epoch: 92, train_loss: 0.6486, test_loss: 1.6956, test_f1: 0.5643
 epoch: 93, train_loss: 0.6814, test_loss: 1.4939, test_f1: 0.5795
 epoch: 94, train_loss: 0.6609, test_loss: 1.5897, test_f1: 0.5709
 epoch: 95, train_loss: 0.6475, test_loss: 1.5572, test_f1: 0.5735
 epoch: 96, train_loss: 0.6501, test_loss: 1.5720, test_f1: 0.5806
 epoch: 97, train_loss: 0.6435, test_loss: 1.5908, test_f1: 0.5793
 epoch: 98, train_loss: 0.6337, test_loss: 1.5650, test_f1: 0.5891
 epoch: 99, train_loss: 0.6417, test_loss: 1.7191, test_f1: 0.5720
##################ITERATION #6 ****************************************
 epoch: 0, train_loss: 1.3144, test_loss: 1.2963, test_f1: 0.2281
 epoch: 1, train_loss: 1.1875, test_loss: 1.2492, test_f1: 0.2336
 epoch: 2, train_loss: 1.1685, test_loss: 1.2111, test_f1: 0.2927
 epoch: 3, train_loss: 1.1351, test_loss: 1.1773, test_f1: 0.3725
 epoch: 4, train_loss: 1.0911, test_loss: 1.1344, test_f1: 0.3947
 epoch: 5, train_loss: 1.0693, test_loss: 1.1134, test_f1: 0.4719
 epoch: 6, train_loss: 1.0407, test_loss: 1.1032, test_f1: 0.4577
 epoch: 7, train_loss: 1.0131, test_loss: 1.1581, test_f1: 0.4068
 epoch: 8, train_loss: 0.9891, test_loss: 1.1099, test_f1: 0.4384
 epoch: 9, train_loss: 0.9930, test_loss: 1.1025, test_f1: 0.4642
 epoch: 10, train_loss: 0.9709, test_loss: 1.0774, test_f1: 0.4939
 epoch: 11, train_loss: 0.9574, test_loss: 1.0447, test_f1: 0.4968
 epoch: 12, train_loss: 0.9433, test_loss: 1.0761, test_f1: 0.4948
 epoch: 13, train_loss: 0.9421, test_loss: 1.0691, test_f1: 0.4593
 epoch: 14, train_loss: 0.9172, test_loss: 1.1096, test_f1: 0.3880
 epoch: 15, train_loss: 0.9045, test_loss: 1.1294, test_f1: 0.4343
 epoch: 16, train_loss: 0.8961, test_loss: 1.0982, test_f1: 0.4196
 epoch: 17, train_loss: 0.8805, test_loss: 1.0577, test_f1: 0.4789
 epoch: 18, train_loss: 0.8866, test_loss: 1.1264, test_f1: 0.4426
 epoch: 19, train_loss: 0.8669, test_loss: 1.1051, test_f1: 0.3982
 epoch: 20, train_loss: 0.8548, test_loss: 1.1643, test_f1: 0.4155
 epoch: 21, train_loss: 0.8408, test_loss: 1.1408, test_f1: 0.4137
 epoch: 22, train_loss: 0.8358, test_loss: 1.1083, test_f1: 0.4623
 epoch: 23, train_loss: 0.8274, test_loss: 1.2220, test_f1: 0.4163
 epoch: 24, train_loss: 0.8387, test_loss: 1.2796, test_f1: 0.4113
 epoch: 25, train_loss: 0.8156, test_loss: 1.2050, test_f1: 0.4696
 epoch: 26, train_loss: 0.8010, test_loss: 1.3010, test_f1: 0.4405
 epoch: 27, train_loss: 0.8074, test_loss: 1.1638, test_f1: 0.5302
 epoch: 28, train_loss: 0.8219, test_loss: 1.0586, test_f1: 0.5190
 epoch: 29, train_loss: 0.8022, test_loss: 1.2382, test_f1: 0.4543
 epoch: 30, train_loss: 0.7940, test_loss: 1.2351, test_f1: 0.4651
 epoch: 31, train_loss: 0.7825, test_loss: 1.2177, test_f1: 0.4892
 epoch: 32, train_loss: 0.7739, test_loss: 1.2556, test_f1: 0.4634
 epoch: 33, train_loss: 0.7645, test_loss: 1.2588, test_f1: 0.4574
 epoch: 34, train_loss: 0.7642, test_loss: 1.0540, test_f1: 0.4980
 epoch: 35, train_loss: 0.7621, test_loss: 1.1908, test_f1: 0.5012
 epoch: 36, train_loss: 0.7552, test_loss: 1.2580, test_f1: 0.4510
 epoch: 37, train_loss: 0.7803, test_loss: 1.0962, test_f1: 0.5368
 epoch: 38, train_loss: 0.7638, test_loss: 1.2634, test_f1: 0.4800
 epoch: 39, train_loss: 0.7644, test_loss: 1.1626, test_f1: 0.5443
 epoch: 40, train_loss: 0.7529, test_loss: 1.1594, test_f1: 0.5070
 epoch: 41, train_loss: 0.7582, test_loss: 1.3562, test_f1: 0.4599
 epoch: 42, train_loss: 0.7499, test_loss: 1.2782, test_f1: 0.5034
 epoch: 43, train_loss: 0.7487, test_loss: 1.1425, test_f1: 0.5457
 epoch: 44, train_loss: 0.7460, test_loss: 1.3059, test_f1: 0.4879
 epoch: 45, train_loss: 0.7338, test_loss: 1.1512, test_f1: 0.5559
 epoch: 46, train_loss: 0.7452, test_loss: 1.3135, test_f1: 0.4891
 epoch: 47, train_loss: 0.7576, test_loss: 1.2260, test_f1: 0.5558
 epoch: 48, train_loss: 0.7317, test_loss: 1.1602, test_f1: 0.5098
 epoch: 49, train_loss: 0.7309, test_loss: 1.2682, test_f1: 0.5108
 epoch: 50, train_loss: 0.7322, test_loss: 1.2285, test_f1: 0.5577
 epoch: 51, train_loss: 0.7063, test_loss: 1.2935, test_f1: 0.5088
 epoch: 52, train_loss: 0.7241, test_loss: 1.2730, test_f1: 0.5104
 epoch: 53, train_loss: 0.6899, test_loss: 1.2418, test_f1: 0.5273
 epoch: 54, train_loss: 0.6967, test_loss: 1.1983, test_f1: 0.5633
 epoch: 55, train_loss: 0.6937, test_loss: 1.2532, test_f1: 0.5382
 epoch: 56, train_loss: 0.6969, test_loss: 1.2077, test_f1: 0.5521
 epoch: 57, train_loss: 0.6812, test_loss: 1.2818, test_f1: 0.5392
 epoch: 58, train_loss: 0.6986, test_loss: 1.2270, test_f1: 0.5704
 epoch: 59, train_loss: 0.6891, test_loss: 1.1799, test_f1: 0.5506
 epoch: 60, train_loss: 0.6955, test_loss: 1.2025, test_f1: 0.5350
 epoch: 61, train_loss: 0.6901, test_loss: 1.2925, test_f1: 0.5319
 epoch: 62, train_loss: 0.6869, test_loss: 1.2484, test_f1: 0.5172
 epoch: 63, train_loss: 0.6819, test_loss: 1.1928, test_f1: 0.5389
 epoch: 64, train_loss: 0.6766, test_loss: 1.1850, test_f1: 0.5576
 epoch: 65, train_loss: 0.6887, test_loss: 1.2935, test_f1: 0.5351
 epoch: 66, train_loss: 0.6785, test_loss: 1.2195, test_f1: 0.5636
 epoch: 67, train_loss: 0.6808, test_loss: 1.2622, test_f1: 0.5605
 epoch: 68, train_loss: 0.6835, test_loss: 1.2225, test_f1: 0.5537
 epoch: 69, train_loss: 0.6745, test_loss: 1.3646, test_f1: 0.5252
 epoch: 70, train_loss: 0.6677, test_loss: 1.3229, test_f1: 0.5385
 epoch: 71, train_loss: 0.6607, test_loss: 1.2187, test_f1: 0.5564
 epoch: 72, train_loss: 0.6727, test_loss: 1.2557, test_f1: 0.5620
 epoch: 73, train_loss: 0.6850, test_loss: 1.2470, test_f1: 0.5657
 epoch: 74, train_loss: 0.6643, test_loss: 1.3284, test_f1: 0.5361
 epoch: 75, train_loss: 0.6606, test_loss: 1.3255, test_f1: 0.5424
 epoch: 76, train_loss: 0.6629, test_loss: 1.2595, test_f1: 0.5554
 epoch: 77, train_loss: 0.6762, test_loss: 1.4221, test_f1: 0.5261
 epoch: 78, train_loss: 0.6772, test_loss: 1.2544, test_f1: 0.5675
 epoch: 79, train_loss: 0.6761, test_loss: 1.3196, test_f1: 0.5622
 epoch: 80, train_loss: 0.6732, test_loss: 1.4598, test_f1: 0.5126
 epoch: 81, train_loss: 0.6685, test_loss: 1.3464, test_f1: 0.5578
 epoch: 82, train_loss: 0.6646, test_loss: 1.2216, test_f1: 0.5775
 epoch: 83, train_loss: 0.6791, test_loss: 1.2928, test_f1: 0.5504
 epoch: 84, train_loss: 0.6719, test_loss: 1.2491, test_f1: 0.5525
 epoch: 85, train_loss: 0.6687, test_loss: 1.3206, test_f1: 0.5357
 epoch: 86, train_loss: 0.6546, test_loss: 1.3776, test_f1: 0.5472
 epoch: 87, train_loss: 0.6572, test_loss: 1.3377, test_f1: 0.5383
 epoch: 88, train_loss: 0.6589, test_loss: 1.3242, test_f1: 0.5254
 epoch: 89, train_loss: 0.6538, test_loss: 1.3207, test_f1: 0.5358
 epoch: 90, train_loss: 0.6455, test_loss: 1.2737, test_f1: 0.5270
 epoch: 91, train_loss: 0.6526, test_loss: 1.2494, test_f1: 0.5714
 epoch: 92, train_loss: 0.6639, test_loss: 1.3366, test_f1: 0.5589
 epoch: 93, train_loss: 0.6461, test_loss: 1.2692, test_f1: 0.5449
 epoch: 94, train_loss: 0.6552, test_loss: 1.3193, test_f1: 0.5588
 epoch: 95, train_loss: 0.6498, test_loss: 1.5174, test_f1: 0.5093
 epoch: 96, train_loss: 0.6434, test_loss: 1.4535, test_f1: 0.5296
 epoch: 97, train_loss: 0.6589, test_loss: 1.3025, test_f1: 0.5353
 epoch: 98, train_loss: 0.6542, test_loss: 1.3720, test_f1: 0.5312
 epoch: 99, train_loss: 0.6490, test_loss: 1.2806, test_f1: 0.5427
##################ITERATION #7 ****************************************
 epoch: 0, train_loss: 1.5071, test_loss: 1.4362, test_f1: 0.2281
 epoch: 1, train_loss: 1.2088, test_loss: 1.4326, test_f1: 0.2410
 epoch: 2, train_loss: 1.1245, test_loss: 1.1698, test_f1: 0.3850
 epoch: 3, train_loss: 1.0903, test_loss: 1.1123, test_f1: 0.4543
 epoch: 4, train_loss: 1.0454, test_loss: 1.1038, test_f1: 0.4895
 epoch: 5, train_loss: 1.0363, test_loss: 1.0898, test_f1: 0.4849
 epoch: 6, train_loss: 1.0085, test_loss: 1.0869, test_f1: 0.5301
 epoch: 7, train_loss: 0.9922, test_loss: 1.0719, test_f1: 0.5278
 epoch: 8, train_loss: 0.9810, test_loss: 1.0784, test_f1: 0.5146
 epoch: 9, train_loss: 0.9727, test_loss: 1.0987, test_f1: 0.4804
 epoch: 10, train_loss: 0.9595, test_loss: 1.0481, test_f1: 0.5256
 epoch: 11, train_loss: 0.9619, test_loss: 1.0422, test_f1: 0.4974
 epoch: 12, train_loss: 0.9288, test_loss: 1.0584, test_f1: 0.4961
 epoch: 13, train_loss: 0.9464, test_loss: 1.0472, test_f1: 0.5064
 epoch: 14, train_loss: 0.9140, test_loss: 1.0849, test_f1: 0.5028
 epoch: 15, train_loss: 0.9195, test_loss: 1.0665, test_f1: 0.4938
 epoch: 16, train_loss: 0.8896, test_loss: 1.0437, test_f1: 0.5324
 epoch: 17, train_loss: 0.9020, test_loss: 1.0342, test_f1: 0.5435
 epoch: 18, train_loss: 0.8743, test_loss: 1.1178, test_f1: 0.5063
 epoch: 19, train_loss: 0.8923, test_loss: 1.0330, test_f1: 0.5383
 epoch: 20, train_loss: 0.8779, test_loss: 1.0448, test_f1: 0.5407
 epoch: 21, train_loss: 0.8673, test_loss: 1.0461, test_f1: 0.5616
 epoch: 22, train_loss: 0.8423, test_loss: 1.0549, test_f1: 0.5459
 epoch: 23, train_loss: 0.8465, test_loss: 1.0342, test_f1: 0.5385
 epoch: 24, train_loss: 0.8286, test_loss: 1.0626, test_f1: 0.4858
 epoch: 25, train_loss: 0.8361, test_loss: 1.0377, test_f1: 0.5546
 epoch: 26, train_loss: 0.8306, test_loss: 1.0564, test_f1: 0.5291
 epoch: 27, train_loss: 0.8304, test_loss: 1.0813, test_f1: 0.4866
 epoch: 28, train_loss: 0.8056, test_loss: 1.0384, test_f1: 0.5551
 epoch: 29, train_loss: 0.7998, test_loss: 1.0437, test_f1: 0.5361
 epoch: 30, train_loss: 0.7846, test_loss: 1.0349, test_f1: 0.5706
 epoch: 31, train_loss: 0.7844, test_loss: 1.0627, test_f1: 0.5616
 epoch: 32, train_loss: 0.7943, test_loss: 1.0729, test_f1: 0.5076
 epoch: 33, train_loss: 0.7713, test_loss: 1.0849, test_f1: 0.5580
 epoch: 34, train_loss: 0.7762, test_loss: 1.0502, test_f1: 0.5689
 epoch: 35, train_loss: 0.7818, test_loss: 1.0380, test_f1: 0.5865
 epoch: 36, train_loss: 0.7535, test_loss: 1.0942, test_f1: 0.4566
 epoch: 37, train_loss: 0.7550, test_loss: 1.1114, test_f1: 0.5161
 epoch: 38, train_loss: 0.7668, test_loss: 1.1095, test_f1: 0.5338
 epoch: 39, train_loss: 0.7586, test_loss: 1.0711, test_f1: 0.5643
 epoch: 40, train_loss: 0.7716, test_loss: 1.0540, test_f1: 0.5869
 epoch: 41, train_loss: 0.7379, test_loss: 1.0330, test_f1: 0.5640
 epoch: 42, train_loss: 0.7602, test_loss: 1.0597, test_f1: 0.5720
 epoch: 43, train_loss: 0.7543, test_loss: 1.1010, test_f1: 0.5301
 epoch: 44, train_loss: 0.7406, test_loss: 1.1189, test_f1: 0.5620
 epoch: 45, train_loss: 0.7363, test_loss: 1.0581, test_f1: 0.5680
 epoch: 46, train_loss: 0.7377, test_loss: 1.0123, test_f1: 0.5843
 epoch: 47, train_loss: 0.7261, test_loss: 1.0884, test_f1: 0.5734
 epoch: 48, train_loss: 0.7316, test_loss: 1.0539, test_f1: 0.5873
 epoch: 49, train_loss: 0.7128, test_loss: 1.0632, test_f1: 0.6160
 epoch: 50, train_loss: 0.7207, test_loss: 1.1840, test_f1: 0.5269
 epoch: 51, train_loss: 0.7130, test_loss: 1.0496, test_f1: 0.6006
 epoch: 52, train_loss: 0.7044, test_loss: 1.0827, test_f1: 0.6026
 epoch: 53, train_loss: 0.6929, test_loss: 1.0500, test_f1: 0.6454
 epoch: 54, train_loss: 0.7072, test_loss: 1.0672, test_f1: 0.6027
 epoch: 55, train_loss: 0.6933, test_loss: 1.0721, test_f1: 0.5378
 epoch: 56, train_loss: 0.6936, test_loss: 1.1087, test_f1: 0.5948
 epoch: 57, train_loss: 0.7004, test_loss: 1.0495, test_f1: 0.5907
 epoch: 58, train_loss: 0.6919, test_loss: 1.0548, test_f1: 0.5759
 epoch: 59, train_loss: 0.6801, test_loss: 1.0848, test_f1: 0.5651
 epoch: 60, train_loss: 0.6877, test_loss: 1.0362, test_f1: 0.6015
 epoch: 61, train_loss: 0.7014, test_loss: 1.0962, test_f1: 0.5896
 epoch: 62, train_loss: 0.6987, test_loss: 1.0747, test_f1: 0.6105
 epoch: 63, train_loss: 0.6838, test_loss: 1.0590, test_f1: 0.6166
 epoch: 64, train_loss: 0.6845, test_loss: 1.0522, test_f1: 0.5759
 epoch: 65, train_loss: 0.6813, test_loss: 1.0439, test_f1: 0.6231
 epoch: 66, train_loss: 0.6784, test_loss: 1.0927, test_f1: 0.5947
 epoch: 67, train_loss: 0.6668, test_loss: 1.1109, test_f1: 0.5919
 epoch: 68, train_loss: 0.6869, test_loss: 1.0494, test_f1: 0.6061
 epoch: 69, train_loss: 0.6790, test_loss: 1.1069, test_f1: 0.5880
 epoch: 70, train_loss: 0.6907, test_loss: 1.1109, test_f1: 0.5685
 epoch: 71, train_loss: 0.6695, test_loss: 1.1127, test_f1: 0.6104
 epoch: 72, train_loss: 0.6903, test_loss: 1.0935, test_f1: 0.5999
 epoch: 73, train_loss: 0.6644, test_loss: 1.0841, test_f1: 0.6157
 epoch: 74, train_loss: 0.6760, test_loss: 1.0745, test_f1: 0.6344
 epoch: 75, train_loss: 0.6715, test_loss: 1.0670, test_f1: 0.6037
 epoch: 76, train_loss: 0.6482, test_loss: 1.1360, test_f1: 0.6217
 epoch: 77, train_loss: 0.6845, test_loss: 1.1239, test_f1: 0.5982
 epoch: 78, train_loss: 0.6607, test_loss: 1.1566, test_f1: 0.5364
 epoch: 79, train_loss: 0.6630, test_loss: 1.1357, test_f1: 0.5460
 epoch: 80, train_loss: 0.6693, test_loss: 1.1032, test_f1: 0.5792
 epoch: 81, train_loss: 0.6650, test_loss: 1.1316, test_f1: 0.5236
 epoch: 82, train_loss: 0.6572, test_loss: 1.1360, test_f1: 0.6002
 epoch: 83, train_loss: 0.6596, test_loss: 1.1286, test_f1: 0.5904
 epoch: 84, train_loss: 0.6819, test_loss: 1.2317, test_f1: 0.5384
 epoch: 85, train_loss: 0.6678, test_loss: 1.0700, test_f1: 0.6278
 epoch: 86, train_loss: 0.6450, test_loss: 1.1120, test_f1: 0.5769
 epoch: 87, train_loss: 0.6476, test_loss: 1.2096, test_f1: 0.5595
 epoch: 88, train_loss: 0.6521, test_loss: 1.1509, test_f1: 0.5930
 epoch: 89, train_loss: 0.6644, test_loss: 1.1810, test_f1: 0.5309
 epoch: 90, train_loss: 0.6733, test_loss: 1.1793, test_f1: 0.5767
 epoch: 91, train_loss: 0.6585, test_loss: 1.0745, test_f1: 0.6085
 epoch: 92, train_loss: 0.6557, test_loss: 1.2665, test_f1: 0.4822
 epoch: 93, train_loss: 0.6624, test_loss: 1.1650, test_f1: 0.5580
 epoch: 94, train_loss: 0.6645, test_loss: 1.1328, test_f1: 0.6047
 epoch: 95, train_loss: 0.6679, test_loss: 1.1615, test_f1: 0.5968
 epoch: 96, train_loss: 0.6443, test_loss: 1.1782, test_f1: 0.5832
 epoch: 97, train_loss: 0.6428, test_loss: 1.2295, test_f1: 0.5346
 epoch: 98, train_loss: 0.6533, test_loss: 1.0765, test_f1: 0.6177
 epoch: 99, train_loss: 0.6467, test_loss: 1.2463, test_f1: 0.5628
##################ITERATION #8 ****************************************
 epoch: 0, train_loss: 1.4466, test_loss: 1.3897, test_f1: 0.2281
 epoch: 1, train_loss: 1.2356, test_loss: 1.3387, test_f1: 0.2281
 epoch: 2, train_loss: 1.1736, test_loss: 1.2758, test_f1: 0.3022
 epoch: 3, train_loss: 1.1545, test_loss: 1.2262, test_f1: 0.3552
 epoch: 4, train_loss: 1.1274, test_loss: 1.2089, test_f1: 0.4141
 epoch: 5, train_loss: 1.1210, test_loss: 1.2002, test_f1: 0.4124
 epoch: 6, train_loss: 1.1033, test_loss: 1.1652, test_f1: 0.4579
 epoch: 7, train_loss: 1.0756, test_loss: 1.1457, test_f1: 0.5210
 epoch: 8, train_loss: 1.0531, test_loss: 1.1287, test_f1: 0.4855
 epoch: 9, train_loss: 1.0525, test_loss: 1.1126, test_f1: 0.5237
 epoch: 10, train_loss: 1.0451, test_loss: 1.0951, test_f1: 0.5254
 epoch: 11, train_loss: 1.0008, test_loss: 1.0673, test_f1: 0.5163
 epoch: 12, train_loss: 1.0002, test_loss: 1.0566, test_f1: 0.5871
 epoch: 13, train_loss: 0.9859, test_loss: 1.0463, test_f1: 0.5577
 epoch: 14, train_loss: 0.9852, test_loss: 1.0313, test_f1: 0.5711
 epoch: 15, train_loss: 0.9582, test_loss: 1.0580, test_f1: 0.5017
 epoch: 16, train_loss: 0.9584, test_loss: 1.0433, test_f1: 0.5363
 epoch: 17, train_loss: 0.9310, test_loss: 1.0346, test_f1: 0.5708
 epoch: 18, train_loss: 0.9309, test_loss: 1.0098, test_f1: 0.5578
 epoch: 19, train_loss: 0.9119, test_loss: 0.9942, test_f1: 0.5717
 epoch: 20, train_loss: 0.9078, test_loss: 0.9924, test_f1: 0.5764
 epoch: 21, train_loss: 0.9085, test_loss: 1.0185, test_f1: 0.5703
 epoch: 22, train_loss: 0.9111, test_loss: 1.0698, test_f1: 0.4936
 epoch: 23, train_loss: 0.8924, test_loss: 0.9782, test_f1: 0.5907
 epoch: 24, train_loss: 0.8935, test_loss: 1.0203, test_f1: 0.5850
 epoch: 25, train_loss: 0.8578, test_loss: 0.9602, test_f1: 0.6123
 epoch: 26, train_loss: 0.8520, test_loss: 1.0245, test_f1: 0.5670
 epoch: 27, train_loss: 0.8446, test_loss: 0.9541, test_f1: 0.5943
 epoch: 28, train_loss: 0.8263, test_loss: 0.9814, test_f1: 0.5753
 epoch: 29, train_loss: 0.8325, test_loss: 0.9655, test_f1: 0.5922
 epoch: 30, train_loss: 0.8306, test_loss: 0.9906, test_f1: 0.5670
 epoch: 31, train_loss: 0.8047, test_loss: 0.9879, test_f1: 0.6033
 epoch: 32, train_loss: 0.8149, test_loss: 0.9727, test_f1: 0.5877
 epoch: 33, train_loss: 0.7927, test_loss: 1.0132, test_f1: 0.5788
 epoch: 34, train_loss: 0.7926, test_loss: 1.0047, test_f1: 0.5826
 epoch: 35, train_loss: 0.7958, test_loss: 0.9775, test_f1: 0.5837
 epoch: 36, train_loss: 0.7919, test_loss: 0.9635, test_f1: 0.6065
 epoch: 37, train_loss: 0.7767, test_loss: 0.9935, test_f1: 0.5748
 epoch: 38, train_loss: 0.8259, test_loss: 1.0361, test_f1: 0.5551
 epoch: 39, train_loss: 0.7810, test_loss: 0.9979, test_f1: 0.6260
 epoch: 40, train_loss: 0.7760, test_loss: 0.9556, test_f1: 0.6069
 epoch: 41, train_loss: 0.7613, test_loss: 0.9638, test_f1: 0.5864
 epoch: 42, train_loss: 0.7580, test_loss: 0.9725, test_f1: 0.5845
 epoch: 43, train_loss: 0.7609, test_loss: 1.0176, test_f1: 0.5512
 epoch: 44, train_loss: 0.7825, test_loss: 0.9648, test_f1: 0.5843
 epoch: 45, train_loss: 0.7410, test_loss: 0.9438, test_f1: 0.5939
 epoch: 46, train_loss: 0.7424, test_loss: 0.9767, test_f1: 0.5948
 epoch: 47, train_loss: 0.7489, test_loss: 0.9896, test_f1: 0.5854
 epoch: 48, train_loss: 0.7500, test_loss: 0.9938, test_f1: 0.5862
 epoch: 49, train_loss: 0.7274, test_loss: 1.0610, test_f1: 0.5636
 epoch: 50, train_loss: 0.7387, test_loss: 1.0010, test_f1: 0.5591
 epoch: 51, train_loss: 0.7362, test_loss: 1.0065, test_f1: 0.5728
 epoch: 52, train_loss: 0.7147, test_loss: 1.0081, test_f1: 0.5843
 epoch: 53, train_loss: 0.7175, test_loss: 0.9893, test_f1: 0.5777
 epoch: 54, train_loss: 0.7092, test_loss: 1.0161, test_f1: 0.5988
 epoch: 55, train_loss: 0.7070, test_loss: 0.9904, test_f1: 0.5806
 epoch: 56, train_loss: 0.7160, test_loss: 0.9899, test_f1: 0.5830
 epoch: 57, train_loss: 0.7022, test_loss: 1.0078, test_f1: 0.5818
 epoch: 58, train_loss: 0.7019, test_loss: 0.9673, test_f1: 0.5886
 epoch: 59, train_loss: 0.7147, test_loss: 0.9816, test_f1: 0.6007
 epoch: 60, train_loss: 0.7147, test_loss: 0.9966, test_f1: 0.5963
 epoch: 61, train_loss: 0.6971, test_loss: 0.9725, test_f1: 0.6300
 epoch: 62, train_loss: 0.6967, test_loss: 0.9996, test_f1: 0.5976
 epoch: 63, train_loss: 0.7079, test_loss: 1.0048, test_f1: 0.5942
 epoch: 64, train_loss: 0.6970, test_loss: 1.0411, test_f1: 0.5493
 epoch: 65, train_loss: 0.6701, test_loss: 1.0300, test_f1: 0.5717
 epoch: 66, train_loss: 0.6824, test_loss: 1.0138, test_f1: 0.5931
 epoch: 67, train_loss: 0.6929, test_loss: 1.0197, test_f1: 0.5781
 epoch: 68, train_loss: 0.6705, test_loss: 1.0306, test_f1: 0.5759
 epoch: 69, train_loss: 0.7011, test_loss: 1.0538, test_f1: 0.5498
 epoch: 70, train_loss: 0.6841, test_loss: 1.0354, test_f1: 0.5810
 epoch: 71, train_loss: 0.6875, test_loss: 1.0270, test_f1: 0.5703
 epoch: 72, train_loss: 0.6712, test_loss: 1.0368, test_f1: 0.5938
 epoch: 73, train_loss: 0.6871, test_loss: 1.0143, test_f1: 0.6000
 epoch: 74, train_loss: 0.6752, test_loss: 1.0010, test_f1: 0.6064
 epoch: 75, train_loss: 0.6860, test_loss: 1.0065, test_f1: 0.6036
 epoch: 76, train_loss: 0.6825, test_loss: 1.0481, test_f1: 0.5934
 epoch: 77, train_loss: 0.6703, test_loss: 1.0446, test_f1: 0.5658
 epoch: 78, train_loss: 0.6758, test_loss: 1.0637, test_f1: 0.5664
 epoch: 79, train_loss: 0.6667, test_loss: 1.0451, test_f1: 0.5624
 epoch: 80, train_loss: 0.6616, test_loss: 1.0677, test_f1: 0.5934
 epoch: 81, train_loss: 0.6762, test_loss: 1.0232, test_f1: 0.5754
 epoch: 82, train_loss: 0.6573, test_loss: 1.0247, test_f1: 0.6112
 epoch: 83, train_loss: 0.6612, test_loss: 1.0397, test_f1: 0.5916
 epoch: 84, train_loss: 0.6468, test_loss: 1.0859, test_f1: 0.5684
 epoch: 85, train_loss: 0.6629, test_loss: 1.0264, test_f1: 0.5822
 epoch: 86, train_loss: 0.6605, test_loss: 1.0652, test_f1: 0.5757
 epoch: 87, train_loss: 0.6704, test_loss: 1.0271, test_f1: 0.5884
 epoch: 88, train_loss: 0.6587, test_loss: 1.0205, test_f1: 0.5964
 epoch: 89, train_loss: 0.6665, test_loss: 1.0209, test_f1: 0.5982
 epoch: 90, train_loss: 0.6553, test_loss: 1.0966, test_f1: 0.5742
 epoch: 91, train_loss: 0.6714, test_loss: 1.0470, test_f1: 0.6152
 epoch: 92, train_loss: 0.6714, test_loss: 1.0295, test_f1: 0.5840
 epoch: 93, train_loss: 0.6580, test_loss: 1.0893, test_f1: 0.5871
 epoch: 94, train_loss: 0.6563, test_loss: 1.0862, test_f1: 0.5820
 epoch: 95, train_loss: 0.6604, test_loss: 1.0277, test_f1: 0.5947
 epoch: 96, train_loss: 0.6499, test_loss: 1.0368, test_f1: 0.6019
 epoch: 97, train_loss: 0.6695, test_loss: 1.0274, test_f1: 0.5916
 epoch: 98, train_loss: 0.6546, test_loss: 1.0443, test_f1: 0.5810
 epoch: 99, train_loss: 0.6539, test_loss: 1.0906, test_f1: 0.5799
##################ITERATION #9 ****************************************
 epoch: 0, train_loss: 1.5910, test_loss: 1.3923, test_f1: 0.2461
 epoch: 1, train_loss: 1.2943, test_loss: 1.3051, test_f1: 0.2821
 epoch: 2, train_loss: 1.2133, test_loss: 1.2264, test_f1: 0.3222
 epoch: 3, train_loss: 1.1837, test_loss: 1.2040, test_f1: 0.3880
 epoch: 4, train_loss: 1.1420, test_loss: 1.1480, test_f1: 0.4351
 epoch: 5, train_loss: 1.0907, test_loss: 1.0988, test_f1: 0.4627
 epoch: 6, train_loss: 1.0552, test_loss: 1.0692, test_f1: 0.4905
 epoch: 7, train_loss: 1.0535, test_loss: 1.0499, test_f1: 0.5437
 epoch: 8, train_loss: 1.0207, test_loss: 1.0347, test_f1: 0.5469
 epoch: 9, train_loss: 0.9737, test_loss: 1.0116, test_f1: 0.5821
 epoch: 10, train_loss: 0.9650, test_loss: 1.0081, test_f1: 0.5539
 epoch: 11, train_loss: 0.9579, test_loss: 1.0103, test_f1: 0.5504
 epoch: 12, train_loss: 0.9345, test_loss: 0.9753, test_f1: 0.5610
 epoch: 13, train_loss: 0.9125, test_loss: 0.9697, test_f1: 0.5569
 epoch: 14, train_loss: 0.9003, test_loss: 0.9467, test_f1: 0.5754
 epoch: 15, train_loss: 0.8852, test_loss: 0.9443, test_f1: 0.5675
 epoch: 16, train_loss: 0.8846, test_loss: 0.9320, test_f1: 0.5919
 epoch: 17, train_loss: 0.8769, test_loss: 0.9458, test_f1: 0.5762
 epoch: 18, train_loss: 0.8647, test_loss: 0.9321, test_f1: 0.5857
 epoch: 19, train_loss: 0.8496, test_loss: 0.9263, test_f1: 0.5822
 epoch: 20, train_loss: 0.8282, test_loss: 0.9317, test_f1: 0.5757
 epoch: 21, train_loss: 0.8263, test_loss: 0.9155, test_f1: 0.5934
 epoch: 22, train_loss: 0.8314, test_loss: 0.9294, test_f1: 0.6018
 epoch: 23, train_loss: 0.8242, test_loss: 0.9315, test_f1: 0.5836
 epoch: 24, train_loss: 0.8172, test_loss: 0.9187, test_f1: 0.6032
 epoch: 25, train_loss: 0.8024, test_loss: 0.9382, test_f1: 0.5750
 epoch: 26, train_loss: 0.7825, test_loss: 0.9208, test_f1: 0.6087
 epoch: 27, train_loss: 0.7997, test_loss: 0.9400, test_f1: 0.5802
 epoch: 28, train_loss: 0.7900, test_loss: 0.9188, test_f1: 0.5977
 epoch: 29, train_loss: 0.7819, test_loss: 0.9245, test_f1: 0.5923
 epoch: 30, train_loss: 0.7621, test_loss: 0.9373, test_f1: 0.5805
 epoch: 31, train_loss: 0.7638, test_loss: 0.9549, test_f1: 0.5658
 epoch: 32, train_loss: 0.7630, test_loss: 0.9229, test_f1: 0.6213
 epoch: 33, train_loss: 0.7561, test_loss: 0.9156, test_f1: 0.6119
 epoch: 34, train_loss: 0.7517, test_loss: 0.9131, test_f1: 0.5830
 epoch: 35, train_loss: 0.7367, test_loss: 0.9277, test_f1: 0.6216
 epoch: 36, train_loss: 0.7432, test_loss: 0.9457, test_f1: 0.6087
 epoch: 37, train_loss: 0.7388, test_loss: 0.9331, test_f1: 0.5642
 epoch: 38, train_loss: 0.7302, test_loss: 0.9577, test_f1: 0.5678
 epoch: 39, train_loss: 0.7344, test_loss: 0.9638, test_f1: 0.5983
 epoch: 40, train_loss: 0.7330, test_loss: 0.9665, test_f1: 0.5820
 epoch: 41, train_loss: 0.7115, test_loss: 0.9773, test_f1: 0.5809
 epoch: 42, train_loss: 0.7171, test_loss: 1.0034, test_f1: 0.5561
 epoch: 43, train_loss: 0.7161, test_loss: 0.9850, test_f1: 0.5788
 epoch: 44, train_loss: 0.7150, test_loss: 0.9581, test_f1: 0.5946
 epoch: 45, train_loss: 0.7059, test_loss: 0.9869, test_f1: 0.5966
 epoch: 46, train_loss: 0.7046, test_loss: 0.9420, test_f1: 0.6203
 epoch: 47, train_loss: 0.6994, test_loss: 1.0361, test_f1: 0.5598
 epoch: 48, train_loss: 0.7033, test_loss: 0.9550, test_f1: 0.5920
 epoch: 49, train_loss: 0.7158, test_loss: 1.0089, test_f1: 0.6010
 epoch: 50, train_loss: 0.6940, test_loss: 0.9852, test_f1: 0.5765
 epoch: 51, train_loss: 0.6706, test_loss: 0.9565, test_f1: 0.6145
 epoch: 52, train_loss: 0.6648, test_loss: 0.9545, test_f1: 0.6270
 epoch: 53, train_loss: 0.6758, test_loss: 0.9810, test_f1: 0.6005
 epoch: 54, train_loss: 0.6711, test_loss: 0.9993, test_f1: 0.5794
 epoch: 55, train_loss: 0.6808, test_loss: 0.9722, test_f1: 0.5908
 epoch: 56, train_loss: 0.6759, test_loss: 0.9673, test_f1: 0.6243
 epoch: 57, train_loss: 0.6736, test_loss: 0.9808, test_f1: 0.5794
 epoch: 58, train_loss: 0.6669, test_loss: 0.9819, test_f1: 0.6003
 epoch: 59, train_loss: 0.6596, test_loss: 0.9895, test_f1: 0.6071
 epoch: 60, train_loss: 0.6722, test_loss: 1.0155, test_f1: 0.5795
 epoch: 61, train_loss: 0.6585, test_loss: 1.0097, test_f1: 0.5850
 epoch: 62, train_loss: 0.6608, test_loss: 0.9866, test_f1: 0.5827
 epoch: 63, train_loss: 0.6600, test_loss: 0.9646, test_f1: 0.6135
 epoch: 64, train_loss: 0.6714, test_loss: 0.9949, test_f1: 0.5939
 epoch: 65, train_loss: 0.6404, test_loss: 0.9572, test_f1: 0.6006
 epoch: 66, train_loss: 0.6563, test_loss: 0.9698, test_f1: 0.6187
 epoch: 67, train_loss: 0.6497, test_loss: 1.0094, test_f1: 0.5710
 epoch: 68, train_loss: 0.6562, test_loss: 1.0281, test_f1: 0.5701
 epoch: 69, train_loss: 0.6735, test_loss: 0.9712, test_f1: 0.6205
 epoch: 70, train_loss: 0.6642, test_loss: 0.9603, test_f1: 0.6135
 epoch: 71, train_loss: 0.6598, test_loss: 0.9699, test_f1: 0.6039
 epoch: 72, train_loss: 0.6364, test_loss: 0.9381, test_f1: 0.5868
 epoch: 73, train_loss: 0.6608, test_loss: 0.9558, test_f1: 0.6019
 epoch: 74, train_loss: 0.6428, test_loss: 0.9697, test_f1: 0.6100
 epoch: 75, train_loss: 0.6460, test_loss: 0.9836, test_f1: 0.5948
 epoch: 76, train_loss: 0.6515, test_loss: 0.9703, test_f1: 0.6039
 epoch: 77, train_loss: 0.6309, test_loss: 0.9676, test_f1: 0.6268
 epoch: 78, train_loss: 0.6296, test_loss: 0.9695, test_f1: 0.5868
 epoch: 79, train_loss: 0.6427, test_loss: 0.9910, test_f1: 0.5851
 epoch: 80, train_loss: 0.6451, test_loss: 1.0102, test_f1: 0.5884
 epoch: 81, train_loss: 0.6391, test_loss: 0.9821, test_f1: 0.5954
 epoch: 82, train_loss: 0.6455, test_loss: 0.9973, test_f1: 0.6119
 epoch: 83, train_loss: 0.6421, test_loss: 0.9923, test_f1: 0.6283
 epoch: 84, train_loss: 0.6206, test_loss: 0.9886, test_f1: 0.6009
 epoch: 85, train_loss: 0.6388, test_loss: 1.0003, test_f1: 0.6088
 epoch: 86, train_loss: 0.6276, test_loss: 0.9803, test_f1: 0.5923
 epoch: 87, train_loss: 0.6407, test_loss: 0.9905, test_f1: 0.6137
 epoch: 88, train_loss: 0.6223, test_loss: 1.0185, test_f1: 0.5820
 epoch: 89, train_loss: 0.6311, test_loss: 0.9764, test_f1: 0.6041
 epoch: 90, train_loss: 0.6299, test_loss: 0.9959, test_f1: 0.6177
 epoch: 91, train_loss: 0.6498, test_loss: 1.0071, test_f1: 0.6047
 epoch: 92, train_loss: 0.6396, test_loss: 0.9949, test_f1: 0.5938
 epoch: 93, train_loss: 0.6373, test_loss: 0.9956, test_f1: 0.5967
 epoch: 94, train_loss: 0.6341, test_loss: 1.0322, test_f1: 0.5899
 epoch: 95, train_loss: 0.6312, test_loss: 0.9691, test_f1: 0.6281
 epoch: 96, train_loss: 0.6090, test_loss: 0.9740, test_f1: 0.6045
 epoch: 97, train_loss: 0.6139, test_loss: 0.9886, test_f1: 0.6150
 epoch: 98, train_loss: 0.6108, test_loss: 1.0088, test_f1: 0.5782
 epoch: 99, train_loss: 0.6335, test_loss: 0.9862, test_f1: 0.6120

Training completed in 446.78 seconds
Best F1: 0.6454 at epoch 53
Mean F1 across iterations: 0.6069  0.0224
========================FINAL RESULTS================================
FEGIN weighted F1: 0.6454  0.0224
python main.py --data ltspice_demos --representation component_pin --model FEGIN --layers 4 --hiddens 16 --batch_size 64 --lr 0.001 --emb_size 250 --epochs 100 --save_appendix component_pin_L4_H16_BS64_LR0.001_E250 --no_val
-----



STDERR:
  File "main.py", line 370, in <module>
    main()
  File "main.py", line 254, in main
    dataset = dataset_class(
  File "/home/philip/projects/ltspice_examples_code_repo/Circuit-Completion-Using-GNNs/component_classification_with_link_prediction_head/evaluation/FEGIN/kernel/circuit_datasets.py", line 15, in __init__
    self.data, self.slices = torch.load(self.processed_paths[0])
  File "/home/philip/.local/lib/python3.8/site-packages/torch/serialization.py", line 1040, in load
    warnings.warn(
  File "/usr/lib/python3.8/warnings.py", line 109, in _showwarnmsg
    sw(msg.message, msg.category, msg.filename, msg.lineno,
  File "main.py", line 47, in warn_with_traceback
    traceback.print_stack(file=log)
/home/philip/projects/ltspice_examples_code_repo/Circuit-Completion-Using-GNNs/component_classification_with_link_prediction_head/evaluation/FEGIN/kernel/circuit_datasets.py:15: FutureWarning: You are using `torch.load` with `weights_only=False` (the current default value), which uses the default pickle module implicitly. It is possible to construct malicious pickle data which will execute arbitrary code during unpickling (See https://github.com/pytorch/pytorch/blob/main/SECURITY.md#untrusted-models for more details). In a future release, the default value for `weights_only` will be flipped to `True`. This limits the functions that could be executed during unpickling. Arbitrary objects will no longer be allowed to be loaded via this mode unless they are explicitly allowlisted by the user via `torch.serialization.add_safe_globals`. We recommend you start setting `weights_only=True` for any use case where you don't have full control of the loaded file. Please open an issue on GitHub for any issues related to this experimental feature.
  self.data, self.slices = torch.load(self.processed_paths[0])
