STDOUT:
Results will be saved in /home/philip/projects/ltspice_examples_code_repo/Circuit-Completion-Using-GNNs/component_classification_with_link_prediction_head/evaluation/FEGIN/results/model_FEGIN_dataset_ltspice_demos
Command line input: python main.py --data ltspice_demos --representation component_pin_net --model FEGIN --layers 2 --hiddens 64 --batch_size 32 --lr 0.001 --emb_size 128 --epochs 100 --save_appendix component_pin_net_L2_H64_BS32_LR0.001_E128 --no_val
 is saved.
-----
ltspice_demos - FEGIN
Using 2 layers, 64 hidden units, h = 2
Loading component_pin_net representation dataset
ENTERED
Training FEGIN on component_pin_net representation
Train: 1565, Test: 383
##################ITERATION #0 ****************************************
 epoch: 0, train_loss: 1.2237, test_loss: 1.2947, test_f1: 0.3394
 epoch: 1, train_loss: 1.0480, test_loss: 1.0958, test_f1: 0.4481
 epoch: 2, train_loss: 1.0107, test_loss: 1.0758, test_f1: 0.4617
 epoch: 3, train_loss: 0.9808, test_loss: 1.0353, test_f1: 0.5000
 epoch: 4, train_loss: 0.9647, test_loss: 1.0561, test_f1: 0.4849
 epoch: 5, train_loss: 0.9435, test_loss: 1.0511, test_f1: 0.5401
 epoch: 6, train_loss: 0.9139, test_loss: 1.0137, test_f1: 0.5551
 epoch: 7, train_loss: 0.9010, test_loss: 0.9759, test_f1: 0.5590
 epoch: 8, train_loss: 0.8824, test_loss: 0.9690, test_f1: 0.5874
 epoch: 9, train_loss: 0.8580, test_loss: 0.9761, test_f1: 0.5777
 epoch: 10, train_loss: 0.8515, test_loss: 1.0010, test_f1: 0.5818
 epoch: 11, train_loss: 0.8241, test_loss: 0.9759, test_f1: 0.5923
 epoch: 12, train_loss: 0.8078, test_loss: 0.9157, test_f1: 0.6226
 epoch: 13, train_loss: 0.7844, test_loss: 0.9487, test_f1: 0.5912
 epoch: 14, train_loss: 0.7774, test_loss: 1.0275, test_f1: 0.5745
 epoch: 15, train_loss: 0.7688, test_loss: 0.9087, test_f1: 0.6320
 epoch: 16, train_loss: 0.7396, test_loss: 0.9267, test_f1: 0.6715
 epoch: 17, train_loss: 0.7293, test_loss: 0.9841, test_f1: 0.5764
 epoch: 18, train_loss: 0.7096, test_loss: 0.9199, test_f1: 0.6038
 epoch: 19, train_loss: 0.7042, test_loss: 0.9179, test_f1: 0.6255
 epoch: 20, train_loss: 0.6802, test_loss: 1.0342, test_f1: 0.5850
 epoch: 21, train_loss: 0.6721, test_loss: 0.9709, test_f1: 0.6729
 epoch: 22, train_loss: 0.6602, test_loss: 1.0036, test_f1: 0.5828
 epoch: 23, train_loss: 0.6544, test_loss: 0.9942, test_f1: 0.6209
 epoch: 24, train_loss: 0.6615, test_loss: 1.0315, test_f1: 0.5726
 epoch: 25, train_loss: 0.6499, test_loss: 1.1168, test_f1: 0.6267
 epoch: 26, train_loss: 0.6345, test_loss: 1.0546, test_f1: 0.6083
 epoch: 27, train_loss: 0.6160, test_loss: 1.0599, test_f1: 0.6414
 epoch: 28, train_loss: 0.6144, test_loss: 1.0620, test_f1: 0.6137
 epoch: 29, train_loss: 0.6206, test_loss: 1.0404, test_f1: 0.6639
 epoch: 30, train_loss: 0.5933, test_loss: 1.1106, test_f1: 0.5897
 epoch: 31, train_loss: 0.5844, test_loss: 1.0700, test_f1: 0.5367
 epoch: 32, train_loss: 0.5874, test_loss: 1.0951, test_f1: 0.6474
 epoch: 33, train_loss: 0.5489, test_loss: 1.2264, test_f1: 0.6582
 epoch: 34, train_loss: 0.5671, test_loss: 1.1054, test_f1: 0.6383
 epoch: 35, train_loss: 0.5481, test_loss: 1.2124, test_f1: 0.6015
 epoch: 36, train_loss: 0.5243, test_loss: 1.2280, test_f1: 0.6067
 epoch: 37, train_loss: 0.5374, test_loss: 1.2375, test_f1: 0.6025
 epoch: 38, train_loss: 0.5254, test_loss: 1.3028, test_f1: 0.5956
 epoch: 39, train_loss: 0.5278, test_loss: 1.2546, test_f1: 0.5998
 epoch: 40, train_loss: 0.4844, test_loss: 1.2189, test_f1: 0.5997
 epoch: 41, train_loss: 0.5088, test_loss: 1.5438, test_f1: 0.5945
 epoch: 42, train_loss: 0.4919, test_loss: 1.1715, test_f1: 0.6259
 epoch: 43, train_loss: 0.4643, test_loss: 1.2704, test_f1: 0.5918
 epoch: 44, train_loss: 0.4845, test_loss: 1.3404, test_f1: 0.6159
 epoch: 45, train_loss: 0.4651, test_loss: 1.3361, test_f1: 0.6561
 epoch: 46, train_loss: 0.4717, test_loss: 1.1336, test_f1: 0.6182
 epoch: 47, train_loss: 0.4502, test_loss: 1.3772, test_f1: 0.6180
 epoch: 48, train_loss: 0.4407, test_loss: 1.4714, test_f1: 0.5764
 epoch: 49, train_loss: 0.4516, test_loss: 1.3766, test_f1: 0.6215
 epoch: 50, train_loss: 0.4006, test_loss: 1.7180, test_f1: 0.5822
 epoch: 51, train_loss: 0.3834, test_loss: 1.4035, test_f1: 0.6098
 epoch: 52, train_loss: 0.3689, test_loss: 1.5863, test_f1: 0.6098
 epoch: 53, train_loss: 0.3855, test_loss: 1.5558, test_f1: 0.6121
 epoch: 54, train_loss: 0.3669, test_loss: 1.4785, test_f1: 0.6262
 epoch: 55, train_loss: 0.3529, test_loss: 1.3910, test_f1: 0.6180
 epoch: 56, train_loss: 0.3454, test_loss: 1.5703, test_f1: 0.6276
 epoch: 57, train_loss: 0.3267, test_loss: 1.6721, test_f1: 0.6130
 epoch: 58, train_loss: 0.3250, test_loss: 1.5706, test_f1: 0.6074
 epoch: 59, train_loss: 0.3156, test_loss: 1.6506, test_f1: 0.6035
 epoch: 60, train_loss: 0.3555, test_loss: 1.6606, test_f1: 0.6189
 epoch: 61, train_loss: 0.3174, test_loss: 1.6607, test_f1: 0.5893
 epoch: 62, train_loss: 0.3262, test_loss: 1.6516, test_f1: 0.6475
 epoch: 63, train_loss: 0.3107, test_loss: 1.7567, test_f1: 0.6042
 epoch: 64, train_loss: 0.3136, test_loss: 1.6199, test_f1: 0.6278
 epoch: 65, train_loss: 0.3178, test_loss: 1.5042, test_f1: 0.6563
 epoch: 66, train_loss: 0.3009, test_loss: 1.7801, test_f1: 0.6085
 epoch: 67, train_loss: 0.3037, test_loss: 1.8535, test_f1: 0.6131
 epoch: 68, train_loss: 0.2954, test_loss: 1.9380, test_f1: 0.5864
 epoch: 69, train_loss: 0.2911, test_loss: 1.7989, test_f1: 0.6166
 epoch: 70, train_loss: 0.3041, test_loss: 1.7899, test_f1: 0.6407
 epoch: 71, train_loss: 0.2847, test_loss: 1.9806, test_f1: 0.5952
 epoch: 72, train_loss: 0.2727, test_loss: 1.7717, test_f1: 0.6375
 epoch: 73, train_loss: 0.2840, test_loss: 1.9387, test_f1: 0.6084
 epoch: 74, train_loss: 0.2634, test_loss: 1.8834, test_f1: 0.6135
 epoch: 75, train_loss: 0.2632, test_loss: 2.1257, test_f1: 0.5970
 epoch: 76, train_loss: 0.2776, test_loss: 1.9731, test_f1: 0.6026
 epoch: 77, train_loss: 0.2662, test_loss: 2.0311, test_f1: 0.6133
 epoch: 78, train_loss: 0.2316, test_loss: 2.1012, test_f1: 0.6138
 epoch: 79, train_loss: 0.2739, test_loss: 2.0159, test_f1: 0.6028
 epoch: 80, train_loss: 0.2508, test_loss: 1.8199, test_f1: 0.6423
 epoch: 81, train_loss: 0.2381, test_loss: 2.1435, test_f1: 0.5848
 epoch: 82, train_loss: 0.2316, test_loss: 2.0587, test_f1: 0.6033
 epoch: 83, train_loss: 0.2361, test_loss: 1.9976, test_f1: 0.6443
 epoch: 84, train_loss: 0.2446, test_loss: 2.1276, test_f1: 0.5942
 epoch: 85, train_loss: 0.2572, test_loss: 2.1507, test_f1: 0.6082
 epoch: 86, train_loss: 0.2378, test_loss: 2.0926, test_f1: 0.5903
 epoch: 87, train_loss: 0.2606, test_loss: 2.0065, test_f1: 0.6220
 epoch: 88, train_loss: 0.2220, test_loss: 2.1739, test_f1: 0.6088
 epoch: 89, train_loss: 0.2364, test_loss: 2.2257, test_f1: 0.6387
 epoch: 90, train_loss: 0.2231, test_loss: 2.4086, test_f1: 0.6099
 epoch: 91, train_loss: 0.2150, test_loss: 2.2573, test_f1: 0.6426
 epoch: 92, train_loss: 0.2166, test_loss: 2.3327, test_f1: 0.6165
 epoch: 93, train_loss: 0.2158, test_loss: 2.2034, test_f1: 0.6236
 epoch: 94, train_loss: 0.2138, test_loss: 2.3760, test_f1: 0.6503
 epoch: 95, train_loss: 0.1974, test_loss: 2.4459, test_f1: 0.6434
 epoch: 96, train_loss: 0.2573, test_loss: 2.1744, test_f1: 0.6082
 epoch: 97, train_loss: 0.2181, test_loss: 2.3297, test_f1: 0.6095
 epoch: 98, train_loss: 0.2230, test_loss: 2.2673, test_f1: 0.6149
 epoch: 99, train_loss: 0.2036, test_loss: 2.4073, test_f1: 0.5998
##################ITERATION #1 ****************************************
 epoch: 0, train_loss: 1.1279, test_loss: 1.0893, test_f1: 0.4798
 epoch: 1, train_loss: 0.9841, test_loss: 1.0555, test_f1: 0.4877
 epoch: 2, train_loss: 0.9381, test_loss: 0.9994, test_f1: 0.5290
 epoch: 3, train_loss: 0.9119, test_loss: 0.9902, test_f1: 0.5633
 epoch: 4, train_loss: 0.8899, test_loss: 0.9803, test_f1: 0.5606
 epoch: 5, train_loss: 0.8617, test_loss: 0.9987, test_f1: 0.5573
 epoch: 6, train_loss: 0.8381, test_loss: 0.9742, test_f1: 0.5594
 epoch: 7, train_loss: 0.8188, test_loss: 1.0335, test_f1: 0.5699
 epoch: 8, train_loss: 0.7969, test_loss: 0.9864, test_f1: 0.5368
 epoch: 9, train_loss: 0.7804, test_loss: 1.0111, test_f1: 0.5638
 epoch: 10, train_loss: 0.7539, test_loss: 1.0518, test_f1: 0.5161
 epoch: 11, train_loss: 0.7490, test_loss: 1.0562, test_f1: 0.5253
 epoch: 12, train_loss: 0.7383, test_loss: 0.9796, test_f1: 0.5673
 epoch: 13, train_loss: 0.7284, test_loss: 0.9396, test_f1: 0.6482
 epoch: 14, train_loss: 0.6994, test_loss: 0.9359, test_f1: 0.6042
 epoch: 15, train_loss: 0.6961, test_loss: 0.9892, test_f1: 0.5609
 epoch: 16, train_loss: 0.6842, test_loss: 0.9721, test_f1: 0.6225
 epoch: 17, train_loss: 0.6548, test_loss: 0.9993, test_f1: 0.5663
 epoch: 18, train_loss: 0.6632, test_loss: 0.9911, test_f1: 0.6256
 epoch: 19, train_loss: 0.6447, test_loss: 0.9812, test_f1: 0.6307
 epoch: 20, train_loss: 0.6424, test_loss: 1.0885, test_f1: 0.6308
 epoch: 21, train_loss: 0.6440, test_loss: 1.0136, test_f1: 0.6069
 epoch: 22, train_loss: 0.6290, test_loss: 0.9844, test_f1: 0.5779
 epoch: 23, train_loss: 0.6221, test_loss: 1.1194, test_f1: 0.6114
 epoch: 24, train_loss: 0.5963, test_loss: 1.0112, test_f1: 0.6126
 epoch: 25, train_loss: 0.6149, test_loss: 0.9966, test_f1: 0.6350
 epoch: 26, train_loss: 0.5896, test_loss: 1.1265, test_f1: 0.6002
 epoch: 27, train_loss: 0.5802, test_loss: 1.0746, test_f1: 0.5418
 epoch: 28, train_loss: 0.5546, test_loss: 1.1852, test_f1: 0.6046
 epoch: 29, train_loss: 0.5437, test_loss: 1.1173, test_f1: 0.6029
 epoch: 30, train_loss: 0.5356, test_loss: 1.1253, test_f1: 0.6404
 epoch: 31, train_loss: 0.5719, test_loss: 1.0448, test_f1: 0.6396
 epoch: 32, train_loss: 0.5151, test_loss: 1.1875, test_f1: 0.5856
 epoch: 33, train_loss: 0.5485, test_loss: 1.3476, test_f1: 0.5893
 epoch: 34, train_loss: 0.5223, test_loss: 1.1160, test_f1: 0.6253
 epoch: 35, train_loss: 0.5181, test_loss: 1.4091, test_f1: 0.5966
 epoch: 36, train_loss: 0.5235, test_loss: 1.2401, test_f1: 0.6393
 epoch: 37, train_loss: 0.4975, test_loss: 1.3228, test_f1: 0.6021
 epoch: 38, train_loss: 0.5099, test_loss: 1.2912, test_f1: 0.5823
 epoch: 39, train_loss: 0.4908, test_loss: 1.2234, test_f1: 0.6005
 epoch: 40, train_loss: 0.4568, test_loss: 1.3090, test_f1: 0.5965
 epoch: 41, train_loss: 0.4705, test_loss: 1.3834, test_f1: 0.5905
 epoch: 42, train_loss: 0.4608, test_loss: 1.1980, test_f1: 0.6086
 epoch: 43, train_loss: 0.4483, test_loss: 1.2547, test_f1: 0.6122
 epoch: 44, train_loss: 0.4654, test_loss: 1.3404, test_f1: 0.5752
 epoch: 45, train_loss: 0.4466, test_loss: 1.3666, test_f1: 0.6167
 epoch: 46, train_loss: 0.4325, test_loss: 1.3169, test_f1: 0.6121
 epoch: 47, train_loss: 0.4289, test_loss: 1.3958, test_f1: 0.6272
 epoch: 48, train_loss: 0.4362, test_loss: 1.5942, test_f1: 0.6033
 epoch: 49, train_loss: 0.4497, test_loss: 1.4878, test_f1: 0.5795
 epoch: 50, train_loss: 0.4467, test_loss: 1.4587, test_f1: 0.5609
 epoch: 51, train_loss: 0.4080, test_loss: 1.5517, test_f1: 0.6202
 epoch: 52, train_loss: 0.3679, test_loss: 1.5001, test_f1: 0.6132
 epoch: 53, train_loss: 0.3629, test_loss: 1.7194, test_f1: 0.6156
 epoch: 54, train_loss: 0.3632, test_loss: 1.5092, test_f1: 0.6279
 epoch: 55, train_loss: 0.3538, test_loss: 1.5587, test_f1: 0.6281
 epoch: 56, train_loss: 0.3369, test_loss: 1.6670, test_f1: 0.6157
 epoch: 57, train_loss: 0.3281, test_loss: 1.5271, test_f1: 0.6058
 epoch: 58, train_loss: 0.3528, test_loss: 1.7106, test_f1: 0.5877
 epoch: 59, train_loss: 0.3298, test_loss: 1.7746, test_f1: 0.6162
 epoch: 60, train_loss: 0.3364, test_loss: 1.7273, test_f1: 0.6236
 epoch: 61, train_loss: 0.3277, test_loss: 1.5877, test_f1: 0.6224
 epoch: 62, train_loss: 0.3192, test_loss: 1.6452, test_f1: 0.6127
 epoch: 63, train_loss: 0.3103, test_loss: 1.8542, test_f1: 0.6064
 epoch: 64, train_loss: 0.3021, test_loss: 1.7247, test_f1: 0.6113
 epoch: 65, train_loss: 0.3096, test_loss: 1.6634, test_f1: 0.6095
 epoch: 66, train_loss: 0.3099, test_loss: 1.7697, test_f1: 0.6031
 epoch: 67, train_loss: 0.3229, test_loss: 1.7891, test_f1: 0.6244
 epoch: 68, train_loss: 0.3018, test_loss: 1.9752, test_f1: 0.6044
 epoch: 69, train_loss: 0.2994, test_loss: 2.1123, test_f1: 0.5830
 epoch: 70, train_loss: 0.3115, test_loss: 1.9597, test_f1: 0.6155
 epoch: 71, train_loss: 0.2897, test_loss: 1.7374, test_f1: 0.6473
 epoch: 72, train_loss: 0.2610, test_loss: 1.9170, test_f1: 0.6336
 epoch: 73, train_loss: 0.3045, test_loss: 1.9877, test_f1: 0.6212
 epoch: 74, train_loss: 0.2901, test_loss: 1.9536, test_f1: 0.6266
 epoch: 75, train_loss: 0.2849, test_loss: 1.8317, test_f1: 0.6194
 epoch: 76, train_loss: 0.2792, test_loss: 1.7817, test_f1: 0.6511
 epoch: 77, train_loss: 0.2642, test_loss: 1.8375, test_f1: 0.6368
 epoch: 78, train_loss: 0.2539, test_loss: 2.0896, test_f1: 0.6173
 epoch: 79, train_loss: 0.2928, test_loss: 1.9059, test_f1: 0.5942
 epoch: 80, train_loss: 0.2600, test_loss: 2.1272, test_f1: 0.6260
 epoch: 81, train_loss: 0.2572, test_loss: 2.0064, test_f1: 0.6164
 epoch: 82, train_loss: 0.2822, test_loss: 1.8108, test_f1: 0.6247
 epoch: 83, train_loss: 0.2520, test_loss: 1.9664, test_f1: 0.6210
 epoch: 84, train_loss: 0.2747, test_loss: 2.0868, test_f1: 0.5908
 epoch: 85, train_loss: 0.2713, test_loss: 2.1414, test_f1: 0.5920
 epoch: 86, train_loss: 0.2560, test_loss: 2.0742, test_f1: 0.6161
 epoch: 87, train_loss: 0.2548, test_loss: 2.0276, test_f1: 0.6190
 epoch: 88, train_loss: 0.2438, test_loss: 2.0564, test_f1: 0.6132
 epoch: 89, train_loss: 0.2306, test_loss: 1.8967, test_f1: 0.6362
 epoch: 90, train_loss: 0.2347, test_loss: 2.0095, test_f1: 0.6271
 epoch: 91, train_loss: 0.2690, test_loss: 2.3332, test_f1: 0.6060
 epoch: 92, train_loss: 0.2624, test_loss: 2.1666, test_f1: 0.5979
 epoch: 93, train_loss: 0.2384, test_loss: 2.4308, test_f1: 0.6068
 epoch: 94, train_loss: 0.2812, test_loss: 2.1974, test_f1: 0.6031
 epoch: 95, train_loss: 0.2496, test_loss: 2.2575, test_f1: 0.6150
 epoch: 96, train_loss: 0.2322, test_loss: 2.2773, test_f1: 0.6122
 epoch: 97, train_loss: 0.2330, test_loss: 2.0945, test_f1: 0.6193
 epoch: 98, train_loss: 0.2535, test_loss: 2.1595, test_f1: 0.6264
 epoch: 99, train_loss: 0.2379, test_loss: 2.3171, test_f1: 0.6287
##################ITERATION #2 ****************************************
 epoch: 0, train_loss: 1.1005, test_loss: 1.2693, test_f1: 0.3018
 epoch: 1, train_loss: 0.9624, test_loss: 0.9997, test_f1: 0.5509
 epoch: 2, train_loss: 0.9116, test_loss: 0.9796, test_f1: 0.5328
 epoch: 3, train_loss: 0.8885, test_loss: 0.9711, test_f1: 0.5907
 epoch: 4, train_loss: 0.8407, test_loss: 0.9914, test_f1: 0.5771
 epoch: 5, train_loss: 0.8299, test_loss: 0.9518, test_f1: 0.5824
 epoch: 6, train_loss: 0.8115, test_loss: 0.9857, test_f1: 0.5726
 epoch: 7, train_loss: 0.7770, test_loss: 0.9575, test_f1: 0.6245
 epoch: 8, train_loss: 0.7557, test_loss: 1.0507, test_f1: 0.5414
 epoch: 9, train_loss: 0.7623, test_loss: 0.9927, test_f1: 0.6120
 epoch: 10, train_loss: 0.7299, test_loss: 0.9967, test_f1: 0.5893
 epoch: 11, train_loss: 0.7311, test_loss: 1.0393, test_f1: 0.6113
 epoch: 12, train_loss: 0.7105, test_loss: 0.9610, test_f1: 0.6333
 epoch: 13, train_loss: 0.7200, test_loss: 1.0182, test_f1: 0.5841
 epoch: 14, train_loss: 0.6833, test_loss: 1.0095, test_f1: 0.6017
 epoch: 15, train_loss: 0.6733, test_loss: 1.0242, test_f1: 0.5952
 epoch: 16, train_loss: 0.6596, test_loss: 0.9984, test_f1: 0.6124
 epoch: 17, train_loss: 0.6535, test_loss: 0.9475, test_f1: 0.6080
 epoch: 18, train_loss: 0.6554, test_loss: 1.0344, test_f1: 0.5921
 epoch: 19, train_loss: 0.6300, test_loss: 0.9448, test_f1: 0.6459
 epoch: 20, train_loss: 0.6277, test_loss: 0.9888, test_f1: 0.5926
 epoch: 21, train_loss: 0.6005, test_loss: 1.1227, test_f1: 0.5841
 epoch: 22, train_loss: 0.5831, test_loss: 1.0382, test_f1: 0.5858
 epoch: 23, train_loss: 0.5879, test_loss: 1.0037, test_f1: 0.6646
 epoch: 24, train_loss: 0.5823, test_loss: 1.0432, test_f1: 0.6327
 epoch: 25, train_loss: 0.5720, test_loss: 1.0177, test_f1: 0.6039
 epoch: 26, train_loss: 0.5901, test_loss: 1.0630, test_f1: 0.6376
 epoch: 27, train_loss: 0.5480, test_loss: 1.0407, test_f1: 0.6314
 epoch: 28, train_loss: 0.5469, test_loss: 1.0254, test_f1: 0.6294
 epoch: 29, train_loss: 0.5549, test_loss: 1.0449, test_f1: 0.6313
 epoch: 30, train_loss: 0.5360, test_loss: 1.1654, test_f1: 0.5723
 epoch: 31, train_loss: 0.5343, test_loss: 1.0776, test_f1: 0.6298
 epoch: 32, train_loss: 0.5296, test_loss: 1.1194, test_f1: 0.5963
 epoch: 33, train_loss: 0.4936, test_loss: 1.1404, test_f1: 0.5865
 epoch: 34, train_loss: 0.5254, test_loss: 1.1508, test_f1: 0.5798
 epoch: 35, train_loss: 0.4854, test_loss: 1.1350, test_f1: 0.6303
 epoch: 36, train_loss: 0.4804, test_loss: 1.1119, test_f1: 0.5957
 epoch: 37, train_loss: 0.4784, test_loss: 1.1601, test_f1: 0.5835
 epoch: 38, train_loss: 0.4945, test_loss: 1.2310, test_f1: 0.6064
 epoch: 39, train_loss: 0.4621, test_loss: 1.2132, test_f1: 0.6393
 epoch: 40, train_loss: 0.4835, test_loss: 1.2112, test_f1: 0.6377
 epoch: 41, train_loss: 0.4950, test_loss: 1.0770, test_f1: 0.6216
 epoch: 42, train_loss: 0.4392, test_loss: 1.3377, test_f1: 0.5793
 epoch: 43, train_loss: 0.4475, test_loss: 1.1802, test_f1: 0.6208
 epoch: 44, train_loss: 0.4427, test_loss: 1.2203, test_f1: 0.6235
 epoch: 45, train_loss: 0.4149, test_loss: 1.1995, test_f1: 0.6296
 epoch: 46, train_loss: 0.4145, test_loss: 1.1631, test_f1: 0.6144
 epoch: 47, train_loss: 0.4203, test_loss: 1.2377, test_f1: 0.5861
 epoch: 48, train_loss: 0.3999, test_loss: 1.2805, test_f1: 0.6166
 epoch: 49, train_loss: 0.3882, test_loss: 1.2704, test_f1: 0.6423
 epoch: 50, train_loss: 0.3865, test_loss: 1.2890, test_f1: 0.6146
 epoch: 51, train_loss: 0.3696, test_loss: 1.3554, test_f1: 0.6086
 epoch: 52, train_loss: 0.3815, test_loss: 1.3437, test_f1: 0.6030
 epoch: 53, train_loss: 0.3461, test_loss: 1.4111, test_f1: 0.6178
 epoch: 54, train_loss: 0.3259, test_loss: 1.3706, test_f1: 0.6206
 epoch: 55, train_loss: 0.3388, test_loss: 1.2988, test_f1: 0.6628
 epoch: 56, train_loss: 0.3173, test_loss: 1.3616, test_f1: 0.6333
 epoch: 57, train_loss: 0.3395, test_loss: 1.3776, test_f1: 0.6052
 epoch: 58, train_loss: 0.3504, test_loss: 1.3591, test_f1: 0.6174
 epoch: 59, train_loss: 0.3043, test_loss: 1.3756, test_f1: 0.6375
 epoch: 60, train_loss: 0.3096, test_loss: 1.4069, test_f1: 0.6269
 epoch: 61, train_loss: 0.2885, test_loss: 1.4608, test_f1: 0.6222
 epoch: 62, train_loss: 0.3081, test_loss: 1.4178, test_f1: 0.6509
 epoch: 63, train_loss: 0.3061, test_loss: 1.4978, test_f1: 0.6240
 epoch: 64, train_loss: 0.3020, test_loss: 1.4538, test_f1: 0.6249
 epoch: 65, train_loss: 0.3050, test_loss: 1.4575, test_f1: 0.6369
 epoch: 66, train_loss: 0.3080, test_loss: 1.5208, test_f1: 0.6335
 epoch: 67, train_loss: 0.2671, test_loss: 1.4875, test_f1: 0.6390
 epoch: 68, train_loss: 0.2689, test_loss: 1.5677, test_f1: 0.6335
 epoch: 69, train_loss: 0.2803, test_loss: 1.5256, test_f1: 0.6348
 epoch: 70, train_loss: 0.2956, test_loss: 1.5405, test_f1: 0.6267
 epoch: 71, train_loss: 0.2896, test_loss: 1.5704, test_f1: 0.6380
 epoch: 72, train_loss: 0.2790, test_loss: 1.4856, test_f1: 0.6280
 epoch: 73, train_loss: 0.2678, test_loss: 1.5796, test_f1: 0.6002
 epoch: 74, train_loss: 0.2508, test_loss: 1.5957, test_f1: 0.6166
 epoch: 75, train_loss: 0.2644, test_loss: 1.6198, test_f1: 0.6252
 epoch: 76, train_loss: 0.2480, test_loss: 1.5978, test_f1: 0.6418
 epoch: 77, train_loss: 0.2986, test_loss: 1.5948, test_f1: 0.6196
 epoch: 78, train_loss: 0.2672, test_loss: 1.5717, test_f1: 0.6336
 epoch: 79, train_loss: 0.2762, test_loss: 1.4972, test_f1: 0.6130
 epoch: 80, train_loss: 0.2677, test_loss: 1.5001, test_f1: 0.6216
 epoch: 81, train_loss: 0.2430, test_loss: 1.6640, test_f1: 0.6197
 epoch: 82, train_loss: 0.2469, test_loss: 1.7109, test_f1: 0.6162
 epoch: 83, train_loss: 0.2118, test_loss: 1.6727, test_f1: 0.6329
 epoch: 84, train_loss: 0.2687, test_loss: 1.6844, test_f1: 0.5980
 epoch: 85, train_loss: 0.2472, test_loss: 1.6662, test_f1: 0.6118
 epoch: 86, train_loss: 0.2353, test_loss: 1.7222, test_f1: 0.6111
 epoch: 87, train_loss: 0.2342, test_loss: 1.7434, test_f1: 0.6058
 epoch: 88, train_loss: 0.2434, test_loss: 1.6639, test_f1: 0.6029
 epoch: 89, train_loss: 0.2332, test_loss: 1.7698, test_f1: 0.6108
 epoch: 90, train_loss: 0.2525, test_loss: 1.6988, test_f1: 0.6100
 epoch: 91, train_loss: 0.2326, test_loss: 1.7389, test_f1: 0.6030
 epoch: 92, train_loss: 0.2287, test_loss: 1.8354, test_f1: 0.5987
 epoch: 93, train_loss: 0.2482, test_loss: 1.7495, test_f1: 0.5970
 epoch: 94, train_loss: 0.2185, test_loss: 1.8753, test_f1: 0.6040
 epoch: 95, train_loss: 0.2126, test_loss: 1.7549, test_f1: 0.6321
 epoch: 96, train_loss: 0.2347, test_loss: 1.7583, test_f1: 0.6244
 epoch: 97, train_loss: 0.2084, test_loss: 1.8059, test_f1: 0.6237
 epoch: 98, train_loss: 0.2079, test_loss: 1.7705, test_f1: 0.6183
 epoch: 99, train_loss: 0.2223, test_loss: 1.8779, test_f1: 0.5946
##################ITERATION #3 ****************************************
 epoch: 0, train_loss: 1.1367, test_loss: 1.2210, test_f1: 0.4372
 epoch: 1, train_loss: 0.9540, test_loss: 1.0386, test_f1: 0.4912
 epoch: 2, train_loss: 0.9102, test_loss: 0.9891, test_f1: 0.5586
 epoch: 3, train_loss: 0.9009, test_loss: 1.0016, test_f1: 0.5544
 epoch: 4, train_loss: 0.8526, test_loss: 1.0064, test_f1: 0.5302
 epoch: 5, train_loss: 0.8314, test_loss: 0.9993, test_f1: 0.5617
 epoch: 6, train_loss: 0.8079, test_loss: 0.9979, test_f1: 0.5827
 epoch: 7, train_loss: 0.7815, test_loss: 1.0108, test_f1: 0.5612
 epoch: 8, train_loss: 0.7817, test_loss: 0.9942, test_f1: 0.5906
 epoch: 9, train_loss: 0.7573, test_loss: 1.0210, test_f1: 0.5898
 epoch: 10, train_loss: 0.7269, test_loss: 1.1731, test_f1: 0.5367
 epoch: 11, train_loss: 0.7212, test_loss: 1.0675, test_f1: 0.5697
 epoch: 12, train_loss: 0.6968, test_loss: 1.0358, test_f1: 0.6148
 epoch: 13, train_loss: 0.6968, test_loss: 1.0533, test_f1: 0.5994
 epoch: 14, train_loss: 0.6694, test_loss: 0.9879, test_f1: 0.6351
 epoch: 15, train_loss: 0.6835, test_loss: 1.0782, test_f1: 0.5912
 epoch: 16, train_loss: 0.6660, test_loss: 1.0024, test_f1: 0.6425
 epoch: 17, train_loss: 0.6554, test_loss: 1.0765, test_f1: 0.5657
 epoch: 18, train_loss: 0.6579, test_loss: 1.0882, test_f1: 0.5804
 epoch: 19, train_loss: 0.6264, test_loss: 0.9939, test_f1: 0.6187
 epoch: 20, train_loss: 0.6145, test_loss: 1.0933, test_f1: 0.6065
 epoch: 21, train_loss: 0.6019, test_loss: 1.1026, test_f1: 0.5823
 epoch: 22, train_loss: 0.5977, test_loss: 1.0685, test_f1: 0.6250
 epoch: 23, train_loss: 0.6012, test_loss: 1.1468, test_f1: 0.6397
 epoch: 24, train_loss: 0.5997, test_loss: 1.2709, test_f1: 0.5960
 epoch: 25, train_loss: 0.5968, test_loss: 1.2190, test_f1: 0.6068
 epoch: 26, train_loss: 0.5837, test_loss: 1.0631, test_f1: 0.6412
 epoch: 27, train_loss: 0.5512, test_loss: 1.1612, test_f1: 0.6282
 epoch: 28, train_loss: 0.5526, test_loss: 1.3970, test_f1: 0.6083
 epoch: 29, train_loss: 0.5558, test_loss: 1.1922, test_f1: 0.5464
 epoch: 30, train_loss: 0.5210, test_loss: 1.1841, test_f1: 0.6408
 epoch: 31, train_loss: 0.5288, test_loss: 1.2163, test_f1: 0.6398
 epoch: 32, train_loss: 0.5229, test_loss: 1.2604, test_f1: 0.6553
 epoch: 33, train_loss: 0.4947, test_loss: 1.3073, test_f1: 0.5818
 epoch: 34, train_loss: 0.5205, test_loss: 1.1786, test_f1: 0.5969
 epoch: 35, train_loss: 0.5176, test_loss: 1.2667, test_f1: 0.5866
 epoch: 36, train_loss: 0.4677, test_loss: 1.3501, test_f1: 0.6148
 epoch: 37, train_loss: 0.4587, test_loss: 1.3373, test_f1: 0.6074
 epoch: 38, train_loss: 0.4777, test_loss: 1.2587, test_f1: 0.6196
 epoch: 39, train_loss: 0.4936, test_loss: 1.3252, test_f1: 0.5862
 epoch: 40, train_loss: 0.4842, test_loss: 1.4315, test_f1: 0.5974
 epoch: 41, train_loss: 0.4362, test_loss: 1.3119, test_f1: 0.5918
 epoch: 42, train_loss: 0.4535, test_loss: 1.2275, test_f1: 0.6453
 epoch: 43, train_loss: 0.4461, test_loss: 1.2533, test_f1: 0.6103
 epoch: 44, train_loss: 0.4515, test_loss: 1.3987, test_f1: 0.6205
 epoch: 45, train_loss: 0.4246, test_loss: 1.3809, test_f1: 0.6255
 epoch: 46, train_loss: 0.3946, test_loss: 1.3334, test_f1: 0.6134
 epoch: 47, train_loss: 0.4281, test_loss: 1.4859, test_f1: 0.6043
 epoch: 48, train_loss: 0.4017, test_loss: 1.4285, test_f1: 0.6146
 epoch: 49, train_loss: 0.4043, test_loss: 1.4438, test_f1: 0.5681
 epoch: 50, train_loss: 0.4027, test_loss: 1.6049, test_f1: 0.6111
 epoch: 51, train_loss: 0.3631, test_loss: 1.3818, test_f1: 0.6133
 epoch: 52, train_loss: 0.3542, test_loss: 1.4685, test_f1: 0.6442
 epoch: 53, train_loss: 0.3377, test_loss: 1.4343, test_f1: 0.6288
 epoch: 54, train_loss: 0.3471, test_loss: 1.4448, test_f1: 0.6316
 epoch: 55, train_loss: 0.3331, test_loss: 1.6262, test_f1: 0.6164
 epoch: 56, train_loss: 0.3412, test_loss: 1.3664, test_f1: 0.6285
 epoch: 57, train_loss: 0.3370, test_loss: 1.5246, test_f1: 0.5845
 epoch: 58, train_loss: 0.3261, test_loss: 1.5399, test_f1: 0.6301
 epoch: 59, train_loss: 0.3168, test_loss: 1.6423, test_f1: 0.6147
 epoch: 60, train_loss: 0.3220, test_loss: 1.5681, test_f1: 0.6393
 epoch: 61, train_loss: 0.2980, test_loss: 1.7720, test_f1: 0.6423
 epoch: 62, train_loss: 0.3063, test_loss: 1.7686, test_f1: 0.6130
 epoch: 63, train_loss: 0.3087, test_loss: 1.6957, test_f1: 0.6304
 epoch: 64, train_loss: 0.3103, test_loss: 1.5902, test_f1: 0.6205
 epoch: 65, train_loss: 0.3156, test_loss: 1.5887, test_f1: 0.5983
 epoch: 66, train_loss: 0.3100, test_loss: 1.8300, test_f1: 0.5885
 epoch: 67, train_loss: 0.2860, test_loss: 1.6387, test_f1: 0.6437
 epoch: 68, train_loss: 0.2833, test_loss: 1.7122, test_f1: 0.6199
 epoch: 69, train_loss: 0.2781, test_loss: 1.7671, test_f1: 0.6047
 epoch: 70, train_loss: 0.2729, test_loss: 1.8181, test_f1: 0.6002
 epoch: 71, train_loss: 0.2922, test_loss: 1.8086, test_f1: 0.6126
 epoch: 72, train_loss: 0.2834, test_loss: 1.6113, test_f1: 0.6443
 epoch: 73, train_loss: 0.2811, test_loss: 1.7786, test_f1: 0.6052
 epoch: 74, train_loss: 0.2646, test_loss: 1.6661, test_f1: 0.6273
 epoch: 75, train_loss: 0.2526, test_loss: 1.5916, test_f1: 0.6523
 epoch: 76, train_loss: 0.2810, test_loss: 1.7651, test_f1: 0.6204
 epoch: 77, train_loss: 0.2566, test_loss: 1.7467, test_f1: 0.6378
 epoch: 78, train_loss: 0.2469, test_loss: 1.7255, test_f1: 0.6215
 epoch: 79, train_loss: 0.2621, test_loss: 1.7904, test_f1: 0.6427
 epoch: 80, train_loss: 0.2684, test_loss: 1.7144, test_f1: 0.6184
 epoch: 81, train_loss: 0.2709, test_loss: 1.8368, test_f1: 0.6346
 epoch: 82, train_loss: 0.2297, test_loss: 1.8000, test_f1: 0.6236
 epoch: 83, train_loss: 0.2363, test_loss: 1.8356, test_f1: 0.6186
 epoch: 84, train_loss: 0.2604, test_loss: 1.7977, test_f1: 0.6355
 epoch: 85, train_loss: 0.2652, test_loss: 1.7957, test_f1: 0.6304
 epoch: 86, train_loss: 0.2707, test_loss: 1.7104, test_f1: 0.6253
 epoch: 87, train_loss: 0.2368, test_loss: 1.8175, test_f1: 0.6271
 epoch: 88, train_loss: 0.2382, test_loss: 1.9391, test_f1: 0.5967
 epoch: 89, train_loss: 0.2422, test_loss: 1.8554, test_f1: 0.6272
 epoch: 90, train_loss: 0.2374, test_loss: 1.9018, test_f1: 0.6020
 epoch: 91, train_loss: 0.2144, test_loss: 1.8619, test_f1: 0.6381
 epoch: 92, train_loss: 0.2292, test_loss: 1.9472, test_f1: 0.6172
 epoch: 93, train_loss: 0.2368, test_loss: 1.9702, test_f1: 0.6203
 epoch: 94, train_loss: 0.2238, test_loss: 1.8491, test_f1: 0.6168
 epoch: 95, train_loss: 0.2228, test_loss: 1.9696, test_f1: 0.6147
 epoch: 96, train_loss: 0.2380, test_loss: 1.9487, test_f1: 0.6080
 epoch: 97, train_loss: 0.2170, test_loss: 1.9261, test_f1: 0.6255
 epoch: 98, train_loss: 0.2340, test_loss: 2.0325, test_f1: 0.6200
 epoch: 99, train_loss: 0.2192, test_loss: 1.9936, test_f1: 0.6320
##################ITERATION #4 ****************************************
 epoch: 0, train_loss: 1.2712, test_loss: 1.4048, test_f1: 0.2595
 epoch: 1, train_loss: 0.9853, test_loss: 1.0524, test_f1: 0.5375
 epoch: 2, train_loss: 0.9305, test_loss: 1.0376, test_f1: 0.5675
 epoch: 3, train_loss: 0.9124, test_loss: 1.0098, test_f1: 0.5823
 epoch: 4, train_loss: 0.8936, test_loss: 0.9911, test_f1: 0.5947
 epoch: 5, train_loss: 0.8584, test_loss: 1.0115, test_f1: 0.5800
 epoch: 6, train_loss: 0.8423, test_loss: 1.0089, test_f1: 0.5435
 epoch: 7, train_loss: 0.8242, test_loss: 1.0068, test_f1: 0.5900
 epoch: 8, train_loss: 0.7813, test_loss: 1.0244, test_f1: 0.5303
 epoch: 9, train_loss: 0.7744, test_loss: 1.0433, test_f1: 0.5751
 epoch: 10, train_loss: 0.7738, test_loss: 1.0039, test_f1: 0.6375
 epoch: 11, train_loss: 0.7644, test_loss: 1.0565, test_f1: 0.6051
 epoch: 12, train_loss: 0.7510, test_loss: 1.0255, test_f1: 0.6061
 epoch: 13, train_loss: 0.7397, test_loss: 1.0899, test_f1: 0.5823
 epoch: 14, train_loss: 0.7333, test_loss: 1.0979, test_f1: 0.5082
 epoch: 15, train_loss: 0.7225, test_loss: 1.0721, test_f1: 0.6066
 epoch: 16, train_loss: 0.7012, test_loss: 1.1940, test_f1: 0.5788
 epoch: 17, train_loss: 0.6954, test_loss: 1.1349, test_f1: 0.5326
 epoch: 18, train_loss: 0.6751, test_loss: 1.1979, test_f1: 0.5596
 epoch: 19, train_loss: 0.6809, test_loss: 1.2149, test_f1: 0.5948
 epoch: 20, train_loss: 0.6630, test_loss: 1.1400, test_f1: 0.5593
 epoch: 21, train_loss: 0.6419, test_loss: 1.2036, test_f1: 0.6155
 epoch: 22, train_loss: 0.6442, test_loss: 1.2744, test_f1: 0.5619
 epoch: 23, train_loss: 0.6366, test_loss: 1.2419, test_f1: 0.5565
 epoch: 24, train_loss: 0.6212, test_loss: 1.2014, test_f1: 0.5231
 epoch: 25, train_loss: 0.6251, test_loss: 1.1680, test_f1: 0.6263
 epoch: 26, train_loss: 0.6386, test_loss: 1.1377, test_f1: 0.6618
 epoch: 27, train_loss: 0.6092, test_loss: 1.2787, test_f1: 0.5330
 epoch: 28, train_loss: 0.5681, test_loss: 1.2026, test_f1: 0.5788
 epoch: 29, train_loss: 0.5906, test_loss: 1.5298, test_f1: 0.5090
 epoch: 30, train_loss: 0.5612, test_loss: 1.4963, test_f1: 0.5783
 epoch: 31, train_loss: 0.5773, test_loss: 1.4698, test_f1: 0.5574
 epoch: 32, train_loss: 0.5847, test_loss: 1.3305, test_f1: 0.6234
 epoch: 33, train_loss: 0.5345, test_loss: 1.4111, test_f1: 0.5685
 epoch: 34, train_loss: 0.5193, test_loss: 1.5387, test_f1: 0.5750
 epoch: 35, train_loss: 0.5283, test_loss: 1.4858, test_f1: 0.5906
 epoch: 36, train_loss: 0.4868, test_loss: 1.3763, test_f1: 0.5284
 epoch: 37, train_loss: 0.4944, test_loss: 1.4185, test_f1: 0.5837
 epoch: 38, train_loss: 0.4877, test_loss: 1.3047, test_f1: 0.6266
 epoch: 39, train_loss: 0.4969, test_loss: 1.7896, test_f1: 0.5955
 epoch: 40, train_loss: 0.5003, test_loss: 1.6007, test_f1: 0.5919
 epoch: 41, train_loss: 0.4863, test_loss: 1.4709, test_f1: 0.5341
 epoch: 42, train_loss: 0.4885, test_loss: 1.4986, test_f1: 0.6435
 epoch: 43, train_loss: 0.4861, test_loss: 1.4858, test_f1: 0.5662
 epoch: 44, train_loss: 0.4821, test_loss: 1.8286, test_f1: 0.5718
 epoch: 45, train_loss: 0.4468, test_loss: 1.6840, test_f1: 0.5877
 epoch: 46, train_loss: 0.4662, test_loss: 1.8572, test_f1: 0.5523
 epoch: 47, train_loss: 0.4669, test_loss: 1.8484, test_f1: 0.5650
 epoch: 48, train_loss: 0.4543, test_loss: 1.8237, test_f1: 0.5714
 epoch: 49, train_loss: 0.4410, test_loss: 1.7936, test_f1: 0.5803
 epoch: 50, train_loss: 0.4510, test_loss: 1.6596, test_f1: 0.5818
 epoch: 51, train_loss: 0.4359, test_loss: 1.4952, test_f1: 0.6017
 epoch: 52, train_loss: 0.3827, test_loss: 1.7056, test_f1: 0.5952
 epoch: 53, train_loss: 0.3728, test_loss: 1.8350, test_f1: 0.5939
 epoch: 54, train_loss: 0.3601, test_loss: 1.8395, test_f1: 0.5811
 epoch: 55, train_loss: 0.3656, test_loss: 1.8215, test_f1: 0.5285
 epoch: 56, train_loss: 0.3855, test_loss: 1.9808, test_f1: 0.5641
 epoch: 57, train_loss: 0.3846, test_loss: 1.8482, test_f1: 0.5621
 epoch: 58, train_loss: 0.3630, test_loss: 1.8128, test_f1: 0.5739
 epoch: 59, train_loss: 0.3612, test_loss: 1.8290, test_f1: 0.5779
 epoch: 60, train_loss: 0.3641, test_loss: 1.9136, test_f1: 0.5891
 epoch: 61, train_loss: 0.3487, test_loss: 1.7707, test_f1: 0.6007
 epoch: 62, train_loss: 0.3495, test_loss: 1.8633, test_f1: 0.5902
 epoch: 63, train_loss: 0.3398, test_loss: 1.8765, test_f1: 0.5950
 epoch: 64, train_loss: 0.3478, test_loss: 1.8417, test_f1: 0.5827
 epoch: 65, train_loss: 0.3445, test_loss: 1.8042, test_f1: 0.5969
 epoch: 66, train_loss: 0.3343, test_loss: 1.9221, test_f1: 0.6273
 epoch: 67, train_loss: 0.3250, test_loss: 1.9599, test_f1: 0.6189
 epoch: 68, train_loss: 0.3458, test_loss: 1.9462, test_f1: 0.6075
 epoch: 69, train_loss: 0.3349, test_loss: 2.0385, test_f1: 0.5796
 epoch: 70, train_loss: 0.3248, test_loss: 1.9481, test_f1: 0.6176
 epoch: 71, train_loss: 0.3105, test_loss: 1.9707, test_f1: 0.6152
 epoch: 72, train_loss: 0.3128, test_loss: 2.0240, test_f1: 0.5919
 epoch: 73, train_loss: 0.3155, test_loss: 2.0841, test_f1: 0.6041
 epoch: 74, train_loss: 0.3093, test_loss: 2.2086, test_f1: 0.5963
 epoch: 75, train_loss: 0.3149, test_loss: 2.3098, test_f1: 0.5902
 epoch: 76, train_loss: 0.3223, test_loss: 2.1652, test_f1: 0.5916
 epoch: 77, train_loss: 0.2855, test_loss: 2.2411, test_f1: 0.5963
 epoch: 78, train_loss: 0.2860, test_loss: 2.1964, test_f1: 0.6037
 epoch: 79, train_loss: 0.2877, test_loss: 2.2571, test_f1: 0.5798
 epoch: 80, train_loss: 0.3142, test_loss: 2.4980, test_f1: 0.5827
 epoch: 81, train_loss: 0.3072, test_loss: 2.3681, test_f1: 0.5880
 epoch: 82, train_loss: 0.2832, test_loss: 2.2518, test_f1: 0.5918
 epoch: 83, train_loss: 0.2821, test_loss: 2.1236, test_f1: 0.5908
 epoch: 84, train_loss: 0.2785, test_loss: 2.1909, test_f1: 0.5995
 epoch: 85, train_loss: 0.2856, test_loss: 2.2035, test_f1: 0.5971
 epoch: 86, train_loss: 0.2592, test_loss: 2.2352, test_f1: 0.5852
 epoch: 87, train_loss: 0.2754, test_loss: 2.1568, test_f1: 0.6165
 epoch: 88, train_loss: 0.2801, test_loss: 2.2868, test_f1: 0.5729
 epoch: 89, train_loss: 0.2773, test_loss: 2.2768, test_f1: 0.5842
 epoch: 90, train_loss: 0.2597, test_loss: 2.4035, test_f1: 0.5829
 epoch: 91, train_loss: 0.2680, test_loss: 2.3613, test_f1: 0.5793
 epoch: 92, train_loss: 0.2644, test_loss: 2.5040, test_f1: 0.5918
 epoch: 93, train_loss: 0.2793, test_loss: 2.2775, test_f1: 0.5903
 epoch: 94, train_loss: 0.2488, test_loss: 2.5448, test_f1: 0.5573
 epoch: 95, train_loss: 0.2623, test_loss: 2.4235, test_f1: 0.5844
 epoch: 96, train_loss: 0.2280, test_loss: 2.4189, test_f1: 0.5621
 epoch: 97, train_loss: 0.2537, test_loss: 2.5569, test_f1: 0.5625
 epoch: 98, train_loss: 0.2177, test_loss: 2.5319, test_f1: 0.5922
 epoch: 99, train_loss: 0.2383, test_loss: 2.6882, test_f1: 0.5861
##################ITERATION #5 ****************************************
 epoch: 0, train_loss: 1.2917, test_loss: 1.3137, test_f1: 0.2478
 epoch: 1, train_loss: 1.0054, test_loss: 1.0473, test_f1: 0.5167
 epoch: 2, train_loss: 0.9654, test_loss: 1.0342, test_f1: 0.5827
 epoch: 3, train_loss: 0.9038, test_loss: 1.0126, test_f1: 0.5264
 epoch: 4, train_loss: 0.8823, test_loss: 0.9941, test_f1: 0.6102
 epoch: 5, train_loss: 0.8667, test_loss: 0.9960, test_f1: 0.5819
 epoch: 6, train_loss: 0.8416, test_loss: 1.0073, test_f1: 0.5657
 epoch: 7, train_loss: 0.8412, test_loss: 1.0008, test_f1: 0.5295
 epoch: 8, train_loss: 0.8006, test_loss: 1.0238, test_f1: 0.5755
 epoch: 9, train_loss: 0.7937, test_loss: 0.9937, test_f1: 0.5819
 epoch: 10, train_loss: 0.7639, test_loss: 1.0766, test_f1: 0.5346
 epoch: 11, train_loss: 0.7537, test_loss: 1.0126, test_f1: 0.6327
 epoch: 12, train_loss: 0.7415, test_loss: 1.0681, test_f1: 0.5208
 epoch: 13, train_loss: 0.7275, test_loss: 1.0398, test_f1: 0.6134
 epoch: 14, train_loss: 0.7010, test_loss: 1.0922, test_f1: 0.5736
 epoch: 15, train_loss: 0.7145, test_loss: 1.1228, test_f1: 0.5726
 epoch: 16, train_loss: 0.6965, test_loss: 1.1038, test_f1: 0.5762
 epoch: 17, train_loss: 0.6898, test_loss: 1.0941, test_f1: 0.5432
 epoch: 18, train_loss: 0.6621, test_loss: 1.0752, test_f1: 0.5828
 epoch: 19, train_loss: 0.6700, test_loss: 1.0643, test_f1: 0.6254
 epoch: 20, train_loss: 0.6322, test_loss: 1.2219, test_f1: 0.5832
 epoch: 21, train_loss: 0.6329, test_loss: 1.1643, test_f1: 0.6264
 epoch: 22, train_loss: 0.6325, test_loss: 1.1100, test_f1: 0.6729
 epoch: 23, train_loss: 0.6158, test_loss: 1.1761, test_f1: 0.5113
 epoch: 24, train_loss: 0.6097, test_loss: 1.1771, test_f1: 0.5889
 epoch: 25, train_loss: 0.5905, test_loss: 1.2112, test_f1: 0.5887
 epoch: 26, train_loss: 0.5668, test_loss: 1.1863, test_f1: 0.6041
 epoch: 27, train_loss: 0.5737, test_loss: 1.3557, test_f1: 0.4685
 epoch: 28, train_loss: 0.5845, test_loss: 1.1669, test_f1: 0.6101
 epoch: 29, train_loss: 0.5756, test_loss: 1.1719, test_f1: 0.6092
 epoch: 30, train_loss: 0.5458, test_loss: 1.2970, test_f1: 0.5790
 epoch: 31, train_loss: 0.5553, test_loss: 1.2915, test_f1: 0.6183
 epoch: 32, train_loss: 0.5486, test_loss: 1.1381, test_f1: 0.5941
 epoch: 33, train_loss: 0.5586, test_loss: 1.3059, test_f1: 0.5839
 epoch: 34, train_loss: 0.5167, test_loss: 1.1848, test_f1: 0.5811
 epoch: 35, train_loss: 0.5858, test_loss: 1.4602, test_f1: 0.5171
 epoch: 36, train_loss: 0.5072, test_loss: 1.3657, test_f1: 0.5673
 epoch: 37, train_loss: 0.5484, test_loss: 1.2087, test_f1: 0.6088
 epoch: 38, train_loss: 0.5198, test_loss: 1.1511, test_f1: 0.6423
 epoch: 39, train_loss: 0.4958, test_loss: 1.2949, test_f1: 0.5944
 epoch: 40, train_loss: 0.5082, test_loss: 1.1986, test_f1: 0.6275
 epoch: 41, train_loss: 0.4893, test_loss: 1.3056, test_f1: 0.6060
 epoch: 42, train_loss: 0.4659, test_loss: 1.3139, test_f1: 0.6039
 epoch: 43, train_loss: 0.5182, test_loss: 1.3131, test_f1: 0.6040
 epoch: 44, train_loss: 0.4722, test_loss: 1.3171, test_f1: 0.6127
 epoch: 45, train_loss: 0.4625, test_loss: 1.2873, test_f1: 0.6147
 epoch: 46, train_loss: 0.4540, test_loss: 1.3420, test_f1: 0.6212
 epoch: 47, train_loss: 0.4341, test_loss: 1.4287, test_f1: 0.5641
 epoch: 48, train_loss: 0.4584, test_loss: 1.5388, test_f1: 0.5627
 epoch: 49, train_loss: 0.4454, test_loss: 1.3020, test_f1: 0.6669
 epoch: 50, train_loss: 0.4323, test_loss: 1.4453, test_f1: 0.5962
 epoch: 51, train_loss: 0.3992, test_loss: 1.5233, test_f1: 0.6008
 epoch: 52, train_loss: 0.3690, test_loss: 1.5052, test_f1: 0.5988
 epoch: 53, train_loss: 0.3684, test_loss: 1.4295, test_f1: 0.6135
 epoch: 54, train_loss: 0.3454, test_loss: 1.5474, test_f1: 0.6097
 epoch: 55, train_loss: 0.3467, test_loss: 1.5140, test_f1: 0.6277
 epoch: 56, train_loss: 0.3466, test_loss: 1.6508, test_f1: 0.6023
 epoch: 57, train_loss: 0.3285, test_loss: 1.5794, test_f1: 0.6237
 epoch: 58, train_loss: 0.3633, test_loss: 1.5661, test_f1: 0.6011
 epoch: 59, train_loss: 0.3389, test_loss: 1.6249, test_f1: 0.5897
 epoch: 60, train_loss: 0.3361, test_loss: 1.7418, test_f1: 0.5845
 epoch: 61, train_loss: 0.3470, test_loss: 1.6201, test_f1: 0.6019
 epoch: 62, train_loss: 0.3224, test_loss: 1.7298, test_f1: 0.5874
 epoch: 63, train_loss: 0.3208, test_loss: 1.6389, test_f1: 0.6118
 epoch: 64, train_loss: 0.3319, test_loss: 1.8396, test_f1: 0.5581
 epoch: 65, train_loss: 0.3039, test_loss: 1.6589, test_f1: 0.6261
 epoch: 66, train_loss: 0.3286, test_loss: 1.6782, test_f1: 0.6052
 epoch: 67, train_loss: 0.3246, test_loss: 1.7041, test_f1: 0.6328
 epoch: 68, train_loss: 0.3067, test_loss: 1.7950, test_f1: 0.5897
 epoch: 69, train_loss: 0.2959, test_loss: 1.7328, test_f1: 0.6079
 epoch: 70, train_loss: 0.3244, test_loss: 1.6940, test_f1: 0.5712
 epoch: 71, train_loss: 0.3192, test_loss: 1.7348, test_f1: 0.6033
 epoch: 72, train_loss: 0.3000, test_loss: 1.7343, test_f1: 0.6064
 epoch: 73, train_loss: 0.3163, test_loss: 1.7296, test_f1: 0.6016
 epoch: 74, train_loss: 0.3065, test_loss: 1.7805, test_f1: 0.6025
 epoch: 75, train_loss: 0.2961, test_loss: 1.8699, test_f1: 0.5813
 epoch: 76, train_loss: 0.2939, test_loss: 1.7258, test_f1: 0.6185
 epoch: 77, train_loss: 0.2868, test_loss: 1.7349, test_f1: 0.5880
 epoch: 78, train_loss: 0.2877, test_loss: 1.9384, test_f1: 0.5709
 epoch: 79, train_loss: 0.3126, test_loss: 1.8760, test_f1: 0.5918
 epoch: 80, train_loss: 0.2954, test_loss: 1.8249, test_f1: 0.5892
 epoch: 81, train_loss: 0.3056, test_loss: 2.1012, test_f1: 0.5870
 epoch: 82, train_loss: 0.2825, test_loss: 1.9180, test_f1: 0.5929
 epoch: 83, train_loss: 0.2925, test_loss: 1.9105, test_f1: 0.5913
 epoch: 84, train_loss: 0.2859, test_loss: 1.8138, test_f1: 0.6051
 epoch: 85, train_loss: 0.2745, test_loss: 1.9989, test_f1: 0.5873
 epoch: 86, train_loss: 0.2553, test_loss: 1.8924, test_f1: 0.6258
 epoch: 87, train_loss: 0.2777, test_loss: 1.9005, test_f1: 0.5971
 epoch: 88, train_loss: 0.2819, test_loss: 1.9656, test_f1: 0.5990
 epoch: 89, train_loss: 0.2545, test_loss: 1.9808, test_f1: 0.5996
 epoch: 90, train_loss: 0.2663, test_loss: 1.7965, test_f1: 0.5928
 epoch: 91, train_loss: 0.2886, test_loss: 2.0191, test_f1: 0.5791
 epoch: 92, train_loss: 0.2982, test_loss: 1.7853, test_f1: 0.6295
 epoch: 93, train_loss: 0.2405, test_loss: 1.8284, test_f1: 0.6041
 epoch: 94, train_loss: 0.2566, test_loss: 2.0242, test_f1: 0.5831
 epoch: 95, train_loss: 0.2567, test_loss: 2.0471, test_f1: 0.6103
 epoch: 96, train_loss: 0.3059, test_loss: 1.9045, test_f1: 0.6103
 epoch: 97, train_loss: 0.2893, test_loss: 2.0257, test_f1: 0.5886
 epoch: 98, train_loss: 0.2619, test_loss: 1.9878, test_f1: 0.5911
 epoch: 99, train_loss: 0.2572, test_loss: 2.0410, test_f1: 0.5934
##################ITERATION #6 ****************************************
 epoch: 0, train_loss: 1.3207, test_loss: 1.3103, test_f1: 0.2727
 epoch: 1, train_loss: 1.0529, test_loss: 1.0530, test_f1: 0.5207
 epoch: 2, train_loss: 0.9767, test_loss: 1.0521, test_f1: 0.6060
 epoch: 3, train_loss: 0.9291, test_loss: 1.0216, test_f1: 0.5808
 epoch: 4, train_loss: 0.8766, test_loss: 1.0227, test_f1: 0.5311
 epoch: 5, train_loss: 0.8825, test_loss: 1.0388, test_f1: 0.5722
 epoch: 6, train_loss: 0.8424, test_loss: 1.0343, test_f1: 0.5719
 epoch: 7, train_loss: 0.8017, test_loss: 1.0895, test_f1: 0.5401
 epoch: 8, train_loss: 0.7815, test_loss: 1.0685, test_f1: 0.5675
 epoch: 9, train_loss: 0.7997, test_loss: 1.0376, test_f1: 0.6100
 epoch: 10, train_loss: 0.7636, test_loss: 1.0848, test_f1: 0.5343
 epoch: 11, train_loss: 0.7396, test_loss: 1.0372, test_f1: 0.6216
 epoch: 12, train_loss: 0.7313, test_loss: 1.0989, test_f1: 0.5643
 epoch: 13, train_loss: 0.7393, test_loss: 1.0406, test_f1: 0.5657
 epoch: 14, train_loss: 0.7262, test_loss: 1.0281, test_f1: 0.5924
 epoch: 15, train_loss: 0.7034, test_loss: 1.0763, test_f1: 0.5728
 epoch: 16, train_loss: 0.6972, test_loss: 1.0495, test_f1: 0.5782
 epoch: 17, train_loss: 0.6905, test_loss: 1.1301, test_f1: 0.6051
 epoch: 18, train_loss: 0.6720, test_loss: 1.1120, test_f1: 0.5944
 epoch: 19, train_loss: 0.6529, test_loss: 1.1441, test_f1: 0.5834
 epoch: 20, train_loss: 0.6442, test_loss: 1.1916, test_f1: 0.5949
 epoch: 21, train_loss: 0.6373, test_loss: 1.3293, test_f1: 0.5857
 epoch: 22, train_loss: 0.6303, test_loss: 1.2874, test_f1: 0.5765
 epoch: 23, train_loss: 0.5951, test_loss: 1.1153, test_f1: 0.6216
 epoch: 24, train_loss: 0.6055, test_loss: 1.2564, test_f1: 0.5601
 epoch: 25, train_loss: 0.5857, test_loss: 1.1553, test_f1: 0.6223
 epoch: 26, train_loss: 0.5749, test_loss: 1.1846, test_f1: 0.6235
 epoch: 27, train_loss: 0.5716, test_loss: 1.5170, test_f1: 0.5445
 epoch: 28, train_loss: 0.5654, test_loss: 1.1733, test_f1: 0.6479
 epoch: 29, train_loss: 0.5523, test_loss: 1.3575, test_f1: 0.6173
 epoch: 30, train_loss: 0.5712, test_loss: 1.2455, test_f1: 0.5871
 epoch: 31, train_loss: 0.5501, test_loss: 1.3615, test_f1: 0.5828
 epoch: 32, train_loss: 0.5790, test_loss: 1.3205, test_f1: 0.5781
 epoch: 33, train_loss: 0.5549, test_loss: 1.3718, test_f1: 0.6074
 epoch: 34, train_loss: 0.5257, test_loss: 1.5392, test_f1: 0.5478
 epoch: 35, train_loss: 0.5127, test_loss: 1.1930, test_f1: 0.6594
 epoch: 36, train_loss: 0.5222, test_loss: 1.4685, test_f1: 0.5828
 epoch: 37, train_loss: 0.5094, test_loss: 1.4377, test_f1: 0.6325
 epoch: 38, train_loss: 0.4821, test_loss: 1.4873, test_f1: 0.6037
 epoch: 39, train_loss: 0.5008, test_loss: 1.3646, test_f1: 0.6281
 epoch: 40, train_loss: 0.5005, test_loss: 1.3596, test_f1: 0.6016
 epoch: 41, train_loss: 0.4677, test_loss: 1.5528, test_f1: 0.5883
 epoch: 42, train_loss: 0.4886, test_loss: 1.5804, test_f1: 0.6021
 epoch: 43, train_loss: 0.4324, test_loss: 1.5757, test_f1: 0.5867
 epoch: 44, train_loss: 0.4704, test_loss: 1.4672, test_f1: 0.5935
 epoch: 45, train_loss: 0.4599, test_loss: 1.3819, test_f1: 0.6146
 epoch: 46, train_loss: 0.4130, test_loss: 1.4454, test_f1: 0.5887
 epoch: 47, train_loss: 0.4432, test_loss: 1.5583, test_f1: 0.5884
 epoch: 48, train_loss: 0.4377, test_loss: 1.6552, test_f1: 0.5630
 epoch: 49, train_loss: 0.4377, test_loss: 1.5604, test_f1: 0.5850
 epoch: 50, train_loss: 0.4327, test_loss: 1.4808, test_f1: 0.6014
 epoch: 51, train_loss: 0.3897, test_loss: 1.4419, test_f1: 0.6188
 epoch: 52, train_loss: 0.3703, test_loss: 1.5172, test_f1: 0.6129
 epoch: 53, train_loss: 0.3838, test_loss: 1.5786, test_f1: 0.5992
 epoch: 54, train_loss: 0.3456, test_loss: 1.5823, test_f1: 0.6043
 epoch: 55, train_loss: 0.3475, test_loss: 1.6203, test_f1: 0.5857
 epoch: 56, train_loss: 0.3514, test_loss: 1.6791, test_f1: 0.6142
 epoch: 57, train_loss: 0.3501, test_loss: 1.7277, test_f1: 0.6096
 epoch: 58, train_loss: 0.3550, test_loss: 1.9572, test_f1: 0.6036
 epoch: 59, train_loss: 0.3644, test_loss: 1.7936, test_f1: 0.6188
 epoch: 60, train_loss: 0.3452, test_loss: 1.7992, test_f1: 0.6141
 epoch: 61, train_loss: 0.3276, test_loss: 1.7498, test_f1: 0.6324
 epoch: 62, train_loss: 0.3422, test_loss: 1.9505, test_f1: 0.6195
 epoch: 63, train_loss: 0.3474, test_loss: 1.7725, test_f1: 0.6089
 epoch: 64, train_loss: 0.3381, test_loss: 1.9239, test_f1: 0.6142
 epoch: 65, train_loss: 0.3297, test_loss: 1.8776, test_f1: 0.6233
 epoch: 66, train_loss: 0.3111, test_loss: 1.7288, test_f1: 0.6250
 epoch: 67, train_loss: 0.3471, test_loss: 1.9607, test_f1: 0.6039
 epoch: 68, train_loss: 0.3231, test_loss: 1.6813, test_f1: 0.6088
 epoch: 69, train_loss: 0.3239, test_loss: 1.8952, test_f1: 0.5994
 epoch: 70, train_loss: 0.2967, test_loss: 1.8641, test_f1: 0.6057
 epoch: 71, train_loss: 0.2911, test_loss: 1.9766, test_f1: 0.5885
 epoch: 72, train_loss: 0.2961, test_loss: 1.9735, test_f1: 0.5905
 epoch: 73, train_loss: 0.3143, test_loss: 2.0842, test_f1: 0.5840
 epoch: 74, train_loss: 0.2916, test_loss: 2.0269, test_f1: 0.5965
 epoch: 75, train_loss: 0.2919, test_loss: 2.4878, test_f1: 0.6001
 epoch: 76, train_loss: 0.2893, test_loss: 2.1233, test_f1: 0.6021
 epoch: 77, train_loss: 0.2930, test_loss: 2.0297, test_f1: 0.6123
 epoch: 78, train_loss: 0.3207, test_loss: 2.0246, test_f1: 0.5908
 epoch: 79, train_loss: 0.2969, test_loss: 2.1555, test_f1: 0.6030
 epoch: 80, train_loss: 0.3162, test_loss: 2.1152, test_f1: 0.6186
 epoch: 81, train_loss: 0.2898, test_loss: 2.1312, test_f1: 0.5999
 epoch: 82, train_loss: 0.2954, test_loss: 2.0384, test_f1: 0.6071
 epoch: 83, train_loss: 0.2817, test_loss: 2.1578, test_f1: 0.5991
 epoch: 84, train_loss: 0.2945, test_loss: 1.8761, test_f1: 0.6164
 epoch: 85, train_loss: 0.3028, test_loss: 2.0318, test_f1: 0.6168
 epoch: 86, train_loss: 0.2728, test_loss: 2.1580, test_f1: 0.5989
 epoch: 87, train_loss: 0.2780, test_loss: 2.2892, test_f1: 0.5944
 epoch: 88, train_loss: 0.2841, test_loss: 2.0157, test_f1: 0.5913
 epoch: 89, train_loss: 0.2681, test_loss: 2.1587, test_f1: 0.6133
 epoch: 90, train_loss: 0.2718, test_loss: 2.1258, test_f1: 0.5915
 epoch: 91, train_loss: 0.2517, test_loss: 2.2026, test_f1: 0.5969
 epoch: 92, train_loss: 0.2473, test_loss: 2.1513, test_f1: 0.6096
 epoch: 93, train_loss: 0.2393, test_loss: 2.2269, test_f1: 0.6017
 epoch: 94, train_loss: 0.2644, test_loss: 2.2066, test_f1: 0.5900
 epoch: 95, train_loss: 0.2670, test_loss: 2.3573, test_f1: 0.5894
 epoch: 96, train_loss: 0.2495, test_loss: 2.3018, test_f1: 0.5724
 epoch: 97, train_loss: 0.2586, test_loss: 2.3338, test_f1: 0.5949
 epoch: 98, train_loss: 0.2721, test_loss: 2.2052, test_f1: 0.6000
 epoch: 99, train_loss: 0.2435, test_loss: 2.2681, test_f1: 0.5933
##################ITERATION #7 ****************************************
 epoch: 0, train_loss: 1.5114, test_loss: 1.5168, test_f1: 0.3223
 epoch: 1, train_loss: 1.0970, test_loss: 1.0781, test_f1: 0.5108
 epoch: 2, train_loss: 0.9721, test_loss: 1.0453, test_f1: 0.5503
 epoch: 3, train_loss: 0.9250, test_loss: 1.0161, test_f1: 0.5198
 epoch: 4, train_loss: 0.8954, test_loss: 1.0229, test_f1: 0.5531
 epoch: 5, train_loss: 0.8559, test_loss: 1.0402, test_f1: 0.5756
 epoch: 6, train_loss: 0.8358, test_loss: 1.0600, test_f1: 0.5785
 epoch: 7, train_loss: 0.8043, test_loss: 1.1358, test_f1: 0.5505
 epoch: 8, train_loss: 0.7990, test_loss: 1.0655, test_f1: 0.6113
 epoch: 9, train_loss: 0.7727, test_loss: 1.1081, test_f1: 0.5194
 epoch: 10, train_loss: 0.7622, test_loss: 1.0704, test_f1: 0.6351
 epoch: 11, train_loss: 0.7420, test_loss: 1.0595, test_f1: 0.5324
 epoch: 12, train_loss: 0.7263, test_loss: 1.1224, test_f1: 0.5865
 epoch: 13, train_loss: 0.7106, test_loss: 1.1038, test_f1: 0.5549
 epoch: 14, train_loss: 0.6907, test_loss: 1.1040, test_f1: 0.5763
 epoch: 15, train_loss: 0.6839, test_loss: 1.3045, test_f1: 0.5287
 epoch: 16, train_loss: 0.6830, test_loss: 1.1063, test_f1: 0.5759
 epoch: 17, train_loss: 0.6401, test_loss: 1.1869, test_f1: 0.5863
 epoch: 18, train_loss: 0.6532, test_loss: 1.0795, test_f1: 0.6291
 epoch: 19, train_loss: 0.6458, test_loss: 1.1014, test_f1: 0.6066
 epoch: 20, train_loss: 0.6359, test_loss: 1.0845, test_f1: 0.6069
 epoch: 21, train_loss: 0.6538, test_loss: 1.2560, test_f1: 0.5831
 epoch: 22, train_loss: 0.6356, test_loss: 1.2971, test_f1: 0.5727
 epoch: 23, train_loss: 0.5934, test_loss: 1.1458, test_f1: 0.5656
 epoch: 24, train_loss: 0.6100, test_loss: 1.2200, test_f1: 0.5892
 epoch: 25, train_loss: 0.5985, test_loss: 1.2001, test_f1: 0.6226
 epoch: 26, train_loss: 0.5877, test_loss: 1.3515, test_f1: 0.6167
 epoch: 27, train_loss: 0.5830, test_loss: 1.4131, test_f1: 0.5790
 epoch: 28, train_loss: 0.5937, test_loss: 1.3937, test_f1: 0.6006
 epoch: 29, train_loss: 0.5940, test_loss: 1.4298, test_f1: 0.5670
 epoch: 30, train_loss: 0.5747, test_loss: 1.4532, test_f1: 0.5400
 epoch: 31, train_loss: 0.5376, test_loss: 1.5291, test_f1: 0.5880
 epoch: 32, train_loss: 0.5674, test_loss: 1.6259, test_f1: 0.6193
 epoch: 33, train_loss: 0.5304, test_loss: 1.6532, test_f1: 0.5966
 epoch: 34, train_loss: 0.5332, test_loss: 1.6013, test_f1: 0.5881
 epoch: 35, train_loss: 0.5304, test_loss: 1.5080, test_f1: 0.5604
 epoch: 36, train_loss: 0.5059, test_loss: 1.6038, test_f1: 0.5944
 epoch: 37, train_loss: 0.5444, test_loss: 1.6275, test_f1: 0.5626
 epoch: 38, train_loss: 0.5381, test_loss: 1.7531, test_f1: 0.5330
 epoch: 39, train_loss: 0.4858, test_loss: 1.4790, test_f1: 0.5927
 epoch: 40, train_loss: 0.4960, test_loss: 1.4790, test_f1: 0.5800
 epoch: 41, train_loss: 0.4740, test_loss: 1.4733, test_f1: 0.5797
 epoch: 42, train_loss: 0.4802, test_loss: 1.9121, test_f1: 0.5226
 epoch: 43, train_loss: 0.4939, test_loss: 1.5553, test_f1: 0.5874
 epoch: 44, train_loss: 0.4499, test_loss: 1.8091, test_f1: 0.5740
 epoch: 45, train_loss: 0.4707, test_loss: 1.6481, test_f1: 0.5904
 epoch: 46, train_loss: 0.4817, test_loss: 1.9911, test_f1: 0.5910
 epoch: 47, train_loss: 0.4557, test_loss: 2.0899, test_f1: 0.5695
 epoch: 48, train_loss: 0.4595, test_loss: 1.5035, test_f1: 0.6164
 epoch: 49, train_loss: 0.4445, test_loss: 1.7937, test_f1: 0.5991
 epoch: 50, train_loss: 0.4321, test_loss: 2.1177, test_f1: 0.5556
 epoch: 51, train_loss: 0.4093, test_loss: 1.7328, test_f1: 0.5952
 epoch: 52, train_loss: 0.3718, test_loss: 1.9546, test_f1: 0.5900
 epoch: 53, train_loss: 0.3873, test_loss: 1.8175, test_f1: 0.5903
 epoch: 54, train_loss: 0.3695, test_loss: 1.8894, test_f1: 0.5965
 epoch: 55, train_loss: 0.3567, test_loss: 1.9177, test_f1: 0.5798
 epoch: 56, train_loss: 0.3575, test_loss: 1.9992, test_f1: 0.5765
 epoch: 57, train_loss: 0.3501, test_loss: 2.1475, test_f1: 0.6041
 epoch: 58, train_loss: 0.3473, test_loss: 2.0715, test_f1: 0.5949
 epoch: 59, train_loss: 0.3297, test_loss: 1.9749, test_f1: 0.6044
 epoch: 60, train_loss: 0.3553, test_loss: 2.1787, test_f1: 0.5910
 epoch: 61, train_loss: 0.3313, test_loss: 2.0782, test_f1: 0.5852
 epoch: 62, train_loss: 0.3387, test_loss: 2.0412, test_f1: 0.5629
 epoch: 63, train_loss: 0.3483, test_loss: 1.9957, test_f1: 0.5854
 epoch: 64, train_loss: 0.3143, test_loss: 2.2916, test_f1: 0.5988
 epoch: 65, train_loss: 0.3771, test_loss: 2.1110, test_f1: 0.5785
 epoch: 66, train_loss: 0.3145, test_loss: 1.9423, test_f1: 0.5864
 epoch: 67, train_loss: 0.3308, test_loss: 1.9672, test_f1: 0.5861
 epoch: 68, train_loss: 0.3262, test_loss: 2.0774, test_f1: 0.5706
 epoch: 69, train_loss: 0.2971, test_loss: 2.0666, test_f1: 0.5842
 epoch: 70, train_loss: 0.3251, test_loss: 2.1841, test_f1: 0.5799
 epoch: 71, train_loss: 0.3252, test_loss: 2.1926, test_f1: 0.5946
 epoch: 72, train_loss: 0.3140, test_loss: 2.0424, test_f1: 0.5838
 epoch: 73, train_loss: 0.3010, test_loss: 2.2346, test_f1: 0.5893
 epoch: 74, train_loss: 0.3100, test_loss: 2.0342, test_f1: 0.5864
 epoch: 75, train_loss: 0.2715, test_loss: 2.3815, test_f1: 0.5982
 epoch: 76, train_loss: 0.2955, test_loss: 2.2129, test_f1: 0.5573
 epoch: 77, train_loss: 0.3040, test_loss: 2.2918, test_f1: 0.5694
 epoch: 78, train_loss: 0.3150, test_loss: 2.1112, test_f1: 0.5794
 epoch: 79, train_loss: 0.2900, test_loss: 2.2604, test_f1: 0.6094
 epoch: 80, train_loss: 0.2851, test_loss: 2.2310, test_f1: 0.5818
 epoch: 81, train_loss: 0.2883, test_loss: 2.3390, test_f1: 0.5904
 epoch: 82, train_loss: 0.2858, test_loss: 2.2495, test_f1: 0.5966
 epoch: 83, train_loss: 0.2955, test_loss: 2.2773, test_f1: 0.5839
 epoch: 84, train_loss: 0.2847, test_loss: 2.3078, test_f1: 0.5909
 epoch: 85, train_loss: 0.2649, test_loss: 2.1331, test_f1: 0.6126
 epoch: 86, train_loss: 0.2864, test_loss: 2.3612, test_f1: 0.5629
 epoch: 87, train_loss: 0.2408, test_loss: 2.5514, test_f1: 0.6086
 epoch: 88, train_loss: 0.2713, test_loss: 2.3974, test_f1: 0.5772
 epoch: 89, train_loss: 0.2970, test_loss: 2.4211, test_f1: 0.5960
 epoch: 90, train_loss: 0.2759, test_loss: 2.4386, test_f1: 0.5653
 epoch: 91, train_loss: 0.2700, test_loss: 2.5147, test_f1: 0.5952
 epoch: 92, train_loss: 0.2491, test_loss: 2.3805, test_f1: 0.6234
 epoch: 93, train_loss: 0.2651, test_loss: 2.7097, test_f1: 0.5784
 epoch: 94, train_loss: 0.2956, test_loss: 2.5003, test_f1: 0.5781
 epoch: 95, train_loss: 0.2605, test_loss: 2.3985, test_f1: 0.5914
 epoch: 96, train_loss: 0.2722, test_loss: 2.6039, test_f1: 0.5720
 epoch: 97, train_loss: 0.2560, test_loss: 2.4044, test_f1: 0.5974
 epoch: 98, train_loss: 0.2467, test_loss: 2.6278, test_f1: 0.5394
 epoch: 99, train_loss: 0.2318, test_loss: 2.6549, test_f1: 0.5670
##################ITERATION #8 ****************************************
 epoch: 0, train_loss: 1.6368, test_loss: 1.2064, test_f1: 0.3589
 epoch: 1, train_loss: 1.0412, test_loss: 1.1617, test_f1: 0.4761
 epoch: 2, train_loss: 0.9889, test_loss: 1.1083, test_f1: 0.5490
 epoch: 3, train_loss: 0.9099, test_loss: 1.1373, test_f1: 0.4949
 epoch: 4, train_loss: 0.8853, test_loss: 1.1533, test_f1: 0.4979
 epoch: 5, train_loss: 0.8294, test_loss: 1.2317, test_f1: 0.5026
 epoch: 6, train_loss: 0.8183, test_loss: 1.1808, test_f1: 0.4891
 epoch: 7, train_loss: 0.8242, test_loss: 1.1650, test_f1: 0.5415
 epoch: 8, train_loss: 0.7868, test_loss: 1.1283, test_f1: 0.5347
 epoch: 9, train_loss: 0.7842, test_loss: 1.1662, test_f1: 0.5182
 epoch: 10, train_loss: 0.7535, test_loss: 1.3710, test_f1: 0.5301
 epoch: 11, train_loss: 0.7387, test_loss: 1.1802, test_f1: 0.5189
 epoch: 12, train_loss: 0.7358, test_loss: 1.1778, test_f1: 0.5432
 epoch: 13, train_loss: 0.7239, test_loss: 1.2886, test_f1: 0.4936
 epoch: 14, train_loss: 0.6925, test_loss: 1.2606, test_f1: 0.5619
 epoch: 15, train_loss: 0.6826, test_loss: 1.2913, test_f1: 0.5746
 epoch: 16, train_loss: 0.6835, test_loss: 1.3602, test_f1: 0.5600
 epoch: 17, train_loss: 0.6840, test_loss: 1.3038, test_f1: 0.5363
 epoch: 18, train_loss: 0.6643, test_loss: 1.3675, test_f1: 0.5254
 epoch: 19, train_loss: 0.6784, test_loss: 1.6348, test_f1: 0.5214
 epoch: 20, train_loss: 0.6552, test_loss: 1.4126, test_f1: 0.5991
 epoch: 21, train_loss: 0.6475, test_loss: 1.5668, test_f1: 0.5771
 epoch: 22, train_loss: 0.6262, test_loss: 1.2563, test_f1: 0.5733
 epoch: 23, train_loss: 0.6134, test_loss: 1.4105, test_f1: 0.5263
 epoch: 24, train_loss: 0.6058, test_loss: 1.4077, test_f1: 0.5475
 epoch: 25, train_loss: 0.5951, test_loss: 1.2718, test_f1: 0.5717
 epoch: 26, train_loss: 0.5941, test_loss: 1.5003, test_f1: 0.5322
 epoch: 27, train_loss: 0.5938, test_loss: 1.4792, test_f1: 0.5876
 epoch: 28, train_loss: 0.5872, test_loss: 1.5775, test_f1: 0.5754
 epoch: 29, train_loss: 0.5808, test_loss: 1.4989, test_f1: 0.5378
 epoch: 30, train_loss: 0.5408, test_loss: 1.5077, test_f1: 0.5748
 epoch: 31, train_loss: 0.5542, test_loss: 1.7896, test_f1: 0.5606
 epoch: 32, train_loss: 0.5641, test_loss: 1.6570, test_f1: 0.5280
 epoch: 33, train_loss: 0.5688, test_loss: 1.6306, test_f1: 0.5867
 epoch: 34, train_loss: 0.5280, test_loss: 1.4050, test_f1: 0.5720
 epoch: 35, train_loss: 0.5367, test_loss: 1.8066, test_f1: 0.5997
 epoch: 36, train_loss: 0.5206, test_loss: 1.3628, test_f1: 0.5659
 epoch: 37, train_loss: 0.5122, test_loss: 1.6620, test_f1: 0.5678
 epoch: 38, train_loss: 0.5126, test_loss: 1.4174, test_f1: 0.5962
 epoch: 39, train_loss: 0.5212, test_loss: 1.4273, test_f1: 0.5868
 epoch: 40, train_loss: 0.5055, test_loss: 1.6997, test_f1: 0.5207
 epoch: 41, train_loss: 0.4868, test_loss: 1.9222, test_f1: 0.5011
 epoch: 42, train_loss: 0.5237, test_loss: 1.5450, test_f1: 0.5709
 epoch: 43, train_loss: 0.4927, test_loss: 1.6153, test_f1: 0.5349
 epoch: 44, train_loss: 0.4710, test_loss: 1.5927, test_f1: 0.5876
 epoch: 45, train_loss: 0.4803, test_loss: 1.9577, test_f1: 0.5561
 epoch: 46, train_loss: 0.4827, test_loss: 1.7838, test_f1: 0.6016
 epoch: 47, train_loss: 0.4657, test_loss: 1.8727, test_f1: 0.5870
 epoch: 48, train_loss: 0.4777, test_loss: 1.8581, test_f1: 0.5886
 epoch: 49, train_loss: 0.4760, test_loss: 1.7619, test_f1: 0.5979
 epoch: 50, train_loss: 0.4174, test_loss: 1.8691, test_f1: 0.5595
 epoch: 51, train_loss: 0.4140, test_loss: 1.8196, test_f1: 0.5861
 epoch: 52, train_loss: 0.4015, test_loss: 1.8859, test_f1: 0.5981
 epoch: 53, train_loss: 0.4175, test_loss: 1.7813, test_f1: 0.5716
 epoch: 54, train_loss: 0.3850, test_loss: 1.7796, test_f1: 0.5934
 epoch: 55, train_loss: 0.3449, test_loss: 1.8439, test_f1: 0.6025
 epoch: 56, train_loss: 0.3626, test_loss: 1.8867, test_f1: 0.5854
 epoch: 57, train_loss: 0.3858, test_loss: 1.8464, test_f1: 0.5858
 epoch: 58, train_loss: 0.3656, test_loss: 1.9933, test_f1: 0.5775
 epoch: 59, train_loss: 0.3548, test_loss: 2.1047, test_f1: 0.5515
 epoch: 60, train_loss: 0.3619, test_loss: 1.9399, test_f1: 0.5842
 epoch: 61, train_loss: 0.3387, test_loss: 1.9688, test_f1: 0.5597
 epoch: 62, train_loss: 0.3570, test_loss: 2.2657, test_f1: 0.5841
 epoch: 63, train_loss: 0.3337, test_loss: 1.9402, test_f1: 0.5808
 epoch: 64, train_loss: 0.3415, test_loss: 2.1376, test_f1: 0.5605
 epoch: 65, train_loss: 0.3251, test_loss: 1.9869, test_f1: 0.5542
 epoch: 66, train_loss: 0.3327, test_loss: 2.2295, test_f1: 0.5809
 epoch: 67, train_loss: 0.3145, test_loss: 2.0001, test_f1: 0.5827
 epoch: 68, train_loss: 0.3457, test_loss: 2.2251, test_f1: 0.5780
 epoch: 69, train_loss: 0.3291, test_loss: 2.2713, test_f1: 0.5975
 epoch: 70, train_loss: 0.3187, test_loss: 2.1071, test_f1: 0.5841
 epoch: 71, train_loss: 0.3078, test_loss: 2.2297, test_f1: 0.5645
 epoch: 72, train_loss: 0.2959, test_loss: 2.1451, test_f1: 0.5571
 epoch: 73, train_loss: 0.2810, test_loss: 1.9095, test_f1: 0.6143
 epoch: 74, train_loss: 0.3093, test_loss: 2.4257, test_f1: 0.5692
 epoch: 75, train_loss: 0.2914, test_loss: 2.3893, test_f1: 0.5826
 epoch: 76, train_loss: 0.3048, test_loss: 2.3048, test_f1: 0.6041
 epoch: 77, train_loss: 0.3118, test_loss: 2.1913, test_f1: 0.5771
 epoch: 78, train_loss: 0.2674, test_loss: 2.3791, test_f1: 0.5983
 epoch: 79, train_loss: 0.2994, test_loss: 2.4531, test_f1: 0.5872
 epoch: 80, train_loss: 0.3128, test_loss: 2.3532, test_f1: 0.5762
 epoch: 81, train_loss: 0.2841, test_loss: 2.3367, test_f1: 0.6138
 epoch: 82, train_loss: 0.3054, test_loss: 2.6314, test_f1: 0.5662
 epoch: 83, train_loss: 0.2955, test_loss: 2.1197, test_f1: 0.5842
 epoch: 84, train_loss: 0.3127, test_loss: 2.2940, test_f1: 0.6009
 epoch: 85, train_loss: 0.2777, test_loss: 2.2917, test_f1: 0.5762
 epoch: 86, train_loss: 0.2848, test_loss: 2.3997, test_f1: 0.5923
 epoch: 87, train_loss: 0.2784, test_loss: 2.4530, test_f1: 0.6057
 epoch: 88, train_loss: 0.2634, test_loss: 2.3967, test_f1: 0.6033
 epoch: 89, train_loss: 0.2789, test_loss: 2.4546, test_f1: 0.5900
 epoch: 90, train_loss: 0.2893, test_loss: 2.3286, test_f1: 0.5731
 epoch: 91, train_loss: 0.3080, test_loss: 2.3859, test_f1: 0.5915
 epoch: 92, train_loss: 0.2947, test_loss: 2.3879, test_f1: 0.5692
 epoch: 93, train_loss: 0.2470, test_loss: 2.5340, test_f1: 0.6142
 epoch: 94, train_loss: 0.2631, test_loss: 2.1132, test_f1: 0.6008
 epoch: 95, train_loss: 0.2573, test_loss: 2.4515, test_f1: 0.6049
 epoch: 96, train_loss: 0.2819, test_loss: 2.4992, test_f1: 0.5909
 epoch: 97, train_loss: 0.2819, test_loss: 2.5434, test_f1: 0.5870
 epoch: 98, train_loss: 0.2759, test_loss: 2.4378, test_f1: 0.5802
 epoch: 99, train_loss: 0.3039, test_loss: 2.3824, test_f1: 0.5650
##################ITERATION #9 ****************************************
 epoch: 0, train_loss: 1.5482, test_loss: 1.5241, test_f1: 0.2293
 epoch: 1, train_loss: 1.0788, test_loss: 1.0653, test_f1: 0.5535
 epoch: 2, train_loss: 1.0013, test_loss: 1.0568, test_f1: 0.5633
 epoch: 3, train_loss: 0.9243, test_loss: 1.0485, test_f1: 0.5928
 epoch: 4, train_loss: 0.8888, test_loss: 1.0051, test_f1: 0.6011
 epoch: 5, train_loss: 0.8785, test_loss: 1.0095, test_f1: 0.6032
 epoch: 6, train_loss: 0.8559, test_loss: 1.0234, test_f1: 0.5833
 epoch: 7, train_loss: 0.8384, test_loss: 0.9951, test_f1: 0.5913
 epoch: 8, train_loss: 0.8175, test_loss: 1.0642, test_f1: 0.5892
 epoch: 9, train_loss: 0.7862, test_loss: 1.0473, test_f1: 0.5762
 epoch: 10, train_loss: 0.7954, test_loss: 1.0237, test_f1: 0.6087
 epoch: 11, train_loss: 0.7612, test_loss: 1.0234, test_f1: 0.5753
 epoch: 12, train_loss: 0.7382, test_loss: 1.1140, test_f1: 0.5733
 epoch: 13, train_loss: 0.7088, test_loss: 1.1066, test_f1: 0.5792
 epoch: 14, train_loss: 0.6960, test_loss: 1.1029, test_f1: 0.5687
 epoch: 15, train_loss: 0.7356, test_loss: 1.0637, test_f1: 0.5840
 epoch: 16, train_loss: 0.6973, test_loss: 1.0326, test_f1: 0.6076
 epoch: 17, train_loss: 0.6802, test_loss: 1.2107, test_f1: 0.5820
 epoch: 18, train_loss: 0.6678, test_loss: 1.1024, test_f1: 0.5768
 epoch: 19, train_loss: 0.6690, test_loss: 1.2240, test_f1: 0.5752
 epoch: 20, train_loss: 0.6834, test_loss: 1.1462, test_f1: 0.5727
 epoch: 21, train_loss: 0.6441, test_loss: 1.1643, test_f1: 0.5867
 epoch: 22, train_loss: 0.6364, test_loss: 1.1534, test_f1: 0.5940
 epoch: 23, train_loss: 0.6516, test_loss: 1.2786, test_f1: 0.6198
 epoch: 24, train_loss: 0.6442, test_loss: 1.1995, test_f1: 0.5697
 epoch: 25, train_loss: 0.6116, test_loss: 1.1508, test_f1: 0.5977
 epoch: 26, train_loss: 0.6068, test_loss: 1.1795, test_f1: 0.5651
 epoch: 27, train_loss: 0.6285, test_loss: 1.1654, test_f1: 0.6243
 epoch: 28, train_loss: 0.6016, test_loss: 1.2380, test_f1: 0.5766
 epoch: 29, train_loss: 0.5931, test_loss: 1.2888, test_f1: 0.5968
 epoch: 30, train_loss: 0.5782, test_loss: 1.2231, test_f1: 0.6049
 epoch: 31, train_loss: 0.5576, test_loss: 1.2767, test_f1: 0.6197
 epoch: 32, train_loss: 0.5703, test_loss: 1.3845, test_f1: 0.5293
 epoch: 33, train_loss: 0.5574, test_loss: 1.4300, test_f1: 0.5700
 epoch: 34, train_loss: 0.5640, test_loss: 1.2775, test_f1: 0.6134
 epoch: 35, train_loss: 0.5803, test_loss: 1.3346, test_f1: 0.5777
 epoch: 36, train_loss: 0.5394, test_loss: 1.4034, test_f1: 0.5843
 epoch: 37, train_loss: 0.5410, test_loss: 1.2738, test_f1: 0.5937
 epoch: 38, train_loss: 0.5274, test_loss: 1.4563, test_f1: 0.5505
 epoch: 39, train_loss: 0.5156, test_loss: 1.4583, test_f1: 0.5890
 epoch: 40, train_loss: 0.5142, test_loss: 1.2887, test_f1: 0.5982
 epoch: 41, train_loss: 0.5170, test_loss: 1.3269, test_f1: 0.6350
 epoch: 42, train_loss: 0.5426, test_loss: 1.4648, test_f1: 0.6107
 epoch: 43, train_loss: 0.5188, test_loss: 1.5189, test_f1: 0.6159
 epoch: 44, train_loss: 0.4948, test_loss: 1.5199, test_f1: 0.6067
 epoch: 45, train_loss: 0.4684, test_loss: 1.4374, test_f1: 0.6005
 epoch: 46, train_loss: 0.4679, test_loss: 1.5287, test_f1: 0.6062
 epoch: 47, train_loss: 0.5043, test_loss: 1.4885, test_f1: 0.5994
 epoch: 48, train_loss: 0.5038, test_loss: 1.6345, test_f1: 0.5712
 epoch: 49, train_loss: 0.4618, test_loss: 1.5215, test_f1: 0.5810
 epoch: 50, train_loss: 0.4386, test_loss: 1.6761, test_f1: 0.5778
 epoch: 51, train_loss: 0.4184, test_loss: 1.5374, test_f1: 0.5612
 epoch: 52, train_loss: 0.3913, test_loss: 1.6499, test_f1: 0.5793
 epoch: 53, train_loss: 0.4158, test_loss: 1.5368, test_f1: 0.5847
 epoch: 54, train_loss: 0.3830, test_loss: 1.5565, test_f1: 0.5883
 epoch: 55, train_loss: 0.3788, test_loss: 1.6711, test_f1: 0.6141
 epoch: 56, train_loss: 0.3891, test_loss: 1.6383, test_f1: 0.5955
 epoch: 57, train_loss: 0.3806, test_loss: 1.6443, test_f1: 0.5926
 epoch: 58, train_loss: 0.3585, test_loss: 1.7482, test_f1: 0.5717
 epoch: 59, train_loss: 0.3512, test_loss: 1.7209, test_f1: 0.5933
 epoch: 60, train_loss: 0.3391, test_loss: 1.7916, test_f1: 0.5424
 epoch: 61, train_loss: 0.3562, test_loss: 1.9163, test_f1: 0.6220
 epoch: 62, train_loss: 0.3714, test_loss: 1.7254, test_f1: 0.5799
 epoch: 63, train_loss: 0.3722, test_loss: 1.7956, test_f1: 0.5912
 epoch: 64, train_loss: 0.3657, test_loss: 1.8493, test_f1: 0.6028
 epoch: 65, train_loss: 0.3483, test_loss: 1.8568, test_f1: 0.5973
 epoch: 66, train_loss: 0.3579, test_loss: 1.6441, test_f1: 0.6107
 epoch: 67, train_loss: 0.3440, test_loss: 1.9400, test_f1: 0.5811
 epoch: 68, train_loss: 0.3333, test_loss: 1.8301, test_f1: 0.6148
 epoch: 69, train_loss: 0.3404, test_loss: 1.8292, test_f1: 0.5786
 epoch: 70, train_loss: 0.3176, test_loss: 1.8049, test_f1: 0.5870
 epoch: 71, train_loss: 0.3217, test_loss: 2.0826, test_f1: 0.5771
 epoch: 72, train_loss: 0.3183, test_loss: 1.9590, test_f1: 0.5694
 epoch: 73, train_loss: 0.3213, test_loss: 2.0220, test_f1: 0.6069
 epoch: 74, train_loss: 0.3144, test_loss: 1.9140, test_f1: 0.5788
 epoch: 75, train_loss: 0.3340, test_loss: 1.9957, test_f1: 0.6151
 epoch: 76, train_loss: 0.3431, test_loss: 2.2917, test_f1: 0.5659
 epoch: 77, train_loss: 0.3038, test_loss: 2.1640, test_f1: 0.5695
 epoch: 78, train_loss: 0.3052, test_loss: 1.9882, test_f1: 0.5894
 epoch: 79, train_loss: 0.2976, test_loss: 2.2408, test_f1: 0.5969
 epoch: 80, train_loss: 0.2861, test_loss: 2.2618, test_f1: 0.5647
 epoch: 81, train_loss: 0.2955, test_loss: 2.2122, test_f1: 0.5865
 epoch: 82, train_loss: 0.3349, test_loss: 2.3511, test_f1: 0.5619
 epoch: 83, train_loss: 0.3026, test_loss: 2.1142, test_f1: 0.5752
 epoch: 84, train_loss: 0.2948, test_loss: 2.1696, test_f1: 0.5633
 epoch: 85, train_loss: 0.2954, test_loss: 2.1978, test_f1: 0.5603
 epoch: 86, train_loss: 0.2938, test_loss: 2.3091, test_f1: 0.5813
 epoch: 87, train_loss: 0.2908, test_loss: 2.2876, test_f1: 0.5622
 epoch: 88, train_loss: 0.2965, test_loss: 2.3794, test_f1: 0.5851
 epoch: 89, train_loss: 0.2901, test_loss: 2.3995, test_f1: 0.5506
 epoch: 90, train_loss: 0.2700, test_loss: 2.3214, test_f1: 0.5452
 epoch: 91, train_loss: 0.2536, test_loss: 2.2424, test_f1: 0.5465
 epoch: 92, train_loss: 0.2816, test_loss: 2.3552, test_f1: 0.6024
 epoch: 93, train_loss: 0.3146, test_loss: 2.2929, test_f1: 0.5438
 epoch: 94, train_loss: 0.2800, test_loss: 2.5243, test_f1: 0.5699
 epoch: 95, train_loss: 0.2703, test_loss: 2.4967, test_f1: 0.5547
 epoch: 96, train_loss: 0.2502, test_loss: 2.3525, test_f1: 0.5605
 epoch: 97, train_loss: 0.2596, test_loss: 2.3709, test_f1: 0.5948
 epoch: 98, train_loss: 0.2565, test_loss: 2.4355, test_f1: 0.5756
 epoch: 99, train_loss: 0.2707, test_loss: 2.5878, test_f1: 0.6138

Training completed in 520.29 seconds
Best F1: 0.6729 at epoch 21
Mean F1 across iterations: 0.6522  0.0179
========================FINAL RESULTS================================
FEGIN weighted F1: 0.6729  0.0179
python main.py --data ltspice_demos --representation component_pin_net --model FEGIN --layers 2 --hiddens 64 --batch_size 32 --lr 0.001 --emb_size 128 --epochs 100 --save_appendix component_pin_net_L2_H64_BS32_LR0.001_E128 --no_val
-----



STDERR:
  File "main.py", line 370, in <module>
    main()
  File "main.py", line 254, in main
    dataset = dataset_class(
  File "/home/philip/projects/ltspice_examples_code_repo/Circuit-Completion-Using-GNNs/component_classification_with_link_prediction_head/evaluation/FEGIN/kernel/circuit_datasets.py", line 15, in __init__
    self.data, self.slices = torch.load(self.processed_paths[0])
  File "/home/philip/.local/lib/python3.8/site-packages/torch/serialization.py", line 1040, in load
    warnings.warn(
  File "/usr/lib/python3.8/warnings.py", line 109, in _showwarnmsg
    sw(msg.message, msg.category, msg.filename, msg.lineno,
  File "main.py", line 47, in warn_with_traceback
    traceback.print_stack(file=log)
/home/philip/projects/ltspice_examples_code_repo/Circuit-Completion-Using-GNNs/component_classification_with_link_prediction_head/evaluation/FEGIN/kernel/circuit_datasets.py:15: FutureWarning: You are using `torch.load` with `weights_only=False` (the current default value), which uses the default pickle module implicitly. It is possible to construct malicious pickle data which will execute arbitrary code during unpickling (See https://github.com/pytorch/pytorch/blob/main/SECURITY.md#untrusted-models for more details). In a future release, the default value for `weights_only` will be flipped to `True`. This limits the functions that could be executed during unpickling. Arbitrary objects will no longer be allowed to be loaded via this mode unless they are explicitly allowlisted by the user via `torch.serialization.add_safe_globals`. We recommend you start setting `weights_only=True` for any use case where you don't have full control of the loaded file. Please open an issue on GitHub for any issues related to this experimental feature.
  self.data, self.slices = torch.load(self.processed_paths[0])
