STDOUT:
Results will be saved in /home/philip/projects/ltspice_examples_code_repo/Circuit-Completion-Using-GNNs/component_classification_with_link_prediction_head/evaluation/FEGIN/results/model_FEGIN_dataset_ltspice_examples
Command line input: python main.py --data ltspice_examples --representation component_pin --model FEGIN --layers 2 --hiddens 32 --batch_size 32 --lr 0.001 --emb_size 512 --epochs 100 --save_appendix component_pin_L2_H32_BS32_LR0.001_E512 --no_val
 is saved.
-----
ltspice_examples - FEGIN
Using 2 layers, 32 hidden units, h = 2
Loading component_pin representation dataset
ENTERED
Training FEGIN on component_pin representation
Train: 3560, Test: 848
##################ITERATION #0 ****************************************
 epoch: 0, train_loss: 1.2482, test_loss: 1.0954, test_f1: 0.3895
 epoch: 1, train_loss: 1.0524, test_loss: 1.0843, test_f1: 0.3515
 epoch: 2, train_loss: 1.0150, test_loss: 1.0337, test_f1: 0.4483
 epoch: 3, train_loss: 1.0052, test_loss: 1.0197, test_f1: 0.4673
 epoch: 4, train_loss: 0.9758, test_loss: 0.9871, test_f1: 0.5005
 epoch: 5, train_loss: 0.9491, test_loss: 0.9638, test_f1: 0.5461
 epoch: 6, train_loss: 0.9316, test_loss: 1.0059, test_f1: 0.5135
 epoch: 7, train_loss: 0.9136, test_loss: 0.8952, test_f1: 0.5269
 epoch: 8, train_loss: 0.9068, test_loss: 0.9266, test_f1: 0.5245
 epoch: 9, train_loss: 0.8873, test_loss: 0.9346, test_f1: 0.5270
 epoch: 10, train_loss: 0.8639, test_loss: 0.9194, test_f1: 0.5476
 epoch: 11, train_loss: 0.8711, test_loss: 0.9419, test_f1: 0.5073
 epoch: 12, train_loss: 0.8466, test_loss: 0.8889, test_f1: 0.5402
 epoch: 13, train_loss: 0.8293, test_loss: 0.8773, test_f1: 0.5360
 epoch: 14, train_loss: 0.8244, test_loss: 0.8775, test_f1: 0.5004
 epoch: 15, train_loss: 0.8186, test_loss: 0.8211, test_f1: 0.5370
 epoch: 16, train_loss: 0.8105, test_loss: 0.8148, test_f1: 0.5347
 epoch: 17, train_loss: 0.7933, test_loss: 0.8271, test_f1: 0.5190
 epoch: 18, train_loss: 0.7817, test_loss: 0.8157, test_f1: 0.5378
 epoch: 19, train_loss: 0.7884, test_loss: 0.8198, test_f1: 0.5571
 epoch: 20, train_loss: 0.7800, test_loss: 0.8523, test_f1: 0.5343
 epoch: 21, train_loss: 0.7703, test_loss: 0.8270, test_f1: 0.5510
 epoch: 22, train_loss: 0.7574, test_loss: 0.8182, test_f1: 0.5645
 epoch: 23, train_loss: 0.7544, test_loss: 0.8204, test_f1: 0.5733
 epoch: 24, train_loss: 0.7453, test_loss: 0.8342, test_f1: 0.5531
 epoch: 25, train_loss: 0.7635, test_loss: 0.7727, test_f1: 0.5616
 epoch: 26, train_loss: 0.7498, test_loss: 0.8231, test_f1: 0.5477
 epoch: 27, train_loss: 0.7385, test_loss: 0.8168, test_f1: 0.5341
 epoch: 28, train_loss: 0.7396, test_loss: 0.7634, test_f1: 0.5764
 epoch: 29, train_loss: 0.7336, test_loss: 0.8087, test_f1: 0.5625
 epoch: 30, train_loss: 0.7438, test_loss: 0.8187, test_f1: 0.5822
 epoch: 31, train_loss: 0.7174, test_loss: 0.8602, test_f1: 0.5702
 epoch: 32, train_loss: 0.7113, test_loss: 0.8042, test_f1: 0.5662
 epoch: 33, train_loss: 0.7069, test_loss: 0.8283, test_f1: 0.5814
 epoch: 34, train_loss: 0.7227, test_loss: 0.9482, test_f1: 0.5678
 epoch: 35, train_loss: 0.7251, test_loss: 0.8257, test_f1: 0.5780
 epoch: 36, train_loss: 0.7090, test_loss: 0.8524, test_f1: 0.5571
 epoch: 37, train_loss: 0.6981, test_loss: 0.8683, test_f1: 0.5776
 epoch: 38, train_loss: 0.6969, test_loss: 0.8613, test_f1: 0.5600
 epoch: 39, train_loss: 0.6935, test_loss: 0.8396, test_f1: 0.5752
 epoch: 40, train_loss: 0.6877, test_loss: 0.8432, test_f1: 0.5751
 epoch: 41, train_loss: 0.6870, test_loss: 0.8022, test_f1: 0.6169
 epoch: 42, train_loss: 0.6793, test_loss: 0.8497, test_f1: 0.5894
 epoch: 43, train_loss: 0.6782, test_loss: 0.8451, test_f1: 0.6340
 epoch: 44, train_loss: 0.6700, test_loss: 0.8118, test_f1: 0.6129
 epoch: 45, train_loss: 0.6834, test_loss: 0.8113, test_f1: 0.6054
 epoch: 46, train_loss: 0.6614, test_loss: 0.9795, test_f1: 0.5975
 epoch: 47, train_loss: 0.6596, test_loss: 0.8394, test_f1: 0.6426
 epoch: 48, train_loss: 0.6547, test_loss: 0.8382, test_f1: 0.6318
 epoch: 49, train_loss: 0.6628, test_loss: 0.8370, test_f1: 0.6012
 epoch: 50, train_loss: 0.6614, test_loss: 0.8009, test_f1: 0.6336
 epoch: 51, train_loss: 0.6316, test_loss: 0.8385, test_f1: 0.6321
 epoch: 52, train_loss: 0.6285, test_loss: 0.7614, test_f1: 0.6382
 epoch: 53, train_loss: 0.6258, test_loss: 0.8651, test_f1: 0.6265
 epoch: 54, train_loss: 0.6383, test_loss: 0.8062, test_f1: 0.6319
 epoch: 55, train_loss: 0.6277, test_loss: 0.8594, test_f1: 0.6221
 epoch: 56, train_loss: 0.6168, test_loss: 0.8555, test_f1: 0.6278
 epoch: 57, train_loss: 0.6212, test_loss: 0.7923, test_f1: 0.6396
 epoch: 58, train_loss: 0.6149, test_loss: 0.8167, test_f1: 0.6340
 epoch: 59, train_loss: 0.6281, test_loss: 0.8450, test_f1: 0.6139
 epoch: 60, train_loss: 0.6247, test_loss: 0.9172, test_f1: 0.6224
 epoch: 61, train_loss: 0.6231, test_loss: 0.8246, test_f1: 0.6208
 epoch: 62, train_loss: 0.6186, test_loss: 0.8275, test_f1: 0.6437
 epoch: 63, train_loss: 0.6149, test_loss: 0.8558, test_f1: 0.6257
 epoch: 64, train_loss: 0.6107, test_loss: 0.8260, test_f1: 0.6140
 epoch: 65, train_loss: 0.6163, test_loss: 0.9333, test_f1: 0.5888
 epoch: 66, train_loss: 0.6182, test_loss: 0.7956, test_f1: 0.6186
 epoch: 67, train_loss: 0.6043, test_loss: 0.8483, test_f1: 0.6351
 epoch: 68, train_loss: 0.6092, test_loss: 0.8245, test_f1: 0.6150
 epoch: 69, train_loss: 0.5893, test_loss: 0.8471, test_f1: 0.6302
 epoch: 70, train_loss: 0.5902, test_loss: 0.7899, test_f1: 0.6439
 epoch: 71, train_loss: 0.6023, test_loss: 0.8261, test_f1: 0.6348
 epoch: 72, train_loss: 0.6049, test_loss: 0.8655, test_f1: 0.6124
 epoch: 73, train_loss: 0.6050, test_loss: 0.8564, test_f1: 0.6330
 epoch: 74, train_loss: 0.6063, test_loss: 0.8067, test_f1: 0.6410
 epoch: 75, train_loss: 0.5838, test_loss: 0.7859, test_f1: 0.6501
 epoch: 76, train_loss: 0.6092, test_loss: 0.8313, test_f1: 0.6352
 epoch: 77, train_loss: 0.5982, test_loss: 0.7811, test_f1: 0.6427
 epoch: 78, train_loss: 0.5850, test_loss: 0.8682, test_f1: 0.6318
 epoch: 79, train_loss: 0.5959, test_loss: 0.8539, test_f1: 0.6240
 epoch: 80, train_loss: 0.5890, test_loss: 0.9310, test_f1: 0.6308
 epoch: 81, train_loss: 0.5859, test_loss: 0.8574, test_f1: 0.6426
 epoch: 82, train_loss: 0.5819, test_loss: 0.8456, test_f1: 0.6317
 epoch: 83, train_loss: 0.6027, test_loss: 0.8108, test_f1: 0.6363
 epoch: 84, train_loss: 0.5772, test_loss: 0.8180, test_f1: 0.6307
 epoch: 85, train_loss: 0.5845, test_loss: 0.8557, test_f1: 0.6401
 epoch: 86, train_loss: 0.5689, test_loss: 0.9569, test_f1: 0.6457
 epoch: 87, train_loss: 0.5701, test_loss: 0.8004, test_f1: 0.6434
 epoch: 88, train_loss: 0.5703, test_loss: 0.9174, test_f1: 0.6451
 epoch: 89, train_loss: 0.5699, test_loss: 0.9216, test_f1: 0.6369
 epoch: 90, train_loss: 0.5566, test_loss: 0.9654, test_f1: 0.6650
 epoch: 91, train_loss: 0.5600, test_loss: 0.9068, test_f1: 0.6430
 epoch: 92, train_loss: 0.5832, test_loss: 0.8439, test_f1: 0.6436
 epoch: 93, train_loss: 0.5618, test_loss: 0.7933, test_f1: 0.6550
 epoch: 94, train_loss: 0.5710, test_loss: 0.8760, test_f1: 0.6478
 epoch: 95, train_loss: 0.5658, test_loss: 1.0512, test_f1: 0.6280
 epoch: 96, train_loss: 0.5586, test_loss: 0.8972, test_f1: 0.6526
 epoch: 97, train_loss: 0.5635, test_loss: 0.9386, test_f1: 0.6145
 epoch: 98, train_loss: 0.5659, test_loss: 0.9152, test_f1: 0.6492
 epoch: 99, train_loss: 0.5615, test_loss: 0.9214, test_f1: 0.6545
##################ITERATION #1 ****************************************
 epoch: 0, train_loss: 1.1368, test_loss: 1.0042, test_f1: 0.4372
 epoch: 1, train_loss: 1.0026, test_loss: 0.9759, test_f1: 0.4795
 epoch: 2, train_loss: 0.9648, test_loss: 0.9398, test_f1: 0.4902
 epoch: 3, train_loss: 0.9384, test_loss: 0.9343, test_f1: 0.5225
 epoch: 4, train_loss: 0.9195, test_loss: 0.9178, test_f1: 0.5309
 epoch: 5, train_loss: 0.8986, test_loss: 0.9206, test_f1: 0.5267
 epoch: 6, train_loss: 0.8827, test_loss: 0.8924, test_f1: 0.5395
 epoch: 7, train_loss: 0.8692, test_loss: 0.8744, test_f1: 0.5432
 epoch: 8, train_loss: 0.8607, test_loss: 0.8741, test_f1: 0.5485
 epoch: 9, train_loss: 0.8529, test_loss: 0.8660, test_f1: 0.5284
 epoch: 10, train_loss: 0.8382, test_loss: 0.8891, test_f1: 0.5609
 epoch: 11, train_loss: 0.8237, test_loss: 0.9417, test_f1: 0.5377
 epoch: 12, train_loss: 0.8300, test_loss: 0.9584, test_f1: 0.5306
 epoch: 13, train_loss: 0.8102, test_loss: 1.0260, test_f1: 0.5159
 epoch: 14, train_loss: 0.8295, test_loss: 0.8384, test_f1: 0.5694
 epoch: 15, train_loss: 0.7973, test_loss: 0.9290, test_f1: 0.5153
 epoch: 16, train_loss: 0.8065, test_loss: 0.7984, test_f1: 0.6007
 epoch: 17, train_loss: 0.7732, test_loss: 0.9813, test_f1: 0.4892
 epoch: 18, train_loss: 0.7819, test_loss: 0.8890, test_f1: 0.5615
 epoch: 19, train_loss: 0.7718, test_loss: 0.8835, test_f1: 0.5295
 epoch: 20, train_loss: 0.7719, test_loss: 0.9560, test_f1: 0.5112
 epoch: 21, train_loss: 0.7735, test_loss: 0.9026, test_f1: 0.5228
 epoch: 22, train_loss: 0.7654, test_loss: 0.8261, test_f1: 0.5973
 epoch: 23, train_loss: 0.7567, test_loss: 0.9307, test_f1: 0.5378
 epoch: 24, train_loss: 0.7508, test_loss: 1.0057, test_f1: 0.5450
 epoch: 25, train_loss: 0.7441, test_loss: 0.9463, test_f1: 0.5856
 epoch: 26, train_loss: 0.7507, test_loss: 0.8680, test_f1: 0.5705
 epoch: 27, train_loss: 0.7341, test_loss: 0.8937, test_f1: 0.5380
 epoch: 28, train_loss: 0.7386, test_loss: 0.8342, test_f1: 0.5977
 epoch: 29, train_loss: 0.7271, test_loss: 0.9008, test_f1: 0.5759
 epoch: 30, train_loss: 0.7257, test_loss: 0.7665, test_f1: 0.5930
 epoch: 31, train_loss: 0.7120, test_loss: 0.8511, test_f1: 0.5857
 epoch: 32, train_loss: 0.7066, test_loss: 0.8715, test_f1: 0.5915
 epoch: 33, train_loss: 0.7232, test_loss: 0.9390, test_f1: 0.5511
 epoch: 34, train_loss: 0.6960, test_loss: 0.8408, test_f1: 0.5769
 epoch: 35, train_loss: 0.6810, test_loss: 0.8615, test_f1: 0.5743
 epoch: 36, train_loss: 0.6959, test_loss: 0.8324, test_f1: 0.5857
 epoch: 37, train_loss: 0.6888, test_loss: 0.7669, test_f1: 0.5927
 epoch: 38, train_loss: 0.6871, test_loss: 0.9525, test_f1: 0.5458
 epoch: 39, train_loss: 0.6770, test_loss: 0.8715, test_f1: 0.5916
 epoch: 40, train_loss: 0.6731, test_loss: 0.9792, test_f1: 0.5908
 epoch: 41, train_loss: 0.6719, test_loss: 0.8373, test_f1: 0.5816
 epoch: 42, train_loss: 0.6728, test_loss: 0.8551, test_f1: 0.6056
 epoch: 43, train_loss: 0.6777, test_loss: 0.8442, test_f1: 0.5991
 epoch: 44, train_loss: 0.6808, test_loss: 0.8488, test_f1: 0.5730
 epoch: 45, train_loss: 0.6488, test_loss: 0.8537, test_f1: 0.6023
 epoch: 46, train_loss: 0.6568, test_loss: 0.8194, test_f1: 0.6383
 epoch: 47, train_loss: 0.6509, test_loss: 0.9176, test_f1: 0.6098
 epoch: 48, train_loss: 0.6598, test_loss: 0.8172, test_f1: 0.5982
 epoch: 49, train_loss: 0.6621, test_loss: 0.8106, test_f1: 0.6182
 epoch: 50, train_loss: 0.6502, test_loss: 0.8830, test_f1: 0.6261
 epoch: 51, train_loss: 0.6098, test_loss: 0.7998, test_f1: 0.6019
 epoch: 52, train_loss: 0.6214, test_loss: 0.8764, test_f1: 0.6032
 epoch: 53, train_loss: 0.6111, test_loss: 0.9122, test_f1: 0.5916
 epoch: 54, train_loss: 0.6075, test_loss: 0.8893, test_f1: 0.6234
 epoch: 55, train_loss: 0.6009, test_loss: 0.8911, test_f1: 0.6088
 epoch: 56, train_loss: 0.6056, test_loss: 0.8111, test_f1: 0.6295
 epoch: 57, train_loss: 0.6081, test_loss: 0.8795, test_f1: 0.6156
 epoch: 58, train_loss: 0.6041, test_loss: 0.8497, test_f1: 0.6114
 epoch: 59, train_loss: 0.6001, test_loss: 0.8472, test_f1: 0.6275
 epoch: 60, train_loss: 0.5918, test_loss: 0.9580, test_f1: 0.6205
 epoch: 61, train_loss: 0.5924, test_loss: 0.9621, test_f1: 0.6121
 epoch: 62, train_loss: 0.5941, test_loss: 0.9104, test_f1: 0.6312
 epoch: 63, train_loss: 0.5919, test_loss: 0.8343, test_f1: 0.6164
 epoch: 64, train_loss: 0.5890, test_loss: 0.8664, test_f1: 0.6169
 epoch: 65, train_loss: 0.5823, test_loss: 0.8463, test_f1: 0.6238
 epoch: 66, train_loss: 0.5889, test_loss: 0.9501, test_f1: 0.6253
 epoch: 67, train_loss: 0.5789, test_loss: 0.9221, test_f1: 0.5865
 epoch: 68, train_loss: 0.5859, test_loss: 0.9079, test_f1: 0.6255
 epoch: 69, train_loss: 0.5780, test_loss: 0.9106, test_f1: 0.6313
 epoch: 70, train_loss: 0.5835, test_loss: 0.9355, test_f1: 0.6306
 epoch: 71, train_loss: 0.5750, test_loss: 1.0376, test_f1: 0.6115
 epoch: 72, train_loss: 0.5659, test_loss: 0.9654, test_f1: 0.6143
 epoch: 73, train_loss: 0.5801, test_loss: 0.9032, test_f1: 0.6248
 epoch: 74, train_loss: 0.5651, test_loss: 0.9307, test_f1: 0.6189
 epoch: 75, train_loss: 0.5620, test_loss: 0.9492, test_f1: 0.6320
 epoch: 76, train_loss: 0.5671, test_loss: 0.8495, test_f1: 0.6476
 epoch: 77, train_loss: 0.5722, test_loss: 0.9389, test_f1: 0.6583
 epoch: 78, train_loss: 0.5661, test_loss: 0.9231, test_f1: 0.6351
 epoch: 79, train_loss: 0.5557, test_loss: 0.8802, test_f1: 0.6318
 epoch: 80, train_loss: 0.5665, test_loss: 0.9837, test_f1: 0.6083
 epoch: 81, train_loss: 0.5597, test_loss: 0.9506, test_f1: 0.6160
 epoch: 82, train_loss: 0.5644, test_loss: 0.9528, test_f1: 0.6205
 epoch: 83, train_loss: 0.5576, test_loss: 0.9528, test_f1: 0.6170
 epoch: 84, train_loss: 0.5715, test_loss: 0.9458, test_f1: 0.6341
 epoch: 85, train_loss: 0.5508, test_loss: 0.9936, test_f1: 0.6424
 epoch: 86, train_loss: 0.5417, test_loss: 0.9361, test_f1: 0.6334
 epoch: 87, train_loss: 0.5596, test_loss: 0.8921, test_f1: 0.6423
 epoch: 88, train_loss: 0.5601, test_loss: 0.9583, test_f1: 0.6049
 epoch: 89, train_loss: 0.5727, test_loss: 0.8613, test_f1: 0.6459
 epoch: 90, train_loss: 0.5417, test_loss: 0.8736, test_f1: 0.6515
 epoch: 91, train_loss: 0.5484, test_loss: 1.0188, test_f1: 0.6227
 epoch: 92, train_loss: 0.5374, test_loss: 1.0260, test_f1: 0.6139
 epoch: 93, train_loss: 0.5395, test_loss: 0.9735, test_f1: 0.6093
 epoch: 94, train_loss: 0.5424, test_loss: 0.9789, test_f1: 0.6201
 epoch: 95, train_loss: 0.5630, test_loss: 0.9260, test_f1: 0.6252
 epoch: 96, train_loss: 0.5379, test_loss: 0.9109, test_f1: 0.6353
 epoch: 97, train_loss: 0.5424, test_loss: 0.9702, test_f1: 0.6256
 epoch: 98, train_loss: 0.5319, test_loss: 0.8756, test_f1: 0.6298
 epoch: 99, train_loss: 0.5459, test_loss: 0.8238, test_f1: 0.6364
##################ITERATION #2 ****************************************
 epoch: 0, train_loss: 1.1178, test_loss: 1.0659, test_f1: 0.3476
 epoch: 1, train_loss: 1.0107, test_loss: 1.0221, test_f1: 0.4832
 epoch: 2, train_loss: 0.9811, test_loss: 0.9784, test_f1: 0.5130
 epoch: 3, train_loss: 0.9490, test_loss: 0.9622, test_f1: 0.5000
 epoch: 4, train_loss: 0.9353, test_loss: 0.9476, test_f1: 0.5312
 epoch: 5, train_loss: 0.9125, test_loss: 0.9698, test_f1: 0.5044
 epoch: 6, train_loss: 0.9042, test_loss: 0.9341, test_f1: 0.5359
 epoch: 7, train_loss: 0.8946, test_loss: 0.9829, test_f1: 0.5078
 epoch: 8, train_loss: 0.8852, test_loss: 0.9097, test_f1: 0.5236
 epoch: 9, train_loss: 0.8817, test_loss: 0.9090, test_f1: 0.5419
 epoch: 10, train_loss: 0.8661, test_loss: 0.9338, test_f1: 0.5212
 epoch: 11, train_loss: 0.8560, test_loss: 0.9533, test_f1: 0.5221
 epoch: 12, train_loss: 0.8550, test_loss: 0.9152, test_f1: 0.5274
 epoch: 13, train_loss: 0.8525, test_loss: 0.8572, test_f1: 0.5546
 epoch: 14, train_loss: 0.8264, test_loss: 0.9070, test_f1: 0.5400
 epoch: 15, train_loss: 0.8316, test_loss: 0.8816, test_f1: 0.5417
 epoch: 16, train_loss: 0.8178, test_loss: 0.9012, test_f1: 0.5282
 epoch: 17, train_loss: 0.8188, test_loss: 0.8619, test_f1: 0.5609
 epoch: 18, train_loss: 0.8087, test_loss: 0.8852, test_f1: 0.5635
 epoch: 19, train_loss: 0.7983, test_loss: 0.8425, test_f1: 0.5505
 epoch: 20, train_loss: 0.8023, test_loss: 0.8836, test_f1: 0.5818
 epoch: 21, train_loss: 0.7980, test_loss: 0.9081, test_f1: 0.5238
 epoch: 22, train_loss: 0.7941, test_loss: 0.8867, test_f1: 0.5341
 epoch: 23, train_loss: 0.7813, test_loss: 0.9280, test_f1: 0.5260
 epoch: 24, train_loss: 0.7881, test_loss: 0.8141, test_f1: 0.5839
 epoch: 25, train_loss: 0.7788, test_loss: 0.9483, test_f1: 0.5473
 epoch: 26, train_loss: 0.7700, test_loss: 0.9119, test_f1: 0.5461
 epoch: 27, train_loss: 0.7686, test_loss: 0.8627, test_f1: 0.5550
 epoch: 28, train_loss: 0.7542, test_loss: 0.8919, test_f1: 0.5436
 epoch: 29, train_loss: 0.7639, test_loss: 0.9201, test_f1: 0.5312
 epoch: 30, train_loss: 0.7531, test_loss: 0.9007, test_f1: 0.5483
 epoch: 31, train_loss: 0.7442, test_loss: 0.8616, test_f1: 0.5733
 epoch: 32, train_loss: 0.7573, test_loss: 0.8428, test_f1: 0.5801
 epoch: 33, train_loss: 0.7389, test_loss: 0.9749, test_f1: 0.5280
 epoch: 34, train_loss: 0.7351, test_loss: 0.8734, test_f1: 0.5814
 epoch: 35, train_loss: 0.7398, test_loss: 0.8402, test_f1: 0.6045
 epoch: 36, train_loss: 0.7357, test_loss: 0.8947, test_f1: 0.5660
 epoch: 37, train_loss: 0.7310, test_loss: 0.8620, test_f1: 0.5779
 epoch: 38, train_loss: 0.7136, test_loss: 0.9173, test_f1: 0.5727
 epoch: 39, train_loss: 0.7120, test_loss: 0.9550, test_f1: 0.5646
 epoch: 40, train_loss: 0.7202, test_loss: 0.8785, test_f1: 0.5889
 epoch: 41, train_loss: 0.7187, test_loss: 0.9119, test_f1: 0.5987
 epoch: 42, train_loss: 0.7205, test_loss: 0.8913, test_f1: 0.5892
 epoch: 43, train_loss: 0.7084, test_loss: 0.8454, test_f1: 0.6019
 epoch: 44, train_loss: 0.6979, test_loss: 0.9353, test_f1: 0.5661
 epoch: 45, train_loss: 0.6978, test_loss: 0.8836, test_f1: 0.5783
 epoch: 46, train_loss: 0.7100, test_loss: 0.9099, test_f1: 0.6106
 epoch: 47, train_loss: 0.7005, test_loss: 1.1850, test_f1: 0.4933
 epoch: 48, train_loss: 0.7041, test_loss: 0.8834, test_f1: 0.6124
 epoch: 49, train_loss: 0.6807, test_loss: 0.8589, test_f1: 0.6213
 epoch: 50, train_loss: 0.7011, test_loss: 1.0626, test_f1: 0.5376
 epoch: 51, train_loss: 0.6717, test_loss: 0.8857, test_f1: 0.6106
 epoch: 52, train_loss: 0.6668, test_loss: 0.8998, test_f1: 0.6220
 epoch: 53, train_loss: 0.6576, test_loss: 0.8973, test_f1: 0.6107
 epoch: 54, train_loss: 0.6511, test_loss: 0.8644, test_f1: 0.6274
 epoch: 55, train_loss: 0.6494, test_loss: 0.8786, test_f1: 0.6050
 epoch: 56, train_loss: 0.6565, test_loss: 0.8986, test_f1: 0.6068
 epoch: 57, train_loss: 0.6520, test_loss: 0.8662, test_f1: 0.6238
 epoch: 58, train_loss: 0.6489, test_loss: 0.8572, test_f1: 0.5856
 epoch: 59, train_loss: 0.6487, test_loss: 0.8645, test_f1: 0.6254
 epoch: 60, train_loss: 0.6418, test_loss: 0.8636, test_f1: 0.6204
 epoch: 61, train_loss: 0.6375, test_loss: 0.8901, test_f1: 0.6326
 epoch: 62, train_loss: 0.6472, test_loss: 0.9083, test_f1: 0.5930
 epoch: 63, train_loss: 0.6379, test_loss: 0.9157, test_f1: 0.5977
 epoch: 64, train_loss: 0.6556, test_loss: 0.8510, test_f1: 0.6482
 epoch: 65, train_loss: 0.6411, test_loss: 0.9056, test_f1: 0.6073
 epoch: 66, train_loss: 0.6426, test_loss: 0.9238, test_f1: 0.6099
 epoch: 67, train_loss: 0.6285, test_loss: 0.8715, test_f1: 0.6291
 epoch: 68, train_loss: 0.6374, test_loss: 0.8988, test_f1: 0.6106
 epoch: 69, train_loss: 0.6368, test_loss: 0.9135, test_f1: 0.6116
 epoch: 70, train_loss: 0.6289, test_loss: 0.8652, test_f1: 0.6236
 epoch: 71, train_loss: 0.6233, test_loss: 0.8925, test_f1: 0.5965
 epoch: 72, train_loss: 0.6255, test_loss: 0.9104, test_f1: 0.6153
 epoch: 73, train_loss: 0.6235, test_loss: 0.9083, test_f1: 0.6187
 epoch: 74, train_loss: 0.6187, test_loss: 0.8812, test_f1: 0.6238
 epoch: 75, train_loss: 0.6152, test_loss: 0.8762, test_f1: 0.6128
 epoch: 76, train_loss: 0.6330, test_loss: 0.8609, test_f1: 0.6271
 epoch: 77, train_loss: 0.6383, test_loss: 0.8659, test_f1: 0.6144
 epoch: 78, train_loss: 0.6263, test_loss: 0.8994, test_f1: 0.6024
 epoch: 79, train_loss: 0.6061, test_loss: 0.9775, test_f1: 0.5871
 epoch: 80, train_loss: 0.6277, test_loss: 0.9578, test_f1: 0.6101
 epoch: 81, train_loss: 0.6190, test_loss: 0.9134, test_f1: 0.6225
 epoch: 82, train_loss: 0.6100, test_loss: 0.9011, test_f1: 0.6154
 epoch: 83, train_loss: 0.6057, test_loss: 0.8913, test_f1: 0.6077
 epoch: 84, train_loss: 0.6100, test_loss: 0.9379, test_f1: 0.6054
 epoch: 85, train_loss: 0.6033, test_loss: 0.9017, test_f1: 0.6256
 epoch: 86, train_loss: 0.6100, test_loss: 0.8961, test_f1: 0.6418
 epoch: 87, train_loss: 0.6235, test_loss: 0.9626, test_f1: 0.5997
 epoch: 88, train_loss: 0.6018, test_loss: 0.8880, test_f1: 0.6400
 epoch: 89, train_loss: 0.5975, test_loss: 0.9278, test_f1: 0.6108
 epoch: 90, train_loss: 0.6106, test_loss: 1.0671, test_f1: 0.5578
 epoch: 91, train_loss: 0.6053, test_loss: 0.9712, test_f1: 0.6018
 epoch: 92, train_loss: 0.6044, test_loss: 0.9553, test_f1: 0.6084
 epoch: 93, train_loss: 0.6009, test_loss: 0.9308, test_f1: 0.6336
 epoch: 94, train_loss: 0.6000, test_loss: 1.0411, test_f1: 0.5865
 epoch: 95, train_loss: 0.5981, test_loss: 0.9443, test_f1: 0.6195
 epoch: 96, train_loss: 0.5912, test_loss: 0.9070, test_f1: 0.6462
 epoch: 97, train_loss: 0.5934, test_loss: 0.8917, test_f1: 0.6397
 epoch: 98, train_loss: 0.6033, test_loss: 0.8968, test_f1: 0.6367
 epoch: 99, train_loss: 0.5935, test_loss: 0.9202, test_f1: 0.6411
##################ITERATION #3 ****************************************
 epoch: 0, train_loss: 1.1439, test_loss: 1.0039, test_f1: 0.5245
 epoch: 1, train_loss: 1.0347, test_loss: 1.0150, test_f1: 0.5197
 epoch: 2, train_loss: 1.0112, test_loss: 0.9997, test_f1: 0.5276
 epoch: 3, train_loss: 0.9807, test_loss: 0.9604, test_f1: 0.5069
 epoch: 4, train_loss: 0.9556, test_loss: 1.0190, test_f1: 0.5137
 epoch: 5, train_loss: 0.9334, test_loss: 0.9316, test_f1: 0.5199
 epoch: 6, train_loss: 0.9214, test_loss: 0.9433, test_f1: 0.5188
 epoch: 7, train_loss: 0.9141, test_loss: 0.9493, test_f1: 0.5151
 epoch: 8, train_loss: 0.8913, test_loss: 0.9293, test_f1: 0.5397
 epoch: 9, train_loss: 0.8805, test_loss: 0.9027, test_f1: 0.5268
 epoch: 10, train_loss: 0.8732, test_loss: 0.8997, test_f1: 0.5189
 epoch: 11, train_loss: 0.8455, test_loss: 0.9843, test_f1: 0.4927
 epoch: 12, train_loss: 0.8375, test_loss: 0.8665, test_f1: 0.5735
 epoch: 13, train_loss: 0.8340, test_loss: 0.8898, test_f1: 0.5687
 epoch: 14, train_loss: 0.8271, test_loss: 0.8356, test_f1: 0.5874
 epoch: 15, train_loss: 0.8217, test_loss: 0.8465, test_f1: 0.5859
 epoch: 16, train_loss: 0.8058, test_loss: 0.8399, test_f1: 0.5540
 epoch: 17, train_loss: 0.7929, test_loss: 0.8430, test_f1: 0.5728
 epoch: 18, train_loss: 0.7973, test_loss: 0.8523, test_f1: 0.6026
 epoch: 19, train_loss: 0.7775, test_loss: 0.8365, test_f1: 0.5867
 epoch: 20, train_loss: 0.7847, test_loss: 0.9304, test_f1: 0.5218
 epoch: 21, train_loss: 0.7650, test_loss: 0.9074, test_f1: 0.5392
 epoch: 22, train_loss: 0.7893, test_loss: 0.8287, test_f1: 0.6210
 epoch: 23, train_loss: 0.7635, test_loss: 0.8830, test_f1: 0.5499
 epoch: 24, train_loss: 0.7662, test_loss: 0.8722, test_f1: 0.6155
 epoch: 25, train_loss: 0.7649, test_loss: 0.8433, test_f1: 0.5919
 epoch: 26, train_loss: 0.7641, test_loss: 0.8936, test_f1: 0.5800
 epoch: 27, train_loss: 0.7388, test_loss: 0.9215, test_f1: 0.5471
 epoch: 28, train_loss: 0.7472, test_loss: 0.8078, test_f1: 0.6261
 epoch: 29, train_loss: 0.7409, test_loss: 0.8391, test_f1: 0.6199
 epoch: 30, train_loss: 0.7371, test_loss: 0.8413, test_f1: 0.6006
 epoch: 31, train_loss: 0.7421, test_loss: 0.8412, test_f1: 0.5935
 epoch: 32, train_loss: 0.7241, test_loss: 0.8778, test_f1: 0.6026
 epoch: 33, train_loss: 0.7183, test_loss: 0.8078, test_f1: 0.6254
 epoch: 34, train_loss: 0.7253, test_loss: 0.8842, test_f1: 0.5851
 epoch: 35, train_loss: 0.7188, test_loss: 0.8263, test_f1: 0.6511
 epoch: 36, train_loss: 0.7031, test_loss: 0.8044, test_f1: 0.6153
 epoch: 37, train_loss: 0.7092, test_loss: 0.8186, test_f1: 0.5927
 epoch: 38, train_loss: 0.6965, test_loss: 0.8319, test_f1: 0.5944
 epoch: 39, train_loss: 0.7158, test_loss: 0.8191, test_f1: 0.6435
 epoch: 40, train_loss: 0.6940, test_loss: 0.7964, test_f1: 0.6030
 epoch: 41, train_loss: 0.6863, test_loss: 1.0032, test_f1: 0.5452
 epoch: 42, train_loss: 0.6948, test_loss: 0.8024, test_f1: 0.5791
 epoch: 43, train_loss: 0.6977, test_loss: 0.8258, test_f1: 0.6279
 epoch: 44, train_loss: 0.6857, test_loss: 0.7591, test_f1: 0.6368
 epoch: 45, train_loss: 0.6878, test_loss: 0.8906, test_f1: 0.6276
 epoch: 46, train_loss: 0.6765, test_loss: 0.8092, test_f1: 0.6011
 epoch: 47, train_loss: 0.6950, test_loss: 0.9166, test_f1: 0.5433
 epoch: 48, train_loss: 0.6820, test_loss: 0.7749, test_f1: 0.6317
 epoch: 49, train_loss: 0.6666, test_loss: 0.8035, test_f1: 0.6177
 epoch: 50, train_loss: 0.6806, test_loss: 0.8294, test_f1: 0.6217
 epoch: 51, train_loss: 0.6587, test_loss: 0.8289, test_f1: 0.6141
 epoch: 52, train_loss: 0.6520, test_loss: 0.7688, test_f1: 0.6560
 epoch: 53, train_loss: 0.6520, test_loss: 0.8425, test_f1: 0.6482
 epoch: 54, train_loss: 0.6477, test_loss: 0.7925, test_f1: 0.6714
 epoch: 55, train_loss: 0.6257, test_loss: 0.7600, test_f1: 0.6348
 epoch: 56, train_loss: 0.6453, test_loss: 0.7536, test_f1: 0.6444
 epoch: 57, train_loss: 0.6302, test_loss: 0.8096, test_f1: 0.6420
 epoch: 58, train_loss: 0.6230, test_loss: 0.7579, test_f1: 0.6674
 epoch: 59, train_loss: 0.6455, test_loss: 0.7555, test_f1: 0.6245
 epoch: 60, train_loss: 0.6307, test_loss: 0.7678, test_f1: 0.6417
 epoch: 61, train_loss: 0.6233, test_loss: 0.8161, test_f1: 0.6438
 epoch: 62, train_loss: 0.6277, test_loss: 0.7602, test_f1: 0.6284
 epoch: 63, train_loss: 0.6222, test_loss: 0.7823, test_f1: 0.6797
 epoch: 64, train_loss: 0.6238, test_loss: 0.8083, test_f1: 0.6406
 epoch: 65, train_loss: 0.6221, test_loss: 0.8139, test_f1: 0.6517
 epoch: 66, train_loss: 0.6173, test_loss: 0.9347, test_f1: 0.5985
 epoch: 67, train_loss: 0.6140, test_loss: 0.8261, test_f1: 0.6456
 epoch: 68, train_loss: 0.6218, test_loss: 0.7903, test_f1: 0.6375
 epoch: 69, train_loss: 0.6144, test_loss: 0.7943, test_f1: 0.6639
 epoch: 70, train_loss: 0.6191, test_loss: 0.8400, test_f1: 0.6452
 epoch: 71, train_loss: 0.6095, test_loss: 0.8905, test_f1: 0.6231
 epoch: 72, train_loss: 0.6242, test_loss: 0.7982, test_f1: 0.6667
 epoch: 73, train_loss: 0.6030, test_loss: 0.8318, test_f1: 0.6514
 epoch: 74, train_loss: 0.6054, test_loss: 0.7795, test_f1: 0.6742
 epoch: 75, train_loss: 0.6114, test_loss: 0.8535, test_f1: 0.6425
 epoch: 76, train_loss: 0.5977, test_loss: 0.8060, test_f1: 0.6730
 epoch: 77, train_loss: 0.6053, test_loss: 0.8545, test_f1: 0.6374
 epoch: 78, train_loss: 0.5940, test_loss: 0.8741, test_f1: 0.6534
 epoch: 79, train_loss: 0.5956, test_loss: 0.8293, test_f1: 0.6640
 epoch: 80, train_loss: 0.5846, test_loss: 0.8255, test_f1: 0.6585
 epoch: 81, train_loss: 0.5992, test_loss: 0.8140, test_f1: 0.6582
 epoch: 82, train_loss: 0.5970, test_loss: 0.8825, test_f1: 0.6749
 epoch: 83, train_loss: 0.5908, test_loss: 0.9088, test_f1: 0.6399
 epoch: 84, train_loss: 0.5898, test_loss: 0.8677, test_f1: 0.6524
 epoch: 85, train_loss: 0.6057, test_loss: 0.8900, test_f1: 0.6456
 epoch: 86, train_loss: 0.5858, test_loss: 0.8166, test_f1: 0.6651
 epoch: 87, train_loss: 0.5905, test_loss: 0.8345, test_f1: 0.6752
 epoch: 88, train_loss: 0.5915, test_loss: 0.8007, test_f1: 0.6491
 epoch: 89, train_loss: 0.5924, test_loss: 0.8213, test_f1: 0.6542
 epoch: 90, train_loss: 0.5876, test_loss: 0.8709, test_f1: 0.6339
 epoch: 91, train_loss: 0.5868, test_loss: 0.8904, test_f1: 0.6451
 epoch: 92, train_loss: 0.5748, test_loss: 0.9362, test_f1: 0.6295
 epoch: 93, train_loss: 0.5825, test_loss: 0.8112, test_f1: 0.6389
 epoch: 94, train_loss: 0.5635, test_loss: 0.8736, test_f1: 0.6485
 epoch: 95, train_loss: 0.5789, test_loss: 0.8531, test_f1: 0.6608
 epoch: 96, train_loss: 0.5863, test_loss: 0.8821, test_f1: 0.6537
 epoch: 97, train_loss: 0.5812, test_loss: 0.7819, test_f1: 0.6661
 epoch: 98, train_loss: 0.5564, test_loss: 0.8691, test_f1: 0.6497
 epoch: 99, train_loss: 0.5770, test_loss: 0.8848, test_f1: 0.6569
##################ITERATION #4 ****************************************
 epoch: 0, train_loss: 1.1604, test_loss: 1.0590, test_f1: 0.5174
 epoch: 1, train_loss: 1.0089, test_loss: 0.9883, test_f1: 0.4852
 epoch: 2, train_loss: 0.9760, test_loss: 0.9356, test_f1: 0.5053
 epoch: 3, train_loss: 0.9495, test_loss: 0.9082, test_f1: 0.5105
 epoch: 4, train_loss: 0.9287, test_loss: 0.8948, test_f1: 0.5562
 epoch: 5, train_loss: 0.9325, test_loss: 0.9878, test_f1: 0.5068
 epoch: 6, train_loss: 0.9038, test_loss: 0.8465, test_f1: 0.5637
 epoch: 7, train_loss: 0.8921, test_loss: 0.9297, test_f1: 0.5271
 epoch: 8, train_loss: 0.8843, test_loss: 0.8711, test_f1: 0.5674
 epoch: 9, train_loss: 0.8667, test_loss: 0.8653, test_f1: 0.5504
 epoch: 10, train_loss: 0.8637, test_loss: 0.8384, test_f1: 0.5559
 epoch: 11, train_loss: 0.8486, test_loss: 0.8701, test_f1: 0.5373
 epoch: 12, train_loss: 0.8520, test_loss: 0.8436, test_f1: 0.5721
 epoch: 13, train_loss: 0.8459, test_loss: 0.8459, test_f1: 0.6182
 epoch: 14, train_loss: 0.8431, test_loss: 0.9650, test_f1: 0.5282
 epoch: 15, train_loss: 0.8279, test_loss: 0.9081, test_f1: 0.5226
 epoch: 16, train_loss: 0.8230, test_loss: 0.9059, test_f1: 0.5589
 epoch: 17, train_loss: 0.8057, test_loss: 0.9746, test_f1: 0.5332
 epoch: 18, train_loss: 0.8065, test_loss: 0.8573, test_f1: 0.5671
 epoch: 19, train_loss: 0.7849, test_loss: 0.8545, test_f1: 0.5576
 epoch: 20, train_loss: 0.8079, test_loss: 0.8760, test_f1: 0.5464
 epoch: 21, train_loss: 0.7802, test_loss: 0.8188, test_f1: 0.6065
 epoch: 22, train_loss: 0.7797, test_loss: 0.9635, test_f1: 0.5139
 epoch: 23, train_loss: 0.7852, test_loss: 0.8668, test_f1: 0.5611
 epoch: 24, train_loss: 0.7629, test_loss: 0.8534, test_f1: 0.5839
 epoch: 25, train_loss: 0.7761, test_loss: 0.8435, test_f1: 0.5792
 epoch: 26, train_loss: 0.7538, test_loss: 0.8581, test_f1: 0.6005
 epoch: 27, train_loss: 0.7660, test_loss: 0.8487, test_f1: 0.5992
 epoch: 28, train_loss: 0.7667, test_loss: 0.8469, test_f1: 0.6007
 epoch: 29, train_loss: 0.7578, test_loss: 0.8419, test_f1: 0.6135
 epoch: 30, train_loss: 0.7567, test_loss: 0.8279, test_f1: 0.6106
 epoch: 31, train_loss: 0.7439, test_loss: 0.8883, test_f1: 0.5996
 epoch: 32, train_loss: 0.7472, test_loss: 0.8190, test_f1: 0.6038
 epoch: 33, train_loss: 0.7480, test_loss: 0.8105, test_f1: 0.6055
 epoch: 34, train_loss: 0.7375, test_loss: 0.7656, test_f1: 0.6077
 epoch: 35, train_loss: 0.7421, test_loss: 0.8224, test_f1: 0.6100
 epoch: 36, train_loss: 0.7405, test_loss: 0.7905, test_f1: 0.6430
 epoch: 37, train_loss: 0.7424, test_loss: 0.8307, test_f1: 0.6152
 epoch: 38, train_loss: 0.7337, test_loss: 0.8369, test_f1: 0.5677
 epoch: 39, train_loss: 0.7279, test_loss: 0.8441, test_f1: 0.6142
 epoch: 40, train_loss: 0.7337, test_loss: 0.8214, test_f1: 0.6070
 epoch: 41, train_loss: 0.7194, test_loss: 0.8554, test_f1: 0.5985
 epoch: 42, train_loss: 0.7298, test_loss: 0.9110, test_f1: 0.5933
 epoch: 43, train_loss: 0.7295, test_loss: 0.8124, test_f1: 0.5998
 epoch: 44, train_loss: 0.7094, test_loss: 0.8148, test_f1: 0.6050
 epoch: 45, train_loss: 0.7079, test_loss: 0.7934, test_f1: 0.6315
 epoch: 46, train_loss: 0.7057, test_loss: 0.7994, test_f1: 0.6323
 epoch: 47, train_loss: 0.7129, test_loss: 0.8416, test_f1: 0.5719
 epoch: 48, train_loss: 0.7049, test_loss: 0.7899, test_f1: 0.6386
 epoch: 49, train_loss: 0.7174, test_loss: 0.8089, test_f1: 0.6130
 epoch: 50, train_loss: 0.7012, test_loss: 0.8309, test_f1: 0.6196
 epoch: 51, train_loss: 0.7015, test_loss: 0.8488, test_f1: 0.5994
 epoch: 52, train_loss: 0.6719, test_loss: 0.8257, test_f1: 0.6066
 epoch: 53, train_loss: 0.6781, test_loss: 0.8035, test_f1: 0.6355
 epoch: 54, train_loss: 0.6613, test_loss: 0.7993, test_f1: 0.6248
 epoch: 55, train_loss: 0.6640, test_loss: 0.7958, test_f1: 0.6089
 epoch: 56, train_loss: 0.6666, test_loss: 0.8633, test_f1: 0.6112
 epoch: 57, train_loss: 0.6695, test_loss: 0.8584, test_f1: 0.6155
 epoch: 58, train_loss: 0.6623, test_loss: 0.8132, test_f1: 0.6053
 epoch: 59, train_loss: 0.6626, test_loss: 0.8131, test_f1: 0.6115
 epoch: 60, train_loss: 0.6504, test_loss: 0.8121, test_f1: 0.5974
 epoch: 61, train_loss: 0.6502, test_loss: 0.8187, test_f1: 0.6304
 epoch: 62, train_loss: 0.6580, test_loss: 0.8100, test_f1: 0.6274
 epoch: 63, train_loss: 0.6413, test_loss: 0.8308, test_f1: 0.6155
 epoch: 64, train_loss: 0.6488, test_loss: 0.8378, test_f1: 0.6294
 epoch: 65, train_loss: 0.6410, test_loss: 0.8377, test_f1: 0.5995
 epoch: 66, train_loss: 0.6477, test_loss: 0.8342, test_f1: 0.6289
 epoch: 67, train_loss: 0.6472, test_loss: 0.8158, test_f1: 0.6241
 epoch: 68, train_loss: 0.6518, test_loss: 0.8569, test_f1: 0.6059
 epoch: 69, train_loss: 0.6412, test_loss: 0.9207, test_f1: 0.5806
 epoch: 70, train_loss: 0.6404, test_loss: 0.8418, test_f1: 0.6148
 epoch: 71, train_loss: 0.6425, test_loss: 0.7953, test_f1: 0.6281
 epoch: 72, train_loss: 0.6445, test_loss: 0.7970, test_f1: 0.6187
 epoch: 73, train_loss: 0.6473, test_loss: 0.8456, test_f1: 0.6038
 epoch: 74, train_loss: 0.6267, test_loss: 0.8048, test_f1: 0.6268
 epoch: 75, train_loss: 0.6429, test_loss: 0.8082, test_f1: 0.6246
 epoch: 76, train_loss: 0.6273, test_loss: 0.7994, test_f1: 0.6079
 epoch: 77, train_loss: 0.6284, test_loss: 0.8241, test_f1: 0.6238
 epoch: 78, train_loss: 0.6207, test_loss: 0.9248, test_f1: 0.5792
 epoch: 79, train_loss: 0.6232, test_loss: 0.8195, test_f1: 0.6228
 epoch: 80, train_loss: 0.6465, test_loss: 0.8204, test_f1: 0.6112
 epoch: 81, train_loss: 0.6290, test_loss: 0.8511, test_f1: 0.5901
 epoch: 82, train_loss: 0.6258, test_loss: 0.8470, test_f1: 0.5992
 epoch: 83, train_loss: 0.6298, test_loss: 0.8477, test_f1: 0.6132
 epoch: 84, train_loss: 0.6207, test_loss: 0.8174, test_f1: 0.6147
 epoch: 85, train_loss: 0.6215, test_loss: 0.8233, test_f1: 0.6214
 epoch: 86, train_loss: 0.6246, test_loss: 0.8878, test_f1: 0.5737
 epoch: 87, train_loss: 0.6289, test_loss: 0.8641, test_f1: 0.6059
 epoch: 88, train_loss: 0.6287, test_loss: 0.8725, test_f1: 0.6078
 epoch: 89, train_loss: 0.6275, test_loss: 0.8831, test_f1: 0.6120
 epoch: 90, train_loss: 0.6213, test_loss: 0.8528, test_f1: 0.5951
 epoch: 91, train_loss: 0.6277, test_loss: 0.8314, test_f1: 0.6292
 epoch: 92, train_loss: 0.6062, test_loss: 0.8272, test_f1: 0.6239
 epoch: 93, train_loss: 0.6293, test_loss: 0.7931, test_f1: 0.6372
 epoch: 94, train_loss: 0.6185, test_loss: 0.8483, test_f1: 0.6294
 epoch: 95, train_loss: 0.6193, test_loss: 0.9063, test_f1: 0.6168
 epoch: 96, train_loss: 0.6077, test_loss: 0.9555, test_f1: 0.5944
 epoch: 97, train_loss: 0.6026, test_loss: 0.8105, test_f1: 0.6256
 epoch: 98, train_loss: 0.6091, test_loss: 0.9024, test_f1: 0.6090
 epoch: 99, train_loss: 0.6141, test_loss: 0.9478, test_f1: 0.5834
##################ITERATION #5 ****************************************
 epoch: 0, train_loss: 1.1622, test_loss: 0.9868, test_f1: 0.5195
 epoch: 1, train_loss: 1.0039, test_loss: 0.9767, test_f1: 0.4539
 epoch: 2, train_loss: 0.9759, test_loss: 0.9491, test_f1: 0.5259
 epoch: 3, train_loss: 0.9554, test_loss: 0.9342, test_f1: 0.5441
 epoch: 4, train_loss: 0.9502, test_loss: 0.9355, test_f1: 0.5059
 epoch: 5, train_loss: 0.9351, test_loss: 0.9074, test_f1: 0.5459
 epoch: 6, train_loss: 0.9180, test_loss: 0.9070, test_f1: 0.5410
 epoch: 7, train_loss: 0.9064, test_loss: 0.8898, test_f1: 0.5792
 epoch: 8, train_loss: 0.8878, test_loss: 0.8955, test_f1: 0.5523
 epoch: 9, train_loss: 0.8849, test_loss: 0.8537, test_f1: 0.5472
 epoch: 10, train_loss: 0.8620, test_loss: 0.8395, test_f1: 0.5737
 epoch: 11, train_loss: 0.8603, test_loss: 0.8703, test_f1: 0.5405
 epoch: 12, train_loss: 0.8500, test_loss: 0.8462, test_f1: 0.5774
 epoch: 13, train_loss: 0.8563, test_loss: 0.8893, test_f1: 0.5277
 epoch: 14, train_loss: 0.8510, test_loss: 0.8491, test_f1: 0.5612
 epoch: 15, train_loss: 0.8340, test_loss: 0.8419, test_f1: 0.5549
 epoch: 16, train_loss: 0.8288, test_loss: 0.8458, test_f1: 0.5486
 epoch: 17, train_loss: 0.8133, test_loss: 0.9459, test_f1: 0.5095
 epoch: 18, train_loss: 0.8113, test_loss: 0.8463, test_f1: 0.5616
 epoch: 19, train_loss: 0.8077, test_loss: 0.8850, test_f1: 0.5463
 epoch: 20, train_loss: 0.8036, test_loss: 0.8367, test_f1: 0.5663
 epoch: 21, train_loss: 0.7882, test_loss: 0.8565, test_f1: 0.5746
 epoch: 22, train_loss: 0.7942, test_loss: 0.8126, test_f1: 0.5913
 epoch: 23, train_loss: 0.7821, test_loss: 0.8217, test_f1: 0.5865
 epoch: 24, train_loss: 0.7665, test_loss: 0.8766, test_f1: 0.5858
 epoch: 25, train_loss: 0.7765, test_loss: 0.8488, test_f1: 0.5974
 epoch: 26, train_loss: 0.7803, test_loss: 0.8551, test_f1: 0.5886
 epoch: 27, train_loss: 0.7569, test_loss: 0.8181, test_f1: 0.6269
 epoch: 28, train_loss: 0.7575, test_loss: 0.8668, test_f1: 0.5972
 epoch: 29, train_loss: 0.7610, test_loss: 0.8308, test_f1: 0.6024
 epoch: 30, train_loss: 0.7360, test_loss: 0.8076, test_f1: 0.6044
 epoch: 31, train_loss: 0.7444, test_loss: 0.8564, test_f1: 0.5964
 epoch: 32, train_loss: 0.7435, test_loss: 0.8878, test_f1: 0.5673
 epoch: 33, train_loss: 0.7317, test_loss: 0.8484, test_f1: 0.6105
 epoch: 34, train_loss: 0.7316, test_loss: 0.8126, test_f1: 0.6178
 epoch: 35, train_loss: 0.7434, test_loss: 0.8096, test_f1: 0.6320
 epoch: 36, train_loss: 0.7207, test_loss: 0.8536, test_f1: 0.6122
 epoch: 37, train_loss: 0.7347, test_loss: 0.9175, test_f1: 0.5670
 epoch: 38, train_loss: 0.7244, test_loss: 0.8204, test_f1: 0.6343
 epoch: 39, train_loss: 0.7212, test_loss: 0.9335, test_f1: 0.5775
 epoch: 40, train_loss: 0.7053, test_loss: 0.8637, test_f1: 0.5851
 epoch: 41, train_loss: 0.7192, test_loss: 0.7974, test_f1: 0.6502
 epoch: 42, train_loss: 0.7249, test_loss: 0.7832, test_f1: 0.6352
 epoch: 43, train_loss: 0.6861, test_loss: 0.8096, test_f1: 0.6230
 epoch: 44, train_loss: 0.7063, test_loss: 0.8313, test_f1: 0.6367
 epoch: 45, train_loss: 0.7030, test_loss: 0.8004, test_f1: 0.6192
 epoch: 46, train_loss: 0.6925, test_loss: 0.8334, test_f1: 0.6377
 epoch: 47, train_loss: 0.6941, test_loss: 0.8318, test_f1: 0.5953
 epoch: 48, train_loss: 0.6888, test_loss: 0.8277, test_f1: 0.6318
 epoch: 49, train_loss: 0.6822, test_loss: 0.8363, test_f1: 0.5985
 epoch: 50, train_loss: 0.6896, test_loss: 0.8970, test_f1: 0.5901
 epoch: 51, train_loss: 0.6781, test_loss: 0.8103, test_f1: 0.6360
 epoch: 52, train_loss: 0.6698, test_loss: 0.8544, test_f1: 0.6123
 epoch: 53, train_loss: 0.6674, test_loss: 0.8418, test_f1: 0.6187
 epoch: 54, train_loss: 0.6439, test_loss: 0.8640, test_f1: 0.6279
 epoch: 55, train_loss: 0.6514, test_loss: 0.8452, test_f1: 0.6320
 epoch: 56, train_loss: 0.6486, test_loss: 0.8460, test_f1: 0.6406
 epoch: 57, train_loss: 0.6430, test_loss: 0.8368, test_f1: 0.6275
 epoch: 58, train_loss: 0.6472, test_loss: 0.8119, test_f1: 0.6706
 epoch: 59, train_loss: 0.6444, test_loss: 0.8288, test_f1: 0.6187
 epoch: 60, train_loss: 0.6360, test_loss: 0.8353, test_f1: 0.6556
 epoch: 61, train_loss: 0.6488, test_loss: 0.8124, test_f1: 0.6459
 epoch: 62, train_loss: 0.6345, test_loss: 0.8271, test_f1: 0.6380
 epoch: 63, train_loss: 0.6519, test_loss: 0.8339, test_f1: 0.6425
 epoch: 64, train_loss: 0.6501, test_loss: 0.8585, test_f1: 0.6388
 epoch: 65, train_loss: 0.6335, test_loss: 0.8464, test_f1: 0.6299
 epoch: 66, train_loss: 0.6291, test_loss: 0.8067, test_f1: 0.6413
 epoch: 67, train_loss: 0.6390, test_loss: 0.8168, test_f1: 0.6319
 epoch: 68, train_loss: 0.6338, test_loss: 0.8600, test_f1: 0.6257
 epoch: 69, train_loss: 0.6287, test_loss: 0.8573, test_f1: 0.6500
 epoch: 70, train_loss: 0.6198, test_loss: 0.8515, test_f1: 0.6478
 epoch: 71, train_loss: 0.6221, test_loss: 0.8186, test_f1: 0.6559
 epoch: 72, train_loss: 0.6215, test_loss: 0.8786, test_f1: 0.6469
 epoch: 73, train_loss: 0.6184, test_loss: 0.8598, test_f1: 0.6419
 epoch: 74, train_loss: 0.6144, test_loss: 0.8629, test_f1: 0.6443
 epoch: 75, train_loss: 0.6248, test_loss: 0.9104, test_f1: 0.6122
 epoch: 76, train_loss: 0.6291, test_loss: 0.8324, test_f1: 0.6445
 epoch: 77, train_loss: 0.6140, test_loss: 0.8616, test_f1: 0.6322
 epoch: 78, train_loss: 0.6130, test_loss: 0.8524, test_f1: 0.6349
 epoch: 79, train_loss: 0.6166, test_loss: 0.8549, test_f1: 0.6338
 epoch: 80, train_loss: 0.6115, test_loss: 0.9172, test_f1: 0.6416
 epoch: 81, train_loss: 0.6235, test_loss: 0.8602, test_f1: 0.6228
 epoch: 82, train_loss: 0.6084, test_loss: 0.8694, test_f1: 0.6487
 epoch: 83, train_loss: 0.6015, test_loss: 0.8351, test_f1: 0.6243
 epoch: 84, train_loss: 0.6122, test_loss: 0.8857, test_f1: 0.6369
 epoch: 85, train_loss: 0.6010, test_loss: 0.8810, test_f1: 0.6363
 epoch: 86, train_loss: 0.6160, test_loss: 0.8405, test_f1: 0.6278
 epoch: 87, train_loss: 0.6026, test_loss: 0.8366, test_f1: 0.6524
 epoch: 88, train_loss: 0.5899, test_loss: 0.8291, test_f1: 0.6387
 epoch: 89, train_loss: 0.5954, test_loss: 0.8126, test_f1: 0.6377
 epoch: 90, train_loss: 0.5857, test_loss: 0.8280, test_f1: 0.6360
 epoch: 91, train_loss: 0.5907, test_loss: 0.8451, test_f1: 0.6329
 epoch: 92, train_loss: 0.6039, test_loss: 0.8171, test_f1: 0.6412
 epoch: 93, train_loss: 0.5845, test_loss: 0.8119, test_f1: 0.6547
 epoch: 94, train_loss: 0.5902, test_loss: 0.8160, test_f1: 0.6588
 epoch: 95, train_loss: 0.5882, test_loss: 0.8467, test_f1: 0.6467
 epoch: 96, train_loss: 0.5799, test_loss: 0.8497, test_f1: 0.6444
 epoch: 97, train_loss: 0.5888, test_loss: 0.8428, test_f1: 0.6243
 epoch: 98, train_loss: 0.5893, test_loss: 0.8917, test_f1: 0.6637
 epoch: 99, train_loss: 0.5953, test_loss: 0.9225, test_f1: 0.6423
##################ITERATION #6 ****************************************
 epoch: 0, train_loss: 1.2054, test_loss: 1.0090, test_f1: 0.4683
 epoch: 1, train_loss: 1.0398, test_loss: 0.9916, test_f1: 0.4935
 epoch: 2, train_loss: 1.0200, test_loss: 0.9928, test_f1: 0.4740
 epoch: 3, train_loss: 0.9990, test_loss: 0.9875, test_f1: 0.4739
 epoch: 4, train_loss: 0.9787, test_loss: 0.9573, test_f1: 0.5039
 epoch: 5, train_loss: 0.9603, test_loss: 0.9266, test_f1: 0.5178
 epoch: 6, train_loss: 0.9389, test_loss: 0.9543, test_f1: 0.5270
 epoch: 7, train_loss: 0.9211, test_loss: 0.9556, test_f1: 0.4857
 epoch: 8, train_loss: 0.9244, test_loss: 0.8387, test_f1: 0.5498
 epoch: 9, train_loss: 0.9133, test_loss: 0.9200, test_f1: 0.5399
 epoch: 10, train_loss: 0.8925, test_loss: 0.9284, test_f1: 0.5643
 epoch: 11, train_loss: 0.8767, test_loss: 0.9083, test_f1: 0.5800
 epoch: 12, train_loss: 0.8744, test_loss: 0.9323, test_f1: 0.5252
 epoch: 13, train_loss: 0.8633, test_loss: 0.8810, test_f1: 0.5667
 epoch: 14, train_loss: 0.8521, test_loss: 0.8869, test_f1: 0.5145
 epoch: 15, train_loss: 0.8428, test_loss: 0.8575, test_f1: 0.5760
 epoch: 16, train_loss: 0.8349, test_loss: 0.8478, test_f1: 0.5974
 epoch: 17, train_loss: 0.8280, test_loss: 0.8187, test_f1: 0.5656
 epoch: 18, train_loss: 0.8173, test_loss: 0.8769, test_f1: 0.5131
 epoch: 19, train_loss: 0.8011, test_loss: 0.8291, test_f1: 0.5367
 epoch: 20, train_loss: 0.8033, test_loss: 0.8282, test_f1: 0.5520
 epoch: 21, train_loss: 0.8010, test_loss: 0.8354, test_f1: 0.5619
 epoch: 22, train_loss: 0.7916, test_loss: 0.8202, test_f1: 0.5645
 epoch: 23, train_loss: 0.7787, test_loss: 0.8185, test_f1: 0.5840
 epoch: 24, train_loss: 0.7732, test_loss: 0.8263, test_f1: 0.5762
 epoch: 25, train_loss: 0.7688, test_loss: 0.8104, test_f1: 0.5900
 epoch: 26, train_loss: 0.7738, test_loss: 0.8436, test_f1: 0.5815
 epoch: 27, train_loss: 0.7598, test_loss: 0.8212, test_f1: 0.5930
 epoch: 28, train_loss: 0.7489, test_loss: 0.7648, test_f1: 0.5671
 epoch: 29, train_loss: 0.7558, test_loss: 0.8310, test_f1: 0.5880
 epoch: 30, train_loss: 0.7460, test_loss: 0.8273, test_f1: 0.5812
 epoch: 31, train_loss: 0.7439, test_loss: 0.8452, test_f1: 0.5835
 epoch: 32, train_loss: 0.7427, test_loss: 0.8387, test_f1: 0.5421
 epoch: 33, train_loss: 0.7338, test_loss: 0.8056, test_f1: 0.5560
 epoch: 34, train_loss: 0.7194, test_loss: 0.8287, test_f1: 0.5868
 epoch: 35, train_loss: 0.7287, test_loss: 0.8615, test_f1: 0.5800
 epoch: 36, train_loss: 0.7333, test_loss: 0.8658, test_f1: 0.5419
 epoch: 37, train_loss: 0.7153, test_loss: 0.7906, test_f1: 0.5602
 epoch: 38, train_loss: 0.7141, test_loss: 0.8296, test_f1: 0.5583
 epoch: 39, train_loss: 0.7138, test_loss: 0.8366, test_f1: 0.5653
 epoch: 40, train_loss: 0.7189, test_loss: 0.8805, test_f1: 0.6002
 epoch: 41, train_loss: 0.7044, test_loss: 0.8534, test_f1: 0.5839
 epoch: 42, train_loss: 0.7225, test_loss: 0.9009, test_f1: 0.6008
 epoch: 43, train_loss: 0.7045, test_loss: 0.8027, test_f1: 0.6252
 epoch: 44, train_loss: 0.6944, test_loss: 0.8100, test_f1: 0.5883
 epoch: 45, train_loss: 0.6909, test_loss: 0.7919, test_f1: 0.6132
 epoch: 46, train_loss: 0.6986, test_loss: 0.8370, test_f1: 0.5634
 epoch: 47, train_loss: 0.6867, test_loss: 0.8151, test_f1: 0.6140
 epoch: 48, train_loss: 0.6955, test_loss: 0.7695, test_f1: 0.5858
 epoch: 49, train_loss: 0.6795, test_loss: 0.7889, test_f1: 0.6160
 epoch: 50, train_loss: 0.6786, test_loss: 0.8401, test_f1: 0.5927
 epoch: 51, train_loss: 0.6561, test_loss: 0.7950, test_f1: 0.6189
 epoch: 52, train_loss: 0.6389, test_loss: 0.7866, test_f1: 0.6085
 epoch: 53, train_loss: 0.6455, test_loss: 0.7840, test_f1: 0.6184
 epoch: 54, train_loss: 0.6494, test_loss: 0.7978, test_f1: 0.6090
 epoch: 55, train_loss: 0.6483, test_loss: 0.7619, test_f1: 0.6163
 epoch: 56, train_loss: 0.6538, test_loss: 0.7345, test_f1: 0.6313
 epoch: 57, train_loss: 0.6312, test_loss: 0.7552, test_f1: 0.6317
 epoch: 58, train_loss: 0.6466, test_loss: 0.7914, test_f1: 0.6308
 epoch: 59, train_loss: 0.6485, test_loss: 0.7910, test_f1: 0.6333
 epoch: 60, train_loss: 0.6330, test_loss: 0.8159, test_f1: 0.6180
 epoch: 61, train_loss: 0.6336, test_loss: 0.8038, test_f1: 0.6135
 epoch: 62, train_loss: 0.6288, test_loss: 0.7943, test_f1: 0.6153
 epoch: 63, train_loss: 0.6214, test_loss: 0.8610, test_f1: 0.6040
 epoch: 64, train_loss: 0.6255, test_loss: 0.7845, test_f1: 0.6268
 epoch: 65, train_loss: 0.6310, test_loss: 0.8604, test_f1: 0.6179
 epoch: 66, train_loss: 0.6307, test_loss: 0.8044, test_f1: 0.6087
 epoch: 67, train_loss: 0.6388, test_loss: 0.7754, test_f1: 0.6174
 epoch: 68, train_loss: 0.6278, test_loss: 0.8025, test_f1: 0.6411
 epoch: 69, train_loss: 0.6201, test_loss: 0.8193, test_f1: 0.6210
 epoch: 70, train_loss: 0.6163, test_loss: 0.7880, test_f1: 0.6350
 epoch: 71, train_loss: 0.6237, test_loss: 0.8430, test_f1: 0.6028
 epoch: 72, train_loss: 0.6224, test_loss: 0.8162, test_f1: 0.6174
 epoch: 73, train_loss: 0.6287, test_loss: 0.8118, test_f1: 0.6343
 epoch: 74, train_loss: 0.6136, test_loss: 0.7859, test_f1: 0.6294
 epoch: 75, train_loss: 0.6113, test_loss: 0.7843, test_f1: 0.6377
 epoch: 76, train_loss: 0.6163, test_loss: 0.8279, test_f1: 0.6255
 epoch: 77, train_loss: 0.5991, test_loss: 0.8266, test_f1: 0.6143
 epoch: 78, train_loss: 0.6048, test_loss: 0.8126, test_f1: 0.6406
 epoch: 79, train_loss: 0.6121, test_loss: 0.8015, test_f1: 0.6304
 epoch: 80, train_loss: 0.5998, test_loss: 0.7953, test_f1: 0.6316
 epoch: 81, train_loss: 0.6040, test_loss: 0.8026, test_f1: 0.6433
 epoch: 82, train_loss: 0.6031, test_loss: 0.7467, test_f1: 0.6541
 epoch: 83, train_loss: 0.5908, test_loss: 0.7866, test_f1: 0.6350
 epoch: 84, train_loss: 0.5887, test_loss: 0.8282, test_f1: 0.6246
 epoch: 85, train_loss: 0.6012, test_loss: 0.8270, test_f1: 0.6154
 epoch: 86, train_loss: 0.5986, test_loss: 0.8227, test_f1: 0.6109
 epoch: 87, train_loss: 0.5953, test_loss: 0.7948, test_f1: 0.6241
 epoch: 88, train_loss: 0.5968, test_loss: 0.8315, test_f1: 0.6311
 epoch: 89, train_loss: 0.5955, test_loss: 0.8031, test_f1: 0.6209
 epoch: 90, train_loss: 0.5956, test_loss: 0.7814, test_f1: 0.6421
 epoch: 91, train_loss: 0.5835, test_loss: 0.7673, test_f1: 0.6262
 epoch: 92, train_loss: 0.5830, test_loss: 0.8295, test_f1: 0.6348
 epoch: 93, train_loss: 0.5730, test_loss: 0.8058, test_f1: 0.6227
 epoch: 94, train_loss: 0.5873, test_loss: 0.8323, test_f1: 0.6124
 epoch: 95, train_loss: 0.5939, test_loss: 0.8734, test_f1: 0.6246
 epoch: 96, train_loss: 0.5756, test_loss: 0.8467, test_f1: 0.6162
 epoch: 97, train_loss: 0.5956, test_loss: 0.8225, test_f1: 0.6335
 epoch: 98, train_loss: 0.5817, test_loss: 0.8080, test_f1: 0.6269
 epoch: 99, train_loss: 0.5737, test_loss: 0.8223, test_f1: 0.6259
##################ITERATION #7 ****************************************
 epoch: 0, train_loss: 1.2106, test_loss: 1.0013, test_f1: 0.5097
 epoch: 1, train_loss: 1.0349, test_loss: 1.0236, test_f1: 0.4974
 epoch: 2, train_loss: 1.0001, test_loss: 1.0007, test_f1: 0.5013
 epoch: 3, train_loss: 0.9826, test_loss: 0.9561, test_f1: 0.5503
 epoch: 4, train_loss: 0.9494, test_loss: 0.9744, test_f1: 0.4972
 epoch: 5, train_loss: 0.9353, test_loss: 1.0092, test_f1: 0.5194
 epoch: 6, train_loss: 0.9231, test_loss: 0.9326, test_f1: 0.5586
 epoch: 7, train_loss: 0.8930, test_loss: 0.9205, test_f1: 0.5466
 epoch: 8, train_loss: 0.9033, test_loss: 1.0878, test_f1: 0.4476
 epoch: 9, train_loss: 0.8698, test_loss: 0.8922, test_f1: 0.5551
 epoch: 10, train_loss: 0.8804, test_loss: 0.8716, test_f1: 0.5708
 epoch: 11, train_loss: 0.8542, test_loss: 0.9143, test_f1: 0.5240
 epoch: 12, train_loss: 0.8532, test_loss: 0.9015, test_f1: 0.5660
 epoch: 13, train_loss: 0.8517, test_loss: 0.8700, test_f1: 0.5631
 epoch: 14, train_loss: 0.8468, test_loss: 0.8945, test_f1: 0.5468
 epoch: 15, train_loss: 0.8564, test_loss: 0.8551, test_f1: 0.5580
 epoch: 16, train_loss: 0.8226, test_loss: 0.8873, test_f1: 0.5365
 epoch: 17, train_loss: 0.8229, test_loss: 0.9206, test_f1: 0.5612
 epoch: 18, train_loss: 0.8122, test_loss: 0.9042, test_f1: 0.5230
 epoch: 19, train_loss: 0.8138, test_loss: 0.8772, test_f1: 0.5731
 epoch: 20, train_loss: 0.7987, test_loss: 0.8629, test_f1: 0.5638
 epoch: 21, train_loss: 0.7905, test_loss: 0.8740, test_f1: 0.5452
 epoch: 22, train_loss: 0.8023, test_loss: 0.8560, test_f1: 0.5831
 epoch: 23, train_loss: 0.7860, test_loss: 0.9388, test_f1: 0.5521
 epoch: 24, train_loss: 0.7812, test_loss: 0.8452, test_f1: 0.5540
 epoch: 25, train_loss: 0.7690, test_loss: 0.8769, test_f1: 0.5392
 epoch: 26, train_loss: 0.7651, test_loss: 0.8140, test_f1: 0.5804
 epoch: 27, train_loss: 0.7674, test_loss: 0.8974, test_f1: 0.5439
 epoch: 28, train_loss: 0.7672, test_loss: 0.8512, test_f1: 0.5638
 epoch: 29, train_loss: 0.7692, test_loss: 0.8153, test_f1: 0.5802
 epoch: 30, train_loss: 0.7705, test_loss: 0.8328, test_f1: 0.5580
 epoch: 31, train_loss: 0.7520, test_loss: 0.8914, test_f1: 0.5383
 epoch: 32, train_loss: 0.7601, test_loss: 0.9056, test_f1: 0.5577
 epoch: 33, train_loss: 0.7517, test_loss: 0.9021, test_f1: 0.5609
 epoch: 34, train_loss: 0.7404, test_loss: 0.8524, test_f1: 0.5736
 epoch: 35, train_loss: 0.7559, test_loss: 0.9032, test_f1: 0.5648
 epoch: 36, train_loss: 0.7457, test_loss: 0.9140, test_f1: 0.5660
 epoch: 37, train_loss: 0.7289, test_loss: 0.8744, test_f1: 0.5636
 epoch: 38, train_loss: 0.7339, test_loss: 0.9213, test_f1: 0.5378
 epoch: 39, train_loss: 0.7250, test_loss: 0.8216, test_f1: 0.6384
 epoch: 40, train_loss: 0.7362, test_loss: 0.8527, test_f1: 0.6119
 epoch: 41, train_loss: 0.7291, test_loss: 0.9032, test_f1: 0.5936
 epoch: 42, train_loss: 0.7216, test_loss: 0.8651, test_f1: 0.5858
 epoch: 43, train_loss: 0.7111, test_loss: 0.8312, test_f1: 0.5928
 epoch: 44, train_loss: 0.7154, test_loss: 0.8505, test_f1: 0.5934
 epoch: 45, train_loss: 0.7158, test_loss: 0.8704, test_f1: 0.5488
 epoch: 46, train_loss: 0.7169, test_loss: 0.8554, test_f1: 0.6273
 epoch: 47, train_loss: 0.7248, test_loss: 0.8622, test_f1: 0.6019
 epoch: 48, train_loss: 0.7122, test_loss: 0.8950, test_f1: 0.6003
 epoch: 49, train_loss: 0.7047, test_loss: 0.8404, test_f1: 0.6243
 epoch: 50, train_loss: 0.6968, test_loss: 0.8312, test_f1: 0.6223
 epoch: 51, train_loss: 0.6881, test_loss: 0.8575, test_f1: 0.5965
 epoch: 52, train_loss: 0.6746, test_loss: 0.8478, test_f1: 0.6072
 epoch: 53, train_loss: 0.6854, test_loss: 0.8121, test_f1: 0.6336
 epoch: 54, train_loss: 0.6653, test_loss: 0.8481, test_f1: 0.6212
 epoch: 55, train_loss: 0.6657, test_loss: 0.8688, test_f1: 0.6096
 epoch: 56, train_loss: 0.6629, test_loss: 0.8835, test_f1: 0.6012
 epoch: 57, train_loss: 0.6748, test_loss: 0.8552, test_f1: 0.6130
 epoch: 58, train_loss: 0.6575, test_loss: 0.9420, test_f1: 0.5937
 epoch: 59, train_loss: 0.6542, test_loss: 0.8835, test_f1: 0.6311
 epoch: 60, train_loss: 0.6509, test_loss: 0.8717, test_f1: 0.6205
 epoch: 61, train_loss: 0.6651, test_loss: 0.9669, test_f1: 0.5791
 epoch: 62, train_loss: 0.6634, test_loss: 0.8569, test_f1: 0.6244
 epoch: 63, train_loss: 0.6471, test_loss: 0.8511, test_f1: 0.6182
 epoch: 64, train_loss: 0.6536, test_loss: 0.8868, test_f1: 0.6025
 epoch: 65, train_loss: 0.6564, test_loss: 0.8611, test_f1: 0.6278
 epoch: 66, train_loss: 0.6523, test_loss: 0.8655, test_f1: 0.6141
 epoch: 67, train_loss: 0.6510, test_loss: 0.8241, test_f1: 0.6508
 epoch: 68, train_loss: 0.6444, test_loss: 0.8688, test_f1: 0.6158
 epoch: 69, train_loss: 0.6448, test_loss: 0.8655, test_f1: 0.6367
 epoch: 70, train_loss: 0.6459, test_loss: 0.9290, test_f1: 0.6116
 epoch: 71, train_loss: 0.6369, test_loss: 0.8476, test_f1: 0.6353
 epoch: 72, train_loss: 0.6564, test_loss: 0.8650, test_f1: 0.6312
 epoch: 73, train_loss: 0.6432, test_loss: 0.8693, test_f1: 0.6341
 epoch: 74, train_loss: 0.6445, test_loss: 0.8873, test_f1: 0.6086
 epoch: 75, train_loss: 0.6291, test_loss: 0.8871, test_f1: 0.6309
 epoch: 76, train_loss: 0.6359, test_loss: 0.9184, test_f1: 0.6218
 epoch: 77, train_loss: 0.6372, test_loss: 0.8461, test_f1: 0.6423
 epoch: 78, train_loss: 0.6298, test_loss: 0.8630, test_f1: 0.6397
 epoch: 79, train_loss: 0.6363, test_loss: 0.9513, test_f1: 0.6229
 epoch: 80, train_loss: 0.6222, test_loss: 0.8687, test_f1: 0.6286
 epoch: 81, train_loss: 0.6238, test_loss: 0.8714, test_f1: 0.6358
 epoch: 82, train_loss: 0.6182, test_loss: 0.8820, test_f1: 0.6192
 epoch: 83, train_loss: 0.6324, test_loss: 0.9108, test_f1: 0.6169
 epoch: 84, train_loss: 0.6413, test_loss: 0.8875, test_f1: 0.6474
 epoch: 85, train_loss: 0.6203, test_loss: 0.9801, test_f1: 0.6067
 epoch: 86, train_loss: 0.6226, test_loss: 0.8607, test_f1: 0.6270
 epoch: 87, train_loss: 0.6229, test_loss: 1.0190, test_f1: 0.5750
 epoch: 88, train_loss: 0.6222, test_loss: 0.9014, test_f1: 0.6282
 epoch: 89, train_loss: 0.6206, test_loss: 0.8774, test_f1: 0.6405
 epoch: 90, train_loss: 0.6296, test_loss: 1.0119, test_f1: 0.6100
 epoch: 91, train_loss: 0.6190, test_loss: 0.9290, test_f1: 0.6227
 epoch: 92, train_loss: 0.6131, test_loss: 0.9844, test_f1: 0.6182
 epoch: 93, train_loss: 0.6271, test_loss: 0.9163, test_f1: 0.6185
 epoch: 94, train_loss: 0.6178, test_loss: 0.8702, test_f1: 0.6412
 epoch: 95, train_loss: 0.6107, test_loss: 0.8711, test_f1: 0.6508
 epoch: 96, train_loss: 0.6139, test_loss: 0.9140, test_f1: 0.6131
 epoch: 97, train_loss: 0.6194, test_loss: 0.9533, test_f1: 0.6241
 epoch: 98, train_loss: 0.6209, test_loss: 0.9715, test_f1: 0.6152
 epoch: 99, train_loss: 0.6085, test_loss: 0.9788, test_f1: 0.6076
##################ITERATION #8 ****************************************
 epoch: 0, train_loss: 1.1691, test_loss: 1.0654, test_f1: 0.5027
 epoch: 1, train_loss: 1.0344, test_loss: 1.0943, test_f1: 0.4505
 epoch: 2, train_loss: 1.0065, test_loss: 1.0149, test_f1: 0.5040
 epoch: 3, train_loss: 0.9821, test_loss: 0.9948, test_f1: 0.5231
 epoch: 4, train_loss: 0.9623, test_loss: 0.9754, test_f1: 0.5179
 epoch: 5, train_loss: 0.9514, test_loss: 0.9950, test_f1: 0.5300
 epoch: 6, train_loss: 0.9333, test_loss: 0.9617, test_f1: 0.5065
 epoch: 7, train_loss: 0.9340, test_loss: 0.9787, test_f1: 0.5014
 epoch: 8, train_loss: 0.9117, test_loss: 1.0565, test_f1: 0.4776
 epoch: 9, train_loss: 0.9127, test_loss: 0.9870, test_f1: 0.4866
 epoch: 10, train_loss: 0.9052, test_loss: 0.9748, test_f1: 0.4623
 epoch: 11, train_loss: 0.8860, test_loss: 0.9613, test_f1: 0.5240
 epoch: 12, train_loss: 0.8935, test_loss: 0.9453, test_f1: 0.5219
 epoch: 13, train_loss: 0.8672, test_loss: 1.0031, test_f1: 0.4706
 epoch: 14, train_loss: 0.8691, test_loss: 0.9241, test_f1: 0.5443
 epoch: 15, train_loss: 0.8712, test_loss: 1.1187, test_f1: 0.4744
 epoch: 16, train_loss: 0.8525, test_loss: 1.0014, test_f1: 0.4649
 epoch: 17, train_loss: 0.8484, test_loss: 0.9020, test_f1: 0.5602
 epoch: 18, train_loss: 0.8450, test_loss: 0.8830, test_f1: 0.5695
 epoch: 19, train_loss: 0.8470, test_loss: 0.9005, test_f1: 0.6139
 epoch: 20, train_loss: 0.8311, test_loss: 1.0597, test_f1: 0.5511
 epoch: 21, train_loss: 0.8385, test_loss: 0.9320, test_f1: 0.5374
 epoch: 22, train_loss: 0.8362, test_loss: 0.9356, test_f1: 0.5746
 epoch: 23, train_loss: 0.8407, test_loss: 0.8925, test_f1: 0.5712
 epoch: 24, train_loss: 0.7966, test_loss: 0.9281, test_f1: 0.5381
 epoch: 25, train_loss: 0.8087, test_loss: 1.2461, test_f1: 0.4665
 epoch: 26, train_loss: 0.8209, test_loss: 0.9461, test_f1: 0.5596
 epoch: 27, train_loss: 0.8116, test_loss: 0.9598, test_f1: 0.5714
 epoch: 28, train_loss: 0.8143, test_loss: 0.8915, test_f1: 0.6250
 epoch: 29, train_loss: 0.7926, test_loss: 0.9086, test_f1: 0.5952
 epoch: 30, train_loss: 0.7926, test_loss: 0.8894, test_f1: 0.5777
 epoch: 31, train_loss: 0.7829, test_loss: 0.9616, test_f1: 0.5519
 epoch: 32, train_loss: 0.7895, test_loss: 1.1340, test_f1: 0.5007
 epoch: 33, train_loss: 0.7978, test_loss: 0.9519, test_f1: 0.5767
 epoch: 34, train_loss: 0.7725, test_loss: 0.8936, test_f1: 0.5951
 epoch: 35, train_loss: 0.7808, test_loss: 0.8353, test_f1: 0.6391
 epoch: 36, train_loss: 0.7740, test_loss: 0.8193, test_f1: 0.6107
 epoch: 37, train_loss: 0.7673, test_loss: 0.9361, test_f1: 0.5802
 epoch: 38, train_loss: 0.7664, test_loss: 0.9026, test_f1: 0.6055
 epoch: 39, train_loss: 0.7555, test_loss: 0.8484, test_f1: 0.6142
 epoch: 40, train_loss: 0.7501, test_loss: 0.8556, test_f1: 0.6359
 epoch: 41, train_loss: 0.7557, test_loss: 0.9699, test_f1: 0.6162
 epoch: 42, train_loss: 0.7622, test_loss: 0.8256, test_f1: 0.6194
 epoch: 43, train_loss: 0.7548, test_loss: 0.8810, test_f1: 0.6096
 epoch: 44, train_loss: 0.7480, test_loss: 0.9749, test_f1: 0.5682
 epoch: 45, train_loss: 0.7578, test_loss: 0.8623, test_f1: 0.5936
 epoch: 46, train_loss: 0.7369, test_loss: 0.9291, test_f1: 0.5911
 epoch: 47, train_loss: 0.7387, test_loss: 0.9106, test_f1: 0.6104
 epoch: 48, train_loss: 0.7378, test_loss: 0.8710, test_f1: 0.6356
 epoch: 49, train_loss: 0.7288, test_loss: 0.9332, test_f1: 0.5865
 epoch: 50, train_loss: 0.7253, test_loss: 0.8700, test_f1: 0.6013
 epoch: 51, train_loss: 0.7083, test_loss: 0.8466, test_f1: 0.6331
 epoch: 52, train_loss: 0.7008, test_loss: 0.8827, test_f1: 0.6180
 epoch: 53, train_loss: 0.6849, test_loss: 0.8284, test_f1: 0.6686
 epoch: 54, train_loss: 0.6858, test_loss: 0.8495, test_f1: 0.6405
 epoch: 55, train_loss: 0.6866, test_loss: 0.8572, test_f1: 0.6515
 epoch: 56, train_loss: 0.6902, test_loss: 0.8757, test_f1: 0.6243
 epoch: 57, train_loss: 0.6830, test_loss: 0.8642, test_f1: 0.6292
 epoch: 58, train_loss: 0.6817, test_loss: 0.8750, test_f1: 0.6383
 epoch: 59, train_loss: 0.6940, test_loss: 0.8234, test_f1: 0.6468
 epoch: 60, train_loss: 0.6865, test_loss: 0.9709, test_f1: 0.6009
 epoch: 61, train_loss: 0.6806, test_loss: 0.8535, test_f1: 0.6290
 epoch: 62, train_loss: 0.6681, test_loss: 0.8554, test_f1: 0.6416
 epoch: 63, train_loss: 0.6708, test_loss: 0.8378, test_f1: 0.6164
 epoch: 64, train_loss: 0.6694, test_loss: 0.8424, test_f1: 0.6515
 epoch: 65, train_loss: 0.6600, test_loss: 0.8804, test_f1: 0.6146
 epoch: 66, train_loss: 0.6642, test_loss: 0.8689, test_f1: 0.6370
 epoch: 67, train_loss: 0.6661, test_loss: 0.8694, test_f1: 0.6231
 epoch: 68, train_loss: 0.6561, test_loss: 0.9046, test_f1: 0.6162
 epoch: 69, train_loss: 0.6590, test_loss: 0.8576, test_f1: 0.6386
 epoch: 70, train_loss: 0.6653, test_loss: 0.8526, test_f1: 0.6214
 epoch: 71, train_loss: 0.6715, test_loss: 0.8460, test_f1: 0.6437
 epoch: 72, train_loss: 0.6582, test_loss: 0.8507, test_f1: 0.6575
 epoch: 73, train_loss: 0.6533, test_loss: 0.9183, test_f1: 0.6340
 epoch: 74, train_loss: 0.6514, test_loss: 0.8520, test_f1: 0.6557
 epoch: 75, train_loss: 0.6392, test_loss: 0.8424, test_f1: 0.6540
 epoch: 76, train_loss: 0.6545, test_loss: 0.8771, test_f1: 0.6220
 epoch: 77, train_loss: 0.6518, test_loss: 0.8485, test_f1: 0.6542
 epoch: 78, train_loss: 0.6541, test_loss: 0.8506, test_f1: 0.6473
 epoch: 79, train_loss: 0.6473, test_loss: 0.8443, test_f1: 0.6414
 epoch: 80, train_loss: 0.6612, test_loss: 0.8516, test_f1: 0.6375
 epoch: 81, train_loss: 0.6535, test_loss: 0.8496, test_f1: 0.6517
 epoch: 82, train_loss: 0.6467, test_loss: 0.8398, test_f1: 0.6447
 epoch: 83, train_loss: 0.6460, test_loss: 0.8835, test_f1: 0.6087
 epoch: 84, train_loss: 0.6442, test_loss: 0.8424, test_f1: 0.6512
 epoch: 85, train_loss: 0.6411, test_loss: 0.9119, test_f1: 0.6359
 epoch: 86, train_loss: 0.6208, test_loss: 0.9553, test_f1: 0.6170
 epoch: 87, train_loss: 0.6390, test_loss: 0.8566, test_f1: 0.6616
 epoch: 88, train_loss: 0.6445, test_loss: 0.8845, test_f1: 0.6236
 epoch: 89, train_loss: 0.6414, test_loss: 0.9411, test_f1: 0.6286
 epoch: 90, train_loss: 0.6337, test_loss: 0.9411, test_f1: 0.6150
 epoch: 91, train_loss: 0.6438, test_loss: 0.9979, test_f1: 0.6005
 epoch: 92, train_loss: 0.6383, test_loss: 0.8500, test_f1: 0.6418
 epoch: 93, train_loss: 0.6226, test_loss: 0.8605, test_f1: 0.6616
 epoch: 94, train_loss: 0.6261, test_loss: 0.8919, test_f1: 0.6276
 epoch: 95, train_loss: 0.6265, test_loss: 0.9636, test_f1: 0.6092
 epoch: 96, train_loss: 0.6340, test_loss: 0.9027, test_f1: 0.6555
 epoch: 97, train_loss: 0.6168, test_loss: 0.8362, test_f1: 0.6489
 epoch: 98, train_loss: 0.6130, test_loss: 0.9020, test_f1: 0.6401
 epoch: 99, train_loss: 0.6231, test_loss: 0.8461, test_f1: 0.6458
##################ITERATION #9 ****************************************
 epoch: 0, train_loss: 1.2596, test_loss: 1.0501, test_f1: 0.4502
 epoch: 1, train_loss: 1.0244, test_loss: 0.9951, test_f1: 0.5058
 epoch: 2, train_loss: 1.0148, test_loss: 0.9945, test_f1: 0.5417
 epoch: 3, train_loss: 0.9892, test_loss: 0.9665, test_f1: 0.5278
 epoch: 4, train_loss: 0.9708, test_loss: 1.0059, test_f1: 0.4996
 epoch: 5, train_loss: 0.9518, test_loss: 0.9947, test_f1: 0.5183
 epoch: 6, train_loss: 0.9440, test_loss: 0.9583, test_f1: 0.5046
 epoch: 7, train_loss: 0.9254, test_loss: 0.9459, test_f1: 0.5515
 epoch: 8, train_loss: 0.9081, test_loss: 1.0095, test_f1: 0.5220
 epoch: 9, train_loss: 0.8903, test_loss: 0.9598, test_f1: 0.5135
 epoch: 10, train_loss: 0.8943, test_loss: 0.9658, test_f1: 0.5524
 epoch: 11, train_loss: 0.8822, test_loss: 0.8896, test_f1: 0.5917
 epoch: 12, train_loss: 0.8738, test_loss: 0.9186, test_f1: 0.5608
 epoch: 13, train_loss: 0.8607, test_loss: 0.8932, test_f1: 0.5719
 epoch: 14, train_loss: 0.8414, test_loss: 0.9769, test_f1: 0.5387
 epoch: 15, train_loss: 0.8507, test_loss: 0.9029, test_f1: 0.5242
 epoch: 16, train_loss: 0.8453, test_loss: 0.8694, test_f1: 0.5599
 epoch: 17, train_loss: 0.8366, test_loss: 0.8325, test_f1: 0.5884
 epoch: 18, train_loss: 0.8372, test_loss: 0.9134, test_f1: 0.5769
 epoch: 19, train_loss: 0.8222, test_loss: 0.9110, test_f1: 0.5726
 epoch: 20, train_loss: 0.8096, test_loss: 0.8312, test_f1: 0.5823
 epoch: 21, train_loss: 0.8146, test_loss: 1.0239, test_f1: 0.5079
 epoch: 22, train_loss: 0.7966, test_loss: 0.8551, test_f1: 0.5919
 epoch: 23, train_loss: 0.8000, test_loss: 0.8359, test_f1: 0.5734
 epoch: 24, train_loss: 0.7973, test_loss: 0.8425, test_f1: 0.5726
 epoch: 25, train_loss: 0.7720, test_loss: 0.8600, test_f1: 0.6263
 epoch: 26, train_loss: 0.7811, test_loss: 0.8876, test_f1: 0.5771
 epoch: 27, train_loss: 0.7717, test_loss: 1.2137, test_f1: 0.4815
 epoch: 28, train_loss: 0.7738, test_loss: 0.8344, test_f1: 0.5958
 epoch: 29, train_loss: 0.7715, test_loss: 0.8254, test_f1: 0.5721
 epoch: 30, train_loss: 0.7576, test_loss: 0.8123, test_f1: 0.6299
 epoch: 31, train_loss: 0.7514, test_loss: 0.8451, test_f1: 0.6078
 epoch: 32, train_loss: 0.7565, test_loss: 0.8194, test_f1: 0.5945
 epoch: 33, train_loss: 0.7456, test_loss: 0.8732, test_f1: 0.5905
 epoch: 34, train_loss: 0.7577, test_loss: 0.8486, test_f1: 0.6134
 epoch: 35, train_loss: 0.7480, test_loss: 0.8703, test_f1: 0.5965
 epoch: 36, train_loss: 0.7421, test_loss: 0.7992, test_f1: 0.5901
 epoch: 37, train_loss: 0.7338, test_loss: 0.9087, test_f1: 0.5853
 epoch: 38, train_loss: 0.7207, test_loss: 0.8175, test_f1: 0.6460
 epoch: 39, train_loss: 0.7289, test_loss: 0.8093, test_f1: 0.6510
 epoch: 40, train_loss: 0.7245, test_loss: 0.8284, test_f1: 0.6278
 epoch: 41, train_loss: 0.7388, test_loss: 0.8598, test_f1: 0.5759
 epoch: 42, train_loss: 0.7290, test_loss: 0.8615, test_f1: 0.6155
 epoch: 43, train_loss: 0.7145, test_loss: 0.7956, test_f1: 0.6189
 epoch: 44, train_loss: 0.7168, test_loss: 0.8462, test_f1: 0.6179
 epoch: 45, train_loss: 0.7119, test_loss: 0.7882, test_f1: 0.6344
 epoch: 46, train_loss: 0.7053, test_loss: 0.7932, test_f1: 0.6408
 epoch: 47, train_loss: 0.7192, test_loss: 0.7616, test_f1: 0.6656
 epoch: 48, train_loss: 0.7049, test_loss: 0.7827, test_f1: 0.6307
 epoch: 49, train_loss: 0.7068, test_loss: 0.9026, test_f1: 0.5879
 epoch: 50, train_loss: 0.6998, test_loss: 0.7694, test_f1: 0.6501
 epoch: 51, train_loss: 0.6856, test_loss: 0.7924, test_f1: 0.6577
 epoch: 52, train_loss: 0.6628, test_loss: 0.7987, test_f1: 0.6434
 epoch: 53, train_loss: 0.6724, test_loss: 0.8010, test_f1: 0.6501
 epoch: 54, train_loss: 0.6683, test_loss: 0.7891, test_f1: 0.6559
 epoch: 55, train_loss: 0.6588, test_loss: 0.7886, test_f1: 0.6582
 epoch: 56, train_loss: 0.6595, test_loss: 0.7991, test_f1: 0.6487
 epoch: 57, train_loss: 0.6615, test_loss: 0.7755, test_f1: 0.6548
 epoch: 58, train_loss: 0.6613, test_loss: 0.7791, test_f1: 0.6472
 epoch: 59, train_loss: 0.6620, test_loss: 0.7807, test_f1: 0.6519
 epoch: 60, train_loss: 0.6549, test_loss: 0.7828, test_f1: 0.6630
 epoch: 61, train_loss: 0.6430, test_loss: 0.8228, test_f1: 0.6504
 epoch: 62, train_loss: 0.6431, test_loss: 0.7939, test_f1: 0.6683
 epoch: 63, train_loss: 0.6412, test_loss: 0.7898, test_f1: 0.6832
 epoch: 64, train_loss: 0.6429, test_loss: 0.7743, test_f1: 0.6623
 epoch: 65, train_loss: 0.6354, test_loss: 0.7978, test_f1: 0.6741
 epoch: 66, train_loss: 0.6370, test_loss: 0.7816, test_f1: 0.6604
 epoch: 67, train_loss: 0.6375, test_loss: 0.7711, test_f1: 0.6758
 epoch: 68, train_loss: 0.6425, test_loss: 0.7725, test_f1: 0.6550
 epoch: 69, train_loss: 0.6246, test_loss: 0.7874, test_f1: 0.6598
 epoch: 70, train_loss: 0.6375, test_loss: 0.7998, test_f1: 0.6774
 epoch: 71, train_loss: 0.6351, test_loss: 0.7897, test_f1: 0.6651
 epoch: 72, train_loss: 0.6272, test_loss: 0.7943, test_f1: 0.6452
 epoch: 73, train_loss: 0.6175, test_loss: 0.7754, test_f1: 0.6609
 epoch: 74, train_loss: 0.6365, test_loss: 0.8035, test_f1: 0.6752
 epoch: 75, train_loss: 0.6414, test_loss: 0.7917, test_f1: 0.6595
 epoch: 76, train_loss: 0.6281, test_loss: 0.7684, test_f1: 0.6809
 epoch: 77, train_loss: 0.6118, test_loss: 0.8127, test_f1: 0.6558
 epoch: 78, train_loss: 0.6122, test_loss: 0.7901, test_f1: 0.6651
 epoch: 79, train_loss: 0.6232, test_loss: 0.7893, test_f1: 0.6567
 epoch: 80, train_loss: 0.6162, test_loss: 0.7878, test_f1: 0.6780
 epoch: 81, train_loss: 0.6182, test_loss: 0.7863, test_f1: 0.6524
 epoch: 82, train_loss: 0.6306, test_loss: 0.7847, test_f1: 0.6299
 epoch: 83, train_loss: 0.6210, test_loss: 0.8060, test_f1: 0.6593
 epoch: 84, train_loss: 0.6101, test_loss: 0.7891, test_f1: 0.6686
 epoch: 85, train_loss: 0.6011, test_loss: 0.8042, test_f1: 0.6698
 epoch: 86, train_loss: 0.6116, test_loss: 0.7873, test_f1: 0.6809
 epoch: 87, train_loss: 0.6103, test_loss: 0.8132, test_f1: 0.6531
 epoch: 88, train_loss: 0.5991, test_loss: 0.8171, test_f1: 0.6668
 epoch: 89, train_loss: 0.6157, test_loss: 0.8201, test_f1: 0.6683
 epoch: 90, train_loss: 0.5921, test_loss: 0.7921, test_f1: 0.6466
 epoch: 91, train_loss: 0.6117, test_loss: 0.8116, test_f1: 0.6633
 epoch: 92, train_loss: 0.6069, test_loss: 0.8240, test_f1: 0.6543
 epoch: 93, train_loss: 0.5968, test_loss: 0.8302, test_f1: 0.6638
 epoch: 94, train_loss: 0.5974, test_loss: 0.8026, test_f1: 0.6761
 epoch: 95, train_loss: 0.6089, test_loss: 0.8043, test_f1: 0.6957
 epoch: 96, train_loss: 0.6023, test_loss: 0.7950, test_f1: 0.6804
 epoch: 97, train_loss: 0.5918, test_loss: 0.7940, test_f1: 0.6767
 epoch: 98, train_loss: 0.5843, test_loss: 0.8153, test_f1: 0.6755
 epoch: 99, train_loss: 0.5993, test_loss: 0.8129, test_f1: 0.6670

Training completed in 825.77 seconds
Best F1: 0.6957 at epoch 95
Mean F1 across iterations: 0.6634  0.0152
========================FINAL RESULTS================================
FEGIN weighted F1: 0.6957  0.0152
python main.py --data ltspice_examples --representation component_pin --model FEGIN --layers 2 --hiddens 32 --batch_size 32 --lr 0.001 --emb_size 512 --epochs 100 --save_appendix component_pin_L2_H32_BS32_LR0.001_E512 --no_val
-----



STDERR:
  File "main.py", line 370, in <module>
    main()
  File "main.py", line 254, in main
    dataset = dataset_class(
  File "/home/philip/projects/ltspice_examples_code_repo/Circuit-Completion-Using-GNNs/component_classification_with_link_prediction_head/evaluation/FEGIN/kernel/circuit_datasets.py", line 15, in __init__
    self.data, self.slices = torch.load(self.processed_paths[0])
  File "/home/philip/.local/lib/python3.8/site-packages/torch/serialization.py", line 1040, in load
    warnings.warn(
  File "/usr/lib/python3.8/warnings.py", line 109, in _showwarnmsg
    sw(msg.message, msg.category, msg.filename, msg.lineno,
  File "main.py", line 47, in warn_with_traceback
    traceback.print_stack(file=log)
/home/philip/projects/ltspice_examples_code_repo/Circuit-Completion-Using-GNNs/component_classification_with_link_prediction_head/evaluation/FEGIN/kernel/circuit_datasets.py:15: FutureWarning: You are using `torch.load` with `weights_only=False` (the current default value), which uses the default pickle module implicitly. It is possible to construct malicious pickle data which will execute arbitrary code during unpickling (See https://github.com/pytorch/pytorch/blob/main/SECURITY.md#untrusted-models for more details). In a future release, the default value for `weights_only` will be flipped to `True`. This limits the functions that could be executed during unpickling. Arbitrary objects will no longer be allowed to be loaded via this mode unless they are explicitly allowlisted by the user via `torch.serialization.add_safe_globals`. We recommend you start setting `weights_only=True` for any use case where you don't have full control of the loaded file. Please open an issue on GitHub for any issues related to this experimental feature.
  self.data, self.slices = torch.load(self.processed_paths[0])
