STDOUT:
Results will be saved in /home/philip/projects/ltspice_examples_code_repo/Circuit-Completion-Using-GNNs/component_classification_with_link_prediction_head/evaluation/FEGIN/results/model_FEGIN_dataset_ltspice_demos
Command line input: python main.py --data ltspice_demos --representation component_component --model FEGIN --layers 4 --hiddens 128 --batch_size 128 --lr 0.0001 --emb_size 128 --epochs 100 --save_appendix component_component_L4_H128_BS128_LR0.0001_E128 --no_val
 is saved.
-----
ltspice_demos - FEGIN
Using 4 layers, 128 hidden units, h = 2
Loading component_component representation dataset
ENTERED
Training FEGIN on component_component representation
Train: 1565, Test: 383
##################ITERATION #0 ****************************************
 epoch: 0, train_loss: 1.3693, test_loss: 1.3646, test_f1: 0.2281
 epoch: 1, train_loss: 1.3527, test_loss: 1.3587, test_f1: 0.2281
 epoch: 2, train_loss: 1.3425, test_loss: 1.3507, test_f1: 0.2281
 epoch: 3, train_loss: 1.3301, test_loss: 1.3400, test_f1: 0.2281
 epoch: 4, train_loss: 1.3165, test_loss: 1.3269, test_f1: 0.2281
 epoch: 5, train_loss: 1.3008, test_loss: 1.3133, test_f1: 0.2281
 epoch: 6, train_loss: 1.2792, test_loss: 1.2981, test_f1: 0.2281
 epoch: 7, train_loss: 1.2580, test_loss: 1.2819, test_f1: 0.2281
 epoch: 8, train_loss: 1.2342, test_loss: 1.2659, test_f1: 0.2281
 epoch: 9, train_loss: 1.2064, test_loss: 1.2531, test_f1: 0.2270
 epoch: 10, train_loss: 1.1855, test_loss: 1.2426, test_f1: 0.2599
 epoch: 11, train_loss: 1.1683, test_loss: 1.2335, test_f1: 0.3058
 epoch: 12, train_loss: 1.1518, test_loss: 1.2258, test_f1: 0.3274
 epoch: 13, train_loss: 1.1348, test_loss: 1.2217, test_f1: 0.3482
 epoch: 14, train_loss: 1.1210, test_loss: 1.2086, test_f1: 0.4214
 epoch: 15, train_loss: 1.1070, test_loss: 1.2074, test_f1: 0.4177
 epoch: 16, train_loss: 1.0911, test_loss: 1.2023, test_f1: 0.4352
 epoch: 17, train_loss: 1.0753, test_loss: 1.2010, test_f1: 0.4482
 epoch: 18, train_loss: 1.0664, test_loss: 1.1840, test_f1: 0.4544
 epoch: 19, train_loss: 1.0555, test_loss: 1.1944, test_f1: 0.4615
 epoch: 20, train_loss: 1.0361, test_loss: 1.1892, test_f1: 0.4709
 epoch: 21, train_loss: 1.0223, test_loss: 1.1808, test_f1: 0.4578
 epoch: 22, train_loss: 1.0110, test_loss: 1.1824, test_f1: 0.4751
 epoch: 23, train_loss: 0.9953, test_loss: 1.1941, test_f1: 0.4830
 epoch: 24, train_loss: 0.9837, test_loss: 1.1962, test_f1: 0.4644
 epoch: 25, train_loss: 0.9677, test_loss: 1.1842, test_f1: 0.4467
 epoch: 26, train_loss: 0.9533, test_loss: 1.1966, test_f1: 0.4527
 epoch: 27, train_loss: 0.9436, test_loss: 1.2110, test_f1: 0.4620
 epoch: 28, train_loss: 0.9364, test_loss: 1.2025, test_f1: 0.4627
 epoch: 29, train_loss: 0.9242, test_loss: 1.2222, test_f1: 0.4713
 epoch: 30, train_loss: 0.9104, test_loss: 1.2462, test_f1: 0.4823
 epoch: 31, train_loss: 0.9048, test_loss: 1.2262, test_f1: 0.4685
 epoch: 32, train_loss: 0.8770, test_loss: 1.2444, test_f1: 0.4586
 epoch: 33, train_loss: 0.8863, test_loss: 1.2410, test_f1: 0.4806
 epoch: 34, train_loss: 0.8655, test_loss: 1.2602, test_f1: 0.4716
 epoch: 35, train_loss: 0.8548, test_loss: 1.3014, test_f1: 0.4813
 epoch: 36, train_loss: 0.8322, test_loss: 1.3214, test_f1: 0.4980
 epoch: 37, train_loss: 0.8274, test_loss: 1.2835, test_f1: 0.4856
 epoch: 38, train_loss: 0.8070, test_loss: 1.3424, test_f1: 0.4660
 epoch: 39, train_loss: 0.8006, test_loss: 1.3400, test_f1: 0.4857
 epoch: 40, train_loss: 0.8005, test_loss: 1.3268, test_f1: 0.4899
 epoch: 41, train_loss: 0.7729, test_loss: 1.3606, test_f1: 0.5079
 epoch: 42, train_loss: 0.7657, test_loss: 1.3487, test_f1: 0.4918
 epoch: 43, train_loss: 0.7614, test_loss: 1.3728, test_f1: 0.5128
 epoch: 44, train_loss: 0.7536, test_loss: 1.3798, test_f1: 0.5230
 epoch: 45, train_loss: 0.7417, test_loss: 1.3918, test_f1: 0.5121
 epoch: 46, train_loss: 0.7348, test_loss: 1.4468, test_f1: 0.5310
 epoch: 47, train_loss: 0.7162, test_loss: 1.4941, test_f1: 0.5161
 epoch: 48, train_loss: 0.7186, test_loss: 1.4324, test_f1: 0.5413
 epoch: 49, train_loss: 0.7072, test_loss: 1.4262, test_f1: 0.5582
 epoch: 50, train_loss: 0.6901, test_loss: 1.4532, test_f1: 0.5393
 epoch: 51, train_loss: 0.6702, test_loss: 1.4311, test_f1: 0.5274
 epoch: 52, train_loss: 0.6608, test_loss: 1.4609, test_f1: 0.5616
 epoch: 53, train_loss: 0.6629, test_loss: 1.4903, test_f1: 0.5608
 epoch: 54, train_loss: 0.6749, test_loss: 1.4700, test_f1: 0.5393
 epoch: 55, train_loss: 0.6723, test_loss: 1.4741, test_f1: 0.5453
 epoch: 56, train_loss: 0.6491, test_loss: 1.5144, test_f1: 0.5650
 epoch: 57, train_loss: 0.6418, test_loss: 1.5345, test_f1: 0.5589
 epoch: 58, train_loss: 0.6347, test_loss: 1.5721, test_f1: 0.5653
 epoch: 59, train_loss: 0.6343, test_loss: 1.5597, test_f1: 0.5484
 epoch: 60, train_loss: 0.6285, test_loss: 1.5156, test_f1: 0.5636
 epoch: 61, train_loss: 0.6166, test_loss: 1.5436, test_f1: 0.5705
 epoch: 62, train_loss: 0.6138, test_loss: 1.5259, test_f1: 0.5457
 epoch: 63, train_loss: 0.6223, test_loss: 1.5347, test_f1: 0.5638
 epoch: 64, train_loss: 0.5918, test_loss: 1.5615, test_f1: 0.5603
 epoch: 65, train_loss: 0.5969, test_loss: 1.5709, test_f1: 0.5604
 epoch: 66, train_loss: 0.5940, test_loss: 1.5618, test_f1: 0.5600
 epoch: 67, train_loss: 0.6105, test_loss: 1.5889, test_f1: 0.5577
 epoch: 68, train_loss: 0.5945, test_loss: 1.6010, test_f1: 0.5653
 epoch: 69, train_loss: 0.5811, test_loss: 1.6501, test_f1: 0.5419
 epoch: 70, train_loss: 0.5896, test_loss: 1.5743, test_f1: 0.5268
 epoch: 71, train_loss: 0.5762, test_loss: 1.6092, test_f1: 0.5371
 epoch: 72, train_loss: 0.5748, test_loss: 1.6786, test_f1: 0.5480
 epoch: 73, train_loss: 0.5721, test_loss: 1.6270, test_f1: 0.5528
 epoch: 74, train_loss: 0.5612, test_loss: 1.6306, test_f1: 0.5421
 epoch: 75, train_loss: 0.5669, test_loss: 1.6887, test_f1: 0.5533
 epoch: 76, train_loss: 0.5781, test_loss: 1.6603, test_f1: 0.5699
 epoch: 77, train_loss: 0.5702, test_loss: 1.6835, test_f1: 0.5594
 epoch: 78, train_loss: 0.5677, test_loss: 1.6217, test_f1: 0.5763
 epoch: 79, train_loss: 0.5493, test_loss: 1.6496, test_f1: 0.5378
 epoch: 80, train_loss: 0.5472, test_loss: 1.6091, test_f1: 0.5395
 epoch: 81, train_loss: 0.5398, test_loss: 1.6275, test_f1: 0.5499
 epoch: 82, train_loss: 0.5371, test_loss: 1.6692, test_f1: 0.5207
 epoch: 83, train_loss: 0.5650, test_loss: 1.7113, test_f1: 0.5414
 epoch: 84, train_loss: 0.5530, test_loss: 1.7988, test_f1: 0.5400
 epoch: 85, train_loss: 0.5524, test_loss: 1.7168, test_f1: 0.5414
 epoch: 86, train_loss: 0.5336, test_loss: 1.7569, test_f1: 0.5452
 epoch: 87, train_loss: 0.5321, test_loss: 1.7959, test_f1: 0.5276
 epoch: 88, train_loss: 0.5013, test_loss: 1.7912, test_f1: 0.5483
 epoch: 89, train_loss: 0.5323, test_loss: 1.7676, test_f1: 0.5269
 epoch: 90, train_loss: 0.5222, test_loss: 1.7270, test_f1: 0.5225
 epoch: 91, train_loss: 0.5159, test_loss: 1.6848, test_f1: 0.5389
 epoch: 92, train_loss: 0.5082, test_loss: 1.7255, test_f1: 0.5352
 epoch: 93, train_loss: 0.4996, test_loss: 1.7173, test_f1: 0.5464
 epoch: 94, train_loss: 0.5156, test_loss: 1.7481, test_f1: 0.5369
 epoch: 95, train_loss: 0.5074, test_loss: 1.7541, test_f1: 0.5570
 epoch: 96, train_loss: 0.5042, test_loss: 1.8116, test_f1: 0.5565
 epoch: 97, train_loss: 0.4877, test_loss: 1.8265, test_f1: 0.5322
 epoch: 98, train_loss: 0.4915, test_loss: 1.8428, test_f1: 0.5518
 epoch: 99, train_loss: 0.4845, test_loss: 1.8581, test_f1: 0.5332
##################ITERATION #1 ****************************************
 epoch: 0, train_loss: 1.3318, test_loss: 1.3484, test_f1: 0.2281
 epoch: 1, train_loss: 1.2788, test_loss: 1.3281, test_f1: 0.2404
 epoch: 2, train_loss: 1.2474, test_loss: 1.3087, test_f1: 0.2674
 epoch: 3, train_loss: 1.2218, test_loss: 1.2878, test_f1: 0.2630
 epoch: 4, train_loss: 1.2007, test_loss: 1.2729, test_f1: 0.2768
 epoch: 5, train_loss: 1.1791, test_loss: 1.2487, test_f1: 0.3787
 epoch: 6, train_loss: 1.1620, test_loss: 1.2378, test_f1: 0.3984
 epoch: 7, train_loss: 1.1472, test_loss: 1.2290, test_f1: 0.4237
 epoch: 8, train_loss: 1.1307, test_loss: 1.2227, test_f1: 0.4275
 epoch: 9, train_loss: 1.1145, test_loss: 1.2042, test_f1: 0.4139
 epoch: 10, train_loss: 1.0984, test_loss: 1.2046, test_f1: 0.4145
 epoch: 11, train_loss: 1.0822, test_loss: 1.1934, test_f1: 0.4199
 epoch: 12, train_loss: 1.0644, test_loss: 1.1901, test_f1: 0.4286
 epoch: 13, train_loss: 1.0511, test_loss: 1.1878, test_f1: 0.4272
 epoch: 14, train_loss: 1.0318, test_loss: 1.1775, test_f1: 0.4383
 epoch: 15, train_loss: 1.0240, test_loss: 1.1879, test_f1: 0.4679
 epoch: 16, train_loss: 1.0044, test_loss: 1.1937, test_f1: 0.4663
 epoch: 17, train_loss: 0.9876, test_loss: 1.2069, test_f1: 0.4760
 epoch: 18, train_loss: 0.9782, test_loss: 1.1854, test_f1: 0.4808
 epoch: 19, train_loss: 0.9599, test_loss: 1.1848, test_f1: 0.4924
 epoch: 20, train_loss: 0.9463, test_loss: 1.2056, test_f1: 0.5049
 epoch: 21, train_loss: 0.9235, test_loss: 1.2059, test_f1: 0.4951
 epoch: 22, train_loss: 0.9095, test_loss: 1.1925, test_f1: 0.4911
 epoch: 23, train_loss: 0.8977, test_loss: 1.2140, test_f1: 0.5191
 epoch: 24, train_loss: 0.8875, test_loss: 1.2430, test_f1: 0.5114
 epoch: 25, train_loss: 0.8805, test_loss: 1.2483, test_f1: 0.5292
 epoch: 26, train_loss: 0.8494, test_loss: 1.2795, test_f1: 0.5328
 epoch: 27, train_loss: 0.8325, test_loss: 1.2909, test_f1: 0.5369
 epoch: 28, train_loss: 0.8390, test_loss: 1.2965, test_f1: 0.5461
 epoch: 29, train_loss: 0.8136, test_loss: 1.3020, test_f1: 0.5347
 epoch: 30, train_loss: 0.8024, test_loss: 1.2944, test_f1: 0.5237
 epoch: 31, train_loss: 0.7962, test_loss: 1.3385, test_f1: 0.5290
 epoch: 32, train_loss: 0.7761, test_loss: 1.4203, test_f1: 0.5495
 epoch: 33, train_loss: 0.7658, test_loss: 1.3496, test_f1: 0.5471
 epoch: 34, train_loss: 0.7529, test_loss: 1.3705, test_f1: 0.5544
 epoch: 35, train_loss: 0.7339, test_loss: 1.3922, test_f1: 0.5531
 epoch: 36, train_loss: 0.7438, test_loss: 1.4473, test_f1: 0.5377
 epoch: 37, train_loss: 0.7066, test_loss: 1.4512, test_f1: 0.5432
 epoch: 38, train_loss: 0.7038, test_loss: 1.4760, test_f1: 0.5429
 epoch: 39, train_loss: 0.6948, test_loss: 1.4916, test_f1: 0.5548
 epoch: 40, train_loss: 0.6937, test_loss: 1.4863, test_f1: 0.5494
 epoch: 41, train_loss: 0.6733, test_loss: 1.5071, test_f1: 0.5550
 epoch: 42, train_loss: 0.6695, test_loss: 1.5812, test_f1: 0.5214
 epoch: 43, train_loss: 0.6657, test_loss: 1.5700, test_f1: 0.5441
 epoch: 44, train_loss: 0.6481, test_loss: 1.6018, test_f1: 0.5626
 epoch: 45, train_loss: 0.6321, test_loss: 1.5709, test_f1: 0.5511
 epoch: 46, train_loss: 0.6232, test_loss: 1.5977, test_f1: 0.5568
 epoch: 47, train_loss: 0.6109, test_loss: 1.5888, test_f1: 0.5434
 epoch: 48, train_loss: 0.6122, test_loss: 1.6961, test_f1: 0.5655
 epoch: 49, train_loss: 0.6155, test_loss: 1.6638, test_f1: 0.5494
 epoch: 50, train_loss: 0.5857, test_loss: 1.7231, test_f1: 0.5376
 epoch: 51, train_loss: 0.5740, test_loss: 1.7742, test_f1: 0.5268
 epoch: 52, train_loss: 0.5791, test_loss: 1.7554, test_f1: 0.5503
 epoch: 53, train_loss: 0.5669, test_loss: 1.7332, test_f1: 0.5274
 epoch: 54, train_loss: 0.5588, test_loss: 1.7608, test_f1: 0.5317
 epoch: 55, train_loss: 0.5679, test_loss: 1.7992, test_f1: 0.5388
 epoch: 56, train_loss: 0.5657, test_loss: 1.7123, test_f1: 0.5578
 epoch: 57, train_loss: 0.5486, test_loss: 1.7439, test_f1: 0.5495
 epoch: 58, train_loss: 0.5408, test_loss: 1.6969, test_f1: 0.5383
 epoch: 59, train_loss: 0.5371, test_loss: 1.7853, test_f1: 0.5353
 epoch: 60, train_loss: 0.5363, test_loss: 1.7800, test_f1: 0.5350
 epoch: 61, train_loss: 0.5329, test_loss: 1.8100, test_f1: 0.5412
 epoch: 62, train_loss: 0.5382, test_loss: 1.7560, test_f1: 0.5356
 epoch: 63, train_loss: 0.5264, test_loss: 1.8233, test_f1: 0.5470
 epoch: 64, train_loss: 0.5081, test_loss: 1.9472, test_f1: 0.5433
 epoch: 65, train_loss: 0.5159, test_loss: 1.8905, test_f1: 0.5377
 epoch: 66, train_loss: 0.5156, test_loss: 1.9033, test_f1: 0.5324
 epoch: 67, train_loss: 0.5128, test_loss: 1.9812, test_f1: 0.5253
 epoch: 68, train_loss: 0.5025, test_loss: 1.9747, test_f1: 0.5304
 epoch: 69, train_loss: 0.4986, test_loss: 1.9260, test_f1: 0.5461
 epoch: 70, train_loss: 0.5155, test_loss: 1.8963, test_f1: 0.5392
 epoch: 71, train_loss: 0.4964, test_loss: 1.9229, test_f1: 0.5231
 epoch: 72, train_loss: 0.4838, test_loss: 1.9377, test_f1: 0.5407
 epoch: 73, train_loss: 0.5003, test_loss: 1.9710, test_f1: 0.5463
 epoch: 74, train_loss: 0.4886, test_loss: 1.9181, test_f1: 0.5515
 epoch: 75, train_loss: 0.5038, test_loss: 1.9560, test_f1: 0.5415
 epoch: 76, train_loss: 0.4911, test_loss: 2.0275, test_f1: 0.5493
 epoch: 77, train_loss: 0.4832, test_loss: 2.0128, test_f1: 0.5314
 epoch: 78, train_loss: 0.4652, test_loss: 2.0228, test_f1: 0.5333
 epoch: 79, train_loss: 0.4561, test_loss: 2.0765, test_f1: 0.5409
 epoch: 80, train_loss: 0.4683, test_loss: 2.0700, test_f1: 0.5401
 epoch: 81, train_loss: 0.4682, test_loss: 2.0480, test_f1: 0.5490
 epoch: 82, train_loss: 0.4509, test_loss: 2.0613, test_f1: 0.5335
 epoch: 83, train_loss: 0.4729, test_loss: 1.9986, test_f1: 0.5287
 epoch: 84, train_loss: 0.4551, test_loss: 1.9977, test_f1: 0.5198
 epoch: 85, train_loss: 0.4504, test_loss: 2.0101, test_f1: 0.5125
 epoch: 86, train_loss: 0.4336, test_loss: 1.9604, test_f1: 0.5114
 epoch: 87, train_loss: 0.4373, test_loss: 2.0408, test_f1: 0.5237
 epoch: 88, train_loss: 0.4508, test_loss: 2.0457, test_f1: 0.5135
 epoch: 89, train_loss: 0.4373, test_loss: 2.1026, test_f1: 0.5421
 epoch: 90, train_loss: 0.4373, test_loss: 2.1608, test_f1: 0.5382
 epoch: 91, train_loss: 0.4535, test_loss: 2.0695, test_f1: 0.5463
 epoch: 92, train_loss: 0.4554, test_loss: 2.1154, test_f1: 0.5392
 epoch: 93, train_loss: 0.4506, test_loss: 2.0857, test_f1: 0.5259
 epoch: 94, train_loss: 0.4297, test_loss: 2.1507, test_f1: 0.5257
 epoch: 95, train_loss: 0.4328, test_loss: 2.1334, test_f1: 0.5409
 epoch: 96, train_loss: 0.4416, test_loss: 2.1182, test_f1: 0.5413
 epoch: 97, train_loss: 0.4298, test_loss: 2.0937, test_f1: 0.5341
 epoch: 98, train_loss: 0.4125, test_loss: 2.1383, test_f1: 0.5362
 epoch: 99, train_loss: 0.4293, test_loss: 2.1160, test_f1: 0.5255
##################ITERATION #2 ****************************************
 epoch: 0, train_loss: 1.2814, test_loss: 1.3330, test_f1: 0.2404
 epoch: 1, train_loss: 1.2262, test_loss: 1.3205, test_f1: 0.2628
 epoch: 2, train_loss: 1.1871, test_loss: 1.3029, test_f1: 0.2678
 epoch: 3, train_loss: 1.1827, test_loss: 1.2759, test_f1: 0.2643
 epoch: 4, train_loss: 1.1576, test_loss: 1.2444, test_f1: 0.3042
 epoch: 5, train_loss: 1.1375, test_loss: 1.2293, test_f1: 0.3482
 epoch: 6, train_loss: 1.1178, test_loss: 1.2018, test_f1: 0.3793
 epoch: 7, train_loss: 1.1025, test_loss: 1.1926, test_f1: 0.3934
 epoch: 8, train_loss: 1.0818, test_loss: 1.1877, test_f1: 0.4203
 epoch: 9, train_loss: 1.0693, test_loss: 1.1812, test_f1: 0.4261
 epoch: 10, train_loss: 1.0533, test_loss: 1.1725, test_f1: 0.4581
 epoch: 11, train_loss: 1.0256, test_loss: 1.1666, test_f1: 0.5059
 epoch: 12, train_loss: 1.0080, test_loss: 1.1602, test_f1: 0.5110
 epoch: 13, train_loss: 1.0115, test_loss: 1.1643, test_f1: 0.5113
 epoch: 14, train_loss: 0.9900, test_loss: 1.1401, test_f1: 0.5335
 epoch: 15, train_loss: 0.9746, test_loss: 1.1405, test_f1: 0.5111
 epoch: 16, train_loss: 0.9679, test_loss: 1.1440, test_f1: 0.5180
 epoch: 17, train_loss: 0.9523, test_loss: 1.1342, test_f1: 0.4995
 epoch: 18, train_loss: 0.9390, test_loss: 1.1289, test_f1: 0.5464
 epoch: 19, train_loss: 0.9181, test_loss: 1.1429, test_f1: 0.5380
 epoch: 20, train_loss: 0.9004, test_loss: 1.1498, test_f1: 0.5167
 epoch: 21, train_loss: 0.8983, test_loss: 1.1449, test_f1: 0.5289
 epoch: 22, train_loss: 0.8982, test_loss: 1.1225, test_f1: 0.5413
 epoch: 23, train_loss: 0.8778, test_loss: 1.1444, test_f1: 0.5045
 epoch: 24, train_loss: 0.8613, test_loss: 1.1353, test_f1: 0.5348
 epoch: 25, train_loss: 0.8538, test_loss: 1.1386, test_f1: 0.5293
 epoch: 26, train_loss: 0.8350, test_loss: 1.1487, test_f1: 0.5205
 epoch: 27, train_loss: 0.8291, test_loss: 1.1521, test_f1: 0.5507
 epoch: 28, train_loss: 0.8229, test_loss: 1.1702, test_f1: 0.5502
 epoch: 29, train_loss: 0.8129, test_loss: 1.1901, test_f1: 0.5120
 epoch: 30, train_loss: 0.7882, test_loss: 1.1692, test_f1: 0.5211
 epoch: 31, train_loss: 0.7925, test_loss: 1.1724, test_f1: 0.5030
 epoch: 32, train_loss: 0.7738, test_loss: 1.1582, test_f1: 0.5245
 epoch: 33, train_loss: 0.7706, test_loss: 1.1720, test_f1: 0.5479
 epoch: 34, train_loss: 0.7646, test_loss: 1.1457, test_f1: 0.5560
 epoch: 35, train_loss: 0.7555, test_loss: 1.1705, test_f1: 0.5329
 epoch: 36, train_loss: 0.7406, test_loss: 1.1862, test_f1: 0.5110
 epoch: 37, train_loss: 0.7400, test_loss: 1.1988, test_f1: 0.5247
 epoch: 38, train_loss: 0.7340, test_loss: 1.1893, test_f1: 0.5751
 epoch: 39, train_loss: 0.7095, test_loss: 1.2091, test_f1: 0.5460
 epoch: 40, train_loss: 0.7085, test_loss: 1.2094, test_f1: 0.5231
 epoch: 41, train_loss: 0.6926, test_loss: 1.1922, test_f1: 0.5451
 epoch: 42, train_loss: 0.6886, test_loss: 1.1846, test_f1: 0.5651
 epoch: 43, train_loss: 0.6818, test_loss: 1.2449, test_f1: 0.5496
 epoch: 44, train_loss: 0.6761, test_loss: 1.2220, test_f1: 0.5581
 epoch: 45, train_loss: 0.6613, test_loss: 1.2476, test_f1: 0.5759
 epoch: 46, train_loss: 0.6655, test_loss: 1.3308, test_f1: 0.5369
 epoch: 47, train_loss: 0.6492, test_loss: 1.3244, test_f1: 0.5538
 epoch: 48, train_loss: 0.6381, test_loss: 1.2736, test_f1: 0.5736
 epoch: 49, train_loss: 0.6309, test_loss: 1.3225, test_f1: 0.5601
 epoch: 50, train_loss: 0.6379, test_loss: 1.3391, test_f1: 0.5459
 epoch: 51, train_loss: 0.6157, test_loss: 1.3148, test_f1: 0.5694
 epoch: 52, train_loss: 0.6230, test_loss: 1.3359, test_f1: 0.5625
 epoch: 53, train_loss: 0.6065, test_loss: 1.3515, test_f1: 0.5330
 epoch: 54, train_loss: 0.5952, test_loss: 1.3460, test_f1: 0.5383
 epoch: 55, train_loss: 0.5947, test_loss: 1.3751, test_f1: 0.5308
 epoch: 56, train_loss: 0.5882, test_loss: 1.4061, test_f1: 0.5398
 epoch: 57, train_loss: 0.5864, test_loss: 1.3965, test_f1: 0.5388
 epoch: 58, train_loss: 0.5827, test_loss: 1.3620, test_f1: 0.5456
 epoch: 59, train_loss: 0.5789, test_loss: 1.3850, test_f1: 0.5563
 epoch: 60, train_loss: 0.5706, test_loss: 1.3957, test_f1: 0.5448
 epoch: 61, train_loss: 0.5905, test_loss: 1.4103, test_f1: 0.5541
 epoch: 62, train_loss: 0.5799, test_loss: 1.3999, test_f1: 0.5587
 epoch: 63, train_loss: 0.5682, test_loss: 1.3935, test_f1: 0.5523
 epoch: 64, train_loss: 0.5562, test_loss: 1.3837, test_f1: 0.5604
 epoch: 65, train_loss: 0.5417, test_loss: 1.4241, test_f1: 0.5644
 epoch: 66, train_loss: 0.5440, test_loss: 1.4442, test_f1: 0.5756
 epoch: 67, train_loss: 0.5514, test_loss: 1.4574, test_f1: 0.5634
 epoch: 68, train_loss: 0.5480, test_loss: 1.4290, test_f1: 0.5745
 epoch: 69, train_loss: 0.5541, test_loss: 1.4641, test_f1: 0.5550
 epoch: 70, train_loss: 0.5394, test_loss: 1.5404, test_f1: 0.5372
 epoch: 71, train_loss: 0.5352, test_loss: 1.4974, test_f1: 0.5373
 epoch: 72, train_loss: 0.5296, test_loss: 1.4354, test_f1: 0.5643
 epoch: 73, train_loss: 0.5184, test_loss: 1.4043, test_f1: 0.5770
 epoch: 74, train_loss: 0.5156, test_loss: 1.4086, test_f1: 0.5746
 epoch: 75, train_loss: 0.5077, test_loss: 1.4264, test_f1: 0.5674
 epoch: 76, train_loss: 0.5065, test_loss: 1.4690, test_f1: 0.5626
 epoch: 77, train_loss: 0.5208, test_loss: 1.4526, test_f1: 0.5744
 epoch: 78, train_loss: 0.5189, test_loss: 1.4932, test_f1: 0.5615
 epoch: 79, train_loss: 0.5049, test_loss: 1.5056, test_f1: 0.5498
 epoch: 80, train_loss: 0.5160, test_loss: 1.5244, test_f1: 0.5632
 epoch: 81, train_loss: 0.5097, test_loss: 1.5571, test_f1: 0.5573
 epoch: 82, train_loss: 0.5088, test_loss: 1.5401, test_f1: 0.5566
 epoch: 83, train_loss: 0.4893, test_loss: 1.5261, test_f1: 0.5819
 epoch: 84, train_loss: 0.4837, test_loss: 1.5125, test_f1: 0.5663
 epoch: 85, train_loss: 0.4898, test_loss: 1.5639, test_f1: 0.5960
 epoch: 86, train_loss: 0.4938, test_loss: 1.5787, test_f1: 0.5661
 epoch: 87, train_loss: 0.4965, test_loss: 1.5270, test_f1: 0.5750
 epoch: 88, train_loss: 0.4873, test_loss: 1.5527, test_f1: 0.5729
 epoch: 89, train_loss: 0.4895, test_loss: 1.6333, test_f1: 0.5825
 epoch: 90, train_loss: 0.4888, test_loss: 1.5564, test_f1: 0.5873
 epoch: 91, train_loss: 0.4842, test_loss: 1.6091, test_f1: 0.5626
 epoch: 92, train_loss: 0.4901, test_loss: 1.5723, test_f1: 0.5646
 epoch: 93, train_loss: 0.5014, test_loss: 1.4894, test_f1: 0.5746
 epoch: 94, train_loss: 0.4685, test_loss: 1.5205, test_f1: 0.5767
 epoch: 95, train_loss: 0.4570, test_loss: 1.5798, test_f1: 0.5612
 epoch: 96, train_loss: 0.4705, test_loss: 1.5609, test_f1: 0.5716
 epoch: 97, train_loss: 0.4578, test_loss: 1.5963, test_f1: 0.5637
 epoch: 98, train_loss: 0.4524, test_loss: 1.6056, test_f1: 0.5750
 epoch: 99, train_loss: 0.4520, test_loss: 1.6283, test_f1: 0.5730
##################ITERATION #3 ****************************************
 epoch: 0, train_loss: 1.2532, test_loss: 1.3380, test_f1: 0.2600
 epoch: 1, train_loss: 1.1797, test_loss: 1.3150, test_f1: 0.2588
 epoch: 2, train_loss: 1.1738, test_loss: 1.2726, test_f1: 0.2821
 epoch: 3, train_loss: 1.1473, test_loss: 1.2396, test_f1: 0.3552
 epoch: 4, train_loss: 1.1249, test_loss: 1.2185, test_f1: 0.3801
 epoch: 5, train_loss: 1.1005, test_loss: 1.1977, test_f1: 0.4206
 epoch: 6, train_loss: 1.0824, test_loss: 1.1796, test_f1: 0.4313
 epoch: 7, train_loss: 1.0637, test_loss: 1.1698, test_f1: 0.4426
 epoch: 8, train_loss: 1.0472, test_loss: 1.1667, test_f1: 0.4462
 epoch: 9, train_loss: 1.0366, test_loss: 1.1603, test_f1: 0.4456
 epoch: 10, train_loss: 1.0262, test_loss: 1.1588, test_f1: 0.4558
 epoch: 11, train_loss: 1.0050, test_loss: 1.1535, test_f1: 0.5025
 epoch: 12, train_loss: 0.9970, test_loss: 1.1583, test_f1: 0.4890
 epoch: 13, train_loss: 0.9824, test_loss: 1.1601, test_f1: 0.4704
 epoch: 14, train_loss: 0.9660, test_loss: 1.1710, test_f1: 0.4566
 epoch: 15, train_loss: 0.9445, test_loss: 1.1597, test_f1: 0.4990
 epoch: 16, train_loss: 0.9320, test_loss: 1.1483, test_f1: 0.5001
 epoch: 17, train_loss: 0.9166, test_loss: 1.1731, test_f1: 0.5070
 epoch: 18, train_loss: 0.9232, test_loss: 1.1927, test_f1: 0.5221
 epoch: 19, train_loss: 0.9025, test_loss: 1.1842, test_f1: 0.5125
 epoch: 20, train_loss: 0.8893, test_loss: 1.1639, test_f1: 0.5571
 epoch: 21, train_loss: 0.8813, test_loss: 1.1885, test_f1: 0.5568
 epoch: 22, train_loss: 0.8594, test_loss: 1.1867, test_f1: 0.5224
 epoch: 23, train_loss: 0.8592, test_loss: 1.1487, test_f1: 0.5637
 epoch: 24, train_loss: 0.8554, test_loss: 1.1844, test_f1: 0.5593
 epoch: 25, train_loss: 0.8235, test_loss: 1.2050, test_f1: 0.5564
 epoch: 26, train_loss: 0.8249, test_loss: 1.2158, test_f1: 0.5832
 epoch: 27, train_loss: 0.8197, test_loss: 1.2205, test_f1: 0.5918
 epoch: 28, train_loss: 0.8155, test_loss: 1.1885, test_f1: 0.5911
 epoch: 29, train_loss: 0.8002, test_loss: 1.2486, test_f1: 0.6003
 epoch: 30, train_loss: 0.7806, test_loss: 1.2052, test_f1: 0.5874
 epoch: 31, train_loss: 0.7694, test_loss: 1.2157, test_f1: 0.5745
 epoch: 32, train_loss: 0.7618, test_loss: 1.2333, test_f1: 0.5979
 epoch: 33, train_loss: 0.7363, test_loss: 1.2403, test_f1: 0.6179
 epoch: 34, train_loss: 0.7559, test_loss: 1.2224, test_f1: 0.6087
 epoch: 35, train_loss: 0.7476, test_loss: 1.2474, test_f1: 0.6048
 epoch: 36, train_loss: 0.7356, test_loss: 1.2488, test_f1: 0.5837
 epoch: 37, train_loss: 0.7202, test_loss: 1.2353, test_f1: 0.6148
 epoch: 38, train_loss: 0.7279, test_loss: 1.2607, test_f1: 0.6143
 epoch: 39, train_loss: 0.7078, test_loss: 1.2604, test_f1: 0.6351
 epoch: 40, train_loss: 0.6877, test_loss: 1.2411, test_f1: 0.5842
 epoch: 41, train_loss: 0.6769, test_loss: 1.2812, test_f1: 0.5444
 epoch: 42, train_loss: 0.6866, test_loss: 1.2528, test_f1: 0.6258
 epoch: 43, train_loss: 0.6623, test_loss: 1.2963, test_f1: 0.5906
 epoch: 44, train_loss: 0.6618, test_loss: 1.2774, test_f1: 0.5903
 epoch: 45, train_loss: 0.6618, test_loss: 1.3056, test_f1: 0.6068
 epoch: 46, train_loss: 0.6559, test_loss: 1.2890, test_f1: 0.6287
 epoch: 47, train_loss: 0.6472, test_loss: 1.3524, test_f1: 0.5470
 epoch: 48, train_loss: 0.6167, test_loss: 1.3295, test_f1: 0.5818
 epoch: 49, train_loss: 0.6219, test_loss: 1.3809, test_f1: 0.6243
 epoch: 50, train_loss: 0.6137, test_loss: 1.4513, test_f1: 0.5873
 epoch: 51, train_loss: 0.6025, test_loss: 1.4304, test_f1: 0.5877
 epoch: 52, train_loss: 0.5919, test_loss: 1.3832, test_f1: 0.5960
 epoch: 53, train_loss: 0.6020, test_loss: 1.3727, test_f1: 0.5812
 epoch: 54, train_loss: 0.5852, test_loss: 1.3829, test_f1: 0.5719
 epoch: 55, train_loss: 0.5876, test_loss: 1.3990, test_f1: 0.5767
 epoch: 56, train_loss: 0.5856, test_loss: 1.3778, test_f1: 0.5979
 epoch: 57, train_loss: 0.5924, test_loss: 1.3753, test_f1: 0.5610
 epoch: 58, train_loss: 0.5706, test_loss: 1.4325, test_f1: 0.5637
 epoch: 59, train_loss: 0.5757, test_loss: 1.4502, test_f1: 0.5809
 epoch: 60, train_loss: 0.5823, test_loss: 1.4645, test_f1: 0.6202
 epoch: 61, train_loss: 0.5643, test_loss: 1.4397, test_f1: 0.6024
 epoch: 62, train_loss: 0.5468, test_loss: 1.4565, test_f1: 0.5724
 epoch: 63, train_loss: 0.5418, test_loss: 1.4413, test_f1: 0.5837
 epoch: 64, train_loss: 0.5478, test_loss: 1.4828, test_f1: 0.5590
 epoch: 65, train_loss: 0.5474, test_loss: 1.4977, test_f1: 0.5678
 epoch: 66, train_loss: 0.5506, test_loss: 1.4552, test_f1: 0.5701
 epoch: 67, train_loss: 0.5284, test_loss: 1.4531, test_f1: 0.5907
 epoch: 68, train_loss: 0.5439, test_loss: 1.4549, test_f1: 0.5895
 epoch: 69, train_loss: 0.5272, test_loss: 1.4810, test_f1: 0.5773
 epoch: 70, train_loss: 0.5354, test_loss: 1.5012, test_f1: 0.5784
 epoch: 71, train_loss: 0.5194, test_loss: 1.5120, test_f1: 0.5617
 epoch: 72, train_loss: 0.5087, test_loss: 1.5297, test_f1: 0.5615
 epoch: 73, train_loss: 0.5268, test_loss: 1.5058, test_f1: 0.5747
 epoch: 74, train_loss: 0.5017, test_loss: 1.5103, test_f1: 0.5782
 epoch: 75, train_loss: 0.5171, test_loss: 1.4841, test_f1: 0.5677
 epoch: 76, train_loss: 0.5116, test_loss: 1.4558, test_f1: 0.5537
 epoch: 77, train_loss: 0.5085, test_loss: 1.4724, test_f1: 0.5536
 epoch: 78, train_loss: 0.5196, test_loss: 1.4642, test_f1: 0.5590
 epoch: 79, train_loss: 0.4992, test_loss: 1.4700, test_f1: 0.5792
 epoch: 80, train_loss: 0.5110, test_loss: 1.4902, test_f1: 0.5634
 epoch: 81, train_loss: 0.5073, test_loss: 1.4892, test_f1: 0.5795
 epoch: 82, train_loss: 0.5166, test_loss: 1.4800, test_f1: 0.5645
 epoch: 83, train_loss: 0.4942, test_loss: 1.4880, test_f1: 0.5586
 epoch: 84, train_loss: 0.4935, test_loss: 1.5290, test_f1: 0.5895
 epoch: 85, train_loss: 0.4849, test_loss: 1.4883, test_f1: 0.5853
 epoch: 86, train_loss: 0.4896, test_loss: 1.4601, test_f1: 0.5809
 epoch: 87, train_loss: 0.4779, test_loss: 1.5290, test_f1: 0.5677
 epoch: 88, train_loss: 0.4792, test_loss: 1.4941, test_f1: 0.5898
 epoch: 89, train_loss: 0.4625, test_loss: 1.4930, test_f1: 0.5745
 epoch: 90, train_loss: 0.4783, test_loss: 1.5186, test_f1: 0.5739
 epoch: 91, train_loss: 0.4902, test_loss: 1.5228, test_f1: 0.5762
 epoch: 92, train_loss: 0.4686, test_loss: 1.5608, test_f1: 0.5742
 epoch: 93, train_loss: 0.4860, test_loss: 1.5971, test_f1: 0.5791
 epoch: 94, train_loss: 0.4545, test_loss: 1.5823, test_f1: 0.5718
 epoch: 95, train_loss: 0.4785, test_loss: 1.5914, test_f1: 0.5614
 epoch: 96, train_loss: 0.4652, test_loss: 1.6061, test_f1: 0.5855
 epoch: 97, train_loss: 0.4548, test_loss: 1.6439, test_f1: 0.5799
 epoch: 98, train_loss: 0.4603, test_loss: 1.6478, test_f1: 0.5708
 epoch: 99, train_loss: 0.4372, test_loss: 1.6174, test_f1: 0.5829
##################ITERATION #4 ****************************************
 epoch: 0, train_loss: 1.2796, test_loss: 1.3189, test_f1: 0.2281
 epoch: 1, train_loss: 1.1958, test_loss: 1.3030, test_f1: 0.2281
 epoch: 2, train_loss: 1.1497, test_loss: 1.2770, test_f1: 0.2516
 epoch: 3, train_loss: 1.1389, test_loss: 1.2161, test_f1: 0.3594
 epoch: 4, train_loss: 1.1106, test_loss: 1.1844, test_f1: 0.4120
 epoch: 5, train_loss: 1.0847, test_loss: 1.1789, test_f1: 0.4205
 epoch: 6, train_loss: 1.0761, test_loss: 1.1746, test_f1: 0.4117
 epoch: 7, train_loss: 1.0619, test_loss: 1.1577, test_f1: 0.4442
 epoch: 8, train_loss: 1.0375, test_loss: 1.1401, test_f1: 0.4715
 epoch: 9, train_loss: 1.0157, test_loss: 1.1450, test_f1: 0.4971
 epoch: 10, train_loss: 0.9935, test_loss: 1.1346, test_f1: 0.5095
 epoch: 11, train_loss: 0.9824, test_loss: 1.1359, test_f1: 0.5102
 epoch: 12, train_loss: 0.9842, test_loss: 1.1399, test_f1: 0.5230
 epoch: 13, train_loss: 0.9539, test_loss: 1.1287, test_f1: 0.5145
 epoch: 14, train_loss: 0.9402, test_loss: 1.1183, test_f1: 0.5259
 epoch: 15, train_loss: 0.9307, test_loss: 1.1216, test_f1: 0.5091
 epoch: 16, train_loss: 0.9044, test_loss: 1.1206, test_f1: 0.5142
 epoch: 17, train_loss: 0.8957, test_loss: 1.1125, test_f1: 0.5425
 epoch: 18, train_loss: 0.8825, test_loss: 1.1172, test_f1: 0.5448
 epoch: 19, train_loss: 0.8676, test_loss: 1.1182, test_f1: 0.5193
 epoch: 20, train_loss: 0.8734, test_loss: 1.1280, test_f1: 0.5812
 epoch: 21, train_loss: 0.8468, test_loss: 1.1299, test_f1: 0.5465
 epoch: 22, train_loss: 0.8283, test_loss: 1.1119, test_f1: 0.5806
 epoch: 23, train_loss: 0.8187, test_loss: 1.1185, test_f1: 0.5540
 epoch: 24, train_loss: 0.7930, test_loss: 1.1325, test_f1: 0.5237
 epoch: 25, train_loss: 0.8017, test_loss: 1.1214, test_f1: 0.5382
 epoch: 26, train_loss: 0.7871, test_loss: 1.1597, test_f1: 0.5418
 epoch: 27, train_loss: 0.7694, test_loss: 1.1431, test_f1: 0.5504
 epoch: 28, train_loss: 0.7559, test_loss: 1.1442, test_f1: 0.5498
 epoch: 29, train_loss: 0.7579, test_loss: 1.1489, test_f1: 0.5493
 epoch: 30, train_loss: 0.7241, test_loss: 1.1651, test_f1: 0.5428
 epoch: 31, train_loss: 0.7315, test_loss: 1.1877, test_f1: 0.5621
 epoch: 32, train_loss: 0.7091, test_loss: 1.1887, test_f1: 0.5473
 epoch: 33, train_loss: 0.7135, test_loss: 1.3127, test_f1: 0.5366
 epoch: 34, train_loss: 0.6936, test_loss: 1.2290, test_f1: 0.5620
 epoch: 35, train_loss: 0.6856, test_loss: 1.2603, test_f1: 0.5633
 epoch: 36, train_loss: 0.6747, test_loss: 1.3097, test_f1: 0.5278
 epoch: 37, train_loss: 0.6794, test_loss: 1.2607, test_f1: 0.5578
 epoch: 38, train_loss: 0.6519, test_loss: 1.2779, test_f1: 0.5487
 epoch: 39, train_loss: 0.6312, test_loss: 1.4222, test_f1: 0.5510
 epoch: 40, train_loss: 0.6332, test_loss: 1.3769, test_f1: 0.5584
 epoch: 41, train_loss: 0.6263, test_loss: 1.3731, test_f1: 0.5669
 epoch: 42, train_loss: 0.6336, test_loss: 1.4485, test_f1: 0.6002
 epoch: 43, train_loss: 0.6219, test_loss: 1.3259, test_f1: 0.5667
 epoch: 44, train_loss: 0.6069, test_loss: 1.3316, test_f1: 0.5572
 epoch: 45, train_loss: 0.5864, test_loss: 1.3893, test_f1: 0.5744
 epoch: 46, train_loss: 0.5829, test_loss: 1.3805, test_f1: 0.5472
 epoch: 47, train_loss: 0.5970, test_loss: 1.4242, test_f1: 0.5421
 epoch: 48, train_loss: 0.5684, test_loss: 1.4056, test_f1: 0.5479
 epoch: 49, train_loss: 0.5691, test_loss: 1.4185, test_f1: 0.5606
 epoch: 50, train_loss: 0.5567, test_loss: 1.4634, test_f1: 0.5719
 epoch: 51, train_loss: 0.5374, test_loss: 1.4856, test_f1: 0.5402
 epoch: 52, train_loss: 0.5597, test_loss: 1.4894, test_f1: 0.5425
 epoch: 53, train_loss: 0.5111, test_loss: 1.5151, test_f1: 0.5481
 epoch: 54, train_loss: 0.5047, test_loss: 1.5637, test_f1: 0.5554
 epoch: 55, train_loss: 0.5121, test_loss: 1.6116, test_f1: 0.5698
 epoch: 56, train_loss: 0.4991, test_loss: 1.6392, test_f1: 0.5511
 epoch: 57, train_loss: 0.5135, test_loss: 1.6434, test_f1: 0.5511
 epoch: 58, train_loss: 0.5147, test_loss: 1.6373, test_f1: 0.5617
 epoch: 59, train_loss: 0.4992, test_loss: 1.6184, test_f1: 0.5624
 epoch: 60, train_loss: 0.4850, test_loss: 1.6464, test_f1: 0.5675
 epoch: 61, train_loss: 0.4832, test_loss: 1.7110, test_f1: 0.5426
 epoch: 62, train_loss: 0.4852, test_loss: 1.7321, test_f1: 0.5416
 epoch: 63, train_loss: 0.4709, test_loss: 1.7688, test_f1: 0.5365
 epoch: 64, train_loss: 0.4782, test_loss: 1.7834, test_f1: 0.5559
 epoch: 65, train_loss: 0.4944, test_loss: 1.8178, test_f1: 0.5470
 epoch: 66, train_loss: 0.4739, test_loss: 1.7625, test_f1: 0.5558
 epoch: 67, train_loss: 0.4671, test_loss: 1.7013, test_f1: 0.5616
 epoch: 68, train_loss: 0.4831, test_loss: 1.6422, test_f1: 0.5594
 epoch: 69, train_loss: 0.4828, test_loss: 1.7144, test_f1: 0.5574
 epoch: 70, train_loss: 0.4633, test_loss: 1.8342, test_f1: 0.5390
 epoch: 71, train_loss: 0.4740, test_loss: 1.7155, test_f1: 0.5694
 epoch: 72, train_loss: 0.4794, test_loss: 1.7232, test_f1: 0.5583
 epoch: 73, train_loss: 0.4740, test_loss: 1.6910, test_f1: 0.5408
 epoch: 74, train_loss: 0.4576, test_loss: 1.7463, test_f1: 0.5487
 epoch: 75, train_loss: 0.4612, test_loss: 1.7778, test_f1: 0.5530
 epoch: 76, train_loss: 0.4410, test_loss: 1.7676, test_f1: 0.5522
 epoch: 77, train_loss: 0.4595, test_loss: 1.7434, test_f1: 0.5621
 epoch: 78, train_loss: 0.4199, test_loss: 1.7993, test_f1: 0.5552
 epoch: 79, train_loss: 0.4608, test_loss: 1.8520, test_f1: 0.5549
 epoch: 80, train_loss: 0.4413, test_loss: 1.8034, test_f1: 0.5589
 epoch: 81, train_loss: 0.4440, test_loss: 1.8032, test_f1: 0.5507
 epoch: 82, train_loss: 0.4609, test_loss: 1.7674, test_f1: 0.5516
 epoch: 83, train_loss: 0.4241, test_loss: 1.8180, test_f1: 0.5515
 epoch: 84, train_loss: 0.4310, test_loss: 1.8073, test_f1: 0.5668
 epoch: 85, train_loss: 0.4095, test_loss: 1.8572, test_f1: 0.5606
 epoch: 86, train_loss: 0.4146, test_loss: 1.8245, test_f1: 0.5666
 epoch: 87, train_loss: 0.4010, test_loss: 1.8376, test_f1: 0.5559
 epoch: 88, train_loss: 0.4371, test_loss: 1.8889, test_f1: 0.5546
 epoch: 89, train_loss: 0.4239, test_loss: 1.9351, test_f1: 0.5559
 epoch: 90, train_loss: 0.4111, test_loss: 1.8939, test_f1: 0.5616
 epoch: 91, train_loss: 0.4203, test_loss: 1.8509, test_f1: 0.5655
 epoch: 92, train_loss: 0.4072, test_loss: 1.9159, test_f1: 0.5552
 epoch: 93, train_loss: 0.4208, test_loss: 1.9264, test_f1: 0.5736
 epoch: 94, train_loss: 0.4138, test_loss: 1.8508, test_f1: 0.5771
 epoch: 95, train_loss: 0.3975, test_loss: 1.8193, test_f1: 0.5571
 epoch: 96, train_loss: 0.4192, test_loss: 1.8780, test_f1: 0.5508
 epoch: 97, train_loss: 0.3852, test_loss: 1.8634, test_f1: 0.5475
 epoch: 98, train_loss: 0.3903, test_loss: 1.8389, test_f1: 0.5428
 epoch: 99, train_loss: 0.4233, test_loss: 1.9307, test_f1: 0.5667
##################ITERATION #5 ****************************************
 epoch: 0, train_loss: 1.2873, test_loss: 1.3194, test_f1: 0.2630
 epoch: 1, train_loss: 1.2151, test_loss: 1.3038, test_f1: 0.2716
 epoch: 2, train_loss: 1.1825, test_loss: 1.2828, test_f1: 0.2876
 epoch: 3, train_loss: 1.1493, test_loss: 1.2525, test_f1: 0.3945
 epoch: 4, train_loss: 1.1317, test_loss: 1.2033, test_f1: 0.4066
 epoch: 5, train_loss: 1.1110, test_loss: 1.2540, test_f1: 0.4218
 epoch: 6, train_loss: 1.0871, test_loss: 1.2617, test_f1: 0.4372
 epoch: 7, train_loss: 1.0600, test_loss: 1.2228, test_f1: 0.4520
 epoch: 8, train_loss: 1.0458, test_loss: 1.3791, test_f1: 0.4838
 epoch: 9, train_loss: 1.0211, test_loss: 1.2304, test_f1: 0.5130
 epoch: 10, train_loss: 1.0072, test_loss: 1.2062, test_f1: 0.5060
 epoch: 11, train_loss: 1.0003, test_loss: 1.1252, test_f1: 0.5204
 epoch: 12, train_loss: 0.9807, test_loss: 1.1253, test_f1: 0.4968
 epoch: 13, train_loss: 0.9614, test_loss: 1.1022, test_f1: 0.5276
 epoch: 14, train_loss: 0.9468, test_loss: 1.0974, test_f1: 0.5514
 epoch: 15, train_loss: 0.9388, test_loss: 1.1343, test_f1: 0.5515
 epoch: 16, train_loss: 0.9457, test_loss: 1.1210, test_f1: 0.5524
 epoch: 17, train_loss: 0.9269, test_loss: 1.1199, test_f1: 0.5538
 epoch: 18, train_loss: 0.9107, test_loss: 1.1324, test_f1: 0.5389
 epoch: 19, train_loss: 0.8934, test_loss: 1.1028, test_f1: 0.5669
 epoch: 20, train_loss: 0.8828, test_loss: 1.0860, test_f1: 0.5451
 epoch: 21, train_loss: 0.8913, test_loss: 1.0835, test_f1: 0.5821
 epoch: 22, train_loss: 0.8711, test_loss: 1.0745, test_f1: 0.5648
 epoch: 23, train_loss: 0.8631, test_loss: 1.0965, test_f1: 0.5746
 epoch: 24, train_loss: 0.8609, test_loss: 1.0890, test_f1: 0.5786
 epoch: 25, train_loss: 0.8384, test_loss: 1.0976, test_f1: 0.5897
 epoch: 26, train_loss: 0.8242, test_loss: 1.0705, test_f1: 0.5942
 epoch: 27, train_loss: 0.8031, test_loss: 1.0683, test_f1: 0.5732
 epoch: 28, train_loss: 0.7948, test_loss: 1.0653, test_f1: 0.5826
 epoch: 29, train_loss: 0.7812, test_loss: 1.1128, test_f1: 0.5763
 epoch: 30, train_loss: 0.7894, test_loss: 1.0786, test_f1: 0.5813
 epoch: 31, train_loss: 0.7783, test_loss: 1.0531, test_f1: 0.5861
 epoch: 32, train_loss: 0.7553, test_loss: 1.0802, test_f1: 0.5776
 epoch: 33, train_loss: 0.7468, test_loss: 1.0955, test_f1: 0.6008
 epoch: 34, train_loss: 0.7432, test_loss: 1.0915, test_f1: 0.6090
 epoch: 35, train_loss: 0.7470, test_loss: 1.0672, test_f1: 0.6182
 epoch: 36, train_loss: 0.7328, test_loss: 1.0545, test_f1: 0.6255
 epoch: 37, train_loss: 0.7074, test_loss: 1.0928, test_f1: 0.6051
 epoch: 38, train_loss: 0.7044, test_loss: 1.0895, test_f1: 0.6098
 epoch: 39, train_loss: 0.6800, test_loss: 1.1064, test_f1: 0.6269
 epoch: 40, train_loss: 0.6901, test_loss: 1.1111, test_f1: 0.6071
 epoch: 41, train_loss: 0.6722, test_loss: 1.0994, test_f1: 0.5918
 epoch: 42, train_loss: 0.6671, test_loss: 1.1014, test_f1: 0.6120
 epoch: 43, train_loss: 0.6617, test_loss: 1.1356, test_f1: 0.5999
 epoch: 44, train_loss: 0.6715, test_loss: 1.1604, test_f1: 0.6083
 epoch: 45, train_loss: 0.6412, test_loss: 1.1069, test_f1: 0.6041
 epoch: 46, train_loss: 0.6438, test_loss: 1.1218, test_f1: 0.6091
 epoch: 47, train_loss: 0.6352, test_loss: 1.1902, test_f1: 0.5891
 epoch: 48, train_loss: 0.6212, test_loss: 1.1263, test_f1: 0.6076
 epoch: 49, train_loss: 0.6183, test_loss: 1.1764, test_f1: 0.6019
 epoch: 50, train_loss: 0.6241, test_loss: 1.1847, test_f1: 0.5742
 epoch: 51, train_loss: 0.6042, test_loss: 1.1457, test_f1: 0.5920
 epoch: 52, train_loss: 0.6012, test_loss: 1.1699, test_f1: 0.6181
 epoch: 53, train_loss: 0.5855, test_loss: 1.1704, test_f1: 0.5958
 epoch: 54, train_loss: 0.5879, test_loss: 1.1713, test_f1: 0.5792
 epoch: 55, train_loss: 0.5966, test_loss: 1.2411, test_f1: 0.5961
 epoch: 56, train_loss: 0.5731, test_loss: 1.2327, test_f1: 0.6058
 epoch: 57, train_loss: 0.5726, test_loss: 1.2224, test_f1: 0.5809
 epoch: 58, train_loss: 0.5634, test_loss: 1.2395, test_f1: 0.6040
 epoch: 59, train_loss: 0.5616, test_loss: 1.2325, test_f1: 0.6011
 epoch: 60, train_loss: 0.5621, test_loss: 1.2135, test_f1: 0.5943
 epoch: 61, train_loss: 0.5566, test_loss: 1.2333, test_f1: 0.5944
 epoch: 62, train_loss: 0.5510, test_loss: 1.1879, test_f1: 0.6123
 epoch: 63, train_loss: 0.5528, test_loss: 1.1929, test_f1: 0.6142
 epoch: 64, train_loss: 0.5447, test_loss: 1.1819, test_f1: 0.5861
 epoch: 65, train_loss: 0.5597, test_loss: 1.2015, test_f1: 0.6084
 epoch: 66, train_loss: 0.5393, test_loss: 1.2269, test_f1: 0.6083
 epoch: 67, train_loss: 0.5505, test_loss: 1.2102, test_f1: 0.5903
 epoch: 68, train_loss: 0.5538, test_loss: 1.1809, test_f1: 0.6008
 epoch: 69, train_loss: 0.5339, test_loss: 1.2813, test_f1: 0.5866
 epoch: 70, train_loss: 0.5194, test_loss: 1.3119, test_f1: 0.6103
 epoch: 71, train_loss: 0.5187, test_loss: 1.3222, test_f1: 0.6060
 epoch: 72, train_loss: 0.5034, test_loss: 1.3003, test_f1: 0.5892
 epoch: 73, train_loss: 0.5215, test_loss: 1.2527, test_f1: 0.5845
 epoch: 74, train_loss: 0.5271, test_loss: 1.2441, test_f1: 0.6002
 epoch: 75, train_loss: 0.5114, test_loss: 1.2409, test_f1: 0.5826
 epoch: 76, train_loss: 0.4958, test_loss: 1.3587, test_f1: 0.5872
 epoch: 77, train_loss: 0.4917, test_loss: 1.3401, test_f1: 0.5970
 epoch: 78, train_loss: 0.4979, test_loss: 1.3418, test_f1: 0.5823
 epoch: 79, train_loss: 0.4764, test_loss: 1.2875, test_f1: 0.5951
 epoch: 80, train_loss: 0.4882, test_loss: 1.2765, test_f1: 0.5838
 epoch: 81, train_loss: 0.4978, test_loss: 1.3345, test_f1: 0.5955
 epoch: 82, train_loss: 0.4831, test_loss: 1.3754, test_f1: 0.5861
 epoch: 83, train_loss: 0.4848, test_loss: 1.3226, test_f1: 0.5897
 epoch: 84, train_loss: 0.4882, test_loss: 1.3517, test_f1: 0.5805
 epoch: 85, train_loss: 0.4837, test_loss: 1.4324, test_f1: 0.5877
 epoch: 86, train_loss: 0.4670, test_loss: 1.4485, test_f1: 0.5849
 epoch: 87, train_loss: 0.4827, test_loss: 1.4307, test_f1: 0.5900
 epoch: 88, train_loss: 0.4624, test_loss: 1.4569, test_f1: 0.5892
 epoch: 89, train_loss: 0.4666, test_loss: 1.3869, test_f1: 0.5946
 epoch: 90, train_loss: 0.4792, test_loss: 1.3396, test_f1: 0.5754
 epoch: 91, train_loss: 0.4686, test_loss: 1.3606, test_f1: 0.5872
 epoch: 92, train_loss: 0.4417, test_loss: 1.4133, test_f1: 0.5834
 epoch: 93, train_loss: 0.4708, test_loss: 1.3493, test_f1: 0.5895
 epoch: 94, train_loss: 0.4526, test_loss: 1.4390, test_f1: 0.5685
 epoch: 95, train_loss: 0.4463, test_loss: 1.4539, test_f1: 0.5821
 epoch: 96, train_loss: 0.4471, test_loss: 1.4359, test_f1: 0.5900
 epoch: 97, train_loss: 0.4468, test_loss: 1.4814, test_f1: 0.5730
 epoch: 98, train_loss: 0.4499, test_loss: 1.4668, test_f1: 0.5751
 epoch: 99, train_loss: 0.4541, test_loss: 1.4936, test_f1: 0.5975
##################ITERATION #6 ****************************************
 epoch: 0, train_loss: 1.3071, test_loss: 1.3344, test_f1: 0.2248
 epoch: 1, train_loss: 1.2167, test_loss: 1.3139, test_f1: 0.2395
 epoch: 2, train_loss: 1.1706, test_loss: 1.2645, test_f1: 0.2657
 epoch: 3, train_loss: 1.1580, test_loss: 1.2448, test_f1: 0.3093
 epoch: 4, train_loss: 1.1455, test_loss: 1.2499, test_f1: 0.3787
 epoch: 5, train_loss: 1.1228, test_loss: 1.2494, test_f1: 0.3914
 epoch: 6, train_loss: 1.1039, test_loss: 1.2598, test_f1: 0.4294
 epoch: 7, train_loss: 1.0807, test_loss: 1.2649, test_f1: 0.4598
 epoch: 8, train_loss: 1.0533, test_loss: 1.2281, test_f1: 0.4505
 epoch: 9, train_loss: 1.0398, test_loss: 1.2402, test_f1: 0.4702
 epoch: 10, train_loss: 1.0201, test_loss: 1.2270, test_f1: 0.4857
 epoch: 11, train_loss: 1.0089, test_loss: 1.2151, test_f1: 0.5095
 epoch: 12, train_loss: 0.9894, test_loss: 1.1853, test_f1: 0.4909
 epoch: 13, train_loss: 0.9814, test_loss: 1.1822, test_f1: 0.4851
 epoch: 14, train_loss: 0.9433, test_loss: 1.1833, test_f1: 0.5013
 epoch: 15, train_loss: 0.9478, test_loss: 1.1684, test_f1: 0.5392
 epoch: 16, train_loss: 0.9385, test_loss: 1.1727, test_f1: 0.5215
 epoch: 17, train_loss: 0.9333, test_loss: 1.1910, test_f1: 0.5331
 epoch: 18, train_loss: 0.9101, test_loss: 1.1770, test_f1: 0.5482
 epoch: 19, train_loss: 0.8983, test_loss: 1.1660, test_f1: 0.5343
 epoch: 20, train_loss: 0.8825, test_loss: 1.1551, test_f1: 0.5431
 epoch: 21, train_loss: 0.8870, test_loss: 1.1599, test_f1: 0.5503
 epoch: 22, train_loss: 0.8746, test_loss: 1.1698, test_f1: 0.5533
 epoch: 23, train_loss: 0.8625, test_loss: 1.1444, test_f1: 0.5497
 epoch: 24, train_loss: 0.8515, test_loss: 1.1644, test_f1: 0.5661
 epoch: 25, train_loss: 0.8325, test_loss: 1.2167, test_f1: 0.5397
 epoch: 26, train_loss: 0.8102, test_loss: 1.2238, test_f1: 0.5387
 epoch: 27, train_loss: 0.8306, test_loss: 1.2486, test_f1: 0.5432
 epoch: 28, train_loss: 0.8046, test_loss: 1.2233, test_f1: 0.5379
 epoch: 29, train_loss: 0.7851, test_loss: 1.2379, test_f1: 0.5519
 epoch: 30, train_loss: 0.7813, test_loss: 1.2775, test_f1: 0.5509
 epoch: 31, train_loss: 0.7828, test_loss: 1.2684, test_f1: 0.5342
 epoch: 32, train_loss: 0.7646, test_loss: 1.2732, test_f1: 0.5450
 epoch: 33, train_loss: 0.7513, test_loss: 1.3673, test_f1: 0.5413
 epoch: 34, train_loss: 0.7535, test_loss: 1.3220, test_f1: 0.5546
 epoch: 35, train_loss: 0.7154, test_loss: 1.3345, test_f1: 0.5466
 epoch: 36, train_loss: 0.7352, test_loss: 1.3205, test_f1: 0.5500
 epoch: 37, train_loss: 0.7102, test_loss: 1.3700, test_f1: 0.5580
 epoch: 38, train_loss: 0.7038, test_loss: 1.4299, test_f1: 0.5613
 epoch: 39, train_loss: 0.7005, test_loss: 1.3904, test_f1: 0.5379
 epoch: 40, train_loss: 0.6914, test_loss: 1.4100, test_f1: 0.5619
 epoch: 41, train_loss: 0.6814, test_loss: 1.4301, test_f1: 0.5743
 epoch: 42, train_loss: 0.6962, test_loss: 1.4487, test_f1: 0.5815
 epoch: 43, train_loss: 0.6691, test_loss: 1.4110, test_f1: 0.5600
 epoch: 44, train_loss: 0.6503, test_loss: 1.4647, test_f1: 0.5627
 epoch: 45, train_loss: 0.6738, test_loss: 1.4548, test_f1: 0.5387
 epoch: 46, train_loss: 0.6446, test_loss: 1.4972, test_f1: 0.5537
 epoch: 47, train_loss: 0.6379, test_loss: 1.5308, test_f1: 0.5479
 epoch: 48, train_loss: 0.6417, test_loss: 1.5420, test_f1: 0.5473
 epoch: 49, train_loss: 0.6125, test_loss: 1.5988, test_f1: 0.5341
 epoch: 50, train_loss: 0.6189, test_loss: 1.6056, test_f1: 0.5640
 epoch: 51, train_loss: 0.5877, test_loss: 1.6050, test_f1: 0.5504
 epoch: 52, train_loss: 0.5937, test_loss: 1.6158, test_f1: 0.5478
 epoch: 53, train_loss: 0.6002, test_loss: 1.6354, test_f1: 0.5303
 epoch: 54, train_loss: 0.5876, test_loss: 1.6402, test_f1: 0.5422
 epoch: 55, train_loss: 0.5890, test_loss: 1.6461, test_f1: 0.5492
 epoch: 56, train_loss: 0.5751, test_loss: 1.6368, test_f1: 0.5517
 epoch: 57, train_loss: 0.5647, test_loss: 1.6448, test_f1: 0.5566
 epoch: 58, train_loss: 0.5716, test_loss: 1.6433, test_f1: 0.5636
 epoch: 59, train_loss: 0.5723, test_loss: 1.6082, test_f1: 0.5510
 epoch: 60, train_loss: 0.5647, test_loss: 1.6775, test_f1: 0.5679
 epoch: 61, train_loss: 0.5496, test_loss: 1.7107, test_f1: 0.5645
 epoch: 62, train_loss: 0.5627, test_loss: 1.7481, test_f1: 0.5556
 epoch: 63, train_loss: 0.5466, test_loss: 1.8031, test_f1: 0.5554
 epoch: 64, train_loss: 0.5596, test_loss: 1.6737, test_f1: 0.5478
 epoch: 65, train_loss: 0.5554, test_loss: 1.6767, test_f1: 0.5438
 epoch: 66, train_loss: 0.5394, test_loss: 1.7060, test_f1: 0.5501
 epoch: 67, train_loss: 0.5242, test_loss: 1.7621, test_f1: 0.5517
 epoch: 68, train_loss: 0.5391, test_loss: 1.6891, test_f1: 0.5386
 epoch: 69, train_loss: 0.5230, test_loss: 1.6799, test_f1: 0.5456
 epoch: 70, train_loss: 0.5418, test_loss: 1.6965, test_f1: 0.5473
 epoch: 71, train_loss: 0.5246, test_loss: 1.7177, test_f1: 0.5470
 epoch: 72, train_loss: 0.5285, test_loss: 1.7359, test_f1: 0.5473
 epoch: 73, train_loss: 0.5319, test_loss: 1.6990, test_f1: 0.5622
 epoch: 74, train_loss: 0.5257, test_loss: 1.7218, test_f1: 0.5591
 epoch: 75, train_loss: 0.5251, test_loss: 1.7999, test_f1: 0.5533
 epoch: 76, train_loss: 0.5031, test_loss: 1.8261, test_f1: 0.5419
 epoch: 77, train_loss: 0.5180, test_loss: 1.8008, test_f1: 0.5447
 epoch: 78, train_loss: 0.4993, test_loss: 1.8220, test_f1: 0.5559
 epoch: 79, train_loss: 0.5285, test_loss: 1.7968, test_f1: 0.5478
 epoch: 80, train_loss: 0.4955, test_loss: 1.7986, test_f1: 0.5495
 epoch: 81, train_loss: 0.5240, test_loss: 1.8403, test_f1: 0.5490
 epoch: 82, train_loss: 0.4955, test_loss: 1.8764, test_f1: 0.5401
 epoch: 83, train_loss: 0.4741, test_loss: 1.8648, test_f1: 0.5450
 epoch: 84, train_loss: 0.5027, test_loss: 1.8081, test_f1: 0.5527
 epoch: 85, train_loss: 0.4797, test_loss: 1.8256, test_f1: 0.5529
 epoch: 86, train_loss: 0.4669, test_loss: 1.9332, test_f1: 0.5477
 epoch: 87, train_loss: 0.4973, test_loss: 1.9430, test_f1: 0.5485
 epoch: 88, train_loss: 0.4820, test_loss: 1.9681, test_f1: 0.5560
 epoch: 89, train_loss: 0.4645, test_loss: 1.9507, test_f1: 0.5393
 epoch: 90, train_loss: 0.4850, test_loss: 2.0041, test_f1: 0.5522
 epoch: 91, train_loss: 0.4605, test_loss: 1.9551, test_f1: 0.5544
 epoch: 92, train_loss: 0.4849, test_loss: 1.9781, test_f1: 0.5579
 epoch: 93, train_loss: 0.4839, test_loss: 1.9362, test_f1: 0.5446
 epoch: 94, train_loss: 0.4825, test_loss: 1.8590, test_f1: 0.5605
 epoch: 95, train_loss: 0.4458, test_loss: 1.9788, test_f1: 0.5556
 epoch: 96, train_loss: 0.4706, test_loss: 2.0037, test_f1: 0.5486
 epoch: 97, train_loss: 0.4516, test_loss: 2.0258, test_f1: 0.5466
 epoch: 98, train_loss: 0.4743, test_loss: 1.9622, test_f1: 0.5564
 epoch: 99, train_loss: 0.4541, test_loss: 2.0944, test_f1: 0.5512
##################ITERATION #7 ****************************************
 epoch: 0, train_loss: 1.2803, test_loss: 1.3451, test_f1: 0.3191
 epoch: 1, train_loss: 1.1836, test_loss: 1.2957, test_f1: 0.3336
 epoch: 2, train_loss: 1.1418, test_loss: 1.2620, test_f1: 0.3316
 epoch: 3, train_loss: 1.1082, test_loss: 1.2350, test_f1: 0.4825
 epoch: 4, train_loss: 1.0979, test_loss: 1.2139, test_f1: 0.5283
 epoch: 5, train_loss: 1.0754, test_loss: 1.2339, test_f1: 0.5507
 epoch: 6, train_loss: 1.0573, test_loss: 1.2865, test_f1: 0.5477
 epoch: 7, train_loss: 1.0326, test_loss: 1.2745, test_f1: 0.5344
 epoch: 8, train_loss: 1.0184, test_loss: 1.3327, test_f1: 0.4973
 epoch: 9, train_loss: 0.9962, test_loss: 1.3239, test_f1: 0.5006
 epoch: 10, train_loss: 0.9889, test_loss: 1.3504, test_f1: 0.5252
 epoch: 11, train_loss: 0.9788, test_loss: 1.3445, test_f1: 0.5447
 epoch: 12, train_loss: 0.9721, test_loss: 1.3257, test_f1: 0.5205
 epoch: 13, train_loss: 0.9566, test_loss: 1.3437, test_f1: 0.5093
 epoch: 14, train_loss: 0.9430, test_loss: 1.3647, test_f1: 0.5095
 epoch: 15, train_loss: 0.9320, test_loss: 1.3208, test_f1: 0.4719
 epoch: 16, train_loss: 0.9009, test_loss: 1.3138, test_f1: 0.4763
 epoch: 17, train_loss: 0.9120, test_loss: 1.2375, test_f1: 0.4969
 epoch: 18, train_loss: 0.8740, test_loss: 1.2571, test_f1: 0.5141
 epoch: 19, train_loss: 0.8839, test_loss: 1.3879, test_f1: 0.5261
 epoch: 20, train_loss: 0.8548, test_loss: 1.3654, test_f1: 0.5171
 epoch: 21, train_loss: 0.8591, test_loss: 1.2956, test_f1: 0.5341
 epoch: 22, train_loss: 0.8500, test_loss: 1.3261, test_f1: 0.5283
 epoch: 23, train_loss: 0.8454, test_loss: 1.3475, test_f1: 0.5127
 epoch: 24, train_loss: 0.8115, test_loss: 1.3711, test_f1: 0.5332
 epoch: 25, train_loss: 0.8158, test_loss: 1.3873, test_f1: 0.5292
 epoch: 26, train_loss: 0.7908, test_loss: 1.4032, test_f1: 0.4898
 epoch: 27, train_loss: 0.8060, test_loss: 1.3467, test_f1: 0.4880
 epoch: 28, train_loss: 0.8020, test_loss: 1.4477, test_f1: 0.5216
 epoch: 29, train_loss: 0.7831, test_loss: 1.4852, test_f1: 0.5185
 epoch: 30, train_loss: 0.7790, test_loss: 1.3908, test_f1: 0.5320
 epoch: 31, train_loss: 0.7709, test_loss: 1.3366, test_f1: 0.5502
 epoch: 32, train_loss: 0.7481, test_loss: 1.4492, test_f1: 0.5428
 epoch: 33, train_loss: 0.7587, test_loss: 1.3898, test_f1: 0.5357
 epoch: 34, train_loss: 0.7626, test_loss: 1.3686, test_f1: 0.5302
 epoch: 35, train_loss: 0.7322, test_loss: 1.4005, test_f1: 0.5483
 epoch: 36, train_loss: 0.7403, test_loss: 1.4077, test_f1: 0.5336
 epoch: 37, train_loss: 0.7162, test_loss: 1.4624, test_f1: 0.5278
 epoch: 38, train_loss: 0.7228, test_loss: 1.5093, test_f1: 0.5261
 epoch: 39, train_loss: 0.6969, test_loss: 1.5455, test_f1: 0.5352
 epoch: 40, train_loss: 0.6961, test_loss: 1.4642, test_f1: 0.5589
 epoch: 41, train_loss: 0.6815, test_loss: 1.4747, test_f1: 0.5467
 epoch: 42, train_loss: 0.6772, test_loss: 1.5690, test_f1: 0.5183
 epoch: 43, train_loss: 0.6791, test_loss: 1.5506, test_f1: 0.5431
 epoch: 44, train_loss: 0.6595, test_loss: 1.5781, test_f1: 0.5532
 epoch: 45, train_loss: 0.6602, test_loss: 1.7104, test_f1: 0.5656
 epoch: 46, train_loss: 0.6652, test_loss: 1.6807, test_f1: 0.5573
 epoch: 47, train_loss: 0.6498, test_loss: 1.6848, test_f1: 0.5440
 epoch: 48, train_loss: 0.6610, test_loss: 1.5358, test_f1: 0.5240
 epoch: 49, train_loss: 0.6443, test_loss: 1.6504, test_f1: 0.5517
 epoch: 50, train_loss: 0.6470, test_loss: 1.7241, test_f1: 0.5325
 epoch: 51, train_loss: 0.6345, test_loss: 1.7189, test_f1: 0.5480
 epoch: 52, train_loss: 0.6176, test_loss: 1.6406, test_f1: 0.5584
 epoch: 53, train_loss: 0.6126, test_loss: 1.5915, test_f1: 0.5651
 epoch: 54, train_loss: 0.6112, test_loss: 1.6376, test_f1: 0.5533
 epoch: 55, train_loss: 0.6187, test_loss: 1.6995, test_f1: 0.5587
 epoch: 56, train_loss: 0.6170, test_loss: 1.7058, test_f1: 0.5410
 epoch: 57, train_loss: 0.6025, test_loss: 1.6431, test_f1: 0.5481
 epoch: 58, train_loss: 0.5929, test_loss: 1.7453, test_f1: 0.5502
 epoch: 59, train_loss: 0.5858, test_loss: 1.7419, test_f1: 0.5299
 epoch: 60, train_loss: 0.5747, test_loss: 1.7490, test_f1: 0.5401
 epoch: 61, train_loss: 0.5935, test_loss: 1.7027, test_f1: 0.5657
 epoch: 62, train_loss: 0.5817, test_loss: 1.7207, test_f1: 0.5677
 epoch: 63, train_loss: 0.5905, test_loss: 1.6084, test_f1: 0.5685
 epoch: 64, train_loss: 0.5920, test_loss: 1.6514, test_f1: 0.5434
 epoch: 65, train_loss: 0.5819, test_loss: 1.7270, test_f1: 0.5512
 epoch: 66, train_loss: 0.5900, test_loss: 1.7772, test_f1: 0.5537
 epoch: 67, train_loss: 0.5626, test_loss: 1.7661, test_f1: 0.5484
 epoch: 68, train_loss: 0.5646, test_loss: 1.7359, test_f1: 0.5438
 epoch: 69, train_loss: 0.5583, test_loss: 1.7985, test_f1: 0.5474
 epoch: 70, train_loss: 0.5627, test_loss: 1.7527, test_f1: 0.5665
 epoch: 71, train_loss: 0.5633, test_loss: 1.7179, test_f1: 0.5368
 epoch: 72, train_loss: 0.5814, test_loss: 1.7375, test_f1: 0.5698
 epoch: 73, train_loss: 0.5500, test_loss: 1.7279, test_f1: 0.5768
 epoch: 74, train_loss: 0.5644, test_loss: 1.8115, test_f1: 0.5676
 epoch: 75, train_loss: 0.5443, test_loss: 1.8755, test_f1: 0.5562
 epoch: 76, train_loss: 0.5523, test_loss: 1.9140, test_f1: 0.5706
 epoch: 77, train_loss: 0.5504, test_loss: 1.9353, test_f1: 0.5611
 epoch: 78, train_loss: 0.5204, test_loss: 1.8917, test_f1: 0.5507
 epoch: 79, train_loss: 0.5335, test_loss: 1.8882, test_f1: 0.5382
 epoch: 80, train_loss: 0.5340, test_loss: 1.8254, test_f1: 0.5615
 epoch: 81, train_loss: 0.5155, test_loss: 1.8082, test_f1: 0.5629
 epoch: 82, train_loss: 0.5249, test_loss: 1.8031, test_f1: 0.5724
 epoch: 83, train_loss: 0.5270, test_loss: 1.8859, test_f1: 0.5572
 epoch: 84, train_loss: 0.5240, test_loss: 1.9566, test_f1: 0.5558
 epoch: 85, train_loss: 0.5369, test_loss: 1.8264, test_f1: 0.5587
 epoch: 86, train_loss: 0.4976, test_loss: 1.8408, test_f1: 0.5510
 epoch: 87, train_loss: 0.5118, test_loss: 1.8507, test_f1: 0.5553
 epoch: 88, train_loss: 0.5030, test_loss: 1.9149, test_f1: 0.5515
 epoch: 89, train_loss: 0.5162, test_loss: 1.9311, test_f1: 0.5599
 epoch: 90, train_loss: 0.5119, test_loss: 1.8405, test_f1: 0.5611
 epoch: 91, train_loss: 0.5036, test_loss: 1.8518, test_f1: 0.5563
 epoch: 92, train_loss: 0.4968, test_loss: 1.8619, test_f1: 0.5366
 epoch: 93, train_loss: 0.5122, test_loss: 1.8374, test_f1: 0.5730
 epoch: 94, train_loss: 0.5162, test_loss: 1.8731, test_f1: 0.5571
 epoch: 95, train_loss: 0.4787, test_loss: 1.9167, test_f1: 0.5682
 epoch: 96, train_loss: 0.4912, test_loss: 1.9345, test_f1: 0.5684
 epoch: 97, train_loss: 0.4857, test_loss: 1.8828, test_f1: 0.5415
 epoch: 98, train_loss: 0.4905, test_loss: 1.8404, test_f1: 0.5699
 epoch: 99, train_loss: 0.5038, test_loss: 1.8111, test_f1: 0.5684
##################ITERATION #8 ****************************************
 epoch: 0, train_loss: 1.3131, test_loss: 1.3363, test_f1: 0.2281
 epoch: 1, train_loss: 1.2131, test_loss: 1.3405, test_f1: 0.3033
 epoch: 2, train_loss: 1.1673, test_loss: 1.3302, test_f1: 0.3919
 epoch: 3, train_loss: 1.1351, test_loss: 1.2966, test_f1: 0.4649
 epoch: 4, train_loss: 1.1135, test_loss: 1.2441, test_f1: 0.5058
 epoch: 5, train_loss: 1.0707, test_loss: 1.2335, test_f1: 0.4917
 epoch: 6, train_loss: 1.0609, test_loss: 1.2141, test_f1: 0.4864
 epoch: 7, train_loss: 1.0490, test_loss: 1.2310, test_f1: 0.5039
 epoch: 8, train_loss: 1.0306, test_loss: 1.2413, test_f1: 0.5224
 epoch: 9, train_loss: 1.0118, test_loss: 1.2198, test_f1: 0.5296
 epoch: 10, train_loss: 1.0023, test_loss: 1.2142, test_f1: 0.5348
 epoch: 11, train_loss: 0.9859, test_loss: 1.2150, test_f1: 0.5508
 epoch: 12, train_loss: 0.9584, test_loss: 1.2111, test_f1: 0.5465
 epoch: 13, train_loss: 0.9620, test_loss: 1.2324, test_f1: 0.5508
 epoch: 14, train_loss: 0.9678, test_loss: 1.2345, test_f1: 0.5389
 epoch: 15, train_loss: 0.9413, test_loss: 1.2416, test_f1: 0.5175
 epoch: 16, train_loss: 0.9131, test_loss: 1.2663, test_f1: 0.5313
 epoch: 17, train_loss: 0.8896, test_loss: 1.3345, test_f1: 0.5390
 epoch: 18, train_loss: 0.9142, test_loss: 1.3292, test_f1: 0.5574
 epoch: 19, train_loss: 0.8703, test_loss: 1.3272, test_f1: 0.5459
 epoch: 20, train_loss: 0.8945, test_loss: 1.3232, test_f1: 0.5257
 epoch: 21, train_loss: 0.8665, test_loss: 1.3502, test_f1: 0.5182
 epoch: 22, train_loss: 0.8552, test_loss: 1.3484, test_f1: 0.5295
 epoch: 23, train_loss: 0.8307, test_loss: 1.3254, test_f1: 0.5432
 epoch: 24, train_loss: 0.8427, test_loss: 1.2916, test_f1: 0.5654
 epoch: 25, train_loss: 0.8132, test_loss: 1.3291, test_f1: 0.5486
 epoch: 26, train_loss: 0.8147, test_loss: 1.3644, test_f1: 0.5687
 epoch: 27, train_loss: 0.8042, test_loss: 1.2595, test_f1: 0.5705
 epoch: 28, train_loss: 0.7751, test_loss: 1.2732, test_f1: 0.5511
 epoch: 29, train_loss: 0.7936, test_loss: 1.3258, test_f1: 0.5426
 epoch: 30, train_loss: 0.7977, test_loss: 1.3322, test_f1: 0.5608
 epoch: 31, train_loss: 0.7581, test_loss: 1.3685, test_f1: 0.5576
 epoch: 32, train_loss: 0.7656, test_loss: 1.3992, test_f1: 0.5351
 epoch: 33, train_loss: 0.7570, test_loss: 1.4044, test_f1: 0.5256
 epoch: 34, train_loss: 0.7332, test_loss: 1.4037, test_f1: 0.5552
 epoch: 35, train_loss: 0.7222, test_loss: 1.4229, test_f1: 0.5337
 epoch: 36, train_loss: 0.7144, test_loss: 1.4477, test_f1: 0.5086
 epoch: 37, train_loss: 0.7057, test_loss: 1.5013, test_f1: 0.5273
 epoch: 38, train_loss: 0.7205, test_loss: 1.4128, test_f1: 0.5296
 epoch: 39, train_loss: 0.7112, test_loss: 1.4467, test_f1: 0.5235
 epoch: 40, train_loss: 0.6987, test_loss: 1.4788, test_f1: 0.5476
 epoch: 41, train_loss: 0.6909, test_loss: 1.3952, test_f1: 0.5166
 epoch: 42, train_loss: 0.6791, test_loss: 1.5542, test_f1: 0.5222
 epoch: 43, train_loss: 0.6931, test_loss: 1.5558, test_f1: 0.5453
 epoch: 44, train_loss: 0.6735, test_loss: 1.5683, test_f1: 0.5401
 epoch: 45, train_loss: 0.6471, test_loss: 1.5962, test_f1: 0.5247
 epoch: 46, train_loss: 0.6683, test_loss: 1.5349, test_f1: 0.5516
 epoch: 47, train_loss: 0.6464, test_loss: 1.5748, test_f1: 0.5351
 epoch: 48, train_loss: 0.6260, test_loss: 1.6485, test_f1: 0.5076
 epoch: 49, train_loss: 0.6384, test_loss: 1.5818, test_f1: 0.5299
 epoch: 50, train_loss: 0.6321, test_loss: 1.6915, test_f1: 0.5350
 epoch: 51, train_loss: 0.6096, test_loss: 1.6780, test_f1: 0.5059
 epoch: 52, train_loss: 0.6285, test_loss: 1.7090, test_f1: 0.5180
 epoch: 53, train_loss: 0.6063, test_loss: 1.6297, test_f1: 0.5176
 epoch: 54, train_loss: 0.6250, test_loss: 1.5539, test_f1: 0.5179
 epoch: 55, train_loss: 0.5814, test_loss: 1.5127, test_f1: 0.5268
 epoch: 56, train_loss: 0.6065, test_loss: 1.6689, test_f1: 0.5158
 epoch: 57, train_loss: 0.5848, test_loss: 1.8277, test_f1: 0.5165
 epoch: 58, train_loss: 0.5659, test_loss: 1.6868, test_f1: 0.5119
 epoch: 59, train_loss: 0.5834, test_loss: 1.6534, test_f1: 0.5189
 epoch: 60, train_loss: 0.5705, test_loss: 1.5604, test_f1: 0.5327
 epoch: 61, train_loss: 0.5910, test_loss: 1.5950, test_f1: 0.5293
 epoch: 62, train_loss: 0.5833, test_loss: 1.6771, test_f1: 0.5293
 epoch: 63, train_loss: 0.5709, test_loss: 1.7144, test_f1: 0.5035
 epoch: 64, train_loss: 0.5688, test_loss: 1.7338, test_f1: 0.5030
 epoch: 65, train_loss: 0.5564, test_loss: 1.6334, test_f1: 0.5148
 epoch: 66, train_loss: 0.5699, test_loss: 1.6368, test_f1: 0.5330
 epoch: 67, train_loss: 0.5480, test_loss: 1.5996, test_f1: 0.5167
 epoch: 68, train_loss: 0.5581, test_loss: 1.7277, test_f1: 0.5172
 epoch: 69, train_loss: 0.5402, test_loss: 1.7423, test_f1: 0.5255
 epoch: 70, train_loss: 0.5512, test_loss: 1.9760, test_f1: 0.5086
 epoch: 71, train_loss: 0.5449, test_loss: 1.9717, test_f1: 0.4937
 epoch: 72, train_loss: 0.5303, test_loss: 1.8625, test_f1: 0.4948
 epoch: 73, train_loss: 0.5373, test_loss: 1.7401, test_f1: 0.5059
 epoch: 74, train_loss: 0.5262, test_loss: 1.7721, test_f1: 0.5118
 epoch: 75, train_loss: 0.5088, test_loss: 1.8580, test_f1: 0.5127
 epoch: 76, train_loss: 0.5207, test_loss: 1.7990, test_f1: 0.5249
 epoch: 77, train_loss: 0.5209, test_loss: 1.8077, test_f1: 0.5348
 epoch: 78, train_loss: 0.5332, test_loss: 1.8069, test_f1: 0.5178
 epoch: 79, train_loss: 0.5160, test_loss: 1.6767, test_f1: 0.5082
 epoch: 80, train_loss: 0.5049, test_loss: 1.7366, test_f1: 0.5235
 epoch: 81, train_loss: 0.5107, test_loss: 1.8025, test_f1: 0.5048
 epoch: 82, train_loss: 0.5008, test_loss: 1.8713, test_f1: 0.5068
 epoch: 83, train_loss: 0.5260, test_loss: 1.8460, test_f1: 0.5082
 epoch: 84, train_loss: 0.5207, test_loss: 1.8662, test_f1: 0.5087
 epoch: 85, train_loss: 0.4853, test_loss: 1.9534, test_f1: 0.5039
 epoch: 86, train_loss: 0.4878, test_loss: 1.9750, test_f1: 0.5018
 epoch: 87, train_loss: 0.5202, test_loss: 1.8554, test_f1: 0.5020
 epoch: 88, train_loss: 0.4903, test_loss: 1.8345, test_f1: 0.5252
 epoch: 89, train_loss: 0.5137, test_loss: 1.8341, test_f1: 0.5063
 epoch: 90, train_loss: 0.4824, test_loss: 1.8844, test_f1: 0.5059
 epoch: 91, train_loss: 0.4777, test_loss: 1.9716, test_f1: 0.5065
 epoch: 92, train_loss: 0.4934, test_loss: 1.8764, test_f1: 0.5111
 epoch: 93, train_loss: 0.4866, test_loss: 1.9151, test_f1: 0.5252
 epoch: 94, train_loss: 0.4763, test_loss: 1.7954, test_f1: 0.5182
 epoch: 95, train_loss: 0.4631, test_loss: 1.8570, test_f1: 0.5091
 epoch: 96, train_loss: 0.4691, test_loss: 1.9743, test_f1: 0.5066
 epoch: 97, train_loss: 0.4679, test_loss: 2.0013, test_f1: 0.5165
 epoch: 98, train_loss: 0.4549, test_loss: 1.8845, test_f1: 0.5178
 epoch: 99, train_loss: 0.4571, test_loss: 1.9329, test_f1: 0.5345
##################ITERATION #9 ****************************************
 epoch: 0, train_loss: 1.3671, test_loss: 1.3188, test_f1: 0.3091
 epoch: 1, train_loss: 1.2045, test_loss: 1.2887, test_f1: 0.3138
 epoch: 2, train_loss: 1.1815, test_loss: 1.3172, test_f1: 0.3893
 epoch: 3, train_loss: 1.1322, test_loss: 1.2643, test_f1: 0.4247
 epoch: 4, train_loss: 1.1134, test_loss: 1.2230, test_f1: 0.4676
 epoch: 5, train_loss: 1.0995, test_loss: 1.1943, test_f1: 0.5049
 epoch: 6, train_loss: 1.0741, test_loss: 1.1920, test_f1: 0.5209
 epoch: 7, train_loss: 1.0567, test_loss: 1.1911, test_f1: 0.5070
 epoch: 8, train_loss: 1.0485, test_loss: 1.1780, test_f1: 0.5344
 epoch: 9, train_loss: 1.0215, test_loss: 1.1535, test_f1: 0.5291
 epoch: 10, train_loss: 1.0072, test_loss: 1.1706, test_f1: 0.5305
 epoch: 11, train_loss: 0.9968, test_loss: 1.1566, test_f1: 0.5358
 epoch: 12, train_loss: 0.9934, test_loss: 1.1472, test_f1: 0.5284
 epoch: 13, train_loss: 0.9567, test_loss: 1.1555, test_f1: 0.5327
 epoch: 14, train_loss: 0.9581, test_loss: 1.1440, test_f1: 0.5519
 epoch: 15, train_loss: 0.9585, test_loss: 1.1654, test_f1: 0.5273
 epoch: 16, train_loss: 0.9294, test_loss: 1.2219, test_f1: 0.4978
 epoch: 17, train_loss: 0.9266, test_loss: 1.2123, test_f1: 0.5009
 epoch: 18, train_loss: 0.8998, test_loss: 1.1506, test_f1: 0.5295
 epoch: 19, train_loss: 0.8938, test_loss: 1.1443, test_f1: 0.5360
 epoch: 20, train_loss: 0.8956, test_loss: 1.1616, test_f1: 0.5152
 epoch: 21, train_loss: 0.8674, test_loss: 1.1622, test_f1: 0.5284
 epoch: 22, train_loss: 0.8565, test_loss: 1.2062, test_f1: 0.5269
 epoch: 23, train_loss: 0.8588, test_loss: 1.1826, test_f1: 0.5271
 epoch: 24, train_loss: 0.8463, test_loss: 1.1393, test_f1: 0.5447
 epoch: 25, train_loss: 0.8337, test_loss: 1.1339, test_f1: 0.5481
 epoch: 26, train_loss: 0.8310, test_loss: 1.1573, test_f1: 0.5352
 epoch: 27, train_loss: 0.8153, test_loss: 1.1868, test_f1: 0.5418
 epoch: 28, train_loss: 0.8123, test_loss: 1.1773, test_f1: 0.5458
 epoch: 29, train_loss: 0.7947, test_loss: 1.1735, test_f1: 0.5348
 epoch: 30, train_loss: 0.7960, test_loss: 1.1811, test_f1: 0.5285
 epoch: 31, train_loss: 0.7851, test_loss: 1.2140, test_f1: 0.5356
 epoch: 32, train_loss: 0.7907, test_loss: 1.2666, test_f1: 0.5271
 epoch: 33, train_loss: 0.7681, test_loss: 1.2438, test_f1: 0.5283
 epoch: 34, train_loss: 0.7716, test_loss: 1.1780, test_f1: 0.5479
 epoch: 35, train_loss: 0.7561, test_loss: 1.2713, test_f1: 0.5191
 epoch: 36, train_loss: 0.7599, test_loss: 1.2939, test_f1: 0.5260
 epoch: 37, train_loss: 0.7545, test_loss: 1.2779, test_f1: 0.5220
 epoch: 38, train_loss: 0.7336, test_loss: 1.2804, test_f1: 0.5592
 epoch: 39, train_loss: 0.7330, test_loss: 1.3047, test_f1: 0.5477
 epoch: 40, train_loss: 0.7264, test_loss: 1.3229, test_f1: 0.5491
 epoch: 41, train_loss: 0.7209, test_loss: 1.3521, test_f1: 0.5470
 epoch: 42, train_loss: 0.7048, test_loss: 1.3081, test_f1: 0.5285
 epoch: 43, train_loss: 0.7051, test_loss: 1.2792, test_f1: 0.5332
 epoch: 44, train_loss: 0.6955, test_loss: 1.3392, test_f1: 0.5301
 epoch: 45, train_loss: 0.6805, test_loss: 1.2663, test_f1: 0.5255
 epoch: 46, train_loss: 0.6791, test_loss: 1.2806, test_f1: 0.5178
 epoch: 47, train_loss: 0.6632, test_loss: 1.2492, test_f1: 0.5347
 epoch: 48, train_loss: 0.6818, test_loss: 1.2657, test_f1: 0.5580
 epoch: 49, train_loss: 0.6628, test_loss: 1.3025, test_f1: 0.5430
 epoch: 50, train_loss: 0.6490, test_loss: 1.3818, test_f1: 0.5556
 epoch: 51, train_loss: 0.6514, test_loss: 1.2973, test_f1: 0.5532
 epoch: 52, train_loss: 0.6478, test_loss: 1.3734, test_f1: 0.5370
 epoch: 53, train_loss: 0.6422, test_loss: 1.3594, test_f1: 0.5355
 epoch: 54, train_loss: 0.6342, test_loss: 1.3132, test_f1: 0.5454
 epoch: 55, train_loss: 0.6205, test_loss: 1.3440, test_f1: 0.5396
 epoch: 56, train_loss: 0.5969, test_loss: 1.3574, test_f1: 0.5532
 epoch: 57, train_loss: 0.6232, test_loss: 1.3441, test_f1: 0.5487
 epoch: 58, train_loss: 0.5979, test_loss: 1.3560, test_f1: 0.5453
 epoch: 59, train_loss: 0.5989, test_loss: 1.3825, test_f1: 0.5468
 epoch: 60, train_loss: 0.6116, test_loss: 1.3227, test_f1: 0.5539
 epoch: 61, train_loss: 0.6115, test_loss: 1.3663, test_f1: 0.5451
 epoch: 62, train_loss: 0.5976, test_loss: 1.4052, test_f1: 0.5362
 epoch: 63, train_loss: 0.6072, test_loss: 1.4240, test_f1: 0.5372
 epoch: 64, train_loss: 0.5901, test_loss: 1.3825, test_f1: 0.5381
 epoch: 65, train_loss: 0.6133, test_loss: 1.3725, test_f1: 0.5327
 epoch: 66, train_loss: 0.5931, test_loss: 1.3289, test_f1: 0.5422
 epoch: 67, train_loss: 0.6067, test_loss: 1.3507, test_f1: 0.5543
 epoch: 68, train_loss: 0.5874, test_loss: 1.3167, test_f1: 0.5637
 epoch: 69, train_loss: 0.6003, test_loss: 1.3584, test_f1: 0.5345
 epoch: 70, train_loss: 0.5815, test_loss: 1.2965, test_f1: 0.5473
 epoch: 71, train_loss: 0.5621, test_loss: 1.3256, test_f1: 0.5581
 epoch: 72, train_loss: 0.5647, test_loss: 1.3288, test_f1: 0.5440
 epoch: 73, train_loss: 0.5744, test_loss: 1.3496, test_f1: 0.5539
 epoch: 74, train_loss: 0.5469, test_loss: 1.3493, test_f1: 0.5521
 epoch: 75, train_loss: 0.5567, test_loss: 1.3333, test_f1: 0.5547
 epoch: 76, train_loss: 0.5502, test_loss: 1.3730, test_f1: 0.5577
 epoch: 77, train_loss: 0.5602, test_loss: 1.3375, test_f1: 0.5504
 epoch: 78, train_loss: 0.5768, test_loss: 1.4383, test_f1: 0.5446
 epoch: 79, train_loss: 0.5648, test_loss: 1.4404, test_f1: 0.5421
 epoch: 80, train_loss: 0.5556, test_loss: 1.4543, test_f1: 0.5259
 epoch: 81, train_loss: 0.5360, test_loss: 1.4565, test_f1: 0.5317
 epoch: 82, train_loss: 0.5297, test_loss: 1.4272, test_f1: 0.5346
 epoch: 83, train_loss: 0.5482, test_loss: 1.4058, test_f1: 0.5503
 epoch: 84, train_loss: 0.5374, test_loss: 1.5270, test_f1: 0.5192
 epoch: 85, train_loss: 0.5437, test_loss: 1.6076, test_f1: 0.5151
 epoch: 86, train_loss: 0.5374, test_loss: 1.5951, test_f1: 0.5272
 epoch: 87, train_loss: 0.5306, test_loss: 1.5048, test_f1: 0.5453
 epoch: 88, train_loss: 0.5214, test_loss: 1.5172, test_f1: 0.5246
 epoch: 89, train_loss: 0.5248, test_loss: 1.5780, test_f1: 0.5307
 epoch: 90, train_loss: 0.5249, test_loss: 1.5901, test_f1: 0.5339
 epoch: 91, train_loss: 0.5301, test_loss: 1.4903, test_f1: 0.5335
 epoch: 92, train_loss: 0.5242, test_loss: 1.5414, test_f1: 0.5369
 epoch: 93, train_loss: 0.5214, test_loss: 1.5124, test_f1: 0.5349
 epoch: 94, train_loss: 0.4976, test_loss: 1.4843, test_f1: 0.5362
 epoch: 95, train_loss: 0.5149, test_loss: 1.5666, test_f1: 0.5507
 epoch: 96, train_loss: 0.5172, test_loss: 1.5290, test_f1: 0.5418
 epoch: 97, train_loss: 0.5179, test_loss: 1.4999, test_f1: 0.5473
 epoch: 98, train_loss: 0.5045, test_loss: 1.4902, test_f1: 0.5456
 epoch: 99, train_loss: 0.5102, test_loss: 1.4952, test_f1: 0.5536

Training completed in 343.58 seconds
Best F1: 0.6351 at epoch 39
Mean F1 across iterations: 0.5892  0.0238
========================FINAL RESULTS================================
FEGIN weighted F1: 0.6351  0.0238
python main.py --data ltspice_demos --representation component_component --model FEGIN --layers 4 --hiddens 128 --batch_size 128 --lr 0.0001 --emb_size 128 --epochs 100 --save_appendix component_component_L4_H128_BS128_LR0.0001_E128 --no_val
-----



STDERR:
  File "main.py", line 370, in <module>
    main()
  File "main.py", line 254, in main
    dataset = dataset_class(
  File "/home/philip/projects/ltspice_examples_code_repo/Circuit-Completion-Using-GNNs/component_classification_with_link_prediction_head/evaluation/FEGIN/kernel/circuit_datasets.py", line 15, in __init__
    self.data, self.slices = torch.load(self.processed_paths[0])
  File "/home/philip/.local/lib/python3.8/site-packages/torch/serialization.py", line 1040, in load
    warnings.warn(
  File "/usr/lib/python3.8/warnings.py", line 109, in _showwarnmsg
    sw(msg.message, msg.category, msg.filename, msg.lineno,
  File "main.py", line 47, in warn_with_traceback
    traceback.print_stack(file=log)
/home/philip/projects/ltspice_examples_code_repo/Circuit-Completion-Using-GNNs/component_classification_with_link_prediction_head/evaluation/FEGIN/kernel/circuit_datasets.py:15: FutureWarning: You are using `torch.load` with `weights_only=False` (the current default value), which uses the default pickle module implicitly. It is possible to construct malicious pickle data which will execute arbitrary code during unpickling (See https://github.com/pytorch/pytorch/blob/main/SECURITY.md#untrusted-models for more details). In a future release, the default value for `weights_only` will be flipped to `True`. This limits the functions that could be executed during unpickling. Arbitrary objects will no longer be allowed to be loaded via this mode unless they are explicitly allowlisted by the user via `torch.serialization.add_safe_globals`. We recommend you start setting `weights_only=True` for any use case where you don't have full control of the loaded file. Please open an issue on GitHub for any issues related to this experimental feature.
  self.data, self.slices = torch.load(self.processed_paths[0])
