STDOUT:
Results will be saved in /home/philip/projects/ltspice_examples_code_repo/Circuit-Completion-Using-GNNs/component_classification_with_link_prediction_head/evaluation/FEGIN/results/model_FEGIN_dataset_ltspice_demos
Command line input: python main.py --data ltspice_demos --representation component_component --model FEGIN --layers 5 --hiddens 16 --batch_size 128 --lr 0.001 --emb_size 128 --epochs 100 --save_appendix component_component_L5_H16_BS128_LR0.001_E128 --no_val
 is saved.
-----
ltspice_demos - FEGIN
Using 5 layers, 16 hidden units, h = 2
Loading component_component representation dataset
Loading component_component representation data...
Loaded 1948 examples (component_component)
saving path: data/processed/ltspice_demos_component_component_processed.pt
ENTERED
Training FEGIN on component_component representation
Train: 1565, Test: 383
##################ITERATION #0 ****************************************
 epoch: 0, train_loss: 1.4038, test_loss: 1.3953, test_f1: 0.0301
 epoch: 1, train_loss: 1.3767, test_loss: 1.3775, test_f1: 0.1945
 epoch: 2, train_loss: 1.3571, test_loss: 1.3590, test_f1: 0.2287
 epoch: 3, train_loss: 1.3365, test_loss: 1.3406, test_f1: 0.2356
 epoch: 4, train_loss: 1.3139, test_loss: 1.3221, test_f1: 0.2281
 epoch: 5, train_loss: 1.2879, test_loss: 1.3078, test_f1: 0.2281
 epoch: 6, train_loss: 1.2698, test_loss: 1.2966, test_f1: 0.2281
 epoch: 7, train_loss: 1.2540, test_loss: 1.2859, test_f1: 0.2281
 epoch: 8, train_loss: 1.2389, test_loss: 1.2778, test_f1: 0.2253
 epoch: 9, train_loss: 1.2229, test_loss: 1.2681, test_f1: 0.2567
 epoch: 10, train_loss: 1.2138, test_loss: 1.2619, test_f1: 0.2767
 epoch: 11, train_loss: 1.1992, test_loss: 1.2591, test_f1: 0.3003
 epoch: 12, train_loss: 1.1986, test_loss: 1.2627, test_f1: 0.3183
 epoch: 13, train_loss: 1.1872, test_loss: 1.2510, test_f1: 0.3539
 epoch: 14, train_loss: 1.1816, test_loss: 1.2467, test_f1: 0.3589
 epoch: 15, train_loss: 1.1714, test_loss: 1.2475, test_f1: 0.3493
 epoch: 16, train_loss: 1.1668, test_loss: 1.2521, test_f1: 0.3548
 epoch: 17, train_loss: 1.1534, test_loss: 1.2578, test_f1: 0.3569
 epoch: 18, train_loss: 1.1500, test_loss: 1.2517, test_f1: 0.3572
 epoch: 19, train_loss: 1.1441, test_loss: 1.2449, test_f1: 0.3635
 epoch: 20, train_loss: 1.1286, test_loss: 1.2405, test_f1: 0.3479
 epoch: 21, train_loss: 1.1330, test_loss: 1.2547, test_f1: 0.3818
 epoch: 22, train_loss: 1.1281, test_loss: 1.2655, test_f1: 0.3834
 epoch: 23, train_loss: 1.1120, test_loss: 1.2939, test_f1: 0.4090
 epoch: 24, train_loss: 1.1047, test_loss: 1.2919, test_f1: 0.4542
 epoch: 25, train_loss: 1.0932, test_loss: 1.3430, test_f1: 0.4985
 epoch: 26, train_loss: 1.0982, test_loss: 1.2784, test_f1: 0.4840
 epoch: 27, train_loss: 1.0758, test_loss: 1.3113, test_f1: 0.4617
 epoch: 28, train_loss: 1.0630, test_loss: 1.3163, test_f1: 0.4659
 epoch: 29, train_loss: 1.0758, test_loss: 1.4077, test_f1: 0.4488
 epoch: 30, train_loss: 1.0569, test_loss: 1.4440, test_f1: 0.4588
 epoch: 31, train_loss: 1.0606, test_loss: 1.3821, test_f1: 0.4520
 epoch: 32, train_loss: 1.0546, test_loss: 1.4685, test_f1: 0.4573
 epoch: 33, train_loss: 1.0506, test_loss: 1.3999, test_f1: 0.4452
 epoch: 34, train_loss: 1.0411, test_loss: 1.4548, test_f1: 0.4686
 epoch: 35, train_loss: 1.0507, test_loss: 1.4517, test_f1: 0.4449
 epoch: 36, train_loss: 1.0243, test_loss: 1.4522, test_f1: 0.4593
 epoch: 37, train_loss: 1.0306, test_loss: 1.4330, test_f1: 0.4309
 epoch: 38, train_loss: 1.0227, test_loss: 1.4460, test_f1: 0.4646
 epoch: 39, train_loss: 1.0115, test_loss: 1.5122, test_f1: 0.4368
 epoch: 40, train_loss: 1.0136, test_loss: 1.5319, test_f1: 0.4545
 epoch: 41, train_loss: 1.0084, test_loss: 1.5511, test_f1: 0.4744
 epoch: 42, train_loss: 1.0015, test_loss: 1.6329, test_f1: 0.4316
 epoch: 43, train_loss: 1.0028, test_loss: 1.6848, test_f1: 0.4494
 epoch: 44, train_loss: 0.9768, test_loss: 1.6717, test_f1: 0.4712
 epoch: 45, train_loss: 0.9786, test_loss: 1.5928, test_f1: 0.4530
 epoch: 46, train_loss: 1.0084, test_loss: 1.5932, test_f1: 0.4581
 epoch: 47, train_loss: 0.9837, test_loss: 1.5381, test_f1: 0.4472
 epoch: 48, train_loss: 0.9845, test_loss: 1.5729, test_f1: 0.4882
 epoch: 49, train_loss: 0.9747, test_loss: 1.6417, test_f1: 0.4742
 epoch: 50, train_loss: 0.9604, test_loss: 1.7041, test_f1: 0.5000
 epoch: 51, train_loss: 0.9798, test_loss: 1.7338, test_f1: 0.5002
 epoch: 52, train_loss: 0.9589, test_loss: 1.7317, test_f1: 0.4860
 epoch: 53, train_loss: 0.9526, test_loss: 1.6276, test_f1: 0.4783
 epoch: 54, train_loss: 0.9431, test_loss: 1.6387, test_f1: 0.4968
 epoch: 55, train_loss: 0.9579, test_loss: 1.6779, test_f1: 0.4992
 epoch: 56, train_loss: 0.9339, test_loss: 1.6361, test_f1: 0.4907
 epoch: 57, train_loss: 0.9452, test_loss: 1.5790, test_f1: 0.5062
 epoch: 58, train_loss: 0.9586, test_loss: 1.6773, test_f1: 0.5039
 epoch: 59, train_loss: 0.9267, test_loss: 1.7112, test_f1: 0.5023
 epoch: 60, train_loss: 0.9380, test_loss: 1.7232, test_f1: 0.5164
 epoch: 61, train_loss: 0.9356, test_loss: 1.6928, test_f1: 0.4992
 epoch: 62, train_loss: 0.9344, test_loss: 1.7415, test_f1: 0.5148
 epoch: 63, train_loss: 0.9308, test_loss: 1.6766, test_f1: 0.4965
 epoch: 64, train_loss: 0.9383, test_loss: 1.6924, test_f1: 0.4926
 epoch: 65, train_loss: 0.9480, test_loss: 1.8457, test_f1: 0.5146
 epoch: 66, train_loss: 0.9362, test_loss: 1.7394, test_f1: 0.4837
 epoch: 67, train_loss: 0.9190, test_loss: 1.7598, test_f1: 0.5157
 epoch: 68, train_loss: 0.9249, test_loss: 1.7095, test_f1: 0.5027
 epoch: 69, train_loss: 0.9250, test_loss: 1.6371, test_f1: 0.5052
 epoch: 70, train_loss: 0.9378, test_loss: 1.7036, test_f1: 0.4955
 epoch: 71, train_loss: 0.9322, test_loss: 1.6976, test_f1: 0.4894
 epoch: 72, train_loss: 0.9295, test_loss: 1.7304, test_f1: 0.5008
 epoch: 73, train_loss: 0.9174, test_loss: 1.6127, test_f1: 0.5258
 epoch: 74, train_loss: 0.9164, test_loss: 1.5938, test_f1: 0.5129
 epoch: 75, train_loss: 0.9206, test_loss: 1.6493, test_f1: 0.5228
 epoch: 76, train_loss: 0.9084, test_loss: 1.6423, test_f1: 0.5154
 epoch: 77, train_loss: 0.9130, test_loss: 1.6901, test_f1: 0.5045
 epoch: 78, train_loss: 0.9011, test_loss: 1.6949, test_f1: 0.5139
 epoch: 79, train_loss: 0.9331, test_loss: 1.7294, test_f1: 0.5033
 epoch: 80, train_loss: 0.9000, test_loss: 1.7847, test_f1: 0.5116
 epoch: 81, train_loss: 0.9076, test_loss: 1.7467, test_f1: 0.5038
 epoch: 82, train_loss: 0.8984, test_loss: 1.6788, test_f1: 0.5133
 epoch: 83, train_loss: 0.9125, test_loss: 1.6308, test_f1: 0.5249
 epoch: 84, train_loss: 0.9012, test_loss: 1.6393, test_f1: 0.5141
 epoch: 85, train_loss: 0.8901, test_loss: 1.5733, test_f1: 0.5086
 epoch: 86, train_loss: 0.8827, test_loss: 1.6260, test_f1: 0.5072
 epoch: 87, train_loss: 0.8789, test_loss: 1.6361, test_f1: 0.5231
 epoch: 88, train_loss: 0.8814, test_loss: 1.6702, test_f1: 0.5153
 epoch: 89, train_loss: 0.8968, test_loss: 1.7242, test_f1: 0.5006
 epoch: 90, train_loss: 0.8897, test_loss: 1.8314, test_f1: 0.5070
 epoch: 91, train_loss: 0.9045, test_loss: 1.7151, test_f1: 0.4840
 epoch: 92, train_loss: 0.8987, test_loss: 1.6723, test_f1: 0.5072
 epoch: 93, train_loss: 0.8789, test_loss: 1.6323, test_f1: 0.5089
 epoch: 94, train_loss: 0.8757, test_loss: 1.6707, test_f1: 0.5099
 epoch: 95, train_loss: 0.8695, test_loss: 1.6607, test_f1: 0.5222
 epoch: 96, train_loss: 0.8809, test_loss: 1.5654, test_f1: 0.5267
 epoch: 97, train_loss: 0.8851, test_loss: 1.5945, test_f1: 0.4954
 epoch: 98, train_loss: 0.8784, test_loss: 1.6362, test_f1: 0.4947
 epoch: 99, train_loss: 0.8875, test_loss: 1.6418, test_f1: 0.4924
##################ITERATION #1 ****************************************
 epoch: 0, train_loss: 1.2836, test_loss: 1.3110, test_f1: 0.3049
 epoch: 1, train_loss: 1.2395, test_loss: 1.3104, test_f1: 0.2898
 epoch: 2, train_loss: 1.2140, test_loss: 1.3047, test_f1: 0.3226
 epoch: 3, train_loss: 1.2041, test_loss: 1.2867, test_f1: 0.3136
 epoch: 4, train_loss: 1.1915, test_loss: 1.2885, test_f1: 0.3305
 epoch: 5, train_loss: 1.1775, test_loss: 1.2914, test_f1: 0.3757
 epoch: 6, train_loss: 1.1697, test_loss: 1.2727, test_f1: 0.4466
 epoch: 7, train_loss: 1.1582, test_loss: 1.2611, test_f1: 0.4237
 epoch: 8, train_loss: 1.1453, test_loss: 1.2746, test_f1: 0.4291
 epoch: 9, train_loss: 1.1254, test_loss: 1.2653, test_f1: 0.4320
 epoch: 10, train_loss: 1.1202, test_loss: 1.2488, test_f1: 0.4311
 epoch: 11, train_loss: 1.1119, test_loss: 1.2304, test_f1: 0.4441
 epoch: 12, train_loss: 1.1095, test_loss: 1.2326, test_f1: 0.4430
 epoch: 13, train_loss: 1.0915, test_loss: 1.2200, test_f1: 0.4707
 epoch: 14, train_loss: 1.0826, test_loss: 1.2231, test_f1: 0.4664
 epoch: 15, train_loss: 1.0736, test_loss: 1.2161, test_f1: 0.4845
 epoch: 16, train_loss: 1.0647, test_loss: 1.2136, test_f1: 0.4978
 epoch: 17, train_loss: 1.0553, test_loss: 1.2206, test_f1: 0.4933
 epoch: 18, train_loss: 1.0605, test_loss: 1.1944, test_f1: 0.4814
 epoch: 19, train_loss: 1.0450, test_loss: 1.1966, test_f1: 0.5037
 epoch: 20, train_loss: 1.0369, test_loss: 1.1673, test_f1: 0.4779
 epoch: 21, train_loss: 1.0200, test_loss: 1.1739, test_f1: 0.4941
 epoch: 22, train_loss: 1.0122, test_loss: 1.2130, test_f1: 0.4676
 epoch: 23, train_loss: 1.0161, test_loss: 1.2021, test_f1: 0.4886
 epoch: 24, train_loss: 1.0061, test_loss: 1.1676, test_f1: 0.4806
 epoch: 25, train_loss: 0.9984, test_loss: 1.1568, test_f1: 0.5056
 epoch: 26, train_loss: 0.9962, test_loss: 1.1761, test_f1: 0.4915
 epoch: 27, train_loss: 0.9950, test_loss: 1.1665, test_f1: 0.5141
 epoch: 28, train_loss: 0.9823, test_loss: 1.1588, test_f1: 0.5078
 epoch: 29, train_loss: 0.9838, test_loss: 1.1521, test_f1: 0.5175
 epoch: 30, train_loss: 0.9797, test_loss: 1.1606, test_f1: 0.5158
 epoch: 31, train_loss: 0.9661, test_loss: 1.1640, test_f1: 0.5136
 epoch: 32, train_loss: 0.9531, test_loss: 1.1518, test_f1: 0.5310
 epoch: 33, train_loss: 0.9598, test_loss: 1.1740, test_f1: 0.5057
 epoch: 34, train_loss: 0.9702, test_loss: 1.1358, test_f1: 0.5240
 epoch: 35, train_loss: 0.9625, test_loss: 1.1695, test_f1: 0.5229
 epoch: 36, train_loss: 0.9447, test_loss: 1.1676, test_f1: 0.5008
 epoch: 37, train_loss: 0.9317, test_loss: 1.1785, test_f1: 0.5114
 epoch: 38, train_loss: 0.9529, test_loss: 1.1136, test_f1: 0.5562
 epoch: 39, train_loss: 0.9497, test_loss: 1.1316, test_f1: 0.5349
 epoch: 40, train_loss: 0.9463, test_loss: 1.1926, test_f1: 0.4836
 epoch: 41, train_loss: 0.9287, test_loss: 1.1537, test_f1: 0.5248
 epoch: 42, train_loss: 0.9344, test_loss: 1.1227, test_f1: 0.5312
 epoch: 43, train_loss: 0.9232, test_loss: 1.1532, test_f1: 0.5010
 epoch: 44, train_loss: 0.9326, test_loss: 1.1513, test_f1: 0.5104
 epoch: 45, train_loss: 0.9240, test_loss: 1.1500, test_f1: 0.5291
 epoch: 46, train_loss: 0.9165, test_loss: 1.1491, test_f1: 0.5006
 epoch: 47, train_loss: 0.9006, test_loss: 1.1343, test_f1: 0.5117
 epoch: 48, train_loss: 0.9033, test_loss: 1.1419, test_f1: 0.4855
 epoch: 49, train_loss: 0.8981, test_loss: 1.1684, test_f1: 0.5365
 epoch: 50, train_loss: 0.8913, test_loss: 1.1614, test_f1: 0.5190
 epoch: 51, train_loss: 0.8731, test_loss: 1.1514, test_f1: 0.5223
 epoch: 52, train_loss: 0.8827, test_loss: 1.1509, test_f1: 0.5090
 epoch: 53, train_loss: 0.8683, test_loss: 1.1720, test_f1: 0.4905
 epoch: 54, train_loss: 0.8803, test_loss: 1.1755, test_f1: 0.4968
 epoch: 55, train_loss: 0.8854, test_loss: 1.1672, test_f1: 0.5141
 epoch: 56, train_loss: 0.8763, test_loss: 1.1723, test_f1: 0.5043
 epoch: 57, train_loss: 0.8775, test_loss: 1.2472, test_f1: 0.4884
 epoch: 58, train_loss: 0.8563, test_loss: 1.2050, test_f1: 0.5143
 epoch: 59, train_loss: 0.8421, test_loss: 1.2035, test_f1: 0.5248
 epoch: 60, train_loss: 0.8569, test_loss: 1.1908, test_f1: 0.5247
 epoch: 61, train_loss: 0.8629, test_loss: 1.1832, test_f1: 0.4835
 epoch: 62, train_loss: 0.8461, test_loss: 1.2162, test_f1: 0.5220
 epoch: 63, train_loss: 0.8442, test_loss: 1.2411, test_f1: 0.5168
 epoch: 64, train_loss: 0.8425, test_loss: 1.1925, test_f1: 0.5201
 epoch: 65, train_loss: 0.8433, test_loss: 1.2083, test_f1: 0.5197
 epoch: 66, train_loss: 0.8297, test_loss: 1.2360, test_f1: 0.5219
 epoch: 67, train_loss: 0.8487, test_loss: 1.2111, test_f1: 0.5113
 epoch: 68, train_loss: 0.8534, test_loss: 1.2124, test_f1: 0.5198
 epoch: 69, train_loss: 0.8486, test_loss: 1.2140, test_f1: 0.5005
 epoch: 70, train_loss: 0.8461, test_loss: 1.1963, test_f1: 0.5142
 epoch: 71, train_loss: 0.8436, test_loss: 1.1945, test_f1: 0.5247
 epoch: 72, train_loss: 0.8349, test_loss: 1.1490, test_f1: 0.5195
 epoch: 73, train_loss: 0.8235, test_loss: 1.1476, test_f1: 0.5195
 epoch: 74, train_loss: 0.8330, test_loss: 1.1618, test_f1: 0.5143
 epoch: 75, train_loss: 0.8223, test_loss: 1.1746, test_f1: 0.5167
 epoch: 76, train_loss: 0.8274, test_loss: 1.2134, test_f1: 0.5163
 epoch: 77, train_loss: 0.8283, test_loss: 1.1808, test_f1: 0.5018
 epoch: 78, train_loss: 0.8233, test_loss: 1.1849, test_f1: 0.5230
 epoch: 79, train_loss: 0.8174, test_loss: 1.1779, test_f1: 0.5193
 epoch: 80, train_loss: 0.8251, test_loss: 1.1524, test_f1: 0.5250
 epoch: 81, train_loss: 0.8154, test_loss: 1.2074, test_f1: 0.5251
 epoch: 82, train_loss: 0.8076, test_loss: 1.1894, test_f1: 0.5148
 epoch: 83, train_loss: 0.8183, test_loss: 1.1815, test_f1: 0.5068
 epoch: 84, train_loss: 0.8091, test_loss: 1.1667, test_f1: 0.5114
 epoch: 85, train_loss: 0.8131, test_loss: 1.1521, test_f1: 0.5249
 epoch: 86, train_loss: 0.8189, test_loss: 1.1536, test_f1: 0.5354
 epoch: 87, train_loss: 0.8083, test_loss: 1.2113, test_f1: 0.5013
 epoch: 88, train_loss: 0.8173, test_loss: 1.2309, test_f1: 0.5063
 epoch: 89, train_loss: 0.7998, test_loss: 1.1983, test_f1: 0.5275
 epoch: 90, train_loss: 0.7893, test_loss: 1.1649, test_f1: 0.5221
 epoch: 91, train_loss: 0.7917, test_loss: 1.1730, test_f1: 0.5299
 epoch: 92, train_loss: 0.7941, test_loss: 1.1868, test_f1: 0.5139
 epoch: 93, train_loss: 0.7923, test_loss: 1.1831, test_f1: 0.5480
 epoch: 94, train_loss: 0.7924, test_loss: 1.1946, test_f1: 0.5419
 epoch: 95, train_loss: 0.7775, test_loss: 1.1723, test_f1: 0.5188
 epoch: 96, train_loss: 0.7936, test_loss: 1.1973, test_f1: 0.5408
 epoch: 97, train_loss: 0.7842, test_loss: 1.1910, test_f1: 0.5481
 epoch: 98, train_loss: 0.7836, test_loss: 1.1779, test_f1: 0.5511
 epoch: 99, train_loss: 0.7822, test_loss: 1.1916, test_f1: 0.5554
##################ITERATION #2 ****************************************
 epoch: 0, train_loss: 1.3619, test_loss: 1.3578, test_f1: 0.1420
 epoch: 1, train_loss: 1.2680, test_loss: 1.3240, test_f1: 0.1531
 epoch: 2, train_loss: 1.2417, test_loss: 1.3117, test_f1: 0.2251
 epoch: 3, train_loss: 1.2235, test_loss: 1.3074, test_f1: 0.3389
 epoch: 4, train_loss: 1.2134, test_loss: 1.3059, test_f1: 0.3531
 epoch: 5, train_loss: 1.2062, test_loss: 1.2948, test_f1: 0.3594
 epoch: 6, train_loss: 1.1844, test_loss: 1.2837, test_f1: 0.3681
 epoch: 7, train_loss: 1.1766, test_loss: 1.2839, test_f1: 0.3693
 epoch: 8, train_loss: 1.1746, test_loss: 1.2925, test_f1: 0.3999
 epoch: 9, train_loss: 1.1569, test_loss: 1.2571, test_f1: 0.3894
 epoch: 10, train_loss: 1.1549, test_loss: 1.2469, test_f1: 0.4053
 epoch: 11, train_loss: 1.1387, test_loss: 1.2202, test_f1: 0.3759
 epoch: 12, train_loss: 1.1285, test_loss: 1.2290, test_f1: 0.3960
 epoch: 13, train_loss: 1.1151, test_loss: 1.2236, test_f1: 0.4481
 epoch: 14, train_loss: 1.1024, test_loss: 1.2104, test_f1: 0.4214
 epoch: 15, train_loss: 1.0915, test_loss: 1.1827, test_f1: 0.4535
 epoch: 16, train_loss: 1.0863, test_loss: 1.1735, test_f1: 0.4690
 epoch: 17, train_loss: 1.0616, test_loss: 1.1896, test_f1: 0.4648
 epoch: 18, train_loss: 1.0658, test_loss: 1.1458, test_f1: 0.4901
 epoch: 19, train_loss: 1.0537, test_loss: 1.1539, test_f1: 0.5114
 epoch: 20, train_loss: 1.0449, test_loss: 1.1203, test_f1: 0.5081
 epoch: 21, train_loss: 1.0328, test_loss: 1.1238, test_f1: 0.5322
 epoch: 22, train_loss: 1.0341, test_loss: 1.1224, test_f1: 0.5007
 epoch: 23, train_loss: 1.0282, test_loss: 1.1142, test_f1: 0.5215
 epoch: 24, train_loss: 1.0120, test_loss: 1.1093, test_f1: 0.5359
 epoch: 25, train_loss: 0.9970, test_loss: 1.1031, test_f1: 0.5484
 epoch: 26, train_loss: 0.9946, test_loss: 1.0947, test_f1: 0.5645
 epoch: 27, train_loss: 0.9836, test_loss: 1.1000, test_f1: 0.5504
 epoch: 28, train_loss: 0.9686, test_loss: 1.1030, test_f1: 0.5483
 epoch: 29, train_loss: 0.9744, test_loss: 1.1148, test_f1: 0.5680
 epoch: 30, train_loss: 0.9621, test_loss: 1.1315, test_f1: 0.5459
 epoch: 31, train_loss: 0.9543, test_loss: 1.1356, test_f1: 0.5659
 epoch: 32, train_loss: 0.9553, test_loss: 1.1066, test_f1: 0.5741
 epoch: 33, train_loss: 0.9554, test_loss: 1.1335, test_f1: 0.5606
 epoch: 34, train_loss: 0.9386, test_loss: 1.1094, test_f1: 0.5623
 epoch: 35, train_loss: 0.9545, test_loss: 1.1045, test_f1: 0.5741
 epoch: 36, train_loss: 0.9388, test_loss: 1.1120, test_f1: 0.5852
 epoch: 37, train_loss: 0.9386, test_loss: 1.1101, test_f1: 0.5370
 epoch: 38, train_loss: 0.9373, test_loss: 1.0754, test_f1: 0.5607
 epoch: 39, train_loss: 0.9349, test_loss: 1.0625, test_f1: 0.5515
 epoch: 40, train_loss: 0.9102, test_loss: 1.0590, test_f1: 0.5743
 epoch: 41, train_loss: 0.9011, test_loss: 1.0510, test_f1: 0.6033
 epoch: 42, train_loss: 0.9042, test_loss: 1.0818, test_f1: 0.5561
 epoch: 43, train_loss: 0.8915, test_loss: 1.0429, test_f1: 0.5648
 epoch: 44, train_loss: 0.8937, test_loss: 1.0278, test_f1: 0.5610
 epoch: 45, train_loss: 0.8883, test_loss: 1.0141, test_f1: 0.5745
 epoch: 46, train_loss: 0.9067, test_loss: 1.1026, test_f1: 0.5374
 epoch: 47, train_loss: 0.8893, test_loss: 1.0629, test_f1: 0.5667
 epoch: 48, train_loss: 0.8898, test_loss: 1.0320, test_f1: 0.5751
 epoch: 49, train_loss: 0.8841, test_loss: 1.0649, test_f1: 0.5492
 epoch: 50, train_loss: 0.8724, test_loss: 1.0269, test_f1: 0.5835
 epoch: 51, train_loss: 0.8665, test_loss: 1.0214, test_f1: 0.5687
 epoch: 52, train_loss: 0.8606, test_loss: 1.0540, test_f1: 0.5706
 epoch: 53, train_loss: 0.8620, test_loss: 1.0785, test_f1: 0.5731
 epoch: 54, train_loss: 0.8766, test_loss: 1.0644, test_f1: 0.5773
 epoch: 55, train_loss: 0.8658, test_loss: 1.0622, test_f1: 0.5756
 epoch: 56, train_loss: 0.8553, test_loss: 1.0680, test_f1: 0.5654
 epoch: 57, train_loss: 0.8483, test_loss: 1.0583, test_f1: 0.5948
 epoch: 58, train_loss: 0.8657, test_loss: 1.0552, test_f1: 0.5738
 epoch: 59, train_loss: 0.8413, test_loss: 1.0419, test_f1: 0.5521
 epoch: 60, train_loss: 0.8290, test_loss: 1.0215, test_f1: 0.5514
 epoch: 61, train_loss: 0.8476, test_loss: 1.0206, test_f1: 0.5548
 epoch: 62, train_loss: 0.8316, test_loss: 1.0277, test_f1: 0.5557
 epoch: 63, train_loss: 0.8444, test_loss: 1.0363, test_f1: 0.5478
 epoch: 64, train_loss: 0.8422, test_loss: 1.0204, test_f1: 0.5795
 epoch: 65, train_loss: 0.8134, test_loss: 1.0239, test_f1: 0.5505
 epoch: 66, train_loss: 0.8136, test_loss: 1.0358, test_f1: 0.5611
 epoch: 67, train_loss: 0.8245, test_loss: 1.0416, test_f1: 0.5488
 epoch: 68, train_loss: 0.8258, test_loss: 1.0208, test_f1: 0.5917
 epoch: 69, train_loss: 0.8133, test_loss: 1.0221, test_f1: 0.5724
 epoch: 70, train_loss: 0.8199, test_loss: 1.0166, test_f1: 0.5623
 epoch: 71, train_loss: 0.8131, test_loss: 1.0389, test_f1: 0.5779
 epoch: 72, train_loss: 0.8177, test_loss: 1.0380, test_f1: 0.5654
 epoch: 73, train_loss: 0.8081, test_loss: 1.0451, test_f1: 0.5576
 epoch: 74, train_loss: 0.8069, test_loss: 1.0399, test_f1: 0.5700
 epoch: 75, train_loss: 0.8024, test_loss: 1.0432, test_f1: 0.5733
 epoch: 76, train_loss: 0.8078, test_loss: 1.0716, test_f1: 0.5526
 epoch: 77, train_loss: 0.8190, test_loss: 1.0444, test_f1: 0.5892
 epoch: 78, train_loss: 0.8061, test_loss: 1.0449, test_f1: 0.5553
 epoch: 79, train_loss: 0.7961, test_loss: 1.0332, test_f1: 0.5619
 epoch: 80, train_loss: 0.7964, test_loss: 1.0226, test_f1: 0.5794
 epoch: 81, train_loss: 0.8078, test_loss: 1.0212, test_f1: 0.5764
 epoch: 82, train_loss: 0.7961, test_loss: 1.0211, test_f1: 0.5620
 epoch: 83, train_loss: 0.7976, test_loss: 1.0271, test_f1: 0.5609
 epoch: 84, train_loss: 0.8137, test_loss: 1.0627, test_f1: 0.5555
 epoch: 85, train_loss: 0.8120, test_loss: 1.0529, test_f1: 0.5799
 epoch: 86, train_loss: 0.7859, test_loss: 1.0211, test_f1: 0.5872
 epoch: 87, train_loss: 0.7706, test_loss: 1.0312, test_f1: 0.5708
 epoch: 88, train_loss: 0.7977, test_loss: 1.0309, test_f1: 0.5633
 epoch: 89, train_loss: 0.7918, test_loss: 1.0354, test_f1: 0.5607
 epoch: 90, train_loss: 0.7757, test_loss: 1.0414, test_f1: 0.5682
 epoch: 91, train_loss: 0.8240, test_loss: 1.0806, test_f1: 0.5712
 epoch: 92, train_loss: 0.7817, test_loss: 1.0692, test_f1: 0.5588
 epoch: 93, train_loss: 0.7729, test_loss: 1.0849, test_f1: 0.5540
 epoch: 94, train_loss: 0.7946, test_loss: 1.0654, test_f1: 0.5445
 epoch: 95, train_loss: 0.7882, test_loss: 1.0928, test_f1: 0.5477
 epoch: 96, train_loss: 0.7939, test_loss: 1.1111, test_f1: 0.5722
 epoch: 97, train_loss: 0.7870, test_loss: 1.0407, test_f1: 0.5638
 epoch: 98, train_loss: 0.7801, test_loss: 1.0495, test_f1: 0.5449
 epoch: 99, train_loss: 0.7793, test_loss: 1.0329, test_f1: 0.5674
##################ITERATION #3 ****************************************
 epoch: 0, train_loss: 1.2702, test_loss: 1.3253, test_f1: 0.2807
 epoch: 1, train_loss: 1.2302, test_loss: 1.3162, test_f1: 0.3104
 epoch: 2, train_loss: 1.2122, test_loss: 1.3024, test_f1: 0.3762
 epoch: 3, train_loss: 1.1997, test_loss: 1.2964, test_f1: 0.3989
 epoch: 4, train_loss: 1.1884, test_loss: 1.2860, test_f1: 0.4002
 epoch: 5, train_loss: 1.1702, test_loss: 1.2547, test_f1: 0.4216
 epoch: 6, train_loss: 1.1531, test_loss: 1.2439, test_f1: 0.4165
 epoch: 7, train_loss: 1.1553, test_loss: 1.2257, test_f1: 0.4251
 epoch: 8, train_loss: 1.1410, test_loss: 1.2348, test_f1: 0.4425
 epoch: 9, train_loss: 1.1233, test_loss: 1.2260, test_f1: 0.4306
 epoch: 10, train_loss: 1.1161, test_loss: 1.2172, test_f1: 0.4414
 epoch: 11, train_loss: 1.0997, test_loss: 1.2085, test_f1: 0.4474
 epoch: 12, train_loss: 1.0983, test_loss: 1.2091, test_f1: 0.4161
 epoch: 13, train_loss: 1.0841, test_loss: 1.1912, test_f1: 0.4252
 epoch: 14, train_loss: 1.0924, test_loss: 1.1850, test_f1: 0.4326
 epoch: 15, train_loss: 1.0783, test_loss: 1.1665, test_f1: 0.4428
 epoch: 16, train_loss: 1.0660, test_loss: 1.1656, test_f1: 0.4549
 epoch: 17, train_loss: 1.0664, test_loss: 1.1621, test_f1: 0.4311
 epoch: 18, train_loss: 1.0579, test_loss: 1.1598, test_f1: 0.4501
 epoch: 19, train_loss: 1.0474, test_loss: 1.1713, test_f1: 0.4540
 epoch: 20, train_loss: 1.0402, test_loss: 1.1636, test_f1: 0.4496
 epoch: 21, train_loss: 1.0346, test_loss: 1.1599, test_f1: 0.4553
 epoch: 22, train_loss: 1.0313, test_loss: 1.1536, test_f1: 0.4522
 epoch: 23, train_loss: 1.0143, test_loss: 1.1550, test_f1: 0.4309
 epoch: 24, train_loss: 1.0106, test_loss: 1.1467, test_f1: 0.4448
 epoch: 25, train_loss: 1.0046, test_loss: 1.1497, test_f1: 0.4320
 epoch: 26, train_loss: 0.9931, test_loss: 1.1394, test_f1: 0.4126
 epoch: 27, train_loss: 1.0002, test_loss: 1.1297, test_f1: 0.4311
 epoch: 28, train_loss: 0.9964, test_loss: 1.1304, test_f1: 0.4179
 epoch: 29, train_loss: 0.9786, test_loss: 1.1464, test_f1: 0.4297
 epoch: 30, train_loss: 0.9851, test_loss: 1.1561, test_f1: 0.3885
 epoch: 31, train_loss: 0.9691, test_loss: 1.1495, test_f1: 0.4186
 epoch: 32, train_loss: 0.9649, test_loss: 1.1582, test_f1: 0.4210
 epoch: 33, train_loss: 0.9495, test_loss: 1.1761, test_f1: 0.3956
 epoch: 34, train_loss: 0.9624, test_loss: 1.2098, test_f1: 0.4263
 epoch: 35, train_loss: 0.9601, test_loss: 1.2093, test_f1: 0.4181
 epoch: 36, train_loss: 0.9408, test_loss: 1.1752, test_f1: 0.4333
 epoch: 37, train_loss: 0.9499, test_loss: 1.1768, test_f1: 0.4139
 epoch: 38, train_loss: 0.9302, test_loss: 1.1560, test_f1: 0.4383
 epoch: 39, train_loss: 0.9178, test_loss: 1.1986, test_f1: 0.4092
 epoch: 40, train_loss: 0.9352, test_loss: 1.2443, test_f1: 0.4293
 epoch: 41, train_loss: 0.9143, test_loss: 1.1722, test_f1: 0.4359
 epoch: 42, train_loss: 0.9214, test_loss: 1.2602, test_f1: 0.4266
 epoch: 43, train_loss: 0.9066, test_loss: 1.2718, test_f1: 0.4130
 epoch: 44, train_loss: 0.8912, test_loss: 1.2409, test_f1: 0.4229
 epoch: 45, train_loss: 0.9034, test_loss: 1.2364, test_f1: 0.4474
 epoch: 46, train_loss: 0.8970, test_loss: 1.2479, test_f1: 0.4699
 epoch: 47, train_loss: 0.8962, test_loss: 1.2230, test_f1: 0.4931
 epoch: 48, train_loss: 0.8832, test_loss: 1.2909, test_f1: 0.4459
 epoch: 49, train_loss: 0.8827, test_loss: 1.2998, test_f1: 0.4682
 epoch: 50, train_loss: 0.8792, test_loss: 1.2771, test_f1: 0.4898
 epoch: 51, train_loss: 0.8747, test_loss: 1.2881, test_f1: 0.4944
 epoch: 52, train_loss: 0.8656, test_loss: 1.3090, test_f1: 0.4915
 epoch: 53, train_loss: 0.8674, test_loss: 1.3108, test_f1: 0.4941
 epoch: 54, train_loss: 0.8774, test_loss: 1.3221, test_f1: 0.4404
 epoch: 55, train_loss: 0.8720, test_loss: 1.3200, test_f1: 0.4700
 epoch: 56, train_loss: 0.8723, test_loss: 1.3463, test_f1: 0.4511
 epoch: 57, train_loss: 0.8538, test_loss: 1.3507, test_f1: 0.4667
 epoch: 58, train_loss: 0.8741, test_loss: 1.3127, test_f1: 0.4875
 epoch: 59, train_loss: 0.8598, test_loss: 1.2989, test_f1: 0.4786
 epoch: 60, train_loss: 0.8413, test_loss: 1.3235, test_f1: 0.4446
 epoch: 61, train_loss: 0.8492, test_loss: 1.3299, test_f1: 0.4561
 epoch: 62, train_loss: 0.8545, test_loss: 1.3410, test_f1: 0.4569
 epoch: 63, train_loss: 0.8416, test_loss: 1.2936, test_f1: 0.4687
 epoch: 64, train_loss: 0.8514, test_loss: 1.3145, test_f1: 0.4991
 epoch: 65, train_loss: 0.8474, test_loss: 1.3036, test_f1: 0.4828
 epoch: 66, train_loss: 0.8570, test_loss: 1.3075, test_f1: 0.4873
 epoch: 67, train_loss: 0.8425, test_loss: 1.3359, test_f1: 0.4875
 epoch: 68, train_loss: 0.8439, test_loss: 1.3672, test_f1: 0.4835
 epoch: 69, train_loss: 0.8432, test_loss: 1.3515, test_f1: 0.4831
 epoch: 70, train_loss: 0.8408, test_loss: 1.3577, test_f1: 0.4734
 epoch: 71, train_loss: 0.8346, test_loss: 1.3581, test_f1: 0.4750
 epoch: 72, train_loss: 0.8383, test_loss: 1.3991, test_f1: 0.4402
 epoch: 73, train_loss: 0.8352, test_loss: 1.3733, test_f1: 0.4537
 epoch: 74, train_loss: 0.8337, test_loss: 1.3373, test_f1: 0.4648
 epoch: 75, train_loss: 0.8325, test_loss: 1.3884, test_f1: 0.4579
 epoch: 76, train_loss: 0.8357, test_loss: 1.3782, test_f1: 0.4586
 epoch: 77, train_loss: 0.8201, test_loss: 1.3765, test_f1: 0.4785
 epoch: 78, train_loss: 0.8327, test_loss: 1.4051, test_f1: 0.4645
 epoch: 79, train_loss: 0.8388, test_loss: 1.3653, test_f1: 0.5036
 epoch: 80, train_loss: 0.8124, test_loss: 1.3448, test_f1: 0.5020
 epoch: 81, train_loss: 0.8151, test_loss: 1.3550, test_f1: 0.5024
 epoch: 82, train_loss: 0.8456, test_loss: 1.3548, test_f1: 0.4634
 epoch: 83, train_loss: 0.8319, test_loss: 1.3752, test_f1: 0.4797
 epoch: 84, train_loss: 0.8258, test_loss: 1.3771, test_f1: 0.4876
 epoch: 85, train_loss: 0.8319, test_loss: 1.3956, test_f1: 0.4615
 epoch: 86, train_loss: 0.8161, test_loss: 1.3645, test_f1: 0.4854
 epoch: 87, train_loss: 0.8136, test_loss: 1.3229, test_f1: 0.5000
 epoch: 88, train_loss: 0.8219, test_loss: 1.3205, test_f1: 0.4865
 epoch: 89, train_loss: 0.8054, test_loss: 1.3390, test_f1: 0.4788
 epoch: 90, train_loss: 0.8192, test_loss: 1.3384, test_f1: 0.4866
 epoch: 91, train_loss: 0.8136, test_loss: 1.3543, test_f1: 0.4598
 epoch: 92, train_loss: 0.8191, test_loss: 1.3886, test_f1: 0.4705
 epoch: 93, train_loss: 0.7892, test_loss: 1.3529, test_f1: 0.4731
 epoch: 94, train_loss: 0.8004, test_loss: 1.3476, test_f1: 0.4790
 epoch: 95, train_loss: 0.8002, test_loss: 1.3823, test_f1: 0.4853
 epoch: 96, train_loss: 0.8016, test_loss: 1.4088, test_f1: 0.4934
 epoch: 97, train_loss: 0.8073, test_loss: 1.3793, test_f1: 0.5039
 epoch: 98, train_loss: 0.7941, test_loss: 1.3854, test_f1: 0.4795
 epoch: 99, train_loss: 0.8048, test_loss: 1.3546, test_f1: 0.5142
##################ITERATION #4 ****************************************
 epoch: 0, train_loss: 1.3098, test_loss: 1.3248, test_f1: 0.2404
 epoch: 1, train_loss: 1.2115, test_loss: 1.2886, test_f1: 0.2354
 epoch: 2, train_loss: 1.1961, test_loss: 1.2642, test_f1: 0.2644
 epoch: 3, train_loss: 1.1787, test_loss: 1.2612, test_f1: 0.2832
 epoch: 4, train_loss: 1.1767, test_loss: 1.2369, test_f1: 0.3411
 epoch: 5, train_loss: 1.1781, test_loss: 1.2194, test_f1: 0.3913
 epoch: 6, train_loss: 1.1634, test_loss: 1.2333, test_f1: 0.4027
 epoch: 7, train_loss: 1.1482, test_loss: 1.2151, test_f1: 0.3891
 epoch: 8, train_loss: 1.1384, test_loss: 1.1994, test_f1: 0.4212
 epoch: 9, train_loss: 1.1317, test_loss: 1.2096, test_f1: 0.4289
 epoch: 10, train_loss: 1.1329, test_loss: 1.2172, test_f1: 0.4218
 epoch: 11, train_loss: 1.1216, test_loss: 1.2056, test_f1: 0.4096
 epoch: 12, train_loss: 1.1085, test_loss: 1.1943, test_f1: 0.4284
 epoch: 13, train_loss: 1.0962, test_loss: 1.1940, test_f1: 0.4208
 epoch: 14, train_loss: 1.0832, test_loss: 1.2139, test_f1: 0.4226
 epoch: 15, train_loss: 1.0831, test_loss: 1.2026, test_f1: 0.4175
 epoch: 16, train_loss: 1.0961, test_loss: 1.2018, test_f1: 0.4508
 epoch: 17, train_loss: 1.0804, test_loss: 1.2113, test_f1: 0.4575
 epoch: 18, train_loss: 1.0839, test_loss: 1.2044, test_f1: 0.4640
 epoch: 19, train_loss: 1.0739, test_loss: 1.2044, test_f1: 0.4448
 epoch: 20, train_loss: 1.0651, test_loss: 1.2079, test_f1: 0.4295
 epoch: 21, train_loss: 1.0585, test_loss: 1.1843, test_f1: 0.4445
 epoch: 22, train_loss: 1.0403, test_loss: 1.1869, test_f1: 0.4601
 epoch: 23, train_loss: 1.0496, test_loss: 1.1898, test_f1: 0.4532
 epoch: 24, train_loss: 1.0358, test_loss: 1.1934, test_f1: 0.4504
 epoch: 25, train_loss: 1.0168, test_loss: 1.2129, test_f1: 0.4632
 epoch: 26, train_loss: 1.0271, test_loss: 1.1892, test_f1: 0.4849
 epoch: 27, train_loss: 1.0114, test_loss: 1.1594, test_f1: 0.4829
 epoch: 28, train_loss: 1.0276, test_loss: 1.1653, test_f1: 0.4886
 epoch: 29, train_loss: 1.0094, test_loss: 1.1678, test_f1: 0.4763
 epoch: 30, train_loss: 0.9941, test_loss: 1.1840, test_f1: 0.4907
 epoch: 31, train_loss: 0.9809, test_loss: 1.1810, test_f1: 0.5028
 epoch: 32, train_loss: 0.9954, test_loss: 1.2149, test_f1: 0.4866
 epoch: 33, train_loss: 0.9761, test_loss: 1.2098, test_f1: 0.4834
 epoch: 34, train_loss: 0.9694, test_loss: 1.1786, test_f1: 0.4944
 epoch: 35, train_loss: 0.9624, test_loss: 1.1856, test_f1: 0.5220
 epoch: 36, train_loss: 0.9568, test_loss: 1.1944, test_f1: 0.4957
 epoch: 37, train_loss: 0.9745, test_loss: 1.1770, test_f1: 0.4910
 epoch: 38, train_loss: 0.9566, test_loss: 1.2025, test_f1: 0.5250
 epoch: 39, train_loss: 0.9508, test_loss: 1.2002, test_f1: 0.5537
 epoch: 40, train_loss: 0.9535, test_loss: 1.1863, test_f1: 0.5268
 epoch: 41, train_loss: 0.9404, test_loss: 1.2156, test_f1: 0.5101
 epoch: 42, train_loss: 0.9373, test_loss: 1.1811, test_f1: 0.5374
 epoch: 43, train_loss: 0.9231, test_loss: 1.1930, test_f1: 0.5091
 epoch: 44, train_loss: 0.9296, test_loss: 1.2098, test_f1: 0.5216
 epoch: 45, train_loss: 0.9293, test_loss: 1.1958, test_f1: 0.5384
 epoch: 46, train_loss: 0.9370, test_loss: 1.1993, test_f1: 0.5216
 epoch: 47, train_loss: 0.9256, test_loss: 1.1898, test_f1: 0.5270
 epoch: 48, train_loss: 0.9085, test_loss: 1.1810, test_f1: 0.5179
 epoch: 49, train_loss: 0.9023, test_loss: 1.2035, test_f1: 0.5275
 epoch: 50, train_loss: 0.9233, test_loss: 1.2024, test_f1: 0.5284
 epoch: 51, train_loss: 0.8975, test_loss: 1.1924, test_f1: 0.5424
 epoch: 52, train_loss: 0.9010, test_loss: 1.2113, test_f1: 0.5490
 epoch: 53, train_loss: 0.9072, test_loss: 1.2110, test_f1: 0.5112
 epoch: 54, train_loss: 0.8995, test_loss: 1.1880, test_f1: 0.5473
 epoch: 55, train_loss: 0.8945, test_loss: 1.1930, test_f1: 0.5289
 epoch: 56, train_loss: 0.8856, test_loss: 1.1923, test_f1: 0.5307
 epoch: 57, train_loss: 0.8711, test_loss: 1.1987, test_f1: 0.5066
 epoch: 58, train_loss: 0.8728, test_loss: 1.1780, test_f1: 0.5443
 epoch: 59, train_loss: 0.8836, test_loss: 1.1858, test_f1: 0.5470
 epoch: 60, train_loss: 0.8621, test_loss: 1.1827, test_f1: 0.5627
 epoch: 61, train_loss: 0.8740, test_loss: 1.1781, test_f1: 0.5524
 epoch: 62, train_loss: 0.8710, test_loss: 1.1781, test_f1: 0.5681
 epoch: 63, train_loss: 0.8567, test_loss: 1.1951, test_f1: 0.5428
 epoch: 64, train_loss: 0.8690, test_loss: 1.1998, test_f1: 0.5424
 epoch: 65, train_loss: 0.8444, test_loss: 1.1985, test_f1: 0.5287
 epoch: 66, train_loss: 0.8657, test_loss: 1.2052, test_f1: 0.5169
 epoch: 67, train_loss: 0.8675, test_loss: 1.2207, test_f1: 0.5057
 epoch: 68, train_loss: 0.8379, test_loss: 1.2012, test_f1: 0.5452
 epoch: 69, train_loss: 0.8627, test_loss: 1.1999, test_f1: 0.5409
 epoch: 70, train_loss: 0.8539, test_loss: 1.2475, test_f1: 0.5066
 epoch: 71, train_loss: 0.8538, test_loss: 1.2740, test_f1: 0.5374
 epoch: 72, train_loss: 0.8613, test_loss: 1.2201, test_f1: 0.5327
 epoch: 73, train_loss: 0.8287, test_loss: 1.2474, test_f1: 0.5440
 epoch: 74, train_loss: 0.8369, test_loss: 1.2640, test_f1: 0.5217
 epoch: 75, train_loss: 0.8532, test_loss: 1.2333, test_f1: 0.5254
 epoch: 76, train_loss: 0.8460, test_loss: 1.2498, test_f1: 0.5163
 epoch: 77, train_loss: 0.8367, test_loss: 1.2642, test_f1: 0.5294
 epoch: 78, train_loss: 0.8397, test_loss: 1.2462, test_f1: 0.5263
 epoch: 79, train_loss: 0.8280, test_loss: 1.2272, test_f1: 0.5087
 epoch: 80, train_loss: 0.8293, test_loss: 1.2088, test_f1: 0.5407
 epoch: 81, train_loss: 0.8415, test_loss: 1.2381, test_f1: 0.5268
 epoch: 82, train_loss: 0.8271, test_loss: 1.2413, test_f1: 0.5496
 epoch: 83, train_loss: 0.8536, test_loss: 1.2623, test_f1: 0.5248
 epoch: 84, train_loss: 0.8173, test_loss: 1.2465, test_f1: 0.5563
 epoch: 85, train_loss: 0.8096, test_loss: 1.2647, test_f1: 0.5368
 epoch: 86, train_loss: 0.8249, test_loss: 1.2566, test_f1: 0.5169
 epoch: 87, train_loss: 0.8214, test_loss: 1.2590, test_f1: 0.5265
 epoch: 88, train_loss: 0.8124, test_loss: 1.3034, test_f1: 0.5177
 epoch: 89, train_loss: 0.8158, test_loss: 1.2958, test_f1: 0.5191
 epoch: 90, train_loss: 0.8112, test_loss: 1.2902, test_f1: 0.5399
 epoch: 91, train_loss: 0.8320, test_loss: 1.3072, test_f1: 0.5044
 epoch: 92, train_loss: 0.8161, test_loss: 1.2914, test_f1: 0.5233
 epoch: 93, train_loss: 0.8119, test_loss: 1.2861, test_f1: 0.5415
 epoch: 94, train_loss: 0.8100, test_loss: 1.3169, test_f1: 0.5168
 epoch: 95, train_loss: 0.8062, test_loss: 1.3434, test_f1: 0.4966
 epoch: 96, train_loss: 0.8314, test_loss: 1.3254, test_f1: 0.5010
 epoch: 97, train_loss: 0.8112, test_loss: 1.3350, test_f1: 0.5205
 epoch: 98, train_loss: 0.8096, test_loss: 1.3298, test_f1: 0.4977
 epoch: 99, train_loss: 0.7920, test_loss: 1.2840, test_f1: 0.5267
##################ITERATION #5 ****************************************
 epoch: 0, train_loss: 1.3623, test_loss: 1.3877, test_f1: 0.2401
 epoch: 1, train_loss: 1.2595, test_loss: 1.3395, test_f1: 0.2255
 epoch: 2, train_loss: 1.2529, test_loss: 1.3122, test_f1: 0.2391
 epoch: 3, train_loss: 1.2300, test_loss: 1.3004, test_f1: 0.2429
 epoch: 4, train_loss: 1.2111, test_loss: 1.3118, test_f1: 0.2372
 epoch: 5, train_loss: 1.2065, test_loss: 1.3517, test_f1: 0.3276
 epoch: 6, train_loss: 1.2112, test_loss: 1.3257, test_f1: 0.3640
 epoch: 7, train_loss: 1.1979, test_loss: 1.2587, test_f1: 0.3438
 epoch: 8, train_loss: 1.1809, test_loss: 1.2574, test_f1: 0.3726
 epoch: 9, train_loss: 1.1699, test_loss: 1.2516, test_f1: 0.3765
 epoch: 10, train_loss: 1.1801, test_loss: 1.2406, test_f1: 0.3766
 epoch: 11, train_loss: 1.1701, test_loss: 1.2351, test_f1: 0.3841
 epoch: 12, train_loss: 1.1568, test_loss: 1.2251, test_f1: 0.4022
 epoch: 13, train_loss: 1.1588, test_loss: 1.2220, test_f1: 0.4265
 epoch: 14, train_loss: 1.1453, test_loss: 1.2096, test_f1: 0.4194
 epoch: 15, train_loss: 1.1372, test_loss: 1.2201, test_f1: 0.4482
 epoch: 16, train_loss: 1.1341, test_loss: 1.2170, test_f1: 0.4382
 epoch: 17, train_loss: 1.1188, test_loss: 1.2236, test_f1: 0.4198
 epoch: 18, train_loss: 1.1024, test_loss: 1.2227, test_f1: 0.4508
 epoch: 19, train_loss: 1.0979, test_loss: 1.2108, test_f1: 0.4662
 epoch: 20, train_loss: 1.1049, test_loss: 1.2392, test_f1: 0.4485
 epoch: 21, train_loss: 1.1050, test_loss: 1.2204, test_f1: 0.4638
 epoch: 22, train_loss: 1.0821, test_loss: 1.1782, test_f1: 0.4557
 epoch: 23, train_loss: 1.0875, test_loss: 1.1762, test_f1: 0.4439
 epoch: 24, train_loss: 1.0733, test_loss: 1.1740, test_f1: 0.5243
 epoch: 25, train_loss: 1.0606, test_loss: 1.1627, test_f1: 0.5039
 epoch: 26, train_loss: 1.0695, test_loss: 1.2215, test_f1: 0.4822
 epoch: 27, train_loss: 1.0516, test_loss: 1.1985, test_f1: 0.5085
 epoch: 28, train_loss: 1.0546, test_loss: 1.2156, test_f1: 0.4987
 epoch: 29, train_loss: 1.0477, test_loss: 1.1770, test_f1: 0.4733
 epoch: 30, train_loss: 1.0452, test_loss: 1.1922, test_f1: 0.4879
 epoch: 31, train_loss: 1.0167, test_loss: 1.2179, test_f1: 0.4999
 epoch: 32, train_loss: 1.0159, test_loss: 1.2047, test_f1: 0.5052
 epoch: 33, train_loss: 1.0136, test_loss: 1.1928, test_f1: 0.4983
 epoch: 34, train_loss: 1.0079, test_loss: 1.1938, test_f1: 0.5100
 epoch: 35, train_loss: 1.0169, test_loss: 1.2071, test_f1: 0.4899
 epoch: 36, train_loss: 0.9788, test_loss: 1.2276, test_f1: 0.5013
 epoch: 37, train_loss: 0.9924, test_loss: 1.2042, test_f1: 0.5178
 epoch: 38, train_loss: 0.9904, test_loss: 1.1988, test_f1: 0.5234
 epoch: 39, train_loss: 0.9931, test_loss: 1.2133, test_f1: 0.5540
 epoch: 40, train_loss: 0.9864, test_loss: 1.1781, test_f1: 0.5236
 epoch: 41, train_loss: 0.9701, test_loss: 1.1734, test_f1: 0.5361
 epoch: 42, train_loss: 0.9833, test_loss: 1.1705, test_f1: 0.5227
 epoch: 43, train_loss: 0.9787, test_loss: 1.1653, test_f1: 0.5173
 epoch: 44, train_loss: 0.9765, test_loss: 1.1629, test_f1: 0.5016
 epoch: 45, train_loss: 0.9467, test_loss: 1.1531, test_f1: 0.5449
 epoch: 46, train_loss: 0.9537, test_loss: 1.1275, test_f1: 0.5368
 epoch: 47, train_loss: 0.9581, test_loss: 1.1473, test_f1: 0.5150
 epoch: 48, train_loss: 0.9352, test_loss: 1.1352, test_f1: 0.5278
 epoch: 49, train_loss: 0.9378, test_loss: 1.1407, test_f1: 0.5303
 epoch: 50, train_loss: 0.9559, test_loss: 1.1746, test_f1: 0.5194
 epoch: 51, train_loss: 0.9261, test_loss: 1.1640, test_f1: 0.5275
 epoch: 52, train_loss: 0.9174, test_loss: 1.1391, test_f1: 0.5398
 epoch: 53, train_loss: 0.9179, test_loss: 1.1490, test_f1: 0.5500
 epoch: 54, train_loss: 0.9200, test_loss: 1.1411, test_f1: 0.5153
 epoch: 55, train_loss: 0.9262, test_loss: 1.1539, test_f1: 0.5041
 epoch: 56, train_loss: 0.9024, test_loss: 1.1662, test_f1: 0.5412
 epoch: 57, train_loss: 0.9096, test_loss: 1.1544, test_f1: 0.5501
 epoch: 58, train_loss: 0.9196, test_loss: 1.1457, test_f1: 0.5446
 epoch: 59, train_loss: 0.9166, test_loss: 1.1517, test_f1: 0.5446
 epoch: 60, train_loss: 0.9073, test_loss: 1.1619, test_f1: 0.5219
 epoch: 61, train_loss: 0.8973, test_loss: 1.1720, test_f1: 0.5038
 epoch: 62, train_loss: 0.9071, test_loss: 1.1582, test_f1: 0.5019
 epoch: 63, train_loss: 0.9004, test_loss: 1.1871, test_f1: 0.5124
 epoch: 64, train_loss: 0.9017, test_loss: 1.1676, test_f1: 0.5143
 epoch: 65, train_loss: 0.8975, test_loss: 1.1643, test_f1: 0.5044
 epoch: 66, train_loss: 0.8884, test_loss: 1.1577, test_f1: 0.5219
 epoch: 67, train_loss: 0.8959, test_loss: 1.1613, test_f1: 0.5302
 epoch: 68, train_loss: 0.9176, test_loss: 1.1539, test_f1: 0.5294
 epoch: 69, train_loss: 0.8869, test_loss: 1.2195, test_f1: 0.5254
 epoch: 70, train_loss: 0.8932, test_loss: 1.1800, test_f1: 0.5130
 epoch: 71, train_loss: 0.8844, test_loss: 1.1791, test_f1: 0.5218
 epoch: 72, train_loss: 0.8850, test_loss: 1.1823, test_f1: 0.5369
 epoch: 73, train_loss: 0.8806, test_loss: 1.1904, test_f1: 0.5301
 epoch: 74, train_loss: 0.8713, test_loss: 1.1977, test_f1: 0.5141
 epoch: 75, train_loss: 0.8646, test_loss: 1.2022, test_f1: 0.5159
 epoch: 76, train_loss: 0.8890, test_loss: 1.1992, test_f1: 0.5181
 epoch: 77, train_loss: 0.8732, test_loss: 1.2100, test_f1: 0.5184
 epoch: 78, train_loss: 0.8651, test_loss: 1.2114, test_f1: 0.5121
 epoch: 79, train_loss: 0.8798, test_loss: 1.1914, test_f1: 0.5195
 epoch: 80, train_loss: 0.8595, test_loss: 1.1793, test_f1: 0.5237
 epoch: 81, train_loss: 0.8532, test_loss: 1.2064, test_f1: 0.5337
 epoch: 82, train_loss: 0.8661, test_loss: 1.2243, test_f1: 0.5324
 epoch: 83, train_loss: 0.8625, test_loss: 1.1815, test_f1: 0.5509
 epoch: 84, train_loss: 0.8807, test_loss: 1.1730, test_f1: 0.5308
 epoch: 85, train_loss: 0.8588, test_loss: 1.2308, test_f1: 0.5337
 epoch: 86, train_loss: 0.8590, test_loss: 1.2547, test_f1: 0.5316
 epoch: 87, train_loss: 0.8524, test_loss: 1.2460, test_f1: 0.5375
 epoch: 88, train_loss: 0.8691, test_loss: 1.2427, test_f1: 0.5394
 epoch: 89, train_loss: 0.8497, test_loss: 1.2562, test_f1: 0.5490
 epoch: 90, train_loss: 0.8419, test_loss: 1.2948, test_f1: 0.5649
 epoch: 91, train_loss: 0.8474, test_loss: 1.2689, test_f1: 0.5030
 epoch: 92, train_loss: 0.8501, test_loss: 1.2818, test_f1: 0.5019
 epoch: 93, train_loss: 0.8651, test_loss: 1.3290, test_f1: 0.5077
 epoch: 94, train_loss: 0.8421, test_loss: 1.2864, test_f1: 0.5204
 epoch: 95, train_loss: 0.8661, test_loss: 1.2492, test_f1: 0.5044
 epoch: 96, train_loss: 0.8666, test_loss: 1.2157, test_f1: 0.5304
 epoch: 97, train_loss: 0.8490, test_loss: 1.2730, test_f1: 0.5050
 epoch: 98, train_loss: 0.8463, test_loss: 1.2145, test_f1: 0.5403
 epoch: 99, train_loss: 0.8578, test_loss: 1.2491, test_f1: 0.5191
##################ITERATION #6 ****************************************
 epoch: 0, train_loss: 1.4377, test_loss: 1.3226, test_f1: 0.2344
 epoch: 1, train_loss: 1.2747, test_loss: 1.3396, test_f1: 0.2274
 epoch: 2, train_loss: 1.2459, test_loss: 1.3379, test_f1: 0.2508
 epoch: 3, train_loss: 1.2621, test_loss: 1.3248, test_f1: 0.2682
 epoch: 4, train_loss: 1.2295, test_loss: 1.3261, test_f1: 0.2636
 epoch: 5, train_loss: 1.2276, test_loss: 1.3349, test_f1: 0.2559
 epoch: 6, train_loss: 1.2187, test_loss: 1.3420, test_f1: 0.2584
 epoch: 7, train_loss: 1.2096, test_loss: 1.3316, test_f1: 0.2649
 epoch: 8, train_loss: 1.1931, test_loss: 1.3238, test_f1: 0.2526
 epoch: 9, train_loss: 1.1966, test_loss: 1.3270, test_f1: 0.2523
 epoch: 10, train_loss: 1.1930, test_loss: 1.3069, test_f1: 0.2812
 epoch: 11, train_loss: 1.1909, test_loss: 1.3122, test_f1: 0.2684
 epoch: 12, train_loss: 1.1727, test_loss: 1.3161, test_f1: 0.2545
 epoch: 13, train_loss: 1.1822, test_loss: 1.3104, test_f1: 0.2860
 epoch: 14, train_loss: 1.1744, test_loss: 1.3069, test_f1: 0.2907
 epoch: 15, train_loss: 1.1637, test_loss: 1.3008, test_f1: 0.3018
 epoch: 16, train_loss: 1.1493, test_loss: 1.3137, test_f1: 0.2961
 epoch: 17, train_loss: 1.1493, test_loss: 1.3147, test_f1: 0.3275
 epoch: 18, train_loss: 1.1427, test_loss: 1.3321, test_f1: 0.3128
 epoch: 19, train_loss: 1.1357, test_loss: 1.3454, test_f1: 0.3397
 epoch: 20, train_loss: 1.1392, test_loss: 1.3332, test_f1: 0.3652
 epoch: 21, train_loss: 1.1256, test_loss: 1.3074, test_f1: 0.3591
 epoch: 22, train_loss: 1.1134, test_loss: 1.3347, test_f1: 0.3988
 epoch: 23, train_loss: 1.1270, test_loss: 1.3231, test_f1: 0.4032
 epoch: 24, train_loss: 1.1064, test_loss: 1.3124, test_f1: 0.4004
 epoch: 25, train_loss: 1.1005, test_loss: 1.3146, test_f1: 0.4248
 epoch: 26, train_loss: 1.0973, test_loss: 1.3122, test_f1: 0.4170
 epoch: 27, train_loss: 1.0819, test_loss: 1.2991, test_f1: 0.4151
 epoch: 28, train_loss: 1.0905, test_loss: 1.2835, test_f1: 0.4741
 epoch: 29, train_loss: 1.0828, test_loss: 1.3004, test_f1: 0.4462
 epoch: 30, train_loss: 1.0615, test_loss: 1.2897, test_f1: 0.4359
 epoch: 31, train_loss: 1.0609, test_loss: 1.2658, test_f1: 0.4724
 epoch: 32, train_loss: 1.0437, test_loss: 1.2909, test_f1: 0.4773
 epoch: 33, train_loss: 1.0502, test_loss: 1.3092, test_f1: 0.4925
 epoch: 34, train_loss: 1.0277, test_loss: 1.3407, test_f1: 0.4468
 epoch: 35, train_loss: 1.0428, test_loss: 1.3769, test_f1: 0.4195
 epoch: 36, train_loss: 1.0324, test_loss: 1.3609, test_f1: 0.4793
 epoch: 37, train_loss: 1.0278, test_loss: 1.3264, test_f1: 0.4802
 epoch: 38, train_loss: 1.0104, test_loss: 1.3959, test_f1: 0.4567
 epoch: 39, train_loss: 1.0032, test_loss: 1.3384, test_f1: 0.4919
 epoch: 40, train_loss: 0.9989, test_loss: 1.3796, test_f1: 0.4824
 epoch: 41, train_loss: 1.0055, test_loss: 1.2904, test_f1: 0.5105
 epoch: 42, train_loss: 1.0047, test_loss: 1.3745, test_f1: 0.4925
 epoch: 43, train_loss: 0.9923, test_loss: 1.3591, test_f1: 0.4995
 epoch: 44, train_loss: 0.9827, test_loss: 1.2113, test_f1: 0.5043
 epoch: 45, train_loss: 0.9649, test_loss: 1.4272, test_f1: 0.4909
 epoch: 46, train_loss: 0.9697, test_loss: 1.3521, test_f1: 0.5397
 epoch: 47, train_loss: 0.9700, test_loss: 1.2393, test_f1: 0.5167
 epoch: 48, train_loss: 0.9614, test_loss: 1.3708, test_f1: 0.4919
 epoch: 49, train_loss: 0.9705, test_loss: 1.2903, test_f1: 0.5324
 epoch: 50, train_loss: 0.9591, test_loss: 1.2768, test_f1: 0.5446
 epoch: 51, train_loss: 0.9437, test_loss: 1.3163, test_f1: 0.4961
 epoch: 52, train_loss: 0.9315, test_loss: 1.3002, test_f1: 0.5343
 epoch: 53, train_loss: 0.9246, test_loss: 1.2822, test_f1: 0.5285
 epoch: 54, train_loss: 0.9359, test_loss: 1.3854, test_f1: 0.5153
 epoch: 55, train_loss: 0.9232, test_loss: 1.3519, test_f1: 0.5356
 epoch: 56, train_loss: 0.9180, test_loss: 1.3669, test_f1: 0.5199
 epoch: 57, train_loss: 0.9213, test_loss: 1.2523, test_f1: 0.5244
 epoch: 58, train_loss: 0.9217, test_loss: 1.4408, test_f1: 0.4994
 epoch: 59, train_loss: 0.9264, test_loss: 1.2682, test_f1: 0.5366
 epoch: 60, train_loss: 0.9112, test_loss: 1.4101, test_f1: 0.5197
 epoch: 61, train_loss: 0.9210, test_loss: 1.3497, test_f1: 0.5569
 epoch: 62, train_loss: 0.9133, test_loss: 1.3960, test_f1: 0.5473
 epoch: 63, train_loss: 0.9196, test_loss: 1.2731, test_f1: 0.5503
 epoch: 64, train_loss: 0.9074, test_loss: 1.3065, test_f1: 0.5465
 epoch: 65, train_loss: 0.9106, test_loss: 1.2850, test_f1: 0.5474
 epoch: 66, train_loss: 0.9110, test_loss: 1.3092, test_f1: 0.5444
 epoch: 67, train_loss: 0.9147, test_loss: 1.2795, test_f1: 0.5283
 epoch: 68, train_loss: 0.8986, test_loss: 1.3469, test_f1: 0.5212
 epoch: 69, train_loss: 0.8957, test_loss: 1.3319, test_f1: 0.5453
 epoch: 70, train_loss: 0.8968, test_loss: 1.3539, test_f1: 0.5372
 epoch: 71, train_loss: 0.8993, test_loss: 1.2905, test_f1: 0.5457
 epoch: 72, train_loss: 0.8928, test_loss: 1.2470, test_f1: 0.5480
 epoch: 73, train_loss: 0.8786, test_loss: 1.2888, test_f1: 0.5431
 epoch: 74, train_loss: 0.8899, test_loss: 1.2857, test_f1: 0.5321
 epoch: 75, train_loss: 0.8868, test_loss: 1.2095, test_f1: 0.5351
 epoch: 76, train_loss: 0.8985, test_loss: 1.3594, test_f1: 0.5391
 epoch: 77, train_loss: 0.8783, test_loss: 1.2121, test_f1: 0.5532
 epoch: 78, train_loss: 0.8854, test_loss: 1.2992, test_f1: 0.5485
 epoch: 79, train_loss: 0.8823, test_loss: 1.3333, test_f1: 0.5411
 epoch: 80, train_loss: 0.8814, test_loss: 1.2284, test_f1: 0.5315
 epoch: 81, train_loss: 0.8788, test_loss: 1.3221, test_f1: 0.5451
 epoch: 82, train_loss: 0.8857, test_loss: 1.3437, test_f1: 0.5329
 epoch: 83, train_loss: 0.8697, test_loss: 1.2664, test_f1: 0.5450
 epoch: 84, train_loss: 0.8606, test_loss: 1.3215, test_f1: 0.5435
 epoch: 85, train_loss: 0.8712, test_loss: 1.2616, test_f1: 0.5512
 epoch: 86, train_loss: 0.8637, test_loss: 1.2878, test_f1: 0.5612
 epoch: 87, train_loss: 0.8535, test_loss: 1.3188, test_f1: 0.5618
 epoch: 88, train_loss: 0.8668, test_loss: 1.3315, test_f1: 0.5541
 epoch: 89, train_loss: 0.8532, test_loss: 1.3119, test_f1: 0.5408
 epoch: 90, train_loss: 0.8396, test_loss: 1.2870, test_f1: 0.5369
 epoch: 91, train_loss: 0.8437, test_loss: 1.2985, test_f1: 0.5273
 epoch: 92, train_loss: 0.8619, test_loss: 1.2935, test_f1: 0.5628
 epoch: 93, train_loss: 0.8349, test_loss: 1.3234, test_f1: 0.5484
 epoch: 94, train_loss: 0.8538, test_loss: 1.3992, test_f1: 0.5624
 epoch: 95, train_loss: 0.8585, test_loss: 1.3548, test_f1: 0.5844
 epoch: 96, train_loss: 0.8462, test_loss: 1.3700, test_f1: 0.5333
 epoch: 97, train_loss: 0.8459, test_loss: 1.3987, test_f1: 0.5574
 epoch: 98, train_loss: 0.8428, test_loss: 1.3145, test_f1: 0.5381
 epoch: 99, train_loss: 0.8437, test_loss: 1.3138, test_f1: 0.5508
##################ITERATION #7 ****************************************
 epoch: 0, train_loss: 1.2836, test_loss: 1.3205, test_f1: 0.2281
 epoch: 1, train_loss: 1.2510, test_loss: 1.3106, test_f1: 0.2281
 epoch: 2, train_loss: 1.2378, test_loss: 1.3189, test_f1: 0.2281
 epoch: 3, train_loss: 1.2287, test_loss: 1.3035, test_f1: 0.2298
 epoch: 4, train_loss: 1.2137, test_loss: 1.2726, test_f1: 0.3238
 epoch: 5, train_loss: 1.2080, test_loss: 1.2596, test_f1: 0.3303
 epoch: 6, train_loss: 1.1995, test_loss: 1.2412, test_f1: 0.3108
 epoch: 7, train_loss: 1.1978, test_loss: 1.2371, test_f1: 0.3157
 epoch: 8, train_loss: 1.1880, test_loss: 1.2331, test_f1: 0.3079
 epoch: 9, train_loss: 1.1863, test_loss: 1.2520, test_f1: 0.2987
 epoch: 10, train_loss: 1.1714, test_loss: 1.2564, test_f1: 0.3211
 epoch: 11, train_loss: 1.1782, test_loss: 1.2592, test_f1: 0.3978
 epoch: 12, train_loss: 1.1630, test_loss: 1.2411, test_f1: 0.3523
 epoch: 13, train_loss: 1.1653, test_loss: 1.2380, test_f1: 0.3586
 epoch: 14, train_loss: 1.1591, test_loss: 1.2299, test_f1: 0.3620
 epoch: 15, train_loss: 1.1636, test_loss: 1.2200, test_f1: 0.3232
 epoch: 16, train_loss: 1.1714, test_loss: 1.2158, test_f1: 0.3637
 epoch: 17, train_loss: 1.1532, test_loss: 1.2062, test_f1: 0.3682
 epoch: 18, train_loss: 1.1521, test_loss: 1.2089, test_f1: 0.3625
 epoch: 19, train_loss: 1.1470, test_loss: 1.2335, test_f1: 0.3871
 epoch: 20, train_loss: 1.1448, test_loss: 1.2225, test_f1: 0.3810
 epoch: 21, train_loss: 1.1410, test_loss: 1.2180, test_f1: 0.3884
 epoch: 22, train_loss: 1.1241, test_loss: 1.2268, test_f1: 0.4108
 epoch: 23, train_loss: 1.1231, test_loss: 1.2223, test_f1: 0.4018
 epoch: 24, train_loss: 1.1196, test_loss: 1.2100, test_f1: 0.4142
 epoch: 25, train_loss: 1.1232, test_loss: 1.2148, test_f1: 0.4178
 epoch: 26, train_loss: 1.1192, test_loss: 1.2317, test_f1: 0.4402
 epoch: 27, train_loss: 1.1134, test_loss: 1.2417, test_f1: 0.4281
 epoch: 28, train_loss: 1.1140, test_loss: 1.2311, test_f1: 0.4360
 epoch: 29, train_loss: 1.0837, test_loss: 1.1987, test_f1: 0.4523
 epoch: 30, train_loss: 1.0800, test_loss: 1.2072, test_f1: 0.4469
 epoch: 31, train_loss: 1.0941, test_loss: 1.2165, test_f1: 0.4580
 epoch: 32, train_loss: 1.0814, test_loss: 1.2071, test_f1: 0.4506
 epoch: 33, train_loss: 1.0735, test_loss: 1.2183, test_f1: 0.4654
 epoch: 34, train_loss: 1.0642, test_loss: 1.2133, test_f1: 0.4724
 epoch: 35, train_loss: 1.0633, test_loss: 1.2356, test_f1: 0.4353
 epoch: 36, train_loss: 1.0495, test_loss: 1.2413, test_f1: 0.4389
 epoch: 37, train_loss: 1.0527, test_loss: 1.1874, test_f1: 0.4660
 epoch: 38, train_loss: 1.0402, test_loss: 1.1900, test_f1: 0.4755
 epoch: 39, train_loss: 1.0432, test_loss: 1.1763, test_f1: 0.4804
 epoch: 40, train_loss: 1.0506, test_loss: 1.1868, test_f1: 0.4745
 epoch: 41, train_loss: 1.0255, test_loss: 1.1864, test_f1: 0.4603
 epoch: 42, train_loss: 1.0221, test_loss: 1.1983, test_f1: 0.4610
 epoch: 43, train_loss: 1.0161, test_loss: 1.1707, test_f1: 0.5279
 epoch: 44, train_loss: 1.0163, test_loss: 1.3157, test_f1: 0.4907
 epoch: 45, train_loss: 1.0168, test_loss: 1.1528, test_f1: 0.4836
 epoch: 46, train_loss: 1.0141, test_loss: 1.1426, test_f1: 0.4712
 epoch: 47, train_loss: 1.0102, test_loss: 1.1671, test_f1: 0.4796
 epoch: 48, train_loss: 0.9894, test_loss: 1.1675, test_f1: 0.4931
 epoch: 49, train_loss: 0.9795, test_loss: 1.1300, test_f1: 0.5183
 epoch: 50, train_loss: 0.9786, test_loss: 1.1845, test_f1: 0.5041
 epoch: 51, train_loss: 0.9763, test_loss: 1.1609, test_f1: 0.4820
 epoch: 52, train_loss: 0.9800, test_loss: 1.1775, test_f1: 0.4745
 epoch: 53, train_loss: 0.9786, test_loss: 1.1672, test_f1: 0.4882
 epoch: 54, train_loss: 0.9709, test_loss: 1.1296, test_f1: 0.4951
 epoch: 55, train_loss: 0.9589, test_loss: 1.1627, test_f1: 0.4979
 epoch: 56, train_loss: 0.9624, test_loss: 1.1965, test_f1: 0.4878
 epoch: 57, train_loss: 0.9547, test_loss: 1.1738, test_f1: 0.5324
 epoch: 58, train_loss: 0.9435, test_loss: 1.1659, test_f1: 0.5183
 epoch: 59, train_loss: 0.9480, test_loss: 1.1838, test_f1: 0.5018
 epoch: 60, train_loss: 0.9616, test_loss: 1.1491, test_f1: 0.5345
 epoch: 61, train_loss: 0.9348, test_loss: 1.2179, test_f1: 0.4777
 epoch: 62, train_loss: 0.9362, test_loss: 1.1665, test_f1: 0.4594
 epoch: 63, train_loss: 0.9392, test_loss: 1.1891, test_f1: 0.5151
 epoch: 64, train_loss: 0.9479, test_loss: 1.1844, test_f1: 0.4974
 epoch: 65, train_loss: 0.9433, test_loss: 1.1787, test_f1: 0.4820
 epoch: 66, train_loss: 0.9201, test_loss: 1.2584, test_f1: 0.4673
 epoch: 67, train_loss: 0.9291, test_loss: 1.2273, test_f1: 0.4907
 epoch: 68, train_loss: 0.9238, test_loss: 1.2522, test_f1: 0.4597
 epoch: 69, train_loss: 0.9191, test_loss: 1.2349, test_f1: 0.4603
 epoch: 70, train_loss: 0.9243, test_loss: 1.2465, test_f1: 0.5249
 epoch: 71, train_loss: 0.9114, test_loss: 1.2749, test_f1: 0.4748
 epoch: 72, train_loss: 0.9124, test_loss: 1.1751, test_f1: 0.5082
 epoch: 73, train_loss: 0.9160, test_loss: 1.1802, test_f1: 0.5347
 epoch: 74, train_loss: 0.9394, test_loss: 1.1862, test_f1: 0.5211
 epoch: 75, train_loss: 0.9212, test_loss: 1.2139, test_f1: 0.4984
 epoch: 76, train_loss: 0.9057, test_loss: 1.2563, test_f1: 0.5131
 epoch: 77, train_loss: 0.8970, test_loss: 1.1971, test_f1: 0.5263
 epoch: 78, train_loss: 0.9060, test_loss: 1.2675, test_f1: 0.5088
 epoch: 79, train_loss: 0.9070, test_loss: 1.2091, test_f1: 0.5049
 epoch: 80, train_loss: 0.9206, test_loss: 1.2731, test_f1: 0.4722
 epoch: 81, train_loss: 0.9132, test_loss: 1.2272, test_f1: 0.4633
 epoch: 82, train_loss: 0.9034, test_loss: 1.2009, test_f1: 0.5059
 epoch: 83, train_loss: 0.9047, test_loss: 1.2292, test_f1: 0.4966
 epoch: 84, train_loss: 0.9075, test_loss: 1.2585, test_f1: 0.5076
 epoch: 85, train_loss: 0.8853, test_loss: 1.2278, test_f1: 0.5149
 epoch: 86, train_loss: 0.8836, test_loss: 1.2250, test_f1: 0.5211
 epoch: 87, train_loss: 0.9045, test_loss: 1.2860, test_f1: 0.5172
 epoch: 88, train_loss: 0.8871, test_loss: 1.2928, test_f1: 0.4824
 epoch: 89, train_loss: 0.8778, test_loss: 1.2754, test_f1: 0.4783
 epoch: 90, train_loss: 0.8981, test_loss: 1.2501, test_f1: 0.4714
 epoch: 91, train_loss: 0.8895, test_loss: 1.3261, test_f1: 0.4935
 epoch: 92, train_loss: 0.8826, test_loss: 1.3045, test_f1: 0.4827
 epoch: 93, train_loss: 0.8912, test_loss: 1.3221, test_f1: 0.5058
 epoch: 94, train_loss: 0.8799, test_loss: 1.2152, test_f1: 0.5285
 epoch: 95, train_loss: 0.8823, test_loss: 1.2969, test_f1: 0.5016
 epoch: 96, train_loss: 0.8840, test_loss: 1.3511, test_f1: 0.4967
 epoch: 97, train_loss: 0.8783, test_loss: 1.3051, test_f1: 0.5124
 epoch: 98, train_loss: 0.8856, test_loss: 1.2632, test_f1: 0.5541
 epoch: 99, train_loss: 0.8452, test_loss: 1.2702, test_f1: 0.5405
##################ITERATION #8 ****************************************
 epoch: 0, train_loss: 1.3810, test_loss: 1.3681, test_f1: 0.2377
 epoch: 1, train_loss: 1.2342, test_loss: 1.3731, test_f1: 0.2391
 epoch: 2, train_loss: 1.2258, test_loss: 1.3974, test_f1: 0.2391
 epoch: 3, train_loss: 1.2098, test_loss: 1.3460, test_f1: 0.2611
 epoch: 4, train_loss: 1.1693, test_loss: 1.3047, test_f1: 0.2992
 epoch: 5, train_loss: 1.1714, test_loss: 1.2788, test_f1: 0.3544
 epoch: 6, train_loss: 1.1607, test_loss: 1.2667, test_f1: 0.3691
 epoch: 7, train_loss: 1.1384, test_loss: 1.2665, test_f1: 0.4019
 epoch: 8, train_loss: 1.1181, test_loss: 1.2602, test_f1: 0.3962
 epoch: 9, train_loss: 1.1074, test_loss: 1.2535, test_f1: 0.4084
 epoch: 10, train_loss: 1.1085, test_loss: 1.2287, test_f1: 0.4510
 epoch: 11, train_loss: 1.0825, test_loss: 1.2366, test_f1: 0.4316
 epoch: 12, train_loss: 1.0763, test_loss: 1.2293, test_f1: 0.4501
 epoch: 13, train_loss: 1.0539, test_loss: 1.2223, test_f1: 0.4252
 epoch: 14, train_loss: 1.0557, test_loss: 1.2421, test_f1: 0.4188
 epoch: 15, train_loss: 1.0507, test_loss: 1.2158, test_f1: 0.4519
 epoch: 16, train_loss: 1.0368, test_loss: 1.2127, test_f1: 0.4582
 epoch: 17, train_loss: 1.0084, test_loss: 1.2217, test_f1: 0.4517
 epoch: 18, train_loss: 1.0056, test_loss: 1.2352, test_f1: 0.4620
 epoch: 19, train_loss: 0.9911, test_loss: 1.2460, test_f1: 0.4443
 epoch: 20, train_loss: 0.9804, test_loss: 1.2454, test_f1: 0.4376
 epoch: 21, train_loss: 0.9792, test_loss: 1.2193, test_f1: 0.4507
 epoch: 22, train_loss: 0.9903, test_loss: 1.2483, test_f1: 0.4340
 epoch: 23, train_loss: 0.9741, test_loss: 1.1945, test_f1: 0.4477
 epoch: 24, train_loss: 0.9838, test_loss: 1.2008, test_f1: 0.4196
 epoch: 25, train_loss: 0.9578, test_loss: 1.1607, test_f1: 0.4685
 epoch: 26, train_loss: 0.9603, test_loss: 1.1548, test_f1: 0.4391
 epoch: 27, train_loss: 0.9539, test_loss: 1.1488, test_f1: 0.4723
 epoch: 28, train_loss: 0.9487, test_loss: 1.1720, test_f1: 0.4299
 epoch: 29, train_loss: 0.9298, test_loss: 1.2109, test_f1: 0.4253
 epoch: 30, train_loss: 0.9485, test_loss: 1.1568, test_f1: 0.4611
 epoch: 31, train_loss: 0.9408, test_loss: 1.1609, test_f1: 0.4564
 epoch: 32, train_loss: 0.9530, test_loss: 1.1632, test_f1: 0.4374
 epoch: 33, train_loss: 0.9330, test_loss: 1.1580, test_f1: 0.4715
 epoch: 34, train_loss: 0.9269, test_loss: 1.1521, test_f1: 0.4600
 epoch: 35, train_loss: 0.9125, test_loss: 1.1521, test_f1: 0.4522
 epoch: 36, train_loss: 0.9228, test_loss: 1.1522, test_f1: 0.4684
 epoch: 37, train_loss: 0.9094, test_loss: 1.1573, test_f1: 0.4782
 epoch: 38, train_loss: 0.8983, test_loss: 1.1561, test_f1: 0.4783
 epoch: 39, train_loss: 0.8965, test_loss: 1.1584, test_f1: 0.4762
 epoch: 40, train_loss: 0.8986, test_loss: 1.1699, test_f1: 0.4635
 epoch: 41, train_loss: 0.9037, test_loss: 1.1870, test_f1: 0.4781
 epoch: 42, train_loss: 0.8857, test_loss: 1.1689, test_f1: 0.4740
 epoch: 43, train_loss: 0.8745, test_loss: 1.1699, test_f1: 0.4918
 epoch: 44, train_loss: 0.8815, test_loss: 1.1744, test_f1: 0.4671
 epoch: 45, train_loss: 0.8920, test_loss: 1.1883, test_f1: 0.4678
 epoch: 46, train_loss: 0.8789, test_loss: 1.2213, test_f1: 0.4893
 epoch: 47, train_loss: 0.8852, test_loss: 1.1760, test_f1: 0.5035
 epoch: 48, train_loss: 0.8685, test_loss: 1.1904, test_f1: 0.4681
 epoch: 49, train_loss: 0.8813, test_loss: 1.1836, test_f1: 0.4935
 epoch: 50, train_loss: 0.8585, test_loss: 1.1938, test_f1: 0.4912
 epoch: 51, train_loss: 0.8566, test_loss: 1.2167, test_f1: 0.4870
 epoch: 52, train_loss: 0.8614, test_loss: 1.2214, test_f1: 0.4881
 epoch: 53, train_loss: 0.8638, test_loss: 1.1889, test_f1: 0.4951
 epoch: 54, train_loss: 0.8573, test_loss: 1.2003, test_f1: 0.5034
 epoch: 55, train_loss: 0.8369, test_loss: 1.1968, test_f1: 0.5001
 epoch: 56, train_loss: 0.8420, test_loss: 1.1936, test_f1: 0.4870
 epoch: 57, train_loss: 0.8352, test_loss: 1.2161, test_f1: 0.5007
 epoch: 58, train_loss: 0.8495, test_loss: 1.2142, test_f1: 0.4834
 epoch: 59, train_loss: 0.8632, test_loss: 1.1769, test_f1: 0.5279
 epoch: 60, train_loss: 0.8494, test_loss: 1.1675, test_f1: 0.5319
 epoch: 61, train_loss: 0.8531, test_loss: 1.2382, test_f1: 0.5048
 epoch: 62, train_loss: 0.8422, test_loss: 1.2241, test_f1: 0.4939
 epoch: 63, train_loss: 0.8373, test_loss: 1.2438, test_f1: 0.5006
 epoch: 64, train_loss: 0.8300, test_loss: 1.2522, test_f1: 0.5088
 epoch: 65, train_loss: 0.8325, test_loss: 1.2615, test_f1: 0.4861
 epoch: 66, train_loss: 0.8235, test_loss: 1.2305, test_f1: 0.4919
 epoch: 67, train_loss: 0.8248, test_loss: 1.2121, test_f1: 0.4946
 epoch: 68, train_loss: 0.8366, test_loss: 1.2204, test_f1: 0.5175
 epoch: 69, train_loss: 0.8323, test_loss: 1.2017, test_f1: 0.5035
 epoch: 70, train_loss: 0.8225, test_loss: 1.1992, test_f1: 0.5164
 epoch: 71, train_loss: 0.8342, test_loss: 1.2257, test_f1: 0.5149
 epoch: 72, train_loss: 0.8362, test_loss: 1.2409, test_f1: 0.4803
 epoch: 73, train_loss: 0.8302, test_loss: 1.2526, test_f1: 0.5080
 epoch: 74, train_loss: 0.8272, test_loss: 1.2556, test_f1: 0.5024
 epoch: 75, train_loss: 0.8086, test_loss: 1.2110, test_f1: 0.5184
 epoch: 76, train_loss: 0.8208, test_loss: 1.2353, test_f1: 0.5081
 epoch: 77, train_loss: 0.8154, test_loss: 1.2628, test_f1: 0.4929
 epoch: 78, train_loss: 0.8062, test_loss: 1.2492, test_f1: 0.4860
 epoch: 79, train_loss: 0.8109, test_loss: 1.2513, test_f1: 0.4717
 epoch: 80, train_loss: 0.8217, test_loss: 1.2718, test_f1: 0.4938
 epoch: 81, train_loss: 0.8140, test_loss: 1.2508, test_f1: 0.5119
 epoch: 82, train_loss: 0.8174, test_loss: 1.2847, test_f1: 0.4708
 epoch: 83, train_loss: 0.7954, test_loss: 1.3331, test_f1: 0.4803
 epoch: 84, train_loss: 0.7973, test_loss: 1.2576, test_f1: 0.5003
 epoch: 85, train_loss: 0.8057, test_loss: 1.1992, test_f1: 0.5156
 epoch: 86, train_loss: 0.8081, test_loss: 1.2507, test_f1: 0.4770
 epoch: 87, train_loss: 0.8045, test_loss: 1.2935, test_f1: 0.4843
 epoch: 88, train_loss: 0.8045, test_loss: 1.2945, test_f1: 0.4786
 epoch: 89, train_loss: 0.8119, test_loss: 1.3077, test_f1: 0.4501
 epoch: 90, train_loss: 0.8073, test_loss: 1.2657, test_f1: 0.4666
 epoch: 91, train_loss: 0.8101, test_loss: 1.2980, test_f1: 0.4559
 epoch: 92, train_loss: 0.8259, test_loss: 1.2759, test_f1: 0.4576
 epoch: 93, train_loss: 0.8035, test_loss: 1.2406, test_f1: 0.4710
 epoch: 94, train_loss: 0.7917, test_loss: 1.3157, test_f1: 0.4772
 epoch: 95, train_loss: 0.8062, test_loss: 1.2710, test_f1: 0.4670
 epoch: 96, train_loss: 0.8096, test_loss: 1.2402, test_f1: 0.4768
 epoch: 97, train_loss: 0.8078, test_loss: 1.2147, test_f1: 0.5169
 epoch: 98, train_loss: 0.8004, test_loss: 1.2695, test_f1: 0.4842
 epoch: 99, train_loss: 0.8000, test_loss: 1.3038, test_f1: 0.4656
##################ITERATION #9 ****************************************
 epoch: 0, train_loss: 1.4777, test_loss: 1.3359, test_f1: 0.2281
 epoch: 1, train_loss: 1.3020, test_loss: 1.3044, test_f1: 0.2281
 epoch: 2, train_loss: 1.2843, test_loss: 1.3115, test_f1: 0.2511
 epoch: 3, train_loss: 1.2371, test_loss: 1.2912, test_f1: 0.2653
 epoch: 4, train_loss: 1.2262, test_loss: 1.2617, test_f1: 0.2608
 epoch: 5, train_loss: 1.2270, test_loss: 1.2470, test_f1: 0.2522
 epoch: 6, train_loss: 1.2356, test_loss: 1.2309, test_f1: 0.2770
 epoch: 7, train_loss: 1.2059, test_loss: 1.2472, test_f1: 0.2737
 epoch: 8, train_loss: 1.2014, test_loss: 1.2354, test_f1: 0.2702
 epoch: 9, train_loss: 1.1829, test_loss: 1.2713, test_f1: 0.3089
 epoch: 10, train_loss: 1.1804, test_loss: 1.2732, test_f1: 0.3075
 epoch: 11, train_loss: 1.1767, test_loss: 1.2550, test_f1: 0.3401
 epoch: 12, train_loss: 1.1626, test_loss: 1.2623, test_f1: 0.3413
 epoch: 13, train_loss: 1.1701, test_loss: 1.2783, test_f1: 0.3431
 epoch: 14, train_loss: 1.1540, test_loss: 1.2855, test_f1: 0.3426
 epoch: 15, train_loss: 1.1580, test_loss: 1.2802, test_f1: 0.3691
 epoch: 16, train_loss: 1.1342, test_loss: 1.2332, test_f1: 0.3942
 epoch: 17, train_loss: 1.1173, test_loss: 1.2215, test_f1: 0.4234
 epoch: 18, train_loss: 1.1222, test_loss: 1.2209, test_f1: 0.4130
 epoch: 19, train_loss: 1.1103, test_loss: 1.2322, test_f1: 0.4484
 epoch: 20, train_loss: 1.0999, test_loss: 1.2027, test_f1: 0.3998
 epoch: 21, train_loss: 1.0907, test_loss: 1.1901, test_f1: 0.4569
 epoch: 22, train_loss: 1.0946, test_loss: 1.2123, test_f1: 0.4296
 epoch: 23, train_loss: 1.0653, test_loss: 1.2505, test_f1: 0.4352
 epoch: 24, train_loss: 1.0699, test_loss: 1.2625, test_f1: 0.4421
 epoch: 25, train_loss: 1.0568, test_loss: 1.2450, test_f1: 0.4338
 epoch: 26, train_loss: 1.0759, test_loss: 1.2369, test_f1: 0.4211
 epoch: 27, train_loss: 1.0460, test_loss: 1.2409, test_f1: 0.4493
 epoch: 28, train_loss: 1.0564, test_loss: 1.3078, test_f1: 0.4712
 epoch: 29, train_loss: 1.0405, test_loss: 1.2348, test_f1: 0.4765
 epoch: 30, train_loss: 1.0307, test_loss: 1.2239, test_f1: 0.4645
 epoch: 31, train_loss: 1.0247, test_loss: 1.2244, test_f1: 0.4419
 epoch: 32, train_loss: 1.0238, test_loss: 1.2939, test_f1: 0.4714
 epoch: 33, train_loss: 1.0089, test_loss: 1.2330, test_f1: 0.4641
 epoch: 34, train_loss: 1.0132, test_loss: 1.1738, test_f1: 0.4715
 epoch: 35, train_loss: 1.0133, test_loss: 1.2401, test_f1: 0.4791
 epoch: 36, train_loss: 1.0204, test_loss: 1.2642, test_f1: 0.4804
 epoch: 37, train_loss: 0.9930, test_loss: 1.2297, test_f1: 0.4885
 epoch: 38, train_loss: 0.9824, test_loss: 1.2210, test_f1: 0.4699
 epoch: 39, train_loss: 0.9758, test_loss: 1.2465, test_f1: 0.4784
 epoch: 40, train_loss: 0.9733, test_loss: 1.2279, test_f1: 0.4872
 epoch: 41, train_loss: 0.9877, test_loss: 1.2714, test_f1: 0.4909
 epoch: 42, train_loss: 0.9744, test_loss: 1.2414, test_f1: 0.4976
 epoch: 43, train_loss: 0.9649, test_loss: 1.2670, test_f1: 0.4837
 epoch: 44, train_loss: 0.9568, test_loss: 1.2431, test_f1: 0.4912
 epoch: 45, train_loss: 0.9655, test_loss: 1.2492, test_f1: 0.5058
 epoch: 46, train_loss: 0.9616, test_loss: 1.2390, test_f1: 0.4933
 epoch: 47, train_loss: 0.9545, test_loss: 1.2090, test_f1: 0.5054
 epoch: 48, train_loss: 0.9410, test_loss: 1.2734, test_f1: 0.4939
 epoch: 49, train_loss: 0.9403, test_loss: 1.2489, test_f1: 0.5072
 epoch: 50, train_loss: 0.9193, test_loss: 1.2437, test_f1: 0.4982
 epoch: 51, train_loss: 0.9304, test_loss: 1.2146, test_f1: 0.4998
 epoch: 52, train_loss: 0.9218, test_loss: 1.2134, test_f1: 0.4763
 epoch: 53, train_loss: 0.9249, test_loss: 1.1914, test_f1: 0.4983
 epoch: 54, train_loss: 0.9186, test_loss: 1.2530, test_f1: 0.4883
 epoch: 55, train_loss: 0.9232, test_loss: 1.2388, test_f1: 0.5054
 epoch: 56, train_loss: 0.9121, test_loss: 1.2214, test_f1: 0.4970
 epoch: 57, train_loss: 0.9269, test_loss: 1.2221, test_f1: 0.5119
 epoch: 58, train_loss: 0.9070, test_loss: 1.2244, test_f1: 0.5089
 epoch: 59, train_loss: 0.9103, test_loss: 1.2424, test_f1: 0.5021
 epoch: 60, train_loss: 0.8952, test_loss: 1.2343, test_f1: 0.4691
 epoch: 61, train_loss: 0.8823, test_loss: 1.2334, test_f1: 0.4770
 epoch: 62, train_loss: 0.8925, test_loss: 1.2266, test_f1: 0.4823
 epoch: 63, train_loss: 0.9104, test_loss: 1.2078, test_f1: 0.4872
 epoch: 64, train_loss: 0.9056, test_loss: 1.2308, test_f1: 0.5036
 epoch: 65, train_loss: 0.8958, test_loss: 1.2352, test_f1: 0.5239
 epoch: 66, train_loss: 0.8965, test_loss: 1.2078, test_f1: 0.4913
 epoch: 67, train_loss: 0.8826, test_loss: 1.2188, test_f1: 0.4871
 epoch: 68, train_loss: 0.8766, test_loss: 1.2480, test_f1: 0.4656
 epoch: 69, train_loss: 0.8923, test_loss: 1.2659, test_f1: 0.4724
 epoch: 70, train_loss: 0.8810, test_loss: 1.2396, test_f1: 0.4757
 epoch: 71, train_loss: 0.8602, test_loss: 1.2371, test_f1: 0.4812
 epoch: 72, train_loss: 0.8928, test_loss: 1.2232, test_f1: 0.4891
 epoch: 73, train_loss: 0.8722, test_loss: 1.2116, test_f1: 0.4966
 epoch: 74, train_loss: 0.8672, test_loss: 1.2242, test_f1: 0.4828
 epoch: 75, train_loss: 0.8669, test_loss: 1.2864, test_f1: 0.4708
 epoch: 76, train_loss: 0.8808, test_loss: 1.2762, test_f1: 0.4828
 epoch: 77, train_loss: 0.8762, test_loss: 1.2443, test_f1: 0.4891
 epoch: 78, train_loss: 0.8576, test_loss: 1.2036, test_f1: 0.4969
 epoch: 79, train_loss: 0.8610, test_loss: 1.2328, test_f1: 0.4957
 epoch: 80, train_loss: 0.8470, test_loss: 1.2374, test_f1: 0.4762
 epoch: 81, train_loss: 0.8678, test_loss: 1.2303, test_f1: 0.4886
 epoch: 82, train_loss: 0.8503, test_loss: 1.3104, test_f1: 0.5019
 epoch: 83, train_loss: 0.8672, test_loss: 1.3215, test_f1: 0.5052
 epoch: 84, train_loss: 0.8511, test_loss: 1.2526, test_f1: 0.5074
 epoch: 85, train_loss: 0.8436, test_loss: 1.2435, test_f1: 0.4994
 epoch: 86, train_loss: 0.8492, test_loss: 1.2468, test_f1: 0.5154
 epoch: 87, train_loss: 0.8574, test_loss: 1.2892, test_f1: 0.4879
 epoch: 88, train_loss: 0.8376, test_loss: 1.2691, test_f1: 0.4834
 epoch: 89, train_loss: 0.8433, test_loss: 1.2757, test_f1: 0.4870
 epoch: 90, train_loss: 0.8310, test_loss: 1.2290, test_f1: 0.5048
 epoch: 91, train_loss: 0.8333, test_loss: 1.2018, test_f1: 0.5050
 epoch: 92, train_loss: 0.8423, test_loss: 1.2097, test_f1: 0.5166
 epoch: 93, train_loss: 0.8507, test_loss: 1.2339, test_f1: 0.4984
 epoch: 94, train_loss: 0.8243, test_loss: 1.3072, test_f1: 0.5012
 epoch: 95, train_loss: 0.8427, test_loss: 1.2710, test_f1: 0.4724
 epoch: 96, train_loss: 0.8197, test_loss: 1.2853, test_f1: 0.4965
 epoch: 97, train_loss: 0.8376, test_loss: 1.2846, test_f1: 0.4885
 epoch: 98, train_loss: 0.8369, test_loss: 1.2681, test_f1: 0.4930
 epoch: 99, train_loss: 0.8302, test_loss: 1.2862, test_f1: 0.4951

Training completed in 371.46 seconds
Best F1: 0.6033 at epoch 41
Mean F1 across iterations: 0.5528  0.0272
========================FINAL RESULTS================================
FEGIN weighted F1: 0.6033  0.0272
python main.py --data ltspice_demos --representation component_component --model FEGIN --layers 5 --hiddens 16 --batch_size 128 --lr 0.001 --emb_size 128 --epochs 100 --save_appendix component_component_L5_H16_BS128_LR0.001_E128 --no_val
-----



STDERR:
Processing...
Done!
  File "main.py", line 370, in <module>
    main()
  File "main.py", line 254, in main
    dataset = dataset_class(
  File "/home/philip/projects/ltspice_examples_code_repo/Circuit-Completion-Using-GNNs/component_classification_with_link_prediction_head/evaluation/FEGIN/kernel/circuit_datasets.py", line 15, in __init__
    self.data, self.slices = torch.load(self.processed_paths[0])
  File "/home/philip/.local/lib/python3.8/site-packages/torch/serialization.py", line 1040, in load
    warnings.warn(
  File "/usr/lib/python3.8/warnings.py", line 109, in _showwarnmsg
    sw(msg.message, msg.category, msg.filename, msg.lineno,
  File "main.py", line 47, in warn_with_traceback
    traceback.print_stack(file=log)
/home/philip/projects/ltspice_examples_code_repo/Circuit-Completion-Using-GNNs/component_classification_with_link_prediction_head/evaluation/FEGIN/kernel/circuit_datasets.py:15: FutureWarning: You are using `torch.load` with `weights_only=False` (the current default value), which uses the default pickle module implicitly. It is possible to construct malicious pickle data which will execute arbitrary code during unpickling (See https://github.com/pytorch/pytorch/blob/main/SECURITY.md#untrusted-models for more details). In a future release, the default value for `weights_only` will be flipped to `True`. This limits the functions that could be executed during unpickling. Arbitrary objects will no longer be allowed to be loaded via this mode unless they are explicitly allowlisted by the user via `torch.serialization.add_safe_globals`. We recommend you start setting `weights_only=True` for any use case where you don't have full control of the loaded file. Please open an issue on GitHub for any issues related to this experimental feature.
  self.data, self.slices = torch.load(self.processed_paths[0])
