STDOUT:
Results will be saved in /home/philip/projects/ltspice_examples_code_repo/Circuit-Completion-Using-GNNs/component_classification_with_link_prediction_head/evaluation/FEGIN/results/model_FEGIN_dataset_ltspice_demos
Command line input: python main.py --data ltspice_demos --representation component_component --model FEGIN --layers 4 --hiddens 16 --batch_size 256 --lr 0.001 --emb_size 512 --epochs 100 --save_appendix component_component_L4_H16_BS256_LR0.001_E512 --no_val
 is saved.
-----
ltspice_demos - FEGIN
Using 4 layers, 16 hidden units, h = 2
Loading component_component representation dataset
ENTERED
Training FEGIN on component_component representation
Train: 1565, Test: 383
##################ITERATION #0 ****************************************
 epoch: 0, train_loss: 1.3696, test_loss: 1.3636, test_f1: 0.2281
 epoch: 1, train_loss: 1.3597, test_loss: 1.3600, test_f1: 0.2281
 epoch: 2, train_loss: 1.3548, test_loss: 1.3567, test_f1: 0.2281
 epoch: 3, train_loss: 1.3500, test_loss: 1.3529, test_f1: 0.2281
 epoch: 4, train_loss: 1.3445, test_loss: 1.3490, test_f1: 0.2281
 epoch: 5, train_loss: 1.3393, test_loss: 1.3446, test_f1: 0.2281
 epoch: 6, train_loss: 1.3331, test_loss: 1.3403, test_f1: 0.2281
 epoch: 7, train_loss: 1.3269, test_loss: 1.3353, test_f1: 0.2281
 epoch: 8, train_loss: 1.3188, test_loss: 1.3298, test_f1: 0.2281
 epoch: 9, train_loss: 1.3105, test_loss: 1.3227, test_f1: 0.2281
 epoch: 10, train_loss: 1.3005, test_loss: 1.3159, test_f1: 0.2281
 epoch: 11, train_loss: 1.2904, test_loss: 1.3083, test_f1: 0.2281
 epoch: 12, train_loss: 1.2734, test_loss: 1.3014, test_f1: 0.2281
 epoch: 13, train_loss: 1.2589, test_loss: 1.2924, test_f1: 0.2281
 epoch: 14, train_loss: 1.2499, test_loss: 1.2807, test_f1: 0.2281
 epoch: 15, train_loss: 1.2355, test_loss: 1.2676, test_f1: 0.2281
 epoch: 16, train_loss: 1.2196, test_loss: 1.2620, test_f1: 0.2281
 epoch: 17, train_loss: 1.2105, test_loss: 1.2689, test_f1: 0.2281
 epoch: 18, train_loss: 1.2013, test_loss: 1.2576, test_f1: 0.2281
 epoch: 19, train_loss: 1.1901, test_loss: 1.2482, test_f1: 0.2968
 epoch: 20, train_loss: 1.1828, test_loss: 1.2470, test_f1: 0.2920
 epoch: 21, train_loss: 1.1829, test_loss: 1.2796, test_f1: 0.2533
 epoch: 22, train_loss: 1.1675, test_loss: 1.3181, test_f1: 0.2559
 epoch: 23, train_loss: 1.1683, test_loss: 1.3127, test_f1: 0.3164
 epoch: 24, train_loss: 1.1541, test_loss: 1.3084, test_f1: 0.3207
 epoch: 25, train_loss: 1.1540, test_loss: 1.3040, test_f1: 0.3375
 epoch: 26, train_loss: 1.1520, test_loss: 1.2954, test_f1: 0.3805
 epoch: 27, train_loss: 1.1470, test_loss: 1.3029, test_f1: 0.4222
 epoch: 28, train_loss: 1.1364, test_loss: 1.3197, test_f1: 0.3950
 epoch: 29, train_loss: 1.1343, test_loss: 1.3501, test_f1: 0.3975
 epoch: 30, train_loss: 1.1282, test_loss: 1.3443, test_f1: 0.3880
 epoch: 31, train_loss: 1.1178, test_loss: 1.3159, test_f1: 0.3736
 epoch: 32, train_loss: 1.1119, test_loss: 1.3203, test_f1: 0.4138
 epoch: 33, train_loss: 1.1137, test_loss: 1.3583, test_f1: 0.4039
 epoch: 34, train_loss: 1.1125, test_loss: 1.3870, test_f1: 0.4039
 epoch: 35, train_loss: 1.1061, test_loss: 1.4125, test_f1: 0.3951
 epoch: 36, train_loss: 1.0978, test_loss: 1.4191, test_f1: 0.4109
 epoch: 37, train_loss: 1.1034, test_loss: 1.4360, test_f1: 0.4015
 epoch: 38, train_loss: 1.0967, test_loss: 1.4534, test_f1: 0.4246
 epoch: 39, train_loss: 1.0914, test_loss: 1.4885, test_f1: 0.4201
 epoch: 40, train_loss: 1.0842, test_loss: 1.5018, test_f1: 0.4234
 epoch: 41, train_loss: 1.0817, test_loss: 1.4910, test_f1: 0.4204
 epoch: 42, train_loss: 1.0862, test_loss: 1.4634, test_f1: 0.4101
 epoch: 43, train_loss: 1.0836, test_loss: 1.4451, test_f1: 0.3979
 epoch: 44, train_loss: 1.0707, test_loss: 1.4124, test_f1: 0.4063
 epoch: 45, train_loss: 1.0658, test_loss: 1.4270, test_f1: 0.4011
 epoch: 46, train_loss: 1.0584, test_loss: 1.4570, test_f1: 0.4112
 epoch: 47, train_loss: 1.0669, test_loss: 1.5056, test_f1: 0.4063
 epoch: 48, train_loss: 1.0489, test_loss: 1.5242, test_f1: 0.4060
 epoch: 49, train_loss: 1.0586, test_loss: 1.4818, test_f1: 0.3893
 epoch: 50, train_loss: 1.0463, test_loss: 1.4510, test_f1: 0.3809
 epoch: 51, train_loss: 1.0353, test_loss: 1.4493, test_f1: 0.3704
 epoch: 52, train_loss: 1.0320, test_loss: 1.4560, test_f1: 0.3914
 epoch: 53, train_loss: 1.0318, test_loss: 1.4859, test_f1: 0.3892
 epoch: 54, train_loss: 1.0250, test_loss: 1.5526, test_f1: 0.3892
 epoch: 55, train_loss: 1.0247, test_loss: 1.5977, test_f1: 0.4092
 epoch: 56, train_loss: 1.0280, test_loss: 1.5902, test_f1: 0.4051
 epoch: 57, train_loss: 1.0213, test_loss: 1.5927, test_f1: 0.4071
 epoch: 58, train_loss: 1.0258, test_loss: 1.5957, test_f1: 0.4028
 epoch: 59, train_loss: 1.0270, test_loss: 1.5985, test_f1: 0.4073
 epoch: 60, train_loss: 1.0178, test_loss: 1.5954, test_f1: 0.4075
 epoch: 61, train_loss: 1.0239, test_loss: 1.5696, test_f1: 0.4118
 epoch: 62, train_loss: 1.0230, test_loss: 1.5700, test_f1: 0.3935
 epoch: 63, train_loss: 1.0171, test_loss: 1.5681, test_f1: 0.4067
 epoch: 64, train_loss: 1.0212, test_loss: 1.5705, test_f1: 0.3894
 epoch: 65, train_loss: 1.0025, test_loss: 1.5547, test_f1: 0.3893
 epoch: 66, train_loss: 0.9912, test_loss: 1.5407, test_f1: 0.4025
 epoch: 67, train_loss: 1.0035, test_loss: 1.5655, test_f1: 0.4198
 epoch: 68, train_loss: 0.9976, test_loss: 1.5865, test_f1: 0.4047
 epoch: 69, train_loss: 1.0087, test_loss: 1.5941, test_f1: 0.3986
 epoch: 70, train_loss: 0.9863, test_loss: 1.6023, test_f1: 0.4013
 epoch: 71, train_loss: 0.9971, test_loss: 1.6015, test_f1: 0.3992
 epoch: 72, train_loss: 1.0090, test_loss: 1.5954, test_f1: 0.4103
 epoch: 73, train_loss: 0.9981, test_loss: 1.6044, test_f1: 0.4081
 epoch: 74, train_loss: 0.9976, test_loss: 1.6270, test_f1: 0.4196
 epoch: 75, train_loss: 0.9973, test_loss: 1.6197, test_f1: 0.4212
 epoch: 76, train_loss: 0.9948, test_loss: 1.6509, test_f1: 0.4171
 epoch: 77, train_loss: 0.9914, test_loss: 1.7310, test_f1: 0.4255
 epoch: 78, train_loss: 0.9936, test_loss: 1.7640, test_f1: 0.4263
 epoch: 79, train_loss: 0.9878, test_loss: 1.7446, test_f1: 0.4050
 epoch: 80, train_loss: 0.9888, test_loss: 1.6929, test_f1: 0.4010
 epoch: 81, train_loss: 0.9770, test_loss: 1.7021, test_f1: 0.4044
 epoch: 82, train_loss: 0.9796, test_loss: 1.7186, test_f1: 0.3944
 epoch: 83, train_loss: 0.9702, test_loss: 1.7309, test_f1: 0.4136
 epoch: 84, train_loss: 0.9858, test_loss: 1.7128, test_f1: 0.4015
 epoch: 85, train_loss: 0.9826, test_loss: 1.7025, test_f1: 0.4088
 epoch: 86, train_loss: 0.9862, test_loss: 1.7098, test_f1: 0.4227
 epoch: 87, train_loss: 0.9741, test_loss: 1.6309, test_f1: 0.4275
 epoch: 88, train_loss: 0.9630, test_loss: 1.6559, test_f1: 0.4339
 epoch: 89, train_loss: 0.9717, test_loss: 1.7314, test_f1: 0.4101
 epoch: 90, train_loss: 0.9590, test_loss: 1.7612, test_f1: 0.4057
 epoch: 91, train_loss: 0.9654, test_loss: 1.7371, test_f1: 0.4223
 epoch: 92, train_loss: 0.9679, test_loss: 1.7323, test_f1: 0.4215
 epoch: 93, train_loss: 0.9766, test_loss: 1.7213, test_f1: 0.4173
 epoch: 94, train_loss: 0.9563, test_loss: 1.7582, test_f1: 0.4393
 epoch: 95, train_loss: 0.9591, test_loss: 1.7716, test_f1: 0.4334
 epoch: 96, train_loss: 0.9536, test_loss: 1.7897, test_f1: 0.4248
 epoch: 97, train_loss: 0.9508, test_loss: 1.7927, test_f1: 0.4227
 epoch: 98, train_loss: 0.9587, test_loss: 1.8497, test_f1: 0.4594
 epoch: 99, train_loss: 0.9519, test_loss: 1.8278, test_f1: 0.4518
##################ITERATION #1 ****************************************
 epoch: 0, train_loss: 1.3601, test_loss: 1.3575, test_f1: 0.2281
 epoch: 1, train_loss: 1.3218, test_loss: 1.3469, test_f1: 0.2281
 epoch: 2, train_loss: 1.3054, test_loss: 1.3376, test_f1: 0.2281
 epoch: 3, train_loss: 1.2883, test_loss: 1.3267, test_f1: 0.2281
 epoch: 4, train_loss: 1.2739, test_loss: 1.3146, test_f1: 0.2281
 epoch: 5, train_loss: 1.2630, test_loss: 1.3040, test_f1: 0.2281
 epoch: 6, train_loss: 1.2516, test_loss: 1.2955, test_f1: 0.2281
 epoch: 7, train_loss: 1.2325, test_loss: 1.2918, test_f1: 0.2281
 epoch: 8, train_loss: 1.2183, test_loss: 1.2889, test_f1: 0.2227
 epoch: 9, train_loss: 1.2091, test_loss: 1.2931, test_f1: 0.2437
 epoch: 10, train_loss: 1.1934, test_loss: 1.2964, test_f1: 0.2581
 epoch: 11, train_loss: 1.1872, test_loss: 1.3001, test_f1: 0.3195
 epoch: 12, train_loss: 1.1766, test_loss: 1.3010, test_f1: 0.3558
 epoch: 13, train_loss: 1.1621, test_loss: 1.2876, test_f1: 0.3570
 epoch: 14, train_loss: 1.1491, test_loss: 1.2772, test_f1: 0.3813
 epoch: 15, train_loss: 1.1476, test_loss: 1.2742, test_f1: 0.3852
 epoch: 16, train_loss: 1.1292, test_loss: 1.2841, test_f1: 0.4017
 epoch: 17, train_loss: 1.1274, test_loss: 1.2896, test_f1: 0.4046
 epoch: 18, train_loss: 1.1145, test_loss: 1.2908, test_f1: 0.4038
 epoch: 19, train_loss: 1.1154, test_loss: 1.2790, test_f1: 0.4037
 epoch: 20, train_loss: 1.1115, test_loss: 1.2602, test_f1: 0.4227
 epoch: 21, train_loss: 1.1073, test_loss: 1.2565, test_f1: 0.4202
 epoch: 22, train_loss: 1.1063, test_loss: 1.2651, test_f1: 0.4176
 epoch: 23, train_loss: 1.0928, test_loss: 1.2728, test_f1: 0.4252
 epoch: 24, train_loss: 1.0878, test_loss: 1.2760, test_f1: 0.4340
 epoch: 25, train_loss: 1.0770, test_loss: 1.2848, test_f1: 0.4234
 epoch: 26, train_loss: 1.0805, test_loss: 1.2722, test_f1: 0.4281
 epoch: 27, train_loss: 1.0642, test_loss: 1.2460, test_f1: 0.4353
 epoch: 28, train_loss: 1.0726, test_loss: 1.2631, test_f1: 0.4408
 epoch: 29, train_loss: 1.0618, test_loss: 1.2720, test_f1: 0.4257
 epoch: 30, train_loss: 1.0583, test_loss: 1.2757, test_f1: 0.4153
 epoch: 31, train_loss: 1.0506, test_loss: 1.2618, test_f1: 0.4250
 epoch: 32, train_loss: 1.0476, test_loss: 1.2382, test_f1: 0.4319
 epoch: 33, train_loss: 1.0484, test_loss: 1.2350, test_f1: 0.4303
 epoch: 34, train_loss: 1.0477, test_loss: 1.2566, test_f1: 0.4155
 epoch: 35, train_loss: 1.0378, test_loss: 1.2666, test_f1: 0.4305
 epoch: 36, train_loss: 1.0307, test_loss: 1.2625, test_f1: 0.4383
 epoch: 37, train_loss: 1.0371, test_loss: 1.2775, test_f1: 0.4460
 epoch: 38, train_loss: 1.0290, test_loss: 1.2877, test_f1: 0.4251
 epoch: 39, train_loss: 1.0185, test_loss: 1.2710, test_f1: 0.4464
 epoch: 40, train_loss: 1.0303, test_loss: 1.2805, test_f1: 0.4332
 epoch: 41, train_loss: 1.0374, test_loss: 1.2620, test_f1: 0.4457
 epoch: 42, train_loss: 1.0178, test_loss: 1.2831, test_f1: 0.4393
 epoch: 43, train_loss: 1.0304, test_loss: 1.2721, test_f1: 0.4391
 epoch: 44, train_loss: 1.0095, test_loss: 1.2787, test_f1: 0.4423
 epoch: 45, train_loss: 1.0212, test_loss: 1.2923, test_f1: 0.4180
 epoch: 46, train_loss: 1.0199, test_loss: 1.2725, test_f1: 0.4425
 epoch: 47, train_loss: 1.0061, test_loss: 1.2725, test_f1: 0.4343
 epoch: 48, train_loss: 1.0010, test_loss: 1.2866, test_f1: 0.4374
 epoch: 49, train_loss: 1.0040, test_loss: 1.2775, test_f1: 0.4503
 epoch: 50, train_loss: 1.0040, test_loss: 1.2840, test_f1: 0.4407
 epoch: 51, train_loss: 1.0002, test_loss: 1.2852, test_f1: 0.4534
 epoch: 52, train_loss: 0.9906, test_loss: 1.2938, test_f1: 0.4393
 epoch: 53, train_loss: 0.9993, test_loss: 1.2954, test_f1: 0.4418
 epoch: 54, train_loss: 0.9937, test_loss: 1.2997, test_f1: 0.4441
 epoch: 55, train_loss: 0.9879, test_loss: 1.3027, test_f1: 0.4432
 epoch: 56, train_loss: 0.9904, test_loss: 1.3187, test_f1: 0.4324
 epoch: 57, train_loss: 0.9907, test_loss: 1.3063, test_f1: 0.4235
 epoch: 58, train_loss: 1.0055, test_loss: 1.3045, test_f1: 0.4332
 epoch: 59, train_loss: 0.9813, test_loss: 1.2969, test_f1: 0.4514
 epoch: 60, train_loss: 0.9786, test_loss: 1.3235, test_f1: 0.4451
 epoch: 61, train_loss: 0.9773, test_loss: 1.3243, test_f1: 0.4455
 epoch: 62, train_loss: 0.9663, test_loss: 1.3227, test_f1: 0.4577
 epoch: 63, train_loss: 0.9772, test_loss: 1.3230, test_f1: 0.4501
 epoch: 64, train_loss: 0.9778, test_loss: 1.3331, test_f1: 0.4514
 epoch: 65, train_loss: 0.9705, test_loss: 1.3553, test_f1: 0.4395
 epoch: 66, train_loss: 0.9813, test_loss: 1.3596, test_f1: 0.4347
 epoch: 67, train_loss: 0.9720, test_loss: 1.3609, test_f1: 0.4420
 epoch: 68, train_loss: 0.9680, test_loss: 1.3702, test_f1: 0.4544
 epoch: 69, train_loss: 0.9666, test_loss: 1.4026, test_f1: 0.4449
 epoch: 70, train_loss: 0.9685, test_loss: 1.3806, test_f1: 0.4465
 epoch: 71, train_loss: 0.9688, test_loss: 1.3576, test_f1: 0.4492
 epoch: 72, train_loss: 0.9537, test_loss: 1.3346, test_f1: 0.4572
 epoch: 73, train_loss: 0.9584, test_loss: 1.3238, test_f1: 0.4514
 epoch: 74, train_loss: 0.9708, test_loss: 1.3260, test_f1: 0.4421
 epoch: 75, train_loss: 0.9674, test_loss: 1.3410, test_f1: 0.4296
 epoch: 76, train_loss: 0.9592, test_loss: 1.3573, test_f1: 0.4463
 epoch: 77, train_loss: 0.9616, test_loss: 1.3811, test_f1: 0.4334
 epoch: 78, train_loss: 0.9602, test_loss: 1.3645, test_f1: 0.4333
 epoch: 79, train_loss: 0.9619, test_loss: 1.3654, test_f1: 0.4442
 epoch: 80, train_loss: 0.9544, test_loss: 1.3260, test_f1: 0.4635
 epoch: 81, train_loss: 0.9528, test_loss: 1.3244, test_f1: 0.4618
 epoch: 82, train_loss: 0.9466, test_loss: 1.3319, test_f1: 0.4595
 epoch: 83, train_loss: 0.9504, test_loss: 1.3429, test_f1: 0.4725
 epoch: 84, train_loss: 0.9454, test_loss: 1.3465, test_f1: 0.4620
 epoch: 85, train_loss: 0.9392, test_loss: 1.3642, test_f1: 0.4477
 epoch: 86, train_loss: 0.9429, test_loss: 1.3447, test_f1: 0.4576
 epoch: 87, train_loss: 0.9572, test_loss: 1.3599, test_f1: 0.4621
 epoch: 88, train_loss: 0.9448, test_loss: 1.3874, test_f1: 0.4588
 epoch: 89, train_loss: 0.9407, test_loss: 1.3826, test_f1: 0.4666
 epoch: 90, train_loss: 0.9418, test_loss: 1.3557, test_f1: 0.4640
 epoch: 91, train_loss: 0.9380, test_loss: 1.3475, test_f1: 0.4638
 epoch: 92, train_loss: 0.9404, test_loss: 1.3636, test_f1: 0.4747
 epoch: 93, train_loss: 0.9366, test_loss: 1.3867, test_f1: 0.4754
 epoch: 94, train_loss: 0.9450, test_loss: 1.4149, test_f1: 0.4642
 epoch: 95, train_loss: 0.9269, test_loss: 1.3929, test_f1: 0.4652
 epoch: 96, train_loss: 0.9397, test_loss: 1.3509, test_f1: 0.4629
 epoch: 97, train_loss: 0.9330, test_loss: 1.3707, test_f1: 0.4518
 epoch: 98, train_loss: 0.9351, test_loss: 1.4309, test_f1: 0.4298
 epoch: 99, train_loss: 0.9384, test_loss: 1.4199, test_f1: 0.4440
##################ITERATION #2 ****************************************
 epoch: 0, train_loss: 1.2938, test_loss: 1.3191, test_f1: 0.2281
 epoch: 1, train_loss: 1.2634, test_loss: 1.3172, test_f1: 0.2281
 epoch: 2, train_loss: 1.2527, test_loss: 1.3125, test_f1: 0.2281
 epoch: 3, train_loss: 1.2432, test_loss: 1.3082, test_f1: 0.2281
 epoch: 4, train_loss: 1.2350, test_loss: 1.3061, test_f1: 0.2429
 epoch: 5, train_loss: 1.2212, test_loss: 1.3020, test_f1: 0.2438
 epoch: 6, train_loss: 1.2093, test_loss: 1.2982, test_f1: 0.2404
 epoch: 7, train_loss: 1.2002, test_loss: 1.2933, test_f1: 0.2341
 epoch: 8, train_loss: 1.1941, test_loss: 1.2833, test_f1: 0.2600
 epoch: 9, train_loss: 1.1853, test_loss: 1.2627, test_f1: 0.2668
 epoch: 10, train_loss: 1.1762, test_loss: 1.2483, test_f1: 0.2955
 epoch: 11, train_loss: 1.1632, test_loss: 1.2397, test_f1: 0.3647
 epoch: 12, train_loss: 1.1520, test_loss: 1.2481, test_f1: 0.3804
 epoch: 13, train_loss: 1.1517, test_loss: 1.2543, test_f1: 0.3906
 epoch: 14, train_loss: 1.1539, test_loss: 1.2741, test_f1: 0.3753
 epoch: 15, train_loss: 1.1329, test_loss: 1.2635, test_f1: 0.3848
 epoch: 16, train_loss: 1.1423, test_loss: 1.2600, test_f1: 0.3965
 epoch: 17, train_loss: 1.1262, test_loss: 1.2655, test_f1: 0.3955
 epoch: 18, train_loss: 1.1270, test_loss: 1.2723, test_f1: 0.3671
 epoch: 19, train_loss: 1.1273, test_loss: 1.2709, test_f1: 0.3831
 epoch: 20, train_loss: 1.1137, test_loss: 1.2649, test_f1: 0.4096
 epoch: 21, train_loss: 1.1095, test_loss: 1.2607, test_f1: 0.3995
 epoch: 22, train_loss: 1.1102, test_loss: 1.2522, test_f1: 0.4047
 epoch: 23, train_loss: 1.1138, test_loss: 1.2199, test_f1: 0.4020
 epoch: 24, train_loss: 1.1155, test_loss: 1.2203, test_f1: 0.4022
 epoch: 25, train_loss: 1.1112, test_loss: 1.2433, test_f1: 0.4013
 epoch: 26, train_loss: 1.0975, test_loss: 1.2569, test_f1: 0.3754
 epoch: 27, train_loss: 1.1012, test_loss: 1.2551, test_f1: 0.4009
 epoch: 28, train_loss: 1.0871, test_loss: 1.2583, test_f1: 0.3920
 epoch: 29, train_loss: 1.0921, test_loss: 1.2671, test_f1: 0.3899
 epoch: 30, train_loss: 1.0856, test_loss: 1.2800, test_f1: 0.3613
 epoch: 31, train_loss: 1.0765, test_loss: 1.2927, test_f1: 0.3427
 epoch: 32, train_loss: 1.0759, test_loss: 1.2837, test_f1: 0.3729
 epoch: 33, train_loss: 1.0861, test_loss: 1.2726, test_f1: 0.3809
 epoch: 34, train_loss: 1.0759, test_loss: 1.2743, test_f1: 0.3816
 epoch: 35, train_loss: 1.0757, test_loss: 1.2726, test_f1: 0.3687
 epoch: 36, train_loss: 1.0678, test_loss: 1.3072, test_f1: 0.3847
 epoch: 37, train_loss: 1.0701, test_loss: 1.2975, test_f1: 0.3743
 epoch: 38, train_loss: 1.0586, test_loss: 1.2976, test_f1: 0.3880
 epoch: 39, train_loss: 1.0545, test_loss: 1.2964, test_f1: 0.3979
 epoch: 40, train_loss: 1.0474, test_loss: 1.3071, test_f1: 0.3933
 epoch: 41, train_loss: 1.0470, test_loss: 1.3174, test_f1: 0.3871
 epoch: 42, train_loss: 1.0514, test_loss: 1.3369, test_f1: 0.3757
 epoch: 43, train_loss: 1.0666, test_loss: 1.3409, test_f1: 0.3824
 epoch: 44, train_loss: 1.0491, test_loss: 1.3696, test_f1: 0.3619
 epoch: 45, train_loss: 1.0589, test_loss: 1.3863, test_f1: 0.3581
 epoch: 46, train_loss: 1.0457, test_loss: 1.3576, test_f1: 0.3860
 epoch: 47, train_loss: 1.0449, test_loss: 1.3442, test_f1: 0.4038
 epoch: 48, train_loss: 1.0265, test_loss: 1.3444, test_f1: 0.3914
 epoch: 49, train_loss: 1.0286, test_loss: 1.3413, test_f1: 0.4055
 epoch: 50, train_loss: 1.0244, test_loss: 1.2926, test_f1: 0.4289
 epoch: 51, train_loss: 1.0239, test_loss: 1.3320, test_f1: 0.4173
 epoch: 52, train_loss: 1.0186, test_loss: 1.3482, test_f1: 0.3875
 epoch: 53, train_loss: 1.0184, test_loss: 1.3443, test_f1: 0.3932
 epoch: 54, train_loss: 1.0129, test_loss: 1.3365, test_f1: 0.3893
 epoch: 55, train_loss: 1.0049, test_loss: 1.3295, test_f1: 0.3778
 epoch: 56, train_loss: 1.0110, test_loss: 1.3142, test_f1: 0.3832
 epoch: 57, train_loss: 1.0142, test_loss: 1.3130, test_f1: 0.3894
 epoch: 58, train_loss: 1.0151, test_loss: 1.3054, test_f1: 0.3913
 epoch: 59, train_loss: 1.0078, test_loss: 1.3115, test_f1: 0.3986
 epoch: 60, train_loss: 1.0079, test_loss: 1.3492, test_f1: 0.3970
 epoch: 61, train_loss: 0.9912, test_loss: 1.3929, test_f1: 0.3927
 epoch: 62, train_loss: 1.0051, test_loss: 1.3601, test_f1: 0.4047
 epoch: 63, train_loss: 0.9945, test_loss: 1.3400, test_f1: 0.4005
 epoch: 64, train_loss: 0.9961, test_loss: 1.3467, test_f1: 0.4035
 epoch: 65, train_loss: 1.0120, test_loss: 1.3521, test_f1: 0.4131
 epoch: 66, train_loss: 1.0005, test_loss: 1.3639, test_f1: 0.3980
 epoch: 67, train_loss: 0.9983, test_loss: 1.3554, test_f1: 0.3934
 epoch: 68, train_loss: 0.9894, test_loss: 1.3826, test_f1: 0.3656
 epoch: 69, train_loss: 1.0039, test_loss: 1.4503, test_f1: 0.3721
 epoch: 70, train_loss: 0.9946, test_loss: 1.3769, test_f1: 0.4005
 epoch: 71, train_loss: 0.9899, test_loss: 1.3608, test_f1: 0.4106
 epoch: 72, train_loss: 0.9861, test_loss: 1.3619, test_f1: 0.4203
 epoch: 73, train_loss: 0.9855, test_loss: 1.3700, test_f1: 0.4304
 epoch: 74, train_loss: 0.9863, test_loss: 1.3809, test_f1: 0.3960
 epoch: 75, train_loss: 0.9912, test_loss: 1.3383, test_f1: 0.4093
 epoch: 76, train_loss: 0.9941, test_loss: 1.3686, test_f1: 0.3615
 epoch: 77, train_loss: 0.9842, test_loss: 1.3808, test_f1: 0.3892
 epoch: 78, train_loss: 0.9926, test_loss: 1.3920, test_f1: 0.4136
 epoch: 79, train_loss: 0.9939, test_loss: 1.3862, test_f1: 0.4121
 epoch: 80, train_loss: 0.9837, test_loss: 1.3977, test_f1: 0.4170
 epoch: 81, train_loss: 0.9765, test_loss: 1.4163, test_f1: 0.4080
 epoch: 82, train_loss: 0.9821, test_loss: 1.4132, test_f1: 0.4066
 epoch: 83, train_loss: 0.9857, test_loss: 1.4166, test_f1: 0.3939
 epoch: 84, train_loss: 0.9852, test_loss: 1.4086, test_f1: 0.4115
 epoch: 85, train_loss: 0.9808, test_loss: 1.3612, test_f1: 0.4087
 epoch: 86, train_loss: 0.9802, test_loss: 1.3789, test_f1: 0.4143
 epoch: 87, train_loss: 0.9842, test_loss: 1.3793, test_f1: 0.4201
 epoch: 88, train_loss: 0.9757, test_loss: 1.4023, test_f1: 0.3723
 epoch: 89, train_loss: 0.9770, test_loss: 1.4080, test_f1: 0.3857
 epoch: 90, train_loss: 0.9765, test_loss: 1.4163, test_f1: 0.3926
 epoch: 91, train_loss: 0.9713, test_loss: 1.3532, test_f1: 0.3996
 epoch: 92, train_loss: 0.9700, test_loss: 1.3497, test_f1: 0.4017
 epoch: 93, train_loss: 0.9668, test_loss: 1.3899, test_f1: 0.4096
 epoch: 94, train_loss: 0.9699, test_loss: 1.4278, test_f1: 0.4132
 epoch: 95, train_loss: 0.9732, test_loss: 1.4264, test_f1: 0.4130
 epoch: 96, train_loss: 0.9766, test_loss: 1.4038, test_f1: 0.3962
 epoch: 97, train_loss: 0.9820, test_loss: 1.4046, test_f1: 0.4133
 epoch: 98, train_loss: 0.9625, test_loss: 1.3941, test_f1: 0.4096
 epoch: 99, train_loss: 0.9542, test_loss: 1.4092, test_f1: 0.4140
##################ITERATION #3 ****************************************
 epoch: 0, train_loss: 1.2855, test_loss: 1.3192, test_f1: 0.2281
 epoch: 1, train_loss: 1.2508, test_loss: 1.3146, test_f1: 0.2281
 epoch: 2, train_loss: 1.2284, test_loss: 1.3048, test_f1: 0.2281
 epoch: 3, train_loss: 1.2237, test_loss: 1.2911, test_f1: 0.2259
 epoch: 4, train_loss: 1.2081, test_loss: 1.2756, test_f1: 0.2395
 epoch: 5, train_loss: 1.1991, test_loss: 1.2674, test_f1: 0.2398
 epoch: 6, train_loss: 1.1963, test_loss: 1.2567, test_f1: 0.2401
 epoch: 7, train_loss: 1.1825, test_loss: 1.2473, test_f1: 0.2610
 epoch: 8, train_loss: 1.1764, test_loss: 1.2407, test_f1: 0.3016
 epoch: 9, train_loss: 1.1581, test_loss: 1.2323, test_f1: 0.3151
 epoch: 10, train_loss: 1.1573, test_loss: 1.2272, test_f1: 0.3269
 epoch: 11, train_loss: 1.1465, test_loss: 1.2195, test_f1: 0.3529
 epoch: 12, train_loss: 1.1506, test_loss: 1.2194, test_f1: 0.3655
 epoch: 13, train_loss: 1.1415, test_loss: 1.2198, test_f1: 0.3722
 epoch: 14, train_loss: 1.1435, test_loss: 1.2240, test_f1: 0.3961
 epoch: 15, train_loss: 1.1237, test_loss: 1.2259, test_f1: 0.3868
 epoch: 16, train_loss: 1.1202, test_loss: 1.2252, test_f1: 0.3803
 epoch: 17, train_loss: 1.1050, test_loss: 1.2098, test_f1: 0.3872
 epoch: 18, train_loss: 1.1058, test_loss: 1.2119, test_f1: 0.3913
 epoch: 19, train_loss: 1.1053, test_loss: 1.2224, test_f1: 0.3993
 epoch: 20, train_loss: 1.1017, test_loss: 1.2378, test_f1: 0.3894
 epoch: 21, train_loss: 1.1029, test_loss: 1.2457, test_f1: 0.3955
 epoch: 22, train_loss: 1.0922, test_loss: 1.2474, test_f1: 0.3976
 epoch: 23, train_loss: 1.1034, test_loss: 1.2220, test_f1: 0.4094
 epoch: 24, train_loss: 1.0900, test_loss: 1.2038, test_f1: 0.4104
 epoch: 25, train_loss: 1.0749, test_loss: 1.2039, test_f1: 0.4273
 epoch: 26, train_loss: 1.0783, test_loss: 1.2101, test_f1: 0.4283
 epoch: 27, train_loss: 1.0771, test_loss: 1.2065, test_f1: 0.4297
 epoch: 28, train_loss: 1.0614, test_loss: 1.2097, test_f1: 0.4198
 epoch: 29, train_loss: 1.0740, test_loss: 1.2007, test_f1: 0.4196
 epoch: 30, train_loss: 1.0625, test_loss: 1.2006, test_f1: 0.4223
 epoch: 31, train_loss: 1.0703, test_loss: 1.2017, test_f1: 0.4239
 epoch: 32, train_loss: 1.0580, test_loss: 1.2075, test_f1: 0.4291
 epoch: 33, train_loss: 1.0543, test_loss: 1.2039, test_f1: 0.4274
 epoch: 34, train_loss: 1.0483, test_loss: 1.1971, test_f1: 0.4320
 epoch: 35, train_loss: 1.0444, test_loss: 1.1925, test_f1: 0.4372
 epoch: 36, train_loss: 1.0414, test_loss: 1.1868, test_f1: 0.4425
 epoch: 37, train_loss: 1.0387, test_loss: 1.1855, test_f1: 0.4329
 epoch: 38, train_loss: 1.0441, test_loss: 1.2017, test_f1: 0.4399
 epoch: 39, train_loss: 1.0324, test_loss: 1.2138, test_f1: 0.4463
 epoch: 40, train_loss: 1.0442, test_loss: 1.2093, test_f1: 0.4429
 epoch: 41, train_loss: 1.0311, test_loss: 1.2012, test_f1: 0.4474
 epoch: 42, train_loss: 1.0243, test_loss: 1.1961, test_f1: 0.4449
 epoch: 43, train_loss: 1.0184, test_loss: 1.1958, test_f1: 0.4235
 epoch: 44, train_loss: 1.0169, test_loss: 1.1983, test_f1: 0.4271
 epoch: 45, train_loss: 1.0156, test_loss: 1.2007, test_f1: 0.4393
 epoch: 46, train_loss: 1.0171, test_loss: 1.1877, test_f1: 0.4403
 epoch: 47, train_loss: 1.0166, test_loss: 1.2014, test_f1: 0.4586
 epoch: 48, train_loss: 1.0237, test_loss: 1.2169, test_f1: 0.4556
 epoch: 49, train_loss: 1.0216, test_loss: 1.2173, test_f1: 0.4320
 epoch: 50, train_loss: 0.9951, test_loss: 1.2088, test_f1: 0.4461
 epoch: 51, train_loss: 1.0029, test_loss: 1.2094, test_f1: 0.4483
 epoch: 52, train_loss: 1.0126, test_loss: 1.2210, test_f1: 0.4491
 epoch: 53, train_loss: 0.9999, test_loss: 1.2068, test_f1: 0.4388
 epoch: 54, train_loss: 1.0066, test_loss: 1.2058, test_f1: 0.4615
 epoch: 55, train_loss: 1.0008, test_loss: 1.2193, test_f1: 0.4545
 epoch: 56, train_loss: 0.9949, test_loss: 1.2296, test_f1: 0.4693
 epoch: 57, train_loss: 0.9933, test_loss: 1.2437, test_f1: 0.4672
 epoch: 58, train_loss: 0.9840, test_loss: 1.2347, test_f1: 0.4744
 epoch: 59, train_loss: 0.9939, test_loss: 1.2400, test_f1: 0.4692
 epoch: 60, train_loss: 0.9932, test_loss: 1.2344, test_f1: 0.4617
 epoch: 61, train_loss: 0.9840, test_loss: 1.2467, test_f1: 0.4519
 epoch: 62, train_loss: 0.9870, test_loss: 1.2582, test_f1: 0.4567
 epoch: 63, train_loss: 0.9927, test_loss: 1.2697, test_f1: 0.4567
 epoch: 64, train_loss: 0.9823, test_loss: 1.2719, test_f1: 0.4608
 epoch: 65, train_loss: 0.9838, test_loss: 1.2704, test_f1: 0.4566
 epoch: 66, train_loss: 0.9918, test_loss: 1.2586, test_f1: 0.4620
 epoch: 67, train_loss: 0.9816, test_loss: 1.2571, test_f1: 0.4683
 epoch: 68, train_loss: 0.9650, test_loss: 1.2446, test_f1: 0.4792
 epoch: 69, train_loss: 0.9835, test_loss: 1.2318, test_f1: 0.4759
 epoch: 70, train_loss: 0.9831, test_loss: 1.2375, test_f1: 0.4649
 epoch: 71, train_loss: 0.9811, test_loss: 1.2347, test_f1: 0.4745
 epoch: 72, train_loss: 0.9800, test_loss: 1.2559, test_f1: 0.4898
 epoch: 73, train_loss: 0.9659, test_loss: 1.2527, test_f1: 0.4874
 epoch: 74, train_loss: 0.9884, test_loss: 1.2530, test_f1: 0.4976
 epoch: 75, train_loss: 0.9766, test_loss: 1.2602, test_f1: 0.4988
 epoch: 76, train_loss: 0.9700, test_loss: 1.2688, test_f1: 0.4962
 epoch: 77, train_loss: 0.9651, test_loss: 1.2725, test_f1: 0.4929
 epoch: 78, train_loss: 0.9658, test_loss: 1.2681, test_f1: 0.4928
 epoch: 79, train_loss: 0.9775, test_loss: 1.2656, test_f1: 0.4899
 epoch: 80, train_loss: 0.9782, test_loss: 1.2534, test_f1: 0.4848
 epoch: 81, train_loss: 0.9699, test_loss: 1.2617, test_f1: 0.4775
 epoch: 82, train_loss: 0.9577, test_loss: 1.2756, test_f1: 0.4749
 epoch: 83, train_loss: 0.9579, test_loss: 1.2499, test_f1: 0.4953
 epoch: 84, train_loss: 0.9570, test_loss: 1.2375, test_f1: 0.4955
 epoch: 85, train_loss: 0.9764, test_loss: 1.2475, test_f1: 0.4946
 epoch: 86, train_loss: 0.9506, test_loss: 1.2568, test_f1: 0.4997
 epoch: 87, train_loss: 0.9612, test_loss: 1.2752, test_f1: 0.4894
 epoch: 88, train_loss: 0.9598, test_loss: 1.2764, test_f1: 0.4966
 epoch: 89, train_loss: 0.9596, test_loss: 1.2765, test_f1: 0.4992
 epoch: 90, train_loss: 0.9536, test_loss: 1.2983, test_f1: 0.4877
 epoch: 91, train_loss: 0.9609, test_loss: 1.2831, test_f1: 0.4833
 epoch: 92, train_loss: 0.9596, test_loss: 1.2956, test_f1: 0.5045
 epoch: 93, train_loss: 0.9578, test_loss: 1.2892, test_f1: 0.4932
 epoch: 94, train_loss: 0.9473, test_loss: 1.2710, test_f1: 0.5039
 epoch: 95, train_loss: 0.9381, test_loss: 1.2637, test_f1: 0.4978
 epoch: 96, train_loss: 0.9411, test_loss: 1.2668, test_f1: 0.4963
 epoch: 97, train_loss: 0.9475, test_loss: 1.2599, test_f1: 0.5132
 epoch: 98, train_loss: 0.9465, test_loss: 1.2565, test_f1: 0.5155
 epoch: 99, train_loss: 0.9425, test_loss: 1.2560, test_f1: 0.5034
##################ITERATION #4 ****************************************
 epoch: 0, train_loss: 1.3224, test_loss: 1.3786, test_f1: 0.2281
 epoch: 1, train_loss: 1.2703, test_loss: 1.3668, test_f1: 0.2281
 epoch: 2, train_loss: 1.2531, test_loss: 1.3443, test_f1: 0.2281
 epoch: 3, train_loss: 1.2348, test_loss: 1.3223, test_f1: 0.2281
 epoch: 4, train_loss: 1.2272, test_loss: 1.3004, test_f1: 0.2416
 epoch: 5, train_loss: 1.2195, test_loss: 1.2877, test_f1: 0.2555
 epoch: 6, train_loss: 1.2072, test_loss: 1.2858, test_f1: 0.2501
 epoch: 7, train_loss: 1.2044, test_loss: 1.2818, test_f1: 0.2600
 epoch: 8, train_loss: 1.1906, test_loss: 1.2721, test_f1: 0.2585
 epoch: 9, train_loss: 1.2006, test_loss: 1.2643, test_f1: 0.2698
 epoch: 10, train_loss: 1.1821, test_loss: 1.2572, test_f1: 0.3109
 epoch: 11, train_loss: 1.1680, test_loss: 1.2475, test_f1: 0.3907
 epoch: 12, train_loss: 1.1616, test_loss: 1.2444, test_f1: 0.3955
 epoch: 13, train_loss: 1.1599, test_loss: 1.2360, test_f1: 0.4111
 epoch: 14, train_loss: 1.1694, test_loss: 1.2312, test_f1: 0.4098
 epoch: 15, train_loss: 1.1577, test_loss: 1.2394, test_f1: 0.4128
 epoch: 16, train_loss: 1.1421, test_loss: 1.2463, test_f1: 0.3884
 epoch: 17, train_loss: 1.1382, test_loss: 1.2452, test_f1: 0.3971
 epoch: 18, train_loss: 1.1293, test_loss: 1.2319, test_f1: 0.4235
 epoch: 19, train_loss: 1.1315, test_loss: 1.2183, test_f1: 0.4353
 epoch: 20, train_loss: 1.1213, test_loss: 1.2176, test_f1: 0.4214
 epoch: 21, train_loss: 1.1252, test_loss: 1.2196, test_f1: 0.4147
 epoch: 22, train_loss: 1.1142, test_loss: 1.2258, test_f1: 0.4047
 epoch: 23, train_loss: 1.1086, test_loss: 1.2271, test_f1: 0.4021
 epoch: 24, train_loss: 1.1053, test_loss: 1.2353, test_f1: 0.4102
 epoch: 25, train_loss: 1.0821, test_loss: 1.2385, test_f1: 0.4223
 epoch: 26, train_loss: 1.0945, test_loss: 1.2348, test_f1: 0.4122
 epoch: 27, train_loss: 1.0931, test_loss: 1.2351, test_f1: 0.4142
 epoch: 28, train_loss: 1.0848, test_loss: 1.2374, test_f1: 0.4355
 epoch: 29, train_loss: 1.0796, test_loss: 1.2369, test_f1: 0.4299
 epoch: 30, train_loss: 1.0708, test_loss: 1.2295, test_f1: 0.4115
 epoch: 31, train_loss: 1.0803, test_loss: 1.2398, test_f1: 0.4156
 epoch: 32, train_loss: 1.0781, test_loss: 1.2607, test_f1: 0.3784
 epoch: 33, train_loss: 1.0685, test_loss: 1.2550, test_f1: 0.3957
 epoch: 34, train_loss: 1.0503, test_loss: 1.2607, test_f1: 0.4486
 epoch: 35, train_loss: 1.0681, test_loss: 1.2437, test_f1: 0.4467
 epoch: 36, train_loss: 1.0626, test_loss: 1.2260, test_f1: 0.4614
 epoch: 37, train_loss: 1.0604, test_loss: 1.2289, test_f1: 0.4099
 epoch: 38, train_loss: 1.0388, test_loss: 1.2279, test_f1: 0.4053
 epoch: 39, train_loss: 1.0398, test_loss: 1.2460, test_f1: 0.4187
 epoch: 40, train_loss: 1.0329, test_loss: 1.2398, test_f1: 0.4157
 epoch: 41, train_loss: 1.0385, test_loss: 1.2432, test_f1: 0.4149
 epoch: 42, train_loss: 1.0266, test_loss: 1.2528, test_f1: 0.4343
 epoch: 43, train_loss: 1.0317, test_loss: 1.2350, test_f1: 0.4017
 epoch: 44, train_loss: 1.0183, test_loss: 1.2311, test_f1: 0.4095
 epoch: 45, train_loss: 1.0209, test_loss: 1.2452, test_f1: 0.3784
 epoch: 46, train_loss: 1.0081, test_loss: 1.2502, test_f1: 0.3922
 epoch: 47, train_loss: 1.0070, test_loss: 1.2539, test_f1: 0.3932
 epoch: 48, train_loss: 1.0176, test_loss: 1.2442, test_f1: 0.3973
 epoch: 49, train_loss: 1.0100, test_loss: 1.2429, test_f1: 0.4214
 epoch: 50, train_loss: 1.0111, test_loss: 1.2372, test_f1: 0.4182
 epoch: 51, train_loss: 1.0094, test_loss: 1.2397, test_f1: 0.4253
 epoch: 52, train_loss: 0.9966, test_loss: 1.2513, test_f1: 0.4385
 epoch: 53, train_loss: 1.0055, test_loss: 1.2387, test_f1: 0.4320
 epoch: 54, train_loss: 0.9969, test_loss: 1.2452, test_f1: 0.4304
 epoch: 55, train_loss: 0.9920, test_loss: 1.2392, test_f1: 0.4322
 epoch: 56, train_loss: 0.9978, test_loss: 1.2367, test_f1: 0.4210
 epoch: 57, train_loss: 0.9947, test_loss: 1.2376, test_f1: 0.4291
 epoch: 58, train_loss: 0.9814, test_loss: 1.2397, test_f1: 0.4396
 epoch: 59, train_loss: 0.9839, test_loss: 1.2406, test_f1: 0.4242
 epoch: 60, train_loss: 0.9786, test_loss: 1.2628, test_f1: 0.4369
 epoch: 61, train_loss: 0.9843, test_loss: 1.2497, test_f1: 0.4527
 epoch: 62, train_loss: 0.9755, test_loss: 1.2465, test_f1: 0.4299
 epoch: 63, train_loss: 0.9805, test_loss: 1.2676, test_f1: 0.4248
 epoch: 64, train_loss: 0.9868, test_loss: 1.2635, test_f1: 0.4112
 epoch: 65, train_loss: 0.9810, test_loss: 1.2593, test_f1: 0.4241
 epoch: 66, train_loss: 0.9683, test_loss: 1.2715, test_f1: 0.4250
 epoch: 67, train_loss: 0.9659, test_loss: 1.2668, test_f1: 0.4149
 epoch: 68, train_loss: 0.9723, test_loss: 1.2782, test_f1: 0.4028
 epoch: 69, train_loss: 0.9685, test_loss: 1.2764, test_f1: 0.4256
 epoch: 70, train_loss: 0.9737, test_loss: 1.2577, test_f1: 0.4144
 epoch: 71, train_loss: 0.9594, test_loss: 1.2561, test_f1: 0.4021
 epoch: 72, train_loss: 0.9681, test_loss: 1.2749, test_f1: 0.4470
 epoch: 73, train_loss: 0.9585, test_loss: 1.2740, test_f1: 0.4333
 epoch: 74, train_loss: 0.9690, test_loss: 1.2871, test_f1: 0.4669
 epoch: 75, train_loss: 0.9673, test_loss: 1.2656, test_f1: 0.4553
 epoch: 76, train_loss: 0.9719, test_loss: 1.2540, test_f1: 0.4559
 epoch: 77, train_loss: 0.9653, test_loss: 1.2524, test_f1: 0.4314
 epoch: 78, train_loss: 0.9557, test_loss: 1.2390, test_f1: 0.4410
 epoch: 79, train_loss: 0.9629, test_loss: 1.2529, test_f1: 0.4514
 epoch: 80, train_loss: 0.9650, test_loss: 1.2528, test_f1: 0.4632
 epoch: 81, train_loss: 0.9640, test_loss: 1.2648, test_f1: 0.4494
 epoch: 82, train_loss: 0.9650, test_loss: 1.2449, test_f1: 0.4399
 epoch: 83, train_loss: 0.9617, test_loss: 1.2305, test_f1: 0.4690
 epoch: 84, train_loss: 0.9612, test_loss: 1.2562, test_f1: 0.4447
 epoch: 85, train_loss: 0.9553, test_loss: 1.2642, test_f1: 0.4176
 epoch: 86, train_loss: 0.9450, test_loss: 1.2795, test_f1: 0.4249
 epoch: 87, train_loss: 0.9445, test_loss: 1.2734, test_f1: 0.4405
 epoch: 88, train_loss: 0.9407, test_loss: 1.2672, test_f1: 0.4617
 epoch: 89, train_loss: 0.9453, test_loss: 1.2516, test_f1: 0.4712
 epoch: 90, train_loss: 0.9437, test_loss: 1.2494, test_f1: 0.4562
 epoch: 91, train_loss: 0.9492, test_loss: 1.2503, test_f1: 0.4678
 epoch: 92, train_loss: 0.9459, test_loss: 1.2511, test_f1: 0.4608
 epoch: 93, train_loss: 0.9443, test_loss: 1.2484, test_f1: 0.4686
 epoch: 94, train_loss: 0.9405, test_loss: 1.2634, test_f1: 0.4636
 epoch: 95, train_loss: 0.9387, test_loss: 1.2713, test_f1: 0.4711
 epoch: 96, train_loss: 0.9349, test_loss: 1.2781, test_f1: 0.4623
 epoch: 97, train_loss: 0.9342, test_loss: 1.2960, test_f1: 0.4405
 epoch: 98, train_loss: 0.9256, test_loss: 1.2966, test_f1: 0.4447
 epoch: 99, train_loss: 0.9431, test_loss: 1.2955, test_f1: 0.4591
##################ITERATION #5 ****************************************
 epoch: 0, train_loss: 1.2930, test_loss: 1.3474, test_f1: 0.2387
 epoch: 1, train_loss: 1.2589, test_loss: 1.3391, test_f1: 0.2404
 epoch: 2, train_loss: 1.2471, test_loss: 1.3330, test_f1: 0.2404
 epoch: 3, train_loss: 1.2414, test_loss: 1.3370, test_f1: 0.2404
 epoch: 4, train_loss: 1.2368, test_loss: 1.3313, test_f1: 0.2404
 epoch: 5, train_loss: 1.2309, test_loss: 1.3257, test_f1: 0.2404
 epoch: 6, train_loss: 1.2293, test_loss: 1.3205, test_f1: 0.2404
 epoch: 7, train_loss: 1.2215, test_loss: 1.3164, test_f1: 0.2404
 epoch: 8, train_loss: 1.2020, test_loss: 1.3168, test_f1: 0.2404
 epoch: 9, train_loss: 1.2043, test_loss: 1.3189, test_f1: 0.2391
 epoch: 10, train_loss: 1.2029, test_loss: 1.3020, test_f1: 0.2505
 epoch: 11, train_loss: 1.2065, test_loss: 1.3022, test_f1: 0.2544
 epoch: 12, train_loss: 1.1956, test_loss: 1.3038, test_f1: 0.2650
 epoch: 13, train_loss: 1.1913, test_loss: 1.3005, test_f1: 0.2740
 epoch: 14, train_loss: 1.1963, test_loss: 1.3030, test_f1: 0.2813
 epoch: 15, train_loss: 1.1872, test_loss: 1.3059, test_f1: 0.2863
 epoch: 16, train_loss: 1.1862, test_loss: 1.3020, test_f1: 0.2822
 epoch: 17, train_loss: 1.1737, test_loss: 1.2937, test_f1: 0.3039
 epoch: 18, train_loss: 1.1766, test_loss: 1.3002, test_f1: 0.3091
 epoch: 19, train_loss: 1.1678, test_loss: 1.3041, test_f1: 0.3007
 epoch: 20, train_loss: 1.1704, test_loss: 1.3101, test_f1: 0.2976
 epoch: 21, train_loss: 1.1673, test_loss: 1.3073, test_f1: 0.2947
 epoch: 22, train_loss: 1.1582, test_loss: 1.3091, test_f1: 0.2998
 epoch: 23, train_loss: 1.1559, test_loss: 1.3034, test_f1: 0.2923
 epoch: 24, train_loss: 1.1495, test_loss: 1.2981, test_f1: 0.3025
 epoch: 25, train_loss: 1.1579, test_loss: 1.3004, test_f1: 0.3319
 epoch: 26, train_loss: 1.1395, test_loss: 1.2847, test_f1: 0.3407
 epoch: 27, train_loss: 1.1362, test_loss: 1.2814, test_f1: 0.3823
 epoch: 28, train_loss: 1.1285, test_loss: 1.2704, test_f1: 0.3967
 epoch: 29, train_loss: 1.1351, test_loss: 1.2661, test_f1: 0.4187
 epoch: 30, train_loss: 1.1255, test_loss: 1.2612, test_f1: 0.4130
 epoch: 31, train_loss: 1.1205, test_loss: 1.2576, test_f1: 0.4049
 epoch: 32, train_loss: 1.1257, test_loss: 1.2682, test_f1: 0.4083
 epoch: 33, train_loss: 1.1099, test_loss: 1.2701, test_f1: 0.3811
 epoch: 34, train_loss: 1.1124, test_loss: 1.2588, test_f1: 0.3812
 epoch: 35, train_loss: 1.1057, test_loss: 1.2583, test_f1: 0.3977
 epoch: 36, train_loss: 1.1029, test_loss: 1.2536, test_f1: 0.4026
 epoch: 37, train_loss: 1.1112, test_loss: 1.2532, test_f1: 0.4012
 epoch: 38, train_loss: 1.1108, test_loss: 1.2459, test_f1: 0.4214
 epoch: 39, train_loss: 1.0998, test_loss: 1.2431, test_f1: 0.4340
 epoch: 40, train_loss: 1.0906, test_loss: 1.2408, test_f1: 0.4404
 epoch: 41, train_loss: 1.0874, test_loss: 1.2304, test_f1: 0.4382
 epoch: 42, train_loss: 1.0835, test_loss: 1.2298, test_f1: 0.4400
 epoch: 43, train_loss: 1.0813, test_loss: 1.2427, test_f1: 0.4383
 epoch: 44, train_loss: 1.0822, test_loss: 1.2506, test_f1: 0.4468
 epoch: 45, train_loss: 1.0688, test_loss: 1.2581, test_f1: 0.4510
 epoch: 46, train_loss: 1.0633, test_loss: 1.2565, test_f1: 0.4553
 epoch: 47, train_loss: 1.0556, test_loss: 1.2485, test_f1: 0.4591
 epoch: 48, train_loss: 1.0629, test_loss: 1.2547, test_f1: 0.4569
 epoch: 49, train_loss: 1.0575, test_loss: 1.2512, test_f1: 0.4572
 epoch: 50, train_loss: 1.0536, test_loss: 1.2510, test_f1: 0.4412
 epoch: 51, train_loss: 1.0420, test_loss: 1.2623, test_f1: 0.4437
 epoch: 52, train_loss: 1.0473, test_loss: 1.2466, test_f1: 0.4474
 epoch: 53, train_loss: 1.0368, test_loss: 1.2514, test_f1: 0.4511
 epoch: 54, train_loss: 1.0467, test_loss: 1.2539, test_f1: 0.4406
 epoch: 55, train_loss: 1.0423, test_loss: 1.2592, test_f1: 0.4450
 epoch: 56, train_loss: 1.0353, test_loss: 1.2592, test_f1: 0.4519
 epoch: 57, train_loss: 1.0348, test_loss: 1.2559, test_f1: 0.4605
 epoch: 58, train_loss: 1.0260, test_loss: 1.2610, test_f1: 0.4606
 epoch: 59, train_loss: 1.0342, test_loss: 1.2658, test_f1: 0.4524
 epoch: 60, train_loss: 1.0208, test_loss: 1.2582, test_f1: 0.4581
 epoch: 61, train_loss: 1.0207, test_loss: 1.2516, test_f1: 0.4586
 epoch: 62, train_loss: 1.0243, test_loss: 1.2556, test_f1: 0.4527
 epoch: 63, train_loss: 1.0250, test_loss: 1.2464, test_f1: 0.4505
 epoch: 64, train_loss: 1.0134, test_loss: 1.2532, test_f1: 0.4478
 epoch: 65, train_loss: 1.0230, test_loss: 1.2632, test_f1: 0.4401
 epoch: 66, train_loss: 1.0110, test_loss: 1.2592, test_f1: 0.4430
 epoch: 67, train_loss: 1.0066, test_loss: 1.2609, test_f1: 0.4433
 epoch: 68, train_loss: 1.0152, test_loss: 1.2564, test_f1: 0.4454
 epoch: 69, train_loss: 1.0139, test_loss: 1.2593, test_f1: 0.4547
 epoch: 70, train_loss: 1.0066, test_loss: 1.2389, test_f1: 0.4540
 epoch: 71, train_loss: 1.0081, test_loss: 1.2327, test_f1: 0.4583
 epoch: 72, train_loss: 1.0147, test_loss: 1.2352, test_f1: 0.4583
 epoch: 73, train_loss: 1.0086, test_loss: 1.2396, test_f1: 0.4467
 epoch: 74, train_loss: 1.0070, test_loss: 1.2375, test_f1: 0.4503
 epoch: 75, train_loss: 1.0071, test_loss: 1.2353, test_f1: 0.4548
 epoch: 76, train_loss: 1.0029, test_loss: 1.2352, test_f1: 0.4566
 epoch: 77, train_loss: 1.0008, test_loss: 1.2460, test_f1: 0.4528
 epoch: 78, train_loss: 0.9963, test_loss: 1.2461, test_f1: 0.4478
 epoch: 79, train_loss: 1.0005, test_loss: 1.2460, test_f1: 0.4429
 epoch: 80, train_loss: 0.9960, test_loss: 1.2551, test_f1: 0.4403
 epoch: 81, train_loss: 1.0069, test_loss: 1.2610, test_f1: 0.4413
 epoch: 82, train_loss: 0.9935, test_loss: 1.2617, test_f1: 0.4348
 epoch: 83, train_loss: 0.9963, test_loss: 1.2553, test_f1: 0.4476
 epoch: 84, train_loss: 0.9813, test_loss: 1.2477, test_f1: 0.4612
 epoch: 85, train_loss: 0.9942, test_loss: 1.2504, test_f1: 0.4564
 epoch: 86, train_loss: 0.9736, test_loss: 1.2504, test_f1: 0.4440
 epoch: 87, train_loss: 0.9770, test_loss: 1.2494, test_f1: 0.4460
 epoch: 88, train_loss: 0.9789, test_loss: 1.2527, test_f1: 0.4481
 epoch: 89, train_loss: 0.9832, test_loss: 1.2525, test_f1: 0.4543
 epoch: 90, train_loss: 0.9832, test_loss: 1.2460, test_f1: 0.4493
 epoch: 91, train_loss: 0.9752, test_loss: 1.2588, test_f1: 0.4568
 epoch: 92, train_loss: 0.9879, test_loss: 1.2613, test_f1: 0.4411
 epoch: 93, train_loss: 0.9687, test_loss: 1.2629, test_f1: 0.4504
 epoch: 94, train_loss: 0.9656, test_loss: 1.2537, test_f1: 0.4543
 epoch: 95, train_loss: 0.9784, test_loss: 1.2448, test_f1: 0.4517
 epoch: 96, train_loss: 0.9667, test_loss: 1.2349, test_f1: 0.4556
 epoch: 97, train_loss: 0.9709, test_loss: 1.2268, test_f1: 0.4598
 epoch: 98, train_loss: 0.9747, test_loss: 1.2459, test_f1: 0.4571
 epoch: 99, train_loss: 0.9671, test_loss: 1.2504, test_f1: 0.4645
##################ITERATION #6 ****************************************
 epoch: 0, train_loss: 1.2937, test_loss: 1.3453, test_f1: 0.2281
 epoch: 1, train_loss: 1.2556, test_loss: 1.3356, test_f1: 0.2281
 epoch: 2, train_loss: 1.2416, test_loss: 1.3277, test_f1: 0.2281
 epoch: 3, train_loss: 1.2539, test_loss: 1.3175, test_f1: 0.2281
 epoch: 4, train_loss: 1.2211, test_loss: 1.3099, test_f1: 0.2281
 epoch: 5, train_loss: 1.2082, test_loss: 1.3023, test_f1: 0.2281
 epoch: 6, train_loss: 1.1971, test_loss: 1.2910, test_f1: 0.2314
 epoch: 7, train_loss: 1.2117, test_loss: 1.2760, test_f1: 0.2549
 epoch: 8, train_loss: 1.1966, test_loss: 1.2632, test_f1: 0.2976
 epoch: 9, train_loss: 1.1962, test_loss: 1.2501, test_f1: 0.3319
 epoch: 10, train_loss: 1.1887, test_loss: 1.2434, test_f1: 0.3463
 epoch: 11, train_loss: 1.1821, test_loss: 1.2317, test_f1: 0.3449
 epoch: 12, train_loss: 1.1625, test_loss: 1.2237, test_f1: 0.3781
 epoch: 13, train_loss: 1.1564, test_loss: 1.2146, test_f1: 0.3914
 epoch: 14, train_loss: 1.1471, test_loss: 1.2129, test_f1: 0.4003
 epoch: 15, train_loss: 1.1530, test_loss: 1.2095, test_f1: 0.4026
 epoch: 16, train_loss: 1.1567, test_loss: 1.2091, test_f1: 0.3929
 epoch: 17, train_loss: 1.1491, test_loss: 1.2062, test_f1: 0.4235
 epoch: 18, train_loss: 1.1423, test_loss: 1.2009, test_f1: 0.4383
 epoch: 19, train_loss: 1.1317, test_loss: 1.1916, test_f1: 0.4362
 epoch: 20, train_loss: 1.1190, test_loss: 1.1831, test_f1: 0.4580
 epoch: 21, train_loss: 1.1148, test_loss: 1.1798, test_f1: 0.4495
 epoch: 22, train_loss: 1.1045, test_loss: 1.1735, test_f1: 0.4520
 epoch: 23, train_loss: 1.1107, test_loss: 1.1761, test_f1: 0.4516
 epoch: 24, train_loss: 1.0950, test_loss: 1.1759, test_f1: 0.4482
 epoch: 25, train_loss: 1.0999, test_loss: 1.1784, test_f1: 0.4513
 epoch: 26, train_loss: 1.0963, test_loss: 1.1870, test_f1: 0.4646
 epoch: 27, train_loss: 1.0996, test_loss: 1.1789, test_f1: 0.4475
 epoch: 28, train_loss: 1.0898, test_loss: 1.1742, test_f1: 0.4520
 epoch: 29, train_loss: 1.0800, test_loss: 1.1740, test_f1: 0.4415
 epoch: 30, train_loss: 1.0738, test_loss: 1.1735, test_f1: 0.4372
 epoch: 31, train_loss: 1.0814, test_loss: 1.1743, test_f1: 0.4509
 epoch: 32, train_loss: 1.0683, test_loss: 1.1606, test_f1: 0.4533
 epoch: 33, train_loss: 1.0677, test_loss: 1.1692, test_f1: 0.4463
 epoch: 34, train_loss: 1.0834, test_loss: 1.1707, test_f1: 0.4490
 epoch: 35, train_loss: 1.0772, test_loss: 1.1709, test_f1: 0.4463
 epoch: 36, train_loss: 1.0756, test_loss: 1.1613, test_f1: 0.4436
 epoch: 37, train_loss: 1.0679, test_loss: 1.1848, test_f1: 0.4326
 epoch: 38, train_loss: 1.0712, test_loss: 1.2032, test_f1: 0.4347
 epoch: 39, train_loss: 1.0528, test_loss: 1.1593, test_f1: 0.4408
 epoch: 40, train_loss: 1.0446, test_loss: 1.1676, test_f1: 0.4277
 epoch: 41, train_loss: 1.0612, test_loss: 1.1696, test_f1: 0.4436
 epoch: 42, train_loss: 1.0629, test_loss: 1.1750, test_f1: 0.4290
 epoch: 43, train_loss: 1.0502, test_loss: 1.1694, test_f1: 0.4212
 epoch: 44, train_loss: 1.0328, test_loss: 1.1613, test_f1: 0.4351
 epoch: 45, train_loss: 1.0359, test_loss: 1.1798, test_f1: 0.4422
 epoch: 46, train_loss: 1.0291, test_loss: 1.2335, test_f1: 0.4409
 epoch: 47, train_loss: 1.0278, test_loss: 1.1973, test_f1: 0.4462
 epoch: 48, train_loss: 1.0176, test_loss: 1.2061, test_f1: 0.4617
 epoch: 49, train_loss: 1.0231, test_loss: 1.1996, test_f1: 0.4652
 epoch: 50, train_loss: 1.0430, test_loss: 1.1665, test_f1: 0.4761
 epoch: 51, train_loss: 1.0160, test_loss: 1.1632, test_f1: 0.4738
 epoch: 52, train_loss: 1.0103, test_loss: 1.1663, test_f1: 0.4614
 epoch: 53, train_loss: 1.0147, test_loss: 1.1699, test_f1: 0.4681
 epoch: 54, train_loss: 1.0084, test_loss: 1.1887, test_f1: 0.4575
 epoch: 55, train_loss: 1.0133, test_loss: 1.1787, test_f1: 0.4600
 epoch: 56, train_loss: 1.0101, test_loss: 1.1718, test_f1: 0.4732
 epoch: 57, train_loss: 1.0205, test_loss: 1.1656, test_f1: 0.4611
 epoch: 58, train_loss: 1.0137, test_loss: 1.1639, test_f1: 0.4602
 epoch: 59, train_loss: 1.0071, test_loss: 1.1638, test_f1: 0.4550
 epoch: 60, train_loss: 1.0025, test_loss: 1.1694, test_f1: 0.4621
 epoch: 61, train_loss: 1.0094, test_loss: 1.1592, test_f1: 0.4594
 epoch: 62, train_loss: 1.0025, test_loss: 1.1618, test_f1: 0.4647
 epoch: 63, train_loss: 1.0065, test_loss: 1.1633, test_f1: 0.4557
 epoch: 64, train_loss: 1.0019, test_loss: 1.1569, test_f1: 0.4507
 epoch: 65, train_loss: 1.0040, test_loss: 1.1516, test_f1: 0.4541
 epoch: 66, train_loss: 0.9996, test_loss: 1.1536, test_f1: 0.4763
 epoch: 67, train_loss: 0.9987, test_loss: 1.1635, test_f1: 0.4721
 epoch: 68, train_loss: 1.0051, test_loss: 1.1648, test_f1: 0.4799
 epoch: 69, train_loss: 1.0047, test_loss: 1.1564, test_f1: 0.4828
 epoch: 70, train_loss: 0.9894, test_loss: 1.1568, test_f1: 0.4785
 epoch: 71, train_loss: 0.9977, test_loss: 1.1532, test_f1: 0.4692
 epoch: 72, train_loss: 0.9923, test_loss: 1.1538, test_f1: 0.4631
 epoch: 73, train_loss: 0.9866, test_loss: 1.1565, test_f1: 0.4642
 epoch: 74, train_loss: 0.9851, test_loss: 1.1608, test_f1: 0.4629
 epoch: 75, train_loss: 0.9882, test_loss: 1.1565, test_f1: 0.4551
 epoch: 76, train_loss: 0.9888, test_loss: 1.1534, test_f1: 0.4672
 epoch: 77, train_loss: 0.9816, test_loss: 1.1594, test_f1: 0.4723
 epoch: 78, train_loss: 0.9953, test_loss: 1.1560, test_f1: 0.4611
 epoch: 79, train_loss: 0.9785, test_loss: 1.1538, test_f1: 0.4752
 epoch: 80, train_loss: 0.9739, test_loss: 1.1496, test_f1: 0.4759
 epoch: 81, train_loss: 0.9876, test_loss: 1.1481, test_f1: 0.4682
 epoch: 82, train_loss: 0.9621, test_loss: 1.1527, test_f1: 0.4805
 epoch: 83, train_loss: 0.9748, test_loss: 1.1613, test_f1: 0.4772
 epoch: 84, train_loss: 0.9716, test_loss: 1.1590, test_f1: 0.4711
 epoch: 85, train_loss: 0.9727, test_loss: 1.1641, test_f1: 0.4622
 epoch: 86, train_loss: 0.9492, test_loss: 1.1629, test_f1: 0.4610
 epoch: 87, train_loss: 0.9766, test_loss: 1.1639, test_f1: 0.4611
 epoch: 88, train_loss: 0.9654, test_loss: 1.1672, test_f1: 0.4681
 epoch: 89, train_loss: 0.9749, test_loss: 1.1639, test_f1: 0.4696
 epoch: 90, train_loss: 0.9693, test_loss: 1.1548, test_f1: 0.4502
 epoch: 91, train_loss: 0.9653, test_loss: 1.1543, test_f1: 0.4590
 epoch: 92, train_loss: 0.9511, test_loss: 1.1543, test_f1: 0.4684
 epoch: 93, train_loss: 0.9711, test_loss: 1.1585, test_f1: 0.4773
 epoch: 94, train_loss: 0.9726, test_loss: 1.1645, test_f1: 0.4692
 epoch: 95, train_loss: 0.9598, test_loss: 1.1690, test_f1: 0.4558
 epoch: 96, train_loss: 0.9427, test_loss: 1.1661, test_f1: 0.4600
 epoch: 97, train_loss: 0.9721, test_loss: 1.1588, test_f1: 0.4761
 epoch: 98, train_loss: 0.9636, test_loss: 1.1768, test_f1: 0.4672
 epoch: 99, train_loss: 0.9642, test_loss: 1.1744, test_f1: 0.4745
##################ITERATION #7 ****************************************
 epoch: 0, train_loss: 1.4152, test_loss: 1.4100, test_f1: 0.2305
 epoch: 1, train_loss: 1.3199, test_loss: 1.3830, test_f1: 0.2346
 epoch: 2, train_loss: 1.2949, test_loss: 1.3567, test_f1: 0.2362
 epoch: 3, train_loss: 1.2752, test_loss: 1.3373, test_f1: 0.2250
 epoch: 4, train_loss: 1.2437, test_loss: 1.3266, test_f1: 0.2398
 epoch: 5, train_loss: 1.2294, test_loss: 1.3252, test_f1: 0.2401
 epoch: 6, train_loss: 1.2233, test_loss: 1.3361, test_f1: 0.2401
 epoch: 7, train_loss: 1.1972, test_loss: 1.3580, test_f1: 0.2447
 epoch: 8, train_loss: 1.1815, test_loss: 1.3610, test_f1: 0.2503
 epoch: 9, train_loss: 1.1761, test_loss: 1.3767, test_f1: 0.2490
 epoch: 10, train_loss: 1.1771, test_loss: 1.3780, test_f1: 0.2653
 epoch: 11, train_loss: 1.1720, test_loss: 1.3110, test_f1: 0.2915
 epoch: 12, train_loss: 1.1501, test_loss: 1.2983, test_f1: 0.3020
 epoch: 13, train_loss: 1.1420, test_loss: 1.3268, test_f1: 0.3058
 epoch: 14, train_loss: 1.1304, test_loss: 1.3327, test_f1: 0.3117
 epoch: 15, train_loss: 1.1356, test_loss: 1.3276, test_f1: 0.3284
 epoch: 16, train_loss: 1.1257, test_loss: 1.3076, test_f1: 0.3344
 epoch: 17, train_loss: 1.1266, test_loss: 1.3307, test_f1: 0.3306
 epoch: 18, train_loss: 1.1016, test_loss: 1.3114, test_f1: 0.3305
 epoch: 19, train_loss: 1.1166, test_loss: 1.2815, test_f1: 0.3370
 epoch: 20, train_loss: 1.1023, test_loss: 1.2638, test_f1: 0.3476
 epoch: 21, train_loss: 1.0921, test_loss: 1.3084, test_f1: 0.3538
 epoch: 22, train_loss: 1.0921, test_loss: 1.2822, test_f1: 0.3584
 epoch: 23, train_loss: 1.0844, test_loss: 1.2964, test_f1: 0.3629
 epoch: 24, train_loss: 1.0772, test_loss: 1.3030, test_f1: 0.3698
 epoch: 25, train_loss: 1.0658, test_loss: 1.3327, test_f1: 0.3629
 epoch: 26, train_loss: 1.0735, test_loss: 1.3672, test_f1: 0.3438
 epoch: 27, train_loss: 1.0684, test_loss: 1.4115, test_f1: 0.3388
 epoch: 28, train_loss: 1.0624, test_loss: 1.3686, test_f1: 0.3791
 epoch: 29, train_loss: 1.0505, test_loss: 1.4278, test_f1: 0.3789
 epoch: 30, train_loss: 1.0510, test_loss: 1.5674, test_f1: 0.3903
 epoch: 31, train_loss: 1.0574, test_loss: 1.6241, test_f1: 0.3806
 epoch: 32, train_loss: 1.0474, test_loss: 1.5771, test_f1: 0.3753
 epoch: 33, train_loss: 1.0278, test_loss: 1.4693, test_f1: 0.3796
 epoch: 34, train_loss: 1.0319, test_loss: 1.4802, test_f1: 0.3979
 epoch: 35, train_loss: 1.0169, test_loss: 1.6254, test_f1: 0.4189
 epoch: 36, train_loss: 1.0215, test_loss: 1.6729, test_f1: 0.4310
 epoch: 37, train_loss: 1.0288, test_loss: 1.5837, test_f1: 0.4067
 epoch: 38, train_loss: 1.0179, test_loss: 1.6331, test_f1: 0.3999
 epoch: 39, train_loss: 1.0130, test_loss: 1.6089, test_f1: 0.4260
 epoch: 40, train_loss: 1.0194, test_loss: 1.5462, test_f1: 0.4080
 epoch: 41, train_loss: 1.0084, test_loss: 1.6428, test_f1: 0.3943
 epoch: 42, train_loss: 1.0223, test_loss: 1.6419, test_f1: 0.4024
 epoch: 43, train_loss: 1.0117, test_loss: 1.7028, test_f1: 0.4016
 epoch: 44, train_loss: 1.0052, test_loss: 1.5987, test_f1: 0.4074
 epoch: 45, train_loss: 1.0116, test_loss: 1.5713, test_f1: 0.4148
 epoch: 46, train_loss: 1.0044, test_loss: 1.5536, test_f1: 0.4105
 epoch: 47, train_loss: 0.9976, test_loss: 1.7679, test_f1: 0.4288
 epoch: 48, train_loss: 0.9816, test_loss: 2.0466, test_f1: 0.4312
 epoch: 49, train_loss: 0.9838, test_loss: 1.9875, test_f1: 0.4506
 epoch: 50, train_loss: 0.9941, test_loss: 1.9830, test_f1: 0.4451
 epoch: 51, train_loss: 0.9717, test_loss: 1.7782, test_f1: 0.4498
 epoch: 52, train_loss: 0.9932, test_loss: 1.7376, test_f1: 0.4555
 epoch: 53, train_loss: 0.9657, test_loss: 1.7913, test_f1: 0.4395
 epoch: 54, train_loss: 0.9779, test_loss: 1.8042, test_f1: 0.4128
 epoch: 55, train_loss: 0.9681, test_loss: 1.9006, test_f1: 0.4132
 epoch: 56, train_loss: 0.9589, test_loss: 1.9496, test_f1: 0.4214
 epoch: 57, train_loss: 0.9671, test_loss: 1.9942, test_f1: 0.4132
 epoch: 58, train_loss: 0.9586, test_loss: 2.0581, test_f1: 0.4206
 epoch: 59, train_loss: 0.9729, test_loss: 1.9880, test_f1: 0.4444
 epoch: 60, train_loss: 0.9691, test_loss: 2.1130, test_f1: 0.4362
 epoch: 61, train_loss: 0.9647, test_loss: 2.0212, test_f1: 0.4395
 epoch: 62, train_loss: 0.9589, test_loss: 1.8394, test_f1: 0.4424
 epoch: 63, train_loss: 0.9618, test_loss: 1.7893, test_f1: 0.4402
 epoch: 64, train_loss: 0.9596, test_loss: 1.6248, test_f1: 0.4413
 epoch: 65, train_loss: 0.9629, test_loss: 1.6669, test_f1: 0.4492
 epoch: 66, train_loss: 0.9599, test_loss: 1.7241, test_f1: 0.4523
 epoch: 67, train_loss: 0.9598, test_loss: 1.7181, test_f1: 0.4333
 epoch: 68, train_loss: 0.9639, test_loss: 1.7905, test_f1: 0.4268
 epoch: 69, train_loss: 0.9543, test_loss: 1.6846, test_f1: 0.4273
 epoch: 70, train_loss: 0.9453, test_loss: 1.6551, test_f1: 0.4252
 epoch: 71, train_loss: 0.9557, test_loss: 1.6717, test_f1: 0.4300
 epoch: 72, train_loss: 0.9495, test_loss: 1.6688, test_f1: 0.4421
 epoch: 73, train_loss: 0.9525, test_loss: 1.7872, test_f1: 0.4464
 epoch: 74, train_loss: 0.9409, test_loss: 1.9625, test_f1: 0.4318
 epoch: 75, train_loss: 0.9350, test_loss: 2.2182, test_f1: 0.4397
 epoch: 76, train_loss: 0.9512, test_loss: 2.4429, test_f1: 0.4389
 epoch: 77, train_loss: 0.9523, test_loss: 2.4385, test_f1: 0.4292
 epoch: 78, train_loss: 0.9464, test_loss: 2.2433, test_f1: 0.4325
 epoch: 79, train_loss: 0.9443, test_loss: 2.1774, test_f1: 0.4367
 epoch: 80, train_loss: 0.9421, test_loss: 2.4572, test_f1: 0.4364
 epoch: 81, train_loss: 0.9431, test_loss: 2.7862, test_f1: 0.4365
 epoch: 82, train_loss: 0.9325, test_loss: 2.7264, test_f1: 0.4254
 epoch: 83, train_loss: 0.9356, test_loss: 2.6618, test_f1: 0.4279
 epoch: 84, train_loss: 0.9322, test_loss: 2.5312, test_f1: 0.4029
 epoch: 85, train_loss: 0.9301, test_loss: 2.5106, test_f1: 0.4201
 epoch: 86, train_loss: 0.9353, test_loss: 2.4033, test_f1: 0.4245
 epoch: 87, train_loss: 0.9359, test_loss: 2.3096, test_f1: 0.4145
 epoch: 88, train_loss: 0.9233, test_loss: 2.3381, test_f1: 0.4201
 epoch: 89, train_loss: 0.9221, test_loss: 2.2193, test_f1: 0.4180
 epoch: 90, train_loss: 0.9391, test_loss: 2.2759, test_f1: 0.4330
 epoch: 91, train_loss: 0.9250, test_loss: 1.9181, test_f1: 0.4396
 epoch: 92, train_loss: 0.9434, test_loss: 1.8711, test_f1: 0.4330
 epoch: 93, train_loss: 0.9259, test_loss: 1.8560, test_f1: 0.4286
 epoch: 94, train_loss: 0.9150, test_loss: 1.8598, test_f1: 0.4356
 epoch: 95, train_loss: 0.9170, test_loss: 2.2170, test_f1: 0.4074
 epoch: 96, train_loss: 0.9294, test_loss: 2.4245, test_f1: 0.3978
 epoch: 97, train_loss: 0.9124, test_loss: 2.5533, test_f1: 0.3995
 epoch: 98, train_loss: 0.9247, test_loss: 2.7676, test_f1: 0.4088
 epoch: 99, train_loss: 0.9157, test_loss: 2.6610, test_f1: 0.4365
##################ITERATION #8 ****************************************
 epoch: 0, train_loss: 1.3364, test_loss: 1.3488, test_f1: 0.2281
 epoch: 1, train_loss: 1.2753, test_loss: 1.3496, test_f1: 0.2281
 epoch: 2, train_loss: 1.2543, test_loss: 1.3371, test_f1: 0.2281
 epoch: 3, train_loss: 1.2259, test_loss: 1.3202, test_f1: 0.2281
 epoch: 4, train_loss: 1.2255, test_loss: 1.3104, test_f1: 0.2281
 epoch: 5, train_loss: 1.2085, test_loss: 1.2994, test_f1: 0.2772
 epoch: 6, train_loss: 1.1942, test_loss: 1.2850, test_f1: 0.3647
 epoch: 7, train_loss: 1.1818, test_loss: 1.2739, test_f1: 0.3511
 epoch: 8, train_loss: 1.1729, test_loss: 1.2632, test_f1: 0.3474
 epoch: 9, train_loss: 1.1807, test_loss: 1.2526, test_f1: 0.3760
 epoch: 10, train_loss: 1.1618, test_loss: 1.2499, test_f1: 0.3804
 epoch: 11, train_loss: 1.1597, test_loss: 1.2414, test_f1: 0.3973
 epoch: 12, train_loss: 1.1524, test_loss: 1.2401, test_f1: 0.4023
 epoch: 13, train_loss: 1.1449, test_loss: 1.2419, test_f1: 0.3910
 epoch: 14, train_loss: 1.1385, test_loss: 1.2462, test_f1: 0.3805
 epoch: 15, train_loss: 1.1287, test_loss: 1.2470, test_f1: 0.3776
 epoch: 16, train_loss: 1.1354, test_loss: 1.2493, test_f1: 0.3903
 epoch: 17, train_loss: 1.1216, test_loss: 1.2552, test_f1: 0.3851
 epoch: 18, train_loss: 1.1156, test_loss: 1.2537, test_f1: 0.3907
 epoch: 19, train_loss: 1.1159, test_loss: 1.2448, test_f1: 0.4146
 epoch: 20, train_loss: 1.1180, test_loss: 1.2358, test_f1: 0.4105
 epoch: 21, train_loss: 1.1020, test_loss: 1.2405, test_f1: 0.3850
 epoch: 22, train_loss: 1.1110, test_loss: 1.2430, test_f1: 0.3998
 epoch: 23, train_loss: 1.1104, test_loss: 1.2287, test_f1: 0.4224
 epoch: 24, train_loss: 1.0986, test_loss: 1.2333, test_f1: 0.4267
 epoch: 25, train_loss: 1.1017, test_loss: 1.2545, test_f1: 0.4046
 epoch: 26, train_loss: 1.1033, test_loss: 1.3051, test_f1: 0.3963
 epoch: 27, train_loss: 1.0790, test_loss: 1.2351, test_f1: 0.4102
 epoch: 28, train_loss: 1.0733, test_loss: 1.2290, test_f1: 0.4197
 epoch: 29, train_loss: 1.0906, test_loss: 1.2296, test_f1: 0.4192
 epoch: 30, train_loss: 1.0906, test_loss: 1.2351, test_f1: 0.4153
 epoch: 31, train_loss: 1.0772, test_loss: 1.2225, test_f1: 0.4230
 epoch: 32, train_loss: 1.0647, test_loss: 1.2145, test_f1: 0.4259
 epoch: 33, train_loss: 1.0824, test_loss: 1.2064, test_f1: 0.4340
 epoch: 34, train_loss: 1.0651, test_loss: 1.2088, test_f1: 0.4336
 epoch: 35, train_loss: 1.0605, test_loss: 1.2119, test_f1: 0.4350
 epoch: 36, train_loss: 1.0705, test_loss: 1.2285, test_f1: 0.4383
 epoch: 37, train_loss: 1.0498, test_loss: 1.2236, test_f1: 0.4309
 epoch: 38, train_loss: 1.0540, test_loss: 1.2148, test_f1: 0.4435
 epoch: 39, train_loss: 1.0397, test_loss: 1.2201, test_f1: 0.4608
 epoch: 40, train_loss: 1.0435, test_loss: 1.2660, test_f1: 0.4585
 epoch: 41, train_loss: 1.0452, test_loss: 1.2108, test_f1: 0.4289
 epoch: 42, train_loss: 1.0456, test_loss: 1.2155, test_f1: 0.4485
 epoch: 43, train_loss: 1.0342, test_loss: 1.2270, test_f1: 0.4350
 epoch: 44, train_loss: 1.0416, test_loss: 1.2262, test_f1: 0.4344
 epoch: 45, train_loss: 1.0331, test_loss: 1.2248, test_f1: 0.4182
 epoch: 46, train_loss: 1.0333, test_loss: 1.2296, test_f1: 0.4301
 epoch: 47, train_loss: 1.0353, test_loss: 1.2594, test_f1: 0.4283
 epoch: 48, train_loss: 1.0405, test_loss: 1.2385, test_f1: 0.4315
 epoch: 49, train_loss: 1.0335, test_loss: 1.2224, test_f1: 0.4494
 epoch: 50, train_loss: 1.0518, test_loss: 1.2670, test_f1: 0.4115
 epoch: 51, train_loss: 1.0141, test_loss: 1.2586, test_f1: 0.4230
 epoch: 52, train_loss: 1.0237, test_loss: 1.2393, test_f1: 0.4346
 epoch: 53, train_loss: 1.0172, test_loss: 1.2347, test_f1: 0.4297
 epoch: 54, train_loss: 1.0250, test_loss: 1.2270, test_f1: 0.4130
 epoch: 55, train_loss: 1.0210, test_loss: 1.2277, test_f1: 0.4277
 epoch: 56, train_loss: 1.0222, test_loss: 1.2278, test_f1: 0.4303
 epoch: 57, train_loss: 1.0196, test_loss: 1.2288, test_f1: 0.4370
 epoch: 58, train_loss: 1.0128, test_loss: 1.2192, test_f1: 0.4348
 epoch: 59, train_loss: 1.0157, test_loss: 1.2176, test_f1: 0.4469
 epoch: 60, train_loss: 1.0116, test_loss: 1.2367, test_f1: 0.4397
 epoch: 61, train_loss: 1.0201, test_loss: 1.2534, test_f1: 0.4386
 epoch: 62, train_loss: 1.0046, test_loss: 1.2663, test_f1: 0.4194
 epoch: 63, train_loss: 1.0148, test_loss: 1.2468, test_f1: 0.4245
 epoch: 64, train_loss: 1.0021, test_loss: 1.2394, test_f1: 0.4388
 epoch: 65, train_loss: 0.9963, test_loss: 1.2449, test_f1: 0.4468
 epoch: 66, train_loss: 1.0171, test_loss: 1.2499, test_f1: 0.4484
 epoch: 67, train_loss: 1.0018, test_loss: 1.2513, test_f1: 0.4464
 epoch: 68, train_loss: 1.0130, test_loss: 1.2315, test_f1: 0.4509
 epoch: 69, train_loss: 1.0002, test_loss: 1.2227, test_f1: 0.4506
 epoch: 70, train_loss: 1.0040, test_loss: 1.2299, test_f1: 0.4417
 epoch: 71, train_loss: 1.0010, test_loss: 1.2201, test_f1: 0.4453
 epoch: 72, train_loss: 0.9955, test_loss: 1.2183, test_f1: 0.4473
 epoch: 73, train_loss: 0.9991, test_loss: 1.2142, test_f1: 0.4520
 epoch: 74, train_loss: 0.9968, test_loss: 1.2303, test_f1: 0.4516
 epoch: 75, train_loss: 1.0116, test_loss: 1.2341, test_f1: 0.4562
 epoch: 76, train_loss: 0.9844, test_loss: 1.2288, test_f1: 0.4453
 epoch: 77, train_loss: 0.9935, test_loss: 1.2178, test_f1: 0.4610
 epoch: 78, train_loss: 0.9898, test_loss: 1.2078, test_f1: 0.4562
 epoch: 79, train_loss: 0.9924, test_loss: 1.2182, test_f1: 0.4550
 epoch: 80, train_loss: 0.9935, test_loss: 1.2312, test_f1: 0.4425
 epoch: 81, train_loss: 0.9851, test_loss: 1.2316, test_f1: 0.4612
 epoch: 82, train_loss: 0.9872, test_loss: 1.2121, test_f1: 0.4577
 epoch: 83, train_loss: 1.0002, test_loss: 1.2193, test_f1: 0.4578
 epoch: 84, train_loss: 0.9914, test_loss: 1.2157, test_f1: 0.4654
 epoch: 85, train_loss: 0.9897, test_loss: 1.2297, test_f1: 0.4648
 epoch: 86, train_loss: 0.9886, test_loss: 1.2111, test_f1: 0.4553
 epoch: 87, train_loss: 0.9762, test_loss: 1.2212, test_f1: 0.4664
 epoch: 88, train_loss: 1.0036, test_loss: 1.2256, test_f1: 0.4526
 epoch: 89, train_loss: 0.9954, test_loss: 1.2239, test_f1: 0.4417
 epoch: 90, train_loss: 0.9841, test_loss: 1.2097, test_f1: 0.4473
 epoch: 91, train_loss: 0.9877, test_loss: 1.2235, test_f1: 0.4594
 epoch: 92, train_loss: 0.9853, test_loss: 1.2361, test_f1: 0.4635
 epoch: 93, train_loss: 0.9799, test_loss: 1.2284, test_f1: 0.4729
 epoch: 94, train_loss: 0.9706, test_loss: 1.2179, test_f1: 0.4703
 epoch: 95, train_loss: 0.9690, test_loss: 1.2352, test_f1: 0.4656
 epoch: 96, train_loss: 0.9621, test_loss: 1.2177, test_f1: 0.4702
 epoch: 97, train_loss: 0.9827, test_loss: 1.2098, test_f1: 0.4702
 epoch: 98, train_loss: 0.9704, test_loss: 1.2167, test_f1: 0.4817
 epoch: 99, train_loss: 0.9780, test_loss: 1.2059, test_f1: 0.4748
##################ITERATION #9 ****************************************
 epoch: 0, train_loss: 1.2986, test_loss: 1.4629, test_f1: 0.2630
 epoch: 1, train_loss: 1.2418, test_loss: 1.3927, test_f1: 0.2354
 epoch: 2, train_loss: 1.2161, test_loss: 1.3624, test_f1: 0.2357
 epoch: 3, train_loss: 1.2114, test_loss: 1.3497, test_f1: 0.2357
 epoch: 4, train_loss: 1.2001, test_loss: 1.3421, test_f1: 0.2630
 epoch: 5, train_loss: 1.1806, test_loss: 1.3262, test_f1: 0.2451
 epoch: 6, train_loss: 1.1688, test_loss: 1.3153, test_f1: 0.2864
 epoch: 7, train_loss: 1.1708, test_loss: 1.3028, test_f1: 0.3169
 epoch: 8, train_loss: 1.1604, test_loss: 1.2863, test_f1: 0.3135
 epoch: 9, train_loss: 1.1578, test_loss: 1.2735, test_f1: 0.3347
 epoch: 10, train_loss: 1.1601, test_loss: 1.2668, test_f1: 0.3202
 epoch: 11, train_loss: 1.1498, test_loss: 1.2569, test_f1: 0.3411
 epoch: 12, train_loss: 1.1493, test_loss: 1.2479, test_f1: 0.3852
 epoch: 13, train_loss: 1.1415, test_loss: 1.2353, test_f1: 0.3904
 epoch: 14, train_loss: 1.1236, test_loss: 1.2245, test_f1: 0.3884
 epoch: 15, train_loss: 1.1260, test_loss: 1.2208, test_f1: 0.3968
 epoch: 16, train_loss: 1.1128, test_loss: 1.2345, test_f1: 0.3936
 epoch: 17, train_loss: 1.1248, test_loss: 1.2340, test_f1: 0.3975
 epoch: 18, train_loss: 1.1059, test_loss: 1.2449, test_f1: 0.3994
 epoch: 19, train_loss: 1.1082, test_loss: 1.2685, test_f1: 0.4176
 epoch: 20, train_loss: 1.1067, test_loss: 1.2482, test_f1: 0.3954
 epoch: 21, train_loss: 1.0829, test_loss: 1.2651, test_f1: 0.4153
 epoch: 22, train_loss: 1.0989, test_loss: 1.2824, test_f1: 0.4090
 epoch: 23, train_loss: 1.0912, test_loss: 1.2787, test_f1: 0.3982
 epoch: 24, train_loss: 1.0922, test_loss: 1.2694, test_f1: 0.3883
 epoch: 25, train_loss: 1.0869, test_loss: 1.2826, test_f1: 0.3899
 epoch: 26, train_loss: 1.0853, test_loss: 1.2892, test_f1: 0.3811
 epoch: 27, train_loss: 1.0806, test_loss: 1.3087, test_f1: 0.3944
 epoch: 28, train_loss: 1.0648, test_loss: 1.2884, test_f1: 0.3751
 epoch: 29, train_loss: 1.0754, test_loss: 1.2668, test_f1: 0.3695
 epoch: 30, train_loss: 1.0636, test_loss: 1.2530, test_f1: 0.4007
 epoch: 31, train_loss: 1.0644, test_loss: 1.2684, test_f1: 0.3864
 epoch: 32, train_loss: 1.0694, test_loss: 1.2942, test_f1: 0.3794
 epoch: 33, train_loss: 1.0506, test_loss: 1.2755, test_f1: 0.3786
 epoch: 34, train_loss: 1.0483, test_loss: 1.2339, test_f1: 0.3868
 epoch: 35, train_loss: 1.0423, test_loss: 1.2076, test_f1: 0.3835
 epoch: 36, train_loss: 1.0302, test_loss: 1.2131, test_f1: 0.3859
 epoch: 37, train_loss: 1.0394, test_loss: 1.2776, test_f1: 0.3849
 epoch: 38, train_loss: 1.0418, test_loss: 1.2612, test_f1: 0.3739
 epoch: 39, train_loss: 1.0262, test_loss: 1.2288, test_f1: 0.3751
 epoch: 40, train_loss: 1.0382, test_loss: 1.2378, test_f1: 0.4341
 epoch: 41, train_loss: 1.0415, test_loss: 1.2166, test_f1: 0.4197
 epoch: 42, train_loss: 1.0379, test_loss: 1.2117, test_f1: 0.3878
 epoch: 43, train_loss: 1.0363, test_loss: 1.1907, test_f1: 0.3971
 epoch: 44, train_loss: 1.0304, test_loss: 1.1929, test_f1: 0.4262
 epoch: 45, train_loss: 1.0329, test_loss: 1.2014, test_f1: 0.4274
 epoch: 46, train_loss: 1.0086, test_loss: 1.1814, test_f1: 0.4128
 epoch: 47, train_loss: 1.0077, test_loss: 1.1640, test_f1: 0.4308
 epoch: 48, train_loss: 1.0026, test_loss: 1.1562, test_f1: 0.4474
 epoch: 49, train_loss: 1.0187, test_loss: 1.1454, test_f1: 0.4358
 epoch: 50, train_loss: 1.0048, test_loss: 1.1559, test_f1: 0.4270
 epoch: 51, train_loss: 0.9916, test_loss: 1.1761, test_f1: 0.4247
 epoch: 52, train_loss: 0.9973, test_loss: 1.1741, test_f1: 0.4092
 epoch: 53, train_loss: 0.9960, test_loss: 1.1501, test_f1: 0.4199
 epoch: 54, train_loss: 1.0054, test_loss: 1.1470, test_f1: 0.4367
 epoch: 55, train_loss: 0.9986, test_loss: 1.1545, test_f1: 0.4377
 epoch: 56, train_loss: 0.9960, test_loss: 1.1658, test_f1: 0.4478
 epoch: 57, train_loss: 0.9927, test_loss: 1.1601, test_f1: 0.4302
 epoch: 58, train_loss: 0.9846, test_loss: 1.1831, test_f1: 0.4484
 epoch: 59, train_loss: 0.9835, test_loss: 1.1939, test_f1: 0.4410
 epoch: 60, train_loss: 0.9843, test_loss: 1.1973, test_f1: 0.4256
 epoch: 61, train_loss: 0.9914, test_loss: 1.1924, test_f1: 0.4353
 epoch: 62, train_loss: 0.9742, test_loss: 1.1836, test_f1: 0.4292
 epoch: 63, train_loss: 0.9824, test_loss: 1.1562, test_f1: 0.4432
 epoch: 64, train_loss: 0.9816, test_loss: 1.1437, test_f1: 0.4380
 epoch: 65, train_loss: 0.9758, test_loss: 1.1463, test_f1: 0.4552
 epoch: 66, train_loss: 0.9730, test_loss: 1.1418, test_f1: 0.4584
 epoch: 67, train_loss: 0.9722, test_loss: 1.1466, test_f1: 0.4497
 epoch: 68, train_loss: 0.9783, test_loss: 1.1682, test_f1: 0.4602
 epoch: 69, train_loss: 0.9694, test_loss: 1.1720, test_f1: 0.4526
 epoch: 70, train_loss: 0.9753, test_loss: 1.1747, test_f1: 0.4144
 epoch: 71, train_loss: 0.9728, test_loss: 1.1743, test_f1: 0.4186
 epoch: 72, train_loss: 0.9645, test_loss: 1.1756, test_f1: 0.4345
 epoch: 73, train_loss: 0.9689, test_loss: 1.1679, test_f1: 0.4436
 epoch: 74, train_loss: 0.9612, test_loss: 1.1696, test_f1: 0.4438
 epoch: 75, train_loss: 0.9620, test_loss: 1.1769, test_f1: 0.4468
 epoch: 76, train_loss: 0.9669, test_loss: 1.1761, test_f1: 0.4466
 epoch: 77, train_loss: 0.9628, test_loss: 1.1780, test_f1: 0.4352
 epoch: 78, train_loss: 0.9534, test_loss: 1.1800, test_f1: 0.4218
 epoch: 79, train_loss: 0.9554, test_loss: 1.1722, test_f1: 0.4163
 epoch: 80, train_loss: 0.9475, test_loss: 1.1720, test_f1: 0.4279
 epoch: 81, train_loss: 0.9431, test_loss: 1.1586, test_f1: 0.4379
 epoch: 82, train_loss: 0.9615, test_loss: 1.1535, test_f1: 0.4527
 epoch: 83, train_loss: 0.9438, test_loss: 1.1576, test_f1: 0.4392
 epoch: 84, train_loss: 0.9530, test_loss: 1.1663, test_f1: 0.4395
 epoch: 85, train_loss: 0.9595, test_loss: 1.1780, test_f1: 0.4427
 epoch: 86, train_loss: 0.9433, test_loss: 1.1819, test_f1: 0.4460
 epoch: 87, train_loss: 0.9351, test_loss: 1.1744, test_f1: 0.4486
 epoch: 88, train_loss: 0.9444, test_loss: 1.1767, test_f1: 0.4535
 epoch: 89, train_loss: 0.9324, test_loss: 1.2131, test_f1: 0.4570
 epoch: 90, train_loss: 0.9341, test_loss: 1.2220, test_f1: 0.4489
 epoch: 91, train_loss: 0.9430, test_loss: 1.2105, test_f1: 0.4410
 epoch: 92, train_loss: 0.9240, test_loss: 1.2042, test_f1: 0.4668
 epoch: 93, train_loss: 0.9259, test_loss: 1.2060, test_f1: 0.4606
 epoch: 94, train_loss: 0.9246, test_loss: 1.1937, test_f1: 0.4598
 epoch: 95, train_loss: 0.9316, test_loss: 1.1828, test_f1: 0.4531
 epoch: 96, train_loss: 0.9304, test_loss: 1.1865, test_f1: 0.4348
 epoch: 97, train_loss: 0.9254, test_loss: 1.1953, test_f1: 0.4432
 epoch: 98, train_loss: 0.9194, test_loss: 1.1907, test_f1: 0.4456
 epoch: 99, train_loss: 0.9174, test_loss: 1.1966, test_f1: 0.4555

Training completed in 296.42 seconds
Best F1: 0.5155 at epoch 98
Mean F1 across iterations: 0.4703  0.0208
========================FINAL RESULTS================================
FEGIN weighted F1: 0.5155  0.0208
python main.py --data ltspice_demos --representation component_component --model FEGIN --layers 4 --hiddens 16 --batch_size 256 --lr 0.001 --emb_size 512 --epochs 100 --save_appendix component_component_L4_H16_BS256_LR0.001_E512 --no_val
-----



STDERR:
  File "main.py", line 370, in <module>
    main()
  File "main.py", line 254, in main
    dataset = dataset_class(
  File "/home/philip/projects/ltspice_examples_code_repo/Circuit-Completion-Using-GNNs/component_classification_with_link_prediction_head/evaluation/FEGIN/kernel/circuit_datasets.py", line 15, in __init__
    self.data, self.slices = torch.load(self.processed_paths[0])
  File "/home/philip/.local/lib/python3.8/site-packages/torch/serialization.py", line 1040, in load
    warnings.warn(
  File "/usr/lib/python3.8/warnings.py", line 109, in _showwarnmsg
    sw(msg.message, msg.category, msg.filename, msg.lineno,
  File "main.py", line 47, in warn_with_traceback
    traceback.print_stack(file=log)
/home/philip/projects/ltspice_examples_code_repo/Circuit-Completion-Using-GNNs/component_classification_with_link_prediction_head/evaluation/FEGIN/kernel/circuit_datasets.py:15: FutureWarning: You are using `torch.load` with `weights_only=False` (the current default value), which uses the default pickle module implicitly. It is possible to construct malicious pickle data which will execute arbitrary code during unpickling (See https://github.com/pytorch/pytorch/blob/main/SECURITY.md#untrusted-models for more details). In a future release, the default value for `weights_only` will be flipped to `True`. This limits the functions that could be executed during unpickling. Arbitrary objects will no longer be allowed to be loaded via this mode unless they are explicitly allowlisted by the user via `torch.serialization.add_safe_globals`. We recommend you start setting `weights_only=True` for any use case where you don't have full control of the loaded file. Please open an issue on GitHub for any issues related to this experimental feature.
  self.data, self.slices = torch.load(self.processed_paths[0])
