STDOUT:
Results will be saved in /home/philip/projects/ltspice_examples_code_repo/Circuit-Completion-Using-GNNs/component_classification_with_link_prediction_head/evaluation/FEGIN/results/model_FEGIN_dataset_ltspice_demos
Command line input: python main.py --data ltspice_demos --representation component_pin --model FEGIN --layers 6 --hiddens 32 --batch_size 64 --lr 0.01 --emb_size 250 --epochs 100 --save_appendix component_pin_L6_H32_BS64_LR0.01_E250 --no_val
 is saved.
-----
ltspice_demos - FEGIN
Using 6 layers, 32 hidden units, h = 2
Loading component_pin representation dataset
ENTERED
Training FEGIN on component_pin representation
Train: 1565, Test: 383
##################ITERATION #0 ****************************************
 epoch: 0, train_loss: 1.2569, test_loss: 1.2649, test_f1: 0.2973
 epoch: 1, train_loss: 1.1582, test_loss: 1.3050, test_f1: 0.3728
 epoch: 2, train_loss: 1.0216, test_loss: 1.0965, test_f1: 0.5062
 epoch: 3, train_loss: 0.9585, test_loss: 1.0140, test_f1: 0.5192
 epoch: 4, train_loss: 0.8843, test_loss: 1.4784, test_f1: 0.3337
 epoch: 5, train_loss: 0.8804, test_loss: 1.2023, test_f1: 0.4852
 epoch: 6, train_loss: 0.8768, test_loss: 1.9706, test_f1: 0.2947
 epoch: 7, train_loss: 0.8818, test_loss: 2.0233, test_f1: 0.3439
 epoch: 8, train_loss: 0.8307, test_loss: 1.1735, test_f1: 0.4755
 epoch: 9, train_loss: 0.7994, test_loss: 1.5514, test_f1: 0.4983
 epoch: 10, train_loss: 0.8651, test_loss: 1.1575, test_f1: 0.5107
 epoch: 11, train_loss: 0.8272, test_loss: 1.5180, test_f1: 0.4578
 epoch: 12, train_loss: 0.8105, test_loss: 1.1215, test_f1: 0.5606
 epoch: 13, train_loss: 0.7769, test_loss: 1.7178, test_f1: 0.4620
 epoch: 14, train_loss: 0.8061, test_loss: 1.1524, test_f1: 0.5995
 epoch: 15, train_loss: 0.7762, test_loss: 0.9301, test_f1: 0.5842
 epoch: 16, train_loss: 0.7970, test_loss: 1.1760, test_f1: 0.5699
 epoch: 17, train_loss: 0.8036, test_loss: 1.1421, test_f1: 0.5686
 epoch: 18, train_loss: 0.7967, test_loss: 1.1999, test_f1: 0.4057
 epoch: 19, train_loss: 0.7786, test_loss: 0.9644, test_f1: 0.4920
 epoch: 20, train_loss: 0.7556, test_loss: 1.0760, test_f1: 0.5981
 epoch: 21, train_loss: 0.7639, test_loss: 0.9679, test_f1: 0.6468
 epoch: 22, train_loss: 0.7591, test_loss: 1.2811, test_f1: 0.5499
 epoch: 23, train_loss: 0.7620, test_loss: 1.2782, test_f1: 0.5083
 epoch: 24, train_loss: 0.7611, test_loss: 1.2255, test_f1: 0.5187
 epoch: 25, train_loss: 0.7584, test_loss: 1.1941, test_f1: 0.5898
 epoch: 26, train_loss: 0.7227, test_loss: 0.9979, test_f1: 0.6533
 epoch: 27, train_loss: 0.7214, test_loss: 1.0415, test_f1: 0.5705
 epoch: 28, train_loss: 0.7189, test_loss: 1.0082, test_f1: 0.6237
 epoch: 29, train_loss: 0.7090, test_loss: 1.8264, test_f1: 0.5181
 epoch: 30, train_loss: 0.7312, test_loss: 1.3557, test_f1: 0.5315
 epoch: 31, train_loss: 0.7344, test_loss: 1.3602, test_f1: 0.5357
 epoch: 32, train_loss: 0.7198, test_loss: 1.2462, test_f1: 0.6033
 epoch: 33, train_loss: 0.7138, test_loss: 0.9559, test_f1: 0.5930
 epoch: 34, train_loss: 0.7045, test_loss: 1.0691, test_f1: 0.6053
 epoch: 35, train_loss: 0.6992, test_loss: 1.0021, test_f1: 0.6109
 epoch: 36, train_loss: 0.6990, test_loss: 1.0259, test_f1: 0.6086
 epoch: 37, train_loss: 0.6800, test_loss: 1.6210, test_f1: 0.4867
 epoch: 38, train_loss: 0.6762, test_loss: 0.9882, test_f1: 0.6613
 epoch: 39, train_loss: 0.6893, test_loss: 1.1363, test_f1: 0.5585
 epoch: 40, train_loss: 0.6873, test_loss: 1.1050, test_f1: 0.5825
 epoch: 41, train_loss: 0.6942, test_loss: 0.8753, test_f1: 0.6664
 epoch: 42, train_loss: 0.6570, test_loss: 1.0948, test_f1: 0.5336
 epoch: 43, train_loss: 0.6861, test_loss: 1.0133, test_f1: 0.6445
 epoch: 44, train_loss: 0.6681, test_loss: 1.5787, test_f1: 0.5682
 epoch: 45, train_loss: 0.6798, test_loss: 1.1096, test_f1: 0.5922
 epoch: 46, train_loss: 0.6743, test_loss: 1.0142, test_f1: 0.5819
 epoch: 47, train_loss: 0.6602, test_loss: 0.9565, test_f1: 0.6393
 epoch: 48, train_loss: 0.6290, test_loss: 1.0457, test_f1: 0.5892
 epoch: 49, train_loss: 0.6481, test_loss: 1.0758, test_f1: 0.5960
 epoch: 50, train_loss: 0.6276, test_loss: 1.1398, test_f1: 0.5929
 epoch: 51, train_loss: 0.6067, test_loss: 1.2328, test_f1: 0.6245
 epoch: 52, train_loss: 0.5906, test_loss: 1.1712, test_f1: 0.6444
 epoch: 53, train_loss: 0.6008, test_loss: 1.1788, test_f1: 0.6058
 epoch: 54, train_loss: 0.5836, test_loss: 1.3057, test_f1: 0.6381
 epoch: 55, train_loss: 0.5848, test_loss: 1.1042, test_f1: 0.6368
 epoch: 56, train_loss: 0.5794, test_loss: 1.1394, test_f1: 0.6067
 epoch: 57, train_loss: 0.5567, test_loss: 1.2330, test_f1: 0.6338
 epoch: 58, train_loss: 0.5580, test_loss: 1.1601, test_f1: 0.6427
 epoch: 59, train_loss: 0.5614, test_loss: 1.2274, test_f1: 0.6203
 epoch: 60, train_loss: 0.5709, test_loss: 1.1458, test_f1: 0.6365
 epoch: 61, train_loss: 0.5491, test_loss: 1.1771, test_f1: 0.6162
 epoch: 62, train_loss: 0.5562, test_loss: 1.2016, test_f1: 0.6065
 epoch: 63, train_loss: 0.5740, test_loss: 1.1735, test_f1: 0.6527
 epoch: 64, train_loss: 0.5603, test_loss: 1.1293, test_f1: 0.6154
 epoch: 65, train_loss: 0.5348, test_loss: 1.2169, test_f1: 0.6453
 epoch: 66, train_loss: 0.5404, test_loss: 1.3070, test_f1: 0.6551
 epoch: 67, train_loss: 0.5342, test_loss: 1.3813, test_f1: 0.6021
 epoch: 68, train_loss: 0.5305, test_loss: 1.2574, test_f1: 0.5833
 epoch: 69, train_loss: 0.5231, test_loss: 1.3741, test_f1: 0.6047
 epoch: 70, train_loss: 0.5193, test_loss: 1.3938, test_f1: 0.5811
 epoch: 71, train_loss: 0.5528, test_loss: 1.3903, test_f1: 0.5520
 epoch: 72, train_loss: 0.5233, test_loss: 1.2437, test_f1: 0.6918
 epoch: 73, train_loss: 0.4986, test_loss: 1.2501, test_f1: 0.6250
 epoch: 74, train_loss: 0.5134, test_loss: 1.3910, test_f1: 0.5848
 epoch: 75, train_loss: 0.5102, test_loss: 1.4947, test_f1: 0.6425
 epoch: 76, train_loss: 0.4962, test_loss: 1.4654, test_f1: 0.6066
 epoch: 77, train_loss: 0.5198, test_loss: 1.6758, test_f1: 0.4876
 epoch: 78, train_loss: 0.5010, test_loss: 1.8163, test_f1: 0.5562
 epoch: 79, train_loss: 0.5121, test_loss: 1.3567, test_f1: 0.6334
 epoch: 80, train_loss: 0.5481, test_loss: 1.1556, test_f1: 0.6360
 epoch: 81, train_loss: 0.5052, test_loss: 1.3598, test_f1: 0.6409
 epoch: 82, train_loss: 0.5021, test_loss: 1.3072, test_f1: 0.6427
 epoch: 83, train_loss: 0.5086, test_loss: 1.4896, test_f1: 0.6539
 epoch: 84, train_loss: 0.5059, test_loss: 1.3781, test_f1: 0.6613
 epoch: 85, train_loss: 0.4616, test_loss: 1.6880, test_f1: 0.6120
 epoch: 86, train_loss: 0.4655, test_loss: 1.3826, test_f1: 0.6066
 epoch: 87, train_loss: 0.4875, test_loss: 1.3379, test_f1: 0.6764
 epoch: 88, train_loss: 0.4958, test_loss: 1.3615, test_f1: 0.6590
 epoch: 89, train_loss: 0.4729, test_loss: 1.3807, test_f1: 0.6016
 epoch: 90, train_loss: 0.5005, test_loss: 1.4341, test_f1: 0.6685
 epoch: 91, train_loss: 0.4631, test_loss: 1.6429, test_f1: 0.6455
 epoch: 92, train_loss: 0.4342, test_loss: 1.5653, test_f1: 0.6222
 epoch: 93, train_loss: 0.4332, test_loss: 1.7859, test_f1: 0.5517
 epoch: 94, train_loss: 0.4768, test_loss: 1.9296, test_f1: 0.6232
 epoch: 95, train_loss: 0.4467, test_loss: 1.5628, test_f1: 0.6646
 epoch: 96, train_loss: 0.4195, test_loss: 1.5627, test_f1: 0.6553
 epoch: 97, train_loss: 0.4404, test_loss: 1.7828, test_f1: 0.6016
 epoch: 98, train_loss: 0.4653, test_loss: 1.6745, test_f1: 0.6032
 epoch: 99, train_loss: 0.4475, test_loss: 1.6434, test_f1: 0.6094
##################ITERATION #1 ****************************************
 epoch: 0, train_loss: 1.1589, test_loss: 1.2962, test_f1: 0.2841
 epoch: 1, train_loss: 1.0196, test_loss: 1.4120, test_f1: 0.5004
 epoch: 2, train_loss: 0.9381, test_loss: 0.9787, test_f1: 0.4720
 epoch: 3, train_loss: 0.9104, test_loss: 1.0542, test_f1: 0.4958
 epoch: 4, train_loss: 0.8981, test_loss: 1.3338, test_f1: 0.4325
 epoch: 5, train_loss: 0.8755, test_loss: 0.9857, test_f1: 0.5413
 epoch: 6, train_loss: 0.8634, test_loss: 0.9898, test_f1: 0.5479
 epoch: 7, train_loss: 0.8106, test_loss: 1.1439, test_f1: 0.4274
 epoch: 8, train_loss: 0.8085, test_loss: 1.1614, test_f1: 0.4767
 epoch: 9, train_loss: 0.7921, test_loss: 1.0725, test_f1: 0.3962
 epoch: 10, train_loss: 0.7971, test_loss: 1.0073, test_f1: 0.5160
 epoch: 11, train_loss: 0.7769, test_loss: 1.0314, test_f1: 0.5634
 epoch: 12, train_loss: 0.7946, test_loss: 0.9792, test_f1: 0.5710
 epoch: 13, train_loss: 0.7777, test_loss: 0.9707, test_f1: 0.5639
 epoch: 14, train_loss: 0.7750, test_loss: 0.9049, test_f1: 0.6332
 epoch: 15, train_loss: 0.7422, test_loss: 1.0270, test_f1: 0.6167
 epoch: 16, train_loss: 0.7499, test_loss: 1.5612, test_f1: 0.4320
 epoch: 17, train_loss: 0.7594, test_loss: 0.9574, test_f1: 0.5940
 epoch: 18, train_loss: 0.7409, test_loss: 1.0198, test_f1: 0.6011
 epoch: 19, train_loss: 0.7377, test_loss: 1.0583, test_f1: 0.5449
 epoch: 20, train_loss: 0.7521, test_loss: 0.9205, test_f1: 0.6492
 epoch: 21, train_loss: 0.7178, test_loss: 1.1514, test_f1: 0.5068
 epoch: 22, train_loss: 0.7248, test_loss: 1.0216, test_f1: 0.5813
 epoch: 23, train_loss: 0.7203, test_loss: 1.4155, test_f1: 0.4724
 epoch: 24, train_loss: 0.7309, test_loss: 0.9928, test_f1: 0.6113
 epoch: 25, train_loss: 0.7467, test_loss: 1.0330, test_f1: 0.5831
 epoch: 26, train_loss: 0.7276, test_loss: 1.0428, test_f1: 0.5720
 epoch: 27, train_loss: 0.7005, test_loss: 1.1835, test_f1: 0.5055
 epoch: 28, train_loss: 0.7161, test_loss: 1.1520, test_f1: 0.5357
 epoch: 29, train_loss: 0.7263, test_loss: 1.0736, test_f1: 0.6275
 epoch: 30, train_loss: 0.6895, test_loss: 1.1604, test_f1: 0.5621
 epoch: 31, train_loss: 0.6851, test_loss: 1.1430, test_f1: 0.4910
 epoch: 32, train_loss: 0.7000, test_loss: 1.1736, test_f1: 0.5782
 epoch: 33, train_loss: 0.6718, test_loss: 1.2078, test_f1: 0.6258
 epoch: 34, train_loss: 0.6745, test_loss: 1.5844, test_f1: 0.4673
 epoch: 35, train_loss: 0.7181, test_loss: 2.8095, test_f1: 0.5412
 epoch: 36, train_loss: 0.7158, test_loss: 1.0641, test_f1: 0.5723
 epoch: 37, train_loss: 0.6853, test_loss: 1.0380, test_f1: 0.6006
 epoch: 38, train_loss: 0.6637, test_loss: 1.1655, test_f1: 0.6172
 epoch: 39, train_loss: 0.6584, test_loss: 1.1755, test_f1: 0.6451
 epoch: 40, train_loss: 0.6951, test_loss: 1.0503, test_f1: 0.6063
 epoch: 41, train_loss: 0.6642, test_loss: 1.3840, test_f1: 0.5545
 epoch: 42, train_loss: 0.6470, test_loss: 1.2468, test_f1: 0.6009
 epoch: 43, train_loss: 0.6625, test_loss: 1.2208, test_f1: 0.6117
 epoch: 44, train_loss: 0.6688, test_loss: 1.0394, test_f1: 0.5630
 epoch: 45, train_loss: 0.6491, test_loss: 1.1501, test_f1: 0.6124
 epoch: 46, train_loss: 0.6397, test_loss: 3.6872, test_f1: 0.3876
 epoch: 47, train_loss: 0.6797, test_loss: 1.2477, test_f1: 0.6180
 epoch: 48, train_loss: 0.6488, test_loss: 1.2254, test_f1: 0.5357
 epoch: 49, train_loss: 0.6411, test_loss: 1.2854, test_f1: 0.6027
 epoch: 50, train_loss: 0.6711, test_loss: 1.1118, test_f1: 0.6159
 epoch: 51, train_loss: 0.6239, test_loss: 1.3334, test_f1: 0.5345
 epoch: 52, train_loss: 0.6040, test_loss: 1.3605, test_f1: 0.5816
 epoch: 53, train_loss: 0.5971, test_loss: 1.5134, test_f1: 0.6203
 epoch: 54, train_loss: 0.5889, test_loss: 1.4116, test_f1: 0.5922
 epoch: 55, train_loss: 0.5703, test_loss: 1.3909, test_f1: 0.6211
 epoch: 56, train_loss: 0.5840, test_loss: 1.4745, test_f1: 0.6346
 epoch: 57, train_loss: 0.5822, test_loss: 1.6783, test_f1: 0.6451
 epoch: 58, train_loss: 0.5846, test_loss: 1.5418, test_f1: 0.6191
 epoch: 59, train_loss: 0.5792, test_loss: 1.4766, test_f1: 0.6075
 epoch: 60, train_loss: 0.5650, test_loss: 1.4865, test_f1: 0.5952
 epoch: 61, train_loss: 0.5776, test_loss: 1.7413, test_f1: 0.5909
 epoch: 62, train_loss: 0.5765, test_loss: 1.4907, test_f1: 0.5915
 epoch: 63, train_loss: 0.5431, test_loss: 1.7653, test_f1: 0.6129
 epoch: 64, train_loss: 0.5829, test_loss: 1.5998, test_f1: 0.5821
 epoch: 65, train_loss: 0.5818, test_loss: 1.5965, test_f1: 0.6152
 epoch: 66, train_loss: 0.5543, test_loss: 1.3034, test_f1: 0.6076
 epoch: 67, train_loss: 0.5356, test_loss: 1.7208, test_f1: 0.6616
 epoch: 68, train_loss: 0.5405, test_loss: 1.8578, test_f1: 0.5936
 epoch: 69, train_loss: 0.5352, test_loss: 1.7465, test_f1: 0.5427
 epoch: 70, train_loss: 0.5213, test_loss: 1.9724, test_f1: 0.6388
 epoch: 71, train_loss: 0.5298, test_loss: 1.7147, test_f1: 0.5892
 epoch: 72, train_loss: 0.5220, test_loss: 1.6612, test_f1: 0.6458
 epoch: 73, train_loss: 0.5506, test_loss: 1.6131, test_f1: 0.6020
 epoch: 74, train_loss: 0.5263, test_loss: 2.0117, test_f1: 0.5861
 epoch: 75, train_loss: 0.5354, test_loss: 1.6838, test_f1: 0.6010
 epoch: 76, train_loss: 0.5507, test_loss: 2.5722, test_f1: 0.5383
 epoch: 77, train_loss: 0.5258, test_loss: 1.7235, test_f1: 0.6114
 epoch: 78, train_loss: 0.5368, test_loss: 1.9134, test_f1: 0.6000
 epoch: 79, train_loss: 0.5349, test_loss: 1.7658, test_f1: 0.6337
 epoch: 80, train_loss: 0.5050, test_loss: 1.5682, test_f1: 0.5693
 epoch: 81, train_loss: 0.5250, test_loss: 1.9490, test_f1: 0.5711
 epoch: 82, train_loss: 0.5227, test_loss: 2.0036, test_f1: 0.6011
 epoch: 83, train_loss: 0.5137, test_loss: 1.7387, test_f1: 0.5757
 epoch: 84, train_loss: 0.5138, test_loss: 2.3003, test_f1: 0.5826
 epoch: 85, train_loss: 0.5332, test_loss: 1.7260, test_f1: 0.5810
 epoch: 86, train_loss: 0.5245, test_loss: 1.6087, test_f1: 0.6069
 epoch: 87, train_loss: 0.5094, test_loss: 2.0789, test_f1: 0.5850
 epoch: 88, train_loss: 0.5445, test_loss: 1.5879, test_f1: 0.6159
 epoch: 89, train_loss: 0.4870, test_loss: 2.0072, test_f1: 0.5784
 epoch: 90, train_loss: 0.4914, test_loss: 1.8585, test_f1: 0.5951
 epoch: 91, train_loss: 0.4846, test_loss: 2.4628, test_f1: 0.6116
 epoch: 92, train_loss: 0.4853, test_loss: 1.9813, test_f1: 0.6148
 epoch: 93, train_loss: 0.5186, test_loss: 1.7852, test_f1: 0.5752
 epoch: 94, train_loss: 0.5167, test_loss: 2.1755, test_f1: 0.5339
 epoch: 95, train_loss: 0.4910, test_loss: 1.6824, test_f1: 0.5882
 epoch: 96, train_loss: 0.4599, test_loss: 1.5194, test_f1: 0.6390
 epoch: 97, train_loss: 0.4717, test_loss: 1.9163, test_f1: 0.6406
 epoch: 98, train_loss: 0.5060, test_loss: 1.7070, test_f1: 0.6358
 epoch: 99, train_loss: 0.4821, test_loss: 2.0405, test_f1: 0.6113
##################ITERATION #2 ****************************************
 epoch: 0, train_loss: 1.2084, test_loss: 1.4078, test_f1: 0.3063
 epoch: 1, train_loss: 1.0252, test_loss: 1.1939, test_f1: 0.3893
 epoch: 2, train_loss: 0.9941, test_loss: 1.0383, test_f1: 0.4905
 epoch: 3, train_loss: 0.9323, test_loss: 1.0049, test_f1: 0.5109
 epoch: 4, train_loss: 0.8940, test_loss: 1.0211, test_f1: 0.5463
 epoch: 5, train_loss: 0.8686, test_loss: 1.0969, test_f1: 0.5217
 epoch: 6, train_loss: 0.8481, test_loss: 1.1232, test_f1: 0.4593
 epoch: 7, train_loss: 0.8219, test_loss: 1.0892, test_f1: 0.5687
 epoch: 8, train_loss: 0.8088, test_loss: 1.4626, test_f1: 0.4388
 epoch: 9, train_loss: 0.8080, test_loss: 1.0154, test_f1: 0.5601
 epoch: 10, train_loss: 0.7894, test_loss: 1.3022, test_f1: 0.5624
 epoch: 11, train_loss: 0.7816, test_loss: 1.0280, test_f1: 0.4615
 epoch: 12, train_loss: 0.8098, test_loss: 1.1376, test_f1: 0.5306
 epoch: 13, train_loss: 0.7613, test_loss: 1.1846, test_f1: 0.4990
 epoch: 14, train_loss: 0.7646, test_loss: 1.2142, test_f1: 0.4948
 epoch: 15, train_loss: 0.8011, test_loss: 0.9608, test_f1: 0.5674
 epoch: 16, train_loss: 0.7507, test_loss: 1.1207, test_f1: 0.6116
 epoch: 17, train_loss: 0.7586, test_loss: 1.4124, test_f1: 0.5831
 epoch: 18, train_loss: 0.7469, test_loss: 0.9811, test_f1: 0.6210
 epoch: 19, train_loss: 0.7389, test_loss: 1.0610, test_f1: 0.6103
 epoch: 20, train_loss: 0.7179, test_loss: 1.0286, test_f1: 0.5696
 epoch: 21, train_loss: 0.7337, test_loss: 1.1134, test_f1: 0.5768
 epoch: 22, train_loss: 0.7174, test_loss: 1.1818, test_f1: 0.5548
 epoch: 23, train_loss: 0.7100, test_loss: 1.2505, test_f1: 0.5849
 epoch: 24, train_loss: 0.7271, test_loss: 1.0721, test_f1: 0.5996
 epoch: 25, train_loss: 0.7358, test_loss: 0.9371, test_f1: 0.6190
 epoch: 26, train_loss: 0.7230, test_loss: 1.0306, test_f1: 0.5892
 epoch: 27, train_loss: 0.6972, test_loss: 0.9957, test_f1: 0.6337
 epoch: 28, train_loss: 0.7240, test_loss: 0.9998, test_f1: 0.5764
 epoch: 29, train_loss: 0.6917, test_loss: 0.9542, test_f1: 0.6319
 epoch: 30, train_loss: 0.6904, test_loss: 4.8659, test_f1: 0.2735
 epoch: 31, train_loss: 0.9482, test_loss: 0.9999, test_f1: 0.5299
 epoch: 32, train_loss: 0.8377, test_loss: 1.1259, test_f1: 0.5750
 epoch: 33, train_loss: 0.7489, test_loss: 1.3017, test_f1: 0.5190
 epoch: 34, train_loss: 0.7212, test_loss: 1.0197, test_f1: 0.5448
 epoch: 35, train_loss: 0.7201, test_loss: 0.9999, test_f1: 0.6231
 epoch: 36, train_loss: 0.7001, test_loss: 1.0026, test_f1: 0.5473
 epoch: 37, train_loss: 0.6984, test_loss: 1.1402, test_f1: 0.5577
 epoch: 38, train_loss: 0.6748, test_loss: 0.9824, test_f1: 0.6210
 epoch: 39, train_loss: 0.6725, test_loss: 0.9785, test_f1: 0.6200
 epoch: 40, train_loss: 0.6720, test_loss: 1.0150, test_f1: 0.6088
 epoch: 41, train_loss: 0.6655, test_loss: 1.0252, test_f1: 0.5928
 epoch: 42, train_loss: 0.6487, test_loss: 1.0747, test_f1: 0.5775
 epoch: 43, train_loss: 0.6868, test_loss: 1.0486, test_f1: 0.5656
 epoch: 44, train_loss: 0.6943, test_loss: 0.9970, test_f1: 0.6341
 epoch: 45, train_loss: 0.6705, test_loss: 1.1681, test_f1: 0.5585
 epoch: 46, train_loss: 0.6581, test_loss: 1.0396, test_f1: 0.5890
 epoch: 47, train_loss: 0.6707, test_loss: 1.2009, test_f1: 0.6076
 epoch: 48, train_loss: 0.6543, test_loss: 1.1256, test_f1: 0.5960
 epoch: 49, train_loss: 0.6270, test_loss: 1.1698, test_f1: 0.5604
 epoch: 50, train_loss: 0.6226, test_loss: 1.0424, test_f1: 0.6343
 epoch: 51, train_loss: 0.6257, test_loss: 1.1741, test_f1: 0.6290
 epoch: 52, train_loss: 0.5892, test_loss: 1.1346, test_f1: 0.6573
 epoch: 53, train_loss: 0.6076, test_loss: 1.2553, test_f1: 0.6030
 epoch: 54, train_loss: 0.5776, test_loss: 1.1827, test_f1: 0.6352
 epoch: 55, train_loss: 0.5873, test_loss: 1.0664, test_f1: 0.6543
 epoch: 56, train_loss: 0.5705, test_loss: 1.1023, test_f1: 0.6557
 epoch: 57, train_loss: 0.5535, test_loss: 1.1815, test_f1: 0.6185
 epoch: 58, train_loss: 0.5365, test_loss: 1.1537, test_f1: 0.6441
 epoch: 59, train_loss: 0.5355, test_loss: 1.2958, test_f1: 0.6161
 epoch: 60, train_loss: 0.5433, test_loss: 1.5756, test_f1: 0.6088
 epoch: 61, train_loss: 0.5395, test_loss: 1.2785, test_f1: 0.6236
 epoch: 62, train_loss: 0.5309, test_loss: 1.1996, test_f1: 0.6435
 epoch: 63, train_loss: 0.5428, test_loss: 1.4152, test_f1: 0.6038
 epoch: 64, train_loss: 0.5281, test_loss: 1.3576, test_f1: 0.6071
 epoch: 65, train_loss: 0.5166, test_loss: 1.5842, test_f1: 0.6270
 epoch: 66, train_loss: 0.5097, test_loss: 1.3440, test_f1: 0.6147
 epoch: 67, train_loss: 0.5165, test_loss: 1.2385, test_f1: 0.6257
 epoch: 68, train_loss: 0.5535, test_loss: 1.3298, test_f1: 0.6370
 epoch: 69, train_loss: 0.5195, test_loss: 1.3664, test_f1: 0.6330
 epoch: 70, train_loss: 0.5179, test_loss: 1.5066, test_f1: 0.6309
 epoch: 71, train_loss: 0.5182, test_loss: 1.5176, test_f1: 0.6014
 epoch: 72, train_loss: 0.5020, test_loss: 1.4050, test_f1: 0.6241
 epoch: 73, train_loss: 0.4909, test_loss: 1.5691, test_f1: 0.6163
 epoch: 74, train_loss: 0.4946, test_loss: 1.6371, test_f1: 0.6040
 epoch: 75, train_loss: 0.5359, test_loss: 1.3055, test_f1: 0.6303
 epoch: 76, train_loss: 0.5422, test_loss: 1.2843, test_f1: 0.6290
 epoch: 77, train_loss: 0.5260, test_loss: 1.3033, test_f1: 0.6066
 epoch: 78, train_loss: 0.5243, test_loss: 1.3716, test_f1: 0.6189
 epoch: 79, train_loss: 0.5118, test_loss: 1.3206, test_f1: 0.6010
 epoch: 80, train_loss: 0.4966, test_loss: 1.5632, test_f1: 0.6082
 epoch: 81, train_loss: 0.5029, test_loss: 1.3923, test_f1: 0.6082
 epoch: 82, train_loss: 0.4805, test_loss: 1.5389, test_f1: 0.5862
 epoch: 83, train_loss: 0.4951, test_loss: 1.5491, test_f1: 0.5928
 epoch: 84, train_loss: 0.4761, test_loss: 1.5323, test_f1: 0.6236
 epoch: 85, train_loss: 0.4826, test_loss: 1.5702, test_f1: 0.6041
 epoch: 86, train_loss: 0.4549, test_loss: 1.8135, test_f1: 0.6016
 epoch: 87, train_loss: 0.4664, test_loss: 1.4104, test_f1: 0.6542
 epoch: 88, train_loss: 0.5126, test_loss: 1.8368, test_f1: 0.6193
 epoch: 89, train_loss: 0.5197, test_loss: 1.3808, test_f1: 0.6165
 epoch: 90, train_loss: 0.4876, test_loss: 1.3409, test_f1: 0.6427
 epoch: 91, train_loss: 0.4853, test_loss: 1.4747, test_f1: 0.5984
 epoch: 92, train_loss: 0.4914, test_loss: 1.3793, test_f1: 0.6176
 epoch: 93, train_loss: 0.4583, test_loss: 1.4725, test_f1: 0.6448
 epoch: 94, train_loss: 0.4571, test_loss: 1.5662, test_f1: 0.6429
 epoch: 95, train_loss: 0.5260, test_loss: 1.3268, test_f1: 0.6331
 epoch: 96, train_loss: 0.4516, test_loss: 1.3946, test_f1: 0.6565
 epoch: 97, train_loss: 0.4674, test_loss: 1.4800, test_f1: 0.6187
 epoch: 98, train_loss: 0.4487, test_loss: 1.5918, test_f1: 0.5790
 epoch: 99, train_loss: 0.4502, test_loss: 1.4234, test_f1: 0.6200
##################ITERATION #3 ****************************************
 epoch: 0, train_loss: 1.2226, test_loss: 1.2610, test_f1: 0.3880
 epoch: 1, train_loss: 1.0145, test_loss: 1.1718, test_f1: 0.4239
 epoch: 2, train_loss: 0.9475, test_loss: 1.0247, test_f1: 0.5426
 epoch: 3, train_loss: 0.9117, test_loss: 0.9715, test_f1: 0.5501
 epoch: 4, train_loss: 0.8848, test_loss: 1.0287, test_f1: 0.5334
 epoch: 5, train_loss: 0.9213, test_loss: 1.0159, test_f1: 0.5263
 epoch: 6, train_loss: 0.8555, test_loss: 1.0295, test_f1: 0.5469
 epoch: 7, train_loss: 0.8511, test_loss: 0.9588, test_f1: 0.5502
 epoch: 8, train_loss: 0.8524, test_loss: 1.0675, test_f1: 0.5072
 epoch: 9, train_loss: 0.8130, test_loss: 0.9817, test_f1: 0.5004
 epoch: 10, train_loss: 0.8054, test_loss: 1.0151, test_f1: 0.5845
 epoch: 11, train_loss: 0.7893, test_loss: 1.0290, test_f1: 0.6118
 epoch: 12, train_loss: 0.7942, test_loss: 1.0443, test_f1: 0.5861
 epoch: 13, train_loss: 0.7596, test_loss: 1.0458, test_f1: 0.5431
 epoch: 14, train_loss: 0.7710, test_loss: 1.0141, test_f1: 0.5503
 epoch: 15, train_loss: 0.7759, test_loss: 1.0442, test_f1: 0.5973
 epoch: 16, train_loss: 0.7641, test_loss: 0.9473, test_f1: 0.5521
 epoch: 17, train_loss: 0.8164, test_loss: 0.9689, test_f1: 0.5686
 epoch: 18, train_loss: 0.7626, test_loss: 0.9944, test_f1: 0.5515
 epoch: 19, train_loss: 0.7762, test_loss: 1.1293, test_f1: 0.5096
 epoch: 20, train_loss: 0.7528, test_loss: 1.5271, test_f1: 0.5546
 epoch: 21, train_loss: 0.7461, test_loss: 0.9886, test_f1: 0.5789
 epoch: 22, train_loss: 0.7488, test_loss: 1.0626, test_f1: 0.5614
 epoch: 23, train_loss: 0.7346, test_loss: 0.9869, test_f1: 0.5585
 epoch: 24, train_loss: 0.7146, test_loss: 1.3299, test_f1: 0.5691
 epoch: 25, train_loss: 0.7248, test_loss: 1.0789, test_f1: 0.5819
 epoch: 26, train_loss: 0.7029, test_loss: 0.9775, test_f1: 0.5911
 epoch: 27, train_loss: 0.6781, test_loss: 0.9656, test_f1: 0.6361
 epoch: 28, train_loss: 0.7233, test_loss: 0.9008, test_f1: 0.6200
 epoch: 29, train_loss: 0.7145, test_loss: 1.0511, test_f1: 0.5878
 epoch: 30, train_loss: 0.7198, test_loss: 1.1315, test_f1: 0.5638
 epoch: 31, train_loss: 0.7087, test_loss: 1.0179, test_f1: 0.5039
 epoch: 32, train_loss: 0.6950, test_loss: 1.0025, test_f1: 0.5536
 epoch: 33, train_loss: 0.7027, test_loss: 1.0805, test_f1: 0.5410
 epoch: 34, train_loss: 0.6790, test_loss: 1.0187, test_f1: 0.5952
 epoch: 35, train_loss: 0.6710, test_loss: 1.1151, test_f1: 0.5749
 epoch: 36, train_loss: 0.6529, test_loss: 0.9709, test_f1: 0.5813
 epoch: 37, train_loss: 0.6543, test_loss: 1.0259, test_f1: 0.6136
 epoch: 38, train_loss: 0.6514, test_loss: 1.1675, test_f1: 0.6129
 epoch: 39, train_loss: 0.6344, test_loss: 0.9266, test_f1: 0.6402
 epoch: 40, train_loss: 0.6651, test_loss: 1.1083, test_f1: 0.6302
 epoch: 41, train_loss: 0.6724, test_loss: 1.4183, test_f1: 0.4669
 epoch: 42, train_loss: 0.6636, test_loss: 0.9676, test_f1: 0.6428
 epoch: 43, train_loss: 0.6329, test_loss: 0.9821, test_f1: 0.6259
 epoch: 44, train_loss: 0.6315, test_loss: 1.1499, test_f1: 0.6243
 epoch: 45, train_loss: 0.6309, test_loss: 1.2282, test_f1: 0.6004
 epoch: 46, train_loss: 0.5923, test_loss: 1.2869, test_f1: 0.5769
 epoch: 47, train_loss: 0.6269, test_loss: 1.0777, test_f1: 0.6577
 epoch: 48, train_loss: 0.6028, test_loss: 1.1677, test_f1: 0.6331
 epoch: 49, train_loss: 0.6237, test_loss: 1.1907, test_f1: 0.6135
 epoch: 50, train_loss: 0.6067, test_loss: 1.0376, test_f1: 0.6313
 epoch: 51, train_loss: 0.6031, test_loss: 1.1331, test_f1: 0.6354
 epoch: 52, train_loss: 0.5602, test_loss: 1.0949, test_f1: 0.6605
 epoch: 53, train_loss: 0.5535, test_loss: 1.2705, test_f1: 0.6341
 epoch: 54, train_loss: 0.5729, test_loss: 1.1594, test_f1: 0.6090
 epoch: 55, train_loss: 0.5537, test_loss: 1.5443, test_f1: 0.5851
 epoch: 56, train_loss: 0.5786, test_loss: 1.1632, test_f1: 0.6509
 epoch: 57, train_loss: 0.5395, test_loss: 1.0728, test_f1: 0.6576
 epoch: 58, train_loss: 0.5034, test_loss: 1.5442, test_f1: 0.6700
 epoch: 59, train_loss: 0.5155, test_loss: 1.6092, test_f1: 0.6639
 epoch: 60, train_loss: 0.5237, test_loss: 1.2012, test_f1: 0.6577
 epoch: 61, train_loss: 0.5371, test_loss: 1.4204, test_f1: 0.5796
 epoch: 62, train_loss: 0.5167, test_loss: 1.3738, test_f1: 0.6690
 epoch: 63, train_loss: 0.5062, test_loss: 1.2732, test_f1: 0.6218
 epoch: 64, train_loss: 0.4851, test_loss: 1.2790, test_f1: 0.6089
 epoch: 65, train_loss: 0.5009, test_loss: 1.1410, test_f1: 0.6444
 epoch: 66, train_loss: 0.4767, test_loss: 1.5200, test_f1: 0.6427
 epoch: 67, train_loss: 0.4655, test_loss: 1.3989, test_f1: 0.6570
 epoch: 68, train_loss: 0.4364, test_loss: 1.5918, test_f1: 0.5853
 epoch: 69, train_loss: 0.4835, test_loss: 1.5548, test_f1: 0.5731
 epoch: 70, train_loss: 0.5013, test_loss: 1.3850, test_f1: 0.6262
 epoch: 71, train_loss: 0.4592, test_loss: 1.3218, test_f1: 0.6543
 epoch: 72, train_loss: 0.4735, test_loss: 1.1250, test_f1: 0.6429
 epoch: 73, train_loss: 0.4742, test_loss: 1.9240, test_f1: 0.6063
 epoch: 74, train_loss: 0.4797, test_loss: 1.5416, test_f1: 0.5227
 epoch: 75, train_loss: 0.4724, test_loss: 1.3205, test_f1: 0.6496
 epoch: 76, train_loss: 0.4734, test_loss: 1.1800, test_f1: 0.6704
 epoch: 77, train_loss: 0.4765, test_loss: 1.2148, test_f1: 0.6263
 epoch: 78, train_loss: 0.4393, test_loss: 1.5042, test_f1: 0.6363
 epoch: 79, train_loss: 0.4318, test_loss: 1.6038, test_f1: 0.5878
 epoch: 80, train_loss: 0.4617, test_loss: 1.5318, test_f1: 0.5922
 epoch: 81, train_loss: 0.4501, test_loss: 1.5555, test_f1: 0.6596
 epoch: 82, train_loss: 0.4566, test_loss: 1.3285, test_f1: 0.5921
 epoch: 83, train_loss: 0.4651, test_loss: 1.5130, test_f1: 0.6560
 epoch: 84, train_loss: 0.4292, test_loss: 1.7143, test_f1: 0.5511
 epoch: 85, train_loss: 0.4533, test_loss: 1.6090, test_f1: 0.5749
 epoch: 86, train_loss: 0.4200, test_loss: 1.4794, test_f1: 0.5435
 epoch: 87, train_loss: 0.4106, test_loss: 1.4546, test_f1: 0.6612
 epoch: 88, train_loss: 0.4335, test_loss: 1.5629, test_f1: 0.6208
 epoch: 89, train_loss: 0.4404, test_loss: 1.8800, test_f1: 0.5891
 epoch: 90, train_loss: 0.4254, test_loss: 1.4944, test_f1: 0.6332
 epoch: 91, train_loss: 0.4656, test_loss: 1.5935, test_f1: 0.4993
 epoch: 92, train_loss: 0.4516, test_loss: 1.9289, test_f1: 0.5666
 epoch: 93, train_loss: 0.4164, test_loss: 2.2131, test_f1: 0.5634
 epoch: 94, train_loss: 0.4046, test_loss: 1.7268, test_f1: 0.5937
 epoch: 95, train_loss: 0.4243, test_loss: 1.3762, test_f1: 0.5876
 epoch: 96, train_loss: 0.4481, test_loss: 1.5787, test_f1: 0.6005
 epoch: 97, train_loss: 0.4071, test_loss: 1.7342, test_f1: 0.6056
 epoch: 98, train_loss: 0.4193, test_loss: 1.7799, test_f1: 0.5971
 epoch: 99, train_loss: 0.4109, test_loss: 1.6913, test_f1: 0.6129
##################ITERATION #4 ****************************************
 epoch: 0, train_loss: 1.1799, test_loss: 1.3632, test_f1: 0.3182
 epoch: 1, train_loss: 1.0139, test_loss: 1.1207, test_f1: 0.4455
 epoch: 2, train_loss: 0.9865, test_loss: 1.0329, test_f1: 0.5330
 epoch: 3, train_loss: 0.9477, test_loss: 1.0835, test_f1: 0.4880
 epoch: 4, train_loss: 0.9172, test_loss: 1.0034, test_f1: 0.5457
 epoch: 5, train_loss: 0.8737, test_loss: 1.0233, test_f1: 0.5437
 epoch: 6, train_loss: 0.8699, test_loss: 1.1839, test_f1: 0.4572
 epoch: 7, train_loss: 0.8671, test_loss: 1.0051, test_f1: 0.5839
 epoch: 8, train_loss: 0.8298, test_loss: 1.1237, test_f1: 0.4966
 epoch: 9, train_loss: 0.8364, test_loss: 1.5033, test_f1: 0.4400
 epoch: 10, train_loss: 0.8043, test_loss: 1.0937, test_f1: 0.4922
 epoch: 11, train_loss: 0.8140, test_loss: 1.3389, test_f1: 0.4826
 epoch: 12, train_loss: 0.7899, test_loss: 0.9950, test_f1: 0.5516
 epoch: 13, train_loss: 0.7557, test_loss: 1.0595, test_f1: 0.5348
 epoch: 14, train_loss: 0.7843, test_loss: 1.9705, test_f1: 0.3916
 epoch: 15, train_loss: 0.7574, test_loss: 1.1324, test_f1: 0.4894
 epoch: 16, train_loss: 0.7528, test_loss: 1.0135, test_f1: 0.6212
 epoch: 17, train_loss: 0.7542, test_loss: 0.9500, test_f1: 0.6327
 epoch: 18, train_loss: 0.7785, test_loss: 1.1387, test_f1: 0.5436
 epoch: 19, train_loss: 0.7503, test_loss: 0.9580, test_f1: 0.5856
 epoch: 20, train_loss: 0.7309, test_loss: 0.9414, test_f1: 0.6114
 epoch: 21, train_loss: 0.7249, test_loss: 1.3785, test_f1: 0.4689
 epoch: 22, train_loss: 0.7259, test_loss: 0.9684, test_f1: 0.6150
 epoch: 23, train_loss: 0.7583, test_loss: 1.1503, test_f1: 0.4667
 epoch: 24, train_loss: 0.7136, test_loss: 1.1573, test_f1: 0.5149
 epoch: 25, train_loss: 0.7252, test_loss: 0.9437, test_f1: 0.6050
 epoch: 26, train_loss: 0.6988, test_loss: 1.0673, test_f1: 0.5249
 epoch: 27, train_loss: 0.7091, test_loss: 1.0151, test_f1: 0.6198
 epoch: 28, train_loss: 0.6958, test_loss: 1.3861, test_f1: 0.5460
 epoch: 29, train_loss: 0.6586, test_loss: 1.1227, test_f1: 0.5699
 epoch: 30, train_loss: 0.6729, test_loss: 0.9542, test_f1: 0.6020
 epoch: 31, train_loss: 0.6745, test_loss: 1.0134, test_f1: 0.5910
 epoch: 32, train_loss: 0.6955, test_loss: 0.9723, test_f1: 0.5966
 epoch: 33, train_loss: 0.6800, test_loss: 1.0918, test_f1: 0.5543
 epoch: 34, train_loss: 0.6400, test_loss: 1.0436, test_f1: 0.5604
 epoch: 35, train_loss: 0.6525, test_loss: 1.0201, test_f1: 0.6191
 epoch: 36, train_loss: 0.6413, test_loss: 1.3368, test_f1: 0.4761
 epoch: 37, train_loss: 0.6350, test_loss: 0.9590, test_f1: 0.6439
 epoch: 38, train_loss: 0.6734, test_loss: 1.0379, test_f1: 0.5964
 epoch: 39, train_loss: 0.6420, test_loss: 0.9937, test_f1: 0.5912
 epoch: 40, train_loss: 0.6160, test_loss: 1.0750, test_f1: 0.5753
 epoch: 41, train_loss: 0.6628, test_loss: 1.1054, test_f1: 0.5821
 epoch: 42, train_loss: 0.6570, test_loss: 0.9808, test_f1: 0.5975
 epoch: 43, train_loss: 0.6029, test_loss: 1.1334, test_f1: 0.6002
 epoch: 44, train_loss: 0.6341, test_loss: 1.1748, test_f1: 0.5690
 epoch: 45, train_loss: 0.6427, test_loss: 0.9868, test_f1: 0.6007
 epoch: 46, train_loss: 0.6395, test_loss: 1.0038, test_f1: 0.6436
 epoch: 47, train_loss: 0.6243, test_loss: 0.9069, test_f1: 0.6319
 epoch: 48, train_loss: 0.6069, test_loss: 1.0469, test_f1: 0.5895
 epoch: 49, train_loss: 0.6241, test_loss: 1.0811, test_f1: 0.6339
 epoch: 50, train_loss: 0.6431, test_loss: 1.1054, test_f1: 0.5904
 epoch: 51, train_loss: 0.5956, test_loss: 1.0319, test_f1: 0.5900
 epoch: 52, train_loss: 0.5230, test_loss: 1.0408, test_f1: 0.6319
 epoch: 53, train_loss: 0.5333, test_loss: 1.0678, test_f1: 0.6263
 epoch: 54, train_loss: 0.5293, test_loss: 1.0437, test_f1: 0.6382
 epoch: 55, train_loss: 0.5291, test_loss: 1.1635, test_f1: 0.6131
 epoch: 56, train_loss: 0.5206, test_loss: 1.0721, test_f1: 0.6207
 epoch: 57, train_loss: 0.4941, test_loss: 1.0603, test_f1: 0.6540
 epoch: 58, train_loss: 0.5021, test_loss: 1.1498, test_f1: 0.6618
 epoch: 59, train_loss: 0.5088, test_loss: 1.2243, test_f1: 0.5999
 epoch: 60, train_loss: 0.5065, test_loss: 1.1005, test_f1: 0.6594
 epoch: 61, train_loss: 0.4923, test_loss: 1.0613, test_f1: 0.6409
 epoch: 62, train_loss: 0.4895, test_loss: 1.1347, test_f1: 0.6563
 epoch: 63, train_loss: 0.4907, test_loss: 1.2733, test_f1: 0.6074
 epoch: 64, train_loss: 0.5160, test_loss: 1.0781, test_f1: 0.6376
 epoch: 65, train_loss: 0.4864, test_loss: 1.1172, test_f1: 0.6325
 epoch: 66, train_loss: 0.4402, test_loss: 1.2432, test_f1: 0.6466
 epoch: 67, train_loss: 0.4541, test_loss: 1.2277, test_f1: 0.6514
 epoch: 68, train_loss: 0.4994, test_loss: 1.1613, test_f1: 0.6337
 epoch: 69, train_loss: 0.4950, test_loss: 1.3046, test_f1: 0.6272
 epoch: 70, train_loss: 0.4508, test_loss: 1.3282, test_f1: 0.6237
 epoch: 71, train_loss: 0.4518, test_loss: 1.3454, test_f1: 0.6176
 epoch: 72, train_loss: 0.4546, test_loss: 1.2394, test_f1: 0.6325
 epoch: 73, train_loss: 0.4930, test_loss: 1.1637, test_f1: 0.6243
 epoch: 74, train_loss: 0.4658, test_loss: 1.3796, test_f1: 0.5973
 epoch: 75, train_loss: 0.4461, test_loss: 1.2274, test_f1: 0.6402
 epoch: 76, train_loss: 0.4227, test_loss: 1.5009, test_f1: 0.5892
 epoch: 77, train_loss: 0.4476, test_loss: 1.2070, test_f1: 0.6310
 epoch: 78, train_loss: 0.4593, test_loss: 1.2300, test_f1: 0.6182
 epoch: 79, train_loss: 0.4141, test_loss: 1.3497, test_f1: 0.6552
 epoch: 80, train_loss: 0.4260, test_loss: 1.4212, test_f1: 0.6306
 epoch: 81, train_loss: 0.4466, test_loss: 1.3070, test_f1: 0.6413
 epoch: 82, train_loss: 0.4266, test_loss: 1.3313, test_f1: 0.6145
 epoch: 83, train_loss: 0.4095, test_loss: 1.3458, test_f1: 0.6144
 epoch: 84, train_loss: 0.4477, test_loss: 1.3181, test_f1: 0.6300
 epoch: 85, train_loss: 0.4318, test_loss: 1.2681, test_f1: 0.6579
 epoch: 86, train_loss: 0.4091, test_loss: 1.5567, test_f1: 0.6047
 epoch: 87, train_loss: 0.4230, test_loss: 1.3717, test_f1: 0.6684
 epoch: 88, train_loss: 0.4046, test_loss: 1.4989, test_f1: 0.6497
 epoch: 89, train_loss: 0.3995, test_loss: 1.5998, test_f1: 0.6364
 epoch: 90, train_loss: 0.4369, test_loss: 1.5785, test_f1: 0.6075
 epoch: 91, train_loss: 0.4155, test_loss: 1.5402, test_f1: 0.6219
 epoch: 92, train_loss: 0.3974, test_loss: 1.5283, test_f1: 0.6458
 epoch: 93, train_loss: 0.4352, test_loss: 1.9900, test_f1: 0.5461
 epoch: 94, train_loss: 0.4129, test_loss: 1.5336, test_f1: 0.6004
 epoch: 95, train_loss: 0.4185, test_loss: 1.4957, test_f1: 0.6374
 epoch: 96, train_loss: 0.3997, test_loss: 1.6721, test_f1: 0.6451
 epoch: 97, train_loss: 0.4041, test_loss: 1.7189, test_f1: 0.6121
 epoch: 98, train_loss: 0.3761, test_loss: 1.5626, test_f1: 0.6487
 epoch: 99, train_loss: 0.3743, test_loss: 1.9721, test_f1: 0.6254
##################ITERATION #5 ****************************************
 epoch: 0, train_loss: 1.1955, test_loss: 1.3517, test_f1: 0.2816
 epoch: 1, train_loss: 1.0195, test_loss: 1.0644, test_f1: 0.4528
 epoch: 2, train_loss: 0.9455, test_loss: 1.0648, test_f1: 0.4397
 epoch: 3, train_loss: 0.9634, test_loss: 1.0161, test_f1: 0.5250
 epoch: 4, train_loss: 0.9130, test_loss: 1.0122, test_f1: 0.4860
 epoch: 5, train_loss: 0.8790, test_loss: 0.9724, test_f1: 0.5243
 epoch: 6, train_loss: 0.8738, test_loss: 1.0630, test_f1: 0.5439
 epoch: 7, train_loss: 0.8531, test_loss: 1.0918, test_f1: 0.4271
 epoch: 8, train_loss: 0.8430, test_loss: 1.1796, test_f1: 0.5500
 epoch: 9, train_loss: 0.8299, test_loss: 0.9997, test_f1: 0.5836
 epoch: 10, train_loss: 0.8101, test_loss: 1.0286, test_f1: 0.5506
 epoch: 11, train_loss: 0.8213, test_loss: 0.9739, test_f1: 0.5757
 epoch: 12, train_loss: 0.7936, test_loss: 1.0089, test_f1: 0.5260
 epoch: 13, train_loss: 0.7718, test_loss: 1.0562, test_f1: 0.5394
 epoch: 14, train_loss: 0.8028, test_loss: 0.9577, test_f1: 0.5900
 epoch: 15, train_loss: 0.7839, test_loss: 0.9801, test_f1: 0.5354
 epoch: 16, train_loss: 0.7760, test_loss: 1.0550, test_f1: 0.5048
 epoch: 17, train_loss: 0.7854, test_loss: 1.0494, test_f1: 0.4781
 epoch: 18, train_loss: 0.7556, test_loss: 1.2820, test_f1: 0.5580
 epoch: 19, train_loss: 0.7745, test_loss: 1.2308, test_f1: 0.5283
 epoch: 20, train_loss: 0.7597, test_loss: 0.9722, test_f1: 0.4998
 epoch: 21, train_loss: 0.7378, test_loss: 0.9783, test_f1: 0.5954
 epoch: 22, train_loss: 0.7430, test_loss: 1.0191, test_f1: 0.6030
 epoch: 23, train_loss: 0.7267, test_loss: 0.9681, test_f1: 0.6136
 epoch: 24, train_loss: 0.7163, test_loss: 1.0309, test_f1: 0.5912
 epoch: 25, train_loss: 0.7380, test_loss: 1.1416, test_f1: 0.5947
 epoch: 26, train_loss: 0.7304, test_loss: 1.0092, test_f1: 0.6003
 epoch: 27, train_loss: 0.7187, test_loss: 1.1003, test_f1: 0.5876
 epoch: 28, train_loss: 0.7467, test_loss: 0.9971, test_f1: 0.5540
 epoch: 29, train_loss: 0.7475, test_loss: 1.2697, test_f1: 0.5752
 epoch: 30, train_loss: 0.7407, test_loss: 1.1682, test_f1: 0.4982
 epoch: 31, train_loss: 0.7223, test_loss: 1.0598, test_f1: 0.5970
 epoch: 32, train_loss: 0.6805, test_loss: 1.1968, test_f1: 0.5987
 epoch: 33, train_loss: 0.6847, test_loss: 0.9701, test_f1: 0.6136
 epoch: 34, train_loss: 0.7158, test_loss: 1.0669, test_f1: 0.5874
 epoch: 35, train_loss: 0.6920, test_loss: 1.0843, test_f1: 0.5776
 epoch: 36, train_loss: 0.7186, test_loss: 1.1620, test_f1: 0.5997
 epoch: 37, train_loss: 0.7011, test_loss: 1.1764, test_f1: 0.5430
 epoch: 38, train_loss: 0.6885, test_loss: 1.1265, test_f1: 0.5639
 epoch: 39, train_loss: 0.6650, test_loss: 1.4699, test_f1: 0.5904
 epoch: 40, train_loss: 0.6773, test_loss: 1.2467, test_f1: 0.5566
 epoch: 41, train_loss: 0.7013, test_loss: 1.1354, test_f1: 0.6256
 epoch: 42, train_loss: 0.6653, test_loss: 1.0317, test_f1: 0.6338
 epoch: 43, train_loss: 0.6707, test_loss: 1.0924, test_f1: 0.5372
 epoch: 44, train_loss: 0.6576, test_loss: 1.2255, test_f1: 0.5510
 epoch: 45, train_loss: 0.6710, test_loss: 1.0281, test_f1: 0.6215
 epoch: 46, train_loss: 0.6616, test_loss: 1.1992, test_f1: 0.6112
 epoch: 47, train_loss: 0.6798, test_loss: 1.0017, test_f1: 0.5914
 epoch: 48, train_loss: 0.6622, test_loss: 1.0190, test_f1: 0.6136
 epoch: 49, train_loss: 0.6590, test_loss: 0.9726, test_f1: 0.6458
 epoch: 50, train_loss: 0.6554, test_loss: 1.1090, test_f1: 0.5748
 epoch: 51, train_loss: 0.6007, test_loss: 1.1455, test_f1: 0.6151
 epoch: 52, train_loss: 0.6061, test_loss: 1.1475, test_f1: 0.6201
 epoch: 53, train_loss: 0.5954, test_loss: 1.2438, test_f1: 0.5509
 epoch: 54, train_loss: 0.6301, test_loss: 1.1145, test_f1: 0.5961
 epoch: 55, train_loss: 0.5813, test_loss: 1.1321, test_f1: 0.5914
 epoch: 56, train_loss: 0.5683, test_loss: 1.1125, test_f1: 0.6464
 epoch: 57, train_loss: 0.5674, test_loss: 1.1672, test_f1: 0.6064
 epoch: 58, train_loss: 0.5654, test_loss: 1.2449, test_f1: 0.6197
 epoch: 59, train_loss: 0.5334, test_loss: 1.2760, test_f1: 0.6448
 epoch: 60, train_loss: 0.5409, test_loss: 1.0911, test_f1: 0.6438
 epoch: 61, train_loss: 0.5272, test_loss: 1.3682, test_f1: 0.6375
 epoch: 62, train_loss: 0.5325, test_loss: 1.3925, test_f1: 0.6406
 epoch: 63, train_loss: 0.5345, test_loss: 1.6652, test_f1: 0.5182
 epoch: 64, train_loss: 0.5365, test_loss: 1.3191, test_f1: 0.6397
 epoch: 65, train_loss: 0.5312, test_loss: 1.1667, test_f1: 0.6179
 epoch: 66, train_loss: 0.5299, test_loss: 1.1413, test_f1: 0.6260
 epoch: 67, train_loss: 0.5552, test_loss: 1.2871, test_f1: 0.5453
 epoch: 68, train_loss: 0.5430, test_loss: 1.3291, test_f1: 0.6038
 epoch: 69, train_loss: 0.5252, test_loss: 1.3527, test_f1: 0.6240
 epoch: 70, train_loss: 0.5242, test_loss: 1.1803, test_f1: 0.6094
 epoch: 71, train_loss: 0.5249, test_loss: 1.4035, test_f1: 0.5998
 epoch: 72, train_loss: 0.5265, test_loss: 1.5078, test_f1: 0.6061
 epoch: 73, train_loss: 0.5369, test_loss: 1.2455, test_f1: 0.6306
 epoch: 74, train_loss: 0.5305, test_loss: 1.2440, test_f1: 0.6520
 epoch: 75, train_loss: 0.5059, test_loss: 1.6476, test_f1: 0.5978
 epoch: 76, train_loss: 0.5378, test_loss: 1.2727, test_f1: 0.6187
 epoch: 77, train_loss: 0.5209, test_loss: 1.5003, test_f1: 0.6411
 epoch: 78, train_loss: 0.5129, test_loss: 1.3405, test_f1: 0.6007
 epoch: 79, train_loss: 0.5056, test_loss: 1.5753, test_f1: 0.6370
 epoch: 80, train_loss: 0.5017, test_loss: 1.3672, test_f1: 0.6542
 epoch: 81, train_loss: 0.5145, test_loss: 1.3478, test_f1: 0.6224
 epoch: 82, train_loss: 0.5257, test_loss: 1.4144, test_f1: 0.6147
 epoch: 83, train_loss: 0.4905, test_loss: 1.7831, test_f1: 0.6284
 epoch: 84, train_loss: 0.4720, test_loss: 1.3804, test_f1: 0.6408
 epoch: 85, train_loss: 0.4696, test_loss: 1.2530, test_f1: 0.6351
 epoch: 86, train_loss: 0.4698, test_loss: 1.5028, test_f1: 0.6413
 epoch: 87, train_loss: 0.4913, test_loss: 1.6899, test_f1: 0.5820
 epoch: 88, train_loss: 0.4750, test_loss: 1.3939, test_f1: 0.5868
 epoch: 89, train_loss: 0.4780, test_loss: 1.3684, test_f1: 0.6446
 epoch: 90, train_loss: 0.4462, test_loss: 1.4019, test_f1: 0.5930
 epoch: 91, train_loss: 0.4668, test_loss: 1.4977, test_f1: 0.6368
 epoch: 92, train_loss: 0.4642, test_loss: 1.3118, test_f1: 0.5866
 epoch: 93, train_loss: 0.4997, test_loss: 1.4097, test_f1: 0.6299
 epoch: 94, train_loss: 0.4743, test_loss: 1.5432, test_f1: 0.6205
 epoch: 95, train_loss: 0.4765, test_loss: 1.3761, test_f1: 0.6370
 epoch: 96, train_loss: 0.4611, test_loss: 1.4991, test_f1: 0.6105
 epoch: 97, train_loss: 0.4395, test_loss: 1.5052, test_f1: 0.6242
 epoch: 98, train_loss: 0.4047, test_loss: 1.6859, test_f1: 0.6122
 epoch: 99, train_loss: 0.4695, test_loss: 1.3890, test_f1: 0.6334
##################ITERATION #6 ****************************************
 epoch: 0, train_loss: 1.2320, test_loss: 1.3053, test_f1: 0.3202
 epoch: 1, train_loss: 1.0350, test_loss: 1.1410, test_f1: 0.4651
 epoch: 2, train_loss: 0.9852, test_loss: 1.2708, test_f1: 0.4275
 epoch: 3, train_loss: 0.9553, test_loss: 1.1659, test_f1: 0.4402
 epoch: 4, train_loss: 0.9411, test_loss: 1.1304, test_f1: 0.5133
 epoch: 5, train_loss: 0.9433, test_loss: 1.0146, test_f1: 0.5798
 epoch: 6, train_loss: 0.8898, test_loss: 1.3399, test_f1: 0.3926
 epoch: 7, train_loss: 0.8631, test_loss: 1.0797, test_f1: 0.5321
 epoch: 8, train_loss: 0.8203, test_loss: 1.0669, test_f1: 0.5496
 epoch: 9, train_loss: 0.8258, test_loss: 1.0705, test_f1: 0.5524
 epoch: 10, train_loss: 0.8514, test_loss: 1.0668, test_f1: 0.5168
 epoch: 11, train_loss: 0.8089, test_loss: 1.2235, test_f1: 0.5557
 epoch: 12, train_loss: 0.8075, test_loss: 1.1338, test_f1: 0.5031
 epoch: 13, train_loss: 0.7890, test_loss: 1.0811, test_f1: 0.5250
 epoch: 14, train_loss: 0.7909, test_loss: 1.3086, test_f1: 0.5815
 epoch: 15, train_loss: 0.7624, test_loss: 1.1920, test_f1: 0.5548
 epoch: 16, train_loss: 0.7527, test_loss: 1.0843, test_f1: 0.5311
 epoch: 17, train_loss: 0.7578, test_loss: 1.0770, test_f1: 0.5173
 epoch: 18, train_loss: 0.7521, test_loss: 1.1941, test_f1: 0.5468
 epoch: 19, train_loss: 0.7400, test_loss: 1.2154, test_f1: 0.5743
 epoch: 20, train_loss: 0.7493, test_loss: 1.0520, test_f1: 0.4720
 epoch: 21, train_loss: 0.7693, test_loss: 1.1251, test_f1: 0.5590
 epoch: 22, train_loss: 0.7421, test_loss: 1.0618, test_f1: 0.5885
 epoch: 23, train_loss: 0.7341, test_loss: 1.1009, test_f1: 0.5824
 epoch: 24, train_loss: 0.7109, test_loss: 1.2377, test_f1: 0.5287
 epoch: 25, train_loss: 0.7047, test_loss: 1.0715, test_f1: 0.5870
 epoch: 26, train_loss: 0.7366, test_loss: 1.0717, test_f1: 0.6108
 epoch: 27, train_loss: 0.6996, test_loss: 1.0969, test_f1: 0.5915
 epoch: 28, train_loss: 0.7053, test_loss: 1.2567, test_f1: 0.5326
 epoch: 29, train_loss: 0.7051, test_loss: 1.2540, test_f1: 0.5891
 epoch: 30, train_loss: 0.6971, test_loss: 1.2158, test_f1: 0.5572
 epoch: 31, train_loss: 0.7050, test_loss: 1.3331, test_f1: 0.5610
 epoch: 32, train_loss: 0.6924, test_loss: 1.0759, test_f1: 0.5964
 epoch: 33, train_loss: 0.7088, test_loss: 1.2118, test_f1: 0.5895
 epoch: 34, train_loss: 0.7237, test_loss: 1.8146, test_f1: 0.4423
 epoch: 35, train_loss: 0.7190, test_loss: 1.0535, test_f1: 0.5958
 epoch: 36, train_loss: 0.6745, test_loss: 1.1588, test_f1: 0.5994
 epoch: 37, train_loss: 0.6550, test_loss: 1.1696, test_f1: 0.5543
 epoch: 38, train_loss: 0.6740, test_loss: 1.1493, test_f1: 0.5777
 epoch: 39, train_loss: 0.6501, test_loss: 1.0862, test_f1: 0.5904
 epoch: 40, train_loss: 0.6729, test_loss: 1.1968, test_f1: 0.5670
 epoch: 41, train_loss: 0.6675, test_loss: 1.1291, test_f1: 0.6197
 epoch: 42, train_loss: 0.6620, test_loss: 1.2241, test_f1: 0.5700
 epoch: 43, train_loss: 0.6505, test_loss: 1.4452, test_f1: 0.5625
 epoch: 44, train_loss: 0.6830, test_loss: 0.9733, test_f1: 0.6003
 epoch: 45, train_loss: 0.6742, test_loss: 1.1991, test_f1: 0.5832
 epoch: 46, train_loss: 0.6714, test_loss: 1.3589, test_f1: 0.5008
 epoch: 47, train_loss: 0.6587, test_loss: 1.2102, test_f1: 0.6396
 epoch: 48, train_loss: 0.6418, test_loss: 1.1221, test_f1: 0.6029
 epoch: 49, train_loss: 0.6226, test_loss: 1.1119, test_f1: 0.5620
 epoch: 50, train_loss: 0.6046, test_loss: 1.0727, test_f1: 0.6158
 epoch: 51, train_loss: 0.5991, test_loss: 1.1440, test_f1: 0.5817
 epoch: 52, train_loss: 0.5868, test_loss: 1.1310, test_f1: 0.5928
 epoch: 53, train_loss: 0.5853, test_loss: 1.1461, test_f1: 0.5979
 epoch: 54, train_loss: 0.5721, test_loss: 1.1222, test_f1: 0.6259
 epoch: 55, train_loss: 0.5697, test_loss: 1.1473, test_f1: 0.6325
 epoch: 56, train_loss: 0.5730, test_loss: 1.1751, test_f1: 0.6155
 epoch: 57, train_loss: 0.5565, test_loss: 1.0672, test_f1: 0.5875
 epoch: 58, train_loss: 0.5567, test_loss: 1.2444, test_f1: 0.6128
 epoch: 59, train_loss: 0.5627, test_loss: 1.2825, test_f1: 0.5785
 epoch: 60, train_loss: 0.5613, test_loss: 1.1908, test_f1: 0.6001
 epoch: 61, train_loss: 0.5471, test_loss: 1.2480, test_f1: 0.5958
 epoch: 62, train_loss: 0.5493, test_loss: 1.2999, test_f1: 0.6347
 epoch: 63, train_loss: 0.5158, test_loss: 1.1913, test_f1: 0.6102
 epoch: 64, train_loss: 0.5526, test_loss: 1.3416, test_f1: 0.5974
 epoch: 65, train_loss: 0.5326, test_loss: 1.3888, test_f1: 0.5694
 epoch: 66, train_loss: 0.5474, test_loss: 1.2396, test_f1: 0.6136
 epoch: 67, train_loss: 0.5054, test_loss: 1.2619, test_f1: 0.5990
 epoch: 68, train_loss: 0.4838, test_loss: 1.3484, test_f1: 0.6242
 epoch: 69, train_loss: 0.4857, test_loss: 1.3906, test_f1: 0.5914
 epoch: 70, train_loss: 0.5028, test_loss: 1.4743, test_f1: 0.5859
 epoch: 71, train_loss: 0.5318, test_loss: 1.4284, test_f1: 0.6277
 epoch: 72, train_loss: 0.5179, test_loss: 1.3731, test_f1: 0.5756
 epoch: 73, train_loss: 0.4938, test_loss: 1.3187, test_f1: 0.6143
 epoch: 74, train_loss: 0.4876, test_loss: 1.4981, test_f1: 0.5970
 epoch: 75, train_loss: 0.4812, test_loss: 1.3229, test_f1: 0.6078
 epoch: 76, train_loss: 0.4800, test_loss: 1.6136, test_f1: 0.5439
 epoch: 77, train_loss: 0.4834, test_loss: 1.6612, test_f1: 0.5825
 epoch: 78, train_loss: 0.4869, test_loss: 1.4265, test_f1: 0.5835
 epoch: 79, train_loss: 0.5016, test_loss: 1.3066, test_f1: 0.6164
 epoch: 80, train_loss: 0.4915, test_loss: 1.4195, test_f1: 0.5710
 epoch: 81, train_loss: 0.4898, test_loss: 1.5187, test_f1: 0.5927
 epoch: 82, train_loss: 0.4624, test_loss: 1.3276, test_f1: 0.6550
 epoch: 83, train_loss: 0.4509, test_loss: 1.5175, test_f1: 0.5832
 epoch: 84, train_loss: 0.4570, test_loss: 1.4714, test_f1: 0.6308
 epoch: 85, train_loss: 0.4381, test_loss: 1.7458, test_f1: 0.5487
 epoch: 86, train_loss: 0.4923, test_loss: 1.4074, test_f1: 0.6089
 epoch: 87, train_loss: 0.4372, test_loss: 1.6263, test_f1: 0.5957
 epoch: 88, train_loss: 0.4564, test_loss: 1.6614, test_f1: 0.6230
 epoch: 89, train_loss: 0.4555, test_loss: 1.8376, test_f1: 0.6250
 epoch: 90, train_loss: 0.4177, test_loss: 1.7943, test_f1: 0.6470
 epoch: 91, train_loss: 0.4621, test_loss: 1.4816, test_f1: 0.6258
 epoch: 92, train_loss: 0.4532, test_loss: 1.9829, test_f1: 0.6083
 epoch: 93, train_loss: 0.4427, test_loss: 1.6575, test_f1: 0.5952
 epoch: 94, train_loss: 0.4083, test_loss: 1.5549, test_f1: 0.6394
 epoch: 95, train_loss: 0.4209, test_loss: 1.8000, test_f1: 0.6032
 epoch: 96, train_loss: 0.4216, test_loss: 1.9610, test_f1: 0.5620
 epoch: 97, train_loss: 0.4266, test_loss: 1.8333, test_f1: 0.5891
 epoch: 98, train_loss: 0.4089, test_loss: 1.8902, test_f1: 0.6169
 epoch: 99, train_loss: 0.3889, test_loss: 1.7327, test_f1: 0.6165
##################ITERATION #7 ****************************************
 epoch: 0, train_loss: 1.2862, test_loss: 1.2935, test_f1: 0.3502
 epoch: 1, train_loss: 1.0523, test_loss: 1.1686, test_f1: 0.4546
 epoch: 2, train_loss: 0.9823, test_loss: 1.1399, test_f1: 0.5161
 epoch: 3, train_loss: 0.9280, test_loss: 1.0511, test_f1: 0.5134
 epoch: 4, train_loss: 0.9804, test_loss: 1.1174, test_f1: 0.5286
 epoch: 5, train_loss: 0.9426, test_loss: 1.1611, test_f1: 0.4791
 epoch: 6, train_loss: 0.9263, test_loss: 1.0412, test_f1: 0.5327
 epoch: 7, train_loss: 0.8949, test_loss: 1.4964, test_f1: 0.4662
 epoch: 8, train_loss: 0.8625, test_loss: 1.1566, test_f1: 0.4857
 epoch: 9, train_loss: 0.8751, test_loss: 0.9616, test_f1: 0.6135
 epoch: 10, train_loss: 0.8249, test_loss: 1.2433, test_f1: 0.5782
 epoch: 11, train_loss: 0.8147, test_loss: 1.0275, test_f1: 0.6012
 epoch: 12, train_loss: 0.8529, test_loss: 0.9720, test_f1: 0.5901
 epoch: 13, train_loss: 0.8078, test_loss: 1.0663, test_f1: 0.5739
 epoch: 14, train_loss: 0.8017, test_loss: 1.6302, test_f1: 0.5622
 epoch: 15, train_loss: 0.8211, test_loss: 0.9646, test_f1: 0.6091
 epoch: 16, train_loss: 0.7806, test_loss: 1.0344, test_f1: 0.5526
 epoch: 17, train_loss: 0.7772, test_loss: 0.9228, test_f1: 0.6112
 epoch: 18, train_loss: 0.7595, test_loss: 1.0589, test_f1: 0.5590
 epoch: 19, train_loss: 0.7476, test_loss: 1.0082, test_f1: 0.6237
 epoch: 20, train_loss: 0.7168, test_loss: 0.9781, test_f1: 0.5833
 epoch: 21, train_loss: 0.7317, test_loss: 2.0014, test_f1: 0.4141
 epoch: 22, train_loss: 0.7443, test_loss: 1.1860, test_f1: 0.5089
 epoch: 23, train_loss: 0.7268, test_loss: 1.3856, test_f1: 0.5232
 epoch: 24, train_loss: 0.7388, test_loss: 0.9610, test_f1: 0.5761
 epoch: 25, train_loss: 0.7319, test_loss: 1.0532, test_f1: 0.4997
 epoch: 26, train_loss: 0.7320, test_loss: 0.8883, test_f1: 0.5941
 epoch: 27, train_loss: 0.7174, test_loss: 1.0384, test_f1: 0.5540
 epoch: 28, train_loss: 0.6868, test_loss: 1.6160, test_f1: 0.4809
 epoch: 29, train_loss: 0.7057, test_loss: 0.9603, test_f1: 0.6180
 epoch: 30, train_loss: 0.6793, test_loss: 1.0540, test_f1: 0.5677
 epoch: 31, train_loss: 0.7130, test_loss: 1.1750, test_f1: 0.5621
 epoch: 32, train_loss: 0.7193, test_loss: 1.1120, test_f1: 0.5785
 epoch: 33, train_loss: 0.6591, test_loss: 1.0823, test_f1: 0.5845
 epoch: 34, train_loss: 0.6529, test_loss: 1.0853, test_f1: 0.5761
 epoch: 35, train_loss: 0.6868, test_loss: 1.1283, test_f1: 0.5714
 epoch: 36, train_loss: 0.6586, test_loss: 1.0327, test_f1: 0.6121
 epoch: 37, train_loss: 0.6841, test_loss: 1.0966, test_f1: 0.6019
 epoch: 38, train_loss: 0.6684, test_loss: 1.3739, test_f1: 0.5195
 epoch: 39, train_loss: 0.6347, test_loss: 1.3178, test_f1: 0.5273
 epoch: 40, train_loss: 0.6493, test_loss: 1.2472, test_f1: 0.5372
 epoch: 41, train_loss: 0.6842, test_loss: 1.0407, test_f1: 0.6044
 epoch: 42, train_loss: 0.6382, test_loss: 1.1186, test_f1: 0.6098
 epoch: 43, train_loss: 0.6216, test_loss: 1.1892, test_f1: 0.5462
 epoch: 44, train_loss: 0.6370, test_loss: 1.1567, test_f1: 0.5800
 epoch: 45, train_loss: 0.6259, test_loss: 1.5103, test_f1: 0.5180
 epoch: 46, train_loss: 0.6524, test_loss: 1.2133, test_f1: 0.5968
 epoch: 47, train_loss: 0.5972, test_loss: 1.1841, test_f1: 0.5978
 epoch: 48, train_loss: 0.6205, test_loss: 1.2151, test_f1: 0.6315
 epoch: 49, train_loss: 0.6321, test_loss: 1.1711, test_f1: 0.5985
 epoch: 50, train_loss: 0.6148, test_loss: 1.3883, test_f1: 0.5866
 epoch: 51, train_loss: 0.5734, test_loss: 1.4810, test_f1: 0.5730
 epoch: 52, train_loss: 0.5567, test_loss: 1.3550, test_f1: 0.5722
 epoch: 53, train_loss: 0.5512, test_loss: 1.4004, test_f1: 0.6050
 epoch: 54, train_loss: 0.5379, test_loss: 1.3244, test_f1: 0.6148
 epoch: 55, train_loss: 0.5526, test_loss: 1.2418, test_f1: 0.6210
 epoch: 56, train_loss: 0.5198, test_loss: 1.5748, test_f1: 0.6221
 epoch: 57, train_loss: 0.5274, test_loss: 1.4739, test_f1: 0.6040
 epoch: 58, train_loss: 0.5233, test_loss: 1.5932, test_f1: 0.5811
 epoch: 59, train_loss: 0.5377, test_loss: 1.7185, test_f1: 0.5127
 epoch: 60, train_loss: 0.5408, test_loss: 1.7293, test_f1: 0.5831
 epoch: 61, train_loss: 0.5074, test_loss: 1.6534, test_f1: 0.6002
 epoch: 62, train_loss: 0.4832, test_loss: 1.5805, test_f1: 0.6134
 epoch: 63, train_loss: 0.4706, test_loss: 1.5461, test_f1: 0.5999
 epoch: 64, train_loss: 0.5032, test_loss: 1.6601, test_f1: 0.5996
 epoch: 65, train_loss: 0.4968, test_loss: 1.3322, test_f1: 0.6428
 epoch: 66, train_loss: 0.4953, test_loss: 1.4863, test_f1: 0.6008
 epoch: 67, train_loss: 0.4842, test_loss: 1.4799, test_f1: 0.6166
 epoch: 68, train_loss: 0.4807, test_loss: 1.7518, test_f1: 0.5924
 epoch: 69, train_loss: 0.4620, test_loss: 1.8523, test_f1: 0.6042
 epoch: 70, train_loss: 0.4890, test_loss: 1.6625, test_f1: 0.6040
 epoch: 71, train_loss: 0.4801, test_loss: 1.6828, test_f1: 0.6164
 epoch: 72, train_loss: 0.4693, test_loss: 1.6401, test_f1: 0.6226
 epoch: 73, train_loss: 0.5053, test_loss: 1.6580, test_f1: 0.6099
 epoch: 74, train_loss: 0.4257, test_loss: 1.4956, test_f1: 0.6171
 epoch: 75, train_loss: 0.4576, test_loss: 1.7365, test_f1: 0.6149
 epoch: 76, train_loss: 0.4512, test_loss: 1.4952, test_f1: 0.6299
 epoch: 77, train_loss: 0.4691, test_loss: 1.6092, test_f1: 0.5834
 epoch: 78, train_loss: 0.4736, test_loss: 1.6492, test_f1: 0.5843
 epoch: 79, train_loss: 0.4386, test_loss: 1.6725, test_f1: 0.6003
 epoch: 80, train_loss: 0.4629, test_loss: 1.5067, test_f1: 0.6015
 epoch: 81, train_loss: 0.4297, test_loss: 1.5622, test_f1: 0.6292
 epoch: 82, train_loss: 0.4530, test_loss: 1.4355, test_f1: 0.6285
 epoch: 83, train_loss: 0.4189, test_loss: 1.5574, test_f1: 0.5907
 epoch: 84, train_loss: 0.4244, test_loss: 1.7425, test_f1: 0.5985
 epoch: 85, train_loss: 0.4016, test_loss: 1.7241, test_f1: 0.6323
 epoch: 86, train_loss: 0.4191, test_loss: 1.9409, test_f1: 0.5941
 epoch: 87, train_loss: 0.4192, test_loss: 1.7921, test_f1: 0.5519
 epoch: 88, train_loss: 0.4017, test_loss: 1.6194, test_f1: 0.6481
 epoch: 89, train_loss: 0.4182, test_loss: 1.6560, test_f1: 0.6510
 epoch: 90, train_loss: 0.4056, test_loss: 1.8008, test_f1: 0.5898
 epoch: 91, train_loss: 0.4036, test_loss: 1.9714, test_f1: 0.5957
 epoch: 92, train_loss: 0.4152, test_loss: 1.8701, test_f1: 0.5789
 epoch: 93, train_loss: 0.3980, test_loss: 1.7409, test_f1: 0.6090
 epoch: 94, train_loss: 0.3954, test_loss: 2.1055, test_f1: 0.6083
 epoch: 95, train_loss: 0.3985, test_loss: 2.1890, test_f1: 0.5950
 epoch: 96, train_loss: 0.3934, test_loss: 1.9568, test_f1: 0.5728
 epoch: 97, train_loss: 0.4052, test_loss: 2.1104, test_f1: 0.6059
 epoch: 98, train_loss: 0.4019, test_loss: 2.0712, test_f1: 0.6086
 epoch: 99, train_loss: 0.4067, test_loss: 1.6597, test_f1: 0.6476
##################ITERATION #8 ****************************************
 epoch: 0, train_loss: 1.2356, test_loss: 1.3840, test_f1: 0.3522
 epoch: 1, train_loss: 1.0666, test_loss: 1.1745, test_f1: 0.4190
 epoch: 2, train_loss: 0.9861, test_loss: 1.1448, test_f1: 0.4859
 epoch: 3, train_loss: 0.9412, test_loss: 1.8584, test_f1: 0.3344
 epoch: 4, train_loss: 0.8966, test_loss: 1.0294, test_f1: 0.5779
 epoch: 5, train_loss: 0.8985, test_loss: 1.1668, test_f1: 0.5265
 epoch: 6, train_loss: 0.8898, test_loss: 1.0682, test_f1: 0.5230
 epoch: 7, train_loss: 0.8689, test_loss: 1.1636, test_f1: 0.5351
 epoch: 8, train_loss: 0.8501, test_loss: 1.0362, test_f1: 0.6071
 epoch: 9, train_loss: 0.8277, test_loss: 1.0307, test_f1: 0.6224
 epoch: 10, train_loss: 0.7937, test_loss: 1.3176, test_f1: 0.4678
 epoch: 11, train_loss: 0.8707, test_loss: 1.0981, test_f1: 0.5427
 epoch: 12, train_loss: 0.8575, test_loss: 1.0821, test_f1: 0.5231
 epoch: 13, train_loss: 0.8194, test_loss: 1.0289, test_f1: 0.5729
 epoch: 14, train_loss: 0.7821, test_loss: 1.2357, test_f1: 0.5628
 epoch: 15, train_loss: 0.7779, test_loss: 1.0351, test_f1: 0.5921
 epoch: 16, train_loss: 0.7856, test_loss: 1.0083, test_f1: 0.5466
 epoch: 17, train_loss: 0.7791, test_loss: 0.9908, test_f1: 0.5924
 epoch: 18, train_loss: 0.7469, test_loss: 1.0096, test_f1: 0.5997
 epoch: 19, train_loss: 0.7679, test_loss: 1.0283, test_f1: 0.5877
 epoch: 20, train_loss: 0.7520, test_loss: 1.0893, test_f1: 0.6129
 epoch: 21, train_loss: 0.7774, test_loss: 0.9935, test_f1: 0.6201
 epoch: 22, train_loss: 0.7558, test_loss: 1.0012, test_f1: 0.5858
 epoch: 23, train_loss: 0.7476, test_loss: 1.2222, test_f1: 0.4727
 epoch: 24, train_loss: 0.7589, test_loss: 1.1364, test_f1: 0.5527
 epoch: 25, train_loss: 0.7541, test_loss: 0.9786, test_f1: 0.5728
 epoch: 26, train_loss: 0.7453, test_loss: 0.9994, test_f1: 0.6112
 epoch: 27, train_loss: 0.7543, test_loss: 0.9876, test_f1: 0.6284
 epoch: 28, train_loss: 0.7343, test_loss: 1.0486, test_f1: 0.5669
 epoch: 29, train_loss: 0.7466, test_loss: 1.1644, test_f1: 0.5555
 epoch: 30, train_loss: 0.7256, test_loss: 0.9962, test_f1: 0.5698
 epoch: 31, train_loss: 0.7197, test_loss: 1.0496, test_f1: 0.5614
 epoch: 32, train_loss: 0.7159, test_loss: 1.0294, test_f1: 0.6241
 epoch: 33, train_loss: 0.7201, test_loss: 1.0673, test_f1: 0.5870
 epoch: 34, train_loss: 0.7047, test_loss: 1.0642, test_f1: 0.6166
 epoch: 35, train_loss: 0.6915, test_loss: 1.0983, test_f1: 0.5407
 epoch: 36, train_loss: 0.6721, test_loss: 0.9881, test_f1: 0.6246
 epoch: 37, train_loss: 0.6923, test_loss: 1.0985, test_f1: 0.5742
 epoch: 38, train_loss: 0.7019, test_loss: 1.1190, test_f1: 0.5318
 epoch: 39, train_loss: 0.6913, test_loss: 0.9961, test_f1: 0.6160
 epoch: 40, train_loss: 0.6964, test_loss: 1.3619, test_f1: 0.5375
 epoch: 41, train_loss: 0.6971, test_loss: 1.0547, test_f1: 0.6039
 epoch: 42, train_loss: 0.7079, test_loss: 1.0873, test_f1: 0.6332
 epoch: 43, train_loss: 0.7104, test_loss: 1.2329, test_f1: 0.5550
 epoch: 44, train_loss: 0.7152, test_loss: 1.0240, test_f1: 0.6050
 epoch: 45, train_loss: 0.6771, test_loss: 1.2172, test_f1: 0.6175
 epoch: 46, train_loss: 0.6697, test_loss: 1.0771, test_f1: 0.6143
 epoch: 47, train_loss: 0.6411, test_loss: 1.0324, test_f1: 0.6416
 epoch: 48, train_loss: 0.6313, test_loss: 1.0681, test_f1: 0.6289
 epoch: 49, train_loss: 0.6420, test_loss: 1.0939, test_f1: 0.6392
 epoch: 50, train_loss: 0.6706, test_loss: 0.9890, test_f1: 0.5714
 epoch: 51, train_loss: 0.6202, test_loss: 1.1095, test_f1: 0.6330
 epoch: 52, train_loss: 0.5771, test_loss: 1.0843, test_f1: 0.6170
 epoch: 53, train_loss: 0.5963, test_loss: 1.2309, test_f1: 0.6146
 epoch: 54, train_loss: 0.6087, test_loss: 1.2698, test_f1: 0.5962
 epoch: 55, train_loss: 0.5701, test_loss: 1.1762, test_f1: 0.6186
 epoch: 56, train_loss: 0.5544, test_loss: 0.9709, test_f1: 0.6533
 epoch: 57, train_loss: 0.5799, test_loss: 1.0530, test_f1: 0.6590
 epoch: 58, train_loss: 0.5614, test_loss: 1.0918, test_f1: 0.6126
 epoch: 59, train_loss: 0.5424, test_loss: 1.0692, test_f1: 0.6762
 epoch: 60, train_loss: 0.5656, test_loss: 1.1657, test_f1: 0.6298
 epoch: 61, train_loss: 0.5721, test_loss: 1.0644, test_f1: 0.6198
 epoch: 62, train_loss: 0.5770, test_loss: 1.1078, test_f1: 0.6623
 epoch: 63, train_loss: 0.5657, test_loss: 1.1710, test_f1: 0.6458
 epoch: 64, train_loss: 0.5564, test_loss: 1.2264, test_f1: 0.6599
 epoch: 65, train_loss: 0.5617, test_loss: 1.1400, test_f1: 0.5784
 epoch: 66, train_loss: 0.5919, test_loss: 1.0340, test_f1: 0.6317
 epoch: 67, train_loss: 0.5594, test_loss: 1.0783, test_f1: 0.6560
 epoch: 68, train_loss: 0.5554, test_loss: 1.1455, test_f1: 0.6272
 epoch: 69, train_loss: 0.5573, test_loss: 1.1259, test_f1: 0.6622
 epoch: 70, train_loss: 0.5320, test_loss: 1.0760, test_f1: 0.6510
 epoch: 71, train_loss: 0.5241, test_loss: 1.7985, test_f1: 0.6126
 epoch: 72, train_loss: 0.5331, test_loss: 1.1562, test_f1: 0.6045
 epoch: 73, train_loss: 0.5162, test_loss: 1.2961, test_f1: 0.6470
 epoch: 74, train_loss: 0.5271, test_loss: 1.4186, test_f1: 0.6204
 epoch: 75, train_loss: 0.5046, test_loss: 1.1076, test_f1: 0.6456
 epoch: 76, train_loss: 0.5214, test_loss: 1.1160, test_f1: 0.6457
 epoch: 77, train_loss: 0.5267, test_loss: 1.0778, test_f1: 0.6764
 epoch: 78, train_loss: 0.5338, test_loss: 1.3758, test_f1: 0.5777
 epoch: 79, train_loss: 0.5140, test_loss: 1.2227, test_f1: 0.6457
 epoch: 80, train_loss: 0.4964, test_loss: 1.3213, test_f1: 0.6513
 epoch: 81, train_loss: 0.5077, test_loss: 1.3772, test_f1: 0.6417
 epoch: 82, train_loss: 0.5247, test_loss: 1.5831, test_f1: 0.5377
 epoch: 83, train_loss: 0.5282, test_loss: 1.1411, test_f1: 0.6620
 epoch: 84, train_loss: 0.4977, test_loss: 1.4739, test_f1: 0.6408
 epoch: 85, train_loss: 0.5395, test_loss: 1.3371, test_f1: 0.6650
 epoch: 86, train_loss: 0.4756, test_loss: 1.2975, test_f1: 0.6497
 epoch: 87, train_loss: 0.5030, test_loss: 1.2582, test_f1: 0.6689
 epoch: 88, train_loss: 0.4897, test_loss: 1.2800, test_f1: 0.6264
 epoch: 89, train_loss: 0.4913, test_loss: 1.2353, test_f1: 0.6617
 epoch: 90, train_loss: 0.4721, test_loss: 1.5792, test_f1: 0.6379
 epoch: 91, train_loss: 0.5076, test_loss: 1.4445, test_f1: 0.6110
 epoch: 92, train_loss: 0.4999, test_loss: 1.1078, test_f1: 0.6727
 epoch: 93, train_loss: 0.4579, test_loss: 1.3325, test_f1: 0.6564
 epoch: 94, train_loss: 0.4751, test_loss: 1.3911, test_f1: 0.6612
 epoch: 95, train_loss: 0.4747, test_loss: 1.3172, test_f1: 0.6711
 epoch: 96, train_loss: 0.4651, test_loss: 1.3647, test_f1: 0.6542
 epoch: 97, train_loss: 0.4711, test_loss: 1.7385, test_f1: 0.6246
 epoch: 98, train_loss: 0.4594, test_loss: 1.2872, test_f1: 0.6865
 epoch: 99, train_loss: 0.4642, test_loss: 1.5670, test_f1: 0.6227
##################ITERATION #9 ****************************************
 epoch: 0, train_loss: 1.2593, test_loss: 1.1325, test_f1: 0.4503
 epoch: 1, train_loss: 1.0022, test_loss: 1.1093, test_f1: 0.4410
 epoch: 2, train_loss: 0.9199, test_loss: 1.3388, test_f1: 0.5432
 epoch: 3, train_loss: 0.8848, test_loss: 1.1027, test_f1: 0.5383
 epoch: 4, train_loss: 0.8961, test_loss: 1.0494, test_f1: 0.5417
 epoch: 5, train_loss: 0.8604, test_loss: 1.0598, test_f1: 0.5512
 epoch: 6, train_loss: 0.8207, test_loss: 1.0321, test_f1: 0.5634
 epoch: 7, train_loss: 0.8302, test_loss: 1.0405, test_f1: 0.5491
 epoch: 8, train_loss: 0.8070, test_loss: 1.1363, test_f1: 0.5571
 epoch: 9, train_loss: 0.8293, test_loss: 1.3318, test_f1: 0.4383
 epoch: 10, train_loss: 0.8143, test_loss: 1.0649, test_f1: 0.5206
 epoch: 11, train_loss: 0.7981, test_loss: 1.3593, test_f1: 0.4860
 epoch: 12, train_loss: 0.7811, test_loss: 1.1704, test_f1: 0.5304
 epoch: 13, train_loss: 0.7950, test_loss: 0.9711, test_f1: 0.6342
 epoch: 14, train_loss: 0.7866, test_loss: 1.0445, test_f1: 0.5482
 epoch: 15, train_loss: 0.7443, test_loss: 1.0409, test_f1: 0.5777
 epoch: 16, train_loss: 0.7210, test_loss: 1.2657, test_f1: 0.5722
 epoch: 17, train_loss: 0.7708, test_loss: 1.0661, test_f1: 0.5813
 epoch: 18, train_loss: 0.7884, test_loss: 1.0530, test_f1: 0.5736
 epoch: 19, train_loss: 0.7665, test_loss: 1.0245, test_f1: 0.5787
 epoch: 20, train_loss: 0.7360, test_loss: 1.3270, test_f1: 0.5046
 epoch: 21, train_loss: 0.7212, test_loss: 1.0293, test_f1: 0.6022
 epoch: 22, train_loss: 0.7119, test_loss: 1.1465, test_f1: 0.5669
 epoch: 23, train_loss: 0.7272, test_loss: 1.2247, test_f1: 0.5261
 epoch: 24, train_loss: 0.7173, test_loss: 1.1849, test_f1: 0.5514
 epoch: 25, train_loss: 0.6875, test_loss: 1.1573, test_f1: 0.5425
 epoch: 26, train_loss: 0.6835, test_loss: 1.1147, test_f1: 0.5824
 epoch: 27, train_loss: 0.6982, test_loss: 1.0763, test_f1: 0.5866
 epoch: 28, train_loss: 0.7008, test_loss: 1.2653, test_f1: 0.5647
 epoch: 29, train_loss: 0.7314, test_loss: 1.0630, test_f1: 0.5790
 epoch: 30, train_loss: 0.6825, test_loss: 1.1472, test_f1: 0.5637
 epoch: 31, train_loss: 0.7198, test_loss: 1.0313, test_f1: 0.5997
 epoch: 32, train_loss: 0.6812, test_loss: 1.0926, test_f1: 0.5619
 epoch: 33, train_loss: 0.6761, test_loss: 1.4064, test_f1: 0.5544
 epoch: 34, train_loss: 0.6721, test_loss: 1.1522, test_f1: 0.5190
 epoch: 35, train_loss: 0.6601, test_loss: 1.2794, test_f1: 0.5757
 epoch: 36, train_loss: 0.6309, test_loss: 1.2452, test_f1: 0.5828
 epoch: 37, train_loss: 0.6465, test_loss: 1.8684, test_f1: 0.5426
 epoch: 38, train_loss: 0.6457, test_loss: 1.3381, test_f1: 0.5765
 epoch: 39, train_loss: 0.6357, test_loss: 1.2820, test_f1: 0.6241
 epoch: 40, train_loss: 0.6490, test_loss: 1.1328, test_f1: 0.6110
 epoch: 41, train_loss: 0.6082, test_loss: 1.1599, test_f1: 0.5702
 epoch: 42, train_loss: 0.6354, test_loss: 1.2252, test_f1: 0.5598
 epoch: 43, train_loss: 0.6287, test_loss: 1.3926, test_f1: 0.5455
 epoch: 44, train_loss: 0.6477, test_loss: 1.2569, test_f1: 0.5838
 epoch: 45, train_loss: 0.6474, test_loss: 1.2476, test_f1: 0.5761
 epoch: 46, train_loss: 0.6249, test_loss: 1.7810, test_f1: 0.4992
 epoch: 47, train_loss: 0.6217, test_loss: 1.4411, test_f1: 0.5419
 epoch: 48, train_loss: 0.6612, test_loss: 1.1470, test_f1: 0.5724
 epoch: 49, train_loss: 0.6436, test_loss: 1.1853, test_f1: 0.5797
 epoch: 50, train_loss: 0.6188, test_loss: 1.5168, test_f1: 0.5001
 epoch: 51, train_loss: 0.5876, test_loss: 1.2107, test_f1: 0.6094
 epoch: 52, train_loss: 0.5380, test_loss: 1.4839, test_f1: 0.5697
 epoch: 53, train_loss: 0.5463, test_loss: 1.3163, test_f1: 0.6071
 epoch: 54, train_loss: 0.5591, test_loss: 1.4890, test_f1: 0.6143
 epoch: 55, train_loss: 0.5173, test_loss: 1.3605, test_f1: 0.5596
 epoch: 56, train_loss: 0.5286, test_loss: 1.4327, test_f1: 0.5329
 epoch: 57, train_loss: 0.4998, test_loss: 1.4458, test_f1: 0.5736
 epoch: 58, train_loss: 0.5169, test_loss: 1.4877, test_f1: 0.6078
 epoch: 59, train_loss: 0.4926, test_loss: 1.6364, test_f1: 0.5921
 epoch: 60, train_loss: 0.5241, test_loss: 1.3036, test_f1: 0.5620
 epoch: 61, train_loss: 0.4918, test_loss: 1.4711, test_f1: 0.6035
 epoch: 62, train_loss: 0.5095, test_loss: 1.3391, test_f1: 0.6101
 epoch: 63, train_loss: 0.5236, test_loss: 1.3480, test_f1: 0.5946
 epoch: 64, train_loss: 0.4654, test_loss: 1.4825, test_f1: 0.6395
 epoch: 65, train_loss: 0.5118, test_loss: 1.3852, test_f1: 0.6100
 epoch: 66, train_loss: 0.5091, test_loss: 1.3475, test_f1: 0.6552
 epoch: 67, train_loss: 0.4880, test_loss: 1.6869, test_f1: 0.5880
 epoch: 68, train_loss: 0.4818, test_loss: 1.3891, test_f1: 0.6009
 epoch: 69, train_loss: 0.5090, test_loss: 1.4226, test_f1: 0.6142
 epoch: 70, train_loss: 0.4974, test_loss: 1.2657, test_f1: 0.6447
 epoch: 71, train_loss: 0.4637, test_loss: 1.7133, test_f1: 0.5748
 epoch: 72, train_loss: 0.4881, test_loss: 1.5175, test_f1: 0.5451
 epoch: 73, train_loss: 0.4680, test_loss: 1.3622, test_f1: 0.6237
 epoch: 74, train_loss: 0.5002, test_loss: 1.4191, test_f1: 0.5969
 epoch: 75, train_loss: 0.4679, test_loss: 2.0989, test_f1: 0.5834
 epoch: 76, train_loss: 0.4518, test_loss: 1.5062, test_f1: 0.5983
 epoch: 77, train_loss: 0.4639, test_loss: 1.3516, test_f1: 0.6399
 epoch: 78, train_loss: 0.4367, test_loss: 1.6759, test_f1: 0.6270
 epoch: 79, train_loss: 0.4264, test_loss: 1.3924, test_f1: 0.6253
 epoch: 80, train_loss: 0.4741, test_loss: 1.5057, test_f1: 0.6444
 epoch: 81, train_loss: 0.4391, test_loss: 1.6034, test_f1: 0.6271
 epoch: 82, train_loss: 0.4634, test_loss: 1.4547, test_f1: 0.6173
 epoch: 83, train_loss: 0.4334, test_loss: 1.6049, test_f1: 0.5955
 epoch: 84, train_loss: 0.4751, test_loss: 1.3955, test_f1: 0.6224
 epoch: 85, train_loss: 0.4366, test_loss: 1.5273, test_f1: 0.6472
 epoch: 86, train_loss: 0.4271, test_loss: 1.5653, test_f1: 0.6372
 epoch: 87, train_loss: 0.4583, test_loss: 1.5526, test_f1: 0.5833
 epoch: 88, train_loss: 0.4592, test_loss: 1.9157, test_f1: 0.5824
 epoch: 89, train_loss: 0.4448, test_loss: 1.7201, test_f1: 0.6174
 epoch: 90, train_loss: 0.4529, test_loss: 1.7271, test_f1: 0.6249
 epoch: 91, train_loss: 0.4622, test_loss: 1.5520, test_f1: 0.6599
 epoch: 92, train_loss: 0.4433, test_loss: 1.4304, test_f1: 0.6324
 epoch: 93, train_loss: 0.4088, test_loss: 1.5963, test_f1: 0.6286
 epoch: 94, train_loss: 0.4193, test_loss: 1.6420, test_f1: 0.6058
 epoch: 95, train_loss: 0.4424, test_loss: 1.5435, test_f1: 0.6523
 epoch: 96, train_loss: 0.4025, test_loss: 1.6022, test_f1: 0.6157
 epoch: 97, train_loss: 0.4135, test_loss: 1.5845, test_f1: 0.6512
 epoch: 98, train_loss: 0.4070, test_loss: 1.6221, test_f1: 0.6636
 epoch: 99, train_loss: 0.4003, test_loss: 1.9148, test_f1: 0.5541

Training completed in 535.18 seconds
Best F1: 0.6918 at epoch 72
Mean F1 across iterations: 0.6660  0.0130
========================FINAL RESULTS================================
FEGIN weighted F1: 0.6918  0.0130
python main.py --data ltspice_demos --representation component_pin --model FEGIN --layers 6 --hiddens 32 --batch_size 64 --lr 0.01 --emb_size 250 --epochs 100 --save_appendix component_pin_L6_H32_BS64_LR0.01_E250 --no_val
-----



STDERR:
  File "main.py", line 370, in <module>
    main()
  File "main.py", line 254, in main
    dataset = dataset_class(
  File "/home/philip/projects/ltspice_examples_code_repo/Circuit-Completion-Using-GNNs/component_classification_with_link_prediction_head/evaluation/FEGIN/kernel/circuit_datasets.py", line 15, in __init__
    self.data, self.slices = torch.load(self.processed_paths[0])
  File "/home/philip/.local/lib/python3.8/site-packages/torch/serialization.py", line 1040, in load
    warnings.warn(
  File "/usr/lib/python3.8/warnings.py", line 109, in _showwarnmsg
    sw(msg.message, msg.category, msg.filename, msg.lineno,
  File "main.py", line 47, in warn_with_traceback
    traceback.print_stack(file=log)
/home/philip/projects/ltspice_examples_code_repo/Circuit-Completion-Using-GNNs/component_classification_with_link_prediction_head/evaluation/FEGIN/kernel/circuit_datasets.py:15: FutureWarning: You are using `torch.load` with `weights_only=False` (the current default value), which uses the default pickle module implicitly. It is possible to construct malicious pickle data which will execute arbitrary code during unpickling (See https://github.com/pytorch/pytorch/blob/main/SECURITY.md#untrusted-models for more details). In a future release, the default value for `weights_only` will be flipped to `True`. This limits the functions that could be executed during unpickling. Arbitrary objects will no longer be allowed to be loaded via this mode unless they are explicitly allowlisted by the user via `torch.serialization.add_safe_globals`. We recommend you start setting `weights_only=True` for any use case where you don't have full control of the loaded file. Please open an issue on GitHub for any issues related to this experimental feature.
  self.data, self.slices = torch.load(self.processed_paths[0])
