STDOUT:
Results will be saved in /home/philip/projects/ltspice_examples_code_repo/Circuit-Completion-Using-GNNs/component_classification_with_link_prediction_head/evaluation/FEGIN/results/model_FEGIN_dataset_ltspice_demos
Command line input: python main.py --data ltspice_demos --representation component_pin --model FEGIN --layers 6 --hiddens 32 --batch_size 64 --lr 0.01 --emb_size 250 --epochs 100 --save_appendix component_pin_L6_H32_BS64_LR0.01_E250 --no_val
 is saved.
-----
ltspice_demos - FEGIN
Using 6 layers, 32 hidden units, h = 2
Loading component_pin representation dataset
ENTERED
Training FEGIN on component_pin representation
Train: 1565, Test: 383
##################ITERATION #0 ****************************************
 epoch: 0, train_loss: 1.2604, test_loss: 1.2473, test_f1: 0.3414
 epoch: 1, train_loss: 1.1693, test_loss: 1.2560, test_f1: 0.3367
 epoch: 2, train_loss: 1.0817, test_loss: 1.1671, test_f1: 0.4091
 epoch: 3, train_loss: 0.9199, test_loss: 1.6211, test_f1: 0.3996
 epoch: 4, train_loss: 0.8626, test_loss: 3.3414, test_f1: 0.2599
 epoch: 5, train_loss: 0.8819, test_loss: 0.9997, test_f1: 0.4918
 epoch: 6, train_loss: 0.8124, test_loss: 1.2361, test_f1: 0.3882
 epoch: 7, train_loss: 0.8087, test_loss: 1.0532, test_f1: 0.5580
 epoch: 8, train_loss: 0.7966, test_loss: 1.2871, test_f1: 0.5506
 epoch: 9, train_loss: 0.8291, test_loss: 1.1453, test_f1: 0.4970
 epoch: 10, train_loss: 0.8038, test_loss: 1.1473, test_f1: 0.5231
 epoch: 11, train_loss: 0.7705, test_loss: 0.9831, test_f1: 0.5841
 epoch: 12, train_loss: 0.7867, test_loss: 1.1618, test_f1: 0.5504
 epoch: 13, train_loss: 0.7801, test_loss: 1.0329, test_f1: 0.5301
 epoch: 14, train_loss: 0.7800, test_loss: 1.0087, test_f1: 0.5811
 epoch: 15, train_loss: 0.7692, test_loss: 0.9890, test_f1: 0.5257
 epoch: 16, train_loss: 0.7951, test_loss: 1.0220, test_f1: 0.5539
 epoch: 17, train_loss: 0.7694, test_loss: 0.9660, test_f1: 0.5431
 epoch: 18, train_loss: 0.7793, test_loss: 1.2214, test_f1: 0.3733
 epoch: 19, train_loss: 0.7689, test_loss: 1.0428, test_f1: 0.5152
 epoch: 20, train_loss: 0.7728, test_loss: 0.9280, test_f1: 0.5896
 epoch: 21, train_loss: 0.7906, test_loss: 1.0077, test_f1: 0.5833
 epoch: 22, train_loss: 0.7606, test_loss: 1.0348, test_f1: 0.5927
 epoch: 23, train_loss: 0.7467, test_loss: 1.1049, test_f1: 0.5779
 epoch: 24, train_loss: 0.7595, test_loss: 1.5491, test_f1: 0.5047
 epoch: 25, train_loss: 0.7634, test_loss: 1.0992, test_f1: 0.5647
 epoch: 26, train_loss: 0.7578, test_loss: 1.0229, test_f1: 0.5902
 epoch: 27, train_loss: 0.7774, test_loss: 1.1066, test_f1: 0.4946
 epoch: 28, train_loss: 0.7666, test_loss: 1.0661, test_f1: 0.5854
 epoch: 29, train_loss: 0.7406, test_loss: 1.2752, test_f1: 0.5421
 epoch: 30, train_loss: 0.7344, test_loss: 1.0391, test_f1: 0.6205
 epoch: 31, train_loss: 0.7497, test_loss: 1.2305, test_f1: 0.4360
 epoch: 32, train_loss: 0.7861, test_loss: 1.7385, test_f1: 0.4129
 epoch: 33, train_loss: 0.7387, test_loss: 1.0918, test_f1: 0.6017
 epoch: 34, train_loss: 0.7305, test_loss: 1.0781, test_f1: 0.5643
 epoch: 35, train_loss: 0.7458, test_loss: 0.9451, test_f1: 0.6182
 epoch: 36, train_loss: 0.7386, test_loss: 1.0177, test_f1: 0.5681
 epoch: 37, train_loss: 0.7400, test_loss: 1.1636, test_f1: 0.5383
 epoch: 38, train_loss: 0.7043, test_loss: 1.0078, test_f1: 0.5992
 epoch: 39, train_loss: 0.7143, test_loss: 0.9455, test_f1: 0.5294
 epoch: 40, train_loss: 0.6882, test_loss: 1.4681, test_f1: 0.5081
 epoch: 41, train_loss: 0.7291, test_loss: 1.0794, test_f1: 0.5758
 epoch: 42, train_loss: 0.7181, test_loss: 1.0337, test_f1: 0.5666
 epoch: 43, train_loss: 0.7136, test_loss: 0.9779, test_f1: 0.5818
 epoch: 44, train_loss: 0.6848, test_loss: 1.0179, test_f1: 0.5857
 epoch: 45, train_loss: 0.6887, test_loss: 1.1452, test_f1: 0.5077
 epoch: 46, train_loss: 0.6649, test_loss: 1.3609, test_f1: 0.4308
 epoch: 47, train_loss: 0.7061, test_loss: 1.0086, test_f1: 0.6261
 epoch: 48, train_loss: 0.6849, test_loss: 1.2248, test_f1: 0.5286
 epoch: 49, train_loss: 0.7035, test_loss: 1.3221, test_f1: 0.5324
 epoch: 50, train_loss: 0.6813, test_loss: 1.2879, test_f1: 0.5331
 epoch: 51, train_loss: 0.6276, test_loss: 1.0413, test_f1: 0.6115
 epoch: 52, train_loss: 0.6257, test_loss: 1.0487, test_f1: 0.6102
 epoch: 53, train_loss: 0.6138, test_loss: 1.1803, test_f1: 0.5821
 epoch: 54, train_loss: 0.6140, test_loss: 1.0654, test_f1: 0.5863
 epoch: 55, train_loss: 0.5985, test_loss: 1.1554, test_f1: 0.6040
 epoch: 56, train_loss: 0.6154, test_loss: 1.1337, test_f1: 0.6196
 epoch: 57, train_loss: 0.5737, test_loss: 1.2410, test_f1: 0.6361
 epoch: 58, train_loss: 0.5826, test_loss: 1.3783, test_f1: 0.5969
 epoch: 59, train_loss: 0.6217, test_loss: 1.2662, test_f1: 0.5405
 epoch: 60, train_loss: 0.5802, test_loss: 1.2300, test_f1: 0.5923
 epoch: 61, train_loss: 0.5778, test_loss: 1.0723, test_f1: 0.6242
 epoch: 62, train_loss: 0.5784, test_loss: 1.2954, test_f1: 0.4787
 epoch: 63, train_loss: 0.5791, test_loss: 1.2241, test_f1: 0.6518
 epoch: 64, train_loss: 0.5537, test_loss: 1.3103, test_f1: 0.6192
 epoch: 65, train_loss: 0.5478, test_loss: 1.4397, test_f1: 0.5851
 epoch: 66, train_loss: 0.5519, test_loss: 1.3779, test_f1: 0.6038
 epoch: 67, train_loss: 0.5447, test_loss: 1.4365, test_f1: 0.6081
 epoch: 68, train_loss: 0.5664, test_loss: 1.3087, test_f1: 0.6338
 epoch: 69, train_loss: 0.5941, test_loss: 1.3509, test_f1: 0.5626
 epoch: 70, train_loss: 0.5519, test_loss: 1.1984, test_f1: 0.5947
 epoch: 71, train_loss: 0.5643, test_loss: 1.1237, test_f1: 0.6556
 epoch: 72, train_loss: 0.5678, test_loss: 1.1170, test_f1: 0.6513
 epoch: 73, train_loss: 0.5580, test_loss: 1.1275, test_f1: 0.6025
 epoch: 74, train_loss: 0.5501, test_loss: 1.1220, test_f1: 0.6197
 epoch: 75, train_loss: 0.5639, test_loss: 1.1712, test_f1: 0.6054
 epoch: 76, train_loss: 0.5460, test_loss: 1.8747, test_f1: 0.4273
 epoch: 77, train_loss: 0.5400, test_loss: 1.3145, test_f1: 0.5984
 epoch: 78, train_loss: 0.5280, test_loss: 1.3548, test_f1: 0.5973
 epoch: 79, train_loss: 0.5365, test_loss: 1.2994, test_f1: 0.6071
 epoch: 80, train_loss: 0.5458, test_loss: 1.1432, test_f1: 0.6506
 epoch: 81, train_loss: 0.5156, test_loss: 1.3796, test_f1: 0.5004
 epoch: 82, train_loss: 0.5561, test_loss: 1.4520, test_f1: 0.5833
 epoch: 83, train_loss: 0.5067, test_loss: 1.4970, test_f1: 0.6254
 epoch: 84, train_loss: 0.5348, test_loss: 1.4556, test_f1: 0.6005
 epoch: 85, train_loss: 0.5065, test_loss: 1.3589, test_f1: 0.5878
 epoch: 86, train_loss: 0.5160, test_loss: 1.6203, test_f1: 0.5547
 epoch: 87, train_loss: 0.5212, test_loss: 1.2179, test_f1: 0.6075
 epoch: 88, train_loss: 0.5213, test_loss: 1.3400, test_f1: 0.6170
 epoch: 89, train_loss: 0.5183, test_loss: 1.4918, test_f1: 0.6523
 epoch: 90, train_loss: 0.5167, test_loss: 1.5173, test_f1: 0.6287
 epoch: 91, train_loss: 0.4941, test_loss: 1.7021, test_f1: 0.6476
 epoch: 92, train_loss: 0.4957, test_loss: 1.8185, test_f1: 0.5179
 epoch: 93, train_loss: 0.5051, test_loss: 1.3137, test_f1: 0.6043
 epoch: 94, train_loss: 0.4950, test_loss: 1.4761, test_f1: 0.6286
 epoch: 95, train_loss: 0.5164, test_loss: 1.5824, test_f1: 0.5430
 epoch: 96, train_loss: 0.4877, test_loss: 1.2506, test_f1: 0.6185
 epoch: 97, train_loss: 0.5156, test_loss: 1.3071, test_f1: 0.6356
 epoch: 98, train_loss: 0.4713, test_loss: 1.6358, test_f1: 0.5758
 epoch: 99, train_loss: 0.4735, test_loss: 1.4577, test_f1: 0.5954
##################ITERATION #1 ****************************************
 epoch: 0, train_loss: 1.1680, test_loss: 1.3399, test_f1: 0.2281
 epoch: 1, train_loss: 1.0583, test_loss: 1.2072, test_f1: 0.3334
 epoch: 2, train_loss: 0.9740, test_loss: 1.0876, test_f1: 0.5018
 epoch: 3, train_loss: 0.9258, test_loss: 1.0400, test_f1: 0.5186
 epoch: 4, train_loss: 0.9020, test_loss: 1.1405, test_f1: 0.4239
 epoch: 5, train_loss: 0.8825, test_loss: 0.9740, test_f1: 0.5582
 epoch: 6, train_loss: 0.8906, test_loss: 0.9978, test_f1: 0.4610
 epoch: 7, train_loss: 0.8856, test_loss: 1.0124, test_f1: 0.5354
 epoch: 8, train_loss: 0.8532, test_loss: 1.1251, test_f1: 0.4836
 epoch: 9, train_loss: 0.8499, test_loss: 1.0089, test_f1: 0.5711
 epoch: 10, train_loss: 0.8525, test_loss: 1.0623, test_f1: 0.4798
 epoch: 11, train_loss: 0.8227, test_loss: 1.3288, test_f1: 0.4528
 epoch: 12, train_loss: 0.8156, test_loss: 1.2881, test_f1: 0.4775
 epoch: 13, train_loss: 0.8103, test_loss: 0.9414, test_f1: 0.6163
 epoch: 14, train_loss: 0.8029, test_loss: 1.2912, test_f1: 0.4963
 epoch: 15, train_loss: 0.8247, test_loss: 0.9915, test_f1: 0.5622
 epoch: 16, train_loss: 0.8052, test_loss: 1.4146, test_f1: 0.4589
 epoch: 17, train_loss: 0.8185, test_loss: 0.9275, test_f1: 0.5896
 epoch: 18, train_loss: 0.7681, test_loss: 0.9022, test_f1: 0.5986
 epoch: 19, train_loss: 0.7449, test_loss: 0.9800, test_f1: 0.5118
 epoch: 20, train_loss: 0.7430, test_loss: 1.2140, test_f1: 0.6040
 epoch: 21, train_loss: 0.7299, test_loss: 1.4186, test_f1: 0.5237
 epoch: 22, train_loss: 0.7556, test_loss: 1.0133, test_f1: 0.6238
 epoch: 23, train_loss: 0.7525, test_loss: 1.2725, test_f1: 0.5391
 epoch: 24, train_loss: 0.7551, test_loss: 1.4427, test_f1: 0.5718
 epoch: 25, train_loss: 0.7527, test_loss: 1.2131, test_f1: 0.5116
 epoch: 26, train_loss: 0.7624, test_loss: 1.6035, test_f1: 0.5411
 epoch: 27, train_loss: 0.7288, test_loss: 1.3329, test_f1: 0.4394
 epoch: 28, train_loss: 0.7105, test_loss: 1.2134, test_f1: 0.6038
 epoch: 29, train_loss: 0.7212, test_loss: 1.0915, test_f1: 0.5548
 epoch: 30, train_loss: 0.7113, test_loss: 1.3346, test_f1: 0.5543
 epoch: 31, train_loss: 0.6999, test_loss: 0.9958, test_f1: 0.6123
 epoch: 32, train_loss: 0.6931, test_loss: 1.1136, test_f1: 0.6106
 epoch: 33, train_loss: 0.6872, test_loss: 1.1951, test_f1: 0.5699
 epoch: 34, train_loss: 0.7031, test_loss: 0.9370, test_f1: 0.6323
 epoch: 35, train_loss: 0.6832, test_loss: 1.3068, test_f1: 0.5329
 epoch: 36, train_loss: 0.7118, test_loss: 1.1188, test_f1: 0.5962
 epoch: 37, train_loss: 0.6794, test_loss: 1.3338, test_f1: 0.6123
 epoch: 38, train_loss: 0.6930, test_loss: 1.0879, test_f1: 0.5954
 epoch: 39, train_loss: 0.6713, test_loss: 1.1338, test_f1: 0.5623
 epoch: 40, train_loss: 0.6579, test_loss: 1.0622, test_f1: 0.5519
 epoch: 41, train_loss: 0.6470, test_loss: 1.9409, test_f1: 0.4968
 epoch: 42, train_loss: 0.6633, test_loss: 0.9767, test_f1: 0.6260
 epoch: 43, train_loss: 0.7081, test_loss: 1.0893, test_f1: 0.5876
 epoch: 44, train_loss: 0.6718, test_loss: 0.9422, test_f1: 0.6382
 epoch: 45, train_loss: 0.6483, test_loss: 0.9584, test_f1: 0.6755
 epoch: 46, train_loss: 0.6232, test_loss: 1.2623, test_f1: 0.6202
 epoch: 47, train_loss: 0.6577, test_loss: 1.1485, test_f1: 0.5895
 epoch: 48, train_loss: 0.6459, test_loss: 1.0698, test_f1: 0.6120
 epoch: 49, train_loss: 0.6582, test_loss: 1.0585, test_f1: 0.5705
 epoch: 50, train_loss: 0.6451, test_loss: 1.0904, test_f1: 0.5764
 epoch: 51, train_loss: 0.6234, test_loss: 0.9603, test_f1: 0.6465
 epoch: 52, train_loss: 0.5926, test_loss: 1.0865, test_f1: 0.6533
 epoch: 53, train_loss: 0.5739, test_loss: 1.0700, test_f1: 0.6470
 epoch: 54, train_loss: 0.5850, test_loss: 1.0891, test_f1: 0.6356
 epoch: 55, train_loss: 0.5817, test_loss: 1.1025, test_f1: 0.6440
 epoch: 56, train_loss: 0.5813, test_loss: 1.0310, test_f1: 0.6574
 epoch: 57, train_loss: 0.5520, test_loss: 1.0816, test_f1: 0.6311
 epoch: 58, train_loss: 0.5349, test_loss: 1.0834, test_f1: 0.6672
 epoch: 59, train_loss: 0.5582, test_loss: 1.2577, test_f1: 0.6294
 epoch: 60, train_loss: 0.5695, test_loss: 1.0422, test_f1: 0.6670
 epoch: 61, train_loss: 0.5599, test_loss: 1.1272, test_f1: 0.6493
 epoch: 62, train_loss: 0.5499, test_loss: 1.4714, test_f1: 0.6195
 epoch: 63, train_loss: 0.5394, test_loss: 1.2231, test_f1: 0.6147
 epoch: 64, train_loss: 0.5309, test_loss: 1.2153, test_f1: 0.6492
 epoch: 65, train_loss: 0.5615, test_loss: 1.0368, test_f1: 0.6430
 epoch: 66, train_loss: 0.5344, test_loss: 1.1498, test_f1: 0.6526
 epoch: 67, train_loss: 0.5522, test_loss: 1.2185, test_f1: 0.6489
 epoch: 68, train_loss: 0.5455, test_loss: 1.3504, test_f1: 0.5964
 epoch: 69, train_loss: 0.5476, test_loss: 1.1992, test_f1: 0.6329
 epoch: 70, train_loss: 0.5387, test_loss: 1.8752, test_f1: 0.4494
 epoch: 71, train_loss: 0.5310, test_loss: 1.3033, test_f1: 0.6038
 epoch: 72, train_loss: 0.5288, test_loss: 1.3580, test_f1: 0.6443
 epoch: 73, train_loss: 0.5202, test_loss: 1.3202, test_f1: 0.6180
 epoch: 74, train_loss: 0.5071, test_loss: 1.4040, test_f1: 0.6464
 epoch: 75, train_loss: 0.5181, test_loss: 1.3863, test_f1: 0.6448
 epoch: 76, train_loss: 0.5030, test_loss: 1.2568, test_f1: 0.6144
 epoch: 77, train_loss: 0.5096, test_loss: 1.1574, test_f1: 0.6418
 epoch: 78, train_loss: 0.5258, test_loss: 1.2365, test_f1: 0.6262
 epoch: 79, train_loss: 0.5135, test_loss: 1.2645, test_f1: 0.6235
 epoch: 80, train_loss: 0.5074, test_loss: 1.2832, test_f1: 0.6326
 epoch: 81, train_loss: 0.4898, test_loss: 1.3978, test_f1: 0.6184
 epoch: 82, train_loss: 0.4976, test_loss: 1.1115, test_f1: 0.6461
 epoch: 83, train_loss: 0.5107, test_loss: 1.1305, test_f1: 0.6358
 epoch: 84, train_loss: 0.4958, test_loss: 1.2976, test_f1: 0.5854
 epoch: 85, train_loss: 0.5190, test_loss: 1.2689, test_f1: 0.6060
 epoch: 86, train_loss: 0.5091, test_loss: 1.7307, test_f1: 0.5167
 epoch: 87, train_loss: 0.5078, test_loss: 1.1859, test_f1: 0.6601
 epoch: 88, train_loss: 0.5404, test_loss: 1.2287, test_f1: 0.6577
 epoch: 89, train_loss: 0.4996, test_loss: 1.2335, test_f1: 0.6038
 epoch: 90, train_loss: 0.4958, test_loss: 1.2445, test_f1: 0.6244
 epoch: 91, train_loss: 0.4839, test_loss: 1.3218, test_f1: 0.6202
 epoch: 92, train_loss: 0.4818, test_loss: 1.3584, test_f1: 0.6151
 epoch: 93, train_loss: 0.4514, test_loss: 1.8389, test_f1: 0.5886
 epoch: 94, train_loss: 0.4716, test_loss: 1.5450, test_f1: 0.5322
 epoch: 95, train_loss: 0.4420, test_loss: 1.1951, test_f1: 0.6095
 epoch: 96, train_loss: 0.4681, test_loss: 1.4638, test_f1: 0.6356
 epoch: 97, train_loss: 0.4483, test_loss: 1.4120, test_f1: 0.6434
 epoch: 98, train_loss: 0.5000, test_loss: 1.3128, test_f1: 0.6646
 epoch: 99, train_loss: 0.4575, test_loss: 1.3697, test_f1: 0.6402
##################ITERATION #2 ****************************************
 epoch: 0, train_loss: 1.2162, test_loss: 1.4547, test_f1: 0.1967
 epoch: 1, train_loss: 1.0404, test_loss: 1.3122, test_f1: 0.2803
 epoch: 2, train_loss: 0.9729, test_loss: 1.0634, test_f1: 0.5344
 epoch: 3, train_loss: 0.9424, test_loss: 1.0892, test_f1: 0.4773
 epoch: 4, train_loss: 0.8942, test_loss: 1.0672, test_f1: 0.5161
 epoch: 5, train_loss: 0.8688, test_loss: 1.0727, test_f1: 0.4398
 epoch: 6, train_loss: 0.8684, test_loss: 0.9794, test_f1: 0.5558
 epoch: 7, train_loss: 0.8201, test_loss: 1.1328, test_f1: 0.5579
 epoch: 8, train_loss: 0.8103, test_loss: 0.9840, test_f1: 0.5698
 epoch: 9, train_loss: 0.8286, test_loss: 1.0281, test_f1: 0.4787
 epoch: 10, train_loss: 0.7976, test_loss: 1.1106, test_f1: 0.5949
 epoch: 11, train_loss: 0.7741, test_loss: 1.0900, test_f1: 0.5631
 epoch: 12, train_loss: 0.7662, test_loss: 1.1432, test_f1: 0.5346
 epoch: 13, train_loss: 0.7795, test_loss: 1.0029, test_f1: 0.5600
 epoch: 14, train_loss: 0.8039, test_loss: 1.0403, test_f1: 0.5166
 epoch: 15, train_loss: 0.7854, test_loss: 1.1407, test_f1: 0.4991
 epoch: 16, train_loss: 0.7563, test_loss: 1.3053, test_f1: 0.5044
 epoch: 17, train_loss: 0.7719, test_loss: 1.1024, test_f1: 0.5811
 epoch: 18, train_loss: 0.7642, test_loss: 1.0923, test_f1: 0.5560
 epoch: 19, train_loss: 0.7376, test_loss: 1.0682, test_f1: 0.5629
 epoch: 20, train_loss: 0.7205, test_loss: 1.0786, test_f1: 0.5885
 epoch: 21, train_loss: 0.7266, test_loss: 1.0673, test_f1: 0.5693
 epoch: 22, train_loss: 0.7226, test_loss: 1.0595, test_f1: 0.5929
 epoch: 23, train_loss: 0.7380, test_loss: 1.0491, test_f1: 0.6234
 epoch: 24, train_loss: 0.7190, test_loss: 1.0491, test_f1: 0.6031
 epoch: 25, train_loss: 0.6997, test_loss: 1.4786, test_f1: 0.4787
 epoch: 26, train_loss: 0.6873, test_loss: 1.1342, test_f1: 0.6008
 epoch: 27, train_loss: 0.7247, test_loss: 0.9654, test_f1: 0.5846
 epoch: 28, train_loss: 0.7614, test_loss: 1.1896, test_f1: 0.5218
 epoch: 29, train_loss: 0.6778, test_loss: 1.0790, test_f1: 0.5932
 epoch: 30, train_loss: 0.6725, test_loss: 1.2169, test_f1: 0.5921
 epoch: 31, train_loss: 0.7169, test_loss: 1.0713, test_f1: 0.5665
 epoch: 32, train_loss: 0.7066, test_loss: 1.2340, test_f1: 0.4765
 epoch: 33, train_loss: 0.6836, test_loss: 1.2168, test_f1: 0.6026
 epoch: 34, train_loss: 0.6691, test_loss: 1.1296, test_f1: 0.6111
 epoch: 35, train_loss: 0.6596, test_loss: 1.0629, test_f1: 0.6345
 epoch: 36, train_loss: 0.6586, test_loss: 1.0307, test_f1: 0.6601
 epoch: 37, train_loss: 0.6673, test_loss: 1.2941, test_f1: 0.5345
 epoch: 38, train_loss: 0.6455, test_loss: 1.2141, test_f1: 0.6133
 epoch: 39, train_loss: 0.6525, test_loss: 1.0454, test_f1: 0.6394
 epoch: 40, train_loss: 0.6501, test_loss: 1.5395, test_f1: 0.5363
 epoch: 41, train_loss: 0.6298, test_loss: 1.4760, test_f1: 0.5200
 epoch: 42, train_loss: 0.6470, test_loss: 1.0075, test_f1: 0.5977
 epoch: 43, train_loss: 0.6632, test_loss: 1.0570, test_f1: 0.6107
 epoch: 44, train_loss: 0.6405, test_loss: 2.2092, test_f1: 0.4287
 epoch: 45, train_loss: 0.6546, test_loss: 1.1578, test_f1: 0.5763
 epoch: 46, train_loss: 0.6351, test_loss: 1.1801, test_f1: 0.5787
 epoch: 47, train_loss: 0.6036, test_loss: 1.0958, test_f1: 0.5712
 epoch: 48, train_loss: 0.6336, test_loss: 1.1855, test_f1: 0.6204
 epoch: 49, train_loss: 0.6140, test_loss: 1.2432, test_f1: 0.5416
 epoch: 50, train_loss: 0.6349, test_loss: 1.2849, test_f1: 0.6044
 epoch: 51, train_loss: 0.5828, test_loss: 1.2634, test_f1: 0.6278
 epoch: 52, train_loss: 0.5725, test_loss: 1.2398, test_f1: 0.6603
 epoch: 53, train_loss: 0.5582, test_loss: 1.5270, test_f1: 0.6115
 epoch: 54, train_loss: 0.5701, test_loss: 1.2748, test_f1: 0.6378
 epoch: 55, train_loss: 0.5415, test_loss: 1.3654, test_f1: 0.6156
 epoch: 56, train_loss: 0.5482, test_loss: 1.3751, test_f1: 0.6522
 epoch: 57, train_loss: 0.5381, test_loss: 1.7435, test_f1: 0.6277
 epoch: 58, train_loss: 0.5544, test_loss: 1.3740, test_f1: 0.6411
 epoch: 59, train_loss: 0.5334, test_loss: 1.2108, test_f1: 0.6614
 epoch: 60, train_loss: 0.5232, test_loss: 1.4635, test_f1: 0.5906
 epoch: 61, train_loss: 0.5226, test_loss: 1.5044, test_f1: 0.6337
 epoch: 62, train_loss: 0.5203, test_loss: 1.5118, test_f1: 0.6247
 epoch: 63, train_loss: 0.5029, test_loss: 1.8119, test_f1: 0.6045
 epoch: 64, train_loss: 0.5070, test_loss: 1.3703, test_f1: 0.6388
 epoch: 65, train_loss: 0.5146, test_loss: 1.3340, test_f1: 0.6709
 epoch: 66, train_loss: 0.5296, test_loss: 1.5843, test_f1: 0.6424
 epoch: 67, train_loss: 0.5101, test_loss: 1.9087, test_f1: 0.5623
 epoch: 68, train_loss: 0.4905, test_loss: 1.7453, test_f1: 0.6562
 epoch: 69, train_loss: 0.5014, test_loss: 1.7867, test_f1: 0.5742
 epoch: 70, train_loss: 0.5139, test_loss: 1.6296, test_f1: 0.6390
 epoch: 71, train_loss: 0.4912, test_loss: 1.5500, test_f1: 0.6811
 epoch: 72, train_loss: 0.4765, test_loss: 1.5271, test_f1: 0.5911
 epoch: 73, train_loss: 0.4815, test_loss: 1.7003, test_f1: 0.6444
 epoch: 74, train_loss: 0.4598, test_loss: 1.9115, test_f1: 0.6378
 epoch: 75, train_loss: 0.5227, test_loss: 1.7615, test_f1: 0.6035
 epoch: 76, train_loss: 0.5369, test_loss: 1.7273, test_f1: 0.6407
 epoch: 77, train_loss: 0.5040, test_loss: 1.6031, test_f1: 0.6563
 epoch: 78, train_loss: 0.4976, test_loss: 1.8420, test_f1: 0.6207
 epoch: 79, train_loss: 0.4684, test_loss: 1.8256, test_f1: 0.6202
 epoch: 80, train_loss: 0.4516, test_loss: 1.6450, test_f1: 0.6568
 epoch: 81, train_loss: 0.4570, test_loss: 1.7030, test_f1: 0.6355
 epoch: 82, train_loss: 0.4658, test_loss: 1.6774, test_f1: 0.6789
 epoch: 83, train_loss: 0.4578, test_loss: 1.4772, test_f1: 0.6325
 epoch: 84, train_loss: 0.4761, test_loss: 1.9286, test_f1: 0.6318
 epoch: 85, train_loss: 0.4619, test_loss: 1.4925, test_f1: 0.6691
 epoch: 86, train_loss: 0.4513, test_loss: 1.9241, test_f1: 0.6444
 epoch: 87, train_loss: 0.4451, test_loss: 1.6961, test_f1: 0.6846
 epoch: 88, train_loss: 0.4376, test_loss: 1.5243, test_f1: 0.6536
 epoch: 89, train_loss: 0.4322, test_loss: 1.7913, test_f1: 0.6339
 epoch: 90, train_loss: 0.4312, test_loss: 2.2587, test_f1: 0.6168
 epoch: 91, train_loss: 0.4422, test_loss: 1.4727, test_f1: 0.6695
 epoch: 92, train_loss: 0.4428, test_loss: 2.1991, test_f1: 0.5819
 epoch: 93, train_loss: 0.4612, test_loss: 1.9159, test_f1: 0.6760
 epoch: 94, train_loss: 0.4414, test_loss: 1.8392, test_f1: 0.6125
 epoch: 95, train_loss: 0.4576, test_loss: 3.4416, test_f1: 0.5632
 epoch: 96, train_loss: 0.4872, test_loss: 1.7935, test_f1: 0.6255
 epoch: 97, train_loss: 0.4311, test_loss: 1.8158, test_f1: 0.5765
 epoch: 98, train_loss: 0.4082, test_loss: 1.7822, test_f1: 0.6318
 epoch: 99, train_loss: 0.4114, test_loss: 1.7248, test_f1: 0.6400
##################ITERATION #3 ****************************************
 epoch: 0, train_loss: 1.2222, test_loss: 1.2618, test_f1: 0.3479
 epoch: 1, train_loss: 1.0033, test_loss: 1.0124, test_f1: 0.5269
 epoch: 2, train_loss: 0.9330, test_loss: 0.9636, test_f1: 0.5393
 epoch: 3, train_loss: 0.9180, test_loss: 1.0498, test_f1: 0.4894
 epoch: 4, train_loss: 0.9155, test_loss: 1.0420, test_f1: 0.5543
 epoch: 5, train_loss: 0.8914, test_loss: 1.0513, test_f1: 0.5579
 epoch: 6, train_loss: 0.8504, test_loss: 0.9803, test_f1: 0.5503
 epoch: 7, train_loss: 0.8238, test_loss: 0.9766, test_f1: 0.5503
 epoch: 8, train_loss: 0.8179, test_loss: 1.1485, test_f1: 0.4643
 epoch: 9, train_loss: 0.8251, test_loss: 1.0814, test_f1: 0.5113
 epoch: 10, train_loss: 0.7981, test_loss: 1.0818, test_f1: 0.5460
 epoch: 11, train_loss: 0.7708, test_loss: 1.1086, test_f1: 0.5366
 epoch: 12, train_loss: 0.7603, test_loss: 1.1265, test_f1: 0.5013
 epoch: 13, train_loss: 0.7675, test_loss: 1.2295, test_f1: 0.5409
 epoch: 14, train_loss: 0.7512, test_loss: 1.0303, test_f1: 0.5517
 epoch: 15, train_loss: 0.7287, test_loss: 1.4228, test_f1: 0.5305
 epoch: 16, train_loss: 0.7543, test_loss: 0.9651, test_f1: 0.5814
 epoch: 17, train_loss: 0.7279, test_loss: 1.0792, test_f1: 0.5140
 epoch: 18, train_loss: 0.7545, test_loss: 1.1304, test_f1: 0.5513
 epoch: 19, train_loss: 0.7295, test_loss: 1.6301, test_f1: 0.4667
 epoch: 20, train_loss: 0.7267, test_loss: 1.0506, test_f1: 0.5432
 epoch: 21, train_loss: 0.7309, test_loss: 1.0070, test_f1: 0.6143
 epoch: 22, train_loss: 0.7036, test_loss: 1.1236, test_f1: 0.5832
 epoch: 23, train_loss: 0.6927, test_loss: 1.0799, test_f1: 0.5806
 epoch: 24, train_loss: 0.6941, test_loss: 1.0933, test_f1: 0.5801
 epoch: 25, train_loss: 0.6935, test_loss: 1.1451, test_f1: 0.5444
 epoch: 26, train_loss: 0.6899, test_loss: 1.1790, test_f1: 0.5113
 epoch: 27, train_loss: 0.6817, test_loss: 1.2488, test_f1: 0.5191
 epoch: 28, train_loss: 0.7058, test_loss: 0.9916, test_f1: 0.5590
 epoch: 29, train_loss: 0.6639, test_loss: 1.0310, test_f1: 0.5785
 epoch: 30, train_loss: 0.6629, test_loss: 0.9855, test_f1: 0.6330
 epoch: 31, train_loss: 0.6679, test_loss: 0.9445, test_f1: 0.6423
 epoch: 32, train_loss: 0.6557, test_loss: 1.1416, test_f1: 0.6005
 epoch: 33, train_loss: 0.6620, test_loss: 1.4687, test_f1: 0.5282
 epoch: 34, train_loss: 0.6767, test_loss: 0.9366, test_f1: 0.5865
 epoch: 35, train_loss: 0.6696, test_loss: 1.2814, test_f1: 0.5773
 epoch: 36, train_loss: 0.6551, test_loss: 1.4676, test_f1: 0.5365
 epoch: 37, train_loss: 0.6366, test_loss: 1.1863, test_f1: 0.5544
 epoch: 38, train_loss: 0.6483, test_loss: 1.4766, test_f1: 0.5508
 epoch: 39, train_loss: 0.6443, test_loss: 1.1684, test_f1: 0.6015
 epoch: 40, train_loss: 0.6661, test_loss: 1.3480, test_f1: 0.5614
 epoch: 41, train_loss: 0.6642, test_loss: 1.4378, test_f1: 0.5803
 epoch: 42, train_loss: 0.6316, test_loss: 1.0568, test_f1: 0.5829
 epoch: 43, train_loss: 0.6359, test_loss: 1.1924, test_f1: 0.6093
 epoch: 44, train_loss: 0.6586, test_loss: 1.3609, test_f1: 0.4800
 epoch: 45, train_loss: 0.6442, test_loss: 1.0156, test_f1: 0.6483
 epoch: 46, train_loss: 0.6252, test_loss: 1.3258, test_f1: 0.5883
 epoch: 47, train_loss: 0.6316, test_loss: 1.1937, test_f1: 0.6434
 epoch: 48, train_loss: 0.6018, test_loss: 1.2683, test_f1: 0.5703
 epoch: 49, train_loss: 0.5915, test_loss: 1.0408, test_f1: 0.5883
 epoch: 50, train_loss: 0.5998, test_loss: 1.2870, test_f1: 0.5910
 epoch: 51, train_loss: 0.5867, test_loss: 1.2597, test_f1: 0.5923
 epoch: 52, train_loss: 0.5319, test_loss: 1.2942, test_f1: 0.6104
 epoch: 53, train_loss: 0.5464, test_loss: 1.2769, test_f1: 0.5812
 epoch: 54, train_loss: 0.5550, test_loss: 1.2527, test_f1: 0.6254
 epoch: 55, train_loss: 0.5442, test_loss: 1.5456, test_f1: 0.5852
 epoch: 56, train_loss: 0.5239, test_loss: 1.5509, test_f1: 0.5969
 epoch: 57, train_loss: 0.5098, test_loss: 1.2266, test_f1: 0.5835
 epoch: 58, train_loss: 0.5201, test_loss: 1.2802, test_f1: 0.6504
 epoch: 59, train_loss: 0.5285, test_loss: 1.5305, test_f1: 0.5783
 epoch: 60, train_loss: 0.5268, test_loss: 1.5066, test_f1: 0.6066
 epoch: 61, train_loss: 0.5437, test_loss: 1.0760, test_f1: 0.6492
 epoch: 62, train_loss: 0.5185, test_loss: 1.6795, test_f1: 0.5512
 epoch: 63, train_loss: 0.5010, test_loss: 1.3994, test_f1: 0.5908
 epoch: 64, train_loss: 0.5120, test_loss: 1.4419, test_f1: 0.5747
 epoch: 65, train_loss: 0.4875, test_loss: 1.2154, test_f1: 0.6471
 epoch: 66, train_loss: 0.4940, test_loss: 1.3733, test_f1: 0.6273
 epoch: 67, train_loss: 0.4914, test_loss: 1.3434, test_f1: 0.5874
 epoch: 68, train_loss: 0.4740, test_loss: 1.4823, test_f1: 0.5972
 epoch: 69, train_loss: 0.4854, test_loss: 1.5083, test_f1: 0.5829
 epoch: 70, train_loss: 0.4924, test_loss: 1.3952, test_f1: 0.6322
 epoch: 71, train_loss: 0.4870, test_loss: 1.5326, test_f1: 0.6299
 epoch: 72, train_loss: 0.4744, test_loss: 1.3502, test_f1: 0.6313
 epoch: 73, train_loss: 0.4876, test_loss: 1.4046, test_f1: 0.6202
 epoch: 74, train_loss: 0.5265, test_loss: 1.1465, test_f1: 0.5996
 epoch: 75, train_loss: 0.4882, test_loss: 1.6274, test_f1: 0.5691
 epoch: 76, train_loss: 0.4869, test_loss: 1.4166, test_f1: 0.5800
 epoch: 77, train_loss: 0.4512, test_loss: 1.5381, test_f1: 0.5942
 epoch: 78, train_loss: 0.5057, test_loss: 1.5104, test_f1: 0.6005
 epoch: 79, train_loss: 0.4792, test_loss: 1.1810, test_f1: 0.6688
 epoch: 80, train_loss: 0.4539, test_loss: 1.3041, test_f1: 0.5929
 epoch: 81, train_loss: 0.4528, test_loss: 1.4481, test_f1: 0.5803
 epoch: 82, train_loss: 0.4345, test_loss: 1.3803, test_f1: 0.5828
 epoch: 83, train_loss: 0.4551, test_loss: 1.7677, test_f1: 0.5744
 epoch: 84, train_loss: 0.4320, test_loss: 1.2440, test_f1: 0.6064
 epoch: 85, train_loss: 0.4334, test_loss: 1.4894, test_f1: 0.6116
 epoch: 86, train_loss: 0.4435, test_loss: 1.5553, test_f1: 0.5673
 epoch: 87, train_loss: 0.4174, test_loss: 1.7123, test_f1: 0.5890
 epoch: 88, train_loss: 0.4448, test_loss: 1.3080, test_f1: 0.6434
 epoch: 89, train_loss: 0.4451, test_loss: 1.5538, test_f1: 0.5556
 epoch: 90, train_loss: 0.4543, test_loss: 1.1964, test_f1: 0.5911
 epoch: 91, train_loss: 0.4353, test_loss: 1.0649, test_f1: 0.6681
 epoch: 92, train_loss: 0.4334, test_loss: 1.3547, test_f1: 0.5774
 epoch: 93, train_loss: 0.4107, test_loss: 1.8521, test_f1: 0.5910
 epoch: 94, train_loss: 0.4019, test_loss: 1.5442, test_f1: 0.5829
 epoch: 95, train_loss: 0.4192, test_loss: 1.7591, test_f1: 0.5607
 epoch: 96, train_loss: 0.4506, test_loss: 1.4495, test_f1: 0.5961
 epoch: 97, train_loss: 0.3886, test_loss: 1.4883, test_f1: 0.6027
 epoch: 98, train_loss: 0.3979, test_loss: 1.7179, test_f1: 0.5912
 epoch: 99, train_loss: 0.4027, test_loss: 1.4493, test_f1: 0.6105
##################ITERATION #4 ****************************************
 epoch: 0, train_loss: 1.1852, test_loss: 1.4980, test_f1: 0.1625
 epoch: 1, train_loss: 0.9761, test_loss: 1.1320, test_f1: 0.4803
 epoch: 2, train_loss: 0.9141, test_loss: 1.4730, test_f1: 0.4171
 epoch: 3, train_loss: 0.8543, test_loss: 1.0060, test_f1: 0.5042
 epoch: 4, train_loss: 0.8767, test_loss: 1.0092, test_f1: 0.5317
 epoch: 5, train_loss: 0.8461, test_loss: 1.0720, test_f1: 0.4723
 epoch: 6, train_loss: 0.8601, test_loss: 1.0404, test_f1: 0.4789
 epoch: 7, train_loss: 0.8596, test_loss: 0.9475, test_f1: 0.5214
 epoch: 8, train_loss: 0.8172, test_loss: 0.9953, test_f1: 0.5003
 epoch: 9, train_loss: 0.7984, test_loss: 0.9475, test_f1: 0.5579
 epoch: 10, train_loss: 0.7873, test_loss: 0.9713, test_f1: 0.4999
 epoch: 11, train_loss: 0.8185, test_loss: 0.9707, test_f1: 0.5322
 epoch: 12, train_loss: 0.7856, test_loss: 1.5933, test_f1: 0.3902
 epoch: 13, train_loss: 0.8151, test_loss: 0.9159, test_f1: 0.5527
 epoch: 14, train_loss: 0.7842, test_loss: 1.1283, test_f1: 0.5080
 epoch: 15, train_loss: 0.7778, test_loss: 0.9743, test_f1: 0.6104
 epoch: 16, train_loss: 0.8017, test_loss: 1.1126, test_f1: 0.5257
 epoch: 17, train_loss: 0.7535, test_loss: 0.9510, test_f1: 0.5906
 epoch: 18, train_loss: 0.7789, test_loss: 1.1369, test_f1: 0.4915
 epoch: 19, train_loss: 0.7880, test_loss: 0.9866, test_f1: 0.5144
 epoch: 20, train_loss: 0.7399, test_loss: 1.0157, test_f1: 0.5335
 epoch: 21, train_loss: 0.7400, test_loss: 1.0975, test_f1: 0.5582
 epoch: 22, train_loss: 0.7386, test_loss: 0.9760, test_f1: 0.5651
 epoch: 23, train_loss: 0.7583, test_loss: 1.1075, test_f1: 0.5345
 epoch: 24, train_loss: 0.7669, test_loss: 1.2591, test_f1: 0.4686
 epoch: 25, train_loss: 0.7369, test_loss: 1.2178, test_f1: 0.4969
 epoch: 26, train_loss: 0.7101, test_loss: 0.9790, test_f1: 0.5799
 epoch: 27, train_loss: 0.7457, test_loss: 0.9743, test_f1: 0.6308
 epoch: 28, train_loss: 0.7112, test_loss: 1.0400, test_f1: 0.5746
 epoch: 29, train_loss: 0.7041, test_loss: 1.0263, test_f1: 0.6027
 epoch: 30, train_loss: 0.7186, test_loss: 1.1786, test_f1: 0.5375
 epoch: 31, train_loss: 0.7230, test_loss: 1.0196, test_f1: 0.5556
 epoch: 32, train_loss: 0.7187, test_loss: 1.0217, test_f1: 0.5147
 epoch: 33, train_loss: 0.7303, test_loss: 1.0917, test_f1: 0.4549
 epoch: 34, train_loss: 0.7083, test_loss: 1.0675, test_f1: 0.5974
 epoch: 35, train_loss: 0.6966, test_loss: 1.1259, test_f1: 0.5861
 epoch: 36, train_loss: 0.6965, test_loss: 1.0036, test_f1: 0.6126
 epoch: 37, train_loss: 0.6887, test_loss: 1.0362, test_f1: 0.5796
 epoch: 38, train_loss: 0.7107, test_loss: 1.0154, test_f1: 0.6191
 epoch: 39, train_loss: 0.7041, test_loss: 0.9736, test_f1: 0.5886
 epoch: 40, train_loss: 0.6700, test_loss: 1.5619, test_f1: 0.4828
 epoch: 41, train_loss: 0.6803, test_loss: 1.1436, test_f1: 0.4496
 epoch: 42, train_loss: 0.7092, test_loss: 1.0516, test_f1: 0.6013
 epoch: 43, train_loss: 0.6529, test_loss: 1.1527, test_f1: 0.6095
 epoch: 44, train_loss: 0.6820, test_loss: 1.2733, test_f1: 0.4486
 epoch: 45, train_loss: 0.6762, test_loss: 1.5517, test_f1: 0.4837
 epoch: 46, train_loss: 0.6719, test_loss: 1.0717, test_f1: 0.5775
 epoch: 47, train_loss: 0.6382, test_loss: 0.9901, test_f1: 0.5950
 epoch: 48, train_loss: 0.6403, test_loss: 1.1388, test_f1: 0.6223
 epoch: 49, train_loss: 0.6514, test_loss: 1.0218, test_f1: 0.6045
 epoch: 50, train_loss: 0.6197, test_loss: 1.0513, test_f1: 0.6333
 epoch: 51, train_loss: 0.6177, test_loss: 1.0428, test_f1: 0.6447
 epoch: 52, train_loss: 0.5999, test_loss: 1.1574, test_f1: 0.6131
 epoch: 53, train_loss: 0.5643, test_loss: 1.0938, test_f1: 0.6661
 epoch: 54, train_loss: 0.5632, test_loss: 1.2148, test_f1: 0.6125
 epoch: 55, train_loss: 0.5711, test_loss: 0.9471, test_f1: 0.6626
 epoch: 56, train_loss: 0.5870, test_loss: 1.1840, test_f1: 0.6000
 epoch: 57, train_loss: 0.5706, test_loss: 1.0572, test_f1: 0.6696
 epoch: 58, train_loss: 0.5665, test_loss: 1.2780, test_f1: 0.5654
 epoch: 59, train_loss: 0.5737, test_loss: 1.1713, test_f1: 0.6354
 epoch: 60, train_loss: 0.5723, test_loss: 1.3809, test_f1: 0.5574
 epoch: 61, train_loss: 0.5545, test_loss: 1.2044, test_f1: 0.6221
 epoch: 62, train_loss: 0.5839, test_loss: 1.1769, test_f1: 0.6716
 epoch: 63, train_loss: 0.5815, test_loss: 1.3991, test_f1: 0.6111
 epoch: 64, train_loss: 0.5787, test_loss: 1.1367, test_f1: 0.6251
 epoch: 65, train_loss: 0.5339, test_loss: 1.1229, test_f1: 0.6469
 epoch: 66, train_loss: 0.5442, test_loss: 1.1620, test_f1: 0.6377
 epoch: 67, train_loss: 0.5533, test_loss: 1.1797, test_f1: 0.6254
 epoch: 68, train_loss: 0.5589, test_loss: 1.1748, test_f1: 0.6187
 epoch: 69, train_loss: 0.5524, test_loss: 1.3713, test_f1: 0.6312
 epoch: 70, train_loss: 0.5345, test_loss: 1.1693, test_f1: 0.6218
 epoch: 71, train_loss: 0.5428, test_loss: 1.2717, test_f1: 0.6217
 epoch: 72, train_loss: 0.5251, test_loss: 1.1801, test_f1: 0.6529
 epoch: 73, train_loss: 0.5287, test_loss: 1.2104, test_f1: 0.6605
 epoch: 74, train_loss: 0.5149, test_loss: 1.3211, test_f1: 0.6437
 epoch: 75, train_loss: 0.5151, test_loss: 1.3906, test_f1: 0.6177
 epoch: 76, train_loss: 0.5141, test_loss: 1.4113, test_f1: 0.5495
 epoch: 77, train_loss: 0.5101, test_loss: 1.3163, test_f1: 0.6154
 epoch: 78, train_loss: 0.5266, test_loss: 1.3084, test_f1: 0.6041
 epoch: 79, train_loss: 0.5257, test_loss: 1.1528, test_f1: 0.6597
 epoch: 80, train_loss: 0.5089, test_loss: 1.2388, test_f1: 0.6569
 epoch: 81, train_loss: 0.5058, test_loss: 1.4069, test_f1: 0.6144
 epoch: 82, train_loss: 0.5000, test_loss: 1.5077, test_f1: 0.6043
 epoch: 83, train_loss: 0.5037, test_loss: 1.3182, test_f1: 0.6638
 epoch: 84, train_loss: 0.4748, test_loss: 1.5403, test_f1: 0.6605
 epoch: 85, train_loss: 0.5005, test_loss: 1.3018, test_f1: 0.6402
 epoch: 86, train_loss: 0.4924, test_loss: 1.8330, test_f1: 0.6446
 epoch: 87, train_loss: 0.4738, test_loss: 1.3691, test_f1: 0.6665
 epoch: 88, train_loss: 0.4839, test_loss: 1.4601, test_f1: 0.6418
 epoch: 89, train_loss: 0.4852, test_loss: 1.5910, test_f1: 0.6335
 epoch: 90, train_loss: 0.5373, test_loss: 2.1847, test_f1: 0.4477
 epoch: 91, train_loss: 0.5815, test_loss: 1.1994, test_f1: 0.6284
 epoch: 92, train_loss: 0.5156, test_loss: 1.5755, test_f1: 0.6241
 epoch: 93, train_loss: 0.5483, test_loss: 1.4091, test_f1: 0.6366
 epoch: 94, train_loss: 0.4982, test_loss: 1.4341, test_f1: 0.6374
 epoch: 95, train_loss: 0.4905, test_loss: 1.4156, test_f1: 0.6366
 epoch: 96, train_loss: 0.5011, test_loss: 1.4693, test_f1: 0.6379
 epoch: 97, train_loss: 0.4418, test_loss: 1.6656, test_f1: 0.6648
 epoch: 98, train_loss: 0.4824, test_loss: 1.2273, test_f1: 0.6749
 epoch: 99, train_loss: 0.5008, test_loss: 1.5611, test_f1: 0.6269
##################ITERATION #5 ****************************************
 epoch: 0, train_loss: 1.1895, test_loss: 1.2266, test_f1: 0.3726
 epoch: 1, train_loss: 1.0212, test_loss: 1.1341, test_f1: 0.3906
 epoch: 2, train_loss: 0.9950, test_loss: 1.0730, test_f1: 0.4275
 epoch: 3, train_loss: 0.9622, test_loss: 1.0471, test_f1: 0.4906
 epoch: 4, train_loss: 0.9555, test_loss: 1.1311, test_f1: 0.4586
 epoch: 5, train_loss: 0.9495, test_loss: 1.0341, test_f1: 0.5037
 epoch: 6, train_loss: 0.9367, test_loss: 1.0922, test_f1: 0.4756
 epoch: 7, train_loss: 0.9187, test_loss: 1.0517, test_f1: 0.5330
 epoch: 8, train_loss: 0.9140, test_loss: 1.0030, test_f1: 0.5297
 epoch: 9, train_loss: 0.8742, test_loss: 1.0864, test_f1: 0.4640
 epoch: 10, train_loss: 0.8724, test_loss: 1.2978, test_f1: 0.4055
 epoch: 11, train_loss: 0.8768, test_loss: 1.1772, test_f1: 0.5229
 epoch: 12, train_loss: 0.8327, test_loss: 1.0468, test_f1: 0.5122
 epoch: 13, train_loss: 0.8247, test_loss: 1.1048, test_f1: 0.5207
 epoch: 14, train_loss: 0.8032, test_loss: 1.0913, test_f1: 0.5559
 epoch: 15, train_loss: 0.8182, test_loss: 1.1036, test_f1: 0.5536
 epoch: 16, train_loss: 0.7992, test_loss: 2.6878, test_f1: 0.3913
 epoch: 17, train_loss: 0.8515, test_loss: 1.0598, test_f1: 0.5585
 epoch: 18, train_loss: 0.8371, test_loss: 1.0354, test_f1: 0.5530
 epoch: 19, train_loss: 0.7773, test_loss: 1.1315, test_f1: 0.5519
 epoch: 20, train_loss: 0.7477, test_loss: 1.0843, test_f1: 0.4577
 epoch: 21, train_loss: 0.7664, test_loss: 1.2711, test_f1: 0.5783
 epoch: 22, train_loss: 0.7713, test_loss: 0.9841, test_f1: 0.5476
 epoch: 23, train_loss: 0.7593, test_loss: 1.0257, test_f1: 0.5811
 epoch: 24, train_loss: 0.7599, test_loss: 1.0797, test_f1: 0.5948
 epoch: 25, train_loss: 0.7611, test_loss: 1.3330, test_f1: 0.5369
 epoch: 26, train_loss: 0.7472, test_loss: 1.1444, test_f1: 0.5669
 epoch: 27, train_loss: 0.7424, test_loss: 1.3107, test_f1: 0.5127
 epoch: 28, train_loss: 0.7818, test_loss: 1.2218, test_f1: 0.4187
 epoch: 29, train_loss: 0.7557, test_loss: 1.2927, test_f1: 0.5719
 epoch: 30, train_loss: 0.7546, test_loss: 1.3468, test_f1: 0.5353
 epoch: 31, train_loss: 0.7485, test_loss: 1.1961, test_f1: 0.5700
 epoch: 32, train_loss: 0.7371, test_loss: 0.9649, test_f1: 0.5665
 epoch: 33, train_loss: 0.7369, test_loss: 1.1215, test_f1: 0.5517
 epoch: 34, train_loss: 0.7372, test_loss: 0.9693, test_f1: 0.6461
 epoch: 35, train_loss: 0.7228, test_loss: 1.0464, test_f1: 0.5620
 epoch: 36, train_loss: 0.7288, test_loss: 0.9644, test_f1: 0.6315
 epoch: 37, train_loss: 0.7214, test_loss: 1.1630, test_f1: 0.5470
 epoch: 38, train_loss: 0.7402, test_loss: 0.9414, test_f1: 0.6109
 epoch: 39, train_loss: 0.7144, test_loss: 1.0608, test_f1: 0.6027
 epoch: 40, train_loss: 0.7017, test_loss: 1.2476, test_f1: 0.5640
 epoch: 41, train_loss: 0.7034, test_loss: 1.1383, test_f1: 0.5566
 epoch: 42, train_loss: 0.6921, test_loss: 0.9638, test_f1: 0.6322
 epoch: 43, train_loss: 0.7132, test_loss: 1.0169, test_f1: 0.6325
 epoch: 44, train_loss: 0.6969, test_loss: 1.1379, test_f1: 0.6169
 epoch: 45, train_loss: 0.6787, test_loss: 0.9805, test_f1: 0.6371
 epoch: 46, train_loss: 0.6929, test_loss: 1.1152, test_f1: 0.5322
 epoch: 47, train_loss: 0.6698, test_loss: 1.1324, test_f1: 0.5838
 epoch: 48, train_loss: 0.6649, test_loss: 0.9660, test_f1: 0.6278
 epoch: 49, train_loss: 0.6415, test_loss: 1.0666, test_f1: 0.6276
 epoch: 50, train_loss: 0.6836, test_loss: 1.1539, test_f1: 0.5629
 epoch: 51, train_loss: 0.6503, test_loss: 1.1090, test_f1: 0.6256
 epoch: 52, train_loss: 0.6236, test_loss: 1.2808, test_f1: 0.6299
 epoch: 53, train_loss: 0.6097, test_loss: 1.1542, test_f1: 0.6503
 epoch: 54, train_loss: 0.6203, test_loss: 1.2337, test_f1: 0.6335
 epoch: 55, train_loss: 0.5880, test_loss: 1.3389, test_f1: 0.5995
 epoch: 56, train_loss: 0.5871, test_loss: 1.2142, test_f1: 0.6354
 epoch: 57, train_loss: 0.6117, test_loss: 1.1097, test_f1: 0.6591
 epoch: 58, train_loss: 0.6203, test_loss: 1.1356, test_f1: 0.6481
 epoch: 59, train_loss: 0.6035, test_loss: 1.0238, test_f1: 0.6607
 epoch: 60, train_loss: 0.6066, test_loss: 1.0797, test_f1: 0.6801
 epoch: 61, train_loss: 0.5802, test_loss: 1.1372, test_f1: 0.6398
 epoch: 62, train_loss: 0.5732, test_loss: 1.3871, test_f1: 0.6002
 epoch: 63, train_loss: 0.5783, test_loss: 1.2849, test_f1: 0.6222
 epoch: 64, train_loss: 0.5879, test_loss: 1.0831, test_f1: 0.6562
 epoch: 65, train_loss: 0.5652, test_loss: 1.3209, test_f1: 0.6585
 epoch: 66, train_loss: 0.5487, test_loss: 1.0827, test_f1: 0.6702
 epoch: 67, train_loss: 0.5652, test_loss: 1.4603, test_f1: 0.6195
 epoch: 68, train_loss: 0.5653, test_loss: 1.1586, test_f1: 0.6494
 epoch: 69, train_loss: 0.5472, test_loss: 1.1463, test_f1: 0.6482
 epoch: 70, train_loss: 0.5467, test_loss: 1.0476, test_f1: 0.6813
 epoch: 71, train_loss: 0.5395, test_loss: 1.3567, test_f1: 0.6373
 epoch: 72, train_loss: 0.5443, test_loss: 1.4073, test_f1: 0.6269
 epoch: 73, train_loss: 0.5157, test_loss: 1.3566, test_f1: 0.6680
 epoch: 74, train_loss: 0.5439, test_loss: 1.1929, test_f1: 0.6904
 epoch: 75, train_loss: 0.5324, test_loss: 1.1821, test_f1: 0.6589
 epoch: 76, train_loss: 0.5429, test_loss: 1.4123, test_f1: 0.6585
 epoch: 77, train_loss: 0.5478, test_loss: 1.3962, test_f1: 0.6076
 epoch: 78, train_loss: 0.5376, test_loss: 1.1873, test_f1: 0.5979
 epoch: 79, train_loss: 0.5421, test_loss: 1.1788, test_f1: 0.6353
 epoch: 80, train_loss: 0.5279, test_loss: 1.4352, test_f1: 0.5762
 epoch: 81, train_loss: 0.5247, test_loss: 1.1795, test_f1: 0.6629
 epoch: 82, train_loss: 0.5785, test_loss: 1.2499, test_f1: 0.6465
 epoch: 83, train_loss: 0.5466, test_loss: 1.4046, test_f1: 0.5964
 epoch: 84, train_loss: 0.4911, test_loss: 1.2599, test_f1: 0.6577
 epoch: 85, train_loss: 0.4905, test_loss: 1.2509, test_f1: 0.6730
 epoch: 86, train_loss: 0.4815, test_loss: 1.5886, test_f1: 0.5989
 epoch: 87, train_loss: 0.5115, test_loss: 1.3572, test_f1: 0.6691
 epoch: 88, train_loss: 0.5146, test_loss: 1.3706, test_f1: 0.6575
 epoch: 89, train_loss: 0.4879, test_loss: 1.3476, test_f1: 0.6746
 epoch: 90, train_loss: 0.4974, test_loss: 1.4717, test_f1: 0.6279
 epoch: 91, train_loss: 0.4957, test_loss: 1.5487, test_f1: 0.6443
 epoch: 92, train_loss: 0.5237, test_loss: 1.2447, test_f1: 0.6516
 epoch: 93, train_loss: 0.5300, test_loss: 1.3906, test_f1: 0.6423
 epoch: 94, train_loss: 0.5261, test_loss: 1.2990, test_f1: 0.6882
 epoch: 95, train_loss: 0.5056, test_loss: 1.3489, test_f1: 0.6263
 epoch: 96, train_loss: 0.5109, test_loss: 1.3063, test_f1: 0.6211
 epoch: 97, train_loss: 0.5157, test_loss: 1.2889, test_f1: 0.6377
 epoch: 98, train_loss: 0.4847, test_loss: 1.4810, test_f1: 0.6332
 epoch: 99, train_loss: 0.4416, test_loss: 1.4401, test_f1: 0.6220
##################ITERATION #6 ****************************************
 epoch: 0, train_loss: 1.2507, test_loss: 1.4608, test_f1: 0.3359
 epoch: 1, train_loss: 1.0487, test_loss: 1.1790, test_f1: 0.4605
 epoch: 2, train_loss: 0.9718, test_loss: 1.0766, test_f1: 0.4675
 epoch: 3, train_loss: 0.9348, test_loss: 1.0244, test_f1: 0.5624
 epoch: 4, train_loss: 0.9023, test_loss: 0.9805, test_f1: 0.5227
 epoch: 5, train_loss: 0.9005, test_loss: 1.2311, test_f1: 0.4709
 epoch: 6, train_loss: 0.8637, test_loss: 0.9595, test_f1: 0.5967
 epoch: 7, train_loss: 0.8578, test_loss: 1.0614, test_f1: 0.4477
 epoch: 8, train_loss: 0.8435, test_loss: 0.9847, test_f1: 0.5903
 epoch: 9, train_loss: 0.8226, test_loss: 0.9319, test_f1: 0.6184
 epoch: 10, train_loss: 0.8065, test_loss: 0.9220, test_f1: 0.6100
 epoch: 11, train_loss: 0.8054, test_loss: 0.9715, test_f1: 0.5993
 epoch: 12, train_loss: 0.7875, test_loss: 0.9431, test_f1: 0.6042
 epoch: 13, train_loss: 0.7970, test_loss: 1.1754, test_f1: 0.4823
 epoch: 14, train_loss: 0.7587, test_loss: 1.0587, test_f1: 0.5792
 epoch: 15, train_loss: 0.7436, test_loss: 1.6825, test_f1: 0.4254
 epoch: 16, train_loss: 0.7366, test_loss: 1.0245, test_f1: 0.6098
 epoch: 17, train_loss: 0.7468, test_loss: 0.9774, test_f1: 0.5730
 epoch: 18, train_loss: 0.7854, test_loss: 1.4534, test_f1: 0.4306
 epoch: 19, train_loss: 0.7505, test_loss: 1.2876, test_f1: 0.4657
 epoch: 20, train_loss: 0.7377, test_loss: 1.0621, test_f1: 0.5276
 epoch: 21, train_loss: 0.7263, test_loss: 1.2206, test_f1: 0.4929
 epoch: 22, train_loss: 0.7145, test_loss: 0.9369, test_f1: 0.5631
 epoch: 23, train_loss: 0.7013, test_loss: 2.3787, test_f1: 0.3413
 epoch: 24, train_loss: 0.6998, test_loss: 1.1827, test_f1: 0.5123
 epoch: 25, train_loss: 0.6764, test_loss: 1.0640, test_f1: 0.5787
 epoch: 26, train_loss: 0.7091, test_loss: 1.3936, test_f1: 0.4520
 epoch: 27, train_loss: 0.7153, test_loss: 1.1077, test_f1: 0.5166
 epoch: 28, train_loss: 0.6776, test_loss: 1.5251, test_f1: 0.4469
 epoch: 29, train_loss: 0.6797, test_loss: 1.0483, test_f1: 0.5483
 epoch: 30, train_loss: 0.6833, test_loss: 1.0988, test_f1: 0.5893
 epoch: 31, train_loss: 0.6471, test_loss: 1.0511, test_f1: 0.5665
 epoch: 32, train_loss: 0.7207, test_loss: 0.9743, test_f1: 0.5969
 epoch: 33, train_loss: 0.6478, test_loss: 1.0973, test_f1: 0.5609
 epoch: 34, train_loss: 0.6414, test_loss: 1.2770, test_f1: 0.5813
 epoch: 35, train_loss: 0.6561, test_loss: 1.1385, test_f1: 0.5069
 epoch: 36, train_loss: 0.6879, test_loss: 1.0812, test_f1: 0.5522
 epoch: 37, train_loss: 0.6475, test_loss: 1.1814, test_f1: 0.5466
 epoch: 38, train_loss: 0.6356, test_loss: 1.1486, test_f1: 0.5383
 epoch: 39, train_loss: 0.6351, test_loss: 0.9920, test_f1: 0.6313
 epoch: 40, train_loss: 0.6430, test_loss: 1.0161, test_f1: 0.5676
 epoch: 41, train_loss: 0.6303, test_loss: 1.2874, test_f1: 0.5148
 epoch: 42, train_loss: 0.6051, test_loss: 1.0955, test_f1: 0.5629
 epoch: 43, train_loss: 0.6285, test_loss: 0.9471, test_f1: 0.6215
 epoch: 44, train_loss: 0.6222, test_loss: 1.1845, test_f1: 0.5266
 epoch: 45, train_loss: 0.6008, test_loss: 1.1006, test_f1: 0.6014
 epoch: 46, train_loss: 0.5888, test_loss: 2.5697, test_f1: 0.3530
 epoch: 47, train_loss: 0.5592, test_loss: 1.1320, test_f1: 0.6133
 epoch: 48, train_loss: 0.5602, test_loss: 1.2388, test_f1: 0.5552
 epoch: 49, train_loss: 0.5723, test_loss: 0.9926, test_f1: 0.6371
 epoch: 50, train_loss: 0.5932, test_loss: 1.1463, test_f1: 0.5430
 epoch: 51, train_loss: 0.5526, test_loss: 1.1115, test_f1: 0.6161
 epoch: 52, train_loss: 0.5087, test_loss: 1.2296, test_f1: 0.6482
 epoch: 53, train_loss: 0.5173, test_loss: 1.1456, test_f1: 0.6651
 epoch: 54, train_loss: 0.5108, test_loss: 1.3350, test_f1: 0.5944
 epoch: 55, train_loss: 0.5021, test_loss: 1.1299, test_f1: 0.6211
 epoch: 56, train_loss: 0.4831, test_loss: 1.2239, test_f1: 0.6406
 epoch: 57, train_loss: 0.4944, test_loss: 1.1681, test_f1: 0.6290
 epoch: 58, train_loss: 0.4864, test_loss: 1.3158, test_f1: 0.6104
 epoch: 59, train_loss: 0.4757, test_loss: 1.3461, test_f1: 0.5800
 epoch: 60, train_loss: 0.4946, test_loss: 1.4440, test_f1: 0.6002
 epoch: 61, train_loss: 0.5447, test_loss: 1.1990, test_f1: 0.6177
 epoch: 62, train_loss: 0.4798, test_loss: 1.2223, test_f1: 0.6294
 epoch: 63, train_loss: 0.4770, test_loss: 1.2501, test_f1: 0.5942
 epoch: 64, train_loss: 0.4888, test_loss: 1.5055, test_f1: 0.5573
 epoch: 65, train_loss: 0.4906, test_loss: 1.1054, test_f1: 0.6379
 epoch: 66, train_loss: 0.4587, test_loss: 1.2631, test_f1: 0.5968
 epoch: 67, train_loss: 0.4464, test_loss: 1.1853, test_f1: 0.6387
 epoch: 68, train_loss: 0.4296, test_loss: 1.5489, test_f1: 0.5823
 epoch: 69, train_loss: 0.4333, test_loss: 1.3387, test_f1: 0.6251
 epoch: 70, train_loss: 0.4280, test_loss: 1.5123, test_f1: 0.5749
 epoch: 71, train_loss: 0.4366, test_loss: 1.4854, test_f1: 0.5693
 epoch: 72, train_loss: 0.4239, test_loss: 1.3077, test_f1: 0.5934
 epoch: 73, train_loss: 0.4190, test_loss: 1.6754, test_f1: 0.5940
 epoch: 74, train_loss: 0.4089, test_loss: 1.3438, test_f1: 0.5972
 epoch: 75, train_loss: 0.4316, test_loss: 1.4133, test_f1: 0.5794
 epoch: 76, train_loss: 0.4192, test_loss: 1.5459, test_f1: 0.6213
 epoch: 77, train_loss: 0.5096, test_loss: 1.2874, test_f1: 0.5857
 epoch: 78, train_loss: 0.5164, test_loss: 1.5645, test_f1: 0.5791
 epoch: 79, train_loss: 0.4815, test_loss: 1.2081, test_f1: 0.6017
 epoch: 80, train_loss: 0.4701, test_loss: 1.3711, test_f1: 0.5857
 epoch: 81, train_loss: 0.4681, test_loss: 1.1907, test_f1: 0.5845
 epoch: 82, train_loss: 0.4382, test_loss: 1.3885, test_f1: 0.5860
 epoch: 83, train_loss: 0.4543, test_loss: 1.3717, test_f1: 0.5927
 epoch: 84, train_loss: 0.4459, test_loss: 1.2745, test_f1: 0.5980
 epoch: 85, train_loss: 0.4605, test_loss: 1.5171, test_f1: 0.5965
 epoch: 86, train_loss: 0.4419, test_loss: 1.1096, test_f1: 0.6071
 epoch: 87, train_loss: 0.3959, test_loss: 1.4613, test_f1: 0.5902
 epoch: 88, train_loss: 0.4110, test_loss: 1.2757, test_f1: 0.6191
 epoch: 89, train_loss: 0.4020, test_loss: 1.3003, test_f1: 0.6318
 epoch: 90, train_loss: 0.3940, test_loss: 1.6215, test_f1: 0.5829
 epoch: 91, train_loss: 0.4141, test_loss: 1.2229, test_f1: 0.6214
 epoch: 92, train_loss: 0.4127, test_loss: 1.4091, test_f1: 0.6371
 epoch: 93, train_loss: 0.4063, test_loss: 1.2512, test_f1: 0.5970
 epoch: 94, train_loss: 0.3697, test_loss: 1.5230, test_f1: 0.6163
 epoch: 95, train_loss: 0.3766, test_loss: 1.5000, test_f1: 0.5754
 epoch: 96, train_loss: 0.3783, test_loss: 1.6490, test_f1: 0.5582
 epoch: 97, train_loss: 0.4051, test_loss: 1.3225, test_f1: 0.6172
 epoch: 98, train_loss: 0.4010, test_loss: 1.3904, test_f1: 0.6145
 epoch: 99, train_loss: 0.3974, test_loss: 1.3708, test_f1: 0.6190
##################ITERATION #7 ****************************************
 epoch: 0, train_loss: 1.2558, test_loss: 1.2408, test_f1: 0.3267
 epoch: 1, train_loss: 1.0210, test_loss: 1.1503, test_f1: 0.4231
 epoch: 2, train_loss: 0.9848, test_loss: 1.1414, test_f1: 0.4640
 epoch: 3, train_loss: 0.9380, test_loss: 1.3091, test_f1: 0.3352
 epoch: 4, train_loss: 0.9433, test_loss: 1.1246, test_f1: 0.4819
 epoch: 5, train_loss: 0.9279, test_loss: 1.0630, test_f1: 0.5252
 epoch: 6, train_loss: 0.8727, test_loss: 1.0532, test_f1: 0.5365
 epoch: 7, train_loss: 0.8595, test_loss: 0.9845, test_f1: 0.5657
 epoch: 8, train_loss: 0.8415, test_loss: 0.9879, test_f1: 0.5876
 epoch: 9, train_loss: 0.8199, test_loss: 1.0782, test_f1: 0.5718
 epoch: 10, train_loss: 0.7938, test_loss: 1.0741, test_f1: 0.5412
 epoch: 11, train_loss: 0.7742, test_loss: 1.0517, test_f1: 0.5645
 epoch: 12, train_loss: 0.8281, test_loss: 1.0128, test_f1: 0.5279
 epoch: 13, train_loss: 0.8206, test_loss: 1.1083, test_f1: 0.5519
 epoch: 14, train_loss: 0.7956, test_loss: 1.0235, test_f1: 0.5186
 epoch: 15, train_loss: 0.7936, test_loss: 1.0438, test_f1: 0.5571
 epoch: 16, train_loss: 0.8118, test_loss: 7.9066, test_f1: 0.1474
 epoch: 17, train_loss: 0.8085, test_loss: 1.0255, test_f1: 0.6078
 epoch: 18, train_loss: 0.7878, test_loss: 0.9616, test_f1: 0.5797
 epoch: 19, train_loss: 0.7780, test_loss: 0.9400, test_f1: 0.5480
 epoch: 20, train_loss: 0.7488, test_loss: 1.0360, test_f1: 0.5984
 epoch: 21, train_loss: 0.7470, test_loss: 1.2290, test_f1: 0.5760
 epoch: 22, train_loss: 0.7415, test_loss: 1.0296, test_f1: 0.5601
 epoch: 23, train_loss: 0.7387, test_loss: 1.0677, test_f1: 0.5734
 epoch: 24, train_loss: 0.7659, test_loss: 1.0349, test_f1: 0.5812
 epoch: 25, train_loss: 0.7608, test_loss: 1.3231, test_f1: 0.5569
 epoch: 26, train_loss: 0.7467, test_loss: 1.1571, test_f1: 0.6229
 epoch: 27, train_loss: 0.7498, test_loss: 1.0900, test_f1: 0.5477
 epoch: 28, train_loss: 0.7419, test_loss: 1.1243, test_f1: 0.5851
 epoch: 29, train_loss: 0.7352, test_loss: 1.0211, test_f1: 0.5945
 epoch: 30, train_loss: 0.7499, test_loss: 1.0465, test_f1: 0.6089
 epoch: 31, train_loss: 0.7229, test_loss: 0.9931, test_f1: 0.5728
 epoch: 32, train_loss: 0.7166, test_loss: 1.2368, test_f1: 0.5741
 epoch: 33, train_loss: 0.7141, test_loss: 1.2093, test_f1: 0.6150
 epoch: 34, train_loss: 0.7223, test_loss: 1.0559, test_f1: 0.6068
 epoch: 35, train_loss: 0.7044, test_loss: 0.9020, test_f1: 0.6303
 epoch: 36, train_loss: 0.6913, test_loss: 1.0461, test_f1: 0.6267
 epoch: 37, train_loss: 0.7075, test_loss: 0.9533, test_f1: 0.5999
 epoch: 38, train_loss: 0.7172, test_loss: 1.1689, test_f1: 0.5020
 epoch: 39, train_loss: 0.6937, test_loss: 1.0330, test_f1: 0.6172
 epoch: 40, train_loss: 0.7023, test_loss: 0.9537, test_f1: 0.5829
 epoch: 41, train_loss: 0.7077, test_loss: 0.8927, test_f1: 0.6422
 epoch: 42, train_loss: 0.6905, test_loss: 0.9487, test_f1: 0.6584
 epoch: 43, train_loss: 0.6626, test_loss: 0.9732, test_f1: 0.6094
 epoch: 44, train_loss: 0.6843, test_loss: 1.0831, test_f1: 0.5755
 epoch: 45, train_loss: 0.6651, test_loss: 0.9836, test_f1: 0.6150
 epoch: 46, train_loss: 0.6757, test_loss: 1.1499, test_f1: 0.5903
 epoch: 47, train_loss: 0.6629, test_loss: 1.3434, test_f1: 0.5787
 epoch: 48, train_loss: 0.6624, test_loss: 1.0140, test_f1: 0.6364
 epoch: 49, train_loss: 0.6746, test_loss: 1.0621, test_f1: 0.6146
 epoch: 50, train_loss: 0.6621, test_loss: 1.7672, test_f1: 0.4772
 epoch: 51, train_loss: 0.6378, test_loss: 1.0111, test_f1: 0.6262
 epoch: 52, train_loss: 0.6076, test_loss: 1.0636, test_f1: 0.6403
 epoch: 53, train_loss: 0.5996, test_loss: 1.0803, test_f1: 0.6585
 epoch: 54, train_loss: 0.5870, test_loss: 1.1193, test_f1: 0.6500
 epoch: 55, train_loss: 0.6130, test_loss: 1.0618, test_f1: 0.6685
 epoch: 56, train_loss: 0.6148, test_loss: 1.0066, test_f1: 0.6453
 epoch: 57, train_loss: 0.6090, test_loss: 1.0660, test_f1: 0.6260
 epoch: 58, train_loss: 0.6011, test_loss: 1.0654, test_f1: 0.6282
 epoch: 59, train_loss: 0.6033, test_loss: 1.2034, test_f1: 0.6036
 epoch: 60, train_loss: 0.5793, test_loss: 1.1443, test_f1: 0.6614
 epoch: 61, train_loss: 0.5843, test_loss: 1.2028, test_f1: 0.6347
 epoch: 62, train_loss: 0.5823, test_loss: 1.3623, test_f1: 0.5662
 epoch: 63, train_loss: 0.5791, test_loss: 1.0805, test_f1: 0.6529
 epoch: 64, train_loss: 0.5674, test_loss: 1.1140, test_f1: 0.6069
 epoch: 65, train_loss: 0.6050, test_loss: 1.1346, test_f1: 0.6184
 epoch: 66, train_loss: 0.5746, test_loss: 1.2638, test_f1: 0.6643
 epoch: 67, train_loss: 0.5731, test_loss: 1.2816, test_f1: 0.6524
 epoch: 68, train_loss: 0.5666, test_loss: 1.1191, test_f1: 0.5962
 epoch: 69, train_loss: 0.5634, test_loss: 1.0350, test_f1: 0.6538
 epoch: 70, train_loss: 0.5381, test_loss: 1.4202, test_f1: 0.5825
 epoch: 71, train_loss: 0.5595, test_loss: 1.3125, test_f1: 0.6085
 epoch: 72, train_loss: 0.5552, test_loss: 1.1684, test_f1: 0.6769
 epoch: 73, train_loss: 0.5488, test_loss: 1.1009, test_f1: 0.6340
 epoch: 74, train_loss: 0.5471, test_loss: 1.2162, test_f1: 0.6022
 epoch: 75, train_loss: 0.5338, test_loss: 1.2539, test_f1: 0.6181
 epoch: 76, train_loss: 0.5362, test_loss: 1.3053, test_f1: 0.6059
 epoch: 77, train_loss: 0.5219, test_loss: 1.2554, test_f1: 0.6628
 epoch: 78, train_loss: 0.5009, test_loss: 1.4181, test_f1: 0.6185
 epoch: 79, train_loss: 0.5288, test_loss: 1.4209, test_f1: 0.5657
 epoch: 80, train_loss: 0.5216, test_loss: 1.1426, test_f1: 0.6247
 epoch: 81, train_loss: 0.5112, test_loss: 1.1459, test_f1: 0.6943
 epoch: 82, train_loss: 0.5228, test_loss: 1.3597, test_f1: 0.6293
 epoch: 83, train_loss: 0.5081, test_loss: 1.3763, test_f1: 0.6659
 epoch: 84, train_loss: 0.5009, test_loss: 1.2215, test_f1: 0.6490
 epoch: 85, train_loss: 0.4856, test_loss: 1.2933, test_f1: 0.6090
 epoch: 86, train_loss: 0.5040, test_loss: 1.1662, test_f1: 0.6420
 epoch: 87, train_loss: 0.4987, test_loss: 1.6004, test_f1: 0.5838
 epoch: 88, train_loss: 0.4871, test_loss: 1.2752, test_f1: 0.6502
 epoch: 89, train_loss: 0.5094, test_loss: 1.4415, test_f1: 0.6130
 epoch: 90, train_loss: 0.5062, test_loss: 1.2892, test_f1: 0.6363
 epoch: 91, train_loss: 0.5225, test_loss: 1.4395, test_f1: 0.6602
 epoch: 92, train_loss: 0.4956, test_loss: 1.3757, test_f1: 0.6629
 epoch: 93, train_loss: 0.4817, test_loss: 1.4704, test_f1: 0.6315
 epoch: 94, train_loss: 0.4634, test_loss: 1.3288, test_f1: 0.6311
 epoch: 95, train_loss: 0.4956, test_loss: 1.0951, test_f1: 0.6208
 epoch: 96, train_loss: 0.4971, test_loss: 1.4153, test_f1: 0.6353
 epoch: 97, train_loss: 0.5042, test_loss: 1.3171, test_f1: 0.5791
 epoch: 98, train_loss: 0.4788, test_loss: 1.4834, test_f1: 0.6153
 epoch: 99, train_loss: 0.4954, test_loss: 1.3763, test_f1: 0.6096
##################ITERATION #8 ****************************************
 epoch: 0, train_loss: 1.2432, test_loss: 1.5121, test_f1: 0.2282
 epoch: 1, train_loss: 1.0069, test_loss: 1.2367, test_f1: 0.3911
 epoch: 2, train_loss: 0.9339, test_loss: 1.0142, test_f1: 0.5877
 epoch: 3, train_loss: 0.8885, test_loss: 1.0970, test_f1: 0.4753
 epoch: 4, train_loss: 0.8486, test_loss: 1.0244, test_f1: 0.5819
 epoch: 5, train_loss: 0.8221, test_loss: 1.0590, test_f1: 0.5653
 epoch: 6, train_loss: 0.8336, test_loss: 1.0728, test_f1: 0.4072
 epoch: 7, train_loss: 0.8484, test_loss: 1.1488, test_f1: 0.5212
 epoch: 8, train_loss: 0.8043, test_loss: 1.0106, test_f1: 0.5844
 epoch: 9, train_loss: 0.8294, test_loss: 1.0144, test_f1: 0.5287
 epoch: 10, train_loss: 0.7852, test_loss: 1.0814, test_f1: 0.5294
 epoch: 11, train_loss: 0.7843, test_loss: 1.3361, test_f1: 0.4624
 epoch: 12, train_loss: 0.7586, test_loss: 1.3317, test_f1: 0.5110
 epoch: 13, train_loss: 0.7753, test_loss: 1.0218, test_f1: 0.5218
 epoch: 14, train_loss: 0.7713, test_loss: 1.1898, test_f1: 0.5740
 epoch: 15, train_loss: 0.7279, test_loss: 1.1444, test_f1: 0.6147
 epoch: 16, train_loss: 0.7444, test_loss: 1.1254, test_f1: 0.4851
 epoch: 17, train_loss: 0.8135, test_loss: 1.1357, test_f1: 0.5381
 epoch: 18, train_loss: 0.7507, test_loss: 1.0575, test_f1: 0.5306
 epoch: 19, train_loss: 0.7154, test_loss: 1.6636, test_f1: 0.5474
 epoch: 20, train_loss: 0.7008, test_loss: 1.5428, test_f1: 0.6041
 epoch: 21, train_loss: 0.7202, test_loss: 1.3136, test_f1: 0.5176
 epoch: 22, train_loss: 0.6952, test_loss: 1.1192, test_f1: 0.5743
 epoch: 23, train_loss: 0.7245, test_loss: 1.0849, test_f1: 0.5487
 epoch: 24, train_loss: 0.7084, test_loss: 1.2249, test_f1: 0.5199
 epoch: 25, train_loss: 0.7061, test_loss: 1.1034, test_f1: 0.5925
 epoch: 26, train_loss: 0.7238, test_loss: 1.0483, test_f1: 0.5719
 epoch: 27, train_loss: 0.6903, test_loss: 0.9961, test_f1: 0.5796
 epoch: 28, train_loss: 0.6664, test_loss: 1.0315, test_f1: 0.5863
 epoch: 29, train_loss: 0.6728, test_loss: 1.0348, test_f1: 0.5936
 epoch: 30, train_loss: 0.6744, test_loss: 1.2179, test_f1: 0.5578
 epoch: 31, train_loss: 0.6461, test_loss: 1.1876, test_f1: 0.5668
 epoch: 32, train_loss: 0.6530, test_loss: 1.0261, test_f1: 0.6029
 epoch: 33, train_loss: 0.6921, test_loss: 1.2573, test_f1: 0.5987
 epoch: 34, train_loss: 0.6559, test_loss: 1.2992, test_f1: 0.5553
 epoch: 35, train_loss: 0.6600, test_loss: 1.1875, test_f1: 0.5564
 epoch: 36, train_loss: 0.6725, test_loss: 1.7496, test_f1: 0.5557
 epoch: 37, train_loss: 0.6731, test_loss: 1.2196, test_f1: 0.6225
 epoch: 38, train_loss: 0.6736, test_loss: 1.0534, test_f1: 0.5852
 epoch: 39, train_loss: 0.6206, test_loss: 1.1091, test_f1: 0.6104
 epoch: 40, train_loss: 0.6136, test_loss: 1.0981, test_f1: 0.6123
 epoch: 41, train_loss: 0.6068, test_loss: 1.3176, test_f1: 0.5997
 epoch: 42, train_loss: 0.6071, test_loss: 1.2775, test_f1: 0.5826
 epoch: 43, train_loss: 0.6495, test_loss: 1.1416, test_f1: 0.5452
 epoch: 44, train_loss: 0.6481, test_loss: 1.2551, test_f1: 0.5707
 epoch: 45, train_loss: 0.5706, test_loss: 1.4738, test_f1: 0.5469
 epoch: 46, train_loss: 0.6094, test_loss: 1.2120, test_f1: 0.5559
 epoch: 47, train_loss: 0.6515, test_loss: 1.1779, test_f1: 0.5984
 epoch: 48, train_loss: 0.6358, test_loss: 1.2868, test_f1: 0.4802
 epoch: 49, train_loss: 0.5868, test_loss: 1.3282, test_f1: 0.5873
 epoch: 50, train_loss: 0.5810, test_loss: 1.3036, test_f1: 0.5963
 epoch: 51, train_loss: 0.5342, test_loss: 1.2128, test_f1: 0.6547
 epoch: 52, train_loss: 0.5183, test_loss: 1.3485, test_f1: 0.6156
 epoch: 53, train_loss: 0.5072, test_loss: 1.3074, test_f1: 0.6117
 epoch: 54, train_loss: 0.5025, test_loss: 1.2546, test_f1: 0.6297
 epoch: 55, train_loss: 0.4881, test_loss: 1.2683, test_f1: 0.5930
 epoch: 56, train_loss: 0.4905, test_loss: 1.5291, test_f1: 0.6077
 epoch: 57, train_loss: 0.4771, test_loss: 1.4820, test_f1: 0.5839
 epoch: 58, train_loss: 0.4650, test_loss: 1.2081, test_f1: 0.6652
 epoch: 59, train_loss: 0.4743, test_loss: 1.2909, test_f1: 0.6427
 epoch: 60, train_loss: 0.4722, test_loss: 1.2760, test_f1: 0.6659
 epoch: 61, train_loss: 0.4908, test_loss: 1.5810, test_f1: 0.6409
 epoch: 62, train_loss: 0.4688, test_loss: 1.2886, test_f1: 0.6209
 epoch: 63, train_loss: 0.4534, test_loss: 1.3776, test_f1: 0.6662
 epoch: 64, train_loss: 0.4439, test_loss: 1.3460, test_f1: 0.6278
 epoch: 65, train_loss: 0.4562, test_loss: 1.3309, test_f1: 0.6633
 epoch: 66, train_loss: 0.5121, test_loss: 1.4272, test_f1: 0.5714
 epoch: 67, train_loss: 0.4939, test_loss: 1.2670, test_f1: 0.6857
 epoch: 68, train_loss: 0.4608, test_loss: 1.3901, test_f1: 0.6090
 epoch: 69, train_loss: 0.4406, test_loss: 1.6294, test_f1: 0.6187
 epoch: 70, train_loss: 0.4383, test_loss: 1.5560, test_f1: 0.6412
 epoch: 71, train_loss: 0.4287, test_loss: 1.6058, test_f1: 0.6215
 epoch: 72, train_loss: 0.4795, test_loss: 1.6696, test_f1: 0.5855
 epoch: 73, train_loss: 0.4824, test_loss: 1.3574, test_f1: 0.6260
 epoch: 74, train_loss: 0.4324, test_loss: 1.4692, test_f1: 0.6354
 epoch: 75, train_loss: 0.4015, test_loss: 1.4976, test_f1: 0.6344
 epoch: 76, train_loss: 0.4126, test_loss: 1.4774, test_f1: 0.6186
 epoch: 77, train_loss: 0.4059, test_loss: 1.5172, test_f1: 0.6549
 epoch: 78, train_loss: 0.4631, test_loss: 1.3848, test_f1: 0.6618
 epoch: 79, train_loss: 0.4558, test_loss: 1.3639, test_f1: 0.6632
 epoch: 80, train_loss: 0.4290, test_loss: 1.3865, test_f1: 0.6512
 epoch: 81, train_loss: 0.3973, test_loss: 1.4645, test_f1: 0.6280
 epoch: 82, train_loss: 0.3688, test_loss: 1.4963, test_f1: 0.6458
 epoch: 83, train_loss: 0.3952, test_loss: 1.4141, test_f1: 0.6136
 epoch: 84, train_loss: 0.4415, test_loss: 1.3564, test_f1: 0.6653
 epoch: 85, train_loss: 0.4625, test_loss: 1.3068, test_f1: 0.6520
 epoch: 86, train_loss: 0.4378, test_loss: 1.5222, test_f1: 0.6609
 epoch: 87, train_loss: 0.3965, test_loss: 1.3949, test_f1: 0.6422
 epoch: 88, train_loss: 0.4088, test_loss: 1.6155, test_f1: 0.6205
 epoch: 89, train_loss: 0.4065, test_loss: 1.4275, test_f1: 0.6182
 epoch: 90, train_loss: 0.3955, test_loss: 1.3792, test_f1: 0.6248
 epoch: 91, train_loss: 0.4330, test_loss: 1.3448, test_f1: 0.6320
 epoch: 92, train_loss: 0.4047, test_loss: 1.4483, test_f1: 0.6223
 epoch: 93, train_loss: 0.3607, test_loss: 1.3487, test_f1: 0.6676
 epoch: 94, train_loss: 0.4008, test_loss: 1.5671, test_f1: 0.6142
 epoch: 95, train_loss: 0.4045, test_loss: 1.4949, test_f1: 0.6740
 epoch: 96, train_loss: 0.3569, test_loss: 1.6147, test_f1: 0.6463
 epoch: 97, train_loss: 0.3829, test_loss: 1.5801, test_f1: 0.6558
 epoch: 98, train_loss: 0.3667, test_loss: 1.5385, test_f1: 0.6003
 epoch: 99, train_loss: 0.3696, test_loss: 1.5349, test_f1: 0.6387
##################ITERATION #9 ****************************************
 epoch: 0, train_loss: 1.2518, test_loss: 1.2876, test_f1: 0.3006
 epoch: 1, train_loss: 1.0159, test_loss: 1.0540, test_f1: 0.4825
 epoch: 2, train_loss: 0.9402, test_loss: 1.0979, test_f1: 0.4484
 epoch: 3, train_loss: 0.8990, test_loss: 1.1422, test_f1: 0.4360
 epoch: 4, train_loss: 0.9109, test_loss: 1.0138, test_f1: 0.5779
 epoch: 5, train_loss: 0.8724, test_loss: 0.9791, test_f1: 0.5128
 epoch: 6, train_loss: 0.8296, test_loss: 1.0531, test_f1: 0.5173
 epoch: 7, train_loss: 0.8344, test_loss: 0.9645, test_f1: 0.5487
 epoch: 8, train_loss: 0.8717, test_loss: 1.2654, test_f1: 0.4722
 epoch: 9, train_loss: 0.8556, test_loss: 1.0411, test_f1: 0.5174
 epoch: 10, train_loss: 0.8307, test_loss: 1.0194, test_f1: 0.5659
 epoch: 11, train_loss: 0.8002, test_loss: 1.0822, test_f1: 0.5495
 epoch: 12, train_loss: 0.7863, test_loss: 1.5904, test_f1: 0.3262
 epoch: 13, train_loss: 0.7991, test_loss: 1.0474, test_f1: 0.5413
 epoch: 14, train_loss: 0.8074, test_loss: 1.3079, test_f1: 0.4861
 epoch: 15, train_loss: 0.7833, test_loss: 0.9351, test_f1: 0.5588
 epoch: 16, train_loss: 0.7955, test_loss: 1.2812, test_f1: 0.4701
 epoch: 17, train_loss: 0.7840, test_loss: 1.1905, test_f1: 0.4441
 epoch: 18, train_loss: 0.7793, test_loss: 0.9878, test_f1: 0.5729
 epoch: 19, train_loss: 0.8018, test_loss: 1.2463, test_f1: 0.5259
 epoch: 20, train_loss: 0.7533, test_loss: 0.9366, test_f1: 0.6448
 epoch: 21, train_loss: 0.7451, test_loss: 1.0052, test_f1: 0.5515
 epoch: 22, train_loss: 0.7328, test_loss: 1.4337, test_f1: 0.4242
 epoch: 23, train_loss: 0.7382, test_loss: 1.0561, test_f1: 0.5893
 epoch: 24, train_loss: 0.7681, test_loss: 0.9854, test_f1: 0.6129
 epoch: 25, train_loss: 0.7249, test_loss: 0.9387, test_f1: 0.6143
 epoch: 26, train_loss: 0.7511, test_loss: 1.2307, test_f1: 0.5322
 epoch: 27, train_loss: 0.7250, test_loss: 1.6522, test_f1: 0.5178
 epoch: 28, train_loss: 0.7186, test_loss: 1.0397, test_f1: 0.6316
 epoch: 29, train_loss: 0.7169, test_loss: 1.1063, test_f1: 0.5298
 epoch: 30, train_loss: 0.7548, test_loss: 0.9911, test_f1: 0.5681
 epoch: 31, train_loss: 0.6985, test_loss: 1.0534, test_f1: 0.6269
 epoch: 32, train_loss: 0.7158, test_loss: 0.9478, test_f1: 0.6091
 epoch: 33, train_loss: 0.7123, test_loss: 1.2063, test_f1: 0.5478
 epoch: 34, train_loss: 0.7242, test_loss: 1.3937, test_f1: 0.4457
 epoch: 35, train_loss: 0.7195, test_loss: 1.2771, test_f1: 0.4331
 epoch: 36, train_loss: 0.7108, test_loss: 1.0287, test_f1: 0.6231
 epoch: 37, train_loss: 0.6946, test_loss: 0.9890, test_f1: 0.6258
 epoch: 38, train_loss: 0.6922, test_loss: 1.1258, test_f1: 0.5337
 epoch: 39, train_loss: 0.6816, test_loss: 1.0183, test_f1: 0.6379
 epoch: 40, train_loss: 0.6803, test_loss: 1.0520, test_f1: 0.6182
 epoch: 41, train_loss: 0.6879, test_loss: 1.0934, test_f1: 0.5991
 epoch: 42, train_loss: 0.6696, test_loss: 1.1473, test_f1: 0.5855
 epoch: 43, train_loss: 0.6960, test_loss: 1.3585, test_f1: 0.4369
 epoch: 44, train_loss: 0.7324, test_loss: 1.2944, test_f1: 0.5249
 epoch: 45, train_loss: 0.7261, test_loss: 1.3813, test_f1: 0.4611
 epoch: 46, train_loss: 0.6926, test_loss: 1.1906, test_f1: 0.6399
 epoch: 47, train_loss: 0.6601, test_loss: 1.2266, test_f1: 0.6680
 epoch: 48, train_loss: 0.6249, test_loss: 1.2461, test_f1: 0.5609
 epoch: 49, train_loss: 0.6535, test_loss: 1.6853, test_f1: 0.4396
 epoch: 50, train_loss: 0.7074, test_loss: 1.0864, test_f1: 0.6168
 epoch: 51, train_loss: 0.6349, test_loss: 1.1274, test_f1: 0.6566
 epoch: 52, train_loss: 0.6137, test_loss: 1.1230, test_f1: 0.6669
 epoch: 53, train_loss: 0.5945, test_loss: 1.4854, test_f1: 0.6435
 epoch: 54, train_loss: 0.6112, test_loss: 1.2267, test_f1: 0.6344
 epoch: 55, train_loss: 0.5842, test_loss: 1.1331, test_f1: 0.6297
 epoch: 56, train_loss: 0.6025, test_loss: 1.1821, test_f1: 0.5964
 epoch: 57, train_loss: 0.5775, test_loss: 1.5058, test_f1: 0.5389
 epoch: 58, train_loss: 0.5805, test_loss: 1.2160, test_f1: 0.6372
 epoch: 59, train_loss: 0.5689, test_loss: 1.3018, test_f1: 0.6653
 epoch: 60, train_loss: 0.5808, test_loss: 1.2867, test_f1: 0.6606
 epoch: 61, train_loss: 0.5798, test_loss: 1.1379, test_f1: 0.6572
 epoch: 62, train_loss: 0.5865, test_loss: 1.0881, test_f1: 0.6612
 epoch: 63, train_loss: 0.5827, test_loss: 1.5111, test_f1: 0.6050
 epoch: 64, train_loss: 0.5653, test_loss: 1.4047, test_f1: 0.6515
 epoch: 65, train_loss: 0.5610, test_loss: 1.6006, test_f1: 0.6225
 epoch: 66, train_loss: 0.5806, test_loss: 1.5005, test_f1: 0.5909
 epoch: 67, train_loss: 0.5551, test_loss: 1.3729, test_f1: 0.6005
 epoch: 68, train_loss: 0.5815, test_loss: 1.3912, test_f1: 0.6743
 epoch: 69, train_loss: 0.5698, test_loss: 1.4819, test_f1: 0.6499
 epoch: 70, train_loss: 0.5870, test_loss: 1.6006, test_f1: 0.6442
 epoch: 71, train_loss: 0.5775, test_loss: 1.2584, test_f1: 0.6252
 epoch: 72, train_loss: 0.5961, test_loss: 1.2325, test_f1: 0.6653
 epoch: 73, train_loss: 0.5489, test_loss: 1.5656, test_f1: 0.6676
 epoch: 74, train_loss: 0.5473, test_loss: 1.6737, test_f1: 0.6280
 epoch: 75, train_loss: 0.5378, test_loss: 1.2250, test_f1: 0.6345
 epoch: 76, train_loss: 0.5371, test_loss: 1.4301, test_f1: 0.6599
 epoch: 77, train_loss: 0.5290, test_loss: 1.3738, test_f1: 0.6888
 epoch: 78, train_loss: 0.5241, test_loss: 1.8063, test_f1: 0.6332
 epoch: 79, train_loss: 0.5488, test_loss: 1.7052, test_f1: 0.6442
 epoch: 80, train_loss: 0.5505, test_loss: 1.7589, test_f1: 0.6972
 epoch: 81, train_loss: 0.5404, test_loss: 1.6014, test_f1: 0.6202
 epoch: 82, train_loss: 0.5343, test_loss: 1.4860, test_f1: 0.6501
 epoch: 83, train_loss: 0.5270, test_loss: 1.5266, test_f1: 0.6491
 epoch: 84, train_loss: 0.5285, test_loss: 1.9116, test_f1: 0.5745
 epoch: 85, train_loss: 0.5261, test_loss: 1.3919, test_f1: 0.6647
 epoch: 86, train_loss: 0.5353, test_loss: 1.5118, test_f1: 0.6464
 epoch: 87, train_loss: 0.5353, test_loss: 1.7209, test_f1: 0.6418
 epoch: 88, train_loss: 0.5182, test_loss: 1.7727, test_f1: 0.6608
 epoch: 89, train_loss: 0.5302, test_loss: 1.4636, test_f1: 0.6869
 epoch: 90, train_loss: 0.5578, test_loss: 1.4725, test_f1: 0.6082
 epoch: 91, train_loss: 0.5654, test_loss: 1.3220, test_f1: 0.6243
 epoch: 92, train_loss: 0.5465, test_loss: 1.3039, test_f1: 0.6711
 epoch: 93, train_loss: 0.5231, test_loss: 1.3097, test_f1: 0.6223
 epoch: 94, train_loss: 0.5237, test_loss: 1.4748, test_f1: 0.6715
 epoch: 95, train_loss: 0.4879, test_loss: 1.6006, test_f1: 0.6094
 epoch: 96, train_loss: 0.4854, test_loss: 1.3490, test_f1: 0.6551
 epoch: 97, train_loss: 0.4900, test_loss: 1.5231, test_f1: 0.6165
 epoch: 98, train_loss: 0.4803, test_loss: 1.8546, test_f1: 0.6218
 epoch: 99, train_loss: 0.5099, test_loss: 1.2385, test_f1: 0.6806

Training completed in 535.59 seconds
Best F1: 0.6972 at epoch 80
Mean F1 across iterations: 0.6792  0.0128
========================FINAL RESULTS================================
FEGIN weighted F1: 0.6972  0.0128
python main.py --data ltspice_demos --representation component_pin --model FEGIN --layers 6 --hiddens 32 --batch_size 64 --lr 0.01 --emb_size 250 --epochs 100 --save_appendix component_pin_L6_H32_BS64_LR0.01_E250 --no_val
-----



STDERR:
  File "main.py", line 370, in <module>
    main()
  File "main.py", line 254, in main
    dataset = dataset_class(
  File "/home/philip/projects/ltspice_examples_code_repo/Circuit-Completion-Using-GNNs/component_classification_with_link_prediction_head/evaluation/FEGIN/kernel/circuit_datasets.py", line 15, in __init__
    self.data, self.slices = torch.load(self.processed_paths[0])
  File "/home/philip/.local/lib/python3.8/site-packages/torch/serialization.py", line 1040, in load
    warnings.warn(
  File "/usr/lib/python3.8/warnings.py", line 109, in _showwarnmsg
    sw(msg.message, msg.category, msg.filename, msg.lineno,
  File "main.py", line 47, in warn_with_traceback
    traceback.print_stack(file=log)
/home/philip/projects/ltspice_examples_code_repo/Circuit-Completion-Using-GNNs/component_classification_with_link_prediction_head/evaluation/FEGIN/kernel/circuit_datasets.py:15: FutureWarning: You are using `torch.load` with `weights_only=False` (the current default value), which uses the default pickle module implicitly. It is possible to construct malicious pickle data which will execute arbitrary code during unpickling (See https://github.com/pytorch/pytorch/blob/main/SECURITY.md#untrusted-models for more details). In a future release, the default value for `weights_only` will be flipped to `True`. This limits the functions that could be executed during unpickling. Arbitrary objects will no longer be allowed to be loaded via this mode unless they are explicitly allowlisted by the user via `torch.serialization.add_safe_globals`. We recommend you start setting `weights_only=True` for any use case where you don't have full control of the loaded file. Please open an issue on GitHub for any issues related to this experimental feature.
  self.data, self.slices = torch.load(self.processed_paths[0])
