STDOUT:
Results will be saved in /home/philip/projects/ltspice_examples_code_repo/Circuit-Completion-Using-GNNs/component_classification_with_link_prediction_head/evaluation/FEGIN/results/model_FEGIN_dataset_ltspice_demos
Command line input: python main.py --data ltspice_demos --representation component_pin --model FEGIN --layers 4 --hiddens 64 --batch_size 256 --lr 0.0001 --emb_size 128 --epochs 100 --save_appendix component_pin_L4_H64_BS256_LR0.0001_E128 --no_val
 is saved.
-----
ltspice_demos - FEGIN
Using 4 layers, 64 hidden units, h = 2
Loading component_pin representation dataset
ENTERED
Training FEGIN on component_pin representation
Train: 1565, Test: 383
##################ITERATION #0 ****************************************
 epoch: 0, train_loss: 1.3941, test_loss: 1.3932, test_f1: 0.0301
 epoch: 1, train_loss: 1.3894, test_loss: 1.3912, test_f1: 0.0301
 epoch: 2, train_loss: 1.3871, test_loss: 1.3896, test_f1: 0.0301
 epoch: 3, train_loss: 1.3846, test_loss: 1.3883, test_f1: 0.0301
 epoch: 4, train_loss: 1.3821, test_loss: 1.3871, test_f1: 0.0301
 epoch: 5, train_loss: 1.3799, test_loss: 1.3856, test_f1: 0.0502
 epoch: 6, train_loss: 1.3769, test_loss: 1.3838, test_f1: 0.1096
 epoch: 7, train_loss: 1.3741, test_loss: 1.3815, test_f1: 0.1558
 epoch: 8, train_loss: 1.3717, test_loss: 1.3791, test_f1: 0.1715
 epoch: 9, train_loss: 1.3684, test_loss: 1.3767, test_f1: 0.2241
 epoch: 10, train_loss: 1.3653, test_loss: 1.3741, test_f1: 0.3615
 epoch: 11, train_loss: 1.3626, test_loss: 1.3713, test_f1: 0.3720
 epoch: 12, train_loss: 1.3582, test_loss: 1.3685, test_f1: 0.3990
 epoch: 13, train_loss: 1.3541, test_loss: 1.3652, test_f1: 0.4213
 epoch: 14, train_loss: 1.3503, test_loss: 1.3622, test_f1: 0.3935
 epoch: 15, train_loss: 1.3461, test_loss: 1.3590, test_f1: 0.3620
 epoch: 16, train_loss: 1.3398, test_loss: 1.3554, test_f1: 0.3647
 epoch: 17, train_loss: 1.3331, test_loss: 1.3513, test_f1: 0.3690
 epoch: 18, train_loss: 1.3275, test_loss: 1.3468, test_f1: 0.3531
 epoch: 19, train_loss: 1.3192, test_loss: 1.3416, test_f1: 0.3506
 epoch: 20, train_loss: 1.3106, test_loss: 1.3360, test_f1: 0.3482
 epoch: 21, train_loss: 1.3041, test_loss: 1.3307, test_f1: 0.3346
 epoch: 22, train_loss: 1.2929, test_loss: 1.3251, test_f1: 0.3219
 epoch: 23, train_loss: 1.2814, test_loss: 1.3177, test_f1: 0.3202
 epoch: 24, train_loss: 1.2707, test_loss: 1.3100, test_f1: 0.3170
 epoch: 25, train_loss: 1.2588, test_loss: 1.3025, test_f1: 0.3199
 epoch: 26, train_loss: 1.2497, test_loss: 1.2952, test_f1: 0.3202
 epoch: 27, train_loss: 1.2357, test_loss: 1.2888, test_f1: 0.3261
 epoch: 28, train_loss: 1.2220, test_loss: 1.2796, test_f1: 0.3380
 epoch: 29, train_loss: 1.2121, test_loss: 1.2719, test_f1: 0.3442
 epoch: 30, train_loss: 1.2055, test_loss: 1.2652, test_f1: 0.3403
 epoch: 31, train_loss: 1.1986, test_loss: 1.2594, test_f1: 0.3547
 epoch: 32, train_loss: 1.1931, test_loss: 1.2538, test_f1: 0.3567
 epoch: 33, train_loss: 1.1830, test_loss: 1.2468, test_f1: 0.3617
 epoch: 34, train_loss: 1.1771, test_loss: 1.2404, test_f1: 0.3843
 epoch: 35, train_loss: 1.1655, test_loss: 1.2346, test_f1: 0.4078
 epoch: 36, train_loss: 1.1613, test_loss: 1.2302, test_f1: 0.4247
 epoch: 37, train_loss: 1.1562, test_loss: 1.2248, test_f1: 0.4321
 epoch: 38, train_loss: 1.1516, test_loss: 1.2216, test_f1: 0.4216
 epoch: 39, train_loss: 1.1493, test_loss: 1.2193, test_f1: 0.4399
 epoch: 40, train_loss: 1.1420, test_loss: 1.2163, test_f1: 0.4483
 epoch: 41, train_loss: 1.1378, test_loss: 1.2124, test_f1: 0.4484
 epoch: 42, train_loss: 1.1316, test_loss: 1.2094, test_f1: 0.4478
 epoch: 43, train_loss: 1.1309, test_loss: 1.2066, test_f1: 0.4541
 epoch: 44, train_loss: 1.1278, test_loss: 1.2022, test_f1: 0.4477
 epoch: 45, train_loss: 1.1262, test_loss: 1.2005, test_f1: 0.4567
 epoch: 46, train_loss: 1.1175, test_loss: 1.1974, test_f1: 0.4497
 epoch: 47, train_loss: 1.1157, test_loss: 1.1949, test_f1: 0.4497
 epoch: 48, train_loss: 1.1088, test_loss: 1.1920, test_f1: 0.4497
 epoch: 49, train_loss: 1.1051, test_loss: 1.1905, test_f1: 0.4503
 epoch: 50, train_loss: 1.1003, test_loss: 1.1885, test_f1: 0.4522
 epoch: 51, train_loss: 1.0991, test_loss: 1.1860, test_f1: 0.4496
 epoch: 52, train_loss: 1.0981, test_loss: 1.1843, test_f1: 0.4496
 epoch: 53, train_loss: 1.0976, test_loss: 1.1863, test_f1: 0.4522
 epoch: 54, train_loss: 1.0911, test_loss: 1.1864, test_f1: 0.4480
 epoch: 55, train_loss: 1.0954, test_loss: 1.1843, test_f1: 0.4530
 epoch: 56, train_loss: 1.0897, test_loss: 1.1811, test_f1: 0.4510
 epoch: 57, train_loss: 1.0874, test_loss: 1.1783, test_f1: 0.4522
 epoch: 58, train_loss: 1.0913, test_loss: 1.1765, test_f1: 0.4504
 epoch: 59, train_loss: 1.0823, test_loss: 1.1752, test_f1: 0.4504
 epoch: 60, train_loss: 1.0865, test_loss: 1.1733, test_f1: 0.4506
 epoch: 61, train_loss: 1.0824, test_loss: 1.1722, test_f1: 0.4506
 epoch: 62, train_loss: 1.0785, test_loss: 1.1706, test_f1: 0.4526
 epoch: 63, train_loss: 1.0776, test_loss: 1.1693, test_f1: 0.4526
 epoch: 64, train_loss: 1.0732, test_loss: 1.1662, test_f1: 0.4526
 epoch: 65, train_loss: 1.0707, test_loss: 1.1660, test_f1: 0.4495
 epoch: 66, train_loss: 1.0691, test_loss: 1.1656, test_f1: 0.4506
 epoch: 67, train_loss: 1.0686, test_loss: 1.1643, test_f1: 0.4526
 epoch: 68, train_loss: 1.0666, test_loss: 1.1618, test_f1: 0.4521
 epoch: 69, train_loss: 1.0608, test_loss: 1.1585, test_f1: 0.4521
 epoch: 70, train_loss: 1.0611, test_loss: 1.1584, test_f1: 0.4521
 epoch: 71, train_loss: 1.0529, test_loss: 1.1557, test_f1: 0.4521
 epoch: 72, train_loss: 1.0535, test_loss: 1.1550, test_f1: 0.4521
 epoch: 73, train_loss: 1.0534, test_loss: 1.1539, test_f1: 0.4521
 epoch: 74, train_loss: 1.0528, test_loss: 1.1523, test_f1: 0.4521
 epoch: 75, train_loss: 1.0541, test_loss: 1.1499, test_f1: 0.4526
 epoch: 76, train_loss: 1.0472, test_loss: 1.1497, test_f1: 0.4521
 epoch: 77, train_loss: 1.0465, test_loss: 1.1471, test_f1: 0.4521
 epoch: 78, train_loss: 1.0393, test_loss: 1.1496, test_f1: 0.4327
 epoch: 79, train_loss: 1.0402, test_loss: 1.1471, test_f1: 0.4414
 epoch: 80, train_loss: 1.0366, test_loss: 1.1433, test_f1: 0.4499
 epoch: 81, train_loss: 1.0365, test_loss: 1.1389, test_f1: 0.4507
 epoch: 82, train_loss: 1.0303, test_loss: 1.1388, test_f1: 0.4503
 epoch: 83, train_loss: 1.0296, test_loss: 1.1359, test_f1: 0.4503
 epoch: 84, train_loss: 1.0270, test_loss: 1.1347, test_f1: 0.4503
 epoch: 85, train_loss: 1.0232, test_loss: 1.1304, test_f1: 0.4511
 epoch: 86, train_loss: 1.0269, test_loss: 1.1316, test_f1: 0.4495
 epoch: 87, train_loss: 1.0206, test_loss: 1.1292, test_f1: 0.4503
 epoch: 88, train_loss: 1.0176, test_loss: 1.1275, test_f1: 0.4503
 epoch: 89, train_loss: 1.0096, test_loss: 1.1269, test_f1: 0.4503
 epoch: 90, train_loss: 1.0108, test_loss: 1.1264, test_f1: 0.4507
 epoch: 91, train_loss: 1.0111, test_loss: 1.1268, test_f1: 0.4576
 epoch: 92, train_loss: 1.0100, test_loss: 1.1257, test_f1: 0.4495
 epoch: 93, train_loss: 1.0097, test_loss: 1.1226, test_f1: 0.4507
 epoch: 94, train_loss: 1.0040, test_loss: 1.1201, test_f1: 0.4503
 epoch: 95, train_loss: 1.0033, test_loss: 1.1181, test_f1: 0.4503
 epoch: 96, train_loss: 0.9975, test_loss: 1.1159, test_f1: 0.4507
 epoch: 97, train_loss: 0.9990, test_loss: 1.1151, test_f1: 0.4507
 epoch: 98, train_loss: 0.9959, test_loss: 1.1166, test_f1: 0.4476
 epoch: 99, train_loss: 0.9979, test_loss: 1.1186, test_f1: 0.4461
##################ITERATION #1 ****************************************
 epoch: 0, train_loss: 1.3496, test_loss: 1.3607, test_f1: 0.2404
 epoch: 1, train_loss: 1.3410, test_loss: 1.3582, test_f1: 0.2416
 epoch: 2, train_loss: 1.3357, test_loss: 1.3552, test_f1: 0.2253
 epoch: 3, train_loss: 1.3304, test_loss: 1.3520, test_f1: 0.2281
 epoch: 4, train_loss: 1.3253, test_loss: 1.3488, test_f1: 0.2281
 epoch: 5, train_loss: 1.3202, test_loss: 1.3449, test_f1: 0.2296
 epoch: 6, train_loss: 1.3128, test_loss: 1.3407, test_f1: 0.2432
 epoch: 7, train_loss: 1.3072, test_loss: 1.3359, test_f1: 0.2577
 epoch: 8, train_loss: 1.2989, test_loss: 1.3314, test_f1: 0.2644
 epoch: 9, train_loss: 1.2932, test_loss: 1.3264, test_f1: 0.2630
 epoch: 10, train_loss: 1.2859, test_loss: 1.3212, test_f1: 0.2615
 epoch: 11, train_loss: 1.2815, test_loss: 1.3160, test_f1: 0.2620
 epoch: 12, train_loss: 1.2707, test_loss: 1.3105, test_f1: 0.2618
 epoch: 13, train_loss: 1.2611, test_loss: 1.3052, test_f1: 0.2618
 epoch: 14, train_loss: 1.2559, test_loss: 1.2998, test_f1: 0.2618
 epoch: 15, train_loss: 1.2459, test_loss: 1.2945, test_f1: 0.2618
 epoch: 16, train_loss: 1.2381, test_loss: 1.2884, test_f1: 0.2587
 epoch: 17, train_loss: 1.2295, test_loss: 1.2822, test_f1: 0.2587
 epoch: 18, train_loss: 1.2205, test_loss: 1.2765, test_f1: 0.2587
 epoch: 19, train_loss: 1.2128, test_loss: 1.2706, test_f1: 0.2587
 epoch: 20, train_loss: 1.2075, test_loss: 1.2646, test_f1: 0.2573
 epoch: 21, train_loss: 1.1979, test_loss: 1.2580, test_f1: 0.2707
 epoch: 22, train_loss: 1.1920, test_loss: 1.2522, test_f1: 0.2962
 epoch: 23, train_loss: 1.1813, test_loss: 1.2467, test_f1: 0.3035
 epoch: 24, train_loss: 1.1779, test_loss: 1.2421, test_f1: 0.3239
 epoch: 25, train_loss: 1.1687, test_loss: 1.2367, test_f1: 0.3500
 epoch: 26, train_loss: 1.1611, test_loss: 1.2314, test_f1: 0.3686
 epoch: 27, train_loss: 1.1565, test_loss: 1.2247, test_f1: 0.3686
 epoch: 28, train_loss: 1.1507, test_loss: 1.2189, test_f1: 0.3989
 epoch: 29, train_loss: 1.1430, test_loss: 1.2138, test_f1: 0.4100
 epoch: 30, train_loss: 1.1414, test_loss: 1.2081, test_f1: 0.4243
 epoch: 31, train_loss: 1.1312, test_loss: 1.2063, test_f1: 0.4297
 epoch: 32, train_loss: 1.1261, test_loss: 1.2001, test_f1: 0.4297
 epoch: 33, train_loss: 1.1165, test_loss: 1.1928, test_f1: 0.4297
 epoch: 34, train_loss: 1.1157, test_loss: 1.1856, test_f1: 0.4366
 epoch: 35, train_loss: 1.1063, test_loss: 1.1796, test_f1: 0.4509
 epoch: 36, train_loss: 1.0971, test_loss: 1.1744, test_f1: 0.4427
 epoch: 37, train_loss: 1.0932, test_loss: 1.1705, test_f1: 0.4461
 epoch: 38, train_loss: 1.0857, test_loss: 1.1643, test_f1: 0.4461
 epoch: 39, train_loss: 1.0788, test_loss: 1.1577, test_f1: 0.4542
 epoch: 40, train_loss: 1.0784, test_loss: 1.1524, test_f1: 0.4495
 epoch: 41, train_loss: 1.0652, test_loss: 1.1458, test_f1: 0.4393
 epoch: 42, train_loss: 1.0633, test_loss: 1.1385, test_f1: 0.4461
 epoch: 43, train_loss: 1.0564, test_loss: 1.1358, test_f1: 0.4542
 epoch: 44, train_loss: 1.0523, test_loss: 1.1339, test_f1: 0.4522
 epoch: 45, train_loss: 1.0417, test_loss: 1.1299, test_f1: 0.4444
 epoch: 46, train_loss: 1.0397, test_loss: 1.1196, test_f1: 0.4524
 epoch: 47, train_loss: 1.0296, test_loss: 1.1133, test_f1: 0.4543
 epoch: 48, train_loss: 1.0275, test_loss: 1.1103, test_f1: 0.4568
 epoch: 49, train_loss: 1.0206, test_loss: 1.1042, test_f1: 0.4518
 epoch: 50, train_loss: 1.0215, test_loss: 1.0997, test_f1: 0.4550
 epoch: 51, train_loss: 1.0094, test_loss: 1.0985, test_f1: 0.4551
 epoch: 52, train_loss: 1.0097, test_loss: 1.1017, test_f1: 0.4492
 epoch: 53, train_loss: 1.0079, test_loss: 1.0912, test_f1: 0.4493
 epoch: 54, train_loss: 1.0040, test_loss: 1.0915, test_f1: 0.4524
 epoch: 55, train_loss: 1.0007, test_loss: 1.0891, test_f1: 0.4550
 epoch: 56, train_loss: 0.9951, test_loss: 1.0884, test_f1: 0.4517
 epoch: 57, train_loss: 0.9918, test_loss: 1.0870, test_f1: 0.4551
 epoch: 58, train_loss: 0.9897, test_loss: 1.0826, test_f1: 0.4551
 epoch: 59, train_loss: 0.9815, test_loss: 1.0818, test_f1: 0.4526
 epoch: 60, train_loss: 0.9869, test_loss: 1.0807, test_f1: 0.4551
 epoch: 61, train_loss: 0.9843, test_loss: 1.0753, test_f1: 0.4551
 epoch: 62, train_loss: 0.9799, test_loss: 1.0729, test_f1: 0.4575
 epoch: 63, train_loss: 0.9788, test_loss: 1.0740, test_f1: 0.4575
 epoch: 64, train_loss: 0.9718, test_loss: 1.0722, test_f1: 0.4526
 epoch: 65, train_loss: 0.9730, test_loss: 1.0664, test_f1: 0.4600
 epoch: 66, train_loss: 0.9717, test_loss: 1.0698, test_f1: 0.4600
 epoch: 67, train_loss: 0.9715, test_loss: 1.0711, test_f1: 0.4527
 epoch: 68, train_loss: 0.9688, test_loss: 1.0693, test_f1: 0.4494
 epoch: 69, train_loss: 0.9654, test_loss: 1.0651, test_f1: 0.4413
 epoch: 70, train_loss: 0.9562, test_loss: 1.0589, test_f1: 0.4575
 epoch: 71, train_loss: 0.9535, test_loss: 1.0578, test_f1: 0.4575
 epoch: 72, train_loss: 0.9551, test_loss: 1.0547, test_f1: 0.4607
 epoch: 73, train_loss: 0.9521, test_loss: 1.0528, test_f1: 0.4600
 epoch: 74, train_loss: 0.9541, test_loss: 1.0554, test_f1: 0.4569
 epoch: 75, train_loss: 0.9523, test_loss: 1.0548, test_f1: 0.4569
 epoch: 76, train_loss: 0.9456, test_loss: 1.0509, test_f1: 0.4545
 epoch: 77, train_loss: 0.9493, test_loss: 1.0471, test_f1: 0.4551
 epoch: 78, train_loss: 0.9511, test_loss: 1.0431, test_f1: 0.4593
 epoch: 79, train_loss: 0.9502, test_loss: 1.0367, test_f1: 0.4600
 epoch: 80, train_loss: 0.9420, test_loss: 1.0517, test_f1: 0.4456
 epoch: 81, train_loss: 0.9396, test_loss: 1.0478, test_f1: 0.4585
 epoch: 82, train_loss: 0.9401, test_loss: 1.0387, test_f1: 0.4461
 epoch: 83, train_loss: 0.9378, test_loss: 1.0388, test_f1: 0.4519
 epoch: 84, train_loss: 0.9340, test_loss: 1.0497, test_f1: 0.4373
 epoch: 85, train_loss: 0.9387, test_loss: 1.0501, test_f1: 0.4370
 epoch: 86, train_loss: 0.9327, test_loss: 1.0419, test_f1: 0.4455
 epoch: 87, train_loss: 0.9281, test_loss: 1.0431, test_f1: 0.4389
 epoch: 88, train_loss: 0.9320, test_loss: 1.0494, test_f1: 0.4395
 epoch: 89, train_loss: 0.9311, test_loss: 1.0422, test_f1: 0.4435
 epoch: 90, train_loss: 0.9264, test_loss: 1.0431, test_f1: 0.4455
 epoch: 91, train_loss: 0.9262, test_loss: 1.0436, test_f1: 0.4458
 epoch: 92, train_loss: 0.9200, test_loss: 1.0389, test_f1: 0.4443
 epoch: 93, train_loss: 0.9156, test_loss: 1.0333, test_f1: 0.4394
 epoch: 94, train_loss: 0.9212, test_loss: 1.0372, test_f1: 0.4389
 epoch: 95, train_loss: 0.9205, test_loss: 1.0427, test_f1: 0.4387
 epoch: 96, train_loss: 0.9162, test_loss: 1.0487, test_f1: 0.4225
 epoch: 97, train_loss: 0.9168, test_loss: 1.0339, test_f1: 0.4365
 epoch: 98, train_loss: 0.9092, test_loss: 1.0278, test_f1: 0.4493
 epoch: 99, train_loss: 0.9091, test_loss: 1.0299, test_f1: 0.4371
##################ITERATION #2 ****************************************
 epoch: 0, train_loss: 1.3218, test_loss: 1.3433, test_f1: 0.2281
 epoch: 1, train_loss: 1.3087, test_loss: 1.3415, test_f1: 0.2281
 epoch: 2, train_loss: 1.3004, test_loss: 1.3399, test_f1: 0.2281
 epoch: 3, train_loss: 1.2926, test_loss: 1.3371, test_f1: 0.2281
 epoch: 4, train_loss: 1.2855, test_loss: 1.3333, test_f1: 0.2281
 epoch: 5, train_loss: 1.2781, test_loss: 1.3297, test_f1: 0.2281
 epoch: 6, train_loss: 1.2681, test_loss: 1.3248, test_f1: 0.2281
 epoch: 7, train_loss: 1.2606, test_loss: 1.3197, test_f1: 0.2281
 epoch: 8, train_loss: 1.2506, test_loss: 1.3159, test_f1: 0.2281
 epoch: 9, train_loss: 1.2442, test_loss: 1.3118, test_f1: 0.2281
 epoch: 10, train_loss: 1.2374, test_loss: 1.3062, test_f1: 0.2281
 epoch: 11, train_loss: 1.2306, test_loss: 1.2987, test_f1: 0.2281
 epoch: 12, train_loss: 1.2226, test_loss: 1.2894, test_f1: 0.2281
 epoch: 13, train_loss: 1.2136, test_loss: 1.2770, test_f1: 0.2281
 epoch: 14, train_loss: 1.2050, test_loss: 1.2653, test_f1: 0.2539
 epoch: 15, train_loss: 1.1965, test_loss: 1.2550, test_f1: 0.2876
 epoch: 16, train_loss: 1.1888, test_loss: 1.2489, test_f1: 0.3083
 epoch: 17, train_loss: 1.1808, test_loss: 1.2419, test_f1: 0.3380
 epoch: 18, train_loss: 1.1732, test_loss: 1.2373, test_f1: 0.3592
 epoch: 19, train_loss: 1.1634, test_loss: 1.2303, test_f1: 0.3619
 epoch: 20, train_loss: 1.1545, test_loss: 1.2226, test_f1: 0.3644
 epoch: 21, train_loss: 1.1469, test_loss: 1.2157, test_f1: 0.3574
 epoch: 22, train_loss: 1.1370, test_loss: 1.2099, test_f1: 0.3672
 epoch: 23, train_loss: 1.1312, test_loss: 1.2051, test_f1: 0.3672
 epoch: 24, train_loss: 1.1201, test_loss: 1.1998, test_f1: 0.3674
 epoch: 25, train_loss: 1.1162, test_loss: 1.1937, test_f1: 0.3724
 epoch: 26, train_loss: 1.1084, test_loss: 1.1886, test_f1: 0.3824
 epoch: 27, train_loss: 1.0985, test_loss: 1.1906, test_f1: 0.3787
 epoch: 28, train_loss: 1.0925, test_loss: 1.1850, test_f1: 0.3762
 epoch: 29, train_loss: 1.0874, test_loss: 1.1730, test_f1: 0.3800
 epoch: 30, train_loss: 1.0796, test_loss: 1.1650, test_f1: 0.3838
 epoch: 31, train_loss: 1.0716, test_loss: 1.1547, test_f1: 0.3840
 epoch: 32, train_loss: 1.0649, test_loss: 1.1554, test_f1: 0.3952
 epoch: 33, train_loss: 1.0558, test_loss: 1.1553, test_f1: 0.3952
 epoch: 34, train_loss: 1.0525, test_loss: 1.1491, test_f1: 0.3880
 epoch: 35, train_loss: 1.0497, test_loss: 1.1391, test_f1: 0.3947
 epoch: 36, train_loss: 1.0406, test_loss: 1.1332, test_f1: 0.3931
 epoch: 37, train_loss: 1.0307, test_loss: 1.1281, test_f1: 0.3892
 epoch: 38, train_loss: 1.0246, test_loss: 1.1246, test_f1: 0.4071
 epoch: 39, train_loss: 1.0239, test_loss: 1.1248, test_f1: 0.4129
 epoch: 40, train_loss: 1.0125, test_loss: 1.1194, test_f1: 0.4257
 epoch: 41, train_loss: 1.0094, test_loss: 1.1108, test_f1: 0.4264
 epoch: 42, train_loss: 1.0038, test_loss: 1.1049, test_f1: 0.4254
 epoch: 43, train_loss: 0.9992, test_loss: 1.0982, test_f1: 0.4317
 epoch: 44, train_loss: 0.9961, test_loss: 1.1019, test_f1: 0.4090
 epoch: 45, train_loss: 0.9902, test_loss: 1.0988, test_f1: 0.4238
 epoch: 46, train_loss: 0.9859, test_loss: 1.0969, test_f1: 0.4317
 epoch: 47, train_loss: 0.9836, test_loss: 1.0901, test_f1: 0.4342
 epoch: 48, train_loss: 0.9785, test_loss: 1.0849, test_f1: 0.4270
 epoch: 49, train_loss: 0.9618, test_loss: 1.0848, test_f1: 0.4307
 epoch: 50, train_loss: 0.9579, test_loss: 1.0811, test_f1: 0.4353
 epoch: 51, train_loss: 0.9582, test_loss: 1.0790, test_f1: 0.4353
 epoch: 52, train_loss: 0.9538, test_loss: 1.0760, test_f1: 0.4378
 epoch: 53, train_loss: 0.9534, test_loss: 1.0756, test_f1: 0.4307
 epoch: 54, train_loss: 0.9491, test_loss: 1.0718, test_f1: 0.4360
 epoch: 55, train_loss: 0.9521, test_loss: 1.0769, test_f1: 0.4318
 epoch: 56, train_loss: 0.9519, test_loss: 1.0769, test_f1: 0.4386
 epoch: 57, train_loss: 0.9470, test_loss: 1.0708, test_f1: 0.4407
 epoch: 58, train_loss: 0.9416, test_loss: 1.0719, test_f1: 0.4378
 epoch: 59, train_loss: 0.9471, test_loss: 1.0703, test_f1: 0.4367
 epoch: 60, train_loss: 0.9380, test_loss: 1.0680, test_f1: 0.4329
 epoch: 61, train_loss: 0.9508, test_loss: 1.0700, test_f1: 0.4390
 epoch: 62, train_loss: 0.9401, test_loss: 1.0679, test_f1: 0.4399
 epoch: 63, train_loss: 0.9379, test_loss: 1.0584, test_f1: 0.4479
 epoch: 64, train_loss: 0.9341, test_loss: 1.0660, test_f1: 0.4288
 epoch: 65, train_loss: 0.9327, test_loss: 1.0638, test_f1: 0.4420
 epoch: 66, train_loss: 0.9336, test_loss: 1.0577, test_f1: 0.4534
 epoch: 67, train_loss: 0.9276, test_loss: 1.0615, test_f1: 0.4449
 epoch: 68, train_loss: 0.9285, test_loss: 1.0566, test_f1: 0.4474
 epoch: 69, train_loss: 0.9253, test_loss: 1.0571, test_f1: 0.4419
 epoch: 70, train_loss: 0.9209, test_loss: 1.0552, test_f1: 0.4548
 epoch: 71, train_loss: 0.9245, test_loss: 1.0578, test_f1: 0.4436
 epoch: 72, train_loss: 0.9188, test_loss: 1.0567, test_f1: 0.4454
 epoch: 73, train_loss: 0.9254, test_loss: 1.0511, test_f1: 0.4460
 epoch: 74, train_loss: 0.9158, test_loss: 1.0504, test_f1: 0.4531
 epoch: 75, train_loss: 0.9165, test_loss: 1.0474, test_f1: 0.4544
 epoch: 76, train_loss: 0.9226, test_loss: 1.0496, test_f1: 0.4512
 epoch: 77, train_loss: 0.9133, test_loss: 1.0409, test_f1: 0.4547
 epoch: 78, train_loss: 0.9115, test_loss: 1.0464, test_f1: 0.4451
 epoch: 79, train_loss: 0.9182, test_loss: 1.0486, test_f1: 0.4482
 epoch: 80, train_loss: 0.9190, test_loss: 1.0452, test_f1: 0.4613
 epoch: 81, train_loss: 0.9049, test_loss: 1.0406, test_f1: 0.4613
 epoch: 82, train_loss: 0.9145, test_loss: 1.0468, test_f1: 0.4471
 epoch: 83, train_loss: 0.9061, test_loss: 1.0416, test_f1: 0.4527
 epoch: 84, train_loss: 0.9114, test_loss: 1.0359, test_f1: 0.4544
 epoch: 85, train_loss: 0.9030, test_loss: 1.0411, test_f1: 0.4502
 epoch: 86, train_loss: 0.9062, test_loss: 1.0429, test_f1: 0.4508
 epoch: 87, train_loss: 0.9004, test_loss: 1.0357, test_f1: 0.4531
 epoch: 88, train_loss: 0.8981, test_loss: 1.0386, test_f1: 0.4558
 epoch: 89, train_loss: 0.8984, test_loss: 1.0395, test_f1: 0.4534
 epoch: 90, train_loss: 0.9017, test_loss: 1.0354, test_f1: 0.4516
 epoch: 91, train_loss: 0.8949, test_loss: 1.0359, test_f1: 0.4476
 epoch: 92, train_loss: 0.8941, test_loss: 1.0330, test_f1: 0.4542
 epoch: 93, train_loss: 0.8931, test_loss: 1.0494, test_f1: 0.4397
 epoch: 94, train_loss: 0.9005, test_loss: 1.0370, test_f1: 0.4499
 epoch: 95, train_loss: 0.8957, test_loss: 1.0337, test_f1: 0.4436
 epoch: 96, train_loss: 0.8868, test_loss: 1.0363, test_f1: 0.4450
 epoch: 97, train_loss: 0.8874, test_loss: 1.0377, test_f1: 0.4525
 epoch: 98, train_loss: 0.8908, test_loss: 1.0329, test_f1: 0.4424
 epoch: 99, train_loss: 0.8887, test_loss: 1.0390, test_f1: 0.4268
##################ITERATION #3 ****************************************
 epoch: 0, train_loss: 1.3074, test_loss: 1.3342, test_f1: 0.2281
 epoch: 1, train_loss: 1.2915, test_loss: 1.3275, test_f1: 0.2281
 epoch: 2, train_loss: 1.2831, test_loss: 1.3231, test_f1: 0.2281
 epoch: 3, train_loss: 1.2745, test_loss: 1.3197, test_f1: 0.2281
 epoch: 4, train_loss: 1.2674, test_loss: 1.3171, test_f1: 0.2281
 epoch: 5, train_loss: 1.2597, test_loss: 1.3148, test_f1: 0.2281
 epoch: 6, train_loss: 1.2520, test_loss: 1.3087, test_f1: 0.2281
 epoch: 7, train_loss: 1.2459, test_loss: 1.3022, test_f1: 0.2281
 epoch: 8, train_loss: 1.2387, test_loss: 1.2968, test_f1: 0.2281
 epoch: 9, train_loss: 1.2288, test_loss: 1.2929, test_f1: 0.2281
 epoch: 10, train_loss: 1.2241, test_loss: 1.2894, test_f1: 0.2281
 epoch: 11, train_loss: 1.2173, test_loss: 1.2851, test_f1: 0.2281
 epoch: 12, train_loss: 1.2104, test_loss: 1.2815, test_f1: 0.2281
 epoch: 13, train_loss: 1.2031, test_loss: 1.2766, test_f1: 0.2281
 epoch: 14, train_loss: 1.1977, test_loss: 1.2700, test_f1: 0.2281
 epoch: 15, train_loss: 1.1923, test_loss: 1.2664, test_f1: 0.2281
 epoch: 16, train_loss: 1.1810, test_loss: 1.2639, test_f1: 0.2390
 epoch: 17, train_loss: 1.1787, test_loss: 1.2609, test_f1: 0.2539
 epoch: 18, train_loss: 1.1699, test_loss: 1.2558, test_f1: 0.2718
 epoch: 19, train_loss: 1.1626, test_loss: 1.2509, test_f1: 0.2759
 epoch: 20, train_loss: 1.1574, test_loss: 1.2435, test_f1: 0.3083
 epoch: 21, train_loss: 1.1499, test_loss: 1.2419, test_f1: 0.3212
 epoch: 22, train_loss: 1.1427, test_loss: 1.2373, test_f1: 0.3261
 epoch: 23, train_loss: 1.1363, test_loss: 1.2309, test_f1: 0.3310
 epoch: 24, train_loss: 1.1294, test_loss: 1.2237, test_f1: 0.3310
 epoch: 25, train_loss: 1.1238, test_loss: 1.2184, test_f1: 0.3336
 epoch: 26, train_loss: 1.1202, test_loss: 1.2125, test_f1: 0.3314
 epoch: 27, train_loss: 1.1099, test_loss: 1.2062, test_f1: 0.3314
 epoch: 28, train_loss: 1.1035, test_loss: 1.2012, test_f1: 0.3277
 epoch: 29, train_loss: 1.0923, test_loss: 1.1978, test_f1: 0.3291
 epoch: 30, train_loss: 1.0853, test_loss: 1.1976, test_f1: 0.3241
 epoch: 31, train_loss: 1.0836, test_loss: 1.1920, test_f1: 0.3180
 epoch: 32, train_loss: 1.0755, test_loss: 1.1814, test_f1: 0.3244
 epoch: 33, train_loss: 1.0690, test_loss: 1.1703, test_f1: 0.3345
 epoch: 34, train_loss: 1.0665, test_loss: 1.1666, test_f1: 0.3300
 epoch: 35, train_loss: 1.0582, test_loss: 1.1683, test_f1: 0.3247
 epoch: 36, train_loss: 1.0526, test_loss: 1.1662, test_f1: 0.3207
 epoch: 37, train_loss: 1.0464, test_loss: 1.1643, test_f1: 0.3365
 epoch: 38, train_loss: 1.0412, test_loss: 1.1553, test_f1: 0.3582
 epoch: 39, train_loss: 1.0353, test_loss: 1.1472, test_f1: 0.3402
 epoch: 40, train_loss: 1.0326, test_loss: 1.1450, test_f1: 0.3606
 epoch: 41, train_loss: 1.0250, test_loss: 1.1551, test_f1: 0.3468
 epoch: 42, train_loss: 1.0168, test_loss: 1.1504, test_f1: 0.3620
 epoch: 43, train_loss: 1.0147, test_loss: 1.1394, test_f1: 0.3496
 epoch: 44, train_loss: 1.0117, test_loss: 1.1227, test_f1: 0.3537
 epoch: 45, train_loss: 1.0053, test_loss: 1.1125, test_f1: 0.3621
 epoch: 46, train_loss: 0.9980, test_loss: 1.1212, test_f1: 0.3725
 epoch: 47, train_loss: 0.9999, test_loss: 1.1403, test_f1: 0.3692
 epoch: 48, train_loss: 0.9947, test_loss: 1.1276, test_f1: 0.3812
 epoch: 49, train_loss: 0.9911, test_loss: 1.1108, test_f1: 0.3832
 epoch: 50, train_loss: 0.9838, test_loss: 1.1130, test_f1: 0.3812
 epoch: 51, train_loss: 0.9813, test_loss: 1.1132, test_f1: 0.3812
 epoch: 52, train_loss: 0.9773, test_loss: 1.1103, test_f1: 0.3822
 epoch: 53, train_loss: 0.9715, test_loss: 1.1006, test_f1: 0.3821
 epoch: 54, train_loss: 0.9735, test_loss: 1.0941, test_f1: 0.3770
 epoch: 55, train_loss: 0.9719, test_loss: 1.0920, test_f1: 0.3768
 epoch: 56, train_loss: 0.9648, test_loss: 1.0875, test_f1: 0.3715
 epoch: 57, train_loss: 0.9611, test_loss: 1.0863, test_f1: 0.3715
 epoch: 58, train_loss: 0.9618, test_loss: 1.0826, test_f1: 0.3750
 epoch: 59, train_loss: 0.9603, test_loss: 1.0816, test_f1: 0.3809
 epoch: 60, train_loss: 0.9586, test_loss: 1.0867, test_f1: 0.3761
 epoch: 61, train_loss: 0.9562, test_loss: 1.0824, test_f1: 0.3759
 epoch: 62, train_loss: 0.9595, test_loss: 1.0819, test_f1: 0.3792
 epoch: 63, train_loss: 0.9530, test_loss: 1.0822, test_f1: 0.3743
 epoch: 64, train_loss: 0.9486, test_loss: 1.0840, test_f1: 0.3840
 epoch: 65, train_loss: 0.9528, test_loss: 1.0882, test_f1: 0.3747
 epoch: 66, train_loss: 0.9450, test_loss: 1.0817, test_f1: 0.3827
 epoch: 67, train_loss: 0.9467, test_loss: 1.0892, test_f1: 0.3890
 epoch: 68, train_loss: 0.9474, test_loss: 1.0896, test_f1: 0.3834
 epoch: 69, train_loss: 0.9480, test_loss: 1.0836, test_f1: 0.3872
 epoch: 70, train_loss: 0.9461, test_loss: 1.0771, test_f1: 0.3905
 epoch: 71, train_loss: 0.9379, test_loss: 1.0752, test_f1: 0.3766
 epoch: 72, train_loss: 0.9331, test_loss: 1.0699, test_f1: 0.3789
 epoch: 73, train_loss: 0.9377, test_loss: 1.0655, test_f1: 0.3748
 epoch: 74, train_loss: 0.9367, test_loss: 1.0640, test_f1: 0.3834
 epoch: 75, train_loss: 0.9331, test_loss: 1.0633, test_f1: 0.3857
 epoch: 76, train_loss: 0.9297, test_loss: 1.0663, test_f1: 0.3941
 epoch: 77, train_loss: 0.9330, test_loss: 1.0624, test_f1: 0.3954
 epoch: 78, train_loss: 0.9237, test_loss: 1.0684, test_f1: 0.3891
 epoch: 79, train_loss: 0.9246, test_loss: 1.0680, test_f1: 0.3742
 epoch: 80, train_loss: 0.9195, test_loss: 1.0634, test_f1: 0.3777
 epoch: 81, train_loss: 0.9272, test_loss: 1.0570, test_f1: 0.3718
 epoch: 82, train_loss: 0.9189, test_loss: 1.0562, test_f1: 0.3730
 epoch: 83, train_loss: 0.9194, test_loss: 1.0586, test_f1: 0.3802
 epoch: 84, train_loss: 0.9141, test_loss: 1.0612, test_f1: 0.3821
 epoch: 85, train_loss: 0.9160, test_loss: 1.0550, test_f1: 0.3760
 epoch: 86, train_loss: 0.9154, test_loss: 1.0545, test_f1: 0.3841
 epoch: 87, train_loss: 0.9069, test_loss: 1.0555, test_f1: 0.3928
 epoch: 88, train_loss: 0.9155, test_loss: 1.0639, test_f1: 0.3969
 epoch: 89, train_loss: 0.9065, test_loss: 1.0634, test_f1: 0.3891
 epoch: 90, train_loss: 0.8995, test_loss: 1.0599, test_f1: 0.3898
 epoch: 91, train_loss: 0.9028, test_loss: 1.0628, test_f1: 0.3899
 epoch: 92, train_loss: 0.9027, test_loss: 1.0570, test_f1: 0.3999
 epoch: 93, train_loss: 0.9011, test_loss: 1.0540, test_f1: 0.3978
 epoch: 94, train_loss: 0.8998, test_loss: 1.0534, test_f1: 0.4051
 epoch: 95, train_loss: 0.8986, test_loss: 1.0549, test_f1: 0.4058
 epoch: 96, train_loss: 0.8985, test_loss: 1.0609, test_f1: 0.3946
 epoch: 97, train_loss: 0.8931, test_loss: 1.0508, test_f1: 0.3946
 epoch: 98, train_loss: 0.8934, test_loss: 1.0443, test_f1: 0.4087
 epoch: 99, train_loss: 0.8887, test_loss: 1.0499, test_f1: 0.3974
##################ITERATION #4 ****************************************
 epoch: 0, train_loss: 1.3013, test_loss: 1.3303, test_f1: 0.2281
 epoch: 1, train_loss: 1.2782, test_loss: 1.3229, test_f1: 0.2281
 epoch: 2, train_loss: 1.2599, test_loss: 1.3165, test_f1: 0.2281
 epoch: 3, train_loss: 1.2524, test_loss: 1.3111, test_f1: 0.2281
 epoch: 4, train_loss: 1.2367, test_loss: 1.3048, test_f1: 0.2281
 epoch: 5, train_loss: 1.2256, test_loss: 1.2988, test_f1: 0.2281
 epoch: 6, train_loss: 1.2163, test_loss: 1.2936, test_f1: 0.2281
 epoch: 7, train_loss: 1.2070, test_loss: 1.2863, test_f1: 0.2281
 epoch: 8, train_loss: 1.1963, test_loss: 1.2778, test_f1: 0.2281
 epoch: 9, train_loss: 1.1840, test_loss: 1.2682, test_f1: 0.2281
 epoch: 10, train_loss: 1.1737, test_loss: 1.2580, test_f1: 0.2556
 epoch: 11, train_loss: 1.1724, test_loss: 1.2476, test_f1: 0.3251
 epoch: 12, train_loss: 1.1597, test_loss: 1.2378, test_f1: 0.3448
 epoch: 13, train_loss: 1.1517, test_loss: 1.2292, test_f1: 0.3537
 epoch: 14, train_loss: 1.1424, test_loss: 1.2192, test_f1: 0.3592
 epoch: 15, train_loss: 1.1361, test_loss: 1.2116, test_f1: 0.3590
 epoch: 16, train_loss: 1.1242, test_loss: 1.2038, test_f1: 0.3590
 epoch: 17, train_loss: 1.1180, test_loss: 1.1953, test_f1: 0.3627
 epoch: 18, train_loss: 1.1105, test_loss: 1.1859, test_f1: 0.3642
 epoch: 19, train_loss: 1.1006, test_loss: 1.1766, test_f1: 0.3649
 epoch: 20, train_loss: 1.0894, test_loss: 1.1694, test_f1: 0.3670
 epoch: 21, train_loss: 1.0848, test_loss: 1.1625, test_f1: 0.3829
 epoch: 22, train_loss: 1.0739, test_loss: 1.1554, test_f1: 0.3874
 epoch: 23, train_loss: 1.0661, test_loss: 1.1486, test_f1: 0.3951
 epoch: 24, train_loss: 1.0611, test_loss: 1.1417, test_f1: 0.3991
 epoch: 25, train_loss: 1.0527, test_loss: 1.1365, test_f1: 0.4023
 epoch: 26, train_loss: 1.0499, test_loss: 1.1294, test_f1: 0.4123
 epoch: 27, train_loss: 1.0445, test_loss: 1.1281, test_f1: 0.4194
 epoch: 28, train_loss: 1.0374, test_loss: 1.1253, test_f1: 0.4240
 epoch: 29, train_loss: 1.0295, test_loss: 1.1209, test_f1: 0.4381
 epoch: 30, train_loss: 1.0271, test_loss: 1.1172, test_f1: 0.4393
 epoch: 31, train_loss: 1.0147, test_loss: 1.1155, test_f1: 0.4461
 epoch: 32, train_loss: 1.0077, test_loss: 1.1090, test_f1: 0.4462
 epoch: 33, train_loss: 1.0086, test_loss: 1.1050, test_f1: 0.4585
 epoch: 34, train_loss: 1.0050, test_loss: 1.1051, test_f1: 0.4583
 epoch: 35, train_loss: 0.9952, test_loss: 1.1077, test_f1: 0.4462
 epoch: 36, train_loss: 0.9930, test_loss: 1.0970, test_f1: 0.4553
 epoch: 37, train_loss: 0.9867, test_loss: 1.0890, test_f1: 0.4642
 epoch: 38, train_loss: 0.9824, test_loss: 1.0885, test_f1: 0.4580
 epoch: 39, train_loss: 0.9755, test_loss: 1.0873, test_f1: 0.4444
 epoch: 40, train_loss: 0.9804, test_loss: 1.0842, test_f1: 0.4502
 epoch: 41, train_loss: 0.9759, test_loss: 1.0819, test_f1: 0.4687
 epoch: 42, train_loss: 0.9641, test_loss: 1.0818, test_f1: 0.4608
 epoch: 43, train_loss: 0.9664, test_loss: 1.0814, test_f1: 0.4658
 epoch: 44, train_loss: 0.9556, test_loss: 1.0800, test_f1: 0.4654
 epoch: 45, train_loss: 0.9589, test_loss: 1.0776, test_f1: 0.4626
 epoch: 46, train_loss: 0.9557, test_loss: 1.0749, test_f1: 0.4512
 epoch: 47, train_loss: 0.9469, test_loss: 1.0760, test_f1: 0.4428
 epoch: 48, train_loss: 0.9430, test_loss: 1.0789, test_f1: 0.4525
 epoch: 49, train_loss: 0.9389, test_loss: 1.0687, test_f1: 0.4652
 epoch: 50, train_loss: 0.9493, test_loss: 1.0642, test_f1: 0.4504
 epoch: 51, train_loss: 0.9368, test_loss: 1.0705, test_f1: 0.4414
 epoch: 52, train_loss: 0.9398, test_loss: 1.0724, test_f1: 0.4414
 epoch: 53, train_loss: 0.9354, test_loss: 1.0644, test_f1: 0.4472
 epoch: 54, train_loss: 0.9355, test_loss: 1.0596, test_f1: 0.4481
 epoch: 55, train_loss: 0.9319, test_loss: 1.0569, test_f1: 0.4706
 epoch: 56, train_loss: 0.9251, test_loss: 1.0602, test_f1: 0.4770
 epoch: 57, train_loss: 0.9255, test_loss: 1.0599, test_f1: 0.4700
 epoch: 58, train_loss: 0.9289, test_loss: 1.0620, test_f1: 0.4466
 epoch: 59, train_loss: 0.9264, test_loss: 1.0576, test_f1: 0.4669
 epoch: 60, train_loss: 0.9219, test_loss: 1.0544, test_f1: 0.4765
 epoch: 61, train_loss: 0.9244, test_loss: 1.0537, test_f1: 0.4782
 epoch: 62, train_loss: 0.9161, test_loss: 1.0535, test_f1: 0.4744
 epoch: 63, train_loss: 0.9176, test_loss: 1.0530, test_f1: 0.4607
 epoch: 64, train_loss: 0.9185, test_loss: 1.0499, test_f1: 0.4395
 epoch: 65, train_loss: 0.9079, test_loss: 1.0506, test_f1: 0.4436
 epoch: 66, train_loss: 0.9069, test_loss: 1.0483, test_f1: 0.4469
 epoch: 67, train_loss: 0.9090, test_loss: 1.0489, test_f1: 0.4512
 epoch: 68, train_loss: 0.9126, test_loss: 1.0513, test_f1: 0.4452
 epoch: 69, train_loss: 0.9164, test_loss: 1.0512, test_f1: 0.4449
 epoch: 70, train_loss: 0.9005, test_loss: 1.0520, test_f1: 0.4481
 epoch: 71, train_loss: 0.9060, test_loss: 1.0435, test_f1: 0.4567
 epoch: 72, train_loss: 0.9068, test_loss: 1.0400, test_f1: 0.4491
 epoch: 73, train_loss: 0.9008, test_loss: 1.0425, test_f1: 0.4428
 epoch: 74, train_loss: 0.8897, test_loss: 1.0469, test_f1: 0.4403
 epoch: 75, train_loss: 0.8969, test_loss: 1.0479, test_f1: 0.4712
 epoch: 76, train_loss: 0.8968, test_loss: 1.0498, test_f1: 0.4535
 epoch: 77, train_loss: 0.8926, test_loss: 1.0490, test_f1: 0.4527
 epoch: 78, train_loss: 0.8959, test_loss: 1.0458, test_f1: 0.4467
 epoch: 79, train_loss: 0.8941, test_loss: 1.0421, test_f1: 0.4402
 epoch: 80, train_loss: 0.8825, test_loss: 1.0357, test_f1: 0.4649
 epoch: 81, train_loss: 0.8985, test_loss: 1.0246, test_f1: 0.4675
 epoch: 82, train_loss: 0.8890, test_loss: 1.0308, test_f1: 0.4660
 epoch: 83, train_loss: 0.8894, test_loss: 1.0279, test_f1: 0.4637
 epoch: 84, train_loss: 0.8879, test_loss: 1.0342, test_f1: 0.4521
 epoch: 85, train_loss: 0.8869, test_loss: 1.0371, test_f1: 0.4520
 epoch: 86, train_loss: 0.8800, test_loss: 1.0348, test_f1: 0.4688
 epoch: 87, train_loss: 0.8788, test_loss: 1.0334, test_f1: 0.4799
 epoch: 88, train_loss: 0.8775, test_loss: 1.0354, test_f1: 0.4650
 epoch: 89, train_loss: 0.8771, test_loss: 1.0385, test_f1: 0.4627
 epoch: 90, train_loss: 0.8804, test_loss: 1.0385, test_f1: 0.4585
 epoch: 91, train_loss: 0.8769, test_loss: 1.0365, test_f1: 0.4612
 epoch: 92, train_loss: 0.8754, test_loss: 1.0332, test_f1: 0.4489
 epoch: 93, train_loss: 0.8709, test_loss: 1.0318, test_f1: 0.4805
 epoch: 94, train_loss: 0.8724, test_loss: 1.0292, test_f1: 0.4822
 epoch: 95, train_loss: 0.8688, test_loss: 1.0285, test_f1: 0.4685
 epoch: 96, train_loss: 0.8616, test_loss: 1.0266, test_f1: 0.4685
 epoch: 97, train_loss: 0.8688, test_loss: 1.0295, test_f1: 0.4718
 epoch: 98, train_loss: 0.8676, test_loss: 1.0300, test_f1: 0.4895
 epoch: 99, train_loss: 0.8708, test_loss: 1.0301, test_f1: 0.4912
##################ITERATION #5 ****************************************
 epoch: 0, train_loss: 1.2940, test_loss: 1.3276, test_f1: 0.2281
 epoch: 1, train_loss: 1.2636, test_loss: 1.3207, test_f1: 0.2281
 epoch: 2, train_loss: 1.2523, test_loss: 1.3153, test_f1: 0.2281
 epoch: 3, train_loss: 1.2407, test_loss: 1.3122, test_f1: 0.2281
 epoch: 4, train_loss: 1.2301, test_loss: 1.3090, test_f1: 0.2281
 epoch: 5, train_loss: 1.2196, test_loss: 1.3022, test_f1: 0.2281
 epoch: 6, train_loss: 1.2112, test_loss: 1.2941, test_f1: 0.2281
 epoch: 7, train_loss: 1.2010, test_loss: 1.2840, test_f1: 0.2281
 epoch: 8, train_loss: 1.1892, test_loss: 1.2703, test_f1: 0.2281
 epoch: 9, train_loss: 1.1810, test_loss: 1.2606, test_f1: 0.2718
 epoch: 10, train_loss: 1.1648, test_loss: 1.2443, test_f1: 0.3083
 epoch: 11, train_loss: 1.1616, test_loss: 1.2336, test_f1: 0.3262
 epoch: 12, train_loss: 1.1555, test_loss: 1.2263, test_f1: 0.3344
 epoch: 13, train_loss: 1.1437, test_loss: 1.2187, test_f1: 0.3362
 epoch: 14, train_loss: 1.1415, test_loss: 1.2096, test_f1: 0.3365
 epoch: 15, train_loss: 1.1316, test_loss: 1.2020, test_f1: 0.3365
 epoch: 16, train_loss: 1.1194, test_loss: 1.1912, test_f1: 0.3340
 epoch: 17, train_loss: 1.1130, test_loss: 1.1842, test_f1: 0.3358
 epoch: 18, train_loss: 1.1104, test_loss: 1.1786, test_f1: 0.3270
 epoch: 19, train_loss: 1.1002, test_loss: 1.1760, test_f1: 0.3250
 epoch: 20, train_loss: 1.0880, test_loss: 1.1655, test_f1: 0.3330
 epoch: 21, train_loss: 1.0799, test_loss: 1.1615, test_f1: 0.3334
 epoch: 22, train_loss: 1.0768, test_loss: 1.1535, test_f1: 0.3515
 epoch: 23, train_loss: 1.0694, test_loss: 1.1519, test_f1: 0.3512
 epoch: 24, train_loss: 1.0584, test_loss: 1.1462, test_f1: 0.3487
 epoch: 25, train_loss: 1.0620, test_loss: 1.1424, test_f1: 0.3487
 epoch: 26, train_loss: 1.0535, test_loss: 1.1293, test_f1: 0.3586
 epoch: 27, train_loss: 1.0469, test_loss: 1.1281, test_f1: 0.3468
 epoch: 28, train_loss: 1.0418, test_loss: 1.1289, test_f1: 0.3482
 epoch: 29, train_loss: 1.0380, test_loss: 1.1228, test_f1: 0.3480
 epoch: 30, train_loss: 1.0314, test_loss: 1.1140, test_f1: 0.3490
 epoch: 31, train_loss: 1.0200, test_loss: 1.1103, test_f1: 0.3582
 epoch: 32, train_loss: 1.0185, test_loss: 1.1120, test_f1: 0.3854
 epoch: 33, train_loss: 1.0100, test_loss: 1.1103, test_f1: 0.4165
 epoch: 34, train_loss: 1.0144, test_loss: 1.1053, test_f1: 0.4173
 epoch: 35, train_loss: 1.0060, test_loss: 1.1066, test_f1: 0.4017
 epoch: 36, train_loss: 1.0027, test_loss: 1.1050, test_f1: 0.3933
 epoch: 37, train_loss: 1.0009, test_loss: 1.0996, test_f1: 0.4000
 epoch: 38, train_loss: 0.9880, test_loss: 1.0934, test_f1: 0.4039
 epoch: 39, train_loss: 0.9881, test_loss: 1.0847, test_f1: 0.4322
 epoch: 40, train_loss: 0.9826, test_loss: 1.0828, test_f1: 0.4321
 epoch: 41, train_loss: 0.9803, test_loss: 1.0794, test_f1: 0.4320
 epoch: 42, train_loss: 0.9754, test_loss: 1.0809, test_f1: 0.4320
 epoch: 43, train_loss: 0.9755, test_loss: 1.0783, test_f1: 0.4296
 epoch: 44, train_loss: 0.9645, test_loss: 1.0703, test_f1: 0.4338
 epoch: 45, train_loss: 0.9680, test_loss: 1.0755, test_f1: 0.4280
 epoch: 46, train_loss: 0.9647, test_loss: 1.0691, test_f1: 0.4275
 epoch: 47, train_loss: 0.9564, test_loss: 1.0656, test_f1: 0.4341
 epoch: 48, train_loss: 0.9523, test_loss: 1.0640, test_f1: 0.4409
 epoch: 49, train_loss: 0.9520, test_loss: 1.0760, test_f1: 0.4261
 epoch: 50, train_loss: 0.9499, test_loss: 1.0826, test_f1: 0.4300
 epoch: 51, train_loss: 0.9442, test_loss: 1.0743, test_f1: 0.4254
 epoch: 52, train_loss: 0.9442, test_loss: 1.0689, test_f1: 0.4283
 epoch: 53, train_loss: 0.9419, test_loss: 1.0600, test_f1: 0.4361
 epoch: 54, train_loss: 0.9444, test_loss: 1.0614, test_f1: 0.4293
 epoch: 55, train_loss: 0.9430, test_loss: 1.0603, test_f1: 0.4272
 epoch: 56, train_loss: 0.9295, test_loss: 1.0606, test_f1: 0.4269
 epoch: 57, train_loss: 0.9372, test_loss: 1.0580, test_f1: 0.4319
 epoch: 58, train_loss: 0.9346, test_loss: 1.0496, test_f1: 0.4309
 epoch: 59, train_loss: 0.9274, test_loss: 1.0517, test_f1: 0.4287
 epoch: 60, train_loss: 0.9309, test_loss: 1.0545, test_f1: 0.4291
 epoch: 61, train_loss: 0.9248, test_loss: 1.0612, test_f1: 0.4296
 epoch: 62, train_loss: 0.9228, test_loss: 1.0588, test_f1: 0.4280
 epoch: 63, train_loss: 0.9258, test_loss: 1.0553, test_f1: 0.4328
 epoch: 64, train_loss: 0.9242, test_loss: 1.0439, test_f1: 0.4398
 epoch: 65, train_loss: 0.9171, test_loss: 1.0476, test_f1: 0.4328
 epoch: 66, train_loss: 0.9178, test_loss: 1.0494, test_f1: 0.4363
 epoch: 67, train_loss: 0.9251, test_loss: 1.0472, test_f1: 0.4340
 epoch: 68, train_loss: 0.9183, test_loss: 1.0477, test_f1: 0.4303
 epoch: 69, train_loss: 0.9166, test_loss: 1.0481, test_f1: 0.4396
 epoch: 70, train_loss: 0.9106, test_loss: 1.0544, test_f1: 0.4331
 epoch: 71, train_loss: 0.9076, test_loss: 1.0522, test_f1: 0.4275
 epoch: 72, train_loss: 0.9089, test_loss: 1.0495, test_f1: 0.4275
 epoch: 73, train_loss: 0.9070, test_loss: 1.0552, test_f1: 0.4249
 epoch: 74, train_loss: 0.9020, test_loss: 1.0529, test_f1: 0.4273
 epoch: 75, train_loss: 0.9119, test_loss: 1.0442, test_f1: 0.4271
 epoch: 76, train_loss: 0.8954, test_loss: 1.0431, test_f1: 0.4305
 epoch: 77, train_loss: 0.8986, test_loss: 1.0459, test_f1: 0.4252
 epoch: 78, train_loss: 0.8994, test_loss: 1.0478, test_f1: 0.4309
 epoch: 79, train_loss: 0.9001, test_loss: 1.0468, test_f1: 0.4309
 epoch: 80, train_loss: 0.8980, test_loss: 1.0484, test_f1: 0.4365
 epoch: 81, train_loss: 0.8958, test_loss: 1.0532, test_f1: 0.4303
 epoch: 82, train_loss: 0.8904, test_loss: 1.0350, test_f1: 0.4328
 epoch: 83, train_loss: 0.8958, test_loss: 1.0289, test_f1: 0.4402
 epoch: 84, train_loss: 0.8870, test_loss: 1.0416, test_f1: 0.4325
 epoch: 85, train_loss: 0.8883, test_loss: 1.0432, test_f1: 0.4458
 epoch: 86, train_loss: 0.8854, test_loss: 1.0380, test_f1: 0.4285
 epoch: 87, train_loss: 0.8871, test_loss: 1.0408, test_f1: 0.4450
 epoch: 88, train_loss: 0.8902, test_loss: 1.0415, test_f1: 0.4391
 epoch: 89, train_loss: 0.8852, test_loss: 1.0509, test_f1: 0.4325
 epoch: 90, train_loss: 0.8825, test_loss: 1.0601, test_f1: 0.4282
 epoch: 91, train_loss: 0.8775, test_loss: 1.0610, test_f1: 0.4264
 epoch: 92, train_loss: 0.8778, test_loss: 1.0520, test_f1: 0.4352
 epoch: 93, train_loss: 0.8774, test_loss: 1.0439, test_f1: 0.4294
 epoch: 94, train_loss: 0.8764, test_loss: 1.0348, test_f1: 0.4319
 epoch: 95, train_loss: 0.8753, test_loss: 1.0315, test_f1: 0.4351
 epoch: 96, train_loss: 0.8657, test_loss: 1.0378, test_f1: 0.4286
 epoch: 97, train_loss: 0.8710, test_loss: 1.0412, test_f1: 0.4371
 epoch: 98, train_loss: 0.8741, test_loss: 1.0404, test_f1: 0.4328
 epoch: 99, train_loss: 0.8726, test_loss: 1.0395, test_f1: 0.4463
##################ITERATION #6 ****************************************
 epoch: 0, train_loss: 1.2731, test_loss: 1.3073, test_f1: 0.2281
 epoch: 1, train_loss: 1.2519, test_loss: 1.3032, test_f1: 0.2281
 epoch: 2, train_loss: 1.2369, test_loss: 1.2997, test_f1: 0.2281
 epoch: 3, train_loss: 1.2308, test_loss: 1.2979, test_f1: 0.2281
 epoch: 4, train_loss: 1.2164, test_loss: 1.2939, test_f1: 0.2281
 epoch: 5, train_loss: 1.2135, test_loss: 1.2902, test_f1: 0.2281
 epoch: 6, train_loss: 1.2006, test_loss: 1.2853, test_f1: 0.2281
 epoch: 7, train_loss: 1.1936, test_loss: 1.2763, test_f1: 0.2281
 epoch: 8, train_loss: 1.1935, test_loss: 1.2687, test_f1: 0.2248
 epoch: 9, train_loss: 1.1756, test_loss: 1.2556, test_f1: 0.2281
 epoch: 10, train_loss: 1.1692, test_loss: 1.2423, test_f1: 0.2390
 epoch: 11, train_loss: 1.1574, test_loss: 1.2311, test_f1: 0.2822
 epoch: 12, train_loss: 1.1522, test_loss: 1.2180, test_f1: 0.2996
 epoch: 13, train_loss: 1.1396, test_loss: 1.2111, test_f1: 0.3263
 epoch: 14, train_loss: 1.1315, test_loss: 1.2074, test_f1: 0.3454
 epoch: 15, train_loss: 1.1245, test_loss: 1.2015, test_f1: 0.3499
 epoch: 16, train_loss: 1.1153, test_loss: 1.1885, test_f1: 0.3696
 epoch: 17, train_loss: 1.1109, test_loss: 1.1806, test_f1: 0.3701
 epoch: 18, train_loss: 1.0970, test_loss: 1.1725, test_f1: 0.3810
 epoch: 19, train_loss: 1.0934, test_loss: 1.1645, test_f1: 0.3868
 epoch: 20, train_loss: 1.0814, test_loss: 1.1575, test_f1: 0.3863
 epoch: 21, train_loss: 1.0710, test_loss: 1.1490, test_f1: 0.3871
 epoch: 22, train_loss: 1.0672, test_loss: 1.1401, test_f1: 0.3887
 epoch: 23, train_loss: 1.0560, test_loss: 1.1355, test_f1: 0.3887
 epoch: 24, train_loss: 1.0493, test_loss: 1.1306, test_f1: 0.3952
 epoch: 25, train_loss: 1.0421, test_loss: 1.1248, test_f1: 0.3997
 epoch: 26, train_loss: 1.0322, test_loss: 1.1185, test_f1: 0.4216
 epoch: 27, train_loss: 1.0302, test_loss: 1.1191, test_f1: 0.4263
 epoch: 28, train_loss: 1.0262, test_loss: 1.1175, test_f1: 0.4089
 epoch: 29, train_loss: 1.0126, test_loss: 1.1100, test_f1: 0.4220
 epoch: 30, train_loss: 1.0089, test_loss: 1.1105, test_f1: 0.4130
 epoch: 31, train_loss: 1.0121, test_loss: 1.1048, test_f1: 0.4094
 epoch: 32, train_loss: 0.9998, test_loss: 1.0981, test_f1: 0.4432
 epoch: 33, train_loss: 0.9936, test_loss: 1.0953, test_f1: 0.4327
 epoch: 34, train_loss: 0.9881, test_loss: 1.0939, test_f1: 0.4278
 epoch: 35, train_loss: 0.9875, test_loss: 1.0955, test_f1: 0.4282
 epoch: 36, train_loss: 0.9830, test_loss: 1.0903, test_f1: 0.4292
 epoch: 37, train_loss: 0.9753, test_loss: 1.0851, test_f1: 0.4252
 epoch: 38, train_loss: 0.9757, test_loss: 1.0826, test_f1: 0.4239
 epoch: 39, train_loss: 0.9674, test_loss: 1.0847, test_f1: 0.4292
 epoch: 40, train_loss: 0.9640, test_loss: 1.0804, test_f1: 0.4406
 epoch: 41, train_loss: 0.9607, test_loss: 1.0823, test_f1: 0.4412
 epoch: 42, train_loss: 0.9516, test_loss: 1.0733, test_f1: 0.4476
 epoch: 43, train_loss: 0.9485, test_loss: 1.0774, test_f1: 0.4364
 epoch: 44, train_loss: 0.9413, test_loss: 1.0725, test_f1: 0.4413
 epoch: 45, train_loss: 0.9420, test_loss: 1.0727, test_f1: 0.4174
 epoch: 46, train_loss: 0.9415, test_loss: 1.0712, test_f1: 0.4283
 epoch: 47, train_loss: 0.9327, test_loss: 1.0645, test_f1: 0.4399
 epoch: 48, train_loss: 0.9318, test_loss: 1.0582, test_f1: 0.4190
 epoch: 49, train_loss: 0.9266, test_loss: 1.0643, test_f1: 0.4334
 epoch: 50, train_loss: 0.9308, test_loss: 1.0608, test_f1: 0.4108
 epoch: 51, train_loss: 0.9167, test_loss: 1.0606, test_f1: 0.4088
 epoch: 52, train_loss: 0.9161, test_loss: 1.0560, test_f1: 0.4096
 epoch: 53, train_loss: 0.9149, test_loss: 1.0579, test_f1: 0.4160
 epoch: 54, train_loss: 0.9195, test_loss: 1.0569, test_f1: 0.4062
 epoch: 55, train_loss: 0.9106, test_loss: 1.0551, test_f1: 0.4093
 epoch: 56, train_loss: 0.9101, test_loss: 1.0558, test_f1: 0.4141
 epoch: 57, train_loss: 0.9082, test_loss: 1.0557, test_f1: 0.4052
 epoch: 58, train_loss: 0.9134, test_loss: 1.0568, test_f1: 0.4074
 epoch: 59, train_loss: 0.9007, test_loss: 1.0567, test_f1: 0.4071
 epoch: 60, train_loss: 0.9074, test_loss: 1.0530, test_f1: 0.4125
 epoch: 61, train_loss: 0.8946, test_loss: 1.0513, test_f1: 0.4023
 epoch: 62, train_loss: 0.8986, test_loss: 1.0512, test_f1: 0.4099
 epoch: 63, train_loss: 0.8976, test_loss: 1.0517, test_f1: 0.4121
 epoch: 64, train_loss: 0.8914, test_loss: 1.0542, test_f1: 0.4146
 epoch: 65, train_loss: 0.8970, test_loss: 1.0549, test_f1: 0.4172
 epoch: 66, train_loss: 0.8991, test_loss: 1.0512, test_f1: 0.4115
 epoch: 67, train_loss: 0.8928, test_loss: 1.0555, test_f1: 0.4122
 epoch: 68, train_loss: 0.9000, test_loss: 1.0561, test_f1: 0.4069
 epoch: 69, train_loss: 0.8955, test_loss: 1.0640, test_f1: 0.4013
 epoch: 70, train_loss: 0.8871, test_loss: 1.0641, test_f1: 0.4055
 epoch: 71, train_loss: 0.8859, test_loss: 1.0583, test_f1: 0.4034
 epoch: 72, train_loss: 0.8816, test_loss: 1.0583, test_f1: 0.4031
 epoch: 73, train_loss: 0.8803, test_loss: 1.0549, test_f1: 0.4031
 epoch: 74, train_loss: 0.8911, test_loss: 1.0559, test_f1: 0.4029
 epoch: 75, train_loss: 0.8777, test_loss: 1.0620, test_f1: 0.4047
 epoch: 76, train_loss: 0.8790, test_loss: 1.0656, test_f1: 0.4042
 epoch: 77, train_loss: 0.8745, test_loss: 1.0622, test_f1: 0.4107
 epoch: 78, train_loss: 0.8767, test_loss: 1.0575, test_f1: 0.4107
 epoch: 79, train_loss: 0.8761, test_loss: 1.0565, test_f1: 0.4041
 epoch: 80, train_loss: 0.8664, test_loss: 1.0603, test_f1: 0.4069
 epoch: 81, train_loss: 0.8659, test_loss: 1.0667, test_f1: 0.4136
 epoch: 82, train_loss: 0.8678, test_loss: 1.0697, test_f1: 0.4150
 epoch: 83, train_loss: 0.8706, test_loss: 1.0655, test_f1: 0.4113
 epoch: 84, train_loss: 0.8694, test_loss: 1.0652, test_f1: 0.4124
 epoch: 85, train_loss: 0.8694, test_loss: 1.0671, test_f1: 0.4195
 epoch: 86, train_loss: 0.8622, test_loss: 1.0699, test_f1: 0.4166
 epoch: 87, train_loss: 0.8627, test_loss: 1.0661, test_f1: 0.4243
 epoch: 88, train_loss: 0.8622, test_loss: 1.0676, test_f1: 0.4220
 epoch: 89, train_loss: 0.8547, test_loss: 1.0669, test_f1: 0.4243
 epoch: 90, train_loss: 0.8640, test_loss: 1.0657, test_f1: 0.4433
 epoch: 91, train_loss: 0.8550, test_loss: 1.0700, test_f1: 0.4444
 epoch: 92, train_loss: 0.8487, test_loss: 1.0696, test_f1: 0.4483
 epoch: 93, train_loss: 0.8531, test_loss: 1.0660, test_f1: 0.4473
 epoch: 94, train_loss: 0.8468, test_loss: 1.0637, test_f1: 0.4456
 epoch: 95, train_loss: 0.8493, test_loss: 1.0641, test_f1: 0.4470
 epoch: 96, train_loss: 0.8450, test_loss: 1.0670, test_f1: 0.4365
 epoch: 97, train_loss: 0.8462, test_loss: 1.0697, test_f1: 0.4466
 epoch: 98, train_loss: 0.8468, test_loss: 1.0688, test_f1: 0.4398
 epoch: 99, train_loss: 0.8473, test_loss: 1.0683, test_f1: 0.4545
##################ITERATION #7 ****************************************
 epoch: 0, train_loss: 1.2884, test_loss: 1.3150, test_f1: 0.2281
 epoch: 1, train_loss: 1.2564, test_loss: 1.3123, test_f1: 0.2281
 epoch: 2, train_loss: 1.2430, test_loss: 1.3103, test_f1: 0.2281
 epoch: 3, train_loss: 1.2285, test_loss: 1.3089, test_f1: 0.2281
 epoch: 4, train_loss: 1.2140, test_loss: 1.3071, test_f1: 0.2281
 epoch: 5, train_loss: 1.2073, test_loss: 1.3049, test_f1: 0.2281
 epoch: 6, train_loss: 1.1918, test_loss: 1.2967, test_f1: 0.2281
 epoch: 7, train_loss: 1.1820, test_loss: 1.2809, test_f1: 0.2281
 epoch: 8, train_loss: 1.1690, test_loss: 1.2640, test_f1: 0.2281
 epoch: 9, train_loss: 1.1605, test_loss: 1.2496, test_f1: 0.2675
 epoch: 10, train_loss: 1.1538, test_loss: 1.2370, test_f1: 0.2913
 epoch: 11, train_loss: 1.1441, test_loss: 1.2312, test_f1: 0.3051
 epoch: 12, train_loss: 1.1354, test_loss: 1.2183, test_f1: 0.3317
 epoch: 13, train_loss: 1.1195, test_loss: 1.2071, test_f1: 0.3220
 epoch: 14, train_loss: 1.1189, test_loss: 1.2004, test_f1: 0.3189
 epoch: 15, train_loss: 1.1103, test_loss: 1.1977, test_f1: 0.3168
 epoch: 16, train_loss: 1.1017, test_loss: 1.1914, test_f1: 0.3168
 epoch: 17, train_loss: 1.0949, test_loss: 1.1853, test_f1: 0.3168
 epoch: 18, train_loss: 1.0909, test_loss: 1.1799, test_f1: 0.3192
 epoch: 19, train_loss: 1.0830, test_loss: 1.1738, test_f1: 0.3282
 epoch: 20, train_loss: 1.0750, test_loss: 1.1697, test_f1: 0.3282
 epoch: 21, train_loss: 1.0663, test_loss: 1.1642, test_f1: 0.3289
 epoch: 22, train_loss: 1.0559, test_loss: 1.1534, test_f1: 0.3294
 epoch: 23, train_loss: 1.0633, test_loss: 1.1473, test_f1: 0.3374
 epoch: 24, train_loss: 1.0484, test_loss: 1.1466, test_f1: 0.3528
 epoch: 25, train_loss: 1.0413, test_loss: 1.1424, test_f1: 0.3406
 epoch: 26, train_loss: 1.0470, test_loss: 1.1425, test_f1: 0.3528
 epoch: 27, train_loss: 1.0293, test_loss: 1.1294, test_f1: 0.3651
 epoch: 28, train_loss: 1.0286, test_loss: 1.1235, test_f1: 0.3771
 epoch: 29, train_loss: 1.0217, test_loss: 1.1243, test_f1: 0.3701
 epoch: 30, train_loss: 1.0147, test_loss: 1.1173, test_f1: 0.3749
 epoch: 31, train_loss: 1.0045, test_loss: 1.1130, test_f1: 0.3700
 epoch: 32, train_loss: 1.0000, test_loss: 1.1070, test_f1: 0.3771
 epoch: 33, train_loss: 0.9952, test_loss: 1.1034, test_f1: 0.3676
 epoch: 34, train_loss: 0.9930, test_loss: 1.1015, test_f1: 0.3740
 epoch: 35, train_loss: 0.9923, test_loss: 1.0910, test_f1: 0.3749
 epoch: 36, train_loss: 0.9833, test_loss: 1.0855, test_f1: 0.3811
 epoch: 37, train_loss: 0.9795, test_loss: 1.0928, test_f1: 0.3857
 epoch: 38, train_loss: 0.9842, test_loss: 1.0910, test_f1: 0.3892
 epoch: 39, train_loss: 0.9720, test_loss: 1.0840, test_f1: 0.3916
 epoch: 40, train_loss: 0.9744, test_loss: 1.0769, test_f1: 0.3933
 epoch: 41, train_loss: 0.9687, test_loss: 1.0796, test_f1: 0.4060
 epoch: 42, train_loss: 0.9601, test_loss: 1.0714, test_f1: 0.4078
 epoch: 43, train_loss: 0.9579, test_loss: 1.0686, test_f1: 0.4102
 epoch: 44, train_loss: 0.9541, test_loss: 1.0723, test_f1: 0.3959
 epoch: 45, train_loss: 0.9605, test_loss: 1.0743, test_f1: 0.4111
 epoch: 46, train_loss: 0.9509, test_loss: 1.0707, test_f1: 0.4231
 epoch: 47, train_loss: 0.9429, test_loss: 1.0599, test_f1: 0.4326
 epoch: 48, train_loss: 0.9418, test_loss: 1.0635, test_f1: 0.4342
 epoch: 49, train_loss: 0.9354, test_loss: 1.0667, test_f1: 0.4359
 epoch: 50, train_loss: 0.9275, test_loss: 1.0630, test_f1: 0.4348
 epoch: 51, train_loss: 0.9289, test_loss: 1.0583, test_f1: 0.4421
 epoch: 52, train_loss: 0.9277, test_loss: 1.0536, test_f1: 0.4436
 epoch: 53, train_loss: 0.9213, test_loss: 1.0540, test_f1: 0.4473
 epoch: 54, train_loss: 0.9200, test_loss: 1.0555, test_f1: 0.4444
 epoch: 55, train_loss: 0.9202, test_loss: 1.0570, test_f1: 0.4455
 epoch: 56, train_loss: 0.9176, test_loss: 1.0551, test_f1: 0.4436
 epoch: 57, train_loss: 0.9165, test_loss: 1.0564, test_f1: 0.4401
 epoch: 58, train_loss: 0.9094, test_loss: 1.0576, test_f1: 0.4408
 epoch: 59, train_loss: 0.9172, test_loss: 1.0576, test_f1: 0.4461
 epoch: 60, train_loss: 0.9137, test_loss: 1.0522, test_f1: 0.4473
 epoch: 61, train_loss: 0.9103, test_loss: 1.0536, test_f1: 0.4441
 epoch: 62, train_loss: 0.9172, test_loss: 1.0481, test_f1: 0.4491
 epoch: 63, train_loss: 0.9083, test_loss: 1.0480, test_f1: 0.4511
 epoch: 64, train_loss: 0.9043, test_loss: 1.0456, test_f1: 0.4473
 epoch: 65, train_loss: 0.9083, test_loss: 1.0457, test_f1: 0.4495
 epoch: 66, train_loss: 0.8990, test_loss: 1.0448, test_f1: 0.4491
 epoch: 67, train_loss: 0.8987, test_loss: 1.0481, test_f1: 0.4427
 epoch: 68, train_loss: 0.8949, test_loss: 1.0465, test_f1: 0.4504
 epoch: 69, train_loss: 0.9023, test_loss: 1.0443, test_f1: 0.4472
 epoch: 70, train_loss: 0.8946, test_loss: 1.0414, test_f1: 0.4560
 epoch: 71, train_loss: 0.8946, test_loss: 1.0409, test_f1: 0.4542
 epoch: 72, train_loss: 0.8896, test_loss: 1.0409, test_f1: 0.4464
 epoch: 73, train_loss: 0.8880, test_loss: 1.0376, test_f1: 0.4560
 epoch: 74, train_loss: 0.8873, test_loss: 1.0484, test_f1: 0.4480
 epoch: 75, train_loss: 0.8813, test_loss: 1.0427, test_f1: 0.4532
 epoch: 76, train_loss: 0.8831, test_loss: 1.0372, test_f1: 0.4626
 epoch: 77, train_loss: 0.8782, test_loss: 1.0353, test_f1: 0.4589
 epoch: 78, train_loss: 0.8843, test_loss: 1.0346, test_f1: 0.4576
 epoch: 79, train_loss: 0.8861, test_loss: 1.0377, test_f1: 0.4524
 epoch: 80, train_loss: 0.8806, test_loss: 1.0368, test_f1: 0.4582
 epoch: 81, train_loss: 0.8873, test_loss: 1.0357, test_f1: 0.4560
 epoch: 82, train_loss: 0.8788, test_loss: 1.0271, test_f1: 0.4547
 epoch: 83, train_loss: 0.8782, test_loss: 1.0222, test_f1: 0.4546
 epoch: 84, train_loss: 0.8722, test_loss: 1.0202, test_f1: 0.4527
 epoch: 85, train_loss: 0.8702, test_loss: 1.0231, test_f1: 0.4564
 epoch: 86, train_loss: 0.8716, test_loss: 1.0251, test_f1: 0.4559
 epoch: 87, train_loss: 0.8758, test_loss: 1.0181, test_f1: 0.4592
 epoch: 88, train_loss: 0.8741, test_loss: 1.0147, test_f1: 0.4605
 epoch: 89, train_loss: 0.8681, test_loss: 1.0160, test_f1: 0.4679
 epoch: 90, train_loss: 0.8633, test_loss: 1.0157, test_f1: 0.4624
 epoch: 91, train_loss: 0.8577, test_loss: 1.0153, test_f1: 0.4776
 epoch: 92, train_loss: 0.8597, test_loss: 1.0251, test_f1: 0.4787
 epoch: 93, train_loss: 0.8637, test_loss: 1.0212, test_f1: 0.4749
 epoch: 94, train_loss: 0.8588, test_loss: 1.0183, test_f1: 0.4823
 epoch: 95, train_loss: 0.8563, test_loss: 1.0234, test_f1: 0.4848
 epoch: 96, train_loss: 0.8539, test_loss: 1.0273, test_f1: 0.4920
 epoch: 97, train_loss: 0.8530, test_loss: 1.0220, test_f1: 0.4940
 epoch: 98, train_loss: 0.8580, test_loss: 1.0210, test_f1: 0.4889
 epoch: 99, train_loss: 0.8509, test_loss: 1.0204, test_f1: 0.4970
##################ITERATION #8 ****************************************
 epoch: 0, train_loss: 1.2891, test_loss: 1.3224, test_f1: 0.2281
 epoch: 1, train_loss: 1.2417, test_loss: 1.3172, test_f1: 0.2281
 epoch: 2, train_loss: 1.2220, test_loss: 1.3128, test_f1: 0.2281
 epoch: 3, train_loss: 1.2087, test_loss: 1.3012, test_f1: 0.2281
 epoch: 4, train_loss: 1.1989, test_loss: 1.2913, test_f1: 0.2281
 epoch: 5, train_loss: 1.1752, test_loss: 1.2808, test_f1: 0.2281
 epoch: 6, train_loss: 1.1666, test_loss: 1.2699, test_f1: 0.2281
 epoch: 7, train_loss: 1.1579, test_loss: 1.2586, test_f1: 0.2281
 epoch: 8, train_loss: 1.1400, test_loss: 1.2391, test_f1: 0.2281
 epoch: 9, train_loss: 1.1269, test_loss: 1.2212, test_f1: 0.3018
 epoch: 10, train_loss: 1.1157, test_loss: 1.2066, test_f1: 0.3317
 epoch: 11, train_loss: 1.1068, test_loss: 1.1956, test_f1: 0.3323
 epoch: 12, train_loss: 1.1020, test_loss: 1.1915, test_f1: 0.3485
 epoch: 13, train_loss: 1.0874, test_loss: 1.1872, test_f1: 0.3572
 epoch: 14, train_loss: 1.0838, test_loss: 1.1768, test_f1: 0.3553
 epoch: 15, train_loss: 1.0740, test_loss: 1.1692, test_f1: 0.3623
 epoch: 16, train_loss: 1.0560, test_loss: 1.1622, test_f1: 0.3595
 epoch: 17, train_loss: 1.0521, test_loss: 1.1519, test_f1: 0.3627
 epoch: 18, train_loss: 1.0446, test_loss: 1.1448, test_f1: 0.3767
 epoch: 19, train_loss: 1.0378, test_loss: 1.1462, test_f1: 0.3775
 epoch: 20, train_loss: 1.0328, test_loss: 1.1429, test_f1: 0.3916
 epoch: 21, train_loss: 1.0287, test_loss: 1.1318, test_f1: 0.3760
 epoch: 22, train_loss: 1.0195, test_loss: 1.1274, test_f1: 0.3828
 epoch: 23, train_loss: 1.0127, test_loss: 1.1199, test_f1: 0.3925
 epoch: 24, train_loss: 1.0092, test_loss: 1.1226, test_f1: 0.3902
 epoch: 25, train_loss: 1.0061, test_loss: 1.1173, test_f1: 0.3960
 epoch: 26, train_loss: 0.9917, test_loss: 1.1082, test_f1: 0.3961
 epoch: 27, train_loss: 0.9924, test_loss: 1.1018, test_f1: 0.4027
 epoch: 28, train_loss: 0.9827, test_loss: 1.0984, test_f1: 0.4044
 epoch: 29, train_loss: 0.9798, test_loss: 1.0924, test_f1: 0.4113
 epoch: 30, train_loss: 0.9724, test_loss: 1.0899, test_f1: 0.4051
 epoch: 31, train_loss: 0.9711, test_loss: 1.0992, test_f1: 0.4050
 epoch: 32, train_loss: 0.9634, test_loss: 1.0890, test_f1: 0.4082
 epoch: 33, train_loss: 0.9641, test_loss: 1.0890, test_f1: 0.4063
 epoch: 34, train_loss: 0.9583, test_loss: 1.0905, test_f1: 0.4044
 epoch: 35, train_loss: 0.9564, test_loss: 1.0962, test_f1: 0.4039
 epoch: 36, train_loss: 0.9508, test_loss: 1.0853, test_f1: 0.4089
 epoch: 37, train_loss: 0.9448, test_loss: 1.0771, test_f1: 0.4089
 epoch: 38, train_loss: 0.9334, test_loss: 1.0751, test_f1: 0.4164
 epoch: 39, train_loss: 0.9271, test_loss: 1.0776, test_f1: 0.4362
 epoch: 40, train_loss: 0.9273, test_loss: 1.0829, test_f1: 0.4331
 epoch: 41, train_loss: 0.9223, test_loss: 1.0815, test_f1: 0.4501
 epoch: 42, train_loss: 0.9226, test_loss: 1.0758, test_f1: 0.4446
 epoch: 43, train_loss: 0.9174, test_loss: 1.0667, test_f1: 0.4430
 epoch: 44, train_loss: 0.9103, test_loss: 1.0573, test_f1: 0.4470
 epoch: 45, train_loss: 0.9093, test_loss: 1.0599, test_f1: 0.4578
 epoch: 46, train_loss: 0.9061, test_loss: 1.0648, test_f1: 0.4631
 epoch: 47, train_loss: 0.9072, test_loss: 1.0716, test_f1: 0.4658
 epoch: 48, train_loss: 0.8991, test_loss: 1.0717, test_f1: 0.4723
 epoch: 49, train_loss: 0.9009, test_loss: 1.0660, test_f1: 0.4730
 epoch: 50, train_loss: 0.8907, test_loss: 1.0518, test_f1: 0.4878
 epoch: 51, train_loss: 0.8886, test_loss: 1.0521, test_f1: 0.4864
 epoch: 52, train_loss: 0.8836, test_loss: 1.0630, test_f1: 0.4959
 epoch: 53, train_loss: 0.8873, test_loss: 1.0545, test_f1: 0.4976
 epoch: 54, train_loss: 0.8899, test_loss: 1.0578, test_f1: 0.4840
 epoch: 55, train_loss: 0.8800, test_loss: 1.0722, test_f1: 0.4934
 epoch: 56, train_loss: 0.8798, test_loss: 1.0819, test_f1: 0.4982
 epoch: 57, train_loss: 0.8729, test_loss: 1.0823, test_f1: 0.5038
 epoch: 58, train_loss: 0.8836, test_loss: 1.0694, test_f1: 0.5013
 epoch: 59, train_loss: 0.8804, test_loss: 1.0708, test_f1: 0.4953
 epoch: 60, train_loss: 0.8720, test_loss: 1.0664, test_f1: 0.4955
 epoch: 61, train_loss: 0.8708, test_loss: 1.0768, test_f1: 0.5121
 epoch: 62, train_loss: 0.8727, test_loss: 1.0845, test_f1: 0.4992
 epoch: 63, train_loss: 0.8697, test_loss: 1.0739, test_f1: 0.5033
 epoch: 64, train_loss: 0.8611, test_loss: 1.0834, test_f1: 0.5043
 epoch: 65, train_loss: 0.8609, test_loss: 1.0760, test_f1: 0.5149
 epoch: 66, train_loss: 0.8573, test_loss: 1.0750, test_f1: 0.5115
 epoch: 67, train_loss: 0.8572, test_loss: 1.0768, test_f1: 0.5137
 epoch: 68, train_loss: 0.8644, test_loss: 1.0739, test_f1: 0.5145
 epoch: 69, train_loss: 0.8525, test_loss: 1.0637, test_f1: 0.5196
 epoch: 70, train_loss: 0.8568, test_loss: 1.0642, test_f1: 0.5260
 epoch: 71, train_loss: 0.8521, test_loss: 1.0793, test_f1: 0.5325
 epoch: 72, train_loss: 0.8537, test_loss: 1.0619, test_f1: 0.5158
 epoch: 73, train_loss: 0.8566, test_loss: 1.0694, test_f1: 0.5222
 epoch: 74, train_loss: 0.8488, test_loss: 1.0690, test_f1: 0.5243
 epoch: 75, train_loss: 0.8478, test_loss: 1.0797, test_f1: 0.5310
 epoch: 76, train_loss: 0.8382, test_loss: 1.0872, test_f1: 0.5352
 epoch: 77, train_loss: 0.8417, test_loss: 1.0820, test_f1: 0.5413
 epoch: 78, train_loss: 0.8379, test_loss: 1.0733, test_f1: 0.5360
 epoch: 79, train_loss: 0.8441, test_loss: 1.0745, test_f1: 0.5332
 epoch: 80, train_loss: 0.8418, test_loss: 1.0655, test_f1: 0.5320
 epoch: 81, train_loss: 0.8402, test_loss: 1.0650, test_f1: 0.5297
 epoch: 82, train_loss: 0.8450, test_loss: 1.0641, test_f1: 0.5267
 epoch: 83, train_loss: 0.8332, test_loss: 1.0540, test_f1: 0.5314
 epoch: 84, train_loss: 0.8296, test_loss: 1.0555, test_f1: 0.5339
 epoch: 85, train_loss: 0.8276, test_loss: 1.0625, test_f1: 0.5267
 epoch: 86, train_loss: 0.8324, test_loss: 1.0581, test_f1: 0.5346
 epoch: 87, train_loss: 0.8269, test_loss: 1.0513, test_f1: 0.5431
 epoch: 88, train_loss: 0.8253, test_loss: 1.0573, test_f1: 0.5338
 epoch: 89, train_loss: 0.8282, test_loss: 1.0531, test_f1: 0.5422
 epoch: 90, train_loss: 0.8287, test_loss: 1.0568, test_f1: 0.5396
 epoch: 91, train_loss: 0.8249, test_loss: 1.0649, test_f1: 0.5356
 epoch: 92, train_loss: 0.8212, test_loss: 1.0660, test_f1: 0.5355
 epoch: 93, train_loss: 0.8289, test_loss: 1.0718, test_f1: 0.5372
 epoch: 94, train_loss: 0.8119, test_loss: 1.0880, test_f1: 0.5407
 epoch: 95, train_loss: 0.8217, test_loss: 1.0872, test_f1: 0.5409
 epoch: 96, train_loss: 0.8190, test_loss: 1.0883, test_f1: 0.5401
 epoch: 97, train_loss: 0.8149, test_loss: 1.0934, test_f1: 0.5397
 epoch: 98, train_loss: 0.8143, test_loss: 1.0770, test_f1: 0.5401
 epoch: 99, train_loss: 0.8100, test_loss: 1.0787, test_f1: 0.5358
##################ITERATION #9 ****************************************
 epoch: 0, train_loss: 1.2623, test_loss: 1.2993, test_f1: 0.2281
 epoch: 1, train_loss: 1.2241, test_loss: 1.3112, test_f1: 0.2281
 epoch: 2, train_loss: 1.2024, test_loss: 1.3085, test_f1: 0.2281
 epoch: 3, train_loss: 1.1985, test_loss: 1.2967, test_f1: 0.2281
 epoch: 4, train_loss: 1.1791, test_loss: 1.2886, test_f1: 0.2281
 epoch: 5, train_loss: 1.1679, test_loss: 1.2842, test_f1: 0.2281
 epoch: 6, train_loss: 1.1583, test_loss: 1.2679, test_f1: 0.2281
 epoch: 7, train_loss: 1.1441, test_loss: 1.2543, test_f1: 0.2281
 epoch: 8, train_loss: 1.1470, test_loss: 1.2396, test_f1: 0.2586
 epoch: 9, train_loss: 1.1285, test_loss: 1.2240, test_f1: 0.3071
 epoch: 10, train_loss: 1.1168, test_loss: 1.2111, test_f1: 0.3273
 epoch: 11, train_loss: 1.1120, test_loss: 1.1997, test_f1: 0.3347
 epoch: 12, train_loss: 1.1048, test_loss: 1.1909, test_f1: 0.3786
 epoch: 13, train_loss: 1.1038, test_loss: 1.1827, test_f1: 0.3930
 epoch: 14, train_loss: 1.0923, test_loss: 1.1801, test_f1: 0.3957
 epoch: 15, train_loss: 1.0789, test_loss: 1.1751, test_f1: 0.3991
 epoch: 16, train_loss: 1.0779, test_loss: 1.1687, test_f1: 0.3980
 epoch: 17, train_loss: 1.0645, test_loss: 1.1647, test_f1: 0.3997
 epoch: 18, train_loss: 1.0607, test_loss: 1.1607, test_f1: 0.4020
 epoch: 19, train_loss: 1.0481, test_loss: 1.1622, test_f1: 0.3979
 epoch: 20, train_loss: 1.0511, test_loss: 1.1596, test_f1: 0.3968
 epoch: 21, train_loss: 1.0392, test_loss: 1.1570, test_f1: 0.3957
 epoch: 22, train_loss: 1.0396, test_loss: 1.1551, test_f1: 0.4070
 epoch: 23, train_loss: 1.0329, test_loss: 1.1502, test_f1: 0.4043
 epoch: 24, train_loss: 1.0258, test_loss: 1.1494, test_f1: 0.4003
 epoch: 25, train_loss: 1.0149, test_loss: 1.1505, test_f1: 0.4140
 epoch: 26, train_loss: 1.0146, test_loss: 1.1471, test_f1: 0.4221
 epoch: 27, train_loss: 1.0096, test_loss: 1.1442, test_f1: 0.4271
 epoch: 28, train_loss: 1.0026, test_loss: 1.1424, test_f1: 0.4338
 epoch: 29, train_loss: 1.0002, test_loss: 1.1417, test_f1: 0.4228
 epoch: 30, train_loss: 0.9957, test_loss: 1.1378, test_f1: 0.4493
 epoch: 31, train_loss: 0.9905, test_loss: 1.1320, test_f1: 0.4504
 epoch: 32, train_loss: 0.9811, test_loss: 1.1338, test_f1: 0.4517
 epoch: 33, train_loss: 0.9840, test_loss: 1.1387, test_f1: 0.4430
 epoch: 34, train_loss: 0.9786, test_loss: 1.1383, test_f1: 0.4458
 epoch: 35, train_loss: 0.9764, test_loss: 1.1367, test_f1: 0.4392
 epoch: 36, train_loss: 0.9756, test_loss: 1.1390, test_f1: 0.4364
 epoch: 37, train_loss: 0.9658, test_loss: 1.1358, test_f1: 0.4489
 epoch: 38, train_loss: 0.9607, test_loss: 1.1311, test_f1: 0.4518
 epoch: 39, train_loss: 0.9633, test_loss: 1.1232, test_f1: 0.4451
 epoch: 40, train_loss: 0.9572, test_loss: 1.1156, test_f1: 0.4395
 epoch: 41, train_loss: 0.9537, test_loss: 1.1141, test_f1: 0.4420
 epoch: 42, train_loss: 0.9495, test_loss: 1.1133, test_f1: 0.4407
 epoch: 43, train_loss: 0.9412, test_loss: 1.1163, test_f1: 0.4437
 epoch: 44, train_loss: 0.9405, test_loss: 1.1207, test_f1: 0.4437
 epoch: 45, train_loss: 0.9338, test_loss: 1.1158, test_f1: 0.4408
 epoch: 46, train_loss: 0.9375, test_loss: 1.1142, test_f1: 0.4454
 epoch: 47, train_loss: 0.9352, test_loss: 1.1114, test_f1: 0.4356
 epoch: 48, train_loss: 0.9328, test_loss: 1.1062, test_f1: 0.4457
 epoch: 49, train_loss: 0.9172, test_loss: 1.1058, test_f1: 0.4567
 epoch: 50, train_loss: 0.9290, test_loss: 1.0984, test_f1: 0.4484
 epoch: 51, train_loss: 0.9212, test_loss: 1.1065, test_f1: 0.4469
 epoch: 52, train_loss: 0.9157, test_loss: 1.1019, test_f1: 0.4448
 epoch: 53, train_loss: 0.9181, test_loss: 1.0963, test_f1: 0.4411
 epoch: 54, train_loss: 0.9084, test_loss: 1.0961, test_f1: 0.4451
 epoch: 55, train_loss: 0.9165, test_loss: 1.0963, test_f1: 0.4436
 epoch: 56, train_loss: 0.9121, test_loss: 1.1022, test_f1: 0.4527
 epoch: 57, train_loss: 0.9029, test_loss: 1.1054, test_f1: 0.4505
 epoch: 58, train_loss: 0.9074, test_loss: 1.1076, test_f1: 0.4484
 epoch: 59, train_loss: 0.9032, test_loss: 1.1021, test_f1: 0.4533
 epoch: 60, train_loss: 0.9003, test_loss: 1.1057, test_f1: 0.4414
 epoch: 61, train_loss: 0.9012, test_loss: 1.1029, test_f1: 0.4438
 epoch: 62, train_loss: 0.8987, test_loss: 1.1016, test_f1: 0.4355
 epoch: 63, train_loss: 0.8934, test_loss: 1.1026, test_f1: 0.4464
 epoch: 64, train_loss: 0.8967, test_loss: 1.0958, test_f1: 0.4481
 epoch: 65, train_loss: 0.8890, test_loss: 1.0936, test_f1: 0.4442
 epoch: 66, train_loss: 0.8961, test_loss: 1.0975, test_f1: 0.4463
 epoch: 67, train_loss: 0.8896, test_loss: 1.1006, test_f1: 0.4391
 epoch: 68, train_loss: 0.8934, test_loss: 1.0974, test_f1: 0.4442
 epoch: 69, train_loss: 0.8883, test_loss: 1.0970, test_f1: 0.4442
 epoch: 70, train_loss: 0.8872, test_loss: 1.0866, test_f1: 0.4519
 epoch: 71, train_loss: 0.8797, test_loss: 1.0918, test_f1: 0.4588
 epoch: 72, train_loss: 0.8825, test_loss: 1.0899, test_f1: 0.4488
 epoch: 73, train_loss: 0.8806, test_loss: 1.0946, test_f1: 0.4431
 epoch: 74, train_loss: 0.8788, test_loss: 1.1014, test_f1: 0.4343
 epoch: 75, train_loss: 0.8777, test_loss: 1.1065, test_f1: 0.4387
 epoch: 76, train_loss: 0.8831, test_loss: 1.0925, test_f1: 0.4480
 epoch: 77, train_loss: 0.8755, test_loss: 1.0853, test_f1: 0.4607
 epoch: 78, train_loss: 0.8752, test_loss: 1.0765, test_f1: 0.4627
 epoch: 79, train_loss: 0.8709, test_loss: 1.0723, test_f1: 0.4629
 epoch: 80, train_loss: 0.8662, test_loss: 1.0753, test_f1: 0.4696
 epoch: 81, train_loss: 0.8684, test_loss: 1.0758, test_f1: 0.4654
 epoch: 82, train_loss: 0.8641, test_loss: 1.0828, test_f1: 0.4610
 epoch: 83, train_loss: 0.8643, test_loss: 1.0844, test_f1: 0.4539
 epoch: 84, train_loss: 0.8654, test_loss: 1.0859, test_f1: 0.4545
 epoch: 85, train_loss: 0.8594, test_loss: 1.0876, test_f1: 0.4413
 epoch: 86, train_loss: 0.8645, test_loss: 1.0894, test_f1: 0.4363
 epoch: 87, train_loss: 0.8524, test_loss: 1.0880, test_f1: 0.4427
 epoch: 88, train_loss: 0.8626, test_loss: 1.0858, test_f1: 0.4525
 epoch: 89, train_loss: 0.8605, test_loss: 1.0851, test_f1: 0.4530
 epoch: 90, train_loss: 0.8518, test_loss: 1.0894, test_f1: 0.4570
 epoch: 91, train_loss: 0.8521, test_loss: 1.0929, test_f1: 0.4432
 epoch: 92, train_loss: 0.8473, test_loss: 1.0893, test_f1: 0.4559
 epoch: 93, train_loss: 0.8466, test_loss: 1.0988, test_f1: 0.4502
 epoch: 94, train_loss: 0.8462, test_loss: 1.1024, test_f1: 0.4462
 epoch: 95, train_loss: 0.8450, test_loss: 1.1026, test_f1: 0.4529
 epoch: 96, train_loss: 0.8445, test_loss: 1.1098, test_f1: 0.4373
 epoch: 97, train_loss: 0.8480, test_loss: 1.0958, test_f1: 0.4518
 epoch: 98, train_loss: 0.8428, test_loss: 1.0898, test_f1: 0.4485
 epoch: 99, train_loss: 0.8429, test_loss: 1.0850, test_f1: 0.4521

Training completed in 319.29 seconds
Best F1: 0.5431 at epoch 87
Mean F1 across iterations: 0.4690  0.0337
========================FINAL RESULTS================================
FEGIN weighted F1: 0.5431  0.0337
python main.py --data ltspice_demos --representation component_pin --model FEGIN --layers 4 --hiddens 64 --batch_size 256 --lr 0.0001 --emb_size 128 --epochs 100 --save_appendix component_pin_L4_H64_BS256_LR0.0001_E128 --no_val
-----



STDERR:
  File "main.py", line 370, in <module>
    main()
  File "main.py", line 254, in main
    dataset = dataset_class(
  File "/home/philip/projects/ltspice_examples_code_repo/Circuit-Completion-Using-GNNs/component_classification_with_link_prediction_head/evaluation/FEGIN/kernel/circuit_datasets.py", line 15, in __init__
    self.data, self.slices = torch.load(self.processed_paths[0])
  File "/home/philip/.local/lib/python3.8/site-packages/torch/serialization.py", line 1040, in load
    warnings.warn(
  File "/usr/lib/python3.8/warnings.py", line 109, in _showwarnmsg
    sw(msg.message, msg.category, msg.filename, msg.lineno,
  File "main.py", line 47, in warn_with_traceback
    traceback.print_stack(file=log)
/home/philip/projects/ltspice_examples_code_repo/Circuit-Completion-Using-GNNs/component_classification_with_link_prediction_head/evaluation/FEGIN/kernel/circuit_datasets.py:15: FutureWarning: You are using `torch.load` with `weights_only=False` (the current default value), which uses the default pickle module implicitly. It is possible to construct malicious pickle data which will execute arbitrary code during unpickling (See https://github.com/pytorch/pytorch/blob/main/SECURITY.md#untrusted-models for more details). In a future release, the default value for `weights_only` will be flipped to `True`. This limits the functions that could be executed during unpickling. Arbitrary objects will no longer be allowed to be loaded via this mode unless they are explicitly allowlisted by the user via `torch.serialization.add_safe_globals`. We recommend you start setting `weights_only=True` for any use case where you don't have full control of the loaded file. Please open an issue on GitHub for any issues related to this experimental feature.
  self.data, self.slices = torch.load(self.processed_paths[0])
