STDOUT:
Results will be saved in /home/philip/projects/ltspice_examples_code_repo/Circuit-Completion-Using-GNNs/component_classification_with_link_prediction_head/evaluation/FEGIN/results/model_FEGIN_dataset_ltspice_demos
Command line input: python main.py --data ltspice_demos --representation component_pin --model FEGIN --layers 5 --hiddens 16 --batch_size 256 --lr 0.001 --emb_size 128 --epochs 100 --save_appendix component_pin_L5_H16_BS256_LR0.001_E128 --no_val
 is saved.
-----
ltspice_demos - FEGIN
Using 5 layers, 16 hidden units, h = 2
Loading component_pin representation dataset
ENTERED
Training FEGIN on component_pin representation
Train: 1565, Test: 383
##################ITERATION #0 ****************************************
 epoch: 0, train_loss: 1.4767, test_loss: 1.4581, test_f1: 0.0507
 epoch: 1, train_loss: 1.4640, test_loss: 1.4522, test_f1: 0.0507
 epoch: 2, train_loss: 1.4564, test_loss: 1.4456, test_f1: 0.0507
 epoch: 3, train_loss: 1.4486, test_loss: 1.4393, test_f1: 0.0507
 epoch: 4, train_loss: 1.4397, test_loss: 1.4321, test_f1: 0.0507
 epoch: 5, train_loss: 1.4297, test_loss: 1.4215, test_f1: 0.0507
 epoch: 6, train_loss: 1.4164, test_loss: 1.4071, test_f1: 0.0507
 epoch: 7, train_loss: 1.4021, test_loss: 1.3895, test_f1: 0.0507
 epoch: 8, train_loss: 1.3851, test_loss: 1.3674, test_f1: 0.2025
 epoch: 9, train_loss: 1.3585, test_loss: 1.3451, test_f1: 0.2628
 epoch: 10, train_loss: 1.3391, test_loss: 1.3272, test_f1: 0.3237
 epoch: 11, train_loss: 1.3111, test_loss: 1.3127, test_f1: 0.3426
 epoch: 12, train_loss: 1.2921, test_loss: 1.3001, test_f1: 0.3446
 epoch: 13, train_loss: 1.2748, test_loss: 1.2890, test_f1: 0.3367
 epoch: 14, train_loss: 1.2452, test_loss: 1.2792, test_f1: 0.3190
 epoch: 15, train_loss: 1.2417, test_loss: 1.2687, test_f1: 0.3191
 epoch: 16, train_loss: 1.2226, test_loss: 1.2612, test_f1: 0.3262
 epoch: 17, train_loss: 1.2195, test_loss: 1.2595, test_f1: 0.3359
 epoch: 18, train_loss: 1.2103, test_loss: 1.2443, test_f1: 0.3310
 epoch: 19, train_loss: 1.1973, test_loss: 1.2350, test_f1: 0.3152
 epoch: 20, train_loss: 1.1830, test_loss: 1.2209, test_f1: 0.3419
 epoch: 21, train_loss: 1.1688, test_loss: 1.2077, test_f1: 0.3372
 epoch: 22, train_loss: 1.1567, test_loss: 1.1988, test_f1: 0.3398
 epoch: 23, train_loss: 1.1453, test_loss: 1.1885, test_f1: 0.4109
 epoch: 24, train_loss: 1.1319, test_loss: 1.1784, test_f1: 0.4274
 epoch: 25, train_loss: 1.1181, test_loss: 1.1663, test_f1: 0.4616
 epoch: 26, train_loss: 1.1094, test_loss: 1.1534, test_f1: 0.4721
 epoch: 27, train_loss: 1.0907, test_loss: 1.1252, test_f1: 0.4443
 epoch: 28, train_loss: 1.0712, test_loss: 1.1097, test_f1: 0.4235
 epoch: 29, train_loss: 1.0557, test_loss: 1.0996, test_f1: 0.4409
 epoch: 30, train_loss: 1.0387, test_loss: 1.0815, test_f1: 0.4515
 epoch: 31, train_loss: 1.0336, test_loss: 1.1021, test_f1: 0.4552
 epoch: 32, train_loss: 1.0203, test_loss: 1.0938, test_f1: 0.4532
 epoch: 33, train_loss: 1.0046, test_loss: 1.0685, test_f1: 0.4644
 epoch: 34, train_loss: 0.9905, test_loss: 1.0672, test_f1: 0.4391
 epoch: 35, train_loss: 0.9833, test_loss: 1.0537, test_f1: 0.4373
 epoch: 36, train_loss: 0.9762, test_loss: 1.1223, test_f1: 0.4288
 epoch: 37, train_loss: 0.9732, test_loss: 1.0774, test_f1: 0.4450
 epoch: 38, train_loss: 0.9588, test_loss: 1.1860, test_f1: 0.3923
 epoch: 39, train_loss: 0.9634, test_loss: 1.2610, test_f1: 0.3362
 epoch: 40, train_loss: 0.9541, test_loss: 1.1085, test_f1: 0.4291
 epoch: 41, train_loss: 0.9604, test_loss: 1.1208, test_f1: 0.4346
 epoch: 42, train_loss: 0.9451, test_loss: 1.1429, test_f1: 0.4358
 epoch: 43, train_loss: 0.9397, test_loss: 1.2036, test_f1: 0.4411
 epoch: 44, train_loss: 0.9288, test_loss: 1.2523, test_f1: 0.4848
 epoch: 45, train_loss: 0.9325, test_loss: 1.2765, test_f1: 0.4863
 epoch: 46, train_loss: 0.9268, test_loss: 1.2113, test_f1: 0.4987
 epoch: 47, train_loss: 0.9230, test_loss: 1.1724, test_f1: 0.5027
 epoch: 48, train_loss: 0.9129, test_loss: 1.0760, test_f1: 0.5172
 epoch: 49, train_loss: 0.9046, test_loss: 1.1603, test_f1: 0.5044
 epoch: 50, train_loss: 0.9118, test_loss: 1.2021, test_f1: 0.4531
 epoch: 51, train_loss: 0.9053, test_loss: 1.1651, test_f1: 0.4929
 epoch: 52, train_loss: 0.9046, test_loss: 1.2884, test_f1: 0.4830
 epoch: 53, train_loss: 0.9003, test_loss: 1.1207, test_f1: 0.5291
 epoch: 54, train_loss: 0.8945, test_loss: 1.0791, test_f1: 0.5292
 epoch: 55, train_loss: 0.9011, test_loss: 1.0814, test_f1: 0.5115
 epoch: 56, train_loss: 0.8917, test_loss: 1.1136, test_f1: 0.5226
 epoch: 57, train_loss: 0.8814, test_loss: 1.1430, test_f1: 0.5297
 epoch: 58, train_loss: 0.8892, test_loss: 1.1382, test_f1: 0.5315
 epoch: 59, train_loss: 0.8859, test_loss: 1.1484, test_f1: 0.5151
 epoch: 60, train_loss: 0.8837, test_loss: 1.1163, test_f1: 0.5297
 epoch: 61, train_loss: 0.8733, test_loss: 1.0870, test_f1: 0.5267
 epoch: 62, train_loss: 0.8738, test_loss: 1.0932, test_f1: 0.5427
 epoch: 63, train_loss: 0.8811, test_loss: 1.1792, test_f1: 0.5287
 epoch: 64, train_loss: 0.8731, test_loss: 1.2261, test_f1: 0.5341
 epoch: 65, train_loss: 0.8697, test_loss: 1.2136, test_f1: 0.5393
 epoch: 66, train_loss: 0.8736, test_loss: 1.2358, test_f1: 0.5272
 epoch: 67, train_loss: 0.8665, test_loss: 1.2027, test_f1: 0.5305
 epoch: 68, train_loss: 0.8617, test_loss: 1.1466, test_f1: 0.5366
 epoch: 69, train_loss: 0.8596, test_loss: 1.1168, test_f1: 0.5369
 epoch: 70, train_loss: 0.8731, test_loss: 1.0499, test_f1: 0.5447
 epoch: 71, train_loss: 0.8647, test_loss: 1.0097, test_f1: 0.5660
 epoch: 72, train_loss: 0.8623, test_loss: 1.0390, test_f1: 0.5532
 epoch: 73, train_loss: 0.8671, test_loss: 1.1086, test_f1: 0.5183
 epoch: 74, train_loss: 0.8493, test_loss: 1.1884, test_f1: 0.5546
 epoch: 75, train_loss: 0.8493, test_loss: 1.1606, test_f1: 0.5605
 epoch: 76, train_loss: 0.8632, test_loss: 1.1370, test_f1: 0.5487
 epoch: 77, train_loss: 0.8547, test_loss: 1.1712, test_f1: 0.5347
 epoch: 78, train_loss: 0.8433, test_loss: 1.1812, test_f1: 0.5426
 epoch: 79, train_loss: 0.8462, test_loss: 1.1175, test_f1: 0.5455
 epoch: 80, train_loss: 0.8496, test_loss: 1.2062, test_f1: 0.5454
 epoch: 81, train_loss: 0.8397, test_loss: 1.2509, test_f1: 0.5451
 epoch: 82, train_loss: 0.8467, test_loss: 1.2268, test_f1: 0.5495
 epoch: 83, train_loss: 0.8455, test_loss: 1.2539, test_f1: 0.5334
 epoch: 84, train_loss: 0.8417, test_loss: 1.2601, test_f1: 0.5144
 epoch: 85, train_loss: 0.8443, test_loss: 1.2503, test_f1: 0.5283
 epoch: 86, train_loss: 0.8429, test_loss: 1.2355, test_f1: 0.5438
 epoch: 87, train_loss: 0.8281, test_loss: 1.1182, test_f1: 0.5633
 epoch: 88, train_loss: 0.8319, test_loss: 1.0709, test_f1: 0.5594
 epoch: 89, train_loss: 0.8325, test_loss: 1.0140, test_f1: 0.5618
 epoch: 90, train_loss: 0.8443, test_loss: 1.0975, test_f1: 0.5561
 epoch: 91, train_loss: 0.8392, test_loss: 1.1466, test_f1: 0.5552
 epoch: 92, train_loss: 0.8346, test_loss: 1.1810, test_f1: 0.5675
 epoch: 93, train_loss: 0.8276, test_loss: 1.2360, test_f1: 0.5658
 epoch: 94, train_loss: 0.8211, test_loss: 1.1545, test_f1: 0.5719
 epoch: 95, train_loss: 0.8201, test_loss: 1.1100, test_f1: 0.5483
 epoch: 96, train_loss: 0.8172, test_loss: 1.1011, test_f1: 0.5354
 epoch: 97, train_loss: 0.8207, test_loss: 1.1042, test_f1: 0.5401
 epoch: 98, train_loss: 0.8237, test_loss: 1.1269, test_f1: 0.5297
 epoch: 99, train_loss: 0.8278, test_loss: 1.1949, test_f1: 0.5233
##################ITERATION #1 ****************************************
 epoch: 0, train_loss: 1.3746, test_loss: 1.3744, test_f1: 0.1134
 epoch: 1, train_loss: 1.3492, test_loss: 1.3629, test_f1: 0.1365
 epoch: 2, train_loss: 1.3321, test_loss: 1.3510, test_f1: 0.1365
 epoch: 3, train_loss: 1.3149, test_loss: 1.3405, test_f1: 0.1365
 epoch: 4, train_loss: 1.2964, test_loss: 1.3314, test_f1: 0.1365
 epoch: 5, train_loss: 1.2759, test_loss: 1.3205, test_f1: 0.1368
 epoch: 6, train_loss: 1.2546, test_loss: 1.3070, test_f1: 0.3164
 epoch: 7, train_loss: 1.2420, test_loss: 1.2887, test_f1: 0.3391
 epoch: 8, train_loss: 1.2271, test_loss: 1.2749, test_f1: 0.3385
 epoch: 9, train_loss: 1.2178, test_loss: 1.2679, test_f1: 0.3251
 epoch: 10, train_loss: 1.2125, test_loss: 1.2578, test_f1: 0.3343
 epoch: 11, train_loss: 1.1975, test_loss: 1.2473, test_f1: 0.3324
 epoch: 12, train_loss: 1.1913, test_loss: 1.2384, test_f1: 0.3322
 epoch: 13, train_loss: 1.1816, test_loss: 1.2261, test_f1: 0.3350
 epoch: 14, train_loss: 1.1649, test_loss: 1.2195, test_f1: 0.3520
 epoch: 15, train_loss: 1.1656, test_loss: 1.2097, test_f1: 0.3939
 epoch: 16, train_loss: 1.1572, test_loss: 1.2053, test_f1: 0.4318
 epoch: 17, train_loss: 1.1461, test_loss: 1.1956, test_f1: 0.4293
 epoch: 18, train_loss: 1.1351, test_loss: 1.1808, test_f1: 0.4272
 epoch: 19, train_loss: 1.1158, test_loss: 1.1675, test_f1: 0.4284
 epoch: 20, train_loss: 1.1123, test_loss: 1.1548, test_f1: 0.4262
 epoch: 21, train_loss: 1.1110, test_loss: 1.1453, test_f1: 0.4293
 epoch: 22, train_loss: 1.0918, test_loss: 1.1389, test_f1: 0.4203
 epoch: 23, train_loss: 1.0819, test_loss: 1.1407, test_f1: 0.4347
 epoch: 24, train_loss: 1.0731, test_loss: 1.1320, test_f1: 0.4328
 epoch: 25, train_loss: 1.0767, test_loss: 1.1215, test_f1: 0.4188
 epoch: 26, train_loss: 1.0575, test_loss: 1.1013, test_f1: 0.3946
 epoch: 27, train_loss: 1.0602, test_loss: 1.0983, test_f1: 0.3966
 epoch: 28, train_loss: 1.0481, test_loss: 1.1000, test_f1: 0.4517
 epoch: 29, train_loss: 1.0277, test_loss: 1.0943, test_f1: 0.4340
 epoch: 30, train_loss: 1.0209, test_loss: 1.0821, test_f1: 0.4483
 epoch: 31, train_loss: 1.0075, test_loss: 1.0792, test_f1: 0.4448
 epoch: 32, train_loss: 1.0120, test_loss: 1.0779, test_f1: 0.4279
 epoch: 33, train_loss: 0.9980, test_loss: 1.0854, test_f1: 0.3942
 epoch: 34, train_loss: 0.9932, test_loss: 1.0940, test_f1: 0.3985
 epoch: 35, train_loss: 0.9846, test_loss: 1.0814, test_f1: 0.3644
 epoch: 36, train_loss: 0.9824, test_loss: 1.0821, test_f1: 0.3785
 epoch: 37, train_loss: 0.9878, test_loss: 1.0716, test_f1: 0.4163
 epoch: 38, train_loss: 0.9799, test_loss: 1.0823, test_f1: 0.4189
 epoch: 39, train_loss: 0.9728, test_loss: 1.0757, test_f1: 0.4170
 epoch: 40, train_loss: 0.9682, test_loss: 1.0686, test_f1: 0.4673
 epoch: 41, train_loss: 0.9661, test_loss: 1.0652, test_f1: 0.4699
 epoch: 42, train_loss: 0.9593, test_loss: 1.0590, test_f1: 0.5297
 epoch: 43, train_loss: 0.9619, test_loss: 1.0687, test_f1: 0.5036
 epoch: 44, train_loss: 0.9477, test_loss: 1.0711, test_f1: 0.5134
 epoch: 45, train_loss: 0.9496, test_loss: 1.0601, test_f1: 0.5237
 epoch: 46, train_loss: 0.9374, test_loss: 1.0782, test_f1: 0.5020
 epoch: 47, train_loss: 0.9343, test_loss: 1.0622, test_f1: 0.5144
 epoch: 48, train_loss: 0.9307, test_loss: 1.0868, test_f1: 0.5077
 epoch: 49, train_loss: 0.9244, test_loss: 1.0867, test_f1: 0.5083
 epoch: 50, train_loss: 0.9164, test_loss: 1.0833, test_f1: 0.4994
 epoch: 51, train_loss: 0.9108, test_loss: 1.0786, test_f1: 0.5223
 epoch: 52, train_loss: 0.9137, test_loss: 1.0951, test_f1: 0.5244
 epoch: 53, train_loss: 0.9130, test_loss: 1.0956, test_f1: 0.5091
 epoch: 54, train_loss: 0.8963, test_loss: 1.1213, test_f1: 0.5022
 epoch: 55, train_loss: 0.8833, test_loss: 1.1277, test_f1: 0.5333
 epoch: 56, train_loss: 0.8955, test_loss: 1.1226, test_f1: 0.5259
 epoch: 57, train_loss: 0.8887, test_loss: 1.1021, test_f1: 0.5143
 epoch: 58, train_loss: 0.8908, test_loss: 1.1122, test_f1: 0.5246
 epoch: 59, train_loss: 0.8887, test_loss: 1.1016, test_f1: 0.5199
 epoch: 60, train_loss: 0.8872, test_loss: 1.0907, test_f1: 0.5229
 epoch: 61, train_loss: 0.8841, test_loss: 1.0956, test_f1: 0.5304
 epoch: 62, train_loss: 0.8837, test_loss: 1.0879, test_f1: 0.5271
 epoch: 63, train_loss: 0.8803, test_loss: 1.0884, test_f1: 0.5259
 epoch: 64, train_loss: 0.8740, test_loss: 1.0924, test_f1: 0.5183
 epoch: 65, train_loss: 0.8602, test_loss: 1.0946, test_f1: 0.5192
 epoch: 66, train_loss: 0.8645, test_loss: 1.1141, test_f1: 0.5188
 epoch: 67, train_loss: 0.8660, test_loss: 1.1175, test_f1: 0.5143
 epoch: 68, train_loss: 0.8661, test_loss: 1.0975, test_f1: 0.5186
 epoch: 69, train_loss: 0.8655, test_loss: 1.0849, test_f1: 0.5065
 epoch: 70, train_loss: 0.8689, test_loss: 1.0930, test_f1: 0.5002
 epoch: 71, train_loss: 0.8611, test_loss: 1.1194, test_f1: 0.5201
 epoch: 72, train_loss: 0.8566, test_loss: 1.0840, test_f1: 0.5184
 epoch: 73, train_loss: 0.8535, test_loss: 1.0730, test_f1: 0.5244
 epoch: 74, train_loss: 0.8554, test_loss: 1.0788, test_f1: 0.5139
 epoch: 75, train_loss: 0.8498, test_loss: 1.1094, test_f1: 0.5087
 epoch: 76, train_loss: 0.8616, test_loss: 1.0976, test_f1: 0.5048
 epoch: 77, train_loss: 0.8565, test_loss: 1.0880, test_f1: 0.5079
 epoch: 78, train_loss: 0.8385, test_loss: 1.0906, test_f1: 0.5121
 epoch: 79, train_loss: 0.8447, test_loss: 1.1011, test_f1: 0.5155
 epoch: 80, train_loss: 0.8487, test_loss: 1.1036, test_f1: 0.5141
 epoch: 81, train_loss: 0.8323, test_loss: 1.0862, test_f1: 0.5078
 epoch: 82, train_loss: 0.8524, test_loss: 1.1021, test_f1: 0.5009
 epoch: 83, train_loss: 0.8262, test_loss: 1.1134, test_f1: 0.5085
 epoch: 84, train_loss: 0.8324, test_loss: 1.0996, test_f1: 0.5100
 epoch: 85, train_loss: 0.8265, test_loss: 1.1029, test_f1: 0.5131
 epoch: 86, train_loss: 0.8404, test_loss: 1.1203, test_f1: 0.5073
 epoch: 87, train_loss: 0.8295, test_loss: 1.1295, test_f1: 0.5128
 epoch: 88, train_loss: 0.8422, test_loss: 1.1091, test_f1: 0.5127
 epoch: 89, train_loss: 0.8286, test_loss: 1.0952, test_f1: 0.5375
 epoch: 90, train_loss: 0.8285, test_loss: 1.0936, test_f1: 0.5192
 epoch: 91, train_loss: 0.8293, test_loss: 1.0935, test_f1: 0.5382
 epoch: 92, train_loss: 0.8179, test_loss: 1.0881, test_f1: 0.5326
 epoch: 93, train_loss: 0.8253, test_loss: 1.1021, test_f1: 0.4931
 epoch: 94, train_loss: 0.8366, test_loss: 1.1135, test_f1: 0.5236
 epoch: 95, train_loss: 0.8152, test_loss: 1.0970, test_f1: 0.5078
 epoch: 96, train_loss: 0.8112, test_loss: 1.0886, test_f1: 0.5044
 epoch: 97, train_loss: 0.8025, test_loss: 1.0988, test_f1: 0.5015
 epoch: 98, train_loss: 0.8315, test_loss: 1.1181, test_f1: 0.5077
 epoch: 99, train_loss: 0.8131, test_loss: 1.1321, test_f1: 0.5160
##################ITERATION #2 ****************************************
 epoch: 0, train_loss: 1.3450, test_loss: 1.3462, test_f1: 0.3146
 epoch: 1, train_loss: 1.2941, test_loss: 1.3399, test_f1: 0.2920
 epoch: 2, train_loss: 1.2658, test_loss: 1.3308, test_f1: 0.2246
 epoch: 3, train_loss: 1.2373, test_loss: 1.3249, test_f1: 0.1485
 epoch: 4, train_loss: 1.2116, test_loss: 1.3156, test_f1: 0.1443
 epoch: 5, train_loss: 1.1924, test_loss: 1.2970, test_f1: 0.1989
 epoch: 6, train_loss: 1.1745, test_loss: 1.2579, test_f1: 0.2618
 epoch: 7, train_loss: 1.1549, test_loss: 1.2131, test_f1: 0.3263
 epoch: 8, train_loss: 1.1301, test_loss: 1.1689, test_f1: 0.3871
 epoch: 9, train_loss: 1.1202, test_loss: 1.1452, test_f1: 0.4100
 epoch: 10, train_loss: 1.0997, test_loss: 1.1401, test_f1: 0.4160
 epoch: 11, train_loss: 1.0827, test_loss: 1.1802, test_f1: 0.3766
 epoch: 12, train_loss: 1.0725, test_loss: 1.1274, test_f1: 0.4060
 epoch: 13, train_loss: 1.0578, test_loss: 1.1037, test_f1: 0.4172
 epoch: 14, train_loss: 1.0488, test_loss: 1.0744, test_f1: 0.4113
 epoch: 15, train_loss: 1.0323, test_loss: 1.0685, test_f1: 0.4080
 epoch: 16, train_loss: 1.0183, test_loss: 1.0740, test_f1: 0.4098
 epoch: 17, train_loss: 1.0147, test_loss: 1.0604, test_f1: 0.4030
 epoch: 18, train_loss: 0.9983, test_loss: 1.0468, test_f1: 0.4139
 epoch: 19, train_loss: 0.9880, test_loss: 1.0509, test_f1: 0.4539
 epoch: 20, train_loss: 0.9853, test_loss: 1.0332, test_f1: 0.4642
 epoch: 21, train_loss: 0.9783, test_loss: 1.0347, test_f1: 0.4914
 epoch: 22, train_loss: 0.9684, test_loss: 1.1643, test_f1: 0.3820
 epoch: 23, train_loss: 0.9635, test_loss: 1.0351, test_f1: 0.4654
 epoch: 24, train_loss: 0.9589, test_loss: 1.0549, test_f1: 0.3891
 epoch: 25, train_loss: 0.9601, test_loss: 1.0216, test_f1: 0.4150
 epoch: 26, train_loss: 0.9424, test_loss: 1.0287, test_f1: 0.4500
 epoch: 27, train_loss: 0.9457, test_loss: 1.0103, test_f1: 0.4548
 epoch: 28, train_loss: 0.9244, test_loss: 0.9987, test_f1: 0.4624
 epoch: 29, train_loss: 0.9358, test_loss: 0.9987, test_f1: 0.4862
 epoch: 30, train_loss: 0.9312, test_loss: 0.9885, test_f1: 0.4838
 epoch: 31, train_loss: 0.9172, test_loss: 1.0061, test_f1: 0.4478
 epoch: 32, train_loss: 0.9287, test_loss: 1.0394, test_f1: 0.4516
 epoch: 33, train_loss: 0.9315, test_loss: 1.0666, test_f1: 0.4253
 epoch: 34, train_loss: 0.9205, test_loss: 0.9881, test_f1: 0.5069
 epoch: 35, train_loss: 0.9226, test_loss: 1.0046, test_f1: 0.4984
 epoch: 36, train_loss: 0.9134, test_loss: 0.9803, test_f1: 0.4995
 epoch: 37, train_loss: 0.8875, test_loss: 0.9556, test_f1: 0.4850
 epoch: 38, train_loss: 0.9005, test_loss: 0.9933, test_f1: 0.4382
 epoch: 39, train_loss: 0.8984, test_loss: 1.2913, test_f1: 0.3797
 epoch: 40, train_loss: 0.8961, test_loss: 0.9702, test_f1: 0.5068
 epoch: 41, train_loss: 0.8907, test_loss: 1.2044, test_f1: 0.3697
 epoch: 42, train_loss: 0.8854, test_loss: 1.0007, test_f1: 0.4898
 epoch: 43, train_loss: 0.8919, test_loss: 0.9847, test_f1: 0.4909
 epoch: 44, train_loss: 0.8853, test_loss: 0.9808, test_f1: 0.5009
 epoch: 45, train_loss: 0.8792, test_loss: 0.9875, test_f1: 0.4906
 epoch: 46, train_loss: 0.8773, test_loss: 0.9697, test_f1: 0.4879
 epoch: 47, train_loss: 0.8715, test_loss: 0.9662, test_f1: 0.4836
 epoch: 48, train_loss: 0.8779, test_loss: 0.9675, test_f1: 0.4702
 epoch: 49, train_loss: 0.8633, test_loss: 0.9423, test_f1: 0.4926
 epoch: 50, train_loss: 0.8693, test_loss: 0.9305, test_f1: 0.4954
 epoch: 51, train_loss: 0.8601, test_loss: 0.9303, test_f1: 0.5036
 epoch: 52, train_loss: 0.8335, test_loss: 0.9417, test_f1: 0.4888
 epoch: 53, train_loss: 0.8534, test_loss: 0.9792, test_f1: 0.4746
 epoch: 54, train_loss: 0.8384, test_loss: 0.9649, test_f1: 0.4898
 epoch: 55, train_loss: 0.8321, test_loss: 0.9515, test_f1: 0.4856
 epoch: 56, train_loss: 0.8360, test_loss: 0.9524, test_f1: 0.4735
 epoch: 57, train_loss: 0.8366, test_loss: 0.9666, test_f1: 0.4705
 epoch: 58, train_loss: 0.8371, test_loss: 0.9723, test_f1: 0.4824
 epoch: 59, train_loss: 0.8228, test_loss: 0.9305, test_f1: 0.4998
 epoch: 60, train_loss: 0.8275, test_loss: 0.9464, test_f1: 0.4907
 epoch: 61, train_loss: 0.8240, test_loss: 0.9770, test_f1: 0.4458
 epoch: 62, train_loss: 0.8167, test_loss: 0.9445, test_f1: 0.4670
 epoch: 63, train_loss: 0.8266, test_loss: 0.9324, test_f1: 0.4863
 epoch: 64, train_loss: 0.8254, test_loss: 0.9306, test_f1: 0.4959
 epoch: 65, train_loss: 0.8220, test_loss: 0.9298, test_f1: 0.4902
 epoch: 66, train_loss: 0.8178, test_loss: 0.9517, test_f1: 0.4513
 epoch: 67, train_loss: 0.8053, test_loss: 0.9735, test_f1: 0.4232
 epoch: 68, train_loss: 0.8052, test_loss: 0.9631, test_f1: 0.4471
 epoch: 69, train_loss: 0.8232, test_loss: 0.9689, test_f1: 0.4416
 epoch: 70, train_loss: 0.8150, test_loss: 0.9543, test_f1: 0.4770
 epoch: 71, train_loss: 0.7967, test_loss: 0.9265, test_f1: 0.4946
 epoch: 72, train_loss: 0.7968, test_loss: 0.9107, test_f1: 0.4998
 epoch: 73, train_loss: 0.8009, test_loss: 0.9206, test_f1: 0.4763
 epoch: 74, train_loss: 0.8052, test_loss: 0.9197, test_f1: 0.4825
 epoch: 75, train_loss: 0.7973, test_loss: 0.9009, test_f1: 0.4823
 epoch: 76, train_loss: 0.7924, test_loss: 0.8975, test_f1: 0.4908
 epoch: 77, train_loss: 0.7777, test_loss: 0.9098, test_f1: 0.4907
 epoch: 78, train_loss: 0.7774, test_loss: 0.9111, test_f1: 0.4831
 epoch: 79, train_loss: 0.7825, test_loss: 0.9280, test_f1: 0.4679
 epoch: 80, train_loss: 0.7829, test_loss: 0.9212, test_f1: 0.4743
 epoch: 81, train_loss: 0.7854, test_loss: 0.9228, test_f1: 0.4824
 epoch: 82, train_loss: 0.7914, test_loss: 0.9235, test_f1: 0.4999
 epoch: 83, train_loss: 0.8027, test_loss: 0.9113, test_f1: 0.4984
 epoch: 84, train_loss: 0.7663, test_loss: 0.9077, test_f1: 0.4903
 epoch: 85, train_loss: 0.7845, test_loss: 0.9163, test_f1: 0.4896
 epoch: 86, train_loss: 0.7816, test_loss: 0.9266, test_f1: 0.4743
 epoch: 87, train_loss: 0.7758, test_loss: 0.9090, test_f1: 0.4798
 epoch: 88, train_loss: 0.7689, test_loss: 0.8977, test_f1: 0.5019
 epoch: 89, train_loss: 0.7713, test_loss: 0.8921, test_f1: 0.4984
 epoch: 90, train_loss: 0.7526, test_loss: 0.9022, test_f1: 0.4875
 epoch: 91, train_loss: 0.7587, test_loss: 0.8996, test_f1: 0.5143
 epoch: 92, train_loss: 0.7651, test_loss: 0.8992, test_f1: 0.5137
 epoch: 93, train_loss: 0.7550, test_loss: 0.9055, test_f1: 0.5056
 epoch: 94, train_loss: 0.7478, test_loss: 0.8891, test_f1: 0.4883
 epoch: 95, train_loss: 0.7487, test_loss: 0.9308, test_f1: 0.4871
 epoch: 96, train_loss: 0.7597, test_loss: 0.9738, test_f1: 0.4764
 epoch: 97, train_loss: 0.7516, test_loss: 0.9074, test_f1: 0.5065
 epoch: 98, train_loss: 0.7661, test_loss: 0.9267, test_f1: 0.4921
 epoch: 99, train_loss: 0.7680, test_loss: 0.9303, test_f1: 0.4810
##################ITERATION #3 ****************************************
 epoch: 0, train_loss: 1.3039, test_loss: 1.3191, test_f1: 0.2281
 epoch: 1, train_loss: 1.2546, test_loss: 1.3084, test_f1: 0.2281
 epoch: 2, train_loss: 1.2304, test_loss: 1.3043, test_f1: 0.2281
 epoch: 3, train_loss: 1.2064, test_loss: 1.3062, test_f1: 0.2281
 epoch: 4, train_loss: 1.1960, test_loss: 1.3139, test_f1: 0.2281
 epoch: 5, train_loss: 1.1824, test_loss: 1.3231, test_f1: 0.2281
 epoch: 6, train_loss: 1.1778, test_loss: 1.3229, test_f1: 0.2281
 epoch: 7, train_loss: 1.1604, test_loss: 1.3177, test_f1: 0.2248
 epoch: 8, train_loss: 1.1523, test_loss: 1.3171, test_f1: 0.2336
 epoch: 9, train_loss: 1.1364, test_loss: 1.3041, test_f1: 0.3103
 epoch: 10, train_loss: 1.1278, test_loss: 1.2714, test_f1: 0.3454
 epoch: 11, train_loss: 1.1197, test_loss: 1.2387, test_f1: 0.3529
 epoch: 12, train_loss: 1.1029, test_loss: 1.2154, test_f1: 0.3737
 epoch: 13, train_loss: 1.0824, test_loss: 1.1621, test_f1: 0.3952
 epoch: 14, train_loss: 1.0702, test_loss: 1.1423, test_f1: 0.4302
 epoch: 15, train_loss: 1.0652, test_loss: 1.1255, test_f1: 0.4592
 epoch: 16, train_loss: 1.0588, test_loss: 1.0963, test_f1: 0.4507
 epoch: 17, train_loss: 1.0400, test_loss: 1.0952, test_f1: 0.4604
 epoch: 18, train_loss: 1.0328, test_loss: 1.0925, test_f1: 0.4614
 epoch: 19, train_loss: 1.0183, test_loss: 1.0788, test_f1: 0.4604
 epoch: 20, train_loss: 1.0065, test_loss: 1.0727, test_f1: 0.4468
 epoch: 21, train_loss: 1.0018, test_loss: 1.0539, test_f1: 0.4526
 epoch: 22, train_loss: 0.9960, test_loss: 1.0478, test_f1: 0.4686
 epoch: 23, train_loss: 0.9926, test_loss: 1.0467, test_f1: 0.4554
 epoch: 24, train_loss: 0.9750, test_loss: 1.0517, test_f1: 0.4599
 epoch: 25, train_loss: 0.9661, test_loss: 1.0432, test_f1: 0.4924
 epoch: 26, train_loss: 0.9694, test_loss: 1.0326, test_f1: 0.5404
 epoch: 27, train_loss: 0.9579, test_loss: 1.0288, test_f1: 0.5702
 epoch: 28, train_loss: 0.9378, test_loss: 1.0226, test_f1: 0.5772
 epoch: 29, train_loss: 0.9373, test_loss: 1.0133, test_f1: 0.5660
 epoch: 30, train_loss: 0.9294, test_loss: 1.0192, test_f1: 0.5729
 epoch: 31, train_loss: 0.9466, test_loss: 1.0290, test_f1: 0.5681
 epoch: 32, train_loss: 0.9264, test_loss: 1.0176, test_f1: 0.5862
 epoch: 33, train_loss: 0.9278, test_loss: 1.0174, test_f1: 0.5758
 epoch: 34, train_loss: 0.9160, test_loss: 1.0248, test_f1: 0.5714
 epoch: 35, train_loss: 0.9397, test_loss: 0.9946, test_f1: 0.5594
 epoch: 36, train_loss: 0.9039, test_loss: 1.0086, test_f1: 0.5283
 epoch: 37, train_loss: 0.8967, test_loss: 0.9846, test_f1: 0.5401
 epoch: 38, train_loss: 0.8908, test_loss: 0.9751, test_f1: 0.5339
 epoch: 39, train_loss: 0.8855, test_loss: 0.9853, test_f1: 0.5160
 epoch: 40, train_loss: 0.8792, test_loss: 0.9943, test_f1: 0.5318
 epoch: 41, train_loss: 0.8909, test_loss: 0.9903, test_f1: 0.5565
 epoch: 42, train_loss: 0.8902, test_loss: 1.0138, test_f1: 0.5661
 epoch: 43, train_loss: 0.8825, test_loss: 0.9985, test_f1: 0.5788
 epoch: 44, train_loss: 0.8753, test_loss: 0.9892, test_f1: 0.5184
 epoch: 45, train_loss: 0.8879, test_loss: 0.9812, test_f1: 0.5418
 epoch: 46, train_loss: 0.8681, test_loss: 0.9660, test_f1: 0.5672
 epoch: 47, train_loss: 0.8691, test_loss: 0.9713, test_f1: 0.5539
 epoch: 48, train_loss: 0.8573, test_loss: 0.9876, test_f1: 0.5383
 epoch: 49, train_loss: 0.8506, test_loss: 1.0149, test_f1: 0.5466
 epoch: 50, train_loss: 0.8520, test_loss: 0.9899, test_f1: 0.5839
 epoch: 51, train_loss: 0.8342, test_loss: 0.9717, test_f1: 0.5921
 epoch: 52, train_loss: 0.8394, test_loss: 0.9674, test_f1: 0.5887
 epoch: 53, train_loss: 0.8468, test_loss: 0.9668, test_f1: 0.5911
 epoch: 54, train_loss: 0.8331, test_loss: 0.9699, test_f1: 0.5817
 epoch: 55, train_loss: 0.8369, test_loss: 0.9700, test_f1: 0.5715
 epoch: 56, train_loss: 0.8198, test_loss: 0.9546, test_f1: 0.5891
 epoch: 57, train_loss: 0.8312, test_loss: 0.9538, test_f1: 0.5794
 epoch: 58, train_loss: 0.8278, test_loss: 0.9521, test_f1: 0.5715
 epoch: 59, train_loss: 0.8178, test_loss: 0.9500, test_f1: 0.5857
 epoch: 60, train_loss: 0.8147, test_loss: 0.9492, test_f1: 0.5819
 epoch: 61, train_loss: 0.8223, test_loss: 0.9641, test_f1: 0.5542
 epoch: 62, train_loss: 0.8189, test_loss: 0.9581, test_f1: 0.5757
 epoch: 63, train_loss: 0.8141, test_loss: 0.9747, test_f1: 0.5640
 epoch: 64, train_loss: 0.7981, test_loss: 0.9596, test_f1: 0.5764
 epoch: 65, train_loss: 0.8104, test_loss: 0.9462, test_f1: 0.6029
 epoch: 66, train_loss: 0.8173, test_loss: 0.9476, test_f1: 0.5924
 epoch: 67, train_loss: 0.8132, test_loss: 0.9965, test_f1: 0.6001
 epoch: 68, train_loss: 0.8055, test_loss: 0.9914, test_f1: 0.6097
 epoch: 69, train_loss: 0.8036, test_loss: 0.9777, test_f1: 0.5949
 epoch: 70, train_loss: 0.8099, test_loss: 0.9485, test_f1: 0.5983
 epoch: 71, train_loss: 0.8014, test_loss: 0.9486, test_f1: 0.6175
 epoch: 72, train_loss: 0.8013, test_loss: 0.9419, test_f1: 0.6192
 epoch: 73, train_loss: 0.8034, test_loss: 0.9549, test_f1: 0.6113
 epoch: 74, train_loss: 0.7998, test_loss: 0.9608, test_f1: 0.6200
 epoch: 75, train_loss: 0.7772, test_loss: 0.9616, test_f1: 0.6006
 epoch: 76, train_loss: 0.7876, test_loss: 0.9599, test_f1: 0.6160
 epoch: 77, train_loss: 0.7831, test_loss: 0.9717, test_f1: 0.6116
 epoch: 78, train_loss: 0.7784, test_loss: 0.9556, test_f1: 0.6122
 epoch: 79, train_loss: 0.7654, test_loss: 0.9529, test_f1: 0.5981
 epoch: 80, train_loss: 0.7804, test_loss: 0.9448, test_f1: 0.6173
 epoch: 81, train_loss: 0.7796, test_loss: 0.9584, test_f1: 0.6158
 epoch: 82, train_loss: 0.7782, test_loss: 0.9598, test_f1: 0.6100
 epoch: 83, train_loss: 0.7664, test_loss: 0.9433, test_f1: 0.6293
 epoch: 84, train_loss: 0.7696, test_loss: 0.9429, test_f1: 0.6086
 epoch: 85, train_loss: 0.7509, test_loss: 0.9365, test_f1: 0.6051
 epoch: 86, train_loss: 0.7652, test_loss: 0.9436, test_f1: 0.6241
 epoch: 87, train_loss: 0.7758, test_loss: 0.9523, test_f1: 0.6226
 epoch: 88, train_loss: 0.7716, test_loss: 0.9420, test_f1: 0.5889
 epoch: 89, train_loss: 0.7673, test_loss: 0.9509, test_f1: 0.5919
 epoch: 90, train_loss: 0.7605, test_loss: 0.9725, test_f1: 0.5998
 epoch: 91, train_loss: 0.7571, test_loss: 0.9857, test_f1: 0.6057
 epoch: 92, train_loss: 0.7637, test_loss: 0.9964, test_f1: 0.5985
 epoch: 93, train_loss: 0.7419, test_loss: 0.9883, test_f1: 0.6096
 epoch: 94, train_loss: 0.7450, test_loss: 0.9699, test_f1: 0.6064
 epoch: 95, train_loss: 0.7530, test_loss: 0.9620, test_f1: 0.6110
 epoch: 96, train_loss: 0.7560, test_loss: 0.9361, test_f1: 0.6021
 epoch: 97, train_loss: 0.7509, test_loss: 0.9486, test_f1: 0.6033
 epoch: 98, train_loss: 0.7464, test_loss: 0.9497, test_f1: 0.6053
 epoch: 99, train_loss: 0.7223, test_loss: 0.9488, test_f1: 0.6177
##################ITERATION #4 ****************************************
 epoch: 0, train_loss: 1.2845, test_loss: 1.3036, test_f1: 0.2281
 epoch: 1, train_loss: 1.2245, test_loss: 1.3034, test_f1: 0.2281
 epoch: 2, train_loss: 1.2206, test_loss: 1.3003, test_f1: 0.2248
 epoch: 3, train_loss: 1.1923, test_loss: 1.2999, test_f1: 0.2429
 epoch: 4, train_loss: 1.1843, test_loss: 1.2963, test_f1: 0.2429
 epoch: 5, train_loss: 1.1680, test_loss: 1.2931, test_f1: 0.2404
 epoch: 6, train_loss: 1.1485, test_loss: 1.2661, test_f1: 0.2381
 epoch: 7, train_loss: 1.1453, test_loss: 1.2468, test_f1: 0.2253
 epoch: 8, train_loss: 1.1444, test_loss: 1.2286, test_f1: 0.2759
 epoch: 9, train_loss: 1.1204, test_loss: 1.2011, test_f1: 0.2951
 epoch: 10, train_loss: 1.1036, test_loss: 1.1894, test_f1: 0.3791
 epoch: 11, train_loss: 1.0909, test_loss: 1.1577, test_f1: 0.4101
 epoch: 12, train_loss: 1.0787, test_loss: 1.1560, test_f1: 0.4392
 epoch: 13, train_loss: 1.0630, test_loss: 1.1513, test_f1: 0.4420
 epoch: 14, train_loss: 1.0515, test_loss: 1.1205, test_f1: 0.4654
 epoch: 15, train_loss: 1.0366, test_loss: 1.1234, test_f1: 0.4560
 epoch: 16, train_loss: 1.0272, test_loss: 1.1359, test_f1: 0.4885
 epoch: 17, train_loss: 1.0264, test_loss: 1.1124, test_f1: 0.4857
 epoch: 18, train_loss: 1.0143, test_loss: 1.1153, test_f1: 0.4808
 epoch: 19, train_loss: 1.0136, test_loss: 1.0959, test_f1: 0.5059
 epoch: 20, train_loss: 0.9980, test_loss: 1.1010, test_f1: 0.5068
 epoch: 21, train_loss: 0.9946, test_loss: 1.1343, test_f1: 0.4968
 epoch: 22, train_loss: 0.9923, test_loss: 1.1346, test_f1: 0.4469
 epoch: 23, train_loss: 0.9898, test_loss: 1.1080, test_f1: 0.4235
 epoch: 24, train_loss: 0.9730, test_loss: 1.1379, test_f1: 0.4147
 epoch: 25, train_loss: 0.9574, test_loss: 1.1488, test_f1: 0.4301
 epoch: 26, train_loss: 0.9640, test_loss: 1.1413, test_f1: 0.4709
 epoch: 27, train_loss: 0.9722, test_loss: 1.1010, test_f1: 0.4995
 epoch: 28, train_loss: 0.9495, test_loss: 1.1163, test_f1: 0.5039
 epoch: 29, train_loss: 0.9299, test_loss: 1.1410, test_f1: 0.4941
 epoch: 30, train_loss: 0.9499, test_loss: 1.1964, test_f1: 0.5008
 epoch: 31, train_loss: 0.9456, test_loss: 1.1604, test_f1: 0.5256
 epoch: 32, train_loss: 0.9391, test_loss: 1.1056, test_f1: 0.5218
 epoch: 33, train_loss: 0.9261, test_loss: 1.0925, test_f1: 0.5171
 epoch: 34, train_loss: 0.9200, test_loss: 1.0268, test_f1: 0.5356
 epoch: 35, train_loss: 0.9408, test_loss: 1.0109, test_f1: 0.5334
 epoch: 36, train_loss: 0.9113, test_loss: 1.0337, test_f1: 0.5185
 epoch: 37, train_loss: 0.9150, test_loss: 1.0257, test_f1: 0.5553
 epoch: 38, train_loss: 0.8959, test_loss: 1.0368, test_f1: 0.4958
 epoch: 39, train_loss: 0.9102, test_loss: 1.1139, test_f1: 0.5058
 epoch: 40, train_loss: 0.8988, test_loss: 1.1787, test_f1: 0.4973
 epoch: 41, train_loss: 0.9157, test_loss: 1.1161, test_f1: 0.5014
 epoch: 42, train_loss: 0.9154, test_loss: 1.0408, test_f1: 0.5327
 epoch: 43, train_loss: 0.9020, test_loss: 1.0405, test_f1: 0.5464
 epoch: 44, train_loss: 0.8910, test_loss: 1.0247, test_f1: 0.5445
 epoch: 45, train_loss: 0.8933, test_loss: 1.0622, test_f1: 0.5491
 epoch: 46, train_loss: 0.8813, test_loss: 1.0981, test_f1: 0.5205
 epoch: 47, train_loss: 0.8910, test_loss: 1.1225, test_f1: 0.5265
 epoch: 48, train_loss: 0.9164, test_loss: 1.1776, test_f1: 0.4873
 epoch: 49, train_loss: 0.9061, test_loss: 1.0922, test_f1: 0.5390
 epoch: 50, train_loss: 0.8976, test_loss: 1.0912, test_f1: 0.5360
 epoch: 51, train_loss: 0.8779, test_loss: 1.0787, test_f1: 0.5169
 epoch: 52, train_loss: 0.8648, test_loss: 1.0793, test_f1: 0.5007
 epoch: 53, train_loss: 0.8660, test_loss: 1.1014, test_f1: 0.5129
 epoch: 54, train_loss: 0.8601, test_loss: 1.1129, test_f1: 0.5070
 epoch: 55, train_loss: 0.8590, test_loss: 1.1120, test_f1: 0.5230
 epoch: 56, train_loss: 0.8601, test_loss: 1.0787, test_f1: 0.5136
 epoch: 57, train_loss: 0.8500, test_loss: 1.0537, test_f1: 0.5128
 epoch: 58, train_loss: 0.8656, test_loss: 1.0630, test_f1: 0.5164
 epoch: 59, train_loss: 0.8656, test_loss: 1.1003, test_f1: 0.5199
 epoch: 60, train_loss: 0.8579, test_loss: 1.1335, test_f1: 0.5202
 epoch: 61, train_loss: 0.8462, test_loss: 1.0747, test_f1: 0.5120
 epoch: 62, train_loss: 0.8469, test_loss: 1.0809, test_f1: 0.5096
 epoch: 63, train_loss: 0.8520, test_loss: 1.0473, test_f1: 0.4992
 epoch: 64, train_loss: 0.8367, test_loss: 1.0357, test_f1: 0.5074
 epoch: 65, train_loss: 0.8358, test_loss: 1.0421, test_f1: 0.5035
 epoch: 66, train_loss: 0.8254, test_loss: 1.0279, test_f1: 0.5079
 epoch: 67, train_loss: 0.8321, test_loss: 1.0155, test_f1: 0.4945
 epoch: 68, train_loss: 0.8386, test_loss: 1.0151, test_f1: 0.5294
 epoch: 69, train_loss: 0.8237, test_loss: 1.0111, test_f1: 0.5646
 epoch: 70, train_loss: 0.8387, test_loss: 1.0124, test_f1: 0.5630
 epoch: 71, train_loss: 0.8249, test_loss: 0.9955, test_f1: 0.5404
 epoch: 72, train_loss: 0.8430, test_loss: 1.0146, test_f1: 0.5448
 epoch: 73, train_loss: 0.8243, test_loss: 1.0519, test_f1: 0.5002
 epoch: 74, train_loss: 0.8311, test_loss: 1.0303, test_f1: 0.5085
 epoch: 75, train_loss: 0.8329, test_loss: 1.0236, test_f1: 0.5576
 epoch: 76, train_loss: 0.8249, test_loss: 1.0134, test_f1: 0.5481
 epoch: 77, train_loss: 0.8258, test_loss: 1.0053, test_f1: 0.5401
 epoch: 78, train_loss: 0.8208, test_loss: 1.0009, test_f1: 0.5375
 epoch: 79, train_loss: 0.8278, test_loss: 1.0080, test_f1: 0.5540
 epoch: 80, train_loss: 0.8282, test_loss: 1.0175, test_f1: 0.5582
 epoch: 81, train_loss: 0.8206, test_loss: 1.0326, test_f1: 0.5404
 epoch: 82, train_loss: 0.8264, test_loss: 1.0136, test_f1: 0.5280
 epoch: 83, train_loss: 0.8173, test_loss: 0.9986, test_f1: 0.5569
 epoch: 84, train_loss: 0.8115, test_loss: 1.0053, test_f1: 0.5559
 epoch: 85, train_loss: 0.8029, test_loss: 1.0051, test_f1: 0.5535
 epoch: 86, train_loss: 0.8066, test_loss: 1.0032, test_f1: 0.5487
 epoch: 87, train_loss: 0.8151, test_loss: 0.9861, test_f1: 0.5557
 epoch: 88, train_loss: 0.8196, test_loss: 1.0068, test_f1: 0.5526
 epoch: 89, train_loss: 0.8230, test_loss: 1.0073, test_f1: 0.5684
 epoch: 90, train_loss: 0.8261, test_loss: 1.0185, test_f1: 0.5513
 epoch: 91, train_loss: 0.8167, test_loss: 0.9972, test_f1: 0.5288
 epoch: 92, train_loss: 0.8022, test_loss: 1.0005, test_f1: 0.5141
 epoch: 93, train_loss: 0.8184, test_loss: 1.0354, test_f1: 0.5280
 epoch: 94, train_loss: 0.8090, test_loss: 1.0333, test_f1: 0.5574
 epoch: 95, train_loss: 0.8221, test_loss: 1.0193, test_f1: 0.5702
 epoch: 96, train_loss: 0.8074, test_loss: 1.0002, test_f1: 0.5462
 epoch: 97, train_loss: 0.8104, test_loss: 1.0205, test_f1: 0.5504
 epoch: 98, train_loss: 0.8221, test_loss: 1.0195, test_f1: 0.5472
 epoch: 99, train_loss: 0.8261, test_loss: 0.9987, test_f1: 0.5487
##################ITERATION #5 ****************************************
 epoch: 0, train_loss: 1.2589, test_loss: 1.3004, test_f1: 0.2281
 epoch: 1, train_loss: 1.2279, test_loss: 1.3045, test_f1: 0.2281
 epoch: 2, train_loss: 1.2048, test_loss: 1.3045, test_f1: 0.2281
 epoch: 3, train_loss: 1.1908, test_loss: 1.3099, test_f1: 0.2281
 epoch: 4, train_loss: 1.1617, test_loss: 1.3176, test_f1: 0.2281
 epoch: 5, train_loss: 1.1515, test_loss: 1.3188, test_f1: 0.2281
 epoch: 6, train_loss: 1.1347, test_loss: 1.3004, test_f1: 0.2281
 epoch: 7, train_loss: 1.1171, test_loss: 1.2801, test_f1: 0.2336
 epoch: 8, train_loss: 1.1141, test_loss: 1.2686, test_f1: 0.2392
 epoch: 9, train_loss: 1.0896, test_loss: 1.2456, test_f1: 0.3020
 epoch: 10, train_loss: 1.0744, test_loss: 1.1969, test_f1: 0.3715
 epoch: 11, train_loss: 1.0629, test_loss: 1.1667, test_f1: 0.3935
 epoch: 12, train_loss: 1.0604, test_loss: 1.1282, test_f1: 0.3959
 epoch: 13, train_loss: 1.0468, test_loss: 1.1076, test_f1: 0.4523
 epoch: 14, train_loss: 1.0438, test_loss: 1.0914, test_f1: 0.4695
 epoch: 15, train_loss: 1.0246, test_loss: 1.0814, test_f1: 0.4798
 epoch: 16, train_loss: 1.0060, test_loss: 1.0781, test_f1: 0.4636
 epoch: 17, train_loss: 1.0007, test_loss: 1.0688, test_f1: 0.4673
 epoch: 18, train_loss: 1.0014, test_loss: 1.0670, test_f1: 0.4916
 epoch: 19, train_loss: 1.0013, test_loss: 1.0567, test_f1: 0.5126
 epoch: 20, train_loss: 0.9776, test_loss: 1.0421, test_f1: 0.5296
 epoch: 21, train_loss: 0.9655, test_loss: 1.0506, test_f1: 0.5090
 epoch: 22, train_loss: 0.9752, test_loss: 1.0675, test_f1: 0.4900
 epoch: 23, train_loss: 0.9715, test_loss: 1.0845, test_f1: 0.5165
 epoch: 24, train_loss: 0.9584, test_loss: 1.0709, test_f1: 0.5160
 epoch: 25, train_loss: 0.9492, test_loss: 1.0949, test_f1: 0.4454
 epoch: 26, train_loss: 0.9427, test_loss: 1.0961, test_f1: 0.5076
 epoch: 27, train_loss: 0.9432, test_loss: 1.0691, test_f1: 0.5241
 epoch: 28, train_loss: 0.9437, test_loss: 1.0530, test_f1: 0.5212
 epoch: 29, train_loss: 0.9226, test_loss: 1.0519, test_f1: 0.5416
 epoch: 30, train_loss: 0.9333, test_loss: 1.0646, test_f1: 0.5233
 epoch: 31, train_loss: 0.9149, test_loss: 1.0475, test_f1: 0.5413
 epoch: 32, train_loss: 0.9102, test_loss: 1.0479, test_f1: 0.5418
 epoch: 33, train_loss: 0.9030, test_loss: 1.0376, test_f1: 0.5481
 epoch: 34, train_loss: 0.9039, test_loss: 1.0599, test_f1: 0.5289
 epoch: 35, train_loss: 0.8987, test_loss: 1.0735, test_f1: 0.5366
 epoch: 36, train_loss: 0.8923, test_loss: 1.0365, test_f1: 0.5546
 epoch: 37, train_loss: 0.9043, test_loss: 1.0468, test_f1: 0.5455
 epoch: 38, train_loss: 0.8945, test_loss: 1.0472, test_f1: 0.5438
 epoch: 39, train_loss: 0.8755, test_loss: 1.0229, test_f1: 0.5643
 epoch: 40, train_loss: 0.8778, test_loss: 1.0461, test_f1: 0.5485
 epoch: 41, train_loss: 0.8804, test_loss: 1.0703, test_f1: 0.5389
 epoch: 42, train_loss: 0.8623, test_loss: 1.0264, test_f1: 0.5431
 epoch: 43, train_loss: 0.8605, test_loss: 1.0070, test_f1: 0.5637
 epoch: 44, train_loss: 0.8622, test_loss: 1.0127, test_f1: 0.5608
 epoch: 45, train_loss: 0.8486, test_loss: 1.0391, test_f1: 0.5447
 epoch: 46, train_loss: 0.8590, test_loss: 1.0722, test_f1: 0.5511
 epoch: 47, train_loss: 0.8495, test_loss: 1.0836, test_f1: 0.5307
 epoch: 48, train_loss: 0.8501, test_loss: 1.0257, test_f1: 0.5416
 epoch: 49, train_loss: 0.8417, test_loss: 1.0696, test_f1: 0.5291
 epoch: 50, train_loss: 0.8443, test_loss: 1.0420, test_f1: 0.5727
 epoch: 51, train_loss: 0.8364, test_loss: 1.0352, test_f1: 0.5684
 epoch: 52, train_loss: 0.8402, test_loss: 1.1082, test_f1: 0.5033
 epoch: 53, train_loss: 0.8280, test_loss: 1.1238, test_f1: 0.5136
 epoch: 54, train_loss: 0.8188, test_loss: 1.0490, test_f1: 0.5440
 epoch: 55, train_loss: 0.8230, test_loss: 1.0316, test_f1: 0.5541
 epoch: 56, train_loss: 0.8131, test_loss: 1.0432, test_f1: 0.5462
 epoch: 57, train_loss: 0.8178, test_loss: 1.0687, test_f1: 0.5419
 epoch: 58, train_loss: 0.8110, test_loss: 1.0522, test_f1: 0.5523
 epoch: 59, train_loss: 0.8200, test_loss: 1.0689, test_f1: 0.5468
 epoch: 60, train_loss: 0.8089, test_loss: 1.0588, test_f1: 0.5489
 epoch: 61, train_loss: 0.8122, test_loss: 1.1165, test_f1: 0.5206
 epoch: 62, train_loss: 0.8167, test_loss: 1.0764, test_f1: 0.5406
 epoch: 63, train_loss: 0.8078, test_loss: 1.0893, test_f1: 0.5155
 epoch: 64, train_loss: 0.8013, test_loss: 1.0774, test_f1: 0.5290
 epoch: 65, train_loss: 0.7985, test_loss: 1.0414, test_f1: 0.5608
 epoch: 66, train_loss: 0.7872, test_loss: 1.0341, test_f1: 0.5552
 epoch: 67, train_loss: 0.8008, test_loss: 1.0599, test_f1: 0.5546
 epoch: 68, train_loss: 0.7936, test_loss: 1.0993, test_f1: 0.5298
 epoch: 69, train_loss: 0.8008, test_loss: 1.0803, test_f1: 0.5493
 epoch: 70, train_loss: 0.7961, test_loss: 1.0368, test_f1: 0.5592
 epoch: 71, train_loss: 0.7823, test_loss: 1.0245, test_f1: 0.5614
 epoch: 72, train_loss: 0.7833, test_loss: 1.0494, test_f1: 0.5499
 epoch: 73, train_loss: 0.7783, test_loss: 1.1140, test_f1: 0.5240
 epoch: 74, train_loss: 0.7896, test_loss: 1.0857, test_f1: 0.5475
 epoch: 75, train_loss: 0.7869, test_loss: 1.0449, test_f1: 0.5718
 epoch: 76, train_loss: 0.7744, test_loss: 1.0836, test_f1: 0.5568
 epoch: 77, train_loss: 0.7697, test_loss: 1.0781, test_f1: 0.5496
 epoch: 78, train_loss: 0.7748, test_loss: 1.1098, test_f1: 0.5461
 epoch: 79, train_loss: 0.7764, test_loss: 1.1189, test_f1: 0.5479
 epoch: 80, train_loss: 0.7758, test_loss: 1.0812, test_f1: 0.5653
 epoch: 81, train_loss: 0.7798, test_loss: 1.0631, test_f1: 0.5571
 epoch: 82, train_loss: 0.7668, test_loss: 1.1052, test_f1: 0.5322
 epoch: 83, train_loss: 0.7680, test_loss: 1.0949, test_f1: 0.5408
 epoch: 84, train_loss: 0.7595, test_loss: 1.1124, test_f1: 0.5307
 epoch: 85, train_loss: 0.7653, test_loss: 1.0990, test_f1: 0.5490
 epoch: 86, train_loss: 0.7666, test_loss: 1.0736, test_f1: 0.5620
 epoch: 87, train_loss: 0.7512, test_loss: 1.0458, test_f1: 0.5554
 epoch: 88, train_loss: 0.7643, test_loss: 1.0718, test_f1: 0.5502
 epoch: 89, train_loss: 0.7523, test_loss: 1.1107, test_f1: 0.5385
 epoch: 90, train_loss: 0.7607, test_loss: 1.1306, test_f1: 0.5298
 epoch: 91, train_loss: 0.7651, test_loss: 1.0945, test_f1: 0.5395
 epoch: 92, train_loss: 0.7643, test_loss: 1.0451, test_f1: 0.5731
 epoch: 93, train_loss: 0.7436, test_loss: 1.0382, test_f1: 0.5577
 epoch: 94, train_loss: 0.7552, test_loss: 1.0715, test_f1: 0.5449
 epoch: 95, train_loss: 0.7642, test_loss: 1.0709, test_f1: 0.5440
 epoch: 96, train_loss: 0.7599, test_loss: 1.0850, test_f1: 0.5549
 epoch: 97, train_loss: 0.7507, test_loss: 1.0912, test_f1: 0.5713
 epoch: 98, train_loss: 0.7399, test_loss: 1.1391, test_f1: 0.5442
 epoch: 99, train_loss: 0.7400, test_loss: 1.1568, test_f1: 0.5348
##################ITERATION #6 ****************************************
 epoch: 0, train_loss: 1.3124, test_loss: 1.3137, test_f1: 0.2281
 epoch: 1, train_loss: 1.2418, test_loss: 1.3122, test_f1: 0.2281
 epoch: 2, train_loss: 1.2187, test_loss: 1.3059, test_f1: 0.2281
 epoch: 3, train_loss: 1.1957, test_loss: 1.3021, test_f1: 0.2281
 epoch: 4, train_loss: 1.2017, test_loss: 1.2946, test_f1: 0.2281
 epoch: 5, train_loss: 1.1757, test_loss: 1.2776, test_f1: 0.2265
 epoch: 6, train_loss: 1.1684, test_loss: 1.2553, test_f1: 0.2662
 epoch: 7, train_loss: 1.1690, test_loss: 1.2598, test_f1: 0.2711
 epoch: 8, train_loss: 1.1498, test_loss: 1.2782, test_f1: 0.2700
 epoch: 9, train_loss: 1.1498, test_loss: 1.2922, test_f1: 0.3634
 epoch: 10, train_loss: 1.1427, test_loss: 1.2742, test_f1: 0.3326
 epoch: 11, train_loss: 1.1200, test_loss: 1.2442, test_f1: 0.3460
 epoch: 12, train_loss: 1.1146, test_loss: 1.2280, test_f1: 0.3526
 epoch: 13, train_loss: 1.0951, test_loss: 1.2225, test_f1: 0.3743
 epoch: 14, train_loss: 1.0888, test_loss: 1.2190, test_f1: 0.3958
 epoch: 15, train_loss: 1.0722, test_loss: 1.2333, test_f1: 0.4508
 epoch: 16, train_loss: 1.0539, test_loss: 1.2197, test_f1: 0.4796
 epoch: 17, train_loss: 1.0435, test_loss: 1.2286, test_f1: 0.5118
 epoch: 18, train_loss: 1.0389, test_loss: 1.2567, test_f1: 0.4915
 epoch: 19, train_loss: 1.0276, test_loss: 1.2122, test_f1: 0.4941
 epoch: 20, train_loss: 1.0238, test_loss: 1.2007, test_f1: 0.4886
 epoch: 21, train_loss: 1.0037, test_loss: 1.1941, test_f1: 0.4920
 epoch: 22, train_loss: 0.9952, test_loss: 1.1775, test_f1: 0.5087
 epoch: 23, train_loss: 0.9944, test_loss: 1.1604, test_f1: 0.4822
 epoch: 24, train_loss: 0.9780, test_loss: 1.1476, test_f1: 0.5079
 epoch: 25, train_loss: 0.9674, test_loss: 1.1680, test_f1: 0.5224
 epoch: 26, train_loss: 0.9696, test_loss: 1.1785, test_f1: 0.4863
 epoch: 27, train_loss: 0.9452, test_loss: 1.1622, test_f1: 0.4747
 epoch: 28, train_loss: 0.9495, test_loss: 1.1508, test_f1: 0.5151
 epoch: 29, train_loss: 0.9439, test_loss: 1.1538, test_f1: 0.5094
 epoch: 30, train_loss: 0.9310, test_loss: 1.1340, test_f1: 0.5020
 epoch: 31, train_loss: 0.9368, test_loss: 1.1609, test_f1: 0.5079
 epoch: 32, train_loss: 0.9150, test_loss: 1.1723, test_f1: 0.5120
 epoch: 33, train_loss: 0.9233, test_loss: 1.2129, test_f1: 0.5314
 epoch: 34, train_loss: 0.9197, test_loss: 1.1774, test_f1: 0.5417
 epoch: 35, train_loss: 0.8919, test_loss: 1.1912, test_f1: 0.5067
 epoch: 36, train_loss: 0.9011, test_loss: 1.1963, test_f1: 0.4957
 epoch: 37, train_loss: 0.8864, test_loss: 1.1599, test_f1: 0.4548
 epoch: 38, train_loss: 0.8834, test_loss: 1.1373, test_f1: 0.5352
 epoch: 39, train_loss: 0.8921, test_loss: 1.2219, test_f1: 0.5202
 epoch: 40, train_loss: 0.8714, test_loss: 1.1828, test_f1: 0.5550
 epoch: 41, train_loss: 0.8867, test_loss: 1.2094, test_f1: 0.5143
 epoch: 42, train_loss: 0.8769, test_loss: 1.2439, test_f1: 0.4986
 epoch: 43, train_loss: 0.8774, test_loss: 1.1640, test_f1: 0.5356
 epoch: 44, train_loss: 0.8774, test_loss: 1.1216, test_f1: 0.5290
 epoch: 45, train_loss: 0.8570, test_loss: 1.1296, test_f1: 0.5040
 epoch: 46, train_loss: 0.8594, test_loss: 1.1694, test_f1: 0.4493
 epoch: 47, train_loss: 0.8549, test_loss: 1.1741, test_f1: 0.4472
 epoch: 48, train_loss: 0.8359, test_loss: 1.1662, test_f1: 0.4644
 epoch: 49, train_loss: 0.8366, test_loss: 1.1842, test_f1: 0.4566
 epoch: 50, train_loss: 0.8180, test_loss: 1.1666, test_f1: 0.4588
 epoch: 51, train_loss: 0.8084, test_loss: 1.1601, test_f1: 0.4571
 epoch: 52, train_loss: 0.8162, test_loss: 1.2022, test_f1: 0.5258
 epoch: 53, train_loss: 0.8032, test_loss: 1.1859, test_f1: 0.5419
 epoch: 54, train_loss: 0.8004, test_loss: 1.2129, test_f1: 0.5523
 epoch: 55, train_loss: 0.8148, test_loss: 1.2348, test_f1: 0.5321
 epoch: 56, train_loss: 0.8061, test_loss: 1.2159, test_f1: 0.5068
 epoch: 57, train_loss: 0.7962, test_loss: 1.1868, test_f1: 0.5095
 epoch: 58, train_loss: 0.8095, test_loss: 1.2167, test_f1: 0.4994
 epoch: 59, train_loss: 0.7999, test_loss: 1.2081, test_f1: 0.5009
 epoch: 60, train_loss: 0.8007, test_loss: 1.2075, test_f1: 0.5238
 epoch: 61, train_loss: 0.8108, test_loss: 1.1881, test_f1: 0.5272
 epoch: 62, train_loss: 0.8034, test_loss: 1.1589, test_f1: 0.5517
 epoch: 63, train_loss: 0.8062, test_loss: 1.1459, test_f1: 0.5679
 epoch: 64, train_loss: 0.8188, test_loss: 1.2021, test_f1: 0.5546
 epoch: 65, train_loss: 0.7955, test_loss: 1.2122, test_f1: 0.5465
 epoch: 66, train_loss: 0.7862, test_loss: 1.2016, test_f1: 0.5538
 epoch: 67, train_loss: 0.7926, test_loss: 1.1940, test_f1: 0.5498
 epoch: 68, train_loss: 0.7810, test_loss: 1.2125, test_f1: 0.5463
 epoch: 69, train_loss: 0.7764, test_loss: 1.2328, test_f1: 0.5298
 epoch: 70, train_loss: 0.7826, test_loss: 1.2303, test_f1: 0.5262
 epoch: 71, train_loss: 0.7838, test_loss: 1.2130, test_f1: 0.5268
 epoch: 72, train_loss: 0.7698, test_loss: 1.2551, test_f1: 0.5312
 epoch: 73, train_loss: 0.7659, test_loss: 1.2600, test_f1: 0.5312
 epoch: 74, train_loss: 0.7716, test_loss: 1.2535, test_f1: 0.5300
 epoch: 75, train_loss: 0.7603, test_loss: 1.2254, test_f1: 0.5271
 epoch: 76, train_loss: 0.7830, test_loss: 1.2173, test_f1: 0.5301
 epoch: 77, train_loss: 0.7621, test_loss: 1.2073, test_f1: 0.5407
 epoch: 78, train_loss: 0.7539, test_loss: 1.1955, test_f1: 0.5328
 epoch: 79, train_loss: 0.7659, test_loss: 1.2007, test_f1: 0.5229
 epoch: 80, train_loss: 0.7904, test_loss: 1.1797, test_f1: 0.5350
 epoch: 81, train_loss: 0.8217, test_loss: 1.2058, test_f1: 0.5073
 epoch: 82, train_loss: 0.8037, test_loss: 1.2209, test_f1: 0.5194
 epoch: 83, train_loss: 0.7962, test_loss: 1.2099, test_f1: 0.5480
 epoch: 84, train_loss: 0.7849, test_loss: 1.1857, test_f1: 0.5356
 epoch: 85, train_loss: 0.7743, test_loss: 1.2151, test_f1: 0.5120
 epoch: 86, train_loss: 0.7701, test_loss: 1.1838, test_f1: 0.5165
 epoch: 87, train_loss: 0.7753, test_loss: 1.2052, test_f1: 0.5314
 epoch: 88, train_loss: 0.7749, test_loss: 1.1892, test_f1: 0.5275
 epoch: 89, train_loss: 0.7744, test_loss: 1.1471, test_f1: 0.5460
 epoch: 90, train_loss: 0.7557, test_loss: 1.1411, test_f1: 0.5422
 epoch: 91, train_loss: 0.7581, test_loss: 1.1424, test_f1: 0.5577
 epoch: 92, train_loss: 0.7559, test_loss: 1.1878, test_f1: 0.5456
 epoch: 93, train_loss: 0.7525, test_loss: 1.2383, test_f1: 0.5423
 epoch: 94, train_loss: 0.7471, test_loss: 1.2449, test_f1: 0.5272
 epoch: 95, train_loss: 0.7543, test_loss: 1.2659, test_f1: 0.5245
 epoch: 96, train_loss: 0.7460, test_loss: 1.2632, test_f1: 0.5270
 epoch: 97, train_loss: 0.7344, test_loss: 1.2262, test_f1: 0.5309
 epoch: 98, train_loss: 0.7365, test_loss: 1.2054, test_f1: 0.5301
 epoch: 99, train_loss: 0.7470, test_loss: 1.2176, test_f1: 0.5311
##################ITERATION #7 ****************************************
 epoch: 0, train_loss: 1.2569, test_loss: 1.3675, test_f1: 0.2383
 epoch: 1, train_loss: 1.1719, test_loss: 1.3160, test_f1: 0.2281
 epoch: 2, train_loss: 1.1446, test_loss: 1.3011, test_f1: 0.2281
 epoch: 3, train_loss: 1.1168, test_loss: 1.2816, test_f1: 0.2285
 epoch: 4, train_loss: 1.0962, test_loss: 1.2728, test_f1: 0.2697
 epoch: 5, train_loss: 1.0868, test_loss: 1.2297, test_f1: 0.3257
 epoch: 6, train_loss: 1.0618, test_loss: 1.1589, test_f1: 0.4168
 epoch: 7, train_loss: 1.0587, test_loss: 1.1485, test_f1: 0.4359
 epoch: 8, train_loss: 1.0542, test_loss: 1.1306, test_f1: 0.4469
 epoch: 9, train_loss: 1.0308, test_loss: 1.1155, test_f1: 0.4792
 epoch: 10, train_loss: 1.0114, test_loss: 1.1167, test_f1: 0.4923
 epoch: 11, train_loss: 1.0047, test_loss: 1.1222, test_f1: 0.4757
 epoch: 12, train_loss: 0.9800, test_loss: 1.1129, test_f1: 0.4921
 epoch: 13, train_loss: 0.9861, test_loss: 1.1105, test_f1: 0.4840
 epoch: 14, train_loss: 0.9686, test_loss: 1.0973, test_f1: 0.4887
 epoch: 15, train_loss: 0.9686, test_loss: 1.0809, test_f1: 0.4914
 epoch: 16, train_loss: 0.9550, test_loss: 1.0737, test_f1: 0.4769
 epoch: 17, train_loss: 0.9410, test_loss: 1.0736, test_f1: 0.4842
 epoch: 18, train_loss: 0.9348, test_loss: 1.0808, test_f1: 0.4581
 epoch: 19, train_loss: 0.9381, test_loss: 1.1218, test_f1: 0.4479
 epoch: 20, train_loss: 0.9341, test_loss: 1.1748, test_f1: 0.4083
 epoch: 21, train_loss: 0.9318, test_loss: 1.1034, test_f1: 0.4752
 epoch: 22, train_loss: 0.9293, test_loss: 1.0871, test_f1: 0.4879
 epoch: 23, train_loss: 0.9020, test_loss: 1.0974, test_f1: 0.4934
 epoch: 24, train_loss: 0.9138, test_loss: 1.0595, test_f1: 0.5165
 epoch: 25, train_loss: 0.8967, test_loss: 1.1163, test_f1: 0.4782
 epoch: 26, train_loss: 0.9037, test_loss: 1.0714, test_f1: 0.5192
 epoch: 27, train_loss: 0.8903, test_loss: 1.0594, test_f1: 0.5165
 epoch: 28, train_loss: 0.8992, test_loss: 1.0681, test_f1: 0.5164
 epoch: 29, train_loss: 0.8832, test_loss: 1.0556, test_f1: 0.5277
 epoch: 30, train_loss: 0.8861, test_loss: 1.0655, test_f1: 0.5112
 epoch: 31, train_loss: 0.8789, test_loss: 1.0645, test_f1: 0.4928
 epoch: 32, train_loss: 0.8771, test_loss: 1.0803, test_f1: 0.4831
 epoch: 33, train_loss: 0.8743, test_loss: 1.0643, test_f1: 0.5194
 epoch: 34, train_loss: 0.8558, test_loss: 1.0490, test_f1: 0.5365
 epoch: 35, train_loss: 0.8560, test_loss: 1.0939, test_f1: 0.5471
 epoch: 36, train_loss: 0.8457, test_loss: 1.0793, test_f1: 0.5156
 epoch: 37, train_loss: 0.8453, test_loss: 1.0689, test_f1: 0.5200
 epoch: 38, train_loss: 0.8388, test_loss: 1.0554, test_f1: 0.5159
 epoch: 39, train_loss: 0.8472, test_loss: 1.0814, test_f1: 0.4774
 epoch: 40, train_loss: 0.8408, test_loss: 1.1089, test_f1: 0.4757
 epoch: 41, train_loss: 0.8425, test_loss: 1.0993, test_f1: 0.4922
 epoch: 42, train_loss: 0.8295, test_loss: 1.1077, test_f1: 0.4971
 epoch: 43, train_loss: 0.8269, test_loss: 1.0673, test_f1: 0.5198
 epoch: 44, train_loss: 0.8460, test_loss: 1.0328, test_f1: 0.5079
 epoch: 45, train_loss: 0.8269, test_loss: 1.0406, test_f1: 0.5313
 epoch: 46, train_loss: 0.8171, test_loss: 1.0373, test_f1: 0.5688
 epoch: 47, train_loss: 0.8061, test_loss: 1.0214, test_f1: 0.5704
 epoch: 48, train_loss: 0.8111, test_loss: 1.0088, test_f1: 0.5566
 epoch: 49, train_loss: 0.8065, test_loss: 1.0191, test_f1: 0.5596
 epoch: 50, train_loss: 0.8030, test_loss: 1.0057, test_f1: 0.5878
 epoch: 51, train_loss: 0.7795, test_loss: 0.9988, test_f1: 0.5941
 epoch: 52, train_loss: 0.7987, test_loss: 1.0363, test_f1: 0.5517
 epoch: 53, train_loss: 0.7882, test_loss: 1.0523, test_f1: 0.5679
 epoch: 54, train_loss: 0.7773, test_loss: 1.0375, test_f1: 0.5665
 epoch: 55, train_loss: 0.7858, test_loss: 1.0385, test_f1: 0.5685
 epoch: 56, train_loss: 0.7754, test_loss: 1.0802, test_f1: 0.5640
 epoch: 57, train_loss: 0.7677, test_loss: 1.0815, test_f1: 0.5164
 epoch: 58, train_loss: 0.7693, test_loss: 1.0301, test_f1: 0.5631
 epoch: 59, train_loss: 0.7678, test_loss: 1.0587, test_f1: 0.5800
 epoch: 60, train_loss: 0.7587, test_loss: 1.0836, test_f1: 0.5631
 epoch: 61, train_loss: 0.7705, test_loss: 1.1061, test_f1: 0.5435
 epoch: 62, train_loss: 0.7756, test_loss: 1.0703, test_f1: 0.5817
 epoch: 63, train_loss: 0.7750, test_loss: 1.0561, test_f1: 0.5451
 epoch: 64, train_loss: 0.7729, test_loss: 1.0544, test_f1: 0.5314
 epoch: 65, train_loss: 0.7872, test_loss: 1.0350, test_f1: 0.5475
 epoch: 66, train_loss: 0.7695, test_loss: 1.0729, test_f1: 0.5851
 epoch: 67, train_loss: 0.7583, test_loss: 1.0836, test_f1: 0.5851
 epoch: 68, train_loss: 0.7556, test_loss: 1.0485, test_f1: 0.5870
 epoch: 69, train_loss: 0.7474, test_loss: 1.0778, test_f1: 0.5672
 epoch: 70, train_loss: 0.7514, test_loss: 1.1177, test_f1: 0.5311
 epoch: 71, train_loss: 0.7503, test_loss: 1.1043, test_f1: 0.5656
 epoch: 72, train_loss: 0.7555, test_loss: 1.0660, test_f1: 0.5929
 epoch: 73, train_loss: 0.7525, test_loss: 1.0949, test_f1: 0.5508
 epoch: 74, train_loss: 0.7591, test_loss: 1.1084, test_f1: 0.5694
 epoch: 75, train_loss: 0.7367, test_loss: 1.0787, test_f1: 0.5835
 epoch: 76, train_loss: 0.7274, test_loss: 1.0710, test_f1: 0.5479
 epoch: 77, train_loss: 0.7479, test_loss: 1.1163, test_f1: 0.5707
 epoch: 78, train_loss: 0.7547, test_loss: 1.1738, test_f1: 0.5672
 epoch: 79, train_loss: 0.7388, test_loss: 1.1471, test_f1: 0.5787
 epoch: 80, train_loss: 0.7391, test_loss: 1.1459, test_f1: 0.5634
 epoch: 81, train_loss: 0.7304, test_loss: 1.0998, test_f1: 0.5839
 epoch: 82, train_loss: 0.7316, test_loss: 1.0859, test_f1: 0.5643
 epoch: 83, train_loss: 0.7357, test_loss: 1.1106, test_f1: 0.5567
 epoch: 84, train_loss: 0.7374, test_loss: 1.0846, test_f1: 0.5845
 epoch: 85, train_loss: 0.7362, test_loss: 1.1097, test_f1: 0.5861
 epoch: 86, train_loss: 0.7321, test_loss: 1.1007, test_f1: 0.5621
 epoch: 87, train_loss: 0.7438, test_loss: 1.1260, test_f1: 0.5469
 epoch: 88, train_loss: 0.7292, test_loss: 1.1430, test_f1: 0.5628
 epoch: 89, train_loss: 0.7194, test_loss: 1.1158, test_f1: 0.5921
 epoch: 90, train_loss: 0.7189, test_loss: 1.1120, test_f1: 0.5720
 epoch: 91, train_loss: 0.7248, test_loss: 1.1158, test_f1: 0.5811
 epoch: 92, train_loss: 0.7207, test_loss: 1.1064, test_f1: 0.5746
 epoch: 93, train_loss: 0.7104, test_loss: 1.1054, test_f1: 0.5701
 epoch: 94, train_loss: 0.7166, test_loss: 1.1447, test_f1: 0.5788
 epoch: 95, train_loss: 0.7192, test_loss: 1.1823, test_f1: 0.5689
 epoch: 96, train_loss: 0.7120, test_loss: 1.1618, test_f1: 0.5536
 epoch: 97, train_loss: 0.7353, test_loss: 1.1683, test_f1: 0.5742
 epoch: 98, train_loss: 0.7206, test_loss: 1.1610, test_f1: 0.5734
 epoch: 99, train_loss: 0.7142, test_loss: 1.1357, test_f1: 0.5693
##################ITERATION #8 ****************************************
 epoch: 0, train_loss: 1.3533, test_loss: 1.3015, test_f1: 0.2281
 epoch: 1, train_loss: 1.2437, test_loss: 1.2994, test_f1: 0.2281
 epoch: 2, train_loss: 1.2181, test_loss: 1.2933, test_f1: 0.2281
 epoch: 3, train_loss: 1.2051, test_loss: 1.2815, test_f1: 0.2281
 epoch: 4, train_loss: 1.1799, test_loss: 1.2632, test_f1: 0.2281
 epoch: 5, train_loss: 1.1745, test_loss: 1.2491, test_f1: 0.2281
 epoch: 6, train_loss: 1.1495, test_loss: 1.2371, test_f1: 0.2308
 epoch: 7, train_loss: 1.1275, test_loss: 1.2212, test_f1: 0.3442
 epoch: 8, train_loss: 1.1108, test_loss: 1.2004, test_f1: 0.3779
 epoch: 9, train_loss: 1.1440, test_loss: 1.1808, test_f1: 0.4178
 epoch: 10, train_loss: 1.1068, test_loss: 1.1663, test_f1: 0.4242
 epoch: 11, train_loss: 1.0936, test_loss: 1.1606, test_f1: 0.4317
 epoch: 12, train_loss: 1.0881, test_loss: 1.1486, test_f1: 0.4341
 epoch: 13, train_loss: 1.0796, test_loss: 1.1396, test_f1: 0.4341
 epoch: 14, train_loss: 1.0703, test_loss: 1.1289, test_f1: 0.4581
 epoch: 15, train_loss: 1.0561, test_loss: 1.1245, test_f1: 0.4694
 epoch: 16, train_loss: 1.0455, test_loss: 1.1192, test_f1: 0.4711
 epoch: 17, train_loss: 1.0308, test_loss: 1.1176, test_f1: 0.4794
 epoch: 18, train_loss: 1.0410, test_loss: 1.1137, test_f1: 0.4758
 epoch: 19, train_loss: 1.0317, test_loss: 1.1033, test_f1: 0.5068
 epoch: 20, train_loss: 1.0229, test_loss: 1.0982, test_f1: 0.5051
 epoch: 21, train_loss: 1.0090, test_loss: 1.0969, test_f1: 0.4966
 epoch: 22, train_loss: 1.0086, test_loss: 1.0816, test_f1: 0.4868
 epoch: 23, train_loss: 1.0033, test_loss: 1.0742, test_f1: 0.4858
 epoch: 24, train_loss: 0.9890, test_loss: 1.0690, test_f1: 0.4977
 epoch: 25, train_loss: 0.9812, test_loss: 1.0755, test_f1: 0.5080
 epoch: 26, train_loss: 0.9782, test_loss: 1.0802, test_f1: 0.5439
 epoch: 27, train_loss: 0.9683, test_loss: 1.0893, test_f1: 0.5306
 epoch: 28, train_loss: 0.9723, test_loss: 1.0907, test_f1: 0.5191
 epoch: 29, train_loss: 0.9631, test_loss: 1.0845, test_f1: 0.5281
 epoch: 30, train_loss: 0.9664, test_loss: 1.0701, test_f1: 0.5350
 epoch: 31, train_loss: 0.9483, test_loss: 1.0479, test_f1: 0.5289
 epoch: 32, train_loss: 0.9432, test_loss: 1.0461, test_f1: 0.5218
 epoch: 33, train_loss: 0.9369, test_loss: 1.0714, test_f1: 0.5224
 epoch: 34, train_loss: 0.9351, test_loss: 1.0561, test_f1: 0.5424
 epoch: 35, train_loss: 0.9230, test_loss: 1.0549, test_f1: 0.5424
 epoch: 36, train_loss: 0.9405, test_loss: 1.0438, test_f1: 0.5518
 epoch: 37, train_loss: 0.9158, test_loss: 1.0492, test_f1: 0.5643
 epoch: 38, train_loss: 0.9057, test_loss: 1.0524, test_f1: 0.5262
 epoch: 39, train_loss: 0.9029, test_loss: 1.0554, test_f1: 0.5251
 epoch: 40, train_loss: 0.8931, test_loss: 1.0462, test_f1: 0.5196
 epoch: 41, train_loss: 0.9062, test_loss: 1.0500, test_f1: 0.5549
 epoch: 42, train_loss: 0.8920, test_loss: 1.0423, test_f1: 0.5778
 epoch: 43, train_loss: 0.8927, test_loss: 1.0692, test_f1: 0.5460
 epoch: 44, train_loss: 0.8935, test_loss: 1.0561, test_f1: 0.5344
 epoch: 45, train_loss: 0.8661, test_loss: 1.0599, test_f1: 0.5407
 epoch: 46, train_loss: 0.8697, test_loss: 1.0607, test_f1: 0.5415
 epoch: 47, train_loss: 0.8757, test_loss: 1.0466, test_f1: 0.5447
 epoch: 48, train_loss: 0.8538, test_loss: 1.0326, test_f1: 0.5632
 epoch: 49, train_loss: 0.8611, test_loss: 1.0225, test_f1: 0.5858
 epoch: 50, train_loss: 0.8576, test_loss: 1.0328, test_f1: 0.5831
 epoch: 51, train_loss: 0.8639, test_loss: 1.0521, test_f1: 0.5647
 epoch: 52, train_loss: 0.8426, test_loss: 1.0486, test_f1: 0.5756
 epoch: 53, train_loss: 0.8549, test_loss: 1.0310, test_f1: 0.5781
 epoch: 54, train_loss: 0.8367, test_loss: 1.0249, test_f1: 0.5652
 epoch: 55, train_loss: 0.8439, test_loss: 1.0304, test_f1: 0.5701
 epoch: 56, train_loss: 0.8395, test_loss: 1.0303, test_f1: 0.5600
 epoch: 57, train_loss: 0.8197, test_loss: 1.0176, test_f1: 0.5650
 epoch: 58, train_loss: 0.8284, test_loss: 1.0214, test_f1: 0.5622
 epoch: 59, train_loss: 0.8386, test_loss: 1.0221, test_f1: 0.5715
 epoch: 60, train_loss: 0.8337, test_loss: 1.0229, test_f1: 0.5770
 epoch: 61, train_loss: 0.8226, test_loss: 1.0158, test_f1: 0.5797
 epoch: 62, train_loss: 0.8191, test_loss: 1.0167, test_f1: 0.5771
 epoch: 63, train_loss: 0.8095, test_loss: 1.0242, test_f1: 0.5668
 epoch: 64, train_loss: 0.8254, test_loss: 1.0283, test_f1: 0.5663
 epoch: 65, train_loss: 0.8047, test_loss: 1.0271, test_f1: 0.5769
 epoch: 66, train_loss: 0.8267, test_loss: 1.0295, test_f1: 0.5448
 epoch: 67, train_loss: 0.8055, test_loss: 1.0475, test_f1: 0.5468
 epoch: 68, train_loss: 0.8127, test_loss: 1.0502, test_f1: 0.5491
 epoch: 69, train_loss: 0.8193, test_loss: 1.0534, test_f1: 0.5430
 epoch: 70, train_loss: 0.8168, test_loss: 1.0320, test_f1: 0.5610
 epoch: 71, train_loss: 0.8139, test_loss: 1.0429, test_f1: 0.5625
 epoch: 72, train_loss: 0.8148, test_loss: 1.0514, test_f1: 0.5540
 epoch: 73, train_loss: 0.8038, test_loss: 1.0227, test_f1: 0.5608
 epoch: 74, train_loss: 0.7981, test_loss: 1.0261, test_f1: 0.5440
 epoch: 75, train_loss: 0.8027, test_loss: 1.0389, test_f1: 0.5624
 epoch: 76, train_loss: 0.7949, test_loss: 1.0328, test_f1: 0.5397
 epoch: 77, train_loss: 0.7949, test_loss: 1.0254, test_f1: 0.5450
 epoch: 78, train_loss: 0.7823, test_loss: 1.0279, test_f1: 0.5535
 epoch: 79, train_loss: 0.7901, test_loss: 1.0271, test_f1: 0.5598
 epoch: 80, train_loss: 0.7802, test_loss: 1.0304, test_f1: 0.5748
 epoch: 81, train_loss: 0.7809, test_loss: 1.0247, test_f1: 0.5767
 epoch: 82, train_loss: 0.7730, test_loss: 1.0319, test_f1: 0.5678
 epoch: 83, train_loss: 0.7843, test_loss: 1.0578, test_f1: 0.5795
 epoch: 84, train_loss: 0.7918, test_loss: 1.0248, test_f1: 0.5917
 epoch: 85, train_loss: 0.7687, test_loss: 1.0129, test_f1: 0.6186
 epoch: 86, train_loss: 0.7734, test_loss: 1.0040, test_f1: 0.6170
 epoch: 87, train_loss: 0.7700, test_loss: 1.0166, test_f1: 0.6108
 epoch: 88, train_loss: 0.7789, test_loss: 1.0334, test_f1: 0.5950
 epoch: 89, train_loss: 0.7663, test_loss: 1.0169, test_f1: 0.6047
 epoch: 90, train_loss: 0.7665, test_loss: 1.0150, test_f1: 0.6029
 epoch: 91, train_loss: 0.7612, test_loss: 1.0394, test_f1: 0.5653
 epoch: 92, train_loss: 0.7572, test_loss: 1.0341, test_f1: 0.5722
 epoch: 93, train_loss: 0.7681, test_loss: 1.0200, test_f1: 0.6015
 epoch: 94, train_loss: 0.7664, test_loss: 1.0309, test_f1: 0.6062
 epoch: 95, train_loss: 0.7570, test_loss: 1.0245, test_f1: 0.5757
 epoch: 96, train_loss: 0.7625, test_loss: 1.0199, test_f1: 0.6006
 epoch: 97, train_loss: 0.7505, test_loss: 1.0325, test_f1: 0.5837
 epoch: 98, train_loss: 0.7537, test_loss: 1.0722, test_f1: 0.5443
 epoch: 99, train_loss: 0.7616, test_loss: 1.0565, test_f1: 0.5572
##################ITERATION #9 ****************************************
 epoch: 0, train_loss: 1.5437, test_loss: 1.3593, test_f1: 0.2281
 epoch: 1, train_loss: 1.3380, test_loss: 1.3209, test_f1: 0.2281
 epoch: 2, train_loss: 1.2808, test_loss: 1.3228, test_f1: 0.2281
 epoch: 3, train_loss: 1.2427, test_loss: 1.3210, test_f1: 0.2281
 epoch: 4, train_loss: 1.2379, test_loss: 1.3095, test_f1: 0.2281
 epoch: 5, train_loss: 1.1902, test_loss: 1.2858, test_f1: 0.2281
 epoch: 6, train_loss: 1.1669, test_loss: 1.2682, test_f1: 0.2281
 epoch: 7, train_loss: 1.1361, test_loss: 1.2466, test_f1: 0.2553
 epoch: 8, train_loss: 1.1217, test_loss: 1.2228, test_f1: 0.2973
 epoch: 9, train_loss: 1.1119, test_loss: 1.2082, test_f1: 0.3309
 epoch: 10, train_loss: 1.1029, test_loss: 1.2189, test_f1: 0.3485
 epoch: 11, train_loss: 1.0864, test_loss: 1.2380, test_f1: 0.3662
 epoch: 12, train_loss: 1.0743, test_loss: 1.2908, test_f1: 0.3570
 epoch: 13, train_loss: 1.0670, test_loss: 1.3665, test_f1: 0.3930
 epoch: 14, train_loss: 1.0610, test_loss: 1.1582, test_f1: 0.4011
 epoch: 15, train_loss: 1.0404, test_loss: 1.1580, test_f1: 0.4115
 epoch: 16, train_loss: 1.0424, test_loss: 1.1580, test_f1: 0.4200
 epoch: 17, train_loss: 1.0333, test_loss: 1.1526, test_f1: 0.4480
 epoch: 18, train_loss: 1.0343, test_loss: 1.1754, test_f1: 0.4268
 epoch: 19, train_loss: 1.0201, test_loss: 1.1797, test_f1: 0.4455
 epoch: 20, train_loss: 1.0142, test_loss: 1.1716, test_f1: 0.4322
 epoch: 21, train_loss: 1.0198, test_loss: 1.2274, test_f1: 0.4575
 epoch: 22, train_loss: 0.9921, test_loss: 1.2058, test_f1: 0.4506
 epoch: 23, train_loss: 1.0099, test_loss: 1.2253, test_f1: 0.4555
 epoch: 24, train_loss: 1.0078, test_loss: 1.2516, test_f1: 0.4574
 epoch: 25, train_loss: 0.9893, test_loss: 1.3152, test_f1: 0.4450
 epoch: 26, train_loss: 0.9876, test_loss: 1.2418, test_f1: 0.4479
 epoch: 27, train_loss: 0.9766, test_loss: 1.1784, test_f1: 0.4600
 epoch: 28, train_loss: 0.9787, test_loss: 1.1476, test_f1: 0.4611
 epoch: 29, train_loss: 0.9830, test_loss: 1.1351, test_f1: 0.4613
 epoch: 30, train_loss: 0.9740, test_loss: 1.1549, test_f1: 0.4883
 epoch: 31, train_loss: 0.9842, test_loss: 1.1782, test_f1: 0.4923
 epoch: 32, train_loss: 0.9593, test_loss: 1.1963, test_f1: 0.4827
 epoch: 33, train_loss: 0.9734, test_loss: 1.2869, test_f1: 0.4914
 epoch: 34, train_loss: 0.9670, test_loss: 1.3557, test_f1: 0.4843
 epoch: 35, train_loss: 0.9589, test_loss: 1.7036, test_f1: 0.4436
 epoch: 36, train_loss: 0.9637, test_loss: 1.4201, test_f1: 0.4513
 epoch: 37, train_loss: 0.9732, test_loss: 1.1162, test_f1: 0.4791
 epoch: 38, train_loss: 0.9492, test_loss: 1.1020, test_f1: 0.5008
 epoch: 39, train_loss: 0.9457, test_loss: 1.1198, test_f1: 0.5308
 epoch: 40, train_loss: 0.9334, test_loss: 1.1818, test_f1: 0.4987
 epoch: 41, train_loss: 0.9426, test_loss: 1.1993, test_f1: 0.5039
 epoch: 42, train_loss: 0.9333, test_loss: 1.1332, test_f1: 0.5239
 epoch: 43, train_loss: 0.9292, test_loss: 1.1428, test_f1: 0.5065
 epoch: 44, train_loss: 0.9262, test_loss: 1.1492, test_f1: 0.5362
 epoch: 45, train_loss: 0.9084, test_loss: 1.1952, test_f1: 0.5259
 epoch: 46, train_loss: 0.9166, test_loss: 1.2070, test_f1: 0.5184
 epoch: 47, train_loss: 0.9229, test_loss: 1.2631, test_f1: 0.5151
 epoch: 48, train_loss: 0.9164, test_loss: 1.1637, test_f1: 0.5245
 epoch: 49, train_loss: 0.9183, test_loss: 1.2603, test_f1: 0.5106
 epoch: 50, train_loss: 0.9114, test_loss: 1.3437, test_f1: 0.5074
 epoch: 51, train_loss: 0.9077, test_loss: 1.1975, test_f1: 0.5000
 epoch: 52, train_loss: 0.8948, test_loss: 1.1635, test_f1: 0.5403
 epoch: 53, train_loss: 0.8903, test_loss: 1.1252, test_f1: 0.5459
 epoch: 54, train_loss: 0.9026, test_loss: 1.1587, test_f1: 0.5294
 epoch: 55, train_loss: 0.8774, test_loss: 1.2521, test_f1: 0.5281
 epoch: 56, train_loss: 0.9039, test_loss: 1.2770, test_f1: 0.5029
 epoch: 57, train_loss: 0.8897, test_loss: 1.2697, test_f1: 0.5065
 epoch: 58, train_loss: 0.9041, test_loss: 1.3431, test_f1: 0.4874
 epoch: 59, train_loss: 0.8908, test_loss: 1.2930, test_f1: 0.5124
 epoch: 60, train_loss: 0.9015, test_loss: 1.2776, test_f1: 0.5110
 epoch: 61, train_loss: 0.8861, test_loss: 1.1713, test_f1: 0.5276
 epoch: 62, train_loss: 0.8859, test_loss: 1.1580, test_f1: 0.5295
 epoch: 63, train_loss: 0.8781, test_loss: 1.1448, test_f1: 0.5216
 epoch: 64, train_loss: 0.8823, test_loss: 1.1812, test_f1: 0.5227
 epoch: 65, train_loss: 0.8686, test_loss: 1.3352, test_f1: 0.4860
 epoch: 66, train_loss: 0.8729, test_loss: 1.2831, test_f1: 0.5181
 epoch: 67, train_loss: 0.8646, test_loss: 1.3194, test_f1: 0.5042
 epoch: 68, train_loss: 0.8775, test_loss: 1.2450, test_f1: 0.5094
 epoch: 69, train_loss: 0.8737, test_loss: 1.1983, test_f1: 0.5290
 epoch: 70, train_loss: 0.8754, test_loss: 1.1907, test_f1: 0.5342
 epoch: 71, train_loss: 0.8847, test_loss: 1.1878, test_f1: 0.5337
 epoch: 72, train_loss: 0.8747, test_loss: 1.2888, test_f1: 0.5436
 epoch: 73, train_loss: 0.8673, test_loss: 1.3332, test_f1: 0.5245
 epoch: 74, train_loss: 0.8604, test_loss: 1.2278, test_f1: 0.5163
 epoch: 75, train_loss: 0.8581, test_loss: 1.1744, test_f1: 0.5354
 epoch: 76, train_loss: 0.8638, test_loss: 1.1978, test_f1: 0.5296
 epoch: 77, train_loss: 0.8625, test_loss: 1.3346, test_f1: 0.5265
 epoch: 78, train_loss: 0.8463, test_loss: 1.3635, test_f1: 0.4935
 epoch: 79, train_loss: 0.8573, test_loss: 1.2362, test_f1: 0.5207
 epoch: 80, train_loss: 0.8474, test_loss: 1.1930, test_f1: 0.5222
 epoch: 81, train_loss: 0.8512, test_loss: 1.2326, test_f1: 0.5341
 epoch: 82, train_loss: 0.8564, test_loss: 1.2173, test_f1: 0.5304
 epoch: 83, train_loss: 0.8311, test_loss: 1.2042, test_f1: 0.5340
 epoch: 84, train_loss: 0.8476, test_loss: 1.2337, test_f1: 0.5148
 epoch: 85, train_loss: 0.8641, test_loss: 1.3040, test_f1: 0.5145
 epoch: 86, train_loss: 0.8554, test_loss: 1.3106, test_f1: 0.5383
 epoch: 87, train_loss: 0.8410, test_loss: 1.3572, test_f1: 0.5360
 epoch: 88, train_loss: 0.8456, test_loss: 1.3571, test_f1: 0.5166
 epoch: 89, train_loss: 0.8600, test_loss: 1.2209, test_f1: 0.5162
 epoch: 90, train_loss: 0.8539, test_loss: 1.2327, test_f1: 0.5244
 epoch: 91, train_loss: 0.8537, test_loss: 1.2638, test_f1: 0.5107
 epoch: 92, train_loss: 0.8623, test_loss: 1.2205, test_f1: 0.5232
 epoch: 93, train_loss: 0.8423, test_loss: 1.1753, test_f1: 0.5380
 epoch: 94, train_loss: 0.8490, test_loss: 1.2401, test_f1: 0.5287
 epoch: 95, train_loss: 0.8382, test_loss: 1.3328, test_f1: 0.5161
 epoch: 96, train_loss: 0.8467, test_loss: 1.2744, test_f1: 0.5181
 epoch: 97, train_loss: 0.8336, test_loss: 1.2358, test_f1: 0.5354
 epoch: 98, train_loss: 0.8298, test_loss: 1.2873, test_f1: 0.5372
 epoch: 99, train_loss: 0.8256, test_loss: 1.2486, test_f1: 0.5215

Training completed in 315.33 seconds
Best F1: 0.6293 at epoch 83
Mean F1 across iterations: 0.5723  0.0333
========================FINAL RESULTS================================
FEGIN weighted F1: 0.6293  0.0333
python main.py --data ltspice_demos --representation component_pin --model FEGIN --layers 5 --hiddens 16 --batch_size 256 --lr 0.001 --emb_size 128 --epochs 100 --save_appendix component_pin_L5_H16_BS256_LR0.001_E128 --no_val
-----



STDERR:
  File "main.py", line 370, in <module>
    main()
  File "main.py", line 254, in main
    dataset = dataset_class(
  File "/home/philip/projects/ltspice_examples_code_repo/Circuit-Completion-Using-GNNs/component_classification_with_link_prediction_head/evaluation/FEGIN/kernel/circuit_datasets.py", line 15, in __init__
    self.data, self.slices = torch.load(self.processed_paths[0])
  File "/home/philip/.local/lib/python3.8/site-packages/torch/serialization.py", line 1040, in load
    warnings.warn(
  File "/usr/lib/python3.8/warnings.py", line 109, in _showwarnmsg
    sw(msg.message, msg.category, msg.filename, msg.lineno,
  File "main.py", line 47, in warn_with_traceback
    traceback.print_stack(file=log)
/home/philip/projects/ltspice_examples_code_repo/Circuit-Completion-Using-GNNs/component_classification_with_link_prediction_head/evaluation/FEGIN/kernel/circuit_datasets.py:15: FutureWarning: You are using `torch.load` with `weights_only=False` (the current default value), which uses the default pickle module implicitly. It is possible to construct malicious pickle data which will execute arbitrary code during unpickling (See https://github.com/pytorch/pytorch/blob/main/SECURITY.md#untrusted-models for more details). In a future release, the default value for `weights_only` will be flipped to `True`. This limits the functions that could be executed during unpickling. Arbitrary objects will no longer be allowed to be loaded via this mode unless they are explicitly allowlisted by the user via `torch.serialization.add_safe_globals`. We recommend you start setting `weights_only=True` for any use case where you don't have full control of the loaded file. Please open an issue on GitHub for any issues related to this experimental feature.
  self.data, self.slices = torch.load(self.processed_paths[0])
