STDOUT:
Results will be saved in /home/philip/projects/ltspice_examples_code_repo/Circuit-Completion-Using-GNNs/component_classification_with_link_prediction_head/evaluation/FEGIN/results/model_FEGIN_dataset_ltspice_examples
Command line input: python main.py --data ltspice_examples --representation component_net --model FEGIN --layers 5 --hiddens 32 --batch_size 64 --lr 0.01 --emb_size 512 --epochs 100 --save_appendix component_net_L5_H32_BS64_LR0.01_E512 --no_val
 is saved.
-----
ltspice_examples - FEGIN
Using 5 layers, 32 hidden units, h = 2
Loading component_net representation dataset
ENTERED
Training FEGIN on component_net representation
Train: 3558, Test: 846
##################ITERATION #0 ****************************************
 epoch: 0, train_loss: 1.2159, test_loss: 1.1004, test_f1: 0.3500
 epoch: 1, train_loss: 1.0634, test_loss: 1.0173, test_f1: 0.5186
 epoch: 2, train_loss: 1.0201, test_loss: 1.1210, test_f1: 0.4358
 epoch: 3, train_loss: 0.9950, test_loss: 1.0520, test_f1: 0.4704
 epoch: 4, train_loss: 0.9884, test_loss: 1.0185, test_f1: 0.4800
 epoch: 5, train_loss: 0.9789, test_loss: 1.0480, test_f1: 0.4735
 epoch: 6, train_loss: 0.9616, test_loss: 0.9675, test_f1: 0.5016
 epoch: 7, train_loss: 0.9578, test_loss: 1.0104, test_f1: 0.4888
 epoch: 8, train_loss: 0.9402, test_loss: 0.9460, test_f1: 0.4942
 epoch: 9, train_loss: 0.9363, test_loss: 0.9787, test_f1: 0.4946
 epoch: 10, train_loss: 0.9305, test_loss: 1.0186, test_f1: 0.5088
 epoch: 11, train_loss: 0.9370, test_loss: 0.9396, test_f1: 0.4660
 epoch: 12, train_loss: 0.9216, test_loss: 0.9768, test_f1: 0.5050
 epoch: 13, train_loss: 0.9128, test_loss: 1.0781, test_f1: 0.4715
 epoch: 14, train_loss: 0.9193, test_loss: 0.9764, test_f1: 0.5520
 epoch: 15, train_loss: 0.9079, test_loss: 1.0436, test_f1: 0.5243
 epoch: 16, train_loss: 0.9018, test_loss: 0.9853, test_f1: 0.5048
 epoch: 17, train_loss: 0.9007, test_loss: 1.0681, test_f1: 0.4564
 epoch: 18, train_loss: 0.9056, test_loss: 0.9805, test_f1: 0.5335
 epoch: 19, train_loss: 0.9009, test_loss: 1.0381, test_f1: 0.5052
 epoch: 20, train_loss: 0.8949, test_loss: 1.0038, test_f1: 0.5104
 epoch: 21, train_loss: 0.8789, test_loss: 1.0159, test_f1: 0.5293
 epoch: 22, train_loss: 0.9125, test_loss: 1.0527, test_f1: 0.5073
 epoch: 23, train_loss: 0.8891, test_loss: 0.9624, test_f1: 0.4931
 epoch: 24, train_loss: 0.8872, test_loss: 1.0472, test_f1: 0.5029
 epoch: 25, train_loss: 0.8768, test_loss: 0.8867, test_f1: 0.5063
 epoch: 26, train_loss: 0.8861, test_loss: 1.0273, test_f1: 0.5018
 epoch: 27, train_loss: 0.8702, test_loss: 0.9463, test_f1: 0.5240
 epoch: 28, train_loss: 0.8658, test_loss: 1.0015, test_f1: 0.4987
 epoch: 29, train_loss: 0.8628, test_loss: 1.0510, test_f1: 0.4958
 epoch: 30, train_loss: 0.8629, test_loss: 0.9391, test_f1: 0.5096
 epoch: 31, train_loss: 0.8728, test_loss: 1.0923, test_f1: 0.5291
 epoch: 32, train_loss: 0.8609, test_loss: 1.1171, test_f1: 0.4946
 epoch: 33, train_loss: 0.8632, test_loss: 0.9564, test_f1: 0.5250
 epoch: 34, train_loss: 0.8518, test_loss: 0.9871, test_f1: 0.5375
 epoch: 35, train_loss: 0.8524, test_loss: 1.0381, test_f1: 0.4877
 epoch: 36, train_loss: 0.8610, test_loss: 0.9534, test_f1: 0.5243
 epoch: 37, train_loss: 0.8544, test_loss: 0.9900, test_f1: 0.5204
 epoch: 38, train_loss: 0.8374, test_loss: 0.9361, test_f1: 0.5352
 epoch: 39, train_loss: 0.8577, test_loss: 1.0078, test_f1: 0.5114
 epoch: 40, train_loss: 0.8304, test_loss: 0.9133, test_f1: 0.5340
 epoch: 41, train_loss: 0.8307, test_loss: 0.9151, test_f1: 0.5716
 epoch: 42, train_loss: 0.8250, test_loss: 0.9442, test_f1: 0.5650
 epoch: 43, train_loss: 0.8304, test_loss: 1.0117, test_f1: 0.5577
 epoch: 44, train_loss: 0.8181, test_loss: 1.0101, test_f1: 0.5198
 epoch: 45, train_loss: 0.8189, test_loss: 0.9890, test_f1: 0.5305
 epoch: 46, train_loss: 0.8309, test_loss: 0.9689, test_f1: 0.5342
 epoch: 47, train_loss: 0.8148, test_loss: 0.9888, test_f1: 0.5064
 epoch: 48, train_loss: 0.8151, test_loss: 1.0112, test_f1: 0.5316
 epoch: 49, train_loss: 0.8052, test_loss: 0.9224, test_f1: 0.5985
 epoch: 50, train_loss: 0.8106, test_loss: 0.9266, test_f1: 0.5814
 epoch: 51, train_loss: 0.7716, test_loss: 1.0061, test_f1: 0.6092
 epoch: 52, train_loss: 0.7737, test_loss: 0.9949, test_f1: 0.5669
 epoch: 53, train_loss: 0.7421, test_loss: 1.0209, test_f1: 0.5675
 epoch: 54, train_loss: 0.7586, test_loss: 0.9695, test_f1: 0.5334
 epoch: 55, train_loss: 0.7585, test_loss: 1.0455, test_f1: 0.5329
 epoch: 56, train_loss: 0.7606, test_loss: 0.9874, test_f1: 0.5647
 epoch: 57, train_loss: 0.7520, test_loss: 0.9173, test_f1: 0.5366
 epoch: 58, train_loss: 0.7578, test_loss: 1.0193, test_f1: 0.5549
 epoch: 59, train_loss: 0.7489, test_loss: 0.9855, test_f1: 0.5716
 epoch: 60, train_loss: 0.7576, test_loss: 1.0120, test_f1: 0.5840
 epoch: 61, train_loss: 0.7433, test_loss: 1.0498, test_f1: 0.5738
 epoch: 62, train_loss: 0.7382, test_loss: 0.9781, test_f1: 0.5965
 epoch: 63, train_loss: 0.7491, test_loss: 1.0376, test_f1: 0.5649
 epoch: 64, train_loss: 0.7419, test_loss: 1.0206, test_f1: 0.6025
 epoch: 65, train_loss: 0.7363, test_loss: 1.0059, test_f1: 0.5722
 epoch: 66, train_loss: 0.7432, test_loss: 1.0313, test_f1: 0.5799
 epoch: 67, train_loss: 0.7456, test_loss: 1.0150, test_f1: 0.5730
 epoch: 68, train_loss: 0.7170, test_loss: 1.0542, test_f1: 0.5707
 epoch: 69, train_loss: 0.7340, test_loss: 1.0249, test_f1: 0.5834
 epoch: 70, train_loss: 0.7277, test_loss: 0.9862, test_f1: 0.5956
 epoch: 71, train_loss: 0.7429, test_loss: 1.0554, test_f1: 0.5655
 epoch: 72, train_loss: 0.7150, test_loss: 0.9468, test_f1: 0.5886
 epoch: 73, train_loss: 0.7170, test_loss: 0.9715, test_f1: 0.5872
 epoch: 74, train_loss: 0.7252, test_loss: 1.0488, test_f1: 0.5777
 epoch: 75, train_loss: 0.7209, test_loss: 1.0145, test_f1: 0.5792
 epoch: 76, train_loss: 0.7130, test_loss: 0.9630, test_f1: 0.6439
 epoch: 77, train_loss: 0.7098, test_loss: 1.0292, test_f1: 0.6004
 epoch: 78, train_loss: 0.7111, test_loss: 1.0173, test_f1: 0.5998
 epoch: 79, train_loss: 0.6983, test_loss: 1.0016, test_f1: 0.5646
 epoch: 80, train_loss: 0.7017, test_loss: 0.9951, test_f1: 0.5963
 epoch: 81, train_loss: 0.7170, test_loss: 1.0116, test_f1: 0.5714
 epoch: 82, train_loss: 0.7128, test_loss: 0.9791, test_f1: 0.5776
 epoch: 83, train_loss: 0.7084, test_loss: 1.0444, test_f1: 0.5897
 epoch: 84, train_loss: 0.6994, test_loss: 1.0686, test_f1: 0.6229
 epoch: 85, train_loss: 0.7034, test_loss: 1.0546, test_f1: 0.5839
 epoch: 86, train_loss: 0.6974, test_loss: 1.0801, test_f1: 0.5887
 epoch: 87, train_loss: 0.6890, test_loss: 1.0221, test_f1: 0.6036
 epoch: 88, train_loss: 0.6829, test_loss: 1.0324, test_f1: 0.6009
 epoch: 89, train_loss: 0.6964, test_loss: 1.0265, test_f1: 0.6243
 epoch: 90, train_loss: 0.6915, test_loss: 1.0500, test_f1: 0.6062
 epoch: 91, train_loss: 0.6915, test_loss: 0.9825, test_f1: 0.5737
 epoch: 92, train_loss: 0.6821, test_loss: 0.9850, test_f1: 0.6124
 epoch: 93, train_loss: 0.6821, test_loss: 1.0086, test_f1: 0.6050
 epoch: 94, train_loss: 0.6751, test_loss: 1.0475, test_f1: 0.6043
 epoch: 95, train_loss: 0.6711, test_loss: 1.0676, test_f1: 0.6192
 epoch: 96, train_loss: 0.6651, test_loss: 1.0000, test_f1: 0.6152
 epoch: 97, train_loss: 0.6891, test_loss: 1.1615, test_f1: 0.5865
 epoch: 98, train_loss: 0.6929, test_loss: 1.0847, test_f1: 0.6370
 epoch: 99, train_loss: 0.6768, test_loss: 0.9876, test_f1: 0.5941
##################ITERATION #1 ****************************************
 epoch: 0, train_loss: 1.1491, test_loss: 1.0645, test_f1: 0.4179
 epoch: 1, train_loss: 1.0198, test_loss: 1.0516, test_f1: 0.4373
 epoch: 2, train_loss: 0.9854, test_loss: 1.0573, test_f1: 0.4890
 epoch: 3, train_loss: 0.9791, test_loss: 1.0467, test_f1: 0.4651
 epoch: 4, train_loss: 0.9585, test_loss: 1.0701, test_f1: 0.4771
 epoch: 5, train_loss: 0.9542, test_loss: 1.0224, test_f1: 0.4754
 epoch: 6, train_loss: 0.9476, test_loss: 0.9577, test_f1: 0.4843
 epoch: 7, train_loss: 0.9317, test_loss: 1.0200, test_f1: 0.4912
 epoch: 8, train_loss: 0.9307, test_loss: 0.8976, test_f1: 0.4700
 epoch: 9, train_loss: 0.9239, test_loss: 1.0115, test_f1: 0.5164
 epoch: 10, train_loss: 0.9083, test_loss: 0.9529, test_f1: 0.5518
 epoch: 11, train_loss: 0.9134, test_loss: 0.9803, test_f1: 0.4963
 epoch: 12, train_loss: 0.9094, test_loss: 0.9971, test_f1: 0.5141
 epoch: 13, train_loss: 0.8910, test_loss: 0.9791, test_f1: 0.4880
 epoch: 14, train_loss: 0.8935, test_loss: 0.9701, test_f1: 0.5411
 epoch: 15, train_loss: 0.8774, test_loss: 1.0110, test_f1: 0.4993
 epoch: 16, train_loss: 0.9039, test_loss: 0.8767, test_f1: 0.5361
 epoch: 17, train_loss: 0.8848, test_loss: 0.9928, test_f1: 0.5084
 epoch: 18, train_loss: 0.8827, test_loss: 0.8831, test_f1: 0.5212
 epoch: 19, train_loss: 0.8629, test_loss: 0.9135, test_f1: 0.5303
 epoch: 20, train_loss: 0.8545, test_loss: 0.9878, test_f1: 0.5040
 epoch: 21, train_loss: 0.8474, test_loss: 0.9525, test_f1: 0.5215
 epoch: 22, train_loss: 0.8543, test_loss: 0.9402, test_f1: 0.5663
 epoch: 23, train_loss: 0.8523, test_loss: 0.9544, test_f1: 0.5677
 epoch: 24, train_loss: 0.8527, test_loss: 0.9287, test_f1: 0.5327
 epoch: 25, train_loss: 0.8295, test_loss: 0.9472, test_f1: 0.5371
 epoch: 26, train_loss: 0.8390, test_loss: 0.9385, test_f1: 0.5335
 epoch: 27, train_loss: 0.8314, test_loss: 0.8889, test_f1: 0.5531
 epoch: 28, train_loss: 0.8142, test_loss: 0.8965, test_f1: 0.5666
 epoch: 29, train_loss: 0.8148, test_loss: 0.8994, test_f1: 0.5716
 epoch: 30, train_loss: 0.7996, test_loss: 0.9332, test_f1: 0.5397
 epoch: 31, train_loss: 0.8178, test_loss: 0.8876, test_f1: 0.5304
 epoch: 32, train_loss: 0.8010, test_loss: 0.9310, test_f1: 0.5850
 epoch: 33, train_loss: 0.7808, test_loss: 0.8680, test_f1: 0.5930
 epoch: 34, train_loss: 0.7896, test_loss: 0.9402, test_f1: 0.5434
 epoch: 35, train_loss: 0.7823, test_loss: 0.9337, test_f1: 0.6024
 epoch: 36, train_loss: 0.7925, test_loss: 0.9218, test_f1: 0.5506
 epoch: 37, train_loss: 0.7950, test_loss: 0.8947, test_f1: 0.5819
 epoch: 38, train_loss: 0.7819, test_loss: 0.9986, test_f1: 0.5406
 epoch: 39, train_loss: 0.7802, test_loss: 0.8855, test_f1: 0.5582
 epoch: 40, train_loss: 0.7801, test_loss: 0.9106, test_f1: 0.5710
 epoch: 41, train_loss: 0.7726, test_loss: 0.8724, test_f1: 0.6045
 epoch: 42, train_loss: 0.7756, test_loss: 0.9136, test_f1: 0.5807
 epoch: 43, train_loss: 0.7600, test_loss: 0.9085, test_f1: 0.6082
 epoch: 44, train_loss: 0.7591, test_loss: 0.9012, test_f1: 0.5895
 epoch: 45, train_loss: 0.7669, test_loss: 0.9726, test_f1: 0.5956
 epoch: 46, train_loss: 0.7554, test_loss: 0.9585, test_f1: 0.5597
 epoch: 47, train_loss: 0.7534, test_loss: 0.8946, test_f1: 0.6246
 epoch: 48, train_loss: 0.7327, test_loss: 0.9162, test_f1: 0.5655
 epoch: 49, train_loss: 0.7502, test_loss: 0.8970, test_f1: 0.5771
 epoch: 50, train_loss: 0.7515, test_loss: 0.9420, test_f1: 0.5641
 epoch: 51, train_loss: 0.7245, test_loss: 0.8958, test_f1: 0.6342
 epoch: 52, train_loss: 0.7129, test_loss: 0.9201, test_f1: 0.6185
 epoch: 53, train_loss: 0.7045, test_loss: 0.9053, test_f1: 0.5930
 epoch: 54, train_loss: 0.7049, test_loss: 0.9208, test_f1: 0.6237
 epoch: 55, train_loss: 0.7025, test_loss: 0.9139, test_f1: 0.5996
 epoch: 56, train_loss: 0.6891, test_loss: 0.9272, test_f1: 0.6276
 epoch: 57, train_loss: 0.6960, test_loss: 0.9658, test_f1: 0.5887
 epoch: 58, train_loss: 0.6933, test_loss: 0.9589, test_f1: 0.6059
 epoch: 59, train_loss: 0.6708, test_loss: 0.9319, test_f1: 0.6515
 epoch: 60, train_loss: 0.6902, test_loss: 0.9506, test_f1: 0.6290
 epoch: 61, train_loss: 0.6844, test_loss: 0.9446, test_f1: 0.6199
 epoch: 62, train_loss: 0.6743, test_loss: 0.9278, test_f1: 0.6169
 epoch: 63, train_loss: 0.6778, test_loss: 0.9685, test_f1: 0.5978
 epoch: 64, train_loss: 0.6603, test_loss: 1.0062, test_f1: 0.6779
 epoch: 65, train_loss: 0.6609, test_loss: 1.0351, test_f1: 0.6078
 epoch: 66, train_loss: 0.6671, test_loss: 1.0364, test_f1: 0.5762
 epoch: 67, train_loss: 0.6745, test_loss: 0.9464, test_f1: 0.6204
 epoch: 68, train_loss: 0.6823, test_loss: 0.9091, test_f1: 0.6200
 epoch: 69, train_loss: 0.6626, test_loss: 0.9919, test_f1: 0.6240
 epoch: 70, train_loss: 0.6632, test_loss: 1.0228, test_f1: 0.6329
 epoch: 71, train_loss: 0.6794, test_loss: 0.9531, test_f1: 0.6495
 epoch: 72, train_loss: 0.6756, test_loss: 0.9464, test_f1: 0.6200
 epoch: 73, train_loss: 0.6661, test_loss: 0.9425, test_f1: 0.6259
 epoch: 74, train_loss: 0.6530, test_loss: 0.9558, test_f1: 0.6523
 epoch: 75, train_loss: 0.6641, test_loss: 0.9113, test_f1: 0.6672
 epoch: 76, train_loss: 0.6527, test_loss: 1.0404, test_f1: 0.6385
 epoch: 77, train_loss: 0.6678, test_loss: 0.9697, test_f1: 0.6403
 epoch: 78, train_loss: 0.6377, test_loss: 1.0128, test_f1: 0.6039
 epoch: 79, train_loss: 0.6420, test_loss: 1.0076, test_f1: 0.6597
 epoch: 80, train_loss: 0.6372, test_loss: 1.0007, test_f1: 0.6440
 epoch: 81, train_loss: 0.6454, test_loss: 1.0037, test_f1: 0.6592
 epoch: 82, train_loss: 0.6426, test_loss: 0.9957, test_f1: 0.6376
 epoch: 83, train_loss: 0.6357, test_loss: 0.9912, test_f1: 0.6580
 epoch: 84, train_loss: 0.6426, test_loss: 1.0092, test_f1: 0.6438
 epoch: 85, train_loss: 0.6338, test_loss: 1.0195, test_f1: 0.6315
 epoch: 86, train_loss: 0.6300, test_loss: 0.9637, test_f1: 0.6677
 epoch: 87, train_loss: 0.6334, test_loss: 1.0483, test_f1: 0.6669
 epoch: 88, train_loss: 0.6280, test_loss: 1.0263, test_f1: 0.6304
 epoch: 89, train_loss: 0.6167, test_loss: 1.0267, test_f1: 0.6273
 epoch: 90, train_loss: 0.6222, test_loss: 1.0359, test_f1: 0.6497
 epoch: 91, train_loss: 0.6175, test_loss: 1.0703, test_f1: 0.6362
 epoch: 92, train_loss: 0.6088, test_loss: 1.0507, test_f1: 0.6496
 epoch: 93, train_loss: 0.6261, test_loss: 1.0598, test_f1: 0.6603
 epoch: 94, train_loss: 0.6070, test_loss: 1.1134, test_f1: 0.6525
 epoch: 95, train_loss: 0.6265, test_loss: 1.0381, test_f1: 0.6415
 epoch: 96, train_loss: 0.6097, test_loss: 1.0255, test_f1: 0.6793
 epoch: 97, train_loss: 0.6035, test_loss: 1.1702, test_f1: 0.6341
 epoch: 98, train_loss: 0.6029, test_loss: 1.0821, test_f1: 0.6510
 epoch: 99, train_loss: 0.6002, test_loss: 1.1873, test_f1: 0.6614
##################ITERATION #2 ****************************************
 epoch: 0, train_loss: 1.1460, test_loss: 1.1179, test_f1: 0.4086
 epoch: 1, train_loss: 1.0279, test_loss: 1.0082, test_f1: 0.5017
 epoch: 2, train_loss: 0.9973, test_loss: 1.0722, test_f1: 0.4555
 epoch: 3, train_loss: 0.9772, test_loss: 1.0628, test_f1: 0.5259
 epoch: 4, train_loss: 0.9644, test_loss: 1.0339, test_f1: 0.5038
 epoch: 5, train_loss: 0.9612, test_loss: 1.0136, test_f1: 0.4925
 epoch: 6, train_loss: 0.9442, test_loss: 1.0475, test_f1: 0.4760
 epoch: 7, train_loss: 0.9390, test_loss: 0.9804, test_f1: 0.4899
 epoch: 8, train_loss: 0.9220, test_loss: 1.0387, test_f1: 0.4808
 epoch: 9, train_loss: 0.9201, test_loss: 0.9830, test_f1: 0.5372
 epoch: 10, train_loss: 0.9251, test_loss: 0.9860, test_f1: 0.5223
 epoch: 11, train_loss: 0.9138, test_loss: 0.9466, test_f1: 0.5570
 epoch: 12, train_loss: 0.8959, test_loss: 0.9415, test_f1: 0.4688
 epoch: 13, train_loss: 0.8897, test_loss: 0.9402, test_f1: 0.5285
 epoch: 14, train_loss: 0.8784, test_loss: 1.0827, test_f1: 0.5455
 epoch: 15, train_loss: 0.9001, test_loss: 0.9082, test_f1: 0.5022
 epoch: 16, train_loss: 0.8965, test_loss: 0.9506, test_f1: 0.4902
 epoch: 17, train_loss: 0.8746, test_loss: 0.9740, test_f1: 0.5258
 epoch: 18, train_loss: 0.8801, test_loss: 0.9379, test_f1: 0.5098
 epoch: 19, train_loss: 0.8475, test_loss: 0.9901, test_f1: 0.4969
 epoch: 20, train_loss: 0.8770, test_loss: 0.9694, test_f1: 0.4947
 epoch: 21, train_loss: 0.8702, test_loss: 0.9381, test_f1: 0.5282
 epoch: 22, train_loss: 0.8696, test_loss: 0.9294, test_f1: 0.5064
 epoch: 23, train_loss: 0.8555, test_loss: 0.9584, test_f1: 0.5124
 epoch: 24, train_loss: 0.8438, test_loss: 0.9368, test_f1: 0.5233
 epoch: 25, train_loss: 0.8391, test_loss: 0.9519, test_f1: 0.5476
 epoch: 26, train_loss: 0.8436, test_loss: 0.9417, test_f1: 0.5283
 epoch: 27, train_loss: 0.8330, test_loss: 0.9303, test_f1: 0.5044
 epoch: 28, train_loss: 0.8322, test_loss: 0.9223, test_f1: 0.5810
 epoch: 29, train_loss: 0.8493, test_loss: 0.9987, test_f1: 0.5043
 epoch: 30, train_loss: 0.8340, test_loss: 1.0513, test_f1: 0.5103
 epoch: 31, train_loss: 0.8362, test_loss: 0.9957, test_f1: 0.5077
 epoch: 32, train_loss: 0.8158, test_loss: 0.9447, test_f1: 0.5252
 epoch: 33, train_loss: 0.8075, test_loss: 0.9831, test_f1: 0.5287
 epoch: 34, train_loss: 0.8229, test_loss: 1.0160, test_f1: 0.5471
 epoch: 35, train_loss: 0.8112, test_loss: 1.0192, test_f1: 0.4942
 epoch: 36, train_loss: 0.8033, test_loss: 0.9636, test_f1: 0.5372
 epoch: 37, train_loss: 0.7916, test_loss: 0.9394, test_f1: 0.5713
 epoch: 38, train_loss: 0.8011, test_loss: 0.9609, test_f1: 0.5869
 epoch: 39, train_loss: 0.7957, test_loss: 1.0650, test_f1: 0.4786
 epoch: 40, train_loss: 0.7867, test_loss: 0.9670, test_f1: 0.5856
 epoch: 41, train_loss: 0.7876, test_loss: 1.1959, test_f1: 0.5291
 epoch: 42, train_loss: 0.7741, test_loss: 0.9465, test_f1: 0.6005
 epoch: 43, train_loss: 0.7787, test_loss: 0.9734, test_f1: 0.5022
 epoch: 44, train_loss: 0.7793, test_loss: 0.9898, test_f1: 0.5414
 epoch: 45, train_loss: 0.8047, test_loss: 0.9431, test_f1: 0.5677
 epoch: 46, train_loss: 0.7635, test_loss: 1.0026, test_f1: 0.5425
 epoch: 47, train_loss: 0.7725, test_loss: 0.9532, test_f1: 0.5486
 epoch: 48, train_loss: 0.7798, test_loss: 0.9662, test_f1: 0.5588
 epoch: 49, train_loss: 0.7741, test_loss: 0.9082, test_f1: 0.5408
 epoch: 50, train_loss: 0.7823, test_loss: 1.0467, test_f1: 0.5308
 epoch: 51, train_loss: 0.7533, test_loss: 0.9036, test_f1: 0.6144
 epoch: 52, train_loss: 0.7287, test_loss: 0.9493, test_f1: 0.6249
 epoch: 53, train_loss: 0.7113, test_loss: 0.9158, test_f1: 0.6169
 epoch: 54, train_loss: 0.7239, test_loss: 0.9333, test_f1: 0.6316
 epoch: 55, train_loss: 0.6954, test_loss: 0.9063, test_f1: 0.6210
 epoch: 56, train_loss: 0.6998, test_loss: 0.9945, test_f1: 0.6123
 epoch: 57, train_loss: 0.6921, test_loss: 0.9461, test_f1: 0.6389
 epoch: 58, train_loss: 0.7215, test_loss: 0.9333, test_f1: 0.6220
 epoch: 59, train_loss: 0.6881, test_loss: 0.9614, test_f1: 0.6052
 epoch: 60, train_loss: 0.6782, test_loss: 0.9264, test_f1: 0.6245
 epoch: 61, train_loss: 0.6959, test_loss: 1.0114, test_f1: 0.6094
 epoch: 62, train_loss: 0.7114, test_loss: 0.9022, test_f1: 0.6503
 epoch: 63, train_loss: 0.6961, test_loss: 0.9413, test_f1: 0.5962
 epoch: 64, train_loss: 0.7054, test_loss: 0.9332, test_f1: 0.6451
 epoch: 65, train_loss: 0.6901, test_loss: 0.9448, test_f1: 0.6381
 epoch: 66, train_loss: 0.6944, test_loss: 0.9643, test_f1: 0.6145
 epoch: 67, train_loss: 0.6661, test_loss: 0.8850, test_f1: 0.6449
 epoch: 68, train_loss: 0.6756, test_loss: 0.9232, test_f1: 0.6164
 epoch: 69, train_loss: 0.6768, test_loss: 0.9224, test_f1: 0.6530
 epoch: 70, train_loss: 0.6826, test_loss: 0.9511, test_f1: 0.6177
 epoch: 71, train_loss: 0.6705, test_loss: 1.0314, test_f1: 0.6377
 epoch: 72, train_loss: 0.6869, test_loss: 0.9786, test_f1: 0.6110
 epoch: 73, train_loss: 0.6880, test_loss: 0.9954, test_f1: 0.6302
 epoch: 74, train_loss: 0.6646, test_loss: 0.9198, test_f1: 0.6259
 epoch: 75, train_loss: 0.6578, test_loss: 0.9786, test_f1: 0.6554
 epoch: 76, train_loss: 0.6706, test_loss: 0.9298, test_f1: 0.6293
 epoch: 77, train_loss: 0.6703, test_loss: 0.9772, test_f1: 0.6243
 epoch: 78, train_loss: 0.6661, test_loss: 1.0852, test_f1: 0.6131
 epoch: 79, train_loss: 0.6558, test_loss: 1.0269, test_f1: 0.6109
 epoch: 80, train_loss: 0.6533, test_loss: 0.9479, test_f1: 0.6507
 epoch: 81, train_loss: 0.6666, test_loss: 0.9542, test_f1: 0.6135
 epoch: 82, train_loss: 0.6466, test_loss: 0.9817, test_f1: 0.6161
 epoch: 83, train_loss: 0.6553, test_loss: 0.9487, test_f1: 0.6427
 epoch: 84, train_loss: 0.6436, test_loss: 0.8790, test_f1: 0.6465
 epoch: 85, train_loss: 0.6351, test_loss: 1.0007, test_f1: 0.6484
 epoch: 86, train_loss: 0.6484, test_loss: 0.9696, test_f1: 0.6291
 epoch: 87, train_loss: 0.6523, test_loss: 0.9954, test_f1: 0.6386
 epoch: 88, train_loss: 0.6194, test_loss: 0.9836, test_f1: 0.6447
 epoch: 89, train_loss: 0.6484, test_loss: 0.9586, test_f1: 0.6363
 epoch: 90, train_loss: 0.6412, test_loss: 0.9061, test_f1: 0.6660
 epoch: 91, train_loss: 0.6506, test_loss: 0.9428, test_f1: 0.6482
 epoch: 92, train_loss: 0.6392, test_loss: 0.9546, test_f1: 0.6359
 epoch: 93, train_loss: 0.6331, test_loss: 0.9961, test_f1: 0.6329
 epoch: 94, train_loss: 0.6259, test_loss: 1.0487, test_f1: 0.5884
 epoch: 95, train_loss: 0.6308, test_loss: 0.9623, test_f1: 0.6576
 epoch: 96, train_loss: 0.6256, test_loss: 0.8942, test_f1: 0.6603
 epoch: 97, train_loss: 0.6328, test_loss: 0.8543, test_f1: 0.6675
 epoch: 98, train_loss: 0.6282, test_loss: 0.8894, test_f1: 0.6471
 epoch: 99, train_loss: 0.6382, test_loss: 0.9404, test_f1: 0.6722
##################ITERATION #3 ****************************************
 epoch: 0, train_loss: 1.1857, test_loss: 1.0436, test_f1: 0.4599
 epoch: 1, train_loss: 1.0242, test_loss: 1.0025, test_f1: 0.4584
 epoch: 2, train_loss: 1.0026, test_loss: 1.0750, test_f1: 0.4511
 epoch: 3, train_loss: 0.9696, test_loss: 0.9840, test_f1: 0.4951
 epoch: 4, train_loss: 0.9560, test_loss: 1.1029, test_f1: 0.4566
 epoch: 5, train_loss: 0.9654, test_loss: 1.0144, test_f1: 0.4816
 epoch: 6, train_loss: 0.9502, test_loss: 1.0083, test_f1: 0.4526
 epoch: 7, train_loss: 0.9277, test_loss: 1.0248, test_f1: 0.4629
 epoch: 8, train_loss: 0.9361, test_loss: 0.9982, test_f1: 0.5133
 epoch: 9, train_loss: 0.9270, test_loss: 0.9684, test_f1: 0.4876
 epoch: 10, train_loss: 0.9066, test_loss: 1.0270, test_f1: 0.5039
 epoch: 11, train_loss: 0.9148, test_loss: 0.8898, test_f1: 0.5034
 epoch: 12, train_loss: 0.8911, test_loss: 1.0022, test_f1: 0.4868
 epoch: 13, train_loss: 0.8967, test_loss: 1.0029, test_f1: 0.4748
 epoch: 14, train_loss: 0.9273, test_loss: 1.0245, test_f1: 0.4791
 epoch: 15, train_loss: 0.9025, test_loss: 1.0143, test_f1: 0.4894
 epoch: 16, train_loss: 0.9461, test_loss: 1.0565, test_f1: 0.5155
 epoch: 17, train_loss: 0.9176, test_loss: 1.0155, test_f1: 0.5171
 epoch: 18, train_loss: 0.8868, test_loss: 0.9532, test_f1: 0.5634
 epoch: 19, train_loss: 0.8772, test_loss: 1.0125, test_f1: 0.5104
 epoch: 20, train_loss: 0.8645, test_loss: 0.9670, test_f1: 0.5147
 epoch: 21, train_loss: 0.8720, test_loss: 0.9553, test_f1: 0.5642
 epoch: 22, train_loss: 0.8721, test_loss: 0.9591, test_f1: 0.5480
 epoch: 23, train_loss: 0.8397, test_loss: 0.9947, test_f1: 0.5189
 epoch: 24, train_loss: 0.8466, test_loss: 0.9434, test_f1: 0.5628
 epoch: 25, train_loss: 0.8397, test_loss: 0.8807, test_f1: 0.5810
 epoch: 26, train_loss: 0.8551, test_loss: 0.9390, test_f1: 0.4985
 epoch: 27, train_loss: 0.8593, test_loss: 0.9687, test_f1: 0.5166
 epoch: 28, train_loss: 0.8429, test_loss: 0.9231, test_f1: 0.5774
 epoch: 29, train_loss: 0.8356, test_loss: 1.0309, test_f1: 0.4888
 epoch: 30, train_loss: 0.8318, test_loss: 1.0245, test_f1: 0.5718
 epoch: 31, train_loss: 0.8296, test_loss: 1.0267, test_f1: 0.5444
 epoch: 32, train_loss: 0.8129, test_loss: 1.0511, test_f1: 0.5454
 epoch: 33, train_loss: 0.8198, test_loss: 1.0328, test_f1: 0.5680
 epoch: 34, train_loss: 0.8153, test_loss: 1.0093, test_f1: 0.5346
 epoch: 35, train_loss: 0.8026, test_loss: 0.9568, test_f1: 0.5532
 epoch: 36, train_loss: 0.7871, test_loss: 1.0186, test_f1: 0.5726
 epoch: 37, train_loss: 0.7947, test_loss: 1.0424, test_f1: 0.5828
 epoch: 38, train_loss: 0.8039, test_loss: 1.1753, test_f1: 0.5431
 epoch: 39, train_loss: 0.8003, test_loss: 1.0207, test_f1: 0.6014
 epoch: 40, train_loss: 0.7809, test_loss: 0.9531, test_f1: 0.5426
 epoch: 41, train_loss: 0.7875, test_loss: 1.0045, test_f1: 0.6118
 epoch: 42, train_loss: 0.7748, test_loss: 1.0839, test_f1: 0.5601
 epoch: 43, train_loss: 0.7671, test_loss: 1.1283, test_f1: 0.6075
 epoch: 44, train_loss: 0.7627, test_loss: 1.0974, test_f1: 0.5369
 epoch: 45, train_loss: 0.7590, test_loss: 1.0721, test_f1: 0.5579
 epoch: 46, train_loss: 0.7582, test_loss: 1.0455, test_f1: 0.5758
 epoch: 47, train_loss: 0.7851, test_loss: 0.9919, test_f1: 0.5807
 epoch: 48, train_loss: 0.7508, test_loss: 1.0547, test_f1: 0.6295
 epoch: 49, train_loss: 0.7449, test_loss: 1.1174, test_f1: 0.6176
 epoch: 50, train_loss: 0.7698, test_loss: 1.0617, test_f1: 0.5913
 epoch: 51, train_loss: 0.7350, test_loss: 1.1167, test_f1: 0.5991
 epoch: 52, train_loss: 0.7173, test_loss: 1.0957, test_f1: 0.6361
 epoch: 53, train_loss: 0.7009, test_loss: 1.1137, test_f1: 0.6515
 epoch: 54, train_loss: 0.6994, test_loss: 1.1327, test_f1: 0.6029
 epoch: 55, train_loss: 0.6947, test_loss: 1.2238, test_f1: 0.5964
 epoch: 56, train_loss: 0.6959, test_loss: 1.1649, test_f1: 0.6319
 epoch: 57, train_loss: 0.6951, test_loss: 1.1745, test_f1: 0.5875
 epoch: 58, train_loss: 0.6908, test_loss: 1.2854, test_f1: 0.6243
 epoch: 59, train_loss: 0.6906, test_loss: 1.1560, test_f1: 0.6495
 epoch: 60, train_loss: 0.6972, test_loss: 1.2024, test_f1: 0.6316
 epoch: 61, train_loss: 0.6945, test_loss: 1.1920, test_f1: 0.6294
 epoch: 62, train_loss: 0.6882, test_loss: 1.1215, test_f1: 0.6459
 epoch: 63, train_loss: 0.6912, test_loss: 1.2479, test_f1: 0.6333
 epoch: 64, train_loss: 0.6708, test_loss: 1.2761, test_f1: 0.6277
 epoch: 65, train_loss: 0.6797, test_loss: 1.2636, test_f1: 0.6031
 epoch: 66, train_loss: 0.6887, test_loss: 1.1898, test_f1: 0.5945
 epoch: 67, train_loss: 0.6841, test_loss: 1.1250, test_f1: 0.6227
 epoch: 68, train_loss: 0.6826, test_loss: 1.3128, test_f1: 0.6225
 epoch: 69, train_loss: 0.6667, test_loss: 1.2994, test_f1: 0.6475
 epoch: 70, train_loss: 0.6676, test_loss: 1.1628, test_f1: 0.6325
 epoch: 71, train_loss: 0.6751, test_loss: 1.2115, test_f1: 0.6215
 epoch: 72, train_loss: 0.6630, test_loss: 1.2340, test_f1: 0.6508
 epoch: 73, train_loss: 0.6674, test_loss: 1.2779, test_f1: 0.6217
 epoch: 74, train_loss: 0.6518, test_loss: 1.4008, test_f1: 0.6204
 epoch: 75, train_loss: 0.6492, test_loss: 1.2648, test_f1: 0.6237
 epoch: 76, train_loss: 0.6624, test_loss: 1.3836, test_f1: 0.5775
 epoch: 77, train_loss: 0.6657, test_loss: 1.2436, test_f1: 0.5985
 epoch: 78, train_loss: 0.6725, test_loss: 1.3703, test_f1: 0.6167
 epoch: 79, train_loss: 0.6469, test_loss: 1.2704, test_f1: 0.6393
 epoch: 80, train_loss: 0.6516, test_loss: 1.2544, test_f1: 0.6474
 epoch: 81, train_loss: 0.6258, test_loss: 1.3261, test_f1: 0.6392
 epoch: 82, train_loss: 0.6440, test_loss: 1.1753, test_f1: 0.6401
 epoch: 83, train_loss: 0.6538, test_loss: 1.2259, test_f1: 0.6318
 epoch: 84, train_loss: 0.6483, test_loss: 1.2495, test_f1: 0.6476
 epoch: 85, train_loss: 0.6494, test_loss: 1.1670, test_f1: 0.6463
 epoch: 86, train_loss: 0.6424, test_loss: 1.2599, test_f1: 0.6424
 epoch: 87, train_loss: 0.6376, test_loss: 1.2339, test_f1: 0.6412
 epoch: 88, train_loss: 0.6110, test_loss: 1.2282, test_f1: 0.6157
 epoch: 89, train_loss: 0.6565, test_loss: 1.1944, test_f1: 0.6288
 epoch: 90, train_loss: 0.6329, test_loss: 1.2297, test_f1: 0.6437
 epoch: 91, train_loss: 0.6295, test_loss: 1.2858, test_f1: 0.6203
 epoch: 92, train_loss: 0.6323, test_loss: 1.1694, test_f1: 0.6382
 epoch: 93, train_loss: 0.6260, test_loss: 1.2547, test_f1: 0.6266
 epoch: 94, train_loss: 0.6151, test_loss: 1.3543, test_f1: 0.6222
 epoch: 95, train_loss: 0.6244, test_loss: 1.3015, test_f1: 0.6212
 epoch: 96, train_loss: 0.6346, test_loss: 1.3400, test_f1: 0.6471
 epoch: 97, train_loss: 0.6297, test_loss: 1.3858, test_f1: 0.6485
 epoch: 98, train_loss: 0.6327, test_loss: 1.3401, test_f1: 0.6325
 epoch: 99, train_loss: 0.6065, test_loss: 1.4270, test_f1: 0.6359
##################ITERATION #4 ****************************************
 epoch: 0, train_loss: 1.1991, test_loss: 1.1425, test_f1: 0.3853
 epoch: 1, train_loss: 1.0637, test_loss: 1.0755, test_f1: 0.4540
 epoch: 2, train_loss: 0.9959, test_loss: 1.0748, test_f1: 0.4663
 epoch: 3, train_loss: 0.9922, test_loss: 1.0254, test_f1: 0.5041
 epoch: 4, train_loss: 0.9705, test_loss: 1.0401, test_f1: 0.4591
 epoch: 5, train_loss: 0.9750, test_loss: 1.0035, test_f1: 0.4794
 epoch: 6, train_loss: 0.9493, test_loss: 1.0159, test_f1: 0.5071
 epoch: 7, train_loss: 0.9314, test_loss: 1.0359, test_f1: 0.5488
 epoch: 8, train_loss: 0.9274, test_loss: 1.0021, test_f1: 0.4831
 epoch: 9, train_loss: 0.9376, test_loss: 1.0496, test_f1: 0.4907
 epoch: 10, train_loss: 0.9288, test_loss: 1.0371, test_f1: 0.4892
 epoch: 11, train_loss: 0.9148, test_loss: 1.1349, test_f1: 0.4453
 epoch: 12, train_loss: 0.9243, test_loss: 1.1755, test_f1: 0.4407
 epoch: 13, train_loss: 0.9095, test_loss: 0.8890, test_f1: 0.5264
 epoch: 14, train_loss: 0.8988, test_loss: 0.9827, test_f1: 0.5286
 epoch: 15, train_loss: 0.9125, test_loss: 1.0792, test_f1: 0.4847
 epoch: 16, train_loss: 0.8886, test_loss: 1.0110, test_f1: 0.5028
 epoch: 17, train_loss: 0.8878, test_loss: 0.9659, test_f1: 0.5195
 epoch: 18, train_loss: 0.8788, test_loss: 1.0028, test_f1: 0.5313
 epoch: 19, train_loss: 0.8860, test_loss: 0.8574, test_f1: 0.5709
 epoch: 20, train_loss: 0.8765, test_loss: 0.9618, test_f1: 0.5215
 epoch: 21, train_loss: 0.8730, test_loss: 0.8895, test_f1: 0.4977
 epoch: 22, train_loss: 0.8721, test_loss: 0.9651, test_f1: 0.5629
 epoch: 23, train_loss: 0.8691, test_loss: 1.0097, test_f1: 0.5505
 epoch: 24, train_loss: 0.8472, test_loss: 0.9894, test_f1: 0.5389
 epoch: 25, train_loss: 0.8710, test_loss: 0.9779, test_f1: 0.5333
 epoch: 26, train_loss: 0.8676, test_loss: 0.9675, test_f1: 0.5529
 epoch: 27, train_loss: 0.8536, test_loss: 0.9614, test_f1: 0.5533
 epoch: 28, train_loss: 0.8531, test_loss: 0.9925, test_f1: 0.5124
 epoch: 29, train_loss: 0.8445, test_loss: 0.9806, test_f1: 0.5483
 epoch: 30, train_loss: 0.8465, test_loss: 0.9895, test_f1: 0.5544
 epoch: 31, train_loss: 0.8402, test_loss: 1.0301, test_f1: 0.5983
 epoch: 32, train_loss: 0.8190, test_loss: 1.1079, test_f1: 0.5390
 epoch: 33, train_loss: 0.8211, test_loss: 1.0261, test_f1: 0.5578
 epoch: 34, train_loss: 0.8087, test_loss: 0.9831, test_f1: 0.5766
 epoch: 35, train_loss: 0.8138, test_loss: 0.9786, test_f1: 0.5801
 epoch: 36, train_loss: 0.8024, test_loss: 0.9505, test_f1: 0.5726
 epoch: 37, train_loss: 0.8012, test_loss: 1.0280, test_f1: 0.5940
 epoch: 38, train_loss: 0.8013, test_loss: 0.9640, test_f1: 0.5891
 epoch: 39, train_loss: 0.8135, test_loss: 0.9789, test_f1: 0.6024
 epoch: 40, train_loss: 0.8095, test_loss: 0.9330, test_f1: 0.5993
 epoch: 41, train_loss: 0.7957, test_loss: 1.0652, test_f1: 0.5285
 epoch: 42, train_loss: 0.8048, test_loss: 1.0232, test_f1: 0.6002
 epoch: 43, train_loss: 0.7995, test_loss: 0.9912, test_f1: 0.5554
 epoch: 44, train_loss: 0.7844, test_loss: 1.0293, test_f1: 0.5946
 epoch: 45, train_loss: 0.7881, test_loss: 1.0433, test_f1: 0.5851
 epoch: 46, train_loss: 0.7679, test_loss: 1.0355, test_f1: 0.5718
 epoch: 47, train_loss: 0.7672, test_loss: 1.0670, test_f1: 0.5416
 epoch: 48, train_loss: 0.7790, test_loss: 1.0194, test_f1: 0.5693
 epoch: 49, train_loss: 0.7750, test_loss: 1.0607, test_f1: 0.5575
 epoch: 50, train_loss: 0.8129, test_loss: 1.0751, test_f1: 0.5597
 epoch: 51, train_loss: 0.7495, test_loss: 1.0531, test_f1: 0.5947
 epoch: 52, train_loss: 0.7390, test_loss: 1.0430, test_f1: 0.5875
 epoch: 53, train_loss: 0.7210, test_loss: 1.0972, test_f1: 0.5884
 epoch: 54, train_loss: 0.7414, test_loss: 1.0977, test_f1: 0.6114
 epoch: 55, train_loss: 0.7145, test_loss: 1.0609, test_f1: 0.5902
 epoch: 56, train_loss: 0.7296, test_loss: 1.1589, test_f1: 0.5529
 epoch: 57, train_loss: 0.7273, test_loss: 1.1257, test_f1: 0.5984
 epoch: 58, train_loss: 0.7379, test_loss: 1.0912, test_f1: 0.5973
 epoch: 59, train_loss: 0.7236, test_loss: 1.0903, test_f1: 0.5922
 epoch: 60, train_loss: 0.7165, test_loss: 1.0478, test_f1: 0.5886
 epoch: 61, train_loss: 0.7195, test_loss: 1.0652, test_f1: 0.6214
 epoch: 62, train_loss: 0.7181, test_loss: 1.0960, test_f1: 0.5969
 epoch: 63, train_loss: 0.7032, test_loss: 1.1667, test_f1: 0.6260
 epoch: 64, train_loss: 0.7085, test_loss: 1.1652, test_f1: 0.5853
 epoch: 65, train_loss: 0.7079, test_loss: 1.1196, test_f1: 0.6105
 epoch: 66, train_loss: 0.7054, test_loss: 1.1767, test_f1: 0.6161
 epoch: 67, train_loss: 0.6955, test_loss: 1.2114, test_f1: 0.6512
 epoch: 68, train_loss: 0.6912, test_loss: 1.2393, test_f1: 0.6070
 epoch: 69, train_loss: 0.6967, test_loss: 1.1014, test_f1: 0.6440
 epoch: 70, train_loss: 0.6888, test_loss: 1.2242, test_f1: 0.6130
 epoch: 71, train_loss: 0.7065, test_loss: 1.1157, test_f1: 0.6438
 epoch: 72, train_loss: 0.6933, test_loss: 1.1140, test_f1: 0.6121
 epoch: 73, train_loss: 0.6895, test_loss: 1.1601, test_f1: 0.6531
 epoch: 74, train_loss: 0.6962, test_loss: 1.1563, test_f1: 0.6092
 epoch: 75, train_loss: 0.6954, test_loss: 1.2303, test_f1: 0.6195
 epoch: 76, train_loss: 0.6907, test_loss: 1.2589, test_f1: 0.6052
 epoch: 77, train_loss: 0.6683, test_loss: 1.1961, test_f1: 0.5630
 epoch: 78, train_loss: 0.6853, test_loss: 1.1543, test_f1: 0.6246
 epoch: 79, train_loss: 0.6867, test_loss: 1.2639, test_f1: 0.5998
 epoch: 80, train_loss: 0.6895, test_loss: 1.1571, test_f1: 0.6281
 epoch: 81, train_loss: 0.6907, test_loss: 1.2090, test_f1: 0.6130
 epoch: 82, train_loss: 0.6795, test_loss: 1.1675, test_f1: 0.6142
 epoch: 83, train_loss: 0.6713, test_loss: 1.2748, test_f1: 0.6350
 epoch: 84, train_loss: 0.6726, test_loss: 1.1982, test_f1: 0.6251
 epoch: 85, train_loss: 0.6632, test_loss: 1.1534, test_f1: 0.5702
 epoch: 86, train_loss: 0.6778, test_loss: 1.2569, test_f1: 0.6359
 epoch: 87, train_loss: 0.6785, test_loss: 1.1830, test_f1: 0.6114
 epoch: 88, train_loss: 0.6797, test_loss: 1.1813, test_f1: 0.6137
 epoch: 89, train_loss: 0.6733, test_loss: 1.1776, test_f1: 0.6218
 epoch: 90, train_loss: 0.6609, test_loss: 1.1550, test_f1: 0.6440
 epoch: 91, train_loss: 0.6719, test_loss: 1.2482, test_f1: 0.6322
 epoch: 92, train_loss: 0.6641, test_loss: 1.1828, test_f1: 0.5980
 epoch: 93, train_loss: 0.6580, test_loss: 1.1017, test_f1: 0.5953
 epoch: 94, train_loss: 0.6630, test_loss: 1.1310, test_f1: 0.6368
 epoch: 95, train_loss: 0.6462, test_loss: 1.2102, test_f1: 0.6360
 epoch: 96, train_loss: 0.6407, test_loss: 1.2526, test_f1: 0.6500
 epoch: 97, train_loss: 0.6434, test_loss: 1.1745, test_f1: 0.6575
 epoch: 98, train_loss: 0.6614, test_loss: 1.2074, test_f1: 0.6233
 epoch: 99, train_loss: 0.6577, test_loss: 1.1605, test_f1: 0.6145
##################ITERATION #5 ****************************************
 epoch: 0, train_loss: 1.2134, test_loss: 1.0844, test_f1: 0.4849
 epoch: 1, train_loss: 1.0352, test_loss: 1.1139, test_f1: 0.4062
 epoch: 2, train_loss: 1.0121, test_loss: 1.0466, test_f1: 0.4237
 epoch: 3, train_loss: 0.9963, test_loss: 0.9947, test_f1: 0.4754
 epoch: 4, train_loss: 0.9809, test_loss: 0.9882, test_f1: 0.4717
 epoch: 5, train_loss: 0.9642, test_loss: 1.0304, test_f1: 0.4911
 epoch: 6, train_loss: 0.9605, test_loss: 0.9586, test_f1: 0.4557
 epoch: 7, train_loss: 0.9511, test_loss: 0.9685, test_f1: 0.4837
 epoch: 8, train_loss: 0.9527, test_loss: 1.0413, test_f1: 0.5140
 epoch: 9, train_loss: 0.9433, test_loss: 1.0104, test_f1: 0.4907
 epoch: 10, train_loss: 0.9212, test_loss: 0.8980, test_f1: 0.5594
 epoch: 11, train_loss: 0.9145, test_loss: 1.0094, test_f1: 0.5185
 epoch: 12, train_loss: 0.8994, test_loss: 0.9338, test_f1: 0.5104
 epoch: 13, train_loss: 0.9013, test_loss: 0.9531, test_f1: 0.4987
 epoch: 14, train_loss: 0.9019, test_loss: 0.9146, test_f1: 0.5165
 epoch: 15, train_loss: 0.8941, test_loss: 0.9743, test_f1: 0.4956
 epoch: 16, train_loss: 0.8785, test_loss: 0.9853, test_f1: 0.5136
 epoch: 17, train_loss: 0.8851, test_loss: 0.9123, test_f1: 0.5262
 epoch: 18, train_loss: 0.8651, test_loss: 1.0987, test_f1: 0.5494
 epoch: 19, train_loss: 0.8604, test_loss: 0.9236, test_f1: 0.5556
 epoch: 20, train_loss: 0.8525, test_loss: 1.1352, test_f1: 0.5652
 epoch: 21, train_loss: 0.8584, test_loss: 0.9998, test_f1: 0.5024
 epoch: 22, train_loss: 0.8508, test_loss: 1.0112, test_f1: 0.5545
 epoch: 23, train_loss: 0.8353, test_loss: 1.0390, test_f1: 0.5810
 epoch: 24, train_loss: 0.8430, test_loss: 1.0007, test_f1: 0.5061
 epoch: 25, train_loss: 0.8395, test_loss: 1.0298, test_f1: 0.5022
 epoch: 26, train_loss: 0.8203, test_loss: 1.1454, test_f1: 0.5441
 epoch: 27, train_loss: 0.8315, test_loss: 1.1414, test_f1: 0.5121
 epoch: 28, train_loss: 0.8199, test_loss: 1.0542, test_f1: 0.5888
 epoch: 29, train_loss: 0.8211, test_loss: 1.0220, test_f1: 0.5976
 epoch: 30, train_loss: 0.8189, test_loss: 1.0767, test_f1: 0.5285
 epoch: 31, train_loss: 0.7953, test_loss: 1.1495, test_f1: 0.5797
 epoch: 32, train_loss: 0.8119, test_loss: 1.0970, test_f1: 0.5674
 epoch: 33, train_loss: 0.7968, test_loss: 1.0962, test_f1: 0.5162
 epoch: 34, train_loss: 0.7876, test_loss: 1.0549, test_f1: 0.6073
 epoch: 35, train_loss: 0.7853, test_loss: 1.0218, test_f1: 0.5868
 epoch: 36, train_loss: 0.7834, test_loss: 1.1005, test_f1: 0.5355
 epoch: 37, train_loss: 0.7806, test_loss: 1.0447, test_f1: 0.5723
 epoch: 38, train_loss: 0.7734, test_loss: 1.0787, test_f1: 0.5550
 epoch: 39, train_loss: 0.7681, test_loss: 1.0636, test_f1: 0.6134
 epoch: 40, train_loss: 0.7822, test_loss: 1.1669, test_f1: 0.5628
 epoch: 41, train_loss: 0.7732, test_loss: 1.0562, test_f1: 0.5256
 epoch: 42, train_loss: 0.7942, test_loss: 1.0416, test_f1: 0.5352
 epoch: 43, train_loss: 0.7705, test_loss: 0.8427, test_f1: 0.6207
 epoch: 44, train_loss: 0.7629, test_loss: 1.0054, test_f1: 0.5338
 epoch: 45, train_loss: 0.7499, test_loss: 1.1042, test_f1: 0.5520
 epoch: 46, train_loss: 0.7492, test_loss: 1.1838, test_f1: 0.6196
 epoch: 47, train_loss: 0.7314, test_loss: 1.0666, test_f1: 0.6249
 epoch: 48, train_loss: 0.7617, test_loss: 1.2031, test_f1: 0.5936
 epoch: 49, train_loss: 0.7390, test_loss: 1.2053, test_f1: 0.5492
 epoch: 50, train_loss: 0.7443, test_loss: 1.0414, test_f1: 0.5654
 epoch: 51, train_loss: 0.7136, test_loss: 1.0461, test_f1: 0.6309
 epoch: 52, train_loss: 0.7108, test_loss: 1.0426, test_f1: 0.6110
 epoch: 53, train_loss: 0.6931, test_loss: 1.0033, test_f1: 0.6183
 epoch: 54, train_loss: 0.6865, test_loss: 1.0155, test_f1: 0.6074
 epoch: 55, train_loss: 0.7070, test_loss: 1.0285, test_f1: 0.6571
 epoch: 56, train_loss: 0.6879, test_loss: 1.1364, test_f1: 0.5796
 epoch: 57, train_loss: 0.6861, test_loss: 1.0783, test_f1: 0.6477
 epoch: 58, train_loss: 0.6847, test_loss: 1.2179, test_f1: 0.5875
 epoch: 59, train_loss: 0.6854, test_loss: 1.0218, test_f1: 0.6340
 epoch: 60, train_loss: 0.6794, test_loss: 1.1035, test_f1: 0.6206
 epoch: 61, train_loss: 0.6745, test_loss: 1.1564, test_f1: 0.5801
 epoch: 62, train_loss: 0.6682, test_loss: 1.1589, test_f1: 0.6125
 epoch: 63, train_loss: 0.6716, test_loss: 1.1884, test_f1: 0.6234
 epoch: 64, train_loss: 0.6590, test_loss: 1.3075, test_f1: 0.5678
 epoch: 65, train_loss: 0.6755, test_loss: 1.1589, test_f1: 0.6378
 epoch: 66, train_loss: 0.6666, test_loss: 1.2206, test_f1: 0.6088
 epoch: 67, train_loss: 0.6750, test_loss: 1.2090, test_f1: 0.6030
 epoch: 68, train_loss: 0.6609, test_loss: 1.2357, test_f1: 0.5874
 epoch: 69, train_loss: 0.6554, test_loss: 1.2512, test_f1: 0.5979
 epoch: 70, train_loss: 0.6469, test_loss: 1.2811, test_f1: 0.6025
 epoch: 71, train_loss: 0.6596, test_loss: 1.2494, test_f1: 0.6033
 epoch: 72, train_loss: 0.6594, test_loss: 1.2449, test_f1: 0.6161
 epoch: 73, train_loss: 0.6525, test_loss: 1.2246, test_f1: 0.5783
 epoch: 74, train_loss: 0.6486, test_loss: 1.3283, test_f1: 0.6235
 epoch: 75, train_loss: 0.6445, test_loss: 1.2826, test_f1: 0.6320
 epoch: 76, train_loss: 0.6468, test_loss: 1.3099, test_f1: 0.5885
 epoch: 77, train_loss: 0.6520, test_loss: 1.3351, test_f1: 0.6106
 epoch: 78, train_loss: 0.6549, test_loss: 1.1896, test_f1: 0.6261
 epoch: 79, train_loss: 0.6478, test_loss: 1.2185, test_f1: 0.6287
 epoch: 80, train_loss: 0.6433, test_loss: 1.1997, test_f1: 0.5879
 epoch: 81, train_loss: 0.6496, test_loss: 1.2267, test_f1: 0.5888
 epoch: 82, train_loss: 0.6516, test_loss: 1.2878, test_f1: 0.5833
 epoch: 83, train_loss: 0.6386, test_loss: 1.3704, test_f1: 0.6095
 epoch: 84, train_loss: 0.6332, test_loss: 1.2920, test_f1: 0.5993
 epoch: 85, train_loss: 0.6173, test_loss: 1.2289, test_f1: 0.6010
 epoch: 86, train_loss: 0.6179, test_loss: 1.2308, test_f1: 0.6324
 epoch: 87, train_loss: 0.6274, test_loss: 1.3418, test_f1: 0.6272
 epoch: 88, train_loss: 0.6337, test_loss: 1.2509, test_f1: 0.6347
 epoch: 89, train_loss: 0.6319, test_loss: 1.3801, test_f1: 0.6101
 epoch: 90, train_loss: 0.6578, test_loss: 1.2880, test_f1: 0.6208
 epoch: 91, train_loss: 0.6051, test_loss: 1.3654, test_f1: 0.5939
 epoch: 92, train_loss: 0.6295, test_loss: 1.3431, test_f1: 0.6241
 epoch: 93, train_loss: 0.6514, test_loss: 1.3168, test_f1: 0.6353
 epoch: 94, train_loss: 0.6297, test_loss: 1.2280, test_f1: 0.6221
 epoch: 95, train_loss: 0.6180, test_loss: 1.4428, test_f1: 0.6087
 epoch: 96, train_loss: 0.6345, test_loss: 1.5178, test_f1: 0.5419
 epoch: 97, train_loss: 0.6080, test_loss: 1.4403, test_f1: 0.6135
 epoch: 98, train_loss: 0.6244, test_loss: 1.4900, test_f1: 0.6028
 epoch: 99, train_loss: 0.6151, test_loss: 1.3306, test_f1: 0.6227
##################ITERATION #6 ****************************************
 epoch: 0, train_loss: 1.1929, test_loss: 1.1122, test_f1: 0.4504
 epoch: 1, train_loss: 1.0259, test_loss: 1.0466, test_f1: 0.4549
 epoch: 2, train_loss: 0.9703, test_loss: 0.9788, test_f1: 0.4863
 epoch: 3, train_loss: 0.9583, test_loss: 0.9823, test_f1: 0.4841
 epoch: 4, train_loss: 0.9558, test_loss: 1.0133, test_f1: 0.4987
 epoch: 5, train_loss: 0.9544, test_loss: 1.0126, test_f1: 0.5210
 epoch: 6, train_loss: 0.9220, test_loss: 0.9449, test_f1: 0.5055
 epoch: 7, train_loss: 0.9050, test_loss: 0.9725, test_f1: 0.5025
 epoch: 8, train_loss: 0.9349, test_loss: 0.9814, test_f1: 0.5313
 epoch: 9, train_loss: 0.9020, test_loss: 0.9928, test_f1: 0.5056
 epoch: 10, train_loss: 0.9019, test_loss: 0.9564, test_f1: 0.5710
 epoch: 11, train_loss: 0.8897, test_loss: 0.9722, test_f1: 0.4827
 epoch: 12, train_loss: 0.8853, test_loss: 0.9702, test_f1: 0.5188
 epoch: 13, train_loss: 0.8750, test_loss: 0.8965, test_f1: 0.4976
 epoch: 14, train_loss: 0.8714, test_loss: 0.8900, test_f1: 0.4908
 epoch: 15, train_loss: 0.8530, test_loss: 0.9571, test_f1: 0.5489
 epoch: 16, train_loss: 0.8811, test_loss: 0.9942, test_f1: 0.5181
 epoch: 17, train_loss: 0.8681, test_loss: 0.8921, test_f1: 0.5310
 epoch: 18, train_loss: 0.8481, test_loss: 0.9365, test_f1: 0.5362
 epoch: 19, train_loss: 0.8649, test_loss: 0.9718, test_f1: 0.5511
 epoch: 20, train_loss: 0.8391, test_loss: 0.9528, test_f1: 0.5505
 epoch: 21, train_loss: 0.8483, test_loss: 0.9344, test_f1: 0.4996
 epoch: 22, train_loss: 0.8472, test_loss: 0.9405, test_f1: 0.5502
 epoch: 23, train_loss: 0.8173, test_loss: 0.9103, test_f1: 0.5691
 epoch: 24, train_loss: 0.8333, test_loss: 0.9183, test_f1: 0.5665
 epoch: 25, train_loss: 0.8231, test_loss: 0.9633, test_f1: 0.6154
 epoch: 26, train_loss: 0.8108, test_loss: 0.9524, test_f1: 0.4913
 epoch: 27, train_loss: 0.8334, test_loss: 0.9508, test_f1: 0.5287
 epoch: 28, train_loss: 0.8142, test_loss: 1.1681, test_f1: 0.4865
 epoch: 29, train_loss: 0.8101, test_loss: 0.9367, test_f1: 0.5534
 epoch: 30, train_loss: 0.7952, test_loss: 0.9939, test_f1: 0.4794
 epoch: 31, train_loss: 0.8130, test_loss: 0.9691, test_f1: 0.5758
 epoch: 32, train_loss: 0.8079, test_loss: 0.8513, test_f1: 0.5816
 epoch: 33, train_loss: 0.7938, test_loss: 0.8589, test_f1: 0.5909
 epoch: 34, train_loss: 0.7836, test_loss: 0.8981, test_f1: 0.5773
 epoch: 35, train_loss: 0.7937, test_loss: 0.9246, test_f1: 0.5722
 epoch: 36, train_loss: 0.7958, test_loss: 0.9574, test_f1: 0.5342
 epoch: 37, train_loss: 0.7799, test_loss: 0.9518, test_f1: 0.5803
 epoch: 38, train_loss: 0.7780, test_loss: 0.9219, test_f1: 0.5812
 epoch: 39, train_loss: 0.7842, test_loss: 0.9350, test_f1: 0.6059
 epoch: 40, train_loss: 0.7948, test_loss: 0.9068, test_f1: 0.6125
 epoch: 41, train_loss: 0.7834, test_loss: 0.8957, test_f1: 0.5520
 epoch: 42, train_loss: 0.8073, test_loss: 0.8712, test_f1: 0.5732
 epoch: 43, train_loss: 0.7894, test_loss: 0.9533, test_f1: 0.6156
 epoch: 44, train_loss: 0.7666, test_loss: 0.9118, test_f1: 0.5842
 epoch: 45, train_loss: 0.7652, test_loss: 0.9308, test_f1: 0.5722
 epoch: 46, train_loss: 0.7685, test_loss: 0.9293, test_f1: 0.5898
 epoch: 47, train_loss: 0.7591, test_loss: 0.9071, test_f1: 0.6239
 epoch: 48, train_loss: 0.7615, test_loss: 0.9207, test_f1: 0.5989
 epoch: 49, train_loss: 0.7514, test_loss: 0.9308, test_f1: 0.6077
 epoch: 50, train_loss: 0.7592, test_loss: 0.8767, test_f1: 0.5881
 epoch: 51, train_loss: 0.7275, test_loss: 0.8937, test_f1: 0.6508
 epoch: 52, train_loss: 0.7150, test_loss: 0.8944, test_f1: 0.6030
 epoch: 53, train_loss: 0.7310, test_loss: 0.9041, test_f1: 0.5954
 epoch: 54, train_loss: 0.7115, test_loss: 0.8813, test_f1: 0.6029
 epoch: 55, train_loss: 0.7097, test_loss: 0.9183, test_f1: 0.6171
 epoch: 56, train_loss: 0.7040, test_loss: 0.8735, test_f1: 0.6476
 epoch: 57, train_loss: 0.6947, test_loss: 0.8801, test_f1: 0.6290
 epoch: 58, train_loss: 0.7014, test_loss: 0.8864, test_f1: 0.6167
 epoch: 59, train_loss: 0.6979, test_loss: 0.9050, test_f1: 0.5978
 epoch: 60, train_loss: 0.6984, test_loss: 0.9064, test_f1: 0.6069
 epoch: 61, train_loss: 0.6863, test_loss: 0.8693, test_f1: 0.6315
 epoch: 62, train_loss: 0.7026, test_loss: 0.8921, test_f1: 0.6367
 epoch: 63, train_loss: 0.6936, test_loss: 0.9116, test_f1: 0.6515
 epoch: 64, train_loss: 0.6829, test_loss: 0.8898, test_f1: 0.6249
 epoch: 65, train_loss: 0.6843, test_loss: 0.9187, test_f1: 0.6186
 epoch: 66, train_loss: 0.6762, test_loss: 0.8784, test_f1: 0.6072
 epoch: 67, train_loss: 0.6580, test_loss: 0.8997, test_f1: 0.6352
 epoch: 68, train_loss: 0.6645, test_loss: 0.8903, test_f1: 0.6302
 epoch: 69, train_loss: 0.6695, test_loss: 0.9310, test_f1: 0.6131
 epoch: 70, train_loss: 0.6625, test_loss: 0.8963, test_f1: 0.6092
 epoch: 71, train_loss: 0.6746, test_loss: 0.9231, test_f1: 0.6422
 epoch: 72, train_loss: 0.6680, test_loss: 0.9205, test_f1: 0.5776
 epoch: 73, train_loss: 0.6687, test_loss: 0.9026, test_f1: 0.6358
 epoch: 74, train_loss: 0.6689, test_loss: 0.9002, test_f1: 0.6286
 epoch: 75, train_loss: 0.6644, test_loss: 0.8774, test_f1: 0.6123
 epoch: 76, train_loss: 0.6655, test_loss: 0.9455, test_f1: 0.6353
 epoch: 77, train_loss: 0.6460, test_loss: 0.9277, test_f1: 0.6035
 epoch: 78, train_loss: 0.6656, test_loss: 0.8873, test_f1: 0.6371
 epoch: 79, train_loss: 0.6616, test_loss: 0.9202, test_f1: 0.5934
 epoch: 80, train_loss: 0.6430, test_loss: 0.9187, test_f1: 0.6284
 epoch: 81, train_loss: 0.6631, test_loss: 0.9044, test_f1: 0.6507
 epoch: 82, train_loss: 0.6318, test_loss: 0.9325, test_f1: 0.6080
 epoch: 83, train_loss: 0.6471, test_loss: 0.8785, test_f1: 0.6504
 epoch: 84, train_loss: 0.6433, test_loss: 0.9127, test_f1: 0.6399
 epoch: 85, train_loss: 0.6542, test_loss: 0.8847, test_f1: 0.6101
 epoch: 86, train_loss: 0.6440, test_loss: 0.9426, test_f1: 0.6187
 epoch: 87, train_loss: 0.6590, test_loss: 0.9475, test_f1: 0.6181
 epoch: 88, train_loss: 0.6407, test_loss: 0.8589, test_f1: 0.6295
 epoch: 89, train_loss: 0.6328, test_loss: 0.8995, test_f1: 0.6333
 epoch: 90, train_loss: 0.6370, test_loss: 0.8989, test_f1: 0.6490
 epoch: 91, train_loss: 0.6284, test_loss: 0.8888, test_f1: 0.6426
 epoch: 92, train_loss: 0.6178, test_loss: 0.8891, test_f1: 0.6485
 epoch: 93, train_loss: 0.6356, test_loss: 0.9226, test_f1: 0.6501
 epoch: 94, train_loss: 0.6251, test_loss: 0.8775, test_f1: 0.6688
 epoch: 95, train_loss: 0.6220, test_loss: 0.9088, test_f1: 0.6508
 epoch: 96, train_loss: 0.6183, test_loss: 0.9536, test_f1: 0.6236
 epoch: 97, train_loss: 0.6206, test_loss: 0.8891, test_f1: 0.6394
 epoch: 98, train_loss: 0.6255, test_loss: 0.8431, test_f1: 0.6554
 epoch: 99, train_loss: 0.6246, test_loss: 0.8633, test_f1: 0.6465
##################ITERATION #7 ****************************************
 epoch: 0, train_loss: 1.1710, test_loss: 1.0900, test_f1: 0.4459
 epoch: 1, train_loss: 1.0116, test_loss: 1.0430, test_f1: 0.4720
 epoch: 2, train_loss: 0.9801, test_loss: 1.0441, test_f1: 0.5332
 epoch: 3, train_loss: 0.9454, test_loss: 1.1712, test_f1: 0.4167
 epoch: 4, train_loss: 0.9468, test_loss: 1.0313, test_f1: 0.5093
 epoch: 5, train_loss: 0.9317, test_loss: 0.9148, test_f1: 0.5449
 epoch: 6, train_loss: 0.9383, test_loss: 1.0230, test_f1: 0.4780
 epoch: 7, train_loss: 0.9227, test_loss: 1.0539, test_f1: 0.5095
 epoch: 8, train_loss: 0.9164, test_loss: 0.9893, test_f1: 0.4863
 epoch: 9, train_loss: 0.9081, test_loss: 1.0434, test_f1: 0.5153
 epoch: 10, train_loss: 0.8945, test_loss: 0.9941, test_f1: 0.5487
 epoch: 11, train_loss: 0.8992, test_loss: 0.9565, test_f1: 0.5173
 epoch: 12, train_loss: 0.8696, test_loss: 0.9515, test_f1: 0.5472
 epoch: 13, train_loss: 0.8876, test_loss: 0.9056, test_f1: 0.5347
 epoch: 14, train_loss: 0.8921, test_loss: 1.0283, test_f1: 0.5273
 epoch: 15, train_loss: 0.8787, test_loss: 0.9788, test_f1: 0.5204
 epoch: 16, train_loss: 0.8653, test_loss: 1.0062, test_f1: 0.5233
 epoch: 17, train_loss: 0.8655, test_loss: 1.0524, test_f1: 0.5075
 epoch: 18, train_loss: 0.8655, test_loss: 1.0319, test_f1: 0.4982
 epoch: 19, train_loss: 0.8533, test_loss: 0.9619, test_f1: 0.5504
 epoch: 20, train_loss: 0.8452, test_loss: 0.9751, test_f1: 0.5182
 epoch: 21, train_loss: 0.8524, test_loss: 0.9765, test_f1: 0.5198
 epoch: 22, train_loss: 0.8370, test_loss: 0.9848, test_f1: 0.5404
 epoch: 23, train_loss: 0.8217, test_loss: 0.9546, test_f1: 0.5630
 epoch: 24, train_loss: 0.8429, test_loss: 0.9604, test_f1: 0.5266
 epoch: 25, train_loss: 0.8421, test_loss: 0.9290, test_f1: 0.5608
 epoch: 26, train_loss: 0.8430, test_loss: 1.1399, test_f1: 0.4846
 epoch: 27, train_loss: 0.8227, test_loss: 0.9279, test_f1: 0.5258
 epoch: 28, train_loss: 0.8046, test_loss: 0.9233, test_f1: 0.5541
 epoch: 29, train_loss: 0.7994, test_loss: 0.9615, test_f1: 0.5820
 epoch: 30, train_loss: 0.8069, test_loss: 0.9170, test_f1: 0.5637
 epoch: 31, train_loss: 0.7920, test_loss: 0.8880, test_f1: 0.5795
 epoch: 32, train_loss: 0.8026, test_loss: 1.0371, test_f1: 0.5580
 epoch: 33, train_loss: 0.7933, test_loss: 0.9543, test_f1: 0.5112
 epoch: 34, train_loss: 0.7827, test_loss: 0.9662, test_f1: 0.6040
 epoch: 35, train_loss: 0.7954, test_loss: 0.9203, test_f1: 0.5721
 epoch: 36, train_loss: 0.7848, test_loss: 0.8965, test_f1: 0.6005
 epoch: 37, train_loss: 0.7984, test_loss: 0.9378, test_f1: 0.5570
 epoch: 38, train_loss: 0.7886, test_loss: 0.9253, test_f1: 0.6102
 epoch: 39, train_loss: 0.7827, test_loss: 0.9388, test_f1: 0.5883
 epoch: 40, train_loss: 0.7707, test_loss: 0.9749, test_f1: 0.5958
 epoch: 41, train_loss: 0.7724, test_loss: 0.8739, test_f1: 0.6215
 epoch: 42, train_loss: 0.7618, test_loss: 0.8909, test_f1: 0.6029
 epoch: 43, train_loss: 0.7639, test_loss: 0.9071, test_f1: 0.5824
 epoch: 44, train_loss: 0.7505, test_loss: 0.9287, test_f1: 0.5966
 epoch: 45, train_loss: 0.7646, test_loss: 1.0096, test_f1: 0.6262
 epoch: 46, train_loss: 0.7558, test_loss: 0.8830, test_f1: 0.6306
 epoch: 47, train_loss: 0.7565, test_loss: 0.9067, test_f1: 0.5954
 epoch: 48, train_loss: 0.7583, test_loss: 0.8785, test_f1: 0.5933
 epoch: 49, train_loss: 0.7421, test_loss: 0.9683, test_f1: 0.6148
 epoch: 50, train_loss: 0.7502, test_loss: 0.9456, test_f1: 0.6077
 epoch: 51, train_loss: 0.7454, test_loss: 0.8938, test_f1: 0.6079
 epoch: 52, train_loss: 0.7079, test_loss: 0.9443, test_f1: 0.6268
 epoch: 53, train_loss: 0.7087, test_loss: 0.9686, test_f1: 0.6041
 epoch: 54, train_loss: 0.6932, test_loss: 1.0196, test_f1: 0.6416
 epoch: 55, train_loss: 0.6969, test_loss: 0.9459, test_f1: 0.6316
 epoch: 56, train_loss: 0.7017, test_loss: 0.9658, test_f1: 0.5999
 epoch: 57, train_loss: 0.6904, test_loss: 0.9795, test_f1: 0.6295
 epoch: 58, train_loss: 0.6950, test_loss: 0.9560, test_f1: 0.6433
 epoch: 59, train_loss: 0.6869, test_loss: 0.9230, test_f1: 0.6509
 epoch: 60, train_loss: 0.6828, test_loss: 1.0554, test_f1: 0.6296
 epoch: 61, train_loss: 0.6973, test_loss: 0.9815, test_f1: 0.6150
 epoch: 62, train_loss: 0.6779, test_loss: 1.0264, test_f1: 0.6204
 epoch: 63, train_loss: 0.6843, test_loss: 0.9989, test_f1: 0.6272
 epoch: 64, train_loss: 0.6837, test_loss: 0.9791, test_f1: 0.6456
 epoch: 65, train_loss: 0.6943, test_loss: 1.0117, test_f1: 0.5845
 epoch: 66, train_loss: 0.7005, test_loss: 0.9951, test_f1: 0.6309
 epoch: 67, train_loss: 0.6689, test_loss: 0.9918, test_f1: 0.6549
 epoch: 68, train_loss: 0.6668, test_loss: 1.0201, test_f1: 0.6295
 epoch: 69, train_loss: 0.6759, test_loss: 1.0258, test_f1: 0.6518
 epoch: 70, train_loss: 0.6757, test_loss: 1.0480, test_f1: 0.6489
 epoch: 71, train_loss: 0.6751, test_loss: 1.1193, test_f1: 0.6273
 epoch: 72, train_loss: 0.6679, test_loss: 1.1758, test_f1: 0.6343
 epoch: 73, train_loss: 0.6812, test_loss: 0.9882, test_f1: 0.6358
 epoch: 74, train_loss: 0.6596, test_loss: 1.0835, test_f1: 0.6359
 epoch: 75, train_loss: 0.6622, test_loss: 1.1370, test_f1: 0.6252
 epoch: 76, train_loss: 0.6710, test_loss: 1.1217, test_f1: 0.6310
 epoch: 77, train_loss: 0.6689, test_loss: 1.0140, test_f1: 0.6181
 epoch: 78, train_loss: 0.6833, test_loss: 0.9933, test_f1: 0.6438
 epoch: 79, train_loss: 0.6612, test_loss: 1.1115, test_f1: 0.6387
 epoch: 80, train_loss: 0.6610, test_loss: 1.0676, test_f1: 0.6223
 epoch: 81, train_loss: 0.6607, test_loss: 1.0320, test_f1: 0.6425
 epoch: 82, train_loss: 0.6493, test_loss: 1.0966, test_f1: 0.6334
 epoch: 83, train_loss: 0.6555, test_loss: 1.1445, test_f1: 0.6330
 epoch: 84, train_loss: 0.6663, test_loss: 1.1213, test_f1: 0.6007
 epoch: 85, train_loss: 0.6577, test_loss: 1.0408, test_f1: 0.6310
 epoch: 86, train_loss: 0.6517, test_loss: 1.0755, test_f1: 0.6129
 epoch: 87, train_loss: 0.6330, test_loss: 1.1192, test_f1: 0.6114
 epoch: 88, train_loss: 0.6561, test_loss: 1.0566, test_f1: 0.6449
 epoch: 89, train_loss: 0.6518, test_loss: 1.0038, test_f1: 0.6247
 epoch: 90, train_loss: 0.6437, test_loss: 1.0348, test_f1: 0.6502
 epoch: 91, train_loss: 0.6528, test_loss: 1.0134, test_f1: 0.6404
 epoch: 92, train_loss: 0.6431, test_loss: 1.0137, test_f1: 0.6361
 epoch: 93, train_loss: 0.6366, test_loss: 1.0224, test_f1: 0.6423
 epoch: 94, train_loss: 0.6400, test_loss: 1.0616, test_f1: 0.6394
 epoch: 95, train_loss: 0.6304, test_loss: 1.0481, test_f1: 0.6412
 epoch: 96, train_loss: 0.6360, test_loss: 0.9875, test_f1: 0.6333
 epoch: 97, train_loss: 0.6468, test_loss: 1.0449, test_f1: 0.6598
 epoch: 98, train_loss: 0.6237, test_loss: 1.0209, test_f1: 0.6250
 epoch: 99, train_loss: 0.6263, test_loss: 1.0222, test_f1: 0.6419
##################ITERATION #8 ****************************************
 epoch: 0, train_loss: 1.2228, test_loss: 1.0849, test_f1: 0.4574
 epoch: 1, train_loss: 1.0517, test_loss: 1.1173, test_f1: 0.4184
 epoch: 2, train_loss: 0.9959, test_loss: 1.0332, test_f1: 0.4695
 epoch: 3, train_loss: 0.9693, test_loss: 1.0156, test_f1: 0.5160
 epoch: 4, train_loss: 0.9703, test_loss: 1.0236, test_f1: 0.4973
 epoch: 5, train_loss: 0.9579, test_loss: 0.9672, test_f1: 0.5002
 epoch: 6, train_loss: 0.9404, test_loss: 1.0653, test_f1: 0.4626
 epoch: 7, train_loss: 0.9403, test_loss: 0.9568, test_f1: 0.4870
 epoch: 8, train_loss: 0.9342, test_loss: 0.9803, test_f1: 0.4883
 epoch: 9, train_loss: 0.9397, test_loss: 0.9732, test_f1: 0.4979
 epoch: 10, train_loss: 0.9189, test_loss: 0.9997, test_f1: 0.5043
 epoch: 11, train_loss: 0.9206, test_loss: 0.9758, test_f1: 0.5401
 epoch: 12, train_loss: 0.9012, test_loss: 0.9670, test_f1: 0.5372
 epoch: 13, train_loss: 0.8978, test_loss: 0.9932, test_f1: 0.4598
 epoch: 14, train_loss: 0.8963, test_loss: 1.0676, test_f1: 0.5042
 epoch: 15, train_loss: 0.8948, test_loss: 1.0298, test_f1: 0.5245
 epoch: 16, train_loss: 0.8887, test_loss: 0.9693, test_f1: 0.5147
 epoch: 17, train_loss: 0.8750, test_loss: 1.0135, test_f1: 0.5293
 epoch: 18, train_loss: 0.8677, test_loss: 1.0085, test_f1: 0.5288
 epoch: 19, train_loss: 0.8782, test_loss: 1.0157, test_f1: 0.5206
 epoch: 20, train_loss: 0.8651, test_loss: 1.1821, test_f1: 0.4543
 epoch: 21, train_loss: 0.8972, test_loss: 1.0688, test_f1: 0.4616
 epoch: 22, train_loss: 0.8927, test_loss: 0.9686, test_f1: 0.5610
 epoch: 23, train_loss: 0.8908, test_loss: 1.0458, test_f1: 0.5607
 epoch: 24, train_loss: 0.8727, test_loss: 1.0244, test_f1: 0.5750
 epoch: 25, train_loss: 0.8725, test_loss: 0.9661, test_f1: 0.5640
 epoch: 26, train_loss: 0.8544, test_loss: 0.9698, test_f1: 0.5620
 epoch: 27, train_loss: 0.8486, test_loss: 1.0485, test_f1: 0.5647
 epoch: 28, train_loss: 0.8426, test_loss: 0.9836, test_f1: 0.5779
 epoch: 29, train_loss: 0.8380, test_loss: 1.0152, test_f1: 0.5267
 epoch: 30, train_loss: 0.8378, test_loss: 0.9581, test_f1: 0.5523
 epoch: 31, train_loss: 0.8248, test_loss: 0.9447, test_f1: 0.5848
 epoch: 32, train_loss: 0.8386, test_loss: 0.9582, test_f1: 0.5634
 epoch: 33, train_loss: 0.8368, test_loss: 0.9537, test_f1: 0.5326
 epoch: 34, train_loss: 0.8362, test_loss: 0.9372, test_f1: 0.5465
 epoch: 35, train_loss: 0.8106, test_loss: 0.8934, test_f1: 0.5900
 epoch: 36, train_loss: 0.8024, test_loss: 0.8924, test_f1: 0.6124
 epoch: 37, train_loss: 0.7901, test_loss: 0.9141, test_f1: 0.5946
 epoch: 38, train_loss: 0.8022, test_loss: 0.9105, test_f1: 0.5745
 epoch: 39, train_loss: 0.7880, test_loss: 0.9253, test_f1: 0.6217
 epoch: 40, train_loss: 0.7913, test_loss: 0.9248, test_f1: 0.5670
 epoch: 41, train_loss: 0.7867, test_loss: 0.9231, test_f1: 0.5847
 epoch: 42, train_loss: 0.7805, test_loss: 0.9365, test_f1: 0.5736
 epoch: 43, train_loss: 0.7849, test_loss: 0.8925, test_f1: 0.5837
 epoch: 44, train_loss: 0.7789, test_loss: 0.8883, test_f1: 0.5954
 epoch: 45, train_loss: 0.7686, test_loss: 0.9129, test_f1: 0.5918
 epoch: 46, train_loss: 0.7658, test_loss: 0.9367, test_f1: 0.6049
 epoch: 47, train_loss: 0.7673, test_loss: 0.8554, test_f1: 0.5859
 epoch: 48, train_loss: 0.7775, test_loss: 0.9116, test_f1: 0.5684
 epoch: 49, train_loss: 0.7660, test_loss: 0.9412, test_f1: 0.6113
 epoch: 50, train_loss: 0.7584, test_loss: 0.9748, test_f1: 0.5552
 epoch: 51, train_loss: 0.7416, test_loss: 0.9299, test_f1: 0.6022
 epoch: 52, train_loss: 0.7223, test_loss: 0.9420, test_f1: 0.6017
 epoch: 53, train_loss: 0.7218, test_loss: 0.8933, test_f1: 0.6061
 epoch: 54, train_loss: 0.7092, test_loss: 0.8993, test_f1: 0.6435
 epoch: 55, train_loss: 0.7122, test_loss: 0.8994, test_f1: 0.6296
 epoch: 56, train_loss: 0.7069, test_loss: 0.8986, test_f1: 0.6335
 epoch: 57, train_loss: 0.7128, test_loss: 0.8888, test_f1: 0.6290
 epoch: 58, train_loss: 0.6923, test_loss: 0.9052, test_f1: 0.6375
 epoch: 59, train_loss: 0.6838, test_loss: 0.9284, test_f1: 0.5954
 epoch: 60, train_loss: 0.6863, test_loss: 0.9289, test_f1: 0.6321
 epoch: 61, train_loss: 0.6881, test_loss: 0.9049, test_f1: 0.6468
 epoch: 62, train_loss: 0.6869, test_loss: 0.8781, test_f1: 0.6168
 epoch: 63, train_loss: 0.6793, test_loss: 0.9078, test_f1: 0.6270
 epoch: 64, train_loss: 0.6760, test_loss: 0.8753, test_f1: 0.6257
 epoch: 65, train_loss: 0.6762, test_loss: 0.9218, test_f1: 0.6171
 epoch: 66, train_loss: 0.6801, test_loss: 0.9041, test_f1: 0.5952
 epoch: 67, train_loss: 0.6617, test_loss: 0.9540, test_f1: 0.6096
 epoch: 68, train_loss: 0.6688, test_loss: 0.8695, test_f1: 0.6446
 epoch: 69, train_loss: 0.6867, test_loss: 0.9176, test_f1: 0.6384
 epoch: 70, train_loss: 0.6686, test_loss: 0.8733, test_f1: 0.6336
 epoch: 71, train_loss: 0.6552, test_loss: 0.8809, test_f1: 0.6394
 epoch: 72, train_loss: 0.6639, test_loss: 0.8928, test_f1: 0.6478
 epoch: 73, train_loss: 0.6591, test_loss: 0.9048, test_f1: 0.6137
 epoch: 74, train_loss: 0.6524, test_loss: 0.9049, test_f1: 0.6238
 epoch: 75, train_loss: 0.6573, test_loss: 0.9067, test_f1: 0.6616
 epoch: 76, train_loss: 0.6596, test_loss: 0.9216, test_f1: 0.6333
 epoch: 77, train_loss: 0.6616, test_loss: 0.8920, test_f1: 0.6453
 epoch: 78, train_loss: 0.6495, test_loss: 0.8934, test_f1: 0.6463
 epoch: 79, train_loss: 0.6377, test_loss: 0.9283, test_f1: 0.6561
 epoch: 80, train_loss: 0.6595, test_loss: 0.9383, test_f1: 0.6260
 epoch: 81, train_loss: 0.6650, test_loss: 0.9300, test_f1: 0.6304
 epoch: 82, train_loss: 0.6441, test_loss: 0.9353, test_f1: 0.6703
 epoch: 83, train_loss: 0.6748, test_loss: 0.9184, test_f1: 0.6599
 epoch: 84, train_loss: 0.6591, test_loss: 0.8952, test_f1: 0.6619
 epoch: 85, train_loss: 0.6609, test_loss: 0.9323, test_f1: 0.6698
 epoch: 86, train_loss: 0.6282, test_loss: 0.9268, test_f1: 0.6550
 epoch: 87, train_loss: 0.6257, test_loss: 0.8928, test_f1: 0.6704
 epoch: 88, train_loss: 0.6376, test_loss: 0.9167, test_f1: 0.6517
 epoch: 89, train_loss: 0.6282, test_loss: 0.9249, test_f1: 0.6680
 epoch: 90, train_loss: 0.6165, test_loss: 0.9948, test_f1: 0.6071
 epoch: 91, train_loss: 0.6235, test_loss: 0.9304, test_f1: 0.6416
 epoch: 92, train_loss: 0.6424, test_loss: 0.8968, test_f1: 0.6604
 epoch: 93, train_loss: 0.6199, test_loss: 1.0026, test_f1: 0.6296
 epoch: 94, train_loss: 0.6268, test_loss: 0.9352, test_f1: 0.6327
 epoch: 95, train_loss: 0.6098, test_loss: 0.9650, test_f1: 0.6168
 epoch: 96, train_loss: 0.6205, test_loss: 0.9185, test_f1: 0.6467
 epoch: 97, train_loss: 0.6137, test_loss: 0.9244, test_f1: 0.6355
 epoch: 98, train_loss: 0.6232, test_loss: 0.9084, test_f1: 0.6737
 epoch: 99, train_loss: 0.6300, test_loss: 1.0032, test_f1: 0.5800
##################ITERATION #9 ****************************************
 epoch: 0, train_loss: 1.1765, test_loss: 1.1161, test_f1: 0.4291
 epoch: 1, train_loss: 1.0223, test_loss: 0.9919, test_f1: 0.4961
 epoch: 2, train_loss: 0.9883, test_loss: 1.0806, test_f1: 0.4714
 epoch: 3, train_loss: 0.9685, test_loss: 1.0328, test_f1: 0.4973
 epoch: 4, train_loss: 0.9625, test_loss: 1.0152, test_f1: 0.4760
 epoch: 5, train_loss: 0.9440, test_loss: 0.9728, test_f1: 0.5082
 epoch: 6, train_loss: 0.9409, test_loss: 1.0498, test_f1: 0.4825
 epoch: 7, train_loss: 0.9345, test_loss: 1.0169, test_f1: 0.5034
 epoch: 8, train_loss: 0.9327, test_loss: 1.0598, test_f1: 0.4854
 epoch: 9, train_loss: 0.9113, test_loss: 0.9468, test_f1: 0.4670
 epoch: 10, train_loss: 0.8956, test_loss: 1.0263, test_f1: 0.4981
 epoch: 11, train_loss: 0.8958, test_loss: 0.9960, test_f1: 0.5350
 epoch: 12, train_loss: 0.9005, test_loss: 0.9265, test_f1: 0.5271
 epoch: 13, train_loss: 0.8884, test_loss: 0.9747, test_f1: 0.5097
 epoch: 14, train_loss: 0.8910, test_loss: 0.9414, test_f1: 0.5118
 epoch: 15, train_loss: 0.8753, test_loss: 0.9568, test_f1: 0.5372
 epoch: 16, train_loss: 0.8855, test_loss: 1.1663, test_f1: 0.4265
 epoch: 17, train_loss: 0.8771, test_loss: 0.9138, test_f1: 0.5363
 epoch: 18, train_loss: 0.8530, test_loss: 0.9948, test_f1: 0.5030
 epoch: 19, train_loss: 0.8674, test_loss: 0.9351, test_f1: 0.4956
 epoch: 20, train_loss: 0.8609, test_loss: 0.9877, test_f1: 0.5033
 epoch: 21, train_loss: 0.8607, test_loss: 1.0054, test_f1: 0.4867
 epoch: 22, train_loss: 0.8593, test_loss: 0.9854, test_f1: 0.5503
 epoch: 23, train_loss: 0.8435, test_loss: 0.9683, test_f1: 0.5397
 epoch: 24, train_loss: 0.8510, test_loss: 0.9124, test_f1: 0.5440
 epoch: 25, train_loss: 0.8311, test_loss: 0.9818, test_f1: 0.5210
 epoch: 26, train_loss: 0.8111, test_loss: 0.9144, test_f1: 0.5176
 epoch: 27, train_loss: 0.8082, test_loss: 0.9479, test_f1: 0.5979
 epoch: 28, train_loss: 0.8130, test_loss: 0.9671, test_f1: 0.5413
 epoch: 29, train_loss: 0.8061, test_loss: 1.1469, test_f1: 0.5002
 epoch: 30, train_loss: 0.8093, test_loss: 0.9690, test_f1: 0.5308
 epoch: 31, train_loss: 0.7776, test_loss: 0.9569, test_f1: 0.5340
 epoch: 32, train_loss: 0.7939, test_loss: 1.0689, test_f1: 0.5206
 epoch: 33, train_loss: 0.8011, test_loss: 0.9594, test_f1: 0.5753
 epoch: 34, train_loss: 0.7827, test_loss: 1.0250, test_f1: 0.5531
 epoch: 35, train_loss: 0.7892, test_loss: 0.9263, test_f1: 0.5394
 epoch: 36, train_loss: 0.8096, test_loss: 0.9364, test_f1: 0.5487
 epoch: 37, train_loss: 0.7690, test_loss: 0.9631, test_f1: 0.6091
 epoch: 38, train_loss: 0.7692, test_loss: 0.9569, test_f1: 0.5604
 epoch: 39, train_loss: 0.7798, test_loss: 1.0897, test_f1: 0.5310
 epoch: 40, train_loss: 0.7746, test_loss: 1.0429, test_f1: 0.5813
 epoch: 41, train_loss: 0.7826, test_loss: 0.9632, test_f1: 0.5677
 epoch: 42, train_loss: 0.7648, test_loss: 0.9140, test_f1: 0.6172
 epoch: 43, train_loss: 0.7551, test_loss: 1.0374, test_f1: 0.5724
 epoch: 44, train_loss: 0.7567, test_loss: 0.9096, test_f1: 0.6148
 epoch: 45, train_loss: 0.7493, test_loss: 1.0744, test_f1: 0.5642
 epoch: 46, train_loss: 0.7422, test_loss: 1.0047, test_f1: 0.6056
 epoch: 47, train_loss: 0.7572, test_loss: 1.0371, test_f1: 0.5540
 epoch: 48, train_loss: 0.7421, test_loss: 0.9426, test_f1: 0.5672
 epoch: 49, train_loss: 0.7700, test_loss: 1.0401, test_f1: 0.5414
 epoch: 50, train_loss: 0.7450, test_loss: 0.9990, test_f1: 0.5874
 epoch: 51, train_loss: 0.7126, test_loss: 0.9497, test_f1: 0.6238
 epoch: 52, train_loss: 0.6952, test_loss: 0.9715, test_f1: 0.6366
 epoch: 53, train_loss: 0.6889, test_loss: 0.9694, test_f1: 0.5945
 epoch: 54, train_loss: 0.6820, test_loss: 0.9576, test_f1: 0.6371
 epoch: 55, train_loss: 0.6832, test_loss: 0.9516, test_f1: 0.6301
 epoch: 56, train_loss: 0.6904, test_loss: 0.9584, test_f1: 0.6192
 epoch: 57, train_loss: 0.6722, test_loss: 0.9691, test_f1: 0.6315
 epoch: 58, train_loss: 0.6782, test_loss: 1.0147, test_f1: 0.6152
 epoch: 59, train_loss: 0.6729, test_loss: 1.0046, test_f1: 0.6447
 epoch: 60, train_loss: 0.6743, test_loss: 1.0097, test_f1: 0.6153
 epoch: 61, train_loss: 0.6831, test_loss: 0.9610, test_f1: 0.6357
 epoch: 62, train_loss: 0.6792, test_loss: 0.9883, test_f1: 0.5857
 epoch: 63, train_loss: 0.6756, test_loss: 0.9350, test_f1: 0.6348
 epoch: 64, train_loss: 0.6575, test_loss: 1.0067, test_f1: 0.6214
 epoch: 65, train_loss: 0.6578, test_loss: 0.9536, test_f1: 0.6645
 epoch: 66, train_loss: 0.6711, test_loss: 0.9731, test_f1: 0.6388
 epoch: 67, train_loss: 0.6747, test_loss: 0.9983, test_f1: 0.6446
 epoch: 68, train_loss: 0.6715, test_loss: 0.9762, test_f1: 0.6408
 epoch: 69, train_loss: 0.6577, test_loss: 1.0103, test_f1: 0.6220
 epoch: 70, train_loss: 0.6449, test_loss: 0.9511, test_f1: 0.6179
 epoch: 71, train_loss: 0.6574, test_loss: 1.0100, test_f1: 0.6591
 epoch: 72, train_loss: 0.6489, test_loss: 0.9959, test_f1: 0.6214
 epoch: 73, train_loss: 0.6353, test_loss: 0.9730, test_f1: 0.6257
 epoch: 74, train_loss: 0.6605, test_loss: 0.9634, test_f1: 0.6525
 epoch: 75, train_loss: 0.6279, test_loss: 0.9813, test_f1: 0.6307
 epoch: 76, train_loss: 0.6364, test_loss: 1.0019, test_f1: 0.6367
 epoch: 77, train_loss: 0.6223, test_loss: 1.0337, test_f1: 0.6441
 epoch: 78, train_loss: 0.6248, test_loss: 0.9635, test_f1: 0.6538
 epoch: 79, train_loss: 0.6187, test_loss: 1.0044, test_f1: 0.5941
 epoch: 80, train_loss: 0.6449, test_loss: 0.9380, test_f1: 0.6455
 epoch: 81, train_loss: 0.6523, test_loss: 0.9334, test_f1: 0.6497
 epoch: 82, train_loss: 0.6071, test_loss: 1.0142, test_f1: 0.6587
 epoch: 83, train_loss: 0.6143, test_loss: 0.9874, test_f1: 0.6346
 epoch: 84, train_loss: 0.6116, test_loss: 1.0068, test_f1: 0.6379
 epoch: 85, train_loss: 0.6165, test_loss: 0.9968, test_f1: 0.6325
 epoch: 86, train_loss: 0.6047, test_loss: 1.0011, test_f1: 0.6215
 epoch: 87, train_loss: 0.6206, test_loss: 1.0504, test_f1: 0.6091
 epoch: 88, train_loss: 0.6181, test_loss: 0.9597, test_f1: 0.6552
 epoch: 89, train_loss: 0.6150, test_loss: 0.9491, test_f1: 0.6354
 epoch: 90, train_loss: 0.6001, test_loss: 0.9802, test_f1: 0.6273
 epoch: 91, train_loss: 0.6087, test_loss: 0.9804, test_f1: 0.6645
 epoch: 92, train_loss: 0.5966, test_loss: 1.0057, test_f1: 0.6582
 epoch: 93, train_loss: 0.5873, test_loss: 0.9577, test_f1: 0.6302
 epoch: 94, train_loss: 0.5976, test_loss: 1.0700, test_f1: 0.6029
 epoch: 95, train_loss: 0.6148, test_loss: 0.8542, test_f1: 0.6600
 epoch: 96, train_loss: 0.6198, test_loss: 1.0577, test_f1: 0.6285
 epoch: 97, train_loss: 0.5846, test_loss: 0.9936, test_f1: 0.6441
 epoch: 98, train_loss: 0.5893, test_loss: 1.0016, test_f1: 0.6539
 epoch: 99, train_loss: 0.5867, test_loss: 0.9838, test_f1: 0.6539

Training completed in 738.89 seconds
Best F1: 0.6793 at epoch 96
Mean F1 across iterations: 0.6628  0.0103
========================FINAL RESULTS================================
FEGIN weighted F1: 0.6793  0.0103
python main.py --data ltspice_examples --representation component_net --model FEGIN --layers 5 --hiddens 32 --batch_size 64 --lr 0.01 --emb_size 512 --epochs 100 --save_appendix component_net_L5_H32_BS64_LR0.01_E512 --no_val
-----



STDERR:
  File "main.py", line 370, in <module>
    main()
  File "main.py", line 254, in main
    dataset = dataset_class(
  File "/home/philip/projects/ltspice_examples_code_repo/Circuit-Completion-Using-GNNs/component_classification_with_link_prediction_head/evaluation/FEGIN/kernel/circuit_datasets.py", line 15, in __init__
    self.data, self.slices = torch.load(self.processed_paths[0])
  File "/home/philip/.local/lib/python3.8/site-packages/torch/serialization.py", line 1040, in load
    warnings.warn(
  File "/usr/lib/python3.8/warnings.py", line 109, in _showwarnmsg
    sw(msg.message, msg.category, msg.filename, msg.lineno,
  File "main.py", line 47, in warn_with_traceback
    traceback.print_stack(file=log)
/home/philip/projects/ltspice_examples_code_repo/Circuit-Completion-Using-GNNs/component_classification_with_link_prediction_head/evaluation/FEGIN/kernel/circuit_datasets.py:15: FutureWarning: You are using `torch.load` with `weights_only=False` (the current default value), which uses the default pickle module implicitly. It is possible to construct malicious pickle data which will execute arbitrary code during unpickling (See https://github.com/pytorch/pytorch/blob/main/SECURITY.md#untrusted-models for more details). In a future release, the default value for `weights_only` will be flipped to `True`. This limits the functions that could be executed during unpickling. Arbitrary objects will no longer be allowed to be loaded via this mode unless they are explicitly allowlisted by the user via `torch.serialization.add_safe_globals`. We recommend you start setting `weights_only=True` for any use case where you don't have full control of the loaded file. Please open an issue on GitHub for any issues related to this experimental feature.
  self.data, self.slices = torch.load(self.processed_paths[0])
