STDOUT:
Results will be saved in /home/philip/projects/ltspice_examples_code_repo/Circuit-Completion-Using-GNNs/component_classification_with_link_prediction_head/evaluation/FEGIN/results/model_FEGIN_dataset_ltspice_examples
Command line input: python main.py --data ltspice_examples --representation component_component --model FEGIN --layers 3 --hiddens 128 --batch_size 32 --lr 0.001 --emb_size 512 --epochs 100 --save_appendix component_component_L3_H128_BS32_LR0.001_E512 --no_val
 is saved.
-----
ltspice_examples - FEGIN
Using 3 layers, 128 hidden units, h = 2
Loading component_component representation dataset
ENTERED
Training FEGIN on component_component representation
Train: 3556, Test: 845
##################ITERATION #0 ****************************************
 epoch: 0, train_loss: 1.2300, test_loss: 1.1173, test_f1: 0.4263
 epoch: 1, train_loss: 1.1139, test_loss: 1.0203, test_f1: 0.4924
 epoch: 2, train_loss: 1.0565, test_loss: 1.0048, test_f1: 0.4675
 epoch: 3, train_loss: 1.0096, test_loss: 0.9428, test_f1: 0.5263
 epoch: 4, train_loss: 0.9909, test_loss: 0.9687, test_f1: 0.4895
 epoch: 5, train_loss: 0.9692, test_loss: 0.9829, test_f1: 0.4612
 epoch: 6, train_loss: 0.9474, test_loss: 0.9951, test_f1: 0.5315
 epoch: 7, train_loss: 0.9303, test_loss: 0.9698, test_f1: 0.5187
 epoch: 8, train_loss: 0.9192, test_loss: 0.9648, test_f1: 0.5459
 epoch: 9, train_loss: 0.9029, test_loss: 1.0237, test_f1: 0.5238
 epoch: 10, train_loss: 0.8920, test_loss: 0.9974, test_f1: 0.5064
 epoch: 11, train_loss: 0.8848, test_loss: 1.0077, test_f1: 0.5093
 epoch: 12, train_loss: 0.8756, test_loss: 1.0471, test_f1: 0.5111
 epoch: 13, train_loss: 0.8654, test_loss: 0.9506, test_f1: 0.5601
 epoch: 14, train_loss: 0.8468, test_loss: 0.9389, test_f1: 0.5329
 epoch: 15, train_loss: 0.8324, test_loss: 1.1136, test_f1: 0.4888
 epoch: 16, train_loss: 0.8084, test_loss: 1.0657, test_f1: 0.5124
 epoch: 17, train_loss: 0.8172, test_loss: 1.1703, test_f1: 0.5265
 epoch: 18, train_loss: 0.7864, test_loss: 1.1133, test_f1: 0.5328
 epoch: 19, train_loss: 0.7943, test_loss: 1.0744, test_f1: 0.5540
 epoch: 20, train_loss: 0.7704, test_loss: 1.0161, test_f1: 0.5632
 epoch: 21, train_loss: 0.7916, test_loss: 1.0246, test_f1: 0.5065
 epoch: 22, train_loss: 0.7696, test_loss: 1.0183, test_f1: 0.5501
 epoch: 23, train_loss: 0.7729, test_loss: 1.0637, test_f1: 0.5318
 epoch: 24, train_loss: 0.7643, test_loss: 1.0408, test_f1: 0.5360
 epoch: 25, train_loss: 0.7484, test_loss: 1.0516, test_f1: 0.5504
 epoch: 26, train_loss: 0.7559, test_loss: 1.2131, test_f1: 0.5387
 epoch: 27, train_loss: 0.7235, test_loss: 1.1040, test_f1: 0.5460
 epoch: 28, train_loss: 0.7445, test_loss: 1.1814, test_f1: 0.5412
 epoch: 29, train_loss: 0.7353, test_loss: 1.0699, test_f1: 0.5461
 epoch: 30, train_loss: 0.7274, test_loss: 1.1162, test_f1: 0.5278
 epoch: 31, train_loss: 0.6862, test_loss: 1.1888, test_f1: 0.5480
 epoch: 32, train_loss: 0.6927, test_loss: 1.0349, test_f1: 0.5831
 epoch: 33, train_loss: 0.7127, test_loss: 1.1041, test_f1: 0.5537
 epoch: 34, train_loss: 0.7048, test_loss: 1.1386, test_f1: 0.5497
 epoch: 35, train_loss: 0.7136, test_loss: 1.1896, test_f1: 0.5299
 epoch: 36, train_loss: 0.6898, test_loss: 1.1487, test_f1: 0.5130
 epoch: 37, train_loss: 0.6963, test_loss: 1.1189, test_f1: 0.5443
 epoch: 38, train_loss: 0.6763, test_loss: 1.1901, test_f1: 0.5500
 epoch: 39, train_loss: 0.6808, test_loss: 1.1516, test_f1: 0.5584
 epoch: 40, train_loss: 0.6671, test_loss: 1.1601, test_f1: 0.5571
 epoch: 41, train_loss: 0.6851, test_loss: 1.1218, test_f1: 0.5607
 epoch: 42, train_loss: 0.6678, test_loss: 1.1327, test_f1: 0.5712
 epoch: 43, train_loss: 0.6284, test_loss: 1.2614, test_f1: 0.5680
 epoch: 44, train_loss: 0.6178, test_loss: 1.3442, test_f1: 0.5445
 epoch: 45, train_loss: 0.6418, test_loss: 1.1735, test_f1: 0.5716
 epoch: 46, train_loss: 0.6308, test_loss: 1.3358, test_f1: 0.5514
 epoch: 47, train_loss: 0.6150, test_loss: 1.2599, test_f1: 0.5676
 epoch: 48, train_loss: 0.5997, test_loss: 1.2095, test_f1: 0.5569
 epoch: 49, train_loss: 0.6346, test_loss: 1.2682, test_f1: 0.5813
 epoch: 50, train_loss: 0.6308, test_loss: 1.1772, test_f1: 0.5817
 epoch: 51, train_loss: 0.5690, test_loss: 1.1402, test_f1: 0.5793
 epoch: 52, train_loss: 0.5460, test_loss: 1.2186, test_f1: 0.5875
 epoch: 53, train_loss: 0.5422, test_loss: 1.1962, test_f1: 0.5768
 epoch: 54, train_loss: 0.5321, test_loss: 1.2659, test_f1: 0.5804
 epoch: 55, train_loss: 0.5167, test_loss: 1.2306, test_f1: 0.5855
 epoch: 56, train_loss: 0.5182, test_loss: 1.2897, test_f1: 0.5713
 epoch: 57, train_loss: 0.5002, test_loss: 1.2444, test_f1: 0.5772
 epoch: 58, train_loss: 0.4874, test_loss: 1.3906, test_f1: 0.5720
 epoch: 59, train_loss: 0.5038, test_loss: 1.3944, test_f1: 0.6034
 epoch: 60, train_loss: 0.5012, test_loss: 1.4585, test_f1: 0.5092
 epoch: 61, train_loss: 0.5626, test_loss: 1.4145, test_f1: 0.5362
 epoch: 62, train_loss: 0.5069, test_loss: 1.3628, test_f1: 0.5760
 epoch: 63, train_loss: 0.4947, test_loss: 1.3162, test_f1: 0.5832
 epoch: 64, train_loss: 0.4865, test_loss: 1.3661, test_f1: 0.5816
 epoch: 65, train_loss: 0.4775, test_loss: 1.3106, test_f1: 0.5653
 epoch: 66, train_loss: 0.4720, test_loss: 1.5041, test_f1: 0.5720
 epoch: 67, train_loss: 0.5031, test_loss: 1.4057, test_f1: 0.5765
 epoch: 68, train_loss: 0.4612, test_loss: 1.4270, test_f1: 0.5680
 epoch: 69, train_loss: 0.4612, test_loss: 1.3645, test_f1: 0.5784
 epoch: 70, train_loss: 0.4453, test_loss: 1.5293, test_f1: 0.5552
 epoch: 71, train_loss: 0.4428, test_loss: 1.4380, test_f1: 0.5634
 epoch: 72, train_loss: 0.4321, test_loss: 1.5557, test_f1: 0.5579
 epoch: 73, train_loss: 0.4327, test_loss: 1.4136, test_f1: 0.5626
 epoch: 74, train_loss: 0.4319, test_loss: 1.5344, test_f1: 0.5657
 epoch: 75, train_loss: 0.4260, test_loss: 1.6207, test_f1: 0.5204
 epoch: 76, train_loss: 0.4086, test_loss: 1.4842, test_f1: 0.5503
 epoch: 77, train_loss: 0.4714, test_loss: 1.5059, test_f1: 0.5568
 epoch: 78, train_loss: 0.4423, test_loss: 1.4362, test_f1: 0.5559
 epoch: 79, train_loss: 0.4246, test_loss: 1.5386, test_f1: 0.5459
 epoch: 80, train_loss: 0.4123, test_loss: 1.6270, test_f1: 0.5512
 epoch: 81, train_loss: 0.4100, test_loss: 1.5622, test_f1: 0.5207
 epoch: 82, train_loss: 0.4462, test_loss: 1.5190, test_f1: 0.5263
 epoch: 83, train_loss: 0.4416, test_loss: 1.5564, test_f1: 0.5307
 epoch: 84, train_loss: 0.4014, test_loss: 1.6469, test_f1: 0.5527
 epoch: 85, train_loss: 0.4051, test_loss: 1.5074, test_f1: 0.5579
 epoch: 86, train_loss: 0.4554, test_loss: 1.5032, test_f1: 0.5611
 epoch: 87, train_loss: 0.4302, test_loss: 1.4533, test_f1: 0.5686
 epoch: 88, train_loss: 0.4141, test_loss: 1.5302, test_f1: 0.5793
 epoch: 89, train_loss: 0.4064, test_loss: 1.5916, test_f1: 0.5448
 epoch: 90, train_loss: 0.3868, test_loss: 1.5915, test_f1: 0.5676
 epoch: 91, train_loss: 0.4064, test_loss: 1.5898, test_f1: 0.5483
 epoch: 92, train_loss: 0.3902, test_loss: 1.5965, test_f1: 0.5596
 epoch: 93, train_loss: 0.3830, test_loss: 1.5876, test_f1: 0.5689
 epoch: 94, train_loss: 0.4251, test_loss: 1.6509, test_f1: 0.5724
 epoch: 95, train_loss: 0.3713, test_loss: 1.6768, test_f1: 0.5629
 epoch: 96, train_loss: 0.3705, test_loss: 1.6855, test_f1: 0.5570
 epoch: 97, train_loss: 0.3811, test_loss: 1.7898, test_f1: 0.5560
 epoch: 98, train_loss: 0.3847, test_loss: 1.9646, test_f1: 0.5139
 epoch: 99, train_loss: 0.3695, test_loss: 1.6913, test_f1: 0.5561
##################ITERATION #1 ****************************************
 epoch: 0, train_loss: 1.1924, test_loss: 1.0761, test_f1: 0.4868
 epoch: 1, train_loss: 1.0819, test_loss: 1.0070, test_f1: 0.4646
 epoch: 2, train_loss: 1.0450, test_loss: 0.9772, test_f1: 0.4541
 epoch: 3, train_loss: 1.0255, test_loss: 0.9985, test_f1: 0.4663
 epoch: 4, train_loss: 0.9979, test_loss: 1.1040, test_f1: 0.4182
 epoch: 5, train_loss: 0.9679, test_loss: 0.9501, test_f1: 0.5125
 epoch: 6, train_loss: 0.9528, test_loss: 0.9729, test_f1: 0.4917
 epoch: 7, train_loss: 0.9350, test_loss: 0.9561, test_f1: 0.5290
 epoch: 8, train_loss: 0.9260, test_loss: 0.9440, test_f1: 0.5283
 epoch: 9, train_loss: 0.9352, test_loss: 0.9351, test_f1: 0.5303
 epoch: 10, train_loss: 0.9057, test_loss: 0.9774, test_f1: 0.5228
 epoch: 11, train_loss: 0.9006, test_loss: 1.0593, test_f1: 0.5187
 epoch: 12, train_loss: 0.8907, test_loss: 1.0057, test_f1: 0.5456
 epoch: 13, train_loss: 0.8673, test_loss: 1.0043, test_f1: 0.5170
 epoch: 14, train_loss: 0.8630, test_loss: 1.0075, test_f1: 0.5235
 epoch: 15, train_loss: 0.8669, test_loss: 1.0329, test_f1: 0.5603
 epoch: 16, train_loss: 0.8501, test_loss: 0.9852, test_f1: 0.5339
 epoch: 17, train_loss: 0.8481, test_loss: 0.9717, test_f1: 0.5263
 epoch: 18, train_loss: 0.8389, test_loss: 1.0062, test_f1: 0.5396
 epoch: 19, train_loss: 0.8414, test_loss: 0.9979, test_f1: 0.5348
 epoch: 20, train_loss: 0.8162, test_loss: 0.9655, test_f1: 0.5426
 epoch: 21, train_loss: 0.8076, test_loss: 0.9548, test_f1: 0.5732
 epoch: 22, train_loss: 0.8095, test_loss: 1.0480, test_f1: 0.5390
 epoch: 23, train_loss: 0.7959, test_loss: 1.0178, test_f1: 0.5372
 epoch: 24, train_loss: 0.7675, test_loss: 1.0390, test_f1: 0.5506
 epoch: 25, train_loss: 0.7686, test_loss: 0.9946, test_f1: 0.5542
 epoch: 26, train_loss: 0.7776, test_loss: 0.9987, test_f1: 0.5402
 epoch: 27, train_loss: 0.7632, test_loss: 1.0968, test_f1: 0.5443
 epoch: 28, train_loss: 0.7582, test_loss: 1.1013, test_f1: 0.5502
 epoch: 29, train_loss: 0.7592, test_loss: 1.0043, test_f1: 0.5449
 epoch: 30, train_loss: 0.7264, test_loss: 1.0218, test_f1: 0.5397
 epoch: 31, train_loss: 0.7684, test_loss: 1.0249, test_f1: 0.5662
 epoch: 32, train_loss: 0.7279, test_loss: 0.9997, test_f1: 0.5542
 epoch: 33, train_loss: 0.7074, test_loss: 1.0644, test_f1: 0.5308
 epoch: 34, train_loss: 0.7154, test_loss: 1.1677, test_f1: 0.5228
 epoch: 35, train_loss: 0.7163, test_loss: 1.1032, test_f1: 0.5476
 epoch: 36, train_loss: 0.6839, test_loss: 0.9987, test_f1: 0.5806
 epoch: 37, train_loss: 0.7038, test_loss: 1.0181, test_f1: 0.5596
 epoch: 38, train_loss: 0.6895, test_loss: 1.0581, test_f1: 0.5641
 epoch: 39, train_loss: 0.6733, test_loss: 1.1767, test_f1: 0.5366
 epoch: 40, train_loss: 0.6849, test_loss: 1.0429, test_f1: 0.5648
 epoch: 41, train_loss: 0.6759, test_loss: 1.1749, test_f1: 0.5031
 epoch: 42, train_loss: 0.6581, test_loss: 1.1441, test_f1: 0.5222
 epoch: 43, train_loss: 0.6749, test_loss: 1.1535, test_f1: 0.5493
 epoch: 44, train_loss: 0.6950, test_loss: 1.0614, test_f1: 0.5459
 epoch: 45, train_loss: 0.6749, test_loss: 1.0725, test_f1: 0.5621
 epoch: 46, train_loss: 0.6595, test_loss: 1.0979, test_f1: 0.5498
 epoch: 47, train_loss: 0.7022, test_loss: 1.1452, test_f1: 0.5807
 epoch: 48, train_loss: 0.6558, test_loss: 1.1400, test_f1: 0.5324
 epoch: 49, train_loss: 0.6588, test_loss: 1.1908, test_f1: 0.5570
 epoch: 50, train_loss: 0.6487, test_loss: 1.2361, test_f1: 0.5460
 epoch: 51, train_loss: 0.6082, test_loss: 1.1345, test_f1: 0.5684
 epoch: 52, train_loss: 0.5836, test_loss: 1.1989, test_f1: 0.5745
 epoch: 53, train_loss: 0.5744, test_loss: 1.1858, test_f1: 0.5351
 epoch: 54, train_loss: 0.5642, test_loss: 1.1654, test_f1: 0.5503
 epoch: 55, train_loss: 0.5828, test_loss: 1.1721, test_f1: 0.5644
 epoch: 56, train_loss: 0.5454, test_loss: 1.2092, test_f1: 0.5587
 epoch: 57, train_loss: 0.5437, test_loss: 1.1775, test_f1: 0.5551
 epoch: 58, train_loss: 0.5442, test_loss: 1.1829, test_f1: 0.5657
 epoch: 59, train_loss: 0.5450, test_loss: 1.1751, test_f1: 0.5589
 epoch: 60, train_loss: 0.5735, test_loss: 1.1674, test_f1: 0.5545
 epoch: 61, train_loss: 0.5414, test_loss: 1.2632, test_f1: 0.5317
 epoch: 62, train_loss: 0.5508, test_loss: 1.1187, test_f1: 0.5671
 epoch: 63, train_loss: 0.5436, test_loss: 1.3849, test_f1: 0.5107
 epoch: 64, train_loss: 0.5344, test_loss: 1.2261, test_f1: 0.5708
 epoch: 65, train_loss: 0.5222, test_loss: 1.3174, test_f1: 0.5154
 epoch: 66, train_loss: 0.5119, test_loss: 1.3746, test_f1: 0.5265
 epoch: 67, train_loss: 0.5283, test_loss: 1.2433, test_f1: 0.5727
 epoch: 68, train_loss: 0.5095, test_loss: 1.3268, test_f1: 0.5124
 epoch: 69, train_loss: 0.5021, test_loss: 1.2635, test_f1: 0.5457
 epoch: 70, train_loss: 0.4963, test_loss: 1.2770, test_f1: 0.5860
 epoch: 71, train_loss: 0.5079, test_loss: 1.2407, test_f1: 0.5442
 epoch: 72, train_loss: 0.4964, test_loss: 1.2704, test_f1: 0.5667
 epoch: 73, train_loss: 0.4820, test_loss: 1.2395, test_f1: 0.5569
 epoch: 74, train_loss: 0.5055, test_loss: 1.2839, test_f1: 0.5615
 epoch: 75, train_loss: 0.4792, test_loss: 1.2016, test_f1: 0.5845
 epoch: 76, train_loss: 0.4779, test_loss: 1.3012, test_f1: 0.5733
 epoch: 77, train_loss: 0.4686, test_loss: 1.3371, test_f1: 0.5499
 epoch: 78, train_loss: 0.4608, test_loss: 1.3057, test_f1: 0.5480
 epoch: 79, train_loss: 0.4637, test_loss: 1.3139, test_f1: 0.5883
 epoch: 80, train_loss: 0.4647, test_loss: 1.4144, test_f1: 0.5430
 epoch: 81, train_loss: 0.4504, test_loss: 1.3877, test_f1: 0.5551
 epoch: 82, train_loss: 0.4586, test_loss: 1.3641, test_f1: 0.5562
 epoch: 83, train_loss: 0.4414, test_loss: 1.3145, test_f1: 0.5732
 epoch: 84, train_loss: 0.4473, test_loss: 1.3931, test_f1: 0.5571
 epoch: 85, train_loss: 0.4384, test_loss: 1.3339, test_f1: 0.5812
 epoch: 86, train_loss: 0.4431, test_loss: 1.4852, test_f1: 0.5428
 epoch: 87, train_loss: 0.4470, test_loss: 1.3691, test_f1: 0.5787
 epoch: 88, train_loss: 0.4384, test_loss: 1.3130, test_f1: 0.5778
 epoch: 89, train_loss: 0.4404, test_loss: 1.4686, test_f1: 0.5447
 epoch: 90, train_loss: 0.4347, test_loss: 1.4045, test_f1: 0.5933
 epoch: 91, train_loss: 0.4387, test_loss: 1.3699, test_f1: 0.5748
 epoch: 92, train_loss: 0.4522, test_loss: 1.3422, test_f1: 0.5636
 epoch: 93, train_loss: 0.4431, test_loss: 1.4257, test_f1: 0.5546
 epoch: 94, train_loss: 0.4287, test_loss: 1.3632, test_f1: 0.5608
 epoch: 95, train_loss: 0.4012, test_loss: 1.4642, test_f1: 0.5689
 epoch: 96, train_loss: 0.4354, test_loss: 1.3942, test_f1: 0.5603
 epoch: 97, train_loss: 0.4317, test_loss: 1.3934, test_f1: 0.5385
 epoch: 98, train_loss: 0.4261, test_loss: 1.4223, test_f1: 0.5712
 epoch: 99, train_loss: 0.4076, test_loss: 1.4534, test_f1: 0.5640
##################ITERATION #2 ****************************************
 epoch: 0, train_loss: 1.2473, test_loss: 1.1396, test_f1: 0.4542
 epoch: 1, train_loss: 1.0993, test_loss: 1.0225, test_f1: 0.4279
 epoch: 2, train_loss: 1.0420, test_loss: 0.9956, test_f1: 0.4606
 epoch: 3, train_loss: 1.0227, test_loss: 0.9998, test_f1: 0.4870
 epoch: 4, train_loss: 0.9970, test_loss: 0.9481, test_f1: 0.5220
 epoch: 5, train_loss: 0.9615, test_loss: 1.0447, test_f1: 0.4722
 epoch: 6, train_loss: 0.9675, test_loss: 0.9803, test_f1: 0.5066
 epoch: 7, train_loss: 0.9474, test_loss: 0.9901, test_f1: 0.4939
 epoch: 8, train_loss: 0.9370, test_loss: 1.0100, test_f1: 0.5216
 epoch: 9, train_loss: 0.9296, test_loss: 1.0481, test_f1: 0.5229
 epoch: 10, train_loss: 0.9098, test_loss: 0.9727, test_f1: 0.5178
 epoch: 11, train_loss: 0.9261, test_loss: 0.9439, test_f1: 0.4916
 epoch: 12, train_loss: 0.8901, test_loss: 0.9590, test_f1: 0.5162
 epoch: 13, train_loss: 0.8804, test_loss: 0.9809, test_f1: 0.5367
 epoch: 14, train_loss: 0.8796, test_loss: 0.9826, test_f1: 0.5197
 epoch: 15, train_loss: 0.8655, test_loss: 0.9737, test_f1: 0.5611
 epoch: 16, train_loss: 0.8444, test_loss: 1.0209, test_f1: 0.5121
 epoch: 17, train_loss: 0.8395, test_loss: 1.0142, test_f1: 0.5571
 epoch: 18, train_loss: 0.8254, test_loss: 1.0098, test_f1: 0.5151
 epoch: 19, train_loss: 0.8037, test_loss: 1.0235, test_f1: 0.5169
 epoch: 20, train_loss: 0.8039, test_loss: 1.1698, test_f1: 0.5055
 epoch: 21, train_loss: 0.8081, test_loss: 0.9991, test_f1: 0.5347
 epoch: 22, train_loss: 0.7965, test_loss: 1.0092, test_f1: 0.5399
 epoch: 23, train_loss: 0.8103, test_loss: 1.0175, test_f1: 0.5234
 epoch: 24, train_loss: 0.7949, test_loss: 1.0066, test_f1: 0.5476
 epoch: 25, train_loss: 0.8172, test_loss: 1.0042, test_f1: 0.5603
 epoch: 26, train_loss: 0.7848, test_loss: 1.0237, test_f1: 0.5518
 epoch: 27, train_loss: 0.7693, test_loss: 1.0198, test_f1: 0.5276
 epoch: 28, train_loss: 0.7487, test_loss: 1.0487, test_f1: 0.5391
 epoch: 29, train_loss: 0.7288, test_loss: 1.1419, test_f1: 0.5364
 epoch: 30, train_loss: 0.7593, test_loss: 1.0159, test_f1: 0.5600
 epoch: 31, train_loss: 0.7484, test_loss: 1.0661, test_f1: 0.5288
 epoch: 32, train_loss: 0.7437, test_loss: 1.0349, test_f1: 0.5307
 epoch: 33, train_loss: 0.7321, test_loss: 1.0546, test_f1: 0.5388
 epoch: 34, train_loss: 0.7168, test_loss: 1.0932, test_f1: 0.5161
 epoch: 35, train_loss: 0.7065, test_loss: 1.0645, test_f1: 0.5517
 epoch: 36, train_loss: 0.6911, test_loss: 1.1401, test_f1: 0.5372
 epoch: 37, train_loss: 0.7029, test_loss: 1.0721, test_f1: 0.5369
 epoch: 38, train_loss: 0.7231, test_loss: 1.0685, test_f1: 0.5572
 epoch: 39, train_loss: 0.6738, test_loss: 1.0822, test_f1: 0.5224
 epoch: 40, train_loss: 0.6697, test_loss: 1.0384, test_f1: 0.5560
 epoch: 41, train_loss: 0.6761, test_loss: 1.0692, test_f1: 0.5147
 epoch: 42, train_loss: 0.6568, test_loss: 1.1485, test_f1: 0.5441
 epoch: 43, train_loss: 0.6597, test_loss: 1.0348, test_f1: 0.5468
 epoch: 44, train_loss: 0.6507, test_loss: 1.0417, test_f1: 0.5561
 epoch: 45, train_loss: 0.6572, test_loss: 1.1187, test_f1: 0.5123
 epoch: 46, train_loss: 0.6481, test_loss: 0.9941, test_f1: 0.5537
 epoch: 47, train_loss: 0.6284, test_loss: 1.0047, test_f1: 0.5815
 epoch: 48, train_loss: 0.6313, test_loss: 1.0556, test_f1: 0.5664
 epoch: 49, train_loss: 0.6313, test_loss: 1.0684, test_f1: 0.5439
 epoch: 50, train_loss: 0.6333, test_loss: 1.1036, test_f1: 0.5579
 epoch: 51, train_loss: 0.5639, test_loss: 1.0652, test_f1: 0.5788
 epoch: 52, train_loss: 0.5530, test_loss: 1.0892, test_f1: 0.5647
 epoch: 53, train_loss: 0.5370, test_loss: 1.1824, test_f1: 0.5305
 epoch: 54, train_loss: 0.5366, test_loss: 1.2455, test_f1: 0.5048
 epoch: 55, train_loss: 0.5600, test_loss: 1.2320, test_f1: 0.5426
 epoch: 56, train_loss: 0.5235, test_loss: 1.2070, test_f1: 0.5587
 epoch: 57, train_loss: 0.5385, test_loss: 1.2804, test_f1: 0.5325
 epoch: 58, train_loss: 0.5232, test_loss: 1.2132, test_f1: 0.5818
 epoch: 59, train_loss: 0.5198, test_loss: 1.1733, test_f1: 0.5633
 epoch: 60, train_loss: 0.4968, test_loss: 1.1930, test_f1: 0.5601
 epoch: 61, train_loss: 0.5080, test_loss: 1.2295, test_f1: 0.5664
 epoch: 62, train_loss: 0.4985, test_loss: 1.1456, test_f1: 0.5740
 epoch: 63, train_loss: 0.4916, test_loss: 1.2311, test_f1: 0.5636
 epoch: 64, train_loss: 0.5013, test_loss: 1.2531, test_f1: 0.5431
 epoch: 65, train_loss: 0.4753, test_loss: 1.2590, test_f1: 0.5680
 epoch: 66, train_loss: 0.5128, test_loss: 1.1957, test_f1: 0.5868
 epoch: 67, train_loss: 0.4754, test_loss: 1.3055, test_f1: 0.5695
 epoch: 68, train_loss: 0.4671, test_loss: 1.2876, test_f1: 0.5898
 epoch: 69, train_loss: 0.4598, test_loss: 1.2964, test_f1: 0.5673
 epoch: 70, train_loss: 0.4821, test_loss: 1.2274, test_f1: 0.5589
 epoch: 71, train_loss: 0.4892, test_loss: 1.2364, test_f1: 0.5605
 epoch: 72, train_loss: 0.4784, test_loss: 1.2558, test_f1: 0.5680
 epoch: 73, train_loss: 0.4569, test_loss: 1.3531, test_f1: 0.5443
 epoch: 74, train_loss: 0.4339, test_loss: 1.3735, test_f1: 0.5440
 epoch: 75, train_loss: 0.4561, test_loss: 1.3473, test_f1: 0.5279
 epoch: 76, train_loss: 0.4936, test_loss: 1.2109, test_f1: 0.5787
 epoch: 77, train_loss: 0.4489, test_loss: 1.2997, test_f1: 0.5657
 epoch: 78, train_loss: 0.4387, test_loss: 1.2455, test_f1: 0.5991
 epoch: 79, train_loss: 0.4273, test_loss: 1.2499, test_f1: 0.5860
 epoch: 80, train_loss: 0.4522, test_loss: 1.2329, test_f1: 0.5935
 epoch: 81, train_loss: 0.4589, test_loss: 1.2779, test_f1: 0.5703
 epoch: 82, train_loss: 0.4284, test_loss: 1.2816, test_f1: 0.5729
 epoch: 83, train_loss: 0.4360, test_loss: 1.3259, test_f1: 0.5490
 epoch: 84, train_loss: 0.4082, test_loss: 1.4507, test_f1: 0.5372
 epoch: 85, train_loss: 0.4383, test_loss: 1.4555, test_f1: 0.5381
 epoch: 86, train_loss: 0.5067, test_loss: 1.3638, test_f1: 0.5393
 epoch: 87, train_loss: 0.4228, test_loss: 1.4061, test_f1: 0.5523
 epoch: 88, train_loss: 0.4250, test_loss: 1.3728, test_f1: 0.5702
 epoch: 89, train_loss: 0.4127, test_loss: 1.3417, test_f1: 0.5857
 epoch: 90, train_loss: 0.4169, test_loss: 1.3541, test_f1: 0.5704
 epoch: 91, train_loss: 0.4031, test_loss: 1.3868, test_f1: 0.5811
 epoch: 92, train_loss: 0.4104, test_loss: 1.4163, test_f1: 0.5672
 epoch: 93, train_loss: 0.4211, test_loss: 1.3618, test_f1: 0.5512
 epoch: 94, train_loss: 0.3847, test_loss: 1.3632, test_f1: 0.5447
 epoch: 95, train_loss: 0.3963, test_loss: 1.3653, test_f1: 0.5590
 epoch: 96, train_loss: 0.4109, test_loss: 1.4092, test_f1: 0.5513
 epoch: 97, train_loss: 0.4132, test_loss: 1.4593, test_f1: 0.5413
 epoch: 98, train_loss: 0.3913, test_loss: 1.4568, test_f1: 0.5272
 epoch: 99, train_loss: 0.3828, test_loss: 1.3419, test_f1: 0.5518
##################ITERATION #3 ****************************************
 epoch: 0, train_loss: 1.2700, test_loss: 1.1202, test_f1: 0.4257
 epoch: 1, train_loss: 1.1108, test_loss: 1.0420, test_f1: 0.4625
 epoch: 2, train_loss: 1.0634, test_loss: 0.9673, test_f1: 0.4854
 epoch: 3, train_loss: 1.0383, test_loss: 0.9860, test_f1: 0.4655
 epoch: 4, train_loss: 0.9996, test_loss: 0.9755, test_f1: 0.4834
 epoch: 5, train_loss: 0.9939, test_loss: 0.9567, test_f1: 0.5033
 epoch: 6, train_loss: 1.0038, test_loss: 1.0151, test_f1: 0.4853
 epoch: 7, train_loss: 0.9792, test_loss: 1.0339, test_f1: 0.5019
 epoch: 8, train_loss: 0.9577, test_loss: 1.0411, test_f1: 0.4699
 epoch: 9, train_loss: 0.9312, test_loss: 1.0944, test_f1: 0.5008
 epoch: 10, train_loss: 0.9209, test_loss: 0.9716, test_f1: 0.5266
 epoch: 11, train_loss: 0.9103, test_loss: 1.0646, test_f1: 0.5076
 epoch: 12, train_loss: 0.8835, test_loss: 1.0625, test_f1: 0.5470
 epoch: 13, train_loss: 0.8769, test_loss: 1.0438, test_f1: 0.5306
 epoch: 14, train_loss: 0.8582, test_loss: 0.9573, test_f1: 0.5266
 epoch: 15, train_loss: 0.8674, test_loss: 1.0421, test_f1: 0.5192
 epoch: 16, train_loss: 0.8513, test_loss: 1.0453, test_f1: 0.5441
 epoch: 17, train_loss: 0.8478, test_loss: 1.0999, test_f1: 0.5339
 epoch: 18, train_loss: 0.8516, test_loss: 1.1175, test_f1: 0.5318
 epoch: 19, train_loss: 0.8181, test_loss: 1.0729, test_f1: 0.5424
 epoch: 20, train_loss: 0.8121, test_loss: 1.1236, test_f1: 0.5096
 epoch: 21, train_loss: 0.8050, test_loss: 1.0347, test_f1: 0.5408
 epoch: 22, train_loss: 0.8070, test_loss: 1.1318, test_f1: 0.5220
 epoch: 23, train_loss: 0.7898, test_loss: 1.1090, test_f1: 0.5257
 epoch: 24, train_loss: 0.7775, test_loss: 1.1900, test_f1: 0.5277
 epoch: 25, train_loss: 0.8013, test_loss: 1.0729, test_f1: 0.5258
 epoch: 26, train_loss: 0.7887, test_loss: 1.0624, test_f1: 0.5476
 epoch: 27, train_loss: 0.7834, test_loss: 1.1086, test_f1: 0.5279
 epoch: 28, train_loss: 0.7528, test_loss: 1.0628, test_f1: 0.5307
 epoch: 29, train_loss: 0.7608, test_loss: 1.1731, test_f1: 0.5289
 epoch: 30, train_loss: 0.7523, test_loss: 1.1098, test_f1: 0.5484
 epoch: 31, train_loss: 0.7446, test_loss: 1.1089, test_f1: 0.5367
 epoch: 32, train_loss: 0.7289, test_loss: 1.2383, test_f1: 0.5267
 epoch: 33, train_loss: 0.7229, test_loss: 1.0973, test_f1: 0.5706
 epoch: 34, train_loss: 0.7256, test_loss: 1.1896, test_f1: 0.5257
 epoch: 35, train_loss: 0.7081, test_loss: 1.1671, test_f1: 0.5614
 epoch: 36, train_loss: 0.6996, test_loss: 1.2232, test_f1: 0.5277
 epoch: 37, train_loss: 0.7174, test_loss: 1.3031, test_f1: 0.5396
 epoch: 38, train_loss: 0.6952, test_loss: 1.2990, test_f1: 0.5183
 epoch: 39, train_loss: 0.6980, test_loss: 1.1004, test_f1: 0.5219
 epoch: 40, train_loss: 0.6843, test_loss: 1.1388, test_f1: 0.5450
 epoch: 41, train_loss: 0.6823, test_loss: 1.1788, test_f1: 0.5578
 epoch: 42, train_loss: 0.7213, test_loss: 1.1392, test_f1: 0.5300
 epoch: 43, train_loss: 0.6609, test_loss: 1.0687, test_f1: 0.5440
 epoch: 44, train_loss: 0.6627, test_loss: 1.1310, test_f1: 0.5599
 epoch: 45, train_loss: 0.6505, test_loss: 1.2225, test_f1: 0.5535
 epoch: 46, train_loss: 0.6819, test_loss: 1.3540, test_f1: 0.5094
 epoch: 47, train_loss: 0.7719, test_loss: 1.0687, test_f1: 0.5472
 epoch: 48, train_loss: 0.6862, test_loss: 1.1674, test_f1: 0.5376
 epoch: 49, train_loss: 0.6746, test_loss: 1.1020, test_f1: 0.5608
 epoch: 50, train_loss: 0.6623, test_loss: 1.1437, test_f1: 0.5031
 epoch: 51, train_loss: 0.6124, test_loss: 1.1355, test_f1: 0.5593
 epoch: 52, train_loss: 0.5827, test_loss: 1.1602, test_f1: 0.5529
 epoch: 53, train_loss: 0.6054, test_loss: 1.1138, test_f1: 0.5850
 epoch: 54, train_loss: 0.5885, test_loss: 1.1624, test_f1: 0.5444
 epoch: 55, train_loss: 0.5633, test_loss: 1.1879, test_f1: 0.5604
 epoch: 56, train_loss: 0.5867, test_loss: 1.2290, test_f1: 0.5371
 epoch: 57, train_loss: 0.6041, test_loss: 1.3715, test_f1: 0.5144
 epoch: 58, train_loss: 0.5757, test_loss: 1.2962, test_f1: 0.5443
 epoch: 59, train_loss: 0.5692, test_loss: 1.2356, test_f1: 0.5315
 epoch: 60, train_loss: 0.5488, test_loss: 1.2062, test_f1: 0.5641
 epoch: 61, train_loss: 0.5427, test_loss: 1.2126, test_f1: 0.5644
 epoch: 62, train_loss: 0.5319, test_loss: 1.2464, test_f1: 0.5433
 epoch: 63, train_loss: 0.5342, test_loss: 1.3335, test_f1: 0.5334
 epoch: 64, train_loss: 0.5616, test_loss: 1.3079, test_f1: 0.5472
 epoch: 65, train_loss: 0.5447, test_loss: 1.1808, test_f1: 0.5753
 epoch: 66, train_loss: 0.5452, test_loss: 1.2899, test_f1: 0.5566
 epoch: 67, train_loss: 0.5187, test_loss: 1.2650, test_f1: 0.5710
 epoch: 68, train_loss: 0.5174, test_loss: 1.3146, test_f1: 0.5549
 epoch: 69, train_loss: 0.5154, test_loss: 1.2299, test_f1: 0.5563
 epoch: 70, train_loss: 0.5112, test_loss: 1.2635, test_f1: 0.5698
 epoch: 71, train_loss: 0.5137, test_loss: 1.1978, test_f1: 0.5861
 epoch: 72, train_loss: 0.4854, test_loss: 1.3040, test_f1: 0.5599
 epoch: 73, train_loss: 0.5014, test_loss: 1.3649, test_f1: 0.5572
 epoch: 74, train_loss: 0.4884, test_loss: 1.3483, test_f1: 0.5397
 epoch: 75, train_loss: 0.4708, test_loss: 1.3992, test_f1: 0.5818
 epoch: 76, train_loss: 0.4792, test_loss: 1.3448, test_f1: 0.5326
 epoch: 77, train_loss: 0.5232, test_loss: 1.3943, test_f1: 0.5286
 epoch: 78, train_loss: 0.4848, test_loss: 1.3108, test_f1: 0.5518
 epoch: 79, train_loss: 0.4808, test_loss: 1.3191, test_f1: 0.5711
 epoch: 80, train_loss: 0.4569, test_loss: 1.2988, test_f1: 0.5583
 epoch: 81, train_loss: 0.4596, test_loss: 1.4231, test_f1: 0.5434
 epoch: 82, train_loss: 0.4715, test_loss: 1.3247, test_f1: 0.5597
 epoch: 83, train_loss: 0.4491, test_loss: 1.4796, test_f1: 0.5473
 epoch: 84, train_loss: 0.4955, test_loss: 1.2797, test_f1: 0.5704
 epoch: 85, train_loss: 0.4501, test_loss: 1.3203, test_f1: 0.5828
 epoch: 86, train_loss: 0.4602, test_loss: 1.2828, test_f1: 0.5696
 epoch: 87, train_loss: 0.4349, test_loss: 1.3633, test_f1: 0.5704
 epoch: 88, train_loss: 0.4482, test_loss: 1.3514, test_f1: 0.5693
 epoch: 89, train_loss: 0.4329, test_loss: 1.3435, test_f1: 0.5702
 epoch: 90, train_loss: 0.4254, test_loss: 1.4376, test_f1: 0.5651
 epoch: 91, train_loss: 0.4362, test_loss: 1.3409, test_f1: 0.5483
 epoch: 92, train_loss: 0.4279, test_loss: 1.5212, test_f1: 0.5310
 epoch: 93, train_loss: 0.4130, test_loss: 1.4002, test_f1: 0.5673
 epoch: 94, train_loss: 0.4262, test_loss: 1.4397, test_f1: 0.5572
 epoch: 95, train_loss: 0.4138, test_loss: 1.4336, test_f1: 0.5671
 epoch: 96, train_loss: 0.4236, test_loss: 1.4413, test_f1: 0.5689
 epoch: 97, train_loss: 0.4081, test_loss: 1.5350, test_f1: 0.5585
 epoch: 98, train_loss: 0.4022, test_loss: 1.4623, test_f1: 0.5545
 epoch: 99, train_loss: 0.4278, test_loss: 1.4373, test_f1: 0.5453
##################ITERATION #4 ****************************************
 epoch: 0, train_loss: 1.3002, test_loss: 1.1314, test_f1: 0.4209
 epoch: 1, train_loss: 1.1380, test_loss: 1.0751, test_f1: 0.4287
 epoch: 2, train_loss: 1.1025, test_loss: 1.0267, test_f1: 0.4548
 epoch: 3, train_loss: 1.0564, test_loss: 1.0732, test_f1: 0.4277
 epoch: 4, train_loss: 1.0388, test_loss: 0.9907, test_f1: 0.4714
 epoch: 5, train_loss: 0.9905, test_loss: 1.1196, test_f1: 0.4382
 epoch: 6, train_loss: 0.9783, test_loss: 0.9857, test_f1: 0.4812
 epoch: 7, train_loss: 0.9446, test_loss: 0.9559, test_f1: 0.5426
 epoch: 8, train_loss: 0.9475, test_loss: 0.9872, test_f1: 0.4932
 epoch: 9, train_loss: 0.9346, test_loss: 1.0292, test_f1: 0.5013
 epoch: 10, train_loss: 0.9122, test_loss: 1.1409, test_f1: 0.4905
 epoch: 11, train_loss: 0.8878, test_loss: 1.0080, test_f1: 0.5171
 epoch: 12, train_loss: 0.8910, test_loss: 1.0452, test_f1: 0.4960
 epoch: 13, train_loss: 0.8688, test_loss: 1.0554, test_f1: 0.5336
 epoch: 14, train_loss: 0.8733, test_loss: 1.0221, test_f1: 0.5405
 epoch: 15, train_loss: 0.8453, test_loss: 1.0583, test_f1: 0.5371
 epoch: 16, train_loss: 0.8763, test_loss: 1.0494, test_f1: 0.5097
 epoch: 17, train_loss: 0.8445, test_loss: 1.0336, test_f1: 0.5261
 epoch: 18, train_loss: 0.8041, test_loss: 1.0655, test_f1: 0.5577
 epoch: 19, train_loss: 0.8326, test_loss: 0.9978, test_f1: 0.5579
 epoch: 20, train_loss: 0.8077, test_loss: 1.0493, test_f1: 0.5608
 epoch: 21, train_loss: 0.7837, test_loss: 1.0849, test_f1: 0.5200
 epoch: 22, train_loss: 0.7739, test_loss: 1.0690, test_f1: 0.5446
 epoch: 23, train_loss: 0.7755, test_loss: 1.0824, test_f1: 0.5453
 epoch: 24, train_loss: 0.7909, test_loss: 1.0606, test_f1: 0.5629
 epoch: 25, train_loss: 0.7590, test_loss: 1.0636, test_f1: 0.5584
 epoch: 26, train_loss: 0.7493, test_loss: 1.0935, test_f1: 0.5141
 epoch: 27, train_loss: 0.7557, test_loss: 1.0541, test_f1: 0.5671
 epoch: 28, train_loss: 0.7553, test_loss: 1.1409, test_f1: 0.5339
 epoch: 29, train_loss: 0.7731, test_loss: 1.0378, test_f1: 0.5592
 epoch: 30, train_loss: 0.7653, test_loss: 1.0888, test_f1: 0.5551
 epoch: 31, train_loss: 0.7695, test_loss: 1.0456, test_f1: 0.5433
 epoch: 32, train_loss: 0.7221, test_loss: 1.0156, test_f1: 0.5459
 epoch: 33, train_loss: 0.7276, test_loss: 1.1127, test_f1: 0.5041
 epoch: 34, train_loss: 0.7211, test_loss: 1.1538, test_f1: 0.5434
 epoch: 35, train_loss: 0.6902, test_loss: 1.0839, test_f1: 0.5386
 epoch: 36, train_loss: 0.6895, test_loss: 1.0660, test_f1: 0.5711
 epoch: 37, train_loss: 0.6967, test_loss: 1.0801, test_f1: 0.5657
 epoch: 38, train_loss: 0.7102, test_loss: 1.0691, test_f1: 0.5390
 epoch: 39, train_loss: 0.6753, test_loss: 1.0385, test_f1: 0.5441
 epoch: 40, train_loss: 0.6801, test_loss: 1.1111, test_f1: 0.5279
 epoch: 41, train_loss: 0.6611, test_loss: 1.1680, test_f1: 0.5285
 epoch: 42, train_loss: 0.6748, test_loss: 1.1529, test_f1: 0.5453
 epoch: 43, train_loss: 0.6718, test_loss: 1.1202, test_f1: 0.5604
 epoch: 44, train_loss: 0.6424, test_loss: 1.2063, test_f1: 0.5220
 epoch: 45, train_loss: 0.6482, test_loss: 1.1338, test_f1: 0.5389
 epoch: 46, train_loss: 0.6447, test_loss: 1.1733, test_f1: 0.5401
 epoch: 47, train_loss: 0.6346, test_loss: 1.1839, test_f1: 0.5577
 epoch: 48, train_loss: 0.6459, test_loss: 1.1976, test_f1: 0.5624
 epoch: 49, train_loss: 0.6403, test_loss: 1.1140, test_f1: 0.5235
 epoch: 50, train_loss: 0.6487, test_loss: 1.1173, test_f1: 0.5332
 epoch: 51, train_loss: 0.5746, test_loss: 1.1690, test_f1: 0.5310
 epoch: 52, train_loss: 0.5688, test_loss: 1.1566, test_f1: 0.5388
 epoch: 53, train_loss: 0.5296, test_loss: 1.2053, test_f1: 0.5543
 epoch: 54, train_loss: 0.5438, test_loss: 1.1735, test_f1: 0.5602
 epoch: 55, train_loss: 0.5141, test_loss: 1.2922, test_f1: 0.5345
 epoch: 56, train_loss: 0.5264, test_loss: 1.5499, test_f1: 0.5238
 epoch: 57, train_loss: 0.5654, test_loss: 1.1863, test_f1: 0.5460
 epoch: 58, train_loss: 0.5258, test_loss: 1.1686, test_f1: 0.5788
 epoch: 59, train_loss: 0.5224, test_loss: 1.2255, test_f1: 0.5526
 epoch: 60, train_loss: 0.5085, test_loss: 1.3608, test_f1: 0.4806
 epoch: 61, train_loss: 0.5369, test_loss: 1.1987, test_f1: 0.5454
 epoch: 62, train_loss: 0.5060, test_loss: 1.2956, test_f1: 0.5203
 epoch: 63, train_loss: 0.5126, test_loss: 1.2213, test_f1: 0.5220
 epoch: 64, train_loss: 0.4906, test_loss: 1.3296, test_f1: 0.5322
 epoch: 65, train_loss: 0.4941, test_loss: 1.2834, test_f1: 0.5448
 epoch: 66, train_loss: 0.4863, test_loss: 1.3335, test_f1: 0.5514
 epoch: 67, train_loss: 0.4848, test_loss: 1.3665, test_f1: 0.5209
 epoch: 68, train_loss: 0.4725, test_loss: 1.3039, test_f1: 0.5605
 epoch: 69, train_loss: 0.4661, test_loss: 1.2481, test_f1: 0.5728
 epoch: 70, train_loss: 0.4657, test_loss: 1.2782, test_f1: 0.5710
 epoch: 71, train_loss: 0.4737, test_loss: 1.4085, test_f1: 0.5269
 epoch: 72, train_loss: 0.4617, test_loss: 1.4107, test_f1: 0.5388
 epoch: 73, train_loss: 0.4597, test_loss: 1.3565, test_f1: 0.5180
 epoch: 74, train_loss: 0.4480, test_loss: 1.3419, test_f1: 0.5506
 epoch: 75, train_loss: 0.4696, test_loss: 1.2757, test_f1: 0.5288
 epoch: 76, train_loss: 0.4486, test_loss: 1.3243, test_f1: 0.5522
 epoch: 77, train_loss: 0.4328, test_loss: 1.3134, test_f1: 0.5447
 epoch: 78, train_loss: 0.4272, test_loss: 1.3121, test_f1: 0.5858
 epoch: 79, train_loss: 0.4459, test_loss: 1.3315, test_f1: 0.5617
 epoch: 80, train_loss: 0.4185, test_loss: 1.3750, test_f1: 0.5656
 epoch: 81, train_loss: 0.4310, test_loss: 1.3205, test_f1: 0.5594
 epoch: 82, train_loss: 0.4133, test_loss: 1.3402, test_f1: 0.5760
 epoch: 83, train_loss: 0.4192, test_loss: 1.5418, test_f1: 0.5410
 epoch: 84, train_loss: 0.4238, test_loss: 1.4124, test_f1: 0.5467
 epoch: 85, train_loss: 0.4176, test_loss: 1.4433, test_f1: 0.5451
 epoch: 86, train_loss: 0.4107, test_loss: 1.4034, test_f1: 0.5942
 epoch: 87, train_loss: 0.4086, test_loss: 1.4273, test_f1: 0.5641
 epoch: 88, train_loss: 0.4075, test_loss: 1.3390, test_f1: 0.5689
 epoch: 89, train_loss: 0.4344, test_loss: 1.4917, test_f1: 0.5500
 epoch: 90, train_loss: 0.4103, test_loss: 1.4825, test_f1: 0.5600
 epoch: 91, train_loss: 0.3794, test_loss: 1.5765, test_f1: 0.5603
 epoch: 92, train_loss: 0.3976, test_loss: 1.4190, test_f1: 0.5568
 epoch: 93, train_loss: 0.3750, test_loss: 1.4355, test_f1: 0.5598
 epoch: 94, train_loss: 0.3817, test_loss: 1.5183, test_f1: 0.5373
 epoch: 95, train_loss: 0.3796, test_loss: 1.5841, test_f1: 0.5622
 epoch: 96, train_loss: 0.3766, test_loss: 1.3080, test_f1: 0.5696
 epoch: 97, train_loss: 0.3598, test_loss: 1.5990, test_f1: 0.5369
 epoch: 98, train_loss: 0.3646, test_loss: 1.4766, test_f1: 0.5497
 epoch: 99, train_loss: 0.3708, test_loss: 1.6756, test_f1: 0.5684
##################ITERATION #5 ****************************************
 epoch: 0, train_loss: 1.2640, test_loss: 1.1370, test_f1: 0.4618
 epoch: 1, train_loss: 1.1031, test_loss: 1.0376, test_f1: 0.4465
 epoch: 2, train_loss: 1.0499, test_loss: 1.0980, test_f1: 0.4104
 epoch: 3, train_loss: 1.0446, test_loss: 0.9795, test_f1: 0.4675
 epoch: 4, train_loss: 1.0167, test_loss: 0.9928, test_f1: 0.4466
 epoch: 5, train_loss: 1.0045, test_loss: 0.9576, test_f1: 0.4823
 epoch: 6, train_loss: 0.9702, test_loss: 1.0116, test_f1: 0.4632
 epoch: 7, train_loss: 0.9672, test_loss: 1.0034, test_f1: 0.4506
 epoch: 8, train_loss: 0.9580, test_loss: 0.9803, test_f1: 0.5027
 epoch: 9, train_loss: 0.9268, test_loss: 0.9378, test_f1: 0.5499
 epoch: 10, train_loss: 0.9235, test_loss: 0.9677, test_f1: 0.5087
 epoch: 11, train_loss: 0.9094, test_loss: 0.9597, test_f1: 0.5305
 epoch: 12, train_loss: 0.8838, test_loss: 0.9510, test_f1: 0.5488
 epoch: 13, train_loss: 0.8689, test_loss: 0.9816, test_f1: 0.5251
 epoch: 14, train_loss: 0.8589, test_loss: 1.0362, test_f1: 0.5054
 epoch: 15, train_loss: 0.8849, test_loss: 0.9076, test_f1: 0.5236
 epoch: 16, train_loss: 0.8552, test_loss: 0.9730, test_f1: 0.5043
 epoch: 17, train_loss: 0.8658, test_loss: 1.1552, test_f1: 0.4977
 epoch: 18, train_loss: 0.8390, test_loss: 1.0475, test_f1: 0.5251
 epoch: 19, train_loss: 0.8250, test_loss: 0.9932, test_f1: 0.5240
 epoch: 20, train_loss: 0.8254, test_loss: 1.0024, test_f1: 0.5458
 epoch: 21, train_loss: 0.7994, test_loss: 0.9923, test_f1: 0.5347
 epoch: 22, train_loss: 0.7949, test_loss: 1.0100, test_f1: 0.5064
 epoch: 23, train_loss: 0.7731, test_loss: 0.9630, test_f1: 0.5549
 epoch: 24, train_loss: 0.7753, test_loss: 1.0448, test_f1: 0.5117
 epoch: 25, train_loss: 0.7643, test_loss: 0.9729, test_f1: 0.5521
 epoch: 26, train_loss: 0.7498, test_loss: 1.0957, test_f1: 0.5240
 epoch: 27, train_loss: 0.7541, test_loss: 1.1728, test_f1: 0.5224
 epoch: 28, train_loss: 0.7710, test_loss: 1.0249, test_f1: 0.5138
 epoch: 29, train_loss: 0.7841, test_loss: 0.9956, test_f1: 0.5448
 epoch: 30, train_loss: 0.7267, test_loss: 1.0494, test_f1: 0.5257
 epoch: 31, train_loss: 0.7147, test_loss: 1.0624, test_f1: 0.5345
 epoch: 32, train_loss: 0.7188, test_loss: 1.0238, test_f1: 0.5567
 epoch: 33, train_loss: 0.6905, test_loss: 1.1731, test_f1: 0.5369
 epoch: 34, train_loss: 0.7023, test_loss: 1.0981, test_f1: 0.5511
 epoch: 35, train_loss: 0.6938, test_loss: 1.1018, test_f1: 0.5358
 epoch: 36, train_loss: 0.7146, test_loss: 1.2256, test_f1: 0.5320
 epoch: 37, train_loss: 0.6938, test_loss: 1.1162, test_f1: 0.5178
 epoch: 38, train_loss: 0.6848, test_loss: 1.0832, test_f1: 0.5508
 epoch: 39, train_loss: 0.6873, test_loss: 1.0607, test_f1: 0.5626
 epoch: 40, train_loss: 0.6945, test_loss: 1.0398, test_f1: 0.5647
 epoch: 41, train_loss: 0.6568, test_loss: 1.1104, test_f1: 0.5425
 epoch: 42, train_loss: 0.6873, test_loss: 1.2155, test_f1: 0.5422
 epoch: 43, train_loss: 0.6741, test_loss: 1.1529, test_f1: 0.5514
 epoch: 44, train_loss: 0.6415, test_loss: 1.2451, test_f1: 0.5258
 epoch: 45, train_loss: 0.6529, test_loss: 1.2363, test_f1: 0.5352
 epoch: 46, train_loss: 0.6397, test_loss: 1.0307, test_f1: 0.5485
 epoch: 47, train_loss: 0.6336, test_loss: 1.1580, test_f1: 0.5557
 epoch: 48, train_loss: 0.6154, test_loss: 1.2198, test_f1: 0.5250
 epoch: 49, train_loss: 0.6163, test_loss: 1.2579, test_f1: 0.5454
 epoch: 50, train_loss: 0.6047, test_loss: 1.1979, test_f1: 0.5593
 epoch: 51, train_loss: 0.5610, test_loss: 1.2373, test_f1: 0.5631
 epoch: 52, train_loss: 0.5383, test_loss: 1.2655, test_f1: 0.5600
 epoch: 53, train_loss: 0.5253, test_loss: 1.3550, test_f1: 0.5474
 epoch: 54, train_loss: 0.5192, test_loss: 1.3940, test_f1: 0.5375
 epoch: 55, train_loss: 0.5211, test_loss: 1.2865, test_f1: 0.5618
 epoch: 56, train_loss: 0.5528, test_loss: 1.2720, test_f1: 0.5386
 epoch: 57, train_loss: 0.5261, test_loss: 1.2910, test_f1: 0.5450
 epoch: 58, train_loss: 0.5086, test_loss: 1.3065, test_f1: 0.5356
 epoch: 59, train_loss: 0.5102, test_loss: 1.3092, test_f1: 0.5417
 epoch: 60, train_loss: 0.5061, test_loss: 1.3056, test_f1: 0.5501
 epoch: 61, train_loss: 0.4856, test_loss: 1.3109, test_f1: 0.5298
 epoch: 62, train_loss: 0.4961, test_loss: 1.3595, test_f1: 0.5434
 epoch: 63, train_loss: 0.4934, test_loss: 1.3072, test_f1: 0.5594
 epoch: 64, train_loss: 0.4631, test_loss: 1.4153, test_f1: 0.5352
 epoch: 65, train_loss: 0.4823, test_loss: 1.3199, test_f1: 0.5663
 epoch: 66, train_loss: 0.4629, test_loss: 1.3208, test_f1: 0.5527
 epoch: 67, train_loss: 0.4754, test_loss: 1.3430, test_f1: 0.5459
 epoch: 68, train_loss: 0.4620, test_loss: 1.4731, test_f1: 0.5098
 epoch: 69, train_loss: 0.4606, test_loss: 1.4135, test_f1: 0.5349
 epoch: 70, train_loss: 0.4995, test_loss: 1.4280, test_f1: 0.5267
 epoch: 71, train_loss: 0.4696, test_loss: 1.4133, test_f1: 0.5299
 epoch: 72, train_loss: 0.4558, test_loss: 1.4265, test_f1: 0.5519
 epoch: 73, train_loss: 0.4591, test_loss: 1.4115, test_f1: 0.5231
 epoch: 74, train_loss: 0.4448, test_loss: 1.4324, test_f1: 0.5553
 epoch: 75, train_loss: 0.4473, test_loss: 1.4181, test_f1: 0.5936
 epoch: 76, train_loss: 0.4323, test_loss: 1.3957, test_f1: 0.5655
 epoch: 77, train_loss: 0.4199, test_loss: 1.4425, test_f1: 0.5410
 epoch: 78, train_loss: 0.4333, test_loss: 1.4213, test_f1: 0.5446
 epoch: 79, train_loss: 0.4094, test_loss: 1.4740, test_f1: 0.5167
 epoch: 80, train_loss: 0.4160, test_loss: 1.4425, test_f1: 0.5501
 epoch: 81, train_loss: 0.4223, test_loss: 1.3439, test_f1: 0.5599
 epoch: 82, train_loss: 0.4106, test_loss: 1.3858, test_f1: 0.5665
 epoch: 83, train_loss: 0.4282, test_loss: 1.3487, test_f1: 0.5702
 epoch: 84, train_loss: 0.4259, test_loss: 1.4116, test_f1: 0.5742
 epoch: 85, train_loss: 0.4022, test_loss: 1.3655, test_f1: 0.5842
 epoch: 86, train_loss: 0.3971, test_loss: 1.6880, test_f1: 0.5274
 epoch: 87, train_loss: 0.4757, test_loss: 1.4906, test_f1: 0.5492
 epoch: 88, train_loss: 0.4256, test_loss: 1.3575, test_f1: 0.5734
 epoch: 89, train_loss: 0.4209, test_loss: 1.4155, test_f1: 0.5623
 epoch: 90, train_loss: 0.4316, test_loss: 1.3629, test_f1: 0.5717
 epoch: 91, train_loss: 0.4118, test_loss: 1.3945, test_f1: 0.5531
 epoch: 92, train_loss: 0.3953, test_loss: 1.5332, test_f1: 0.5307
 epoch: 93, train_loss: 0.3955, test_loss: 1.5653, test_f1: 0.5546
 epoch: 94, train_loss: 0.4006, test_loss: 1.5903, test_f1: 0.5481
 epoch: 95, train_loss: 0.3635, test_loss: 1.5506, test_f1: 0.5342
 epoch: 96, train_loss: 0.3708, test_loss: 1.6042, test_f1: 0.5538
 epoch: 97, train_loss: 0.3757, test_loss: 1.5978, test_f1: 0.5528
 epoch: 98, train_loss: 0.3670, test_loss: 1.5809, test_f1: 0.5432
 epoch: 99, train_loss: 0.3970, test_loss: 1.7144, test_f1: 0.5352
##################ITERATION #6 ****************************************
 epoch: 0, train_loss: 1.2702, test_loss: 1.0950, test_f1: 0.4864
 epoch: 1, train_loss: 1.1315, test_loss: 1.0548, test_f1: 0.4136
 epoch: 2, train_loss: 1.0695, test_loss: 0.9759, test_f1: 0.4759
 epoch: 3, train_loss: 1.0380, test_loss: 0.9788, test_f1: 0.4569
 epoch: 4, train_loss: 1.0032, test_loss: 1.0320, test_f1: 0.4678
 epoch: 5, train_loss: 0.9984, test_loss: 1.0163, test_f1: 0.5071
 epoch: 6, train_loss: 0.9647, test_loss: 0.9701, test_f1: 0.5166
 epoch: 7, train_loss: 0.9590, test_loss: 0.9848, test_f1: 0.4792
 epoch: 8, train_loss: 0.9451, test_loss: 0.9449, test_f1: 0.5319
 epoch: 9, train_loss: 0.9289, test_loss: 1.0241, test_f1: 0.5304
 epoch: 10, train_loss: 0.9154, test_loss: 0.9988, test_f1: 0.5217
 epoch: 11, train_loss: 0.9025, test_loss: 1.0171, test_f1: 0.5181
 epoch: 12, train_loss: 0.8789, test_loss: 0.9552, test_f1: 0.5319
 epoch: 13, train_loss: 0.8515, test_loss: 1.0244, test_f1: 0.5510
 epoch: 14, train_loss: 0.8575, test_loss: 0.9694, test_f1: 0.5508
 epoch: 15, train_loss: 0.8587, test_loss: 0.9352, test_f1: 0.5470
 epoch: 16, train_loss: 0.8508, test_loss: 0.9678, test_f1: 0.5607
 epoch: 17, train_loss: 0.8370, test_loss: 1.0252, test_f1: 0.4959
 epoch: 18, train_loss: 0.8408, test_loss: 1.0154, test_f1: 0.5220
 epoch: 19, train_loss: 0.8434, test_loss: 1.0322, test_f1: 0.5174
 epoch: 20, train_loss: 0.8171, test_loss: 1.0138, test_f1: 0.5414
 epoch: 21, train_loss: 0.8179, test_loss: 1.0155, test_f1: 0.5318
 epoch: 22, train_loss: 0.8040, test_loss: 0.9936, test_f1: 0.5604
 epoch: 23, train_loss: 0.7973, test_loss: 1.0514, test_f1: 0.5306
 epoch: 24, train_loss: 0.7943, test_loss: 1.0371, test_f1: 0.5377
 epoch: 25, train_loss: 0.7806, test_loss: 1.0537, test_f1: 0.5407
 epoch: 26, train_loss: 0.7609, test_loss: 1.0417, test_f1: 0.5573
 epoch: 27, train_loss: 0.7694, test_loss: 1.0504, test_f1: 0.5529
 epoch: 28, train_loss: 0.7533, test_loss: 1.0373, test_f1: 0.5463
 epoch: 29, train_loss: 0.7664, test_loss: 1.0623, test_f1: 0.5477
 epoch: 30, train_loss: 0.7321, test_loss: 1.1415, test_f1: 0.5301
 epoch: 31, train_loss: 0.7719, test_loss: 1.0791, test_f1: 0.5406
 epoch: 32, train_loss: 0.7470, test_loss: 1.1159, test_f1: 0.5412
 epoch: 33, train_loss: 0.7343, test_loss: 1.0348, test_f1: 0.5457
 epoch: 34, train_loss: 0.7447, test_loss: 1.0543, test_f1: 0.5588
 epoch: 35, train_loss: 0.7206, test_loss: 1.0611, test_f1: 0.5554
 epoch: 36, train_loss: 0.7026, test_loss: 1.0170, test_f1: 0.5695
 epoch: 37, train_loss: 0.6962, test_loss: 1.0268, test_f1: 0.5517
 epoch: 38, train_loss: 0.7002, test_loss: 1.0643, test_f1: 0.5400
 epoch: 39, train_loss: 0.7006, test_loss: 1.1161, test_f1: 0.5434
 epoch: 40, train_loss: 0.7217, test_loss: 1.0495, test_f1: 0.5676
 epoch: 41, train_loss: 0.6859, test_loss: 1.0515, test_f1: 0.5523
 epoch: 42, train_loss: 0.6876, test_loss: 1.0185, test_f1: 0.5473
 epoch: 43, train_loss: 0.6561, test_loss: 1.0242, test_f1: 0.5825
 epoch: 44, train_loss: 0.6663, test_loss: 1.1135, test_f1: 0.5425
 epoch: 45, train_loss: 0.6494, test_loss: 1.0847, test_f1: 0.5605
 epoch: 46, train_loss: 0.6503, test_loss: 1.1176, test_f1: 0.5810
 epoch: 47, train_loss: 0.6446, test_loss: 1.1679, test_f1: 0.5500
 epoch: 48, train_loss: 0.6200, test_loss: 1.1437, test_f1: 0.5384
 epoch: 49, train_loss: 0.6199, test_loss: 1.1575, test_f1: 0.5730
 epoch: 50, train_loss: 0.6304, test_loss: 1.1051, test_f1: 0.5598
 epoch: 51, train_loss: 0.5723, test_loss: 1.1987, test_f1: 0.5438
 epoch: 52, train_loss: 0.5527, test_loss: 1.1269, test_f1: 0.5678
 epoch: 53, train_loss: 0.5557, test_loss: 1.1363, test_f1: 0.5807
 epoch: 54, train_loss: 0.5638, test_loss: 1.1025, test_f1: 0.5832
 epoch: 55, train_loss: 0.5331, test_loss: 1.1083, test_f1: 0.6082
 epoch: 56, train_loss: 0.5343, test_loss: 1.1157, test_f1: 0.5855
 epoch: 57, train_loss: 0.5326, test_loss: 1.2059, test_f1: 0.5681
 epoch: 58, train_loss: 0.5432, test_loss: 1.2301, test_f1: 0.5534
 epoch: 59, train_loss: 0.5009, test_loss: 1.2877, test_f1: 0.5525
 epoch: 60, train_loss: 0.4934, test_loss: 1.1641, test_f1: 0.5651
 epoch: 61, train_loss: 0.4791, test_loss: 1.1315, test_f1: 0.5779
 epoch: 62, train_loss: 0.4971, test_loss: 1.1517, test_f1: 0.5827
 epoch: 63, train_loss: 0.4960, test_loss: 1.2380, test_f1: 0.5795
 epoch: 64, train_loss: 0.4893, test_loss: 1.3101, test_f1: 0.5485
 epoch: 65, train_loss: 0.4979, test_loss: 1.1054, test_f1: 0.5987
 epoch: 66, train_loss: 0.4899, test_loss: 1.4279, test_f1: 0.5659
 epoch: 67, train_loss: 0.4783, test_loss: 1.2802, test_f1: 0.5815
 epoch: 68, train_loss: 0.5108, test_loss: 1.3142, test_f1: 0.5908
 epoch: 69, train_loss: 0.4868, test_loss: 2.0749, test_f1: 0.5672
 epoch: 70, train_loss: 0.4817, test_loss: 1.2719, test_f1: 0.5651
 epoch: 71, train_loss: 0.4692, test_loss: 1.3172, test_f1: 0.5539
 epoch: 72, train_loss: 0.4715, test_loss: 1.2656, test_f1: 0.5786
 epoch: 73, train_loss: 0.4415, test_loss: 1.3822, test_f1: 0.5776
 epoch: 74, train_loss: 0.4533, test_loss: 1.3309, test_f1: 0.5646
 epoch: 75, train_loss: 0.4669, test_loss: 1.3192, test_f1: 0.5661
 epoch: 76, train_loss: 0.4334, test_loss: 1.2833, test_f1: 0.5970
 epoch: 77, train_loss: 0.4238, test_loss: 1.3125, test_f1: 0.5965
 epoch: 78, train_loss: 0.4474, test_loss: 1.3751, test_f1: 0.5753
 epoch: 79, train_loss: 0.4358, test_loss: 1.4137, test_f1: 0.5482
 epoch: 80, train_loss: 0.4403, test_loss: 1.3926, test_f1: 0.5730
 epoch: 81, train_loss: 0.4148, test_loss: 1.3664, test_f1: 0.5582
 epoch: 82, train_loss: 0.4107, test_loss: 1.5429, test_f1: 0.5363
 epoch: 83, train_loss: 0.4324, test_loss: 1.3906, test_f1: 0.5576
 epoch: 84, train_loss: 0.4059, test_loss: 1.4084, test_f1: 0.5518
 epoch: 85, train_loss: 0.4215, test_loss: 1.3663, test_f1: 0.5781
 epoch: 86, train_loss: 0.4338, test_loss: 1.3422, test_f1: 0.5855
 epoch: 87, train_loss: 0.4048, test_loss: 1.3787, test_f1: 0.5704
 epoch: 88, train_loss: 0.4501, test_loss: 1.4817, test_f1: 0.5462
 epoch: 89, train_loss: 0.4041, test_loss: 1.4551, test_f1: 0.5624
 epoch: 90, train_loss: 0.3991, test_loss: 1.4451, test_f1: 0.5534
 epoch: 91, train_loss: 0.3883, test_loss: 1.7228, test_f1: 0.5269
 epoch: 92, train_loss: 0.3859, test_loss: 1.3891, test_f1: 0.5585
 epoch: 93, train_loss: 0.3866, test_loss: 1.4519, test_f1: 0.5669
 epoch: 94, train_loss: 0.3828, test_loss: 1.3728, test_f1: 0.5848
 epoch: 95, train_loss: 0.3757, test_loss: 1.5414, test_f1: 0.5520
 epoch: 96, train_loss: 0.3881, test_loss: 1.4143, test_f1: 0.5888
 epoch: 97, train_loss: 0.3779, test_loss: 1.5724, test_f1: 0.5539
 epoch: 98, train_loss: 0.3860, test_loss: 1.4854, test_f1: 0.5652
 epoch: 99, train_loss: 0.4128, test_loss: 1.3654, test_f1: 0.5952
##################ITERATION #7 ****************************************
 epoch: 0, train_loss: 1.3166, test_loss: 1.2073, test_f1: 0.3751
 epoch: 1, train_loss: 1.1497, test_loss: 1.0591, test_f1: 0.4758
 epoch: 2, train_loss: 1.1084, test_loss: 1.0365, test_f1: 0.4547
 epoch: 3, train_loss: 1.0723, test_loss: 1.0058, test_f1: 0.4486
 epoch: 4, train_loss: 1.0516, test_loss: 1.0045, test_f1: 0.4695
 epoch: 5, train_loss: 1.0216, test_loss: 1.0745, test_f1: 0.4305
 epoch: 6, train_loss: 0.9963, test_loss: 0.9540, test_f1: 0.5173
 epoch: 7, train_loss: 0.9766, test_loss: 1.0414, test_f1: 0.4619
 epoch: 8, train_loss: 0.9841, test_loss: 0.9401, test_f1: 0.5200
 epoch: 9, train_loss: 0.9623, test_loss: 0.9544, test_f1: 0.5056
 epoch: 10, train_loss: 0.9414, test_loss: 0.9763, test_f1: 0.5258
 epoch: 11, train_loss: 0.9343, test_loss: 0.9466, test_f1: 0.5249
 epoch: 12, train_loss: 0.9183, test_loss: 0.9571, test_f1: 0.5069
 epoch: 13, train_loss: 0.9029, test_loss: 1.0232, test_f1: 0.4885
 epoch: 14, train_loss: 0.9015, test_loss: 0.9280, test_f1: 0.5219
 epoch: 15, train_loss: 0.8895, test_loss: 0.9456, test_f1: 0.5427
 epoch: 16, train_loss: 0.8662, test_loss: 0.9970, test_f1: 0.4882
 epoch: 17, train_loss: 0.8765, test_loss: 0.9865, test_f1: 0.5442
 epoch: 18, train_loss: 0.8637, test_loss: 1.0362, test_f1: 0.5410
 epoch: 19, train_loss: 0.8575, test_loss: 0.9345, test_f1: 0.5226
 epoch: 20, train_loss: 0.8373, test_loss: 1.0165, test_f1: 0.5305
 epoch: 21, train_loss: 0.8365, test_loss: 1.0376, test_f1: 0.5623
 epoch: 22, train_loss: 0.8172, test_loss: 1.0315, test_f1: 0.5513
 epoch: 23, train_loss: 0.8036, test_loss: 1.0009, test_f1: 0.5449
 epoch: 24, train_loss: 0.8154, test_loss: 0.9812, test_f1: 0.5474
 epoch: 25, train_loss: 0.8018, test_loss: 1.0040, test_f1: 0.5493
 epoch: 26, train_loss: 0.7924, test_loss: 1.0681, test_f1: 0.5515
 epoch: 27, train_loss: 0.7858, test_loss: 1.0626, test_f1: 0.5458
 epoch: 28, train_loss: 0.7791, test_loss: 1.0012, test_f1: 0.5526
 epoch: 29, train_loss: 0.7678, test_loss: 1.0737, test_f1: 0.5555
 epoch: 30, train_loss: 0.7710, test_loss: 0.9949, test_f1: 0.5566
 epoch: 31, train_loss: 0.7486, test_loss: 1.0606, test_f1: 0.5291
 epoch: 32, train_loss: 0.7780, test_loss: 1.0932, test_f1: 0.5360
 epoch: 33, train_loss: 0.7277, test_loss: 1.0819, test_f1: 0.5444
 epoch: 34, train_loss: 0.7292, test_loss: 1.0605, test_f1: 0.5460
 epoch: 35, train_loss: 0.7488, test_loss: 1.0737, test_f1: 0.5446
 epoch: 36, train_loss: 0.7124, test_loss: 1.1216, test_f1: 0.5616
 epoch: 37, train_loss: 0.7204, test_loss: 0.9724, test_f1: 0.5473
 epoch: 38, train_loss: 0.7187, test_loss: 1.0850, test_f1: 0.5421
 epoch: 39, train_loss: 0.7334, test_loss: 1.0467, test_f1: 0.5463
 epoch: 40, train_loss: 0.7571, test_loss: 1.1286, test_f1: 0.5368
 epoch: 41, train_loss: 0.7206, test_loss: 1.0567, test_f1: 0.5448
 epoch: 42, train_loss: 0.6979, test_loss: 1.1132, test_f1: 0.5296
 epoch: 43, train_loss: 0.6743, test_loss: 1.1057, test_f1: 0.5584
 epoch: 44, train_loss: 0.6730, test_loss: 1.1292, test_f1: 0.5373
 epoch: 45, train_loss: 0.6872, test_loss: 1.0431, test_f1: 0.5511
 epoch: 46, train_loss: 0.6779, test_loss: 1.1263, test_f1: 0.5335
 epoch: 47, train_loss: 0.7272, test_loss: 0.9943, test_f1: 0.5352
 epoch: 48, train_loss: 0.6970, test_loss: 1.0468, test_f1: 0.5444
 epoch: 49, train_loss: 0.6711, test_loss: 1.0797, test_f1: 0.5500
 epoch: 50, train_loss: 0.6662, test_loss: 1.1831, test_f1: 0.5455
 epoch: 51, train_loss: 0.6232, test_loss: 1.1447, test_f1: 0.5641
 epoch: 52, train_loss: 0.5994, test_loss: 1.2978, test_f1: 0.5373
 epoch: 53, train_loss: 0.5965, test_loss: 1.1830, test_f1: 0.5762
 epoch: 54, train_loss: 0.5912, test_loss: 1.3172, test_f1: 0.5240
 epoch: 55, train_loss: 0.5863, test_loss: 1.2253, test_f1: 0.5608
 epoch: 56, train_loss: 0.5773, test_loss: 1.2244, test_f1: 0.5758
 epoch: 57, train_loss: 0.5709, test_loss: 1.1693, test_f1: 0.5714
 epoch: 58, train_loss: 0.5825, test_loss: 1.2115, test_f1: 0.5688
 epoch: 59, train_loss: 0.5612, test_loss: 1.3597, test_f1: 0.5261
 epoch: 60, train_loss: 0.5845, test_loss: 1.1734, test_f1: 0.5710
 epoch: 61, train_loss: 0.5596, test_loss: 1.1657, test_f1: 0.5844
 epoch: 62, train_loss: 0.5600, test_loss: 1.1770, test_f1: 0.5724
 epoch: 63, train_loss: 0.5404, test_loss: 1.2219, test_f1: 0.5682
 epoch: 64, train_loss: 0.5300, test_loss: 1.2653, test_f1: 0.5946
 epoch: 65, train_loss: 0.5255, test_loss: 1.2381, test_f1: 0.5797
 epoch: 66, train_loss: 0.5150, test_loss: 1.2778, test_f1: 0.5893
 epoch: 67, train_loss: 0.5112, test_loss: 1.2129, test_f1: 0.5886
 epoch: 68, train_loss: 0.5233, test_loss: 1.2412, test_f1: 0.5601
 epoch: 69, train_loss: 0.5183, test_loss: 1.2724, test_f1: 0.5657
 epoch: 70, train_loss: 0.5030, test_loss: 1.2247, test_f1: 0.6027
 epoch: 71, train_loss: 0.5230, test_loss: 1.2229, test_f1: 0.5762
 epoch: 72, train_loss: 0.5146, test_loss: 1.2474, test_f1: 0.5530
 epoch: 73, train_loss: 0.4938, test_loss: 1.3131, test_f1: 0.5816
 epoch: 74, train_loss: 0.4966, test_loss: 1.3397, test_f1: 0.5592
 epoch: 75, train_loss: 0.4949, test_loss: 1.3413, test_f1: 0.5819
 epoch: 76, train_loss: 0.5039, test_loss: 1.2749, test_f1: 0.5710
 epoch: 77, train_loss: 0.5188, test_loss: 1.2693, test_f1: 0.5699
 epoch: 78, train_loss: 0.4827, test_loss: 1.2591, test_f1: 0.5810
 epoch: 79, train_loss: 0.4649, test_loss: 1.3557, test_f1: 0.5690
 epoch: 80, train_loss: 0.4722, test_loss: 1.3715, test_f1: 0.5758
 epoch: 81, train_loss: 0.4680, test_loss: 1.2783, test_f1: 0.5678
 epoch: 82, train_loss: 0.4651, test_loss: 1.4094, test_f1: 0.5542
 epoch: 83, train_loss: 0.4348, test_loss: 1.3941, test_f1: 0.5706
 epoch: 84, train_loss: 0.4739, test_loss: 1.3828, test_f1: 0.5802
 epoch: 85, train_loss: 0.4437, test_loss: 1.3778, test_f1: 0.5550
 epoch: 86, train_loss: 0.4476, test_loss: 1.5677, test_f1: 0.5648
 epoch: 87, train_loss: 0.4603, test_loss: 1.4778, test_f1: 0.5481
 epoch: 88, train_loss: 0.4294, test_loss: 1.5429, test_f1: 0.5486
 epoch: 89, train_loss: 0.4311, test_loss: 1.5729, test_f1: 0.5682
 epoch: 90, train_loss: 0.4569, test_loss: 1.5750, test_f1: 0.5410
 epoch: 91, train_loss: 0.4549, test_loss: 1.5611, test_f1: 0.5608
 epoch: 92, train_loss: 0.4524, test_loss: 1.4464, test_f1: 0.5685
 epoch: 93, train_loss: 0.4574, test_loss: 1.3630, test_f1: 0.5587
 epoch: 94, train_loss: 0.4278, test_loss: 1.4348, test_f1: 0.5527
 epoch: 95, train_loss: 0.4277, test_loss: 1.4314, test_f1: 0.5671
 epoch: 96, train_loss: 0.4140, test_loss: 1.5139, test_f1: 0.5551
 epoch: 97, train_loss: 0.4140, test_loss: 1.4527, test_f1: 0.5770
 epoch: 98, train_loss: 0.4040, test_loss: 1.4799, test_f1: 0.5713
 epoch: 99, train_loss: 0.4175, test_loss: 1.4478, test_f1: 0.5635
##################ITERATION #8 ****************************************
 epoch: 0, train_loss: 1.2820, test_loss: 1.1449, test_f1: 0.4493
 epoch: 1, train_loss: 1.1335, test_loss: 1.0706, test_f1: 0.4395
 epoch: 2, train_loss: 1.0940, test_loss: 1.0071, test_f1: 0.4819
 epoch: 3, train_loss: 1.0481, test_loss: 1.0804, test_f1: 0.4431
 epoch: 4, train_loss: 1.0259, test_loss: 0.9711, test_f1: 0.5257
 epoch: 5, train_loss: 0.9969, test_loss: 0.9948, test_f1: 0.4592
 epoch: 6, train_loss: 0.9907, test_loss: 1.0421, test_f1: 0.4731
 epoch: 7, train_loss: 0.9752, test_loss: 1.0244, test_f1: 0.4969
 epoch: 8, train_loss: 0.9589, test_loss: 0.9766, test_f1: 0.5107
 epoch: 9, train_loss: 0.9363, test_loss: 0.9880, test_f1: 0.5252
 epoch: 10, train_loss: 0.9416, test_loss: 0.9319, test_f1: 0.5172
 epoch: 11, train_loss: 0.9134, test_loss: 0.9662, test_f1: 0.5290
 epoch: 12, train_loss: 0.9099, test_loss: 0.9200, test_f1: 0.5720
 epoch: 13, train_loss: 0.8987, test_loss: 0.9814, test_f1: 0.5174
 epoch: 14, train_loss: 0.8858, test_loss: 1.0259, test_f1: 0.5249
 epoch: 15, train_loss: 0.8703, test_loss: 0.9997, test_f1: 0.5414
 epoch: 16, train_loss: 0.8672, test_loss: 0.9663, test_f1: 0.5190
 epoch: 17, train_loss: 0.8491, test_loss: 1.0272, test_f1: 0.5396
 epoch: 18, train_loss: 0.8305, test_loss: 1.0658, test_f1: 0.5117
 epoch: 19, train_loss: 0.8748, test_loss: 1.0382, test_f1: 0.5465
 epoch: 20, train_loss: 0.8160, test_loss: 1.1162, test_f1: 0.5376
 epoch: 21, train_loss: 0.8136, test_loss: 0.9544, test_f1: 0.5843
 epoch: 22, train_loss: 0.8018, test_loss: 1.1389, test_f1: 0.5138
 epoch: 23, train_loss: 0.8023, test_loss: 0.9929, test_f1: 0.5526
 epoch: 24, train_loss: 0.7679, test_loss: 1.1051, test_f1: 0.5448
 epoch: 25, train_loss: 0.7701, test_loss: 1.0592, test_f1: 0.5420
 epoch: 26, train_loss: 0.7636, test_loss: 1.0937, test_f1: 0.5578
 epoch: 27, train_loss: 0.7431, test_loss: 1.1767, test_f1: 0.5347
 epoch: 28, train_loss: 0.7800, test_loss: 1.0559, test_f1: 0.5603
 epoch: 29, train_loss: 0.7408, test_loss: 1.1145, test_f1: 0.5717
 epoch: 30, train_loss: 0.7309, test_loss: 1.1156, test_f1: 0.5365
 epoch: 31, train_loss: 0.7163, test_loss: 1.2608, test_f1: 0.5437
 epoch: 32, train_loss: 0.7209, test_loss: 1.1897, test_f1: 0.5330
 epoch: 33, train_loss: 0.7303, test_loss: 1.1703, test_f1: 0.5577
 epoch: 34, train_loss: 0.7028, test_loss: 1.2731, test_f1: 0.5208
 epoch: 35, train_loss: 0.7122, test_loss: 1.1632, test_f1: 0.5602
 epoch: 36, train_loss: 0.7274, test_loss: 1.1619, test_f1: 0.5657
 epoch: 37, train_loss: 0.7069, test_loss: 1.2032, test_f1: 0.5236
 epoch: 38, train_loss: 0.7179, test_loss: 1.1776, test_f1: 0.5210
 epoch: 39, train_loss: 0.7178, test_loss: 1.1371, test_f1: 0.5528
 epoch: 40, train_loss: 0.6965, test_loss: 1.1695, test_f1: 0.5342
 epoch: 41, train_loss: 0.6797, test_loss: 1.0447, test_f1: 0.5633
 epoch: 42, train_loss: 0.6792, test_loss: 1.1167, test_f1: 0.5424
 epoch: 43, train_loss: 0.6670, test_loss: 1.0720, test_f1: 0.5602
 epoch: 44, train_loss: 0.6483, test_loss: 1.1402, test_f1: 0.5526
 epoch: 45, train_loss: 0.6468, test_loss: 1.0709, test_f1: 0.5532
 epoch: 46, train_loss: 0.6335, test_loss: 1.0670, test_f1: 0.5359
 epoch: 47, train_loss: 0.6638, test_loss: 1.2215, test_f1: 0.5434
 epoch: 48, train_loss: 0.6376, test_loss: 1.2011, test_f1: 0.5177
 epoch: 49, train_loss: 0.6338, test_loss: 1.2105, test_f1: 0.5128
 epoch: 50, train_loss: 0.6219, test_loss: 1.1794, test_f1: 0.5260
 epoch: 51, train_loss: 0.5803, test_loss: 1.2962, test_f1: 0.5415
 epoch: 52, train_loss: 0.5510, test_loss: 1.3419, test_f1: 0.5227
 epoch: 53, train_loss: 0.5512, test_loss: 1.2305, test_f1: 0.5263
 epoch: 54, train_loss: 0.5470, test_loss: 1.2402, test_f1: 0.5518
 epoch: 55, train_loss: 0.5821, test_loss: 1.2329, test_f1: 0.5430
 epoch: 56, train_loss: 0.5365, test_loss: 1.2710, test_f1: 0.5409
 epoch: 57, train_loss: 0.5353, test_loss: 1.2648, test_f1: 0.5365
 epoch: 58, train_loss: 0.5196, test_loss: 1.3232, test_f1: 0.5177
 epoch: 59, train_loss: 0.5315, test_loss: 1.2245, test_f1: 0.5414
 epoch: 60, train_loss: 0.5401, test_loss: 1.2387, test_f1: 0.5367
 epoch: 61, train_loss: 0.5459, test_loss: 1.2508, test_f1: 0.5434
 epoch: 62, train_loss: 0.5327, test_loss: 1.4939, test_f1: 0.5159
 epoch: 63, train_loss: 0.5257, test_loss: 1.3330, test_f1: 0.5409
 epoch: 64, train_loss: 0.5193, test_loss: 1.1784, test_f1: 0.5632
 epoch: 65, train_loss: 0.4923, test_loss: 1.3515, test_f1: 0.5617
 epoch: 66, train_loss: 0.5123, test_loss: 1.2363, test_f1: 0.5608
 epoch: 67, train_loss: 0.4833, test_loss: 1.3071, test_f1: 0.5489
 epoch: 68, train_loss: 0.4905, test_loss: 1.2984, test_f1: 0.5045
 epoch: 69, train_loss: 0.4883, test_loss: 1.3420, test_f1: 0.5375
 epoch: 70, train_loss: 0.4860, test_loss: 1.3794, test_f1: 0.5262
 epoch: 71, train_loss: 0.4737, test_loss: 1.4167, test_f1: 0.5160
 epoch: 72, train_loss: 0.4715, test_loss: 1.5502, test_f1: 0.5216
 epoch: 73, train_loss: 0.4971, test_loss: 1.3856, test_f1: 0.5037
 epoch: 74, train_loss: 0.4803, test_loss: 1.4334, test_f1: 0.5007
 epoch: 75, train_loss: 0.4848, test_loss: 1.3053, test_f1: 0.5596
 epoch: 76, train_loss: 0.4763, test_loss: 1.4178, test_f1: 0.5224
 epoch: 77, train_loss: 0.4621, test_loss: 1.3318, test_f1: 0.5659
 epoch: 78, train_loss: 0.5079, test_loss: 1.3090, test_f1: 0.5555
 epoch: 79, train_loss: 0.4691, test_loss: 1.3042, test_f1: 0.5449
 epoch: 80, train_loss: 0.4464, test_loss: 1.4388, test_f1: 0.5171
 epoch: 81, train_loss: 0.4726, test_loss: 1.2886, test_f1: 0.5560
 epoch: 82, train_loss: 0.4385, test_loss: 1.4086, test_f1: 0.5616
 epoch: 83, train_loss: 0.4557, test_loss: 1.5022, test_f1: 0.5060
 epoch: 84, train_loss: 0.4659, test_loss: 1.5030, test_f1: 0.5052
 epoch: 85, train_loss: 0.4483, test_loss: 1.4042, test_f1: 0.5540
 epoch: 86, train_loss: 0.4561, test_loss: 1.3395, test_f1: 0.5521
 epoch: 87, train_loss: 0.4419, test_loss: 1.3102, test_f1: 0.5147
 epoch: 88, train_loss: 0.4622, test_loss: 1.3857, test_f1: 0.5264
 epoch: 89, train_loss: 0.4404, test_loss: 1.3891, test_f1: 0.5344
 epoch: 90, train_loss: 0.4316, test_loss: 1.3839, test_f1: 0.5243
 epoch: 91, train_loss: 0.4206, test_loss: 1.4021, test_f1: 0.5313
 epoch: 92, train_loss: 0.4234, test_loss: 1.3714, test_f1: 0.5459
 epoch: 93, train_loss: 0.4293, test_loss: 1.4018, test_f1: 0.5270
 epoch: 94, train_loss: 0.4130, test_loss: 1.4138, test_f1: 0.5539
 epoch: 95, train_loss: 0.4354, test_loss: 1.3372, test_f1: 0.5733
 epoch: 96, train_loss: 0.4094, test_loss: 1.4007, test_f1: 0.5474
 epoch: 97, train_loss: 0.3983, test_loss: 1.5521, test_f1: 0.5324
 epoch: 98, train_loss: 0.4053, test_loss: 1.4619, test_f1: 0.5382
 epoch: 99, train_loss: 0.4031, test_loss: 1.3806, test_f1: 0.5607
##################ITERATION #9 ****************************************
 epoch: 0, train_loss: 1.2609, test_loss: 1.0943, test_f1: 0.4002
 epoch: 1, train_loss: 1.1067, test_loss: 1.0261, test_f1: 0.4604
 epoch: 2, train_loss: 1.0461, test_loss: 0.9949, test_f1: 0.4799
 epoch: 3, train_loss: 1.0220, test_loss: 0.9559, test_f1: 0.5110
 epoch: 4, train_loss: 0.9984, test_loss: 1.0077, test_f1: 0.4617
 epoch: 5, train_loss: 0.9759, test_loss: 1.1077, test_f1: 0.4503
 epoch: 6, train_loss: 0.9658, test_loss: 1.0074, test_f1: 0.5144
 epoch: 7, train_loss: 0.9321, test_loss: 0.9761, test_f1: 0.5238
 epoch: 8, train_loss: 0.9130, test_loss: 0.9708, test_f1: 0.4887
 epoch: 9, train_loss: 0.9059, test_loss: 1.0358, test_f1: 0.5529
 epoch: 10, train_loss: 0.9038, test_loss: 1.1216, test_f1: 0.4844
 epoch: 11, train_loss: 0.8957, test_loss: 1.0822, test_f1: 0.4798
 epoch: 12, train_loss: 0.9014, test_loss: 1.0881, test_f1: 0.5487
 epoch: 13, train_loss: 0.8659, test_loss: 1.0020, test_f1: 0.5179
 epoch: 14, train_loss: 0.8756, test_loss: 1.1072, test_f1: 0.5041
 epoch: 15, train_loss: 0.8542, test_loss: 1.0535, test_f1: 0.5221
 epoch: 16, train_loss: 0.8329, test_loss: 1.1077, test_f1: 0.5044
 epoch: 17, train_loss: 0.8260, test_loss: 1.0212, test_f1: 0.5323
 epoch: 18, train_loss: 0.8058, test_loss: 1.1585, test_f1: 0.5268
 epoch: 19, train_loss: 0.8202, test_loss: 1.0078, test_f1: 0.5620
 epoch: 20, train_loss: 0.8075, test_loss: 1.0328, test_f1: 0.5289
 epoch: 21, train_loss: 0.8017, test_loss: 1.0864, test_f1: 0.5493
 epoch: 22, train_loss: 0.7882, test_loss: 1.1680, test_f1: 0.5257
 epoch: 23, train_loss: 0.7989, test_loss: 1.1516, test_f1: 0.5456
 epoch: 24, train_loss: 0.7993, test_loss: 1.0596, test_f1: 0.5498
 epoch: 25, train_loss: 0.7819, test_loss: 1.0190, test_f1: 0.5608
 epoch: 26, train_loss: 0.7713, test_loss: 1.0526, test_f1: 0.5757
 epoch: 27, train_loss: 0.7416, test_loss: 1.1100, test_f1: 0.5475
 epoch: 28, train_loss: 0.7366, test_loss: 1.0594, test_f1: 0.5481
 epoch: 29, train_loss: 0.7565, test_loss: 1.0353, test_f1: 0.5566
 epoch: 30, train_loss: 0.7060, test_loss: 1.1148, test_f1: 0.5560
 epoch: 31, train_loss: 0.7329, test_loss: 1.1240, test_f1: 0.5524
 epoch: 32, train_loss: 0.7114, test_loss: 1.1504, test_f1: 0.5555
 epoch: 33, train_loss: 0.7028, test_loss: 1.1231, test_f1: 0.5410
 epoch: 34, train_loss: 0.6854, test_loss: 1.1363, test_f1: 0.5387
 epoch: 35, train_loss: 0.6869, test_loss: 1.1663, test_f1: 0.5587
 epoch: 36, train_loss: 0.6893, test_loss: 1.1400, test_f1: 0.5319
 epoch: 37, train_loss: 0.7077, test_loss: 1.0935, test_f1: 0.5501
 epoch: 38, train_loss: 0.6802, test_loss: 1.1445, test_f1: 0.5442
 epoch: 39, train_loss: 0.6678, test_loss: 1.1382, test_f1: 0.5358
 epoch: 40, train_loss: 0.7340, test_loss: 1.0574, test_f1: 0.5648
 epoch: 41, train_loss: 0.7035, test_loss: 0.9589, test_f1: 0.5699
 epoch: 42, train_loss: 0.6579, test_loss: 1.1333, test_f1: 0.5403
 epoch: 43, train_loss: 0.6553, test_loss: 1.0524, test_f1: 0.5317
 epoch: 44, train_loss: 0.6461, test_loss: 1.2007, test_f1: 0.5262
 epoch: 45, train_loss: 0.6392, test_loss: 1.0856, test_f1: 0.5512
 epoch: 46, train_loss: 0.6225, test_loss: 1.1891, test_f1: 0.5442
 epoch: 47, train_loss: 0.6314, test_loss: 1.1438, test_f1: 0.5709
 epoch: 48, train_loss: 0.6320, test_loss: 1.0925, test_f1: 0.5618
 epoch: 49, train_loss: 0.6021, test_loss: 1.0853, test_f1: 0.5583
 epoch: 50, train_loss: 0.6110, test_loss: 1.2421, test_f1: 0.5421
 epoch: 51, train_loss: 0.5730, test_loss: 1.1888, test_f1: 0.5517
 epoch: 52, train_loss: 0.5562, test_loss: 1.2144, test_f1: 0.5849
 epoch: 53, train_loss: 0.5290, test_loss: 1.2452, test_f1: 0.5600
 epoch: 54, train_loss: 0.5412, test_loss: 1.2736, test_f1: 0.5852
 epoch: 55, train_loss: 0.5258, test_loss: 1.2932, test_f1: 0.5456
 epoch: 56, train_loss: 0.5307, test_loss: 1.2737, test_f1: 0.5423
 epoch: 57, train_loss: 0.5170, test_loss: 1.2429, test_f1: 0.5625
 epoch: 58, train_loss: 0.5085, test_loss: 1.3020, test_f1: 0.5671
 epoch: 59, train_loss: 0.5019, test_loss: 1.3018, test_f1: 0.5656
 epoch: 60, train_loss: 0.5540, test_loss: 1.2221, test_f1: 0.5666
 epoch: 61, train_loss: 0.4981, test_loss: 1.1779, test_f1: 0.5913
 epoch: 62, train_loss: 0.4937, test_loss: 1.2707, test_f1: 0.5716
 epoch: 63, train_loss: 0.4829, test_loss: 1.3178, test_f1: 0.5596
 epoch: 64, train_loss: 0.4967, test_loss: 1.2857, test_f1: 0.5649
 epoch: 65, train_loss: 0.4739, test_loss: 1.4000, test_f1: 0.5780
 epoch: 66, train_loss: 0.4816, test_loss: 1.3745, test_f1: 0.5931
 epoch: 67, train_loss: 0.4778, test_loss: 1.2916, test_f1: 0.5683
 epoch: 68, train_loss: 0.4606, test_loss: 1.2629, test_f1: 0.5801
 epoch: 69, train_loss: 0.4860, test_loss: 1.2559, test_f1: 0.5906
 epoch: 70, train_loss: 0.5028, test_loss: 1.3064, test_f1: 0.5638
 epoch: 71, train_loss: 0.4733, test_loss: 1.4918, test_f1: 0.5513
 epoch: 72, train_loss: 0.4722, test_loss: 1.4737, test_f1: 0.5560
 epoch: 73, train_loss: 0.4588, test_loss: 1.4879, test_f1: 0.5640
 epoch: 74, train_loss: 0.4852, test_loss: 1.4392, test_f1: 0.5411
 epoch: 75, train_loss: 0.4456, test_loss: 1.5393, test_f1: 0.5444
 epoch: 76, train_loss: 0.4366, test_loss: 1.5055, test_f1: 0.5768
 epoch: 77, train_loss: 0.4526, test_loss: 1.5039, test_f1: 0.5478
 epoch: 78, train_loss: 0.4429, test_loss: 1.5444, test_f1: 0.5482
 epoch: 79, train_loss: 0.4370, test_loss: 1.4682, test_f1: 0.5830
 epoch: 80, train_loss: 0.4552, test_loss: 1.4190, test_f1: 0.6046
 epoch: 81, train_loss: 0.4332, test_loss: 1.5510, test_f1: 0.5414
 epoch: 82, train_loss: 0.4482, test_loss: 1.5061, test_f1: 0.5712
 epoch: 83, train_loss: 0.4340, test_loss: 1.5199, test_f1: 0.5833
 epoch: 84, train_loss: 0.4247, test_loss: 1.4636, test_f1: 0.5979
 epoch: 85, train_loss: 0.3984, test_loss: 1.5478, test_f1: 0.5587
 epoch: 86, train_loss: 0.4134, test_loss: 1.4596, test_f1: 0.5926
 epoch: 87, train_loss: 0.3914, test_loss: 1.7373, test_f1: 0.5340
 epoch: 88, train_loss: 0.3898, test_loss: 1.5570, test_f1: 0.5748
 epoch: 89, train_loss: 0.4237, test_loss: 1.4896, test_f1: 0.5753
 epoch: 90, train_loss: 0.4072, test_loss: 1.5660, test_f1: 0.5761
 epoch: 91, train_loss: 0.4145, test_loss: 1.4604, test_f1: 0.5706
 epoch: 92, train_loss: 0.4053, test_loss: 1.7158, test_f1: 0.5626
 epoch: 93, train_loss: 0.4663, test_loss: 1.3965, test_f1: 0.5996
 epoch: 94, train_loss: 0.4060, test_loss: 1.4382, test_f1: 0.5785
 epoch: 95, train_loss: 0.3877, test_loss: 1.5012, test_f1: 0.5756
 epoch: 96, train_loss: 0.3864, test_loss: 1.5154, test_f1: 0.5581
 epoch: 97, train_loss: 0.3933, test_loss: 1.5022, test_f1: 0.5792
 epoch: 98, train_loss: 0.3688, test_loss: 1.5810, test_f1: 0.5818
 epoch: 99, train_loss: 0.3675, test_loss: 1.5364, test_f1: 0.5887

Training completed in 948.50 seconds
Best F1: 0.6082 at epoch 55
Mean F1 across iterations: 0.5970  0.0076
========================FINAL RESULTS================================
FEGIN weighted F1: 0.6082  0.0076
python main.py --data ltspice_examples --representation component_component --model FEGIN --layers 3 --hiddens 128 --batch_size 32 --lr 0.001 --emb_size 512 --epochs 100 --save_appendix component_component_L3_H128_BS32_LR0.001_E512 --no_val
-----



STDERR:
  File "main.py", line 370, in <module>
    main()
  File "main.py", line 254, in main
    dataset = dataset_class(
  File "/home/philip/projects/ltspice_examples_code_repo/Circuit-Completion-Using-GNNs/component_classification_with_link_prediction_head/evaluation/FEGIN/kernel/circuit_datasets.py", line 15, in __init__
    self.data, self.slices = torch.load(self.processed_paths[0])
  File "/home/philip/.local/lib/python3.8/site-packages/torch/serialization.py", line 1040, in load
    warnings.warn(
  File "/usr/lib/python3.8/warnings.py", line 109, in _showwarnmsg
    sw(msg.message, msg.category, msg.filename, msg.lineno,
  File "main.py", line 47, in warn_with_traceback
    traceback.print_stack(file=log)
/home/philip/projects/ltspice_examples_code_repo/Circuit-Completion-Using-GNNs/component_classification_with_link_prediction_head/evaluation/FEGIN/kernel/circuit_datasets.py:15: FutureWarning: You are using `torch.load` with `weights_only=False` (the current default value), which uses the default pickle module implicitly. It is possible to construct malicious pickle data which will execute arbitrary code during unpickling (See https://github.com/pytorch/pytorch/blob/main/SECURITY.md#untrusted-models for more details). In a future release, the default value for `weights_only` will be flipped to `True`. This limits the functions that could be executed during unpickling. Arbitrary objects will no longer be allowed to be loaded via this mode unless they are explicitly allowlisted by the user via `torch.serialization.add_safe_globals`. We recommend you start setting `weights_only=True` for any use case where you don't have full control of the loaded file. Please open an issue on GitHub for any issues related to this experimental feature.
  self.data, self.slices = torch.load(self.processed_paths[0])
