STDOUT:
Results will be saved in /home/philip/projects/ltspice_examples_code_repo/Circuit-Completion-Using-GNNs/component_classification_with_link_prediction_head/evaluation/FEGIN/results/model_FEGIN_dataset_ltspice_examples
Command line input: python main.py --data ltspice_examples --representation component_pin_net --model FEGIN --layers 3 --hiddens 128 --batch_size 32 --lr 0.0001 --emb_size 128 --epochs 100 --save_appendix component_pin_net_L3_H128_BS32_LR0.0001_E128 --no_val
 is saved.
-----
ltspice_examples - FEGIN
Using 3 layers, 128 hidden units, h = 2
Loading component_pin_net representation dataset
ENTERED
Training FEGIN on component_pin_net representation
Train: 3558, Test: 846
##################ITERATION #0 ****************************************
 epoch: 0, train_loss: 1.3110, test_loss: 1.1888, test_f1: 0.3029
 epoch: 1, train_loss: 1.1821, test_loss: 1.1290, test_f1: 0.3821
 epoch: 2, train_loss: 1.1182, test_loss: 1.0553, test_f1: 0.4584
 epoch: 3, train_loss: 1.0483, test_loss: 1.0264, test_f1: 0.4643
 epoch: 4, train_loss: 1.0029, test_loss: 0.9975, test_f1: 0.5035
 epoch: 5, train_loss: 0.9792, test_loss: 0.9525, test_f1: 0.5016
 epoch: 6, train_loss: 0.9533, test_loss: 0.9647, test_f1: 0.5226
 epoch: 7, train_loss: 0.9310, test_loss: 0.9364, test_f1: 0.5398
 epoch: 8, train_loss: 0.9292, test_loss: 0.9171, test_f1: 0.4958
 epoch: 9, train_loss: 0.9097, test_loss: 0.9257, test_f1: 0.5117
 epoch: 10, train_loss: 0.8990, test_loss: 0.9526, test_f1: 0.4935
 epoch: 11, train_loss: 0.8849, test_loss: 0.9213, test_f1: 0.5400
 epoch: 12, train_loss: 0.8784, test_loss: 0.8676, test_f1: 0.5430
 epoch: 13, train_loss: 0.8671, test_loss: 0.8759, test_f1: 0.5478
 epoch: 14, train_loss: 0.8490, test_loss: 0.8744, test_f1: 0.5428
 epoch: 15, train_loss: 0.8504, test_loss: 0.8737, test_f1: 0.5376
 epoch: 16, train_loss: 0.8403, test_loss: 0.8874, test_f1: 0.5494
 epoch: 17, train_loss: 0.8352, test_loss: 0.8477, test_f1: 0.5473
 epoch: 18, train_loss: 0.8222, test_loss: 0.8315, test_f1: 0.5556
 epoch: 19, train_loss: 0.8121, test_loss: 0.8458, test_f1: 0.5517
 epoch: 20, train_loss: 0.8107, test_loss: 0.8329, test_f1: 0.5630
 epoch: 21, train_loss: 0.8004, test_loss: 0.8419, test_f1: 0.5854
 epoch: 22, train_loss: 0.7937, test_loss: 0.8763, test_f1: 0.5528
 epoch: 23, train_loss: 0.7804, test_loss: 0.8355, test_f1: 0.5412
 epoch: 24, train_loss: 0.7746, test_loss: 0.8255, test_f1: 0.5660
 epoch: 25, train_loss: 0.7711, test_loss: 0.7995, test_f1: 0.5770
 epoch: 26, train_loss: 0.7720, test_loss: 0.8064, test_f1: 0.5801
 epoch: 27, train_loss: 0.7568, test_loss: 0.7944, test_f1: 0.5785
 epoch: 28, train_loss: 0.7594, test_loss: 0.8411, test_f1: 0.5892
 epoch: 29, train_loss: 0.7590, test_loss: 0.8257, test_f1: 0.6209
 epoch: 30, train_loss: 0.7397, test_loss: 0.7822, test_f1: 0.6229
 epoch: 31, train_loss: 0.7377, test_loss: 0.8389, test_f1: 0.5611
 epoch: 32, train_loss: 0.7312, test_loss: 0.8112, test_f1: 0.5910
 epoch: 33, train_loss: 0.7213, test_loss: 0.7945, test_f1: 0.6005
 epoch: 34, train_loss: 0.7220, test_loss: 0.7997, test_f1: 0.6073
 epoch: 35, train_loss: 0.7236, test_loss: 0.7938, test_f1: 0.5872
 epoch: 36, train_loss: 0.7121, test_loss: 0.7843, test_f1: 0.6093
 epoch: 37, train_loss: 0.6984, test_loss: 0.7937, test_f1: 0.6276
 epoch: 38, train_loss: 0.7044, test_loss: 0.8353, test_f1: 0.6419
 epoch: 39, train_loss: 0.6820, test_loss: 0.8132, test_f1: 0.6012
 epoch: 40, train_loss: 0.6925, test_loss: 0.7693, test_f1: 0.6206
 epoch: 41, train_loss: 0.6768, test_loss: 0.7628, test_f1: 0.6293
 epoch: 42, train_loss: 0.6779, test_loss: 0.7819, test_f1: 0.5997
 epoch: 43, train_loss: 0.6838, test_loss: 0.7953, test_f1: 0.6257
 epoch: 44, train_loss: 0.6735, test_loss: 0.9726, test_f1: 0.5686
 epoch: 45, train_loss: 0.6684, test_loss: 0.8729, test_f1: 0.6131
 epoch: 46, train_loss: 0.6562, test_loss: 0.7947, test_f1: 0.5908
 epoch: 47, train_loss: 0.6644, test_loss: 0.8003, test_f1: 0.6303
 epoch: 48, train_loss: 0.6459, test_loss: 0.8304, test_f1: 0.6162
 epoch: 49, train_loss: 0.6570, test_loss: 0.8313, test_f1: 0.6140
 epoch: 50, train_loss: 0.6384, test_loss: 0.8064, test_f1: 0.6348
 epoch: 51, train_loss: 0.6195, test_loss: 0.8040, test_f1: 0.6374
 epoch: 52, train_loss: 0.6187, test_loss: 0.8056, test_f1: 0.6398
 epoch: 53, train_loss: 0.6113, test_loss: 0.8321, test_f1: 0.6330
 epoch: 54, train_loss: 0.6032, test_loss: 0.8058, test_f1: 0.6409
 epoch: 55, train_loss: 0.6077, test_loss: 0.8139, test_f1: 0.6387
 epoch: 56, train_loss: 0.6066, test_loss: 0.8239, test_f1: 0.6372
 epoch: 57, train_loss: 0.5985, test_loss: 0.8293, test_f1: 0.6425
 epoch: 58, train_loss: 0.6009, test_loss: 0.8238, test_f1: 0.6239
 epoch: 59, train_loss: 0.5872, test_loss: 0.8492, test_f1: 0.6421
 epoch: 60, train_loss: 0.5820, test_loss: 0.8450, test_f1: 0.6302
 epoch: 61, train_loss: 0.5876, test_loss: 0.8821, test_f1: 0.6363
 epoch: 62, train_loss: 0.5885, test_loss: 0.8592, test_f1: 0.6449
 epoch: 63, train_loss: 0.5855, test_loss: 0.8305, test_f1: 0.6374
 epoch: 64, train_loss: 0.5734, test_loss: 0.8752, test_f1: 0.6241
 epoch: 65, train_loss: 0.5824, test_loss: 0.8325, test_f1: 0.6381
 epoch: 66, train_loss: 0.5757, test_loss: 0.8523, test_f1: 0.6381
 epoch: 67, train_loss: 0.5777, test_loss: 0.8602, test_f1: 0.6174
 epoch: 68, train_loss: 0.5726, test_loss: 0.8660, test_f1: 0.6428
 epoch: 69, train_loss: 0.5636, test_loss: 0.8878, test_f1: 0.6312
 epoch: 70, train_loss: 0.5777, test_loss: 0.8598, test_f1: 0.6348
 epoch: 71, train_loss: 0.5517, test_loss: 0.8628, test_f1: 0.6173
 epoch: 72, train_loss: 0.5685, test_loss: 0.8381, test_f1: 0.6395
 epoch: 73, train_loss: 0.5642, test_loss: 0.8260, test_f1: 0.6274
 epoch: 74, train_loss: 0.5564, test_loss: 0.8562, test_f1: 0.6501
 epoch: 75, train_loss: 0.5519, test_loss: 0.8545, test_f1: 0.6530
 epoch: 76, train_loss: 0.5466, test_loss: 0.8721, test_f1: 0.6596
 epoch: 77, train_loss: 0.5510, test_loss: 0.8990, test_f1: 0.6294
 epoch: 78, train_loss: 0.5408, test_loss: 0.8775, test_f1: 0.6314
 epoch: 79, train_loss: 0.5433, test_loss: 0.8335, test_f1: 0.6316
 epoch: 80, train_loss: 0.5430, test_loss: 0.8767, test_f1: 0.6344
 epoch: 81, train_loss: 0.5428, test_loss: 0.8118, test_f1: 0.6516
 epoch: 82, train_loss: 0.5334, test_loss: 0.8878, test_f1: 0.6571
 epoch: 83, train_loss: 0.5268, test_loss: 0.9221, test_f1: 0.6024
 epoch: 84, train_loss: 0.5185, test_loss: 0.8827, test_f1: 0.6418
 epoch: 85, train_loss: 0.5261, test_loss: 0.8898, test_f1: 0.6237
 epoch: 86, train_loss: 0.5414, test_loss: 0.9225, test_f1: 0.6205
 epoch: 87, train_loss: 0.5371, test_loss: 0.8949, test_f1: 0.6180
 epoch: 88, train_loss: 0.5260, test_loss: 0.8894, test_f1: 0.6265
 epoch: 89, train_loss: 0.5100, test_loss: 0.8765, test_f1: 0.6364
 epoch: 90, train_loss: 0.5274, test_loss: 0.9286, test_f1: 0.6375
 epoch: 91, train_loss: 0.5045, test_loss: 0.9452, test_f1: 0.6313
 epoch: 92, train_loss: 0.5000, test_loss: 0.9561, test_f1: 0.6231
 epoch: 93, train_loss: 0.5113, test_loss: 0.9077, test_f1: 0.6128
 epoch: 94, train_loss: 0.5083, test_loss: 0.9312, test_f1: 0.6269
 epoch: 95, train_loss: 0.5071, test_loss: 0.9388, test_f1: 0.6336
 epoch: 96, train_loss: 0.5119, test_loss: 0.9566, test_f1: 0.6455
 epoch: 97, train_loss: 0.5110, test_loss: 0.9135, test_f1: 0.6214
 epoch: 98, train_loss: 0.4970, test_loss: 0.9503, test_f1: 0.6287
 epoch: 99, train_loss: 0.4904, test_loss: 0.9875, test_f1: 0.6200
##################ITERATION #1 ****************************************
 epoch: 0, train_loss: 1.2079, test_loss: 1.0505, test_f1: 0.4146
 epoch: 1, train_loss: 1.0398, test_loss: 0.9854, test_f1: 0.5038
 epoch: 2, train_loss: 0.9875, test_loss: 0.9486, test_f1: 0.5061
 epoch: 3, train_loss: 0.9601, test_loss: 0.9333, test_f1: 0.5357
 epoch: 4, train_loss: 0.9384, test_loss: 0.9225, test_f1: 0.5122
 epoch: 5, train_loss: 0.9239, test_loss: 0.8883, test_f1: 0.5412
 epoch: 6, train_loss: 0.9034, test_loss: 0.9157, test_f1: 0.5504
 epoch: 7, train_loss: 0.8973, test_loss: 0.8924, test_f1: 0.5570
 epoch: 8, train_loss: 0.8668, test_loss: 0.8367, test_f1: 0.5645
 epoch: 9, train_loss: 0.8620, test_loss: 0.8425, test_f1: 0.5593
 epoch: 10, train_loss: 0.8375, test_loss: 0.8417, test_f1: 0.5672
 epoch: 11, train_loss: 0.8346, test_loss: 0.8343, test_f1: 0.5704
 epoch: 12, train_loss: 0.8271, test_loss: 0.8134, test_f1: 0.5764
 epoch: 13, train_loss: 0.8181, test_loss: 0.8127, test_f1: 0.5898
 epoch: 14, train_loss: 0.8035, test_loss: 0.8108, test_f1: 0.5661
 epoch: 15, train_loss: 0.8034, test_loss: 0.7953, test_f1: 0.5858
 epoch: 16, train_loss: 0.7843, test_loss: 0.7837, test_f1: 0.6006
 epoch: 17, train_loss: 0.7763, test_loss: 0.7598, test_f1: 0.6207
 epoch: 18, train_loss: 0.7701, test_loss: 0.8007, test_f1: 0.6070
 epoch: 19, train_loss: 0.7518, test_loss: 0.8351, test_f1: 0.6136
 epoch: 20, train_loss: 0.7515, test_loss: 0.7651, test_f1: 0.6090
 epoch: 21, train_loss: 0.7373, test_loss: 0.7509, test_f1: 0.6080
 epoch: 22, train_loss: 0.7243, test_loss: 0.7615, test_f1: 0.6138
 epoch: 23, train_loss: 0.7319, test_loss: 0.7242, test_f1: 0.6327
 epoch: 24, train_loss: 0.7191, test_loss: 0.7338, test_f1: 0.6230
 epoch: 25, train_loss: 0.6994, test_loss: 0.7724, test_f1: 0.6180
 epoch: 26, train_loss: 0.7061, test_loss: 0.7733, test_f1: 0.6178
 epoch: 27, train_loss: 0.6861, test_loss: 0.7753, test_f1: 0.6050
 epoch: 28, train_loss: 0.6895, test_loss: 0.7593, test_f1: 0.6260
 epoch: 29, train_loss: 0.6703, test_loss: 0.7165, test_f1: 0.6731
 epoch: 30, train_loss: 0.6712, test_loss: 0.7423, test_f1: 0.6463
 epoch: 31, train_loss: 0.6627, test_loss: 0.7318, test_f1: 0.6294
 epoch: 32, train_loss: 0.6724, test_loss: 0.7225, test_f1: 0.6261
 epoch: 33, train_loss: 0.6572, test_loss: 0.7153, test_f1: 0.6735
 epoch: 34, train_loss: 0.6515, test_loss: 0.7084, test_f1: 0.6744
 epoch: 35, train_loss: 0.6311, test_loss: 0.7609, test_f1: 0.6345
 epoch: 36, train_loss: 0.6306, test_loss: 0.7114, test_f1: 0.6657
 epoch: 37, train_loss: 0.6200, test_loss: 0.7289, test_f1: 0.6351
 epoch: 38, train_loss: 0.6262, test_loss: 0.6831, test_f1: 0.6677
 epoch: 39, train_loss: 0.6162, test_loss: 0.6890, test_f1: 0.6732
 epoch: 40, train_loss: 0.6027, test_loss: 0.7244, test_f1: 0.6450
 epoch: 41, train_loss: 0.5941, test_loss: 0.7298, test_f1: 0.6417
 epoch: 42, train_loss: 0.5995, test_loss: 0.7209, test_f1: 0.6582
 epoch: 43, train_loss: 0.5963, test_loss: 0.7271, test_f1: 0.6670
 epoch: 44, train_loss: 0.5810, test_loss: 0.7191, test_f1: 0.6397
 epoch: 45, train_loss: 0.5763, test_loss: 0.7201, test_f1: 0.6499
 epoch: 46, train_loss: 0.5844, test_loss: 0.7288, test_f1: 0.6273
 epoch: 47, train_loss: 0.5725, test_loss: 0.7139, test_f1: 0.6450
 epoch: 48, train_loss: 0.5716, test_loss: 0.6788, test_f1: 0.6512
 epoch: 49, train_loss: 0.5648, test_loss: 0.7465, test_f1: 0.6331
 epoch: 50, train_loss: 0.5560, test_loss: 0.7224, test_f1: 0.6745
 epoch: 51, train_loss: 0.5464, test_loss: 0.7314, test_f1: 0.6612
 epoch: 52, train_loss: 0.5403, test_loss: 0.7352, test_f1: 0.6562
 epoch: 53, train_loss: 0.5296, test_loss: 0.7582, test_f1: 0.6402
 epoch: 54, train_loss: 0.5335, test_loss: 0.7712, test_f1: 0.6560
 epoch: 55, train_loss: 0.5144, test_loss: 0.7476, test_f1: 0.6418
 epoch: 56, train_loss: 0.5089, test_loss: 0.7690, test_f1: 0.6459
 epoch: 57, train_loss: 0.5243, test_loss: 0.7114, test_f1: 0.6649
 epoch: 58, train_loss: 0.5164, test_loss: 0.7669, test_f1: 0.6581
 epoch: 59, train_loss: 0.5048, test_loss: 0.7713, test_f1: 0.6622
 epoch: 60, train_loss: 0.5004, test_loss: 0.7826, test_f1: 0.6556
 epoch: 61, train_loss: 0.5022, test_loss: 0.7280, test_f1: 0.6644
 epoch: 62, train_loss: 0.4988, test_loss: 0.7775, test_f1: 0.6652
 epoch: 63, train_loss: 0.5018, test_loss: 0.7973, test_f1: 0.6438
 epoch: 64, train_loss: 0.4932, test_loss: 0.7422, test_f1: 0.6606
 epoch: 65, train_loss: 0.4989, test_loss: 0.7377, test_f1: 0.6668
 epoch: 66, train_loss: 0.4956, test_loss: 0.7793, test_f1: 0.6591
 epoch: 67, train_loss: 0.4921, test_loss: 0.8032, test_f1: 0.6359
 epoch: 68, train_loss: 0.4818, test_loss: 0.7875, test_f1: 0.6573
 epoch: 69, train_loss: 0.4779, test_loss: 0.8279, test_f1: 0.6577
 epoch: 70, train_loss: 0.4811, test_loss: 0.8023, test_f1: 0.6580
 epoch: 71, train_loss: 0.4803, test_loss: 0.8584, test_f1: 0.6514
 epoch: 72, train_loss: 0.4785, test_loss: 0.8457, test_f1: 0.6430
 epoch: 73, train_loss: 0.4731, test_loss: 0.8124, test_f1: 0.6513
 epoch: 74, train_loss: 0.4676, test_loss: 0.8637, test_f1: 0.6574
 epoch: 75, train_loss: 0.4612, test_loss: 0.8785, test_f1: 0.6408
 epoch: 76, train_loss: 0.4697, test_loss: 0.8705, test_f1: 0.6246
 epoch: 77, train_loss: 0.4660, test_loss: 0.8732, test_f1: 0.6493
 epoch: 78, train_loss: 0.4543, test_loss: 0.7830, test_f1: 0.6566
 epoch: 79, train_loss: 0.4546, test_loss: 0.8184, test_f1: 0.6605
 epoch: 80, train_loss: 0.4553, test_loss: 0.8381, test_f1: 0.6405
 epoch: 81, train_loss: 0.4434, test_loss: 0.9098, test_f1: 0.6286
 epoch: 82, train_loss: 0.4480, test_loss: 0.8756, test_f1: 0.6406
 epoch: 83, train_loss: 0.4487, test_loss: 0.8489, test_f1: 0.6440
 epoch: 84, train_loss: 0.4467, test_loss: 0.8292, test_f1: 0.6416
 epoch: 85, train_loss: 0.4364, test_loss: 0.9588, test_f1: 0.6223
 epoch: 86, train_loss: 0.4411, test_loss: 0.8934, test_f1: 0.6376
 epoch: 87, train_loss: 0.4362, test_loss: 0.8546, test_f1: 0.6527
 epoch: 88, train_loss: 0.4366, test_loss: 0.9318, test_f1: 0.6469
 epoch: 89, train_loss: 0.4276, test_loss: 0.8774, test_f1: 0.6421
 epoch: 90, train_loss: 0.4342, test_loss: 0.9044, test_f1: 0.6438
 epoch: 91, train_loss: 0.4374, test_loss: 0.8960, test_f1: 0.6454
 epoch: 92, train_loss: 0.4150, test_loss: 0.8608, test_f1: 0.6364
 epoch: 93, train_loss: 0.4236, test_loss: 0.9318, test_f1: 0.6305
 epoch: 94, train_loss: 0.4277, test_loss: 0.9228, test_f1: 0.6392
 epoch: 95, train_loss: 0.4222, test_loss: 0.9424, test_f1: 0.6297
 epoch: 96, train_loss: 0.4258, test_loss: 0.9666, test_f1: 0.6357
 epoch: 97, train_loss: 0.4200, test_loss: 0.9659, test_f1: 0.6388
 epoch: 98, train_loss: 0.4133, test_loss: 0.9049, test_f1: 0.6309
 epoch: 99, train_loss: 0.4271, test_loss: 0.9485, test_f1: 0.6222
##################ITERATION #2 ****************************************
 epoch: 0, train_loss: 1.1456, test_loss: 1.0206, test_f1: 0.4915
 epoch: 1, train_loss: 1.0145, test_loss: 0.9804, test_f1: 0.4951
 epoch: 2, train_loss: 0.9662, test_loss: 0.9649, test_f1: 0.5235
 epoch: 3, train_loss: 0.9513, test_loss: 0.9351, test_f1: 0.5454
 epoch: 4, train_loss: 0.9390, test_loss: 0.9044, test_f1: 0.5295
 epoch: 5, train_loss: 0.9243, test_loss: 0.8742, test_f1: 0.5424
 epoch: 6, train_loss: 0.9080, test_loss: 0.8690, test_f1: 0.5325
 epoch: 7, train_loss: 0.8915, test_loss: 0.8406, test_f1: 0.5573
 epoch: 8, train_loss: 0.8711, test_loss: 0.8425, test_f1: 0.5467
 epoch: 9, train_loss: 0.8590, test_loss: 0.8410, test_f1: 0.5480
 epoch: 10, train_loss: 0.8502, test_loss: 0.8248, test_f1: 0.5686
 epoch: 11, train_loss: 0.8392, test_loss: 0.7923, test_f1: 0.5833
 epoch: 12, train_loss: 0.8150, test_loss: 0.7942, test_f1: 0.5977
 epoch: 13, train_loss: 0.8140, test_loss: 0.7800, test_f1: 0.6015
 epoch: 14, train_loss: 0.8156, test_loss: 0.7697, test_f1: 0.6057
 epoch: 15, train_loss: 0.7934, test_loss: 0.7895, test_f1: 0.6134
 epoch: 16, train_loss: 0.7845, test_loss: 0.7569, test_f1: 0.6159
 epoch: 17, train_loss: 0.7788, test_loss: 0.7674, test_f1: 0.6218
 epoch: 18, train_loss: 0.7767, test_loss: 0.7644, test_f1: 0.6133
 epoch: 19, train_loss: 0.7589, test_loss: 0.7608, test_f1: 0.6319
 epoch: 20, train_loss: 0.7598, test_loss: 0.7553, test_f1: 0.6207
 epoch: 21, train_loss: 0.7473, test_loss: 0.7401, test_f1: 0.6211
 epoch: 22, train_loss: 0.7279, test_loss: 0.7334, test_f1: 0.6370
 epoch: 23, train_loss: 0.7237, test_loss: 0.7140, test_f1: 0.6477
 epoch: 24, train_loss: 0.7201, test_loss: 0.7329, test_f1: 0.6560
 epoch: 25, train_loss: 0.7034, test_loss: 0.7331, test_f1: 0.6319
 epoch: 26, train_loss: 0.7026, test_loss: 0.7300, test_f1: 0.6588
 epoch: 27, train_loss: 0.7082, test_loss: 0.7153, test_f1: 0.6497
 epoch: 28, train_loss: 0.6873, test_loss: 0.7056, test_f1: 0.6577
 epoch: 29, train_loss: 0.6725, test_loss: 0.7712, test_f1: 0.6309
 epoch: 30, train_loss: 0.6599, test_loss: 0.7104, test_f1: 0.6409
 epoch: 31, train_loss: 0.6616, test_loss: 0.7110, test_f1: 0.6364
 epoch: 32, train_loss: 0.6587, test_loss: 0.7461, test_f1: 0.6455
 epoch: 33, train_loss: 0.6479, test_loss: 0.7265, test_f1: 0.6657
 epoch: 34, train_loss: 0.6377, test_loss: 0.7216, test_f1: 0.6689
 epoch: 35, train_loss: 0.6327, test_loss: 0.7112, test_f1: 0.6738
 epoch: 36, train_loss: 0.6337, test_loss: 0.7336, test_f1: 0.6579
 epoch: 37, train_loss: 0.6244, test_loss: 0.7614, test_f1: 0.6605
 epoch: 38, train_loss: 0.6206, test_loss: 0.7815, test_f1: 0.6311
 epoch: 39, train_loss: 0.6151, test_loss: 0.7297, test_f1: 0.6638
 epoch: 40, train_loss: 0.5986, test_loss: 0.7515, test_f1: 0.6627
 epoch: 41, train_loss: 0.5881, test_loss: 0.7753, test_f1: 0.6472
 epoch: 42, train_loss: 0.5921, test_loss: 0.7781, test_f1: 0.6588
 epoch: 43, train_loss: 0.5915, test_loss: 0.8152, test_f1: 0.6213
 epoch: 44, train_loss: 0.5736, test_loss: 0.7466, test_f1: 0.6635
 epoch: 45, train_loss: 0.5815, test_loss: 0.7623, test_f1: 0.6384
 epoch: 46, train_loss: 0.5713, test_loss: 0.7600, test_f1: 0.6642
 epoch: 47, train_loss: 0.5614, test_loss: 0.7862, test_f1: 0.6293
 epoch: 48, train_loss: 0.5636, test_loss: 0.7736, test_f1: 0.6462
 epoch: 49, train_loss: 0.5661, test_loss: 0.7623, test_f1: 0.6504
 epoch: 50, train_loss: 0.5502, test_loss: 0.7451, test_f1: 0.6599
 epoch: 51, train_loss: 0.5280, test_loss: 0.7826, test_f1: 0.6576
 epoch: 52, train_loss: 0.5237, test_loss: 0.8038, test_f1: 0.6562
 epoch: 53, train_loss: 0.5141, test_loss: 0.7865, test_f1: 0.6595
 epoch: 54, train_loss: 0.5103, test_loss: 0.8104, test_f1: 0.6432
 epoch: 55, train_loss: 0.4929, test_loss: 0.7794, test_f1: 0.6681
 epoch: 56, train_loss: 0.5179, test_loss: 0.7994, test_f1: 0.6495
 epoch: 57, train_loss: 0.5043, test_loss: 0.7970, test_f1: 0.6538
 epoch: 58, train_loss: 0.4885, test_loss: 0.8141, test_f1: 0.6646
 epoch: 59, train_loss: 0.4981, test_loss: 0.8185, test_f1: 0.6531
 epoch: 60, train_loss: 0.5001, test_loss: 0.8243, test_f1: 0.6497
 epoch: 61, train_loss: 0.4895, test_loss: 0.7934, test_f1: 0.6617
 epoch: 62, train_loss: 0.4923, test_loss: 0.8301, test_f1: 0.6580
 epoch: 63, train_loss: 0.4851, test_loss: 0.8658, test_f1: 0.6501
 epoch: 64, train_loss: 0.4828, test_loss: 0.8745, test_f1: 0.6546
 epoch: 65, train_loss: 0.4852, test_loss: 0.8312, test_f1: 0.6495
 epoch: 66, train_loss: 0.4827, test_loss: 0.7906, test_f1: 0.6823
 epoch: 67, train_loss: 0.4752, test_loss: 0.8241, test_f1: 0.6526
 epoch: 68, train_loss: 0.4666, test_loss: 0.8632, test_f1: 0.6534
 epoch: 69, train_loss: 0.4631, test_loss: 0.8615, test_f1: 0.6541
 epoch: 70, train_loss: 0.4656, test_loss: 0.8343, test_f1: 0.6783
 epoch: 71, train_loss: 0.4629, test_loss: 0.8909, test_f1: 0.6499
 epoch: 72, train_loss: 0.4513, test_loss: 0.8747, test_f1: 0.6586
 epoch: 73, train_loss: 0.4597, test_loss: 0.9003, test_f1: 0.6465
 epoch: 74, train_loss: 0.4561, test_loss: 0.9380, test_f1: 0.6418
 epoch: 75, train_loss: 0.4532, test_loss: 0.9459, test_f1: 0.6575
 epoch: 76, train_loss: 0.4596, test_loss: 0.9171, test_f1: 0.6580
 epoch: 77, train_loss: 0.4504, test_loss: 0.9450, test_f1: 0.6563
 epoch: 78, train_loss: 0.4472, test_loss: 0.9107, test_f1: 0.6479
 epoch: 79, train_loss: 0.4381, test_loss: 0.9839, test_f1: 0.6521
 epoch: 80, train_loss: 0.4403, test_loss: 0.9735, test_f1: 0.6552
 epoch: 81, train_loss: 0.4407, test_loss: 0.9518, test_f1: 0.6685
 epoch: 82, train_loss: 0.4198, test_loss: 0.9436, test_f1: 0.6591
 epoch: 83, train_loss: 0.4330, test_loss: 0.9824, test_f1: 0.6612
 epoch: 84, train_loss: 0.4445, test_loss: 0.9924, test_f1: 0.6482
 epoch: 85, train_loss: 0.4283, test_loss: 1.0069, test_f1: 0.6406
 epoch: 86, train_loss: 0.4501, test_loss: 0.9356, test_f1: 0.6773
 epoch: 87, train_loss: 0.4297, test_loss: 0.9468, test_f1: 0.6640
 epoch: 88, train_loss: 0.4237, test_loss: 1.0462, test_f1: 0.6332
 epoch: 89, train_loss: 0.4098, test_loss: 0.9829, test_f1: 0.6620
 epoch: 90, train_loss: 0.4243, test_loss: 0.9524, test_f1: 0.6628
 epoch: 91, train_loss: 0.4037, test_loss: 1.0409, test_f1: 0.6393
 epoch: 92, train_loss: 0.4321, test_loss: 1.0234, test_f1: 0.6642
 epoch: 93, train_loss: 0.4253, test_loss: 1.0062, test_f1: 0.6635
 epoch: 94, train_loss: 0.4111, test_loss: 0.9944, test_f1: 0.6567
 epoch: 95, train_loss: 0.4132, test_loss: 1.0699, test_f1: 0.6684
 epoch: 96, train_loss: 0.4153, test_loss: 1.0414, test_f1: 0.6731
 epoch: 97, train_loss: 0.4202, test_loss: 1.0331, test_f1: 0.6539
 epoch: 98, train_loss: 0.4112, test_loss: 1.0196, test_f1: 0.6729
 epoch: 99, train_loss: 0.4007, test_loss: 1.0452, test_f1: 0.6601
##################ITERATION #3 ****************************************
 epoch: 0, train_loss: 1.1194, test_loss: 1.0070, test_f1: 0.4621
 epoch: 1, train_loss: 1.0093, test_loss: 0.9546, test_f1: 0.4784
 epoch: 2, train_loss: 0.9791, test_loss: 0.9508, test_f1: 0.5118
 epoch: 3, train_loss: 0.9504, test_loss: 0.9293, test_f1: 0.5022
 epoch: 4, train_loss: 0.9412, test_loss: 0.9171, test_f1: 0.5000
 epoch: 5, train_loss: 0.9285, test_loss: 0.9166, test_f1: 0.5230
 epoch: 6, train_loss: 0.9146, test_loss: 0.9039, test_f1: 0.5515
 epoch: 7, train_loss: 0.8971, test_loss: 0.8875, test_f1: 0.5343
 epoch: 8, train_loss: 0.8822, test_loss: 0.8702, test_f1: 0.5021
 epoch: 9, train_loss: 0.8628, test_loss: 0.8653, test_f1: 0.5100
 epoch: 10, train_loss: 0.8504, test_loss: 0.8548, test_f1: 0.5401
 epoch: 11, train_loss: 0.8507, test_loss: 0.8440, test_f1: 0.5532
 epoch: 12, train_loss: 0.8405, test_loss: 0.8208, test_f1: 0.5405
 epoch: 13, train_loss: 0.8231, test_loss: 0.8077, test_f1: 0.5790
 epoch: 14, train_loss: 0.8216, test_loss: 0.8493, test_f1: 0.5787
 epoch: 15, train_loss: 0.8036, test_loss: 0.7919, test_f1: 0.5772
 epoch: 16, train_loss: 0.7888, test_loss: 0.7909, test_f1: 0.6033
 epoch: 17, train_loss: 0.7935, test_loss: 0.7842, test_f1: 0.5810
 epoch: 18, train_loss: 0.7898, test_loss: 0.8365, test_f1: 0.5918
 epoch: 19, train_loss: 0.7738, test_loss: 0.8085, test_f1: 0.5975
 epoch: 20, train_loss: 0.7649, test_loss: 0.7881, test_f1: 0.6079
 epoch: 21, train_loss: 0.7585, test_loss: 0.7886, test_f1: 0.6177
 epoch: 22, train_loss: 0.7512, test_loss: 0.7691, test_f1: 0.5924
 epoch: 23, train_loss: 0.7300, test_loss: 0.7873, test_f1: 0.6193
 epoch: 24, train_loss: 0.7322, test_loss: 0.7523, test_f1: 0.6217
 epoch: 25, train_loss: 0.7274, test_loss: 0.7761, test_f1: 0.6262
 epoch: 26, train_loss: 0.7064, test_loss: 0.7536, test_f1: 0.6307
 epoch: 27, train_loss: 0.7095, test_loss: 0.7488, test_f1: 0.6511
 epoch: 28, train_loss: 0.7078, test_loss: 0.7624, test_f1: 0.6224
 epoch: 29, train_loss: 0.6868, test_loss: 0.7550, test_f1: 0.6513
 epoch: 30, train_loss: 0.6966, test_loss: 0.7533, test_f1: 0.6277
 epoch: 31, train_loss: 0.6862, test_loss: 0.7591, test_f1: 0.6235
 epoch: 32, train_loss: 0.6695, test_loss: 0.7536, test_f1: 0.6585
 epoch: 33, train_loss: 0.6691, test_loss: 0.7846, test_f1: 0.6295
 epoch: 34, train_loss: 0.6619, test_loss: 0.7766, test_f1: 0.6374
 epoch: 35, train_loss: 0.6623, test_loss: 0.7914, test_f1: 0.6296
 epoch: 36, train_loss: 0.6524, test_loss: 0.7485, test_f1: 0.6505
 epoch: 37, train_loss: 0.6489, test_loss: 0.7771, test_f1: 0.6623
 epoch: 38, train_loss: 0.6447, test_loss: 0.7400, test_f1: 0.6476
 epoch: 39, train_loss: 0.6292, test_loss: 0.7525, test_f1: 0.6425
 epoch: 40, train_loss: 0.6246, test_loss: 0.7509, test_f1: 0.6532
 epoch: 41, train_loss: 0.6190, test_loss: 0.7549, test_f1: 0.6684
 epoch: 42, train_loss: 0.6229, test_loss: 0.7433, test_f1: 0.6564
 epoch: 43, train_loss: 0.6151, test_loss: 0.7712, test_f1: 0.6451
 epoch: 44, train_loss: 0.6181, test_loss: 0.8311, test_f1: 0.6226
 epoch: 45, train_loss: 0.5955, test_loss: 0.7930, test_f1: 0.6321
 epoch: 46, train_loss: 0.5955, test_loss: 0.7932, test_f1: 0.6663
 epoch: 47, train_loss: 0.6009, test_loss: 0.7761, test_f1: 0.6305
 epoch: 48, train_loss: 0.5851, test_loss: 0.8241, test_f1: 0.6216
 epoch: 49, train_loss: 0.5768, test_loss: 0.7955, test_f1: 0.6701
 epoch: 50, train_loss: 0.5733, test_loss: 0.8178, test_f1: 0.6444
 epoch: 51, train_loss: 0.5493, test_loss: 0.8466, test_f1: 0.6417
 epoch: 52, train_loss: 0.5405, test_loss: 0.8510, test_f1: 0.6620
 epoch: 53, train_loss: 0.5522, test_loss: 0.8354, test_f1: 0.6497
 epoch: 54, train_loss: 0.5411, test_loss: 0.8638, test_f1: 0.6711
 epoch: 55, train_loss: 0.5464, test_loss: 0.8146, test_f1: 0.6683
 epoch: 56, train_loss: 0.5349, test_loss: 0.8447, test_f1: 0.6591
 epoch: 57, train_loss: 0.5275, test_loss: 0.8274, test_f1: 0.6631
 epoch: 58, train_loss: 0.5335, test_loss: 0.8286, test_f1: 0.6539
 epoch: 59, train_loss: 0.5209, test_loss: 0.8410, test_f1: 0.6817
 epoch: 60, train_loss: 0.5188, test_loss: 0.8038, test_f1: 0.6584
 epoch: 61, train_loss: 0.5255, test_loss: 0.8474, test_f1: 0.6874
 epoch: 62, train_loss: 0.5191, test_loss: 0.8638, test_f1: 0.6411
 epoch: 63, train_loss: 0.5233, test_loss: 0.8539, test_f1: 0.6605
 epoch: 64, train_loss: 0.5151, test_loss: 0.8754, test_f1: 0.6689
 epoch: 65, train_loss: 0.5073, test_loss: 0.8730, test_f1: 0.6671
 epoch: 66, train_loss: 0.5145, test_loss: 0.8834, test_f1: 0.6673
 epoch: 67, train_loss: 0.4948, test_loss: 0.8691, test_f1: 0.6475
 epoch: 68, train_loss: 0.5060, test_loss: 0.8633, test_f1: 0.6484
 epoch: 69, train_loss: 0.4926, test_loss: 0.8695, test_f1: 0.6485
 epoch: 70, train_loss: 0.4918, test_loss: 0.9207, test_f1: 0.6531
 epoch: 71, train_loss: 0.4916, test_loss: 0.8775, test_f1: 0.6477
 epoch: 72, train_loss: 0.4821, test_loss: 0.8864, test_f1: 0.6677
 epoch: 73, train_loss: 0.4891, test_loss: 0.9064, test_f1: 0.6562
 epoch: 74, train_loss: 0.4796, test_loss: 0.9461, test_f1: 0.6460
 epoch: 75, train_loss: 0.4815, test_loss: 0.8745, test_f1: 0.6420
 epoch: 76, train_loss: 0.4703, test_loss: 0.9370, test_f1: 0.6456
 epoch: 77, train_loss: 0.4818, test_loss: 0.9500, test_f1: 0.6559
 epoch: 78, train_loss: 0.4749, test_loss: 0.9696, test_f1: 0.6556
 epoch: 79, train_loss: 0.4752, test_loss: 0.9724, test_f1: 0.6583
 epoch: 80, train_loss: 0.4565, test_loss: 0.9435, test_f1: 0.6496
 epoch: 81, train_loss: 0.4716, test_loss: 0.9348, test_f1: 0.6490
 epoch: 82, train_loss: 0.4557, test_loss: 0.9715, test_f1: 0.6479
 epoch: 83, train_loss: 0.4709, test_loss: 1.0064, test_f1: 0.6483
 epoch: 84, train_loss: 0.4479, test_loss: 0.9513, test_f1: 0.6600
 epoch: 85, train_loss: 0.4493, test_loss: 1.0014, test_f1: 0.6463
 epoch: 86, train_loss: 0.4586, test_loss: 1.0196, test_f1: 0.6563
 epoch: 87, train_loss: 0.4520, test_loss: 1.0335, test_f1: 0.6450
 epoch: 88, train_loss: 0.4443, test_loss: 0.9445, test_f1: 0.6358
 epoch: 89, train_loss: 0.4501, test_loss: 0.9685, test_f1: 0.6469
 epoch: 90, train_loss: 0.4299, test_loss: 0.9978, test_f1: 0.6471
 epoch: 91, train_loss: 0.4499, test_loss: 1.0021, test_f1: 0.6612
 epoch: 92, train_loss: 0.4343, test_loss: 1.0351, test_f1: 0.6698
 epoch: 93, train_loss: 0.4495, test_loss: 0.9903, test_f1: 0.6629
 epoch: 94, train_loss: 0.4434, test_loss: 0.9703, test_f1: 0.6394
 epoch: 95, train_loss: 0.4211, test_loss: 0.9789, test_f1: 0.6539
 epoch: 96, train_loss: 0.4180, test_loss: 1.0303, test_f1: 0.6484
 epoch: 97, train_loss: 0.4266, test_loss: 1.0019, test_f1: 0.6648
 epoch: 98, train_loss: 0.4094, test_loss: 1.1031, test_f1: 0.6457
 epoch: 99, train_loss: 0.4140, test_loss: 1.1637, test_f1: 0.6514
##################ITERATION #4 ****************************************
 epoch: 0, train_loss: 1.1365, test_loss: 0.9825, test_f1: 0.4693
 epoch: 1, train_loss: 0.9893, test_loss: 0.9512, test_f1: 0.4806
 epoch: 2, train_loss: 0.9662, test_loss: 0.9393, test_f1: 0.5097
 epoch: 3, train_loss: 0.9388, test_loss: 0.8994, test_f1: 0.5018
 epoch: 4, train_loss: 0.9262, test_loss: 0.9155, test_f1: 0.5671
 epoch: 5, train_loss: 0.9154, test_loss: 0.8867, test_f1: 0.5570
 epoch: 6, train_loss: 0.8947, test_loss: 0.8596, test_f1: 0.5419
 epoch: 7, train_loss: 0.8829, test_loss: 0.8444, test_f1: 0.5730
 epoch: 8, train_loss: 0.8623, test_loss: 0.8363, test_f1: 0.5648
 epoch: 9, train_loss: 0.8519, test_loss: 0.8194, test_f1: 0.5780
 epoch: 10, train_loss: 0.8410, test_loss: 0.8220, test_f1: 0.5999
 epoch: 11, train_loss: 0.8291, test_loss: 0.8082, test_f1: 0.5798
 epoch: 12, train_loss: 0.8189, test_loss: 0.8037, test_f1: 0.5614
 epoch: 13, train_loss: 0.7954, test_loss: 0.7873, test_f1: 0.5866
 epoch: 14, train_loss: 0.7876, test_loss: 0.7814, test_f1: 0.6274
 epoch: 15, train_loss: 0.7818, test_loss: 0.7593, test_f1: 0.6129
 epoch: 16, train_loss: 0.7792, test_loss: 0.7804, test_f1: 0.6642
 epoch: 17, train_loss: 0.7766, test_loss: 0.7609, test_f1: 0.6374
 epoch: 18, train_loss: 0.7603, test_loss: 0.7524, test_f1: 0.6663
 epoch: 19, train_loss: 0.7534, test_loss: 0.7394, test_f1: 0.6336
 epoch: 20, train_loss: 0.7419, test_loss: 0.7335, test_f1: 0.6609
 epoch: 21, train_loss: 0.7333, test_loss: 0.7353, test_f1: 0.6490
 epoch: 22, train_loss: 0.7271, test_loss: 0.7381, test_f1: 0.6545
 epoch: 23, train_loss: 0.7135, test_loss: 0.7340, test_f1: 0.6603
 epoch: 24, train_loss: 0.7029, test_loss: 0.7739, test_f1: 0.6463
 epoch: 25, train_loss: 0.7040, test_loss: 0.7269, test_f1: 0.6526
 epoch: 26, train_loss: 0.6896, test_loss: 0.7076, test_f1: 0.6915
 epoch: 27, train_loss: 0.6835, test_loss: 0.7182, test_f1: 0.6948
 epoch: 28, train_loss: 0.6646, test_loss: 0.7004, test_f1: 0.6696
 epoch: 29, train_loss: 0.6671, test_loss: 0.7151, test_f1: 0.6643
 epoch: 30, train_loss: 0.6672, test_loss: 0.7570, test_f1: 0.6430
 epoch: 31, train_loss: 0.6497, test_loss: 0.7162, test_f1: 0.6751
 epoch: 32, train_loss: 0.6604, test_loss: 0.7088, test_f1: 0.6843
 epoch: 33, train_loss: 0.6458, test_loss: 0.7423, test_f1: 0.6833
 epoch: 34, train_loss: 0.6351, test_loss: 0.7150, test_f1: 0.6700
 epoch: 35, train_loss: 0.6338, test_loss: 0.7050, test_f1: 0.6812
 epoch: 36, train_loss: 0.6218, test_loss: 0.7086, test_f1: 0.6582
 epoch: 37, train_loss: 0.6164, test_loss: 0.7279, test_f1: 0.6502
 epoch: 38, train_loss: 0.6206, test_loss: 0.7887, test_f1: 0.6334
 epoch: 39, train_loss: 0.6043, test_loss: 0.7063, test_f1: 0.6606
 epoch: 40, train_loss: 0.5938, test_loss: 0.7187, test_f1: 0.6733
 epoch: 41, train_loss: 0.5958, test_loss: 0.7423, test_f1: 0.6481
 epoch: 42, train_loss: 0.5982, test_loss: 0.7337, test_f1: 0.6521
 epoch: 43, train_loss: 0.5899, test_loss: 0.7191, test_f1: 0.6775
 epoch: 44, train_loss: 0.5682, test_loss: 0.6962, test_f1: 0.6712
 epoch: 45, train_loss: 0.5664, test_loss: 0.7686, test_f1: 0.6610
 epoch: 46, train_loss: 0.5636, test_loss: 0.7608, test_f1: 0.6624
 epoch: 47, train_loss: 0.5638, test_loss: 0.7307, test_f1: 0.6627
 epoch: 48, train_loss: 0.5620, test_loss: 0.7380, test_f1: 0.7017
 epoch: 49, train_loss: 0.5524, test_loss: 0.7830, test_f1: 0.6517
 epoch: 50, train_loss: 0.5434, test_loss: 0.7645, test_f1: 0.6634
 epoch: 51, train_loss: 0.5226, test_loss: 0.8064, test_f1: 0.6460
 epoch: 52, train_loss: 0.5185, test_loss: 0.7272, test_f1: 0.6664
 epoch: 53, train_loss: 0.5157, test_loss: 0.7756, test_f1: 0.6548
 epoch: 54, train_loss: 0.5074, test_loss: 0.7646, test_f1: 0.6671
 epoch: 55, train_loss: 0.4963, test_loss: 0.7533, test_f1: 0.6674
 epoch: 56, train_loss: 0.5082, test_loss: 0.7981, test_f1: 0.6571
 epoch: 57, train_loss: 0.5039, test_loss: 0.7536, test_f1: 0.6673
 epoch: 58, train_loss: 0.4958, test_loss: 0.7927, test_f1: 0.6580
 epoch: 59, train_loss: 0.4878, test_loss: 0.7901, test_f1: 0.6391
 epoch: 60, train_loss: 0.4927, test_loss: 0.7744, test_f1: 0.6566
 epoch: 61, train_loss: 0.4865, test_loss: 0.8172, test_f1: 0.6485
 epoch: 62, train_loss: 0.4761, test_loss: 0.8320, test_f1: 0.6541
 epoch: 63, train_loss: 0.4882, test_loss: 0.8288, test_f1: 0.6611
 epoch: 64, train_loss: 0.4821, test_loss: 0.8713, test_f1: 0.6568
 epoch: 65, train_loss: 0.4759, test_loss: 0.9025, test_f1: 0.6480
 epoch: 66, train_loss: 0.4653, test_loss: 0.8644, test_f1: 0.6372
 epoch: 67, train_loss: 0.4591, test_loss: 0.8838, test_f1: 0.6488
 epoch: 68, train_loss: 0.4589, test_loss: 0.8099, test_f1: 0.6426
 epoch: 69, train_loss: 0.4680, test_loss: 0.9138, test_f1: 0.6342
 epoch: 70, train_loss: 0.4801, test_loss: 0.8540, test_f1: 0.6400
 epoch: 71, train_loss: 0.4590, test_loss: 0.8478, test_f1: 0.6462
 epoch: 72, train_loss: 0.4721, test_loss: 0.9113, test_f1: 0.6437
 epoch: 73, train_loss: 0.4544, test_loss: 0.8875, test_f1: 0.6414
 epoch: 74, train_loss: 0.4500, test_loss: 0.9080, test_f1: 0.6346
 epoch: 75, train_loss: 0.4485, test_loss: 0.8716, test_f1: 0.6489
 epoch: 76, train_loss: 0.4427, test_loss: 0.8716, test_f1: 0.6542
 epoch: 77, train_loss: 0.4497, test_loss: 0.8788, test_f1: 0.6616
 epoch: 78, train_loss: 0.4398, test_loss: 0.8685, test_f1: 0.6571
 epoch: 79, train_loss: 0.4321, test_loss: 0.9238, test_f1: 0.6430
 epoch: 80, train_loss: 0.4308, test_loss: 0.9021, test_f1: 0.6449
 epoch: 81, train_loss: 0.4304, test_loss: 0.8893, test_f1: 0.6567
 epoch: 82, train_loss: 0.4267, test_loss: 0.9466, test_f1: 0.6533
 epoch: 83, train_loss: 0.4309, test_loss: 0.9597, test_f1: 0.6538
 epoch: 84, train_loss: 0.4286, test_loss: 1.0064, test_f1: 0.6428
 epoch: 85, train_loss: 0.4143, test_loss: 0.9522, test_f1: 0.6489
 epoch: 86, train_loss: 0.4183, test_loss: 0.9448, test_f1: 0.6484
 epoch: 87, train_loss: 0.4088, test_loss: 0.9954, test_f1: 0.6437
 epoch: 88, train_loss: 0.4112, test_loss: 0.9424, test_f1: 0.6515
 epoch: 89, train_loss: 0.4089, test_loss: 0.9640, test_f1: 0.6518
 epoch: 90, train_loss: 0.4239, test_loss: 0.9884, test_f1: 0.6478
 epoch: 91, train_loss: 0.4077, test_loss: 1.0319, test_f1: 0.6485
 epoch: 92, train_loss: 0.4028, test_loss: 1.0108, test_f1: 0.6448
 epoch: 93, train_loss: 0.4077, test_loss: 0.9738, test_f1: 0.6559
 epoch: 94, train_loss: 0.3956, test_loss: 0.9916, test_f1: 0.6439
 epoch: 95, train_loss: 0.4041, test_loss: 1.0400, test_f1: 0.6530
 epoch: 96, train_loss: 0.3949, test_loss: 1.0476, test_f1: 0.6542
 epoch: 97, train_loss: 0.3931, test_loss: 1.0382, test_f1: 0.6468
 epoch: 98, train_loss: 0.3855, test_loss: 0.9674, test_f1: 0.6460
 epoch: 99, train_loss: 0.3926, test_loss: 1.0748, test_f1: 0.6569
##################ITERATION #5 ****************************************
 epoch: 0, train_loss: 1.1433, test_loss: 0.9741, test_f1: 0.4767
 epoch: 1, train_loss: 1.0054, test_loss: 0.9412, test_f1: 0.4993
 epoch: 2, train_loss: 0.9800, test_loss: 0.9064, test_f1: 0.5360
 epoch: 3, train_loss: 0.9411, test_loss: 0.8902, test_f1: 0.5133
 epoch: 4, train_loss: 0.9266, test_loss: 0.8849, test_f1: 0.5433
 epoch: 5, train_loss: 0.9042, test_loss: 0.8813, test_f1: 0.5480
 epoch: 6, train_loss: 0.8832, test_loss: 0.8507, test_f1: 0.5280
 epoch: 7, train_loss: 0.8733, test_loss: 0.8414, test_f1: 0.5533
 epoch: 8, train_loss: 0.8607, test_loss: 0.8351, test_f1: 0.5313
 epoch: 9, train_loss: 0.8481, test_loss: 0.8133, test_f1: 0.6093
 epoch: 10, train_loss: 0.8268, test_loss: 0.8138, test_f1: 0.5810
 epoch: 11, train_loss: 0.8188, test_loss: 0.7998, test_f1: 0.5934
 epoch: 12, train_loss: 0.8050, test_loss: 0.8241, test_f1: 0.5762
 epoch: 13, train_loss: 0.8022, test_loss: 0.8011, test_f1: 0.5852
 epoch: 14, train_loss: 0.7911, test_loss: 0.7694, test_f1: 0.6025
 epoch: 15, train_loss: 0.7732, test_loss: 0.7553, test_f1: 0.6237
 epoch: 16, train_loss: 0.7637, test_loss: 0.7630, test_f1: 0.5874
 epoch: 17, train_loss: 0.7595, test_loss: 0.7716, test_f1: 0.6032
 epoch: 18, train_loss: 0.7605, test_loss: 0.7727, test_f1: 0.5933
 epoch: 19, train_loss: 0.7304, test_loss: 0.7382, test_f1: 0.6114
 epoch: 20, train_loss: 0.7322, test_loss: 0.7455, test_f1: 0.6251
 epoch: 21, train_loss: 0.7394, test_loss: 0.7256, test_f1: 0.6320
 epoch: 22, train_loss: 0.7276, test_loss: 0.7269, test_f1: 0.6500
 epoch: 23, train_loss: 0.7254, test_loss: 0.7378, test_f1: 0.6308
 epoch: 24, train_loss: 0.7084, test_loss: 0.7244, test_f1: 0.6331
 epoch: 25, train_loss: 0.6981, test_loss: 0.7180, test_f1: 0.6609
 epoch: 26, train_loss: 0.6939, test_loss: 0.7419, test_f1: 0.6535
 epoch: 27, train_loss: 0.6819, test_loss: 0.7512, test_f1: 0.5998
 epoch: 28, train_loss: 0.6799, test_loss: 0.7176, test_f1: 0.6822
 epoch: 29, train_loss: 0.6687, test_loss: 0.7217, test_f1: 0.6691
 epoch: 30, train_loss: 0.6646, test_loss: 0.7223, test_f1: 0.6643
 epoch: 31, train_loss: 0.6697, test_loss: 0.7442, test_f1: 0.6532
 epoch: 32, train_loss: 0.6534, test_loss: 0.7372, test_f1: 0.6614
 epoch: 33, train_loss: 0.6450, test_loss: 0.7083, test_f1: 0.6810
 epoch: 34, train_loss: 0.6429, test_loss: 0.7327, test_f1: 0.6529
 epoch: 35, train_loss: 0.6333, test_loss: 0.7283, test_f1: 0.6655
 epoch: 36, train_loss: 0.6275, test_loss: 0.7305, test_f1: 0.6615
 epoch: 37, train_loss: 0.6276, test_loss: 0.6992, test_f1: 0.6797
 epoch: 38, train_loss: 0.6182, test_loss: 0.7328, test_f1: 0.6657
 epoch: 39, train_loss: 0.6120, test_loss: 0.6959, test_f1: 0.6800
 epoch: 40, train_loss: 0.6158, test_loss: 0.7059, test_f1: 0.6583
 epoch: 41, train_loss: 0.5849, test_loss: 0.7254, test_f1: 0.6843
 epoch: 42, train_loss: 0.5870, test_loss: 0.7895, test_f1: 0.6637
 epoch: 43, train_loss: 0.5940, test_loss: 0.7104, test_f1: 0.6628
 epoch: 44, train_loss: 0.5866, test_loss: 0.8055, test_f1: 0.6288
 epoch: 45, train_loss: 0.5705, test_loss: 0.7708, test_f1: 0.6485
 epoch: 46, train_loss: 0.5830, test_loss: 0.7592, test_f1: 0.6516
 epoch: 47, train_loss: 0.5833, test_loss: 0.7631, test_f1: 0.6720
 epoch: 48, train_loss: 0.5667, test_loss: 0.7474, test_f1: 0.6481
 epoch: 49, train_loss: 0.5757, test_loss: 0.7881, test_f1: 0.6667
 epoch: 50, train_loss: 0.5533, test_loss: 0.8787, test_f1: 0.6365
 epoch: 51, train_loss: 0.5347, test_loss: 0.7658, test_f1: 0.6710
 epoch: 52, train_loss: 0.5439, test_loss: 0.7665, test_f1: 0.6515
 epoch: 53, train_loss: 0.5236, test_loss: 0.7851, test_f1: 0.6555
 epoch: 54, train_loss: 0.5172, test_loss: 0.8065, test_f1: 0.6557
 epoch: 55, train_loss: 0.5195, test_loss: 0.7781, test_f1: 0.6361
 epoch: 56, train_loss: 0.5217, test_loss: 0.8347, test_f1: 0.6475
 epoch: 57, train_loss: 0.5148, test_loss: 0.7671, test_f1: 0.6688
 epoch: 58, train_loss: 0.5123, test_loss: 0.7945, test_f1: 0.6604
 epoch: 59, train_loss: 0.5195, test_loss: 0.7989, test_f1: 0.6421
 epoch: 60, train_loss: 0.5158, test_loss: 0.7519, test_f1: 0.6749
 epoch: 61, train_loss: 0.5092, test_loss: 0.8430, test_f1: 0.6458
 epoch: 62, train_loss: 0.5088, test_loss: 0.8030, test_f1: 0.6472
 epoch: 63, train_loss: 0.4943, test_loss: 0.8393, test_f1: 0.6474
 epoch: 64, train_loss: 0.4942, test_loss: 0.8764, test_f1: 0.6511
 epoch: 65, train_loss: 0.4917, test_loss: 0.8130, test_f1: 0.6647
 epoch: 66, train_loss: 0.4915, test_loss: 0.8532, test_f1: 0.6448
 epoch: 67, train_loss: 0.4757, test_loss: 0.8546, test_f1: 0.6625
 epoch: 68, train_loss: 0.4990, test_loss: 0.8209, test_f1: 0.6599
 epoch: 69, train_loss: 0.4770, test_loss: 0.8487, test_f1: 0.6537
 epoch: 70, train_loss: 0.4652, test_loss: 0.8490, test_f1: 0.6624
 epoch: 71, train_loss: 0.4851, test_loss: 0.8763, test_f1: 0.6638
 epoch: 72, train_loss: 0.4797, test_loss: 0.8926, test_f1: 0.6454
 epoch: 73, train_loss: 0.4686, test_loss: 0.8675, test_f1: 0.6560
 epoch: 74, train_loss: 0.4692, test_loss: 0.9683, test_f1: 0.6381
 epoch: 75, train_loss: 0.4706, test_loss: 0.9103, test_f1: 0.6586
 epoch: 76, train_loss: 0.4753, test_loss: 0.9244, test_f1: 0.6576
 epoch: 77, train_loss: 0.4712, test_loss: 0.9585, test_f1: 0.6564
 epoch: 78, train_loss: 0.4600, test_loss: 0.9441, test_f1: 0.6547
 epoch: 79, train_loss: 0.4511, test_loss: 0.9315, test_f1: 0.6626
 epoch: 80, train_loss: 0.4573, test_loss: 0.8727, test_f1: 0.6329
 epoch: 81, train_loss: 0.4337, test_loss: 0.8761, test_f1: 0.6646
 epoch: 82, train_loss: 0.4541, test_loss: 0.9042, test_f1: 0.6694
 epoch: 83, train_loss: 0.4635, test_loss: 0.9380, test_f1: 0.6647
 epoch: 84, train_loss: 0.4406, test_loss: 0.9041, test_f1: 0.6512
 epoch: 85, train_loss: 0.4463, test_loss: 0.9178, test_f1: 0.6637
 epoch: 86, train_loss: 0.4332, test_loss: 0.9749, test_f1: 0.6681
 epoch: 87, train_loss: 0.4408, test_loss: 0.9174, test_f1: 0.6604
 epoch: 88, train_loss: 0.4417, test_loss: 0.9822, test_f1: 0.6553
 epoch: 89, train_loss: 0.4261, test_loss: 0.9735, test_f1: 0.6616
 epoch: 90, train_loss: 0.4293, test_loss: 1.0117, test_f1: 0.6439
 epoch: 91, train_loss: 0.4216, test_loss: 1.0396, test_f1: 0.6561
 epoch: 92, train_loss: 0.4281, test_loss: 1.0084, test_f1: 0.6679
 epoch: 93, train_loss: 0.4292, test_loss: 1.0308, test_f1: 0.6424
 epoch: 94, train_loss: 0.4202, test_loss: 0.9799, test_f1: 0.6354
 epoch: 95, train_loss: 0.4098, test_loss: 0.9873, test_f1: 0.6470
 epoch: 96, train_loss: 0.4037, test_loss: 1.0250, test_f1: 0.6464
 epoch: 97, train_loss: 0.4253, test_loss: 1.0664, test_f1: 0.6473
 epoch: 98, train_loss: 0.4158, test_loss: 1.0342, test_f1: 0.6340
 epoch: 99, train_loss: 0.4199, test_loss: 0.9354, test_f1: 0.6523
##################ITERATION #6 ****************************************
 epoch: 0, train_loss: 1.1857, test_loss: 0.9684, test_f1: 0.4987
 epoch: 1, train_loss: 1.0190, test_loss: 0.9274, test_f1: 0.5210
 epoch: 2, train_loss: 0.9870, test_loss: 0.8999, test_f1: 0.5179
 epoch: 3, train_loss: 0.9330, test_loss: 0.8943, test_f1: 0.5433
 epoch: 4, train_loss: 0.9336, test_loss: 0.8946, test_f1: 0.5466
 epoch: 5, train_loss: 0.9107, test_loss: 0.8587, test_f1: 0.5535
 epoch: 6, train_loss: 0.8914, test_loss: 0.8487, test_f1: 0.5551
 epoch: 7, train_loss: 0.8841, test_loss: 0.8482, test_f1: 0.5680
 epoch: 8, train_loss: 0.8739, test_loss: 0.8423, test_f1: 0.5560
 epoch: 9, train_loss: 0.8430, test_loss: 0.8457, test_f1: 0.5842
 epoch: 10, train_loss: 0.8395, test_loss: 0.8166, test_f1: 0.6078
 epoch: 11, train_loss: 0.8073, test_loss: 0.7871, test_f1: 0.5971
 epoch: 12, train_loss: 0.8037, test_loss: 0.8037, test_f1: 0.5863
 epoch: 13, train_loss: 0.7992, test_loss: 0.7877, test_f1: 0.6076
 epoch: 14, train_loss: 0.7829, test_loss: 0.7861, test_f1: 0.6193
 epoch: 15, train_loss: 0.7865, test_loss: 0.7768, test_f1: 0.6265
 epoch: 16, train_loss: 0.7692, test_loss: 0.7619, test_f1: 0.6273
 epoch: 17, train_loss: 0.7497, test_loss: 0.7397, test_f1: 0.6636
 epoch: 18, train_loss: 0.7511, test_loss: 0.7524, test_f1: 0.5990
 epoch: 19, train_loss: 0.7396, test_loss: 0.7291, test_f1: 0.6578
 epoch: 20, train_loss: 0.7239, test_loss: 0.7357, test_f1: 0.6497
 epoch: 21, train_loss: 0.7281, test_loss: 0.7495, test_f1: 0.6408
 epoch: 22, train_loss: 0.7244, test_loss: 0.7300, test_f1: 0.6443
 epoch: 23, train_loss: 0.7153, test_loss: 0.7398, test_f1: 0.6368
 epoch: 24, train_loss: 0.7019, test_loss: 0.7309, test_f1: 0.6498
 epoch: 25, train_loss: 0.6933, test_loss: 0.7231, test_f1: 0.6547
 epoch: 26, train_loss: 0.6747, test_loss: 0.7396, test_f1: 0.6596
 epoch: 27, train_loss: 0.6879, test_loss: 0.7249, test_f1: 0.6740
 epoch: 28, train_loss: 0.6688, test_loss: 0.7324, test_f1: 0.6413
 epoch: 29, train_loss: 0.6614, test_loss: 0.7600, test_f1: 0.6301
 epoch: 30, train_loss: 0.6589, test_loss: 0.7627, test_f1: 0.6490
 epoch: 31, train_loss: 0.6641, test_loss: 0.7308, test_f1: 0.6738
 epoch: 32, train_loss: 0.6585, test_loss: 0.7336, test_f1: 0.6677
 epoch: 33, train_loss: 0.6432, test_loss: 0.7218, test_f1: 0.6673
 epoch: 34, train_loss: 0.6372, test_loss: 0.7536, test_f1: 0.6394
 epoch: 35, train_loss: 0.6361, test_loss: 0.7387, test_f1: 0.6315
 epoch: 36, train_loss: 0.6182, test_loss: 0.7570, test_f1: 0.6860
 epoch: 37, train_loss: 0.6173, test_loss: 0.7272, test_f1: 0.6615
 epoch: 38, train_loss: 0.6043, test_loss: 0.7298, test_f1: 0.6544
 epoch: 39, train_loss: 0.6221, test_loss: 0.7518, test_f1: 0.6477
 epoch: 40, train_loss: 0.6039, test_loss: 0.7893, test_f1: 0.6298
 epoch: 41, train_loss: 0.6118, test_loss: 0.7439, test_f1: 0.6632
 epoch: 42, train_loss: 0.6122, test_loss: 0.7163, test_f1: 0.6750
 epoch: 43, train_loss: 0.5835, test_loss: 0.7946, test_f1: 0.6560
 epoch: 44, train_loss: 0.5843, test_loss: 0.7745, test_f1: 0.6433
 epoch: 45, train_loss: 0.5912, test_loss: 0.7579, test_f1: 0.6572
 epoch: 46, train_loss: 0.5834, test_loss: 0.7955, test_f1: 0.6318
 epoch: 47, train_loss: 0.5499, test_loss: 0.8147, test_f1: 0.6307
 epoch: 48, train_loss: 0.5739, test_loss: 0.8226, test_f1: 0.6530
 epoch: 49, train_loss: 0.5553, test_loss: 0.8549, test_f1: 0.6375
 epoch: 50, train_loss: 0.5604, test_loss: 0.8104, test_f1: 0.6302
 epoch: 51, train_loss: 0.5423, test_loss: 0.8014, test_f1: 0.6345
 epoch: 52, train_loss: 0.5232, test_loss: 0.7958, test_f1: 0.6656
 epoch: 53, train_loss: 0.5223, test_loss: 0.8144, test_f1: 0.6630
 epoch: 54, train_loss: 0.5232, test_loss: 0.8251, test_f1: 0.6500
 epoch: 55, train_loss: 0.5247, test_loss: 0.8315, test_f1: 0.6501
 epoch: 56, train_loss: 0.5135, test_loss: 0.8339, test_f1: 0.6445
 epoch: 57, train_loss: 0.5162, test_loss: 0.8899, test_f1: 0.6468
 epoch: 58, train_loss: 0.5074, test_loss: 0.8750, test_f1: 0.6558
 epoch: 59, train_loss: 0.5057, test_loss: 0.8517, test_f1: 0.6451
 epoch: 60, train_loss: 0.5132, test_loss: 0.8863, test_f1: 0.6421
 epoch: 61, train_loss: 0.4943, test_loss: 0.8845, test_f1: 0.6493
 epoch: 62, train_loss: 0.4970, test_loss: 0.9006, test_f1: 0.6412
 epoch: 63, train_loss: 0.5016, test_loss: 0.8675, test_f1: 0.6456
 epoch: 64, train_loss: 0.5026, test_loss: 0.8980, test_f1: 0.6433
 epoch: 65, train_loss: 0.4851, test_loss: 0.9551, test_f1: 0.6304
 epoch: 66, train_loss: 0.4878, test_loss: 0.8924, test_f1: 0.6571
 epoch: 67, train_loss: 0.4900, test_loss: 0.9255, test_f1: 0.6609
 epoch: 68, train_loss: 0.4785, test_loss: 0.8918, test_f1: 0.6499
 epoch: 69, train_loss: 0.4690, test_loss: 0.9312, test_f1: 0.6496
 epoch: 70, train_loss: 0.4712, test_loss: 0.9280, test_f1: 0.6339
 epoch: 71, train_loss: 0.4791, test_loss: 0.9544, test_f1: 0.6413
 epoch: 72, train_loss: 0.4793, test_loss: 1.0427, test_f1: 0.6405
 epoch: 73, train_loss: 0.4629, test_loss: 0.9727, test_f1: 0.6563
 epoch: 74, train_loss: 0.4725, test_loss: 0.9332, test_f1: 0.6410
 epoch: 75, train_loss: 0.4789, test_loss: 0.9686, test_f1: 0.6454
 epoch: 76, train_loss: 0.4657, test_loss: 1.0382, test_f1: 0.6454
 epoch: 77, train_loss: 0.4608, test_loss: 0.9618, test_f1: 0.6542
 epoch: 78, train_loss: 0.4517, test_loss: 0.9576, test_f1: 0.6488
 epoch: 79, train_loss: 0.4611, test_loss: 0.9484, test_f1: 0.6448
 epoch: 80, train_loss: 0.4597, test_loss: 0.9986, test_f1: 0.6679
 epoch: 81, train_loss: 0.4531, test_loss: 0.9833, test_f1: 0.6442
 epoch: 82, train_loss: 0.4447, test_loss: 1.0256, test_f1: 0.6600
 epoch: 83, train_loss: 0.4543, test_loss: 0.9738, test_f1: 0.6575
 epoch: 84, train_loss: 0.4450, test_loss: 1.0383, test_f1: 0.6482
 epoch: 85, train_loss: 0.4501, test_loss: 1.0619, test_f1: 0.6575
 epoch: 86, train_loss: 0.4258, test_loss: 1.0388, test_f1: 0.6543
 epoch: 87, train_loss: 0.4334, test_loss: 1.0817, test_f1: 0.6388
 epoch: 88, train_loss: 0.4454, test_loss: 1.0638, test_f1: 0.6547
 epoch: 89, train_loss: 0.4358, test_loss: 1.0750, test_f1: 0.6606
 epoch: 90, train_loss: 0.4181, test_loss: 1.0734, test_f1: 0.6468
 epoch: 91, train_loss: 0.4289, test_loss: 1.0943, test_f1: 0.6510
 epoch: 92, train_loss: 0.4292, test_loss: 1.0786, test_f1: 0.6586
 epoch: 93, train_loss: 0.4316, test_loss: 1.1304, test_f1: 0.6432
 epoch: 94, train_loss: 0.4289, test_loss: 1.0996, test_f1: 0.6638
 epoch: 95, train_loss: 0.4182, test_loss: 1.0715, test_f1: 0.6552
 epoch: 96, train_loss: 0.4212, test_loss: 1.1004, test_f1: 0.6694
 epoch: 97, train_loss: 0.4068, test_loss: 1.1261, test_f1: 0.6503
 epoch: 98, train_loss: 0.4091, test_loss: 1.1291, test_f1: 0.6576
 epoch: 99, train_loss: 0.4205, test_loss: 1.1150, test_f1: 0.6498
##################ITERATION #7 ****************************************
 epoch: 0, train_loss: 1.2074, test_loss: 1.0063, test_f1: 0.4966
 epoch: 1, train_loss: 1.0196, test_loss: 0.9454, test_f1: 0.5065
 epoch: 2, train_loss: 0.9906, test_loss: 0.9513, test_f1: 0.5452
 epoch: 3, train_loss: 0.9667, test_loss: 0.9478, test_f1: 0.5418
 epoch: 4, train_loss: 0.9347, test_loss: 0.9498, test_f1: 0.5551
 epoch: 5, train_loss: 0.9168, test_loss: 0.9276, test_f1: 0.5571
 epoch: 6, train_loss: 0.9049, test_loss: 0.9101, test_f1: 0.5319
 epoch: 7, train_loss: 0.8907, test_loss: 0.9108, test_f1: 0.5692
 epoch: 8, train_loss: 0.8693, test_loss: 0.9090, test_f1: 0.5931
 epoch: 9, train_loss: 0.8762, test_loss: 0.9247, test_f1: 0.5845
 epoch: 10, train_loss: 0.8541, test_loss: 0.9102, test_f1: 0.5909
 epoch: 11, train_loss: 0.8372, test_loss: 0.8959, test_f1: 0.5978
 epoch: 12, train_loss: 0.8268, test_loss: 0.8933, test_f1: 0.5994
 epoch: 13, train_loss: 0.8114, test_loss: 0.8780, test_f1: 0.6100
 epoch: 14, train_loss: 0.8095, test_loss: 0.8827, test_f1: 0.5859
 epoch: 15, train_loss: 0.8104, test_loss: 0.9128, test_f1: 0.5881
 epoch: 16, train_loss: 0.7931, test_loss: 0.8773, test_f1: 0.6070
 epoch: 17, train_loss: 0.7757, test_loss: 0.8879, test_f1: 0.5843
 epoch: 18, train_loss: 0.7672, test_loss: 0.8638, test_f1: 0.6046
 epoch: 19, train_loss: 0.7648, test_loss: 0.8917, test_f1: 0.6206
 epoch: 20, train_loss: 0.7434, test_loss: 0.8818, test_f1: 0.6362
 epoch: 21, train_loss: 0.7424, test_loss: 0.8225, test_f1: 0.6035
 epoch: 22, train_loss: 0.7450, test_loss: 0.8390, test_f1: 0.6451
 epoch: 23, train_loss: 0.7348, test_loss: 0.8540, test_f1: 0.6311
 epoch: 24, train_loss: 0.7091, test_loss: 0.8260, test_f1: 0.6564
 epoch: 25, train_loss: 0.7167, test_loss: 0.8342, test_f1: 0.6320
 epoch: 26, train_loss: 0.7102, test_loss: 0.8316, test_f1: 0.6553
 epoch: 27, train_loss: 0.6969, test_loss: 0.8372, test_f1: 0.6428
 epoch: 28, train_loss: 0.6991, test_loss: 0.8430, test_f1: 0.6339
 epoch: 29, train_loss: 0.6827, test_loss: 0.8202, test_f1: 0.6467
 epoch: 30, train_loss: 0.6819, test_loss: 0.8221, test_f1: 0.6362
 epoch: 31, train_loss: 0.6829, test_loss: 0.7768, test_f1: 0.6404
 epoch: 32, train_loss: 0.6711, test_loss: 0.8190, test_f1: 0.6508
 epoch: 33, train_loss: 0.6652, test_loss: 0.8727, test_f1: 0.6122
 epoch: 34, train_loss: 0.6513, test_loss: 0.7854, test_f1: 0.6385
 epoch: 35, train_loss: 0.6464, test_loss: 0.8199, test_f1: 0.6477
 epoch: 36, train_loss: 0.6406, test_loss: 0.8321, test_f1: 0.6174
 epoch: 37, train_loss: 0.6245, test_loss: 0.8809, test_f1: 0.6298
 epoch: 38, train_loss: 0.6284, test_loss: 0.8345, test_f1: 0.6564
 epoch: 39, train_loss: 0.6323, test_loss: 0.8525, test_f1: 0.6207
 epoch: 40, train_loss: 0.6169, test_loss: 0.8486, test_f1: 0.6260
 epoch: 41, train_loss: 0.6201, test_loss: 0.8678, test_f1: 0.6255
 epoch: 42, train_loss: 0.6116, test_loss: 0.8542, test_f1: 0.6265
 epoch: 43, train_loss: 0.5985, test_loss: 0.7706, test_f1: 0.6267
 epoch: 44, train_loss: 0.6144, test_loss: 0.7815, test_f1: 0.6368
 epoch: 45, train_loss: 0.6046, test_loss: 0.8124, test_f1: 0.6391
 epoch: 46, train_loss: 0.5917, test_loss: 0.8628, test_f1: 0.6385
 epoch: 47, train_loss: 0.5873, test_loss: 0.8420, test_f1: 0.6431
 epoch: 48, train_loss: 0.5801, test_loss: 0.7697, test_f1: 0.6564
 epoch: 49, train_loss: 0.5753, test_loss: 0.8536, test_f1: 0.6518
 epoch: 50, train_loss: 0.5709, test_loss: 0.8447, test_f1: 0.6459
 epoch: 51, train_loss: 0.5467, test_loss: 0.8253, test_f1: 0.6419
 epoch: 52, train_loss: 0.5461, test_loss: 0.8176, test_f1: 0.6518
 epoch: 53, train_loss: 0.5363, test_loss: 0.7978, test_f1: 0.6475
 epoch: 54, train_loss: 0.5302, test_loss: 0.8342, test_f1: 0.6318
 epoch: 55, train_loss: 0.5371, test_loss: 0.8771, test_f1: 0.6429
 epoch: 56, train_loss: 0.5274, test_loss: 0.8842, test_f1: 0.6338
 epoch: 57, train_loss: 0.5329, test_loss: 0.8474, test_f1: 0.6255
 epoch: 58, train_loss: 0.5225, test_loss: 0.8432, test_f1: 0.6346
 epoch: 59, train_loss: 0.5097, test_loss: 0.8627, test_f1: 0.6338
 epoch: 60, train_loss: 0.5145, test_loss: 0.8751, test_f1: 0.6344
 epoch: 61, train_loss: 0.5266, test_loss: 0.8445, test_f1: 0.6517
 epoch: 62, train_loss: 0.5116, test_loss: 0.8657, test_f1: 0.6439
 epoch: 63, train_loss: 0.5136, test_loss: 0.8087, test_f1: 0.6432
 epoch: 64, train_loss: 0.4962, test_loss: 0.9579, test_f1: 0.6380
 epoch: 65, train_loss: 0.4989, test_loss: 0.9026, test_f1: 0.6348
 epoch: 66, train_loss: 0.5014, test_loss: 0.8623, test_f1: 0.6377
 epoch: 67, train_loss: 0.5014, test_loss: 0.8755, test_f1: 0.6261
 epoch: 68, train_loss: 0.4958, test_loss: 0.8886, test_f1: 0.6239
 epoch: 69, train_loss: 0.4955, test_loss: 0.8842, test_f1: 0.6393
 epoch: 70, train_loss: 0.5029, test_loss: 0.8850, test_f1: 0.6441
 epoch: 71, train_loss: 0.5015, test_loss: 0.8622, test_f1: 0.6361
 epoch: 72, train_loss: 0.4874, test_loss: 0.9232, test_f1: 0.6418
 epoch: 73, train_loss: 0.4850, test_loss: 0.8909, test_f1: 0.6458
 epoch: 74, train_loss: 0.4860, test_loss: 0.8783, test_f1: 0.6443
 epoch: 75, train_loss: 0.4944, test_loss: 0.9270, test_f1: 0.6388
 epoch: 76, train_loss: 0.4692, test_loss: 0.9661, test_f1: 0.6338
 epoch: 77, train_loss: 0.4758, test_loss: 0.8538, test_f1: 0.6505
 epoch: 78, train_loss: 0.4677, test_loss: 0.8876, test_f1: 0.6370
 epoch: 79, train_loss: 0.4661, test_loss: 0.9282, test_f1: 0.6394
 epoch: 80, train_loss: 0.4701, test_loss: 0.8842, test_f1: 0.6479
 epoch: 81, train_loss: 0.4731, test_loss: 0.9179, test_f1: 0.6409
 epoch: 82, train_loss: 0.4681, test_loss: 0.9349, test_f1: 0.6374
 epoch: 83, train_loss: 0.4650, test_loss: 0.9604, test_f1: 0.6224
 epoch: 84, train_loss: 0.4634, test_loss: 0.9317, test_f1: 0.6534
 epoch: 85, train_loss: 0.4606, test_loss: 0.9427, test_f1: 0.6518
 epoch: 86, train_loss: 0.4646, test_loss: 0.9444, test_f1: 0.6398
 epoch: 87, train_loss: 0.4632, test_loss: 0.9081, test_f1: 0.6418
 epoch: 88, train_loss: 0.4558, test_loss: 0.9477, test_f1: 0.6314
 epoch: 89, train_loss: 0.4587, test_loss: 0.9827, test_f1: 0.6285
 epoch: 90, train_loss: 0.4502, test_loss: 1.0081, test_f1: 0.6468
 epoch: 91, train_loss: 0.4419, test_loss: 1.0027, test_f1: 0.6412
 epoch: 92, train_loss: 0.4435, test_loss: 1.0459, test_f1: 0.6457
 epoch: 93, train_loss: 0.4319, test_loss: 1.0022, test_f1: 0.6468
 epoch: 94, train_loss: 0.4458, test_loss: 1.0296, test_f1: 0.6504
 epoch: 95, train_loss: 0.4431, test_loss: 1.0011, test_f1: 0.6284
 epoch: 96, train_loss: 0.4319, test_loss: 1.0465, test_f1: 0.6354
 epoch: 97, train_loss: 0.4430, test_loss: 1.0873, test_f1: 0.6395
 epoch: 98, train_loss: 0.4286, test_loss: 1.0145, test_f1: 0.6253
 epoch: 99, train_loss: 0.4307, test_loss: 1.0319, test_f1: 0.6592
##################ITERATION #8 ****************************************
 epoch: 0, train_loss: 1.2116, test_loss: 0.9845, test_f1: 0.5076
 epoch: 1, train_loss: 1.0489, test_loss: 0.9223, test_f1: 0.5217
 epoch: 2, train_loss: 1.0005, test_loss: 0.9206, test_f1: 0.5321
 epoch: 3, train_loss: 0.9709, test_loss: 0.9193, test_f1: 0.5451
 epoch: 4, train_loss: 0.9476, test_loss: 0.8828, test_f1: 0.5505
 epoch: 5, train_loss: 0.9037, test_loss: 0.8645, test_f1: 0.5344
 epoch: 6, train_loss: 0.8871, test_loss: 0.8629, test_f1: 0.5611
 epoch: 7, train_loss: 0.8848, test_loss: 0.8407, test_f1: 0.5671
 epoch: 8, train_loss: 0.8604, test_loss: 0.8444, test_f1: 0.5692
 epoch: 9, train_loss: 0.8515, test_loss: 0.8420, test_f1: 0.5721
 epoch: 10, train_loss: 0.8360, test_loss: 0.8421, test_f1: 0.5658
 epoch: 11, train_loss: 0.8286, test_loss: 0.8231, test_f1: 0.5834
 epoch: 12, train_loss: 0.8041, test_loss: 0.8057, test_f1: 0.6018
 epoch: 13, train_loss: 0.8041, test_loss: 0.8111, test_f1: 0.5953
 epoch: 14, train_loss: 0.7949, test_loss: 0.7922, test_f1: 0.5995
 epoch: 15, train_loss: 0.7774, test_loss: 0.7825, test_f1: 0.5930
 epoch: 16, train_loss: 0.7872, test_loss: 0.7711, test_f1: 0.6269
 epoch: 17, train_loss: 0.7521, test_loss: 0.7889, test_f1: 0.6306
 epoch: 18, train_loss: 0.7544, test_loss: 0.7622, test_f1: 0.6491
 epoch: 19, train_loss: 0.7306, test_loss: 0.7661, test_f1: 0.6365
 epoch: 20, train_loss: 0.7312, test_loss: 0.7798, test_f1: 0.5999
 epoch: 21, train_loss: 0.7162, test_loss: 0.8304, test_f1: 0.6221
 epoch: 22, train_loss: 0.7269, test_loss: 0.7727, test_f1: 0.6713
 epoch: 23, train_loss: 0.7096, test_loss: 0.7684, test_f1: 0.6230
 epoch: 24, train_loss: 0.6996, test_loss: 0.7872, test_f1: 0.6514
 epoch: 25, train_loss: 0.6905, test_loss: 0.7811, test_f1: 0.6414
 epoch: 26, train_loss: 0.6924, test_loss: 0.7829, test_f1: 0.6260
 epoch: 27, train_loss: 0.6763, test_loss: 0.7315, test_f1: 0.6585
 epoch: 28, train_loss: 0.6632, test_loss: 0.7419, test_f1: 0.6617
 epoch: 29, train_loss: 0.6636, test_loss: 0.7649, test_f1: 0.6698
 epoch: 30, train_loss: 0.6606, test_loss: 0.7824, test_f1: 0.6566
 epoch: 31, train_loss: 0.6558, test_loss: 0.8006, test_f1: 0.6514
 epoch: 32, train_loss: 0.6511, test_loss: 0.7824, test_f1: 0.6415
 epoch: 33, train_loss: 0.6476, test_loss: 0.7842, test_f1: 0.6301
 epoch: 34, train_loss: 0.6298, test_loss: 0.7845, test_f1: 0.6341
 epoch: 35, train_loss: 0.6447, test_loss: 0.7710, test_f1: 0.6632
 epoch: 36, train_loss: 0.6263, test_loss: 0.7569, test_f1: 0.6555
 epoch: 37, train_loss: 0.6188, test_loss: 0.7701, test_f1: 0.6455
 epoch: 38, train_loss: 0.6227, test_loss: 0.7867, test_f1: 0.6691
 epoch: 39, train_loss: 0.6007, test_loss: 0.8273, test_f1: 0.6498
 epoch: 40, train_loss: 0.6078, test_loss: 0.7787, test_f1: 0.6702
 epoch: 41, train_loss: 0.5938, test_loss: 0.7951, test_f1: 0.6354
 epoch: 42, train_loss: 0.5962, test_loss: 0.7750, test_f1: 0.6392
 epoch: 43, train_loss: 0.5816, test_loss: 0.8353, test_f1: 0.6439
 epoch: 44, train_loss: 0.5738, test_loss: 0.8003, test_f1: 0.6542
 epoch: 45, train_loss: 0.5809, test_loss: 0.8147, test_f1: 0.6482
 epoch: 46, train_loss: 0.5859, test_loss: 0.8276, test_f1: 0.6333
 epoch: 47, train_loss: 0.5711, test_loss: 0.8137, test_f1: 0.6455
 epoch: 48, train_loss: 0.5589, test_loss: 0.8439, test_f1: 0.6426
 epoch: 49, train_loss: 0.5602, test_loss: 0.7908, test_f1: 0.6508
 epoch: 50, train_loss: 0.5541, test_loss: 0.8702, test_f1: 0.6344
 epoch: 51, train_loss: 0.5304, test_loss: 0.8659, test_f1: 0.6483
 epoch: 52, train_loss: 0.5248, test_loss: 0.8204, test_f1: 0.6641
 epoch: 53, train_loss: 0.5116, test_loss: 0.8479, test_f1: 0.6645
 epoch: 54, train_loss: 0.5021, test_loss: 0.8443, test_f1: 0.6671
 epoch: 55, train_loss: 0.5143, test_loss: 0.8633, test_f1: 0.6563
 epoch: 56, train_loss: 0.5060, test_loss: 0.8654, test_f1: 0.6640
 epoch: 57, train_loss: 0.5059, test_loss: 0.8957, test_f1: 0.6547
 epoch: 58, train_loss: 0.5120, test_loss: 0.8781, test_f1: 0.6531
 epoch: 59, train_loss: 0.4999, test_loss: 0.8540, test_f1: 0.6554
 epoch: 60, train_loss: 0.4836, test_loss: 0.8948, test_f1: 0.6673
 epoch: 61, train_loss: 0.4903, test_loss: 0.9070, test_f1: 0.6620
 epoch: 62, train_loss: 0.5050, test_loss: 0.9385, test_f1: 0.6564
 epoch: 63, train_loss: 0.4766, test_loss: 0.9012, test_f1: 0.6610
 epoch: 64, train_loss: 0.4895, test_loss: 0.9563, test_f1: 0.6517
 epoch: 65, train_loss: 0.4827, test_loss: 0.9235, test_f1: 0.6688
 epoch: 66, train_loss: 0.4793, test_loss: 1.0348, test_f1: 0.6504
 epoch: 67, train_loss: 0.4666, test_loss: 1.0048, test_f1: 0.6582
 epoch: 68, train_loss: 0.4571, test_loss: 0.9972, test_f1: 0.6589
 epoch: 69, train_loss: 0.4730, test_loss: 1.0155, test_f1: 0.6515
 epoch: 70, train_loss: 0.4719, test_loss: 0.9768, test_f1: 0.6668
 epoch: 71, train_loss: 0.4803, test_loss: 0.9958, test_f1: 0.6688
 epoch: 72, train_loss: 0.4546, test_loss: 1.0016, test_f1: 0.6546
 epoch: 73, train_loss: 0.4441, test_loss: 0.9618, test_f1: 0.6617
 epoch: 74, train_loss: 0.4695, test_loss: 1.0168, test_f1: 0.6723
 epoch: 75, train_loss: 0.4512, test_loss: 0.9985, test_f1: 0.6798
 epoch: 76, train_loss: 0.4567, test_loss: 1.0090, test_f1: 0.6722
 epoch: 77, train_loss: 0.4372, test_loss: 1.0306, test_f1: 0.6559
 epoch: 78, train_loss: 0.4469, test_loss: 1.0250, test_f1: 0.6702
 epoch: 79, train_loss: 0.4271, test_loss: 1.0407, test_f1: 0.6547
 epoch: 80, train_loss: 0.4472, test_loss: 1.1033, test_f1: 0.6611
 epoch: 81, train_loss: 0.4420, test_loss: 0.9810, test_f1: 0.6755
 epoch: 82, train_loss: 0.4231, test_loss: 1.1053, test_f1: 0.6637
 epoch: 83, train_loss: 0.4352, test_loss: 1.0645, test_f1: 0.6705
 epoch: 84, train_loss: 0.4267, test_loss: 1.0700, test_f1: 0.6767
 epoch: 85, train_loss: 0.4165, test_loss: 1.0891, test_f1: 0.6741
 epoch: 86, train_loss: 0.4181, test_loss: 1.0636, test_f1: 0.6860
 epoch: 87, train_loss: 0.4206, test_loss: 1.0955, test_f1: 0.6641
 epoch: 88, train_loss: 0.4123, test_loss: 1.1789, test_f1: 0.6641
 epoch: 89, train_loss: 0.4171, test_loss: 1.1073, test_f1: 0.6628
 epoch: 90, train_loss: 0.4135, test_loss: 1.1249, test_f1: 0.6703
 epoch: 91, train_loss: 0.4164, test_loss: 1.1419, test_f1: 0.6677
 epoch: 92, train_loss: 0.4053, test_loss: 1.1281, test_f1: 0.6677
 epoch: 93, train_loss: 0.4042, test_loss: 1.1637, test_f1: 0.6632
 epoch: 94, train_loss: 0.4034, test_loss: 1.1271, test_f1: 0.6633
 epoch: 95, train_loss: 0.4077, test_loss: 1.1330, test_f1: 0.6731
 epoch: 96, train_loss: 0.3937, test_loss: 1.1275, test_f1: 0.6721
 epoch: 97, train_loss: 0.4040, test_loss: 1.2508, test_f1: 0.6630
 epoch: 98, train_loss: 0.3902, test_loss: 1.2152, test_f1: 0.6670
 epoch: 99, train_loss: 0.3892, test_loss: 1.1970, test_f1: 0.6741
##################ITERATION #9 ****************************************
 epoch: 0, train_loss: 1.2055, test_loss: 1.0172, test_f1: 0.5190
 epoch: 1, train_loss: 1.0389, test_loss: 0.9777, test_f1: 0.5469
 epoch: 2, train_loss: 0.9962, test_loss: 0.9532, test_f1: 0.5333
 epoch: 3, train_loss: 0.9680, test_loss: 0.9533, test_f1: 0.5320
 epoch: 4, train_loss: 0.9537, test_loss: 0.9034, test_f1: 0.5529
 epoch: 5, train_loss: 0.9400, test_loss: 0.9150, test_f1: 0.5446
 epoch: 6, train_loss: 0.9038, test_loss: 0.9344, test_f1: 0.5402
 epoch: 7, train_loss: 0.8968, test_loss: 0.9035, test_f1: 0.5674
 epoch: 8, train_loss: 0.8678, test_loss: 0.8908, test_f1: 0.5585
 epoch: 9, train_loss: 0.8825, test_loss: 0.9140, test_f1: 0.5405
 epoch: 10, train_loss: 0.8465, test_loss: 0.8638, test_f1: 0.5721
 epoch: 11, train_loss: 0.8439, test_loss: 0.9003, test_f1: 0.5780
 epoch: 12, train_loss: 0.8243, test_loss: 0.8468, test_f1: 0.5927
 epoch: 13, train_loss: 0.8215, test_loss: 0.8572, test_f1: 0.5790
 epoch: 14, train_loss: 0.8138, test_loss: 0.8589, test_f1: 0.6034
 epoch: 15, train_loss: 0.7977, test_loss: 0.8422, test_f1: 0.5598
 epoch: 16, train_loss: 0.8015, test_loss: 0.8706, test_f1: 0.5906
 epoch: 17, train_loss: 0.7763, test_loss: 0.8026, test_f1: 0.6231
 epoch: 18, train_loss: 0.7739, test_loss: 0.8138, test_f1: 0.6233
 epoch: 19, train_loss: 0.7567, test_loss: 0.8488, test_f1: 0.6494
 epoch: 20, train_loss: 0.7511, test_loss: 0.7904, test_f1: 0.6370
 epoch: 21, train_loss: 0.7396, test_loss: 0.7826, test_f1: 0.6156
 epoch: 22, train_loss: 0.7407, test_loss: 0.7740, test_f1: 0.6405
 epoch: 23, train_loss: 0.7244, test_loss: 0.7725, test_f1: 0.6521
 epoch: 24, train_loss: 0.7087, test_loss: 0.7883, test_f1: 0.6614
 epoch: 25, train_loss: 0.7226, test_loss: 0.7384, test_f1: 0.6411
 epoch: 26, train_loss: 0.7033, test_loss: 0.8416, test_f1: 0.6282
 epoch: 27, train_loss: 0.7132, test_loss: 0.7964, test_f1: 0.6476
 epoch: 28, train_loss: 0.6910, test_loss: 0.7600, test_f1: 0.6491
 epoch: 29, train_loss: 0.6922, test_loss: 0.7986, test_f1: 0.6803
 epoch: 30, train_loss: 0.6980, test_loss: 0.7965, test_f1: 0.6267
 epoch: 31, train_loss: 0.6743, test_loss: 0.8180, test_f1: 0.6666
 epoch: 32, train_loss: 0.6786, test_loss: 0.7648, test_f1: 0.6247
 epoch: 33, train_loss: 0.6770, test_loss: 0.7285, test_f1: 0.6590
 epoch: 34, train_loss: 0.6457, test_loss: 0.8074, test_f1: 0.6514
 epoch: 35, train_loss: 0.6467, test_loss: 0.7730, test_f1: 0.6496
 epoch: 36, train_loss: 0.6487, test_loss: 0.8078, test_f1: 0.6512
 epoch: 37, train_loss: 0.6460, test_loss: 0.7869, test_f1: 0.6395
 epoch: 38, train_loss: 0.6390, test_loss: 0.8089, test_f1: 0.6527
 epoch: 39, train_loss: 0.6393, test_loss: 0.8573, test_f1: 0.6208
 epoch: 40, train_loss: 0.6165, test_loss: 0.7536, test_f1: 0.6408
 epoch: 41, train_loss: 0.6074, test_loss: 0.7935, test_f1: 0.6418
 epoch: 42, train_loss: 0.6121, test_loss: 0.8001, test_f1: 0.6501
 epoch: 43, train_loss: 0.6141, test_loss: 0.8186, test_f1: 0.6598
 epoch: 44, train_loss: 0.6245, test_loss: 0.8062, test_f1: 0.6622
 epoch: 45, train_loss: 0.6068, test_loss: 0.8075, test_f1: 0.6334
 epoch: 46, train_loss: 0.5963, test_loss: 0.8567, test_f1: 0.6407
 epoch: 47, train_loss: 0.5768, test_loss: 0.7943, test_f1: 0.6539
 epoch: 48, train_loss: 0.5868, test_loss: 0.8065, test_f1: 0.6490
 epoch: 49, train_loss: 0.5820, test_loss: 0.7972, test_f1: 0.6735
 epoch: 50, train_loss: 0.5708, test_loss: 0.8232, test_f1: 0.6427
 epoch: 51, train_loss: 0.5594, test_loss: 0.8202, test_f1: 0.6412
 epoch: 52, train_loss: 0.5521, test_loss: 0.7856, test_f1: 0.6498
 epoch: 53, train_loss: 0.5525, test_loss: 0.7996, test_f1: 0.6631
 epoch: 54, train_loss: 0.5369, test_loss: 0.7723, test_f1: 0.6579
 epoch: 55, train_loss: 0.5193, test_loss: 0.8252, test_f1: 0.6512
 epoch: 56, train_loss: 0.5325, test_loss: 0.8026, test_f1: 0.6572
 epoch: 57, train_loss: 0.5334, test_loss: 0.8627, test_f1: 0.6450
 epoch: 58, train_loss: 0.5290, test_loss: 0.8534, test_f1: 0.6339
 epoch: 59, train_loss: 0.5234, test_loss: 0.8655, test_f1: 0.6540
 epoch: 60, train_loss: 0.5290, test_loss: 0.8351, test_f1: 0.6501
 epoch: 61, train_loss: 0.5141, test_loss: 0.8509, test_f1: 0.6400
 epoch: 62, train_loss: 0.5136, test_loss: 0.8594, test_f1: 0.6483
 epoch: 63, train_loss: 0.5013, test_loss: 0.8891, test_f1: 0.6547
 epoch: 64, train_loss: 0.5240, test_loss: 0.8620, test_f1: 0.6543
 epoch: 65, train_loss: 0.5077, test_loss: 0.8614, test_f1: 0.6653
 epoch: 66, train_loss: 0.5076, test_loss: 0.8600, test_f1: 0.6598
 epoch: 67, train_loss: 0.5056, test_loss: 0.8289, test_f1: 0.6678
 epoch: 68, train_loss: 0.4872, test_loss: 0.8578, test_f1: 0.6605
 epoch: 69, train_loss: 0.5093, test_loss: 0.8724, test_f1: 0.6551
 epoch: 70, train_loss: 0.4872, test_loss: 0.8903, test_f1: 0.6553
 epoch: 71, train_loss: 0.4760, test_loss: 0.8985, test_f1: 0.6579
 epoch: 72, train_loss: 0.4883, test_loss: 0.9139, test_f1: 0.6522
 epoch: 73, train_loss: 0.4855, test_loss: 0.8649, test_f1: 0.6650
 epoch: 74, train_loss: 0.4792, test_loss: 0.8784, test_f1: 0.6602
 epoch: 75, train_loss: 0.4738, test_loss: 0.9270, test_f1: 0.6578
 epoch: 76, train_loss: 0.4698, test_loss: 0.9068, test_f1: 0.6743
 epoch: 77, train_loss: 0.4691, test_loss: 0.9164, test_f1: 0.6679
 epoch: 78, train_loss: 0.4583, test_loss: 0.9260, test_f1: 0.6581
 epoch: 79, train_loss: 0.4866, test_loss: 0.9276, test_f1: 0.6650
 epoch: 80, train_loss: 0.4760, test_loss: 0.9809, test_f1: 0.6573
 epoch: 81, train_loss: 0.4733, test_loss: 0.9439, test_f1: 0.6638
 epoch: 82, train_loss: 0.4669, test_loss: 0.9582, test_f1: 0.6667
 epoch: 83, train_loss: 0.4616, test_loss: 0.9867, test_f1: 0.6761
 epoch: 84, train_loss: 0.4590, test_loss: 1.0299, test_f1: 0.6666
 epoch: 85, train_loss: 0.4571, test_loss: 0.9786, test_f1: 0.6626
 epoch: 86, train_loss: 0.4478, test_loss: 0.9407, test_f1: 0.6643
 epoch: 87, train_loss: 0.4613, test_loss: 0.9552, test_f1: 0.6634
 epoch: 88, train_loss: 0.4584, test_loss: 0.9922, test_f1: 0.6501
 epoch: 89, train_loss: 0.4580, test_loss: 0.9530, test_f1: 0.6626
 epoch: 90, train_loss: 0.4465, test_loss: 1.0117, test_f1: 0.6463
 epoch: 91, train_loss: 0.4397, test_loss: 0.9452, test_f1: 0.6572
 epoch: 92, train_loss: 0.4415, test_loss: 0.9915, test_f1: 0.6616
 epoch: 93, train_loss: 0.4437, test_loss: 1.0468, test_f1: 0.6771
 epoch: 94, train_loss: 0.4481, test_loss: 0.9359, test_f1: 0.6713
 epoch: 95, train_loss: 0.4333, test_loss: 0.9394, test_f1: 0.6605
 epoch: 96, train_loss: 0.4398, test_loss: 1.0131, test_f1: 0.6535
 epoch: 97, train_loss: 0.4345, test_loss: 1.0443, test_f1: 0.6625
 epoch: 98, train_loss: 0.4231, test_loss: 1.0028, test_f1: 0.6534
 epoch: 99, train_loss: 0.4324, test_loss: 0.9839, test_f1: 0.6430

Training completed in 1793.60 seconds
Best F1: 0.7017 at epoch 48
Mean F1 across iterations: 0.6801  0.0123
========================FINAL RESULTS================================
FEGIN weighted F1: 0.7017  0.0123
python main.py --data ltspice_examples --representation component_pin_net --model FEGIN --layers 3 --hiddens 128 --batch_size 32 --lr 0.0001 --emb_size 128 --epochs 100 --save_appendix component_pin_net_L3_H128_BS32_LR0.0001_E128 --no_val
-----



STDERR:
  File "main.py", line 370, in <module>
    main()
  File "main.py", line 254, in main
    dataset = dataset_class(
  File "/home/philip/projects/ltspice_examples_code_repo/Circuit-Completion-Using-GNNs/component_classification_with_link_prediction_head/evaluation/FEGIN/kernel/circuit_datasets.py", line 15, in __init__
    self.data, self.slices = torch.load(self.processed_paths[0])
  File "/home/philip/.local/lib/python3.8/site-packages/torch/serialization.py", line 1040, in load
    warnings.warn(
  File "/usr/lib/python3.8/warnings.py", line 109, in _showwarnmsg
    sw(msg.message, msg.category, msg.filename, msg.lineno,
  File "main.py", line 47, in warn_with_traceback
    traceback.print_stack(file=log)
/home/philip/projects/ltspice_examples_code_repo/Circuit-Completion-Using-GNNs/component_classification_with_link_prediction_head/evaluation/FEGIN/kernel/circuit_datasets.py:15: FutureWarning: You are using `torch.load` with `weights_only=False` (the current default value), which uses the default pickle module implicitly. It is possible to construct malicious pickle data which will execute arbitrary code during unpickling (See https://github.com/pytorch/pytorch/blob/main/SECURITY.md#untrusted-models for more details). In a future release, the default value for `weights_only` will be flipped to `True`. This limits the functions that could be executed during unpickling. Arbitrary objects will no longer be allowed to be loaded via this mode unless they are explicitly allowlisted by the user via `torch.serialization.add_safe_globals`. We recommend you start setting `weights_only=True` for any use case where you don't have full control of the loaded file. Please open an issue on GitHub for any issues related to this experimental feature.
  self.data, self.slices = torch.load(self.processed_paths[0])
