STDOUT:
Results will be saved in /home/philip/projects/ltspice_examples_code_repo/Circuit-Completion-Using-GNNs/component_classification_with_link_prediction_head/evaluation/FEGIN/results/model_FEGIN_dataset_ltspice_demos
Command line input: python main.py --data ltspice_demos --representation component_net --model FEGIN --layers 6 --hiddens 64 --batch_size 256 --lr 0.0001 --emb_size 512 --epochs 100 --save_appendix component_net_L6_H64_BS256_LR0.0001_E512 --no_val
 is saved.
-----
ltspice_demos - FEGIN
Using 6 layers, 64 hidden units, h = 2
Loading component_net representation dataset
ENTERED
Training FEGIN on component_net representation
Train: 1565, Test: 383
##################ITERATION #0 ****************************************
 epoch: 0, train_loss: 1.3844, test_loss: 1.3928, test_f1: 0.1365
 epoch: 1, train_loss: 1.3757, test_loss: 1.3922, test_f1: 0.1365
 epoch: 2, train_loss: 1.3717, test_loss: 1.3907, test_f1: 0.1365
 epoch: 3, train_loss: 1.3660, test_loss: 1.3874, test_f1: 0.1365
 epoch: 4, train_loss: 1.3604, test_loss: 1.3834, test_f1: 0.1365
 epoch: 5, train_loss: 1.3559, test_loss: 1.3805, test_f1: 0.1365
 epoch: 6, train_loss: 1.3483, test_loss: 1.3792, test_f1: 0.1365
 epoch: 7, train_loss: 1.3426, test_loss: 1.3765, test_f1: 0.1365
 epoch: 8, train_loss: 1.3372, test_loss: 1.3718, test_f1: 0.1365
 epoch: 9, train_loss: 1.3289, test_loss: 1.3661, test_f1: 0.1365
 epoch: 10, train_loss: 1.3207, test_loss: 1.3598, test_f1: 0.1365
 epoch: 11, train_loss: 1.3112, test_loss: 1.3517, test_f1: 0.1365
 epoch: 12, train_loss: 1.3028, test_loss: 1.3419, test_f1: 0.1365
 epoch: 13, train_loss: 1.2929, test_loss: 1.3315, test_f1: 0.1365
 epoch: 14, train_loss: 1.2823, test_loss: 1.3205, test_f1: 0.1365
 epoch: 15, train_loss: 1.2722, test_loss: 1.3102, test_f1: 0.1365
 epoch: 16, train_loss: 1.2593, test_loss: 1.3008, test_f1: 0.1365
 epoch: 17, train_loss: 1.2479, test_loss: 1.2920, test_f1: 0.1365
 epoch: 18, train_loss: 1.2378, test_loss: 1.2837, test_f1: 0.1474
 epoch: 19, train_loss: 1.2262, test_loss: 1.2715, test_f1: 0.1550
 epoch: 20, train_loss: 1.2163, test_loss: 1.2633, test_f1: 0.1690
 epoch: 21, train_loss: 1.2053, test_loss: 1.2560, test_f1: 0.1915
 epoch: 22, train_loss: 1.1985, test_loss: 1.2488, test_f1: 0.2406
 epoch: 23, train_loss: 1.1900, test_loss: 1.2401, test_f1: 0.2574
 epoch: 24, train_loss: 1.1816, test_loss: 1.2351, test_f1: 0.2632
 epoch: 25, train_loss: 1.1755, test_loss: 1.2293, test_f1: 0.2918
 epoch: 26, train_loss: 1.1658, test_loss: 1.2231, test_f1: 0.3214
 epoch: 27, train_loss: 1.1592, test_loss: 1.2164, test_f1: 0.3482
 epoch: 28, train_loss: 1.1578, test_loss: 1.2125, test_f1: 0.3535
 epoch: 29, train_loss: 1.1493, test_loss: 1.2091, test_f1: 0.3350
 epoch: 30, train_loss: 1.1463, test_loss: 1.2056, test_f1: 0.3340
 epoch: 31, train_loss: 1.1405, test_loss: 1.2007, test_f1: 0.3277
 epoch: 32, train_loss: 1.1393, test_loss: 1.1955, test_f1: 0.2842
 epoch: 33, train_loss: 1.1284, test_loss: 1.1926, test_f1: 0.2939
 epoch: 34, train_loss: 1.1307, test_loss: 1.1879, test_f1: 0.2879
 epoch: 35, train_loss: 1.1254, test_loss: 1.1845, test_f1: 0.3015
 epoch: 36, train_loss: 1.1257, test_loss: 1.1802, test_f1: 0.2754
 epoch: 37, train_loss: 1.1219, test_loss: 1.1778, test_f1: 0.2662
 epoch: 38, train_loss: 1.1209, test_loss: 1.1766, test_f1: 0.2857
 epoch: 39, train_loss: 1.1125, test_loss: 1.1729, test_f1: 0.2653
 epoch: 40, train_loss: 1.1078, test_loss: 1.1731, test_f1: 0.2667
 epoch: 41, train_loss: 1.1035, test_loss: 1.1729, test_f1: 0.2784
 epoch: 42, train_loss: 1.1061, test_loss: 1.1670, test_f1: 0.3164
 epoch: 43, train_loss: 1.1032, test_loss: 1.1633, test_f1: 0.3395
 epoch: 44, train_loss: 1.1012, test_loss: 1.1633, test_f1: 0.3259
 epoch: 45, train_loss: 1.0931, test_loss: 1.1594, test_f1: 0.3087
 epoch: 46, train_loss: 1.0905, test_loss: 1.1556, test_f1: 0.3146
 epoch: 47, train_loss: 1.0887, test_loss: 1.1549, test_f1: 0.3223
 epoch: 48, train_loss: 1.0880, test_loss: 1.1484, test_f1: 0.3401
 epoch: 49, train_loss: 1.0845, test_loss: 1.1457, test_f1: 0.3411
 epoch: 50, train_loss: 1.0877, test_loss: 1.1439, test_f1: 0.3607
 epoch: 51, train_loss: 1.0788, test_loss: 1.1433, test_f1: 0.3581
 epoch: 52, train_loss: 1.0814, test_loss: 1.1422, test_f1: 0.3716
 epoch: 53, train_loss: 1.0760, test_loss: 1.1403, test_f1: 0.3745
 epoch: 54, train_loss: 1.0738, test_loss: 1.1400, test_f1: 0.3746
 epoch: 55, train_loss: 1.0743, test_loss: 1.1390, test_f1: 0.3705
 epoch: 56, train_loss: 1.0713, test_loss: 1.1395, test_f1: 0.3854
 epoch: 57, train_loss: 1.0684, test_loss: 1.1383, test_f1: 0.3550
 epoch: 58, train_loss: 1.0697, test_loss: 1.1369, test_f1: 0.3808
 epoch: 59, train_loss: 1.0730, test_loss: 1.1358, test_f1: 0.3936
 epoch: 60, train_loss: 1.0639, test_loss: 1.1323, test_f1: 0.3981
 epoch: 61, train_loss: 1.0661, test_loss: 1.1313, test_f1: 0.3913
 epoch: 62, train_loss: 1.0649, test_loss: 1.1318, test_f1: 0.3951
 epoch: 63, train_loss: 1.0641, test_loss: 1.1304, test_f1: 0.4020
 epoch: 64, train_loss: 1.0601, test_loss: 1.1347, test_f1: 0.3966
 epoch: 65, train_loss: 1.0623, test_loss: 1.1306, test_f1: 0.4002
 epoch: 66, train_loss: 1.0555, test_loss: 1.1261, test_f1: 0.3909
 epoch: 67, train_loss: 1.0616, test_loss: 1.1234, test_f1: 0.3926
 epoch: 68, train_loss: 1.0542, test_loss: 1.1219, test_f1: 0.3995
 epoch: 69, train_loss: 1.0534, test_loss: 1.1210, test_f1: 0.3897
 epoch: 70, train_loss: 1.0495, test_loss: 1.1191, test_f1: 0.3938
 epoch: 71, train_loss: 1.0563, test_loss: 1.1180, test_f1: 0.3914
 epoch: 72, train_loss: 1.0541, test_loss: 1.1201, test_f1: 0.4005
 epoch: 73, train_loss: 1.0501, test_loss: 1.1237, test_f1: 0.4112
 epoch: 74, train_loss: 1.0464, test_loss: 1.1226, test_f1: 0.4245
 epoch: 75, train_loss: 1.0455, test_loss: 1.1222, test_f1: 0.4277
 epoch: 76, train_loss: 1.0457, test_loss: 1.1182, test_f1: 0.4359
 epoch: 77, train_loss: 1.0420, test_loss: 1.1148, test_f1: 0.4586
 epoch: 78, train_loss: 1.0434, test_loss: 1.1149, test_f1: 0.4648
 epoch: 79, train_loss: 1.0424, test_loss: 1.1159, test_f1: 0.4722
 epoch: 80, train_loss: 1.0398, test_loss: 1.1134, test_f1: 0.4526
 epoch: 81, train_loss: 1.0333, test_loss: 1.1082, test_f1: 0.4736
 epoch: 82, train_loss: 1.0376, test_loss: 1.1050, test_f1: 0.4627
 epoch: 83, train_loss: 1.0313, test_loss: 1.1033, test_f1: 0.4734
 epoch: 84, train_loss: 1.0329, test_loss: 1.1042, test_f1: 0.4587
 epoch: 85, train_loss: 1.0310, test_loss: 1.1042, test_f1: 0.4677
 epoch: 86, train_loss: 1.0284, test_loss: 1.1036, test_f1: 0.4914
 epoch: 87, train_loss: 1.0256, test_loss: 1.1030, test_f1: 0.4907
 epoch: 88, train_loss: 1.0260, test_loss: 1.1018, test_f1: 0.4955
 epoch: 89, train_loss: 1.0282, test_loss: 1.1006, test_f1: 0.4769
 epoch: 90, train_loss: 1.0276, test_loss: 1.1001, test_f1: 0.4761
 epoch: 91, train_loss: 1.0285, test_loss: 1.0968, test_f1: 0.4967
 epoch: 92, train_loss: 1.0203, test_loss: 1.0946, test_f1: 0.4993
 epoch: 93, train_loss: 1.0159, test_loss: 1.0922, test_f1: 0.5023
 epoch: 94, train_loss: 1.0193, test_loss: 1.0924, test_f1: 0.5051
 epoch: 95, train_loss: 1.0259, test_loss: 1.0951, test_f1: 0.5087
 epoch: 96, train_loss: 1.0131, test_loss: 1.0918, test_f1: 0.5085
 epoch: 97, train_loss: 1.0184, test_loss: 1.0973, test_f1: 0.5078
 epoch: 98, train_loss: 1.0199, test_loss: 1.0964, test_f1: 0.5068
 epoch: 99, train_loss: 1.0091, test_loss: 1.0943, test_f1: 0.5068
##################ITERATION #1 ****************************************
 epoch: 0, train_loss: 1.3434, test_loss: 1.3760, test_f1: 0.1365
 epoch: 1, train_loss: 1.3262, test_loss: 1.3759, test_f1: 0.1365
 epoch: 2, train_loss: 1.3147, test_loss: 1.3738, test_f1: 0.1365
 epoch: 3, train_loss: 1.3047, test_loss: 1.3712, test_f1: 0.1365
 epoch: 4, train_loss: 1.2941, test_loss: 1.3636, test_f1: 0.1365
 epoch: 5, train_loss: 1.2833, test_loss: 1.3489, test_f1: 0.1365
 epoch: 6, train_loss: 1.2720, test_loss: 1.3334, test_f1: 0.1365
 epoch: 7, train_loss: 1.2603, test_loss: 1.3241, test_f1: 0.1365
 epoch: 8, train_loss: 1.2491, test_loss: 1.3060, test_f1: 0.1773
 epoch: 9, train_loss: 1.2358, test_loss: 1.2879, test_f1: 0.2586
 epoch: 10, train_loss: 1.2238, test_loss: 1.2746, test_f1: 0.3143
 epoch: 11, train_loss: 1.2150, test_loss: 1.2623, test_f1: 0.3196
 epoch: 12, train_loss: 1.2029, test_loss: 1.2506, test_f1: 0.3304
 epoch: 13, train_loss: 1.1916, test_loss: 1.2361, test_f1: 0.3559
 epoch: 14, train_loss: 1.1866, test_loss: 1.2273, test_f1: 0.3650
 epoch: 15, train_loss: 1.1770, test_loss: 1.2201, test_f1: 0.3628
 epoch: 16, train_loss: 1.1689, test_loss: 1.2129, test_f1: 0.3529
 epoch: 17, train_loss: 1.1600, test_loss: 1.2075, test_f1: 0.3355
 epoch: 18, train_loss: 1.1542, test_loss: 1.2025, test_f1: 0.3290
 epoch: 19, train_loss: 1.1474, test_loss: 1.1995, test_f1: 0.3295
 epoch: 20, train_loss: 1.1441, test_loss: 1.1951, test_f1: 0.3320
 epoch: 21, train_loss: 1.1335, test_loss: 1.1911, test_f1: 0.3320
 epoch: 22, train_loss: 1.1389, test_loss: 1.1855, test_f1: 0.3428
 epoch: 23, train_loss: 1.1279, test_loss: 1.1819, test_f1: 0.3196
 epoch: 24, train_loss: 1.1242, test_loss: 1.1804, test_f1: 0.3179
 epoch: 25, train_loss: 1.1215, test_loss: 1.1776, test_f1: 0.3161
 epoch: 26, train_loss: 1.1153, test_loss: 1.1770, test_f1: 0.3398
 epoch: 27, train_loss: 1.1113, test_loss: 1.1762, test_f1: 0.3501
 epoch: 28, train_loss: 1.1126, test_loss: 1.1753, test_f1: 0.3471
 epoch: 29, train_loss: 1.1081, test_loss: 1.1783, test_f1: 0.3574
 epoch: 30, train_loss: 1.1061, test_loss: 1.1722, test_f1: 0.3540
 epoch: 31, train_loss: 1.1000, test_loss: 1.1718, test_f1: 0.3568
 epoch: 32, train_loss: 1.0985, test_loss: 1.1686, test_f1: 0.3536
 epoch: 33, train_loss: 1.0943, test_loss: 1.1659, test_f1: 0.3579
 epoch: 34, train_loss: 1.0899, test_loss: 1.1637, test_f1: 0.3699
 epoch: 35, train_loss: 1.0885, test_loss: 1.1609, test_f1: 0.3737
 epoch: 36, train_loss: 1.0877, test_loss: 1.1577, test_f1: 0.3772
 epoch: 37, train_loss: 1.0781, test_loss: 1.1556, test_f1: 0.3808
 epoch: 38, train_loss: 1.0789, test_loss: 1.1587, test_f1: 0.3807
 epoch: 39, train_loss: 1.0727, test_loss: 1.1514, test_f1: 0.3806
 epoch: 40, train_loss: 1.0747, test_loss: 1.1472, test_f1: 0.3839
 epoch: 41, train_loss: 1.0692, test_loss: 1.1419, test_f1: 0.3800
 epoch: 42, train_loss: 1.0712, test_loss: 1.1493, test_f1: 0.3875
 epoch: 43, train_loss: 1.0637, test_loss: 1.1450, test_f1: 0.3914
 epoch: 44, train_loss: 1.0597, test_loss: 1.1390, test_f1: 0.4029
 epoch: 45, train_loss: 1.0573, test_loss: 1.1393, test_f1: 0.4397
 epoch: 46, train_loss: 1.0505, test_loss: 1.1338, test_f1: 0.4636
 epoch: 47, train_loss: 1.0461, test_loss: 1.1329, test_f1: 0.4615
 epoch: 48, train_loss: 1.0494, test_loss: 1.1351, test_f1: 0.4714
 epoch: 49, train_loss: 1.0440, test_loss: 1.1263, test_f1: 0.4697
 epoch: 50, train_loss: 1.0467, test_loss: 1.1328, test_f1: 0.4644
 epoch: 51, train_loss: 1.0385, test_loss: 1.1290, test_f1: 0.4651
 epoch: 52, train_loss: 1.0362, test_loss: 1.1280, test_f1: 0.4642
 epoch: 53, train_loss: 1.0401, test_loss: 1.1305, test_f1: 0.4644
 epoch: 54, train_loss: 1.0352, test_loss: 1.1319, test_f1: 0.4660
 epoch: 55, train_loss: 1.0268, test_loss: 1.1328, test_f1: 0.4633
 epoch: 56, train_loss: 1.0319, test_loss: 1.1308, test_f1: 0.4701
 epoch: 57, train_loss: 1.0326, test_loss: 1.1366, test_f1: 0.4685
 epoch: 58, train_loss: 1.0296, test_loss: 1.1451, test_f1: 0.4707
 epoch: 59, train_loss: 1.0272, test_loss: 1.1354, test_f1: 0.4694
 epoch: 60, train_loss: 1.0256, test_loss: 1.1379, test_f1: 0.4750
 epoch: 61, train_loss: 1.0261, test_loss: 1.1333, test_f1: 0.4811
 epoch: 62, train_loss: 1.0212, test_loss: 1.1394, test_f1: 0.4713
 epoch: 63, train_loss: 1.0215, test_loss: 1.1312, test_f1: 0.4834
 epoch: 64, train_loss: 1.0254, test_loss: 1.1275, test_f1: 0.4837
 epoch: 65, train_loss: 1.0192, test_loss: 1.1273, test_f1: 0.4750
 epoch: 66, train_loss: 1.0203, test_loss: 1.1199, test_f1: 0.4874
 epoch: 67, train_loss: 1.0093, test_loss: 1.1180, test_f1: 0.4976
 epoch: 68, train_loss: 1.0118, test_loss: 1.1214, test_f1: 0.4830
 epoch: 69, train_loss: 1.0108, test_loss: 1.1251, test_f1: 0.4931
 epoch: 70, train_loss: 1.0099, test_loss: 1.1207, test_f1: 0.4972
 epoch: 71, train_loss: 1.0047, test_loss: 1.1151, test_f1: 0.4975
 epoch: 72, train_loss: 1.0044, test_loss: 1.1143, test_f1: 0.4902
 epoch: 73, train_loss: 1.0082, test_loss: 1.1227, test_f1: 0.4845
 epoch: 74, train_loss: 1.0068, test_loss: 1.1087, test_f1: 0.4942
 epoch: 75, train_loss: 1.0017, test_loss: 1.1111, test_f1: 0.4976
 epoch: 76, train_loss: 1.0026, test_loss: 1.1162, test_f1: 0.4982
 epoch: 77, train_loss: 0.9983, test_loss: 1.1228, test_f1: 0.4943
 epoch: 78, train_loss: 0.9962, test_loss: 1.1156, test_f1: 0.4996
 epoch: 79, train_loss: 0.9888, test_loss: 1.1220, test_f1: 0.5020
 epoch: 80, train_loss: 0.9867, test_loss: 1.1231, test_f1: 0.4927
 epoch: 81, train_loss: 0.9894, test_loss: 1.1215, test_f1: 0.5014
 epoch: 82, train_loss: 0.9935, test_loss: 1.1208, test_f1: 0.4993
 epoch: 83, train_loss: 0.9921, test_loss: 1.1164, test_f1: 0.5018
 epoch: 84, train_loss: 0.9829, test_loss: 1.1165, test_f1: 0.5038
 epoch: 85, train_loss: 0.9902, test_loss: 1.1017, test_f1: 0.5104
 epoch: 86, train_loss: 0.9818, test_loss: 1.0970, test_f1: 0.5002
 epoch: 87, train_loss: 0.9809, test_loss: 1.0992, test_f1: 0.5029
 epoch: 88, train_loss: 0.9842, test_loss: 1.1025, test_f1: 0.5072
 epoch: 89, train_loss: 0.9851, test_loss: 1.0944, test_f1: 0.5150
 epoch: 90, train_loss: 0.9799, test_loss: 1.1007, test_f1: 0.5168
 epoch: 91, train_loss: 0.9761, test_loss: 1.1007, test_f1: 0.5155
 epoch: 92, train_loss: 0.9710, test_loss: 1.1051, test_f1: 0.5179
 epoch: 93, train_loss: 0.9706, test_loss: 1.1058, test_f1: 0.5244
 epoch: 94, train_loss: 0.9725, test_loss: 1.1130, test_f1: 0.5136
 epoch: 95, train_loss: 0.9670, test_loss: 1.0980, test_f1: 0.5138
 epoch: 96, train_loss: 0.9646, test_loss: 1.1024, test_f1: 0.5203
 epoch: 97, train_loss: 0.9635, test_loss: 1.1042, test_f1: 0.5140
 epoch: 98, train_loss: 0.9723, test_loss: 1.0996, test_f1: 0.5167
 epoch: 99, train_loss: 0.9613, test_loss: 1.1016, test_f1: 0.5159
##################ITERATION #2 ****************************************
 epoch: 0, train_loss: 1.3109, test_loss: 1.3618, test_f1: 0.1365
 epoch: 1, train_loss: 1.2844, test_loss: 1.3576, test_f1: 0.1365
 epoch: 2, train_loss: 1.2708, test_loss: 1.3565, test_f1: 0.1365
 epoch: 3, train_loss: 1.2582, test_loss: 1.3565, test_f1: 0.1365
 epoch: 4, train_loss: 1.2449, test_loss: 1.3507, test_f1: 0.1365
 epoch: 5, train_loss: 1.2298, test_loss: 1.3419, test_f1: 0.1494
 epoch: 6, train_loss: 1.2212, test_loss: 1.3342, test_f1: 0.2463
 epoch: 7, train_loss: 1.2078, test_loss: 1.3263, test_f1: 0.2727
 epoch: 8, train_loss: 1.2013, test_loss: 1.3157, test_f1: 0.3111
 epoch: 9, train_loss: 1.1969, test_loss: 1.3022, test_f1: 0.3335
 epoch: 10, train_loss: 1.1848, test_loss: 1.2899, test_f1: 0.3518
 epoch: 11, train_loss: 1.1793, test_loss: 1.2749, test_f1: 0.3455
 epoch: 12, train_loss: 1.1664, test_loss: 1.2581, test_f1: 0.3226
 epoch: 13, train_loss: 1.1595, test_loss: 1.2421, test_f1: 0.3219
 epoch: 14, train_loss: 1.1561, test_loss: 1.2271, test_f1: 0.2934
 epoch: 15, train_loss: 1.1489, test_loss: 1.2154, test_f1: 0.2667
 epoch: 16, train_loss: 1.1415, test_loss: 1.2072, test_f1: 0.2673
 epoch: 17, train_loss: 1.1368, test_loss: 1.2004, test_f1: 0.2700
 epoch: 18, train_loss: 1.1317, test_loss: 1.1953, test_f1: 0.2754
 epoch: 19, train_loss: 1.1237, test_loss: 1.1905, test_f1: 0.2803
 epoch: 20, train_loss: 1.1235, test_loss: 1.1860, test_f1: 0.2754
 epoch: 21, train_loss: 1.1143, test_loss: 1.1823, test_f1: 0.3003
 epoch: 22, train_loss: 1.1179, test_loss: 1.1806, test_f1: 0.3130
 epoch: 23, train_loss: 1.1052, test_loss: 1.1733, test_f1: 0.2988
 epoch: 24, train_loss: 1.1008, test_loss: 1.1699, test_f1: 0.3206
 epoch: 25, train_loss: 1.0967, test_loss: 1.1653, test_f1: 0.3339
 epoch: 26, train_loss: 1.0907, test_loss: 1.1644, test_f1: 0.3340
 epoch: 27, train_loss: 1.0861, test_loss: 1.1636, test_f1: 0.3340
 epoch: 28, train_loss: 1.0848, test_loss: 1.1605, test_f1: 0.3384
 epoch: 29, train_loss: 1.0799, test_loss: 1.1549, test_f1: 0.3591
 epoch: 30, train_loss: 1.0797, test_loss: 1.1514, test_f1: 0.3669
 epoch: 31, train_loss: 1.0782, test_loss: 1.1483, test_f1: 0.3774
 epoch: 32, train_loss: 1.0722, test_loss: 1.1540, test_f1: 0.3956
 epoch: 33, train_loss: 1.0636, test_loss: 1.1464, test_f1: 0.3970
 epoch: 34, train_loss: 1.0680, test_loss: 1.1446, test_f1: 0.4065
 epoch: 35, train_loss: 1.0557, test_loss: 1.1386, test_f1: 0.4052
 epoch: 36, train_loss: 1.0507, test_loss: 1.1397, test_f1: 0.4128
 epoch: 37, train_loss: 1.0499, test_loss: 1.1387, test_f1: 0.4025
 epoch: 38, train_loss: 1.0529, test_loss: 1.1339, test_f1: 0.4279
 epoch: 39, train_loss: 1.0426, test_loss: 1.1331, test_f1: 0.4306
 epoch: 40, train_loss: 1.0413, test_loss: 1.1312, test_f1: 0.4303
 epoch: 41, train_loss: 1.0327, test_loss: 1.1291, test_f1: 0.4521
 epoch: 42, train_loss: 1.0324, test_loss: 1.1250, test_f1: 0.4430
 epoch: 43, train_loss: 1.0276, test_loss: 1.1219, test_f1: 0.4469
 epoch: 44, train_loss: 1.0201, test_loss: 1.1244, test_f1: 0.4539
 epoch: 45, train_loss: 1.0227, test_loss: 1.1205, test_f1: 0.4641
 epoch: 46, train_loss: 1.0158, test_loss: 1.1181, test_f1: 0.4663
 epoch: 47, train_loss: 1.0145, test_loss: 1.1072, test_f1: 0.4791
 epoch: 48, train_loss: 1.0101, test_loss: 1.1032, test_f1: 0.4795
 epoch: 49, train_loss: 0.9983, test_loss: 1.1047, test_f1: 0.4733
 epoch: 50, train_loss: 1.0083, test_loss: 1.0944, test_f1: 0.4719
 epoch: 51, train_loss: 0.9995, test_loss: 1.0938, test_f1: 0.4851
 epoch: 52, train_loss: 0.9958, test_loss: 1.0928, test_f1: 0.4854
 epoch: 53, train_loss: 0.9928, test_loss: 1.0883, test_f1: 0.4890
 epoch: 54, train_loss: 0.9937, test_loss: 1.0932, test_f1: 0.4883
 epoch: 55, train_loss: 0.9920, test_loss: 1.0829, test_f1: 0.4886
 epoch: 56, train_loss: 0.9908, test_loss: 1.0854, test_f1: 0.4838
 epoch: 57, train_loss: 0.9797, test_loss: 1.0937, test_f1: 0.4944
 epoch: 58, train_loss: 0.9812, test_loss: 1.0914, test_f1: 0.4955
 epoch: 59, train_loss: 0.9763, test_loss: 1.0876, test_f1: 0.5033
 epoch: 60, train_loss: 0.9836, test_loss: 1.0787, test_f1: 0.5041
 epoch: 61, train_loss: 0.9735, test_loss: 1.0838, test_f1: 0.5037
 epoch: 62, train_loss: 0.9729, test_loss: 1.0814, test_f1: 0.5117
 epoch: 63, train_loss: 0.9664, test_loss: 1.0839, test_f1: 0.5088
 epoch: 64, train_loss: 0.9737, test_loss: 1.0831, test_f1: 0.5131
 epoch: 65, train_loss: 0.9693, test_loss: 1.0814, test_f1: 0.5133
 epoch: 66, train_loss: 0.9658, test_loss: 1.0792, test_f1: 0.5082
 epoch: 67, train_loss: 0.9695, test_loss: 1.0838, test_f1: 0.5078
 epoch: 68, train_loss: 0.9677, test_loss: 1.0906, test_f1: 0.5140
 epoch: 69, train_loss: 0.9631, test_loss: 1.0824, test_f1: 0.5118
 epoch: 70, train_loss: 0.9577, test_loss: 1.0716, test_f1: 0.5099
 epoch: 71, train_loss: 0.9543, test_loss: 1.0696, test_f1: 0.5107
 epoch: 72, train_loss: 0.9544, test_loss: 1.0716, test_f1: 0.5052
 epoch: 73, train_loss: 0.9543, test_loss: 1.0781, test_f1: 0.5145
 epoch: 74, train_loss: 0.9540, test_loss: 1.0762, test_f1: 0.5214
 epoch: 75, train_loss: 0.9471, test_loss: 1.0915, test_f1: 0.5208
 epoch: 76, train_loss: 0.9524, test_loss: 1.0877, test_f1: 0.5122
 epoch: 77, train_loss: 0.9440, test_loss: 1.0735, test_f1: 0.5194
 epoch: 78, train_loss: 0.9492, test_loss: 1.0708, test_f1: 0.5207
 epoch: 79, train_loss: 0.9432, test_loss: 1.0648, test_f1: 0.5288
 epoch: 80, train_loss: 0.9386, test_loss: 1.0598, test_f1: 0.5290
 epoch: 81, train_loss: 0.9348, test_loss: 1.0697, test_f1: 0.5323
 epoch: 82, train_loss: 0.9336, test_loss: 1.0604, test_f1: 0.5288
 epoch: 83, train_loss: 0.9407, test_loss: 1.0671, test_f1: 0.5365
 epoch: 84, train_loss: 0.9358, test_loss: 1.0704, test_f1: 0.5320
 epoch: 85, train_loss: 0.9337, test_loss: 1.0670, test_f1: 0.5306
 epoch: 86, train_loss: 0.9312, test_loss: 1.0630, test_f1: 0.5233
 epoch: 87, train_loss: 0.9310, test_loss: 1.0734, test_f1: 0.5260
 epoch: 88, train_loss: 0.9238, test_loss: 1.0664, test_f1: 0.5317
 epoch: 89, train_loss: 0.9287, test_loss: 1.0678, test_f1: 0.5257
 epoch: 90, train_loss: 0.9269, test_loss: 1.0681, test_f1: 0.5354
 epoch: 91, train_loss: 0.9149, test_loss: 1.0648, test_f1: 0.5326
 epoch: 92, train_loss: 0.9225, test_loss: 1.0636, test_f1: 0.5316
 epoch: 93, train_loss: 0.9152, test_loss: 1.0617, test_f1: 0.5334
 epoch: 94, train_loss: 0.9233, test_loss: 1.0669, test_f1: 0.5460
 epoch: 95, train_loss: 0.9159, test_loss: 1.0723, test_f1: 0.5454
 epoch: 96, train_loss: 0.9100, test_loss: 1.0790, test_f1: 0.5464
 epoch: 97, train_loss: 0.9128, test_loss: 1.0643, test_f1: 0.5364
 epoch: 98, train_loss: 0.9107, test_loss: 1.0713, test_f1: 0.5479
 epoch: 99, train_loss: 0.9099, test_loss: 1.0735, test_f1: 0.5351
##################ITERATION #3 ****************************************
 epoch: 0, train_loss: 1.2771, test_loss: 1.3576, test_f1: 0.2281
 epoch: 1, train_loss: 1.2364, test_loss: 1.3523, test_f1: 0.2281
 epoch: 2, train_loss: 1.2236, test_loss: 1.3493, test_f1: 0.2281
 epoch: 3, train_loss: 1.2058, test_loss: 1.3473, test_f1: 0.2281
 epoch: 4, train_loss: 1.1941, test_loss: 1.3440, test_f1: 0.2281
 epoch: 5, train_loss: 1.1882, test_loss: 1.3353, test_f1: 0.2281
 epoch: 6, train_loss: 1.1792, test_loss: 1.3206, test_f1: 0.2281
 epoch: 7, train_loss: 1.1719, test_loss: 1.2932, test_f1: 0.2281
 epoch: 8, train_loss: 1.1612, test_loss: 1.2604, test_f1: 0.2274
 epoch: 9, train_loss: 1.1500, test_loss: 1.2328, test_f1: 0.2248
 epoch: 10, train_loss: 1.1455, test_loss: 1.2175, test_f1: 0.2315
 epoch: 11, train_loss: 1.1420, test_loss: 1.2050, test_f1: 0.2315
 epoch: 12, train_loss: 1.1344, test_loss: 1.1973, test_f1: 0.2371
 epoch: 13, train_loss: 1.1335, test_loss: 1.1897, test_f1: 0.2378
 epoch: 14, train_loss: 1.1223, test_loss: 1.1847, test_f1: 0.2413
 epoch: 15, train_loss: 1.1240, test_loss: 1.1793, test_f1: 0.2516
 epoch: 16, train_loss: 1.1189, test_loss: 1.1772, test_f1: 0.2489
 epoch: 17, train_loss: 1.1110, test_loss: 1.1746, test_f1: 0.2812
 epoch: 18, train_loss: 1.1075, test_loss: 1.1704, test_f1: 0.2891
 epoch: 19, train_loss: 1.1031, test_loss: 1.1633, test_f1: 0.3038
 epoch: 20, train_loss: 1.1037, test_loss: 1.1576, test_f1: 0.3296
 epoch: 21, train_loss: 1.0941, test_loss: 1.1517, test_f1: 0.3848
 epoch: 22, train_loss: 1.0993, test_loss: 1.1480, test_f1: 0.3936
 epoch: 23, train_loss: 1.0846, test_loss: 1.1457, test_f1: 0.3805
 epoch: 24, train_loss: 1.0793, test_loss: 1.1446, test_f1: 0.3828
 epoch: 25, train_loss: 1.0818, test_loss: 1.1438, test_f1: 0.3926
 epoch: 26, train_loss: 1.0701, test_loss: 1.1445, test_f1: 0.4143
 epoch: 27, train_loss: 1.0630, test_loss: 1.1395, test_f1: 0.4124
 epoch: 28, train_loss: 1.0686, test_loss: 1.1419, test_f1: 0.4217
 epoch: 29, train_loss: 1.0647, test_loss: 1.1329, test_f1: 0.4366
 epoch: 30, train_loss: 1.0592, test_loss: 1.1295, test_f1: 0.4449
 epoch: 31, train_loss: 1.0516, test_loss: 1.1318, test_f1: 0.4571
 epoch: 32, train_loss: 1.0484, test_loss: 1.1267, test_f1: 0.4559
 epoch: 33, train_loss: 1.0467, test_loss: 1.1267, test_f1: 0.4566
 epoch: 34, train_loss: 1.0428, test_loss: 1.1164, test_f1: 0.4637
 epoch: 35, train_loss: 1.0419, test_loss: 1.1126, test_f1: 0.4411
 epoch: 36, train_loss: 1.0244, test_loss: 1.1116, test_f1: 0.4349
 epoch: 37, train_loss: 1.0352, test_loss: 1.1091, test_f1: 0.4496
 epoch: 38, train_loss: 1.0292, test_loss: 1.1043, test_f1: 0.4450
 epoch: 39, train_loss: 1.0220, test_loss: 1.1019, test_f1: 0.4489
 epoch: 40, train_loss: 1.0182, test_loss: 1.1080, test_f1: 0.4510
 epoch: 41, train_loss: 1.0206, test_loss: 1.1060, test_f1: 0.4718
 epoch: 42, train_loss: 1.0185, test_loss: 1.0978, test_f1: 0.4816
 epoch: 43, train_loss: 1.0089, test_loss: 1.1021, test_f1: 0.4670
 epoch: 44, train_loss: 1.0053, test_loss: 1.0951, test_f1: 0.4717
 epoch: 45, train_loss: 1.0036, test_loss: 1.0952, test_f1: 0.4915
 epoch: 46, train_loss: 0.9970, test_loss: 1.0887, test_f1: 0.4904
 epoch: 47, train_loss: 0.9926, test_loss: 1.0893, test_f1: 0.4864
 epoch: 48, train_loss: 0.9873, test_loss: 1.0772, test_f1: 0.4834
 epoch: 49, train_loss: 0.9887, test_loss: 1.0738, test_f1: 0.4847
 epoch: 50, train_loss: 0.9827, test_loss: 1.0702, test_f1: 0.4748
 epoch: 51, train_loss: 0.9805, test_loss: 1.0703, test_f1: 0.4838
 epoch: 52, train_loss: 0.9760, test_loss: 1.0714, test_f1: 0.4876
 epoch: 53, train_loss: 0.9720, test_loss: 1.0645, test_f1: 0.4983
 epoch: 54, train_loss: 0.9746, test_loss: 1.0605, test_f1: 0.4972
 epoch: 55, train_loss: 0.9690, test_loss: 1.0622, test_f1: 0.5028
 epoch: 56, train_loss: 0.9675, test_loss: 1.0629, test_f1: 0.4945
 epoch: 57, train_loss: 0.9700, test_loss: 1.0648, test_f1: 0.5110
 epoch: 58, train_loss: 0.9643, test_loss: 1.0681, test_f1: 0.5190
 epoch: 59, train_loss: 0.9598, test_loss: 1.0652, test_f1: 0.4939
 epoch: 60, train_loss: 0.9619, test_loss: 1.0681, test_f1: 0.5070
 epoch: 61, train_loss: 0.9627, test_loss: 1.0685, test_f1: 0.5084
 epoch: 62, train_loss: 0.9552, test_loss: 1.0635, test_f1: 0.5132
 epoch: 63, train_loss: 0.9545, test_loss: 1.0567, test_f1: 0.5075
 epoch: 64, train_loss: 0.9627, test_loss: 1.0552, test_f1: 0.5126
 epoch: 65, train_loss: 0.9537, test_loss: 1.0531, test_f1: 0.5098
 epoch: 66, train_loss: 0.9560, test_loss: 1.0577, test_f1: 0.5131
 epoch: 67, train_loss: 0.9490, test_loss: 1.0570, test_f1: 0.5203
 epoch: 68, train_loss: 0.9441, test_loss: 1.0593, test_f1: 0.5291
 epoch: 69, train_loss: 0.9436, test_loss: 1.0523, test_f1: 0.5364
 epoch: 70, train_loss: 0.9550, test_loss: 1.0446, test_f1: 0.5112
 epoch: 71, train_loss: 0.9497, test_loss: 1.0433, test_f1: 0.5221
 epoch: 72, train_loss: 0.9499, test_loss: 1.0398, test_f1: 0.5308
 epoch: 73, train_loss: 0.9430, test_loss: 1.0414, test_f1: 0.5267
 epoch: 74, train_loss: 0.9360, test_loss: 1.0418, test_f1: 0.5312
 epoch: 75, train_loss: 0.9252, test_loss: 1.0520, test_f1: 0.5302
 epoch: 76, train_loss: 0.9347, test_loss: 1.0590, test_f1: 0.5104
 epoch: 77, train_loss: 0.9310, test_loss: 1.0488, test_f1: 0.5138
 epoch: 78, train_loss: 0.9226, test_loss: 1.0480, test_f1: 0.5020
 epoch: 79, train_loss: 0.9254, test_loss: 1.0490, test_f1: 0.5062
 epoch: 80, train_loss: 0.9267, test_loss: 1.0660, test_f1: 0.5034
 epoch: 81, train_loss: 0.9270, test_loss: 1.0583, test_f1: 0.5096
 epoch: 82, train_loss: 0.9217, test_loss: 1.0453, test_f1: 0.5247
 epoch: 83, train_loss: 0.9339, test_loss: 1.0509, test_f1: 0.5274
 epoch: 84, train_loss: 0.9291, test_loss: 1.0508, test_f1: 0.5366
 epoch: 85, train_loss: 0.9130, test_loss: 1.0519, test_f1: 0.5350
 epoch: 86, train_loss: 0.9090, test_loss: 1.0540, test_f1: 0.5424
 epoch: 87, train_loss: 0.9209, test_loss: 1.0447, test_f1: 0.5446
 epoch: 88, train_loss: 0.9278, test_loss: 1.0278, test_f1: 0.5398
 epoch: 89, train_loss: 0.9220, test_loss: 1.0395, test_f1: 0.5407
 epoch: 90, train_loss: 0.9150, test_loss: 1.0396, test_f1: 0.5277
 epoch: 91, train_loss: 0.9145, test_loss: 1.0412, test_f1: 0.5289
 epoch: 92, train_loss: 0.9030, test_loss: 1.0451, test_f1: 0.5493
 epoch: 93, train_loss: 0.9103, test_loss: 1.0426, test_f1: 0.5449
 epoch: 94, train_loss: 0.9100, test_loss: 1.0344, test_f1: 0.5411
 epoch: 95, train_loss: 0.8991, test_loss: 1.0237, test_f1: 0.5303
 epoch: 96, train_loss: 0.9033, test_loss: 1.0310, test_f1: 0.5333
 epoch: 97, train_loss: 0.9000, test_loss: 1.0328, test_f1: 0.5412
 epoch: 98, train_loss: 0.8991, test_loss: 1.0380, test_f1: 0.5327
 epoch: 99, train_loss: 0.9056, test_loss: 1.0403, test_f1: 0.5442
##################ITERATION #4 ****************************************
 epoch: 0, train_loss: 1.2824, test_loss: 1.3488, test_f1: 0.2281
 epoch: 1, train_loss: 1.2418, test_loss: 1.3436, test_f1: 0.2926
 epoch: 2, train_loss: 1.2275, test_loss: 1.3356, test_f1: 0.1815
 epoch: 3, train_loss: 1.2155, test_loss: 1.3229, test_f1: 0.2577
 epoch: 4, train_loss: 1.1968, test_loss: 1.3179, test_f1: 0.3311
 epoch: 5, train_loss: 1.1860, test_loss: 1.3138, test_f1: 0.2905
 epoch: 6, train_loss: 1.1772, test_loss: 1.3085, test_f1: 0.2816
 epoch: 7, train_loss: 1.1688, test_loss: 1.2942, test_f1: 0.2720
 epoch: 8, train_loss: 1.1547, test_loss: 1.2653, test_f1: 0.2706
 epoch: 9, train_loss: 1.1490, test_loss: 1.2367, test_f1: 0.2996
 epoch: 10, train_loss: 1.1498, test_loss: 1.2199, test_f1: 0.3358
 epoch: 11, train_loss: 1.1372, test_loss: 1.2104, test_f1: 0.3508
 epoch: 12, train_loss: 1.1284, test_loss: 1.1958, test_f1: 0.3654
 epoch: 13, train_loss: 1.1188, test_loss: 1.1826, test_f1: 0.3942
 epoch: 14, train_loss: 1.1193, test_loss: 1.1754, test_f1: 0.3847
 epoch: 15, train_loss: 1.1110, test_loss: 1.1686, test_f1: 0.3951
 epoch: 16, train_loss: 1.1091, test_loss: 1.1637, test_f1: 0.3953
 epoch: 17, train_loss: 1.0989, test_loss: 1.1555, test_f1: 0.4055
 epoch: 18, train_loss: 1.0984, test_loss: 1.1527, test_f1: 0.4136
 epoch: 19, train_loss: 1.0930, test_loss: 1.1484, test_f1: 0.4285
 epoch: 20, train_loss: 1.0859, test_loss: 1.1398, test_f1: 0.4249
 epoch: 21, train_loss: 1.0828, test_loss: 1.1327, test_f1: 0.4434
 epoch: 22, train_loss: 1.0706, test_loss: 1.1301, test_f1: 0.4382
 epoch: 23, train_loss: 1.0677, test_loss: 1.1248, test_f1: 0.4378
 epoch: 24, train_loss: 1.0625, test_loss: 1.1237, test_f1: 0.4507
 epoch: 25, train_loss: 1.0629, test_loss: 1.1323, test_f1: 0.4536
 epoch: 26, train_loss: 1.0548, test_loss: 1.1212, test_f1: 0.4543
 epoch: 27, train_loss: 1.0462, test_loss: 1.1227, test_f1: 0.4644
 epoch: 28, train_loss: 1.0489, test_loss: 1.1196, test_f1: 0.4683
 epoch: 29, train_loss: 1.0418, test_loss: 1.1134, test_f1: 0.4767
 epoch: 30, train_loss: 1.0342, test_loss: 1.1078, test_f1: 0.4911
 epoch: 31, train_loss: 1.0322, test_loss: 1.1037, test_f1: 0.5018
 epoch: 32, train_loss: 1.0280, test_loss: 1.1030, test_f1: 0.4993
 epoch: 33, train_loss: 1.0214, test_loss: 1.1064, test_f1: 0.5003
 epoch: 34, train_loss: 1.0187, test_loss: 1.1063, test_f1: 0.4993
 epoch: 35, train_loss: 1.0199, test_loss: 1.0966, test_f1: 0.5041
 epoch: 36, train_loss: 1.0131, test_loss: 1.0933, test_f1: 0.5074
 epoch: 37, train_loss: 1.0119, test_loss: 1.0839, test_f1: 0.5066
 epoch: 38, train_loss: 1.0041, test_loss: 1.0835, test_f1: 0.5172
 epoch: 39, train_loss: 1.0056, test_loss: 1.0782, test_f1: 0.5202
 epoch: 40, train_loss: 0.9907, test_loss: 1.0739, test_f1: 0.5163
 epoch: 41, train_loss: 1.0001, test_loss: 1.0725, test_f1: 0.5138
 epoch: 42, train_loss: 0.9952, test_loss: 1.0746, test_f1: 0.5047
 epoch: 43, train_loss: 0.9923, test_loss: 1.0804, test_f1: 0.5088
 epoch: 44, train_loss: 0.9845, test_loss: 1.0864, test_f1: 0.5112
 epoch: 45, train_loss: 0.9892, test_loss: 1.0671, test_f1: 0.5188
 epoch: 46, train_loss: 0.9795, test_loss: 1.0606, test_f1: 0.5058
 epoch: 47, train_loss: 0.9772, test_loss: 1.0699, test_f1: 0.5218
 epoch: 48, train_loss: 0.9775, test_loss: 1.1038, test_f1: 0.5238
 epoch: 49, train_loss: 0.9666, test_loss: 1.0948, test_f1: 0.5159
 epoch: 50, train_loss: 0.9607, test_loss: 1.0767, test_f1: 0.5125
 epoch: 51, train_loss: 0.9597, test_loss: 1.0690, test_f1: 0.5123
 epoch: 52, train_loss: 0.9575, test_loss: 1.0693, test_f1: 0.5183
 epoch: 53, train_loss: 0.9552, test_loss: 1.0752, test_f1: 0.5173
 epoch: 54, train_loss: 0.9602, test_loss: 1.0728, test_f1: 0.5229
 epoch: 55, train_loss: 0.9491, test_loss: 1.0716, test_f1: 0.5175
 epoch: 56, train_loss: 0.9531, test_loss: 1.0695, test_f1: 0.5212
 epoch: 57, train_loss: 0.9491, test_loss: 1.0720, test_f1: 0.5242
 epoch: 58, train_loss: 0.9538, test_loss: 1.0739, test_f1: 0.5190
 epoch: 59, train_loss: 0.9567, test_loss: 1.0807, test_f1: 0.5220
 epoch: 60, train_loss: 0.9477, test_loss: 1.0759, test_f1: 0.5256
 epoch: 61, train_loss: 0.9459, test_loss: 1.0739, test_f1: 0.5190
 epoch: 62, train_loss: 0.9547, test_loss: 1.0626, test_f1: 0.5235
 epoch: 63, train_loss: 0.9436, test_loss: 1.0655, test_f1: 0.5137
 epoch: 64, train_loss: 0.9447, test_loss: 1.0798, test_f1: 0.5062
 epoch: 65, train_loss: 0.9454, test_loss: 1.0854, test_f1: 0.5158
 epoch: 66, train_loss: 0.9439, test_loss: 1.0882, test_f1: 0.5031
 epoch: 67, train_loss: 0.9385, test_loss: 1.0849, test_f1: 0.5143
 epoch: 68, train_loss: 0.9360, test_loss: 1.0780, test_f1: 0.5101
 epoch: 69, train_loss: 0.9347, test_loss: 1.0764, test_f1: 0.5018
 epoch: 70, train_loss: 0.9404, test_loss: 1.0767, test_f1: 0.5042
 epoch: 71, train_loss: 0.9340, test_loss: 1.0824, test_f1: 0.5070
 epoch: 72, train_loss: 0.9324, test_loss: 1.0828, test_f1: 0.4992
 epoch: 73, train_loss: 0.9261, test_loss: 1.0823, test_f1: 0.5133
 epoch: 74, train_loss: 0.9189, test_loss: 1.0766, test_f1: 0.5218
 epoch: 75, train_loss: 0.9251, test_loss: 1.0696, test_f1: 0.5253
 epoch: 76, train_loss: 0.9306, test_loss: 1.0671, test_f1: 0.5117
 epoch: 77, train_loss: 0.9214, test_loss: 1.0667, test_f1: 0.5200
 epoch: 78, train_loss: 0.9150, test_loss: 1.0794, test_f1: 0.5217
 epoch: 79, train_loss: 0.9205, test_loss: 1.0896, test_f1: 0.5129
 epoch: 80, train_loss: 0.9141, test_loss: 1.1006, test_f1: 0.5144
 epoch: 81, train_loss: 0.9190, test_loss: 1.0973, test_f1: 0.5089
 epoch: 82, train_loss: 0.9169, test_loss: 1.0917, test_f1: 0.5026
 epoch: 83, train_loss: 0.9166, test_loss: 1.0729, test_f1: 0.5088
 epoch: 84, train_loss: 0.9149, test_loss: 1.0736, test_f1: 0.5185
 epoch: 85, train_loss: 0.9105, test_loss: 1.0558, test_f1: 0.5188
 epoch: 86, train_loss: 0.9086, test_loss: 1.0635, test_f1: 0.5175
 epoch: 87, train_loss: 0.9011, test_loss: 1.0758, test_f1: 0.5077
 epoch: 88, train_loss: 0.9089, test_loss: 1.0801, test_f1: 0.5142
 epoch: 89, train_loss: 0.9092, test_loss: 1.0752, test_f1: 0.5175
 epoch: 90, train_loss: 0.9081, test_loss: 1.0756, test_f1: 0.5134
 epoch: 91, train_loss: 0.9090, test_loss: 1.0831, test_f1: 0.5114
 epoch: 92, train_loss: 0.8951, test_loss: 1.0699, test_f1: 0.5097
 epoch: 93, train_loss: 0.8959, test_loss: 1.0655, test_f1: 0.5049
 epoch: 94, train_loss: 0.8907, test_loss: 1.0772, test_f1: 0.5078
 epoch: 95, train_loss: 0.8929, test_loss: 1.0800, test_f1: 0.5109
 epoch: 96, train_loss: 0.8923, test_loss: 1.0734, test_f1: 0.4959
 epoch: 97, train_loss: 0.8961, test_loss: 1.0679, test_f1: 0.4933
 epoch: 98, train_loss: 0.8863, test_loss: 1.0772, test_f1: 0.5020
 epoch: 99, train_loss: 0.8928, test_loss: 1.0844, test_f1: 0.5046
##################ITERATION #5 ****************************************
 epoch: 0, train_loss: 1.2858, test_loss: 1.3522, test_f1: 0.2281
 epoch: 1, train_loss: 1.2417, test_loss: 1.3504, test_f1: 0.2281
 epoch: 2, train_loss: 1.2244, test_loss: 1.3471, test_f1: 0.2281
 epoch: 3, train_loss: 1.2134, test_loss: 1.3450, test_f1: 0.2281
 epoch: 4, train_loss: 1.1986, test_loss: 1.3409, test_f1: 0.2281
 epoch: 5, train_loss: 1.1926, test_loss: 1.3325, test_f1: 0.2281
 epoch: 6, train_loss: 1.1778, test_loss: 1.3234, test_f1: 0.2281
 epoch: 7, train_loss: 1.1711, test_loss: 1.3023, test_f1: 0.2336
 epoch: 8, train_loss: 1.1563, test_loss: 1.2732, test_f1: 0.2540
 epoch: 9, train_loss: 1.1519, test_loss: 1.2489, test_f1: 0.2526
 epoch: 10, train_loss: 1.1464, test_loss: 1.2298, test_f1: 0.2556
 epoch: 11, train_loss: 1.1327, test_loss: 1.2111, test_f1: 0.3039
 epoch: 12, train_loss: 1.1241, test_loss: 1.1975, test_f1: 0.3380
 epoch: 13, train_loss: 1.1229, test_loss: 1.1911, test_f1: 0.3484
 epoch: 14, train_loss: 1.1148, test_loss: 1.1843, test_f1: 0.3645
 epoch: 15, train_loss: 1.1067, test_loss: 1.1806, test_f1: 0.3799
 epoch: 16, train_loss: 1.1009, test_loss: 1.1728, test_f1: 0.3876
 epoch: 17, train_loss: 1.0950, test_loss: 1.1675, test_f1: 0.3883
 epoch: 18, train_loss: 1.0835, test_loss: 1.1636, test_f1: 0.4083
 epoch: 19, train_loss: 1.0863, test_loss: 1.1586, test_f1: 0.4044
 epoch: 20, train_loss: 1.0802, test_loss: 1.1522, test_f1: 0.4047
 epoch: 21, train_loss: 1.0725, test_loss: 1.1469, test_f1: 0.4010
 epoch: 22, train_loss: 1.0670, test_loss: 1.1405, test_f1: 0.4014
 epoch: 23, train_loss: 1.0595, test_loss: 1.1356, test_f1: 0.4127
 epoch: 24, train_loss: 1.0497, test_loss: 1.1359, test_f1: 0.4128
 epoch: 25, train_loss: 1.0479, test_loss: 1.1326, test_f1: 0.4192
 epoch: 26, train_loss: 1.0484, test_loss: 1.1273, test_f1: 0.4447
 epoch: 27, train_loss: 1.0427, test_loss: 1.1230, test_f1: 0.4447
 epoch: 28, train_loss: 1.0370, test_loss: 1.1194, test_f1: 0.4609
 epoch: 29, train_loss: 1.0321, test_loss: 1.1156, test_f1: 0.4612
 epoch: 30, train_loss: 1.0341, test_loss: 1.1103, test_f1: 0.4629
 epoch: 31, train_loss: 1.0220, test_loss: 1.1097, test_f1: 0.4582
 epoch: 32, train_loss: 1.0217, test_loss: 1.1072, test_f1: 0.4662
 epoch: 33, train_loss: 1.0166, test_loss: 1.1064, test_f1: 0.4602
 epoch: 34, train_loss: 1.0060, test_loss: 1.1061, test_f1: 0.4776
 epoch: 35, train_loss: 1.0114, test_loss: 1.1060, test_f1: 0.4868
 epoch: 36, train_loss: 0.9997, test_loss: 1.1017, test_f1: 0.4788
 epoch: 37, train_loss: 0.9927, test_loss: 1.1027, test_f1: 0.4878
 epoch: 38, train_loss: 0.9909, test_loss: 1.1051, test_f1: 0.4906
 epoch: 39, train_loss: 0.9903, test_loss: 1.1009, test_f1: 0.4875
 epoch: 40, train_loss: 0.9833, test_loss: 1.0964, test_f1: 0.4941
 epoch: 41, train_loss: 0.9761, test_loss: 1.0885, test_f1: 0.4871
 epoch: 42, train_loss: 0.9782, test_loss: 1.0930, test_f1: 0.4932
 epoch: 43, train_loss: 0.9832, test_loss: 1.0879, test_f1: 0.5006
 epoch: 44, train_loss: 0.9747, test_loss: 1.0837, test_f1: 0.4981
 epoch: 45, train_loss: 0.9669, test_loss: 1.0831, test_f1: 0.5001
 epoch: 46, train_loss: 0.9628, test_loss: 1.0905, test_f1: 0.5106
 epoch: 47, train_loss: 0.9620, test_loss: 1.0842, test_f1: 0.5159
 epoch: 48, train_loss: 0.9627, test_loss: 1.0812, test_f1: 0.5089
 epoch: 49, train_loss: 0.9503, test_loss: 1.0899, test_f1: 0.5019
 epoch: 50, train_loss: 0.9589, test_loss: 1.0792, test_f1: 0.5112
 epoch: 51, train_loss: 0.9475, test_loss: 1.0845, test_f1: 0.5112
 epoch: 52, train_loss: 0.9382, test_loss: 1.0918, test_f1: 0.5097
 epoch: 53, train_loss: 0.9440, test_loss: 1.0861, test_f1: 0.5018
 epoch: 54, train_loss: 0.9422, test_loss: 1.0801, test_f1: 0.5125
 epoch: 55, train_loss: 0.9426, test_loss: 1.0827, test_f1: 0.5081
 epoch: 56, train_loss: 0.9345, test_loss: 1.0808, test_f1: 0.5047
 epoch: 57, train_loss: 0.9313, test_loss: 1.0769, test_f1: 0.5250
 epoch: 58, train_loss: 0.9416, test_loss: 1.0931, test_f1: 0.5155
 epoch: 59, train_loss: 0.9257, test_loss: 1.0870, test_f1: 0.5087
 epoch: 60, train_loss: 0.9300, test_loss: 1.0874, test_f1: 0.5022
 epoch: 61, train_loss: 0.9319, test_loss: 1.0998, test_f1: 0.5115
 epoch: 62, train_loss: 0.9256, test_loss: 1.0841, test_f1: 0.5085
 epoch: 63, train_loss: 0.9250, test_loss: 1.0870, test_f1: 0.5115
 epoch: 64, train_loss: 0.9197, test_loss: 1.0887, test_f1: 0.5106
 epoch: 65, train_loss: 0.9278, test_loss: 1.0909, test_f1: 0.5161
 epoch: 66, train_loss: 0.9147, test_loss: 1.1011, test_f1: 0.5111
 epoch: 67, train_loss: 0.9220, test_loss: 1.1047, test_f1: 0.5129
 epoch: 68, train_loss: 0.9166, test_loss: 1.1064, test_f1: 0.5137
 epoch: 69, train_loss: 0.9170, test_loss: 1.1046, test_f1: 0.5093
 epoch: 70, train_loss: 0.9161, test_loss: 1.0927, test_f1: 0.5153
 epoch: 71, train_loss: 0.9139, test_loss: 1.0877, test_f1: 0.5090
 epoch: 72, train_loss: 0.9114, test_loss: 1.0913, test_f1: 0.5128
 epoch: 73, train_loss: 0.9151, test_loss: 1.0956, test_f1: 0.5094
 epoch: 74, train_loss: 0.9049, test_loss: 1.1001, test_f1: 0.5077
 epoch: 75, train_loss: 0.9049, test_loss: 1.0975, test_f1: 0.5017
 epoch: 76, train_loss: 0.9059, test_loss: 1.0955, test_f1: 0.5071
 epoch: 77, train_loss: 0.9081, test_loss: 1.0877, test_f1: 0.5179
 epoch: 78, train_loss: 0.8991, test_loss: 1.0795, test_f1: 0.5219
 epoch: 79, train_loss: 0.8993, test_loss: 1.0839, test_f1: 0.5099
 epoch: 80, train_loss: 0.9035, test_loss: 1.0835, test_f1: 0.5263
 epoch: 81, train_loss: 0.8903, test_loss: 1.0862, test_f1: 0.5180
 epoch: 82, train_loss: 0.9144, test_loss: 1.0984, test_f1: 0.5246
 epoch: 83, train_loss: 0.8967, test_loss: 1.1001, test_f1: 0.5189
 epoch: 84, train_loss: 0.8971, test_loss: 1.1013, test_f1: 0.5127
 epoch: 85, train_loss: 0.8966, test_loss: 1.0959, test_f1: 0.5198
 epoch: 86, train_loss: 0.8857, test_loss: 1.0887, test_f1: 0.5126
 epoch: 87, train_loss: 0.8912, test_loss: 1.0821, test_f1: 0.5192
 epoch: 88, train_loss: 0.8916, test_loss: 1.0924, test_f1: 0.5219
 epoch: 89, train_loss: 0.8921, test_loss: 1.0924, test_f1: 0.5297
 epoch: 90, train_loss: 0.8883, test_loss: 1.1035, test_f1: 0.5042
 epoch: 91, train_loss: 0.8798, test_loss: 1.1060, test_f1: 0.5095
 epoch: 92, train_loss: 0.8794, test_loss: 1.0974, test_f1: 0.5112
 epoch: 93, train_loss: 0.8869, test_loss: 1.1000, test_f1: 0.5121
 epoch: 94, train_loss: 0.8845, test_loss: 1.1095, test_f1: 0.4979
 epoch: 95, train_loss: 0.8882, test_loss: 1.0929, test_f1: 0.5125
 epoch: 96, train_loss: 0.8813, test_loss: 1.0922, test_f1: 0.5101
 epoch: 97, train_loss: 0.8741, test_loss: 1.1039, test_f1: 0.5009
 epoch: 98, train_loss: 0.8762, test_loss: 1.1116, test_f1: 0.5017
 epoch: 99, train_loss: 0.8662, test_loss: 1.1071, test_f1: 0.5006
##################ITERATION #6 ****************************************
 epoch: 0, train_loss: 1.2689, test_loss: 1.3740, test_f1: 0.2281
 epoch: 1, train_loss: 1.2099, test_loss: 1.3610, test_f1: 0.2281
 epoch: 2, train_loss: 1.1927, test_loss: 1.3568, test_f1: 0.2281
 epoch: 3, train_loss: 1.1793, test_loss: 1.3484, test_f1: 0.2281
 epoch: 4, train_loss: 1.1569, test_loss: 1.3376, test_f1: 0.2929
 epoch: 5, train_loss: 1.1473, test_loss: 1.3184, test_f1: 0.3009
 epoch: 6, train_loss: 1.1335, test_loss: 1.2903, test_f1: 0.2972
 epoch: 7, train_loss: 1.1289, test_loss: 1.2749, test_f1: 0.3007
 epoch: 8, train_loss: 1.1225, test_loss: 1.2624, test_f1: 0.3018
 epoch: 9, train_loss: 1.1152, test_loss: 1.2341, test_f1: 0.3361
 epoch: 10, train_loss: 1.1028, test_loss: 1.2059, test_f1: 0.3995
 epoch: 11, train_loss: 1.1047, test_loss: 1.1899, test_f1: 0.3970
 epoch: 12, train_loss: 1.0899, test_loss: 1.1777, test_f1: 0.4044
 epoch: 13, train_loss: 1.0863, test_loss: 1.1638, test_f1: 0.4189
 epoch: 14, train_loss: 1.0771, test_loss: 1.1631, test_f1: 0.4305
 epoch: 15, train_loss: 1.0804, test_loss: 1.1570, test_f1: 0.4203
 epoch: 16, train_loss: 1.0678, test_loss: 1.1525, test_f1: 0.4257
 epoch: 17, train_loss: 1.0588, test_loss: 1.1479, test_f1: 0.4608
 epoch: 18, train_loss: 1.0528, test_loss: 1.1460, test_f1: 0.4504
 epoch: 19, train_loss: 1.0518, test_loss: 1.1451, test_f1: 0.4596
 epoch: 20, train_loss: 1.0532, test_loss: 1.1383, test_f1: 0.4634
 epoch: 21, train_loss: 1.0378, test_loss: 1.1324, test_f1: 0.4574
 epoch: 22, train_loss: 1.0403, test_loss: 1.1270, test_f1: 0.4496
 epoch: 23, train_loss: 1.0307, test_loss: 1.1266, test_f1: 0.4578
 epoch: 24, train_loss: 1.0210, test_loss: 1.1278, test_f1: 0.4549
 epoch: 25, train_loss: 1.0229, test_loss: 1.1291, test_f1: 0.4504
 epoch: 26, train_loss: 1.0086, test_loss: 1.1285, test_f1: 0.4575
 epoch: 27, train_loss: 1.0084, test_loss: 1.1237, test_f1: 0.4608
 epoch: 28, train_loss: 1.0020, test_loss: 1.1149, test_f1: 0.4933
 epoch: 29, train_loss: 1.0007, test_loss: 1.1133, test_f1: 0.4836
 epoch: 30, train_loss: 1.0027, test_loss: 1.1150, test_f1: 0.4706
 epoch: 31, train_loss: 1.0013, test_loss: 1.1213, test_f1: 0.4808
 epoch: 32, train_loss: 0.9977, test_loss: 1.1166, test_f1: 0.4640
 epoch: 33, train_loss: 0.9873, test_loss: 1.1100, test_f1: 0.4723
 epoch: 34, train_loss: 0.9806, test_loss: 1.1047, test_f1: 0.4864
 epoch: 35, train_loss: 0.9738, test_loss: 1.1019, test_f1: 0.5033
 epoch: 36, train_loss: 0.9804, test_loss: 1.1053, test_f1: 0.5171
 epoch: 37, train_loss: 0.9686, test_loss: 1.1000, test_f1: 0.5220
 epoch: 38, train_loss: 0.9674, test_loss: 1.0940, test_f1: 0.5258
 epoch: 39, train_loss: 0.9538, test_loss: 1.0983, test_f1: 0.5224
 epoch: 40, train_loss: 0.9521, test_loss: 1.0990, test_f1: 0.5202
 epoch: 41, train_loss: 0.9508, test_loss: 1.1054, test_f1: 0.5304
 epoch: 42, train_loss: 0.9449, test_loss: 1.0931, test_f1: 0.5193
 epoch: 43, train_loss: 0.9419, test_loss: 1.0940, test_f1: 0.5293
 epoch: 44, train_loss: 0.9345, test_loss: 1.0826, test_f1: 0.5156
 epoch: 45, train_loss: 0.9373, test_loss: 1.0827, test_f1: 0.5245
 epoch: 46, train_loss: 0.9424, test_loss: 1.0937, test_f1: 0.5289
 epoch: 47, train_loss: 0.9350, test_loss: 1.0930, test_f1: 0.5222
 epoch: 48, train_loss: 0.9417, test_loss: 1.1031, test_f1: 0.5239
 epoch: 49, train_loss: 0.9278, test_loss: 1.1083, test_f1: 0.5205
 epoch: 50, train_loss: 0.9312, test_loss: 1.0930, test_f1: 0.5262
 epoch: 51, train_loss: 0.9167, test_loss: 1.0884, test_f1: 0.5261
 epoch: 52, train_loss: 0.9241, test_loss: 1.0959, test_f1: 0.5302
 epoch: 53, train_loss: 0.9194, test_loss: 1.0928, test_f1: 0.5301
 epoch: 54, train_loss: 0.9301, test_loss: 1.0851, test_f1: 0.5266
 epoch: 55, train_loss: 0.9177, test_loss: 1.0859, test_f1: 0.5321
 epoch: 56, train_loss: 0.9111, test_loss: 1.0840, test_f1: 0.5266
 epoch: 57, train_loss: 0.9075, test_loss: 1.0737, test_f1: 0.5267
 epoch: 58, train_loss: 0.9008, test_loss: 1.0721, test_f1: 0.5243
 epoch: 59, train_loss: 0.9185, test_loss: 1.0705, test_f1: 0.5267
 epoch: 60, train_loss: 0.9048, test_loss: 1.0808, test_f1: 0.5259
 epoch: 61, train_loss: 0.9168, test_loss: 1.0868, test_f1: 0.5328
 epoch: 62, train_loss: 0.9043, test_loss: 1.0826, test_f1: 0.5236
 epoch: 63, train_loss: 0.9040, test_loss: 1.0778, test_f1: 0.5246
 epoch: 64, train_loss: 0.8883, test_loss: 1.0889, test_f1: 0.5299
 epoch: 65, train_loss: 0.8897, test_loss: 1.0911, test_f1: 0.5349
 epoch: 66, train_loss: 0.9003, test_loss: 1.0786, test_f1: 0.5308
 epoch: 67, train_loss: 0.9054, test_loss: 1.0775, test_f1: 0.5329
 epoch: 68, train_loss: 0.8978, test_loss: 1.0796, test_f1: 0.5400
 epoch: 69, train_loss: 0.8965, test_loss: 1.0785, test_f1: 0.5357
 epoch: 70, train_loss: 0.8987, test_loss: 1.0720, test_f1: 0.5417
 epoch: 71, train_loss: 0.8931, test_loss: 1.0743, test_f1: 0.5469
 epoch: 72, train_loss: 0.8943, test_loss: 1.0755, test_f1: 0.5238
 epoch: 73, train_loss: 0.8916, test_loss: 1.0758, test_f1: 0.5340
 epoch: 74, train_loss: 0.8899, test_loss: 1.0800, test_f1: 0.5349
 epoch: 75, train_loss: 0.8901, test_loss: 1.0849, test_f1: 0.5351
 epoch: 76, train_loss: 0.8842, test_loss: 1.0804, test_f1: 0.5356
 epoch: 77, train_loss: 0.8775, test_loss: 1.0821, test_f1: 0.5319
 epoch: 78, train_loss: 0.8848, test_loss: 1.0879, test_f1: 0.5404
 epoch: 79, train_loss: 0.8841, test_loss: 1.0850, test_f1: 0.5458
 epoch: 80, train_loss: 0.8840, test_loss: 1.0874, test_f1: 0.5458
 epoch: 81, train_loss: 0.8832, test_loss: 1.0952, test_f1: 0.5529
 epoch: 82, train_loss: 0.8726, test_loss: 1.0856, test_f1: 0.5512
 epoch: 83, train_loss: 0.8835, test_loss: 1.0915, test_f1: 0.5369
 epoch: 84, train_loss: 0.8841, test_loss: 1.0891, test_f1: 0.5423
 epoch: 85, train_loss: 0.8834, test_loss: 1.1101, test_f1: 0.5409
 epoch: 86, train_loss: 0.8753, test_loss: 1.1113, test_f1: 0.5431
 epoch: 87, train_loss: 0.8768, test_loss: 1.1093, test_f1: 0.5443
 epoch: 88, train_loss: 0.8653, test_loss: 1.0979, test_f1: 0.5513
 epoch: 89, train_loss: 0.8668, test_loss: 1.0881, test_f1: 0.5503
 epoch: 90, train_loss: 0.8740, test_loss: 1.0840, test_f1: 0.5537
 epoch: 91, train_loss: 0.8649, test_loss: 1.0730, test_f1: 0.5577
 epoch: 92, train_loss: 0.8736, test_loss: 1.0719, test_f1: 0.5591
 epoch: 93, train_loss: 0.8762, test_loss: 1.0865, test_f1: 0.5465
 epoch: 94, train_loss: 0.8698, test_loss: 1.1092, test_f1: 0.5447
 epoch: 95, train_loss: 0.8614, test_loss: 1.1067, test_f1: 0.5530
 epoch: 96, train_loss: 0.8546, test_loss: 1.1053, test_f1: 0.5519
 epoch: 97, train_loss: 0.8682, test_loss: 1.1072, test_f1: 0.5548
 epoch: 98, train_loss: 0.8577, test_loss: 1.0932, test_f1: 0.5423
 epoch: 99, train_loss: 0.8649, test_loss: 1.1038, test_f1: 0.5467
##################ITERATION #7 ****************************************
 epoch: 0, train_loss: 1.2539, test_loss: 1.3581, test_f1: 0.2281
 epoch: 1, train_loss: 1.2125, test_loss: 1.3316, test_f1: 0.2281
 epoch: 2, train_loss: 1.1941, test_loss: 1.3078, test_f1: 0.2281
 epoch: 3, train_loss: 1.1740, test_loss: 1.2895, test_f1: 0.2281
 epoch: 4, train_loss: 1.1665, test_loss: 1.2855, test_f1: 0.2441
 epoch: 5, train_loss: 1.1560, test_loss: 1.3049, test_f1: 0.2830
 epoch: 6, train_loss: 1.1461, test_loss: 1.3014, test_f1: 0.2881
 epoch: 7, train_loss: 1.1241, test_loss: 1.2886, test_f1: 0.3054
 epoch: 8, train_loss: 1.1242, test_loss: 1.2715, test_f1: 0.3036
 epoch: 9, train_loss: 1.1148, test_loss: 1.2639, test_f1: 0.3011
 epoch: 10, train_loss: 1.1173, test_loss: 1.2501, test_f1: 0.3349
 epoch: 11, train_loss: 1.1049, test_loss: 1.2253, test_f1: 0.3954
 epoch: 12, train_loss: 1.0952, test_loss: 1.2061, test_f1: 0.4084
 epoch: 13, train_loss: 1.0912, test_loss: 1.1862, test_f1: 0.4186
 epoch: 14, train_loss: 1.0863, test_loss: 1.1780, test_f1: 0.4274
 epoch: 15, train_loss: 1.0829, test_loss: 1.1705, test_f1: 0.4369
 epoch: 16, train_loss: 1.0799, test_loss: 1.1634, test_f1: 0.4427
 epoch: 17, train_loss: 1.0716, test_loss: 1.1583, test_f1: 0.4323
 epoch: 18, train_loss: 1.0635, test_loss: 1.1568, test_f1: 0.4377
 epoch: 19, train_loss: 1.0611, test_loss: 1.1603, test_f1: 0.4520
 epoch: 20, train_loss: 1.0553, test_loss: 1.1531, test_f1: 0.4446
 epoch: 21, train_loss: 1.0470, test_loss: 1.1499, test_f1: 0.4447
 epoch: 22, train_loss: 1.0347, test_loss: 1.1443, test_f1: 0.4408
 epoch: 23, train_loss: 1.0333, test_loss: 1.1422, test_f1: 0.4657
 epoch: 24, train_loss: 1.0350, test_loss: 1.1374, test_f1: 0.4667
 epoch: 25, train_loss: 1.0239, test_loss: 1.1299, test_f1: 0.4483
 epoch: 26, train_loss: 1.0278, test_loss: 1.1350, test_f1: 0.4658
 epoch: 27, train_loss: 1.0231, test_loss: 1.1305, test_f1: 0.4666
 epoch: 28, train_loss: 1.0195, test_loss: 1.1247, test_f1: 0.4647
 epoch: 29, train_loss: 1.0094, test_loss: 1.1174, test_f1: 0.4677
 epoch: 30, train_loss: 1.0052, test_loss: 1.1141, test_f1: 0.4611
 epoch: 31, train_loss: 1.0002, test_loss: 1.1108, test_f1: 0.4581
 epoch: 32, train_loss: 1.0018, test_loss: 1.1084, test_f1: 0.4634
 epoch: 33, train_loss: 0.9986, test_loss: 1.1108, test_f1: 0.4421
 epoch: 34, train_loss: 0.9877, test_loss: 1.1070, test_f1: 0.4348
 epoch: 35, train_loss: 0.9780, test_loss: 1.0989, test_f1: 0.4660
 epoch: 36, train_loss: 0.9890, test_loss: 1.0944, test_f1: 0.4831
 epoch: 37, train_loss: 0.9774, test_loss: 1.0928, test_f1: 0.4912
 epoch: 38, train_loss: 0.9745, test_loss: 1.0924, test_f1: 0.4791
 epoch: 39, train_loss: 0.9689, test_loss: 1.0955, test_f1: 0.4769
 epoch: 40, train_loss: 0.9639, test_loss: 1.0852, test_f1: 0.4710
 epoch: 41, train_loss: 0.9651, test_loss: 1.0816, test_f1: 0.4829
 epoch: 42, train_loss: 0.9641, test_loss: 1.0813, test_f1: 0.4851
 epoch: 43, train_loss: 0.9643, test_loss: 1.0853, test_f1: 0.4840
 epoch: 44, train_loss: 0.9545, test_loss: 1.0784, test_f1: 0.5026
 epoch: 45, train_loss: 0.9556, test_loss: 1.0621, test_f1: 0.5074
 epoch: 46, train_loss: 0.9489, test_loss: 1.0590, test_f1: 0.5051
 epoch: 47, train_loss: 0.9492, test_loss: 1.0631, test_f1: 0.5022
 epoch: 48, train_loss: 0.9407, test_loss: 1.0632, test_f1: 0.5104
 epoch: 49, train_loss: 0.9377, test_loss: 1.0530, test_f1: 0.5121
 epoch: 50, train_loss: 0.9376, test_loss: 1.0466, test_f1: 0.5244
 epoch: 51, train_loss: 0.9343, test_loss: 1.0506, test_f1: 0.5131
 epoch: 52, train_loss: 0.9346, test_loss: 1.0488, test_f1: 0.5066
 epoch: 53, train_loss: 0.9286, test_loss: 1.0558, test_f1: 0.5098
 epoch: 54, train_loss: 0.9285, test_loss: 1.0517, test_f1: 0.5012
 epoch: 55, train_loss: 0.9367, test_loss: 1.0537, test_f1: 0.5100
 epoch: 56, train_loss: 0.9308, test_loss: 1.0457, test_f1: 0.5012
 epoch: 57, train_loss: 0.9156, test_loss: 1.0417, test_f1: 0.5096
 epoch: 58, train_loss: 0.9241, test_loss: 1.0411, test_f1: 0.5173
 epoch: 59, train_loss: 0.9298, test_loss: 1.0456, test_f1: 0.5218
 epoch: 60, train_loss: 0.9186, test_loss: 1.0455, test_f1: 0.5273
 epoch: 61, train_loss: 0.9176, test_loss: 1.0463, test_f1: 0.5125
 epoch: 62, train_loss: 0.9319, test_loss: 1.0427, test_f1: 0.5092
 epoch: 63, train_loss: 0.9176, test_loss: 1.0471, test_f1: 0.5026
 epoch: 64, train_loss: 0.9161, test_loss: 1.0497, test_f1: 0.5213
 epoch: 65, train_loss: 0.9148, test_loss: 1.0479, test_f1: 0.5144
 epoch: 66, train_loss: 0.9120, test_loss: 1.0424, test_f1: 0.5215
 epoch: 67, train_loss: 0.9015, test_loss: 1.0531, test_f1: 0.5065
 epoch: 68, train_loss: 0.9164, test_loss: 1.0553, test_f1: 0.5174
 epoch: 69, train_loss: 0.9061, test_loss: 1.0499, test_f1: 0.5184
 epoch: 70, train_loss: 0.9057, test_loss: 1.0510, test_f1: 0.5302
 epoch: 71, train_loss: 0.9027, test_loss: 1.0498, test_f1: 0.5347
 epoch: 72, train_loss: 0.9114, test_loss: 1.0601, test_f1: 0.5147
 epoch: 73, train_loss: 0.9090, test_loss: 1.0734, test_f1: 0.4936
 epoch: 74, train_loss: 0.9032, test_loss: 1.0664, test_f1: 0.5067
 epoch: 75, train_loss: 0.9016, test_loss: 1.0609, test_f1: 0.4949
 epoch: 76, train_loss: 0.8929, test_loss: 1.0562, test_f1: 0.5129
 epoch: 77, train_loss: 0.8979, test_loss: 1.0505, test_f1: 0.5142
 epoch: 78, train_loss: 0.9021, test_loss: 1.0541, test_f1: 0.5183
 epoch: 79, train_loss: 0.8891, test_loss: 1.0644, test_f1: 0.5112
 epoch: 80, train_loss: 0.8843, test_loss: 1.0612, test_f1: 0.5094
 epoch: 81, train_loss: 0.8891, test_loss: 1.0592, test_f1: 0.5130
 epoch: 82, train_loss: 0.8889, test_loss: 1.0579, test_f1: 0.5109
 epoch: 83, train_loss: 0.8870, test_loss: 1.0514, test_f1: 0.5103
 epoch: 84, train_loss: 0.8825, test_loss: 1.0587, test_f1: 0.5093
 epoch: 85, train_loss: 0.8827, test_loss: 1.0591, test_f1: 0.5332
 epoch: 86, train_loss: 0.8857, test_loss: 1.0612, test_f1: 0.5273
 epoch: 87, train_loss: 0.8915, test_loss: 1.0604, test_f1: 0.5211
 epoch: 88, train_loss: 0.8859, test_loss: 1.0547, test_f1: 0.5335
 epoch: 89, train_loss: 0.8831, test_loss: 1.0586, test_f1: 0.5281
 epoch: 90, train_loss: 0.8815, test_loss: 1.0602, test_f1: 0.5212
 epoch: 91, train_loss: 0.8851, test_loss: 1.0553, test_f1: 0.5395
 epoch: 92, train_loss: 0.8797, test_loss: 1.0554, test_f1: 0.5387
 epoch: 93, train_loss: 0.8720, test_loss: 1.0487, test_f1: 0.5419
 epoch: 94, train_loss: 0.8827, test_loss: 1.0518, test_f1: 0.5359
 epoch: 95, train_loss: 0.8772, test_loss: 1.0570, test_f1: 0.5345
 epoch: 96, train_loss: 0.8669, test_loss: 1.0539, test_f1: 0.5163
 epoch: 97, train_loss: 0.8778, test_loss: 1.0660, test_f1: 0.5116
 epoch: 98, train_loss: 0.8736, test_loss: 1.0529, test_f1: 0.5227
 epoch: 99, train_loss: 0.8734, test_loss: 1.0529, test_f1: 0.5374
##################ITERATION #8 ****************************************
 epoch: 0, train_loss: 1.2641, test_loss: 1.3410, test_f1: 0.2281
 epoch: 1, train_loss: 1.2001, test_loss: 1.3344, test_f1: 0.2281
 epoch: 2, train_loss: 1.1890, test_loss: 1.3296, test_f1: 0.2281
 epoch: 3, train_loss: 1.1684, test_loss: 1.3240, test_f1: 0.2281
 epoch: 4, train_loss: 1.1498, test_loss: 1.3156, test_f1: 0.2281
 epoch: 5, train_loss: 1.1423, test_loss: 1.3127, test_f1: 0.2552
 epoch: 6, train_loss: 1.1281, test_loss: 1.2979, test_f1: 0.2558
 epoch: 7, train_loss: 1.1126, test_loss: 1.2633, test_f1: 0.2625
 epoch: 8, train_loss: 1.1067, test_loss: 1.2361, test_f1: 0.2744
 epoch: 9, train_loss: 1.1043, test_loss: 1.2148, test_f1: 0.3447
 epoch: 10, train_loss: 1.0916, test_loss: 1.2037, test_f1: 0.3622
 epoch: 11, train_loss: 1.0875, test_loss: 1.2019, test_f1: 0.3703
 epoch: 12, train_loss: 1.0838, test_loss: 1.1835, test_f1: 0.4441
 epoch: 13, train_loss: 1.0748, test_loss: 1.1753, test_f1: 0.4445
 epoch: 14, train_loss: 1.0762, test_loss: 1.1741, test_f1: 0.4585
 epoch: 15, train_loss: 1.0651, test_loss: 1.1743, test_f1: 0.4699
 epoch: 16, train_loss: 1.0574, test_loss: 1.1757, test_f1: 0.4528
 epoch: 17, train_loss: 1.0468, test_loss: 1.1765, test_f1: 0.4545
 epoch: 18, train_loss: 1.0372, test_loss: 1.1771, test_f1: 0.4662
 epoch: 19, train_loss: 1.0463, test_loss: 1.1724, test_f1: 0.4701
 epoch: 20, train_loss: 1.0347, test_loss: 1.1667, test_f1: 0.4716
 epoch: 21, train_loss: 1.0319, test_loss: 1.1607, test_f1: 0.4793
 epoch: 22, train_loss: 1.0303, test_loss: 1.1565, test_f1: 0.4825
 epoch: 23, train_loss: 1.0217, test_loss: 1.1548, test_f1: 0.4846
 epoch: 24, train_loss: 1.0121, test_loss: 1.1528, test_f1: 0.4984
 epoch: 25, train_loss: 1.0146, test_loss: 1.1591, test_f1: 0.4963
 epoch: 26, train_loss: 1.0139, test_loss: 1.1538, test_f1: 0.4878
 epoch: 27, train_loss: 1.0027, test_loss: 1.1405, test_f1: 0.5081
 epoch: 28, train_loss: 1.0018, test_loss: 1.1367, test_f1: 0.5020
 epoch: 29, train_loss: 0.9944, test_loss: 1.1294, test_f1: 0.4919
 epoch: 30, train_loss: 0.9890, test_loss: 1.1302, test_f1: 0.5081
 epoch: 31, train_loss: 0.9789, test_loss: 1.1373, test_f1: 0.5070
 epoch: 32, train_loss: 0.9991, test_loss: 1.1389, test_f1: 0.5127
 epoch: 33, train_loss: 0.9803, test_loss: 1.1434, test_f1: 0.5044
 epoch: 34, train_loss: 0.9725, test_loss: 1.1427, test_f1: 0.4986
 epoch: 35, train_loss: 0.9694, test_loss: 1.1280, test_f1: 0.5056
 epoch: 36, train_loss: 0.9736, test_loss: 1.1247, test_f1: 0.5023
 epoch: 37, train_loss: 0.9699, test_loss: 1.1271, test_f1: 0.5074
 epoch: 38, train_loss: 0.9519, test_loss: 1.1404, test_f1: 0.5072
 epoch: 39, train_loss: 0.9627, test_loss: 1.1306, test_f1: 0.5042
 epoch: 40, train_loss: 0.9606, test_loss: 1.1254, test_f1: 0.5069
 epoch: 41, train_loss: 0.9518, test_loss: 1.1202, test_f1: 0.5060
 epoch: 42, train_loss: 0.9500, test_loss: 1.1140, test_f1: 0.5027
 epoch: 43, train_loss: 0.9411, test_loss: 1.1163, test_f1: 0.5136
 epoch: 44, train_loss: 0.9439, test_loss: 1.1130, test_f1: 0.5136
 epoch: 45, train_loss: 0.9375, test_loss: 1.1078, test_f1: 0.5001
 epoch: 46, train_loss: 0.9331, test_loss: 1.1079, test_f1: 0.5058
 epoch: 47, train_loss: 0.9294, test_loss: 1.1065, test_f1: 0.5116
 epoch: 48, train_loss: 0.9314, test_loss: 1.1078, test_f1: 0.5165
 epoch: 49, train_loss: 0.9222, test_loss: 1.0987, test_f1: 0.5190
 epoch: 50, train_loss: 0.9225, test_loss: 1.1054, test_f1: 0.5150
 epoch: 51, train_loss: 0.9277, test_loss: 1.1043, test_f1: 0.5187
 epoch: 52, train_loss: 0.9216, test_loss: 1.1139, test_f1: 0.5215
 epoch: 53, train_loss: 0.9226, test_loss: 1.1097, test_f1: 0.5246
 epoch: 54, train_loss: 0.9225, test_loss: 1.1007, test_f1: 0.5194
 epoch: 55, train_loss: 0.9249, test_loss: 1.1035, test_f1: 0.5217
 epoch: 56, train_loss: 0.9085, test_loss: 1.0947, test_f1: 0.5255
 epoch: 57, train_loss: 0.9152, test_loss: 1.1035, test_f1: 0.5257
 epoch: 58, train_loss: 0.9040, test_loss: 1.1037, test_f1: 0.5208
 epoch: 59, train_loss: 0.9143, test_loss: 1.1039, test_f1: 0.5207
 epoch: 60, train_loss: 0.9053, test_loss: 1.1105, test_f1: 0.5208
 epoch: 61, train_loss: 0.9030, test_loss: 1.1163, test_f1: 0.5259
 epoch: 62, train_loss: 0.9096, test_loss: 1.1152, test_f1: 0.5281
 epoch: 63, train_loss: 0.9016, test_loss: 1.1274, test_f1: 0.5307
 epoch: 64, train_loss: 0.9048, test_loss: 1.1283, test_f1: 0.5212
 epoch: 65, train_loss: 0.9027, test_loss: 1.1220, test_f1: 0.5210
 epoch: 66, train_loss: 0.9015, test_loss: 1.1240, test_f1: 0.5250
 epoch: 67, train_loss: 0.8976, test_loss: 1.1179, test_f1: 0.5226
 epoch: 68, train_loss: 0.8983, test_loss: 1.1113, test_f1: 0.5180
 epoch: 69, train_loss: 0.8901, test_loss: 1.1009, test_f1: 0.5204
 epoch: 70, train_loss: 0.8956, test_loss: 1.0977, test_f1: 0.5238
 epoch: 71, train_loss: 0.8817, test_loss: 1.1043, test_f1: 0.5261
 epoch: 72, train_loss: 0.8884, test_loss: 1.1070, test_f1: 0.5212
 epoch: 73, train_loss: 0.8896, test_loss: 1.1062, test_f1: 0.5146
 epoch: 74, train_loss: 0.8887, test_loss: 1.1294, test_f1: 0.5167
 epoch: 75, train_loss: 0.8797, test_loss: 1.1367, test_f1: 0.5141
 epoch: 76, train_loss: 0.8834, test_loss: 1.1245, test_f1: 0.5293
 epoch: 77, train_loss: 0.8849, test_loss: 1.1190, test_f1: 0.5347
 epoch: 78, train_loss: 0.8920, test_loss: 1.1095, test_f1: 0.5343
 epoch: 79, train_loss: 0.8782, test_loss: 1.1133, test_f1: 0.5263
 epoch: 80, train_loss: 0.8800, test_loss: 1.1023, test_f1: 0.5321
 epoch: 81, train_loss: 0.8742, test_loss: 1.0936, test_f1: 0.5299
 epoch: 82, train_loss: 0.8812, test_loss: 1.1083, test_f1: 0.5194
 epoch: 83, train_loss: 0.8852, test_loss: 1.1141, test_f1: 0.5219
 epoch: 84, train_loss: 0.8749, test_loss: 1.1104, test_f1: 0.5268
 epoch: 85, train_loss: 0.8798, test_loss: 1.0992, test_f1: 0.5318
 epoch: 86, train_loss: 0.8657, test_loss: 1.0938, test_f1: 0.5296
 epoch: 87, train_loss: 0.8721, test_loss: 1.1007, test_f1: 0.5312
 epoch: 88, train_loss: 0.8765, test_loss: 1.1013, test_f1: 0.5261
 epoch: 89, train_loss: 0.8877, test_loss: 1.1058, test_f1: 0.5258
 epoch: 90, train_loss: 0.8662, test_loss: 1.1056, test_f1: 0.5173
 epoch: 91, train_loss: 0.8593, test_loss: 1.1106, test_f1: 0.5255
 epoch: 92, train_loss: 0.8684, test_loss: 1.1099, test_f1: 0.5308
 epoch: 93, train_loss: 0.8623, test_loss: 1.1197, test_f1: 0.5280
 epoch: 94, train_loss: 0.8688, test_loss: 1.1158, test_f1: 0.5281
 epoch: 95, train_loss: 0.8556, test_loss: 1.1103, test_f1: 0.5275
 epoch: 96, train_loss: 0.8667, test_loss: 1.1108, test_f1: 0.5375
 epoch: 97, train_loss: 0.8676, test_loss: 1.1213, test_f1: 0.5252
 epoch: 98, train_loss: 0.8595, test_loss: 1.1151, test_f1: 0.5275
 epoch: 99, train_loss: 0.8733, test_loss: 1.0993, test_f1: 0.5420
##################ITERATION #9 ****************************************
 epoch: 0, train_loss: 1.3102, test_loss: 1.3819, test_f1: 0.2281
 epoch: 1, train_loss: 1.2432, test_loss: 1.3624, test_f1: 0.2281
 epoch: 2, train_loss: 1.2212, test_loss: 1.3433, test_f1: 0.2281
 epoch: 3, train_loss: 1.2009, test_loss: 1.3249, test_f1: 0.2281
 epoch: 4, train_loss: 1.1848, test_loss: 1.3030, test_f1: 0.2281
 epoch: 5, train_loss: 1.1739, test_loss: 1.2829, test_f1: 0.2336
 epoch: 6, train_loss: 1.1604, test_loss: 1.2603, test_f1: 0.2525
 epoch: 7, train_loss: 1.1518, test_loss: 1.2616, test_f1: 0.2879
 epoch: 8, train_loss: 1.1277, test_loss: 1.2641, test_f1: 0.2835
 epoch: 9, train_loss: 1.1326, test_loss: 1.2413, test_f1: 0.2843
 epoch: 10, train_loss: 1.1190, test_loss: 1.2161, test_f1: 0.2867
 epoch: 11, train_loss: 1.1072, test_loss: 1.2028, test_f1: 0.2842
 epoch: 12, train_loss: 1.0985, test_loss: 1.1943, test_f1: 0.2952
 epoch: 13, train_loss: 1.1047, test_loss: 1.1828, test_f1: 0.2907
 epoch: 14, train_loss: 1.0879, test_loss: 1.1815, test_f1: 0.3071
 epoch: 15, train_loss: 1.0776, test_loss: 1.1781, test_f1: 0.3168
 epoch: 16, train_loss: 1.0705, test_loss: 1.1697, test_f1: 0.3206
 epoch: 17, train_loss: 1.0734, test_loss: 1.1642, test_f1: 0.3227
 epoch: 18, train_loss: 1.0690, test_loss: 1.1610, test_f1: 0.3340
 epoch: 19, train_loss: 1.0583, test_loss: 1.1605, test_f1: 0.3126
 epoch: 20, train_loss: 1.0535, test_loss: 1.1526, test_f1: 0.3337
 epoch: 21, train_loss: 1.0485, test_loss: 1.1479, test_f1: 0.3536
 epoch: 22, train_loss: 1.0493, test_loss: 1.1452, test_f1: 0.3613
 epoch: 23, train_loss: 1.0378, test_loss: 1.1308, test_f1: 0.3671
 epoch: 24, train_loss: 1.0349, test_loss: 1.1283, test_f1: 0.3621
 epoch: 25, train_loss: 1.0216, test_loss: 1.1228, test_f1: 0.3927
 epoch: 26, train_loss: 1.0164, test_loss: 1.1234, test_f1: 0.3688
 epoch: 27, train_loss: 1.0121, test_loss: 1.1158, test_f1: 0.3926
 epoch: 28, train_loss: 1.0137, test_loss: 1.1097, test_f1: 0.3890
 epoch: 29, train_loss: 1.0063, test_loss: 1.1069, test_f1: 0.4128
 epoch: 30, train_loss: 1.0057, test_loss: 1.0973, test_f1: 0.4259
 epoch: 31, train_loss: 0.9986, test_loss: 1.1010, test_f1: 0.4343
 epoch: 32, train_loss: 0.9900, test_loss: 1.1061, test_f1: 0.4284
 epoch: 33, train_loss: 0.9971, test_loss: 1.0916, test_f1: 0.4251
 epoch: 34, train_loss: 0.9801, test_loss: 1.0800, test_f1: 0.4655
 epoch: 35, train_loss: 0.9847, test_loss: 1.0703, test_f1: 0.4725
 epoch: 36, train_loss: 0.9808, test_loss: 1.0650, test_f1: 0.4889
 epoch: 37, train_loss: 0.9751, test_loss: 1.0662, test_f1: 0.4884
 epoch: 38, train_loss: 0.9711, test_loss: 1.0647, test_f1: 0.4837
 epoch: 39, train_loss: 0.9625, test_loss: 1.0699, test_f1: 0.4935
 epoch: 40, train_loss: 0.9582, test_loss: 1.0682, test_f1: 0.4954
 epoch: 41, train_loss: 0.9567, test_loss: 1.0633, test_f1: 0.5001
 epoch: 42, train_loss: 0.9505, test_loss: 1.0553, test_f1: 0.5037
 epoch: 43, train_loss: 0.9512, test_loss: 1.0538, test_f1: 0.5018
 epoch: 44, train_loss: 0.9534, test_loss: 1.0460, test_f1: 0.5011
 epoch: 45, train_loss: 0.9386, test_loss: 1.0387, test_f1: 0.5004
 epoch: 46, train_loss: 0.9421, test_loss: 1.0398, test_f1: 0.5277
 epoch: 47, train_loss: 0.9456, test_loss: 1.0453, test_f1: 0.5080
 epoch: 48, train_loss: 0.9423, test_loss: 1.0472, test_f1: 0.4996
 epoch: 49, train_loss: 0.9321, test_loss: 1.0463, test_f1: 0.4955
 epoch: 50, train_loss: 0.9320, test_loss: 1.0357, test_f1: 0.5102
 epoch: 51, train_loss: 0.9281, test_loss: 1.0353, test_f1: 0.5204
 epoch: 52, train_loss: 0.9209, test_loss: 1.0351, test_f1: 0.5327
 epoch: 53, train_loss: 0.9169, test_loss: 1.0360, test_f1: 0.5274
 epoch: 54, train_loss: 0.9253, test_loss: 1.0333, test_f1: 0.5356
 epoch: 55, train_loss: 0.9158, test_loss: 1.0311, test_f1: 0.5394
 epoch: 56, train_loss: 0.9122, test_loss: 1.0327, test_f1: 0.5290
 epoch: 57, train_loss: 0.9171, test_loss: 1.0336, test_f1: 0.5382
 epoch: 58, train_loss: 0.9063, test_loss: 1.0412, test_f1: 0.5387
 epoch: 59, train_loss: 0.9074, test_loss: 1.0425, test_f1: 0.5361
 epoch: 60, train_loss: 0.9135, test_loss: 1.0410, test_f1: 0.5398
 epoch: 61, train_loss: 0.9128, test_loss: 1.0380, test_f1: 0.5409
 epoch: 62, train_loss: 0.9150, test_loss: 1.0377, test_f1: 0.5364
 epoch: 63, train_loss: 0.9121, test_loss: 1.0357, test_f1: 0.5388
 epoch: 64, train_loss: 0.9144, test_loss: 1.0344, test_f1: 0.5382
 epoch: 65, train_loss: 0.9010, test_loss: 1.0441, test_f1: 0.5239
 epoch: 66, train_loss: 0.9099, test_loss: 1.0513, test_f1: 0.5157
 epoch: 67, train_loss: 0.8985, test_loss: 1.0430, test_f1: 0.5296
 epoch: 68, train_loss: 0.9051, test_loss: 1.0420, test_f1: 0.5285
 epoch: 69, train_loss: 0.8970, test_loss: 1.0467, test_f1: 0.5252
 epoch: 70, train_loss: 0.9032, test_loss: 1.0416, test_f1: 0.5265
 epoch: 71, train_loss: 0.9034, test_loss: 1.0378, test_f1: 0.5382
 epoch: 72, train_loss: 0.8905, test_loss: 1.0432, test_f1: 0.5291
 epoch: 73, train_loss: 0.8970, test_loss: 1.0382, test_f1: 0.5426
 epoch: 74, train_loss: 0.8935, test_loss: 1.0395, test_f1: 0.5403
 epoch: 75, train_loss: 0.8796, test_loss: 1.0405, test_f1: 0.5361
 epoch: 76, train_loss: 0.8891, test_loss: 1.0465, test_f1: 0.5432
 epoch: 77, train_loss: 0.8868, test_loss: 1.0442, test_f1: 0.5403
 epoch: 78, train_loss: 0.8880, test_loss: 1.0405, test_f1: 0.5292
 epoch: 79, train_loss: 0.8834, test_loss: 1.0368, test_f1: 0.5247
 epoch: 80, train_loss: 0.8899, test_loss: 1.0337, test_f1: 0.5284
 epoch: 81, train_loss: 0.8833, test_loss: 1.0367, test_f1: 0.5315
 epoch: 82, train_loss: 0.8873, test_loss: 1.0374, test_f1: 0.5269
 epoch: 83, train_loss: 0.8809, test_loss: 1.0405, test_f1: 0.5277
 epoch: 84, train_loss: 0.8807, test_loss: 1.0339, test_f1: 0.5362
 epoch: 85, train_loss: 0.8838, test_loss: 1.0341, test_f1: 0.5370
 epoch: 86, train_loss: 0.8720, test_loss: 1.0330, test_f1: 0.5396
 epoch: 87, train_loss: 0.8786, test_loss: 1.0382, test_f1: 0.5349
 epoch: 88, train_loss: 0.8683, test_loss: 1.0469, test_f1: 0.5308
 epoch: 89, train_loss: 0.8669, test_loss: 1.0430, test_f1: 0.5300
 epoch: 90, train_loss: 0.8857, test_loss: 1.0435, test_f1: 0.5272
 epoch: 91, train_loss: 0.8658, test_loss: 1.0410, test_f1: 0.5372
 epoch: 92, train_loss: 0.8670, test_loss: 1.0339, test_f1: 0.5319
 epoch: 93, train_loss: 0.8739, test_loss: 1.0307, test_f1: 0.5282
 epoch: 94, train_loss: 0.8714, test_loss: 1.0328, test_f1: 0.5350
 epoch: 95, train_loss: 0.8729, test_loss: 1.0247, test_f1: 0.5417
 epoch: 96, train_loss: 0.8724, test_loss: 1.0230, test_f1: 0.5360
 epoch: 97, train_loss: 0.8707, test_loss: 1.0266, test_f1: 0.5381
 epoch: 98, train_loss: 0.8713, test_loss: 1.0348, test_f1: 0.5511
 epoch: 99, train_loss: 0.8729, test_loss: 1.0285, test_f1: 0.5414

Training completed in 321.19 seconds
Best F1: 0.5591 at epoch 92
Mean F1 across iterations: 0.5380  0.0146
========================FINAL RESULTS================================
FEGIN weighted F1: 0.5591  0.0146
python main.py --data ltspice_demos --representation component_net --model FEGIN --layers 6 --hiddens 64 --batch_size 256 --lr 0.0001 --emb_size 512 --epochs 100 --save_appendix component_net_L6_H64_BS256_LR0.0001_E512 --no_val
-----



STDERR:
  File "main.py", line 370, in <module>
    main()
  File "main.py", line 254, in main
    dataset = dataset_class(
  File "/home/philip/projects/ltspice_examples_code_repo/Circuit-Completion-Using-GNNs/component_classification_with_link_prediction_head/evaluation/FEGIN/kernel/circuit_datasets.py", line 15, in __init__
    self.data, self.slices = torch.load(self.processed_paths[0])
  File "/home/philip/.local/lib/python3.8/site-packages/torch/serialization.py", line 1040, in load
    warnings.warn(
  File "/usr/lib/python3.8/warnings.py", line 109, in _showwarnmsg
    sw(msg.message, msg.category, msg.filename, msg.lineno,
  File "main.py", line 47, in warn_with_traceback
    traceback.print_stack(file=log)
/home/philip/projects/ltspice_examples_code_repo/Circuit-Completion-Using-GNNs/component_classification_with_link_prediction_head/evaluation/FEGIN/kernel/circuit_datasets.py:15: FutureWarning: You are using `torch.load` with `weights_only=False` (the current default value), which uses the default pickle module implicitly. It is possible to construct malicious pickle data which will execute arbitrary code during unpickling (See https://github.com/pytorch/pytorch/blob/main/SECURITY.md#untrusted-models for more details). In a future release, the default value for `weights_only` will be flipped to `True`. This limits the functions that could be executed during unpickling. Arbitrary objects will no longer be allowed to be loaded via this mode unless they are explicitly allowlisted by the user via `torch.serialization.add_safe_globals`. We recommend you start setting `weights_only=True` for any use case where you don't have full control of the loaded file. Please open an issue on GitHub for any issues related to this experimental feature.
  self.data, self.slices = torch.load(self.processed_paths[0])
