STDOUT:
Results will be saved in /home/philip/projects/ltspice_examples_code_repo/Circuit-Completion-Using-GNNs/component_classification_with_link_prediction_head/evaluation/FEGIN/results/model_FEGIN_dataset_ltspice_examples
Command line input: python main.py --data ltspice_examples --representation component_net --model FEGIN --layers 4 --hiddens 32 --batch_size 256 --lr 0.0001 --emb_size 128 --epochs 100 --save_appendix component_net_L4_H32_BS256_LR0.0001_E128 --no_val
 is saved.
-----
ltspice_examples - FEGIN
Using 4 layers, 32 hidden units, h = 2
Loading component_net representation dataset
ENTERED
Training FEGIN on component_net representation
Train: 3558, Test: 846
##################ITERATION #0 ****************************************
 epoch: 0, train_loss: 1.3614, test_loss: 1.3607, test_f1: 0.2270
 epoch: 1, train_loss: 1.3572, test_loss: 1.3602, test_f1: 0.2270
 epoch: 2, train_loss: 1.3550, test_loss: 1.3598, test_f1: 0.2270
 epoch: 3, train_loss: 1.3517, test_loss: 1.3572, test_f1: 0.2270
 epoch: 4, train_loss: 1.3491, test_loss: 1.3531, test_f1: 0.2270
 epoch: 5, train_loss: 1.3461, test_loss: 1.3482, test_f1: 0.2270
 epoch: 6, train_loss: 1.3440, test_loss: 1.3440, test_f1: 0.2270
 epoch: 7, train_loss: 1.3394, test_loss: 1.3403, test_f1: 0.2270
 epoch: 8, train_loss: 1.3359, test_loss: 1.3360, test_f1: 0.2270
 epoch: 9, train_loss: 1.3329, test_loss: 1.3317, test_f1: 0.2270
 epoch: 10, train_loss: 1.3287, test_loss: 1.3278, test_f1: 0.2270
 epoch: 11, train_loss: 1.3254, test_loss: 1.3241, test_f1: 0.2270
 epoch: 12, train_loss: 1.3213, test_loss: 1.3197, test_f1: 0.2270
 epoch: 13, train_loss: 1.3176, test_loss: 1.3152, test_f1: 0.2270
 epoch: 14, train_loss: 1.3140, test_loss: 1.3114, test_f1: 0.2295
 epoch: 15, train_loss: 1.3090, test_loss: 1.3075, test_f1: 0.2320
 epoch: 16, train_loss: 1.3058, test_loss: 1.3036, test_f1: 0.2320
 epoch: 17, train_loss: 1.3004, test_loss: 1.3001, test_f1: 0.2392
 epoch: 18, train_loss: 1.2973, test_loss: 1.2955, test_f1: 0.2461
 epoch: 19, train_loss: 1.2940, test_loss: 1.2914, test_f1: 0.2484
 epoch: 20, train_loss: 1.2895, test_loss: 1.2882, test_f1: 0.2549
 epoch: 21, train_loss: 1.2830, test_loss: 1.2842, test_f1: 0.2611
 epoch: 22, train_loss: 1.2815, test_loss: 1.2808, test_f1: 0.2651
 epoch: 23, train_loss: 1.2762, test_loss: 1.2759, test_f1: 0.2737
 epoch: 24, train_loss: 1.2712, test_loss: 1.2713, test_f1: 0.2806
 epoch: 25, train_loss: 1.2671, test_loss: 1.2671, test_f1: 0.2843
 epoch: 26, train_loss: 1.2610, test_loss: 1.2626, test_f1: 0.2892
 epoch: 27, train_loss: 1.2590, test_loss: 1.2573, test_f1: 0.3003
 epoch: 28, train_loss: 1.2544, test_loss: 1.2532, test_f1: 0.3018
 epoch: 29, train_loss: 1.2467, test_loss: 1.2481, test_f1: 0.3137
 epoch: 30, train_loss: 1.2432, test_loss: 1.2415, test_f1: 0.3250
 epoch: 31, train_loss: 1.2373, test_loss: 1.2359, test_f1: 0.3360
 epoch: 32, train_loss: 1.2318, test_loss: 1.2305, test_f1: 0.3402
 epoch: 33, train_loss: 1.2283, test_loss: 1.2249, test_f1: 0.3403
 epoch: 34, train_loss: 1.2218, test_loss: 1.2173, test_f1: 0.3539
 epoch: 35, train_loss: 1.2169, test_loss: 1.2111, test_f1: 0.3630
 epoch: 36, train_loss: 1.2147, test_loss: 1.2029, test_f1: 0.3705
 epoch: 37, train_loss: 1.2042, test_loss: 1.1965, test_f1: 0.3724
 epoch: 38, train_loss: 1.1984, test_loss: 1.1902, test_f1: 0.3752
 epoch: 39, train_loss: 1.1931, test_loss: 1.1819, test_f1: 0.3822
 epoch: 40, train_loss: 1.1867, test_loss: 1.1742, test_f1: 0.3918
 epoch: 41, train_loss: 1.1774, test_loss: 1.1672, test_f1: 0.3949
 epoch: 42, train_loss: 1.1716, test_loss: 1.1593, test_f1: 0.3956
 epoch: 43, train_loss: 1.1610, test_loss: 1.1512, test_f1: 0.3987
 epoch: 44, train_loss: 1.1549, test_loss: 1.1442, test_f1: 0.4107
 epoch: 45, train_loss: 1.1474, test_loss: 1.1353, test_f1: 0.4147
 epoch: 46, train_loss: 1.1462, test_loss: 1.1281, test_f1: 0.4205
 epoch: 47, train_loss: 1.1338, test_loss: 1.1181, test_f1: 0.4265
 epoch: 48, train_loss: 1.1266, test_loss: 1.1128, test_f1: 0.4292
 epoch: 49, train_loss: 1.1235, test_loss: 1.1047, test_f1: 0.4322
 epoch: 50, train_loss: 1.1169, test_loss: 1.0968, test_f1: 0.4319
 epoch: 51, train_loss: 1.1155, test_loss: 1.0932, test_f1: 0.4350
 epoch: 52, train_loss: 1.1101, test_loss: 1.0901, test_f1: 0.4384
 epoch: 53, train_loss: 1.1040, test_loss: 1.0855, test_f1: 0.4379
 epoch: 54, train_loss: 1.0998, test_loss: 1.0815, test_f1: 0.4477
 epoch: 55, train_loss: 1.1019, test_loss: 1.0774, test_f1: 0.4495
 epoch: 56, train_loss: 1.0955, test_loss: 1.0740, test_f1: 0.4506
 epoch: 57, train_loss: 1.0907, test_loss: 1.0709, test_f1: 0.4696
 epoch: 58, train_loss: 1.0847, test_loss: 1.0679, test_f1: 0.4671
 epoch: 59, train_loss: 1.0840, test_loss: 1.0634, test_f1: 0.4622
 epoch: 60, train_loss: 1.0793, test_loss: 1.0612, test_f1: 0.4651
 epoch: 61, train_loss: 1.0796, test_loss: 1.0573, test_f1: 0.4868
 epoch: 62, train_loss: 1.0732, test_loss: 1.0540, test_f1: 0.4817
 epoch: 63, train_loss: 1.0738, test_loss: 1.0510, test_f1: 0.4822
 epoch: 64, train_loss: 1.0713, test_loss: 1.0461, test_f1: 0.4813
 epoch: 65, train_loss: 1.0611, test_loss: 1.0432, test_f1: 0.4944
 epoch: 66, train_loss: 1.0565, test_loss: 1.0386, test_f1: 0.4920
 epoch: 67, train_loss: 1.0619, test_loss: 1.0367, test_f1: 0.4970
 epoch: 68, train_loss: 1.0605, test_loss: 1.0357, test_f1: 0.4967
 epoch: 69, train_loss: 1.0551, test_loss: 1.0304, test_f1: 0.4930
 epoch: 70, train_loss: 1.0540, test_loss: 1.0289, test_f1: 0.4974
 epoch: 71, train_loss: 1.0512, test_loss: 1.0255, test_f1: 0.4956
 epoch: 72, train_loss: 1.0508, test_loss: 1.0219, test_f1: 0.4979
 epoch: 73, train_loss: 1.0406, test_loss: 1.0199, test_f1: 0.4984
 epoch: 74, train_loss: 1.0389, test_loss: 1.0172, test_f1: 0.5014
 epoch: 75, train_loss: 1.0376, test_loss: 1.0154, test_f1: 0.5010
 epoch: 76, train_loss: 1.0372, test_loss: 1.0107, test_f1: 0.4977
 epoch: 77, train_loss: 1.0324, test_loss: 1.0067, test_f1: 0.5010
 epoch: 78, train_loss: 1.0283, test_loss: 1.0050, test_f1: 0.5010
 epoch: 79, train_loss: 1.0228, test_loss: 1.0011, test_f1: 0.5025
 epoch: 80, train_loss: 1.0237, test_loss: 1.0012, test_f1: 0.5027
 epoch: 81, train_loss: 1.0272, test_loss: 1.0003, test_f1: 0.4954
 epoch: 82, train_loss: 1.0209, test_loss: 0.9961, test_f1: 0.4998
 epoch: 83, train_loss: 1.0176, test_loss: 0.9914, test_f1: 0.5124
 epoch: 84, train_loss: 1.0118, test_loss: 0.9883, test_f1: 0.5143
 epoch: 85, train_loss: 1.0150, test_loss: 0.9855, test_f1: 0.5085
 epoch: 86, train_loss: 1.0039, test_loss: 0.9826, test_f1: 0.5115
 epoch: 87, train_loss: 1.0100, test_loss: 0.9808, test_f1: 0.5050
 epoch: 88, train_loss: 1.0045, test_loss: 0.9790, test_f1: 0.5044
 epoch: 89, train_loss: 1.0077, test_loss: 0.9773, test_f1: 0.5072
 epoch: 90, train_loss: 0.9965, test_loss: 0.9774, test_f1: 0.5071
 epoch: 91, train_loss: 0.9973, test_loss: 0.9767, test_f1: 0.4921
 epoch: 92, train_loss: 0.9964, test_loss: 0.9752, test_f1: 0.4866
 epoch: 93, train_loss: 0.9928, test_loss: 0.9699, test_f1: 0.5008
 epoch: 94, train_loss: 0.9952, test_loss: 0.9687, test_f1: 0.4990
 epoch: 95, train_loss: 0.9847, test_loss: 0.9675, test_f1: 0.4952
 epoch: 96, train_loss: 0.9874, test_loss: 0.9632, test_f1: 0.5140
 epoch: 97, train_loss: 0.9769, test_loss: 0.9633, test_f1: 0.5134
 epoch: 98, train_loss: 0.9823, test_loss: 0.9606, test_f1: 0.5110
 epoch: 99, train_loss: 0.9786, test_loss: 0.9596, test_f1: 0.5089
##################ITERATION #1 ****************************************
 epoch: 0, train_loss: 1.3273, test_loss: 1.3359, test_f1: 0.2270
 epoch: 1, train_loss: 1.3199, test_loss: 1.3310, test_f1: 0.2270
 epoch: 2, train_loss: 1.3163, test_loss: 1.3251, test_f1: 0.2270
 epoch: 3, train_loss: 1.3114, test_loss: 1.3186, test_f1: 0.2270
 epoch: 4, train_loss: 1.3068, test_loss: 1.3135, test_f1: 0.2270
 epoch: 5, train_loss: 1.3008, test_loss: 1.3072, test_f1: 0.2270
 epoch: 6, train_loss: 1.2970, test_loss: 1.3014, test_f1: 0.2270
 epoch: 7, train_loss: 1.2912, test_loss: 1.2956, test_f1: 0.2270
 epoch: 8, train_loss: 1.2840, test_loss: 1.2897, test_f1: 0.2270
 epoch: 9, train_loss: 1.2804, test_loss: 1.2836, test_f1: 0.2270
 epoch: 10, train_loss: 1.2759, test_loss: 1.2779, test_f1: 0.2270
 epoch: 11, train_loss: 1.2680, test_loss: 1.2720, test_f1: 0.2270
 epoch: 12, train_loss: 1.2656, test_loss: 1.2661, test_f1: 0.2270
 epoch: 13, train_loss: 1.2603, test_loss: 1.2602, test_f1: 0.2270
 epoch: 14, train_loss: 1.2538, test_loss: 1.2542, test_f1: 0.2270
 epoch: 15, train_loss: 1.2500, test_loss: 1.2478, test_f1: 0.2270
 epoch: 16, train_loss: 1.2422, test_loss: 1.2418, test_f1: 0.2270
 epoch: 17, train_loss: 1.2377, test_loss: 1.2361, test_f1: 0.2506
 epoch: 18, train_loss: 1.2352, test_loss: 1.2300, test_f1: 0.2549
 epoch: 19, train_loss: 1.2274, test_loss: 1.2243, test_f1: 0.2728
 epoch: 20, train_loss: 1.2266, test_loss: 1.2194, test_f1: 0.2728
 epoch: 21, train_loss: 1.2211, test_loss: 1.2137, test_f1: 0.2783
 epoch: 22, train_loss: 1.2168, test_loss: 1.2080, test_f1: 0.2819
 epoch: 23, train_loss: 1.2122, test_loss: 1.2029, test_f1: 0.2921
 epoch: 24, train_loss: 1.2027, test_loss: 1.1955, test_f1: 0.3157
 epoch: 25, train_loss: 1.1982, test_loss: 1.1905, test_f1: 0.3390
 epoch: 26, train_loss: 1.1959, test_loss: 1.1847, test_f1: 0.3492
 epoch: 27, train_loss: 1.1927, test_loss: 1.1792, test_f1: 0.3622
 epoch: 28, train_loss: 1.1860, test_loss: 1.1729, test_f1: 0.3808
 epoch: 29, train_loss: 1.1826, test_loss: 1.1664, test_f1: 0.4012
 epoch: 30, train_loss: 1.1726, test_loss: 1.1602, test_f1: 0.4091
 epoch: 31, train_loss: 1.1668, test_loss: 1.1535, test_f1: 0.4112
 epoch: 32, train_loss: 1.1635, test_loss: 1.1466, test_f1: 0.4143
 epoch: 33, train_loss: 1.1616, test_loss: 1.1390, test_f1: 0.4261
 epoch: 34, train_loss: 1.1559, test_loss: 1.1314, test_f1: 0.4273
 epoch: 35, train_loss: 1.1412, test_loss: 1.1247, test_f1: 0.4474
 epoch: 36, train_loss: 1.1380, test_loss: 1.1180, test_f1: 0.4600
 epoch: 37, train_loss: 1.1359, test_loss: 1.1105, test_f1: 0.4615
 epoch: 38, train_loss: 1.1246, test_loss: 1.1026, test_f1: 0.4635
 epoch: 39, train_loss: 1.1192, test_loss: 1.0964, test_f1: 0.4654
 epoch: 40, train_loss: 1.1109, test_loss: 1.0880, test_f1: 0.4712
 epoch: 41, train_loss: 1.1139, test_loss: 1.0857, test_f1: 0.4674
 epoch: 42, train_loss: 1.1017, test_loss: 1.0749, test_f1: 0.4752
 epoch: 43, train_loss: 1.0941, test_loss: 1.0680, test_f1: 0.4802
 epoch: 44, train_loss: 1.0881, test_loss: 1.0621, test_f1: 0.4767
 epoch: 45, train_loss: 1.0810, test_loss: 1.0569, test_f1: 0.4812
 epoch: 46, train_loss: 1.0769, test_loss: 1.0504, test_f1: 0.4803
 epoch: 47, train_loss: 1.0675, test_loss: 1.0473, test_f1: 0.4836
 epoch: 48, train_loss: 1.0646, test_loss: 1.0369, test_f1: 0.4832
 epoch: 49, train_loss: 1.0568, test_loss: 1.0362, test_f1: 0.4788
 epoch: 50, train_loss: 1.0516, test_loss: 1.0285, test_f1: 0.4867
 epoch: 51, train_loss: 1.0451, test_loss: 1.0246, test_f1: 0.4843
 epoch: 52, train_loss: 1.0398, test_loss: 1.0226, test_f1: 0.4784
 epoch: 53, train_loss: 1.0359, test_loss: 1.0209, test_f1: 0.4814
 epoch: 54, train_loss: 1.0384, test_loss: 1.0160, test_f1: 0.4863
 epoch: 55, train_loss: 1.0296, test_loss: 1.0152, test_f1: 0.4846
 epoch: 56, train_loss: 1.0315, test_loss: 1.0138, test_f1: 0.4839
 epoch: 57, train_loss: 1.0310, test_loss: 1.0141, test_f1: 0.4864
 epoch: 58, train_loss: 1.0228, test_loss: 1.0103, test_f1: 0.4874
 epoch: 59, train_loss: 1.0217, test_loss: 1.0078, test_f1: 0.4839
 epoch: 60, train_loss: 1.0120, test_loss: 1.0061, test_f1: 0.4797
 epoch: 61, train_loss: 1.0126, test_loss: 1.0005, test_f1: 0.4852
 epoch: 62, train_loss: 1.0155, test_loss: 1.0010, test_f1: 0.4842
 epoch: 63, train_loss: 1.0026, test_loss: 1.0000, test_f1: 0.4923
 epoch: 64, train_loss: 1.0081, test_loss: 0.9965, test_f1: 0.4884
 epoch: 65, train_loss: 0.9980, test_loss: 0.9932, test_f1: 0.4915
 epoch: 66, train_loss: 0.9997, test_loss: 0.9927, test_f1: 0.4925
 epoch: 67, train_loss: 1.0011, test_loss: 0.9901, test_f1: 0.4899
 epoch: 68, train_loss: 1.0010, test_loss: 0.9922, test_f1: 0.4925
 epoch: 69, train_loss: 0.9978, test_loss: 0.9903, test_f1: 0.4872
 epoch: 70, train_loss: 0.9942, test_loss: 0.9871, test_f1: 0.4820
 epoch: 71, train_loss: 0.9906, test_loss: 0.9864, test_f1: 0.4917
 epoch: 72, train_loss: 0.9891, test_loss: 0.9887, test_f1: 0.4948
 epoch: 73, train_loss: 0.9813, test_loss: 0.9847, test_f1: 0.4871
 epoch: 74, train_loss: 0.9783, test_loss: 0.9831, test_f1: 0.4853
 epoch: 75, train_loss: 0.9872, test_loss: 0.9868, test_f1: 0.4853
 epoch: 76, train_loss: 0.9772, test_loss: 0.9836, test_f1: 0.4862
 epoch: 77, train_loss: 0.9800, test_loss: 0.9792, test_f1: 0.4877
 epoch: 78, train_loss: 0.9836, test_loss: 0.9794, test_f1: 0.4849
 epoch: 79, train_loss: 0.9720, test_loss: 0.9727, test_f1: 0.4914
 epoch: 80, train_loss: 0.9787, test_loss: 0.9731, test_f1: 0.4918
 epoch: 81, train_loss: 0.9714, test_loss: 0.9769, test_f1: 0.4896
 epoch: 82, train_loss: 0.9701, test_loss: 0.9726, test_f1: 0.4886
 epoch: 83, train_loss: 0.9587, test_loss: 0.9767, test_f1: 0.4971
 epoch: 84, train_loss: 0.9692, test_loss: 0.9740, test_f1: 0.4908
 epoch: 85, train_loss: 0.9676, test_loss: 0.9736, test_f1: 0.4858
 epoch: 86, train_loss: 0.9616, test_loss: 0.9711, test_f1: 0.4843
 epoch: 87, train_loss: 0.9661, test_loss: 0.9661, test_f1: 0.4927
 epoch: 88, train_loss: 0.9599, test_loss: 0.9617, test_f1: 0.4897
 epoch: 89, train_loss: 0.9586, test_loss: 0.9677, test_f1: 0.4886
 epoch: 90, train_loss: 0.9533, test_loss: 0.9664, test_f1: 0.4893
 epoch: 91, train_loss: 0.9555, test_loss: 0.9630, test_f1: 0.4892
 epoch: 92, train_loss: 0.9445, test_loss: 0.9682, test_f1: 0.4894
 epoch: 93, train_loss: 0.9538, test_loss: 0.9697, test_f1: 0.4881
 epoch: 94, train_loss: 0.9490, test_loss: 0.9659, test_f1: 0.4935
 epoch: 95, train_loss: 0.9432, test_loss: 0.9565, test_f1: 0.4958
 epoch: 96, train_loss: 0.9461, test_loss: 0.9524, test_f1: 0.4913
 epoch: 97, train_loss: 0.9467, test_loss: 0.9545, test_f1: 0.4914
 epoch: 98, train_loss: 0.9403, test_loss: 0.9561, test_f1: 0.4896
 epoch: 99, train_loss: 0.9401, test_loss: 0.9522, test_f1: 0.4925
##################ITERATION #2 ****************************************
 epoch: 0, train_loss: 1.3193, test_loss: 1.3269, test_f1: 0.2270
 epoch: 1, train_loss: 1.3085, test_loss: 1.3250, test_f1: 0.2270
 epoch: 2, train_loss: 1.2994, test_loss: 1.3161, test_f1: 0.2270
 epoch: 3, train_loss: 1.2879, test_loss: 1.3043, test_f1: 0.2270
 epoch: 4, train_loss: 1.2844, test_loss: 1.2931, test_f1: 0.2270
 epoch: 5, train_loss: 1.2771, test_loss: 1.2821, test_f1: 0.2806
 epoch: 6, train_loss: 1.2706, test_loss: 1.2630, test_f1: 0.3149
 epoch: 7, train_loss: 1.2606, test_loss: 1.2465, test_f1: 0.3310
 epoch: 8, train_loss: 1.2564, test_loss: 1.2372, test_f1: 0.3307
 epoch: 9, train_loss: 1.2472, test_loss: 1.2286, test_f1: 0.3320
 epoch: 10, train_loss: 1.2398, test_loss: 1.2201, test_f1: 0.3329
 epoch: 11, train_loss: 1.2368, test_loss: 1.2124, test_f1: 0.3377
 epoch: 12, train_loss: 1.2309, test_loss: 1.2061, test_f1: 0.3412
 epoch: 13, train_loss: 1.2247, test_loss: 1.2005, test_f1: 0.3472
 epoch: 14, train_loss: 1.2185, test_loss: 1.1950, test_f1: 0.3516
 epoch: 15, train_loss: 1.2179, test_loss: 1.1890, test_f1: 0.3575
 epoch: 16, train_loss: 1.2085, test_loss: 1.1844, test_f1: 0.3543
 epoch: 17, train_loss: 1.2044, test_loss: 1.1775, test_f1: 0.3568
 epoch: 18, train_loss: 1.1954, test_loss: 1.1722, test_f1: 0.3612
 epoch: 19, train_loss: 1.1972, test_loss: 1.1672, test_f1: 0.3670
 epoch: 20, train_loss: 1.1871, test_loss: 1.1613, test_f1: 0.3660
 epoch: 21, train_loss: 1.1821, test_loss: 1.1549, test_f1: 0.3736
 epoch: 22, train_loss: 1.1828, test_loss: 1.1515, test_f1: 0.3720
 epoch: 23, train_loss: 1.1728, test_loss: 1.1475, test_f1: 0.3813
 epoch: 24, train_loss: 1.1722, test_loss: 1.1425, test_f1: 0.3821
 epoch: 25, train_loss: 1.1632, test_loss: 1.1363, test_f1: 0.3833
 epoch: 26, train_loss: 1.1611, test_loss: 1.1310, test_f1: 0.3985
 epoch: 27, train_loss: 1.1565, test_loss: 1.1267, test_f1: 0.4003
 epoch: 28, train_loss: 1.1518, test_loss: 1.1230, test_f1: 0.4005
 epoch: 29, train_loss: 1.1533, test_loss: 1.1186, test_f1: 0.4090
 epoch: 30, train_loss: 1.1409, test_loss: 1.1131, test_f1: 0.4146
 epoch: 31, train_loss: 1.1396, test_loss: 1.1084, test_f1: 0.4208
 epoch: 32, train_loss: 1.1295, test_loss: 1.1037, test_f1: 0.4218
 epoch: 33, train_loss: 1.1249, test_loss: 1.1004, test_f1: 0.4296
 epoch: 34, train_loss: 1.1228, test_loss: 1.0961, test_f1: 0.4387
 epoch: 35, train_loss: 1.1213, test_loss: 1.0899, test_f1: 0.4465
 epoch: 36, train_loss: 1.1210, test_loss: 1.0863, test_f1: 0.4463
 epoch: 37, train_loss: 1.1153, test_loss: 1.0812, test_f1: 0.4558
 epoch: 38, train_loss: 1.1105, test_loss: 1.0774, test_f1: 0.4620
 epoch: 39, train_loss: 1.1069, test_loss: 1.0754, test_f1: 0.4620
 epoch: 40, train_loss: 1.1002, test_loss: 1.0688, test_f1: 0.4614
 epoch: 41, train_loss: 1.0931, test_loss: 1.0643, test_f1: 0.4631
 epoch: 42, train_loss: 1.0852, test_loss: 1.0581, test_f1: 0.4726
 epoch: 43, train_loss: 1.0811, test_loss: 1.0541, test_f1: 0.4758
 epoch: 44, train_loss: 1.0802, test_loss: 1.0480, test_f1: 0.4756
 epoch: 45, train_loss: 1.0765, test_loss: 1.0446, test_f1: 0.4720
 epoch: 46, train_loss: 1.0687, test_loss: 1.0416, test_f1: 0.4752
 epoch: 47, train_loss: 1.0687, test_loss: 1.0401, test_f1: 0.4723
 epoch: 48, train_loss: 1.0593, test_loss: 1.0351, test_f1: 0.4808
 epoch: 49, train_loss: 1.0552, test_loss: 1.0296, test_f1: 0.4830
 epoch: 50, train_loss: 1.0552, test_loss: 1.0292, test_f1: 0.4813
 epoch: 51, train_loss: 1.0448, test_loss: 1.0258, test_f1: 0.4782
 epoch: 52, train_loss: 1.0483, test_loss: 1.0237, test_f1: 0.4887
 epoch: 53, train_loss: 1.0458, test_loss: 1.0211, test_f1: 0.4823
 epoch: 54, train_loss: 1.0418, test_loss: 1.0192, test_f1: 0.4836
 epoch: 55, train_loss: 1.0433, test_loss: 1.0179, test_f1: 0.4813
 epoch: 56, train_loss: 1.0363, test_loss: 1.0165, test_f1: 0.4837
 epoch: 57, train_loss: 1.0309, test_loss: 1.0141, test_f1: 0.4855
 epoch: 58, train_loss: 1.0344, test_loss: 1.0133, test_f1: 0.4814
 epoch: 59, train_loss: 1.0324, test_loss: 1.0133, test_f1: 0.4873
 epoch: 60, train_loss: 1.0280, test_loss: 1.0105, test_f1: 0.4895
 epoch: 61, train_loss: 1.0256, test_loss: 1.0084, test_f1: 0.4898
 epoch: 62, train_loss: 1.0257, test_loss: 1.0077, test_f1: 0.4907
 epoch: 63, train_loss: 1.0271, test_loss: 1.0062, test_f1: 0.4920
 epoch: 64, train_loss: 1.0212, test_loss: 1.0037, test_f1: 0.4919
 epoch: 65, train_loss: 1.0175, test_loss: 1.0015, test_f1: 0.4917
 epoch: 66, train_loss: 1.0167, test_loss: 1.0008, test_f1: 0.4923
 epoch: 67, train_loss: 1.0148, test_loss: 1.0002, test_f1: 0.4923
 epoch: 68, train_loss: 1.0134, test_loss: 0.9982, test_f1: 0.4946
 epoch: 69, train_loss: 1.0155, test_loss: 0.9977, test_f1: 0.4924
 epoch: 70, train_loss: 1.0101, test_loss: 0.9972, test_f1: 0.4901
 epoch: 71, train_loss: 1.0020, test_loss: 0.9950, test_f1: 0.4922
 epoch: 72, train_loss: 1.0062, test_loss: 0.9935, test_f1: 0.4953
 epoch: 73, train_loss: 1.0016, test_loss: 0.9917, test_f1: 0.4936
 epoch: 74, train_loss: 1.0009, test_loss: 0.9927, test_f1: 0.4884
 epoch: 75, train_loss: 1.0002, test_loss: 0.9911, test_f1: 0.4935
 epoch: 76, train_loss: 0.9982, test_loss: 0.9891, test_f1: 0.4912
 epoch: 77, train_loss: 0.9984, test_loss: 0.9889, test_f1: 0.4896
 epoch: 78, train_loss: 0.9949, test_loss: 0.9875, test_f1: 0.4891
 epoch: 79, train_loss: 1.0008, test_loss: 0.9867, test_f1: 0.4900
 epoch: 80, train_loss: 0.9903, test_loss: 0.9863, test_f1: 0.4932
 epoch: 81, train_loss: 0.9919, test_loss: 0.9863, test_f1: 0.4920
 epoch: 82, train_loss: 0.9919, test_loss: 0.9844, test_f1: 0.4962
 epoch: 83, train_loss: 0.9840, test_loss: 0.9856, test_f1: 0.4909
 epoch: 84, train_loss: 0.9900, test_loss: 0.9838, test_f1: 0.4930
 epoch: 85, train_loss: 0.9762, test_loss: 0.9816, test_f1: 0.4919
 epoch: 86, train_loss: 0.9868, test_loss: 0.9814, test_f1: 0.4907
 epoch: 87, train_loss: 0.9837, test_loss: 0.9814, test_f1: 0.4909
 epoch: 88, train_loss: 0.9828, test_loss: 0.9801, test_f1: 0.4949
 epoch: 89, train_loss: 0.9790, test_loss: 0.9790, test_f1: 0.4888
 epoch: 90, train_loss: 0.9759, test_loss: 0.9785, test_f1: 0.4870
 epoch: 91, train_loss: 0.9781, test_loss: 0.9778, test_f1: 0.4883
 epoch: 92, train_loss: 0.9754, test_loss: 0.9777, test_f1: 0.4899
 epoch: 93, train_loss: 0.9768, test_loss: 0.9760, test_f1: 0.4957
 epoch: 94, train_loss: 0.9743, test_loss: 0.9731, test_f1: 0.4947
 epoch: 95, train_loss: 0.9742, test_loss: 0.9714, test_f1: 0.4967
 epoch: 96, train_loss: 0.9770, test_loss: 0.9731, test_f1: 0.4937
 epoch: 97, train_loss: 0.9674, test_loss: 0.9705, test_f1: 0.4957
 epoch: 98, train_loss: 0.9668, test_loss: 0.9675, test_f1: 0.4957
 epoch: 99, train_loss: 0.9647, test_loss: 0.9681, test_f1: 0.4885
##################ITERATION #3 ****************************************
 epoch: 0, train_loss: 1.3127, test_loss: 1.3197, test_f1: 0.2270
 epoch: 1, train_loss: 1.2944, test_loss: 1.3190, test_f1: 0.2270
 epoch: 2, train_loss: 1.2857, test_loss: 1.3094, test_f1: 0.2270
 epoch: 3, train_loss: 1.2771, test_loss: 1.2913, test_f1: 0.2270
 epoch: 4, train_loss: 1.2669, test_loss: 1.2724, test_f1: 0.2270
 epoch: 5, train_loss: 1.2604, test_loss: 1.2525, test_f1: 0.2270
 epoch: 6, train_loss: 1.2514, test_loss: 1.2388, test_f1: 0.2297
 epoch: 7, train_loss: 1.2431, test_loss: 1.2288, test_f1: 0.2640
 epoch: 8, train_loss: 1.2371, test_loss: 1.2217, test_f1: 0.2813
 epoch: 9, train_loss: 1.2299, test_loss: 1.2143, test_f1: 0.2899
 epoch: 10, train_loss: 1.2223, test_loss: 1.2075, test_f1: 0.3095
 epoch: 11, train_loss: 1.2145, test_loss: 1.1989, test_f1: 0.3317
 epoch: 12, train_loss: 1.2082, test_loss: 1.1918, test_f1: 0.3592
 epoch: 13, train_loss: 1.2034, test_loss: 1.1822, test_f1: 0.3702
 epoch: 14, train_loss: 1.1925, test_loss: 1.1737, test_f1: 0.3864
 epoch: 15, train_loss: 1.1858, test_loss: 1.1663, test_f1: 0.4107
 epoch: 16, train_loss: 1.1776, test_loss: 1.1578, test_f1: 0.4127
 epoch: 17, train_loss: 1.1684, test_loss: 1.1510, test_f1: 0.4189
 epoch: 18, train_loss: 1.1645, test_loss: 1.1427, test_f1: 0.4199
 epoch: 19, train_loss: 1.1621, test_loss: 1.1354, test_f1: 0.4287
 epoch: 20, train_loss: 1.1533, test_loss: 1.1279, test_f1: 0.4316
 epoch: 21, train_loss: 1.1454, test_loss: 1.1208, test_f1: 0.4404
 epoch: 22, train_loss: 1.1344, test_loss: 1.1130, test_f1: 0.4426
 epoch: 23, train_loss: 1.1297, test_loss: 1.1043, test_f1: 0.4437
 epoch: 24, train_loss: 1.1203, test_loss: 1.0962, test_f1: 0.4457
 epoch: 25, train_loss: 1.1164, test_loss: 1.0878, test_f1: 0.4457
 epoch: 26, train_loss: 1.1101, test_loss: 1.0825, test_f1: 0.4443
 epoch: 27, train_loss: 1.1032, test_loss: 1.0761, test_f1: 0.4470
 epoch: 28, train_loss: 1.0983, test_loss: 1.0689, test_f1: 0.4341
 epoch: 29, train_loss: 1.0898, test_loss: 1.0641, test_f1: 0.4433
 epoch: 30, train_loss: 1.0850, test_loss: 1.0578, test_f1: 0.4425
 epoch: 31, train_loss: 1.0765, test_loss: 1.0509, test_f1: 0.4435
 epoch: 32, train_loss: 1.0711, test_loss: 1.0443, test_f1: 0.4467
 epoch: 33, train_loss: 1.0681, test_loss: 1.0396, test_f1: 0.4440
 epoch: 34, train_loss: 1.0599, test_loss: 1.0349, test_f1: 0.4490
 epoch: 35, train_loss: 1.0541, test_loss: 1.0259, test_f1: 0.4509
 epoch: 36, train_loss: 1.0446, test_loss: 1.0225, test_f1: 0.4552
 epoch: 37, train_loss: 1.0423, test_loss: 1.0176, test_f1: 0.4577
 epoch: 38, train_loss: 1.0264, test_loss: 1.0118, test_f1: 0.4601
 epoch: 39, train_loss: 1.0263, test_loss: 1.0058, test_f1: 0.4578
 epoch: 40, train_loss: 1.0234, test_loss: 1.0058, test_f1: 0.4615
 epoch: 41, train_loss: 1.0130, test_loss: 1.0049, test_f1: 0.4583
 epoch: 42, train_loss: 1.0153, test_loss: 0.9986, test_f1: 0.4598
 epoch: 43, train_loss: 1.0123, test_loss: 0.9950, test_f1: 0.4654
 epoch: 44, train_loss: 0.9969, test_loss: 0.9937, test_f1: 0.4651
 epoch: 45, train_loss: 1.0016, test_loss: 0.9888, test_f1: 0.4771
 epoch: 46, train_loss: 0.9936, test_loss: 0.9882, test_f1: 0.4706
 epoch: 47, train_loss: 0.9932, test_loss: 0.9828, test_f1: 0.4670
 epoch: 48, train_loss: 0.9943, test_loss: 0.9787, test_f1: 0.4667
 epoch: 49, train_loss: 0.9821, test_loss: 0.9765, test_f1: 0.4728
 epoch: 50, train_loss: 0.9801, test_loss: 0.9773, test_f1: 0.4778
 epoch: 51, train_loss: 0.9799, test_loss: 0.9762, test_f1: 0.4734
 epoch: 52, train_loss: 0.9751, test_loss: 0.9773, test_f1: 0.4739
 epoch: 53, train_loss: 0.9731, test_loss: 0.9752, test_f1: 0.4801
 epoch: 54, train_loss: 0.9666, test_loss: 0.9766, test_f1: 0.4838
 epoch: 55, train_loss: 0.9631, test_loss: 0.9710, test_f1: 0.4812
 epoch: 56, train_loss: 0.9752, test_loss: 0.9717, test_f1: 0.4802
 epoch: 57, train_loss: 0.9634, test_loss: 0.9722, test_f1: 0.4842
 epoch: 58, train_loss: 0.9691, test_loss: 0.9716, test_f1: 0.4817
 epoch: 59, train_loss: 0.9635, test_loss: 0.9673, test_f1: 0.4787
 epoch: 60, train_loss: 0.9639, test_loss: 0.9672, test_f1: 0.4774
 epoch: 61, train_loss: 0.9626, test_loss: 0.9671, test_f1: 0.4811
 epoch: 62, train_loss: 0.9633, test_loss: 0.9629, test_f1: 0.4797
 epoch: 63, train_loss: 0.9572, test_loss: 0.9676, test_f1: 0.4803
 epoch: 64, train_loss: 0.9554, test_loss: 0.9693, test_f1: 0.4834
 epoch: 65, train_loss: 0.9515, test_loss: 0.9679, test_f1: 0.4792
 epoch: 66, train_loss: 0.9528, test_loss: 0.9673, test_f1: 0.4759
 epoch: 67, train_loss: 0.9490, test_loss: 0.9616, test_f1: 0.4830
 epoch: 68, train_loss: 0.9537, test_loss: 0.9626, test_f1: 0.4838
 epoch: 69, train_loss: 0.9430, test_loss: 0.9653, test_f1: 0.4839
 epoch: 70, train_loss: 0.9489, test_loss: 0.9613, test_f1: 0.4809
 epoch: 71, train_loss: 0.9379, test_loss: 0.9601, test_f1: 0.4848
 epoch: 72, train_loss: 0.9441, test_loss: 0.9677, test_f1: 0.4825
 epoch: 73, train_loss: 0.9447, test_loss: 0.9648, test_f1: 0.4762
 epoch: 74, train_loss: 0.9450, test_loss: 0.9684, test_f1: 0.4816
 epoch: 75, train_loss: 0.9449, test_loss: 0.9621, test_f1: 0.4806
 epoch: 76, train_loss: 0.9398, test_loss: 0.9650, test_f1: 0.4827
 epoch: 77, train_loss: 0.9350, test_loss: 0.9615, test_f1: 0.4854
 epoch: 78, train_loss: 0.9386, test_loss: 0.9625, test_f1: 0.4851
 epoch: 79, train_loss: 0.9338, test_loss: 0.9606, test_f1: 0.4841
 epoch: 80, train_loss: 0.9311, test_loss: 0.9572, test_f1: 0.4819
 epoch: 81, train_loss: 0.9349, test_loss: 0.9562, test_f1: 0.4892
 epoch: 82, train_loss: 0.9280, test_loss: 0.9492, test_f1: 0.4898
 epoch: 83, train_loss: 0.9324, test_loss: 0.9537, test_f1: 0.4907
 epoch: 84, train_loss: 0.9244, test_loss: 0.9542, test_f1: 0.4870
 epoch: 85, train_loss: 0.9216, test_loss: 0.9585, test_f1: 0.4900
 epoch: 86, train_loss: 0.9167, test_loss: 0.9532, test_f1: 0.4855
 epoch: 87, train_loss: 0.9181, test_loss: 0.9494, test_f1: 0.4975
 epoch: 88, train_loss: 0.9259, test_loss: 0.9513, test_f1: 0.4975
 epoch: 89, train_loss: 0.9166, test_loss: 0.9501, test_f1: 0.4971
 epoch: 90, train_loss: 0.9173, test_loss: 0.9499, test_f1: 0.4963
 epoch: 91, train_loss: 0.9274, test_loss: 0.9550, test_f1: 0.4987
 epoch: 92, train_loss: 0.9188, test_loss: 0.9579, test_f1: 0.4992
 epoch: 93, train_loss: 0.9173, test_loss: 0.9558, test_f1: 0.5016
 epoch: 94, train_loss: 0.9148, test_loss: 0.9520, test_f1: 0.5050
 epoch: 95, train_loss: 0.9183, test_loss: 0.9574, test_f1: 0.5012
 epoch: 96, train_loss: 0.9080, test_loss: 0.9535, test_f1: 0.5019
 epoch: 97, train_loss: 0.9091, test_loss: 0.9484, test_f1: 0.5073
 epoch: 98, train_loss: 0.9073, test_loss: 0.9503, test_f1: 0.5086
 epoch: 99, train_loss: 0.9097, test_loss: 0.9501, test_f1: 0.5045
##################ITERATION #4 ****************************************
 epoch: 0, train_loss: 1.3044, test_loss: 1.3170, test_f1: 0.2270
 epoch: 1, train_loss: 1.2786, test_loss: 1.3075, test_f1: 0.2270
 epoch: 2, train_loss: 1.2653, test_loss: 1.2899, test_f1: 0.2270
 epoch: 3, train_loss: 1.2575, test_loss: 1.2655, test_f1: 0.2270
 epoch: 4, train_loss: 1.2470, test_loss: 1.2431, test_f1: 0.2350
 epoch: 5, train_loss: 1.2410, test_loss: 1.2206, test_f1: 0.2662
 epoch: 6, train_loss: 1.2363, test_loss: 1.2056, test_f1: 0.2912
 epoch: 7, train_loss: 1.2263, test_loss: 1.1960, test_f1: 0.3044
 epoch: 8, train_loss: 1.2208, test_loss: 1.1881, test_f1: 0.3059
 epoch: 9, train_loss: 1.2156, test_loss: 1.1791, test_f1: 0.3125
 epoch: 10, train_loss: 1.2098, test_loss: 1.1712, test_f1: 0.3224
 epoch: 11, train_loss: 1.2057, test_loss: 1.1631, test_f1: 0.3325
 epoch: 12, train_loss: 1.1937, test_loss: 1.1580, test_f1: 0.3526
 epoch: 13, train_loss: 1.1916, test_loss: 1.1504, test_f1: 0.3682
 epoch: 14, train_loss: 1.1856, test_loss: 1.1416, test_f1: 0.3884
 epoch: 15, train_loss: 1.1712, test_loss: 1.1344, test_f1: 0.3903
 epoch: 16, train_loss: 1.1605, test_loss: 1.1304, test_f1: 0.4055
 epoch: 17, train_loss: 1.1596, test_loss: 1.1237, test_f1: 0.4081
 epoch: 18, train_loss: 1.1571, test_loss: 1.1151, test_f1: 0.4073
 epoch: 19, train_loss: 1.1431, test_loss: 1.1067, test_f1: 0.4106
 epoch: 20, train_loss: 1.1422, test_loss: 1.0995, test_f1: 0.4150
 epoch: 21, train_loss: 1.1359, test_loss: 1.0919, test_f1: 0.4258
 epoch: 22, train_loss: 1.1265, test_loss: 1.0868, test_f1: 0.4348
 epoch: 23, train_loss: 1.1199, test_loss: 1.0792, test_f1: 0.4463
 epoch: 24, train_loss: 1.1152, test_loss: 1.0723, test_f1: 0.4513
 epoch: 25, train_loss: 1.1115, test_loss: 1.0664, test_f1: 0.4551
 epoch: 26, train_loss: 1.0960, test_loss: 1.0589, test_f1: 0.4518
 epoch: 27, train_loss: 1.0905, test_loss: 1.0549, test_f1: 0.4531
 epoch: 28, train_loss: 1.0903, test_loss: 1.0467, test_f1: 0.4520
 epoch: 29, train_loss: 1.0810, test_loss: 1.0414, test_f1: 0.4641
 epoch: 30, train_loss: 1.0768, test_loss: 1.0347, test_f1: 0.4703
 epoch: 31, train_loss: 1.0604, test_loss: 1.0292, test_f1: 0.4666
 epoch: 32, train_loss: 1.0570, test_loss: 1.0193, test_f1: 0.4688
 epoch: 33, train_loss: 1.0524, test_loss: 1.0150, test_f1: 0.4708
 epoch: 34, train_loss: 1.0438, test_loss: 1.0131, test_f1: 0.4627
 epoch: 35, train_loss: 1.0374, test_loss: 1.0056, test_f1: 0.4638
 epoch: 36, train_loss: 1.0369, test_loss: 0.9982, test_f1: 0.4707
 epoch: 37, train_loss: 1.0282, test_loss: 0.9952, test_f1: 0.4687
 epoch: 38, train_loss: 1.0265, test_loss: 0.9881, test_f1: 0.4725
 epoch: 39, train_loss: 1.0200, test_loss: 0.9850, test_f1: 0.4743
 epoch: 40, train_loss: 1.0194, test_loss: 0.9849, test_f1: 0.4757
 epoch: 41, train_loss: 1.0178, test_loss: 0.9767, test_f1: 0.4819
 epoch: 42, train_loss: 1.0099, test_loss: 0.9724, test_f1: 0.4818
 epoch: 43, train_loss: 0.9959, test_loss: 0.9688, test_f1: 0.4834
 epoch: 44, train_loss: 0.9996, test_loss: 0.9634, test_f1: 0.4904
 epoch: 45, train_loss: 0.9974, test_loss: 0.9609, test_f1: 0.4824
 epoch: 46, train_loss: 0.9913, test_loss: 0.9609, test_f1: 0.4888
 epoch: 47, train_loss: 0.9792, test_loss: 0.9580, test_f1: 0.4838
 epoch: 48, train_loss: 0.9852, test_loss: 0.9550, test_f1: 0.4853
 epoch: 49, train_loss: 0.9747, test_loss: 0.9555, test_f1: 0.4905
 epoch: 50, train_loss: 0.9742, test_loss: 0.9582, test_f1: 0.4867
 epoch: 51, train_loss: 0.9703, test_loss: 0.9487, test_f1: 0.4941
 epoch: 52, train_loss: 0.9760, test_loss: 0.9514, test_f1: 0.4935
 epoch: 53, train_loss: 0.9650, test_loss: 0.9512, test_f1: 0.4902
 epoch: 54, train_loss: 0.9521, test_loss: 0.9492, test_f1: 0.4941
 epoch: 55, train_loss: 0.9697, test_loss: 0.9463, test_f1: 0.4961
 epoch: 56, train_loss: 0.9678, test_loss: 0.9453, test_f1: 0.4963
 epoch: 57, train_loss: 0.9606, test_loss: 0.9425, test_f1: 0.4993
 epoch: 58, train_loss: 0.9586, test_loss: 0.9468, test_f1: 0.4941
 epoch: 59, train_loss: 0.9535, test_loss: 0.9457, test_f1: 0.4991
 epoch: 60, train_loss: 0.9516, test_loss: 0.9452, test_f1: 0.4952
 epoch: 61, train_loss: 0.9539, test_loss: 0.9501, test_f1: 0.4950
 epoch: 62, train_loss: 0.9539, test_loss: 0.9490, test_f1: 0.4933
 epoch: 63, train_loss: 0.9593, test_loss: 0.9467, test_f1: 0.5002
 epoch: 64, train_loss: 0.9469, test_loss: 0.9429, test_f1: 0.5048
 epoch: 65, train_loss: 0.9462, test_loss: 0.9482, test_f1: 0.5053
 epoch: 66, train_loss: 0.9457, test_loss: 0.9446, test_f1: 0.5043
 epoch: 67, train_loss: 0.9429, test_loss: 0.9442, test_f1: 0.5044
 epoch: 68, train_loss: 0.9494, test_loss: 0.9468, test_f1: 0.4968
 epoch: 69, train_loss: 0.9464, test_loss: 0.9477, test_f1: 0.4974
 epoch: 70, train_loss: 0.9313, test_loss: 0.9425, test_f1: 0.5022
 epoch: 71, train_loss: 0.9413, test_loss: 0.9434, test_f1: 0.5068
 epoch: 72, train_loss: 0.9363, test_loss: 0.9420, test_f1: 0.5031
 epoch: 73, train_loss: 0.9362, test_loss: 0.9399, test_f1: 0.5076
 epoch: 74, train_loss: 0.9407, test_loss: 0.9419, test_f1: 0.5037
 epoch: 75, train_loss: 0.9285, test_loss: 0.9403, test_f1: 0.5061
 epoch: 76, train_loss: 0.9410, test_loss: 0.9388, test_f1: 0.5063
 epoch: 77, train_loss: 0.9256, test_loss: 0.9406, test_f1: 0.5012
 epoch: 78, train_loss: 0.9302, test_loss: 0.9429, test_f1: 0.5007
 epoch: 79, train_loss: 0.9251, test_loss: 0.9409, test_f1: 0.5023
 epoch: 80, train_loss: 0.9298, test_loss: 0.9412, test_f1: 0.5033
 epoch: 81, train_loss: 0.9314, test_loss: 0.9427, test_f1: 0.5033
 epoch: 82, train_loss: 0.9232, test_loss: 0.9412, test_f1: 0.5024
 epoch: 83, train_loss: 0.9232, test_loss: 0.9407, test_f1: 0.5044
 epoch: 84, train_loss: 0.9275, test_loss: 0.9394, test_f1: 0.5054
 epoch: 85, train_loss: 0.9200, test_loss: 0.9437, test_f1: 0.5160
 epoch: 86, train_loss: 0.9205, test_loss: 0.9472, test_f1: 0.5092
 epoch: 87, train_loss: 0.9157, test_loss: 0.9450, test_f1: 0.4990
 epoch: 88, train_loss: 0.9110, test_loss: 0.9410, test_f1: 0.5150
 epoch: 89, train_loss: 0.9204, test_loss: 0.9420, test_f1: 0.5160
 epoch: 90, train_loss: 0.9186, test_loss: 0.9488, test_f1: 0.5021
 epoch: 91, train_loss: 0.9108, test_loss: 0.9469, test_f1: 0.5131
 epoch: 92, train_loss: 0.9160, test_loss: 0.9411, test_f1: 0.5178
 epoch: 93, train_loss: 0.9146, test_loss: 0.9388, test_f1: 0.5188
 epoch: 94, train_loss: 0.9087, test_loss: 0.9409, test_f1: 0.5142
 epoch: 95, train_loss: 0.9041, test_loss: 0.9437, test_f1: 0.5204
 epoch: 96, train_loss: 0.9177, test_loss: 0.9424, test_f1: 0.5182
 epoch: 97, train_loss: 0.9143, test_loss: 0.9484, test_f1: 0.5152
 epoch: 98, train_loss: 0.9034, test_loss: 0.9485, test_f1: 0.5175
 epoch: 99, train_loss: 0.9054, test_loss: 0.9475, test_f1: 0.5119
##################ITERATION #5 ****************************************
 epoch: 0, train_loss: 1.3078, test_loss: 1.3305, test_f1: 0.2270
 epoch: 1, train_loss: 1.2764, test_loss: 1.3312, test_f1: 0.2270
 epoch: 2, train_loss: 1.2663, test_loss: 1.3292, test_f1: 0.2270
 epoch: 3, train_loss: 1.2498, test_loss: 1.3313, test_f1: 0.2270
 epoch: 4, train_loss: 1.2353, test_loss: 1.3084, test_f1: 0.2526
 epoch: 5, train_loss: 1.2267, test_loss: 1.2420, test_f1: 0.2606
 epoch: 6, train_loss: 1.2193, test_loss: 1.1970, test_f1: 0.2956
 epoch: 7, train_loss: 1.2144, test_loss: 1.1793, test_f1: 0.3062
 epoch: 8, train_loss: 1.2015, test_loss: 1.1685, test_f1: 0.3099
 epoch: 9, train_loss: 1.1928, test_loss: 1.1598, test_f1: 0.3303
 epoch: 10, train_loss: 1.1852, test_loss: 1.1520, test_f1: 0.3522
 epoch: 11, train_loss: 1.1846, test_loss: 1.1429, test_f1: 0.3646
 epoch: 12, train_loss: 1.1700, test_loss: 1.1340, test_f1: 0.3854
 epoch: 13, train_loss: 1.1721, test_loss: 1.1287, test_f1: 0.3836
 epoch: 14, train_loss: 1.1571, test_loss: 1.1210, test_f1: 0.3999
 epoch: 15, train_loss: 1.1528, test_loss: 1.1104, test_f1: 0.4097
 epoch: 16, train_loss: 1.1460, test_loss: 1.1068, test_f1: 0.4251
 epoch: 17, train_loss: 1.1415, test_loss: 1.0988, test_f1: 0.4360
 epoch: 18, train_loss: 1.1360, test_loss: 1.0926, test_f1: 0.4461
 epoch: 19, train_loss: 1.1293, test_loss: 1.0879, test_f1: 0.4507
 epoch: 20, train_loss: 1.1235, test_loss: 1.0819, test_f1: 0.4573
 epoch: 21, train_loss: 1.1133, test_loss: 1.0725, test_f1: 0.4603
 epoch: 22, train_loss: 1.1074, test_loss: 1.0637, test_f1: 0.4589
 epoch: 23, train_loss: 1.1073, test_loss: 1.0593, test_f1: 0.4623
 epoch: 24, train_loss: 1.0995, test_loss: 1.0537, test_f1: 0.4667
 epoch: 25, train_loss: 1.0974, test_loss: 1.0512, test_f1: 0.4686
 epoch: 26, train_loss: 1.0929, test_loss: 1.0437, test_f1: 0.4749
 epoch: 27, train_loss: 1.0788, test_loss: 1.0386, test_f1: 0.4651
 epoch: 28, train_loss: 1.0769, test_loss: 1.0307, test_f1: 0.4741
 epoch: 29, train_loss: 1.0732, test_loss: 1.0273, test_f1: 0.4713
 epoch: 30, train_loss: 1.0669, test_loss: 1.0195, test_f1: 0.4734
 epoch: 31, train_loss: 1.0610, test_loss: 1.0173, test_f1: 0.4724
 epoch: 32, train_loss: 1.0576, test_loss: 1.0158, test_f1: 0.4692
 epoch: 33, train_loss: 1.0484, test_loss: 1.0113, test_f1: 0.4704
 epoch: 34, train_loss: 1.0456, test_loss: 1.0042, test_f1: 0.4771
 epoch: 35, train_loss: 1.0391, test_loss: 0.9997, test_f1: 0.4759
 epoch: 36, train_loss: 1.0331, test_loss: 0.9968, test_f1: 0.4748
 epoch: 37, train_loss: 1.0318, test_loss: 0.9918, test_f1: 0.4847
 epoch: 38, train_loss: 1.0299, test_loss: 0.9890, test_f1: 0.4793
 epoch: 39, train_loss: 1.0295, test_loss: 0.9899, test_f1: 0.4832
 epoch: 40, train_loss: 1.0237, test_loss: 0.9854, test_f1: 0.4865
 epoch: 41, train_loss: 1.0141, test_loss: 0.9812, test_f1: 0.4824
 epoch: 42, train_loss: 1.0160, test_loss: 0.9823, test_f1: 0.4793
 epoch: 43, train_loss: 1.0167, test_loss: 0.9740, test_f1: 0.4750
 epoch: 44, train_loss: 1.0017, test_loss: 0.9744, test_f1: 0.4719
 epoch: 45, train_loss: 0.9951, test_loss: 0.9776, test_f1: 0.4789
 epoch: 46, train_loss: 0.9954, test_loss: 0.9717, test_f1: 0.4783
 epoch: 47, train_loss: 0.9889, test_loss: 0.9729, test_f1: 0.4846
 epoch: 48, train_loss: 0.9946, test_loss: 0.9684, test_f1: 0.4714
 epoch: 49, train_loss: 0.9943, test_loss: 0.9733, test_f1: 0.4830
 epoch: 50, train_loss: 0.9819, test_loss: 0.9672, test_f1: 0.4957
 epoch: 51, train_loss: 0.9803, test_loss: 0.9703, test_f1: 0.4885
 epoch: 52, train_loss: 0.9811, test_loss: 0.9695, test_f1: 0.4825
 epoch: 53, train_loss: 0.9759, test_loss: 0.9601, test_f1: 0.4892
 epoch: 54, train_loss: 0.9764, test_loss: 0.9686, test_f1: 0.4904
 epoch: 55, train_loss: 0.9853, test_loss: 0.9639, test_f1: 0.4917
 epoch: 56, train_loss: 0.9600, test_loss: 0.9621, test_f1: 0.4854
 epoch: 57, train_loss: 0.9777, test_loss: 0.9586, test_f1: 0.4896
 epoch: 58, train_loss: 0.9718, test_loss: 0.9605, test_f1: 0.4877
 epoch: 59, train_loss: 0.9586, test_loss: 0.9563, test_f1: 0.4941
 epoch: 60, train_loss: 0.9704, test_loss: 0.9534, test_f1: 0.4897
 epoch: 61, train_loss: 0.9642, test_loss: 0.9576, test_f1: 0.4918
 epoch: 62, train_loss: 0.9611, test_loss: 0.9561, test_f1: 0.4880
 epoch: 63, train_loss: 0.9573, test_loss: 0.9552, test_f1: 0.4875
 epoch: 64, train_loss: 0.9565, test_loss: 0.9510, test_f1: 0.4837
 epoch: 65, train_loss: 0.9601, test_loss: 0.9507, test_f1: 0.4890
 epoch: 66, train_loss: 0.9594, test_loss: 0.9561, test_f1: 0.4931
 epoch: 67, train_loss: 0.9596, test_loss: 0.9515, test_f1: 0.4877
 epoch: 68, train_loss: 0.9509, test_loss: 0.9484, test_f1: 0.4863
 epoch: 69, train_loss: 0.9593, test_loss: 0.9596, test_f1: 0.4838
 epoch: 70, train_loss: 0.9538, test_loss: 0.9464, test_f1: 0.4930
 epoch: 71, train_loss: 0.9619, test_loss: 0.9454, test_f1: 0.4956
 epoch: 72, train_loss: 0.9494, test_loss: 0.9493, test_f1: 0.4904
 epoch: 73, train_loss: 0.9466, test_loss: 0.9529, test_f1: 0.4938
 epoch: 74, train_loss: 0.9503, test_loss: 0.9427, test_f1: 0.4939
 epoch: 75, train_loss: 0.9441, test_loss: 0.9417, test_f1: 0.4932
 epoch: 76, train_loss: 0.9404, test_loss: 0.9424, test_f1: 0.4923
 epoch: 77, train_loss: 0.9362, test_loss: 0.9432, test_f1: 0.4916
 epoch: 78, train_loss: 0.9446, test_loss: 0.9492, test_f1: 0.4911
 epoch: 79, train_loss: 0.9382, test_loss: 0.9444, test_f1: 0.4917
 epoch: 80, train_loss: 0.9415, test_loss: 0.9507, test_f1: 0.4976
 epoch: 81, train_loss: 0.9440, test_loss: 0.9479, test_f1: 0.4960
 epoch: 82, train_loss: 0.9400, test_loss: 0.9434, test_f1: 0.4938
 epoch: 83, train_loss: 0.9400, test_loss: 0.9423, test_f1: 0.4914
 epoch: 84, train_loss: 0.9304, test_loss: 0.9453, test_f1: 0.4910
 epoch: 85, train_loss: 0.9339, test_loss: 0.9392, test_f1: 0.4936
 epoch: 86, train_loss: 0.9355, test_loss: 0.9358, test_f1: 0.4965
 epoch: 87, train_loss: 0.9340, test_loss: 0.9495, test_f1: 0.4999
 epoch: 88, train_loss: 0.9313, test_loss: 0.9435, test_f1: 0.4905
 epoch: 89, train_loss: 0.9291, test_loss: 0.9441, test_f1: 0.4973
 epoch: 90, train_loss: 0.9329, test_loss: 0.9457, test_f1: 0.5008
 epoch: 91, train_loss: 0.9304, test_loss: 0.9491, test_f1: 0.4958
 epoch: 92, train_loss: 0.9282, test_loss: 0.9408, test_f1: 0.5012
 epoch: 93, train_loss: 0.9218, test_loss: 0.9456, test_f1: 0.4964
 epoch: 94, train_loss: 0.9317, test_loss: 0.9401, test_f1: 0.4975
 epoch: 95, train_loss: 0.9220, test_loss: 0.9464, test_f1: 0.5017
 epoch: 96, train_loss: 0.9298, test_loss: 0.9434, test_f1: 0.5047
 epoch: 97, train_loss: 0.9241, test_loss: 0.9417, test_f1: 0.4986
 epoch: 98, train_loss: 0.9244, test_loss: 0.9434, test_f1: 0.4978
 epoch: 99, train_loss: 0.9187, test_loss: 0.9467, test_f1: 0.4954
##################ITERATION #6 ****************************************
 epoch: 0, train_loss: 1.3256, test_loss: 1.3129, test_f1: 0.2270
 epoch: 1, train_loss: 1.2820, test_loss: 1.3134, test_f1: 0.2270
 epoch: 2, train_loss: 1.2670, test_loss: 1.2966, test_f1: 0.2270
 epoch: 3, train_loss: 1.2442, test_loss: 1.2679, test_f1: 0.2270
 epoch: 4, train_loss: 1.2339, test_loss: 1.2259, test_f1: 0.2677
 epoch: 5, train_loss: 1.2286, test_loss: 1.1953, test_f1: 0.2783
 epoch: 6, train_loss: 1.2158, test_loss: 1.1767, test_f1: 0.2973
 epoch: 7, train_loss: 1.2059, test_loss: 1.1660, test_f1: 0.3031
 epoch: 8, train_loss: 1.1944, test_loss: 1.1544, test_f1: 0.3169
 epoch: 9, train_loss: 1.1898, test_loss: 1.1465, test_f1: 0.3290
 epoch: 10, train_loss: 1.1834, test_loss: 1.1383, test_f1: 0.3447
 epoch: 11, train_loss: 1.1781, test_loss: 1.1313, test_f1: 0.3562
 epoch: 12, train_loss: 1.1680, test_loss: 1.1232, test_f1: 0.3640
 epoch: 13, train_loss: 1.1615, test_loss: 1.1154, test_f1: 0.3749
 epoch: 14, train_loss: 1.1489, test_loss: 1.1061, test_f1: 0.3884
 epoch: 15, train_loss: 1.1457, test_loss: 1.0978, test_f1: 0.3965
 epoch: 16, train_loss: 1.1409, test_loss: 1.0899, test_f1: 0.4125
 epoch: 17, train_loss: 1.1367, test_loss: 1.0827, test_f1: 0.4243
 epoch: 18, train_loss: 1.1260, test_loss: 1.0748, test_f1: 0.4332
 epoch: 19, train_loss: 1.1215, test_loss: 1.0676, test_f1: 0.4393
 epoch: 20, train_loss: 1.1246, test_loss: 1.0610, test_f1: 0.4451
 epoch: 21, train_loss: 1.1050, test_loss: 1.0555, test_f1: 0.4447
 epoch: 22, train_loss: 1.1066, test_loss: 1.0509, test_f1: 0.4432
 epoch: 23, train_loss: 1.1025, test_loss: 1.0434, test_f1: 0.4467
 epoch: 24, train_loss: 1.0913, test_loss: 1.0388, test_f1: 0.4499
 epoch: 25, train_loss: 1.0889, test_loss: 1.0346, test_f1: 0.4577
 epoch: 26, train_loss: 1.0773, test_loss: 1.0310, test_f1: 0.4599
 epoch: 27, train_loss: 1.0833, test_loss: 1.0229, test_f1: 0.4634
 epoch: 28, train_loss: 1.0787, test_loss: 1.0186, test_f1: 0.4638
 epoch: 29, train_loss: 1.0653, test_loss: 1.0165, test_f1: 0.4642
 epoch: 30, train_loss: 1.0594, test_loss: 1.0141, test_f1: 0.4718
 epoch: 31, train_loss: 1.0567, test_loss: 1.0109, test_f1: 0.4728
 epoch: 32, train_loss: 1.0494, test_loss: 1.0072, test_f1: 0.4698
 epoch: 33, train_loss: 1.0512, test_loss: 1.0026, test_f1: 0.4741
 epoch: 34, train_loss: 1.0463, test_loss: 0.9996, test_f1: 0.4719
 epoch: 35, train_loss: 1.0525, test_loss: 0.9982, test_f1: 0.4700
 epoch: 36, train_loss: 1.0387, test_loss: 0.9909, test_f1: 0.4737
 epoch: 37, train_loss: 1.0328, test_loss: 0.9867, test_f1: 0.4744
 epoch: 38, train_loss: 1.0362, test_loss: 0.9841, test_f1: 0.4782
 epoch: 39, train_loss: 1.0258, test_loss: 0.9834, test_f1: 0.4641
 epoch: 40, train_loss: 1.0245, test_loss: 0.9791, test_f1: 0.4760
 epoch: 41, train_loss: 1.0195, test_loss: 0.9782, test_f1: 0.4691
 epoch: 42, train_loss: 1.0129, test_loss: 0.9743, test_f1: 0.4708
 epoch: 43, train_loss: 1.0171, test_loss: 0.9703, test_f1: 0.4754
 epoch: 44, train_loss: 1.0039, test_loss: 0.9668, test_f1: 0.4811
 epoch: 45, train_loss: 1.0043, test_loss: 0.9647, test_f1: 0.4773
 epoch: 46, train_loss: 0.9961, test_loss: 0.9647, test_f1: 0.4785
 epoch: 47, train_loss: 0.9938, test_loss: 0.9607, test_f1: 0.4853
 epoch: 48, train_loss: 0.9925, test_loss: 0.9554, test_f1: 0.5136
 epoch: 49, train_loss: 0.9965, test_loss: 0.9526, test_f1: 0.5117
 epoch: 50, train_loss: 0.9871, test_loss: 0.9477, test_f1: 0.5103
 epoch: 51, train_loss: 0.9928, test_loss: 0.9471, test_f1: 0.5124
 epoch: 52, train_loss: 0.9775, test_loss: 0.9461, test_f1: 0.5139
 epoch: 53, train_loss: 0.9795, test_loss: 0.9470, test_f1: 0.5124
 epoch: 54, train_loss: 0.9815, test_loss: 0.9452, test_f1: 0.5159
 epoch: 55, train_loss: 0.9835, test_loss: 0.9455, test_f1: 0.5120
 epoch: 56, train_loss: 0.9752, test_loss: 0.9420, test_f1: 0.5184
 epoch: 57, train_loss: 0.9806, test_loss: 0.9417, test_f1: 0.5173
 epoch: 58, train_loss: 0.9790, test_loss: 0.9390, test_f1: 0.5147
 epoch: 59, train_loss: 0.9755, test_loss: 0.9401, test_f1: 0.5159
 epoch: 60, train_loss: 0.9792, test_loss: 0.9377, test_f1: 0.5155
 epoch: 61, train_loss: 0.9822, test_loss: 0.9390, test_f1: 0.5109
 epoch: 62, train_loss: 0.9744, test_loss: 0.9358, test_f1: 0.5172
 epoch: 63, train_loss: 0.9659, test_loss: 0.9360, test_f1: 0.5157
 epoch: 64, train_loss: 0.9653, test_loss: 0.9364, test_f1: 0.5172
 epoch: 65, train_loss: 0.9667, test_loss: 0.9355, test_f1: 0.5168
 epoch: 66, train_loss: 0.9632, test_loss: 0.9351, test_f1: 0.5101
 epoch: 67, train_loss: 0.9604, test_loss: 0.9326, test_f1: 0.5099
 epoch: 68, train_loss: 0.9612, test_loss: 0.9337, test_f1: 0.5100
 epoch: 69, train_loss: 0.9571, test_loss: 0.9352, test_f1: 0.5073
 epoch: 70, train_loss: 0.9669, test_loss: 0.9334, test_f1: 0.5118
 epoch: 71, train_loss: 0.9619, test_loss: 0.9337, test_f1: 0.5128
 epoch: 72, train_loss: 0.9540, test_loss: 0.9287, test_f1: 0.5128
 epoch: 73, train_loss: 0.9609, test_loss: 0.9262, test_f1: 0.5112
 epoch: 74, train_loss: 0.9610, test_loss: 0.9283, test_f1: 0.5106
 epoch: 75, train_loss: 0.9508, test_loss: 0.9273, test_f1: 0.5073
 epoch: 76, train_loss: 0.9613, test_loss: 0.9247, test_f1: 0.5154
 epoch: 77, train_loss: 0.9501, test_loss: 0.9224, test_f1: 0.5179
 epoch: 78, train_loss: 0.9527, test_loss: 0.9223, test_f1: 0.5160
 epoch: 79, train_loss: 0.9506, test_loss: 0.9202, test_f1: 0.5159
 epoch: 80, train_loss: 0.9406, test_loss: 0.9202, test_f1: 0.5160
 epoch: 81, train_loss: 0.9443, test_loss: 0.9197, test_f1: 0.5141
 epoch: 82, train_loss: 0.9414, test_loss: 0.9180, test_f1: 0.5165
 epoch: 83, train_loss: 0.9434, test_loss: 0.9172, test_f1: 0.5121
 epoch: 84, train_loss: 0.9494, test_loss: 0.9151, test_f1: 0.5121
 epoch: 85, train_loss: 0.9437, test_loss: 0.9176, test_f1: 0.5143
 epoch: 86, train_loss: 0.9423, test_loss: 0.9165, test_f1: 0.5083
 epoch: 87, train_loss: 0.9439, test_loss: 0.9172, test_f1: 0.5180
 epoch: 88, train_loss: 0.9378, test_loss: 0.9146, test_f1: 0.5179
 epoch: 89, train_loss: 0.9309, test_loss: 0.9163, test_f1: 0.5174
 epoch: 90, train_loss: 0.9438, test_loss: 0.9184, test_f1: 0.5129
 epoch: 91, train_loss: 0.9358, test_loss: 0.9151, test_f1: 0.5190
 epoch: 92, train_loss: 0.9361, test_loss: 0.9148, test_f1: 0.5186
 epoch: 93, train_loss: 0.9329, test_loss: 0.9148, test_f1: 0.5145
 epoch: 94, train_loss: 0.9384, test_loss: 0.9178, test_f1: 0.5130
 epoch: 95, train_loss: 0.9300, test_loss: 0.9170, test_f1: 0.5154
 epoch: 96, train_loss: 0.9247, test_loss: 0.9179, test_f1: 0.5020
 epoch: 97, train_loss: 0.9328, test_loss: 0.9146, test_f1: 0.5093
 epoch: 98, train_loss: 0.9310, test_loss: 0.9127, test_f1: 0.5200
 epoch: 99, train_loss: 0.9231, test_loss: 0.9123, test_f1: 0.5146
##################ITERATION #7 ****************************************
 epoch: 0, train_loss: 1.3638, test_loss: 1.3368, test_f1: 0.2270
 epoch: 1, train_loss: 1.3126, test_loss: 1.3202, test_f1: 0.2270
 epoch: 2, train_loss: 1.2809, test_loss: 1.3119, test_f1: 0.2270
 epoch: 3, train_loss: 1.2736, test_loss: 1.2843, test_f1: 0.2270
 epoch: 4, train_loss: 1.2520, test_loss: 1.2432, test_f1: 0.2270
 epoch: 5, train_loss: 1.2359, test_loss: 1.2193, test_f1: 0.2439
 epoch: 6, train_loss: 1.2282, test_loss: 1.2056, test_f1: 0.2646
 epoch: 7, train_loss: 1.2212, test_loss: 1.1944, test_f1: 0.2813
 epoch: 8, train_loss: 1.2110, test_loss: 1.1836, test_f1: 0.3254
 epoch: 9, train_loss: 1.1969, test_loss: 1.1745, test_f1: 0.3416
 epoch: 10, train_loss: 1.1912, test_loss: 1.1653, test_f1: 0.3532
 epoch: 11, train_loss: 1.1839, test_loss: 1.1540, test_f1: 0.3746
 epoch: 12, train_loss: 1.1800, test_loss: 1.1450, test_f1: 0.3805
 epoch: 13, train_loss: 1.1781, test_loss: 1.1360, test_f1: 0.3987
 epoch: 14, train_loss: 1.1597, test_loss: 1.1286, test_f1: 0.4138
 epoch: 15, train_loss: 1.1551, test_loss: 1.1204, test_f1: 0.4303
 epoch: 16, train_loss: 1.1470, test_loss: 1.1116, test_f1: 0.4317
 epoch: 17, train_loss: 1.1327, test_loss: 1.1021, test_f1: 0.4336
 epoch: 18, train_loss: 1.1257, test_loss: 1.0924, test_f1: 0.4363
 epoch: 19, train_loss: 1.1172, test_loss: 1.0849, test_f1: 0.4378
 epoch: 20, train_loss: 1.1142, test_loss: 1.0772, test_f1: 0.4402
 epoch: 21, train_loss: 1.1040, test_loss: 1.0698, test_f1: 0.4428
 epoch: 22, train_loss: 1.0959, test_loss: 1.0624, test_f1: 0.4512
 epoch: 23, train_loss: 1.0837, test_loss: 1.0544, test_f1: 0.4590
 epoch: 24, train_loss: 1.0860, test_loss: 1.0451, test_f1: 0.4596
 epoch: 25, train_loss: 1.0828, test_loss: 1.0393, test_f1: 0.4686
 epoch: 26, train_loss: 1.0719, test_loss: 1.0320, test_f1: 0.4662
 epoch: 27, train_loss: 1.0690, test_loss: 1.0262, test_f1: 0.4680
 epoch: 28, train_loss: 1.0584, test_loss: 1.0196, test_f1: 0.4734
 epoch: 29, train_loss: 1.0569, test_loss: 1.0137, test_f1: 0.4742
 epoch: 30, train_loss: 1.0476, test_loss: 1.0092, test_f1: 0.4743
 epoch: 31, train_loss: 1.0492, test_loss: 1.0063, test_f1: 0.4761
 epoch: 32, train_loss: 1.0382, test_loss: 1.0006, test_f1: 0.4761
 epoch: 33, train_loss: 1.0308, test_loss: 0.9946, test_f1: 0.4785
 epoch: 34, train_loss: 1.0246, test_loss: 0.9891, test_f1: 0.4785
 epoch: 35, train_loss: 1.0256, test_loss: 0.9877, test_f1: 0.4792
 epoch: 36, train_loss: 1.0120, test_loss: 0.9864, test_f1: 0.4804
 epoch: 37, train_loss: 1.0131, test_loss: 0.9854, test_f1: 0.4817
 epoch: 38, train_loss: 1.0077, test_loss: 0.9797, test_f1: 0.4781
 epoch: 39, train_loss: 1.0002, test_loss: 0.9746, test_f1: 0.4776
 epoch: 40, train_loss: 1.0054, test_loss: 0.9738, test_f1: 0.4810
 epoch: 41, train_loss: 0.9898, test_loss: 0.9753, test_f1: 0.4784
 epoch: 42, train_loss: 0.9996, test_loss: 0.9743, test_f1: 0.4801
 epoch: 43, train_loss: 0.9874, test_loss: 0.9703, test_f1: 0.4813
 epoch: 44, train_loss: 0.9834, test_loss: 0.9721, test_f1: 0.4802
 epoch: 45, train_loss: 0.9798, test_loss: 0.9697, test_f1: 0.4841
 epoch: 46, train_loss: 0.9804, test_loss: 0.9655, test_f1: 0.4847
 epoch: 47, train_loss: 0.9759, test_loss: 0.9635, test_f1: 0.4927
 epoch: 48, train_loss: 0.9722, test_loss: 0.9591, test_f1: 0.4928
 epoch: 49, train_loss: 0.9712, test_loss: 0.9575, test_f1: 0.4928
 epoch: 50, train_loss: 0.9636, test_loss: 0.9577, test_f1: 0.4987
 epoch: 51, train_loss: 0.9582, test_loss: 0.9574, test_f1: 0.4991
 epoch: 52, train_loss: 0.9696, test_loss: 0.9628, test_f1: 0.4956
 epoch: 53, train_loss: 0.9696, test_loss: 0.9635, test_f1: 0.4950
 epoch: 54, train_loss: 0.9615, test_loss: 0.9643, test_f1: 0.4944
 epoch: 55, train_loss: 0.9586, test_loss: 0.9633, test_f1: 0.4939
 epoch: 56, train_loss: 0.9541, test_loss: 0.9584, test_f1: 0.4951
 epoch: 57, train_loss: 0.9574, test_loss: 0.9580, test_f1: 0.4985
 epoch: 58, train_loss: 0.9476, test_loss: 0.9567, test_f1: 0.4962
 epoch: 59, train_loss: 0.9552, test_loss: 0.9604, test_f1: 0.4983
 epoch: 60, train_loss: 0.9566, test_loss: 0.9621, test_f1: 0.4979
 epoch: 61, train_loss: 0.9525, test_loss: 0.9592, test_f1: 0.4984
 epoch: 62, train_loss: 0.9540, test_loss: 0.9581, test_f1: 0.4989
 epoch: 63, train_loss: 0.9608, test_loss: 0.9548, test_f1: 0.4958
 epoch: 64, train_loss: 0.9575, test_loss: 0.9599, test_f1: 0.4967
 epoch: 65, train_loss: 0.9550, test_loss: 0.9614, test_f1: 0.4984
 epoch: 66, train_loss: 0.9499, test_loss: 0.9574, test_f1: 0.4999
 epoch: 67, train_loss: 0.9508, test_loss: 0.9548, test_f1: 0.4983
 epoch: 68, train_loss: 0.9456, test_loss: 0.9551, test_f1: 0.4945
 epoch: 69, train_loss: 0.9467, test_loss: 0.9560, test_f1: 0.4975
 epoch: 70, train_loss: 0.9406, test_loss: 0.9643, test_f1: 0.4992
 epoch: 71, train_loss: 0.9477, test_loss: 0.9584, test_f1: 0.4997
 epoch: 72, train_loss: 0.9406, test_loss: 0.9603, test_f1: 0.4993
 epoch: 73, train_loss: 0.9435, test_loss: 0.9631, test_f1: 0.5004
 epoch: 74, train_loss: 0.9430, test_loss: 0.9635, test_f1: 0.4973
 epoch: 75, train_loss: 0.9424, test_loss: 0.9588, test_f1: 0.4990
 epoch: 76, train_loss: 0.9332, test_loss: 0.9638, test_f1: 0.4992
 epoch: 77, train_loss: 0.9362, test_loss: 0.9654, test_f1: 0.4953
 epoch: 78, train_loss: 0.9323, test_loss: 0.9569, test_f1: 0.4960
 epoch: 79, train_loss: 0.9354, test_loss: 0.9551, test_f1: 0.5026
 epoch: 80, train_loss: 0.9308, test_loss: 0.9599, test_f1: 0.4973
 epoch: 81, train_loss: 0.9389, test_loss: 0.9607, test_f1: 0.4997
 epoch: 82, train_loss: 0.9353, test_loss: 0.9595, test_f1: 0.5006
 epoch: 83, train_loss: 0.9325, test_loss: 0.9586, test_f1: 0.4990
 epoch: 84, train_loss: 0.9324, test_loss: 0.9573, test_f1: 0.4989
 epoch: 85, train_loss: 0.9332, test_loss: 0.9584, test_f1: 0.5016
 epoch: 86, train_loss: 0.9319, test_loss: 0.9607, test_f1: 0.4965
 epoch: 87, train_loss: 0.9216, test_loss: 0.9622, test_f1: 0.4984
 epoch: 88, train_loss: 0.9195, test_loss: 0.9653, test_f1: 0.4976
 epoch: 89, train_loss: 0.9374, test_loss: 0.9622, test_f1: 0.4980
 epoch: 90, train_loss: 0.9312, test_loss: 0.9620, test_f1: 0.4993
 epoch: 91, train_loss: 0.9201, test_loss: 0.9597, test_f1: 0.5037
 epoch: 92, train_loss: 0.9292, test_loss: 0.9585, test_f1: 0.5003
 epoch: 93, train_loss: 0.9307, test_loss: 0.9678, test_f1: 0.4986
 epoch: 94, train_loss: 0.9239, test_loss: 0.9631, test_f1: 0.4988
 epoch: 95, train_loss: 0.9224, test_loss: 0.9698, test_f1: 0.4986
 epoch: 96, train_loss: 0.9193, test_loss: 0.9687, test_f1: 0.4975
 epoch: 97, train_loss: 0.9166, test_loss: 0.9641, test_f1: 0.5015
 epoch: 98, train_loss: 0.9128, test_loss: 0.9606, test_f1: 0.5014
 epoch: 99, train_loss: 0.9184, test_loss: 0.9584, test_f1: 0.4979
##################ITERATION #8 ****************************************
 epoch: 0, train_loss: 1.3428, test_loss: 1.3135, test_f1: 0.2270
 epoch: 1, train_loss: 1.2744, test_loss: 1.2966, test_f1: 0.2270
 epoch: 2, train_loss: 1.2498, test_loss: 1.2832, test_f1: 0.2270
 epoch: 3, train_loss: 1.2287, test_loss: 1.2539, test_f1: 0.2515
 epoch: 4, train_loss: 1.2201, test_loss: 1.2115, test_f1: 0.2588
 epoch: 5, train_loss: 1.2082, test_loss: 1.1709, test_f1: 0.3346
 epoch: 6, train_loss: 1.2025, test_loss: 1.1531, test_f1: 0.3498
 epoch: 7, train_loss: 1.1889, test_loss: 1.1392, test_f1: 0.3663
 epoch: 8, train_loss: 1.1770, test_loss: 1.1303, test_f1: 0.3809
 epoch: 9, train_loss: 1.1750, test_loss: 1.1218, test_f1: 0.3964
 epoch: 10, train_loss: 1.1619, test_loss: 1.1131, test_f1: 0.4142
 epoch: 11, train_loss: 1.1573, test_loss: 1.1053, test_f1: 0.4217
 epoch: 12, train_loss: 1.1490, test_loss: 1.0978, test_f1: 0.4279
 epoch: 13, train_loss: 1.1376, test_loss: 1.0947, test_f1: 0.4361
 epoch: 14, train_loss: 1.1318, test_loss: 1.0865, test_f1: 0.4395
 epoch: 15, train_loss: 1.1381, test_loss: 1.0798, test_f1: 0.4562
 epoch: 16, train_loss: 1.1258, test_loss: 1.0715, test_f1: 0.4536
 epoch: 17, train_loss: 1.1147, test_loss: 1.0655, test_f1: 0.4554
 epoch: 18, train_loss: 1.1076, test_loss: 1.0582, test_f1: 0.4576
 epoch: 19, train_loss: 1.0973, test_loss: 1.0521, test_f1: 0.4639
 epoch: 20, train_loss: 1.0997, test_loss: 1.0454, test_f1: 0.4640
 epoch: 21, train_loss: 1.0819, test_loss: 1.0391, test_f1: 0.4724
 epoch: 22, train_loss: 1.0868, test_loss: 1.0333, test_f1: 0.4735
 epoch: 23, train_loss: 1.0889, test_loss: 1.0296, test_f1: 0.4716
 epoch: 24, train_loss: 1.0746, test_loss: 1.0222, test_f1: 0.4753
 epoch: 25, train_loss: 1.0592, test_loss: 1.0161, test_f1: 0.4742
 epoch: 26, train_loss: 1.0641, test_loss: 1.0111, test_f1: 0.4749
 epoch: 27, train_loss: 1.0579, test_loss: 1.0057, test_f1: 0.4773
 epoch: 28, train_loss: 1.0524, test_loss: 1.0004, test_f1: 0.4823
 epoch: 29, train_loss: 1.0457, test_loss: 0.9955, test_f1: 0.4830
 epoch: 30, train_loss: 1.0411, test_loss: 0.9910, test_f1: 0.4830
 epoch: 31, train_loss: 1.0316, test_loss: 0.9884, test_f1: 0.4806
 epoch: 32, train_loss: 1.0351, test_loss: 0.9852, test_f1: 0.4810
 epoch: 33, train_loss: 1.0241, test_loss: 0.9787, test_f1: 0.4830
 epoch: 34, train_loss: 1.0211, test_loss: 0.9760, test_f1: 0.4866
 epoch: 35, train_loss: 1.0173, test_loss: 0.9714, test_f1: 0.4873
 epoch: 36, train_loss: 1.0094, test_loss: 0.9705, test_f1: 0.4822
 epoch: 37, train_loss: 1.0013, test_loss: 0.9699, test_f1: 0.4801
 epoch: 38, train_loss: 1.0027, test_loss: 0.9647, test_f1: 0.4860
 epoch: 39, train_loss: 0.9999, test_loss: 0.9594, test_f1: 0.4871
 epoch: 40, train_loss: 1.0007, test_loss: 0.9575, test_f1: 0.4868
 epoch: 41, train_loss: 0.9869, test_loss: 0.9556, test_f1: 0.4837
 epoch: 42, train_loss: 0.9881, test_loss: 0.9552, test_f1: 0.4801
 epoch: 43, train_loss: 0.9865, test_loss: 0.9545, test_f1: 0.4824
 epoch: 44, train_loss: 0.9881, test_loss: 0.9528, test_f1: 0.4786
 epoch: 45, train_loss: 0.9794, test_loss: 0.9535, test_f1: 0.4818
 epoch: 46, train_loss: 0.9886, test_loss: 0.9489, test_f1: 0.4808
 epoch: 47, train_loss: 0.9746, test_loss: 0.9489, test_f1: 0.4884
 epoch: 48, train_loss: 0.9690, test_loss: 0.9458, test_f1: 0.4975
 epoch: 49, train_loss: 0.9736, test_loss: 0.9551, test_f1: 0.4958
 epoch: 50, train_loss: 0.9626, test_loss: 0.9519, test_f1: 0.4986
 epoch: 51, train_loss: 0.9668, test_loss: 0.9532, test_f1: 0.4953
 epoch: 52, train_loss: 0.9621, test_loss: 0.9514, test_f1: 0.4969
 epoch: 53, train_loss: 0.9494, test_loss: 0.9508, test_f1: 0.4965
 epoch: 54, train_loss: 0.9610, test_loss: 0.9512, test_f1: 0.4967
 epoch: 55, train_loss: 0.9555, test_loss: 0.9485, test_f1: 0.4922
 epoch: 56, train_loss: 0.9562, test_loss: 0.9497, test_f1: 0.5022
 epoch: 57, train_loss: 0.9600, test_loss: 0.9523, test_f1: 0.5002
 epoch: 58, train_loss: 0.9518, test_loss: 0.9499, test_f1: 0.4977
 epoch: 59, train_loss: 0.9436, test_loss: 0.9496, test_f1: 0.4958
 epoch: 60, train_loss: 0.9484, test_loss: 0.9469, test_f1: 0.4993
 epoch: 61, train_loss: 0.9495, test_loss: 0.9436, test_f1: 0.4984
 epoch: 62, train_loss: 0.9421, test_loss: 0.9462, test_f1: 0.4951
 epoch: 63, train_loss: 0.9532, test_loss: 0.9459, test_f1: 0.4973
 epoch: 64, train_loss: 0.9437, test_loss: 0.9490, test_f1: 0.5000
 epoch: 65, train_loss: 0.9462, test_loss: 0.9488, test_f1: 0.5027
 epoch: 66, train_loss: 0.9429, test_loss: 0.9424, test_f1: 0.4956
 epoch: 67, train_loss: 0.9467, test_loss: 0.9400, test_f1: 0.4994
 epoch: 68, train_loss: 0.9415, test_loss: 0.9400, test_f1: 0.5025
 epoch: 69, train_loss: 0.9516, test_loss: 0.9402, test_f1: 0.5042
 epoch: 70, train_loss: 0.9365, test_loss: 0.9443, test_f1: 0.5059
 epoch: 71, train_loss: 0.9376, test_loss: 0.9454, test_f1: 0.5049
 epoch: 72, train_loss: 0.9415, test_loss: 0.9445, test_f1: 0.5078
 epoch: 73, train_loss: 0.9306, test_loss: 0.9490, test_f1: 0.5050
 epoch: 74, train_loss: 0.9294, test_loss: 0.9408, test_f1: 0.5140
 epoch: 75, train_loss: 0.9314, test_loss: 0.9406, test_f1: 0.5084
 epoch: 76, train_loss: 0.9264, test_loss: 0.9375, test_f1: 0.5083
 epoch: 77, train_loss: 0.9295, test_loss: 0.9427, test_f1: 0.5081
 epoch: 78, train_loss: 0.9311, test_loss: 0.9414, test_f1: 0.5142
 epoch: 79, train_loss: 0.9322, test_loss: 0.9454, test_f1: 0.5094
 epoch: 80, train_loss: 0.9302, test_loss: 0.9406, test_f1: 0.5123
 epoch: 81, train_loss: 0.9266, test_loss: 0.9368, test_f1: 0.5090
 epoch: 82, train_loss: 0.9315, test_loss: 0.9389, test_f1: 0.5105
 epoch: 83, train_loss: 0.9198, test_loss: 0.9385, test_f1: 0.5146
 epoch: 84, train_loss: 0.9236, test_loss: 0.9372, test_f1: 0.5163
 epoch: 85, train_loss: 0.9250, test_loss: 0.9394, test_f1: 0.5111
 epoch: 86, train_loss: 0.9190, test_loss: 0.9389, test_f1: 0.5088
 epoch: 87, train_loss: 0.9267, test_loss: 0.9373, test_f1: 0.5113
 epoch: 88, train_loss: 0.9193, test_loss: 0.9350, test_f1: 0.5139
 epoch: 89, train_loss: 0.9209, test_loss: 0.9384, test_f1: 0.5159
 epoch: 90, train_loss: 0.9156, test_loss: 0.9329, test_f1: 0.5090
 epoch: 91, train_loss: 0.9153, test_loss: 0.9322, test_f1: 0.5186
 epoch: 92, train_loss: 0.9186, test_loss: 0.9355, test_f1: 0.5174
 epoch: 93, train_loss: 0.9142, test_loss: 0.9354, test_f1: 0.5185
 epoch: 94, train_loss: 0.9245, test_loss: 0.9347, test_f1: 0.5167
 epoch: 95, train_loss: 0.9150, test_loss: 0.9380, test_f1: 0.5144
 epoch: 96, train_loss: 0.9151, test_loss: 0.9409, test_f1: 0.5119
 epoch: 97, train_loss: 0.9085, test_loss: 0.9392, test_f1: 0.5135
 epoch: 98, train_loss: 0.9104, test_loss: 0.9372, test_f1: 0.5145
 epoch: 99, train_loss: 0.9123, test_loss: 0.9404, test_f1: 0.5063
##################ITERATION #9 ****************************************
 epoch: 0, train_loss: 1.4100, test_loss: 1.3754, test_f1: 0.2270
 epoch: 1, train_loss: 1.3319, test_loss: 1.3616, test_f1: 0.2270
 epoch: 2, train_loss: 1.2877, test_loss: 1.3327, test_f1: 0.2270
 epoch: 3, train_loss: 1.2643, test_loss: 1.2728, test_f1: 0.2554
 epoch: 4, train_loss: 1.2499, test_loss: 1.2197, test_f1: 0.3266
 epoch: 5, train_loss: 1.2320, test_loss: 1.1916, test_f1: 0.3433
 epoch: 6, train_loss: 1.2187, test_loss: 1.1754, test_f1: 0.3508
 epoch: 7, train_loss: 1.2071, test_loss: 1.1653, test_f1: 0.3608
 epoch: 8, train_loss: 1.1929, test_loss: 1.1549, test_f1: 0.3600
 epoch: 9, train_loss: 1.1867, test_loss: 1.1451, test_f1: 0.3531
 epoch: 10, train_loss: 1.1754, test_loss: 1.1355, test_f1: 0.3688
 epoch: 11, train_loss: 1.1653, test_loss: 1.1261, test_f1: 0.3912
 epoch: 12, train_loss: 1.1555, test_loss: 1.1151, test_f1: 0.4028
 epoch: 13, train_loss: 1.1546, test_loss: 1.1042, test_f1: 0.4246
 epoch: 14, train_loss: 1.1451, test_loss: 1.0961, test_f1: 0.4266
 epoch: 15, train_loss: 1.1329, test_loss: 1.0871, test_f1: 0.4297
 epoch: 16, train_loss: 1.1250, test_loss: 1.0804, test_f1: 0.4335
 epoch: 17, train_loss: 1.1137, test_loss: 1.0707, test_f1: 0.4401
 epoch: 18, train_loss: 1.1105, test_loss: 1.0634, test_f1: 0.4401
 epoch: 19, train_loss: 1.1046, test_loss: 1.0554, test_f1: 0.4433
 epoch: 20, train_loss: 1.0960, test_loss: 1.0490, test_f1: 0.4470
 epoch: 21, train_loss: 1.0928, test_loss: 1.0418, test_f1: 0.4459
 epoch: 22, train_loss: 1.0781, test_loss: 1.0366, test_f1: 0.4500
 epoch: 23, train_loss: 1.0741, test_loss: 1.0328, test_f1: 0.4523
 epoch: 24, train_loss: 1.0639, test_loss: 1.0276, test_f1: 0.4432
 epoch: 25, train_loss: 1.0643, test_loss: 1.0210, test_f1: 0.4618
 epoch: 26, train_loss: 1.0595, test_loss: 1.0213, test_f1: 0.4477
 epoch: 27, train_loss: 1.0556, test_loss: 1.0150, test_f1: 0.4607
 epoch: 28, train_loss: 1.0535, test_loss: 1.0108, test_f1: 0.4562
 epoch: 29, train_loss: 1.0372, test_loss: 1.0063, test_f1: 0.4693
 epoch: 30, train_loss: 1.0291, test_loss: 1.0030, test_f1: 0.4677
 epoch: 31, train_loss: 1.0281, test_loss: 0.9997, test_f1: 0.4729
 epoch: 32, train_loss: 1.0249, test_loss: 0.9968, test_f1: 0.4567
 epoch: 33, train_loss: 1.0296, test_loss: 0.9927, test_f1: 0.4819
 epoch: 34, train_loss: 1.0150, test_loss: 0.9922, test_f1: 0.4816
 epoch: 35, train_loss: 1.0115, test_loss: 0.9867, test_f1: 0.4877
 epoch: 36, train_loss: 1.0069, test_loss: 0.9862, test_f1: 0.4906
 epoch: 37, train_loss: 1.0065, test_loss: 0.9839, test_f1: 0.4847
 epoch: 38, train_loss: 1.0067, test_loss: 0.9787, test_f1: 0.4837
 epoch: 39, train_loss: 1.0014, test_loss: 0.9800, test_f1: 0.4825
 epoch: 40, train_loss: 0.9977, test_loss: 0.9787, test_f1: 0.4870
 epoch: 41, train_loss: 0.9935, test_loss: 0.9755, test_f1: 0.4755
 epoch: 42, train_loss: 0.9869, test_loss: 0.9727, test_f1: 0.4765
 epoch: 43, train_loss: 0.9902, test_loss: 0.9710, test_f1: 0.4695
 epoch: 44, train_loss: 0.9857, test_loss: 0.9724, test_f1: 0.4814
 epoch: 45, train_loss: 0.9734, test_loss: 0.9691, test_f1: 0.4892
 epoch: 46, train_loss: 0.9862, test_loss: 0.9713, test_f1: 0.4943
 epoch: 47, train_loss: 0.9706, test_loss: 0.9706, test_f1: 0.4957
 epoch: 48, train_loss: 0.9724, test_loss: 0.9678, test_f1: 0.4889
 epoch: 49, train_loss: 0.9708, test_loss: 0.9646, test_f1: 0.4981
 epoch: 50, train_loss: 0.9593, test_loss: 0.9632, test_f1: 0.5016
 epoch: 51, train_loss: 0.9633, test_loss: 0.9635, test_f1: 0.4945
 epoch: 52, train_loss: 0.9637, test_loss: 0.9614, test_f1: 0.4946
 epoch: 53, train_loss: 0.9591, test_loss: 0.9611, test_f1: 0.4992
 epoch: 54, train_loss: 0.9577, test_loss: 0.9604, test_f1: 0.5013
 epoch: 55, train_loss: 0.9552, test_loss: 0.9584, test_f1: 0.4991
 epoch: 56, train_loss: 0.9564, test_loss: 0.9592, test_f1: 0.4923
 epoch: 57, train_loss: 0.9503, test_loss: 0.9568, test_f1: 0.4930
 epoch: 58, train_loss: 0.9509, test_loss: 0.9560, test_f1: 0.5073
 epoch: 59, train_loss: 0.9448, test_loss: 0.9597, test_f1: 0.4878
 epoch: 60, train_loss: 0.9451, test_loss: 0.9557, test_f1: 0.5046
 epoch: 61, train_loss: 0.9448, test_loss: 0.9545, test_f1: 0.5098
 epoch: 62, train_loss: 0.9531, test_loss: 0.9521, test_f1: 0.5138
 epoch: 63, train_loss: 0.9496, test_loss: 0.9509, test_f1: 0.5022
 epoch: 64, train_loss: 0.9438, test_loss: 0.9544, test_f1: 0.4998
 epoch: 65, train_loss: 0.9430, test_loss: 0.9539, test_f1: 0.4985
 epoch: 66, train_loss: 0.9364, test_loss: 0.9556, test_f1: 0.4816
 epoch: 67, train_loss: 0.9427, test_loss: 0.9512, test_f1: 0.5000
 epoch: 68, train_loss: 0.9359, test_loss: 0.9512, test_f1: 0.5042
 epoch: 69, train_loss: 0.9370, test_loss: 0.9509, test_f1: 0.4914
 epoch: 70, train_loss: 0.9373, test_loss: 0.9532, test_f1: 0.4961
 epoch: 71, train_loss: 0.9349, test_loss: 0.9520, test_f1: 0.4999
 epoch: 72, train_loss: 0.9287, test_loss: 0.9509, test_f1: 0.5015
 epoch: 73, train_loss: 0.9353, test_loss: 0.9517, test_f1: 0.5016
 epoch: 74, train_loss: 0.9292, test_loss: 0.9503, test_f1: 0.5026
 epoch: 75, train_loss: 0.9315, test_loss: 0.9490, test_f1: 0.4962
 epoch: 76, train_loss: 0.9332, test_loss: 0.9478, test_f1: 0.5057
 epoch: 77, train_loss: 0.9230, test_loss: 0.9487, test_f1: 0.5039
 epoch: 78, train_loss: 0.9349, test_loss: 0.9465, test_f1: 0.5032
 epoch: 79, train_loss: 0.9223, test_loss: 0.9485, test_f1: 0.5026
 epoch: 80, train_loss: 0.9239, test_loss: 0.9490, test_f1: 0.5011
 epoch: 81, train_loss: 0.9167, test_loss: 0.9477, test_f1: 0.5085
 epoch: 82, train_loss: 0.9237, test_loss: 0.9468, test_f1: 0.4998
 epoch: 83, train_loss: 0.9219, test_loss: 0.9471, test_f1: 0.5001
 epoch: 84, train_loss: 0.9218, test_loss: 0.9437, test_f1: 0.4966
 epoch: 85, train_loss: 0.9232, test_loss: 0.9489, test_f1: 0.5038
 epoch: 86, train_loss: 0.9209, test_loss: 0.9431, test_f1: 0.5049
 epoch: 87, train_loss: 0.9219, test_loss: 0.9428, test_f1: 0.5005
 epoch: 88, train_loss: 0.9185, test_loss: 0.9446, test_f1: 0.5021
 epoch: 89, train_loss: 0.9103, test_loss: 0.9436, test_f1: 0.4987
 epoch: 90, train_loss: 0.9152, test_loss: 0.9457, test_f1: 0.5037
 epoch: 91, train_loss: 0.9122, test_loss: 0.9440, test_f1: 0.5009
 epoch: 92, train_loss: 0.9050, test_loss: 0.9423, test_f1: 0.4992
 epoch: 93, train_loss: 0.9157, test_loss: 0.9436, test_f1: 0.4987
 epoch: 94, train_loss: 0.9054, test_loss: 0.9435, test_f1: 0.5048
 epoch: 95, train_loss: 0.9059, test_loss: 0.9446, test_f1: 0.5007
 epoch: 96, train_loss: 0.9209, test_loss: 0.9436, test_f1: 0.5069
 epoch: 97, train_loss: 0.9048, test_loss: 0.9456, test_f1: 0.5096
 epoch: 98, train_loss: 0.9095, test_loss: 0.9463, test_f1: 0.5011
 epoch: 99, train_loss: 0.9079, test_loss: 0.9433, test_f1: 0.5005

Training completed in 397.89 seconds
Best F1: 0.5204 at epoch 95
Mean F1 across iterations: 0.5098  0.0085
========================FINAL RESULTS================================
FEGIN weighted F1: 0.5204  0.0085
python main.py --data ltspice_examples --representation component_net --model FEGIN --layers 4 --hiddens 32 --batch_size 256 --lr 0.0001 --emb_size 128 --epochs 100 --save_appendix component_net_L4_H32_BS256_LR0.0001_E128 --no_val
-----



STDERR:
  File "main.py", line 370, in <module>
    main()
  File "main.py", line 254, in main
    dataset = dataset_class(
  File "/home/philip/projects/ltspice_examples_code_repo/Circuit-Completion-Using-GNNs/component_classification_with_link_prediction_head/evaluation/FEGIN/kernel/circuit_datasets.py", line 15, in __init__
    self.data, self.slices = torch.load(self.processed_paths[0])
  File "/home/philip/.local/lib/python3.8/site-packages/torch/serialization.py", line 1040, in load
    warnings.warn(
  File "/usr/lib/python3.8/warnings.py", line 109, in _showwarnmsg
    sw(msg.message, msg.category, msg.filename, msg.lineno,
  File "main.py", line 47, in warn_with_traceback
    traceback.print_stack(file=log)
/home/philip/projects/ltspice_examples_code_repo/Circuit-Completion-Using-GNNs/component_classification_with_link_prediction_head/evaluation/FEGIN/kernel/circuit_datasets.py:15: FutureWarning: You are using `torch.load` with `weights_only=False` (the current default value), which uses the default pickle module implicitly. It is possible to construct malicious pickle data which will execute arbitrary code during unpickling (See https://github.com/pytorch/pytorch/blob/main/SECURITY.md#untrusted-models for more details). In a future release, the default value for `weights_only` will be flipped to `True`. This limits the functions that could be executed during unpickling. Arbitrary objects will no longer be allowed to be loaded via this mode unless they are explicitly allowlisted by the user via `torch.serialization.add_safe_globals`. We recommend you start setting `weights_only=True` for any use case where you don't have full control of the loaded file. Please open an issue on GitHub for any issues related to this experimental feature.
  self.data, self.slices = torch.load(self.processed_paths[0])
