STDOUT:
Results will be saved in /home/philip/projects/ltspice_examples_code_repo/Circuit-Completion-Using-GNNs/component_classification_with_link_prediction_head/evaluation/FEGIN/results/model_FEGIN_dataset_ltspice_examples
Command line input: python main.py --data ltspice_examples --representation component_component --model FEGIN --layers 2 --hiddens 128 --batch_size 256 --lr 0.0001 --emb_size 128 --epochs 100 --save_appendix component_component_L2_H128_BS256_LR0.0001_E128 --no_val
 is saved.
-----
ltspice_examples - FEGIN
Using 2 layers, 128 hidden units, h = 2
Loading component_component representation dataset
ENTERED
Training FEGIN on component_component representation
Train: 3556, Test: 845
##################ITERATION #0 ****************************************
 epoch: 0, train_loss: 1.3704, test_loss: 1.3678, test_f1: 0.2274
 epoch: 1, train_loss: 1.3539, test_loss: 1.3580, test_f1: 0.2274
 epoch: 2, train_loss: 1.3434, test_loss: 1.3445, test_f1: 0.2274
 epoch: 3, train_loss: 1.3307, test_loss: 1.3278, test_f1: 0.2274
 epoch: 4, train_loss: 1.3162, test_loss: 1.3092, test_f1: 0.2274
 epoch: 5, train_loss: 1.2989, test_loss: 1.2902, test_f1: 0.2274
 epoch: 6, train_loss: 1.2840, test_loss: 1.2726, test_f1: 0.2274
 epoch: 7, train_loss: 1.2666, test_loss: 1.2556, test_f1: 0.2274
 epoch: 8, train_loss: 1.2508, test_loss: 1.2396, test_f1: 0.2390
 epoch: 9, train_loss: 1.2365, test_loss: 1.2250, test_f1: 0.2578
 epoch: 10, train_loss: 1.2207, test_loss: 1.2111, test_f1: 0.2859
 epoch: 11, train_loss: 1.2074, test_loss: 1.1980, test_f1: 0.3415
 epoch: 12, train_loss: 1.1945, test_loss: 1.1841, test_f1: 0.3513
 epoch: 13, train_loss: 1.1829, test_loss: 1.1728, test_f1: 0.3582
 epoch: 14, train_loss: 1.1688, test_loss: 1.1613, test_f1: 0.3584
 epoch: 15, train_loss: 1.1569, test_loss: 1.1498, test_f1: 0.3721
 epoch: 16, train_loss: 1.1474, test_loss: 1.1421, test_f1: 0.4174
 epoch: 17, train_loss: 1.1323, test_loss: 1.1309, test_f1: 0.4384
 epoch: 18, train_loss: 1.1160, test_loss: 1.1206, test_f1: 0.4374
 epoch: 19, train_loss: 1.1081, test_loss: 1.1122, test_f1: 0.4297
 epoch: 20, train_loss: 1.0983, test_loss: 1.1017, test_f1: 0.4401
 epoch: 21, train_loss: 1.0859, test_loss: 1.0926, test_f1: 0.4568
 epoch: 22, train_loss: 1.0709, test_loss: 1.0858, test_f1: 0.4347
 epoch: 23, train_loss: 1.0600, test_loss: 1.0765, test_f1: 0.4510
 epoch: 24, train_loss: 1.0502, test_loss: 1.0661, test_f1: 0.4500
 epoch: 25, train_loss: 1.0299, test_loss: 1.0590, test_f1: 0.4699
 epoch: 26, train_loss: 1.0282, test_loss: 1.0527, test_f1: 0.4616
 epoch: 27, train_loss: 1.0182, test_loss: 1.0407, test_f1: 0.4589
 epoch: 28, train_loss: 1.0091, test_loss: 1.0336, test_f1: 0.4684
 epoch: 29, train_loss: 0.9967, test_loss: 1.0269, test_f1: 0.4674
 epoch: 30, train_loss: 0.9852, test_loss: 1.0231, test_f1: 0.4768
 epoch: 31, train_loss: 0.9789, test_loss: 1.0147, test_f1: 0.4807
 epoch: 32, train_loss: 0.9681, test_loss: 1.0195, test_f1: 0.4833
 epoch: 33, train_loss: 0.9531, test_loss: 1.0077, test_f1: 0.4746
 epoch: 34, train_loss: 0.9454, test_loss: 1.0072, test_f1: 0.4894
 epoch: 35, train_loss: 0.9387, test_loss: 0.9986, test_f1: 0.4833
 epoch: 36, train_loss: 0.9260, test_loss: 0.9955, test_f1: 0.4918
 epoch: 37, train_loss: 0.9236, test_loss: 0.9921, test_f1: 0.4887
 epoch: 38, train_loss: 0.9108, test_loss: 0.9928, test_f1: 0.4818
 epoch: 39, train_loss: 0.9084, test_loss: 0.9829, test_f1: 0.4860
 epoch: 40, train_loss: 0.9006, test_loss: 0.9998, test_f1: 0.4857
 epoch: 41, train_loss: 0.8925, test_loss: 0.9877, test_f1: 0.4923
 epoch: 42, train_loss: 0.8822, test_loss: 0.9876, test_f1: 0.4849
 epoch: 43, train_loss: 0.8746, test_loss: 0.9796, test_f1: 0.4964
 epoch: 44, train_loss: 0.8645, test_loss: 1.0093, test_f1: 0.4814
 epoch: 45, train_loss: 0.8561, test_loss: 0.9902, test_f1: 0.4921
 epoch: 46, train_loss: 0.8536, test_loss: 0.9904, test_f1: 0.5147
 epoch: 47, train_loss: 0.8407, test_loss: 0.9896, test_f1: 0.4985
 epoch: 48, train_loss: 0.8316, test_loss: 0.9886, test_f1: 0.4941
 epoch: 49, train_loss: 0.8222, test_loss: 0.9972, test_f1: 0.4950
 epoch: 50, train_loss: 0.8249, test_loss: 1.0019, test_f1: 0.5047
 epoch: 51, train_loss: 0.8195, test_loss: 0.9988, test_f1: 0.5097
 epoch: 52, train_loss: 0.8052, test_loss: 1.0104, test_f1: 0.4987
 epoch: 53, train_loss: 0.8046, test_loss: 1.0079, test_f1: 0.4989
 epoch: 54, train_loss: 0.7963, test_loss: 1.0153, test_f1: 0.4965
 epoch: 55, train_loss: 0.7948, test_loss: 1.0150, test_f1: 0.4915
 epoch: 56, train_loss: 0.7902, test_loss: 1.0133, test_f1: 0.5117
 epoch: 57, train_loss: 0.7872, test_loss: 1.0310, test_f1: 0.5000
 epoch: 58, train_loss: 0.7838, test_loss: 1.0219, test_f1: 0.5072
 epoch: 59, train_loss: 0.7783, test_loss: 1.0204, test_f1: 0.4995
 epoch: 60, train_loss: 0.7784, test_loss: 1.0415, test_f1: 0.5131
 epoch: 61, train_loss: 0.7693, test_loss: 1.0304, test_f1: 0.4921
 epoch: 62, train_loss: 0.7711, test_loss: 1.0317, test_f1: 0.5183
 epoch: 63, train_loss: 0.7640, test_loss: 1.0237, test_f1: 0.5116
 epoch: 64, train_loss: 0.7639, test_loss: 1.0270, test_f1: 0.5141
 epoch: 65, train_loss: 0.7564, test_loss: 1.0367, test_f1: 0.5141
 epoch: 66, train_loss: 0.7567, test_loss: 1.0405, test_f1: 0.5055
 epoch: 67, train_loss: 0.7531, test_loss: 1.0450, test_f1: 0.5075
 epoch: 68, train_loss: 0.7528, test_loss: 1.0394, test_f1: 0.5047
 epoch: 69, train_loss: 0.7410, test_loss: 1.0450, test_f1: 0.5007
 epoch: 70, train_loss: 0.7453, test_loss: 1.0486, test_f1: 0.5106
 epoch: 71, train_loss: 0.7357, test_loss: 1.0461, test_f1: 0.5211
 epoch: 72, train_loss: 0.7410, test_loss: 1.0487, test_f1: 0.5079
 epoch: 73, train_loss: 0.7348, test_loss: 1.0559, test_f1: 0.5116
 epoch: 74, train_loss: 0.7292, test_loss: 1.0560, test_f1: 0.5160
 epoch: 75, train_loss: 0.7312, test_loss: 1.0681, test_f1: 0.5066
 epoch: 76, train_loss: 0.7231, test_loss: 1.0701, test_f1: 0.4999
 epoch: 77, train_loss: 0.7337, test_loss: 1.0682, test_f1: 0.5141
 epoch: 78, train_loss: 0.7260, test_loss: 1.0794, test_f1: 0.5058
 epoch: 79, train_loss: 0.7237, test_loss: 1.0718, test_f1: 0.5024
 epoch: 80, train_loss: 0.7167, test_loss: 1.0892, test_f1: 0.5079
 epoch: 81, train_loss: 0.7102, test_loss: 1.0865, test_f1: 0.5050
 epoch: 82, train_loss: 0.7053, test_loss: 1.0970, test_f1: 0.4933
 epoch: 83, train_loss: 0.7030, test_loss: 1.0908, test_f1: 0.5119
 epoch: 84, train_loss: 0.7011, test_loss: 1.0930, test_f1: 0.5099
 epoch: 85, train_loss: 0.7047, test_loss: 1.0844, test_f1: 0.5094
 epoch: 86, train_loss: 0.6942, test_loss: 1.0933, test_f1: 0.5071
 epoch: 87, train_loss: 0.7099, test_loss: 1.1107, test_f1: 0.5077
 epoch: 88, train_loss: 0.6887, test_loss: 1.0987, test_f1: 0.5107
 epoch: 89, train_loss: 0.6876, test_loss: 1.1196, test_f1: 0.5123
 epoch: 90, train_loss: 0.6859, test_loss: 1.1150, test_f1: 0.5094
 epoch: 91, train_loss: 0.6836, test_loss: 1.1200, test_f1: 0.5102
 epoch: 92, train_loss: 0.6800, test_loss: 1.1322, test_f1: 0.5131
 epoch: 93, train_loss: 0.6740, test_loss: 1.1071, test_f1: 0.5111
 epoch: 94, train_loss: 0.6740, test_loss: 1.1162, test_f1: 0.5116
 epoch: 95, train_loss: 0.6735, test_loss: 1.1243, test_f1: 0.5206
 epoch: 96, train_loss: 0.6655, test_loss: 1.1319, test_f1: 0.5183
 epoch: 97, train_loss: 0.6694, test_loss: 1.1425, test_f1: 0.5113
 epoch: 98, train_loss: 0.6709, test_loss: 1.1554, test_f1: 0.5048
 epoch: 99, train_loss: 0.6640, test_loss: 1.1376, test_f1: 0.5147
##################ITERATION #1 ****************************************
 epoch: 0, train_loss: 1.3349, test_loss: 1.3361, test_f1: 0.2274
 epoch: 1, train_loss: 1.2923, test_loss: 1.3050, test_f1: 0.2533
 epoch: 2, train_loss: 1.2715, test_loss: 1.2735, test_f1: 0.2603
 epoch: 3, train_loss: 1.2521, test_loss: 1.2411, test_f1: 0.2728
 epoch: 4, train_loss: 1.2353, test_loss: 1.2145, test_f1: 0.3126
 epoch: 5, train_loss: 1.2172, test_loss: 1.1921, test_f1: 0.3343
 epoch: 6, train_loss: 1.2071, test_loss: 1.1741, test_f1: 0.3681
 epoch: 7, train_loss: 1.1900, test_loss: 1.1589, test_f1: 0.4052
 epoch: 8, train_loss: 1.1728, test_loss: 1.1447, test_f1: 0.4222
 epoch: 9, train_loss: 1.1657, test_loss: 1.1321, test_f1: 0.4329
 epoch: 10, train_loss: 1.1510, test_loss: 1.1178, test_f1: 0.4442
 epoch: 11, train_loss: 1.1377, test_loss: 1.1053, test_f1: 0.4439
 epoch: 12, train_loss: 1.1239, test_loss: 1.0946, test_f1: 0.4535
 epoch: 13, train_loss: 1.1120, test_loss: 1.0799, test_f1: 0.4490
 epoch: 14, train_loss: 1.0994, test_loss: 1.0677, test_f1: 0.4344
 epoch: 15, train_loss: 1.0930, test_loss: 1.0581, test_f1: 0.4470
 epoch: 16, train_loss: 1.0760, test_loss: 1.0477, test_f1: 0.4456
 epoch: 17, train_loss: 1.0668, test_loss: 1.0369, test_f1: 0.4497
 epoch: 18, train_loss: 1.0540, test_loss: 1.0268, test_f1: 0.4506
 epoch: 19, train_loss: 1.0469, test_loss: 1.0185, test_f1: 0.4463
 epoch: 20, train_loss: 1.0413, test_loss: 1.0085, test_f1: 0.4561
 epoch: 21, train_loss: 1.0324, test_loss: 1.0030, test_f1: 0.4669
 epoch: 22, train_loss: 1.0246, test_loss: 0.9962, test_f1: 0.4805
 epoch: 23, train_loss: 1.0079, test_loss: 0.9858, test_f1: 0.4602
 epoch: 24, train_loss: 1.0046, test_loss: 0.9829, test_f1: 0.4866
 epoch: 25, train_loss: 0.9859, test_loss: 0.9762, test_f1: 0.4782
 epoch: 26, train_loss: 0.9831, test_loss: 0.9735, test_f1: 0.4929
 epoch: 27, train_loss: 0.9793, test_loss: 0.9639, test_f1: 0.5009
 epoch: 28, train_loss: 0.9665, test_loss: 0.9611, test_f1: 0.4915
 epoch: 29, train_loss: 0.9561, test_loss: 0.9511, test_f1: 0.4915
 epoch: 30, train_loss: 0.9588, test_loss: 0.9571, test_f1: 0.4796
 epoch: 31, train_loss: 0.9420, test_loss: 0.9498, test_f1: 0.4854
 epoch: 32, train_loss: 0.9392, test_loss: 0.9491, test_f1: 0.4885
 epoch: 33, train_loss: 0.9300, test_loss: 0.9459, test_f1: 0.4806
 epoch: 34, train_loss: 0.9273, test_loss: 0.9432, test_f1: 0.5036
 epoch: 35, train_loss: 0.9126, test_loss: 0.9453, test_f1: 0.4897
 epoch: 36, train_loss: 0.9090, test_loss: 0.9364, test_f1: 0.4816
 epoch: 37, train_loss: 0.9020, test_loss: 0.9409, test_f1: 0.4833
 epoch: 38, train_loss: 0.8996, test_loss: 0.9339, test_f1: 0.5091
 epoch: 39, train_loss: 0.8912, test_loss: 0.9542, test_f1: 0.4969
 epoch: 40, train_loss: 0.8834, test_loss: 0.9455, test_f1: 0.5123
 epoch: 41, train_loss: 0.8831, test_loss: 0.9410, test_f1: 0.5192
 epoch: 42, train_loss: 0.8743, test_loss: 0.9470, test_f1: 0.5037
 epoch: 43, train_loss: 0.8619, test_loss: 0.9500, test_f1: 0.5044
 epoch: 44, train_loss: 0.8615, test_loss: 0.9485, test_f1: 0.5265
 epoch: 45, train_loss: 0.8532, test_loss: 0.9504, test_f1: 0.5105
 epoch: 46, train_loss: 0.8502, test_loss: 0.9334, test_f1: 0.5240
 epoch: 47, train_loss: 0.8471, test_loss: 0.9506, test_f1: 0.5300
 epoch: 48, train_loss: 0.8341, test_loss: 0.9490, test_f1: 0.5116
 epoch: 49, train_loss: 0.8284, test_loss: 0.9384, test_f1: 0.5114
 epoch: 50, train_loss: 0.8223, test_loss: 0.9504, test_f1: 0.5174
 epoch: 51, train_loss: 0.8221, test_loss: 0.9517, test_f1: 0.5163
 epoch: 52, train_loss: 0.8111, test_loss: 0.9635, test_f1: 0.5181
 epoch: 53, train_loss: 0.8134, test_loss: 0.9652, test_f1: 0.5258
 epoch: 54, train_loss: 0.8084, test_loss: 0.9534, test_f1: 0.5219
 epoch: 55, train_loss: 0.8041, test_loss: 0.9510, test_f1: 0.5254
 epoch: 56, train_loss: 0.7989, test_loss: 0.9560, test_f1: 0.5267
 epoch: 57, train_loss: 0.8003, test_loss: 0.9545, test_f1: 0.5221
 epoch: 58, train_loss: 0.8062, test_loss: 0.9587, test_f1: 0.5231
 epoch: 59, train_loss: 0.7966, test_loss: 0.9607, test_f1: 0.5275
 epoch: 60, train_loss: 0.7971, test_loss: 0.9515, test_f1: 0.5379
 epoch: 61, train_loss: 0.7855, test_loss: 0.9511, test_f1: 0.5221
 epoch: 62, train_loss: 0.7886, test_loss: 0.9564, test_f1: 0.5271
 epoch: 63, train_loss: 0.7809, test_loss: 0.9559, test_f1: 0.5292
 epoch: 64, train_loss: 0.7818, test_loss: 0.9544, test_f1: 0.5274
 epoch: 65, train_loss: 0.7706, test_loss: 0.9651, test_f1: 0.5189
 epoch: 66, train_loss: 0.7849, test_loss: 0.9630, test_f1: 0.5291
 epoch: 67, train_loss: 0.7716, test_loss: 0.9576, test_f1: 0.5282
 epoch: 68, train_loss: 0.7756, test_loss: 0.9649, test_f1: 0.5122
 epoch: 69, train_loss: 0.7644, test_loss: 0.9723, test_f1: 0.5276
 epoch: 70, train_loss: 0.7726, test_loss: 0.9747, test_f1: 0.5318
 epoch: 71, train_loss: 0.7591, test_loss: 0.9838, test_f1: 0.5261
 epoch: 72, train_loss: 0.7558, test_loss: 0.9744, test_f1: 0.5210
 epoch: 73, train_loss: 0.7485, test_loss: 0.9677, test_f1: 0.5214
 epoch: 74, train_loss: 0.7532, test_loss: 0.9752, test_f1: 0.5304
 epoch: 75, train_loss: 0.7573, test_loss: 0.9771, test_f1: 0.5261
 epoch: 76, train_loss: 0.7415, test_loss: 0.9759, test_f1: 0.5194
 epoch: 77, train_loss: 0.7499, test_loss: 0.9600, test_f1: 0.5230
 epoch: 78, train_loss: 0.7450, test_loss: 0.9660, test_f1: 0.5237
 epoch: 79, train_loss: 0.7510, test_loss: 0.9802, test_f1: 0.5199
 epoch: 80, train_loss: 0.7435, test_loss: 0.9831, test_f1: 0.5271
 epoch: 81, train_loss: 0.7416, test_loss: 0.9707, test_f1: 0.5198
 epoch: 82, train_loss: 0.7273, test_loss: 0.9823, test_f1: 0.5207
 epoch: 83, train_loss: 0.7359, test_loss: 0.9836, test_f1: 0.5156
 epoch: 84, train_loss: 0.7362, test_loss: 0.9798, test_f1: 0.5306
 epoch: 85, train_loss: 0.7326, test_loss: 0.9872, test_f1: 0.5218
 epoch: 86, train_loss: 0.7266, test_loss: 0.9849, test_f1: 0.5102
 epoch: 87, train_loss: 0.7298, test_loss: 0.9956, test_f1: 0.5250
 epoch: 88, train_loss: 0.7317, test_loss: 0.9744, test_f1: 0.5299
 epoch: 89, train_loss: 0.7115, test_loss: 0.9940, test_f1: 0.5278
 epoch: 90, train_loss: 0.7254, test_loss: 0.9899, test_f1: 0.5239
 epoch: 91, train_loss: 0.7250, test_loss: 0.9979, test_f1: 0.5203
 epoch: 92, train_loss: 0.7136, test_loss: 0.9993, test_f1: 0.5218
 epoch: 93, train_loss: 0.7182, test_loss: 1.0045, test_f1: 0.5317
 epoch: 94, train_loss: 0.7089, test_loss: 0.9966, test_f1: 0.5260
 epoch: 95, train_loss: 0.7126, test_loss: 0.9972, test_f1: 0.5268
 epoch: 96, train_loss: 0.7077, test_loss: 1.0062, test_f1: 0.5283
 epoch: 97, train_loss: 0.6982, test_loss: 1.0164, test_f1: 0.5392
 epoch: 98, train_loss: 0.6967, test_loss: 1.0087, test_f1: 0.5332
 epoch: 99, train_loss: 0.6986, test_loss: 1.0020, test_f1: 0.5313
##################ITERATION #2 ****************************************
 epoch: 0, train_loss: 1.3050, test_loss: 1.3055, test_f1: 0.2274
 epoch: 1, train_loss: 1.2370, test_loss: 1.2740, test_f1: 0.2390
 epoch: 2, train_loss: 1.2184, test_loss: 1.2284, test_f1: 0.2816
 epoch: 3, train_loss: 1.1942, test_loss: 1.1885, test_f1: 0.3775
 epoch: 4, train_loss: 1.1751, test_loss: 1.1581, test_f1: 0.4146
 epoch: 5, train_loss: 1.1573, test_loss: 1.1401, test_f1: 0.4437
 epoch: 6, train_loss: 1.1443, test_loss: 1.1235, test_f1: 0.4667
 epoch: 7, train_loss: 1.1273, test_loss: 1.1068, test_f1: 0.4356
 epoch: 8, train_loss: 1.1148, test_loss: 1.0923, test_f1: 0.4712
 epoch: 9, train_loss: 1.0989, test_loss: 1.0785, test_f1: 0.4745
 epoch: 10, train_loss: 1.0896, test_loss: 1.0701, test_f1: 0.4671
 epoch: 11, train_loss: 1.0743, test_loss: 1.0583, test_f1: 0.4733
 epoch: 12, train_loss: 1.0710, test_loss: 1.0532, test_f1: 0.4542
 epoch: 13, train_loss: 1.0580, test_loss: 1.0488, test_f1: 0.4602
 epoch: 14, train_loss: 1.0512, test_loss: 1.0350, test_f1: 0.4699
 epoch: 15, train_loss: 1.0420, test_loss: 1.0279, test_f1: 0.4669
 epoch: 16, train_loss: 1.0410, test_loss: 1.0241, test_f1: 0.4739
 epoch: 17, train_loss: 1.0228, test_loss: 1.0156, test_f1: 0.4739
 epoch: 18, train_loss: 1.0256, test_loss: 1.0137, test_f1: 0.4759
 epoch: 19, train_loss: 1.0136, test_loss: 1.0113, test_f1: 0.4765
 epoch: 20, train_loss: 1.0069, test_loss: 1.0002, test_f1: 0.4898
 epoch: 21, train_loss: 0.9954, test_loss: 1.0068, test_f1: 0.4796
 epoch: 22, train_loss: 0.9906, test_loss: 0.9984, test_f1: 0.4870
 epoch: 23, train_loss: 0.9812, test_loss: 0.9889, test_f1: 0.4919
 epoch: 24, train_loss: 0.9808, test_loss: 0.9878, test_f1: 0.4974
 epoch: 25, train_loss: 0.9709, test_loss: 0.9806, test_f1: 0.5009
 epoch: 26, train_loss: 0.9595, test_loss: 0.9850, test_f1: 0.4948
 epoch: 27, train_loss: 0.9562, test_loss: 0.9843, test_f1: 0.4953
 epoch: 28, train_loss: 0.9529, test_loss: 0.9751, test_f1: 0.5097
 epoch: 29, train_loss: 0.9431, test_loss: 0.9855, test_f1: 0.4900
 epoch: 30, train_loss: 0.9382, test_loss: 0.9698, test_f1: 0.4977
 epoch: 31, train_loss: 0.9281, test_loss: 0.9738, test_f1: 0.4924
 epoch: 32, train_loss: 0.9297, test_loss: 0.9808, test_f1: 0.4866
 epoch: 33, train_loss: 0.9169, test_loss: 0.9595, test_f1: 0.5013
 epoch: 34, train_loss: 0.9046, test_loss: 0.9813, test_f1: 0.4887
 epoch: 35, train_loss: 0.9109, test_loss: 0.9552, test_f1: 0.5124
 epoch: 36, train_loss: 0.9028, test_loss: 0.9788, test_f1: 0.4934
 epoch: 37, train_loss: 0.9081, test_loss: 0.9626, test_f1: 0.5070
 epoch: 38, train_loss: 0.8964, test_loss: 0.9548, test_f1: 0.4940
 epoch: 39, train_loss: 0.8869, test_loss: 0.9743, test_f1: 0.4937
 epoch: 40, train_loss: 0.8851, test_loss: 0.9628, test_f1: 0.5063
 epoch: 41, train_loss: 0.8785, test_loss: 0.9665, test_f1: 0.4976
 epoch: 42, train_loss: 0.8718, test_loss: 0.9636, test_f1: 0.4949
 epoch: 43, train_loss: 0.8625, test_loss: 0.9636, test_f1: 0.4956
 epoch: 44, train_loss: 0.8602, test_loss: 0.9594, test_f1: 0.5035
 epoch: 45, train_loss: 0.8479, test_loss: 0.9579, test_f1: 0.4961
 epoch: 46, train_loss: 0.8603, test_loss: 0.9816, test_f1: 0.4943
 epoch: 47, train_loss: 0.8447, test_loss: 0.9749, test_f1: 0.5078
 epoch: 48, train_loss: 0.8420, test_loss: 0.9618, test_f1: 0.4997
 epoch: 49, train_loss: 0.8278, test_loss: 0.9702, test_f1: 0.5034
 epoch: 50, train_loss: 0.8289, test_loss: 0.9689, test_f1: 0.4923
 epoch: 51, train_loss: 0.8319, test_loss: 0.9730, test_f1: 0.5060
 epoch: 52, train_loss: 0.8183, test_loss: 0.9780, test_f1: 0.5055
 epoch: 53, train_loss: 0.8171, test_loss: 0.9763, test_f1: 0.5072
 epoch: 54, train_loss: 0.8108, test_loss: 0.9766, test_f1: 0.5039
 epoch: 55, train_loss: 0.8051, test_loss: 0.9889, test_f1: 0.4952
 epoch: 56, train_loss: 0.8127, test_loss: 0.9798, test_f1: 0.5020
 epoch: 57, train_loss: 0.8012, test_loss: 0.9804, test_f1: 0.5057
 epoch: 58, train_loss: 0.8016, test_loss: 0.9828, test_f1: 0.5121
 epoch: 59, train_loss: 0.7968, test_loss: 0.9890, test_f1: 0.5065
 epoch: 60, train_loss: 0.7948, test_loss: 0.9929, test_f1: 0.4909
 epoch: 61, train_loss: 0.7938, test_loss: 0.9927, test_f1: 0.5109
 epoch: 62, train_loss: 0.7899, test_loss: 1.0049, test_f1: 0.4969
 epoch: 63, train_loss: 0.7875, test_loss: 0.9876, test_f1: 0.5062
 epoch: 64, train_loss: 0.7899, test_loss: 1.0036, test_f1: 0.5007
 epoch: 65, train_loss: 0.7857, test_loss: 0.9976, test_f1: 0.5011
 epoch: 66, train_loss: 0.7887, test_loss: 1.0007, test_f1: 0.5091
 epoch: 67, train_loss: 0.7870, test_loss: 1.0011, test_f1: 0.5068
 epoch: 68, train_loss: 0.7772, test_loss: 0.9957, test_f1: 0.5006
 epoch: 69, train_loss: 0.7732, test_loss: 0.9949, test_f1: 0.5157
 epoch: 70, train_loss: 0.7773, test_loss: 0.9993, test_f1: 0.5113
 epoch: 71, train_loss: 0.7701, test_loss: 1.0126, test_f1: 0.5059
 epoch: 72, train_loss: 0.7581, test_loss: 1.0054, test_f1: 0.5021
 epoch: 73, train_loss: 0.7666, test_loss: 1.0306, test_f1: 0.4763
 epoch: 74, train_loss: 0.7657, test_loss: 1.0108, test_f1: 0.4881
 epoch: 75, train_loss: 0.7587, test_loss: 1.0202, test_f1: 0.5004
 epoch: 76, train_loss: 0.7514, test_loss: 1.0232, test_f1: 0.5075
 epoch: 77, train_loss: 0.7572, test_loss: 1.0189, test_f1: 0.5141
 epoch: 78, train_loss: 0.7517, test_loss: 1.0211, test_f1: 0.4912
 epoch: 79, train_loss: 0.7509, test_loss: 1.0198, test_f1: 0.5125
 epoch: 80, train_loss: 0.7410, test_loss: 1.0281, test_f1: 0.5011
 epoch: 81, train_loss: 0.7475, test_loss: 1.0292, test_f1: 0.5044
 epoch: 82, train_loss: 0.7469, test_loss: 1.0216, test_f1: 0.4908
 epoch: 83, train_loss: 0.7394, test_loss: 1.0323, test_f1: 0.4731
 epoch: 84, train_loss: 0.7376, test_loss: 1.0413, test_f1: 0.4741
 epoch: 85, train_loss: 0.7275, test_loss: 1.0333, test_f1: 0.4954
 epoch: 86, train_loss: 0.7369, test_loss: 1.0487, test_f1: 0.4859
 epoch: 87, train_loss: 0.7306, test_loss: 1.0500, test_f1: 0.4783
 epoch: 88, train_loss: 0.7315, test_loss: 1.0422, test_f1: 0.4972
 epoch: 89, train_loss: 0.7218, test_loss: 1.0534, test_f1: 0.4801
 epoch: 90, train_loss: 0.7223, test_loss: 1.0562, test_f1: 0.4807
 epoch: 91, train_loss: 0.7288, test_loss: 1.0543, test_f1: 0.4812
 epoch: 92, train_loss: 0.7312, test_loss: 1.0606, test_f1: 0.4809
 epoch: 93, train_loss: 0.7089, test_loss: 1.0479, test_f1: 0.4850
 epoch: 94, train_loss: 0.7164, test_loss: 1.0555, test_f1: 0.4763
 epoch: 95, train_loss: 0.7099, test_loss: 1.0745, test_f1: 0.4966
 epoch: 96, train_loss: 0.7141, test_loss: 1.0665, test_f1: 0.5079
 epoch: 97, train_loss: 0.7192, test_loss: 1.0688, test_f1: 0.4905
 epoch: 98, train_loss: 0.7148, test_loss: 1.0599, test_f1: 0.5002
 epoch: 99, train_loss: 0.7094, test_loss: 1.0905, test_f1: 0.4806
##################ITERATION #3 ****************************************
 epoch: 0, train_loss: 1.3264, test_loss: 1.3013, test_f1: 0.2274
 epoch: 1, train_loss: 1.2419, test_loss: 1.2575, test_f1: 0.2838
 epoch: 2, train_loss: 1.2129, test_loss: 1.2054, test_f1: 0.3500
 epoch: 3, train_loss: 1.1862, test_loss: 1.1660, test_f1: 0.4178
 epoch: 4, train_loss: 1.1721, test_loss: 1.1411, test_f1: 0.4426
 epoch: 5, train_loss: 1.1499, test_loss: 1.1265, test_f1: 0.4518
 epoch: 6, train_loss: 1.1367, test_loss: 1.1152, test_f1: 0.4602
 epoch: 7, train_loss: 1.1267, test_loss: 1.1041, test_f1: 0.4562
 epoch: 8, train_loss: 1.1066, test_loss: 1.0970, test_f1: 0.4611
 epoch: 9, train_loss: 1.1066, test_loss: 1.0947, test_f1: 0.4600
 epoch: 10, train_loss: 1.0834, test_loss: 1.0816, test_f1: 0.4582
 epoch: 11, train_loss: 1.0799, test_loss: 1.0719, test_f1: 0.4626
 epoch: 12, train_loss: 1.0753, test_loss: 1.0638, test_f1: 0.4572
 epoch: 13, train_loss: 1.0604, test_loss: 1.0603, test_f1: 0.4592
 epoch: 14, train_loss: 1.0468, test_loss: 1.0533, test_f1: 0.4610
 epoch: 15, train_loss: 1.0434, test_loss: 1.0429, test_f1: 0.4667
 epoch: 16, train_loss: 1.0288, test_loss: 1.0345, test_f1: 0.4642
 epoch: 17, train_loss: 1.0163, test_loss: 1.0282, test_f1: 0.4666
 epoch: 18, train_loss: 1.0158, test_loss: 1.0196, test_f1: 0.4726
 epoch: 19, train_loss: 1.0087, test_loss: 1.0113, test_f1: 0.4698
 epoch: 20, train_loss: 0.9933, test_loss: 1.0044, test_f1: 0.4887
 epoch: 21, train_loss: 0.9890, test_loss: 1.0038, test_f1: 0.4674
 epoch: 22, train_loss: 0.9876, test_loss: 0.9958, test_f1: 0.4687
 epoch: 23, train_loss: 0.9723, test_loss: 0.9969, test_f1: 0.4801
 epoch: 24, train_loss: 0.9740, test_loss: 0.9902, test_f1: 0.4847
 epoch: 25, train_loss: 0.9600, test_loss: 0.9814, test_f1: 0.4912
 epoch: 26, train_loss: 0.9555, test_loss: 0.9826, test_f1: 0.4892
 epoch: 27, train_loss: 0.9418, test_loss: 0.9763, test_f1: 0.4978
 epoch: 28, train_loss: 0.9339, test_loss: 0.9810, test_f1: 0.4900
 epoch: 29, train_loss: 0.9257, test_loss: 0.9758, test_f1: 0.5027
 epoch: 30, train_loss: 0.9254, test_loss: 0.9749, test_f1: 0.4986
 epoch: 31, train_loss: 0.9235, test_loss: 0.9686, test_f1: 0.5078
 epoch: 32, train_loss: 0.9108, test_loss: 0.9695, test_f1: 0.5052
 epoch: 33, train_loss: 0.9078, test_loss: 0.9601, test_f1: 0.5031
 epoch: 34, train_loss: 0.9008, test_loss: 0.9713, test_f1: 0.5087
 epoch: 35, train_loss: 0.8943, test_loss: 0.9704, test_f1: 0.5079
 epoch: 36, train_loss: 0.8890, test_loss: 0.9670, test_f1: 0.5139
 epoch: 37, train_loss: 0.8847, test_loss: 0.9722, test_f1: 0.5068
 epoch: 38, train_loss: 0.8770, test_loss: 0.9755, test_f1: 0.5147
 epoch: 39, train_loss: 0.8692, test_loss: 0.9748, test_f1: 0.5123
 epoch: 40, train_loss: 0.8575, test_loss: 0.9706, test_f1: 0.5108
 epoch: 41, train_loss: 0.8576, test_loss: 0.9924, test_f1: 0.5087
 epoch: 42, train_loss: 0.8491, test_loss: 0.9975, test_f1: 0.5162
 epoch: 43, train_loss: 0.8508, test_loss: 0.9800, test_f1: 0.5153
 epoch: 44, train_loss: 0.8462, test_loss: 0.9774, test_f1: 0.4998
 epoch: 45, train_loss: 0.8434, test_loss: 1.0027, test_f1: 0.5050
 epoch: 46, train_loss: 0.8329, test_loss: 0.9934, test_f1: 0.5068
 epoch: 47, train_loss: 0.8315, test_loss: 1.0022, test_f1: 0.5117
 epoch: 48, train_loss: 0.8205, test_loss: 0.9990, test_f1: 0.5081
 epoch: 49, train_loss: 0.8212, test_loss: 1.0055, test_f1: 0.5252
 epoch: 50, train_loss: 0.8209, test_loss: 1.0053, test_f1: 0.5160
 epoch: 51, train_loss: 0.8070, test_loss: 0.9989, test_f1: 0.5051
 epoch: 52, train_loss: 0.8030, test_loss: 1.0057, test_f1: 0.5104
 epoch: 53, train_loss: 0.7953, test_loss: 1.0091, test_f1: 0.5139
 epoch: 54, train_loss: 0.7985, test_loss: 0.9990, test_f1: 0.5204
 epoch: 55, train_loss: 0.8007, test_loss: 1.0021, test_f1: 0.5199
 epoch: 56, train_loss: 0.7921, test_loss: 1.0050, test_f1: 0.5270
 epoch: 57, train_loss: 0.7903, test_loss: 1.0078, test_f1: 0.5298
 epoch: 58, train_loss: 0.7825, test_loss: 1.0108, test_f1: 0.5201
 epoch: 59, train_loss: 0.7806, test_loss: 1.0238, test_f1: 0.5254
 epoch: 60, train_loss: 0.7828, test_loss: 1.0299, test_f1: 0.5332
 epoch: 61, train_loss: 0.7776, test_loss: 1.0144, test_f1: 0.5343
 epoch: 62, train_loss: 0.7826, test_loss: 1.0199, test_f1: 0.5298
 epoch: 63, train_loss: 0.7733, test_loss: 1.0214, test_f1: 0.5269
 epoch: 64, train_loss: 0.7739, test_loss: 1.0367, test_f1: 0.5297
 epoch: 65, train_loss: 0.7642, test_loss: 1.0276, test_f1: 0.5311
 epoch: 66, train_loss: 0.7720, test_loss: 1.0280, test_f1: 0.5402
 epoch: 67, train_loss: 0.7706, test_loss: 1.0300, test_f1: 0.5256
 epoch: 68, train_loss: 0.7630, test_loss: 1.0254, test_f1: 0.5341
 epoch: 69, train_loss: 0.7636, test_loss: 1.0440, test_f1: 0.5358
 epoch: 70, train_loss: 0.7540, test_loss: 1.0566, test_f1: 0.5328
 epoch: 71, train_loss: 0.7598, test_loss: 1.0541, test_f1: 0.5337
 epoch: 72, train_loss: 0.7442, test_loss: 1.0536, test_f1: 0.5437
 epoch: 73, train_loss: 0.7477, test_loss: 1.0552, test_f1: 0.5364
 epoch: 74, train_loss: 0.7524, test_loss: 1.0526, test_f1: 0.5351
 epoch: 75, train_loss: 0.7530, test_loss: 1.0628, test_f1: 0.5424
 epoch: 76, train_loss: 0.7463, test_loss: 1.0623, test_f1: 0.5405
 epoch: 77, train_loss: 0.7448, test_loss: 1.0525, test_f1: 0.5379
 epoch: 78, train_loss: 0.7418, test_loss: 1.0603, test_f1: 0.5404
 epoch: 79, train_loss: 0.7419, test_loss: 1.0524, test_f1: 0.5366
 epoch: 80, train_loss: 0.7410, test_loss: 1.0598, test_f1: 0.5383
 epoch: 81, train_loss: 0.7361, test_loss: 1.0625, test_f1: 0.5412
 epoch: 82, train_loss: 0.7399, test_loss: 1.0733, test_f1: 0.5338
 epoch: 83, train_loss: 0.7373, test_loss: 1.0630, test_f1: 0.5364
 epoch: 84, train_loss: 0.7291, test_loss: 1.0811, test_f1: 0.5375
 epoch: 85, train_loss: 0.7287, test_loss: 1.0793, test_f1: 0.5316
 epoch: 86, train_loss: 0.7262, test_loss: 1.0765, test_f1: 0.5404
 epoch: 87, train_loss: 0.7271, test_loss: 1.0767, test_f1: 0.5429
 epoch: 88, train_loss: 0.7115, test_loss: 1.0870, test_f1: 0.5461
 epoch: 89, train_loss: 0.7326, test_loss: 1.0852, test_f1: 0.5377
 epoch: 90, train_loss: 0.7148, test_loss: 1.0895, test_f1: 0.5441
 epoch: 91, train_loss: 0.7170, test_loss: 1.0930, test_f1: 0.5386
 epoch: 92, train_loss: 0.7240, test_loss: 1.1056, test_f1: 0.5477
 epoch: 93, train_loss: 0.7057, test_loss: 1.1096, test_f1: 0.5407
 epoch: 94, train_loss: 0.7069, test_loss: 1.1140, test_f1: 0.5408
 epoch: 95, train_loss: 0.7034, test_loss: 1.0937, test_f1: 0.5533
 epoch: 96, train_loss: 0.6994, test_loss: 1.1045, test_f1: 0.5458
 epoch: 97, train_loss: 0.7032, test_loss: 1.1037, test_f1: 0.5418
 epoch: 98, train_loss: 0.7075, test_loss: 1.1203, test_f1: 0.5474
 epoch: 99, train_loss: 0.7014, test_loss: 1.1190, test_f1: 0.5449
##################ITERATION #4 ****************************************
 epoch: 0, train_loss: 1.3313, test_loss: 1.2908, test_f1: 0.2294
 epoch: 1, train_loss: 1.2420, test_loss: 1.2549, test_f1: 0.3147
 epoch: 2, train_loss: 1.2064, test_loss: 1.2164, test_f1: 0.3987
 epoch: 3, train_loss: 1.1894, test_loss: 1.1744, test_f1: 0.4356
 epoch: 4, train_loss: 1.1650, test_loss: 1.1380, test_f1: 0.4537
 epoch: 5, train_loss: 1.1468, test_loss: 1.1182, test_f1: 0.4616
 epoch: 6, train_loss: 1.1269, test_loss: 1.1014, test_f1: 0.4669
 epoch: 7, train_loss: 1.1272, test_loss: 1.0901, test_f1: 0.4623
 epoch: 8, train_loss: 1.1051, test_loss: 1.0805, test_f1: 0.4570
 epoch: 9, train_loss: 1.1024, test_loss: 1.0729, test_f1: 0.4619
 epoch: 10, train_loss: 1.0869, test_loss: 1.0615, test_f1: 0.4614
 epoch: 11, train_loss: 1.0833, test_loss: 1.0488, test_f1: 0.4564
 epoch: 12, train_loss: 1.0601, test_loss: 1.0430, test_f1: 0.4588
 epoch: 13, train_loss: 1.0514, test_loss: 1.0573, test_f1: 0.4299
 epoch: 14, train_loss: 1.0444, test_loss: 1.0370, test_f1: 0.4531
 epoch: 15, train_loss: 1.0391, test_loss: 1.0257, test_f1: 0.4406
 epoch: 16, train_loss: 1.0307, test_loss: 1.0167, test_f1: 0.4489
 epoch: 17, train_loss: 1.0243, test_loss: 1.0137, test_f1: 0.4550
 epoch: 18, train_loss: 1.0172, test_loss: 1.0123, test_f1: 0.4429
 epoch: 19, train_loss: 1.0000, test_loss: 1.0047, test_f1: 0.4524
 epoch: 20, train_loss: 1.0014, test_loss: 1.0042, test_f1: 0.4562
 epoch: 21, train_loss: 0.9943, test_loss: 0.9947, test_f1: 0.4697
 epoch: 22, train_loss: 0.9949, test_loss: 1.0038, test_f1: 0.4490
 epoch: 23, train_loss: 0.9834, test_loss: 0.9900, test_f1: 0.4589
 epoch: 24, train_loss: 0.9790, test_loss: 0.9824, test_f1: 0.4789
 epoch: 25, train_loss: 0.9584, test_loss: 0.9924, test_f1: 0.4597
 epoch: 26, train_loss: 0.9575, test_loss: 0.9763, test_f1: 0.4681
 epoch: 27, train_loss: 0.9595, test_loss: 0.9743, test_f1: 0.4768
 epoch: 28, train_loss: 0.9562, test_loss: 0.9763, test_f1: 0.4670
 epoch: 29, train_loss: 0.9466, test_loss: 0.9851, test_f1: 0.4669
 epoch: 30, train_loss: 0.9445, test_loss: 0.9781, test_f1: 0.4593
 epoch: 31, train_loss: 0.9329, test_loss: 0.9739, test_f1: 0.4795
 epoch: 32, train_loss: 0.9298, test_loss: 0.9879, test_f1: 0.4663
 epoch: 33, train_loss: 0.9324, test_loss: 0.9886, test_f1: 0.4671
 epoch: 34, train_loss: 0.9156, test_loss: 0.9756, test_f1: 0.4711
 epoch: 35, train_loss: 0.9125, test_loss: 0.9735, test_f1: 0.4898
 epoch: 36, train_loss: 0.9130, test_loss: 0.9600, test_f1: 0.4866
 epoch: 37, train_loss: 0.8949, test_loss: 0.9842, test_f1: 0.4777
 epoch: 38, train_loss: 0.9022, test_loss: 0.9748, test_f1: 0.4979
 epoch: 39, train_loss: 0.8826, test_loss: 0.9649, test_f1: 0.5009
 epoch: 40, train_loss: 0.8785, test_loss: 0.9762, test_f1: 0.4963
 epoch: 41, train_loss: 0.8745, test_loss: 0.9767, test_f1: 0.4806
 epoch: 42, train_loss: 0.8769, test_loss: 0.9739, test_f1: 0.5108
 epoch: 43, train_loss: 0.8659, test_loss: 0.9794, test_f1: 0.4757
 epoch: 44, train_loss: 0.8659, test_loss: 0.9886, test_f1: 0.4917
 epoch: 45, train_loss: 0.8539, test_loss: 0.9844, test_f1: 0.4714
 epoch: 46, train_loss: 0.8572, test_loss: 0.9794, test_f1: 0.4835
 epoch: 47, train_loss: 0.8455, test_loss: 0.9827, test_f1: 0.5077
 epoch: 48, train_loss: 0.8386, test_loss: 0.9860, test_f1: 0.5040
 epoch: 49, train_loss: 0.8448, test_loss: 0.9886, test_f1: 0.5019
 epoch: 50, train_loss: 0.8308, test_loss: 0.9811, test_f1: 0.4984
 epoch: 51, train_loss: 0.8232, test_loss: 0.9861, test_f1: 0.4965
 epoch: 52, train_loss: 0.8152, test_loss: 0.9816, test_f1: 0.4937
 epoch: 53, train_loss: 0.8165, test_loss: 0.9872, test_f1: 0.4983
 epoch: 54, train_loss: 0.8122, test_loss: 0.9920, test_f1: 0.4939
 epoch: 55, train_loss: 0.8107, test_loss: 0.9885, test_f1: 0.4950
 epoch: 56, train_loss: 0.8023, test_loss: 0.9921, test_f1: 0.5070
 epoch: 57, train_loss: 0.8163, test_loss: 0.9906, test_f1: 0.4913
 epoch: 58, train_loss: 0.8022, test_loss: 1.0062, test_f1: 0.5105
 epoch: 59, train_loss: 0.8035, test_loss: 1.0040, test_f1: 0.5056
 epoch: 60, train_loss: 0.8056, test_loss: 1.0016, test_f1: 0.4958
 epoch: 61, train_loss: 0.7921, test_loss: 1.0057, test_f1: 0.5047
 epoch: 62, train_loss: 0.8027, test_loss: 1.0016, test_f1: 0.4943
 epoch: 63, train_loss: 0.7934, test_loss: 1.0012, test_f1: 0.5113
 epoch: 64, train_loss: 0.7878, test_loss: 1.0150, test_f1: 0.4853
 epoch: 65, train_loss: 0.7891, test_loss: 1.0044, test_f1: 0.4930
 epoch: 66, train_loss: 0.7866, test_loss: 1.0057, test_f1: 0.5077
 epoch: 67, train_loss: 0.7750, test_loss: 1.0133, test_f1: 0.4930
 epoch: 68, train_loss: 0.7841, test_loss: 1.0083, test_f1: 0.4857
 epoch: 69, train_loss: 0.7752, test_loss: 1.0140, test_f1: 0.5041
 epoch: 70, train_loss: 0.7769, test_loss: 1.0138, test_f1: 0.5000
 epoch: 71, train_loss: 0.7696, test_loss: 1.0110, test_f1: 0.4966
 epoch: 72, train_loss: 0.7684, test_loss: 1.0113, test_f1: 0.4886
 epoch: 73, train_loss: 0.7683, test_loss: 1.0242, test_f1: 0.4903
 epoch: 74, train_loss: 0.7730, test_loss: 1.0181, test_f1: 0.5047
 epoch: 75, train_loss: 0.7713, test_loss: 1.0229, test_f1: 0.4975
 epoch: 76, train_loss: 0.7638, test_loss: 1.0327, test_f1: 0.4842
 epoch: 77, train_loss: 0.7585, test_loss: 1.0345, test_f1: 0.4972
 epoch: 78, train_loss: 0.7637, test_loss: 1.0370, test_f1: 0.5118
 epoch: 79, train_loss: 0.7472, test_loss: 1.0300, test_f1: 0.5069
 epoch: 80, train_loss: 0.7498, test_loss: 1.0264, test_f1: 0.5095
 epoch: 81, train_loss: 0.7549, test_loss: 1.0354, test_f1: 0.5079
 epoch: 82, train_loss: 0.7557, test_loss: 1.0404, test_f1: 0.5092
 epoch: 83, train_loss: 0.7447, test_loss: 1.0387, test_f1: 0.4998
 epoch: 84, train_loss: 0.7560, test_loss: 1.0409, test_f1: 0.4972
 epoch: 85, train_loss: 0.7414, test_loss: 1.0477, test_f1: 0.5042
 epoch: 86, train_loss: 0.7344, test_loss: 1.0503, test_f1: 0.5050
 epoch: 87, train_loss: 0.7427, test_loss: 1.0494, test_f1: 0.5046
 epoch: 88, train_loss: 0.7312, test_loss: 1.0402, test_f1: 0.5058
 epoch: 89, train_loss: 0.7335, test_loss: 1.0461, test_f1: 0.4971
 epoch: 90, train_loss: 0.7350, test_loss: 1.0513, test_f1: 0.5015
 epoch: 91, train_loss: 0.7323, test_loss: 1.0586, test_f1: 0.4977
 epoch: 92, train_loss: 0.7251, test_loss: 1.0519, test_f1: 0.5071
 epoch: 93, train_loss: 0.7256, test_loss: 1.0582, test_f1: 0.5059
 epoch: 94, train_loss: 0.7119, test_loss: 1.0642, test_f1: 0.5080
 epoch: 95, train_loss: 0.7191, test_loss: 1.0589, test_f1: 0.5106
 epoch: 96, train_loss: 0.7139, test_loss: 1.0658, test_f1: 0.5049
 epoch: 97, train_loss: 0.7228, test_loss: 1.0627, test_f1: 0.4966
 epoch: 98, train_loss: 0.7089, test_loss: 1.0589, test_f1: 0.5092
 epoch: 99, train_loss: 0.7229, test_loss: 1.0645, test_f1: 0.4969
##################ITERATION #5 ****************************************
 epoch: 0, train_loss: 1.2985, test_loss: 1.2842, test_f1: 0.2274
 epoch: 1, train_loss: 1.2198, test_loss: 1.2537, test_f1: 0.2276
 epoch: 2, train_loss: 1.1960, test_loss: 1.2090, test_f1: 0.2854
 epoch: 3, train_loss: 1.1753, test_loss: 1.1603, test_f1: 0.4118
 epoch: 4, train_loss: 1.1593, test_loss: 1.1252, test_f1: 0.4508
 epoch: 5, train_loss: 1.1378, test_loss: 1.0946, test_f1: 0.4693
 epoch: 6, train_loss: 1.1283, test_loss: 1.0757, test_f1: 0.4681
 epoch: 7, train_loss: 1.1190, test_loss: 1.0667, test_f1: 0.4655
 epoch: 8, train_loss: 1.1093, test_loss: 1.0556, test_f1: 0.4731
 epoch: 9, train_loss: 1.0881, test_loss: 1.0434, test_f1: 0.4758
 epoch: 10, train_loss: 1.0759, test_loss: 1.0356, test_f1: 0.4682
 epoch: 11, train_loss: 1.0666, test_loss: 1.0312, test_f1: 0.4710
 epoch: 12, train_loss: 1.0513, test_loss: 1.0227, test_f1: 0.4767
 epoch: 13, train_loss: 1.0391, test_loss: 1.0152, test_f1: 0.4708
 epoch: 14, train_loss: 1.0383, test_loss: 1.0038, test_f1: 0.4723
 epoch: 15, train_loss: 1.0330, test_loss: 1.0048, test_f1: 0.4695
 epoch: 16, train_loss: 1.0214, test_loss: 0.9992, test_f1: 0.4740
 epoch: 17, train_loss: 1.0124, test_loss: 0.9954, test_f1: 0.4774
 epoch: 18, train_loss: 1.0042, test_loss: 0.9872, test_f1: 0.4796
 epoch: 19, train_loss: 0.9991, test_loss: 0.9777, test_f1: 0.4836
 epoch: 20, train_loss: 0.9877, test_loss: 0.9726, test_f1: 0.4917
 epoch: 21, train_loss: 0.9799, test_loss: 0.9753, test_f1: 0.4824
 epoch: 22, train_loss: 0.9791, test_loss: 0.9663, test_f1: 0.4935
 epoch: 23, train_loss: 0.9745, test_loss: 0.9584, test_f1: 0.4951
 epoch: 24, train_loss: 0.9625, test_loss: 0.9590, test_f1: 0.4879
 epoch: 25, train_loss: 0.9526, test_loss: 0.9611, test_f1: 0.4868
 epoch: 26, train_loss: 0.9511, test_loss: 0.9589, test_f1: 0.4878
 epoch: 27, train_loss: 0.9384, test_loss: 0.9539, test_f1: 0.5040
 epoch: 28, train_loss: 0.9366, test_loss: 0.9477, test_f1: 0.4962
 epoch: 29, train_loss: 0.9243, test_loss: 0.9527, test_f1: 0.4876
 epoch: 30, train_loss: 0.9184, test_loss: 0.9408, test_f1: 0.5023
 epoch: 31, train_loss: 0.9098, test_loss: 0.9514, test_f1: 0.5120
 epoch: 32, train_loss: 0.9142, test_loss: 0.9594, test_f1: 0.5070
 epoch: 33, train_loss: 0.9078, test_loss: 0.9371, test_f1: 0.5110
 epoch: 34, train_loss: 0.8933, test_loss: 0.9425, test_f1: 0.5140
 epoch: 35, train_loss: 0.8946, test_loss: 0.9515, test_f1: 0.5199
 epoch: 36, train_loss: 0.8899, test_loss: 0.9486, test_f1: 0.5173
 epoch: 37, train_loss: 0.8906, test_loss: 0.9529, test_f1: 0.5181
 epoch: 38, train_loss: 0.8778, test_loss: 0.9503, test_f1: 0.5074
 epoch: 39, train_loss: 0.8737, test_loss: 0.9482, test_f1: 0.5143
 epoch: 40, train_loss: 0.8686, test_loss: 0.9498, test_f1: 0.5050
 epoch: 41, train_loss: 0.8607, test_loss: 0.9591, test_f1: 0.5078
 epoch: 42, train_loss: 0.8675, test_loss: 0.9738, test_f1: 0.4864
 epoch: 43, train_loss: 0.8630, test_loss: 0.9558, test_f1: 0.5081
 epoch: 44, train_loss: 0.8471, test_loss: 0.9523, test_f1: 0.5062
 epoch: 45, train_loss: 0.8490, test_loss: 0.9646, test_f1: 0.5206
 epoch: 46, train_loss: 0.8447, test_loss: 0.9466, test_f1: 0.5092
 epoch: 47, train_loss: 0.8444, test_loss: 0.9586, test_f1: 0.5310
 epoch: 48, train_loss: 0.8335, test_loss: 0.9603, test_f1: 0.5366
 epoch: 49, train_loss: 0.8292, test_loss: 0.9589, test_f1: 0.5202
 epoch: 50, train_loss: 0.8220, test_loss: 0.9787, test_f1: 0.5152
 epoch: 51, train_loss: 0.8112, test_loss: 0.9655, test_f1: 0.5210
 epoch: 52, train_loss: 0.8130, test_loss: 0.9638, test_f1: 0.5314
 epoch: 53, train_loss: 0.8074, test_loss: 0.9571, test_f1: 0.5383
 epoch: 54, train_loss: 0.8084, test_loss: 0.9703, test_f1: 0.5350
 epoch: 55, train_loss: 0.8021, test_loss: 0.9685, test_f1: 0.5286
 epoch: 56, train_loss: 0.7993, test_loss: 0.9886, test_f1: 0.5097
 epoch: 57, train_loss: 0.7961, test_loss: 0.9857, test_f1: 0.5106
 epoch: 58, train_loss: 0.7989, test_loss: 0.9894, test_f1: 0.5096
 epoch: 59, train_loss: 0.7879, test_loss: 0.9876, test_f1: 0.5202
 epoch: 60, train_loss: 0.7876, test_loss: 0.9699, test_f1: 0.5460
 epoch: 61, train_loss: 0.7915, test_loss: 0.9858, test_f1: 0.5163
 epoch: 62, train_loss: 0.7831, test_loss: 1.0046, test_f1: 0.5148
 epoch: 63, train_loss: 0.7790, test_loss: 0.9919, test_f1: 0.5254
 epoch: 64, train_loss: 0.7743, test_loss: 0.9844, test_f1: 0.5310
 epoch: 65, train_loss: 0.7737, test_loss: 0.9876, test_f1: 0.5208
 epoch: 66, train_loss: 0.7842, test_loss: 0.9863, test_f1: 0.5250
 epoch: 67, train_loss: 0.7726, test_loss: 0.9961, test_f1: 0.5271
 epoch: 68, train_loss: 0.7632, test_loss: 1.0000, test_f1: 0.5118
 epoch: 69, train_loss: 0.7563, test_loss: 0.9973, test_f1: 0.5132
 epoch: 70, train_loss: 0.7590, test_loss: 1.0011, test_f1: 0.5198
 epoch: 71, train_loss: 0.7685, test_loss: 1.0188, test_f1: 0.5144
 epoch: 72, train_loss: 0.7642, test_loss: 1.0146, test_f1: 0.5275
 epoch: 73, train_loss: 0.7569, test_loss: 1.0158, test_f1: 0.5319
 epoch: 74, train_loss: 0.7550, test_loss: 1.0163, test_f1: 0.5247
 epoch: 75, train_loss: 0.7492, test_loss: 1.0184, test_f1: 0.5202
 epoch: 76, train_loss: 0.7536, test_loss: 1.0208, test_f1: 0.5297
 epoch: 77, train_loss: 0.7388, test_loss: 1.0204, test_f1: 0.5194
 epoch: 78, train_loss: 0.7521, test_loss: 1.0481, test_f1: 0.4971
 epoch: 79, train_loss: 0.7416, test_loss: 1.0203, test_f1: 0.5380
 epoch: 80, train_loss: 0.7451, test_loss: 1.0153, test_f1: 0.5249
 epoch: 81, train_loss: 0.7374, test_loss: 1.0308, test_f1: 0.5179
 epoch: 82, train_loss: 0.7386, test_loss: 1.0294, test_f1: 0.5358
 epoch: 83, train_loss: 0.7262, test_loss: 1.0279, test_f1: 0.5266
 epoch: 84, train_loss: 0.7205, test_loss: 1.0225, test_f1: 0.5300
 epoch: 85, train_loss: 0.7206, test_loss: 1.0870, test_f1: 0.4955
 epoch: 86, train_loss: 0.7212, test_loss: 1.0493, test_f1: 0.5168
 epoch: 87, train_loss: 0.7227, test_loss: 1.0384, test_f1: 0.5360
 epoch: 88, train_loss: 0.7282, test_loss: 1.0521, test_f1: 0.5194
 epoch: 89, train_loss: 0.7133, test_loss: 1.0407, test_f1: 0.5443
 epoch: 90, train_loss: 0.7181, test_loss: 1.0504, test_f1: 0.5481
 epoch: 91, train_loss: 0.7227, test_loss: 1.0631, test_f1: 0.5208
 epoch: 92, train_loss: 0.7153, test_loss: 1.0744, test_f1: 0.5192
 epoch: 93, train_loss: 0.7146, test_loss: 1.0531, test_f1: 0.5299
 epoch: 94, train_loss: 0.7021, test_loss: 1.0649, test_f1: 0.5245
 epoch: 95, train_loss: 0.6981, test_loss: 1.1316, test_f1: 0.5082
 epoch: 96, train_loss: 0.6944, test_loss: 1.0617, test_f1: 0.5214
 epoch: 97, train_loss: 0.7060, test_loss: 1.0697, test_f1: 0.5306
 epoch: 98, train_loss: 0.7021, test_loss: 1.0726, test_f1: 0.5287
 epoch: 99, train_loss: 0.7012, test_loss: 1.0653, test_f1: 0.5345
##################ITERATION #6 ****************************************
 epoch: 0, train_loss: 1.3522, test_loss: 1.2826, test_f1: 0.2239
 epoch: 1, train_loss: 1.2698, test_loss: 1.2372, test_f1: 0.2869
 epoch: 2, train_loss: 1.2226, test_loss: 1.1897, test_f1: 0.3966
 epoch: 3, train_loss: 1.2029, test_loss: 1.1492, test_f1: 0.4416
 epoch: 4, train_loss: 1.1918, test_loss: 1.1242, test_f1: 0.4563
 epoch: 5, train_loss: 1.1629, test_loss: 1.1095, test_f1: 0.4541
 epoch: 6, train_loss: 1.1440, test_loss: 1.0985, test_f1: 0.4467
 epoch: 7, train_loss: 1.1346, test_loss: 1.0859, test_f1: 0.4454
 epoch: 8, train_loss: 1.1256, test_loss: 1.0763, test_f1: 0.4398
 epoch: 9, train_loss: 1.1136, test_loss: 1.0676, test_f1: 0.4477
 epoch: 10, train_loss: 1.0914, test_loss: 1.0645, test_f1: 0.4401
 epoch: 11, train_loss: 1.0831, test_loss: 1.0592, test_f1: 0.4395
 epoch: 12, train_loss: 1.0893, test_loss: 1.0510, test_f1: 0.4567
 epoch: 13, train_loss: 1.0744, test_loss: 1.0478, test_f1: 0.4496
 epoch: 14, train_loss: 1.0590, test_loss: 1.0428, test_f1: 0.4555
 epoch: 15, train_loss: 1.0649, test_loss: 1.0362, test_f1: 0.4611
 epoch: 16, train_loss: 1.0423, test_loss: 1.0330, test_f1: 0.4495
 epoch: 17, train_loss: 1.0348, test_loss: 1.0265, test_f1: 0.4577
 epoch: 18, train_loss: 1.0251, test_loss: 1.0153, test_f1: 0.4666
 epoch: 19, train_loss: 1.0191, test_loss: 1.0120, test_f1: 0.4726
 epoch: 20, train_loss: 1.0128, test_loss: 1.0091, test_f1: 0.4628
 epoch: 21, train_loss: 1.0034, test_loss: 1.0065, test_f1: 0.4653
 epoch: 22, train_loss: 0.9969, test_loss: 1.0014, test_f1: 0.4679
 epoch: 23, train_loss: 0.9964, test_loss: 0.9968, test_f1: 0.4722
 epoch: 24, train_loss: 0.9937, test_loss: 0.9873, test_f1: 0.4645
 epoch: 25, train_loss: 0.9780, test_loss: 0.9889, test_f1: 0.4470
 epoch: 26, train_loss: 0.9729, test_loss: 0.9825, test_f1: 0.4532
 epoch: 27, train_loss: 0.9733, test_loss: 0.9775, test_f1: 0.4746
 epoch: 28, train_loss: 0.9618, test_loss: 0.9745, test_f1: 0.4664
 epoch: 29, train_loss: 0.9471, test_loss: 0.9738, test_f1: 0.4762
 epoch: 30, train_loss: 0.9411, test_loss: 0.9663, test_f1: 0.4736
 epoch: 31, train_loss: 0.9470, test_loss: 0.9718, test_f1: 0.4844
 epoch: 32, train_loss: 0.9389, test_loss: 0.9724, test_f1: 0.4861
 epoch: 33, train_loss: 0.9220, test_loss: 0.9677, test_f1: 0.4888
 epoch: 34, train_loss: 0.9270, test_loss: 0.9539, test_f1: 0.4942
 epoch: 35, train_loss: 0.9200, test_loss: 0.9656, test_f1: 0.4855
 epoch: 36, train_loss: 0.9212, test_loss: 0.9572, test_f1: 0.5042
 epoch: 37, train_loss: 0.9152, test_loss: 0.9512, test_f1: 0.4969
 epoch: 38, train_loss: 0.9076, test_loss: 0.9526, test_f1: 0.4956
 epoch: 39, train_loss: 0.9139, test_loss: 0.9507, test_f1: 0.4805
 epoch: 40, train_loss: 0.8955, test_loss: 0.9491, test_f1: 0.5009
 epoch: 41, train_loss: 0.8889, test_loss: 0.9464, test_f1: 0.5086
 epoch: 42, train_loss: 0.8963, test_loss: 0.9531, test_f1: 0.5085
 epoch: 43, train_loss: 0.8831, test_loss: 0.9596, test_f1: 0.4921
 epoch: 44, train_loss: 0.8885, test_loss: 0.9368, test_f1: 0.5020
 epoch: 45, train_loss: 0.8773, test_loss: 0.9692, test_f1: 0.4911
 epoch: 46, train_loss: 0.8832, test_loss: 0.9569, test_f1: 0.4988
 epoch: 47, train_loss: 0.8707, test_loss: 0.9742, test_f1: 0.4817
 epoch: 48, train_loss: 0.8610, test_loss: 0.9430, test_f1: 0.5080
 epoch: 49, train_loss: 0.8534, test_loss: 0.9581, test_f1: 0.5109
 epoch: 50, train_loss: 0.8596, test_loss: 0.9660, test_f1: 0.5010
 epoch: 51, train_loss: 0.8540, test_loss: 0.9517, test_f1: 0.5190
 epoch: 52, train_loss: 0.8516, test_loss: 0.9535, test_f1: 0.5155
 epoch: 53, train_loss: 0.8407, test_loss: 0.9592, test_f1: 0.5030
 epoch: 54, train_loss: 0.8281, test_loss: 0.9558, test_f1: 0.5071
 epoch: 55, train_loss: 0.8403, test_loss: 0.9546, test_f1: 0.5206
 epoch: 56, train_loss: 0.8307, test_loss: 0.9524, test_f1: 0.5217
 epoch: 57, train_loss: 0.8318, test_loss: 0.9618, test_f1: 0.5186
 epoch: 58, train_loss: 0.8313, test_loss: 0.9554, test_f1: 0.5366
 epoch: 59, train_loss: 0.8380, test_loss: 0.9572, test_f1: 0.5225
 epoch: 60, train_loss: 0.8258, test_loss: 0.9793, test_f1: 0.5111
 epoch: 61, train_loss: 0.8303, test_loss: 0.9646, test_f1: 0.5082
 epoch: 62, train_loss: 0.8176, test_loss: 0.9619, test_f1: 0.5259
 epoch: 63, train_loss: 0.8193, test_loss: 0.9833, test_f1: 0.5193
 epoch: 64, train_loss: 0.8264, test_loss: 0.9782, test_f1: 0.5227
 epoch: 65, train_loss: 0.8179, test_loss: 0.9722, test_f1: 0.5165
 epoch: 66, train_loss: 0.8115, test_loss: 0.9778, test_f1: 0.5118
 epoch: 67, train_loss: 0.8113, test_loss: 0.9845, test_f1: 0.5302
 epoch: 68, train_loss: 0.8118, test_loss: 0.9883, test_f1: 0.5217
 epoch: 69, train_loss: 0.8039, test_loss: 0.9766, test_f1: 0.5149
 epoch: 70, train_loss: 0.8149, test_loss: 0.9853, test_f1: 0.5221
 epoch: 71, train_loss: 0.8022, test_loss: 0.9987, test_f1: 0.5094
 epoch: 72, train_loss: 0.7943, test_loss: 0.9876, test_f1: 0.5304
 epoch: 73, train_loss: 0.7946, test_loss: 0.9769, test_f1: 0.5241
 epoch: 74, train_loss: 0.7989, test_loss: 0.9708, test_f1: 0.5275
 epoch: 75, train_loss: 0.7954, test_loss: 0.9760, test_f1: 0.5361
 epoch: 76, train_loss: 0.7978, test_loss: 0.9835, test_f1: 0.5248
 epoch: 77, train_loss: 0.7987, test_loss: 0.9768, test_f1: 0.5234
 epoch: 78, train_loss: 0.7809, test_loss: 1.0077, test_f1: 0.5268
 epoch: 79, train_loss: 0.7865, test_loss: 0.9903, test_f1: 0.5221
 epoch: 80, train_loss: 0.7833, test_loss: 1.0017, test_f1: 0.5277
 epoch: 81, train_loss: 0.7867, test_loss: 1.0183, test_f1: 0.5069
 epoch: 82, train_loss: 0.7869, test_loss: 1.0054, test_f1: 0.5320
 epoch: 83, train_loss: 0.7795, test_loss: 1.0079, test_f1: 0.5297
 epoch: 84, train_loss: 0.7814, test_loss: 1.0068, test_f1: 0.5231
 epoch: 85, train_loss: 0.7921, test_loss: 1.0001, test_f1: 0.5284
 epoch: 86, train_loss: 0.7684, test_loss: 1.0036, test_f1: 0.5383
 epoch: 87, train_loss: 0.7736, test_loss: 1.0003, test_f1: 0.5267
 epoch: 88, train_loss: 0.7701, test_loss: 1.0337, test_f1: 0.5299
 epoch: 89, train_loss: 0.7639, test_loss: 1.0071, test_f1: 0.5336
 epoch: 90, train_loss: 0.7680, test_loss: 1.0135, test_f1: 0.5304
 epoch: 91, train_loss: 0.7760, test_loss: 1.0356, test_f1: 0.5268
 epoch: 92, train_loss: 0.7661, test_loss: 1.0218, test_f1: 0.5476
 epoch: 93, train_loss: 0.7643, test_loss: 1.0190, test_f1: 0.5428
 epoch: 94, train_loss: 0.7459, test_loss: 1.0357, test_f1: 0.5403
 epoch: 95, train_loss: 0.7643, test_loss: 1.0269, test_f1: 0.5396
 epoch: 96, train_loss: 0.7476, test_loss: 1.0455, test_f1: 0.5371
 epoch: 97, train_loss: 0.7473, test_loss: 1.0612, test_f1: 0.5397
 epoch: 98, train_loss: 0.7555, test_loss: 1.0534, test_f1: 0.5375
 epoch: 99, train_loss: 0.7467, test_loss: 1.0447, test_f1: 0.5339
##################ITERATION #7 ****************************************
 epoch: 0, train_loss: 1.3593, test_loss: 1.2657, test_f1: 0.2274
 epoch: 1, train_loss: 1.2485, test_loss: 1.2320, test_f1: 0.2870
 epoch: 2, train_loss: 1.2139, test_loss: 1.1971, test_f1: 0.2920
 epoch: 3, train_loss: 1.1915, test_loss: 1.1540, test_f1: 0.4141
 epoch: 4, train_loss: 1.1754, test_loss: 1.1209, test_f1: 0.4644
 epoch: 5, train_loss: 1.1707, test_loss: 1.0948, test_f1: 0.4847
 epoch: 6, train_loss: 1.1382, test_loss: 1.0807, test_f1: 0.4860
 epoch: 7, train_loss: 1.1427, test_loss: 1.0667, test_f1: 0.4895
 epoch: 8, train_loss: 1.1133, test_loss: 1.0621, test_f1: 0.4853
 epoch: 9, train_loss: 1.1069, test_loss: 1.0530, test_f1: 0.4730
 epoch: 10, train_loss: 1.0914, test_loss: 1.0415, test_f1: 0.4844
 epoch: 11, train_loss: 1.0787, test_loss: 1.0357, test_f1: 0.4862
 epoch: 12, train_loss: 1.0702, test_loss: 1.0282, test_f1: 0.4921
 epoch: 13, train_loss: 1.0617, test_loss: 1.0176, test_f1: 0.4952
 epoch: 14, train_loss: 1.0446, test_loss: 1.0148, test_f1: 0.4900
 epoch: 15, train_loss: 1.0490, test_loss: 1.0108, test_f1: 0.4794
 epoch: 16, train_loss: 1.0293, test_loss: 1.0028, test_f1: 0.4882
 epoch: 17, train_loss: 1.0263, test_loss: 0.9993, test_f1: 0.4878
 epoch: 18, train_loss: 1.0181, test_loss: 0.9939, test_f1: 0.4892
 epoch: 19, train_loss: 1.0106, test_loss: 0.9926, test_f1: 0.4875
 epoch: 20, train_loss: 0.9972, test_loss: 0.9755, test_f1: 0.4912
 epoch: 21, train_loss: 0.9878, test_loss: 0.9787, test_f1: 0.4975
 epoch: 22, train_loss: 0.9779, test_loss: 0.9756, test_f1: 0.4950
 epoch: 23, train_loss: 0.9686, test_loss: 0.9741, test_f1: 0.4868
 epoch: 24, train_loss: 0.9554, test_loss: 0.9741, test_f1: 0.4910
 epoch: 25, train_loss: 0.9677, test_loss: 0.9688, test_f1: 0.4977
 epoch: 26, train_loss: 0.9561, test_loss: 0.9712, test_f1: 0.4967
 epoch: 27, train_loss: 0.9416, test_loss: 0.9643, test_f1: 0.5003
 epoch: 28, train_loss: 0.9342, test_loss: 0.9639, test_f1: 0.4979
 epoch: 29, train_loss: 0.9351, test_loss: 0.9547, test_f1: 0.4943
 epoch: 30, train_loss: 0.9101, test_loss: 0.9573, test_f1: 0.4969
 epoch: 31, train_loss: 0.9194, test_loss: 0.9669, test_f1: 0.4939
 epoch: 32, train_loss: 0.9111, test_loss: 0.9603, test_f1: 0.5018
 epoch: 33, train_loss: 0.9122, test_loss: 0.9591, test_f1: 0.5075
 epoch: 34, train_loss: 0.8965, test_loss: 0.9620, test_f1: 0.5065
 epoch: 35, train_loss: 0.9033, test_loss: 0.9671, test_f1: 0.5041
 epoch: 36, train_loss: 0.8901, test_loss: 0.9578, test_f1: 0.5031
 epoch: 37, train_loss: 0.8823, test_loss: 0.9637, test_f1: 0.4978
 epoch: 38, train_loss: 0.8790, test_loss: 0.9717, test_f1: 0.4968
 epoch: 39, train_loss: 0.8792, test_loss: 0.9710, test_f1: 0.5119
 epoch: 40, train_loss: 0.8681, test_loss: 0.9681, test_f1: 0.5101
 epoch: 41, train_loss: 0.8663, test_loss: 0.9848, test_f1: 0.5132
 epoch: 42, train_loss: 0.8576, test_loss: 0.9842, test_f1: 0.5056
 epoch: 43, train_loss: 0.8562, test_loss: 0.9815, test_f1: 0.5233
 epoch: 44, train_loss: 0.8388, test_loss: 0.9826, test_f1: 0.5086
 epoch: 45, train_loss: 0.8401, test_loss: 0.9848, test_f1: 0.5055
 epoch: 46, train_loss: 0.8340, test_loss: 1.0002, test_f1: 0.5257
 epoch: 47, train_loss: 0.8309, test_loss: 1.0072, test_f1: 0.5194
 epoch: 48, train_loss: 0.8242, test_loss: 1.0104, test_f1: 0.5242
 epoch: 49, train_loss: 0.8194, test_loss: 1.0125, test_f1: 0.5139
 epoch: 50, train_loss: 0.8084, test_loss: 1.0125, test_f1: 0.5399
 epoch: 51, train_loss: 0.8008, test_loss: 1.0182, test_f1: 0.5285
 epoch: 52, train_loss: 0.8064, test_loss: 1.0179, test_f1: 0.5197
 epoch: 53, train_loss: 0.7949, test_loss: 1.0162, test_f1: 0.5236
 epoch: 54, train_loss: 0.7968, test_loss: 1.0161, test_f1: 0.5215
 epoch: 55, train_loss: 0.8042, test_loss: 1.0260, test_f1: 0.5146
 epoch: 56, train_loss: 0.7989, test_loss: 1.0198, test_f1: 0.5138
 epoch: 57, train_loss: 0.7871, test_loss: 1.0165, test_f1: 0.5247
 epoch: 58, train_loss: 0.7817, test_loss: 1.0249, test_f1: 0.5347
 epoch: 59, train_loss: 0.7809, test_loss: 1.0279, test_f1: 0.5318
 epoch: 60, train_loss: 0.7721, test_loss: 1.0175, test_f1: 0.5299
 epoch: 61, train_loss: 0.7745, test_loss: 1.0301, test_f1: 0.5328
 epoch: 62, train_loss: 0.7716, test_loss: 1.0327, test_f1: 0.5236
 epoch: 63, train_loss: 0.7825, test_loss: 1.0288, test_f1: 0.5256
 epoch: 64, train_loss: 0.7681, test_loss: 1.0427, test_f1: 0.5235
 epoch: 65, train_loss: 0.7679, test_loss: 1.0413, test_f1: 0.5222
 epoch: 66, train_loss: 0.7580, test_loss: 1.0376, test_f1: 0.5339
 epoch: 67, train_loss: 0.7773, test_loss: 1.0371, test_f1: 0.5517
 epoch: 68, train_loss: 0.7594, test_loss: 1.0474, test_f1: 0.5307
 epoch: 69, train_loss: 0.7557, test_loss: 1.0585, test_f1: 0.5277
 epoch: 70, train_loss: 0.7641, test_loss: 1.0516, test_f1: 0.5316
 epoch: 71, train_loss: 0.7474, test_loss: 1.0536, test_f1: 0.5513
 epoch: 72, train_loss: 0.7442, test_loss: 1.0626, test_f1: 0.5357
 epoch: 73, train_loss: 0.7467, test_loss: 1.0665, test_f1: 0.5387
 epoch: 74, train_loss: 0.7487, test_loss: 1.0671, test_f1: 0.5391
 epoch: 75, train_loss: 0.7403, test_loss: 1.0682, test_f1: 0.5511
 epoch: 76, train_loss: 0.7384, test_loss: 1.0612, test_f1: 0.5401
 epoch: 77, train_loss: 0.7297, test_loss: 1.0639, test_f1: 0.5367
 epoch: 78, train_loss: 0.7332, test_loss: 1.0682, test_f1: 0.5433
 epoch: 79, train_loss: 0.7347, test_loss: 1.0735, test_f1: 0.5202
 epoch: 80, train_loss: 0.7386, test_loss: 1.0768, test_f1: 0.5301
 epoch: 81, train_loss: 0.7334, test_loss: 1.0788, test_f1: 0.5274
 epoch: 82, train_loss: 0.7343, test_loss: 1.0791, test_f1: 0.5290
 epoch: 83, train_loss: 0.7301, test_loss: 1.0841, test_f1: 0.5273
 epoch: 84, train_loss: 0.7148, test_loss: 1.0878, test_f1: 0.5231
 epoch: 85, train_loss: 0.7385, test_loss: 1.0843, test_f1: 0.5284
 epoch: 86, train_loss: 0.7187, test_loss: 1.0772, test_f1: 0.5252
 epoch: 87, train_loss: 0.7129, test_loss: 1.0783, test_f1: 0.5509
 epoch: 88, train_loss: 0.7167, test_loss: 1.0980, test_f1: 0.5364
 epoch: 89, train_loss: 0.7181, test_loss: 1.1156, test_f1: 0.5505
 epoch: 90, train_loss: 0.7094, test_loss: 1.0979, test_f1: 0.5308
 epoch: 91, train_loss: 0.7130, test_loss: 1.1113, test_f1: 0.5414
 epoch: 92, train_loss: 0.7057, test_loss: 1.1036, test_f1: 0.5344
 epoch: 93, train_loss: 0.7125, test_loss: 1.1145, test_f1: 0.5319
 epoch: 94, train_loss: 0.6935, test_loss: 1.1050, test_f1: 0.5340
 epoch: 95, train_loss: 0.7123, test_loss: 1.1114, test_f1: 0.5264
 epoch: 96, train_loss: 0.6954, test_loss: 1.1104, test_f1: 0.5284
 epoch: 97, train_loss: 0.6993, test_loss: 1.0996, test_f1: 0.5305
 epoch: 98, train_loss: 0.7016, test_loss: 1.1174, test_f1: 0.5363
 epoch: 99, train_loss: 0.6952, test_loss: 1.1088, test_f1: 0.5424
##################ITERATION #8 ****************************************
 epoch: 0, train_loss: 1.4079, test_loss: 1.2954, test_f1: 0.2459
 epoch: 1, train_loss: 1.2763, test_loss: 1.2571, test_f1: 0.2878
 epoch: 2, train_loss: 1.2341, test_loss: 1.2143, test_f1: 0.3504
 epoch: 3, train_loss: 1.1962, test_loss: 1.1616, test_f1: 0.4323
 epoch: 4, train_loss: 1.1872, test_loss: 1.1260, test_f1: 0.4476
 epoch: 5, train_loss: 1.1672, test_loss: 1.1081, test_f1: 0.4459
 epoch: 6, train_loss: 1.1494, test_loss: 1.0915, test_f1: 0.4546
 epoch: 7, train_loss: 1.1348, test_loss: 1.0792, test_f1: 0.4548
 epoch: 8, train_loss: 1.1276, test_loss: 1.0704, test_f1: 0.4552
 epoch: 9, train_loss: 1.1080, test_loss: 1.0623, test_f1: 0.4533
 epoch: 10, train_loss: 1.0792, test_loss: 1.0537, test_f1: 0.4575
 epoch: 11, train_loss: 1.0798, test_loss: 1.0455, test_f1: 0.4575
 epoch: 12, train_loss: 1.0745, test_loss: 1.0359, test_f1: 0.4630
 epoch: 13, train_loss: 1.0648, test_loss: 1.0210, test_f1: 0.4634
 epoch: 14, train_loss: 1.0589, test_loss: 1.0236, test_f1: 0.4584
 epoch: 15, train_loss: 1.0468, test_loss: 1.0126, test_f1: 0.4656
 epoch: 16, train_loss: 1.0345, test_loss: 1.0077, test_f1: 0.4749
 epoch: 17, train_loss: 1.0197, test_loss: 1.0032, test_f1: 0.4806
 epoch: 18, train_loss: 1.0118, test_loss: 0.9962, test_f1: 0.4806
 epoch: 19, train_loss: 1.0025, test_loss: 0.9942, test_f1: 0.4806
 epoch: 20, train_loss: 0.9902, test_loss: 0.9853, test_f1: 0.4770
 epoch: 21, train_loss: 0.9884, test_loss: 0.9801, test_f1: 0.4873
 epoch: 22, train_loss: 0.9795, test_loss: 0.9884, test_f1: 0.4770
 epoch: 23, train_loss: 0.9717, test_loss: 0.9903, test_f1: 0.4595
 epoch: 24, train_loss: 0.9708, test_loss: 0.9704, test_f1: 0.4789
 epoch: 25, train_loss: 0.9531, test_loss: 0.9631, test_f1: 0.4756
 epoch: 26, train_loss: 0.9635, test_loss: 0.9666, test_f1: 0.4695
 epoch: 27, train_loss: 0.9529, test_loss: 0.9627, test_f1: 0.4854
 epoch: 28, train_loss: 0.9438, test_loss: 0.9669, test_f1: 0.4772
 epoch: 29, train_loss: 0.9311, test_loss: 0.9534, test_f1: 0.4895
 epoch: 30, train_loss: 0.9344, test_loss: 0.9646, test_f1: 0.4814
 epoch: 31, train_loss: 0.9269, test_loss: 0.9617, test_f1: 0.4713
 epoch: 32, train_loss: 0.9194, test_loss: 0.9524, test_f1: 0.5011
 epoch: 33, train_loss: 0.9066, test_loss: 0.9523, test_f1: 0.4870
 epoch: 34, train_loss: 0.9108, test_loss: 0.9612, test_f1: 0.4848
 epoch: 35, train_loss: 0.9159, test_loss: 0.9644, test_f1: 0.4691
 epoch: 36, train_loss: 0.8997, test_loss: 0.9607, test_f1: 0.4699
 epoch: 37, train_loss: 0.8939, test_loss: 0.9672, test_f1: 0.4667
 epoch: 38, train_loss: 0.8850, test_loss: 0.9631, test_f1: 0.4785
 epoch: 39, train_loss: 0.8800, test_loss: 0.9695, test_f1: 0.4705
 epoch: 40, train_loss: 0.8770, test_loss: 0.9489, test_f1: 0.4837
 epoch: 41, train_loss: 0.8690, test_loss: 0.9555, test_f1: 0.4923
 epoch: 42, train_loss: 0.8697, test_loss: 0.9560, test_f1: 0.4787
 epoch: 43, train_loss: 0.8639, test_loss: 0.9666, test_f1: 0.4795
 epoch: 44, train_loss: 0.8547, test_loss: 0.9582, test_f1: 0.4866
 epoch: 45, train_loss: 0.8633, test_loss: 0.9578, test_f1: 0.4850
 epoch: 46, train_loss: 0.8489, test_loss: 0.9475, test_f1: 0.4819
 epoch: 47, train_loss: 0.8553, test_loss: 0.9623, test_f1: 0.4850
 epoch: 48, train_loss: 0.8454, test_loss: 0.9440, test_f1: 0.4886
 epoch: 49, train_loss: 0.8362, test_loss: 0.9622, test_f1: 0.4879
 epoch: 50, train_loss: 0.8343, test_loss: 0.9506, test_f1: 0.5032
 epoch: 51, train_loss: 0.8215, test_loss: 0.9540, test_f1: 0.4832
 epoch: 52, train_loss: 0.8232, test_loss: 0.9645, test_f1: 0.4871
 epoch: 53, train_loss: 0.8195, test_loss: 0.9717, test_f1: 0.4945
 epoch: 54, train_loss: 0.8258, test_loss: 0.9648, test_f1: 0.4862
 epoch: 55, train_loss: 0.7996, test_loss: 0.9650, test_f1: 0.4921
 epoch: 56, train_loss: 0.8067, test_loss: 0.9823, test_f1: 0.4699
 epoch: 57, train_loss: 0.8114, test_loss: 0.9776, test_f1: 0.4869
 epoch: 58, train_loss: 0.8052, test_loss: 0.9653, test_f1: 0.4925
 epoch: 59, train_loss: 0.8092, test_loss: 0.9673, test_f1: 0.4828
 epoch: 60, train_loss: 0.8084, test_loss: 0.9773, test_f1: 0.4603
 epoch: 61, train_loss: 0.8028, test_loss: 0.9767, test_f1: 0.4682
 epoch: 62, train_loss: 0.8041, test_loss: 0.9692, test_f1: 0.4921
 epoch: 63, train_loss: 0.7954, test_loss: 0.9802, test_f1: 0.4678
 epoch: 64, train_loss: 0.7997, test_loss: 0.9737, test_f1: 0.4771
 epoch: 65, train_loss: 0.8053, test_loss: 0.9829, test_f1: 0.4646
 epoch: 66, train_loss: 0.7858, test_loss: 0.9723, test_f1: 0.4851
 epoch: 67, train_loss: 0.7888, test_loss: 0.9811, test_f1: 0.4850
 epoch: 68, train_loss: 0.7865, test_loss: 0.9726, test_f1: 0.4904
 epoch: 69, train_loss: 0.7837, test_loss: 0.9821, test_f1: 0.4796
 epoch: 70, train_loss: 0.7795, test_loss: 0.9821, test_f1: 0.4898
 epoch: 71, train_loss: 0.7806, test_loss: 0.9756, test_f1: 0.4969
 epoch: 72, train_loss: 0.7875, test_loss: 0.9797, test_f1: 0.5039
 epoch: 73, train_loss: 0.7783, test_loss: 0.9822, test_f1: 0.4969
 epoch: 74, train_loss: 0.7646, test_loss: 0.9886, test_f1: 0.4731
 epoch: 75, train_loss: 0.7701, test_loss: 0.9889, test_f1: 0.5080
 epoch: 76, train_loss: 0.7723, test_loss: 0.9898, test_f1: 0.4949
 epoch: 77, train_loss: 0.7724, test_loss: 1.0035, test_f1: 0.4759
 epoch: 78, train_loss: 0.7754, test_loss: 0.9794, test_f1: 0.5021
 epoch: 79, train_loss: 0.7774, test_loss: 0.9901, test_f1: 0.5004
 epoch: 80, train_loss: 0.7625, test_loss: 0.9893, test_f1: 0.4966
 epoch: 81, train_loss: 0.7510, test_loss: 1.0012, test_f1: 0.4994
 epoch: 82, train_loss: 0.7667, test_loss: 1.0052, test_f1: 0.5015
 epoch: 83, train_loss: 0.7506, test_loss: 0.9996, test_f1: 0.4777
 epoch: 84, train_loss: 0.7617, test_loss: 0.9975, test_f1: 0.4869
 epoch: 85, train_loss: 0.7448, test_loss: 0.9932, test_f1: 0.4882
 epoch: 86, train_loss: 0.7533, test_loss: 0.9841, test_f1: 0.5044
 epoch: 87, train_loss: 0.7568, test_loss: 1.0010, test_f1: 0.4790
 epoch: 88, train_loss: 0.7535, test_loss: 0.9951, test_f1: 0.5134
 epoch: 89, train_loss: 0.7494, test_loss: 0.9940, test_f1: 0.5008
 epoch: 90, train_loss: 0.7467, test_loss: 0.9977, test_f1: 0.4947
 epoch: 91, train_loss: 0.7321, test_loss: 0.9890, test_f1: 0.5126
 epoch: 92, train_loss: 0.7475, test_loss: 0.9984, test_f1: 0.5060
 epoch: 93, train_loss: 0.7433, test_loss: 1.0226, test_f1: 0.4786
 epoch: 94, train_loss: 0.7380, test_loss: 1.0224, test_f1: 0.4770
 epoch: 95, train_loss: 0.7358, test_loss: 1.0120, test_f1: 0.5022
 epoch: 96, train_loss: 0.7275, test_loss: 1.0148, test_f1: 0.4933
 epoch: 97, train_loss: 0.7323, test_loss: 0.9943, test_f1: 0.5016
 epoch: 98, train_loss: 0.7229, test_loss: 1.0141, test_f1: 0.4988
 epoch: 99, train_loss: 0.7164, test_loss: 1.0083, test_f1: 0.4972
##################ITERATION #9 ****************************************
 epoch: 0, train_loss: 1.3580, test_loss: 1.2614, test_f1: 0.3221
 epoch: 1, train_loss: 1.2582, test_loss: 1.1885, test_f1: 0.3496
 epoch: 2, train_loss: 1.2177, test_loss: 1.1433, test_f1: 0.4364
 epoch: 3, train_loss: 1.1814, test_loss: 1.1022, test_f1: 0.4691
 epoch: 4, train_loss: 1.1634, test_loss: 1.0798, test_f1: 0.4773
 epoch: 5, train_loss: 1.1688, test_loss: 1.0673, test_f1: 0.4602
 epoch: 6, train_loss: 1.1413, test_loss: 1.0645, test_f1: 0.4766
 epoch: 7, train_loss: 1.1193, test_loss: 1.0530, test_f1: 0.4662
 epoch: 8, train_loss: 1.1106, test_loss: 1.0508, test_f1: 0.4623
 epoch: 9, train_loss: 1.1073, test_loss: 1.0452, test_f1: 0.4466
 epoch: 10, train_loss: 1.1047, test_loss: 1.0396, test_f1: 0.4419
 epoch: 11, train_loss: 1.0739, test_loss: 1.0338, test_f1: 0.4612
 epoch: 12, train_loss: 1.0787, test_loss: 1.0238, test_f1: 0.4588
 epoch: 13, train_loss: 1.0595, test_loss: 1.0200, test_f1: 0.4627
 epoch: 14, train_loss: 1.0531, test_loss: 1.0102, test_f1: 0.4814
 epoch: 15, train_loss: 1.0546, test_loss: 1.0084, test_f1: 0.4826
 epoch: 16, train_loss: 1.0489, test_loss: 1.0043, test_f1: 0.4883
 epoch: 17, train_loss: 1.0163, test_loss: 0.9997, test_f1: 0.4942
 epoch: 18, train_loss: 1.0292, test_loss: 0.9936, test_f1: 0.4927
 epoch: 19, train_loss: 1.0279, test_loss: 0.9879, test_f1: 0.4968
 epoch: 20, train_loss: 1.0113, test_loss: 0.9882, test_f1: 0.5016
 epoch: 21, train_loss: 1.0077, test_loss: 0.9981, test_f1: 0.4825
 epoch: 22, train_loss: 1.0042, test_loss: 0.9850, test_f1: 0.4856
 epoch: 23, train_loss: 0.9978, test_loss: 0.9883, test_f1: 0.4918
 epoch: 24, train_loss: 0.9848, test_loss: 0.9752, test_f1: 0.5065
 epoch: 25, train_loss: 0.9803, test_loss: 0.9709, test_f1: 0.5120
 epoch: 26, train_loss: 0.9732, test_loss: 0.9737, test_f1: 0.5155
 epoch: 27, train_loss: 0.9669, test_loss: 0.9726, test_f1: 0.5204
 epoch: 28, train_loss: 0.9633, test_loss: 0.9664, test_f1: 0.5159
 epoch: 29, train_loss: 0.9639, test_loss: 0.9838, test_f1: 0.4968
 epoch: 30, train_loss: 0.9411, test_loss: 0.9991, test_f1: 0.5009
 epoch: 31, train_loss: 0.9521, test_loss: 0.9623, test_f1: 0.5252
 epoch: 32, train_loss: 0.9503, test_loss: 1.0191, test_f1: 0.4917
 epoch: 33, train_loss: 0.9367, test_loss: 0.9994, test_f1: 0.5067
 epoch: 34, train_loss: 0.9414, test_loss: 0.9876, test_f1: 0.4921
 epoch: 35, train_loss: 0.9278, test_loss: 0.9977, test_f1: 0.4898
 epoch: 36, train_loss: 0.9181, test_loss: 1.0148, test_f1: 0.4920
 epoch: 37, train_loss: 0.9096, test_loss: 0.9730, test_f1: 0.4864
 epoch: 38, train_loss: 0.9102, test_loss: 1.0194, test_f1: 0.4857
 epoch: 39, train_loss: 0.9116, test_loss: 1.0234, test_f1: 0.4891
 epoch: 40, train_loss: 0.9012, test_loss: 0.9742, test_f1: 0.4952
 epoch: 41, train_loss: 0.9004, test_loss: 0.9967, test_f1: 0.4865
 epoch: 42, train_loss: 0.8920, test_loss: 1.0522, test_f1: 0.4819
 epoch: 43, train_loss: 0.8811, test_loss: 1.0084, test_f1: 0.4798
 epoch: 44, train_loss: 0.8788, test_loss: 1.1395, test_f1: 0.4643
 epoch: 45, train_loss: 0.8715, test_loss: 0.9593, test_f1: 0.4810
 epoch: 46, train_loss: 0.8726, test_loss: 1.1372, test_f1: 0.4703
 epoch: 47, train_loss: 0.8682, test_loss: 1.0419, test_f1: 0.4688
 epoch: 48, train_loss: 0.8649, test_loss: 1.1302, test_f1: 0.4494
 epoch: 49, train_loss: 0.8568, test_loss: 1.0496, test_f1: 0.4804
 epoch: 50, train_loss: 0.8512, test_loss: 1.1697, test_f1: 0.4810
 epoch: 51, train_loss: 0.8468, test_loss: 1.0858, test_f1: 0.4772
 epoch: 52, train_loss: 0.8485, test_loss: 1.0968, test_f1: 0.4830
 epoch: 53, train_loss: 0.8343, test_loss: 1.1181, test_f1: 0.4809
 epoch: 54, train_loss: 0.8446, test_loss: 1.0835, test_f1: 0.4786
 epoch: 55, train_loss: 0.8398, test_loss: 1.1370, test_f1: 0.4718
 epoch: 56, train_loss: 0.8239, test_loss: 1.0960, test_f1: 0.4779
 epoch: 57, train_loss: 0.8327, test_loss: 1.1479, test_f1: 0.4661
 epoch: 58, train_loss: 0.8292, test_loss: 1.1523, test_f1: 0.4700
 epoch: 59, train_loss: 0.8293, test_loss: 1.0663, test_f1: 0.4762
 epoch: 60, train_loss: 0.8196, test_loss: 1.0480, test_f1: 0.4815
 epoch: 61, train_loss: 0.8122, test_loss: 1.1328, test_f1: 0.4786
 epoch: 62, train_loss: 0.8125, test_loss: 1.1141, test_f1: 0.4795
 epoch: 63, train_loss: 0.8141, test_loss: 1.1138, test_f1: 0.4709
 epoch: 64, train_loss: 0.8141, test_loss: 1.1973, test_f1: 0.4574
 epoch: 65, train_loss: 0.8066, test_loss: 1.1490, test_f1: 0.4756
 epoch: 66, train_loss: 0.8168, test_loss: 1.1543, test_f1: 0.4719
 epoch: 67, train_loss: 0.8003, test_loss: 1.0802, test_f1: 0.4790
 epoch: 68, train_loss: 0.7993, test_loss: 1.1123, test_f1: 0.4800
 epoch: 69, train_loss: 0.8047, test_loss: 1.1567, test_f1: 0.4781
 epoch: 70, train_loss: 0.8070, test_loss: 1.1061, test_f1: 0.4885
 epoch: 71, train_loss: 0.8030, test_loss: 1.1699, test_f1: 0.4742
 epoch: 72, train_loss: 0.8017, test_loss: 1.1522, test_f1: 0.4809
 epoch: 73, train_loss: 0.7910, test_loss: 1.1521, test_f1: 0.4763
 epoch: 74, train_loss: 0.7872, test_loss: 1.2072, test_f1: 0.4700
 epoch: 75, train_loss: 0.7941, test_loss: 1.1958, test_f1: 0.4746
 epoch: 76, train_loss: 0.7917, test_loss: 1.1834, test_f1: 0.4680
 epoch: 77, train_loss: 0.7777, test_loss: 1.1207, test_f1: 0.4754
 epoch: 78, train_loss: 0.7749, test_loss: 1.1716, test_f1: 0.4795
 epoch: 79, train_loss: 0.7923, test_loss: 1.1494, test_f1: 0.4774
 epoch: 80, train_loss: 0.7725, test_loss: 1.1284, test_f1: 0.4850
 epoch: 81, train_loss: 0.7791, test_loss: 1.1106, test_f1: 0.4761
 epoch: 82, train_loss: 0.7687, test_loss: 1.1860, test_f1: 0.4821
 epoch: 83, train_loss: 0.7626, test_loss: 1.1279, test_f1: 0.4885
 epoch: 84, train_loss: 0.7655, test_loss: 1.2101, test_f1: 0.4824
 epoch: 85, train_loss: 0.7663, test_loss: 1.1625, test_f1: 0.4848
 epoch: 86, train_loss: 0.7537, test_loss: 1.2224, test_f1: 0.4747
 epoch: 87, train_loss: 0.7893, test_loss: 1.1250, test_f1: 0.4804
 epoch: 88, train_loss: 0.7654, test_loss: 1.1320, test_f1: 0.4860
 epoch: 89, train_loss: 0.7652, test_loss: 1.0969, test_f1: 0.4891
 epoch: 90, train_loss: 0.7584, test_loss: 1.1579, test_f1: 0.4867
 epoch: 91, train_loss: 0.7630, test_loss: 1.1240, test_f1: 0.4965
 epoch: 92, train_loss: 0.7617, test_loss: 1.1195, test_f1: 0.4905
 epoch: 93, train_loss: 0.7551, test_loss: 1.1061, test_f1: 0.4986
 epoch: 94, train_loss: 0.7463, test_loss: 1.1625, test_f1: 0.4889
 epoch: 95, train_loss: 0.7463, test_loss: 1.1671, test_f1: 0.4923
 epoch: 96, train_loss: 0.7471, test_loss: 1.0964, test_f1: 0.5062
 epoch: 97, train_loss: 0.7313, test_loss: 1.1077, test_f1: 0.4978
 epoch: 98, train_loss: 0.7460, test_loss: 1.0887, test_f1: 0.4975
 epoch: 99, train_loss: 0.7371, test_loss: 1.0971, test_f1: 0.4985

Training completed in 365.25 seconds
Best F1: 0.5533 at epoch 95
Mean F1 across iterations: 0.5327  0.0160
========================FINAL RESULTS================================
FEGIN weighted F1: 0.5533  0.0160
python main.py --data ltspice_examples --representation component_component --model FEGIN --layers 2 --hiddens 128 --batch_size 256 --lr 0.0001 --emb_size 128 --epochs 100 --save_appendix component_component_L2_H128_BS256_LR0.0001_E128 --no_val
-----



STDERR:
  File "main.py", line 370, in <module>
    main()
  File "main.py", line 254, in main
    dataset = dataset_class(
  File "/home/philip/projects/ltspice_examples_code_repo/Circuit-Completion-Using-GNNs/component_classification_with_link_prediction_head/evaluation/FEGIN/kernel/circuit_datasets.py", line 15, in __init__
    self.data, self.slices = torch.load(self.processed_paths[0])
  File "/home/philip/.local/lib/python3.8/site-packages/torch/serialization.py", line 1040, in load
    warnings.warn(
  File "/usr/lib/python3.8/warnings.py", line 109, in _showwarnmsg
    sw(msg.message, msg.category, msg.filename, msg.lineno,
  File "main.py", line 47, in warn_with_traceback
    traceback.print_stack(file=log)
/home/philip/projects/ltspice_examples_code_repo/Circuit-Completion-Using-GNNs/component_classification_with_link_prediction_head/evaluation/FEGIN/kernel/circuit_datasets.py:15: FutureWarning: You are using `torch.load` with `weights_only=False` (the current default value), which uses the default pickle module implicitly. It is possible to construct malicious pickle data which will execute arbitrary code during unpickling (See https://github.com/pytorch/pytorch/blob/main/SECURITY.md#untrusted-models for more details). In a future release, the default value for `weights_only` will be flipped to `True`. This limits the functions that could be executed during unpickling. Arbitrary objects will no longer be allowed to be loaded via this mode unless they are explicitly allowlisted by the user via `torch.serialization.add_safe_globals`. We recommend you start setting `weights_only=True` for any use case where you don't have full control of the loaded file. Please open an issue on GitHub for any issues related to this experimental feature.
  self.data, self.slices = torch.load(self.processed_paths[0])
