STDOUT:
Results will be saved in /home/philip/projects/ltspice_examples_code_repo/Circuit-Completion-Using-GNNs/component_classification_with_link_prediction_head/evaluation/FEGIN/results/model_FEGIN_dataset_ltspice_examples
Command line input: python main.py --data ltspice_examples --representation component_pin --model FEGIN --layers 6 --hiddens 32 --batch_size 64 --lr 0.01 --emb_size 250 --epochs 100 --save_appendix component_pin_L6_H32_BS64_LR0.01_E250 --no_val
 is saved.
-----
ltspice_examples - FEGIN
Using 6 layers, 32 hidden units, h = 2
Loading component_pin representation dataset
ENTERED
Training FEGIN on component_pin representation
Train: 3560, Test: 848
##################ITERATION #0 ****************************************
 epoch: 0, train_loss: 1.1826, test_loss: 2.9897, test_f1: 0.2047
 epoch: 1, train_loss: 1.0430, test_loss: 1.0232, test_f1: 0.3850
 epoch: 2, train_loss: 1.0123, test_loss: 1.0222, test_f1: 0.5235
 epoch: 3, train_loss: 0.9801, test_loss: 0.9385, test_f1: 0.4898
 epoch: 4, train_loss: 0.9881, test_loss: 0.9684, test_f1: 0.4653
 epoch: 5, train_loss: 0.9288, test_loss: 0.9032, test_f1: 0.5480
 epoch: 6, train_loss: 0.9265, test_loss: 1.0698, test_f1: 0.4668
 epoch: 7, train_loss: 0.9185, test_loss: 0.8458, test_f1: 0.5118
 epoch: 8, train_loss: 0.8973, test_loss: 0.8625, test_f1: 0.5374
 epoch: 9, train_loss: 0.8871, test_loss: 0.8509, test_f1: 0.5321
 epoch: 10, train_loss: 0.8608, test_loss: 0.9110, test_f1: 0.5066
 epoch: 11, train_loss: 0.8589, test_loss: 0.9804, test_f1: 0.4649
 epoch: 12, train_loss: 0.8532, test_loss: 0.9766, test_f1: 0.5832
 epoch: 13, train_loss: 0.8414, test_loss: 0.9511, test_f1: 0.5264
 epoch: 14, train_loss: 0.8338, test_loss: 0.8312, test_f1: 0.5776
 epoch: 15, train_loss: 0.8220, test_loss: 0.9408, test_f1: 0.5235
 epoch: 16, train_loss: 0.8004, test_loss: 0.8889, test_f1: 0.5429
 epoch: 17, train_loss: 0.8138, test_loss: 0.8938, test_f1: 0.5348
 epoch: 18, train_loss: 0.8262, test_loss: 0.9358, test_f1: 0.4956
 epoch: 19, train_loss: 0.8120, test_loss: 0.8504, test_f1: 0.5445
 epoch: 20, train_loss: 0.8040, test_loss: 0.8758, test_f1: 0.5391
 epoch: 21, train_loss: 0.8081, test_loss: 0.8923, test_f1: 0.5253
 epoch: 22, train_loss: 0.8030, test_loss: 0.8539, test_f1: 0.5499
 epoch: 23, train_loss: 0.7947, test_loss: 0.8823, test_f1: 0.6069
 epoch: 24, train_loss: 0.7849, test_loss: 1.0692, test_f1: 0.4681
 epoch: 25, train_loss: 0.7955, test_loss: 0.8915, test_f1: 0.5417
 epoch: 26, train_loss: 0.7952, test_loss: 0.9521, test_f1: 0.4747
 epoch: 27, train_loss: 0.7803, test_loss: 1.0074, test_f1: 0.5251
 epoch: 28, train_loss: 0.7689, test_loss: 0.9396, test_f1: 0.5351
 epoch: 29, train_loss: 0.7754, test_loss: 0.8661, test_f1: 0.5646
 epoch: 30, train_loss: 0.7642, test_loss: 0.9901, test_f1: 0.5500
 epoch: 31, train_loss: 0.7622, test_loss: 0.8718, test_f1: 0.5949
 epoch: 32, train_loss: 0.7616, test_loss: 0.8673, test_f1: 0.5503
 epoch: 33, train_loss: 0.7453, test_loss: 0.9104, test_f1: 0.5435
 epoch: 34, train_loss: 0.7373, test_loss: 1.1437, test_f1: 0.4940
 epoch: 35, train_loss: 0.7356, test_loss: 0.8770, test_f1: 0.5817
 epoch: 36, train_loss: 0.7399, test_loss: 0.9707, test_f1: 0.5730
 epoch: 37, train_loss: 0.7592, test_loss: 0.7854, test_f1: 0.5683
 epoch: 38, train_loss: 0.7597, test_loss: 0.7864, test_f1: 0.5731
 epoch: 39, train_loss: 0.7327, test_loss: 0.9114, test_f1: 0.5332
 epoch: 40, train_loss: 0.7457, test_loss: 0.9440, test_f1: 0.5398
 epoch: 41, train_loss: 0.7241, test_loss: 0.8555, test_f1: 0.5678
 epoch: 42, train_loss: 0.7210, test_loss: 0.8212, test_f1: 0.5729
 epoch: 43, train_loss: 0.7229, test_loss: 0.8643, test_f1: 0.5858
 epoch: 44, train_loss: 0.7116, test_loss: 0.8054, test_f1: 0.5946
 epoch: 45, train_loss: 0.6916, test_loss: 0.8396, test_f1: 0.5672
 epoch: 46, train_loss: 0.7152, test_loss: 0.9743, test_f1: 0.6091
 epoch: 47, train_loss: 0.6971, test_loss: 1.0039, test_f1: 0.5681
 epoch: 48, train_loss: 0.7006, test_loss: 0.8741, test_f1: 0.6149
 epoch: 49, train_loss: 0.7021, test_loss: 0.8834, test_f1: 0.6246
 epoch: 50, train_loss: 0.7008, test_loss: 0.7845, test_f1: 0.6343
 epoch: 51, train_loss: 0.6845, test_loss: 0.8994, test_f1: 0.5787
 epoch: 52, train_loss: 0.6571, test_loss: 0.9184, test_f1: 0.6355
 epoch: 53, train_loss: 0.6547, test_loss: 0.7913, test_f1: 0.6050
 epoch: 54, train_loss: 0.6401, test_loss: 0.8846, test_f1: 0.6287
 epoch: 55, train_loss: 0.6394, test_loss: 0.8804, test_f1: 0.5983
 epoch: 56, train_loss: 0.6405, test_loss: 0.9247, test_f1: 0.5987
 epoch: 57, train_loss: 0.6440, test_loss: 0.9963, test_f1: 0.6025
 epoch: 58, train_loss: 0.6293, test_loss: 0.8396, test_f1: 0.5970
 epoch: 59, train_loss: 0.6206, test_loss: 0.8664, test_f1: 0.6263
 epoch: 60, train_loss: 0.6416, test_loss: 0.9620, test_f1: 0.6396
 epoch: 61, train_loss: 0.6416, test_loss: 0.9100, test_f1: 0.6413
 epoch: 62, train_loss: 0.6310, test_loss: 0.8043, test_f1: 0.6277
 epoch: 63, train_loss: 0.6329, test_loss: 1.0001, test_f1: 0.6263
 epoch: 64, train_loss: 0.6150, test_loss: 0.8579, test_f1: 0.6449
 epoch: 65, train_loss: 0.6345, test_loss: 0.9207, test_f1: 0.6374
 epoch: 66, train_loss: 0.6213, test_loss: 0.9260, test_f1: 0.6270
 epoch: 67, train_loss: 0.6118, test_loss: 0.9344, test_f1: 0.5856
 epoch: 68, train_loss: 0.6198, test_loss: 0.9837, test_f1: 0.5922
 epoch: 69, train_loss: 0.6203, test_loss: 0.8847, test_f1: 0.6134
 epoch: 70, train_loss: 0.6222, test_loss: 0.8617, test_f1: 0.6338
 epoch: 71, train_loss: 0.6035, test_loss: 0.8866, test_f1: 0.6091
 epoch: 72, train_loss: 0.6126, test_loss: 1.0741, test_f1: 0.6116
 epoch: 73, train_loss: 0.6187, test_loss: 0.9478, test_f1: 0.6163
 epoch: 74, train_loss: 0.6077, test_loss: 0.8906, test_f1: 0.6255
 epoch: 75, train_loss: 0.6142, test_loss: 0.9117, test_f1: 0.6196
 epoch: 76, train_loss: 0.5962, test_loss: 0.9435, test_f1: 0.6633
 epoch: 77, train_loss: 0.6011, test_loss: 0.9790, test_f1: 0.6411
 epoch: 78, train_loss: 0.5931, test_loss: 2.4057, test_f1: 0.3191
 epoch: 79, train_loss: 0.7887, test_loss: 0.8500, test_f1: 0.5599
 epoch: 80, train_loss: 0.6546, test_loss: 0.8226, test_f1: 0.6019
 epoch: 81, train_loss: 0.6262, test_loss: 0.8666, test_f1: 0.6214
 epoch: 82, train_loss: 0.5924, test_loss: 0.9882, test_f1: 0.6195
 epoch: 83, train_loss: 0.6048, test_loss: 0.9274, test_f1: 0.6585
 epoch: 84, train_loss: 0.6138, test_loss: 0.8181, test_f1: 0.6064
 epoch: 85, train_loss: 0.5874, test_loss: 0.7952, test_f1: 0.6497
 epoch: 86, train_loss: 0.5972, test_loss: 0.8200, test_f1: 0.6575
 epoch: 87, train_loss: 0.5907, test_loss: 0.8349, test_f1: 0.6662
 epoch: 88, train_loss: 0.5933, test_loss: 0.9157, test_f1: 0.6215
 epoch: 89, train_loss: 0.5969, test_loss: 0.8258, test_f1: 0.6424
 epoch: 90, train_loss: 0.5699, test_loss: 1.1914, test_f1: 0.6228
 epoch: 91, train_loss: 0.5866, test_loss: 0.8297, test_f1: 0.6395
 epoch: 92, train_loss: 0.6011, test_loss: 0.8119, test_f1: 0.6290
 epoch: 93, train_loss: 0.5751, test_loss: 0.8386, test_f1: 0.6349
 epoch: 94, train_loss: 0.5848, test_loss: 0.8416, test_f1: 0.6300
 epoch: 95, train_loss: 0.5643, test_loss: 0.9587, test_f1: 0.6117
 epoch: 96, train_loss: 0.5900, test_loss: 0.9642, test_f1: 0.6710
 epoch: 97, train_loss: 0.5741, test_loss: 0.7595, test_f1: 0.6646
 epoch: 98, train_loss: 0.5801, test_loss: 0.8185, test_f1: 0.6451
 epoch: 99, train_loss: 0.5947, test_loss: 0.8548, test_f1: 0.6238
##################ITERATION #1 ****************************************
 epoch: 0, train_loss: 1.1165, test_loss: 1.0874, test_f1: 0.4322
 epoch: 1, train_loss: 1.0119, test_loss: 1.0180, test_f1: 0.4669
 epoch: 2, train_loss: 0.9754, test_loss: 0.9945, test_f1: 0.5018
 epoch: 3, train_loss: 0.9734, test_loss: 1.0436, test_f1: 0.4793
 epoch: 4, train_loss: 0.9507, test_loss: 0.9479, test_f1: 0.5472
 epoch: 5, train_loss: 0.9204, test_loss: 0.9871, test_f1: 0.5093
 epoch: 6, train_loss: 0.9176, test_loss: 0.9403, test_f1: 0.5602
 epoch: 7, train_loss: 0.8856, test_loss: 1.5255, test_f1: 0.3777
 epoch: 8, train_loss: 0.9046, test_loss: 0.9559, test_f1: 0.5294
 epoch: 9, train_loss: 0.8622, test_loss: 0.9841, test_f1: 0.4546
 epoch: 10, train_loss: 0.8698, test_loss: 0.9117, test_f1: 0.5154
 epoch: 11, train_loss: 0.8793, test_loss: 0.8907, test_f1: 0.5226
 epoch: 12, train_loss: 0.8505, test_loss: 0.9714, test_f1: 0.5219
 epoch: 13, train_loss: 0.8562, test_loss: 0.9037, test_f1: 0.5106
 epoch: 14, train_loss: 0.8343, test_loss: 0.8365, test_f1: 0.5158
 epoch: 15, train_loss: 0.8299, test_loss: 0.8584, test_f1: 0.5900
 epoch: 16, train_loss: 0.8446, test_loss: 1.3219, test_f1: 0.4550
 epoch: 17, train_loss: 0.8583, test_loss: 0.9885, test_f1: 0.5146
 epoch: 18, train_loss: 0.8310, test_loss: 0.9880, test_f1: 0.5557
 epoch: 19, train_loss: 0.8118, test_loss: 0.9629, test_f1: 0.5247
 epoch: 20, train_loss: 0.8154, test_loss: 0.8904, test_f1: 0.5378
 epoch: 21, train_loss: 0.8167, test_loss: 0.9472, test_f1: 0.5033
 epoch: 22, train_loss: 0.8063, test_loss: 0.9122, test_f1: 0.5592
 epoch: 23, train_loss: 0.7818, test_loss: 0.8667, test_f1: 0.6029
 epoch: 24, train_loss: 0.7784, test_loss: 0.9088, test_f1: 0.5836
 epoch: 25, train_loss: 0.7772, test_loss: 0.9910, test_f1: 0.5406
 epoch: 26, train_loss: 0.7747, test_loss: 0.9543, test_f1: 0.5503
 epoch: 27, train_loss: 0.7686, test_loss: 1.0418, test_f1: 0.4676
 epoch: 28, train_loss: 0.7809, test_loss: 0.9562, test_f1: 0.5280
 epoch: 29, train_loss: 0.7805, test_loss: 0.8810, test_f1: 0.5521
 epoch: 30, train_loss: 0.7673, test_loss: 0.8434, test_f1: 0.5764
 epoch: 31, train_loss: 0.7396, test_loss: 1.0378, test_f1: 0.5288
 epoch: 32, train_loss: 0.7639, test_loss: 0.8874, test_f1: 0.5857
 epoch: 33, train_loss: 0.7363, test_loss: 1.0193, test_f1: 0.5320
 epoch: 34, train_loss: 0.7527, test_loss: 0.8716, test_f1: 0.6101
 epoch: 35, train_loss: 0.7480, test_loss: 0.9698, test_f1: 0.5363
 epoch: 36, train_loss: 0.7477, test_loss: 0.9238, test_f1: 0.5379
 epoch: 37, train_loss: 0.7312, test_loss: 0.8971, test_f1: 0.6053
 epoch: 38, train_loss: 0.7348, test_loss: 0.8318, test_f1: 0.5840
 epoch: 39, train_loss: 0.7230, test_loss: 0.8902, test_f1: 0.6220
 epoch: 40, train_loss: 0.7393, test_loss: 1.3091, test_f1: 0.4640
 epoch: 41, train_loss: 0.7627, test_loss: 0.8493, test_f1: 0.5708
 epoch: 42, train_loss: 0.7478, test_loss: 1.0866, test_f1: 0.5361
 epoch: 43, train_loss: 0.7381, test_loss: 0.9467, test_f1: 0.5996
 epoch: 44, train_loss: 0.7394, test_loss: 0.8598, test_f1: 0.5954
 epoch: 45, train_loss: 0.7346, test_loss: 0.8935, test_f1: 0.5844
 epoch: 46, train_loss: 0.7220, test_loss: 0.9870, test_f1: 0.5529
 epoch: 47, train_loss: 0.7000, test_loss: 0.9595, test_f1: 0.5510
 epoch: 48, train_loss: 0.7098, test_loss: 0.9281, test_f1: 0.6184
 epoch: 49, train_loss: 0.7221, test_loss: 0.8724, test_f1: 0.5912
 epoch: 50, train_loss: 0.7205, test_loss: 0.9477, test_f1: 0.5531
 epoch: 51, train_loss: 0.6774, test_loss: 0.9850, test_f1: 0.5746
 epoch: 52, train_loss: 0.6684, test_loss: 0.9294, test_f1: 0.5886
 epoch: 53, train_loss: 0.6621, test_loss: 0.9453, test_f1: 0.5828
 epoch: 54, train_loss: 0.6463, test_loss: 0.9124, test_f1: 0.5770
 epoch: 55, train_loss: 0.6384, test_loss: 0.9646, test_f1: 0.5869
 epoch: 56, train_loss: 0.6455, test_loss: 0.8705, test_f1: 0.6137
 epoch: 57, train_loss: 0.6386, test_loss: 1.1094, test_f1: 0.5870
 epoch: 58, train_loss: 0.6422, test_loss: 1.0255, test_f1: 0.6020
 epoch: 59, train_loss: 0.6460, test_loss: 0.8901, test_f1: 0.5857
 epoch: 60, train_loss: 0.6432, test_loss: 0.9741, test_f1: 0.5938
 epoch: 61, train_loss: 0.6308, test_loss: 0.9056, test_f1: 0.6111
 epoch: 62, train_loss: 0.6418, test_loss: 0.8885, test_f1: 0.5931
 epoch: 63, train_loss: 0.6326, test_loss: 0.8778, test_f1: 0.6186
 epoch: 64, train_loss: 0.6379, test_loss: 0.9840, test_f1: 0.5812
 epoch: 65, train_loss: 0.6252, test_loss: 1.0024, test_f1: 0.5945
 epoch: 66, train_loss: 0.6396, test_loss: 0.9117, test_f1: 0.6242
 epoch: 67, train_loss: 0.6129, test_loss: 1.0609, test_f1: 0.5799
 epoch: 68, train_loss: 0.6159, test_loss: 1.0076, test_f1: 0.5938
 epoch: 69, train_loss: 0.6163, test_loss: 0.9016, test_f1: 0.6186
 epoch: 70, train_loss: 0.6241, test_loss: 1.0122, test_f1: 0.6114
 epoch: 71, train_loss: 0.6213, test_loss: 1.0146, test_f1: 0.6095
 epoch: 72, train_loss: 0.6100, test_loss: 0.9733, test_f1: 0.6146
 epoch: 73, train_loss: 0.6074, test_loss: 0.9834, test_f1: 0.6136
 epoch: 74, train_loss: 0.6404, test_loss: 0.9710, test_f1: 0.6562
 epoch: 75, train_loss: 0.6058, test_loss: 1.0189, test_f1: 0.6381
 epoch: 76, train_loss: 0.6110, test_loss: 1.0085, test_f1: 0.6391
 epoch: 77, train_loss: 0.6089, test_loss: 1.0495, test_f1: 0.5964
 epoch: 78, train_loss: 0.6041, test_loss: 1.0403, test_f1: 0.6480
 epoch: 79, train_loss: 0.5995, test_loss: 0.9179, test_f1: 0.6601
 epoch: 80, train_loss: 0.5964, test_loss: 1.1011, test_f1: 0.5826
 epoch: 81, train_loss: 0.5907, test_loss: 1.0687, test_f1: 0.6410
 epoch: 82, train_loss: 0.6008, test_loss: 0.9922, test_f1: 0.6513
 epoch: 83, train_loss: 0.6124, test_loss: 0.8361, test_f1: 0.6312
 epoch: 84, train_loss: 0.6047, test_loss: 1.0625, test_f1: 0.6092
 epoch: 85, train_loss: 0.5824, test_loss: 0.9581, test_f1: 0.6470
 epoch: 86, train_loss: 0.5857, test_loss: 0.9982, test_f1: 0.5988
 epoch: 87, train_loss: 0.6036, test_loss: 0.8716, test_f1: 0.6071
 epoch: 88, train_loss: 0.5921, test_loss: 1.0685, test_f1: 0.6337
 epoch: 89, train_loss: 0.6014, test_loss: 0.9618, test_f1: 0.6378
 epoch: 90, train_loss: 0.5699, test_loss: 1.2033, test_f1: 0.6382
 epoch: 91, train_loss: 0.5845, test_loss: 1.0377, test_f1: 0.6230
 epoch: 92, train_loss: 0.5976, test_loss: 1.0699, test_f1: 0.6000
 epoch: 93, train_loss: 0.5819, test_loss: 1.1238, test_f1: 0.6269
 epoch: 94, train_loss: 0.5875, test_loss: 1.0298, test_f1: 0.6480
 epoch: 95, train_loss: 0.5680, test_loss: 1.1054, test_f1: 0.6374
 epoch: 96, train_loss: 0.5837, test_loss: 1.0478, test_f1: 0.6364
 epoch: 97, train_loss: 0.5875, test_loss: 0.9811, test_f1: 0.6216
 epoch: 98, train_loss: 0.5663, test_loss: 1.0446, test_f1: 0.6400
 epoch: 99, train_loss: 0.5698, test_loss: 0.9470, test_f1: 0.6664
##################ITERATION #2 ****************************************
 epoch: 0, train_loss: 1.1421, test_loss: 1.0551, test_f1: 0.3968
 epoch: 1, train_loss: 1.0555, test_loss: 1.0096, test_f1: 0.4652
 epoch: 2, train_loss: 1.0297, test_loss: 1.0905, test_f1: 0.4161
 epoch: 3, train_loss: 0.9950, test_loss: 1.0659, test_f1: 0.4744
 epoch: 4, train_loss: 0.9726, test_loss: 1.0121, test_f1: 0.4602
 epoch: 5, train_loss: 0.9580, test_loss: 1.1099, test_f1: 0.5230
 epoch: 6, train_loss: 0.9608, test_loss: 1.0604, test_f1: 0.4863
 epoch: 7, train_loss: 0.9528, test_loss: 1.0309, test_f1: 0.5094
 epoch: 8, train_loss: 0.9263, test_loss: 0.9490, test_f1: 0.5009
 epoch: 9, train_loss: 0.9487, test_loss: 0.9743, test_f1: 0.4923
 epoch: 10, train_loss: 0.9227, test_loss: 0.9756, test_f1: 0.5060
 epoch: 11, train_loss: 0.9101, test_loss: 0.9117, test_f1: 0.5309
 epoch: 12, train_loss: 0.9075, test_loss: 0.9588, test_f1: 0.5159
 epoch: 13, train_loss: 0.8960, test_loss: 0.9152, test_f1: 0.5021
 epoch: 14, train_loss: 0.8861, test_loss: 0.9396, test_f1: 0.5164
 epoch: 15, train_loss: 0.8660, test_loss: 0.9142, test_f1: 0.4997
 epoch: 16, train_loss: 0.8590, test_loss: 0.9154, test_f1: 0.5152
 epoch: 17, train_loss: 0.8657, test_loss: 1.1711, test_f1: 0.4863
 epoch: 18, train_loss: 0.8607, test_loss: 0.9734, test_f1: 0.5681
 epoch: 19, train_loss: 0.8549, test_loss: 0.9425, test_f1: 0.5343
 epoch: 20, train_loss: 0.8488, test_loss: 0.9087, test_f1: 0.5231
 epoch: 21, train_loss: 0.8323, test_loss: 0.8919, test_f1: 0.5362
 epoch: 22, train_loss: 0.8281, test_loss: 0.9173, test_f1: 0.5579
 epoch: 23, train_loss: 0.8086, test_loss: 0.9156, test_f1: 0.5226
 epoch: 24, train_loss: 0.8285, test_loss: 0.9843, test_f1: 0.5444
 epoch: 25, train_loss: 0.8283, test_loss: 1.1346, test_f1: 0.4629
 epoch: 26, train_loss: 0.8021, test_loss: 0.8318, test_f1: 0.5512
 epoch: 27, train_loss: 0.8024, test_loss: 0.9229, test_f1: 0.5368
 epoch: 28, train_loss: 0.8096, test_loss: 0.8841, test_f1: 0.5337
 epoch: 29, train_loss: 0.8031, test_loss: 0.8735, test_f1: 0.5492
 epoch: 30, train_loss: 0.8037, test_loss: 0.9225, test_f1: 0.4942
 epoch: 31, train_loss: 0.7778, test_loss: 0.8345, test_f1: 0.5408
 epoch: 32, train_loss: 0.7792, test_loss: 0.8926, test_f1: 0.5481
 epoch: 33, train_loss: 0.7705, test_loss: 0.8600, test_f1: 0.5536
 epoch: 34, train_loss: 0.7745, test_loss: 1.2250, test_f1: 0.5327
 epoch: 35, train_loss: 0.7717, test_loss: 1.0039, test_f1: 0.5510
 epoch: 36, train_loss: 0.7685, test_loss: 0.9024, test_f1: 0.5636
 epoch: 37, train_loss: 0.7932, test_loss: 0.8256, test_f1: 0.5684
 epoch: 38, train_loss: 0.7650, test_loss: 0.9632, test_f1: 0.5602
 epoch: 39, train_loss: 0.7475, test_loss: 0.9416, test_f1: 0.5451
 epoch: 40, train_loss: 0.7382, test_loss: 1.0803, test_f1: 0.4964
 epoch: 41, train_loss: 0.7539, test_loss: 0.8802, test_f1: 0.5451
 epoch: 42, train_loss: 0.7551, test_loss: 1.0253, test_f1: 0.6224
 epoch: 43, train_loss: 0.7551, test_loss: 1.0263, test_f1: 0.5599
 epoch: 44, train_loss: 0.7391, test_loss: 0.7723, test_f1: 0.5958
 epoch: 45, train_loss: 0.7369, test_loss: 1.0643, test_f1: 0.5964
 epoch: 46, train_loss: 0.7509, test_loss: 0.8977, test_f1: 0.5253
 epoch: 47, train_loss: 0.7384, test_loss: 0.9578, test_f1: 0.5748
 epoch: 48, train_loss: 0.7372, test_loss: 0.9512, test_f1: 0.5348
 epoch: 49, train_loss: 0.7166, test_loss: 0.9146, test_f1: 0.5727
 epoch: 50, train_loss: 0.7226, test_loss: 0.8289, test_f1: 0.5964
 epoch: 51, train_loss: 0.6879, test_loss: 0.8996, test_f1: 0.5822
 epoch: 52, train_loss: 0.6813, test_loss: 0.8817, test_f1: 0.6441
 epoch: 53, train_loss: 0.6717, test_loss: 1.0049, test_f1: 0.5981
 epoch: 54, train_loss: 0.6862, test_loss: 0.9155, test_f1: 0.5961
 epoch: 55, train_loss: 0.6683, test_loss: 0.9402, test_f1: 0.6312
 epoch: 56, train_loss: 0.6527, test_loss: 0.9730, test_f1: 0.6114
 epoch: 57, train_loss: 0.6561, test_loss: 0.8757, test_f1: 0.6263
 epoch: 58, train_loss: 0.6535, test_loss: 0.9733, test_f1: 0.6389
 epoch: 59, train_loss: 0.6670, test_loss: 0.9401, test_f1: 0.6068
 epoch: 60, train_loss: 0.6574, test_loss: 1.0101, test_f1: 0.5939
 epoch: 61, train_loss: 0.6505, test_loss: 1.0593, test_f1: 0.6126
 epoch: 62, train_loss: 0.6487, test_loss: 0.8292, test_f1: 0.6292
 epoch: 63, train_loss: 0.6462, test_loss: 0.9764, test_f1: 0.6362
 epoch: 64, train_loss: 0.6468, test_loss: 1.0441, test_f1: 0.6064
 epoch: 65, train_loss: 0.6425, test_loss: 0.9974, test_f1: 0.6079
 epoch: 66, train_loss: 0.6461, test_loss: 0.9875, test_f1: 0.5934
 epoch: 67, train_loss: 0.6365, test_loss: 0.9175, test_f1: 0.6060
 epoch: 68, train_loss: 0.6509, test_loss: 0.9876, test_f1: 0.6036
 epoch: 69, train_loss: 0.6283, test_loss: 1.1139, test_f1: 0.5955
 epoch: 70, train_loss: 0.6334, test_loss: 0.9973, test_f1: 0.6029
 epoch: 71, train_loss: 0.6217, test_loss: 1.1118, test_f1: 0.6347
 epoch: 72, train_loss: 0.6195, test_loss: 0.9523, test_f1: 0.6500
 epoch: 73, train_loss: 0.6146, test_loss: 1.0758, test_f1: 0.6422
 epoch: 74, train_loss: 0.6340, test_loss: 0.8776, test_f1: 0.6655
 epoch: 75, train_loss: 0.6237, test_loss: 1.0406, test_f1: 0.6115
 epoch: 76, train_loss: 0.6291, test_loss: 0.8970, test_f1: 0.6412
 epoch: 77, train_loss: 0.6310, test_loss: 0.8661, test_f1: 0.6389
 epoch: 78, train_loss: 0.6175, test_loss: 0.8970, test_f1: 0.6568
 epoch: 79, train_loss: 0.6242, test_loss: 0.8645, test_f1: 0.6335
 epoch: 80, train_loss: 0.6218, test_loss: 0.7930, test_f1: 0.6456
 epoch: 81, train_loss: 0.6168, test_loss: 0.8367, test_f1: 0.6326
 epoch: 82, train_loss: 0.6176, test_loss: 0.8724, test_f1: 0.6696
 epoch: 83, train_loss: 0.6314, test_loss: 0.9404, test_f1: 0.6404
 epoch: 84, train_loss: 0.6157, test_loss: 0.9230, test_f1: 0.6297
 epoch: 85, train_loss: 0.5927, test_loss: 0.9528, test_f1: 0.6507
 epoch: 86, train_loss: 0.6115, test_loss: 0.9891, test_f1: 0.6173
 epoch: 87, train_loss: 0.6034, test_loss: 0.9940, test_f1: 0.6462
 epoch: 88, train_loss: 0.6107, test_loss: 0.8967, test_f1: 0.6382
 epoch: 89, train_loss: 0.5934, test_loss: 0.9698, test_f1: 0.6581
 epoch: 90, train_loss: 0.6095, test_loss: 0.8712, test_f1: 0.6369
 epoch: 91, train_loss: 0.5970, test_loss: 1.0639, test_f1: 0.6079
 epoch: 92, train_loss: 0.6076, test_loss: 1.0064, test_f1: 0.6460
 epoch: 93, train_loss: 0.6129, test_loss: 1.0051, test_f1: 0.6280
 epoch: 94, train_loss: 0.6014, test_loss: 1.0425, test_f1: 0.6039
 epoch: 95, train_loss: 0.5972, test_loss: 0.9965, test_f1: 0.6468
 epoch: 96, train_loss: 0.5834, test_loss: 1.1027, test_f1: 0.5988
 epoch: 97, train_loss: 0.5974, test_loss: 0.9363, test_f1: 0.6411
 epoch: 98, train_loss: 0.5913, test_loss: 1.0003, test_f1: 0.6165
 epoch: 99, train_loss: 0.5759, test_loss: 1.0302, test_f1: 0.6685
##################ITERATION #3 ****************************************
 epoch: 0, train_loss: 1.1329, test_loss: 1.0796, test_f1: 0.3554
 epoch: 1, train_loss: 1.0214, test_loss: 0.9897, test_f1: 0.4967
 epoch: 2, train_loss: 0.9861, test_loss: 1.0071, test_f1: 0.5144
 epoch: 3, train_loss: 0.9545, test_loss: 0.9769, test_f1: 0.5463
 epoch: 4, train_loss: 0.9415, test_loss: 1.0371, test_f1: 0.4919
 epoch: 5, train_loss: 0.9147, test_loss: 0.9629, test_f1: 0.5212
 epoch: 6, train_loss: 0.8948, test_loss: 0.9587, test_f1: 0.5177
 epoch: 7, train_loss: 0.8728, test_loss: 1.0209, test_f1: 0.5590
 epoch: 8, train_loss: 0.8615, test_loss: 0.9153, test_f1: 0.5551
 epoch: 9, train_loss: 0.8690, test_loss: 0.9891, test_f1: 0.5120
 epoch: 10, train_loss: 0.8418, test_loss: 1.0795, test_f1: 0.4597
 epoch: 11, train_loss: 0.8609, test_loss: 0.8997, test_f1: 0.5673
 epoch: 12, train_loss: 0.8447, test_loss: 0.8595, test_f1: 0.5701
 epoch: 13, train_loss: 0.8091, test_loss: 0.8295, test_f1: 0.5439
 epoch: 14, train_loss: 0.8143, test_loss: 0.8842, test_f1: 0.5263
 epoch: 15, train_loss: 0.8009, test_loss: 0.8497, test_f1: 0.5947
 epoch: 16, train_loss: 0.8219, test_loss: 0.8777, test_f1: 0.5846
 epoch: 17, train_loss: 0.8069, test_loss: 0.8425, test_f1: 0.6099
 epoch: 18, train_loss: 0.7856, test_loss: 0.9335, test_f1: 0.5220
 epoch: 19, train_loss: 0.8025, test_loss: 0.8645, test_f1: 0.5400
 epoch: 20, train_loss: 0.7850, test_loss: 0.8419, test_f1: 0.5961
 epoch: 21, train_loss: 0.8002, test_loss: 0.8484, test_f1: 0.5549
 epoch: 22, train_loss: 0.7927, test_loss: 0.8973, test_f1: 0.5947
 epoch: 23, train_loss: 0.7750, test_loss: 0.8243, test_f1: 0.5609
 epoch: 24, train_loss: 0.7772, test_loss: 0.8852, test_f1: 0.5243
 epoch: 25, train_loss: 0.7850, test_loss: 0.8793, test_f1: 0.5230
 epoch: 26, train_loss: 0.7567, test_loss: 0.9076, test_f1: 0.5927
 epoch: 27, train_loss: 0.7538, test_loss: 0.8240, test_f1: 0.5584
 epoch: 28, train_loss: 0.7449, test_loss: 0.8266, test_f1: 0.5540
 epoch: 29, train_loss: 0.7474, test_loss: 0.9076, test_f1: 0.5748
 epoch: 30, train_loss: 0.7669, test_loss: 0.8529, test_f1: 0.5147
 epoch: 31, train_loss: 0.7473, test_loss: 0.8464, test_f1: 0.5766
 epoch: 32, train_loss: 0.7470, test_loss: 0.8528, test_f1: 0.5462
 epoch: 33, train_loss: 0.7463, test_loss: 0.8169, test_f1: 0.5508
 epoch: 34, train_loss: 0.7423, test_loss: 0.7835, test_f1: 0.5668
 epoch: 35, train_loss: 0.7364, test_loss: 0.8112, test_f1: 0.5633
 epoch: 36, train_loss: 0.7213, test_loss: 0.8468, test_f1: 0.5855
 epoch: 37, train_loss: 0.7199, test_loss: 0.9632, test_f1: 0.4964
 epoch: 38, train_loss: 0.7360, test_loss: 0.9608, test_f1: 0.5189
 epoch: 39, train_loss: 0.7016, test_loss: 0.8453, test_f1: 0.5357
 epoch: 40, train_loss: 0.7111, test_loss: 0.9036, test_f1: 0.5449
 epoch: 41, train_loss: 0.7216, test_loss: 0.8337, test_f1: 0.5815
 epoch: 42, train_loss: 0.7182, test_loss: 0.8127, test_f1: 0.5741
 epoch: 43, train_loss: 0.6936, test_loss: 0.9423, test_f1: 0.5392
 epoch: 44, train_loss: 0.6964, test_loss: 0.8399, test_f1: 0.5942
 epoch: 45, train_loss: 0.7167, test_loss: 0.8073, test_f1: 0.6228
 epoch: 46, train_loss: 0.7000, test_loss: 0.8608, test_f1: 0.5792
 epoch: 47, train_loss: 0.6949, test_loss: 0.7956, test_f1: 0.5838
 epoch: 48, train_loss: 0.6836, test_loss: 0.8252, test_f1: 0.5932
 epoch: 49, train_loss: 0.6958, test_loss: 0.7902, test_f1: 0.6480
 epoch: 50, train_loss: 0.6981, test_loss: 0.8267, test_f1: 0.6216
 epoch: 51, train_loss: 0.6500, test_loss: 0.8061, test_f1: 0.6349
 epoch: 52, train_loss: 0.6448, test_loss: 0.8265, test_f1: 0.6307
 epoch: 53, train_loss: 0.6350, test_loss: 0.8022, test_f1: 0.6480
 epoch: 54, train_loss: 0.6382, test_loss: 0.8383, test_f1: 0.5888
 epoch: 55, train_loss: 0.6367, test_loss: 0.8153, test_f1: 0.6253
 epoch: 56, train_loss: 0.6220, test_loss: 0.8067, test_f1: 0.6454
 epoch: 57, train_loss: 0.6216, test_loss: 0.8123, test_f1: 0.6315
 epoch: 58, train_loss: 0.6164, test_loss: 0.8103, test_f1: 0.6115
 epoch: 59, train_loss: 0.6146, test_loss: 0.8336, test_f1: 0.6425
 epoch: 60, train_loss: 0.6225, test_loss: 0.7691, test_f1: 0.6261
 epoch: 61, train_loss: 0.6330, test_loss: 0.8249, test_f1: 0.5981
 epoch: 62, train_loss: 0.6135, test_loss: 0.8109, test_f1: 0.6137
 epoch: 63, train_loss: 0.6187, test_loss: 0.7466, test_f1: 0.6505
 epoch: 64, train_loss: 0.6195, test_loss: 0.8260, test_f1: 0.6268
 epoch: 65, train_loss: 0.6180, test_loss: 0.8040, test_f1: 0.6152
 epoch: 66, train_loss: 0.6046, test_loss: 0.7778, test_f1: 0.6376
 epoch: 67, train_loss: 0.5925, test_loss: 0.8091, test_f1: 0.6338
 epoch: 68, train_loss: 0.5921, test_loss: 0.8271, test_f1: 0.6112
 epoch: 69, train_loss: 0.5891, test_loss: 0.8306, test_f1: 0.6151
 epoch: 70, train_loss: 0.5944, test_loss: 0.7787, test_f1: 0.6365
 epoch: 71, train_loss: 0.5971, test_loss: 0.8121, test_f1: 0.6301
 epoch: 72, train_loss: 0.5738, test_loss: 0.7755, test_f1: 0.6136
 epoch: 73, train_loss: 0.5843, test_loss: 0.8135, test_f1: 0.6653
 epoch: 74, train_loss: 0.6027, test_loss: 0.7914, test_f1: 0.6321
 epoch: 75, train_loss: 0.5678, test_loss: 0.8386, test_f1: 0.6058
 epoch: 76, train_loss: 0.5810, test_loss: 0.8051, test_f1: 0.6168
 epoch: 77, train_loss: 0.5642, test_loss: 0.8002, test_f1: 0.6268
 epoch: 78, train_loss: 0.5791, test_loss: 0.7703, test_f1: 0.6423
 epoch: 79, train_loss: 0.5606, test_loss: 0.8219, test_f1: 0.6508
 epoch: 80, train_loss: 0.5742, test_loss: 0.8323, test_f1: 0.6461
 epoch: 81, train_loss: 0.5745, test_loss: 0.8368, test_f1: 0.6455
 epoch: 82, train_loss: 0.5658, test_loss: 0.8967, test_f1: 0.5771
 epoch: 83, train_loss: 0.5502, test_loss: 0.8628, test_f1: 0.6144
 epoch: 84, train_loss: 0.5683, test_loss: 0.8548, test_f1: 0.6541
 epoch: 85, train_loss: 0.5658, test_loss: 0.8445, test_f1: 0.6193
 epoch: 86, train_loss: 0.5494, test_loss: 0.8468, test_f1: 0.6385
 epoch: 87, train_loss: 0.5522, test_loss: 0.8691, test_f1: 0.6602
 epoch: 88, train_loss: 0.5510, test_loss: 0.7738, test_f1: 0.6554
 epoch: 89, train_loss: 0.5451, test_loss: 0.8674, test_f1: 0.6519
 epoch: 90, train_loss: 0.5664, test_loss: 0.8353, test_f1: 0.6168
 epoch: 91, train_loss: 0.5442, test_loss: 0.8375, test_f1: 0.6265
 epoch: 92, train_loss: 0.5364, test_loss: 0.9275, test_f1: 0.6268
 epoch: 93, train_loss: 0.5451, test_loss: 0.8336, test_f1: 0.6178
 epoch: 94, train_loss: 0.5379, test_loss: 0.7926, test_f1: 0.6610
 epoch: 95, train_loss: 0.5393, test_loss: 0.7754, test_f1: 0.6584
 epoch: 96, train_loss: 0.5385, test_loss: 0.7982, test_f1: 0.6449
 epoch: 97, train_loss: 0.5649, test_loss: 0.8345, test_f1: 0.6457
 epoch: 98, train_loss: 0.5422, test_loss: 0.9091, test_f1: 0.6231
 epoch: 99, train_loss: 0.5351, test_loss: 0.8256, test_f1: 0.6567
##################ITERATION #4 ****************************************
 epoch: 0, train_loss: 1.1326, test_loss: 1.1884, test_f1: 0.3852
 epoch: 1, train_loss: 1.0374, test_loss: 1.0765, test_f1: 0.4021
 epoch: 2, train_loss: 0.9918, test_loss: 1.0244, test_f1: 0.4454
 epoch: 3, train_loss: 0.9752, test_loss: 1.0232, test_f1: 0.4325
 epoch: 4, train_loss: 0.9616, test_loss: 0.9362, test_f1: 0.5015
 epoch: 5, train_loss: 0.9449, test_loss: 0.9341, test_f1: 0.4967
 epoch: 6, train_loss: 0.9433, test_loss: 0.9416, test_f1: 0.5155
 epoch: 7, train_loss: 0.9321, test_loss: 0.9946, test_f1: 0.5078
 epoch: 8, train_loss: 0.9120, test_loss: 0.9790, test_f1: 0.5299
 epoch: 9, train_loss: 0.9016, test_loss: 1.0043, test_f1: 0.5021
 epoch: 10, train_loss: 0.8859, test_loss: 0.8634, test_f1: 0.5141
 epoch: 11, train_loss: 0.8848, test_loss: 0.9947, test_f1: 0.4759
 epoch: 12, train_loss: 0.8675, test_loss: 1.0165, test_f1: 0.4855
 epoch: 13, train_loss: 0.8839, test_loss: 0.9003, test_f1: 0.5301
 epoch: 14, train_loss: 0.8816, test_loss: 1.0002, test_f1: 0.4799
 epoch: 15, train_loss: 0.8711, test_loss: 0.9900, test_f1: 0.5430
 epoch: 16, train_loss: 0.8693, test_loss: 0.8546, test_f1: 0.5538
 epoch: 17, train_loss: 0.8410, test_loss: 0.8773, test_f1: 0.5369
 epoch: 18, train_loss: 0.8431, test_loss: 0.9620, test_f1: 0.5094
 epoch: 19, train_loss: 0.8233, test_loss: 0.8659, test_f1: 0.5580
 epoch: 20, train_loss: 0.8269, test_loss: 0.9800, test_f1: 0.5092
 epoch: 21, train_loss: 0.8195, test_loss: 0.9712, test_f1: 0.4815
 epoch: 22, train_loss: 0.7955, test_loss: 0.9061, test_f1: 0.5206
 epoch: 23, train_loss: 0.8170, test_loss: 0.8789, test_f1: 0.5179
 epoch: 24, train_loss: 0.8124, test_loss: 0.9196, test_f1: 0.5469
 epoch: 25, train_loss: 0.7938, test_loss: 0.9023, test_f1: 0.5929
 epoch: 26, train_loss: 0.7933, test_loss: 0.8862, test_f1: 0.5560
 epoch: 27, train_loss: 0.8230, test_loss: 0.8940, test_f1: 0.5653
 epoch: 28, train_loss: 0.7682, test_loss: 0.8473, test_f1: 0.5620
 epoch: 29, train_loss: 0.7822, test_loss: 0.8592, test_f1: 0.5368
 epoch: 30, train_loss: 0.7750, test_loss: 1.0091, test_f1: 0.5206
 epoch: 31, train_loss: 0.7661, test_loss: 0.8360, test_f1: 0.6062
 epoch: 32, train_loss: 0.7590, test_loss: 0.8703, test_f1: 0.6177
 epoch: 33, train_loss: 0.7733, test_loss: 0.8703, test_f1: 0.6041
 epoch: 34, train_loss: 0.7429, test_loss: 0.8929, test_f1: 0.5462
 epoch: 35, train_loss: 0.7518, test_loss: 0.8547, test_f1: 0.5999
 epoch: 36, train_loss: 0.7534, test_loss: 0.9996, test_f1: 0.5569
 epoch: 37, train_loss: 0.7447, test_loss: 0.8818, test_f1: 0.5921
 epoch: 38, train_loss: 0.7326, test_loss: 0.9448, test_f1: 0.5567
 epoch: 39, train_loss: 0.7410, test_loss: 0.9156, test_f1: 0.6044
 epoch: 40, train_loss: 0.7269, test_loss: 0.9630, test_f1: 0.5357
 epoch: 41, train_loss: 0.7185, test_loss: 0.9227, test_f1: 0.5721
 epoch: 42, train_loss: 0.7283, test_loss: 0.9103, test_f1: 0.6026
 epoch: 43, train_loss: 0.7358, test_loss: 0.9315, test_f1: 0.5759
 epoch: 44, train_loss: 0.7456, test_loss: 0.8898, test_f1: 0.5473
 epoch: 45, train_loss: 0.7304, test_loss: 0.8482, test_f1: 0.6046
 epoch: 46, train_loss: 0.7410, test_loss: 0.8508, test_f1: 0.5748
 epoch: 47, train_loss: 0.7073, test_loss: 0.8462, test_f1: 0.6195
 epoch: 48, train_loss: 0.7014, test_loss: 0.8773, test_f1: 0.6321
 epoch: 49, train_loss: 0.7102, test_loss: 0.8629, test_f1: 0.5901
 epoch: 50, train_loss: 0.6891, test_loss: 0.8841, test_f1: 0.5875
 epoch: 51, train_loss: 0.6845, test_loss: 0.9056, test_f1: 0.6026
 epoch: 52, train_loss: 0.6638, test_loss: 0.9074, test_f1: 0.6282
 epoch: 53, train_loss: 0.6591, test_loss: 0.8434, test_f1: 0.6142
 epoch: 54, train_loss: 0.6476, test_loss: 0.8648, test_f1: 0.6147
 epoch: 55, train_loss: 0.6571, test_loss: 0.8364, test_f1: 0.6351
 epoch: 56, train_loss: 0.6566, test_loss: 0.8462, test_f1: 0.6415
 epoch: 57, train_loss: 0.6421, test_loss: 0.8543, test_f1: 0.6446
 epoch: 58, train_loss: 0.6403, test_loss: 0.9378, test_f1: 0.6255
 epoch: 59, train_loss: 0.6468, test_loss: 0.9120, test_f1: 0.6345
 epoch: 60, train_loss: 0.6435, test_loss: 0.9176, test_f1: 0.6183
 epoch: 61, train_loss: 0.6290, test_loss: 0.9531, test_f1: 0.5793
 epoch: 62, train_loss: 0.6423, test_loss: 0.9180, test_f1: 0.6384
 epoch: 63, train_loss: 0.6412, test_loss: 0.9069, test_f1: 0.6048
 epoch: 64, train_loss: 0.6229, test_loss: 0.8872, test_f1: 0.6210
 epoch: 65, train_loss: 0.6129, test_loss: 0.9166, test_f1: 0.6238
 epoch: 66, train_loss: 0.6075, test_loss: 0.8852, test_f1: 0.6324
 epoch: 67, train_loss: 0.6249, test_loss: 0.9261, test_f1: 0.6051
 epoch: 68, train_loss: 0.6193, test_loss: 0.8861, test_f1: 0.6339
 epoch: 69, train_loss: 0.6143, test_loss: 0.8978, test_f1: 0.6412
 epoch: 70, train_loss: 0.6091, test_loss: 0.9052, test_f1: 0.6392
 epoch: 71, train_loss: 0.6079, test_loss: 0.7883, test_f1: 0.6286
 epoch: 72, train_loss: 0.6125, test_loss: 0.8476, test_f1: 0.5933
 epoch: 73, train_loss: 0.6159, test_loss: 0.8626, test_f1: 0.6282
 epoch: 74, train_loss: 0.6061, test_loss: 0.8994, test_f1: 0.6430
 epoch: 75, train_loss: 0.6052, test_loss: 0.8634, test_f1: 0.6198
 epoch: 76, train_loss: 0.6084, test_loss: 0.8391, test_f1: 0.6570
 epoch: 77, train_loss: 0.6177, test_loss: 0.9467, test_f1: 0.6191
 epoch: 78, train_loss: 0.5984, test_loss: 0.9205, test_f1: 0.6150
 epoch: 79, train_loss: 0.6012, test_loss: 0.8800, test_f1: 0.6150
 epoch: 80, train_loss: 0.6117, test_loss: 0.8324, test_f1: 0.5825
 epoch: 81, train_loss: 0.6202, test_loss: 0.8724, test_f1: 0.6411
 epoch: 82, train_loss: 0.6180, test_loss: 0.8992, test_f1: 0.6278
 epoch: 83, train_loss: 0.6120, test_loss: 0.9068, test_f1: 0.6311
 epoch: 84, train_loss: 0.6018, test_loss: 0.8634, test_f1: 0.6364
 epoch: 85, train_loss: 0.5825, test_loss: 0.8761, test_f1: 0.6497
 epoch: 86, train_loss: 0.5891, test_loss: 0.9155, test_f1: 0.6284
 epoch: 87, train_loss: 0.5890, test_loss: 0.9524, test_f1: 0.6377
 epoch: 88, train_loss: 0.5840, test_loss: 0.8851, test_f1: 0.6529
 epoch: 89, train_loss: 0.5849, test_loss: 0.9541, test_f1: 0.6489
 epoch: 90, train_loss: 0.5726, test_loss: 0.9186, test_f1: 0.6554
 epoch: 91, train_loss: 0.5811, test_loss: 0.9059, test_f1: 0.6448
 epoch: 92, train_loss: 0.5842, test_loss: 0.9917, test_f1: 0.6258
 epoch: 93, train_loss: 0.5844, test_loss: 0.8928, test_f1: 0.6570
 epoch: 94, train_loss: 0.5862, test_loss: 0.9340, test_f1: 0.6290
 epoch: 95, train_loss: 0.5846, test_loss: 0.9395, test_f1: 0.6557
 epoch: 96, train_loss: 0.5846, test_loss: 0.8899, test_f1: 0.6180
 epoch: 97, train_loss: 0.5651, test_loss: 0.9135, test_f1: 0.6620
 epoch: 98, train_loss: 0.5738, test_loss: 0.9887, test_f1: 0.6087
 epoch: 99, train_loss: 0.5829, test_loss: 0.9265, test_f1: 0.6507
##################ITERATION #5 ****************************************
 epoch: 0, train_loss: 1.1368, test_loss: 1.0652, test_f1: 0.4838
 epoch: 1, train_loss: 1.0228, test_loss: 1.0105, test_f1: 0.4521
 epoch: 2, train_loss: 0.9927, test_loss: 1.0751, test_f1: 0.4102
 epoch: 3, train_loss: 0.9721, test_loss: 0.9919, test_f1: 0.4917
 epoch: 4, train_loss: 0.9423, test_loss: 0.9432, test_f1: 0.5112
 epoch: 5, train_loss: 0.9405, test_loss: 0.9433, test_f1: 0.4870
 epoch: 6, train_loss: 0.9299, test_loss: 1.0067, test_f1: 0.4812
 epoch: 7, train_loss: 0.9141, test_loss: 0.8401, test_f1: 0.5244
 epoch: 8, train_loss: 0.8930, test_loss: 0.8996, test_f1: 0.5445
 epoch: 9, train_loss: 0.9221, test_loss: 0.9671, test_f1: 0.5287
 epoch: 10, train_loss: 0.9054, test_loss: 0.9915, test_f1: 0.5079
 epoch: 11, train_loss: 0.8741, test_loss: 0.8973, test_f1: 0.5469
 epoch: 12, train_loss: 0.8798, test_loss: 0.8965, test_f1: 0.5152
 epoch: 13, train_loss: 0.8868, test_loss: 0.8870, test_f1: 0.5139
 epoch: 14, train_loss: 0.8641, test_loss: 0.8389, test_f1: 0.5558
 epoch: 15, train_loss: 0.8739, test_loss: 0.9055, test_f1: 0.5258
 epoch: 16, train_loss: 0.8628, test_loss: 0.8761, test_f1: 0.5703
 epoch: 17, train_loss: 0.8662, test_loss: 0.9246, test_f1: 0.5199
 epoch: 18, train_loss: 0.8548, test_loss: 0.9014, test_f1: 0.5750
 epoch: 19, train_loss: 0.8329, test_loss: 0.8697, test_f1: 0.5664
 epoch: 20, train_loss: 0.8429, test_loss: 0.8686, test_f1: 0.5422
 epoch: 21, train_loss: 0.8323, test_loss: 0.8493, test_f1: 0.5660
 epoch: 22, train_loss: 0.8265, test_loss: 0.8532, test_f1: 0.5798
 epoch: 23, train_loss: 0.8176, test_loss: 0.8327, test_f1: 0.5749
 epoch: 24, train_loss: 0.8601, test_loss: 0.8614, test_f1: 0.5146
 epoch: 25, train_loss: 0.8275, test_loss: 0.8838, test_f1: 0.5295
 epoch: 26, train_loss: 0.8142, test_loss: 0.8494, test_f1: 0.5975
 epoch: 27, train_loss: 0.8307, test_loss: 0.8409, test_f1: 0.5595
 epoch: 28, train_loss: 0.8079, test_loss: 0.8289, test_f1: 0.5582
 epoch: 29, train_loss: 0.8191, test_loss: 0.8598, test_f1: 0.5547
 epoch: 30, train_loss: 0.8012, test_loss: 0.8180, test_f1: 0.5611
 epoch: 31, train_loss: 0.8005, test_loss: 0.8561, test_f1: 0.5707
 epoch: 32, train_loss: 0.8182, test_loss: 0.7964, test_f1: 0.5884
 epoch: 33, train_loss: 0.8038, test_loss: 0.8580, test_f1: 0.5688
 epoch: 34, train_loss: 0.7957, test_loss: 0.8693, test_f1: 0.5280
 epoch: 35, train_loss: 0.8056, test_loss: 0.8804, test_f1: 0.5385
 epoch: 36, train_loss: 0.8018, test_loss: 0.8037, test_f1: 0.6077
 epoch: 37, train_loss: 0.7829, test_loss: 0.8597, test_f1: 0.5566
 epoch: 38, train_loss: 0.7723, test_loss: 0.8642, test_f1: 0.5454
 epoch: 39, train_loss: 0.7739, test_loss: 0.8596, test_f1: 0.5888
 epoch: 40, train_loss: 0.7622, test_loss: 0.8835, test_f1: 0.5426
 epoch: 41, train_loss: 0.7469, test_loss: 0.8233, test_f1: 0.5940
 epoch: 42, train_loss: 0.7630, test_loss: 0.8030, test_f1: 0.6155
 epoch: 43, train_loss: 0.7449, test_loss: 0.8542, test_f1: 0.5961
 epoch: 44, train_loss: 0.7798, test_loss: 0.8660, test_f1: 0.5386
 epoch: 45, train_loss: 0.7626, test_loss: 0.8124, test_f1: 0.5991
 epoch: 46, train_loss: 0.7489, test_loss: 0.7949, test_f1: 0.6533
 epoch: 47, train_loss: 0.7547, test_loss: 0.8161, test_f1: 0.5706
 epoch: 48, train_loss: 0.7543, test_loss: 1.0247, test_f1: 0.4900
 epoch: 49, train_loss: 0.7507, test_loss: 0.8910, test_f1: 0.5444
 epoch: 50, train_loss: 0.8041, test_loss: 0.9533, test_f1: 0.5063
 epoch: 51, train_loss: 0.8015, test_loss: 0.8867, test_f1: 0.5472
 epoch: 52, train_loss: 0.7542, test_loss: 0.8008, test_f1: 0.5862
 epoch: 53, train_loss: 0.7440, test_loss: 0.8622, test_f1: 0.5732
 epoch: 54, train_loss: 0.7204, test_loss: 0.8008, test_f1: 0.5883
 epoch: 55, train_loss: 0.7341, test_loss: 0.8593, test_f1: 0.5622
 epoch: 56, train_loss: 0.7164, test_loss: 0.8123, test_f1: 0.6249
 epoch: 57, train_loss: 0.7054, test_loss: 0.8454, test_f1: 0.5643
 epoch: 58, train_loss: 0.7062, test_loss: 0.8590, test_f1: 0.6237
 epoch: 59, train_loss: 0.7047, test_loss: 0.8437, test_f1: 0.6230
 epoch: 60, train_loss: 0.7141, test_loss: 0.8570, test_f1: 0.5923
 epoch: 61, train_loss: 0.7247, test_loss: 0.8420, test_f1: 0.5975
 epoch: 62, train_loss: 0.7084, test_loss: 0.8778, test_f1: 0.6319
 epoch: 63, train_loss: 0.7038, test_loss: 0.8686, test_f1: 0.6262
 epoch: 64, train_loss: 0.6936, test_loss: 0.8158, test_f1: 0.6548
 epoch: 65, train_loss: 0.6959, test_loss: 0.9177, test_f1: 0.5886
 epoch: 66, train_loss: 0.6830, test_loss: 0.8401, test_f1: 0.6368
 epoch: 67, train_loss: 0.6765, test_loss: 0.7803, test_f1: 0.6421
 epoch: 68, train_loss: 0.6823, test_loss: 0.8886, test_f1: 0.6143
 epoch: 69, train_loss: 0.6924, test_loss: 0.8727, test_f1: 0.6262
 epoch: 70, train_loss: 0.6670, test_loss: 0.8266, test_f1: 0.6415
 epoch: 71, train_loss: 0.6858, test_loss: 0.9016, test_f1: 0.6301
 epoch: 72, train_loss: 0.6636, test_loss: 0.8769, test_f1: 0.6483
 epoch: 73, train_loss: 0.6795, test_loss: 0.8242, test_f1: 0.6022
 epoch: 74, train_loss: 0.6744, test_loss: 0.8808, test_f1: 0.5893
 epoch: 75, train_loss: 0.6637, test_loss: 0.8437, test_f1: 0.5797
 epoch: 76, train_loss: 0.6658, test_loss: 0.8746, test_f1: 0.5722
 epoch: 77, train_loss: 0.6659, test_loss: 0.8543, test_f1: 0.6252
 epoch: 78, train_loss: 0.6722, test_loss: 0.9217, test_f1: 0.6040
 epoch: 79, train_loss: 0.6736, test_loss: 0.9675, test_f1: 0.5498
 epoch: 80, train_loss: 0.6655, test_loss: 0.8244, test_f1: 0.6059
 epoch: 81, train_loss: 0.6771, test_loss: 0.8426, test_f1: 0.6081
 epoch: 82, train_loss: 0.6589, test_loss: 0.8420, test_f1: 0.6121
 epoch: 83, train_loss: 0.6487, test_loss: 0.8027, test_f1: 0.6190
 epoch: 84, train_loss: 0.6434, test_loss: 0.8556, test_f1: 0.6552
 epoch: 85, train_loss: 0.6412, test_loss: 0.8182, test_f1: 0.6532
 epoch: 86, train_loss: 0.6336, test_loss: 0.9329, test_f1: 0.6245
 epoch: 87, train_loss: 0.6488, test_loss: 0.8274, test_f1: 0.6285
 epoch: 88, train_loss: 0.6487, test_loss: 0.8520, test_f1: 0.6465
 epoch: 89, train_loss: 0.6369, test_loss: 0.8435, test_f1: 0.6310
 epoch: 90, train_loss: 0.6426, test_loss: 0.8982, test_f1: 0.6154
 epoch: 91, train_loss: 0.6476, test_loss: 0.8230, test_f1: 0.5927
 epoch: 92, train_loss: 0.6192, test_loss: 0.9481, test_f1: 0.5902
 epoch: 93, train_loss: 0.6215, test_loss: 0.9051, test_f1: 0.6041
 epoch: 94, train_loss: 0.6388, test_loss: 0.9216, test_f1: 0.6222
 epoch: 95, train_loss: 0.6379, test_loss: 0.8974, test_f1: 0.6187
 epoch: 96, train_loss: 0.6281, test_loss: 0.8472, test_f1: 0.6349
 epoch: 97, train_loss: 0.6396, test_loss: 0.9943, test_f1: 0.5883
 epoch: 98, train_loss: 0.6053, test_loss: 0.9169, test_f1: 0.6161
 epoch: 99, train_loss: 0.6207, test_loss: 0.8738, test_f1: 0.6394
##################ITERATION #6 ****************************************
 epoch: 0, train_loss: 1.1553, test_loss: 1.1153, test_f1: 0.4045
 epoch: 1, train_loss: 1.0180, test_loss: 1.1257, test_f1: 0.3976
 epoch: 2, train_loss: 0.9729, test_loss: 0.9669, test_f1: 0.4600
 epoch: 3, train_loss: 0.9626, test_loss: 1.2318, test_f1: 0.4635
 epoch: 4, train_loss: 0.9350, test_loss: 0.9286, test_f1: 0.5034
 epoch: 5, train_loss: 0.9255, test_loss: 0.9829, test_f1: 0.4803
 epoch: 6, train_loss: 0.8991, test_loss: 0.9381, test_f1: 0.4876
 epoch: 7, train_loss: 0.8910, test_loss: 0.9570, test_f1: 0.4700
 epoch: 8, train_loss: 0.8777, test_loss: 0.9158, test_f1: 0.4999
 epoch: 9, train_loss: 0.8739, test_loss: 0.9674, test_f1: 0.5043
 epoch: 10, train_loss: 0.8793, test_loss: 0.9530, test_f1: 0.4845
 epoch: 11, train_loss: 0.8733, test_loss: 0.8976, test_f1: 0.5159
 epoch: 12, train_loss: 0.8611, test_loss: 0.9933, test_f1: 0.4472
 epoch: 13, train_loss: 0.8471, test_loss: 0.9651, test_f1: 0.4710
 epoch: 14, train_loss: 0.8249, test_loss: 0.8495, test_f1: 0.5521
 epoch: 15, train_loss: 0.8328, test_loss: 0.9231, test_f1: 0.4867
 epoch: 16, train_loss: 0.8266, test_loss: 0.8112, test_f1: 0.5421
 epoch: 17, train_loss: 0.8285, test_loss: 0.9217, test_f1: 0.5472
 epoch: 18, train_loss: 0.8004, test_loss: 0.9492, test_f1: 0.5189
 epoch: 19, train_loss: 0.8159, test_loss: 0.8437, test_f1: 0.5468
 epoch: 20, train_loss: 0.8254, test_loss: 0.9420, test_f1: 0.5357
 epoch: 21, train_loss: 0.8188, test_loss: 0.8510, test_f1: 0.5434
 epoch: 22, train_loss: 0.8029, test_loss: 0.8265, test_f1: 0.5468
 epoch: 23, train_loss: 0.7982, test_loss: 0.9233, test_f1: 0.5472
 epoch: 24, train_loss: 0.7841, test_loss: 0.8341, test_f1: 0.5513
 epoch: 25, train_loss: 0.8045, test_loss: 0.8873, test_f1: 0.5238
 epoch: 26, train_loss: 0.7853, test_loss: 0.9436, test_f1: 0.5003
 epoch: 27, train_loss: 0.7942, test_loss: 0.9293, test_f1: 0.5479
 epoch: 28, train_loss: 0.7859, test_loss: 0.8471, test_f1: 0.5608
 epoch: 29, train_loss: 0.7601, test_loss: 0.8630, test_f1: 0.5347
 epoch: 30, train_loss: 0.7547, test_loss: 0.8598, test_f1: 0.5441
 epoch: 31, train_loss: 0.7538, test_loss: 0.8199, test_f1: 0.5620
 epoch: 32, train_loss: 0.7598, test_loss: 0.9269, test_f1: 0.5327
 epoch: 33, train_loss: 0.7699, test_loss: 1.1664, test_f1: 0.4348
 epoch: 34, train_loss: 0.7477, test_loss: 0.8864, test_f1: 0.5458
 epoch: 35, train_loss: 0.7556, test_loss: 0.8445, test_f1: 0.5600
 epoch: 36, train_loss: 0.7442, test_loss: 0.9210, test_f1: 0.5206
 epoch: 37, train_loss: 0.7674, test_loss: 0.8072, test_f1: 0.5715
 epoch: 38, train_loss: 0.7843, test_loss: 0.8512, test_f1: 0.5430
 epoch: 39, train_loss: 0.7631, test_loss: 0.8179, test_f1: 0.5548
 epoch: 40, train_loss: 0.7414, test_loss: 0.8355, test_f1: 0.5517
 epoch: 41, train_loss: 0.7257, test_loss: 0.8800, test_f1: 0.5426
 epoch: 42, train_loss: 0.7378, test_loss: 0.8603, test_f1: 0.6033
 epoch: 43, train_loss: 0.7211, test_loss: 0.8035, test_f1: 0.5672
 epoch: 44, train_loss: 0.7315, test_loss: 0.8269, test_f1: 0.5604
 epoch: 45, train_loss: 0.7295, test_loss: 0.8812, test_f1: 0.5467
 epoch: 46, train_loss: 0.7340, test_loss: 0.7883, test_f1: 0.5646
 epoch: 47, train_loss: 0.7194, test_loss: 0.8270, test_f1: 0.5589
 epoch: 48, train_loss: 0.7131, test_loss: 0.8270, test_f1: 0.5635
 epoch: 49, train_loss: 0.7164, test_loss: 0.8024, test_f1: 0.5717
 epoch: 50, train_loss: 0.7153, test_loss: 0.9281, test_f1: 0.5065
 epoch: 51, train_loss: 0.6964, test_loss: 0.8095, test_f1: 0.5669
 epoch: 52, train_loss: 0.6680, test_loss: 0.8782, test_f1: 0.5636
 epoch: 53, train_loss: 0.6577, test_loss: 0.8065, test_f1: 0.5847
 epoch: 54, train_loss: 0.6613, test_loss: 0.8144, test_f1: 0.6038
 epoch: 55, train_loss: 0.6613, test_loss: 0.8237, test_f1: 0.5834
 epoch: 56, train_loss: 0.6550, test_loss: 0.8326, test_f1: 0.5586
 epoch: 57, train_loss: 0.6612, test_loss: 0.8216, test_f1: 0.5889
 epoch: 58, train_loss: 0.6510, test_loss: 0.8129, test_f1: 0.6270
 epoch: 59, train_loss: 0.6691, test_loss: 0.8453, test_f1: 0.6169
 epoch: 60, train_loss: 0.6491, test_loss: 0.8483, test_f1: 0.6359
 epoch: 61, train_loss: 0.6353, test_loss: 0.8502, test_f1: 0.6046
 epoch: 62, train_loss: 0.6514, test_loss: 0.8472, test_f1: 0.5977
 epoch: 63, train_loss: 0.6480, test_loss: 0.8777, test_f1: 0.6003
 epoch: 64, train_loss: 0.6272, test_loss: 0.8951, test_f1: 0.5747
 epoch: 65, train_loss: 0.6458, test_loss: 0.8352, test_f1: 0.6115
 epoch: 66, train_loss: 0.6385, test_loss: 0.8602, test_f1: 0.5977
 epoch: 67, train_loss: 0.6317, test_loss: 0.8448, test_f1: 0.5888
 epoch: 68, train_loss: 0.6299, test_loss: 0.8618, test_f1: 0.6217
 epoch: 69, train_loss: 0.6247, test_loss: 0.8756, test_f1: 0.6188
 epoch: 70, train_loss: 0.6100, test_loss: 0.8283, test_f1: 0.5974
 epoch: 71, train_loss: 0.6030, test_loss: 0.9163, test_f1: 0.6262
 epoch: 72, train_loss: 0.6534, test_loss: 0.8981, test_f1: 0.5744
 epoch: 73, train_loss: 0.6327, test_loss: 0.8570, test_f1: 0.6114
 epoch: 74, train_loss: 0.6383, test_loss: 0.8314, test_f1: 0.6037
 epoch: 75, train_loss: 0.6295, test_loss: 0.8420, test_f1: 0.5809
 epoch: 76, train_loss: 0.6210, test_loss: 0.8364, test_f1: 0.6246
 epoch: 77, train_loss: 0.6223, test_loss: 0.8723, test_f1: 0.5996
 epoch: 78, train_loss: 0.6232, test_loss: 0.8285, test_f1: 0.6343
 epoch: 79, train_loss: 0.6178, test_loss: 0.8520, test_f1: 0.6268
 epoch: 80, train_loss: 0.6150, test_loss: 0.9748, test_f1: 0.5648
 epoch: 81, train_loss: 0.6130, test_loss: 0.8611, test_f1: 0.5840
 epoch: 82, train_loss: 0.6251, test_loss: 0.8677, test_f1: 0.5954
 epoch: 83, train_loss: 0.6132, test_loss: 0.8414, test_f1: 0.5938
 epoch: 84, train_loss: 0.6250, test_loss: 0.8453, test_f1: 0.5875
 epoch: 85, train_loss: 0.6136, test_loss: 0.8274, test_f1: 0.6434
 epoch: 86, train_loss: 0.5793, test_loss: 0.9082, test_f1: 0.5891
 epoch: 87, train_loss: 0.6182, test_loss: 0.8551, test_f1: 0.6118
 epoch: 88, train_loss: 0.6053, test_loss: 0.8323, test_f1: 0.6124
 epoch: 89, train_loss: 0.5951, test_loss: 0.8512, test_f1: 0.6496
 epoch: 90, train_loss: 0.5943, test_loss: 0.8961, test_f1: 0.6126
 epoch: 91, train_loss: 0.5857, test_loss: 0.8575, test_f1: 0.6124
 epoch: 92, train_loss: 0.5879, test_loss: 0.8919, test_f1: 0.6405
 epoch: 93, train_loss: 0.6001, test_loss: 0.8210, test_f1: 0.6169
 epoch: 94, train_loss: 0.5903, test_loss: 0.9053, test_f1: 0.5908
 epoch: 95, train_loss: 0.5978, test_loss: 0.9038, test_f1: 0.6143
 epoch: 96, train_loss: 0.5884, test_loss: 0.8202, test_f1: 0.6111
 epoch: 97, train_loss: 0.5970, test_loss: 0.8338, test_f1: 0.5912
 epoch: 98, train_loss: 0.5809, test_loss: 0.8643, test_f1: 0.6343
 epoch: 99, train_loss: 0.5732, test_loss: 0.8241, test_f1: 0.6562
##################ITERATION #7 ****************************************
 epoch: 0, train_loss: 1.1687, test_loss: 2.5479, test_f1: 0.1688
 epoch: 1, train_loss: 1.0427, test_loss: 1.0304, test_f1: 0.4464
 epoch: 2, train_loss: 0.9961, test_loss: 1.0092, test_f1: 0.4987
 epoch: 3, train_loss: 0.9632, test_loss: 0.9941, test_f1: 0.4526
 epoch: 4, train_loss: 0.9843, test_loss: 0.9948, test_f1: 0.4857
 epoch: 5, train_loss: 0.9696, test_loss: 0.9576, test_f1: 0.4850
 epoch: 6, train_loss: 0.9413, test_loss: 1.0672, test_f1: 0.4729
 epoch: 7, train_loss: 0.9266, test_loss: 0.9646, test_f1: 0.5324
 epoch: 8, train_loss: 0.9146, test_loss: 0.9196, test_f1: 0.5080
 epoch: 9, train_loss: 0.9284, test_loss: 0.9475, test_f1: 0.4871
 epoch: 10, train_loss: 0.8991, test_loss: 0.9799, test_f1: 0.5627
 epoch: 11, train_loss: 0.8991, test_loss: 0.9567, test_f1: 0.5622
 epoch: 12, train_loss: 0.8820, test_loss: 0.9111, test_f1: 0.5458
 epoch: 13, train_loss: 0.8732, test_loss: 0.8965, test_f1: 0.5472
 epoch: 14, train_loss: 0.8743, test_loss: 0.8878, test_f1: 0.5889
 epoch: 15, train_loss: 0.8621, test_loss: 0.9084, test_f1: 0.5619
 epoch: 16, train_loss: 0.8659, test_loss: 0.9332, test_f1: 0.6013
 epoch: 17, train_loss: 0.8600, test_loss: 0.8746, test_f1: 0.5372
 epoch: 18, train_loss: 0.8333, test_loss: 0.8603, test_f1: 0.5886
 epoch: 19, train_loss: 0.8516, test_loss: 0.8994, test_f1: 0.6063
 epoch: 20, train_loss: 0.8284, test_loss: 1.0864, test_f1: 0.5429
 epoch: 21, train_loss: 0.8201, test_loss: 0.9066, test_f1: 0.6110
 epoch: 22, train_loss: 0.8273, test_loss: 0.9294, test_f1: 0.5660
 epoch: 23, train_loss: 0.8143, test_loss: 0.9398, test_f1: 0.6007
 epoch: 24, train_loss: 0.8384, test_loss: 1.0023, test_f1: 0.5659
 epoch: 25, train_loss: 0.8065, test_loss: 0.9503, test_f1: 0.5556
 epoch: 26, train_loss: 0.8142, test_loss: 0.9571, test_f1: 0.6028
 epoch: 27, train_loss: 0.8149, test_loss: 0.9595, test_f1: 0.5386
 epoch: 28, train_loss: 0.8032, test_loss: 1.0011, test_f1: 0.5110
 epoch: 29, train_loss: 0.8043, test_loss: 0.9751, test_f1: 0.5710
 epoch: 30, train_loss: 0.8076, test_loss: 1.1245, test_f1: 0.5343
 epoch: 31, train_loss: 0.8153, test_loss: 0.9339, test_f1: 0.5387
 epoch: 32, train_loss: 0.7783, test_loss: 1.0254, test_f1: 0.6189
 epoch: 33, train_loss: 0.7865, test_loss: 0.9933, test_f1: 0.5440
 epoch: 34, train_loss: 0.7864, test_loss: 1.0024, test_f1: 0.6019
 epoch: 35, train_loss: 0.7844, test_loss: 1.0168, test_f1: 0.5921
 epoch: 36, train_loss: 0.7709, test_loss: 0.9478, test_f1: 0.5967
 epoch: 37, train_loss: 0.7633, test_loss: 1.0396, test_f1: 0.6066
 epoch: 38, train_loss: 0.7737, test_loss: 0.9932, test_f1: 0.6339
 epoch: 39, train_loss: 0.7788, test_loss: 0.9307, test_f1: 0.5923
 epoch: 40, train_loss: 0.7657, test_loss: 1.0178, test_f1: 0.6089
 epoch: 41, train_loss: 0.7521, test_loss: 1.0771, test_f1: 0.6186
 epoch: 42, train_loss: 0.7403, test_loss: 1.1392, test_f1: 0.5345
 epoch: 43, train_loss: 0.7506, test_loss: 0.9304, test_f1: 0.5999
 epoch: 44, train_loss: 0.7449, test_loss: 0.9805, test_f1: 0.6092
 epoch: 45, train_loss: 0.7237, test_loss: 0.9543, test_f1: 0.6036
 epoch: 46, train_loss: 0.7291, test_loss: 0.9499, test_f1: 0.6415
 epoch: 47, train_loss: 0.7511, test_loss: 1.0322, test_f1: 0.5249
 epoch: 48, train_loss: 0.7603, test_loss: 0.9765, test_f1: 0.5842
 epoch: 49, train_loss: 0.7194, test_loss: 0.9691, test_f1: 0.5695
 epoch: 50, train_loss: 0.7242, test_loss: 1.0263, test_f1: 0.6178
 epoch: 51, train_loss: 0.6874, test_loss: 0.9282, test_f1: 0.6393
 epoch: 52, train_loss: 0.6790, test_loss: 0.9909, test_f1: 0.6218
 epoch: 53, train_loss: 0.6605, test_loss: 0.8854, test_f1: 0.6490
 epoch: 54, train_loss: 0.6625, test_loss: 1.0009, test_f1: 0.6143
 epoch: 55, train_loss: 0.6603, test_loss: 0.9880, test_f1: 0.6375
 epoch: 56, train_loss: 0.6518, test_loss: 0.9858, test_f1: 0.6389
 epoch: 57, train_loss: 0.6693, test_loss: 0.8989, test_f1: 0.5916
 epoch: 58, train_loss: 0.6758, test_loss: 1.0432, test_f1: 0.6100
 epoch: 59, train_loss: 0.6688, test_loss: 0.9723, test_f1: 0.6119
 epoch: 60, train_loss: 0.6553, test_loss: 0.9831, test_f1: 0.6127
 epoch: 61, train_loss: 0.6510, test_loss: 0.9842, test_f1: 0.6470
 epoch: 62, train_loss: 0.6441, test_loss: 0.8987, test_f1: 0.6516
 epoch: 63, train_loss: 0.6573, test_loss: 0.9906, test_f1: 0.6015
 epoch: 64, train_loss: 0.6467, test_loss: 1.0837, test_f1: 0.6147
 epoch: 65, train_loss: 0.6402, test_loss: 1.0542, test_f1: 0.6081
 epoch: 66, train_loss: 0.6139, test_loss: 1.0287, test_f1: 0.6063
 epoch: 67, train_loss: 0.6300, test_loss: 0.9979, test_f1: 0.6522
 epoch: 68, train_loss: 0.6156, test_loss: 1.0281, test_f1: 0.6158
 epoch: 69, train_loss: 0.6426, test_loss: 1.0447, test_f1: 0.6279
 epoch: 70, train_loss: 0.6157, test_loss: 1.1388, test_f1: 0.6216
 epoch: 71, train_loss: 0.6257, test_loss: 0.9487, test_f1: 0.6507
 epoch: 72, train_loss: 0.6231, test_loss: 1.0248, test_f1: 0.6196
 epoch: 73, train_loss: 0.6142, test_loss: 1.1543, test_f1: 0.5567
 epoch: 74, train_loss: 0.6269, test_loss: 1.0413, test_f1: 0.6198
 epoch: 75, train_loss: 0.6278, test_loss: 0.9481, test_f1: 0.6307
 epoch: 76, train_loss: 0.6203, test_loss: 0.9871, test_f1: 0.6205
 epoch: 77, train_loss: 0.6227, test_loss: 1.0097, test_f1: 0.6294
 epoch: 78, train_loss: 0.6197, test_loss: 0.9677, test_f1: 0.6091
 epoch: 79, train_loss: 0.6168, test_loss: 0.8918, test_f1: 0.6304
 epoch: 80, train_loss: 0.6208, test_loss: 1.1162, test_f1: 0.6230
 epoch: 81, train_loss: 0.5994, test_loss: 0.9421, test_f1: 0.6241
 epoch: 82, train_loss: 0.6050, test_loss: 0.9810, test_f1: 0.6050
 epoch: 83, train_loss: 0.6073, test_loss: 1.0561, test_f1: 0.6312
 epoch: 84, train_loss: 0.5999, test_loss: 0.9979, test_f1: 0.6401
 epoch: 85, train_loss: 0.5799, test_loss: 1.0145, test_f1: 0.6426
 epoch: 86, train_loss: 0.5930, test_loss: 1.0416, test_f1: 0.6167
 epoch: 87, train_loss: 0.5975, test_loss: 1.0439, test_f1: 0.6331
 epoch: 88, train_loss: 0.5985, test_loss: 1.0621, test_f1: 0.6409
 epoch: 89, train_loss: 0.5759, test_loss: 1.1650, test_f1: 0.6192
 epoch: 90, train_loss: 0.5821, test_loss: 1.1398, test_f1: 0.6171
 epoch: 91, train_loss: 0.5993, test_loss: 1.0794, test_f1: 0.6239
 epoch: 92, train_loss: 0.5658, test_loss: 1.0100, test_f1: 0.6627
 epoch: 93, train_loss: 0.5797, test_loss: 0.9619, test_f1: 0.6260
 epoch: 94, train_loss: 0.5840, test_loss: 1.0045, test_f1: 0.6410
 epoch: 95, train_loss: 0.5859, test_loss: 1.1460, test_f1: 0.5855
 epoch: 96, train_loss: 0.5903, test_loss: 1.1238, test_f1: 0.6399
 epoch: 97, train_loss: 0.5661, test_loss: 1.0978, test_f1: 0.6202
 epoch: 98, train_loss: 0.5700, test_loss: 0.9162, test_f1: 0.6566
 epoch: 99, train_loss: 0.5619, test_loss: 1.1704, test_f1: 0.6180
##################ITERATION #8 ****************************************
 epoch: 0, train_loss: 1.1382, test_loss: 1.0448, test_f1: 0.4459
 epoch: 1, train_loss: 1.0080, test_loss: 1.0129, test_f1: 0.4780
 epoch: 2, train_loss: 0.9890, test_loss: 0.9768, test_f1: 0.5234
 epoch: 3, train_loss: 0.9639, test_loss: 1.0091, test_f1: 0.5264
 epoch: 4, train_loss: 0.9335, test_loss: 0.9237, test_f1: 0.5557
 epoch: 5, train_loss: 0.9421, test_loss: 0.9426, test_f1: 0.5453
 epoch: 6, train_loss: 0.9030, test_loss: 0.9731, test_f1: 0.5630
 epoch: 7, train_loss: 0.9001, test_loss: 1.1171, test_f1: 0.4726
 epoch: 8, train_loss: 0.9076, test_loss: 0.9311, test_f1: 0.4971
 epoch: 9, train_loss: 0.8699, test_loss: 0.8633, test_f1: 0.5779
 epoch: 10, train_loss: 0.8672, test_loss: 0.9202, test_f1: 0.5279
 epoch: 11, train_loss: 0.8625, test_loss: 0.8948, test_f1: 0.5878
 epoch: 12, train_loss: 0.8670, test_loss: 0.9685, test_f1: 0.5037
 epoch: 13, train_loss: 0.8498, test_loss: 0.8412, test_f1: 0.5519
 epoch: 14, train_loss: 0.8237, test_loss: 0.9027, test_f1: 0.5066
 epoch: 15, train_loss: 0.8230, test_loss: 1.0273, test_f1: 0.4987
 epoch: 16, train_loss: 0.8469, test_loss: 0.9306, test_f1: 0.5133
 epoch: 17, train_loss: 0.8270, test_loss: 0.9738, test_f1: 0.5102
 epoch: 18, train_loss: 0.8168, test_loss: 0.9009, test_f1: 0.5235
 epoch: 19, train_loss: 0.8121, test_loss: 0.8492, test_f1: 0.5614
 epoch: 20, train_loss: 0.7901, test_loss: 0.9104, test_f1: 0.5334
 epoch: 21, train_loss: 0.8077, test_loss: 0.9076, test_f1: 0.5373
 epoch: 22, train_loss: 0.8107, test_loss: 0.9213, test_f1: 0.5116
 epoch: 23, train_loss: 0.8008, test_loss: 0.8683, test_f1: 0.5479
 epoch: 24, train_loss: 0.7919, test_loss: 0.8773, test_f1: 0.5331
 epoch: 25, train_loss: 0.7794, test_loss: 0.8776, test_f1: 0.5411
 epoch: 26, train_loss: 0.7831, test_loss: 0.8397, test_f1: 0.5482
 epoch: 27, train_loss: 0.7744, test_loss: 0.9729, test_f1: 0.5038
 epoch: 28, train_loss: 0.7640, test_loss: 0.9107, test_f1: 0.5374
 epoch: 29, train_loss: 0.7584, test_loss: 0.8838, test_f1: 0.5329
 epoch: 30, train_loss: 0.7495, test_loss: 1.0291, test_f1: 0.4871
 epoch: 31, train_loss: 0.7694, test_loss: 0.8914, test_f1: 0.5370
 epoch: 32, train_loss: 0.7571, test_loss: 0.9140, test_f1: 0.5326
 epoch: 33, train_loss: 0.7513, test_loss: 0.9371, test_f1: 0.5373
 epoch: 34, train_loss: 0.7373, test_loss: 0.8869, test_f1: 0.5231
 epoch: 35, train_loss: 0.7699, test_loss: 0.9395, test_f1: 0.5472
 epoch: 36, train_loss: 0.7829, test_loss: 0.9122, test_f1: 0.5843
 epoch: 37, train_loss: 0.7527, test_loss: 0.9145, test_f1: 0.5414
 epoch: 38, train_loss: 0.7416, test_loss: 0.8988, test_f1: 0.5477
 epoch: 39, train_loss: 0.7182, test_loss: 0.8858, test_f1: 0.5584
 epoch: 40, train_loss: 0.7298, test_loss: 0.8958, test_f1: 0.5840
 epoch: 41, train_loss: 0.7176, test_loss: 0.8864, test_f1: 0.5434
 epoch: 42, train_loss: 0.7277, test_loss: 0.8869, test_f1: 0.5401
 epoch: 43, train_loss: 0.7286, test_loss: 0.9368, test_f1: 0.5294
 epoch: 44, train_loss: 0.7248, test_loss: 0.8873, test_f1: 0.5370
 epoch: 45, train_loss: 0.7168, test_loss: 0.8741, test_f1: 0.5550
 epoch: 46, train_loss: 0.7216, test_loss: 0.9086, test_f1: 0.5341
 epoch: 47, train_loss: 0.7109, test_loss: 0.8285, test_f1: 0.5961
 epoch: 48, train_loss: 0.7010, test_loss: 0.8947, test_f1: 0.5588
 epoch: 49, train_loss: 0.7082, test_loss: 0.8454, test_f1: 0.5645
 epoch: 50, train_loss: 0.6982, test_loss: 0.9088, test_f1: 0.5546
 epoch: 51, train_loss: 0.6780, test_loss: 0.8790, test_f1: 0.5900
 epoch: 52, train_loss: 0.6655, test_loss: 0.9051, test_f1: 0.5948
 epoch: 53, train_loss: 0.6535, test_loss: 0.8817, test_f1: 0.5849
 epoch: 54, train_loss: 0.6590, test_loss: 0.9014, test_f1: 0.6080
 epoch: 55, train_loss: 0.6543, test_loss: 0.8708, test_f1: 0.5896
 epoch: 56, train_loss: 0.6538, test_loss: 0.9540, test_f1: 0.5703
 epoch: 57, train_loss: 0.6527, test_loss: 0.9162, test_f1: 0.5888
 epoch: 58, train_loss: 0.6434, test_loss: 0.9267, test_f1: 0.5868
 epoch: 59, train_loss: 0.6285, test_loss: 0.8812, test_f1: 0.5730
 epoch: 60, train_loss: 0.6457, test_loss: 0.9182, test_f1: 0.5891
 epoch: 61, train_loss: 0.6558, test_loss: 0.8696, test_f1: 0.5715
 epoch: 62, train_loss: 0.6465, test_loss: 0.8760, test_f1: 0.5902
 epoch: 63, train_loss: 0.6574, test_loss: 0.8792, test_f1: 0.5689
 epoch: 64, train_loss: 0.6416, test_loss: 0.9640, test_f1: 0.6301
 epoch: 65, train_loss: 0.6380, test_loss: 0.9343, test_f1: 0.5898
 epoch: 66, train_loss: 0.6331, test_loss: 0.9052, test_f1: 0.5921
 epoch: 67, train_loss: 0.6262, test_loss: 0.9075, test_f1: 0.5989
 epoch: 68, train_loss: 0.6358, test_loss: 0.9283, test_f1: 0.5867
 epoch: 69, train_loss: 0.6300, test_loss: 0.9072, test_f1: 0.5851
 epoch: 70, train_loss: 0.6219, test_loss: 0.9322, test_f1: 0.5630
 epoch: 71, train_loss: 0.6393, test_loss: 0.9910, test_f1: 0.5567
 epoch: 72, train_loss: 0.6255, test_loss: 0.9345, test_f1: 0.6229
 epoch: 73, train_loss: 0.6202, test_loss: 0.9831, test_f1: 0.5996
 epoch: 74, train_loss: 0.6177, test_loss: 0.9674, test_f1: 0.5678
 epoch: 75, train_loss: 0.6065, test_loss: 0.9912, test_f1: 0.6173
 epoch: 76, train_loss: 0.6243, test_loss: 0.9930, test_f1: 0.5676
 epoch: 77, train_loss: 0.6139, test_loss: 0.9566, test_f1: 0.6059
 epoch: 78, train_loss: 0.6079, test_loss: 0.9557, test_f1: 0.5800
 epoch: 79, train_loss: 0.6122, test_loss: 1.0282, test_f1: 0.5907
 epoch: 80, train_loss: 0.6196, test_loss: 0.9638, test_f1: 0.5700
 epoch: 81, train_loss: 0.6145, test_loss: 0.9608, test_f1: 0.5979
 epoch: 82, train_loss: 0.6204, test_loss: 0.8845, test_f1: 0.5691
 epoch: 83, train_loss: 0.5994, test_loss: 0.9372, test_f1: 0.6215
 epoch: 84, train_loss: 0.5970, test_loss: 0.9680, test_f1: 0.6198
 epoch: 85, train_loss: 0.6098, test_loss: 0.8971, test_f1: 0.6190
 epoch: 86, train_loss: 0.6022, test_loss: 0.9088, test_f1: 0.6136
 epoch: 87, train_loss: 0.5998, test_loss: 1.0125, test_f1: 0.6233
 epoch: 88, train_loss: 0.6060, test_loss: 1.0282, test_f1: 0.6139
 epoch: 89, train_loss: 0.6025, test_loss: 0.8659, test_f1: 0.6368
 epoch: 90, train_loss: 0.6198, test_loss: 0.8979, test_f1: 0.6050
 epoch: 91, train_loss: 0.6034, test_loss: 0.9272, test_f1: 0.5769
 epoch: 92, train_loss: 0.5777, test_loss: 0.9564, test_f1: 0.6345
 epoch: 93, train_loss: 0.6026, test_loss: 1.0091, test_f1: 0.6087
 epoch: 94, train_loss: 0.5795, test_loss: 1.0526, test_f1: 0.5813
 epoch: 95, train_loss: 0.6013, test_loss: 0.9437, test_f1: 0.6264
 epoch: 96, train_loss: 0.5794, test_loss: 0.9567, test_f1: 0.6183
 epoch: 97, train_loss: 0.5949, test_loss: 1.0165, test_f1: 0.6198
 epoch: 98, train_loss: 0.5801, test_loss: 0.9861, test_f1: 0.6038
 epoch: 99, train_loss: 0.5721, test_loss: 0.9663, test_f1: 0.5969
##################ITERATION #9 ****************************************
 epoch: 0, train_loss: 1.1301, test_loss: 1.0770, test_f1: 0.4346
 epoch: 1, train_loss: 0.9968, test_loss: 0.9412, test_f1: 0.5250
 epoch: 2, train_loss: 0.9544, test_loss: 1.0171, test_f1: 0.4771
 epoch: 3, train_loss: 0.9485, test_loss: 1.1132, test_f1: 0.4446
 epoch: 4, train_loss: 0.9284, test_loss: 1.3149, test_f1: 0.4799
 epoch: 5, train_loss: 0.9113, test_loss: 0.9286, test_f1: 0.4717
 epoch: 6, train_loss: 0.8838, test_loss: 0.9282, test_f1: 0.4881
 epoch: 7, train_loss: 0.8753, test_loss: 0.8684, test_f1: 0.5343
 epoch: 8, train_loss: 0.8648, test_loss: 0.9287, test_f1: 0.5285
 epoch: 9, train_loss: 0.8591, test_loss: 0.9429, test_f1: 0.5121
 epoch: 10, train_loss: 0.8770, test_loss: 0.8542, test_f1: 0.5302
 epoch: 11, train_loss: 0.8584, test_loss: 0.8911, test_f1: 0.5455
 epoch: 12, train_loss: 0.8420, test_loss: 0.9529, test_f1: 0.5087
 epoch: 13, train_loss: 0.8359, test_loss: 0.8693, test_f1: 0.5347
 epoch: 14, train_loss: 0.8142, test_loss: 0.9121, test_f1: 0.5463
 epoch: 15, train_loss: 0.8268, test_loss: 0.8529, test_f1: 0.5725
 epoch: 16, train_loss: 0.8167, test_loss: 0.8551, test_f1: 0.5642
 epoch: 17, train_loss: 0.7939, test_loss: 0.9234, test_f1: 0.5335
 epoch: 18, train_loss: 0.7962, test_loss: 0.9691, test_f1: 0.5278
 epoch: 19, train_loss: 0.7887, test_loss: 0.9191, test_f1: 0.5207
 epoch: 20, train_loss: 0.8182, test_loss: 0.9689, test_f1: 0.5321
 epoch: 21, train_loss: 0.7989, test_loss: 0.8514, test_f1: 0.5336
 epoch: 22, train_loss: 0.7607, test_loss: 0.8939, test_f1: 0.5424
 epoch: 23, train_loss: 0.7841, test_loss: 1.0850, test_f1: 0.4512
 epoch: 24, train_loss: 0.7592, test_loss: 0.9957, test_f1: 0.5146
 epoch: 25, train_loss: 0.7803, test_loss: 0.9684, test_f1: 0.5251
 epoch: 26, train_loss: 0.7636, test_loss: 1.2621, test_f1: 0.5147
 epoch: 27, train_loss: 0.7727, test_loss: 0.9288, test_f1: 0.5197
 epoch: 28, train_loss: 0.7693, test_loss: 0.8885, test_f1: 0.5476
 epoch: 29, train_loss: 0.7398, test_loss: 0.8952, test_f1: 0.6079
 epoch: 30, train_loss: 0.7406, test_loss: 0.9151, test_f1: 0.6172
 epoch: 31, train_loss: 0.7646, test_loss: 1.0894, test_f1: 0.4709
 epoch: 32, train_loss: 0.7388, test_loss: 0.9575, test_f1: 0.5915
 epoch: 33, train_loss: 0.7427, test_loss: 0.9179, test_f1: 0.5622
 epoch: 34, train_loss: 0.7449, test_loss: 0.9367, test_f1: 0.6151
 epoch: 35, train_loss: 0.7412, test_loss: 0.9609, test_f1: 0.5496
 epoch: 36, train_loss: 0.7375, test_loss: 1.1148, test_f1: 0.5172
 epoch: 37, train_loss: 0.7364, test_loss: 0.9563, test_f1: 0.5869
 epoch: 38, train_loss: 0.7293, test_loss: 1.0234, test_f1: 0.6115
 epoch: 39, train_loss: 0.7398, test_loss: 1.2269, test_f1: 0.4980
 epoch: 40, train_loss: 0.7516, test_loss: 0.8853, test_f1: 0.6159
 epoch: 41, train_loss: 0.7257, test_loss: 0.9101, test_f1: 0.5398
 epoch: 42, train_loss: 0.7127, test_loss: 0.9441, test_f1: 0.5492
 epoch: 43, train_loss: 0.7174, test_loss: 0.9069, test_f1: 0.5664
 epoch: 44, train_loss: 0.7210, test_loss: 0.8859, test_f1: 0.5440
 epoch: 45, train_loss: 0.7130, test_loss: 0.9132, test_f1: 0.5607
 epoch: 46, train_loss: 0.7152, test_loss: 0.8790, test_f1: 0.6129
 epoch: 47, train_loss: 0.7093, test_loss: 0.9504, test_f1: 0.6347
 epoch: 48, train_loss: 0.7012, test_loss: 0.9836, test_f1: 0.5419
 epoch: 49, train_loss: 0.6812, test_loss: 0.8835, test_f1: 0.6159
 epoch: 50, train_loss: 0.7109, test_loss: 0.9557, test_f1: 0.5358
 epoch: 51, train_loss: 0.6662, test_loss: 0.8796, test_f1: 0.6353
 epoch: 52, train_loss: 0.6591, test_loss: 0.8750, test_f1: 0.6273
 epoch: 53, train_loss: 0.6490, test_loss: 0.8849, test_f1: 0.6358
 epoch: 54, train_loss: 0.6415, test_loss: 0.9395, test_f1: 0.6219
 epoch: 55, train_loss: 0.6362, test_loss: 0.9824, test_f1: 0.6506
 epoch: 56, train_loss: 0.6234, test_loss: 0.8874, test_f1: 0.6219
 epoch: 57, train_loss: 0.6351, test_loss: 0.9109, test_f1: 0.6513
 epoch: 58, train_loss: 0.6334, test_loss: 0.8701, test_f1: 0.6320
 epoch: 59, train_loss: 0.6012, test_loss: 0.9986, test_f1: 0.6051
 epoch: 60, train_loss: 0.6228, test_loss: 0.8715, test_f1: 0.6519
 epoch: 61, train_loss: 0.6245, test_loss: 0.9685, test_f1: 0.6228
 epoch: 62, train_loss: 0.6127, test_loss: 0.8698, test_f1: 0.6453
 epoch: 63, train_loss: 0.6163, test_loss: 0.9789, test_f1: 0.6280
 epoch: 64, train_loss: 0.6247, test_loss: 0.8951, test_f1: 0.6188
 epoch: 65, train_loss: 0.6123, test_loss: 0.9226, test_f1: 0.6083
 epoch: 66, train_loss: 0.6167, test_loss: 0.9255, test_f1: 0.6475
 epoch: 67, train_loss: 0.6039, test_loss: 0.9511, test_f1: 0.6260
 epoch: 68, train_loss: 0.6014, test_loss: 0.9426, test_f1: 0.6320
 epoch: 69, train_loss: 0.5980, test_loss: 0.9416, test_f1: 0.6421
 epoch: 70, train_loss: 0.6119, test_loss: 0.9070, test_f1: 0.6250
 epoch: 71, train_loss: 0.6076, test_loss: 0.8756, test_f1: 0.6518
 epoch: 72, train_loss: 0.5993, test_loss: 0.8962, test_f1: 0.6215
 epoch: 73, train_loss: 0.5798, test_loss: 0.9152, test_f1: 0.6293
 epoch: 74, train_loss: 0.5835, test_loss: 0.8802, test_f1: 0.6536
 epoch: 75, train_loss: 0.5904, test_loss: 1.0245, test_f1: 0.5910
 epoch: 76, train_loss: 0.5903, test_loss: 0.9315, test_f1: 0.6237
 epoch: 77, train_loss: 0.5781, test_loss: 0.9368, test_f1: 0.5929
 epoch: 78, train_loss: 0.5868, test_loss: 0.9032, test_f1: 0.6295
 epoch: 79, train_loss: 0.6169, test_loss: 0.9551, test_f1: 0.6232
 epoch: 80, train_loss: 0.6004, test_loss: 0.9897, test_f1: 0.6143
 epoch: 81, train_loss: 0.5899, test_loss: 0.9067, test_f1: 0.6372
 epoch: 82, train_loss: 0.5826, test_loss: 0.9275, test_f1: 0.6480
 epoch: 83, train_loss: 0.5785, test_loss: 0.9643, test_f1: 0.6165
 epoch: 84, train_loss: 0.5735, test_loss: 0.9487, test_f1: 0.6205
 epoch: 85, train_loss: 0.5673, test_loss: 0.8998, test_f1: 0.6335
 epoch: 86, train_loss: 0.5604, test_loss: 1.0043, test_f1: 0.6253
 epoch: 87, train_loss: 0.5714, test_loss: 0.9089, test_f1: 0.6114
 epoch: 88, train_loss: 0.5808, test_loss: 0.8973, test_f1: 0.6235
 epoch: 89, train_loss: 0.5667, test_loss: 0.9974, test_f1: 0.6236
 epoch: 90, train_loss: 0.5699, test_loss: 1.0065, test_f1: 0.6064
 epoch: 91, train_loss: 0.5660, test_loss: 0.9302, test_f1: 0.6306
 epoch: 92, train_loss: 0.5628, test_loss: 0.9357, test_f1: 0.6385
 epoch: 93, train_loss: 0.5415, test_loss: 0.9645, test_f1: 0.6407
 epoch: 94, train_loss: 0.5450, test_loss: 1.0047, test_f1: 0.6311
 epoch: 95, train_loss: 0.5509, test_loss: 1.0246, test_f1: 0.6383
 epoch: 96, train_loss: 0.5598, test_loss: 0.9527, test_f1: 0.6658
 epoch: 97, train_loss: 0.5520, test_loss: 0.9108, test_f1: 0.6255
 epoch: 98, train_loss: 0.5662, test_loss: 0.9224, test_f1: 0.6450
 epoch: 99, train_loss: 0.5548, test_loss: 0.9573, test_f1: 0.6248

Training completed in 833.16 seconds
Best F1: 0.6710 at epoch 96
Mean F1 across iterations: 0.6611  0.0094
========================FINAL RESULTS================================
FEGIN weighted F1: 0.6710  0.0094
python main.py --data ltspice_examples --representation component_pin --model FEGIN --layers 6 --hiddens 32 --batch_size 64 --lr 0.01 --emb_size 250 --epochs 100 --save_appendix component_pin_L6_H32_BS64_LR0.01_E250 --no_val
-----



STDERR:
  File "main.py", line 370, in <module>
    main()
  File "main.py", line 254, in main
    dataset = dataset_class(
  File "/home/philip/projects/ltspice_examples_code_repo/Circuit-Completion-Using-GNNs/component_classification_with_link_prediction_head/evaluation/FEGIN/kernel/circuit_datasets.py", line 15, in __init__
    self.data, self.slices = torch.load(self.processed_paths[0])
  File "/home/philip/.local/lib/python3.8/site-packages/torch/serialization.py", line 1040, in load
    warnings.warn(
  File "/usr/lib/python3.8/warnings.py", line 109, in _showwarnmsg
    sw(msg.message, msg.category, msg.filename, msg.lineno,
  File "main.py", line 47, in warn_with_traceback
    traceback.print_stack(file=log)
/home/philip/projects/ltspice_examples_code_repo/Circuit-Completion-Using-GNNs/component_classification_with_link_prediction_head/evaluation/FEGIN/kernel/circuit_datasets.py:15: FutureWarning: You are using `torch.load` with `weights_only=False` (the current default value), which uses the default pickle module implicitly. It is possible to construct malicious pickle data which will execute arbitrary code during unpickling (See https://github.com/pytorch/pytorch/blob/main/SECURITY.md#untrusted-models for more details). In a future release, the default value for `weights_only` will be flipped to `True`. This limits the functions that could be executed during unpickling. Arbitrary objects will no longer be allowed to be loaded via this mode unless they are explicitly allowlisted by the user via `torch.serialization.add_safe_globals`. We recommend you start setting `weights_only=True` for any use case where you don't have full control of the loaded file. Please open an issue on GitHub for any issues related to this experimental feature.
  self.data, self.slices = torch.load(self.processed_paths[0])
