STDOUT:
Results will be saved in /home/philip/projects/ltspice_examples_code_repo/Circuit-Completion-Using-GNNs/component_classification_with_link_prediction_head/evaluation/FEGIN/results/model_FEGIN_dataset_ltspice_examples
Command line input: python main.py --data ltspice_examples --representation component_pin_net --model FEGIN --layers 3 --hiddens 16 --batch_size 128 --lr 0.001 --emb_size 128 --epochs 100 --save_appendix component_pin_net_L3_H16_BS128_LR0.001_E128 --no_val
 is saved.
-----
ltspice_examples - FEGIN
Using 3 layers, 16 hidden units, h = 2
Loading component_pin_net representation dataset
ENTERED
Training FEGIN on component_pin_net representation
Train: 3558, Test: 846
##################ITERATION #0 ****************************************
 epoch: 0, train_loss: 1.3434, test_loss: 1.3425, test_f1: 0.2270
 epoch: 1, train_loss: 1.3179, test_loss: 1.3255, test_f1: 0.2270
 epoch: 2, train_loss: 1.2818, test_loss: 1.2477, test_f1: 0.3366
 epoch: 3, train_loss: 1.2125, test_loss: 1.1653, test_f1: 0.3422
 epoch: 4, train_loss: 1.1494, test_loss: 1.1162, test_f1: 0.3422
 epoch: 5, train_loss: 1.1002, test_loss: 1.1234, test_f1: 0.3413
 epoch: 6, train_loss: 1.0776, test_loss: 1.0717, test_f1: 0.3681
 epoch: 7, train_loss: 1.0609, test_loss: 1.0614, test_f1: 0.3440
 epoch: 8, train_loss: 1.0565, test_loss: 1.0416, test_f1: 0.3596
 epoch: 9, train_loss: 1.0462, test_loss: 1.0584, test_f1: 0.3558
 epoch: 10, train_loss: 1.0390, test_loss: 1.0351, test_f1: 0.3569
 epoch: 11, train_loss: 1.0328, test_loss: 1.0290, test_f1: 0.3447
 epoch: 12, train_loss: 1.0330, test_loss: 1.0665, test_f1: 0.3384
 epoch: 13, train_loss: 1.0250, test_loss: 1.0232, test_f1: 0.3458
 epoch: 14, train_loss: 1.0115, test_loss: 0.9926, test_f1: 0.3459
 epoch: 15, train_loss: 1.0049, test_loss: 0.9898, test_f1: 0.3863
 epoch: 16, train_loss: 0.9845, test_loss: 1.0165, test_f1: 0.4349
 epoch: 17, train_loss: 0.9736, test_loss: 0.9643, test_f1: 0.4555
 epoch: 18, train_loss: 0.9627, test_loss: 0.9695, test_f1: 0.4741
 epoch: 19, train_loss: 0.9578, test_loss: 0.9574, test_f1: 0.4800
 epoch: 20, train_loss: 0.9372, test_loss: 1.0028, test_f1: 0.4441
 epoch: 21, train_loss: 0.9420, test_loss: 0.9845, test_f1: 0.4796
 epoch: 22, train_loss: 0.9396, test_loss: 0.9448, test_f1: 0.4815
 epoch: 23, train_loss: 0.9241, test_loss: 0.9320, test_f1: 0.4870
 epoch: 24, train_loss: 0.9368, test_loss: 0.9156, test_f1: 0.4919
 epoch: 25, train_loss: 0.9180, test_loss: 0.9551, test_f1: 0.4733
 epoch: 26, train_loss: 0.9104, test_loss: 0.9040, test_f1: 0.5033
 epoch: 27, train_loss: 0.9144, test_loss: 0.8764, test_f1: 0.5073
 epoch: 28, train_loss: 0.9171, test_loss: 0.9022, test_f1: 0.4935
 epoch: 29, train_loss: 0.9165, test_loss: 0.8974, test_f1: 0.5261
 epoch: 30, train_loss: 0.9123, test_loss: 0.9227, test_f1: 0.4868
 epoch: 31, train_loss: 0.8991, test_loss: 0.8795, test_f1: 0.5260
 epoch: 32, train_loss: 0.8920, test_loss: 0.9942, test_f1: 0.4449
 epoch: 33, train_loss: 0.8945, test_loss: 1.0500, test_f1: 0.4293
 epoch: 34, train_loss: 0.8866, test_loss: 0.9299, test_f1: 0.4727
 epoch: 35, train_loss: 0.8932, test_loss: 0.8688, test_f1: 0.5140
 epoch: 36, train_loss: 0.8836, test_loss: 0.9418, test_f1: 0.4698
 epoch: 37, train_loss: 0.8770, test_loss: 0.8474, test_f1: 0.5341
 epoch: 38, train_loss: 0.8821, test_loss: 0.8734, test_f1: 0.5306
 epoch: 39, train_loss: 0.8795, test_loss: 0.9002, test_f1: 0.5480
 epoch: 40, train_loss: 0.8642, test_loss: 0.8882, test_f1: 0.5107
 epoch: 41, train_loss: 0.8667, test_loss: 0.8668, test_f1: 0.5362
 epoch: 42, train_loss: 0.8628, test_loss: 0.8565, test_f1: 0.5489
 epoch: 43, train_loss: 0.8511, test_loss: 0.8739, test_f1: 0.5149
 epoch: 44, train_loss: 0.8535, test_loss: 0.8418, test_f1: 0.5422
 epoch: 45, train_loss: 0.8601, test_loss: 0.9072, test_f1: 0.5319
 epoch: 46, train_loss: 0.8471, test_loss: 0.8568, test_f1: 0.5318
 epoch: 47, train_loss: 0.8559, test_loss: 0.8570, test_f1: 0.5394
 epoch: 48, train_loss: 0.8427, test_loss: 0.8407, test_f1: 0.5541
 epoch: 49, train_loss: 0.8536, test_loss: 0.9044, test_f1: 0.5486
 epoch: 50, train_loss: 0.8444, test_loss: 0.9113, test_f1: 0.5027
 epoch: 51, train_loss: 0.8327, test_loss: 0.8423, test_f1: 0.5524
 epoch: 52, train_loss: 0.8181, test_loss: 0.8383, test_f1: 0.5505
 epoch: 53, train_loss: 0.8296, test_loss: 0.8724, test_f1: 0.5302
 epoch: 54, train_loss: 0.8263, test_loss: 0.8395, test_f1: 0.5694
 epoch: 55, train_loss: 0.8157, test_loss: 0.8448, test_f1: 0.5642
 epoch: 56, train_loss: 0.8208, test_loss: 0.8322, test_f1: 0.5536
 epoch: 57, train_loss: 0.8188, test_loss: 0.8467, test_f1: 0.5354
 epoch: 58, train_loss: 0.8241, test_loss: 0.8652, test_f1: 0.5327
 epoch: 59, train_loss: 0.8176, test_loss: 0.8595, test_f1: 0.5573
 epoch: 60, train_loss: 0.8125, test_loss: 0.8659, test_f1: 0.5647
 epoch: 61, train_loss: 0.8142, test_loss: 0.8274, test_f1: 0.5882
 epoch: 62, train_loss: 0.8074, test_loss: 0.8563, test_f1: 0.5380
 epoch: 63, train_loss: 0.8173, test_loss: 0.8599, test_f1: 0.5727
 epoch: 64, train_loss: 0.8190, test_loss: 0.8372, test_f1: 0.5917
 epoch: 65, train_loss: 0.8176, test_loss: 0.8382, test_f1: 0.5562
 epoch: 66, train_loss: 0.8079, test_loss: 0.8547, test_f1: 0.5656
 epoch: 67, train_loss: 0.8051, test_loss: 0.8439, test_f1: 0.5657
 epoch: 68, train_loss: 0.8030, test_loss: 0.8466, test_f1: 0.5367
 epoch: 69, train_loss: 0.8051, test_loss: 0.8346, test_f1: 0.5692
 epoch: 70, train_loss: 0.8072, test_loss: 0.8646, test_f1: 0.5369
 epoch: 71, train_loss: 0.8102, test_loss: 0.8567, test_f1: 0.5503
 epoch: 72, train_loss: 0.8030, test_loss: 0.8353, test_f1: 0.5569
 epoch: 73, train_loss: 0.8008, test_loss: 0.8401, test_f1: 0.5701
 epoch: 74, train_loss: 0.8064, test_loss: 0.8528, test_f1: 0.5706
 epoch: 75, train_loss: 0.7955, test_loss: 0.8682, test_f1: 0.5385
 epoch: 76, train_loss: 0.8011, test_loss: 0.8615, test_f1: 0.5461
 epoch: 77, train_loss: 0.7967, test_loss: 0.8335, test_f1: 0.5719
 epoch: 78, train_loss: 0.7985, test_loss: 0.8449, test_f1: 0.5747
 epoch: 79, train_loss: 0.8019, test_loss: 0.8414, test_f1: 0.5681
 epoch: 80, train_loss: 0.7952, test_loss: 0.8338, test_f1: 0.6048
 epoch: 81, train_loss: 0.7928, test_loss: 0.8661, test_f1: 0.5395
 epoch: 82, train_loss: 0.7977, test_loss: 0.8403, test_f1: 0.5653
 epoch: 83, train_loss: 0.7932, test_loss: 0.8522, test_f1: 0.5567
 epoch: 84, train_loss: 0.7975, test_loss: 0.8452, test_f1: 0.5526
 epoch: 85, train_loss: 0.7902, test_loss: 0.8473, test_f1: 0.5559
 epoch: 86, train_loss: 0.7945, test_loss: 0.8629, test_f1: 0.5546
 epoch: 87, train_loss: 0.7920, test_loss: 0.8696, test_f1: 0.5554
 epoch: 88, train_loss: 0.7944, test_loss: 0.8541, test_f1: 0.5546
 epoch: 89, train_loss: 0.7842, test_loss: 0.8505, test_f1: 0.5508
 epoch: 90, train_loss: 0.7875, test_loss: 0.8370, test_f1: 0.5885
 epoch: 91, train_loss: 0.7822, test_loss: 0.8720, test_f1: 0.5511
 epoch: 92, train_loss: 0.7738, test_loss: 0.8361, test_f1: 0.5746
 epoch: 93, train_loss: 0.7896, test_loss: 0.8665, test_f1: 0.5527
 epoch: 94, train_loss: 0.7857, test_loss: 0.8481, test_f1: 0.5532
 epoch: 95, train_loss: 0.7845, test_loss: 0.8616, test_f1: 0.5495
 epoch: 96, train_loss: 0.7816, test_loss: 0.8406, test_f1: 0.5771
 epoch: 97, train_loss: 0.7833, test_loss: 0.8514, test_f1: 0.5718
 epoch: 98, train_loss: 0.7874, test_loss: 0.8391, test_f1: 0.5761
 epoch: 99, train_loss: 0.7822, test_loss: 0.8354, test_f1: 0.5771
##################ITERATION #1 ****************************************
 epoch: 0, train_loss: 1.2923, test_loss: 1.3114, test_f1: 0.2270
 epoch: 1, train_loss: 1.2139, test_loss: 1.2285, test_f1: 0.2270
 epoch: 2, train_loss: 1.1622, test_loss: 1.1247, test_f1: 0.3705
 epoch: 3, train_loss: 1.1157, test_loss: 1.0746, test_f1: 0.4113
 epoch: 4, train_loss: 1.0811, test_loss: 1.0505, test_f1: 0.4297
 epoch: 5, train_loss: 1.0538, test_loss: 1.0360, test_f1: 0.4493
 epoch: 6, train_loss: 1.0351, test_loss: 1.0033, test_f1: 0.4767
 epoch: 7, train_loss: 1.0283, test_loss: 0.9801, test_f1: 0.4916
 epoch: 8, train_loss: 1.0175, test_loss: 0.9793, test_f1: 0.4849
 epoch: 9, train_loss: 1.0074, test_loss: 0.9563, test_f1: 0.4951
 epoch: 10, train_loss: 0.9923, test_loss: 0.9540, test_f1: 0.5110
 epoch: 11, train_loss: 0.9847, test_loss: 0.9410, test_f1: 0.4979
 epoch: 12, train_loss: 0.9803, test_loss: 0.9243, test_f1: 0.5199
 epoch: 13, train_loss: 0.9738, test_loss: 0.9275, test_f1: 0.5282
 epoch: 14, train_loss: 0.9549, test_loss: 0.9044, test_f1: 0.5197
 epoch: 15, train_loss: 0.9535, test_loss: 0.9255, test_f1: 0.5223
 epoch: 16, train_loss: 0.9515, test_loss: 0.9023, test_f1: 0.5184
 epoch: 17, train_loss: 0.9391, test_loss: 0.9109, test_f1: 0.5252
 epoch: 18, train_loss: 0.9370, test_loss: 0.8827, test_f1: 0.5391
 epoch: 19, train_loss: 0.9325, test_loss: 0.9224, test_f1: 0.5462
 epoch: 20, train_loss: 0.9293, test_loss: 0.8763, test_f1: 0.5355
 epoch: 21, train_loss: 0.9351, test_loss: 0.9031, test_f1: 0.5069
 epoch: 22, train_loss: 0.9190, test_loss: 0.8733, test_f1: 0.5579
 epoch: 23, train_loss: 0.9204, test_loss: 0.8572, test_f1: 0.5390
 epoch: 24, train_loss: 0.9104, test_loss: 0.8964, test_f1: 0.5497
 epoch: 25, train_loss: 0.9029, test_loss: 0.8571, test_f1: 0.5375
 epoch: 26, train_loss: 0.9133, test_loss: 0.8556, test_f1: 0.5413
 epoch: 27, train_loss: 0.9032, test_loss: 0.8621, test_f1: 0.5530
 epoch: 28, train_loss: 0.8907, test_loss: 0.8519, test_f1: 0.5596
 epoch: 29, train_loss: 0.8877, test_loss: 0.8539, test_f1: 0.5613
 epoch: 30, train_loss: 0.8939, test_loss: 0.8409, test_f1: 0.5581
 epoch: 31, train_loss: 0.8885, test_loss: 0.8514, test_f1: 0.5442
 epoch: 32, train_loss: 0.8909, test_loss: 0.8475, test_f1: 0.5470
 epoch: 33, train_loss: 0.8826, test_loss: 0.8753, test_f1: 0.5370
 epoch: 34, train_loss: 0.8701, test_loss: 0.8284, test_f1: 0.5771
 epoch: 35, train_loss: 0.8743, test_loss: 0.8484, test_f1: 0.5534
 epoch: 36, train_loss: 0.8662, test_loss: 0.8402, test_f1: 0.5544
 epoch: 37, train_loss: 0.8698, test_loss: 0.8607, test_f1: 0.5493
 epoch: 38, train_loss: 0.8695, test_loss: 0.8571, test_f1: 0.5323
 epoch: 39, train_loss: 0.8540, test_loss: 0.8298, test_f1: 0.5729
 epoch: 40, train_loss: 0.8558, test_loss: 0.8544, test_f1: 0.5518
 epoch: 41, train_loss: 0.8680, test_loss: 0.8416, test_f1: 0.5527
 epoch: 42, train_loss: 0.8527, test_loss: 0.8470, test_f1: 0.5433
 epoch: 43, train_loss: 0.8560, test_loss: 0.8175, test_f1: 0.5797
 epoch: 44, train_loss: 0.8458, test_loss: 0.8535, test_f1: 0.5688
 epoch: 45, train_loss: 0.8625, test_loss: 0.8232, test_f1: 0.5721
 epoch: 46, train_loss: 0.8458, test_loss: 0.8044, test_f1: 0.5792
 epoch: 47, train_loss: 0.8452, test_loss: 0.8122, test_f1: 0.5707
 epoch: 48, train_loss: 0.8266, test_loss: 0.8335, test_f1: 0.5858
 epoch: 49, train_loss: 0.8408, test_loss: 0.8830, test_f1: 0.5102
 epoch: 50, train_loss: 0.8290, test_loss: 0.8447, test_f1: 0.5676
 epoch: 51, train_loss: 0.8314, test_loss: 0.8161, test_f1: 0.5709
 epoch: 52, train_loss: 0.8260, test_loss: 0.8072, test_f1: 0.5512
 epoch: 53, train_loss: 0.8178, test_loss: 0.8243, test_f1: 0.5564
 epoch: 54, train_loss: 0.8189, test_loss: 0.7925, test_f1: 0.5728
 epoch: 55, train_loss: 0.8126, test_loss: 0.8207, test_f1: 0.5397
 epoch: 56, train_loss: 0.8235, test_loss: 0.8035, test_f1: 0.5579
 epoch: 57, train_loss: 0.8203, test_loss: 0.7936, test_f1: 0.5735
 epoch: 58, train_loss: 0.8166, test_loss: 0.8052, test_f1: 0.5628
 epoch: 59, train_loss: 0.7958, test_loss: 0.8449, test_f1: 0.5403
 epoch: 60, train_loss: 0.8141, test_loss: 0.8107, test_f1: 0.5777
 epoch: 61, train_loss: 0.8063, test_loss: 0.8049, test_f1: 0.5801
 epoch: 62, train_loss: 0.8054, test_loss: 0.8010, test_f1: 0.5616
 epoch: 63, train_loss: 0.7977, test_loss: 0.8000, test_f1: 0.5735
 epoch: 64, train_loss: 0.8054, test_loss: 0.8128, test_f1: 0.5608
 epoch: 65, train_loss: 0.8092, test_loss: 0.8078, test_f1: 0.5607
 epoch: 66, train_loss: 0.7924, test_loss: 0.8243, test_f1: 0.5699
 epoch: 67, train_loss: 0.7919, test_loss: 0.8019, test_f1: 0.5723
 epoch: 68, train_loss: 0.7952, test_loss: 0.8041, test_f1: 0.5598
 epoch: 69, train_loss: 0.7917, test_loss: 0.8143, test_f1: 0.5778
 epoch: 70, train_loss: 0.7971, test_loss: 0.7939, test_f1: 0.5798
 epoch: 71, train_loss: 0.7924, test_loss: 0.7947, test_f1: 0.5826
 epoch: 72, train_loss: 0.7860, test_loss: 0.7966, test_f1: 0.5734
 epoch: 73, train_loss: 0.7993, test_loss: 0.7986, test_f1: 0.5670
 epoch: 74, train_loss: 0.7933, test_loss: 0.7917, test_f1: 0.5784
 epoch: 75, train_loss: 0.7835, test_loss: 0.7857, test_f1: 0.5761
 epoch: 76, train_loss: 0.7945, test_loss: 0.7884, test_f1: 0.5863
 epoch: 77, train_loss: 0.7764, test_loss: 0.7982, test_f1: 0.5509
 epoch: 78, train_loss: 0.7796, test_loss: 0.7972, test_f1: 0.5689
 epoch: 79, train_loss: 0.7806, test_loss: 0.7941, test_f1: 0.5874
 epoch: 80, train_loss: 0.7799, test_loss: 0.7706, test_f1: 0.5953
 epoch: 81, train_loss: 0.7868, test_loss: 0.8018, test_f1: 0.5766
 epoch: 82, train_loss: 0.7836, test_loss: 0.8030, test_f1: 0.5810
 epoch: 83, train_loss: 0.7812, test_loss: 0.8042, test_f1: 0.5665
 epoch: 84, train_loss: 0.7790, test_loss: 0.7904, test_f1: 0.5717
 epoch: 85, train_loss: 0.7753, test_loss: 0.8026, test_f1: 0.5844
 epoch: 86, train_loss: 0.7808, test_loss: 0.7898, test_f1: 0.5886
 epoch: 87, train_loss: 0.7738, test_loss: 0.7877, test_f1: 0.5781
 epoch: 88, train_loss: 0.7648, test_loss: 0.8098, test_f1: 0.5520
 epoch: 89, train_loss: 0.7807, test_loss: 0.7806, test_f1: 0.5830
 epoch: 90, train_loss: 0.7688, test_loss: 0.8101, test_f1: 0.5537
 epoch: 91, train_loss: 0.7824, test_loss: 0.7948, test_f1: 0.5806
 epoch: 92, train_loss: 0.7638, test_loss: 0.7855, test_f1: 0.5848
 epoch: 93, train_loss: 0.7712, test_loss: 0.7939, test_f1: 0.5730
 epoch: 94, train_loss: 0.7822, test_loss: 0.7926, test_f1: 0.5701
 epoch: 95, train_loss: 0.7707, test_loss: 0.7945, test_f1: 0.5662
 epoch: 96, train_loss: 0.7666, test_loss: 0.7889, test_f1: 0.5832
 epoch: 97, train_loss: 0.7657, test_loss: 0.8032, test_f1: 0.5713
 epoch: 98, train_loss: 0.7674, test_loss: 0.8114, test_f1: 0.5506
 epoch: 99, train_loss: 0.7733, test_loss: 0.7731, test_f1: 0.6022
##################ITERATION #2 ****************************************
 epoch: 0, train_loss: 1.2807, test_loss: 1.2863, test_f1: 0.2270
 epoch: 1, train_loss: 1.1436, test_loss: 1.1260, test_f1: 0.3390
 epoch: 2, train_loss: 1.1030, test_loss: 1.0693, test_f1: 0.3529
 epoch: 3, train_loss: 1.0783, test_loss: 1.0526, test_f1: 0.3675
 epoch: 4, train_loss: 1.0630, test_loss: 1.0463, test_f1: 0.3633
 epoch: 5, train_loss: 1.0507, test_loss: 1.0419, test_f1: 0.3937
 epoch: 6, train_loss: 1.0391, test_loss: 1.0438, test_f1: 0.3878
 epoch: 7, train_loss: 1.0315, test_loss: 1.0466, test_f1: 0.3835
 epoch: 8, train_loss: 1.0269, test_loss: 1.0329, test_f1: 0.4062
 epoch: 9, train_loss: 1.0113, test_loss: 1.0075, test_f1: 0.4375
 epoch: 10, train_loss: 0.9975, test_loss: 0.9915, test_f1: 0.4636
 epoch: 11, train_loss: 0.9904, test_loss: 1.0025, test_f1: 0.4464
 epoch: 12, train_loss: 0.9726, test_loss: 0.9706, test_f1: 0.4744
 epoch: 13, train_loss: 0.9651, test_loss: 0.9916, test_f1: 0.4520
 epoch: 14, train_loss: 0.9557, test_loss: 1.0180, test_f1: 0.4533
 epoch: 15, train_loss: 0.9547, test_loss: 0.9498, test_f1: 0.4980
 epoch: 16, train_loss: 0.9515, test_loss: 0.9760, test_f1: 0.4836
 epoch: 17, train_loss: 0.9520, test_loss: 0.9985, test_f1: 0.4820
 epoch: 18, train_loss: 0.9483, test_loss: 0.9616, test_f1: 0.4966
 epoch: 19, train_loss: 0.9398, test_loss: 0.9449, test_f1: 0.4883
 epoch: 20, train_loss: 0.9271, test_loss: 0.9369, test_f1: 0.5042
 epoch: 21, train_loss: 0.9268, test_loss: 0.9327, test_f1: 0.4965
 epoch: 22, train_loss: 0.9229, test_loss: 0.9282, test_f1: 0.4966
 epoch: 23, train_loss: 0.9169, test_loss: 0.9271, test_f1: 0.5042
 epoch: 24, train_loss: 0.9048, test_loss: 0.9498, test_f1: 0.5003
 epoch: 25, train_loss: 0.9049, test_loss: 0.9201, test_f1: 0.5069
 epoch: 26, train_loss: 0.9049, test_loss: 0.9238, test_f1: 0.5080
 epoch: 27, train_loss: 0.8951, test_loss: 0.9041, test_f1: 0.5020
 epoch: 28, train_loss: 0.9045, test_loss: 0.9312, test_f1: 0.4894
 epoch: 29, train_loss: 0.9005, test_loss: 0.9285, test_f1: 0.5061
 epoch: 30, train_loss: 0.8861, test_loss: 0.9114, test_f1: 0.5169
 epoch: 31, train_loss: 0.8846, test_loss: 0.8929, test_f1: 0.5101
 epoch: 32, train_loss: 0.8760, test_loss: 0.8777, test_f1: 0.5151
 epoch: 33, train_loss: 0.8845, test_loss: 0.9009, test_f1: 0.5130
 epoch: 34, train_loss: 0.8666, test_loss: 0.8753, test_f1: 0.5224
 epoch: 35, train_loss: 0.8685, test_loss: 0.9005, test_f1: 0.5228
 epoch: 36, train_loss: 0.8712, test_loss: 0.9051, test_f1: 0.5111
 epoch: 37, train_loss: 0.8720, test_loss: 0.9058, test_f1: 0.5050
 epoch: 38, train_loss: 0.8643, test_loss: 0.9093, test_f1: 0.5048
 epoch: 39, train_loss: 0.8548, test_loss: 0.8857, test_f1: 0.5100
 epoch: 40, train_loss: 0.8515, test_loss: 0.9234, test_f1: 0.4752
 epoch: 41, train_loss: 0.8598, test_loss: 0.8761, test_f1: 0.5046
 epoch: 42, train_loss: 0.8443, test_loss: 0.8749, test_f1: 0.5239
 epoch: 43, train_loss: 0.8471, test_loss: 0.8947, test_f1: 0.5198
 epoch: 44, train_loss: 0.8542, test_loss: 0.9236, test_f1: 0.5118
 epoch: 45, train_loss: 0.8558, test_loss: 0.9141, test_f1: 0.4987
 epoch: 46, train_loss: 0.8469, test_loss: 0.9524, test_f1: 0.4934
 epoch: 47, train_loss: 0.8551, test_loss: 0.8961, test_f1: 0.5138
 epoch: 48, train_loss: 0.8404, test_loss: 0.8857, test_f1: 0.5052
 epoch: 49, train_loss: 0.8367, test_loss: 0.9056, test_f1: 0.5254
 epoch: 50, train_loss: 0.8381, test_loss: 0.9049, test_f1: 0.5197
 epoch: 51, train_loss: 0.8333, test_loss: 0.8728, test_f1: 0.5121
 epoch: 52, train_loss: 0.8192, test_loss: 0.8664, test_f1: 0.5217
 epoch: 53, train_loss: 0.8242, test_loss: 0.8596, test_f1: 0.5219
 epoch: 54, train_loss: 0.8287, test_loss: 0.8887, test_f1: 0.5147
 epoch: 55, train_loss: 0.8213, test_loss: 0.8655, test_f1: 0.5421
 epoch: 56, train_loss: 0.8178, test_loss: 0.8723, test_f1: 0.5211
 epoch: 57, train_loss: 0.8137, test_loss: 0.8665, test_f1: 0.5192
 epoch: 58, train_loss: 0.8202, test_loss: 0.8792, test_f1: 0.5311
 epoch: 59, train_loss: 0.8228, test_loss: 0.8566, test_f1: 0.5080
 epoch: 60, train_loss: 0.8174, test_loss: 0.8664, test_f1: 0.5245
 epoch: 61, train_loss: 0.8164, test_loss: 0.8575, test_f1: 0.5290
 epoch: 62, train_loss: 0.8200, test_loss: 0.8648, test_f1: 0.5240
 epoch: 63, train_loss: 0.8107, test_loss: 0.8858, test_f1: 0.5368
 epoch: 64, train_loss: 0.8069, test_loss: 0.8577, test_f1: 0.5450
 epoch: 65, train_loss: 0.8234, test_loss: 0.8716, test_f1: 0.5308
 epoch: 66, train_loss: 0.8097, test_loss: 0.8842, test_f1: 0.5230
 epoch: 67, train_loss: 0.8184, test_loss: 0.8953, test_f1: 0.5550
 epoch: 68, train_loss: 0.8048, test_loss: 0.8829, test_f1: 0.5364
 epoch: 69, train_loss: 0.8067, test_loss: 0.8738, test_f1: 0.5206
 epoch: 70, train_loss: 0.8031, test_loss: 0.8753, test_f1: 0.5330
 epoch: 71, train_loss: 0.8053, test_loss: 0.8760, test_f1: 0.5087
 epoch: 72, train_loss: 0.8076, test_loss: 0.8624, test_f1: 0.5195
 epoch: 73, train_loss: 0.8016, test_loss: 0.8870, test_f1: 0.5507
 epoch: 74, train_loss: 0.7969, test_loss: 0.8636, test_f1: 0.5507
 epoch: 75, train_loss: 0.8033, test_loss: 0.8785, test_f1: 0.5322
 epoch: 76, train_loss: 0.8044, test_loss: 0.9032, test_f1: 0.5203
 epoch: 77, train_loss: 0.8085, test_loss: 0.8744, test_f1: 0.5514
 epoch: 78, train_loss: 0.8048, test_loss: 0.8691, test_f1: 0.5369
 epoch: 79, train_loss: 0.8019, test_loss: 0.8863, test_f1: 0.5293
 epoch: 80, train_loss: 0.8063, test_loss: 0.8715, test_f1: 0.5436
 epoch: 81, train_loss: 0.7967, test_loss: 0.8873, test_f1: 0.5302
 epoch: 82, train_loss: 0.7977, test_loss: 0.8655, test_f1: 0.5380
 epoch: 83, train_loss: 0.8107, test_loss: 0.8678, test_f1: 0.5277
 epoch: 84, train_loss: 0.7837, test_loss: 0.8750, test_f1: 0.5469
 epoch: 85, train_loss: 0.7921, test_loss: 0.8734, test_f1: 0.5484
 epoch: 86, train_loss: 0.7846, test_loss: 0.8673, test_f1: 0.5257
 epoch: 87, train_loss: 0.7885, test_loss: 0.9129, test_f1: 0.5230
 epoch: 88, train_loss: 0.7839, test_loss: 0.9029, test_f1: 0.5340
 epoch: 89, train_loss: 0.7801, test_loss: 0.8880, test_f1: 0.5180
 epoch: 90, train_loss: 0.7934, test_loss: 0.8954, test_f1: 0.5460
 epoch: 91, train_loss: 0.7918, test_loss: 0.9007, test_f1: 0.5250
 epoch: 92, train_loss: 0.7868, test_loss: 0.8681, test_f1: 0.5347
 epoch: 93, train_loss: 0.7936, test_loss: 0.8963, test_f1: 0.5429
 epoch: 94, train_loss: 0.7836, test_loss: 0.9150, test_f1: 0.5310
 epoch: 95, train_loss: 0.7827, test_loss: 0.9287, test_f1: 0.5217
 epoch: 96, train_loss: 0.7950, test_loss: 0.8735, test_f1: 0.5323
 epoch: 97, train_loss: 0.7823, test_loss: 0.8841, test_f1: 0.5340
 epoch: 98, train_loss: 0.7782, test_loss: 0.8698, test_f1: 0.5378
 epoch: 99, train_loss: 0.7867, test_loss: 0.8917, test_f1: 0.5326
##################ITERATION #3 ****************************************
 epoch: 0, train_loss: 1.2139, test_loss: 1.2768, test_f1: 0.2270
 epoch: 1, train_loss: 1.1127, test_loss: 1.0985, test_f1: 0.3431
 epoch: 2, train_loss: 1.0723, test_loss: 1.0569, test_f1: 0.3460
 epoch: 3, train_loss: 1.0442, test_loss: 1.0416, test_f1: 0.3705
 epoch: 4, train_loss: 1.0317, test_loss: 1.0342, test_f1: 0.3926
 epoch: 5, train_loss: 1.0258, test_loss: 1.0227, test_f1: 0.4211
 epoch: 6, train_loss: 1.0118, test_loss: 1.0193, test_f1: 0.4336
 epoch: 7, train_loss: 0.9990, test_loss: 1.0033, test_f1: 0.4109
 epoch: 8, train_loss: 1.0025, test_loss: 0.9992, test_f1: 0.4196
 epoch: 9, train_loss: 0.9917, test_loss: 1.0041, test_f1: 0.4261
 epoch: 10, train_loss: 0.9831, test_loss: 1.0005, test_f1: 0.4573
 epoch: 11, train_loss: 0.9665, test_loss: 0.9875, test_f1: 0.4923
 epoch: 12, train_loss: 0.9581, test_loss: 0.9771, test_f1: 0.4746
 epoch: 13, train_loss: 0.9513, test_loss: 0.9685, test_f1: 0.4646
 epoch: 14, train_loss: 0.9440, test_loss: 0.9456, test_f1: 0.4865
 epoch: 15, train_loss: 0.9375, test_loss: 0.9394, test_f1: 0.4690
 epoch: 16, train_loss: 0.9470, test_loss: 0.9999, test_f1: 0.5047
 epoch: 17, train_loss: 0.9337, test_loss: 0.9334, test_f1: 0.4795
 epoch: 18, train_loss: 0.9405, test_loss: 0.9449, test_f1: 0.4654
 epoch: 19, train_loss: 0.9282, test_loss: 0.9385, test_f1: 0.4831
 epoch: 20, train_loss: 0.9190, test_loss: 0.9290, test_f1: 0.4885
 epoch: 21, train_loss: 0.9190, test_loss: 0.9318, test_f1: 0.4902
 epoch: 22, train_loss: 0.9095, test_loss: 0.9311, test_f1: 0.4907
 epoch: 23, train_loss: 0.9055, test_loss: 0.9363, test_f1: 0.4974
 epoch: 24, train_loss: 0.9177, test_loss: 0.9520, test_f1: 0.4941
 epoch: 25, train_loss: 0.8927, test_loss: 0.9351, test_f1: 0.5008
 epoch: 26, train_loss: 0.8969, test_loss: 0.9576, test_f1: 0.4703
 epoch: 27, train_loss: 0.8998, test_loss: 0.9045, test_f1: 0.5017
 epoch: 28, train_loss: 0.8883, test_loss: 0.9252, test_f1: 0.4957
 epoch: 29, train_loss: 0.8819, test_loss: 0.9384, test_f1: 0.5037
 epoch: 30, train_loss: 0.8797, test_loss: 0.9208, test_f1: 0.4915
 epoch: 31, train_loss: 0.8804, test_loss: 0.9651, test_f1: 0.5070
 epoch: 32, train_loss: 0.8769, test_loss: 0.9439, test_f1: 0.5151
 epoch: 33, train_loss: 0.8796, test_loss: 0.9254, test_f1: 0.5171
 epoch: 34, train_loss: 0.8821, test_loss: 0.9394, test_f1: 0.4897
 epoch: 35, train_loss: 0.8682, test_loss: 0.9516, test_f1: 0.4948
 epoch: 36, train_loss: 0.8675, test_loss: 0.9023, test_f1: 0.5033
 epoch: 37, train_loss: 0.8684, test_loss: 0.9665, test_f1: 0.5069
 epoch: 38, train_loss: 0.8584, test_loss: 0.9860, test_f1: 0.4989
 epoch: 39, train_loss: 0.8588, test_loss: 0.9547, test_f1: 0.5061
 epoch: 40, train_loss: 0.8522, test_loss: 0.9300, test_f1: 0.5215
 epoch: 41, train_loss: 0.8661, test_loss: 0.9307, test_f1: 0.5226
 epoch: 42, train_loss: 0.8600, test_loss: 0.9903, test_f1: 0.5092
 epoch: 43, train_loss: 0.8473, test_loss: 0.9681, test_f1: 0.5195
 epoch: 44, train_loss: 0.8529, test_loss: 0.9682, test_f1: 0.5033
 epoch: 45, train_loss: 0.8428, test_loss: 1.0128, test_f1: 0.4820
 epoch: 46, train_loss: 0.8417, test_loss: 0.9581, test_f1: 0.5233
 epoch: 47, train_loss: 0.8402, test_loss: 0.9644, test_f1: 0.5295
 epoch: 48, train_loss: 0.8444, test_loss: 0.9559, test_f1: 0.5073
 epoch: 49, train_loss: 0.8510, test_loss: 1.0057, test_f1: 0.5057
 epoch: 50, train_loss: 0.8376, test_loss: 0.9991, test_f1: 0.5163
 epoch: 51, train_loss: 0.8241, test_loss: 0.9525, test_f1: 0.5320
 epoch: 52, train_loss: 0.8314, test_loss: 0.9618, test_f1: 0.5388
 epoch: 53, train_loss: 0.8303, test_loss: 0.9424, test_f1: 0.5279
 epoch: 54, train_loss: 0.8233, test_loss: 0.9593, test_f1: 0.5222
 epoch: 55, train_loss: 0.8124, test_loss: 0.9727, test_f1: 0.5226
 epoch: 56, train_loss: 0.8123, test_loss: 0.9632, test_f1: 0.5323
 epoch: 57, train_loss: 0.8058, test_loss: 0.9641, test_f1: 0.5232
 epoch: 58, train_loss: 0.8065, test_loss: 0.9526, test_f1: 0.5240
 epoch: 59, train_loss: 0.8173, test_loss: 0.9641, test_f1: 0.5261
 epoch: 60, train_loss: 0.8086, test_loss: 1.0037, test_f1: 0.5321
 epoch: 61, train_loss: 0.8116, test_loss: 0.9598, test_f1: 0.5160
 epoch: 62, train_loss: 0.8012, test_loss: 0.9482, test_f1: 0.5097
 epoch: 63, train_loss: 0.8027, test_loss: 0.9764, test_f1: 0.5241
 epoch: 64, train_loss: 0.7992, test_loss: 0.9686, test_f1: 0.5254
 epoch: 65, train_loss: 0.7885, test_loss: 0.9604, test_f1: 0.5377
 epoch: 66, train_loss: 0.8050, test_loss: 0.9794, test_f1: 0.5248
 epoch: 67, train_loss: 0.8063, test_loss: 0.9656, test_f1: 0.5274
 epoch: 68, train_loss: 0.8006, test_loss: 0.9631, test_f1: 0.5197
 epoch: 69, train_loss: 0.7935, test_loss: 0.9712, test_f1: 0.5279
 epoch: 70, train_loss: 0.8025, test_loss: 0.9770, test_f1: 0.5255
 epoch: 71, train_loss: 0.7840, test_loss: 0.9643, test_f1: 0.5398
 epoch: 72, train_loss: 0.7909, test_loss: 0.9620, test_f1: 0.5422
 epoch: 73, train_loss: 0.8033, test_loss: 1.0061, test_f1: 0.5106
 epoch: 74, train_loss: 0.7987, test_loss: 0.9726, test_f1: 0.5243
 epoch: 75, train_loss: 0.7918, test_loss: 0.9760, test_f1: 0.5333
 epoch: 76, train_loss: 0.7936, test_loss: 0.9812, test_f1: 0.5330
 epoch: 77, train_loss: 0.7933, test_loss: 0.9884, test_f1: 0.5223
 epoch: 78, train_loss: 0.7957, test_loss: 1.0046, test_f1: 0.5223
 epoch: 79, train_loss: 0.7925, test_loss: 0.9720, test_f1: 0.5392
 epoch: 80, train_loss: 0.7883, test_loss: 1.0009, test_f1: 0.5305
 epoch: 81, train_loss: 0.7864, test_loss: 0.9814, test_f1: 0.5298
 epoch: 82, train_loss: 0.7847, test_loss: 0.9879, test_f1: 0.5342
 epoch: 83, train_loss: 0.7795, test_loss: 0.9815, test_f1: 0.5349
 epoch: 84, train_loss: 0.7935, test_loss: 1.0149, test_f1: 0.5417
 epoch: 85, train_loss: 0.7822, test_loss: 0.9524, test_f1: 0.5235
 epoch: 86, train_loss: 0.7852, test_loss: 0.9759, test_f1: 0.5327
 epoch: 87, train_loss: 0.7734, test_loss: 0.9886, test_f1: 0.5432
 epoch: 88, train_loss: 0.7717, test_loss: 0.9797, test_f1: 0.5384
 epoch: 89, train_loss: 0.7785, test_loss: 0.9901, test_f1: 0.5375
 epoch: 90, train_loss: 0.7804, test_loss: 0.9868, test_f1: 0.5355
 epoch: 91, train_loss: 0.7819, test_loss: 0.9790, test_f1: 0.5297
 epoch: 92, train_loss: 0.7771, test_loss: 0.9937, test_f1: 0.5466
 epoch: 93, train_loss: 0.7729, test_loss: 0.9966, test_f1: 0.5348
 epoch: 94, train_loss: 0.7772, test_loss: 0.9911, test_f1: 0.5311
 epoch: 95, train_loss: 0.7835, test_loss: 0.9958, test_f1: 0.5324
 epoch: 96, train_loss: 0.7772, test_loss: 1.0024, test_f1: 0.5216
 epoch: 97, train_loss: 0.7641, test_loss: 0.9752, test_f1: 0.5298
 epoch: 98, train_loss: 0.7775, test_loss: 0.9963, test_f1: 0.5328
 epoch: 99, train_loss: 0.7791, test_loss: 1.0300, test_f1: 0.5375
##################ITERATION #4 ****************************************
 epoch: 0, train_loss: 1.2294, test_loss: 1.4253, test_f1: 0.2764
 epoch: 1, train_loss: 1.1076, test_loss: 1.0846, test_f1: 0.4245
 epoch: 2, train_loss: 1.0770, test_loss: 1.0210, test_f1: 0.4452
 epoch: 3, train_loss: 1.0374, test_loss: 1.0005, test_f1: 0.4515
 epoch: 4, train_loss: 1.0189, test_loss: 0.9677, test_f1: 0.4576
 epoch: 5, train_loss: 1.0061, test_loss: 0.9710, test_f1: 0.4694
 epoch: 6, train_loss: 0.9979, test_loss: 0.9478, test_f1: 0.4774
 epoch: 7, train_loss: 0.9691, test_loss: 0.9399, test_f1: 0.4827
 epoch: 8, train_loss: 0.9735, test_loss: 0.9759, test_f1: 0.4982
 epoch: 9, train_loss: 0.9623, test_loss: 0.9419, test_f1: 0.4991
 epoch: 10, train_loss: 0.9481, test_loss: 0.8911, test_f1: 0.5128
 epoch: 11, train_loss: 0.9479, test_loss: 0.9139, test_f1: 0.4754
 epoch: 12, train_loss: 0.9271, test_loss: 0.9302, test_f1: 0.4950
 epoch: 13, train_loss: 0.9343, test_loss: 0.8896, test_f1: 0.4919
 epoch: 14, train_loss: 0.9330, test_loss: 0.9051, test_f1: 0.4865
 epoch: 15, train_loss: 0.9137, test_loss: 0.9337, test_f1: 0.5188
 epoch: 16, train_loss: 0.9075, test_loss: 0.9401, test_f1: 0.5106
 epoch: 17, train_loss: 0.8966, test_loss: 0.8837, test_f1: 0.5048
 epoch: 18, train_loss: 0.8949, test_loss: 0.8446, test_f1: 0.5269
 epoch: 19, train_loss: 0.8916, test_loss: 0.9231, test_f1: 0.5302
 epoch: 20, train_loss: 0.8978, test_loss: 0.8555, test_f1: 0.5178
 epoch: 21, train_loss: 0.8833, test_loss: 0.8919, test_f1: 0.5149
 epoch: 22, train_loss: 0.8704, test_loss: 0.8978, test_f1: 0.5327
 epoch: 23, train_loss: 0.8638, test_loss: 0.8733, test_f1: 0.5089
 epoch: 24, train_loss: 0.8693, test_loss: 0.8440, test_f1: 0.5478
 epoch: 25, train_loss: 0.8597, test_loss: 0.8082, test_f1: 0.5482
 epoch: 26, train_loss: 0.8580, test_loss: 0.8422, test_f1: 0.5391
 epoch: 27, train_loss: 0.8537, test_loss: 0.8137, test_f1: 0.5533
 epoch: 28, train_loss: 0.8500, test_loss: 0.8119, test_f1: 0.5483
 epoch: 29, train_loss: 0.8469, test_loss: 0.8439, test_f1: 0.5449
 epoch: 30, train_loss: 0.8431, test_loss: 0.8777, test_f1: 0.5550
 epoch: 31, train_loss: 0.8420, test_loss: 0.8193, test_f1: 0.5361
 epoch: 32, train_loss: 0.8281, test_loss: 0.8641, test_f1: 0.5560
 epoch: 33, train_loss: 0.8283, test_loss: 0.8145, test_f1: 0.5445
 epoch: 34, train_loss: 0.8183, test_loss: 0.8249, test_f1: 0.5530
 epoch: 35, train_loss: 0.8091, test_loss: 0.8358, test_f1: 0.5434
 epoch: 36, train_loss: 0.8148, test_loss: 0.8121, test_f1: 0.5513
 epoch: 37, train_loss: 0.8191, test_loss: 0.7806, test_f1: 0.5697
 epoch: 38, train_loss: 0.8172, test_loss: 0.7979, test_f1: 0.5568
 epoch: 39, train_loss: 0.8094, test_loss: 0.8050, test_f1: 0.5508
 epoch: 40, train_loss: 0.7979, test_loss: 0.8038, test_f1: 0.5559
 epoch: 41, train_loss: 0.8068, test_loss: 0.7858, test_f1: 0.5820
 epoch: 42, train_loss: 0.7973, test_loss: 0.7736, test_f1: 0.6059
 epoch: 43, train_loss: 0.8101, test_loss: 0.8010, test_f1: 0.5685
 epoch: 44, train_loss: 0.7900, test_loss: 0.8203, test_f1: 0.5713
 epoch: 45, train_loss: 0.7954, test_loss: 0.9305, test_f1: 0.5355
 epoch: 46, train_loss: 0.7953, test_loss: 0.8677, test_f1: 0.5628
 epoch: 47, train_loss: 0.7747, test_loss: 0.7937, test_f1: 0.5807
 epoch: 48, train_loss: 0.7856, test_loss: 0.7717, test_f1: 0.5796
 epoch: 49, train_loss: 0.7770, test_loss: 0.8369, test_f1: 0.5609
 epoch: 50, train_loss: 0.7845, test_loss: 0.7982, test_f1: 0.5699
 epoch: 51, train_loss: 0.7772, test_loss: 0.8324, test_f1: 0.5638
 epoch: 52, train_loss: 0.7776, test_loss: 0.7644, test_f1: 0.5803
 epoch: 53, train_loss: 0.7663, test_loss: 0.7906, test_f1: 0.5788
 epoch: 54, train_loss: 0.7735, test_loss: 0.8077, test_f1: 0.5660
 epoch: 55, train_loss: 0.7685, test_loss: 0.7719, test_f1: 0.5950
 epoch: 56, train_loss: 0.7606, test_loss: 0.7903, test_f1: 0.5806
 epoch: 57, train_loss: 0.7575, test_loss: 0.7873, test_f1: 0.5775
 epoch: 58, train_loss: 0.7606, test_loss: 0.8094, test_f1: 0.5658
 epoch: 59, train_loss: 0.7628, test_loss: 0.8152, test_f1: 0.5717
 epoch: 60, train_loss: 0.7647, test_loss: 0.7830, test_f1: 0.5665
 epoch: 61, train_loss: 0.7546, test_loss: 0.7944, test_f1: 0.5768
 epoch: 62, train_loss: 0.7508, test_loss: 0.7881, test_f1: 0.5823
 epoch: 63, train_loss: 0.7477, test_loss: 0.8919, test_f1: 0.5676
 epoch: 64, train_loss: 0.7696, test_loss: 0.7605, test_f1: 0.5957
 epoch: 65, train_loss: 0.7502, test_loss: 0.7802, test_f1: 0.5847
 epoch: 66, train_loss: 0.7507, test_loss: 0.7735, test_f1: 0.5946
 epoch: 67, train_loss: 0.7584, test_loss: 0.8050, test_f1: 0.5768
 epoch: 68, train_loss: 0.7557, test_loss: 0.7741, test_f1: 0.5907
 epoch: 69, train_loss: 0.7469, test_loss: 0.7547, test_f1: 0.5893
 epoch: 70, train_loss: 0.7433, test_loss: 0.7785, test_f1: 0.5955
 epoch: 71, train_loss: 0.7530, test_loss: 0.7819, test_f1: 0.5752
 epoch: 72, train_loss: 0.7489, test_loss: 0.7763, test_f1: 0.5846
 epoch: 73, train_loss: 0.7366, test_loss: 0.7874, test_f1: 0.5807
 epoch: 74, train_loss: 0.7462, test_loss: 0.7769, test_f1: 0.5951
 epoch: 75, train_loss: 0.7453, test_loss: 0.7815, test_f1: 0.5773
 epoch: 76, train_loss: 0.7449, test_loss: 0.7922, test_f1: 0.5821
 epoch: 77, train_loss: 0.7366, test_loss: 0.7872, test_f1: 0.5797
 epoch: 78, train_loss: 0.7413, test_loss: 0.7781, test_f1: 0.6029
 epoch: 79, train_loss: 0.7427, test_loss: 0.7965, test_f1: 0.5856
 epoch: 80, train_loss: 0.7292, test_loss: 0.7679, test_f1: 0.5898
 epoch: 81, train_loss: 0.7367, test_loss: 0.7788, test_f1: 0.5756
 epoch: 82, train_loss: 0.7417, test_loss: 0.7719, test_f1: 0.5820
 epoch: 83, train_loss: 0.7321, test_loss: 0.7864, test_f1: 0.5848
 epoch: 84, train_loss: 0.7380, test_loss: 0.8195, test_f1: 0.5811
 epoch: 85, train_loss: 0.7311, test_loss: 0.8082, test_f1: 0.5786
 epoch: 86, train_loss: 0.7337, test_loss: 0.7433, test_f1: 0.6174
 epoch: 87, train_loss: 0.7383, test_loss: 0.8185, test_f1: 0.5682
 epoch: 88, train_loss: 0.7319, test_loss: 0.7800, test_f1: 0.5954
 epoch: 89, train_loss: 0.7224, test_loss: 0.7624, test_f1: 0.5978
 epoch: 90, train_loss: 0.7323, test_loss: 0.7731, test_f1: 0.5936
 epoch: 91, train_loss: 0.7348, test_loss: 0.8208, test_f1: 0.5881
 epoch: 92, train_loss: 0.7228, test_loss: 0.7907, test_f1: 0.6005
 epoch: 93, train_loss: 0.7229, test_loss: 0.8112, test_f1: 0.5768
 epoch: 94, train_loss: 0.7253, test_loss: 0.7472, test_f1: 0.5993
 epoch: 95, train_loss: 0.7237, test_loss: 0.8347, test_f1: 0.5782
 epoch: 96, train_loss: 0.7254, test_loss: 0.7724, test_f1: 0.5900
 epoch: 97, train_loss: 0.7305, test_loss: 0.7871, test_f1: 0.6127
 epoch: 98, train_loss: 0.7363, test_loss: 0.8097, test_f1: 0.5948
 epoch: 99, train_loss: 0.7179, test_loss: 0.8207, test_f1: 0.5775
##################ITERATION #5 ****************************************
 epoch: 0, train_loss: 1.3664, test_loss: 1.3860, test_f1: 0.2270
 epoch: 1, train_loss: 1.1460, test_loss: 1.2599, test_f1: 0.2757
 epoch: 2, train_loss: 1.0907, test_loss: 1.0745, test_f1: 0.4067
 epoch: 3, train_loss: 1.0569, test_loss: 1.0255, test_f1: 0.4765
 epoch: 4, train_loss: 1.0400, test_loss: 1.0062, test_f1: 0.4801
 epoch: 5, train_loss: 1.0295, test_loss: 1.0005, test_f1: 0.4760
 epoch: 6, train_loss: 1.0100, test_loss: 0.9864, test_f1: 0.4657
 epoch: 7, train_loss: 0.9861, test_loss: 0.9810, test_f1: 0.4929
 epoch: 8, train_loss: 0.9803, test_loss: 0.9880, test_f1: 0.4749
 epoch: 9, train_loss: 0.9716, test_loss: 1.0199, test_f1: 0.4599
 epoch: 10, train_loss: 0.9630, test_loss: 0.9485, test_f1: 0.4720
 epoch: 11, train_loss: 0.9564, test_loss: 0.9801, test_f1: 0.4727
 epoch: 12, train_loss: 0.9446, test_loss: 0.9220, test_f1: 0.5071
 epoch: 13, train_loss: 0.9249, test_loss: 0.9213, test_f1: 0.4985
 epoch: 14, train_loss: 0.9283, test_loss: 0.9220, test_f1: 0.4823
 epoch: 15, train_loss: 0.9198, test_loss: 0.9392, test_f1: 0.4886
 epoch: 16, train_loss: 0.9285, test_loss: 0.9058, test_f1: 0.5209
 epoch: 17, train_loss: 0.9199, test_loss: 0.8927, test_f1: 0.5305
 epoch: 18, train_loss: 0.9063, test_loss: 0.9298, test_f1: 0.4999
 epoch: 19, train_loss: 0.9033, test_loss: 0.8876, test_f1: 0.5353
 epoch: 20, train_loss: 0.8969, test_loss: 0.9106, test_f1: 0.5177
 epoch: 21, train_loss: 0.8878, test_loss: 0.8743, test_f1: 0.5466
 epoch: 22, train_loss: 0.8812, test_loss: 0.8933, test_f1: 0.5187
 epoch: 23, train_loss: 0.8871, test_loss: 0.8847, test_f1: 0.5346
 epoch: 24, train_loss: 0.8690, test_loss: 0.9119, test_f1: 0.5067
 epoch: 25, train_loss: 0.8550, test_loss: 0.8838, test_f1: 0.5202
 epoch: 26, train_loss: 0.8692, test_loss: 0.9354, test_f1: 0.4984
 epoch: 27, train_loss: 0.8621, test_loss: 0.8725, test_f1: 0.5447
 epoch: 28, train_loss: 0.8632, test_loss: 0.8853, test_f1: 0.5405
 epoch: 29, train_loss: 0.8694, test_loss: 0.9178, test_f1: 0.5488
 epoch: 30, train_loss: 0.8615, test_loss: 0.8472, test_f1: 0.5499
 epoch: 31, train_loss: 0.8526, test_loss: 0.8588, test_f1: 0.5362
 epoch: 32, train_loss: 0.8378, test_loss: 0.8609, test_f1: 0.5293
 epoch: 33, train_loss: 0.8383, test_loss: 0.8808, test_f1: 0.5420
 epoch: 34, train_loss: 0.8418, test_loss: 0.8759, test_f1: 0.5463
 epoch: 35, train_loss: 0.8386, test_loss: 1.0029, test_f1: 0.5006
 epoch: 36, train_loss: 0.8348, test_loss: 0.8811, test_f1: 0.5312
 epoch: 37, train_loss: 0.8273, test_loss: 0.8359, test_f1: 0.5463
 epoch: 38, train_loss: 0.8141, test_loss: 0.8709, test_f1: 0.5622
 epoch: 39, train_loss: 0.8132, test_loss: 0.8612, test_f1: 0.5352
 epoch: 40, train_loss: 0.8095, test_loss: 0.8491, test_f1: 0.5487
 epoch: 41, train_loss: 0.8173, test_loss: 0.8822, test_f1: 0.5578
 epoch: 42, train_loss: 0.8015, test_loss: 0.8523, test_f1: 0.5401
 epoch: 43, train_loss: 0.8058, test_loss: 0.8528, test_f1: 0.5281
 epoch: 44, train_loss: 0.8159, test_loss: 0.8511, test_f1: 0.5434
 epoch: 45, train_loss: 0.8048, test_loss: 0.8153, test_f1: 0.5671
 epoch: 46, train_loss: 0.7935, test_loss: 0.8477, test_f1: 0.5635
 epoch: 47, train_loss: 0.7916, test_loss: 0.8380, test_f1: 0.5585
 epoch: 48, train_loss: 0.7968, test_loss: 0.8521, test_f1: 0.5458
 epoch: 49, train_loss: 0.7871, test_loss: 0.8051, test_f1: 0.5569
 epoch: 50, train_loss: 0.7854, test_loss: 0.8200, test_f1: 0.5625
 epoch: 51, train_loss: 0.7763, test_loss: 0.8320, test_f1: 0.5749
 epoch: 52, train_loss: 0.7656, test_loss: 0.8333, test_f1: 0.5638
 epoch: 53, train_loss: 0.7813, test_loss: 0.8438, test_f1: 0.5577
 epoch: 54, train_loss: 0.7628, test_loss: 0.8175, test_f1: 0.5647
 epoch: 55, train_loss: 0.7664, test_loss: 0.8170, test_f1: 0.5610
 epoch: 56, train_loss: 0.7676, test_loss: 0.8453, test_f1: 0.5451
 epoch: 57, train_loss: 0.7651, test_loss: 0.8606, test_f1: 0.5395
 epoch: 58, train_loss: 0.7626, test_loss: 0.8417, test_f1: 0.5444
 epoch: 59, train_loss: 0.7433, test_loss: 0.8472, test_f1: 0.5585
 epoch: 60, train_loss: 0.7575, test_loss: 0.8428, test_f1: 0.5566
 epoch: 61, train_loss: 0.7640, test_loss: 0.8710, test_f1: 0.5315
 epoch: 62, train_loss: 0.7550, test_loss: 0.8424, test_f1: 0.5637
 epoch: 63, train_loss: 0.7543, test_loss: 0.8079, test_f1: 0.5821
 epoch: 64, train_loss: 0.7563, test_loss: 0.8390, test_f1: 0.5587
 epoch: 65, train_loss: 0.7542, test_loss: 0.8288, test_f1: 0.5518
 epoch: 66, train_loss: 0.7553, test_loss: 0.8246, test_f1: 0.5623
 epoch: 67, train_loss: 0.7534, test_loss: 0.8305, test_f1: 0.5621
 epoch: 68, train_loss: 0.7457, test_loss: 0.8607, test_f1: 0.5597
 epoch: 69, train_loss: 0.7569, test_loss: 0.8677, test_f1: 0.5692
 epoch: 70, train_loss: 0.7449, test_loss: 0.8433, test_f1: 0.5509
 epoch: 71, train_loss: 0.7482, test_loss: 0.8380, test_f1: 0.5829
 epoch: 72, train_loss: 0.7519, test_loss: 0.8647, test_f1: 0.5686
 epoch: 73, train_loss: 0.7477, test_loss: 0.8537, test_f1: 0.5559
 epoch: 74, train_loss: 0.7437, test_loss: 0.8533, test_f1: 0.5591
 epoch: 75, train_loss: 0.7304, test_loss: 0.8629, test_f1: 0.5741
 epoch: 76, train_loss: 0.7459, test_loss: 0.8617, test_f1: 0.5675
 epoch: 77, train_loss: 0.7384, test_loss: 0.8537, test_f1: 0.5540
 epoch: 78, train_loss: 0.7335, test_loss: 0.8457, test_f1: 0.5686
 epoch: 79, train_loss: 0.7256, test_loss: 0.9022, test_f1: 0.5552
 epoch: 80, train_loss: 0.7370, test_loss: 0.8443, test_f1: 0.5740
 epoch: 81, train_loss: 0.7348, test_loss: 0.8547, test_f1: 0.5470
 epoch: 82, train_loss: 0.7472, test_loss: 0.8789, test_f1: 0.5703
 epoch: 83, train_loss: 0.7356, test_loss: 0.8366, test_f1: 0.5749
 epoch: 84, train_loss: 0.7331, test_loss: 0.8665, test_f1: 0.5595
 epoch: 85, train_loss: 0.7419, test_loss: 0.8434, test_f1: 0.5729
 epoch: 86, train_loss: 0.7264, test_loss: 0.8793, test_f1: 0.5510
 epoch: 87, train_loss: 0.7261, test_loss: 0.8587, test_f1: 0.5709
 epoch: 88, train_loss: 0.7406, test_loss: 0.8788, test_f1: 0.5667
 epoch: 89, train_loss: 0.7286, test_loss: 0.8658, test_f1: 0.5673
 epoch: 90, train_loss: 0.7162, test_loss: 0.8482, test_f1: 0.5725
 epoch: 91, train_loss: 0.7359, test_loss: 0.8450, test_f1: 0.5951
 epoch: 92, train_loss: 0.7307, test_loss: 0.8477, test_f1: 0.5848
 epoch: 93, train_loss: 0.7270, test_loss: 0.8448, test_f1: 0.5784
 epoch: 94, train_loss: 0.7413, test_loss: 0.8753, test_f1: 0.5605
 epoch: 95, train_loss: 0.7265, test_loss: 0.8561, test_f1: 0.5642
 epoch: 96, train_loss: 0.7185, test_loss: 0.8870, test_f1: 0.5756
 epoch: 97, train_loss: 0.7180, test_loss: 0.8453, test_f1: 0.5881
 epoch: 98, train_loss: 0.7134, test_loss: 0.9159, test_f1: 0.5691
 epoch: 99, train_loss: 0.7205, test_loss: 0.8617, test_f1: 0.5730
##################ITERATION #6 ****************************************
 epoch: 0, train_loss: 1.3211, test_loss: 1.4001, test_f1: 0.2270
 epoch: 1, train_loss: 1.1164, test_loss: 1.1180, test_f1: 0.3187
 epoch: 2, train_loss: 1.0848, test_loss: 1.0522, test_f1: 0.3982
 epoch: 3, train_loss: 1.0663, test_loss: 1.0278, test_f1: 0.4242
 epoch: 4, train_loss: 1.0538, test_loss: 1.0382, test_f1: 0.4508
 epoch: 5, train_loss: 1.0385, test_loss: 1.0271, test_f1: 0.4633
 epoch: 6, train_loss: 1.0297, test_loss: 1.0222, test_f1: 0.4603
 epoch: 7, train_loss: 1.0169, test_loss: 0.9972, test_f1: 0.4635
 epoch: 8, train_loss: 1.0127, test_loss: 1.0014, test_f1: 0.4539
 epoch: 9, train_loss: 1.0029, test_loss: 0.9963, test_f1: 0.5022
 epoch: 10, train_loss: 0.9955, test_loss: 0.9880, test_f1: 0.4628
 epoch: 11, train_loss: 0.9914, test_loss: 1.0037, test_f1: 0.5013
 epoch: 12, train_loss: 0.9880, test_loss: 0.9954, test_f1: 0.4837
 epoch: 13, train_loss: 0.9763, test_loss: 0.9633, test_f1: 0.5039
 epoch: 14, train_loss: 0.9671, test_loss: 0.9659, test_f1: 0.5001
 epoch: 15, train_loss: 0.9615, test_loss: 0.9675, test_f1: 0.5012
 epoch: 16, train_loss: 0.9539, test_loss: 0.9540, test_f1: 0.5110
 epoch: 17, train_loss: 0.9521, test_loss: 0.9386, test_f1: 0.4987
 epoch: 18, train_loss: 0.9357, test_loss: 0.9257, test_f1: 0.5056
 epoch: 19, train_loss: 0.9390, test_loss: 0.9454, test_f1: 0.5033
 epoch: 20, train_loss: 0.9377, test_loss: 0.9757, test_f1: 0.4987
 epoch: 21, train_loss: 0.9385, test_loss: 0.9354, test_f1: 0.4844
 epoch: 22, train_loss: 0.9247, test_loss: 0.9411, test_f1: 0.5262
 epoch: 23, train_loss: 0.9230, test_loss: 0.9301, test_f1: 0.5226
 epoch: 24, train_loss: 0.9241, test_loss: 0.9388, test_f1: 0.5270
 epoch: 25, train_loss: 0.9246, test_loss: 0.9556, test_f1: 0.5128
 epoch: 26, train_loss: 0.9204, test_loss: 0.9389, test_f1: 0.5165
 epoch: 27, train_loss: 0.9177, test_loss: 0.9220, test_f1: 0.5287
 epoch: 28, train_loss: 0.9088, test_loss: 0.9804, test_f1: 0.5265
 epoch: 29, train_loss: 0.9058, test_loss: 0.8779, test_f1: 0.5218
 epoch: 30, train_loss: 0.9126, test_loss: 0.9233, test_f1: 0.5432
 epoch: 31, train_loss: 0.9027, test_loss: 0.9247, test_f1: 0.5209
 epoch: 32, train_loss: 0.8912, test_loss: 0.8665, test_f1: 0.5673
 epoch: 33, train_loss: 0.8871, test_loss: 0.8884, test_f1: 0.5418
 epoch: 34, train_loss: 0.8849, test_loss: 0.9013, test_f1: 0.5302
 epoch: 35, train_loss: 0.8775, test_loss: 0.8910, test_f1: 0.5349
 epoch: 36, train_loss: 0.8881, test_loss: 0.8488, test_f1: 0.5449
 epoch: 37, train_loss: 0.8653, test_loss: 0.9138, test_f1: 0.5318
 epoch: 38, train_loss: 0.8682, test_loss: 0.8399, test_f1: 0.5717
 epoch: 39, train_loss: 0.8725, test_loss: 0.8933, test_f1: 0.5615
 epoch: 40, train_loss: 0.8641, test_loss: 0.8417, test_f1: 0.5699
 epoch: 41, train_loss: 0.8707, test_loss: 0.8721, test_f1: 0.5553
 epoch: 42, train_loss: 0.8500, test_loss: 0.8351, test_f1: 0.5562
 epoch: 43, train_loss: 0.8533, test_loss: 0.8435, test_f1: 0.5661
 epoch: 44, train_loss: 0.8469, test_loss: 0.8742, test_f1: 0.5335
 epoch: 45, train_loss: 0.8424, test_loss: 0.8366, test_f1: 0.5749
 epoch: 46, train_loss: 0.8411, test_loss: 0.9234, test_f1: 0.5386
 epoch: 47, train_loss: 0.8343, test_loss: 0.8960, test_f1: 0.5200
 epoch: 48, train_loss: 0.8334, test_loss: 0.8305, test_f1: 0.5515
 epoch: 49, train_loss: 0.8363, test_loss: 0.8076, test_f1: 0.5577
 epoch: 50, train_loss: 0.8364, test_loss: 0.8558, test_f1: 0.5378
 epoch: 51, train_loss: 0.8242, test_loss: 0.8152, test_f1: 0.5716
 epoch: 52, train_loss: 0.8377, test_loss: 0.7893, test_f1: 0.5715
 epoch: 53, train_loss: 0.8138, test_loss: 0.7976, test_f1: 0.5730
 epoch: 54, train_loss: 0.8152, test_loss: 0.7936, test_f1: 0.5621
 epoch: 55, train_loss: 0.8069, test_loss: 0.8090, test_f1: 0.5658
 epoch: 56, train_loss: 0.8300, test_loss: 0.8075, test_f1: 0.5750
 epoch: 57, train_loss: 0.8216, test_loss: 0.8058, test_f1: 0.5775
 epoch: 58, train_loss: 0.8048, test_loss: 0.8405, test_f1: 0.5628
 epoch: 59, train_loss: 0.8125, test_loss: 0.7935, test_f1: 0.5714
 epoch: 60, train_loss: 0.8048, test_loss: 0.7883, test_f1: 0.5898
 epoch: 61, train_loss: 0.7969, test_loss: 0.7845, test_f1: 0.5723
 epoch: 62, train_loss: 0.7957, test_loss: 0.8106, test_f1: 0.5836
 epoch: 63, train_loss: 0.7960, test_loss: 0.7914, test_f1: 0.5883
 epoch: 64, train_loss: 0.8177, test_loss: 0.7991, test_f1: 0.5979
 epoch: 65, train_loss: 0.7957, test_loss: 0.7957, test_f1: 0.5760
 epoch: 66, train_loss: 0.7963, test_loss: 0.7840, test_f1: 0.5718
 epoch: 67, train_loss: 0.7986, test_loss: 0.7938, test_f1: 0.6015
 epoch: 68, train_loss: 0.7917, test_loss: 0.7969, test_f1: 0.5913
 epoch: 69, train_loss: 0.7935, test_loss: 0.7753, test_f1: 0.5828
 epoch: 70, train_loss: 0.7930, test_loss: 0.8049, test_f1: 0.5837
 epoch: 71, train_loss: 0.7992, test_loss: 0.7780, test_f1: 0.5879
 epoch: 72, train_loss: 0.7808, test_loss: 0.8366, test_f1: 0.5871
 epoch: 73, train_loss: 0.7914, test_loss: 0.7756, test_f1: 0.5893
 epoch: 74, train_loss: 0.7897, test_loss: 0.8152, test_f1: 0.5786
 epoch: 75, train_loss: 0.7802, test_loss: 0.7815, test_f1: 0.5997
 epoch: 76, train_loss: 0.7769, test_loss: 0.7799, test_f1: 0.5986
 epoch: 77, train_loss: 0.7866, test_loss: 0.7762, test_f1: 0.5880
 epoch: 78, train_loss: 0.7803, test_loss: 0.7877, test_f1: 0.5884
 epoch: 79, train_loss: 0.7817, test_loss: 0.7719, test_f1: 0.6027
 epoch: 80, train_loss: 0.7846, test_loss: 0.7815, test_f1: 0.6133
 epoch: 81, train_loss: 0.7845, test_loss: 0.7689, test_f1: 0.5980
 epoch: 82, train_loss: 0.7814, test_loss: 0.7860, test_f1: 0.6067
 epoch: 83, train_loss: 0.7732, test_loss: 0.7583, test_f1: 0.6124
 epoch: 84, train_loss: 0.7760, test_loss: 0.7646, test_f1: 0.5945
 epoch: 85, train_loss: 0.7806, test_loss: 0.7799, test_f1: 0.6021
 epoch: 86, train_loss: 0.7641, test_loss: 0.7753, test_f1: 0.6076
 epoch: 87, train_loss: 0.7722, test_loss: 0.7778, test_f1: 0.6035
 epoch: 88, train_loss: 0.7586, test_loss: 0.7828, test_f1: 0.5982
 epoch: 89, train_loss: 0.7795, test_loss: 0.7616, test_f1: 0.5844
 epoch: 90, train_loss: 0.7644, test_loss: 0.7873, test_f1: 0.6066
 epoch: 91, train_loss: 0.7740, test_loss: 0.7845, test_f1: 0.5886
 epoch: 92, train_loss: 0.7585, test_loss: 0.7706, test_f1: 0.5981
 epoch: 93, train_loss: 0.7624, test_loss: 0.7660, test_f1: 0.6059
 epoch: 94, train_loss: 0.7725, test_loss: 0.7645, test_f1: 0.6101
 epoch: 95, train_loss: 0.7762, test_loss: 0.7626, test_f1: 0.5922
 epoch: 96, train_loss: 0.7628, test_loss: 0.7704, test_f1: 0.5913
 epoch: 97, train_loss: 0.7708, test_loss: 0.8556, test_f1: 0.5896
 epoch: 98, train_loss: 0.7803, test_loss: 0.7695, test_f1: 0.5937
 epoch: 99, train_loss: 0.7579, test_loss: 0.7615, test_f1: 0.6146
##################ITERATION #7 ****************************************
 epoch: 0, train_loss: 1.4528, test_loss: 1.3394, test_f1: 0.2943
 epoch: 1, train_loss: 1.1615, test_loss: 1.1416, test_f1: 0.4238
 epoch: 2, train_loss: 1.1190, test_loss: 1.0761, test_f1: 0.4056
 epoch: 3, train_loss: 1.0901, test_loss: 1.0634, test_f1: 0.3962
 epoch: 4, train_loss: 1.0635, test_loss: 1.0457, test_f1: 0.4310
 epoch: 5, train_loss: 1.0535, test_loss: 1.0278, test_f1: 0.4402
 epoch: 6, train_loss: 1.0305, test_loss: 1.0373, test_f1: 0.4256
 epoch: 7, train_loss: 1.0330, test_loss: 1.0104, test_f1: 0.4501
 epoch: 8, train_loss: 1.0181, test_loss: 1.0166, test_f1: 0.4643
 epoch: 9, train_loss: 1.0047, test_loss: 1.0071, test_f1: 0.4553
 epoch: 10, train_loss: 1.0017, test_loss: 1.0010, test_f1: 0.4536
 epoch: 11, train_loss: 0.9953, test_loss: 0.9981, test_f1: 0.4689
 epoch: 12, train_loss: 0.9899, test_loss: 1.0004, test_f1: 0.4593
 epoch: 13, train_loss: 0.9742, test_loss: 0.9899, test_f1: 0.4597
 epoch: 14, train_loss: 0.9654, test_loss: 0.9961, test_f1: 0.4796
 epoch: 15, train_loss: 0.9637, test_loss: 1.0089, test_f1: 0.4780
 epoch: 16, train_loss: 0.9589, test_loss: 0.9855, test_f1: 0.5015
 epoch: 17, train_loss: 0.9559, test_loss: 0.9821, test_f1: 0.4982
 epoch: 18, train_loss: 0.9512, test_loss: 0.9834, test_f1: 0.4796
 epoch: 19, train_loss: 0.9312, test_loss: 0.9647, test_f1: 0.4736
 epoch: 20, train_loss: 0.9230, test_loss: 0.9640, test_f1: 0.5017
 epoch: 21, train_loss: 0.9126, test_loss: 0.9479, test_f1: 0.5192
 epoch: 22, train_loss: 0.9183, test_loss: 0.9393, test_f1: 0.4884
 epoch: 23, train_loss: 0.9102, test_loss: 0.9458, test_f1: 0.5145
 epoch: 24, train_loss: 0.9190, test_loss: 0.9447, test_f1: 0.4856
 epoch: 25, train_loss: 0.8979, test_loss: 0.9664, test_f1: 0.4871
 epoch: 26, train_loss: 0.9036, test_loss: 0.9509, test_f1: 0.4910
 epoch: 27, train_loss: 0.8953, test_loss: 0.9278, test_f1: 0.5075
 epoch: 28, train_loss: 0.9007, test_loss: 0.9318, test_f1: 0.5000
 epoch: 29, train_loss: 0.8976, test_loss: 0.9318, test_f1: 0.4878
 epoch: 30, train_loss: 0.8814, test_loss: 0.9483, test_f1: 0.5097
 epoch: 31, train_loss: 0.8752, test_loss: 0.9214, test_f1: 0.5066
 epoch: 32, train_loss: 0.8772, test_loss: 0.9402, test_f1: 0.4981
 epoch: 33, train_loss: 0.8715, test_loss: 0.9441, test_f1: 0.4983
 epoch: 34, train_loss: 0.8814, test_loss: 0.9512, test_f1: 0.4993
 epoch: 35, train_loss: 0.8671, test_loss: 0.9354, test_f1: 0.5108
 epoch: 36, train_loss: 0.8585, test_loss: 0.9519, test_f1: 0.5051
 epoch: 37, train_loss: 0.8532, test_loss: 0.9332, test_f1: 0.5299
 epoch: 38, train_loss: 0.8534, test_loss: 0.9726, test_f1: 0.4913
 epoch: 39, train_loss: 0.8516, test_loss: 0.9385, test_f1: 0.5237
 epoch: 40, train_loss: 0.8498, test_loss: 0.9099, test_f1: 0.5220
 epoch: 41, train_loss: 0.8473, test_loss: 0.9320, test_f1: 0.5180
 epoch: 42, train_loss: 0.8381, test_loss: 0.9344, test_f1: 0.5146
 epoch: 43, train_loss: 0.8495, test_loss: 0.9494, test_f1: 0.5269
 epoch: 44, train_loss: 0.8375, test_loss: 0.9426, test_f1: 0.4999
 epoch: 45, train_loss: 0.8405, test_loss: 0.9102, test_f1: 0.5205
 epoch: 46, train_loss: 0.8296, test_loss: 0.9157, test_f1: 0.5103
 epoch: 47, train_loss: 0.8339, test_loss: 0.9351, test_f1: 0.5075
 epoch: 48, train_loss: 0.8501, test_loss: 0.9033, test_f1: 0.5185
 epoch: 49, train_loss: 0.8326, test_loss: 0.9137, test_f1: 0.5065
 epoch: 50, train_loss: 0.8229, test_loss: 0.9300, test_f1: 0.4974
 epoch: 51, train_loss: 0.8230, test_loss: 0.9373, test_f1: 0.5262
 epoch: 52, train_loss: 0.8140, test_loss: 0.9163, test_f1: 0.5148
 epoch: 53, train_loss: 0.8113, test_loss: 0.9154, test_f1: 0.5091
 epoch: 54, train_loss: 0.8053, test_loss: 0.9057, test_f1: 0.5169
 epoch: 55, train_loss: 0.8017, test_loss: 0.9027, test_f1: 0.5085
 epoch: 56, train_loss: 0.8030, test_loss: 0.9026, test_f1: 0.5111
 epoch: 57, train_loss: 0.7958, test_loss: 0.8954, test_f1: 0.5199
 epoch: 58, train_loss: 0.8039, test_loss: 0.9236, test_f1: 0.5215
 epoch: 59, train_loss: 0.7975, test_loss: 0.9223, test_f1: 0.5118
 epoch: 60, train_loss: 0.7988, test_loss: 0.9090, test_f1: 0.5224
 epoch: 61, train_loss: 0.8011, test_loss: 0.8929, test_f1: 0.5197
 epoch: 62, train_loss: 0.7934, test_loss: 0.9177, test_f1: 0.5000
 epoch: 63, train_loss: 0.7985, test_loss: 0.9029, test_f1: 0.5115
 epoch: 64, train_loss: 0.7905, test_loss: 0.9019, test_f1: 0.5170
 epoch: 65, train_loss: 0.7909, test_loss: 0.9091, test_f1: 0.5091
 epoch: 66, train_loss: 0.7874, test_loss: 0.9239, test_f1: 0.5215
 epoch: 67, train_loss: 0.7998, test_loss: 0.9021, test_f1: 0.5140
 epoch: 68, train_loss: 0.7851, test_loss: 0.8966, test_f1: 0.5098
 epoch: 69, train_loss: 0.7846, test_loss: 0.9065, test_f1: 0.5202
 epoch: 70, train_loss: 0.7792, test_loss: 0.9095, test_f1: 0.5159
 epoch: 71, train_loss: 0.7843, test_loss: 0.9014, test_f1: 0.5231
 epoch: 72, train_loss: 0.7749, test_loss: 0.8878, test_f1: 0.5241
 epoch: 73, train_loss: 0.7777, test_loss: 0.9268, test_f1: 0.5066
 epoch: 74, train_loss: 0.7842, test_loss: 0.9363, test_f1: 0.5091
 epoch: 75, train_loss: 0.7849, test_loss: 0.9185, test_f1: 0.5182
 epoch: 76, train_loss: 0.7689, test_loss: 0.9179, test_f1: 0.5296
 epoch: 77, train_loss: 0.7692, test_loss: 0.9225, test_f1: 0.5212
 epoch: 78, train_loss: 0.7669, test_loss: 0.9101, test_f1: 0.5210
 epoch: 79, train_loss: 0.7765, test_loss: 0.9074, test_f1: 0.5185
 epoch: 80, train_loss: 0.7727, test_loss: 0.9697, test_f1: 0.4854
 epoch: 81, train_loss: 0.7737, test_loss: 0.9112, test_f1: 0.5230
 epoch: 82, train_loss: 0.7697, test_loss: 0.8997, test_f1: 0.5191
 epoch: 83, train_loss: 0.7689, test_loss: 0.9263, test_f1: 0.5142
 epoch: 84, train_loss: 0.7649, test_loss: 0.9199, test_f1: 0.5244
 epoch: 85, train_loss: 0.7692, test_loss: 0.9122, test_f1: 0.5117
 epoch: 86, train_loss: 0.7566, test_loss: 0.9543, test_f1: 0.5109
 epoch: 87, train_loss: 0.7674, test_loss: 0.9174, test_f1: 0.5179
 epoch: 88, train_loss: 0.7747, test_loss: 0.9341, test_f1: 0.5244
 epoch: 89, train_loss: 0.7596, test_loss: 0.9263, test_f1: 0.5198
 epoch: 90, train_loss: 0.7585, test_loss: 0.9258, test_f1: 0.5277
 epoch: 91, train_loss: 0.7618, test_loss: 0.9395, test_f1: 0.5113
 epoch: 92, train_loss: 0.7510, test_loss: 0.8841, test_f1: 0.5424
 epoch: 93, train_loss: 0.7655, test_loss: 0.9065, test_f1: 0.5275
 epoch: 94, train_loss: 0.7494, test_loss: 0.9335, test_f1: 0.5257
 epoch: 95, train_loss: 0.7498, test_loss: 0.9357, test_f1: 0.5193
 epoch: 96, train_loss: 0.7540, test_loss: 0.9472, test_f1: 0.5211
 epoch: 97, train_loss: 0.7564, test_loss: 0.9230, test_f1: 0.5190
 epoch: 98, train_loss: 0.7471, test_loss: 0.9114, test_f1: 0.5231
 epoch: 99, train_loss: 0.7554, test_loss: 0.9045, test_f1: 0.5381
##################ITERATION #8 ****************************************
 epoch: 0, train_loss: 1.4260, test_loss: 1.4864, test_f1: 0.2270
 epoch: 1, train_loss: 1.1455, test_loss: 1.2115, test_f1: 0.2709
 epoch: 2, train_loss: 1.1000, test_loss: 1.0234, test_f1: 0.4485
 epoch: 3, train_loss: 1.0646, test_loss: 0.9820, test_f1: 0.4494
 epoch: 4, train_loss: 1.0278, test_loss: 0.9792, test_f1: 0.4888
 epoch: 5, train_loss: 1.0213, test_loss: 0.9667, test_f1: 0.4644
 epoch: 6, train_loss: 1.0085, test_loss: 0.9700, test_f1: 0.5029
 epoch: 7, train_loss: 1.0053, test_loss: 0.9456, test_f1: 0.4812
 epoch: 8, train_loss: 0.9826, test_loss: 0.9466, test_f1: 0.4821
 epoch: 9, train_loss: 0.9715, test_loss: 0.9528, test_f1: 0.5084
 epoch: 10, train_loss: 0.9663, test_loss: 0.9179, test_f1: 0.5073
 epoch: 11, train_loss: 0.9552, test_loss: 0.9126, test_f1: 0.5052
 epoch: 12, train_loss: 0.9543, test_loss: 0.9232, test_f1: 0.4855
 epoch: 13, train_loss: 0.9377, test_loss: 0.9126, test_f1: 0.5122
 epoch: 14, train_loss: 0.9422, test_loss: 0.9006, test_f1: 0.5170
 epoch: 15, train_loss: 0.9233, test_loss: 0.9112, test_f1: 0.5357
 epoch: 16, train_loss: 0.9252, test_loss: 0.8919, test_f1: 0.5271
 epoch: 17, train_loss: 0.9163, test_loss: 0.8904, test_f1: 0.5104
 epoch: 18, train_loss: 0.9015, test_loss: 0.9090, test_f1: 0.5350
 epoch: 19, train_loss: 0.8946, test_loss: 0.8810, test_f1: 0.5413
 epoch: 20, train_loss: 0.8977, test_loss: 0.8767, test_f1: 0.5430
 epoch: 21, train_loss: 0.8888, test_loss: 0.8793, test_f1: 0.5290
 epoch: 22, train_loss: 0.8943, test_loss: 0.8632, test_f1: 0.5540
 epoch: 23, train_loss: 0.8933, test_loss: 0.8738, test_f1: 0.5440
 epoch: 24, train_loss: 0.8936, test_loss: 0.8634, test_f1: 0.5475
 epoch: 25, train_loss: 0.8777, test_loss: 0.8597, test_f1: 0.5347
 epoch: 26, train_loss: 0.8818, test_loss: 0.8786, test_f1: 0.5395
 epoch: 27, train_loss: 0.8763, test_loss: 0.8850, test_f1: 0.5391
 epoch: 28, train_loss: 0.8706, test_loss: 0.8555, test_f1: 0.5589
 epoch: 29, train_loss: 0.8703, test_loss: 0.8791, test_f1: 0.5597
 epoch: 30, train_loss: 0.8550, test_loss: 0.8600, test_f1: 0.5424
 epoch: 31, train_loss: 0.8625, test_loss: 0.8532, test_f1: 0.5584
 epoch: 32, train_loss: 0.8578, test_loss: 0.8464, test_f1: 0.5547
 epoch: 33, train_loss: 0.8531, test_loss: 0.8510, test_f1: 0.5480
 epoch: 34, train_loss: 0.8475, test_loss: 0.8380, test_f1: 0.5642
 epoch: 35, train_loss: 0.8480, test_loss: 0.8763, test_f1: 0.5601
 epoch: 36, train_loss: 0.8438, test_loss: 0.8833, test_f1: 0.5344
 epoch: 37, train_loss: 0.8452, test_loss: 0.8423, test_f1: 0.5660
 epoch: 38, train_loss: 0.8419, test_loss: 0.8345, test_f1: 0.5861
 epoch: 39, train_loss: 0.8347, test_loss: 0.8567, test_f1: 0.5579
 epoch: 40, train_loss: 0.8371, test_loss: 0.8653, test_f1: 0.5706
 epoch: 41, train_loss: 0.8256, test_loss: 0.8515, test_f1: 0.5789
 epoch: 42, train_loss: 0.8232, test_loss: 0.8438, test_f1: 0.5666
 epoch: 43, train_loss: 0.8265, test_loss: 0.8437, test_f1: 0.5740
 epoch: 44, train_loss: 0.8133, test_loss: 0.8490, test_f1: 0.5470
 epoch: 45, train_loss: 0.8130, test_loss: 0.8204, test_f1: 0.5763
 epoch: 46, train_loss: 0.8220, test_loss: 0.8323, test_f1: 0.5538
 epoch: 47, train_loss: 0.8086, test_loss: 0.8632, test_f1: 0.5574
 epoch: 48, train_loss: 0.8123, test_loss: 0.8594, test_f1: 0.5609
 epoch: 49, train_loss: 0.7989, test_loss: 0.8156, test_f1: 0.5784
 epoch: 50, train_loss: 0.8047, test_loss: 0.8013, test_f1: 0.5797
 epoch: 51, train_loss: 0.8043, test_loss: 0.8194, test_f1: 0.5590
 epoch: 52, train_loss: 0.7972, test_loss: 0.8307, test_f1: 0.5824
 epoch: 53, train_loss: 0.7933, test_loss: 0.8205, test_f1: 0.5737
 epoch: 54, train_loss: 0.7874, test_loss: 0.8151, test_f1: 0.5754
 epoch: 55, train_loss: 0.7896, test_loss: 0.8080, test_f1: 0.5863
 epoch: 56, train_loss: 0.7856, test_loss: 0.8473, test_f1: 0.5565
 epoch: 57, train_loss: 0.7875, test_loss: 0.8360, test_f1: 0.5816
 epoch: 58, train_loss: 0.8026, test_loss: 0.8275, test_f1: 0.5753
 epoch: 59, train_loss: 0.7950, test_loss: 0.8117, test_f1: 0.5689
 epoch: 60, train_loss: 0.7852, test_loss: 0.8176, test_f1: 0.5691
 epoch: 61, train_loss: 0.7791, test_loss: 0.8160, test_f1: 0.5740
 epoch: 62, train_loss: 0.7863, test_loss: 0.8295, test_f1: 0.5515
 epoch: 63, train_loss: 0.7833, test_loss: 0.8435, test_f1: 0.5948
 epoch: 64, train_loss: 0.7772, test_loss: 0.8074, test_f1: 0.5769
 epoch: 65, train_loss: 0.7659, test_loss: 0.8406, test_f1: 0.5916
 epoch: 66, train_loss: 0.7927, test_loss: 0.8457, test_f1: 0.5714
 epoch: 67, train_loss: 0.7906, test_loss: 0.8457, test_f1: 0.5764
 epoch: 68, train_loss: 0.7846, test_loss: 0.8190, test_f1: 0.5708
 epoch: 69, train_loss: 0.7706, test_loss: 0.8150, test_f1: 0.5874
 epoch: 70, train_loss: 0.7806, test_loss: 0.8183, test_f1: 0.5982
 epoch: 71, train_loss: 0.7742, test_loss: 0.8161, test_f1: 0.5717
 epoch: 72, train_loss: 0.7638, test_loss: 0.8255, test_f1: 0.5728
 epoch: 73, train_loss: 0.7550, test_loss: 0.8374, test_f1: 0.5673
 epoch: 74, train_loss: 0.7721, test_loss: 0.8118, test_f1: 0.5778
 epoch: 75, train_loss: 0.7703, test_loss: 0.8039, test_f1: 0.5736
 epoch: 76, train_loss: 0.7659, test_loss: 0.8362, test_f1: 0.5650
 epoch: 77, train_loss: 0.7610, test_loss: 0.7924, test_f1: 0.5846
 epoch: 78, train_loss: 0.7739, test_loss: 0.8229, test_f1: 0.5729
 epoch: 79, train_loss: 0.7665, test_loss: 0.8184, test_f1: 0.5847
 epoch: 80, train_loss: 0.7699, test_loss: 0.8114, test_f1: 0.5684
 epoch: 81, train_loss: 0.7625, test_loss: 0.8462, test_f1: 0.5856
 epoch: 82, train_loss: 0.7651, test_loss: 0.8205, test_f1: 0.5717
 epoch: 83, train_loss: 0.7680, test_loss: 0.8004, test_f1: 0.5864
 epoch: 84, train_loss: 0.7697, test_loss: 0.8072, test_f1: 0.6089
 epoch: 85, train_loss: 0.7597, test_loss: 0.8125, test_f1: 0.5691
 epoch: 86, train_loss: 0.7528, test_loss: 0.8106, test_f1: 0.5925
 epoch: 87, train_loss: 0.7547, test_loss: 0.8129, test_f1: 0.6066
 epoch: 88, train_loss: 0.7544, test_loss: 0.7834, test_f1: 0.5808
 epoch: 89, train_loss: 0.7431, test_loss: 0.7947, test_f1: 0.5726
 epoch: 90, train_loss: 0.7577, test_loss: 0.8127, test_f1: 0.5993
 epoch: 91, train_loss: 0.7510, test_loss: 0.8129, test_f1: 0.5686
 epoch: 92, train_loss: 0.7504, test_loss: 0.8102, test_f1: 0.5966
 epoch: 93, train_loss: 0.7551, test_loss: 0.8083, test_f1: 0.5924
 epoch: 94, train_loss: 0.7605, test_loss: 0.8000, test_f1: 0.6112
 epoch: 95, train_loss: 0.7557, test_loss: 0.7832, test_f1: 0.5794
 epoch: 96, train_loss: 0.7519, test_loss: 0.8317, test_f1: 0.5858
 epoch: 97, train_loss: 0.7482, test_loss: 0.8118, test_f1: 0.5941
 epoch: 98, train_loss: 0.7467, test_loss: 0.8168, test_f1: 0.5909
 epoch: 99, train_loss: 0.7499, test_loss: 0.8085, test_f1: 0.6263
##################ITERATION #9 ****************************************
 epoch: 0, train_loss: 1.4789, test_loss: 1.3680, test_f1: 0.2270
 epoch: 1, train_loss: 1.1602, test_loss: 1.1186, test_f1: 0.4241
 epoch: 2, train_loss: 1.0944, test_loss: 1.0271, test_f1: 0.4625
 epoch: 3, train_loss: 1.0592, test_loss: 1.0073, test_f1: 0.4490
 epoch: 4, train_loss: 1.0499, test_loss: 1.0149, test_f1: 0.4543
 epoch: 5, train_loss: 1.0284, test_loss: 0.9758, test_f1: 0.4671
 epoch: 6, train_loss: 1.0106, test_loss: 0.9972, test_f1: 0.4754
 epoch: 7, train_loss: 1.0005, test_loss: 0.9860, test_f1: 0.4575
 epoch: 8, train_loss: 0.9957, test_loss: 1.0002, test_f1: 0.4665
 epoch: 9, train_loss: 0.9796, test_loss: 0.9833, test_f1: 0.4554
 epoch: 10, train_loss: 0.9799, test_loss: 0.9561, test_f1: 0.4853
 epoch: 11, train_loss: 0.9724, test_loss: 0.9618, test_f1: 0.4950
 epoch: 12, train_loss: 0.9667, test_loss: 0.9713, test_f1: 0.4751
 epoch: 13, train_loss: 0.9647, test_loss: 0.9597, test_f1: 0.4723
 epoch: 14, train_loss: 0.9474, test_loss: 0.9819, test_f1: 0.4568
 epoch: 15, train_loss: 0.9485, test_loss: 0.9460, test_f1: 0.4715
 epoch: 16, train_loss: 0.9430, test_loss: 0.9591, test_f1: 0.4884
 epoch: 17, train_loss: 0.9385, test_loss: 0.9633, test_f1: 0.4941
 epoch: 18, train_loss: 0.9360, test_loss: 0.9309, test_f1: 0.4860
 epoch: 19, train_loss: 0.9331, test_loss: 0.9192, test_f1: 0.5001
 epoch: 20, train_loss: 0.9303, test_loss: 0.9354, test_f1: 0.4856
 epoch: 21, train_loss: 0.9280, test_loss: 0.9616, test_f1: 0.5134
 epoch: 22, train_loss: 0.9226, test_loss: 0.9298, test_f1: 0.5032
 epoch: 23, train_loss: 0.9171, test_loss: 0.9588, test_f1: 0.4827
 epoch: 24, train_loss: 0.9209, test_loss: 0.9034, test_f1: 0.5318
 epoch: 25, train_loss: 0.9162, test_loss: 0.9164, test_f1: 0.5071
 epoch: 26, train_loss: 0.9055, test_loss: 0.9476, test_f1: 0.4997
 epoch: 27, train_loss: 0.9100, test_loss: 0.9172, test_f1: 0.4866
 epoch: 28, train_loss: 0.8984, test_loss: 0.9247, test_f1: 0.4996
 epoch: 29, train_loss: 0.9135, test_loss: 0.9072, test_f1: 0.5155
 epoch: 30, train_loss: 0.8995, test_loss: 0.9780, test_f1: 0.4938
 epoch: 31, train_loss: 0.8914, test_loss: 0.8958, test_f1: 0.5072
 epoch: 32, train_loss: 0.8995, test_loss: 0.8911, test_f1: 0.5187
 epoch: 33, train_loss: 0.8856, test_loss: 0.9200, test_f1: 0.5179
 epoch: 34, train_loss: 0.8847, test_loss: 0.9411, test_f1: 0.5042
 epoch: 35, train_loss: 0.8795, test_loss: 0.8900, test_f1: 0.5348
 epoch: 36, train_loss: 0.8874, test_loss: 0.8997, test_f1: 0.5254
 epoch: 37, train_loss: 0.8637, test_loss: 0.8965, test_f1: 0.5278
 epoch: 38, train_loss: 0.8711, test_loss: 0.9319, test_f1: 0.5207
 epoch: 39, train_loss: 0.8719, test_loss: 0.8781, test_f1: 0.5126
 epoch: 40, train_loss: 0.8818, test_loss: 0.8897, test_f1: 0.5208
 epoch: 41, train_loss: 0.8669, test_loss: 0.9076, test_f1: 0.5267
 epoch: 42, train_loss: 0.8605, test_loss: 0.8822, test_f1: 0.5375
 epoch: 43, train_loss: 0.8461, test_loss: 0.8763, test_f1: 0.5328
 epoch: 44, train_loss: 0.8540, test_loss: 0.9123, test_f1: 0.5219
 epoch: 45, train_loss: 0.8580, test_loss: 0.9064, test_f1: 0.5199
 epoch: 46, train_loss: 0.8527, test_loss: 0.8659, test_f1: 0.5385
 epoch: 47, train_loss: 0.8458, test_loss: 0.8986, test_f1: 0.5219
 epoch: 48, train_loss: 0.8463, test_loss: 0.9211, test_f1: 0.5357
 epoch: 49, train_loss: 0.8343, test_loss: 0.8507, test_f1: 0.5480
 epoch: 50, train_loss: 0.8310, test_loss: 0.8562, test_f1: 0.5512
 epoch: 51, train_loss: 0.8280, test_loss: 0.8621, test_f1: 0.5308
 epoch: 52, train_loss: 0.8189, test_loss: 0.8397, test_f1: 0.5622
 epoch: 53, train_loss: 0.8300, test_loss: 0.8856, test_f1: 0.5404
 epoch: 54, train_loss: 0.8205, test_loss: 0.8430, test_f1: 0.5481
 epoch: 55, train_loss: 0.8213, test_loss: 0.8382, test_f1: 0.5454
 epoch: 56, train_loss: 0.8235, test_loss: 0.8799, test_f1: 0.5402
 epoch: 57, train_loss: 0.8159, test_loss: 0.8375, test_f1: 0.5667
 epoch: 58, train_loss: 0.8165, test_loss: 0.8450, test_f1: 0.5532
 epoch: 59, train_loss: 0.8238, test_loss: 0.8206, test_f1: 0.5604
 epoch: 60, train_loss: 0.8265, test_loss: 0.8784, test_f1: 0.5575
 epoch: 61, train_loss: 0.7999, test_loss: 0.8289, test_f1: 0.5678
 epoch: 62, train_loss: 0.8026, test_loss: 0.8255, test_f1: 0.5722
 epoch: 63, train_loss: 0.8077, test_loss: 0.8708, test_f1: 0.5619
 epoch: 64, train_loss: 0.8102, test_loss: 0.8409, test_f1: 0.5514
 epoch: 65, train_loss: 0.8109, test_loss: 0.8753, test_f1: 0.5615
 epoch: 66, train_loss: 0.8037, test_loss: 0.8584, test_f1: 0.5477
 epoch: 67, train_loss: 0.8176, test_loss: 0.8873, test_f1: 0.5534
 epoch: 68, train_loss: 0.8043, test_loss: 0.8799, test_f1: 0.5353
 epoch: 69, train_loss: 0.8074, test_loss: 0.8638, test_f1: 0.5489
 epoch: 70, train_loss: 0.8054, test_loss: 0.8679, test_f1: 0.5461
 epoch: 71, train_loss: 0.8113, test_loss: 0.8665, test_f1: 0.5455
 epoch: 72, train_loss: 0.8039, test_loss: 0.8473, test_f1: 0.5598
 epoch: 73, train_loss: 0.7971, test_loss: 0.8811, test_f1: 0.5584
 epoch: 74, train_loss: 0.8016, test_loss: 0.8769, test_f1: 0.5735
 epoch: 75, train_loss: 0.7932, test_loss: 0.8655, test_f1: 0.5686
 epoch: 76, train_loss: 0.8033, test_loss: 0.8730, test_f1: 0.5520
 epoch: 77, train_loss: 0.7934, test_loss: 0.8709, test_f1: 0.5547
 epoch: 78, train_loss: 0.7887, test_loss: 0.8701, test_f1: 0.5726
 epoch: 79, train_loss: 0.7790, test_loss: 0.8563, test_f1: 0.5537
 epoch: 80, train_loss: 0.7856, test_loss: 0.8278, test_f1: 0.5607
 epoch: 81, train_loss: 0.7940, test_loss: 0.8820, test_f1: 0.5549
 epoch: 82, train_loss: 0.7887, test_loss: 0.8754, test_f1: 0.5691
 epoch: 83, train_loss: 0.7814, test_loss: 0.8423, test_f1: 0.5567
 epoch: 84, train_loss: 0.7827, test_loss: 0.9076, test_f1: 0.5389
 epoch: 85, train_loss: 0.7808, test_loss: 0.8728, test_f1: 0.5503
 epoch: 86, train_loss: 0.7826, test_loss: 0.8563, test_f1: 0.5580
 epoch: 87, train_loss: 0.7725, test_loss: 0.8461, test_f1: 0.5689
 epoch: 88, train_loss: 0.7872, test_loss: 0.8700, test_f1: 0.5760
 epoch: 89, train_loss: 0.7722, test_loss: 0.8384, test_f1: 0.5667
 epoch: 90, train_loss: 0.7851, test_loss: 0.8662, test_f1: 0.5641
 epoch: 91, train_loss: 0.7639, test_loss: 0.8474, test_f1: 0.5526
 epoch: 92, train_loss: 0.7755, test_loss: 0.8602, test_f1: 0.5502
 epoch: 93, train_loss: 0.7683, test_loss: 0.8523, test_f1: 0.5389
 epoch: 94, train_loss: 0.7710, test_loss: 0.8698, test_f1: 0.5558
 epoch: 95, train_loss: 0.7825, test_loss: 0.8403, test_f1: 0.5614
 epoch: 96, train_loss: 0.7633, test_loss: 0.8538, test_f1: 0.5685
 epoch: 97, train_loss: 0.7719, test_loss: 0.8544, test_f1: 0.5665
 epoch: 98, train_loss: 0.7678, test_loss: 0.8593, test_f1: 0.5671
 epoch: 99, train_loss: 0.7628, test_loss: 0.8759, test_f1: 0.5596

Training completed in 803.22 seconds
Best F1: 0.6263 at epoch 99
Mean F1 across iterations: 0.5880  0.0293
========================FINAL RESULTS================================
FEGIN weighted F1: 0.6263  0.0293
python main.py --data ltspice_examples --representation component_pin_net --model FEGIN --layers 3 --hiddens 16 --batch_size 128 --lr 0.001 --emb_size 128 --epochs 100 --save_appendix component_pin_net_L3_H16_BS128_LR0.001_E128 --no_val
-----



STDERR:
  File "main.py", line 370, in <module>
    main()
  File "main.py", line 254, in main
    dataset = dataset_class(
  File "/home/philip/projects/ltspice_examples_code_repo/Circuit-Completion-Using-GNNs/component_classification_with_link_prediction_head/evaluation/FEGIN/kernel/circuit_datasets.py", line 15, in __init__
    self.data, self.slices = torch.load(self.processed_paths[0])
  File "/home/philip/.local/lib/python3.8/site-packages/torch/serialization.py", line 1040, in load
    warnings.warn(
  File "/usr/lib/python3.8/warnings.py", line 109, in _showwarnmsg
    sw(msg.message, msg.category, msg.filename, msg.lineno,
  File "main.py", line 47, in warn_with_traceback
    traceback.print_stack(file=log)
/home/philip/projects/ltspice_examples_code_repo/Circuit-Completion-Using-GNNs/component_classification_with_link_prediction_head/evaluation/FEGIN/kernel/circuit_datasets.py:15: FutureWarning: You are using `torch.load` with `weights_only=False` (the current default value), which uses the default pickle module implicitly. It is possible to construct malicious pickle data which will execute arbitrary code during unpickling (See https://github.com/pytorch/pytorch/blob/main/SECURITY.md#untrusted-models for more details). In a future release, the default value for `weights_only` will be flipped to `True`. This limits the functions that could be executed during unpickling. Arbitrary objects will no longer be allowed to be loaded via this mode unless they are explicitly allowlisted by the user via `torch.serialization.add_safe_globals`. We recommend you start setting `weights_only=True` for any use case where you don't have full control of the loaded file. Please open an issue on GitHub for any issues related to this experimental feature.
  self.data, self.slices = torch.load(self.processed_paths[0])
