STDOUT:
Results will be saved in /home/philip/projects/ltspice_examples_code_repo/Circuit-Completion-Using-GNNs/component_classification_with_link_prediction_head/evaluation/FEGIN/results/model_FEGIN_dataset_ltspice_examples
Command line input: python main.py --data ltspice_examples --representation component_component --model FEGIN --layers 2 --hiddens 64 --batch_size 64 --lr 0.0001 --emb_size 128 --epochs 100 --save_appendix component_component_L2_H64_BS64_LR0.0001_E128 --no_val
 is saved.
-----
ltspice_examples - FEGIN
Using 2 layers, 64 hidden units, h = 2
Loading component_component representation dataset
ENTERED
Training FEGIN on component_component representation
Train: 3556, Test: 845
##################ITERATION #0 ****************************************
 epoch: 0, train_loss: 1.3872, test_loss: 1.3789, test_f1: 0.2515
 epoch: 1, train_loss: 1.3651, test_loss: 1.3565, test_f1: 0.2574
 epoch: 2, train_loss: 1.3445, test_loss: 1.3289, test_f1: 0.2524
 epoch: 3, train_loss: 1.3180, test_loss: 1.2958, test_f1: 0.2558
 epoch: 4, train_loss: 1.2894, test_loss: 1.2666, test_f1: 0.2611
 epoch: 5, train_loss: 1.2660, test_loss: 1.2405, test_f1: 0.3144
 epoch: 6, train_loss: 1.2455, test_loss: 1.2201, test_f1: 0.3361
 epoch: 7, train_loss: 1.2293, test_loss: 1.2011, test_f1: 0.3510
 epoch: 8, train_loss: 1.2132, test_loss: 1.1845, test_f1: 0.3481
 epoch: 9, train_loss: 1.2015, test_loss: 1.1679, test_f1: 0.3487
 epoch: 10, train_loss: 1.1877, test_loss: 1.1564, test_f1: 0.3571
 epoch: 11, train_loss: 1.1769, test_loss: 1.1447, test_f1: 0.3541
 epoch: 12, train_loss: 1.1688, test_loss: 1.1338, test_f1: 0.3665
 epoch: 13, train_loss: 1.1560, test_loss: 1.1230, test_f1: 0.3830
 epoch: 14, train_loss: 1.1480, test_loss: 1.1125, test_f1: 0.3977
 epoch: 15, train_loss: 1.1338, test_loss: 1.1049, test_f1: 0.4213
 epoch: 16, train_loss: 1.1289, test_loss: 1.0967, test_f1: 0.4288
 epoch: 17, train_loss: 1.1265, test_loss: 1.0880, test_f1: 0.4352
 epoch: 18, train_loss: 1.1137, test_loss: 1.0811, test_f1: 0.4478
 epoch: 19, train_loss: 1.1044, test_loss: 1.0742, test_f1: 0.4448
 epoch: 20, train_loss: 1.1037, test_loss: 1.0653, test_f1: 0.4572
 epoch: 21, train_loss: 1.0928, test_loss: 1.0615, test_f1: 0.4561
 epoch: 22, train_loss: 1.0805, test_loss: 1.0541, test_f1: 0.4729
 epoch: 23, train_loss: 1.0771, test_loss: 1.0464, test_f1: 0.4756
 epoch: 24, train_loss: 1.0686, test_loss: 1.0397, test_f1: 0.4741
 epoch: 25, train_loss: 1.0666, test_loss: 1.0316, test_f1: 0.4721
 epoch: 26, train_loss: 1.0601, test_loss: 1.0289, test_f1: 0.4740
 epoch: 27, train_loss: 1.0548, test_loss: 1.0228, test_f1: 0.4849
 epoch: 28, train_loss: 1.0490, test_loss: 1.0161, test_f1: 0.4738
 epoch: 29, train_loss: 1.0417, test_loss: 1.0075, test_f1: 0.4762
 epoch: 30, train_loss: 1.0336, test_loss: 1.0030, test_f1: 0.4790
 epoch: 31, train_loss: 1.0338, test_loss: 0.9985, test_f1: 0.4781
 epoch: 32, train_loss: 1.0236, test_loss: 0.9973, test_f1: 0.4841
 epoch: 33, train_loss: 1.0233, test_loss: 0.9861, test_f1: 0.4963
 epoch: 34, train_loss: 1.0112, test_loss: 0.9869, test_f1: 0.4849
 epoch: 35, train_loss: 1.0101, test_loss: 0.9832, test_f1: 0.4763
 epoch: 36, train_loss: 1.0015, test_loss: 0.9765, test_f1: 0.5026
 epoch: 37, train_loss: 0.9943, test_loss: 0.9678, test_f1: 0.4832
 epoch: 38, train_loss: 0.9892, test_loss: 0.9690, test_f1: 0.4825
 epoch: 39, train_loss: 0.9848, test_loss: 0.9680, test_f1: 0.4881
 epoch: 40, train_loss: 0.9851, test_loss: 0.9595, test_f1: 0.4947
 epoch: 41, train_loss: 0.9740, test_loss: 0.9599, test_f1: 0.4885
 epoch: 42, train_loss: 0.9744, test_loss: 0.9632, test_f1: 0.4906
 epoch: 43, train_loss: 0.9688, test_loss: 0.9531, test_f1: 0.4895
 epoch: 44, train_loss: 0.9525, test_loss: 0.9582, test_f1: 0.4897
 epoch: 45, train_loss: 0.9652, test_loss: 0.9544, test_f1: 0.4902
 epoch: 46, train_loss: 0.9454, test_loss: 0.9490, test_f1: 0.4866
 epoch: 47, train_loss: 0.9423, test_loss: 0.9412, test_f1: 0.5006
 epoch: 48, train_loss: 0.9451, test_loss: 0.9541, test_f1: 0.4947
 epoch: 49, train_loss: 0.9447, test_loss: 0.9558, test_f1: 0.5055
 epoch: 50, train_loss: 0.9388, test_loss: 0.9523, test_f1: 0.4946
 epoch: 51, train_loss: 0.9339, test_loss: 0.9507, test_f1: 0.4929
 epoch: 52, train_loss: 0.9297, test_loss: 0.9422, test_f1: 0.4971
 epoch: 53, train_loss: 0.9200, test_loss: 0.9389, test_f1: 0.5009
 epoch: 54, train_loss: 0.9226, test_loss: 0.9464, test_f1: 0.4867
 epoch: 55, train_loss: 0.9198, test_loss: 0.9438, test_f1: 0.4999
 epoch: 56, train_loss: 0.9232, test_loss: 0.9393, test_f1: 0.4866
 epoch: 57, train_loss: 0.9252, test_loss: 0.9510, test_f1: 0.5214
 epoch: 58, train_loss: 0.9131, test_loss: 0.9464, test_f1: 0.5038
 epoch: 59, train_loss: 0.9120, test_loss: 0.9492, test_f1: 0.4915
 epoch: 60, train_loss: 0.9177, test_loss: 0.9446, test_f1: 0.5063
 epoch: 61, train_loss: 0.9091, test_loss: 0.9435, test_f1: 0.4844
 epoch: 62, train_loss: 0.9201, test_loss: 0.9474, test_f1: 0.4978
 epoch: 63, train_loss: 0.9098, test_loss: 0.9521, test_f1: 0.4917
 epoch: 64, train_loss: 0.9019, test_loss: 0.9490, test_f1: 0.4905
 epoch: 65, train_loss: 0.9068, test_loss: 0.9481, test_f1: 0.5028
 epoch: 66, train_loss: 0.8958, test_loss: 0.9435, test_f1: 0.5134
 epoch: 67, train_loss: 0.8990, test_loss: 0.9430, test_f1: 0.5065
 epoch: 68, train_loss: 0.8953, test_loss: 0.9460, test_f1: 0.5147
 epoch: 69, train_loss: 0.8976, test_loss: 0.9508, test_f1: 0.5122
 epoch: 70, train_loss: 0.8997, test_loss: 0.9402, test_f1: 0.4982
 epoch: 71, train_loss: 0.8988, test_loss: 0.9454, test_f1: 0.5134
 epoch: 72, train_loss: 0.8967, test_loss: 0.9405, test_f1: 0.5071
 epoch: 73, train_loss: 0.8975, test_loss: 0.9439, test_f1: 0.5078
 epoch: 74, train_loss: 0.8884, test_loss: 0.9477, test_f1: 0.5171
 epoch: 75, train_loss: 0.8835, test_loss: 0.9471, test_f1: 0.5135
 epoch: 76, train_loss: 0.8917, test_loss: 0.9513, test_f1: 0.5175
 epoch: 77, train_loss: 0.8905, test_loss: 0.9492, test_f1: 0.5131
 epoch: 78, train_loss: 0.8916, test_loss: 0.9465, test_f1: 0.5156
 epoch: 79, train_loss: 0.8869, test_loss: 0.9499, test_f1: 0.5106
 epoch: 80, train_loss: 0.8838, test_loss: 0.9547, test_f1: 0.5124
 epoch: 81, train_loss: 0.8854, test_loss: 0.9570, test_f1: 0.5094
 epoch: 82, train_loss: 0.8829, test_loss: 0.9495, test_f1: 0.5174
 epoch: 83, train_loss: 0.8765, test_loss: 0.9561, test_f1: 0.5186
 epoch: 84, train_loss: 0.8824, test_loss: 0.9504, test_f1: 0.5180
 epoch: 85, train_loss: 0.8771, test_loss: 0.9552, test_f1: 0.5059
 epoch: 86, train_loss: 0.8763, test_loss: 0.9615, test_f1: 0.5190
 epoch: 87, train_loss: 0.8723, test_loss: 0.9583, test_f1: 0.5103
 epoch: 88, train_loss: 0.8760, test_loss: 0.9559, test_f1: 0.5103
 epoch: 89, train_loss: 0.8822, test_loss: 0.9601, test_f1: 0.5065
 epoch: 90, train_loss: 0.8714, test_loss: 0.9650, test_f1: 0.5006
 epoch: 91, train_loss: 0.8729, test_loss: 0.9613, test_f1: 0.5104
 epoch: 92, train_loss: 0.8747, test_loss: 0.9552, test_f1: 0.5123
 epoch: 93, train_loss: 0.8787, test_loss: 0.9678, test_f1: 0.5177
 epoch: 94, train_loss: 0.8726, test_loss: 0.9669, test_f1: 0.5118
 epoch: 95, train_loss: 0.8732, test_loss: 0.9625, test_f1: 0.5170
 epoch: 96, train_loss: 0.8661, test_loss: 0.9537, test_f1: 0.5057
 epoch: 97, train_loss: 0.8684, test_loss: 0.9583, test_f1: 0.5157
 epoch: 98, train_loss: 0.8678, test_loss: 0.9567, test_f1: 0.5144
 epoch: 99, train_loss: 0.8631, test_loss: 0.9552, test_f1: 0.5177
##################ITERATION #1 ****************************************
 epoch: 0, train_loss: 1.3474, test_loss: 1.3098, test_f1: 0.2274
 epoch: 1, train_loss: 1.2906, test_loss: 1.2718, test_f1: 0.2274
 epoch: 2, train_loss: 1.2643, test_loss: 1.2463, test_f1: 0.2274
 epoch: 3, train_loss: 1.2467, test_loss: 1.2283, test_f1: 0.2463
 epoch: 4, train_loss: 1.2304, test_loss: 1.2139, test_f1: 0.2507
 epoch: 5, train_loss: 1.2163, test_loss: 1.1953, test_f1: 0.3126
 epoch: 6, train_loss: 1.2067, test_loss: 1.1736, test_f1: 0.4111
 epoch: 7, train_loss: 1.1901, test_loss: 1.1596, test_f1: 0.4297
 epoch: 8, train_loss: 1.1748, test_loss: 1.1440, test_f1: 0.4254
 epoch: 9, train_loss: 1.1591, test_loss: 1.1226, test_f1: 0.4253
 epoch: 10, train_loss: 1.1428, test_loss: 1.1075, test_f1: 0.4162
 epoch: 11, train_loss: 1.1291, test_loss: 1.0917, test_f1: 0.4203
 epoch: 12, train_loss: 1.1179, test_loss: 1.0776, test_f1: 0.4302
 epoch: 13, train_loss: 1.1003, test_loss: 1.0633, test_f1: 0.4467
 epoch: 14, train_loss: 1.0942, test_loss: 1.0508, test_f1: 0.4455
 epoch: 15, train_loss: 1.0745, test_loss: 1.0369, test_f1: 0.4550
 epoch: 16, train_loss: 1.0657, test_loss: 1.0188, test_f1: 0.4632
 epoch: 17, train_loss: 1.0593, test_loss: 1.0124, test_f1: 0.4647
 epoch: 18, train_loss: 1.0502, test_loss: 1.0030, test_f1: 0.4635
 epoch: 19, train_loss: 1.0420, test_loss: 1.0025, test_f1: 0.4600
 epoch: 20, train_loss: 1.0340, test_loss: 0.9936, test_f1: 0.4668
 epoch: 21, train_loss: 1.0289, test_loss: 0.9895, test_f1: 0.4851
 epoch: 22, train_loss: 1.0313, test_loss: 0.9771, test_f1: 0.4896
 epoch: 23, train_loss: 1.0089, test_loss: 0.9725, test_f1: 0.4879
 epoch: 24, train_loss: 1.0024, test_loss: 0.9674, test_f1: 0.5007
 epoch: 25, train_loss: 1.0073, test_loss: 0.9653, test_f1: 0.4930
 epoch: 26, train_loss: 0.9920, test_loss: 0.9786, test_f1: 0.4856
 epoch: 27, train_loss: 0.9969, test_loss: 0.9643, test_f1: 0.4920
 epoch: 28, train_loss: 0.9782, test_loss: 0.9625, test_f1: 0.5007
 epoch: 29, train_loss: 0.9795, test_loss: 0.9605, test_f1: 0.5006
 epoch: 30, train_loss: 0.9797, test_loss: 0.9574, test_f1: 0.4943
 epoch: 31, train_loss: 0.9715, test_loss: 0.9612, test_f1: 0.4962
 epoch: 32, train_loss: 0.9662, test_loss: 0.9635, test_f1: 0.4976
 epoch: 33, train_loss: 0.9592, test_loss: 0.9552, test_f1: 0.5020
 epoch: 34, train_loss: 0.9634, test_loss: 0.9553, test_f1: 0.4945
 epoch: 35, train_loss: 0.9529, test_loss: 0.9693, test_f1: 0.4988
 epoch: 36, train_loss: 0.9601, test_loss: 0.9612, test_f1: 0.4967
 epoch: 37, train_loss: 0.9537, test_loss: 0.9561, test_f1: 0.5014
 epoch: 38, train_loss: 0.9362, test_loss: 0.9485, test_f1: 0.4931
 epoch: 39, train_loss: 0.9458, test_loss: 0.9519, test_f1: 0.4949
 epoch: 40, train_loss: 0.9382, test_loss: 0.9397, test_f1: 0.5100
 epoch: 41, train_loss: 0.9305, test_loss: 0.9539, test_f1: 0.4970
 epoch: 42, train_loss: 0.9285, test_loss: 0.9428, test_f1: 0.5104
 epoch: 43, train_loss: 0.9318, test_loss: 0.9354, test_f1: 0.5029
 epoch: 44, train_loss: 0.9230, test_loss: 0.9703, test_f1: 0.5005
 epoch: 45, train_loss: 0.9177, test_loss: 0.9628, test_f1: 0.4900
 epoch: 46, train_loss: 0.9204, test_loss: 0.9744, test_f1: 0.5036
 epoch: 47, train_loss: 0.9161, test_loss: 0.9507, test_f1: 0.4900
 epoch: 48, train_loss: 0.9133, test_loss: 0.9673, test_f1: 0.4953
 epoch: 49, train_loss: 0.9136, test_loss: 0.9613, test_f1: 0.4983
 epoch: 50, train_loss: 0.9116, test_loss: 0.9484, test_f1: 0.5078
 epoch: 51, train_loss: 0.9055, test_loss: 0.9574, test_f1: 0.4927
 epoch: 52, train_loss: 0.9007, test_loss: 0.9615, test_f1: 0.4935
 epoch: 53, train_loss: 0.8932, test_loss: 0.9590, test_f1: 0.4964
 epoch: 54, train_loss: 0.8936, test_loss: 0.9529, test_f1: 0.4932
 epoch: 55, train_loss: 0.8941, test_loss: 0.9541, test_f1: 0.4919
 epoch: 56, train_loss: 0.8890, test_loss: 0.9524, test_f1: 0.4985
 epoch: 57, train_loss: 0.8936, test_loss: 0.9569, test_f1: 0.4945
 epoch: 58, train_loss: 0.8885, test_loss: 0.9548, test_f1: 0.5042
 epoch: 59, train_loss: 0.8863, test_loss: 0.9645, test_f1: 0.4935
 epoch: 60, train_loss: 0.8880, test_loss: 0.9603, test_f1: 0.5010
 epoch: 61, train_loss: 0.8889, test_loss: 0.9623, test_f1: 0.4995
 epoch: 62, train_loss: 0.8872, test_loss: 0.9482, test_f1: 0.5036
 epoch: 63, train_loss: 0.8907, test_loss: 0.9577, test_f1: 0.4988
 epoch: 64, train_loss: 0.8813, test_loss: 0.9650, test_f1: 0.5060
 epoch: 65, train_loss: 0.8897, test_loss: 0.9509, test_f1: 0.5062
 epoch: 66, train_loss: 0.8785, test_loss: 0.9583, test_f1: 0.5088
 epoch: 67, train_loss: 0.8754, test_loss: 0.9524, test_f1: 0.4931
 epoch: 68, train_loss: 0.8828, test_loss: 0.9563, test_f1: 0.5013
 epoch: 69, train_loss: 0.8726, test_loss: 0.9505, test_f1: 0.5079
 epoch: 70, train_loss: 0.8732, test_loss: 0.9736, test_f1: 0.4992
 epoch: 71, train_loss: 0.8801, test_loss: 0.9619, test_f1: 0.5053
 epoch: 72, train_loss: 0.8822, test_loss: 0.9526, test_f1: 0.5101
 epoch: 73, train_loss: 0.8746, test_loss: 0.9560, test_f1: 0.5113
 epoch: 74, train_loss: 0.8704, test_loss: 0.9497, test_f1: 0.5107
 epoch: 75, train_loss: 0.8689, test_loss: 0.9567, test_f1: 0.5080
 epoch: 76, train_loss: 0.8747, test_loss: 0.9609, test_f1: 0.5057
 epoch: 77, train_loss: 0.8690, test_loss: 0.9587, test_f1: 0.5041
 epoch: 78, train_loss: 0.8690, test_loss: 0.9592, test_f1: 0.5029
 epoch: 79, train_loss: 0.8644, test_loss: 0.9668, test_f1: 0.5066
 epoch: 80, train_loss: 0.8686, test_loss: 0.9725, test_f1: 0.5047
 epoch: 81, train_loss: 0.8719, test_loss: 0.9589, test_f1: 0.5089
 epoch: 82, train_loss: 0.8639, test_loss: 0.9770, test_f1: 0.5087
 epoch: 83, train_loss: 0.8573, test_loss: 0.9563, test_f1: 0.5167
 epoch: 84, train_loss: 0.8671, test_loss: 0.9624, test_f1: 0.5067
 epoch: 85, train_loss: 0.8613, test_loss: 0.9826, test_f1: 0.5092
 epoch: 86, train_loss: 0.8594, test_loss: 0.9566, test_f1: 0.5133
 epoch: 87, train_loss: 0.8511, test_loss: 0.9717, test_f1: 0.5057
 epoch: 88, train_loss: 0.8557, test_loss: 0.9607, test_f1: 0.5110
 epoch: 89, train_loss: 0.8676, test_loss: 0.9598, test_f1: 0.5013
 epoch: 90, train_loss: 0.8503, test_loss: 0.9668, test_f1: 0.5108
 epoch: 91, train_loss: 0.8503, test_loss: 0.9625, test_f1: 0.5141
 epoch: 92, train_loss: 0.8466, test_loss: 0.9702, test_f1: 0.5110
 epoch: 93, train_loss: 0.8495, test_loss: 0.9772, test_f1: 0.5069
 epoch: 94, train_loss: 0.8574, test_loss: 0.9738, test_f1: 0.5081
 epoch: 95, train_loss: 0.8401, test_loss: 0.9865, test_f1: 0.5127
 epoch: 96, train_loss: 0.8507, test_loss: 0.9747, test_f1: 0.5127
 epoch: 97, train_loss: 0.8418, test_loss: 0.9734, test_f1: 0.5115
 epoch: 98, train_loss: 0.8456, test_loss: 0.9711, test_f1: 0.5086
 epoch: 99, train_loss: 0.8452, test_loss: 0.9804, test_f1: 0.5107
##################ITERATION #2 ****************************************
 epoch: 0, train_loss: 1.3706, test_loss: 1.3139, test_f1: 0.3322
 epoch: 1, train_loss: 1.2879, test_loss: 1.2486, test_f1: 0.3629
 epoch: 2, train_loss: 1.2627, test_loss: 1.2182, test_f1: 0.3738
 epoch: 3, train_loss: 1.2380, test_loss: 1.1959, test_f1: 0.4061
 epoch: 4, train_loss: 1.2224, test_loss: 1.1812, test_f1: 0.4124
 epoch: 5, train_loss: 1.2066, test_loss: 1.1640, test_f1: 0.4235
 epoch: 6, train_loss: 1.2010, test_loss: 1.1508, test_f1: 0.4253
 epoch: 7, train_loss: 1.1873, test_loss: 1.1355, test_f1: 0.4318
 epoch: 8, train_loss: 1.1744, test_loss: 1.1240, test_f1: 0.4350
 epoch: 9, train_loss: 1.1613, test_loss: 1.1154, test_f1: 0.4394
 epoch: 10, train_loss: 1.1459, test_loss: 1.1009, test_f1: 0.4454
 epoch: 11, train_loss: 1.1405, test_loss: 1.0893, test_f1: 0.4505
 epoch: 12, train_loss: 1.1318, test_loss: 1.0819, test_f1: 0.4530
 epoch: 13, train_loss: 1.1212, test_loss: 1.0696, test_f1: 0.4581
 epoch: 14, train_loss: 1.1122, test_loss: 1.0679, test_f1: 0.4438
 epoch: 15, train_loss: 1.1037, test_loss: 1.0505, test_f1: 0.4647
 epoch: 16, train_loss: 1.0972, test_loss: 1.0446, test_f1: 0.4451
 epoch: 17, train_loss: 1.0834, test_loss: 1.0382, test_f1: 0.4555
 epoch: 18, train_loss: 1.0747, test_loss: 1.0292, test_f1: 0.4681
 epoch: 19, train_loss: 1.0734, test_loss: 1.0197, test_f1: 0.4454
 epoch: 20, train_loss: 1.0609, test_loss: 1.0196, test_f1: 0.4739
 epoch: 21, train_loss: 1.0520, test_loss: 1.0076, test_f1: 0.4826
 epoch: 22, train_loss: 1.0503, test_loss: 1.0027, test_f1: 0.4590
 epoch: 23, train_loss: 1.0491, test_loss: 0.9993, test_f1: 0.4756
 epoch: 24, train_loss: 1.0452, test_loss: 0.9958, test_f1: 0.4734
 epoch: 25, train_loss: 1.0312, test_loss: 0.9931, test_f1: 0.4696
 epoch: 26, train_loss: 1.0263, test_loss: 1.0083, test_f1: 0.4350
 epoch: 27, train_loss: 1.0201, test_loss: 0.9864, test_f1: 0.4655
 epoch: 28, train_loss: 1.0170, test_loss: 0.9783, test_f1: 0.4815
 epoch: 29, train_loss: 1.0082, test_loss: 0.9764, test_f1: 0.4928
 epoch: 30, train_loss: 1.0061, test_loss: 0.9714, test_f1: 0.4836
 epoch: 31, train_loss: 1.0030, test_loss: 0.9703, test_f1: 0.4734
 epoch: 32, train_loss: 0.9936, test_loss: 0.9601, test_f1: 0.4884
 epoch: 33, train_loss: 0.9955, test_loss: 0.9615, test_f1: 0.4887
 epoch: 34, train_loss: 0.9799, test_loss: 0.9681, test_f1: 0.4861
 epoch: 35, train_loss: 0.9833, test_loss: 0.9636, test_f1: 0.4916
 epoch: 36, train_loss: 0.9813, test_loss: 0.9530, test_f1: 0.4705
 epoch: 37, train_loss: 0.9780, test_loss: 1.0004, test_f1: 0.4577
 epoch: 38, train_loss: 0.9689, test_loss: 0.9638, test_f1: 0.4752
 epoch: 39, train_loss: 0.9662, test_loss: 0.9600, test_f1: 0.4722
 epoch: 40, train_loss: 0.9599, test_loss: 0.9583, test_f1: 0.4800
 epoch: 41, train_loss: 0.9602, test_loss: 0.9700, test_f1: 0.4767
 epoch: 42, train_loss: 0.9519, test_loss: 0.9486, test_f1: 0.5012
 epoch: 43, train_loss: 0.9567, test_loss: 0.9670, test_f1: 0.4725
 epoch: 44, train_loss: 0.9430, test_loss: 0.9639, test_f1: 0.4745
 epoch: 45, train_loss: 0.9419, test_loss: 0.9595, test_f1: 0.4766
 epoch: 46, train_loss: 0.9355, test_loss: 0.9843, test_f1: 0.4739
 epoch: 47, train_loss: 0.9384, test_loss: 0.9703, test_f1: 0.4795
 epoch: 48, train_loss: 0.9319, test_loss: 0.9827, test_f1: 0.4678
 epoch: 49, train_loss: 0.9276, test_loss: 0.9459, test_f1: 0.5007
 epoch: 50, train_loss: 0.9236, test_loss: 0.9682, test_f1: 0.4939
 epoch: 51, train_loss: 0.9203, test_loss: 0.9715, test_f1: 0.4800
 epoch: 52, train_loss: 0.9184, test_loss: 0.9600, test_f1: 0.4860
 epoch: 53, train_loss: 0.9195, test_loss: 0.9820, test_f1: 0.4780
 epoch: 54, train_loss: 0.9158, test_loss: 0.9587, test_f1: 0.4751
 epoch: 55, train_loss: 0.9091, test_loss: 0.9996, test_f1: 0.4918
 epoch: 56, train_loss: 0.9048, test_loss: 0.9420, test_f1: 0.4981
 epoch: 57, train_loss: 0.9085, test_loss: 0.9593, test_f1: 0.4812
 epoch: 58, train_loss: 0.9089, test_loss: 0.9393, test_f1: 0.5042
 epoch: 59, train_loss: 0.9081, test_loss: 0.9630, test_f1: 0.4841
 epoch: 60, train_loss: 0.9039, test_loss: 0.9564, test_f1: 0.4888
 epoch: 61, train_loss: 0.9061, test_loss: 0.9499, test_f1: 0.4918
 epoch: 62, train_loss: 0.9060, test_loss: 0.9593, test_f1: 0.4928
 epoch: 63, train_loss: 0.8921, test_loss: 0.9429, test_f1: 0.4975
 epoch: 64, train_loss: 0.9046, test_loss: 0.9377, test_f1: 0.5071
 epoch: 65, train_loss: 0.8994, test_loss: 0.9610, test_f1: 0.4958
 epoch: 66, train_loss: 0.8964, test_loss: 0.9517, test_f1: 0.4848
 epoch: 67, train_loss: 0.8920, test_loss: 0.9700, test_f1: 0.4932
 epoch: 68, train_loss: 0.8940, test_loss: 0.9445, test_f1: 0.5024
 epoch: 69, train_loss: 0.8876, test_loss: 0.9708, test_f1: 0.4898
 epoch: 70, train_loss: 0.8933, test_loss: 0.9688, test_f1: 0.4886
 epoch: 71, train_loss: 0.8835, test_loss: 0.9502, test_f1: 0.4988
 epoch: 72, train_loss: 0.8895, test_loss: 0.9474, test_f1: 0.5029
 epoch: 73, train_loss: 0.8835, test_loss: 0.9578, test_f1: 0.5071
 epoch: 74, train_loss: 0.8803, test_loss: 0.9625, test_f1: 0.5023
 epoch: 75, train_loss: 0.8785, test_loss: 0.9418, test_f1: 0.5163
 epoch: 76, train_loss: 0.8739, test_loss: 0.9633, test_f1: 0.5073
 epoch: 77, train_loss: 0.8791, test_loss: 0.9458, test_f1: 0.5135
 epoch: 78, train_loss: 0.8772, test_loss: 0.9458, test_f1: 0.5171
 epoch: 79, train_loss: 0.8851, test_loss: 0.9612, test_f1: 0.5040
 epoch: 80, train_loss: 0.8698, test_loss: 0.9385, test_f1: 0.5348
 epoch: 81, train_loss: 0.8748, test_loss: 0.9415, test_f1: 0.5175
 epoch: 82, train_loss: 0.8683, test_loss: 0.9273, test_f1: 0.5164
 epoch: 83, train_loss: 0.8551, test_loss: 0.9427, test_f1: 0.5203
 epoch: 84, train_loss: 0.8819, test_loss: 0.9346, test_f1: 0.5132
 epoch: 85, train_loss: 0.8762, test_loss: 0.9483, test_f1: 0.5049
 epoch: 86, train_loss: 0.8653, test_loss: 0.9463, test_f1: 0.5055
 epoch: 87, train_loss: 0.8636, test_loss: 0.9535, test_f1: 0.5028
 epoch: 88, train_loss: 0.8675, test_loss: 0.9446, test_f1: 0.5214
 epoch: 89, train_loss: 0.8581, test_loss: 0.9333, test_f1: 0.5169
 epoch: 90, train_loss: 0.8635, test_loss: 0.9447, test_f1: 0.5152
 epoch: 91, train_loss: 0.8653, test_loss: 0.9389, test_f1: 0.5132
 epoch: 92, train_loss: 0.8596, test_loss: 0.9549, test_f1: 0.5153
 epoch: 93, train_loss: 0.8675, test_loss: 0.9321, test_f1: 0.5180
 epoch: 94, train_loss: 0.8649, test_loss: 0.9404, test_f1: 0.5287
 epoch: 95, train_loss: 0.8551, test_loss: 0.9668, test_f1: 0.5144
 epoch: 96, train_loss: 0.8526, test_loss: 0.9474, test_f1: 0.5185
 epoch: 97, train_loss: 0.8425, test_loss: 0.9488, test_f1: 0.5209
 epoch: 98, train_loss: 0.8569, test_loss: 0.9364, test_f1: 0.5274
 epoch: 99, train_loss: 0.8445, test_loss: 0.9537, test_f1: 0.5200
##################ITERATION #3 ****************************************
 epoch: 0, train_loss: 1.3069, test_loss: 1.2513, test_f1: 0.2676
 epoch: 1, train_loss: 1.2478, test_loss: 1.2055, test_f1: 0.3343
 epoch: 2, train_loss: 1.2256, test_loss: 1.1829, test_f1: 0.3882
 epoch: 3, train_loss: 1.2022, test_loss: 1.1661, test_f1: 0.4277
 epoch: 4, train_loss: 1.1929, test_loss: 1.1502, test_f1: 0.4333
 epoch: 5, train_loss: 1.1809, test_loss: 1.1356, test_f1: 0.4506
 epoch: 6, train_loss: 1.1652, test_loss: 1.1184, test_f1: 0.4473
 epoch: 7, train_loss: 1.1546, test_loss: 1.1057, test_f1: 0.4406
 epoch: 8, train_loss: 1.1460, test_loss: 1.0923, test_f1: 0.4326
 epoch: 9, train_loss: 1.1242, test_loss: 1.0839, test_f1: 0.4419
 epoch: 10, train_loss: 1.1255, test_loss: 1.0766, test_f1: 0.4432
 epoch: 11, train_loss: 1.1114, test_loss: 1.0710, test_f1: 0.4525
 epoch: 12, train_loss: 1.0965, test_loss: 1.0544, test_f1: 0.4512
 epoch: 13, train_loss: 1.0954, test_loss: 1.0515, test_f1: 0.4540
 epoch: 14, train_loss: 1.0833, test_loss: 1.0392, test_f1: 0.4557
 epoch: 15, train_loss: 1.0776, test_loss: 1.0332, test_f1: 0.4609
 epoch: 16, train_loss: 1.0646, test_loss: 1.0299, test_f1: 0.4656
 epoch: 17, train_loss: 1.0621, test_loss: 1.0163, test_f1: 0.4642
 epoch: 18, train_loss: 1.0562, test_loss: 1.0075, test_f1: 0.4735
 epoch: 19, train_loss: 1.0454, test_loss: 1.0086, test_f1: 0.4604
 epoch: 20, train_loss: 1.0409, test_loss: 1.0088, test_f1: 0.4659
 epoch: 21, train_loss: 1.0293, test_loss: 0.9965, test_f1: 0.4677
 epoch: 22, train_loss: 1.0263, test_loss: 0.9898, test_f1: 0.4619
 epoch: 23, train_loss: 1.0206, test_loss: 0.9872, test_f1: 0.4721
 epoch: 24, train_loss: 1.0141, test_loss: 0.9936, test_f1: 0.4600
 epoch: 25, train_loss: 1.0065, test_loss: 0.9957, test_f1: 0.4652
 epoch: 26, train_loss: 0.9999, test_loss: 0.9928, test_f1: 0.4631
 epoch: 27, train_loss: 0.9938, test_loss: 0.9925, test_f1: 0.4636
 epoch: 28, train_loss: 0.9957, test_loss: 0.9985, test_f1: 0.4681
 epoch: 29, train_loss: 0.9911, test_loss: 0.9923, test_f1: 0.4697
 epoch: 30, train_loss: 0.9881, test_loss: 1.0017, test_f1: 0.4648
 epoch: 31, train_loss: 0.9830, test_loss: 0.9914, test_f1: 0.4688
 epoch: 32, train_loss: 0.9726, test_loss: 0.9872, test_f1: 0.4799
 epoch: 33, train_loss: 0.9791, test_loss: 0.9899, test_f1: 0.4705
 epoch: 34, train_loss: 0.9623, test_loss: 0.9877, test_f1: 0.4824
 epoch: 35, train_loss: 0.9700, test_loss: 1.0044, test_f1: 0.4577
 epoch: 36, train_loss: 0.9601, test_loss: 0.9909, test_f1: 0.4718
 epoch: 37, train_loss: 0.9627, test_loss: 0.9939, test_f1: 0.4789
 epoch: 38, train_loss: 0.9527, test_loss: 0.9981, test_f1: 0.4783
 epoch: 39, train_loss: 0.9453, test_loss: 1.0036, test_f1: 0.4808
 epoch: 40, train_loss: 0.9533, test_loss: 1.0049, test_f1: 0.4789
 epoch: 41, train_loss: 0.9400, test_loss: 0.9967, test_f1: 0.4876
 epoch: 42, train_loss: 0.9420, test_loss: 0.9906, test_f1: 0.4751
 epoch: 43, train_loss: 0.9403, test_loss: 0.9965, test_f1: 0.4902
 epoch: 44, train_loss: 0.9269, test_loss: 0.9915, test_f1: 0.4776
 epoch: 45, train_loss: 0.9282, test_loss: 0.9890, test_f1: 0.4815
 epoch: 46, train_loss: 0.9211, test_loss: 0.9959, test_f1: 0.4889
 epoch: 47, train_loss: 0.9160, test_loss: 0.9788, test_f1: 0.4782
 epoch: 48, train_loss: 0.9095, test_loss: 0.9676, test_f1: 0.4927
 epoch: 49, train_loss: 0.9077, test_loss: 0.9827, test_f1: 0.4903
 epoch: 50, train_loss: 0.9026, test_loss: 0.9859, test_f1: 0.4871
 epoch: 51, train_loss: 0.9083, test_loss: 0.9799, test_f1: 0.4883
 epoch: 52, train_loss: 0.9030, test_loss: 0.9876, test_f1: 0.4853
 epoch: 53, train_loss: 0.8997, test_loss: 0.9887, test_f1: 0.4805
 epoch: 54, train_loss: 0.9074, test_loss: 0.9826, test_f1: 0.4930
 epoch: 55, train_loss: 0.8982, test_loss: 0.9877, test_f1: 0.4837
 epoch: 56, train_loss: 0.8870, test_loss: 0.9878, test_f1: 0.4824
 epoch: 57, train_loss: 0.8912, test_loss: 0.9857, test_f1: 0.4881
 epoch: 58, train_loss: 0.8982, test_loss: 0.9879, test_f1: 0.4942
 epoch: 59, train_loss: 0.8946, test_loss: 0.9782, test_f1: 0.4925
 epoch: 60, train_loss: 0.8830, test_loss: 0.9882, test_f1: 0.4906
 epoch: 61, train_loss: 0.8851, test_loss: 0.9866, test_f1: 0.4849
 epoch: 62, train_loss: 0.8850, test_loss: 0.9917, test_f1: 0.4896
 epoch: 63, train_loss: 0.8779, test_loss: 0.9851, test_f1: 0.4947
 epoch: 64, train_loss: 0.8819, test_loss: 1.0007, test_f1: 0.4728
 epoch: 65, train_loss: 0.8812, test_loss: 0.9998, test_f1: 0.4788
 epoch: 66, train_loss: 0.8789, test_loss: 1.0071, test_f1: 0.4809
 epoch: 67, train_loss: 0.8780, test_loss: 0.9944, test_f1: 0.4839
 epoch: 68, train_loss: 0.8817, test_loss: 0.9931, test_f1: 0.4786
 epoch: 69, train_loss: 0.8803, test_loss: 0.9990, test_f1: 0.4778
 epoch: 70, train_loss: 0.8623, test_loss: 0.9925, test_f1: 0.4711
 epoch: 71, train_loss: 0.8741, test_loss: 0.9892, test_f1: 0.4768
 epoch: 72, train_loss: 0.8596, test_loss: 0.9865, test_f1: 0.4795
 epoch: 73, train_loss: 0.8615, test_loss: 0.9941, test_f1: 0.4763
 epoch: 74, train_loss: 0.8651, test_loss: 0.9931, test_f1: 0.4759
 epoch: 75, train_loss: 0.8753, test_loss: 1.0130, test_f1: 0.4823
 epoch: 76, train_loss: 0.8616, test_loss: 1.0088, test_f1: 0.4727
 epoch: 77, train_loss: 0.8613, test_loss: 1.0030, test_f1: 0.4721
 epoch: 78, train_loss: 0.8610, test_loss: 1.0076, test_f1: 0.4753
 epoch: 79, train_loss: 0.8585, test_loss: 1.0075, test_f1: 0.4740
 epoch: 80, train_loss: 0.8657, test_loss: 1.0146, test_f1: 0.4706
 epoch: 81, train_loss: 0.8559, test_loss: 1.0185, test_f1: 0.4846
 epoch: 82, train_loss: 0.8616, test_loss: 1.0142, test_f1: 0.4839
 epoch: 83, train_loss: 0.8471, test_loss: 1.0032, test_f1: 0.4779
 epoch: 84, train_loss: 0.8443, test_loss: 1.0088, test_f1: 0.4818
 epoch: 85, train_loss: 0.8500, test_loss: 1.0156, test_f1: 0.4824
 epoch: 86, train_loss: 0.8454, test_loss: 1.0124, test_f1: 0.4788
 epoch: 87, train_loss: 0.8463, test_loss: 1.0177, test_f1: 0.4806
 epoch: 88, train_loss: 0.8432, test_loss: 1.0207, test_f1: 0.4728
 epoch: 89, train_loss: 0.8394, test_loss: 1.0178, test_f1: 0.4783
 epoch: 90, train_loss: 0.8466, test_loss: 1.0296, test_f1: 0.4785
 epoch: 91, train_loss: 0.8309, test_loss: 1.0273, test_f1: 0.4776
 epoch: 92, train_loss: 0.8425, test_loss: 1.0276, test_f1: 0.4768
 epoch: 93, train_loss: 0.8365, test_loss: 1.0263, test_f1: 0.4823
 epoch: 94, train_loss: 0.8241, test_loss: 1.0382, test_f1: 0.4811
 epoch: 95, train_loss: 0.8319, test_loss: 1.0348, test_f1: 0.4779
 epoch: 96, train_loss: 0.8293, test_loss: 1.0448, test_f1: 0.4989
 epoch: 97, train_loss: 0.8401, test_loss: 1.0212, test_f1: 0.4773
 epoch: 98, train_loss: 0.8288, test_loss: 1.0325, test_f1: 0.4850
 epoch: 99, train_loss: 0.8337, test_loss: 1.0333, test_f1: 0.4885
##################ITERATION #4 ****************************************
 epoch: 0, train_loss: 1.3422, test_loss: 1.2550, test_f1: 0.2393
 epoch: 1, train_loss: 1.2571, test_loss: 1.2068, test_f1: 0.3500
 epoch: 2, train_loss: 1.2450, test_loss: 1.1861, test_f1: 0.3751
 epoch: 3, train_loss: 1.2235, test_loss: 1.1672, test_f1: 0.3785
 epoch: 4, train_loss: 1.2041, test_loss: 1.1562, test_f1: 0.3736
 epoch: 5, train_loss: 1.1928, test_loss: 1.1452, test_f1: 0.4014
 epoch: 6, train_loss: 1.1780, test_loss: 1.1289, test_f1: 0.4224
 epoch: 7, train_loss: 1.1667, test_loss: 1.1190, test_f1: 0.4096
 epoch: 8, train_loss: 1.1572, test_loss: 1.1096, test_f1: 0.4491
 epoch: 9, train_loss: 1.1562, test_loss: 1.0976, test_f1: 0.4266
 epoch: 10, train_loss: 1.1461, test_loss: 1.0901, test_f1: 0.4316
 epoch: 11, train_loss: 1.1350, test_loss: 1.0785, test_f1: 0.4531
 epoch: 12, train_loss: 1.1223, test_loss: 1.0727, test_f1: 0.4473
 epoch: 13, train_loss: 1.1169, test_loss: 1.0649, test_f1: 0.4549
 epoch: 14, train_loss: 1.1068, test_loss: 1.0612, test_f1: 0.4555
 epoch: 15, train_loss: 1.0954, test_loss: 1.0614, test_f1: 0.4410
 epoch: 16, train_loss: 1.0864, test_loss: 1.0440, test_f1: 0.4515
 epoch: 17, train_loss: 1.0849, test_loss: 1.0389, test_f1: 0.4638
 epoch: 18, train_loss: 1.0669, test_loss: 1.0236, test_f1: 0.4740
 epoch: 19, train_loss: 1.0667, test_loss: 1.0220, test_f1: 0.4579
 epoch: 20, train_loss: 1.0604, test_loss: 1.0225, test_f1: 0.4649
 epoch: 21, train_loss: 1.0503, test_loss: 1.0222, test_f1: 0.4434
 epoch: 22, train_loss: 1.0553, test_loss: 1.0074, test_f1: 0.4727
 epoch: 23, train_loss: 1.0406, test_loss: 1.0068, test_f1: 0.4567
 epoch: 24, train_loss: 1.0359, test_loss: 0.9964, test_f1: 0.4738
 epoch: 25, train_loss: 1.0397, test_loss: 0.9906, test_f1: 0.4722
 epoch: 26, train_loss: 1.0289, test_loss: 0.9854, test_f1: 0.4677
 epoch: 27, train_loss: 1.0167, test_loss: 0.9745, test_f1: 0.4810
 epoch: 28, train_loss: 1.0198, test_loss: 0.9728, test_f1: 0.4834
 epoch: 29, train_loss: 1.0125, test_loss: 0.9863, test_f1: 0.4604
 epoch: 30, train_loss: 1.0089, test_loss: 0.9792, test_f1: 0.4822
 epoch: 31, train_loss: 0.9899, test_loss: 0.9747, test_f1: 0.4635
 epoch: 32, train_loss: 0.9884, test_loss: 0.9669, test_f1: 0.4627
 epoch: 33, train_loss: 0.9868, test_loss: 0.9559, test_f1: 0.4667
 epoch: 34, train_loss: 0.9825, test_loss: 0.9699, test_f1: 0.4788
 epoch: 35, train_loss: 0.9752, test_loss: 0.9603, test_f1: 0.4628
 epoch: 36, train_loss: 0.9743, test_loss: 0.9540, test_f1: 0.4711
 epoch: 37, train_loss: 0.9805, test_loss: 0.9579, test_f1: 0.4637
 epoch: 38, train_loss: 0.9707, test_loss: 0.9633, test_f1: 0.4514
 epoch: 39, train_loss: 0.9622, test_loss: 0.9416, test_f1: 0.4842
 epoch: 40, train_loss: 0.9585, test_loss: 0.9488, test_f1: 0.4755
 epoch: 41, train_loss: 0.9570, test_loss: 0.9445, test_f1: 0.4692
 epoch: 42, train_loss: 0.9506, test_loss: 0.9431, test_f1: 0.4786
 epoch: 43, train_loss: 0.9596, test_loss: 0.9491, test_f1: 0.4779
 epoch: 44, train_loss: 0.9474, test_loss: 0.9436, test_f1: 0.4684
 epoch: 45, train_loss: 0.9443, test_loss: 0.9492, test_f1: 0.4718
 epoch: 46, train_loss: 0.9457, test_loss: 0.9402, test_f1: 0.4744
 epoch: 47, train_loss: 0.9377, test_loss: 0.9402, test_f1: 0.4814
 epoch: 48, train_loss: 0.9305, test_loss: 0.9316, test_f1: 0.4850
 epoch: 49, train_loss: 0.9230, test_loss: 0.9293, test_f1: 0.4983
 epoch: 50, train_loss: 0.9332, test_loss: 0.9464, test_f1: 0.4618
 epoch: 51, train_loss: 0.9192, test_loss: 0.9386, test_f1: 0.4923
 epoch: 52, train_loss: 0.9258, test_loss: 0.9422, test_f1: 0.4898
 epoch: 53, train_loss: 0.9201, test_loss: 0.9315, test_f1: 0.5005
 epoch: 54, train_loss: 0.9230, test_loss: 0.9335, test_f1: 0.5008
 epoch: 55, train_loss: 0.9054, test_loss: 0.9363, test_f1: 0.4945
 epoch: 56, train_loss: 0.9099, test_loss: 0.9473, test_f1: 0.4943
 epoch: 57, train_loss: 0.9081, test_loss: 0.9415, test_f1: 0.5033
 epoch: 58, train_loss: 0.9126, test_loss: 0.9471, test_f1: 0.4925
 epoch: 59, train_loss: 0.9010, test_loss: 0.9403, test_f1: 0.4927
 epoch: 60, train_loss: 0.9090, test_loss: 0.9467, test_f1: 0.4862
 epoch: 61, train_loss: 0.8995, test_loss: 0.9413, test_f1: 0.4895
 epoch: 62, train_loss: 0.9093, test_loss: 0.9446, test_f1: 0.4808
 epoch: 63, train_loss: 0.9037, test_loss: 0.9491, test_f1: 0.4918
 epoch: 64, train_loss: 0.9024, test_loss: 0.9507, test_f1: 0.4824
 epoch: 65, train_loss: 0.9027, test_loss: 0.9512, test_f1: 0.4868
 epoch: 66, train_loss: 0.8939, test_loss: 0.9659, test_f1: 0.4669
 epoch: 67, train_loss: 0.8995, test_loss: 0.9441, test_f1: 0.4766
 epoch: 68, train_loss: 0.8920, test_loss: 0.9465, test_f1: 0.4905
 epoch: 69, train_loss: 0.9003, test_loss: 0.9578, test_f1: 0.4833
 epoch: 70, train_loss: 0.8865, test_loss: 0.9376, test_f1: 0.4967
 epoch: 71, train_loss: 0.8918, test_loss: 0.9539, test_f1: 0.4912
 epoch: 72, train_loss: 0.8855, test_loss: 0.9488, test_f1: 0.5006
 epoch: 73, train_loss: 0.8851, test_loss: 0.9440, test_f1: 0.4847
 epoch: 74, train_loss: 0.8856, test_loss: 0.9582, test_f1: 0.4947
 epoch: 75, train_loss: 0.8857, test_loss: 0.9467, test_f1: 0.4952
 epoch: 76, train_loss: 0.8754, test_loss: 0.9393, test_f1: 0.5050
 epoch: 77, train_loss: 0.8816, test_loss: 0.9449, test_f1: 0.4930
 epoch: 78, train_loss: 0.8846, test_loss: 0.9483, test_f1: 0.4914
 epoch: 79, train_loss: 0.8804, test_loss: 0.9548, test_f1: 0.4882
 epoch: 80, train_loss: 0.8817, test_loss: 0.9679, test_f1: 0.4900
 epoch: 81, train_loss: 0.8763, test_loss: 0.9572, test_f1: 0.5056
 epoch: 82, train_loss: 0.8813, test_loss: 0.9568, test_f1: 0.5025
 epoch: 83, train_loss: 0.8701, test_loss: 0.9683, test_f1: 0.5039
 epoch: 84, train_loss: 0.8610, test_loss: 0.9563, test_f1: 0.4816
 epoch: 85, train_loss: 0.8622, test_loss: 0.9798, test_f1: 0.5001
 epoch: 86, train_loss: 0.8669, test_loss: 0.9576, test_f1: 0.5033
 epoch: 87, train_loss: 0.8648, test_loss: 0.9548, test_f1: 0.4900
 epoch: 88, train_loss: 0.8604, test_loss: 0.9605, test_f1: 0.5022
 epoch: 89, train_loss: 0.8680, test_loss: 0.9591, test_f1: 0.4773
 epoch: 90, train_loss: 0.8684, test_loss: 0.9741, test_f1: 0.4974
 epoch: 91, train_loss: 0.8575, test_loss: 0.9715, test_f1: 0.5049
 epoch: 92, train_loss: 0.8666, test_loss: 0.9744, test_f1: 0.4989
 epoch: 93, train_loss: 0.8592, test_loss: 0.9768, test_f1: 0.4976
 epoch: 94, train_loss: 0.8548, test_loss: 0.9568, test_f1: 0.4984
 epoch: 95, train_loss: 0.8514, test_loss: 0.9713, test_f1: 0.4992
 epoch: 96, train_loss: 0.8493, test_loss: 0.9735, test_f1: 0.5166
 epoch: 97, train_loss: 0.8582, test_loss: 0.9622, test_f1: 0.5125
 epoch: 98, train_loss: 0.8569, test_loss: 0.9822, test_f1: 0.4999
 epoch: 99, train_loss: 0.8495, test_loss: 0.9795, test_f1: 0.4891
##################ITERATION #5 ****************************************
 epoch: 0, train_loss: 1.3595, test_loss: 1.2654, test_f1: 0.2999
 epoch: 1, train_loss: 1.2662, test_loss: 1.2193, test_f1: 0.3602
 epoch: 2, train_loss: 1.2372, test_loss: 1.1918, test_f1: 0.3830
 epoch: 3, train_loss: 1.2189, test_loss: 1.1670, test_f1: 0.3917
 epoch: 4, train_loss: 1.2070, test_loss: 1.1440, test_f1: 0.3990
 epoch: 5, train_loss: 1.1913, test_loss: 1.1249, test_f1: 0.4333
 epoch: 6, train_loss: 1.1637, test_loss: 1.1096, test_f1: 0.4431
 epoch: 7, train_loss: 1.1501, test_loss: 1.0913, test_f1: 0.4578
 epoch: 8, train_loss: 1.1405, test_loss: 1.0807, test_f1: 0.4576
 epoch: 9, train_loss: 1.1356, test_loss: 1.0734, test_f1: 0.4719
 epoch: 10, train_loss: 1.1125, test_loss: 1.0595, test_f1: 0.4653
 epoch: 11, train_loss: 1.1079, test_loss: 1.0536, test_f1: 0.4579
 epoch: 12, train_loss: 1.0978, test_loss: 1.0403, test_f1: 0.4557
 epoch: 13, train_loss: 1.0806, test_loss: 1.0306, test_f1: 0.4512
 epoch: 14, train_loss: 1.0827, test_loss: 1.0290, test_f1: 0.4464
 epoch: 15, train_loss: 1.0717, test_loss: 1.0172, test_f1: 0.4502
 epoch: 16, train_loss: 1.0643, test_loss: 1.0183, test_f1: 0.4601
 epoch: 17, train_loss: 1.0538, test_loss: 1.0206, test_f1: 0.4488
 epoch: 18, train_loss: 1.0476, test_loss: 1.0061, test_f1: 0.4634
 epoch: 19, train_loss: 1.0484, test_loss: 1.0024, test_f1: 0.4661
 epoch: 20, train_loss: 1.0217, test_loss: 1.0012, test_f1: 0.4560
 epoch: 21, train_loss: 1.0216, test_loss: 0.9866, test_f1: 0.4659
 epoch: 22, train_loss: 1.0123, test_loss: 0.9849, test_f1: 0.4627
 epoch: 23, train_loss: 1.0132, test_loss: 0.9767, test_f1: 0.4663
 epoch: 24, train_loss: 1.0128, test_loss: 0.9784, test_f1: 0.4747
 epoch: 25, train_loss: 0.9921, test_loss: 0.9630, test_f1: 0.4779
 epoch: 26, train_loss: 0.9945, test_loss: 0.9733, test_f1: 0.4737
 epoch: 27, train_loss: 0.9808, test_loss: 0.9662, test_f1: 0.4636
 epoch: 28, train_loss: 0.9850, test_loss: 0.9544, test_f1: 0.4837
 epoch: 29, train_loss: 0.9818, test_loss: 0.9545, test_f1: 0.4619
 epoch: 30, train_loss: 0.9790, test_loss: 0.9619, test_f1: 0.4695
 epoch: 31, train_loss: 0.9682, test_loss: 0.9683, test_f1: 0.4788
 epoch: 32, train_loss: 0.9682, test_loss: 0.9393, test_f1: 0.4915
 epoch: 33, train_loss: 0.9617, test_loss: 0.9468, test_f1: 0.4813
 epoch: 34, train_loss: 0.9505, test_loss: 0.9344, test_f1: 0.4938
 epoch: 35, train_loss: 0.9555, test_loss: 0.9349, test_f1: 0.4944
 epoch: 36, train_loss: 0.9566, test_loss: 0.9499, test_f1: 0.4821
 epoch: 37, train_loss: 0.9457, test_loss: 0.9401, test_f1: 0.4884
 epoch: 38, train_loss: 0.9467, test_loss: 0.9354, test_f1: 0.4920
 epoch: 39, train_loss: 0.9367, test_loss: 0.9297, test_f1: 0.4921
 epoch: 40, train_loss: 0.9425, test_loss: 0.9327, test_f1: 0.4830
 epoch: 41, train_loss: 0.9316, test_loss: 0.9386, test_f1: 0.4890
 epoch: 42, train_loss: 0.9284, test_loss: 0.9264, test_f1: 0.4947
 epoch: 43, train_loss: 0.9263, test_loss: 0.9302, test_f1: 0.5016
 epoch: 44, train_loss: 0.9183, test_loss: 0.9238, test_f1: 0.4996
 epoch: 45, train_loss: 0.9181, test_loss: 0.9409, test_f1: 0.4808
 epoch: 46, train_loss: 0.9203, test_loss: 0.9391, test_f1: 0.4843
 epoch: 47, train_loss: 0.9120, test_loss: 0.9387, test_f1: 0.4837
 epoch: 48, train_loss: 0.9127, test_loss: 0.9436, test_f1: 0.4801
 epoch: 49, train_loss: 0.9095, test_loss: 0.9502, test_f1: 0.4830
 epoch: 50, train_loss: 0.9073, test_loss: 0.9374, test_f1: 0.4875
 epoch: 51, train_loss: 0.8997, test_loss: 0.9476, test_f1: 0.4897
 epoch: 52, train_loss: 0.8930, test_loss: 0.9425, test_f1: 0.4876
 epoch: 53, train_loss: 0.8873, test_loss: 0.9341, test_f1: 0.4918
 epoch: 54, train_loss: 0.8866, test_loss: 0.9456, test_f1: 0.4804
 epoch: 55, train_loss: 0.8927, test_loss: 0.9309, test_f1: 0.4941
 epoch: 56, train_loss: 0.8834, test_loss: 0.9531, test_f1: 0.4860
 epoch: 57, train_loss: 0.8923, test_loss: 0.9360, test_f1: 0.4915
 epoch: 58, train_loss: 0.8883, test_loss: 0.9405, test_f1: 0.4839
 epoch: 59, train_loss: 0.8816, test_loss: 0.9457, test_f1: 0.4890
 epoch: 60, train_loss: 0.8777, test_loss: 0.9422, test_f1: 0.4878
 epoch: 61, train_loss: 0.8856, test_loss: 0.9536, test_f1: 0.4922
 epoch: 62, train_loss: 0.8755, test_loss: 0.9398, test_f1: 0.4948
 epoch: 63, train_loss: 0.8802, test_loss: 0.9466, test_f1: 0.4953
 epoch: 64, train_loss: 0.8751, test_loss: 0.9399, test_f1: 0.4962
 epoch: 65, train_loss: 0.8798, test_loss: 0.9435, test_f1: 0.4906
 epoch: 66, train_loss: 0.8755, test_loss: 0.9442, test_f1: 0.4938
 epoch: 67, train_loss: 0.8797, test_loss: 0.9415, test_f1: 0.5052
 epoch: 68, train_loss: 0.8750, test_loss: 0.9470, test_f1: 0.4938
 epoch: 69, train_loss: 0.8624, test_loss: 0.9379, test_f1: 0.4912
 epoch: 70, train_loss: 0.8758, test_loss: 0.9558, test_f1: 0.4942
 epoch: 71, train_loss: 0.8742, test_loss: 0.9600, test_f1: 0.4976
 epoch: 72, train_loss: 0.8706, test_loss: 0.9573, test_f1: 0.4924
 epoch: 73, train_loss: 0.8609, test_loss: 0.9598, test_f1: 0.4909
 epoch: 74, train_loss: 0.8682, test_loss: 0.9511, test_f1: 0.5006
 epoch: 75, train_loss: 0.8616, test_loss: 0.9475, test_f1: 0.5023
 epoch: 76, train_loss: 0.8575, test_loss: 0.9392, test_f1: 0.5018
 epoch: 77, train_loss: 0.8563, test_loss: 0.9576, test_f1: 0.4929
 epoch: 78, train_loss: 0.8543, test_loss: 0.9567, test_f1: 0.4932
 epoch: 79, train_loss: 0.8636, test_loss: 0.9506, test_f1: 0.5040
 epoch: 80, train_loss: 0.8528, test_loss: 0.9719, test_f1: 0.4924
 epoch: 81, train_loss: 0.8621, test_loss: 0.9399, test_f1: 0.5042
 epoch: 82, train_loss: 0.8529, test_loss: 0.9599, test_f1: 0.4930
 epoch: 83, train_loss: 0.8511, test_loss: 0.9524, test_f1: 0.5016
 epoch: 84, train_loss: 0.8459, test_loss: 0.9580, test_f1: 0.4975
 epoch: 85, train_loss: 0.8551, test_loss: 0.9632, test_f1: 0.5002
 epoch: 86, train_loss: 0.8501, test_loss: 0.9657, test_f1: 0.4948
 epoch: 87, train_loss: 0.8516, test_loss: 0.9663, test_f1: 0.4974
 epoch: 88, train_loss: 0.8421, test_loss: 0.9612, test_f1: 0.5016
 epoch: 89, train_loss: 0.8462, test_loss: 0.9557, test_f1: 0.4907
 epoch: 90, train_loss: 0.8451, test_loss: 0.9821, test_f1: 0.4924
 epoch: 91, train_loss: 0.8477, test_loss: 0.9854, test_f1: 0.5011
 epoch: 92, train_loss: 0.8445, test_loss: 0.9573, test_f1: 0.4958
 epoch: 93, train_loss: 0.8334, test_loss: 0.9580, test_f1: 0.4880
 epoch: 94, train_loss: 0.8402, test_loss: 0.9876, test_f1: 0.4912
 epoch: 95, train_loss: 0.8436, test_loss: 0.9396, test_f1: 0.4978
 epoch: 96, train_loss: 0.8399, test_loss: 0.9650, test_f1: 0.4965
 epoch: 97, train_loss: 0.8333, test_loss: 0.9499, test_f1: 0.4931
 epoch: 98, train_loss: 0.8450, test_loss: 0.9812, test_f1: 0.4881
 epoch: 99, train_loss: 0.8265, test_loss: 0.9934, test_f1: 0.4872
##################ITERATION #6 ****************************************
 epoch: 0, train_loss: 1.3350, test_loss: 1.2457, test_f1: 0.3135
 epoch: 1, train_loss: 1.2564, test_loss: 1.2087, test_f1: 0.4277
 epoch: 2, train_loss: 1.2318, test_loss: 1.1949, test_f1: 0.4063
 epoch: 3, train_loss: 1.2136, test_loss: 1.1747, test_f1: 0.4307
 epoch: 4, train_loss: 1.1972, test_loss: 1.1585, test_f1: 0.4381
 epoch: 5, train_loss: 1.1893, test_loss: 1.1436, test_f1: 0.4451
 epoch: 6, train_loss: 1.1697, test_loss: 1.1339, test_f1: 0.4608
 epoch: 7, train_loss: 1.1594, test_loss: 1.1180, test_f1: 0.4647
 epoch: 8, train_loss: 1.1500, test_loss: 1.1059, test_f1: 0.4702
 epoch: 9, train_loss: 1.1401, test_loss: 1.1088, test_f1: 0.4538
 epoch: 10, train_loss: 1.1286, test_loss: 1.0835, test_f1: 0.4723
 epoch: 11, train_loss: 1.1184, test_loss: 1.0809, test_f1: 0.4706
 epoch: 12, train_loss: 1.1140, test_loss: 1.0766, test_f1: 0.4634
 epoch: 13, train_loss: 1.1058, test_loss: 1.0688, test_f1: 0.4598
 epoch: 14, train_loss: 1.1031, test_loss: 1.0631, test_f1: 0.4695
 epoch: 15, train_loss: 1.0913, test_loss: 1.0461, test_f1: 0.4738
 epoch: 16, train_loss: 1.0864, test_loss: 1.0424, test_f1: 0.4510
 epoch: 17, train_loss: 1.0672, test_loss: 1.0326, test_f1: 0.4736
 epoch: 18, train_loss: 1.0657, test_loss: 1.0237, test_f1: 0.4775
 epoch: 19, train_loss: 1.0564, test_loss: 1.0275, test_f1: 0.4849
 epoch: 20, train_loss: 1.0469, test_loss: 1.0199, test_f1: 0.4787
 epoch: 21, train_loss: 1.0509, test_loss: 1.0161, test_f1: 0.4824
 epoch: 22, train_loss: 1.0363, test_loss: 1.0116, test_f1: 0.4729
 epoch: 23, train_loss: 1.0359, test_loss: 1.0108, test_f1: 0.4811
 epoch: 24, train_loss: 1.0393, test_loss: 0.9998, test_f1: 0.4811
 epoch: 25, train_loss: 1.0273, test_loss: 1.0104, test_f1: 0.4790
 epoch: 26, train_loss: 1.0194, test_loss: 0.9948, test_f1: 0.4834
 epoch: 27, train_loss: 1.0244, test_loss: 0.9988, test_f1: 0.4679
 epoch: 28, train_loss: 1.0214, test_loss: 0.9897, test_f1: 0.4831
 epoch: 29, train_loss: 1.0058, test_loss: 0.9932, test_f1: 0.4747
 epoch: 30, train_loss: 1.0098, test_loss: 0.9894, test_f1: 0.4786
 epoch: 31, train_loss: 0.9990, test_loss: 0.9893, test_f1: 0.4776
 epoch: 32, train_loss: 0.9958, test_loss: 0.9944, test_f1: 0.4782
 epoch: 33, train_loss: 0.9936, test_loss: 0.9796, test_f1: 0.4874
 epoch: 34, train_loss: 0.9913, test_loss: 0.9758, test_f1: 0.4792
 epoch: 35, train_loss: 0.9863, test_loss: 0.9833, test_f1: 0.4738
 epoch: 36, train_loss: 0.9829, test_loss: 0.9695, test_f1: 0.4882
 epoch: 37, train_loss: 0.9741, test_loss: 0.9609, test_f1: 0.4915
 epoch: 38, train_loss: 0.9720, test_loss: 0.9668, test_f1: 0.4828
 epoch: 39, train_loss: 0.9679, test_loss: 0.9540, test_f1: 0.4910
 epoch: 40, train_loss: 0.9590, test_loss: 0.9687, test_f1: 0.4971
 epoch: 41, train_loss: 0.9628, test_loss: 0.9633, test_f1: 0.4862
 epoch: 42, train_loss: 0.9609, test_loss: 0.9548, test_f1: 0.4926
 epoch: 43, train_loss: 0.9504, test_loss: 0.9527, test_f1: 0.4983
 epoch: 44, train_loss: 0.9536, test_loss: 0.9651, test_f1: 0.4923
 epoch: 45, train_loss: 0.9374, test_loss: 0.9576, test_f1: 0.4911
 epoch: 46, train_loss: 0.9396, test_loss: 0.9609, test_f1: 0.4810
 epoch: 47, train_loss: 0.9366, test_loss: 0.9596, test_f1: 0.4908
 epoch: 48, train_loss: 0.9295, test_loss: 0.9459, test_f1: 0.5025
 epoch: 49, train_loss: 0.9319, test_loss: 0.9647, test_f1: 0.4715
 epoch: 50, train_loss: 0.9397, test_loss: 0.9499, test_f1: 0.4854
 epoch: 51, train_loss: 0.9227, test_loss: 0.9575, test_f1: 0.4946
 epoch: 52, train_loss: 0.9039, test_loss: 0.9575, test_f1: 0.4872
 epoch: 53, train_loss: 0.9163, test_loss: 0.9480, test_f1: 0.4946
 epoch: 54, train_loss: 0.9148, test_loss: 0.9643, test_f1: 0.4968
 epoch: 55, train_loss: 0.9182, test_loss: 0.9527, test_f1: 0.4962
 epoch: 56, train_loss: 0.9204, test_loss: 0.9682, test_f1: 0.4823
 epoch: 57, train_loss: 0.9105, test_loss: 0.9597, test_f1: 0.4990
 epoch: 58, train_loss: 0.9093, test_loss: 0.9471, test_f1: 0.4947
 epoch: 59, train_loss: 0.8918, test_loss: 0.9493, test_f1: 0.4908
 epoch: 60, train_loss: 0.9091, test_loss: 0.9539, test_f1: 0.4925
 epoch: 61, train_loss: 0.9080, test_loss: 0.9519, test_f1: 0.4958
 epoch: 62, train_loss: 0.9026, test_loss: 0.9571, test_f1: 0.4924
 epoch: 63, train_loss: 0.8936, test_loss: 0.9610, test_f1: 0.4892
 epoch: 64, train_loss: 0.8949, test_loss: 0.9511, test_f1: 0.4841
 epoch: 65, train_loss: 0.9002, test_loss: 0.9533, test_f1: 0.5016
 epoch: 66, train_loss: 0.9036, test_loss: 0.9467, test_f1: 0.4915
 epoch: 67, train_loss: 0.9116, test_loss: 0.9693, test_f1: 0.4862
 epoch: 68, train_loss: 0.9010, test_loss: 0.9482, test_f1: 0.4967
 epoch: 69, train_loss: 0.8983, test_loss: 0.9655, test_f1: 0.4891
 epoch: 70, train_loss: 0.8834, test_loss: 0.9603, test_f1: 0.4971
 epoch: 71, train_loss: 0.8952, test_loss: 0.9540, test_f1: 0.4934
 epoch: 72, train_loss: 0.8877, test_loss: 0.9574, test_f1: 0.4922
 epoch: 73, train_loss: 0.8883, test_loss: 0.9606, test_f1: 0.4950
 epoch: 74, train_loss: 0.8841, test_loss: 0.9627, test_f1: 0.4836
 epoch: 75, train_loss: 0.8907, test_loss: 0.9521, test_f1: 0.4942
 epoch: 76, train_loss: 0.8752, test_loss: 0.9645, test_f1: 0.4944
 epoch: 77, train_loss: 0.8763, test_loss: 0.9540, test_f1: 0.4975
 epoch: 78, train_loss: 0.8895, test_loss: 0.9566, test_f1: 0.4838
 epoch: 79, train_loss: 0.8800, test_loss: 0.9592, test_f1: 0.4893
 epoch: 80, train_loss: 0.8686, test_loss: 0.9545, test_f1: 0.4883
 epoch: 81, train_loss: 0.8801, test_loss: 0.9710, test_f1: 0.4832
 epoch: 82, train_loss: 0.8763, test_loss: 0.9580, test_f1: 0.5015
 epoch: 83, train_loss: 0.8737, test_loss: 0.9661, test_f1: 0.4891
 epoch: 84, train_loss: 0.8789, test_loss: 0.9747, test_f1: 0.4930
 epoch: 85, train_loss: 0.8727, test_loss: 0.9630, test_f1: 0.4827
 epoch: 86, train_loss: 0.8706, test_loss: 0.9585, test_f1: 0.4877
 epoch: 87, train_loss: 0.8718, test_loss: 0.9648, test_f1: 0.4885
 epoch: 88, train_loss: 0.8758, test_loss: 0.9547, test_f1: 0.5046
 epoch: 89, train_loss: 0.8732, test_loss: 0.9629, test_f1: 0.4867
 epoch: 90, train_loss: 0.8729, test_loss: 0.9788, test_f1: 0.4771
 epoch: 91, train_loss: 0.8726, test_loss: 0.9663, test_f1: 0.4739
 epoch: 92, train_loss: 0.8603, test_loss: 0.9763, test_f1: 0.4872
 epoch: 93, train_loss: 0.8592, test_loss: 0.9574, test_f1: 0.4755
 epoch: 94, train_loss: 0.8767, test_loss: 0.9509, test_f1: 0.4806
 epoch: 95, train_loss: 0.8478, test_loss: 0.9678, test_f1: 0.4615
 epoch: 96, train_loss: 0.8694, test_loss: 0.9585, test_f1: 0.5147
 epoch: 97, train_loss: 0.8708, test_loss: 0.9625, test_f1: 0.4722
 epoch: 98, train_loss: 0.8625, test_loss: 0.9749, test_f1: 0.4653
 epoch: 99, train_loss: 0.8526, test_loss: 0.9656, test_f1: 0.4896
##################ITERATION #7 ****************************************
 epoch: 0, train_loss: 1.3331, test_loss: 1.2417, test_f1: 0.2841
 epoch: 1, train_loss: 1.2594, test_loss: 1.1654, test_f1: 0.4344
 epoch: 2, train_loss: 1.2233, test_loss: 1.1471, test_f1: 0.4437
 epoch: 3, train_loss: 1.2009, test_loss: 1.1299, test_f1: 0.4520
 epoch: 4, train_loss: 1.1966, test_loss: 1.1162, test_f1: 0.4620
 epoch: 5, train_loss: 1.1778, test_loss: 1.0976, test_f1: 0.4694
 epoch: 6, train_loss: 1.1668, test_loss: 1.0900, test_f1: 0.4524
 epoch: 7, train_loss: 1.1398, test_loss: 1.0755, test_f1: 0.4778
 epoch: 8, train_loss: 1.1271, test_loss: 1.0652, test_f1: 0.4753
 epoch: 9, train_loss: 1.1236, test_loss: 1.0565, test_f1: 0.4732
 epoch: 10, train_loss: 1.1116, test_loss: 1.0444, test_f1: 0.4614
 epoch: 11, train_loss: 1.0905, test_loss: 1.0395, test_f1: 0.4778
 epoch: 12, train_loss: 1.0926, test_loss: 1.0300, test_f1: 0.4679
 epoch: 13, train_loss: 1.0903, test_loss: 1.0239, test_f1: 0.4762
 epoch: 14, train_loss: 1.0768, test_loss: 1.0120, test_f1: 0.4787
 epoch: 15, train_loss: 1.0715, test_loss: 1.0088, test_f1: 0.4775
 epoch: 16, train_loss: 1.0569, test_loss: 1.0077, test_f1: 0.4707
 epoch: 17, train_loss: 1.0584, test_loss: 0.9968, test_f1: 0.4802
 epoch: 18, train_loss: 1.0433, test_loss: 0.9959, test_f1: 0.4679
 epoch: 19, train_loss: 1.0504, test_loss: 0.9899, test_f1: 0.4779
 epoch: 20, train_loss: 1.0511, test_loss: 0.9833, test_f1: 0.4772
 epoch: 21, train_loss: 1.0272, test_loss: 0.9799, test_f1: 0.4753
 epoch: 22, train_loss: 1.0311, test_loss: 0.9740, test_f1: 0.4813
 epoch: 23, train_loss: 1.0291, test_loss: 0.9687, test_f1: 0.4793
 epoch: 24, train_loss: 1.0159, test_loss: 0.9692, test_f1: 0.4857
 epoch: 25, train_loss: 1.0138, test_loss: 0.9587, test_f1: 0.4978
 epoch: 26, train_loss: 1.0067, test_loss: 0.9558, test_f1: 0.4832
 epoch: 27, train_loss: 1.0031, test_loss: 0.9595, test_f1: 0.4814
 epoch: 28, train_loss: 1.0025, test_loss: 0.9568, test_f1: 0.4967
 epoch: 29, train_loss: 0.9926, test_loss: 0.9541, test_f1: 0.4689
 epoch: 30, train_loss: 0.9895, test_loss: 0.9476, test_f1: 0.4712
 epoch: 31, train_loss: 0.9874, test_loss: 0.9458, test_f1: 0.4755
 epoch: 32, train_loss: 0.9900, test_loss: 0.9496, test_f1: 0.4646
 epoch: 33, train_loss: 0.9867, test_loss: 0.9462, test_f1: 0.4669
 epoch: 34, train_loss: 0.9812, test_loss: 0.9426, test_f1: 0.4720
 epoch: 35, train_loss: 0.9902, test_loss: 0.9391, test_f1: 0.4731
 epoch: 36, train_loss: 0.9754, test_loss: 0.9325, test_f1: 0.4748
 epoch: 37, train_loss: 0.9762, test_loss: 0.9458, test_f1: 0.4747
 epoch: 38, train_loss: 0.9689, test_loss: 0.9302, test_f1: 0.4717
 epoch: 39, train_loss: 0.9617, test_loss: 0.9290, test_f1: 0.4737
 epoch: 40, train_loss: 0.9592, test_loss: 0.9291, test_f1: 0.4897
 epoch: 41, train_loss: 0.9635, test_loss: 0.9397, test_f1: 0.4815
 epoch: 42, train_loss: 0.9528, test_loss: 0.9282, test_f1: 0.4807
 epoch: 43, train_loss: 0.9457, test_loss: 0.9367, test_f1: 0.4841
 epoch: 44, train_loss: 0.9466, test_loss: 0.9232, test_f1: 0.4868
 epoch: 45, train_loss: 0.9379, test_loss: 0.9238, test_f1: 0.4840
 epoch: 46, train_loss: 0.9441, test_loss: 0.9287, test_f1: 0.4889
 epoch: 47, train_loss: 0.9352, test_loss: 0.9300, test_f1: 0.4914
 epoch: 48, train_loss: 0.9284, test_loss: 0.9241, test_f1: 0.4923
 epoch: 49, train_loss: 0.9289, test_loss: 0.9257, test_f1: 0.4946
 epoch: 50, train_loss: 0.9254, test_loss: 0.9221, test_f1: 0.4992
 epoch: 51, train_loss: 0.9274, test_loss: 0.9223, test_f1: 0.4883
 epoch: 52, train_loss: 0.9222, test_loss: 0.9239, test_f1: 0.4836
 epoch: 53, train_loss: 0.9137, test_loss: 0.9196, test_f1: 0.4951
 epoch: 54, train_loss: 0.9255, test_loss: 0.9230, test_f1: 0.4926
 epoch: 55, train_loss: 0.9114, test_loss: 0.9201, test_f1: 0.4867
 epoch: 56, train_loss: 0.9109, test_loss: 0.9121, test_f1: 0.4910
 epoch: 57, train_loss: 0.9049, test_loss: 0.9257, test_f1: 0.4865
 epoch: 58, train_loss: 0.9095, test_loss: 0.9207, test_f1: 0.4949
 epoch: 59, train_loss: 0.9071, test_loss: 0.9307, test_f1: 0.4972
 epoch: 60, train_loss: 0.9142, test_loss: 0.9187, test_f1: 0.4889
 epoch: 61, train_loss: 0.9140, test_loss: 0.9223, test_f1: 0.4879
 epoch: 62, train_loss: 0.8951, test_loss: 0.9178, test_f1: 0.4989
 epoch: 63, train_loss: 0.9057, test_loss: 0.9183, test_f1: 0.4971
 epoch: 64, train_loss: 0.9081, test_loss: 0.9128, test_f1: 0.5043
 epoch: 65, train_loss: 0.8974, test_loss: 0.9154, test_f1: 0.4878
 epoch: 66, train_loss: 0.9013, test_loss: 0.9187, test_f1: 0.5002
 epoch: 67, train_loss: 0.8906, test_loss: 0.9169, test_f1: 0.4922
 epoch: 68, train_loss: 0.8994, test_loss: 0.9217, test_f1: 0.4902
 epoch: 69, train_loss: 0.8920, test_loss: 0.9098, test_f1: 0.4852
 epoch: 70, train_loss: 0.8911, test_loss: 0.9069, test_f1: 0.4937
 epoch: 71, train_loss: 0.8976, test_loss: 0.9131, test_f1: 0.4885
 epoch: 72, train_loss: 0.8954, test_loss: 0.9064, test_f1: 0.4971
 epoch: 73, train_loss: 0.9013, test_loss: 0.9142, test_f1: 0.4918
 epoch: 74, train_loss: 0.8835, test_loss: 0.9146, test_f1: 0.4880
 epoch: 75, train_loss: 0.8872, test_loss: 0.9158, test_f1: 0.5023
 epoch: 76, train_loss: 0.8905, test_loss: 0.9096, test_f1: 0.5074
 epoch: 77, train_loss: 0.8950, test_loss: 0.9158, test_f1: 0.4906
 epoch: 78, train_loss: 0.8805, test_loss: 0.9097, test_f1: 0.5085
 epoch: 79, train_loss: 0.8803, test_loss: 0.9087, test_f1: 0.5115
 epoch: 80, train_loss: 0.8818, test_loss: 0.9124, test_f1: 0.5037
 epoch: 81, train_loss: 0.8856, test_loss: 0.9141, test_f1: 0.4953
 epoch: 82, train_loss: 0.8827, test_loss: 0.9127, test_f1: 0.5125
 epoch: 83, train_loss: 0.8732, test_loss: 0.9145, test_f1: 0.4974
 epoch: 84, train_loss: 0.8698, test_loss: 0.9087, test_f1: 0.5070
 epoch: 85, train_loss: 0.8790, test_loss: 0.9156, test_f1: 0.5015
 epoch: 86, train_loss: 0.8718, test_loss: 0.9120, test_f1: 0.5217
 epoch: 87, train_loss: 0.8732, test_loss: 0.9197, test_f1: 0.5165
 epoch: 88, train_loss: 0.8645, test_loss: 0.9098, test_f1: 0.5143
 epoch: 89, train_loss: 0.8762, test_loss: 0.9113, test_f1: 0.4990
 epoch: 90, train_loss: 0.8638, test_loss: 0.9185, test_f1: 0.5163
 epoch: 91, train_loss: 0.8679, test_loss: 0.9174, test_f1: 0.5190
 epoch: 92, train_loss: 0.8623, test_loss: 0.9122, test_f1: 0.5183
 epoch: 93, train_loss: 0.8654, test_loss: 0.9112, test_f1: 0.5233
 epoch: 94, train_loss: 0.8738, test_loss: 0.9068, test_f1: 0.5196
 epoch: 95, train_loss: 0.8652, test_loss: 0.9135, test_f1: 0.5215
 epoch: 96, train_loss: 0.8610, test_loss: 0.9215, test_f1: 0.5222
 epoch: 97, train_loss: 0.8520, test_loss: 0.9183, test_f1: 0.5278
 epoch: 98, train_loss: 0.8603, test_loss: 0.9113, test_f1: 0.5248
 epoch: 99, train_loss: 0.8672, test_loss: 0.9107, test_f1: 0.5256
##################ITERATION #8 ****************************************
 epoch: 0, train_loss: 1.3546, test_loss: 1.2220, test_f1: 0.2503
 epoch: 1, train_loss: 1.2631, test_loss: 1.1578, test_f1: 0.3857
 epoch: 2, train_loss: 1.2484, test_loss: 1.1405, test_f1: 0.3983
 epoch: 3, train_loss: 1.2229, test_loss: 1.1325, test_f1: 0.4305
 epoch: 4, train_loss: 1.2023, test_loss: 1.1121, test_f1: 0.4474
 epoch: 5, train_loss: 1.1980, test_loss: 1.1147, test_f1: 0.4427
 epoch: 6, train_loss: 1.1714, test_loss: 1.1102, test_f1: 0.4442
 epoch: 7, train_loss: 1.1682, test_loss: 1.1042, test_f1: 0.4384
 epoch: 8, train_loss: 1.1627, test_loss: 1.0917, test_f1: 0.4584
 epoch: 9, train_loss: 1.1415, test_loss: 1.1007, test_f1: 0.4435
 epoch: 10, train_loss: 1.1340, test_loss: 1.0887, test_f1: 0.4535
 epoch: 11, train_loss: 1.1304, test_loss: 1.0779, test_f1: 0.4800
 epoch: 12, train_loss: 1.1157, test_loss: 1.0845, test_f1: 0.4308
 epoch: 13, train_loss: 1.1136, test_loss: 1.0723, test_f1: 0.4471
 epoch: 14, train_loss: 1.1037, test_loss: 1.0711, test_f1: 0.4371
 epoch: 15, train_loss: 1.0990, test_loss: 1.0645, test_f1: 0.4515
 epoch: 16, train_loss: 1.0974, test_loss: 1.0529, test_f1: 0.4654
 epoch: 17, train_loss: 1.0818, test_loss: 1.0509, test_f1: 0.4476
 epoch: 18, train_loss: 1.0864, test_loss: 1.0522, test_f1: 0.4320
 epoch: 19, train_loss: 1.0843, test_loss: 1.0504, test_f1: 0.4337
 epoch: 20, train_loss: 1.0745, test_loss: 1.0425, test_f1: 0.4446
 epoch: 21, train_loss: 1.0701, test_loss: 1.0297, test_f1: 0.4617
 epoch: 22, train_loss: 1.0695, test_loss: 1.0325, test_f1: 0.4570
 epoch: 23, train_loss: 1.0664, test_loss: 1.0267, test_f1: 0.4586
 epoch: 24, train_loss: 1.0568, test_loss: 1.0248, test_f1: 0.4525
 epoch: 25, train_loss: 1.0437, test_loss: 1.0239, test_f1: 0.4486
 epoch: 26, train_loss: 1.0421, test_loss: 1.0292, test_f1: 0.4510
 epoch: 27, train_loss: 1.0498, test_loss: 1.0172, test_f1: 0.4613
 epoch: 28, train_loss: 1.0356, test_loss: 1.0188, test_f1: 0.4639
 epoch: 29, train_loss: 1.0245, test_loss: 1.0205, test_f1: 0.4533
 epoch: 30, train_loss: 1.0310, test_loss: 1.0080, test_f1: 0.4648
 epoch: 31, train_loss: 1.0174, test_loss: 1.0074, test_f1: 0.4540
 epoch: 32, train_loss: 1.0190, test_loss: 1.0062, test_f1: 0.4427
 epoch: 33, train_loss: 1.0095, test_loss: 0.9981, test_f1: 0.4585
 epoch: 34, train_loss: 1.0072, test_loss: 0.9959, test_f1: 0.4588
 epoch: 35, train_loss: 1.0086, test_loss: 1.0094, test_f1: 0.4511
 epoch: 36, train_loss: 1.0020, test_loss: 0.9938, test_f1: 0.4562
 epoch: 37, train_loss: 1.0051, test_loss: 0.9882, test_f1: 0.4642
 epoch: 38, train_loss: 1.0006, test_loss: 0.9992, test_f1: 0.4520
 epoch: 39, train_loss: 0.9926, test_loss: 0.9952, test_f1: 0.4596
 epoch: 40, train_loss: 0.9845, test_loss: 0.9871, test_f1: 0.4588
 epoch: 41, train_loss: 0.9860, test_loss: 0.9870, test_f1: 0.4660
 epoch: 42, train_loss: 0.9823, test_loss: 0.9792, test_f1: 0.4712
 epoch: 43, train_loss: 0.9780, test_loss: 0.9876, test_f1: 0.4724
 epoch: 44, train_loss: 0.9728, test_loss: 0.9812, test_f1: 0.4761
 epoch: 45, train_loss: 0.9712, test_loss: 0.9832, test_f1: 0.4666
 epoch: 46, train_loss: 0.9644, test_loss: 0.9826, test_f1: 0.4689
 epoch: 47, train_loss: 0.9628, test_loss: 0.9863, test_f1: 0.4730
 epoch: 48, train_loss: 0.9571, test_loss: 0.9844, test_f1: 0.4739
 epoch: 49, train_loss: 0.9627, test_loss: 0.9916, test_f1: 0.4783
 epoch: 50, train_loss: 0.9360, test_loss: 0.9793, test_f1: 0.4802
 epoch: 51, train_loss: 0.9471, test_loss: 0.9904, test_f1: 0.4709
 epoch: 52, train_loss: 0.9467, test_loss: 0.9784, test_f1: 0.4810
 epoch: 53, train_loss: 0.9551, test_loss: 0.9799, test_f1: 0.4814
 epoch: 54, train_loss: 0.9481, test_loss: 0.9743, test_f1: 0.4775
 epoch: 55, train_loss: 0.9377, test_loss: 0.9826, test_f1: 0.4736
 epoch: 56, train_loss: 0.9381, test_loss: 0.9843, test_f1: 0.4741
 epoch: 57, train_loss: 0.9315, test_loss: 0.9886, test_f1: 0.4780
 epoch: 58, train_loss: 0.9276, test_loss: 0.9904, test_f1: 0.4841
 epoch: 59, train_loss: 0.9345, test_loss: 0.9903, test_f1: 0.4831
 epoch: 60, train_loss: 0.9285, test_loss: 0.9940, test_f1: 0.4841
 epoch: 61, train_loss: 0.9192, test_loss: 0.9911, test_f1: 0.4793
 epoch: 62, train_loss: 0.9324, test_loss: 0.9887, test_f1: 0.4880
 epoch: 63, train_loss: 0.9219, test_loss: 0.9926, test_f1: 0.4837
 epoch: 64, train_loss: 0.9372, test_loss: 0.9957, test_f1: 0.4869
 epoch: 65, train_loss: 0.9270, test_loss: 0.9900, test_f1: 0.4882
 epoch: 66, train_loss: 0.9101, test_loss: 0.9874, test_f1: 0.4872
 epoch: 67, train_loss: 0.9166, test_loss: 1.0052, test_f1: 0.4840
 epoch: 68, train_loss: 0.9367, test_loss: 0.9942, test_f1: 0.4882
 epoch: 69, train_loss: 0.9141, test_loss: 0.9960, test_f1: 0.4844
 epoch: 70, train_loss: 0.9129, test_loss: 0.9992, test_f1: 0.4964
 epoch: 71, train_loss: 0.9091, test_loss: 1.0056, test_f1: 0.4862
 epoch: 72, train_loss: 0.9170, test_loss: 0.9949, test_f1: 0.4917
 epoch: 73, train_loss: 0.9159, test_loss: 0.9926, test_f1: 0.4921
 epoch: 74, train_loss: 0.9111, test_loss: 0.9912, test_f1: 0.4950
 epoch: 75, train_loss: 0.9035, test_loss: 0.9980, test_f1: 0.4882
 epoch: 76, train_loss: 0.9191, test_loss: 1.0006, test_f1: 0.4924
 epoch: 77, train_loss: 0.9131, test_loss: 0.9894, test_f1: 0.4970
 epoch: 78, train_loss: 0.9000, test_loss: 0.9945, test_f1: 0.4957
 epoch: 79, train_loss: 0.9110, test_loss: 0.9992, test_f1: 0.4932
 epoch: 80, train_loss: 0.9100, test_loss: 0.9937, test_f1: 0.4941
 epoch: 81, train_loss: 0.9018, test_loss: 0.9970, test_f1: 0.4830
 epoch: 82, train_loss: 0.9068, test_loss: 0.9985, test_f1: 0.4930
 epoch: 83, train_loss: 0.9030, test_loss: 0.9962, test_f1: 0.4913
 epoch: 84, train_loss: 0.8952, test_loss: 0.9891, test_f1: 0.5027
 epoch: 85, train_loss: 0.9006, test_loss: 1.0069, test_f1: 0.4860
 epoch: 86, train_loss: 0.9007, test_loss: 0.9952, test_f1: 0.5021
 epoch: 87, train_loss: 0.8959, test_loss: 1.0009, test_f1: 0.4950
 epoch: 88, train_loss: 0.8917, test_loss: 0.9999, test_f1: 0.4966
 epoch: 89, train_loss: 0.8860, test_loss: 0.9970, test_f1: 0.4946
 epoch: 90, train_loss: 0.8909, test_loss: 0.9901, test_f1: 0.4968
 epoch: 91, train_loss: 0.8868, test_loss: 0.9940, test_f1: 0.4916
 epoch: 92, train_loss: 0.8977, test_loss: 0.9971, test_f1: 0.5073
 epoch: 93, train_loss: 0.8786, test_loss: 1.0092, test_f1: 0.4967
 epoch: 94, train_loss: 0.8820, test_loss: 1.0072, test_f1: 0.4875
 epoch: 95, train_loss: 0.8758, test_loss: 1.0100, test_f1: 0.4927
 epoch: 96, train_loss: 0.8890, test_loss: 1.0055, test_f1: 0.4925
 epoch: 97, train_loss: 0.8873, test_loss: 1.0068, test_f1: 0.4980
 epoch: 98, train_loss: 0.8862, test_loss: 1.0110, test_f1: 0.4930
 epoch: 99, train_loss: 0.8647, test_loss: 1.0109, test_f1: 0.4906
##################ITERATION #9 ****************************************
 epoch: 0, train_loss: 1.3775, test_loss: 1.2338, test_f1: 0.3559
 epoch: 1, train_loss: 1.2886, test_loss: 1.1935, test_f1: 0.3977
 epoch: 2, train_loss: 1.2504, test_loss: 1.1732, test_f1: 0.4006
 epoch: 3, train_loss: 1.2341, test_loss: 1.1618, test_f1: 0.4245
 epoch: 4, train_loss: 1.2146, test_loss: 1.1443, test_f1: 0.4253
 epoch: 5, train_loss: 1.1995, test_loss: 1.1265, test_f1: 0.4331
 epoch: 6, train_loss: 1.1757, test_loss: 1.1144, test_f1: 0.4339
 epoch: 7, train_loss: 1.1683, test_loss: 1.1122, test_f1: 0.4237
 epoch: 8, train_loss: 1.1501, test_loss: 1.0917, test_f1: 0.4415
 epoch: 9, train_loss: 1.1434, test_loss: 1.0863, test_f1: 0.4450
 epoch: 10, train_loss: 1.1335, test_loss: 1.0814, test_f1: 0.4543
 epoch: 11, train_loss: 1.1274, test_loss: 1.0678, test_f1: 0.4445
 epoch: 12, train_loss: 1.1190, test_loss: 1.0656, test_f1: 0.4496
 epoch: 13, train_loss: 1.1102, test_loss: 1.0575, test_f1: 0.4349
 epoch: 14, train_loss: 1.0977, test_loss: 1.0629, test_f1: 0.4240
 epoch: 15, train_loss: 1.1035, test_loss: 1.0638, test_f1: 0.4220
 epoch: 16, train_loss: 1.0925, test_loss: 1.0620, test_f1: 0.4397
 epoch: 17, train_loss: 1.0854, test_loss: 1.0369, test_f1: 0.4707
 epoch: 18, train_loss: 1.0854, test_loss: 1.0439, test_f1: 0.4502
 epoch: 19, train_loss: 1.0811, test_loss: 1.0330, test_f1: 0.4560
 epoch: 20, train_loss: 1.0636, test_loss: 1.0380, test_f1: 0.4606
 epoch: 21, train_loss: 1.0546, test_loss: 1.0232, test_f1: 0.4634
 epoch: 22, train_loss: 1.0565, test_loss: 1.0244, test_f1: 0.4684
 epoch: 23, train_loss: 1.0477, test_loss: 1.0058, test_f1: 0.4675
 epoch: 24, train_loss: 1.0436, test_loss: 1.0135, test_f1: 0.4847
 epoch: 25, train_loss: 1.0366, test_loss: 1.0016, test_f1: 0.4782
 epoch: 26, train_loss: 1.0377, test_loss: 1.0040, test_f1: 0.4830
 epoch: 27, train_loss: 1.0225, test_loss: 0.9968, test_f1: 0.4706
 epoch: 28, train_loss: 1.0133, test_loss: 1.0083, test_f1: 0.4683
 epoch: 29, train_loss: 1.0205, test_loss: 1.0043, test_f1: 0.4896
 epoch: 30, train_loss: 1.0099, test_loss: 0.9915, test_f1: 0.4475
 epoch: 31, train_loss: 1.0092, test_loss: 0.9939, test_f1: 0.4834
 epoch: 32, train_loss: 1.0095, test_loss: 0.9851, test_f1: 0.4688
 epoch: 33, train_loss: 0.9994, test_loss: 0.9810, test_f1: 0.4791
 epoch: 34, train_loss: 0.9976, test_loss: 0.9852, test_f1: 0.4729
 epoch: 35, train_loss: 0.9945, test_loss: 0.9870, test_f1: 0.4722
 epoch: 36, train_loss: 0.9836, test_loss: 0.9865, test_f1: 0.4806
 epoch: 37, train_loss: 0.9792, test_loss: 0.9880, test_f1: 0.4828
 epoch: 38, train_loss: 0.9812, test_loss: 1.0119, test_f1: 0.4542
 epoch: 39, train_loss: 0.9728, test_loss: 0.9626, test_f1: 0.4895
 epoch: 40, train_loss: 0.9765, test_loss: 0.9758, test_f1: 0.4907
 epoch: 41, train_loss: 0.9741, test_loss: 0.9657, test_f1: 0.4893
 epoch: 42, train_loss: 0.9585, test_loss: 0.9885, test_f1: 0.4921
 epoch: 43, train_loss: 0.9710, test_loss: 0.9817, test_f1: 0.4940
 epoch: 44, train_loss: 0.9633, test_loss: 0.9801, test_f1: 0.4702
 epoch: 45, train_loss: 0.9659, test_loss: 0.9649, test_f1: 0.4845
 epoch: 46, train_loss: 0.9499, test_loss: 0.9729, test_f1: 0.4931
 epoch: 47, train_loss: 0.9474, test_loss: 0.9714, test_f1: 0.4934
 epoch: 48, train_loss: 0.9464, test_loss: 0.9792, test_f1: 0.5024
 epoch: 49, train_loss: 0.9389, test_loss: 0.9626, test_f1: 0.4902
 epoch: 50, train_loss: 0.9393, test_loss: 0.9694, test_f1: 0.4908
 epoch: 51, train_loss: 0.9358, test_loss: 0.9615, test_f1: 0.4864
 epoch: 52, train_loss: 0.9193, test_loss: 0.9629, test_f1: 0.4897
 epoch: 53, train_loss: 0.9330, test_loss: 0.9819, test_f1: 0.4793
 epoch: 54, train_loss: 0.9243, test_loss: 0.9666, test_f1: 0.4901
 epoch: 55, train_loss: 0.9184, test_loss: 0.9636, test_f1: 0.4941
 epoch: 56, train_loss: 0.9243, test_loss: 0.9739, test_f1: 0.4888
 epoch: 57, train_loss: 0.9135, test_loss: 0.9567, test_f1: 0.4987
 epoch: 58, train_loss: 0.9192, test_loss: 0.9644, test_f1: 0.4937
 epoch: 59, train_loss: 0.9246, test_loss: 0.9726, test_f1: 0.4916
 epoch: 60, train_loss: 0.9126, test_loss: 0.9728, test_f1: 0.4901
 epoch: 61, train_loss: 0.9002, test_loss: 0.9697, test_f1: 0.4960
 epoch: 62, train_loss: 0.9188, test_loss: 0.9717, test_f1: 0.4938
 epoch: 63, train_loss: 0.9076, test_loss: 0.9606, test_f1: 0.4974
 epoch: 64, train_loss: 0.9077, test_loss: 0.9669, test_f1: 0.4958
 epoch: 65, train_loss: 0.9092, test_loss: 0.9796, test_f1: 0.4953
 epoch: 66, train_loss: 0.9058, test_loss: 0.9650, test_f1: 0.4982
 epoch: 67, train_loss: 0.9001, test_loss: 0.9801, test_f1: 0.4810
 epoch: 68, train_loss: 0.9065, test_loss: 0.9668, test_f1: 0.5005
 epoch: 69, train_loss: 0.9086, test_loss: 0.9678, test_f1: 0.4967
 epoch: 70, train_loss: 0.9061, test_loss: 1.0017, test_f1: 0.4657
 epoch: 71, train_loss: 0.8999, test_loss: 0.9724, test_f1: 0.4940
 epoch: 72, train_loss: 0.9051, test_loss: 0.9853, test_f1: 0.4777
 epoch: 73, train_loss: 0.8995, test_loss: 0.9759, test_f1: 0.4775
 epoch: 74, train_loss: 0.8984, test_loss: 0.9590, test_f1: 0.5073
 epoch: 75, train_loss: 0.8971, test_loss: 0.9785, test_f1: 0.5005
 epoch: 76, train_loss: 0.8994, test_loss: 0.9597, test_f1: 0.5040
 epoch: 77, train_loss: 0.8916, test_loss: 0.9906, test_f1: 0.4866
 epoch: 78, train_loss: 0.8896, test_loss: 0.9814, test_f1: 0.5009
 epoch: 79, train_loss: 0.8862, test_loss: 0.9846, test_f1: 0.4943
 epoch: 80, train_loss: 0.8889, test_loss: 0.9744, test_f1: 0.4943
 epoch: 81, train_loss: 0.8827, test_loss: 0.9885, test_f1: 0.4940
 epoch: 82, train_loss: 0.8875, test_loss: 0.9882, test_f1: 0.4957
 epoch: 83, train_loss: 0.8844, test_loss: 0.9818, test_f1: 0.5002
 epoch: 84, train_loss: 0.8803, test_loss: 0.9707, test_f1: 0.4921
 epoch: 85, train_loss: 0.8757, test_loss: 0.9973, test_f1: 0.4720
 epoch: 86, train_loss: 0.8901, test_loss: 1.0059, test_f1: 0.4631
 epoch: 87, train_loss: 0.8796, test_loss: 0.9726, test_f1: 0.4920
 epoch: 88, train_loss: 0.8860, test_loss: 0.9809, test_f1: 0.4976
 epoch: 89, train_loss: 0.8868, test_loss: 0.9769, test_f1: 0.5002
 epoch: 90, train_loss: 0.8792, test_loss: 0.9817, test_f1: 0.4961
 epoch: 91, train_loss: 0.8845, test_loss: 0.9718, test_f1: 0.4944
 epoch: 92, train_loss: 0.8679, test_loss: 0.9987, test_f1: 0.4583
 epoch: 93, train_loss: 0.8693, test_loss: 0.9739, test_f1: 0.4973
 epoch: 94, train_loss: 0.8686, test_loss: 0.9900, test_f1: 0.4756
 epoch: 95, train_loss: 0.8603, test_loss: 0.9838, test_f1: 0.4928
 epoch: 96, train_loss: 0.8676, test_loss: 0.9636, test_f1: 0.4985
 epoch: 97, train_loss: 0.8694, test_loss: 0.9975, test_f1: 0.4874
 epoch: 98, train_loss: 0.8724, test_loss: 0.9789, test_f1: 0.4819
 epoch: 99, train_loss: 0.8694, test_loss: 0.9797, test_f1: 0.4919

Training completed in 557.53 seconds
Best F1: 0.5348 at epoch 80
Mean F1 across iterations: 0.5151  0.0104
========================FINAL RESULTS================================
FEGIN weighted F1: 0.5348  0.0104
python main.py --data ltspice_examples --representation component_component --model FEGIN --layers 2 --hiddens 64 --batch_size 64 --lr 0.0001 --emb_size 128 --epochs 100 --save_appendix component_component_L2_H64_BS64_LR0.0001_E128 --no_val
-----



STDERR:
  File "main.py", line 370, in <module>
    main()
  File "main.py", line 254, in main
    dataset = dataset_class(
  File "/home/philip/projects/ltspice_examples_code_repo/Circuit-Completion-Using-GNNs/component_classification_with_link_prediction_head/evaluation/FEGIN/kernel/circuit_datasets.py", line 15, in __init__
    self.data, self.slices = torch.load(self.processed_paths[0])
  File "/home/philip/.local/lib/python3.8/site-packages/torch/serialization.py", line 1040, in load
    warnings.warn(
  File "/usr/lib/python3.8/warnings.py", line 109, in _showwarnmsg
    sw(msg.message, msg.category, msg.filename, msg.lineno,
  File "main.py", line 47, in warn_with_traceback
    traceback.print_stack(file=log)
/home/philip/projects/ltspice_examples_code_repo/Circuit-Completion-Using-GNNs/component_classification_with_link_prediction_head/evaluation/FEGIN/kernel/circuit_datasets.py:15: FutureWarning: You are using `torch.load` with `weights_only=False` (the current default value), which uses the default pickle module implicitly. It is possible to construct malicious pickle data which will execute arbitrary code during unpickling (See https://github.com/pytorch/pytorch/blob/main/SECURITY.md#untrusted-models for more details). In a future release, the default value for `weights_only` will be flipped to `True`. This limits the functions that could be executed during unpickling. Arbitrary objects will no longer be allowed to be loaded via this mode unless they are explicitly allowlisted by the user via `torch.serialization.add_safe_globals`. We recommend you start setting `weights_only=True` for any use case where you don't have full control of the loaded file. Please open an issue on GitHub for any issues related to this experimental feature.
  self.data, self.slices = torch.load(self.processed_paths[0])
