STDOUT:
Results will be saved in /home/philip/projects/ltspice_examples_code_repo/Circuit-Completion-Using-GNNs/component_classification_with_link_prediction_head/evaluation/FEGIN/results/model_FEGIN_dataset_ltspice_examples
Command line input: python main.py --data ltspice_examples --representation component_pin --model FEGIN --layers 3 --hiddens 16 --batch_size 128 --lr 0.01 --emb_size 250 --epochs 100 --save_appendix component_pin_L3_H16_BS128_LR0.01_E250 --no_val
 is saved.
-----
ltspice_examples - FEGIN
Using 3 layers, 16 hidden units, h = 2
Loading component_pin representation dataset
ENTERED
Training FEGIN on component_pin representation
Train: 3560, Test: 848
##################ITERATION #0 ****************************************
 epoch: 0, train_loss: 1.2618, test_loss: 1.1834, test_f1: 0.2260
 epoch: 1, train_loss: 1.1210, test_loss: 1.0544, test_f1: 0.4101
 epoch: 2, train_loss: 1.0407, test_loss: 1.0456, test_f1: 0.4534
 epoch: 3, train_loss: 1.0169, test_loss: 1.1156, test_f1: 0.3427
 epoch: 4, train_loss: 1.0119, test_loss: 1.0799, test_f1: 0.4488
 epoch: 5, train_loss: 0.9876, test_loss: 1.0583, test_f1: 0.4191
 epoch: 6, train_loss: 0.9564, test_loss: 0.9979, test_f1: 0.4585
 epoch: 7, train_loss: 0.9479, test_loss: 1.0076, test_f1: 0.4737
 epoch: 8, train_loss: 0.9250, test_loss: 0.9501, test_f1: 0.5094
 epoch: 9, train_loss: 0.9107, test_loss: 1.2101, test_f1: 0.4481
 epoch: 10, train_loss: 0.9036, test_loss: 1.0056, test_f1: 0.5047
 epoch: 11, train_loss: 0.8958, test_loss: 0.9209, test_f1: 0.5083
 epoch: 12, train_loss: 0.8750, test_loss: 1.1511, test_f1: 0.4634
 epoch: 13, train_loss: 0.8951, test_loss: 0.9878, test_f1: 0.4877
 epoch: 14, train_loss: 0.8745, test_loss: 0.9983, test_f1: 0.4954
 epoch: 15, train_loss: 0.8712, test_loss: 0.8784, test_f1: 0.5169
 epoch: 16, train_loss: 0.8608, test_loss: 1.0189, test_f1: 0.4899
 epoch: 17, train_loss: 0.8552, test_loss: 0.8944, test_f1: 0.5262
 epoch: 18, train_loss: 0.8460, test_loss: 0.8636, test_f1: 0.5427
 epoch: 19, train_loss: 0.8285, test_loss: 0.8429, test_f1: 0.5501
 epoch: 20, train_loss: 0.8329, test_loss: 0.8993, test_f1: 0.5305
 epoch: 21, train_loss: 0.8310, test_loss: 0.9304, test_f1: 0.5196
 epoch: 22, train_loss: 0.8128, test_loss: 0.8721, test_f1: 0.5386
 epoch: 23, train_loss: 0.8067, test_loss: 0.8546, test_f1: 0.5379
 epoch: 24, train_loss: 0.7999, test_loss: 0.9135, test_f1: 0.5110
 epoch: 25, train_loss: 0.8016, test_loss: 0.8839, test_f1: 0.5359
 epoch: 26, train_loss: 0.8129, test_loss: 0.9843, test_f1: 0.4945
 epoch: 27, train_loss: 0.8152, test_loss: 0.8832, test_f1: 0.5234
 epoch: 28, train_loss: 0.8165, test_loss: 0.8760, test_f1: 0.5502
 epoch: 29, train_loss: 0.7876, test_loss: 0.8597, test_f1: 0.5641
 epoch: 30, train_loss: 0.7983, test_loss: 0.8444, test_f1: 0.5533
 epoch: 31, train_loss: 0.7789, test_loss: 0.9577, test_f1: 0.5120
 epoch: 32, train_loss: 0.7790, test_loss: 0.9004, test_f1: 0.5303
 epoch: 33, train_loss: 0.7787, test_loss: 0.8970, test_f1: 0.5419
 epoch: 34, train_loss: 0.7846, test_loss: 0.8744, test_f1: 0.5299
 epoch: 35, train_loss: 0.7714, test_loss: 0.9022, test_f1: 0.5371
 epoch: 36, train_loss: 0.7565, test_loss: 0.8682, test_f1: 0.5192
 epoch: 37, train_loss: 0.7759, test_loss: 0.9116, test_f1: 0.5242
 epoch: 38, train_loss: 0.7780, test_loss: 0.8740, test_f1: 0.5389
 epoch: 39, train_loss: 0.7706, test_loss: 0.8523, test_f1: 0.5632
 epoch: 40, train_loss: 0.7495, test_loss: 0.8493, test_f1: 0.5373
 epoch: 41, train_loss: 0.7472, test_loss: 0.8337, test_f1: 0.5502
 epoch: 42, train_loss: 0.7637, test_loss: 0.8475, test_f1: 0.5587
 epoch: 43, train_loss: 0.7530, test_loss: 0.8327, test_f1: 0.5654
 epoch: 44, train_loss: 0.7474, test_loss: 1.0135, test_f1: 0.4592
 epoch: 45, train_loss: 0.7638, test_loss: 1.0081, test_f1: 0.5386
 epoch: 46, train_loss: 0.7487, test_loss: 0.8402, test_f1: 0.6115
 epoch: 47, train_loss: 0.7471, test_loss: 0.8245, test_f1: 0.5584
 epoch: 48, train_loss: 0.7454, test_loss: 0.8607, test_f1: 0.5509
 epoch: 49, train_loss: 0.7525, test_loss: 0.8556, test_f1: 0.5434
 epoch: 50, train_loss: 0.7656, test_loss: 0.9114, test_f1: 0.5459
 epoch: 51, train_loss: 0.7506, test_loss: 0.8208, test_f1: 0.5571
 epoch: 52, train_loss: 0.7351, test_loss: 0.7968, test_f1: 0.6132
 epoch: 53, train_loss: 0.7171, test_loss: 0.8249, test_f1: 0.5516
 epoch: 54, train_loss: 0.7134, test_loss: 0.8143, test_f1: 0.5776
 epoch: 55, train_loss: 0.7005, test_loss: 0.8069, test_f1: 0.5788
 epoch: 56, train_loss: 0.7126, test_loss: 0.8381, test_f1: 0.5945
 epoch: 57, train_loss: 0.7150, test_loss: 0.8018, test_f1: 0.5677
 epoch: 58, train_loss: 0.7066, test_loss: 0.8377, test_f1: 0.5458
 epoch: 59, train_loss: 0.7088, test_loss: 0.8166, test_f1: 0.5787
 epoch: 60, train_loss: 0.7006, test_loss: 0.8253, test_f1: 0.5364
 epoch: 61, train_loss: 0.6950, test_loss: 0.8233, test_f1: 0.5627
 epoch: 62, train_loss: 0.6982, test_loss: 0.8355, test_f1: 0.5802
 epoch: 63, train_loss: 0.6993, test_loss: 0.8183, test_f1: 0.5814
 epoch: 64, train_loss: 0.6973, test_loss: 0.8061, test_f1: 0.5967
 epoch: 65, train_loss: 0.6996, test_loss: 0.7940, test_f1: 0.5569
 epoch: 66, train_loss: 0.6979, test_loss: 0.8182, test_f1: 0.6225
 epoch: 67, train_loss: 0.7109, test_loss: 0.8384, test_f1: 0.5584
 epoch: 68, train_loss: 0.6910, test_loss: 0.7911, test_f1: 0.5527
 epoch: 69, train_loss: 0.6922, test_loss: 0.7889, test_f1: 0.5702
 epoch: 70, train_loss: 0.7020, test_loss: 0.8368, test_f1: 0.5706
 epoch: 71, train_loss: 0.7359, test_loss: 0.8470, test_f1: 0.5482
 epoch: 72, train_loss: 0.6877, test_loss: 0.8262, test_f1: 0.5463
 epoch: 73, train_loss: 0.6865, test_loss: 0.8038, test_f1: 0.6018
 epoch: 74, train_loss: 0.6984, test_loss: 0.8495, test_f1: 0.5663
 epoch: 75, train_loss: 0.6949, test_loss: 0.8442, test_f1: 0.5677
 epoch: 76, train_loss: 0.6841, test_loss: 0.8151, test_f1: 0.5694
 epoch: 77, train_loss: 0.6720, test_loss: 0.8351, test_f1: 0.5775
 epoch: 78, train_loss: 0.6920, test_loss: 0.8065, test_f1: 0.5738
 epoch: 79, train_loss: 0.6701, test_loss: 0.8555, test_f1: 0.5537
 epoch: 80, train_loss: 0.6807, test_loss: 0.8071, test_f1: 0.5689
 epoch: 81, train_loss: 0.6654, test_loss: 0.8491, test_f1: 0.5565
 epoch: 82, train_loss: 0.6836, test_loss: 0.8177, test_f1: 0.6296
 epoch: 83, train_loss: 0.6808, test_loss: 0.8116, test_f1: 0.5757
 epoch: 84, train_loss: 0.6683, test_loss: 0.8293, test_f1: 0.5507
 epoch: 85, train_loss: 0.6702, test_loss: 0.8248, test_f1: 0.5782
 epoch: 86, train_loss: 0.6642, test_loss: 0.7903, test_f1: 0.6068
 epoch: 87, train_loss: 0.6877, test_loss: 0.8452, test_f1: 0.5559
 epoch: 88, train_loss: 0.6762, test_loss: 0.7965, test_f1: 0.6041
 epoch: 89, train_loss: 0.6669, test_loss: 0.8070, test_f1: 0.5802
 epoch: 90, train_loss: 0.6744, test_loss: 0.8313, test_f1: 0.5785
 epoch: 91, train_loss: 0.6587, test_loss: 0.8348, test_f1: 0.5920
 epoch: 92, train_loss: 0.6548, test_loss: 0.8194, test_f1: 0.5970
 epoch: 93, train_loss: 0.6759, test_loss: 0.8420, test_f1: 0.5923
 epoch: 94, train_loss: 0.6598, test_loss: 0.8246, test_f1: 0.6189
 epoch: 95, train_loss: 0.6697, test_loss: 0.8201, test_f1: 0.5745
 epoch: 96, train_loss: 0.6850, test_loss: 0.8222, test_f1: 0.5780
 epoch: 97, train_loss: 0.6675, test_loss: 0.8347, test_f1: 0.6034
 epoch: 98, train_loss: 0.6673, test_loss: 0.8299, test_f1: 0.5670
 epoch: 99, train_loss: 0.6698, test_loss: 0.8286, test_f1: 0.5701
##################ITERATION #1 ****************************************
 epoch: 0, train_loss: 1.2046, test_loss: 1.1116, test_f1: 0.3619
 epoch: 1, train_loss: 1.0551, test_loss: 1.0701, test_f1: 0.4628
 epoch: 2, train_loss: 0.9948, test_loss: 0.9820, test_f1: 0.4619
 epoch: 3, train_loss: 0.9837, test_loss: 1.0121, test_f1: 0.4834
 epoch: 4, train_loss: 0.9818, test_loss: 1.0141, test_f1: 0.5317
 epoch: 5, train_loss: 0.9608, test_loss: 1.1127, test_f1: 0.4034
 epoch: 6, train_loss: 0.9301, test_loss: 2.1015, test_f1: 0.3559
 epoch: 7, train_loss: 0.9511, test_loss: 1.1887, test_f1: 0.4172
 epoch: 8, train_loss: 0.9159, test_loss: 0.8871, test_f1: 0.5191
 epoch: 9, train_loss: 0.9046, test_loss: 1.0129, test_f1: 0.4816
 epoch: 10, train_loss: 0.9017, test_loss: 1.0388, test_f1: 0.4769
 epoch: 11, train_loss: 0.8932, test_loss: 0.9697, test_f1: 0.5281
 epoch: 12, train_loss: 0.8783, test_loss: 1.0290, test_f1: 0.4424
 epoch: 13, train_loss: 0.8807, test_loss: 1.2109, test_f1: 0.3882
 epoch: 14, train_loss: 0.8552, test_loss: 0.9832, test_f1: 0.5201
 epoch: 15, train_loss: 0.8624, test_loss: 1.0088, test_f1: 0.4774
 epoch: 16, train_loss: 0.8439, test_loss: 1.0159, test_f1: 0.5106
 epoch: 17, train_loss: 0.8520, test_loss: 1.1760, test_f1: 0.4505
 epoch: 18, train_loss: 0.8291, test_loss: 0.9600, test_f1: 0.5741
 epoch: 19, train_loss: 0.8372, test_loss: 0.9691, test_f1: 0.4939
 epoch: 20, train_loss: 0.8244, test_loss: 0.9012, test_f1: 0.5221
 epoch: 21, train_loss: 0.8263, test_loss: 0.9261, test_f1: 0.5065
 epoch: 22, train_loss: 0.8119, test_loss: 0.9861, test_f1: 0.5255
 epoch: 23, train_loss: 0.8299, test_loss: 0.9843, test_f1: 0.4530
 epoch: 24, train_loss: 0.8294, test_loss: 1.0755, test_f1: 0.4691
 epoch: 25, train_loss: 0.8197, test_loss: 1.1566, test_f1: 0.4778
 epoch: 26, train_loss: 0.8054, test_loss: 1.2093, test_f1: 0.4444
 epoch: 27, train_loss: 0.7931, test_loss: 0.9020, test_f1: 0.5268
 epoch: 28, train_loss: 0.8146, test_loss: 1.0197, test_f1: 0.5066
 epoch: 29, train_loss: 0.8019, test_loss: 0.9356, test_f1: 0.5020
 epoch: 30, train_loss: 0.7932, test_loss: 1.0230, test_f1: 0.5030
 epoch: 31, train_loss: 0.7972, test_loss: 0.9390, test_f1: 0.5107
 epoch: 32, train_loss: 0.8000, test_loss: 0.9762, test_f1: 0.4810
 epoch: 33, train_loss: 0.7917, test_loss: 1.0457, test_f1: 0.5387
 epoch: 34, train_loss: 0.7943, test_loss: 0.9092, test_f1: 0.5561
 epoch: 35, train_loss: 0.7854, test_loss: 1.0518, test_f1: 0.4955
 epoch: 36, train_loss: 0.7822, test_loss: 1.0953, test_f1: 0.4444
 epoch: 37, train_loss: 0.7944, test_loss: 0.9385, test_f1: 0.5128
 epoch: 38, train_loss: 0.7923, test_loss: 0.9079, test_f1: 0.5147
 epoch: 39, train_loss: 0.7723, test_loss: 1.0053, test_f1: 0.4809
 epoch: 40, train_loss: 0.7695, test_loss: 0.8828, test_f1: 0.6042
 epoch: 41, train_loss: 0.7700, test_loss: 1.1226, test_f1: 0.4994
 epoch: 42, train_loss: 0.7809, test_loss: 0.9011, test_f1: 0.5185
 epoch: 43, train_loss: 0.7660, test_loss: 0.8923, test_f1: 0.5341
 epoch: 44, train_loss: 0.7630, test_loss: 0.8894, test_f1: 0.5675
 epoch: 45, train_loss: 0.7564, test_loss: 1.0235, test_f1: 0.5273
 epoch: 46, train_loss: 0.7614, test_loss: 0.9030, test_f1: 0.5325
 epoch: 47, train_loss: 0.7799, test_loss: 0.8748, test_f1: 0.5411
 epoch: 48, train_loss: 0.7669, test_loss: 0.9480, test_f1: 0.4997
 epoch: 49, train_loss: 0.7605, test_loss: 0.8953, test_f1: 0.5523
 epoch: 50, train_loss: 0.7554, test_loss: 0.9510, test_f1: 0.5596
 epoch: 51, train_loss: 0.7297, test_loss: 0.9228, test_f1: 0.5872
 epoch: 52, train_loss: 0.7252, test_loss: 0.8629, test_f1: 0.5764
 epoch: 53, train_loss: 0.7135, test_loss: 0.8697, test_f1: 0.5810
 epoch: 54, train_loss: 0.7182, test_loss: 0.9395, test_f1: 0.5444
 epoch: 55, train_loss: 0.7054, test_loss: 0.9290, test_f1: 0.5763
 epoch: 56, train_loss: 0.7232, test_loss: 0.8988, test_f1: 0.5671
 epoch: 57, train_loss: 0.7011, test_loss: 0.9307, test_f1: 0.5901
 epoch: 58, train_loss: 0.7133, test_loss: 1.0731, test_f1: 0.5479
 epoch: 59, train_loss: 0.7201, test_loss: 1.0193, test_f1: 0.5189
 epoch: 60, train_loss: 0.7185, test_loss: 0.9251, test_f1: 0.6059
 epoch: 61, train_loss: 0.7110, test_loss: 0.8819, test_f1: 0.5711
 epoch: 62, train_loss: 0.7212, test_loss: 0.9210, test_f1: 0.5632
 epoch: 63, train_loss: 0.7042, test_loss: 0.8946, test_f1: 0.5989
 epoch: 64, train_loss: 0.7098, test_loss: 0.8715, test_f1: 0.5838
 epoch: 65, train_loss: 0.7143, test_loss: 0.9031, test_f1: 0.5852
 epoch: 66, train_loss: 0.7030, test_loss: 0.9082, test_f1: 0.5931
 epoch: 67, train_loss: 0.7084, test_loss: 0.8719, test_f1: 0.6338
 epoch: 68, train_loss: 0.6943, test_loss: 0.9525, test_f1: 0.5793
 epoch: 69, train_loss: 0.6971, test_loss: 0.8675, test_f1: 0.6239
 epoch: 70, train_loss: 0.6953, test_loss: 0.8205, test_f1: 0.6222
 epoch: 71, train_loss: 0.6963, test_loss: 0.9213, test_f1: 0.5654
 epoch: 72, train_loss: 0.6950, test_loss: 0.8565, test_f1: 0.6343
 epoch: 73, train_loss: 0.6939, test_loss: 0.9020, test_f1: 0.5918
 epoch: 74, train_loss: 0.6986, test_loss: 0.9681, test_f1: 0.5546
 epoch: 75, train_loss: 0.7082, test_loss: 0.9494, test_f1: 0.5420
 epoch: 76, train_loss: 0.6959, test_loss: 0.9197, test_f1: 0.5762
 epoch: 77, train_loss: 0.6891, test_loss: 0.9773, test_f1: 0.5626
 epoch: 78, train_loss: 0.6857, test_loss: 0.8964, test_f1: 0.5881
 epoch: 79, train_loss: 0.6823, test_loss: 0.8942, test_f1: 0.6251
 epoch: 80, train_loss: 0.6767, test_loss: 0.9256, test_f1: 0.5573
 epoch: 81, train_loss: 0.6838, test_loss: 0.8901, test_f1: 0.5690
 epoch: 82, train_loss: 0.6728, test_loss: 0.9241, test_f1: 0.6083
 epoch: 83, train_loss: 0.7012, test_loss: 0.9391, test_f1: 0.5671
 epoch: 84, train_loss: 0.6808, test_loss: 0.9264, test_f1: 0.5864
 epoch: 85, train_loss: 0.6894, test_loss: 0.8670, test_f1: 0.5928
 epoch: 86, train_loss: 0.6954, test_loss: 0.9678, test_f1: 0.5912
 epoch: 87, train_loss: 0.6802, test_loss: 0.9321, test_f1: 0.5719
 epoch: 88, train_loss: 0.6951, test_loss: 0.8792, test_f1: 0.5719
 epoch: 89, train_loss: 0.6768, test_loss: 0.9183, test_f1: 0.5486
 epoch: 90, train_loss: 0.6856, test_loss: 0.8935, test_f1: 0.6087
 epoch: 91, train_loss: 0.6899, test_loss: 0.9467, test_f1: 0.5604
 epoch: 92, train_loss: 0.6791, test_loss: 0.9453, test_f1: 0.5747
 epoch: 93, train_loss: 0.6952, test_loss: 0.9446, test_f1: 0.5847
 epoch: 94, train_loss: 0.6695, test_loss: 0.9040, test_f1: 0.5636
 epoch: 95, train_loss: 0.6887, test_loss: 0.9254, test_f1: 0.5609
 epoch: 96, train_loss: 0.6945, test_loss: 1.1333, test_f1: 0.5165
 epoch: 97, train_loss: 0.6816, test_loss: 0.9437, test_f1: 0.5523
 epoch: 98, train_loss: 0.6724, test_loss: 0.9554, test_f1: 0.5734
 epoch: 99, train_loss: 0.6719, test_loss: 0.9142, test_f1: 0.5818
##################ITERATION #2 ****************************************
 epoch: 0, train_loss: 1.1973, test_loss: 1.1222, test_f1: 0.3469
 epoch: 1, train_loss: 1.0587, test_loss: 1.0546, test_f1: 0.4409
 epoch: 2, train_loss: 1.0164, test_loss: 1.0120, test_f1: 0.4593
 epoch: 3, train_loss: 1.0033, test_loss: 1.0085, test_f1: 0.4340
 epoch: 4, train_loss: 0.9820, test_loss: 0.9485, test_f1: 0.4737
 epoch: 5, train_loss: 0.9653, test_loss: 0.9717, test_f1: 0.5302
 epoch: 6, train_loss: 0.9593, test_loss: 1.1187, test_f1: 0.4690
 epoch: 7, train_loss: 0.9527, test_loss: 0.9692, test_f1: 0.4870
 epoch: 8, train_loss: 0.9351, test_loss: 0.9209, test_f1: 0.5330
 epoch: 9, train_loss: 0.9333, test_loss: 0.9327, test_f1: 0.5327
 epoch: 10, train_loss: 0.9179, test_loss: 0.9853, test_f1: 0.4842
 epoch: 11, train_loss: 0.8992, test_loss: 1.2274, test_f1: 0.4151
 epoch: 12, train_loss: 0.9197, test_loss: 0.8944, test_f1: 0.5120
 epoch: 13, train_loss: 0.8856, test_loss: 0.9215, test_f1: 0.5374
 epoch: 14, train_loss: 0.8883, test_loss: 0.8895, test_f1: 0.5728
 epoch: 15, train_loss: 0.8755, test_loss: 1.1291, test_f1: 0.4936
 epoch: 16, train_loss: 0.8923, test_loss: 0.9990, test_f1: 0.5527
 epoch: 17, train_loss: 0.8909, test_loss: 1.0928, test_f1: 0.4607
 epoch: 18, train_loss: 0.8681, test_loss: 0.9017, test_f1: 0.5486
 epoch: 19, train_loss: 0.8507, test_loss: 1.0838, test_f1: 0.4817
 epoch: 20, train_loss: 0.8697, test_loss: 0.9424, test_f1: 0.5186
 epoch: 21, train_loss: 0.8497, test_loss: 0.9686, test_f1: 0.5171
 epoch: 22, train_loss: 0.8489, test_loss: 0.8709, test_f1: 0.5915
 epoch: 23, train_loss: 0.8548, test_loss: 0.9193, test_f1: 0.5180
 epoch: 24, train_loss: 0.8466, test_loss: 0.8806, test_f1: 0.5634
 epoch: 25, train_loss: 0.8569, test_loss: 0.9899, test_f1: 0.4874
 epoch: 26, train_loss: 0.8799, test_loss: 0.9519, test_f1: 0.4823
 epoch: 27, train_loss: 0.8672, test_loss: 1.0618, test_f1: 0.5432
 epoch: 28, train_loss: 0.8402, test_loss: 0.8591, test_f1: 0.6050
 epoch: 29, train_loss: 0.8474, test_loss: 1.1346, test_f1: 0.5160
 epoch: 30, train_loss: 0.8266, test_loss: 0.9725, test_f1: 0.5463
 epoch: 31, train_loss: 0.8297, test_loss: 0.9225, test_f1: 0.5717
 epoch: 32, train_loss: 0.8254, test_loss: 1.2008, test_f1: 0.4789
 epoch: 33, train_loss: 0.8170, test_loss: 1.0905, test_f1: 0.5411
 epoch: 34, train_loss: 0.8184, test_loss: 0.8780, test_f1: 0.5761
 epoch: 35, train_loss: 0.8020, test_loss: 1.1012, test_f1: 0.5158
 epoch: 36, train_loss: 0.8182, test_loss: 0.9137, test_f1: 0.5443
 epoch: 37, train_loss: 0.8119, test_loss: 0.9719, test_f1: 0.5454
 epoch: 38, train_loss: 0.8210, test_loss: 0.9548, test_f1: 0.5482
 epoch: 39, train_loss: 0.8111, test_loss: 1.1547, test_f1: 0.5369
 epoch: 40, train_loss: 0.8221, test_loss: 0.9429, test_f1: 0.5022
 epoch: 41, train_loss: 0.8058, test_loss: 1.0283, test_f1: 0.5042
 epoch: 42, train_loss: 0.8000, test_loss: 0.8840, test_f1: 0.6145
 epoch: 43, train_loss: 0.7988, test_loss: 0.9521, test_f1: 0.5454
 epoch: 44, train_loss: 0.8050, test_loss: 0.9674, test_f1: 0.5004
 epoch: 45, train_loss: 0.8228, test_loss: 0.8450, test_f1: 0.5999
 epoch: 46, train_loss: 0.8046, test_loss: 0.8699, test_f1: 0.6116
 epoch: 47, train_loss: 0.7927, test_loss: 0.9261, test_f1: 0.5903
 epoch: 48, train_loss: 0.8047, test_loss: 0.8656, test_f1: 0.6104
 epoch: 49, train_loss: 0.8021, test_loss: 0.8438, test_f1: 0.6319
 epoch: 50, train_loss: 0.8003, test_loss: 0.9114, test_f1: 0.5766
 epoch: 51, train_loss: 0.7756, test_loss: 0.8307, test_f1: 0.6141
 epoch: 52, train_loss: 0.7544, test_loss: 0.8953, test_f1: 0.6156
 epoch: 53, train_loss: 0.7474, test_loss: 0.9042, test_f1: 0.6031
 epoch: 54, train_loss: 0.7583, test_loss: 0.8604, test_f1: 0.6206
 epoch: 55, train_loss: 0.7476, test_loss: 0.8952, test_f1: 0.6210
 epoch: 56, train_loss: 0.7475, test_loss: 0.8323, test_f1: 0.6282
 epoch: 57, train_loss: 0.7382, test_loss: 0.8583, test_f1: 0.6357
 epoch: 58, train_loss: 0.7399, test_loss: 0.8625, test_f1: 0.6527
 epoch: 59, train_loss: 0.7497, test_loss: 0.8639, test_f1: 0.6320
 epoch: 60, train_loss: 0.7258, test_loss: 0.8742, test_f1: 0.5733
 epoch: 61, train_loss: 0.7401, test_loss: 0.8759, test_f1: 0.6287
 epoch: 62, train_loss: 0.7429, test_loss: 0.9628, test_f1: 0.5874
 epoch: 63, train_loss: 0.7459, test_loss: 0.8658, test_f1: 0.6409
 epoch: 64, train_loss: 0.7229, test_loss: 0.8998, test_f1: 0.5733
 epoch: 65, train_loss: 0.7491, test_loss: 0.8687, test_f1: 0.6176
 epoch: 66, train_loss: 0.7389, test_loss: 0.8950, test_f1: 0.6211
 epoch: 67, train_loss: 0.7238, test_loss: 0.9003, test_f1: 0.6053
 epoch: 68, train_loss: 0.7369, test_loss: 0.9294, test_f1: 0.6102
 epoch: 69, train_loss: 0.7388, test_loss: 0.8593, test_f1: 0.6430
 epoch: 70, train_loss: 0.7351, test_loss: 0.8702, test_f1: 0.6257
 epoch: 71, train_loss: 0.7319, test_loss: 0.8549, test_f1: 0.6253
 epoch: 72, train_loss: 0.7244, test_loss: 0.9340, test_f1: 0.6026
 epoch: 73, train_loss: 0.7354, test_loss: 0.8540, test_f1: 0.5898
 epoch: 74, train_loss: 0.7215, test_loss: 0.8717, test_f1: 0.6418
 epoch: 75, train_loss: 0.7134, test_loss: 0.8532, test_f1: 0.5914
 epoch: 76, train_loss: 0.7086, test_loss: 0.8401, test_f1: 0.6421
 epoch: 77, train_loss: 0.7162, test_loss: 0.9247, test_f1: 0.6147
 epoch: 78, train_loss: 0.7260, test_loss: 0.8501, test_f1: 0.6409
 epoch: 79, train_loss: 0.7140, test_loss: 0.8930, test_f1: 0.6000
 epoch: 80, train_loss: 0.7124, test_loss: 0.8957, test_f1: 0.5880
 epoch: 81, train_loss: 0.7169, test_loss: 0.8846, test_f1: 0.6305
 epoch: 82, train_loss: 0.7185, test_loss: 0.9983, test_f1: 0.5689
 epoch: 83, train_loss: 0.7140, test_loss: 0.9049, test_f1: 0.6108
 epoch: 84, train_loss: 0.7133, test_loss: 0.8599, test_f1: 0.6248
 epoch: 85, train_loss: 0.7117, test_loss: 0.8851, test_f1: 0.6081
 epoch: 86, train_loss: 0.6948, test_loss: 0.9155, test_f1: 0.6114
 epoch: 87, train_loss: 0.7172, test_loss: 0.8869, test_f1: 0.6106
 epoch: 88, train_loss: 0.7083, test_loss: 0.8748, test_f1: 0.5975
 epoch: 89, train_loss: 0.7032, test_loss: 0.8702, test_f1: 0.6097
 epoch: 90, train_loss: 0.7092, test_loss: 0.8643, test_f1: 0.6291
 epoch: 91, train_loss: 0.6919, test_loss: 0.8374, test_f1: 0.6389
 epoch: 92, train_loss: 0.6941, test_loss: 0.8754, test_f1: 0.6297
 epoch: 93, train_loss: 0.6911, test_loss: 0.8554, test_f1: 0.6096
 epoch: 94, train_loss: 0.7035, test_loss: 0.8863, test_f1: 0.6173
 epoch: 95, train_loss: 0.6929, test_loss: 0.8999, test_f1: 0.6228
 epoch: 96, train_loss: 0.7082, test_loss: 0.9305, test_f1: 0.5999
 epoch: 97, train_loss: 0.7241, test_loss: 0.9464, test_f1: 0.5969
 epoch: 98, train_loss: 0.6864, test_loss: 0.9616, test_f1: 0.5686
 epoch: 99, train_loss: 0.7177, test_loss: 0.9243, test_f1: 0.6201
##################ITERATION #3 ****************************************
 epoch: 0, train_loss: 1.1847, test_loss: 1.2312, test_f1: 0.2941
 epoch: 1, train_loss: 1.0203, test_loss: 1.0083, test_f1: 0.5101
 epoch: 2, train_loss: 0.9996, test_loss: 1.0436, test_f1: 0.4494
 epoch: 3, train_loss: 0.9740, test_loss: 1.0633, test_f1: 0.4287
 epoch: 4, train_loss: 0.9703, test_loss: 0.9843, test_f1: 0.5207
 epoch: 5, train_loss: 0.9634, test_loss: 1.0846, test_f1: 0.4843
 epoch: 6, train_loss: 0.9306, test_loss: 0.9187, test_f1: 0.5273
 epoch: 7, train_loss: 0.9152, test_loss: 0.9011, test_f1: 0.5031
 epoch: 8, train_loss: 0.9216, test_loss: 0.8731, test_f1: 0.5356
 epoch: 9, train_loss: 0.8885, test_loss: 1.2967, test_f1: 0.4533
 epoch: 10, train_loss: 0.9087, test_loss: 0.9281, test_f1: 0.4911
 epoch: 11, train_loss: 0.9001, test_loss: 0.9144, test_f1: 0.5744
 epoch: 12, train_loss: 0.8891, test_loss: 0.8612, test_f1: 0.5304
 epoch: 13, train_loss: 0.8838, test_loss: 0.9301, test_f1: 0.5202
 epoch: 14, train_loss: 0.8817, test_loss: 1.0134, test_f1: 0.4430
 epoch: 15, train_loss: 0.9062, test_loss: 0.8606, test_f1: 0.5057
 epoch: 16, train_loss: 0.8869, test_loss: 0.9563, test_f1: 0.5000
 epoch: 17, train_loss: 0.8605, test_loss: 1.0034, test_f1: 0.5049
 epoch: 18, train_loss: 0.8507, test_loss: 0.9701, test_f1: 0.5122
 epoch: 19, train_loss: 0.8487, test_loss: 0.9984, test_f1: 0.4516
 epoch: 20, train_loss: 0.8638, test_loss: 0.8865, test_f1: 0.5218
 epoch: 21, train_loss: 0.8317, test_loss: 0.8824, test_f1: 0.5218
 epoch: 22, train_loss: 0.8341, test_loss: 1.0598, test_f1: 0.4741
 epoch: 23, train_loss: 0.8390, test_loss: 0.8888, test_f1: 0.5199
 epoch: 24, train_loss: 0.8423, test_loss: 0.8678, test_f1: 0.5416
 epoch: 25, train_loss: 0.8313, test_loss: 0.8430, test_f1: 0.5228
 epoch: 26, train_loss: 0.8364, test_loss: 0.8207, test_f1: 0.5416
 epoch: 27, train_loss: 0.8207, test_loss: 0.9824, test_f1: 0.5014
 epoch: 28, train_loss: 0.8276, test_loss: 0.9659, test_f1: 0.4731
 epoch: 29, train_loss: 0.8104, test_loss: 0.9128, test_f1: 0.5379
 epoch: 30, train_loss: 0.8265, test_loss: 0.9857, test_f1: 0.4971
 epoch: 31, train_loss: 0.8152, test_loss: 0.8571, test_f1: 0.5541
 epoch: 32, train_loss: 0.8225, test_loss: 0.8722, test_f1: 0.5383
 epoch: 33, train_loss: 0.8110, test_loss: 0.9096, test_f1: 0.5156
 epoch: 34, train_loss: 0.8094, test_loss: 0.7785, test_f1: 0.5645
 epoch: 35, train_loss: 0.7985, test_loss: 0.9119, test_f1: 0.5175
 epoch: 36, train_loss: 0.7931, test_loss: 0.8550, test_f1: 0.5425
 epoch: 37, train_loss: 0.8059, test_loss: 0.8452, test_f1: 0.5310
 epoch: 38, train_loss: 0.8009, test_loss: 0.8698, test_f1: 0.5353
 epoch: 39, train_loss: 0.7892, test_loss: 0.8879, test_f1: 0.5555
 epoch: 40, train_loss: 0.7881, test_loss: 0.8283, test_f1: 0.5615
 epoch: 41, train_loss: 0.7800, test_loss: 0.8537, test_f1: 0.5644
 epoch: 42, train_loss: 0.7893, test_loss: 0.9511, test_f1: 0.5017
 epoch: 43, train_loss: 0.7945, test_loss: 0.9680, test_f1: 0.5240
 epoch: 44, train_loss: 0.7823, test_loss: 0.8890, test_f1: 0.5399
 epoch: 45, train_loss: 0.7778, test_loss: 0.8586, test_f1: 0.5774
 epoch: 46, train_loss: 0.7960, test_loss: 0.8744, test_f1: 0.5310
 epoch: 47, train_loss: 0.7702, test_loss: 0.9262, test_f1: 0.5338
 epoch: 48, train_loss: 0.7799, test_loss: 0.8334, test_f1: 0.5633
 epoch: 49, train_loss: 0.7735, test_loss: 0.8729, test_f1: 0.5293
 epoch: 50, train_loss: 0.7840, test_loss: 1.0820, test_f1: 0.5159
 epoch: 51, train_loss: 0.7416, test_loss: 0.9048, test_f1: 0.5448
 epoch: 52, train_loss: 0.7442, test_loss: 0.8522, test_f1: 0.5313
 epoch: 53, train_loss: 0.7289, test_loss: 0.8312, test_f1: 0.5398
 epoch: 54, train_loss: 0.7243, test_loss: 0.8772, test_f1: 0.5655
 epoch: 55, train_loss: 0.7126, test_loss: 0.8529, test_f1: 0.5602
 epoch: 56, train_loss: 0.7401, test_loss: 0.8388, test_f1: 0.5477
 epoch: 57, train_loss: 0.7454, test_loss: 0.8600, test_f1: 0.5576
 epoch: 58, train_loss: 0.7387, test_loss: 0.8583, test_f1: 0.5722
 epoch: 59, train_loss: 0.7338, test_loss: 0.8768, test_f1: 0.5304
 epoch: 60, train_loss: 0.7443, test_loss: 0.8735, test_f1: 0.5684
 epoch: 61, train_loss: 0.7434, test_loss: 0.8550, test_f1: 0.5727
 epoch: 62, train_loss: 0.7322, test_loss: 0.8567, test_f1: 0.5560
 epoch: 63, train_loss: 0.7227, test_loss: 0.8376, test_f1: 0.5724
 epoch: 64, train_loss: 0.7170, test_loss: 0.8351, test_f1: 0.5515
 epoch: 65, train_loss: 0.7281, test_loss: 0.8964, test_f1: 0.5404
 epoch: 66, train_loss: 0.7114, test_loss: 0.8578, test_f1: 0.5343
 epoch: 67, train_loss: 0.7209, test_loss: 0.8230, test_f1: 0.5827
 epoch: 68, train_loss: 0.7211, test_loss: 0.9272, test_f1: 0.5530
 epoch: 69, train_loss: 0.7029, test_loss: 0.8994, test_f1: 0.5779
 epoch: 70, train_loss: 0.7073, test_loss: 0.8887, test_f1: 0.5606
 epoch: 71, train_loss: 0.7157, test_loss: 0.8627, test_f1: 0.5535
 epoch: 72, train_loss: 0.7202, test_loss: 0.8452, test_f1: 0.5575
 epoch: 73, train_loss: 0.7121, test_loss: 0.8711, test_f1: 0.5450
 epoch: 74, train_loss: 0.7035, test_loss: 0.9170, test_f1: 0.5502
 epoch: 75, train_loss: 0.7164, test_loss: 0.8973, test_f1: 0.5519
 epoch: 76, train_loss: 0.7049, test_loss: 0.8619, test_f1: 0.5985
 epoch: 77, train_loss: 0.7115, test_loss: 0.9160, test_f1: 0.5698
 epoch: 78, train_loss: 0.7150, test_loss: 0.8938, test_f1: 0.5838
 epoch: 79, train_loss: 0.7059, test_loss: 0.8595, test_f1: 0.5677
 epoch: 80, train_loss: 0.7043, test_loss: 0.9088, test_f1: 0.5700
 epoch: 81, train_loss: 0.7079, test_loss: 0.8996, test_f1: 0.5799
 epoch: 82, train_loss: 0.7154, test_loss: 0.8743, test_f1: 0.5544
 epoch: 83, train_loss: 0.6988, test_loss: 0.8737, test_f1: 0.5816
 epoch: 84, train_loss: 0.7058, test_loss: 0.8386, test_f1: 0.5425
 epoch: 85, train_loss: 0.7030, test_loss: 0.8862, test_f1: 0.5613
 epoch: 86, train_loss: 0.7011, test_loss: 0.9352, test_f1: 0.5687
 epoch: 87, train_loss: 0.6997, test_loss: 0.8437, test_f1: 0.5572
 epoch: 88, train_loss: 0.7077, test_loss: 0.8753, test_f1: 0.6200
 epoch: 89, train_loss: 0.6934, test_loss: 0.8990, test_f1: 0.5871
 epoch: 90, train_loss: 0.6875, test_loss: 0.9214, test_f1: 0.5360
 epoch: 91, train_loss: 0.6789, test_loss: 0.8520, test_f1: 0.5777
 epoch: 92, train_loss: 0.6774, test_loss: 0.9057, test_f1: 0.5862
 epoch: 93, train_loss: 0.7027, test_loss: 0.8825, test_f1: 0.5590
 epoch: 94, train_loss: 0.7004, test_loss: 0.9257, test_f1: 0.6255
 epoch: 95, train_loss: 0.6914, test_loss: 0.9236, test_f1: 0.5909
 epoch: 96, train_loss: 0.6940, test_loss: 0.8616, test_f1: 0.5997
 epoch: 97, train_loss: 0.6843, test_loss: 0.9504, test_f1: 0.5673
 epoch: 98, train_loss: 0.6809, test_loss: 0.9492, test_f1: 0.6273
 epoch: 99, train_loss: 0.6815, test_loss: 0.9030, test_f1: 0.5501
##################ITERATION #4 ****************************************
 epoch: 0, train_loss: 1.2198, test_loss: 1.1089, test_f1: 0.3545
 epoch: 1, train_loss: 1.0220, test_loss: 1.0627, test_f1: 0.4473
 epoch: 2, train_loss: 0.9912, test_loss: 0.9589, test_f1: 0.4870
 epoch: 3, train_loss: 0.9721, test_loss: 1.1054, test_f1: 0.4714
 epoch: 4, train_loss: 0.9659, test_loss: 1.2070, test_f1: 0.4122
 epoch: 5, train_loss: 0.9371, test_loss: 1.4878, test_f1: 0.3825
 epoch: 6, train_loss: 0.9401, test_loss: 0.9468, test_f1: 0.5413
 epoch: 7, train_loss: 0.9047, test_loss: 1.1337, test_f1: 0.4563
 epoch: 8, train_loss: 0.8834, test_loss: 0.9729, test_f1: 0.5164
 epoch: 9, train_loss: 0.8903, test_loss: 0.9416, test_f1: 0.5185
 epoch: 10, train_loss: 0.8853, test_loss: 1.0762, test_f1: 0.5040
 epoch: 11, train_loss: 0.8861, test_loss: 0.9867, test_f1: 0.5605
 epoch: 12, train_loss: 0.8744, test_loss: 0.9102, test_f1: 0.5406
 epoch: 13, train_loss: 0.8601, test_loss: 0.9284, test_f1: 0.5449
 epoch: 14, train_loss: 0.8581, test_loss: 1.2624, test_f1: 0.4222
 epoch: 15, train_loss: 0.8330, test_loss: 0.8998, test_f1: 0.5481
 epoch: 16, train_loss: 0.8439, test_loss: 1.1261, test_f1: 0.4678
 epoch: 17, train_loss: 0.8368, test_loss: 0.8894, test_f1: 0.5419
 epoch: 18, train_loss: 0.8305, test_loss: 0.8828, test_f1: 0.5843
 epoch: 19, train_loss: 0.8158, test_loss: 0.9144, test_f1: 0.5090
 epoch: 20, train_loss: 0.8193, test_loss: 0.9848, test_f1: 0.5407
 epoch: 21, train_loss: 0.8177, test_loss: 0.9663, test_f1: 0.5396
 epoch: 22, train_loss: 0.8397, test_loss: 1.0611, test_f1: 0.4799
 epoch: 23, train_loss: 0.8160, test_loss: 0.9858, test_f1: 0.5229
 epoch: 24, train_loss: 0.8036, test_loss: 0.9673, test_f1: 0.5322
 epoch: 25, train_loss: 0.7883, test_loss: 0.8840, test_f1: 0.5822
 epoch: 26, train_loss: 0.7954, test_loss: 1.1725, test_f1: 0.4378
 epoch: 27, train_loss: 0.7866, test_loss: 0.9655, test_f1: 0.4962
 epoch: 28, train_loss: 0.7850, test_loss: 0.9104, test_f1: 0.5501
 epoch: 29, train_loss: 0.8030, test_loss: 0.9258, test_f1: 0.5457
 epoch: 30, train_loss: 0.8054, test_loss: 1.2186, test_f1: 0.4788
 epoch: 31, train_loss: 0.8278, test_loss: 1.1368, test_f1: 0.4640
 epoch: 32, train_loss: 0.7990, test_loss: 0.9070, test_f1: 0.5541
 epoch: 33, train_loss: 0.7737, test_loss: 0.8828, test_f1: 0.5712
 epoch: 34, train_loss: 0.7656, test_loss: 1.2165, test_f1: 0.5193
 epoch: 35, train_loss: 0.7851, test_loss: 1.0152, test_f1: 0.5811
 epoch: 36, train_loss: 0.7767, test_loss: 1.8266, test_f1: 0.3851
 epoch: 37, train_loss: 0.7587, test_loss: 0.8723, test_f1: 0.5664
 epoch: 38, train_loss: 0.7684, test_loss: 0.9238, test_f1: 0.5340
 epoch: 39, train_loss: 0.7546, test_loss: 0.8861, test_f1: 0.5639
 epoch: 40, train_loss: 0.7532, test_loss: 1.0436, test_f1: 0.5461
 epoch: 41, train_loss: 0.7574, test_loss: 1.0514, test_f1: 0.5608
 epoch: 42, train_loss: 0.7436, test_loss: 0.9977, test_f1: 0.5324
 epoch: 43, train_loss: 0.7527, test_loss: 1.0656, test_f1: 0.5318
 epoch: 44, train_loss: 0.7555, test_loss: 0.8988, test_f1: 0.5879
 epoch: 45, train_loss: 0.7619, test_loss: 0.8992, test_f1: 0.5773
 epoch: 46, train_loss: 0.7447, test_loss: 0.8614, test_f1: 0.5731
 epoch: 47, train_loss: 0.7300, test_loss: 0.8930, test_f1: 0.5930
 epoch: 48, train_loss: 0.7652, test_loss: 1.1991, test_f1: 0.4466
 epoch: 49, train_loss: 0.7292, test_loss: 0.9042, test_f1: 0.6107
 epoch: 50, train_loss: 0.7613, test_loss: 1.0358, test_f1: 0.5793
 epoch: 51, train_loss: 0.7273, test_loss: 0.9465, test_f1: 0.5410
 epoch: 52, train_loss: 0.7014, test_loss: 0.9997, test_f1: 0.5620
 epoch: 53, train_loss: 0.7037, test_loss: 0.9142, test_f1: 0.5899
 epoch: 54, train_loss: 0.7072, test_loss: 0.9549, test_f1: 0.5554
 epoch: 55, train_loss: 0.6800, test_loss: 0.8901, test_f1: 0.6049
 epoch: 56, train_loss: 0.6800, test_loss: 1.0170, test_f1: 0.5824
 epoch: 57, train_loss: 0.6908, test_loss: 0.8765, test_f1: 0.5831
 epoch: 58, train_loss: 0.6900, test_loss: 0.9424, test_f1: 0.5962
 epoch: 59, train_loss: 0.7136, test_loss: 0.9355, test_f1: 0.6027
 epoch: 60, train_loss: 0.6870, test_loss: 0.9205, test_f1: 0.6049
 epoch: 61, train_loss: 0.6807, test_loss: 0.8705, test_f1: 0.6240
 epoch: 62, train_loss: 0.6839, test_loss: 0.8893, test_f1: 0.5812
 epoch: 63, train_loss: 0.6869, test_loss: 0.9017, test_f1: 0.5966
 epoch: 64, train_loss: 0.6701, test_loss: 0.9463, test_f1: 0.5755
 epoch: 65, train_loss: 0.6792, test_loss: 1.0184, test_f1: 0.5529
 epoch: 66, train_loss: 0.6845, test_loss: 0.8934, test_f1: 0.5851
 epoch: 67, train_loss: 0.6726, test_loss: 0.9546, test_f1: 0.5882
 epoch: 68, train_loss: 0.6690, test_loss: 0.9715, test_f1: 0.6111
 epoch: 69, train_loss: 0.6727, test_loss: 0.9023, test_f1: 0.5968
 epoch: 70, train_loss: 0.6701, test_loss: 0.9232, test_f1: 0.6233
 epoch: 71, train_loss: 0.6672, test_loss: 1.0070, test_f1: 0.5841
 epoch: 72, train_loss: 0.6609, test_loss: 0.9768, test_f1: 0.6042
 epoch: 73, train_loss: 0.6488, test_loss: 1.1589, test_f1: 0.6003
 epoch: 74, train_loss: 0.6676, test_loss: 0.9151, test_f1: 0.6307
 epoch: 75, train_loss: 0.6622, test_loss: 0.9816, test_f1: 0.5715
 epoch: 76, train_loss: 0.6676, test_loss: 0.9856, test_f1: 0.6218
 epoch: 77, train_loss: 0.6507, test_loss: 1.0482, test_f1: 0.6103
 epoch: 78, train_loss: 0.6432, test_loss: 1.1790, test_f1: 0.5693
 epoch: 79, train_loss: 0.6524, test_loss: 0.9571, test_f1: 0.5772
 epoch: 80, train_loss: 0.6541, test_loss: 0.9750, test_f1: 0.6111
 epoch: 81, train_loss: 0.6596, test_loss: 0.9252, test_f1: 0.6162
 epoch: 82, train_loss: 0.6560, test_loss: 1.0511, test_f1: 0.5869
 epoch: 83, train_loss: 0.6574, test_loss: 1.1047, test_f1: 0.5838
 epoch: 84, train_loss: 0.6685, test_loss: 1.2932, test_f1: 0.5377
 epoch: 85, train_loss: 0.6670, test_loss: 1.1616, test_f1: 0.5839
 epoch: 86, train_loss: 0.6452, test_loss: 1.1192, test_f1: 0.5985
 epoch: 87, train_loss: 0.6379, test_loss: 0.9740, test_f1: 0.6374
 epoch: 88, train_loss: 0.6439, test_loss: 0.9211, test_f1: 0.5716
 epoch: 89, train_loss: 0.6539, test_loss: 1.3197, test_f1: 0.5656
 epoch: 90, train_loss: 0.6349, test_loss: 1.0558, test_f1: 0.6189
 epoch: 91, train_loss: 0.6484, test_loss: 0.9428, test_f1: 0.6047
 epoch: 92, train_loss: 0.6406, test_loss: 1.1386, test_f1: 0.5877
 epoch: 93, train_loss: 0.6368, test_loss: 1.0558, test_f1: 0.6075
 epoch: 94, train_loss: 0.6396, test_loss: 1.0140, test_f1: 0.6058
 epoch: 95, train_loss: 0.6375, test_loss: 1.2666, test_f1: 0.6007
 epoch: 96, train_loss: 0.6474, test_loss: 1.1045, test_f1: 0.5635
 epoch: 97, train_loss: 0.6566, test_loss: 0.9648, test_f1: 0.6299
 epoch: 98, train_loss: 0.6324, test_loss: 0.9804, test_f1: 0.5869
 epoch: 99, train_loss: 0.6454, test_loss: 1.2402, test_f1: 0.5735
##################ITERATION #5 ****************************************
 epoch: 0, train_loss: 1.2135, test_loss: 1.0816, test_f1: 0.3930
 epoch: 1, train_loss: 1.0454, test_loss: 1.1210, test_f1: 0.3317
 epoch: 2, train_loss: 1.0152, test_loss: 1.2206, test_f1: 0.3824
 epoch: 3, train_loss: 1.0000, test_loss: 1.0481, test_f1: 0.4583
 epoch: 4, train_loss: 0.9685, test_loss: 0.9930, test_f1: 0.4874
 epoch: 5, train_loss: 0.9485, test_loss: 0.9917, test_f1: 0.4629
 epoch: 6, train_loss: 0.9486, test_loss: 1.0873, test_f1: 0.4617
 epoch: 7, train_loss: 0.9352, test_loss: 1.0315, test_f1: 0.4306
 epoch: 8, train_loss: 0.9064, test_loss: 0.9166, test_f1: 0.5246
 epoch: 9, train_loss: 0.9039, test_loss: 0.9661, test_f1: 0.5066
 epoch: 10, train_loss: 0.8895, test_loss: 1.1264, test_f1: 0.4508
 epoch: 11, train_loss: 0.8850, test_loss: 0.8548, test_f1: 0.5450
 epoch: 12, train_loss: 0.8960, test_loss: 1.0365, test_f1: 0.4810
 epoch: 13, train_loss: 0.8696, test_loss: 0.9769, test_f1: 0.4646
 epoch: 14, train_loss: 0.8553, test_loss: 0.9637, test_f1: 0.5155
 epoch: 15, train_loss: 0.8569, test_loss: 0.9037, test_f1: 0.5008
 epoch: 16, train_loss: 0.8466, test_loss: 0.8759, test_f1: 0.5274
 epoch: 17, train_loss: 0.8626, test_loss: 0.9113, test_f1: 0.5752
 epoch: 18, train_loss: 0.8604, test_loss: 0.9434, test_f1: 0.5129
 epoch: 19, train_loss: 0.8405, test_loss: 0.9112, test_f1: 0.5331
 epoch: 20, train_loss: 0.8409, test_loss: 0.9038, test_f1: 0.5328
 epoch: 21, train_loss: 0.8326, test_loss: 0.8961, test_f1: 0.5437
 epoch: 22, train_loss: 0.8338, test_loss: 1.0174, test_f1: 0.4677
 epoch: 23, train_loss: 0.8357, test_loss: 1.0668, test_f1: 0.4176
 epoch: 24, train_loss: 0.8231, test_loss: 0.9622, test_f1: 0.5131
 epoch: 25, train_loss: 0.8326, test_loss: 0.9844, test_f1: 0.4929
 epoch: 26, train_loss: 0.8204, test_loss: 1.0031, test_f1: 0.4901
 epoch: 27, train_loss: 0.8127, test_loss: 0.9650, test_f1: 0.5428
 epoch: 28, train_loss: 0.8146, test_loss: 0.8610, test_f1: 0.5426
 epoch: 29, train_loss: 0.8071, test_loss: 0.9108, test_f1: 0.5136
 epoch: 30, train_loss: 0.8003, test_loss: 0.9405, test_f1: 0.4829
 epoch: 31, train_loss: 0.7980, test_loss: 0.8811, test_f1: 0.5462
 epoch: 32, train_loss: 0.7841, test_loss: 0.8741, test_f1: 0.5456
 epoch: 33, train_loss: 0.8148, test_loss: 0.9456, test_f1: 0.4834
 epoch: 34, train_loss: 0.7871, test_loss: 0.8817, test_f1: 0.5333
 epoch: 35, train_loss: 0.7814, test_loss: 0.9805, test_f1: 0.5006
 epoch: 36, train_loss: 0.7979, test_loss: 1.0445, test_f1: 0.4607
 epoch: 37, train_loss: 0.7869, test_loss: 0.9219, test_f1: 0.5156
 epoch: 38, train_loss: 0.7805, test_loss: 0.9097, test_f1: 0.5269
 epoch: 39, train_loss: 0.7883, test_loss: 0.9042, test_f1: 0.5750
 epoch: 40, train_loss: 0.7926, test_loss: 0.9250, test_f1: 0.5413
 epoch: 41, train_loss: 0.7802, test_loss: 0.8812, test_f1: 0.5190
 epoch: 42, train_loss: 0.7825, test_loss: 0.9108, test_f1: 0.5041
 epoch: 43, train_loss: 0.7706, test_loss: 0.9037, test_f1: 0.5290
 epoch: 44, train_loss: 0.7647, test_loss: 0.9405, test_f1: 0.5315
 epoch: 45, train_loss: 0.7548, test_loss: 1.0068, test_f1: 0.5244
 epoch: 46, train_loss: 0.7644, test_loss: 1.0778, test_f1: 0.4679
 epoch: 47, train_loss: 0.7707, test_loss: 0.8708, test_f1: 0.5568
 epoch: 48, train_loss: 0.7603, test_loss: 0.9151, test_f1: 0.5499
 epoch: 49, train_loss: 0.7650, test_loss: 0.9013, test_f1: 0.5667
 epoch: 50, train_loss: 0.7483, test_loss: 0.8608, test_f1: 0.5656
 epoch: 51, train_loss: 0.7376, test_loss: 0.9235, test_f1: 0.5401
 epoch: 52, train_loss: 0.7394, test_loss: 0.8647, test_f1: 0.5589
 epoch: 53, train_loss: 0.7309, test_loss: 0.8731, test_f1: 0.5554
 epoch: 54, train_loss: 0.7253, test_loss: 0.9552, test_f1: 0.5045
 epoch: 55, train_loss: 0.7353, test_loss: 0.9433, test_f1: 0.5843
 epoch: 56, train_loss: 0.7355, test_loss: 0.9129, test_f1: 0.5358
 epoch: 57, train_loss: 0.7267, test_loss: 0.8755, test_f1: 0.5506
 epoch: 58, train_loss: 0.7188, test_loss: 0.9112, test_f1: 0.5534
 epoch: 59, train_loss: 0.7152, test_loss: 0.8738, test_f1: 0.5539
 epoch: 60, train_loss: 0.7193, test_loss: 0.8675, test_f1: 0.5657
 epoch: 61, train_loss: 0.7155, test_loss: 0.9294, test_f1: 0.5139
 epoch: 62, train_loss: 0.7195, test_loss: 0.9061, test_f1: 0.5346
 epoch: 63, train_loss: 0.7211, test_loss: 0.8504, test_f1: 0.5869
 epoch: 64, train_loss: 0.7176, test_loss: 0.9013, test_f1: 0.5303
 epoch: 65, train_loss: 0.7082, test_loss: 0.9416, test_f1: 0.5192
 epoch: 66, train_loss: 0.7098, test_loss: 0.9430, test_f1: 0.5570
 epoch: 67, train_loss: 0.7072, test_loss: 0.9706, test_f1: 0.5191
 epoch: 68, train_loss: 0.7178, test_loss: 0.8713, test_f1: 0.5871
 epoch: 69, train_loss: 0.7055, test_loss: 0.9434, test_f1: 0.5103
 epoch: 70, train_loss: 0.7245, test_loss: 0.8893, test_f1: 0.5411
 epoch: 71, train_loss: 0.7190, test_loss: 0.9430, test_f1: 0.5105
 epoch: 72, train_loss: 0.7147, test_loss: 0.9558, test_f1: 0.5390
 epoch: 73, train_loss: 0.7163, test_loss: 0.9338, test_f1: 0.5220
 epoch: 74, train_loss: 0.7038, test_loss: 0.9074, test_f1: 0.5530
 epoch: 75, train_loss: 0.6960, test_loss: 0.9058, test_f1: 0.5642
 epoch: 76, train_loss: 0.7020, test_loss: 0.9574, test_f1: 0.5350
 epoch: 77, train_loss: 0.7080, test_loss: 1.0053, test_f1: 0.5167
 epoch: 78, train_loss: 0.7032, test_loss: 0.9815, test_f1: 0.5135
 epoch: 79, train_loss: 0.7081, test_loss: 0.9172, test_f1: 0.5529
 epoch: 80, train_loss: 0.7169, test_loss: 0.8886, test_f1: 0.5713
 epoch: 81, train_loss: 0.7031, test_loss: 0.9452, test_f1: 0.5179
 epoch: 82, train_loss: 0.6936, test_loss: 0.9028, test_f1: 0.5738
 epoch: 83, train_loss: 0.7034, test_loss: 0.9298, test_f1: 0.5611
 epoch: 84, train_loss: 0.7043, test_loss: 0.9280, test_f1: 0.5556
 epoch: 85, train_loss: 0.7066, test_loss: 0.9119, test_f1: 0.5503
 epoch: 86, train_loss: 0.7015, test_loss: 0.9327, test_f1: 0.5541
 epoch: 87, train_loss: 0.6933, test_loss: 1.0293, test_f1: 0.5061
 epoch: 88, train_loss: 0.7075, test_loss: 0.9257, test_f1: 0.6164
 epoch: 89, train_loss: 0.7120, test_loss: 0.9712, test_f1: 0.5175
 epoch: 90, train_loss: 0.6923, test_loss: 0.8903, test_f1: 0.5913
 epoch: 91, train_loss: 0.6932, test_loss: 0.8716, test_f1: 0.6036
 epoch: 92, train_loss: 0.7053, test_loss: 0.9390, test_f1: 0.5444
 epoch: 93, train_loss: 0.6837, test_loss: 0.9202, test_f1: 0.5325
 epoch: 94, train_loss: 0.6730, test_loss: 0.8971, test_f1: 0.5528
 epoch: 95, train_loss: 0.6807, test_loss: 0.9065, test_f1: 0.5649
 epoch: 96, train_loss: 0.6943, test_loss: 0.9216, test_f1: 0.5470
 epoch: 97, train_loss: 0.6767, test_loss: 0.9631, test_f1: 0.5388
 epoch: 98, train_loss: 0.6731, test_loss: 0.8936, test_f1: 0.5606
 epoch: 99, train_loss: 0.6735, test_loss: 0.8834, test_f1: 0.5706
##################ITERATION #6 ****************************************
 epoch: 0, train_loss: 1.2024, test_loss: 1.1892, test_f1: 0.3105
 epoch: 1, train_loss: 1.0488, test_loss: 1.0926, test_f1: 0.4137
 epoch: 2, train_loss: 1.0100, test_loss: 0.9776, test_f1: 0.5341
 epoch: 3, train_loss: 0.9846, test_loss: 1.0276, test_f1: 0.5286
 epoch: 4, train_loss: 0.9649, test_loss: 1.0065, test_f1: 0.4988
 epoch: 5, train_loss: 0.9499, test_loss: 0.9749, test_f1: 0.5484
 epoch: 6, train_loss: 0.9329, test_loss: 1.0587, test_f1: 0.4823
 epoch: 7, train_loss: 0.9027, test_loss: 0.9350, test_f1: 0.5372
 epoch: 8, train_loss: 0.8967, test_loss: 0.9408, test_f1: 0.5183
 epoch: 9, train_loss: 0.8982, test_loss: 0.9674, test_f1: 0.5749
 epoch: 10, train_loss: 0.8884, test_loss: 0.9164, test_f1: 0.5374
 epoch: 11, train_loss: 0.8951, test_loss: 0.9739, test_f1: 0.5016
 epoch: 12, train_loss: 0.8692, test_loss: 1.0284, test_f1: 0.4768
 epoch: 13, train_loss: 0.8693, test_loss: 0.8949, test_f1: 0.5706
 epoch: 14, train_loss: 0.8426, test_loss: 0.9708, test_f1: 0.5054
 epoch: 15, train_loss: 0.8424, test_loss: 0.9140, test_f1: 0.5184
 epoch: 16, train_loss: 0.8486, test_loss: 0.8764, test_f1: 0.5063
 epoch: 17, train_loss: 0.8326, test_loss: 1.2534, test_f1: 0.4192
 epoch: 18, train_loss: 0.8119, test_loss: 0.9334, test_f1: 0.5498
 epoch: 19, train_loss: 0.8436, test_loss: 1.0935, test_f1: 0.4760
 epoch: 20, train_loss: 0.8196, test_loss: 0.9025, test_f1: 0.5973
 epoch: 21, train_loss: 0.8255, test_loss: 0.9358, test_f1: 0.5213
 epoch: 22, train_loss: 0.8455, test_loss: 0.9634, test_f1: 0.5006
 epoch: 23, train_loss: 0.8273, test_loss: 0.8634, test_f1: 0.5481
 epoch: 24, train_loss: 0.8059, test_loss: 0.8436, test_f1: 0.5895
 epoch: 25, train_loss: 0.8033, test_loss: 0.8703, test_f1: 0.5540
 epoch: 26, train_loss: 0.8089, test_loss: 0.9885, test_f1: 0.5370
 epoch: 27, train_loss: 0.8007, test_loss: 0.8535, test_f1: 0.5719
 epoch: 28, train_loss: 0.8060, test_loss: 1.0326, test_f1: 0.5284
 epoch: 29, train_loss: 0.8015, test_loss: 1.0549, test_f1: 0.4855
 epoch: 30, train_loss: 0.7908, test_loss: 0.9222, test_f1: 0.5209
 epoch: 31, train_loss: 0.8070, test_loss: 0.8276, test_f1: 0.5449
 epoch: 32, train_loss: 0.7895, test_loss: 0.8852, test_f1: 0.5403
 epoch: 33, train_loss: 0.7821, test_loss: 0.8649, test_f1: 0.5898
 epoch: 34, train_loss: 0.7901, test_loss: 0.8788, test_f1: 0.5217
 epoch: 35, train_loss: 0.7851, test_loss: 1.7007, test_f1: 0.3773
 epoch: 36, train_loss: 0.7839, test_loss: 0.9067, test_f1: 0.5366
 epoch: 37, train_loss: 0.7837, test_loss: 0.9161, test_f1: 0.5324
 epoch: 38, train_loss: 0.7719, test_loss: 0.9832, test_f1: 0.5436
 epoch: 39, train_loss: 0.7712, test_loss: 1.1053, test_f1: 0.4976
 epoch: 40, train_loss: 0.7873, test_loss: 0.8911, test_f1: 0.5406
 epoch: 41, train_loss: 0.7698, test_loss: 0.9904, test_f1: 0.5690
 epoch: 42, train_loss: 0.7842, test_loss: 0.8634, test_f1: 0.6101
 epoch: 43, train_loss: 0.7731, test_loss: 0.8550, test_f1: 0.5864
 epoch: 44, train_loss: 0.7758, test_loss: 1.1710, test_f1: 0.4903
 epoch: 45, train_loss: 0.7520, test_loss: 0.8151, test_f1: 0.5968
 epoch: 46, train_loss: 0.7518, test_loss: 1.2919, test_f1: 0.4677
 epoch: 47, train_loss: 0.7577, test_loss: 0.9953, test_f1: 0.5282
 epoch: 48, train_loss: 0.7603, test_loss: 0.9177, test_f1: 0.6239
 epoch: 49, train_loss: 0.7552, test_loss: 0.8940, test_f1: 0.6146
 epoch: 50, train_loss: 0.7541, test_loss: 1.0240, test_f1: 0.5819
 epoch: 51, train_loss: 0.7416, test_loss: 0.8746, test_f1: 0.6001
 epoch: 52, train_loss: 0.7223, test_loss: 0.9397, test_f1: 0.5864
 epoch: 53, train_loss: 0.7171, test_loss: 0.9530, test_f1: 0.5950
 epoch: 54, train_loss: 0.7337, test_loss: 0.9463, test_f1: 0.6128
 epoch: 55, train_loss: 0.6993, test_loss: 0.9972, test_f1: 0.6010
 epoch: 56, train_loss: 0.7095, test_loss: 0.8991, test_f1: 0.6277
 epoch: 57, train_loss: 0.7116, test_loss: 0.9102, test_f1: 0.5950
 epoch: 58, train_loss: 0.7235, test_loss: 0.9192, test_f1: 0.5773
 epoch: 59, train_loss: 0.7213, test_loss: 0.8896, test_f1: 0.6456
 epoch: 60, train_loss: 0.6851, test_loss: 0.9147, test_f1: 0.6223
 epoch: 61, train_loss: 0.6910, test_loss: 0.9029, test_f1: 0.6245
 epoch: 62, train_loss: 0.6955, test_loss: 0.9508, test_f1: 0.5809
 epoch: 63, train_loss: 0.6871, test_loss: 0.9806, test_f1: 0.5876
 epoch: 64, train_loss: 0.6864, test_loss: 0.8951, test_f1: 0.6179
 epoch: 65, train_loss: 0.7019, test_loss: 0.8474, test_f1: 0.6273
 epoch: 66, train_loss: 0.6992, test_loss: 1.4020, test_f1: 0.5016
 epoch: 67, train_loss: 0.7013, test_loss: 0.9140, test_f1: 0.5899
 epoch: 68, train_loss: 0.6851, test_loss: 0.9523, test_f1: 0.5822
 epoch: 69, train_loss: 0.7030, test_loss: 0.9209, test_f1: 0.6331
 epoch: 70, train_loss: 0.7016, test_loss: 0.9074, test_f1: 0.6130
 epoch: 71, train_loss: 0.6769, test_loss: 0.9398, test_f1: 0.6169
 epoch: 72, train_loss: 0.6800, test_loss: 0.9636, test_f1: 0.5493
 epoch: 73, train_loss: 0.6819, test_loss: 0.9848, test_f1: 0.5864
 epoch: 74, train_loss: 0.6966, test_loss: 0.9116, test_f1: 0.6323
 epoch: 75, train_loss: 0.6782, test_loss: 0.9417, test_f1: 0.6009
 epoch: 76, train_loss: 0.6708, test_loss: 0.9027, test_f1: 0.6257
 epoch: 77, train_loss: 0.6858, test_loss: 0.8950, test_f1: 0.6364
 epoch: 78, train_loss: 0.6680, test_loss: 0.9078, test_f1: 0.6476
 epoch: 79, train_loss: 0.6864, test_loss: 0.9972, test_f1: 0.5874
 epoch: 80, train_loss: 0.6925, test_loss: 1.0097, test_f1: 0.5610
 epoch: 81, train_loss: 0.6833, test_loss: 1.0050, test_f1: 0.5664
 epoch: 82, train_loss: 0.6799, test_loss: 0.9954, test_f1: 0.5884
 epoch: 83, train_loss: 0.6809, test_loss: 0.9886, test_f1: 0.6195
 epoch: 84, train_loss: 0.6757, test_loss: 0.8579, test_f1: 0.6119
 epoch: 85, train_loss: 0.6779, test_loss: 1.0130, test_f1: 0.5922
 epoch: 86, train_loss: 0.6588, test_loss: 0.9395, test_f1: 0.6119
 epoch: 87, train_loss: 0.6670, test_loss: 0.9107, test_f1: 0.6246
 epoch: 88, train_loss: 0.6709, test_loss: 0.9252, test_f1: 0.6213
 epoch: 89, train_loss: 0.6870, test_loss: 0.9341, test_f1: 0.6177
 epoch: 90, train_loss: 0.6712, test_loss: 0.9946, test_f1: 0.6195
 epoch: 91, train_loss: 0.6769, test_loss: 0.9006, test_f1: 0.6415
 epoch: 92, train_loss: 0.6784, test_loss: 0.9120, test_f1: 0.6116
 epoch: 93, train_loss: 0.6820, test_loss: 0.8795, test_f1: 0.6451
 epoch: 94, train_loss: 0.6630, test_loss: 0.9116, test_f1: 0.6397
 epoch: 95, train_loss: 0.6730, test_loss: 0.9412, test_f1: 0.6231
 epoch: 96, train_loss: 0.6739, test_loss: 1.0112, test_f1: 0.6000
 epoch: 97, train_loss: 0.6845, test_loss: 1.0039, test_f1: 0.5911
 epoch: 98, train_loss: 0.6774, test_loss: 0.9098, test_f1: 0.6427
 epoch: 99, train_loss: 0.6585, test_loss: 0.8754, test_f1: 0.6780
##################ITERATION #7 ****************************************
 epoch: 0, train_loss: 1.2011, test_loss: 1.1344, test_f1: 0.3140
 epoch: 1, train_loss: 1.0430, test_loss: 1.1254, test_f1: 0.4024
 epoch: 2, train_loss: 1.0191, test_loss: 1.0764, test_f1: 0.5015
 epoch: 3, train_loss: 1.0097, test_loss: 1.0163, test_f1: 0.5514
 epoch: 4, train_loss: 0.9734, test_loss: 0.9908, test_f1: 0.4985
 epoch: 5, train_loss: 0.9403, test_loss: 0.9906, test_f1: 0.5124
 epoch: 6, train_loss: 0.9320, test_loss: 1.0031, test_f1: 0.5254
 epoch: 7, train_loss: 0.9137, test_loss: 0.9940, test_f1: 0.4948
 epoch: 8, train_loss: 0.9012, test_loss: 0.9459, test_f1: 0.5203
 epoch: 9, train_loss: 0.8996, test_loss: 1.0473, test_f1: 0.4640
 epoch: 10, train_loss: 0.8868, test_loss: 0.9978, test_f1: 0.5349
 epoch: 11, train_loss: 0.8799, test_loss: 0.9668, test_f1: 0.5091
 epoch: 12, train_loss: 0.8570, test_loss: 0.9344, test_f1: 0.5446
 epoch: 13, train_loss: 0.8522, test_loss: 0.9333, test_f1: 0.5467
 epoch: 14, train_loss: 0.8502, test_loss: 0.9259, test_f1: 0.5374
 epoch: 15, train_loss: 0.8331, test_loss: 0.9632, test_f1: 0.5827
 epoch: 16, train_loss: 0.8461, test_loss: 1.0628, test_f1: 0.4631
 epoch: 17, train_loss: 0.8586, test_loss: 1.0251, test_f1: 0.4465
 epoch: 18, train_loss: 0.8232, test_loss: 0.8793, test_f1: 0.5552
 epoch: 19, train_loss: 0.8154, test_loss: 0.8891, test_f1: 0.5331
 epoch: 20, train_loss: 0.8102, test_loss: 0.8822, test_f1: 0.5490
 epoch: 21, train_loss: 0.8105, test_loss: 0.9232, test_f1: 0.5190
 epoch: 22, train_loss: 0.8078, test_loss: 0.9758, test_f1: 0.4622
 epoch: 23, train_loss: 0.8179, test_loss: 0.9890, test_f1: 0.4980
 epoch: 24, train_loss: 0.7975, test_loss: 0.8875, test_f1: 0.5862
 epoch: 25, train_loss: 0.7872, test_loss: 0.9546, test_f1: 0.5127
 epoch: 26, train_loss: 0.7850, test_loss: 0.8934, test_f1: 0.5590
 epoch: 27, train_loss: 0.7889, test_loss: 0.8757, test_f1: 0.5480
 epoch: 28, train_loss: 0.8159, test_loss: 0.8831, test_f1: 0.5582
 epoch: 29, train_loss: 0.7723, test_loss: 0.9571, test_f1: 0.5729
 epoch: 30, train_loss: 0.8037, test_loss: 0.9457, test_f1: 0.5188
 epoch: 31, train_loss: 0.7869, test_loss: 0.8891, test_f1: 0.5371
 epoch: 32, train_loss: 0.7682, test_loss: 0.8984, test_f1: 0.5373
 epoch: 33, train_loss: 0.7604, test_loss: 0.8597, test_f1: 0.6103
 epoch: 34, train_loss: 0.7504, test_loss: 1.0033, test_f1: 0.5405
 epoch: 35, train_loss: 0.7423, test_loss: 0.9231, test_f1: 0.5223
 epoch: 36, train_loss: 0.7785, test_loss: 0.9143, test_f1: 0.5435
 epoch: 37, train_loss: 0.7513, test_loss: 0.8790, test_f1: 0.5487
 epoch: 38, train_loss: 0.7464, test_loss: 0.9120, test_f1: 0.5438
 epoch: 39, train_loss: 0.7421, test_loss: 0.8985, test_f1: 0.5410
 epoch: 40, train_loss: 0.7514, test_loss: 0.9152, test_f1: 0.5074
 epoch: 41, train_loss: 0.7492, test_loss: 0.8835, test_f1: 0.5465
 epoch: 42, train_loss: 0.7499, test_loss: 0.9152, test_f1: 0.5467
 epoch: 43, train_loss: 0.7401, test_loss: 0.9103, test_f1: 0.5183
 epoch: 44, train_loss: 0.7533, test_loss: 0.9222, test_f1: 0.5701
 epoch: 45, train_loss: 0.7446, test_loss: 0.9185, test_f1: 0.5090
 epoch: 46, train_loss: 0.7394, test_loss: 0.8875, test_f1: 0.5666
 epoch: 47, train_loss: 0.7511, test_loss: 0.8627, test_f1: 0.5641
 epoch: 48, train_loss: 0.7239, test_loss: 0.8882, test_f1: 0.5793
 epoch: 49, train_loss: 0.7272, test_loss: 0.9943, test_f1: 0.5201
 epoch: 50, train_loss: 0.7319, test_loss: 0.8675, test_f1: 0.5975
 epoch: 51, train_loss: 0.6998, test_loss: 0.8616, test_f1: 0.5641
 epoch: 52, train_loss: 0.6823, test_loss: 0.9314, test_f1: 0.5504
 epoch: 53, train_loss: 0.6970, test_loss: 0.8823, test_f1: 0.5509
 epoch: 54, train_loss: 0.6810, test_loss: 0.8596, test_f1: 0.5725
 epoch: 55, train_loss: 0.6933, test_loss: 0.8928, test_f1: 0.6066
 epoch: 56, train_loss: 0.6777, test_loss: 0.8837, test_f1: 0.5967
 epoch: 57, train_loss: 0.6878, test_loss: 0.8756, test_f1: 0.5690
 epoch: 58, train_loss: 0.6860, test_loss: 0.8768, test_f1: 0.5999
 epoch: 59, train_loss: 0.6739, test_loss: 0.8769, test_f1: 0.5579
 epoch: 60, train_loss: 0.6713, test_loss: 0.9321, test_f1: 0.5701
 epoch: 61, train_loss: 0.6774, test_loss: 0.9124, test_f1: 0.5369
 epoch: 62, train_loss: 0.6890, test_loss: 0.8876, test_f1: 0.5897
 epoch: 63, train_loss: 0.6777, test_loss: 0.8830, test_f1: 0.5840
 epoch: 64, train_loss: 0.6794, test_loss: 0.9160, test_f1: 0.5303
 epoch: 65, train_loss: 0.6805, test_loss: 0.8796, test_f1: 0.5853
 epoch: 66, train_loss: 0.6750, test_loss: 0.8939, test_f1: 0.5906
 epoch: 67, train_loss: 0.6819, test_loss: 0.8915, test_f1: 0.5818
 epoch: 68, train_loss: 0.6830, test_loss: 0.9180, test_f1: 0.5836
 epoch: 69, train_loss: 0.6850, test_loss: 0.9507, test_f1: 0.5387
 epoch: 70, train_loss: 0.6645, test_loss: 0.9506, test_f1: 0.5807
 epoch: 71, train_loss: 0.6788, test_loss: 0.9531, test_f1: 0.5183
 epoch: 72, train_loss: 0.6701, test_loss: 0.9284, test_f1: 0.5657
 epoch: 73, train_loss: 0.6619, test_loss: 0.8930, test_f1: 0.5966
 epoch: 74, train_loss: 0.6659, test_loss: 0.8921, test_f1: 0.5816
 epoch: 75, train_loss: 0.6527, test_loss: 0.9044, test_f1: 0.5669
 epoch: 76, train_loss: 0.6552, test_loss: 0.9073, test_f1: 0.6165
 epoch: 77, train_loss: 0.6746, test_loss: 0.9011, test_f1: 0.5745
 epoch: 78, train_loss: 0.6500, test_loss: 0.9053, test_f1: 0.5753
 epoch: 79, train_loss: 0.6601, test_loss: 0.9094, test_f1: 0.5832
 epoch: 80, train_loss: 0.6504, test_loss: 0.8979, test_f1: 0.5707
 epoch: 81, train_loss: 0.6540, test_loss: 0.9069, test_f1: 0.5682
 epoch: 82, train_loss: 0.6535, test_loss: 0.9605, test_f1: 0.5821
 epoch: 83, train_loss: 0.6644, test_loss: 0.8997, test_f1: 0.6074
 epoch: 84, train_loss: 0.6669, test_loss: 0.8608, test_f1: 0.6152
 epoch: 85, train_loss: 0.6473, test_loss: 0.8917, test_f1: 0.5708
 epoch: 86, train_loss: 0.6381, test_loss: 0.9012, test_f1: 0.5854
 epoch: 87, train_loss: 0.6726, test_loss: 0.8993, test_f1: 0.6097
 epoch: 88, train_loss: 0.6413, test_loss: 0.9244, test_f1: 0.5690
 epoch: 89, train_loss: 0.6540, test_loss: 0.9258, test_f1: 0.5637
 epoch: 90, train_loss: 0.6570, test_loss: 0.9131, test_f1: 0.5559
 epoch: 91, train_loss: 0.6530, test_loss: 0.9147, test_f1: 0.5839
 epoch: 92, train_loss: 0.6434, test_loss: 0.9025, test_f1: 0.6166
 epoch: 93, train_loss: 0.6425, test_loss: 0.8999, test_f1: 0.5712
 epoch: 94, train_loss: 0.6581, test_loss: 1.0519, test_f1: 0.5291
 epoch: 95, train_loss: 0.6678, test_loss: 0.8519, test_f1: 0.6201
 epoch: 96, train_loss: 0.6528, test_loss: 0.8760, test_f1: 0.5773
 epoch: 97, train_loss: 0.6529, test_loss: 0.8946, test_f1: 0.5847
 epoch: 98, train_loss: 0.6414, test_loss: 0.9114, test_f1: 0.5801
 epoch: 99, train_loss: 0.6421, test_loss: 0.8874, test_f1: 0.6179
##################ITERATION #8 ****************************************
 epoch: 0, train_loss: 1.2395, test_loss: 1.1501, test_f1: 0.3103
 epoch: 1, train_loss: 1.0353, test_loss: 1.0043, test_f1: 0.4408
 epoch: 2, train_loss: 1.0094, test_loss: 1.2133, test_f1: 0.3985
 epoch: 3, train_loss: 0.9848, test_loss: 1.0084, test_f1: 0.4839
 epoch: 4, train_loss: 0.9585, test_loss: 1.0624, test_f1: 0.4575
 epoch: 5, train_loss: 0.9491, test_loss: 0.9165, test_f1: 0.5469
 epoch: 6, train_loss: 0.9320, test_loss: 0.9479, test_f1: 0.4544
 epoch: 7, train_loss: 0.9300, test_loss: 0.9680, test_f1: 0.4790
 epoch: 8, train_loss: 0.8994, test_loss: 1.0507, test_f1: 0.4372
 epoch: 9, train_loss: 0.9040, test_loss: 0.9324, test_f1: 0.5195
 epoch: 10, train_loss: 0.8740, test_loss: 1.4324, test_f1: 0.4097
 epoch: 11, train_loss: 0.8583, test_loss: 0.9205, test_f1: 0.5187
 epoch: 12, train_loss: 0.8551, test_loss: 1.0124, test_f1: 0.4754
 epoch: 13, train_loss: 0.8617, test_loss: 0.9853, test_f1: 0.5078
 epoch: 14, train_loss: 0.8810, test_loss: 1.0263, test_f1: 0.4365
 epoch: 15, train_loss: 0.8596, test_loss: 0.8855, test_f1: 0.5635
 epoch: 16, train_loss: 0.8383, test_loss: 0.9255, test_f1: 0.4906
 epoch: 17, train_loss: 0.8437, test_loss: 0.8821, test_f1: 0.5518
 epoch: 18, train_loss: 0.8246, test_loss: 0.9213, test_f1: 0.4941
 epoch: 19, train_loss: 0.8184, test_loss: 0.9168, test_f1: 0.5258
 epoch: 20, train_loss: 0.8212, test_loss: 0.9426, test_f1: 0.5192
 epoch: 21, train_loss: 0.8200, test_loss: 0.8993, test_f1: 0.5461
 epoch: 22, train_loss: 0.8276, test_loss: 0.9882, test_f1: 0.5013
 epoch: 23, train_loss: 0.8143, test_loss: 1.0250, test_f1: 0.5099
 epoch: 24, train_loss: 0.8176, test_loss: 0.9947, test_f1: 0.4961
 epoch: 25, train_loss: 0.8011, test_loss: 0.8857, test_f1: 0.5233
 epoch: 26, train_loss: 0.8163, test_loss: 1.0742, test_f1: 0.4920
 epoch: 27, train_loss: 0.8044, test_loss: 0.9445, test_f1: 0.5865
 epoch: 28, train_loss: 0.8092, test_loss: 1.4181, test_f1: 0.4465
 epoch: 29, train_loss: 0.8103, test_loss: 0.8528, test_f1: 0.5867
 epoch: 30, train_loss: 0.7836, test_loss: 0.8764, test_f1: 0.5391
 epoch: 31, train_loss: 0.8052, test_loss: 0.9181, test_f1: 0.5633
 epoch: 32, train_loss: 0.8006, test_loss: 0.8774, test_f1: 0.5551
 epoch: 33, train_loss: 0.7903, test_loss: 1.0070, test_f1: 0.5469
 epoch: 34, train_loss: 0.7924, test_loss: 0.8696, test_f1: 0.5462
 epoch: 35, train_loss: 0.7967, test_loss: 0.9384, test_f1: 0.5278
 epoch: 36, train_loss: 0.7739, test_loss: 0.8778, test_f1: 0.5505
 epoch: 37, train_loss: 0.7787, test_loss: 0.9430, test_f1: 0.5422
 epoch: 38, train_loss: 0.7734, test_loss: 0.9022, test_f1: 0.5417
 epoch: 39, train_loss: 0.7819, test_loss: 0.9463, test_f1: 0.5521
 epoch: 40, train_loss: 0.7913, test_loss: 0.8745, test_f1: 0.5858
 epoch: 41, train_loss: 0.7704, test_loss: 0.9344, test_f1: 0.5641
 epoch: 42, train_loss: 0.7607, test_loss: 0.9062, test_f1: 0.5792
 epoch: 43, train_loss: 0.7747, test_loss: 0.9280, test_f1: 0.5756
 epoch: 44, train_loss: 0.7549, test_loss: 0.9046, test_f1: 0.5613
 epoch: 45, train_loss: 0.7505, test_loss: 1.0046, test_f1: 0.5179
 epoch: 46, train_loss: 0.7549, test_loss: 0.8805, test_f1: 0.5943
 epoch: 47, train_loss: 0.7517, test_loss: 0.8561, test_f1: 0.6207
 epoch: 48, train_loss: 0.7672, test_loss: 0.9075, test_f1: 0.6018
 epoch: 49, train_loss: 0.7603, test_loss: 0.8887, test_f1: 0.6141
 epoch: 50, train_loss: 0.7627, test_loss: 1.0297, test_f1: 0.5778
 epoch: 51, train_loss: 0.7421, test_loss: 0.8959, test_f1: 0.5565
 epoch: 52, train_loss: 0.7383, test_loss: 0.8857, test_f1: 0.6034
 epoch: 53, train_loss: 0.7161, test_loss: 0.9109, test_f1: 0.5779
 epoch: 54, train_loss: 0.7205, test_loss: 0.9032, test_f1: 0.5730
 epoch: 55, train_loss: 0.7091, test_loss: 0.9000, test_f1: 0.5836
 epoch: 56, train_loss: 0.7129, test_loss: 0.9191, test_f1: 0.5977
 epoch: 57, train_loss: 0.7147, test_loss: 0.9043, test_f1: 0.6013
 epoch: 58, train_loss: 0.7139, test_loss: 0.9303, test_f1: 0.5865
 epoch: 59, train_loss: 0.7084, test_loss: 0.8861, test_f1: 0.6100
 epoch: 60, train_loss: 0.7037, test_loss: 0.8741, test_f1: 0.6101
 epoch: 61, train_loss: 0.6977, test_loss: 0.9232, test_f1: 0.6098
 epoch: 62, train_loss: 0.7121, test_loss: 0.8791, test_f1: 0.6225
 epoch: 63, train_loss: 0.6966, test_loss: 0.9007, test_f1: 0.6184
 epoch: 64, train_loss: 0.6898, test_loss: 0.9781, test_f1: 0.5810
 epoch: 65, train_loss: 0.7071, test_loss: 0.8845, test_f1: 0.6195
 epoch: 66, train_loss: 0.6874, test_loss: 0.8817, test_f1: 0.5922
 epoch: 67, train_loss: 0.6980, test_loss: 0.8878, test_f1: 0.6173
 epoch: 68, train_loss: 0.6854, test_loss: 1.0280, test_f1: 0.5787
 epoch: 69, train_loss: 0.7147, test_loss: 0.9415, test_f1: 0.6075
 epoch: 70, train_loss: 0.6931, test_loss: 0.9077, test_f1: 0.5961
 epoch: 71, train_loss: 0.6772, test_loss: 0.9563, test_f1: 0.5936
 epoch: 72, train_loss: 0.6965, test_loss: 0.8906, test_f1: 0.6304
 epoch: 73, train_loss: 0.6927, test_loss: 0.8869, test_f1: 0.6202
 epoch: 74, train_loss: 0.6785, test_loss: 0.9238, test_f1: 0.6075
 epoch: 75, train_loss: 0.7090, test_loss: 0.8921, test_f1: 0.6301
 epoch: 76, train_loss: 0.6952, test_loss: 0.9131, test_f1: 0.6161
 epoch: 77, train_loss: 0.6950, test_loss: 1.0174, test_f1: 0.5901
 epoch: 78, train_loss: 0.6785, test_loss: 0.9183, test_f1: 0.6011
 epoch: 79, train_loss: 0.6943, test_loss: 0.9481, test_f1: 0.6068
 epoch: 80, train_loss: 0.6682, test_loss: 0.9231, test_f1: 0.6209
 epoch: 81, train_loss: 0.6727, test_loss: 0.9271, test_f1: 0.6075
 epoch: 82, train_loss: 0.6721, test_loss: 0.9034, test_f1: 0.6120
 epoch: 83, train_loss: 0.6687, test_loss: 0.9204, test_f1: 0.6048
 epoch: 84, train_loss: 0.6802, test_loss: 0.8915, test_f1: 0.6368
 epoch: 85, train_loss: 0.6781, test_loss: 0.9256, test_f1: 0.6200
 epoch: 86, train_loss: 0.6853, test_loss: 0.9418, test_f1: 0.5986
 epoch: 87, train_loss: 0.6695, test_loss: 0.9412, test_f1: 0.6025
 epoch: 88, train_loss: 0.6542, test_loss: 0.8578, test_f1: 0.6304
 epoch: 89, train_loss: 0.6692, test_loss: 0.9261, test_f1: 0.6197
 epoch: 90, train_loss: 0.6598, test_loss: 0.9619, test_f1: 0.6132
 epoch: 91, train_loss: 0.6672, test_loss: 0.9421, test_f1: 0.5979
 epoch: 92, train_loss: 0.6748, test_loss: 1.0245, test_f1: 0.5798
 epoch: 93, train_loss: 0.6685, test_loss: 0.8765, test_f1: 0.6209
 epoch: 94, train_loss: 0.6740, test_loss: 1.0062, test_f1: 0.5939
 epoch: 95, train_loss: 0.6604, test_loss: 0.9480, test_f1: 0.6095
 epoch: 96, train_loss: 0.6459, test_loss: 0.9213, test_f1: 0.6260
 epoch: 97, train_loss: 0.6587, test_loss: 0.9647, test_f1: 0.6117
 epoch: 98, train_loss: 0.6630, test_loss: 0.9530, test_f1: 0.5849
 epoch: 99, train_loss: 0.6757, test_loss: 0.9152, test_f1: 0.6345
##################ITERATION #9 ****************************************
 epoch: 0, train_loss: 1.1383, test_loss: 1.2292, test_f1: 0.3531
 epoch: 1, train_loss: 1.0128, test_loss: 1.0156, test_f1: 0.4763
 epoch: 2, train_loss: 0.9917, test_loss: 1.0223, test_f1: 0.4797
 epoch: 3, train_loss: 0.9880, test_loss: 1.0546, test_f1: 0.4963
 epoch: 4, train_loss: 0.9586, test_loss: 1.0670, test_f1: 0.4663
 epoch: 5, train_loss: 0.9449, test_loss: 0.9758, test_f1: 0.5092
 epoch: 6, train_loss: 0.9340, test_loss: 1.2514, test_f1: 0.4545
 epoch: 7, train_loss: 0.9299, test_loss: 1.0186, test_f1: 0.5050
 epoch: 8, train_loss: 0.9098, test_loss: 1.0140, test_f1: 0.4973
 epoch: 9, train_loss: 0.8986, test_loss: 1.0024, test_f1: 0.5085
 epoch: 10, train_loss: 0.9163, test_loss: 0.9435, test_f1: 0.5080
 epoch: 11, train_loss: 0.9116, test_loss: 1.3182, test_f1: 0.4787
 epoch: 12, train_loss: 0.9113, test_loss: 1.0196, test_f1: 0.4627
 epoch: 13, train_loss: 0.8918, test_loss: 1.0181, test_f1: 0.5396
 epoch: 14, train_loss: 0.8898, test_loss: 1.0106, test_f1: 0.4924
 epoch: 15, train_loss: 0.8802, test_loss: 1.0084, test_f1: 0.4810
 epoch: 16, train_loss: 0.8909, test_loss: 0.9835, test_f1: 0.5406
 epoch: 17, train_loss: 0.8739, test_loss: 0.9329, test_f1: 0.5311
 epoch: 18, train_loss: 0.8643, test_loss: 0.9792, test_f1: 0.5286
 epoch: 19, train_loss: 0.8972, test_loss: 0.9852, test_f1: 0.5073
 epoch: 20, train_loss: 0.8710, test_loss: 1.0236, test_f1: 0.4363
 epoch: 21, train_loss: 0.8953, test_loss: 0.9344, test_f1: 0.5261
 epoch: 22, train_loss: 0.8515, test_loss: 0.9964, test_f1: 0.4888
 epoch: 23, train_loss: 0.8358, test_loss: 0.9133, test_f1: 0.5326
 epoch: 24, train_loss: 0.8442, test_loss: 0.9086, test_f1: 0.5349
 epoch: 25, train_loss: 0.8252, test_loss: 1.0022, test_f1: 0.5168
 epoch: 26, train_loss: 0.8498, test_loss: 0.9464, test_f1: 0.5322
 epoch: 27, train_loss: 0.8591, test_loss: 0.9412, test_f1: 0.5242
 epoch: 28, train_loss: 0.8376, test_loss: 0.9602, test_f1: 0.5180
 epoch: 29, train_loss: 0.8339, test_loss: 0.9178, test_f1: 0.5427
 epoch: 30, train_loss: 0.8309, test_loss: 0.9227, test_f1: 0.5361
 epoch: 31, train_loss: 0.8299, test_loss: 0.9197, test_f1: 0.5532
 epoch: 32, train_loss: 0.8238, test_loss: 0.9450, test_f1: 0.5282
 epoch: 33, train_loss: 0.8219, test_loss: 0.9555, test_f1: 0.5269
 epoch: 34, train_loss: 0.8268, test_loss: 0.9256, test_f1: 0.5197
 epoch: 35, train_loss: 0.8136, test_loss: 1.0331, test_f1: 0.4780
 epoch: 36, train_loss: 0.8293, test_loss: 0.9510, test_f1: 0.5313
 epoch: 37, train_loss: 0.8034, test_loss: 1.1878, test_f1: 0.4742
 epoch: 38, train_loss: 0.8095, test_loss: 0.9620, test_f1: 0.5311
 epoch: 39, train_loss: 0.7990, test_loss: 1.0117, test_f1: 0.4759
 epoch: 40, train_loss: 0.8026, test_loss: 0.9523, test_f1: 0.5282
 epoch: 41, train_loss: 0.7976, test_loss: 1.0623, test_f1: 0.5078
 epoch: 42, train_loss: 0.8124, test_loss: 0.9809, test_f1: 0.5152
 epoch: 43, train_loss: 0.7961, test_loss: 0.9371, test_f1: 0.5523
 epoch: 44, train_loss: 0.8109, test_loss: 0.9463, test_f1: 0.5599
 epoch: 45, train_loss: 0.7973, test_loss: 1.0767, test_f1: 0.5303
 epoch: 46, train_loss: 0.7973, test_loss: 0.9797, test_f1: 0.5611
 epoch: 47, train_loss: 0.7928, test_loss: 1.2977, test_f1: 0.4560
 epoch: 48, train_loss: 0.8024, test_loss: 1.0095, test_f1: 0.5251
 epoch: 49, train_loss: 0.7794, test_loss: 0.9200, test_f1: 0.5315
 epoch: 50, train_loss: 0.7796, test_loss: 0.9378, test_f1: 0.5331
 epoch: 51, train_loss: 0.7671, test_loss: 0.9377, test_f1: 0.5295
 epoch: 52, train_loss: 0.7518, test_loss: 1.1363, test_f1: 0.4898
 epoch: 53, train_loss: 0.7434, test_loss: 0.9643, test_f1: 0.5366
 epoch: 54, train_loss: 0.7504, test_loss: 1.0290, test_f1: 0.5143
 epoch: 55, train_loss: 0.7516, test_loss: 0.9746, test_f1: 0.5230
 epoch: 56, train_loss: 0.7649, test_loss: 1.1423, test_f1: 0.4997
 epoch: 57, train_loss: 0.7363, test_loss: 0.9645, test_f1: 0.5387
 epoch: 58, train_loss: 0.7517, test_loss: 1.0861, test_f1: 0.5193
 epoch: 59, train_loss: 0.7423, test_loss: 0.9977, test_f1: 0.5167
 epoch: 60, train_loss: 0.7483, test_loss: 0.9183, test_f1: 0.5395
 epoch: 61, train_loss: 0.7445, test_loss: 0.9319, test_f1: 0.5663
 epoch: 62, train_loss: 0.7374, test_loss: 1.2019, test_f1: 0.4670
 epoch: 63, train_loss: 0.7500, test_loss: 0.9406, test_f1: 0.5585
 epoch: 64, train_loss: 0.7375, test_loss: 0.9678, test_f1: 0.5472
 epoch: 65, train_loss: 0.7499, test_loss: 1.0917, test_f1: 0.4716
 epoch: 66, train_loss: 0.7268, test_loss: 0.9787, test_f1: 0.5351
 epoch: 67, train_loss: 0.7272, test_loss: 1.0505, test_f1: 0.4989
 epoch: 68, train_loss: 0.7418, test_loss: 0.9904, test_f1: 0.5021
 epoch: 69, train_loss: 0.7330, test_loss: 1.0191, test_f1: 0.4917
 epoch: 70, train_loss: 0.7387, test_loss: 0.9908, test_f1: 0.5346
 epoch: 71, train_loss: 0.7274, test_loss: 1.1447, test_f1: 0.4798
 epoch: 72, train_loss: 0.7171, test_loss: 0.9471, test_f1: 0.5266
 epoch: 73, train_loss: 0.7329, test_loss: 0.9264, test_f1: 0.5385
 epoch: 74, train_loss: 0.7283, test_loss: 1.1290, test_f1: 0.5015
 epoch: 75, train_loss: 0.7363, test_loss: 0.9511, test_f1: 0.5392
 epoch: 76, train_loss: 0.7281, test_loss: 1.0249, test_f1: 0.5249
 epoch: 77, train_loss: 0.7298, test_loss: 0.9398, test_f1: 0.5506
 epoch: 78, train_loss: 0.7129, test_loss: 1.0200, test_f1: 0.5148
 epoch: 79, train_loss: 0.7189, test_loss: 1.0063, test_f1: 0.5173
 epoch: 80, train_loss: 0.7229, test_loss: 1.3675, test_f1: 0.4382
 epoch: 81, train_loss: 0.7134, test_loss: 0.9702, test_f1: 0.5632
 epoch: 82, train_loss: 0.7221, test_loss: 1.0402, test_f1: 0.5181
 epoch: 83, train_loss: 0.7124, test_loss: 0.9887, test_f1: 0.5134
 epoch: 84, train_loss: 0.7180, test_loss: 0.9733, test_f1: 0.5272
 epoch: 85, train_loss: 0.7138, test_loss: 1.0078, test_f1: 0.5516
 epoch: 86, train_loss: 0.7188, test_loss: 0.9912, test_f1: 0.5552
 epoch: 87, train_loss: 0.7240, test_loss: 0.9380, test_f1: 0.5582
 epoch: 88, train_loss: 0.7317, test_loss: 0.9473, test_f1: 0.5468
 epoch: 89, train_loss: 0.7158, test_loss: 1.0171, test_f1: 0.5262
 epoch: 90, train_loss: 0.7126, test_loss: 0.9802, test_f1: 0.5093
 epoch: 91, train_loss: 0.7244, test_loss: 0.9501, test_f1: 0.5403
 epoch: 92, train_loss: 0.7014, test_loss: 0.9468, test_f1: 0.5883
 epoch: 93, train_loss: 0.7009, test_loss: 0.9855, test_f1: 0.5393
 epoch: 94, train_loss: 0.7165, test_loss: 0.9432, test_f1: 0.5493
 epoch: 95, train_loss: 0.7046, test_loss: 1.0361, test_f1: 0.4983
 epoch: 96, train_loss: 0.6983, test_loss: 0.9856, test_f1: 0.5512
 epoch: 97, train_loss: 0.7045, test_loss: 0.9567, test_f1: 0.5489
 epoch: 98, train_loss: 0.7088, test_loss: 1.0126, test_f1: 0.4931
 epoch: 99, train_loss: 0.7086, test_loss: 1.0184, test_f1: 0.5058

Training completed in 492.44 seconds
Best F1: 0.6780 at epoch 99
Mean F1 across iterations: 0.6321  0.0222
========================FINAL RESULTS================================
FEGIN weighted F1: 0.6780  0.0222
python main.py --data ltspice_examples --representation component_pin --model FEGIN --layers 3 --hiddens 16 --batch_size 128 --lr 0.01 --emb_size 250 --epochs 100 --save_appendix component_pin_L3_H16_BS128_LR0.01_E250 --no_val
-----



STDERR:
  File "main.py", line 370, in <module>
    main()
  File "main.py", line 254, in main
    dataset = dataset_class(
  File "/home/philip/projects/ltspice_examples_code_repo/Circuit-Completion-Using-GNNs/component_classification_with_link_prediction_head/evaluation/FEGIN/kernel/circuit_datasets.py", line 15, in __init__
    self.data, self.slices = torch.load(self.processed_paths[0])
  File "/home/philip/.local/lib/python3.8/site-packages/torch/serialization.py", line 1040, in load
    warnings.warn(
  File "/usr/lib/python3.8/warnings.py", line 109, in _showwarnmsg
    sw(msg.message, msg.category, msg.filename, msg.lineno,
  File "main.py", line 47, in warn_with_traceback
    traceback.print_stack(file=log)
/home/philip/projects/ltspice_examples_code_repo/Circuit-Completion-Using-GNNs/component_classification_with_link_prediction_head/evaluation/FEGIN/kernel/circuit_datasets.py:15: FutureWarning: You are using `torch.load` with `weights_only=False` (the current default value), which uses the default pickle module implicitly. It is possible to construct malicious pickle data which will execute arbitrary code during unpickling (See https://github.com/pytorch/pytorch/blob/main/SECURITY.md#untrusted-models for more details). In a future release, the default value for `weights_only` will be flipped to `True`. This limits the functions that could be executed during unpickling. Arbitrary objects will no longer be allowed to be loaded via this mode unless they are explicitly allowlisted by the user via `torch.serialization.add_safe_globals`. We recommend you start setting `weights_only=True` for any use case where you don't have full control of the loaded file. Please open an issue on GitHub for any issues related to this experimental feature.
  self.data, self.slices = torch.load(self.processed_paths[0])
