STDOUT:
Results will be saved in /home/philip/projects/ltspice_examples_code_repo/Circuit-Completion-Using-GNNs/component_classification_with_link_prediction_head/evaluation/FEGIN/results/model_FEGIN_dataset_ltspice_examples
Command line input: python main.py --data ltspice_examples --representation component_net --model FEGIN --layers 5 --hiddens 32 --batch_size 128 --lr 0.0001 --emb_size 250 --epochs 100 --save_appendix component_net_L5_H32_BS128_LR0.0001_E250 --no_val
 is saved.
-----
ltspice_examples - FEGIN
Using 5 layers, 32 hidden units, h = 2
Loading component_net representation dataset
ENTERED
Training FEGIN on component_net representation
Train: 3558, Test: 846
##################ITERATION #0 ****************************************
 epoch: 0, train_loss: 1.4192, test_loss: 1.4163, test_f1: 0.1004
 epoch: 1, train_loss: 1.4100, test_loss: 1.4040, test_f1: 0.1004
 epoch: 2, train_loss: 1.4039, test_loss: 1.3995, test_f1: 0.1122
 epoch: 3, train_loss: 1.3975, test_loss: 1.3917, test_f1: 0.1370
 epoch: 4, train_loss: 1.3915, test_loss: 1.3848, test_f1: 0.1303
 epoch: 5, train_loss: 1.3835, test_loss: 1.3765, test_f1: 0.1523
 epoch: 6, train_loss: 1.3758, test_loss: 1.3684, test_f1: 0.2233
 epoch: 7, train_loss: 1.3659, test_loss: 1.3590, test_f1: 0.2871
 epoch: 8, train_loss: 1.3562, test_loss: 1.3479, test_f1: 0.3278
 epoch: 9, train_loss: 1.3454, test_loss: 1.3372, test_f1: 0.3378
 epoch: 10, train_loss: 1.3323, test_loss: 1.3247, test_f1: 0.3320
 epoch: 11, train_loss: 1.3216, test_loss: 1.3118, test_f1: 0.3299
 epoch: 12, train_loss: 1.3069, test_loss: 1.2990, test_f1: 0.3264
 epoch: 13, train_loss: 1.2964, test_loss: 1.2876, test_f1: 0.3227
 epoch: 14, train_loss: 1.2814, test_loss: 1.2742, test_f1: 0.3208
 epoch: 15, train_loss: 1.2709, test_loss: 1.2614, test_f1: 0.3238
 epoch: 16, train_loss: 1.2537, test_loss: 1.2489, test_f1: 0.3288
 epoch: 17, train_loss: 1.2422, test_loss: 1.2384, test_f1: 0.3302
 epoch: 18, train_loss: 1.2314, test_loss: 1.2254, test_f1: 0.3384
 epoch: 19, train_loss: 1.2203, test_loss: 1.2177, test_f1: 0.3399
 epoch: 20, train_loss: 1.2109, test_loss: 1.2061, test_f1: 0.3402
 epoch: 21, train_loss: 1.1960, test_loss: 1.1916, test_f1: 0.3423
 epoch: 22, train_loss: 1.1930, test_loss: 1.1856, test_f1: 0.3638
 epoch: 23, train_loss: 1.1794, test_loss: 1.1784, test_f1: 0.3649
 epoch: 24, train_loss: 1.1728, test_loss: 1.1692, test_f1: 0.3674
 epoch: 25, train_loss: 1.1655, test_loss: 1.1581, test_f1: 0.3784
 epoch: 26, train_loss: 1.1614, test_loss: 1.1496, test_f1: 0.3933
 epoch: 27, train_loss: 1.1526, test_loss: 1.1459, test_f1: 0.4032
 epoch: 28, train_loss: 1.1426, test_loss: 1.1390, test_f1: 0.4145
 epoch: 29, train_loss: 1.1387, test_loss: 1.1354, test_f1: 0.4262
 epoch: 30, train_loss: 1.1245, test_loss: 1.1260, test_f1: 0.4271
 epoch: 31, train_loss: 1.1256, test_loss: 1.1193, test_f1: 0.4564
 epoch: 32, train_loss: 1.1227, test_loss: 1.1158, test_f1: 0.4544
 epoch: 33, train_loss: 1.1120, test_loss: 1.1051, test_f1: 0.4542
 epoch: 34, train_loss: 1.1114, test_loss: 1.0953, test_f1: 0.4635
 epoch: 35, train_loss: 1.1024, test_loss: 1.0911, test_f1: 0.4694
 epoch: 36, train_loss: 1.0953, test_loss: 1.0855, test_f1: 0.4742
 epoch: 37, train_loss: 1.0964, test_loss: 1.0764, test_f1: 0.4904
 epoch: 38, train_loss: 1.0870, test_loss: 1.0726, test_f1: 0.4883
 epoch: 39, train_loss: 1.0781, test_loss: 1.0679, test_f1: 0.4988
 epoch: 40, train_loss: 1.0707, test_loss: 1.0603, test_f1: 0.5146
 epoch: 41, train_loss: 1.0674, test_loss: 1.0535, test_f1: 0.5065
 epoch: 42, train_loss: 1.0607, test_loss: 1.0427, test_f1: 0.5228
 epoch: 43, train_loss: 1.0509, test_loss: 1.0409, test_f1: 0.5282
 epoch: 44, train_loss: 1.0529, test_loss: 1.0340, test_f1: 0.5291
 epoch: 45, train_loss: 1.0371, test_loss: 1.0242, test_f1: 0.5323
 epoch: 46, train_loss: 1.0348, test_loss: 1.0248, test_f1: 0.5310
 epoch: 47, train_loss: 1.0239, test_loss: 1.0114, test_f1: 0.5360
 epoch: 48, train_loss: 1.0267, test_loss: 1.0002, test_f1: 0.5374
 epoch: 49, train_loss: 1.0093, test_loss: 1.0000, test_f1: 0.5320
 epoch: 50, train_loss: 1.0101, test_loss: 0.9939, test_f1: 0.5306
 epoch: 51, train_loss: 1.0070, test_loss: 0.9917, test_f1: 0.5249
 epoch: 52, train_loss: 1.0009, test_loss: 0.9884, test_f1: 0.5156
 epoch: 53, train_loss: 0.9981, test_loss: 0.9826, test_f1: 0.5335
 epoch: 54, train_loss: 0.9861, test_loss: 0.9851, test_f1: 0.5247
 epoch: 55, train_loss: 0.9899, test_loss: 0.9832, test_f1: 0.5189
 epoch: 56, train_loss: 0.9885, test_loss: 0.9763, test_f1: 0.5220
 epoch: 57, train_loss: 0.9823, test_loss: 0.9783, test_f1: 0.5182
 epoch: 58, train_loss: 0.9928, test_loss: 0.9772, test_f1: 0.5196
 epoch: 59, train_loss: 0.9783, test_loss: 0.9733, test_f1: 0.5193
 epoch: 60, train_loss: 0.9752, test_loss: 0.9736, test_f1: 0.5245
 epoch: 61, train_loss: 0.9747, test_loss: 0.9673, test_f1: 0.5272
 epoch: 62, train_loss: 0.9702, test_loss: 0.9681, test_f1: 0.5271
 epoch: 63, train_loss: 0.9763, test_loss: 0.9654, test_f1: 0.5257
 epoch: 64, train_loss: 0.9758, test_loss: 0.9594, test_f1: 0.5269
 epoch: 65, train_loss: 0.9639, test_loss: 0.9547, test_f1: 0.5266
 epoch: 66, train_loss: 0.9614, test_loss: 0.9519, test_f1: 0.5230
 epoch: 67, train_loss: 0.9637, test_loss: 0.9528, test_f1: 0.5230
 epoch: 68, train_loss: 0.9528, test_loss: 0.9491, test_f1: 0.5207
 epoch: 69, train_loss: 0.9664, test_loss: 0.9462, test_f1: 0.5312
 epoch: 70, train_loss: 0.9576, test_loss: 0.9496, test_f1: 0.5228
 epoch: 71, train_loss: 0.9600, test_loss: 0.9434, test_f1: 0.5278
 epoch: 72, train_loss: 0.9506, test_loss: 0.9455, test_f1: 0.5278
 epoch: 73, train_loss: 0.9508, test_loss: 0.9422, test_f1: 0.5280
 epoch: 74, train_loss: 0.9453, test_loss: 0.9423, test_f1: 0.5321
 epoch: 75, train_loss: 0.9526, test_loss: 0.9415, test_f1: 0.5409
 epoch: 76, train_loss: 0.9365, test_loss: 0.9439, test_f1: 0.5383
 epoch: 77, train_loss: 0.9340, test_loss: 0.9334, test_f1: 0.5073
 epoch: 78, train_loss: 0.9321, test_loss: 0.9365, test_f1: 0.5345
 epoch: 79, train_loss: 0.9315, test_loss: 0.9391, test_f1: 0.5170
 epoch: 80, train_loss: 0.9286, test_loss: 0.9373, test_f1: 0.5185
 epoch: 81, train_loss: 0.9214, test_loss: 0.9316, test_f1: 0.5281
 epoch: 82, train_loss: 0.9392, test_loss: 0.9306, test_f1: 0.5212
 epoch: 83, train_loss: 0.9342, test_loss: 0.9337, test_f1: 0.5335
 epoch: 84, train_loss: 0.9288, test_loss: 0.9282, test_f1: 0.5293
 epoch: 85, train_loss: 0.9241, test_loss: 0.9270, test_f1: 0.5038
 epoch: 86, train_loss: 0.9259, test_loss: 0.9208, test_f1: 0.5255
 epoch: 87, train_loss: 0.9172, test_loss: 0.9253, test_f1: 0.5224
 epoch: 88, train_loss: 0.9196, test_loss: 0.9238, test_f1: 0.5175
 epoch: 89, train_loss: 0.9229, test_loss: 0.9271, test_f1: 0.5194
 epoch: 90, train_loss: 0.9165, test_loss: 0.9220, test_f1: 0.5291
 epoch: 91, train_loss: 0.9213, test_loss: 0.9281, test_f1: 0.5480
 epoch: 92, train_loss: 0.9102, test_loss: 0.9237, test_f1: 0.5242
 epoch: 93, train_loss: 0.9130, test_loss: 0.9295, test_f1: 0.5405
 epoch: 94, train_loss: 0.9017, test_loss: 0.9237, test_f1: 0.5130
 epoch: 95, train_loss: 0.9092, test_loss: 0.9174, test_f1: 0.5267
 epoch: 96, train_loss: 0.9076, test_loss: 0.9173, test_f1: 0.5219
 epoch: 97, train_loss: 0.9053, test_loss: 0.9155, test_f1: 0.5261
 epoch: 98, train_loss: 0.9008, test_loss: 0.9169, test_f1: 0.5243
 epoch: 99, train_loss: 0.8981, test_loss: 0.9207, test_f1: 0.5406
##################ITERATION #1 ****************************************
 epoch: 0, train_loss: 1.3824, test_loss: 1.3897, test_f1: 0.1004
 epoch: 1, train_loss: 1.3580, test_loss: 1.3642, test_f1: 0.1001
 epoch: 2, train_loss: 1.3424, test_loss: 1.3398, test_f1: 0.2886
 epoch: 3, train_loss: 1.3242, test_loss: 1.3188, test_f1: 0.3269
 epoch: 4, train_loss: 1.3083, test_loss: 1.3023, test_f1: 0.3350
 epoch: 5, train_loss: 1.2926, test_loss: 1.2854, test_f1: 0.3256
 epoch: 6, train_loss: 1.2823, test_loss: 1.2710, test_f1: 0.3502
 epoch: 7, train_loss: 1.2674, test_loss: 1.2549, test_f1: 0.3595
 epoch: 8, train_loss: 1.2560, test_loss: 1.2395, test_f1: 0.3443
 epoch: 9, train_loss: 1.2425, test_loss: 1.2270, test_f1: 0.3506
 epoch: 10, train_loss: 1.2332, test_loss: 1.2131, test_f1: 0.3619
 epoch: 11, train_loss: 1.2224, test_loss: 1.1993, test_f1: 0.3665
 epoch: 12, train_loss: 1.2136, test_loss: 1.1850, test_f1: 0.3817
 epoch: 13, train_loss: 1.1989, test_loss: 1.1702, test_f1: 0.3961
 epoch: 14, train_loss: 1.1941, test_loss: 1.1609, test_f1: 0.4079
 epoch: 15, train_loss: 1.1803, test_loss: 1.1493, test_f1: 0.4210
 epoch: 16, train_loss: 1.1738, test_loss: 1.1371, test_f1: 0.4327
 epoch: 17, train_loss: 1.1679, test_loss: 1.1274, test_f1: 0.4483
 epoch: 18, train_loss: 1.1580, test_loss: 1.1177, test_f1: 0.4563
 epoch: 19, train_loss: 1.1453, test_loss: 1.1078, test_f1: 0.4564
 epoch: 20, train_loss: 1.1407, test_loss: 1.0939, test_f1: 0.4511
 epoch: 21, train_loss: 1.1286, test_loss: 1.0859, test_f1: 0.4618
 epoch: 22, train_loss: 1.1232, test_loss: 1.0768, test_f1: 0.4720
 epoch: 23, train_loss: 1.1159, test_loss: 1.0659, test_f1: 0.4687
 epoch: 24, train_loss: 1.1034, test_loss: 1.0563, test_f1: 0.4732
 epoch: 25, train_loss: 1.0962, test_loss: 1.0475, test_f1: 0.4770
 epoch: 26, train_loss: 1.0839, test_loss: 1.0325, test_f1: 0.4719
 epoch: 27, train_loss: 1.0819, test_loss: 1.0275, test_f1: 0.4861
 epoch: 28, train_loss: 1.0748, test_loss: 1.0213, test_f1: 0.4793
 epoch: 29, train_loss: 1.0621, test_loss: 1.0079, test_f1: 0.4978
 epoch: 30, train_loss: 1.0553, test_loss: 0.9988, test_f1: 0.4872
 epoch: 31, train_loss: 1.0511, test_loss: 0.9962, test_f1: 0.4838
 epoch: 32, train_loss: 1.0450, test_loss: 0.9917, test_f1: 0.4705
 epoch: 33, train_loss: 1.0468, test_loss: 0.9896, test_f1: 0.4774
 epoch: 34, train_loss: 1.0293, test_loss: 0.9824, test_f1: 0.4861
 epoch: 35, train_loss: 1.0250, test_loss: 0.9779, test_f1: 0.4916
 epoch: 36, train_loss: 1.0186, test_loss: 0.9717, test_f1: 0.4941
 epoch: 37, train_loss: 1.0176, test_loss: 0.9599, test_f1: 0.5071
 epoch: 38, train_loss: 1.0111, test_loss: 0.9596, test_f1: 0.5059
 epoch: 39, train_loss: 1.0099, test_loss: 0.9621, test_f1: 0.4991
 epoch: 40, train_loss: 1.0032, test_loss: 0.9455, test_f1: 0.5116
 epoch: 41, train_loss: 0.9920, test_loss: 0.9479, test_f1: 0.5081
 epoch: 42, train_loss: 0.9955, test_loss: 0.9448, test_f1: 0.5006
 epoch: 43, train_loss: 0.9928, test_loss: 0.9428, test_f1: 0.5065
 epoch: 44, train_loss: 0.9805, test_loss: 0.9420, test_f1: 0.5022
 epoch: 45, train_loss: 0.9818, test_loss: 0.9406, test_f1: 0.5075
 epoch: 46, train_loss: 0.9721, test_loss: 0.9397, test_f1: 0.5174
 epoch: 47, train_loss: 0.9704, test_loss: 0.9260, test_f1: 0.5138
 epoch: 48, train_loss: 0.9697, test_loss: 0.9189, test_f1: 0.5120
 epoch: 49, train_loss: 0.9665, test_loss: 0.9300, test_f1: 0.5221
 epoch: 50, train_loss: 0.9624, test_loss: 0.9367, test_f1: 0.5130
 epoch: 51, train_loss: 0.9568, test_loss: 0.9330, test_f1: 0.5172
 epoch: 52, train_loss: 0.9666, test_loss: 0.9238, test_f1: 0.5202
 epoch: 53, train_loss: 0.9550, test_loss: 0.9227, test_f1: 0.5316
 epoch: 54, train_loss: 0.9582, test_loss: 0.9225, test_f1: 0.5223
 epoch: 55, train_loss: 0.9545, test_loss: 0.9183, test_f1: 0.5174
 epoch: 56, train_loss: 0.9538, test_loss: 0.9199, test_f1: 0.5139
 epoch: 57, train_loss: 0.9466, test_loss: 0.9179, test_f1: 0.5158
 epoch: 58, train_loss: 0.9518, test_loss: 0.9235, test_f1: 0.5126
 epoch: 59, train_loss: 0.9462, test_loss: 0.9301, test_f1: 0.5246
 epoch: 60, train_loss: 0.9365, test_loss: 0.9178, test_f1: 0.5128
 epoch: 61, train_loss: 0.9439, test_loss: 0.9145, test_f1: 0.5173
 epoch: 62, train_loss: 0.9462, test_loss: 0.9184, test_f1: 0.5142
 epoch: 63, train_loss: 0.9358, test_loss: 0.9185, test_f1: 0.5226
 epoch: 64, train_loss: 0.9450, test_loss: 0.9216, test_f1: 0.5206
 epoch: 65, train_loss: 0.9357, test_loss: 0.9190, test_f1: 0.5230
 epoch: 66, train_loss: 0.9349, test_loss: 0.9180, test_f1: 0.5236
 epoch: 67, train_loss: 0.9417, test_loss: 0.9260, test_f1: 0.5185
 epoch: 68, train_loss: 0.9418, test_loss: 0.9115, test_f1: 0.5225
 epoch: 69, train_loss: 0.9295, test_loss: 0.9185, test_f1: 0.5192
 epoch: 70, train_loss: 0.9311, test_loss: 0.9171, test_f1: 0.5170
 epoch: 71, train_loss: 0.9353, test_loss: 0.9091, test_f1: 0.5249
 epoch: 72, train_loss: 0.9350, test_loss: 0.9121, test_f1: 0.5195
 epoch: 73, train_loss: 0.9335, test_loss: 0.9202, test_f1: 0.5325
 epoch: 74, train_loss: 0.9338, test_loss: 0.9209, test_f1: 0.5278
 epoch: 75, train_loss: 0.9351, test_loss: 0.9209, test_f1: 0.5240
 epoch: 76, train_loss: 0.9258, test_loss: 0.9120, test_f1: 0.5151
 epoch: 77, train_loss: 0.9424, test_loss: 0.9257, test_f1: 0.5220
 epoch: 78, train_loss: 0.9234, test_loss: 0.9164, test_f1: 0.5192
 epoch: 79, train_loss: 0.9242, test_loss: 0.9117, test_f1: 0.5244
 epoch: 80, train_loss: 0.9223, test_loss: 0.9112, test_f1: 0.5225
 epoch: 81, train_loss: 0.9213, test_loss: 0.9066, test_f1: 0.5299
 epoch: 82, train_loss: 0.9263, test_loss: 0.9053, test_f1: 0.5280
 epoch: 83, train_loss: 0.9156, test_loss: 0.9068, test_f1: 0.5280
 epoch: 84, train_loss: 0.9113, test_loss: 0.9154, test_f1: 0.5267
 epoch: 85, train_loss: 0.9246, test_loss: 0.9005, test_f1: 0.5250
 epoch: 86, train_loss: 0.9171, test_loss: 0.8991, test_f1: 0.5351
 epoch: 87, train_loss: 0.9184, test_loss: 0.8972, test_f1: 0.5313
 epoch: 88, train_loss: 0.9117, test_loss: 0.8984, test_f1: 0.5273
 epoch: 89, train_loss: 0.9183, test_loss: 0.9043, test_f1: 0.5266
 epoch: 90, train_loss: 0.9151, test_loss: 0.9021, test_f1: 0.5329
 epoch: 91, train_loss: 0.9068, test_loss: 0.9055, test_f1: 0.5300
 epoch: 92, train_loss: 0.9195, test_loss: 0.9053, test_f1: 0.5231
 epoch: 93, train_loss: 0.9143, test_loss: 0.9141, test_f1: 0.5126
 epoch: 94, train_loss: 0.9191, test_loss: 0.9185, test_f1: 0.5207
 epoch: 95, train_loss: 0.9057, test_loss: 0.9224, test_f1: 0.5143
 epoch: 96, train_loss: 0.9046, test_loss: 0.9159, test_f1: 0.5269
 epoch: 97, train_loss: 0.9117, test_loss: 0.8972, test_f1: 0.5287
 epoch: 98, train_loss: 0.9154, test_loss: 0.9082, test_f1: 0.5170
 epoch: 99, train_loss: 0.9074, test_loss: 0.9101, test_f1: 0.5260
##################ITERATION #2 ****************************************
 epoch: 0, train_loss: 1.3345, test_loss: 1.3501, test_f1: 0.2270
 epoch: 1, train_loss: 1.3026, test_loss: 1.3263, test_f1: 0.2270
 epoch: 2, train_loss: 1.2861, test_loss: 1.2956, test_f1: 0.2270
 epoch: 3, train_loss: 1.2762, test_loss: 1.2713, test_f1: 0.2484
 epoch: 4, train_loss: 1.2640, test_loss: 1.2580, test_f1: 0.2611
 epoch: 5, train_loss: 1.2482, test_loss: 1.2454, test_f1: 0.2810
 epoch: 6, train_loss: 1.2437, test_loss: 1.2359, test_f1: 0.2915
 epoch: 7, train_loss: 1.2300, test_loss: 1.2275, test_f1: 0.3097
 epoch: 8, train_loss: 1.2198, test_loss: 1.2153, test_f1: 0.3201
 epoch: 9, train_loss: 1.2140, test_loss: 1.2000, test_f1: 0.3349
 epoch: 10, train_loss: 1.2037, test_loss: 1.1898, test_f1: 0.3537
 epoch: 11, train_loss: 1.1891, test_loss: 1.1785, test_f1: 0.3669
 epoch: 12, train_loss: 1.1809, test_loss: 1.1591, test_f1: 0.3722
 epoch: 13, train_loss: 1.1732, test_loss: 1.1452, test_f1: 0.3807
 epoch: 14, train_loss: 1.1588, test_loss: 1.1332, test_f1: 0.3940
 epoch: 15, train_loss: 1.1490, test_loss: 1.1218, test_f1: 0.4034
 epoch: 16, train_loss: 1.1377, test_loss: 1.1135, test_f1: 0.4193
 epoch: 17, train_loss: 1.1297, test_loss: 1.0997, test_f1: 0.4430
 epoch: 18, train_loss: 1.1156, test_loss: 1.0898, test_f1: 0.4584
 epoch: 19, train_loss: 1.1108, test_loss: 1.0762, test_f1: 0.4594
 epoch: 20, train_loss: 1.1040, test_loss: 1.0701, test_f1: 0.4661
 epoch: 21, train_loss: 1.0883, test_loss: 1.0551, test_f1: 0.4743
 epoch: 22, train_loss: 1.0907, test_loss: 1.0444, test_f1: 0.4790
 epoch: 23, train_loss: 1.0785, test_loss: 1.0374, test_f1: 0.4761
 epoch: 24, train_loss: 1.0731, test_loss: 1.0266, test_f1: 0.4754
 epoch: 25, train_loss: 1.0573, test_loss: 1.0238, test_f1: 0.4825
 epoch: 26, train_loss: 1.0591, test_loss: 1.0161, test_f1: 0.4754
 epoch: 27, train_loss: 1.0466, test_loss: 1.0062, test_f1: 0.4831
 epoch: 28, train_loss: 1.0451, test_loss: 1.0037, test_f1: 0.4781
 epoch: 29, train_loss: 1.0445, test_loss: 1.0012, test_f1: 0.4816
 epoch: 30, train_loss: 1.0351, test_loss: 0.9956, test_f1: 0.4832
 epoch: 31, train_loss: 1.0299, test_loss: 0.9908, test_f1: 0.4747
 epoch: 32, train_loss: 1.0251, test_loss: 0.9846, test_f1: 0.4797
 epoch: 33, train_loss: 1.0101, test_loss: 0.9859, test_f1: 0.4650
 epoch: 34, train_loss: 1.0085, test_loss: 0.9780, test_f1: 0.4831
 epoch: 35, train_loss: 1.0064, test_loss: 0.9801, test_f1: 0.4724
 epoch: 36, train_loss: 1.0002, test_loss: 0.9769, test_f1: 0.4793
 epoch: 37, train_loss: 1.0021, test_loss: 0.9724, test_f1: 0.4898
 epoch: 38, train_loss: 0.9924, test_loss: 0.9682, test_f1: 0.5047
 epoch: 39, train_loss: 0.9875, test_loss: 0.9661, test_f1: 0.4892
 epoch: 40, train_loss: 0.9902, test_loss: 0.9454, test_f1: 0.5089
 epoch: 41, train_loss: 0.9771, test_loss: 0.9459, test_f1: 0.5096
 epoch: 42, train_loss: 0.9734, test_loss: 0.9547, test_f1: 0.4957
 epoch: 43, train_loss: 0.9740, test_loss: 0.9552, test_f1: 0.4979
 epoch: 44, train_loss: 0.9724, test_loss: 0.9509, test_f1: 0.4882
 epoch: 45, train_loss: 0.9734, test_loss: 0.9435, test_f1: 0.4989
 epoch: 46, train_loss: 0.9698, test_loss: 0.9591, test_f1: 0.4957
 epoch: 47, train_loss: 0.9589, test_loss: 0.9459, test_f1: 0.4956
 epoch: 48, train_loss: 0.9608, test_loss: 0.9405, test_f1: 0.4963
 epoch: 49, train_loss: 0.9610, test_loss: 0.9399, test_f1: 0.5065
 epoch: 50, train_loss: 0.9444, test_loss: 0.9439, test_f1: 0.4963
 epoch: 51, train_loss: 0.9427, test_loss: 0.9360, test_f1: 0.5018
 epoch: 52, train_loss: 0.9472, test_loss: 0.9343, test_f1: 0.5034
 epoch: 53, train_loss: 0.9425, test_loss: 0.9435, test_f1: 0.4942
 epoch: 54, train_loss: 0.9503, test_loss: 0.9272, test_f1: 0.5033
 epoch: 55, train_loss: 0.9366, test_loss: 0.9329, test_f1: 0.4972
 epoch: 56, train_loss: 0.9386, test_loss: 0.9388, test_f1: 0.5003
 epoch: 57, train_loss: 0.9373, test_loss: 0.9400, test_f1: 0.5040
 epoch: 58, train_loss: 0.9349, test_loss: 0.9313, test_f1: 0.5076
 epoch: 59, train_loss: 0.9319, test_loss: 0.9369, test_f1: 0.5044
 epoch: 60, train_loss: 0.9438, test_loss: 0.9324, test_f1: 0.5033
 epoch: 61, train_loss: 0.9321, test_loss: 0.9343, test_f1: 0.4992
 epoch: 62, train_loss: 0.9265, test_loss: 0.9282, test_f1: 0.5077
 epoch: 63, train_loss: 0.9280, test_loss: 0.9252, test_f1: 0.5050
 epoch: 64, train_loss: 0.9326, test_loss: 0.9292, test_f1: 0.5121
 epoch: 65, train_loss: 0.9278, test_loss: 0.9351, test_f1: 0.5013
 epoch: 66, train_loss: 0.9222, test_loss: 0.9436, test_f1: 0.4921
 epoch: 67, train_loss: 0.9235, test_loss: 0.9246, test_f1: 0.5068
 epoch: 68, train_loss: 0.9257, test_loss: 0.9288, test_f1: 0.5044
 epoch: 69, train_loss: 0.9188, test_loss: 0.9251, test_f1: 0.5037
 epoch: 70, train_loss: 0.9256, test_loss: 0.9357, test_f1: 0.5000
 epoch: 71, train_loss: 0.9217, test_loss: 0.9371, test_f1: 0.4941
 epoch: 72, train_loss: 0.9169, test_loss: 0.9298, test_f1: 0.5016
 epoch: 73, train_loss: 0.9228, test_loss: 0.9361, test_f1: 0.5021
 epoch: 74, train_loss: 0.9191, test_loss: 0.9260, test_f1: 0.5063
 epoch: 75, train_loss: 0.9132, test_loss: 0.9310, test_f1: 0.5005
 epoch: 76, train_loss: 0.9125, test_loss: 0.9366, test_f1: 0.4973
 epoch: 77, train_loss: 0.9119, test_loss: 0.9286, test_f1: 0.4987
 epoch: 78, train_loss: 0.9050, test_loss: 0.9273, test_f1: 0.5045
 epoch: 79, train_loss: 0.9183, test_loss: 0.9323, test_f1: 0.5058
 epoch: 80, train_loss: 0.9123, test_loss: 0.9308, test_f1: 0.5048
 epoch: 81, train_loss: 0.9084, test_loss: 0.9247, test_f1: 0.5091
 epoch: 82, train_loss: 0.9147, test_loss: 0.9237, test_f1: 0.5096
 epoch: 83, train_loss: 0.9156, test_loss: 0.9249, test_f1: 0.5081
 epoch: 84, train_loss: 0.9022, test_loss: 0.9412, test_f1: 0.5017
 epoch: 85, train_loss: 0.9109, test_loss: 0.9369, test_f1: 0.4965
 epoch: 86, train_loss: 0.9122, test_loss: 0.9300, test_f1: 0.5088
 epoch: 87, train_loss: 0.9069, test_loss: 0.9356, test_f1: 0.5027
 epoch: 88, train_loss: 0.8983, test_loss: 0.9345, test_f1: 0.5034
 epoch: 89, train_loss: 0.9046, test_loss: 0.9330, test_f1: 0.5004
 epoch: 90, train_loss: 0.9006, test_loss: 0.9265, test_f1: 0.5056
 epoch: 91, train_loss: 0.8952, test_loss: 0.9344, test_f1: 0.5086
 epoch: 92, train_loss: 0.8960, test_loss: 0.9264, test_f1: 0.5018
 epoch: 93, train_loss: 0.8937, test_loss: 0.9102, test_f1: 0.5184
 epoch: 94, train_loss: 0.9009, test_loss: 0.9213, test_f1: 0.5122
 epoch: 95, train_loss: 0.9103, test_loss: 0.9270, test_f1: 0.5017
 epoch: 96, train_loss: 0.8992, test_loss: 0.9240, test_f1: 0.5024
 epoch: 97, train_loss: 0.8949, test_loss: 0.9326, test_f1: 0.5019
 epoch: 98, train_loss: 0.8964, test_loss: 0.9307, test_f1: 0.5010
 epoch: 99, train_loss: 0.8995, test_loss: 0.9248, test_f1: 0.5159
##################ITERATION #3 ****************************************
 epoch: 0, train_loss: 1.3146, test_loss: 1.3470, test_f1: 0.2270
 epoch: 1, train_loss: 1.2824, test_loss: 1.3113, test_f1: 0.2250
 epoch: 2, train_loss: 1.2647, test_loss: 1.2689, test_f1: 0.2285
 epoch: 3, train_loss: 1.2498, test_loss: 1.2397, test_f1: 0.2270
 epoch: 4, train_loss: 1.2371, test_loss: 1.2230, test_f1: 0.2461
 epoch: 5, train_loss: 1.2268, test_loss: 1.2102, test_f1: 0.2616
 epoch: 6, train_loss: 1.2183, test_loss: 1.1988, test_f1: 0.2990
 epoch: 7, train_loss: 1.2055, test_loss: 1.1831, test_f1: 0.3057
 epoch: 8, train_loss: 1.1999, test_loss: 1.1707, test_f1: 0.3428
 epoch: 9, train_loss: 1.1821, test_loss: 1.1581, test_f1: 0.3565
 epoch: 10, train_loss: 1.1783, test_loss: 1.1471, test_f1: 0.3780
 epoch: 11, train_loss: 1.1656, test_loss: 1.1340, test_f1: 0.3953
 epoch: 12, train_loss: 1.1595, test_loss: 1.1225, test_f1: 0.4197
 epoch: 13, train_loss: 1.1509, test_loss: 1.1122, test_f1: 0.4273
 epoch: 14, train_loss: 1.1443, test_loss: 1.1029, test_f1: 0.4344
 epoch: 15, train_loss: 1.1316, test_loss: 1.0933, test_f1: 0.4361
 epoch: 16, train_loss: 1.1237, test_loss: 1.0810, test_f1: 0.4340
 epoch: 17, train_loss: 1.1188, test_loss: 1.0773, test_f1: 0.4332
 epoch: 18, train_loss: 1.1008, test_loss: 1.0617, test_f1: 0.4318
 epoch: 19, train_loss: 1.1004, test_loss: 1.0617, test_f1: 0.4445
 epoch: 20, train_loss: 1.0930, test_loss: 1.0491, test_f1: 0.4444
 epoch: 21, train_loss: 1.0841, test_loss: 1.0450, test_f1: 0.4509
 epoch: 22, train_loss: 1.0749, test_loss: 1.0366, test_f1: 0.4549
 epoch: 23, train_loss: 1.0646, test_loss: 1.0292, test_f1: 0.4508
 epoch: 24, train_loss: 1.0591, test_loss: 1.0232, test_f1: 0.4475
 epoch: 25, train_loss: 1.0474, test_loss: 1.0214, test_f1: 0.4482
 epoch: 26, train_loss: 1.0548, test_loss: 1.0094, test_f1: 0.4683
 epoch: 27, train_loss: 1.0397, test_loss: 1.0048, test_f1: 0.4634
 epoch: 28, train_loss: 1.0307, test_loss: 1.0026, test_f1: 0.4663
 epoch: 29, train_loss: 1.0287, test_loss: 0.9970, test_f1: 0.4682
 epoch: 30, train_loss: 1.0165, test_loss: 0.9898, test_f1: 0.4683
 epoch: 31, train_loss: 1.0103, test_loss: 0.9870, test_f1: 0.4720
 epoch: 32, train_loss: 1.0014, test_loss: 0.9812, test_f1: 0.4775
 epoch: 33, train_loss: 0.9992, test_loss: 0.9829, test_f1: 0.4742
 epoch: 34, train_loss: 1.0064, test_loss: 0.9814, test_f1: 0.4865
 epoch: 35, train_loss: 0.9964, test_loss: 0.9764, test_f1: 0.4766
 epoch: 36, train_loss: 0.9867, test_loss: 0.9761, test_f1: 0.4843
 epoch: 37, train_loss: 0.9827, test_loss: 0.9757, test_f1: 0.4863
 epoch: 38, train_loss: 0.9814, test_loss: 0.9737, test_f1: 0.4865
 epoch: 39, train_loss: 0.9736, test_loss: 0.9679, test_f1: 0.4925
 epoch: 40, train_loss: 0.9655, test_loss: 0.9673, test_f1: 0.4915
 epoch: 41, train_loss: 0.9607, test_loss: 0.9617, test_f1: 0.4940
 epoch: 42, train_loss: 0.9546, test_loss: 0.9582, test_f1: 0.4968
 epoch: 43, train_loss: 0.9564, test_loss: 0.9651, test_f1: 0.4927
 epoch: 44, train_loss: 0.9558, test_loss: 0.9588, test_f1: 0.4986
 epoch: 45, train_loss: 0.9486, test_loss: 0.9583, test_f1: 0.4955
 epoch: 46, train_loss: 0.9462, test_loss: 0.9609, test_f1: 0.5012
 epoch: 47, train_loss: 0.9411, test_loss: 0.9517, test_f1: 0.5038
 epoch: 48, train_loss: 0.9371, test_loss: 0.9486, test_f1: 0.4982
 epoch: 49, train_loss: 0.9456, test_loss: 0.9501, test_f1: 0.5027
 epoch: 50, train_loss: 0.9398, test_loss: 0.9542, test_f1: 0.4995
 epoch: 51, train_loss: 0.9353, test_loss: 0.9475, test_f1: 0.4957
 epoch: 52, train_loss: 0.9234, test_loss: 0.9502, test_f1: 0.5024
 epoch: 53, train_loss: 0.9346, test_loss: 0.9491, test_f1: 0.4980
 epoch: 54, train_loss: 0.9253, test_loss: 0.9426, test_f1: 0.5042
 epoch: 55, train_loss: 0.9313, test_loss: 0.9494, test_f1: 0.5002
 epoch: 56, train_loss: 0.9131, test_loss: 0.9417, test_f1: 0.5048
 epoch: 57, train_loss: 0.9231, test_loss: 0.9490, test_f1: 0.5059
 epoch: 58, train_loss: 0.9199, test_loss: 0.9432, test_f1: 0.5036
 epoch: 59, train_loss: 0.9173, test_loss: 0.9459, test_f1: 0.5042
 epoch: 60, train_loss: 0.9201, test_loss: 0.9411, test_f1: 0.5134
 epoch: 61, train_loss: 0.9169, test_loss: 0.9415, test_f1: 0.5057
 epoch: 62, train_loss: 0.9126, test_loss: 0.9464, test_f1: 0.4982
 epoch: 63, train_loss: 0.9218, test_loss: 0.9396, test_f1: 0.5111
 epoch: 64, train_loss: 0.9101, test_loss: 0.9375, test_f1: 0.5149
 epoch: 65, train_loss: 0.9186, test_loss: 0.9475, test_f1: 0.5076
 epoch: 66, train_loss: 0.9130, test_loss: 0.9480, test_f1: 0.5117
 epoch: 67, train_loss: 0.9122, test_loss: 0.9538, test_f1: 0.4991
 epoch: 68, train_loss: 0.9074, test_loss: 0.9458, test_f1: 0.5105
 epoch: 69, train_loss: 0.9012, test_loss: 0.9465, test_f1: 0.5129
 epoch: 70, train_loss: 0.9061, test_loss: 0.9445, test_f1: 0.5003
 epoch: 71, train_loss: 0.9030, test_loss: 0.9514, test_f1: 0.4966
 epoch: 72, train_loss: 0.9081, test_loss: 0.9471, test_f1: 0.5071
 epoch: 73, train_loss: 0.9069, test_loss: 0.9442, test_f1: 0.5003
 epoch: 74, train_loss: 0.9031, test_loss: 0.9392, test_f1: 0.5079
 epoch: 75, train_loss: 0.8997, test_loss: 0.9387, test_f1: 0.5098
 epoch: 76, train_loss: 0.8985, test_loss: 0.9440, test_f1: 0.5009
 epoch: 77, train_loss: 0.8995, test_loss: 0.9363, test_f1: 0.5107
 epoch: 78, train_loss: 0.8942, test_loss: 0.9399, test_f1: 0.5113
 epoch: 79, train_loss: 0.8937, test_loss: 0.9442, test_f1: 0.4969
 epoch: 80, train_loss: 0.8961, test_loss: 0.9431, test_f1: 0.5031
 epoch: 81, train_loss: 0.8947, test_loss: 0.9397, test_f1: 0.5066
 epoch: 82, train_loss: 0.8968, test_loss: 0.9457, test_f1: 0.5000
 epoch: 83, train_loss: 0.8901, test_loss: 0.9409, test_f1: 0.5127
 epoch: 84, train_loss: 0.8974, test_loss: 0.9466, test_f1: 0.5048
 epoch: 85, train_loss: 0.8993, test_loss: 0.9378, test_f1: 0.5165
 epoch: 86, train_loss: 0.8818, test_loss: 0.9406, test_f1: 0.5091
 epoch: 87, train_loss: 0.8783, test_loss: 0.9419, test_f1: 0.5035
 epoch: 88, train_loss: 0.8849, test_loss: 0.9392, test_f1: 0.5109
 epoch: 89, train_loss: 0.8879, test_loss: 0.9427, test_f1: 0.5062
 epoch: 90, train_loss: 0.8841, test_loss: 0.9445, test_f1: 0.5106
 epoch: 91, train_loss: 0.8718, test_loss: 0.9403, test_f1: 0.5016
 epoch: 92, train_loss: 0.8797, test_loss: 0.9438, test_f1: 0.5065
 epoch: 93, train_loss: 0.8835, test_loss: 0.9462, test_f1: 0.5051
 epoch: 94, train_loss: 0.8807, test_loss: 0.9463, test_f1: 0.5032
 epoch: 95, train_loss: 0.8825, test_loss: 0.9538, test_f1: 0.5022
 epoch: 96, train_loss: 0.8780, test_loss: 0.9415, test_f1: 0.4957
 epoch: 97, train_loss: 0.8833, test_loss: 0.9461, test_f1: 0.5108
 epoch: 98, train_loss: 0.8858, test_loss: 0.9558, test_f1: 0.5052
 epoch: 99, train_loss: 0.8741, test_loss: 0.9496, test_f1: 0.4953
##################ITERATION #4 ****************************************
 epoch: 0, train_loss: 1.2937, test_loss: 1.3444, test_f1: 0.2270
 epoch: 1, train_loss: 1.2508, test_loss: 1.2702, test_f1: 0.3491
 epoch: 2, train_loss: 1.2422, test_loss: 1.2101, test_f1: 0.3607
 epoch: 3, train_loss: 1.2232, test_loss: 1.1823, test_f1: 0.3712
 epoch: 4, train_loss: 1.2088, test_loss: 1.1634, test_f1: 0.3806
 epoch: 5, train_loss: 1.1995, test_loss: 1.1484, test_f1: 0.3868
 epoch: 6, train_loss: 1.1801, test_loss: 1.1287, test_f1: 0.3917
 epoch: 7, train_loss: 1.1666, test_loss: 1.1113, test_f1: 0.3964
 epoch: 8, train_loss: 1.1538, test_loss: 1.1000, test_f1: 0.4059
 epoch: 9, train_loss: 1.1542, test_loss: 1.0889, test_f1: 0.4185
 epoch: 10, train_loss: 1.1352, test_loss: 1.0751, test_f1: 0.4409
 epoch: 11, train_loss: 1.1295, test_loss: 1.0650, test_f1: 0.4419
 epoch: 12, train_loss: 1.1120, test_loss: 1.0514, test_f1: 0.4510
 epoch: 13, train_loss: 1.1085, test_loss: 1.0375, test_f1: 0.4575
 epoch: 14, train_loss: 1.0970, test_loss: 1.0206, test_f1: 0.4752
 epoch: 15, train_loss: 1.0864, test_loss: 1.0127, test_f1: 0.4886
 epoch: 16, train_loss: 1.0781, test_loss: 1.0020, test_f1: 0.4940
 epoch: 17, train_loss: 1.0742, test_loss: 0.9940, test_f1: 0.4937
 epoch: 18, train_loss: 1.0625, test_loss: 0.9877, test_f1: 0.4911
 epoch: 19, train_loss: 1.0560, test_loss: 0.9798, test_f1: 0.4926
 epoch: 20, train_loss: 1.0454, test_loss: 0.9691, test_f1: 0.4918
 epoch: 21, train_loss: 1.0395, test_loss: 0.9607, test_f1: 0.4965
 epoch: 22, train_loss: 1.0262, test_loss: 0.9544, test_f1: 0.5004
 epoch: 23, train_loss: 1.0248, test_loss: 0.9528, test_f1: 0.4995
 epoch: 24, train_loss: 1.0108, test_loss: 0.9465, test_f1: 0.4985
 epoch: 25, train_loss: 1.0120, test_loss: 0.9415, test_f1: 0.5034
 epoch: 26, train_loss: 1.0016, test_loss: 0.9361, test_f1: 0.5059
 epoch: 27, train_loss: 0.9944, test_loss: 0.9367, test_f1: 0.5018
 epoch: 28, train_loss: 0.9983, test_loss: 0.9278, test_f1: 0.5048
 epoch: 29, train_loss: 0.9857, test_loss: 0.9288, test_f1: 0.5076
 epoch: 30, train_loss: 0.9763, test_loss: 0.9284, test_f1: 0.5085
 epoch: 31, train_loss: 0.9806, test_loss: 0.9186, test_f1: 0.5073
 epoch: 32, train_loss: 0.9723, test_loss: 0.9188, test_f1: 0.5021
 epoch: 33, train_loss: 0.9618, test_loss: 0.9141, test_f1: 0.5148
 epoch: 34, train_loss: 0.9732, test_loss: 0.9150, test_f1: 0.5238
 epoch: 35, train_loss: 0.9582, test_loss: 0.9070, test_f1: 0.5228
 epoch: 36, train_loss: 0.9632, test_loss: 0.9049, test_f1: 0.5251
 epoch: 37, train_loss: 0.9463, test_loss: 0.9091, test_f1: 0.5277
 epoch: 38, train_loss: 0.9565, test_loss: 0.9064, test_f1: 0.5325
 epoch: 39, train_loss: 0.9370, test_loss: 0.9062, test_f1: 0.5246
 epoch: 40, train_loss: 0.9404, test_loss: 0.9059, test_f1: 0.5284
 epoch: 41, train_loss: 0.9303, test_loss: 0.9092, test_f1: 0.5276
 epoch: 42, train_loss: 0.9388, test_loss: 0.9078, test_f1: 0.5288
 epoch: 43, train_loss: 0.9321, test_loss: 0.9054, test_f1: 0.5305
 epoch: 44, train_loss: 0.9188, test_loss: 0.9052, test_f1: 0.5290
 epoch: 45, train_loss: 0.9256, test_loss: 0.9013, test_f1: 0.5230
 epoch: 46, train_loss: 0.9223, test_loss: 0.9011, test_f1: 0.5273
 epoch: 47, train_loss: 0.9241, test_loss: 0.9059, test_f1: 0.5305
 epoch: 48, train_loss: 0.9151, test_loss: 0.9039, test_f1: 0.5259
 epoch: 49, train_loss: 0.9159, test_loss: 0.8969, test_f1: 0.5291
 epoch: 50, train_loss: 0.9119, test_loss: 0.9028, test_f1: 0.5344
 epoch: 51, train_loss: 0.9159, test_loss: 0.9018, test_f1: 0.5336
 epoch: 52, train_loss: 0.9020, test_loss: 0.9001, test_f1: 0.5300
 epoch: 53, train_loss: 0.8952, test_loss: 0.8960, test_f1: 0.5298
 epoch: 54, train_loss: 0.9014, test_loss: 0.9015, test_f1: 0.5288
 epoch: 55, train_loss: 0.8983, test_loss: 0.9058, test_f1: 0.5218
 epoch: 56, train_loss: 0.8877, test_loss: 0.9046, test_f1: 0.5258
 epoch: 57, train_loss: 0.8994, test_loss: 0.9030, test_f1: 0.5243
 epoch: 58, train_loss: 0.9045, test_loss: 0.9055, test_f1: 0.5308
 epoch: 59, train_loss: 0.8998, test_loss: 0.9009, test_f1: 0.5330
 epoch: 60, train_loss: 0.8940, test_loss: 0.9099, test_f1: 0.5307
 epoch: 61, train_loss: 0.8939, test_loss: 0.8961, test_f1: 0.5370
 epoch: 62, train_loss: 0.8949, test_loss: 0.8986, test_f1: 0.5326
 epoch: 63, train_loss: 0.8860, test_loss: 0.9067, test_f1: 0.5332
 epoch: 64, train_loss: 0.8860, test_loss: 0.9080, test_f1: 0.5188
 epoch: 65, train_loss: 0.8828, test_loss: 0.9135, test_f1: 0.5262
 epoch: 66, train_loss: 0.8894, test_loss: 0.9034, test_f1: 0.5192
 epoch: 67, train_loss: 0.8795, test_loss: 0.9048, test_f1: 0.5294
 epoch: 68, train_loss: 0.8849, test_loss: 0.9089, test_f1: 0.5298
 epoch: 69, train_loss: 0.8789, test_loss: 0.9138, test_f1: 0.5226
 epoch: 70, train_loss: 0.8725, test_loss: 0.9109, test_f1: 0.5198
 epoch: 71, train_loss: 0.8738, test_loss: 0.9125, test_f1: 0.5200
 epoch: 72, train_loss: 0.8756, test_loss: 0.9089, test_f1: 0.5213
 epoch: 73, train_loss: 0.8793, test_loss: 0.9129, test_f1: 0.5220
 epoch: 74, train_loss: 0.8772, test_loss: 0.9132, test_f1: 0.5203
 epoch: 75, train_loss: 0.8767, test_loss: 0.9100, test_f1: 0.5219
 epoch: 76, train_loss: 0.8777, test_loss: 0.9111, test_f1: 0.5222
 epoch: 77, train_loss: 0.8754, test_loss: 0.9178, test_f1: 0.5178
 epoch: 78, train_loss: 0.8679, test_loss: 0.9149, test_f1: 0.5215
 epoch: 79, train_loss: 0.8796, test_loss: 0.9194, test_f1: 0.5210
 epoch: 80, train_loss: 0.8838, test_loss: 0.9203, test_f1: 0.5184
 epoch: 81, train_loss: 0.8700, test_loss: 0.9151, test_f1: 0.5247
 epoch: 82, train_loss: 0.8623, test_loss: 0.9212, test_f1: 0.5213
 epoch: 83, train_loss: 0.8682, test_loss: 0.9146, test_f1: 0.5179
 epoch: 84, train_loss: 0.8729, test_loss: 0.9109, test_f1: 0.5157
 epoch: 85, train_loss: 0.8723, test_loss: 0.9154, test_f1: 0.5230
 epoch: 86, train_loss: 0.8557, test_loss: 0.9152, test_f1: 0.5219
 epoch: 87, train_loss: 0.8611, test_loss: 0.9245, test_f1: 0.5205
 epoch: 88, train_loss: 0.8716, test_loss: 0.9171, test_f1: 0.5301
 epoch: 89, train_loss: 0.8674, test_loss: 0.9166, test_f1: 0.5280
 epoch: 90, train_loss: 0.8671, test_loss: 0.9142, test_f1: 0.5219
 epoch: 91, train_loss: 0.8693, test_loss: 0.9209, test_f1: 0.5168
 epoch: 92, train_loss: 0.8623, test_loss: 0.9157, test_f1: 0.5180
 epoch: 93, train_loss: 0.8449, test_loss: 0.9274, test_f1: 0.5195
 epoch: 94, train_loss: 0.8620, test_loss: 0.9223, test_f1: 0.5229
 epoch: 95, train_loss: 0.8622, test_loss: 0.9169, test_f1: 0.5267
 epoch: 96, train_loss: 0.8534, test_loss: 0.9244, test_f1: 0.5240
 epoch: 97, train_loss: 0.8541, test_loss: 0.9328, test_f1: 0.5231
 epoch: 98, train_loss: 0.8593, test_loss: 0.9310, test_f1: 0.5186
 epoch: 99, train_loss: 0.8577, test_loss: 0.9204, test_f1: 0.5250
##################ITERATION #5 ****************************************
 epoch: 0, train_loss: 1.3007, test_loss: 1.3732, test_f1: 0.2257
 epoch: 1, train_loss: 1.2625, test_loss: 1.2828, test_f1: 0.2736
 epoch: 2, train_loss: 1.2434, test_loss: 1.2397, test_f1: 0.2600
 epoch: 3, train_loss: 1.2341, test_loss: 1.2100, test_f1: 0.3027
 epoch: 4, train_loss: 1.2228, test_loss: 1.1836, test_f1: 0.3202
 epoch: 5, train_loss: 1.2095, test_loss: 1.1727, test_f1: 0.3412
 epoch: 6, train_loss: 1.1967, test_loss: 1.1626, test_f1: 0.3845
 epoch: 7, train_loss: 1.1850, test_loss: 1.1427, test_f1: 0.4002
 epoch: 8, train_loss: 1.1717, test_loss: 1.1339, test_f1: 0.4120
 epoch: 9, train_loss: 1.1684, test_loss: 1.1193, test_f1: 0.4238
 epoch: 10, train_loss: 1.1535, test_loss: 1.1046, test_f1: 0.4386
 epoch: 11, train_loss: 1.1434, test_loss: 1.0924, test_f1: 0.4427
 epoch: 12, train_loss: 1.1370, test_loss: 1.0825, test_f1: 0.4478
 epoch: 13, train_loss: 1.1316, test_loss: 1.0695, test_f1: 0.4511
 epoch: 14, train_loss: 1.1117, test_loss: 1.0677, test_f1: 0.4614
 epoch: 15, train_loss: 1.1058, test_loss: 1.0485, test_f1: 0.4509
 epoch: 16, train_loss: 1.0953, test_loss: 1.0344, test_f1: 0.4676
 epoch: 17, train_loss: 1.0881, test_loss: 1.0284, test_f1: 0.4694
 epoch: 18, train_loss: 1.0832, test_loss: 1.0220, test_f1: 0.4545
 epoch: 19, train_loss: 1.0666, test_loss: 1.0164, test_f1: 0.4620
 epoch: 20, train_loss: 1.0620, test_loss: 1.0102, test_f1: 0.4673
 epoch: 21, train_loss: 1.0544, test_loss: 1.0000, test_f1: 0.4600
 epoch: 22, train_loss: 1.0513, test_loss: 0.9972, test_f1: 0.4605
 epoch: 23, train_loss: 1.0410, test_loss: 0.9849, test_f1: 0.4618
 epoch: 24, train_loss: 1.0300, test_loss: 0.9773, test_f1: 0.4603
 epoch: 25, train_loss: 1.0347, test_loss: 0.9806, test_f1: 0.4753
 epoch: 26, train_loss: 1.0231, test_loss: 0.9716, test_f1: 0.4614
 epoch: 27, train_loss: 1.0252, test_loss: 0.9726, test_f1: 0.4858
 epoch: 28, train_loss: 1.0123, test_loss: 0.9621, test_f1: 0.4640
 epoch: 29, train_loss: 1.0125, test_loss: 0.9522, test_f1: 0.4831
 epoch: 30, train_loss: 1.0037, test_loss: 0.9494, test_f1: 0.4908
 epoch: 31, train_loss: 0.9901, test_loss: 0.9561, test_f1: 0.4948
 epoch: 32, train_loss: 1.0033, test_loss: 0.9655, test_f1: 0.4752
 epoch: 33, train_loss: 0.9928, test_loss: 0.9549, test_f1: 0.4933
 epoch: 34, train_loss: 0.9877, test_loss: 0.9456, test_f1: 0.4985
 epoch: 35, train_loss: 0.9862, test_loss: 0.9599, test_f1: 0.4779
 epoch: 36, train_loss: 0.9837, test_loss: 0.9395, test_f1: 0.4949
 epoch: 37, train_loss: 0.9759, test_loss: 0.9560, test_f1: 0.4888
 epoch: 38, train_loss: 0.9637, test_loss: 0.9445, test_f1: 0.4889
 epoch: 39, train_loss: 0.9640, test_loss: 0.9476, test_f1: 0.4830
 epoch: 40, train_loss: 0.9635, test_loss: 0.9473, test_f1: 0.4945
 epoch: 41, train_loss: 0.9626, test_loss: 0.9553, test_f1: 0.4987
 epoch: 42, train_loss: 0.9685, test_loss: 0.9406, test_f1: 0.5165
 epoch: 43, train_loss: 0.9595, test_loss: 0.9324, test_f1: 0.4899
 epoch: 44, train_loss: 0.9532, test_loss: 0.9522, test_f1: 0.5045
 epoch: 45, train_loss: 0.9450, test_loss: 0.9394, test_f1: 0.5120
 epoch: 46, train_loss: 0.9404, test_loss: 0.9341, test_f1: 0.4934
 epoch: 47, train_loss: 0.9398, test_loss: 0.9372, test_f1: 0.4943
 epoch: 48, train_loss: 0.9449, test_loss: 0.9700, test_f1: 0.5101
 epoch: 49, train_loss: 0.9372, test_loss: 0.9481, test_f1: 0.4968
 epoch: 50, train_loss: 0.9357, test_loss: 0.9353, test_f1: 0.5288
 epoch: 51, train_loss: 0.9381, test_loss: 0.9388, test_f1: 0.5309
 epoch: 52, train_loss: 0.9292, test_loss: 0.9406, test_f1: 0.5166
 epoch: 53, train_loss: 0.9239, test_loss: 0.9378, test_f1: 0.5215
 epoch: 54, train_loss: 0.9233, test_loss: 0.9412, test_f1: 0.5086
 epoch: 55, train_loss: 0.9282, test_loss: 0.9466, test_f1: 0.5217
 epoch: 56, train_loss: 0.9290, test_loss: 0.9457, test_f1: 0.5094
 epoch: 57, train_loss: 0.9164, test_loss: 0.9398, test_f1: 0.5278
 epoch: 58, train_loss: 0.9241, test_loss: 0.9361, test_f1: 0.5145
 epoch: 59, train_loss: 0.9226, test_loss: 0.9298, test_f1: 0.5247
 epoch: 60, train_loss: 0.9126, test_loss: 0.9434, test_f1: 0.5086
 epoch: 61, train_loss: 0.9172, test_loss: 0.9318, test_f1: 0.5354
 epoch: 62, train_loss: 0.9179, test_loss: 0.9421, test_f1: 0.5203
 epoch: 63, train_loss: 0.9159, test_loss: 0.9455, test_f1: 0.5040
 epoch: 64, train_loss: 0.9214, test_loss: 0.9345, test_f1: 0.5213
 epoch: 65, train_loss: 0.9102, test_loss: 0.9387, test_f1: 0.5047
 epoch: 66, train_loss: 0.9100, test_loss: 0.9391, test_f1: 0.5353
 epoch: 67, train_loss: 0.9088, test_loss: 0.9444, test_f1: 0.5046
 epoch: 68, train_loss: 0.9113, test_loss: 0.9347, test_f1: 0.5190
 epoch: 69, train_loss: 0.9010, test_loss: 0.9363, test_f1: 0.5131
 epoch: 70, train_loss: 0.9071, test_loss: 0.9428, test_f1: 0.5247
 epoch: 71, train_loss: 0.9127, test_loss: 0.9340, test_f1: 0.5253
 epoch: 72, train_loss: 0.9041, test_loss: 0.9319, test_f1: 0.5106
 epoch: 73, train_loss: 0.8992, test_loss: 0.9337, test_f1: 0.5240
 epoch: 74, train_loss: 0.9063, test_loss: 0.9338, test_f1: 0.5361
 epoch: 75, train_loss: 0.9131, test_loss: 0.9451, test_f1: 0.5284
 epoch: 76, train_loss: 0.8991, test_loss: 0.9341, test_f1: 0.5276
 epoch: 77, train_loss: 0.8937, test_loss: 0.9459, test_f1: 0.5201
 epoch: 78, train_loss: 0.9080, test_loss: 0.9339, test_f1: 0.5395
 epoch: 79, train_loss: 0.9000, test_loss: 0.9354, test_f1: 0.5121
 epoch: 80, train_loss: 0.8990, test_loss: 0.9261, test_f1: 0.5353
 epoch: 81, train_loss: 0.8928, test_loss: 0.9406, test_f1: 0.5378
 epoch: 82, train_loss: 0.9020, test_loss: 0.9234, test_f1: 0.5373
 epoch: 83, train_loss: 0.8964, test_loss: 0.9367, test_f1: 0.5316
 epoch: 84, train_loss: 0.8900, test_loss: 0.9397, test_f1: 0.5171
 epoch: 85, train_loss: 0.8887, test_loss: 0.9386, test_f1: 0.5358
 epoch: 86, train_loss: 0.8962, test_loss: 0.9366, test_f1: 0.5431
 epoch: 87, train_loss: 0.8834, test_loss: 0.9367, test_f1: 0.5306
 epoch: 88, train_loss: 0.8899, test_loss: 0.9363, test_f1: 0.5344
 epoch: 89, train_loss: 0.8982, test_loss: 0.9379, test_f1: 0.5466
 epoch: 90, train_loss: 0.8800, test_loss: 0.9303, test_f1: 0.5271
 epoch: 91, train_loss: 0.8917, test_loss: 0.9348, test_f1: 0.5266
 epoch: 92, train_loss: 0.8824, test_loss: 0.9282, test_f1: 0.5483
 epoch: 93, train_loss: 0.8882, test_loss: 0.9319, test_f1: 0.5321
 epoch: 94, train_loss: 0.8878, test_loss: 0.9600, test_f1: 0.5387
 epoch: 95, train_loss: 0.8907, test_loss: 0.9343, test_f1: 0.5303
 epoch: 96, train_loss: 0.8889, test_loss: 0.9303, test_f1: 0.5380
 epoch: 97, train_loss: 0.8727, test_loss: 0.9472, test_f1: 0.5403
 epoch: 98, train_loss: 0.8790, test_loss: 0.9425, test_f1: 0.5446
 epoch: 99, train_loss: 0.8746, test_loss: 0.9471, test_f1: 0.5332
##################ITERATION #6 ****************************************
 epoch: 0, train_loss: 1.3291, test_loss: 1.3066, test_f1: 0.2270
 epoch: 1, train_loss: 1.2679, test_loss: 1.2469, test_f1: 0.2742
 epoch: 2, train_loss: 1.2534, test_loss: 1.2171, test_f1: 0.2985
 epoch: 3, train_loss: 1.2281, test_loss: 1.1977, test_f1: 0.2974
 epoch: 4, train_loss: 1.2075, test_loss: 1.1824, test_f1: 0.3055
 epoch: 5, train_loss: 1.1987, test_loss: 1.1724, test_f1: 0.3361
 epoch: 6, train_loss: 1.1892, test_loss: 1.1569, test_f1: 0.3652
 epoch: 7, train_loss: 1.1693, test_loss: 1.1412, test_f1: 0.3879
 epoch: 8, train_loss: 1.1637, test_loss: 1.1276, test_f1: 0.3952
 epoch: 9, train_loss: 1.1576, test_loss: 1.1131, test_f1: 0.4054
 epoch: 10, train_loss: 1.1382, test_loss: 1.1001, test_f1: 0.4136
 epoch: 11, train_loss: 1.1270, test_loss: 1.0886, test_f1: 0.4313
 epoch: 12, train_loss: 1.1197, test_loss: 1.0727, test_f1: 0.4355
 epoch: 13, train_loss: 1.0986, test_loss: 1.0633, test_f1: 0.4444
 epoch: 14, train_loss: 1.0991, test_loss: 1.0524, test_f1: 0.4462
 epoch: 15, train_loss: 1.0943, test_loss: 1.0436, test_f1: 0.4520
 epoch: 16, train_loss: 1.0840, test_loss: 1.0358, test_f1: 0.4435
 epoch: 17, train_loss: 1.0748, test_loss: 1.0237, test_f1: 0.4480
 epoch: 18, train_loss: 1.0659, test_loss: 1.0170, test_f1: 0.4472
 epoch: 19, train_loss: 1.0574, test_loss: 1.0108, test_f1: 0.4513
 epoch: 20, train_loss: 1.0449, test_loss: 1.0046, test_f1: 0.4536
 epoch: 21, train_loss: 1.0450, test_loss: 0.9949, test_f1: 0.4580
 epoch: 22, train_loss: 1.0381, test_loss: 0.9945, test_f1: 0.4560
 epoch: 23, train_loss: 1.0401, test_loss: 0.9907, test_f1: 0.4598
 epoch: 24, train_loss: 1.0270, test_loss: 0.9806, test_f1: 0.4587
 epoch: 25, train_loss: 1.0226, test_loss: 0.9832, test_f1: 0.4594
 epoch: 26, train_loss: 1.0155, test_loss: 0.9814, test_f1: 0.4637
 epoch: 27, train_loss: 1.0117, test_loss: 0.9800, test_f1: 0.4648
 epoch: 28, train_loss: 1.0148, test_loss: 0.9724, test_f1: 0.4690
 epoch: 29, train_loss: 1.0049, test_loss: 0.9724, test_f1: 0.4644
 epoch: 30, train_loss: 1.0059, test_loss: 0.9709, test_f1: 0.4735
 epoch: 31, train_loss: 0.9975, test_loss: 0.9662, test_f1: 0.4736
 epoch: 32, train_loss: 0.9978, test_loss: 0.9625, test_f1: 0.4711
 epoch: 33, train_loss: 0.9886, test_loss: 0.9631, test_f1: 0.4775
 epoch: 34, train_loss: 0.9871, test_loss: 0.9581, test_f1: 0.4843
 epoch: 35, train_loss: 0.9845, test_loss: 0.9636, test_f1: 0.4813
 epoch: 36, train_loss: 0.9742, test_loss: 0.9640, test_f1: 0.4818
 epoch: 37, train_loss: 0.9710, test_loss: 0.9577, test_f1: 0.4786
 epoch: 38, train_loss: 0.9755, test_loss: 0.9651, test_f1: 0.4866
 epoch: 39, train_loss: 0.9624, test_loss: 0.9565, test_f1: 0.4802
 epoch: 40, train_loss: 0.9660, test_loss: 0.9526, test_f1: 0.4869
 epoch: 41, train_loss: 0.9614, test_loss: 0.9570, test_f1: 0.4950
 epoch: 42, train_loss: 0.9661, test_loss: 0.9480, test_f1: 0.4872
 epoch: 43, train_loss: 0.9571, test_loss: 0.9465, test_f1: 0.4958
 epoch: 44, train_loss: 0.9587, test_loss: 0.9410, test_f1: 0.4999
 epoch: 45, train_loss: 0.9547, test_loss: 0.9487, test_f1: 0.4986
 epoch: 46, train_loss: 0.9464, test_loss: 0.9468, test_f1: 0.4949
 epoch: 47, train_loss: 0.9523, test_loss: 0.9480, test_f1: 0.4944
 epoch: 48, train_loss: 0.9544, test_loss: 0.9546, test_f1: 0.4940
 epoch: 49, train_loss: 0.9442, test_loss: 0.9529, test_f1: 0.5033
 epoch: 50, train_loss: 0.9426, test_loss: 0.9562, test_f1: 0.4779
 epoch: 51, train_loss: 0.9420, test_loss: 0.9497, test_f1: 0.5022
 epoch: 52, train_loss: 0.9413, test_loss: 0.9499, test_f1: 0.4965
 epoch: 53, train_loss: 0.9439, test_loss: 0.9485, test_f1: 0.5049
 epoch: 54, train_loss: 0.9317, test_loss: 0.9452, test_f1: 0.5017
 epoch: 55, train_loss: 0.9387, test_loss: 0.9471, test_f1: 0.5064
 epoch: 56, train_loss: 0.9266, test_loss: 0.9494, test_f1: 0.4990
 epoch: 57, train_loss: 0.9358, test_loss: 0.9526, test_f1: 0.4986
 epoch: 58, train_loss: 0.9292, test_loss: 0.9465, test_f1: 0.4974
 epoch: 59, train_loss: 0.9395, test_loss: 0.9529, test_f1: 0.5029
 epoch: 60, train_loss: 0.9309, test_loss: 0.9479, test_f1: 0.5052
 epoch: 61, train_loss: 0.9347, test_loss: 0.9506, test_f1: 0.5004
 epoch: 62, train_loss: 0.9357, test_loss: 0.9422, test_f1: 0.4985
 epoch: 63, train_loss: 0.9381, test_loss: 0.9436, test_f1: 0.4950
 epoch: 64, train_loss: 0.9403, test_loss: 0.9461, test_f1: 0.5014
 epoch: 65, train_loss: 0.9273, test_loss: 0.9474, test_f1: 0.5000
 epoch: 66, train_loss: 0.9304, test_loss: 0.9435, test_f1: 0.5009
 epoch: 67, train_loss: 0.9290, test_loss: 0.9435, test_f1: 0.5021
 epoch: 68, train_loss: 0.9241, test_loss: 0.9453, test_f1: 0.4993
 epoch: 69, train_loss: 0.9243, test_loss: 0.9480, test_f1: 0.5027
 epoch: 70, train_loss: 0.9255, test_loss: 0.9437, test_f1: 0.4974
 epoch: 71, train_loss: 0.9234, test_loss: 0.9483, test_f1: 0.5007
 epoch: 72, train_loss: 0.9237, test_loss: 0.9467, test_f1: 0.4990
 epoch: 73, train_loss: 0.9233, test_loss: 0.9448, test_f1: 0.5012
 epoch: 74, train_loss: 0.9299, test_loss: 0.9474, test_f1: 0.5027
 epoch: 75, train_loss: 0.9105, test_loss: 0.9540, test_f1: 0.5006
 epoch: 76, train_loss: 0.9182, test_loss: 0.9471, test_f1: 0.5094
 epoch: 77, train_loss: 0.9186, test_loss: 0.9448, test_f1: 0.5075
 epoch: 78, train_loss: 0.9175, test_loss: 0.9482, test_f1: 0.5050
 epoch: 79, train_loss: 0.9218, test_loss: 0.9402, test_f1: 0.5101
 epoch: 80, train_loss: 0.9181, test_loss: 0.9484, test_f1: 0.5067
 epoch: 81, train_loss: 0.9163, test_loss: 0.9450, test_f1: 0.5081
 epoch: 82, train_loss: 0.9156, test_loss: 0.9321, test_f1: 0.5002
 epoch: 83, train_loss: 0.9193, test_loss: 0.9401, test_f1: 0.5049
 epoch: 84, train_loss: 0.9115, test_loss: 0.9427, test_f1: 0.5085
 epoch: 85, train_loss: 0.9200, test_loss: 0.9417, test_f1: 0.5095
 epoch: 86, train_loss: 0.9068, test_loss: 0.9466, test_f1: 0.5103
 epoch: 87, train_loss: 0.9131, test_loss: 0.9389, test_f1: 0.5071
 epoch: 88, train_loss: 0.9065, test_loss: 0.9450, test_f1: 0.5133
 epoch: 89, train_loss: 0.9159, test_loss: 0.9449, test_f1: 0.5106
 epoch: 90, train_loss: 0.9041, test_loss: 0.9498, test_f1: 0.5179
 epoch: 91, train_loss: 0.9171, test_loss: 0.9498, test_f1: 0.5176
 epoch: 92, train_loss: 0.9049, test_loss: 0.9499, test_f1: 0.5182
 epoch: 93, train_loss: 0.9161, test_loss: 0.9490, test_f1: 0.5143
 epoch: 94, train_loss: 0.8960, test_loss: 0.9445, test_f1: 0.5156
 epoch: 95, train_loss: 0.9046, test_loss: 0.9512, test_f1: 0.5197
 epoch: 96, train_loss: 0.9145, test_loss: 0.9539, test_f1: 0.5307
 epoch: 97, train_loss: 0.9055, test_loss: 0.9533, test_f1: 0.5174
 epoch: 98, train_loss: 0.9085, test_loss: 0.9509, test_f1: 0.5076
 epoch: 99, train_loss: 0.9021, test_loss: 0.9501, test_f1: 0.5194
##################ITERATION #7 ****************************************
 epoch: 0, train_loss: 1.3322, test_loss: 1.3022, test_f1: 0.2270
 epoch: 1, train_loss: 1.2808, test_loss: 1.2468, test_f1: 0.2527
 epoch: 2, train_loss: 1.2545, test_loss: 1.2235, test_f1: 0.2956
 epoch: 3, train_loss: 1.2281, test_loss: 1.2020, test_f1: 0.3009
 epoch: 4, train_loss: 1.2235, test_loss: 1.1830, test_f1: 0.3195
 epoch: 5, train_loss: 1.2046, test_loss: 1.1700, test_f1: 0.3412
 epoch: 6, train_loss: 1.1953, test_loss: 1.1549, test_f1: 0.3506
 epoch: 7, train_loss: 1.1861, test_loss: 1.1413, test_f1: 0.3684
 epoch: 8, train_loss: 1.1702, test_loss: 1.1307, test_f1: 0.3739
 epoch: 9, train_loss: 1.1588, test_loss: 1.1140, test_f1: 0.3847
 epoch: 10, train_loss: 1.1560, test_loss: 1.1104, test_f1: 0.3908
 epoch: 11, train_loss: 1.1334, test_loss: 1.0934, test_f1: 0.4066
 epoch: 12, train_loss: 1.1332, test_loss: 1.0837, test_f1: 0.4178
 epoch: 13, train_loss: 1.1207, test_loss: 1.0712, test_f1: 0.4273
 epoch: 14, train_loss: 1.1087, test_loss: 1.0620, test_f1: 0.4338
 epoch: 15, train_loss: 1.0970, test_loss: 1.0562, test_f1: 0.4370
 epoch: 16, train_loss: 1.0882, test_loss: 1.0358, test_f1: 0.4491
 epoch: 17, train_loss: 1.0854, test_loss: 1.0316, test_f1: 0.4527
 epoch: 18, train_loss: 1.0767, test_loss: 1.0228, test_f1: 0.4533
 epoch: 19, train_loss: 1.0658, test_loss: 1.0122, test_f1: 0.4486
 epoch: 20, train_loss: 1.0508, test_loss: 1.0067, test_f1: 0.4533
 epoch: 21, train_loss: 1.0451, test_loss: 0.9957, test_f1: 0.4611
 epoch: 22, train_loss: 1.0369, test_loss: 0.9869, test_f1: 0.4606
 epoch: 23, train_loss: 1.0358, test_loss: 0.9827, test_f1: 0.4631
 epoch: 24, train_loss: 1.0264, test_loss: 0.9752, test_f1: 0.4636
 epoch: 25, train_loss: 1.0215, test_loss: 0.9667, test_f1: 0.4827
 epoch: 26, train_loss: 1.0154, test_loss: 0.9746, test_f1: 0.4656
 epoch: 27, train_loss: 1.0147, test_loss: 0.9634, test_f1: 0.4843
 epoch: 28, train_loss: 1.0161, test_loss: 0.9575, test_f1: 0.4724
 epoch: 29, train_loss: 1.0024, test_loss: 0.9586, test_f1: 0.4885
 epoch: 30, train_loss: 0.9973, test_loss: 0.9505, test_f1: 0.4860
 epoch: 31, train_loss: 0.9915, test_loss: 0.9445, test_f1: 0.4856
 epoch: 32, train_loss: 0.9931, test_loss: 0.9460, test_f1: 0.5001
 epoch: 33, train_loss: 0.9831, test_loss: 0.9406, test_f1: 0.4941
 epoch: 34, train_loss: 0.9809, test_loss: 0.9388, test_f1: 0.4983
 epoch: 35, train_loss: 0.9782, test_loss: 0.9386, test_f1: 0.4984
 epoch: 36, train_loss: 0.9670, test_loss: 0.9299, test_f1: 0.4937
 epoch: 37, train_loss: 0.9698, test_loss: 0.9299, test_f1: 0.4925
 epoch: 38, train_loss: 0.9638, test_loss: 0.9236, test_f1: 0.4998
 epoch: 39, train_loss: 0.9600, test_loss: 0.9170, test_f1: 0.5011
 epoch: 40, train_loss: 0.9537, test_loss: 0.9142, test_f1: 0.5114
 epoch: 41, train_loss: 0.9580, test_loss: 0.9125, test_f1: 0.5071
 epoch: 42, train_loss: 0.9460, test_loss: 0.9214, test_f1: 0.4998
 epoch: 43, train_loss: 0.9524, test_loss: 0.9078, test_f1: 0.4959
 epoch: 44, train_loss: 0.9505, test_loss: 0.9073, test_f1: 0.4989
 epoch: 45, train_loss: 0.9427, test_loss: 0.9005, test_f1: 0.5143
 epoch: 46, train_loss: 0.9464, test_loss: 0.9080, test_f1: 0.5092
 epoch: 47, train_loss: 0.9297, test_loss: 0.9020, test_f1: 0.5245
 epoch: 48, train_loss: 0.9367, test_loss: 0.9011, test_f1: 0.5204
 epoch: 49, train_loss: 0.9360, test_loss: 0.8956, test_f1: 0.5311
 epoch: 50, train_loss: 0.9194, test_loss: 0.9035, test_f1: 0.5227
 epoch: 51, train_loss: 0.9310, test_loss: 0.8960, test_f1: 0.5256
 epoch: 52, train_loss: 0.9160, test_loss: 0.8921, test_f1: 0.5335
 epoch: 53, train_loss: 0.9205, test_loss: 0.8926, test_f1: 0.5291
 epoch: 54, train_loss: 0.9170, test_loss: 0.8923, test_f1: 0.5318
 epoch: 55, train_loss: 0.9108, test_loss: 0.8909, test_f1: 0.5278
 epoch: 56, train_loss: 0.9102, test_loss: 0.8941, test_f1: 0.5233
 epoch: 57, train_loss: 0.9185, test_loss: 0.8907, test_f1: 0.5350
 epoch: 58, train_loss: 0.9134, test_loss: 0.8931, test_f1: 0.5321
 epoch: 59, train_loss: 0.9136, test_loss: 0.8920, test_f1: 0.5312
 epoch: 60, train_loss: 0.9138, test_loss: 0.8877, test_f1: 0.5373
 epoch: 61, train_loss: 0.9111, test_loss: 0.8901, test_f1: 0.5352
 epoch: 62, train_loss: 0.9078, test_loss: 0.8828, test_f1: 0.5461
 epoch: 63, train_loss: 0.9091, test_loss: 0.8857, test_f1: 0.5407
 epoch: 64, train_loss: 0.9087, test_loss: 0.8868, test_f1: 0.5371
 epoch: 65, train_loss: 0.9038, test_loss: 0.8886, test_f1: 0.5371
 epoch: 66, train_loss: 0.9052, test_loss: 0.8885, test_f1: 0.5404
 epoch: 67, train_loss: 0.9030, test_loss: 0.8858, test_f1: 0.5388
 epoch: 68, train_loss: 0.9067, test_loss: 0.8871, test_f1: 0.5385
 epoch: 69, train_loss: 0.8912, test_loss: 0.8838, test_f1: 0.5345
 epoch: 70, train_loss: 0.8961, test_loss: 0.8843, test_f1: 0.5401
 epoch: 71, train_loss: 0.9032, test_loss: 0.8827, test_f1: 0.5378
 epoch: 72, train_loss: 0.8918, test_loss: 0.8810, test_f1: 0.5417
 epoch: 73, train_loss: 0.8956, test_loss: 0.8860, test_f1: 0.5273
 epoch: 74, train_loss: 0.8988, test_loss: 0.8811, test_f1: 0.5427
 epoch: 75, train_loss: 0.9021, test_loss: 0.8838, test_f1: 0.5344
 epoch: 76, train_loss: 0.8958, test_loss: 0.8830, test_f1: 0.5414
 epoch: 77, train_loss: 0.8966, test_loss: 0.8800, test_f1: 0.5455
 epoch: 78, train_loss: 0.8924, test_loss: 0.8828, test_f1: 0.5420
 epoch: 79, train_loss: 0.9001, test_loss: 0.8813, test_f1: 0.5459
 epoch: 80, train_loss: 0.8949, test_loss: 0.8807, test_f1: 0.5436
 epoch: 81, train_loss: 0.8867, test_loss: 0.8834, test_f1: 0.5443
 epoch: 82, train_loss: 0.8835, test_loss: 0.8861, test_f1: 0.5302
 epoch: 83, train_loss: 0.8829, test_loss: 0.8832, test_f1: 0.5333
 epoch: 84, train_loss: 0.8939, test_loss: 0.8793, test_f1: 0.5425
 epoch: 85, train_loss: 0.8846, test_loss: 0.8780, test_f1: 0.5392
 epoch: 86, train_loss: 0.8812, test_loss: 0.8790, test_f1: 0.5454
 epoch: 87, train_loss: 0.8814, test_loss: 0.8808, test_f1: 0.5418
 epoch: 88, train_loss: 0.8845, test_loss: 0.8791, test_f1: 0.5508
 epoch: 89, train_loss: 0.8804, test_loss: 0.8771, test_f1: 0.5344
 epoch: 90, train_loss: 0.8735, test_loss: 0.8768, test_f1: 0.5332
 epoch: 91, train_loss: 0.8773, test_loss: 0.8753, test_f1: 0.5443
 epoch: 92, train_loss: 0.8776, test_loss: 0.8758, test_f1: 0.5299
 epoch: 93, train_loss: 0.8678, test_loss: 0.8788, test_f1: 0.5450
 epoch: 94, train_loss: 0.8761, test_loss: 0.8768, test_f1: 0.5376
 epoch: 95, train_loss: 0.8819, test_loss: 0.8764, test_f1: 0.5351
 epoch: 96, train_loss: 0.8775, test_loss: 0.8764, test_f1: 0.5441
 epoch: 97, train_loss: 0.8677, test_loss: 0.8784, test_f1: 0.5419
 epoch: 98, train_loss: 0.8704, test_loss: 0.8782, test_f1: 0.5339
 epoch: 99, train_loss: 0.8729, test_loss: 0.8780, test_f1: 0.5377
##################ITERATION #8 ****************************************
 epoch: 0, train_loss: 1.2971, test_loss: 1.3668, test_f1: 0.2528
 epoch: 1, train_loss: 1.2535, test_loss: 1.2418, test_f1: 0.2879
 epoch: 2, train_loss: 1.2312, test_loss: 1.2045, test_f1: 0.3246
 epoch: 3, train_loss: 1.2053, test_loss: 1.1855, test_f1: 0.3769
 epoch: 4, train_loss: 1.1967, test_loss: 1.1681, test_f1: 0.3862
 epoch: 5, train_loss: 1.1875, test_loss: 1.1494, test_f1: 0.3879
 epoch: 6, train_loss: 1.1678, test_loss: 1.1381, test_f1: 0.3893
 epoch: 7, train_loss: 1.1632, test_loss: 1.1286, test_f1: 0.3795
 epoch: 8, train_loss: 1.1503, test_loss: 1.1137, test_f1: 0.3791
 epoch: 9, train_loss: 1.1393, test_loss: 1.1010, test_f1: 0.4035
 epoch: 10, train_loss: 1.1325, test_loss: 1.0954, test_f1: 0.3995
 epoch: 11, train_loss: 1.1197, test_loss: 1.0887, test_f1: 0.4008
 epoch: 12, train_loss: 1.1185, test_loss: 1.0809, test_f1: 0.4183
 epoch: 13, train_loss: 1.1079, test_loss: 1.0850, test_f1: 0.4271
 epoch: 14, train_loss: 1.1038, test_loss: 1.0738, test_f1: 0.4083
 epoch: 15, train_loss: 1.0972, test_loss: 1.0667, test_f1: 0.4315
 epoch: 16, train_loss: 1.0907, test_loss: 1.0553, test_f1: 0.4355
 epoch: 17, train_loss: 1.0861, test_loss: 1.0600, test_f1: 0.4304
 epoch: 18, train_loss: 1.0627, test_loss: 1.0440, test_f1: 0.4524
 epoch: 19, train_loss: 1.0582, test_loss: 1.0364, test_f1: 0.4573
 epoch: 20, train_loss: 1.0579, test_loss: 1.0266, test_f1: 0.4617
 epoch: 21, train_loss: 1.0465, test_loss: 1.0297, test_f1: 0.4574
 epoch: 22, train_loss: 1.0426, test_loss: 1.0167, test_f1: 0.4669
 epoch: 23, train_loss: 1.0355, test_loss: 1.0216, test_f1: 0.4620
 epoch: 24, train_loss: 1.0360, test_loss: 1.0192, test_f1: 0.4538
 epoch: 25, train_loss: 1.0309, test_loss: 1.0087, test_f1: 0.4777
 epoch: 26, train_loss: 1.0246, test_loss: 0.9975, test_f1: 0.4727
 epoch: 27, train_loss: 1.0212, test_loss: 0.9980, test_f1: 0.4716
 epoch: 28, train_loss: 1.0181, test_loss: 1.0055, test_f1: 0.4638
 epoch: 29, train_loss: 1.0058, test_loss: 1.0054, test_f1: 0.4640
 epoch: 30, train_loss: 0.9997, test_loss: 0.9946, test_f1: 0.4668
 epoch: 31, train_loss: 0.9999, test_loss: 1.0005, test_f1: 0.4672
 epoch: 32, train_loss: 0.9958, test_loss: 0.9916, test_f1: 0.4749
 epoch: 33, train_loss: 0.9975, test_loss: 0.9924, test_f1: 0.4674
 epoch: 34, train_loss: 0.9879, test_loss: 1.0047, test_f1: 0.4552
 epoch: 35, train_loss: 0.9861, test_loss: 0.9796, test_f1: 0.4768
 epoch: 36, train_loss: 0.9811, test_loss: 0.9875, test_f1: 0.4638
 epoch: 37, train_loss: 0.9726, test_loss: 0.9792, test_f1: 0.4928
 epoch: 38, train_loss: 0.9888, test_loss: 0.9901, test_f1: 0.4787
 epoch: 39, train_loss: 0.9782, test_loss: 0.9756, test_f1: 0.4810
 epoch: 40, train_loss: 0.9725, test_loss: 0.9743, test_f1: 0.4944
 epoch: 41, train_loss: 0.9603, test_loss: 0.9745, test_f1: 0.4993
 epoch: 42, train_loss: 0.9711, test_loss: 0.9937, test_f1: 0.4834
 epoch: 43, train_loss: 0.9730, test_loss: 0.9701, test_f1: 0.4971
 epoch: 44, train_loss: 0.9554, test_loss: 0.9724, test_f1: 0.4940
 epoch: 45, train_loss: 0.9578, test_loss: 0.9717, test_f1: 0.5006
 epoch: 46, train_loss: 0.9659, test_loss: 0.9628, test_f1: 0.5044
 epoch: 47, train_loss: 0.9540, test_loss: 0.9650, test_f1: 0.5064
 epoch: 48, train_loss: 0.9549, test_loss: 0.9671, test_f1: 0.5086
 epoch: 49, train_loss: 0.9411, test_loss: 0.9601, test_f1: 0.5103
 epoch: 50, train_loss: 0.9474, test_loss: 0.9637, test_f1: 0.5070
 epoch: 51, train_loss: 0.9469, test_loss: 0.9627, test_f1: 0.5127
 epoch: 52, train_loss: 0.9339, test_loss: 0.9655, test_f1: 0.5074
 epoch: 53, train_loss: 0.9307, test_loss: 0.9655, test_f1: 0.5063
 epoch: 54, train_loss: 0.9360, test_loss: 0.9569, test_f1: 0.5058
 epoch: 55, train_loss: 0.9333, test_loss: 0.9653, test_f1: 0.5127
 epoch: 56, train_loss: 0.9255, test_loss: 0.9618, test_f1: 0.5090
 epoch: 57, train_loss: 0.9441, test_loss: 0.9685, test_f1: 0.5174
 epoch: 58, train_loss: 0.9259, test_loss: 0.9552, test_f1: 0.5161
 epoch: 59, train_loss: 0.9340, test_loss: 0.9545, test_f1: 0.5137
 epoch: 60, train_loss: 0.9220, test_loss: 0.9516, test_f1: 0.5134
 epoch: 61, train_loss: 0.9254, test_loss: 0.9530, test_f1: 0.5151
 epoch: 62, train_loss: 0.9279, test_loss: 0.9582, test_f1: 0.5103
 epoch: 63, train_loss: 0.9136, test_loss: 0.9466, test_f1: 0.5130
 epoch: 64, train_loss: 0.9287, test_loss: 0.9374, test_f1: 0.5172
 epoch: 65, train_loss: 0.9239, test_loss: 0.9579, test_f1: 0.5212
 epoch: 66, train_loss: 0.9205, test_loss: 0.9555, test_f1: 0.5224
 epoch: 67, train_loss: 0.9263, test_loss: 0.9497, test_f1: 0.5174
 epoch: 68, train_loss: 0.9226, test_loss: 0.9589, test_f1: 0.5145
 epoch: 69, train_loss: 0.9148, test_loss: 0.9438, test_f1: 0.5153
 epoch: 70, train_loss: 0.9187, test_loss: 0.9489, test_f1: 0.5158
 epoch: 71, train_loss: 0.9225, test_loss: 0.9546, test_f1: 0.5185
 epoch: 72, train_loss: 0.9179, test_loss: 0.9468, test_f1: 0.5261
 epoch: 73, train_loss: 0.9136, test_loss: 0.9365, test_f1: 0.5170
 epoch: 74, train_loss: 0.9155, test_loss: 0.9391, test_f1: 0.5179
 epoch: 75, train_loss: 0.9074, test_loss: 0.9382, test_f1: 0.5175
 epoch: 76, train_loss: 0.9168, test_loss: 0.9423, test_f1: 0.5194
 epoch: 77, train_loss: 0.9044, test_loss: 0.9442, test_f1: 0.5157
 epoch: 78, train_loss: 0.9164, test_loss: 0.9534, test_f1: 0.5159
 epoch: 79, train_loss: 0.9013, test_loss: 0.9370, test_f1: 0.5223
 epoch: 80, train_loss: 0.9010, test_loss: 0.9401, test_f1: 0.5182
 epoch: 81, train_loss: 0.9003, test_loss: 0.9356, test_f1: 0.5145
 epoch: 82, train_loss: 0.9014, test_loss: 0.9314, test_f1: 0.5214
 epoch: 83, train_loss: 0.8999, test_loss: 0.9435, test_f1: 0.5286
 epoch: 84, train_loss: 0.8975, test_loss: 0.9492, test_f1: 0.5164
 epoch: 85, train_loss: 0.9025, test_loss: 0.9524, test_f1: 0.5220
 epoch: 86, train_loss: 0.8964, test_loss: 0.9481, test_f1: 0.5214
 epoch: 87, train_loss: 0.8950, test_loss: 0.9393, test_f1: 0.5276
 epoch: 88, train_loss: 0.8920, test_loss: 0.9355, test_f1: 0.5264
 epoch: 89, train_loss: 0.9003, test_loss: 0.9573, test_f1: 0.5212
 epoch: 90, train_loss: 0.8948, test_loss: 0.9468, test_f1: 0.5206
 epoch: 91, train_loss: 0.8916, test_loss: 0.9487, test_f1: 0.5172
 epoch: 92, train_loss: 0.8914, test_loss: 0.9379, test_f1: 0.5138
 epoch: 93, train_loss: 0.8901, test_loss: 0.9081, test_f1: 0.5146
 epoch: 94, train_loss: 0.8855, test_loss: 0.9230, test_f1: 0.5215
 epoch: 95, train_loss: 0.8872, test_loss: 0.9093, test_f1: 0.5192
 epoch: 96, train_loss: 0.8931, test_loss: 0.9385, test_f1: 0.5233
 epoch: 97, train_loss: 0.8965, test_loss: 0.9313, test_f1: 0.5201
 epoch: 98, train_loss: 0.8882, test_loss: 0.9177, test_f1: 0.5326
 epoch: 99, train_loss: 0.8945, test_loss: 0.9225, test_f1: 0.5303
##################ITERATION #9 ****************************************
 epoch: 0, train_loss: 1.3666, test_loss: 1.3447, test_f1: 0.2270
 epoch: 1, train_loss: 1.2842, test_loss: 1.3195, test_f1: 0.3168
 epoch: 2, train_loss: 1.2593, test_loss: 1.2465, test_f1: 0.3405
 epoch: 3, train_loss: 1.2434, test_loss: 1.2142, test_f1: 0.3718
 epoch: 4, train_loss: 1.2282, test_loss: 1.1977, test_f1: 0.3670
 epoch: 5, train_loss: 1.2129, test_loss: 1.1806, test_f1: 0.3946
 epoch: 6, train_loss: 1.2012, test_loss: 1.1655, test_f1: 0.3990
 epoch: 7, train_loss: 1.1965, test_loss: 1.1521, test_f1: 0.4098
 epoch: 8, train_loss: 1.1840, test_loss: 1.1427, test_f1: 0.4102
 epoch: 9, train_loss: 1.1718, test_loss: 1.1351, test_f1: 0.4150
 epoch: 10, train_loss: 1.1565, test_loss: 1.1206, test_f1: 0.4232
 epoch: 11, train_loss: 1.1501, test_loss: 1.1038, test_f1: 0.4321
 epoch: 12, train_loss: 1.1544, test_loss: 1.0966, test_f1: 0.4317
 epoch: 13, train_loss: 1.1463, test_loss: 1.0857, test_f1: 0.4421
 epoch: 14, train_loss: 1.1393, test_loss: 1.0815, test_f1: 0.4366
 epoch: 15, train_loss: 1.1232, test_loss: 1.0723, test_f1: 0.4457
 epoch: 16, train_loss: 1.1149, test_loss: 1.0602, test_f1: 0.4716
 epoch: 17, train_loss: 1.1124, test_loss: 1.0639, test_f1: 0.4449
 epoch: 18, train_loss: 1.1070, test_loss: 1.0447, test_f1: 0.4673
 epoch: 19, train_loss: 1.0974, test_loss: 1.0461, test_f1: 0.4665
 epoch: 20, train_loss: 1.0910, test_loss: 1.0321, test_f1: 0.4795
 epoch: 21, train_loss: 1.0934, test_loss: 1.0266, test_f1: 0.4809
 epoch: 22, train_loss: 1.0798, test_loss: 1.0202, test_f1: 0.4758
 epoch: 23, train_loss: 1.0752, test_loss: 1.0132, test_f1: 0.4850
 epoch: 24, train_loss: 1.0746, test_loss: 1.0157, test_f1: 0.4776
 epoch: 25, train_loss: 1.0610, test_loss: 1.0058, test_f1: 0.4663
 epoch: 26, train_loss: 1.0718, test_loss: 1.0023, test_f1: 0.4603
 epoch: 27, train_loss: 1.0587, test_loss: 0.9968, test_f1: 0.4640
 epoch: 28, train_loss: 1.0445, test_loss: 0.9782, test_f1: 0.5010
 epoch: 29, train_loss: 1.0424, test_loss: 0.9912, test_f1: 0.4720
 epoch: 30, train_loss: 1.0467, test_loss: 0.9843, test_f1: 0.4729
 epoch: 31, train_loss: 1.0348, test_loss: 0.9773, test_f1: 0.4807
 epoch: 32, train_loss: 1.0318, test_loss: 0.9644, test_f1: 0.4814
 epoch: 33, train_loss: 1.0296, test_loss: 0.9652, test_f1: 0.4850
 epoch: 34, train_loss: 1.0260, test_loss: 0.9702, test_f1: 0.4799
 epoch: 35, train_loss: 1.0298, test_loss: 0.9641, test_f1: 0.4825
 epoch: 36, train_loss: 1.0140, test_loss: 0.9645, test_f1: 0.4807
 epoch: 37, train_loss: 1.0074, test_loss: 0.9526, test_f1: 0.4885
 epoch: 38, train_loss: 1.0091, test_loss: 0.9489, test_f1: 0.4858
 epoch: 39, train_loss: 1.0040, test_loss: 0.9380, test_f1: 0.4952
 epoch: 40, train_loss: 1.0014, test_loss: 0.9485, test_f1: 0.4897
 epoch: 41, train_loss: 1.0073, test_loss: 0.9493, test_f1: 0.4899
 epoch: 42, train_loss: 1.0032, test_loss: 0.9415, test_f1: 0.4848
 epoch: 43, train_loss: 0.9933, test_loss: 0.9319, test_f1: 0.5096
 epoch: 44, train_loss: 1.0009, test_loss: 0.9456, test_f1: 0.4895
 epoch: 45, train_loss: 0.9863, test_loss: 0.9358, test_f1: 0.4903
 epoch: 46, train_loss: 0.9801, test_loss: 0.9365, test_f1: 0.4922
 epoch: 47, train_loss: 0.9862, test_loss: 0.9278, test_f1: 0.4898
 epoch: 48, train_loss: 0.9668, test_loss: 0.9266, test_f1: 0.5088
 epoch: 49, train_loss: 0.9741, test_loss: 0.9440, test_f1: 0.4945
 epoch: 50, train_loss: 0.9843, test_loss: 0.9533, test_f1: 0.4892
 epoch: 51, train_loss: 0.9657, test_loss: 0.9336, test_f1: 0.4926
 epoch: 52, train_loss: 0.9691, test_loss: 0.9297, test_f1: 0.4955
 epoch: 53, train_loss: 0.9678, test_loss: 0.9334, test_f1: 0.4958
 epoch: 54, train_loss: 0.9688, test_loss: 0.9309, test_f1: 0.4926
 epoch: 55, train_loss: 0.9701, test_loss: 0.9446, test_f1: 0.4963
 epoch: 56, train_loss: 0.9676, test_loss: 0.9310, test_f1: 0.5027
 epoch: 57, train_loss: 0.9566, test_loss: 0.9363, test_f1: 0.4949
 epoch: 58, train_loss: 0.9532, test_loss: 0.9394, test_f1: 0.4926
 epoch: 59, train_loss: 0.9545, test_loss: 0.9470, test_f1: 0.4971
 epoch: 60, train_loss: 0.9565, test_loss: 0.9268, test_f1: 0.4921
 epoch: 61, train_loss: 0.9520, test_loss: 0.9303, test_f1: 0.4997
 epoch: 62, train_loss: 0.9435, test_loss: 0.9348, test_f1: 0.4972
 epoch: 63, train_loss: 0.9534, test_loss: 0.9293, test_f1: 0.4991
 epoch: 64, train_loss: 0.9481, test_loss: 0.9208, test_f1: 0.4966
 epoch: 65, train_loss: 0.9474, test_loss: 0.9277, test_f1: 0.4951
 epoch: 66, train_loss: 0.9468, test_loss: 0.9378, test_f1: 0.5027
 epoch: 67, train_loss: 0.9505, test_loss: 0.9393, test_f1: 0.4994
 epoch: 68, train_loss: 0.9373, test_loss: 0.9454, test_f1: 0.4954
 epoch: 69, train_loss: 0.9395, test_loss: 0.9320, test_f1: 0.5010
 epoch: 70, train_loss: 0.9464, test_loss: 0.9330, test_f1: 0.4945
 epoch: 71, train_loss: 0.9415, test_loss: 0.9356, test_f1: 0.4939
 epoch: 72, train_loss: 0.9529, test_loss: 0.9380, test_f1: 0.4915
 epoch: 73, train_loss: 0.9272, test_loss: 0.9454, test_f1: 0.4998
 epoch: 74, train_loss: 0.9416, test_loss: 0.9257, test_f1: 0.4967
 epoch: 75, train_loss: 0.9380, test_loss: 0.9274, test_f1: 0.4988
 epoch: 76, train_loss: 0.9285, test_loss: 0.9320, test_f1: 0.4959
 epoch: 77, train_loss: 0.9323, test_loss: 0.9364, test_f1: 0.4938
 epoch: 78, train_loss: 0.9353, test_loss: 0.9316, test_f1: 0.4980
 epoch: 79, train_loss: 0.9333, test_loss: 0.9503, test_f1: 0.4931
 epoch: 80, train_loss: 0.9221, test_loss: 0.9483, test_f1: 0.4965
 epoch: 81, train_loss: 0.9290, test_loss: 0.9472, test_f1: 0.4927
 epoch: 82, train_loss: 0.9255, test_loss: 0.9431, test_f1: 0.4938
 epoch: 83, train_loss: 0.9387, test_loss: 0.9494, test_f1: 0.5013
 epoch: 84, train_loss: 0.9292, test_loss: 0.9342, test_f1: 0.4978
 epoch: 85, train_loss: 0.9280, test_loss: 0.9485, test_f1: 0.5014
 epoch: 86, train_loss: 0.9347, test_loss: 0.9538, test_f1: 0.5024
 epoch: 87, train_loss: 0.9294, test_loss: 0.9319, test_f1: 0.4970
 epoch: 88, train_loss: 0.9143, test_loss: 0.9341, test_f1: 0.4959
 epoch: 89, train_loss: 0.9191, test_loss: 0.9221, test_f1: 0.4947
 epoch: 90, train_loss: 0.9261, test_loss: 0.9554, test_f1: 0.4978
 epoch: 91, train_loss: 0.9235, test_loss: 0.9558, test_f1: 0.4952
 epoch: 92, train_loss: 0.9233, test_loss: 0.9364, test_f1: 0.4951
 epoch: 93, train_loss: 0.9311, test_loss: 0.9333, test_f1: 0.4955
 epoch: 94, train_loss: 0.9120, test_loss: 0.9319, test_f1: 0.4926
 epoch: 95, train_loss: 0.9235, test_loss: 0.9534, test_f1: 0.5014
 epoch: 96, train_loss: 0.9186, test_loss: 0.9538, test_f1: 0.5000
 epoch: 97, train_loss: 0.9124, test_loss: 0.9386, test_f1: 0.4912
 epoch: 98, train_loss: 0.9141, test_loss: 0.9485, test_f1: 0.4962
 epoch: 99, train_loss: 0.9205, test_loss: 0.9624, test_f1: 0.4969

Training completed in 516.54 seconds
Best F1: 0.5508 at epoch 88
Mean F1 across iterations: 0.5327  0.0136
========================FINAL RESULTS================================
FEGIN weighted F1: 0.5508  0.0136
python main.py --data ltspice_examples --representation component_net --model FEGIN --layers 5 --hiddens 32 --batch_size 128 --lr 0.0001 --emb_size 250 --epochs 100 --save_appendix component_net_L5_H32_BS128_LR0.0001_E250 --no_val
-----



STDERR:
  File "main.py", line 370, in <module>
    main()
  File "main.py", line 254, in main
    dataset = dataset_class(
  File "/home/philip/projects/ltspice_examples_code_repo/Circuit-Completion-Using-GNNs/component_classification_with_link_prediction_head/evaluation/FEGIN/kernel/circuit_datasets.py", line 15, in __init__
    self.data, self.slices = torch.load(self.processed_paths[0])
  File "/home/philip/.local/lib/python3.8/site-packages/torch/serialization.py", line 1040, in load
    warnings.warn(
  File "/usr/lib/python3.8/warnings.py", line 109, in _showwarnmsg
    sw(msg.message, msg.category, msg.filename, msg.lineno,
  File "main.py", line 47, in warn_with_traceback
    traceback.print_stack(file=log)
/home/philip/projects/ltspice_examples_code_repo/Circuit-Completion-Using-GNNs/component_classification_with_link_prediction_head/evaluation/FEGIN/kernel/circuit_datasets.py:15: FutureWarning: You are using `torch.load` with `weights_only=False` (the current default value), which uses the default pickle module implicitly. It is possible to construct malicious pickle data which will execute arbitrary code during unpickling (See https://github.com/pytorch/pytorch/blob/main/SECURITY.md#untrusted-models for more details). In a future release, the default value for `weights_only` will be flipped to `True`. This limits the functions that could be executed during unpickling. Arbitrary objects will no longer be allowed to be loaded via this mode unless they are explicitly allowlisted by the user via `torch.serialization.add_safe_globals`. We recommend you start setting `weights_only=True` for any use case where you don't have full control of the loaded file. Please open an issue on GitHub for any issues related to this experimental feature.
  self.data, self.slices = torch.load(self.processed_paths[0])
