STDOUT:
Results will be saved in /home/philip/projects/ltspice_examples_code_repo/Circuit-Completion-Using-GNNs/component_classification_with_link_prediction_head/evaluation/FEGIN/results/model_FEGIN_dataset_ltspice_examples
Command line input: python main.py --data ltspice_examples --representation component_pin --model FEGIN --layers 4 --hiddens 16 --batch_size 64 --lr 0.001 --emb_size 250 --epochs 100 --save_appendix component_pin_L4_H16_BS64_LR0.001_E250 --no_val
 is saved.
-----
ltspice_examples - FEGIN
Using 4 layers, 16 hidden units, h = 2
Loading component_pin representation dataset
ENTERED
Training FEGIN on component_pin representation
Train: 3560, Test: 848
##################ITERATION #0 ****************************************
 epoch: 0, train_loss: 1.3829, test_loss: 1.3149, test_f1: 0.3723
 epoch: 1, train_loss: 1.2675, test_loss: 1.2052, test_f1: 0.2377
 epoch: 2, train_loss: 1.2078, test_loss: 1.1702, test_f1: 0.2558
 epoch: 3, train_loss: 1.1730, test_loss: 1.1226, test_f1: 0.3565
 epoch: 4, train_loss: 1.1185, test_loss: 1.0725, test_f1: 0.3473
 epoch: 5, train_loss: 1.0459, test_loss: 1.0087, test_f1: 0.3602
 epoch: 6, train_loss: 1.0062, test_loss: 0.9868, test_f1: 0.4153
 epoch: 7, train_loss: 0.9844, test_loss: 0.9897, test_f1: 0.4066
 epoch: 8, train_loss: 0.9721, test_loss: 0.9782, test_f1: 0.4436
 epoch: 9, train_loss: 0.9508, test_loss: 0.9753, test_f1: 0.4567
 epoch: 10, train_loss: 0.9444, test_loss: 0.9580, test_f1: 0.4514
 epoch: 11, train_loss: 0.9330, test_loss: 1.0188, test_f1: 0.4729
 epoch: 12, train_loss: 0.9214, test_loss: 0.9579, test_f1: 0.4749
 epoch: 13, train_loss: 0.9244, test_loss: 1.0320, test_f1: 0.4604
 epoch: 14, train_loss: 0.9076, test_loss: 1.2266, test_f1: 0.4500
 epoch: 15, train_loss: 0.9048, test_loss: 0.9721, test_f1: 0.4697
 epoch: 16, train_loss: 0.8866, test_loss: 0.9297, test_f1: 0.5052
 epoch: 17, train_loss: 0.8945, test_loss: 0.9472, test_f1: 0.5085
 epoch: 18, train_loss: 0.9019, test_loss: 0.9061, test_f1: 0.5015
 epoch: 19, train_loss: 0.8763, test_loss: 0.9449, test_f1: 0.4900
 epoch: 20, train_loss: 0.8816, test_loss: 0.9794, test_f1: 0.4971
 epoch: 21, train_loss: 0.8685, test_loss: 0.9235, test_f1: 0.5224
 epoch: 22, train_loss: 0.8679, test_loss: 0.9315, test_f1: 0.5025
 epoch: 23, train_loss: 0.8617, test_loss: 0.9170, test_f1: 0.5048
 epoch: 24, train_loss: 0.8603, test_loss: 0.9499, test_f1: 0.4924
 epoch: 25, train_loss: 0.8470, test_loss: 0.8765, test_f1: 0.5438
 epoch: 26, train_loss: 0.8428, test_loss: 0.9154, test_f1: 0.5182
 epoch: 27, train_loss: 0.8443, test_loss: 0.9100, test_f1: 0.4982
 epoch: 28, train_loss: 0.8497, test_loss: 0.9098, test_f1: 0.5293
 epoch: 29, train_loss: 0.8514, test_loss: 0.9322, test_f1: 0.5225
 epoch: 30, train_loss: 0.8376, test_loss: 0.9139, test_f1: 0.4939
 epoch: 31, train_loss: 0.8486, test_loss: 0.9978, test_f1: 0.4734
 epoch: 32, train_loss: 0.8385, test_loss: 0.9026, test_f1: 0.5060
 epoch: 33, train_loss: 0.8313, test_loss: 0.9082, test_f1: 0.5150
 epoch: 34, train_loss: 0.8380, test_loss: 0.8915, test_f1: 0.5370
 epoch: 35, train_loss: 0.8291, test_loss: 0.8904, test_f1: 0.5232
 epoch: 36, train_loss: 0.8194, test_loss: 0.9113, test_f1: 0.5146
 epoch: 37, train_loss: 0.8120, test_loss: 0.9105, test_f1: 0.5274
 epoch: 38, train_loss: 0.8282, test_loss: 0.8937, test_f1: 0.5318
 epoch: 39, train_loss: 0.8081, test_loss: 0.8883, test_f1: 0.5291
 epoch: 40, train_loss: 0.8095, test_loss: 0.9351, test_f1: 0.5310
 epoch: 41, train_loss: 0.8068, test_loss: 0.8913, test_f1: 0.5319
 epoch: 42, train_loss: 0.8029, test_loss: 0.8969, test_f1: 0.5283
 epoch: 43, train_loss: 0.8142, test_loss: 0.8757, test_f1: 0.5398
 epoch: 44, train_loss: 0.8088, test_loss: 0.9034, test_f1: 0.5336
 epoch: 45, train_loss: 0.8035, test_loss: 0.8876, test_f1: 0.5369
 epoch: 46, train_loss: 0.7777, test_loss: 0.9498, test_f1: 0.5234
 epoch: 47, train_loss: 0.7994, test_loss: 0.9257, test_f1: 0.5122
 epoch: 48, train_loss: 0.7943, test_loss: 0.9036, test_f1: 0.5216
 epoch: 49, train_loss: 0.7829, test_loss: 0.8834, test_f1: 0.5291
 epoch: 50, train_loss: 0.7840, test_loss: 0.9602, test_f1: 0.5059
 epoch: 51, train_loss: 0.7771, test_loss: 0.8810, test_f1: 0.5340
 epoch: 52, train_loss: 0.7576, test_loss: 0.8929, test_f1: 0.5346
 epoch: 53, train_loss: 0.7670, test_loss: 0.8952, test_f1: 0.5413
 epoch: 54, train_loss: 0.7640, test_loss: 0.9019, test_f1: 0.5391
 epoch: 55, train_loss: 0.7558, test_loss: 0.9311, test_f1: 0.5245
 epoch: 56, train_loss: 0.7571, test_loss: 0.9115, test_f1: 0.5312
 epoch: 57, train_loss: 0.7683, test_loss: 0.8929, test_f1: 0.5379
 epoch: 58, train_loss: 0.7715, test_loss: 0.9642, test_f1: 0.5050
 epoch: 59, train_loss: 0.7642, test_loss: 0.9296, test_f1: 0.5231
 epoch: 60, train_loss: 0.7545, test_loss: 0.9146, test_f1: 0.5356
 epoch: 61, train_loss: 0.7493, test_loss: 0.9093, test_f1: 0.5271
 epoch: 62, train_loss: 0.7521, test_loss: 0.9304, test_f1: 0.5032
 epoch: 63, train_loss: 0.7565, test_loss: 0.9162, test_f1: 0.5403
 epoch: 64, train_loss: 0.7480, test_loss: 0.9532, test_f1: 0.5139
 epoch: 65, train_loss: 0.7430, test_loss: 0.9137, test_f1: 0.5357
 epoch: 66, train_loss: 0.7428, test_loss: 0.9333, test_f1: 0.5299
 epoch: 67, train_loss: 0.7537, test_loss: 0.8923, test_f1: 0.5393
 epoch: 68, train_loss: 0.7540, test_loss: 0.9298, test_f1: 0.5226
 epoch: 69, train_loss: 0.7431, test_loss: 0.9390, test_f1: 0.5199
 epoch: 70, train_loss: 0.7568, test_loss: 0.9007, test_f1: 0.5331
 epoch: 71, train_loss: 0.7398, test_loss: 0.9325, test_f1: 0.5291
 epoch: 72, train_loss: 0.7350, test_loss: 0.9527, test_f1: 0.5096
 epoch: 73, train_loss: 0.7502, test_loss: 0.9122, test_f1: 0.5293
 epoch: 74, train_loss: 0.7286, test_loss: 0.9307, test_f1: 0.5381
 epoch: 75, train_loss: 0.7395, test_loss: 0.9099, test_f1: 0.5269
 epoch: 76, train_loss: 0.7396, test_loss: 0.9244, test_f1: 0.5533
 epoch: 77, train_loss: 0.7427, test_loss: 0.8975, test_f1: 0.5494
 epoch: 78, train_loss: 0.7418, test_loss: 0.8968, test_f1: 0.5432
 epoch: 79, train_loss: 0.7452, test_loss: 0.9089, test_f1: 0.5351
 epoch: 80, train_loss: 0.7430, test_loss: 0.9569, test_f1: 0.5381
 epoch: 81, train_loss: 0.7420, test_loss: 0.9085, test_f1: 0.5410
 epoch: 82, train_loss: 0.7493, test_loss: 0.9121, test_f1: 0.5351
 epoch: 83, train_loss: 0.7386, test_loss: 0.9131, test_f1: 0.5401
 epoch: 84, train_loss: 0.7277, test_loss: 0.9407, test_f1: 0.5258
 epoch: 85, train_loss: 0.7291, test_loss: 0.9123, test_f1: 0.5380
 epoch: 86, train_loss: 0.7279, test_loss: 0.9311, test_f1: 0.5246
 epoch: 87, train_loss: 0.7302, test_loss: 0.9443, test_f1: 0.5294
 epoch: 88, train_loss: 0.7274, test_loss: 0.9263, test_f1: 0.5270
 epoch: 89, train_loss: 0.7384, test_loss: 0.9076, test_f1: 0.5422
 epoch: 90, train_loss: 0.7284, test_loss: 0.9182, test_f1: 0.5324
 epoch: 91, train_loss: 0.7302, test_loss: 0.9405, test_f1: 0.5432
 epoch: 92, train_loss: 0.7180, test_loss: 0.9478, test_f1: 0.5321
 epoch: 93, train_loss: 0.7347, test_loss: 0.9368, test_f1: 0.5292
 epoch: 94, train_loss: 0.7182, test_loss: 0.9022, test_f1: 0.5531
 epoch: 95, train_loss: 0.7152, test_loss: 0.9290, test_f1: 0.5337
 epoch: 96, train_loss: 0.7291, test_loss: 0.9166, test_f1: 0.5433
 epoch: 97, train_loss: 0.7233, test_loss: 0.9415, test_f1: 0.5376
 epoch: 98, train_loss: 0.7167, test_loss: 0.8970, test_f1: 0.5528
 epoch: 99, train_loss: 0.7225, test_loss: 0.9533, test_f1: 0.5481
##################ITERATION #1 ****************************************
 epoch: 0, train_loss: 1.2976, test_loss: 1.2346, test_f1: 0.2286
 epoch: 1, train_loss: 1.1992, test_loss: 1.1538, test_f1: 0.3422
 epoch: 2, train_loss: 1.1504, test_loss: 1.1164, test_f1: 0.3167
 epoch: 3, train_loss: 1.0935, test_loss: 1.1497, test_f1: 0.3087
 epoch: 4, train_loss: 1.0618, test_loss: 1.0893, test_f1: 0.3664
 epoch: 5, train_loss: 1.0286, test_loss: 1.0040, test_f1: 0.4562
 epoch: 6, train_loss: 1.0192, test_loss: 1.0155, test_f1: 0.4529
 epoch: 7, train_loss: 0.9915, test_loss: 1.0345, test_f1: 0.4545
 epoch: 8, train_loss: 0.9807, test_loss: 1.0103, test_f1: 0.4652
 epoch: 9, train_loss: 0.9617, test_loss: 1.0179, test_f1: 0.4840
 epoch: 10, train_loss: 0.9581, test_loss: 1.0149, test_f1: 0.4788
 epoch: 11, train_loss: 0.9504, test_loss: 1.0398, test_f1: 0.4920
 epoch: 12, train_loss: 0.9489, test_loss: 1.0152, test_f1: 0.5132
 epoch: 13, train_loss: 0.9375, test_loss: 1.0211, test_f1: 0.5111
 epoch: 14, train_loss: 0.9363, test_loss: 1.0032, test_f1: 0.5127
 epoch: 15, train_loss: 0.9252, test_loss: 0.9361, test_f1: 0.4937
 epoch: 16, train_loss: 0.9239, test_loss: 1.0311, test_f1: 0.5110
 epoch: 17, train_loss: 0.9150, test_loss: 1.0049, test_f1: 0.4792
 epoch: 18, train_loss: 0.9143, test_loss: 0.9664, test_f1: 0.5296
 epoch: 19, train_loss: 0.9005, test_loss: 0.9423, test_f1: 0.4976
 epoch: 20, train_loss: 0.9003, test_loss: 0.9904, test_f1: 0.4927
 epoch: 21, train_loss: 0.8988, test_loss: 1.2419, test_f1: 0.4673
 epoch: 22, train_loss: 0.8879, test_loss: 0.9422, test_f1: 0.5046
 epoch: 23, train_loss: 0.8971, test_loss: 1.0341, test_f1: 0.5069
 epoch: 24, train_loss: 0.8941, test_loss: 0.9782, test_f1: 0.5086
 epoch: 25, train_loss: 0.8899, test_loss: 0.9806, test_f1: 0.4969
 epoch: 26, train_loss: 0.8779, test_loss: 0.9828, test_f1: 0.5167
 epoch: 27, train_loss: 0.8660, test_loss: 0.9747, test_f1: 0.5254
 epoch: 28, train_loss: 0.8737, test_loss: 0.9785, test_f1: 0.5226
 epoch: 29, train_loss: 0.8746, test_loss: 1.0602, test_f1: 0.4571
 epoch: 30, train_loss: 0.8716, test_loss: 1.0053, test_f1: 0.5085
 epoch: 31, train_loss: 0.8560, test_loss: 0.9967, test_f1: 0.5279
 epoch: 32, train_loss: 0.8616, test_loss: 0.9793, test_f1: 0.5251
 epoch: 33, train_loss: 0.8636, test_loss: 0.9676, test_f1: 0.5292
 epoch: 34, train_loss: 0.8542, test_loss: 0.9748, test_f1: 0.5335
 epoch: 35, train_loss: 0.8479, test_loss: 0.9203, test_f1: 0.5194
 epoch: 36, train_loss: 0.8371, test_loss: 0.9727, test_f1: 0.5053
 epoch: 37, train_loss: 0.8446, test_loss: 0.9975, test_f1: 0.5085
 epoch: 38, train_loss: 0.8370, test_loss: 1.0364, test_f1: 0.4988
 epoch: 39, train_loss: 0.8364, test_loss: 1.0203, test_f1: 0.5013
 epoch: 40, train_loss: 0.8440, test_loss: 1.0052, test_f1: 0.4932
 epoch: 41, train_loss: 0.8354, test_loss: 0.9640, test_f1: 0.5144
 epoch: 42, train_loss: 0.8399, test_loss: 1.0112, test_f1: 0.5007
 epoch: 43, train_loss: 0.8378, test_loss: 1.0075, test_f1: 0.5111
 epoch: 44, train_loss: 0.8394, test_loss: 1.0343, test_f1: 0.4680
 epoch: 45, train_loss: 0.8257, test_loss: 0.9504, test_f1: 0.5280
 epoch: 46, train_loss: 0.8218, test_loss: 0.9555, test_f1: 0.5199
 epoch: 47, train_loss: 0.8248, test_loss: 1.0225, test_f1: 0.5090
 epoch: 48, train_loss: 0.8204, test_loss: 0.9565, test_f1: 0.5195
 epoch: 49, train_loss: 0.8197, test_loss: 0.9378, test_f1: 0.5115
 epoch: 50, train_loss: 0.8059, test_loss: 0.9694, test_f1: 0.4864
 epoch: 51, train_loss: 0.8013, test_loss: 0.9550, test_f1: 0.5158
 epoch: 52, train_loss: 0.7970, test_loss: 0.9285, test_f1: 0.5090
 epoch: 53, train_loss: 0.7943, test_loss: 0.9785, test_f1: 0.4970
 epoch: 54, train_loss: 0.7906, test_loss: 0.9448, test_f1: 0.5030
 epoch: 55, train_loss: 0.7903, test_loss: 0.9620, test_f1: 0.5007
 epoch: 56, train_loss: 0.7815, test_loss: 0.9688, test_f1: 0.5033
 epoch: 57, train_loss: 0.8022, test_loss: 0.9957, test_f1: 0.4911
 epoch: 58, train_loss: 0.7884, test_loss: 0.9671, test_f1: 0.5033
 epoch: 59, train_loss: 0.7817, test_loss: 0.9760, test_f1: 0.4986
 epoch: 60, train_loss: 0.7989, test_loss: 0.9741, test_f1: 0.5098
 epoch: 61, train_loss: 0.7882, test_loss: 0.9403, test_f1: 0.5148
 epoch: 62, train_loss: 0.7821, test_loss: 0.9557, test_f1: 0.5096
 epoch: 63, train_loss: 0.7752, test_loss: 0.9325, test_f1: 0.5162
 epoch: 64, train_loss: 0.7811, test_loss: 0.9592, test_f1: 0.5050
 epoch: 65, train_loss: 0.7756, test_loss: 0.9434, test_f1: 0.5118
 epoch: 66, train_loss: 0.7781, test_loss: 0.9820, test_f1: 0.5097
 epoch: 67, train_loss: 0.7750, test_loss: 0.9530, test_f1: 0.5132
 epoch: 68, train_loss: 0.7706, test_loss: 0.9528, test_f1: 0.5167
 epoch: 69, train_loss: 0.7773, test_loss: 0.9719, test_f1: 0.5035
 epoch: 70, train_loss: 0.7693, test_loss: 0.9656, test_f1: 0.5134
 epoch: 71, train_loss: 0.7706, test_loss: 0.9824, test_f1: 0.5109
 epoch: 72, train_loss: 0.7630, test_loss: 0.9651, test_f1: 0.5209
 epoch: 73, train_loss: 0.7669, test_loss: 0.9671, test_f1: 0.4935
 epoch: 74, train_loss: 0.7601, test_loss: 0.9881, test_f1: 0.5163
 epoch: 75, train_loss: 0.7775, test_loss: 0.9871, test_f1: 0.5082
 epoch: 76, train_loss: 0.7574, test_loss: 0.9698, test_f1: 0.5177
 epoch: 77, train_loss: 0.7748, test_loss: 0.9912, test_f1: 0.4871
 epoch: 78, train_loss: 0.7697, test_loss: 0.9989, test_f1: 0.5166
 epoch: 79, train_loss: 0.7683, test_loss: 0.9673, test_f1: 0.5151
 epoch: 80, train_loss: 0.7636, test_loss: 0.9337, test_f1: 0.5420
 epoch: 81, train_loss: 0.7598, test_loss: 0.9514, test_f1: 0.5229
 epoch: 82, train_loss: 0.7679, test_loss: 0.9521, test_f1: 0.5175
 epoch: 83, train_loss: 0.7516, test_loss: 0.9633, test_f1: 0.5153
 epoch: 84, train_loss: 0.7507, test_loss: 0.9609, test_f1: 0.5022
 epoch: 85, train_loss: 0.7662, test_loss: 0.9714, test_f1: 0.4878
 epoch: 86, train_loss: 0.7497, test_loss: 0.9639, test_f1: 0.5219
 epoch: 87, train_loss: 0.7560, test_loss: 0.9682, test_f1: 0.5155
 epoch: 88, train_loss: 0.7479, test_loss: 0.9395, test_f1: 0.5226
 epoch: 89, train_loss: 0.7591, test_loss: 0.9292, test_f1: 0.5016
 epoch: 90, train_loss: 0.7490, test_loss: 0.9605, test_f1: 0.5286
 epoch: 91, train_loss: 0.7390, test_loss: 0.9733, test_f1: 0.5087
 epoch: 92, train_loss: 0.7520, test_loss: 0.9724, test_f1: 0.5179
 epoch: 93, train_loss: 0.7571, test_loss: 0.9585, test_f1: 0.5406
 epoch: 94, train_loss: 0.7532, test_loss: 0.9546, test_f1: 0.5120
 epoch: 95, train_loss: 0.7519, test_loss: 0.9987, test_f1: 0.5069
 epoch: 96, train_loss: 0.7558, test_loss: 0.9851, test_f1: 0.5103
 epoch: 97, train_loss: 0.7478, test_loss: 0.9445, test_f1: 0.5291
 epoch: 98, train_loss: 0.7346, test_loss: 0.9407, test_f1: 0.5196
 epoch: 99, train_loss: 0.7463, test_loss: 0.9492, test_f1: 0.5163
##################ITERATION #2 ****************************************
 epoch: 0, train_loss: 1.2934, test_loss: 1.1704, test_f1: 0.3438
 epoch: 1, train_loss: 1.1504, test_loss: 1.0770, test_f1: 0.4431
 epoch: 2, train_loss: 1.1014, test_loss: 1.0564, test_f1: 0.4297
 epoch: 3, train_loss: 1.0776, test_loss: 1.0364, test_f1: 0.4263
 epoch: 4, train_loss: 1.0619, test_loss: 1.0642, test_f1: 0.4119
 epoch: 5, train_loss: 1.0598, test_loss: 1.0489, test_f1: 0.4693
 epoch: 6, train_loss: 1.0377, test_loss: 1.0169, test_f1: 0.4625
 epoch: 7, train_loss: 1.0289, test_loss: 1.0048, test_f1: 0.4664
 epoch: 8, train_loss: 1.0181, test_loss: 1.0039, test_f1: 0.4769
 epoch: 9, train_loss: 1.0066, test_loss: 1.0092, test_f1: 0.4836
 epoch: 10, train_loss: 1.0068, test_loss: 1.0228, test_f1: 0.4636
 epoch: 11, train_loss: 0.9918, test_loss: 0.9998, test_f1: 0.4796
 epoch: 12, train_loss: 0.9767, test_loss: 0.9984, test_f1: 0.4881
 epoch: 13, train_loss: 0.9851, test_loss: 0.9759, test_f1: 0.4696
 epoch: 14, train_loss: 0.9604, test_loss: 0.9791, test_f1: 0.5177
 epoch: 15, train_loss: 0.9504, test_loss: 0.9486, test_f1: 0.5157
 epoch: 16, train_loss: 0.9454, test_loss: 1.0569, test_f1: 0.4675
 epoch: 17, train_loss: 0.9306, test_loss: 0.9680, test_f1: 0.4701
 epoch: 18, train_loss: 0.9250, test_loss: 0.9489, test_f1: 0.5025
 epoch: 19, train_loss: 0.9188, test_loss: 0.9546, test_f1: 0.5060
 epoch: 20, train_loss: 0.9139, test_loss: 0.9604, test_f1: 0.4926
 epoch: 21, train_loss: 0.9148, test_loss: 0.9254, test_f1: 0.5268
 epoch: 22, train_loss: 0.8888, test_loss: 0.9461, test_f1: 0.5119
 epoch: 23, train_loss: 0.9027, test_loss: 0.9455, test_f1: 0.5165
 epoch: 24, train_loss: 0.8961, test_loss: 0.9378, test_f1: 0.5164
 epoch: 25, train_loss: 0.9039, test_loss: 0.9911, test_f1: 0.4887
 epoch: 26, train_loss: 0.8981, test_loss: 0.9635, test_f1: 0.4925
 epoch: 27, train_loss: 0.9104, test_loss: 0.9698, test_f1: 0.4859
 epoch: 28, train_loss: 0.8727, test_loss: 0.9664, test_f1: 0.4956
 epoch: 29, train_loss: 0.8785, test_loss: 0.9441, test_f1: 0.5184
 epoch: 30, train_loss: 0.8748, test_loss: 0.9213, test_f1: 0.5172
 epoch: 31, train_loss: 0.8760, test_loss: 0.9357, test_f1: 0.5074
 epoch: 32, train_loss: 0.8631, test_loss: 0.9278, test_f1: 0.5182
 epoch: 33, train_loss: 0.8610, test_loss: 0.9299, test_f1: 0.5083
 epoch: 34, train_loss: 0.8671, test_loss: 0.9223, test_f1: 0.5123
 epoch: 35, train_loss: 0.8598, test_loss: 0.9383, test_f1: 0.5211
 epoch: 36, train_loss: 0.8618, test_loss: 0.9420, test_f1: 0.5021
 epoch: 37, train_loss: 0.8518, test_loss: 0.9443, test_f1: 0.5071
 epoch: 38, train_loss: 0.8535, test_loss: 0.9088, test_f1: 0.5052
 epoch: 39, train_loss: 0.8424, test_loss: 0.9549, test_f1: 0.5041
 epoch: 40, train_loss: 0.8440, test_loss: 0.9317, test_f1: 0.4989
 epoch: 41, train_loss: 0.8359, test_loss: 0.9472, test_f1: 0.4924
 epoch: 42, train_loss: 0.8390, test_loss: 0.8717, test_f1: 0.5170
 epoch: 43, train_loss: 0.8417, test_loss: 0.9293, test_f1: 0.5210
 epoch: 44, train_loss: 0.8348, test_loss: 0.9690, test_f1: 0.4898
 epoch: 45, train_loss: 0.8308, test_loss: 0.8976, test_f1: 0.5082
 epoch: 46, train_loss: 0.8399, test_loss: 0.9232, test_f1: 0.5182
 epoch: 47, train_loss: 0.8242, test_loss: 0.9304, test_f1: 0.5088
 epoch: 48, train_loss: 0.8252, test_loss: 0.8955, test_f1: 0.5170
 epoch: 49, train_loss: 0.8320, test_loss: 0.9357, test_f1: 0.5155
 epoch: 50, train_loss: 0.8224, test_loss: 0.9683, test_f1: 0.5012
 epoch: 51, train_loss: 0.8163, test_loss: 0.9206, test_f1: 0.5057
 epoch: 52, train_loss: 0.8044, test_loss: 0.9244, test_f1: 0.5129
 epoch: 53, train_loss: 0.8152, test_loss: 0.9170, test_f1: 0.5140
 epoch: 54, train_loss: 0.8127, test_loss: 0.9508, test_f1: 0.5029
 epoch: 55, train_loss: 0.8064, test_loss: 0.9049, test_f1: 0.5025
 epoch: 56, train_loss: 0.8102, test_loss: 0.9382, test_f1: 0.5081
 epoch: 57, train_loss: 0.8035, test_loss: 0.8836, test_f1: 0.5282
 epoch: 58, train_loss: 0.8138, test_loss: 0.9143, test_f1: 0.5144
 epoch: 59, train_loss: 0.8007, test_loss: 0.9040, test_f1: 0.5225
 epoch: 60, train_loss: 0.7950, test_loss: 0.9333, test_f1: 0.5165
 epoch: 61, train_loss: 0.8002, test_loss: 0.9173, test_f1: 0.5329
 epoch: 62, train_loss: 0.7972, test_loss: 0.9113, test_f1: 0.5166
 epoch: 63, train_loss: 0.7941, test_loss: 0.9384, test_f1: 0.5092
 epoch: 64, train_loss: 0.8018, test_loss: 0.9050, test_f1: 0.5316
 epoch: 65, train_loss: 0.7902, test_loss: 0.8976, test_f1: 0.5229
 epoch: 66, train_loss: 0.7898, test_loss: 0.9246, test_f1: 0.5220
 epoch: 67, train_loss: 0.7927, test_loss: 0.9443, test_f1: 0.5027
 epoch: 68, train_loss: 0.7898, test_loss: 0.9134, test_f1: 0.5136
 epoch: 69, train_loss: 0.7963, test_loss: 0.9515, test_f1: 0.5138
 epoch: 70, train_loss: 0.7925, test_loss: 0.9299, test_f1: 0.5120
 epoch: 71, train_loss: 0.7851, test_loss: 0.9634, test_f1: 0.5078
 epoch: 72, train_loss: 0.7886, test_loss: 0.9823, test_f1: 0.5049
 epoch: 73, train_loss: 0.7891, test_loss: 0.9235, test_f1: 0.5166
 epoch: 74, train_loss: 0.7824, test_loss: 0.9133, test_f1: 0.5215
 epoch: 75, train_loss: 0.7868, test_loss: 0.8930, test_f1: 0.5295
 epoch: 76, train_loss: 0.7846, test_loss: 0.9308, test_f1: 0.5070
 epoch: 77, train_loss: 0.7824, test_loss: 0.9524, test_f1: 0.5206
 epoch: 78, train_loss: 0.7744, test_loss: 0.9279, test_f1: 0.5142
 epoch: 79, train_loss: 0.7768, test_loss: 0.9036, test_f1: 0.5166
 epoch: 80, train_loss: 0.7787, test_loss: 0.9283, test_f1: 0.5194
 epoch: 81, train_loss: 0.7809, test_loss: 0.9275, test_f1: 0.5057
 epoch: 82, train_loss: 0.7853, test_loss: 0.9656, test_f1: 0.5048
 epoch: 83, train_loss: 0.7763, test_loss: 0.8988, test_f1: 0.5179
 epoch: 84, train_loss: 0.7882, test_loss: 0.9834, test_f1: 0.5067
 epoch: 85, train_loss: 0.7716, test_loss: 0.9767, test_f1: 0.5006
 epoch: 86, train_loss: 0.7754, test_loss: 0.9055, test_f1: 0.5216
 epoch: 87, train_loss: 0.7628, test_loss: 0.9337, test_f1: 0.5133
 epoch: 88, train_loss: 0.7703, test_loss: 0.8962, test_f1: 0.5159
 epoch: 89, train_loss: 0.7768, test_loss: 0.9210, test_f1: 0.5250
 epoch: 90, train_loss: 0.7740, test_loss: 0.9588, test_f1: 0.5107
 epoch: 91, train_loss: 0.7735, test_loss: 0.9338, test_f1: 0.5051
 epoch: 92, train_loss: 0.7819, test_loss: 0.9481, test_f1: 0.4999
 epoch: 93, train_loss: 0.7778, test_loss: 0.9065, test_f1: 0.5011
 epoch: 94, train_loss: 0.7619, test_loss: 0.8885, test_f1: 0.5255
 epoch: 95, train_loss: 0.7705, test_loss: 0.8792, test_f1: 0.5241
 epoch: 96, train_loss: 0.7601, test_loss: 0.9382, test_f1: 0.5124
 epoch: 97, train_loss: 0.7590, test_loss: 0.9501, test_f1: 0.4963
 epoch: 98, train_loss: 0.7587, test_loss: 0.8846, test_f1: 0.5231
 epoch: 99, train_loss: 0.7624, test_loss: 0.9531, test_f1: 0.4944
##################ITERATION #3 ****************************************
 epoch: 0, train_loss: 1.2412, test_loss: 1.1627, test_f1: 0.4152
 epoch: 1, train_loss: 1.1374, test_loss: 1.0677, test_f1: 0.4152
 epoch: 2, train_loss: 1.0976, test_loss: 1.0370, test_f1: 0.4515
 epoch: 3, train_loss: 1.0533, test_loss: 1.0319, test_f1: 0.4469
 epoch: 4, train_loss: 1.0322, test_loss: 1.0005, test_f1: 0.4709
 epoch: 5, train_loss: 1.0120, test_loss: 0.9955, test_f1: 0.4694
 epoch: 6, train_loss: 0.9863, test_loss: 0.9888, test_f1: 0.4797
 epoch: 7, train_loss: 0.9731, test_loss: 0.9665, test_f1: 0.4535
 epoch: 8, train_loss: 0.9657, test_loss: 0.9771, test_f1: 0.4848
 epoch: 9, train_loss: 0.9517, test_loss: 0.9695, test_f1: 0.5070
 epoch: 10, train_loss: 0.9468, test_loss: 0.9651, test_f1: 0.4898
 epoch: 11, train_loss: 0.9386, test_loss: 0.9562, test_f1: 0.4949
 epoch: 12, train_loss: 0.9170, test_loss: 0.9398, test_f1: 0.5253
 epoch: 13, train_loss: 0.9192, test_loss: 0.9623, test_f1: 0.5173
 epoch: 14, train_loss: 0.9083, test_loss: 0.9405, test_f1: 0.4986
 epoch: 15, train_loss: 0.8969, test_loss: 0.9332, test_f1: 0.5188
 epoch: 16, train_loss: 0.8981, test_loss: 0.9233, test_f1: 0.5209
 epoch: 17, train_loss: 0.8872, test_loss: 0.9020, test_f1: 0.5144
 epoch: 18, train_loss: 0.8883, test_loss: 0.9332, test_f1: 0.5246
 epoch: 19, train_loss: 0.8773, test_loss: 0.9833, test_f1: 0.4692
 epoch: 20, train_loss: 0.8764, test_loss: 0.9001, test_f1: 0.5168
 epoch: 21, train_loss: 0.8669, test_loss: 0.9045, test_f1: 0.5236
 epoch: 22, train_loss: 0.8639, test_loss: 0.9240, test_f1: 0.5222
 epoch: 23, train_loss: 0.8595, test_loss: 0.9291, test_f1: 0.5255
 epoch: 24, train_loss: 0.8545, test_loss: 0.9133, test_f1: 0.5287
 epoch: 25, train_loss: 0.8430, test_loss: 0.9878, test_f1: 0.4917
 epoch: 26, train_loss: 0.8523, test_loss: 0.9541, test_f1: 0.5099
 epoch: 27, train_loss: 0.8629, test_loss: 0.9125, test_f1: 0.5314
 epoch: 28, train_loss: 0.8368, test_loss: 0.9521, test_f1: 0.5194
 epoch: 29, train_loss: 0.8466, test_loss: 0.9287, test_f1: 0.5060
 epoch: 30, train_loss: 0.8324, test_loss: 0.9584, test_f1: 0.4973
 epoch: 31, train_loss: 0.8224, test_loss: 0.9389, test_f1: 0.4988
 epoch: 32, train_loss: 0.8170, test_loss: 0.9163, test_f1: 0.5071
 epoch: 33, train_loss: 0.8274, test_loss: 0.9092, test_f1: 0.5321
 epoch: 34, train_loss: 0.8221, test_loss: 0.9180, test_f1: 0.5093
 epoch: 35, train_loss: 0.8079, test_loss: 0.9481, test_f1: 0.5137
 epoch: 36, train_loss: 0.8014, test_loss: 0.9369, test_f1: 0.4979
 epoch: 37, train_loss: 0.8035, test_loss: 0.9212, test_f1: 0.4949
 epoch: 38, train_loss: 0.8025, test_loss: 0.9125, test_f1: 0.5176
 epoch: 39, train_loss: 0.8056, test_loss: 0.9427, test_f1: 0.5047
 epoch: 40, train_loss: 0.8067, test_loss: 0.9257, test_f1: 0.5066
 epoch: 41, train_loss: 0.8015, test_loss: 0.8929, test_f1: 0.5336
 epoch: 42, train_loss: 0.8027, test_loss: 0.9231, test_f1: 0.5134
 epoch: 43, train_loss: 0.7897, test_loss: 0.9255, test_f1: 0.4964
 epoch: 44, train_loss: 0.7860, test_loss: 0.9203, test_f1: 0.5164
 epoch: 45, train_loss: 0.7942, test_loss: 0.8748, test_f1: 0.5416
 epoch: 46, train_loss: 0.8010, test_loss: 0.9299, test_f1: 0.5071
 epoch: 47, train_loss: 0.7872, test_loss: 0.9231, test_f1: 0.5337
 epoch: 48, train_loss: 0.7875, test_loss: 0.9052, test_f1: 0.5334
 epoch: 49, train_loss: 0.7836, test_loss: 0.8450, test_f1: 0.5537
 epoch: 50, train_loss: 0.7764, test_loss: 0.9064, test_f1: 0.5244
 epoch: 51, train_loss: 0.7697, test_loss: 0.9224, test_f1: 0.5110
 epoch: 52, train_loss: 0.7618, test_loss: 0.8874, test_f1: 0.5317
 epoch: 53, train_loss: 0.7673, test_loss: 0.8642, test_f1: 0.5125
 epoch: 54, train_loss: 0.7618, test_loss: 0.8679, test_f1: 0.5257
 epoch: 55, train_loss: 0.7632, test_loss: 0.8867, test_f1: 0.5145
 epoch: 56, train_loss: 0.7604, test_loss: 0.9045, test_f1: 0.5178
 epoch: 57, train_loss: 0.7581, test_loss: 0.9072, test_f1: 0.5259
 epoch: 58, train_loss: 0.7383, test_loss: 0.9098, test_f1: 0.5233
 epoch: 59, train_loss: 0.7511, test_loss: 0.8993, test_f1: 0.5321
 epoch: 60, train_loss: 0.7538, test_loss: 0.9094, test_f1: 0.5241
 epoch: 61, train_loss: 0.7583, test_loss: 0.8885, test_f1: 0.5263
 epoch: 62, train_loss: 0.7510, test_loss: 0.8992, test_f1: 0.5332
 epoch: 63, train_loss: 0.7496, test_loss: 0.9381, test_f1: 0.4971
 epoch: 64, train_loss: 0.7574, test_loss: 0.8813, test_f1: 0.5252
 epoch: 65, train_loss: 0.7439, test_loss: 0.9476, test_f1: 0.5229
 epoch: 66, train_loss: 0.7482, test_loss: 0.9145, test_f1: 0.5159
 epoch: 67, train_loss: 0.7494, test_loss: 0.9061, test_f1: 0.5137
 epoch: 68, train_loss: 0.7482, test_loss: 0.9300, test_f1: 0.5143
 epoch: 69, train_loss: 0.7507, test_loss: 0.9194, test_f1: 0.5065
 epoch: 70, train_loss: 0.7395, test_loss: 0.9308, test_f1: 0.5048
 epoch: 71, train_loss: 0.7441, test_loss: 0.9172, test_f1: 0.5130
 epoch: 72, train_loss: 0.7383, test_loss: 0.9260, test_f1: 0.5125
 epoch: 73, train_loss: 0.7364, test_loss: 0.9155, test_f1: 0.5187
 epoch: 74, train_loss: 0.7492, test_loss: 0.9168, test_f1: 0.5234
 epoch: 75, train_loss: 0.7232, test_loss: 0.9320, test_f1: 0.5266
 epoch: 76, train_loss: 0.7358, test_loss: 0.9585, test_f1: 0.5058
 epoch: 77, train_loss: 0.7327, test_loss: 0.9356, test_f1: 0.5288
 epoch: 78, train_loss: 0.7337, test_loss: 0.9642, test_f1: 0.5161
 epoch: 79, train_loss: 0.7411, test_loss: 0.9572, test_f1: 0.5245
 epoch: 80, train_loss: 0.7351, test_loss: 0.9397, test_f1: 0.5370
 epoch: 81, train_loss: 0.7333, test_loss: 0.9346, test_f1: 0.5209
 epoch: 82, train_loss: 0.7300, test_loss: 0.9312, test_f1: 0.5243
 epoch: 83, train_loss: 0.7163, test_loss: 0.9274, test_f1: 0.5398
 epoch: 84, train_loss: 0.7390, test_loss: 0.9127, test_f1: 0.5158
 epoch: 85, train_loss: 0.7276, test_loss: 0.9102, test_f1: 0.5529
 epoch: 86, train_loss: 0.7258, test_loss: 0.9297, test_f1: 0.5206
 epoch: 87, train_loss: 0.7141, test_loss: 0.9365, test_f1: 0.5251
 epoch: 88, train_loss: 0.7142, test_loss: 0.9111, test_f1: 0.5323
 epoch: 89, train_loss: 0.7254, test_loss: 0.9182, test_f1: 0.5387
 epoch: 90, train_loss: 0.7184, test_loss: 0.9719, test_f1: 0.5301
 epoch: 91, train_loss: 0.7253, test_loss: 0.9016, test_f1: 0.5379
 epoch: 92, train_loss: 0.7314, test_loss: 0.9297, test_f1: 0.5217
 epoch: 93, train_loss: 0.7093, test_loss: 0.9399, test_f1: 0.5308
 epoch: 94, train_loss: 0.7204, test_loss: 0.9483, test_f1: 0.5246
 epoch: 95, train_loss: 0.7129, test_loss: 0.8903, test_f1: 0.5380
 epoch: 96, train_loss: 0.7093, test_loss: 0.9083, test_f1: 0.5411
 epoch: 97, train_loss: 0.7109, test_loss: 0.9559, test_f1: 0.5308
 epoch: 98, train_loss: 0.7138, test_loss: 0.9354, test_f1: 0.5315
 epoch: 99, train_loss: 0.6976, test_loss: 0.9165, test_f1: 0.5527
##################ITERATION #4 ****************************************
 epoch: 0, train_loss: 1.2898, test_loss: 1.1034, test_f1: 0.3786
 epoch: 1, train_loss: 1.1037, test_loss: 1.0548, test_f1: 0.3847
 epoch: 2, train_loss: 1.0673, test_loss: 1.0285, test_f1: 0.4394
 epoch: 3, train_loss: 1.0570, test_loss: 1.0350, test_f1: 0.4376
 epoch: 4, train_loss: 1.0313, test_loss: 1.0149, test_f1: 0.4713
 epoch: 5, train_loss: 1.0201, test_loss: 0.9967, test_f1: 0.4408
 epoch: 6, train_loss: 0.9958, test_loss: 1.0418, test_f1: 0.4456
 epoch: 7, train_loss: 0.9857, test_loss: 0.9564, test_f1: 0.4805
 epoch: 8, train_loss: 0.9841, test_loss: 0.9922, test_f1: 0.4825
 epoch: 9, train_loss: 0.9635, test_loss: 1.0009, test_f1: 0.5093
 epoch: 10, train_loss: 0.9501, test_loss: 0.9675, test_f1: 0.5001
 epoch: 11, train_loss: 0.9394, test_loss: 1.0038, test_f1: 0.4978
 epoch: 12, train_loss: 0.9384, test_loss: 1.0129, test_f1: 0.5082
 epoch: 13, train_loss: 0.9304, test_loss: 1.0164, test_f1: 0.4980
 epoch: 14, train_loss: 0.9164, test_loss: 1.0607, test_f1: 0.4900
 epoch: 15, train_loss: 0.9141, test_loss: 1.0100, test_f1: 0.4938
 epoch: 16, train_loss: 0.9269, test_loss: 1.0000, test_f1: 0.5061
 epoch: 17, train_loss: 0.9102, test_loss: 1.0150, test_f1: 0.5102
 epoch: 18, train_loss: 0.8909, test_loss: 1.0050, test_f1: 0.5196
 epoch: 19, train_loss: 0.8922, test_loss: 0.9859, test_f1: 0.5280
 epoch: 20, train_loss: 0.8888, test_loss: 0.9690, test_f1: 0.5490
 epoch: 21, train_loss: 0.8704, test_loss: 0.9602, test_f1: 0.5392
 epoch: 22, train_loss: 0.8815, test_loss: 0.9808, test_f1: 0.5367
 epoch: 23, train_loss: 0.8662, test_loss: 1.0743, test_f1: 0.5178
 epoch: 24, train_loss: 0.8746, test_loss: 0.9663, test_f1: 0.5489
 epoch: 25, train_loss: 0.8633, test_loss: 0.9728, test_f1: 0.5315
 epoch: 26, train_loss: 0.8532, test_loss: 0.9570, test_f1: 0.5479
 epoch: 27, train_loss: 0.8619, test_loss: 0.9789, test_f1: 0.5337
 epoch: 28, train_loss: 0.8629, test_loss: 0.9776, test_f1: 0.5105
 epoch: 29, train_loss: 0.8474, test_loss: 0.9919, test_f1: 0.5320
 epoch: 30, train_loss: 0.8393, test_loss: 0.9090, test_f1: 0.5591
 epoch: 31, train_loss: 0.8289, test_loss: 0.9491, test_f1: 0.5413
 epoch: 32, train_loss: 0.8341, test_loss: 1.0382, test_f1: 0.5148
 epoch: 33, train_loss: 0.8301, test_loss: 0.9557, test_f1: 0.5466
 epoch: 34, train_loss: 0.8479, test_loss: 0.9971, test_f1: 0.5134
 epoch: 35, train_loss: 0.8427, test_loss: 0.9472, test_f1: 0.5375
 epoch: 36, train_loss: 0.8345, test_loss: 0.8849, test_f1: 0.5544
 epoch: 37, train_loss: 0.8161, test_loss: 0.9541, test_f1: 0.5410
 epoch: 38, train_loss: 0.8142, test_loss: 0.8990, test_f1: 0.5546
 epoch: 39, train_loss: 0.8040, test_loss: 0.9837, test_f1: 0.5280
 epoch: 40, train_loss: 0.8213, test_loss: 0.9324, test_f1: 0.5469
 epoch: 41, train_loss: 0.8064, test_loss: 0.8981, test_f1: 0.5521
 epoch: 42, train_loss: 0.8057, test_loss: 0.9747, test_f1: 0.5172
 epoch: 43, train_loss: 0.8183, test_loss: 0.8901, test_f1: 0.5481
 epoch: 44, train_loss: 0.8140, test_loss: 0.9126, test_f1: 0.5379
 epoch: 45, train_loss: 0.8054, test_loss: 0.9019, test_f1: 0.5448
 epoch: 46, train_loss: 0.8109, test_loss: 0.9364, test_f1: 0.5403
 epoch: 47, train_loss: 0.8014, test_loss: 0.9172, test_f1: 0.5558
 epoch: 48, train_loss: 0.8011, test_loss: 0.9272, test_f1: 0.5417
 epoch: 49, train_loss: 0.7992, test_loss: 0.9142, test_f1: 0.5471
 epoch: 50, train_loss: 0.7995, test_loss: 0.8816, test_f1: 0.5670
 epoch: 51, train_loss: 0.7770, test_loss: 0.8762, test_f1: 0.5524
 epoch: 52, train_loss: 0.7613, test_loss: 0.9149, test_f1: 0.5438
 epoch: 53, train_loss: 0.7759, test_loss: 0.8782, test_f1: 0.5557
 epoch: 54, train_loss: 0.7755, test_loss: 0.8875, test_f1: 0.5575
 epoch: 55, train_loss: 0.7696, test_loss: 0.9137, test_f1: 0.5403
 epoch: 56, train_loss: 0.7737, test_loss: 0.9000, test_f1: 0.5464
 epoch: 57, train_loss: 0.7710, test_loss: 0.9015, test_f1: 0.5573
 epoch: 58, train_loss: 0.7614, test_loss: 0.8952, test_f1: 0.5485
 epoch: 59, train_loss: 0.7529, test_loss: 0.8820, test_f1: 0.5484
 epoch: 60, train_loss: 0.7592, test_loss: 0.9089, test_f1: 0.5410
 epoch: 61, train_loss: 0.7524, test_loss: 0.8899, test_f1: 0.5444
 epoch: 62, train_loss: 0.7516, test_loss: 0.9161, test_f1: 0.5505
 epoch: 63, train_loss: 0.7598, test_loss: 0.9074, test_f1: 0.5500
 epoch: 64, train_loss: 0.7537, test_loss: 0.8978, test_f1: 0.5636
 epoch: 65, train_loss: 0.7541, test_loss: 0.8862, test_f1: 0.5536
 epoch: 66, train_loss: 0.7488, test_loss: 0.9197, test_f1: 0.5481
 epoch: 67, train_loss: 0.7594, test_loss: 0.8807, test_f1: 0.5582
 epoch: 68, train_loss: 0.7544, test_loss: 0.9291, test_f1: 0.5504
 epoch: 69, train_loss: 0.7583, test_loss: 0.8907, test_f1: 0.5607
 epoch: 70, train_loss: 0.7544, test_loss: 0.8941, test_f1: 0.5585
 epoch: 71, train_loss: 0.7475, test_loss: 0.8793, test_f1: 0.5535
 epoch: 72, train_loss: 0.7555, test_loss: 0.9048, test_f1: 0.5448
 epoch: 73, train_loss: 0.7380, test_loss: 0.8679, test_f1: 0.5467
 epoch: 74, train_loss: 0.7404, test_loss: 0.8936, test_f1: 0.5426
 epoch: 75, train_loss: 0.7340, test_loss: 0.8919, test_f1: 0.5613
 epoch: 76, train_loss: 0.7410, test_loss: 0.8949, test_f1: 0.5584
 epoch: 77, train_loss: 0.7336, test_loss: 0.9012, test_f1: 0.5523
 epoch: 78, train_loss: 0.7439, test_loss: 0.9009, test_f1: 0.5608
 epoch: 79, train_loss: 0.7297, test_loss: 0.8980, test_f1: 0.5498
 epoch: 80, train_loss: 0.7435, test_loss: 0.9014, test_f1: 0.5570
 epoch: 81, train_loss: 0.7242, test_loss: 0.8945, test_f1: 0.5753
 epoch: 82, train_loss: 0.7203, test_loss: 0.9016, test_f1: 0.5607
 epoch: 83, train_loss: 0.7391, test_loss: 0.9001, test_f1: 0.5482
 epoch: 84, train_loss: 0.7386, test_loss: 0.8782, test_f1: 0.5617
 epoch: 85, train_loss: 0.7335, test_loss: 0.8549, test_f1: 0.5624
 epoch: 86, train_loss: 0.7374, test_loss: 0.9144, test_f1: 0.5540
 epoch: 87, train_loss: 0.7261, test_loss: 0.8871, test_f1: 0.5712
 epoch: 88, train_loss: 0.7184, test_loss: 0.8910, test_f1: 0.5672
 epoch: 89, train_loss: 0.7335, test_loss: 0.9023, test_f1: 0.5590
 epoch: 90, train_loss: 0.7238, test_loss: 0.8761, test_f1: 0.5609
 epoch: 91, train_loss: 0.7248, test_loss: 0.8911, test_f1: 0.5550
 epoch: 92, train_loss: 0.7312, test_loss: 0.8630, test_f1: 0.5595
 epoch: 93, train_loss: 0.7265, test_loss: 0.9205, test_f1: 0.5402
 epoch: 94, train_loss: 0.7222, test_loss: 0.8925, test_f1: 0.5631
 epoch: 95, train_loss: 0.7176, test_loss: 0.9017, test_f1: 0.5457
 epoch: 96, train_loss: 0.7250, test_loss: 0.8984, test_f1: 0.5607
 epoch: 97, train_loss: 0.7170, test_loss: 0.8673, test_f1: 0.5758
 epoch: 98, train_loss: 0.7227, test_loss: 0.9119, test_f1: 0.5385
 epoch: 99, train_loss: 0.7143, test_loss: 0.8908, test_f1: 0.5772
##################ITERATION #5 ****************************************
 epoch: 0, train_loss: 1.2623, test_loss: 1.1251, test_f1: 0.3731
 epoch: 1, train_loss: 1.1062, test_loss: 1.0471, test_f1: 0.4440
 epoch: 2, train_loss: 1.0720, test_loss: 1.0347, test_f1: 0.4577
 epoch: 3, train_loss: 1.0433, test_loss: 1.0111, test_f1: 0.4505
 epoch: 4, train_loss: 1.0246, test_loss: 0.9937, test_f1: 0.4771
 epoch: 5, train_loss: 1.0094, test_loss: 0.9721, test_f1: 0.4714
 epoch: 6, train_loss: 0.9826, test_loss: 0.9496, test_f1: 0.5031
 epoch: 7, train_loss: 0.9741, test_loss: 0.9372, test_f1: 0.5105
 epoch: 8, train_loss: 0.9594, test_loss: 0.9070, test_f1: 0.4757
 epoch: 9, train_loss: 0.9627, test_loss: 0.9368, test_f1: 0.5053
 epoch: 10, train_loss: 0.9475, test_loss: 0.9006, test_f1: 0.5451
 epoch: 11, train_loss: 0.9274, test_loss: 0.9005, test_f1: 0.5248
 epoch: 12, train_loss: 0.9175, test_loss: 0.8914, test_f1: 0.5157
 epoch: 13, train_loss: 0.9111, test_loss: 0.9145, test_f1: 0.5260
 epoch: 14, train_loss: 0.9147, test_loss: 0.8810, test_f1: 0.5149
 epoch: 15, train_loss: 0.9115, test_loss: 0.9217, test_f1: 0.5104
 epoch: 16, train_loss: 0.8995, test_loss: 0.8919, test_f1: 0.5093
 epoch: 17, train_loss: 0.8999, test_loss: 0.9203, test_f1: 0.5193
 epoch: 18, train_loss: 0.8776, test_loss: 0.8979, test_f1: 0.5371
 epoch: 19, train_loss: 0.9047, test_loss: 0.9357, test_f1: 0.5426
 epoch: 20, train_loss: 0.8776, test_loss: 0.8352, test_f1: 0.5332
 epoch: 21, train_loss: 0.8878, test_loss: 0.8951, test_f1: 0.5151
 epoch: 22, train_loss: 0.8632, test_loss: 0.9609, test_f1: 0.4981
 epoch: 23, train_loss: 0.8734, test_loss: 0.8924, test_f1: 0.5241
 epoch: 24, train_loss: 0.8549, test_loss: 0.9344, test_f1: 0.4941
 epoch: 25, train_loss: 0.8566, test_loss: 0.9132, test_f1: 0.4962
 epoch: 26, train_loss: 0.8492, test_loss: 0.8658, test_f1: 0.5151
 epoch: 27, train_loss: 0.8594, test_loss: 0.9091, test_f1: 0.5126
 epoch: 28, train_loss: 0.8404, test_loss: 0.9434, test_f1: 0.5092
 epoch: 29, train_loss: 0.8288, test_loss: 0.9028, test_f1: 0.5324
 epoch: 30, train_loss: 0.8401, test_loss: 0.9251, test_f1: 0.5181
 epoch: 31, train_loss: 0.8306, test_loss: 0.9453, test_f1: 0.5164
 epoch: 32, train_loss: 0.8192, test_loss: 0.9282, test_f1: 0.5250
 epoch: 33, train_loss: 0.8221, test_loss: 0.9750, test_f1: 0.5134
 epoch: 34, train_loss: 0.8212, test_loss: 0.9718, test_f1: 0.4835
 epoch: 35, train_loss: 0.8243, test_loss: 0.9244, test_f1: 0.5437
 epoch: 36, train_loss: 0.8191, test_loss: 0.9108, test_f1: 0.5066
 epoch: 37, train_loss: 0.8161, test_loss: 0.9530, test_f1: 0.5168
 epoch: 38, train_loss: 0.8060, test_loss: 0.9236, test_f1: 0.5297
 epoch: 39, train_loss: 0.8058, test_loss: 0.9292, test_f1: 0.5074
 epoch: 40, train_loss: 0.8028, test_loss: 0.9296, test_f1: 0.5302
 epoch: 41, train_loss: 0.8022, test_loss: 0.9163, test_f1: 0.5252
 epoch: 42, train_loss: 0.8143, test_loss: 0.8920, test_f1: 0.5263
 epoch: 43, train_loss: 0.8050, test_loss: 0.9625, test_f1: 0.5070
 epoch: 44, train_loss: 0.8022, test_loss: 0.9224, test_f1: 0.5297
 epoch: 45, train_loss: 0.8054, test_loss: 0.9285, test_f1: 0.5214
 epoch: 46, train_loss: 0.7941, test_loss: 0.9037, test_f1: 0.5323
 epoch: 47, train_loss: 0.7828, test_loss: 0.9512, test_f1: 0.5214
 epoch: 48, train_loss: 0.7838, test_loss: 0.9679, test_f1: 0.5314
 epoch: 49, train_loss: 0.7861, test_loss: 0.9287, test_f1: 0.5431
 epoch: 50, train_loss: 0.7837, test_loss: 0.9774, test_f1: 0.5012
 epoch: 51, train_loss: 0.7770, test_loss: 0.9721, test_f1: 0.5192
 epoch: 52, train_loss: 0.7618, test_loss: 0.9247, test_f1: 0.5230
 epoch: 53, train_loss: 0.7630, test_loss: 0.9297, test_f1: 0.5274
 epoch: 54, train_loss: 0.7477, test_loss: 0.9327, test_f1: 0.5274
 epoch: 55, train_loss: 0.7662, test_loss: 0.9490, test_f1: 0.5300
 epoch: 56, train_loss: 0.7550, test_loss: 0.9400, test_f1: 0.5126
 epoch: 57, train_loss: 0.7608, test_loss: 0.9542, test_f1: 0.5183
 epoch: 58, train_loss: 0.7498, test_loss: 0.9542, test_f1: 0.5307
 epoch: 59, train_loss: 0.7579, test_loss: 0.9601, test_f1: 0.5258
 epoch: 60, train_loss: 0.7641, test_loss: 0.9379, test_f1: 0.5302
 epoch: 61, train_loss: 0.7572, test_loss: 0.9427, test_f1: 0.5236
 epoch: 62, train_loss: 0.7559, test_loss: 0.9480, test_f1: 0.5273
 epoch: 63, train_loss: 0.7360, test_loss: 0.9379, test_f1: 0.5307
 epoch: 64, train_loss: 0.7401, test_loss: 0.9462, test_f1: 0.5183
 epoch: 65, train_loss: 0.7349, test_loss: 0.9329, test_f1: 0.5285
 epoch: 66, train_loss: 0.7394, test_loss: 0.9511, test_f1: 0.5081
 epoch: 67, train_loss: 0.7519, test_loss: 0.9747, test_f1: 0.5227
 epoch: 68, train_loss: 0.7442, test_loss: 0.9311, test_f1: 0.5356
 epoch: 69, train_loss: 0.7353, test_loss: 0.9714, test_f1: 0.5338
 epoch: 70, train_loss: 0.7403, test_loss: 0.9724, test_f1: 0.5251
 epoch: 71, train_loss: 0.7455, test_loss: 0.9721, test_f1: 0.5028
 epoch: 72, train_loss: 0.7312, test_loss: 1.0235, test_f1: 0.5051
 epoch: 73, train_loss: 0.7397, test_loss: 0.9684, test_f1: 0.5185
 epoch: 74, train_loss: 0.7332, test_loss: 0.9577, test_f1: 0.5177
 epoch: 75, train_loss: 0.7292, test_loss: 0.9410, test_f1: 0.5250
 epoch: 76, train_loss: 0.7319, test_loss: 0.9534, test_f1: 0.5162
 epoch: 77, train_loss: 0.7343, test_loss: 1.0070, test_f1: 0.5062
 epoch: 78, train_loss: 0.7431, test_loss: 0.9347, test_f1: 0.5380
 epoch: 79, train_loss: 0.7325, test_loss: 0.9657, test_f1: 0.5268
 epoch: 80, train_loss: 0.7303, test_loss: 0.9780, test_f1: 0.5099
 epoch: 81, train_loss: 0.7288, test_loss: 1.0241, test_f1: 0.5125
 epoch: 82, train_loss: 0.7270, test_loss: 0.9477, test_f1: 0.5228
 epoch: 83, train_loss: 0.7426, test_loss: 1.0090, test_f1: 0.4982
 epoch: 84, train_loss: 0.7227, test_loss: 0.9871, test_f1: 0.5205
 epoch: 85, train_loss: 0.7217, test_loss: 1.0084, test_f1: 0.5161
 epoch: 86, train_loss: 0.7249, test_loss: 1.0206, test_f1: 0.4984
 epoch: 87, train_loss: 0.7298, test_loss: 0.9376, test_f1: 0.5412
 epoch: 88, train_loss: 0.7282, test_loss: 0.9923, test_f1: 0.5285
 epoch: 89, train_loss: 0.7200, test_loss: 0.9664, test_f1: 0.5157
 epoch: 90, train_loss: 0.7302, test_loss: 1.0291, test_f1: 0.5196
 epoch: 91, train_loss: 0.7104, test_loss: 0.9901, test_f1: 0.5385
 epoch: 92, train_loss: 0.7269, test_loss: 0.9694, test_f1: 0.5368
 epoch: 93, train_loss: 0.7208, test_loss: 0.9964, test_f1: 0.5193
 epoch: 94, train_loss: 0.7238, test_loss: 1.0216, test_f1: 0.4956
 epoch: 95, train_loss: 0.7097, test_loss: 0.9424, test_f1: 0.5211
 epoch: 96, train_loss: 0.7119, test_loss: 0.9730, test_f1: 0.5126
 epoch: 97, train_loss: 0.7088, test_loss: 1.0015, test_f1: 0.5115
 epoch: 98, train_loss: 0.7126, test_loss: 0.9635, test_f1: 0.5248
 epoch: 99, train_loss: 0.7168, test_loss: 0.9776, test_f1: 0.5314
##################ITERATION #6 ****************************************
 epoch: 0, train_loss: 1.3657, test_loss: 1.1428, test_f1: 0.4002
 epoch: 1, train_loss: 1.1360, test_loss: 1.0684, test_f1: 0.4232
 epoch: 2, train_loss: 1.0817, test_loss: 1.0586, test_f1: 0.3978
 epoch: 3, train_loss: 1.0629, test_loss: 1.1480, test_f1: 0.4017
 epoch: 4, train_loss: 1.0330, test_loss: 1.0175, test_f1: 0.4733
 epoch: 5, train_loss: 1.0269, test_loss: 1.0228, test_f1: 0.4729
 epoch: 6, train_loss: 1.0150, test_loss: 1.0320, test_f1: 0.4552
 epoch: 7, train_loss: 0.9963, test_loss: 1.0304, test_f1: 0.4424
 epoch: 8, train_loss: 0.9963, test_loss: 1.0174, test_f1: 0.4904
 epoch: 9, train_loss: 0.9837, test_loss: 1.0675, test_f1: 0.4529
 epoch: 10, train_loss: 0.9862, test_loss: 0.9991, test_f1: 0.4694
 epoch: 11, train_loss: 0.9650, test_loss: 1.0188, test_f1: 0.4473
 epoch: 12, train_loss: 0.9545, test_loss: 1.0376, test_f1: 0.4618
 epoch: 13, train_loss: 0.9534, test_loss: 0.9904, test_f1: 0.4876
 epoch: 14, train_loss: 0.9450, test_loss: 0.9926, test_f1: 0.4880
 epoch: 15, train_loss: 0.9468, test_loss: 0.9481, test_f1: 0.4811
 epoch: 16, train_loss: 0.9317, test_loss: 0.9673, test_f1: 0.5030
 epoch: 17, train_loss: 0.9303, test_loss: 0.9611, test_f1: 0.5005
 epoch: 18, train_loss: 0.9294, test_loss: 0.9720, test_f1: 0.4743
 epoch: 19, train_loss: 0.9094, test_loss: 0.9286, test_f1: 0.5081
 epoch: 20, train_loss: 0.9056, test_loss: 0.9428, test_f1: 0.5166
 epoch: 21, train_loss: 0.9061, test_loss: 0.9505, test_f1: 0.5031
 epoch: 22, train_loss: 0.9023, test_loss: 0.9642, test_f1: 0.4955
 epoch: 23, train_loss: 0.8974, test_loss: 0.9346, test_f1: 0.5196
 epoch: 24, train_loss: 0.8845, test_loss: 0.9539, test_f1: 0.5031
 epoch: 25, train_loss: 0.8885, test_loss: 0.9849, test_f1: 0.4909
 epoch: 26, train_loss: 0.8783, test_loss: 0.9237, test_f1: 0.5203
 epoch: 27, train_loss: 0.8743, test_loss: 0.8927, test_f1: 0.5186
 epoch: 28, train_loss: 0.8800, test_loss: 0.9691, test_f1: 0.4877
 epoch: 29, train_loss: 0.8654, test_loss: 0.9377, test_f1: 0.5266
 epoch: 30, train_loss: 0.8695, test_loss: 0.8895, test_f1: 0.5194
 epoch: 31, train_loss: 0.8637, test_loss: 0.9130, test_f1: 0.5215
 epoch: 32, train_loss: 0.8523, test_loss: 0.8914, test_f1: 0.5243
 epoch: 33, train_loss: 0.8582, test_loss: 0.9558, test_f1: 0.5142
 epoch: 34, train_loss: 0.8422, test_loss: 0.9466, test_f1: 0.5171
 epoch: 35, train_loss: 0.8458, test_loss: 0.9046, test_f1: 0.4930
 epoch: 36, train_loss: 0.8480, test_loss: 0.8447, test_f1: 0.5471
 epoch: 37, train_loss: 0.8438, test_loss: 0.9840, test_f1: 0.4964
 epoch: 38, train_loss: 0.8460, test_loss: 0.9501, test_f1: 0.5080
 epoch: 39, train_loss: 0.8376, test_loss: 0.9071, test_f1: 0.5169
 epoch: 40, train_loss: 0.8329, test_loss: 0.9579, test_f1: 0.4941
 epoch: 41, train_loss: 0.8420, test_loss: 0.9011, test_f1: 0.5112
 epoch: 42, train_loss: 0.8245, test_loss: 0.8534, test_f1: 0.5185
 epoch: 43, train_loss: 0.8326, test_loss: 0.8937, test_f1: 0.5210
 epoch: 44, train_loss: 0.8130, test_loss: 0.9111, test_f1: 0.5220
 epoch: 45, train_loss: 0.8193, test_loss: 0.9296, test_f1: 0.5132
 epoch: 46, train_loss: 0.8106, test_loss: 0.9132, test_f1: 0.5276
 epoch: 47, train_loss: 0.8141, test_loss: 0.8667, test_f1: 0.5199
 epoch: 48, train_loss: 0.8108, test_loss: 0.9458, test_f1: 0.5113
 epoch: 49, train_loss: 0.8027, test_loss: 0.9514, test_f1: 0.4984
 epoch: 50, train_loss: 0.8113, test_loss: 0.8492, test_f1: 0.5290
 epoch: 51, train_loss: 0.7886, test_loss: 0.8786, test_f1: 0.5223
 epoch: 52, train_loss: 0.7820, test_loss: 0.9414, test_f1: 0.4930
 epoch: 53, train_loss: 0.7813, test_loss: 0.8419, test_f1: 0.5297
 epoch: 54, train_loss: 0.7833, test_loss: 0.9087, test_f1: 0.5105
 epoch: 55, train_loss: 0.7720, test_loss: 0.8303, test_f1: 0.5427
 epoch: 56, train_loss: 0.7756, test_loss: 0.9113, test_f1: 0.5167
 epoch: 57, train_loss: 0.7813, test_loss: 0.9186, test_f1: 0.5035
 epoch: 58, train_loss: 0.7864, test_loss: 0.8644, test_f1: 0.5410
 epoch: 59, train_loss: 0.7692, test_loss: 0.8682, test_f1: 0.5257
 epoch: 60, train_loss: 0.7691, test_loss: 0.9139, test_f1: 0.5036
 epoch: 61, train_loss: 0.7693, test_loss: 0.8605, test_f1: 0.5282
 epoch: 62, train_loss: 0.7690, test_loss: 0.8420, test_f1: 0.5370
 epoch: 63, train_loss: 0.7581, test_loss: 0.8697, test_f1: 0.5279
 epoch: 64, train_loss: 0.7748, test_loss: 0.8571, test_f1: 0.5360
 epoch: 65, train_loss: 0.7635, test_loss: 0.9173, test_f1: 0.5218
 epoch: 66, train_loss: 0.7627, test_loss: 0.8754, test_f1: 0.5289
 epoch: 67, train_loss: 0.7713, test_loss: 0.8798, test_f1: 0.5213
 epoch: 68, train_loss: 0.7599, test_loss: 0.8564, test_f1: 0.5246
 epoch: 69, train_loss: 0.7606, test_loss: 0.8407, test_f1: 0.5426
 epoch: 70, train_loss: 0.7507, test_loss: 0.8409, test_f1: 0.5366
 epoch: 71, train_loss: 0.7486, test_loss: 0.8587, test_f1: 0.5344
 epoch: 72, train_loss: 0.7551, test_loss: 0.8662, test_f1: 0.5310
 epoch: 73, train_loss: 0.7530, test_loss: 0.8713, test_f1: 0.5324
 epoch: 74, train_loss: 0.7526, test_loss: 0.8204, test_f1: 0.5412
 epoch: 75, train_loss: 0.7494, test_loss: 0.8389, test_f1: 0.5462
 epoch: 76, train_loss: 0.7566, test_loss: 0.8562, test_f1: 0.5336
 epoch: 77, train_loss: 0.7494, test_loss: 0.8533, test_f1: 0.5311
 epoch: 78, train_loss: 0.7527, test_loss: 0.8467, test_f1: 0.5249
 epoch: 79, train_loss: 0.7399, test_loss: 0.8447, test_f1: 0.5385
 epoch: 80, train_loss: 0.7473, test_loss: 0.8871, test_f1: 0.5363
 epoch: 81, train_loss: 0.7441, test_loss: 0.8680, test_f1: 0.5387
 epoch: 82, train_loss: 0.7322, test_loss: 0.8435, test_f1: 0.5641
 epoch: 83, train_loss: 0.7485, test_loss: 0.8537, test_f1: 0.5364
 epoch: 84, train_loss: 0.7472, test_loss: 0.8848, test_f1: 0.5280
 epoch: 85, train_loss: 0.7311, test_loss: 0.8384, test_f1: 0.5318
 epoch: 86, train_loss: 0.7328, test_loss: 0.8881, test_f1: 0.5387
 epoch: 87, train_loss: 0.7292, test_loss: 0.8486, test_f1: 0.5257
 epoch: 88, train_loss: 0.7408, test_loss: 0.8572, test_f1: 0.5240
 epoch: 89, train_loss: 0.7364, test_loss: 0.8319, test_f1: 0.5415
 epoch: 90, train_loss: 0.7304, test_loss: 0.8534, test_f1: 0.5483
 epoch: 91, train_loss: 0.7384, test_loss: 0.8420, test_f1: 0.5319
 epoch: 92, train_loss: 0.7272, test_loss: 0.8285, test_f1: 0.5345
 epoch: 93, train_loss: 0.7432, test_loss: 0.8329, test_f1: 0.5519
 epoch: 94, train_loss: 0.7321, test_loss: 0.8235, test_f1: 0.5389
 epoch: 95, train_loss: 0.7413, test_loss: 0.8382, test_f1: 0.5345
 epoch: 96, train_loss: 0.7382, test_loss: 0.8170, test_f1: 0.5325
 epoch: 97, train_loss: 0.7281, test_loss: 0.8297, test_f1: 0.5220
 epoch: 98, train_loss: 0.7254, test_loss: 0.8277, test_f1: 0.5278
 epoch: 99, train_loss: 0.7333, test_loss: 0.8254, test_f1: 0.5261
##################ITERATION #7 ****************************************
 epoch: 0, train_loss: 1.2753, test_loss: 1.1890, test_f1: 0.4486
 epoch: 1, train_loss: 1.1305, test_loss: 1.0330, test_f1: 0.4353
 epoch: 2, train_loss: 1.0787, test_loss: 1.0019, test_f1: 0.4999
 epoch: 3, train_loss: 1.0616, test_loss: 1.0005, test_f1: 0.4783
 epoch: 4, train_loss: 1.0448, test_loss: 0.9859, test_f1: 0.4376
 epoch: 5, train_loss: 1.0105, test_loss: 0.9454, test_f1: 0.4994
 epoch: 6, train_loss: 0.9993, test_loss: 0.9769, test_f1: 0.4873
 epoch: 7, train_loss: 0.9915, test_loss: 0.9431, test_f1: 0.4859
 epoch: 8, train_loss: 0.9769, test_loss: 0.9235, test_f1: 0.5222
 epoch: 9, train_loss: 0.9667, test_loss: 0.9431, test_f1: 0.4726
 epoch: 10, train_loss: 0.9577, test_loss: 0.9315, test_f1: 0.5046
 epoch: 11, train_loss: 0.9550, test_loss: 0.9204, test_f1: 0.5108
 epoch: 12, train_loss: 0.9439, test_loss: 0.8999, test_f1: 0.5096
 epoch: 13, train_loss: 0.9387, test_loss: 0.9703, test_f1: 0.4673
 epoch: 14, train_loss: 0.9254, test_loss: 0.8949, test_f1: 0.5224
 epoch: 15, train_loss: 0.9302, test_loss: 0.9128, test_f1: 0.5120
 epoch: 16, train_loss: 0.9169, test_loss: 0.9545, test_f1: 0.5323
 epoch: 17, train_loss: 0.9105, test_loss: 0.9182, test_f1: 0.5313
 epoch: 18, train_loss: 0.8971, test_loss: 0.9088, test_f1: 0.5356
 epoch: 19, train_loss: 0.9020, test_loss: 0.9107, test_f1: 0.5233
 epoch: 20, train_loss: 0.8936, test_loss: 0.8783, test_f1: 0.5342
 epoch: 21, train_loss: 0.8837, test_loss: 0.8883, test_f1: 0.5349
 epoch: 22, train_loss: 0.8903, test_loss: 0.8870, test_f1: 0.5116
 epoch: 23, train_loss: 0.8706, test_loss: 0.8923, test_f1: 0.5295
 epoch: 24, train_loss: 0.8782, test_loss: 0.9419, test_f1: 0.5175
 epoch: 25, train_loss: 0.8758, test_loss: 0.8381, test_f1: 0.5394
 epoch: 26, train_loss: 0.8699, test_loss: 1.1206, test_f1: 0.4760
 epoch: 27, train_loss: 0.8714, test_loss: 0.9144, test_f1: 0.5165
 epoch: 28, train_loss: 0.8628, test_loss: 0.8587, test_f1: 0.5277
 epoch: 29, train_loss: 0.8568, test_loss: 0.8660, test_f1: 0.5199
 epoch: 30, train_loss: 0.8508, test_loss: 0.8354, test_f1: 0.5218
 epoch: 31, train_loss: 0.8496, test_loss: 0.8978, test_f1: 0.5161
 epoch: 32, train_loss: 0.8401, test_loss: 0.8798, test_f1: 0.5351
 epoch: 33, train_loss: 0.8422, test_loss: 1.0146, test_f1: 0.5061
 epoch: 34, train_loss: 0.8407, test_loss: 0.8867, test_f1: 0.5243
 epoch: 35, train_loss: 0.8263, test_loss: 0.9335, test_f1: 0.5170
 epoch: 36, train_loss: 0.8256, test_loss: 0.9102, test_f1: 0.5314
 epoch: 37, train_loss: 0.8263, test_loss: 0.8561, test_f1: 0.5380
 epoch: 38, train_loss: 0.8329, test_loss: 0.8275, test_f1: 0.5291
 epoch: 39, train_loss: 0.8217, test_loss: 0.9080, test_f1: 0.5160
 epoch: 40, train_loss: 0.8181, test_loss: 0.8742, test_f1: 0.5478
 epoch: 41, train_loss: 0.8173, test_loss: 0.8137, test_f1: 0.5383
 epoch: 42, train_loss: 0.8080, test_loss: 0.9413, test_f1: 0.5040
 epoch: 43, train_loss: 0.8077, test_loss: 0.9304, test_f1: 0.5213
 epoch: 44, train_loss: 0.8064, test_loss: 0.8580, test_f1: 0.5247
 epoch: 45, train_loss: 0.8106, test_loss: 0.8971, test_f1: 0.5197
 epoch: 46, train_loss: 0.8056, test_loss: 0.8772, test_f1: 0.5439
 epoch: 47, train_loss: 0.8167, test_loss: 0.9589, test_f1: 0.5330
 epoch: 48, train_loss: 0.7910, test_loss: 0.8764, test_f1: 0.5283
 epoch: 49, train_loss: 0.8096, test_loss: 0.9013, test_f1: 0.5148
 epoch: 50, train_loss: 0.7844, test_loss: 0.9061, test_f1: 0.5213
 epoch: 51, train_loss: 0.7811, test_loss: 0.8775, test_f1: 0.5263
 epoch: 52, train_loss: 0.7830, test_loss: 0.8745, test_f1: 0.5279
 epoch: 53, train_loss: 0.7679, test_loss: 0.8961, test_f1: 0.5262
 epoch: 54, train_loss: 0.7628, test_loss: 0.8843, test_f1: 0.5270
 epoch: 55, train_loss: 0.7770, test_loss: 0.8383, test_f1: 0.5245
 epoch: 56, train_loss: 0.7746, test_loss: 0.8722, test_f1: 0.5333
 epoch: 57, train_loss: 0.7687, test_loss: 0.8881, test_f1: 0.5475
 epoch: 58, train_loss: 0.7819, test_loss: 0.9626, test_f1: 0.5110
 epoch: 59, train_loss: 0.7608, test_loss: 0.9254, test_f1: 0.5362
 epoch: 60, train_loss: 0.7608, test_loss: 0.8931, test_f1: 0.5216
 epoch: 61, train_loss: 0.7623, test_loss: 0.9041, test_f1: 0.5229
 epoch: 62, train_loss: 0.7763, test_loss: 0.8639, test_f1: 0.5412
 epoch: 63, train_loss: 0.7548, test_loss: 0.9061, test_f1: 0.5189
 epoch: 64, train_loss: 0.7592, test_loss: 0.8850, test_f1: 0.5170
 epoch: 65, train_loss: 0.7558, test_loss: 0.8722, test_f1: 0.5266
 epoch: 66, train_loss: 0.7640, test_loss: 0.8780, test_f1: 0.5275
 epoch: 67, train_loss: 0.7532, test_loss: 0.9041, test_f1: 0.5172
 epoch: 68, train_loss: 0.7548, test_loss: 0.8569, test_f1: 0.5363
 epoch: 69, train_loss: 0.7628, test_loss: 0.9364, test_f1: 0.5228
 epoch: 70, train_loss: 0.7565, test_loss: 0.8725, test_f1: 0.5281
 epoch: 71, train_loss: 0.7540, test_loss: 0.9040, test_f1: 0.5322
 epoch: 72, train_loss: 0.7455, test_loss: 0.8830, test_f1: 0.5315
 epoch: 73, train_loss: 0.7524, test_loss: 0.9213, test_f1: 0.5274
 epoch: 74, train_loss: 0.7570, test_loss: 0.9122, test_f1: 0.5231
 epoch: 75, train_loss: 0.7492, test_loss: 0.8960, test_f1: 0.5436
 epoch: 76, train_loss: 0.7549, test_loss: 0.8670, test_f1: 0.5397
 epoch: 77, train_loss: 0.7434, test_loss: 0.9251, test_f1: 0.5183
 epoch: 78, train_loss: 0.7400, test_loss: 0.8973, test_f1: 0.5310
 epoch: 79, train_loss: 0.7426, test_loss: 0.9463, test_f1: 0.5277
 epoch: 80, train_loss: 0.7412, test_loss: 0.9101, test_f1: 0.5317
 epoch: 81, train_loss: 0.7394, test_loss: 0.9194, test_f1: 0.5266
 epoch: 82, train_loss: 0.7234, test_loss: 0.9235, test_f1: 0.5146
 epoch: 83, train_loss: 0.7434, test_loss: 0.9493, test_f1: 0.5176
 epoch: 84, train_loss: 0.7407, test_loss: 0.9112, test_f1: 0.5279
 epoch: 85, train_loss: 0.7495, test_loss: 0.9203, test_f1: 0.5335
 epoch: 86, train_loss: 0.7259, test_loss: 0.9082, test_f1: 0.5222
 epoch: 87, train_loss: 0.7124, test_loss: 0.8968, test_f1: 0.5222
 epoch: 88, train_loss: 0.7343, test_loss: 0.8986, test_f1: 0.5489
 epoch: 89, train_loss: 0.7269, test_loss: 0.9350, test_f1: 0.5352
 epoch: 90, train_loss: 0.7202, test_loss: 0.8702, test_f1: 0.5501
 epoch: 91, train_loss: 0.7248, test_loss: 0.9441, test_f1: 0.5412
 epoch: 92, train_loss: 0.7251, test_loss: 0.9547, test_f1: 0.5315
 epoch: 93, train_loss: 0.7323, test_loss: 0.8421, test_f1: 0.5492
 epoch: 94, train_loss: 0.7257, test_loss: 0.8956, test_f1: 0.5386
 epoch: 95, train_loss: 0.7217, test_loss: 0.9218, test_f1: 0.5254
 epoch: 96, train_loss: 0.7162, test_loss: 0.9204, test_f1: 0.5409
 epoch: 97, train_loss: 0.7171, test_loss: 0.8989, test_f1: 0.5447
 epoch: 98, train_loss: 0.7310, test_loss: 0.9417, test_f1: 0.5432
 epoch: 99, train_loss: 0.7161, test_loss: 0.8971, test_f1: 0.5292
##################ITERATION #8 ****************************************
 epoch: 0, train_loss: 1.3414, test_loss: 1.1951, test_f1: 0.2970
 epoch: 1, train_loss: 1.1829, test_loss: 1.0795, test_f1: 0.4394
 epoch: 2, train_loss: 1.1394, test_loss: 1.0487, test_f1: 0.4476
 epoch: 3, train_loss: 1.1042, test_loss: 1.0442, test_f1: 0.4710
 epoch: 4, train_loss: 1.0762, test_loss: 1.0276, test_f1: 0.4729
 epoch: 5, train_loss: 1.0589, test_loss: 0.9969, test_f1: 0.4936
 epoch: 6, train_loss: 1.0406, test_loss: 1.0341, test_f1: 0.4843
 epoch: 7, train_loss: 1.0232, test_loss: 1.0000, test_f1: 0.4810
 epoch: 8, train_loss: 1.0310, test_loss: 1.0285, test_f1: 0.4712
 epoch: 9, train_loss: 0.9991, test_loss: 0.9954, test_f1: 0.4996
 epoch: 10, train_loss: 0.9910, test_loss: 0.9719, test_f1: 0.5077
 epoch: 11, train_loss: 0.9816, test_loss: 0.9506, test_f1: 0.4942
 epoch: 12, train_loss: 0.9697, test_loss: 0.9758, test_f1: 0.4879
 epoch: 13, train_loss: 0.9673, test_loss: 0.9679, test_f1: 0.4902
 epoch: 14, train_loss: 0.9682, test_loss: 0.9342, test_f1: 0.4912
 epoch: 15, train_loss: 0.9476, test_loss: 0.9826, test_f1: 0.5095
 epoch: 16, train_loss: 0.9467, test_loss: 0.9284, test_f1: 0.5428
 epoch: 17, train_loss: 0.9210, test_loss: 0.9421, test_f1: 0.5089
 epoch: 18, train_loss: 0.9182, test_loss: 0.9544, test_f1: 0.5142
 epoch: 19, train_loss: 0.9100, test_loss: 0.9711, test_f1: 0.5051
 epoch: 20, train_loss: 0.9237, test_loss: 0.9366, test_f1: 0.5307
 epoch: 21, train_loss: 0.9064, test_loss: 0.9872, test_f1: 0.5171
 epoch: 22, train_loss: 0.9025, test_loss: 0.9254, test_f1: 0.5129
 epoch: 23, train_loss: 0.9003, test_loss: 0.9474, test_f1: 0.5143
 epoch: 24, train_loss: 0.9034, test_loss: 0.9379, test_f1: 0.4895
 epoch: 25, train_loss: 0.8847, test_loss: 0.8879, test_f1: 0.5097
 epoch: 26, train_loss: 0.8751, test_loss: 0.9224, test_f1: 0.5071
 epoch: 27, train_loss: 0.8758, test_loss: 0.9148, test_f1: 0.5173
 epoch: 28, train_loss: 0.8647, test_loss: 0.9193, test_f1: 0.5095
 epoch: 29, train_loss: 0.8771, test_loss: 0.9026, test_f1: 0.5440
 epoch: 30, train_loss: 0.8709, test_loss: 0.9018, test_f1: 0.5138
 epoch: 31, train_loss: 0.8653, test_loss: 0.9197, test_f1: 0.5262
 epoch: 32, train_loss: 0.8575, test_loss: 0.9221, test_f1: 0.5289
 epoch: 33, train_loss: 0.8494, test_loss: 0.9569, test_f1: 0.5244
 epoch: 34, train_loss: 0.8539, test_loss: 1.0304, test_f1: 0.4829
 epoch: 35, train_loss: 0.8587, test_loss: 0.8964, test_f1: 0.5396
 epoch: 36, train_loss: 0.8435, test_loss: 0.9307, test_f1: 0.5371
 epoch: 37, train_loss: 0.8469, test_loss: 0.9178, test_f1: 0.5410
 epoch: 38, train_loss: 0.8344, test_loss: 0.9106, test_f1: 0.5286
 epoch: 39, train_loss: 0.8419, test_loss: 0.8984, test_f1: 0.5319
 epoch: 40, train_loss: 0.8236, test_loss: 1.0572, test_f1: 0.4844
 epoch: 41, train_loss: 0.8433, test_loss: 0.8907, test_f1: 0.5537
 epoch: 42, train_loss: 0.8310, test_loss: 0.9240, test_f1: 0.5213
 epoch: 43, train_loss: 0.8216, test_loss: 0.9053, test_f1: 0.5323
 epoch: 44, train_loss: 0.8145, test_loss: 0.8965, test_f1: 0.5568
 epoch: 45, train_loss: 0.8101, test_loss: 0.8980, test_f1: 0.5355
 epoch: 46, train_loss: 0.8111, test_loss: 0.8872, test_f1: 0.5400
 epoch: 47, train_loss: 0.8177, test_loss: 0.9102, test_f1: 0.5375
 epoch: 48, train_loss: 0.8166, test_loss: 0.9247, test_f1: 0.5391
 epoch: 49, train_loss: 0.8094, test_loss: 0.9290, test_f1: 0.5435
 epoch: 50, train_loss: 0.8123, test_loss: 0.9081, test_f1: 0.5224
 epoch: 51, train_loss: 0.8001, test_loss: 0.9272, test_f1: 0.5222
 epoch: 52, train_loss: 0.7891, test_loss: 0.9098, test_f1: 0.5241
 epoch: 53, train_loss: 0.7865, test_loss: 0.9161, test_f1: 0.5241
 epoch: 54, train_loss: 0.7802, test_loss: 0.9153, test_f1: 0.5356
 epoch: 55, train_loss: 0.7837, test_loss: 0.9005, test_f1: 0.5289
 epoch: 56, train_loss: 0.7754, test_loss: 0.8986, test_f1: 0.5339
 epoch: 57, train_loss: 0.7829, test_loss: 0.9025, test_f1: 0.5660
 epoch: 58, train_loss: 0.7788, test_loss: 0.8947, test_f1: 0.5624
 epoch: 59, train_loss: 0.7688, test_loss: 0.8790, test_f1: 0.5581
 epoch: 60, train_loss: 0.7679, test_loss: 0.8967, test_f1: 0.5545
 epoch: 61, train_loss: 0.7584, test_loss: 0.8794, test_f1: 0.5615
 epoch: 62, train_loss: 0.7708, test_loss: 0.9349, test_f1: 0.5133
 epoch: 63, train_loss: 0.7724, test_loss: 0.9082, test_f1: 0.5386
 epoch: 64, train_loss: 0.7709, test_loss: 0.8989, test_f1: 0.5471
 epoch: 65, train_loss: 0.7757, test_loss: 0.8933, test_f1: 0.5610
 epoch: 66, train_loss: 0.7719, test_loss: 0.8981, test_f1: 0.5536
 epoch: 67, train_loss: 0.7683, test_loss: 0.9117, test_f1: 0.5324
 epoch: 68, train_loss: 0.7591, test_loss: 0.8938, test_f1: 0.5610
 epoch: 69, train_loss: 0.7704, test_loss: 0.9209, test_f1: 0.5428
 epoch: 70, train_loss: 0.7726, test_loss: 0.9051, test_f1: 0.5535
 epoch: 71, train_loss: 0.7528, test_loss: 0.8984, test_f1: 0.5613
 epoch: 72, train_loss: 0.7518, test_loss: 0.9036, test_f1: 0.5399
 epoch: 73, train_loss: 0.7583, test_loss: 0.8853, test_f1: 0.5496
 epoch: 74, train_loss: 0.7575, test_loss: 0.8927, test_f1: 0.5391
 epoch: 75, train_loss: 0.7511, test_loss: 0.8833, test_f1: 0.5537
 epoch: 76, train_loss: 0.7622, test_loss: 0.8886, test_f1: 0.5548
 epoch: 77, train_loss: 0.7559, test_loss: 0.8969, test_f1: 0.5438
 epoch: 78, train_loss: 0.7559, test_loss: 0.8945, test_f1: 0.5392
 epoch: 79, train_loss: 0.7479, test_loss: 0.8863, test_f1: 0.5347
 epoch: 80, train_loss: 0.7520, test_loss: 0.8930, test_f1: 0.5456
 epoch: 81, train_loss: 0.7484, test_loss: 0.8922, test_f1: 0.5645
 epoch: 82, train_loss: 0.7627, test_loss: 0.8942, test_f1: 0.5547
 epoch: 83, train_loss: 0.7516, test_loss: 0.8852, test_f1: 0.5519
 epoch: 84, train_loss: 0.7450, test_loss: 0.9033, test_f1: 0.5408
 epoch: 85, train_loss: 0.7485, test_loss: 0.9252, test_f1: 0.5236
 epoch: 86, train_loss: 0.7475, test_loss: 0.8751, test_f1: 0.5282
 epoch: 87, train_loss: 0.7334, test_loss: 0.8983, test_f1: 0.5296
 epoch: 88, train_loss: 0.7550, test_loss: 0.8857, test_f1: 0.5546
 epoch: 89, train_loss: 0.7342, test_loss: 0.8763, test_f1: 0.5550
 epoch: 90, train_loss: 0.7346, test_loss: 0.9252, test_f1: 0.5322
 epoch: 91, train_loss: 0.7386, test_loss: 0.8708, test_f1: 0.5715
 epoch: 92, train_loss: 0.7296, test_loss: 0.8799, test_f1: 0.5735
 epoch: 93, train_loss: 0.7453, test_loss: 0.9524, test_f1: 0.5345
 epoch: 94, train_loss: 0.7232, test_loss: 0.8853, test_f1: 0.5525
 epoch: 95, train_loss: 0.7257, test_loss: 0.8812, test_f1: 0.5564
 epoch: 96, train_loss: 0.7425, test_loss: 0.9003, test_f1: 0.5640
 epoch: 97, train_loss: 0.7284, test_loss: 0.8669, test_f1: 0.5569
 epoch: 98, train_loss: 0.7255, test_loss: 0.8646, test_f1: 0.5552
 epoch: 99, train_loss: 0.7358, test_loss: 0.9455, test_f1: 0.5207
##################ITERATION #9 ****************************************
 epoch: 0, train_loss: 1.3884, test_loss: 1.1876, test_f1: 0.2789
 epoch: 1, train_loss: 1.1950, test_loss: 1.0968, test_f1: 0.4302
 epoch: 2, train_loss: 1.1505, test_loss: 1.0463, test_f1: 0.5248
 epoch: 3, train_loss: 1.1067, test_loss: 1.0207, test_f1: 0.4931
 epoch: 4, train_loss: 1.0732, test_loss: 1.0042, test_f1: 0.4796
 epoch: 5, train_loss: 1.0525, test_loss: 0.9765, test_f1: 0.5362
 epoch: 6, train_loss: 1.0289, test_loss: 0.9842, test_f1: 0.5156
 epoch: 7, train_loss: 1.0168, test_loss: 1.0336, test_f1: 0.4670
 epoch: 8, train_loss: 0.9939, test_loss: 0.9847, test_f1: 0.4973
 epoch: 9, train_loss: 0.9898, test_loss: 0.9946, test_f1: 0.4991
 epoch: 10, train_loss: 0.9716, test_loss: 0.9460, test_f1: 0.5079
 epoch: 11, train_loss: 0.9608, test_loss: 0.9454, test_f1: 0.5148
 epoch: 12, train_loss: 0.9587, test_loss: 0.9412, test_f1: 0.4975
 epoch: 13, train_loss: 0.9473, test_loss: 0.9940, test_f1: 0.4716
 epoch: 14, train_loss: 0.9370, test_loss: 0.9590, test_f1: 0.5067
 epoch: 15, train_loss: 0.9206, test_loss: 0.9555, test_f1: 0.5014
 epoch: 16, train_loss: 0.9241, test_loss: 0.9400, test_f1: 0.4912
 epoch: 17, train_loss: 0.9075, test_loss: 0.9487, test_f1: 0.5040
 epoch: 18, train_loss: 0.9316, test_loss: 0.9800, test_f1: 0.4980
 epoch: 19, train_loss: 0.9187, test_loss: 0.8845, test_f1: 0.5278
 epoch: 20, train_loss: 0.8913, test_loss: 0.9334, test_f1: 0.5240
 epoch: 21, train_loss: 0.8973, test_loss: 0.9660, test_f1: 0.5052
 epoch: 22, train_loss: 0.8949, test_loss: 0.8758, test_f1: 0.5342
 epoch: 23, train_loss: 0.8708, test_loss: 0.9180, test_f1: 0.5230
 epoch: 24, train_loss: 0.8797, test_loss: 0.9358, test_f1: 0.5342
 epoch: 25, train_loss: 0.8730, test_loss: 0.9231, test_f1: 0.5338
 epoch: 26, train_loss: 0.8935, test_loss: 0.9525, test_f1: 0.5103
 epoch: 27, train_loss: 0.8722, test_loss: 0.9000, test_f1: 0.5414
 epoch: 28, train_loss: 0.8745, test_loss: 0.8951, test_f1: 0.5295
 epoch: 29, train_loss: 0.8663, test_loss: 0.9173, test_f1: 0.5258
 epoch: 30, train_loss: 0.8664, test_loss: 0.9720, test_f1: 0.5031
 epoch: 31, train_loss: 0.8521, test_loss: 0.9233, test_f1: 0.5374
 epoch: 32, train_loss: 0.8522, test_loss: 0.9267, test_f1: 0.5342
 epoch: 33, train_loss: 0.8451, test_loss: 0.9263, test_f1: 0.5536
 epoch: 34, train_loss: 0.8478, test_loss: 0.9788, test_f1: 0.5349
 epoch: 35, train_loss: 0.8584, test_loss: 0.8903, test_f1: 0.5449
 epoch: 36, train_loss: 0.8451, test_loss: 0.9034, test_f1: 0.5457
 epoch: 37, train_loss: 0.8494, test_loss: 0.9078, test_f1: 0.5276
 epoch: 38, train_loss: 0.8307, test_loss: 0.9465, test_f1: 0.5164
 epoch: 39, train_loss: 0.8309, test_loss: 0.8808, test_f1: 0.5328
 epoch: 40, train_loss: 0.8304, test_loss: 0.8849, test_f1: 0.5628
 epoch: 41, train_loss: 0.8199, test_loss: 0.9139, test_f1: 0.5305
 epoch: 42, train_loss: 0.8313, test_loss: 0.8979, test_f1: 0.5356
 epoch: 43, train_loss: 0.8148, test_loss: 0.9246, test_f1: 0.5388
 epoch: 44, train_loss: 0.8218, test_loss: 0.9260, test_f1: 0.5268
 epoch: 45, train_loss: 0.8251, test_loss: 0.9071, test_f1: 0.5468
 epoch: 46, train_loss: 0.8107, test_loss: 0.9041, test_f1: 0.5371
 epoch: 47, train_loss: 0.7986, test_loss: 0.8911, test_f1: 0.5415
 epoch: 48, train_loss: 0.8248, test_loss: 0.9128, test_f1: 0.5477
 epoch: 49, train_loss: 0.8229, test_loss: 0.8997, test_f1: 0.5425
 epoch: 50, train_loss: 0.8040, test_loss: 0.8842, test_f1: 0.5708
 epoch: 51, train_loss: 0.7993, test_loss: 0.9013, test_f1: 0.5494
 epoch: 52, train_loss: 0.8069, test_loss: 0.9143, test_f1: 0.5460
 epoch: 53, train_loss: 0.7918, test_loss: 0.9349, test_f1: 0.5478
 epoch: 54, train_loss: 0.8043, test_loss: 0.9108, test_f1: 0.5621
 epoch: 55, train_loss: 0.7823, test_loss: 0.9220, test_f1: 0.5403
 epoch: 56, train_loss: 0.7818, test_loss: 0.9366, test_f1: 0.5284
 epoch: 57, train_loss: 0.7801, test_loss: 0.9160, test_f1: 0.5591
 epoch: 58, train_loss: 0.7767, test_loss: 0.9092, test_f1: 0.5584
 epoch: 59, train_loss: 0.7909, test_loss: 0.9443, test_f1: 0.5448
 epoch: 60, train_loss: 0.7890, test_loss: 0.9280, test_f1: 0.5512
 epoch: 61, train_loss: 0.7760, test_loss: 0.9023, test_f1: 0.5596
 epoch: 62, train_loss: 0.7789, test_loss: 0.9080, test_f1: 0.5369
 epoch: 63, train_loss: 0.7824, test_loss: 0.9149, test_f1: 0.5549
 epoch: 64, train_loss: 0.7743, test_loss: 0.9241, test_f1: 0.5353
 epoch: 65, train_loss: 0.7754, test_loss: 0.9386, test_f1: 0.5424
 epoch: 66, train_loss: 0.7718, test_loss: 0.9170, test_f1: 0.5455
 epoch: 67, train_loss: 0.7717, test_loss: 0.9267, test_f1: 0.5496
 epoch: 68, train_loss: 0.7753, test_loss: 0.9373, test_f1: 0.5529
 epoch: 69, train_loss: 0.7740, test_loss: 0.9028, test_f1: 0.5514
 epoch: 70, train_loss: 0.7695, test_loss: 0.9353, test_f1: 0.5339
 epoch: 71, train_loss: 0.7777, test_loss: 0.9295, test_f1: 0.5319
 epoch: 72, train_loss: 0.7598, test_loss: 0.9555, test_f1: 0.5433
 epoch: 73, train_loss: 0.7694, test_loss: 0.9314, test_f1: 0.5343
 epoch: 74, train_loss: 0.7754, test_loss: 0.9138, test_f1: 0.5307
 epoch: 75, train_loss: 0.7629, test_loss: 0.9201, test_f1: 0.5481
 epoch: 76, train_loss: 0.7693, test_loss: 0.9003, test_f1: 0.5465
 epoch: 77, train_loss: 0.7547, test_loss: 0.9153, test_f1: 0.5574
 epoch: 78, train_loss: 0.7651, test_loss: 0.9029, test_f1: 0.5687
 epoch: 79, train_loss: 0.7631, test_loss: 0.9369, test_f1: 0.5392
 epoch: 80, train_loss: 0.7675, test_loss: 0.9263, test_f1: 0.5426
 epoch: 81, train_loss: 0.7536, test_loss: 0.9224, test_f1: 0.5562
 epoch: 82, train_loss: 0.7513, test_loss: 0.9352, test_f1: 0.5270
 epoch: 83, train_loss: 0.7663, test_loss: 0.9362, test_f1: 0.5401
 epoch: 84, train_loss: 0.7545, test_loss: 0.9370, test_f1: 0.5378
 epoch: 85, train_loss: 0.7480, test_loss: 0.9495, test_f1: 0.5570
 epoch: 86, train_loss: 0.7477, test_loss: 0.9616, test_f1: 0.5387
 epoch: 87, train_loss: 0.7586, test_loss: 0.9181, test_f1: 0.5436
 epoch: 88, train_loss: 0.7521, test_loss: 0.9354, test_f1: 0.5476
 epoch: 89, train_loss: 0.7561, test_loss: 0.9449, test_f1: 0.5600
 epoch: 90, train_loss: 0.7471, test_loss: 0.9306, test_f1: 0.5381
 epoch: 91, train_loss: 0.7470, test_loss: 0.9556, test_f1: 0.5538
 epoch: 92, train_loss: 0.7488, test_loss: 0.9237, test_f1: 0.5491
 epoch: 93, train_loss: 0.7349, test_loss: 0.9601, test_f1: 0.5554
 epoch: 94, train_loss: 0.7460, test_loss: 0.9328, test_f1: 0.5681
 epoch: 95, train_loss: 0.7411, test_loss: 0.9251, test_f1: 0.5645
 epoch: 96, train_loss: 0.7403, test_loss: 0.9021, test_f1: 0.5547
 epoch: 97, train_loss: 0.7366, test_loss: 0.9382, test_f1: 0.5309
 epoch: 98, train_loss: 0.7482, test_loss: 0.9160, test_f1: 0.5471
 epoch: 99, train_loss: 0.7601, test_loss: 0.9381, test_f1: 0.5589

Training completed in 674.68 seconds
Best F1: 0.5772 at epoch 99
Mean F1 across iterations: 0.5563  0.0139
========================FINAL RESULTS================================
FEGIN weighted F1: 0.5772  0.0139
python main.py --data ltspice_examples --representation component_pin --model FEGIN --layers 4 --hiddens 16 --batch_size 64 --lr 0.001 --emb_size 250 --epochs 100 --save_appendix component_pin_L4_H16_BS64_LR0.001_E250 --no_val
-----



STDERR:
  File "main.py", line 370, in <module>
    main()
  File "main.py", line 254, in main
    dataset = dataset_class(
  File "/home/philip/projects/ltspice_examples_code_repo/Circuit-Completion-Using-GNNs/component_classification_with_link_prediction_head/evaluation/FEGIN/kernel/circuit_datasets.py", line 15, in __init__
    self.data, self.slices = torch.load(self.processed_paths[0])
  File "/home/philip/.local/lib/python3.8/site-packages/torch/serialization.py", line 1040, in load
    warnings.warn(
  File "/usr/lib/python3.8/warnings.py", line 109, in _showwarnmsg
    sw(msg.message, msg.category, msg.filename, msg.lineno,
  File "main.py", line 47, in warn_with_traceback
    traceback.print_stack(file=log)
/home/philip/projects/ltspice_examples_code_repo/Circuit-Completion-Using-GNNs/component_classification_with_link_prediction_head/evaluation/FEGIN/kernel/circuit_datasets.py:15: FutureWarning: You are using `torch.load` with `weights_only=False` (the current default value), which uses the default pickle module implicitly. It is possible to construct malicious pickle data which will execute arbitrary code during unpickling (See https://github.com/pytorch/pytorch/blob/main/SECURITY.md#untrusted-models for more details). In a future release, the default value for `weights_only` will be flipped to `True`. This limits the functions that could be executed during unpickling. Arbitrary objects will no longer be allowed to be loaded via this mode unless they are explicitly allowlisted by the user via `torch.serialization.add_safe_globals`. We recommend you start setting `weights_only=True` for any use case where you don't have full control of the loaded file. Please open an issue on GitHub for any issues related to this experimental feature.
  self.data, self.slices = torch.load(self.processed_paths[0])
