STDOUT:
Results will be saved in /home/philip/projects/llm_inference_code_repo/Circuit-Completion-Using-GNNs/component_classification_with_link_prediction_head/evaluation/FEGIN/results/model_FEGIN_dataset_ltspice_examples
Command line input: python main.py --data ltspice_examples --representation component_component --model FEGIN --layers 5 --hiddens 32 --batch_size 128 --lr 0.0001 --emb_size 512 --epochs 100 --save_appendix component_component_L5_H32_BS128_LR0.0001_E512 --no_val
 is saved.
-----
ltspice_examples - FEGIN
Using 5 layers, 32 hidden units, h = 2
Loading component_component representation dataset
ENTERED
Training FEGIN on component_component representation
Train: 3556, Test: 845
##################ITERATION #0 ****************************************
 epoch: 0, train_loss: 1.3595, test_loss: 1.3622, test_f1: 0.2274
 epoch: 1, train_loss: 1.3524, test_loss: 1.3555, test_f1: 0.2274
 epoch: 2, train_loss: 1.3475, test_loss: 1.3509, test_f1: 0.2274
 epoch: 3, train_loss: 1.3404, test_loss: 1.3460, test_f1: 0.2274
 epoch: 4, train_loss: 1.3363, test_loss: 1.3412, test_f1: 0.2274
 epoch: 5, train_loss: 1.3305, test_loss: 1.3358, test_f1: 0.2274
 epoch: 6, train_loss: 1.3245, test_loss: 1.3301, test_f1: 0.2274
 epoch: 7, train_loss: 1.3179, test_loss: 1.3245, test_f1: 0.2274
 epoch: 8, train_loss: 1.3134, test_loss: 1.3189, test_f1: 0.2274
 epoch: 9, train_loss: 1.3050, test_loss: 1.3134, test_f1: 0.2274
 epoch: 10, train_loss: 1.3002, test_loss: 1.3088, test_f1: 0.2274
 epoch: 11, train_loss: 1.2958, test_loss: 1.3053, test_f1: 0.2274
 epoch: 12, train_loss: 1.2878, test_loss: 1.2996, test_f1: 0.2274
 epoch: 13, train_loss: 1.2840, test_loss: 1.2952, test_f1: 0.2274
 epoch: 14, train_loss: 1.2793, test_loss: 1.2915, test_f1: 0.2274
 epoch: 15, train_loss: 1.2757, test_loss: 1.2871, test_f1: 0.2274
 epoch: 16, train_loss: 1.2726, test_loss: 1.2832, test_f1: 0.2274
 epoch: 17, train_loss: 1.2676, test_loss: 1.2804, test_f1: 0.2274
 epoch: 18, train_loss: 1.2644, test_loss: 1.2756, test_f1: 0.2274
 epoch: 19, train_loss: 1.2583, test_loss: 1.2733, test_f1: 0.2274
 epoch: 20, train_loss: 1.2523, test_loss: 1.2677, test_f1: 0.2274
 epoch: 21, train_loss: 1.2521, test_loss: 1.2620, test_f1: 0.2274
 epoch: 22, train_loss: 1.2471, test_loss: 1.2595, test_f1: 0.2274
 epoch: 23, train_loss: 1.2427, test_loss: 1.2565, test_f1: 0.2274
 epoch: 24, train_loss: 1.2399, test_loss: 1.2516, test_f1: 0.2274
 epoch: 25, train_loss: 1.2359, test_loss: 1.2490, test_f1: 0.2274
 epoch: 26, train_loss: 1.2331, test_loss: 1.2438, test_f1: 0.2274
 epoch: 27, train_loss: 1.2293, test_loss: 1.2417, test_f1: 0.2274
 epoch: 28, train_loss: 1.2210, test_loss: 1.2352, test_f1: 0.2274
 epoch: 29, train_loss: 1.2235, test_loss: 1.2328, test_f1: 0.2274
 epoch: 30, train_loss: 1.2217, test_loss: 1.2269, test_f1: 0.2430
 epoch: 31, train_loss: 1.2162, test_loss: 1.2238, test_f1: 0.2904
 epoch: 32, train_loss: 1.2158, test_loss: 1.2242, test_f1: 0.2975
 epoch: 33, train_loss: 1.2129, test_loss: 1.2206, test_f1: 0.3031
 epoch: 34, train_loss: 1.2041, test_loss: 1.2157, test_f1: 0.3145
 epoch: 35, train_loss: 1.2022, test_loss: 1.2178, test_f1: 0.3221
 epoch: 36, train_loss: 1.2024, test_loss: 1.2104, test_f1: 0.3248
 epoch: 37, train_loss: 1.1975, test_loss: 1.2080, test_f1: 0.3319
 epoch: 38, train_loss: 1.1974, test_loss: 1.2118, test_f1: 0.3381
 epoch: 39, train_loss: 1.1929, test_loss: 1.2007, test_f1: 0.3404
 epoch: 40, train_loss: 1.1923, test_loss: 1.2013, test_f1: 0.3479
 epoch: 41, train_loss: 1.1903, test_loss: 1.1991, test_f1: 0.3575
 epoch: 42, train_loss: 1.1884, test_loss: 1.1979, test_f1: 0.3603
 epoch: 43, train_loss: 1.1835, test_loss: 1.1918, test_f1: 0.3809
 epoch: 44, train_loss: 1.1782, test_loss: 1.1896, test_f1: 0.3731
 epoch: 45, train_loss: 1.1786, test_loss: 1.1932, test_f1: 0.3803
 epoch: 46, train_loss: 1.1739, test_loss: 1.1886, test_f1: 0.3780
 epoch: 47, train_loss: 1.1758, test_loss: 1.1854, test_f1: 0.3930
 epoch: 48, train_loss: 1.1677, test_loss: 1.1850, test_f1: 0.3889
 epoch: 49, train_loss: 1.1590, test_loss: 1.1856, test_f1: 0.3907
 epoch: 50, train_loss: 1.1661, test_loss: 1.1831, test_f1: 0.3851
 epoch: 51, train_loss: 1.1595, test_loss: 1.1781, test_f1: 0.3870
 epoch: 52, train_loss: 1.1580, test_loss: 1.1790, test_f1: 0.3891
 epoch: 53, train_loss: 1.1569, test_loss: 1.1765, test_f1: 0.3950
 epoch: 54, train_loss: 1.1598, test_loss: 1.1767, test_f1: 0.3930
 epoch: 55, train_loss: 1.1551, test_loss: 1.1731, test_f1: 0.3961
 epoch: 56, train_loss: 1.1529, test_loss: 1.1724, test_f1: 0.3908
 epoch: 57, train_loss: 1.1481, test_loss: 1.1773, test_f1: 0.3919
 epoch: 58, train_loss: 1.1496, test_loss: 1.1718, test_f1: 0.3929
 epoch: 59, train_loss: 1.1484, test_loss: 1.1731, test_f1: 0.3931
 epoch: 60, train_loss: 1.1486, test_loss: 1.1693, test_f1: 0.3909
 epoch: 61, train_loss: 1.1501, test_loss: 1.1694, test_f1: 0.3951
 epoch: 62, train_loss: 1.1412, test_loss: 1.1690, test_f1: 0.3940
 epoch: 63, train_loss: 1.1411, test_loss: 1.1701, test_f1: 0.3949
 epoch: 64, train_loss: 1.1403, test_loss: 1.1649, test_f1: 0.3919
 epoch: 65, train_loss: 1.1413, test_loss: 1.1666, test_f1: 0.3900
 epoch: 66, train_loss: 1.1406, test_loss: 1.1664, test_f1: 0.3948
 epoch: 67, train_loss: 1.1364, test_loss: 1.1632, test_f1: 0.3939
 epoch: 68, train_loss: 1.1295, test_loss: 1.1675, test_f1: 0.3936
 epoch: 69, train_loss: 1.1463, test_loss: 1.1628, test_f1: 0.3927
 epoch: 70, train_loss: 1.1337, test_loss: 1.1635, test_f1: 0.3928
 epoch: 71, train_loss: 1.1349, test_loss: 1.1639, test_f1: 0.3845
 epoch: 72, train_loss: 1.1257, test_loss: 1.1636, test_f1: 0.3905
 epoch: 73, train_loss: 1.1296, test_loss: 1.1593, test_f1: 0.3917
 epoch: 74, train_loss: 1.1285, test_loss: 1.1588, test_f1: 0.3918
 epoch: 75, train_loss: 1.1332, test_loss: 1.1625, test_f1: 0.3906
 epoch: 76, train_loss: 1.1278, test_loss: 1.1635, test_f1: 0.3877
 epoch: 77, train_loss: 1.1229, test_loss: 1.1570, test_f1: 0.3896
 epoch: 78, train_loss: 1.1269, test_loss: 1.1565, test_f1: 0.3935
 epoch: 79, train_loss: 1.1275, test_loss: 1.1568, test_f1: 0.3906
 epoch: 80, train_loss: 1.1246, test_loss: 1.1616, test_f1: 0.3877
 epoch: 81, train_loss: 1.1213, test_loss: 1.1534, test_f1: 0.3936
 epoch: 82, train_loss: 1.1207, test_loss: 1.1550, test_f1: 0.4085
 epoch: 83, train_loss: 1.1133, test_loss: 1.1563, test_f1: 0.4135
 epoch: 84, train_loss: 1.1134, test_loss: 1.1542, test_f1: 0.4212
 epoch: 85, train_loss: 1.1149, test_loss: 1.1497, test_f1: 0.4249
 epoch: 86, train_loss: 1.1112, test_loss: 1.1452, test_f1: 0.4269
 epoch: 87, train_loss: 1.1087, test_loss: 1.1516, test_f1: 0.4327
 epoch: 88, train_loss: 1.1081, test_loss: 1.1506, test_f1: 0.4362
 epoch: 89, train_loss: 1.1102, test_loss: 1.1495, test_f1: 0.4386
 epoch: 90, train_loss: 1.1074, test_loss: 1.1536, test_f1: 0.4470
 epoch: 91, train_loss: 1.0998, test_loss: 1.1485, test_f1: 0.4452
 epoch: 92, train_loss: 1.1085, test_loss: 1.1500, test_f1: 0.4556
 epoch: 93, train_loss: 1.1024, test_loss: 1.1468, test_f1: 0.4526
 epoch: 94, train_loss: 1.1032, test_loss: 1.1473, test_f1: 0.4570
 epoch: 95, train_loss: 1.1112, test_loss: 1.1424, test_f1: 0.4585
 epoch: 96, train_loss: 1.1023, test_loss: 1.1419, test_f1: 0.4581
 epoch: 97, train_loss: 1.1019, test_loss: 1.1438, test_f1: 0.4595
 epoch: 98, train_loss: 1.0967, test_loss: 1.1418, test_f1: 0.4601
 epoch: 99, train_loss: 1.0984, test_loss: 1.1420, test_f1: 0.4613
##################ITERATION #1 ****************************************
 epoch: 0, train_loss: 1.3463, test_loss: 1.3546, test_f1: 0.2274
 epoch: 1, train_loss: 1.3335, test_loss: 1.3423, test_f1: 0.2274
 epoch: 2, train_loss: 1.3252, test_loss: 1.3272, test_f1: 0.2274
 epoch: 3, train_loss: 1.3160, test_loss: 1.3145, test_f1: 0.2274
 epoch: 4, train_loss: 1.3088, test_loss: 1.3057, test_f1: 0.2274
 epoch: 5, train_loss: 1.2993, test_loss: 1.2943, test_f1: 0.2274
 epoch: 6, train_loss: 1.2884, test_loss: 1.2836, test_f1: 0.2274
 epoch: 7, train_loss: 1.2784, test_loss: 1.2750, test_f1: 0.2274
 epoch: 8, train_loss: 1.2729, test_loss: 1.2655, test_f1: 0.2274
 epoch: 9, train_loss: 1.2664, test_loss: 1.2575, test_f1: 0.2274
 epoch: 10, train_loss: 1.2617, test_loss: 1.2522, test_f1: 0.2293
 epoch: 11, train_loss: 1.2557, test_loss: 1.2445, test_f1: 0.2469
 epoch: 12, train_loss: 1.2466, test_loss: 1.2386, test_f1: 0.2694
 epoch: 13, train_loss: 1.2445, test_loss: 1.2324, test_f1: 0.2774
 epoch: 14, train_loss: 1.2406, test_loss: 1.2262, test_f1: 0.2825
 epoch: 15, train_loss: 1.2355, test_loss: 1.2227, test_f1: 0.2804
 epoch: 16, train_loss: 1.2312, test_loss: 1.2175, test_f1: 0.2754
 epoch: 17, train_loss: 1.2254, test_loss: 1.2137, test_f1: 0.2999
 epoch: 18, train_loss: 1.2240, test_loss: 1.2084, test_f1: 0.3086
 epoch: 19, train_loss: 1.2153, test_loss: 1.2043, test_f1: 0.3163
 epoch: 20, train_loss: 1.2121, test_loss: 1.2013, test_f1: 0.3289
 epoch: 21, train_loss: 1.2122, test_loss: 1.1978, test_f1: 0.3450
 epoch: 22, train_loss: 1.2073, test_loss: 1.1936, test_f1: 0.3411
 epoch: 23, train_loss: 1.2039, test_loss: 1.1906, test_f1: 0.3466
 epoch: 24, train_loss: 1.1998, test_loss: 1.1860, test_f1: 0.3486
 epoch: 25, train_loss: 1.2038, test_loss: 1.1827, test_f1: 0.3455
 epoch: 26, train_loss: 1.1946, test_loss: 1.1797, test_f1: 0.3480
 epoch: 27, train_loss: 1.1865, test_loss: 1.1748, test_f1: 0.3547
 epoch: 28, train_loss: 1.1857, test_loss: 1.1729, test_f1: 0.3565
 epoch: 29, train_loss: 1.1839, test_loss: 1.1715, test_f1: 0.3541
 epoch: 30, train_loss: 1.1808, test_loss: 1.1689, test_f1: 0.3542
 epoch: 31, train_loss: 1.1801, test_loss: 1.1655, test_f1: 0.3552
 epoch: 32, train_loss: 1.1723, test_loss: 1.1624, test_f1: 0.3591
 epoch: 33, train_loss: 1.1672, test_loss: 1.1592, test_f1: 0.3533
 epoch: 34, train_loss: 1.1675, test_loss: 1.1571, test_f1: 0.3578
 epoch: 35, train_loss: 1.1690, test_loss: 1.1546, test_f1: 0.3586
 epoch: 36, train_loss: 1.1705, test_loss: 1.1512, test_f1: 0.3603
 epoch: 37, train_loss: 1.1616, test_loss: 1.1507, test_f1: 0.3642
 epoch: 38, train_loss: 1.1560, test_loss: 1.1529, test_f1: 0.3618
 epoch: 39, train_loss: 1.1532, test_loss: 1.1491, test_f1: 0.3621
 epoch: 40, train_loss: 1.1499, test_loss: 1.1472, test_f1: 0.3659
 epoch: 41, train_loss: 1.1535, test_loss: 1.1458, test_f1: 0.3600
 epoch: 42, train_loss: 1.1505, test_loss: 1.1403, test_f1: 0.3691
 epoch: 43, train_loss: 1.1426, test_loss: 1.1386, test_f1: 0.3678
 epoch: 44, train_loss: 1.1401, test_loss: 1.1421, test_f1: 0.3615
 epoch: 45, train_loss: 1.1374, test_loss: 1.1367, test_f1: 0.3776
 epoch: 46, train_loss: 1.1399, test_loss: 1.1360, test_f1: 0.3888
 epoch: 47, train_loss: 1.1311, test_loss: 1.1367, test_f1: 0.3996
 epoch: 48, train_loss: 1.1354, test_loss: 1.1361, test_f1: 0.3919
 epoch: 49, train_loss: 1.1311, test_loss: 1.1270, test_f1: 0.4135
 epoch: 50, train_loss: 1.1257, test_loss: 1.1277, test_f1: 0.4168
 epoch: 51, train_loss: 1.1288, test_loss: 1.1296, test_f1: 0.4222
 epoch: 52, train_loss: 1.1301, test_loss: 1.1296, test_f1: 0.4230
 epoch: 53, train_loss: 1.1188, test_loss: 1.1298, test_f1: 0.4155
 epoch: 54, train_loss: 1.1289, test_loss: 1.1305, test_f1: 0.4240
 epoch: 55, train_loss: 1.1258, test_loss: 1.1265, test_f1: 0.4272
 epoch: 56, train_loss: 1.1210, test_loss: 1.1244, test_f1: 0.4171
 epoch: 57, train_loss: 1.1153, test_loss: 1.1266, test_f1: 0.4212
 epoch: 58, train_loss: 1.1138, test_loss: 1.1222, test_f1: 0.4275
 epoch: 59, train_loss: 1.1156, test_loss: 1.1211, test_f1: 0.4334
 epoch: 60, train_loss: 1.1168, test_loss: 1.1259, test_f1: 0.4208
 epoch: 61, train_loss: 1.1102, test_loss: 1.1245, test_f1: 0.4392
 epoch: 62, train_loss: 1.1132, test_loss: 1.1241, test_f1: 0.4168
 epoch: 63, train_loss: 1.1086, test_loss: 1.1222, test_f1: 0.4276
 epoch: 64, train_loss: 1.1116, test_loss: 1.1200, test_f1: 0.4319
 epoch: 65, train_loss: 1.1069, test_loss: 1.1235, test_f1: 0.4306
 epoch: 66, train_loss: 1.1028, test_loss: 1.1241, test_f1: 0.4311
 epoch: 67, train_loss: 1.1075, test_loss: 1.1181, test_f1: 0.4250
 epoch: 68, train_loss: 1.1029, test_loss: 1.1192, test_f1: 0.4256
 epoch: 69, train_loss: 1.1069, test_loss: 1.1186, test_f1: 0.4341
 epoch: 70, train_loss: 1.1022, test_loss: 1.1169, test_f1: 0.4300
 epoch: 71, train_loss: 1.1042, test_loss: 1.1203, test_f1: 0.4306
 epoch: 72, train_loss: 1.0983, test_loss: 1.1222, test_f1: 0.4317
 epoch: 73, train_loss: 1.1088, test_loss: 1.1161, test_f1: 0.4358
 epoch: 74, train_loss: 1.0985, test_loss: 1.1164, test_f1: 0.4266
 epoch: 75, train_loss: 1.1018, test_loss: 1.1170, test_f1: 0.4352
 epoch: 76, train_loss: 1.1020, test_loss: 1.1117, test_f1: 0.4243
 epoch: 77, train_loss: 1.0932, test_loss: 1.1150, test_f1: 0.4270
 epoch: 78, train_loss: 1.0946, test_loss: 1.1127, test_f1: 0.4300
 epoch: 79, train_loss: 1.1008, test_loss: 1.1169, test_f1: 0.4265
 epoch: 80, train_loss: 1.0921, test_loss: 1.1154, test_f1: 0.4262
 epoch: 81, train_loss: 1.0924, test_loss: 1.1127, test_f1: 0.4279
 epoch: 82, train_loss: 1.0951, test_loss: 1.1220, test_f1: 0.4143
 epoch: 83, train_loss: 1.0982, test_loss: 1.1154, test_f1: 0.4237
 epoch: 84, train_loss: 1.0859, test_loss: 1.1116, test_f1: 0.4308
 epoch: 85, train_loss: 1.0941, test_loss: 1.1090, test_f1: 0.4301
 epoch: 86, train_loss: 1.0986, test_loss: 1.1110, test_f1: 0.4267
 epoch: 87, train_loss: 1.0878, test_loss: 1.1110, test_f1: 0.4301
 epoch: 88, train_loss: 1.0857, test_loss: 1.1146, test_f1: 0.4255
 epoch: 89, train_loss: 1.0883, test_loss: 1.1143, test_f1: 0.4309
 epoch: 90, train_loss: 1.0812, test_loss: 1.1120, test_f1: 0.4304
 epoch: 91, train_loss: 1.0797, test_loss: 1.1114, test_f1: 0.4295
 epoch: 92, train_loss: 1.0770, test_loss: 1.1100, test_f1: 0.4276
 epoch: 93, train_loss: 1.0848, test_loss: 1.1128, test_f1: 0.4306
 epoch: 94, train_loss: 1.0794, test_loss: 1.1073, test_f1: 0.4253
 epoch: 95, train_loss: 1.0760, test_loss: 1.1135, test_f1: 0.4313
 epoch: 96, train_loss: 1.0823, test_loss: 1.1114, test_f1: 0.4274
 epoch: 97, train_loss: 1.0693, test_loss: 1.1127, test_f1: 0.4302
 epoch: 98, train_loss: 1.0739, test_loss: 1.1102, test_f1: 0.4300
 epoch: 99, train_loss: 1.0818, test_loss: 1.1117, test_f1: 0.4318
##################ITERATION #2 ****************************************
 epoch: 0, train_loss: 1.3235, test_loss: 1.3308, test_f1: 0.2274
 epoch: 1, train_loss: 1.3010, test_loss: 1.3065, test_f1: 0.2371
 epoch: 2, train_loss: 1.2904, test_loss: 1.2875, test_f1: 0.2648
 epoch: 3, train_loss: 1.2839, test_loss: 1.2750, test_f1: 0.2829
 epoch: 4, train_loss: 1.2744, test_loss: 1.2648, test_f1: 0.2799
 epoch: 5, train_loss: 1.2685, test_loss: 1.2563, test_f1: 0.2847
 epoch: 6, train_loss: 1.2632, test_loss: 1.2490, test_f1: 0.2947
 epoch: 7, train_loss: 1.2515, test_loss: 1.2437, test_f1: 0.3009
 epoch: 8, train_loss: 1.2489, test_loss: 1.2370, test_f1: 0.3009
 epoch: 9, train_loss: 1.2431, test_loss: 1.2316, test_f1: 0.3020
 epoch: 10, train_loss: 1.2385, test_loss: 1.2253, test_f1: 0.3219
 epoch: 11, train_loss: 1.2361, test_loss: 1.2196, test_f1: 0.3187
 epoch: 12, train_loss: 1.2340, test_loss: 1.2144, test_f1: 0.3259
 epoch: 13, train_loss: 1.2284, test_loss: 1.2107, test_f1: 0.3253
 epoch: 14, train_loss: 1.2272, test_loss: 1.2059, test_f1: 0.3230
 epoch: 15, train_loss: 1.2209, test_loss: 1.2027, test_f1: 0.3364
 epoch: 16, train_loss: 1.2219, test_loss: 1.1963, test_f1: 0.3361
 epoch: 17, train_loss: 1.2131, test_loss: 1.1934, test_f1: 0.3437
 epoch: 18, train_loss: 1.2090, test_loss: 1.1886, test_f1: 0.3451
 epoch: 19, train_loss: 1.2110, test_loss: 1.1849, test_f1: 0.3502
 epoch: 20, train_loss: 1.2081, test_loss: 1.1813, test_f1: 0.3513
 epoch: 21, train_loss: 1.2020, test_loss: 1.1804, test_f1: 0.3516
 epoch: 22, train_loss: 1.1952, test_loss: 1.1772, test_f1: 0.3506
 epoch: 23, train_loss: 1.1975, test_loss: 1.1723, test_f1: 0.3521
 epoch: 24, train_loss: 1.1941, test_loss: 1.1698, test_f1: 0.3541
 epoch: 25, train_loss: 1.1902, test_loss: 1.1672, test_f1: 0.3574
 epoch: 26, train_loss: 1.1870, test_loss: 1.1634, test_f1: 0.3602
 epoch: 27, train_loss: 1.1834, test_loss: 1.1608, test_f1: 0.3563
 epoch: 28, train_loss: 1.1748, test_loss: 1.1585, test_f1: 0.3609
 epoch: 29, train_loss: 1.1776, test_loss: 1.1556, test_f1: 0.3727
 epoch: 30, train_loss: 1.1778, test_loss: 1.1547, test_f1: 0.3914
 epoch: 31, train_loss: 1.1751, test_loss: 1.1504, test_f1: 0.3973
 epoch: 32, train_loss: 1.1705, test_loss: 1.1482, test_f1: 0.4113
 epoch: 33, train_loss: 1.1680, test_loss: 1.1458, test_f1: 0.4106
 epoch: 34, train_loss: 1.1600, test_loss: 1.1428, test_f1: 0.4173
 epoch: 35, train_loss: 1.1641, test_loss: 1.1427, test_f1: 0.4328
 epoch: 36, train_loss: 1.1620, test_loss: 1.1394, test_f1: 0.4244
 epoch: 37, train_loss: 1.1550, test_loss: 1.1383, test_f1: 0.4345
 epoch: 38, train_loss: 1.1498, test_loss: 1.1354, test_f1: 0.4435
 epoch: 39, train_loss: 1.1459, test_loss: 1.1346, test_f1: 0.4438
 epoch: 40, train_loss: 1.1419, test_loss: 1.1301, test_f1: 0.4529
 epoch: 41, train_loss: 1.1386, test_loss: 1.1313, test_f1: 0.4501
 epoch: 42, train_loss: 1.1365, test_loss: 1.1281, test_f1: 0.4470
 epoch: 43, train_loss: 1.1319, test_loss: 1.1259, test_f1: 0.4548
 epoch: 44, train_loss: 1.1293, test_loss: 1.1244, test_f1: 0.4560
 epoch: 45, train_loss: 1.1245, test_loss: 1.1222, test_f1: 0.4550
 epoch: 46, train_loss: 1.1245, test_loss: 1.1207, test_f1: 0.4419
 epoch: 47, train_loss: 1.1222, test_loss: 1.1194, test_f1: 0.4513
 epoch: 48, train_loss: 1.1146, test_loss: 1.1189, test_f1: 0.4497
 epoch: 49, train_loss: 1.1088, test_loss: 1.1172, test_f1: 0.4407
 epoch: 50, train_loss: 1.1115, test_loss: 1.1144, test_f1: 0.4570
 epoch: 51, train_loss: 1.1033, test_loss: 1.1196, test_f1: 0.4481
 epoch: 52, train_loss: 1.1037, test_loss: 1.1160, test_f1: 0.4483
 epoch: 53, train_loss: 1.1064, test_loss: 1.1154, test_f1: 0.4537
 epoch: 54, train_loss: 1.0990, test_loss: 1.1114, test_f1: 0.4529
 epoch: 55, train_loss: 1.0985, test_loss: 1.1127, test_f1: 0.4516
 epoch: 56, train_loss: 1.1020, test_loss: 1.1127, test_f1: 0.4506
 epoch: 57, train_loss: 1.1019, test_loss: 1.1155, test_f1: 0.4503
 epoch: 58, train_loss: 1.0937, test_loss: 1.1127, test_f1: 0.4464
 epoch: 59, train_loss: 1.0925, test_loss: 1.1126, test_f1: 0.4549
 epoch: 60, train_loss: 1.0886, test_loss: 1.1090, test_f1: 0.4486
 epoch: 61, train_loss: 1.0858, test_loss: 1.1090, test_f1: 0.4514
 epoch: 62, train_loss: 1.0914, test_loss: 1.1077, test_f1: 0.4558
 epoch: 63, train_loss: 1.0985, test_loss: 1.1092, test_f1: 0.4504
 epoch: 64, train_loss: 1.0942, test_loss: 1.1129, test_f1: 0.4483
 epoch: 65, train_loss: 1.0819, test_loss: 1.1052, test_f1: 0.4519
 epoch: 66, train_loss: 1.0836, test_loss: 1.1088, test_f1: 0.4535
 epoch: 67, train_loss: 1.0757, test_loss: 1.1097, test_f1: 0.4483
 epoch: 68, train_loss: 1.0772, test_loss: 1.1043, test_f1: 0.4511
 epoch: 69, train_loss: 1.0840, test_loss: 1.1025, test_f1: 0.4564
 epoch: 70, train_loss: 1.0805, test_loss: 1.1102, test_f1: 0.4545
 epoch: 71, train_loss: 1.0776, test_loss: 1.1082, test_f1: 0.4530
 epoch: 72, train_loss: 1.0726, test_loss: 1.1046, test_f1: 0.4501
 epoch: 73, train_loss: 1.0724, test_loss: 1.1059, test_f1: 0.4460
 epoch: 74, train_loss: 1.0766, test_loss: 1.1064, test_f1: 0.4427
 epoch: 75, train_loss: 1.0710, test_loss: 1.1099, test_f1: 0.4439
 epoch: 76, train_loss: 1.0748, test_loss: 1.1051, test_f1: 0.4577
 epoch: 77, train_loss: 1.0673, test_loss: 1.1074, test_f1: 0.4512
 epoch: 78, train_loss: 1.0669, test_loss: 1.1085, test_f1: 0.4462
 epoch: 79, train_loss: 1.0679, test_loss: 1.1034, test_f1: 0.4568
 epoch: 80, train_loss: 1.0638, test_loss: 1.1044, test_f1: 0.4559
 epoch: 81, train_loss: 1.0687, test_loss: 1.0978, test_f1: 0.4492
 epoch: 82, train_loss: 1.0641, test_loss: 1.1025, test_f1: 0.4548
 epoch: 83, train_loss: 1.0616, test_loss: 1.1020, test_f1: 0.4600
 epoch: 84, train_loss: 1.0621, test_loss: 1.1025, test_f1: 0.4495
 epoch: 85, train_loss: 1.0681, test_loss: 1.1013, test_f1: 0.4529
 epoch: 86, train_loss: 1.0582, test_loss: 1.1050, test_f1: 0.4517
 epoch: 87, train_loss: 1.0570, test_loss: 1.0978, test_f1: 0.4530
 epoch: 88, train_loss: 1.0607, test_loss: 1.1005, test_f1: 0.4517
 epoch: 89, train_loss: 1.0491, test_loss: 1.1013, test_f1: 0.4475
 epoch: 90, train_loss: 1.0634, test_loss: 1.0991, test_f1: 0.4527
 epoch: 91, train_loss: 1.0557, test_loss: 1.1052, test_f1: 0.4503
 epoch: 92, train_loss: 1.0549, test_loss: 1.1068, test_f1: 0.4342
 epoch: 93, train_loss: 1.0533, test_loss: 1.1041, test_f1: 0.4505
 epoch: 94, train_loss: 1.0449, test_loss: 1.1003, test_f1: 0.4458
 epoch: 95, train_loss: 1.0429, test_loss: 1.0967, test_f1: 0.4523
 epoch: 96, train_loss: 1.0445, test_loss: 1.0995, test_f1: 0.4457
 epoch: 97, train_loss: 1.0473, test_loss: 1.1024, test_f1: 0.4471
 epoch: 98, train_loss: 1.0415, test_loss: 1.0962, test_f1: 0.4494
 epoch: 99, train_loss: 1.0417, test_loss: 1.1023, test_f1: 0.4396
##################ITERATION #3 ****************************************
 epoch: 0, train_loss: 1.3178, test_loss: 1.3207, test_f1: 0.2274
 epoch: 1, train_loss: 1.2998, test_loss: 1.2969, test_f1: 0.2274
 epoch: 2, train_loss: 1.2846, test_loss: 1.2818, test_f1: 0.2274
 epoch: 3, train_loss: 1.2767, test_loss: 1.2702, test_f1: 0.2274
 epoch: 4, train_loss: 1.2680, test_loss: 1.2602, test_f1: 0.2275
 epoch: 5, train_loss: 1.2614, test_loss: 1.2469, test_f1: 0.2563
 epoch: 6, train_loss: 1.2493, test_loss: 1.2388, test_f1: 0.2662
 epoch: 7, train_loss: 1.2405, test_loss: 1.2268, test_f1: 0.2642
 epoch: 8, train_loss: 1.2354, test_loss: 1.2167, test_f1: 0.2748
 epoch: 9, train_loss: 1.2255, test_loss: 1.2056, test_f1: 0.2870
 epoch: 10, train_loss: 1.2193, test_loss: 1.1972, test_f1: 0.2945
 epoch: 11, train_loss: 1.2082, test_loss: 1.1870, test_f1: 0.3268
 epoch: 12, train_loss: 1.2003, test_loss: 1.1761, test_f1: 0.3412
 epoch: 13, train_loss: 1.1949, test_loss: 1.1710, test_f1: 0.3733
 epoch: 14, train_loss: 1.1945, test_loss: 1.1629, test_f1: 0.3937
 epoch: 15, train_loss: 1.1883, test_loss: 1.1550, test_f1: 0.4182
 epoch: 16, train_loss: 1.1846, test_loss: 1.1483, test_f1: 0.4260
 epoch: 17, train_loss: 1.1762, test_loss: 1.1408, test_f1: 0.4145
 epoch: 18, train_loss: 1.1686, test_loss: 1.1348, test_f1: 0.4301
 epoch: 19, train_loss: 1.1681, test_loss: 1.1284, test_f1: 0.4298
 epoch: 20, train_loss: 1.1627, test_loss: 1.1237, test_f1: 0.4312
 epoch: 21, train_loss: 1.1579, test_loss: 1.1162, test_f1: 0.4435
 epoch: 22, train_loss: 1.1505, test_loss: 1.1131, test_f1: 0.4442
 epoch: 23, train_loss: 1.1387, test_loss: 1.1072, test_f1: 0.4374
 epoch: 24, train_loss: 1.1411, test_loss: 1.1044, test_f1: 0.4494
 epoch: 25, train_loss: 1.1341, test_loss: 1.0989, test_f1: 0.4491
 epoch: 26, train_loss: 1.1234, test_loss: 1.0951, test_f1: 0.4657
 epoch: 27, train_loss: 1.1224, test_loss: 1.0921, test_f1: 0.4531
 epoch: 28, train_loss: 1.1142, test_loss: 1.0896, test_f1: 0.4580
 epoch: 29, train_loss: 1.1143, test_loss: 1.0832, test_f1: 0.4637
 epoch: 30, train_loss: 1.1107, test_loss: 1.0816, test_f1: 0.4735
 epoch: 31, train_loss: 1.1014, test_loss: 1.0831, test_f1: 0.4573
 epoch: 32, train_loss: 1.0993, test_loss: 1.0811, test_f1: 0.4569
 epoch: 33, train_loss: 1.0945, test_loss: 1.0761, test_f1: 0.4593
 epoch: 34, train_loss: 1.0882, test_loss: 1.0714, test_f1: 0.4716
 epoch: 35, train_loss: 1.0825, test_loss: 1.0694, test_f1: 0.4643
 epoch: 36, train_loss: 1.0720, test_loss: 1.0645, test_f1: 0.4611
 epoch: 37, train_loss: 1.0690, test_loss: 1.0640, test_f1: 0.4711
 epoch: 38, train_loss: 1.0674, test_loss: 1.0609, test_f1: 0.4644
 epoch: 39, train_loss: 1.0738, test_loss: 1.0586, test_f1: 0.4706
 epoch: 40, train_loss: 1.0604, test_loss: 1.0602, test_f1: 0.4780
 epoch: 41, train_loss: 1.0641, test_loss: 1.0592, test_f1: 0.4690
 epoch: 42, train_loss: 1.0541, test_loss: 1.0507, test_f1: 0.4795
 epoch: 43, train_loss: 1.0583, test_loss: 1.0538, test_f1: 0.4714
 epoch: 44, train_loss: 1.0463, test_loss: 1.0574, test_f1: 0.4693
 epoch: 45, train_loss: 1.0493, test_loss: 1.0446, test_f1: 0.4732
 epoch: 46, train_loss: 1.0481, test_loss: 1.0449, test_f1: 0.4678
 epoch: 47, train_loss: 1.0418, test_loss: 1.0473, test_f1: 0.4654
 epoch: 48, train_loss: 1.0458, test_loss: 1.0539, test_f1: 0.4659
 epoch: 49, train_loss: 1.0319, test_loss: 1.0480, test_f1: 0.4711
 epoch: 50, train_loss: 1.0325, test_loss: 1.0601, test_f1: 0.4733
 epoch: 51, train_loss: 1.0238, test_loss: 1.0463, test_f1: 0.4571
 epoch: 52, train_loss: 1.0292, test_loss: 1.0457, test_f1: 0.4669
 epoch: 53, train_loss: 1.0299, test_loss: 1.0508, test_f1: 0.4721
 epoch: 54, train_loss: 1.0329, test_loss: 1.0427, test_f1: 0.4674
 epoch: 55, train_loss: 1.0273, test_loss: 1.0414, test_f1: 0.4666
 epoch: 56, train_loss: 1.0287, test_loss: 1.0402, test_f1: 0.4608
 epoch: 57, train_loss: 1.0222, test_loss: 1.0406, test_f1: 0.4670
 epoch: 58, train_loss: 1.0219, test_loss: 1.0406, test_f1: 0.4658
 epoch: 59, train_loss: 1.0209, test_loss: 1.0389, test_f1: 0.4763
 epoch: 60, train_loss: 1.0141, test_loss: 1.0353, test_f1: 0.4701
 epoch: 61, train_loss: 1.0201, test_loss: 1.0349, test_f1: 0.4622
 epoch: 62, train_loss: 1.0135, test_loss: 1.0378, test_f1: 0.4600
 epoch: 63, train_loss: 1.0171, test_loss: 1.0383, test_f1: 0.4610
 epoch: 64, train_loss: 1.0115, test_loss: 1.0395, test_f1: 0.4617
 epoch: 65, train_loss: 1.0110, test_loss: 1.0378, test_f1: 0.4616
 epoch: 66, train_loss: 1.0163, test_loss: 1.0381, test_f1: 0.4592
 epoch: 67, train_loss: 1.0024, test_loss: 1.0354, test_f1: 0.4640
 epoch: 68, train_loss: 1.0106, test_loss: 1.0341, test_f1: 0.4751
 epoch: 69, train_loss: 1.0080, test_loss: 1.0340, test_f1: 0.4668
 epoch: 70, train_loss: 1.0088, test_loss: 1.0372, test_f1: 0.4649
 epoch: 71, train_loss: 0.9958, test_loss: 1.0334, test_f1: 0.4539
 epoch: 72, train_loss: 1.0075, test_loss: 1.0374, test_f1: 0.4599
 epoch: 73, train_loss: 1.0055, test_loss: 1.0440, test_f1: 0.4536
 epoch: 74, train_loss: 1.0035, test_loss: 1.0377, test_f1: 0.4592
 epoch: 75, train_loss: 0.9926, test_loss: 1.0352, test_f1: 0.4619
 epoch: 76, train_loss: 1.0014, test_loss: 1.0494, test_f1: 0.4592
 epoch: 77, train_loss: 0.9981, test_loss: 1.0397, test_f1: 0.4590
 epoch: 78, train_loss: 0.9925, test_loss: 1.0390, test_f1: 0.4648
 epoch: 79, train_loss: 0.9969, test_loss: 1.0348, test_f1: 0.4681
 epoch: 80, train_loss: 0.9988, test_loss: 1.0430, test_f1: 0.4614
 epoch: 81, train_loss: 0.9941, test_loss: 1.0448, test_f1: 0.4598
 epoch: 82, train_loss: 0.9995, test_loss: 1.0392, test_f1: 0.4570
 epoch: 83, train_loss: 0.9878, test_loss: 1.0378, test_f1: 0.4538
 epoch: 84, train_loss: 0.9950, test_loss: 1.0339, test_f1: 0.4584
 epoch: 85, train_loss: 0.9949, test_loss: 1.0396, test_f1: 0.4665
 epoch: 86, train_loss: 0.9867, test_loss: 1.0381, test_f1: 0.4631
 epoch: 87, train_loss: 0.9941, test_loss: 1.0405, test_f1: 0.4571
 epoch: 88, train_loss: 0.9839, test_loss: 1.0374, test_f1: 0.4576
 epoch: 89, train_loss: 0.9858, test_loss: 1.0398, test_f1: 0.4634
 epoch: 90, train_loss: 0.9812, test_loss: 1.0352, test_f1: 0.4609
 epoch: 91, train_loss: 0.9854, test_loss: 1.0330, test_f1: 0.4639
 epoch: 92, train_loss: 0.9994, test_loss: 1.0338, test_f1: 0.4592
 epoch: 93, train_loss: 0.9800, test_loss: 1.0400, test_f1: 0.4592
 epoch: 94, train_loss: 0.9944, test_loss: 1.0324, test_f1: 0.4648
 epoch: 95, train_loss: 0.9824, test_loss: 1.0366, test_f1: 0.4650
 epoch: 96, train_loss: 0.9836, test_loss: 1.0383, test_f1: 0.4651
 epoch: 97, train_loss: 0.9790, test_loss: 1.0412, test_f1: 0.4608
 epoch: 98, train_loss: 0.9735, test_loss: 1.0433, test_f1: 0.4618
 epoch: 99, train_loss: 0.9726, test_loss: 1.0347, test_f1: 0.4626
##################ITERATION #4 ****************************************
 epoch: 0, train_loss: 1.3321, test_loss: 1.3338, test_f1: 0.3087
 epoch: 1, train_loss: 1.3034, test_loss: 1.3028, test_f1: 0.3191
 epoch: 2, train_loss: 1.2833, test_loss: 1.2682, test_f1: 0.3251
 epoch: 3, train_loss: 1.2748, test_loss: 1.2537, test_f1: 0.3198
 epoch: 4, train_loss: 1.2657, test_loss: 1.2414, test_f1: 0.3073
 epoch: 5, train_loss: 1.2513, test_loss: 1.2297, test_f1: 0.3252
 epoch: 6, train_loss: 1.2448, test_loss: 1.2170, test_f1: 0.3285
 epoch: 7, train_loss: 1.2351, test_loss: 1.2098, test_f1: 0.3260
 epoch: 8, train_loss: 1.2265, test_loss: 1.1986, test_f1: 0.3333
 epoch: 9, train_loss: 1.2176, test_loss: 1.1918, test_f1: 0.3353
 epoch: 10, train_loss: 1.2075, test_loss: 1.1842, test_f1: 0.3470
 epoch: 11, train_loss: 1.2052, test_loss: 1.1783, test_f1: 0.3595
 epoch: 12, train_loss: 1.1973, test_loss: 1.1732, test_f1: 0.3707
 epoch: 13, train_loss: 1.1942, test_loss: 1.1676, test_f1: 0.3909
 epoch: 14, train_loss: 1.1880, test_loss: 1.1627, test_f1: 0.4029
 epoch: 15, train_loss: 1.1825, test_loss: 1.1564, test_f1: 0.4102
 epoch: 16, train_loss: 1.1793, test_loss: 1.1500, test_f1: 0.4136
 epoch: 17, train_loss: 1.1743, test_loss: 1.1461, test_f1: 0.4111
 epoch: 18, train_loss: 1.1728, test_loss: 1.1398, test_f1: 0.4170
 epoch: 19, train_loss: 1.1604, test_loss: 1.1383, test_f1: 0.4187
 epoch: 20, train_loss: 1.1602, test_loss: 1.1317, test_f1: 0.4227
 epoch: 21, train_loss: 1.1549, test_loss: 1.1274, test_f1: 0.4200
 epoch: 22, train_loss: 1.1509, test_loss: 1.1227, test_f1: 0.4242
 epoch: 23, train_loss: 1.1423, test_loss: 1.1155, test_f1: 0.4186
 epoch: 24, train_loss: 1.1416, test_loss: 1.1114, test_f1: 0.4283
 epoch: 25, train_loss: 1.1376, test_loss: 1.1052, test_f1: 0.4305
 epoch: 26, train_loss: 1.1292, test_loss: 1.1036, test_f1: 0.4346
 epoch: 27, train_loss: 1.1327, test_loss: 1.0983, test_f1: 0.4258
 epoch: 28, train_loss: 1.1248, test_loss: 1.0935, test_f1: 0.4296
 epoch: 29, train_loss: 1.1241, test_loss: 1.0876, test_f1: 0.4328
 epoch: 30, train_loss: 1.1169, test_loss: 1.0828, test_f1: 0.4325
 epoch: 31, train_loss: 1.1097, test_loss: 1.0820, test_f1: 0.4391
 epoch: 32, train_loss: 1.1029, test_loss: 1.0761, test_f1: 0.4404
 epoch: 33, train_loss: 1.1014, test_loss: 1.0683, test_f1: 0.4609
 epoch: 34, train_loss: 1.1002, test_loss: 1.0641, test_f1: 0.4502
 epoch: 35, train_loss: 1.0938, test_loss: 1.0639, test_f1: 0.4408
 epoch: 36, train_loss: 1.0978, test_loss: 1.0622, test_f1: 0.4370
 epoch: 37, train_loss: 1.0841, test_loss: 1.0588, test_f1: 0.4473
 epoch: 38, train_loss: 1.0861, test_loss: 1.0518, test_f1: 0.4461
 epoch: 39, train_loss: 1.0790, test_loss: 1.0521, test_f1: 0.4466
 epoch: 40, train_loss: 1.0805, test_loss: 1.0414, test_f1: 0.4473
 epoch: 41, train_loss: 1.0682, test_loss: 1.0382, test_f1: 0.4453
 epoch: 42, train_loss: 1.0777, test_loss: 1.0324, test_f1: 0.4485
 epoch: 43, train_loss: 1.0673, test_loss: 1.0317, test_f1: 0.4464
 epoch: 44, train_loss: 1.0637, test_loss: 1.0185, test_f1: 0.4593
 epoch: 45, train_loss: 1.0538, test_loss: 1.0230, test_f1: 0.4586
 epoch: 46, train_loss: 1.0520, test_loss: 1.0229, test_f1: 0.4523
 epoch: 47, train_loss: 1.0465, test_loss: 1.0192, test_f1: 0.4587
 epoch: 48, train_loss: 1.0535, test_loss: 1.0212, test_f1: 0.4579
 epoch: 49, train_loss: 1.0571, test_loss: 1.0053, test_f1: 0.4649
 epoch: 50, train_loss: 1.0485, test_loss: 1.0017, test_f1: 0.4728
 epoch: 51, train_loss: 1.0369, test_loss: 1.0059, test_f1: 0.4759
 epoch: 52, train_loss: 1.0351, test_loss: 1.0029, test_f1: 0.4717
 epoch: 53, train_loss: 1.0333, test_loss: 1.0051, test_f1: 0.4789
 epoch: 54, train_loss: 1.0388, test_loss: 0.9995, test_f1: 0.4795
 epoch: 55, train_loss: 1.0350, test_loss: 0.9959, test_f1: 0.4728
 epoch: 56, train_loss: 1.0288, test_loss: 1.0006, test_f1: 0.4777
 epoch: 57, train_loss: 1.0311, test_loss: 0.9995, test_f1: 0.4717
 epoch: 58, train_loss: 1.0331, test_loss: 1.0014, test_f1: 0.4639
 epoch: 59, train_loss: 1.0250, test_loss: 0.9939, test_f1: 0.4772
 epoch: 60, train_loss: 1.0195, test_loss: 0.9946, test_f1: 0.4849
 epoch: 61, train_loss: 1.0240, test_loss: 0.9919, test_f1: 0.4852
 epoch: 62, train_loss: 1.0187, test_loss: 0.9935, test_f1: 0.4698
 epoch: 63, train_loss: 1.0297, test_loss: 0.9933, test_f1: 0.4735
 epoch: 64, train_loss: 1.0317, test_loss: 0.9922, test_f1: 0.4702
 epoch: 65, train_loss: 1.0159, test_loss: 0.9920, test_f1: 0.4796
 epoch: 66, train_loss: 1.0161, test_loss: 0.9910, test_f1: 0.4769
 epoch: 67, train_loss: 1.0213, test_loss: 0.9804, test_f1: 0.4864
 epoch: 68, train_loss: 1.0209, test_loss: 0.9909, test_f1: 0.4759
 epoch: 69, train_loss: 1.0166, test_loss: 0.9915, test_f1: 0.4743
 epoch: 70, train_loss: 1.0153, test_loss: 0.9919, test_f1: 0.4747
 epoch: 71, train_loss: 1.0129, test_loss: 0.9881, test_f1: 0.4751
 epoch: 72, train_loss: 1.0030, test_loss: 0.9825, test_f1: 0.4870
 epoch: 73, train_loss: 1.0076, test_loss: 0.9862, test_f1: 0.4810
 epoch: 74, train_loss: 1.0105, test_loss: 0.9833, test_f1: 0.4812
 epoch: 75, train_loss: 1.0012, test_loss: 0.9828, test_f1: 0.4830
 epoch: 76, train_loss: 1.0089, test_loss: 0.9832, test_f1: 0.4887
 epoch: 77, train_loss: 1.0117, test_loss: 0.9870, test_f1: 0.4775
 epoch: 78, train_loss: 1.0092, test_loss: 0.9816, test_f1: 0.4875
 epoch: 79, train_loss: 1.0049, test_loss: 0.9790, test_f1: 0.4827
 epoch: 80, train_loss: 1.0053, test_loss: 0.9747, test_f1: 0.4831
 epoch: 81, train_loss: 1.0021, test_loss: 0.9721, test_f1: 0.4925
 epoch: 82, train_loss: 0.9973, test_loss: 0.9753, test_f1: 0.4940
 epoch: 83, train_loss: 0.9967, test_loss: 0.9781, test_f1: 0.4849
 epoch: 84, train_loss: 1.0043, test_loss: 0.9791, test_f1: 0.4868
 epoch: 85, train_loss: 0.9972, test_loss: 0.9779, test_f1: 0.4838
 epoch: 86, train_loss: 0.9873, test_loss: 0.9779, test_f1: 0.5005
 epoch: 87, train_loss: 0.9977, test_loss: 0.9775, test_f1: 0.4991
 epoch: 88, train_loss: 0.9880, test_loss: 0.9768, test_f1: 0.4981
 epoch: 89, train_loss: 0.9910, test_loss: 0.9755, test_f1: 0.4994
 epoch: 90, train_loss: 0.9973, test_loss: 0.9692, test_f1: 0.5003
 epoch: 91, train_loss: 0.9884, test_loss: 0.9706, test_f1: 0.5021
 epoch: 92, train_loss: 1.0026, test_loss: 0.9727, test_f1: 0.5030
 epoch: 93, train_loss: 0.9899, test_loss: 0.9642, test_f1: 0.5004
 epoch: 94, train_loss: 0.9901, test_loss: 0.9692, test_f1: 0.4972
 epoch: 95, train_loss: 0.9893, test_loss: 0.9717, test_f1: 0.4999
 epoch: 96, train_loss: 0.9900, test_loss: 0.9686, test_f1: 0.5047
 epoch: 97, train_loss: 0.9878, test_loss: 0.9677, test_f1: 0.5021
 epoch: 98, train_loss: 0.9955, test_loss: 0.9709, test_f1: 0.4957
 epoch: 99, train_loss: 0.9763, test_loss: 0.9656, test_f1: 0.4934
##################ITERATION #5 ****************************************
 epoch: 0, train_loss: 1.3295, test_loss: 1.3069, test_f1: 0.2274
 epoch: 1, train_loss: 1.2984, test_loss: 1.2944, test_f1: 0.2274
 epoch: 2, train_loss: 1.2910, test_loss: 1.2778, test_f1: 0.2402
 epoch: 3, train_loss: 1.2863, test_loss: 1.2624, test_f1: 0.2522
 epoch: 4, train_loss: 1.2700, test_loss: 1.2525, test_f1: 0.2697
 epoch: 5, train_loss: 1.2612, test_loss: 1.2426, test_f1: 0.2769
 epoch: 6, train_loss: 1.2565, test_loss: 1.2356, test_f1: 0.2907
 epoch: 7, train_loss: 1.2564, test_loss: 1.2307, test_f1: 0.2919
 epoch: 8, train_loss: 1.2490, test_loss: 1.2261, test_f1: 0.2911
 epoch: 9, train_loss: 1.2471, test_loss: 1.2187, test_f1: 0.2959
 epoch: 10, train_loss: 1.2429, test_loss: 1.2164, test_f1: 0.2933
 epoch: 11, train_loss: 1.2352, test_loss: 1.2095, test_f1: 0.2921
 epoch: 12, train_loss: 1.2319, test_loss: 1.2046, test_f1: 0.3002
 epoch: 13, train_loss: 1.2276, test_loss: 1.1989, test_f1: 0.3018
 epoch: 14, train_loss: 1.2276, test_loss: 1.1950, test_f1: 0.3144
 epoch: 15, train_loss: 1.2224, test_loss: 1.1909, test_f1: 0.3357
 epoch: 16, train_loss: 1.2205, test_loss: 1.1844, test_f1: 0.3452
 epoch: 17, train_loss: 1.2157, test_loss: 1.1816, test_f1: 0.3594
 epoch: 18, train_loss: 1.2057, test_loss: 1.1760, test_f1: 0.3643
 epoch: 19, train_loss: 1.2096, test_loss: 1.1685, test_f1: 0.3733
 epoch: 20, train_loss: 1.2046, test_loss: 1.1671, test_f1: 0.3748
 epoch: 21, train_loss: 1.1961, test_loss: 1.1577, test_f1: 0.3989
 epoch: 22, train_loss: 1.1937, test_loss: 1.1543, test_f1: 0.3938
 epoch: 23, train_loss: 1.1993, test_loss: 1.1494, test_f1: 0.4055
 epoch: 24, train_loss: 1.1889, test_loss: 1.1475, test_f1: 0.3942
 epoch: 25, train_loss: 1.1873, test_loss: 1.1435, test_f1: 0.3946
 epoch: 26, train_loss: 1.1775, test_loss: 1.1388, test_f1: 0.4009
 epoch: 27, train_loss: 1.1795, test_loss: 1.1348, test_f1: 0.4021
 epoch: 28, train_loss: 1.1691, test_loss: 1.1329, test_f1: 0.4116
 epoch: 29, train_loss: 1.1713, test_loss: 1.1282, test_f1: 0.4167
 epoch: 30, train_loss: 1.1683, test_loss: 1.1229, test_f1: 0.4187
 epoch: 31, train_loss: 1.1566, test_loss: 1.1207, test_f1: 0.4186
 epoch: 32, train_loss: 1.1564, test_loss: 1.1166, test_f1: 0.4196
 epoch: 33, train_loss: 1.1498, test_loss: 1.1115, test_f1: 0.4111
 epoch: 34, train_loss: 1.1450, test_loss: 1.1036, test_f1: 0.4215
 epoch: 35, train_loss: 1.1455, test_loss: 1.1049, test_f1: 0.4247
 epoch: 36, train_loss: 1.1389, test_loss: 1.0999, test_f1: 0.4302
 epoch: 37, train_loss: 1.1375, test_loss: 1.0929, test_f1: 0.4371
 epoch: 38, train_loss: 1.1268, test_loss: 1.0898, test_f1: 0.4387
 epoch: 39, train_loss: 1.1303, test_loss: 1.0859, test_f1: 0.4395
 epoch: 40, train_loss: 1.1243, test_loss: 1.0820, test_f1: 0.4378
 epoch: 41, train_loss: 1.1199, test_loss: 1.0741, test_f1: 0.4403
 epoch: 42, train_loss: 1.1081, test_loss: 1.0763, test_f1: 0.4423
 epoch: 43, train_loss: 1.1185, test_loss: 1.0720, test_f1: 0.4428
 epoch: 44, train_loss: 1.1147, test_loss: 1.0675, test_f1: 0.4389
 epoch: 45, train_loss: 1.1113, test_loss: 1.0629, test_f1: 0.4483
 epoch: 46, train_loss: 1.1001, test_loss: 1.0554, test_f1: 0.4524
 epoch: 47, train_loss: 1.1039, test_loss: 1.0556, test_f1: 0.4480
 epoch: 48, train_loss: 1.0962, test_loss: 1.0530, test_f1: 0.4458
 epoch: 49, train_loss: 1.0935, test_loss: 1.0531, test_f1: 0.4513
 epoch: 50, train_loss: 1.0964, test_loss: 1.0493, test_f1: 0.4478
 epoch: 51, train_loss: 1.0858, test_loss: 1.0470, test_f1: 0.4598
 epoch: 52, train_loss: 1.0991, test_loss: 1.0451, test_f1: 0.4532
 epoch: 53, train_loss: 1.0929, test_loss: 1.0423, test_f1: 0.4449
 epoch: 54, train_loss: 1.0788, test_loss: 1.0435, test_f1: 0.4537
 epoch: 55, train_loss: 1.0870, test_loss: 1.0457, test_f1: 0.4563
 epoch: 56, train_loss: 1.0811, test_loss: 1.0547, test_f1: 0.4571
 epoch: 57, train_loss: 1.0759, test_loss: 1.0454, test_f1: 0.4613
 epoch: 58, train_loss: 1.0869, test_loss: 1.0419, test_f1: 0.4619
 epoch: 59, train_loss: 1.0713, test_loss: 1.0417, test_f1: 0.4587
 epoch: 60, train_loss: 1.0785, test_loss: 1.0400, test_f1: 0.4554
 epoch: 61, train_loss: 1.0737, test_loss: 1.0441, test_f1: 0.4592
 epoch: 62, train_loss: 1.0768, test_loss: 1.0329, test_f1: 0.4682
 epoch: 63, train_loss: 1.0761, test_loss: 1.0357, test_f1: 0.4597
 epoch: 64, train_loss: 1.0726, test_loss: 1.0451, test_f1: 0.4546
 epoch: 65, train_loss: 1.0756, test_loss: 1.0393, test_f1: 0.4678
 epoch: 66, train_loss: 1.0630, test_loss: 1.0363, test_f1: 0.4603
 epoch: 67, train_loss: 1.0709, test_loss: 1.0359, test_f1: 0.4578
 epoch: 68, train_loss: 1.0673, test_loss: 1.0336, test_f1: 0.4596
 epoch: 69, train_loss: 1.0719, test_loss: 1.0284, test_f1: 0.4628
 epoch: 70, train_loss: 1.0653, test_loss: 1.0316, test_f1: 0.4634
 epoch: 71, train_loss: 1.0626, test_loss: 1.0375, test_f1: 0.4590
 epoch: 72, train_loss: 1.0592, test_loss: 1.0308, test_f1: 0.4644
 epoch: 73, train_loss: 1.0661, test_loss: 1.0313, test_f1: 0.4633
 epoch: 74, train_loss: 1.0584, test_loss: 1.0372, test_f1: 0.4569
 epoch: 75, train_loss: 1.0605, test_loss: 1.0291, test_f1: 0.4666
 epoch: 76, train_loss: 1.0467, test_loss: 1.0319, test_f1: 0.4594
 epoch: 77, train_loss: 1.0558, test_loss: 1.0283, test_f1: 0.4692
 epoch: 78, train_loss: 1.0603, test_loss: 1.0346, test_f1: 0.4589
 epoch: 79, train_loss: 1.0530, test_loss: 1.0221, test_f1: 0.4667
 epoch: 80, train_loss: 1.0458, test_loss: 1.0338, test_f1: 0.4674
 epoch: 81, train_loss: 1.0511, test_loss: 1.0288, test_f1: 0.4720
 epoch: 82, train_loss: 1.0556, test_loss: 1.0306, test_f1: 0.4621
 epoch: 83, train_loss: 1.0522, test_loss: 1.0218, test_f1: 0.4660
 epoch: 84, train_loss: 1.0489, test_loss: 1.0191, test_f1: 0.4668
 epoch: 85, train_loss: 1.0465, test_loss: 1.0344, test_f1: 0.4625
 epoch: 86, train_loss: 1.0509, test_loss: 1.0340, test_f1: 0.4551
 epoch: 87, train_loss: 1.0489, test_loss: 1.0323, test_f1: 0.4584
 epoch: 88, train_loss: 1.0466, test_loss: 1.0265, test_f1: 0.4618
 epoch: 89, train_loss: 1.0450, test_loss: 1.0264, test_f1: 0.4699
 epoch: 90, train_loss: 1.0324, test_loss: 1.0274, test_f1: 0.4662
 epoch: 91, train_loss: 1.0500, test_loss: 1.0102, test_f1: 0.4838
 epoch: 92, train_loss: 1.0418, test_loss: 1.0215, test_f1: 0.4617
 epoch: 93, train_loss: 1.0461, test_loss: 1.0265, test_f1: 0.4689
 epoch: 94, train_loss: 1.0304, test_loss: 1.0344, test_f1: 0.4636
 epoch: 95, train_loss: 1.0384, test_loss: 1.0228, test_f1: 0.4667
 epoch: 96, train_loss: 1.0374, test_loss: 1.0144, test_f1: 0.4732
 epoch: 97, train_loss: 1.0512, test_loss: 1.0241, test_f1: 0.4686
 epoch: 98, train_loss: 1.0353, test_loss: 1.0185, test_f1: 0.4647
 epoch: 99, train_loss: 1.0371, test_loss: 1.0181, test_f1: 0.4630
##################ITERATION #6 ****************************************
 epoch: 0, train_loss: 1.3440, test_loss: 1.3349, test_f1: 0.2274
 epoch: 1, train_loss: 1.3132, test_loss: 1.2883, test_f1: 0.2300
 epoch: 2, train_loss: 1.3050, test_loss: 1.2739, test_f1: 0.2418
 epoch: 3, train_loss: 1.2907, test_loss: 1.2631, test_f1: 0.2548
 epoch: 4, train_loss: 1.2831, test_loss: 1.2511, test_f1: 0.2656
 epoch: 5, train_loss: 1.2767, test_loss: 1.2493, test_f1: 0.2557
 epoch: 6, train_loss: 1.2682, test_loss: 1.2441, test_f1: 0.2576
 epoch: 7, train_loss: 1.2648, test_loss: 1.2308, test_f1: 0.2857
 epoch: 8, train_loss: 1.2571, test_loss: 1.2297, test_f1: 0.2836
 epoch: 9, train_loss: 1.2471, test_loss: 1.2229, test_f1: 0.2903
 epoch: 10, train_loss: 1.2477, test_loss: 1.2125, test_f1: 0.2936
 epoch: 11, train_loss: 1.2391, test_loss: 1.2079, test_f1: 0.3016
 epoch: 12, train_loss: 1.2329, test_loss: 1.2036, test_f1: 0.3246
 epoch: 13, train_loss: 1.2336, test_loss: 1.2022, test_f1: 0.3194
 epoch: 14, train_loss: 1.2268, test_loss: 1.1939, test_f1: 0.3439
 epoch: 15, train_loss: 1.2209, test_loss: 1.1891, test_f1: 0.3732
 epoch: 16, train_loss: 1.2163, test_loss: 1.1834, test_f1: 0.3570
 epoch: 17, train_loss: 1.2142, test_loss: 1.1823, test_f1: 0.3734
 epoch: 18, train_loss: 1.2086, test_loss: 1.1786, test_f1: 0.3684
 epoch: 19, train_loss: 1.2021, test_loss: 1.1824, test_f1: 0.3774
 epoch: 20, train_loss: 1.2008, test_loss: 1.1716, test_f1: 0.3836
 epoch: 21, train_loss: 1.2057, test_loss: 1.1713, test_f1: 0.3927
 epoch: 22, train_loss: 1.1989, test_loss: 1.1683, test_f1: 0.4104
 epoch: 23, train_loss: 1.1900, test_loss: 1.1635, test_f1: 0.4147
 epoch: 24, train_loss: 1.1870, test_loss: 1.1544, test_f1: 0.4120
 epoch: 25, train_loss: 1.1803, test_loss: 1.1558, test_f1: 0.4096
 epoch: 26, train_loss: 1.1844, test_loss: 1.1546, test_f1: 0.4130
 epoch: 27, train_loss: 1.1801, test_loss: 1.1533, test_f1: 0.4277
 epoch: 28, train_loss: 1.1678, test_loss: 1.1463, test_f1: 0.4092
 epoch: 29, train_loss: 1.1770, test_loss: 1.1435, test_f1: 0.4162
 epoch: 30, train_loss: 1.1663, test_loss: 1.1402, test_f1: 0.4363
 epoch: 31, train_loss: 1.1628, test_loss: 1.1381, test_f1: 0.4236
 epoch: 32, train_loss: 1.1589, test_loss: 1.1401, test_f1: 0.4126
 epoch: 33, train_loss: 1.1544, test_loss: 1.1317, test_f1: 0.4221
 epoch: 34, train_loss: 1.1580, test_loss: 1.1297, test_f1: 0.4363
 epoch: 35, train_loss: 1.1514, test_loss: 1.1270, test_f1: 0.4311
 epoch: 36, train_loss: 1.1544, test_loss: 1.1257, test_f1: 0.4369
 epoch: 37, train_loss: 1.1550, test_loss: 1.1205, test_f1: 0.4348
 epoch: 38, train_loss: 1.1487, test_loss: 1.1181, test_f1: 0.4442
 epoch: 39, train_loss: 1.1435, test_loss: 1.1169, test_f1: 0.4416
 epoch: 40, train_loss: 1.1420, test_loss: 1.1128, test_f1: 0.4360
 epoch: 41, train_loss: 1.1463, test_loss: 1.1137, test_f1: 0.4306
 epoch: 42, train_loss: 1.1367, test_loss: 1.1102, test_f1: 0.4391
 epoch: 43, train_loss: 1.1361, test_loss: 1.1084, test_f1: 0.4235
 epoch: 44, train_loss: 1.1266, test_loss: 1.1051, test_f1: 0.4248
 epoch: 45, train_loss: 1.1329, test_loss: 1.1017, test_f1: 0.4486
 epoch: 46, train_loss: 1.1222, test_loss: 1.0986, test_f1: 0.4459
 epoch: 47, train_loss: 1.1270, test_loss: 1.0985, test_f1: 0.4513
 epoch: 48, train_loss: 1.1229, test_loss: 1.0998, test_f1: 0.4472
 epoch: 49, train_loss: 1.1183, test_loss: 1.0949, test_f1: 0.4475
 epoch: 50, train_loss: 1.1165, test_loss: 1.0895, test_f1: 0.4491
 epoch: 51, train_loss: 1.1195, test_loss: 1.0877, test_f1: 0.4523
 epoch: 52, train_loss: 1.1110, test_loss: 1.0899, test_f1: 0.4478
 epoch: 53, train_loss: 1.1103, test_loss: 1.0860, test_f1: 0.4541
 epoch: 54, train_loss: 1.1126, test_loss: 1.0846, test_f1: 0.4616
 epoch: 55, train_loss: 1.1006, test_loss: 1.0856, test_f1: 0.4552
 epoch: 56, train_loss: 1.1039, test_loss: 1.0860, test_f1: 0.4445
 epoch: 57, train_loss: 1.1119, test_loss: 1.0832, test_f1: 0.4589
 epoch: 58, train_loss: 1.1070, test_loss: 1.0841, test_f1: 0.4529
 epoch: 59, train_loss: 1.1132, test_loss: 1.0822, test_f1: 0.4478
 epoch: 60, train_loss: 1.0936, test_loss: 1.0833, test_f1: 0.4472
 epoch: 61, train_loss: 1.1006, test_loss: 1.0800, test_f1: 0.4627
 epoch: 62, train_loss: 1.0998, test_loss: 1.0826, test_f1: 0.4623
 epoch: 63, train_loss: 1.0918, test_loss: 1.0841, test_f1: 0.4579
 epoch: 64, train_loss: 1.0934, test_loss: 1.0774, test_f1: 0.4704
 epoch: 65, train_loss: 1.0973, test_loss: 1.0764, test_f1: 0.4590
 epoch: 66, train_loss: 1.0956, test_loss: 1.0723, test_f1: 0.4542
 epoch: 67, train_loss: 1.0947, test_loss: 1.0749, test_f1: 0.4519
 epoch: 68, train_loss: 1.1001, test_loss: 1.0722, test_f1: 0.4598
 epoch: 69, train_loss: 1.0879, test_loss: 1.0687, test_f1: 0.4714
 epoch: 70, train_loss: 1.0901, test_loss: 1.0691, test_f1: 0.4660
 epoch: 71, train_loss: 1.0959, test_loss: 1.0696, test_f1: 0.4565
 epoch: 72, train_loss: 1.0897, test_loss: 1.0665, test_f1: 0.4681
 epoch: 73, train_loss: 1.0943, test_loss: 1.0625, test_f1: 0.4612
 epoch: 74, train_loss: 1.0844, test_loss: 1.0675, test_f1: 0.4527
 epoch: 75, train_loss: 1.0821, test_loss: 1.0648, test_f1: 0.4667
 epoch: 76, train_loss: 1.0936, test_loss: 1.0662, test_f1: 0.4641
 epoch: 77, train_loss: 1.0777, test_loss: 1.0640, test_f1: 0.4662
 epoch: 78, train_loss: 1.0897, test_loss: 1.0674, test_f1: 0.4607
 epoch: 79, train_loss: 1.0768, test_loss: 1.0660, test_f1: 0.4593
 epoch: 80, train_loss: 1.0813, test_loss: 1.0626, test_f1: 0.4591
 epoch: 81, train_loss: 1.0864, test_loss: 1.0608, test_f1: 0.4653
 epoch: 82, train_loss: 1.0860, test_loss: 1.0609, test_f1: 0.4713
 epoch: 83, train_loss: 1.0763, test_loss: 1.0570, test_f1: 0.4733
 epoch: 84, train_loss: 1.0704, test_loss: 1.0550, test_f1: 0.4793
 epoch: 85, train_loss: 1.0739, test_loss: 1.0552, test_f1: 0.4678
 epoch: 86, train_loss: 1.0773, test_loss: 1.0556, test_f1: 0.4775
 epoch: 87, train_loss: 1.0744, test_loss: 1.0555, test_f1: 0.4799
 epoch: 88, train_loss: 1.0699, test_loss: 1.0509, test_f1: 0.4779
 epoch: 89, train_loss: 1.0681, test_loss: 1.0537, test_f1: 0.4750
 epoch: 90, train_loss: 1.0749, test_loss: 1.0509, test_f1: 0.4816
 epoch: 91, train_loss: 1.0734, test_loss: 1.0522, test_f1: 0.4833
 epoch: 92, train_loss: 1.0669, test_loss: 1.0523, test_f1: 0.4773
 epoch: 93, train_loss: 1.0644, test_loss: 1.0511, test_f1: 0.4797
 epoch: 94, train_loss: 1.0680, test_loss: 1.0487, test_f1: 0.4709
 epoch: 95, train_loss: 1.0707, test_loss: 1.0495, test_f1: 0.4695
 epoch: 96, train_loss: 1.0618, test_loss: 1.0458, test_f1: 0.4804
 epoch: 97, train_loss: 1.0615, test_loss: 1.0428, test_f1: 0.4800
 epoch: 98, train_loss: 1.0672, test_loss: 1.0474, test_f1: 0.4755
 epoch: 99, train_loss: 1.0623, test_loss: 1.0449, test_f1: 0.4740
##################ITERATION #7 ****************************************
 epoch: 0, train_loss: 1.3217, test_loss: 1.3118, test_f1: 0.2555
 epoch: 1, train_loss: 1.2882, test_loss: 1.2793, test_f1: 0.2555
 epoch: 2, train_loss: 1.2747, test_loss: 1.2554, test_f1: 0.2568
 epoch: 3, train_loss: 1.2645, test_loss: 1.2427, test_f1: 0.2890
 epoch: 4, train_loss: 1.2554, test_loss: 1.2309, test_f1: 0.3058
 epoch: 5, train_loss: 1.2473, test_loss: 1.2219, test_f1: 0.3177
 epoch: 6, train_loss: 1.2394, test_loss: 1.2173, test_f1: 0.3241
 epoch: 7, train_loss: 1.2342, test_loss: 1.2112, test_f1: 0.3295
 epoch: 8, train_loss: 1.2292, test_loss: 1.2048, test_f1: 0.3450
 epoch: 9, train_loss: 1.2178, test_loss: 1.2001, test_f1: 0.3478
 epoch: 10, train_loss: 1.2200, test_loss: 1.1958, test_f1: 0.3727
 epoch: 11, train_loss: 1.2171, test_loss: 1.1918, test_f1: 0.3889
 epoch: 12, train_loss: 1.2089, test_loss: 1.1883, test_f1: 0.3750
 epoch: 13, train_loss: 1.1996, test_loss: 1.1834, test_f1: 0.3816
 epoch: 14, train_loss: 1.1949, test_loss: 1.1776, test_f1: 0.3910
 epoch: 15, train_loss: 1.1990, test_loss: 1.1751, test_f1: 0.3950
 epoch: 16, train_loss: 1.1964, test_loss: 1.1690, test_f1: 0.4019
 epoch: 17, train_loss: 1.1940, test_loss: 1.1673, test_f1: 0.3930
 epoch: 18, train_loss: 1.1880, test_loss: 1.1648, test_f1: 0.3889
 epoch: 19, train_loss: 1.1797, test_loss: 1.1608, test_f1: 0.4071
 epoch: 20, train_loss: 1.1835, test_loss: 1.1582, test_f1: 0.3957
 epoch: 21, train_loss: 1.1769, test_loss: 1.1515, test_f1: 0.4111
 epoch: 22, train_loss: 1.1732, test_loss: 1.1498, test_f1: 0.4044
 epoch: 23, train_loss: 1.1640, test_loss: 1.1450, test_f1: 0.3978
 epoch: 24, train_loss: 1.1644, test_loss: 1.1398, test_f1: 0.4172
 epoch: 25, train_loss: 1.1639, test_loss: 1.1372, test_f1: 0.4186
 epoch: 26, train_loss: 1.1598, test_loss: 1.1377, test_f1: 0.4125
 epoch: 27, train_loss: 1.1591, test_loss: 1.1328, test_f1: 0.4151
 epoch: 28, train_loss: 1.1495, test_loss: 1.1304, test_f1: 0.4169
 epoch: 29, train_loss: 1.1514, test_loss: 1.1279, test_f1: 0.4122
 epoch: 30, train_loss: 1.1468, test_loss: 1.1232, test_f1: 0.4098
 epoch: 31, train_loss: 1.1338, test_loss: 1.1193, test_f1: 0.4188
 epoch: 32, train_loss: 1.1363, test_loss: 1.1149, test_f1: 0.4212
 epoch: 33, train_loss: 1.1340, test_loss: 1.1144, test_f1: 0.4157
 epoch: 34, train_loss: 1.1333, test_loss: 1.1123, test_f1: 0.4068
 epoch: 35, train_loss: 1.1275, test_loss: 1.1061, test_f1: 0.4239
 epoch: 36, train_loss: 1.1198, test_loss: 1.1053, test_f1: 0.4201
 epoch: 37, train_loss: 1.1153, test_loss: 1.1017, test_f1: 0.4182
 epoch: 38, train_loss: 1.1126, test_loss: 1.0983, test_f1: 0.4163
 epoch: 39, train_loss: 1.1118, test_loss: 1.0958, test_f1: 0.4202
 epoch: 40, train_loss: 1.1122, test_loss: 1.0918, test_f1: 0.4226
 epoch: 41, train_loss: 1.1058, test_loss: 1.0886, test_f1: 0.4297
 epoch: 42, train_loss: 1.1094, test_loss: 1.0857, test_f1: 0.4237
 epoch: 43, train_loss: 1.0979, test_loss: 1.0863, test_f1: 0.4179
 epoch: 44, train_loss: 1.0988, test_loss: 1.0816, test_f1: 0.4215
 epoch: 45, train_loss: 1.0982, test_loss: 1.0784, test_f1: 0.4205
 epoch: 46, train_loss: 1.0907, test_loss: 1.0719, test_f1: 0.4295
 epoch: 47, train_loss: 1.0861, test_loss: 1.0725, test_f1: 0.4341
 epoch: 48, train_loss: 1.0855, test_loss: 1.0668, test_f1: 0.4327
 epoch: 49, train_loss: 1.0798, test_loss: 1.0697, test_f1: 0.4266
 epoch: 50, train_loss: 1.0904, test_loss: 1.0611, test_f1: 0.4380
 epoch: 51, train_loss: 1.0777, test_loss: 1.0620, test_f1: 0.4287
 epoch: 52, train_loss: 1.0682, test_loss: 1.0630, test_f1: 0.4251
 epoch: 53, train_loss: 1.0668, test_loss: 1.0596, test_f1: 0.4302
 epoch: 54, train_loss: 1.0807, test_loss: 1.0559, test_f1: 0.4378
 epoch: 55, train_loss: 1.0690, test_loss: 1.0556, test_f1: 0.4322
 epoch: 56, train_loss: 1.0627, test_loss: 1.0550, test_f1: 0.4290
 epoch: 57, train_loss: 1.0644, test_loss: 1.0552, test_f1: 0.4283
 epoch: 58, train_loss: 1.0642, test_loss: 1.0534, test_f1: 0.4298
 epoch: 59, train_loss: 1.0671, test_loss: 1.0515, test_f1: 0.4294
 epoch: 60, train_loss: 1.0619, test_loss: 1.0578, test_f1: 0.4294
 epoch: 61, train_loss: 1.0580, test_loss: 1.0513, test_f1: 0.4352
 epoch: 62, train_loss: 1.0696, test_loss: 1.0500, test_f1: 0.4353
 epoch: 63, train_loss: 1.0540, test_loss: 1.0528, test_f1: 0.4314
 epoch: 64, train_loss: 1.0583, test_loss: 1.0513, test_f1: 0.4327
 epoch: 65, train_loss: 1.0543, test_loss: 1.0487, test_f1: 0.4393
 epoch: 66, train_loss: 1.0493, test_loss: 1.0506, test_f1: 0.4333
 epoch: 67, train_loss: 1.0500, test_loss: 1.0452, test_f1: 0.4399
 epoch: 68, train_loss: 1.0531, test_loss: 1.0449, test_f1: 0.4386
 epoch: 69, train_loss: 1.0455, test_loss: 1.0443, test_f1: 0.4413
 epoch: 70, train_loss: 1.0556, test_loss: 1.0431, test_f1: 0.4384
 epoch: 71, train_loss: 1.0468, test_loss: 1.0365, test_f1: 0.4389
 epoch: 72, train_loss: 1.0402, test_loss: 1.0418, test_f1: 0.4378
 epoch: 73, train_loss: 1.0440, test_loss: 1.0383, test_f1: 0.4377
 epoch: 74, train_loss: 1.0407, test_loss: 1.0356, test_f1: 0.4395
 epoch: 75, train_loss: 1.0427, test_loss: 1.0316, test_f1: 0.4441
 epoch: 76, train_loss: 1.0374, test_loss: 1.0407, test_f1: 0.4453
 epoch: 77, train_loss: 1.0360, test_loss: 1.0350, test_f1: 0.4420
 epoch: 78, train_loss: 1.0309, test_loss: 1.0339, test_f1: 0.4454
 epoch: 79, train_loss: 1.0311, test_loss: 1.0321, test_f1: 0.4499
 epoch: 80, train_loss: 1.0293, test_loss: 1.0363, test_f1: 0.4414
 epoch: 81, train_loss: 1.0380, test_loss: 1.0358, test_f1: 0.4410
 epoch: 82, train_loss: 1.0303, test_loss: 1.0291, test_f1: 0.4445
 epoch: 83, train_loss: 1.0335, test_loss: 1.0288, test_f1: 0.4403
 epoch: 84, train_loss: 1.0354, test_loss: 1.0295, test_f1: 0.4441
 epoch: 85, train_loss: 1.0278, test_loss: 1.0281, test_f1: 0.4388
 epoch: 86, train_loss: 1.0219, test_loss: 1.0276, test_f1: 0.4405
 epoch: 87, train_loss: 1.0317, test_loss: 1.0277, test_f1: 0.4454
 epoch: 88, train_loss: 1.0263, test_loss: 1.0287, test_f1: 0.4388
 epoch: 89, train_loss: 1.0185, test_loss: 1.0291, test_f1: 0.4468
 epoch: 90, train_loss: 1.0151, test_loss: 1.0250, test_f1: 0.4391
 epoch: 91, train_loss: 1.0191, test_loss: 1.0245, test_f1: 0.4467
 epoch: 92, train_loss: 1.0223, test_loss: 1.0235, test_f1: 0.4466
 epoch: 93, train_loss: 1.0291, test_loss: 1.0216, test_f1: 0.4452
 epoch: 94, train_loss: 1.0131, test_loss: 1.0275, test_f1: 0.4460
 epoch: 95, train_loss: 1.0124, test_loss: 1.0193, test_f1: 0.4483
 epoch: 96, train_loss: 1.0097, test_loss: 1.0175, test_f1: 0.4481
 epoch: 97, train_loss: 1.0159, test_loss: 1.0182, test_f1: 0.4557
 epoch: 98, train_loss: 1.0032, test_loss: 1.0165, test_f1: 0.4453
 epoch: 99, train_loss: 1.0196, test_loss: 1.0116, test_f1: 0.4576
##################ITERATION #8 ****************************************
 epoch: 0, train_loss: 1.3696, test_loss: 1.3350, test_f1: 0.2274
 epoch: 1, train_loss: 1.3116, test_loss: 1.2948, test_f1: 0.2328
 epoch: 2, train_loss: 1.2937, test_loss: 1.2820, test_f1: 0.2612
 epoch: 3, train_loss: 1.2843, test_loss: 1.2706, test_f1: 0.2717
 epoch: 4, train_loss: 1.2707, test_loss: 1.2575, test_f1: 0.2838
 epoch: 5, train_loss: 1.2680, test_loss: 1.2525, test_f1: 0.2936
 epoch: 6, train_loss: 1.2576, test_loss: 1.2432, test_f1: 0.2894
 epoch: 7, train_loss: 1.2461, test_loss: 1.2339, test_f1: 0.2973
 epoch: 8, train_loss: 1.2443, test_loss: 1.2252, test_f1: 0.3296
 epoch: 9, train_loss: 1.2430, test_loss: 1.2235, test_f1: 0.3499
 epoch: 10, train_loss: 1.2357, test_loss: 1.2163, test_f1: 0.3536
 epoch: 11, train_loss: 1.2407, test_loss: 1.2052, test_f1: 0.3717
 epoch: 12, train_loss: 1.2221, test_loss: 1.2065, test_f1: 0.3775
 epoch: 13, train_loss: 1.2319, test_loss: 1.2033, test_f1: 0.3673
 epoch: 14, train_loss: 1.2203, test_loss: 1.1949, test_f1: 0.3839
 epoch: 15, train_loss: 1.2104, test_loss: 1.1937, test_f1: 0.3824
 epoch: 16, train_loss: 1.2164, test_loss: 1.1911, test_f1: 0.3694
 epoch: 17, train_loss: 1.2077, test_loss: 1.1864, test_f1: 0.3804
 epoch: 18, train_loss: 1.2057, test_loss: 1.1848, test_f1: 0.3972
 epoch: 19, train_loss: 1.2002, test_loss: 1.1805, test_f1: 0.4103
 epoch: 20, train_loss: 1.2025, test_loss: 1.1738, test_f1: 0.4242
 epoch: 21, train_loss: 1.1993, test_loss: 1.1716, test_f1: 0.4364
 epoch: 22, train_loss: 1.1976, test_loss: 1.1708, test_f1: 0.4093
 epoch: 23, train_loss: 1.1916, test_loss: 1.1704, test_f1: 0.4177
 epoch: 24, train_loss: 1.1821, test_loss: 1.1683, test_f1: 0.4241
 epoch: 25, train_loss: 1.1835, test_loss: 1.1633, test_f1: 0.4258
 epoch: 26, train_loss: 1.1802, test_loss: 1.1579, test_f1: 0.4287
 epoch: 27, train_loss: 1.1778, test_loss: 1.1543, test_f1: 0.4310
 epoch: 28, train_loss: 1.1730, test_loss: 1.1544, test_f1: 0.4265
 epoch: 29, train_loss: 1.1721, test_loss: 1.1488, test_f1: 0.4419
 epoch: 30, train_loss: 1.1696, test_loss: 1.1459, test_f1: 0.4394
 epoch: 31, train_loss: 1.1641, test_loss: 1.1459, test_f1: 0.4281
 epoch: 32, train_loss: 1.1631, test_loss: 1.1441, test_f1: 0.4292
 epoch: 33, train_loss: 1.1579, test_loss: 1.1408, test_f1: 0.4321
 epoch: 34, train_loss: 1.1609, test_loss: 1.1424, test_f1: 0.4196
 epoch: 35, train_loss: 1.1585, test_loss: 1.1390, test_f1: 0.4278
 epoch: 36, train_loss: 1.1502, test_loss: 1.1352, test_f1: 0.4209
 epoch: 37, train_loss: 1.1406, test_loss: 1.1339, test_f1: 0.4337
 epoch: 38, train_loss: 1.1465, test_loss: 1.1348, test_f1: 0.4219
 epoch: 39, train_loss: 1.1438, test_loss: 1.1307, test_f1: 0.4234
 epoch: 40, train_loss: 1.1468, test_loss: 1.1302, test_f1: 0.4205
 epoch: 41, train_loss: 1.1325, test_loss: 1.1266, test_f1: 0.4249
 epoch: 42, train_loss: 1.1440, test_loss: 1.1284, test_f1: 0.4191
 epoch: 43, train_loss: 1.1341, test_loss: 1.1259, test_f1: 0.4242
 epoch: 44, train_loss: 1.1317, test_loss: 1.1269, test_f1: 0.4247
 epoch: 45, train_loss: 1.1240, test_loss: 1.1237, test_f1: 0.4310
 epoch: 46, train_loss: 1.1236, test_loss: 1.1251, test_f1: 0.4226
 epoch: 47, train_loss: 1.1342, test_loss: 1.1205, test_f1: 0.4293
 epoch: 48, train_loss: 1.1231, test_loss: 1.1219, test_f1: 0.4268
 epoch: 49, train_loss: 1.1221, test_loss: 1.1203, test_f1: 0.4179
 epoch: 50, train_loss: 1.1093, test_loss: 1.1209, test_f1: 0.4254
 epoch: 51, train_loss: 1.1118, test_loss: 1.1196, test_f1: 0.4288
 epoch: 52, train_loss: 1.1101, test_loss: 1.1176, test_f1: 0.4250
 epoch: 53, train_loss: 1.1143, test_loss: 1.1174, test_f1: 0.4260
 epoch: 54, train_loss: 1.1101, test_loss: 1.1164, test_f1: 0.4239
 epoch: 55, train_loss: 1.1031, test_loss: 1.1111, test_f1: 0.4298
 epoch: 56, train_loss: 1.1005, test_loss: 1.1126, test_f1: 0.4231
 epoch: 57, train_loss: 1.1011, test_loss: 1.1138, test_f1: 0.4273
 epoch: 58, train_loss: 1.1038, test_loss: 1.1096, test_f1: 0.4319
 epoch: 59, train_loss: 1.0909, test_loss: 1.1101, test_f1: 0.4328
 epoch: 60, train_loss: 1.0983, test_loss: 1.1095, test_f1: 0.4313
 epoch: 61, train_loss: 1.0974, test_loss: 1.1105, test_f1: 0.4388
 epoch: 62, train_loss: 1.1067, test_loss: 1.1048, test_f1: 0.4291
 epoch: 63, train_loss: 1.0942, test_loss: 1.1078, test_f1: 0.4334
 epoch: 64, train_loss: 1.0906, test_loss: 1.1089, test_f1: 0.4343
 epoch: 65, train_loss: 1.0969, test_loss: 1.1078, test_f1: 0.4403
 epoch: 66, train_loss: 1.1033, test_loss: 1.1082, test_f1: 0.4325
 epoch: 67, train_loss: 1.1006, test_loss: 1.1076, test_f1: 0.4387
 epoch: 68, train_loss: 1.0936, test_loss: 1.1054, test_f1: 0.4395
 epoch: 69, train_loss: 1.0914, test_loss: 1.1056, test_f1: 0.4421
 epoch: 70, train_loss: 1.0886, test_loss: 1.1072, test_f1: 0.4388
 epoch: 71, train_loss: 1.0869, test_loss: 1.1086, test_f1: 0.4405
 epoch: 72, train_loss: 1.0856, test_loss: 1.1051, test_f1: 0.4411
 epoch: 73, train_loss: 1.0850, test_loss: 1.1023, test_f1: 0.4433
 epoch: 74, train_loss: 1.0768, test_loss: 1.1005, test_f1: 0.4389
 epoch: 75, train_loss: 1.0842, test_loss: 1.1030, test_f1: 0.4421
 epoch: 76, train_loss: 1.0822, test_loss: 1.1109, test_f1: 0.4417
 epoch: 77, train_loss: 1.0827, test_loss: 1.1089, test_f1: 0.4376
 epoch: 78, train_loss: 1.0772, test_loss: 1.1076, test_f1: 0.4361
 epoch: 79, train_loss: 1.0771, test_loss: 1.1066, test_f1: 0.4511
 epoch: 80, train_loss: 1.0794, test_loss: 1.1015, test_f1: 0.4445
 epoch: 81, train_loss: 1.0722, test_loss: 1.1044, test_f1: 0.4320
 epoch: 82, train_loss: 1.0664, test_loss: 1.1022, test_f1: 0.4488
 epoch: 83, train_loss: 1.0711, test_loss: 1.1013, test_f1: 0.4457
 epoch: 84, train_loss: 1.0683, test_loss: 1.1016, test_f1: 0.4363
 epoch: 85, train_loss: 1.0614, test_loss: 1.1043, test_f1: 0.4339
 epoch: 86, train_loss: 1.0619, test_loss: 1.1034, test_f1: 0.4412
 epoch: 87, train_loss: 1.0653, test_loss: 1.1000, test_f1: 0.4332
 epoch: 88, train_loss: 1.0622, test_loss: 1.0988, test_f1: 0.4477
 epoch: 89, train_loss: 1.0609, test_loss: 1.1011, test_f1: 0.4470
 epoch: 90, train_loss: 1.0594, test_loss: 1.1039, test_f1: 0.4443
 epoch: 91, train_loss: 1.0607, test_loss: 1.1048, test_f1: 0.4425
 epoch: 92, train_loss: 1.0589, test_loss: 1.0990, test_f1: 0.4482
 epoch: 93, train_loss: 1.0634, test_loss: 1.0991, test_f1: 0.4504
 epoch: 94, train_loss: 1.0604, test_loss: 1.0950, test_f1: 0.4507
 epoch: 95, train_loss: 1.0640, test_loss: 1.0947, test_f1: 0.4585
 epoch: 96, train_loss: 1.0608, test_loss: 1.0974, test_f1: 0.4504
 epoch: 97, train_loss: 1.0524, test_loss: 1.0988, test_f1: 0.4490
 epoch: 98, train_loss: 1.0538, test_loss: 1.0987, test_f1: 0.4452
 epoch: 99, train_loss: 1.0535, test_loss: 1.0963, test_f1: 0.4445
##################ITERATION #9 ****************************************
 epoch: 0, train_loss: 1.3097, test_loss: 1.3119, test_f1: 0.2274
 epoch: 1, train_loss: 1.2782, test_loss: 1.2774, test_f1: 0.2300
 epoch: 2, train_loss: 1.2670, test_loss: 1.2498, test_f1: 0.2620
 epoch: 3, train_loss: 1.2617, test_loss: 1.2422, test_f1: 0.2924
 epoch: 4, train_loss: 1.2528, test_loss: 1.2341, test_f1: 0.3232
 epoch: 5, train_loss: 1.2462, test_loss: 1.2285, test_f1: 0.3383
 epoch: 6, train_loss: 1.2383, test_loss: 1.2226, test_f1: 0.3601
 epoch: 7, train_loss: 1.2420, test_loss: 1.2175, test_f1: 0.3652
 epoch: 8, train_loss: 1.2287, test_loss: 1.2105, test_f1: 0.3700
 epoch: 9, train_loss: 1.2332, test_loss: 1.2047, test_f1: 0.3745
 epoch: 10, train_loss: 1.2314, test_loss: 1.2014, test_f1: 0.3746
 epoch: 11, train_loss: 1.2187, test_loss: 1.1983, test_f1: 0.3776
 epoch: 12, train_loss: 1.2111, test_loss: 1.1901, test_f1: 0.3900
 epoch: 13, train_loss: 1.2076, test_loss: 1.1878, test_f1: 0.3937
 epoch: 14, train_loss: 1.2126, test_loss: 1.1824, test_f1: 0.3899
 epoch: 15, train_loss: 1.2030, test_loss: 1.1836, test_f1: 0.3850
 epoch: 16, train_loss: 1.2065, test_loss: 1.1788, test_f1: 0.3908
 epoch: 17, train_loss: 1.1928, test_loss: 1.1755, test_f1: 0.3929
 epoch: 18, train_loss: 1.1974, test_loss: 1.1732, test_f1: 0.3887
 epoch: 19, train_loss: 1.1989, test_loss: 1.1657, test_f1: 0.3899
 epoch: 20, train_loss: 1.1867, test_loss: 1.1621, test_f1: 0.3894
 epoch: 21, train_loss: 1.1843, test_loss: 1.1592, test_f1: 0.3931
 epoch: 22, train_loss: 1.1853, test_loss: 1.1548, test_f1: 0.3924
 epoch: 23, train_loss: 1.1827, test_loss: 1.1525, test_f1: 0.3948
 epoch: 24, train_loss: 1.1778, test_loss: 1.1544, test_f1: 0.4002
 epoch: 25, train_loss: 1.1777, test_loss: 1.1478, test_f1: 0.3969
 epoch: 26, train_loss: 1.1751, test_loss: 1.1457, test_f1: 0.4074
 epoch: 27, train_loss: 1.1694, test_loss: 1.1428, test_f1: 0.4028
 epoch: 28, train_loss: 1.1664, test_loss: 1.1378, test_f1: 0.3994
 epoch: 29, train_loss: 1.1667, test_loss: 1.1350, test_f1: 0.4034
 epoch: 30, train_loss: 1.1664, test_loss: 1.1343, test_f1: 0.4005
 epoch: 31, train_loss: 1.1622, test_loss: 1.1323, test_f1: 0.4113
 epoch: 32, train_loss: 1.1540, test_loss: 1.1298, test_f1: 0.4184
 epoch: 33, train_loss: 1.1547, test_loss: 1.1306, test_f1: 0.4109
 epoch: 34, train_loss: 1.1531, test_loss: 1.1255, test_f1: 0.4031
 epoch: 35, train_loss: 1.1494, test_loss: 1.1291, test_f1: 0.4134
 epoch: 36, train_loss: 1.1542, test_loss: 1.1202, test_f1: 0.4210
 epoch: 37, train_loss: 1.1461, test_loss: 1.1215, test_f1: 0.4259
 epoch: 38, train_loss: 1.1442, test_loss: 1.1257, test_f1: 0.4077
 epoch: 39, train_loss: 1.1411, test_loss: 1.1238, test_f1: 0.4041
 epoch: 40, train_loss: 1.1372, test_loss: 1.1226, test_f1: 0.4091
 epoch: 41, train_loss: 1.1348, test_loss: 1.1162, test_f1: 0.4116
 epoch: 42, train_loss: 1.1337, test_loss: 1.1118, test_f1: 0.4129
 epoch: 43, train_loss: 1.1344, test_loss: 1.0992, test_f1: 0.4138
 epoch: 44, train_loss: 1.1321, test_loss: 1.1106, test_f1: 0.4152
 epoch: 45, train_loss: 1.1233, test_loss: 1.1014, test_f1: 0.4191
 epoch: 46, train_loss: 1.1238, test_loss: 1.0976, test_f1: 0.4294
 epoch: 47, train_loss: 1.1279, test_loss: 1.1061, test_f1: 0.4240
 epoch: 48, train_loss: 1.1193, test_loss: 1.0959, test_f1: 0.4280
 epoch: 49, train_loss: 1.1189, test_loss: 1.0933, test_f1: 0.4276
 epoch: 50, train_loss: 1.1144, test_loss: 1.0998, test_f1: 0.4230
 epoch: 51, train_loss: 1.1092, test_loss: 1.0939, test_f1: 0.4272
 epoch: 52, train_loss: 1.1076, test_loss: 1.0940, test_f1: 0.4261
 epoch: 53, train_loss: 1.1077, test_loss: 1.0893, test_f1: 0.4311
 epoch: 54, train_loss: 1.1121, test_loss: 1.0917, test_f1: 0.4264
 epoch: 55, train_loss: 1.1066, test_loss: 1.0868, test_f1: 0.4304
 epoch: 56, train_loss: 1.1146, test_loss: 1.0865, test_f1: 0.4236
 epoch: 57, train_loss: 1.0989, test_loss: 1.0891, test_f1: 0.4292
 epoch: 58, train_loss: 1.1054, test_loss: 1.0886, test_f1: 0.4322
 epoch: 59, train_loss: 1.1121, test_loss: 1.0818, test_f1: 0.4385
 epoch: 60, train_loss: 1.1098, test_loss: 1.0814, test_f1: 0.4381
 epoch: 61, train_loss: 1.1035, test_loss: 1.0908, test_f1: 0.4303
 epoch: 62, train_loss: 1.0952, test_loss: 1.0767, test_f1: 0.4325
 epoch: 63, train_loss: 1.1016, test_loss: 1.0795, test_f1: 0.4300
 epoch: 64, train_loss: 1.0944, test_loss: 1.0695, test_f1: 0.4455
 epoch: 65, train_loss: 1.0951, test_loss: 1.0731, test_f1: 0.4357
 epoch: 66, train_loss: 1.0965, test_loss: 1.0765, test_f1: 0.4384
 epoch: 67, train_loss: 1.0920, test_loss: 1.0834, test_f1: 0.4221
 epoch: 68, train_loss: 1.0905, test_loss: 1.0776, test_f1: 0.4286
 epoch: 69, train_loss: 1.0921, test_loss: 1.0724, test_f1: 0.4344
 epoch: 70, train_loss: 1.0958, test_loss: 1.0681, test_f1: 0.4354
 epoch: 71, train_loss: 1.0956, test_loss: 1.0802, test_f1: 0.4321
 epoch: 72, train_loss: 1.0967, test_loss: 1.0763, test_f1: 0.4230
 epoch: 73, train_loss: 1.0942, test_loss: 1.0786, test_f1: 0.4274
 epoch: 74, train_loss: 1.0881, test_loss: 1.0752, test_f1: 0.4293
 epoch: 75, train_loss: 1.0911, test_loss: 1.0751, test_f1: 0.4284
 epoch: 76, train_loss: 1.0772, test_loss: 1.0717, test_f1: 0.4332
 epoch: 77, train_loss: 1.0851, test_loss: 1.0717, test_f1: 0.4288
 epoch: 78, train_loss: 1.0866, test_loss: 1.0700, test_f1: 0.4268
 epoch: 79, train_loss: 1.0741, test_loss: 1.0725, test_f1: 0.4239
 epoch: 80, train_loss: 1.0728, test_loss: 1.0767, test_f1: 0.4163
 epoch: 81, train_loss: 1.0841, test_loss: 1.0667, test_f1: 0.4260
 epoch: 82, train_loss: 1.0795, test_loss: 1.0608, test_f1: 0.4287
 epoch: 83, train_loss: 1.0807, test_loss: 1.0666, test_f1: 0.4152
 epoch: 84, train_loss: 1.0809, test_loss: 1.0658, test_f1: 0.4247
 epoch: 85, train_loss: 1.0665, test_loss: 1.0707, test_f1: 0.4165
 epoch: 86, train_loss: 1.0773, test_loss: 1.0657, test_f1: 0.4226
 epoch: 87, train_loss: 1.0770, test_loss: 1.0568, test_f1: 0.4322
 epoch: 88, train_loss: 1.0743, test_loss: 1.0644, test_f1: 0.4256
 epoch: 89, train_loss: 1.0682, test_loss: 1.0739, test_f1: 0.4151
 epoch: 90, train_loss: 1.0736, test_loss: 1.0679, test_f1: 0.4169
 epoch: 91, train_loss: 1.0781, test_loss: 1.0552, test_f1: 0.4390
 epoch: 92, train_loss: 1.0729, test_loss: 1.0608, test_f1: 0.4272
 epoch: 93, train_loss: 1.0615, test_loss: 1.0606, test_f1: 0.4264
 epoch: 94, train_loss: 1.0571, test_loss: 1.0554, test_f1: 0.4309
 epoch: 95, train_loss: 1.0666, test_loss: 1.0541, test_f1: 0.4310
 epoch: 96, train_loss: 1.0553, test_loss: 1.0547, test_f1: 0.4379
 epoch: 97, train_loss: 1.0648, test_loss: 1.0651, test_f1: 0.4248
 epoch: 98, train_loss: 1.0568, test_loss: 1.0610, test_f1: 0.4296
 epoch: 99, train_loss: 1.0643, test_loss: 1.0587, test_f1: 0.4337

Training completed in 645.79 seconds
Best F1: 0.5047 at epoch 96
Mean F1 across iterations: 0.4673  0.0190
========================FINAL RESULTS================================
FEGIN weighted F1: 0.5047  0.0190
python main.py --data ltspice_examples --representation component_component --model FEGIN --layers 5 --hiddens 32 --batch_size 128 --lr 0.0001 --emb_size 512 --epochs 100 --save_appendix component_component_L5_H32_BS128_LR0.0001_E512 --no_val
-----



STDERR:
  File "main.py", line 370, in <module>
    main()
  File "main.py", line 254, in main
    dataset = dataset_class(
  File "/home/philip/projects/llm_inference_code_repo/Circuit-Completion-Using-GNNs/component_classification_with_link_prediction_head/evaluation/FEGIN/kernel/circuit_datasets.py", line 15, in __init__
    self.data, self.slices = torch.load(self.processed_paths[0])
  File "/home/philip/.local/lib/python3.8/site-packages/torch/serialization.py", line 1040, in load
    warnings.warn(
  File "/usr/lib/python3.8/warnings.py", line 109, in _showwarnmsg
    sw(msg.message, msg.category, msg.filename, msg.lineno,
  File "main.py", line 47, in warn_with_traceback
    traceback.print_stack(file=log)
/home/philip/projects/llm_inference_code_repo/Circuit-Completion-Using-GNNs/component_classification_with_link_prediction_head/evaluation/FEGIN/kernel/circuit_datasets.py:15: FutureWarning: You are using `torch.load` with `weights_only=False` (the current default value), which uses the default pickle module implicitly. It is possible to construct malicious pickle data which will execute arbitrary code during unpickling (See https://github.com/pytorch/pytorch/blob/main/SECURITY.md#untrusted-models for more details). In a future release, the default value for `weights_only` will be flipped to `True`. This limits the functions that could be executed during unpickling. Arbitrary objects will no longer be allowed to be loaded via this mode unless they are explicitly allowlisted by the user via `torch.serialization.add_safe_globals`. We recommend you start setting `weights_only=True` for any use case where you don't have full control of the loaded file. Please open an issue on GitHub for any issues related to this experimental feature.
  self.data, self.slices = torch.load(self.processed_paths[0])
