STDOUT:
Results will be saved in /home/philip/projects/ltspice_examples_code_repo/Circuit-Completion-Using-GNNs/component_classification_with_link_prediction_head/evaluation/FEGIN/results/model_FEGIN_dataset_ltspice_examples
Command line input: python main.py --data ltspice_examples --representation component_net --model FEGIN --layers 4 --hiddens 32 --batch_size 32 --lr 0.01 --emb_size 128 --epochs 100 --save_appendix component_net_L4_H32_BS32_LR0.01_E128 --no_val
 is saved.
-----
ltspice_examples - FEGIN
Using 4 layers, 32 hidden units, h = 2
Loading component_net representation dataset
ENTERED
Training FEGIN on component_net representation
Train: 3558, Test: 846
##################ITERATION #0 ****************************************
 epoch: 0, train_loss: 1.1851, test_loss: 1.1659, test_f1: 0.3165
 epoch: 1, train_loss: 1.0638, test_loss: 1.0128, test_f1: 0.4986
 epoch: 2, train_loss: 1.0155, test_loss: 1.0869, test_f1: 0.4452
 epoch: 3, train_loss: 1.0065, test_loss: 1.0380, test_f1: 0.4462
 epoch: 4, train_loss: 0.9891, test_loss: 0.9190, test_f1: 0.5349
 epoch: 5, train_loss: 0.9674, test_loss: 0.9645, test_f1: 0.4899
 epoch: 6, train_loss: 0.9896, test_loss: 0.9801, test_f1: 0.5141
 epoch: 7, train_loss: 0.9672, test_loss: 0.9758, test_f1: 0.4893
 epoch: 8, train_loss: 0.9452, test_loss: 0.9072, test_f1: 0.5564
 epoch: 9, train_loss: 0.9449, test_loss: 0.9634, test_f1: 0.4301
 epoch: 10, train_loss: 0.9455, test_loss: 1.0176, test_f1: 0.4777
 epoch: 11, train_loss: 0.9360, test_loss: 1.0429, test_f1: 0.4866
 epoch: 12, train_loss: 0.9376, test_loss: 0.9304, test_f1: 0.5447
 epoch: 13, train_loss: 0.9620, test_loss: 1.0061, test_f1: 0.4584
 epoch: 14, train_loss: 0.9427, test_loss: 0.9356, test_f1: 0.4940
 epoch: 15, train_loss: 0.9432, test_loss: 0.9899, test_f1: 0.5006
 epoch: 16, train_loss: 0.9230, test_loss: 0.9131, test_f1: 0.5325
 epoch: 17, train_loss: 0.9299, test_loss: 1.0376, test_f1: 0.5519
 epoch: 18, train_loss: 0.9252, test_loss: 0.9449, test_f1: 0.4960
 epoch: 19, train_loss: 0.9218, test_loss: 0.8883, test_f1: 0.5259
 epoch: 20, train_loss: 0.9079, test_loss: 0.9560, test_f1: 0.5062
 epoch: 21, train_loss: 0.8958, test_loss: 1.0208, test_f1: 0.4709
 epoch: 22, train_loss: 0.9023, test_loss: 0.9839, test_f1: 0.5129
 epoch: 23, train_loss: 0.8940, test_loss: 0.9004, test_f1: 0.4876
 epoch: 24, train_loss: 0.8956, test_loss: 0.9988, test_f1: 0.4907
 epoch: 25, train_loss: 0.9014, test_loss: 0.9496, test_f1: 0.5136
 epoch: 26, train_loss: 0.8880, test_loss: 0.9696, test_f1: 0.4872
 epoch: 27, train_loss: 0.8866, test_loss: 1.0685, test_f1: 0.5060
 epoch: 28, train_loss: 0.8942, test_loss: 1.0162, test_f1: 0.4697
 epoch: 29, train_loss: 0.8744, test_loss: 0.9037, test_f1: 0.5206
 epoch: 30, train_loss: 0.8894, test_loss: 0.9238, test_f1: 0.5257
 epoch: 31, train_loss: 0.8617, test_loss: 1.0566, test_f1: 0.5198
 epoch: 32, train_loss: 0.8658, test_loss: 0.9859, test_f1: 0.4828
 epoch: 33, train_loss: 0.8762, test_loss: 0.9460, test_f1: 0.5239
 epoch: 34, train_loss: 0.8562, test_loss: 0.9814, test_f1: 0.5480
 epoch: 35, train_loss: 0.8670, test_loss: 0.9964, test_f1: 0.5934
 epoch: 36, train_loss: 0.8710, test_loss: 1.0024, test_f1: 0.5554
 epoch: 37, train_loss: 0.8653, test_loss: 0.9545, test_f1: 0.5410
 epoch: 38, train_loss: 0.8549, test_loss: 0.9408, test_f1: 0.5343
 epoch: 39, train_loss: 0.8614, test_loss: 0.9385, test_f1: 0.5682
 epoch: 40, train_loss: 0.8593, test_loss: 0.9441, test_f1: 0.5354
 epoch: 41, train_loss: 0.8418, test_loss: 0.9656, test_f1: 0.5557
 epoch: 42, train_loss: 0.8540, test_loss: 0.9403, test_f1: 0.5689
 epoch: 43, train_loss: 0.8573, test_loss: 1.0112, test_f1: 0.5161
 epoch: 44, train_loss: 0.8433, test_loss: 0.9832, test_f1: 0.5253
 epoch: 45, train_loss: 0.8500, test_loss: 0.8976, test_f1: 0.5907
 epoch: 46, train_loss: 0.8549, test_loss: 0.9693, test_f1: 0.5625
 epoch: 47, train_loss: 0.8403, test_loss: 0.9931, test_f1: 0.4983
 epoch: 48, train_loss: 0.8421, test_loss: 0.9407, test_f1: 0.5365
 epoch: 49, train_loss: 0.8522, test_loss: 0.9817, test_f1: 0.5325
 epoch: 50, train_loss: 0.8379, test_loss: 1.0030, test_f1: 0.5559
 epoch: 51, train_loss: 0.8109, test_loss: 0.9727, test_f1: 0.5450
 epoch: 52, train_loss: 0.8109, test_loss: 0.9969, test_f1: 0.5735
 epoch: 53, train_loss: 0.7960, test_loss: 1.0136, test_f1: 0.5403
 epoch: 54, train_loss: 0.8015, test_loss: 0.9874, test_f1: 0.5529
 epoch: 55, train_loss: 0.8045, test_loss: 0.9933, test_f1: 0.5785
 epoch: 56, train_loss: 0.7915, test_loss: 0.9789, test_f1: 0.5764
 epoch: 57, train_loss: 0.8010, test_loss: 0.9500, test_f1: 0.6037
 epoch: 58, train_loss: 0.7889, test_loss: 0.9299, test_f1: 0.5755
 epoch: 59, train_loss: 0.7892, test_loss: 1.0054, test_f1: 0.5637
 epoch: 60, train_loss: 0.7874, test_loss: 0.9497, test_f1: 0.5859
 epoch: 61, train_loss: 0.7788, test_loss: 0.9532, test_f1: 0.5766
 epoch: 62, train_loss: 0.7818, test_loss: 0.9297, test_f1: 0.5788
 epoch: 63, train_loss: 0.7777, test_loss: 0.9558, test_f1: 0.5780
 epoch: 64, train_loss: 0.7787, test_loss: 0.9541, test_f1: 0.5894
 epoch: 65, train_loss: 0.7796, test_loss: 0.9485, test_f1: 0.5862
 epoch: 66, train_loss: 0.7888, test_loss: 1.0199, test_f1: 0.5833
 epoch: 67, train_loss: 0.7783, test_loss: 0.9908, test_f1: 0.5798
 epoch: 68, train_loss: 0.7728, test_loss: 0.9787, test_f1: 0.5847
 epoch: 69, train_loss: 0.7800, test_loss: 1.0515, test_f1: 0.5708
 epoch: 70, train_loss: 0.7707, test_loss: 1.0349, test_f1: 0.5791
 epoch: 71, train_loss: 0.7758, test_loss: 1.0253, test_f1: 0.5567
 epoch: 72, train_loss: 0.7753, test_loss: 1.0044, test_f1: 0.5694
 epoch: 73, train_loss: 0.7658, test_loss: 0.9735, test_f1: 0.5912
 epoch: 74, train_loss: 0.7517, test_loss: 1.1108, test_f1: 0.5731
 epoch: 75, train_loss: 0.7681, test_loss: 0.9754, test_f1: 0.5859
 epoch: 76, train_loss: 0.7621, test_loss: 1.0148, test_f1: 0.5721
 epoch: 77, train_loss: 0.7720, test_loss: 1.0105, test_f1: 0.5919
 epoch: 78, train_loss: 0.7581, test_loss: 1.0016, test_f1: 0.6270
 epoch: 79, train_loss: 0.7426, test_loss: 1.0888, test_f1: 0.6015
 epoch: 80, train_loss: 0.7687, test_loss: 0.9871, test_f1: 0.5991
 epoch: 81, train_loss: 0.7567, test_loss: 1.0079, test_f1: 0.5621
 epoch: 82, train_loss: 0.8064, test_loss: 0.9242, test_f1: 0.5756
 epoch: 83, train_loss: 0.7753, test_loss: 1.0462, test_f1: 0.5939
 epoch: 84, train_loss: 0.8232, test_loss: 0.9422, test_f1: 0.6181
 epoch: 85, train_loss: 0.7897, test_loss: 1.0298, test_f1: 0.5589
 epoch: 86, train_loss: 0.7828, test_loss: 1.0422, test_f1: 0.5770
 epoch: 87, train_loss: 0.7637, test_loss: 1.0590, test_f1: 0.5712
 epoch: 88, train_loss: 0.7558, test_loss: 1.0507, test_f1: 0.5901
 epoch: 89, train_loss: 0.7464, test_loss: 1.0921, test_f1: 0.5444
 epoch: 90, train_loss: 0.7597, test_loss: 1.0251, test_f1: 0.5939
 epoch: 91, train_loss: 0.7395, test_loss: 1.0550, test_f1: 0.6151
 epoch: 92, train_loss: 0.7409, test_loss: 1.0697, test_f1: 0.6012
 epoch: 93, train_loss: 0.7578, test_loss: 1.0237, test_f1: 0.5479
 epoch: 94, train_loss: 0.7377, test_loss: 0.9641, test_f1: 0.6145
 epoch: 95, train_loss: 0.7543, test_loss: 0.9482, test_f1: 0.5596
 epoch: 96, train_loss: 0.7360, test_loss: 1.0170, test_f1: 0.6151
 epoch: 97, train_loss: 0.7395, test_loss: 1.0062, test_f1: 0.5965
 epoch: 98, train_loss: 0.7514, test_loss: 0.9953, test_f1: 0.6151
 epoch: 99, train_loss: 0.7570, test_loss: 1.0149, test_f1: 0.6081
##################ITERATION #1 ****************************************
 epoch: 0, train_loss: 1.1472, test_loss: 1.0811, test_f1: 0.4217
 epoch: 1, train_loss: 1.0299, test_loss: 0.9885, test_f1: 0.4147
 epoch: 2, train_loss: 1.0056, test_loss: 0.9965, test_f1: 0.4493
 epoch: 3, train_loss: 0.9810, test_loss: 1.0449, test_f1: 0.5102
 epoch: 4, train_loss: 0.9791, test_loss: 0.9901, test_f1: 0.4697
 epoch: 5, train_loss: 0.9552, test_loss: 0.9685, test_f1: 0.4709
 epoch: 6, train_loss: 0.9560, test_loss: 0.9707, test_f1: 0.4917
 epoch: 7, train_loss: 0.9435, test_loss: 0.9917, test_f1: 0.4761
 epoch: 8, train_loss: 0.9547, test_loss: 0.9112, test_f1: 0.4482
 epoch: 9, train_loss: 0.9403, test_loss: 1.0819, test_f1: 0.4201
 epoch: 10, train_loss: 0.9292, test_loss: 0.9232, test_f1: 0.4946
 epoch: 11, train_loss: 0.9143, test_loss: 0.9614, test_f1: 0.4720
 epoch: 12, train_loss: 0.9162, test_loss: 0.9156, test_f1: 0.5294
 epoch: 13, train_loss: 0.9181, test_loss: 1.0107, test_f1: 0.4966
 epoch: 14, train_loss: 0.9118, test_loss: 0.9934, test_f1: 0.5216
 epoch: 15, train_loss: 0.9166, test_loss: 0.9540, test_f1: 0.4958
 epoch: 16, train_loss: 0.9214, test_loss: 0.9038, test_f1: 0.5187
 epoch: 17, train_loss: 0.8904, test_loss: 0.9426, test_f1: 0.5241
 epoch: 18, train_loss: 0.8911, test_loss: 0.9303, test_f1: 0.5003
 epoch: 19, train_loss: 0.8899, test_loss: 0.8821, test_f1: 0.5140
 epoch: 20, train_loss: 0.8993, test_loss: 1.0763, test_f1: 0.4846
 epoch: 21, train_loss: 0.9142, test_loss: 0.9606, test_f1: 0.4911
 epoch: 22, train_loss: 0.8695, test_loss: 0.8634, test_f1: 0.5476
 epoch: 23, train_loss: 0.8709, test_loss: 0.9260, test_f1: 0.5304
 epoch: 24, train_loss: 0.8771, test_loss: 0.8740, test_f1: 0.5763
 epoch: 25, train_loss: 0.8701, test_loss: 0.9061, test_f1: 0.5704
 epoch: 26, train_loss: 0.8637, test_loss: 0.9289, test_f1: 0.5232
 epoch: 27, train_loss: 0.8641, test_loss: 0.9364, test_f1: 0.5236
 epoch: 28, train_loss: 0.8479, test_loss: 0.9679, test_f1: 0.5588
 epoch: 29, train_loss: 0.8599, test_loss: 0.9139, test_f1: 0.5233
 epoch: 30, train_loss: 0.8476, test_loss: 0.8817, test_f1: 0.5799
 epoch: 31, train_loss: 0.8390, test_loss: 0.9760, test_f1: 0.5360
 epoch: 32, train_loss: 0.8373, test_loss: 1.0195, test_f1: 0.5097
 epoch: 33, train_loss: 0.8576, test_loss: 0.9106, test_f1: 0.5971
 epoch: 34, train_loss: 0.8556, test_loss: 0.9905, test_f1: 0.5365
 epoch: 35, train_loss: 0.8515, test_loss: 0.9348, test_f1: 0.5512
 epoch: 36, train_loss: 0.8365, test_loss: 0.9353, test_f1: 0.5671
 epoch: 37, train_loss: 0.8283, test_loss: 0.9037, test_f1: 0.5646
 epoch: 38, train_loss: 0.8152, test_loss: 0.9495, test_f1: 0.5910
 epoch: 39, train_loss: 0.8421, test_loss: 0.8882, test_f1: 0.5890
 epoch: 40, train_loss: 0.8198, test_loss: 0.9784, test_f1: 0.5569
 epoch: 41, train_loss: 0.8129, test_loss: 0.9190, test_f1: 0.5672
 epoch: 42, train_loss: 0.8290, test_loss: 0.9123, test_f1: 0.5495
 epoch: 43, train_loss: 0.8040, test_loss: 0.9316, test_f1: 0.5332
 epoch: 44, train_loss: 0.7970, test_loss: 0.9587, test_f1: 0.5844
 epoch: 45, train_loss: 0.8142, test_loss: 0.8317, test_f1: 0.5573
 epoch: 46, train_loss: 0.8086, test_loss: 0.9189, test_f1: 0.5454
 epoch: 47, train_loss: 0.8049, test_loss: 0.9678, test_f1: 0.5321
 epoch: 48, train_loss: 0.8175, test_loss: 0.9086, test_f1: 0.5753
 epoch: 49, train_loss: 0.8070, test_loss: 0.9172, test_f1: 0.6009
 epoch: 50, train_loss: 0.7947, test_loss: 0.9602, test_f1: 0.5713
 epoch: 51, train_loss: 0.7786, test_loss: 0.9993, test_f1: 0.6126
 epoch: 52, train_loss: 0.7634, test_loss: 0.9841, test_f1: 0.6136
 epoch: 53, train_loss: 0.7583, test_loss: 1.0408, test_f1: 0.6168
 epoch: 54, train_loss: 0.7659, test_loss: 0.9375, test_f1: 0.5982
 epoch: 55, train_loss: 0.7618, test_loss: 0.9496, test_f1: 0.6329
 epoch: 56, train_loss: 0.7502, test_loss: 0.9801, test_f1: 0.5897
 epoch: 57, train_loss: 0.7519, test_loss: 1.0249, test_f1: 0.6082
 epoch: 58, train_loss: 0.7381, test_loss: 1.0023, test_f1: 0.6129
 epoch: 59, train_loss: 0.7585, test_loss: 0.9649, test_f1: 0.5932
 epoch: 60, train_loss: 0.7301, test_loss: 0.9946, test_f1: 0.5900
 epoch: 61, train_loss: 0.7422, test_loss: 1.0168, test_f1: 0.6448
 epoch: 62, train_loss: 0.7398, test_loss: 1.0114, test_f1: 0.5819
 epoch: 63, train_loss: 0.7285, test_loss: 1.0032, test_f1: 0.6105
 epoch: 64, train_loss: 0.7246, test_loss: 0.9890, test_f1: 0.6154
 epoch: 65, train_loss: 0.7259, test_loss: 1.0925, test_f1: 0.6092
 epoch: 66, train_loss: 0.7163, test_loss: 0.9897, test_f1: 0.6083
 epoch: 67, train_loss: 0.7187, test_loss: 0.9916, test_f1: 0.5945
 epoch: 68, train_loss: 0.7333, test_loss: 0.9961, test_f1: 0.6328
 epoch: 69, train_loss: 0.7229, test_loss: 0.9827, test_f1: 0.5830
 epoch: 70, train_loss: 0.7265, test_loss: 1.0010, test_f1: 0.6027
 epoch: 71, train_loss: 0.7650, test_loss: 0.9864, test_f1: 0.6534
 epoch: 72, train_loss: 0.7301, test_loss: 1.0726, test_f1: 0.5594
 epoch: 73, train_loss: 0.7213, test_loss: 1.0019, test_f1: 0.6579
 epoch: 74, train_loss: 0.7155, test_loss: 1.0362, test_f1: 0.6309
 epoch: 75, train_loss: 0.7144, test_loss: 1.0335, test_f1: 0.6197
 epoch: 76, train_loss: 0.6975, test_loss: 1.0586, test_f1: 0.5998
 epoch: 77, train_loss: 0.7165, test_loss: 1.0251, test_f1: 0.6185
 epoch: 78, train_loss: 0.7078, test_loss: 1.0871, test_f1: 0.6126
 epoch: 79, train_loss: 0.7288, test_loss: 1.0526, test_f1: 0.6451
 epoch: 80, train_loss: 0.7211, test_loss: 1.0846, test_f1: 0.6016
 epoch: 81, train_loss: 0.6953, test_loss: 1.0475, test_f1: 0.5997
 epoch: 82, train_loss: 0.7062, test_loss: 1.0877, test_f1: 0.5948
 epoch: 83, train_loss: 0.6922, test_loss: 1.0738, test_f1: 0.5527
 epoch: 84, train_loss: 0.6976, test_loss: 1.0598, test_f1: 0.6149
 epoch: 85, train_loss: 0.6890, test_loss: 1.0421, test_f1: 0.6073
 epoch: 86, train_loss: 0.6992, test_loss: 0.9931, test_f1: 0.6271
 epoch: 87, train_loss: 0.7079, test_loss: 0.9762, test_f1: 0.6138
 epoch: 88, train_loss: 0.6901, test_loss: 1.0473, test_f1: 0.6464
 epoch: 89, train_loss: 0.6891, test_loss: 1.1130, test_f1: 0.5866
 epoch: 90, train_loss: 0.6961, test_loss: 1.1305, test_f1: 0.6448
 epoch: 91, train_loss: 0.6994, test_loss: 1.0484, test_f1: 0.5988
 epoch: 92, train_loss: 0.6886, test_loss: 1.0892, test_f1: 0.6464
 epoch: 93, train_loss: 0.6938, test_loss: 1.1478, test_f1: 0.6609
 epoch: 94, train_loss: 0.7525, test_loss: 1.0735, test_f1: 0.6327
 epoch: 95, train_loss: 0.7107, test_loss: 0.9989, test_f1: 0.6389
 epoch: 96, train_loss: 0.6891, test_loss: 0.9168, test_f1: 0.6413
 epoch: 97, train_loss: 0.6838, test_loss: 1.0049, test_f1: 0.6400
 epoch: 98, train_loss: 0.6796, test_loss: 1.0140, test_f1: 0.6170
 epoch: 99, train_loss: 0.6938, test_loss: 0.9116, test_f1: 0.6403
##################ITERATION #2 ****************************************
 epoch: 0, train_loss: 1.1672, test_loss: 1.0902, test_f1: 0.3596
 epoch: 1, train_loss: 1.0780, test_loss: 1.0470, test_f1: 0.3471
 epoch: 2, train_loss: 1.0601, test_loss: 1.0876, test_f1: 0.4365
 epoch: 3, train_loss: 1.0190, test_loss: 0.9725, test_f1: 0.4727
 epoch: 4, train_loss: 0.9994, test_loss: 1.0473, test_f1: 0.4994
 epoch: 5, train_loss: 1.0045, test_loss: 0.9724, test_f1: 0.4722
 epoch: 6, train_loss: 0.9754, test_loss: 0.9840, test_f1: 0.4888
 epoch: 7, train_loss: 0.9701, test_loss: 0.9982, test_f1: 0.4280
 epoch: 8, train_loss: 0.9687, test_loss: 0.9655, test_f1: 0.4636
 epoch: 9, train_loss: 0.9619, test_loss: 1.0189, test_f1: 0.4960
 epoch: 10, train_loss: 0.9704, test_loss: 1.0564, test_f1: 0.4913
 epoch: 11, train_loss: 0.9570, test_loss: 0.9984, test_f1: 0.5027
 epoch: 12, train_loss: 0.9313, test_loss: 0.9670, test_f1: 0.5013
 epoch: 13, train_loss: 0.9408, test_loss: 0.9936, test_f1: 0.4794
 epoch: 14, train_loss: 0.9289, test_loss: 0.9841, test_f1: 0.4843
 epoch: 15, train_loss: 0.9446, test_loss: 0.9830, test_f1: 0.4907
 epoch: 16, train_loss: 0.9285, test_loss: 0.9701, test_f1: 0.5017
 epoch: 17, train_loss: 0.9260, test_loss: 1.0013, test_f1: 0.5052
 epoch: 18, train_loss: 0.9048, test_loss: 0.9851, test_f1: 0.4950
 epoch: 19, train_loss: 0.9154, test_loss: 0.9672, test_f1: 0.5035
 epoch: 20, train_loss: 0.9018, test_loss: 0.9713, test_f1: 0.5205
 epoch: 21, train_loss: 0.8994, test_loss: 0.9549, test_f1: 0.4890
 epoch: 22, train_loss: 0.8999, test_loss: 0.9652, test_f1: 0.5027
 epoch: 23, train_loss: 0.9005, test_loss: 1.0014, test_f1: 0.5059
 epoch: 24, train_loss: 0.8982, test_loss: 0.9103, test_f1: 0.4839
 epoch: 25, train_loss: 0.8895, test_loss: 0.9569, test_f1: 0.5155
 epoch: 26, train_loss: 0.8836, test_loss: 0.9712, test_f1: 0.5200
 epoch: 27, train_loss: 0.8900, test_loss: 0.9176, test_f1: 0.5610
 epoch: 28, train_loss: 0.9042, test_loss: 0.9801, test_f1: 0.4941
 epoch: 29, train_loss: 0.8884, test_loss: 0.9216, test_f1: 0.5461
 epoch: 30, train_loss: 0.9368, test_loss: 0.9982, test_f1: 0.5022
 epoch: 31, train_loss: 0.9241, test_loss: 0.9593, test_f1: 0.4998
 epoch: 32, train_loss: 0.9341, test_loss: 0.9607, test_f1: 0.5166
 epoch: 33, train_loss: 0.9007, test_loss: 0.9358, test_f1: 0.5426
 epoch: 34, train_loss: 0.8854, test_loss: 0.8934, test_f1: 0.5497
 epoch: 35, train_loss: 0.8771, test_loss: 0.8468, test_f1: 0.5139
 epoch: 36, train_loss: 0.8693, test_loss: 0.8646, test_f1: 0.5550
 epoch: 37, train_loss: 0.8498, test_loss: 0.9278, test_f1: 0.5074
 epoch: 38, train_loss: 0.8548, test_loss: 0.9665, test_f1: 0.5127
 epoch: 39, train_loss: 0.8640, test_loss: 0.9334, test_f1: 0.5068
 epoch: 40, train_loss: 0.8627, test_loss: 0.8332, test_f1: 0.5238
 epoch: 41, train_loss: 0.8500, test_loss: 0.9457, test_f1: 0.5299
 epoch: 42, train_loss: 0.8614, test_loss: 0.9393, test_f1: 0.5630
 epoch: 43, train_loss: 0.8545, test_loss: 0.9639, test_f1: 0.5363
 epoch: 44, train_loss: 0.8465, test_loss: 0.9761, test_f1: 0.5370
 epoch: 45, train_loss: 0.8459, test_loss: 0.9345, test_f1: 0.5164
 epoch: 46, train_loss: 0.8550, test_loss: 0.9386, test_f1: 0.5039
 epoch: 47, train_loss: 0.8415, test_loss: 0.8975, test_f1: 0.5782
 epoch: 48, train_loss: 0.8307, test_loss: 0.9533, test_f1: 0.5994
 epoch: 49, train_loss: 0.8376, test_loss: 0.9328, test_f1: 0.5464
 epoch: 50, train_loss: 0.8393, test_loss: 0.8960, test_f1: 0.5366
 epoch: 51, train_loss: 0.8193, test_loss: 0.8797, test_f1: 0.5636
 epoch: 52, train_loss: 0.8021, test_loss: 0.8697, test_f1: 0.5819
 epoch: 53, train_loss: 0.7904, test_loss: 0.9106, test_f1: 0.5967
 epoch: 54, train_loss: 0.8072, test_loss: 0.8779, test_f1: 0.5379
 epoch: 55, train_loss: 0.7997, test_loss: 0.8795, test_f1: 0.5520
 epoch: 56, train_loss: 0.7889, test_loss: 0.8612, test_f1: 0.6061
 epoch: 57, train_loss: 0.7944, test_loss: 0.9007, test_f1: 0.5703
 epoch: 58, train_loss: 0.7940, test_loss: 0.8939, test_f1: 0.5882
 epoch: 59, train_loss: 0.7865, test_loss: 0.8590, test_f1: 0.5627
 epoch: 60, train_loss: 0.7884, test_loss: 0.8460, test_f1: 0.5773
 epoch: 61, train_loss: 0.7881, test_loss: 0.8891, test_f1: 0.5789
 epoch: 62, train_loss: 0.7898, test_loss: 0.8557, test_f1: 0.5146
 epoch: 63, train_loss: 0.7778, test_loss: 0.8833, test_f1: 0.5851
 epoch: 64, train_loss: 0.7663, test_loss: 0.8974, test_f1: 0.5925
 epoch: 65, train_loss: 0.7644, test_loss: 0.9444, test_f1: 0.5974
 epoch: 66, train_loss: 0.7796, test_loss: 0.8721, test_f1: 0.5537
 epoch: 67, train_loss: 0.7737, test_loss: 0.9019, test_f1: 0.5585
 epoch: 68, train_loss: 0.7646, test_loss: 0.9097, test_f1: 0.6060
 epoch: 69, train_loss: 0.7625, test_loss: 0.9084, test_f1: 0.5958
 epoch: 70, train_loss: 0.7665, test_loss: 0.9055, test_f1: 0.6127
 epoch: 71, train_loss: 0.7554, test_loss: 0.9125, test_f1: 0.5617
 epoch: 72, train_loss: 0.7733, test_loss: 0.9063, test_f1: 0.5856
 epoch: 73, train_loss: 0.7700, test_loss: 0.8771, test_f1: 0.6140
 epoch: 74, train_loss: 0.7550, test_loss: 0.8694, test_f1: 0.6123
 epoch: 75, train_loss: 0.7722, test_loss: 0.8856, test_f1: 0.5636
 epoch: 76, train_loss: 0.7628, test_loss: 0.8771, test_f1: 0.6080
 epoch: 77, train_loss: 0.7585, test_loss: 0.8593, test_f1: 0.6255
 epoch: 78, train_loss: 0.7577, test_loss: 0.9379, test_f1: 0.5944
 epoch: 79, train_loss: 0.7567, test_loss: 0.8830, test_f1: 0.5967
 epoch: 80, train_loss: 0.7421, test_loss: 0.8646, test_f1: 0.5648
 epoch: 81, train_loss: 0.7381, test_loss: 0.9686, test_f1: 0.6273
 epoch: 82, train_loss: 0.7355, test_loss: 0.9316, test_f1: 0.6138
 epoch: 83, train_loss: 0.7465, test_loss: 0.9179, test_f1: 0.6212
 epoch: 84, train_loss: 0.7550, test_loss: 0.8751, test_f1: 0.6389
 epoch: 85, train_loss: 0.7821, test_loss: 0.9052, test_f1: 0.6415
 epoch: 86, train_loss: 0.7532, test_loss: 0.9101, test_f1: 0.5994
 epoch: 87, train_loss: 0.7426, test_loss: 0.9278, test_f1: 0.5947
 epoch: 88, train_loss: 0.7615, test_loss: 0.9486, test_f1: 0.6018
 epoch: 89, train_loss: 0.7449, test_loss: 0.8927, test_f1: 0.5766
 epoch: 90, train_loss: 0.7494, test_loss: 0.8908, test_f1: 0.6390
 epoch: 91, train_loss: 0.7508, test_loss: 0.9882, test_f1: 0.6048
 epoch: 92, train_loss: 0.7414, test_loss: 0.8980, test_f1: 0.5941
 epoch: 93, train_loss: 0.7477, test_loss: 1.0257, test_f1: 0.5987
 epoch: 94, train_loss: 0.7465, test_loss: 0.8903, test_f1: 0.5685
 epoch: 95, train_loss: 0.7260, test_loss: 0.8887, test_f1: 0.5958
 epoch: 96, train_loss: 0.7295, test_loss: 0.9526, test_f1: 0.5989
 epoch: 97, train_loss: 0.7256, test_loss: 0.9436, test_f1: 0.6309
 epoch: 98, train_loss: 0.7397, test_loss: 0.9814, test_f1: 0.5866
 epoch: 99, train_loss: 0.7192, test_loss: 0.9068, test_f1: 0.6331
##################ITERATION #3 ****************************************
 epoch: 0, train_loss: 1.1437, test_loss: 1.0876, test_f1: 0.4257
 epoch: 1, train_loss: 1.0270, test_loss: 1.0216, test_f1: 0.4416
 epoch: 2, train_loss: 1.0004, test_loss: 1.0135, test_f1: 0.4753
 epoch: 3, train_loss: 0.9875, test_loss: 1.0382, test_f1: 0.4860
 epoch: 4, train_loss: 0.9802, test_loss: 1.1276, test_f1: 0.4308
 epoch: 5, train_loss: 0.9728, test_loss: 1.0039, test_f1: 0.4454
 epoch: 6, train_loss: 0.9514, test_loss: 0.9755, test_f1: 0.4924
 epoch: 7, train_loss: 0.9395, test_loss: 1.0175, test_f1: 0.4730
 epoch: 8, train_loss: 0.9570, test_loss: 0.9889, test_f1: 0.4790
 epoch: 9, train_loss: 0.9356, test_loss: 0.9889, test_f1: 0.5061
 epoch: 10, train_loss: 0.9265, test_loss: 0.9317, test_f1: 0.5072
 epoch: 11, train_loss: 0.9094, test_loss: 0.9501, test_f1: 0.5485
 epoch: 12, train_loss: 0.9186, test_loss: 0.9392, test_f1: 0.5399
 epoch: 13, train_loss: 0.9197, test_loss: 0.8814, test_f1: 0.5081
 epoch: 14, train_loss: 0.9027, test_loss: 0.9221, test_f1: 0.5182
 epoch: 15, train_loss: 0.9164, test_loss: 0.9402, test_f1: 0.5349
 epoch: 16, train_loss: 0.9020, test_loss: 0.9924, test_f1: 0.5370
 epoch: 17, train_loss: 0.8960, test_loss: 0.8763, test_f1: 0.5279
 epoch: 18, train_loss: 0.8886, test_loss: 0.9983, test_f1: 0.5366
 epoch: 19, train_loss: 0.8997, test_loss: 0.9565, test_f1: 0.5538
 epoch: 20, train_loss: 0.8939, test_loss: 0.9305, test_f1: 0.5076
 epoch: 21, train_loss: 0.8723, test_loss: 0.9610, test_f1: 0.5233
 epoch: 22, train_loss: 0.8565, test_loss: 0.9851, test_f1: 0.5238
 epoch: 23, train_loss: 0.8755, test_loss: 0.9435, test_f1: 0.5291
 epoch: 24, train_loss: 0.8633, test_loss: 0.9904, test_f1: 0.5131
 epoch: 25, train_loss: 0.8662, test_loss: 0.9433, test_f1: 0.5391
 epoch: 26, train_loss: 0.8631, test_loss: 0.9056, test_f1: 0.5693
 epoch: 27, train_loss: 0.8648, test_loss: 0.9412, test_f1: 0.5459
 epoch: 28, train_loss: 0.8480, test_loss: 0.9584, test_f1: 0.5465
 epoch: 29, train_loss: 0.8951, test_loss: 0.8907, test_f1: 0.5401
 epoch: 30, train_loss: 0.8713, test_loss: 0.9082, test_f1: 0.5586
 epoch: 31, train_loss: 0.8617, test_loss: 0.9101, test_f1: 0.5537
 epoch: 32, train_loss: 0.8545, test_loss: 0.8945, test_f1: 0.5746
 epoch: 33, train_loss: 0.8597, test_loss: 0.9486, test_f1: 0.5592
 epoch: 34, train_loss: 0.8273, test_loss: 0.9544, test_f1: 0.5709
 epoch: 35, train_loss: 0.8364, test_loss: 1.0345, test_f1: 0.5234
 epoch: 36, train_loss: 0.8317, test_loss: 0.9255, test_f1: 0.5502
 epoch: 37, train_loss: 0.8419, test_loss: 0.9063, test_f1: 0.5513
 epoch: 38, train_loss: 0.8481, test_loss: 0.9029, test_f1: 0.5968
 epoch: 39, train_loss: 0.9206, test_loss: 0.9258, test_f1: 0.5200
 epoch: 40, train_loss: 0.8940, test_loss: 0.8944, test_f1: 0.5466
 epoch: 41, train_loss: 0.8586, test_loss: 0.9051, test_f1: 0.5788
 epoch: 42, train_loss: 0.8889, test_loss: 0.9233, test_f1: 0.5729
 epoch: 43, train_loss: 0.8503, test_loss: 0.9160, test_f1: 0.5540
 epoch: 44, train_loss: 0.8407, test_loss: 0.9601, test_f1: 0.6136
 epoch: 45, train_loss: 0.8260, test_loss: 0.9315, test_f1: 0.5654
 epoch: 46, train_loss: 0.8142, test_loss: 0.9277, test_f1: 0.5376
 epoch: 47, train_loss: 0.8247, test_loss: 0.9463, test_f1: 0.5906
 epoch: 48, train_loss: 0.8181, test_loss: 1.0043, test_f1: 0.5792
 epoch: 49, train_loss: 0.8217, test_loss: 0.9365, test_f1: 0.5499
 epoch: 50, train_loss: 0.8171, test_loss: 0.8858, test_f1: 0.6153
 epoch: 51, train_loss: 0.7954, test_loss: 0.8716, test_f1: 0.6248
 epoch: 52, train_loss: 0.7834, test_loss: 0.8620, test_f1: 0.5996
 epoch: 53, train_loss: 0.7906, test_loss: 0.8889, test_f1: 0.6373
 epoch: 54, train_loss: 0.7774, test_loss: 0.8853, test_f1: 0.6015
 epoch: 55, train_loss: 0.7855, test_loss: 0.9089, test_f1: 0.6012
 epoch: 56, train_loss: 0.7831, test_loss: 0.9223, test_f1: 0.6512
 epoch: 57, train_loss: 0.7767, test_loss: 0.9975, test_f1: 0.6198
 epoch: 58, train_loss: 0.7760, test_loss: 1.0059, test_f1: 0.6381
 epoch: 59, train_loss: 0.7606, test_loss: 0.9810, test_f1: 0.6590
 epoch: 60, train_loss: 0.7533, test_loss: 1.0070, test_f1: 0.6532
 epoch: 61, train_loss: 0.7554, test_loss: 0.9698, test_f1: 0.6149
 epoch: 62, train_loss: 0.7629, test_loss: 0.9051, test_f1: 0.6719
 epoch: 63, train_loss: 0.7678, test_loss: 0.8885, test_f1: 0.6371
 epoch: 64, train_loss: 0.7507, test_loss: 0.9003, test_f1: 0.6568
 epoch: 65, train_loss: 0.7664, test_loss: 0.9753, test_f1: 0.6623
 epoch: 66, train_loss: 0.7461, test_loss: 0.9388, test_f1: 0.7055
 epoch: 67, train_loss: 0.7383, test_loss: 0.9440, test_f1: 0.6456
 epoch: 68, train_loss: 0.7548, test_loss: 0.8612, test_f1: 0.6397
 epoch: 69, train_loss: 0.7518, test_loss: 0.9535, test_f1: 0.6285
 epoch: 70, train_loss: 0.7507, test_loss: 0.9189, test_f1: 0.6347
 epoch: 71, train_loss: 0.7299, test_loss: 0.9836, test_f1: 0.6512
 epoch: 72, train_loss: 0.7476, test_loss: 0.9437, test_f1: 0.6430
 epoch: 73, train_loss: 0.7360, test_loss: 0.9860, test_f1: 0.6469
 epoch: 74, train_loss: 0.7405, test_loss: 0.9566, test_f1: 0.6208
 epoch: 75, train_loss: 0.7540, test_loss: 0.9385, test_f1: 0.6744
 epoch: 76, train_loss: 0.7349, test_loss: 0.9344, test_f1: 0.6857
 epoch: 77, train_loss: 0.7369, test_loss: 0.9247, test_f1: 0.5946
 epoch: 78, train_loss: 0.7384, test_loss: 0.9336, test_f1: 0.6575
 epoch: 79, train_loss: 0.7457, test_loss: 0.9509, test_f1: 0.6654
 epoch: 80, train_loss: 0.7429, test_loss: 0.9244, test_f1: 0.6267
 epoch: 81, train_loss: 0.7285, test_loss: 0.9082, test_f1: 0.6444
 epoch: 82, train_loss: 0.7315, test_loss: 0.9240, test_f1: 0.6560
 epoch: 83, train_loss: 0.7293, test_loss: 1.0266, test_f1: 0.6310
 epoch: 84, train_loss: 0.7240, test_loss: 0.9811, test_f1: 0.6175
 epoch: 85, train_loss: 0.7305, test_loss: 0.9617, test_f1: 0.6138
 epoch: 86, train_loss: 0.7456, test_loss: 1.0192, test_f1: 0.6494
 epoch: 87, train_loss: 0.7213, test_loss: 1.0318, test_f1: 0.6537
 epoch: 88, train_loss: 0.7208, test_loss: 1.1175, test_f1: 0.6097
 epoch: 89, train_loss: 0.7287, test_loss: 1.0606, test_f1: 0.6735
 epoch: 90, train_loss: 0.7210, test_loss: 1.0822, test_f1: 0.6702
 epoch: 91, train_loss: 0.7314, test_loss: 0.9947, test_f1: 0.6405
 epoch: 92, train_loss: 0.7262, test_loss: 1.0575, test_f1: 0.6567
 epoch: 93, train_loss: 0.7275, test_loss: 1.0760, test_f1: 0.6300
 epoch: 94, train_loss: 0.7264, test_loss: 1.0048, test_f1: 0.6188
 epoch: 95, train_loss: 0.7130, test_loss: 1.0414, test_f1: 0.6401
 epoch: 96, train_loss: 0.7065, test_loss: 0.9702, test_f1: 0.6799
 epoch: 97, train_loss: 0.7084, test_loss: 0.9690, test_f1: 0.6620
 epoch: 98, train_loss: 0.7052, test_loss: 1.0209, test_f1: 0.6621
 epoch: 99, train_loss: 0.7155, test_loss: 1.0856, test_f1: 0.6521
##################ITERATION #4 ****************************************
 epoch: 0, train_loss: 1.2099, test_loss: 1.1224, test_f1: 0.4270
 epoch: 1, train_loss: 1.0650, test_loss: 1.0851, test_f1: 0.4114
 epoch: 2, train_loss: 1.0421, test_loss: 1.0099, test_f1: 0.4514
 epoch: 3, train_loss: 1.0097, test_loss: 1.0304, test_f1: 0.5114
 epoch: 4, train_loss: 0.9914, test_loss: 1.1675, test_f1: 0.4486
 epoch: 5, train_loss: 1.0082, test_loss: 1.0518, test_f1: 0.4641
 epoch: 6, train_loss: 0.9836, test_loss: 1.0537, test_f1: 0.4631
 epoch: 7, train_loss: 0.9789, test_loss: 1.0284, test_f1: 0.4663
 epoch: 8, train_loss: 0.9669, test_loss: 1.0541, test_f1: 0.4768
 epoch: 9, train_loss: 0.9683, test_loss: 1.0583, test_f1: 0.4989
 epoch: 10, train_loss: 0.9542, test_loss: 1.0213, test_f1: 0.3892
 epoch: 11, train_loss: 0.9574, test_loss: 1.0307, test_f1: 0.5029
 epoch: 12, train_loss: 0.9545, test_loss: 1.0231, test_f1: 0.5145
 epoch: 13, train_loss: 0.9429, test_loss: 1.0632, test_f1: 0.5058
 epoch: 14, train_loss: 0.9361, test_loss: 1.0430, test_f1: 0.5214
 epoch: 15, train_loss: 0.9423, test_loss: 0.9699, test_f1: 0.5379
 epoch: 16, train_loss: 0.9320, test_loss: 1.0200, test_f1: 0.4914
 epoch: 17, train_loss: 0.9247, test_loss: 0.9984, test_f1: 0.5667
 epoch: 18, train_loss: 0.9201, test_loss: 1.0357, test_f1: 0.5663
 epoch: 19, train_loss: 0.9127, test_loss: 0.9661, test_f1: 0.5347
 epoch: 20, train_loss: 0.9069, test_loss: 1.0102, test_f1: 0.4881
 epoch: 21, train_loss: 0.9205, test_loss: 0.9403, test_f1: 0.5338
 epoch: 22, train_loss: 0.9141, test_loss: 0.9642, test_f1: 0.5732
 epoch: 23, train_loss: 0.9005, test_loss: 0.9287, test_f1: 0.5562
 epoch: 24, train_loss: 0.9030, test_loss: 1.0293, test_f1: 0.5475
 epoch: 25, train_loss: 0.8982, test_loss: 0.9793, test_f1: 0.4945
 epoch: 26, train_loss: 0.8919, test_loss: 0.9594, test_f1: 0.5282
 epoch: 27, train_loss: 0.8985, test_loss: 1.0348, test_f1: 0.5329
 epoch: 28, train_loss: 0.8764, test_loss: 1.1842, test_f1: 0.5150
 epoch: 29, train_loss: 0.8948, test_loss: 1.0691, test_f1: 0.5690
 epoch: 30, train_loss: 0.8805, test_loss: 1.0684, test_f1: 0.5696
 epoch: 31, train_loss: 0.8646, test_loss: 0.9745, test_f1: 0.5872
 epoch: 32, train_loss: 0.8622, test_loss: 1.1345, test_f1: 0.5423
 epoch: 33, train_loss: 0.8574, test_loss: 0.9830, test_f1: 0.5539
 epoch: 34, train_loss: 0.8740, test_loss: 1.0489, test_f1: 0.5812
 epoch: 35, train_loss: 0.8585, test_loss: 1.0863, test_f1: 0.5473
 epoch: 36, train_loss: 0.8558, test_loss: 1.0012, test_f1: 0.5759
 epoch: 37, train_loss: 0.8567, test_loss: 0.9424, test_f1: 0.5334
 epoch: 38, train_loss: 0.8557, test_loss: 1.0389, test_f1: 0.5382
 epoch: 39, train_loss: 0.8571, test_loss: 1.0548, test_f1: 0.5349
 epoch: 40, train_loss: 0.8361, test_loss: 1.0187, test_f1: 0.5615
 epoch: 41, train_loss: 0.8421, test_loss: 1.0846, test_f1: 0.5848
 epoch: 42, train_loss: 0.8397, test_loss: 1.0137, test_f1: 0.5594
 epoch: 43, train_loss: 0.8329, test_loss: 0.9909, test_f1: 0.5779
 epoch: 44, train_loss: 0.8518, test_loss: 0.9912, test_f1: 0.5288
 epoch: 45, train_loss: 0.8411, test_loss: 1.0005, test_f1: 0.5860
 epoch: 46, train_loss: 0.8233, test_loss: 0.9827, test_f1: 0.5572
 epoch: 47, train_loss: 0.8163, test_loss: 0.8966, test_f1: 0.5400
 epoch: 48, train_loss: 0.8232, test_loss: 1.0223, test_f1: 0.5078
 epoch: 49, train_loss: 0.8529, test_loss: 0.9575, test_f1: 0.5608
 epoch: 50, train_loss: 0.8332, test_loss: 0.9748, test_f1: 0.5536
 epoch: 51, train_loss: 0.8065, test_loss: 1.0276, test_f1: 0.5440
 epoch: 52, train_loss: 0.7883, test_loss: 1.0502, test_f1: 0.5627
 epoch: 53, train_loss: 0.7960, test_loss: 1.0260, test_f1: 0.5597
 epoch: 54, train_loss: 0.7906, test_loss: 0.9800, test_f1: 0.5820
 epoch: 55, train_loss: 0.7867, test_loss: 1.0153, test_f1: 0.5669
 epoch: 56, train_loss: 0.7747, test_loss: 1.0251, test_f1: 0.6028
 epoch: 57, train_loss: 0.7807, test_loss: 0.9269, test_f1: 0.5982
 epoch: 58, train_loss: 0.7619, test_loss: 1.0142, test_f1: 0.5722
 epoch: 59, train_loss: 0.7778, test_loss: 1.0015, test_f1: 0.6026
 epoch: 60, train_loss: 0.7560, test_loss: 1.0909, test_f1: 0.5882
 epoch: 61, train_loss: 0.7677, test_loss: 0.9679, test_f1: 0.5752
 epoch: 62, train_loss: 0.7670, test_loss: 1.0202, test_f1: 0.5494
 epoch: 63, train_loss: 0.7631, test_loss: 1.0793, test_f1: 0.6058
 epoch: 64, train_loss: 0.7770, test_loss: 1.0459, test_f1: 0.5827
 epoch: 65, train_loss: 0.7739, test_loss: 0.9996, test_f1: 0.6138
 epoch: 66, train_loss: 0.7450, test_loss: 1.0109, test_f1: 0.6152
 epoch: 67, train_loss: 0.7370, test_loss: 1.0085, test_f1: 0.6111
 epoch: 68, train_loss: 0.7599, test_loss: 1.0777, test_f1: 0.6128
 epoch: 69, train_loss: 0.7559, test_loss: 1.0265, test_f1: 0.5472
 epoch: 70, train_loss: 0.7451, test_loss: 1.0268, test_f1: 0.5976
 epoch: 71, train_loss: 0.7525, test_loss: 1.0071, test_f1: 0.6365
 epoch: 72, train_loss: 0.7472, test_loss: 1.0110, test_f1: 0.6156
 epoch: 73, train_loss: 0.7709, test_loss: 1.0308, test_f1: 0.5745
 epoch: 74, train_loss: 0.7458, test_loss: 1.0300, test_f1: 0.6124
 epoch: 75, train_loss: 0.7476, test_loss: 1.1105, test_f1: 0.5919
 epoch: 76, train_loss: 0.7376, test_loss: 1.0766, test_f1: 0.6317
 epoch: 77, train_loss: 0.7364, test_loss: 1.0682, test_f1: 0.6071
 epoch: 78, train_loss: 0.7320, test_loss: 1.0813, test_f1: 0.5743
 epoch: 79, train_loss: 0.7356, test_loss: 0.9952, test_f1: 0.6259
 epoch: 80, train_loss: 0.7370, test_loss: 1.0167, test_f1: 0.6189
 epoch: 81, train_loss: 0.7220, test_loss: 1.0033, test_f1: 0.6041
 epoch: 82, train_loss: 0.7360, test_loss: 1.0162, test_f1: 0.6115
 epoch: 83, train_loss: 0.7325, test_loss: 1.0081, test_f1: 0.5985
 epoch: 84, train_loss: 0.7151, test_loss: 1.0363, test_f1: 0.6009
 epoch: 85, train_loss: 0.7251, test_loss: 1.0385, test_f1: 0.6254
 epoch: 86, train_loss: 0.7172, test_loss: 0.9941, test_f1: 0.6153
 epoch: 87, train_loss: 0.7185, test_loss: 1.0095, test_f1: 0.5678
 epoch: 88, train_loss: 0.7263, test_loss: 1.0673, test_f1: 0.6019
 epoch: 89, train_loss: 0.7311, test_loss: 1.0799, test_f1: 0.6028
 epoch: 90, train_loss: 0.7291, test_loss: 1.0993, test_f1: 0.5862
 epoch: 91, train_loss: 0.7244, test_loss: 1.1661, test_f1: 0.5890
 epoch: 92, train_loss: 0.7178, test_loss: 1.1264, test_f1: 0.6054
 epoch: 93, train_loss: 0.7215, test_loss: 1.1132, test_f1: 0.6110
 epoch: 94, train_loss: 0.7232, test_loss: 1.0839, test_f1: 0.5734
 epoch: 95, train_loss: 0.7185, test_loss: 1.0819, test_f1: 0.6185
 epoch: 96, train_loss: 0.7095, test_loss: 1.0703, test_f1: 0.5900
 epoch: 97, train_loss: 0.7116, test_loss: 1.0780, test_f1: 0.6263
 epoch: 98, train_loss: 0.7172, test_loss: 1.1852, test_f1: 0.5890
 epoch: 99, train_loss: 0.7255, test_loss: 1.1228, test_f1: 0.6007
##################ITERATION #5 ****************************************
 epoch: 0, train_loss: 1.1559, test_loss: 1.0466, test_f1: 0.4094
 epoch: 1, train_loss: 1.0465, test_loss: 1.0401, test_f1: 0.4810
 epoch: 2, train_loss: 1.0252, test_loss: 1.0780, test_f1: 0.4956
 epoch: 3, train_loss: 1.0119, test_loss: 1.0491, test_f1: 0.4622
 epoch: 4, train_loss: 1.0007, test_loss: 0.9861, test_f1: 0.4694
 epoch: 5, train_loss: 0.9710, test_loss: 1.0288, test_f1: 0.4752
 epoch: 6, train_loss: 0.9801, test_loss: 1.0831, test_f1: 0.5059
 epoch: 7, train_loss: 0.9615, test_loss: 1.0436, test_f1: 0.4775
 epoch: 8, train_loss: 0.9557, test_loss: 0.9371, test_f1: 0.4935
 epoch: 9, train_loss: 0.9420, test_loss: 0.9588, test_f1: 0.4678
 epoch: 10, train_loss: 0.9755, test_loss: 1.2318, test_f1: 0.4393
 epoch: 11, train_loss: 0.9790, test_loss: 1.0122, test_f1: 0.4643
 epoch: 12, train_loss: 0.9410, test_loss: 1.0705, test_f1: 0.4605
 epoch: 13, train_loss: 0.9390, test_loss: 0.9876, test_f1: 0.4901
 epoch: 14, train_loss: 0.9322, test_loss: 0.9518, test_f1: 0.4978
 epoch: 15, train_loss: 0.9313, test_loss: 0.9711, test_f1: 0.4942
 epoch: 16, train_loss: 0.9270, test_loss: 1.0349, test_f1: 0.4887
 epoch: 17, train_loss: 0.9091, test_loss: 1.0268, test_f1: 0.4888
 epoch: 18, train_loss: 0.9022, test_loss: 1.0216, test_f1: 0.4901
 epoch: 19, train_loss: 0.9043, test_loss: 1.0036, test_f1: 0.4916
 epoch: 20, train_loss: 0.8893, test_loss: 0.9556, test_f1: 0.5022
 epoch: 21, train_loss: 0.8885, test_loss: 0.9292, test_f1: 0.5088
 epoch: 22, train_loss: 0.8827, test_loss: 1.0181, test_f1: 0.4681
 epoch: 23, train_loss: 0.8835, test_loss: 0.9424, test_f1: 0.4925
 epoch: 24, train_loss: 0.8637, test_loss: 0.9472, test_f1: 0.5190
 epoch: 25, train_loss: 0.8745, test_loss: 0.9520, test_f1: 0.5046
 epoch: 26, train_loss: 0.8683, test_loss: 0.9395, test_f1: 0.5433
 epoch: 27, train_loss: 0.8709, test_loss: 1.0019, test_f1: 0.4890
 epoch: 28, train_loss: 0.8567, test_loss: 0.9923, test_f1: 0.5075
 epoch: 29, train_loss: 0.8538, test_loss: 1.3757, test_f1: 0.4944
 epoch: 30, train_loss: 0.8526, test_loss: 0.9957, test_f1: 0.5001
 epoch: 31, train_loss: 0.8688, test_loss: 0.9776, test_f1: 0.5293
 epoch: 32, train_loss: 0.8495, test_loss: 1.0401, test_f1: 0.5143
 epoch: 33, train_loss: 0.8583, test_loss: 0.9740, test_f1: 0.5245
 epoch: 34, train_loss: 0.8525, test_loss: 0.9893, test_f1: 0.6054
 epoch: 35, train_loss: 0.8419, test_loss: 0.9955, test_f1: 0.5959
 epoch: 36, train_loss: 0.8275, test_loss: 0.8904, test_f1: 0.5916
 epoch: 37, train_loss: 0.8369, test_loss: 0.9772, test_f1: 0.5300
 epoch: 38, train_loss: 0.8333, test_loss: 0.9914, test_f1: 0.5430
 epoch: 39, train_loss: 0.8327, test_loss: 0.9577, test_f1: 0.5776
 epoch: 40, train_loss: 0.8325, test_loss: 1.0569, test_f1: 0.5543
 epoch: 41, train_loss: 0.8268, test_loss: 0.9918, test_f1: 0.5388
 epoch: 42, train_loss: 0.8126, test_loss: 1.0019, test_f1: 0.5790
 epoch: 43, train_loss: 0.8332, test_loss: 0.9500, test_f1: 0.5362
 epoch: 44, train_loss: 0.8549, test_loss: 0.9714, test_f1: 0.5184
 epoch: 45, train_loss: 0.8298, test_loss: 0.9773, test_f1: 0.5492
 epoch: 46, train_loss: 0.8203, test_loss: 0.9661, test_f1: 0.5591
 epoch: 47, train_loss: 0.8030, test_loss: 1.0045, test_f1: 0.5538
 epoch: 48, train_loss: 0.8267, test_loss: 1.0207, test_f1: 0.5103
 epoch: 49, train_loss: 0.8146, test_loss: 1.0224, test_f1: 0.5112
 epoch: 50, train_loss: 0.8163, test_loss: 1.0253, test_f1: 0.5517
 epoch: 51, train_loss: 0.7889, test_loss: 0.9643, test_f1: 0.6056
 epoch: 52, train_loss: 0.7863, test_loss: 0.9506, test_f1: 0.5599
 epoch: 53, train_loss: 0.7699, test_loss: 0.9251, test_f1: 0.6125
 epoch: 54, train_loss: 0.7699, test_loss: 0.9366, test_f1: 0.6167
 epoch: 55, train_loss: 0.7668, test_loss: 0.9568, test_f1: 0.6242
 epoch: 56, train_loss: 0.7604, test_loss: 0.9780, test_f1: 0.6256
 epoch: 57, train_loss: 0.7750, test_loss: 0.9658, test_f1: 0.6199
 epoch: 58, train_loss: 0.7729, test_loss: 0.9464, test_f1: 0.6086
 epoch: 59, train_loss: 0.7866, test_loss: 0.9798, test_f1: 0.6096
 epoch: 60, train_loss: 0.7714, test_loss: 0.9344, test_f1: 0.6260
 epoch: 61, train_loss: 0.7675, test_loss: 1.0655, test_f1: 0.6091
 epoch: 62, train_loss: 0.7727, test_loss: 0.9994, test_f1: 0.6177
 epoch: 63, train_loss: 0.7734, test_loss: 0.9587, test_f1: 0.6393
 epoch: 64, train_loss: 0.7507, test_loss: 0.9774, test_f1: 0.6220
 epoch: 65, train_loss: 0.7561, test_loss: 0.9796, test_f1: 0.6191
 epoch: 66, train_loss: 0.7599, test_loss: 0.9111, test_f1: 0.6318
 epoch: 67, train_loss: 0.7575, test_loss: 1.0365, test_f1: 0.6369
 epoch: 68, train_loss: 0.7431, test_loss: 0.9727, test_f1: 0.6172
 epoch: 69, train_loss: 0.7440, test_loss: 1.0316, test_f1: 0.6415
 epoch: 70, train_loss: 0.7621, test_loss: 0.9795, test_f1: 0.6262
 epoch: 71, train_loss: 0.7507, test_loss: 0.9693, test_f1: 0.6087
 epoch: 72, train_loss: 0.7497, test_loss: 1.0026, test_f1: 0.6070
 epoch: 73, train_loss: 0.7616, test_loss: 1.0355, test_f1: 0.5978
 epoch: 74, train_loss: 0.7433, test_loss: 1.0252, test_f1: 0.5543
 epoch: 75, train_loss: 0.7500, test_loss: 0.9872, test_f1: 0.6168
 epoch: 76, train_loss: 0.7546, test_loss: 1.0419, test_f1: 0.6145
 epoch: 77, train_loss: 0.7515, test_loss: 1.0276, test_f1: 0.6283
 epoch: 78, train_loss: 0.7427, test_loss: 1.0457, test_f1: 0.6460
 epoch: 79, train_loss: 0.7327, test_loss: 1.0129, test_f1: 0.6221
 epoch: 80, train_loss: 0.7412, test_loss: 1.0128, test_f1: 0.6182
 epoch: 81, train_loss: 0.7325, test_loss: 1.0816, test_f1: 0.6233
 epoch: 82, train_loss: 0.7275, test_loss: 1.0463, test_f1: 0.6318
 epoch: 83, train_loss: 0.7339, test_loss: 1.0425, test_f1: 0.6059
 epoch: 84, train_loss: 0.7298, test_loss: 1.1521, test_f1: 0.6049
 epoch: 85, train_loss: 0.7332, test_loss: 0.9992, test_f1: 0.5752
 epoch: 86, train_loss: 0.7451, test_loss: 1.0144, test_f1: 0.6117
 epoch: 87, train_loss: 0.7292, test_loss: 1.0263, test_f1: 0.6289
 epoch: 88, train_loss: 0.7323, test_loss: 1.0553, test_f1: 0.6359
 epoch: 89, train_loss: 0.7489, test_loss: 1.0130, test_f1: 0.6412
 epoch: 90, train_loss: 0.7353, test_loss: 0.9516, test_f1: 0.6331
 epoch: 91, train_loss: 0.7254, test_loss: 0.9976, test_f1: 0.6344
 epoch: 92, train_loss: 0.7635, test_loss: 1.1027, test_f1: 0.5981
 epoch: 93, train_loss: 0.7272, test_loss: 0.9768, test_f1: 0.6130
 epoch: 94, train_loss: 0.7232, test_loss: 1.0007, test_f1: 0.6397
 epoch: 95, train_loss: 0.7154, test_loss: 1.0233, test_f1: 0.6138
 epoch: 96, train_loss: 0.7213, test_loss: 1.0630, test_f1: 0.6464
 epoch: 97, train_loss: 0.7267, test_loss: 1.1599, test_f1: 0.5935
 epoch: 98, train_loss: 0.7278, test_loss: 1.1355, test_f1: 0.6292
 epoch: 99, train_loss: 0.7588, test_loss: 1.0252, test_f1: 0.6441
##################ITERATION #6 ****************************************
 epoch: 0, train_loss: 1.1545, test_loss: 1.2042, test_f1: 0.4460
 epoch: 1, train_loss: 1.0491, test_loss: 1.0590, test_f1: 0.4608
 epoch: 2, train_loss: 1.0163, test_loss: 1.0198, test_f1: 0.4581
 epoch: 3, train_loss: 0.9854, test_loss: 0.9787, test_f1: 0.4605
 epoch: 4, train_loss: 0.9930, test_loss: 0.9874, test_f1: 0.4661
 epoch: 5, train_loss: 0.9708, test_loss: 0.9862, test_f1: 0.5274
 epoch: 6, train_loss: 0.9693, test_loss: 0.9693, test_f1: 0.5066
 epoch: 7, train_loss: 0.9564, test_loss: 0.9470, test_f1: 0.4962
 epoch: 8, train_loss: 0.9502, test_loss: 0.9544, test_f1: 0.4776
 epoch: 9, train_loss: 0.9518, test_loss: 0.9665, test_f1: 0.4951
 epoch: 10, train_loss: 0.9452, test_loss: 0.9484, test_f1: 0.5356
 epoch: 11, train_loss: 0.9283, test_loss: 0.9772, test_f1: 0.5087
 epoch: 12, train_loss: 0.9349, test_loss: 0.9904, test_f1: 0.4924
 epoch: 13, train_loss: 0.9223, test_loss: 0.9556, test_f1: 0.5097
 epoch: 14, train_loss: 0.9270, test_loss: 0.9675, test_f1: 0.5443
 epoch: 15, train_loss: 0.9211, test_loss: 1.0050, test_f1: 0.5098
 epoch: 16, train_loss: 0.9097, test_loss: 0.9681, test_f1: 0.5066
 epoch: 17, train_loss: 0.9172, test_loss: 0.8959, test_f1: 0.4944
 epoch: 18, train_loss: 0.9010, test_loss: 1.0028, test_f1: 0.5478
 epoch: 19, train_loss: 0.8995, test_loss: 0.9434, test_f1: 0.4991
 epoch: 20, train_loss: 0.9010, test_loss: 0.9593, test_f1: 0.5506
 epoch: 21, train_loss: 0.9022, test_loss: 0.9542, test_f1: 0.5330
 epoch: 22, train_loss: 0.8714, test_loss: 0.9598, test_f1: 0.5124
 epoch: 23, train_loss: 0.8936, test_loss: 0.9331, test_f1: 0.5346
 epoch: 24, train_loss: 0.8899, test_loss: 0.9676, test_f1: 0.5535
 epoch: 25, train_loss: 0.8805, test_loss: 0.9658, test_f1: 0.5462
 epoch: 26, train_loss: 0.8848, test_loss: 1.0119, test_f1: 0.5691
 epoch: 27, train_loss: 0.8696, test_loss: 0.9968, test_f1: 0.5261
 epoch: 28, train_loss: 0.8928, test_loss: 0.9452, test_f1: 0.5138
 epoch: 29, train_loss: 0.8965, test_loss: 0.9629, test_f1: 0.5439
 epoch: 30, train_loss: 0.8786, test_loss: 0.9510, test_f1: 0.5350
 epoch: 31, train_loss: 0.8795, test_loss: 1.0029, test_f1: 0.5576
 epoch: 32, train_loss: 0.8667, test_loss: 1.0252, test_f1: 0.5345
 epoch: 33, train_loss: 0.8592, test_loss: 0.9944, test_f1: 0.5635
 epoch: 34, train_loss: 0.8538, test_loss: 0.9596, test_f1: 0.5569
 epoch: 35, train_loss: 0.8545, test_loss: 0.9693, test_f1: 0.5719
 epoch: 36, train_loss: 0.8463, test_loss: 0.9561, test_f1: 0.5041
 epoch: 37, train_loss: 0.8410, test_loss: 0.9718, test_f1: 0.5803
 epoch: 38, train_loss: 0.8469, test_loss: 1.0162, test_f1: 0.5590
 epoch: 39, train_loss: 0.8549, test_loss: 0.9641, test_f1: 0.5505
 epoch: 40, train_loss: 0.8481, test_loss: 0.9189, test_f1: 0.5175
 epoch: 41, train_loss: 0.8350, test_loss: 0.9335, test_f1: 0.5435
 epoch: 42, train_loss: 0.8315, test_loss: 0.9258, test_f1: 0.5508
 epoch: 43, train_loss: 0.8270, test_loss: 0.9240, test_f1: 0.5868
 epoch: 44, train_loss: 0.8226, test_loss: 0.8796, test_f1: 0.5610
 epoch: 45, train_loss: 0.8365, test_loss: 0.9123, test_f1: 0.5948
 epoch: 46, train_loss: 0.8610, test_loss: 0.9529, test_f1: 0.5752
 epoch: 47, train_loss: 0.8342, test_loss: 0.9170, test_f1: 0.5616
 epoch: 48, train_loss: 0.8184, test_loss: 0.9425, test_f1: 0.5904
 epoch: 49, train_loss: 0.8173, test_loss: 0.9188, test_f1: 0.6097
 epoch: 50, train_loss: 0.8159, test_loss: 0.8719, test_f1: 0.6122
 epoch: 51, train_loss: 0.8043, test_loss: 0.9101, test_f1: 0.6035
 epoch: 52, train_loss: 0.7820, test_loss: 0.9057, test_f1: 0.5980
 epoch: 53, train_loss: 0.7934, test_loss: 0.9609, test_f1: 0.6023
 epoch: 54, train_loss: 0.7836, test_loss: 0.9467, test_f1: 0.6324
 epoch: 55, train_loss: 0.7747, test_loss: 0.9399, test_f1: 0.6150
 epoch: 56, train_loss: 0.7729, test_loss: 0.9448, test_f1: 0.5860
 epoch: 57, train_loss: 0.7690, test_loss: 0.9421, test_f1: 0.5660
 epoch: 58, train_loss: 0.7712, test_loss: 0.9267, test_f1: 0.5990
 epoch: 59, train_loss: 0.7601, test_loss: 0.9121, test_f1: 0.5989
 epoch: 60, train_loss: 0.7705, test_loss: 0.9001, test_f1: 0.6458
 epoch: 61, train_loss: 0.7466, test_loss: 0.9454, test_f1: 0.5926
 epoch: 62, train_loss: 0.7615, test_loss: 0.9360, test_f1: 0.6285
 epoch: 63, train_loss: 0.7522, test_loss: 0.9460, test_f1: 0.6006
 epoch: 64, train_loss: 0.7641, test_loss: 0.9614, test_f1: 0.6164
 epoch: 65, train_loss: 0.7716, test_loss: 0.9113, test_f1: 0.5991
 epoch: 66, train_loss: 0.7520, test_loss: 0.8958, test_f1: 0.6317
 epoch: 67, train_loss: 0.7555, test_loss: 0.9161, test_f1: 0.6136
 epoch: 68, train_loss: 0.7516, test_loss: 0.9653, test_f1: 0.5739
 epoch: 69, train_loss: 0.7483, test_loss: 0.9155, test_f1: 0.5655
 epoch: 70, train_loss: 0.7481, test_loss: 0.9136, test_f1: 0.6223
 epoch: 71, train_loss: 0.7428, test_loss: 0.9146, test_f1: 0.6172
 epoch: 72, train_loss: 0.7908, test_loss: 0.9355, test_f1: 0.5836
 epoch: 73, train_loss: 0.7475, test_loss: 0.9563, test_f1: 0.6287
 epoch: 74, train_loss: 0.7490, test_loss: 0.9694, test_f1: 0.5832
 epoch: 75, train_loss: 0.7606, test_loss: 0.9776, test_f1: 0.5987
 epoch: 76, train_loss: 0.7446, test_loss: 0.9608, test_f1: 0.6453
 epoch: 77, train_loss: 0.7398, test_loss: 0.9746, test_f1: 0.6101
 epoch: 78, train_loss: 0.7422, test_loss: 0.9389, test_f1: 0.5918
 epoch: 79, train_loss: 0.7340, test_loss: 0.9876, test_f1: 0.6103
 epoch: 80, train_loss: 0.7432, test_loss: 0.9812, test_f1: 0.6280
 epoch: 81, train_loss: 0.7385, test_loss: 1.0500, test_f1: 0.6224
 epoch: 82, train_loss: 0.7391, test_loss: 0.9703, test_f1: 0.6083
 epoch: 83, train_loss: 0.7293, test_loss: 1.0064, test_f1: 0.6154
 epoch: 84, train_loss: 0.7542, test_loss: 1.0755, test_f1: 0.6055
 epoch: 85, train_loss: 0.7615, test_loss: 0.9869, test_f1: 0.5711
 epoch: 86, train_loss: 0.7432, test_loss: 0.9358, test_f1: 0.6068
 epoch: 87, train_loss: 0.7291, test_loss: 0.9342, test_f1: 0.6041
 epoch: 88, train_loss: 0.7212, test_loss: 0.9386, test_f1: 0.6263
 epoch: 89, train_loss: 0.7387, test_loss: 1.0306, test_f1: 0.6397
 epoch: 90, train_loss: 0.7325, test_loss: 1.0945, test_f1: 0.6378
 epoch: 91, train_loss: 0.7445, test_loss: 1.0817, test_f1: 0.6318
 epoch: 92, train_loss: 0.7244, test_loss: 1.0119, test_f1: 0.6181
 epoch: 93, train_loss: 0.7175, test_loss: 0.9797, test_f1: 0.6193
 epoch: 94, train_loss: 0.7414, test_loss: 0.9851, test_f1: 0.6064
 epoch: 95, train_loss: 0.7305, test_loss: 0.9824, test_f1: 0.6094
 epoch: 96, train_loss: 0.7370, test_loss: 0.9658, test_f1: 0.6243
 epoch: 97, train_loss: 0.7255, test_loss: 0.9944, test_f1: 0.6207
 epoch: 98, train_loss: 0.7323, test_loss: 0.9721, test_f1: 0.6461
 epoch: 99, train_loss: 0.7008, test_loss: 0.9681, test_f1: 0.6191
##################ITERATION #7 ****************************************
 epoch: 0, train_loss: 1.1832, test_loss: 1.0310, test_f1: 0.4459
 epoch: 1, train_loss: 1.0189, test_loss: 1.0044, test_f1: 0.4618
 epoch: 2, train_loss: 0.9964, test_loss: 0.9778, test_f1: 0.4474
 epoch: 3, train_loss: 1.0017, test_loss: 0.9800, test_f1: 0.4674
 epoch: 4, train_loss: 0.9789, test_loss: 1.0272, test_f1: 0.4498
 epoch: 5, train_loss: 0.9693, test_loss: 1.0288, test_f1: 0.4816
 epoch: 6, train_loss: 0.9644, test_loss: 0.9778, test_f1: 0.4763
 epoch: 7, train_loss: 0.9564, test_loss: 0.9582, test_f1: 0.4845
 epoch: 8, train_loss: 0.9421, test_loss: 0.9818, test_f1: 0.4850
 epoch: 9, train_loss: 0.9508, test_loss: 0.9972, test_f1: 0.4731
 epoch: 10, train_loss: 0.9410, test_loss: 0.9400, test_f1: 0.4971
 epoch: 11, train_loss: 0.9390, test_loss: 1.0003, test_f1: 0.4859
 epoch: 12, train_loss: 0.9354, test_loss: 1.0076, test_f1: 0.4845
 epoch: 13, train_loss: 0.9193, test_loss: 0.8936, test_f1: 0.5009
 epoch: 14, train_loss: 0.9111, test_loss: 0.8911, test_f1: 0.4993
 epoch: 15, train_loss: 0.9246, test_loss: 0.9880, test_f1: 0.5134
 epoch: 16, train_loss: 0.9193, test_loss: 1.0019, test_f1: 0.4929
 epoch: 17, train_loss: 0.9082, test_loss: 0.9391, test_f1: 0.4862
 epoch: 18, train_loss: 0.9032, test_loss: 0.9763, test_f1: 0.4856
 epoch: 19, train_loss: 0.9004, test_loss: 1.0256, test_f1: 0.4923
 epoch: 20, train_loss: 0.9061, test_loss: 1.0408, test_f1: 0.5016
 epoch: 21, train_loss: 0.9021, test_loss: 1.0453, test_f1: 0.4986
 epoch: 22, train_loss: 0.9065, test_loss: 0.9824, test_f1: 0.5004
 epoch: 23, train_loss: 0.8938, test_loss: 0.9690, test_f1: 0.4781
 epoch: 24, train_loss: 0.8935, test_loss: 0.9761, test_f1: 0.4873
 epoch: 25, train_loss: 0.8963, test_loss: 0.9569, test_f1: 0.5185
 epoch: 26, train_loss: 0.8827, test_loss: 1.0181, test_f1: 0.5108
 epoch: 27, train_loss: 0.8801, test_loss: 1.0219, test_f1: 0.5526
 epoch: 28, train_loss: 0.8841, test_loss: 0.9611, test_f1: 0.5451
 epoch: 29, train_loss: 0.8819, test_loss: 1.0046, test_f1: 0.4938
 epoch: 30, train_loss: 0.8794, test_loss: 1.0259, test_f1: 0.5763
 epoch: 31, train_loss: 0.8909, test_loss: 1.0834, test_f1: 0.4895
 epoch: 32, train_loss: 0.8797, test_loss: 0.9192, test_f1: 0.5296
 epoch: 33, train_loss: 0.8666, test_loss: 1.0001, test_f1: 0.5051
 epoch: 34, train_loss: 0.8674, test_loss: 0.9300, test_f1: 0.5113
 epoch: 35, train_loss: 0.8757, test_loss: 1.0087, test_f1: 0.5140
 epoch: 36, train_loss: 0.8738, test_loss: 1.1604, test_f1: 0.4390
 epoch: 37, train_loss: 0.8734, test_loss: 1.0973, test_f1: 0.5094
 epoch: 38, train_loss: 0.8740, test_loss: 1.0024, test_f1: 0.5584
 epoch: 39, train_loss: 0.8582, test_loss: 1.0500, test_f1: 0.5004
 epoch: 40, train_loss: 0.8628, test_loss: 1.0224, test_f1: 0.5596
 epoch: 41, train_loss: 0.9162, test_loss: 1.0890, test_f1: 0.4880
 epoch: 42, train_loss: 0.9196, test_loss: 0.9314, test_f1: 0.5504
 epoch: 43, train_loss: 0.8872, test_loss: 0.9899, test_f1: 0.5761
 epoch: 44, train_loss: 0.8722, test_loss: 0.9576, test_f1: 0.5554
 epoch: 45, train_loss: 0.8504, test_loss: 0.9825, test_f1: 0.4977
 epoch: 46, train_loss: 0.8560, test_loss: 0.9806, test_f1: 0.5384
 epoch: 47, train_loss: 0.8434, test_loss: 0.9741, test_f1: 0.5085
 epoch: 48, train_loss: 0.8563, test_loss: 0.9527, test_f1: 0.5115
 epoch: 49, train_loss: 0.8440, test_loss: 0.9833, test_f1: 0.5251
 epoch: 50, train_loss: 0.8430, test_loss: 1.0172, test_f1: 0.5246
 epoch: 51, train_loss: 0.8181, test_loss: 0.9992, test_f1: 0.5312
 epoch: 52, train_loss: 0.8181, test_loss: 0.9700, test_f1: 0.5793
 epoch: 53, train_loss: 0.8066, test_loss: 0.9878, test_f1: 0.5444
 epoch: 54, train_loss: 0.8078, test_loss: 0.9664, test_f1: 0.5305
 epoch: 55, train_loss: 0.8005, test_loss: 0.9608, test_f1: 0.5508
 epoch: 56, train_loss: 0.7941, test_loss: 0.9638, test_f1: 0.5976
 epoch: 57, train_loss: 0.8016, test_loss: 1.0119, test_f1: 0.5437
 epoch: 58, train_loss: 0.8031, test_loss: 0.9708, test_f1: 0.5612
 epoch: 59, train_loss: 0.8049, test_loss: 1.0015, test_f1: 0.5414
 epoch: 60, train_loss: 0.7934, test_loss: 0.9439, test_f1: 0.5851
 epoch: 61, train_loss: 0.7951, test_loss: 0.9552, test_f1: 0.5567
 epoch: 62, train_loss: 0.7875, test_loss: 0.9996, test_f1: 0.5719
 epoch: 63, train_loss: 0.7819, test_loss: 1.0280, test_f1: 0.5985
 epoch: 64, train_loss: 0.7858, test_loss: 0.9873, test_f1: 0.5823
 epoch: 65, train_loss: 0.8115, test_loss: 0.9566, test_f1: 0.5610
 epoch: 66, train_loss: 0.7798, test_loss: 0.9439, test_f1: 0.5537
 epoch: 67, train_loss: 0.7829, test_loss: 0.9997, test_f1: 0.5892
 epoch: 68, train_loss: 0.7780, test_loss: 0.9699, test_f1: 0.6003
 epoch: 69, train_loss: 0.7857, test_loss: 0.9487, test_f1: 0.5827
 epoch: 70, train_loss: 0.7779, test_loss: 0.9751, test_f1: 0.5734
 epoch: 71, train_loss: 0.7770, test_loss: 1.1070, test_f1: 0.5895
 epoch: 72, train_loss: 0.7807, test_loss: 0.9797, test_f1: 0.5783
 epoch: 73, train_loss: 0.7647, test_loss: 0.9902, test_f1: 0.5806
 epoch: 74, train_loss: 0.7652, test_loss: 0.9728, test_f1: 0.5582
 epoch: 75, train_loss: 0.7699, test_loss: 1.0219, test_f1: 0.5855
 epoch: 76, train_loss: 0.7585, test_loss: 1.0057, test_f1: 0.6106
 epoch: 77, train_loss: 0.7746, test_loss: 0.9952, test_f1: 0.5718
 epoch: 78, train_loss: 0.7610, test_loss: 0.9744, test_f1: 0.6134
 epoch: 79, train_loss: 0.7667, test_loss: 1.0170, test_f1: 0.6057
 epoch: 80, train_loss: 0.7544, test_loss: 0.9792, test_f1: 0.5824
 epoch: 81, train_loss: 0.7450, test_loss: 1.0051, test_f1: 0.5707
 epoch: 82, train_loss: 0.7504, test_loss: 1.1213, test_f1: 0.5773
 epoch: 83, train_loss: 0.7652, test_loss: 1.0856, test_f1: 0.5860
 epoch: 84, train_loss: 0.7592, test_loss: 1.0746, test_f1: 0.5739
 epoch: 85, train_loss: 0.7677, test_loss: 0.9627, test_f1: 0.5614
 epoch: 86, train_loss: 0.7547, test_loss: 0.9905, test_f1: 0.6345
 epoch: 87, train_loss: 0.7498, test_loss: 1.0492, test_f1: 0.5642
 epoch: 88, train_loss: 0.7467, test_loss: 1.0500, test_f1: 0.5944
 epoch: 89, train_loss: 0.7443, test_loss: 1.0118, test_f1: 0.6015
 epoch: 90, train_loss: 0.7454, test_loss: 1.0301, test_f1: 0.6183
 epoch: 91, train_loss: 0.7339, test_loss: 1.0223, test_f1: 0.6109
 epoch: 92, train_loss: 0.7466, test_loss: 1.0526, test_f1: 0.5892
 epoch: 93, train_loss: 0.7390, test_loss: 1.0884, test_f1: 0.5686
 epoch: 94, train_loss: 0.7401, test_loss: 1.0689, test_f1: 0.6195
 epoch: 95, train_loss: 0.7495, test_loss: 1.0613, test_f1: 0.5812
 epoch: 96, train_loss: 0.7336, test_loss: 1.0686, test_f1: 0.6185
 epoch: 97, train_loss: 0.7382, test_loss: 1.1034, test_f1: 0.5938
 epoch: 98, train_loss: 0.7352, test_loss: 1.1013, test_f1: 0.5987
 epoch: 99, train_loss: 0.7320, test_loss: 1.0947, test_f1: 0.5958
##################ITERATION #8 ****************************************
 epoch: 0, train_loss: 1.1459, test_loss: 1.2508, test_f1: 0.3718
 epoch: 1, train_loss: 1.0471, test_loss: 1.0468, test_f1: 0.4513
 epoch: 2, train_loss: 0.9959, test_loss: 1.0370, test_f1: 0.4255
 epoch: 3, train_loss: 0.9857, test_loss: 1.0221, test_f1: 0.4903
 epoch: 4, train_loss: 0.9702, test_loss: 1.0137, test_f1: 0.4687
 epoch: 5, train_loss: 0.9560, test_loss: 0.9289, test_f1: 0.4794
 epoch: 6, train_loss: 0.9598, test_loss: 1.0565, test_f1: 0.4639
 epoch: 7, train_loss: 0.9595, test_loss: 0.9876, test_f1: 0.4555
 epoch: 8, train_loss: 0.9391, test_loss: 0.9930, test_f1: 0.4827
 epoch: 9, train_loss: 0.9403, test_loss: 1.0070, test_f1: 0.5132
 epoch: 10, train_loss: 0.9472, test_loss: 0.9486, test_f1: 0.4953
 epoch: 11, train_loss: 0.9305, test_loss: 0.9994, test_f1: 0.5144
 epoch: 12, train_loss: 0.9395, test_loss: 1.0324, test_f1: 0.4363
 epoch: 13, train_loss: 0.9580, test_loss: 1.0150, test_f1: 0.4754
 epoch: 14, train_loss: 0.9311, test_loss: 0.9252, test_f1: 0.4987
 epoch: 15, train_loss: 0.9152, test_loss: 1.0341, test_f1: 0.4582
 epoch: 16, train_loss: 0.9553, test_loss: 0.9642, test_f1: 0.5274
 epoch: 17, train_loss: 0.9238, test_loss: 0.9813, test_f1: 0.4742
 epoch: 18, train_loss: 0.9076, test_loss: 0.9945, test_f1: 0.4887
 epoch: 19, train_loss: 0.8977, test_loss: 0.9759, test_f1: 0.4738
 epoch: 20, train_loss: 0.8908, test_loss: 0.9287, test_f1: 0.4977
 epoch: 21, train_loss: 0.8823, test_loss: 0.9583, test_f1: 0.5078
 epoch: 22, train_loss: 0.8944, test_loss: 0.9030, test_f1: 0.5110
 epoch: 23, train_loss: 0.8744, test_loss: 0.9975, test_f1: 0.5224
 epoch: 24, train_loss: 0.8791, test_loss: 0.9323, test_f1: 0.5535
 epoch: 25, train_loss: 0.8674, test_loss: 0.9275, test_f1: 0.5249
 epoch: 26, train_loss: 0.8701, test_loss: 0.9590, test_f1: 0.5803
 epoch: 27, train_loss: 0.8759, test_loss: 0.9418, test_f1: 0.5229
 epoch: 28, train_loss: 0.8718, test_loss: 0.9405, test_f1: 0.5522
 epoch: 29, train_loss: 0.8733, test_loss: 0.9766, test_f1: 0.5057
 epoch: 30, train_loss: 0.8652, test_loss: 0.9603, test_f1: 0.5018
 epoch: 31, train_loss: 0.8546, test_loss: 0.9617, test_f1: 0.4949
 epoch: 32, train_loss: 0.8544, test_loss: 1.0053, test_f1: 0.5088
 epoch: 33, train_loss: 0.8444, test_loss: 0.9093, test_f1: 0.5164
 epoch: 34, train_loss: 0.8532, test_loss: 0.9645, test_f1: 0.4990
 epoch: 35, train_loss: 0.8496, test_loss: 0.9217, test_f1: 0.5342
 epoch: 36, train_loss: 0.8544, test_loss: 0.9232, test_f1: 0.5910
 epoch: 37, train_loss: 0.8356, test_loss: 0.9095, test_f1: 0.5843
 epoch: 38, train_loss: 0.8486, test_loss: 0.9901, test_f1: 0.4903
 epoch: 39, train_loss: 0.8375, test_loss: 0.9465, test_f1: 0.5802
 epoch: 40, train_loss: 0.8410, test_loss: 0.9390, test_f1: 0.5489
 epoch: 41, train_loss: 0.8353, test_loss: 0.8911, test_f1: 0.5471
 epoch: 42, train_loss: 0.8081, test_loss: 0.9075, test_f1: 0.5602
 epoch: 43, train_loss: 0.8091, test_loss: 0.8624, test_f1: 0.6231
 epoch: 44, train_loss: 0.8293, test_loss: 0.8772, test_f1: 0.5394
 epoch: 45, train_loss: 0.8364, test_loss: 0.9415, test_f1: 0.5719
 epoch: 46, train_loss: 0.8113, test_loss: 0.8874, test_f1: 0.5391
 epoch: 47, train_loss: 0.8079, test_loss: 0.9047, test_f1: 0.5402
 epoch: 48, train_loss: 0.8142, test_loss: 0.8671, test_f1: 0.6038
 epoch: 49, train_loss: 0.8047, test_loss: 0.8795, test_f1: 0.5395
 epoch: 50, train_loss: 0.8061, test_loss: 0.9155, test_f1: 0.5450
 epoch: 51, train_loss: 0.7901, test_loss: 0.8933, test_f1: 0.5426
 epoch: 52, train_loss: 0.7575, test_loss: 0.9308, test_f1: 0.6146
 epoch: 53, train_loss: 0.7616, test_loss: 0.8787, test_f1: 0.5911
 epoch: 54, train_loss: 0.7592, test_loss: 0.9022, test_f1: 0.5872
 epoch: 55, train_loss: 0.7663, test_loss: 0.9149, test_f1: 0.5792
 epoch: 56, train_loss: 0.7489, test_loss: 0.8931, test_f1: 0.5985
 epoch: 57, train_loss: 0.7553, test_loss: 1.1843, test_f1: 0.5315
 epoch: 58, train_loss: 0.7633, test_loss: 0.8833, test_f1: 0.6127
 epoch: 59, train_loss: 0.7563, test_loss: 0.8944, test_f1: 0.5700
 epoch: 60, train_loss: 0.7513, test_loss: 0.8527, test_f1: 0.5824
 epoch: 61, train_loss: 0.7466, test_loss: 0.9162, test_f1: 0.5725
 epoch: 62, train_loss: 0.7472, test_loss: 0.8874, test_f1: 0.6292
 epoch: 63, train_loss: 0.7602, test_loss: 0.8743, test_f1: 0.5704
 epoch: 64, train_loss: 0.7420, test_loss: 0.9035, test_f1: 0.6252
 epoch: 65, train_loss: 0.7358, test_loss: 0.8799, test_f1: 0.6328
 epoch: 66, train_loss: 0.7571, test_loss: 0.9015, test_f1: 0.6026
 epoch: 67, train_loss: 0.7337, test_loss: 0.8723, test_f1: 0.5755
 epoch: 68, train_loss: 0.7512, test_loss: 0.8914, test_f1: 0.6171
 epoch: 69, train_loss: 0.7361, test_loss: 0.8889, test_f1: 0.5817
 epoch: 70, train_loss: 0.7671, test_loss: 0.9199, test_f1: 0.5965
 epoch: 71, train_loss: 0.7293, test_loss: 0.8746, test_f1: 0.5921
 epoch: 72, train_loss: 0.7218, test_loss: 0.8901, test_f1: 0.5972
 epoch: 73, train_loss: 0.7376, test_loss: 0.9100, test_f1: 0.6254
 epoch: 74, train_loss: 0.7217, test_loss: 0.8805, test_f1: 0.6239
 epoch: 75, train_loss: 0.7181, test_loss: 0.8782, test_f1: 0.5869
 epoch: 76, train_loss: 0.7310, test_loss: 0.8831, test_f1: 0.6069
 epoch: 77, train_loss: 0.7170, test_loss: 0.8701, test_f1: 0.5743
 epoch: 78, train_loss: 0.7061, test_loss: 0.8921, test_f1: 0.6081
 epoch: 79, train_loss: 0.7121, test_loss: 0.8985, test_f1: 0.5953
 epoch: 80, train_loss: 0.7017, test_loss: 0.9441, test_f1: 0.6345
 epoch: 81, train_loss: 0.7152, test_loss: 0.9091, test_f1: 0.6151
 epoch: 82, train_loss: 0.6984, test_loss: 0.8763, test_f1: 0.6201
 epoch: 83, train_loss: 0.7235, test_loss: 0.9205, test_f1: 0.6224
 epoch: 84, train_loss: 0.7159, test_loss: 0.9263, test_f1: 0.6262
 epoch: 85, train_loss: 0.7006, test_loss: 0.8866, test_f1: 0.6205
 epoch: 86, train_loss: 0.7116, test_loss: 0.8822, test_f1: 0.5917
 epoch: 87, train_loss: 0.7144, test_loss: 0.9318, test_f1: 0.5927
 epoch: 88, train_loss: 0.7251, test_loss: 0.8793, test_f1: 0.5806
 epoch: 89, train_loss: 0.7114, test_loss: 0.9000, test_f1: 0.6311
 epoch: 90, train_loss: 0.6887, test_loss: 0.9362, test_f1: 0.5951
 epoch: 91, train_loss: 0.6956, test_loss: 0.9240, test_f1: 0.6256
 epoch: 92, train_loss: 0.8095, test_loss: 0.9164, test_f1: 0.6120
 epoch: 93, train_loss: 0.7648, test_loss: 0.8954, test_f1: 0.6530
 epoch: 94, train_loss: 0.7384, test_loss: 0.8859, test_f1: 0.6267
 epoch: 95, train_loss: 0.7317, test_loss: 0.8924, test_f1: 0.6355
 epoch: 96, train_loss: 0.7130, test_loss: 0.9127, test_f1: 0.6124
 epoch: 97, train_loss: 0.7222, test_loss: 0.9227, test_f1: 0.6377
 epoch: 98, train_loss: 0.7082, test_loss: 0.8906, test_f1: 0.6103
 epoch: 99, train_loss: 0.7014, test_loss: 0.8953, test_f1: 0.5907
##################ITERATION #9 ****************************************
 epoch: 0, train_loss: 1.1741, test_loss: 1.0477, test_f1: 0.3989
 epoch: 1, train_loss: 1.0367, test_loss: 1.0745, test_f1: 0.4188
 epoch: 2, train_loss: 1.0242, test_loss: 0.9911, test_f1: 0.4549
 epoch: 3, train_loss: 1.0164, test_loss: 1.0221, test_f1: 0.4745
 epoch: 4, train_loss: 0.9973, test_loss: 1.0245, test_f1: 0.5087
 epoch: 5, train_loss: 0.9847, test_loss: 1.0151, test_f1: 0.4739
 epoch: 6, train_loss: 0.9831, test_loss: 1.0000, test_f1: 0.4864
 epoch: 7, train_loss: 0.9676, test_loss: 0.9623, test_f1: 0.4918
 epoch: 8, train_loss: 0.9618, test_loss: 1.0056, test_f1: 0.5169
 epoch: 9, train_loss: 0.9597, test_loss: 1.0007, test_f1: 0.5413
 epoch: 10, train_loss: 0.9449, test_loss: 0.9529, test_f1: 0.4949
 epoch: 11, train_loss: 0.9462, test_loss: 0.9352, test_f1: 0.5296
 epoch: 12, train_loss: 0.9401, test_loss: 0.9661, test_f1: 0.5095
 epoch: 13, train_loss: 0.9401, test_loss: 0.9501, test_f1: 0.5053
 epoch: 14, train_loss: 0.9154, test_loss: 0.9767, test_f1: 0.5030
 epoch: 15, train_loss: 0.9290, test_loss: 0.9394, test_f1: 0.5247
 epoch: 16, train_loss: 0.9354, test_loss: 0.9424, test_f1: 0.5618
 epoch: 17, train_loss: 0.9116, test_loss: 0.9394, test_f1: 0.5235
 epoch: 18, train_loss: 0.9054, test_loss: 0.9293, test_f1: 0.4966
 epoch: 19, train_loss: 0.9053, test_loss: 0.9666, test_f1: 0.5039
 epoch: 20, train_loss: 0.9064, test_loss: 0.9161, test_f1: 0.5243
 epoch: 21, train_loss: 0.9141, test_loss: 0.9844, test_f1: 0.5103
 epoch: 22, train_loss: 0.9050, test_loss: 0.9266, test_f1: 0.5406
 epoch: 23, train_loss: 0.9040, test_loss: 0.8955, test_f1: 0.5043
 epoch: 24, train_loss: 0.8887, test_loss: 0.9502, test_f1: 0.5385
 epoch: 25, train_loss: 0.8914, test_loss: 0.9664, test_f1: 0.5015
 epoch: 26, train_loss: 0.8873, test_loss: 0.9340, test_f1: 0.5198
 epoch: 27, train_loss: 0.8860, test_loss: 0.9831, test_f1: 0.4987
 epoch: 28, train_loss: 0.8832, test_loss: 0.9461, test_f1: 0.5035
 epoch: 29, train_loss: 0.8752, test_loss: 0.9695, test_f1: 0.5066
 epoch: 30, train_loss: 0.8689, test_loss: 0.9144, test_f1: 0.5254
 epoch: 31, train_loss: 0.8684, test_loss: 0.9416, test_f1: 0.5257
 epoch: 32, train_loss: 0.8611, test_loss: 0.9264, test_f1: 0.5327
 epoch: 33, train_loss: 0.8540, test_loss: 0.9780, test_f1: 0.5180
 epoch: 34, train_loss: 0.8633, test_loss: 0.9999, test_f1: 0.5061
 epoch: 35, train_loss: 0.8684, test_loss: 0.8843, test_f1: 0.5749
 epoch: 36, train_loss: 0.8442, test_loss: 0.9164, test_f1: 0.5609
 epoch: 37, train_loss: 0.8513, test_loss: 0.9548, test_f1: 0.4691
 epoch: 38, train_loss: 0.8833, test_loss: 0.9386, test_f1: 0.5122
 epoch: 39, train_loss: 0.8552, test_loss: 0.8606, test_f1: 0.5632
 epoch: 40, train_loss: 0.8629, test_loss: 0.8437, test_f1: 0.5184
 epoch: 41, train_loss: 0.8494, test_loss: 0.9907, test_f1: 0.5632
 epoch: 42, train_loss: 0.8490, test_loss: 0.8249, test_f1: 0.5588
 epoch: 43, train_loss: 0.8471, test_loss: 0.9310, test_f1: 0.5613
 epoch: 44, train_loss: 0.8272, test_loss: 0.9066, test_f1: 0.5485
 epoch: 45, train_loss: 0.8369, test_loss: 1.0468, test_f1: 0.5497
 epoch: 46, train_loss: 0.8194, test_loss: 0.9062, test_f1: 0.5863
 epoch: 47, train_loss: 0.8311, test_loss: 0.8927, test_f1: 0.5408
 epoch: 48, train_loss: 0.8141, test_loss: 0.9143, test_f1: 0.5863
 epoch: 49, train_loss: 0.8069, test_loss: 0.9422, test_f1: 0.5463
 epoch: 50, train_loss: 0.8000, test_loss: 0.9673, test_f1: 0.5349
 epoch: 51, train_loss: 0.7968, test_loss: 0.8599, test_f1: 0.5912
 epoch: 52, train_loss: 0.7848, test_loss: 0.9041, test_f1: 0.5648
 epoch: 53, train_loss: 0.7792, test_loss: 0.9616, test_f1: 0.6062
 epoch: 54, train_loss: 0.7709, test_loss: 0.9487, test_f1: 0.5728
 epoch: 55, train_loss: 0.7789, test_loss: 0.8833, test_f1: 0.6139
 epoch: 56, train_loss: 0.7521, test_loss: 0.9265, test_f1: 0.6094
 epoch: 57, train_loss: 0.7651, test_loss: 0.9109, test_f1: 0.6182
 epoch: 58, train_loss: 0.7676, test_loss: 0.9489, test_f1: 0.6032
 epoch: 59, train_loss: 0.7622, test_loss: 0.9157, test_f1: 0.6126
 epoch: 60, train_loss: 0.7498, test_loss: 0.8249, test_f1: 0.5889
 epoch: 61, train_loss: 0.7680, test_loss: 0.9654, test_f1: 0.6278
 epoch: 62, train_loss: 0.7557, test_loss: 0.9498, test_f1: 0.5835
 epoch: 63, train_loss: 0.7706, test_loss: 0.8866, test_f1: 0.6030
 epoch: 64, train_loss: 0.7647, test_loss: 0.8734, test_f1: 0.6212
 epoch: 65, train_loss: 0.7418, test_loss: 0.8590, test_f1: 0.6439
 epoch: 66, train_loss: 0.7491, test_loss: 0.8461, test_f1: 0.6394
 epoch: 67, train_loss: 0.7513, test_loss: 0.8287, test_f1: 0.6295
 epoch: 68, train_loss: 0.7321, test_loss: 0.9253, test_f1: 0.6262
 epoch: 69, train_loss: 0.7431, test_loss: 0.7941, test_f1: 0.5974
 epoch: 70, train_loss: 0.7473, test_loss: 0.9312, test_f1: 0.5762
 epoch: 71, train_loss: 0.7425, test_loss: 0.8925, test_f1: 0.6205
 epoch: 72, train_loss: 0.7267, test_loss: 0.8071, test_f1: 0.6084
 epoch: 73, train_loss: 0.7285, test_loss: 0.8875, test_f1: 0.6254
 epoch: 74, train_loss: 0.7303, test_loss: 0.9216, test_f1: 0.6143
 epoch: 75, train_loss: 0.7451, test_loss: 0.8873, test_f1: 0.6211
 epoch: 76, train_loss: 0.7545, test_loss: 0.9145, test_f1: 0.6201
 epoch: 77, train_loss: 0.7309, test_loss: 0.9027, test_f1: 0.6383
 epoch: 78, train_loss: 0.7202, test_loss: 0.9576, test_f1: 0.6285
 epoch: 79, train_loss: 0.7335, test_loss: 0.8644, test_f1: 0.6275
 epoch: 80, train_loss: 0.7225, test_loss: 0.8572, test_f1: 0.6105
 epoch: 81, train_loss: 0.7235, test_loss: 0.8947, test_f1: 0.6323
 epoch: 82, train_loss: 0.7107, test_loss: 0.8664, test_f1: 0.6532
 epoch: 83, train_loss: 0.7081, test_loss: 0.8242, test_f1: 0.6461
 epoch: 84, train_loss: 0.7035, test_loss: 0.8760, test_f1: 0.6486
 epoch: 85, train_loss: 0.6966, test_loss: 0.8909, test_f1: 0.6049
 epoch: 86, train_loss: 0.7249, test_loss: 0.9424, test_f1: 0.6473
 epoch: 87, train_loss: 0.7135, test_loss: 0.9048, test_f1: 0.6220
 epoch: 88, train_loss: 0.7082, test_loss: 0.9383, test_f1: 0.6532
 epoch: 89, train_loss: 0.7071, test_loss: 0.8679, test_f1: 0.6371
 epoch: 90, train_loss: 0.7045, test_loss: 0.9742, test_f1: 0.6342
 epoch: 91, train_loss: 0.7076, test_loss: 0.8084, test_f1: 0.6340
 epoch: 92, train_loss: 0.7104, test_loss: 0.9619, test_f1: 0.6350
 epoch: 93, train_loss: 0.6973, test_loss: 0.9065, test_f1: 0.6421
 epoch: 94, train_loss: 0.7139, test_loss: 0.9225, test_f1: 0.6590
 epoch: 95, train_loss: 0.6955, test_loss: 0.9248, test_f1: 0.6283
 epoch: 96, train_loss: 0.7038, test_loss: 0.8853, test_f1: 0.6344
 epoch: 97, train_loss: 0.6906, test_loss: 0.8266, test_f1: 0.6643
 epoch: 98, train_loss: 0.6931, test_loss: 0.8873, test_f1: 0.6344
 epoch: 99, train_loss: 0.6880, test_loss: 0.8298, test_f1: 0.6512

Training completed in 1112.44 seconds
Best F1: 0.7055 at epoch 66
Mean F1 across iterations: 0.6516  0.0211
========================FINAL RESULTS================================
FEGIN weighted F1: 0.7055  0.0211
python main.py --data ltspice_examples --representation component_net --model FEGIN --layers 4 --hiddens 32 --batch_size 32 --lr 0.01 --emb_size 128 --epochs 100 --save_appendix component_net_L4_H32_BS32_LR0.01_E128 --no_val
-----



STDERR:
  File "main.py", line 370, in <module>
    main()
  File "main.py", line 254, in main
    dataset = dataset_class(
  File "/home/philip/projects/ltspice_examples_code_repo/Circuit-Completion-Using-GNNs/component_classification_with_link_prediction_head/evaluation/FEGIN/kernel/circuit_datasets.py", line 15, in __init__
    self.data, self.slices = torch.load(self.processed_paths[0])
  File "/home/philip/.local/lib/python3.8/site-packages/torch/serialization.py", line 1040, in load
    warnings.warn(
  File "/usr/lib/python3.8/warnings.py", line 109, in _showwarnmsg
    sw(msg.message, msg.category, msg.filename, msg.lineno,
  File "main.py", line 47, in warn_with_traceback
    traceback.print_stack(file=log)
/home/philip/projects/ltspice_examples_code_repo/Circuit-Completion-Using-GNNs/component_classification_with_link_prediction_head/evaluation/FEGIN/kernel/circuit_datasets.py:15: FutureWarning: You are using `torch.load` with `weights_only=False` (the current default value), which uses the default pickle module implicitly. It is possible to construct malicious pickle data which will execute arbitrary code during unpickling (See https://github.com/pytorch/pytorch/blob/main/SECURITY.md#untrusted-models for more details). In a future release, the default value for `weights_only` will be flipped to `True`. This limits the functions that could be executed during unpickling. Arbitrary objects will no longer be allowed to be loaded via this mode unless they are explicitly allowlisted by the user via `torch.serialization.add_safe_globals`. We recommend you start setting `weights_only=True` for any use case where you don't have full control of the loaded file. Please open an issue on GitHub for any issues related to this experimental feature.
  self.data, self.slices = torch.load(self.processed_paths[0])
