STDOUT:
Results will be saved in /home/philip/projects/ltspice_examples_code_repo/Circuit-Completion-Using-GNNs/component_classification_with_link_prediction_head/evaluation/FEGIN/results/model_FEGIN_dataset_ltspice_examples
Command line input: python main.py --data ltspice_examples --representation component_net --model FEGIN --layers 5 --hiddens 64 --batch_size 64 --lr 0.001 --emb_size 512 --epochs 100 --save_appendix component_net_L5_H64_BS64_LR0.001_E512 --no_val
 is saved.
-----
ltspice_examples - FEGIN
Using 5 layers, 64 hidden units, h = 2
Loading component_net representation dataset
ENTERED
Training FEGIN on component_net representation
Train: 3558, Test: 846
##################ITERATION #0 ****************************************
 epoch: 0, train_loss: 1.2600, test_loss: 1.1588, test_f1: 0.4088
 epoch: 1, train_loss: 1.1130, test_loss: 1.0325, test_f1: 0.4801
 epoch: 2, train_loss: 1.0247, test_loss: 1.0003, test_f1: 0.4648
 epoch: 3, train_loss: 0.9767, test_loss: 0.9604, test_f1: 0.5293
 epoch: 4, train_loss: 0.9526, test_loss: 0.9698, test_f1: 0.4827
 epoch: 5, train_loss: 0.9287, test_loss: 0.9404, test_f1: 0.5023
 epoch: 6, train_loss: 0.8977, test_loss: 0.9338, test_f1: 0.5138
 epoch: 7, train_loss: 0.8968, test_loss: 0.9275, test_f1: 0.5608
 epoch: 8, train_loss: 0.8808, test_loss: 0.9412, test_f1: 0.5233
 epoch: 9, train_loss: 0.8601, test_loss: 0.9614, test_f1: 0.5650
 epoch: 10, train_loss: 0.8522, test_loss: 0.9379, test_f1: 0.5096
 epoch: 11, train_loss: 0.8442, test_loss: 0.9509, test_f1: 0.5124
 epoch: 12, train_loss: 0.8433, test_loss: 0.8906, test_f1: 0.5749
 epoch: 13, train_loss: 0.8205, test_loss: 1.0746, test_f1: 0.5397
 epoch: 14, train_loss: 0.8146, test_loss: 0.9759, test_f1: 0.5699
 epoch: 15, train_loss: 0.8031, test_loss: 0.9830, test_f1: 0.5766
 epoch: 16, train_loss: 0.7871, test_loss: 0.9929, test_f1: 0.5696
 epoch: 17, train_loss: 0.7839, test_loss: 0.9789, test_f1: 0.5783
 epoch: 18, train_loss: 0.7803, test_loss: 0.9301, test_f1: 0.5792
 epoch: 19, train_loss: 0.7624, test_loss: 0.9913, test_f1: 0.6025
 epoch: 20, train_loss: 0.7610, test_loss: 0.9528, test_f1: 0.5732
 epoch: 21, train_loss: 0.7571, test_loss: 0.9231, test_f1: 0.6073
 epoch: 22, train_loss: 0.7403, test_loss: 0.9460, test_f1: 0.6098
 epoch: 23, train_loss: 0.7472, test_loss: 0.9612, test_f1: 0.5989
 epoch: 24, train_loss: 0.7424, test_loss: 0.9956, test_f1: 0.5958
 epoch: 25, train_loss: 0.7245, test_loss: 1.0005, test_f1: 0.5870
 epoch: 26, train_loss: 0.7075, test_loss: 0.9883, test_f1: 0.5984
 epoch: 27, train_loss: 0.7027, test_loss: 1.0176, test_f1: 0.6061
 epoch: 28, train_loss: 0.6957, test_loss: 0.9693, test_f1: 0.6244
 epoch: 29, train_loss: 0.6819, test_loss: 0.9108, test_f1: 0.6519
 epoch: 30, train_loss: 0.6942, test_loss: 0.9610, test_f1: 0.5791
 epoch: 31, train_loss: 0.6855, test_loss: 0.9661, test_f1: 0.6120
 epoch: 32, train_loss: 0.6915, test_loss: 0.9442, test_f1: 0.5858
 epoch: 33, train_loss: 0.6722, test_loss: 0.9879, test_f1: 0.6167
 epoch: 34, train_loss: 0.6743, test_loss: 1.0008, test_f1: 0.6502
 epoch: 35, train_loss: 0.6545, test_loss: 1.0037, test_f1: 0.6184
 epoch: 36, train_loss: 0.6536, test_loss: 0.9736, test_f1: 0.6220
 epoch: 37, train_loss: 0.6427, test_loss: 0.9622, test_f1: 0.6231
 epoch: 38, train_loss: 0.6387, test_loss: 1.0699, test_f1: 0.6022
 epoch: 39, train_loss: 0.6324, test_loss: 0.9974, test_f1: 0.6456
 epoch: 40, train_loss: 0.6182, test_loss: 0.9588, test_f1: 0.6134
 epoch: 41, train_loss: 0.6157, test_loss: 1.0378, test_f1: 0.6308
 epoch: 42, train_loss: 0.6225, test_loss: 1.0720, test_f1: 0.6081
 epoch: 43, train_loss: 0.6007, test_loss: 1.0401, test_f1: 0.6015
 epoch: 44, train_loss: 0.6061, test_loss: 1.0160, test_f1: 0.6136
 epoch: 45, train_loss: 0.5980, test_loss: 1.0346, test_f1: 0.6158
 epoch: 46, train_loss: 0.5819, test_loss: 1.0480, test_f1: 0.6309
 epoch: 47, train_loss: 0.6047, test_loss: 1.0188, test_f1: 0.6034
 epoch: 48, train_loss: 0.5804, test_loss: 1.0752, test_f1: 0.6259
 epoch: 49, train_loss: 0.5644, test_loss: 1.0201, test_f1: 0.6412
 epoch: 50, train_loss: 0.5642, test_loss: 1.0708, test_f1: 0.6296
 epoch: 51, train_loss: 0.5265, test_loss: 1.0540, test_f1: 0.6439
 epoch: 52, train_loss: 0.4903, test_loss: 1.0732, test_f1: 0.6166
 epoch: 53, train_loss: 0.4958, test_loss: 1.0613, test_f1: 0.6285
 epoch: 54, train_loss: 0.4847, test_loss: 1.0618, test_f1: 0.6180
 epoch: 55, train_loss: 0.4585, test_loss: 1.0761, test_f1: 0.6285
 epoch: 56, train_loss: 0.4797, test_loss: 1.0298, test_f1: 0.6297
 epoch: 57, train_loss: 0.4623, test_loss: 1.1149, test_f1: 0.6405
 epoch: 58, train_loss: 0.4555, test_loss: 1.0680, test_f1: 0.6452
 epoch: 59, train_loss: 0.4446, test_loss: 1.1003, test_f1: 0.6204
 epoch: 60, train_loss: 0.4623, test_loss: 1.1443, test_f1: 0.6293
 epoch: 61, train_loss: 0.4372, test_loss: 1.1022, test_f1: 0.6406
 epoch: 62, train_loss: 0.4360, test_loss: 1.1469, test_f1: 0.6133
 epoch: 63, train_loss: 0.4389, test_loss: 1.0751, test_f1: 0.6349
 epoch: 64, train_loss: 0.4278, test_loss: 1.2134, test_f1: 0.6099
 epoch: 65, train_loss: 0.4352, test_loss: 1.1902, test_f1: 0.6194
 epoch: 66, train_loss: 0.4088, test_loss: 1.1278, test_f1: 0.6542
 epoch: 67, train_loss: 0.4259, test_loss: 1.1090, test_f1: 0.6151
 epoch: 68, train_loss: 0.4101, test_loss: 1.1444, test_f1: 0.6253
 epoch: 69, train_loss: 0.4041, test_loss: 1.1665, test_f1: 0.6183
 epoch: 70, train_loss: 0.4090, test_loss: 1.2046, test_f1: 0.6048
 epoch: 71, train_loss: 0.4079, test_loss: 1.2265, test_f1: 0.6265
 epoch: 72, train_loss: 0.3922, test_loss: 1.1730, test_f1: 0.6170
 epoch: 73, train_loss: 0.4057, test_loss: 1.3028, test_f1: 0.6267
 epoch: 74, train_loss: 0.3958, test_loss: 1.1978, test_f1: 0.6337
 epoch: 75, train_loss: 0.3926, test_loss: 1.2315, test_f1: 0.6369
 epoch: 76, train_loss: 0.3763, test_loss: 1.2699, test_f1: 0.6392
 epoch: 77, train_loss: 0.3829, test_loss: 1.2538, test_f1: 0.6130
 epoch: 78, train_loss: 0.3812, test_loss: 1.2241, test_f1: 0.6415
 epoch: 79, train_loss: 0.3770, test_loss: 1.3245, test_f1: 0.6214
 epoch: 80, train_loss: 0.3580, test_loss: 1.3618, test_f1: 0.6181
 epoch: 81, train_loss: 0.3767, test_loss: 1.3117, test_f1: 0.6137
 epoch: 82, train_loss: 0.3702, test_loss: 1.4760, test_f1: 0.6383
 epoch: 83, train_loss: 0.3588, test_loss: 1.3369, test_f1: 0.6390
 epoch: 84, train_loss: 0.3745, test_loss: 1.3332, test_f1: 0.6124
 epoch: 85, train_loss: 0.3664, test_loss: 1.4089, test_f1: 0.6365
 epoch: 86, train_loss: 0.3532, test_loss: 1.4183, test_f1: 0.6126
 epoch: 87, train_loss: 0.3477, test_loss: 1.4453, test_f1: 0.6230
 epoch: 88, train_loss: 0.3452, test_loss: 1.4493, test_f1: 0.6213
 epoch: 89, train_loss: 0.3386, test_loss: 1.5768, test_f1: 0.5964
 epoch: 90, train_loss: 0.3663, test_loss: 1.4259, test_f1: 0.6304
 epoch: 91, train_loss: 0.3581, test_loss: 1.3711, test_f1: 0.6049
 epoch: 92, train_loss: 0.3291, test_loss: 1.4687, test_f1: 0.6128
 epoch: 93, train_loss: 0.3303, test_loss: 1.4507, test_f1: 0.6341
 epoch: 94, train_loss: 0.3390, test_loss: 1.4468, test_f1: 0.6235
 epoch: 95, train_loss: 0.3342, test_loss: 1.5063, test_f1: 0.5966
 epoch: 96, train_loss: 0.3268, test_loss: 1.4343, test_f1: 0.6287
 epoch: 97, train_loss: 0.3497, test_loss: 1.4747, test_f1: 0.6316
 epoch: 98, train_loss: 0.3099, test_loss: 1.5083, test_f1: 0.6367
 epoch: 99, train_loss: 0.3405, test_loss: 1.3580, test_f1: 0.6407
##################ITERATION #1 ****************************************
 epoch: 0, train_loss: 1.1536, test_loss: 1.0302, test_f1: 0.4339
 epoch: 1, train_loss: 1.0162, test_loss: 0.9631, test_f1: 0.4656
 epoch: 2, train_loss: 0.9566, test_loss: 0.9591, test_f1: 0.5031
 epoch: 3, train_loss: 0.9458, test_loss: 0.9128, test_f1: 0.5409
 epoch: 4, train_loss: 0.9222, test_loss: 0.9442, test_f1: 0.5332
 epoch: 5, train_loss: 0.9107, test_loss: 0.9260, test_f1: 0.5352
 epoch: 6, train_loss: 0.8996, test_loss: 0.9042, test_f1: 0.5530
 epoch: 7, train_loss: 0.8706, test_loss: 0.8984, test_f1: 0.5481
 epoch: 8, train_loss: 0.8676, test_loss: 0.9490, test_f1: 0.5177
 epoch: 9, train_loss: 0.8428, test_loss: 0.8718, test_f1: 0.5444
 epoch: 10, train_loss: 0.8416, test_loss: 0.9527, test_f1: 0.5332
 epoch: 11, train_loss: 0.8377, test_loss: 0.9611, test_f1: 0.5747
 epoch: 12, train_loss: 0.8151, test_loss: 0.9733, test_f1: 0.5294
 epoch: 13, train_loss: 0.8143, test_loss: 0.9437, test_f1: 0.5660
 epoch: 14, train_loss: 0.8132, test_loss: 0.9114, test_f1: 0.5626
 epoch: 15, train_loss: 0.7816, test_loss: 0.9324, test_f1: 0.5890
 epoch: 16, train_loss: 0.7927, test_loss: 0.8894, test_f1: 0.5732
 epoch: 17, train_loss: 0.7805, test_loss: 0.9565, test_f1: 0.6106
 epoch: 18, train_loss: 0.7618, test_loss: 0.9715, test_f1: 0.5739
 epoch: 19, train_loss: 0.7631, test_loss: 0.9168, test_f1: 0.5945
 epoch: 20, train_loss: 0.7468, test_loss: 0.8883, test_f1: 0.6235
 epoch: 21, train_loss: 0.7341, test_loss: 0.8837, test_f1: 0.6127
 epoch: 22, train_loss: 0.7313, test_loss: 0.9051, test_f1: 0.5616
 epoch: 23, train_loss: 0.7236, test_loss: 0.9104, test_f1: 0.5881
 epoch: 24, train_loss: 0.7289, test_loss: 0.8444, test_f1: 0.6270
 epoch: 25, train_loss: 0.7284, test_loss: 0.8794, test_f1: 0.6138
 epoch: 26, train_loss: 0.7244, test_loss: 0.9853, test_f1: 0.5829
 epoch: 27, train_loss: 0.7194, test_loss: 0.9166, test_f1: 0.6243
 epoch: 28, train_loss: 0.6936, test_loss: 1.0194, test_f1: 0.5896
 epoch: 29, train_loss: 0.6943, test_loss: 0.9590, test_f1: 0.5776
 epoch: 30, train_loss: 0.6854, test_loss: 1.0591, test_f1: 0.5838
 epoch: 31, train_loss: 0.6863, test_loss: 0.9724, test_f1: 0.6270
 epoch: 32, train_loss: 0.6613, test_loss: 0.9802, test_f1: 0.6208
 epoch: 33, train_loss: 0.6588, test_loss: 0.9784, test_f1: 0.6227
 epoch: 34, train_loss: 0.6621, test_loss: 1.0283, test_f1: 0.6131
 epoch: 35, train_loss: 0.6602, test_loss: 0.9584, test_f1: 0.6437
 epoch: 36, train_loss: 0.6360, test_loss: 0.9732, test_f1: 0.6308
 epoch: 37, train_loss: 0.6168, test_loss: 0.9592, test_f1: 0.6373
 epoch: 38, train_loss: 0.6260, test_loss: 1.0313, test_f1: 0.6112
 epoch: 39, train_loss: 0.6103, test_loss: 0.9701, test_f1: 0.6483
 epoch: 40, train_loss: 0.5942, test_loss: 0.9867, test_f1: 0.6272
 epoch: 41, train_loss: 0.5867, test_loss: 1.0727, test_f1: 0.6376
 epoch: 42, train_loss: 0.5813, test_loss: 1.0557, test_f1: 0.6481
 epoch: 43, train_loss: 0.5921, test_loss: 0.9680, test_f1: 0.6518
 epoch: 44, train_loss: 0.5878, test_loss: 1.1130, test_f1: 0.6110
 epoch: 45, train_loss: 0.5615, test_loss: 1.0770, test_f1: 0.6499
 epoch: 46, train_loss: 0.5636, test_loss: 1.0579, test_f1: 0.6427
 epoch: 47, train_loss: 0.5516, test_loss: 1.0528, test_f1: 0.6302
 epoch: 48, train_loss: 0.5770, test_loss: 1.0247, test_f1: 0.6591
 epoch: 49, train_loss: 0.5181, test_loss: 1.0385, test_f1: 0.6434
 epoch: 50, train_loss: 0.5131, test_loss: 1.0655, test_f1: 0.6623
 epoch: 51, train_loss: 0.5174, test_loss: 0.9976, test_f1: 0.6603
 epoch: 52, train_loss: 0.4688, test_loss: 1.0692, test_f1: 0.6718
 epoch: 53, train_loss: 0.4359, test_loss: 1.0410, test_f1: 0.6488
 epoch: 54, train_loss: 0.4499, test_loss: 1.1267, test_f1: 0.6641
 epoch: 55, train_loss: 0.4518, test_loss: 1.1566, test_f1: 0.6485
 epoch: 56, train_loss: 0.4254, test_loss: 1.1988, test_f1: 0.6602
 epoch: 57, train_loss: 0.4298, test_loss: 1.1511, test_f1: 0.6689
 epoch: 58, train_loss: 0.4271, test_loss: 1.1157, test_f1: 0.6749
 epoch: 59, train_loss: 0.4302, test_loss: 1.1026, test_f1: 0.6719
 epoch: 60, train_loss: 0.4229, test_loss: 1.1735, test_f1: 0.6725
 epoch: 61, train_loss: 0.4015, test_loss: 1.1986, test_f1: 0.6506
 epoch: 62, train_loss: 0.4120, test_loss: 1.2209, test_f1: 0.6653
 epoch: 63, train_loss: 0.4081, test_loss: 1.2219, test_f1: 0.6289
 epoch: 64, train_loss: 0.4091, test_loss: 1.1977, test_f1: 0.6770
 epoch: 65, train_loss: 0.3820, test_loss: 1.2829, test_f1: 0.6846
 epoch: 66, train_loss: 0.3861, test_loss: 1.2414, test_f1: 0.6686
 epoch: 67, train_loss: 0.3883, test_loss: 1.3964, test_f1: 0.6641
 epoch: 68, train_loss: 0.3849, test_loss: 1.3353, test_f1: 0.6476
 epoch: 69, train_loss: 0.3908, test_loss: 1.3677, test_f1: 0.6648
 epoch: 70, train_loss: 0.3703, test_loss: 1.2841, test_f1: 0.6559
 epoch: 71, train_loss: 0.3625, test_loss: 1.3073, test_f1: 0.6626
 epoch: 72, train_loss: 0.3749, test_loss: 1.3762, test_f1: 0.6288
 epoch: 73, train_loss: 0.3472, test_loss: 1.4613, test_f1: 0.6356
 epoch: 74, train_loss: 0.3684, test_loss: 1.3753, test_f1: 0.6388
 epoch: 75, train_loss: 0.3592, test_loss: 1.2639, test_f1: 0.6491
 epoch: 76, train_loss: 0.3484, test_loss: 1.3854, test_f1: 0.6412
 epoch: 77, train_loss: 0.3450, test_loss: 1.3814, test_f1: 0.6534
 epoch: 78, train_loss: 0.3443, test_loss: 1.3588, test_f1: 0.6492
 epoch: 79, train_loss: 0.3410, test_loss: 1.4370, test_f1: 0.6471
 epoch: 80, train_loss: 0.3479, test_loss: 1.3260, test_f1: 0.6528
 epoch: 81, train_loss: 0.3368, test_loss: 1.3893, test_f1: 0.6476
 epoch: 82, train_loss: 0.3378, test_loss: 1.3663, test_f1: 0.6568
 epoch: 83, train_loss: 0.3295, test_loss: 1.4291, test_f1: 0.6647
 epoch: 84, train_loss: 0.3313, test_loss: 1.4333, test_f1: 0.6427
 epoch: 85, train_loss: 0.3111, test_loss: 1.4331, test_f1: 0.6406
 epoch: 86, train_loss: 0.3256, test_loss: 1.5126, test_f1: 0.6432
 epoch: 87, train_loss: 0.3284, test_loss: 1.4180, test_f1: 0.6524
 epoch: 88, train_loss: 0.3106, test_loss: 1.4192, test_f1: 0.6701
 epoch: 89, train_loss: 0.3030, test_loss: 1.5983, test_f1: 0.6352
 epoch: 90, train_loss: 0.3126, test_loss: 1.5244, test_f1: 0.6413
 epoch: 91, train_loss: 0.3083, test_loss: 1.5211, test_f1: 0.6442
 epoch: 92, train_loss: 0.2884, test_loss: 1.5643, test_f1: 0.6515
 epoch: 93, train_loss: 0.3033, test_loss: 1.4620, test_f1: 0.6673
 epoch: 94, train_loss: 0.2858, test_loss: 1.6073, test_f1: 0.6332
 epoch: 95, train_loss: 0.3042, test_loss: 1.6219, test_f1: 0.6381
 epoch: 96, train_loss: 0.2913, test_loss: 1.4690, test_f1: 0.6532
 epoch: 97, train_loss: 0.2972, test_loss: 1.6178, test_f1: 0.6255
 epoch: 98, train_loss: 0.2982, test_loss: 1.5455, test_f1: 0.6552
 epoch: 99, train_loss: 0.2873, test_loss: 1.5644, test_f1: 0.6699
##################ITERATION #2 ****************************************
 epoch: 0, train_loss: 1.1926, test_loss: 1.0382, test_f1: 0.4456
 epoch: 1, train_loss: 1.0389, test_loss: 0.9935, test_f1: 0.4803
 epoch: 2, train_loss: 0.9787, test_loss: 0.9365, test_f1: 0.5238
 epoch: 3, train_loss: 0.9565, test_loss: 0.9539, test_f1: 0.5205
 epoch: 4, train_loss: 0.9324, test_loss: 0.9717, test_f1: 0.5095
 epoch: 5, train_loss: 0.9067, test_loss: 0.9578, test_f1: 0.5244
 epoch: 6, train_loss: 0.9077, test_loss: 0.9342, test_f1: 0.5534
 epoch: 7, train_loss: 0.8784, test_loss: 0.9540, test_f1: 0.5723
 epoch: 8, train_loss: 0.8753, test_loss: 0.9812, test_f1: 0.5658
 epoch: 9, train_loss: 0.8659, test_loss: 0.9485, test_f1: 0.5711
 epoch: 10, train_loss: 0.8450, test_loss: 0.9298, test_f1: 0.5523
 epoch: 11, train_loss: 0.8516, test_loss: 0.9213, test_f1: 0.5748
 epoch: 12, train_loss: 0.8356, test_loss: 0.8969, test_f1: 0.5988
 epoch: 13, train_loss: 0.8167, test_loss: 0.9140, test_f1: 0.5940
 epoch: 14, train_loss: 0.8036, test_loss: 0.9258, test_f1: 0.5622
 epoch: 15, train_loss: 0.8027, test_loss: 0.9537, test_f1: 0.6187
 epoch: 16, train_loss: 0.7979, test_loss: 0.9944, test_f1: 0.5675
 epoch: 17, train_loss: 0.7735, test_loss: 0.9416, test_f1: 0.6005
 epoch: 18, train_loss: 0.7737, test_loss: 0.9707, test_f1: 0.5584
 epoch: 19, train_loss: 0.7590, test_loss: 0.9472, test_f1: 0.5814
 epoch: 20, train_loss: 0.7561, test_loss: 0.9631, test_f1: 0.5508
 epoch: 21, train_loss: 0.7574, test_loss: 0.9319, test_f1: 0.5895
 epoch: 22, train_loss: 0.7524, test_loss: 0.9903, test_f1: 0.5821
 epoch: 23, train_loss: 0.7356, test_loss: 0.9471, test_f1: 0.5932
 epoch: 24, train_loss: 0.7325, test_loss: 0.9141, test_f1: 0.5957
 epoch: 25, train_loss: 0.7254, test_loss: 0.9258, test_f1: 0.6117
 epoch: 26, train_loss: 0.7239, test_loss: 1.0050, test_f1: 0.5738
 epoch: 27, train_loss: 0.7108, test_loss: 0.9745, test_f1: 0.6001
 epoch: 28, train_loss: 0.7042, test_loss: 0.9910, test_f1: 0.5848
 epoch: 29, train_loss: 0.6807, test_loss: 0.9808, test_f1: 0.6131
 epoch: 30, train_loss: 0.6866, test_loss: 0.9762, test_f1: 0.6270
 epoch: 31, train_loss: 0.6819, test_loss: 0.9319, test_f1: 0.6130
 epoch: 32, train_loss: 0.6932, test_loss: 0.9696, test_f1: 0.5866
 epoch: 33, train_loss: 0.6813, test_loss: 1.0089, test_f1: 0.6139
 epoch: 34, train_loss: 0.6699, test_loss: 1.0165, test_f1: 0.5803
 epoch: 35, train_loss: 0.6679, test_loss: 1.0009, test_f1: 0.5672
 epoch: 36, train_loss: 0.6607, test_loss: 1.0760, test_f1: 0.6017
 epoch: 37, train_loss: 0.6488, test_loss: 1.0576, test_f1: 0.6231
 epoch: 38, train_loss: 0.6617, test_loss: 0.9897, test_f1: 0.6215
 epoch: 39, train_loss: 0.6369, test_loss: 0.9987, test_f1: 0.5918
 epoch: 40, train_loss: 0.6514, test_loss: 0.9956, test_f1: 0.6060
 epoch: 41, train_loss: 0.6277, test_loss: 1.0008, test_f1: 0.6445
 epoch: 42, train_loss: 0.6023, test_loss: 0.9957, test_f1: 0.6117
 epoch: 43, train_loss: 0.6176, test_loss: 1.0633, test_f1: 0.6194
 epoch: 44, train_loss: 0.6129, test_loss: 0.9764, test_f1: 0.6286
 epoch: 45, train_loss: 0.6000, test_loss: 0.9600, test_f1: 0.6248
 epoch: 46, train_loss: 0.5815, test_loss: 1.0382, test_f1: 0.6319
 epoch: 47, train_loss: 0.5926, test_loss: 0.9853, test_f1: 0.5972
 epoch: 48, train_loss: 0.5952, test_loss: 1.0690, test_f1: 0.6076
 epoch: 49, train_loss: 0.5931, test_loss: 1.1389, test_f1: 0.6092
 epoch: 50, train_loss: 0.5589, test_loss: 1.1447, test_f1: 0.6174
 epoch: 51, train_loss: 0.5458, test_loss: 1.0586, test_f1: 0.6229
 epoch: 52, train_loss: 0.5226, test_loss: 1.0086, test_f1: 0.6358
 epoch: 53, train_loss: 0.4810, test_loss: 1.1257, test_f1: 0.6290
 epoch: 54, train_loss: 0.4910, test_loss: 1.2017, test_f1: 0.6459
 epoch: 55, train_loss: 0.4812, test_loss: 1.0627, test_f1: 0.6588
 epoch: 56, train_loss: 0.4885, test_loss: 1.1436, test_f1: 0.6445
 epoch: 57, train_loss: 0.4764, test_loss: 1.1327, test_f1: 0.6377
 epoch: 58, train_loss: 0.4889, test_loss: 1.1180, test_f1: 0.6544
 epoch: 59, train_loss: 0.4754, test_loss: 1.1440, test_f1: 0.6417
 epoch: 60, train_loss: 0.4727, test_loss: 1.1363, test_f1: 0.6395
 epoch: 61, train_loss: 0.4587, test_loss: 1.1717, test_f1: 0.6497
 epoch: 62, train_loss: 0.4603, test_loss: 1.1142, test_f1: 0.6763
 epoch: 63, train_loss: 0.4584, test_loss: 1.1967, test_f1: 0.6374
 epoch: 64, train_loss: 0.4461, test_loss: 1.1590, test_f1: 0.6451
 epoch: 65, train_loss: 0.4495, test_loss: 1.1861, test_f1: 0.6259
 epoch: 66, train_loss: 0.4358, test_loss: 1.2074, test_f1: 0.6398
 epoch: 67, train_loss: 0.4192, test_loss: 1.2618, test_f1: 0.6498
 epoch: 68, train_loss: 0.4210, test_loss: 1.1532, test_f1: 0.6417
 epoch: 69, train_loss: 0.4306, test_loss: 1.2187, test_f1: 0.6256
 epoch: 70, train_loss: 0.4195, test_loss: 1.2804, test_f1: 0.6065
 epoch: 71, train_loss: 0.4117, test_loss: 1.2565, test_f1: 0.6190
 epoch: 72, train_loss: 0.4002, test_loss: 1.2419, test_f1: 0.6423
 epoch: 73, train_loss: 0.3861, test_loss: 1.2152, test_f1: 0.6663
 epoch: 74, train_loss: 0.4154, test_loss: 1.2921, test_f1: 0.6554
 epoch: 75, train_loss: 0.4063, test_loss: 1.2775, test_f1: 0.6312
 epoch: 76, train_loss: 0.3894, test_loss: 1.2987, test_f1: 0.6604
 epoch: 77, train_loss: 0.3761, test_loss: 1.2488, test_f1: 0.6416
 epoch: 78, train_loss: 0.3832, test_loss: 1.2586, test_f1: 0.6594
 epoch: 79, train_loss: 0.3929, test_loss: 1.3196, test_f1: 0.6557
 epoch: 80, train_loss: 0.3775, test_loss: 1.4031, test_f1: 0.6224
 epoch: 81, train_loss: 0.3787, test_loss: 1.2783, test_f1: 0.6328
 epoch: 82, train_loss: 0.3961, test_loss: 1.2712, test_f1: 0.6566
 epoch: 83, train_loss: 0.3605, test_loss: 1.2943, test_f1: 0.6435
 epoch: 84, train_loss: 0.3517, test_loss: 1.3668, test_f1: 0.6335
 epoch: 85, train_loss: 0.3781, test_loss: 1.3096, test_f1: 0.6502
 epoch: 86, train_loss: 0.3649, test_loss: 1.3037, test_f1: 0.6858
 epoch: 87, train_loss: 0.3680, test_loss: 1.3581, test_f1: 0.6366
 epoch: 88, train_loss: 0.3453, test_loss: 1.3920, test_f1: 0.6367
 epoch: 89, train_loss: 0.3567, test_loss: 1.3841, test_f1: 0.6580
 epoch: 90, train_loss: 0.3382, test_loss: 1.3970, test_f1: 0.6598
 epoch: 91, train_loss: 0.3434, test_loss: 1.4393, test_f1: 0.6448
 epoch: 92, train_loss: 0.3354, test_loss: 1.3507, test_f1: 0.6558
 epoch: 93, train_loss: 0.3310, test_loss: 1.3920, test_f1: 0.6415
 epoch: 94, train_loss: 0.3439, test_loss: 1.4223, test_f1: 0.6749
 epoch: 95, train_loss: 0.3375, test_loss: 1.4579, test_f1: 0.6618
 epoch: 96, train_loss: 0.3326, test_loss: 1.4165, test_f1: 0.6649
 epoch: 97, train_loss: 0.3157, test_loss: 1.5036, test_f1: 0.6435
 epoch: 98, train_loss: 0.3214, test_loss: 1.4866, test_f1: 0.6448
 epoch: 99, train_loss: 0.3127, test_loss: 1.5038, test_f1: 0.6528
##################ITERATION #3 ****************************************
 epoch: 0, train_loss: 1.2452, test_loss: 1.0502, test_f1: 0.4975
 epoch: 1, train_loss: 1.0540, test_loss: 0.9496, test_f1: 0.5134
 epoch: 2, train_loss: 0.9932, test_loss: 0.9350, test_f1: 0.5248
 epoch: 3, train_loss: 0.9552, test_loss: 0.9423, test_f1: 0.5376
 epoch: 4, train_loss: 0.9372, test_loss: 0.9430, test_f1: 0.4777
 epoch: 5, train_loss: 0.9169, test_loss: 0.9835, test_f1: 0.5003
 epoch: 6, train_loss: 0.9025, test_loss: 0.9608, test_f1: 0.5194
 epoch: 7, train_loss: 0.8981, test_loss: 0.9303, test_f1: 0.5862
 epoch: 8, train_loss: 0.8785, test_loss: 0.8853, test_f1: 0.5556
 epoch: 9, train_loss: 0.8862, test_loss: 0.9141, test_f1: 0.5564
 epoch: 10, train_loss: 0.8686, test_loss: 0.9577, test_f1: 0.5531
 epoch: 11, train_loss: 0.8476, test_loss: 0.8960, test_f1: 0.5583
 epoch: 12, train_loss: 0.8469, test_loss: 0.9313, test_f1: 0.5205
 epoch: 13, train_loss: 0.8362, test_loss: 0.9437, test_f1: 0.5452
 epoch: 14, train_loss: 0.8224, test_loss: 0.9174, test_f1: 0.5506
 epoch: 15, train_loss: 0.8267, test_loss: 0.9573, test_f1: 0.5672
 epoch: 16, train_loss: 0.8232, test_loss: 0.9506, test_f1: 0.5559
 epoch: 17, train_loss: 0.8164, test_loss: 0.9684, test_f1: 0.5644
 epoch: 18, train_loss: 0.8085, test_loss: 0.9350, test_f1: 0.5619
 epoch: 19, train_loss: 0.7908, test_loss: 0.9372, test_f1: 0.5988
 epoch: 20, train_loss: 0.7826, test_loss: 0.9230, test_f1: 0.5843
 epoch: 21, train_loss: 0.7909, test_loss: 0.9642, test_f1: 0.5712
 epoch: 22, train_loss: 0.7616, test_loss: 0.9449, test_f1: 0.5680
 epoch: 23, train_loss: 0.7509, test_loss: 0.9002, test_f1: 0.6241
 epoch: 24, train_loss: 0.7654, test_loss: 0.9581, test_f1: 0.5923
 epoch: 25, train_loss: 0.7547, test_loss: 0.9433, test_f1: 0.5946
 epoch: 26, train_loss: 0.7470, test_loss: 0.9243, test_f1: 0.6071
 epoch: 27, train_loss: 0.7251, test_loss: 0.9176, test_f1: 0.5842
 epoch: 28, train_loss: 0.7119, test_loss: 1.0135, test_f1: 0.6343
 epoch: 29, train_loss: 0.7381, test_loss: 0.9024, test_f1: 0.6294
 epoch: 30, train_loss: 0.7084, test_loss: 0.9038, test_f1: 0.6408
 epoch: 31, train_loss: 0.7178, test_loss: 0.9064, test_f1: 0.6269
 epoch: 32, train_loss: 0.6846, test_loss: 0.9751, test_f1: 0.5990
 epoch: 33, train_loss: 0.6895, test_loss: 0.9195, test_f1: 0.6419
 epoch: 34, train_loss: 0.6775, test_loss: 1.0050, test_f1: 0.5965
 epoch: 35, train_loss: 0.6905, test_loss: 0.9545, test_f1: 0.6165
 epoch: 36, train_loss: 0.6827, test_loss: 0.9870, test_f1: 0.5696
 epoch: 37, train_loss: 0.6563, test_loss: 0.9233, test_f1: 0.6420
 epoch: 38, train_loss: 0.6467, test_loss: 0.9409, test_f1: 0.6259
 epoch: 39, train_loss: 0.6510, test_loss: 0.9579, test_f1: 0.6257
 epoch: 40, train_loss: 0.6468, test_loss: 0.9493, test_f1: 0.6145
 epoch: 41, train_loss: 0.6290, test_loss: 0.9777, test_f1: 0.6234
 epoch: 42, train_loss: 0.6229, test_loss: 0.9563, test_f1: 0.6154
 epoch: 43, train_loss: 0.6069, test_loss: 0.8843, test_f1: 0.6418
 epoch: 44, train_loss: 0.6302, test_loss: 0.9658, test_f1: 0.6583
 epoch: 45, train_loss: 0.5975, test_loss: 0.9260, test_f1: 0.6478
 epoch: 46, train_loss: 0.6237, test_loss: 0.9706, test_f1: 0.6306
 epoch: 47, train_loss: 0.5995, test_loss: 0.9878, test_f1: 0.6423
 epoch: 48, train_loss: 0.5906, test_loss: 0.9379, test_f1: 0.6613
 epoch: 49, train_loss: 0.5808, test_loss: 0.9856, test_f1: 0.6368
 epoch: 50, train_loss: 0.5659, test_loss: 1.0335, test_f1: 0.6527
 epoch: 51, train_loss: 0.5272, test_loss: 0.9634, test_f1: 0.6412
 epoch: 52, train_loss: 0.5042, test_loss: 0.9520, test_f1: 0.7026
 epoch: 53, train_loss: 0.5155, test_loss: 0.9500, test_f1: 0.6702
 epoch: 54, train_loss: 0.5160, test_loss: 1.0237, test_f1: 0.6703
 epoch: 55, train_loss: 0.4974, test_loss: 1.0509, test_f1: 0.6247
 epoch: 56, train_loss: 0.4895, test_loss: 1.0061, test_f1: 0.6516
 epoch: 57, train_loss: 0.4836, test_loss: 0.9964, test_f1: 0.6536
 epoch: 58, train_loss: 0.4729, test_loss: 1.0388, test_f1: 0.6748
 epoch: 59, train_loss: 0.4579, test_loss: 1.0547, test_f1: 0.6488
 epoch: 60, train_loss: 0.4537, test_loss: 1.0994, test_f1: 0.6535
 epoch: 61, train_loss: 0.4429, test_loss: 1.0699, test_f1: 0.6456
 epoch: 62, train_loss: 0.4540, test_loss: 1.0966, test_f1: 0.6704
 epoch: 63, train_loss: 0.4471, test_loss: 1.0914, test_f1: 0.6650
 epoch: 64, train_loss: 0.4358, test_loss: 1.1449, test_f1: 0.6590
 epoch: 65, train_loss: 0.4412, test_loss: 1.1551, test_f1: 0.6778
 epoch: 66, train_loss: 0.4404, test_loss: 1.1250, test_f1: 0.6326
 epoch: 67, train_loss: 0.4473, test_loss: 1.1309, test_f1: 0.6637
 epoch: 68, train_loss: 0.4387, test_loss: 1.0485, test_f1: 0.6664
 epoch: 69, train_loss: 0.4509, test_loss: 1.0911, test_f1: 0.6570
 epoch: 70, train_loss: 0.4221, test_loss: 1.1438, test_f1: 0.6629
 epoch: 71, train_loss: 0.4133, test_loss: 1.1954, test_f1: 0.6567
 epoch: 72, train_loss: 0.4085, test_loss: 1.0952, test_f1: 0.6786
 epoch: 73, train_loss: 0.4036, test_loss: 1.1511, test_f1: 0.6476
 epoch: 74, train_loss: 0.3940, test_loss: 1.2024, test_f1: 0.6648
 epoch: 75, train_loss: 0.4055, test_loss: 1.1486, test_f1: 0.6719
 epoch: 76, train_loss: 0.4061, test_loss: 1.1972, test_f1: 0.6500
 epoch: 77, train_loss: 0.4039, test_loss: 1.1582, test_f1: 0.6816
 epoch: 78, train_loss: 0.3836, test_loss: 1.2033, test_f1: 0.6542
 epoch: 79, train_loss: 0.3981, test_loss: 1.2184, test_f1: 0.6527
 epoch: 80, train_loss: 0.3853, test_loss: 1.1895, test_f1: 0.6538
 epoch: 81, train_loss: 0.3823, test_loss: 1.1683, test_f1: 0.6749
 epoch: 82, train_loss: 0.3809, test_loss: 1.1662, test_f1: 0.6806
 epoch: 83, train_loss: 0.3751, test_loss: 1.2251, test_f1: 0.6693
 epoch: 84, train_loss: 0.3757, test_loss: 1.2650, test_f1: 0.6762
 epoch: 85, train_loss: 0.3829, test_loss: 1.2379, test_f1: 0.6754
 epoch: 86, train_loss: 0.3813, test_loss: 1.2233, test_f1: 0.6401
 epoch: 87, train_loss: 0.3795, test_loss: 1.2276, test_f1: 0.6589
 epoch: 88, train_loss: 0.3437, test_loss: 1.2381, test_f1: 0.6653
 epoch: 89, train_loss: 0.3640, test_loss: 1.2931, test_f1: 0.6515
 epoch: 90, train_loss: 0.3535, test_loss: 1.2949, test_f1: 0.6585
 epoch: 91, train_loss: 0.3581, test_loss: 1.2125, test_f1: 0.6732
 epoch: 92, train_loss: 0.3480, test_loss: 1.1979, test_f1: 0.6586
 epoch: 93, train_loss: 0.3475, test_loss: 1.2759, test_f1: 0.6748
 epoch: 94, train_loss: 0.3594, test_loss: 1.3740, test_f1: 0.6495
 epoch: 95, train_loss: 0.3401, test_loss: 1.3614, test_f1: 0.6644
 epoch: 96, train_loss: 0.3482, test_loss: 1.3274, test_f1: 0.6424
 epoch: 97, train_loss: 0.3377, test_loss: 1.2941, test_f1: 0.6472
 epoch: 98, train_loss: 0.3336, test_loss: 1.2688, test_f1: 0.6331
 epoch: 99, train_loss: 0.3470, test_loss: 1.3109, test_f1: 0.6335
##################ITERATION #4 ****************************************
 epoch: 0, train_loss: 1.2720, test_loss: 1.0305, test_f1: 0.4787
 epoch: 1, train_loss: 1.0643, test_loss: 0.9489, test_f1: 0.4755
 epoch: 2, train_loss: 0.9928, test_loss: 0.9985, test_f1: 0.4679
 epoch: 3, train_loss: 0.9725, test_loss: 0.9310, test_f1: 0.5091
 epoch: 4, train_loss: 0.9465, test_loss: 1.0436, test_f1: 0.4446
 epoch: 5, train_loss: 0.9449, test_loss: 0.9238, test_f1: 0.5191
 epoch: 6, train_loss: 0.9155, test_loss: 0.9715, test_f1: 0.5112
 epoch: 7, train_loss: 0.8981, test_loss: 0.9745, test_f1: 0.4926
 epoch: 8, train_loss: 0.8842, test_loss: 0.9205, test_f1: 0.5432
 epoch: 9, train_loss: 0.8805, test_loss: 0.9519, test_f1: 0.5316
 epoch: 10, train_loss: 0.8541, test_loss: 0.9370, test_f1: 0.5410
 epoch: 11, train_loss: 0.8609, test_loss: 0.9448, test_f1: 0.5426
 epoch: 12, train_loss: 0.8557, test_loss: 0.9285, test_f1: 0.5457
 epoch: 13, train_loss: 0.8346, test_loss: 0.9848, test_f1: 0.5345
 epoch: 14, train_loss: 0.8333, test_loss: 0.9952, test_f1: 0.5642
 epoch: 15, train_loss: 0.8327, test_loss: 0.9350, test_f1: 0.5406
 epoch: 16, train_loss: 0.8251, test_loss: 0.9648, test_f1: 0.5376
 epoch: 17, train_loss: 0.8102, test_loss: 0.9939, test_f1: 0.5490
 epoch: 18, train_loss: 0.7979, test_loss: 0.9756, test_f1: 0.5581
 epoch: 19, train_loss: 0.7978, test_loss: 1.0151, test_f1: 0.5433
 epoch: 20, train_loss: 0.8107, test_loss: 0.9243, test_f1: 0.5724
 epoch: 21, train_loss: 0.7809, test_loss: 0.9669, test_f1: 0.5644
 epoch: 22, train_loss: 0.7848, test_loss: 0.9285, test_f1: 0.5578
 epoch: 23, train_loss: 0.7859, test_loss: 0.9560, test_f1: 0.5958
 epoch: 24, train_loss: 0.7554, test_loss: 0.9485, test_f1: 0.5646
 epoch: 25, train_loss: 0.7748, test_loss: 0.9443, test_f1: 0.5931
 epoch: 26, train_loss: 0.7689, test_loss: 0.9010, test_f1: 0.5555
 epoch: 27, train_loss: 0.7531, test_loss: 0.9064, test_f1: 0.5747
 epoch: 28, train_loss: 0.7540, test_loss: 0.9272, test_f1: 0.6190
 epoch: 29, train_loss: 0.7453, test_loss: 0.9695, test_f1: 0.5861
 epoch: 30, train_loss: 0.7478, test_loss: 0.9751, test_f1: 0.6165
 epoch: 31, train_loss: 0.7478, test_loss: 0.9378, test_f1: 0.5910
 epoch: 32, train_loss: 0.7228, test_loss: 0.9657, test_f1: 0.5966
 epoch: 33, train_loss: 0.7126, test_loss: 0.9035, test_f1: 0.6057
 epoch: 34, train_loss: 0.7223, test_loss: 0.8997, test_f1: 0.6031
 epoch: 35, train_loss: 0.7184, test_loss: 0.9322, test_f1: 0.5726
 epoch: 36, train_loss: 0.7181, test_loss: 0.8950, test_f1: 0.6003
 epoch: 37, train_loss: 0.6817, test_loss: 0.9424, test_f1: 0.6002
 epoch: 38, train_loss: 0.6831, test_loss: 0.9212, test_f1: 0.6339
 epoch: 39, train_loss: 0.7201, test_loss: 0.9219, test_f1: 0.6225
 epoch: 40, train_loss: 0.6948, test_loss: 0.9306, test_f1: 0.6328
 epoch: 41, train_loss: 0.6693, test_loss: 0.9257, test_f1: 0.6127
 epoch: 42, train_loss: 0.6645, test_loss: 0.9205, test_f1: 0.6460
 epoch: 43, train_loss: 0.6637, test_loss: 1.0021, test_f1: 0.6061
 epoch: 44, train_loss: 0.6596, test_loss: 0.9066, test_f1: 0.6170
 epoch: 45, train_loss: 0.6592, test_loss: 1.0060, test_f1: 0.6216
 epoch: 46, train_loss: 0.6489, test_loss: 1.0127, test_f1: 0.5914
 epoch: 47, train_loss: 0.6543, test_loss: 0.9949, test_f1: 0.6052
 epoch: 48, train_loss: 0.6346, test_loss: 0.9734, test_f1: 0.6394
 epoch: 49, train_loss: 0.6494, test_loss: 1.1606, test_f1: 0.5655
 epoch: 50, train_loss: 0.6362, test_loss: 0.9826, test_f1: 0.6036
 epoch: 51, train_loss: 0.5898, test_loss: 0.9638, test_f1: 0.6443
 epoch: 52, train_loss: 0.5697, test_loss: 0.9374, test_f1: 0.6368
 epoch: 53, train_loss: 0.5631, test_loss: 1.0063, test_f1: 0.6464
 epoch: 54, train_loss: 0.5643, test_loss: 1.0003, test_f1: 0.6235
 epoch: 55, train_loss: 0.5542, test_loss: 1.0019, test_f1: 0.6570
 epoch: 56, train_loss: 0.5390, test_loss: 1.0535, test_f1: 0.6382
 epoch: 57, train_loss: 0.5292, test_loss: 1.0820, test_f1: 0.6237
 epoch: 58, train_loss: 0.5272, test_loss: 1.0318, test_f1: 0.6340
 epoch: 59, train_loss: 0.5160, test_loss: 1.0444, test_f1: 0.6361
 epoch: 60, train_loss: 0.5101, test_loss: 1.0793, test_f1: 0.6481
 epoch: 61, train_loss: 0.5214, test_loss: 1.1050, test_f1: 0.6259
 epoch: 62, train_loss: 0.5150, test_loss: 1.0624, test_f1: 0.6558
 epoch: 63, train_loss: 0.5157, test_loss: 1.0288, test_f1: 0.6689
 epoch: 64, train_loss: 0.5099, test_loss: 1.1212, test_f1: 0.6357
 epoch: 65, train_loss: 0.4972, test_loss: 1.0530, test_f1: 0.6337
 epoch: 66, train_loss: 0.4999, test_loss: 1.0898, test_f1: 0.6114
 epoch: 67, train_loss: 0.4873, test_loss: 1.1053, test_f1: 0.6300
 epoch: 68, train_loss: 0.4777, test_loss: 1.0645, test_f1: 0.6540
 epoch: 69, train_loss: 0.4856, test_loss: 1.1014, test_f1: 0.6184
 epoch: 70, train_loss: 0.4597, test_loss: 1.2198, test_f1: 0.6284
 epoch: 71, train_loss: 0.4732, test_loss: 1.0576, test_f1: 0.6473
 epoch: 72, train_loss: 0.4574, test_loss: 1.0542, test_f1: 0.6498
 epoch: 73, train_loss: 0.4616, test_loss: 1.1729, test_f1: 0.6055
 epoch: 74, train_loss: 0.4687, test_loss: 1.0179, test_f1: 0.6332
 epoch: 75, train_loss: 0.4659, test_loss: 1.0318, test_f1: 0.6607
 epoch: 76, train_loss: 0.4520, test_loss: 1.0392, test_f1: 0.6516
 epoch: 77, train_loss: 0.4485, test_loss: 1.0622, test_f1: 0.6487
 epoch: 78, train_loss: 0.4483, test_loss: 1.1124, test_f1: 0.6564
 epoch: 79, train_loss: 0.4375, test_loss: 1.2116, test_f1: 0.6466
 epoch: 80, train_loss: 0.4407, test_loss: 1.1116, test_f1: 0.6547
 epoch: 81, train_loss: 0.4509, test_loss: 1.0900, test_f1: 0.6550
 epoch: 82, train_loss: 0.4434, test_loss: 1.0384, test_f1: 0.6468
 epoch: 83, train_loss: 0.4305, test_loss: 1.1114, test_f1: 0.6507
 epoch: 84, train_loss: 0.4308, test_loss: 1.1084, test_f1: 0.6326
 epoch: 85, train_loss: 0.4359, test_loss: 1.0975, test_f1: 0.6490
 epoch: 86, train_loss: 0.4253, test_loss: 1.0696, test_f1: 0.6758
 epoch: 87, train_loss: 0.4227, test_loss: 1.1571, test_f1: 0.6420
 epoch: 88, train_loss: 0.4046, test_loss: 1.0962, test_f1: 0.6713
 epoch: 89, train_loss: 0.4076, test_loss: 1.2335, test_f1: 0.6353
 epoch: 90, train_loss: 0.4005, test_loss: 1.1654, test_f1: 0.6389
 epoch: 91, train_loss: 0.4118, test_loss: 1.2121, test_f1: 0.6448
 epoch: 92, train_loss: 0.3845, test_loss: 1.1686, test_f1: 0.6793
 epoch: 93, train_loss: 0.3995, test_loss: 1.1216, test_f1: 0.6509
 epoch: 94, train_loss: 0.3908, test_loss: 1.1708, test_f1: 0.6457
 epoch: 95, train_loss: 0.3823, test_loss: 1.2063, test_f1: 0.6347
 epoch: 96, train_loss: 0.3915, test_loss: 1.2734, test_f1: 0.6427
 epoch: 97, train_loss: 0.3944, test_loss: 1.2163, test_f1: 0.6303
 epoch: 98, train_loss: 0.3826, test_loss: 1.2088, test_f1: 0.6742
 epoch: 99, train_loss: 0.3898, test_loss: 1.2473, test_f1: 0.6468
##################ITERATION #5 ****************************************
 epoch: 0, train_loss: 1.2746, test_loss: 1.0222, test_f1: 0.4280
 epoch: 1, train_loss: 1.0319, test_loss: 0.9633, test_f1: 0.4915
 epoch: 2, train_loss: 0.9832, test_loss: 0.9384, test_f1: 0.5151
 epoch: 3, train_loss: 0.9658, test_loss: 0.9780, test_f1: 0.4853
 epoch: 4, train_loss: 0.9373, test_loss: 0.9424, test_f1: 0.5190
 epoch: 5, train_loss: 0.9392, test_loss: 0.9662, test_f1: 0.4910
 epoch: 6, train_loss: 0.9100, test_loss: 0.9347, test_f1: 0.5201
 epoch: 7, train_loss: 0.8934, test_loss: 0.9204, test_f1: 0.5343
 epoch: 8, train_loss: 0.8807, test_loss: 0.9454, test_f1: 0.5385
 epoch: 9, train_loss: 0.8785, test_loss: 0.9632, test_f1: 0.5446
 epoch: 10, train_loss: 0.8631, test_loss: 0.9331, test_f1: 0.5048
 epoch: 11, train_loss: 0.8602, test_loss: 0.9460, test_f1: 0.5571
 epoch: 12, train_loss: 0.8419, test_loss: 0.9816, test_f1: 0.5443
 epoch: 13, train_loss: 0.8354, test_loss: 0.9408, test_f1: 0.5907
 epoch: 14, train_loss: 0.8235, test_loss: 0.9440, test_f1: 0.5553
 epoch: 15, train_loss: 0.8175, test_loss: 0.9700, test_f1: 0.5325
 epoch: 16, train_loss: 0.8074, test_loss: 0.9177, test_f1: 0.5621
 epoch: 17, train_loss: 0.8060, test_loss: 0.9448, test_f1: 0.5592
 epoch: 18, train_loss: 0.7903, test_loss: 0.9660, test_f1: 0.5534
 epoch: 19, train_loss: 0.7844, test_loss: 0.9365, test_f1: 0.5887
 epoch: 20, train_loss: 0.7889, test_loss: 0.9323, test_f1: 0.6070
 epoch: 21, train_loss: 0.7638, test_loss: 0.9460, test_f1: 0.5892
 epoch: 22, train_loss: 0.7687, test_loss: 0.8972, test_f1: 0.6000
 epoch: 23, train_loss: 0.7607, test_loss: 0.9407, test_f1: 0.5860
 epoch: 24, train_loss: 0.7619, test_loss: 0.9318, test_f1: 0.5886
 epoch: 25, train_loss: 0.7483, test_loss: 0.9157, test_f1: 0.5937
 epoch: 26, train_loss: 0.7355, test_loss: 0.9787, test_f1: 0.5993
 epoch: 27, train_loss: 0.7273, test_loss: 0.9194, test_f1: 0.6218
 epoch: 28, train_loss: 0.7279, test_loss: 0.9172, test_f1: 0.6355
 epoch: 29, train_loss: 0.7159, test_loss: 0.9964, test_f1: 0.5714
 epoch: 30, train_loss: 0.7094, test_loss: 0.9494, test_f1: 0.6190
 epoch: 31, train_loss: 0.7074, test_loss: 0.9306, test_f1: 0.5955
 epoch: 32, train_loss: 0.7120, test_loss: 0.9612, test_f1: 0.5982
 epoch: 33, train_loss: 0.7045, test_loss: 0.9957, test_f1: 0.6071
 epoch: 34, train_loss: 0.6955, test_loss: 0.9432, test_f1: 0.6099
 epoch: 35, train_loss: 0.6937, test_loss: 0.9266, test_f1: 0.6128
 epoch: 36, train_loss: 0.6860, test_loss: 0.9254, test_f1: 0.6220
 epoch: 37, train_loss: 0.6697, test_loss: 0.9252, test_f1: 0.5949
 epoch: 38, train_loss: 0.6673, test_loss: 0.9667, test_f1: 0.6356
 epoch: 39, train_loss: 0.6623, test_loss: 0.9775, test_f1: 0.6194
 epoch: 40, train_loss: 0.6481, test_loss: 0.9820, test_f1: 0.6256
 epoch: 41, train_loss: 0.6470, test_loss: 0.9890, test_f1: 0.6209
 epoch: 42, train_loss: 0.6398, test_loss: 0.9426, test_f1: 0.6277
 epoch: 43, train_loss: 0.6422, test_loss: 1.0018, test_f1: 0.6329
 epoch: 44, train_loss: 0.6433, test_loss: 1.0427, test_f1: 0.6101
 epoch: 45, train_loss: 0.6508, test_loss: 0.9548, test_f1: 0.6106
 epoch: 46, train_loss: 0.6033, test_loss: 1.0149, test_f1: 0.6110
 epoch: 47, train_loss: 0.5962, test_loss: 1.0314, test_f1: 0.6391
 epoch: 48, train_loss: 0.6118, test_loss: 0.9878, test_f1: 0.6233
 epoch: 49, train_loss: 0.5936, test_loss: 1.0962, test_f1: 0.6042
 epoch: 50, train_loss: 0.5836, test_loss: 1.0217, test_f1: 0.5988
 epoch: 51, train_loss: 0.5738, test_loss: 0.9773, test_f1: 0.6407
 epoch: 52, train_loss: 0.5491, test_loss: 1.0308, test_f1: 0.6297
 epoch: 53, train_loss: 0.5368, test_loss: 1.0106, test_f1: 0.6523
 epoch: 54, train_loss: 0.4996, test_loss: 1.0140, test_f1: 0.6684
 epoch: 55, train_loss: 0.5016, test_loss: 1.0683, test_f1: 0.6462
 epoch: 56, train_loss: 0.5175, test_loss: 1.0900, test_f1: 0.6148
 epoch: 57, train_loss: 0.5016, test_loss: 1.0410, test_f1: 0.6577
 epoch: 58, train_loss: 0.4961, test_loss: 1.0666, test_f1: 0.6233
 epoch: 59, train_loss: 0.4970, test_loss: 1.1157, test_f1: 0.6703
 epoch: 60, train_loss: 0.4953, test_loss: 1.0046, test_f1: 0.6522
 epoch: 61, train_loss: 0.4808, test_loss: 1.0243, test_f1: 0.6473
 epoch: 62, train_loss: 0.4702, test_loss: 1.0021, test_f1: 0.6843
 epoch: 63, train_loss: 0.4778, test_loss: 1.1099, test_f1: 0.6578
 epoch: 64, train_loss: 0.4567, test_loss: 1.0371, test_f1: 0.6483
 epoch: 65, train_loss: 0.4485, test_loss: 1.0568, test_f1: 0.6637
 epoch: 66, train_loss: 0.4354, test_loss: 1.0604, test_f1: 0.6694
 epoch: 67, train_loss: 0.4414, test_loss: 1.1342, test_f1: 0.6598
 epoch: 68, train_loss: 0.4564, test_loss: 1.1132, test_f1: 0.6229
 epoch: 69, train_loss: 0.4213, test_loss: 1.1819, test_f1: 0.6622
 epoch: 70, train_loss: 0.4459, test_loss: 1.1509, test_f1: 0.6483
 epoch: 71, train_loss: 0.4405, test_loss: 1.1586, test_f1: 0.6527
 epoch: 72, train_loss: 0.4331, test_loss: 1.1785, test_f1: 0.6559
 epoch: 73, train_loss: 0.4358, test_loss: 1.1423, test_f1: 0.6238
 epoch: 74, train_loss: 0.4351, test_loss: 1.1513, test_f1: 0.6447
 epoch: 75, train_loss: 0.4196, test_loss: 1.1463, test_f1: 0.6496
 epoch: 76, train_loss: 0.4227, test_loss: 1.1893, test_f1: 0.6553
 epoch: 77, train_loss: 0.3972, test_loss: 1.2785, test_f1: 0.6514
 epoch: 78, train_loss: 0.4131, test_loss: 1.1583, test_f1: 0.6540
 epoch: 79, train_loss: 0.4000, test_loss: 1.1564, test_f1: 0.6644
 epoch: 80, train_loss: 0.4045, test_loss: 1.2284, test_f1: 0.6636
 epoch: 81, train_loss: 0.3814, test_loss: 1.2022, test_f1: 0.6644
 epoch: 82, train_loss: 0.4016, test_loss: 1.2187, test_f1: 0.6426
 epoch: 83, train_loss: 0.4006, test_loss: 1.2608, test_f1: 0.6436
 epoch: 84, train_loss: 0.3919, test_loss: 1.2522, test_f1: 0.6375
 epoch: 85, train_loss: 0.3810, test_loss: 1.2736, test_f1: 0.6881
 epoch: 86, train_loss: 0.3593, test_loss: 1.2589, test_f1: 0.6620
 epoch: 87, train_loss: 0.3629, test_loss: 1.3392, test_f1: 0.6575
 epoch: 88, train_loss: 0.3862, test_loss: 1.2777, test_f1: 0.6540
 epoch: 89, train_loss: 0.3703, test_loss: 1.2847, test_f1: 0.6832
 epoch: 90, train_loss: 0.3690, test_loss: 1.2636, test_f1: 0.6544
 epoch: 91, train_loss: 0.3654, test_loss: 1.3696, test_f1: 0.6548
 epoch: 92, train_loss: 0.3583, test_loss: 1.3499, test_f1: 0.6588
 epoch: 93, train_loss: 0.3631, test_loss: 1.4199, test_f1: 0.6390
 epoch: 94, train_loss: 0.3612, test_loss: 1.4041, test_f1: 0.6366
 epoch: 95, train_loss: 0.3649, test_loss: 1.2838, test_f1: 0.6699
 epoch: 96, train_loss: 0.3516, test_loss: 1.3393, test_f1: 0.6622
 epoch: 97, train_loss: 0.3395, test_loss: 1.3518, test_f1: 0.6509
 epoch: 98, train_loss: 0.3534, test_loss: 1.4483, test_f1: 0.6527
 epoch: 99, train_loss: 0.3331, test_loss: 1.2356, test_f1: 0.6742
##################ITERATION #6 ****************************************
 epoch: 0, train_loss: 1.3547, test_loss: 1.0895, test_f1: 0.4893
 epoch: 1, train_loss: 1.0443, test_loss: 0.9926, test_f1: 0.4874
 epoch: 2, train_loss: 0.9994, test_loss: 0.9523, test_f1: 0.5026
 epoch: 3, train_loss: 0.9705, test_loss: 0.9430, test_f1: 0.5205
 epoch: 4, train_loss: 0.9545, test_loss: 0.9364, test_f1: 0.4717
 epoch: 5, train_loss: 0.9368, test_loss: 0.9537, test_f1: 0.5299
 epoch: 6, train_loss: 0.9191, test_loss: 0.9068, test_f1: 0.5363
 epoch: 7, train_loss: 0.9255, test_loss: 0.9437, test_f1: 0.4812
 epoch: 8, train_loss: 0.8966, test_loss: 0.9458, test_f1: 0.5412
 epoch: 9, train_loss: 0.9028, test_loss: 0.9344, test_f1: 0.5361
 epoch: 10, train_loss: 0.8773, test_loss: 0.9396, test_f1: 0.5309
 epoch: 11, train_loss: 0.8739, test_loss: 0.9290, test_f1: 0.5407
 epoch: 12, train_loss: 0.8609, test_loss: 0.9379, test_f1: 0.5346
 epoch: 13, train_loss: 0.8529, test_loss: 0.9732, test_f1: 0.5521
 epoch: 14, train_loss: 0.8191, test_loss: 0.9588, test_f1: 0.5698
 epoch: 15, train_loss: 0.8326, test_loss: 0.9032, test_f1: 0.5979
 epoch: 16, train_loss: 0.8317, test_loss: 0.9687, test_f1: 0.5740
 epoch: 17, train_loss: 0.8038, test_loss: 0.9313, test_f1: 0.5737
 epoch: 18, train_loss: 0.8122, test_loss: 0.9423, test_f1: 0.5753
 epoch: 19, train_loss: 0.7871, test_loss: 0.9752, test_f1: 0.5613
 epoch: 20, train_loss: 0.7969, test_loss: 0.9252, test_f1: 0.5967
 epoch: 21, train_loss: 0.7718, test_loss: 0.9441, test_f1: 0.5572
 epoch: 22, train_loss: 0.7755, test_loss: 0.9539, test_f1: 0.5869
 epoch: 23, train_loss: 0.7838, test_loss: 0.9799, test_f1: 0.5838
 epoch: 24, train_loss: 0.7700, test_loss: 0.9671, test_f1: 0.5733
 epoch: 25, train_loss: 0.7620, test_loss: 0.9913, test_f1: 0.5914
 epoch: 26, train_loss: 0.7505, test_loss: 0.9896, test_f1: 0.5581
 epoch: 27, train_loss: 0.7460, test_loss: 1.0040, test_f1: 0.5820
 epoch: 28, train_loss: 0.7497, test_loss: 0.9467, test_f1: 0.5797
 epoch: 29, train_loss: 0.7468, test_loss: 0.9953, test_f1: 0.5865
 epoch: 30, train_loss: 0.7042, test_loss: 0.9664, test_f1: 0.5655
 epoch: 31, train_loss: 0.7383, test_loss: 0.9668, test_f1: 0.5832
 epoch: 32, train_loss: 0.7070, test_loss: 0.9290, test_f1: 0.5855
 epoch: 33, train_loss: 0.7132, test_loss: 0.9753, test_f1: 0.6130
 epoch: 34, train_loss: 0.7081, test_loss: 0.9859, test_f1: 0.5893
 epoch: 35, train_loss: 0.6857, test_loss: 0.9895, test_f1: 0.5975
 epoch: 36, train_loss: 0.6951, test_loss: 0.9946, test_f1: 0.5914
 epoch: 37, train_loss: 0.6811, test_loss: 1.0105, test_f1: 0.5596
 epoch: 38, train_loss: 0.6814, test_loss: 0.9794, test_f1: 0.6109
 epoch: 39, train_loss: 0.6709, test_loss: 1.0094, test_f1: 0.5766
 epoch: 40, train_loss: 0.6581, test_loss: 0.9619, test_f1: 0.6242
 epoch: 41, train_loss: 0.6846, test_loss: 0.9657, test_f1: 0.6023
 epoch: 42, train_loss: 0.6572, test_loss: 0.9476, test_f1: 0.6092
 epoch: 43, train_loss: 0.6512, test_loss: 0.9518, test_f1: 0.6171
 epoch: 44, train_loss: 0.6388, test_loss: 1.0224, test_f1: 0.6166
 epoch: 45, train_loss: 0.6588, test_loss: 0.9592, test_f1: 0.6202
 epoch: 46, train_loss: 0.6175, test_loss: 0.9708, test_f1: 0.6483
 epoch: 47, train_loss: 0.6138, test_loss: 0.9786, test_f1: 0.6371
 epoch: 48, train_loss: 0.6216, test_loss: 0.9914, test_f1: 0.6183
 epoch: 49, train_loss: 0.6125, test_loss: 1.0053, test_f1: 0.6157
 epoch: 50, train_loss: 0.6157, test_loss: 0.9637, test_f1: 0.6077
 epoch: 51, train_loss: 0.5820, test_loss: 0.9616, test_f1: 0.6422
 epoch: 52, train_loss: 0.5705, test_loss: 0.9921, test_f1: 0.6429
 epoch: 53, train_loss: 0.5498, test_loss: 1.0141, test_f1: 0.6381
 epoch: 54, train_loss: 0.5442, test_loss: 1.0179, test_f1: 0.6366
 epoch: 55, train_loss: 0.5354, test_loss: 0.9960, test_f1: 0.6623
 epoch: 56, train_loss: 0.5159, test_loss: 1.0333, test_f1: 0.6469
 epoch: 57, train_loss: 0.5213, test_loss: 1.0265, test_f1: 0.6642
 epoch: 58, train_loss: 0.5061, test_loss: 1.0277, test_f1: 0.6485
 epoch: 59, train_loss: 0.4999, test_loss: 1.0016, test_f1: 0.6541
 epoch: 60, train_loss: 0.5091, test_loss: 1.0212, test_f1: 0.6585
 epoch: 61, train_loss: 0.5174, test_loss: 1.0616, test_f1: 0.6701
 epoch: 62, train_loss: 0.4962, test_loss: 1.0306, test_f1: 0.6581
 epoch: 63, train_loss: 0.4841, test_loss: 1.0372, test_f1: 0.6516
 epoch: 64, train_loss: 0.4742, test_loss: 1.0552, test_f1: 0.6408
 epoch: 65, train_loss: 0.4900, test_loss: 1.1140, test_f1: 0.6393
 epoch: 66, train_loss: 0.4686, test_loss: 1.1556, test_f1: 0.6292
 epoch: 67, train_loss: 0.4825, test_loss: 1.0983, test_f1: 0.6404
 epoch: 68, train_loss: 0.4761, test_loss: 1.1199, test_f1: 0.6177
 epoch: 69, train_loss: 0.4661, test_loss: 1.1016, test_f1: 0.6547
 epoch: 70, train_loss: 0.4650, test_loss: 1.0772, test_f1: 0.6641
 epoch: 71, train_loss: 0.4687, test_loss: 1.0953, test_f1: 0.6448
 epoch: 72, train_loss: 0.4501, test_loss: 1.0944, test_f1: 0.6506
 epoch: 73, train_loss: 0.4536, test_loss: 1.1838, test_f1: 0.6355
 epoch: 74, train_loss: 0.4384, test_loss: 1.1760, test_f1: 0.6654
 epoch: 75, train_loss: 0.4477, test_loss: 1.1458, test_f1: 0.6474
 epoch: 76, train_loss: 0.4286, test_loss: 1.0730, test_f1: 0.6577
 epoch: 77, train_loss: 0.4346, test_loss: 1.1091, test_f1: 0.6324
 epoch: 78, train_loss: 0.4201, test_loss: 1.2046, test_f1: 0.6487
 epoch: 79, train_loss: 0.4344, test_loss: 1.1187, test_f1: 0.6705
 epoch: 80, train_loss: 0.4092, test_loss: 1.2019, test_f1: 0.6248
 epoch: 81, train_loss: 0.4064, test_loss: 1.1828, test_f1: 0.6420
 epoch: 82, train_loss: 0.4099, test_loss: 1.1448, test_f1: 0.6692
 epoch: 83, train_loss: 0.4113, test_loss: 1.1795, test_f1: 0.6737
 epoch: 84, train_loss: 0.4113, test_loss: 1.1999, test_f1: 0.6333
 epoch: 85, train_loss: 0.4158, test_loss: 1.2008, test_f1: 0.6483
 epoch: 86, train_loss: 0.4139, test_loss: 1.2084, test_f1: 0.6384
 epoch: 87, train_loss: 0.3926, test_loss: 1.2597, test_f1: 0.6403
 epoch: 88, train_loss: 0.4065, test_loss: 1.2012, test_f1: 0.6440
 epoch: 89, train_loss: 0.4090, test_loss: 1.2313, test_f1: 0.6399
 epoch: 90, train_loss: 0.3727, test_loss: 1.2460, test_f1: 0.6185
 epoch: 91, train_loss: 0.4102, test_loss: 1.4132, test_f1: 0.6217
 epoch: 92, train_loss: 0.3833, test_loss: 1.2809, test_f1: 0.6343
 epoch: 93, train_loss: 0.3831, test_loss: 1.2859, test_f1: 0.6441
 epoch: 94, train_loss: 0.3729, test_loss: 1.3021, test_f1: 0.6329
 epoch: 95, train_loss: 0.3723, test_loss: 1.3322, test_f1: 0.6349
 epoch: 96, train_loss: 0.3692, test_loss: 1.3101, test_f1: 0.6430
 epoch: 97, train_loss: 0.3566, test_loss: 1.3128, test_f1: 0.6616
 epoch: 98, train_loss: 0.3633, test_loss: 1.3943, test_f1: 0.6340
 epoch: 99, train_loss: 0.3579, test_loss: 1.2963, test_f1: 0.6395
##################ITERATION #7 ****************************************
 epoch: 0, train_loss: 1.3095, test_loss: 1.1003, test_f1: 0.4324
 epoch: 1, train_loss: 1.0378, test_loss: 0.9318, test_f1: 0.4791
 epoch: 2, train_loss: 0.9989, test_loss: 0.9334, test_f1: 0.5001
 epoch: 3, train_loss: 0.9660, test_loss: 0.9596, test_f1: 0.5011
 epoch: 4, train_loss: 0.9319, test_loss: 0.9385, test_f1: 0.5119
 epoch: 5, train_loss: 0.9264, test_loss: 0.9171, test_f1: 0.5201
 epoch: 6, train_loss: 0.9060, test_loss: 0.9405, test_f1: 0.5195
 epoch: 7, train_loss: 0.8999, test_loss: 0.9425, test_f1: 0.5453
 epoch: 8, train_loss: 0.8805, test_loss: 0.9322, test_f1: 0.5365
 epoch: 9, train_loss: 0.8620, test_loss: 0.9195, test_f1: 0.5644
 epoch: 10, train_loss: 0.8414, test_loss: 0.9161, test_f1: 0.5790
 epoch: 11, train_loss: 0.8493, test_loss: 0.9725, test_f1: 0.5407
 epoch: 12, train_loss: 0.8446, test_loss: 0.9373, test_f1: 0.5664
 epoch: 13, train_loss: 0.8216, test_loss: 0.9411, test_f1: 0.5531
 epoch: 14, train_loss: 0.8004, test_loss: 0.9199, test_f1: 0.5703
 epoch: 15, train_loss: 0.8107, test_loss: 0.9509, test_f1: 0.5640
 epoch: 16, train_loss: 0.8045, test_loss: 0.9599, test_f1: 0.5514
 epoch: 17, train_loss: 0.7954, test_loss: 0.9576, test_f1: 0.5879
 epoch: 18, train_loss: 0.7844, test_loss: 0.9278, test_f1: 0.5891
 epoch: 19, train_loss: 0.7837, test_loss: 0.8787, test_f1: 0.5780
 epoch: 20, train_loss: 0.7750, test_loss: 0.9087, test_f1: 0.5978
 epoch: 21, train_loss: 0.7787, test_loss: 0.9525, test_f1: 0.5953
 epoch: 22, train_loss: 0.7607, test_loss: 0.9332, test_f1: 0.6067
 epoch: 23, train_loss: 0.7486, test_loss: 0.9745, test_f1: 0.5785
 epoch: 24, train_loss: 0.7449, test_loss: 0.9426, test_f1: 0.6140
 epoch: 25, train_loss: 0.7314, test_loss: 0.9564, test_f1: 0.5903
 epoch: 26, train_loss: 0.7406, test_loss: 0.9651, test_f1: 0.5965
 epoch: 27, train_loss: 0.7290, test_loss: 0.9290, test_f1: 0.6173
 epoch: 28, train_loss: 0.7147, test_loss: 0.9228, test_f1: 0.5874
 epoch: 29, train_loss: 0.7084, test_loss: 0.9498, test_f1: 0.6077
 epoch: 30, train_loss: 0.7176, test_loss: 0.9456, test_f1: 0.6013
 epoch: 31, train_loss: 0.6982, test_loss: 0.9207, test_f1: 0.6083
 epoch: 32, train_loss: 0.6934, test_loss: 0.9468, test_f1: 0.6028
 epoch: 33, train_loss: 0.6791, test_loss: 0.9279, test_f1: 0.6170
 epoch: 34, train_loss: 0.6895, test_loss: 0.9873, test_f1: 0.6003
 epoch: 35, train_loss: 0.6802, test_loss: 1.0711, test_f1: 0.5939
 epoch: 36, train_loss: 0.6735, test_loss: 0.9310, test_f1: 0.6638
 epoch: 37, train_loss: 0.6664, test_loss: 0.9830, test_f1: 0.5815
 epoch: 38, train_loss: 0.6600, test_loss: 0.9697, test_f1: 0.5938
 epoch: 39, train_loss: 0.6530, test_loss: 0.8988, test_f1: 0.6226
 epoch: 40, train_loss: 0.6610, test_loss: 0.9591, test_f1: 0.6340
 epoch: 41, train_loss: 0.6514, test_loss: 0.9329, test_f1: 0.6191
 epoch: 42, train_loss: 0.6372, test_loss: 0.9195, test_f1: 0.6364
 epoch: 43, train_loss: 0.6416, test_loss: 1.0058, test_f1: 0.6175
 epoch: 44, train_loss: 0.6331, test_loss: 0.9307, test_f1: 0.6140
 epoch: 45, train_loss: 0.6090, test_loss: 0.9127, test_f1: 0.6081
 epoch: 46, train_loss: 0.6132, test_loss: 0.9412, test_f1: 0.6613
 epoch: 47, train_loss: 0.6012, test_loss: 0.9378, test_f1: 0.6426
 epoch: 48, train_loss: 0.6149, test_loss: 0.9232, test_f1: 0.6635
 epoch: 49, train_loss: 0.6085, test_loss: 0.9023, test_f1: 0.6508
 epoch: 50, train_loss: 0.6018, test_loss: 0.9478, test_f1: 0.6652
 epoch: 51, train_loss: 0.5572, test_loss: 0.9265, test_f1: 0.6431
 epoch: 52, train_loss: 0.5437, test_loss: 0.9636, test_f1: 0.6690
 epoch: 53, train_loss: 0.5215, test_loss: 0.9390, test_f1: 0.6507
 epoch: 54, train_loss: 0.5185, test_loss: 0.9493, test_f1: 0.6779
 epoch: 55, train_loss: 0.5173, test_loss: 0.9586, test_f1: 0.6694
 epoch: 56, train_loss: 0.5132, test_loss: 0.9669, test_f1: 0.6594
 epoch: 57, train_loss: 0.5019, test_loss: 0.9578, test_f1: 0.6544
 epoch: 58, train_loss: 0.4891, test_loss: 0.9613, test_f1: 0.6751
 epoch: 59, train_loss: 0.4908, test_loss: 0.9692, test_f1: 0.6693
 epoch: 60, train_loss: 0.4949, test_loss: 1.0245, test_f1: 0.6727
 epoch: 61, train_loss: 0.4861, test_loss: 1.0217, test_f1: 0.6571
 epoch: 62, train_loss: 0.4805, test_loss: 1.0475, test_f1: 0.6535
 epoch: 63, train_loss: 0.4912, test_loss: 1.0366, test_f1: 0.6573
 epoch: 64, train_loss: 0.4701, test_loss: 1.0546, test_f1: 0.6430
 epoch: 65, train_loss: 0.4712, test_loss: 1.0428, test_f1: 0.6419
 epoch: 66, train_loss: 0.4676, test_loss: 1.0665, test_f1: 0.6601
 epoch: 67, train_loss: 0.4699, test_loss: 1.0690, test_f1: 0.6710
 epoch: 68, train_loss: 0.4473, test_loss: 1.0438, test_f1: 0.6631
 epoch: 69, train_loss: 0.4507, test_loss: 1.0461, test_f1: 0.6573
 epoch: 70, train_loss: 0.4456, test_loss: 1.0819, test_f1: 0.6771
 epoch: 71, train_loss: 0.4521, test_loss: 1.1452, test_f1: 0.6580
 epoch: 72, train_loss: 0.4201, test_loss: 1.1283, test_f1: 0.6733
 epoch: 73, train_loss: 0.4233, test_loss: 1.1195, test_f1: 0.6715
 epoch: 74, train_loss: 0.4356, test_loss: 1.0845, test_f1: 0.6723
 epoch: 75, train_loss: 0.4335, test_loss: 1.2398, test_f1: 0.6423
 epoch: 76, train_loss: 0.4309, test_loss: 1.0827, test_f1: 0.6790
 epoch: 77, train_loss: 0.4166, test_loss: 1.0717, test_f1: 0.6763
 epoch: 78, train_loss: 0.4235, test_loss: 1.1211, test_f1: 0.6678
 epoch: 79, train_loss: 0.4189, test_loss: 1.2427, test_f1: 0.6478
 epoch: 80, train_loss: 0.4060, test_loss: 1.1311, test_f1: 0.6649
 epoch: 81, train_loss: 0.3947, test_loss: 1.2766, test_f1: 0.6662
 epoch: 82, train_loss: 0.4029, test_loss: 1.1924, test_f1: 0.6519
 epoch: 83, train_loss: 0.3849, test_loss: 1.2002, test_f1: 0.6614
 epoch: 84, train_loss: 0.3902, test_loss: 1.1791, test_f1: 0.6525
 epoch: 85, train_loss: 0.4014, test_loss: 1.1773, test_f1: 0.6512
 epoch: 86, train_loss: 0.4045, test_loss: 1.1902, test_f1: 0.6581
 epoch: 87, train_loss: 0.4061, test_loss: 1.1866, test_f1: 0.6648
 epoch: 88, train_loss: 0.3726, test_loss: 1.2985, test_f1: 0.6543
 epoch: 89, train_loss: 0.3688, test_loss: 1.3620, test_f1: 0.6323
 epoch: 90, train_loss: 0.3777, test_loss: 1.2291, test_f1: 0.6447
 epoch: 91, train_loss: 0.3609, test_loss: 1.3356, test_f1: 0.6509
 epoch: 92, train_loss: 0.3692, test_loss: 1.2673, test_f1: 0.6692
 epoch: 93, train_loss: 0.3672, test_loss: 1.2428, test_f1: 0.6781
 epoch: 94, train_loss: 0.3502, test_loss: 1.2914, test_f1: 0.6531
 epoch: 95, train_loss: 0.3494, test_loss: 1.2567, test_f1: 0.6789
 epoch: 96, train_loss: 0.3647, test_loss: 1.2346, test_f1: 0.6856
 epoch: 97, train_loss: 0.3719, test_loss: 1.2657, test_f1: 0.6782
 epoch: 98, train_loss: 0.3666, test_loss: 1.2486, test_f1: 0.6740
 epoch: 99, train_loss: 0.3632, test_loss: 1.3003, test_f1: 0.6663
##################ITERATION #8 ****************************************
 epoch: 0, train_loss: 1.3302, test_loss: 1.0392, test_f1: 0.4733
 epoch: 1, train_loss: 1.0423, test_loss: 0.9373, test_f1: 0.5175
 epoch: 2, train_loss: 0.9704, test_loss: 0.9352, test_f1: 0.4964
 epoch: 3, train_loss: 0.9571, test_loss: 0.9418, test_f1: 0.5038
 epoch: 4, train_loss: 0.9384, test_loss: 0.9508, test_f1: 0.5247
 epoch: 5, train_loss: 0.9147, test_loss: 0.9354, test_f1: 0.5339
 epoch: 6, train_loss: 0.8991, test_loss: 0.9658, test_f1: 0.5098
 epoch: 7, train_loss: 0.8837, test_loss: 0.9236, test_f1: 0.5397
 epoch: 8, train_loss: 0.8877, test_loss: 0.9107, test_f1: 0.5397
 epoch: 9, train_loss: 0.8581, test_loss: 0.9436, test_f1: 0.5234
 epoch: 10, train_loss: 0.8455, test_loss: 0.9581, test_f1: 0.5537
 epoch: 11, train_loss: 0.8308, test_loss: 0.9953, test_f1: 0.5446
 epoch: 12, train_loss: 0.8285, test_loss: 0.9526, test_f1: 0.5472
 epoch: 13, train_loss: 0.7983, test_loss: 0.9341, test_f1: 0.5882
 epoch: 14, train_loss: 0.8075, test_loss: 0.9864, test_f1: 0.5459
 epoch: 15, train_loss: 0.8161, test_loss: 0.9780, test_f1: 0.5625
 epoch: 16, train_loss: 0.7975, test_loss: 0.9353, test_f1: 0.5661
 epoch: 17, train_loss: 0.7918, test_loss: 1.0557, test_f1: 0.5286
 epoch: 18, train_loss: 0.7782, test_loss: 0.8738, test_f1: 0.5611
 epoch: 19, train_loss: 0.7762, test_loss: 0.9341, test_f1: 0.5679
 epoch: 20, train_loss: 0.7683, test_loss: 0.9128, test_f1: 0.5867
 epoch: 21, train_loss: 0.7584, test_loss: 0.9635, test_f1: 0.6021
 epoch: 22, train_loss: 0.7456, test_loss: 0.9335, test_f1: 0.5713
 epoch: 23, train_loss: 0.7660, test_loss: 0.9384, test_f1: 0.6312
 epoch: 24, train_loss: 0.7383, test_loss: 0.9746, test_f1: 0.6189
 epoch: 25, train_loss: 0.7328, test_loss: 0.9732, test_f1: 0.6140
 epoch: 26, train_loss: 0.7268, test_loss: 0.9759, test_f1: 0.5987
 epoch: 27, train_loss: 0.7021, test_loss: 1.0210, test_f1: 0.6012
 epoch: 28, train_loss: 0.7080, test_loss: 1.0361, test_f1: 0.5774
 epoch: 29, train_loss: 0.7238, test_loss: 0.9225, test_f1: 0.6245
 epoch: 30, train_loss: 0.7014, test_loss: 0.9740, test_f1: 0.6196
 epoch: 31, train_loss: 0.6931, test_loss: 0.9964, test_f1: 0.6018
 epoch: 32, train_loss: 0.7089, test_loss: 1.0579, test_f1: 0.5990
 epoch: 33, train_loss: 0.6885, test_loss: 0.9068, test_f1: 0.5941
 epoch: 34, train_loss: 0.6992, test_loss: 1.0308, test_f1: 0.5966
 epoch: 35, train_loss: 0.6721, test_loss: 0.9442, test_f1: 0.6160
 epoch: 36, train_loss: 0.6595, test_loss: 0.9965, test_f1: 0.6160
 epoch: 37, train_loss: 0.6513, test_loss: 1.0058, test_f1: 0.5975
 epoch: 38, train_loss: 0.6751, test_loss: 1.0050, test_f1: 0.5975
 epoch: 39, train_loss: 0.6497, test_loss: 1.0332, test_f1: 0.6425
 epoch: 40, train_loss: 0.6692, test_loss: 1.0342, test_f1: 0.6273
 epoch: 41, train_loss: 0.6381, test_loss: 1.1003, test_f1: 0.6034
 epoch: 42, train_loss: 0.6273, test_loss: 1.1295, test_f1: 0.6035
 epoch: 43, train_loss: 0.6168, test_loss: 1.0247, test_f1: 0.6229
 epoch: 44, train_loss: 0.6133, test_loss: 1.0494, test_f1: 0.6268
 epoch: 45, train_loss: 0.6145, test_loss: 1.0324, test_f1: 0.6233
 epoch: 46, train_loss: 0.6096, test_loss: 1.0537, test_f1: 0.6245
 epoch: 47, train_loss: 0.6129, test_loss: 1.1290, test_f1: 0.6434
 epoch: 48, train_loss: 0.5843, test_loss: 1.0760, test_f1: 0.6235
 epoch: 49, train_loss: 0.5984, test_loss: 1.1684, test_f1: 0.6361
 epoch: 50, train_loss: 0.5834, test_loss: 1.0564, test_f1: 0.6272
 epoch: 51, train_loss: 0.5431, test_loss: 1.0294, test_f1: 0.6266
 epoch: 52, train_loss: 0.5393, test_loss: 1.0955, test_f1: 0.6348
 epoch: 53, train_loss: 0.5212, test_loss: 1.1239, test_f1: 0.6489
 epoch: 54, train_loss: 0.5107, test_loss: 1.1664, test_f1: 0.6348
 epoch: 55, train_loss: 0.5110, test_loss: 1.0763, test_f1: 0.6306
 epoch: 56, train_loss: 0.4914, test_loss: 1.1292, test_f1: 0.6376
 epoch: 57, train_loss: 0.5071, test_loss: 1.1181, test_f1: 0.6325
 epoch: 58, train_loss: 0.4859, test_loss: 1.1811, test_f1: 0.6367
 epoch: 59, train_loss: 0.4813, test_loss: 1.1727, test_f1: 0.6364
 epoch: 60, train_loss: 0.4757, test_loss: 1.1253, test_f1: 0.6394
 epoch: 61, train_loss: 0.4622, test_loss: 1.3020, test_f1: 0.6404
 epoch: 62, train_loss: 0.4792, test_loss: 1.3185, test_f1: 0.6275
 epoch: 63, train_loss: 0.4677, test_loss: 1.1644, test_f1: 0.6381
 epoch: 64, train_loss: 0.4577, test_loss: 1.1650, test_f1: 0.6538
 epoch: 65, train_loss: 0.4640, test_loss: 1.1701, test_f1: 0.6490
 epoch: 66, train_loss: 0.4601, test_loss: 1.1407, test_f1: 0.6587
 epoch: 67, train_loss: 0.4653, test_loss: 1.2291, test_f1: 0.6535
 epoch: 68, train_loss: 0.4347, test_loss: 1.2338, test_f1: 0.6608
 epoch: 69, train_loss: 0.4441, test_loss: 1.1783, test_f1: 0.6448
 epoch: 70, train_loss: 0.4190, test_loss: 1.3698, test_f1: 0.5912
 epoch: 71, train_loss: 0.4443, test_loss: 1.2376, test_f1: 0.6574
 epoch: 72, train_loss: 0.4248, test_loss: 1.2973, test_f1: 0.6469
 epoch: 73, train_loss: 0.4327, test_loss: 1.2129, test_f1: 0.6550
 epoch: 74, train_loss: 0.4088, test_loss: 1.2294, test_f1: 0.6355
 epoch: 75, train_loss: 0.4311, test_loss: 1.3119, test_f1: 0.6544
 epoch: 76, train_loss: 0.4106, test_loss: 1.3058, test_f1: 0.6306
 epoch: 77, train_loss: 0.4124, test_loss: 1.4143, test_f1: 0.6332
 epoch: 78, train_loss: 0.3947, test_loss: 1.2609, test_f1: 0.6449
 epoch: 79, train_loss: 0.4091, test_loss: 1.3954, test_f1: 0.6485
 epoch: 80, train_loss: 0.4183, test_loss: 1.3437, test_f1: 0.6470
 epoch: 81, train_loss: 0.4007, test_loss: 1.3465, test_f1: 0.6438
 epoch: 82, train_loss: 0.3810, test_loss: 1.3230, test_f1: 0.6509
 epoch: 83, train_loss: 0.3942, test_loss: 1.3559, test_f1: 0.6431
 epoch: 84, train_loss: 0.3968, test_loss: 1.3785, test_f1: 0.6532
 epoch: 85, train_loss: 0.3721, test_loss: 1.3818, test_f1: 0.6244
 epoch: 86, train_loss: 0.3745, test_loss: 1.4501, test_f1: 0.6305
 epoch: 87, train_loss: 0.3799, test_loss: 1.3083, test_f1: 0.6543
 epoch: 88, train_loss: 0.3704, test_loss: 1.4169, test_f1: 0.6419
 epoch: 89, train_loss: 0.3561, test_loss: 1.4511, test_f1: 0.6392
 epoch: 90, train_loss: 0.3669, test_loss: 1.4965, test_f1: 0.6495
 epoch: 91, train_loss: 0.3613, test_loss: 1.4755, test_f1: 0.6442
 epoch: 92, train_loss: 0.3677, test_loss: 1.3672, test_f1: 0.6208
 epoch: 93, train_loss: 0.3641, test_loss: 1.3724, test_f1: 0.6475
 epoch: 94, train_loss: 0.3472, test_loss: 1.4374, test_f1: 0.6470
 epoch: 95, train_loss: 0.3548, test_loss: 1.3943, test_f1: 0.6543
 epoch: 96, train_loss: 0.3395, test_loss: 1.4630, test_f1: 0.6478
 epoch: 97, train_loss: 0.3369, test_loss: 1.5236, test_f1: 0.6176
 epoch: 98, train_loss: 0.3463, test_loss: 1.4154, test_f1: 0.6548
 epoch: 99, train_loss: 0.3468, test_loss: 1.4668, test_f1: 0.6636
##################ITERATION #9 ****************************************
 epoch: 0, train_loss: 1.3297, test_loss: 1.0634, test_f1: 0.4203
 epoch: 1, train_loss: 1.0477, test_loss: 0.9450, test_f1: 0.4522
 epoch: 2, train_loss: 0.9938, test_loss: 0.9264, test_f1: 0.5250
 epoch: 3, train_loss: 0.9741, test_loss: 0.9138, test_f1: 0.5035
 epoch: 4, train_loss: 0.9487, test_loss: 0.9545, test_f1: 0.4905
 epoch: 5, train_loss: 0.9375, test_loss: 0.9664, test_f1: 0.4959
 epoch: 6, train_loss: 0.9127, test_loss: 0.9662, test_f1: 0.5037
 epoch: 7, train_loss: 0.8984, test_loss: 0.8711, test_f1: 0.5171
 epoch: 8, train_loss: 0.8762, test_loss: 0.9629, test_f1: 0.5080
 epoch: 9, train_loss: 0.8729, test_loss: 1.0002, test_f1: 0.5262
 epoch: 10, train_loss: 0.8499, test_loss: 1.0057, test_f1: 0.5477
 epoch: 11, train_loss: 0.8632, test_loss: 0.9369, test_f1: 0.5414
 epoch: 12, train_loss: 0.8465, test_loss: 0.9364, test_f1: 0.5613
 epoch: 13, train_loss: 0.8437, test_loss: 0.9629, test_f1: 0.5345
 epoch: 14, train_loss: 0.8300, test_loss: 0.9119, test_f1: 0.5950
 epoch: 15, train_loss: 0.8130, test_loss: 0.9509, test_f1: 0.5369
 epoch: 16, train_loss: 0.8266, test_loss: 0.9229, test_f1: 0.5719
 epoch: 17, train_loss: 0.7884, test_loss: 0.9312, test_f1: 0.5629
 epoch: 18, train_loss: 0.8018, test_loss: 0.9545, test_f1: 0.5690
 epoch: 19, train_loss: 0.7953, test_loss: 0.9115, test_f1: 0.5730
 epoch: 20, train_loss: 0.7861, test_loss: 0.9441, test_f1: 0.5686
 epoch: 21, train_loss: 0.7782, test_loss: 0.9428, test_f1: 0.5715
 epoch: 22, train_loss: 0.7591, test_loss: 0.9845, test_f1: 0.5210
 epoch: 23, train_loss: 0.7844, test_loss: 0.9001, test_f1: 0.6014
 epoch: 24, train_loss: 0.7711, test_loss: 0.9577, test_f1: 0.6063
 epoch: 25, train_loss: 0.7594, test_loss: 0.9286, test_f1: 0.6029
 epoch: 26, train_loss: 0.7589, test_loss: 0.9044, test_f1: 0.6057
 epoch: 27, train_loss: 0.7424, test_loss: 0.9586, test_f1: 0.5974
 epoch: 28, train_loss: 0.7472, test_loss: 1.0054, test_f1: 0.5987
 epoch: 29, train_loss: 0.7372, test_loss: 0.9335, test_f1: 0.6106
 epoch: 30, train_loss: 0.7313, test_loss: 0.9992, test_f1: 0.5802
 epoch: 31, train_loss: 0.7372, test_loss: 0.9277, test_f1: 0.5762
 epoch: 32, train_loss: 0.7100, test_loss: 0.8968, test_f1: 0.6334
 epoch: 33, train_loss: 0.7015, test_loss: 0.9395, test_f1: 0.6351
 epoch: 34, train_loss: 0.6810, test_loss: 0.9894, test_f1: 0.6429
 epoch: 35, train_loss: 0.6888, test_loss: 1.0266, test_f1: 0.5988
 epoch: 36, train_loss: 0.7069, test_loss: 0.9738, test_f1: 0.6040
 epoch: 37, train_loss: 0.6954, test_loss: 1.0189, test_f1: 0.6229
 epoch: 38, train_loss: 0.6753, test_loss: 0.9248, test_f1: 0.6348
 epoch: 39, train_loss: 0.6578, test_loss: 0.9938, test_f1: 0.6016
 epoch: 40, train_loss: 0.6824, test_loss: 0.9885, test_f1: 0.6362
 epoch: 41, train_loss: 0.6648, test_loss: 0.9533, test_f1: 0.6333
 epoch: 42, train_loss: 0.6612, test_loss: 1.0226, test_f1: 0.6360
 epoch: 43, train_loss: 0.6603, test_loss: 0.8991, test_f1: 0.6161
 epoch: 44, train_loss: 0.6558, test_loss: 0.9265, test_f1: 0.5991
 epoch: 45, train_loss: 0.6382, test_loss: 0.9424, test_f1: 0.6331
 epoch: 46, train_loss: 0.6345, test_loss: 1.0367, test_f1: 0.6180
 epoch: 47, train_loss: 0.6176, test_loss: 0.9804, test_f1: 0.6044
 epoch: 48, train_loss: 0.6293, test_loss: 0.9878, test_f1: 0.6298
 epoch: 49, train_loss: 0.6228, test_loss: 0.9349, test_f1: 0.6484
 epoch: 50, train_loss: 0.6239, test_loss: 0.9958, test_f1: 0.6072
 epoch: 51, train_loss: 0.5692, test_loss: 0.9603, test_f1: 0.6364
 epoch: 52, train_loss: 0.5603, test_loss: 0.9907, test_f1: 0.6370
 epoch: 53, train_loss: 0.5362, test_loss: 1.0153, test_f1: 0.6447
 epoch: 54, train_loss: 0.5410, test_loss: 1.0257, test_f1: 0.6546
 epoch: 55, train_loss: 0.5505, test_loss: 1.0073, test_f1: 0.6609
 epoch: 56, train_loss: 0.5256, test_loss: 0.9355, test_f1: 0.6581
 epoch: 57, train_loss: 0.5253, test_loss: 1.0024, test_f1: 0.6453
 epoch: 58, train_loss: 0.5225, test_loss: 0.9760, test_f1: 0.6578
 epoch: 59, train_loss: 0.5336, test_loss: 1.0488, test_f1: 0.6407
 epoch: 60, train_loss: 0.5092, test_loss: 1.0506, test_f1: 0.6578
 epoch: 61, train_loss: 0.5081, test_loss: 1.0350, test_f1: 0.6461
 epoch: 62, train_loss: 0.4930, test_loss: 1.0963, test_f1: 0.6265
 epoch: 63, train_loss: 0.5073, test_loss: 1.0669, test_f1: 0.6254
 epoch: 64, train_loss: 0.4851, test_loss: 0.9973, test_f1: 0.6370
 epoch: 65, train_loss: 0.4828, test_loss: 1.0446, test_f1: 0.6505
 epoch: 66, train_loss: 0.4890, test_loss: 1.0437, test_f1: 0.6366
 epoch: 67, train_loss: 0.4786, test_loss: 1.0554, test_f1: 0.6369
 epoch: 68, train_loss: 0.4733, test_loss: 1.0652, test_f1: 0.6578
 epoch: 69, train_loss: 0.4588, test_loss: 1.0067, test_f1: 0.6429
 epoch: 70, train_loss: 0.4621, test_loss: 1.0689, test_f1: 0.6358
 epoch: 71, train_loss: 0.4615, test_loss: 1.0623, test_f1: 0.6513
 epoch: 72, train_loss: 0.4710, test_loss: 1.0653, test_f1: 0.6568
 epoch: 73, train_loss: 0.4472, test_loss: 1.0736, test_f1: 0.6769
 epoch: 74, train_loss: 0.4470, test_loss: 1.0827, test_f1: 0.6454
 epoch: 75, train_loss: 0.4512, test_loss: 1.0974, test_f1: 0.6232
 epoch: 76, train_loss: 0.4475, test_loss: 1.1135, test_f1: 0.6211
 epoch: 77, train_loss: 0.4295, test_loss: 1.0421, test_f1: 0.6580
 epoch: 78, train_loss: 0.4484, test_loss: 1.1433, test_f1: 0.6527
 epoch: 79, train_loss: 0.4349, test_loss: 1.1014, test_f1: 0.6117
 epoch: 80, train_loss: 0.4302, test_loss: 1.1315, test_f1: 0.6389
 epoch: 81, train_loss: 0.4496, test_loss: 1.1712, test_f1: 0.6312
 epoch: 82, train_loss: 0.4310, test_loss: 1.1897, test_f1: 0.6131
 epoch: 83, train_loss: 0.4494, test_loss: 1.1183, test_f1: 0.6310
 epoch: 84, train_loss: 0.4405, test_loss: 1.0990, test_f1: 0.6299
 epoch: 85, train_loss: 0.4126, test_loss: 1.0815, test_f1: 0.6565
 epoch: 86, train_loss: 0.4172, test_loss: 1.0978, test_f1: 0.6671
 epoch: 87, train_loss: 0.4020, test_loss: 1.1733, test_f1: 0.6462
 epoch: 88, train_loss: 0.4230, test_loss: 1.1371, test_f1: 0.6442
 epoch: 89, train_loss: 0.3955, test_loss: 1.1362, test_f1: 0.6425
 epoch: 90, train_loss: 0.3995, test_loss: 1.1767, test_f1: 0.6259
 epoch: 91, train_loss: 0.4105, test_loss: 1.2374, test_f1: 0.6369
 epoch: 92, train_loss: 0.4035, test_loss: 1.1937, test_f1: 0.6465
 epoch: 93, train_loss: 0.3800, test_loss: 1.2044, test_f1: 0.6394
 epoch: 94, train_loss: 0.3897, test_loss: 1.1891, test_f1: 0.6426
 epoch: 95, train_loss: 0.3806, test_loss: 1.2092, test_f1: 0.6067
 epoch: 96, train_loss: 0.3839, test_loss: 1.2048, test_f1: 0.6526
 epoch: 97, train_loss: 0.4062, test_loss: 1.1735, test_f1: 0.6420
 epoch: 98, train_loss: 0.3516, test_loss: 1.2049, test_f1: 0.6369
 epoch: 99, train_loss: 0.3676, test_loss: 1.2191, test_f1: 0.6557

Training completed in 748.34 seconds
Best F1: 0.7026 at epoch 52
Mean F1 across iterations: 0.6794  0.0128
========================FINAL RESULTS================================
FEGIN weighted F1: 0.7026  0.0128
python main.py --data ltspice_examples --representation component_net --model FEGIN --layers 5 --hiddens 64 --batch_size 64 --lr 0.001 --emb_size 512 --epochs 100 --save_appendix component_net_L5_H64_BS64_LR0.001_E512 --no_val
-----



STDERR:
  File "main.py", line 370, in <module>
    main()
  File "main.py", line 254, in main
    dataset = dataset_class(
  File "/home/philip/projects/ltspice_examples_code_repo/Circuit-Completion-Using-GNNs/component_classification_with_link_prediction_head/evaluation/FEGIN/kernel/circuit_datasets.py", line 15, in __init__
    self.data, self.slices = torch.load(self.processed_paths[0])
  File "/home/philip/.local/lib/python3.8/site-packages/torch/serialization.py", line 1040, in load
    warnings.warn(
  File "/usr/lib/python3.8/warnings.py", line 109, in _showwarnmsg
    sw(msg.message, msg.category, msg.filename, msg.lineno,
  File "main.py", line 47, in warn_with_traceback
    traceback.print_stack(file=log)
/home/philip/projects/ltspice_examples_code_repo/Circuit-Completion-Using-GNNs/component_classification_with_link_prediction_head/evaluation/FEGIN/kernel/circuit_datasets.py:15: FutureWarning: You are using `torch.load` with `weights_only=False` (the current default value), which uses the default pickle module implicitly. It is possible to construct malicious pickle data which will execute arbitrary code during unpickling (See https://github.com/pytorch/pytorch/blob/main/SECURITY.md#untrusted-models for more details). In a future release, the default value for `weights_only` will be flipped to `True`. This limits the functions that could be executed during unpickling. Arbitrary objects will no longer be allowed to be loaded via this mode unless they are explicitly allowlisted by the user via `torch.serialization.add_safe_globals`. We recommend you start setting `weights_only=True` for any use case where you don't have full control of the loaded file. Please open an issue on GitHub for any issues related to this experimental feature.
  self.data, self.slices = torch.load(self.processed_paths[0])
