STDOUT:
Results will be saved in /home/philip/projects/ltspice_examples_code_repo/Circuit-Completion-Using-GNNs/component_classification_with_link_prediction_head/evaluation/FEGIN/results/model_FEGIN_dataset_ltspice_examples
Command line input: python main.py --data ltspice_examples --representation component_pin_net --model FEGIN --layers 2 --hiddens 128 --batch_size 32 --lr 0.01 --emb_size 128 --epochs 100 --save_appendix component_pin_net_L2_H128_BS32_LR0.01_E128 --no_val
 is saved.
-----
ltspice_examples - FEGIN
Using 2 layers, 128 hidden units, h = 2
Loading component_pin_net representation dataset
ENTERED
Training FEGIN on component_pin_net representation
Train: 3558, Test: 846
##################ITERATION #0 ****************************************
 epoch: 0, train_loss: 1.1393, test_loss: 1.2514, test_f1: 0.3490
 epoch: 1, train_loss: 1.0626, test_loss: 1.0441, test_f1: 0.4311
 epoch: 2, train_loss: 1.0174, test_loss: 1.0280, test_f1: 0.4704
 epoch: 3, train_loss: 1.0033, test_loss: 1.1345, test_f1: 0.4923
 epoch: 4, train_loss: 0.9766, test_loss: 1.2022, test_f1: 0.4238
 epoch: 5, train_loss: 0.9821, test_loss: 0.9364, test_f1: 0.5018
 epoch: 6, train_loss: 0.9620, test_loss: 0.9163, test_f1: 0.5107
 epoch: 7, train_loss: 0.9419, test_loss: 0.9892, test_f1: 0.4645
 epoch: 8, train_loss: 0.9411, test_loss: 0.9801, test_f1: 0.5042
 epoch: 9, train_loss: 0.9094, test_loss: 0.9416, test_f1: 0.5456
 epoch: 10, train_loss: 0.9270, test_loss: 1.0878, test_f1: 0.5354
 epoch: 11, train_loss: 0.8990, test_loss: 0.9160, test_f1: 0.5579
 epoch: 12, train_loss: 0.8884, test_loss: 0.9982, test_f1: 0.4846
 epoch: 13, train_loss: 0.8834, test_loss: 1.0239, test_f1: 0.5223
 epoch: 14, train_loss: 0.8791, test_loss: 0.8572, test_f1: 0.5368
 epoch: 15, train_loss: 0.8793, test_loss: 0.9352, test_f1: 0.5182
 epoch: 16, train_loss: 0.8805, test_loss: 1.0175, test_f1: 0.5138
 epoch: 17, train_loss: 0.8765, test_loss: 0.9530, test_f1: 0.5197
 epoch: 18, train_loss: 0.8669, test_loss: 0.8564, test_f1: 0.5377
 epoch: 19, train_loss: 0.8542, test_loss: 0.9041, test_f1: 0.5074
 epoch: 20, train_loss: 0.8328, test_loss: 0.9529, test_f1: 0.5451
 epoch: 21, train_loss: 0.8444, test_loss: 0.8340, test_f1: 0.5427
 epoch: 22, train_loss: 0.8498, test_loss: 0.8387, test_f1: 0.5795
 epoch: 23, train_loss: 0.8381, test_loss: 0.8681, test_f1: 0.6128
 epoch: 24, train_loss: 0.8210, test_loss: 0.9703, test_f1: 0.5574
 epoch: 25, train_loss: 0.8344, test_loss: 0.9050, test_f1: 0.5551
 epoch: 26, train_loss: 0.8183, test_loss: 0.7814, test_f1: 0.6122
 epoch: 27, train_loss: 0.8017, test_loss: 0.8397, test_f1: 0.5825
 epoch: 28, train_loss: 0.7999, test_loss: 0.8771, test_f1: 0.5442
 epoch: 29, train_loss: 0.7885, test_loss: 0.8275, test_f1: 0.5561
 epoch: 30, train_loss: 0.7882, test_loss: 0.8752, test_f1: 0.5445
 epoch: 31, train_loss: 0.7799, test_loss: 0.8144, test_f1: 0.5786
 epoch: 32, train_loss: 0.7670, test_loss: 0.8554, test_f1: 0.5677
 epoch: 33, train_loss: 0.7750, test_loss: 0.9365, test_f1: 0.6066
 epoch: 34, train_loss: 0.7618, test_loss: 0.8332, test_f1: 0.5842
 epoch: 35, train_loss: 0.7586, test_loss: 0.8470, test_f1: 0.6480
 epoch: 36, train_loss: 0.7565, test_loss: 0.8214, test_f1: 0.6573
 epoch: 37, train_loss: 0.7375, test_loss: 0.8010, test_f1: 0.5985
 epoch: 38, train_loss: 0.7492, test_loss: 0.8043, test_f1: 0.5841
 epoch: 39, train_loss: 0.7268, test_loss: 0.8153, test_f1: 0.6297
 epoch: 40, train_loss: 0.7440, test_loss: 0.9004, test_f1: 0.6163
 epoch: 41, train_loss: 0.7258, test_loss: 0.8914, test_f1: 0.6196
 epoch: 42, train_loss: 0.7356, test_loss: 0.9010, test_f1: 0.6248
 epoch: 43, train_loss: 0.7318, test_loss: 0.8706, test_f1: 0.5900
 epoch: 44, train_loss: 0.7082, test_loss: 0.9728, test_f1: 0.6176
 epoch: 45, train_loss: 0.7253, test_loss: 0.9172, test_f1: 0.6002
 epoch: 46, train_loss: 0.7032, test_loss: 0.9734, test_f1: 0.5743
 epoch: 47, train_loss: 0.7315, test_loss: 0.8727, test_f1: 0.5833
 epoch: 48, train_loss: 0.6867, test_loss: 0.8503, test_f1: 0.6471
 epoch: 49, train_loss: 0.7167, test_loss: 0.8916, test_f1: 0.6091
 epoch: 50, train_loss: 0.7026, test_loss: 0.8636, test_f1: 0.5947
 epoch: 51, train_loss: 0.6696, test_loss: 0.8702, test_f1: 0.6059
 epoch: 52, train_loss: 0.6486, test_loss: 0.9628, test_f1: 0.6460
 epoch: 53, train_loss: 0.6346, test_loss: 0.9590, test_f1: 0.6329
 epoch: 54, train_loss: 0.6437, test_loss: 0.9400, test_f1: 0.6378
 epoch: 55, train_loss: 0.6256, test_loss: 0.9465, test_f1: 0.6286
 epoch: 56, train_loss: 0.6233, test_loss: 0.9404, test_f1: 0.6600
 epoch: 57, train_loss: 0.6279, test_loss: 0.9473, test_f1: 0.6481
 epoch: 58, train_loss: 0.6202, test_loss: 0.9740, test_f1: 0.6444
 epoch: 59, train_loss: 0.6071, test_loss: 1.0030, test_f1: 0.6337
 epoch: 60, train_loss: 0.6072, test_loss: 1.0518, test_f1: 0.6309
 epoch: 61, train_loss: 0.6060, test_loss: 1.1134, test_f1: 0.6170
 epoch: 62, train_loss: 0.6209, test_loss: 0.9696, test_f1: 0.6507
 epoch: 63, train_loss: 0.5986, test_loss: 0.9876, test_f1: 0.6551
 epoch: 64, train_loss: 0.5917, test_loss: 0.9076, test_f1: 0.6630
 epoch: 65, train_loss: 0.5931, test_loss: 0.9456, test_f1: 0.6413
 epoch: 66, train_loss: 0.5902, test_loss: 1.0351, test_f1: 0.6631
 epoch: 67, train_loss: 0.5980, test_loss: 0.9769, test_f1: 0.6547
 epoch: 68, train_loss: 0.5823, test_loss: 1.0655, test_f1: 0.6273
 epoch: 69, train_loss: 0.5644, test_loss: 0.9892, test_f1: 0.6631
 epoch: 70, train_loss: 0.5607, test_loss: 0.9456, test_f1: 0.6508
 epoch: 71, train_loss: 0.5499, test_loss: 1.0977, test_f1: 0.6593
 epoch: 72, train_loss: 0.5868, test_loss: 1.0859, test_f1: 0.6368
 epoch: 73, train_loss: 0.5648, test_loss: 1.0770, test_f1: 0.6373
 epoch: 74, train_loss: 0.5716, test_loss: 1.0262, test_f1: 0.5896
 epoch: 75, train_loss: 0.5616, test_loss: 1.1098, test_f1: 0.6756
 epoch: 76, train_loss: 0.5584, test_loss: 1.0193, test_f1: 0.6664
 epoch: 77, train_loss: 0.5566, test_loss: 1.2545, test_f1: 0.6493
 epoch: 78, train_loss: 0.5326, test_loss: 1.1889, test_f1: 0.6749
 epoch: 79, train_loss: 0.5352, test_loss: 1.0626, test_f1: 0.6178
 epoch: 80, train_loss: 0.5422, test_loss: 1.1567, test_f1: 0.6534
 epoch: 81, train_loss: 0.5478, test_loss: 1.1727, test_f1: 0.6442
 epoch: 82, train_loss: 0.5320, test_loss: 1.1905, test_f1: 0.6390
 epoch: 83, train_loss: 0.5471, test_loss: 1.0700, test_f1: 0.6666
 epoch: 84, train_loss: 0.5511, test_loss: 1.1790, test_f1: 0.6314
 epoch: 85, train_loss: 0.5337, test_loss: 1.0287, test_f1: 0.6537
 epoch: 86, train_loss: 0.5117, test_loss: 1.1619, test_f1: 0.6358
 epoch: 87, train_loss: 0.5207, test_loss: 1.1955, test_f1: 0.6387
 epoch: 88, train_loss: 0.5255, test_loss: 1.0937, test_f1: 0.6586
 epoch: 89, train_loss: 0.5219, test_loss: 1.1129, test_f1: 0.6464
 epoch: 90, train_loss: 0.5128, test_loss: 1.2163, test_f1: 0.6473
 epoch: 91, train_loss: 0.4979, test_loss: 1.1800, test_f1: 0.6366
 epoch: 92, train_loss: 0.4891, test_loss: 1.2384, test_f1: 0.6338
 epoch: 93, train_loss: 0.5003, test_loss: 1.2118, test_f1: 0.6340
 epoch: 94, train_loss: 0.4959, test_loss: 1.3353, test_f1: 0.6390
 epoch: 95, train_loss: 0.5000, test_loss: 1.2314, test_f1: 0.6536
 epoch: 96, train_loss: 0.4817, test_loss: 1.3751, test_f1: 0.6502
 epoch: 97, train_loss: 0.4953, test_loss: 1.2160, test_f1: 0.6444
 epoch: 98, train_loss: 0.4969, test_loss: 1.2606, test_f1: 0.6424
 epoch: 99, train_loss: 0.4752, test_loss: 1.3713, test_f1: 0.6876
##################ITERATION #1 ****************************************
 epoch: 0, train_loss: 1.1043, test_loss: 1.1213, test_f1: 0.3850
 epoch: 1, train_loss: 1.0124, test_loss: 1.0611, test_f1: 0.4441
 epoch: 2, train_loss: 1.0037, test_loss: 0.9994, test_f1: 0.4727
 epoch: 3, train_loss: 0.9824, test_loss: 0.9821, test_f1: 0.4590
 epoch: 4, train_loss: 0.9529, test_loss: 0.9267, test_f1: 0.4794
 epoch: 5, train_loss: 0.9570, test_loss: 0.9757, test_f1: 0.5140
 epoch: 6, train_loss: 0.9333, test_loss: 0.8988, test_f1: 0.4955
 epoch: 7, train_loss: 0.9196, test_loss: 0.9721, test_f1: 0.5223
 epoch: 8, train_loss: 0.9208, test_loss: 0.9515, test_f1: 0.5329
 epoch: 9, train_loss: 0.8927, test_loss: 0.8381, test_f1: 0.5368
 epoch: 10, train_loss: 0.8776, test_loss: 0.8524, test_f1: 0.5292
 epoch: 11, train_loss: 0.8764, test_loss: 0.8111, test_f1: 0.5715
 epoch: 12, train_loss: 0.8769, test_loss: 0.8963, test_f1: 0.4960
 epoch: 13, train_loss: 0.8796, test_loss: 0.8501, test_f1: 0.5479
 epoch: 14, train_loss: 0.8426, test_loss: 0.7776, test_f1: 0.5874
 epoch: 15, train_loss: 0.8361, test_loss: 0.8310, test_f1: 0.5344
 epoch: 16, train_loss: 0.8388, test_loss: 0.8517, test_f1: 0.5575
 epoch: 17, train_loss: 0.8335, test_loss: 1.0574, test_f1: 0.5175
 epoch: 18, train_loss: 0.8195, test_loss: 0.8457, test_f1: 0.5619
 epoch: 19, train_loss: 0.8165, test_loss: 0.8243, test_f1: 0.5580
 epoch: 20, train_loss: 0.8112, test_loss: 0.7572, test_f1: 0.5941
 epoch: 21, train_loss: 0.8023, test_loss: 0.7476, test_f1: 0.6206
 epoch: 22, train_loss: 0.7925, test_loss: 0.8706, test_f1: 0.5293
 epoch: 23, train_loss: 0.8143, test_loss: 1.0357, test_f1: 0.5914
 epoch: 24, train_loss: 0.7998, test_loss: 0.8994, test_f1: 0.5876
 epoch: 25, train_loss: 0.7799, test_loss: 0.9426, test_f1: 0.5874
 epoch: 26, train_loss: 0.7578, test_loss: 0.8924, test_f1: 0.5590
 epoch: 27, train_loss: 0.7414, test_loss: 0.8348, test_f1: 0.5445
 epoch: 28, train_loss: 0.7542, test_loss: 0.7592, test_f1: 0.6402
 epoch: 29, train_loss: 0.7501, test_loss: 1.0290, test_f1: 0.6026
 epoch: 30, train_loss: 0.7562, test_loss: 0.9901, test_f1: 0.6184
 epoch: 31, train_loss: 0.7548, test_loss: 0.8072, test_f1: 0.6260
 epoch: 32, train_loss: 0.7277, test_loss: 0.8710, test_f1: 0.6105
 epoch: 33, train_loss: 0.7207, test_loss: 0.8910, test_f1: 0.6469
 epoch: 34, train_loss: 0.7029, test_loss: 0.8556, test_f1: 0.6072
 epoch: 35, train_loss: 0.7216, test_loss: 1.0146, test_f1: 0.6459
 epoch: 36, train_loss: 0.7000, test_loss: 0.8110, test_f1: 0.6358
 epoch: 37, train_loss: 0.6907, test_loss: 0.8391, test_f1: 0.6702
 epoch: 38, train_loss: 0.6693, test_loss: 0.8374, test_f1: 0.6117
 epoch: 39, train_loss: 0.6920, test_loss: 1.1072, test_f1: 0.5686
 epoch: 40, train_loss: 0.7097, test_loss: 0.8982, test_f1: 0.6502
 epoch: 41, train_loss: 0.6660, test_loss: 0.9808, test_f1: 0.6052
 epoch: 42, train_loss: 0.6672, test_loss: 0.8204, test_f1: 0.6437
 epoch: 43, train_loss: 0.6717, test_loss: 0.8814, test_f1: 0.6644
 epoch: 44, train_loss: 0.6745, test_loss: 0.8049, test_f1: 0.6578
 epoch: 45, train_loss: 0.6405, test_loss: 0.8494, test_f1: 0.6233
 epoch: 46, train_loss: 0.6405, test_loss: 1.0541, test_f1: 0.6067
 epoch: 47, train_loss: 0.6373, test_loss: 0.8358, test_f1: 0.6534
 epoch: 48, train_loss: 0.6512, test_loss: 0.9754, test_f1: 0.6150
 epoch: 49, train_loss: 0.6542, test_loss: 0.8783, test_f1: 0.6072
 epoch: 50, train_loss: 0.6497, test_loss: 0.9271, test_f1: 0.6199
 epoch: 51, train_loss: 0.5960, test_loss: 0.8419, test_f1: 0.6728
 epoch: 52, train_loss: 0.5750, test_loss: 0.8486, test_f1: 0.6684
 epoch: 53, train_loss: 0.5893, test_loss: 0.8556, test_f1: 0.6576
 epoch: 54, train_loss: 0.5533, test_loss: 0.9516, test_f1: 0.6807
 epoch: 55, train_loss: 0.5761, test_loss: 0.8318, test_f1: 0.6569
 epoch: 56, train_loss: 0.5479, test_loss: 0.8453, test_f1: 0.6480
 epoch: 57, train_loss: 0.5409, test_loss: 0.9645, test_f1: 0.6581
 epoch: 58, train_loss: 0.5230, test_loss: 0.9455, test_f1: 0.6570
 epoch: 59, train_loss: 0.5301, test_loss: 0.8708, test_f1: 0.6782
 epoch: 60, train_loss: 0.5450, test_loss: 0.8124, test_f1: 0.6744
 epoch: 61, train_loss: 0.5172, test_loss: 0.8018, test_f1: 0.6615
 epoch: 62, train_loss: 0.5384, test_loss: 0.9375, test_f1: 0.6832
 epoch: 63, train_loss: 0.5353, test_loss: 0.9773, test_f1: 0.6661
 epoch: 64, train_loss: 0.5157, test_loss: 0.8266, test_f1: 0.6445
 epoch: 65, train_loss: 0.5327, test_loss: 1.0662, test_f1: 0.6560
 epoch: 66, train_loss: 0.5017, test_loss: 1.0938, test_f1: 0.6766
 epoch: 67, train_loss: 0.5119, test_loss: 1.0545, test_f1: 0.6569
 epoch: 68, train_loss: 0.4965, test_loss: 0.9526, test_f1: 0.6762
 epoch: 69, train_loss: 0.5145, test_loss: 1.1139, test_f1: 0.6747
 epoch: 70, train_loss: 0.4879, test_loss: 1.0254, test_f1: 0.6633
 epoch: 71, train_loss: 0.4821, test_loss: 0.8985, test_f1: 0.7062
 epoch: 72, train_loss: 0.4739, test_loss: 1.1221, test_f1: 0.6762
 epoch: 73, train_loss: 0.4758, test_loss: 1.0712, test_f1: 0.6556
 epoch: 74, train_loss: 0.4665, test_loss: 1.2991, test_f1: 0.6763
 epoch: 75, train_loss: 0.5016, test_loss: 1.1136, test_f1: 0.6627
 epoch: 76, train_loss: 0.4634, test_loss: 1.1438, test_f1: 0.6705
 epoch: 77, train_loss: 0.4697, test_loss: 0.9770, test_f1: 0.6697
 epoch: 78, train_loss: 0.4617, test_loss: 0.9005, test_f1: 0.6586
 epoch: 79, train_loss: 0.4709, test_loss: 0.9148, test_f1: 0.6778
 epoch: 80, train_loss: 0.4456, test_loss: 0.9859, test_f1: 0.6796
 epoch: 81, train_loss: 0.4449, test_loss: 1.0888, test_f1: 0.6667
 epoch: 82, train_loss: 0.4373, test_loss: 1.0662, test_f1: 0.6700
 epoch: 83, train_loss: 0.4399, test_loss: 1.0828, test_f1: 0.6855
 epoch: 84, train_loss: 0.4508, test_loss: 1.1296, test_f1: 0.7025
 epoch: 85, train_loss: 0.4475, test_loss: 1.2652, test_f1: 0.6921
 epoch: 86, train_loss: 0.4505, test_loss: 1.0348, test_f1: 0.6721
 epoch: 87, train_loss: 0.4283, test_loss: 1.0612, test_f1: 0.6669
 epoch: 88, train_loss: 0.4506, test_loss: 1.2897, test_f1: 0.6720
 epoch: 89, train_loss: 0.4447, test_loss: 1.1682, test_f1: 0.6592
 epoch: 90, train_loss: 0.4215, test_loss: 1.1198, test_f1: 0.6841
 epoch: 91, train_loss: 0.4208, test_loss: 1.1763, test_f1: 0.6915
 epoch: 92, train_loss: 0.4338, test_loss: 1.0296, test_f1: 0.6877
 epoch: 93, train_loss: 0.4239, test_loss: 1.1618, test_f1: 0.6750
 epoch: 94, train_loss: 0.4410, test_loss: 1.0921, test_f1: 0.6884
 epoch: 95, train_loss: 0.4216, test_loss: 1.0774, test_f1: 0.6767
 epoch: 96, train_loss: 0.4048, test_loss: 1.0813, test_f1: 0.6713
 epoch: 97, train_loss: 0.4076, test_loss: 0.9861, test_f1: 0.7012
 epoch: 98, train_loss: 0.4045, test_loss: 1.1358, test_f1: 0.6928
 epoch: 99, train_loss: 0.4183, test_loss: 1.0075, test_f1: 0.6990
##################ITERATION #2 ****************************************
 epoch: 0, train_loss: 1.1511, test_loss: 1.1500, test_f1: 0.3842
 epoch: 1, train_loss: 1.0778, test_loss: 1.0522, test_f1: 0.4635
 epoch: 2, train_loss: 1.0408, test_loss: 1.1364, test_f1: 0.3422
 epoch: 3, train_loss: 1.0336, test_loss: 1.1181, test_f1: 0.4658
 epoch: 4, train_loss: 1.0237, test_loss: 1.1416, test_f1: 0.4499
 epoch: 5, train_loss: 1.0007, test_loss: 1.0205, test_f1: 0.4532
 epoch: 6, train_loss: 0.9873, test_loss: 0.9964, test_f1: 0.4780
 epoch: 7, train_loss: 0.9719, test_loss: 0.9463, test_f1: 0.5100
 epoch: 8, train_loss: 0.9663, test_loss: 1.0101, test_f1: 0.5008
 epoch: 9, train_loss: 0.9393, test_loss: 1.0450, test_f1: 0.5088
 epoch: 10, train_loss: 0.9509, test_loss: 1.0625, test_f1: 0.4542
 epoch: 11, train_loss: 0.9235, test_loss: 0.9786, test_f1: 0.4828
 epoch: 12, train_loss: 0.9425, test_loss: 0.9139, test_f1: 0.5177
 epoch: 13, train_loss: 0.9210, test_loss: 1.0535, test_f1: 0.5053
 epoch: 14, train_loss: 0.9053, test_loss: 1.0941, test_f1: 0.5129
 epoch: 15, train_loss: 0.9145, test_loss: 1.0528, test_f1: 0.5185
 epoch: 16, train_loss: 0.8963, test_loss: 0.9668, test_f1: 0.5331
 epoch: 17, train_loss: 0.8902, test_loss: 1.0922, test_f1: 0.5270
 epoch: 18, train_loss: 0.8749, test_loss: 1.1716, test_f1: 0.5135
 epoch: 19, train_loss: 0.8886, test_loss: 1.2720, test_f1: 0.5071
 epoch: 20, train_loss: 0.8806, test_loss: 0.9178, test_f1: 0.5044
 epoch: 21, train_loss: 0.8707, test_loss: 0.9344, test_f1: 0.5332
 epoch: 22, train_loss: 0.8592, test_loss: 0.9516, test_f1: 0.5138
 epoch: 23, train_loss: 0.8602, test_loss: 1.0140, test_f1: 0.5313
 epoch: 24, train_loss: 0.8372, test_loss: 1.2506, test_f1: 0.5447
 epoch: 25, train_loss: 0.8324, test_loss: 0.9175, test_f1: 0.5378
 epoch: 26, train_loss: 0.8341, test_loss: 1.1852, test_f1: 0.5013
 epoch: 27, train_loss: 0.8218, test_loss: 0.8538, test_f1: 0.5428
 epoch: 28, train_loss: 0.8288, test_loss: 1.1267, test_f1: 0.5419
 epoch: 29, train_loss: 0.8271, test_loss: 0.9718, test_f1: 0.5213
 epoch: 30, train_loss: 0.8195, test_loss: 0.8875, test_f1: 0.5265
 epoch: 31, train_loss: 0.8153, test_loss: 1.3167, test_f1: 0.5208
 epoch: 32, train_loss: 0.8226, test_loss: 1.2431, test_f1: 0.5433
 epoch: 33, train_loss: 0.8056, test_loss: 0.9350, test_f1: 0.5466
 epoch: 34, train_loss: 0.8006, test_loss: 1.0794, test_f1: 0.4994
 epoch: 35, train_loss: 0.8128, test_loss: 0.9738, test_f1: 0.5502
 epoch: 36, train_loss: 0.7949, test_loss: 0.8076, test_f1: 0.5646
 epoch: 37, train_loss: 0.7769, test_loss: 1.0797, test_f1: 0.5369
 epoch: 38, train_loss: 0.7775, test_loss: 0.9826, test_f1: 0.5541
 epoch: 39, train_loss: 0.7964, test_loss: 0.9176, test_f1: 0.5469
 epoch: 40, train_loss: 0.7805, test_loss: 1.0420, test_f1: 0.5504
 epoch: 41, train_loss: 0.7823, test_loss: 1.1179, test_f1: 0.5582
 epoch: 42, train_loss: 0.7784, test_loss: 1.0907, test_f1: 0.5343
 epoch: 43, train_loss: 0.7572, test_loss: 0.8990, test_f1: 0.5496
 epoch: 44, train_loss: 0.7658, test_loss: 0.9484, test_f1: 0.5583
 epoch: 45, train_loss: 0.7493, test_loss: 1.0845, test_f1: 0.5417
 epoch: 46, train_loss: 0.7557, test_loss: 1.0005, test_f1: 0.5133
 epoch: 47, train_loss: 0.7437, test_loss: 0.8331, test_f1: 0.5520
 epoch: 48, train_loss: 0.7622, test_loss: 0.9195, test_f1: 0.5689
 epoch: 49, train_loss: 0.7552, test_loss: 1.0164, test_f1: 0.5902
 epoch: 50, train_loss: 0.7448, test_loss: 1.1173, test_f1: 0.5331
 epoch: 51, train_loss: 0.7038, test_loss: 0.9768, test_f1: 0.6125
 epoch: 52, train_loss: 0.6800, test_loss: 0.9501, test_f1: 0.6043
 epoch: 53, train_loss: 0.6700, test_loss: 1.1411, test_f1: 0.6205
 epoch: 54, train_loss: 0.6711, test_loss: 0.9968, test_f1: 0.6091
 epoch: 55, train_loss: 0.6514, test_loss: 0.9464, test_f1: 0.6190
 epoch: 56, train_loss: 0.6689, test_loss: 1.0147, test_f1: 0.5941
 epoch: 57, train_loss: 0.6629, test_loss: 1.1407, test_f1: 0.6245
 epoch: 58, train_loss: 0.6368, test_loss: 0.9640, test_f1: 0.6321
 epoch: 59, train_loss: 0.6415, test_loss: 1.0061, test_f1: 0.6102
 epoch: 60, train_loss: 0.6373, test_loss: 0.9602, test_f1: 0.6375
 epoch: 61, train_loss: 0.6309, test_loss: 0.9723, test_f1: 0.6440
 epoch: 62, train_loss: 0.6237, test_loss: 1.0497, test_f1: 0.6621
 epoch: 63, train_loss: 0.6146, test_loss: 0.9830, test_f1: 0.6507
 epoch: 64, train_loss: 0.6241, test_loss: 0.9905, test_f1: 0.6406
 epoch: 65, train_loss: 0.5966, test_loss: 1.0824, test_f1: 0.6446
 epoch: 66, train_loss: 0.6167, test_loss: 1.1241, test_f1: 0.6432
 epoch: 67, train_loss: 0.6181, test_loss: 0.9432, test_f1: 0.6227
 epoch: 68, train_loss: 0.6007, test_loss: 1.0116, test_f1: 0.6265
 epoch: 69, train_loss: 0.5991, test_loss: 0.9515, test_f1: 0.6206
 epoch: 70, train_loss: 0.6265, test_loss: 1.1769, test_f1: 0.6378
 epoch: 71, train_loss: 0.6261, test_loss: 1.1404, test_f1: 0.6280
 epoch: 72, train_loss: 0.6126, test_loss: 1.0739, test_f1: 0.6263
 epoch: 73, train_loss: 0.5746, test_loss: 1.2257, test_f1: 0.6504
 epoch: 74, train_loss: 0.5853, test_loss: 1.0979, test_f1: 0.6524
 epoch: 75, train_loss: 0.5747, test_loss: 1.1551, test_f1: 0.6686
 epoch: 76, train_loss: 0.5909, test_loss: 1.0533, test_f1: 0.6518
 epoch: 77, train_loss: 0.5643, test_loss: 0.9091, test_f1: 0.6510
 epoch: 78, train_loss: 0.5685, test_loss: 1.0245, test_f1: 0.6520
 epoch: 79, train_loss: 0.5785, test_loss: 0.8916, test_f1: 0.6311
 epoch: 80, train_loss: 0.5592, test_loss: 0.9099, test_f1: 0.6598
 epoch: 81, train_loss: 0.5543, test_loss: 0.9578, test_f1: 0.6628
 epoch: 82, train_loss: 0.5599, test_loss: 1.1665, test_f1: 0.6539
 epoch: 83, train_loss: 0.5603, test_loss: 1.0777, test_f1: 0.6639
 epoch: 84, train_loss: 0.5457, test_loss: 1.1079, test_f1: 0.6597
 epoch: 85, train_loss: 0.5508, test_loss: 1.0496, test_f1: 0.6260
 epoch: 86, train_loss: 0.5442, test_loss: 1.0088, test_f1: 0.6686
 epoch: 87, train_loss: 0.5536, test_loss: 0.9628, test_f1: 0.6619
 epoch: 88, train_loss: 0.5369, test_loss: 0.9435, test_f1: 0.6717
 epoch: 89, train_loss: 0.5198, test_loss: 1.1540, test_f1: 0.6588
 epoch: 90, train_loss: 0.5401, test_loss: 1.1970, test_f1: 0.6608
 epoch: 91, train_loss: 0.5342, test_loss: 1.0106, test_f1: 0.6781
 epoch: 92, train_loss: 0.5371, test_loss: 0.9759, test_f1: 0.6631
 epoch: 93, train_loss: 0.5337, test_loss: 1.0547, test_f1: 0.6655
 epoch: 94, train_loss: 0.5217, test_loss: 1.0753, test_f1: 0.6625
 epoch: 95, train_loss: 0.5288, test_loss: 1.0794, test_f1: 0.6684
 epoch: 96, train_loss: 0.5211, test_loss: 1.1058, test_f1: 0.6488
 epoch: 97, train_loss: 0.5171, test_loss: 1.0067, test_f1: 0.6836
 epoch: 98, train_loss: 0.5070, test_loss: 1.0153, test_f1: 0.6684
 epoch: 99, train_loss: 0.5203, test_loss: 1.1284, test_f1: 0.6470
##################ITERATION #3 ****************************************
 epoch: 0, train_loss: 1.0878, test_loss: 1.0118, test_f1: 0.4984
 epoch: 1, train_loss: 1.0086, test_loss: 1.1133, test_f1: 0.4229
 epoch: 2, train_loss: 0.9577, test_loss: 0.9308, test_f1: 0.4855
 epoch: 3, train_loss: 0.9534, test_loss: 1.0513, test_f1: 0.4786
 epoch: 4, train_loss: 0.9323, test_loss: 1.0957, test_f1: 0.4656
 epoch: 5, train_loss: 0.9212, test_loss: 1.0378, test_f1: 0.4399
 epoch: 6, train_loss: 0.9036, test_loss: 0.9138, test_f1: 0.5696
 epoch: 7, train_loss: 0.8855, test_loss: 0.9076, test_f1: 0.5891
 epoch: 8, train_loss: 0.8769, test_loss: 0.9789, test_f1: 0.5059
 epoch: 9, train_loss: 0.8717, test_loss: 0.8373, test_f1: 0.5438
 epoch: 10, train_loss: 0.8554, test_loss: 0.9165, test_f1: 0.5867
 epoch: 11, train_loss: 0.8480, test_loss: 0.9625, test_f1: 0.5479
 epoch: 12, train_loss: 0.8334, test_loss: 0.8567, test_f1: 0.5768
 epoch: 13, train_loss: 0.8150, test_loss: 0.7912, test_f1: 0.6270
 epoch: 14, train_loss: 0.8209, test_loss: 0.9359, test_f1: 0.5492
 epoch: 15, train_loss: 0.8005, test_loss: 0.7973, test_f1: 0.6167
 epoch: 16, train_loss: 0.7897, test_loss: 0.8741, test_f1: 0.5982
 epoch: 17, train_loss: 0.7780, test_loss: 0.8552, test_f1: 0.6053
 epoch: 18, train_loss: 0.7785, test_loss: 0.8142, test_f1: 0.5739
 epoch: 19, train_loss: 0.7743, test_loss: 0.9118, test_f1: 0.5979
 epoch: 20, train_loss: 0.7639, test_loss: 0.9052, test_f1: 0.5765
 epoch: 21, train_loss: 0.7605, test_loss: 0.9048, test_f1: 0.6167
 epoch: 22, train_loss: 0.7380, test_loss: 0.8176, test_f1: 0.6243
 epoch: 23, train_loss: 0.7810, test_loss: 0.8377, test_f1: 0.6213
 epoch: 24, train_loss: 0.7439, test_loss: 0.7563, test_f1: 0.6245
 epoch: 25, train_loss: 0.7297, test_loss: 0.9523, test_f1: 0.6015
 epoch: 26, train_loss: 0.7278, test_loss: 0.8382, test_f1: 0.5923
 epoch: 27, train_loss: 0.7223, test_loss: 0.8297, test_f1: 0.6330
 epoch: 28, train_loss: 0.7226, test_loss: 0.7890, test_f1: 0.6247
 epoch: 29, train_loss: 0.7145, test_loss: 0.9212, test_f1: 0.6548
 epoch: 30, train_loss: 0.7213, test_loss: 0.7985, test_f1: 0.6196
 epoch: 31, train_loss: 0.7253, test_loss: 0.7964, test_f1: 0.5936
 epoch: 32, train_loss: 0.7383, test_loss: 0.9389, test_f1: 0.6196
 epoch: 33, train_loss: 0.7164, test_loss: 0.7656, test_f1: 0.6472
 epoch: 34, train_loss: 0.6935, test_loss: 1.0746, test_f1: 0.5922
 epoch: 35, train_loss: 0.7065, test_loss: 0.9067, test_f1: 0.6325
 epoch: 36, train_loss: 0.6835, test_loss: 0.9038, test_f1: 0.6228
 epoch: 37, train_loss: 0.6853, test_loss: 0.7960, test_f1: 0.6299
 epoch: 38, train_loss: 0.6745, test_loss: 1.0492, test_f1: 0.6695
 epoch: 39, train_loss: 0.6644, test_loss: 0.8821, test_f1: 0.6302
 epoch: 40, train_loss: 0.6784, test_loss: 1.0169, test_f1: 0.6335
 epoch: 41, train_loss: 0.6724, test_loss: 0.9468, test_f1: 0.6785
 epoch: 42, train_loss: 0.6784, test_loss: 0.8421, test_f1: 0.6252
 epoch: 43, train_loss: 0.6618, test_loss: 0.9641, test_f1: 0.6434
 epoch: 44, train_loss: 0.6484, test_loss: 1.0812, test_f1: 0.6646
 epoch: 45, train_loss: 0.6551, test_loss: 1.0176, test_f1: 0.6723
 epoch: 46, train_loss: 0.6260, test_loss: 1.0099, test_f1: 0.5965
 epoch: 47, train_loss: 0.6380, test_loss: 0.8912, test_f1: 0.6460
 epoch: 48, train_loss: 0.6430, test_loss: 0.9935, test_f1: 0.6592
 epoch: 49, train_loss: 0.6291, test_loss: 1.0453, test_f1: 0.6238
 epoch: 50, train_loss: 0.6183, test_loss: 1.1680, test_f1: 0.6403
 epoch: 51, train_loss: 0.5879, test_loss: 1.0239, test_f1: 0.6497
 epoch: 52, train_loss: 0.5786, test_loss: 0.8842, test_f1: 0.6674
 epoch: 53, train_loss: 0.5594, test_loss: 1.0086, test_f1: 0.6680
 epoch: 54, train_loss: 0.5362, test_loss: 1.0523, test_f1: 0.6682
 epoch: 55, train_loss: 0.5594, test_loss: 1.1307, test_f1: 0.6874
 epoch: 56, train_loss: 0.5411, test_loss: 1.1272, test_f1: 0.6799
 epoch: 57, train_loss: 0.5450, test_loss: 1.1172, test_f1: 0.6656
 epoch: 58, train_loss: 0.5382, test_loss: 1.2034, test_f1: 0.6889
 epoch: 59, train_loss: 0.5166, test_loss: 0.9631, test_f1: 0.6781
 epoch: 60, train_loss: 0.5170, test_loss: 1.2582, test_f1: 0.6640
 epoch: 61, train_loss: 0.5491, test_loss: 1.2054, test_f1: 0.6784
 epoch: 62, train_loss: 0.5395, test_loss: 1.1442, test_f1: 0.6619
 epoch: 63, train_loss: 0.5242, test_loss: 1.1308, test_f1: 0.6905
 epoch: 64, train_loss: 0.5036, test_loss: 1.2230, test_f1: 0.6902
 epoch: 65, train_loss: 0.5263, test_loss: 1.0793, test_f1: 0.7147
 epoch: 66, train_loss: 0.4963, test_loss: 1.0175, test_f1: 0.7131
 epoch: 67, train_loss: 0.5184, test_loss: 1.0918, test_f1: 0.7021
 epoch: 68, train_loss: 0.4991, test_loss: 1.1854, test_f1: 0.6894
 epoch: 69, train_loss: 0.4864, test_loss: 1.1164, test_f1: 0.7043
 epoch: 70, train_loss: 0.5007, test_loss: 1.2455, test_f1: 0.6895
 epoch: 71, train_loss: 0.4832, test_loss: 1.1463, test_f1: 0.6928
 epoch: 72, train_loss: 0.4927, test_loss: 1.2475, test_f1: 0.6778
 epoch: 73, train_loss: 0.4946, test_loss: 1.3414, test_f1: 0.7065
 epoch: 74, train_loss: 0.4817, test_loss: 1.2413, test_f1: 0.6907
 epoch: 75, train_loss: 0.4612, test_loss: 1.4012, test_f1: 0.7179
 epoch: 76, train_loss: 0.4533, test_loss: 1.2554, test_f1: 0.7044
 epoch: 77, train_loss: 0.4925, test_loss: 0.9946, test_f1: 0.6947
 epoch: 78, train_loss: 0.4638, test_loss: 1.0311, test_f1: 0.6976
 epoch: 79, train_loss: 0.4512, test_loss: 1.0694, test_f1: 0.6982
 epoch: 80, train_loss: 0.4689, test_loss: 1.0846, test_f1: 0.6936
 epoch: 81, train_loss: 0.4678, test_loss: 1.1973, test_f1: 0.6872
 epoch: 82, train_loss: 0.4636, test_loss: 1.3832, test_f1: 0.6770
 epoch: 83, train_loss: 0.4679, test_loss: 1.1214, test_f1: 0.6814
 epoch: 84, train_loss: 0.4526, test_loss: 1.2503, test_f1: 0.7215
 epoch: 85, train_loss: 0.4542, test_loss: 1.1436, test_f1: 0.6889
 epoch: 86, train_loss: 0.4812, test_loss: 1.1353, test_f1: 0.6969
 epoch: 87, train_loss: 0.4425, test_loss: 1.2500, test_f1: 0.7047
 epoch: 88, train_loss: 0.4371, test_loss: 1.2399, test_f1: 0.6919
 epoch: 89, train_loss: 0.4550, test_loss: 1.1553, test_f1: 0.7072
 epoch: 90, train_loss: 0.4335, test_loss: 1.3574, test_f1: 0.6998
 epoch: 91, train_loss: 0.4401, test_loss: 1.2688, test_f1: 0.6856
 epoch: 92, train_loss: 0.4314, test_loss: 1.4065, test_f1: 0.6933
 epoch: 93, train_loss: 0.4275, test_loss: 1.2096, test_f1: 0.7027
 epoch: 94, train_loss: 0.4314, test_loss: 1.2826, test_f1: 0.7037
 epoch: 95, train_loss: 0.4327, test_loss: 1.1922, test_f1: 0.6985
 epoch: 96, train_loss: 0.3944, test_loss: 1.3285, test_f1: 0.6908
 epoch: 97, train_loss: 0.3995, test_loss: 1.4433, test_f1: 0.6820
 epoch: 98, train_loss: 0.4132, test_loss: 1.3238, test_f1: 0.7100
 epoch: 99, train_loss: 0.4164, test_loss: 1.2750, test_f1: 0.6914
##################ITERATION #4 ****************************************
 epoch: 0, train_loss: 1.1074, test_loss: 1.0160, test_f1: 0.5097
 epoch: 1, train_loss: 1.0044, test_loss: 1.1444, test_f1: 0.4539
 epoch: 2, train_loss: 0.9520, test_loss: 1.0064, test_f1: 0.5530
 epoch: 3, train_loss: 0.9365, test_loss: 0.8725, test_f1: 0.5499
 epoch: 4, train_loss: 0.9325, test_loss: 1.0035, test_f1: 0.5028
 epoch: 5, train_loss: 0.8981, test_loss: 1.0257, test_f1: 0.5159
 epoch: 6, train_loss: 0.9203, test_loss: 0.8881, test_f1: 0.5430
 epoch: 7, train_loss: 0.8907, test_loss: 0.8712, test_f1: 0.5808
 epoch: 8, train_loss: 0.9008, test_loss: 0.9019, test_f1: 0.5701
 epoch: 9, train_loss: 0.8881, test_loss: 0.8641, test_f1: 0.5752
 epoch: 10, train_loss: 0.8740, test_loss: 0.8430, test_f1: 0.5940
 epoch: 11, train_loss: 0.8679, test_loss: 0.8429, test_f1: 0.6229
 epoch: 12, train_loss: 0.8550, test_loss: 0.9485, test_f1: 0.5423
 epoch: 13, train_loss: 0.8458, test_loss: 0.9395, test_f1: 0.5867
 epoch: 14, train_loss: 0.8490, test_loss: 0.8839, test_f1: 0.5664
 epoch: 15, train_loss: 0.8572, test_loss: 0.9306, test_f1: 0.5517
 epoch: 16, train_loss: 0.8505, test_loss: 0.8407, test_f1: 0.5659
 epoch: 17, train_loss: 0.8289, test_loss: 0.9166, test_f1: 0.6088
 epoch: 18, train_loss: 0.8268, test_loss: 0.9599, test_f1: 0.5851
 epoch: 19, train_loss: 0.8147, test_loss: 0.8964, test_f1: 0.5941
 epoch: 20, train_loss: 0.8047, test_loss: 0.8572, test_f1: 0.5829
 epoch: 21, train_loss: 0.8120, test_loss: 0.8974, test_f1: 0.6285
 epoch: 22, train_loss: 0.7902, test_loss: 0.8645, test_f1: 0.5668
 epoch: 23, train_loss: 0.7926, test_loss: 0.8708, test_f1: 0.6330
 epoch: 24, train_loss: 0.7875, test_loss: 0.7891, test_f1: 0.5934
 epoch: 25, train_loss: 0.7868, test_loss: 1.0028, test_f1: 0.6029
 epoch: 26, train_loss: 0.7731, test_loss: 0.8725, test_f1: 0.5953
 epoch: 27, train_loss: 0.8001, test_loss: 0.8961, test_f1: 0.5843
 epoch: 28, train_loss: 0.7861, test_loss: 0.9105, test_f1: 0.6227
 epoch: 29, train_loss: 0.7689, test_loss: 0.8296, test_f1: 0.6248
 epoch: 30, train_loss: 0.7573, test_loss: 0.8474, test_f1: 0.6198
 epoch: 31, train_loss: 0.7530, test_loss: 0.9715, test_f1: 0.6056
 epoch: 32, train_loss: 0.7499, test_loss: 0.9363, test_f1: 0.6032
 epoch: 33, train_loss: 0.7601, test_loss: 0.8914, test_f1: 0.6011
 epoch: 34, train_loss: 0.7414, test_loss: 0.9575, test_f1: 0.6155
 epoch: 35, train_loss: 0.7237, test_loss: 0.8354, test_f1: 0.5755
 epoch: 36, train_loss: 0.7196, test_loss: 0.7908, test_f1: 0.5974
 epoch: 37, train_loss: 0.6972, test_loss: 1.0015, test_f1: 0.6302
 epoch: 38, train_loss: 0.7196, test_loss: 0.9540, test_f1: 0.6355
 epoch: 39, train_loss: 0.7146, test_loss: 0.9681, test_f1: 0.6179
 epoch: 40, train_loss: 0.7048, test_loss: 0.9714, test_f1: 0.6311
 epoch: 41, train_loss: 0.7051, test_loss: 0.8751, test_f1: 0.6446
 epoch: 42, train_loss: 0.7066, test_loss: 0.9787, test_f1: 0.6438
 epoch: 43, train_loss: 0.7046, test_loss: 1.0696, test_f1: 0.5706
 epoch: 44, train_loss: 0.6934, test_loss: 1.1436, test_f1: 0.6096
 epoch: 45, train_loss: 0.6855, test_loss: 0.8856, test_f1: 0.6545
 epoch: 46, train_loss: 0.7028, test_loss: 0.9181, test_f1: 0.6170
 epoch: 47, train_loss: 0.6865, test_loss: 0.7382, test_f1: 0.6816
 epoch: 48, train_loss: 0.6721, test_loss: 0.9625, test_f1: 0.6139
 epoch: 49, train_loss: 0.6741, test_loss: 0.8572, test_f1: 0.6668
 epoch: 50, train_loss: 0.6632, test_loss: 0.9428, test_f1: 0.6329
 epoch: 51, train_loss: 0.6296, test_loss: 1.0215, test_f1: 0.6512
 epoch: 52, train_loss: 0.6044, test_loss: 0.9055, test_f1: 0.6676
 epoch: 53, train_loss: 0.5772, test_loss: 1.0348, test_f1: 0.6618
 epoch: 54, train_loss: 0.6352, test_loss: 1.0202, test_f1: 0.6627
 epoch: 55, train_loss: 0.6021, test_loss: 0.9988, test_f1: 0.6858
 epoch: 56, train_loss: 0.5946, test_loss: 1.0262, test_f1: 0.6531
 epoch: 57, train_loss: 0.5574, test_loss: 0.8853, test_f1: 0.6762
 epoch: 58, train_loss: 0.5616, test_loss: 1.0014, test_f1: 0.6945
 epoch: 59, train_loss: 0.5695, test_loss: 1.0133, test_f1: 0.6840
 epoch: 60, train_loss: 0.5716, test_loss: 0.9952, test_f1: 0.6877
 epoch: 61, train_loss: 0.5676, test_loss: 1.0761, test_f1: 0.6589
 epoch: 62, train_loss: 0.5582, test_loss: 1.0014, test_f1: 0.6815
 epoch: 63, train_loss: 0.5453, test_loss: 1.0708, test_f1: 0.6547
 epoch: 64, train_loss: 0.5540, test_loss: 1.0551, test_f1: 0.6683
 epoch: 65, train_loss: 0.5510, test_loss: 1.0623, test_f1: 0.6766
 epoch: 66, train_loss: 0.5490, test_loss: 0.9622, test_f1: 0.6655
 epoch: 67, train_loss: 0.5411, test_loss: 0.9689, test_f1: 0.6911
 epoch: 68, train_loss: 0.5353, test_loss: 1.0167, test_f1: 0.6625
 epoch: 69, train_loss: 0.5537, test_loss: 1.0168, test_f1: 0.6846
 epoch: 70, train_loss: 0.5293, test_loss: 1.0014, test_f1: 0.6633
 epoch: 71, train_loss: 0.5351, test_loss: 1.0243, test_f1: 0.6456
 epoch: 72, train_loss: 0.5252, test_loss: 0.8891, test_f1: 0.6828
 epoch: 73, train_loss: 0.5185, test_loss: 0.9834, test_f1: 0.6695
 epoch: 74, train_loss: 0.5301, test_loss: 1.0677, test_f1: 0.6759
 epoch: 75, train_loss: 0.4986, test_loss: 1.0861, test_f1: 0.6841
 epoch: 76, train_loss: 0.5098, test_loss: 1.0216, test_f1: 0.6932
 epoch: 77, train_loss: 0.5141, test_loss: 1.0165, test_f1: 0.7202
 epoch: 78, train_loss: 0.4844, test_loss: 1.0231, test_f1: 0.6811
 epoch: 79, train_loss: 0.5034, test_loss: 0.8489, test_f1: 0.6823
 epoch: 80, train_loss: 0.4957, test_loss: 0.8807, test_f1: 0.7056
 epoch: 81, train_loss: 0.4953, test_loss: 1.0416, test_f1: 0.6753
 epoch: 82, train_loss: 0.5008, test_loss: 0.9745, test_f1: 0.6929
 epoch: 83, train_loss: 0.4831, test_loss: 0.9504, test_f1: 0.6744
 epoch: 84, train_loss: 0.5016, test_loss: 0.9317, test_f1: 0.6652
 epoch: 85, train_loss: 0.4868, test_loss: 1.0526, test_f1: 0.6498
 epoch: 86, train_loss: 0.5023, test_loss: 1.0333, test_f1: 0.6721
 epoch: 87, train_loss: 0.4750, test_loss: 1.0242, test_f1: 0.6752
 epoch: 88, train_loss: 0.4856, test_loss: 0.9677, test_f1: 0.6848
 epoch: 89, train_loss: 0.4687, test_loss: 1.0615, test_f1: 0.6318
 epoch: 90, train_loss: 0.4548, test_loss: 1.0397, test_f1: 0.6973
 epoch: 91, train_loss: 0.4534, test_loss: 1.1449, test_f1: 0.6552
 epoch: 92, train_loss: 0.4530, test_loss: 1.0738, test_f1: 0.6779
 epoch: 93, train_loss: 0.4455, test_loss: 0.9507, test_f1: 0.7040
 epoch: 94, train_loss: 0.4452, test_loss: 1.1615, test_f1: 0.6690
 epoch: 95, train_loss: 0.4483, test_loss: 0.9892, test_f1: 0.6901
 epoch: 96, train_loss: 0.4569, test_loss: 0.9023, test_f1: 0.6591
 epoch: 97, train_loss: 0.4501, test_loss: 1.0968, test_f1: 0.6943
 epoch: 98, train_loss: 0.4473, test_loss: 1.1376, test_f1: 0.6840
 epoch: 99, train_loss: 0.4598, test_loss: 1.0380, test_f1: 0.6468
##################ITERATION #5 ****************************************
 epoch: 0, train_loss: 1.1496, test_loss: 1.0806, test_f1: 0.4241
 epoch: 1, train_loss: 0.9974, test_loss: 0.9956, test_f1: 0.4739
 epoch: 2, train_loss: 0.9828, test_loss: 0.9506, test_f1: 0.4900
 epoch: 3, train_loss: 0.9687, test_loss: 1.0512, test_f1: 0.5289
 epoch: 4, train_loss: 0.9322, test_loss: 1.0945, test_f1: 0.4588
 epoch: 5, train_loss: 0.9320, test_loss: 0.9008, test_f1: 0.5630
 epoch: 6, train_loss: 0.9178, test_loss: 0.9216, test_f1: 0.5246
 epoch: 7, train_loss: 0.9063, test_loss: 0.9967, test_f1: 0.5788
 epoch: 8, train_loss: 0.9043, test_loss: 1.0645, test_f1: 0.5048
 epoch: 9, train_loss: 0.8718, test_loss: 1.1290, test_f1: 0.4865
 epoch: 10, train_loss: 0.8551, test_loss: 0.9333, test_f1: 0.5988
 epoch: 11, train_loss: 0.8480, test_loss: 1.0934, test_f1: 0.5367
 epoch: 12, train_loss: 0.8459, test_loss: 0.8116, test_f1: 0.6034
 epoch: 13, train_loss: 0.8485, test_loss: 1.1730, test_f1: 0.4820
 epoch: 14, train_loss: 0.8208, test_loss: 0.9672, test_f1: 0.5959
 epoch: 15, train_loss: 0.8609, test_loss: 0.8679, test_f1: 0.5647
 epoch: 16, train_loss: 0.8328, test_loss: 1.1055, test_f1: 0.5341
 epoch: 17, train_loss: 0.8123, test_loss: 0.9215, test_f1: 0.5755
 epoch: 18, train_loss: 0.7987, test_loss: 0.9239, test_f1: 0.5910
 epoch: 19, train_loss: 0.7992, test_loss: 0.9759, test_f1: 0.6034
 epoch: 20, train_loss: 0.8026, test_loss: 0.8934, test_f1: 0.5713
 epoch: 21, train_loss: 0.7898, test_loss: 0.8296, test_f1: 0.5821
 epoch: 22, train_loss: 0.7730, test_loss: 0.9684, test_f1: 0.5942
 epoch: 23, train_loss: 0.7681, test_loss: 0.8175, test_f1: 0.6777
 epoch: 24, train_loss: 0.7506, test_loss: 0.9099, test_f1: 0.6201
 epoch: 25, train_loss: 0.7708, test_loss: 0.8288, test_f1: 0.6590
 epoch: 26, train_loss: 0.7510, test_loss: 1.0341, test_f1: 0.5996
 epoch: 27, train_loss: 0.7408, test_loss: 0.8462, test_f1: 0.6520
 epoch: 28, train_loss: 0.7603, test_loss: 0.9761, test_f1: 0.6087
 epoch: 29, train_loss: 0.7357, test_loss: 0.9097, test_f1: 0.6375
 epoch: 30, train_loss: 0.7210, test_loss: 0.9936, test_f1: 0.6260
 epoch: 31, train_loss: 0.7044, test_loss: 0.8474, test_f1: 0.6312
 epoch: 32, train_loss: 0.7167, test_loss: 1.0956, test_f1: 0.6162
 epoch: 33, train_loss: 0.7192, test_loss: 0.9134, test_f1: 0.6299
 epoch: 34, train_loss: 0.7125, test_loss: 0.8854, test_f1: 0.6485
 epoch: 35, train_loss: 0.6800, test_loss: 1.1196, test_f1: 0.5881
 epoch: 36, train_loss: 0.7062, test_loss: 0.8909, test_f1: 0.6030
 epoch: 37, train_loss: 0.7016, test_loss: 0.9444, test_f1: 0.6572
 epoch: 38, train_loss: 0.7648, test_loss: 2.2851, test_f1: 0.3652
 epoch: 39, train_loss: 0.8396, test_loss: 0.8501, test_f1: 0.6217
 epoch: 40, train_loss: 0.7349, test_loss: 0.9532, test_f1: 0.6715
 epoch: 41, train_loss: 0.7010, test_loss: 0.7952, test_f1: 0.6248
 epoch: 42, train_loss: 0.6748, test_loss: 0.9660, test_f1: 0.6328
 epoch: 43, train_loss: 0.6865, test_loss: 0.9867, test_f1: 0.6474
 epoch: 44, train_loss: 0.6774, test_loss: 0.9655, test_f1: 0.6057
 epoch: 45, train_loss: 0.6813, test_loss: 0.8490, test_f1: 0.6490
 epoch: 46, train_loss: 0.6429, test_loss: 0.9046, test_f1: 0.6525
 epoch: 47, train_loss: 0.6236, test_loss: 0.9534, test_f1: 0.6144
 epoch: 48, train_loss: 0.6852, test_loss: 0.9536, test_f1: 0.6569
 epoch: 49, train_loss: 0.6682, test_loss: 0.8784, test_f1: 0.6896
 epoch: 50, train_loss: 0.6480, test_loss: 0.9523, test_f1: 0.6422
 epoch: 51, train_loss: 0.5973, test_loss: 0.8625, test_f1: 0.6427
 epoch: 52, train_loss: 0.5761, test_loss: 0.7955, test_f1: 0.6867
 epoch: 53, train_loss: 0.5807, test_loss: 0.9364, test_f1: 0.6414
 epoch: 54, train_loss: 0.5676, test_loss: 0.9123, test_f1: 0.6667
 epoch: 55, train_loss: 0.5756, test_loss: 0.9157, test_f1: 0.6528
 epoch: 56, train_loss: 0.5649, test_loss: 0.8660, test_f1: 0.6958
 epoch: 57, train_loss: 0.5490, test_loss: 0.9310, test_f1: 0.7021
 epoch: 58, train_loss: 0.5635, test_loss: 0.9007, test_f1: 0.6762
 epoch: 59, train_loss: 0.5359, test_loss: 0.9883, test_f1: 0.6623
 epoch: 60, train_loss: 0.5321, test_loss: 0.8861, test_f1: 0.6975
 epoch: 61, train_loss: 0.5532, test_loss: 1.0410, test_f1: 0.6491
 epoch: 62, train_loss: 0.5365, test_loss: 1.0375, test_f1: 0.6913
 epoch: 63, train_loss: 0.5333, test_loss: 0.9692, test_f1: 0.6779
 epoch: 64, train_loss: 0.5259, test_loss: 1.0493, test_f1: 0.6912
 epoch: 65, train_loss: 0.5187, test_loss: 1.0445, test_f1: 0.6505
 epoch: 66, train_loss: 0.4938, test_loss: 1.1193, test_f1: 0.6496
 epoch: 67, train_loss: 0.5202, test_loss: 0.9255, test_f1: 0.6826
 epoch: 68, train_loss: 0.4870, test_loss: 1.0278, test_f1: 0.6694
 epoch: 69, train_loss: 0.5257, test_loss: 1.0324, test_f1: 0.6673
 epoch: 70, train_loss: 0.5178, test_loss: 0.8792, test_f1: 0.6719
 epoch: 71, train_loss: 0.5135, test_loss: 0.9814, test_f1: 0.6693
 epoch: 72, train_loss: 0.4854, test_loss: 1.0496, test_f1: 0.6774
 epoch: 73, train_loss: 0.4766, test_loss: 0.9768, test_f1: 0.6732
 epoch: 74, train_loss: 0.4886, test_loss: 1.1363, test_f1: 0.6555
 epoch: 75, train_loss: 0.4899, test_loss: 1.0746, test_f1: 0.6692
 epoch: 76, train_loss: 0.4771, test_loss: 1.2000, test_f1: 0.6814
 epoch: 77, train_loss: 0.4911, test_loss: 0.9822, test_f1: 0.6550
 epoch: 78, train_loss: 0.4864, test_loss: 1.0466, test_f1: 0.6831
 epoch: 79, train_loss: 0.4788, test_loss: 0.9626, test_f1: 0.6648
 epoch: 80, train_loss: 0.4682, test_loss: 1.0136, test_f1: 0.6917
 epoch: 81, train_loss: 0.4728, test_loss: 1.0241, test_f1: 0.6570
 epoch: 82, train_loss: 0.4854, test_loss: 1.0839, test_f1: 0.6914
 epoch: 83, train_loss: 0.4614, test_loss: 1.0052, test_f1: 0.6685
 epoch: 84, train_loss: 0.4598, test_loss: 0.9724, test_f1: 0.6808
 epoch: 85, train_loss: 0.4653, test_loss: 1.0849, test_f1: 0.6902
 epoch: 86, train_loss: 0.4654, test_loss: 0.9239, test_f1: 0.6641
 epoch: 87, train_loss: 0.4409, test_loss: 0.9999, test_f1: 0.6868
 epoch: 88, train_loss: 0.4761, test_loss: 1.0605, test_f1: 0.6634
 epoch: 89, train_loss: 0.4489, test_loss: 0.9950, test_f1: 0.6690
 epoch: 90, train_loss: 0.4406, test_loss: 1.0228, test_f1: 0.6781
 epoch: 91, train_loss: 0.4446, test_loss: 1.0436, test_f1: 0.6726
 epoch: 92, train_loss: 0.4666, test_loss: 1.0790, test_f1: 0.6739
 epoch: 93, train_loss: 0.4509, test_loss: 1.0324, test_f1: 0.6716
 epoch: 94, train_loss: 0.4252, test_loss: 1.2056, test_f1: 0.6615
 epoch: 95, train_loss: 0.4470, test_loss: 0.9879, test_f1: 0.6703
 epoch: 96, train_loss: 0.4125, test_loss: 1.0470, test_f1: 0.6779
 epoch: 97, train_loss: 0.4324, test_loss: 0.9286, test_f1: 0.7057
 epoch: 98, train_loss: 0.4110, test_loss: 1.0283, test_f1: 0.6750
 epoch: 99, train_loss: 0.4255, test_loss: 1.0402, test_f1: 0.6613
##################ITERATION #6 ****************************************
 epoch: 0, train_loss: 1.1344, test_loss: 1.0403, test_f1: 0.4762
 epoch: 1, train_loss: 0.9883, test_loss: 0.9718, test_f1: 0.4824
 epoch: 2, train_loss: 0.9586, test_loss: 0.9216, test_f1: 0.4945
 epoch: 3, train_loss: 0.9310, test_loss: 1.0908, test_f1: 0.4815
 epoch: 4, train_loss: 0.9197, test_loss: 0.9045, test_f1: 0.5188
 epoch: 5, train_loss: 0.9051, test_loss: 0.9227, test_f1: 0.5540
 epoch: 6, train_loss: 0.8820, test_loss: 0.9078, test_f1: 0.5341
 epoch: 7, train_loss: 0.8835, test_loss: 0.9519, test_f1: 0.4927
 epoch: 8, train_loss: 0.8839, test_loss: 0.8934, test_f1: 0.5962
 epoch: 9, train_loss: 0.8686, test_loss: 1.0808, test_f1: 0.5200
 epoch: 10, train_loss: 0.8644, test_loss: 0.9054, test_f1: 0.5840
 epoch: 11, train_loss: 0.8600, test_loss: 1.0399, test_f1: 0.4968
 epoch: 12, train_loss: 0.8426, test_loss: 0.8963, test_f1: 0.5950
 epoch: 13, train_loss: 0.8446, test_loss: 1.0033, test_f1: 0.5642
 epoch: 14, train_loss: 0.8370, test_loss: 0.8694, test_f1: 0.5747
 epoch: 15, train_loss: 0.8428, test_loss: 1.0582, test_f1: 0.5198
 epoch: 16, train_loss: 0.8379, test_loss: 0.9644, test_f1: 0.5960
 epoch: 17, train_loss: 0.8111, test_loss: 0.8932, test_f1: 0.5647
 epoch: 18, train_loss: 0.8093, test_loss: 0.8732, test_f1: 0.5980
 epoch: 19, train_loss: 0.7982, test_loss: 0.9681, test_f1: 0.5894
 epoch: 20, train_loss: 0.8033, test_loss: 0.8886, test_f1: 0.6029
 epoch: 21, train_loss: 0.7973, test_loss: 0.9401, test_f1: 0.6089
 epoch: 22, train_loss: 0.7902, test_loss: 0.8424, test_f1: 0.5908
 epoch: 23, train_loss: 0.7849, test_loss: 0.8575, test_f1: 0.5977
 epoch: 24, train_loss: 0.7645, test_loss: 0.9104, test_f1: 0.5823
 epoch: 25, train_loss: 0.7724, test_loss: 0.8790, test_f1: 0.5420
 epoch: 26, train_loss: 0.7719, test_loss: 0.9974, test_f1: 0.5556
 epoch: 27, train_loss: 0.7599, test_loss: 0.8990, test_f1: 0.5950
 epoch: 28, train_loss: 0.7817, test_loss: 0.9425, test_f1: 0.6541
 epoch: 29, train_loss: 0.7581, test_loss: 0.9206, test_f1: 0.6134
 epoch: 30, train_loss: 0.7519, test_loss: 0.8943, test_f1: 0.6217
 epoch: 31, train_loss: 0.7452, test_loss: 0.8935, test_f1: 0.5728
 epoch: 32, train_loss: 0.8649, test_loss: 1.3284, test_f1: 0.4562
 epoch: 33, train_loss: 0.8044, test_loss: 0.8426, test_f1: 0.5773
 epoch: 34, train_loss: 0.7574, test_loss: 1.1027, test_f1: 0.6030
 epoch: 35, train_loss: 0.7520, test_loss: 1.1741, test_f1: 0.6172
 epoch: 36, train_loss: 0.7426, test_loss: 1.0618, test_f1: 0.6178
 epoch: 37, train_loss: 0.7340, test_loss: 0.8422, test_f1: 0.6144
 epoch: 38, train_loss: 0.7623, test_loss: 0.8312, test_f1: 0.6014
 epoch: 39, train_loss: 0.7332, test_loss: 1.0363, test_f1: 0.6039
 epoch: 40, train_loss: 0.7384, test_loss: 0.9279, test_f1: 0.6245
 epoch: 41, train_loss: 0.7112, test_loss: 0.8877, test_f1: 0.6638
 epoch: 42, train_loss: 0.7140, test_loss: 0.8986, test_f1: 0.6251
 epoch: 43, train_loss: 0.6805, test_loss: 0.7382, test_f1: 0.6375
 epoch: 44, train_loss: 0.6706, test_loss: 1.1664, test_f1: 0.6413
 epoch: 45, train_loss: 0.6834, test_loss: 0.8956, test_f1: 0.6459
 epoch: 46, train_loss: 0.7277, test_loss: 0.8201, test_f1: 0.6732
 epoch: 47, train_loss: 0.7101, test_loss: 0.9969, test_f1: 0.6227
 epoch: 48, train_loss: 0.6519, test_loss: 1.0845, test_f1: 0.6269
 epoch: 49, train_loss: 0.6565, test_loss: 1.0618, test_f1: 0.6312
 epoch: 50, train_loss: 0.6567, test_loss: 0.9604, test_f1: 0.6469
 epoch: 51, train_loss: 0.6102, test_loss: 1.0466, test_f1: 0.6611
 epoch: 52, train_loss: 0.6076, test_loss: 0.8567, test_f1: 0.6553
 epoch: 53, train_loss: 0.5975, test_loss: 0.9094, test_f1: 0.6727
 epoch: 54, train_loss: 0.5853, test_loss: 0.9062, test_f1: 0.6615
 epoch: 55, train_loss: 0.5919, test_loss: 0.9049, test_f1: 0.6704
 epoch: 56, train_loss: 0.5833, test_loss: 1.0222, test_f1: 0.6887
 epoch: 57, train_loss: 0.5847, test_loss: 0.9293, test_f1: 0.6662
 epoch: 58, train_loss: 0.5839, test_loss: 1.0308, test_f1: 0.6726
 epoch: 59, train_loss: 0.5757, test_loss: 0.9618, test_f1: 0.6796
 epoch: 60, train_loss: 0.5682, test_loss: 1.0199, test_f1: 0.6517
 epoch: 61, train_loss: 0.5683, test_loss: 0.9590, test_f1: 0.6443
 epoch: 62, train_loss: 0.5964, test_loss: 1.0455, test_f1: 0.6516
 epoch: 63, train_loss: 0.5615, test_loss: 0.8987, test_f1: 0.6625
 epoch: 64, train_loss: 0.5667, test_loss: 0.9973, test_f1: 0.6527
 epoch: 65, train_loss: 0.5528, test_loss: 1.0037, test_f1: 0.6600
 epoch: 66, train_loss: 0.5403, test_loss: 0.8942, test_f1: 0.6560
 epoch: 67, train_loss: 0.5402, test_loss: 1.0400, test_f1: 0.6584
 epoch: 68, train_loss: 0.5627, test_loss: 1.0210, test_f1: 0.6409
 epoch: 69, train_loss: 0.5259, test_loss: 1.1137, test_f1: 0.6655
 epoch: 70, train_loss: 0.5284, test_loss: 1.0401, test_f1: 0.6542
 epoch: 71, train_loss: 0.5117, test_loss: 1.0413, test_f1: 0.6575
 epoch: 72, train_loss: 0.5236, test_loss: 1.0319, test_f1: 0.6420
 epoch: 73, train_loss: 0.5154, test_loss: 1.1550, test_f1: 0.6714
 epoch: 74, train_loss: 0.5108, test_loss: 1.2514, test_f1: 0.6842
 epoch: 75, train_loss: 0.5240, test_loss: 1.1436, test_f1: 0.6528
 epoch: 76, train_loss: 0.5116, test_loss: 1.1113, test_f1: 0.6598
 epoch: 77, train_loss: 0.5062, test_loss: 1.3054, test_f1: 0.6610
 epoch: 78, train_loss: 0.5171, test_loss: 1.1914, test_f1: 0.6919
 epoch: 79, train_loss: 0.5271, test_loss: 1.1066, test_f1: 0.6543
 epoch: 80, train_loss: 0.5001, test_loss: 1.4954, test_f1: 0.6687
 epoch: 81, train_loss: 0.5123, test_loss: 1.0612, test_f1: 0.6531
 epoch: 82, train_loss: 0.4880, test_loss: 1.0848, test_f1: 0.6479
 epoch: 83, train_loss: 0.4881, test_loss: 1.0220, test_f1: 0.6597
 epoch: 84, train_loss: 0.5052, test_loss: 1.1953, test_f1: 0.6743
 epoch: 85, train_loss: 0.4964, test_loss: 1.2161, test_f1: 0.6563
 epoch: 86, train_loss: 0.4768, test_loss: 1.0192, test_f1: 0.6764
 epoch: 87, train_loss: 0.4791, test_loss: 1.0123, test_f1: 0.6645
 epoch: 88, train_loss: 0.4868, test_loss: 1.1266, test_f1: 0.6656
 epoch: 89, train_loss: 0.4982, test_loss: 1.1830, test_f1: 0.6797
 epoch: 90, train_loss: 0.4629, test_loss: 1.1398, test_f1: 0.6639
 epoch: 91, train_loss: 0.4780, test_loss: 1.2075, test_f1: 0.6751
 epoch: 92, train_loss: 0.4722, test_loss: 1.1236, test_f1: 0.6824
 epoch: 93, train_loss: 0.4689, test_loss: 1.0401, test_f1: 0.6775
 epoch: 94, train_loss: 0.4583, test_loss: 1.4014, test_f1: 0.6938
 epoch: 95, train_loss: 0.4871, test_loss: 1.0572, test_f1: 0.6666
 epoch: 96, train_loss: 0.4824, test_loss: 1.2868, test_f1: 0.6854
 epoch: 97, train_loss: 0.4717, test_loss: 1.2840, test_f1: 0.6693
 epoch: 98, train_loss: 0.4599, test_loss: 1.0130, test_f1: 0.6784
 epoch: 99, train_loss: 0.4501, test_loss: 1.0228, test_f1: 0.6919
##################ITERATION #7 ****************************************
 epoch: 0, train_loss: 1.1419, test_loss: 1.4409, test_f1: 0.4277
 epoch: 1, train_loss: 0.9923, test_loss: 0.9797, test_f1: 0.4925
 epoch: 2, train_loss: 0.9625, test_loss: 1.1283, test_f1: 0.4849
 epoch: 3, train_loss: 0.9604, test_loss: 1.0118, test_f1: 0.4955
 epoch: 4, train_loss: 0.9153, test_loss: 0.9766, test_f1: 0.5416
 epoch: 5, train_loss: 0.9202, test_loss: 0.9218, test_f1: 0.5233
 epoch: 6, train_loss: 0.8956, test_loss: 0.8672, test_f1: 0.5279
 epoch: 7, train_loss: 0.8917, test_loss: 1.0587, test_f1: 0.4927
 epoch: 8, train_loss: 0.8650, test_loss: 1.0876, test_f1: 0.4931
 epoch: 9, train_loss: 0.8628, test_loss: 0.8862, test_f1: 0.5739
 epoch: 10, train_loss: 0.8461, test_loss: 0.8189, test_f1: 0.5869
 epoch: 11, train_loss: 0.8602, test_loss: 0.8495, test_f1: 0.6224
 epoch: 12, train_loss: 0.8351, test_loss: 0.8091, test_f1: 0.6082
 epoch: 13, train_loss: 0.8354, test_loss: 0.8359, test_f1: 0.6281
 epoch: 14, train_loss: 0.8258, test_loss: 0.8115, test_f1: 0.5939
 epoch: 15, train_loss: 0.8021, test_loss: 0.8695, test_f1: 0.5672
 epoch: 16, train_loss: 0.8319, test_loss: 0.9639, test_f1: 0.5722
 epoch: 17, train_loss: 0.8311, test_loss: 0.9084, test_f1: 0.5815
 epoch: 18, train_loss: 0.8307, test_loss: 0.7836, test_f1: 0.6240
 epoch: 19, train_loss: 0.8004, test_loss: 0.7588, test_f1: 0.6132
 epoch: 20, train_loss: 0.7921, test_loss: 0.8509, test_f1: 0.5898
 epoch: 21, train_loss: 0.7878, test_loss: 0.7512, test_f1: 0.6387
 epoch: 22, train_loss: 0.7766, test_loss: 0.8531, test_f1: 0.6117
 epoch: 23, train_loss: 0.7899, test_loss: 0.7841, test_f1: 0.5745
 epoch: 24, train_loss: 0.7417, test_loss: 0.9014, test_f1: 0.6056
 epoch: 25, train_loss: 0.7639, test_loss: 0.8182, test_f1: 0.5872
 epoch: 26, train_loss: 0.7704, test_loss: 0.7462, test_f1: 0.6187
 epoch: 27, train_loss: 0.7420, test_loss: 0.8085, test_f1: 0.6300
 epoch: 28, train_loss: 0.7452, test_loss: 0.9031, test_f1: 0.5644
 epoch: 29, train_loss: 0.7479, test_loss: 0.8759, test_f1: 0.5692
 epoch: 30, train_loss: 0.7411, test_loss: 0.8243, test_f1: 0.6193
 epoch: 31, train_loss: 0.7404, test_loss: 0.7625, test_f1: 0.6199
 epoch: 32, train_loss: 0.7166, test_loss: 0.7568, test_f1: 0.6701
 epoch: 33, train_loss: 0.7251, test_loss: 0.7572, test_f1: 0.6341
 epoch: 34, train_loss: 0.6908, test_loss: 0.7950, test_f1: 0.6473
 epoch: 35, train_loss: 0.7122, test_loss: 0.7146, test_f1: 0.6581
 epoch: 36, train_loss: 0.7349, test_loss: 0.7205, test_f1: 0.6403
 epoch: 37, train_loss: 0.6978, test_loss: 0.7559, test_f1: 0.6366
 epoch: 38, train_loss: 0.7041, test_loss: 0.8257, test_f1: 0.5655
 epoch: 39, train_loss: 0.7194, test_loss: 0.8798, test_f1: 0.6361
 epoch: 40, train_loss: 0.6885, test_loss: 0.7130, test_f1: 0.6667
 epoch: 41, train_loss: 0.6946, test_loss: 0.7838, test_f1: 0.6501
 epoch: 42, train_loss: 0.6843, test_loss: 0.6840, test_f1: 0.6945
 epoch: 43, train_loss: 0.6509, test_loss: 0.7152, test_f1: 0.6469
 epoch: 44, train_loss: 0.6892, test_loss: 0.7748, test_f1: 0.6206
 epoch: 45, train_loss: 0.6564, test_loss: 0.6908, test_f1: 0.6508
 epoch: 46, train_loss: 0.6644, test_loss: 0.6931, test_f1: 0.6705
 epoch: 47, train_loss: 0.6488, test_loss: 0.7206, test_f1: 0.6521
 epoch: 48, train_loss: 0.6751, test_loss: 0.7974, test_f1: 0.6466
 epoch: 49, train_loss: 0.6581, test_loss: 0.8141, test_f1: 0.6216
 epoch: 50, train_loss: 0.6642, test_loss: 0.7293, test_f1: 0.6364
 epoch: 51, train_loss: 0.6144, test_loss: 0.8629, test_f1: 0.6634
 epoch: 52, train_loss: 0.5700, test_loss: 0.7439, test_f1: 0.6483
 epoch: 53, train_loss: 0.5837, test_loss: 0.7331, test_f1: 0.6460
 epoch: 54, train_loss: 0.5624, test_loss: 0.6738, test_f1: 0.7095
 epoch: 55, train_loss: 0.5647, test_loss: 0.7476, test_f1: 0.6569
 epoch: 56, train_loss: 0.5698, test_loss: 0.7472, test_f1: 0.6584
 epoch: 57, train_loss: 0.5394, test_loss: 0.7177, test_f1: 0.7005
 epoch: 58, train_loss: 0.5436, test_loss: 0.7234, test_f1: 0.6902
 epoch: 59, train_loss: 0.5449, test_loss: 0.6703, test_f1: 0.6957
 epoch: 60, train_loss: 0.5687, test_loss: 0.6752, test_f1: 0.6887
 epoch: 61, train_loss: 0.5446, test_loss: 0.7470, test_f1: 0.7048
 epoch: 62, train_loss: 0.5192, test_loss: 0.7809, test_f1: 0.7012
 epoch: 63, train_loss: 0.5375, test_loss: 0.7053, test_f1: 0.6925
 epoch: 64, train_loss: 0.5144, test_loss: 0.6631, test_f1: 0.7066
 epoch: 65, train_loss: 0.5300, test_loss: 0.7728, test_f1: 0.6878
 epoch: 66, train_loss: 0.5022, test_loss: 0.7708, test_f1: 0.6965
 epoch: 67, train_loss: 0.5202, test_loss: 0.8853, test_f1: 0.6699
 epoch: 68, train_loss: 0.5043, test_loss: 0.8354, test_f1: 0.6619
 epoch: 69, train_loss: 0.5099, test_loss: 0.7883, test_f1: 0.6713
 epoch: 70, train_loss: 0.5456, test_loss: 0.7333, test_f1: 0.6815
 epoch: 71, train_loss: 0.4864, test_loss: 0.6872, test_f1: 0.7197
 epoch: 72, train_loss: 0.4849, test_loss: 0.8172, test_f1: 0.6551
 epoch: 73, train_loss: 0.4874, test_loss: 0.7656, test_f1: 0.6578
 epoch: 74, train_loss: 0.4909, test_loss: 0.7981, test_f1: 0.6664
 epoch: 75, train_loss: 0.4886, test_loss: 0.6853, test_f1: 0.7081
 epoch: 76, train_loss: 0.4771, test_loss: 0.7522, test_f1: 0.6890
 epoch: 77, train_loss: 0.4823, test_loss: 0.8150, test_f1: 0.6425
 epoch: 78, train_loss: 0.4699, test_loss: 0.7343, test_f1: 0.7225
 epoch: 79, train_loss: 0.4722, test_loss: 0.7900, test_f1: 0.6909
 epoch: 80, train_loss: 0.4828, test_loss: 0.8474, test_f1: 0.6633
 epoch: 81, train_loss: 0.4611, test_loss: 0.8482, test_f1: 0.6883
 epoch: 82, train_loss: 0.4601, test_loss: 0.9430, test_f1: 0.6640
 epoch: 83, train_loss: 0.4511, test_loss: 0.8610, test_f1: 0.6630
 epoch: 84, train_loss: 0.4504, test_loss: 0.8245, test_f1: 0.7002
 epoch: 85, train_loss: 0.4519, test_loss: 0.8010, test_f1: 0.6618
 epoch: 86, train_loss: 0.4559, test_loss: 0.7732, test_f1: 0.6873
 epoch: 87, train_loss: 0.4521, test_loss: 0.8835, test_f1: 0.6371
 epoch: 88, train_loss: 0.4449, test_loss: 0.9097, test_f1: 0.6212
 epoch: 89, train_loss: 0.4394, test_loss: 0.8973, test_f1: 0.6596
 epoch: 90, train_loss: 0.4521, test_loss: 0.7988, test_f1: 0.7064
 epoch: 91, train_loss: 0.4403, test_loss: 0.7741, test_f1: 0.7063
 epoch: 92, train_loss: 0.4642, test_loss: 0.8639, test_f1: 0.6768
 epoch: 93, train_loss: 0.4352, test_loss: 0.9343, test_f1: 0.6966
 epoch: 94, train_loss: 0.4480, test_loss: 0.8918, test_f1: 0.6905
 epoch: 95, train_loss: 0.4290, test_loss: 1.0296, test_f1: 0.7029
 epoch: 96, train_loss: 0.4198, test_loss: 0.8965, test_f1: 0.6926
 epoch: 97, train_loss: 0.4268, test_loss: 0.9139, test_f1: 0.6972
 epoch: 98, train_loss: 0.4302, test_loss: 0.7918, test_f1: 0.6786
 epoch: 99, train_loss: 0.4204, test_loss: 1.8471, test_f1: 0.5660
##################ITERATION #8 ****************************************
 epoch: 0, train_loss: 1.1126, test_loss: 1.0443, test_f1: 0.4224
 epoch: 1, train_loss: 0.9769, test_loss: 0.9988, test_f1: 0.5288
 epoch: 2, train_loss: 0.9519, test_loss: 0.9685, test_f1: 0.5217
 epoch: 3, train_loss: 0.9441, test_loss: 0.9601, test_f1: 0.5511
 epoch: 4, train_loss: 0.9396, test_loss: 0.9230, test_f1: 0.5766
 epoch: 5, train_loss: 0.9205, test_loss: 0.9693, test_f1: 0.5382
 epoch: 6, train_loss: 0.9080, test_loss: 1.2331, test_f1: 0.4843
 epoch: 7, train_loss: 0.9203, test_loss: 0.9570, test_f1: 0.5636
 epoch: 8, train_loss: 0.8933, test_loss: 0.9053, test_f1: 0.5465
 epoch: 9, train_loss: 0.8832, test_loss: 0.8867, test_f1: 0.5960
 epoch: 10, train_loss: 0.8516, test_loss: 0.8667, test_f1: 0.5903
 epoch: 11, train_loss: 0.8535, test_loss: 0.8959, test_f1: 0.5473
 epoch: 12, train_loss: 0.8757, test_loss: 1.0260, test_f1: 0.5493
 epoch: 13, train_loss: 0.8601, test_loss: 0.8448, test_f1: 0.5843
 epoch: 14, train_loss: 0.8365, test_loss: 0.8291, test_f1: 0.5918
 epoch: 15, train_loss: 0.8366, test_loss: 0.7701, test_f1: 0.6428
 epoch: 16, train_loss: 0.8246, test_loss: 0.9643, test_f1: 0.5501
 epoch: 17, train_loss: 0.8063, test_loss: 0.7865, test_f1: 0.5910
 epoch: 18, train_loss: 0.8282, test_loss: 0.9716, test_f1: 0.5852
 epoch: 19, train_loss: 0.8321, test_loss: 0.9580, test_f1: 0.5483
 epoch: 20, train_loss: 0.8020, test_loss: 0.8995, test_f1: 0.6299
 epoch: 21, train_loss: 0.7918, test_loss: 0.8255, test_f1: 0.5828
 epoch: 22, train_loss: 0.7836, test_loss: 0.9152, test_f1: 0.6376
 epoch: 23, train_loss: 0.7745, test_loss: 0.8166, test_f1: 0.6145
 epoch: 24, train_loss: 0.7695, test_loss: 0.9128, test_f1: 0.6356
 epoch: 25, train_loss: 0.7620, test_loss: 1.0223, test_f1: 0.5836
 epoch: 26, train_loss: 0.7460, test_loss: 0.9311, test_f1: 0.6401
 epoch: 27, train_loss: 0.7438, test_loss: 0.7784, test_f1: 0.6465
 epoch: 28, train_loss: 0.7474, test_loss: 0.7926, test_f1: 0.6467
 epoch: 29, train_loss: 0.7336, test_loss: 0.8280, test_f1: 0.6343
 epoch: 30, train_loss: 0.7235, test_loss: 0.9012, test_f1: 0.5853
 epoch: 31, train_loss: 0.7462, test_loss: 0.8605, test_f1: 0.6322
 epoch: 32, train_loss: 0.7123, test_loss: 0.8264, test_f1: 0.6395
 epoch: 33, train_loss: 0.7141, test_loss: 0.7410, test_f1: 0.6714
 epoch: 34, train_loss: 0.7090, test_loss: 0.9368, test_f1: 0.6423
 epoch: 35, train_loss: 0.7003, test_loss: 0.8553, test_f1: 0.6531
 epoch: 36, train_loss: 0.7214, test_loss: 0.9455, test_f1: 0.6602
 epoch: 37, train_loss: 0.6773, test_loss: 0.9158, test_f1: 0.6373
 epoch: 38, train_loss: 0.6772, test_loss: 0.8405, test_f1: 0.6292
 epoch: 39, train_loss: 0.6851, test_loss: 0.8659, test_f1: 0.6374
 epoch: 40, train_loss: 0.6630, test_loss: 0.9643, test_f1: 0.6466
 epoch: 41, train_loss: 0.6834, test_loss: 0.9384, test_f1: 0.6610
 epoch: 42, train_loss: 0.6635, test_loss: 1.0493, test_f1: 0.6371
 epoch: 43, train_loss: 0.6504, test_loss: 0.9078, test_f1: 0.5829
 epoch: 44, train_loss: 0.6454, test_loss: 1.1259, test_f1: 0.6617
 epoch: 45, train_loss: 0.6443, test_loss: 0.9950, test_f1: 0.6566
 epoch: 46, train_loss: 0.6390, test_loss: 1.0662, test_f1: 0.5904
 epoch: 47, train_loss: 0.6649, test_loss: 1.0606, test_f1: 0.6780
 epoch: 48, train_loss: 0.6180, test_loss: 1.1378, test_f1: 0.6805
 epoch: 49, train_loss: 0.6254, test_loss: 1.1839, test_f1: 0.6477
 epoch: 50, train_loss: 0.6206, test_loss: 1.1972, test_f1: 0.6549
 epoch: 51, train_loss: 0.5788, test_loss: 0.9317, test_f1: 0.6453
 epoch: 52, train_loss: 0.5604, test_loss: 1.0309, test_f1: 0.6859
 epoch: 53, train_loss: 0.5400, test_loss: 0.9820, test_f1: 0.6674
 epoch: 54, train_loss: 0.5526, test_loss: 1.0361, test_f1: 0.6617
 epoch: 55, train_loss: 0.5342, test_loss: 1.0713, test_f1: 0.6782
 epoch: 56, train_loss: 0.5445, test_loss: 0.9901, test_f1: 0.7106
 epoch: 57, train_loss: 0.5125, test_loss: 1.0694, test_f1: 0.6855
 epoch: 58, train_loss: 0.5339, test_loss: 1.1675, test_f1: 0.6889
 epoch: 59, train_loss: 0.5443, test_loss: 0.9179, test_f1: 0.6578
 epoch: 60, train_loss: 0.5299, test_loss: 1.0230, test_f1: 0.6787
 epoch: 61, train_loss: 0.5054, test_loss: 1.0259, test_f1: 0.7000
 epoch: 62, train_loss: 0.4987, test_loss: 1.2230, test_f1: 0.6903
 epoch: 63, train_loss: 0.4957, test_loss: 1.1731, test_f1: 0.6753
 epoch: 64, train_loss: 0.5080, test_loss: 1.1865, test_f1: 0.6928
 epoch: 65, train_loss: 0.4864, test_loss: 1.1419, test_f1: 0.6949
 epoch: 66, train_loss: 0.4799, test_loss: 1.1224, test_f1: 0.7019
 epoch: 67, train_loss: 0.4739, test_loss: 1.1340, test_f1: 0.6947
 epoch: 68, train_loss: 0.4784, test_loss: 1.0483, test_f1: 0.6861
 epoch: 69, train_loss: 0.4969, test_loss: 0.9984, test_f1: 0.7022
 epoch: 70, train_loss: 0.4688, test_loss: 1.1444, test_f1: 0.7039
 epoch: 71, train_loss: 0.4850, test_loss: 1.0275, test_f1: 0.6778
 epoch: 72, train_loss: 0.4836, test_loss: 1.1977, test_f1: 0.6669
 epoch: 73, train_loss: 0.4750, test_loss: 1.2070, test_f1: 0.6907
 epoch: 74, train_loss: 0.4600, test_loss: 1.2242, test_f1: 0.6967
 epoch: 75, train_loss: 0.4684, test_loss: 1.2461, test_f1: 0.6704
 epoch: 76, train_loss: 0.4453, test_loss: 1.2285, test_f1: 0.6624
 epoch: 77, train_loss: 0.4665, test_loss: 1.2222, test_f1: 0.6905
 epoch: 78, train_loss: 0.4647, test_loss: 1.1346, test_f1: 0.6844
 epoch: 79, train_loss: 0.4630, test_loss: 1.0821, test_f1: 0.6942
 epoch: 80, train_loss: 0.4566, test_loss: 1.4479, test_f1: 0.6827
 epoch: 81, train_loss: 0.4380, test_loss: 1.3237, test_f1: 0.6972
 epoch: 82, train_loss: 0.4401, test_loss: 1.2657, test_f1: 0.7198
 epoch: 83, train_loss: 0.4229, test_loss: 1.3025, test_f1: 0.6738
 epoch: 84, train_loss: 0.5075, test_loss: 1.2881, test_f1: 0.6945
 epoch: 85, train_loss: 0.4568, test_loss: 1.3542, test_f1: 0.6853
 epoch: 86, train_loss: 0.4316, test_loss: 1.3124, test_f1: 0.6940
 epoch: 87, train_loss: 0.4328, test_loss: 1.2645, test_f1: 0.7072
 epoch: 88, train_loss: 0.4397, test_loss: 1.3360, test_f1: 0.6754
 epoch: 89, train_loss: 0.4328, test_loss: 1.4027, test_f1: 0.7058
 epoch: 90, train_loss: 0.4495, test_loss: 1.2108, test_f1: 0.6793
 epoch: 91, train_loss: 0.4215, test_loss: 1.2854, test_f1: 0.7049
 epoch: 92, train_loss: 0.3950, test_loss: 1.1328, test_f1: 0.6976
 epoch: 93, train_loss: 0.4122, test_loss: 1.5594, test_f1: 0.7036
 epoch: 94, train_loss: 0.4010, test_loss: 1.4283, test_f1: 0.7037
 epoch: 95, train_loss: 0.4209, test_loss: 1.4783, test_f1: 0.7112
 epoch: 96, train_loss: 0.3982, test_loss: 1.2623, test_f1: 0.6893
 epoch: 97, train_loss: 0.3961, test_loss: 1.3405, test_f1: 0.6996
 epoch: 98, train_loss: 0.3761, test_loss: 1.3516, test_f1: 0.7118
 epoch: 99, train_loss: 0.3995, test_loss: 1.3863, test_f1: 0.6943
##################ITERATION #9 ****************************************
 epoch: 0, train_loss: 1.1166, test_loss: 0.9976, test_f1: 0.4950
 epoch: 1, train_loss: 1.0097, test_loss: 1.0695, test_f1: 0.4850
 epoch: 2, train_loss: 0.9899, test_loss: 0.9394, test_f1: 0.5149
 epoch: 3, train_loss: 0.9889, test_loss: 0.9852, test_f1: 0.4440
 epoch: 4, train_loss: 0.9689, test_loss: 0.9527, test_f1: 0.5147
 epoch: 5, train_loss: 0.9282, test_loss: 0.9487, test_f1: 0.5421
 epoch: 6, train_loss: 0.9188, test_loss: 0.9989, test_f1: 0.5004
 epoch: 7, train_loss: 0.9226, test_loss: 1.1717, test_f1: 0.5031
 epoch: 8, train_loss: 0.9134, test_loss: 0.8894, test_f1: 0.5294
 epoch: 9, train_loss: 0.8927, test_loss: 0.8977, test_f1: 0.5204
 epoch: 10, train_loss: 0.8778, test_loss: 0.9089, test_f1: 0.5484
 epoch: 11, train_loss: 0.8781, test_loss: 0.9264, test_f1: 0.5648
 epoch: 12, train_loss: 0.8553, test_loss: 0.8763, test_f1: 0.5235
 epoch: 13, train_loss: 0.8525, test_loss: 1.0300, test_f1: 0.5597
 epoch: 14, train_loss: 0.8378, test_loss: 0.8620, test_f1: 0.6128
 epoch: 15, train_loss: 0.8720, test_loss: 0.9002, test_f1: 0.5738
 epoch: 16, train_loss: 0.9060, test_loss: 0.9601, test_f1: 0.5357
 epoch: 17, train_loss: 0.8782, test_loss: 0.9227, test_f1: 0.5960
 epoch: 18, train_loss: 0.8406, test_loss: 0.9178, test_f1: 0.5952
 epoch: 19, train_loss: 0.8549, test_loss: 1.0059, test_f1: 0.4829
 epoch: 20, train_loss: 0.8438, test_loss: 0.8770, test_f1: 0.5846
 epoch: 21, train_loss: 0.8100, test_loss: 0.9073, test_f1: 0.6119
 epoch: 22, train_loss: 0.8064, test_loss: 0.8392, test_f1: 0.5775
 epoch: 23, train_loss: 0.7902, test_loss: 0.8592, test_f1: 0.6416
 epoch: 24, train_loss: 0.7917, test_loss: 0.8211, test_f1: 0.6095
 epoch: 25, train_loss: 0.7971, test_loss: 1.0047, test_f1: 0.6183
 epoch: 26, train_loss: 0.7708, test_loss: 1.2017, test_f1: 0.6248
 epoch: 27, train_loss: 0.7687, test_loss: 1.0396, test_f1: 0.6214
 epoch: 28, train_loss: 0.7758, test_loss: 1.0792, test_f1: 0.5888
 epoch: 29, train_loss: 0.7630, test_loss: 0.9297, test_f1: 0.6530
 epoch: 30, train_loss: 0.7538, test_loss: 0.9903, test_f1: 0.5982
 epoch: 31, train_loss: 0.7951, test_loss: 1.0231, test_f1: 0.6255
 epoch: 32, train_loss: 0.7601, test_loss: 0.9807, test_f1: 0.6535
 epoch: 33, train_loss: 0.7576, test_loss: 1.3106, test_f1: 0.6309
 epoch: 34, train_loss: 0.7344, test_loss: 0.9493, test_f1: 0.5955
 epoch: 35, train_loss: 0.7510, test_loss: 0.9942, test_f1: 0.6035
 epoch: 36, train_loss: 0.7270, test_loss: 0.8742, test_f1: 0.6406
 epoch: 37, train_loss: 0.6922, test_loss: 0.9456, test_f1: 0.6011
 epoch: 38, train_loss: 0.7279, test_loss: 0.8819, test_f1: 0.6441
 epoch: 39, train_loss: 0.7044, test_loss: 0.8570, test_f1: 0.6577
 epoch: 40, train_loss: 0.6941, test_loss: 1.0473, test_f1: 0.6232
 epoch: 41, train_loss: 0.7254, test_loss: 0.9818, test_f1: 0.6128
 epoch: 42, train_loss: 0.6701, test_loss: 1.1052, test_f1: 0.6628
 epoch: 43, train_loss: 0.6778, test_loss: 1.1306, test_f1: 0.6455
 epoch: 44, train_loss: 0.6760, test_loss: 1.1311, test_f1: 0.6276
 epoch: 45, train_loss: 0.6657, test_loss: 1.0519, test_f1: 0.6622
 epoch: 46, train_loss: 0.6783, test_loss: 1.1374, test_f1: 0.6080
 epoch: 47, train_loss: 0.6659, test_loss: 1.1850, test_f1: 0.6412
 epoch: 48, train_loss: 0.6621, test_loss: 1.0013, test_f1: 0.6344
 epoch: 49, train_loss: 0.6425, test_loss: 1.1363, test_f1: 0.6530
 epoch: 50, train_loss: 0.6969, test_loss: 1.0096, test_f1: 0.5873
 epoch: 51, train_loss: 0.6738, test_loss: 1.0104, test_f1: 0.6834
 epoch: 52, train_loss: 0.6190, test_loss: 1.0076, test_f1: 0.7015
 epoch: 53, train_loss: 0.5991, test_loss: 0.9219, test_f1: 0.6729
 epoch: 54, train_loss: 0.5868, test_loss: 1.0504, test_f1: 0.6545
 epoch: 55, train_loss: 0.5888, test_loss: 1.1565, test_f1: 0.6471
 epoch: 56, train_loss: 0.5640, test_loss: 1.0266, test_f1: 0.6867
 epoch: 57, train_loss: 0.5539, test_loss: 1.0599, test_f1: 0.6656
 epoch: 58, train_loss: 0.5667, test_loss: 1.0734, test_f1: 0.6843
 epoch: 59, train_loss: 0.5524, test_loss: 1.0948, test_f1: 0.6785
 epoch: 60, train_loss: 0.5530, test_loss: 1.0287, test_f1: 0.6832
 epoch: 61, train_loss: 0.5485, test_loss: 0.9797, test_f1: 0.6762
 epoch: 62, train_loss: 0.5228, test_loss: 1.0270, test_f1: 0.6792
 epoch: 63, train_loss: 0.5195, test_loss: 1.1572, test_f1: 0.6890
 epoch: 64, train_loss: 0.5261, test_loss: 1.2566, test_f1: 0.5997
 epoch: 65, train_loss: 0.5266, test_loss: 1.1366, test_f1: 0.6790
 epoch: 66, train_loss: 0.5221, test_loss: 1.2391, test_f1: 0.6911
 epoch: 67, train_loss: 0.5304, test_loss: 1.2005, test_f1: 0.6762
 epoch: 68, train_loss: 0.5272, test_loss: 1.1765, test_f1: 0.6818
 epoch: 69, train_loss: 0.5102, test_loss: 1.3070, test_f1: 0.6756
 epoch: 70, train_loss: 0.5094, test_loss: 1.2777, test_f1: 0.6862
 epoch: 71, train_loss: 0.5077, test_loss: 1.2146, test_f1: 0.6917
 epoch: 72, train_loss: 0.4898, test_loss: 1.3880, test_f1: 0.6863
 epoch: 73, train_loss: 0.4638, test_loss: 1.5158, test_f1: 0.6820
 epoch: 74, train_loss: 0.5016, test_loss: 1.4531, test_f1: 0.6876
 epoch: 75, train_loss: 0.4952, test_loss: 1.1310, test_f1: 0.6423
 epoch: 76, train_loss: 0.4686, test_loss: 1.3666, test_f1: 0.6840
 epoch: 77, train_loss: 0.4907, test_loss: 1.3796, test_f1: 0.6264
 epoch: 78, train_loss: 0.4875, test_loss: 1.3470, test_f1: 0.6979
 epoch: 79, train_loss: 0.4724, test_loss: 1.3263, test_f1: 0.6794
 epoch: 80, train_loss: 0.4710, test_loss: 1.1478, test_f1: 0.7058
 epoch: 81, train_loss: 0.4624, test_loss: 1.3066, test_f1: 0.6693
 epoch: 82, train_loss: 0.4912, test_loss: 1.3243, test_f1: 0.6741
 epoch: 83, train_loss: 0.4724, test_loss: 1.3899, test_f1: 0.6733
 epoch: 84, train_loss: 0.5039, test_loss: 1.1235, test_f1: 0.6915
 epoch: 85, train_loss: 0.4447, test_loss: 1.3001, test_f1: 0.6832
 epoch: 86, train_loss: 0.4425, test_loss: 1.3964, test_f1: 0.7028
 epoch: 87, train_loss: 0.4490, test_loss: 1.3844, test_f1: 0.6767
 epoch: 88, train_loss: 0.4582, test_loss: 1.3670, test_f1: 0.6857
 epoch: 89, train_loss: 0.4632, test_loss: 1.4703, test_f1: 0.7032
 epoch: 90, train_loss: 0.4427, test_loss: 1.4493, test_f1: 0.6843
 epoch: 91, train_loss: 0.4393, test_loss: 1.4648, test_f1: 0.6853
 epoch: 92, train_loss: 0.4396, test_loss: 1.2654, test_f1: 0.7122
 epoch: 93, train_loss: 0.4332, test_loss: 1.5232, test_f1: 0.7060
 epoch: 94, train_loss: 0.4259, test_loss: 1.4129, test_f1: 0.6732
 epoch: 95, train_loss: 0.4206, test_loss: 1.4820, test_f1: 0.6755
 epoch: 96, train_loss: 0.5098, test_loss: 1.3902, test_f1: 0.6982
 epoch: 97, train_loss: 0.4990, test_loss: 1.5392, test_f1: 0.6766
 epoch: 98, train_loss: 0.4579, test_loss: 1.3746, test_f1: 0.6870
 epoch: 99, train_loss: 0.4626, test_loss: 1.3374, test_f1: 0.6880

Training completed in 830.65 seconds
Best F1: 0.7225 at epoch 78
Mean F1 across iterations: 0.7073  0.0138
========================FINAL RESULTS================================
FEGIN weighted F1: 0.7225  0.0138
python main.py --data ltspice_examples --representation component_pin_net --model FEGIN --layers 2 --hiddens 128 --batch_size 32 --lr 0.01 --emb_size 128 --epochs 100 --save_appendix component_pin_net_L2_H128_BS32_LR0.01_E128 --no_val
-----



STDERR:
  File "main.py", line 370, in <module>
    main()
  File "main.py", line 254, in main
    dataset = dataset_class(
  File "/home/philip/projects/ltspice_examples_code_repo/Circuit-Completion-Using-GNNs/component_classification_with_link_prediction_head/evaluation/FEGIN/kernel/circuit_datasets.py", line 15, in __init__
    self.data, self.slices = torch.load(self.processed_paths[0])
  File "/home/philip/.local/lib/python3.8/site-packages/torch/serialization.py", line 1040, in load
    warnings.warn(
  File "/usr/lib/python3.8/warnings.py", line 109, in _showwarnmsg
    sw(msg.message, msg.category, msg.filename, msg.lineno,
  File "main.py", line 47, in warn_with_traceback
    traceback.print_stack(file=log)
/home/philip/projects/ltspice_examples_code_repo/Circuit-Completion-Using-GNNs/component_classification_with_link_prediction_head/evaluation/FEGIN/kernel/circuit_datasets.py:15: FutureWarning: You are using `torch.load` with `weights_only=False` (the current default value), which uses the default pickle module implicitly. It is possible to construct malicious pickle data which will execute arbitrary code during unpickling (See https://github.com/pytorch/pytorch/blob/main/SECURITY.md#untrusted-models for more details). In a future release, the default value for `weights_only` will be flipped to `True`. This limits the functions that could be executed during unpickling. Arbitrary objects will no longer be allowed to be loaded via this mode unless they are explicitly allowlisted by the user via `torch.serialization.add_safe_globals`. We recommend you start setting `weights_only=True` for any use case where you don't have full control of the loaded file. Please open an issue on GitHub for any issues related to this experimental feature.
  self.data, self.slices = torch.load(self.processed_paths[0])
