STDOUT:
Results will be saved in /home/philip/projects/ltspice_examples_code_repo/Circuit-Completion-Using-GNNs/component_classification_with_link_prediction_head/evaluation/FEGIN/results/model_FEGIN_dataset_ltspice_demos
Command line input: python main.py --data ltspice_demos --representation component_pin_net --model FEGIN --layers 6 --hiddens 128 --batch_size 128 --lr 0.01 --emb_size 250 --epochs 100 --save_appendix component_pin_net_L6_H128_BS128_LR0.01_E250 --no_val
 is saved.
-----
ltspice_demos - FEGIN
Using 6 layers, 128 hidden units, h = 2
Loading component_pin_net representation dataset
ENTERED
Training FEGIN on component_pin_net representation
Train: 1565, Test: 383
##################ITERATION #0 ****************************************
 epoch: 0, train_loss: 1.3652, test_loss: 1.3578, test_f1: 0.2501
 epoch: 1, train_loss: 1.0918, test_loss: 1.1487, test_f1: 0.3164
 epoch: 2, train_loss: 1.0365, test_loss: 1.2523, test_f1: 0.3018
 epoch: 3, train_loss: 1.0195, test_loss: 1.2304, test_f1: 0.3702
 epoch: 4, train_loss: 0.9775, test_loss: 1.2195, test_f1: 0.4173
 epoch: 5, train_loss: 0.9726, test_loss: 1.1228, test_f1: 0.4933
 epoch: 6, train_loss: 0.9561, test_loss: 1.0272, test_f1: 0.4781
 epoch: 7, train_loss: 0.9301, test_loss: 1.0708, test_f1: 0.4551
 epoch: 8, train_loss: 0.9226, test_loss: 1.1215, test_f1: 0.5214
 epoch: 9, train_loss: 0.8981, test_loss: 1.1212, test_f1: 0.5182
 epoch: 10, train_loss: 0.8994, test_loss: 1.2042, test_f1: 0.5217
 epoch: 11, train_loss: 0.9176, test_loss: 1.3609, test_f1: 0.4350
 epoch: 12, train_loss: 0.8939, test_loss: 1.0892, test_f1: 0.5245
 epoch: 13, train_loss: 0.8805, test_loss: 1.1850, test_f1: 0.4950
 epoch: 14, train_loss: 0.8637, test_loss: 1.0613, test_f1: 0.5430
 epoch: 15, train_loss: 0.8641, test_loss: 0.9999, test_f1: 0.5300
 epoch: 16, train_loss: 0.8492, test_loss: 1.0742, test_f1: 0.4461
 epoch: 17, train_loss: 0.8108, test_loss: 1.0682, test_f1: 0.5428
 epoch: 18, train_loss: 0.7787, test_loss: 1.8164, test_f1: 0.4640
 epoch: 19, train_loss: 0.8093, test_loss: 3.5622, test_f1: 0.3120
 epoch: 20, train_loss: 0.8256, test_loss: 1.7291, test_f1: 0.4113
 epoch: 21, train_loss: 0.7898, test_loss: 1.1702, test_f1: 0.4654
 epoch: 22, train_loss: 0.8041, test_loss: 1.1841, test_f1: 0.4279
 epoch: 23, train_loss: 0.7548, test_loss: 1.0779, test_f1: 0.5058
 epoch: 24, train_loss: 0.7867, test_loss: 0.9824, test_f1: 0.5515
 epoch: 25, train_loss: 0.7414, test_loss: 1.0687, test_f1: 0.5033
 epoch: 26, train_loss: 0.7131, test_loss: 1.0295, test_f1: 0.5812
 epoch: 27, train_loss: 0.7327, test_loss: 1.0679, test_f1: 0.5224
 epoch: 28, train_loss: 0.7486, test_loss: 1.1435, test_f1: 0.5478
 epoch: 29, train_loss: 0.7208, test_loss: 0.9440, test_f1: 0.5925
 epoch: 30, train_loss: 0.7011, test_loss: 1.1625, test_f1: 0.5063
 epoch: 31, train_loss: 0.6840, test_loss: 1.2816, test_f1: 0.4991
 epoch: 32, train_loss: 0.6919, test_loss: 1.2379, test_f1: 0.5637
 epoch: 33, train_loss: 0.6577, test_loss: 1.2036, test_f1: 0.5414
 epoch: 34, train_loss: 0.7065, test_loss: 1.4502, test_f1: 0.4457
 epoch: 35, train_loss: 0.6760, test_loss: 1.2708, test_f1: 0.5553
 epoch: 36, train_loss: 0.6618, test_loss: 1.3180, test_f1: 0.5551
 epoch: 37, train_loss: 0.6972, test_loss: 1.0973, test_f1: 0.6067
 epoch: 38, train_loss: 0.6650, test_loss: 1.2266, test_f1: 0.5330
 epoch: 39, train_loss: 0.6817, test_loss: 1.0850, test_f1: 0.5456
 epoch: 40, train_loss: 0.6506, test_loss: 1.2435, test_f1: 0.5502
 epoch: 41, train_loss: 0.6299, test_loss: 1.3495, test_f1: 0.5526
 epoch: 42, train_loss: 0.5941, test_loss: 1.5447, test_f1: 0.5035
 epoch: 43, train_loss: 0.6043, test_loss: 1.2762, test_f1: 0.5770
 epoch: 44, train_loss: 0.5606, test_loss: 1.6941, test_f1: 0.5070
 epoch: 45, train_loss: 0.5748, test_loss: 1.5274, test_f1: 0.5340
 epoch: 46, train_loss: 0.5911, test_loss: 1.6089, test_f1: 0.4969
 epoch: 47, train_loss: 0.5924, test_loss: 1.5678, test_f1: 0.5596
 epoch: 48, train_loss: 0.5863, test_loss: 1.8188, test_f1: 0.4596
 epoch: 49, train_loss: 0.5740, test_loss: 1.3782, test_f1: 0.5447
 epoch: 50, train_loss: 0.6160, test_loss: 1.2064, test_f1: 0.5550
 epoch: 51, train_loss: 0.5477, test_loss: 1.2235, test_f1: 0.6176
 epoch: 52, train_loss: 0.5442, test_loss: 1.4678, test_f1: 0.5515
 epoch: 53, train_loss: 0.5299, test_loss: 1.5366, test_f1: 0.5658
 epoch: 54, train_loss: 0.5522, test_loss: 1.3437, test_f1: 0.5502
 epoch: 55, train_loss: 0.4975, test_loss: 1.3233, test_f1: 0.5816
 epoch: 56, train_loss: 0.4811, test_loss: 1.5084, test_f1: 0.6006
 epoch: 57, train_loss: 0.4606, test_loss: 1.4120, test_f1: 0.5583
 epoch: 58, train_loss: 0.4591, test_loss: 1.5431, test_f1: 0.5616
 epoch: 59, train_loss: 0.4163, test_loss: 1.4827, test_f1: 0.5963
 epoch: 60, train_loss: 0.4482, test_loss: 1.8545, test_f1: 0.6014
 epoch: 61, train_loss: 0.4221, test_loss: 1.6557, test_f1: 0.6344
 epoch: 62, train_loss: 0.4436, test_loss: 1.7827, test_f1: 0.5792
 epoch: 63, train_loss: 0.4291, test_loss: 1.5380, test_f1: 0.5935
 epoch: 64, train_loss: 0.4571, test_loss: 1.7354, test_f1: 0.5693
 epoch: 65, train_loss: 0.4180, test_loss: 1.8388, test_f1: 0.5489
 epoch: 66, train_loss: 0.4181, test_loss: 2.0664, test_f1: 0.5168
 epoch: 67, train_loss: 0.4156, test_loss: 1.8464, test_f1: 0.5980
 epoch: 68, train_loss: 0.3857, test_loss: 1.9368, test_f1: 0.5810
 epoch: 69, train_loss: 0.3973, test_loss: 2.2013, test_f1: 0.6023
 epoch: 70, train_loss: 0.3849, test_loss: 1.9192, test_f1: 0.5923
 epoch: 71, train_loss: 0.4045, test_loss: 2.0978, test_f1: 0.5512
 epoch: 72, train_loss: 0.3863, test_loss: 1.8336, test_f1: 0.5940
 epoch: 73, train_loss: 0.3544, test_loss: 2.3804, test_f1: 0.5819
 epoch: 74, train_loss: 0.3794, test_loss: 1.8458, test_f1: 0.6388
 epoch: 75, train_loss: 0.3713, test_loss: 2.1528, test_f1: 0.5919
 epoch: 76, train_loss: 0.3909, test_loss: 2.2807, test_f1: 0.5733
 epoch: 77, train_loss: 0.3768, test_loss: 2.6588, test_f1: 0.5831
 epoch: 78, train_loss: 0.3499, test_loss: 2.3614, test_f1: 0.5744
 epoch: 79, train_loss: 0.3369, test_loss: 2.1226, test_f1: 0.6054
 epoch: 80, train_loss: 0.3528, test_loss: 2.1671, test_f1: 0.5494
 epoch: 81, train_loss: 0.3797, test_loss: 1.9615, test_f1: 0.6344
 epoch: 82, train_loss: 0.3198, test_loss: 2.5062, test_f1: 0.5577
 epoch: 83, train_loss: 0.3544, test_loss: 2.5059, test_f1: 0.5532
 epoch: 84, train_loss: 0.3450, test_loss: 2.1903, test_f1: 0.5884
 epoch: 85, train_loss: 0.3260, test_loss: 2.3818, test_f1: 0.5873
 epoch: 86, train_loss: 0.3249, test_loss: 2.2579, test_f1: 0.6090
 epoch: 87, train_loss: 0.2964, test_loss: 2.3735, test_f1: 0.6378
 epoch: 88, train_loss: 0.2865, test_loss: 2.4045, test_f1: 0.5342
 epoch: 89, train_loss: 0.3425, test_loss: 2.4945, test_f1: 0.5655
 epoch: 90, train_loss: 0.3204, test_loss: 2.5433, test_f1: 0.5967
 epoch: 91, train_loss: 0.3296, test_loss: 2.2536, test_f1: 0.5997
 epoch: 92, train_loss: 0.3101, test_loss: 2.4354, test_f1: 0.5776
 epoch: 93, train_loss: 0.3052, test_loss: 2.4789, test_f1: 0.5979
 epoch: 94, train_loss: 0.2711, test_loss: 2.4071, test_f1: 0.5639
 epoch: 95, train_loss: 0.2978, test_loss: 2.6623, test_f1: 0.5746
 epoch: 96, train_loss: 0.2724, test_loss: 2.5187, test_f1: 0.5893
 epoch: 97, train_loss: 0.2505, test_loss: 2.8726, test_f1: 0.5664
 epoch: 98, train_loss: 0.2554, test_loss: 2.8675, test_f1: 0.6096
 epoch: 99, train_loss: 0.2558, test_loss: 2.8524, test_f1: 0.5531
##################ITERATION #1 ****************************************
 epoch: 0, train_loss: 1.2467, test_loss: 1.6445, test_f1: 0.3112
 epoch: 1, train_loss: 1.0173, test_loss: 1.3217, test_f1: 0.3146
 epoch: 2, train_loss: 0.9844, test_loss: 1.0750, test_f1: 0.3793
 epoch: 3, train_loss: 0.9476, test_loss: 1.3275, test_f1: 0.3740
 epoch: 4, train_loss: 0.9363, test_loss: 1.1070, test_f1: 0.4340
 epoch: 5, train_loss: 0.8889, test_loss: 1.2541, test_f1: 0.3931
 epoch: 6, train_loss: 0.8854, test_loss: 1.0191, test_f1: 0.5214
 epoch: 7, train_loss: 0.8895, test_loss: 1.2675, test_f1: 0.4533
 epoch: 8, train_loss: 0.8552, test_loss: 1.0342, test_f1: 0.5153
 epoch: 9, train_loss: 0.8211, test_loss: 1.0241, test_f1: 0.5393
 epoch: 10, train_loss: 0.7775, test_loss: 1.3012, test_f1: 0.4335
 epoch: 11, train_loss: 0.7848, test_loss: 1.1314, test_f1: 0.5040
 epoch: 12, train_loss: 0.7856, test_loss: 1.1628, test_f1: 0.5201
 epoch: 13, train_loss: 0.7785, test_loss: 1.7540, test_f1: 0.4215
 epoch: 14, train_loss: 0.7506, test_loss: 2.1864, test_f1: 0.3818
 epoch: 15, train_loss: 0.7348, test_loss: 1.1683, test_f1: 0.4587
 epoch: 16, train_loss: 0.7372, test_loss: 1.1533, test_f1: 0.5187
 epoch: 17, train_loss: 0.6954, test_loss: 1.2750, test_f1: 0.5318
 epoch: 18, train_loss: 0.6958, test_loss: 1.2010, test_f1: 0.5268
 epoch: 19, train_loss: 0.6906, test_loss: 0.9955, test_f1: 0.5532
 epoch: 20, train_loss: 0.6700, test_loss: 2.5295, test_f1: 0.4065
 epoch: 21, train_loss: 0.6535, test_loss: 1.1876, test_f1: 0.5202
 epoch: 22, train_loss: 0.6632, test_loss: 1.2819, test_f1: 0.4693
 epoch: 23, train_loss: 0.7077, test_loss: 1.5040, test_f1: 0.5111
 epoch: 24, train_loss: 0.6899, test_loss: 1.4600, test_f1: 0.5438
 epoch: 25, train_loss: 0.6813, test_loss: 1.1647, test_f1: 0.6106
 epoch: 26, train_loss: 0.6462, test_loss: 1.2896, test_f1: 0.5490
 epoch: 27, train_loss: 0.6582, test_loss: 1.3351, test_f1: 0.5440
 epoch: 28, train_loss: 0.6419, test_loss: 1.3180, test_f1: 0.5210
 epoch: 29, train_loss: 0.6813, test_loss: 1.6224, test_f1: 0.4785
 epoch: 30, train_loss: 0.6408, test_loss: 1.8224, test_f1: 0.4631
 epoch: 31, train_loss: 0.6358, test_loss: 1.2160, test_f1: 0.5656
 epoch: 32, train_loss: 0.5974, test_loss: 1.4525, test_f1: 0.4497
 epoch: 33, train_loss: 0.5848, test_loss: 1.3370, test_f1: 0.5750
 epoch: 34, train_loss: 0.6476, test_loss: 1.2753, test_f1: 0.4947
 epoch: 35, train_loss: 0.6834, test_loss: 1.4864, test_f1: 0.4304
 epoch: 36, train_loss: 0.6143, test_loss: 1.2168, test_f1: 0.5603
 epoch: 37, train_loss: 0.5701, test_loss: 1.6305, test_f1: 0.6070
 epoch: 38, train_loss: 0.5624, test_loss: 2.0017, test_f1: 0.3571
 epoch: 39, train_loss: 0.5868, test_loss: 1.3786, test_f1: 0.5977
 epoch: 40, train_loss: 0.5131, test_loss: 1.5957, test_f1: 0.5184
 epoch: 41, train_loss: 0.5054, test_loss: 1.9366, test_f1: 0.5383
 epoch: 42, train_loss: 0.5497, test_loss: 1.5950, test_f1: 0.4739
 epoch: 43, train_loss: 0.5837, test_loss: 1.6375, test_f1: 0.5512
 epoch: 44, train_loss: 0.5370, test_loss: 1.4377, test_f1: 0.5788
 epoch: 45, train_loss: 0.4997, test_loss: 1.4824, test_f1: 0.5326
 epoch: 46, train_loss: 0.4758, test_loss: 1.5267, test_f1: 0.6347
 epoch: 47, train_loss: 0.4892, test_loss: 2.1519, test_f1: 0.5565
 epoch: 48, train_loss: 0.5161, test_loss: 1.6922, test_f1: 0.5856
 epoch: 49, train_loss: 0.4577, test_loss: 1.8884, test_f1: 0.5809
 epoch: 50, train_loss: 0.4498, test_loss: 1.5493, test_f1: 0.5517
 epoch: 51, train_loss: 0.4600, test_loss: 1.6511, test_f1: 0.6207
 epoch: 52, train_loss: 0.4246, test_loss: 1.5765, test_f1: 0.6075
 epoch: 53, train_loss: 0.4082, test_loss: 1.8093, test_f1: 0.5928
 epoch: 54, train_loss: 0.3958, test_loss: 2.0231, test_f1: 0.4594
 epoch: 55, train_loss: 0.3821, test_loss: 1.5582, test_f1: 0.6120
 epoch: 56, train_loss: 0.3482, test_loss: 1.8498, test_f1: 0.6029
 epoch: 57, train_loss: 0.3795, test_loss: 1.8007, test_f1: 0.5373
 epoch: 58, train_loss: 0.4045, test_loss: 1.7369, test_f1: 0.5105
 epoch: 59, train_loss: 0.4042, test_loss: 1.8597, test_f1: 0.5796
 epoch: 60, train_loss: 0.3652, test_loss: 1.6385, test_f1: 0.5813
 epoch: 61, train_loss: 0.3549, test_loss: 1.9176, test_f1: 0.5705
 epoch: 62, train_loss: 0.3517, test_loss: 1.9784, test_f1: 0.6204
 epoch: 63, train_loss: 0.3315, test_loss: 2.2251, test_f1: 0.4912
 epoch: 64, train_loss: 0.3327, test_loss: 1.9303, test_f1: 0.6084
 epoch: 65, train_loss: 0.2963, test_loss: 2.1088, test_f1: 0.5583
 epoch: 66, train_loss: 0.2829, test_loss: 2.3455, test_f1: 0.5495
 epoch: 67, train_loss: 0.3091, test_loss: 1.8694, test_f1: 0.5666
 epoch: 68, train_loss: 0.2884, test_loss: 2.1242, test_f1: 0.5952
 epoch: 69, train_loss: 0.2856, test_loss: 2.1765, test_f1: 0.6394
 epoch: 70, train_loss: 0.3411, test_loss: 1.6811, test_f1: 0.6027
 epoch: 71, train_loss: 0.2746, test_loss: 1.9420, test_f1: 0.5869
 epoch: 72, train_loss: 0.3016, test_loss: 1.9153, test_f1: 0.6216
 epoch: 73, train_loss: 0.3306, test_loss: 2.3460, test_f1: 0.5284
 epoch: 74, train_loss: 0.2844, test_loss: 2.2296, test_f1: 0.5824
 epoch: 75, train_loss: 0.2974, test_loss: 2.0097, test_f1: 0.6052
 epoch: 76, train_loss: 0.2727, test_loss: 2.1103, test_f1: 0.6036
 epoch: 77, train_loss: 0.2595, test_loss: 2.3459, test_f1: 0.5763
 epoch: 78, train_loss: 0.2777, test_loss: 2.3360, test_f1: 0.5729
 epoch: 79, train_loss: 0.2679, test_loss: 2.1983, test_f1: 0.5764
 epoch: 80, train_loss: 0.3099, test_loss: 3.0484, test_f1: 0.4947
 epoch: 81, train_loss: 0.3021, test_loss: 2.0789, test_f1: 0.6263
 epoch: 82, train_loss: 0.3071, test_loss: 2.2802, test_f1: 0.5904
 epoch: 83, train_loss: 0.3104, test_loss: 2.1583, test_f1: 0.5771
 epoch: 84, train_loss: 0.2908, test_loss: 2.0670, test_f1: 0.6240
 epoch: 85, train_loss: 0.2479, test_loss: 2.6734, test_f1: 0.5657
 epoch: 86, train_loss: 0.2497, test_loss: 2.2193, test_f1: 0.6168
 epoch: 87, train_loss: 0.2173, test_loss: 2.2399, test_f1: 0.5789
 epoch: 88, train_loss: 0.2795, test_loss: 2.3412, test_f1: 0.5944
 epoch: 89, train_loss: 0.2615, test_loss: 2.6293, test_f1: 0.5471
 epoch: 90, train_loss: 0.2749, test_loss: 2.1578, test_f1: 0.6004
 epoch: 91, train_loss: 0.2341, test_loss: 2.4506, test_f1: 0.5960
 epoch: 92, train_loss: 0.2601, test_loss: 2.7437, test_f1: 0.5914
 epoch: 93, train_loss: 0.2593, test_loss: 2.3289, test_f1: 0.5743
 epoch: 94, train_loss: 0.2022, test_loss: 2.3761, test_f1: 0.5529
 epoch: 95, train_loss: 0.2479, test_loss: 2.3868, test_f1: 0.6261
 epoch: 96, train_loss: 0.2479, test_loss: 2.2234, test_f1: 0.6072
 epoch: 97, train_loss: 0.2142, test_loss: 2.7817, test_f1: 0.5605
 epoch: 98, train_loss: 0.2310, test_loss: 2.3083, test_f1: 0.6142
 epoch: 99, train_loss: 0.1952, test_loss: 2.6961, test_f1: 0.6039
##################ITERATION #2 ****************************************
 epoch: 0, train_loss: 1.2256, test_loss: 2.8737, test_f1: 0.2289
 epoch: 1, train_loss: 0.9896, test_loss: 1.1856, test_f1: 0.4320
 epoch: 2, train_loss: 0.9430, test_loss: 1.3015, test_f1: 0.3718
 epoch: 3, train_loss: 0.9181, test_loss: 1.1341, test_f1: 0.5050
 epoch: 4, train_loss: 0.8915, test_loss: 1.0827, test_f1: 0.4364
 epoch: 5, train_loss: 0.8944, test_loss: 1.0752, test_f1: 0.5078
 epoch: 6, train_loss: 0.8424, test_loss: 1.0265, test_f1: 0.5052
 epoch: 7, train_loss: 0.8369, test_loss: 1.0477, test_f1: 0.5274
 epoch: 8, train_loss: 0.8336, test_loss: 1.0191, test_f1: 0.5605
 epoch: 9, train_loss: 0.8620, test_loss: 1.1689, test_f1: 0.4891
 epoch: 10, train_loss: 0.8290, test_loss: 1.2309, test_f1: 0.4696
 epoch: 11, train_loss: 0.7844, test_loss: 1.1567, test_f1: 0.5258
 epoch: 12, train_loss: 0.7451, test_loss: 1.0727, test_f1: 0.5996
 epoch: 13, train_loss: 0.7463, test_loss: 1.1695, test_f1: 0.5766
 epoch: 14, train_loss: 0.7230, test_loss: 1.2383, test_f1: 0.4753
 epoch: 15, train_loss: 0.7252, test_loss: 1.0525, test_f1: 0.5128
 epoch: 16, train_loss: 0.7098, test_loss: 1.7705, test_f1: 0.3813
 epoch: 17, train_loss: 0.7796, test_loss: 1.1900, test_f1: 0.5479
 epoch: 18, train_loss: 0.7337, test_loss: 1.2489, test_f1: 0.4668
 epoch: 19, train_loss: 0.7230, test_loss: 1.2109, test_f1: 0.5478
 epoch: 20, train_loss: 0.6917, test_loss: 1.6677, test_f1: 0.5038
 epoch: 21, train_loss: 0.6705, test_loss: 1.5220, test_f1: 0.5260
 epoch: 22, train_loss: 0.6590, test_loss: 1.4373, test_f1: 0.5485
 epoch: 23, train_loss: 0.6982, test_loss: 1.3863, test_f1: 0.5609
 epoch: 24, train_loss: 0.6752, test_loss: 1.3228, test_f1: 0.4912
 epoch: 25, train_loss: 0.6239, test_loss: 1.3300, test_f1: 0.5684
 epoch: 26, train_loss: 0.6361, test_loss: 1.5748, test_f1: 0.5109
 epoch: 27, train_loss: 0.5992, test_loss: 1.5759, test_f1: 0.5511
 epoch: 28, train_loss: 0.6477, test_loss: 2.2652, test_f1: 0.3494
 epoch: 29, train_loss: 0.6209, test_loss: 1.2313, test_f1: 0.5899
 epoch: 30, train_loss: 0.5982, test_loss: 1.4742, test_f1: 0.5281
 epoch: 31, train_loss: 0.5845, test_loss: 1.8196, test_f1: 0.5129
 epoch: 32, train_loss: 0.5759, test_loss: 1.9571, test_f1: 0.5521
 epoch: 33, train_loss: 0.5633, test_loss: 1.7330, test_f1: 0.5018
 epoch: 34, train_loss: 0.6266, test_loss: 1.3873, test_f1: 0.5422
 epoch: 35, train_loss: 0.6176, test_loss: 1.5420, test_f1: 0.5081
 epoch: 36, train_loss: 0.5995, test_loss: 3.0026, test_f1: 0.3959
 epoch: 37, train_loss: 0.5940, test_loss: 1.5406, test_f1: 0.5424
 epoch: 38, train_loss: 0.5797, test_loss: 1.5547, test_f1: 0.5346
 epoch: 39, train_loss: 0.5567, test_loss: 1.8380, test_f1: 0.5548
 epoch: 40, train_loss: 0.5315, test_loss: 1.6153, test_f1: 0.5582
 epoch: 41, train_loss: 0.5257, test_loss: 1.7677, test_f1: 0.5382
 epoch: 42, train_loss: 0.5752, test_loss: 1.6970, test_f1: 0.5085
 epoch: 43, train_loss: 0.5617, test_loss: 1.4004, test_f1: 0.5488
 epoch: 44, train_loss: 0.5569, test_loss: 1.6293, test_f1: 0.4952
 epoch: 45, train_loss: 0.5462, test_loss: 2.3613, test_f1: 0.4573
 epoch: 46, train_loss: 0.5272, test_loss: 1.6800, test_f1: 0.5655
 epoch: 47, train_loss: 0.5002, test_loss: 1.5688, test_f1: 0.5882
 epoch: 48, train_loss: 0.4846, test_loss: 1.8177, test_f1: 0.6174
 epoch: 49, train_loss: 0.4905, test_loss: 1.4915, test_f1: 0.5982
 epoch: 50, train_loss: 0.4645, test_loss: 1.6349, test_f1: 0.5579
 epoch: 51, train_loss: 0.4362, test_loss: 1.6728, test_f1: 0.5693
 epoch: 52, train_loss: 0.3816, test_loss: 1.8632, test_f1: 0.6066
 epoch: 53, train_loss: 0.4029, test_loss: 1.8965, test_f1: 0.5703
 epoch: 54, train_loss: 0.3922, test_loss: 1.9243, test_f1: 0.6152
 epoch: 55, train_loss: 0.3821, test_loss: 1.8312, test_f1: 0.6249
 epoch: 56, train_loss: 0.3511, test_loss: 1.7815, test_f1: 0.6349
 epoch: 57, train_loss: 0.3459, test_loss: 1.9496, test_f1: 0.6444
 epoch: 58, train_loss: 0.3185, test_loss: 2.1498, test_f1: 0.5890
 epoch: 59, train_loss: 0.3504, test_loss: 2.1053, test_f1: 0.6175
 epoch: 60, train_loss: 0.3317, test_loss: 2.0580, test_f1: 0.6040
 epoch: 61, train_loss: 0.3284, test_loss: 2.4409, test_f1: 0.5306
 epoch: 62, train_loss: 0.3299, test_loss: 2.1692, test_f1: 0.5475
 epoch: 63, train_loss: 0.3490, test_loss: 1.9144, test_f1: 0.5526
 epoch: 64, train_loss: 0.3396, test_loss: 2.0396, test_f1: 0.5813
 epoch: 65, train_loss: 0.3171, test_loss: 1.9758, test_f1: 0.6085
 epoch: 66, train_loss: 0.3379, test_loss: 2.0825, test_f1: 0.6409
 epoch: 67, train_loss: 0.3158, test_loss: 2.3495, test_f1: 0.6323
 epoch: 68, train_loss: 0.2922, test_loss: 2.3917, test_f1: 0.5921
 epoch: 69, train_loss: 0.3281, test_loss: 2.1291, test_f1: 0.6371
 epoch: 70, train_loss: 0.3030, test_loss: 2.2346, test_f1: 0.6115
 epoch: 71, train_loss: 0.3034, test_loss: 2.2410, test_f1: 0.5768
 epoch: 72, train_loss: 0.2911, test_loss: 2.2291, test_f1: 0.5940
 epoch: 73, train_loss: 0.2986, test_loss: 2.1628, test_f1: 0.6392
 epoch: 74, train_loss: 0.2930, test_loss: 1.9582, test_f1: 0.6083
 epoch: 75, train_loss: 0.3074, test_loss: 2.0791, test_f1: 0.6080
 epoch: 76, train_loss: 0.2932, test_loss: 1.9618, test_f1: 0.6147
 epoch: 77, train_loss: 0.2670, test_loss: 2.2260, test_f1: 0.6305
 epoch: 78, train_loss: 0.3199, test_loss: 2.2325, test_f1: 0.6028
 epoch: 79, train_loss: 0.2971, test_loss: 2.2505, test_f1: 0.6178
 epoch: 80, train_loss: 0.3280, test_loss: 2.3905, test_f1: 0.5711
 epoch: 81, train_loss: 0.2944, test_loss: 2.0170, test_f1: 0.6538
 epoch: 82, train_loss: 0.2639, test_loss: 2.1163, test_f1: 0.6409
 epoch: 83, train_loss: 0.2385, test_loss: 2.3097, test_f1: 0.6290
 epoch: 84, train_loss: 0.2444, test_loss: 2.4194, test_f1: 0.5977
 epoch: 85, train_loss: 0.2619, test_loss: 2.3004, test_f1: 0.6025
 epoch: 86, train_loss: 0.3076, test_loss: 2.0448, test_f1: 0.6444
 epoch: 87, train_loss: 0.2678, test_loss: 2.0657, test_f1: 0.6507
 epoch: 88, train_loss: 0.2266, test_loss: 2.3433, test_f1: 0.6373
 epoch: 89, train_loss: 0.2214, test_loss: 2.2772, test_f1: 0.6122
 epoch: 90, train_loss: 0.2206, test_loss: 2.2522, test_f1: 0.5887
 epoch: 91, train_loss: 0.2416, test_loss: 2.4201, test_f1: 0.6485
 epoch: 92, train_loss: 0.2294, test_loss: 2.5086, test_f1: 0.6158
 epoch: 93, train_loss: 0.1999, test_loss: 2.8092, test_f1: 0.5766
 epoch: 94, train_loss: 0.2327, test_loss: 2.4352, test_f1: 0.6145
 epoch: 95, train_loss: 0.2296, test_loss: 2.4009, test_f1: 0.6452
 epoch: 96, train_loss: 0.2853, test_loss: 2.8255, test_f1: 0.5439
 epoch: 97, train_loss: 0.2401, test_loss: 2.4850, test_f1: 0.5379
 epoch: 98, train_loss: 0.2240, test_loss: 2.0430, test_f1: 0.6534
 epoch: 99, train_loss: 0.2211, test_loss: 2.1978, test_f1: 0.6176
##################ITERATION #3 ****************************************
 epoch: 0, train_loss: 1.3335, test_loss: 2.2843, test_f1: 0.1365
 epoch: 1, train_loss: 1.0225, test_loss: 1.4039, test_f1: 0.2343
 epoch: 2, train_loss: 0.9640, test_loss: 1.2861, test_f1: 0.4433
 epoch: 3, train_loss: 0.9455, test_loss: 1.1421, test_f1: 0.4788
 epoch: 4, train_loss: 0.9192, test_loss: 1.1545, test_f1: 0.4565
 epoch: 5, train_loss: 0.9182, test_loss: 1.2324, test_f1: 0.4063
 epoch: 6, train_loss: 0.8762, test_loss: 1.1603, test_f1: 0.4879
 epoch: 7, train_loss: 0.8516, test_loss: 1.1525, test_f1: 0.5121
 epoch: 8, train_loss: 0.8162, test_loss: 1.3965, test_f1: 0.4602
 epoch: 9, train_loss: 0.8409, test_loss: 1.3589, test_f1: 0.4234
 epoch: 10, train_loss: 0.8064, test_loss: 1.2152, test_f1: 0.4293
 epoch: 11, train_loss: 0.7955, test_loss: 1.5286, test_f1: 0.5371
 epoch: 12, train_loss: 0.9155, test_loss: 1.5197, test_f1: 0.3342
 epoch: 13, train_loss: 0.8559, test_loss: 1.3651, test_f1: 0.5460
 epoch: 14, train_loss: 0.8282, test_loss: 1.2616, test_f1: 0.5380
 epoch: 15, train_loss: 0.7784, test_loss: 1.1757, test_f1: 0.5203
 epoch: 16, train_loss: 0.8016, test_loss: 1.3189, test_f1: 0.4815
 epoch: 17, train_loss: 0.7721, test_loss: 1.1703, test_f1: 0.5157
 epoch: 18, train_loss: 0.7378, test_loss: 1.2238, test_f1: 0.5191
 epoch: 19, train_loss: 0.7527, test_loss: 1.2266, test_f1: 0.4482
 epoch: 20, train_loss: 0.7383, test_loss: 1.4050, test_f1: 0.4846
 epoch: 21, train_loss: 0.7186, test_loss: 1.0186, test_f1: 0.5650
 epoch: 22, train_loss: 0.6873, test_loss: 1.4217, test_f1: 0.5076
 epoch: 23, train_loss: 0.7086, test_loss: 1.3644, test_f1: 0.4939
 epoch: 24, train_loss: 0.6562, test_loss: 1.2681, test_f1: 0.5622
 epoch: 25, train_loss: 0.6468, test_loss: 1.2484, test_f1: 0.5278
 epoch: 26, train_loss: 0.6815, test_loss: 1.2560, test_f1: 0.5611
 epoch: 27, train_loss: 0.6612, test_loss: 1.7783, test_f1: 0.4007
 epoch: 28, train_loss: 0.6860, test_loss: 1.0782, test_f1: 0.6034
 epoch: 29, train_loss: 0.6854, test_loss: 1.0533, test_f1: 0.5807
 epoch: 30, train_loss: 0.6622, test_loss: 1.2504, test_f1: 0.5347
 epoch: 31, train_loss: 0.6222, test_loss: 1.3907, test_f1: 0.6064
 epoch: 32, train_loss: 0.6011, test_loss: 1.4196, test_f1: 0.5961
 epoch: 33, train_loss: 0.6394, test_loss: 1.0419, test_f1: 0.6057
 epoch: 34, train_loss: 0.5974, test_loss: 1.1001, test_f1: 0.5513
 epoch: 35, train_loss: 0.5759, test_loss: 1.4161, test_f1: 0.5710
 epoch: 36, train_loss: 0.6062, test_loss: 1.5728, test_f1: 0.4877
 epoch: 37, train_loss: 0.6200, test_loss: 1.6566, test_f1: 0.5080
 epoch: 38, train_loss: 0.5741, test_loss: 1.4202, test_f1: 0.5896
 epoch: 39, train_loss: 0.5622, test_loss: 1.3243, test_f1: 0.6240
 epoch: 40, train_loss: 0.5882, test_loss: 1.4213, test_f1: 0.5316
 epoch: 41, train_loss: 0.6107, test_loss: 2.0149, test_f1: 0.5244
 epoch: 42, train_loss: 0.5662, test_loss: 1.7640, test_f1: 0.4901
 epoch: 43, train_loss: 0.5301, test_loss: 1.7171, test_f1: 0.5995
 epoch: 44, train_loss: 0.5592, test_loss: 1.2473, test_f1: 0.6365
 epoch: 45, train_loss: 0.5613, test_loss: 1.9193, test_f1: 0.5350
 epoch: 46, train_loss: 0.5162, test_loss: 1.8012, test_f1: 0.5382
 epoch: 47, train_loss: 0.6187, test_loss: 1.3169, test_f1: 0.5466
 epoch: 48, train_loss: 0.5807, test_loss: 1.3954, test_f1: 0.5654
 epoch: 49, train_loss: 0.5357, test_loss: 1.3758, test_f1: 0.5921
 epoch: 50, train_loss: 0.5024, test_loss: 1.6840, test_f1: 0.5387
 epoch: 51, train_loss: 0.4976, test_loss: 1.4565, test_f1: 0.6289
 epoch: 52, train_loss: 0.4300, test_loss: 1.5175, test_f1: 0.6544
 epoch: 53, train_loss: 0.4038, test_loss: 1.9018, test_f1: 0.6187
 epoch: 54, train_loss: 0.4363, test_loss: 1.5490, test_f1: 0.6582
 epoch: 55, train_loss: 0.4267, test_loss: 1.7545, test_f1: 0.5284
 epoch: 56, train_loss: 0.4101, test_loss: 1.6916, test_f1: 0.6145
 epoch: 57, train_loss: 0.4251, test_loss: 1.6885, test_f1: 0.5950
 epoch: 58, train_loss: 0.4339, test_loss: 1.7455, test_f1: 0.5947
 epoch: 59, train_loss: 0.4016, test_loss: 1.7529, test_f1: 0.6088
 epoch: 60, train_loss: 0.3516, test_loss: 1.9949, test_f1: 0.5844
 epoch: 61, train_loss: 0.3481, test_loss: 1.9258, test_f1: 0.5995
 epoch: 62, train_loss: 0.3481, test_loss: 1.9617, test_f1: 0.6234
 epoch: 63, train_loss: 0.3693, test_loss: 2.0662, test_f1: 0.5438
 epoch: 64, train_loss: 0.3981, test_loss: 1.8323, test_f1: 0.6308
 epoch: 65, train_loss: 0.3584, test_loss: 1.9900, test_f1: 0.5867
 epoch: 66, train_loss: 0.3396, test_loss: 2.2210, test_f1: 0.6314
 epoch: 67, train_loss: 0.3378, test_loss: 1.7864, test_f1: 0.6277
 epoch: 68, train_loss: 0.3382, test_loss: 1.9131, test_f1: 0.6071
 epoch: 69, train_loss: 0.3480, test_loss: 1.8575, test_f1: 0.6048
 epoch: 70, train_loss: 0.3507, test_loss: 1.9653, test_f1: 0.6067
 epoch: 71, train_loss: 0.3475, test_loss: 2.1156, test_f1: 0.6141
 epoch: 72, train_loss: 0.3288, test_loss: 1.8751, test_f1: 0.6321
 epoch: 73, train_loss: 0.3135, test_loss: 2.0343, test_f1: 0.6447
 epoch: 74, train_loss: 0.2958, test_loss: 2.3663, test_f1: 0.6269
 epoch: 75, train_loss: 0.2988, test_loss: 2.0692, test_f1: 0.6281
 epoch: 76, train_loss: 0.2949, test_loss: 2.5913, test_f1: 0.6026
 epoch: 77, train_loss: 0.2990, test_loss: 2.3642, test_f1: 0.6219
 epoch: 78, train_loss: 0.3155, test_loss: 2.0834, test_f1: 0.6000
 epoch: 79, train_loss: 0.3009, test_loss: 1.9764, test_f1: 0.5646
 epoch: 80, train_loss: 0.3360, test_loss: 2.5518, test_f1: 0.6020
 epoch: 81, train_loss: 0.3231, test_loss: 2.3014, test_f1: 0.5830
 epoch: 82, train_loss: 0.3366, test_loss: 2.2678, test_f1: 0.6275
 epoch: 83, train_loss: 0.3287, test_loss: 2.1178, test_f1: 0.6443
 epoch: 84, train_loss: 0.3196, test_loss: 2.1730, test_f1: 0.6189
 epoch: 85, train_loss: 0.2515, test_loss: 2.2348, test_f1: 0.6084
 epoch: 86, train_loss: 0.2752, test_loss: 2.5976, test_f1: 0.5884
 epoch: 87, train_loss: 0.2860, test_loss: 2.3527, test_f1: 0.5955
 epoch: 88, train_loss: 0.2592, test_loss: 2.2607, test_f1: 0.6177
 epoch: 89, train_loss: 0.3127, test_loss: 2.4744, test_f1: 0.6246
 epoch: 90, train_loss: 0.2720, test_loss: 2.7004, test_f1: 0.5839
 epoch: 91, train_loss: 0.2611, test_loss: 2.4602, test_f1: 0.6359
 epoch: 92, train_loss: 0.2375, test_loss: 2.4623, test_f1: 0.6232
 epoch: 93, train_loss: 0.2879, test_loss: 2.4853, test_f1: 0.6434
 epoch: 94, train_loss: 0.3636, test_loss: 2.2811, test_f1: 0.5355
 epoch: 95, train_loss: 0.3069, test_loss: 2.7826, test_f1: 0.5501
 epoch: 96, train_loss: 0.2767, test_loss: 2.5388, test_f1: 0.5850
 epoch: 97, train_loss: 0.2731, test_loss: 2.4656, test_f1: 0.6035
 epoch: 98, train_loss: 0.2439, test_loss: 2.6250, test_f1: 0.6163
 epoch: 99, train_loss: 0.2462, test_loss: 2.4998, test_f1: 0.6128
##################ITERATION #4 ****************************************
 epoch: 0, train_loss: 1.2817, test_loss: 2.0660, test_f1: 0.2281
 epoch: 1, train_loss: 1.0312, test_loss: 1.4236, test_f1: 0.3230
 epoch: 2, train_loss: 0.9862, test_loss: 1.1637, test_f1: 0.3507
 epoch: 3, train_loss: 0.9322, test_loss: 1.0962, test_f1: 0.4763
 epoch: 4, train_loss: 0.9360, test_loss: 1.1450, test_f1: 0.5335
 epoch: 5, train_loss: 0.9326, test_loss: 1.1800, test_f1: 0.4943
 epoch: 6, train_loss: 0.8944, test_loss: 1.0803, test_f1: 0.4749
 epoch: 7, train_loss: 0.8942, test_loss: 0.9946, test_f1: 0.5045
 epoch: 8, train_loss: 0.8699, test_loss: 1.3431, test_f1: 0.4833
 epoch: 9, train_loss: 0.8650, test_loss: 1.1918, test_f1: 0.4923
 epoch: 10, train_loss: 0.8257, test_loss: 0.9843, test_f1: 0.5244
 epoch: 11, train_loss: 0.7967, test_loss: 1.1645, test_f1: 0.5127
 epoch: 12, train_loss: 0.7960, test_loss: 1.2219, test_f1: 0.4587
 epoch: 13, train_loss: 0.7778, test_loss: 1.0104, test_f1: 0.5425
 epoch: 14, train_loss: 0.7585, test_loss: 1.0181, test_f1: 0.5204
 epoch: 15, train_loss: 0.7461, test_loss: 1.0609, test_f1: 0.5317
 epoch: 16, train_loss: 0.7347, test_loss: 1.2023, test_f1: 0.5040
 epoch: 17, train_loss: 0.7252, test_loss: 1.1316, test_f1: 0.4830
 epoch: 18, train_loss: 0.7210, test_loss: 1.1923, test_f1: 0.5056
 epoch: 19, train_loss: 0.7134, test_loss: 1.0766, test_f1: 0.5312
 epoch: 20, train_loss: 0.6777, test_loss: 1.3664, test_f1: 0.5330
 epoch: 21, train_loss: 0.6845, test_loss: 1.5338, test_f1: 0.4940
 epoch: 22, train_loss: 0.6857, test_loss: 1.2961, test_f1: 0.5337
 epoch: 23, train_loss: 0.6762, test_loss: 1.5529, test_f1: 0.5579
 epoch: 24, train_loss: 0.6571, test_loss: 1.1767, test_f1: 0.5712
 epoch: 25, train_loss: 0.6578, test_loss: 1.4551, test_f1: 0.5382
 epoch: 26, train_loss: 0.6755, test_loss: 1.4332, test_f1: 0.4946
 epoch: 27, train_loss: 0.6859, test_loss: 1.4218, test_f1: 0.4977
 epoch: 28, train_loss: 0.7150, test_loss: 1.1107, test_f1: 0.5674
 epoch: 29, train_loss: 0.6770, test_loss: 1.2834, test_f1: 0.5326
 epoch: 30, train_loss: 0.6562, test_loss: 1.2816, test_f1: 0.5111
 epoch: 31, train_loss: 0.6442, test_loss: 1.1857, test_f1: 0.5339
 epoch: 32, train_loss: 0.6505, test_loss: 1.2953, test_f1: 0.5346
 epoch: 33, train_loss: 0.6799, test_loss: 1.5314, test_f1: 0.5630
 epoch: 34, train_loss: 0.6320, test_loss: 1.2589, test_f1: 0.5647
 epoch: 35, train_loss: 0.6214, test_loss: 1.2122, test_f1: 0.5605
 epoch: 36, train_loss: 0.6107, test_loss: 1.4858, test_f1: 0.5511
 epoch: 37, train_loss: 0.5917, test_loss: 1.1944, test_f1: 0.5901
 epoch: 38, train_loss: 0.5995, test_loss: 1.2632, test_f1: 0.5876
 epoch: 39, train_loss: 0.5764, test_loss: 1.4818, test_f1: 0.5325
 epoch: 40, train_loss: 0.5695, test_loss: 1.3047, test_f1: 0.5886
 epoch: 41, train_loss: 0.5789, test_loss: 1.3752, test_f1: 0.6167
 epoch: 42, train_loss: 0.5846, test_loss: 1.5527, test_f1: 0.5523
 epoch: 43, train_loss: 0.5590, test_loss: 2.0005, test_f1: 0.5449
 epoch: 44, train_loss: 0.5409, test_loss: 1.4265, test_f1: 0.5904
 epoch: 45, train_loss: 0.5523, test_loss: 1.5173, test_f1: 0.5498
 epoch: 46, train_loss: 0.5421, test_loss: 1.2911, test_f1: 0.5816
 epoch: 47, train_loss: 0.5416, test_loss: 1.2643, test_f1: 0.5921
 epoch: 48, train_loss: 0.5285, test_loss: 1.4931, test_f1: 0.5818
 epoch: 49, train_loss: 0.5272, test_loss: 1.5343, test_f1: 0.5691
 epoch: 50, train_loss: 0.5410, test_loss: 1.4023, test_f1: 0.5678
 epoch: 51, train_loss: 0.4975, test_loss: 1.3528, test_f1: 0.6024
 epoch: 52, train_loss: 0.4502, test_loss: 1.6742, test_f1: 0.5686
 epoch: 53, train_loss: 0.4191, test_loss: 1.5704, test_f1: 0.6199
 epoch: 54, train_loss: 0.4125, test_loss: 1.6851, test_f1: 0.5951
 epoch: 55, train_loss: 0.3908, test_loss: 1.6367, test_f1: 0.6002
 epoch: 56, train_loss: 0.3716, test_loss: 1.7237, test_f1: 0.5974
 epoch: 57, train_loss: 0.3832, test_loss: 1.9068, test_f1: 0.5948
 epoch: 58, train_loss: 0.4253, test_loss: 1.8059, test_f1: 0.5792
 epoch: 59, train_loss: 0.4045, test_loss: 1.8152, test_f1: 0.6167
 epoch: 60, train_loss: 0.3614, test_loss: 1.5417, test_f1: 0.6072
 epoch: 61, train_loss: 0.3702, test_loss: 1.7265, test_f1: 0.6154
 epoch: 62, train_loss: 0.3739, test_loss: 1.7031, test_f1: 0.6267
 epoch: 63, train_loss: 0.3895, test_loss: 2.2281, test_f1: 0.5664
 epoch: 64, train_loss: 0.3497, test_loss: 2.0750, test_f1: 0.5833
 epoch: 65, train_loss: 0.3806, test_loss: 1.8788, test_f1: 0.5974
 epoch: 66, train_loss: 0.3373, test_loss: 1.8443, test_f1: 0.5824
 epoch: 67, train_loss: 0.3138, test_loss: 2.2412, test_f1: 0.5846
 epoch: 68, train_loss: 0.3617, test_loss: 2.3655, test_f1: 0.5871
 epoch: 69, train_loss: 0.3326, test_loss: 1.8977, test_f1: 0.6034
 epoch: 70, train_loss: 0.3327, test_loss: 1.8798, test_f1: 0.5803
 epoch: 71, train_loss: 0.2946, test_loss: 2.1834, test_f1: 0.5828
 epoch: 72, train_loss: 0.3067, test_loss: 1.7735, test_f1: 0.6094
 epoch: 73, train_loss: 0.2982, test_loss: 1.8641, test_f1: 0.6016
 epoch: 74, train_loss: 0.2902, test_loss: 2.0396, test_f1: 0.5814
 epoch: 75, train_loss: 0.3002, test_loss: 2.0544, test_f1: 0.6093
 epoch: 76, train_loss: 0.2854, test_loss: 2.2636, test_f1: 0.5756
 epoch: 77, train_loss: 0.3201, test_loss: 2.2167, test_f1: 0.5912
 epoch: 78, train_loss: 0.3221, test_loss: 2.2499, test_f1: 0.5699
 epoch: 79, train_loss: 0.2597, test_loss: 2.4347, test_f1: 0.5799
 epoch: 80, train_loss: 0.2898, test_loss: 2.4346, test_f1: 0.6026
 epoch: 81, train_loss: 0.2825, test_loss: 2.1312, test_f1: 0.5875
 epoch: 82, train_loss: 0.2688, test_loss: 2.1817, test_f1: 0.5969
 epoch: 83, train_loss: 0.2485, test_loss: 2.4802, test_f1: 0.6010
 epoch: 84, train_loss: 0.2835, test_loss: 2.1954, test_f1: 0.5948
 epoch: 85, train_loss: 0.2420, test_loss: 2.4429, test_f1: 0.5691
 epoch: 86, train_loss: 0.2354, test_loss: 2.3149, test_f1: 0.5694
 epoch: 87, train_loss: 0.2497, test_loss: 2.5973, test_f1: 0.5674
 epoch: 88, train_loss: 0.2444, test_loss: 2.4811, test_f1: 0.5989
 epoch: 89, train_loss: 0.2228, test_loss: 2.4622, test_f1: 0.6065
 epoch: 90, train_loss: 0.2412, test_loss: 2.6416, test_f1: 0.5955
 epoch: 91, train_loss: 0.2235, test_loss: 2.6311, test_f1: 0.5603
 epoch: 92, train_loss: 0.2405, test_loss: 2.4533, test_f1: 0.5894
 epoch: 93, train_loss: 0.2653, test_loss: 2.1515, test_f1: 0.5945
 epoch: 94, train_loss: 0.2475, test_loss: 2.1604, test_f1: 0.6215
 epoch: 95, train_loss: 0.2395, test_loss: 2.1993, test_f1: 0.6092
 epoch: 96, train_loss: 0.2617, test_loss: 2.6052, test_f1: 0.5641
 epoch: 97, train_loss: 0.2241, test_loss: 2.0982, test_f1: 0.5675
 epoch: 98, train_loss: 0.2531, test_loss: 2.5689, test_f1: 0.5966
 epoch: 99, train_loss: 0.2138, test_loss: 2.4001, test_f1: 0.5753
##################ITERATION #5 ****************************************
 epoch: 0, train_loss: 1.2785, test_loss: 1.2756, test_f1: 0.4210
 epoch: 1, train_loss: 0.9761, test_loss: 1.1516, test_f1: 0.3837
 epoch: 2, train_loss: 0.9124, test_loss: 1.0137, test_f1: 0.4857
 epoch: 3, train_loss: 0.8896, test_loss: 1.3577, test_f1: 0.4469
 epoch: 4, train_loss: 0.8793, test_loss: 1.7385, test_f1: 0.3873
 epoch: 5, train_loss: 0.8630, test_loss: 1.1539, test_f1: 0.5282
 epoch: 6, train_loss: 0.8159, test_loss: 1.2941, test_f1: 0.5224
 epoch: 7, train_loss: 0.8151, test_loss: 1.1630, test_f1: 0.5440
 epoch: 8, train_loss: 0.8050, test_loss: 1.3481, test_f1: 0.4953
 epoch: 9, train_loss: 0.7940, test_loss: 1.2200, test_f1: 0.5204
 epoch: 10, train_loss: 0.7628, test_loss: 1.2056, test_f1: 0.5455
 epoch: 11, train_loss: 0.7169, test_loss: 1.1993, test_f1: 0.5117
 epoch: 12, train_loss: 0.7090, test_loss: 1.4833, test_f1: 0.5279
 epoch: 13, train_loss: 0.7686, test_loss: 1.2967, test_f1: 0.4207
 epoch: 14, train_loss: 0.7190, test_loss: 1.4913, test_f1: 0.4937
 epoch: 15, train_loss: 0.7170, test_loss: 1.2757, test_f1: 0.5201
 epoch: 16, train_loss: 0.6835, test_loss: 1.3691, test_f1: 0.4738
 epoch: 17, train_loss: 0.6575, test_loss: 1.3349, test_f1: 0.5611
 epoch: 18, train_loss: 0.7182, test_loss: 1.6818, test_f1: 0.5427
 epoch: 19, train_loss: 0.7179, test_loss: 1.1357, test_f1: 0.5337
 epoch: 20, train_loss: 0.7234, test_loss: 1.0436, test_f1: 0.6055
 epoch: 21, train_loss: 0.6815, test_loss: 1.2951, test_f1: 0.5631
 epoch: 22, train_loss: 0.7187, test_loss: 1.1929, test_f1: 0.5102
 epoch: 23, train_loss: 0.6434, test_loss: 1.7397, test_f1: 0.5240
 epoch: 24, train_loss: 0.6253, test_loss: 2.3558, test_f1: 0.4755
 epoch: 25, train_loss: 0.6138, test_loss: 1.5919, test_f1: 0.5569
 epoch: 26, train_loss: 0.6344, test_loss: 1.2481, test_f1: 0.5746
 epoch: 27, train_loss: 0.6031, test_loss: 1.4013, test_f1: 0.5315
 epoch: 28, train_loss: 0.5788, test_loss: 1.3715, test_f1: 0.5070
 epoch: 29, train_loss: 0.5754, test_loss: 1.3337, test_f1: 0.6068
 epoch: 30, train_loss: 0.5552, test_loss: 1.4302, test_f1: 0.5558
 epoch: 31, train_loss: 0.5140, test_loss: 1.6129, test_f1: 0.5912
 epoch: 32, train_loss: 0.5229, test_loss: 1.4686, test_f1: 0.5313
 epoch: 33, train_loss: 0.5715, test_loss: 1.5303, test_f1: 0.5856
 epoch: 34, train_loss: 0.5556, test_loss: 1.6896, test_f1: 0.5453
 epoch: 35, train_loss: 0.5631, test_loss: 2.0801, test_f1: 0.5451
 epoch: 36, train_loss: 0.5882, test_loss: 1.5537, test_f1: 0.5476
 epoch: 37, train_loss: 0.5178, test_loss: 1.4919, test_f1: 0.5752
 epoch: 38, train_loss: 0.5137, test_loss: 1.8514, test_f1: 0.5337
 epoch: 39, train_loss: 0.5757, test_loss: 1.3033, test_f1: 0.5571
 epoch: 40, train_loss: 0.5302, test_loss: 1.6574, test_f1: 0.6250
 epoch: 41, train_loss: 0.5412, test_loss: 1.5410, test_f1: 0.6020
 epoch: 42, train_loss: 0.5161, test_loss: 1.7687, test_f1: 0.5371
 epoch: 43, train_loss: 0.5213, test_loss: 1.3137, test_f1: 0.5488
 epoch: 44, train_loss: 0.4950, test_loss: 1.8490, test_f1: 0.5062
 epoch: 45, train_loss: 0.4692, test_loss: 1.3366, test_f1: 0.5730
 epoch: 46, train_loss: 0.4825, test_loss: 2.2346, test_f1: 0.5432
 epoch: 47, train_loss: 0.4939, test_loss: 1.7711, test_f1: 0.5750
 epoch: 48, train_loss: 0.4494, test_loss: 1.7413, test_f1: 0.5955
 epoch: 49, train_loss: 0.4475, test_loss: 1.5031, test_f1: 0.6296
 epoch: 50, train_loss: 0.4125, test_loss: 1.5755, test_f1: 0.6072
 epoch: 51, train_loss: 0.3833, test_loss: 1.7272, test_f1: 0.6323
 epoch: 52, train_loss: 0.3699, test_loss: 1.8188, test_f1: 0.6080
 epoch: 53, train_loss: 0.3468, test_loss: 1.7060, test_f1: 0.5749
 epoch: 54, train_loss: 0.3549, test_loss: 1.8436, test_f1: 0.5941
 epoch: 55, train_loss: 0.3225, test_loss: 2.0344, test_f1: 0.6236
 epoch: 56, train_loss: 0.3031, test_loss: 2.1669, test_f1: 0.5919
 epoch: 57, train_loss: 0.3003, test_loss: 2.1532, test_f1: 0.5764
 epoch: 58, train_loss: 0.3450, test_loss: 1.8914, test_f1: 0.5971
 epoch: 59, train_loss: 0.3141, test_loss: 2.0006, test_f1: 0.6192
 epoch: 60, train_loss: 0.3086, test_loss: 1.8402, test_f1: 0.5692
 epoch: 61, train_loss: 0.2858, test_loss: 2.4070, test_f1: 0.5712
 epoch: 62, train_loss: 0.3295, test_loss: 2.5468, test_f1: 0.6046
 epoch: 63, train_loss: 0.2914, test_loss: 2.0973, test_f1: 0.6175
 epoch: 64, train_loss: 0.3419, test_loss: 1.9336, test_f1: 0.6389
 epoch: 65, train_loss: 0.2738, test_loss: 2.0275, test_f1: 0.6030
 epoch: 66, train_loss: 0.2893, test_loss: 2.2128, test_f1: 0.6012
 epoch: 67, train_loss: 0.2804, test_loss: 2.8374, test_f1: 0.5823
 epoch: 68, train_loss: 0.3121, test_loss: 2.0902, test_f1: 0.5742
 epoch: 69, train_loss: 0.2951, test_loss: 2.1319, test_f1: 0.5886
 epoch: 70, train_loss: 0.2938, test_loss: 2.3674, test_f1: 0.5509
 epoch: 71, train_loss: 0.2837, test_loss: 2.6081, test_f1: 0.5730
 epoch: 72, train_loss: 0.2892, test_loss: 2.5306, test_f1: 0.5879
 epoch: 73, train_loss: 0.2986, test_loss: 2.3124, test_f1: 0.5999
 epoch: 74, train_loss: 0.3613, test_loss: 2.1743, test_f1: 0.6139
 epoch: 75, train_loss: 0.2716, test_loss: 2.0765, test_f1: 0.6086
 epoch: 76, train_loss: 0.2577, test_loss: 2.5352, test_f1: 0.5960
 epoch: 77, train_loss: 0.2524, test_loss: 2.5801, test_f1: 0.5695
 epoch: 78, train_loss: 0.2266, test_loss: 2.6879, test_f1: 0.5751
 epoch: 79, train_loss: 0.2491, test_loss: 2.4946, test_f1: 0.5798
 epoch: 80, train_loss: 0.2376, test_loss: 2.7118, test_f1: 0.6156
 epoch: 81, train_loss: 0.2405, test_loss: 2.6168, test_f1: 0.5882
 epoch: 82, train_loss: 0.2112, test_loss: 2.3815, test_f1: 0.6110
 epoch: 83, train_loss: 0.2745, test_loss: 2.6181, test_f1: 0.6221
 epoch: 84, train_loss: 0.2192, test_loss: 2.5341, test_f1: 0.5899
 epoch: 85, train_loss: 0.2232, test_loss: 2.4947, test_f1: 0.6156
 epoch: 86, train_loss: 0.2577, test_loss: 3.0708, test_f1: 0.6030
 epoch: 87, train_loss: 0.2365, test_loss: 2.2803, test_f1: 0.6313
 epoch: 88, train_loss: 0.2688, test_loss: 2.1410, test_f1: 0.5782
 epoch: 89, train_loss: 0.2240, test_loss: 2.3878, test_f1: 0.5816
 epoch: 90, train_loss: 0.2506, test_loss: 2.1956, test_f1: 0.5908
 epoch: 91, train_loss: 0.2447, test_loss: 2.5347, test_f1: 0.6062
 epoch: 92, train_loss: 0.2443, test_loss: 2.3902, test_f1: 0.5656
 epoch: 93, train_loss: 0.2178, test_loss: 2.3915, test_f1: 0.6082
 epoch: 94, train_loss: 0.2221, test_loss: 2.3939, test_f1: 0.6158
 epoch: 95, train_loss: 0.1724, test_loss: 2.7041, test_f1: 0.5951
 epoch: 96, train_loss: 0.1985, test_loss: 2.5817, test_f1: 0.5987
 epoch: 97, train_loss: 0.2045, test_loss: 2.7471, test_f1: 0.5767
 epoch: 98, train_loss: 0.1782, test_loss: 2.6704, test_f1: 0.6009
 epoch: 99, train_loss: 0.2072, test_loss: 3.0164, test_f1: 0.5676
##################ITERATION #6 ****************************************
 epoch: 0, train_loss: 1.4211, test_loss: 1.3208, test_f1: 0.3279
 epoch: 1, train_loss: 1.0189, test_loss: 1.1837, test_f1: 0.3188
 epoch: 2, train_loss: 0.9573, test_loss: 1.1519, test_f1: 0.4697
 epoch: 3, train_loss: 0.9433, test_loss: 0.9985, test_f1: 0.5196
 epoch: 4, train_loss: 0.9094, test_loss: 1.1443, test_f1: 0.4706
 epoch: 5, train_loss: 0.8772, test_loss: 1.0231, test_f1: 0.4919
 epoch: 6, train_loss: 0.8524, test_loss: 1.2375, test_f1: 0.4982
 epoch: 7, train_loss: 0.8460, test_loss: 1.1815, test_f1: 0.4322
 epoch: 8, train_loss: 0.8399, test_loss: 1.2015, test_f1: 0.4572
 epoch: 9, train_loss: 0.7988, test_loss: 1.0463, test_f1: 0.5436
 epoch: 10, train_loss: 0.7705, test_loss: 1.5283, test_f1: 0.4873
 epoch: 11, train_loss: 0.7713, test_loss: 1.1086, test_f1: 0.5520
 epoch: 12, train_loss: 0.7699, test_loss: 1.0009, test_f1: 0.5519
 epoch: 13, train_loss: 0.7608, test_loss: 0.9781, test_f1: 0.5829
 epoch: 14, train_loss: 0.7549, test_loss: 1.1389, test_f1: 0.4785
 epoch: 15, train_loss: 0.7361, test_loss: 1.0302, test_f1: 0.5807
 epoch: 16, train_loss: 0.7087, test_loss: 1.0944, test_f1: 0.5976
 epoch: 17, train_loss: 0.7088, test_loss: 1.0494, test_f1: 0.5639
 epoch: 18, train_loss: 0.6936, test_loss: 1.1778, test_f1: 0.5669
 epoch: 19, train_loss: 0.6872, test_loss: 0.9967, test_f1: 0.5990
 epoch: 20, train_loss: 0.6926, test_loss: 1.1416, test_f1: 0.5064
 epoch: 21, train_loss: 0.6930, test_loss: 1.1493, test_f1: 0.5710
 epoch: 22, train_loss: 0.7080, test_loss: 1.3352, test_f1: 0.4982
 epoch: 23, train_loss: 0.6537, test_loss: 1.2932, test_f1: 0.4924
 epoch: 24, train_loss: 0.6880, test_loss: 1.1897, test_f1: 0.6093
 epoch: 25, train_loss: 0.6448, test_loss: 1.4195, test_f1: 0.5316
 epoch: 26, train_loss: 0.6446, test_loss: 1.2378, test_f1: 0.5870
 epoch: 27, train_loss: 0.6127, test_loss: 1.2702, test_f1: 0.5677
 epoch: 28, train_loss: 0.6068, test_loss: 1.1859, test_f1: 0.5915
 epoch: 29, train_loss: 0.5761, test_loss: 1.3148, test_f1: 0.5337
 epoch: 30, train_loss: 0.5592, test_loss: 1.5809, test_f1: 0.5575
 epoch: 31, train_loss: 0.5384, test_loss: 1.3370, test_f1: 0.5738
 epoch: 32, train_loss: 0.5849, test_loss: 1.3952, test_f1: 0.5442
 epoch: 33, train_loss: 0.5730, test_loss: 1.3632, test_f1: 0.5767
 epoch: 34, train_loss: 0.5881, test_loss: 1.2986, test_f1: 0.5899
 epoch: 35, train_loss: 0.6101, test_loss: 1.2495, test_f1: 0.6023
 epoch: 36, train_loss: 0.5705, test_loss: 1.5075, test_f1: 0.5229
 epoch: 37, train_loss: 0.5638, test_loss: 1.3079, test_f1: 0.5825
 epoch: 38, train_loss: 0.5614, test_loss: 1.7619, test_f1: 0.4270
 epoch: 39, train_loss: 0.5798, test_loss: 1.1469, test_f1: 0.6580
 epoch: 40, train_loss: 0.5747, test_loss: 1.4675, test_f1: 0.5696
 epoch: 41, train_loss: 0.5218, test_loss: 1.3217, test_f1: 0.5673
 epoch: 42, train_loss: 0.4878, test_loss: 1.5924, test_f1: 0.5512
 epoch: 43, train_loss: 0.4893, test_loss: 1.5728, test_f1: 0.5119
 epoch: 44, train_loss: 0.4808, test_loss: 1.8453, test_f1: 0.5535
 epoch: 45, train_loss: 0.4675, test_loss: 1.5577, test_f1: 0.6210
 epoch: 46, train_loss: 0.4945, test_loss: 1.3609, test_f1: 0.6025
 epoch: 47, train_loss: 0.4609, test_loss: 1.5787, test_f1: 0.6018
 epoch: 48, train_loss: 0.4647, test_loss: 1.8845, test_f1: 0.5908
 epoch: 49, train_loss: 0.5255, test_loss: 1.8164, test_f1: 0.6069
 epoch: 50, train_loss: 0.5433, test_loss: 1.3729, test_f1: 0.5744
 epoch: 51, train_loss: 0.4796, test_loss: 1.3866, test_f1: 0.6139
 epoch: 52, train_loss: 0.4176, test_loss: 1.6172, test_f1: 0.6189
 epoch: 53, train_loss: 0.3823, test_loss: 1.6362, test_f1: 0.6192
 epoch: 54, train_loss: 0.3775, test_loss: 1.5633, test_f1: 0.6009
 epoch: 55, train_loss: 0.3593, test_loss: 1.9825, test_f1: 0.6069
 epoch: 56, train_loss: 0.3341, test_loss: 1.9733, test_f1: 0.5917
 epoch: 57, train_loss: 0.3316, test_loss: 2.3392, test_f1: 0.5775
 epoch: 58, train_loss: 0.3130, test_loss: 1.8267, test_f1: 0.5863
 epoch: 59, train_loss: 0.3418, test_loss: 1.9888, test_f1: 0.6265
 epoch: 60, train_loss: 0.3931, test_loss: 1.7050, test_f1: 0.5991
 epoch: 61, train_loss: 0.3912, test_loss: 1.8951, test_f1: 0.5634
 epoch: 62, train_loss: 0.3434, test_loss: 1.7801, test_f1: 0.6254
 epoch: 63, train_loss: 0.3252, test_loss: 1.9314, test_f1: 0.6156
 epoch: 64, train_loss: 0.3070, test_loss: 2.2081, test_f1: 0.6051
 epoch: 65, train_loss: 0.2909, test_loss: 2.1621, test_f1: 0.6263
 epoch: 66, train_loss: 0.2830, test_loss: 2.1930, test_f1: 0.5883
 epoch: 67, train_loss: 0.2868, test_loss: 2.2806, test_f1: 0.5979
 epoch: 68, train_loss: 0.2779, test_loss: 2.3263, test_f1: 0.5867
 epoch: 69, train_loss: 0.2788, test_loss: 2.4720, test_f1: 0.5286
 epoch: 70, train_loss: 0.3333, test_loss: 2.1037, test_f1: 0.5888
 epoch: 71, train_loss: 0.3296, test_loss: 2.0953, test_f1: 0.5925
 epoch: 72, train_loss: 0.3117, test_loss: 2.1081, test_f1: 0.6078
 epoch: 73, train_loss: 0.2898, test_loss: 2.1581, test_f1: 0.6154
 epoch: 74, train_loss: 0.2855, test_loss: 2.2982, test_f1: 0.6104
 epoch: 75, train_loss: 0.2508, test_loss: 2.2117, test_f1: 0.6097
 epoch: 76, train_loss: 0.2523, test_loss: 2.1151, test_f1: 0.6091
 epoch: 77, train_loss: 0.2928, test_loss: 2.7661, test_f1: 0.5429
 epoch: 78, train_loss: 0.3895, test_loss: 2.0245, test_f1: 0.5607
 epoch: 79, train_loss: 0.3332, test_loss: 2.1801, test_f1: 0.5824
 epoch: 80, train_loss: 0.2652, test_loss: 2.3070, test_f1: 0.5949
 epoch: 81, train_loss: 0.2474, test_loss: 2.2887, test_f1: 0.6105
 epoch: 82, train_loss: 0.2498, test_loss: 2.4484, test_f1: 0.6133
 epoch: 83, train_loss: 0.2448, test_loss: 2.2883, test_f1: 0.5727
 epoch: 84, train_loss: 0.2394, test_loss: 2.5501, test_f1: 0.5870
 epoch: 85, train_loss: 0.2769, test_loss: 2.1506, test_f1: 0.5849
 epoch: 86, train_loss: 0.2289, test_loss: 2.8217, test_f1: 0.5984
 epoch: 87, train_loss: 0.2833, test_loss: 2.7075, test_f1: 0.5679
 epoch: 88, train_loss: 0.3374, test_loss: 2.2799, test_f1: 0.5785
 epoch: 89, train_loss: 0.2773, test_loss: 2.4029, test_f1: 0.6004
 epoch: 90, train_loss: 0.2760, test_loss: 2.1588, test_f1: 0.6113
 epoch: 91, train_loss: 0.2303, test_loss: 2.0365, test_f1: 0.6000
 epoch: 92, train_loss: 0.2465, test_loss: 2.2518, test_f1: 0.5750
 epoch: 93, train_loss: 0.2446, test_loss: 2.3791, test_f1: 0.6229
 epoch: 94, train_loss: 0.2411, test_loss: 2.4274, test_f1: 0.6064
 epoch: 95, train_loss: 0.2328, test_loss: 2.5786, test_f1: 0.6066
 epoch: 96, train_loss: 0.2354, test_loss: 2.3220, test_f1: 0.6134
 epoch: 97, train_loss: 0.2233, test_loss: 2.2723, test_f1: 0.6120
 epoch: 98, train_loss: 0.2214, test_loss: 2.2642, test_f1: 0.5900
 epoch: 99, train_loss: 0.2098, test_loss: 2.3039, test_f1: 0.6200
##################ITERATION #7 ****************************************
 epoch: 0, train_loss: 1.3757, test_loss: 1.4000, test_f1: 0.2281
 epoch: 1, train_loss: 1.0433, test_loss: 1.2357, test_f1: 0.2987
 epoch: 2, train_loss: 0.9951, test_loss: 1.0728, test_f1: 0.3958
 epoch: 3, train_loss: 0.9659, test_loss: 1.1133, test_f1: 0.4621
 epoch: 4, train_loss: 0.9569, test_loss: 1.0887, test_f1: 0.4781
 epoch: 5, train_loss: 0.9257, test_loss: 1.0012, test_f1: 0.4855
 epoch: 6, train_loss: 0.9395, test_loss: 1.0306, test_f1: 0.4938
 epoch: 7, train_loss: 0.9221, test_loss: 1.0381, test_f1: 0.5220
 epoch: 8, train_loss: 0.8640, test_loss: 0.9934, test_f1: 0.5104
 epoch: 9, train_loss: 0.8284, test_loss: 1.0956, test_f1: 0.4547
 epoch: 10, train_loss: 0.8483, test_loss: 0.9835, test_f1: 0.5224
 epoch: 11, train_loss: 0.8234, test_loss: 1.3914, test_f1: 0.4300
 epoch: 12, train_loss: 0.8307, test_loss: 1.3457, test_f1: 0.4833
 epoch: 13, train_loss: 0.8026, test_loss: 1.1709, test_f1: 0.4799
 epoch: 14, train_loss: 0.7741, test_loss: 1.1081, test_f1: 0.5075
 epoch: 15, train_loss: 0.7549, test_loss: 1.0800, test_f1: 0.5060
 epoch: 16, train_loss: 0.7306, test_loss: 1.1837, test_f1: 0.5295
 epoch: 17, train_loss: 0.7271, test_loss: 1.1184, test_f1: 0.5746
 epoch: 18, train_loss: 0.7256, test_loss: 1.0923, test_f1: 0.6002
 epoch: 19, train_loss: 0.7455, test_loss: 1.1781, test_f1: 0.5023
 epoch: 20, train_loss: 0.7254, test_loss: 1.0841, test_f1: 0.5832
 epoch: 21, train_loss: 0.7165, test_loss: 1.0987, test_f1: 0.5337
 epoch: 22, train_loss: 0.6800, test_loss: 1.1099, test_f1: 0.6024
 epoch: 23, train_loss: 0.6639, test_loss: 1.1284, test_f1: 0.5952
 epoch: 24, train_loss: 0.6620, test_loss: 1.2177, test_f1: 0.5013
 epoch: 25, train_loss: 0.6684, test_loss: 1.2548, test_f1: 0.5491
 epoch: 26, train_loss: 0.6350, test_loss: 1.1683, test_f1: 0.5644
 epoch: 27, train_loss: 0.6387, test_loss: 1.1381, test_f1: 0.5520
 epoch: 28, train_loss: 0.6333, test_loss: 1.3149, test_f1: 0.5436
 epoch: 29, train_loss: 0.6281, test_loss: 1.5430, test_f1: 0.5035
 epoch: 30, train_loss: 0.6785, test_loss: 1.3360, test_f1: 0.5209
 epoch: 31, train_loss: 0.6369, test_loss: 1.3020, test_f1: 0.5447
 epoch: 32, train_loss: 0.6627, test_loss: 1.3227, test_f1: 0.5364
 epoch: 33, train_loss: 0.6221, test_loss: 1.3612, test_f1: 0.5650
 epoch: 34, train_loss: 0.6372, test_loss: 1.0911, test_f1: 0.5819
 epoch: 35, train_loss: 0.5871, test_loss: 1.9215, test_f1: 0.4919
 epoch: 36, train_loss: 0.6226, test_loss: 1.0486, test_f1: 0.5882
 epoch: 37, train_loss: 0.5724, test_loss: 1.4026, test_f1: 0.5284
 epoch: 38, train_loss: 0.6091, test_loss: 1.4506, test_f1: 0.5185
 epoch: 39, train_loss: 0.5775, test_loss: 1.3635, test_f1: 0.5616
 epoch: 40, train_loss: 0.5772, test_loss: 1.2999, test_f1: 0.6091
 epoch: 41, train_loss: 0.5695, test_loss: 1.5459, test_f1: 0.5153
 epoch: 42, train_loss: 0.5559, test_loss: 1.4450, test_f1: 0.5559
 epoch: 43, train_loss: 0.5512, test_loss: 1.1798, test_f1: 0.5932
 epoch: 44, train_loss: 0.5494, test_loss: 1.4210, test_f1: 0.5489
 epoch: 45, train_loss: 0.5251, test_loss: 1.2451, test_f1: 0.5628
 epoch: 46, train_loss: 0.5272, test_loss: 1.2907, test_f1: 0.5537
 epoch: 47, train_loss: 0.5103, test_loss: 1.6347, test_f1: 0.5352
 epoch: 48, train_loss: 0.5543, test_loss: 1.5155, test_f1: 0.5231
 epoch: 49, train_loss: 0.5351, test_loss: 1.5934, test_f1: 0.5357
 epoch: 50, train_loss: 0.4949, test_loss: 1.3222, test_f1: 0.6030
 epoch: 51, train_loss: 0.4863, test_loss: 1.4823, test_f1: 0.5810
 epoch: 52, train_loss: 0.4667, test_loss: 1.3550, test_f1: 0.5916
 epoch: 53, train_loss: 0.4353, test_loss: 1.4983, test_f1: 0.5998
 epoch: 54, train_loss: 0.3995, test_loss: 1.5162, test_f1: 0.5866
 epoch: 55, train_loss: 0.3774, test_loss: 1.4740, test_f1: 0.5931
 epoch: 56, train_loss: 0.3693, test_loss: 1.5550, test_f1: 0.6129
 epoch: 57, train_loss: 0.4166, test_loss: 1.5271, test_f1: 0.6290
 epoch: 58, train_loss: 0.4025, test_loss: 1.5497, test_f1: 0.5713
 epoch: 59, train_loss: 0.3831, test_loss: 1.7904, test_f1: 0.5694
 epoch: 60, train_loss: 0.3691, test_loss: 1.5554, test_f1: 0.5678
 epoch: 61, train_loss: 0.3668, test_loss: 1.6544, test_f1: 0.6028
 epoch: 62, train_loss: 0.3262, test_loss: 1.6944, test_f1: 0.6285
 epoch: 63, train_loss: 0.3417, test_loss: 2.1030, test_f1: 0.6032
 epoch: 64, train_loss: 0.3728, test_loss: 2.6546, test_f1: 0.5176
 epoch: 65, train_loss: 0.3661, test_loss: 1.7304, test_f1: 0.6050
 epoch: 66, train_loss: 0.3359, test_loss: 1.9670, test_f1: 0.5697
 epoch: 67, train_loss: 0.3508, test_loss: 1.6986, test_f1: 0.5640
 epoch: 68, train_loss: 0.3375, test_loss: 1.8385, test_f1: 0.6197
 epoch: 69, train_loss: 0.3669, test_loss: 1.7220, test_f1: 0.5783
 epoch: 70, train_loss: 0.3141, test_loss: 1.9843, test_f1: 0.5636
 epoch: 71, train_loss: 0.3028, test_loss: 2.0830, test_f1: 0.5974
 epoch: 72, train_loss: 0.3201, test_loss: 1.8844, test_f1: 0.5960
 epoch: 73, train_loss: 0.3164, test_loss: 1.9717, test_f1: 0.5599
 epoch: 74, train_loss: 0.2926, test_loss: 2.2641, test_f1: 0.5402
 epoch: 75, train_loss: 0.3003, test_loss: 2.0814, test_f1: 0.5886
 epoch: 76, train_loss: 0.3458, test_loss: 1.8791, test_f1: 0.6302
 epoch: 77, train_loss: 0.3466, test_loss: 2.4789, test_f1: 0.5350
 epoch: 78, train_loss: 0.3114, test_loss: 2.1885, test_f1: 0.5815
 epoch: 79, train_loss: 0.2949, test_loss: 1.9681, test_f1: 0.6108
 epoch: 80, train_loss: 0.3189, test_loss: 1.9493, test_f1: 0.5482
 epoch: 81, train_loss: 0.3582, test_loss: 1.9873, test_f1: 0.5740
 epoch: 82, train_loss: 0.3215, test_loss: 2.3953, test_f1: 0.5676
 epoch: 83, train_loss: 0.3023, test_loss: 2.5248, test_f1: 0.5469
 epoch: 84, train_loss: 0.3380, test_loss: 1.9044, test_f1: 0.6258
 epoch: 85, train_loss: 0.3486, test_loss: 1.9692, test_f1: 0.6358
 epoch: 86, train_loss: 0.3293, test_loss: 1.9764, test_f1: 0.6250
 epoch: 87, train_loss: 0.3178, test_loss: 1.9021, test_f1: 0.5826
 epoch: 88, train_loss: 0.2867, test_loss: 1.9441, test_f1: 0.5876
 epoch: 89, train_loss: 0.2805, test_loss: 2.0549, test_f1: 0.6243
 epoch: 90, train_loss: 0.2912, test_loss: 2.1498, test_f1: 0.5918
 epoch: 91, train_loss: 0.2946, test_loss: 2.2324, test_f1: 0.5494
 epoch: 92, train_loss: 0.2938, test_loss: 1.9698, test_f1: 0.6318
 epoch: 93, train_loss: 0.2658, test_loss: 1.9566, test_f1: 0.6121
 epoch: 94, train_loss: 0.2353, test_loss: 2.3258, test_f1: 0.5866
 epoch: 95, train_loss: 0.2378, test_loss: 2.2166, test_f1: 0.5604
 epoch: 96, train_loss: 0.2622, test_loss: 2.4551, test_f1: 0.5711
 epoch: 97, train_loss: 0.3505, test_loss: 2.2672, test_f1: 0.5047
 epoch: 98, train_loss: 0.3094, test_loss: 2.1368, test_f1: 0.5835
 epoch: 99, train_loss: 0.3017, test_loss: 2.3550, test_f1: 0.6353
##################ITERATION #8 ****************************************
 epoch: 0, train_loss: 1.3170, test_loss: 1.3822, test_f1: 0.2935
 epoch: 1, train_loss: 1.0232, test_loss: 1.3698, test_f1: 0.2360
 epoch: 2, train_loss: 0.9876, test_loss: 1.1486, test_f1: 0.4141
 epoch: 3, train_loss: 0.9482, test_loss: 1.0626, test_f1: 0.5147
 epoch: 4, train_loss: 0.9545, test_loss: 1.0951, test_f1: 0.4878
 epoch: 5, train_loss: 0.9218, test_loss: 1.1638, test_f1: 0.4720
 epoch: 6, train_loss: 0.9049, test_loss: 1.1350, test_f1: 0.5080
 epoch: 7, train_loss: 0.9066, test_loss: 1.0612, test_f1: 0.5255
 epoch: 8, train_loss: 0.9271, test_loss: 1.1070, test_f1: 0.4426
 epoch: 9, train_loss: 0.8768, test_loss: 0.9646, test_f1: 0.5827
 epoch: 10, train_loss: 0.8396, test_loss: 1.1045, test_f1: 0.4765
 epoch: 11, train_loss: 0.8015, test_loss: 1.1077, test_f1: 0.5565
 epoch: 12, train_loss: 0.8091, test_loss: 1.1359, test_f1: 0.5175
 epoch: 13, train_loss: 0.8080, test_loss: 1.0641, test_f1: 0.5368
 epoch: 14, train_loss: 0.7963, test_loss: 1.1703, test_f1: 0.5975
 epoch: 15, train_loss: 0.7895, test_loss: 1.0982, test_f1: 0.4911
 epoch: 16, train_loss: 0.7778, test_loss: 1.0605, test_f1: 0.4871
 epoch: 17, train_loss: 0.7579, test_loss: 1.0215, test_f1: 0.4925
 epoch: 18, train_loss: 0.7221, test_loss: 2.2789, test_f1: 0.4374
 epoch: 19, train_loss: 0.7535, test_loss: 1.3359, test_f1: 0.4755
 epoch: 20, train_loss: 0.7615, test_loss: 1.0581, test_f1: 0.5411
 epoch: 21, train_loss: 0.7260, test_loss: 1.1559, test_f1: 0.5325
 epoch: 22, train_loss: 0.7114, test_loss: 1.1143, test_f1: 0.5393
 epoch: 23, train_loss: 0.7149, test_loss: 1.2114, test_f1: 0.5353
 epoch: 24, train_loss: 0.6946, test_loss: 1.0786, test_f1: 0.5402
 epoch: 25, train_loss: 0.7195, test_loss: 1.4223, test_f1: 0.5374
 epoch: 26, train_loss: 0.7008, test_loss: 1.3856, test_f1: 0.4820
 epoch: 27, train_loss: 0.7197, test_loss: 1.1046, test_f1: 0.5331
 epoch: 28, train_loss: 0.6789, test_loss: 1.6662, test_f1: 0.4729
 epoch: 29, train_loss: 0.6359, test_loss: 1.0160, test_f1: 0.5678
 epoch: 30, train_loss: 0.6289, test_loss: 1.5864, test_f1: 0.4881
 epoch: 31, train_loss: 0.6489, test_loss: 0.9868, test_f1: 0.5751
 epoch: 32, train_loss: 0.6053, test_loss: 1.0761, test_f1: 0.5804
 epoch: 33, train_loss: 0.5814, test_loss: 1.7151, test_f1: 0.4578
 epoch: 34, train_loss: 0.6056, test_loss: 1.2542, test_f1: 0.4860
 epoch: 35, train_loss: 0.6140, test_loss: 1.7873, test_f1: 0.4804
 epoch: 36, train_loss: 0.6295, test_loss: 1.1588, test_f1: 0.5279
 epoch: 37, train_loss: 0.6208, test_loss: 1.1002, test_f1: 0.5907
 epoch: 38, train_loss: 0.5882, test_loss: 1.2316, test_f1: 0.5810
 epoch: 39, train_loss: 0.5958, test_loss: 1.1827, test_f1: 0.5531
 epoch: 40, train_loss: 0.5607, test_loss: 1.1554, test_f1: 0.6177
 epoch: 41, train_loss: 0.5745, test_loss: 1.4137, test_f1: 0.5477
 epoch: 42, train_loss: 0.5700, test_loss: 1.1747, test_f1: 0.5695
 epoch: 43, train_loss: 0.5807, test_loss: 1.0348, test_f1: 0.5804
 epoch: 44, train_loss: 0.5547, test_loss: 1.5100, test_f1: 0.6005
 epoch: 45, train_loss: 0.5587, test_loss: 1.4335, test_f1: 0.5101
 epoch: 46, train_loss: 0.5668, test_loss: 1.8171, test_f1: 0.4991
 epoch: 47, train_loss: 0.5453, test_loss: 1.4124, test_f1: 0.5846
 epoch: 48, train_loss: 0.5462, test_loss: 1.0736, test_f1: 0.5779
 epoch: 49, train_loss: 0.5235, test_loss: 1.1232, test_f1: 0.6407
 epoch: 50, train_loss: 0.4984, test_loss: 1.4455, test_f1: 0.5661
 epoch: 51, train_loss: 0.5041, test_loss: 1.7857, test_f1: 0.5259
 epoch: 52, train_loss: 0.4552, test_loss: 1.4176, test_f1: 0.5713
 epoch: 53, train_loss: 0.4544, test_loss: 1.2732, test_f1: 0.6106
 epoch: 54, train_loss: 0.4381, test_loss: 1.4054, test_f1: 0.5876
 epoch: 55, train_loss: 0.4395, test_loss: 1.5383, test_f1: 0.5656
 epoch: 56, train_loss: 0.4261, test_loss: 1.2973, test_f1: 0.5746
 epoch: 57, train_loss: 0.4333, test_loss: 1.2810, test_f1: 0.6125
 epoch: 58, train_loss: 0.3851, test_loss: 1.3237, test_f1: 0.6352
 epoch: 59, train_loss: 0.3670, test_loss: 1.4992, test_f1: 0.6071
 epoch: 60, train_loss: 0.3872, test_loss: 1.5023, test_f1: 0.6231
 epoch: 61, train_loss: 0.3773, test_loss: 1.4913, test_f1: 0.6021
 epoch: 62, train_loss: 0.3565, test_loss: 1.4728, test_f1: 0.5880
 epoch: 63, train_loss: 0.3680, test_loss: 1.7009, test_f1: 0.5939
 epoch: 64, train_loss: 0.3611, test_loss: 1.5968, test_f1: 0.6081
 epoch: 65, train_loss: 0.3846, test_loss: 1.7504, test_f1: 0.5807
 epoch: 66, train_loss: 0.3776, test_loss: 1.5559, test_f1: 0.6344
 epoch: 67, train_loss: 0.3736, test_loss: 1.5687, test_f1: 0.5509
 epoch: 68, train_loss: 0.3622, test_loss: 1.7265, test_f1: 0.5750
 epoch: 69, train_loss: 0.3631, test_loss: 1.6871, test_f1: 0.6298
 epoch: 70, train_loss: 0.3816, test_loss: 1.6853, test_f1: 0.5639
 epoch: 71, train_loss: 0.3568, test_loss: 1.6813, test_f1: 0.6078
 epoch: 72, train_loss: 0.3254, test_loss: 1.8458, test_f1: 0.6185
 epoch: 73, train_loss: 0.3407, test_loss: 1.6544, test_f1: 0.5550
 epoch: 74, train_loss: 0.3493, test_loss: 1.9202, test_f1: 0.5369
 epoch: 75, train_loss: 0.3767, test_loss: 1.9116, test_f1: 0.5518
 epoch: 76, train_loss: 0.3271, test_loss: 1.8879, test_f1: 0.5449
 epoch: 77, train_loss: 0.3447, test_loss: 1.5986, test_f1: 0.6011
 epoch: 78, train_loss: 0.3214, test_loss: 1.3812, test_f1: 0.6182
 epoch: 79, train_loss: 0.3223, test_loss: 1.6480, test_f1: 0.6087
 epoch: 80, train_loss: 0.3247, test_loss: 1.7941, test_f1: 0.5645
 epoch: 81, train_loss: 0.2887, test_loss: 1.8507, test_f1: 0.5497
 epoch: 82, train_loss: 0.3057, test_loss: 1.8362, test_f1: 0.5799
 epoch: 83, train_loss: 0.3374, test_loss: 1.8284, test_f1: 0.5773
 epoch: 84, train_loss: 0.2802, test_loss: 1.9252, test_f1: 0.5939
 epoch: 85, train_loss: 0.2951, test_loss: 2.1692, test_f1: 0.5419
 epoch: 86, train_loss: 0.4360, test_loss: 1.3853, test_f1: 0.5847
 epoch: 87, train_loss: 0.3532, test_loss: 1.6402, test_f1: 0.5999
 epoch: 88, train_loss: 0.3658, test_loss: 1.7693, test_f1: 0.5995
 epoch: 89, train_loss: 0.3148, test_loss: 1.4742, test_f1: 0.6325
 epoch: 90, train_loss: 0.3602, test_loss: 1.6495, test_f1: 0.5752
 epoch: 91, train_loss: 0.3416, test_loss: 1.8209, test_f1: 0.5860
 epoch: 92, train_loss: 0.3194, test_loss: 1.7767, test_f1: 0.5998
 epoch: 93, train_loss: 0.2992, test_loss: 1.6012, test_f1: 0.6292
 epoch: 94, train_loss: 0.2838, test_loss: 1.8774, test_f1: 0.5885
 epoch: 95, train_loss: 0.2989, test_loss: 1.7164, test_f1: 0.6108
 epoch: 96, train_loss: 0.3016, test_loss: 1.6314, test_f1: 0.5635
 epoch: 97, train_loss: 0.2921, test_loss: 1.8994, test_f1: 0.6171
 epoch: 98, train_loss: 0.2692, test_loss: 1.7718, test_f1: 0.5850
 epoch: 99, train_loss: 0.2786, test_loss: 2.0403, test_f1: 0.6278
##################ITERATION #9 ****************************************
 epoch: 0, train_loss: 1.2826, test_loss: 1.3863, test_f1: 0.1477
 epoch: 1, train_loss: 0.9803, test_loss: 1.3073, test_f1: 0.2370
 epoch: 2, train_loss: 0.9390, test_loss: 1.1871, test_f1: 0.3560
 epoch: 3, train_loss: 0.8827, test_loss: 1.0941, test_f1: 0.5194
 epoch: 4, train_loss: 0.8506, test_loss: 1.0304, test_f1: 0.5272
 epoch: 5, train_loss: 0.8121, test_loss: 1.0758, test_f1: 0.5396
 epoch: 6, train_loss: 0.7890, test_loss: 1.0384, test_f1: 0.5794
 epoch: 7, train_loss: 0.8068, test_loss: 1.3572, test_f1: 0.4868
 epoch: 8, train_loss: 0.8094, test_loss: 1.4248, test_f1: 0.4799
 epoch: 9, train_loss: 0.7906, test_loss: 1.5764, test_f1: 0.5025
 epoch: 10, train_loss: 0.7708, test_loss: 1.1374, test_f1: 0.4938
 epoch: 11, train_loss: 0.7558, test_loss: 1.4687, test_f1: 0.4635
 epoch: 12, train_loss: 0.7641, test_loss: 1.0564, test_f1: 0.5273
 epoch: 13, train_loss: 0.7598, test_loss: 1.0861, test_f1: 0.5467
 epoch: 14, train_loss: 0.7397, test_loss: 1.1241, test_f1: 0.4999
 epoch: 15, train_loss: 0.7324, test_loss: 1.0511, test_f1: 0.5130
 epoch: 16, train_loss: 0.7393, test_loss: 1.2923, test_f1: 0.4994
 epoch: 17, train_loss: 0.7123, test_loss: 3.3473, test_f1: 0.3957
 epoch: 18, train_loss: 0.7631, test_loss: 1.1804, test_f1: 0.5128
 epoch: 19, train_loss: 0.7032, test_loss: 1.0214, test_f1: 0.5901
 epoch: 20, train_loss: 0.6779, test_loss: 1.0693, test_f1: 0.6207
 epoch: 21, train_loss: 0.6828, test_loss: 1.2695, test_f1: 0.5311
 epoch: 22, train_loss: 0.6809, test_loss: 0.9805, test_f1: 0.5787
 epoch: 23, train_loss: 0.6508, test_loss: 1.0714, test_f1: 0.5680
 epoch: 24, train_loss: 0.6884, test_loss: 1.1479, test_f1: 0.5270
 epoch: 25, train_loss: 0.6613, test_loss: 1.2547, test_f1: 0.5313
 epoch: 26, train_loss: 0.6196, test_loss: 1.8361, test_f1: 0.4899
 epoch: 27, train_loss: 0.6240, test_loss: 1.3356, test_f1: 0.5152
 epoch: 28, train_loss: 0.6415, test_loss: 1.0746, test_f1: 0.5787
 epoch: 29, train_loss: 0.6543, test_loss: 1.0619, test_f1: 0.5860
 epoch: 30, train_loss: 0.6323, test_loss: 1.3237, test_f1: 0.4815
 epoch: 31, train_loss: 0.6392, test_loss: 1.2927, test_f1: 0.5711
 epoch: 32, train_loss: 0.6090, test_loss: 1.4981, test_f1: 0.5225
 epoch: 33, train_loss: 0.6180, test_loss: 1.9034, test_f1: 0.4559
 epoch: 34, train_loss: 0.5994, test_loss: 1.7350, test_f1: 0.5049
 epoch: 35, train_loss: 0.5831, test_loss: 1.3276, test_f1: 0.5248
 epoch: 36, train_loss: 0.5798, test_loss: 1.1840, test_f1: 0.5889
 epoch: 37, train_loss: 0.5805, test_loss: 1.5415, test_f1: 0.5382
 epoch: 38, train_loss: 0.5648, test_loss: 1.4163, test_f1: 0.6036
 epoch: 39, train_loss: 0.5789, test_loss: 1.1999, test_f1: 0.5841
 epoch: 40, train_loss: 0.5618, test_loss: 1.3351, test_f1: 0.5011
 epoch: 41, train_loss: 0.5732, test_loss: 1.7216, test_f1: 0.5678
 epoch: 42, train_loss: 0.5380, test_loss: 1.5892, test_f1: 0.5237
 epoch: 43, train_loss: 0.5742, test_loss: 1.2031, test_f1: 0.6164
 epoch: 44, train_loss: 0.5265, test_loss: 1.0717, test_f1: 0.6261
 epoch: 45, train_loss: 0.5309, test_loss: 1.4573, test_f1: 0.6261
 epoch: 46, train_loss: 0.5013, test_loss: 1.7713, test_f1: 0.5460
 epoch: 47, train_loss: 0.5063, test_loss: 1.4319, test_f1: 0.5548
 epoch: 48, train_loss: 0.5028, test_loss: 1.5082, test_f1: 0.5919
 epoch: 49, train_loss: 0.5093, test_loss: 1.5419, test_f1: 0.5779
 epoch: 50, train_loss: 0.4723, test_loss: 1.9123, test_f1: 0.5081
 epoch: 51, train_loss: 0.4497, test_loss: 1.5203, test_f1: 0.5723
 epoch: 52, train_loss: 0.4056, test_loss: 1.7423, test_f1: 0.5566
 epoch: 53, train_loss: 0.3935, test_loss: 1.7590, test_f1: 0.5764
 epoch: 54, train_loss: 0.3840, test_loss: 1.6970, test_f1: 0.5819
 epoch: 55, train_loss: 0.3785, test_loss: 1.6254, test_f1: 0.6043
 epoch: 56, train_loss: 0.4118, test_loss: 2.0201, test_f1: 0.5362
 epoch: 57, train_loss: 0.3958, test_loss: 1.6200, test_f1: 0.5885
 epoch: 58, train_loss: 0.3673, test_loss: 1.8552, test_f1: 0.6260
 epoch: 59, train_loss: 0.3744, test_loss: 1.9261, test_f1: 0.6018
 epoch: 60, train_loss: 0.3649, test_loss: 2.0817, test_f1: 0.5758
 epoch: 61, train_loss: 0.3436, test_loss: 1.9325, test_f1: 0.6085
 epoch: 62, train_loss: 0.3283, test_loss: 1.7132, test_f1: 0.6476
 epoch: 63, train_loss: 0.3087, test_loss: 1.9656, test_f1: 0.5842
 epoch: 64, train_loss: 0.3428, test_loss: 1.9860, test_f1: 0.5993
 epoch: 65, train_loss: 0.2976, test_loss: 2.3098, test_f1: 0.5127
 epoch: 66, train_loss: 0.3484, test_loss: 1.6203, test_f1: 0.6331
 epoch: 67, train_loss: 0.3742, test_loss: 1.7800, test_f1: 0.5820
 epoch: 68, train_loss: 0.3458, test_loss: 1.8045, test_f1: 0.6315
 epoch: 69, train_loss: 0.3087, test_loss: 2.1360, test_f1: 0.5824
 epoch: 70, train_loss: 0.3110, test_loss: 1.8999, test_f1: 0.5799
 epoch: 71, train_loss: 0.3555, test_loss: 2.1897, test_f1: 0.5183
 epoch: 72, train_loss: 0.3855, test_loss: 1.7294, test_f1: 0.6102
 epoch: 73, train_loss: 0.3502, test_loss: 2.0027, test_f1: 0.5885
 epoch: 74, train_loss: 0.3216, test_loss: 1.5530, test_f1: 0.6445
 epoch: 75, train_loss: 0.2785, test_loss: 1.6390, test_f1: 0.6462
 epoch: 76, train_loss: 0.2966, test_loss: 2.5771, test_f1: 0.5249
 epoch: 77, train_loss: 0.2848, test_loss: 1.7653, test_f1: 0.5992
 epoch: 78, train_loss: 0.2894, test_loss: 2.9513, test_f1: 0.5142
 epoch: 79, train_loss: 0.3090, test_loss: 1.8876, test_f1: 0.6277
 epoch: 80, train_loss: 0.2633, test_loss: 2.2768, test_f1: 0.6171
 epoch: 81, train_loss: 0.2694, test_loss: 2.3235, test_f1: 0.5028
 epoch: 82, train_loss: 0.2944, test_loss: 2.1163, test_f1: 0.6146
 epoch: 83, train_loss: 0.2519, test_loss: 2.3990, test_f1: 0.5189
 epoch: 84, train_loss: 0.2533, test_loss: 2.2095, test_f1: 0.5642
 epoch: 85, train_loss: 0.2784, test_loss: 2.5573, test_f1: 0.5429
 epoch: 86, train_loss: 0.2449, test_loss: 2.2621, test_f1: 0.6118
 epoch: 87, train_loss: 0.2436, test_loss: 2.6803, test_f1: 0.5523
 epoch: 88, train_loss: 0.2461, test_loss: 3.2603, test_f1: 0.5613
 epoch: 89, train_loss: 0.2239, test_loss: 2.3484, test_f1: 0.6078
 epoch: 90, train_loss: 0.2328, test_loss: 2.2983, test_f1: 0.6157
 epoch: 91, train_loss: 0.2523, test_loss: 2.3073, test_f1: 0.6084
 epoch: 92, train_loss: 0.2998, test_loss: 2.4159, test_f1: 0.5464
 epoch: 93, train_loss: 0.2931, test_loss: 1.9501, test_f1: 0.5811
 epoch: 94, train_loss: 0.2668, test_loss: 1.9250, test_f1: 0.5856
 epoch: 95, train_loss: 0.2556, test_loss: 2.3656, test_f1: 0.5350
 epoch: 96, train_loss: 0.2720, test_loss: 2.1549, test_f1: 0.5746
 epoch: 97, train_loss: 0.2852, test_loss: 1.9748, test_f1: 0.6439
 epoch: 98, train_loss: 0.2609, test_loss: 2.1821, test_f1: 0.5193
 epoch: 99, train_loss: 0.2322, test_loss: 2.2760, test_f1: 0.5874

Training completed in 404.88 seconds
Best F1: 0.6582 at epoch 54
Mean F1 across iterations: 0.6438  0.0098
========================FINAL RESULTS================================
FEGIN weighted F1: 0.6582  0.0098
python main.py --data ltspice_demos --representation component_pin_net --model FEGIN --layers 6 --hiddens 128 --batch_size 128 --lr 0.01 --emb_size 250 --epochs 100 --save_appendix component_pin_net_L6_H128_BS128_LR0.01_E250 --no_val
-----



STDERR:
  File "main.py", line 370, in <module>
    main()
  File "main.py", line 254, in main
    dataset = dataset_class(
  File "/home/philip/projects/ltspice_examples_code_repo/Circuit-Completion-Using-GNNs/component_classification_with_link_prediction_head/evaluation/FEGIN/kernel/circuit_datasets.py", line 15, in __init__
    self.data, self.slices = torch.load(self.processed_paths[0])
  File "/home/philip/.local/lib/python3.8/site-packages/torch/serialization.py", line 1040, in load
    warnings.warn(
  File "/usr/lib/python3.8/warnings.py", line 109, in _showwarnmsg
    sw(msg.message, msg.category, msg.filename, msg.lineno,
  File "main.py", line 47, in warn_with_traceback
    traceback.print_stack(file=log)
/home/philip/projects/ltspice_examples_code_repo/Circuit-Completion-Using-GNNs/component_classification_with_link_prediction_head/evaluation/FEGIN/kernel/circuit_datasets.py:15: FutureWarning: You are using `torch.load` with `weights_only=False` (the current default value), which uses the default pickle module implicitly. It is possible to construct malicious pickle data which will execute arbitrary code during unpickling (See https://github.com/pytorch/pytorch/blob/main/SECURITY.md#untrusted-models for more details). In a future release, the default value for `weights_only` will be flipped to `True`. This limits the functions that could be executed during unpickling. Arbitrary objects will no longer be allowed to be loaded via this mode unless they are explicitly allowlisted by the user via `torch.serialization.add_safe_globals`. We recommend you start setting `weights_only=True` for any use case where you don't have full control of the loaded file. Please open an issue on GitHub for any issues related to this experimental feature.
  self.data, self.slices = torch.load(self.processed_paths[0])
