STDOUT:
Results will be saved in /home/philip/projects/ltspice_examples_code_repo/Circuit-Completion-Using-GNNs/component_classification_with_link_prediction_head/evaluation/FEGIN/results/model_FEGIN_dataset_ltspice_examples
Command line input: python main.py --data ltspice_examples --representation component_pin --model FEGIN --layers 3 --hiddens 16 --batch_size 256 --lr 0.1 --emb_size 128 --epochs 100 --save_appendix component_pin_L3_H16_BS256_LR0.1_E128 --no_val
 is saved.
-----
ltspice_examples - FEGIN
Using 3 layers, 16 hidden units, h = 2
Loading component_pin representation dataset
ENTERED
Training FEGIN on component_pin representation
Train: 3560, Test: 848
##################ITERATION #0 ****************************************
 epoch: 0, train_loss: 1.2703, test_loss: 1.1818, test_f1: 0.3686
 epoch: 1, train_loss: 1.0855, test_loss: 1.4269, test_f1: 0.3907
 epoch: 2, train_loss: 1.0503, test_loss: 1.0694, test_f1: 0.4146
 epoch: 3, train_loss: 1.0507, test_loss: 1.0841, test_f1: 0.3618
 epoch: 4, train_loss: 1.0434, test_loss: 1.4292, test_f1: 0.3016
 epoch: 5, train_loss: 1.0390, test_loss: 1.0187, test_f1: 0.4356
 epoch: 6, train_loss: 1.0174, test_loss: 0.9912, test_f1: 0.4462
 epoch: 7, train_loss: 1.0007, test_loss: 0.9524, test_f1: 0.4592
 epoch: 8, train_loss: 0.9853, test_loss: 1.0085, test_f1: 0.5143
 epoch: 9, train_loss: 0.9970, test_loss: 1.0480, test_f1: 0.4420
 epoch: 10, train_loss: 0.9885, test_loss: 1.0467, test_f1: 0.4262
 epoch: 11, train_loss: 0.9719, test_loss: 1.0480, test_f1: 0.4474
 epoch: 12, train_loss: 0.9676, test_loss: 0.9995, test_f1: 0.4503
 epoch: 13, train_loss: 0.9705, test_loss: 1.1040, test_f1: 0.4597
 epoch: 14, train_loss: 0.9777, test_loss: 1.3093, test_f1: 0.4187
 epoch: 15, train_loss: 0.9730, test_loss: 0.8870, test_f1: 0.5108
 epoch: 16, train_loss: 0.9879, test_loss: 0.9564, test_f1: 0.4583
 epoch: 17, train_loss: 0.9672, test_loss: 1.0155, test_f1: 0.4540
 epoch: 18, train_loss: 0.9529, test_loss: 0.8950, test_f1: 0.4773
 epoch: 19, train_loss: 0.9360, test_loss: 0.8765, test_f1: 0.4838
 epoch: 20, train_loss: 0.9801, test_loss: 0.9810, test_f1: 0.4114
 epoch: 21, train_loss: 0.9848, test_loss: 1.0534, test_f1: 0.4677
 epoch: 22, train_loss: 0.9411, test_loss: 1.2691, test_f1: 0.4712
 epoch: 23, train_loss: 0.9296, test_loss: 1.0369, test_f1: 0.4415
 epoch: 24, train_loss: 0.9244, test_loss: 0.9262, test_f1: 0.4499
 epoch: 25, train_loss: 0.9245, test_loss: 1.0065, test_f1: 0.4499
 epoch: 26, train_loss: 0.9119, test_loss: 0.8904, test_f1: 0.4823
 epoch: 27, train_loss: 0.9204, test_loss: 1.5204, test_f1: 0.4023
 epoch: 28, train_loss: 0.9125, test_loss: 0.9426, test_f1: 0.4431
 epoch: 29, train_loss: 0.8939, test_loss: 0.9764, test_f1: 0.4576
 epoch: 30, train_loss: 0.9384, test_loss: 0.9482, test_f1: 0.4666
 epoch: 31, train_loss: 0.9109, test_loss: 0.9246, test_f1: 0.4788
 epoch: 32, train_loss: 0.9110, test_loss: 0.9166, test_f1: 0.4969
 epoch: 33, train_loss: 0.9024, test_loss: 0.9630, test_f1: 0.4808
 epoch: 34, train_loss: 0.9030, test_loss: 0.8472, test_f1: 0.5078
 epoch: 35, train_loss: 0.8971, test_loss: 1.1485, test_f1: 0.4710
 epoch: 36, train_loss: 0.8806, test_loss: 0.8871, test_f1: 0.4506
 epoch: 37, train_loss: 0.8955, test_loss: 0.8501, test_f1: 0.5172
 epoch: 38, train_loss: 0.9289, test_loss: 0.9423, test_f1: 0.4663
 epoch: 39, train_loss: 0.9311, test_loss: 0.9609, test_f1: 0.4657
 epoch: 40, train_loss: 0.9304, test_loss: 0.9352, test_f1: 0.4651
 epoch: 41, train_loss: 0.9041, test_loss: 0.9256, test_f1: 0.5004
 epoch: 42, train_loss: 0.8868, test_loss: 0.9599, test_f1: 0.5216
 epoch: 43, train_loss: 0.9035, test_loss: 0.8902, test_f1: 0.5010
 epoch: 44, train_loss: 0.9010, test_loss: 1.2529, test_f1: 0.4312
 epoch: 45, train_loss: 0.8944, test_loss: 0.9968, test_f1: 0.4951
 epoch: 46, train_loss: 0.8712, test_loss: 0.8825, test_f1: 0.4470
 epoch: 47, train_loss: 0.8720, test_loss: 1.0106, test_f1: 0.4561
 epoch: 48, train_loss: 0.8696, test_loss: 0.8860, test_f1: 0.5184
 epoch: 49, train_loss: 0.8888, test_loss: 0.8922, test_f1: 0.5010
 epoch: 50, train_loss: 0.9263, test_loss: 1.3117, test_f1: 0.3597
 epoch: 51, train_loss: 0.9347, test_loss: 1.6502, test_f1: 0.4455
 epoch: 52, train_loss: 0.9134, test_loss: 1.0104, test_f1: 0.4868
 epoch: 53, train_loss: 0.8788, test_loss: 0.8374, test_f1: 0.4922
 epoch: 54, train_loss: 0.8659, test_loss: 0.8767, test_f1: 0.4965
 epoch: 55, train_loss: 0.8781, test_loss: 0.8473, test_f1: 0.4919
 epoch: 56, train_loss: 0.8678, test_loss: 0.8682, test_f1: 0.4972
 epoch: 57, train_loss: 0.8810, test_loss: 0.9292, test_f1: 0.4598
 epoch: 58, train_loss: 0.8815, test_loss: 0.8611, test_f1: 0.5063
 epoch: 59, train_loss: 0.8864, test_loss: 0.8455, test_f1: 0.5209
 epoch: 60, train_loss: 0.8864, test_loss: 0.8746, test_f1: 0.4988
 epoch: 61, train_loss: 0.8770, test_loss: 0.8554, test_f1: 0.4964
 epoch: 62, train_loss: 0.8574, test_loss: 0.8690, test_f1: 0.5163
 epoch: 63, train_loss: 0.8433, test_loss: 0.9461, test_f1: 0.5096
 epoch: 64, train_loss: 0.8404, test_loss: 0.9734, test_f1: 0.4850
 epoch: 65, train_loss: 0.8462, test_loss: 0.8434, test_f1: 0.5028
 epoch: 66, train_loss: 0.8272, test_loss: 0.8644, test_f1: 0.4885
 epoch: 67, train_loss: 0.8461, test_loss: 1.1970, test_f1: 0.4770
 epoch: 68, train_loss: 0.8400, test_loss: 0.8241, test_f1: 0.5209
 epoch: 69, train_loss: 0.8330, test_loss: 0.8284, test_f1: 0.5067
 epoch: 70, train_loss: 0.8556, test_loss: 0.9049, test_f1: 0.4892
 epoch: 71, train_loss: 0.8589, test_loss: 1.1175, test_f1: 0.4850
 epoch: 72, train_loss: 0.8495, test_loss: 0.8269, test_f1: 0.5143
 epoch: 73, train_loss: 0.8504, test_loss: 0.8293, test_f1: 0.5091
 epoch: 74, train_loss: 0.8452, test_loss: 0.8059, test_f1: 0.5197
 epoch: 75, train_loss: 0.8423, test_loss: 0.8429, test_f1: 0.5070
 epoch: 76, train_loss: 0.8308, test_loss: 0.8349, test_f1: 0.5248
 epoch: 77, train_loss: 0.8383, test_loss: 0.8290, test_f1: 0.5232
 epoch: 78, train_loss: 0.8435, test_loss: 1.0642, test_f1: 0.4875
 epoch: 79, train_loss: 0.8341, test_loss: 0.8805, test_f1: 0.5064
 epoch: 80, train_loss: 0.8336, test_loss: 0.8046, test_f1: 0.5244
 epoch: 81, train_loss: 0.8340, test_loss: 0.8262, test_f1: 0.4994
 epoch: 82, train_loss: 0.8441, test_loss: 0.7910, test_f1: 0.5398
 epoch: 83, train_loss: 0.8381, test_loss: 0.7870, test_f1: 0.5326
 epoch: 84, train_loss: 0.8367, test_loss: 0.9104, test_f1: 0.4850
 epoch: 85, train_loss: 0.8477, test_loss: 0.8473, test_f1: 0.5117
 epoch: 86, train_loss: 0.8327, test_loss: 1.0643, test_f1: 0.4790
 epoch: 87, train_loss: 0.8355, test_loss: 0.8368, test_f1: 0.5015
 epoch: 88, train_loss: 0.8292, test_loss: 0.9115, test_f1: 0.5169
 epoch: 89, train_loss: 0.8258, test_loss: 0.8747, test_f1: 0.4816
 epoch: 90, train_loss: 0.8143, test_loss: 0.8199, test_f1: 0.5096
 epoch: 91, train_loss: 0.8387, test_loss: 0.7994, test_f1: 0.5460
 epoch: 92, train_loss: 0.8244, test_loss: 0.7881, test_f1: 0.5332
 epoch: 93, train_loss: 0.8413, test_loss: 0.8048, test_f1: 0.5442
 epoch: 94, train_loss: 0.8382, test_loss: 0.8455, test_f1: 0.5203
 epoch: 95, train_loss: 0.8625, test_loss: 1.3212, test_f1: 0.4678
 epoch: 96, train_loss: 0.9062, test_loss: 0.9012, test_f1: 0.5004
 epoch: 97, train_loss: 0.8817, test_loss: 0.8199, test_f1: 0.5849
 epoch: 98, train_loss: 0.8401, test_loss: 0.8115, test_f1: 0.5239
 epoch: 99, train_loss: 0.8416, test_loss: 0.8079, test_f1: 0.5295
##################ITERATION #1 ****************************************
 epoch: 0, train_loss: 1.3582, test_loss: 1.3185, test_f1: 0.2260
 epoch: 1, train_loss: 1.3054, test_loss: 1.3145, test_f1: 0.2260
 epoch: 2, train_loss: 1.3012, test_loss: 1.3162, test_f1: 0.2260
 epoch: 3, train_loss: 1.3024, test_loss: 1.3149, test_f1: 0.2260
 epoch: 4, train_loss: 1.3026, test_loss: 1.3165, test_f1: 0.2260
 epoch: 5, train_loss: 1.3024, test_loss: 1.3155, test_f1: 0.2260
 epoch: 6, train_loss: 1.3017, test_loss: 1.3154, test_f1: 0.2260
 epoch: 7, train_loss: 1.3022, test_loss: 1.3157, test_f1: 0.2260
 epoch: 8, train_loss: 1.3020, test_loss: 1.3147, test_f1: 0.2260
 epoch: 9, train_loss: 1.3018, test_loss: 1.3156, test_f1: 0.2260
 epoch: 10, train_loss: 1.3018, test_loss: 1.3151, test_f1: 0.2260
 epoch: 11, train_loss: 1.3025, test_loss: 1.3151, test_f1: 0.2260
 epoch: 12, train_loss: 1.3025, test_loss: 1.3152, test_f1: 0.2260
 epoch: 13, train_loss: 1.3023, test_loss: 1.3153, test_f1: 0.2260
 epoch: 14, train_loss: 1.3018, test_loss: 1.3164, test_f1: 0.2260
 epoch: 15, train_loss: 1.3016, test_loss: 1.3143, test_f1: 0.2260
 epoch: 16, train_loss: 1.3019, test_loss: 1.3150, test_f1: 0.2260
 epoch: 17, train_loss: 1.3020, test_loss: 1.3151, test_f1: 0.2260
 epoch: 18, train_loss: 1.3030, test_loss: 1.3144, test_f1: 0.2260
 epoch: 19, train_loss: 1.3027, test_loss: 1.3159, test_f1: 0.2260
 epoch: 20, train_loss: 1.3021, test_loss: 1.3152, test_f1: 0.2260
 epoch: 21, train_loss: 1.3018, test_loss: 1.3151, test_f1: 0.2260
 epoch: 22, train_loss: 1.3032, test_loss: 1.3159, test_f1: 0.2260
 epoch: 23, train_loss: 1.3025, test_loss: 1.3155, test_f1: 0.2260
 epoch: 24, train_loss: 1.3017, test_loss: 1.3147, test_f1: 0.2260
 epoch: 25, train_loss: 1.3021, test_loss: 1.3151, test_f1: 0.2260
 epoch: 26, train_loss: 1.3018, test_loss: 1.3151, test_f1: 0.2260
 epoch: 27, train_loss: 1.3028, test_loss: 1.3146, test_f1: 0.2260
 epoch: 28, train_loss: 1.3024, test_loss: 1.3160, test_f1: 0.2260
 epoch: 29, train_loss: 1.3023, test_loss: 1.3150, test_f1: 0.2260
 epoch: 30, train_loss: 1.3020, test_loss: 1.3153, test_f1: 0.2260
 epoch: 31, train_loss: 1.3018, test_loss: 1.3157, test_f1: 0.2260
 epoch: 32, train_loss: 1.3019, test_loss: 1.3154, test_f1: 0.2260
 epoch: 33, train_loss: 1.3026, test_loss: 1.3147, test_f1: 0.2260
 epoch: 34, train_loss: 1.3019, test_loss: 1.3155, test_f1: 0.2260
 epoch: 35, train_loss: 1.3017, test_loss: 1.3148, test_f1: 0.2260
 epoch: 36, train_loss: 1.3016, test_loss: 1.3163, test_f1: 0.2260
 epoch: 37, train_loss: 1.3026, test_loss: 1.3170, test_f1: 0.2260
 epoch: 38, train_loss: 1.3028, test_loss: 1.3149, test_f1: 0.2260
 epoch: 39, train_loss: 1.3019, test_loss: 1.3154, test_f1: 0.2260
 epoch: 40, train_loss: 1.3026, test_loss: 1.3143, test_f1: 0.2260
 epoch: 41, train_loss: 1.3023, test_loss: 1.3155, test_f1: 0.2260
 epoch: 42, train_loss: 1.3020, test_loss: 1.3151, test_f1: 0.2260
 epoch: 43, train_loss: 1.3020, test_loss: 1.3163, test_f1: 0.2260
 epoch: 44, train_loss: 1.3018, test_loss: 1.3151, test_f1: 0.2260
 epoch: 45, train_loss: 1.3023, test_loss: 1.3163, test_f1: 0.2260
 epoch: 46, train_loss: 1.3020, test_loss: 1.3151, test_f1: 0.2260
 epoch: 47, train_loss: 1.3016, test_loss: 1.3162, test_f1: 0.2260
 epoch: 48, train_loss: 1.3023, test_loss: 1.3153, test_f1: 0.2260
 epoch: 49, train_loss: 1.3019, test_loss: 1.3158, test_f1: 0.2260
 epoch: 50, train_loss: 1.3018, test_loss: 1.3147, test_f1: 0.2260
 epoch: 51, train_loss: 1.3015, test_loss: 1.3150, test_f1: 0.2260
 epoch: 52, train_loss: 1.3016, test_loss: 1.3146, test_f1: 0.2260
 epoch: 53, train_loss: 1.3015, test_loss: 1.3161, test_f1: 0.2260
 epoch: 54, train_loss: 1.3017, test_loss: 1.3151, test_f1: 0.2260
 epoch: 55, train_loss: 1.3016, test_loss: 1.3151, test_f1: 0.2260
 epoch: 56, train_loss: 1.3015, test_loss: 1.3151, test_f1: 0.2260
 epoch: 57, train_loss: 1.3016, test_loss: 1.3160, test_f1: 0.2260
 epoch: 58, train_loss: 1.3017, test_loss: 1.3150, test_f1: 0.2260
 epoch: 59, train_loss: 1.3018, test_loss: 1.3147, test_f1: 0.2260
 epoch: 60, train_loss: 1.3018, test_loss: 1.3159, test_f1: 0.2260
 epoch: 61, train_loss: 1.3017, test_loss: 1.3149, test_f1: 0.2260
 epoch: 62, train_loss: 1.3014, test_loss: 1.3155, test_f1: 0.2260
 epoch: 63, train_loss: 1.3023, test_loss: 1.3157, test_f1: 0.2260
 epoch: 64, train_loss: 1.3017, test_loss: 1.3144, test_f1: 0.2260
 epoch: 65, train_loss: 1.3017, test_loss: 1.3167, test_f1: 0.2260
 epoch: 66, train_loss: 1.3016, test_loss: 1.3149, test_f1: 0.2260
 epoch: 67, train_loss: 1.3015, test_loss: 1.3154, test_f1: 0.2260
 epoch: 68, train_loss: 1.3017, test_loss: 1.3145, test_f1: 0.2260
 epoch: 69, train_loss: 1.3021, test_loss: 1.3155, test_f1: 0.2260
 epoch: 70, train_loss: 1.3025, test_loss: 1.3155, test_f1: 0.2260
 epoch: 71, train_loss: 1.3016, test_loss: 1.3145, test_f1: 0.2260
 epoch: 72, train_loss: 1.3018, test_loss: 1.3156, test_f1: 0.2260
 epoch: 73, train_loss: 1.3016, test_loss: 1.3151, test_f1: 0.2260
 epoch: 74, train_loss: 1.3016, test_loss: 1.3151, test_f1: 0.2260
 epoch: 75, train_loss: 1.3014, test_loss: 1.3153, test_f1: 0.2260
 epoch: 76, train_loss: 1.3017, test_loss: 1.3164, test_f1: 0.2260
 epoch: 77, train_loss: 1.3020, test_loss: 1.3146, test_f1: 0.2260
 epoch: 78, train_loss: 1.3018, test_loss: 1.3149, test_f1: 0.2260
 epoch: 79, train_loss: 1.3018, test_loss: 1.3160, test_f1: 0.2260
 epoch: 80, train_loss: 1.3018, test_loss: 1.3143, test_f1: 0.2260
 epoch: 81, train_loss: 1.3013, test_loss: 1.3160, test_f1: 0.2260
 epoch: 82, train_loss: 1.3018, test_loss: 1.3152, test_f1: 0.2260
 epoch: 83, train_loss: 1.3018, test_loss: 1.3145, test_f1: 0.2260
 epoch: 84, train_loss: 1.3018, test_loss: 1.3163, test_f1: 0.2260
 epoch: 85, train_loss: 1.3014, test_loss: 1.3153, test_f1: 0.2260
 epoch: 86, train_loss: 1.3019, test_loss: 1.3154, test_f1: 0.2260
 epoch: 87, train_loss: 1.3020, test_loss: 1.3144, test_f1: 0.2260
 epoch: 88, train_loss: 1.3021, test_loss: 1.3163, test_f1: 0.2260
 epoch: 89, train_loss: 1.3024, test_loss: 1.3152, test_f1: 0.2260
 epoch: 90, train_loss: 1.3015, test_loss: 1.3167, test_f1: 0.2260
 epoch: 91, train_loss: 1.3016, test_loss: 1.3147, test_f1: 0.2260
 epoch: 92, train_loss: 1.3015, test_loss: 1.3149, test_f1: 0.2260
 epoch: 93, train_loss: 1.3019, test_loss: 1.3165, test_f1: 0.2260
 epoch: 94, train_loss: 1.3018, test_loss: 1.3143, test_f1: 0.2260
 epoch: 95, train_loss: 1.3015, test_loss: 1.3161, test_f1: 0.2260
 epoch: 96, train_loss: 1.3017, test_loss: 1.3149, test_f1: 0.2260
 epoch: 97, train_loss: 1.3015, test_loss: 1.3153, test_f1: 0.2260
 epoch: 98, train_loss: 1.3017, test_loss: 1.3155, test_f1: 0.2260
 epoch: 99, train_loss: 1.3017, test_loss: 1.3151, test_f1: 0.2260
##################ITERATION #2 ****************************************
 epoch: 0, train_loss: 1.3131, test_loss: 1.3181, test_f1: 0.2260
 epoch: 1, train_loss: 1.3024, test_loss: 1.3136, test_f1: 0.2260
 epoch: 2, train_loss: 1.3033, test_loss: 1.3181, test_f1: 0.2260
 epoch: 3, train_loss: 1.3025, test_loss: 1.3144, test_f1: 0.2260
 epoch: 4, train_loss: 1.3014, test_loss: 1.3168, test_f1: 0.2260
 epoch: 5, train_loss: 1.3018, test_loss: 1.3151, test_f1: 0.2260
 epoch: 6, train_loss: 1.3019, test_loss: 1.3138, test_f1: 0.2260
 epoch: 7, train_loss: 1.3021, test_loss: 1.3164, test_f1: 0.2260
 epoch: 8, train_loss: 1.3025, test_loss: 1.3154, test_f1: 0.2260
 epoch: 9, train_loss: 1.3018, test_loss: 1.3147, test_f1: 0.2260
 epoch: 10, train_loss: 1.3031, test_loss: 1.3146, test_f1: 0.2260
 epoch: 11, train_loss: 1.3018, test_loss: 1.3162, test_f1: 0.2260
 epoch: 12, train_loss: 1.3023, test_loss: 1.3146, test_f1: 0.2260
 epoch: 13, train_loss: 1.3017, test_loss: 1.3153, test_f1: 0.2260
 epoch: 14, train_loss: 1.3026, test_loss: 1.3151, test_f1: 0.2260
 epoch: 15, train_loss: 1.3036, test_loss: 1.3157, test_f1: 0.2260
 epoch: 16, train_loss: 1.3045, test_loss: 1.3141, test_f1: 0.2260
 epoch: 17, train_loss: 1.3039, test_loss: 1.3173, test_f1: 0.2260
 epoch: 18, train_loss: 1.3031, test_loss: 1.3144, test_f1: 0.2260
 epoch: 19, train_loss: 1.3037, test_loss: 1.3159, test_f1: 0.2260
 epoch: 20, train_loss: 1.3032, test_loss: 1.3149, test_f1: 0.2260
 epoch: 21, train_loss: 1.3017, test_loss: 1.3149, test_f1: 0.2260
 epoch: 22, train_loss: 1.3022, test_loss: 1.3156, test_f1: 0.2260
 epoch: 23, train_loss: 1.3024, test_loss: 1.3145, test_f1: 0.2260
 epoch: 24, train_loss: 1.3029, test_loss: 1.3163, test_f1: 0.2260
 epoch: 25, train_loss: 1.3024, test_loss: 1.3154, test_f1: 0.2260
 epoch: 26, train_loss: 1.3020, test_loss: 1.3146, test_f1: 0.2260
 epoch: 27, train_loss: 1.3023, test_loss: 1.3153, test_f1: 0.2260
 epoch: 28, train_loss: 1.3019, test_loss: 1.3150, test_f1: 0.2260
 epoch: 29, train_loss: 1.3023, test_loss: 1.3148, test_f1: 0.2260
 epoch: 30, train_loss: 1.3022, test_loss: 1.3165, test_f1: 0.2260
 epoch: 31, train_loss: 1.3035, test_loss: 1.3154, test_f1: 0.2260
 epoch: 32, train_loss: 1.3023, test_loss: 1.3143, test_f1: 0.2260
 epoch: 33, train_loss: 1.3025, test_loss: 1.3153, test_f1: 0.2260
 epoch: 34, train_loss: 1.3019, test_loss: 1.3147, test_f1: 0.2260
 epoch: 35, train_loss: 1.3026, test_loss: 1.3147, test_f1: 0.2260
 epoch: 36, train_loss: 1.3023, test_loss: 1.3150, test_f1: 0.2260
 epoch: 37, train_loss: 1.3018, test_loss: 1.3159, test_f1: 0.2260
 epoch: 38, train_loss: 1.3021, test_loss: 1.3143, test_f1: 0.2260
 epoch: 39, train_loss: 1.3030, test_loss: 1.3157, test_f1: 0.2260
 epoch: 40, train_loss: 1.3020, test_loss: 1.3162, test_f1: 0.2260
 epoch: 41, train_loss: 1.3018, test_loss: 1.3151, test_f1: 0.2260
 epoch: 42, train_loss: 1.3021, test_loss: 1.3155, test_f1: 0.2260
 epoch: 43, train_loss: 1.3027, test_loss: 1.3148, test_f1: 0.2260
 epoch: 44, train_loss: 1.3021, test_loss: 1.3153, test_f1: 0.2260
 epoch: 45, train_loss: 1.3017, test_loss: 1.3162, test_f1: 0.2260
 epoch: 46, train_loss: 1.3023, test_loss: 1.3141, test_f1: 0.2260
 epoch: 47, train_loss: 1.3017, test_loss: 1.3161, test_f1: 0.2260
 epoch: 48, train_loss: 1.3023, test_loss: 1.3145, test_f1: 0.2260
 epoch: 49, train_loss: 1.3021, test_loss: 1.3146, test_f1: 0.2260
 epoch: 50, train_loss: 1.3025, test_loss: 1.3166, test_f1: 0.2260
 epoch: 51, train_loss: 1.3017, test_loss: 1.3148, test_f1: 0.2260
 epoch: 52, train_loss: 1.3016, test_loss: 1.3156, test_f1: 0.2260
 epoch: 53, train_loss: 1.3015, test_loss: 1.3153, test_f1: 0.2260
 epoch: 54, train_loss: 1.3016, test_loss: 1.3147, test_f1: 0.2260
 epoch: 55, train_loss: 1.3021, test_loss: 1.3159, test_f1: 0.2260
 epoch: 56, train_loss: 1.3018, test_loss: 1.3151, test_f1: 0.2260
 epoch: 57, train_loss: 1.3016, test_loss: 1.3162, test_f1: 0.2260
 epoch: 58, train_loss: 1.3016, test_loss: 1.3145, test_f1: 0.2260
 epoch: 59, train_loss: 1.3015, test_loss: 1.3158, test_f1: 0.2260
 epoch: 60, train_loss: 1.3021, test_loss: 1.3151, test_f1: 0.2260
 epoch: 61, train_loss: 1.3015, test_loss: 1.3157, test_f1: 0.2260
 epoch: 62, train_loss: 1.3020, test_loss: 1.3153, test_f1: 0.2260
 epoch: 63, train_loss: 1.3015, test_loss: 1.3149, test_f1: 0.2260
 epoch: 64, train_loss: 1.3023, test_loss: 1.3142, test_f1: 0.2260
 epoch: 65, train_loss: 1.3015, test_loss: 1.3166, test_f1: 0.2260
 epoch: 66, train_loss: 1.3020, test_loss: 1.3156, test_f1: 0.2260
 epoch: 67, train_loss: 1.3015, test_loss: 1.3145, test_f1: 0.2260
 epoch: 68, train_loss: 1.3016, test_loss: 1.3152, test_f1: 0.2260
 epoch: 69, train_loss: 1.3016, test_loss: 1.3157, test_f1: 0.2260
 epoch: 70, train_loss: 1.3017, test_loss: 1.3151, test_f1: 0.2260
 epoch: 71, train_loss: 1.3022, test_loss: 1.3143, test_f1: 0.2260
 epoch: 72, train_loss: 1.3020, test_loss: 1.3166, test_f1: 0.2260
 epoch: 73, train_loss: 1.3020, test_loss: 1.3150, test_f1: 0.2260
 epoch: 74, train_loss: 1.3018, test_loss: 1.3159, test_f1: 0.2260
 epoch: 75, train_loss: 1.3021, test_loss: 1.3145, test_f1: 0.2260
 epoch: 76, train_loss: 1.3016, test_loss: 1.3161, test_f1: 0.2260
 epoch: 77, train_loss: 1.3015, test_loss: 1.3153, test_f1: 0.2260
 epoch: 78, train_loss: 1.3016, test_loss: 1.3147, test_f1: 0.2260
 epoch: 79, train_loss: 1.3016, test_loss: 1.3147, test_f1: 0.2260
 epoch: 80, train_loss: 1.3014, test_loss: 1.3156, test_f1: 0.2260
 epoch: 81, train_loss: 1.3015, test_loss: 1.3151, test_f1: 0.2260
 epoch: 82, train_loss: 1.3017, test_loss: 1.3161, test_f1: 0.2260
 epoch: 83, train_loss: 1.3016, test_loss: 1.3148, test_f1: 0.2260
 epoch: 84, train_loss: 1.3020, test_loss: 1.3157, test_f1: 0.2260
 epoch: 85, train_loss: 1.3014, test_loss: 1.3152, test_f1: 0.2260
 epoch: 86, train_loss: 1.3018, test_loss: 1.3147, test_f1: 0.2260
 epoch: 87, train_loss: 1.3017, test_loss: 1.3148, test_f1: 0.2260
 epoch: 88, train_loss: 1.3017, test_loss: 1.3161, test_f1: 0.2260
 epoch: 89, train_loss: 1.3017, test_loss: 1.3154, test_f1: 0.2260
 epoch: 90, train_loss: 1.3020, test_loss: 1.3165, test_f1: 0.2260
 epoch: 91, train_loss: 1.3018, test_loss: 1.3147, test_f1: 0.2260
 epoch: 92, train_loss: 1.3017, test_loss: 1.3150, test_f1: 0.2260
 epoch: 93, train_loss: 1.3017, test_loss: 1.3152, test_f1: 0.2260
 epoch: 94, train_loss: 1.3016, test_loss: 1.3147, test_f1: 0.2260
 epoch: 95, train_loss: 1.3017, test_loss: 1.3160, test_f1: 0.2260
 epoch: 96, train_loss: 1.3027, test_loss: 1.3146, test_f1: 0.2260
 epoch: 97, train_loss: 1.3018, test_loss: 1.3159, test_f1: 0.2260
 epoch: 98, train_loss: 1.3013, test_loss: 1.3156, test_f1: 0.2260
 epoch: 99, train_loss: 1.3016, test_loss: 1.3149, test_f1: 0.2260
##################ITERATION #3 ****************************************
 epoch: 0, train_loss: 1.3079, test_loss: 1.3138, test_f1: 0.2260
 epoch: 1, train_loss: 1.3026, test_loss: 1.3171, test_f1: 0.2260
 epoch: 2, train_loss: 1.3018, test_loss: 1.3149, test_f1: 0.2260
 epoch: 3, train_loss: 1.3020, test_loss: 1.3161, test_f1: 0.2260
 epoch: 4, train_loss: 1.3019, test_loss: 1.3154, test_f1: 0.2260
 epoch: 5, train_loss: 1.3028, test_loss: 1.3140, test_f1: 0.2260
 epoch: 6, train_loss: 1.3021, test_loss: 1.3165, test_f1: 0.2260
 epoch: 7, train_loss: 1.3021, test_loss: 1.3149, test_f1: 0.2260
 epoch: 8, train_loss: 1.3027, test_loss: 1.3176, test_f1: 0.2260
 epoch: 9, train_loss: 1.3033, test_loss: 1.3140, test_f1: 0.2260
 epoch: 10, train_loss: 1.3025, test_loss: 1.3161, test_f1: 0.2260
 epoch: 11, train_loss: 1.3021, test_loss: 1.3157, test_f1: 0.2260
 epoch: 12, train_loss: 1.3030, test_loss: 1.3140, test_f1: 0.2260
 epoch: 13, train_loss: 1.3040, test_loss: 1.3163, test_f1: 0.2260
 epoch: 14, train_loss: 1.3035, test_loss: 1.3153, test_f1: 0.2260
 epoch: 15, train_loss: 1.3021, test_loss: 1.3164, test_f1: 0.2260
 epoch: 16, train_loss: 1.3017, test_loss: 1.3150, test_f1: 0.2260
 epoch: 17, train_loss: 1.3020, test_loss: 1.3155, test_f1: 0.2260
 epoch: 18, train_loss: 1.3021, test_loss: 1.3146, test_f1: 0.2260
 epoch: 19, train_loss: 1.3024, test_loss: 1.3168, test_f1: 0.2260
 epoch: 20, train_loss: 1.3020, test_loss: 1.3139, test_f1: 0.2260
 epoch: 21, train_loss: 1.3028, test_loss: 1.3165, test_f1: 0.2260
 epoch: 22, train_loss: 1.3029, test_loss: 1.3146, test_f1: 0.2260
 epoch: 23, train_loss: 1.3035, test_loss: 1.3159, test_f1: 0.2260
 epoch: 24, train_loss: 1.3025, test_loss: 1.3151, test_f1: 0.2260
 epoch: 25, train_loss: 1.3015, test_loss: 1.3149, test_f1: 0.2260
 epoch: 26, train_loss: 1.3020, test_loss: 1.3153, test_f1: 0.2260
 epoch: 27, train_loss: 1.3019, test_loss: 1.3150, test_f1: 0.2260
 epoch: 28, train_loss: 1.3014, test_loss: 1.3155, test_f1: 0.2260
 epoch: 29, train_loss: 1.3019, test_loss: 1.3151, test_f1: 0.2260
 epoch: 30, train_loss: 1.3038, test_loss: 1.3174, test_f1: 0.2260
 epoch: 31, train_loss: 1.3023, test_loss: 1.3157, test_f1: 0.2260
 epoch: 32, train_loss: 1.3023, test_loss: 1.3160, test_f1: 0.2260
 epoch: 33, train_loss: 1.3020, test_loss: 1.3156, test_f1: 0.2260
 epoch: 34, train_loss: 1.3022, test_loss: 1.3153, test_f1: 0.2260
 epoch: 35, train_loss: 1.3028, test_loss: 1.3147, test_f1: 0.2260
 epoch: 36, train_loss: 1.3020, test_loss: 1.3158, test_f1: 0.2260
 epoch: 37, train_loss: 1.3026, test_loss: 1.3157, test_f1: 0.2260
 epoch: 38, train_loss: 1.3019, test_loss: 1.3146, test_f1: 0.2260
 epoch: 39, train_loss: 1.3025, test_loss: 1.3158, test_f1: 0.2260
 epoch: 40, train_loss: 1.3022, test_loss: 1.3153, test_f1: 0.2260
 epoch: 41, train_loss: 1.3018, test_loss: 1.3158, test_f1: 0.2260
 epoch: 42, train_loss: 1.3025, test_loss: 1.3153, test_f1: 0.2260
 epoch: 43, train_loss: 1.3021, test_loss: 1.3148, test_f1: 0.2260
 epoch: 44, train_loss: 1.3016, test_loss: 1.3148, test_f1: 0.2260
 epoch: 45, train_loss: 1.3021, test_loss: 1.3148, test_f1: 0.2260
 epoch: 46, train_loss: 1.3019, test_loss: 1.3156, test_f1: 0.2260
 epoch: 47, train_loss: 1.3018, test_loss: 1.3156, test_f1: 0.2260
 epoch: 48, train_loss: 1.3020, test_loss: 1.3163, test_f1: 0.2260
 epoch: 49, train_loss: 1.3023, test_loss: 1.3162, test_f1: 0.2260
 epoch: 50, train_loss: 1.3021, test_loss: 1.3151, test_f1: 0.2260
 epoch: 51, train_loss: 1.3019, test_loss: 1.3142, test_f1: 0.2260
 epoch: 52, train_loss: 1.3016, test_loss: 1.3159, test_f1: 0.2260
 epoch: 53, train_loss: 1.3014, test_loss: 1.3161, test_f1: 0.2260
 epoch: 54, train_loss: 1.3017, test_loss: 1.3158, test_f1: 0.2260
 epoch: 55, train_loss: 1.3017, test_loss: 1.3141, test_f1: 0.2260
 epoch: 56, train_loss: 1.3017, test_loss: 1.3154, test_f1: 0.2260
 epoch: 57, train_loss: 1.3015, test_loss: 1.3151, test_f1: 0.2260
 epoch: 58, train_loss: 1.3015, test_loss: 1.3157, test_f1: 0.2260
 epoch: 59, train_loss: 1.3018, test_loss: 1.3150, test_f1: 0.2260
 epoch: 60, train_loss: 1.3017, test_loss: 1.3153, test_f1: 0.2260
 epoch: 61, train_loss: 1.3020, test_loss: 1.3144, test_f1: 0.2260
 epoch: 62, train_loss: 1.3017, test_loss: 1.3164, test_f1: 0.2260
 epoch: 63, train_loss: 1.3016, test_loss: 1.3147, test_f1: 0.2260
 epoch: 64, train_loss: 1.3016, test_loss: 1.3156, test_f1: 0.2260
 epoch: 65, train_loss: 1.3014, test_loss: 1.3155, test_f1: 0.2260
 epoch: 66, train_loss: 1.3014, test_loss: 1.3152, test_f1: 0.2260
 epoch: 67, train_loss: 1.3015, test_loss: 1.3149, test_f1: 0.2260
 epoch: 68, train_loss: 1.3016, test_loss: 1.3152, test_f1: 0.2260
 epoch: 69, train_loss: 1.3014, test_loss: 1.3156, test_f1: 0.2260
 epoch: 70, train_loss: 1.3016, test_loss: 1.3149, test_f1: 0.2260
 epoch: 71, train_loss: 1.3018, test_loss: 1.3146, test_f1: 0.2260
 epoch: 72, train_loss: 1.3018, test_loss: 1.3158, test_f1: 0.2260
 epoch: 73, train_loss: 1.3016, test_loss: 1.3152, test_f1: 0.2260
 epoch: 74, train_loss: 1.3017, test_loss: 1.3158, test_f1: 0.2260
 epoch: 75, train_loss: 1.3016, test_loss: 1.3147, test_f1: 0.2260
 epoch: 76, train_loss: 1.3017, test_loss: 1.3159, test_f1: 0.2260
 epoch: 77, train_loss: 1.3016, test_loss: 1.3147, test_f1: 0.2260
 epoch: 78, train_loss: 1.3015, test_loss: 1.3153, test_f1: 0.2260
 epoch: 79, train_loss: 1.3015, test_loss: 1.3153, test_f1: 0.2260
 epoch: 80, train_loss: 1.3016, test_loss: 1.3152, test_f1: 0.2260
 epoch: 81, train_loss: 1.3018, test_loss: 1.3151, test_f1: 0.2260
 epoch: 82, train_loss: 1.3016, test_loss: 1.3156, test_f1: 0.2260
 epoch: 83, train_loss: 1.3016, test_loss: 1.3151, test_f1: 0.2260
 epoch: 84, train_loss: 1.3017, test_loss: 1.3150, test_f1: 0.2260
 epoch: 85, train_loss: 1.3021, test_loss: 1.3159, test_f1: 0.2260
 epoch: 86, train_loss: 1.3018, test_loss: 1.3156, test_f1: 0.2260
 epoch: 87, train_loss: 1.3025, test_loss: 1.3146, test_f1: 0.2260
 epoch: 88, train_loss: 1.3020, test_loss: 1.3164, test_f1: 0.2260
 epoch: 89, train_loss: 1.3016, test_loss: 1.3147, test_f1: 0.2260
 epoch: 90, train_loss: 1.3015, test_loss: 1.3157, test_f1: 0.2260
 epoch: 91, train_loss: 1.3016, test_loss: 1.3152, test_f1: 0.2260
 epoch: 92, train_loss: 1.3014, test_loss: 1.3151, test_f1: 0.2260
 epoch: 93, train_loss: 1.3018, test_loss: 1.3149, test_f1: 0.2260
 epoch: 94, train_loss: 1.3022, test_loss: 1.3168, test_f1: 0.2260
 epoch: 95, train_loss: 1.3018, test_loss: 1.3140, test_f1: 0.2260
 epoch: 96, train_loss: 1.3017, test_loss: 1.3160, test_f1: 0.2260
 epoch: 97, train_loss: 1.3022, test_loss: 1.3159, test_f1: 0.2260
 epoch: 98, train_loss: 1.3017, test_loss: 1.3155, test_f1: 0.2260
 epoch: 99, train_loss: 1.3018, test_loss: 1.3151, test_f1: 0.2260
##################ITERATION #4 ****************************************
 epoch: 0, train_loss: 1.3054, test_loss: 1.3157, test_f1: 0.2260
 epoch: 1, train_loss: 1.3016, test_loss: 1.3153, test_f1: 0.2260
 epoch: 2, train_loss: 1.3015, test_loss: 1.3152, test_f1: 0.2260
 epoch: 3, train_loss: 1.3022, test_loss: 1.3154, test_f1: 0.2260
 epoch: 4, train_loss: 1.3032, test_loss: 1.3143, test_f1: 0.2260
 epoch: 5, train_loss: 1.3027, test_loss: 1.3159, test_f1: 0.2260
 epoch: 6, train_loss: 1.3023, test_loss: 1.3146, test_f1: 0.2260
 epoch: 7, train_loss: 1.3022, test_loss: 1.3158, test_f1: 0.2260
 epoch: 8, train_loss: 1.3024, test_loss: 1.3164, test_f1: 0.2260
 epoch: 9, train_loss: 1.3027, test_loss: 1.3157, test_f1: 0.2260
 epoch: 10, train_loss: 1.3019, test_loss: 1.3154, test_f1: 0.2260
 epoch: 11, train_loss: 1.3023, test_loss: 1.3145, test_f1: 0.2260
 epoch: 12, train_loss: 1.3027, test_loss: 1.3159, test_f1: 0.2260
 epoch: 13, train_loss: 1.3021, test_loss: 1.3138, test_f1: 0.2260
 epoch: 14, train_loss: 1.3018, test_loss: 1.3155, test_f1: 0.2260
 epoch: 15, train_loss: 1.3024, test_loss: 1.3144, test_f1: 0.2260
 epoch: 16, train_loss: 1.3023, test_loss: 1.3155, test_f1: 0.2260
 epoch: 17, train_loss: 1.3028, test_loss: 1.3163, test_f1: 0.2260
 epoch: 18, train_loss: 1.3023, test_loss: 1.3157, test_f1: 0.2260
 epoch: 19, train_loss: 1.3037, test_loss: 1.3146, test_f1: 0.2260
 epoch: 20, train_loss: 1.3038, test_loss: 1.3159, test_f1: 0.2260
 epoch: 21, train_loss: 1.3022, test_loss: 1.3144, test_f1: 0.2260
 epoch: 22, train_loss: 1.3020, test_loss: 1.3151, test_f1: 0.2260
 epoch: 23, train_loss: 1.3016, test_loss: 1.3158, test_f1: 0.2260
 epoch: 24, train_loss: 1.3022, test_loss: 1.3146, test_f1: 0.2260
 epoch: 25, train_loss: 1.3024, test_loss: 1.3146, test_f1: 0.2260
 epoch: 26, train_loss: 1.3023, test_loss: 1.3161, test_f1: 0.2260
 epoch: 27, train_loss: 1.3022, test_loss: 1.3144, test_f1: 0.2260
 epoch: 28, train_loss: 1.3026, test_loss: 1.3182, test_f1: 0.2260
 epoch: 29, train_loss: 1.3032, test_loss: 1.3146, test_f1: 0.2260
 epoch: 30, train_loss: 1.3017, test_loss: 1.3151, test_f1: 0.2260
 epoch: 31, train_loss: 1.3019, test_loss: 1.3155, test_f1: 0.2260
 epoch: 32, train_loss: 1.3030, test_loss: 1.3171, test_f1: 0.2260
 epoch: 33, train_loss: 1.3023, test_loss: 1.3153, test_f1: 0.2260
 epoch: 34, train_loss: 1.3029, test_loss: 1.3144, test_f1: 0.2260
 epoch: 35, train_loss: 1.3020, test_loss: 1.3172, test_f1: 0.2260
 epoch: 36, train_loss: 1.3017, test_loss: 1.3147, test_f1: 0.2260
 epoch: 37, train_loss: 1.3020, test_loss: 1.3170, test_f1: 0.2260
 epoch: 38, train_loss: 1.3034, test_loss: 1.3153, test_f1: 0.2260
 epoch: 39, train_loss: 1.3023, test_loss: 1.3160, test_f1: 0.2260
 epoch: 40, train_loss: 1.3019, test_loss: 1.3161, test_f1: 0.2260
 epoch: 41, train_loss: 1.3025, test_loss: 1.3150, test_f1: 0.2260
 epoch: 42, train_loss: 1.3020, test_loss: 1.3164, test_f1: 0.2260
 epoch: 43, train_loss: 1.3028, test_loss: 1.3145, test_f1: 0.2260
 epoch: 44, train_loss: 1.3021, test_loss: 1.3155, test_f1: 0.2260
 epoch: 45, train_loss: 1.3019, test_loss: 1.3158, test_f1: 0.2260
 epoch: 46, train_loss: 1.3018, test_loss: 1.3156, test_f1: 0.2260
 epoch: 47, train_loss: 1.3015, test_loss: 1.3158, test_f1: 0.2260
 epoch: 48, train_loss: 1.3018, test_loss: 1.3150, test_f1: 0.2260
 epoch: 49, train_loss: 1.3022, test_loss: 1.3144, test_f1: 0.2260
 epoch: 50, train_loss: 1.3024, test_loss: 1.3157, test_f1: 0.2260
 epoch: 51, train_loss: 1.3016, test_loss: 1.3150, test_f1: 0.2260
 epoch: 52, train_loss: 1.3019, test_loss: 1.3153, test_f1: 0.2260
 epoch: 53, train_loss: 1.3017, test_loss: 1.3155, test_f1: 0.2260
 epoch: 54, train_loss: 1.3019, test_loss: 1.3153, test_f1: 0.2260
 epoch: 55, train_loss: 1.3020, test_loss: 1.3149, test_f1: 0.2260
 epoch: 56, train_loss: 1.3019, test_loss: 1.3159, test_f1: 0.2260
 epoch: 57, train_loss: 1.3014, test_loss: 1.3150, test_f1: 0.2260
 epoch: 58, train_loss: 1.3018, test_loss: 1.3148, test_f1: 0.2260
 epoch: 59, train_loss: 1.3017, test_loss: 1.3154, test_f1: 0.2260
 epoch: 60, train_loss: 1.3016, test_loss: 1.3167, test_f1: 0.2260
 epoch: 61, train_loss: 1.3014, test_loss: 1.3148, test_f1: 0.2260
 epoch: 62, train_loss: 1.3017, test_loss: 1.3156, test_f1: 0.2260
 epoch: 63, train_loss: 1.3014, test_loss: 1.3148, test_f1: 0.2260
 epoch: 64, train_loss: 1.3016, test_loss: 1.3148, test_f1: 0.2260
 epoch: 65, train_loss: 1.3013, test_loss: 1.3155, test_f1: 0.2260
 epoch: 66, train_loss: 1.3016, test_loss: 1.3165, test_f1: 0.2260
 epoch: 67, train_loss: 1.3014, test_loss: 1.3151, test_f1: 0.2260
 epoch: 68, train_loss: 1.3019, test_loss: 1.3145, test_f1: 0.2260
 epoch: 69, train_loss: 1.3019, test_loss: 1.3157, test_f1: 0.2260
 epoch: 70, train_loss: 1.3017, test_loss: 1.3154, test_f1: 0.2260
 epoch: 71, train_loss: 1.3015, test_loss: 1.3146, test_f1: 0.2260
 epoch: 72, train_loss: 1.3022, test_loss: 1.3158, test_f1: 0.2260
 epoch: 73, train_loss: 1.3019, test_loss: 1.3149, test_f1: 0.2260
 epoch: 74, train_loss: 1.3019, test_loss: 1.3156, test_f1: 0.2260
 epoch: 75, train_loss: 1.3024, test_loss: 1.3146, test_f1: 0.2260
 epoch: 76, train_loss: 1.3022, test_loss: 1.3161, test_f1: 0.2260
 epoch: 77, train_loss: 1.3016, test_loss: 1.3142, test_f1: 0.2260
 epoch: 78, train_loss: 1.3015, test_loss: 1.3158, test_f1: 0.2260
 epoch: 79, train_loss: 1.3016, test_loss: 1.3155, test_f1: 0.2260
 epoch: 80, train_loss: 1.3015, test_loss: 1.3153, test_f1: 0.2260
 epoch: 81, train_loss: 1.3015, test_loss: 1.3154, test_f1: 0.2260
 epoch: 82, train_loss: 1.3022, test_loss: 1.3143, test_f1: 0.2260
 epoch: 83, train_loss: 1.3018, test_loss: 1.3160, test_f1: 0.2260
 epoch: 84, train_loss: 1.3017, test_loss: 1.3150, test_f1: 0.2260
 epoch: 85, train_loss: 1.3016, test_loss: 1.3160, test_f1: 0.2260
 epoch: 86, train_loss: 1.3016, test_loss: 1.3163, test_f1: 0.2260
 epoch: 87, train_loss: 1.3016, test_loss: 1.3149, test_f1: 0.2260
 epoch: 88, train_loss: 1.3023, test_loss: 1.3141, test_f1: 0.2260
 epoch: 89, train_loss: 1.3016, test_loss: 1.3167, test_f1: 0.2260
 epoch: 90, train_loss: 1.3019, test_loss: 1.3147, test_f1: 0.2260
 epoch: 91, train_loss: 1.3014, test_loss: 1.3153, test_f1: 0.2260
 epoch: 92, train_loss: 1.3016, test_loss: 1.3153, test_f1: 0.2260
 epoch: 93, train_loss: 1.3016, test_loss: 1.3155, test_f1: 0.2260
 epoch: 94, train_loss: 1.3017, test_loss: 1.3157, test_f1: 0.2260
 epoch: 95, train_loss: 1.3024, test_loss: 1.3152, test_f1: 0.2260
 epoch: 96, train_loss: 1.3021, test_loss: 1.3143, test_f1: 0.2260
 epoch: 97, train_loss: 1.3019, test_loss: 1.3166, test_f1: 0.2260
 epoch: 98, train_loss: 1.3018, test_loss: 1.3150, test_f1: 0.2260
 epoch: 99, train_loss: 1.3022, test_loss: 1.3146, test_f1: 0.2260
##################ITERATION #5 ****************************************
 epoch: 0, train_loss: 1.3038, test_loss: 1.3200, test_f1: 0.2260
 epoch: 1, train_loss: 1.3051, test_loss: 1.3169, test_f1: 0.2260
 epoch: 2, train_loss: 1.3025, test_loss: 1.3150, test_f1: 0.2260
 epoch: 3, train_loss: 1.3023, test_loss: 1.3144, test_f1: 0.2260
 epoch: 4, train_loss: 1.3021, test_loss: 1.3168, test_f1: 0.2260
 epoch: 5, train_loss: 1.3022, test_loss: 1.3158, test_f1: 0.2260
 epoch: 6, train_loss: 1.3016, test_loss: 1.3156, test_f1: 0.2260
 epoch: 7, train_loss: 1.3024, test_loss: 1.3147, test_f1: 0.2260
 epoch: 8, train_loss: 1.3023, test_loss: 1.3157, test_f1: 0.2260
 epoch: 9, train_loss: 1.3037, test_loss: 1.3140, test_f1: 0.2260
 epoch: 10, train_loss: 1.3035, test_loss: 1.3171, test_f1: 0.2260
 epoch: 11, train_loss: 1.3026, test_loss: 1.3151, test_f1: 0.2260
 epoch: 12, train_loss: 1.3020, test_loss: 1.3154, test_f1: 0.2260
 epoch: 13, train_loss: 1.3017, test_loss: 1.3146, test_f1: 0.2260
 epoch: 14, train_loss: 1.3027, test_loss: 1.3163, test_f1: 0.2260
 epoch: 15, train_loss: 1.3029, test_loss: 1.3158, test_f1: 0.2260
 epoch: 16, train_loss: 1.3016, test_loss: 1.3152, test_f1: 0.2260
 epoch: 17, train_loss: 1.3027, test_loss: 1.3144, test_f1: 0.2260
 epoch: 18, train_loss: 1.3019, test_loss: 1.3151, test_f1: 0.2260
 epoch: 19, train_loss: 1.3015, test_loss: 1.3158, test_f1: 0.2260
 epoch: 20, train_loss: 1.3019, test_loss: 1.3146, test_f1: 0.2260
 epoch: 21, train_loss: 1.3017, test_loss: 1.3154, test_f1: 0.2260
 epoch: 22, train_loss: 1.3019, test_loss: 1.3146, test_f1: 0.2260
 epoch: 23, train_loss: 1.3024, test_loss: 1.3158, test_f1: 0.2260
 epoch: 24, train_loss: 1.3017, test_loss: 1.3154, test_f1: 0.2260
 epoch: 25, train_loss: 1.3025, test_loss: 1.3153, test_f1: 0.2260
 epoch: 26, train_loss: 1.3022, test_loss: 1.3149, test_f1: 0.2260
 epoch: 27, train_loss: 1.3033, test_loss: 1.3171, test_f1: 0.2260
 epoch: 28, train_loss: 1.3027, test_loss: 1.3138, test_f1: 0.2260
 epoch: 29, train_loss: 1.3020, test_loss: 1.3167, test_f1: 0.2260
 epoch: 30, train_loss: 1.3021, test_loss: 1.3144, test_f1: 0.2260
 epoch: 31, train_loss: 1.3021, test_loss: 1.3158, test_f1: 0.2260
 epoch: 32, train_loss: 1.3022, test_loss: 1.3156, test_f1: 0.2260
 epoch: 33, train_loss: 1.3020, test_loss: 1.3165, test_f1: 0.2260
 epoch: 34, train_loss: 1.3022, test_loss: 1.3144, test_f1: 0.2260
 epoch: 35, train_loss: 1.3016, test_loss: 1.3173, test_f1: 0.2260
 epoch: 36, train_loss: 1.3020, test_loss: 1.3148, test_f1: 0.2260
 epoch: 37, train_loss: 1.3023, test_loss: 1.3144, test_f1: 0.2260
 epoch: 38, train_loss: 1.3018, test_loss: 1.3171, test_f1: 0.2260
 epoch: 39, train_loss: 1.3021, test_loss: 1.3147, test_f1: 0.2260
 epoch: 40, train_loss: 1.3028, test_loss: 1.3160, test_f1: 0.2260
 epoch: 41, train_loss: 1.3027, test_loss: 1.3159, test_f1: 0.2260
 epoch: 42, train_loss: 1.3020, test_loss: 1.3150, test_f1: 0.2260
 epoch: 43, train_loss: 1.3024, test_loss: 1.3154, test_f1: 0.2260
 epoch: 44, train_loss: 1.3020, test_loss: 1.3146, test_f1: 0.2260
 epoch: 45, train_loss: 1.3020, test_loss: 1.3155, test_f1: 0.2260
 epoch: 46, train_loss: 1.3018, test_loss: 1.3154, test_f1: 0.2260
 epoch: 47, train_loss: 1.3017, test_loss: 1.3154, test_f1: 0.2260
 epoch: 48, train_loss: 1.3025, test_loss: 1.3161, test_f1: 0.2260
 epoch: 49, train_loss: 1.3024, test_loss: 1.3151, test_f1: 0.2260
 epoch: 50, train_loss: 1.3019, test_loss: 1.3149, test_f1: 0.2260
 epoch: 51, train_loss: 1.3018, test_loss: 1.3152, test_f1: 0.2260
 epoch: 52, train_loss: 1.3017, test_loss: 1.3156, test_f1: 0.2260
 epoch: 53, train_loss: 1.3016, test_loss: 1.3155, test_f1: 0.2260
 epoch: 54, train_loss: 1.3016, test_loss: 1.3145, test_f1: 0.2260
 epoch: 55, train_loss: 1.3024, test_loss: 1.3161, test_f1: 0.2260
 epoch: 56, train_loss: 1.3019, test_loss: 1.3143, test_f1: 0.2260
 epoch: 57, train_loss: 1.3017, test_loss: 1.3159, test_f1: 0.2260
 epoch: 58, train_loss: 1.3017, test_loss: 1.3155, test_f1: 0.2260
 epoch: 59, train_loss: 1.3017, test_loss: 1.3152, test_f1: 0.2260
 epoch: 60, train_loss: 1.3016, test_loss: 1.3147, test_f1: 0.2260
 epoch: 61, train_loss: 1.3017, test_loss: 1.3160, test_f1: 0.2260
 epoch: 62, train_loss: 1.3021, test_loss: 1.3150, test_f1: 0.2260
 epoch: 63, train_loss: 1.3016, test_loss: 1.3153, test_f1: 0.2260
 epoch: 64, train_loss: 1.3017, test_loss: 1.3152, test_f1: 0.2260
 epoch: 65, train_loss: 1.3015, test_loss: 1.3158, test_f1: 0.2260
 epoch: 66, train_loss: 1.3016, test_loss: 1.3152, test_f1: 0.2260
 epoch: 67, train_loss: 1.3019, test_loss: 1.3142, test_f1: 0.2260
 epoch: 68, train_loss: 1.3032, test_loss: 1.3167, test_f1: 0.2260
 epoch: 69, train_loss: 1.3014, test_loss: 1.3142, test_f1: 0.2260
 epoch: 70, train_loss: 1.3018, test_loss: 1.3156, test_f1: 0.2260
 epoch: 71, train_loss: 1.3017, test_loss: 1.3156, test_f1: 0.2260
 epoch: 72, train_loss: 1.3016, test_loss: 1.3151, test_f1: 0.2260
 epoch: 73, train_loss: 1.3016, test_loss: 1.3155, test_f1: 0.2260
 epoch: 74, train_loss: 1.3017, test_loss: 1.3143, test_f1: 0.2260
 epoch: 75, train_loss: 1.3016, test_loss: 1.3154, test_f1: 0.2260
 epoch: 76, train_loss: 1.3016, test_loss: 1.3150, test_f1: 0.2260
 epoch: 77, train_loss: 1.3016, test_loss: 1.3150, test_f1: 0.2260
 epoch: 78, train_loss: 1.3016, test_loss: 1.3154, test_f1: 0.2260
 epoch: 79, train_loss: 1.3016, test_loss: 1.3165, test_f1: 0.2260
 epoch: 80, train_loss: 1.3015, test_loss: 1.3146, test_f1: 0.2260
 epoch: 81, train_loss: 1.3021, test_loss: 1.3156, test_f1: 0.2260
 epoch: 82, train_loss: 1.3018, test_loss: 1.3159, test_f1: 0.2260
 epoch: 83, train_loss: 1.3015, test_loss: 1.3147, test_f1: 0.2260
 epoch: 84, train_loss: 1.3015, test_loss: 1.3150, test_f1: 0.2260
 epoch: 85, train_loss: 1.3017, test_loss: 1.3159, test_f1: 0.2260
 epoch: 86, train_loss: 1.3020, test_loss: 1.3148, test_f1: 0.2260
 epoch: 87, train_loss: 1.3013, test_loss: 1.3154, test_f1: 0.2260
 epoch: 88, train_loss: 1.3023, test_loss: 1.3163, test_f1: 0.2260
 epoch: 89, train_loss: 1.3018, test_loss: 1.3142, test_f1: 0.2260
 epoch: 90, train_loss: 1.3019, test_loss: 1.3160, test_f1: 0.2260
 epoch: 91, train_loss: 1.3014, test_loss: 1.3151, test_f1: 0.2260
 epoch: 92, train_loss: 1.3016, test_loss: 1.3150, test_f1: 0.2260
 epoch: 93, train_loss: 1.3016, test_loss: 1.3147, test_f1: 0.2260
 epoch: 94, train_loss: 1.3014, test_loss: 1.3157, test_f1: 0.2260
 epoch: 95, train_loss: 1.3016, test_loss: 1.3153, test_f1: 0.2260
 epoch: 96, train_loss: 1.3017, test_loss: 1.3158, test_f1: 0.2260
 epoch: 97, train_loss: 1.3021, test_loss: 1.3149, test_f1: 0.2260
 epoch: 98, train_loss: 1.3023, test_loss: 1.3151, test_f1: 0.2260
 epoch: 99, train_loss: 1.3015, test_loss: 1.3159, test_f1: 0.2260
##################ITERATION #6 ****************************************
 epoch: 0, train_loss: 1.3048, test_loss: 1.3279, test_f1: 0.2260
 epoch: 1, train_loss: 1.3066, test_loss: 1.3147, test_f1: 0.2260
 epoch: 2, train_loss: 1.3024, test_loss: 1.3156, test_f1: 0.2260
 epoch: 3, train_loss: 1.3020, test_loss: 1.3145, test_f1: 0.2260
 epoch: 4, train_loss: 1.3025, test_loss: 1.3154, test_f1: 0.2260
 epoch: 5, train_loss: 1.3017, test_loss: 1.3159, test_f1: 0.2260
 epoch: 6, train_loss: 1.3023, test_loss: 1.3155, test_f1: 0.2260
 epoch: 7, train_loss: 1.3017, test_loss: 1.3155, test_f1: 0.2260
 epoch: 8, train_loss: 1.3017, test_loss: 1.3149, test_f1: 0.2260
 epoch: 9, train_loss: 1.3025, test_loss: 1.3160, test_f1: 0.2260
 epoch: 10, train_loss: 1.3016, test_loss: 1.3149, test_f1: 0.2260
 epoch: 11, train_loss: 1.3016, test_loss: 1.3145, test_f1: 0.2260
 epoch: 12, train_loss: 1.3021, test_loss: 1.3160, test_f1: 0.2260
 epoch: 13, train_loss: 1.3018, test_loss: 1.3148, test_f1: 0.2260
 epoch: 14, train_loss: 1.3024, test_loss: 1.3161, test_f1: 0.2260
 epoch: 15, train_loss: 1.3024, test_loss: 1.3169, test_f1: 0.2260
 epoch: 16, train_loss: 1.3020, test_loss: 1.3151, test_f1: 0.2260
 epoch: 17, train_loss: 1.3018, test_loss: 1.3152, test_f1: 0.2260
 epoch: 18, train_loss: 1.3020, test_loss: 1.3158, test_f1: 0.2260
 epoch: 19, train_loss: 1.3037, test_loss: 1.3150, test_f1: 0.2260
 epoch: 20, train_loss: 1.3027, test_loss: 1.3150, test_f1: 0.2260
 epoch: 21, train_loss: 1.3025, test_loss: 1.3158, test_f1: 0.2260
 epoch: 22, train_loss: 1.3020, test_loss: 1.3149, test_f1: 0.2260
 epoch: 23, train_loss: 1.3016, test_loss: 1.3146, test_f1: 0.2260
 epoch: 24, train_loss: 1.3021, test_loss: 1.3158, test_f1: 0.2260
 epoch: 25, train_loss: 1.3019, test_loss: 1.3154, test_f1: 0.2260
 epoch: 26, train_loss: 1.3017, test_loss: 1.3158, test_f1: 0.2260
 epoch: 27, train_loss: 1.3021, test_loss: 1.3141, test_f1: 0.2260
 epoch: 28, train_loss: 1.3021, test_loss: 1.3154, test_f1: 0.2260
 epoch: 29, train_loss: 1.3016, test_loss: 1.3145, test_f1: 0.2260
 epoch: 30, train_loss: 1.3016, test_loss: 1.3166, test_f1: 0.2260
 epoch: 31, train_loss: 1.3019, test_loss: 1.3152, test_f1: 0.2260
 epoch: 32, train_loss: 1.3020, test_loss: 1.3147, test_f1: 0.2260
 epoch: 33, train_loss: 1.3042, test_loss: 1.3188, test_f1: 0.2260
 epoch: 34, train_loss: 1.3044, test_loss: 1.3142, test_f1: 0.2260
 epoch: 35, train_loss: 1.3021, test_loss: 1.3181, test_f1: 0.2260
 epoch: 36, train_loss: 1.3033, test_loss: 1.3140, test_f1: 0.2260
 epoch: 37, train_loss: 1.3023, test_loss: 1.3158, test_f1: 0.2260
 epoch: 38, train_loss: 1.3017, test_loss: 1.3154, test_f1: 0.2260
 epoch: 39, train_loss: 1.3023, test_loss: 1.3160, test_f1: 0.2260
 epoch: 40, train_loss: 1.3025, test_loss: 1.3145, test_f1: 0.2260
 epoch: 41, train_loss: 1.3031, test_loss: 1.3157, test_f1: 0.2260
 epoch: 42, train_loss: 1.3024, test_loss: 1.3147, test_f1: 0.2260
 epoch: 43, train_loss: 1.3027, test_loss: 1.3146, test_f1: 0.2260
 epoch: 44, train_loss: 1.3018, test_loss: 1.3168, test_f1: 0.2260
 epoch: 45, train_loss: 1.3016, test_loss: 1.3153, test_f1: 0.2260
 epoch: 46, train_loss: 1.3026, test_loss: 1.3149, test_f1: 0.2260
 epoch: 47, train_loss: 1.3026, test_loss: 1.3143, test_f1: 0.2260
 epoch: 48, train_loss: 1.3023, test_loss: 1.3151, test_f1: 0.2260
 epoch: 49, train_loss: 1.3027, test_loss: 1.3157, test_f1: 0.2260
 epoch: 50, train_loss: 1.3026, test_loss: 1.3154, test_f1: 0.2260
 epoch: 51, train_loss: 1.3020, test_loss: 1.3147, test_f1: 0.2260
 epoch: 52, train_loss: 1.3016, test_loss: 1.3169, test_f1: 0.2260
 epoch: 53, train_loss: 1.3017, test_loss: 1.3148, test_f1: 0.2260
 epoch: 54, train_loss: 1.3016, test_loss: 1.3148, test_f1: 0.2260
 epoch: 55, train_loss: 1.3019, test_loss: 1.3160, test_f1: 0.2260
 epoch: 56, train_loss: 1.3017, test_loss: 1.3147, test_f1: 0.2260
 epoch: 57, train_loss: 1.3016, test_loss: 1.3153, test_f1: 0.2260
 epoch: 58, train_loss: 1.3026, test_loss: 1.3147, test_f1: 0.2260
 epoch: 59, train_loss: 1.3024, test_loss: 1.3164, test_f1: 0.2260
 epoch: 60, train_loss: 1.3019, test_loss: 1.3149, test_f1: 0.2260
 epoch: 61, train_loss: 1.3017, test_loss: 1.3155, test_f1: 0.2260
 epoch: 62, train_loss: 1.3015, test_loss: 1.3147, test_f1: 0.2260
 epoch: 63, train_loss: 1.3017, test_loss: 1.3149, test_f1: 0.2260
 epoch: 64, train_loss: 1.3016, test_loss: 1.3156, test_f1: 0.2260
 epoch: 65, train_loss: 1.3018, test_loss: 1.3153, test_f1: 0.2260
 epoch: 66, train_loss: 1.3015, test_loss: 1.3156, test_f1: 0.2260
 epoch: 67, train_loss: 1.3016, test_loss: 1.3153, test_f1: 0.2260
 epoch: 68, train_loss: 1.3018, test_loss: 1.3146, test_f1: 0.2260
 epoch: 69, train_loss: 1.3015, test_loss: 1.3156, test_f1: 0.2260
 epoch: 70, train_loss: 1.3017, test_loss: 1.3150, test_f1: 0.2260
 epoch: 71, train_loss: 1.3023, test_loss: 1.3151, test_f1: 0.2260
 epoch: 72, train_loss: 1.3018, test_loss: 1.3161, test_f1: 0.2260
 epoch: 73, train_loss: 1.3015, test_loss: 1.3155, test_f1: 0.2260
 epoch: 74, train_loss: 1.3017, test_loss: 1.3156, test_f1: 0.2260
 epoch: 75, train_loss: 1.3016, test_loss: 1.3147, test_f1: 0.2260
 epoch: 76, train_loss: 1.3018, test_loss: 1.3155, test_f1: 0.2260
 epoch: 77, train_loss: 1.3014, test_loss: 1.3146, test_f1: 0.2260
 epoch: 78, train_loss: 1.3015, test_loss: 1.3155, test_f1: 0.2260
 epoch: 79, train_loss: 1.3014, test_loss: 1.3155, test_f1: 0.2260
 epoch: 80, train_loss: 1.3016, test_loss: 1.3150, test_f1: 0.2260
 epoch: 81, train_loss: 1.3014, test_loss: 1.3154, test_f1: 0.2260
 epoch: 82, train_loss: 1.3017, test_loss: 1.3156, test_f1: 0.2260
 epoch: 83, train_loss: 1.3018, test_loss: 1.3145, test_f1: 0.2260
 epoch: 84, train_loss: 1.3015, test_loss: 1.3159, test_f1: 0.2260
 epoch: 85, train_loss: 1.3022, test_loss: 1.3160, test_f1: 0.2260
 epoch: 86, train_loss: 1.3020, test_loss: 1.3151, test_f1: 0.2260
 epoch: 87, train_loss: 1.3015, test_loss: 1.3155, test_f1: 0.2260
 epoch: 88, train_loss: 1.3017, test_loss: 1.3150, test_f1: 0.2260
 epoch: 89, train_loss: 1.3015, test_loss: 1.3160, test_f1: 0.2260
 epoch: 90, train_loss: 1.3016, test_loss: 1.3151, test_f1: 0.2260
 epoch: 91, train_loss: 1.3015, test_loss: 1.3147, test_f1: 0.2260
 epoch: 92, train_loss: 1.3019, test_loss: 1.3152, test_f1: 0.2260
 epoch: 93, train_loss: 1.3015, test_loss: 1.3153, test_f1: 0.2260
 epoch: 94, train_loss: 1.3015, test_loss: 1.3149, test_f1: 0.2260
 epoch: 95, train_loss: 1.3024, test_loss: 1.3153, test_f1: 0.2260
 epoch: 96, train_loss: 1.3018, test_loss: 1.3144, test_f1: 0.2260
 epoch: 97, train_loss: 1.3021, test_loss: 1.3161, test_f1: 0.2260
 epoch: 98, train_loss: 1.3015, test_loss: 1.3148, test_f1: 0.2260
 epoch: 99, train_loss: 1.3016, test_loss: 1.3149, test_f1: 0.2260
##################ITERATION #7 ****************************************
 epoch: 0, train_loss: 1.2876, test_loss: 1.2771, test_f1: 0.3203
 epoch: 1, train_loss: 1.1572, test_loss: 1.4713, test_f1: 0.3135
 epoch: 2, train_loss: 1.1436, test_loss: 10.7736, test_f1: 0.1203
 epoch: 3, train_loss: 1.1228, test_loss: 1.1433, test_f1: 0.3338
 epoch: 4, train_loss: 1.1122, test_loss: 1.1783, test_f1: 0.3306
 epoch: 5, train_loss: 1.0963, test_loss: 1.1490, test_f1: 0.3252
 epoch: 6, train_loss: 1.1036, test_loss: 1.0612, test_f1: 0.3570
 epoch: 7, train_loss: 1.0899, test_loss: 1.1220, test_f1: 0.3426
 epoch: 8, train_loss: 1.0818, test_loss: 1.1129, test_f1: 0.3265
 epoch: 9, train_loss: 1.0703, test_loss: 1.1215, test_f1: 0.3397
 epoch: 10, train_loss: 1.0713, test_loss: 1.1093, test_f1: 0.3541
 epoch: 11, train_loss: 1.0789, test_loss: 1.1831, test_f1: 0.3447
 epoch: 12, train_loss: 1.0878, test_loss: 1.5219, test_f1: 0.3039
 epoch: 13, train_loss: 1.0645, test_loss: 1.0922, test_f1: 0.3400
 epoch: 14, train_loss: 1.0701, test_loss: 1.1477, test_f1: 0.3404
 epoch: 15, train_loss: 1.0578, test_loss: 1.1171, test_f1: 0.3510
 epoch: 16, train_loss: 1.0675, test_loss: 1.0899, test_f1: 0.3490
 epoch: 17, train_loss: 1.0629, test_loss: 1.7273, test_f1: 0.2784
 epoch: 18, train_loss: 1.0551, test_loss: 1.1264, test_f1: 0.3435
 epoch: 19, train_loss: 1.0516, test_loss: 1.2595, test_f1: 0.2661
 epoch: 20, train_loss: 1.0615, test_loss: 2.0068, test_f1: 0.2405
 epoch: 21, train_loss: 1.0693, test_loss: 1.1870, test_f1: 0.3346
 epoch: 22, train_loss: 1.0588, test_loss: 1.0653, test_f1: 0.3419
 epoch: 23, train_loss: 1.0555, test_loss: 1.0644, test_f1: 0.3400
 epoch: 24, train_loss: 1.0447, test_loss: 1.0492, test_f1: 0.3492
 epoch: 25, train_loss: 1.0453, test_loss: 1.0567, test_f1: 0.3439
 epoch: 26, train_loss: 1.0528, test_loss: 1.0581, test_f1: 0.3479
 epoch: 27, train_loss: 1.0536, test_loss: 1.2640, test_f1: 0.3174
 epoch: 28, train_loss: 1.0535, test_loss: 1.0812, test_f1: 0.3507
 epoch: 29, train_loss: 1.0516, test_loss: 1.2086, test_f1: 0.3612
 epoch: 30, train_loss: 1.0591, test_loss: 1.1460, test_f1: 0.3411
 epoch: 31, train_loss: 1.0572, test_loss: 1.2426, test_f1: 0.3186
 epoch: 32, train_loss: 1.0720, test_loss: 1.0550, test_f1: 0.3417
 epoch: 33, train_loss: 1.0597, test_loss: 1.1470, test_f1: 0.3405
 epoch: 34, train_loss: 1.0610, test_loss: 1.1997, test_f1: 0.3396
 epoch: 35, train_loss: 1.0713, test_loss: 1.0974, test_f1: 0.3494
 epoch: 36, train_loss: 1.0620, test_loss: 1.0698, test_f1: 0.3400
 epoch: 37, train_loss: 1.0604, test_loss: 1.0822, test_f1: 0.3469
 epoch: 38, train_loss: 1.0437, test_loss: 1.2976, test_f1: 0.3187
 epoch: 39, train_loss: 1.0470, test_loss: 1.1998, test_f1: 0.3353
 epoch: 40, train_loss: 1.0689, test_loss: 1.0647, test_f1: 0.3410
 epoch: 41, train_loss: 1.0561, test_loss: 1.3302, test_f1: 0.3337
 epoch: 42, train_loss: 1.0608, test_loss: 1.0886, test_f1: 0.3381
 epoch: 43, train_loss: 1.0480, test_loss: 1.0708, test_f1: 0.3500
 epoch: 44, train_loss: 1.0512, test_loss: 1.0776, test_f1: 0.3500
 epoch: 45, train_loss: 1.0584, test_loss: 1.0613, test_f1: 0.3419
 epoch: 46, train_loss: 1.0639, test_loss: 1.0939, test_f1: 0.3410
 epoch: 47, train_loss: 1.0550, test_loss: 1.0468, test_f1: 0.3434
 epoch: 48, train_loss: 1.0400, test_loss: 1.2914, test_f1: 0.3348
 epoch: 49, train_loss: 1.0470, test_loss: 1.1097, test_f1: 0.3400
 epoch: 50, train_loss: 1.0497, test_loss: 1.0666, test_f1: 0.3531
 epoch: 51, train_loss: 1.0388, test_loss: 1.0697, test_f1: 0.3459
 epoch: 52, train_loss: 1.0279, test_loss: 1.1005, test_f1: 0.3488
 epoch: 53, train_loss: 1.0400, test_loss: 1.0676, test_f1: 0.3426
 epoch: 54, train_loss: 1.0301, test_loss: 1.1331, test_f1: 0.3431
 epoch: 55, train_loss: 1.0287, test_loss: 1.0757, test_f1: 0.3468
 epoch: 56, train_loss: 1.0266, test_loss: 1.0738, test_f1: 0.3452
 epoch: 57, train_loss: 1.0221, test_loss: 1.1189, test_f1: 0.3436
 epoch: 58, train_loss: 1.0296, test_loss: 1.0968, test_f1: 0.3423
 epoch: 59, train_loss: 1.0288, test_loss: 1.1188, test_f1: 0.3444
 epoch: 60, train_loss: 1.0317, test_loss: 1.1057, test_f1: 0.3433
 epoch: 61, train_loss: 1.0242, test_loss: 1.1094, test_f1: 0.3617
 epoch: 62, train_loss: 1.0313, test_loss: 1.0813, test_f1: 0.3462
 epoch: 63, train_loss: 1.0252, test_loss: 1.0930, test_f1: 0.3445
 epoch: 64, train_loss: 1.0193, test_loss: 1.0896, test_f1: 0.3458
 epoch: 65, train_loss: 1.0256, test_loss: 1.1145, test_f1: 0.3455
 epoch: 66, train_loss: 1.0265, test_loss: 1.0997, test_f1: 0.3526
 epoch: 67, train_loss: 1.0325, test_loss: 1.1214, test_f1: 0.3431
 epoch: 68, train_loss: 1.0129, test_loss: 1.0792, test_f1: 0.3484
 epoch: 69, train_loss: 1.0135, test_loss: 1.1387, test_f1: 0.3760
 epoch: 70, train_loss: 1.0174, test_loss: 1.0896, test_f1: 0.3701
 epoch: 71, train_loss: 1.0220, test_loss: 1.1824, test_f1: 0.3439
 epoch: 72, train_loss: 1.0129, test_loss: 1.1127, test_f1: 0.4111
 epoch: 73, train_loss: 1.0102, test_loss: 1.0937, test_f1: 0.3473
 epoch: 74, train_loss: 1.0157, test_loss: 1.0384, test_f1: 0.3643
 epoch: 75, train_loss: 1.0192, test_loss: 1.0985, test_f1: 0.3407
 epoch: 76, train_loss: 1.0313, test_loss: 1.0610, test_f1: 0.3537
 epoch: 77, train_loss: 1.0301, test_loss: 1.0870, test_f1: 0.3439
 epoch: 78, train_loss: 1.0208, test_loss: 1.0274, test_f1: 0.3634
 epoch: 79, train_loss: 1.0300, test_loss: 1.0545, test_f1: 0.3463
 epoch: 80, train_loss: 1.0213, test_loss: 1.0849, test_f1: 0.3772
 epoch: 81, train_loss: 1.0101, test_loss: 1.0771, test_f1: 0.3526
 epoch: 82, train_loss: 0.9996, test_loss: 1.1582, test_f1: 0.3773
 epoch: 83, train_loss: 1.0054, test_loss: 1.0805, test_f1: 0.3840
 epoch: 84, train_loss: 1.0051, test_loss: 1.2050, test_f1: 0.3763
 epoch: 85, train_loss: 1.0058, test_loss: 1.1859, test_f1: 0.3570
 epoch: 86, train_loss: 1.0132, test_loss: 1.0140, test_f1: 0.3702
 epoch: 87, train_loss: 1.0002, test_loss: 0.9826, test_f1: 0.3916
 epoch: 88, train_loss: 1.0157, test_loss: 1.1097, test_f1: 0.4096
 epoch: 89, train_loss: 1.0020, test_loss: 1.1318, test_f1: 0.3784
 epoch: 90, train_loss: 0.9918, test_loss: 1.0965, test_f1: 0.4189
 epoch: 91, train_loss: 0.9935, test_loss: 1.0394, test_f1: 0.3595
 epoch: 92, train_loss: 0.9924, test_loss: 1.1078, test_f1: 0.3921
 epoch: 93, train_loss: 0.9978, test_loss: 1.2606, test_f1: 0.3835
 epoch: 94, train_loss: 1.0387, test_loss: 1.0993, test_f1: 0.3671
 epoch: 95, train_loss: 1.0310, test_loss: 1.1161, test_f1: 0.3982
 epoch: 96, train_loss: 1.0174, test_loss: 1.0221, test_f1: 0.3989
 epoch: 97, train_loss: 1.0138, test_loss: 1.0052, test_f1: 0.4016
 epoch: 98, train_loss: 1.0079, test_loss: 1.0159, test_f1: 0.3576
 epoch: 99, train_loss: 1.0008, test_loss: 1.1451, test_f1: 0.3940
##################ITERATION #8 ****************************************
 epoch: 0, train_loss: 1.3608, test_loss: 1.9608, test_f1: 0.2485
 epoch: 1, train_loss: 1.2606, test_loss: 1.1294, test_f1: 0.3275
 epoch: 2, train_loss: 1.1331, test_loss: 1.1281, test_f1: 0.3383
 epoch: 3, train_loss: 1.0891, test_loss: 1.1361, test_f1: 0.3426
 epoch: 4, train_loss: 1.0757, test_loss: 1.2321, test_f1: 0.3297
 epoch: 5, train_loss: 1.0607, test_loss: 1.2098, test_f1: 0.3351
 epoch: 6, train_loss: 1.0717, test_loss: 1.2008, test_f1: 0.3385
 epoch: 7, train_loss: 1.0675, test_loss: 1.3792, test_f1: 0.2999
 epoch: 8, train_loss: 1.0535, test_loss: 1.0994, test_f1: 0.3500
 epoch: 9, train_loss: 1.0610, test_loss: 1.1752, test_f1: 0.3437
 epoch: 10, train_loss: 1.0533, test_loss: 1.0545, test_f1: 0.3631
 epoch: 11, train_loss: 1.0752, test_loss: 1.3053, test_f1: 0.4236
 epoch: 12, train_loss: 1.0781, test_loss: 1.0274, test_f1: 0.3500
 epoch: 13, train_loss: 1.0539, test_loss: 1.0687, test_f1: 0.3437
 epoch: 14, train_loss: 1.0595, test_loss: 1.0528, test_f1: 0.3412
 epoch: 15, train_loss: 1.0542, test_loss: 1.0273, test_f1: 0.3564
 epoch: 16, train_loss: 1.0323, test_loss: 1.1733, test_f1: 0.3429
 epoch: 17, train_loss: 1.0281, test_loss: 1.0863, test_f1: 0.3384
 epoch: 18, train_loss: 1.0435, test_loss: 1.4673, test_f1: 0.3281
 epoch: 19, train_loss: 1.0485, test_loss: 1.0072, test_f1: 0.3490
 epoch: 20, train_loss: 1.0384, test_loss: 1.0388, test_f1: 0.3454
 epoch: 21, train_loss: 1.0249, test_loss: 1.0210, test_f1: 0.3506
 epoch: 22, train_loss: 1.0228, test_loss: 1.0971, test_f1: 0.4537
 epoch: 23, train_loss: 1.0240, test_loss: 1.0822, test_f1: 0.4027
 epoch: 24, train_loss: 1.0341, test_loss: 1.0400, test_f1: 0.4261
 epoch: 25, train_loss: 1.0185, test_loss: 1.0951, test_f1: 0.3437
 epoch: 26, train_loss: 1.0215, test_loss: 1.4979, test_f1: 0.3478
 epoch: 27, train_loss: 1.0427, test_loss: 1.0783, test_f1: 0.4261
 epoch: 28, train_loss: 1.0387, test_loss: 1.1432, test_f1: 0.4246
 epoch: 29, train_loss: 1.0244, test_loss: 1.0546, test_f1: 0.4451
 epoch: 30, train_loss: 1.0179, test_loss: 1.0680, test_f1: 0.3441
 epoch: 31, train_loss: 1.0140, test_loss: 1.1026, test_f1: 0.3794
 epoch: 32, train_loss: 1.0133, test_loss: 1.0097, test_f1: 0.4285
 epoch: 33, train_loss: 1.0197, test_loss: 1.1238, test_f1: 0.4120
 epoch: 34, train_loss: 1.0155, test_loss: 1.0317, test_f1: 0.3680
 epoch: 35, train_loss: 1.0341, test_loss: 1.0233, test_f1: 0.3510
 epoch: 36, train_loss: 1.0108, test_loss: 1.2853, test_f1: 0.4229
 epoch: 37, train_loss: 1.0183, test_loss: 1.1568, test_f1: 0.4345
 epoch: 38, train_loss: 1.0098, test_loss: 1.0300, test_f1: 0.4197
 epoch: 39, train_loss: 1.0197, test_loss: 1.2030, test_f1: 0.4420
 epoch: 40, train_loss: 1.0071, test_loss: 1.0408, test_f1: 0.3789
 epoch: 41, train_loss: 1.0042, test_loss: 1.0283, test_f1: 0.4500
 epoch: 42, train_loss: 1.0202, test_loss: 0.9618, test_f1: 0.4015
 epoch: 43, train_loss: 1.0146, test_loss: 1.0824, test_f1: 0.4064
 epoch: 44, train_loss: 1.0097, test_loss: 1.0849, test_f1: 0.4064
 epoch: 45, train_loss: 0.9968, test_loss: 0.9404, test_f1: 0.4385
 epoch: 46, train_loss: 1.0104, test_loss: 1.0124, test_f1: 0.3546
 epoch: 47, train_loss: 1.0246, test_loss: 1.3591, test_f1: 0.4272
 epoch: 48, train_loss: 0.9991, test_loss: 1.0089, test_f1: 0.4308
 epoch: 49, train_loss: 1.0082, test_loss: 0.9540, test_f1: 0.4353
 epoch: 50, train_loss: 0.9989, test_loss: 0.9474, test_f1: 0.4627
 epoch: 51, train_loss: 0.9991, test_loss: 0.9766, test_f1: 0.4426
 epoch: 52, train_loss: 1.0088, test_loss: 0.9638, test_f1: 0.3567
 epoch: 53, train_loss: 0.9874, test_loss: 0.9636, test_f1: 0.4710
 epoch: 54, train_loss: 0.9930, test_loss: 1.0291, test_f1: 0.4389
 epoch: 55, train_loss: 0.9888, test_loss: 0.9386, test_f1: 0.4868
 epoch: 56, train_loss: 0.9821, test_loss: 0.9718, test_f1: 0.4615
 epoch: 57, train_loss: 0.9857, test_loss: 1.0797, test_f1: 0.4677
 epoch: 58, train_loss: 0.9812, test_loss: 0.9296, test_f1: 0.5070
 epoch: 59, train_loss: 0.9877, test_loss: 1.0584, test_f1: 0.4860
 epoch: 60, train_loss: 0.9812, test_loss: 0.9261, test_f1: 0.5066
 epoch: 61, train_loss: 0.9828, test_loss: 0.9795, test_f1: 0.4805
 epoch: 62, train_loss: 0.9913, test_loss: 0.9642, test_f1: 0.4840
 epoch: 63, train_loss: 0.9844, test_loss: 0.9597, test_f1: 0.4925
 epoch: 64, train_loss: 0.9786, test_loss: 0.9103, test_f1: 0.4985
 epoch: 65, train_loss: 0.9778, test_loss: 1.0131, test_f1: 0.4639
 epoch: 66, train_loss: 0.9820, test_loss: 0.9394, test_f1: 0.4719
 epoch: 67, train_loss: 0.9745, test_loss: 0.9656, test_f1: 0.4987
 epoch: 68, train_loss: 0.9803, test_loss: 0.9491, test_f1: 0.4806
 epoch: 69, train_loss: 0.9688, test_loss: 0.9773, test_f1: 0.4910
 epoch: 70, train_loss: 0.9775, test_loss: 0.9450, test_f1: 0.4835
 epoch: 71, train_loss: 0.9741, test_loss: 0.9954, test_f1: 0.4973
 epoch: 72, train_loss: 0.9720, test_loss: 0.9124, test_f1: 0.5045
 epoch: 73, train_loss: 0.9765, test_loss: 0.9614, test_f1: 0.4800
 epoch: 74, train_loss: 0.9785, test_loss: 0.9754, test_f1: 0.4737
 epoch: 75, train_loss: 0.9878, test_loss: 0.9431, test_f1: 0.5044
 epoch: 76, train_loss: 0.9726, test_loss: 0.9113, test_f1: 0.4959
 epoch: 77, train_loss: 0.9781, test_loss: 0.9517, test_f1: 0.4651
 epoch: 78, train_loss: 0.9913, test_loss: 1.0006, test_f1: 0.4705
 epoch: 79, train_loss: 0.9911, test_loss: 0.9590, test_f1: 0.4475
 epoch: 80, train_loss: 0.9816, test_loss: 0.9856, test_f1: 0.4728
 epoch: 81, train_loss: 0.9729, test_loss: 0.9505, test_f1: 0.4867
 epoch: 82, train_loss: 0.9683, test_loss: 0.9708, test_f1: 0.4842
 epoch: 83, train_loss: 0.9743, test_loss: 0.9173, test_f1: 0.5060
 epoch: 84, train_loss: 0.9614, test_loss: 1.0447, test_f1: 0.4720
 epoch: 85, train_loss: 0.9815, test_loss: 0.9719, test_f1: 0.4818
 epoch: 86, train_loss: 0.9733, test_loss: 0.9301, test_f1: 0.4845
 epoch: 87, train_loss: 0.9653, test_loss: 0.9234, test_f1: 0.4827
 epoch: 88, train_loss: 0.9611, test_loss: 0.9219, test_f1: 0.4993
 epoch: 89, train_loss: 0.9694, test_loss: 0.9409, test_f1: 0.4824
 epoch: 90, train_loss: 0.9694, test_loss: 0.9528, test_f1: 0.5048
 epoch: 91, train_loss: 0.9648, test_loss: 0.9317, test_f1: 0.4665
 epoch: 92, train_loss: 0.9706, test_loss: 0.9216, test_f1: 0.4965
 epoch: 93, train_loss: 0.9683, test_loss: 0.9284, test_f1: 0.4768
 epoch: 94, train_loss: 0.9732, test_loss: 1.1776, test_f1: 0.4759
 epoch: 95, train_loss: 0.9863, test_loss: 1.2728, test_f1: 0.4747
 epoch: 96, train_loss: 0.9734, test_loss: 0.9733, test_f1: 0.4738
 epoch: 97, train_loss: 0.9788, test_loss: 0.9707, test_f1: 0.4788
 epoch: 98, train_loss: 0.9743, test_loss: 1.0070, test_f1: 0.4630
 epoch: 99, train_loss: 0.9646, test_loss: 0.9482, test_f1: 0.4980
##################ITERATION #9 ****************************************
 epoch: 0, train_loss: 1.3056, test_loss: 1.7345, test_f1: 0.2260
 epoch: 1, train_loss: 1.1758, test_loss: 1.1548, test_f1: 0.3373
 epoch: 2, train_loss: 1.1283, test_loss: 1.1162, test_f1: 0.3422
 epoch: 3, train_loss: 1.1085, test_loss: 1.1303, test_f1: 0.3447
 epoch: 4, train_loss: 1.0796, test_loss: 1.0399, test_f1: 0.3542
 epoch: 5, train_loss: 1.0754, test_loss: 1.5239, test_f1: 0.3339
 epoch: 6, train_loss: 1.0734, test_loss: 1.4453, test_f1: 0.3937
 epoch: 7, train_loss: 1.0621, test_loss: 1.2908, test_f1: 0.3347
 epoch: 8, train_loss: 1.0415, test_loss: 1.3041, test_f1: 0.3457
 epoch: 9, train_loss: 1.0370, test_loss: 1.2403, test_f1: 0.3447
 epoch: 10, train_loss: 1.0371, test_loss: 1.0159, test_f1: 0.3738
 epoch: 11, train_loss: 1.0393, test_loss: 1.0965, test_f1: 0.4375
 epoch: 12, train_loss: 1.0523, test_loss: 1.2467, test_f1: 0.3804
 epoch: 13, train_loss: 1.0581, test_loss: 1.1971, test_f1: 0.3876
 epoch: 14, train_loss: 1.0583, test_loss: 1.0674, test_f1: 0.3371
 epoch: 15, train_loss: 1.0320, test_loss: 1.3737, test_f1: 0.3530
 epoch: 16, train_loss: 1.0357, test_loss: 1.1999, test_f1: 0.3679
 epoch: 17, train_loss: 1.0141, test_loss: 1.2809, test_f1: 0.4239
 epoch: 18, train_loss: 1.0066, test_loss: 1.1491, test_f1: 0.4649
 epoch: 19, train_loss: 1.0190, test_loss: 1.3411, test_f1: 0.3668
 epoch: 20, train_loss: 1.0084, test_loss: 1.4705, test_f1: 0.3413
 epoch: 21, train_loss: 1.0106, test_loss: 1.3218, test_f1: 0.3450
 epoch: 22, train_loss: 1.0086, test_loss: 1.1958, test_f1: 0.3335
 epoch: 23, train_loss: 0.9963, test_loss: 1.5385, test_f1: 0.3510
 epoch: 24, train_loss: 0.9935, test_loss: 1.1526, test_f1: 0.3875
 epoch: 25, train_loss: 0.9874, test_loss: 1.3132, test_f1: 0.3822
 epoch: 26, train_loss: 1.0074, test_loss: 1.5558, test_f1: 0.3898
 epoch: 27, train_loss: 1.0125, test_loss: 1.3085, test_f1: 0.4776
 epoch: 28, train_loss: 1.0320, test_loss: 1.0837, test_f1: 0.3471
 epoch: 29, train_loss: 1.0176, test_loss: 1.0699, test_f1: 0.3476
 epoch: 30, train_loss: 0.9902, test_loss: 1.1476, test_f1: 0.4055
 epoch: 31, train_loss: 0.9950, test_loss: 1.3279, test_f1: 0.4513
 epoch: 32, train_loss: 0.9905, test_loss: 1.1654, test_f1: 0.3536
 epoch: 33, train_loss: 0.9850, test_loss: 1.3100, test_f1: 0.4803
 epoch: 34, train_loss: 0.9999, test_loss: 1.2140, test_f1: 0.3643
 epoch: 35, train_loss: 0.9839, test_loss: 1.1059, test_f1: 0.3829
 epoch: 36, train_loss: 0.9966, test_loss: 1.4040, test_f1: 0.3784
 epoch: 37, train_loss: 0.9875, test_loss: 1.0415, test_f1: 0.3844
 epoch: 38, train_loss: 1.0029, test_loss: 1.1179, test_f1: 0.4720
 epoch: 39, train_loss: 0.9971, test_loss: 1.0505, test_f1: 0.3521
 epoch: 40, train_loss: 0.9923, test_loss: 1.1482, test_f1: 0.3457
 epoch: 41, train_loss: 0.9929, test_loss: 1.1923, test_f1: 0.3747
 epoch: 42, train_loss: 0.9954, test_loss: 1.0464, test_f1: 0.3606
 epoch: 43, train_loss: 0.9851, test_loss: 1.1757, test_f1: 0.4797
 epoch: 44, train_loss: 0.9738, test_loss: 1.3891, test_f1: 0.4609
 epoch: 45, train_loss: 0.9767, test_loss: 1.3997, test_f1: 0.3631
 epoch: 46, train_loss: 0.9919, test_loss: 1.1343, test_f1: 0.3602
 epoch: 47, train_loss: 0.9889, test_loss: 1.0993, test_f1: 0.3526
 epoch: 48, train_loss: 0.9783, test_loss: 1.1660, test_f1: 0.3475
 epoch: 49, train_loss: 0.9790, test_loss: 1.2298, test_f1: 0.5094
 epoch: 50, train_loss: 0.9783, test_loss: 1.1363, test_f1: 0.3457
 epoch: 51, train_loss: 0.9739, test_loss: 1.4300, test_f1: 0.4893
 epoch: 52, train_loss: 0.9638, test_loss: 1.4460, test_f1: 0.4908
 epoch: 53, train_loss: 0.9672, test_loss: 1.1204, test_f1: 0.4887
 epoch: 54, train_loss: 0.9580, test_loss: 1.1746, test_f1: 0.4000
 epoch: 55, train_loss: 0.9513, test_loss: 1.1898, test_f1: 0.4095
 epoch: 56, train_loss: 0.9559, test_loss: 1.3343, test_f1: 0.4370
 epoch: 57, train_loss: 0.9408, test_loss: 1.3087, test_f1: 0.5186
 epoch: 58, train_loss: 0.9472, test_loss: 1.4091, test_f1: 0.5138
 epoch: 59, train_loss: 0.9454, test_loss: 1.5773, test_f1: 0.3792
 epoch: 60, train_loss: 0.9418, test_loss: 1.5095, test_f1: 0.5110
 epoch: 61, train_loss: 0.9487, test_loss: 1.4228, test_f1: 0.3888
 epoch: 62, train_loss: 0.9564, test_loss: 1.4871, test_f1: 0.4958
 epoch: 63, train_loss: 0.9516, test_loss: 1.3899, test_f1: 0.5064
 epoch: 64, train_loss: 0.9326, test_loss: 1.3066, test_f1: 0.5105
 epoch: 65, train_loss: 0.9417, test_loss: 1.3501, test_f1: 0.4212
 epoch: 66, train_loss: 0.9400, test_loss: 1.5951, test_f1: 0.5174
 epoch: 67, train_loss: 0.9388, test_loss: 1.2199, test_f1: 0.3923
 epoch: 68, train_loss: 0.9430, test_loss: 1.2071, test_f1: 0.5144
 epoch: 69, train_loss: 0.9532, test_loss: 1.2213, test_f1: 0.5023
 epoch: 70, train_loss: 0.9338, test_loss: 1.2931, test_f1: 0.5167
 epoch: 71, train_loss: 0.9406, test_loss: 1.2886, test_f1: 0.5105
 epoch: 72, train_loss: 0.9348, test_loss: 1.5642, test_f1: 0.5228
 epoch: 73, train_loss: 0.9324, test_loss: 1.6362, test_f1: 0.4941
 epoch: 74, train_loss: 0.9481, test_loss: 1.3016, test_f1: 0.5165
 epoch: 75, train_loss: 0.9332, test_loss: 1.3538, test_f1: 0.5127
 epoch: 76, train_loss: 0.9397, test_loss: 1.4625, test_f1: 0.3849
 epoch: 77, train_loss: 0.9244, test_loss: 1.3280, test_f1: 0.5200
 epoch: 78, train_loss: 0.9395, test_loss: 1.2760, test_f1: 0.5075
 epoch: 79, train_loss: 0.9316, test_loss: 1.3899, test_f1: 0.5298
 epoch: 80, train_loss: 0.9296, test_loss: 1.4757, test_f1: 0.5108
 epoch: 81, train_loss: 0.9207, test_loss: 1.5318, test_f1: 0.5258
 epoch: 82, train_loss: 0.9215, test_loss: 1.5936, test_f1: 0.5201
 epoch: 83, train_loss: 0.9365, test_loss: 1.5475, test_f1: 0.5223
 epoch: 84, train_loss: 0.9346, test_loss: 1.2603, test_f1: 0.5296
 epoch: 85, train_loss: 0.9420, test_loss: 1.2661, test_f1: 0.5070
 epoch: 86, train_loss: 0.9549, test_loss: 1.5017, test_f1: 0.4621
 epoch: 87, train_loss: 0.9483, test_loss: 1.3737, test_f1: 0.4804
 epoch: 88, train_loss: 0.9379, test_loss: 1.4168, test_f1: 0.4909
 epoch: 89, train_loss: 0.9391, test_loss: 1.2836, test_f1: 0.5223
 epoch: 90, train_loss: 0.9330, test_loss: 1.4529, test_f1: 0.4336
 epoch: 91, train_loss: 0.9373, test_loss: 1.3580, test_f1: 0.5128
 epoch: 92, train_loss: 0.9449, test_loss: 1.2970, test_f1: 0.5171
 epoch: 93, train_loss: 0.9324, test_loss: 1.3795, test_f1: 0.4969
 epoch: 94, train_loss: 0.9510, test_loss: 1.2928, test_f1: 0.5107
 epoch: 95, train_loss: 0.9439, test_loss: 1.3697, test_f1: 0.5198
 epoch: 96, train_loss: 0.9270, test_loss: 1.8485, test_f1: 0.4682
 epoch: 97, train_loss: 0.9256, test_loss: 1.5382, test_f1: 0.5216
 epoch: 98, train_loss: 0.9244, test_loss: 1.5155, test_f1: 0.5301
 epoch: 99, train_loss: 0.9319, test_loss: 1.3373, test_f1: 0.5033

Training completed in 397.79 seconds
Best F1: 0.5849 at epoch 97
Mean F1 across iterations: 0.3397  0.1443
========================FINAL RESULTS================================
FEGIN weighted F1: 0.5849  0.1443
python main.py --data ltspice_examples --representation component_pin --model FEGIN --layers 3 --hiddens 16 --batch_size 256 --lr 0.1 --emb_size 128 --epochs 100 --save_appendix component_pin_L3_H16_BS256_LR0.1_E128 --no_val
-----



STDERR:
  File "main.py", line 370, in <module>
    main()
  File "main.py", line 254, in main
    dataset = dataset_class(
  File "/home/philip/projects/ltspice_examples_code_repo/Circuit-Completion-Using-GNNs/component_classification_with_link_prediction_head/evaluation/FEGIN/kernel/circuit_datasets.py", line 15, in __init__
    self.data, self.slices = torch.load(self.processed_paths[0])
  File "/home/philip/.local/lib/python3.8/site-packages/torch/serialization.py", line 1040, in load
    warnings.warn(
  File "/usr/lib/python3.8/warnings.py", line 109, in _showwarnmsg
    sw(msg.message, msg.category, msg.filename, msg.lineno,
  File "main.py", line 47, in warn_with_traceback
    traceback.print_stack(file=log)
/home/philip/projects/ltspice_examples_code_repo/Circuit-Completion-Using-GNNs/component_classification_with_link_prediction_head/evaluation/FEGIN/kernel/circuit_datasets.py:15: FutureWarning: You are using `torch.load` with `weights_only=False` (the current default value), which uses the default pickle module implicitly. It is possible to construct malicious pickle data which will execute arbitrary code during unpickling (See https://github.com/pytorch/pytorch/blob/main/SECURITY.md#untrusted-models for more details). In a future release, the default value for `weights_only` will be flipped to `True`. This limits the functions that could be executed during unpickling. Arbitrary objects will no longer be allowed to be loaded via this mode unless they are explicitly allowlisted by the user via `torch.serialization.add_safe_globals`. We recommend you start setting `weights_only=True` for any use case where you don't have full control of the loaded file. Please open an issue on GitHub for any issues related to this experimental feature.
  self.data, self.slices = torch.load(self.processed_paths[0])
