STDOUT:
Results will be saved in /home/philip/projects/ltspice_examples_code_repo/Circuit-Completion-Using-GNNs/component_classification_with_link_prediction_head/evaluation/FEGIN/results/model_FEGIN_dataset_ltspice_demos
Command line input: python main.py --data ltspice_demos --representation component_net --model FEGIN --layers 5 --hiddens 64 --batch_size 64 --lr 0.001 --emb_size 512 --epochs 100 --save_appendix component_net_L5_H64_BS64_LR0.001_E512 --no_val
 is saved.
-----
ltspice_demos - FEGIN
Using 5 layers, 64 hidden units, h = 2
Loading component_net representation dataset
ENTERED
Training FEGIN on component_net representation
Train: 1565, Test: 383
##################ITERATION #0 ****************************************
 epoch: 0, train_loss: 1.2653, test_loss: 1.3155, test_f1: 0.1365
 epoch: 1, train_loss: 1.1510, test_loss: 1.2362, test_f1: 0.3434
 epoch: 2, train_loss: 1.0997, test_loss: 1.1565, test_f1: 0.4399
 epoch: 3, train_loss: 1.0735, test_loss: 1.1347, test_f1: 0.4767
 epoch: 4, train_loss: 1.0196, test_loss: 1.0898, test_f1: 0.4761
 epoch: 5, train_loss: 0.9883, test_loss: 1.0379, test_f1: 0.5132
 epoch: 6, train_loss: 0.9690, test_loss: 1.0661, test_f1: 0.5346
 epoch: 7, train_loss: 0.9401, test_loss: 1.0715, test_f1: 0.5304
 epoch: 8, train_loss: 0.9224, test_loss: 1.0444, test_f1: 0.5456
 epoch: 9, train_loss: 0.9268, test_loss: 1.1365, test_f1: 0.5366
 epoch: 10, train_loss: 0.8820, test_loss: 1.0448, test_f1: 0.5662
 epoch: 11, train_loss: 0.8564, test_loss: 1.0988, test_f1: 0.5785
 epoch: 12, train_loss: 0.8551, test_loss: 1.0930, test_f1: 0.5928
 epoch: 13, train_loss: 0.8648, test_loss: 1.1198, test_f1: 0.5619
 epoch: 14, train_loss: 0.8416, test_loss: 1.1202, test_f1: 0.5729
 epoch: 15, train_loss: 0.8204, test_loss: 1.1451, test_f1: 0.5841
 epoch: 16, train_loss: 0.7995, test_loss: 1.1667, test_f1: 0.5919
 epoch: 17, train_loss: 0.8011, test_loss: 1.2665, test_f1: 0.5859
 epoch: 18, train_loss: 0.7972, test_loss: 1.1879, test_f1: 0.5682
 epoch: 19, train_loss: 0.7723, test_loss: 1.1410, test_f1: 0.5821
 epoch: 20, train_loss: 0.7978, test_loss: 1.1770, test_f1: 0.5891
 epoch: 21, train_loss: 0.7565, test_loss: 1.1523, test_f1: 0.6121
 epoch: 22, train_loss: 0.7470, test_loss: 1.2275, test_f1: 0.6254
 epoch: 23, train_loss: 0.7284, test_loss: 1.3036, test_f1: 0.5679
 epoch: 24, train_loss: 0.7157, test_loss: 1.1909, test_f1: 0.6457
 epoch: 25, train_loss: 0.7193, test_loss: 1.2497, test_f1: 0.6265
 epoch: 26, train_loss: 0.6862, test_loss: 1.1860, test_f1: 0.6083
 epoch: 27, train_loss: 0.6584, test_loss: 1.1858, test_f1: 0.6514
 epoch: 28, train_loss: 0.6728, test_loss: 1.3961, test_f1: 0.6013
 epoch: 29, train_loss: 0.6726, test_loss: 1.5612, test_f1: 0.5777
 epoch: 30, train_loss: 0.6439, test_loss: 1.2957, test_f1: 0.6207
 epoch: 31, train_loss: 0.6635, test_loss: 1.5034, test_f1: 0.5940
 epoch: 32, train_loss: 0.6412, test_loss: 1.4193, test_f1: 0.6235
 epoch: 33, train_loss: 0.6468, test_loss: 1.4040, test_f1: 0.6155
 epoch: 34, train_loss: 0.6278, test_loss: 1.6091, test_f1: 0.5625
 epoch: 35, train_loss: 0.6043, test_loss: 1.3875, test_f1: 0.6034
 epoch: 36, train_loss: 0.5896, test_loss: 1.5252, test_f1: 0.5812
 epoch: 37, train_loss: 0.5699, test_loss: 1.6084, test_f1: 0.5925
 epoch: 38, train_loss: 0.5572, test_loss: 1.5425, test_f1: 0.6325
 epoch: 39, train_loss: 0.5528, test_loss: 1.6795, test_f1: 0.6092
 epoch: 40, train_loss: 0.5561, test_loss: 1.4602, test_f1: 0.6264
 epoch: 41, train_loss: 0.5280, test_loss: 1.6676, test_f1: 0.5918
 epoch: 42, train_loss: 0.5084, test_loss: 1.7011, test_f1: 0.5659
 epoch: 43, train_loss: 0.5352, test_loss: 1.7619, test_f1: 0.5980
 epoch: 44, train_loss: 0.5015, test_loss: 1.6949, test_f1: 0.5971
 epoch: 45, train_loss: 0.4994, test_loss: 1.8211, test_f1: 0.5607
 epoch: 46, train_loss: 0.5199, test_loss: 2.0433, test_f1: 0.5866
 epoch: 47, train_loss: 0.4619, test_loss: 2.1482, test_f1: 0.5585
 epoch: 48, train_loss: 0.4741, test_loss: 1.8743, test_f1: 0.5941
 epoch: 49, train_loss: 0.4558, test_loss: 2.1390, test_f1: 0.5977
 epoch: 50, train_loss: 0.4581, test_loss: 1.9999, test_f1: 0.5701
 epoch: 51, train_loss: 0.4329, test_loss: 1.9740, test_f1: 0.6119
 epoch: 52, train_loss: 0.3936, test_loss: 1.9788, test_f1: 0.6258
 epoch: 53, train_loss: 0.3881, test_loss: 1.9862, test_f1: 0.6154
 epoch: 54, train_loss: 0.3903, test_loss: 2.0475, test_f1: 0.6163
 epoch: 55, train_loss: 0.3813, test_loss: 2.2305, test_f1: 0.5941
 epoch: 56, train_loss: 0.3727, test_loss: 2.3441, test_f1: 0.5732
 epoch: 57, train_loss: 0.3454, test_loss: 2.2473, test_f1: 0.6021
 epoch: 58, train_loss: 0.3420, test_loss: 2.2399, test_f1: 0.5983
 epoch: 59, train_loss: 0.3493, test_loss: 2.4923, test_f1: 0.5949
 epoch: 60, train_loss: 0.3398, test_loss: 2.3970, test_f1: 0.6044
 epoch: 61, train_loss: 0.3471, test_loss: 2.5957, test_f1: 0.5922
 epoch: 62, train_loss: 0.3554, test_loss: 2.6200, test_f1: 0.5582
 epoch: 63, train_loss: 0.3297, test_loss: 2.6447, test_f1: 0.5847
 epoch: 64, train_loss: 0.3373, test_loss: 2.5338, test_f1: 0.5976
 epoch: 65, train_loss: 0.3073, test_loss: 2.7270, test_f1: 0.5764
 epoch: 66, train_loss: 0.2837, test_loss: 2.6160, test_f1: 0.5724
 epoch: 67, train_loss: 0.3138, test_loss: 2.8659, test_f1: 0.5640
 epoch: 68, train_loss: 0.3355, test_loss: 2.6217, test_f1: 0.5873
 epoch: 69, train_loss: 0.3080, test_loss: 2.7838, test_f1: 0.5585
 epoch: 70, train_loss: 0.3117, test_loss: 2.8654, test_f1: 0.6089
 epoch: 71, train_loss: 0.3431, test_loss: 2.7232, test_f1: 0.6203
 epoch: 72, train_loss: 0.3160, test_loss: 2.6788, test_f1: 0.5769
 epoch: 73, train_loss: 0.3074, test_loss: 2.8973, test_f1: 0.6080
 epoch: 74, train_loss: 0.3054, test_loss: 2.6636, test_f1: 0.6170
 epoch: 75, train_loss: 0.3289, test_loss: 2.8918, test_f1: 0.5933
 epoch: 76, train_loss: 0.3027, test_loss: 2.9994, test_f1: 0.5807
 epoch: 77, train_loss: 0.2708, test_loss: 2.8249, test_f1: 0.5883
 epoch: 78, train_loss: 0.2714, test_loss: 2.8737, test_f1: 0.5972
 epoch: 79, train_loss: 0.2764, test_loss: 3.0737, test_f1: 0.5840
 epoch: 80, train_loss: 0.2492, test_loss: 2.9568, test_f1: 0.5831
 epoch: 81, train_loss: 0.2543, test_loss: 2.9476, test_f1: 0.5964
 epoch: 82, train_loss: 0.2768, test_loss: 3.2502, test_f1: 0.5898
 epoch: 83, train_loss: 0.2644, test_loss: 3.0710, test_f1: 0.5788
 epoch: 84, train_loss: 0.2779, test_loss: 3.4328, test_f1: 0.5664
 epoch: 85, train_loss: 0.2562, test_loss: 3.3285, test_f1: 0.5873
 epoch: 86, train_loss: 0.2453, test_loss: 3.3167, test_f1: 0.5878
 epoch: 87, train_loss: 0.2854, test_loss: 3.0101, test_f1: 0.5647
 epoch: 88, train_loss: 0.2612, test_loss: 3.2163, test_f1: 0.5755
 epoch: 89, train_loss: 0.2494, test_loss: 3.1254, test_f1: 0.5916
 epoch: 90, train_loss: 0.2535, test_loss: 3.4710, test_f1: 0.5841
 epoch: 91, train_loss: 0.2469, test_loss: 3.4866, test_f1: 0.6012
 epoch: 92, train_loss: 0.2216, test_loss: 3.5880, test_f1: 0.6047
 epoch: 93, train_loss: 0.2574, test_loss: 3.3546, test_f1: 0.5814
 epoch: 94, train_loss: 0.2284, test_loss: 3.3731, test_f1: 0.5696
 epoch: 95, train_loss: 0.1999, test_loss: 3.7640, test_f1: 0.5808
 epoch: 96, train_loss: 0.2225, test_loss: 3.7280, test_f1: 0.5754
 epoch: 97, train_loss: 0.2258, test_loss: 3.6746, test_f1: 0.5614
 epoch: 98, train_loss: 0.2168, test_loss: 3.6601, test_f1: 0.5567
 epoch: 99, train_loss: 0.2194, test_loss: 3.8221, test_f1: 0.5774
##################ITERATION #1 ****************************************
 epoch: 0, train_loss: 1.1833, test_loss: 1.3436, test_f1: 0.2250
 epoch: 1, train_loss: 1.0415, test_loss: 1.1384, test_f1: 0.4231
 epoch: 2, train_loss: 1.0127, test_loss: 1.0283, test_f1: 0.5189
 epoch: 3, train_loss: 0.9715, test_loss: 1.0713, test_f1: 0.5300
 epoch: 4, train_loss: 0.9444, test_loss: 1.0379, test_f1: 0.5233
 epoch: 5, train_loss: 0.9421, test_loss: 1.1295, test_f1: 0.5428
 epoch: 6, train_loss: 0.9015, test_loss: 1.0873, test_f1: 0.5054
 epoch: 7, train_loss: 0.8917, test_loss: 1.1017, test_f1: 0.4839
 epoch: 8, train_loss: 0.8727, test_loss: 1.1320, test_f1: 0.5416
 epoch: 9, train_loss: 0.8658, test_loss: 1.0570, test_f1: 0.5588
 epoch: 10, train_loss: 0.8557, test_loss: 1.0598, test_f1: 0.5627
 epoch: 11, train_loss: 0.8430, test_loss: 1.0863, test_f1: 0.5356
 epoch: 12, train_loss: 0.8301, test_loss: 1.1039, test_f1: 0.5350
 epoch: 13, train_loss: 0.8360, test_loss: 1.0713, test_f1: 0.5737
 epoch: 14, train_loss: 0.7980, test_loss: 1.1893, test_f1: 0.5860
 epoch: 15, train_loss: 0.7902, test_loss: 1.1375, test_f1: 0.5562
 epoch: 16, train_loss: 0.7914, test_loss: 1.1751, test_f1: 0.5732
 epoch: 17, train_loss: 0.7856, test_loss: 1.1784, test_f1: 0.5839
 epoch: 18, train_loss: 0.7735, test_loss: 1.2206, test_f1: 0.5923
 epoch: 19, train_loss: 0.7457, test_loss: 1.2028, test_f1: 0.5915
 epoch: 20, train_loss: 0.7562, test_loss: 1.1424, test_f1: 0.5875
 epoch: 21, train_loss: 0.7413, test_loss: 1.1284, test_f1: 0.5714
 epoch: 22, train_loss: 0.7198, test_loss: 1.2972, test_f1: 0.5600
 epoch: 23, train_loss: 0.7084, test_loss: 1.2478, test_f1: 0.5897
 epoch: 24, train_loss: 0.6721, test_loss: 1.2340, test_f1: 0.6001
 epoch: 25, train_loss: 0.6842, test_loss: 1.2488, test_f1: 0.5800
 epoch: 26, train_loss: 0.6740, test_loss: 1.4076, test_f1: 0.5938
 epoch: 27, train_loss: 0.6588, test_loss: 1.4420, test_f1: 0.5727
 epoch: 28, train_loss: 0.6250, test_loss: 1.5250, test_f1: 0.5905
 epoch: 29, train_loss: 0.6511, test_loss: 1.3147, test_f1: 0.6023
 epoch: 30, train_loss: 0.6398, test_loss: 1.5130, test_f1: 0.5583
 epoch: 31, train_loss: 0.6171, test_loss: 1.2873, test_f1: 0.6090
 epoch: 32, train_loss: 0.6193, test_loss: 1.4296, test_f1: 0.5594
 epoch: 33, train_loss: 0.6296, test_loss: 1.4455, test_f1: 0.5790
 epoch: 34, train_loss: 0.5977, test_loss: 1.4118, test_f1: 0.5724
 epoch: 35, train_loss: 0.5649, test_loss: 1.4801, test_f1: 0.5737
 epoch: 36, train_loss: 0.5530, test_loss: 1.4932, test_f1: 0.5976
 epoch: 37, train_loss: 0.5415, test_loss: 1.6356, test_f1: 0.5858
 epoch: 38, train_loss: 0.5469, test_loss: 1.6752, test_f1: 0.5921
 epoch: 39, train_loss: 0.5395, test_loss: 1.6864, test_f1: 0.5668
 epoch: 40, train_loss: 0.5494, test_loss: 1.6592, test_f1: 0.5430
 epoch: 41, train_loss: 0.5506, test_loss: 1.5252, test_f1: 0.6095
 epoch: 42, train_loss: 0.5264, test_loss: 1.8541, test_f1: 0.5728
 epoch: 43, train_loss: 0.4832, test_loss: 1.7944, test_f1: 0.5542
 epoch: 44, train_loss: 0.4918, test_loss: 1.8371, test_f1: 0.5859
 epoch: 45, train_loss: 0.4773, test_loss: 1.7500, test_f1: 0.5922
 epoch: 46, train_loss: 0.5218, test_loss: 1.7857, test_f1: 0.5261
 epoch: 47, train_loss: 0.5655, test_loss: 1.6305, test_f1: 0.6004
 epoch: 48, train_loss: 0.4949, test_loss: 1.7265, test_f1: 0.5798
 epoch: 49, train_loss: 0.4546, test_loss: 1.4793, test_f1: 0.6369
 epoch: 50, train_loss: 0.4332, test_loss: 1.6422, test_f1: 0.6171
 epoch: 51, train_loss: 0.4166, test_loss: 1.8624, test_f1: 0.6013
 epoch: 52, train_loss: 0.3989, test_loss: 1.9019, test_f1: 0.5927
 epoch: 53, train_loss: 0.3762, test_loss: 1.9236, test_f1: 0.6066
 epoch: 54, train_loss: 0.3702, test_loss: 1.9071, test_f1: 0.6235
 epoch: 55, train_loss: 0.3728, test_loss: 1.8996, test_f1: 0.6156
 epoch: 56, train_loss: 0.3462, test_loss: 1.9642, test_f1: 0.5771
 epoch: 57, train_loss: 0.3317, test_loss: 1.9427, test_f1: 0.6147
 epoch: 58, train_loss: 0.3318, test_loss: 2.0198, test_f1: 0.5964
 epoch: 59, train_loss: 0.3418, test_loss: 2.1624, test_f1: 0.5977
 epoch: 60, train_loss: 0.3119, test_loss: 2.1830, test_f1: 0.6173
 epoch: 61, train_loss: 0.3174, test_loss: 2.1526, test_f1: 0.5893
 epoch: 62, train_loss: 0.3184, test_loss: 2.1450, test_f1: 0.5942
 epoch: 63, train_loss: 0.2942, test_loss: 2.2117, test_f1: 0.5973
 epoch: 64, train_loss: 0.2954, test_loss: 2.2345, test_f1: 0.6070
 epoch: 65, train_loss: 0.3021, test_loss: 2.2630, test_f1: 0.6079
 epoch: 66, train_loss: 0.3125, test_loss: 2.2490, test_f1: 0.6095
 epoch: 67, train_loss: 0.3020, test_loss: 2.2968, test_f1: 0.5928
 epoch: 68, train_loss: 0.3053, test_loss: 2.3252, test_f1: 0.5984
 epoch: 69, train_loss: 0.2974, test_loss: 2.4752, test_f1: 0.5857
 epoch: 70, train_loss: 0.3164, test_loss: 2.5092, test_f1: 0.5918
 epoch: 71, train_loss: 0.2697, test_loss: 2.5276, test_f1: 0.5915
 epoch: 72, train_loss: 0.2778, test_loss: 2.7610, test_f1: 0.5721
 epoch: 73, train_loss: 0.3006, test_loss: 2.4339, test_f1: 0.5904
 epoch: 74, train_loss: 0.2953, test_loss: 2.5162, test_f1: 0.5821
 epoch: 75, train_loss: 0.3054, test_loss: 2.5086, test_f1: 0.6148
 epoch: 76, train_loss: 0.3059, test_loss: 2.5053, test_f1: 0.5885
 epoch: 77, train_loss: 0.2764, test_loss: 2.6030, test_f1: 0.5986
 epoch: 78, train_loss: 0.2740, test_loss: 2.5388, test_f1: 0.6107
 epoch: 79, train_loss: 0.2689, test_loss: 2.7421, test_f1: 0.5814
 epoch: 80, train_loss: 0.2718, test_loss: 2.5739, test_f1: 0.6249
 epoch: 81, train_loss: 0.2463, test_loss: 2.6556, test_f1: 0.5747
 epoch: 82, train_loss: 0.2395, test_loss: 2.6425, test_f1: 0.5934
 epoch: 83, train_loss: 0.2510, test_loss: 2.8640, test_f1: 0.5775
 epoch: 84, train_loss: 0.2348, test_loss: 2.6655, test_f1: 0.5964
 epoch: 85, train_loss: 0.2316, test_loss: 2.8307, test_f1: 0.5804
 epoch: 86, train_loss: 0.2366, test_loss: 2.8318, test_f1: 0.5940
 epoch: 87, train_loss: 0.2341, test_loss: 2.9099, test_f1: 0.5850
 epoch: 88, train_loss: 0.2316, test_loss: 2.9902, test_f1: 0.5918
 epoch: 89, train_loss: 0.2298, test_loss: 2.9305, test_f1: 0.5909
 epoch: 90, train_loss: 0.2283, test_loss: 3.0067, test_f1: 0.5894
 epoch: 91, train_loss: 0.2526, test_loss: 3.2380, test_f1: 0.5764
 epoch: 92, train_loss: 0.2347, test_loss: 3.1227, test_f1: 0.5878
 epoch: 93, train_loss: 0.1956, test_loss: 3.0620, test_f1: 0.5806
 epoch: 94, train_loss: 0.2204, test_loss: 3.0627, test_f1: 0.5867
 epoch: 95, train_loss: 0.2358, test_loss: 3.0952, test_f1: 0.5749
 epoch: 96, train_loss: 0.2235, test_loss: 3.0791, test_f1: 0.5879
 epoch: 97, train_loss: 0.2190, test_loss: 3.3217, test_f1: 0.5706
 epoch: 98, train_loss: 0.2105, test_loss: 2.9992, test_f1: 0.5979
 epoch: 99, train_loss: 0.2110, test_loss: 3.1375, test_f1: 0.5957
##################ITERATION #2 ****************************************
 epoch: 0, train_loss: 1.2202, test_loss: 1.2791, test_f1: 0.2980
 epoch: 1, train_loss: 1.0771, test_loss: 1.1838, test_f1: 0.4632
 epoch: 2, train_loss: 1.0277, test_loss: 1.1705, test_f1: 0.4815
 epoch: 3, train_loss: 0.9994, test_loss: 1.1456, test_f1: 0.5027
 epoch: 4, train_loss: 0.9596, test_loss: 1.0864, test_f1: 0.5166
 epoch: 5, train_loss: 0.9345, test_loss: 1.1720, test_f1: 0.5234
 epoch: 6, train_loss: 0.9238, test_loss: 1.1414, test_f1: 0.5209
 epoch: 7, train_loss: 0.9192, test_loss: 1.1806, test_f1: 0.5493
 epoch: 8, train_loss: 0.8973, test_loss: 1.0836, test_f1: 0.5587
 epoch: 9, train_loss: 0.8722, test_loss: 1.1542, test_f1: 0.5676
 epoch: 10, train_loss: 0.8664, test_loss: 1.0887, test_f1: 0.5710
 epoch: 11, train_loss: 0.8454, test_loss: 1.2350, test_f1: 0.5413
 epoch: 12, train_loss: 0.8472, test_loss: 1.1666, test_f1: 0.5940
 epoch: 13, train_loss: 0.8238, test_loss: 1.3005, test_f1: 0.5513
 epoch: 14, train_loss: 0.8159, test_loss: 1.2159, test_f1: 0.5727
 epoch: 15, train_loss: 0.7931, test_loss: 1.1773, test_f1: 0.5522
 epoch: 16, train_loss: 0.7733, test_loss: 1.3286, test_f1: 0.5920
 epoch: 17, train_loss: 0.7764, test_loss: 1.4056, test_f1: 0.5165
 epoch: 18, train_loss: 0.7650, test_loss: 1.2798, test_f1: 0.5610
 epoch: 19, train_loss: 0.7538, test_loss: 1.5503, test_f1: 0.4544
 epoch: 20, train_loss: 0.7262, test_loss: 1.4623, test_f1: 0.5249
 epoch: 21, train_loss: 0.7574, test_loss: 1.3928, test_f1: 0.5912
 epoch: 22, train_loss: 0.7170, test_loss: 1.3706, test_f1: 0.5263
 epoch: 23, train_loss: 0.7416, test_loss: 1.2715, test_f1: 0.5979
 epoch: 24, train_loss: 0.7151, test_loss: 1.3740, test_f1: 0.5332
 epoch: 25, train_loss: 0.7127, test_loss: 1.3698, test_f1: 0.5431
 epoch: 26, train_loss: 0.7018, test_loss: 1.4664, test_f1: 0.5628
 epoch: 27, train_loss: 0.6899, test_loss: 1.5856, test_f1: 0.5331
 epoch: 28, train_loss: 0.6678, test_loss: 1.4721, test_f1: 0.5643
 epoch: 29, train_loss: 0.6452, test_loss: 1.3922, test_f1: 0.5852
 epoch: 30, train_loss: 0.6403, test_loss: 1.5515, test_f1: 0.6011
 epoch: 31, train_loss: 0.6413, test_loss: 1.6775, test_f1: 0.5726
 epoch: 32, train_loss: 0.6202, test_loss: 1.6009, test_f1: 0.5800
 epoch: 33, train_loss: 0.6103, test_loss: 1.6694, test_f1: 0.5331
 epoch: 34, train_loss: 0.6223, test_loss: 1.8442, test_f1: 0.5292
 epoch: 35, train_loss: 0.5813, test_loss: 1.6475, test_f1: 0.5879
 epoch: 36, train_loss: 0.6148, test_loss: 1.6949, test_f1: 0.5537
 epoch: 37, train_loss: 0.6083, test_loss: 1.6129, test_f1: 0.5819
 epoch: 38, train_loss: 0.5977, test_loss: 1.4982, test_f1: 0.6037
 epoch: 39, train_loss: 0.6062, test_loss: 1.6493, test_f1: 0.5557
 epoch: 40, train_loss: 0.5742, test_loss: 1.4572, test_f1: 0.5878
 epoch: 41, train_loss: 0.5645, test_loss: 1.7314, test_f1: 0.5687
 epoch: 42, train_loss: 0.5449, test_loss: 1.5552, test_f1: 0.5353
 epoch: 43, train_loss: 0.5376, test_loss: 2.0049, test_f1: 0.5449
 epoch: 44, train_loss: 0.5390, test_loss: 1.7286, test_f1: 0.5846
 epoch: 45, train_loss: 0.5253, test_loss: 1.9651, test_f1: 0.4716
 epoch: 46, train_loss: 0.5288, test_loss: 1.9265, test_f1: 0.5760
 epoch: 47, train_loss: 0.5143, test_loss: 1.7333, test_f1: 0.6041
 epoch: 48, train_loss: 0.4855, test_loss: 1.8625, test_f1: 0.5920
 epoch: 49, train_loss: 0.4507, test_loss: 1.8749, test_f1: 0.5935
 epoch: 50, train_loss: 0.4372, test_loss: 1.9664, test_f1: 0.6018
 epoch: 51, train_loss: 0.4375, test_loss: 1.7819, test_f1: 0.6057
 epoch: 52, train_loss: 0.3903, test_loss: 1.8498, test_f1: 0.6407
 epoch: 53, train_loss: 0.3848, test_loss: 1.9478, test_f1: 0.5853
 epoch: 54, train_loss: 0.3722, test_loss: 1.9618, test_f1: 0.6073
 epoch: 55, train_loss: 0.3682, test_loss: 1.8607, test_f1: 0.6044
 epoch: 56, train_loss: 0.3869, test_loss: 2.1831, test_f1: 0.5574
 epoch: 57, train_loss: 0.3635, test_loss: 2.2157, test_f1: 0.5902
 epoch: 58, train_loss: 0.3737, test_loss: 2.0553, test_f1: 0.5803
 epoch: 59, train_loss: 0.3431, test_loss: 1.9679, test_f1: 0.6168
 epoch: 60, train_loss: 0.3491, test_loss: 2.0547, test_f1: 0.6240
 epoch: 61, train_loss: 0.3231, test_loss: 2.3142, test_f1: 0.5609
 epoch: 62, train_loss: 0.3289, test_loss: 2.2726, test_f1: 0.6172
 epoch: 63, train_loss: 0.3193, test_loss: 2.3334, test_f1: 0.5973
 epoch: 64, train_loss: 0.3187, test_loss: 2.1908, test_f1: 0.6098
 epoch: 65, train_loss: 0.3186, test_loss: 2.2372, test_f1: 0.6084
 epoch: 66, train_loss: 0.3360, test_loss: 2.3053, test_f1: 0.6008
 epoch: 67, train_loss: 0.3407, test_loss: 2.2752, test_f1: 0.5993
 epoch: 68, train_loss: 0.3303, test_loss: 2.6870, test_f1: 0.6022
 epoch: 69, train_loss: 0.3012, test_loss: 2.4928, test_f1: 0.5932
 epoch: 70, train_loss: 0.2730, test_loss: 2.6634, test_f1: 0.5982
 epoch: 71, train_loss: 0.2897, test_loss: 2.5343, test_f1: 0.5975
 epoch: 72, train_loss: 0.2997, test_loss: 2.4970, test_f1: 0.6083
 epoch: 73, train_loss: 0.3096, test_loss: 2.8292, test_f1: 0.5737
 epoch: 74, train_loss: 0.3032, test_loss: 2.6113, test_f1: 0.5961
 epoch: 75, train_loss: 0.2945, test_loss: 2.6096, test_f1: 0.6141
 epoch: 76, train_loss: 0.2875, test_loss: 2.6126, test_f1: 0.6178
 epoch: 77, train_loss: 0.2642, test_loss: 2.4344, test_f1: 0.5976
 epoch: 78, train_loss: 0.2659, test_loss: 2.8624, test_f1: 0.5965
 epoch: 79, train_loss: 0.2590, test_loss: 2.4923, test_f1: 0.6277
 epoch: 80, train_loss: 0.2863, test_loss: 2.6966, test_f1: 0.5960
 epoch: 81, train_loss: 0.2508, test_loss: 2.7127, test_f1: 0.6217
 epoch: 82, train_loss: 0.2578, test_loss: 2.9839, test_f1: 0.5960
 epoch: 83, train_loss: 0.2517, test_loss: 2.8662, test_f1: 0.5926
 epoch: 84, train_loss: 0.2539, test_loss: 3.1553, test_f1: 0.5857
 epoch: 85, train_loss: 0.2819, test_loss: 2.8820, test_f1: 0.6206
 epoch: 86, train_loss: 0.2906, test_loss: 3.1111, test_f1: 0.6080
 epoch: 87, train_loss: 0.2567, test_loss: 2.7988, test_f1: 0.6273
 epoch: 88, train_loss: 0.2484, test_loss: 2.9629, test_f1: 0.5870
 epoch: 89, train_loss: 0.2293, test_loss: 2.7560, test_f1: 0.6056
 epoch: 90, train_loss: 0.2296, test_loss: 2.7968, test_f1: 0.6200
 epoch: 91, train_loss: 0.2140, test_loss: 2.7811, test_f1: 0.5872
 epoch: 92, train_loss: 0.2063, test_loss: 2.7956, test_f1: 0.6056
 epoch: 93, train_loss: 0.2308, test_loss: 3.0241, test_f1: 0.5961
 epoch: 94, train_loss: 0.2121, test_loss: 3.1022, test_f1: 0.5874
 epoch: 95, train_loss: 0.2194, test_loss: 2.9498, test_f1: 0.6167
 epoch: 96, train_loss: 0.1989, test_loss: 2.9931, test_f1: 0.6048
 epoch: 97, train_loss: 0.2348, test_loss: 3.0593, test_f1: 0.6012
 epoch: 98, train_loss: 0.2142, test_loss: 3.3033, test_f1: 0.6140
 epoch: 99, train_loss: 0.2258, test_loss: 2.9813, test_f1: 0.6066
##################ITERATION #3 ****************************************
 epoch: 0, train_loss: 1.2450, test_loss: 1.2848, test_f1: 0.1419
 epoch: 1, train_loss: 1.0956, test_loss: 1.1927, test_f1: 0.2918
 epoch: 2, train_loss: 1.0400, test_loss: 1.0672, test_f1: 0.4867
 epoch: 3, train_loss: 0.9957, test_loss: 1.0287, test_f1: 0.5129
 epoch: 4, train_loss: 0.9723, test_loss: 1.0109, test_f1: 0.5409
 epoch: 5, train_loss: 0.9513, test_loss: 1.0324, test_f1: 0.5152
 epoch: 6, train_loss: 0.9100, test_loss: 0.9813, test_f1: 0.5611
 epoch: 7, train_loss: 0.9245, test_loss: 1.1040, test_f1: 0.5534
 epoch: 8, train_loss: 0.8948, test_loss: 0.9950, test_f1: 0.5458
 epoch: 9, train_loss: 0.8826, test_loss: 1.0193, test_f1: 0.5701
 epoch: 10, train_loss: 0.8580, test_loss: 1.0268, test_f1: 0.5269
 epoch: 11, train_loss: 0.8839, test_loss: 0.9699, test_f1: 0.5996
 epoch: 12, train_loss: 0.8489, test_loss: 0.9920, test_f1: 0.5735
 epoch: 13, train_loss: 0.8056, test_loss: 1.1092, test_f1: 0.5718
 epoch: 14, train_loss: 0.8048, test_loss: 1.0189, test_f1: 0.5891
 epoch: 15, train_loss: 0.7873, test_loss: 1.0408, test_f1: 0.5967
 epoch: 16, train_loss: 0.7783, test_loss: 1.0190, test_f1: 0.6069
 epoch: 17, train_loss: 0.7798, test_loss: 1.0046, test_f1: 0.5878
 epoch: 18, train_loss: 0.7614, test_loss: 1.1026, test_f1: 0.5683
 epoch: 19, train_loss: 0.7249, test_loss: 1.0088, test_f1: 0.6264
 epoch: 20, train_loss: 0.7298, test_loss: 1.1205, test_f1: 0.5397
 epoch: 21, train_loss: 0.7348, test_loss: 1.0959, test_f1: 0.6006
 epoch: 22, train_loss: 0.7112, test_loss: 1.1073, test_f1: 0.5878
 epoch: 23, train_loss: 0.7061, test_loss: 1.0428, test_f1: 0.6200
 epoch: 24, train_loss: 0.6805, test_loss: 1.2183, test_f1: 0.5669
 epoch: 25, train_loss: 0.6962, test_loss: 1.0539, test_f1: 0.6065
 epoch: 26, train_loss: 0.6565, test_loss: 1.1676, test_f1: 0.6117
 epoch: 27, train_loss: 0.6326, test_loss: 1.0618, test_f1: 0.6273
 epoch: 28, train_loss: 0.6480, test_loss: 1.1103, test_f1: 0.6096
 epoch: 29, train_loss: 0.6410, test_loss: 1.1811, test_f1: 0.5779
 epoch: 30, train_loss: 0.5998, test_loss: 1.1708, test_f1: 0.6070
 epoch: 31, train_loss: 0.5937, test_loss: 1.3555, test_f1: 0.6205
 epoch: 32, train_loss: 0.5792, test_loss: 1.2989, test_f1: 0.5969
 epoch: 33, train_loss: 0.5821, test_loss: 1.3945, test_f1: 0.5774
 epoch: 34, train_loss: 0.5489, test_loss: 1.2549, test_f1: 0.6554
 epoch: 35, train_loss: 0.5959, test_loss: 1.1917, test_f1: 0.6245
 epoch: 36, train_loss: 0.5527, test_loss: 1.3201, test_f1: 0.6305
 epoch: 37, train_loss: 0.5574, test_loss: 1.2474, test_f1: 0.5858
 epoch: 38, train_loss: 0.5419, test_loss: 1.5148, test_f1: 0.5687
 epoch: 39, train_loss: 0.5259, test_loss: 1.5764, test_f1: 0.5781
 epoch: 40, train_loss: 0.5280, test_loss: 1.3858, test_f1: 0.5885
 epoch: 41, train_loss: 0.5328, test_loss: 1.3915, test_f1: 0.5764
 epoch: 42, train_loss: 0.5248, test_loss: 1.3683, test_f1: 0.5944
 epoch: 43, train_loss: 0.4996, test_loss: 1.6423, test_f1: 0.5950
 epoch: 44, train_loss: 0.4690, test_loss: 1.4902, test_f1: 0.6138
 epoch: 45, train_loss: 0.4757, test_loss: 1.6937, test_f1: 0.5887
 epoch: 46, train_loss: 0.4627, test_loss: 1.6785, test_f1: 0.6208
 epoch: 47, train_loss: 0.4975, test_loss: 1.4518, test_f1: 0.6186
 epoch: 48, train_loss: 0.4603, test_loss: 1.7209, test_f1: 0.6150
 epoch: 49, train_loss: 0.4575, test_loss: 1.7758, test_f1: 0.6016
 epoch: 50, train_loss: 0.4480, test_loss: 1.5906, test_f1: 0.6383
 epoch: 51, train_loss: 0.4268, test_loss: 1.5612, test_f1: 0.5938
 epoch: 52, train_loss: 0.3955, test_loss: 1.7105, test_f1: 0.6427
 epoch: 53, train_loss: 0.3939, test_loss: 1.7197, test_f1: 0.6184
 epoch: 54, train_loss: 0.3849, test_loss: 1.7564, test_f1: 0.6024
 epoch: 55, train_loss: 0.3394, test_loss: 1.7162, test_f1: 0.6610
 epoch: 56, train_loss: 0.3417, test_loss: 1.8624, test_f1: 0.6144
 epoch: 57, train_loss: 0.3592, test_loss: 1.8277, test_f1: 0.6212
 epoch: 58, train_loss: 0.3420, test_loss: 1.7280, test_f1: 0.6229
 epoch: 59, train_loss: 0.3286, test_loss: 1.8521, test_f1: 0.6385
 epoch: 60, train_loss: 0.3315, test_loss: 1.9598, test_f1: 0.5976
 epoch: 61, train_loss: 0.3110, test_loss: 2.1045, test_f1: 0.6175
 epoch: 62, train_loss: 0.3373, test_loss: 2.0915, test_f1: 0.6207
 epoch: 63, train_loss: 0.3415, test_loss: 2.0376, test_f1: 0.5928
 epoch: 64, train_loss: 0.3222, test_loss: 1.9720, test_f1: 0.6236
 epoch: 65, train_loss: 0.3102, test_loss: 2.0306, test_f1: 0.6116
 epoch: 66, train_loss: 0.3036, test_loss: 2.0476, test_f1: 0.6152
 epoch: 67, train_loss: 0.2877, test_loss: 2.2012, test_f1: 0.6134
 epoch: 68, train_loss: 0.3032, test_loss: 1.9978, test_f1: 0.6041
 epoch: 69, train_loss: 0.3234, test_loss: 2.1694, test_f1: 0.6098
 epoch: 70, train_loss: 0.2919, test_loss: 2.0923, test_f1: 0.6275
 epoch: 71, train_loss: 0.3104, test_loss: 2.2290, test_f1: 0.6213
 epoch: 72, train_loss: 0.2866, test_loss: 2.0522, test_f1: 0.6466
 epoch: 73, train_loss: 0.2944, test_loss: 2.2472, test_f1: 0.6009
 epoch: 74, train_loss: 0.2778, test_loss: 2.2327, test_f1: 0.6141
 epoch: 75, train_loss: 0.2923, test_loss: 2.3101, test_f1: 0.5988
 epoch: 76, train_loss: 0.2799, test_loss: 2.1613, test_f1: 0.6406
 epoch: 77, train_loss: 0.2545, test_loss: 2.4052, test_f1: 0.5974
 epoch: 78, train_loss: 0.2749, test_loss: 2.4635, test_f1: 0.6172
 epoch: 79, train_loss: 0.2521, test_loss: 2.3255, test_f1: 0.6480
 epoch: 80, train_loss: 0.2818, test_loss: 2.4757, test_f1: 0.5883
 epoch: 81, train_loss: 0.2518, test_loss: 2.3040, test_f1: 0.6208
 epoch: 82, train_loss: 0.2898, test_loss: 2.3287, test_f1: 0.6184
 epoch: 83, train_loss: 0.2660, test_loss: 2.4439, test_f1: 0.6248
 epoch: 84, train_loss: 0.2747, test_loss: 2.4451, test_f1: 0.5934
 epoch: 85, train_loss: 0.2486, test_loss: 2.4782, test_f1: 0.6231
 epoch: 86, train_loss: 0.2307, test_loss: 2.5040, test_f1: 0.6058
 epoch: 87, train_loss: 0.2439, test_loss: 2.6888, test_f1: 0.6056
 epoch: 88, train_loss: 0.2322, test_loss: 2.6782, test_f1: 0.6021
 epoch: 89, train_loss: 0.2336, test_loss: 2.4282, test_f1: 0.6061
 epoch: 90, train_loss: 0.2305, test_loss: 2.5146, test_f1: 0.6294
 epoch: 91, train_loss: 0.2416, test_loss: 2.5469, test_f1: 0.6038
 epoch: 92, train_loss: 0.2702, test_loss: 2.4551, test_f1: 0.6307
 epoch: 93, train_loss: 0.2294, test_loss: 2.5469, test_f1: 0.6106
 epoch: 94, train_loss: 0.2219, test_loss: 2.6416, test_f1: 0.5890
 epoch: 95, train_loss: 0.2578, test_loss: 2.7112, test_f1: 0.6063
 epoch: 96, train_loss: 0.2473, test_loss: 2.6361, test_f1: 0.6204
 epoch: 97, train_loss: 0.2421, test_loss: 2.5594, test_f1: 0.6256
 epoch: 98, train_loss: 0.2196, test_loss: 2.4586, test_f1: 0.6348
 epoch: 99, train_loss: 0.2311, test_loss: 2.7564, test_f1: 0.6103
##################ITERATION #4 ****************************************
 epoch: 0, train_loss: 1.3147, test_loss: 1.3314, test_f1: 0.2057
 epoch: 1, train_loss: 1.1039, test_loss: 1.1621, test_f1: 0.4287
 epoch: 2, train_loss: 1.0343, test_loss: 1.0998, test_f1: 0.4879
 epoch: 3, train_loss: 1.0037, test_loss: 1.1092, test_f1: 0.4919
 epoch: 4, train_loss: 0.9961, test_loss: 1.1290, test_f1: 0.5133
 epoch: 5, train_loss: 0.9557, test_loss: 1.1571, test_f1: 0.4876
 epoch: 6, train_loss: 0.9372, test_loss: 1.0374, test_f1: 0.5440
 epoch: 7, train_loss: 0.9276, test_loss: 1.0778, test_f1: 0.5376
 epoch: 8, train_loss: 0.9143, test_loss: 1.1369, test_f1: 0.5323
 epoch: 9, train_loss: 0.8840, test_loss: 1.1551, test_f1: 0.5268
 epoch: 10, train_loss: 0.8740, test_loss: 1.0006, test_f1: 0.5862
 epoch: 11, train_loss: 0.8492, test_loss: 1.1067, test_f1: 0.5428
 epoch: 12, train_loss: 0.8598, test_loss: 1.1983, test_f1: 0.5434
 epoch: 13, train_loss: 0.8431, test_loss: 1.1590, test_f1: 0.5240
 epoch: 14, train_loss: 0.8176, test_loss: 1.1412, test_f1: 0.5880
 epoch: 15, train_loss: 0.8121, test_loss: 1.0915, test_f1: 0.5592
 epoch: 16, train_loss: 0.8088, test_loss: 1.0528, test_f1: 0.5650
 epoch: 17, train_loss: 0.7991, test_loss: 1.0608, test_f1: 0.5834
 epoch: 18, train_loss: 0.7857, test_loss: 0.9932, test_f1: 0.5773
 epoch: 19, train_loss: 0.7681, test_loss: 1.0503, test_f1: 0.5936
 epoch: 20, train_loss: 0.7574, test_loss: 1.0980, test_f1: 0.5842
 epoch: 21, train_loss: 0.7542, test_loss: 1.2786, test_f1: 0.5846
 epoch: 22, train_loss: 0.7464, test_loss: 1.0827, test_f1: 0.5828
 epoch: 23, train_loss: 0.7439, test_loss: 1.1455, test_f1: 0.5847
 epoch: 24, train_loss: 0.7090, test_loss: 1.1176, test_f1: 0.5835
 epoch: 25, train_loss: 0.6999, test_loss: 1.1288, test_f1: 0.6378
 epoch: 26, train_loss: 0.7138, test_loss: 1.1289, test_f1: 0.6215
 epoch: 27, train_loss: 0.7319, test_loss: 1.2068, test_f1: 0.5731
 epoch: 28, train_loss: 0.6803, test_loss: 1.0909, test_f1: 0.6096
 epoch: 29, train_loss: 0.6612, test_loss: 1.1069, test_f1: 0.5935
 epoch: 30, train_loss: 0.6901, test_loss: 1.0942, test_f1: 0.6315
 epoch: 31, train_loss: 0.6816, test_loss: 1.1198, test_f1: 0.5603
 epoch: 32, train_loss: 0.6432, test_loss: 1.2358, test_f1: 0.6060
 epoch: 33, train_loss: 0.6141, test_loss: 1.0955, test_f1: 0.6121
 epoch: 34, train_loss: 0.6384, test_loss: 1.1956, test_f1: 0.5965
 epoch: 35, train_loss: 0.6165, test_loss: 1.2789, test_f1: 0.5961
 epoch: 36, train_loss: 0.6076, test_loss: 1.1855, test_f1: 0.6378
 epoch: 37, train_loss: 0.5943, test_loss: 1.3700, test_f1: 0.5981
 epoch: 38, train_loss: 0.5984, test_loss: 1.4814, test_f1: 0.6070
 epoch: 39, train_loss: 0.5827, test_loss: 1.3023, test_f1: 0.6039
 epoch: 40, train_loss: 0.5554, test_loss: 1.3048, test_f1: 0.6316
 epoch: 41, train_loss: 0.5460, test_loss: 1.4289, test_f1: 0.6021
 epoch: 42, train_loss: 0.5397, test_loss: 1.2326, test_f1: 0.6001
 epoch: 43, train_loss: 0.5484, test_loss: 1.2838, test_f1: 0.6211
 epoch: 44, train_loss: 0.5435, test_loss: 1.5989, test_f1: 0.5996
 epoch: 45, train_loss: 0.5351, test_loss: 1.3115, test_f1: 0.6222
 epoch: 46, train_loss: 0.5350, test_loss: 1.6635, test_f1: 0.5916
 epoch: 47, train_loss: 0.5026, test_loss: 1.5510, test_f1: 0.5824
 epoch: 48, train_loss: 0.5454, test_loss: 1.5205, test_f1: 0.5955
 epoch: 49, train_loss: 0.5297, test_loss: 1.6109, test_f1: 0.5877
 epoch: 50, train_loss: 0.5045, test_loss: 1.6336, test_f1: 0.5678
 epoch: 51, train_loss: 0.4999, test_loss: 1.3791, test_f1: 0.6305
 epoch: 52, train_loss: 0.4353, test_loss: 1.3574, test_f1: 0.6650
 epoch: 53, train_loss: 0.4214, test_loss: 1.5455, test_f1: 0.6236
 epoch: 54, train_loss: 0.4131, test_loss: 1.4951, test_f1: 0.6460
 epoch: 55, train_loss: 0.4144, test_loss: 1.6612, test_f1: 0.6238
 epoch: 56, train_loss: 0.4087, test_loss: 1.7009, test_f1: 0.6215
 epoch: 57, train_loss: 0.4101, test_loss: 1.7023, test_f1: 0.6316
 epoch: 58, train_loss: 0.4197, test_loss: 1.6702, test_f1: 0.6261
 epoch: 59, train_loss: 0.3836, test_loss: 1.5286, test_f1: 0.6372
 epoch: 60, train_loss: 0.3974, test_loss: 1.7031, test_f1: 0.6276
 epoch: 61, train_loss: 0.3777, test_loss: 1.7085, test_f1: 0.6169
 epoch: 62, train_loss: 0.3946, test_loss: 1.7391, test_f1: 0.5988
 epoch: 63, train_loss: 0.4042, test_loss: 1.8190, test_f1: 0.6214
 epoch: 64, train_loss: 0.4058, test_loss: 1.8953, test_f1: 0.6281
 epoch: 65, train_loss: 0.3678, test_loss: 1.5979, test_f1: 0.6316
 epoch: 66, train_loss: 0.3538, test_loss: 1.7579, test_f1: 0.6175
 epoch: 67, train_loss: 0.3501, test_loss: 1.7806, test_f1: 0.5794
 epoch: 68, train_loss: 0.3199, test_loss: 2.0468, test_f1: 0.5975
 epoch: 69, train_loss: 0.3336, test_loss: 1.9383, test_f1: 0.6007
 epoch: 70, train_loss: 0.3385, test_loss: 2.0275, test_f1: 0.6017
 epoch: 71, train_loss: 0.3340, test_loss: 1.8733, test_f1: 0.6167
 epoch: 72, train_loss: 0.3303, test_loss: 1.7885, test_f1: 0.6253
 epoch: 73, train_loss: 0.3172, test_loss: 1.8787, test_f1: 0.6215
 epoch: 74, train_loss: 0.3364, test_loss: 2.0477, test_f1: 0.5912
 epoch: 75, train_loss: 0.3354, test_loss: 1.9180, test_f1: 0.6258
 epoch: 76, train_loss: 0.3517, test_loss: 2.3267, test_f1: 0.5861
 epoch: 77, train_loss: 0.3243, test_loss: 2.0666, test_f1: 0.6112
 epoch: 78, train_loss: 0.3111, test_loss: 1.9185, test_f1: 0.6097
 epoch: 79, train_loss: 0.3059, test_loss: 1.9186, test_f1: 0.6151
 epoch: 80, train_loss: 0.3002, test_loss: 2.2451, test_f1: 0.5963
 epoch: 81, train_loss: 0.2799, test_loss: 2.0109, test_f1: 0.6081
 epoch: 82, train_loss: 0.2861, test_loss: 1.9272, test_f1: 0.5975
 epoch: 83, train_loss: 0.2976, test_loss: 2.1087, test_f1: 0.6135
 epoch: 84, train_loss: 0.2789, test_loss: 2.1653, test_f1: 0.6179
 epoch: 85, train_loss: 0.2764, test_loss: 2.3457, test_f1: 0.6052
 epoch: 86, train_loss: 0.2998, test_loss: 2.3528, test_f1: 0.5985
 epoch: 87, train_loss: 0.2818, test_loss: 2.2580, test_f1: 0.6274
 epoch: 88, train_loss: 0.3020, test_loss: 2.1608, test_f1: 0.6269
 epoch: 89, train_loss: 0.2855, test_loss: 2.4172, test_f1: 0.6173
 epoch: 90, train_loss: 0.2567, test_loss: 2.3955, test_f1: 0.5979
 epoch: 91, train_loss: 0.2545, test_loss: 2.4779, test_f1: 0.5933
 epoch: 92, train_loss: 0.2630, test_loss: 2.3823, test_f1: 0.6151
 epoch: 93, train_loss: 0.2679, test_loss: 2.4301, test_f1: 0.6108
 epoch: 94, train_loss: 0.2694, test_loss: 2.3322, test_f1: 0.6182
 epoch: 95, train_loss: 0.2622, test_loss: 2.5044, test_f1: 0.5964
 epoch: 96, train_loss: 0.2769, test_loss: 2.4905, test_f1: 0.6167
 epoch: 97, train_loss: 0.2720, test_loss: 2.3542, test_f1: 0.6276
 epoch: 98, train_loss: 0.3211, test_loss: 2.3764, test_f1: 0.5960
 epoch: 99, train_loss: 0.2622, test_loss: 2.2780, test_f1: 0.6037
##################ITERATION #5 ****************************************
 epoch: 0, train_loss: 1.2449, test_loss: 1.3359, test_f1: 0.1365
 epoch: 1, train_loss: 1.0872, test_loss: 1.2152, test_f1: 0.2524
 epoch: 2, train_loss: 1.0183, test_loss: 1.2006, test_f1: 0.4346
 epoch: 3, train_loss: 1.0100, test_loss: 1.1404, test_f1: 0.5010
 epoch: 4, train_loss: 0.9642, test_loss: 1.0888, test_f1: 0.5255
 epoch: 5, train_loss: 0.9550, test_loss: 1.0670, test_f1: 0.5311
 epoch: 6, train_loss: 0.9062, test_loss: 1.1588, test_f1: 0.5102
 epoch: 7, train_loss: 0.9012, test_loss: 1.1212, test_f1: 0.5208
 epoch: 8, train_loss: 0.8794, test_loss: 1.1588, test_f1: 0.5381
 epoch: 9, train_loss: 0.8660, test_loss: 1.0902, test_f1: 0.5443
 epoch: 10, train_loss: 0.8639, test_loss: 1.0881, test_f1: 0.5412
 epoch: 11, train_loss: 0.8342, test_loss: 1.1559, test_f1: 0.5521
 epoch: 12, train_loss: 0.8287, test_loss: 1.1558, test_f1: 0.5477
 epoch: 13, train_loss: 0.7973, test_loss: 1.1686, test_f1: 0.5347
 epoch: 14, train_loss: 0.8205, test_loss: 1.0666, test_f1: 0.5569
 epoch: 15, train_loss: 0.7905, test_loss: 1.0984, test_f1: 0.5866
 epoch: 16, train_loss: 0.7905, test_loss: 1.1348, test_f1: 0.5849
 epoch: 17, train_loss: 0.7614, test_loss: 1.1542, test_f1: 0.5826
 epoch: 18, train_loss: 0.7781, test_loss: 1.1490, test_f1: 0.5437
 epoch: 19, train_loss: 0.7897, test_loss: 1.0887, test_f1: 0.5623
 epoch: 20, train_loss: 0.7752, test_loss: 1.1177, test_f1: 0.5684
 epoch: 21, train_loss: 0.7337, test_loss: 1.2347, test_f1: 0.5779
 epoch: 22, train_loss: 0.7243, test_loss: 1.0930, test_f1: 0.5915
 epoch: 23, train_loss: 0.6966, test_loss: 1.1473, test_f1: 0.6164
 epoch: 24, train_loss: 0.6993, test_loss: 1.1728, test_f1: 0.5983
 epoch: 25, train_loss: 0.7079, test_loss: 1.2446, test_f1: 0.5658
 epoch: 26, train_loss: 0.6883, test_loss: 1.1763, test_f1: 0.6269
 epoch: 27, train_loss: 0.6844, test_loss: 1.3700, test_f1: 0.5601
 epoch: 28, train_loss: 0.6925, test_loss: 1.3245, test_f1: 0.5892
 epoch: 29, train_loss: 0.7024, test_loss: 1.3521, test_f1: 0.5829
 epoch: 30, train_loss: 0.6736, test_loss: 1.1850, test_f1: 0.6037
 epoch: 31, train_loss: 0.6430, test_loss: 1.2578, test_f1: 0.6221
 epoch: 32, train_loss: 0.6181, test_loss: 1.2752, test_f1: 0.6193
 epoch: 33, train_loss: 0.6099, test_loss: 1.2449, test_f1: 0.6021
 epoch: 34, train_loss: 0.6429, test_loss: 1.3900, test_f1: 0.6245
 epoch: 35, train_loss: 0.6198, test_loss: 1.3266, test_f1: 0.5779
 epoch: 36, train_loss: 0.6055, test_loss: 1.5314, test_f1: 0.5706
 epoch: 37, train_loss: 0.5799, test_loss: 1.4134, test_f1: 0.6081
 epoch: 38, train_loss: 0.5637, test_loss: 1.5416, test_f1: 0.5773
 epoch: 39, train_loss: 0.5748, test_loss: 1.4917, test_f1: 0.6353
 epoch: 40, train_loss: 0.5686, test_loss: 1.6903, test_f1: 0.5971
 epoch: 41, train_loss: 0.5536, test_loss: 1.5566, test_f1: 0.5995
 epoch: 42, train_loss: 0.5516, test_loss: 1.5995, test_f1: 0.5997
 epoch: 43, train_loss: 0.5511, test_loss: 1.5002, test_f1: 0.5719
 epoch: 44, train_loss: 0.5024, test_loss: 1.8105, test_f1: 0.6207
 epoch: 45, train_loss: 0.5726, test_loss: 1.4635, test_f1: 0.5927
 epoch: 46, train_loss: 0.5440, test_loss: 1.5144, test_f1: 0.5732
 epoch: 47, train_loss: 0.5050, test_loss: 1.6293, test_f1: 0.6179
 epoch: 48, train_loss: 0.5051, test_loss: 1.8419, test_f1: 0.5425
 epoch: 49, train_loss: 0.4843, test_loss: 1.8048, test_f1: 0.5969
 epoch: 50, train_loss: 0.4799, test_loss: 1.8410, test_f1: 0.5803
 epoch: 51, train_loss: 0.4629, test_loss: 1.8826, test_f1: 0.6045
 epoch: 52, train_loss: 0.4320, test_loss: 1.6660, test_f1: 0.6010
 epoch: 53, train_loss: 0.4032, test_loss: 1.9339, test_f1: 0.5984
 epoch: 54, train_loss: 0.3929, test_loss: 1.9398, test_f1: 0.5998
 epoch: 55, train_loss: 0.3973, test_loss: 1.8043, test_f1: 0.6267
 epoch: 56, train_loss: 0.3651, test_loss: 1.9471, test_f1: 0.6100
 epoch: 57, train_loss: 0.3543, test_loss: 1.9826, test_f1: 0.5981
 epoch: 58, train_loss: 0.3792, test_loss: 1.9561, test_f1: 0.6050
 epoch: 59, train_loss: 0.3731, test_loss: 2.2185, test_f1: 0.6044
 epoch: 60, train_loss: 0.3535, test_loss: 2.1417, test_f1: 0.6112
 epoch: 61, train_loss: 0.3591, test_loss: 2.1948, test_f1: 0.5975
 epoch: 62, train_loss: 0.3455, test_loss: 2.2070, test_f1: 0.6271
 epoch: 63, train_loss: 0.3433, test_loss: 2.4074, test_f1: 0.5970
 epoch: 64, train_loss: 0.3370, test_loss: 2.4860, test_f1: 0.6051
 epoch: 65, train_loss: 0.3345, test_loss: 2.3210, test_f1: 0.5860
 epoch: 66, train_loss: 0.3179, test_loss: 2.5175, test_f1: 0.6131
 epoch: 67, train_loss: 0.3356, test_loss: 2.4568, test_f1: 0.5982
 epoch: 68, train_loss: 0.3010, test_loss: 2.6623, test_f1: 0.6147
 epoch: 69, train_loss: 0.3269, test_loss: 2.7151, test_f1: 0.5655
 epoch: 70, train_loss: 0.3196, test_loss: 2.5253, test_f1: 0.6152
 epoch: 71, train_loss: 0.3218, test_loss: 2.8872, test_f1: 0.5927
 epoch: 72, train_loss: 0.3145, test_loss: 2.5731, test_f1: 0.6179
 epoch: 73, train_loss: 0.3266, test_loss: 2.5504, test_f1: 0.6353
 epoch: 74, train_loss: 0.3031, test_loss: 2.7517, test_f1: 0.5894
 epoch: 75, train_loss: 0.2974, test_loss: 2.6920, test_f1: 0.6053
 epoch: 76, train_loss: 0.3070, test_loss: 2.5848, test_f1: 0.6107
 epoch: 77, train_loss: 0.2707, test_loss: 2.8561, test_f1: 0.5916
 epoch: 78, train_loss: 0.2985, test_loss: 3.1222, test_f1: 0.5843
 epoch: 79, train_loss: 0.2688, test_loss: 2.8764, test_f1: 0.6021
 epoch: 80, train_loss: 0.2931, test_loss: 2.8645, test_f1: 0.6050
 epoch: 81, train_loss: 0.2620, test_loss: 2.8106, test_f1: 0.6224
 epoch: 82, train_loss: 0.2729, test_loss: 3.1296, test_f1: 0.5992
 epoch: 83, train_loss: 0.2657, test_loss: 2.9588, test_f1: 0.6058
 epoch: 84, train_loss: 0.2706, test_loss: 3.0047, test_f1: 0.5739
 epoch: 85, train_loss: 0.2717, test_loss: 3.2067, test_f1: 0.6083
 epoch: 86, train_loss: 0.2651, test_loss: 3.0739, test_f1: 0.6170
 epoch: 87, train_loss: 0.2759, test_loss: 3.0954, test_f1: 0.5775
 epoch: 88, train_loss: 0.2679, test_loss: 2.8739, test_f1: 0.6101
 epoch: 89, train_loss: 0.2830, test_loss: 2.6765, test_f1: 0.6213
 epoch: 90, train_loss: 0.2427, test_loss: 3.0049, test_f1: 0.5954
 epoch: 91, train_loss: 0.2368, test_loss: 2.9701, test_f1: 0.5943
 epoch: 92, train_loss: 0.2500, test_loss: 3.2760, test_f1: 0.6025
 epoch: 93, train_loss: 0.2468, test_loss: 2.9372, test_f1: 0.6199
 epoch: 94, train_loss: 0.2186, test_loss: 3.2215, test_f1: 0.6007
 epoch: 95, train_loss: 0.2639, test_loss: 3.2169, test_f1: 0.6096
 epoch: 96, train_loss: 0.2349, test_loss: 3.2853, test_f1: 0.5879
 epoch: 97, train_loss: 0.2499, test_loss: 3.6626, test_f1: 0.6102
 epoch: 98, train_loss: 0.2338, test_loss: 3.2290, test_f1: 0.5919
 epoch: 99, train_loss: 0.2409, test_loss: 3.1415, test_f1: 0.6202
##################ITERATION #6 ****************************************
 epoch: 0, train_loss: 1.2743, test_loss: 1.2731, test_f1: 0.3435
 epoch: 1, train_loss: 1.0824, test_loss: 1.2279, test_f1: 0.2774
 epoch: 2, train_loss: 1.0161, test_loss: 1.1144, test_f1: 0.5191
 epoch: 3, train_loss: 0.9806, test_loss: 1.0960, test_f1: 0.5004
 epoch: 4, train_loss: 0.9632, test_loss: 1.1145, test_f1: 0.5198
 epoch: 5, train_loss: 0.9417, test_loss: 1.1319, test_f1: 0.5225
 epoch: 6, train_loss: 0.9166, test_loss: 1.0449, test_f1: 0.5579
 epoch: 7, train_loss: 0.8923, test_loss: 1.0777, test_f1: 0.5662
 epoch: 8, train_loss: 0.8757, test_loss: 1.0893, test_f1: 0.5234
 epoch: 9, train_loss: 0.8980, test_loss: 1.1961, test_f1: 0.5295
 epoch: 10, train_loss: 0.8535, test_loss: 1.1490, test_f1: 0.5585
 epoch: 11, train_loss: 0.8539, test_loss: 1.1167, test_f1: 0.5766
 epoch: 12, train_loss: 0.8445, test_loss: 1.1241, test_f1: 0.5292
 epoch: 13, train_loss: 0.8596, test_loss: 1.0898, test_f1: 0.5644
 epoch: 14, train_loss: 0.8189, test_loss: 1.0763, test_f1: 0.5888
 epoch: 15, train_loss: 0.8186, test_loss: 1.0828, test_f1: 0.5977
 epoch: 16, train_loss: 0.8024, test_loss: 1.1229, test_f1: 0.6020
 epoch: 17, train_loss: 0.7975, test_loss: 1.0259, test_f1: 0.6193
 epoch: 18, train_loss: 0.7768, test_loss: 1.0986, test_f1: 0.6054
 epoch: 19, train_loss: 0.7551, test_loss: 1.0278, test_f1: 0.5955
 epoch: 20, train_loss: 0.7640, test_loss: 1.1221, test_f1: 0.5388
 epoch: 21, train_loss: 0.7704, test_loss: 1.1814, test_f1: 0.5555
 epoch: 22, train_loss: 0.7478, test_loss: 1.2322, test_f1: 0.5606
 epoch: 23, train_loss: 0.7630, test_loss: 1.2271, test_f1: 0.5871
 epoch: 24, train_loss: 0.7431, test_loss: 1.1790, test_f1: 0.5871
 epoch: 25, train_loss: 0.7186, test_loss: 1.0941, test_f1: 0.6156
 epoch: 26, train_loss: 0.7172, test_loss: 1.1209, test_f1: 0.6145
 epoch: 27, train_loss: 0.6935, test_loss: 1.3002, test_f1: 0.5896
 epoch: 28, train_loss: 0.6916, test_loss: 1.1035, test_f1: 0.6242
 epoch: 29, train_loss: 0.6574, test_loss: 1.2946, test_f1: 0.5728
 epoch: 30, train_loss: 0.6348, test_loss: 1.2102, test_f1: 0.6095
 epoch: 31, train_loss: 0.6412, test_loss: 1.2021, test_f1: 0.5808
 epoch: 32, train_loss: 0.6393, test_loss: 1.4031, test_f1: 0.6051
 epoch: 33, train_loss: 0.6471, test_loss: 1.2670, test_f1: 0.6182
 epoch: 34, train_loss: 0.6365, test_loss: 1.2522, test_f1: 0.5961
 epoch: 35, train_loss: 0.6388, test_loss: 1.3583, test_f1: 0.5646
 epoch: 36, train_loss: 0.6378, test_loss: 1.3343, test_f1: 0.6049
 epoch: 37, train_loss: 0.6094, test_loss: 1.4180, test_f1: 0.5894
 epoch: 38, train_loss: 0.6145, test_loss: 1.3147, test_f1: 0.6109
 epoch: 39, train_loss: 0.5880, test_loss: 1.2786, test_f1: 0.6242
 epoch: 40, train_loss: 0.5700, test_loss: 1.5080, test_f1: 0.5700
 epoch: 41, train_loss: 0.5640, test_loss: 1.4141, test_f1: 0.6273
 epoch: 42, train_loss: 0.5520, test_loss: 1.4441, test_f1: 0.5892
 epoch: 43, train_loss: 0.5805, test_loss: 1.5390, test_f1: 0.6059
 epoch: 44, train_loss: 0.5418, test_loss: 1.3827, test_f1: 0.6304
 epoch: 45, train_loss: 0.5508, test_loss: 1.6657, test_f1: 0.5330
 epoch: 46, train_loss: 0.5447, test_loss: 1.5338, test_f1: 0.6052
 epoch: 47, train_loss: 0.5152, test_loss: 1.3582, test_f1: 0.6384
 epoch: 48, train_loss: 0.5250, test_loss: 1.5363, test_f1: 0.5652
 epoch: 49, train_loss: 0.5235, test_loss: 1.5629, test_f1: 0.6428
 epoch: 50, train_loss: 0.5079, test_loss: 1.7656, test_f1: 0.5838
 epoch: 51, train_loss: 0.4468, test_loss: 1.6884, test_f1: 0.6002
 epoch: 52, train_loss: 0.4398, test_loss: 1.6579, test_f1: 0.6255
 epoch: 53, train_loss: 0.4210, test_loss: 1.6595, test_f1: 0.6328
 epoch: 54, train_loss: 0.3985, test_loss: 1.7506, test_f1: 0.6172
 epoch: 55, train_loss: 0.4111, test_loss: 1.6855, test_f1: 0.6034
 epoch: 56, train_loss: 0.3899, test_loss: 1.7308, test_f1: 0.6042
 epoch: 57, train_loss: 0.3845, test_loss: 1.5646, test_f1: 0.6406
 epoch: 58, train_loss: 0.3943, test_loss: 1.8220, test_f1: 0.6266
 epoch: 59, train_loss: 0.3781, test_loss: 1.7837, test_f1: 0.6026
 epoch: 60, train_loss: 0.3540, test_loss: 1.8743, test_f1: 0.6159
 epoch: 61, train_loss: 0.3483, test_loss: 1.7445, test_f1: 0.6318
 epoch: 62, train_loss: 0.3234, test_loss: 1.8969, test_f1: 0.6137
 epoch: 63, train_loss: 0.3318, test_loss: 2.1361, test_f1: 0.6059
 epoch: 64, train_loss: 0.3367, test_loss: 1.9659, test_f1: 0.6314
 epoch: 65, train_loss: 0.3200, test_loss: 2.1024, test_f1: 0.5989
 epoch: 66, train_loss: 0.3358, test_loss: 2.0806, test_f1: 0.6107
 epoch: 67, train_loss: 0.3517, test_loss: 2.1652, test_f1: 0.5970
 epoch: 68, train_loss: 0.3432, test_loss: 2.2080, test_f1: 0.5994
 epoch: 69, train_loss: 0.3172, test_loss: 2.0014, test_f1: 0.6075
 epoch: 70, train_loss: 0.3248, test_loss: 2.2005, test_f1: 0.5898
 epoch: 71, train_loss: 0.3003, test_loss: 2.1116, test_f1: 0.6075
 epoch: 72, train_loss: 0.3227, test_loss: 2.0131, test_f1: 0.6343
 epoch: 73, train_loss: 0.3137, test_loss: 2.1168, test_f1: 0.6276
 epoch: 74, train_loss: 0.3300, test_loss: 1.9788, test_f1: 0.6346
 epoch: 75, train_loss: 0.3066, test_loss: 1.9252, test_f1: 0.6332
 epoch: 76, train_loss: 0.2988, test_loss: 2.3482, test_f1: 0.6185
 epoch: 77, train_loss: 0.2979, test_loss: 2.0447, test_f1: 0.6200
 epoch: 78, train_loss: 0.3173, test_loss: 2.0944, test_f1: 0.6068
 epoch: 79, train_loss: 0.2889, test_loss: 2.0481, test_f1: 0.6241
 epoch: 80, train_loss: 0.2933, test_loss: 2.5802, test_f1: 0.5796
 epoch: 81, train_loss: 0.3162, test_loss: 2.1834, test_f1: 0.6135
 epoch: 82, train_loss: 0.2849, test_loss: 2.1912, test_f1: 0.6133
 epoch: 83, train_loss: 0.3209, test_loss: 2.2158, test_f1: 0.6217
 epoch: 84, train_loss: 0.2968, test_loss: 2.3874, test_f1: 0.6420
 epoch: 85, train_loss: 0.2968, test_loss: 2.1313, test_f1: 0.5993
 epoch: 86, train_loss: 0.2698, test_loss: 2.2553, test_f1: 0.6203
 epoch: 87, train_loss: 0.2548, test_loss: 2.0650, test_f1: 0.6391
 epoch: 88, train_loss: 0.2583, test_loss: 2.2001, test_f1: 0.6379
 epoch: 89, train_loss: 0.2477, test_loss: 2.3197, test_f1: 0.6306
 epoch: 90, train_loss: 0.2371, test_loss: 2.4618, test_f1: 0.6225
 epoch: 91, train_loss: 0.2527, test_loss: 2.3445, test_f1: 0.6131
 epoch: 92, train_loss: 0.2492, test_loss: 2.5770, test_f1: 0.5981
 epoch: 93, train_loss: 0.2633, test_loss: 2.4309, test_f1: 0.6331
 epoch: 94, train_loss: 0.2339, test_loss: 2.6306, test_f1: 0.6134
 epoch: 95, train_loss: 0.2740, test_loss: 2.5552, test_f1: 0.6323
 epoch: 96, train_loss: 0.2659, test_loss: 2.5885, test_f1: 0.6463
 epoch: 97, train_loss: 0.2336, test_loss: 2.4501, test_f1: 0.6182
 epoch: 98, train_loss: 0.2691, test_loss: 2.7018, test_f1: 0.6149
 epoch: 99, train_loss: 0.2498, test_loss: 2.5607, test_f1: 0.6454
##################ITERATION #7 ****************************************
 epoch: 0, train_loss: 1.3739, test_loss: 1.3089, test_f1: 0.1420
 epoch: 1, train_loss: 1.1552, test_loss: 1.2555, test_f1: 0.3230
 epoch: 2, train_loss: 1.0992, test_loss: 1.1167, test_f1: 0.4945
 epoch: 3, train_loss: 1.0501, test_loss: 1.0880, test_f1: 0.5049
 epoch: 4, train_loss: 1.0152, test_loss: 1.1023, test_f1: 0.5056
 epoch: 5, train_loss: 0.9962, test_loss: 1.1080, test_f1: 0.5307
 epoch: 6, train_loss: 0.9860, test_loss: 1.0685, test_f1: 0.5241
 epoch: 7, train_loss: 0.9661, test_loss: 1.0198, test_f1: 0.5322
 epoch: 8, train_loss: 0.9256, test_loss: 1.0915, test_f1: 0.5455
 epoch: 9, train_loss: 0.9068, test_loss: 1.1095, test_f1: 0.5569
 epoch: 10, train_loss: 0.9061, test_loss: 1.0494, test_f1: 0.5715
 epoch: 11, train_loss: 0.8798, test_loss: 1.1330, test_f1: 0.5515
 epoch: 12, train_loss: 0.8468, test_loss: 1.1216, test_f1: 0.5687
 epoch: 13, train_loss: 0.8710, test_loss: 1.0247, test_f1: 0.5676
 epoch: 14, train_loss: 0.8239, test_loss: 1.1576, test_f1: 0.5434
 epoch: 15, train_loss: 0.8621, test_loss: 1.1679, test_f1: 0.5476
 epoch: 16, train_loss: 0.8201, test_loss: 1.1382, test_f1: 0.5492
 epoch: 17, train_loss: 0.8266, test_loss: 1.1545, test_f1: 0.5481
 epoch: 18, train_loss: 0.7938, test_loss: 1.0896, test_f1: 0.5705
 epoch: 19, train_loss: 0.7865, test_loss: 1.1626, test_f1: 0.5722
 epoch: 20, train_loss: 0.7940, test_loss: 1.0676, test_f1: 0.5927
 epoch: 21, train_loss: 0.7673, test_loss: 1.1337, test_f1: 0.5765
 epoch: 22, train_loss: 0.7677, test_loss: 1.2629, test_f1: 0.5763
 epoch: 23, train_loss: 0.7547, test_loss: 1.0073, test_f1: 0.5967
 epoch: 24, train_loss: 0.7484, test_loss: 1.0225, test_f1: 0.6109
 epoch: 25, train_loss: 0.7123, test_loss: 1.1601, test_f1: 0.5993
 epoch: 26, train_loss: 0.7050, test_loss: 1.0957, test_f1: 0.5958
 epoch: 27, train_loss: 0.6973, test_loss: 1.1775, test_f1: 0.5907
 epoch: 28, train_loss: 0.7044, test_loss: 1.2473, test_f1: 0.5913
 epoch: 29, train_loss: 0.6929, test_loss: 1.1998, test_f1: 0.5832
 epoch: 30, train_loss: 0.6744, test_loss: 1.1488, test_f1: 0.6252
 epoch: 31, train_loss: 0.6640, test_loss: 1.1774, test_f1: 0.5886
 epoch: 32, train_loss: 0.6510, test_loss: 1.2929, test_f1: 0.5996
 epoch: 33, train_loss: 0.6584, test_loss: 1.3012, test_f1: 0.5743
 epoch: 34, train_loss: 0.6128, test_loss: 1.1680, test_f1: 0.6113
 epoch: 35, train_loss: 0.6261, test_loss: 1.3428, test_f1: 0.5630
 epoch: 36, train_loss: 0.6263, test_loss: 1.2728, test_f1: 0.5727
 epoch: 37, train_loss: 0.6222, test_loss: 1.2928, test_f1: 0.6070
 epoch: 38, train_loss: 0.6255, test_loss: 1.3734, test_f1: 0.5593
 epoch: 39, train_loss: 0.6070, test_loss: 1.2665, test_f1: 0.5865
 epoch: 40, train_loss: 0.5840, test_loss: 1.2708, test_f1: 0.6023
 epoch: 41, train_loss: 0.5667, test_loss: 1.4109, test_f1: 0.5826
 epoch: 42, train_loss: 0.5750, test_loss: 1.3148, test_f1: 0.5895
 epoch: 43, train_loss: 0.5620, test_loss: 1.3527, test_f1: 0.6088
 epoch: 44, train_loss: 0.5673, test_loss: 1.4371, test_f1: 0.5817
 epoch: 45, train_loss: 0.5334, test_loss: 1.1823, test_f1: 0.6405
 epoch: 46, train_loss: 0.5736, test_loss: 1.4063, test_f1: 0.6032
 epoch: 47, train_loss: 0.5771, test_loss: 1.4419, test_f1: 0.5778
 epoch: 48, train_loss: 0.5356, test_loss: 1.3743, test_f1: 0.6098
 epoch: 49, train_loss: 0.5350, test_loss: 1.4422, test_f1: 0.5920
 epoch: 50, train_loss: 0.5157, test_loss: 1.5369, test_f1: 0.5710
 epoch: 51, train_loss: 0.4780, test_loss: 1.4566, test_f1: 0.5927
 epoch: 52, train_loss: 0.4752, test_loss: 1.5126, test_f1: 0.6193
 epoch: 53, train_loss: 0.4638, test_loss: 1.5892, test_f1: 0.6040
 epoch: 54, train_loss: 0.4618, test_loss: 1.7663, test_f1: 0.5921
 epoch: 55, train_loss: 0.4399, test_loss: 1.6429, test_f1: 0.5983
 epoch: 56, train_loss: 0.4117, test_loss: 1.5863, test_f1: 0.6079
 epoch: 57, train_loss: 0.3983, test_loss: 1.7253, test_f1: 0.5746
 epoch: 58, train_loss: 0.4088, test_loss: 1.7358, test_f1: 0.6023
 epoch: 59, train_loss: 0.4013, test_loss: 1.6868, test_f1: 0.6178
 epoch: 60, train_loss: 0.3868, test_loss: 1.7399, test_f1: 0.5902
 epoch: 61, train_loss: 0.4050, test_loss: 1.8350, test_f1: 0.6019
 epoch: 62, train_loss: 0.4003, test_loss: 1.8018, test_f1: 0.5764
 epoch: 63, train_loss: 0.3974, test_loss: 1.7006, test_f1: 0.6035
 epoch: 64, train_loss: 0.3920, test_loss: 1.8095, test_f1: 0.6139
 epoch: 65, train_loss: 0.3854, test_loss: 2.0213, test_f1: 0.5447
 epoch: 66, train_loss: 0.3752, test_loss: 1.7292, test_f1: 0.6356
 epoch: 67, train_loss: 0.3671, test_loss: 1.7992, test_f1: 0.6134
 epoch: 68, train_loss: 0.3628, test_loss: 1.8495, test_f1: 0.6026
 epoch: 69, train_loss: 0.3945, test_loss: 1.7846, test_f1: 0.6159
 epoch: 70, train_loss: 0.3625, test_loss: 1.8708, test_f1: 0.6143
 epoch: 71, train_loss: 0.3560, test_loss: 1.8437, test_f1: 0.6230
 epoch: 72, train_loss: 0.3659, test_loss: 1.8656, test_f1: 0.5963
 epoch: 73, train_loss: 0.3596, test_loss: 2.0005, test_f1: 0.6041
 epoch: 74, train_loss: 0.3459, test_loss: 2.0642, test_f1: 0.6322
 epoch: 75, train_loss: 0.3400, test_loss: 2.1753, test_f1: 0.5831
 epoch: 76, train_loss: 0.3559, test_loss: 1.8749, test_f1: 0.5991
 epoch: 77, train_loss: 0.3420, test_loss: 2.0203, test_f1: 0.6316
 epoch: 78, train_loss: 0.3350, test_loss: 2.0149, test_f1: 0.5781
 epoch: 79, train_loss: 0.3089, test_loss: 2.0231, test_f1: 0.5855
 epoch: 80, train_loss: 0.3178, test_loss: 2.0767, test_f1: 0.6328
 epoch: 81, train_loss: 0.3196, test_loss: 1.9639, test_f1: 0.6246
 epoch: 82, train_loss: 0.3428, test_loss: 1.9051, test_f1: 0.6177
 epoch: 83, train_loss: 0.3476, test_loss: 2.0657, test_f1: 0.5969
 epoch: 84, train_loss: 0.3403, test_loss: 2.1663, test_f1: 0.5913
 epoch: 85, train_loss: 0.3274, test_loss: 2.0043, test_f1: 0.6182
 epoch: 86, train_loss: 0.2942, test_loss: 2.1271, test_f1: 0.6336
 epoch: 87, train_loss: 0.2927, test_loss: 2.3122, test_f1: 0.6024
 epoch: 88, train_loss: 0.2800, test_loss: 2.1538, test_f1: 0.6174
 epoch: 89, train_loss: 0.2795, test_loss: 2.3813, test_f1: 0.6069
 epoch: 90, train_loss: 0.3216, test_loss: 2.0823, test_f1: 0.6065
 epoch: 91, train_loss: 0.3180, test_loss: 2.1144, test_f1: 0.5977
 epoch: 92, train_loss: 0.2902, test_loss: 2.4870, test_f1: 0.5829
 epoch: 93, train_loss: 0.3022, test_loss: 2.2276, test_f1: 0.6012
 epoch: 94, train_loss: 0.2850, test_loss: 2.3010, test_f1: 0.6074
 epoch: 95, train_loss: 0.2715, test_loss: 2.5161, test_f1: 0.5962
 epoch: 96, train_loss: 0.2607, test_loss: 2.4400, test_f1: 0.5765
 epoch: 97, train_loss: 0.2782, test_loss: 2.4770, test_f1: 0.5733
 epoch: 98, train_loss: 0.2883, test_loss: 2.5044, test_f1: 0.5885
 epoch: 99, train_loss: 0.2689, test_loss: 2.5153, test_f1: 0.6039
##################ITERATION #8 ****************************************
 epoch: 0, train_loss: 1.3400, test_loss: 1.2944, test_f1: 0.1620
 epoch: 1, train_loss: 1.1140, test_loss: 1.1616, test_f1: 0.3750
 epoch: 2, train_loss: 1.0474, test_loss: 1.0898, test_f1: 0.4761
 epoch: 3, train_loss: 1.0001, test_loss: 1.1231, test_f1: 0.4536
 epoch: 4, train_loss: 1.0011, test_loss: 1.1075, test_f1: 0.4878
 epoch: 5, train_loss: 0.9720, test_loss: 1.1323, test_f1: 0.4842
 epoch: 6, train_loss: 0.9261, test_loss: 1.0935, test_f1: 0.5272
 epoch: 7, train_loss: 0.9080, test_loss: 1.0676, test_f1: 0.5101
 epoch: 8, train_loss: 0.8905, test_loss: 1.1169, test_f1: 0.5107
 epoch: 9, train_loss: 0.8776, test_loss: 1.0286, test_f1: 0.5795
 epoch: 10, train_loss: 0.8522, test_loss: 1.0627, test_f1: 0.5896
 epoch: 11, train_loss: 0.8253, test_loss: 1.0758, test_f1: 0.5744
 epoch: 12, train_loss: 0.8393, test_loss: 1.1075, test_f1: 0.5680
 epoch: 13, train_loss: 0.8041, test_loss: 1.0651, test_f1: 0.5851
 epoch: 14, train_loss: 0.8330, test_loss: 0.9742, test_f1: 0.6180
 epoch: 15, train_loss: 0.8034, test_loss: 1.0587, test_f1: 0.6013
 epoch: 16, train_loss: 0.8120, test_loss: 0.9622, test_f1: 0.6175
 epoch: 17, train_loss: 0.7802, test_loss: 1.0371, test_f1: 0.5921
 epoch: 18, train_loss: 0.7760, test_loss: 1.0957, test_f1: 0.5897
 epoch: 19, train_loss: 0.7493, test_loss: 1.0357, test_f1: 0.6069
 epoch: 20, train_loss: 0.7388, test_loss: 1.1554, test_f1: 0.6124
 epoch: 21, train_loss: 0.7280, test_loss: 1.1895, test_f1: 0.5314
 epoch: 22, train_loss: 0.7358, test_loss: 1.0500, test_f1: 0.6089
 epoch: 23, train_loss: 0.7273, test_loss: 1.0649, test_f1: 0.6116
 epoch: 24, train_loss: 0.7002, test_loss: 1.1717, test_f1: 0.5964
 epoch: 25, train_loss: 0.7009, test_loss: 1.1756, test_f1: 0.6138
 epoch: 26, train_loss: 0.6589, test_loss: 1.2610, test_f1: 0.5997
 epoch: 27, train_loss: 0.6687, test_loss: 1.1333, test_f1: 0.6403
 epoch: 28, train_loss: 0.6517, test_loss: 1.3844, test_f1: 0.6150
 epoch: 29, train_loss: 0.6498, test_loss: 1.4187, test_f1: 0.5559
 epoch: 30, train_loss: 0.6372, test_loss: 1.1970, test_f1: 0.5941
 epoch: 31, train_loss: 0.6618, test_loss: 1.3714, test_f1: 0.5876
 epoch: 32, train_loss: 0.6699, test_loss: 1.1963, test_f1: 0.5963
 epoch: 33, train_loss: 0.6433, test_loss: 1.2980, test_f1: 0.6499
 epoch: 34, train_loss: 0.6119, test_loss: 1.1418, test_f1: 0.5829
 epoch: 35, train_loss: 0.6011, test_loss: 1.3454, test_f1: 0.5875
 epoch: 36, train_loss: 0.6045, test_loss: 1.3648, test_f1: 0.5915
 epoch: 37, train_loss: 0.5978, test_loss: 1.3409, test_f1: 0.6038
 epoch: 38, train_loss: 0.5801, test_loss: 1.3184, test_f1: 0.5843
 epoch: 39, train_loss: 0.5830, test_loss: 1.3335, test_f1: 0.5967
 epoch: 40, train_loss: 0.5672, test_loss: 1.4845, test_f1: 0.5820
 epoch: 41, train_loss: 0.5655, test_loss: 1.2389, test_f1: 0.6124
 epoch: 42, train_loss: 0.5407, test_loss: 1.4719, test_f1: 0.5800
 epoch: 43, train_loss: 0.5310, test_loss: 1.4627, test_f1: 0.6238
 epoch: 44, train_loss: 0.5387, test_loss: 1.6001, test_f1: 0.5815
 epoch: 45, train_loss: 0.5266, test_loss: 1.3011, test_f1: 0.6086
 epoch: 46, train_loss: 0.5007, test_loss: 1.6423, test_f1: 0.5743
 epoch: 47, train_loss: 0.5219, test_loss: 1.6187, test_f1: 0.5756
 epoch: 48, train_loss: 0.5233, test_loss: 1.5219, test_f1: 0.5908
 epoch: 49, train_loss: 0.4812, test_loss: 1.6548, test_f1: 0.5924
 epoch: 50, train_loss: 0.4944, test_loss: 1.5560, test_f1: 0.5886
 epoch: 51, train_loss: 0.4733, test_loss: 1.6361, test_f1: 0.5659
 epoch: 52, train_loss: 0.4323, test_loss: 1.6223, test_f1: 0.5790
 epoch: 53, train_loss: 0.4334, test_loss: 1.6529, test_f1: 0.5775
 epoch: 54, train_loss: 0.4262, test_loss: 1.7501, test_f1: 0.5859
 epoch: 55, train_loss: 0.4008, test_loss: 1.9217, test_f1: 0.5673
 epoch: 56, train_loss: 0.3774, test_loss: 1.7762, test_f1: 0.5753
 epoch: 57, train_loss: 0.3934, test_loss: 1.8166, test_f1: 0.5873
 epoch: 58, train_loss: 0.3741, test_loss: 1.8685, test_f1: 0.5812
 epoch: 59, train_loss: 0.3685, test_loss: 1.9338, test_f1: 0.5908
 epoch: 60, train_loss: 0.3824, test_loss: 2.1375, test_f1: 0.5517
 epoch: 61, train_loss: 0.3691, test_loss: 1.9901, test_f1: 0.5888
 epoch: 62, train_loss: 0.3731, test_loss: 2.1420, test_f1: 0.5812
 epoch: 63, train_loss: 0.3685, test_loss: 1.8223, test_f1: 0.5666
 epoch: 64, train_loss: 0.3813, test_loss: 1.9797, test_f1: 0.5946
 epoch: 65, train_loss: 0.3599, test_loss: 2.0878, test_f1: 0.5822
 epoch: 66, train_loss: 0.3617, test_loss: 2.3548, test_f1: 0.5749
 epoch: 67, train_loss: 0.3532, test_loss: 2.1019, test_f1: 0.5951
 epoch: 68, train_loss: 0.3620, test_loss: 2.1701, test_f1: 0.5627
 epoch: 69, train_loss: 0.3426, test_loss: 2.2544, test_f1: 0.5525
 epoch: 70, train_loss: 0.3721, test_loss: 2.2573, test_f1: 0.5582
 epoch: 71, train_loss: 0.3348, test_loss: 2.4159, test_f1: 0.5707
 epoch: 72, train_loss: 0.3301, test_loss: 2.3338, test_f1: 0.5857
 epoch: 73, train_loss: 0.3418, test_loss: 2.2868, test_f1: 0.5644
 epoch: 74, train_loss: 0.3239, test_loss: 2.4607, test_f1: 0.5743
 epoch: 75, train_loss: 0.3493, test_loss: 2.1380, test_f1: 0.5740
 epoch: 76, train_loss: 0.3386, test_loss: 2.1389, test_f1: 0.5887
 epoch: 77, train_loss: 0.3233, test_loss: 2.4493, test_f1: 0.5583
 epoch: 78, train_loss: 0.3111, test_loss: 2.2886, test_f1: 0.5561
 epoch: 79, train_loss: 0.2995, test_loss: 2.3709, test_f1: 0.5659
 epoch: 80, train_loss: 0.3125, test_loss: 2.3649, test_f1: 0.5520
 epoch: 81, train_loss: 0.2919, test_loss: 2.3592, test_f1: 0.5888
 epoch: 82, train_loss: 0.3158, test_loss: 2.7143, test_f1: 0.5914
 epoch: 83, train_loss: 0.2833, test_loss: 2.4808, test_f1: 0.5735
 epoch: 84, train_loss: 0.2837, test_loss: 2.5321, test_f1: 0.5978
 epoch: 85, train_loss: 0.3261, test_loss: 2.5392, test_f1: 0.5813
 epoch: 86, train_loss: 0.2940, test_loss: 2.4962, test_f1: 0.5742
 epoch: 87, train_loss: 0.2807, test_loss: 2.5028, test_f1: 0.5753
 epoch: 88, train_loss: 0.2723, test_loss: 2.7465, test_f1: 0.5702
 epoch: 89, train_loss: 0.2778, test_loss: 2.5552, test_f1: 0.5689
 epoch: 90, train_loss: 0.2628, test_loss: 2.8555, test_f1: 0.5673
 epoch: 91, train_loss: 0.2623, test_loss: 2.8209, test_f1: 0.5710
 epoch: 92, train_loss: 0.2528, test_loss: 2.5389, test_f1: 0.5848
 epoch: 93, train_loss: 0.2667, test_loss: 2.7901, test_f1: 0.5403
 epoch: 94, train_loss: 0.2584, test_loss: 2.8242, test_f1: 0.5833
 epoch: 95, train_loss: 0.2820, test_loss: 3.0951, test_f1: 0.5633
 epoch: 96, train_loss: 0.2436, test_loss: 2.4320, test_f1: 0.5648
 epoch: 97, train_loss: 0.2316, test_loss: 3.1501, test_f1: 0.5643
 epoch: 98, train_loss: 0.2501, test_loss: 2.8314, test_f1: 0.5827
 epoch: 99, train_loss: 0.2646, test_loss: 3.0702, test_f1: 0.5663
##################ITERATION #9 ****************************************
 epoch: 0, train_loss: 1.4549, test_loss: 1.2185, test_f1: 0.3415
 epoch: 1, train_loss: 1.1447, test_loss: 1.2760, test_f1: 0.3614
 epoch: 2, train_loss: 1.0465, test_loss: 1.1178, test_f1: 0.5008
 epoch: 3, train_loss: 1.0478, test_loss: 1.1417, test_f1: 0.5117
 epoch: 4, train_loss: 1.0181, test_loss: 1.1434, test_f1: 0.5217
 epoch: 5, train_loss: 0.9807, test_loss: 1.0716, test_f1: 0.5359
 epoch: 6, train_loss: 0.9797, test_loss: 1.0651, test_f1: 0.5517
 epoch: 7, train_loss: 0.9563, test_loss: 1.0590, test_f1: 0.5986
 epoch: 8, train_loss: 0.9199, test_loss: 1.0313, test_f1: 0.5949
 epoch: 9, train_loss: 0.9032, test_loss: 1.0525, test_f1: 0.5785
 epoch: 10, train_loss: 0.8913, test_loss: 1.0776, test_f1: 0.5501
 epoch: 11, train_loss: 0.8791, test_loss: 1.0367, test_f1: 0.5964
 epoch: 12, train_loss: 0.8533, test_loss: 1.0955, test_f1: 0.5425
 epoch: 13, train_loss: 0.8785, test_loss: 1.1078, test_f1: 0.5567
 epoch: 14, train_loss: 0.8420, test_loss: 1.0240, test_f1: 0.5823
 epoch: 15, train_loss: 0.8566, test_loss: 1.1451, test_f1: 0.5607
 epoch: 16, train_loss: 0.8338, test_loss: 1.0450, test_f1: 0.5728
 epoch: 17, train_loss: 0.8228, test_loss: 1.1054, test_f1: 0.5440
 epoch: 18, train_loss: 0.8060, test_loss: 1.1297, test_f1: 0.5859
 epoch: 19, train_loss: 0.7999, test_loss: 1.0525, test_f1: 0.5749
 epoch: 20, train_loss: 0.7936, test_loss: 1.1049, test_f1: 0.5718
 epoch: 21, train_loss: 0.7757, test_loss: 1.0841, test_f1: 0.5629
 epoch: 22, train_loss: 0.7889, test_loss: 1.1584, test_f1: 0.5838
 epoch: 23, train_loss: 0.7502, test_loss: 1.1375, test_f1: 0.5512
 epoch: 24, train_loss: 0.7530, test_loss: 1.1207, test_f1: 0.6199
 epoch: 25, train_loss: 0.7413, test_loss: 1.1309, test_f1: 0.5995
 epoch: 26, train_loss: 0.7370, test_loss: 1.1324, test_f1: 0.6121
 epoch: 27, train_loss: 0.7298, test_loss: 1.1974, test_f1: 0.5780
 epoch: 28, train_loss: 0.7297, test_loss: 1.1724, test_f1: 0.5691
 epoch: 29, train_loss: 0.7312, test_loss: 1.1986, test_f1: 0.5858
 epoch: 30, train_loss: 0.7226, test_loss: 1.2327, test_f1: 0.5614
 epoch: 31, train_loss: 0.7218, test_loss: 1.1372, test_f1: 0.5940
 epoch: 32, train_loss: 0.6901, test_loss: 1.1172, test_f1: 0.6290
 epoch: 33, train_loss: 0.6845, test_loss: 1.2917, test_f1: 0.6048
 epoch: 34, train_loss: 0.6587, test_loss: 1.1728, test_f1: 0.5991
 epoch: 35, train_loss: 0.6526, test_loss: 1.3064, test_f1: 0.6094
 epoch: 36, train_loss: 0.6454, test_loss: 1.3614, test_f1: 0.5966
 epoch: 37, train_loss: 0.6216, test_loss: 1.2727, test_f1: 0.6138
 epoch: 38, train_loss: 0.6406, test_loss: 1.3106, test_f1: 0.6314
 epoch: 39, train_loss: 0.6255, test_loss: 1.3130, test_f1: 0.5994
 epoch: 40, train_loss: 0.6412, test_loss: 1.3248, test_f1: 0.6092
 epoch: 41, train_loss: 0.6301, test_loss: 1.2399, test_f1: 0.6485
 epoch: 42, train_loss: 0.6099, test_loss: 1.3621, test_f1: 0.6173
 epoch: 43, train_loss: 0.5856, test_loss: 1.5521, test_f1: 0.5391
 epoch: 44, train_loss: 0.5827, test_loss: 1.4302, test_f1: 0.5582
 epoch: 45, train_loss: 0.5891, test_loss: 1.3545, test_f1: 0.5632
 epoch: 46, train_loss: 0.5809, test_loss: 1.5338, test_f1: 0.5858
 epoch: 47, train_loss: 0.5924, test_loss: 1.4834, test_f1: 0.6170
 epoch: 48, train_loss: 0.6021, test_loss: 1.3827, test_f1: 0.5825
 epoch: 49, train_loss: 0.5769, test_loss: 1.4566, test_f1: 0.5680
 epoch: 50, train_loss: 0.5698, test_loss: 1.4588, test_f1: 0.6074
 epoch: 51, train_loss: 0.5196, test_loss: 1.3827, test_f1: 0.6181
 epoch: 52, train_loss: 0.5111, test_loss: 1.4578, test_f1: 0.6297
 epoch: 53, train_loss: 0.4732, test_loss: 1.4808, test_f1: 0.6309
 epoch: 54, train_loss: 0.4822, test_loss: 1.5644, test_f1: 0.6175
 epoch: 55, train_loss: 0.4738, test_loss: 1.5763, test_f1: 0.6069
 epoch: 56, train_loss: 0.4598, test_loss: 1.5823, test_f1: 0.6090
 epoch: 57, train_loss: 0.4510, test_loss: 1.5225, test_f1: 0.6186
 epoch: 58, train_loss: 0.4625, test_loss: 1.6946, test_f1: 0.5831
 epoch: 59, train_loss: 0.4549, test_loss: 1.7413, test_f1: 0.6053
 epoch: 60, train_loss: 0.4157, test_loss: 1.7143, test_f1: 0.6190
 epoch: 61, train_loss: 0.4064, test_loss: 1.8116, test_f1: 0.6109
 epoch: 62, train_loss: 0.3862, test_loss: 1.8108, test_f1: 0.6104
 epoch: 63, train_loss: 0.4241, test_loss: 1.6655, test_f1: 0.6169
 epoch: 64, train_loss: 0.4175, test_loss: 1.7941, test_f1: 0.6023
 epoch: 65, train_loss: 0.4081, test_loss: 1.6882, test_f1: 0.5903
 epoch: 66, train_loss: 0.4060, test_loss: 1.6687, test_f1: 0.6119
 epoch: 67, train_loss: 0.3895, test_loss: 1.8984, test_f1: 0.6044
 epoch: 68, train_loss: 0.3866, test_loss: 1.8703, test_f1: 0.6099
 epoch: 69, train_loss: 0.3838, test_loss: 1.9030, test_f1: 0.5835
 epoch: 70, train_loss: 0.4049, test_loss: 1.9969, test_f1: 0.5909
 epoch: 71, train_loss: 0.3981, test_loss: 1.8409, test_f1: 0.6311
 epoch: 72, train_loss: 0.3625, test_loss: 1.9549, test_f1: 0.6099
 epoch: 73, train_loss: 0.3736, test_loss: 1.9630, test_f1: 0.6119
 epoch: 74, train_loss: 0.3574, test_loss: 2.1417, test_f1: 0.5870
 epoch: 75, train_loss: 0.3746, test_loss: 2.0385, test_f1: 0.5990
 epoch: 76, train_loss: 0.3734, test_loss: 2.2490, test_f1: 0.5928
 epoch: 77, train_loss: 0.3558, test_loss: 2.1055, test_f1: 0.6070
 epoch: 78, train_loss: 0.3295, test_loss: 2.0818, test_f1: 0.5785
 epoch: 79, train_loss: 0.3448, test_loss: 2.1703, test_f1: 0.5910
 epoch: 80, train_loss: 0.3634, test_loss: 2.0328, test_f1: 0.6024
 epoch: 81, train_loss: 0.3274, test_loss: 2.1104, test_f1: 0.6323
 epoch: 82, train_loss: 0.3482, test_loss: 2.3677, test_f1: 0.5935
 epoch: 83, train_loss: 0.3617, test_loss: 2.0824, test_f1: 0.6091
 epoch: 84, train_loss: 0.3417, test_loss: 2.3338, test_f1: 0.6138
 epoch: 85, train_loss: 0.3300, test_loss: 2.4346, test_f1: 0.5879
 epoch: 86, train_loss: 0.3353, test_loss: 2.0852, test_f1: 0.6258
 epoch: 87, train_loss: 0.3279, test_loss: 2.2953, test_f1: 0.5837
 epoch: 88, train_loss: 0.3084, test_loss: 2.4497, test_f1: 0.6008
 epoch: 89, train_loss: 0.3103, test_loss: 2.4076, test_f1: 0.5719
 epoch: 90, train_loss: 0.3062, test_loss: 2.3552, test_f1: 0.6056
 epoch: 91, train_loss: 0.3165, test_loss: 2.4753, test_f1: 0.5935
 epoch: 92, train_loss: 0.2921, test_loss: 2.2999, test_f1: 0.6048
 epoch: 93, train_loss: 0.3139, test_loss: 2.2594, test_f1: 0.5988
 epoch: 94, train_loss: 0.3059, test_loss: 2.3734, test_f1: 0.5996
 epoch: 95, train_loss: 0.2878, test_loss: 2.1675, test_f1: 0.6077
 epoch: 96, train_loss: 0.3009, test_loss: 2.4394, test_f1: 0.5894
 epoch: 97, train_loss: 0.2780, test_loss: 2.4248, test_f1: 0.6094
 epoch: 98, train_loss: 0.2566, test_loss: 2.3106, test_f1: 0.6361
 epoch: 99, train_loss: 0.2697, test_loss: 2.5645, test_f1: 0.5999

Training completed in 494.64 seconds
Best F1: 0.6650 at epoch 52
Mean F1 across iterations: 0.6475  0.0093
========================FINAL RESULTS================================
FEGIN weighted F1: 0.6650  0.0093
python main.py --data ltspice_demos --representation component_net --model FEGIN --layers 5 --hiddens 64 --batch_size 64 --lr 0.001 --emb_size 512 --epochs 100 --save_appendix component_net_L5_H64_BS64_LR0.001_E512 --no_val
-----



STDERR:
  File "main.py", line 370, in <module>
    main()
  File "main.py", line 254, in main
    dataset = dataset_class(
  File "/home/philip/projects/ltspice_examples_code_repo/Circuit-Completion-Using-GNNs/component_classification_with_link_prediction_head/evaluation/FEGIN/kernel/circuit_datasets.py", line 15, in __init__
    self.data, self.slices = torch.load(self.processed_paths[0])
  File "/home/philip/.local/lib/python3.8/site-packages/torch/serialization.py", line 1040, in load
    warnings.warn(
  File "/usr/lib/python3.8/warnings.py", line 109, in _showwarnmsg
    sw(msg.message, msg.category, msg.filename, msg.lineno,
  File "main.py", line 47, in warn_with_traceback
    traceback.print_stack(file=log)
/home/philip/projects/ltspice_examples_code_repo/Circuit-Completion-Using-GNNs/component_classification_with_link_prediction_head/evaluation/FEGIN/kernel/circuit_datasets.py:15: FutureWarning: You are using `torch.load` with `weights_only=False` (the current default value), which uses the default pickle module implicitly. It is possible to construct malicious pickle data which will execute arbitrary code during unpickling (See https://github.com/pytorch/pytorch/blob/main/SECURITY.md#untrusted-models for more details). In a future release, the default value for `weights_only` will be flipped to `True`. This limits the functions that could be executed during unpickling. Arbitrary objects will no longer be allowed to be loaded via this mode unless they are explicitly allowlisted by the user via `torch.serialization.add_safe_globals`. We recommend you start setting `weights_only=True` for any use case where you don't have full control of the loaded file. Please open an issue on GitHub for any issues related to this experimental feature.
  self.data, self.slices = torch.load(self.processed_paths[0])
