STDOUT:
Results will be saved in /home/philip/projects/ltspice_examples_code_repo/Circuit-Completion-Using-GNNs/component_classification_with_link_prediction_head/evaluation/FEGIN/results/model_FEGIN_dataset_ltspice_examples
Command line input: python main.py --data ltspice_examples --representation component_component --model FEGIN --layers 2 --hiddens 64 --batch_size 32 --lr 0.01 --emb_size 512 --epochs 100 --save_appendix component_component_L2_H64_BS32_LR0.01_E512 --no_val
 is saved.
-----
ltspice_examples - FEGIN
Using 2 layers, 64 hidden units, h = 2
Loading component_component representation dataset
ENTERED
Training FEGIN on component_component representation
Train: 3556, Test: 845
##################ITERATION #0 ****************************************
 epoch: 0, train_loss: 1.2432, test_loss: 1.1079, test_f1: 0.3982
 epoch: 1, train_loss: 1.1025, test_loss: 0.9861, test_f1: 0.4777
 epoch: 2, train_loss: 1.0326, test_loss: 1.0511, test_f1: 0.4653
 epoch: 3, train_loss: 1.0098, test_loss: 0.9650, test_f1: 0.4575
 epoch: 4, train_loss: 0.9820, test_loss: 1.0162, test_f1: 0.4735
 epoch: 5, train_loss: 1.0014, test_loss: 0.9953, test_f1: 0.4885
 epoch: 6, train_loss: 0.9681, test_loss: 1.0221, test_f1: 0.4965
 epoch: 7, train_loss: 0.9623, test_loss: 0.9685, test_f1: 0.5206
 epoch: 8, train_loss: 0.9358, test_loss: 0.9764, test_f1: 0.4781
 epoch: 9, train_loss: 0.9333, test_loss: 1.0368, test_f1: 0.5200
 epoch: 10, train_loss: 0.9411, test_loss: 0.9671, test_f1: 0.4716
 epoch: 11, train_loss: 0.9220, test_loss: 1.1154, test_f1: 0.4835
 epoch: 12, train_loss: 0.9212, test_loss: 0.9627, test_f1: 0.4835
 epoch: 13, train_loss: 0.9232, test_loss: 0.9916, test_f1: 0.5396
 epoch: 14, train_loss: 0.9224, test_loss: 0.9872, test_f1: 0.4905
 epoch: 15, train_loss: 0.8958, test_loss: 1.0438, test_f1: 0.5060
 epoch: 16, train_loss: 0.9059, test_loss: 1.0111, test_f1: 0.5087
 epoch: 17, train_loss: 0.8839, test_loss: 1.0342, test_f1: 0.5318
 epoch: 18, train_loss: 0.9067, test_loss: 1.4439, test_f1: 0.4423
 epoch: 19, train_loss: 0.9234, test_loss: 1.1184, test_f1: 0.4741
 epoch: 20, train_loss: 0.8853, test_loss: 1.0437, test_f1: 0.5138
 epoch: 21, train_loss: 0.8851, test_loss: 1.0905, test_f1: 0.5064
 epoch: 22, train_loss: 0.8726, test_loss: 1.0115, test_f1: 0.5269
 epoch: 23, train_loss: 0.8517, test_loss: 1.0936, test_f1: 0.5115
 epoch: 24, train_loss: 0.8519, test_loss: 1.1631, test_f1: 0.5055
 epoch: 25, train_loss: 0.9770, test_loss: 0.9980, test_f1: 0.4549
 epoch: 26, train_loss: 0.9560, test_loss: 0.9992, test_f1: 0.4728
 epoch: 27, train_loss: 0.9128, test_loss: 1.0550, test_f1: 0.5270
 epoch: 28, train_loss: 0.9005, test_loss: 0.9724, test_f1: 0.5530
 epoch: 29, train_loss: 0.8920, test_loss: 1.1290, test_f1: 0.5130
 epoch: 30, train_loss: 0.8699, test_loss: 1.0076, test_f1: 0.5319
 epoch: 31, train_loss: 0.8883, test_loss: 1.0188, test_f1: 0.5057
 epoch: 32, train_loss: 0.8593, test_loss: 1.0358, test_f1: 0.5365
 epoch: 33, train_loss: 0.8584, test_loss: 0.9892, test_f1: 0.4959
 epoch: 34, train_loss: 0.9247, test_loss: 0.9909, test_f1: 0.5324
 epoch: 35, train_loss: 0.8697, test_loss: 0.9116, test_f1: 0.5440
 epoch: 36, train_loss: 0.8695, test_loss: 0.9635, test_f1: 0.5369
 epoch: 37, train_loss: 0.8724, test_loss: 1.0280, test_f1: 0.5711
 epoch: 38, train_loss: 0.8339, test_loss: 0.9714, test_f1: 0.5218
 epoch: 39, train_loss: 0.8273, test_loss: 0.9822, test_f1: 0.5351
 epoch: 40, train_loss: 0.8338, test_loss: 1.0936, test_f1: 0.5027
 epoch: 41, train_loss: 0.8310, test_loss: 1.0364, test_f1: 0.5282
 epoch: 42, train_loss: 0.8230, test_loss: 0.8922, test_f1: 0.5477
 epoch: 43, train_loss: 0.8089, test_loss: 1.1517, test_f1: 0.5248
 epoch: 44, train_loss: 0.8073, test_loss: 1.0047, test_f1: 0.5017
 epoch: 45, train_loss: 0.8150, test_loss: 1.0922, test_f1: 0.5651
 epoch: 46, train_loss: 0.8130, test_loss: 1.0474, test_f1: 0.5568
 epoch: 47, train_loss: 0.8109, test_loss: 0.9711, test_f1: 0.5359
 epoch: 48, train_loss: 0.7953, test_loss: 1.1796, test_f1: 0.5274
 epoch: 49, train_loss: 0.7985, test_loss: 1.1656, test_f1: 0.4516
 epoch: 50, train_loss: 0.8832, test_loss: 0.9546, test_f1: 0.5597
 epoch: 51, train_loss: 0.8035, test_loss: 0.9720, test_f1: 0.5412
 epoch: 52, train_loss: 0.7694, test_loss: 0.9381, test_f1: 0.5646
 epoch: 53, train_loss: 0.7501, test_loss: 1.0184, test_f1: 0.5734
 epoch: 54, train_loss: 0.7471, test_loss: 0.9976, test_f1: 0.5341
 epoch: 55, train_loss: 0.7416, test_loss: 1.1040, test_f1: 0.5396
 epoch: 56, train_loss: 0.7417, test_loss: 1.0860, test_f1: 0.5201
 epoch: 57, train_loss: 0.7470, test_loss: 1.0054, test_f1: 0.5636
 epoch: 58, train_loss: 0.7471, test_loss: 1.1563, test_f1: 0.5476
 epoch: 59, train_loss: 0.7236, test_loss: 1.0356, test_f1: 0.5563
 epoch: 60, train_loss: 0.7334, test_loss: 1.2084, test_f1: 0.5369
 epoch: 61, train_loss: 0.7181, test_loss: 0.9677, test_f1: 0.5626
 epoch: 62, train_loss: 0.7328, test_loss: 1.0735, test_f1: 0.5393
 epoch: 63, train_loss: 0.7122, test_loss: 0.9585, test_f1: 0.5710
 epoch: 64, train_loss: 0.7769, test_loss: 0.9555, test_f1: 0.5781
 epoch: 65, train_loss: 0.7322, test_loss: 1.0351, test_f1: 0.5466
 epoch: 66, train_loss: 0.7285, test_loss: 0.9444, test_f1: 0.5655
 epoch: 67, train_loss: 0.7323, test_loss: 1.0455, test_f1: 0.5473
 epoch: 68, train_loss: 0.7025, test_loss: 1.0869, test_f1: 0.5419
 epoch: 69, train_loss: 0.7170, test_loss: 1.1757, test_f1: 0.5488
 epoch: 70, train_loss: 0.7052, test_loss: 1.1267, test_f1: 0.5418
 epoch: 71, train_loss: 0.7073, test_loss: 1.1008, test_f1: 0.5189
 epoch: 72, train_loss: 0.6978, test_loss: 1.0152, test_f1: 0.5583
 epoch: 73, train_loss: 0.6998, test_loss: 1.1004, test_f1: 0.5194
 epoch: 74, train_loss: 0.6958, test_loss: 1.0565, test_f1: 0.5563
 epoch: 75, train_loss: 0.6879, test_loss: 1.0025, test_f1: 0.5397
 epoch: 76, train_loss: 0.7077, test_loss: 0.9551, test_f1: 0.5681
 epoch: 77, train_loss: 0.6853, test_loss: 1.1680, test_f1: 0.5536
 epoch: 78, train_loss: 0.6997, test_loss: 1.1528, test_f1: 0.5324
 epoch: 79, train_loss: 0.6800, test_loss: 1.3761, test_f1: 0.5236
 epoch: 80, train_loss: 0.6847, test_loss: 1.2463, test_f1: 0.5493
 epoch: 81, train_loss: 0.6627, test_loss: 1.0259, test_f1: 0.5773
 epoch: 82, train_loss: 0.6818, test_loss: 1.2581, test_f1: 0.5506
 epoch: 83, train_loss: 0.6893, test_loss: 1.1382, test_f1: 0.5310
 epoch: 84, train_loss: 0.6879, test_loss: 1.1390, test_f1: 0.5401
 epoch: 85, train_loss: 0.6679, test_loss: 1.1019, test_f1: 0.5543
 epoch: 86, train_loss: 0.6656, test_loss: 1.0049, test_f1: 0.5253
 epoch: 87, train_loss: 0.6687, test_loss: 1.4324, test_f1: 0.5506
 epoch: 88, train_loss: 0.6638, test_loss: 1.0755, test_f1: 0.5833
 epoch: 89, train_loss: 0.6619, test_loss: 1.0600, test_f1: 0.5859
 epoch: 90, train_loss: 0.6576, test_loss: 1.2502, test_f1: 0.5494
 epoch: 91, train_loss: 0.6598, test_loss: 1.2003, test_f1: 0.5483
 epoch: 92, train_loss: 0.6693, test_loss: 1.2681, test_f1: 0.5741
 epoch: 93, train_loss: 0.6556, test_loss: 1.1368, test_f1: 0.5594
 epoch: 94, train_loss: 0.6339, test_loss: 1.1247, test_f1: 0.5312
 epoch: 95, train_loss: 0.6428, test_loss: 1.1800, test_f1: 0.5374
 epoch: 96, train_loss: 0.6356, test_loss: 1.4104, test_f1: 0.5454
 epoch: 97, train_loss: 0.6327, test_loss: 1.1493, test_f1: 0.5548
 epoch: 98, train_loss: 0.6602, test_loss: 1.3853, test_f1: 0.5487
 epoch: 99, train_loss: 0.6442, test_loss: 1.1945, test_f1: 0.5691
##################ITERATION #1 ****************************************
 epoch: 0, train_loss: 1.2601, test_loss: 1.1637, test_f1: 0.4192
 epoch: 1, train_loss: 1.1313, test_loss: 1.0495, test_f1: 0.4531
 epoch: 2, train_loss: 1.0726, test_loss: 0.9916, test_f1: 0.4707
 epoch: 3, train_loss: 1.0611, test_loss: 1.0048, test_f1: 0.4840
 epoch: 4, train_loss: 1.0333, test_loss: 1.1123, test_f1: 0.4158
 epoch: 5, train_loss: 1.0082, test_loss: 1.1853, test_f1: 0.4143
 epoch: 6, train_loss: 1.0100, test_loss: 0.9715, test_f1: 0.4948
 epoch: 7, train_loss: 0.9746, test_loss: 1.0781, test_f1: 0.5151
 epoch: 8, train_loss: 0.9737, test_loss: 0.9828, test_f1: 0.4788
 epoch: 9, train_loss: 0.9668, test_loss: 1.0186, test_f1: 0.5110
 epoch: 10, train_loss: 0.9551, test_loss: 1.1110, test_f1: 0.4804
 epoch: 11, train_loss: 0.9485, test_loss: 1.0281, test_f1: 0.5548
 epoch: 12, train_loss: 0.9382, test_loss: 1.0624, test_f1: 0.5453
 epoch: 13, train_loss: 0.9230, test_loss: 1.0395, test_f1: 0.4760
 epoch: 14, train_loss: 0.9267, test_loss: 1.0368, test_f1: 0.5196
 epoch: 15, train_loss: 0.9113, test_loss: 1.1422, test_f1: 0.5161
 epoch: 16, train_loss: 0.9528, test_loss: 1.0908, test_f1: 0.5392
 epoch: 17, train_loss: 0.9102, test_loss: 1.0932, test_f1: 0.5142
 epoch: 18, train_loss: 0.9136, test_loss: 0.9225, test_f1: 0.5600
 epoch: 19, train_loss: 0.8999, test_loss: 0.9821, test_f1: 0.5350
 epoch: 20, train_loss: 0.8980, test_loss: 1.1145, test_f1: 0.4938
 epoch: 21, train_loss: 0.9051, test_loss: 1.0294, test_f1: 0.5427
 epoch: 22, train_loss: 0.8912, test_loss: 1.0737, test_f1: 0.5462
 epoch: 23, train_loss: 0.8867, test_loss: 1.0797, test_f1: 0.5469
 epoch: 24, train_loss: 0.8847, test_loss: 1.0540, test_f1: 0.5315
 epoch: 25, train_loss: 0.8690, test_loss: 1.0801, test_f1: 0.5550
 epoch: 26, train_loss: 0.8622, test_loss: 1.0197, test_f1: 0.5583
 epoch: 27, train_loss: 0.8801, test_loss: 0.9606, test_f1: 0.5335
 epoch: 28, train_loss: 0.8612, test_loss: 1.0013, test_f1: 0.5035
 epoch: 29, train_loss: 0.8561, test_loss: 1.0361, test_f1: 0.5517
 epoch: 30, train_loss: 0.8436, test_loss: 1.0034, test_f1: 0.5738
 epoch: 31, train_loss: 0.8417, test_loss: 0.9861, test_f1: 0.5388
 epoch: 32, train_loss: 0.8518, test_loss: 1.0347, test_f1: 0.5433
 epoch: 33, train_loss: 0.8432, test_loss: 0.9750, test_f1: 0.5600
 epoch: 34, train_loss: 0.8331, test_loss: 1.0794, test_f1: 0.5008
 epoch: 35, train_loss: 0.8307, test_loss: 1.0746, test_f1: 0.5592
 epoch: 36, train_loss: 0.8178, test_loss: 1.0429, test_f1: 0.5776
 epoch: 37, train_loss: 0.8360, test_loss: 0.9878, test_f1: 0.5462
 epoch: 38, train_loss: 0.8082, test_loss: 1.0144, test_f1: 0.5541
 epoch: 39, train_loss: 0.8207, test_loss: 1.0404, test_f1: 0.5411
 epoch: 40, train_loss: 0.8165, test_loss: 1.0404, test_f1: 0.5450
 epoch: 41, train_loss: 0.8086, test_loss: 1.1536, test_f1: 0.5585
 epoch: 42, train_loss: 0.8374, test_loss: 1.0395, test_f1: 0.5567
 epoch: 43, train_loss: 0.8180, test_loss: 1.0527, test_f1: 0.5827
 epoch: 44, train_loss: 0.7945, test_loss: 1.1791, test_f1: 0.5620
 epoch: 45, train_loss: 0.8066, test_loss: 1.1511, test_f1: 0.5453
 epoch: 46, train_loss: 0.7915, test_loss: 1.5257, test_f1: 0.5322
 epoch: 47, train_loss: 0.8207, test_loss: 0.9591, test_f1: 0.5364
 epoch: 48, train_loss: 0.8150, test_loss: 1.0179, test_f1: 0.5867
 epoch: 49, train_loss: 0.8208, test_loss: 1.1386, test_f1: 0.5418
 epoch: 50, train_loss: 0.8040, test_loss: 1.1258, test_f1: 0.5539
 epoch: 51, train_loss: 0.7556, test_loss: 1.3595, test_f1: 0.5568
 epoch: 52, train_loss: 0.7387, test_loss: 1.1998, test_f1: 0.5530
 epoch: 53, train_loss: 0.7420, test_loss: 1.1865, test_f1: 0.5706
 epoch: 54, train_loss: 0.7236, test_loss: 1.1831, test_f1: 0.5615
 epoch: 55, train_loss: 0.7118, test_loss: 1.3167, test_f1: 0.5672
 epoch: 56, train_loss: 0.7100, test_loss: 1.2091, test_f1: 0.6200
 epoch: 57, train_loss: 0.7095, test_loss: 1.1553, test_f1: 0.5596
 epoch: 58, train_loss: 0.7098, test_loss: 1.2399, test_f1: 0.6031
 epoch: 59, train_loss: 0.7139, test_loss: 1.1898, test_f1: 0.5857
 epoch: 60, train_loss: 0.7110, test_loss: 1.1145, test_f1: 0.5697
 epoch: 61, train_loss: 0.6944, test_loss: 1.1571, test_f1: 0.5958
 epoch: 62, train_loss: 0.7038, test_loss: 1.2021, test_f1: 0.5854
 epoch: 63, train_loss: 0.6943, test_loss: 1.2688, test_f1: 0.5695
 epoch: 64, train_loss: 0.7194, test_loss: 1.1511, test_f1: 0.5712
 epoch: 65, train_loss: 0.7088, test_loss: 1.2649, test_f1: 0.5703
 epoch: 66, train_loss: 0.6819, test_loss: 1.1015, test_f1: 0.5776
 epoch: 67, train_loss: 0.6888, test_loss: 1.0600, test_f1: 0.5915
 epoch: 68, train_loss: 0.6710, test_loss: 1.1712, test_f1: 0.5723
 epoch: 69, train_loss: 0.6824, test_loss: 1.1650, test_f1: 0.5889
 epoch: 70, train_loss: 0.6757, test_loss: 1.2344, test_f1: 0.6037
 epoch: 71, train_loss: 0.6897, test_loss: 1.2498, test_f1: 0.5558
 epoch: 72, train_loss: 0.6820, test_loss: 1.2636, test_f1: 0.5826
 epoch: 73, train_loss: 0.6678, test_loss: 1.1804, test_f1: 0.5854
 epoch: 74, train_loss: 0.6693, test_loss: 1.2682, test_f1: 0.5739
 epoch: 75, train_loss: 0.6870, test_loss: 1.2297, test_f1: 0.5886
 epoch: 76, train_loss: 0.6736, test_loss: 1.3332, test_f1: 0.5732
 epoch: 77, train_loss: 0.6619, test_loss: 1.2827, test_f1: 0.5834
 epoch: 78, train_loss: 0.6684, test_loss: 1.1156, test_f1: 0.5991
 epoch: 79, train_loss: 0.6445, test_loss: 1.3030, test_f1: 0.5912
 epoch: 80, train_loss: 0.6485, test_loss: 1.2388, test_f1: 0.5934
 epoch: 81, train_loss: 0.6222, test_loss: 1.1436, test_f1: 0.5870
 epoch: 82, train_loss: 0.6466, test_loss: 1.0591, test_f1: 0.5808
 epoch: 83, train_loss: 0.6583, test_loss: 1.2207, test_f1: 0.5764
 epoch: 84, train_loss: 0.6514, test_loss: 1.1429, test_f1: 0.5819
 epoch: 85, train_loss: 0.6310, test_loss: 1.2058, test_f1: 0.5937
 epoch: 86, train_loss: 0.6420, test_loss: 1.2055, test_f1: 0.5893
 epoch: 87, train_loss: 0.6192, test_loss: 1.3603, test_f1: 0.5677
 epoch: 88, train_loss: 0.6456, test_loss: 1.2484, test_f1: 0.5825
 epoch: 89, train_loss: 0.6369, test_loss: 1.3083, test_f1: 0.5700
 epoch: 90, train_loss: 0.6451, test_loss: 1.1770, test_f1: 0.5773
 epoch: 91, train_loss: 0.6399, test_loss: 1.1949, test_f1: 0.5754
 epoch: 92, train_loss: 0.6324, test_loss: 1.4558, test_f1: 0.5538
 epoch: 93, train_loss: 0.6478, test_loss: 1.4470, test_f1: 0.5845
 epoch: 94, train_loss: 0.6263, test_loss: 1.3851, test_f1: 0.5948
 epoch: 95, train_loss: 0.6381, test_loss: 1.1580, test_f1: 0.5918
 epoch: 96, train_loss: 0.6072, test_loss: 1.2384, test_f1: 0.5800
 epoch: 97, train_loss: 0.6037, test_loss: 1.0913, test_f1: 0.5837
 epoch: 98, train_loss: 0.5904, test_loss: 1.2774, test_f1: 0.5921
 epoch: 99, train_loss: 0.6258, test_loss: 1.3162, test_f1: 0.5745
##################ITERATION #2 ****************************************
 epoch: 0, train_loss: 1.3014, test_loss: 1.2437, test_f1: 0.2468
 epoch: 1, train_loss: 1.1964, test_loss: 1.0935, test_f1: 0.4090
 epoch: 2, train_loss: 1.1158, test_loss: 1.0458, test_f1: 0.4585
 epoch: 3, train_loss: 1.0845, test_loss: 1.0286, test_f1: 0.4246
 epoch: 4, train_loss: 1.0654, test_loss: 0.9871, test_f1: 0.4379
 epoch: 5, train_loss: 1.0533, test_loss: 0.9825, test_f1: 0.4460
 epoch: 6, train_loss: 1.0348, test_loss: 1.0374, test_f1: 0.4486
 epoch: 7, train_loss: 1.0103, test_loss: 0.9402, test_f1: 0.4956
 epoch: 8, train_loss: 0.9843, test_loss: 1.3226, test_f1: 0.4047
 epoch: 9, train_loss: 0.9791, test_loss: 1.0200, test_f1: 0.5120
 epoch: 10, train_loss: 0.9797, test_loss: 0.9659, test_f1: 0.4828
 epoch: 11, train_loss: 0.9857, test_loss: 0.9601, test_f1: 0.5314
 epoch: 12, train_loss: 0.9591, test_loss: 0.9628, test_f1: 0.5490
 epoch: 13, train_loss: 0.9523, test_loss: 1.0531, test_f1: 0.5070
 epoch: 14, train_loss: 0.9596, test_loss: 1.1266, test_f1: 0.4389
 epoch: 15, train_loss: 0.9403, test_loss: 0.9651, test_f1: 0.5171
 epoch: 16, train_loss: 0.9455, test_loss: 1.0072, test_f1: 0.4845
 epoch: 17, train_loss: 0.9460, test_loss: 0.9808, test_f1: 0.4959
 epoch: 18, train_loss: 0.9442, test_loss: 0.9810, test_f1: 0.5058
 epoch: 19, train_loss: 0.9110, test_loss: 1.0054, test_f1: 0.5069
 epoch: 20, train_loss: 0.9073, test_loss: 0.9942, test_f1: 0.5041
 epoch: 21, train_loss: 0.9162, test_loss: 1.0650, test_f1: 0.5075
 epoch: 22, train_loss: 0.9166, test_loss: 1.2040, test_f1: 0.4683
 epoch: 23, train_loss: 0.9216, test_loss: 0.9477, test_f1: 0.4743
 epoch: 24, train_loss: 0.9050, test_loss: 0.9543, test_f1: 0.4789
 epoch: 25, train_loss: 0.8922, test_loss: 0.9611, test_f1: 0.5523
 epoch: 26, train_loss: 0.8736, test_loss: 1.0443, test_f1: 0.5345
 epoch: 27, train_loss: 0.8770, test_loss: 1.2928, test_f1: 0.5297
 epoch: 28, train_loss: 0.8773, test_loss: 1.1552, test_f1: 0.5275
 epoch: 29, train_loss: 0.8939, test_loss: 0.8737, test_f1: 0.5240
 epoch: 30, train_loss: 0.8730, test_loss: 1.0381, test_f1: 0.5044
 epoch: 31, train_loss: 0.9077, test_loss: 1.0567, test_f1: 0.5425
 epoch: 32, train_loss: 0.8852, test_loss: 0.9407, test_f1: 0.5132
 epoch: 33, train_loss: 0.8694, test_loss: 0.9795, test_f1: 0.5507
 epoch: 34, train_loss: 0.8642, test_loss: 1.1692, test_f1: 0.5187
 epoch: 35, train_loss: 0.8511, test_loss: 1.0031, test_f1: 0.5501
 epoch: 36, train_loss: 0.8445, test_loss: 0.9243, test_f1: 0.5610
 epoch: 37, train_loss: 0.8567, test_loss: 0.8873, test_f1: 0.5259
 epoch: 38, train_loss: 0.8421, test_loss: 0.9436, test_f1: 0.5677
 epoch: 39, train_loss: 0.8517, test_loss: 0.9345, test_f1: 0.5295
 epoch: 40, train_loss: 0.8326, test_loss: 0.9077, test_f1: 0.5800
 epoch: 41, train_loss: 0.8267, test_loss: 1.2111, test_f1: 0.5069
 epoch: 42, train_loss: 0.8301, test_loss: 0.8841, test_f1: 0.5481
 epoch: 43, train_loss: 0.8128, test_loss: 1.2334, test_f1: 0.5182
 epoch: 44, train_loss: 0.8295, test_loss: 0.9195, test_f1: 0.5487
 epoch: 45, train_loss: 0.8170, test_loss: 1.1852, test_f1: 0.5600
 epoch: 46, train_loss: 0.8006, test_loss: 1.0981, test_f1: 0.5302
 epoch: 47, train_loss: 0.8435, test_loss: 0.8869, test_f1: 0.5477
 epoch: 48, train_loss: 0.8111, test_loss: 0.9648, test_f1: 0.5424
 epoch: 49, train_loss: 0.8477, test_loss: 1.0042, test_f1: 0.5533
 epoch: 50, train_loss: 0.8406, test_loss: 1.1733, test_f1: 0.5695
 epoch: 51, train_loss: 0.7772, test_loss: 0.9545, test_f1: 0.5852
 epoch: 52, train_loss: 0.7530, test_loss: 0.9542, test_f1: 0.5719
 epoch: 53, train_loss: 0.7417, test_loss: 0.9249, test_f1: 0.5855
 epoch: 54, train_loss: 0.7380, test_loss: 0.9773, test_f1: 0.5983
 epoch: 55, train_loss: 0.7493, test_loss: 0.8604, test_f1: 0.5891
 epoch: 56, train_loss: 0.7378, test_loss: 0.8914, test_f1: 0.5795
 epoch: 57, train_loss: 0.7315, test_loss: 0.9793, test_f1: 0.5851
 epoch: 58, train_loss: 0.7225, test_loss: 0.8719, test_f1: 0.5887
 epoch: 59, train_loss: 0.7308, test_loss: 1.0174, test_f1: 0.5650
 epoch: 60, train_loss: 0.7369, test_loss: 0.9680, test_f1: 0.5644
 epoch: 61, train_loss: 0.7131, test_loss: 0.9631, test_f1: 0.5939
 epoch: 62, train_loss: 0.7360, test_loss: 0.9732, test_f1: 0.5692
 epoch: 63, train_loss: 0.7118, test_loss: 1.0973, test_f1: 0.5931
 epoch: 64, train_loss: 0.7304, test_loss: 1.1781, test_f1: 0.5816
 epoch: 65, train_loss: 0.7045, test_loss: 1.1653, test_f1: 0.5587
 epoch: 66, train_loss: 0.7226, test_loss: 0.9243, test_f1: 0.5786
 epoch: 67, train_loss: 0.6949, test_loss: 1.0461, test_f1: 0.5861
 epoch: 68, train_loss: 0.7338, test_loss: 0.9579, test_f1: 0.5868
 epoch: 69, train_loss: 0.7062, test_loss: 0.9050, test_f1: 0.5831
 epoch: 70, train_loss: 0.6888, test_loss: 0.9978, test_f1: 0.5835
 epoch: 71, train_loss: 0.6868, test_loss: 1.0293, test_f1: 0.5716
 epoch: 72, train_loss: 0.6723, test_loss: 1.0237, test_f1: 0.5920
 epoch: 73, train_loss: 0.6804, test_loss: 1.0296, test_f1: 0.5909
 epoch: 74, train_loss: 0.6625, test_loss: 1.1283, test_f1: 0.5718
 epoch: 75, train_loss: 0.6662, test_loss: 1.0420, test_f1: 0.5965
 epoch: 76, train_loss: 0.6828, test_loss: 1.0649, test_f1: 0.5837
 epoch: 77, train_loss: 0.6835, test_loss: 1.1152, test_f1: 0.5854
 epoch: 78, train_loss: 0.6678, test_loss: 1.0322, test_f1: 0.5730
 epoch: 79, train_loss: 0.6786, test_loss: 1.0873, test_f1: 0.5690
 epoch: 80, train_loss: 0.6581, test_loss: 1.3037, test_f1: 0.5510
 epoch: 81, train_loss: 0.6441, test_loss: 1.1614, test_f1: 0.6013
 epoch: 82, train_loss: 0.6557, test_loss: 0.9462, test_f1: 0.5853
 epoch: 83, train_loss: 0.6488, test_loss: 1.2322, test_f1: 0.5738
 epoch: 84, train_loss: 0.6496, test_loss: 1.0161, test_f1: 0.5893
 epoch: 85, train_loss: 0.6362, test_loss: 1.0339, test_f1: 0.6006
 epoch: 86, train_loss: 0.6636, test_loss: 1.1626, test_f1: 0.5263
 epoch: 87, train_loss: 0.6669, test_loss: 0.9679, test_f1: 0.5859
 epoch: 88, train_loss: 0.6550, test_loss: 1.0116, test_f1: 0.5861
 epoch: 89, train_loss: 0.6337, test_loss: 1.1428, test_f1: 0.5714
 epoch: 90, train_loss: 0.6219, test_loss: 1.1504, test_f1: 0.5528
 epoch: 91, train_loss: 0.6475, test_loss: 1.1061, test_f1: 0.5663
 epoch: 92, train_loss: 0.6370, test_loss: 1.0639, test_f1: 0.5572
 epoch: 93, train_loss: 0.6358, test_loss: 0.9749, test_f1: 0.5948
 epoch: 94, train_loss: 0.6297, test_loss: 1.0670, test_f1: 0.5659
 epoch: 95, train_loss: 0.6290, test_loss: 1.0830, test_f1: 0.5617
 epoch: 96, train_loss: 0.6429, test_loss: 1.0449, test_f1: 0.5842
 epoch: 97, train_loss: 0.6225, test_loss: 1.2855, test_f1: 0.5325
 epoch: 98, train_loss: 0.6358, test_loss: 1.1534, test_f1: 0.5719
 epoch: 99, train_loss: 0.6305, test_loss: 1.2137, test_f1: 0.5454
##################ITERATION #3 ****************************************
 epoch: 0, train_loss: 1.2637, test_loss: 1.2231, test_f1: 0.3411
 epoch: 1, train_loss: 1.1587, test_loss: 1.1152, test_f1: 0.3584
 epoch: 2, train_loss: 1.1125, test_loss: 1.0574, test_f1: 0.4465
 epoch: 3, train_loss: 1.0774, test_loss: 0.9704, test_f1: 0.4799
 epoch: 4, train_loss: 1.0556, test_loss: 1.0422, test_f1: 0.4661
 epoch: 5, train_loss: 1.0288, test_loss: 0.9829, test_f1: 0.4693
 epoch: 6, train_loss: 1.0114, test_loss: 1.0214, test_f1: 0.4855
 epoch: 7, train_loss: 0.9949, test_loss: 0.9821, test_f1: 0.4778
 epoch: 8, train_loss: 0.9851, test_loss: 1.0614, test_f1: 0.4879
 epoch: 9, train_loss: 0.9846, test_loss: 1.0666, test_f1: 0.5276
 epoch: 10, train_loss: 0.9622, test_loss: 0.9549, test_f1: 0.5240
 epoch: 11, train_loss: 0.9614, test_loss: 0.9536, test_f1: 0.4941
 epoch: 12, train_loss: 0.9383, test_loss: 0.9654, test_f1: 0.4981
 epoch: 13, train_loss: 0.9406, test_loss: 0.9413, test_f1: 0.5238
 epoch: 14, train_loss: 0.9297, test_loss: 1.0296, test_f1: 0.5059
 epoch: 15, train_loss: 0.9314, test_loss: 0.9894, test_f1: 0.4867
 epoch: 16, train_loss: 0.9295, test_loss: 1.0070, test_f1: 0.5158
 epoch: 17, train_loss: 0.9569, test_loss: 1.1373, test_f1: 0.4603
 epoch: 18, train_loss: 0.9117, test_loss: 1.0135, test_f1: 0.4777
 epoch: 19, train_loss: 0.8995, test_loss: 1.0199, test_f1: 0.5172
 epoch: 20, train_loss: 0.9121, test_loss: 1.0589, test_f1: 0.5102
 epoch: 21, train_loss: 0.9091, test_loss: 0.9971, test_f1: 0.5274
 epoch: 22, train_loss: 0.9094, test_loss: 1.0093, test_f1: 0.5588
 epoch: 23, train_loss: 0.8907, test_loss: 0.9420, test_f1: 0.5281
 epoch: 24, train_loss: 0.8835, test_loss: 1.0112, test_f1: 0.5383
 epoch: 25, train_loss: 0.9000, test_loss: 1.0457, test_f1: 0.5187
 epoch: 26, train_loss: 0.8743, test_loss: 1.0115, test_f1: 0.5171
 epoch: 27, train_loss: 0.8796, test_loss: 0.9095, test_f1: 0.5360
 epoch: 28, train_loss: 0.8662, test_loss: 0.9980, test_f1: 0.5516
 epoch: 29, train_loss: 0.8801, test_loss: 1.0210, test_f1: 0.5532
 epoch: 30, train_loss: 0.8826, test_loss: 0.9334, test_f1: 0.5660
 epoch: 31, train_loss: 0.8518, test_loss: 0.9897, test_f1: 0.5480
 epoch: 32, train_loss: 0.8555, test_loss: 0.9918, test_f1: 0.5150
 epoch: 33, train_loss: 0.8563, test_loss: 1.1313, test_f1: 0.4969
 epoch: 34, train_loss: 0.8607, test_loss: 0.9944, test_f1: 0.5082
 epoch: 35, train_loss: 0.8487, test_loss: 1.1238, test_f1: 0.5281
 epoch: 36, train_loss: 0.8490, test_loss: 1.0797, test_f1: 0.5434
 epoch: 37, train_loss: 0.8479, test_loss: 1.0979, test_f1: 0.5643
 epoch: 38, train_loss: 0.8459, test_loss: 1.1252, test_f1: 0.5530
 epoch: 39, train_loss: 0.8483, test_loss: 1.2761, test_f1: 0.5319
 epoch: 40, train_loss: 0.8332, test_loss: 1.1057, test_f1: 0.5310
 epoch: 41, train_loss: 0.8453, test_loss: 1.1871, test_f1: 0.5699
 epoch: 42, train_loss: 0.8595, test_loss: 1.0521, test_f1: 0.5242
 epoch: 43, train_loss: 0.8253, test_loss: 1.1837, test_f1: 0.5869
 epoch: 44, train_loss: 0.8180, test_loss: 1.1966, test_f1: 0.5125
 epoch: 45, train_loss: 0.8224, test_loss: 0.9411, test_f1: 0.5706
 epoch: 46, train_loss: 0.7942, test_loss: 1.1079, test_f1: 0.5615
 epoch: 47, train_loss: 0.8115, test_loss: 1.1058, test_f1: 0.5602
 epoch: 48, train_loss: 0.8372, test_loss: 1.1583, test_f1: 0.5223
 epoch: 49, train_loss: 0.8250, test_loss: 1.1580, test_f1: 0.5619
 epoch: 50, train_loss: 0.8034, test_loss: 1.1968, test_f1: 0.5604
 epoch: 51, train_loss: 0.7896, test_loss: 0.9683, test_f1: 0.5822
 epoch: 52, train_loss: 0.7562, test_loss: 1.0844, test_f1: 0.5760
 epoch: 53, train_loss: 0.7715, test_loss: 1.1220, test_f1: 0.5804
 epoch: 54, train_loss: 0.7570, test_loss: 1.1763, test_f1: 0.5609
 epoch: 55, train_loss: 0.7586, test_loss: 1.0480, test_f1: 0.5894
 epoch: 56, train_loss: 0.7620, test_loss: 1.0818, test_f1: 0.5879
 epoch: 57, train_loss: 0.7467, test_loss: 1.1036, test_f1: 0.5867
 epoch: 58, train_loss: 0.7416, test_loss: 1.1736, test_f1: 0.5843
 epoch: 59, train_loss: 0.7414, test_loss: 1.1347, test_f1: 0.5863
 epoch: 60, train_loss: 0.7236, test_loss: 1.1548, test_f1: 0.5729
 epoch: 61, train_loss: 0.7082, test_loss: 1.1260, test_f1: 0.5751
 epoch: 62, train_loss: 0.7140, test_loss: 1.0880, test_f1: 0.5729
 epoch: 63, train_loss: 0.7290, test_loss: 1.1953, test_f1: 0.5668
 epoch: 64, train_loss: 0.7021, test_loss: 1.1219, test_f1: 0.5835
 epoch: 65, train_loss: 0.7190, test_loss: 1.1479, test_f1: 0.5885
 epoch: 66, train_loss: 0.7187, test_loss: 1.2064, test_f1: 0.5522
 epoch: 67, train_loss: 0.6890, test_loss: 1.1955, test_f1: 0.5751
 epoch: 68, train_loss: 0.7264, test_loss: 1.3343, test_f1: 0.5450
 epoch: 69, train_loss: 0.7052, test_loss: 1.1264, test_f1: 0.5752
 epoch: 70, train_loss: 0.7007, test_loss: 1.3148, test_f1: 0.5563
 epoch: 71, train_loss: 0.7052, test_loss: 1.1943, test_f1: 0.5667
 epoch: 72, train_loss: 0.6867, test_loss: 1.2011, test_f1: 0.5914
 epoch: 73, train_loss: 0.6935, test_loss: 1.1788, test_f1: 0.5844
 epoch: 74, train_loss: 0.6958, test_loss: 1.2116, test_f1: 0.5808
 epoch: 75, train_loss: 0.6936, test_loss: 1.2016, test_f1: 0.5596
 epoch: 76, train_loss: 0.6768, test_loss: 1.4026, test_f1: 0.5376
 epoch: 77, train_loss: 0.6724, test_loss: 1.2274, test_f1: 0.5768
 epoch: 78, train_loss: 0.6897, test_loss: 1.2817, test_f1: 0.5723
 epoch: 79, train_loss: 0.7022, test_loss: 1.2210, test_f1: 0.5869
 epoch: 80, train_loss: 0.6633, test_loss: 1.2941, test_f1: 0.5834
 epoch: 81, train_loss: 0.6594, test_loss: 1.2305, test_f1: 0.5732
 epoch: 82, train_loss: 0.6706, test_loss: 1.3488, test_f1: 0.5777
 epoch: 83, train_loss: 0.6511, test_loss: 1.3351, test_f1: 0.5649
 epoch: 84, train_loss: 0.6468, test_loss: 1.2167, test_f1: 0.5652
 epoch: 85, train_loss: 0.6821, test_loss: 1.1419, test_f1: 0.5609
 epoch: 86, train_loss: 0.6660, test_loss: 1.2526, test_f1: 0.5657
 epoch: 87, train_loss: 0.6454, test_loss: 1.3189, test_f1: 0.5707
 epoch: 88, train_loss: 0.6716, test_loss: 1.3203, test_f1: 0.5632
 epoch: 89, train_loss: 0.6748, test_loss: 1.2151, test_f1: 0.5866
 epoch: 90, train_loss: 0.6477, test_loss: 1.3325, test_f1: 0.5347
 epoch: 91, train_loss: 0.6444, test_loss: 1.3647, test_f1: 0.5342
 epoch: 92, train_loss: 0.6391, test_loss: 1.2145, test_f1: 0.5636
 epoch: 93, train_loss: 0.6393, test_loss: 1.2072, test_f1: 0.5661
 epoch: 94, train_loss: 0.6357, test_loss: 1.3500, test_f1: 0.5868
 epoch: 95, train_loss: 0.6331, test_loss: 1.2205, test_f1: 0.6101
 epoch: 96, train_loss: 0.6282, test_loss: 1.2025, test_f1: 0.5797
 epoch: 97, train_loss: 0.6415, test_loss: 1.3346, test_f1: 0.5762
 epoch: 98, train_loss: 0.6271, test_loss: 1.2843, test_f1: 0.6046
 epoch: 99, train_loss: 0.6241, test_loss: 1.4060, test_f1: 0.5969
##################ITERATION #4 ****************************************
 epoch: 0, train_loss: 1.2906, test_loss: 1.2147, test_f1: 0.3409
 epoch: 1, train_loss: 1.1856, test_loss: 1.1173, test_f1: 0.3844
 epoch: 2, train_loss: 1.1243, test_loss: 1.0548, test_f1: 0.4393
 epoch: 3, train_loss: 1.1125, test_loss: 0.9965, test_f1: 0.4543
 epoch: 4, train_loss: 1.0561, test_loss: 1.0053, test_f1: 0.4474
 epoch: 5, train_loss: 1.0502, test_loss: 0.9988, test_f1: 0.4677
 epoch: 6, train_loss: 1.0158, test_loss: 0.9920, test_f1: 0.4636
 epoch: 7, train_loss: 1.0201, test_loss: 1.0673, test_f1: 0.4655
 epoch: 8, train_loss: 1.0021, test_loss: 1.0305, test_f1: 0.4681
 epoch: 9, train_loss: 0.9883, test_loss: 1.0447, test_f1: 0.4791
 epoch: 10, train_loss: 0.9711, test_loss: 1.0405, test_f1: 0.4810
 epoch: 11, train_loss: 0.9752, test_loss: 1.0963, test_f1: 0.4780
 epoch: 12, train_loss: 0.9740, test_loss: 1.0394, test_f1: 0.4488
 epoch: 13, train_loss: 0.9761, test_loss: 1.0901, test_f1: 0.5019
 epoch: 14, train_loss: 0.9593, test_loss: 1.0525, test_f1: 0.4441
 epoch: 15, train_loss: 0.9452, test_loss: 1.1040, test_f1: 0.4887
 epoch: 16, train_loss: 0.9442, test_loss: 1.0599, test_f1: 0.4953
 epoch: 17, train_loss: 0.9556, test_loss: 1.0025, test_f1: 0.4922
 epoch: 18, train_loss: 0.9325, test_loss: 1.0801, test_f1: 0.5260
 epoch: 19, train_loss: 0.9059, test_loss: 1.0579, test_f1: 0.5192
 epoch: 20, train_loss: 0.9321, test_loss: 1.0147, test_f1: 0.4945
 epoch: 21, train_loss: 0.9117, test_loss: 1.0873, test_f1: 0.5080
 epoch: 22, train_loss: 0.9166, test_loss: 0.9922, test_f1: 0.5250
 epoch: 23, train_loss: 0.9108, test_loss: 0.9319, test_f1: 0.5263
 epoch: 24, train_loss: 0.9047, test_loss: 1.0491, test_f1: 0.5531
 epoch: 25, train_loss: 0.9057, test_loss: 1.0274, test_f1: 0.5090
 epoch: 26, train_loss: 0.9017, test_loss: 1.0275, test_f1: 0.5117
 epoch: 27, train_loss: 0.8974, test_loss: 1.2627, test_f1: 0.4672
 epoch: 28, train_loss: 0.8898, test_loss: 0.9869, test_f1: 0.4847
 epoch: 29, train_loss: 0.8733, test_loss: 0.9425, test_f1: 0.5381
 epoch: 30, train_loss: 0.8850, test_loss: 1.0061, test_f1: 0.5446
 epoch: 31, train_loss: 0.8810, test_loss: 0.9483, test_f1: 0.5819
 epoch: 32, train_loss: 0.8709, test_loss: 1.0639, test_f1: 0.5518
 epoch: 33, train_loss: 0.8978, test_loss: 0.9899, test_f1: 0.4995
 epoch: 34, train_loss: 0.8590, test_loss: 0.9641, test_f1: 0.5298
 epoch: 35, train_loss: 0.8638, test_loss: 1.1007, test_f1: 0.5404
 epoch: 36, train_loss: 0.8583, test_loss: 1.1338, test_f1: 0.4989
 epoch: 37, train_loss: 0.8677, test_loss: 1.0176, test_f1: 0.5581
 epoch: 38, train_loss: 0.8601, test_loss: 0.9325, test_f1: 0.5312
 epoch: 39, train_loss: 0.8516, test_loss: 1.0296, test_f1: 0.5359
 epoch: 40, train_loss: 0.8458, test_loss: 0.9852, test_f1: 0.5230
 epoch: 41, train_loss: 0.8377, test_loss: 1.1679, test_f1: 0.5037
 epoch: 42, train_loss: 0.8599, test_loss: 0.9432, test_f1: 0.5727
 epoch: 43, train_loss: 0.8522, test_loss: 1.0673, test_f1: 0.5413
 epoch: 44, train_loss: 0.8343, test_loss: 0.9848, test_f1: 0.5168
 epoch: 45, train_loss: 0.8586, test_loss: 0.9663, test_f1: 0.5408
 epoch: 46, train_loss: 0.8376, test_loss: 1.0791, test_f1: 0.5110
 epoch: 47, train_loss: 0.8361, test_loss: 0.9298, test_f1: 0.5671
 epoch: 48, train_loss: 0.8176, test_loss: 0.9600, test_f1: 0.5612
 epoch: 49, train_loss: 0.8315, test_loss: 1.0565, test_f1: 0.5582
 epoch: 50, train_loss: 0.8271, test_loss: 1.1350, test_f1: 0.5314
 epoch: 51, train_loss: 0.8006, test_loss: 1.0173, test_f1: 0.5673
 epoch: 52, train_loss: 0.7888, test_loss: 1.0718, test_f1: 0.5198
 epoch: 53, train_loss: 0.7695, test_loss: 1.0415, test_f1: 0.5517
 epoch: 54, train_loss: 0.7700, test_loss: 1.0905, test_f1: 0.5668
 epoch: 55, train_loss: 0.7608, test_loss: 1.0219, test_f1: 0.5413
 epoch: 56, train_loss: 0.7534, test_loss: 1.0595, test_f1: 0.5741
 epoch: 57, train_loss: 0.7459, test_loss: 0.9690, test_f1: 0.5647
 epoch: 58, train_loss: 0.7578, test_loss: 1.0342, test_f1: 0.5461
 epoch: 59, train_loss: 0.7596, test_loss: 1.0957, test_f1: 0.5319
 epoch: 60, train_loss: 0.7558, test_loss: 1.0523, test_f1: 0.5531
 epoch: 61, train_loss: 0.7575, test_loss: 1.0749, test_f1: 0.5158
 epoch: 62, train_loss: 0.7383, test_loss: 1.1491, test_f1: 0.5178
 epoch: 63, train_loss: 0.7449, test_loss: 1.0897, test_f1: 0.5266
 epoch: 64, train_loss: 0.7313, test_loss: 1.2652, test_f1: 0.5343
 epoch: 65, train_loss: 0.7261, test_loss: 1.2245, test_f1: 0.5389
 epoch: 66, train_loss: 0.7220, test_loss: 1.0578, test_f1: 0.5557
 epoch: 67, train_loss: 0.7212, test_loss: 1.0744, test_f1: 0.5622
 epoch: 68, train_loss: 0.7116, test_loss: 1.0694, test_f1: 0.5557
 epoch: 69, train_loss: 0.6954, test_loss: 1.5299, test_f1: 0.5488
 epoch: 70, train_loss: 0.7120, test_loss: 1.0901, test_f1: 0.5878
 epoch: 71, train_loss: 0.7351, test_loss: 1.0832, test_f1: 0.5353
 epoch: 72, train_loss: 0.7048, test_loss: 1.1662, test_f1: 0.5418
 epoch: 73, train_loss: 0.7044, test_loss: 1.1418, test_f1: 0.5599
 epoch: 74, train_loss: 0.7055, test_loss: 1.2120, test_f1: 0.5118
 epoch: 75, train_loss: 0.7118, test_loss: 1.1270, test_f1: 0.5550
 epoch: 76, train_loss: 0.7103, test_loss: 1.2931, test_f1: 0.5805
 epoch: 77, train_loss: 0.6917, test_loss: 1.1661, test_f1: 0.5556
 epoch: 78, train_loss: 0.6937, test_loss: 1.1613, test_f1: 0.5479
 epoch: 79, train_loss: 0.8779, test_loss: 1.0102, test_f1: 0.5446
 epoch: 80, train_loss: 0.8055, test_loss: 1.1422, test_f1: 0.5144
 epoch: 81, train_loss: 0.7723, test_loss: 1.0040, test_f1: 0.5859
 epoch: 82, train_loss: 0.7416, test_loss: 1.0619, test_f1: 0.5583
 epoch: 83, train_loss: 0.7356, test_loss: 1.0714, test_f1: 0.5705
 epoch: 84, train_loss: 0.7390, test_loss: 1.1778, test_f1: 0.5846
 epoch: 85, train_loss: 0.7123, test_loss: 1.2252, test_f1: 0.5722
 epoch: 86, train_loss: 0.7266, test_loss: 1.1154, test_f1: 0.5580
 epoch: 87, train_loss: 0.7040, test_loss: 1.1004, test_f1: 0.5803
 epoch: 88, train_loss: 0.6992, test_loss: 1.1160, test_f1: 0.5756
 epoch: 89, train_loss: 0.6917, test_loss: 1.1943, test_f1: 0.5668
 epoch: 90, train_loss: 0.7108, test_loss: 1.3104, test_f1: 0.5526
 epoch: 91, train_loss: 0.6899, test_loss: 1.2027, test_f1: 0.5654
 epoch: 92, train_loss: 0.6646, test_loss: 1.1454, test_f1: 0.5600
 epoch: 93, train_loss: 0.6996, test_loss: 1.1788, test_f1: 0.5566
 epoch: 94, train_loss: 0.6938, test_loss: 1.1713, test_f1: 0.5692
 epoch: 95, train_loss: 0.6834, test_loss: 1.1299, test_f1: 0.5555
 epoch: 96, train_loss: 0.6702, test_loss: 1.1131, test_f1: 0.5679
 epoch: 97, train_loss: 0.6768, test_loss: 1.1742, test_f1: 0.5739
 epoch: 98, train_loss: 0.6664, test_loss: 1.2715, test_f1: 0.5192
 epoch: 99, train_loss: 0.6904, test_loss: 1.0911, test_f1: 0.5851
##################ITERATION #5 ****************************************
 epoch: 0, train_loss: 1.2528, test_loss: 1.1588, test_f1: 0.3296
 epoch: 1, train_loss: 1.1293, test_loss: 1.1033, test_f1: 0.4867
 epoch: 2, train_loss: 1.0867, test_loss: 1.0131, test_f1: 0.4369
 epoch: 3, train_loss: 1.0664, test_loss: 0.9696, test_f1: 0.4879
 epoch: 4, train_loss: 1.0215, test_loss: 1.0574, test_f1: 0.4781
 epoch: 5, train_loss: 1.0008, test_loss: 0.9460, test_f1: 0.4842
 epoch: 6, train_loss: 0.9919, test_loss: 0.9592, test_f1: 0.4799
 epoch: 7, train_loss: 0.9762, test_loss: 1.0293, test_f1: 0.4853
 epoch: 8, train_loss: 0.9646, test_loss: 0.9890, test_f1: 0.4819
 epoch: 9, train_loss: 0.9688, test_loss: 1.0114, test_f1: 0.5170
 epoch: 10, train_loss: 0.9577, test_loss: 1.1195, test_f1: 0.5013
 epoch: 11, train_loss: 0.9673, test_loss: 0.9290, test_f1: 0.5052
 epoch: 12, train_loss: 0.9444, test_loss: 1.1444, test_f1: 0.5248
 epoch: 13, train_loss: 0.9276, test_loss: 1.1110, test_f1: 0.5187
 epoch: 14, train_loss: 0.9305, test_loss: 1.0900, test_f1: 0.4988
 epoch: 15, train_loss: 0.9302, test_loss: 1.0820, test_f1: 0.5345
 epoch: 16, train_loss: 0.9026, test_loss: 1.0740, test_f1: 0.5128
 epoch: 17, train_loss: 0.9105, test_loss: 1.0454, test_f1: 0.5293
 epoch: 18, train_loss: 0.8942, test_loss: 1.0793, test_f1: 0.5294
 epoch: 19, train_loss: 0.8955, test_loss: 1.0455, test_f1: 0.5038
 epoch: 20, train_loss: 0.9081, test_loss: 1.0366, test_f1: 0.4991
 epoch: 21, train_loss: 0.8926, test_loss: 1.0592, test_f1: 0.5375
 epoch: 22, train_loss: 0.8807, test_loss: 0.9822, test_f1: 0.5391
 epoch: 23, train_loss: 0.9003, test_loss: 1.0592, test_f1: 0.5301
 epoch: 24, train_loss: 0.8688, test_loss: 1.2546, test_f1: 0.4855
 epoch: 25, train_loss: 0.8914, test_loss: 1.4011, test_f1: 0.4782
 epoch: 26, train_loss: 0.9452, test_loss: 1.0003, test_f1: 0.5284
 epoch: 27, train_loss: 0.8978, test_loss: 1.1191, test_f1: 0.5438
 epoch: 28, train_loss: 0.8907, test_loss: 1.1752, test_f1: 0.4704
 epoch: 29, train_loss: 0.8796, test_loss: 1.0883, test_f1: 0.5210
 epoch: 30, train_loss: 0.8623, test_loss: 1.0580, test_f1: 0.5574
 epoch: 31, train_loss: 0.8481, test_loss: 1.2459, test_f1: 0.5355
 epoch: 32, train_loss: 0.8400, test_loss: 1.1044, test_f1: 0.5744
 epoch: 33, train_loss: 0.8653, test_loss: 0.9483, test_f1: 0.5557
 epoch: 34, train_loss: 0.8674, test_loss: 1.0012, test_f1: 0.5555
 epoch: 35, train_loss: 0.8582, test_loss: 1.1198, test_f1: 0.5321
 epoch: 36, train_loss: 0.8428, test_loss: 1.1011, test_f1: 0.5687
 epoch: 37, train_loss: 0.8459, test_loss: 1.0169, test_f1: 0.5558
 epoch: 38, train_loss: 0.8724, test_loss: 0.9389, test_f1: 0.5529
 epoch: 39, train_loss: 0.8304, test_loss: 1.0714, test_f1: 0.5698
 epoch: 40, train_loss: 0.8388, test_loss: 1.0983, test_f1: 0.5622
 epoch: 41, train_loss: 0.8100, test_loss: 1.0269, test_f1: 0.5355
 epoch: 42, train_loss: 0.8454, test_loss: 0.9569, test_f1: 0.5194
 epoch: 43, train_loss: 0.8259, test_loss: 1.0098, test_f1: 0.5592
 epoch: 44, train_loss: 0.8355, test_loss: 1.0338, test_f1: 0.5380
 epoch: 45, train_loss: 0.8097, test_loss: 1.0234, test_f1: 0.5113
 epoch: 46, train_loss: 0.8147, test_loss: 1.3054, test_f1: 0.5353
 epoch: 47, train_loss: 0.8275, test_loss: 1.0173, test_f1: 0.5610
 epoch: 48, train_loss: 0.8240, test_loss: 1.2357, test_f1: 0.5337
 epoch: 49, train_loss: 0.8094, test_loss: 1.0966, test_f1: 0.5769
 epoch: 50, train_loss: 0.8197, test_loss: 1.1186, test_f1: 0.5163
 epoch: 51, train_loss: 0.7860, test_loss: 1.1280, test_f1: 0.5833
 epoch: 52, train_loss: 0.7664, test_loss: 1.0111, test_f1: 0.5735
 epoch: 53, train_loss: 0.7606, test_loss: 0.9590, test_f1: 0.5802
 epoch: 54, train_loss: 0.7603, test_loss: 1.0062, test_f1: 0.5729
 epoch: 55, train_loss: 0.7685, test_loss: 1.0225, test_f1: 0.5653
 epoch: 56, train_loss: 0.7634, test_loss: 1.0939, test_f1: 0.5249
 epoch: 57, train_loss: 0.7755, test_loss: 1.1121, test_f1: 0.5649
 epoch: 58, train_loss: 0.7499, test_loss: 1.0591, test_f1: 0.5674
 epoch: 59, train_loss: 0.7432, test_loss: 1.0391, test_f1: 0.5491
 epoch: 60, train_loss: 0.7456, test_loss: 1.0314, test_f1: 0.5757
 epoch: 61, train_loss: 0.7467, test_loss: 1.1909, test_f1: 0.5591
 epoch: 62, train_loss: 0.7456, test_loss: 1.1245, test_f1: 0.5532
 epoch: 63, train_loss: 0.7388, test_loss: 1.1042, test_f1: 0.5728
 epoch: 64, train_loss: 0.7391, test_loss: 1.0256, test_f1: 0.5802
 epoch: 65, train_loss: 0.7363, test_loss: 1.1805, test_f1: 0.5689
 epoch: 66, train_loss: 0.7366, test_loss: 1.0696, test_f1: 0.5839
 epoch: 67, train_loss: 0.7430, test_loss: 1.0617, test_f1: 0.5695
 epoch: 68, train_loss: 0.7232, test_loss: 0.9921, test_f1: 0.5770
 epoch: 69, train_loss: 0.7471, test_loss: 0.9629, test_f1: 0.5591
 epoch: 70, train_loss: 0.7301, test_loss: 1.0256, test_f1: 0.5811
 epoch: 71, train_loss: 0.7219, test_loss: 0.9852, test_f1: 0.5684
 epoch: 72, train_loss: 0.7076, test_loss: 1.0370, test_f1: 0.5616
 epoch: 73, train_loss: 0.7110, test_loss: 1.0279, test_f1: 0.5810
 epoch: 74, train_loss: 0.7003, test_loss: 1.1987, test_f1: 0.5542
 epoch: 75, train_loss: 0.7193, test_loss: 1.1187, test_f1: 0.5686
 epoch: 76, train_loss: 0.7071, test_loss: 1.1395, test_f1: 0.5909
 epoch: 77, train_loss: 0.7076, test_loss: 1.2791, test_f1: 0.5641
 epoch: 78, train_loss: 0.6988, test_loss: 1.1112, test_f1: 0.5810
 epoch: 79, train_loss: 0.7082, test_loss: 1.1502, test_f1: 0.5674
 epoch: 80, train_loss: 0.7014, test_loss: 1.2931, test_f1: 0.5720
 epoch: 81, train_loss: 0.6894, test_loss: 1.1424, test_f1: 0.5875
 epoch: 82, train_loss: 0.6933, test_loss: 1.2005, test_f1: 0.5551
 epoch: 83, train_loss: 0.6827, test_loss: 1.1715, test_f1: 0.5801
 epoch: 84, train_loss: 0.6900, test_loss: 1.1906, test_f1: 0.5559
 epoch: 85, train_loss: 0.6974, test_loss: 1.1222, test_f1: 0.5933
 epoch: 86, train_loss: 0.6864, test_loss: 1.2467, test_f1: 0.5624
 epoch: 87, train_loss: 0.6921, test_loss: 1.1894, test_f1: 0.5449
 epoch: 88, train_loss: 0.6948, test_loss: 1.0106, test_f1: 0.5770
 epoch: 89, train_loss: 0.6812, test_loss: 1.0335, test_f1: 0.6009
 epoch: 90, train_loss: 0.6766, test_loss: 0.9646, test_f1: 0.5748
 epoch: 91, train_loss: 0.6686, test_loss: 1.1767, test_f1: 0.5343
 epoch: 92, train_loss: 0.6792, test_loss: 1.0585, test_f1: 0.5580
 epoch: 93, train_loss: 0.6794, test_loss: 1.1595, test_f1: 0.5809
 epoch: 94, train_loss: 0.6765, test_loss: 1.3472, test_f1: 0.5706
 epoch: 95, train_loss: 0.6859, test_loss: 1.1524, test_f1: 0.5853
 epoch: 96, train_loss: 0.6592, test_loss: 1.2152, test_f1: 0.5633
 epoch: 97, train_loss: 0.6974, test_loss: 1.2503, test_f1: 0.5671
 epoch: 98, train_loss: 0.6616, test_loss: 1.1217, test_f1: 0.5417
 epoch: 99, train_loss: 0.6661, test_loss: 1.3927, test_f1: 0.5383
##################ITERATION #6 ****************************************
 epoch: 0, train_loss: 1.2806, test_loss: 1.1675, test_f1: 0.3707
 epoch: 1, train_loss: 1.1361, test_loss: 1.1196, test_f1: 0.4419
 epoch: 2, train_loss: 1.0904, test_loss: 1.0313, test_f1: 0.4456
 epoch: 3, train_loss: 1.0517, test_loss: 1.0417, test_f1: 0.4289
 epoch: 4, train_loss: 1.0157, test_loss: 1.0299, test_f1: 0.4938
 epoch: 5, train_loss: 1.0070, test_loss: 0.9575, test_f1: 0.4805
 epoch: 6, train_loss: 0.9833, test_loss: 1.0146, test_f1: 0.4919
 epoch: 7, train_loss: 0.9692, test_loss: 1.0422, test_f1: 0.4866
 epoch: 8, train_loss: 0.9564, test_loss: 1.0086, test_f1: 0.5049
 epoch: 9, train_loss: 0.9728, test_loss: 1.1379, test_f1: 0.4879
 epoch: 10, train_loss: 0.9648, test_loss: 1.0091, test_f1: 0.4625
 epoch: 11, train_loss: 0.9380, test_loss: 1.1332, test_f1: 0.4930
 epoch: 12, train_loss: 0.9381, test_loss: 1.0326, test_f1: 0.5282
 epoch: 13, train_loss: 0.9219, test_loss: 1.0352, test_f1: 0.4814
 epoch: 14, train_loss: 0.9203, test_loss: 1.1107, test_f1: 0.4939
 epoch: 15, train_loss: 0.9077, test_loss: 1.0465, test_f1: 0.5195
 epoch: 16, train_loss: 0.9460, test_loss: 1.0795, test_f1: 0.4332
 epoch: 17, train_loss: 0.9528, test_loss: 1.0118, test_f1: 0.5182
 epoch: 18, train_loss: 0.9181, test_loss: 0.9884, test_f1: 0.4910
 epoch: 19, train_loss: 0.9051, test_loss: 1.0605, test_f1: 0.5055
 epoch: 20, train_loss: 0.8944, test_loss: 1.0154, test_f1: 0.4862
 epoch: 21, train_loss: 0.9098, test_loss: 1.0754, test_f1: 0.5229
 epoch: 22, train_loss: 0.8863, test_loss: 1.1576, test_f1: 0.4886
 epoch: 23, train_loss: 0.8832, test_loss: 0.9580, test_f1: 0.5284
 epoch: 24, train_loss: 0.8623, test_loss: 1.0086, test_f1: 0.5030
 epoch: 25, train_loss: 0.8705, test_loss: 1.1659, test_f1: 0.4779
 epoch: 26, train_loss: 0.8617, test_loss: 0.9896, test_f1: 0.5327
 epoch: 27, train_loss: 0.8577, test_loss: 1.1339, test_f1: 0.4611
 epoch: 28, train_loss: 0.8495, test_loss: 1.1783, test_f1: 0.4951
 epoch: 29, train_loss: 0.8501, test_loss: 1.1318, test_f1: 0.5093
 epoch: 30, train_loss: 0.8552, test_loss: 1.1875, test_f1: 0.4994
 epoch: 31, train_loss: 0.8518, test_loss: 1.1954, test_f1: 0.5197
 epoch: 32, train_loss: 0.8384, test_loss: 1.1267, test_f1: 0.5267
 epoch: 33, train_loss: 0.8519, test_loss: 1.1214, test_f1: 0.5344
 epoch: 34, train_loss: 0.8458, test_loss: 1.1831, test_f1: 0.5428
 epoch: 35, train_loss: 0.8399, test_loss: 1.2561, test_f1: 0.4822
 epoch: 36, train_loss: 0.8403, test_loss: 1.0670, test_f1: 0.5457
 epoch: 37, train_loss: 0.8131, test_loss: 1.1585, test_f1: 0.5077
 epoch: 38, train_loss: 0.8039, test_loss: 1.0848, test_f1: 0.5274
 epoch: 39, train_loss: 0.8076, test_loss: 1.2645, test_f1: 0.5423
 epoch: 40, train_loss: 0.8009, test_loss: 1.1732, test_f1: 0.5157
 epoch: 41, train_loss: 0.8042, test_loss: 1.1856, test_f1: 0.5583
 epoch: 42, train_loss: 0.7887, test_loss: 1.0040, test_f1: 0.5572
 epoch: 43, train_loss: 0.8195, test_loss: 1.2424, test_f1: 0.5157
 epoch: 44, train_loss: 0.8004, test_loss: 1.6580, test_f1: 0.5204
 epoch: 45, train_loss: 0.7798, test_loss: 1.3375, test_f1: 0.5401
 epoch: 46, train_loss: 0.8188, test_loss: 1.1903, test_f1: 0.5580
 epoch: 47, train_loss: 0.7839, test_loss: 1.3399, test_f1: 0.5432
 epoch: 48, train_loss: 0.7866, test_loss: 1.4010, test_f1: 0.5133
 epoch: 49, train_loss: 0.7768, test_loss: 1.2955, test_f1: 0.5429
 epoch: 50, train_loss: 0.7670, test_loss: 1.5246, test_f1: 0.5162
 epoch: 51, train_loss: 0.7453, test_loss: 1.3067, test_f1: 0.5372
 epoch: 52, train_loss: 0.7314, test_loss: 1.1763, test_f1: 0.5576
 epoch: 53, train_loss: 0.7399, test_loss: 1.3563, test_f1: 0.5226
 epoch: 54, train_loss: 0.7131, test_loss: 1.5651, test_f1: 0.5192
 epoch: 55, train_loss: 0.7023, test_loss: 1.4049, test_f1: 0.5492
 epoch: 56, train_loss: 0.7153, test_loss: 1.3449, test_f1: 0.5489
 epoch: 57, train_loss: 0.7168, test_loss: 1.4215, test_f1: 0.5458
 epoch: 58, train_loss: 0.6955, test_loss: 1.2738, test_f1: 0.5391
 epoch: 59, train_loss: 0.6931, test_loss: 1.5213, test_f1: 0.5328
 epoch: 60, train_loss: 0.6766, test_loss: 1.5070, test_f1: 0.5185
 epoch: 61, train_loss: 0.6932, test_loss: 1.6007, test_f1: 0.5271
 epoch: 62, train_loss: 0.6813, test_loss: 1.3868, test_f1: 0.5347
 epoch: 63, train_loss: 0.6777, test_loss: 1.3708, test_f1: 0.5480
 epoch: 64, train_loss: 0.6669, test_loss: 1.3881, test_f1: 0.5362
 epoch: 65, train_loss: 0.6722, test_loss: 1.2607, test_f1: 0.5734
 epoch: 66, train_loss: 0.6595, test_loss: 1.4120, test_f1: 0.5237
 epoch: 67, train_loss: 0.6976, test_loss: 1.3074, test_f1: 0.5371
 epoch: 68, train_loss: 0.7018, test_loss: 1.3855, test_f1: 0.5454
 epoch: 69, train_loss: 0.6721, test_loss: 1.3300, test_f1: 0.5781
 epoch: 70, train_loss: 0.6564, test_loss: 1.5462, test_f1: 0.5242
 epoch: 71, train_loss: 0.6677, test_loss: 1.3909, test_f1: 0.5360
 epoch: 72, train_loss: 0.6486, test_loss: 1.6843, test_f1: 0.5385
 epoch: 73, train_loss: 0.6532, test_loss: 1.4118, test_f1: 0.5361
 epoch: 74, train_loss: 0.6648, test_loss: 1.6398, test_f1: 0.5439
 epoch: 75, train_loss: 0.6635, test_loss: 1.3573, test_f1: 0.5338
 epoch: 76, train_loss: 0.6448, test_loss: 1.5604, test_f1: 0.5276
 epoch: 77, train_loss: 0.6457, test_loss: 1.7263, test_f1: 0.5472
 epoch: 78, train_loss: 0.6206, test_loss: 1.6200, test_f1: 0.5479
 epoch: 79, train_loss: 0.6360, test_loss: 1.5549, test_f1: 0.5528
 epoch: 80, train_loss: 0.6151, test_loss: 1.4736, test_f1: 0.5537
 epoch: 81, train_loss: 0.6353, test_loss: 1.3743, test_f1: 0.5606
 epoch: 82, train_loss: 0.6417, test_loss: 1.7501, test_f1: 0.5683
 epoch: 83, train_loss: 0.6433, test_loss: 1.5530, test_f1: 0.5610
 epoch: 84, train_loss: 0.6132, test_loss: 1.3905, test_f1: 0.5544
 epoch: 85, train_loss: 0.6310, test_loss: 1.7150, test_f1: 0.5313
 epoch: 86, train_loss: 0.6313, test_loss: 1.8419, test_f1: 0.5473
 epoch: 87, train_loss: 0.6260, test_loss: 1.8298, test_f1: 0.5436
 epoch: 88, train_loss: 0.6020, test_loss: 1.6732, test_f1: 0.5187
 epoch: 89, train_loss: 0.6451, test_loss: 1.5726, test_f1: 0.5410
 epoch: 90, train_loss: 0.6411, test_loss: 1.6350, test_f1: 0.5415
 epoch: 91, train_loss: 0.6255, test_loss: 1.6884, test_f1: 0.5450
 epoch: 92, train_loss: 0.6350, test_loss: 1.9762, test_f1: 0.5659
 epoch: 93, train_loss: 0.6417, test_loss: 1.6363, test_f1: 0.5499
 epoch: 94, train_loss: 0.5993, test_loss: 1.5854, test_f1: 0.5491
 epoch: 95, train_loss: 0.5936, test_loss: 1.5970, test_f1: 0.5951
 epoch: 96, train_loss: 0.6298, test_loss: 1.6255, test_f1: 0.5380
 epoch: 97, train_loss: 0.5896, test_loss: 1.6956, test_f1: 0.5894
 epoch: 98, train_loss: 0.5965, test_loss: 1.6670, test_f1: 0.5627
 epoch: 99, train_loss: 0.5868, test_loss: 1.5257, test_f1: 0.5563
##################ITERATION #7 ****************************************
 epoch: 0, train_loss: 1.2640, test_loss: 1.1522, test_f1: 0.3851
 epoch: 1, train_loss: 1.1514, test_loss: 1.2275, test_f1: 0.3915
 epoch: 2, train_loss: 1.0977, test_loss: 0.9856, test_f1: 0.4793
 epoch: 3, train_loss: 1.0407, test_loss: 1.0085, test_f1: 0.4800
 epoch: 4, train_loss: 1.0254, test_loss: 0.9965, test_f1: 0.4510
 epoch: 5, train_loss: 0.9998, test_loss: 1.0476, test_f1: 0.4605
 epoch: 6, train_loss: 0.9758, test_loss: 1.0380, test_f1: 0.5044
 epoch: 7, train_loss: 0.9876, test_loss: 1.0520, test_f1: 0.4789
 epoch: 8, train_loss: 0.9948, test_loss: 1.0220, test_f1: 0.5099
 epoch: 9, train_loss: 0.9599, test_loss: 0.9888, test_f1: 0.4940
 epoch: 10, train_loss: 0.9496, test_loss: 1.0319, test_f1: 0.5004
 epoch: 11, train_loss: 0.9229, test_loss: 0.9949, test_f1: 0.4816
 epoch: 12, train_loss: 0.9706, test_loss: 0.9677, test_f1: 0.5070
 epoch: 13, train_loss: 0.9293, test_loss: 1.0095, test_f1: 0.4841
 epoch: 14, train_loss: 0.9191, test_loss: 0.9458, test_f1: 0.4696
 epoch: 15, train_loss: 0.9179, test_loss: 0.9900, test_f1: 0.5141
 epoch: 16, train_loss: 0.9012, test_loss: 1.0070, test_f1: 0.5052
 epoch: 17, train_loss: 0.9200, test_loss: 0.9536, test_f1: 0.5239
 epoch: 18, train_loss: 0.8989, test_loss: 0.9941, test_f1: 0.5247
 epoch: 19, train_loss: 0.9214, test_loss: 0.9391, test_f1: 0.5137
 epoch: 20, train_loss: 0.8960, test_loss: 1.0439, test_f1: 0.4918
 epoch: 21, train_loss: 0.8906, test_loss: 1.0761, test_f1: 0.4765
 epoch: 22, train_loss: 0.8774, test_loss: 0.9672, test_f1: 0.5462
 epoch: 23, train_loss: 0.8841, test_loss: 1.0968, test_f1: 0.5301
 epoch: 24, train_loss: 0.8697, test_loss: 0.9623, test_f1: 0.5105
 epoch: 25, train_loss: 0.8850, test_loss: 1.0434, test_f1: 0.4859
 epoch: 26, train_loss: 0.8828, test_loss: 0.9801, test_f1: 0.5367
 epoch: 27, train_loss: 0.8589, test_loss: 0.9740, test_f1: 0.4920
 epoch: 28, train_loss: 0.8767, test_loss: 0.9503, test_f1: 0.5442
 epoch: 29, train_loss: 0.8644, test_loss: 1.0131, test_f1: 0.5226
 epoch: 30, train_loss: 0.8497, test_loss: 1.1205, test_f1: 0.5272
 epoch: 31, train_loss: 0.8447, test_loss: 1.0342, test_f1: 0.5005
 epoch: 32, train_loss: 0.8476, test_loss: 0.9700, test_f1: 0.5074
 epoch: 33, train_loss: 0.8631, test_loss: 1.0058, test_f1: 0.5223
 epoch: 34, train_loss: 0.8684, test_loss: 1.0131, test_f1: 0.4941
 epoch: 35, train_loss: 0.8469, test_loss: 1.0489, test_f1: 0.5246
 epoch: 36, train_loss: 0.8488, test_loss: 0.9947, test_f1: 0.5108
 epoch: 37, train_loss: 0.8224, test_loss: 1.0767, test_f1: 0.5410
 epoch: 38, train_loss: 0.8349, test_loss: 1.0585, test_f1: 0.5268
 epoch: 39, train_loss: 0.8548, test_loss: 1.1029, test_f1: 0.5539
 epoch: 40, train_loss: 0.8267, test_loss: 1.2207, test_f1: 0.5251
 epoch: 41, train_loss: 0.8073, test_loss: 1.0943, test_f1: 0.5482
 epoch: 42, train_loss: 0.8074, test_loss: 1.1764, test_f1: 0.5510
 epoch: 43, train_loss: 0.8192, test_loss: 1.0614, test_f1: 0.5042
 epoch: 44, train_loss: 0.8127, test_loss: 1.1838, test_f1: 0.5042
 epoch: 45, train_loss: 0.8220, test_loss: 1.1839, test_f1: 0.5219
 epoch: 46, train_loss: 0.7993, test_loss: 1.0687, test_f1: 0.5490
 epoch: 47, train_loss: 0.8118, test_loss: 1.1650, test_f1: 0.5448
 epoch: 48, train_loss: 0.8130, test_loss: 1.0268, test_f1: 0.5745
 epoch: 49, train_loss: 0.8183, test_loss: 1.0965, test_f1: 0.5635
 epoch: 50, train_loss: 0.8292, test_loss: 1.1038, test_f1: 0.5290
 epoch: 51, train_loss: 0.7766, test_loss: 1.2434, test_f1: 0.5663
 epoch: 52, train_loss: 0.7560, test_loss: 1.1054, test_f1: 0.5669
 epoch: 53, train_loss: 0.7576, test_loss: 1.3038, test_f1: 0.5540
 epoch: 54, train_loss: 0.7423, test_loss: 1.2746, test_f1: 0.5447
 epoch: 55, train_loss: 0.7334, test_loss: 1.1251, test_f1: 0.5833
 epoch: 56, train_loss: 0.7324, test_loss: 1.2296, test_f1: 0.5811
 epoch: 57, train_loss: 0.7242, test_loss: 1.3661, test_f1: 0.5907
 epoch: 58, train_loss: 0.7262, test_loss: 1.4280, test_f1: 0.5797
 epoch: 59, train_loss: 0.7153, test_loss: 1.3759, test_f1: 0.5759
 epoch: 60, train_loss: 0.7122, test_loss: 1.3484, test_f1: 0.5675
 epoch: 61, train_loss: 0.7261, test_loss: 1.3296, test_f1: 0.5555
 epoch: 62, train_loss: 0.7136, test_loss: 1.4724, test_f1: 0.5369
 epoch: 63, train_loss: 0.7088, test_loss: 1.2718, test_f1: 0.5888
 epoch: 64, train_loss: 0.7018, test_loss: 1.1735, test_f1: 0.5719
 epoch: 65, train_loss: 0.7002, test_loss: 1.2636, test_f1: 0.5741
 epoch: 66, train_loss: 0.6952, test_loss: 1.3897, test_f1: 0.5530
 epoch: 67, train_loss: 0.6796, test_loss: 1.3351, test_f1: 0.5693
 epoch: 68, train_loss: 0.6919, test_loss: 1.4202, test_f1: 0.5429
 epoch: 69, train_loss: 0.6729, test_loss: 1.1795, test_f1: 0.5598
 epoch: 70, train_loss: 0.7018, test_loss: 1.2920, test_f1: 0.5906
 epoch: 71, train_loss: 0.6669, test_loss: 1.1749, test_f1: 0.5693
 epoch: 72, train_loss: 0.6755, test_loss: 1.1408, test_f1: 0.5681
 epoch: 73, train_loss: 0.6851, test_loss: 1.1771, test_f1: 0.5662
 epoch: 74, train_loss: 0.6827, test_loss: 1.2784, test_f1: 0.5813
 epoch: 75, train_loss: 0.6762, test_loss: 1.2154, test_f1: 0.5728
 epoch: 76, train_loss: 0.6432, test_loss: 1.5237, test_f1: 0.5554
 epoch: 77, train_loss: 0.6581, test_loss: 1.2783, test_f1: 0.5541
 epoch: 78, train_loss: 0.6406, test_loss: 1.7283, test_f1: 0.5407
 epoch: 79, train_loss: 0.6568, test_loss: 1.3010, test_f1: 0.5499
 epoch: 80, train_loss: 0.6578, test_loss: 1.3062, test_f1: 0.5602
 epoch: 81, train_loss: 0.6500, test_loss: 1.3278, test_f1: 0.5651
 epoch: 82, train_loss: 0.6402, test_loss: 1.4185, test_f1: 0.5610
 epoch: 83, train_loss: 0.6387, test_loss: 1.4336, test_f1: 0.5663
 epoch: 84, train_loss: 0.6377, test_loss: 1.3209, test_f1: 0.5469
 epoch: 85, train_loss: 0.6439, test_loss: 1.4233, test_f1: 0.5498
 epoch: 86, train_loss: 0.6254, test_loss: 1.3573, test_f1: 0.5329
 epoch: 87, train_loss: 0.6582, test_loss: 1.2463, test_f1: 0.5473
 epoch: 88, train_loss: 0.6571, test_loss: 1.2494, test_f1: 0.5466
 epoch: 89, train_loss: 0.6488, test_loss: 1.3510, test_f1: 0.5712
 epoch: 90, train_loss: 0.6323, test_loss: 1.3294, test_f1: 0.5477
 epoch: 91, train_loss: 0.6171, test_loss: 1.4404, test_f1: 0.5484
 epoch: 92, train_loss: 0.6306, test_loss: 1.3253, test_f1: 0.5753
 epoch: 93, train_loss: 0.6179, test_loss: 1.3846, test_f1: 0.5651
 epoch: 94, train_loss: 0.6123, test_loss: 1.4382, test_f1: 0.5590
 epoch: 95, train_loss: 0.6170, test_loss: 1.4069, test_f1: 0.5675
 epoch: 96, train_loss: 0.6125, test_loss: 1.2957, test_f1: 0.5653
 epoch: 97, train_loss: 0.6200, test_loss: 1.3314, test_f1: 0.5326
 epoch: 98, train_loss: 0.6203, test_loss: 1.3258, test_f1: 0.5909
 epoch: 99, train_loss: 0.6195, test_loss: 1.3102, test_f1: 0.5736
##################ITERATION #8 ****************************************
 epoch: 0, train_loss: 1.2561, test_loss: 1.1224, test_f1: 0.3862
 epoch: 1, train_loss: 1.1301, test_loss: 1.0041, test_f1: 0.4636
 epoch: 2, train_loss: 1.0732, test_loss: 0.9663, test_f1: 0.4787
 epoch: 3, train_loss: 1.0297, test_loss: 0.9944, test_f1: 0.4494
 epoch: 4, train_loss: 1.0088, test_loss: 1.0138, test_f1: 0.4724
 epoch: 5, train_loss: 1.0020, test_loss: 0.9348, test_f1: 0.5007
 epoch: 6, train_loss: 0.9750, test_loss: 1.0574, test_f1: 0.5147
 epoch: 7, train_loss: 0.9474, test_loss: 1.0228, test_f1: 0.5327
 epoch: 8, train_loss: 0.9441, test_loss: 1.0252, test_f1: 0.5060
 epoch: 9, train_loss: 0.9307, test_loss: 1.0650, test_f1: 0.5104
 epoch: 10, train_loss: 0.9254, test_loss: 0.9939, test_f1: 0.4776
 epoch: 11, train_loss: 0.9202, test_loss: 1.0193, test_f1: 0.5230
 epoch: 12, train_loss: 0.9209, test_loss: 1.0937, test_f1: 0.4884
 epoch: 13, train_loss: 0.9019, test_loss: 1.0205, test_f1: 0.4830
 epoch: 14, train_loss: 0.9073, test_loss: 1.0133, test_f1: 0.5204
 epoch: 15, train_loss: 0.8858, test_loss: 1.0403, test_f1: 0.5084
 epoch: 16, train_loss: 0.8631, test_loss: 1.0502, test_f1: 0.4710
 epoch: 17, train_loss: 0.8989, test_loss: 1.0326, test_f1: 0.5701
 epoch: 18, train_loss: 0.8841, test_loss: 1.0900, test_f1: 0.5205
 epoch: 19, train_loss: 0.8885, test_loss: 0.9841, test_f1: 0.5182
 epoch: 20, train_loss: 0.8633, test_loss: 0.9933, test_f1: 0.5575
 epoch: 21, train_loss: 0.8701, test_loss: 0.9669, test_f1: 0.5150
 epoch: 22, train_loss: 0.8665, test_loss: 1.0141, test_f1: 0.5249
 epoch: 23, train_loss: 0.8602, test_loss: 1.1537, test_f1: 0.5091
 epoch: 24, train_loss: 0.8656, test_loss: 1.2305, test_f1: 0.5146
 epoch: 25, train_loss: 0.8492, test_loss: 1.0461, test_f1: 0.4866
 epoch: 26, train_loss: 0.8764, test_loss: 1.0447, test_f1: 0.5169
 epoch: 27, train_loss: 0.8562, test_loss: 1.0682, test_f1: 0.5803
 epoch: 28, train_loss: 0.8528, test_loss: 0.9915, test_f1: 0.5599
 epoch: 29, train_loss: 0.8534, test_loss: 0.9572, test_f1: 0.5654
 epoch: 30, train_loss: 0.8383, test_loss: 1.1534, test_f1: 0.4738
 epoch: 31, train_loss: 0.8808, test_loss: 1.0779, test_f1: 0.5420
 epoch: 32, train_loss: 0.8497, test_loss: 1.0567, test_f1: 0.5563
 epoch: 33, train_loss: 0.8350, test_loss: 1.0503, test_f1: 0.5360
 epoch: 34, train_loss: 0.8483, test_loss: 1.1410, test_f1: 0.4943
 epoch: 35, train_loss: 0.8306, test_loss: 1.0018, test_f1: 0.5039
 epoch: 36, train_loss: 0.8409, test_loss: 1.0265, test_f1: 0.5455
 epoch: 37, train_loss: 0.8360, test_loss: 1.1164, test_f1: 0.5259
 epoch: 38, train_loss: 0.8264, test_loss: 1.0961, test_f1: 0.5244
 epoch: 39, train_loss: 0.8287, test_loss: 1.0959, test_f1: 0.5444
 epoch: 40, train_loss: 0.8263, test_loss: 1.0221, test_f1: 0.5247
 epoch: 41, train_loss: 0.8336, test_loss: 1.0262, test_f1: 0.5535
 epoch: 42, train_loss: 0.8579, test_loss: 1.1556, test_f1: 0.5197
 epoch: 43, train_loss: 0.8226, test_loss: 0.9350, test_f1: 0.5377
 epoch: 44, train_loss: 0.8095, test_loss: 1.0817, test_f1: 0.5030
 epoch: 45, train_loss: 0.8228, test_loss: 1.0692, test_f1: 0.5423
 epoch: 46, train_loss: 0.8172, test_loss: 0.9932, test_f1: 0.5516
 epoch: 47, train_loss: 0.7914, test_loss: 1.1167, test_f1: 0.5468
 epoch: 48, train_loss: 0.7902, test_loss: 1.0738, test_f1: 0.5443
 epoch: 49, train_loss: 0.7812, test_loss: 1.1696, test_f1: 0.4953
 epoch: 50, train_loss: 0.8072, test_loss: 1.1096, test_f1: 0.5127
 epoch: 51, train_loss: 0.7602, test_loss: 1.0854, test_f1: 0.5473
 epoch: 52, train_loss: 0.7556, test_loss: 1.0976, test_f1: 0.5227
 epoch: 53, train_loss: 0.7617, test_loss: 1.0630, test_f1: 0.5369
 epoch: 54, train_loss: 0.7379, test_loss: 1.1291, test_f1: 0.5599
 epoch: 55, train_loss: 0.7349, test_loss: 1.1282, test_f1: 0.5522
 epoch: 56, train_loss: 0.7382, test_loss: 1.0440, test_f1: 0.5483
 epoch: 57, train_loss: 0.7257, test_loss: 1.1141, test_f1: 0.5390
 epoch: 58, train_loss: 0.7094, test_loss: 1.0892, test_f1: 0.5426
 epoch: 59, train_loss: 0.7182, test_loss: 1.0355, test_f1: 0.5480
 epoch: 60, train_loss: 0.7211, test_loss: 1.0418, test_f1: 0.5406
 epoch: 61, train_loss: 0.7142, test_loss: 1.1205, test_f1: 0.5384
 epoch: 62, train_loss: 0.7101, test_loss: 1.1841, test_f1: 0.5478
 epoch: 63, train_loss: 0.6958, test_loss: 1.1984, test_f1: 0.5390
 epoch: 64, train_loss: 0.6864, test_loss: 1.1471, test_f1: 0.5495
 epoch: 65, train_loss: 0.6984, test_loss: 1.1060, test_f1: 0.5556
 epoch: 66, train_loss: 0.6797, test_loss: 1.1114, test_f1: 0.5368
 epoch: 67, train_loss: 0.6862, test_loss: 1.1921, test_f1: 0.5479
 epoch: 68, train_loss: 0.6754, test_loss: 1.0842, test_f1: 0.5593
 epoch: 69, train_loss: 0.6891, test_loss: 1.1082, test_f1: 0.5449
 epoch: 70, train_loss: 0.6732, test_loss: 1.1311, test_f1: 0.5566
 epoch: 71, train_loss: 0.6854, test_loss: 1.0482, test_f1: 0.5410
 epoch: 72, train_loss: 0.6871, test_loss: 1.0765, test_f1: 0.5540
 epoch: 73, train_loss: 0.6668, test_loss: 1.1333, test_f1: 0.5609
 epoch: 74, train_loss: 0.6701, test_loss: 1.1208, test_f1: 0.5383
 epoch: 75, train_loss: 0.6577, test_loss: 1.1123, test_f1: 0.5585
 epoch: 76, train_loss: 0.6716, test_loss: 1.0577, test_f1: 0.5603
 epoch: 77, train_loss: 0.6717, test_loss: 1.1138, test_f1: 0.5573
 epoch: 78, train_loss: 0.6559, test_loss: 1.1232, test_f1: 0.5577
 epoch: 79, train_loss: 0.6866, test_loss: 1.1096, test_f1: 0.5582
 epoch: 80, train_loss: 0.6618, test_loss: 1.1845, test_f1: 0.5602
 epoch: 81, train_loss: 0.6587, test_loss: 1.0885, test_f1: 0.5698
 epoch: 82, train_loss: 0.6481, test_loss: 1.2530, test_f1: 0.5875
 epoch: 83, train_loss: 0.6598, test_loss: 1.2885, test_f1: 0.5863
 epoch: 84, train_loss: 0.6402, test_loss: 1.1944, test_f1: 0.5562
 epoch: 85, train_loss: 0.6343, test_loss: 1.3482, test_f1: 0.5621
 epoch: 86, train_loss: 0.6483, test_loss: 1.1786, test_f1: 0.5645
 epoch: 87, train_loss: 0.6637, test_loss: 1.2104, test_f1: 0.5583
 epoch: 88, train_loss: 0.6415, test_loss: 1.2761, test_f1: 0.5491
 epoch: 89, train_loss: 0.6478, test_loss: 1.1408, test_f1: 0.5346
 epoch: 90, train_loss: 0.6220, test_loss: 1.3220, test_f1: 0.5671
 epoch: 91, train_loss: 0.6438, test_loss: 1.1814, test_f1: 0.5543
 epoch: 92, train_loss: 0.6577, test_loss: 1.1836, test_f1: 0.5524
 epoch: 93, train_loss: 0.6192, test_loss: 1.2556, test_f1: 0.5601
 epoch: 94, train_loss: 0.6396, test_loss: 1.2837, test_f1: 0.5565
 epoch: 95, train_loss: 0.6107, test_loss: 1.1588, test_f1: 0.5773
 epoch: 96, train_loss: 0.6246, test_loss: 1.1952, test_f1: 0.5804
 epoch: 97, train_loss: 0.6128, test_loss: 1.1636, test_f1: 0.5620
 epoch: 98, train_loss: 0.6170, test_loss: 1.4412, test_f1: 0.5426
 epoch: 99, train_loss: 0.6170, test_loss: 1.2092, test_f1: 0.5575
##################ITERATION #9 ****************************************
 epoch: 0, train_loss: 1.2964, test_loss: 1.2417, test_f1: 0.3349
 epoch: 1, train_loss: 1.1942, test_loss: 1.1078, test_f1: 0.4341
 epoch: 2, train_loss: 1.1218, test_loss: 1.1035, test_f1: 0.4519
 epoch: 3, train_loss: 1.0718, test_loss: 1.0346, test_f1: 0.4502
 epoch: 4, train_loss: 1.0440, test_loss: 0.9377, test_f1: 0.5000
 epoch: 5, train_loss: 1.0220, test_loss: 1.0129, test_f1: 0.4855
 epoch: 6, train_loss: 0.9852, test_loss: 0.9856, test_f1: 0.5093
 epoch: 7, train_loss: 1.0004, test_loss: 0.9749, test_f1: 0.4947
 epoch: 8, train_loss: 0.9768, test_loss: 1.0163, test_f1: 0.5246
 epoch: 9, train_loss: 0.9500, test_loss: 0.9804, test_f1: 0.5197
 epoch: 10, train_loss: 0.9477, test_loss: 1.0255, test_f1: 0.5078
 epoch: 11, train_loss: 0.9494, test_loss: 1.0415, test_f1: 0.5076
 epoch: 12, train_loss: 0.9302, test_loss: 0.9967, test_f1: 0.5325
 epoch: 13, train_loss: 0.9182, test_loss: 0.9720, test_f1: 0.5359
 epoch: 14, train_loss: 0.9500, test_loss: 0.9542, test_f1: 0.5270
 epoch: 15, train_loss: 0.9094, test_loss: 1.0821, test_f1: 0.5472
 epoch: 16, train_loss: 0.9171, test_loss: 1.1599, test_f1: 0.5267
 epoch: 17, train_loss: 0.8828, test_loss: 1.1477, test_f1: 0.4998
 epoch: 18, train_loss: 0.9013, test_loss: 1.0749, test_f1: 0.4890
 epoch: 19, train_loss: 0.8759, test_loss: 1.0468, test_f1: 0.5117
 epoch: 20, train_loss: 0.8780, test_loss: 0.9803, test_f1: 0.5503
 epoch: 21, train_loss: 0.8676, test_loss: 1.0343, test_f1: 0.5453
 epoch: 22, train_loss: 0.8671, test_loss: 1.1306, test_f1: 0.4975
 epoch: 23, train_loss: 0.9108, test_loss: 1.0079, test_f1: 0.5174
 epoch: 24, train_loss: 0.8644, test_loss: 1.0726, test_f1: 0.5552
 epoch: 25, train_loss: 0.8430, test_loss: 1.0230, test_f1: 0.5587
 epoch: 26, train_loss: 0.8507, test_loss: 1.0486, test_f1: 0.5305
 epoch: 27, train_loss: 0.8607, test_loss: 1.1198, test_f1: 0.5057
 epoch: 28, train_loss: 0.8524, test_loss: 1.0320, test_f1: 0.5580
 epoch: 29, train_loss: 0.8237, test_loss: 1.0926, test_f1: 0.5384
 epoch: 30, train_loss: 0.8421, test_loss: 0.9619, test_f1: 0.5543
 epoch: 31, train_loss: 0.8266, test_loss: 1.0455, test_f1: 0.5496
 epoch: 32, train_loss: 0.8251, test_loss: 1.0792, test_f1: 0.5579
 epoch: 33, train_loss: 0.8230, test_loss: 1.1135, test_f1: 0.5340
 epoch: 34, train_loss: 0.8262, test_loss: 1.0076, test_f1: 0.5339
 epoch: 35, train_loss: 0.8404, test_loss: 1.2696, test_f1: 0.5091
 epoch: 36, train_loss: 0.8180, test_loss: 1.2245, test_f1: 0.4842
 epoch: 37, train_loss: 0.8127, test_loss: 1.0037, test_f1: 0.5606
 epoch: 38, train_loss: 0.8136, test_loss: 1.0483, test_f1: 0.5630
 epoch: 39, train_loss: 0.7933, test_loss: 1.1484, test_f1: 0.5361
 epoch: 40, train_loss: 0.7898, test_loss: 1.3625, test_f1: 0.5434
 epoch: 41, train_loss: 0.7837, test_loss: 1.1097, test_f1: 0.5332
 epoch: 42, train_loss: 0.7849, test_loss: 1.0801, test_f1: 0.5536
 epoch: 43, train_loss: 0.7881, test_loss: 1.3458, test_f1: 0.5794
 epoch: 44, train_loss: 0.7872, test_loss: 1.0687, test_f1: 0.5604
 epoch: 45, train_loss: 0.7678, test_loss: 1.3279, test_f1: 0.5339
 epoch: 46, train_loss: 0.8123, test_loss: 0.9127, test_f1: 0.5380
 epoch: 47, train_loss: 0.8029, test_loss: 1.0367, test_f1: 0.5651
 epoch: 48, train_loss: 0.7702, test_loss: 1.1667, test_f1: 0.5201
 epoch: 49, train_loss: 0.7694, test_loss: 1.3017, test_f1: 0.5052
 epoch: 50, train_loss: 0.7917, test_loss: 1.1384, test_f1: 0.5706
 epoch: 51, train_loss: 0.7354, test_loss: 1.1235, test_f1: 0.5592
 epoch: 52, train_loss: 0.7167, test_loss: 1.2888, test_f1: 0.5552
 epoch: 53, train_loss: 0.7024, test_loss: 1.2848, test_f1: 0.5401
 epoch: 54, train_loss: 0.7043, test_loss: 1.3248, test_f1: 0.5339
 epoch: 55, train_loss: 0.7097, test_loss: 1.4663, test_f1: 0.5556
 epoch: 56, train_loss: 0.7026, test_loss: 1.2256, test_f1: 0.5469
 epoch: 57, train_loss: 0.6934, test_loss: 1.0257, test_f1: 0.5955
 epoch: 58, train_loss: 0.6915, test_loss: 1.0416, test_f1: 0.5770
 epoch: 59, train_loss: 0.6884, test_loss: 1.1847, test_f1: 0.5440
 epoch: 60, train_loss: 0.6935, test_loss: 1.1997, test_f1: 0.5528
 epoch: 61, train_loss: 0.6676, test_loss: 1.0512, test_f1: 0.5617
 epoch: 62, train_loss: 0.7019, test_loss: 1.2168, test_f1: 0.5705
 epoch: 63, train_loss: 0.6701, test_loss: 1.0690, test_f1: 0.5679
 epoch: 64, train_loss: 0.6693, test_loss: 1.1925, test_f1: 0.5697
 epoch: 65, train_loss: 0.6611, test_loss: 1.2697, test_f1: 0.5548
 epoch: 66, train_loss: 0.6832, test_loss: 1.7320, test_f1: 0.5550
 epoch: 67, train_loss: 0.6837, test_loss: 1.5778, test_f1: 0.5678
 epoch: 68, train_loss: 0.6613, test_loss: 1.2434, test_f1: 0.5360
 epoch: 69, train_loss: 0.6338, test_loss: 1.9332, test_f1: 0.5217
 epoch: 70, train_loss: 0.6380, test_loss: 1.5663, test_f1: 0.5470
 epoch: 71, train_loss: 0.6418, test_loss: 1.7182, test_f1: 0.5538
 epoch: 72, train_loss: 0.6511, test_loss: 1.4522, test_f1: 0.5395
 epoch: 73, train_loss: 0.6371, test_loss: 1.3899, test_f1: 0.5492
 epoch: 74, train_loss: 0.6542, test_loss: 1.8136, test_f1: 0.5130
 epoch: 75, train_loss: 0.6343, test_loss: 1.6594, test_f1: 0.5255
 epoch: 76, train_loss: 0.6533, test_loss: 1.4020, test_f1: 0.5485
 epoch: 77, train_loss: 0.6313, test_loss: 1.7802, test_f1: 0.5263
 epoch: 78, train_loss: 0.6538, test_loss: 1.3015, test_f1: 0.5478
 epoch: 79, train_loss: 0.6345, test_loss: 1.0794, test_f1: 0.5599
 epoch: 80, train_loss: 0.6168, test_loss: 1.1414, test_f1: 0.5331
 epoch: 81, train_loss: 0.6331, test_loss: 1.4438, test_f1: 0.5326
 epoch: 82, train_loss: 0.6315, test_loss: 1.4719, test_f1: 0.5349
 epoch: 83, train_loss: 0.6495, test_loss: 1.2584, test_f1: 0.5512
 epoch: 84, train_loss: 0.6255, test_loss: 1.3579, test_f1: 0.5794
 epoch: 85, train_loss: 0.6173, test_loss: 1.3120, test_f1: 0.5674
 epoch: 86, train_loss: 0.6157, test_loss: 1.2082, test_f1: 0.5859
 epoch: 87, train_loss: 0.6109, test_loss: 1.1118, test_f1: 0.5626
 epoch: 88, train_loss: 0.6368, test_loss: 1.3845, test_f1: 0.5685
 epoch: 89, train_loss: 0.6357, test_loss: 1.2039, test_f1: 0.5606
 epoch: 90, train_loss: 0.5994, test_loss: 1.3809, test_f1: 0.5398
 epoch: 91, train_loss: 0.6008, test_loss: 1.3394, test_f1: 0.5261
 epoch: 92, train_loss: 0.6425, test_loss: 1.2577, test_f1: 0.5425
 epoch: 93, train_loss: 0.5732, test_loss: 1.2806, test_f1: 0.5510
 epoch: 94, train_loss: 0.5741, test_loss: 1.3325, test_f1: 0.5401
 epoch: 95, train_loss: 0.5914, test_loss: 1.3121, test_f1: 0.5578
 epoch: 96, train_loss: 0.5906, test_loss: 1.5545, test_f1: 0.5527
 epoch: 97, train_loss: 0.5958, test_loss: 1.1998, test_f1: 0.5691
 epoch: 98, train_loss: 0.5601, test_loss: 1.3681, test_f1: 0.5426
 epoch: 99, train_loss: 0.5736, test_loss: 1.4383, test_f1: 0.5516

Training completed in 796.49 seconds
Best F1: 0.6200 at epoch 56
Mean F1 across iterations: 0.5975  0.0104
========================FINAL RESULTS================================
FEGIN weighted F1: 0.6200  0.0104
python main.py --data ltspice_examples --representation component_component --model FEGIN --layers 2 --hiddens 64 --batch_size 32 --lr 0.01 --emb_size 512 --epochs 100 --save_appendix component_component_L2_H64_BS32_LR0.01_E512 --no_val
-----



STDERR:
  File "main.py", line 370, in <module>
    main()
  File "main.py", line 254, in main
    dataset = dataset_class(
  File "/home/philip/projects/ltspice_examples_code_repo/Circuit-Completion-Using-GNNs/component_classification_with_link_prediction_head/evaluation/FEGIN/kernel/circuit_datasets.py", line 15, in __init__
    self.data, self.slices = torch.load(self.processed_paths[0])
  File "/home/philip/.local/lib/python3.8/site-packages/torch/serialization.py", line 1040, in load
    warnings.warn(
  File "/usr/lib/python3.8/warnings.py", line 109, in _showwarnmsg
    sw(msg.message, msg.category, msg.filename, msg.lineno,
  File "main.py", line 47, in warn_with_traceback
    traceback.print_stack(file=log)
/home/philip/projects/ltspice_examples_code_repo/Circuit-Completion-Using-GNNs/component_classification_with_link_prediction_head/evaluation/FEGIN/kernel/circuit_datasets.py:15: FutureWarning: You are using `torch.load` with `weights_only=False` (the current default value), which uses the default pickle module implicitly. It is possible to construct malicious pickle data which will execute arbitrary code during unpickling (See https://github.com/pytorch/pytorch/blob/main/SECURITY.md#untrusted-models for more details). In a future release, the default value for `weights_only` will be flipped to `True`. This limits the functions that could be executed during unpickling. Arbitrary objects will no longer be allowed to be loaded via this mode unless they are explicitly allowlisted by the user via `torch.serialization.add_safe_globals`. We recommend you start setting `weights_only=True` for any use case where you don't have full control of the loaded file. Please open an issue on GitHub for any issues related to this experimental feature.
  self.data, self.slices = torch.load(self.processed_paths[0])
