STDOUT:
Results will be saved in /home/philip/projects/ltspice_examples_code_repo/Circuit-Completion-Using-GNNs/component_classification_with_link_prediction_head/evaluation/FEGIN/results/model_FEGIN_dataset_ltspice_examples
Command line input: python main.py --data ltspice_examples --representation component_pin_net --model FEGIN --layers 3 --hiddens 128 --batch_size 256 --lr 0.0001 --emb_size 128 --epochs 100 --save_appendix component_pin_net_L3_H128_BS256_LR0.0001_E128 --no_val
 is saved.
-----
ltspice_examples - FEGIN
Using 3 layers, 128 hidden units, h = 2
Loading component_pin_net representation dataset
ENTERED
Training FEGIN on component_pin_net representation
Train: 3558, Test: 846
##################ITERATION #0 ****************************************
 epoch: 0, train_loss: 1.3891, test_loss: 1.3914, test_f1: 0.0304
 epoch: 1, train_loss: 1.3687, test_loss: 1.3830, test_f1: 0.2117
 epoch: 2, train_loss: 1.3500, test_loss: 1.3684, test_f1: 0.2270
 epoch: 3, train_loss: 1.3258, test_loss: 1.3400, test_f1: 0.2270
 epoch: 4, train_loss: 1.2943, test_loss: 1.2919, test_f1: 0.2270
 epoch: 5, train_loss: 1.2611, test_loss: 1.2443, test_f1: 0.2392
 epoch: 6, train_loss: 1.2351, test_loss: 1.2127, test_f1: 0.2671
 epoch: 7, train_loss: 1.2117, test_loss: 1.1883, test_f1: 0.2903
 epoch: 8, train_loss: 1.1927, test_loss: 1.1693, test_f1: 0.3384
 epoch: 9, train_loss: 1.1760, test_loss: 1.1544, test_f1: 0.3467
 epoch: 10, train_loss: 1.1639, test_loss: 1.1403, test_f1: 0.3536
 epoch: 11, train_loss: 1.1485, test_loss: 1.1265, test_f1: 0.3545
 epoch: 12, train_loss: 1.1342, test_loss: 1.1082, test_f1: 0.3818
 epoch: 13, train_loss: 1.1135, test_loss: 1.0905, test_f1: 0.3998
 epoch: 14, train_loss: 1.0921, test_loss: 1.0686, test_f1: 0.4330
 epoch: 15, train_loss: 1.0664, test_loss: 1.0471, test_f1: 0.4495
 epoch: 16, train_loss: 1.0431, test_loss: 1.0231, test_f1: 0.4511
 epoch: 17, train_loss: 1.0203, test_loss: 1.0083, test_f1: 0.4680
 epoch: 18, train_loss: 1.0013, test_loss: 0.9924, test_f1: 0.4902
 epoch: 19, train_loss: 0.9846, test_loss: 0.9872, test_f1: 0.4769
 epoch: 20, train_loss: 0.9660, test_loss: 0.9801, test_f1: 0.4868
 epoch: 21, train_loss: 0.9536, test_loss: 0.9549, test_f1: 0.4932
 epoch: 22, train_loss: 0.9432, test_loss: 0.9536, test_f1: 0.5173
 epoch: 23, train_loss: 0.9246, test_loss: 0.9303, test_f1: 0.5140
 epoch: 24, train_loss: 0.9132, test_loss: 0.9347, test_f1: 0.5362
 epoch: 25, train_loss: 0.9066, test_loss: 0.9434, test_f1: 0.4945
 epoch: 26, train_loss: 0.9006, test_loss: 0.9236, test_f1: 0.5239
 epoch: 27, train_loss: 0.8826, test_loss: 0.9238, test_f1: 0.5351
 epoch: 28, train_loss: 0.8755, test_loss: 0.9153, test_f1: 0.5355
 epoch: 29, train_loss: 0.8655, test_loss: 0.9166, test_f1: 0.5510
 epoch: 30, train_loss: 0.8609, test_loss: 0.8961, test_f1: 0.5446
 epoch: 31, train_loss: 0.8545, test_loss: 0.9019, test_f1: 0.5399
 epoch: 32, train_loss: 0.8503, test_loss: 0.9200, test_f1: 0.5396
 epoch: 33, train_loss: 0.8417, test_loss: 0.9024, test_f1: 0.5440
 epoch: 34, train_loss: 0.8316, test_loss: 0.8995, test_f1: 0.5418
 epoch: 35, train_loss: 0.8322, test_loss: 0.9021, test_f1: 0.5436
 epoch: 36, train_loss: 0.8241, test_loss: 0.8814, test_f1: 0.5466
 epoch: 37, train_loss: 0.8171, test_loss: 0.9025, test_f1: 0.5401
 epoch: 38, train_loss: 0.8100, test_loss: 0.8902, test_f1: 0.5385
 epoch: 39, train_loss: 0.8045, test_loss: 0.8840, test_f1: 0.5469
 epoch: 40, train_loss: 0.7999, test_loss: 0.8861, test_f1: 0.5377
 epoch: 41, train_loss: 0.7968, test_loss: 0.8915, test_f1: 0.5568
 epoch: 42, train_loss: 0.7915, test_loss: 0.8846, test_f1: 0.5498
 epoch: 43, train_loss: 0.7886, test_loss: 0.9041, test_f1: 0.5613
 epoch: 44, train_loss: 0.7888, test_loss: 0.8677, test_f1: 0.5575
 epoch: 45, train_loss: 0.7722, test_loss: 0.9550, test_f1: 0.5297
 epoch: 46, train_loss: 0.7761, test_loss: 0.8702, test_f1: 0.5552
 epoch: 47, train_loss: 0.7724, test_loss: 0.8871, test_f1: 0.5621
 epoch: 48, train_loss: 0.7666, test_loss: 0.8965, test_f1: 0.5514
 epoch: 49, train_loss: 0.7735, test_loss: 0.8816, test_f1: 0.5546
 epoch: 50, train_loss: 0.7689, test_loss: 0.8843, test_f1: 0.5451
 epoch: 51, train_loss: 0.7476, test_loss: 0.8858, test_f1: 0.5646
 epoch: 52, train_loss: 0.7478, test_loss: 0.8786, test_f1: 0.5662
 epoch: 53, train_loss: 0.7415, test_loss: 0.8863, test_f1: 0.5666
 epoch: 54, train_loss: 0.7445, test_loss: 0.8967, test_f1: 0.5620
 epoch: 55, train_loss: 0.7490, test_loss: 0.9010, test_f1: 0.5682
 epoch: 56, train_loss: 0.7350, test_loss: 0.8795, test_f1: 0.5696
 epoch: 57, train_loss: 0.7316, test_loss: 0.8691, test_f1: 0.5518
 epoch: 58, train_loss: 0.7328, test_loss: 0.8975, test_f1: 0.5709
 epoch: 59, train_loss: 0.7325, test_loss: 0.8876, test_f1: 0.5511
 epoch: 60, train_loss: 0.7226, test_loss: 0.8952, test_f1: 0.5584
 epoch: 61, train_loss: 0.7258, test_loss: 0.9049, test_f1: 0.5600
 epoch: 62, train_loss: 0.7263, test_loss: 0.8965, test_f1: 0.5615
 epoch: 63, train_loss: 0.7274, test_loss: 0.9107, test_f1: 0.5612
 epoch: 64, train_loss: 0.7197, test_loss: 0.8741, test_f1: 0.5602
 epoch: 65, train_loss: 0.7172, test_loss: 0.8981, test_f1: 0.5658
 epoch: 66, train_loss: 0.7124, test_loss: 0.9112, test_f1: 0.5597
 epoch: 67, train_loss: 0.7094, test_loss: 0.8801, test_f1: 0.5672
 epoch: 68, train_loss: 0.7120, test_loss: 0.8858, test_f1: 0.5606
 epoch: 69, train_loss: 0.7098, test_loss: 0.8978, test_f1: 0.5670
 epoch: 70, train_loss: 0.7132, test_loss: 0.8990, test_f1: 0.5751
 epoch: 71, train_loss: 0.7022, test_loss: 0.8744, test_f1: 0.5690
 epoch: 72, train_loss: 0.7047, test_loss: 0.9071, test_f1: 0.5642
 epoch: 73, train_loss: 0.7063, test_loss: 0.8997, test_f1: 0.5739
 epoch: 74, train_loss: 0.6967, test_loss: 0.8813, test_f1: 0.5668
 epoch: 75, train_loss: 0.6980, test_loss: 0.9129, test_f1: 0.5619
 epoch: 76, train_loss: 0.7061, test_loss: 0.8748, test_f1: 0.5755
 epoch: 77, train_loss: 0.6980, test_loss: 0.9019, test_f1: 0.5692
 epoch: 78, train_loss: 0.6928, test_loss: 0.9020, test_f1: 0.5671
 epoch: 79, train_loss: 0.6859, test_loss: 0.9151, test_f1: 0.5589
 epoch: 80, train_loss: 0.6859, test_loss: 0.9047, test_f1: 0.5806
 epoch: 81, train_loss: 0.6889, test_loss: 0.8976, test_f1: 0.5696
 epoch: 82, train_loss: 0.6802, test_loss: 0.9197, test_f1: 0.5781
 epoch: 83, train_loss: 0.6841, test_loss: 0.9045, test_f1: 0.5829
 epoch: 84, train_loss: 0.6901, test_loss: 0.9200, test_f1: 0.5700
 epoch: 85, train_loss: 0.6834, test_loss: 0.9121, test_f1: 0.5758
 epoch: 86, train_loss: 0.6782, test_loss: 0.9111, test_f1: 0.5996
 epoch: 87, train_loss: 0.6851, test_loss: 0.9041, test_f1: 0.5721
 epoch: 88, train_loss: 0.6734, test_loss: 0.9005, test_f1: 0.5955
 epoch: 89, train_loss: 0.6722, test_loss: 0.9264, test_f1: 0.5758
 epoch: 90, train_loss: 0.6800, test_loss: 0.9029, test_f1: 0.5872
 epoch: 91, train_loss: 0.6600, test_loss: 0.9183, test_f1: 0.6020
 epoch: 92, train_loss: 0.6605, test_loss: 0.9229, test_f1: 0.5822
 epoch: 93, train_loss: 0.6681, test_loss: 0.9454, test_f1: 0.5959
 epoch: 94, train_loss: 0.6599, test_loss: 0.9120, test_f1: 0.5883
 epoch: 95, train_loss: 0.6659, test_loss: 0.9189, test_f1: 0.5937
 epoch: 96, train_loss: 0.6677, test_loss: 0.9277, test_f1: 0.6062
 epoch: 97, train_loss: 0.6559, test_loss: 0.9276, test_f1: 0.5802
 epoch: 98, train_loss: 0.6568, test_loss: 0.9250, test_f1: 0.5951
 epoch: 99, train_loss: 0.6486, test_loss: 0.9341, test_f1: 0.5895
##################ITERATION #1 ****************************************
 epoch: 0, train_loss: 1.3437, test_loss: 1.3690, test_f1: 0.2270
 epoch: 1, train_loss: 1.2790, test_loss: 1.3377, test_f1: 0.2270
 epoch: 2, train_loss: 1.2353, test_loss: 1.2985, test_f1: 0.2270
 epoch: 3, train_loss: 1.1886, test_loss: 1.2285, test_f1: 0.2270
 epoch: 4, train_loss: 1.1495, test_loss: 1.1411, test_f1: 0.3853
 epoch: 5, train_loss: 1.1115, test_loss: 1.0856, test_f1: 0.4171
 epoch: 6, train_loss: 1.0761, test_loss: 1.0500, test_f1: 0.4431
 epoch: 7, train_loss: 1.0515, test_loss: 1.0267, test_f1: 0.4619
 epoch: 8, train_loss: 1.0254, test_loss: 1.0091, test_f1: 0.4854
 epoch: 9, train_loss: 1.0023, test_loss: 0.9933, test_f1: 0.5014
 epoch: 10, train_loss: 0.9874, test_loss: 0.9838, test_f1: 0.5227
 epoch: 11, train_loss: 0.9693, test_loss: 0.9674, test_f1: 0.5211
 epoch: 12, train_loss: 0.9595, test_loss: 0.9554, test_f1: 0.5249
 epoch: 13, train_loss: 0.9459, test_loss: 0.9471, test_f1: 0.5379
 epoch: 14, train_loss: 0.9362, test_loss: 0.9358, test_f1: 0.5397
 epoch: 15, train_loss: 0.9280, test_loss: 0.9406, test_f1: 0.5364
 epoch: 16, train_loss: 0.9216, test_loss: 0.9263, test_f1: 0.5269
 epoch: 17, train_loss: 0.9119, test_loss: 0.9338, test_f1: 0.5376
 epoch: 18, train_loss: 0.8948, test_loss: 0.9071, test_f1: 0.5509
 epoch: 19, train_loss: 0.8868, test_loss: 0.9033, test_f1: 0.5569
 epoch: 20, train_loss: 0.8836, test_loss: 0.8986, test_f1: 0.5600
 epoch: 21, train_loss: 0.8735, test_loss: 0.8843, test_f1: 0.5585
 epoch: 22, train_loss: 0.8660, test_loss: 0.8877, test_f1: 0.5431
 epoch: 23, train_loss: 0.8637, test_loss: 0.8772, test_f1: 0.5520
 epoch: 24, train_loss: 0.8515, test_loss: 0.8790, test_f1: 0.5584
 epoch: 25, train_loss: 0.8435, test_loss: 0.9271, test_f1: 0.5349
 epoch: 26, train_loss: 0.8511, test_loss: 0.8609, test_f1: 0.5382
 epoch: 27, train_loss: 0.8366, test_loss: 0.8792, test_f1: 0.5606
 epoch: 28, train_loss: 0.8284, test_loss: 0.8712, test_f1: 0.5508
 epoch: 29, train_loss: 0.8287, test_loss: 0.8697, test_f1: 0.5645
 epoch: 30, train_loss: 0.8250, test_loss: 0.8715, test_f1: 0.5715
 epoch: 31, train_loss: 0.8150, test_loss: 0.8358, test_f1: 0.5665
 epoch: 32, train_loss: 0.8049, test_loss: 0.8382, test_f1: 0.5594
 epoch: 33, train_loss: 0.8007, test_loss: 0.8638, test_f1: 0.5468
 epoch: 34, train_loss: 0.8037, test_loss: 0.8290, test_f1: 0.5658
 epoch: 35, train_loss: 0.7955, test_loss: 0.8856, test_f1: 0.5502
 epoch: 36, train_loss: 0.7893, test_loss: 0.8265, test_f1: 0.5791
 epoch: 37, train_loss: 0.7786, test_loss: 0.8323, test_f1: 0.5674
 epoch: 38, train_loss: 0.7783, test_loss: 0.8365, test_f1: 0.5602
 epoch: 39, train_loss: 0.7679, test_loss: 0.8384, test_f1: 0.5775
 epoch: 40, train_loss: 0.7629, test_loss: 0.8314, test_f1: 0.5783
 epoch: 41, train_loss: 0.7507, test_loss: 0.8352, test_f1: 0.5727
 epoch: 42, train_loss: 0.7549, test_loss: 0.8234, test_f1: 0.5647
 epoch: 43, train_loss: 0.7446, test_loss: 0.8182, test_f1: 0.5594
 epoch: 44, train_loss: 0.7427, test_loss: 0.8195, test_f1: 0.5667
 epoch: 45, train_loss: 0.7493, test_loss: 0.8262, test_f1: 0.5797
 epoch: 46, train_loss: 0.7404, test_loss: 0.8319, test_f1: 0.5702
 epoch: 47, train_loss: 0.7400, test_loss: 0.8497, test_f1: 0.5621
 epoch: 48, train_loss: 0.7341, test_loss: 0.8429, test_f1: 0.5723
 epoch: 49, train_loss: 0.7273, test_loss: 0.8359, test_f1: 0.5655
 epoch: 50, train_loss: 0.7275, test_loss: 0.8436, test_f1: 0.5603
 epoch: 51, train_loss: 0.7106, test_loss: 0.8363, test_f1: 0.5542
 epoch: 52, train_loss: 0.7009, test_loss: 0.8254, test_f1: 0.5604
 epoch: 53, train_loss: 0.7000, test_loss: 0.8186, test_f1: 0.5635
 epoch: 54, train_loss: 0.7041, test_loss: 0.8393, test_f1: 0.5621
 epoch: 55, train_loss: 0.7005, test_loss: 0.8258, test_f1: 0.5723
 epoch: 56, train_loss: 0.6898, test_loss: 0.8255, test_f1: 0.5560
 epoch: 57, train_loss: 0.6909, test_loss: 0.8366, test_f1: 0.5658
 epoch: 58, train_loss: 0.6825, test_loss: 0.8262, test_f1: 0.5542
 epoch: 59, train_loss: 0.6910, test_loss: 0.8487, test_f1: 0.5697
 epoch: 60, train_loss: 0.6856, test_loss: 0.8231, test_f1: 0.5605
 epoch: 61, train_loss: 0.6857, test_loss: 0.8416, test_f1: 0.5668
 epoch: 62, train_loss: 0.6817, test_loss: 0.8488, test_f1: 0.5756
 epoch: 63, train_loss: 0.6825, test_loss: 0.8521, test_f1: 0.5673
 epoch: 64, train_loss: 0.6815, test_loss: 0.8248, test_f1: 0.5658
 epoch: 65, train_loss: 0.6709, test_loss: 0.8321, test_f1: 0.5637
 epoch: 66, train_loss: 0.6650, test_loss: 0.8280, test_f1: 0.5733
 epoch: 67, train_loss: 0.6720, test_loss: 0.8376, test_f1: 0.5763
 epoch: 68, train_loss: 0.6615, test_loss: 0.8354, test_f1: 0.5657
 epoch: 69, train_loss: 0.6640, test_loss: 0.8327, test_f1: 0.5884
 epoch: 70, train_loss: 0.6645, test_loss: 0.8323, test_f1: 0.5744
 epoch: 71, train_loss: 0.6643, test_loss: 0.8393, test_f1: 0.5671
 epoch: 72, train_loss: 0.6560, test_loss: 0.8386, test_f1: 0.5736
 epoch: 73, train_loss: 0.6595, test_loss: 0.8136, test_f1: 0.5738
 epoch: 74, train_loss: 0.6489, test_loss: 0.8524, test_f1: 0.5697
 epoch: 75, train_loss: 0.6495, test_loss: 0.8319, test_f1: 0.5716
 epoch: 76, train_loss: 0.6522, test_loss: 0.8517, test_f1: 0.5740
 epoch: 77, train_loss: 0.6503, test_loss: 0.8422, test_f1: 0.5919
 epoch: 78, train_loss: 0.6435, test_loss: 0.8455, test_f1: 0.5742
 epoch: 79, train_loss: 0.6471, test_loss: 0.8366, test_f1: 0.5851
 epoch: 80, train_loss: 0.6456, test_loss: 0.8705, test_f1: 0.5822
 epoch: 81, train_loss: 0.6394, test_loss: 0.8411, test_f1: 0.5713
 epoch: 82, train_loss: 0.6415, test_loss: 0.8346, test_f1: 0.5934
 epoch: 83, train_loss: 0.6330, test_loss: 0.8572, test_f1: 0.5932
 epoch: 84, train_loss: 0.6340, test_loss: 0.8466, test_f1: 0.5845
 epoch: 85, train_loss: 0.6378, test_loss: 0.8308, test_f1: 0.5907
 epoch: 86, train_loss: 0.6400, test_loss: 0.8440, test_f1: 0.5734
 epoch: 87, train_loss: 0.6403, test_loss: 0.8576, test_f1: 0.5861
 epoch: 88, train_loss: 0.6344, test_loss: 0.8319, test_f1: 0.5963
 epoch: 89, train_loss: 0.6292, test_loss: 0.8528, test_f1: 0.5877
 epoch: 90, train_loss: 0.6308, test_loss: 0.8362, test_f1: 0.5897
 epoch: 91, train_loss: 0.6276, test_loss: 0.8468, test_f1: 0.6013
 epoch: 92, train_loss: 0.6212, test_loss: 0.8448, test_f1: 0.5901
 epoch: 93, train_loss: 0.6278, test_loss: 0.8662, test_f1: 0.5971
 epoch: 94, train_loss: 0.6245, test_loss: 0.8270, test_f1: 0.5985
 epoch: 95, train_loss: 0.6201, test_loss: 0.8502, test_f1: 0.5983
 epoch: 96, train_loss: 0.6038, test_loss: 0.8464, test_f1: 0.5911
 epoch: 97, train_loss: 0.6090, test_loss: 0.8649, test_f1: 0.5983
 epoch: 98, train_loss: 0.6035, test_loss: 0.8730, test_f1: 0.5894
 epoch: 99, train_loss: 0.6143, test_loss: 0.8571, test_f1: 0.5938
##################ITERATION #2 ****************************************
 epoch: 0, train_loss: 1.3084, test_loss: 1.3520, test_f1: 0.2270
 epoch: 1, train_loss: 1.2255, test_loss: 1.3154, test_f1: 0.2270
 epoch: 2, train_loss: 1.1748, test_loss: 1.2797, test_f1: 0.2270
 epoch: 3, train_loss: 1.1290, test_loss: 1.1924, test_f1: 0.2320
 epoch: 4, train_loss: 1.0875, test_loss: 1.0832, test_f1: 0.4015
 epoch: 5, train_loss: 1.0536, test_loss: 1.0312, test_f1: 0.4527
 epoch: 6, train_loss: 1.0311, test_loss: 1.0040, test_f1: 0.4858
 epoch: 7, train_loss: 1.0054, test_loss: 0.9875, test_f1: 0.4917
 epoch: 8, train_loss: 0.9911, test_loss: 0.9743, test_f1: 0.4992
 epoch: 9, train_loss: 0.9752, test_loss: 0.9605, test_f1: 0.5093
 epoch: 10, train_loss: 0.9652, test_loss: 0.9513, test_f1: 0.5016
 epoch: 11, train_loss: 0.9578, test_loss: 0.9449, test_f1: 0.5180
 epoch: 12, train_loss: 0.9492, test_loss: 0.9367, test_f1: 0.5286
 epoch: 13, train_loss: 0.9305, test_loss: 0.9256, test_f1: 0.5399
 epoch: 14, train_loss: 0.9287, test_loss: 0.9160, test_f1: 0.5265
 epoch: 15, train_loss: 0.9176, test_loss: 0.9206, test_f1: 0.5386
 epoch: 16, train_loss: 0.9123, test_loss: 0.9089, test_f1: 0.5166
 epoch: 17, train_loss: 0.9019, test_loss: 0.8972, test_f1: 0.5455
 epoch: 18, train_loss: 0.8917, test_loss: 0.8848, test_f1: 0.5587
 epoch: 19, train_loss: 0.8907, test_loss: 0.8882, test_f1: 0.5529
 epoch: 20, train_loss: 0.8827, test_loss: 0.8813, test_f1: 0.5454
 epoch: 21, train_loss: 0.8768, test_loss: 0.8914, test_f1: 0.5146
 epoch: 22, train_loss: 0.8627, test_loss: 0.8696, test_f1: 0.5640
 epoch: 23, train_loss: 0.8622, test_loss: 0.8677, test_f1: 0.5410
 epoch: 24, train_loss: 0.8466, test_loss: 0.8743, test_f1: 0.5636
 epoch: 25, train_loss: 0.8473, test_loss: 0.8747, test_f1: 0.5551
 epoch: 26, train_loss: 0.8406, test_loss: 0.8473, test_f1: 0.5535
 epoch: 27, train_loss: 0.8314, test_loss: 0.8485, test_f1: 0.5605
 epoch: 28, train_loss: 0.8236, test_loss: 0.8828, test_f1: 0.5567
 epoch: 29, train_loss: 0.8228, test_loss: 0.8358, test_f1: 0.5496
 epoch: 30, train_loss: 0.8082, test_loss: 0.8453, test_f1: 0.5638
 epoch: 31, train_loss: 0.8027, test_loss: 0.8498, test_f1: 0.5488
 epoch: 32, train_loss: 0.7996, test_loss: 0.8409, test_f1: 0.5705
 epoch: 33, train_loss: 0.7963, test_loss: 0.8550, test_f1: 0.5649
 epoch: 34, train_loss: 0.7939, test_loss: 0.8391, test_f1: 0.5462
 epoch: 35, train_loss: 0.7837, test_loss: 0.8376, test_f1: 0.5531
 epoch: 36, train_loss: 0.7822, test_loss: 0.8383, test_f1: 0.5555
 epoch: 37, train_loss: 0.7650, test_loss: 0.8281, test_f1: 0.5518
 epoch: 38, train_loss: 0.7654, test_loss: 0.8533, test_f1: 0.5537
 epoch: 39, train_loss: 0.7625, test_loss: 0.8259, test_f1: 0.5686
 epoch: 40, train_loss: 0.7544, test_loss: 0.8188, test_f1: 0.5523
 epoch: 41, train_loss: 0.7414, test_loss: 0.8568, test_f1: 0.5565
 epoch: 42, train_loss: 0.7418, test_loss: 0.8121, test_f1: 0.5637
 epoch: 43, train_loss: 0.7400, test_loss: 0.8206, test_f1: 0.5811
 epoch: 44, train_loss: 0.7324, test_loss: 0.8272, test_f1: 0.5688
 epoch: 45, train_loss: 0.7294, test_loss: 0.8330, test_f1: 0.5556
 epoch: 46, train_loss: 0.7237, test_loss: 0.8364, test_f1: 0.5516
 epoch: 47, train_loss: 0.7197, test_loss: 0.8280, test_f1: 0.5651
 epoch: 48, train_loss: 0.7095, test_loss: 0.8459, test_f1: 0.5588
 epoch: 49, train_loss: 0.7030, test_loss: 0.8661, test_f1: 0.5613
 epoch: 50, train_loss: 0.7088, test_loss: 0.8126, test_f1: 0.5700
 epoch: 51, train_loss: 0.6954, test_loss: 0.8318, test_f1: 0.5708
 epoch: 52, train_loss: 0.6875, test_loss: 0.8486, test_f1: 0.5691
 epoch: 53, train_loss: 0.6918, test_loss: 0.8520, test_f1: 0.5639
 epoch: 54, train_loss: 0.6774, test_loss: 0.8537, test_f1: 0.5661
 epoch: 55, train_loss: 0.6774, test_loss: 0.8301, test_f1: 0.5677
 epoch: 56, train_loss: 0.6776, test_loss: 0.8497, test_f1: 0.5699
 epoch: 57, train_loss: 0.6777, test_loss: 0.8614, test_f1: 0.5673
 epoch: 58, train_loss: 0.6687, test_loss: 0.8498, test_f1: 0.5622
 epoch: 59, train_loss: 0.6639, test_loss: 0.8510, test_f1: 0.5778
 epoch: 60, train_loss: 0.6660, test_loss: 0.8471, test_f1: 0.5831
 epoch: 61, train_loss: 0.6676, test_loss: 0.8462, test_f1: 0.5899
 epoch: 62, train_loss: 0.6679, test_loss: 0.8606, test_f1: 0.5794
 epoch: 63, train_loss: 0.6612, test_loss: 0.8566, test_f1: 0.5771
 epoch: 64, train_loss: 0.6576, test_loss: 0.8520, test_f1: 0.5588
 epoch: 65, train_loss: 0.6540, test_loss: 0.8494, test_f1: 0.5828
 epoch: 66, train_loss: 0.6574, test_loss: 0.8595, test_f1: 0.5778
 epoch: 67, train_loss: 0.6487, test_loss: 0.8473, test_f1: 0.5850
 epoch: 68, train_loss: 0.6411, test_loss: 0.8556, test_f1: 0.5767
 epoch: 69, train_loss: 0.6450, test_loss: 0.8679, test_f1: 0.5683
 epoch: 70, train_loss: 0.6358, test_loss: 0.8479, test_f1: 0.5780
 epoch: 71, train_loss: 0.6445, test_loss: 0.8545, test_f1: 0.5775
 epoch: 72, train_loss: 0.6369, test_loss: 0.8543, test_f1: 0.5817
 epoch: 73, train_loss: 0.6278, test_loss: 0.8492, test_f1: 0.5865
 epoch: 74, train_loss: 0.6337, test_loss: 0.8848, test_f1: 0.5764
 epoch: 75, train_loss: 0.6305, test_loss: 0.8738, test_f1: 0.5765
 epoch: 76, train_loss: 0.6210, test_loss: 0.8686, test_f1: 0.5758
 epoch: 77, train_loss: 0.6271, test_loss: 0.8867, test_f1: 0.5759
 epoch: 78, train_loss: 0.6244, test_loss: 0.8872, test_f1: 0.5791
 epoch: 79, train_loss: 0.6243, test_loss: 0.8856, test_f1: 0.5758
 epoch: 80, train_loss: 0.6230, test_loss: 0.8783, test_f1: 0.5682
 epoch: 81, train_loss: 0.6210, test_loss: 0.8884, test_f1: 0.5780
 epoch: 82, train_loss: 0.6172, test_loss: 0.9059, test_f1: 0.5849
 epoch: 83, train_loss: 0.6186, test_loss: 0.8749, test_f1: 0.5917
 epoch: 84, train_loss: 0.6112, test_loss: 0.9071, test_f1: 0.5806
 epoch: 85, train_loss: 0.6124, test_loss: 0.9058, test_f1: 0.5749
 epoch: 86, train_loss: 0.5984, test_loss: 0.8811, test_f1: 0.5771
 epoch: 87, train_loss: 0.6024, test_loss: 0.9026, test_f1: 0.5729
 epoch: 88, train_loss: 0.6052, test_loss: 0.8968, test_f1: 0.5936
 epoch: 89, train_loss: 0.6009, test_loss: 0.9147, test_f1: 0.5850
 epoch: 90, train_loss: 0.6054, test_loss: 0.9012, test_f1: 0.5856
 epoch: 91, train_loss: 0.5908, test_loss: 0.9323, test_f1: 0.5683
 epoch: 92, train_loss: 0.6002, test_loss: 0.9056, test_f1: 0.5757
 epoch: 93, train_loss: 0.5960, test_loss: 0.9149, test_f1: 0.5797
 epoch: 94, train_loss: 0.5891, test_loss: 0.9176, test_f1: 0.5764
 epoch: 95, train_loss: 0.5922, test_loss: 0.9069, test_f1: 0.5866
 epoch: 96, train_loss: 0.5874, test_loss: 0.9226, test_f1: 0.5854
 epoch: 97, train_loss: 0.6036, test_loss: 0.9023, test_f1: 0.5826
 epoch: 98, train_loss: 0.5787, test_loss: 0.9315, test_f1: 0.5911
 epoch: 99, train_loss: 0.5932, test_loss: 0.9140, test_f1: 0.5744
##################ITERATION #3 ****************************************
 epoch: 0, train_loss: 1.2672, test_loss: 1.3306, test_f1: 0.2270
 epoch: 1, train_loss: 1.1640, test_loss: 1.2809, test_f1: 0.2270
 epoch: 2, train_loss: 1.1083, test_loss: 1.1963, test_f1: 0.2506
 epoch: 3, train_loss: 1.0707, test_loss: 1.0911, test_f1: 0.3677
 epoch: 4, train_loss: 1.0407, test_loss: 1.0441, test_f1: 0.4499
 epoch: 5, train_loss: 1.0155, test_loss: 1.0194, test_f1: 0.4649
 epoch: 6, train_loss: 0.9934, test_loss: 1.0018, test_f1: 0.5021
 epoch: 7, train_loss: 0.9779, test_loss: 0.9832, test_f1: 0.5133
 epoch: 8, train_loss: 0.9685, test_loss: 0.9708, test_f1: 0.5223
 epoch: 9, train_loss: 0.9528, test_loss: 0.9604, test_f1: 0.5144
 epoch: 10, train_loss: 0.9429, test_loss: 0.9514, test_f1: 0.5274
 epoch: 11, train_loss: 0.9298, test_loss: 0.9516, test_f1: 0.5225
 epoch: 12, train_loss: 0.9314, test_loss: 0.9459, test_f1: 0.5332
 epoch: 13, train_loss: 0.9136, test_loss: 0.9272, test_f1: 0.5354
 epoch: 14, train_loss: 0.9080, test_loss: 0.9274, test_f1: 0.5293
 epoch: 15, train_loss: 0.8996, test_loss: 0.9331, test_f1: 0.5329
 epoch: 16, train_loss: 0.8933, test_loss: 0.9198, test_f1: 0.5440
 epoch: 17, train_loss: 0.8892, test_loss: 0.9341, test_f1: 0.5294
 epoch: 18, train_loss: 0.8760, test_loss: 0.9334, test_f1: 0.5356
 epoch: 19, train_loss: 0.8657, test_loss: 0.9079, test_f1: 0.5377
 epoch: 20, train_loss: 0.8541, test_loss: 0.9007, test_f1: 0.5381
 epoch: 21, train_loss: 0.8545, test_loss: 0.8969, test_f1: 0.5491
 epoch: 22, train_loss: 0.8531, test_loss: 0.8908, test_f1: 0.5443
 epoch: 23, train_loss: 0.8398, test_loss: 0.8842, test_f1: 0.5483
 epoch: 24, train_loss: 0.8381, test_loss: 0.8776, test_f1: 0.5363
 epoch: 25, train_loss: 0.8222, test_loss: 0.8789, test_f1: 0.5606
 epoch: 26, train_loss: 0.8131, test_loss: 0.8679, test_f1: 0.5487
 epoch: 27, train_loss: 0.8120, test_loss: 0.8886, test_f1: 0.5511
 epoch: 28, train_loss: 0.8065, test_loss: 0.8866, test_f1: 0.5643
 epoch: 29, train_loss: 0.8047, test_loss: 0.8699, test_f1: 0.5542
 epoch: 30, train_loss: 0.8067, test_loss: 0.8547, test_f1: 0.5516
 epoch: 31, train_loss: 0.7867, test_loss: 0.8740, test_f1: 0.5529
 epoch: 32, train_loss: 0.7821, test_loss: 0.8634, test_f1: 0.5676
 epoch: 33, train_loss: 0.7736, test_loss: 0.8776, test_f1: 0.5563
 epoch: 34, train_loss: 0.7670, test_loss: 0.8614, test_f1: 0.5854
 epoch: 35, train_loss: 0.7630, test_loss: 0.8522, test_f1: 0.5690
 epoch: 36, train_loss: 0.7533, test_loss: 0.8782, test_f1: 0.5774
 epoch: 37, train_loss: 0.7521, test_loss: 0.8491, test_f1: 0.5732
 epoch: 38, train_loss: 0.7493, test_loss: 0.8647, test_f1: 0.5697
 epoch: 39, train_loss: 0.7422, test_loss: 0.8381, test_f1: 0.5573
 epoch: 40, train_loss: 0.7345, test_loss: 0.8698, test_f1: 0.5822
 epoch: 41, train_loss: 0.7209, test_loss: 0.8636, test_f1: 0.5683
 epoch: 42, train_loss: 0.7215, test_loss: 0.8682, test_f1: 0.5979
 epoch: 43, train_loss: 0.7164, test_loss: 0.8638, test_f1: 0.5876
 epoch: 44, train_loss: 0.7156, test_loss: 0.8496, test_f1: 0.5740
 epoch: 45, train_loss: 0.7105, test_loss: 0.8523, test_f1: 0.5773
 epoch: 46, train_loss: 0.6986, test_loss: 0.8767, test_f1: 0.5991
 epoch: 47, train_loss: 0.7097, test_loss: 0.8528, test_f1: 0.5883
 epoch: 48, train_loss: 0.6961, test_loss: 0.8640, test_f1: 0.6090
 epoch: 49, train_loss: 0.6946, test_loss: 0.8667, test_f1: 0.6069
 epoch: 50, train_loss: 0.6833, test_loss: 0.8419, test_f1: 0.5920
 epoch: 51, train_loss: 0.6785, test_loss: 0.8493, test_f1: 0.6076
 epoch: 52, train_loss: 0.6684, test_loss: 0.8393, test_f1: 0.6126
 epoch: 53, train_loss: 0.6629, test_loss: 0.8623, test_f1: 0.6127
 epoch: 54, train_loss: 0.6659, test_loss: 0.8420, test_f1: 0.6011
 epoch: 55, train_loss: 0.6545, test_loss: 0.8491, test_f1: 0.5966
 epoch: 56, train_loss: 0.6653, test_loss: 0.8536, test_f1: 0.5957
 epoch: 57, train_loss: 0.6617, test_loss: 0.8579, test_f1: 0.6013
 epoch: 58, train_loss: 0.6562, test_loss: 0.8582, test_f1: 0.6034
 epoch: 59, train_loss: 0.6633, test_loss: 0.8541, test_f1: 0.6053
 epoch: 60, train_loss: 0.6509, test_loss: 0.8539, test_f1: 0.5968
 epoch: 61, train_loss: 0.6529, test_loss: 0.8630, test_f1: 0.5968
 epoch: 62, train_loss: 0.6466, test_loss: 0.8522, test_f1: 0.5960
 epoch: 63, train_loss: 0.6387, test_loss: 0.8470, test_f1: 0.5963
 epoch: 64, train_loss: 0.6439, test_loss: 0.8559, test_f1: 0.5994
 epoch: 65, train_loss: 0.6422, test_loss: 0.8676, test_f1: 0.6140
 epoch: 66, train_loss: 0.6299, test_loss: 0.8634, test_f1: 0.5904
 epoch: 67, train_loss: 0.6416, test_loss: 0.8682, test_f1: 0.5897
 epoch: 68, train_loss: 0.6410, test_loss: 0.8644, test_f1: 0.5934
 epoch: 69, train_loss: 0.6365, test_loss: 0.8771, test_f1: 0.6073
 epoch: 70, train_loss: 0.6241, test_loss: 0.8770, test_f1: 0.5992
 epoch: 71, train_loss: 0.6283, test_loss: 0.8613, test_f1: 0.6020
 epoch: 72, train_loss: 0.6214, test_loss: 0.8920, test_f1: 0.5855
 epoch: 73, train_loss: 0.6182, test_loss: 0.8693, test_f1: 0.5948
 epoch: 74, train_loss: 0.6193, test_loss: 0.8653, test_f1: 0.6022
 epoch: 75, train_loss: 0.6137, test_loss: 0.8748, test_f1: 0.6037
 epoch: 76, train_loss: 0.6085, test_loss: 0.8728, test_f1: 0.6058
 epoch: 77, train_loss: 0.6113, test_loss: 0.8866, test_f1: 0.5985
 epoch: 78, train_loss: 0.6108, test_loss: 0.8820, test_f1: 0.6006
 epoch: 79, train_loss: 0.6083, test_loss: 0.8860, test_f1: 0.6095
 epoch: 80, train_loss: 0.6112, test_loss: 0.8819, test_f1: 0.6113
 epoch: 81, train_loss: 0.6060, test_loss: 0.8950, test_f1: 0.6051
 epoch: 82, train_loss: 0.6065, test_loss: 0.8865, test_f1: 0.6186
 epoch: 83, train_loss: 0.6017, test_loss: 0.8880, test_f1: 0.6020
 epoch: 84, train_loss: 0.5927, test_loss: 0.8862, test_f1: 0.6040
 epoch: 85, train_loss: 0.5979, test_loss: 0.8921, test_f1: 0.6224
 epoch: 86, train_loss: 0.5987, test_loss: 0.8794, test_f1: 0.6063
 epoch: 87, train_loss: 0.5908, test_loss: 0.9025, test_f1: 0.6353
 epoch: 88, train_loss: 0.6010, test_loss: 0.9165, test_f1: 0.6145
 epoch: 89, train_loss: 0.5903, test_loss: 0.9095, test_f1: 0.6165
 epoch: 90, train_loss: 0.5973, test_loss: 0.9050, test_f1: 0.6258
 epoch: 91, train_loss: 0.5788, test_loss: 0.8883, test_f1: 0.6186
 epoch: 92, train_loss: 0.5844, test_loss: 0.8893, test_f1: 0.5986
 epoch: 93, train_loss: 0.6038, test_loss: 0.9139, test_f1: 0.6322
 epoch: 94, train_loss: 0.5825, test_loss: 0.9145, test_f1: 0.6122
 epoch: 95, train_loss: 0.5883, test_loss: 0.9205, test_f1: 0.6221
 epoch: 96, train_loss: 0.5800, test_loss: 0.9170, test_f1: 0.6006
 epoch: 97, train_loss: 0.5781, test_loss: 0.9107, test_f1: 0.6195
 epoch: 98, train_loss: 0.5785, test_loss: 0.9207, test_f1: 0.6036
 epoch: 99, train_loss: 0.5602, test_loss: 0.9106, test_f1: 0.6199
##################ITERATION #4 ****************************************
 epoch: 0, train_loss: 1.2541, test_loss: 1.3254, test_f1: 0.2270
 epoch: 1, train_loss: 1.1276, test_loss: 1.3021, test_f1: 0.2270
 epoch: 2, train_loss: 1.0736, test_loss: 1.2293, test_f1: 0.2484
 epoch: 3, train_loss: 1.0368, test_loss: 1.1086, test_f1: 0.3589
 epoch: 4, train_loss: 1.0072, test_loss: 1.0405, test_f1: 0.4609
 epoch: 5, train_loss: 0.9854, test_loss: 0.9879, test_f1: 0.4912
 epoch: 6, train_loss: 0.9676, test_loss: 0.9580, test_f1: 0.5270
 epoch: 7, train_loss: 0.9563, test_loss: 0.9362, test_f1: 0.5234
 epoch: 8, train_loss: 0.9394, test_loss: 0.9223, test_f1: 0.5463
 epoch: 9, train_loss: 0.9331, test_loss: 0.9161, test_f1: 0.5343
 epoch: 10, train_loss: 0.9240, test_loss: 0.9046, test_f1: 0.5376
 epoch: 11, train_loss: 0.9105, test_loss: 0.9073, test_f1: 0.5362
 epoch: 12, train_loss: 0.8993, test_loss: 0.8933, test_f1: 0.5297
 epoch: 13, train_loss: 0.8915, test_loss: 0.8825, test_f1: 0.5452
 epoch: 14, train_loss: 0.8873, test_loss: 0.8802, test_f1: 0.5420
 epoch: 15, train_loss: 0.8769, test_loss: 0.8738, test_f1: 0.5381
 epoch: 16, train_loss: 0.8717, test_loss: 0.8663, test_f1: 0.5542
 epoch: 17, train_loss: 0.8638, test_loss: 0.8623, test_f1: 0.5537
 epoch: 18, train_loss: 0.8510, test_loss: 0.8524, test_f1: 0.5442
 epoch: 19, train_loss: 0.8435, test_loss: 0.8471, test_f1: 0.5515
 epoch: 20, train_loss: 0.8333, test_loss: 0.8413, test_f1: 0.5523
 epoch: 21, train_loss: 0.8315, test_loss: 0.8403, test_f1: 0.5519
 epoch: 22, train_loss: 0.8195, test_loss: 0.8350, test_f1: 0.5529
 epoch: 23, train_loss: 0.8135, test_loss: 0.8293, test_f1: 0.5615
 epoch: 24, train_loss: 0.7989, test_loss: 0.8125, test_f1: 0.5512
 epoch: 25, train_loss: 0.7932, test_loss: 0.8248, test_f1: 0.5617
 epoch: 26, train_loss: 0.7895, test_loss: 0.8120, test_f1: 0.5723
 epoch: 27, train_loss: 0.7786, test_loss: 0.7985, test_f1: 0.5838
 epoch: 28, train_loss: 0.7770, test_loss: 0.8143, test_f1: 0.5621
 epoch: 29, train_loss: 0.7618, test_loss: 0.7912, test_f1: 0.5759
 epoch: 30, train_loss: 0.7652, test_loss: 0.8061, test_f1: 0.5743
 epoch: 31, train_loss: 0.7606, test_loss: 0.7939, test_f1: 0.5804
 epoch: 32, train_loss: 0.7476, test_loss: 0.7866, test_f1: 0.5753
 epoch: 33, train_loss: 0.7465, test_loss: 0.7943, test_f1: 0.5785
 epoch: 34, train_loss: 0.7339, test_loss: 0.7926, test_f1: 0.5785
 epoch: 35, train_loss: 0.7326, test_loss: 0.8061, test_f1: 0.5843
 epoch: 36, train_loss: 0.7258, test_loss: 0.7794, test_f1: 0.5891
 epoch: 37, train_loss: 0.7271, test_loss: 0.7888, test_f1: 0.5799
 epoch: 38, train_loss: 0.7092, test_loss: 0.7766, test_f1: 0.5862
 epoch: 39, train_loss: 0.7119, test_loss: 0.7787, test_f1: 0.5872
 epoch: 40, train_loss: 0.7014, test_loss: 0.7678, test_f1: 0.5983
 epoch: 41, train_loss: 0.7040, test_loss: 0.7663, test_f1: 0.6098
 epoch: 42, train_loss: 0.6944, test_loss: 0.7877, test_f1: 0.5805
 epoch: 43, train_loss: 0.6978, test_loss: 0.8074, test_f1: 0.5838
 epoch: 44, train_loss: 0.6913, test_loss: 0.7909, test_f1: 0.5966
 epoch: 45, train_loss: 0.6800, test_loss: 0.7832, test_f1: 0.6138
 epoch: 46, train_loss: 0.6710, test_loss: 0.7702, test_f1: 0.6065
 epoch: 47, train_loss: 0.6739, test_loss: 0.7636, test_f1: 0.5990
 epoch: 48, train_loss: 0.6672, test_loss: 0.7972, test_f1: 0.5989
 epoch: 49, train_loss: 0.6626, test_loss: 0.7611, test_f1: 0.6179
 epoch: 50, train_loss: 0.6574, test_loss: 0.7745, test_f1: 0.5935
 epoch: 51, train_loss: 0.6546, test_loss: 0.7770, test_f1: 0.6197
 epoch: 52, train_loss: 0.6475, test_loss: 0.7722, test_f1: 0.6148
 epoch: 53, train_loss: 0.6344, test_loss: 0.7630, test_f1: 0.6164
 epoch: 54, train_loss: 0.6366, test_loss: 0.7693, test_f1: 0.6236
 epoch: 55, train_loss: 0.6381, test_loss: 0.7688, test_f1: 0.6362
 epoch: 56, train_loss: 0.6353, test_loss: 0.7769, test_f1: 0.6025
 epoch: 57, train_loss: 0.6321, test_loss: 0.7702, test_f1: 0.6218
 epoch: 58, train_loss: 0.6153, test_loss: 0.7732, test_f1: 0.6116
 epoch: 59, train_loss: 0.6206, test_loss: 0.7757, test_f1: 0.6050
 epoch: 60, train_loss: 0.6256, test_loss: 0.7941, test_f1: 0.5931
 epoch: 61, train_loss: 0.6147, test_loss: 0.7748, test_f1: 0.6255
 epoch: 62, train_loss: 0.6089, test_loss: 0.7900, test_f1: 0.6106
 epoch: 63, train_loss: 0.6137, test_loss: 0.7816, test_f1: 0.6219
 epoch: 64, train_loss: 0.6121, test_loss: 0.7879, test_f1: 0.6110
 epoch: 65, train_loss: 0.5991, test_loss: 0.7807, test_f1: 0.6217
 epoch: 66, train_loss: 0.6095, test_loss: 0.7893, test_f1: 0.6246
 epoch: 67, train_loss: 0.6085, test_loss: 0.7896, test_f1: 0.6183
 epoch: 68, train_loss: 0.6006, test_loss: 0.7854, test_f1: 0.6218
 epoch: 69, train_loss: 0.5976, test_loss: 0.7864, test_f1: 0.6401
 epoch: 70, train_loss: 0.5913, test_loss: 0.8006, test_f1: 0.6150
 epoch: 71, train_loss: 0.5925, test_loss: 0.7925, test_f1: 0.6258
 epoch: 72, train_loss: 0.5858, test_loss: 0.7841, test_f1: 0.6432
 epoch: 73, train_loss: 0.5941, test_loss: 0.7965, test_f1: 0.6480
 epoch: 74, train_loss: 0.5803, test_loss: 0.7977, test_f1: 0.6323
 epoch: 75, train_loss: 0.5830, test_loss: 0.7902, test_f1: 0.6413
 epoch: 76, train_loss: 0.5942, test_loss: 0.7976, test_f1: 0.6606
 epoch: 77, train_loss: 0.5927, test_loss: 0.8052, test_f1: 0.6281
 epoch: 78, train_loss: 0.5862, test_loss: 0.8094, test_f1: 0.6390
 epoch: 79, train_loss: 0.5919, test_loss: 0.8030, test_f1: 0.6496
 epoch: 80, train_loss: 0.5775, test_loss: 0.8092, test_f1: 0.6373
 epoch: 81, train_loss: 0.5737, test_loss: 0.7928, test_f1: 0.6316
 epoch: 82, train_loss: 0.5807, test_loss: 0.8149, test_f1: 0.6307
 epoch: 83, train_loss: 0.5687, test_loss: 0.8285, test_f1: 0.6412
 epoch: 84, train_loss: 0.5766, test_loss: 0.8115, test_f1: 0.6605
 epoch: 85, train_loss: 0.5713, test_loss: 0.8270, test_f1: 0.6479
 epoch: 86, train_loss: 0.5710, test_loss: 0.8193, test_f1: 0.6547
 epoch: 87, train_loss: 0.5633, test_loss: 0.8064, test_f1: 0.6488
 epoch: 88, train_loss: 0.5527, test_loss: 0.8184, test_f1: 0.6453
 epoch: 89, train_loss: 0.5561, test_loss: 0.8240, test_f1: 0.6495
 epoch: 90, train_loss: 0.5470, test_loss: 0.8288, test_f1: 0.6561
 epoch: 91, train_loss: 0.5553, test_loss: 0.8356, test_f1: 0.6402
 epoch: 92, train_loss: 0.5537, test_loss: 0.8227, test_f1: 0.6565
 epoch: 93, train_loss: 0.5513, test_loss: 0.8235, test_f1: 0.6616
 epoch: 94, train_loss: 0.5509, test_loss: 0.8387, test_f1: 0.6434
 epoch: 95, train_loss: 0.5426, test_loss: 0.8435, test_f1: 0.6534
 epoch: 96, train_loss: 0.5507, test_loss: 0.8447, test_f1: 0.6574
 epoch: 97, train_loss: 0.5487, test_loss: 0.8474, test_f1: 0.6447
 epoch: 98, train_loss: 0.5379, test_loss: 0.8601, test_f1: 0.6383
 epoch: 99, train_loss: 0.5428, test_loss: 0.8776, test_f1: 0.6282
##################ITERATION #5 ****************************************
 epoch: 0, train_loss: 1.2101, test_loss: 1.3101, test_f1: 0.2270
 epoch: 1, train_loss: 1.0849, test_loss: 1.2775, test_f1: 0.2392
 epoch: 2, train_loss: 1.0448, test_loss: 1.1911, test_f1: 0.3123
 epoch: 3, train_loss: 1.0200, test_loss: 1.0659, test_f1: 0.4668
 epoch: 4, train_loss: 0.9962, test_loss: 0.9975, test_f1: 0.4968
 epoch: 5, train_loss: 0.9847, test_loss: 0.9757, test_f1: 0.5264
 epoch: 6, train_loss: 0.9648, test_loss: 0.9631, test_f1: 0.5331
 epoch: 7, train_loss: 0.9576, test_loss: 0.9494, test_f1: 0.5412
 epoch: 8, train_loss: 0.9438, test_loss: 0.9413, test_f1: 0.5466
 epoch: 9, train_loss: 0.9328, test_loss: 0.9362, test_f1: 0.5205
 epoch: 10, train_loss: 0.9172, test_loss: 0.9321, test_f1: 0.5351
 epoch: 11, train_loss: 0.9102, test_loss: 0.9267, test_f1: 0.5424
 epoch: 12, train_loss: 0.8994, test_loss: 0.9136, test_f1: 0.5403
 epoch: 13, train_loss: 0.8925, test_loss: 0.9044, test_f1: 0.5435
 epoch: 14, train_loss: 0.8853, test_loss: 0.9084, test_f1: 0.5494
 epoch: 15, train_loss: 0.8744, test_loss: 0.8885, test_f1: 0.5555
 epoch: 16, train_loss: 0.8615, test_loss: 0.8855, test_f1: 0.5595
 epoch: 17, train_loss: 0.8596, test_loss: 0.8839, test_f1: 0.5562
 epoch: 18, train_loss: 0.8566, test_loss: 0.8919, test_f1: 0.5480
 epoch: 19, train_loss: 0.8375, test_loss: 0.8781, test_f1: 0.5640
 epoch: 20, train_loss: 0.8427, test_loss: 0.8843, test_f1: 0.5475
 epoch: 21, train_loss: 0.8333, test_loss: 0.8759, test_f1: 0.5627
 epoch: 22, train_loss: 0.8216, test_loss: 0.8680, test_f1: 0.5533
 epoch: 23, train_loss: 0.8144, test_loss: 0.8563, test_f1: 0.5716
 epoch: 24, train_loss: 0.7990, test_loss: 0.8773, test_f1: 0.5602
 epoch: 25, train_loss: 0.7977, test_loss: 0.8741, test_f1: 0.5700
 epoch: 26, train_loss: 0.7844, test_loss: 0.8467, test_f1: 0.5694
 epoch: 27, train_loss: 0.7771, test_loss: 0.8507, test_f1: 0.5790
 epoch: 28, train_loss: 0.7813, test_loss: 0.8575, test_f1: 0.5633
 epoch: 29, train_loss: 0.7722, test_loss: 0.8461, test_f1: 0.5703
 epoch: 30, train_loss: 0.7523, test_loss: 0.8534, test_f1: 0.5822
 epoch: 31, train_loss: 0.7574, test_loss: 0.8842, test_f1: 0.5672
 epoch: 32, train_loss: 0.7544, test_loss: 0.8568, test_f1: 0.5608
 epoch: 33, train_loss: 0.7454, test_loss: 0.8475, test_f1: 0.5775
 epoch: 34, train_loss: 0.7418, test_loss: 0.8326, test_f1: 0.5691
 epoch: 35, train_loss: 0.7325, test_loss: 0.8370, test_f1: 0.5737
 epoch: 36, train_loss: 0.7209, test_loss: 0.8382, test_f1: 0.5905
 epoch: 37, train_loss: 0.7189, test_loss: 0.8717, test_f1: 0.5772
 epoch: 38, train_loss: 0.7180, test_loss: 0.8273, test_f1: 0.6025
 epoch: 39, train_loss: 0.7099, test_loss: 0.8556, test_f1: 0.5766
 epoch: 40, train_loss: 0.7077, test_loss: 0.8499, test_f1: 0.5971
 epoch: 41, train_loss: 0.6967, test_loss: 0.8265, test_f1: 0.6373
 epoch: 42, train_loss: 0.6857, test_loss: 0.8549, test_f1: 0.6115
 epoch: 43, train_loss: 0.6850, test_loss: 0.8607, test_f1: 0.6161
 epoch: 44, train_loss: 0.6802, test_loss: 0.8541, test_f1: 0.6167
 epoch: 45, train_loss: 0.6761, test_loss: 0.8459, test_f1: 0.6164
 epoch: 46, train_loss: 0.6610, test_loss: 0.8745, test_f1: 0.6289
 epoch: 47, train_loss: 0.6584, test_loss: 0.8647, test_f1: 0.6082
 epoch: 48, train_loss: 0.6656, test_loss: 0.8345, test_f1: 0.5957
 epoch: 49, train_loss: 0.6678, test_loss: 0.8731, test_f1: 0.6339
 epoch: 50, train_loss: 0.6453, test_loss: 0.8773, test_f1: 0.6175
 epoch: 51, train_loss: 0.6514, test_loss: 0.8850, test_f1: 0.6222
 epoch: 52, train_loss: 0.6293, test_loss: 0.8742, test_f1: 0.6189
 epoch: 53, train_loss: 0.6334, test_loss: 0.8621, test_f1: 0.6187
 epoch: 54, train_loss: 0.6327, test_loss: 0.8811, test_f1: 0.6234
 epoch: 55, train_loss: 0.6210, test_loss: 0.8928, test_f1: 0.6223
 epoch: 56, train_loss: 0.6185, test_loss: 0.8949, test_f1: 0.6303
 epoch: 57, train_loss: 0.6233, test_loss: 0.8977, test_f1: 0.6353
 epoch: 58, train_loss: 0.6127, test_loss: 0.8834, test_f1: 0.6423
 epoch: 59, train_loss: 0.6025, test_loss: 0.8938, test_f1: 0.6387
 epoch: 60, train_loss: 0.6201, test_loss: 0.9031, test_f1: 0.6357
 epoch: 61, train_loss: 0.6084, test_loss: 0.9090, test_f1: 0.6127
 epoch: 62, train_loss: 0.6004, test_loss: 0.8901, test_f1: 0.6367
 epoch: 63, train_loss: 0.6061, test_loss: 0.8997, test_f1: 0.6458
 epoch: 64, train_loss: 0.5982, test_loss: 0.8835, test_f1: 0.6388
 epoch: 65, train_loss: 0.5915, test_loss: 0.9222, test_f1: 0.6534
 epoch: 66, train_loss: 0.5986, test_loss: 0.9133, test_f1: 0.6540
 epoch: 67, train_loss: 0.5934, test_loss: 0.9085, test_f1: 0.6346
 epoch: 68, train_loss: 0.5962, test_loss: 0.9112, test_f1: 0.6296
 epoch: 69, train_loss: 0.5810, test_loss: 0.9135, test_f1: 0.6467
 epoch: 70, train_loss: 0.5882, test_loss: 0.9304, test_f1: 0.6298
 epoch: 71, train_loss: 0.5837, test_loss: 0.9361, test_f1: 0.6312
 epoch: 72, train_loss: 0.5841, test_loss: 0.9227, test_f1: 0.6423
 epoch: 73, train_loss: 0.5796, test_loss: 0.9412, test_f1: 0.6482
 epoch: 74, train_loss: 0.5755, test_loss: 0.9404, test_f1: 0.6431
 epoch: 75, train_loss: 0.5707, test_loss: 0.9440, test_f1: 0.6288
 epoch: 76, train_loss: 0.5780, test_loss: 0.9348, test_f1: 0.6421
 epoch: 77, train_loss: 0.5743, test_loss: 0.9372, test_f1: 0.6486
 epoch: 78, train_loss: 0.5648, test_loss: 0.9580, test_f1: 0.6282
 epoch: 79, train_loss: 0.5659, test_loss: 0.9497, test_f1: 0.6406
 epoch: 80, train_loss: 0.5605, test_loss: 0.9669, test_f1: 0.6338
 epoch: 81, train_loss: 0.5600, test_loss: 0.9437, test_f1: 0.6363
 epoch: 82, train_loss: 0.5672, test_loss: 0.9697, test_f1: 0.6331
 epoch: 83, train_loss: 0.5535, test_loss: 0.9602, test_f1: 0.6541
 epoch: 84, train_loss: 0.5511, test_loss: 0.9653, test_f1: 0.6183
 epoch: 85, train_loss: 0.5493, test_loss: 0.9696, test_f1: 0.6228
 epoch: 86, train_loss: 0.5551, test_loss: 0.9599, test_f1: 0.6257
 epoch: 87, train_loss: 0.5590, test_loss: 0.9543, test_f1: 0.6241
 epoch: 88, train_loss: 0.5440, test_loss: 0.9764, test_f1: 0.6282
 epoch: 89, train_loss: 0.5461, test_loss: 0.9734, test_f1: 0.6247
 epoch: 90, train_loss: 0.5434, test_loss: 0.9567, test_f1: 0.6333
 epoch: 91, train_loss: 0.5332, test_loss: 0.9554, test_f1: 0.6300
 epoch: 92, train_loss: 0.5337, test_loss: 0.9782, test_f1: 0.6173
 epoch: 93, train_loss: 0.5373, test_loss: 0.9740, test_f1: 0.6267
 epoch: 94, train_loss: 0.5329, test_loss: 0.9902, test_f1: 0.6076
 epoch: 95, train_loss: 0.5354, test_loss: 0.9898, test_f1: 0.6304
 epoch: 96, train_loss: 0.5391, test_loss: 0.9694, test_f1: 0.6344
 epoch: 97, train_loss: 0.5218, test_loss: 0.9834, test_f1: 0.6342
 epoch: 98, train_loss: 0.5284, test_loss: 0.9918, test_f1: 0.6344
 epoch: 99, train_loss: 0.5265, test_loss: 0.9872, test_f1: 0.6020
##################ITERATION #6 ****************************************
 epoch: 0, train_loss: 1.2664, test_loss: 1.3237, test_f1: 0.2270
 epoch: 1, train_loss: 1.1085, test_loss: 1.3378, test_f1: 0.2270
 epoch: 2, train_loss: 1.0531, test_loss: 1.3206, test_f1: 0.2270
 epoch: 3, train_loss: 1.0258, test_loss: 1.1919, test_f1: 0.2451
 epoch: 4, train_loss: 0.9975, test_loss: 1.0674, test_f1: 0.4381
 epoch: 5, train_loss: 0.9846, test_loss: 0.9922, test_f1: 0.4894
 epoch: 6, train_loss: 0.9652, test_loss: 0.9694, test_f1: 0.5110
 epoch: 7, train_loss: 0.9662, test_loss: 0.9574, test_f1: 0.5069
 epoch: 8, train_loss: 0.9461, test_loss: 0.9510, test_f1: 0.5223
 epoch: 9, train_loss: 0.9370, test_loss: 0.9428, test_f1: 0.5217
 epoch: 10, train_loss: 0.9345, test_loss: 0.9311, test_f1: 0.5294
 epoch: 11, train_loss: 0.9161, test_loss: 0.9227, test_f1: 0.5219
 epoch: 12, train_loss: 0.9047, test_loss: 0.9099, test_f1: 0.5238
 epoch: 13, train_loss: 0.8985, test_loss: 0.9081, test_f1: 0.5276
 epoch: 14, train_loss: 0.8933, test_loss: 0.9076, test_f1: 0.5258
 epoch: 15, train_loss: 0.8765, test_loss: 0.8980, test_f1: 0.5293
 epoch: 16, train_loss: 0.8710, test_loss: 0.8915, test_f1: 0.5305
 epoch: 17, train_loss: 0.8654, test_loss: 0.8838, test_f1: 0.5487
 epoch: 18, train_loss: 0.8516, test_loss: 0.8726, test_f1: 0.5454
 epoch: 19, train_loss: 0.8495, test_loss: 0.8746, test_f1: 0.5445
 epoch: 20, train_loss: 0.8408, test_loss: 0.8687, test_f1: 0.5474
 epoch: 21, train_loss: 0.8329, test_loss: 0.8513, test_f1: 0.5523
 epoch: 22, train_loss: 0.8241, test_loss: 0.8596, test_f1: 0.5547
 epoch: 23, train_loss: 0.8169, test_loss: 0.8592, test_f1: 0.5653
 epoch: 24, train_loss: 0.8096, test_loss: 0.8564, test_f1: 0.5679
 epoch: 25, train_loss: 0.8007, test_loss: 0.8469, test_f1: 0.5704
 epoch: 26, train_loss: 0.7950, test_loss: 0.8289, test_f1: 0.5626
 epoch: 27, train_loss: 0.7927, test_loss: 0.8225, test_f1: 0.5543
 epoch: 28, train_loss: 0.7818, test_loss: 0.8305, test_f1: 0.5530
 epoch: 29, train_loss: 0.7777, test_loss: 0.8139, test_f1: 0.5670
 epoch: 30, train_loss: 0.7725, test_loss: 0.8156, test_f1: 0.5688
 epoch: 31, train_loss: 0.7644, test_loss: 0.8359, test_f1: 0.5747
 epoch: 32, train_loss: 0.7619, test_loss: 0.8117, test_f1: 0.5851
 epoch: 33, train_loss: 0.7521, test_loss: 0.8163, test_f1: 0.5816
 epoch: 34, train_loss: 0.7475, test_loss: 0.8070, test_f1: 0.5855
 epoch: 35, train_loss: 0.7463, test_loss: 0.8185, test_f1: 0.5990
 epoch: 36, train_loss: 0.7375, test_loss: 0.8101, test_f1: 0.5979
 epoch: 37, train_loss: 0.7356, test_loss: 0.8231, test_f1: 0.5894
 epoch: 38, train_loss: 0.7317, test_loss: 0.8398, test_f1: 0.5793
 epoch: 39, train_loss: 0.7290, test_loss: 0.8057, test_f1: 0.5980
 epoch: 40, train_loss: 0.7238, test_loss: 0.8003, test_f1: 0.6047
 epoch: 41, train_loss: 0.7176, test_loss: 0.8067, test_f1: 0.6125
 epoch: 42, train_loss: 0.7202, test_loss: 0.8260, test_f1: 0.6005
 epoch: 43, train_loss: 0.7120, test_loss: 0.7736, test_f1: 0.6037
 epoch: 44, train_loss: 0.7002, test_loss: 0.8163, test_f1: 0.5736
 epoch: 45, train_loss: 0.7011, test_loss: 0.8035, test_f1: 0.6040
 epoch: 46, train_loss: 0.6844, test_loss: 0.8123, test_f1: 0.5899
 epoch: 47, train_loss: 0.6890, test_loss: 0.8086, test_f1: 0.5967
 epoch: 48, train_loss: 0.6781, test_loss: 0.8177, test_f1: 0.6126
 epoch: 49, train_loss: 0.6873, test_loss: 0.8074, test_f1: 0.6078
 epoch: 50, train_loss: 0.6725, test_loss: 0.8159, test_f1: 0.5834
 epoch: 51, train_loss: 0.6633, test_loss: 0.8181, test_f1: 0.6080
 epoch: 52, train_loss: 0.6589, test_loss: 0.7864, test_f1: 0.5999
 epoch: 53, train_loss: 0.6573, test_loss: 0.8016, test_f1: 0.6016
 epoch: 54, train_loss: 0.6636, test_loss: 0.8166, test_f1: 0.6146
 epoch: 55, train_loss: 0.6512, test_loss: 0.8071, test_f1: 0.6134
 epoch: 56, train_loss: 0.6449, test_loss: 0.8219, test_f1: 0.6038
 epoch: 57, train_loss: 0.6439, test_loss: 0.8024, test_f1: 0.5951
 epoch: 58, train_loss: 0.6473, test_loss: 0.8015, test_f1: 0.6155
 epoch: 59, train_loss: 0.6477, test_loss: 0.8033, test_f1: 0.5907
 epoch: 60, train_loss: 0.6470, test_loss: 0.8066, test_f1: 0.6004
 epoch: 61, train_loss: 0.6390, test_loss: 0.8157, test_f1: 0.6208
 epoch: 62, train_loss: 0.6435, test_loss: 0.8246, test_f1: 0.5953
 epoch: 63, train_loss: 0.6347, test_loss: 0.8170, test_f1: 0.6158
 epoch: 64, train_loss: 0.6287, test_loss: 0.8041, test_f1: 0.6040
 epoch: 65, train_loss: 0.6247, test_loss: 0.8048, test_f1: 0.6137
 epoch: 66, train_loss: 0.6279, test_loss: 0.8137, test_f1: 0.6139
 epoch: 67, train_loss: 0.6250, test_loss: 0.8138, test_f1: 0.6239
 epoch: 68, train_loss: 0.6202, test_loss: 0.8259, test_f1: 0.6050
 epoch: 69, train_loss: 0.6201, test_loss: 0.8379, test_f1: 0.6030
 epoch: 70, train_loss: 0.6264, test_loss: 0.8254, test_f1: 0.6236
 epoch: 71, train_loss: 0.6226, test_loss: 0.8282, test_f1: 0.6267
 epoch: 72, train_loss: 0.6227, test_loss: 0.8207, test_f1: 0.6195
 epoch: 73, train_loss: 0.6155, test_loss: 0.8227, test_f1: 0.6246
 epoch: 74, train_loss: 0.6116, test_loss: 0.8291, test_f1: 0.6184
 epoch: 75, train_loss: 0.6136, test_loss: 0.8357, test_f1: 0.6317
 epoch: 76, train_loss: 0.6100, test_loss: 0.8484, test_f1: 0.6259
 epoch: 77, train_loss: 0.6157, test_loss: 0.8523, test_f1: 0.6272
 epoch: 78, train_loss: 0.5960, test_loss: 0.8339, test_f1: 0.6240
 epoch: 79, train_loss: 0.6034, test_loss: 0.8468, test_f1: 0.6086
 epoch: 80, train_loss: 0.6001, test_loss: 0.8435, test_f1: 0.6348
 epoch: 81, train_loss: 0.6062, test_loss: 0.8382, test_f1: 0.6171
 epoch: 82, train_loss: 0.5985, test_loss: 0.8360, test_f1: 0.6378
 epoch: 83, train_loss: 0.5933, test_loss: 0.8435, test_f1: 0.6018
 epoch: 84, train_loss: 0.5881, test_loss: 0.8386, test_f1: 0.6541
 epoch: 85, train_loss: 0.5947, test_loss: 0.8556, test_f1: 0.6207
 epoch: 86, train_loss: 0.5885, test_loss: 0.8619, test_f1: 0.6240
 epoch: 87, train_loss: 0.5907, test_loss: 0.8422, test_f1: 0.6176
 epoch: 88, train_loss: 0.5893, test_loss: 0.8556, test_f1: 0.6197
 epoch: 89, train_loss: 0.5755, test_loss: 0.8410, test_f1: 0.6232
 epoch: 90, train_loss: 0.5777, test_loss: 0.8413, test_f1: 0.6255
 epoch: 91, train_loss: 0.5787, test_loss: 0.8867, test_f1: 0.6214
 epoch: 92, train_loss: 0.5701, test_loss: 0.8527, test_f1: 0.6251
 epoch: 93, train_loss: 0.5698, test_loss: 0.8475, test_f1: 0.6242
 epoch: 94, train_loss: 0.5790, test_loss: 0.8534, test_f1: 0.6129
 epoch: 95, train_loss: 0.5698, test_loss: 0.8588, test_f1: 0.6268
 epoch: 96, train_loss: 0.5657, test_loss: 0.8672, test_f1: 0.6193
 epoch: 97, train_loss: 0.5633, test_loss: 0.8617, test_f1: 0.6281
 epoch: 98, train_loss: 0.5673, test_loss: 0.8833, test_f1: 0.6264
 epoch: 99, train_loss: 0.5669, test_loss: 0.9055, test_f1: 0.6314
##################ITERATION #7 ****************************************
 epoch: 0, train_loss: 1.2121, test_loss: 1.3067, test_f1: 0.2270
 epoch: 1, train_loss: 1.0614, test_loss: 1.2817, test_f1: 0.2315
 epoch: 2, train_loss: 1.0315, test_loss: 1.2453, test_f1: 0.3290
 epoch: 3, train_loss: 0.9985, test_loss: 1.0867, test_f1: 0.4609
 epoch: 4, train_loss: 0.9929, test_loss: 1.0235, test_f1: 0.4632
 epoch: 5, train_loss: 0.9665, test_loss: 1.0039, test_f1: 0.4839
 epoch: 6, train_loss: 0.9526, test_loss: 0.9733, test_f1: 0.5081
 epoch: 7, train_loss: 0.9399, test_loss: 0.9366, test_f1: 0.5337
 epoch: 8, train_loss: 0.9288, test_loss: 0.9421, test_f1: 0.5472
 epoch: 9, train_loss: 0.9169, test_loss: 0.9144, test_f1: 0.5450
 epoch: 10, train_loss: 0.9102, test_loss: 0.9221, test_f1: 0.5467
 epoch: 11, train_loss: 0.9074, test_loss: 0.9250, test_f1: 0.5250
 epoch: 12, train_loss: 0.8960, test_loss: 0.9067, test_f1: 0.5485
 epoch: 13, train_loss: 0.8886, test_loss: 0.9083, test_f1: 0.5528
 epoch: 14, train_loss: 0.8727, test_loss: 0.9030, test_f1: 0.5463
 epoch: 15, train_loss: 0.8690, test_loss: 0.8895, test_f1: 0.5450
 epoch: 16, train_loss: 0.8533, test_loss: 0.8930, test_f1: 0.5455
 epoch: 17, train_loss: 0.8403, test_loss: 0.8902, test_f1: 0.5456
 epoch: 18, train_loss: 0.8461, test_loss: 0.8925, test_f1: 0.5477
 epoch: 19, train_loss: 0.8396, test_loss: 0.8808, test_f1: 0.5443
 epoch: 20, train_loss: 0.8268, test_loss: 0.9081, test_f1: 0.5442
 epoch: 21, train_loss: 0.8172, test_loss: 0.8750, test_f1: 0.5464
 epoch: 22, train_loss: 0.8182, test_loss: 0.8833, test_f1: 0.5391
 epoch: 23, train_loss: 0.8087, test_loss: 0.8723, test_f1: 0.5520
 epoch: 24, train_loss: 0.8061, test_loss: 0.8833, test_f1: 0.5467
 epoch: 25, train_loss: 0.7916, test_loss: 0.8697, test_f1: 0.5607
 epoch: 26, train_loss: 0.7840, test_loss: 0.8831, test_f1: 0.5345
 epoch: 27, train_loss: 0.7833, test_loss: 0.8632, test_f1: 0.5577
 epoch: 28, train_loss: 0.7706, test_loss: 0.8606, test_f1: 0.5524
 epoch: 29, train_loss: 0.7748, test_loss: 0.8702, test_f1: 0.5645
 epoch: 30, train_loss: 0.7770, test_loss: 0.8581, test_f1: 0.5728
 epoch: 31, train_loss: 0.7596, test_loss: 0.8552, test_f1: 0.5688
 epoch: 32, train_loss: 0.7643, test_loss: 0.8542, test_f1: 0.5638
 epoch: 33, train_loss: 0.7489, test_loss: 0.8547, test_f1: 0.5755
 epoch: 34, train_loss: 0.7444, test_loss: 0.8827, test_f1: 0.5711
 epoch: 35, train_loss: 0.7450, test_loss: 0.8242, test_f1: 0.5662
 epoch: 36, train_loss: 0.7307, test_loss: 0.8574, test_f1: 0.5742
 epoch: 37, train_loss: 0.7266, test_loss: 0.8618, test_f1: 0.5652
 epoch: 38, train_loss: 0.7270, test_loss: 0.8374, test_f1: 0.5757
 epoch: 39, train_loss: 0.7201, test_loss: 0.8472, test_f1: 0.5769
 epoch: 40, train_loss: 0.7162, test_loss: 0.8409, test_f1: 0.5772
 epoch: 41, train_loss: 0.7089, test_loss: 0.8365, test_f1: 0.5765
 epoch: 42, train_loss: 0.6976, test_loss: 0.8659, test_f1: 0.5834
 epoch: 43, train_loss: 0.6883, test_loss: 0.8529, test_f1: 0.5764
 epoch: 44, train_loss: 0.6906, test_loss: 0.8281, test_f1: 0.5728
 epoch: 45, train_loss: 0.6864, test_loss: 0.8704, test_f1: 0.5781
 epoch: 46, train_loss: 0.6802, test_loss: 0.8539, test_f1: 0.5807
 epoch: 47, train_loss: 0.6778, test_loss: 0.8551, test_f1: 0.5828
 epoch: 48, train_loss: 0.6771, test_loss: 0.8598, test_f1: 0.5806
 epoch: 49, train_loss: 0.6702, test_loss: 0.8470, test_f1: 0.5936
 epoch: 50, train_loss: 0.6694, test_loss: 0.8404, test_f1: 0.5696
 epoch: 51, train_loss: 0.6580, test_loss: 0.8567, test_f1: 0.6133
 epoch: 52, train_loss: 0.6529, test_loss: 0.8568, test_f1: 0.5794
 epoch: 53, train_loss: 0.6502, test_loss: 0.8402, test_f1: 0.5917
 epoch: 54, train_loss: 0.6456, test_loss: 0.8423, test_f1: 0.5871
 epoch: 55, train_loss: 0.6418, test_loss: 0.8495, test_f1: 0.5997
 epoch: 56, train_loss: 0.6458, test_loss: 0.8363, test_f1: 0.5922
 epoch: 57, train_loss: 0.6439, test_loss: 0.8525, test_f1: 0.6054
 epoch: 58, train_loss: 0.6359, test_loss: 0.8569, test_f1: 0.6108
 epoch: 59, train_loss: 0.6416, test_loss: 0.8583, test_f1: 0.6147
 epoch: 60, train_loss: 0.6420, test_loss: 0.8529, test_f1: 0.5912
 epoch: 61, train_loss: 0.6396, test_loss: 0.8675, test_f1: 0.6159
 epoch: 62, train_loss: 0.6297, test_loss: 0.8620, test_f1: 0.6113
 epoch: 63, train_loss: 0.6304, test_loss: 0.8611, test_f1: 0.5987
 epoch: 64, train_loss: 0.6249, test_loss: 0.8579, test_f1: 0.5870
 epoch: 65, train_loss: 0.6181, test_loss: 0.8619, test_f1: 0.6090
 epoch: 66, train_loss: 0.6192, test_loss: 0.8486, test_f1: 0.5957
 epoch: 67, train_loss: 0.6163, test_loss: 0.8442, test_f1: 0.6239
 epoch: 68, train_loss: 0.6217, test_loss: 0.8752, test_f1: 0.6167
 epoch: 69, train_loss: 0.6117, test_loss: 0.8976, test_f1: 0.6234
 epoch: 70, train_loss: 0.6054, test_loss: 0.8881, test_f1: 0.6041
 epoch: 71, train_loss: 0.5959, test_loss: 0.8679, test_f1: 0.6133
 epoch: 72, train_loss: 0.6092, test_loss: 0.8520, test_f1: 0.6352
 epoch: 73, train_loss: 0.6086, test_loss: 0.8793, test_f1: 0.6200
 epoch: 74, train_loss: 0.5969, test_loss: 0.8760, test_f1: 0.6313
 epoch: 75, train_loss: 0.6075, test_loss: 0.8947, test_f1: 0.6394
 epoch: 76, train_loss: 0.6015, test_loss: 0.8953, test_f1: 0.6216
 epoch: 77, train_loss: 0.5952, test_loss: 0.9167, test_f1: 0.6135
 epoch: 78, train_loss: 0.5917, test_loss: 0.8927, test_f1: 0.6050
 epoch: 79, train_loss: 0.5938, test_loss: 0.8888, test_f1: 0.6110
 epoch: 80, train_loss: 0.5893, test_loss: 0.8982, test_f1: 0.6195
 epoch: 81, train_loss: 0.5889, test_loss: 0.8777, test_f1: 0.6272
 epoch: 82, train_loss: 0.5797, test_loss: 0.8875, test_f1: 0.6355
 epoch: 83, train_loss: 0.5807, test_loss: 0.9081, test_f1: 0.6224
 epoch: 84, train_loss: 0.5953, test_loss: 0.8752, test_f1: 0.6216
 epoch: 85, train_loss: 0.5789, test_loss: 0.9083, test_f1: 0.6154
 epoch: 86, train_loss: 0.5723, test_loss: 0.8739, test_f1: 0.6368
 epoch: 87, train_loss: 0.5846, test_loss: 0.8843, test_f1: 0.6436
 epoch: 88, train_loss: 0.5715, test_loss: 0.9080, test_f1: 0.6249
 epoch: 89, train_loss: 0.5680, test_loss: 0.9020, test_f1: 0.6270
 epoch: 90, train_loss: 0.5688, test_loss: 0.8784, test_f1: 0.6438
 epoch: 91, train_loss: 0.5768, test_loss: 0.9114, test_f1: 0.6292
 epoch: 92, train_loss: 0.5626, test_loss: 0.8810, test_f1: 0.6501
 epoch: 93, train_loss: 0.5619, test_loss: 0.8872, test_f1: 0.6416
 epoch: 94, train_loss: 0.5651, test_loss: 0.9060, test_f1: 0.6411
 epoch: 95, train_loss: 0.5597, test_loss: 0.9056, test_f1: 0.6413
 epoch: 96, train_loss: 0.5615, test_loss: 0.9049, test_f1: 0.6360
 epoch: 97, train_loss: 0.5667, test_loss: 0.9020, test_f1: 0.6306
 epoch: 98, train_loss: 0.5479, test_loss: 0.9052, test_f1: 0.6413
 epoch: 99, train_loss: 0.5489, test_loss: 0.9450, test_f1: 0.6543
##################ITERATION #8 ****************************************
 epoch: 0, train_loss: 1.2517, test_loss: 1.2974, test_f1: 0.2270
 epoch: 1, train_loss: 1.0915, test_loss: 1.2683, test_f1: 0.2270
 epoch: 2, train_loss: 1.0388, test_loss: 1.2165, test_f1: 0.2270
 epoch: 3, train_loss: 1.0175, test_loss: 1.1479, test_f1: 0.2917
 epoch: 4, train_loss: 0.9919, test_loss: 1.0273, test_f1: 0.4463
 epoch: 5, train_loss: 0.9782, test_loss: 0.9772, test_f1: 0.5013
 epoch: 6, train_loss: 0.9575, test_loss: 0.9642, test_f1: 0.5206
 epoch: 7, train_loss: 0.9405, test_loss: 0.9582, test_f1: 0.5154
 epoch: 8, train_loss: 0.9436, test_loss: 0.9436, test_f1: 0.5181
 epoch: 9, train_loss: 0.9247, test_loss: 0.9510, test_f1: 0.5188
 epoch: 10, train_loss: 0.9076, test_loss: 0.9418, test_f1: 0.5237
 epoch: 11, train_loss: 0.9042, test_loss: 0.9269, test_f1: 0.5146
 epoch: 12, train_loss: 0.9030, test_loss: 0.9279, test_f1: 0.5158
 epoch: 13, train_loss: 0.8935, test_loss: 0.9178, test_f1: 0.5362
 epoch: 14, train_loss: 0.8781, test_loss: 0.9206, test_f1: 0.5281
 epoch: 15, train_loss: 0.8745, test_loss: 0.9146, test_f1: 0.5283
 epoch: 16, train_loss: 0.8631, test_loss: 0.9064, test_f1: 0.5340
 epoch: 17, train_loss: 0.8572, test_loss: 0.9026, test_f1: 0.5416
 epoch: 18, train_loss: 0.8547, test_loss: 0.8901, test_f1: 0.5320
 epoch: 19, train_loss: 0.8407, test_loss: 0.8893, test_f1: 0.5427
 epoch: 20, train_loss: 0.8309, test_loss: 0.8912, test_f1: 0.5284
 epoch: 21, train_loss: 0.8227, test_loss: 0.8799, test_f1: 0.5577
 epoch: 22, train_loss: 0.8212, test_loss: 0.8748, test_f1: 0.5330
 epoch: 23, train_loss: 0.8151, test_loss: 0.8685, test_f1: 0.5521
 epoch: 24, train_loss: 0.7978, test_loss: 0.8751, test_f1: 0.5416
 epoch: 25, train_loss: 0.7873, test_loss: 0.8708, test_f1: 0.5564
 epoch: 26, train_loss: 0.7803, test_loss: 0.8674, test_f1: 0.5591
 epoch: 27, train_loss: 0.7737, test_loss: 0.8914, test_f1: 0.5463
 epoch: 28, train_loss: 0.7743, test_loss: 0.8790, test_f1: 0.5421
 epoch: 29, train_loss: 0.7701, test_loss: 0.8753, test_f1: 0.5695
 epoch: 30, train_loss: 0.7590, test_loss: 0.8663, test_f1: 0.5688
 epoch: 31, train_loss: 0.7653, test_loss: 0.8654, test_f1: 0.5728
 epoch: 32, train_loss: 0.7477, test_loss: 0.8580, test_f1: 0.5709
 epoch: 33, train_loss: 0.7478, test_loss: 0.8579, test_f1: 0.5611
 epoch: 34, train_loss: 0.7427, test_loss: 0.8576, test_f1: 0.5492
 epoch: 35, train_loss: 0.7319, test_loss: 0.8645, test_f1: 0.5714
 epoch: 36, train_loss: 0.7333, test_loss: 0.8519, test_f1: 0.5636
 epoch: 37, train_loss: 0.7285, test_loss: 0.8564, test_f1: 0.5674
 epoch: 38, train_loss: 0.7248, test_loss: 0.8343, test_f1: 0.5791
 epoch: 39, train_loss: 0.7121, test_loss: 0.8653, test_f1: 0.5672
 epoch: 40, train_loss: 0.7086, test_loss: 0.8387, test_f1: 0.5760
 epoch: 41, train_loss: 0.7052, test_loss: 0.8401, test_f1: 0.5749
 epoch: 42, train_loss: 0.6998, test_loss: 0.8263, test_f1: 0.5752
 epoch: 43, train_loss: 0.6989, test_loss: 0.8388, test_f1: 0.5753
 epoch: 44, train_loss: 0.6821, test_loss: 0.8542, test_f1: 0.5756
 epoch: 45, train_loss: 0.6868, test_loss: 0.8390, test_f1: 0.5712
 epoch: 46, train_loss: 0.6754, test_loss: 0.8170, test_f1: 0.5861
 epoch: 47, train_loss: 0.6699, test_loss: 0.8133, test_f1: 0.5628
 epoch: 48, train_loss: 0.6718, test_loss: 0.8308, test_f1: 0.5767
 epoch: 49, train_loss: 0.6596, test_loss: 0.8354, test_f1: 0.5724
 epoch: 50, train_loss: 0.6636, test_loss: 0.8367, test_f1: 0.5850
 epoch: 51, train_loss: 0.6560, test_loss: 0.8315, test_f1: 0.5877
 epoch: 52, train_loss: 0.6517, test_loss: 0.8206, test_f1: 0.5889
 epoch: 53, train_loss: 0.6501, test_loss: 0.8332, test_f1: 0.5801
 epoch: 54, train_loss: 0.6500, test_loss: 0.8358, test_f1: 0.6077
 epoch: 55, train_loss: 0.6392, test_loss: 0.8501, test_f1: 0.5934
 epoch: 56, train_loss: 0.6497, test_loss: 0.8430, test_f1: 0.5968
 epoch: 57, train_loss: 0.6327, test_loss: 0.8395, test_f1: 0.5837
 epoch: 58, train_loss: 0.6440, test_loss: 0.8349, test_f1: 0.5802
 epoch: 59, train_loss: 0.6254, test_loss: 0.8375, test_f1: 0.5962
 epoch: 60, train_loss: 0.6276, test_loss: 0.8406, test_f1: 0.6114
 epoch: 61, train_loss: 0.6341, test_loss: 0.8334, test_f1: 0.6096
 epoch: 62, train_loss: 0.6326, test_loss: 0.8429, test_f1: 0.6062
 epoch: 63, train_loss: 0.6219, test_loss: 0.8526, test_f1: 0.5750
 epoch: 64, train_loss: 0.6147, test_loss: 0.8549, test_f1: 0.6086
 epoch: 65, train_loss: 0.6079, test_loss: 0.8451, test_f1: 0.6331
 epoch: 66, train_loss: 0.6249, test_loss: 0.8391, test_f1: 0.6266
 epoch: 67, train_loss: 0.6083, test_loss: 0.8496, test_f1: 0.5908
 epoch: 68, train_loss: 0.6150, test_loss: 0.8437, test_f1: 0.6190
 epoch: 69, train_loss: 0.5980, test_loss: 0.8326, test_f1: 0.6074
 epoch: 70, train_loss: 0.6161, test_loss: 0.8352, test_f1: 0.6103
 epoch: 71, train_loss: 0.6056, test_loss: 0.8470, test_f1: 0.6223
 epoch: 72, train_loss: 0.5917, test_loss: 0.8744, test_f1: 0.6173
 epoch: 73, train_loss: 0.5893, test_loss: 0.8420, test_f1: 0.6308
 epoch: 74, train_loss: 0.5819, test_loss: 0.8601, test_f1: 0.6203
 epoch: 75, train_loss: 0.5988, test_loss: 0.8479, test_f1: 0.6205
 epoch: 76, train_loss: 0.5861, test_loss: 0.8534, test_f1: 0.6181
 epoch: 77, train_loss: 0.5861, test_loss: 0.8279, test_f1: 0.6316
 epoch: 78, train_loss: 0.5834, test_loss: 0.8623, test_f1: 0.6268
 epoch: 79, train_loss: 0.5826, test_loss: 0.8585, test_f1: 0.6426
 epoch: 80, train_loss: 0.5770, test_loss: 0.8773, test_f1: 0.6309
 epoch: 81, train_loss: 0.5720, test_loss: 0.8859, test_f1: 0.6306
 epoch: 82, train_loss: 0.5684, test_loss: 0.8748, test_f1: 0.6304
 epoch: 83, train_loss: 0.5691, test_loss: 0.9287, test_f1: 0.6017
 epoch: 84, train_loss: 0.5840, test_loss: 0.8630, test_f1: 0.6238
 epoch: 85, train_loss: 0.5668, test_loss: 0.8540, test_f1: 0.6260
 epoch: 86, train_loss: 0.5762, test_loss: 0.8764, test_f1: 0.6304
 epoch: 87, train_loss: 0.5698, test_loss: 0.9030, test_f1: 0.6023
 epoch: 88, train_loss: 0.5660, test_loss: 0.8869, test_f1: 0.6219
 epoch: 89, train_loss: 0.5603, test_loss: 0.9176, test_f1: 0.6231
 epoch: 90, train_loss: 0.5566, test_loss: 0.8881, test_f1: 0.6312
 epoch: 91, train_loss: 0.5578, test_loss: 0.8975, test_f1: 0.6204
 epoch: 92, train_loss: 0.5640, test_loss: 0.9038, test_f1: 0.6252
 epoch: 93, train_loss: 0.5503, test_loss: 0.8756, test_f1: 0.6333
 epoch: 94, train_loss: 0.5546, test_loss: 0.8742, test_f1: 0.6241
 epoch: 95, train_loss: 0.5421, test_loss: 0.9050, test_f1: 0.6144
 epoch: 96, train_loss: 0.5537, test_loss: 0.9209, test_f1: 0.6169
 epoch: 97, train_loss: 0.5466, test_loss: 0.9106, test_f1: 0.6033
 epoch: 98, train_loss: 0.5427, test_loss: 0.9101, test_f1: 0.6198
 epoch: 99, train_loss: 0.5330, test_loss: 0.9400, test_f1: 0.6266
##################ITERATION #9 ****************************************
 epoch: 0, train_loss: 1.2660, test_loss: 1.2893, test_f1: 0.2270
 epoch: 1, train_loss: 1.0887, test_loss: 1.2448, test_f1: 0.2270
 epoch: 2, train_loss: 1.0609, test_loss: 1.1685, test_f1: 0.2953
 epoch: 3, train_loss: 1.0256, test_loss: 1.0551, test_f1: 0.4435
 epoch: 4, train_loss: 0.9872, test_loss: 0.9989, test_f1: 0.5036
 epoch: 5, train_loss: 0.9843, test_loss: 0.9595, test_f1: 0.5235
 epoch: 6, train_loss: 0.9730, test_loss: 0.9348, test_f1: 0.5309
 epoch: 7, train_loss: 0.9444, test_loss: 0.9108, test_f1: 0.5324
 epoch: 8, train_loss: 0.9365, test_loss: 0.9074, test_f1: 0.5379
 epoch: 9, train_loss: 0.9251, test_loss: 0.8930, test_f1: 0.5424
 epoch: 10, train_loss: 0.9094, test_loss: 0.8965, test_f1: 0.5332
 epoch: 11, train_loss: 0.9082, test_loss: 0.8926, test_f1: 0.5311
 epoch: 12, train_loss: 0.9038, test_loss: 0.8850, test_f1: 0.5434
 epoch: 13, train_loss: 0.8858, test_loss: 0.8778, test_f1: 0.5418
 epoch: 14, train_loss: 0.8730, test_loss: 0.8767, test_f1: 0.5476
 epoch: 15, train_loss: 0.8599, test_loss: 0.8702, test_f1: 0.5491
 epoch: 16, train_loss: 0.8553, test_loss: 0.8510, test_f1: 0.5476
 epoch: 17, train_loss: 0.8507, test_loss: 0.8595, test_f1: 0.5496
 epoch: 18, train_loss: 0.8359, test_loss: 0.8587, test_f1: 0.5563
 epoch: 19, train_loss: 0.8308, test_loss: 0.8739, test_f1: 0.5619
 epoch: 20, train_loss: 0.8314, test_loss: 0.8519, test_f1: 0.5572
 epoch: 21, train_loss: 0.8157, test_loss: 0.8327, test_f1: 0.5523
 epoch: 22, train_loss: 0.8147, test_loss: 0.8536, test_f1: 0.5631
 epoch: 23, train_loss: 0.8068, test_loss: 0.8379, test_f1: 0.5466
 epoch: 24, train_loss: 0.8025, test_loss: 0.8279, test_f1: 0.5771
 epoch: 25, train_loss: 0.7902, test_loss: 0.8315, test_f1: 0.5668
 epoch: 26, train_loss: 0.7772, test_loss: 0.8273, test_f1: 0.5720
 epoch: 27, train_loss: 0.7774, test_loss: 0.8305, test_f1: 0.5696
 epoch: 28, train_loss: 0.7697, test_loss: 0.8191, test_f1: 0.5771
 epoch: 29, train_loss: 0.7578, test_loss: 0.8331, test_f1: 0.5814
 epoch: 30, train_loss: 0.7636, test_loss: 0.8192, test_f1: 0.5861
 epoch: 31, train_loss: 0.7506, test_loss: 0.8507, test_f1: 0.5516
 epoch: 32, train_loss: 0.7557, test_loss: 0.8333, test_f1: 0.5785
 epoch: 33, train_loss: 0.7396, test_loss: 0.8029, test_f1: 0.5808
 epoch: 34, train_loss: 0.7270, test_loss: 0.8273, test_f1: 0.5824
 epoch: 35, train_loss: 0.7382, test_loss: 0.8074, test_f1: 0.5950
 epoch: 36, train_loss: 0.7276, test_loss: 0.8186, test_f1: 0.6029
 epoch: 37, train_loss: 0.7208, test_loss: 0.8099, test_f1: 0.5899
 epoch: 38, train_loss: 0.7084, test_loss: 0.8210, test_f1: 0.5946
 epoch: 39, train_loss: 0.7133, test_loss: 0.7907, test_f1: 0.5936
 epoch: 40, train_loss: 0.6996, test_loss: 0.8276, test_f1: 0.5928
 epoch: 41, train_loss: 0.7085, test_loss: 0.8091, test_f1: 0.5939
 epoch: 42, train_loss: 0.6865, test_loss: 0.8203, test_f1: 0.6297
 epoch: 43, train_loss: 0.6939, test_loss: 0.8414, test_f1: 0.5995
 epoch: 44, train_loss: 0.6802, test_loss: 0.8139, test_f1: 0.6264
 epoch: 45, train_loss: 0.6807, test_loss: 0.8506, test_f1: 0.6218
 epoch: 46, train_loss: 0.6722, test_loss: 0.8182, test_f1: 0.6128
 epoch: 47, train_loss: 0.6625, test_loss: 0.8119, test_f1: 0.6168
 epoch: 48, train_loss: 0.6624, test_loss: 0.8320, test_f1: 0.6336
 epoch: 49, train_loss: 0.6639, test_loss: 0.8346, test_f1: 0.6248
 epoch: 50, train_loss: 0.6533, test_loss: 0.8426, test_f1: 0.6121
 epoch: 51, train_loss: 0.6407, test_loss: 0.8271, test_f1: 0.6235
 epoch: 52, train_loss: 0.6410, test_loss: 0.8340, test_f1: 0.6162
 epoch: 53, train_loss: 0.6383, test_loss: 0.8372, test_f1: 0.6111
 epoch: 54, train_loss: 0.6333, test_loss: 0.8345, test_f1: 0.6238
 epoch: 55, train_loss: 0.6340, test_loss: 0.8124, test_f1: 0.6199
 epoch: 56, train_loss: 0.6221, test_loss: 0.8308, test_f1: 0.6262
 epoch: 57, train_loss: 0.6362, test_loss: 0.8264, test_f1: 0.6281
 epoch: 58, train_loss: 0.6287, test_loss: 0.8395, test_f1: 0.6175
 epoch: 59, train_loss: 0.6215, test_loss: 0.8280, test_f1: 0.6378
 epoch: 60, train_loss: 0.6169, test_loss: 0.8317, test_f1: 0.6173
 epoch: 61, train_loss: 0.6220, test_loss: 0.8416, test_f1: 0.6358
 epoch: 62, train_loss: 0.6202, test_loss: 0.8377, test_f1: 0.6166
 epoch: 63, train_loss: 0.6217, test_loss: 0.8452, test_f1: 0.6198
 epoch: 64, train_loss: 0.6084, test_loss: 0.8447, test_f1: 0.6335
 epoch: 65, train_loss: 0.6048, test_loss: 0.8604, test_f1: 0.6155
 epoch: 66, train_loss: 0.6024, test_loss: 0.8273, test_f1: 0.6363
 epoch: 67, train_loss: 0.6032, test_loss: 0.8478, test_f1: 0.6251
 epoch: 68, train_loss: 0.5962, test_loss: 0.8185, test_f1: 0.6348
 epoch: 69, train_loss: 0.6003, test_loss: 0.8409, test_f1: 0.6203
 epoch: 70, train_loss: 0.5899, test_loss: 0.8260, test_f1: 0.6376
 epoch: 71, train_loss: 0.5867, test_loss: 0.8405, test_f1: 0.6282
 epoch: 72, train_loss: 0.5986, test_loss: 0.8372, test_f1: 0.6368
 epoch: 73, train_loss: 0.5999, test_loss: 0.8592, test_f1: 0.6323
 epoch: 74, train_loss: 0.5977, test_loss: 0.8691, test_f1: 0.6286
 epoch: 75, train_loss: 0.5904, test_loss: 0.8550, test_f1: 0.6336
 epoch: 76, train_loss: 0.5820, test_loss: 0.8530, test_f1: 0.6275
 epoch: 77, train_loss: 0.5844, test_loss: 0.8466, test_f1: 0.6441
 epoch: 78, train_loss: 0.5824, test_loss: 0.8595, test_f1: 0.6253
 epoch: 79, train_loss: 0.5887, test_loss: 0.8660, test_f1: 0.6308
 epoch: 80, train_loss: 0.5829, test_loss: 0.8521, test_f1: 0.6447
 epoch: 81, train_loss: 0.5788, test_loss: 0.8611, test_f1: 0.6300
 epoch: 82, train_loss: 0.5814, test_loss: 0.8733, test_f1: 0.6367
 epoch: 83, train_loss: 0.5655, test_loss: 0.8919, test_f1: 0.6479
 epoch: 84, train_loss: 0.5829, test_loss: 0.8727, test_f1: 0.6410
 epoch: 85, train_loss: 0.5794, test_loss: 0.9022, test_f1: 0.6356
 epoch: 86, train_loss: 0.5661, test_loss: 0.8779, test_f1: 0.6346
 epoch: 87, train_loss: 0.5691, test_loss: 0.8868, test_f1: 0.6273
 epoch: 88, train_loss: 0.5723, test_loss: 0.8761, test_f1: 0.6341
 epoch: 89, train_loss: 0.5617, test_loss: 0.8784, test_f1: 0.6409
 epoch: 90, train_loss: 0.5530, test_loss: 0.8934, test_f1: 0.6240
 epoch: 91, train_loss: 0.5568, test_loss: 0.8745, test_f1: 0.6295
 epoch: 92, train_loss: 0.5660, test_loss: 0.9075, test_f1: 0.6344
 epoch: 93, train_loss: 0.5637, test_loss: 0.9071, test_f1: 0.6358
 epoch: 94, train_loss: 0.5569, test_loss: 0.9007, test_f1: 0.6337
 epoch: 95, train_loss: 0.5568, test_loss: 0.9135, test_f1: 0.6331
 epoch: 96, train_loss: 0.5498, test_loss: 0.8885, test_f1: 0.6353
 epoch: 97, train_loss: 0.5474, test_loss: 0.9035, test_f1: 0.6286
 epoch: 98, train_loss: 0.5503, test_loss: 0.8974, test_f1: 0.6410
 epoch: 99, train_loss: 0.5434, test_loss: 0.9217, test_f1: 0.6258

Training completed in 460.29 seconds
Best F1: 0.6616 at epoch 93
Mean F1 across iterations: 0.6351  0.0239
========================FINAL RESULTS================================
FEGIN weighted F1: 0.6616  0.0239
python main.py --data ltspice_examples --representation component_pin_net --model FEGIN --layers 3 --hiddens 128 --batch_size 256 --lr 0.0001 --emb_size 128 --epochs 100 --save_appendix component_pin_net_L3_H128_BS256_LR0.0001_E128 --no_val
-----



STDERR:
  File "main.py", line 370, in <module>
    main()
  File "main.py", line 254, in main
    dataset = dataset_class(
  File "/home/philip/projects/ltspice_examples_code_repo/Circuit-Completion-Using-GNNs/component_classification_with_link_prediction_head/evaluation/FEGIN/kernel/circuit_datasets.py", line 15, in __init__
    self.data, self.slices = torch.load(self.processed_paths[0])
  File "/home/philip/.local/lib/python3.8/site-packages/torch/serialization.py", line 1040, in load
    warnings.warn(
  File "/usr/lib/python3.8/warnings.py", line 109, in _showwarnmsg
    sw(msg.message, msg.category, msg.filename, msg.lineno,
  File "main.py", line 47, in warn_with_traceback
    traceback.print_stack(file=log)
/home/philip/projects/ltspice_examples_code_repo/Circuit-Completion-Using-GNNs/component_classification_with_link_prediction_head/evaluation/FEGIN/kernel/circuit_datasets.py:15: FutureWarning: You are using `torch.load` with `weights_only=False` (the current default value), which uses the default pickle module implicitly. It is possible to construct malicious pickle data which will execute arbitrary code during unpickling (See https://github.com/pytorch/pytorch/blob/main/SECURITY.md#untrusted-models for more details). In a future release, the default value for `weights_only` will be flipped to `True`. This limits the functions that could be executed during unpickling. Arbitrary objects will no longer be allowed to be loaded via this mode unless they are explicitly allowlisted by the user via `torch.serialization.add_safe_globals`. We recommend you start setting `weights_only=True` for any use case where you don't have full control of the loaded file. Please open an issue on GitHub for any issues related to this experimental feature.
  self.data, self.slices = torch.load(self.processed_paths[0])
