STDOUT:
Results will be saved in /home/philip/projects/ltspice_examples_code_repo/Circuit-Completion-Using-GNNs/component_classification_with_link_prediction_head/evaluation/FEGIN/results/model_FEGIN_dataset_ltspice_demos
Command line input: python main.py --data ltspice_demos --representation component_component --model FEGIN --layers 2 --hiddens 16 --batch_size 128 --lr 0.1 --emb_size 128 --epochs 100 --save_appendix component_component_L2_H16_BS128_LR0.1_E128 --no_val
 is saved.
-----
ltspice_demos - FEGIN
Using 2 layers, 16 hidden units, h = 2
Loading component_component representation dataset
ENTERED
Training FEGIN on component_component representation
Train: 1565, Test: 383
##################ITERATION #0 ****************************************
 epoch: 0, train_loss: 1.3006, test_loss: 1.3096, test_f1: 0.2281
 epoch: 1, train_loss: 1.2574, test_loss: 1.2899, test_f1: 0.2285
 epoch: 2, train_loss: 1.2285, test_loss: 1.2348, test_f1: 0.3004
 epoch: 3, train_loss: 1.2432, test_loss: 1.5015, test_f1: 0.2687
 epoch: 4, train_loss: 1.1815, test_loss: 1.3689, test_f1: 0.2281
 epoch: 5, train_loss: 1.1332, test_loss: 1.3126, test_f1: 0.2673
 epoch: 6, train_loss: 1.1092, test_loss: 1.2385, test_f1: 0.3448
 epoch: 7, train_loss: 1.0878, test_loss: 4.5653, test_f1: 0.2231
 epoch: 8, train_loss: 1.1365, test_loss: 1.2667, test_f1: 0.4319
 epoch: 9, train_loss: 1.0814, test_loss: 1.3436, test_f1: 0.2404
 epoch: 10, train_loss: 1.0742, test_loss: 1.2191, test_f1: 0.4020
 epoch: 11, train_loss: 1.0899, test_loss: 1.1646, test_f1: 0.3286
 epoch: 12, train_loss: 1.0799, test_loss: 1.1912, test_f1: 0.3240
 epoch: 13, train_loss: 1.0680, test_loss: 1.1714, test_f1: 0.3324
 epoch: 14, train_loss: 1.0667, test_loss: 1.1574, test_f1: 0.3235
 epoch: 15, train_loss: 1.0627, test_loss: 1.2105, test_f1: 0.3107
 epoch: 16, train_loss: 1.0576, test_loss: 1.1735, test_f1: 0.4432
 epoch: 17, train_loss: 1.0891, test_loss: 1.1427, test_f1: 0.3255
 epoch: 18, train_loss: 1.0439, test_loss: 1.1225, test_f1: 0.3195
 epoch: 19, train_loss: 1.0316, test_loss: 1.1595, test_f1: 0.3300
 epoch: 20, train_loss: 1.0292, test_loss: 1.2036, test_f1: 0.3071
 epoch: 21, train_loss: 1.0329, test_loss: 1.1673, test_f1: 0.4477
 epoch: 22, train_loss: 1.0513, test_loss: 1.1072, test_f1: 0.3271
 epoch: 23, train_loss: 1.0296, test_loss: 1.1365, test_f1: 0.3756
 epoch: 24, train_loss: 1.0238, test_loss: 1.2584, test_f1: 0.3000
 epoch: 25, train_loss: 1.0457, test_loss: 1.2274, test_f1: 0.4247
 epoch: 26, train_loss: 1.0165, test_loss: 1.1704, test_f1: 0.3314
 epoch: 27, train_loss: 0.9910, test_loss: 1.1608, test_f1: 0.3775
 epoch: 28, train_loss: 0.9813, test_loss: 1.2070, test_f1: 0.3404
 epoch: 29, train_loss: 1.0054, test_loss: 1.0706, test_f1: 0.4224
 epoch: 30, train_loss: 1.0148, test_loss: 1.2297, test_f1: 0.3888
 epoch: 31, train_loss: 1.0294, test_loss: 1.2892, test_f1: 0.3279
 epoch: 32, train_loss: 1.0578, test_loss: 1.2802, test_f1: 0.3327
 epoch: 33, train_loss: 1.0290, test_loss: 1.1768, test_f1: 0.4449
 epoch: 34, train_loss: 1.0185, test_loss: 1.2055, test_f1: 0.3340
 epoch: 35, train_loss: 1.0582, test_loss: 1.1983, test_f1: 0.3341
 epoch: 36, train_loss: 0.9975, test_loss: 1.3132, test_f1: 0.4499
 epoch: 37, train_loss: 0.9882, test_loss: 1.1377, test_f1: 0.4168
 epoch: 38, train_loss: 1.0071, test_loss: 1.2903, test_f1: 0.2607
 epoch: 39, train_loss: 1.0188, test_loss: 1.6545, test_f1: 0.2013
 epoch: 40, train_loss: 1.0455, test_loss: 1.3521, test_f1: 0.3014
 epoch: 41, train_loss: 1.0962, test_loss: 1.4622, test_f1: 0.3239
 epoch: 42, train_loss: 1.0456, test_loss: 1.1660, test_f1: 0.4783
 epoch: 43, train_loss: 1.0066, test_loss: 1.1571, test_f1: 0.4973
 epoch: 44, train_loss: 0.9832, test_loss: 1.1258, test_f1: 0.5217
 epoch: 45, train_loss: 0.9812, test_loss: 1.0493, test_f1: 0.5295
 epoch: 46, train_loss: 0.9866, test_loss: 1.3022, test_f1: 0.3389
 epoch: 47, train_loss: 1.1070, test_loss: 1.1641, test_f1: 0.4206
 epoch: 48, train_loss: 1.0950, test_loss: 1.2518, test_f1: 0.4970
 epoch: 49, train_loss: 1.0355, test_loss: 1.1799, test_f1: 0.3617
 epoch: 50, train_loss: 1.0125, test_loss: 1.2271, test_f1: 0.3202
 epoch: 51, train_loss: 0.9824, test_loss: 1.0780, test_f1: 0.4189
 epoch: 52, train_loss: 1.0041, test_loss: 1.0728, test_f1: 0.4189
 epoch: 53, train_loss: 0.9856, test_loss: 1.0603, test_f1: 0.5221
 epoch: 54, train_loss: 0.9773, test_loss: 1.1253, test_f1: 0.3920
 epoch: 55, train_loss: 0.9482, test_loss: 1.0297, test_f1: 0.5457
 epoch: 56, train_loss: 0.9466, test_loss: 1.0504, test_f1: 0.4570
 epoch: 57, train_loss: 0.9278, test_loss: 1.0406, test_f1: 0.4276
 epoch: 58, train_loss: 0.9270, test_loss: 1.0232, test_f1: 0.5307
 epoch: 59, train_loss: 0.9116, test_loss: 1.0097, test_f1: 0.5169
 epoch: 60, train_loss: 0.9153, test_loss: 1.0372, test_f1: 0.5759
 epoch: 61, train_loss: 0.9016, test_loss: 1.0608, test_f1: 0.4696
 epoch: 62, train_loss: 0.9465, test_loss: 1.0701, test_f1: 0.4894
 epoch: 63, train_loss: 0.9264, test_loss: 1.0765, test_f1: 0.4108
 epoch: 64, train_loss: 0.9117, test_loss: 1.0665, test_f1: 0.5423
 epoch: 65, train_loss: 0.9027, test_loss: 1.0562, test_f1: 0.5214
 epoch: 66, train_loss: 0.9101, test_loss: 1.0544, test_f1: 0.4232
 epoch: 67, train_loss: 0.9075, test_loss: 1.0662, test_f1: 0.5370
 epoch: 68, train_loss: 0.9176, test_loss: 1.0410, test_f1: 0.5348
 epoch: 69, train_loss: 0.9060, test_loss: 1.0453, test_f1: 0.4244
 epoch: 70, train_loss: 0.8878, test_loss: 1.0488, test_f1: 0.5500
 epoch: 71, train_loss: 0.9052, test_loss: 1.0656, test_f1: 0.5498
 epoch: 72, train_loss: 0.8972, test_loss: 1.1014, test_f1: 0.4361
 epoch: 73, train_loss: 0.9277, test_loss: 1.0737, test_f1: 0.5286
 epoch: 74, train_loss: 0.9047, test_loss: 1.0406, test_f1: 0.5132
 epoch: 75, train_loss: 0.9037, test_loss: 0.9789, test_f1: 0.4366
 epoch: 76, train_loss: 0.8955, test_loss: 1.0084, test_f1: 0.5592
 epoch: 77, train_loss: 0.8921, test_loss: 1.0206, test_f1: 0.4260
 epoch: 78, train_loss: 0.8939, test_loss: 1.0379, test_f1: 0.5187
 epoch: 79, train_loss: 0.8879, test_loss: 0.9815, test_f1: 0.4384
 epoch: 80, train_loss: 0.8917, test_loss: 1.2801, test_f1: 0.4030
 epoch: 81, train_loss: 0.9407, test_loss: 1.2802, test_f1: 0.4525
 epoch: 82, train_loss: 0.9233, test_loss: 1.0536, test_f1: 0.4178
 epoch: 83, train_loss: 0.9178, test_loss: 1.0664, test_f1: 0.5087
 epoch: 84, train_loss: 0.9168, test_loss: 1.0262, test_f1: 0.5515
 epoch: 85, train_loss: 0.9047, test_loss: 1.0128, test_f1: 0.4306
 epoch: 86, train_loss: 0.9030, test_loss: 0.9966, test_f1: 0.5463
 epoch: 87, train_loss: 0.9047, test_loss: 0.9837, test_f1: 0.5556
 epoch: 88, train_loss: 0.8890, test_loss: 1.0880, test_f1: 0.5173
 epoch: 89, train_loss: 0.9326, test_loss: 1.0640, test_f1: 0.5352
 epoch: 90, train_loss: 0.8976, test_loss: 1.0098, test_f1: 0.4169
 epoch: 91, train_loss: 0.8870, test_loss: 0.9993, test_f1: 0.5263
 epoch: 92, train_loss: 0.9011, test_loss: 1.0044, test_f1: 0.4398
 epoch: 93, train_loss: 0.8907, test_loss: 1.7375, test_f1: 0.4892
 epoch: 94, train_loss: 0.9139, test_loss: 1.0710, test_f1: 0.5113
 epoch: 95, train_loss: 0.8982, test_loss: 1.0667, test_f1: 0.3940
 epoch: 96, train_loss: 0.9097, test_loss: 0.9822, test_f1: 0.5531
 epoch: 97, train_loss: 0.9197, test_loss: 1.0185, test_f1: 0.5533
 epoch: 98, train_loss: 0.9094, test_loss: 1.1861, test_f1: 0.4262
 epoch: 99, train_loss: 0.9070, test_loss: 1.0178, test_f1: 0.5341
##################ITERATION #1 ****************************************
 epoch: 0, train_loss: 1.4117, test_loss: 1.3167, test_f1: 0.1365
 epoch: 1, train_loss: 1.2325, test_loss: 1.3099, test_f1: 0.1517
 epoch: 2, train_loss: 1.1847, test_loss: 2.6697, test_f1: 0.2724
 epoch: 3, train_loss: 1.1721, test_loss: 1.3058, test_f1: 0.2699
 epoch: 4, train_loss: 1.1455, test_loss: 1.3403, test_f1: 0.2281
 epoch: 5, train_loss: 1.1256, test_loss: 1.6283, test_f1: 0.3093
 epoch: 6, train_loss: 1.1426, test_loss: 1.1983, test_f1: 0.3230
 epoch: 7, train_loss: 1.1224, test_loss: 1.2999, test_f1: 0.2821
 epoch: 8, train_loss: 1.1263, test_loss: 1.2032, test_f1: 0.3240
 epoch: 9, train_loss: 1.1083, test_loss: 1.3039, test_f1: 0.2281
 epoch: 10, train_loss: 1.0993, test_loss: 1.3310, test_f1: 0.2756
 epoch: 11, train_loss: 1.1179, test_loss: 1.1867, test_f1: 0.4182
 epoch: 12, train_loss: 1.1349, test_loss: 1.3714, test_f1: 0.2281
 epoch: 13, train_loss: 1.1437, test_loss: 1.8259, test_f1: 0.2847
 epoch: 14, train_loss: 1.1117, test_loss: 1.2274, test_f1: 0.3162
 epoch: 15, train_loss: 1.1313, test_loss: 1.2227, test_f1: 0.4209
 epoch: 16, train_loss: 1.1119, test_loss: 1.2324, test_f1: 0.3126
 epoch: 17, train_loss: 1.0935, test_loss: 1.1924, test_f1: 0.4393
 epoch: 18, train_loss: 1.0870, test_loss: 1.1699, test_f1: 0.3308
 epoch: 19, train_loss: 1.0898, test_loss: 1.2021, test_f1: 0.3098
 epoch: 20, train_loss: 1.0965, test_loss: 1.1979, test_f1: 0.4250
 epoch: 21, train_loss: 1.0868, test_loss: 1.2203, test_f1: 0.4291
 epoch: 22, train_loss: 1.0937, test_loss: 1.1889, test_f1: 0.4151
 epoch: 23, train_loss: 1.0794, test_loss: 1.1977, test_f1: 0.3138
 epoch: 24, train_loss: 1.0921, test_loss: 1.2437, test_f1: 0.4100
 epoch: 25, train_loss: 1.0851, test_loss: 1.2677, test_f1: 0.2957
 epoch: 26, train_loss: 1.0797, test_loss: 1.2615, test_f1: 0.3103
 epoch: 27, train_loss: 1.0690, test_loss: 1.2091, test_f1: 0.3139
 epoch: 28, train_loss: 1.0728, test_loss: 1.2042, test_f1: 0.4110
 epoch: 29, train_loss: 1.0744, test_loss: 1.4134, test_f1: 0.3163
 epoch: 30, train_loss: 1.0829, test_loss: 1.2044, test_f1: 0.3487
 epoch: 31, train_loss: 1.0932, test_loss: 1.3654, test_f1: 0.2641
 epoch: 32, train_loss: 1.0953, test_loss: 1.2633, test_f1: 0.4043
 epoch: 33, train_loss: 1.0871, test_loss: 1.2768, test_f1: 0.4401
 epoch: 34, train_loss: 1.0706, test_loss: 1.2480, test_f1: 0.4357
 epoch: 35, train_loss: 1.0844, test_loss: 1.2744, test_f1: 0.4249
 epoch: 36, train_loss: 1.1675, test_loss: 7.0037, test_f1: 0.2885
 epoch: 37, train_loss: 1.1366, test_loss: 1.2389, test_f1: 0.3125
 epoch: 38, train_loss: 1.0894, test_loss: 1.2402, test_f1: 0.3135
 epoch: 39, train_loss: 1.0533, test_loss: 1.2266, test_f1: 0.3848
 epoch: 40, train_loss: 1.0757, test_loss: 1.2920, test_f1: 0.3303
 epoch: 41, train_loss: 1.0865, test_loss: 1.2165, test_f1: 0.3094
 epoch: 42, train_loss: 1.0456, test_loss: 1.2203, test_f1: 0.3958
 epoch: 43, train_loss: 1.0260, test_loss: 1.2794, test_f1: 0.3635
 epoch: 44, train_loss: 1.0423, test_loss: 1.2889, test_f1: 0.3724
 epoch: 45, train_loss: 1.0216, test_loss: 1.1331, test_f1: 0.4329
 epoch: 46, train_loss: 1.0325, test_loss: 1.1254, test_f1: 0.3366
 epoch: 47, train_loss: 1.0882, test_loss: 1.2414, test_f1: 0.3651
 epoch: 48, train_loss: 1.0630, test_loss: 1.2901, test_f1: 0.3478
 epoch: 49, train_loss: 1.0531, test_loss: 1.3037, test_f1: 0.3070
 epoch: 50, train_loss: 1.0154, test_loss: 1.3576, test_f1: 0.2945
 epoch: 51, train_loss: 1.0247, test_loss: 1.1099, test_f1: 0.4110
 epoch: 52, train_loss: 1.0352, test_loss: 1.1209, test_f1: 0.4233
 epoch: 53, train_loss: 0.9842, test_loss: 1.2100, test_f1: 0.3613
 epoch: 54, train_loss: 0.9780, test_loss: 1.2406, test_f1: 0.3719
 epoch: 55, train_loss: 0.9740, test_loss: 1.1025, test_f1: 0.4151
 epoch: 56, train_loss: 0.9705, test_loss: 1.1379, test_f1: 0.4138
 epoch: 57, train_loss: 0.9798, test_loss: 1.1757, test_f1: 0.3954
 epoch: 58, train_loss: 0.9710, test_loss: 1.4044, test_f1: 0.3873
 epoch: 59, train_loss: 0.9764, test_loss: 1.2617, test_f1: 0.3527
 epoch: 60, train_loss: 1.0174, test_loss: 1.5792, test_f1: 0.3544
 epoch: 61, train_loss: 0.9779, test_loss: 1.1926, test_f1: 0.4126
 epoch: 62, train_loss: 0.9648, test_loss: 1.0838, test_f1: 0.4248
 epoch: 63, train_loss: 0.9669, test_loss: 1.0990, test_f1: 0.4203
 epoch: 64, train_loss: 0.9836, test_loss: 1.1061, test_f1: 0.4196
 epoch: 65, train_loss: 0.9615, test_loss: 1.1368, test_f1: 0.4032
 epoch: 66, train_loss: 0.9727, test_loss: 1.1360, test_f1: 0.4001
 epoch: 67, train_loss: 0.9839, test_loss: 1.0870, test_f1: 0.4189
 epoch: 68, train_loss: 0.9819, test_loss: 1.0930, test_f1: 0.4225
 epoch: 69, train_loss: 0.9728, test_loss: 1.0846, test_f1: 0.4066
 epoch: 70, train_loss: 0.9851, test_loss: 1.1966, test_f1: 0.3894
 epoch: 71, train_loss: 0.9734, test_loss: 1.0980, test_f1: 0.4243
 epoch: 72, train_loss: 0.9725, test_loss: 1.1197, test_f1: 0.4085
 epoch: 73, train_loss: 0.9751, test_loss: 1.0862, test_f1: 0.4244
 epoch: 74, train_loss: 0.9689, test_loss: 1.1122, test_f1: 0.4112
 epoch: 75, train_loss: 0.9585, test_loss: 1.0812, test_f1: 0.4290
 epoch: 76, train_loss: 0.9628, test_loss: 1.2847, test_f1: 0.3868
 epoch: 77, train_loss: 0.9493, test_loss: 1.0607, test_f1: 0.4321
 epoch: 78, train_loss: 0.9424, test_loss: 1.1392, test_f1: 0.4179
 epoch: 79, train_loss: 0.9811, test_loss: 1.2252, test_f1: 0.4154
 epoch: 80, train_loss: 1.0286, test_loss: 1.2159, test_f1: 0.3956
 epoch: 81, train_loss: 0.9899, test_loss: 1.1095, test_f1: 0.4188
 epoch: 82, train_loss: 0.9650, test_loss: 1.0631, test_f1: 0.4179
 epoch: 83, train_loss: 0.9805, test_loss: 1.1032, test_f1: 0.4125
 epoch: 84, train_loss: 0.9445, test_loss: 1.1183, test_f1: 0.4177
 epoch: 85, train_loss: 0.9588, test_loss: 1.0992, test_f1: 0.4150
 epoch: 86, train_loss: 0.9615, test_loss: 1.1174, test_f1: 0.4042
 epoch: 87, train_loss: 0.9632, test_loss: 1.1353, test_f1: 0.3990
 epoch: 88, train_loss: 0.9590, test_loss: 1.1002, test_f1: 0.4161
 epoch: 89, train_loss: 0.9527, test_loss: 1.0838, test_f1: 0.4225
 epoch: 90, train_loss: 0.9601, test_loss: 1.0967, test_f1: 0.4231
 epoch: 91, train_loss: 0.9832, test_loss: 1.1312, test_f1: 0.3807
 epoch: 92, train_loss: 0.9862, test_loss: 1.0679, test_f1: 0.4168
 epoch: 93, train_loss: 0.9816, test_loss: 1.0753, test_f1: 0.4206
 epoch: 94, train_loss: 0.9587, test_loss: 1.0498, test_f1: 0.4279
 epoch: 95, train_loss: 0.9553, test_loss: 5.1431, test_f1: 0.3357
 epoch: 96, train_loss: 0.9694, test_loss: 1.1736, test_f1: 0.3782
 epoch: 97, train_loss: 0.9933, test_loss: 1.1183, test_f1: 0.3925
 epoch: 98, train_loss: 0.9855, test_loss: 1.1478, test_f1: 0.3885
 epoch: 99, train_loss: 1.0876, test_loss: 1.2981, test_f1: 0.3081
##################ITERATION #2 ****************************************
 epoch: 0, train_loss: 1.2852, test_loss: 1.3452, test_f1: 0.2373
 epoch: 1, train_loss: 1.2521, test_loss: 1.3201, test_f1: 0.1396
 epoch: 2, train_loss: 1.2380, test_loss: 1.2252, test_f1: 0.3018
 epoch: 3, train_loss: 1.1829, test_loss: 1.3253, test_f1: 0.1471
 epoch: 4, train_loss: 1.1800, test_loss: 1.1747, test_f1: 0.3246
 epoch: 5, train_loss: 1.1588, test_loss: 1.1621, test_f1: 0.3290
 epoch: 6, train_loss: 1.1381, test_loss: 1.1439, test_f1: 0.3298
 epoch: 7, train_loss: 1.1443, test_loss: 1.2479, test_f1: 0.2675
 epoch: 8, train_loss: 1.1008, test_loss: 1.2885, test_f1: 0.2462
 epoch: 9, train_loss: 1.1127, test_loss: 1.1599, test_f1: 0.3290
 epoch: 10, train_loss: 1.1037, test_loss: 1.1951, test_f1: 0.3115
 epoch: 11, train_loss: 1.0997, test_loss: 1.1696, test_f1: 0.3290
 epoch: 12, train_loss: 1.0982, test_loss: 1.1459, test_f1: 0.3290
 epoch: 13, train_loss: 1.0851, test_loss: 1.1660, test_f1: 0.3290
 epoch: 14, train_loss: 1.0889, test_loss: 1.1633, test_f1: 0.3262
 epoch: 15, train_loss: 1.0965, test_loss: 1.3466, test_f1: 0.2390
 epoch: 16, train_loss: 1.1044, test_loss: 1.4717, test_f1: 0.2953
 epoch: 17, train_loss: 1.1453, test_loss: 1.3805, test_f1: 0.2818
 epoch: 18, train_loss: 1.1156, test_loss: 1.2233, test_f1: 0.3152
 epoch: 19, train_loss: 1.1141, test_loss: 1.1362, test_f1: 0.2782
 epoch: 20, train_loss: 1.1118, test_loss: 1.1570, test_f1: 0.3291
 epoch: 21, train_loss: 1.1007, test_loss: 1.1418, test_f1: 0.3344
 epoch: 22, train_loss: 1.1147, test_loss: 1.1306, test_f1: 0.3296
 epoch: 23, train_loss: 1.1124, test_loss: 1.1295, test_f1: 0.3284
 epoch: 24, train_loss: 1.1074, test_loss: 1.1378, test_f1: 0.3344
 epoch: 25, train_loss: 1.1174, test_loss: 1.1539, test_f1: 0.3344
 epoch: 26, train_loss: 1.1550, test_loss: 1.2318, test_f1: 0.3020
 epoch: 27, train_loss: 1.1353, test_loss: 1.2884, test_f1: 0.2867
 epoch: 28, train_loss: 1.1291, test_loss: 1.1227, test_f1: 0.3403
 epoch: 29, train_loss: 1.1158, test_loss: 1.1325, test_f1: 0.3444
 epoch: 30, train_loss: 1.1163, test_loss: 1.1676, test_f1: 0.3267
 epoch: 31, train_loss: 1.1165, test_loss: 1.1640, test_f1: 0.3290
 epoch: 32, train_loss: 1.1038, test_loss: 1.1608, test_f1: 0.3317
 epoch: 33, train_loss: 1.1101, test_loss: 1.1647, test_f1: 0.3276
 epoch: 34, train_loss: 1.1042, test_loss: 1.1528, test_f1: 0.3291
 epoch: 35, train_loss: 1.1115, test_loss: 1.1736, test_f1: 0.3281
 epoch: 36, train_loss: 1.1125, test_loss: 1.1509, test_f1: 0.3281
 epoch: 37, train_loss: 1.1110, test_loss: 1.1526, test_f1: 0.3311
 epoch: 38, train_loss: 1.1099, test_loss: 1.1671, test_f1: 0.3281
 epoch: 39, train_loss: 1.1127, test_loss: 1.1471, test_f1: 0.3304
 epoch: 40, train_loss: 1.1111, test_loss: 1.1432, test_f1: 0.2466
 epoch: 41, train_loss: 1.1122, test_loss: 1.1417, test_f1: 0.3326
 epoch: 42, train_loss: 1.1079, test_loss: 1.1559, test_f1: 0.3352
 epoch: 43, train_loss: 1.1002, test_loss: 1.1687, test_f1: 0.3220
 epoch: 44, train_loss: 1.1057, test_loss: 1.1362, test_f1: 0.3331
 epoch: 45, train_loss: 1.1121, test_loss: 1.1291, test_f1: 0.3331
 epoch: 46, train_loss: 1.1116, test_loss: 1.1759, test_f1: 0.3290
 epoch: 47, train_loss: 1.1372, test_loss: 1.1686, test_f1: 0.3317
 epoch: 48, train_loss: 1.1127, test_loss: 1.1704, test_f1: 0.3290
 epoch: 49, train_loss: 1.1052, test_loss: 1.1713, test_f1: 0.3290
 epoch: 50, train_loss: 1.0960, test_loss: 1.1621, test_f1: 0.3290
 epoch: 51, train_loss: 1.0904, test_loss: 1.1712, test_f1: 0.3262
 epoch: 52, train_loss: 1.0855, test_loss: 1.1569, test_f1: 0.3290
 epoch: 53, train_loss: 1.0874, test_loss: 1.1612, test_f1: 0.3290
 epoch: 54, train_loss: 1.0871, test_loss: 1.1605, test_f1: 0.3290
 epoch: 55, train_loss: 1.0844, test_loss: 1.1549, test_f1: 0.3290
 epoch: 56, train_loss: 1.1015, test_loss: 1.1463, test_f1: 0.3344
 epoch: 57, train_loss: 1.1018, test_loss: 1.1548, test_f1: 0.3290
 epoch: 58, train_loss: 1.0830, test_loss: 1.1596, test_f1: 0.3290
 epoch: 59, train_loss: 1.0817, test_loss: 1.1563, test_f1: 0.3290
 epoch: 60, train_loss: 1.0823, test_loss: 1.1585, test_f1: 0.3290
 epoch: 61, train_loss: 1.0809, test_loss: 1.1550, test_f1: 0.3290
 epoch: 62, train_loss: 1.0777, test_loss: 1.1563, test_f1: 0.3290
 epoch: 63, train_loss: 1.0781, test_loss: 1.1539, test_f1: 0.3290
 epoch: 64, train_loss: 1.0795, test_loss: 1.1568, test_f1: 0.3290
 epoch: 65, train_loss: 1.0776, test_loss: 1.1570, test_f1: 0.3290
 epoch: 66, train_loss: 1.0771, test_loss: 1.1520, test_f1: 0.3290
 epoch: 67, train_loss: 1.0765, test_loss: 1.1586, test_f1: 0.3290
 epoch: 68, train_loss: 1.0777, test_loss: 1.1532, test_f1: 0.3290
 epoch: 69, train_loss: 1.0767, test_loss: 1.1517, test_f1: 0.3290
 epoch: 70, train_loss: 1.0766, test_loss: 1.1534, test_f1: 0.3290
 epoch: 71, train_loss: 1.0753, test_loss: 1.1553, test_f1: 0.3290
 epoch: 72, train_loss: 1.0767, test_loss: 1.1507, test_f1: 0.3290
 epoch: 73, train_loss: 1.0787, test_loss: 1.1543, test_f1: 0.3290
 epoch: 74, train_loss: 1.0781, test_loss: 1.1506, test_f1: 0.3290
 epoch: 75, train_loss: 1.0761, test_loss: 1.1582, test_f1: 0.3290
 epoch: 76, train_loss: 1.0743, test_loss: 1.1495, test_f1: 0.3290
 epoch: 77, train_loss: 1.0770, test_loss: 1.1529, test_f1: 0.3290
 epoch: 78, train_loss: 1.0768, test_loss: 1.1569, test_f1: 0.3290
 epoch: 79, train_loss: 1.0757, test_loss: 1.1522, test_f1: 0.3290
 epoch: 80, train_loss: 1.0759, test_loss: 1.1544, test_f1: 0.3290
 epoch: 81, train_loss: 1.0752, test_loss: 1.1507, test_f1: 0.3290
 epoch: 82, train_loss: 1.0771, test_loss: 1.1566, test_f1: 0.3290
 epoch: 83, train_loss: 1.0748, test_loss: 1.1525, test_f1: 0.3290
 epoch: 84, train_loss: 1.0749, test_loss: 1.1522, test_f1: 0.3290
 epoch: 85, train_loss: 1.0746, test_loss: 1.1501, test_f1: 0.3290
 epoch: 86, train_loss: 1.0767, test_loss: 1.1521, test_f1: 0.3290
 epoch: 87, train_loss: 1.0764, test_loss: 1.1530, test_f1: 0.3290
 epoch: 88, train_loss: 1.0759, test_loss: 1.1549, test_f1: 0.3290
 epoch: 89, train_loss: 1.0777, test_loss: 1.1548, test_f1: 0.3290
 epoch: 90, train_loss: 1.0745, test_loss: 1.1549, test_f1: 0.3290
 epoch: 91, train_loss: 1.0762, test_loss: 1.1511, test_f1: 0.3290
 epoch: 92, train_loss: 1.0796, test_loss: 1.1498, test_f1: 0.3290
 epoch: 93, train_loss: 1.0810, test_loss: 1.1498, test_f1: 0.3290
 epoch: 94, train_loss: 1.0794, test_loss: 1.1519, test_f1: 0.3290
 epoch: 95, train_loss: 1.0798, test_loss: 1.1544, test_f1: 0.3290
 epoch: 96, train_loss: 1.0794, test_loss: 1.1547, test_f1: 0.3290
 epoch: 97, train_loss: 1.0795, test_loss: 1.1541, test_f1: 0.3290
 epoch: 98, train_loss: 1.0774, test_loss: 1.1513, test_f1: 0.3290
 epoch: 99, train_loss: 1.0766, test_loss: 1.1539, test_f1: 0.3290
##################ITERATION #3 ****************************************
 epoch: 0, train_loss: 1.3397, test_loss: 1.3477, test_f1: 0.2630
 epoch: 1, train_loss: 1.2650, test_loss: 1.3067, test_f1: 0.2354
 epoch: 2, train_loss: 1.2582, test_loss: 1.3125, test_f1: 0.2281
 epoch: 3, train_loss: 1.2608, test_loss: 1.3219, test_f1: 0.1365
 epoch: 4, train_loss: 1.2635, test_loss: 1.3273, test_f1: 0.2281
 epoch: 5, train_loss: 1.2559, test_loss: 1.3117, test_f1: 0.2281
 epoch: 6, train_loss: 1.2560, test_loss: 1.3006, test_f1: 0.2281
 epoch: 7, train_loss: 1.2624, test_loss: 1.3176, test_f1: 0.2281
 epoch: 8, train_loss: 1.2560, test_loss: 1.3032, test_f1: 0.2281
 epoch: 9, train_loss: 1.2573, test_loss: 1.3093, test_f1: 0.2281
 epoch: 10, train_loss: 1.2542, test_loss: 1.3062, test_f1: 0.2281
 epoch: 11, train_loss: 1.2582, test_loss: 1.3244, test_f1: 0.2281
 epoch: 12, train_loss: 1.2573, test_loss: 1.3017, test_f1: 0.2281
 epoch: 13, train_loss: 1.2581, test_loss: 1.3046, test_f1: 0.2281
 epoch: 14, train_loss: 1.2583, test_loss: 1.3058, test_f1: 0.2281
 epoch: 15, train_loss: 1.2566, test_loss: 1.3091, test_f1: 0.2281
 epoch: 16, train_loss: 1.2600, test_loss: 1.3064, test_f1: 0.2281
 epoch: 17, train_loss: 1.2664, test_loss: 1.3180, test_f1: 0.2281
 epoch: 18, train_loss: 1.2583, test_loss: 1.3025, test_f1: 0.2281
 epoch: 19, train_loss: 1.2557, test_loss: 1.3017, test_f1: 0.2281
 epoch: 20, train_loss: 1.2555, test_loss: 1.3050, test_f1: 0.2281
 epoch: 21, train_loss: 1.2539, test_loss: 1.3043, test_f1: 0.2281
 epoch: 22, train_loss: 1.2545, test_loss: 1.3056, test_f1: 0.2281
 epoch: 23, train_loss: 1.2535, test_loss: 1.3015, test_f1: 0.2281
 epoch: 24, train_loss: 1.2555, test_loss: 1.3056, test_f1: 0.2281
 epoch: 25, train_loss: 1.2571, test_loss: 1.3103, test_f1: 0.2281
 epoch: 26, train_loss: 1.2554, test_loss: 1.3052, test_f1: 0.2281
 epoch: 27, train_loss: 1.2557, test_loss: 1.3018, test_f1: 0.2281
 epoch: 28, train_loss: 1.2559, test_loss: 1.3021, test_f1: 0.2281
 epoch: 29, train_loss: 1.2573, test_loss: 1.3142, test_f1: 0.2281
 epoch: 30, train_loss: 1.2567, test_loss: 1.3081, test_f1: 0.2281
 epoch: 31, train_loss: 1.2554, test_loss: 1.3038, test_f1: 0.2281
 epoch: 32, train_loss: 1.2560, test_loss: 1.3098, test_f1: 0.2281
 epoch: 33, train_loss: 1.2551, test_loss: 1.3045, test_f1: 0.2281
 epoch: 34, train_loss: 1.2555, test_loss: 1.3146, test_f1: 0.2281
 epoch: 35, train_loss: 1.2588, test_loss: 1.3003, test_f1: 0.2281
 epoch: 36, train_loss: 1.2552, test_loss: 1.3208, test_f1: 0.2281
 epoch: 37, train_loss: 1.2654, test_loss: 1.3125, test_f1: 0.1365
 epoch: 38, train_loss: 1.2622, test_loss: 1.3066, test_f1: 0.2281
 epoch: 39, train_loss: 1.2586, test_loss: 1.3016, test_f1: 0.2281
 epoch: 40, train_loss: 1.2552, test_loss: 1.3044, test_f1: 0.2281
 epoch: 41, train_loss: 1.2543, test_loss: 1.3091, test_f1: 0.2281
 epoch: 42, train_loss: 1.2595, test_loss: 1.3036, test_f1: 0.2281
 epoch: 43, train_loss: 1.2605, test_loss: 1.3082, test_f1: 0.2281
 epoch: 44, train_loss: 1.2634, test_loss: 1.3130, test_f1: 0.2281
 epoch: 45, train_loss: 1.2549, test_loss: 1.3022, test_f1: 0.2281
 epoch: 46, train_loss: 1.2545, test_loss: 1.3060, test_f1: 0.2281
 epoch: 47, train_loss: 1.2582, test_loss: 1.3066, test_f1: 0.2281
 epoch: 48, train_loss: 1.2553, test_loss: 1.3237, test_f1: 0.1365
 epoch: 49, train_loss: 1.2578, test_loss: 1.3075, test_f1: 0.2281
 epoch: 50, train_loss: 1.2577, test_loss: 1.3014, test_f1: 0.2281
 epoch: 51, train_loss: 1.2560, test_loss: 1.3034, test_f1: 0.2281
 epoch: 52, train_loss: 1.2539, test_loss: 1.3081, test_f1: 0.2281
 epoch: 53, train_loss: 1.2550, test_loss: 1.3000, test_f1: 0.2281
 epoch: 54, train_loss: 1.2558, test_loss: 1.3055, test_f1: 0.2281
 epoch: 55, train_loss: 1.2576, test_loss: 1.3029, test_f1: 0.2281
 epoch: 56, train_loss: 1.2531, test_loss: 1.3070, test_f1: 0.2281
 epoch: 57, train_loss: 1.2556, test_loss: 1.3030, test_f1: 0.2281
 epoch: 58, train_loss: 1.2557, test_loss: 1.3083, test_f1: 0.2281
 epoch: 59, train_loss: 1.2533, test_loss: 1.3052, test_f1: 0.2281
 epoch: 60, train_loss: 1.2531, test_loss: 1.3068, test_f1: 0.2281
 epoch: 61, train_loss: 1.2556, test_loss: 1.3026, test_f1: 0.2281
 epoch: 62, train_loss: 1.2528, test_loss: 1.3063, test_f1: 0.2281
 epoch: 63, train_loss: 1.2533, test_loss: 1.3057, test_f1: 0.2281
 epoch: 64, train_loss: 1.2534, test_loss: 1.3023, test_f1: 0.2281
 epoch: 65, train_loss: 1.2550, test_loss: 1.3045, test_f1: 0.2281
 epoch: 66, train_loss: 1.2547, test_loss: 1.3101, test_f1: 0.2281
 epoch: 67, train_loss: 1.2569, test_loss: 1.3017, test_f1: 0.2281
 epoch: 68, train_loss: 1.2549, test_loss: 1.3038, test_f1: 0.2281
 epoch: 69, train_loss: 1.2540, test_loss: 1.3098, test_f1: 0.2281
 epoch: 70, train_loss: 1.2533, test_loss: 1.3030, test_f1: 0.2281
 epoch: 71, train_loss: 1.2525, test_loss: 1.3051, test_f1: 0.2281
 epoch: 72, train_loss: 1.2536, test_loss: 1.3037, test_f1: 0.2281
 epoch: 73, train_loss: 1.2533, test_loss: 1.3070, test_f1: 0.2281
 epoch: 74, train_loss: 1.2540, test_loss: 1.3055, test_f1: 0.2281
 epoch: 75, train_loss: 1.2551, test_loss: 1.3048, test_f1: 0.2281
 epoch: 76, train_loss: 1.2533, test_loss: 1.3043, test_f1: 0.2281
 epoch: 77, train_loss: 1.2523, test_loss: 1.3067, test_f1: 0.2281
 epoch: 78, train_loss: 1.2542, test_loss: 1.3043, test_f1: 0.2281
 epoch: 79, train_loss: 1.2528, test_loss: 1.3099, test_f1: 0.2281
 epoch: 80, train_loss: 1.2548, test_loss: 1.3008, test_f1: 0.2281
 epoch: 81, train_loss: 1.2560, test_loss: 1.3072, test_f1: 0.2281
 epoch: 82, train_loss: 1.2527, test_loss: 1.3081, test_f1: 0.2281
 epoch: 83, train_loss: 1.2590, test_loss: 1.3010, test_f1: 0.2281
 epoch: 84, train_loss: 1.2555, test_loss: 1.3097, test_f1: 0.2281
 epoch: 85, train_loss: 1.2555, test_loss: 1.3011, test_f1: 0.2281
 epoch: 86, train_loss: 1.2560, test_loss: 1.3064, test_f1: 0.2281
 epoch: 87, train_loss: 1.2538, test_loss: 1.3030, test_f1: 0.2281
 epoch: 88, train_loss: 1.2529, test_loss: 1.3088, test_f1: 0.2281
 epoch: 89, train_loss: 1.2574, test_loss: 1.3013, test_f1: 0.2281
 epoch: 90, train_loss: 1.2528, test_loss: 1.3096, test_f1: 0.2281
 epoch: 91, train_loss: 1.2534, test_loss: 1.3029, test_f1: 0.2281
 epoch: 92, train_loss: 1.2552, test_loss: 1.3049, test_f1: 0.2281
 epoch: 93, train_loss: 1.2537, test_loss: 1.3047, test_f1: 0.2281
 epoch: 94, train_loss: 1.2531, test_loss: 1.3064, test_f1: 0.2281
 epoch: 95, train_loss: 1.2531, test_loss: 1.3070, test_f1: 0.2281
 epoch: 96, train_loss: 1.2540, test_loss: 1.3046, test_f1: 0.2281
 epoch: 97, train_loss: 1.2531, test_loss: 1.3072, test_f1: 0.2281
 epoch: 98, train_loss: 1.2537, test_loss: 1.3055, test_f1: 0.2281
 epoch: 99, train_loss: 1.2537, test_loss: 1.3053, test_f1: 0.2281
##################ITERATION #4 ****************************************
 epoch: 0, train_loss: 1.3359, test_loss: 1.3108, test_f1: 0.2281
 epoch: 1, train_loss: 1.2543, test_loss: 1.3036, test_f1: 0.2281
 epoch: 2, train_loss: 1.2571, test_loss: 1.3268, test_f1: 0.2281
 epoch: 3, train_loss: 1.2605, test_loss: 1.3025, test_f1: 0.2281
 epoch: 4, train_loss: 1.2570, test_loss: 1.3036, test_f1: 0.2281
 epoch: 5, train_loss: 1.2605, test_loss: 1.3137, test_f1: 0.1365
 epoch: 6, train_loss: 1.2586, test_loss: 1.3021, test_f1: 0.2281
 epoch: 7, train_loss: 1.2576, test_loss: 1.3101, test_f1: 0.2281
 epoch: 8, train_loss: 1.2554, test_loss: 1.3047, test_f1: 0.2281
 epoch: 9, train_loss: 1.2539, test_loss: 1.3033, test_f1: 0.2281
 epoch: 10, train_loss: 1.2551, test_loss: 1.3070, test_f1: 0.2281
 epoch: 11, train_loss: 1.2544, test_loss: 1.3078, test_f1: 0.2281
 epoch: 12, train_loss: 1.2542, test_loss: 1.3066, test_f1: 0.2281
 epoch: 13, train_loss: 1.2539, test_loss: 1.3029, test_f1: 0.2281
 epoch: 14, train_loss: 1.2549, test_loss: 1.3079, test_f1: 0.2281
 epoch: 15, train_loss: 1.2571, test_loss: 1.3056, test_f1: 0.2281
 epoch: 16, train_loss: 1.2574, test_loss: 1.3114, test_f1: 0.2281
 epoch: 17, train_loss: 1.2594, test_loss: 1.3046, test_f1: 0.2281
 epoch: 18, train_loss: 1.2567, test_loss: 1.3057, test_f1: 0.2281
 epoch: 19, train_loss: 1.2608, test_loss: 1.3081, test_f1: 0.2281
 epoch: 20, train_loss: 1.2547, test_loss: 1.3045, test_f1: 0.2281
 epoch: 21, train_loss: 1.2574, test_loss: 1.3019, test_f1: 0.2281
 epoch: 22, train_loss: 1.2584, test_loss: 1.3065, test_f1: 0.2281
 epoch: 23, train_loss: 1.2613, test_loss: 1.3115, test_f1: 0.1365
 epoch: 24, train_loss: 1.2574, test_loss: 1.3031, test_f1: 0.2281
 epoch: 25, train_loss: 1.2580, test_loss: 1.3139, test_f1: 0.2281
 epoch: 26, train_loss: 1.2545, test_loss: 1.3018, test_f1: 0.2281
 epoch: 27, train_loss: 1.2571, test_loss: 1.3008, test_f1: 0.2281
 epoch: 28, train_loss: 1.2561, test_loss: 1.3104, test_f1: 0.2281
 epoch: 29, train_loss: 1.2549, test_loss: 1.3018, test_f1: 0.2281
 epoch: 30, train_loss: 1.2571, test_loss: 1.3061, test_f1: 0.2281
 epoch: 31, train_loss: 1.2643, test_loss: 1.3077, test_f1: 0.2281
 epoch: 32, train_loss: 1.2552, test_loss: 1.3024, test_f1: 0.2281
 epoch: 33, train_loss: 1.2549, test_loss: 1.3046, test_f1: 0.2281
 epoch: 34, train_loss: 1.2550, test_loss: 1.3067, test_f1: 0.2281
 epoch: 35, train_loss: 1.2612, test_loss: 1.3130, test_f1: 0.2281
 epoch: 36, train_loss: 1.2562, test_loss: 1.3044, test_f1: 0.2281
 epoch: 37, train_loss: 1.2553, test_loss: 1.3030, test_f1: 0.2281
 epoch: 38, train_loss: 1.2630, test_loss: 1.3151, test_f1: 0.2281
 epoch: 39, train_loss: 1.2565, test_loss: 1.3003, test_f1: 0.2281
 epoch: 40, train_loss: 1.2558, test_loss: 1.3163, test_f1: 0.2281
 epoch: 41, train_loss: 1.2550, test_loss: 1.3038, test_f1: 0.2281
 epoch: 42, train_loss: 1.2567, test_loss: 1.3069, test_f1: 0.2281
 epoch: 43, train_loss: 1.2523, test_loss: 1.3024, test_f1: 0.2281
 epoch: 44, train_loss: 1.2573, test_loss: 1.3026, test_f1: 0.2281
 epoch: 45, train_loss: 1.2548, test_loss: 1.3051, test_f1: 0.2281
 epoch: 46, train_loss: 1.2551, test_loss: 1.3064, test_f1: 0.2281
 epoch: 47, train_loss: 1.2538, test_loss: 1.3096, test_f1: 0.2281
 epoch: 48, train_loss: 1.2567, test_loss: 1.3095, test_f1: 0.1365
 epoch: 49, train_loss: 1.2544, test_loss: 1.3101, test_f1: 0.2281
 epoch: 50, train_loss: 1.2552, test_loss: 1.3006, test_f1: 0.2281
 epoch: 51, train_loss: 1.2544, test_loss: 1.3039, test_f1: 0.2281
 epoch: 52, train_loss: 1.2551, test_loss: 1.3048, test_f1: 0.2281
 epoch: 53, train_loss: 1.2536, test_loss: 1.3036, test_f1: 0.2281
 epoch: 54, train_loss: 1.2553, test_loss: 1.3036, test_f1: 0.2281
 epoch: 55, train_loss: 1.2536, test_loss: 1.3065, test_f1: 0.2281
 epoch: 56, train_loss: 1.2534, test_loss: 1.3026, test_f1: 0.2281
 epoch: 57, train_loss: 1.2532, test_loss: 1.3052, test_f1: 0.2281
 epoch: 58, train_loss: 1.2547, test_loss: 1.3061, test_f1: 0.2281
 epoch: 59, train_loss: 1.2548, test_loss: 1.3050, test_f1: 0.2281
 epoch: 60, train_loss: 1.2547, test_loss: 1.3051, test_f1: 0.2281
 epoch: 61, train_loss: 1.2565, test_loss: 1.3091, test_f1: 0.2281
 epoch: 62, train_loss: 1.2527, test_loss: 1.3034, test_f1: 0.2281
 epoch: 63, train_loss: 1.2531, test_loss: 1.3070, test_f1: 0.2281
 epoch: 64, train_loss: 1.2534, test_loss: 1.3034, test_f1: 0.2281
 epoch: 65, train_loss: 1.2538, test_loss: 1.3029, test_f1: 0.2281
 epoch: 66, train_loss: 1.2530, test_loss: 1.3070, test_f1: 0.2281
 epoch: 67, train_loss: 1.2526, test_loss: 1.3028, test_f1: 0.2281
 epoch: 68, train_loss: 1.2541, test_loss: 1.3039, test_f1: 0.2281
 epoch: 69, train_loss: 1.2545, test_loss: 1.3046, test_f1: 0.2281
 epoch: 70, train_loss: 1.2554, test_loss: 1.3072, test_f1: 0.2281
 epoch: 71, train_loss: 1.2556, test_loss: 1.3031, test_f1: 0.2281
 epoch: 72, train_loss: 1.2536, test_loss: 1.3091, test_f1: 0.2281
 epoch: 73, train_loss: 1.2560, test_loss: 1.3079, test_f1: 0.2281
 epoch: 74, train_loss: 1.2565, test_loss: 1.3036, test_f1: 0.2281
 epoch: 75, train_loss: 1.2579, test_loss: 1.3054, test_f1: 0.2281
 epoch: 76, train_loss: 1.2540, test_loss: 1.3042, test_f1: 0.2281
 epoch: 77, train_loss: 1.2543, test_loss: 1.3020, test_f1: 0.2281
 epoch: 78, train_loss: 1.2537, test_loss: 1.3033, test_f1: 0.2281
 epoch: 79, train_loss: 1.2549, test_loss: 1.3064, test_f1: 0.2281
 epoch: 80, train_loss: 1.2545, test_loss: 1.3041, test_f1: 0.2281
 epoch: 81, train_loss: 1.2544, test_loss: 1.3048, test_f1: 0.2281
 epoch: 82, train_loss: 1.2535, test_loss: 1.3071, test_f1: 0.2281
 epoch: 83, train_loss: 1.2540, test_loss: 1.3020, test_f1: 0.2281
 epoch: 84, train_loss: 1.2541, test_loss: 1.3087, test_f1: 0.2281
 epoch: 85, train_loss: 1.2544, test_loss: 1.3046, test_f1: 0.2281
 epoch: 86, train_loss: 1.2541, test_loss: 1.3038, test_f1: 0.2281
 epoch: 87, train_loss: 1.2538, test_loss: 1.3063, test_f1: 0.2281
 epoch: 88, train_loss: 1.2548, test_loss: 1.3077, test_f1: 0.2281
 epoch: 89, train_loss: 1.2537, test_loss: 1.3051, test_f1: 0.2281
 epoch: 90, train_loss: 1.2536, test_loss: 1.3070, test_f1: 0.2281
 epoch: 91, train_loss: 1.2551, test_loss: 1.3063, test_f1: 0.2281
 epoch: 92, train_loss: 1.2561, test_loss: 1.3038, test_f1: 0.2281
 epoch: 93, train_loss: 1.2541, test_loss: 1.3046, test_f1: 0.2281
 epoch: 94, train_loss: 1.2543, test_loss: 1.3060, test_f1: 0.2281
 epoch: 95, train_loss: 1.2534, test_loss: 1.3063, test_f1: 0.2281
 epoch: 96, train_loss: 1.2567, test_loss: 1.3021, test_f1: 0.2281
 epoch: 97, train_loss: 1.2525, test_loss: 1.3108, test_f1: 0.2281
 epoch: 98, train_loss: 1.2551, test_loss: 1.3064, test_f1: 0.2281
 epoch: 99, train_loss: 1.2536, test_loss: 1.3035, test_f1: 0.2281
##################ITERATION #5 ****************************************
 epoch: 0, train_loss: 1.3026, test_loss: 1.4223, test_f1: 0.2630
 epoch: 1, train_loss: 1.2577, test_loss: 1.3242, test_f1: 0.2404
 epoch: 2, train_loss: 1.2621, test_loss: 1.3123, test_f1: 0.2281
 epoch: 3, train_loss: 1.2554, test_loss: 1.3277, test_f1: 0.2281
 epoch: 4, train_loss: 1.2533, test_loss: 1.3773, test_f1: 0.2341
 epoch: 5, train_loss: 1.2546, test_loss: 1.3116, test_f1: 0.2281
 epoch: 6, train_loss: 1.2504, test_loss: 1.3103, test_f1: 0.1365
 epoch: 7, train_loss: 1.2567, test_loss: 1.3106, test_f1: 0.2281
 epoch: 8, train_loss: 1.2562, test_loss: 1.3056, test_f1: 0.2281
 epoch: 9, train_loss: 1.2482, test_loss: 1.3027, test_f1: 0.2281
 epoch: 10, train_loss: 1.2425, test_loss: 1.3003, test_f1: 0.2281
 epoch: 11, train_loss: 1.2392, test_loss: 1.2874, test_f1: 0.2220
 epoch: 12, train_loss: 1.2260, test_loss: 1.3253, test_f1: 0.3128
 epoch: 13, train_loss: 1.1855, test_loss: 1.3719, test_f1: 0.3607
 epoch: 14, train_loss: 1.1722, test_loss: 1.3073, test_f1: 0.3203
 epoch: 15, train_loss: 1.1635, test_loss: 1.8829, test_f1: 0.1990
 epoch: 16, train_loss: 1.1476, test_loss: 1.2015, test_f1: 0.3290
 epoch: 17, train_loss: 1.1318, test_loss: 1.2276, test_f1: 0.3413
 epoch: 18, train_loss: 1.1368, test_loss: 1.4677, test_f1: 0.3238
 epoch: 19, train_loss: 1.1347, test_loss: 1.2116, test_f1: 0.3545
 epoch: 20, train_loss: 1.1132, test_loss: 1.1773, test_f1: 0.3176
 epoch: 21, train_loss: 1.0998, test_loss: 1.6966, test_f1: 0.2314
 epoch: 22, train_loss: 1.2248, test_loss: 1.3268, test_f1: 0.2398
 epoch: 23, train_loss: 1.2599, test_loss: 1.3042, test_f1: 0.2281
 epoch: 24, train_loss: 1.1789, test_loss: 1.1821, test_f1: 0.3262
 epoch: 25, train_loss: 1.1307, test_loss: 1.1605, test_f1: 0.3290
 epoch: 26, train_loss: 1.1267, test_loss: 1.1696, test_f1: 0.3290
 epoch: 27, train_loss: 1.1037, test_loss: 1.1611, test_f1: 0.3290
 epoch: 28, train_loss: 1.0966, test_loss: 1.1585, test_f1: 0.3290
 epoch: 29, train_loss: 1.0880, test_loss: 1.1591, test_f1: 0.3290
 epoch: 30, train_loss: 1.0932, test_loss: 1.1506, test_f1: 0.3290
 epoch: 31, train_loss: 1.1045, test_loss: 1.1639, test_f1: 0.3290
 epoch: 32, train_loss: 1.0923, test_loss: 1.1538, test_f1: 0.3290
 epoch: 33, train_loss: 1.0948, test_loss: 1.1517, test_f1: 0.3290
 epoch: 34, train_loss: 1.0884, test_loss: 1.1621, test_f1: 0.3290
 epoch: 35, train_loss: 1.0863, test_loss: 1.1528, test_f1: 0.3290
 epoch: 36, train_loss: 1.0866, test_loss: 1.1671, test_f1: 0.2334
 epoch: 37, train_loss: 1.0913, test_loss: 1.1510, test_f1: 0.3290
 epoch: 38, train_loss: 1.0817, test_loss: 1.1589, test_f1: 0.3290
 epoch: 39, train_loss: 1.0924, test_loss: 1.1602, test_f1: 0.2334
 epoch: 40, train_loss: 1.0894, test_loss: 1.1561, test_f1: 0.3290
 epoch: 41, train_loss: 1.0917, test_loss: 1.1533, test_f1: 0.3290
 epoch: 42, train_loss: 1.0807, test_loss: 1.1645, test_f1: 0.3290
 epoch: 43, train_loss: 1.0872, test_loss: 1.1459, test_f1: 0.3290
 epoch: 44, train_loss: 1.0792, test_loss: 1.1574, test_f1: 0.3290
 epoch: 45, train_loss: 1.0897, test_loss: 1.1512, test_f1: 0.3290
 epoch: 46, train_loss: 1.0818, test_loss: 1.1604, test_f1: 0.3290
 epoch: 47, train_loss: 1.0836, test_loss: 1.1542, test_f1: 0.3290
 epoch: 48, train_loss: 1.0819, test_loss: 1.1539, test_f1: 0.3290
 epoch: 49, train_loss: 1.0848, test_loss: 1.1515, test_f1: 0.3290
 epoch: 50, train_loss: 1.0780, test_loss: 1.1577, test_f1: 0.3290
 epoch: 51, train_loss: 1.0859, test_loss: 1.1563, test_f1: 0.3290
 epoch: 52, train_loss: 1.0835, test_loss: 1.1475, test_f1: 0.3290
 epoch: 53, train_loss: 1.0791, test_loss: 1.1570, test_f1: 0.3290
 epoch: 54, train_loss: 1.0821, test_loss: 1.1512, test_f1: 0.3290
 epoch: 55, train_loss: 1.0790, test_loss: 1.1507, test_f1: 0.3290
 epoch: 56, train_loss: 1.0787, test_loss: 1.1546, test_f1: 0.3290
 epoch: 57, train_loss: 1.0806, test_loss: 1.1568, test_f1: 0.3290
 epoch: 58, train_loss: 1.0802, test_loss: 1.1555, test_f1: 0.3290
 epoch: 59, train_loss: 1.0812, test_loss: 1.1503, test_f1: 0.3290
 epoch: 60, train_loss: 1.0809, test_loss: 1.1545, test_f1: 0.3290
 epoch: 61, train_loss: 1.0857, test_loss: 1.1459, test_f1: 0.3290
 epoch: 62, train_loss: 1.0810, test_loss: 1.1542, test_f1: 0.3290
 epoch: 63, train_loss: 1.0838, test_loss: 1.1514, test_f1: 0.3290
 epoch: 64, train_loss: 1.0768, test_loss: 1.1519, test_f1: 0.3290
 epoch: 65, train_loss: 1.0831, test_loss: 1.1541, test_f1: 0.3290
 epoch: 66, train_loss: 1.0739, test_loss: 1.1491, test_f1: 0.3290
 epoch: 67, train_loss: 1.0831, test_loss: 1.1496, test_f1: 0.3290
 epoch: 68, train_loss: 1.0814, test_loss: 1.1491, test_f1: 0.3290
 epoch: 69, train_loss: 1.0835, test_loss: 1.1517, test_f1: 0.3290
 epoch: 70, train_loss: 1.0756, test_loss: 1.1509, test_f1: 0.3290
 epoch: 71, train_loss: 1.0739, test_loss: 1.1522, test_f1: 0.3290
 epoch: 72, train_loss: 1.0759, test_loss: 1.1539, test_f1: 0.3290
 epoch: 73, train_loss: 1.0802, test_loss: 1.1543, test_f1: 0.3290
 epoch: 74, train_loss: 1.0790, test_loss: 1.1506, test_f1: 0.3290
 epoch: 75, train_loss: 1.0792, test_loss: 1.1498, test_f1: 0.3290
 epoch: 76, train_loss: 1.0847, test_loss: 1.1525, test_f1: 0.3290
 epoch: 77, train_loss: 1.0840, test_loss: 1.1539, test_f1: 0.3290
 epoch: 78, train_loss: 1.0857, test_loss: 1.1523, test_f1: 0.3290
 epoch: 79, train_loss: 1.0785, test_loss: 1.1477, test_f1: 0.3290
 epoch: 80, train_loss: 1.0830, test_loss: 1.1559, test_f1: 0.3290
 epoch: 81, train_loss: 1.0783, test_loss: 1.1509, test_f1: 0.3290
 epoch: 82, train_loss: 1.0813, test_loss: 1.1553, test_f1: 0.3290
 epoch: 83, train_loss: 1.0811, test_loss: 1.1507, test_f1: 0.3290
 epoch: 84, train_loss: 1.0835, test_loss: 1.1498, test_f1: 0.3290
 epoch: 85, train_loss: 1.0797, test_loss: 1.1477, test_f1: 0.3290
 epoch: 86, train_loss: 1.0739, test_loss: 1.1567, test_f1: 0.3290
 epoch: 87, train_loss: 1.0814, test_loss: 1.1537, test_f1: 0.3290
 epoch: 88, train_loss: 1.0785, test_loss: 1.1471, test_f1: 0.3290
 epoch: 89, train_loss: 1.0832, test_loss: 1.1539, test_f1: 0.3290
 epoch: 90, train_loss: 1.0850, test_loss: 1.1521, test_f1: 0.3290
 epoch: 91, train_loss: 1.0786, test_loss: 1.1476, test_f1: 0.3290
 epoch: 92, train_loss: 1.0793, test_loss: 1.1532, test_f1: 0.3290
 epoch: 93, train_loss: 1.0735, test_loss: 1.1554, test_f1: 0.3290
 epoch: 94, train_loss: 1.0803, test_loss: 1.1522, test_f1: 0.3290
 epoch: 95, train_loss: 1.0794, test_loss: 1.1523, test_f1: 0.3290
 epoch: 96, train_loss: 1.0813, test_loss: 1.1495, test_f1: 0.3290
 epoch: 97, train_loss: 1.0772, test_loss: 1.1501, test_f1: 0.3290
 epoch: 98, train_loss: 1.0807, test_loss: 1.1527, test_f1: 0.3290
 epoch: 99, train_loss: 1.0781, test_loss: 1.1536, test_f1: 0.3290
##################ITERATION #6 ****************************************
 epoch: 0, train_loss: 1.3147, test_loss: 1.3072, test_f1: 0.2281
 epoch: 1, train_loss: 1.2621, test_loss: 1.3073, test_f1: 0.2281
 epoch: 2, train_loss: 1.2574, test_loss: 1.3122, test_f1: 0.2281
 epoch: 3, train_loss: 1.2542, test_loss: 1.3037, test_f1: 0.2281
 epoch: 4, train_loss: 1.2584, test_loss: 1.3069, test_f1: 0.2281
 epoch: 5, train_loss: 1.2522, test_loss: 1.3082, test_f1: 0.2281
 epoch: 6, train_loss: 1.2573, test_loss: 1.3132, test_f1: 0.2281
 epoch: 7, train_loss: 1.2415, test_loss: 1.3364, test_f1: 0.2906
 epoch: 8, train_loss: 1.2416, test_loss: 1.2945, test_f1: 0.2281
 epoch: 9, train_loss: 1.2398, test_loss: 1.3150, test_f1: 0.2281
 epoch: 10, train_loss: 1.2583, test_loss: 1.3044, test_f1: 0.2281
 epoch: 11, train_loss: 1.2480, test_loss: 1.2808, test_f1: 0.2281
 epoch: 12, train_loss: 1.2362, test_loss: 1.2770, test_f1: 0.2281
 epoch: 13, train_loss: 1.2148, test_loss: 1.7895, test_f1: 0.2609
 epoch: 14, train_loss: 1.2340, test_loss: 1.3194, test_f1: 0.1365
 epoch: 15, train_loss: 1.2099, test_loss: 1.4350, test_f1: 0.2609
 epoch: 16, train_loss: 1.1789, test_loss: 1.3243, test_f1: 0.2970
 epoch: 17, train_loss: 1.1581, test_loss: 1.1592, test_f1: 0.3260
 epoch: 18, train_loss: 1.1717, test_loss: 1.1890, test_f1: 0.3262
 epoch: 19, train_loss: 1.1230, test_loss: 1.2096, test_f1: 0.2082
 epoch: 20, train_loss: 1.1176, test_loss: 1.1515, test_f1: 0.3290
 epoch: 21, train_loss: 1.1454, test_loss: 1.2360, test_f1: 0.2876
 epoch: 22, train_loss: 1.1675, test_loss: 2.0505, test_f1: 0.2684
 epoch: 23, train_loss: 1.1771, test_loss: 1.2138, test_f1: 0.2984
 epoch: 24, train_loss: 1.2012, test_loss: 1.1562, test_f1: 0.3290
 epoch: 25, train_loss: 1.1931, test_loss: 1.1671, test_f1: 0.2334
 epoch: 26, train_loss: 1.1398, test_loss: 1.1553, test_f1: 0.3290
 epoch: 27, train_loss: 1.1138, test_loss: 1.3449, test_f1: 0.3345
 epoch: 28, train_loss: 1.1095, test_loss: 1.1541, test_f1: 0.3290
 epoch: 29, train_loss: 1.1135, test_loss: 1.1473, test_f1: 0.3290
 epoch: 30, train_loss: 1.1179, test_loss: 1.1590, test_f1: 0.3290
 epoch: 31, train_loss: 1.1104, test_loss: 1.3196, test_f1: 0.2898
 epoch: 32, train_loss: 1.1097, test_loss: 1.1672, test_f1: 0.3205
 epoch: 33, train_loss: 1.1142, test_loss: 1.1561, test_f1: 0.3419
 epoch: 34, train_loss: 1.1209, test_loss: 1.1510, test_f1: 0.3290
 epoch: 35, train_loss: 1.1079, test_loss: 1.1506, test_f1: 0.3290
 epoch: 36, train_loss: 1.0905, test_loss: 1.1628, test_f1: 0.2337
 epoch: 37, train_loss: 1.0814, test_loss: 1.1577, test_f1: 0.3290
 epoch: 38, train_loss: 1.0915, test_loss: 1.1622, test_f1: 0.3290
 epoch: 39, train_loss: 1.0793, test_loss: 1.1606, test_f1: 0.3290
 epoch: 40, train_loss: 1.0787, test_loss: 1.1815, test_f1: 0.3290
 epoch: 41, train_loss: 1.0688, test_loss: 1.1271, test_f1: 0.3346
 epoch: 42, train_loss: 1.0385, test_loss: 1.3558, test_f1: 0.3847
 epoch: 43, train_loss: 1.0180, test_loss: 1.0823, test_f1: 0.4001
 epoch: 44, train_loss: 1.0143, test_loss: 1.2652, test_f1: 0.3990
 epoch: 45, train_loss: 0.9873, test_loss: 1.0595, test_f1: 0.4189
 epoch: 46, train_loss: 0.9734, test_loss: 1.0610, test_f1: 0.4153
 epoch: 47, train_loss: 0.9612, test_loss: 1.0645, test_f1: 0.4189
 epoch: 48, train_loss: 0.9601, test_loss: 1.0566, test_f1: 0.4189
 epoch: 49, train_loss: 0.9601, test_loss: 1.0726, test_f1: 0.4153
 epoch: 50, train_loss: 0.9636, test_loss: 1.0764, test_f1: 0.4094
 epoch: 51, train_loss: 0.9596, test_loss: 1.0600, test_f1: 0.4189
 epoch: 52, train_loss: 0.9497, test_loss: 1.0657, test_f1: 0.4189
 epoch: 53, train_loss: 0.9411, test_loss: 1.0715, test_f1: 0.4189
 epoch: 54, train_loss: 0.9404, test_loss: 1.0652, test_f1: 0.4189
 epoch: 55, train_loss: 0.9578, test_loss: 1.0684, test_f1: 0.4153
 epoch: 56, train_loss: 0.9430, test_loss: 1.0577, test_f1: 0.4189
 epoch: 57, train_loss: 0.9441, test_loss: 1.0644, test_f1: 0.4189
 epoch: 58, train_loss: 0.9476, test_loss: 1.0665, test_f1: 0.4189
 epoch: 59, train_loss: 0.9444, test_loss: 1.0673, test_f1: 0.4153
 epoch: 60, train_loss: 0.9531, test_loss: 1.0634, test_f1: 0.4189
 epoch: 61, train_loss: 0.9482, test_loss: 1.0658, test_f1: 0.4189
 epoch: 62, train_loss: 0.9480, test_loss: 1.0647, test_f1: 0.4189
 epoch: 63, train_loss: 0.9412, test_loss: 1.0643, test_f1: 0.4189
 epoch: 64, train_loss: 0.9491, test_loss: 1.0683, test_f1: 0.4153
 epoch: 65, train_loss: 0.9590, test_loss: 1.0930, test_f1: 0.4088
 epoch: 66, train_loss: 0.9611, test_loss: 1.0577, test_f1: 0.4189
 epoch: 67, train_loss: 0.9600, test_loss: 1.2966, test_f1: 0.3827
 epoch: 68, train_loss: 0.9530, test_loss: 1.0669, test_f1: 0.4167
 epoch: 69, train_loss: 0.9479, test_loss: 1.0711, test_f1: 0.4189
 epoch: 70, train_loss: 0.9422, test_loss: 1.0590, test_f1: 0.4189
 epoch: 71, train_loss: 0.9472, test_loss: 1.0708, test_f1: 0.4189
 epoch: 72, train_loss: 0.9453, test_loss: 1.0594, test_f1: 0.4189
 epoch: 73, train_loss: 0.9420, test_loss: 1.0649, test_f1: 0.4189
 epoch: 74, train_loss: 0.9521, test_loss: 1.0673, test_f1: 0.4153
 epoch: 75, train_loss: 0.9489, test_loss: 1.0746, test_f1: 0.4116
 epoch: 76, train_loss: 0.9486, test_loss: 1.0606, test_f1: 0.4189
 epoch: 77, train_loss: 0.9478, test_loss: 1.0574, test_f1: 0.4189
 epoch: 78, train_loss: 0.9467, test_loss: 1.0623, test_f1: 0.4189
 epoch: 79, train_loss: 0.9457, test_loss: 1.0613, test_f1: 0.4189
 epoch: 80, train_loss: 0.9473, test_loss: 1.0594, test_f1: 0.4189
 epoch: 81, train_loss: 0.9387, test_loss: 1.0670, test_f1: 0.4189
 epoch: 82, train_loss: 0.9401, test_loss: 1.0611, test_f1: 0.4189
 epoch: 83, train_loss: 0.9404, test_loss: 1.0616, test_f1: 0.4189
 epoch: 84, train_loss: 0.9384, test_loss: 1.0712, test_f1: 0.4189
 epoch: 85, train_loss: 0.9372, test_loss: 1.0636, test_f1: 0.4189
 epoch: 86, train_loss: 0.9416, test_loss: 1.0560, test_f1: 0.4189
 epoch: 87, train_loss: 0.9352, test_loss: 1.0681, test_f1: 0.4225
 epoch: 88, train_loss: 0.9450, test_loss: 1.0595, test_f1: 0.4189
 epoch: 89, train_loss: 0.9424, test_loss: 1.0637, test_f1: 0.4189
 epoch: 90, train_loss: 0.9434, test_loss: 1.0594, test_f1: 0.4189
 epoch: 91, train_loss: 0.9419, test_loss: 1.0664, test_f1: 0.4189
 epoch: 92, train_loss: 0.9369, test_loss: 1.0611, test_f1: 0.4189
 epoch: 93, train_loss: 0.9404, test_loss: 1.0648, test_f1: 0.4189
 epoch: 94, train_loss: 0.9441, test_loss: 1.0663, test_f1: 0.4189
 epoch: 95, train_loss: 0.9404, test_loss: 1.0584, test_f1: 0.4189
 epoch: 96, train_loss: 0.9394, test_loss: 1.0630, test_f1: 0.4189
 epoch: 97, train_loss: 0.9387, test_loss: 1.0691, test_f1: 0.4189
 epoch: 98, train_loss: 0.9402, test_loss: 1.0596, test_f1: 0.4189
 epoch: 99, train_loss: 0.9346, test_loss: 1.0632, test_f1: 0.4189
##################ITERATION #7 ****************************************
 epoch: 0, train_loss: 1.3513, test_loss: 1.5070, test_f1: 0.2281
 epoch: 1, train_loss: 1.2642, test_loss: 1.3082, test_f1: 0.2281
 epoch: 2, train_loss: 1.2685, test_loss: 1.3074, test_f1: 0.2281
 epoch: 3, train_loss: 1.2560, test_loss: 1.3114, test_f1: 0.2281
 epoch: 4, train_loss: 1.2591, test_loss: 1.3107, test_f1: 0.2281
 epoch: 5, train_loss: 1.2555, test_loss: 1.3047, test_f1: 0.2281
 epoch: 6, train_loss: 1.2611, test_loss: 1.3099, test_f1: 0.2281
 epoch: 7, train_loss: 1.2611, test_loss: 1.3052, test_f1: 0.2281
 epoch: 8, train_loss: 1.2583, test_loss: 1.3176, test_f1: 0.2281
 epoch: 9, train_loss: 1.2586, test_loss: 1.3089, test_f1: 0.2281
 epoch: 10, train_loss: 1.2558, test_loss: 1.3090, test_f1: 0.2281
 epoch: 11, train_loss: 1.2600, test_loss: 1.3082, test_f1: 0.2281
 epoch: 12, train_loss: 1.2559, test_loss: 1.3045, test_f1: 0.2281
 epoch: 13, train_loss: 1.2557, test_loss: 1.3097, test_f1: 0.2281
 epoch: 14, train_loss: 1.2557, test_loss: 1.3053, test_f1: 0.2281
 epoch: 15, train_loss: 1.2505, test_loss: 1.3174, test_f1: 0.2438
 epoch: 16, train_loss: 1.2454, test_loss: 4.2896, test_f1: 0.0890
 epoch: 17, train_loss: 1.2569, test_loss: 1.3049, test_f1: 0.2281
 epoch: 18, train_loss: 1.2467, test_loss: 1.3139, test_f1: 0.2281
 epoch: 19, train_loss: 1.2593, test_loss: 1.3154, test_f1: 0.1365
 epoch: 20, train_loss: 1.2607, test_loss: 1.3054, test_f1: 0.2281
 epoch: 21, train_loss: 1.2499, test_loss: 1.2981, test_f1: 0.2586
 epoch: 22, train_loss: 1.2401, test_loss: 1.4331, test_f1: 0.2328
 epoch: 23, train_loss: 1.2128, test_loss: 1.2896, test_f1: 0.2336
 epoch: 24, train_loss: 1.1839, test_loss: 1.1386, test_f1: 0.3354
 epoch: 25, train_loss: 1.1546, test_loss: 1.2971, test_f1: 0.2336
 epoch: 26, train_loss: 1.1508, test_loss: 1.1573, test_f1: 0.3290
 epoch: 27, train_loss: 1.1165, test_loss: 1.1581, test_f1: 0.3290
 epoch: 28, train_loss: 1.0992, test_loss: 1.1363, test_f1: 0.3344
 epoch: 29, train_loss: 1.0873, test_loss: 1.1551, test_f1: 0.3290
 epoch: 30, train_loss: 1.0896, test_loss: 1.1611, test_f1: 0.3290
 epoch: 31, train_loss: 1.1081, test_loss: 1.1484, test_f1: 0.3290
 epoch: 32, train_loss: 1.1099, test_loss: 1.1808, test_f1: 0.2334
 epoch: 33, train_loss: 1.0869, test_loss: 1.1572, test_f1: 0.3290
 epoch: 34, train_loss: 1.0854, test_loss: 1.1403, test_f1: 0.3290
 epoch: 35, train_loss: 1.0896, test_loss: 1.1577, test_f1: 0.3290
 epoch: 36, train_loss: 1.0928, test_loss: 1.1490, test_f1: 0.3290
 epoch: 37, train_loss: 1.1056, test_loss: 1.2281, test_f1: 0.3051
 epoch: 38, train_loss: 1.0918, test_loss: 1.1514, test_f1: 0.3268
 epoch: 39, train_loss: 1.0852, test_loss: 1.1252, test_f1: 0.3344
 epoch: 40, train_loss: 1.0853, test_loss: 1.1690, test_f1: 0.2334
 epoch: 41, train_loss: 1.0851, test_loss: 1.1609, test_f1: 0.3290
 epoch: 42, train_loss: 1.0801, test_loss: 1.1527, test_f1: 0.3290
 epoch: 43, train_loss: 1.0787, test_loss: 1.1602, test_f1: 0.3290
 epoch: 44, train_loss: 1.0776, test_loss: 1.1496, test_f1: 0.3290
 epoch: 45, train_loss: 1.0784, test_loss: 1.1561, test_f1: 0.3290
 epoch: 46, train_loss: 1.0771, test_loss: 1.1510, test_f1: 0.3290
 epoch: 47, train_loss: 1.0752, test_loss: 1.1481, test_f1: 0.3290
 epoch: 48, train_loss: 1.0748, test_loss: 1.1676, test_f1: 0.2334
 epoch: 49, train_loss: 1.0782, test_loss: 1.1461, test_f1: 0.3290
 epoch: 50, train_loss: 1.0856, test_loss: 1.1563, test_f1: 0.3290
 epoch: 51, train_loss: 1.0741, test_loss: 1.1500, test_f1: 0.3290
 epoch: 52, train_loss: 1.0724, test_loss: 1.1532, test_f1: 0.3290
 epoch: 53, train_loss: 1.0737, test_loss: 1.1474, test_f1: 0.3290
 epoch: 54, train_loss: 1.0781, test_loss: 1.1518, test_f1: 0.3290
 epoch: 55, train_loss: 1.0752, test_loss: 1.1530, test_f1: 0.3290
 epoch: 56, train_loss: 1.0761, test_loss: 1.1490, test_f1: 0.3290
 epoch: 57, train_loss: 1.0749, test_loss: 1.1558, test_f1: 0.3290
 epoch: 58, train_loss: 1.0761, test_loss: 1.1494, test_f1: 0.3290
 epoch: 59, train_loss: 1.0775, test_loss: 1.1468, test_f1: 0.3290
 epoch: 60, train_loss: 1.0755, test_loss: 1.1641, test_f1: 0.3290
 epoch: 61, train_loss: 1.0760, test_loss: 1.1455, test_f1: 0.3290
 epoch: 62, train_loss: 1.0734, test_loss: 1.1563, test_f1: 0.3290
 epoch: 63, train_loss: 1.0757, test_loss: 1.1486, test_f1: 0.3290
 epoch: 64, train_loss: 1.0738, test_loss: 1.1525, test_f1: 0.3290
 epoch: 65, train_loss: 1.0738, test_loss: 1.1543, test_f1: 0.3290
 epoch: 66, train_loss: 1.0734, test_loss: 1.1502, test_f1: 0.3290
 epoch: 67, train_loss: 1.0755, test_loss: 1.1525, test_f1: 0.3290
 epoch: 68, train_loss: 1.0741, test_loss: 1.1499, test_f1: 0.3290
 epoch: 69, train_loss: 1.0786, test_loss: 1.1521, test_f1: 0.3290
 epoch: 70, train_loss: 1.0759, test_loss: 1.1536, test_f1: 0.3290
 epoch: 71, train_loss: 1.0793, test_loss: 1.1517, test_f1: 0.3290
 epoch: 72, train_loss: 1.0805, test_loss: 1.1503, test_f1: 0.3290
 epoch: 73, train_loss: 1.0755, test_loss: 1.1575, test_f1: 0.3245
 epoch: 74, train_loss: 1.0758, test_loss: 1.1517, test_f1: 0.3290
 epoch: 75, train_loss: 1.0755, test_loss: 1.1512, test_f1: 0.3290
 epoch: 76, train_loss: 1.0737, test_loss: 1.1555, test_f1: 0.3290
 epoch: 77, train_loss: 1.0731, test_loss: 1.1517, test_f1: 0.3290
 epoch: 78, train_loss: 1.0740, test_loss: 1.1510, test_f1: 0.3290
 epoch: 79, train_loss: 1.0741, test_loss: 1.1545, test_f1: 0.3290
 epoch: 80, train_loss: 1.0732, test_loss: 1.1496, test_f1: 0.3290
 epoch: 81, train_loss: 1.0785, test_loss: 1.1503, test_f1: 0.3290
 epoch: 82, train_loss: 1.0793, test_loss: 1.1531, test_f1: 0.3290
 epoch: 83, train_loss: 1.0760, test_loss: 1.1468, test_f1: 0.3290
 epoch: 84, train_loss: 1.0760, test_loss: 1.1493, test_f1: 0.3290
 epoch: 85, train_loss: 1.0750, test_loss: 1.1515, test_f1: 0.3290
 epoch: 86, train_loss: 1.0747, test_loss: 1.1493, test_f1: 0.3290
 epoch: 87, train_loss: 1.0783, test_loss: 1.1473, test_f1: 0.3290
 epoch: 88, train_loss: 1.0730, test_loss: 1.1547, test_f1: 0.3290
 epoch: 89, train_loss: 1.0742, test_loss: 1.1532, test_f1: 0.3290
 epoch: 90, train_loss: 1.0746, test_loss: 1.1464, test_f1: 0.3290
 epoch: 91, train_loss: 1.0786, test_loss: 1.1492, test_f1: 0.3290
 epoch: 92, train_loss: 1.0747, test_loss: 1.1571, test_f1: 0.3290
 epoch: 93, train_loss: 1.0783, test_loss: 1.1547, test_f1: 0.3290
 epoch: 94, train_loss: 1.0742, test_loss: 1.1495, test_f1: 0.3290
 epoch: 95, train_loss: 1.0731, test_loss: 1.1501, test_f1: 0.3290
 epoch: 96, train_loss: 1.0741, test_loss: 1.1505, test_f1: 0.3290
 epoch: 97, train_loss: 1.0761, test_loss: 1.1546, test_f1: 0.3290
 epoch: 98, train_loss: 1.0849, test_loss: 1.1481, test_f1: 0.3290
 epoch: 99, train_loss: 1.0745, test_loss: 1.1532, test_f1: 0.3290
##################ITERATION #8 ****************************************
 epoch: 0, train_loss: 1.3222, test_loss: 1.3687, test_f1: 0.1365
 epoch: 1, train_loss: 1.2655, test_loss: 1.3029, test_f1: 0.2281
 epoch: 2, train_loss: 1.2693, test_loss: 1.3179, test_f1: 0.2281
 epoch: 3, train_loss: 1.2581, test_loss: 1.3056, test_f1: 0.2281
 epoch: 4, train_loss: 1.2552, test_loss: 1.3038, test_f1: 0.2281
 epoch: 5, train_loss: 1.2544, test_loss: 1.3095, test_f1: 0.2281
 epoch: 6, train_loss: 1.2616, test_loss: 1.3061, test_f1: 0.2281
 epoch: 7, train_loss: 1.2593, test_loss: 1.3343, test_f1: 0.1365
 epoch: 8, train_loss: 1.2681, test_loss: 1.3098, test_f1: 0.2281
 epoch: 9, train_loss: 1.2568, test_loss: 1.3104, test_f1: 0.2281
 epoch: 10, train_loss: 1.2583, test_loss: 1.3125, test_f1: 0.2281
 epoch: 11, train_loss: 1.2604, test_loss: 1.3079, test_f1: 0.2281
 epoch: 12, train_loss: 1.2552, test_loss: 1.3027, test_f1: 0.2281
 epoch: 13, train_loss: 1.2560, test_loss: 1.3062, test_f1: 0.2281
 epoch: 14, train_loss: 1.2596, test_loss: 1.3141, test_f1: 0.2281
 epoch: 15, train_loss: 1.2559, test_loss: 1.3045, test_f1: 0.2281
 epoch: 16, train_loss: 1.2555, test_loss: 1.3065, test_f1: 0.2281
 epoch: 17, train_loss: 1.2548, test_loss: 1.3022, test_f1: 0.2281
 epoch: 18, train_loss: 1.2572, test_loss: 1.3163, test_f1: 0.2281
 epoch: 19, train_loss: 1.2613, test_loss: 1.3059, test_f1: 0.2281
 epoch: 20, train_loss: 1.2599, test_loss: 1.3011, test_f1: 0.2281
 epoch: 21, train_loss: 1.2657, test_loss: 1.3226, test_f1: 0.1365
 epoch: 22, train_loss: 1.2620, test_loss: 1.3031, test_f1: 0.2281
 epoch: 23, train_loss: 1.2550, test_loss: 1.3138, test_f1: 0.2281
 epoch: 24, train_loss: 1.2563, test_loss: 1.3091, test_f1: 0.2281
 epoch: 25, train_loss: 1.2616, test_loss: 1.3012, test_f1: 0.2281
 epoch: 26, train_loss: 1.2603, test_loss: 1.3070, test_f1: 0.2281
 epoch: 27, train_loss: 1.2535, test_loss: 1.3070, test_f1: 0.2281
 epoch: 28, train_loss: 1.2542, test_loss: 1.3058, test_f1: 0.2281
 epoch: 29, train_loss: 1.2609, test_loss: 1.3131, test_f1: 0.2281
 epoch: 30, train_loss: 1.2692, test_loss: 1.3303, test_f1: 0.1365
 epoch: 31, train_loss: 1.2744, test_loss: 1.3083, test_f1: 0.2281
 epoch: 32, train_loss: 1.2568, test_loss: 1.3042, test_f1: 0.2281
 epoch: 33, train_loss: 1.2573, test_loss: 1.3046, test_f1: 0.2281
 epoch: 34, train_loss: 1.2574, test_loss: 1.3093, test_f1: 0.2281
 epoch: 35, train_loss: 1.2578, test_loss: 1.3096, test_f1: 0.2281
 epoch: 36, train_loss: 1.2658, test_loss: 1.3156, test_f1: 0.2281
 epoch: 37, train_loss: 1.2665, test_loss: 1.3092, test_f1: 0.2281
 epoch: 38, train_loss: 1.2524, test_loss: 1.3064, test_f1: 0.2281
 epoch: 39, train_loss: 1.2577, test_loss: 1.3081, test_f1: 0.2281
 epoch: 40, train_loss: 1.2620, test_loss: 1.3087, test_f1: 0.2281
 epoch: 41, train_loss: 1.2528, test_loss: 1.3088, test_f1: 0.2281
 epoch: 42, train_loss: 1.2545, test_loss: 1.3095, test_f1: 0.2281
 epoch: 43, train_loss: 1.2558, test_loss: 1.3073, test_f1: 0.2281
 epoch: 44, train_loss: 1.2548, test_loss: 1.3055, test_f1: 0.2281
 epoch: 45, train_loss: 1.2565, test_loss: 1.3028, test_f1: 0.2281
 epoch: 46, train_loss: 1.2593, test_loss: 1.3078, test_f1: 0.2281
 epoch: 47, train_loss: 1.2587, test_loss: 1.3139, test_f1: 0.2281
 epoch: 48, train_loss: 1.2572, test_loss: 1.3014, test_f1: 0.2281
 epoch: 49, train_loss: 1.2593, test_loss: 1.3138, test_f1: 0.2281
 epoch: 50, train_loss: 1.2543, test_loss: 1.3104, test_f1: 0.1365
 epoch: 51, train_loss: 1.2536, test_loss: 1.3060, test_f1: 0.2281
 epoch: 52, train_loss: 1.2544, test_loss: 1.3068, test_f1: 0.2281
 epoch: 53, train_loss: 1.2537, test_loss: 1.3025, test_f1: 0.2281
 epoch: 54, train_loss: 1.2556, test_loss: 1.3044, test_f1: 0.2281
 epoch: 55, train_loss: 1.2539, test_loss: 1.3053, test_f1: 0.2281
 epoch: 56, train_loss: 1.2549, test_loss: 1.3081, test_f1: 0.2281
 epoch: 57, train_loss: 1.2535, test_loss: 1.3029, test_f1: 0.2281
 epoch: 58, train_loss: 1.2551, test_loss: 1.3056, test_f1: 0.2281
 epoch: 59, train_loss: 1.2534, test_loss: 1.3028, test_f1: 0.2281
 epoch: 60, train_loss: 1.2539, test_loss: 1.3096, test_f1: 0.2281
 epoch: 61, train_loss: 1.2545, test_loss: 1.3008, test_f1: 0.2281
 epoch: 62, train_loss: 1.2534, test_loss: 1.3036, test_f1: 0.2281
 epoch: 63, train_loss: 1.2538, test_loss: 1.3062, test_f1: 0.2281
 epoch: 64, train_loss: 1.2537, test_loss: 1.3038, test_f1: 0.2281
 epoch: 65, train_loss: 1.2548, test_loss: 1.2996, test_f1: 0.2281
 epoch: 66, train_loss: 1.2548, test_loss: 1.3084, test_f1: 0.2281
 epoch: 67, train_loss: 1.2552, test_loss: 1.3076, test_f1: 0.2281
 epoch: 68, train_loss: 1.2532, test_loss: 1.3010, test_f1: 0.2281
 epoch: 69, train_loss: 1.2565, test_loss: 1.3069, test_f1: 0.2281
 epoch: 70, train_loss: 1.2542, test_loss: 1.3075, test_f1: 0.2375
 epoch: 71, train_loss: 1.2534, test_loss: 1.3242, test_f1: 0.2352
 epoch: 72, train_loss: 1.2552, test_loss: 1.3085, test_f1: 0.2281
 epoch: 73, train_loss: 1.2537, test_loss: 1.3035, test_f1: 0.2281
 epoch: 74, train_loss: 1.2555, test_loss: 1.3027, test_f1: 0.2281
 epoch: 75, train_loss: 1.2528, test_loss: 1.3105, test_f1: 0.2281
 epoch: 76, train_loss: 1.2534, test_loss: 1.3049, test_f1: 0.2281
 epoch: 77, train_loss: 1.2541, test_loss: 1.3055, test_f1: 0.2281
 epoch: 78, train_loss: 1.2550, test_loss: 1.3078, test_f1: 0.2281
 epoch: 79, train_loss: 1.2548, test_loss: 1.3015, test_f1: 0.2281
 epoch: 80, train_loss: 1.2539, test_loss: 1.3076, test_f1: 0.2281
 epoch: 81, train_loss: 1.2556, test_loss: 1.3081, test_f1: 0.2281
 epoch: 82, train_loss: 1.2551, test_loss: 1.3051, test_f1: 0.2281
 epoch: 83, train_loss: 1.2547, test_loss: 1.3061, test_f1: 0.2281
 epoch: 84, train_loss: 1.2528, test_loss: 1.3031, test_f1: 0.2281
 epoch: 85, train_loss: 1.2536, test_loss: 1.3063, test_f1: 0.2281
 epoch: 86, train_loss: 1.2546, test_loss: 1.3033, test_f1: 0.2281
 epoch: 87, train_loss: 1.2552, test_loss: 1.3060, test_f1: 0.2281
 epoch: 88, train_loss: 1.2530, test_loss: 1.3024, test_f1: 0.2281
 epoch: 89, train_loss: 1.2536, test_loss: 1.3059, test_f1: 0.2281
 epoch: 90, train_loss: 1.2586, test_loss: 1.3055, test_f1: 0.2281
 epoch: 91, train_loss: 1.2607, test_loss: 1.3067, test_f1: 0.2281
 epoch: 92, train_loss: 1.2563, test_loss: 1.3028, test_f1: 0.2281
 epoch: 93, train_loss: 1.2543, test_loss: 1.3067, test_f1: 0.2281
 epoch: 94, train_loss: 1.2542, test_loss: 1.3027, test_f1: 0.2281
 epoch: 95, train_loss: 1.2526, test_loss: 1.3066, test_f1: 0.2281
 epoch: 96, train_loss: 1.2545, test_loss: 1.3056, test_f1: 0.2281
 epoch: 97, train_loss: 1.2553, test_loss: 1.3043, test_f1: 0.2281
 epoch: 98, train_loss: 1.2532, test_loss: 1.3053, test_f1: 0.2281
 epoch: 99, train_loss: 1.2528, test_loss: 1.3042, test_f1: 0.2281
##################ITERATION #9 ****************************************
 epoch: 0, train_loss: 1.2922, test_loss: 1.3206, test_f1: 0.2281
 epoch: 1, train_loss: 1.2634, test_loss: 1.3069, test_f1: 0.2281
 epoch: 2, train_loss: 1.2581, test_loss: 1.3093, test_f1: 0.1365
 epoch: 3, train_loss: 1.2584, test_loss: 1.3024, test_f1: 0.2281
 epoch: 4, train_loss: 1.2555, test_loss: 1.3049, test_f1: 0.2281
 epoch: 5, train_loss: 1.2545, test_loss: 1.3030, test_f1: 0.2281
 epoch: 6, train_loss: 1.2572, test_loss: 1.3085, test_f1: 0.2281
 epoch: 7, train_loss: 1.2608, test_loss: 1.3100, test_f1: 0.2281
 epoch: 8, train_loss: 1.2550, test_loss: 1.3125, test_f1: 0.2281
 epoch: 9, train_loss: 1.2682, test_loss: 1.3198, test_f1: 0.1365
 epoch: 10, train_loss: 1.2582, test_loss: 1.3036, test_f1: 0.2281
 epoch: 11, train_loss: 1.2536, test_loss: 1.3108, test_f1: 0.2281
 epoch: 12, train_loss: 1.2564, test_loss: 1.3100, test_f1: 0.2281
 epoch: 13, train_loss: 1.2620, test_loss: 1.3100, test_f1: 0.2281
 epoch: 14, train_loss: 1.2583, test_loss: 1.3039, test_f1: 0.2281
 epoch: 15, train_loss: 1.2631, test_loss: 1.3125, test_f1: 0.2281
 epoch: 16, train_loss: 1.2532, test_loss: 1.3042, test_f1: 0.2281
 epoch: 17, train_loss: 1.2550, test_loss: 1.3081, test_f1: 0.2281
 epoch: 18, train_loss: 1.2569, test_loss: 1.3073, test_f1: 0.2281
 epoch: 19, train_loss: 1.2571, test_loss: 1.3093, test_f1: 0.2281
 epoch: 20, train_loss: 1.2564, test_loss: 1.3091, test_f1: 0.2281
 epoch: 21, train_loss: 1.2578, test_loss: 1.3077, test_f1: 0.2281
 epoch: 22, train_loss: 1.2619, test_loss: 1.3131, test_f1: 0.2281
 epoch: 23, train_loss: 1.2588, test_loss: 1.3111, test_f1: 0.2281
 epoch: 24, train_loss: 1.2579, test_loss: 1.3044, test_f1: 0.2281
 epoch: 25, train_loss: 1.2564, test_loss: 1.3063, test_f1: 0.2281
 epoch: 26, train_loss: 1.2572, test_loss: 1.3091, test_f1: 0.2281
 epoch: 27, train_loss: 1.2574, test_loss: 1.3042, test_f1: 0.2281
 epoch: 28, train_loss: 1.2565, test_loss: 1.3084, test_f1: 0.2281
 epoch: 29, train_loss: 1.2577, test_loss: 1.3022, test_f1: 0.2281
 epoch: 30, train_loss: 1.2546, test_loss: 1.3072, test_f1: 0.2281
 epoch: 31, train_loss: 1.2546, test_loss: 1.3105, test_f1: 0.2281
 epoch: 32, train_loss: 1.2608, test_loss: 1.3148, test_f1: 0.2281
 epoch: 33, train_loss: 1.2594, test_loss: 1.3024, test_f1: 0.2281
 epoch: 34, train_loss: 1.2548, test_loss: 1.3064, test_f1: 0.2281
 epoch: 35, train_loss: 1.2560, test_loss: 1.3039, test_f1: 0.2281
 epoch: 36, train_loss: 1.2546, test_loss: 1.3117, test_f1: 0.2281
 epoch: 37, train_loss: 1.2569, test_loss: 1.3039, test_f1: 0.2281
 epoch: 38, train_loss: 1.2619, test_loss: 1.3230, test_f1: 0.2281
 epoch: 39, train_loss: 1.2674, test_loss: 1.3066, test_f1: 0.2281
 epoch: 40, train_loss: 1.2550, test_loss: 1.3227, test_f1: 0.2281
 epoch: 41, train_loss: 1.2624, test_loss: 1.3037, test_f1: 0.2281
 epoch: 42, train_loss: 1.2556, test_loss: 1.3067, test_f1: 0.2281
 epoch: 43, train_loss: 1.2555, test_loss: 1.3123, test_f1: 0.2281
 epoch: 44, train_loss: 1.2588, test_loss: 1.3065, test_f1: 0.2281
 epoch: 45, train_loss: 1.2597, test_loss: 1.3134, test_f1: 0.2281
 epoch: 46, train_loss: 1.2595, test_loss: 1.3019, test_f1: 0.2281
 epoch: 47, train_loss: 1.2577, test_loss: 1.3041, test_f1: 0.2281
 epoch: 48, train_loss: 1.2577, test_loss: 1.3035, test_f1: 0.2281
 epoch: 49, train_loss: 1.2562, test_loss: 1.3049, test_f1: 0.2281
 epoch: 50, train_loss: 1.2540, test_loss: 1.3020, test_f1: 0.2281
 epoch: 51, train_loss: 1.2533, test_loss: 1.3064, test_f1: 0.2281
 epoch: 52, train_loss: 1.2532, test_loss: 1.3023, test_f1: 0.2281
 epoch: 53, train_loss: 1.2554, test_loss: 1.3029, test_f1: 0.2281
 epoch: 54, train_loss: 1.2532, test_loss: 1.3057, test_f1: 0.2281
 epoch: 55, train_loss: 1.2536, test_loss: 1.3037, test_f1: 0.2281
 epoch: 56, train_loss: 1.2566, test_loss: 1.3052, test_f1: 0.2281
 epoch: 57, train_loss: 1.2541, test_loss: 1.3025, test_f1: 0.2281
 epoch: 58, train_loss: 1.2532, test_loss: 1.3064, test_f1: 0.2281
 epoch: 59, train_loss: 1.2538, test_loss: 1.3062, test_f1: 0.2281
 epoch: 60, train_loss: 1.2540, test_loss: 1.3035, test_f1: 0.2281
 epoch: 61, train_loss: 1.2554, test_loss: 1.3012, test_f1: 0.2281
 epoch: 62, train_loss: 1.2536, test_loss: 1.3094, test_f1: 0.2281
 epoch: 63, train_loss: 1.2540, test_loss: 1.3046, test_f1: 0.2281
 epoch: 64, train_loss: 1.2532, test_loss: 1.3063, test_f1: 0.2281
 epoch: 65, train_loss: 1.2530, test_loss: 1.3055, test_f1: 0.2281
 epoch: 66, train_loss: 1.2551, test_loss: 1.3025, test_f1: 0.2281
 epoch: 67, train_loss: 1.2545, test_loss: 1.3057, test_f1: 0.2281
 epoch: 68, train_loss: 1.2545, test_loss: 1.3033, test_f1: 0.2281
 epoch: 69, train_loss: 1.2531, test_loss: 1.3024, test_f1: 0.2281
 epoch: 70, train_loss: 1.2534, test_loss: 1.3070, test_f1: 0.2281
 epoch: 71, train_loss: 1.2544, test_loss: 1.3039, test_f1: 0.2281
 epoch: 72, train_loss: 1.2565, test_loss: 1.3060, test_f1: 0.2281
 epoch: 73, train_loss: 1.2552, test_loss: 1.3017, test_f1: 0.2281
 epoch: 74, train_loss: 1.2539, test_loss: 1.3107, test_f1: 0.2281
 epoch: 75, train_loss: 1.2550, test_loss: 1.3045, test_f1: 0.2281
 epoch: 76, train_loss: 1.2563, test_loss: 1.3023, test_f1: 0.2281
 epoch: 77, train_loss: 1.2525, test_loss: 1.3074, test_f1: 0.2281
 epoch: 78, train_loss: 1.2550, test_loss: 1.3041, test_f1: 0.2281
 epoch: 79, train_loss: 1.2557, test_loss: 1.3045, test_f1: 0.2281
 epoch: 80, train_loss: 1.2540, test_loss: 1.3056, test_f1: 0.2281
 epoch: 81, train_loss: 1.2580, test_loss: 1.3052, test_f1: 0.2281
 epoch: 82, train_loss: 1.2537, test_loss: 1.3043, test_f1: 0.2281
 epoch: 83, train_loss: 1.2549, test_loss: 1.3062, test_f1: 0.2281
 epoch: 84, train_loss: 1.2549, test_loss: 1.3032, test_f1: 0.2281
 epoch: 85, train_loss: 1.2523, test_loss: 1.3013, test_f1: 0.2281
 epoch: 86, train_loss: 1.2528, test_loss: 1.3047, test_f1: 0.2281
 epoch: 87, train_loss: 1.2534, test_loss: 1.3079, test_f1: 0.2281
 epoch: 88, train_loss: 1.2524, test_loss: 1.3018, test_f1: 0.2281
 epoch: 89, train_loss: 1.2535, test_loss: 1.3046, test_f1: 0.2281
 epoch: 90, train_loss: 1.2538, test_loss: 1.3062, test_f1: 0.2281
 epoch: 91, train_loss: 1.2549, test_loss: 1.3049, test_f1: 0.2281
 epoch: 92, train_loss: 1.2529, test_loss: 1.3032, test_f1: 0.2281
 epoch: 93, train_loss: 1.2541, test_loss: 1.3060, test_f1: 0.2281
 epoch: 94, train_loss: 1.2541, test_loss: 1.3035, test_f1: 0.2281
 epoch: 95, train_loss: 1.2526, test_loss: 1.3039, test_f1: 0.2281
 epoch: 96, train_loss: 1.2531, test_loss: 1.3041, test_f1: 0.2281
 epoch: 97, train_loss: 1.2549, test_loss: 1.3071, test_f1: 0.2281
 epoch: 98, train_loss: 1.2549, test_loss: 1.3075, test_f1: 0.2281
 epoch: 99, train_loss: 1.2540, test_loss: 1.3020, test_f1: 0.2281

Training completed in 383.86 seconds
Best F1: 0.5759 at epoch 60
Mean F1 across iterations: 0.3436  0.1069
========================FINAL RESULTS================================
FEGIN weighted F1: 0.5759  0.1069
python main.py --data ltspice_demos --representation component_component --model FEGIN --layers 2 --hiddens 16 --batch_size 128 --lr 0.1 --emb_size 128 --epochs 100 --save_appendix component_component_L2_H16_BS128_LR0.1_E128 --no_val
-----



STDERR:
  File "main.py", line 370, in <module>
    main()
  File "main.py", line 254, in main
    dataset = dataset_class(
  File "/home/philip/projects/ltspice_examples_code_repo/Circuit-Completion-Using-GNNs/component_classification_with_link_prediction_head/evaluation/FEGIN/kernel/circuit_datasets.py", line 15, in __init__
    self.data, self.slices = torch.load(self.processed_paths[0])
  File "/home/philip/.local/lib/python3.8/site-packages/torch/serialization.py", line 1040, in load
    warnings.warn(
  File "/usr/lib/python3.8/warnings.py", line 109, in _showwarnmsg
    sw(msg.message, msg.category, msg.filename, msg.lineno,
  File "main.py", line 47, in warn_with_traceback
    traceback.print_stack(file=log)
/home/philip/projects/ltspice_examples_code_repo/Circuit-Completion-Using-GNNs/component_classification_with_link_prediction_head/evaluation/FEGIN/kernel/circuit_datasets.py:15: FutureWarning: You are using `torch.load` with `weights_only=False` (the current default value), which uses the default pickle module implicitly. It is possible to construct malicious pickle data which will execute arbitrary code during unpickling (See https://github.com/pytorch/pytorch/blob/main/SECURITY.md#untrusted-models for more details). In a future release, the default value for `weights_only` will be flipped to `True`. This limits the functions that could be executed during unpickling. Arbitrary objects will no longer be allowed to be loaded via this mode unless they are explicitly allowlisted by the user via `torch.serialization.add_safe_globals`. We recommend you start setting `weights_only=True` for any use case where you don't have full control of the loaded file. Please open an issue on GitHub for any issues related to this experimental feature.
  self.data, self.slices = torch.load(self.processed_paths[0])
