STDOUT:
Results will be saved in /home/philip/projects/ltspice_examples_code_repo/Circuit-Completion-Using-GNNs/component_classification_with_link_prediction_head/evaluation/FEGIN/results/model_FEGIN_dataset_ltspice_examples
Command line input: python main.py --data ltspice_examples --representation component_pin --model FEGIN --layers 3 --hiddens 64 --batch_size 256 --lr 0.01 --emb_size 250 --epochs 100 --save_appendix component_pin_L3_H64_BS256_LR0.01_E250 --no_val
 is saved.
-----
ltspice_examples - FEGIN
Using 3 layers, 64 hidden units, h = 2
Loading component_pin representation dataset
ENTERED
Training FEGIN on component_pin representation
Train: 3560, Test: 848
##################ITERATION #0 ****************************************
 epoch: 0, train_loss: 1.2560, test_loss: 1.4089, test_f1: 0.2260
 epoch: 1, train_loss: 1.0535, test_loss: 1.0449, test_f1: 0.3651
 epoch: 2, train_loss: 0.9938, test_loss: 0.9937, test_f1: 0.4407
 epoch: 3, train_loss: 0.9513, test_loss: 1.0205, test_f1: 0.5202
 epoch: 4, train_loss: 0.8907, test_loss: 0.9692, test_f1: 0.4716
 epoch: 5, train_loss: 0.8680, test_loss: 1.0003, test_f1: 0.4522
 epoch: 6, train_loss: 0.8663, test_loss: 0.9409, test_f1: 0.5095
 epoch: 7, train_loss: 0.8336, test_loss: 0.9386, test_f1: 0.5423
 epoch: 8, train_loss: 0.8106, test_loss: 1.3019, test_f1: 0.4299
 epoch: 9, train_loss: 0.7952, test_loss: 1.0001, test_f1: 0.4869
 epoch: 10, train_loss: 0.7808, test_loss: 0.9645, test_f1: 0.5219
 epoch: 11, train_loss: 0.7534, test_loss: 0.8897, test_f1: 0.5509
 epoch: 12, train_loss: 0.7509, test_loss: 0.8341, test_f1: 0.5701
 epoch: 13, train_loss: 0.7352, test_loss: 0.9186, test_f1: 0.5167
 epoch: 14, train_loss: 0.7168, test_loss: 0.8018, test_f1: 0.5713
 epoch: 15, train_loss: 0.7184, test_loss: 1.0173, test_f1: 0.5589
 epoch: 16, train_loss: 0.7092, test_loss: 0.9877, test_f1: 0.5763
 epoch: 17, train_loss: 0.7196, test_loss: 0.8985, test_f1: 0.5579
 epoch: 18, train_loss: 0.7068, test_loss: 0.8649, test_f1: 0.6007
 epoch: 19, train_loss: 0.6785, test_loss: 0.8278, test_f1: 0.5761
 epoch: 20, train_loss: 0.6629, test_loss: 0.9287, test_f1: 0.6179
 epoch: 21, train_loss: 0.6526, test_loss: 0.7516, test_f1: 0.5873
 epoch: 22, train_loss: 0.6537, test_loss: 0.8503, test_f1: 0.5949
 epoch: 23, train_loss: 0.6408, test_loss: 0.9205, test_f1: 0.6013
 epoch: 24, train_loss: 0.6618, test_loss: 1.0098, test_f1: 0.5888
 epoch: 25, train_loss: 0.6215, test_loss: 0.8070, test_f1: 0.5978
 epoch: 26, train_loss: 0.6060, test_loss: 0.9951, test_f1: 0.6076
 epoch: 27, train_loss: 0.5949, test_loss: 0.9221, test_f1: 0.6112
 epoch: 28, train_loss: 0.5974, test_loss: 1.0575, test_f1: 0.6164
 epoch: 29, train_loss: 0.5884, test_loss: 0.8857, test_f1: 0.6357
 epoch: 30, train_loss: 0.5995, test_loss: 0.7885, test_f1: 0.6301
 epoch: 31, train_loss: 0.6062, test_loss: 1.2031, test_f1: 0.5790
 epoch: 32, train_loss: 0.5695, test_loss: 0.7713, test_f1: 0.6382
 epoch: 33, train_loss: 0.5636, test_loss: 0.9148, test_f1: 0.6074
 epoch: 34, train_loss: 0.5762, test_loss: 0.7305, test_f1: 0.6216
 epoch: 35, train_loss: 0.5799, test_loss: 0.9247, test_f1: 0.6321
 epoch: 36, train_loss: 0.5734, test_loss: 0.7434, test_f1: 0.6181
 epoch: 37, train_loss: 0.5222, test_loss: 0.9023, test_f1: 0.5990
 epoch: 38, train_loss: 0.5203, test_loss: 0.8305, test_f1: 0.6421
 epoch: 39, train_loss: 0.5471, test_loss: 0.8488, test_f1: 0.5863
 epoch: 40, train_loss: 0.5279, test_loss: 1.0556, test_f1: 0.5997
 epoch: 41, train_loss: 0.4980, test_loss: 0.9377, test_f1: 0.6266
 epoch: 42, train_loss: 0.5018, test_loss: 0.9063, test_f1: 0.6391
 epoch: 43, train_loss: 0.5079, test_loss: 0.9974, test_f1: 0.6420
 epoch: 44, train_loss: 0.5068, test_loss: 0.8097, test_f1: 0.6089
 epoch: 45, train_loss: 0.4812, test_loss: 0.9229, test_f1: 0.6637
 epoch: 46, train_loss: 0.4669, test_loss: 0.8104, test_f1: 0.6426
 epoch: 47, train_loss: 0.4727, test_loss: 0.8269, test_f1: 0.6440
 epoch: 48, train_loss: 0.4655, test_loss: 0.8594, test_f1: 0.6291
 epoch: 49, train_loss: 0.4535, test_loss: 0.9009, test_f1: 0.6336
 epoch: 50, train_loss: 0.4588, test_loss: 1.0224, test_f1: 0.6255
 epoch: 51, train_loss: 0.4460, test_loss: 0.7743, test_f1: 0.6870
 epoch: 52, train_loss: 0.4018, test_loss: 0.8159, test_f1: 0.6775
 epoch: 53, train_loss: 0.3837, test_loss: 0.8745, test_f1: 0.6540
 epoch: 54, train_loss: 0.3753, test_loss: 0.8693, test_f1: 0.6707
 epoch: 55, train_loss: 0.3669, test_loss: 0.9493, test_f1: 0.6622
 epoch: 56, train_loss: 0.3604, test_loss: 1.0490, test_f1: 0.6438
 epoch: 57, train_loss: 0.3486, test_loss: 0.8634, test_f1: 0.6683
 epoch: 58, train_loss: 0.3539, test_loss: 0.8789, test_f1: 0.6917
 epoch: 59, train_loss: 0.3373, test_loss: 1.1438, test_f1: 0.6562
 epoch: 60, train_loss: 0.3435, test_loss: 0.8704, test_f1: 0.6948
 epoch: 61, train_loss: 0.3641, test_loss: 0.9239, test_f1: 0.6700
 epoch: 62, train_loss: 0.3511, test_loss: 0.8676, test_f1: 0.6387
 epoch: 63, train_loss: 0.3295, test_loss: 0.9623, test_f1: 0.6675
 epoch: 64, train_loss: 0.3285, test_loss: 1.1422, test_f1: 0.6344
 epoch: 65, train_loss: 0.3253, test_loss: 0.8268, test_f1: 0.6768
 epoch: 66, train_loss: 0.3257, test_loss: 1.0683, test_f1: 0.6538
 epoch: 67, train_loss: 0.3365, test_loss: 0.9431, test_f1: 0.6797
 epoch: 68, train_loss: 0.3405, test_loss: 1.0797, test_f1: 0.6485
 epoch: 69, train_loss: 0.3080, test_loss: 1.0170, test_f1: 0.6477
 epoch: 70, train_loss: 0.3143, test_loss: 1.1414, test_f1: 0.6739
 epoch: 71, train_loss: 0.3033, test_loss: 0.9392, test_f1: 0.6606
 epoch: 72, train_loss: 0.3224, test_loss: 0.9725, test_f1: 0.6704
 epoch: 73, train_loss: 0.3174, test_loss: 1.3078, test_f1: 0.6335
 epoch: 74, train_loss: 0.3208, test_loss: 1.1128, test_f1: 0.6808
 epoch: 75, train_loss: 0.3333, test_loss: 0.9669, test_f1: 0.6797
 epoch: 76, train_loss: 0.3173, test_loss: 0.9730, test_f1: 0.6600
 epoch: 77, train_loss: 0.3049, test_loss: 0.9003, test_f1: 0.6676
 epoch: 78, train_loss: 0.2790, test_loss: 0.9824, test_f1: 0.6641
 epoch: 79, train_loss: 0.2753, test_loss: 1.0912, test_f1: 0.6635
 epoch: 80, train_loss: 0.2795, test_loss: 1.0130, test_f1: 0.6958
 epoch: 81, train_loss: 0.2584, test_loss: 1.0128, test_f1: 0.6649
 epoch: 82, train_loss: 0.2591, test_loss: 1.0625, test_f1: 0.6714
 epoch: 83, train_loss: 0.2785, test_loss: 1.2244, test_f1: 0.6648
 epoch: 84, train_loss: 0.2886, test_loss: 0.9401, test_f1: 0.6644
 epoch: 85, train_loss: 0.2767, test_loss: 1.3995, test_f1: 0.6469
 epoch: 86, train_loss: 0.2783, test_loss: 1.1504, test_f1: 0.6800
 epoch: 87, train_loss: 0.2756, test_loss: 1.2806, test_f1: 0.6612
 epoch: 88, train_loss: 0.2856, test_loss: 1.1105, test_f1: 0.6777
 epoch: 89, train_loss: 0.2711, test_loss: 0.8938, test_f1: 0.6922
 epoch: 90, train_loss: 0.2744, test_loss: 1.2320, test_f1: 0.6589
 epoch: 91, train_loss: 0.2559, test_loss: 1.1812, test_f1: 0.6468
 epoch: 92, train_loss: 0.2868, test_loss: 1.0726, test_f1: 0.6730
 epoch: 93, train_loss: 0.2769, test_loss: 1.1278, test_f1: 0.6867
 epoch: 94, train_loss: 0.2506, test_loss: 1.1536, test_f1: 0.6421
 epoch: 95, train_loss: 0.2540, test_loss: 1.0070, test_f1: 0.6717
 epoch: 96, train_loss: 0.2530, test_loss: 1.0194, test_f1: 0.6794
 epoch: 97, train_loss: 0.2457, test_loss: 1.1454, test_f1: 0.6819
 epoch: 98, train_loss: 0.2535, test_loss: 1.6217, test_f1: 0.6474
 epoch: 99, train_loss: 0.2447, test_loss: 0.9785, test_f1: 0.6929
##################ITERATION #1 ****************************************
 epoch: 0, train_loss: 1.1749, test_loss: 1.3019, test_f1: 0.2396
 epoch: 1, train_loss: 1.0152, test_loss: 1.0396, test_f1: 0.3601
 epoch: 2, train_loss: 1.0004, test_loss: 1.0163, test_f1: 0.4049
 epoch: 3, train_loss: 0.9410, test_loss: 1.1867, test_f1: 0.4075
 epoch: 4, train_loss: 0.9184, test_loss: 1.0344, test_f1: 0.4188
 epoch: 5, train_loss: 0.8945, test_loss: 0.9978, test_f1: 0.5116
 epoch: 6, train_loss: 0.8703, test_loss: 0.8333, test_f1: 0.5862
 epoch: 7, train_loss: 0.8767, test_loss: 1.0198, test_f1: 0.5136
 epoch: 8, train_loss: 0.8341, test_loss: 0.9284, test_f1: 0.5248
 epoch: 9, train_loss: 0.8112, test_loss: 1.0250, test_f1: 0.5233
 epoch: 10, train_loss: 0.8063, test_loss: 0.8370, test_f1: 0.5621
 epoch: 11, train_loss: 0.7833, test_loss: 0.9197, test_f1: 0.5888
 epoch: 12, train_loss: 0.7909, test_loss: 1.0979, test_f1: 0.4780
 epoch: 13, train_loss: 0.7743, test_loss: 0.9257, test_f1: 0.5928
 epoch: 14, train_loss: 0.7393, test_loss: 0.9503, test_f1: 0.5554
 epoch: 15, train_loss: 0.7323, test_loss: 0.7795, test_f1: 0.5963
 epoch: 16, train_loss: 0.7324, test_loss: 0.8178, test_f1: 0.5812
 epoch: 17, train_loss: 0.7190, test_loss: 0.9735, test_f1: 0.5397
 epoch: 18, train_loss: 0.7362, test_loss: 0.8081, test_f1: 0.5867
 epoch: 19, train_loss: 0.7223, test_loss: 0.8667, test_f1: 0.6049
 epoch: 20, train_loss: 0.6876, test_loss: 0.7739, test_f1: 0.5857
 epoch: 21, train_loss: 0.6899, test_loss: 0.9272, test_f1: 0.5993
 epoch: 22, train_loss: 0.7236, test_loss: 0.7342, test_f1: 0.6226
 epoch: 23, train_loss: 0.6834, test_loss: 1.2547, test_f1: 0.5086
 epoch: 24, train_loss: 0.6662, test_loss: 0.9185, test_f1: 0.5605
 epoch: 25, train_loss: 0.6600, test_loss: 0.9573, test_f1: 0.5705
 epoch: 26, train_loss: 0.6521, test_loss: 0.7990, test_f1: 0.6125
 epoch: 27, train_loss: 0.6548, test_loss: 1.0048, test_f1: 0.5464
 epoch: 28, train_loss: 0.6596, test_loss: 0.9811, test_f1: 0.5620
 epoch: 29, train_loss: 0.6439, test_loss: 0.8825, test_f1: 0.6253
 epoch: 30, train_loss: 0.6299, test_loss: 0.7122, test_f1: 0.6286
 epoch: 31, train_loss: 0.6330, test_loss: 0.9105, test_f1: 0.5839
 epoch: 32, train_loss: 0.6156, test_loss: 1.1778, test_f1: 0.6365
 epoch: 33, train_loss: 0.6228, test_loss: 1.1800, test_f1: 0.5864
 epoch: 34, train_loss: 0.6253, test_loss: 0.9376, test_f1: 0.5905
 epoch: 35, train_loss: 0.6051, test_loss: 0.8395, test_f1: 0.6168
 epoch: 36, train_loss: 0.5934, test_loss: 0.9377, test_f1: 0.5643
 epoch: 37, train_loss: 0.5865, test_loss: 0.9402, test_f1: 0.6361
 epoch: 38, train_loss: 0.5659, test_loss: 1.0874, test_f1: 0.6063
 epoch: 39, train_loss: 0.5557, test_loss: 0.9495, test_f1: 0.5866
 epoch: 40, train_loss: 0.5735, test_loss: 0.8983, test_f1: 0.6257
 epoch: 41, train_loss: 0.5529, test_loss: 1.1328, test_f1: 0.5941
 epoch: 42, train_loss: 0.5506, test_loss: 0.9796, test_f1: 0.6396
 epoch: 43, train_loss: 0.5664, test_loss: 1.1001, test_f1: 0.6160
 epoch: 44, train_loss: 0.5603, test_loss: 0.8441, test_f1: 0.5997
 epoch: 45, train_loss: 0.5428, test_loss: 1.0848, test_f1: 0.5380
 epoch: 46, train_loss: 0.5599, test_loss: 1.0404, test_f1: 0.5997
 epoch: 47, train_loss: 0.5467, test_loss: 1.0638, test_f1: 0.5859
 epoch: 48, train_loss: 0.5259, test_loss: 1.0139, test_f1: 0.6167
 epoch: 49, train_loss: 0.5309, test_loss: 1.1247, test_f1: 0.5693
 epoch: 50, train_loss: 0.5383, test_loss: 0.7976, test_f1: 0.6494
 epoch: 51, train_loss: 0.4992, test_loss: 0.9113, test_f1: 0.6364
 epoch: 52, train_loss: 0.4725, test_loss: 0.9504, test_f1: 0.6309
 epoch: 53, train_loss: 0.4515, test_loss: 1.0660, test_f1: 0.6300
 epoch: 54, train_loss: 0.4369, test_loss: 0.9957, test_f1: 0.6424
 epoch: 55, train_loss: 0.4402, test_loss: 0.9620, test_f1: 0.6482
 epoch: 56, train_loss: 0.4479, test_loss: 0.9766, test_f1: 0.6472
 epoch: 57, train_loss: 0.4373, test_loss: 0.9747, test_f1: 0.6404
 epoch: 58, train_loss: 0.4113, test_loss: 1.1628, test_f1: 0.6259
 epoch: 59, train_loss: 0.4136, test_loss: 0.9785, test_f1: 0.6546
 epoch: 60, train_loss: 0.4273, test_loss: 1.2665, test_f1: 0.6070
 epoch: 61, train_loss: 0.4157, test_loss: 0.9656, test_f1: 0.6599
 epoch: 62, train_loss: 0.4033, test_loss: 1.1433, test_f1: 0.6360
 epoch: 63, train_loss: 0.4062, test_loss: 1.0093, test_f1: 0.6315
 epoch: 64, train_loss: 0.3919, test_loss: 0.9062, test_f1: 0.6579
 epoch: 65, train_loss: 0.3856, test_loss: 1.1897, test_f1: 0.6236
 epoch: 66, train_loss: 0.3857, test_loss: 1.1314, test_f1: 0.6386
 epoch: 67, train_loss: 0.3895, test_loss: 1.1516, test_f1: 0.6362
 epoch: 68, train_loss: 0.3914, test_loss: 1.0286, test_f1: 0.6434
 epoch: 69, train_loss: 0.3830, test_loss: 1.0779, test_f1: 0.6279
 epoch: 70, train_loss: 0.3693, test_loss: 1.0970, test_f1: 0.6590
 epoch: 71, train_loss: 0.3735, test_loss: 1.2201, test_f1: 0.6679
 epoch: 72, train_loss: 0.3767, test_loss: 1.3087, test_f1: 0.6222
 epoch: 73, train_loss: 0.3897, test_loss: 0.9900, test_f1: 0.6672
 epoch: 74, train_loss: 0.3681, test_loss: 1.0772, test_f1: 0.6712
 epoch: 75, train_loss: 0.3577, test_loss: 1.4867, test_f1: 0.6041
 epoch: 76, train_loss: 0.3648, test_loss: 1.2494, test_f1: 0.6312
 epoch: 77, train_loss: 0.3635, test_loss: 1.3106, test_f1: 0.6352
 epoch: 78, train_loss: 0.3579, test_loss: 1.2190, test_f1: 0.6428
 epoch: 79, train_loss: 0.3632, test_loss: 1.1666, test_f1: 0.6131
 epoch: 80, train_loss: 0.3555, test_loss: 1.3219, test_f1: 0.6279
 epoch: 81, train_loss: 0.3584, test_loss: 1.1226, test_f1: 0.6492
 epoch: 82, train_loss: 0.3393, test_loss: 1.1732, test_f1: 0.6341
 epoch: 83, train_loss: 0.3515, test_loss: 1.1408, test_f1: 0.6532
 epoch: 84, train_loss: 0.3302, test_loss: 1.3893, test_f1: 0.6415
 epoch: 85, train_loss: 0.3484, test_loss: 1.4166, test_f1: 0.6044
 epoch: 86, train_loss: 0.3524, test_loss: 1.1379, test_f1: 0.6642
 epoch: 87, train_loss: 0.3449, test_loss: 1.4288, test_f1: 0.6277
 epoch: 88, train_loss: 0.3531, test_loss: 1.2802, test_f1: 0.6396
 epoch: 89, train_loss: 0.3422, test_loss: 1.2567, test_f1: 0.6314
 epoch: 90, train_loss: 0.3436, test_loss: 1.2652, test_f1: 0.6288
 epoch: 91, train_loss: 0.3386, test_loss: 1.4688, test_f1: 0.6283
 epoch: 92, train_loss: 0.3167, test_loss: 1.1706, test_f1: 0.6662
 epoch: 93, train_loss: 0.3278, test_loss: 1.3291, test_f1: 0.6570
 epoch: 94, train_loss: 0.3154, test_loss: 1.3938, test_f1: 0.6415
 epoch: 95, train_loss: 0.3035, test_loss: 1.3705, test_f1: 0.6481
 epoch: 96, train_loss: 0.3170, test_loss: 1.7609, test_f1: 0.6193
 epoch: 97, train_loss: 0.3243, test_loss: 1.2542, test_f1: 0.6568
 epoch: 98, train_loss: 0.3193, test_loss: 1.2855, test_f1: 0.6584
 epoch: 99, train_loss: 0.3115, test_loss: 1.5139, test_f1: 0.6085
##################ITERATION #2 ****************************************
 epoch: 0, train_loss: 1.3641, test_loss: 1.2053, test_f1: 0.3520
 epoch: 1, train_loss: 0.9974, test_loss: 1.0466, test_f1: 0.3709
 epoch: 2, train_loss: 0.9430, test_loss: 1.0331, test_f1: 0.4912
 epoch: 3, train_loss: 0.9198, test_loss: 0.9912, test_f1: 0.4653
 epoch: 4, train_loss: 0.8994, test_loss: 1.1937, test_f1: 0.4212
 epoch: 5, train_loss: 0.8854, test_loss: 0.9700, test_f1: 0.5356
 epoch: 6, train_loss: 0.8575, test_loss: 1.0055, test_f1: 0.4802
 epoch: 7, train_loss: 0.8314, test_loss: 1.0260, test_f1: 0.4939
 epoch: 8, train_loss: 0.8269, test_loss: 0.9469, test_f1: 0.5052
 epoch: 9, train_loss: 0.8204, test_loss: 0.8962, test_f1: 0.5964
 epoch: 10, train_loss: 0.7925, test_loss: 0.9370, test_f1: 0.5248
 epoch: 11, train_loss: 0.7648, test_loss: 0.8798, test_f1: 0.6171
 epoch: 12, train_loss: 0.7381, test_loss: 0.8271, test_f1: 0.5970
 epoch: 13, train_loss: 0.7386, test_loss: 0.8371, test_f1: 0.5841
 epoch: 14, train_loss: 0.7324, test_loss: 0.9638, test_f1: 0.5699
 epoch: 15, train_loss: 0.7154, test_loss: 0.9714, test_f1: 0.5392
 epoch: 16, train_loss: 0.6942, test_loss: 1.0371, test_f1: 0.5434
 epoch: 17, train_loss: 0.6893, test_loss: 1.0043, test_f1: 0.5887
 epoch: 18, train_loss: 0.6756, test_loss: 0.9368, test_f1: 0.5448
 epoch: 19, train_loss: 0.6732, test_loss: 1.0198, test_f1: 0.5295
 epoch: 20, train_loss: 0.6666, test_loss: 0.8591, test_f1: 0.5441
 epoch: 21, train_loss: 0.6660, test_loss: 0.9344, test_f1: 0.5863
 epoch: 22, train_loss: 0.6689, test_loss: 0.8958, test_f1: 0.5940
 epoch: 23, train_loss: 0.6471, test_loss: 0.9350, test_f1: 0.5755
 epoch: 24, train_loss: 0.6343, test_loss: 0.9141, test_f1: 0.5832
 epoch: 25, train_loss: 0.6359, test_loss: 0.9128, test_f1: 0.5858
 epoch: 26, train_loss: 0.6105, test_loss: 1.0237, test_f1: 0.5858
 epoch: 27, train_loss: 0.6307, test_loss: 0.9919, test_f1: 0.5670
 epoch: 28, train_loss: 0.6183, test_loss: 0.9876, test_f1: 0.6327
 epoch: 29, train_loss: 0.6091, test_loss: 1.0032, test_f1: 0.5586
 epoch: 30, train_loss: 0.6071, test_loss: 1.0452, test_f1: 0.5895
 epoch: 31, train_loss: 0.6016, test_loss: 0.9126, test_f1: 0.6105
 epoch: 32, train_loss: 0.5759, test_loss: 0.8695, test_f1: 0.6389
 epoch: 33, train_loss: 0.5611, test_loss: 1.1704, test_f1: 0.5556
 epoch: 34, train_loss: 0.5497, test_loss: 0.9051, test_f1: 0.6352
 epoch: 35, train_loss: 0.5808, test_loss: 1.0349, test_f1: 0.5821
 epoch: 36, train_loss: 0.5691, test_loss: 0.9664, test_f1: 0.6026
 epoch: 37, train_loss: 0.5717, test_loss: 1.0932, test_f1: 0.5613
 epoch: 38, train_loss: 0.5812, test_loss: 1.0804, test_f1: 0.6084
 epoch: 39, train_loss: 0.5672, test_loss: 1.0868, test_f1: 0.6178
 epoch: 40, train_loss: 0.5372, test_loss: 1.0746, test_f1: 0.6168
 epoch: 41, train_loss: 0.5172, test_loss: 1.0069, test_f1: 0.6223
 epoch: 42, train_loss: 0.5248, test_loss: 1.0595, test_f1: 0.6222
 epoch: 43, train_loss: 0.5059, test_loss: 1.0526, test_f1: 0.5829
 epoch: 44, train_loss: 0.5113, test_loss: 0.9819, test_f1: 0.6396
 epoch: 45, train_loss: 0.5232, test_loss: 1.1046, test_f1: 0.6308
 epoch: 46, train_loss: 0.5280, test_loss: 0.9719, test_f1: 0.5716
 epoch: 47, train_loss: 0.5473, test_loss: 1.7462, test_f1: 0.5103
 epoch: 48, train_loss: 0.5142, test_loss: 1.0795, test_f1: 0.6242
 epoch: 49, train_loss: 0.4819, test_loss: 0.9082, test_f1: 0.6623
 epoch: 50, train_loss: 0.4987, test_loss: 1.3589, test_f1: 0.5984
 epoch: 51, train_loss: 0.4653, test_loss: 0.9225, test_f1: 0.6672
 epoch: 52, train_loss: 0.4308, test_loss: 1.0112, test_f1: 0.6433
 epoch: 53, train_loss: 0.4139, test_loss: 0.9635, test_f1: 0.6675
 epoch: 54, train_loss: 0.4052, test_loss: 1.0452, test_f1: 0.6488
 epoch: 55, train_loss: 0.3855, test_loss: 1.1315, test_f1: 0.6446
 epoch: 56, train_loss: 0.3966, test_loss: 1.1088, test_f1: 0.6562
 epoch: 57, train_loss: 0.3985, test_loss: 1.2281, test_f1: 0.6365
 epoch: 58, train_loss: 0.3955, test_loss: 1.1515, test_f1: 0.6585
 epoch: 59, train_loss: 0.3897, test_loss: 1.1416, test_f1: 0.6399
 epoch: 60, train_loss: 0.3816, test_loss: 1.1754, test_f1: 0.6522
 epoch: 61, train_loss: 0.3967, test_loss: 1.2758, test_f1: 0.6006
 epoch: 62, train_loss: 0.3852, test_loss: 1.1338, test_f1: 0.6421
 epoch: 63, train_loss: 0.3747, test_loss: 1.2810, test_f1: 0.6361
 epoch: 64, train_loss: 0.3669, test_loss: 1.0668, test_f1: 0.6581
 epoch: 65, train_loss: 0.3708, test_loss: 1.3991, test_f1: 0.6199
 epoch: 66, train_loss: 0.3644, test_loss: 1.1699, test_f1: 0.6529
 epoch: 67, train_loss: 0.3541, test_loss: 1.2966, test_f1: 0.6279
 epoch: 68, train_loss: 0.3540, test_loss: 1.1991, test_f1: 0.6466
 epoch: 69, train_loss: 0.3770, test_loss: 1.2106, test_f1: 0.6600
 epoch: 70, train_loss: 0.3568, test_loss: 1.3541, test_f1: 0.6489
 epoch: 71, train_loss: 0.3433, test_loss: 1.0955, test_f1: 0.6798
 epoch: 72, train_loss: 0.3429, test_loss: 1.2793, test_f1: 0.6646
 epoch: 73, train_loss: 0.3444, test_loss: 1.3468, test_f1: 0.6416
 epoch: 74, train_loss: 0.3348, test_loss: 1.2968, test_f1: 0.6431
 epoch: 75, train_loss: 0.3550, test_loss: 1.2711, test_f1: 0.6357
 epoch: 76, train_loss: 0.3842, test_loss: 1.2365, test_f1: 0.6377
 epoch: 77, train_loss: 0.3595, test_loss: 1.1878, test_f1: 0.6865
 epoch: 78, train_loss: 0.3422, test_loss: 1.2339, test_f1: 0.6551
 epoch: 79, train_loss: 0.3323, test_loss: 1.2824, test_f1: 0.6315
 epoch: 80, train_loss: 0.3221, test_loss: 1.2606, test_f1: 0.6727
 epoch: 81, train_loss: 0.3102, test_loss: 1.3670, test_f1: 0.6344
 epoch: 82, train_loss: 0.3245, test_loss: 1.4403, test_f1: 0.6697
 epoch: 83, train_loss: 0.3540, test_loss: 1.4454, test_f1: 0.6329
 epoch: 84, train_loss: 0.3229, test_loss: 1.2202, test_f1: 0.6791
 epoch: 85, train_loss: 0.3064, test_loss: 1.4413, test_f1: 0.6586
 epoch: 86, train_loss: 0.3125, test_loss: 1.4104, test_f1: 0.6014
 epoch: 87, train_loss: 0.3136, test_loss: 1.2610, test_f1: 0.6897
 epoch: 88, train_loss: 0.3092, test_loss: 1.4296, test_f1: 0.6489
 epoch: 89, train_loss: 0.3112, test_loss: 1.3890, test_f1: 0.6211
 epoch: 90, train_loss: 0.3098, test_loss: 1.3482, test_f1: 0.6579
 epoch: 91, train_loss: 0.2958, test_loss: 1.4691, test_f1: 0.6107
 epoch: 92, train_loss: 0.2925, test_loss: 1.6707, test_f1: 0.6313
 epoch: 93, train_loss: 0.3342, test_loss: 1.4510, test_f1: 0.6571
 epoch: 94, train_loss: 0.3067, test_loss: 1.3490, test_f1: 0.6591
 epoch: 95, train_loss: 0.2943, test_loss: 1.3266, test_f1: 0.6492
 epoch: 96, train_loss: 0.3067, test_loss: 1.6050, test_f1: 0.6704
 epoch: 97, train_loss: 0.3028, test_loss: 1.5941, test_f1: 0.6160
 epoch: 98, train_loss: 0.2893, test_loss: 1.6960, test_f1: 0.6470
 epoch: 99, train_loss: 0.2875, test_loss: 1.7092, test_f1: 0.6548
##################ITERATION #3 ****************************************
 epoch: 0, train_loss: 1.6645, test_loss: 1.2196, test_f1: 0.3032
 epoch: 1, train_loss: 1.0259, test_loss: 1.0978, test_f1: 0.3770
 epoch: 2, train_loss: 0.9841, test_loss: 1.1972, test_f1: 0.3909
 epoch: 3, train_loss: 0.9516, test_loss: 1.0254, test_f1: 0.4678
 epoch: 4, train_loss: 0.9459, test_loss: 1.1422, test_f1: 0.4304
 epoch: 5, train_loss: 0.9224, test_loss: 1.0278, test_f1: 0.4781
 epoch: 6, train_loss: 0.9026, test_loss: 1.0234, test_f1: 0.4861
 epoch: 7, train_loss: 0.8931, test_loss: 0.9877, test_f1: 0.4836
 epoch: 8, train_loss: 0.8771, test_loss: 0.9801, test_f1: 0.4928
 epoch: 9, train_loss: 0.8412, test_loss: 1.1675, test_f1: 0.4492
 epoch: 10, train_loss: 0.8352, test_loss: 0.9927, test_f1: 0.5083
 epoch: 11, train_loss: 0.8232, test_loss: 1.0003, test_f1: 0.4349
 epoch: 12, train_loss: 0.8034, test_loss: 1.1644, test_f1: 0.4452
 epoch: 13, train_loss: 0.7968, test_loss: 1.0814, test_f1: 0.4967
 epoch: 14, train_loss: 0.7912, test_loss: 0.9808, test_f1: 0.5562
 epoch: 15, train_loss: 0.7664, test_loss: 0.9006, test_f1: 0.5316
 epoch: 16, train_loss: 0.7775, test_loss: 1.1014, test_f1: 0.4255
 epoch: 17, train_loss: 0.7765, test_loss: 1.0012, test_f1: 0.4597
 epoch: 18, train_loss: 0.7556, test_loss: 0.9267, test_f1: 0.5337
 epoch: 19, train_loss: 0.7243, test_loss: 0.8578, test_f1: 0.5953
 epoch: 20, train_loss: 0.7265, test_loss: 0.9158, test_f1: 0.5412
 epoch: 21, train_loss: 0.7208, test_loss: 0.9722, test_f1: 0.5203
 epoch: 22, train_loss: 0.7011, test_loss: 0.9302, test_f1: 0.5465
 epoch: 23, train_loss: 0.7041, test_loss: 0.8554, test_f1: 0.5472
 epoch: 24, train_loss: 0.6911, test_loss: 0.9889, test_f1: 0.5527
 epoch: 25, train_loss: 0.6801, test_loss: 0.9010, test_f1: 0.5628
 epoch: 26, train_loss: 0.6748, test_loss: 0.8676, test_f1: 0.5654
 epoch: 27, train_loss: 0.6512, test_loss: 1.2210, test_f1: 0.5087
 epoch: 28, train_loss: 0.6730, test_loss: 0.9954, test_f1: 0.5543
 epoch: 29, train_loss: 0.6500, test_loss: 1.0493, test_f1: 0.5202
 epoch: 30, train_loss: 0.6364, test_loss: 0.8489, test_f1: 0.6037
 epoch: 31, train_loss: 0.6340, test_loss: 0.9118, test_f1: 0.5796
 epoch: 32, train_loss: 0.6212, test_loss: 0.8731, test_f1: 0.5826
 epoch: 33, train_loss: 0.6320, test_loss: 0.8396, test_f1: 0.6113
 epoch: 34, train_loss: 0.5996, test_loss: 0.9012, test_f1: 0.6057
 epoch: 35, train_loss: 0.5792, test_loss: 1.1300, test_f1: 0.5263
 epoch: 36, train_loss: 0.6249, test_loss: 1.2435, test_f1: 0.4970
 epoch: 37, train_loss: 0.6238, test_loss: 0.9120, test_f1: 0.5990
 epoch: 38, train_loss: 0.5990, test_loss: 0.8297, test_f1: 0.6360
 epoch: 39, train_loss: 0.5862, test_loss: 1.1638, test_f1: 0.5206
 epoch: 40, train_loss: 0.6040, test_loss: 0.9531, test_f1: 0.5490
 epoch: 41, train_loss: 0.5987, test_loss: 0.8688, test_f1: 0.6228
 epoch: 42, train_loss: 0.5779, test_loss: 0.9280, test_f1: 0.6262
 epoch: 43, train_loss: 0.5548, test_loss: 0.8852, test_f1: 0.6166
 epoch: 44, train_loss: 0.5479, test_loss: 1.0384, test_f1: 0.5937
 epoch: 45, train_loss: 0.5303, test_loss: 1.0340, test_f1: 0.5436
 epoch: 46, train_loss: 0.5428, test_loss: 0.9902, test_f1: 0.5935
 epoch: 47, train_loss: 0.5419, test_loss: 1.0576, test_f1: 0.5869
 epoch: 48, train_loss: 0.5504, test_loss: 0.9918, test_f1: 0.5721
 epoch: 49, train_loss: 0.5425, test_loss: 1.0128, test_f1: 0.5862
 epoch: 50, train_loss: 0.5230, test_loss: 0.9096, test_f1: 0.6128
 epoch: 51, train_loss: 0.5050, test_loss: 0.9176, test_f1: 0.6188
 epoch: 52, train_loss: 0.4916, test_loss: 0.8956, test_f1: 0.6273
 epoch: 53, train_loss: 0.4633, test_loss: 0.9815, test_f1: 0.6190
 epoch: 54, train_loss: 0.4575, test_loss: 0.9327, test_f1: 0.6122
 epoch: 55, train_loss: 0.4514, test_loss: 0.9413, test_f1: 0.6052
 epoch: 56, train_loss: 0.4256, test_loss: 1.0474, test_f1: 0.6094
 epoch: 57, train_loss: 0.4326, test_loss: 1.0306, test_f1: 0.5877
 epoch: 58, train_loss: 0.4417, test_loss: 0.9861, test_f1: 0.5986
 epoch: 59, train_loss: 0.4283, test_loss: 0.9311, test_f1: 0.6048
 epoch: 60, train_loss: 0.4096, test_loss: 1.0583, test_f1: 0.6384
 epoch: 61, train_loss: 0.3895, test_loss: 1.0838, test_f1: 0.5875
 epoch: 62, train_loss: 0.3991, test_loss: 1.0511, test_f1: 0.6226
 epoch: 63, train_loss: 0.3937, test_loss: 1.0459, test_f1: 0.6380
 epoch: 64, train_loss: 0.4021, test_loss: 0.9960, test_f1: 0.6192
 epoch: 65, train_loss: 0.3960, test_loss: 0.9006, test_f1: 0.6566
 epoch: 66, train_loss: 0.3796, test_loss: 1.1610, test_f1: 0.6313
 epoch: 67, train_loss: 0.3936, test_loss: 0.9684, test_f1: 0.6502
 epoch: 68, train_loss: 0.3968, test_loss: 1.1062, test_f1: 0.6192
 epoch: 69, train_loss: 0.3985, test_loss: 1.1705, test_f1: 0.6151
 epoch: 70, train_loss: 0.3720, test_loss: 1.0287, test_f1: 0.6166
 epoch: 71, train_loss: 0.3654, test_loss: 1.0173, test_f1: 0.6538
 epoch: 72, train_loss: 0.3695, test_loss: 1.0243, test_f1: 0.6300
 epoch: 73, train_loss: 0.3627, test_loss: 1.0965, test_f1: 0.6238
 epoch: 74, train_loss: 0.3673, test_loss: 1.2187, test_f1: 0.6097
 epoch: 75, train_loss: 0.3708, test_loss: 1.1457, test_f1: 0.6162
 epoch: 76, train_loss: 0.3640, test_loss: 1.0412, test_f1: 0.6363
 epoch: 77, train_loss: 0.3749, test_loss: 1.2103, test_f1: 0.6070
 epoch: 78, train_loss: 0.3548, test_loss: 1.0832, test_f1: 0.5898
 epoch: 79, train_loss: 0.3494, test_loss: 1.2363, test_f1: 0.6033
 epoch: 80, train_loss: 0.3562, test_loss: 1.1299, test_f1: 0.6136
 epoch: 81, train_loss: 0.3340, test_loss: 1.1822, test_f1: 0.6240
 epoch: 82, train_loss: 0.3439, test_loss: 1.2874, test_f1: 0.5877
 epoch: 83, train_loss: 0.3426, test_loss: 1.0965, test_f1: 0.6305
 epoch: 84, train_loss: 0.3351, test_loss: 1.1835, test_f1: 0.6441
 epoch: 85, train_loss: 0.3154, test_loss: 1.1549, test_f1: 0.6413
 epoch: 86, train_loss: 0.3176, test_loss: 1.1658, test_f1: 0.6250
 epoch: 87, train_loss: 0.3483, test_loss: 1.2223, test_f1: 0.6132
 epoch: 88, train_loss: 0.3214, test_loss: 1.1699, test_f1: 0.6182
 epoch: 89, train_loss: 0.3042, test_loss: 1.3049, test_f1: 0.6267
 epoch: 90, train_loss: 0.3127, test_loss: 1.1809, test_f1: 0.6259
 epoch: 91, train_loss: 0.3115, test_loss: 1.2333, test_f1: 0.6175
 epoch: 92, train_loss: 0.2961, test_loss: 1.2634, test_f1: 0.6269
 epoch: 93, train_loss: 0.3115, test_loss: 1.3216, test_f1: 0.5931
 epoch: 94, train_loss: 0.3482, test_loss: 1.1032, test_f1: 0.6147
 epoch: 95, train_loss: 0.3463, test_loss: 1.2156, test_f1: 0.6296
 epoch: 96, train_loss: 0.3211, test_loss: 1.3751, test_f1: 0.6133
 epoch: 97, train_loss: 0.3140, test_loss: 1.1924, test_f1: 0.6298
 epoch: 98, train_loss: 0.3296, test_loss: 1.3427, test_f1: 0.6039
 epoch: 99, train_loss: 0.3302, test_loss: 1.4662, test_f1: 0.6033
##################ITERATION #4 ****************************************
 epoch: 0, train_loss: 1.5933, test_loss: 1.7209, test_f1: 0.2247
 epoch: 1, train_loss: 1.0608, test_loss: 1.7667, test_f1: 0.2072
 epoch: 2, train_loss: 1.0147, test_loss: 1.4769, test_f1: 0.2814
 epoch: 3, train_loss: 0.9655, test_loss: 1.2413, test_f1: 0.3642
 epoch: 4, train_loss: 0.9315, test_loss: 1.0180, test_f1: 0.5035
 epoch: 5, train_loss: 0.9141, test_loss: 1.0967, test_f1: 0.4491
 epoch: 6, train_loss: 0.8760, test_loss: 0.9957, test_f1: 0.5277
 epoch: 7, train_loss: 0.8783, test_loss: 0.9536, test_f1: 0.5493
 epoch: 8, train_loss: 0.8442, test_loss: 0.9661, test_f1: 0.4942
 epoch: 9, train_loss: 0.8307, test_loss: 0.9532, test_f1: 0.5303
 epoch: 10, train_loss: 0.8019, test_loss: 0.9430, test_f1: 0.5910
 epoch: 11, train_loss: 0.7995, test_loss: 0.9988, test_f1: 0.5319
 epoch: 12, train_loss: 0.7649, test_loss: 0.9316, test_f1: 0.5599
 epoch: 13, train_loss: 0.7710, test_loss: 0.9615, test_f1: 0.5269
 epoch: 14, train_loss: 0.7617, test_loss: 0.9086, test_f1: 0.5651
 epoch: 15, train_loss: 0.7470, test_loss: 0.9809, test_f1: 0.5344
 epoch: 16, train_loss: 0.7402, test_loss: 0.8734, test_f1: 0.6436
 epoch: 17, train_loss: 0.7181, test_loss: 0.8515, test_f1: 0.5749
 epoch: 18, train_loss: 0.7050, test_loss: 0.8311, test_f1: 0.6034
 epoch: 19, train_loss: 0.6991, test_loss: 0.9709, test_f1: 0.5542
 epoch: 20, train_loss: 0.6843, test_loss: 1.1230, test_f1: 0.4975
 epoch: 21, train_loss: 0.6749, test_loss: 0.9313, test_f1: 0.5283
 epoch: 22, train_loss: 0.6880, test_loss: 1.0135, test_f1: 0.5277
 epoch: 23, train_loss: 0.6637, test_loss: 0.9252, test_f1: 0.6107
 epoch: 24, train_loss: 0.6625, test_loss: 0.9080, test_f1: 0.6456
 epoch: 25, train_loss: 0.6440, test_loss: 0.8832, test_f1: 0.5899
 epoch: 26, train_loss: 0.6519, test_loss: 0.8489, test_f1: 0.5914
 epoch: 27, train_loss: 0.6092, test_loss: 0.8343, test_f1: 0.6186
 epoch: 28, train_loss: 0.6135, test_loss: 0.9076, test_f1: 0.5647
 epoch: 29, train_loss: 0.6233, test_loss: 0.9065, test_f1: 0.5988
 epoch: 30, train_loss: 0.6139, test_loss: 1.1437, test_f1: 0.5152
 epoch: 31, train_loss: 0.6361, test_loss: 0.9289, test_f1: 0.5757
 epoch: 32, train_loss: 0.6209, test_loss: 0.9627, test_f1: 0.5712
 epoch: 33, train_loss: 0.6092, test_loss: 0.8357, test_f1: 0.6574
 epoch: 34, train_loss: 0.5996, test_loss: 0.9583, test_f1: 0.5412
 epoch: 35, train_loss: 0.5994, test_loss: 0.8646, test_f1: 0.5770
 epoch: 36, train_loss: 0.5788, test_loss: 1.0218, test_f1: 0.5823
 epoch: 37, train_loss: 0.6008, test_loss: 0.9050, test_f1: 0.5773
 epoch: 38, train_loss: 0.5702, test_loss: 0.8937, test_f1: 0.6192
 epoch: 39, train_loss: 0.5520, test_loss: 1.0927, test_f1: 0.5622
 epoch: 40, train_loss: 0.5539, test_loss: 0.9490, test_f1: 0.6113
 epoch: 41, train_loss: 0.5560, test_loss: 1.0111, test_f1: 0.6155
 epoch: 42, train_loss: 0.5550, test_loss: 1.0842, test_f1: 0.5980
 epoch: 43, train_loss: 0.5467, test_loss: 0.8440, test_f1: 0.6157
 epoch: 44, train_loss: 0.5448, test_loss: 0.9403, test_f1: 0.6196
 epoch: 45, train_loss: 0.5422, test_loss: 1.0044, test_f1: 0.5857
 epoch: 46, train_loss: 0.5535, test_loss: 1.0118, test_f1: 0.6009
 epoch: 47, train_loss: 0.5305, test_loss: 0.9276, test_f1: 0.6548
 epoch: 48, train_loss: 0.5360, test_loss: 1.0101, test_f1: 0.6147
 epoch: 49, train_loss: 0.5270, test_loss: 1.0359, test_f1: 0.5719
 epoch: 50, train_loss: 0.5259, test_loss: 1.0110, test_f1: 0.6102
 epoch: 51, train_loss: 0.5163, test_loss: 0.9423, test_f1: 0.6214
 epoch: 52, train_loss: 0.4778, test_loss: 0.9462, test_f1: 0.6309
 epoch: 53, train_loss: 0.4521, test_loss: 1.0259, test_f1: 0.6394
 epoch: 54, train_loss: 0.4252, test_loss: 0.9411, test_f1: 0.6556
 epoch: 55, train_loss: 0.4261, test_loss: 0.9701, test_f1: 0.6467
 epoch: 56, train_loss: 0.4371, test_loss: 0.9931, test_f1: 0.6485
 epoch: 57, train_loss: 0.4219, test_loss: 0.9258, test_f1: 0.6308
 epoch: 58, train_loss: 0.4228, test_loss: 1.0402, test_f1: 0.6363
 epoch: 59, train_loss: 0.4089, test_loss: 0.9671, test_f1: 0.6645
 epoch: 60, train_loss: 0.3940, test_loss: 1.1477, test_f1: 0.6307
 epoch: 61, train_loss: 0.3985, test_loss: 0.9085, test_f1: 0.6539
 epoch: 62, train_loss: 0.3996, test_loss: 1.0185, test_f1: 0.6867
 epoch: 63, train_loss: 0.4019, test_loss: 1.1490, test_f1: 0.6249
 epoch: 64, train_loss: 0.4018, test_loss: 0.9146, test_f1: 0.6812
 epoch: 65, train_loss: 0.3937, test_loss: 0.9576, test_f1: 0.6471
 epoch: 66, train_loss: 0.4320, test_loss: 0.9028, test_f1: 0.6273
 epoch: 67, train_loss: 0.4046, test_loss: 0.9226, test_f1: 0.6572
 epoch: 68, train_loss: 0.4055, test_loss: 1.0406, test_f1: 0.6208
 epoch: 69, train_loss: 0.4020, test_loss: 0.9530, test_f1: 0.6633
 epoch: 70, train_loss: 0.3960, test_loss: 0.9028, test_f1: 0.6824
 epoch: 71, train_loss: 0.3735, test_loss: 1.0186, test_f1: 0.6516
 epoch: 72, train_loss: 0.3706, test_loss: 0.9480, test_f1: 0.6568
 epoch: 73, train_loss: 0.3710, test_loss: 0.9939, test_f1: 0.6673
 epoch: 74, train_loss: 0.3706, test_loss: 1.1417, test_f1: 0.6400
 epoch: 75, train_loss: 0.3638, test_loss: 1.0105, test_f1: 0.6349
 epoch: 76, train_loss: 0.3640, test_loss: 1.0259, test_f1: 0.6604
 epoch: 77, train_loss: 0.3570, test_loss: 1.1947, test_f1: 0.6611
 epoch: 78, train_loss: 0.3887, test_loss: 0.9799, test_f1: 0.6664
 epoch: 79, train_loss: 0.3650, test_loss: 1.1579, test_f1: 0.6357
 epoch: 80, train_loss: 0.3499, test_loss: 1.0717, test_f1: 0.6518
 epoch: 81, train_loss: 0.3484, test_loss: 1.3031, test_f1: 0.6055
 epoch: 82, train_loss: 0.3649, test_loss: 1.2599, test_f1: 0.6306
 epoch: 83, train_loss: 0.3649, test_loss: 1.1048, test_f1: 0.6599
 epoch: 84, train_loss: 0.3593, test_loss: 1.0096, test_f1: 0.6727
 epoch: 85, train_loss: 0.3461, test_loss: 1.0511, test_f1: 0.6468
 epoch: 86, train_loss: 0.3449, test_loss: 1.2126, test_f1: 0.6380
 epoch: 87, train_loss: 0.3431, test_loss: 1.3594, test_f1: 0.6390
 epoch: 88, train_loss: 0.3317, test_loss: 1.0637, test_f1: 0.6713
 epoch: 89, train_loss: 0.3331, test_loss: 1.0245, test_f1: 0.6704
 epoch: 90, train_loss: 0.3216, test_loss: 1.2554, test_f1: 0.6353
 epoch: 91, train_loss: 0.3261, test_loss: 1.1362, test_f1: 0.6654
 epoch: 92, train_loss: 0.3088, test_loss: 1.1062, test_f1: 0.6389
 epoch: 93, train_loss: 0.3278, test_loss: 1.0949, test_f1: 0.6535
 epoch: 94, train_loss: 0.3360, test_loss: 1.1481, test_f1: 0.6393
 epoch: 95, train_loss: 0.3291, test_loss: 1.3666, test_f1: 0.6590
 epoch: 96, train_loss: 0.2915, test_loss: 1.0998, test_f1: 0.6633
 epoch: 97, train_loss: 0.2905, test_loss: 1.1864, test_f1: 0.6603
 epoch: 98, train_loss: 0.3213, test_loss: 1.2061, test_f1: 0.6530
 epoch: 99, train_loss: 0.3415, test_loss: 1.3232, test_f1: 0.6356
##################ITERATION #5 ****************************************
 epoch: 0, train_loss: 1.4980, test_loss: 1.2931, test_f1: 0.2714
 epoch: 1, train_loss: 1.0157, test_loss: 1.0982, test_f1: 0.4122
 epoch: 2, train_loss: 0.9701, test_loss: 1.0965, test_f1: 0.3652
 epoch: 3, train_loss: 0.9403, test_loss: 1.0345, test_f1: 0.4909
 epoch: 4, train_loss: 0.9225, test_loss: 0.9913, test_f1: 0.5181
 epoch: 5, train_loss: 0.8820, test_loss: 1.0271, test_f1: 0.4804
 epoch: 6, train_loss: 0.8669, test_loss: 0.9353, test_f1: 0.5297
 epoch: 7, train_loss: 0.8475, test_loss: 0.9558, test_f1: 0.5352
 epoch: 8, train_loss: 0.8256, test_loss: 1.0732, test_f1: 0.4883
 epoch: 9, train_loss: 0.7998, test_loss: 0.9193, test_f1: 0.5716
 epoch: 10, train_loss: 0.7854, test_loss: 0.9537, test_f1: 0.5553
 epoch: 11, train_loss: 0.7852, test_loss: 1.0994, test_f1: 0.5295
 epoch: 12, train_loss: 0.7582, test_loss: 0.9848, test_f1: 0.5363
 epoch: 13, train_loss: 0.7319, test_loss: 0.9699, test_f1: 0.5369
 epoch: 14, train_loss: 0.7441, test_loss: 0.8452, test_f1: 0.5837
 epoch: 15, train_loss: 0.7433, test_loss: 0.7909, test_f1: 0.5926
 epoch: 16, train_loss: 0.7193, test_loss: 0.8434, test_f1: 0.6005
 epoch: 17, train_loss: 0.7010, test_loss: 1.3429, test_f1: 0.4941
 epoch: 18, train_loss: 0.7145, test_loss: 0.9777, test_f1: 0.5996
 epoch: 19, train_loss: 0.7110, test_loss: 0.8477, test_f1: 0.5965
 epoch: 20, train_loss: 0.7060, test_loss: 0.9579, test_f1: 0.6025
 epoch: 21, train_loss: 0.6992, test_loss: 0.8807, test_f1: 0.6249
 epoch: 22, train_loss: 0.6645, test_loss: 0.8426, test_f1: 0.6229
 epoch: 23, train_loss: 0.6590, test_loss: 0.9884, test_f1: 0.5433
 epoch: 24, train_loss: 0.6517, test_loss: 1.0736, test_f1: 0.5762
 epoch: 25, train_loss: 0.6514, test_loss: 0.9553, test_f1: 0.6314
 epoch: 26, train_loss: 0.6568, test_loss: 1.0364, test_f1: 0.5587
 epoch: 27, train_loss: 0.6368, test_loss: 0.8381, test_f1: 0.6331
 epoch: 28, train_loss: 0.6385, test_loss: 0.9290, test_f1: 0.6076
 epoch: 29, train_loss: 0.6168, test_loss: 0.8797, test_f1: 0.5912
 epoch: 30, train_loss: 0.5995, test_loss: 1.0003, test_f1: 0.5860
 epoch: 31, train_loss: 0.6153, test_loss: 0.9562, test_f1: 0.5872
 epoch: 32, train_loss: 0.6344, test_loss: 0.9399, test_f1: 0.6364
 epoch: 33, train_loss: 0.6129, test_loss: 1.2478, test_f1: 0.5376
 epoch: 34, train_loss: 0.6151, test_loss: 0.8020, test_f1: 0.6360
 epoch: 35, train_loss: 0.5663, test_loss: 0.8386, test_f1: 0.6225
 epoch: 36, train_loss: 0.5691, test_loss: 0.8439, test_f1: 0.6438
 epoch: 37, train_loss: 0.5659, test_loss: 0.9339, test_f1: 0.6263
 epoch: 38, train_loss: 0.5540, test_loss: 0.9178, test_f1: 0.6209
 epoch: 39, train_loss: 0.5416, test_loss: 1.0379, test_f1: 0.5886
 epoch: 40, train_loss: 0.5435, test_loss: 0.8638, test_f1: 0.6219
 epoch: 41, train_loss: 0.5428, test_loss: 1.0803, test_f1: 0.5705
 epoch: 42, train_loss: 0.5511, test_loss: 0.8740, test_f1: 0.6268
 epoch: 43, train_loss: 0.5608, test_loss: 0.8047, test_f1: 0.6175
 epoch: 44, train_loss: 0.5342, test_loss: 0.8000, test_f1: 0.6332
 epoch: 45, train_loss: 0.5335, test_loss: 1.0460, test_f1: 0.6053
 epoch: 46, train_loss: 0.5230, test_loss: 0.8299, test_f1: 0.6595
 epoch: 47, train_loss: 0.5082, test_loss: 0.8408, test_f1: 0.6548
 epoch: 48, train_loss: 0.5110, test_loss: 0.7460, test_f1: 0.6758
 epoch: 49, train_loss: 0.4979, test_loss: 1.0754, test_f1: 0.5778
 epoch: 50, train_loss: 0.4857, test_loss: 0.8412, test_f1: 0.6576
 epoch: 51, train_loss: 0.4564, test_loss: 0.8135, test_f1: 0.6566
 epoch: 52, train_loss: 0.4319, test_loss: 0.9481, test_f1: 0.6327
 epoch: 53, train_loss: 0.4190, test_loss: 0.8192, test_f1: 0.6788
 epoch: 54, train_loss: 0.3982, test_loss: 1.0231, test_f1: 0.6207
 epoch: 55, train_loss: 0.4173, test_loss: 0.8272, test_f1: 0.6766
 epoch: 56, train_loss: 0.4218, test_loss: 0.8319, test_f1: 0.6674
 epoch: 57, train_loss: 0.3790, test_loss: 0.8994, test_f1: 0.6447
 epoch: 58, train_loss: 0.3860, test_loss: 0.9521, test_f1: 0.6727
 epoch: 59, train_loss: 0.3769, test_loss: 0.8890, test_f1: 0.6525
 epoch: 60, train_loss: 0.3932, test_loss: 0.9733, test_f1: 0.6459
 epoch: 61, train_loss: 0.3787, test_loss: 0.9261, test_f1: 0.6585
 epoch: 62, train_loss: 0.3910, test_loss: 0.9780, test_f1: 0.6307
 epoch: 63, train_loss: 0.3939, test_loss: 0.8888, test_f1: 0.6671
 epoch: 64, train_loss: 0.3917, test_loss: 0.9165, test_f1: 0.6368
 epoch: 65, train_loss: 0.3537, test_loss: 1.0046, test_f1: 0.6468
 epoch: 66, train_loss: 0.3596, test_loss: 0.9494, test_f1: 0.6800
 epoch: 67, train_loss: 0.3546, test_loss: 1.0669, test_f1: 0.6382
 epoch: 68, train_loss: 0.3775, test_loss: 0.8351, test_f1: 0.6929
 epoch: 69, train_loss: 0.3647, test_loss: 1.0245, test_f1: 0.6517
 epoch: 70, train_loss: 0.3639, test_loss: 1.2580, test_f1: 0.6470
 epoch: 71, train_loss: 0.3563, test_loss: 0.9349, test_f1: 0.6577
 epoch: 72, train_loss: 0.3400, test_loss: 1.0544, test_f1: 0.6557
 epoch: 73, train_loss: 0.3482, test_loss: 1.0297, test_f1: 0.6748
 epoch: 74, train_loss: 0.3417, test_loss: 1.0361, test_f1: 0.6391
 epoch: 75, train_loss: 0.3391, test_loss: 1.1802, test_f1: 0.6518
 epoch: 76, train_loss: 0.3553, test_loss: 1.0613, test_f1: 0.6501
 epoch: 77, train_loss: 0.3455, test_loss: 1.0214, test_f1: 0.6502
 epoch: 78, train_loss: 0.3344, test_loss: 1.0455, test_f1: 0.6328
 epoch: 79, train_loss: 0.3541, test_loss: 0.9641, test_f1: 0.6370
 epoch: 80, train_loss: 0.3358, test_loss: 1.4771, test_f1: 0.6008
 epoch: 81, train_loss: 0.3536, test_loss: 0.8909, test_f1: 0.6869
 epoch: 82, train_loss: 0.3346, test_loss: 1.0232, test_f1: 0.6725
 epoch: 83, train_loss: 0.3261, test_loss: 1.1565, test_f1: 0.6217
 epoch: 84, train_loss: 0.3159, test_loss: 1.1338, test_f1: 0.6316
 epoch: 85, train_loss: 0.3255, test_loss: 0.9765, test_f1: 0.6755
 epoch: 86, train_loss: 0.3343, test_loss: 1.3101, test_f1: 0.6343
 epoch: 87, train_loss: 0.3172, test_loss: 1.4476, test_f1: 0.6160
 epoch: 88, train_loss: 0.3062, test_loss: 1.3515, test_f1: 0.6130
 epoch: 89, train_loss: 0.3180, test_loss: 1.0935, test_f1: 0.6788
 epoch: 90, train_loss: 0.3208, test_loss: 1.1901, test_f1: 0.6077
 epoch: 91, train_loss: 0.3056, test_loss: 1.3964, test_f1: 0.6122
 epoch: 92, train_loss: 0.2898, test_loss: 1.3900, test_f1: 0.6311
 epoch: 93, train_loss: 0.2972, test_loss: 1.1970, test_f1: 0.6353
 epoch: 94, train_loss: 0.2824, test_loss: 1.2387, test_f1: 0.6565
 epoch: 95, train_loss: 0.3067, test_loss: 1.2155, test_f1: 0.6069
 epoch: 96, train_loss: 0.3295, test_loss: 1.2076, test_f1: 0.6506
 epoch: 97, train_loss: 0.3375, test_loss: 1.4177, test_f1: 0.6321
 epoch: 98, train_loss: 0.3270, test_loss: 1.1710, test_f1: 0.6699
 epoch: 99, train_loss: 0.2819, test_loss: 1.1245, test_f1: 0.6833
##################ITERATION #6 ****************************************
 epoch: 0, train_loss: 1.7050, test_loss: 1.4672, test_f1: 0.2747
 epoch: 1, train_loss: 1.0608, test_loss: 1.2286, test_f1: 0.3615
 epoch: 2, train_loss: 1.0004, test_loss: 1.1452, test_f1: 0.4020
 epoch: 3, train_loss: 0.9555, test_loss: 1.0988, test_f1: 0.4341
 epoch: 4, train_loss: 0.9236, test_loss: 1.0532, test_f1: 0.4335
 epoch: 5, train_loss: 0.9115, test_loss: 1.0997, test_f1: 0.4352
 epoch: 6, train_loss: 0.8985, test_loss: 1.0258, test_f1: 0.4465
 epoch: 7, train_loss: 0.9161, test_loss: 1.0587, test_f1: 0.5201
 epoch: 8, train_loss: 0.8704, test_loss: 0.9564, test_f1: 0.5347
 epoch: 9, train_loss: 0.8342, test_loss: 1.0140, test_f1: 0.5208
 epoch: 10, train_loss: 0.8182, test_loss: 0.9082, test_f1: 0.5470
 epoch: 11, train_loss: 0.8135, test_loss: 0.9218, test_f1: 0.5188
 epoch: 12, train_loss: 0.8059, test_loss: 0.8697, test_f1: 0.5384
 epoch: 13, train_loss: 0.7904, test_loss: 1.1223, test_f1: 0.4425
 epoch: 14, train_loss: 0.7767, test_loss: 0.9912, test_f1: 0.5017
 epoch: 15, train_loss: 0.7574, test_loss: 0.9467, test_f1: 0.5231
 epoch: 16, train_loss: 0.7761, test_loss: 0.8969, test_f1: 0.5487
 epoch: 17, train_loss: 0.7624, test_loss: 1.0333, test_f1: 0.5031
 epoch: 18, train_loss: 0.7334, test_loss: 0.9041, test_f1: 0.5529
 epoch: 19, train_loss: 0.7349, test_loss: 1.2148, test_f1: 0.4890
 epoch: 20, train_loss: 0.7411, test_loss: 0.9262, test_f1: 0.5676
 epoch: 21, train_loss: 0.7227, test_loss: 0.9745, test_f1: 0.5268
 epoch: 22, train_loss: 0.7087, test_loss: 1.0468, test_f1: 0.5187
 epoch: 23, train_loss: 0.6887, test_loss: 0.7753, test_f1: 0.6044
 epoch: 24, train_loss: 0.6761, test_loss: 0.8944, test_f1: 0.5691
 epoch: 25, train_loss: 0.7037, test_loss: 0.9487, test_f1: 0.5326
 epoch: 26, train_loss: 0.6760, test_loss: 0.9561, test_f1: 0.5832
 epoch: 27, train_loss: 0.6652, test_loss: 0.8158, test_f1: 0.6128
 epoch: 28, train_loss: 0.6610, test_loss: 1.1841, test_f1: 0.5298
 epoch: 29, train_loss: 0.6560, test_loss: 1.3632, test_f1: 0.4467
 epoch: 30, train_loss: 0.6466, test_loss: 0.9693, test_f1: 0.5849
 epoch: 31, train_loss: 0.6445, test_loss: 1.0208, test_f1: 0.5519
 epoch: 32, train_loss: 0.6353, test_loss: 1.2934, test_f1: 0.4608
 epoch: 33, train_loss: 0.6364, test_loss: 1.3054, test_f1: 0.4781
 epoch: 34, train_loss: 0.6287, test_loss: 0.8189, test_f1: 0.6219
 epoch: 35, train_loss: 0.6358, test_loss: 0.9394, test_f1: 0.5609
 epoch: 36, train_loss: 0.6085, test_loss: 0.9969, test_f1: 0.5833
 epoch: 37, train_loss: 0.6079, test_loss: 0.8823, test_f1: 0.5753
 epoch: 38, train_loss: 0.5818, test_loss: 0.9107, test_f1: 0.6036
 epoch: 39, train_loss: 0.6109, test_loss: 1.1967, test_f1: 0.5239
 epoch: 40, train_loss: 0.6124, test_loss: 1.3804, test_f1: 0.4949
 epoch: 41, train_loss: 0.6073, test_loss: 0.8512, test_f1: 0.5922
 epoch: 42, train_loss: 0.5775, test_loss: 0.9446, test_f1: 0.6021
 epoch: 43, train_loss: 0.5879, test_loss: 1.0161, test_f1: 0.5693
 epoch: 44, train_loss: 0.5773, test_loss: 0.9158, test_f1: 0.5986
 epoch: 45, train_loss: 0.5696, test_loss: 1.0185, test_f1: 0.6049
 epoch: 46, train_loss: 0.5662, test_loss: 1.3987, test_f1: 0.5587
 epoch: 47, train_loss: 0.5586, test_loss: 0.8511, test_f1: 0.6074
 epoch: 48, train_loss: 0.5455, test_loss: 0.8954, test_f1: 0.6430
 epoch: 49, train_loss: 0.5338, test_loss: 1.0183, test_f1: 0.6155
 epoch: 50, train_loss: 0.5501, test_loss: 0.8661, test_f1: 0.6456
 epoch: 51, train_loss: 0.5033, test_loss: 0.9591, test_f1: 0.6234
 epoch: 52, train_loss: 0.4802, test_loss: 0.9413, test_f1: 0.6478
 epoch: 53, train_loss: 0.4658, test_loss: 0.9469, test_f1: 0.6416
 epoch: 54, train_loss: 0.4695, test_loss: 0.9644, test_f1: 0.6421
 epoch: 55, train_loss: 0.4548, test_loss: 1.2827, test_f1: 0.5969
 epoch: 56, train_loss: 0.4633, test_loss: 0.8393, test_f1: 0.6561
 epoch: 57, train_loss: 0.4526, test_loss: 0.9611, test_f1: 0.6460
 epoch: 58, train_loss: 0.4369, test_loss: 0.9338, test_f1: 0.6271
 epoch: 59, train_loss: 0.4354, test_loss: 1.0446, test_f1: 0.6277
 epoch: 60, train_loss: 0.4305, test_loss: 0.9354, test_f1: 0.6501
 epoch: 61, train_loss: 0.4071, test_loss: 1.1265, test_f1: 0.6385
 epoch: 62, train_loss: 0.4205, test_loss: 1.0756, test_f1: 0.6324
 epoch: 63, train_loss: 0.4078, test_loss: 1.0227, test_f1: 0.6397
 epoch: 64, train_loss: 0.4347, test_loss: 1.1354, test_f1: 0.6313
 epoch: 65, train_loss: 0.4221, test_loss: 0.9369, test_f1: 0.6556
 epoch: 66, train_loss: 0.4002, test_loss: 0.9643, test_f1: 0.6600
 epoch: 67, train_loss: 0.4262, test_loss: 1.1308, test_f1: 0.6237
 epoch: 68, train_loss: 0.4122, test_loss: 0.9719, test_f1: 0.6623
 epoch: 69, train_loss: 0.3945, test_loss: 1.0022, test_f1: 0.6514
 epoch: 70, train_loss: 0.4007, test_loss: 0.9522, test_f1: 0.6427
 epoch: 71, train_loss: 0.3892, test_loss: 1.0634, test_f1: 0.6442
 epoch: 72, train_loss: 0.3869, test_loss: 1.0874, test_f1: 0.6216
 epoch: 73, train_loss: 0.3966, test_loss: 1.0196, test_f1: 0.6529
 epoch: 74, train_loss: 0.3979, test_loss: 1.0118, test_f1: 0.6542
 epoch: 75, train_loss: 0.3856, test_loss: 1.0274, test_f1: 0.6563
 epoch: 76, train_loss: 0.3870, test_loss: 1.0281, test_f1: 0.6653
 epoch: 77, train_loss: 0.3859, test_loss: 1.1207, test_f1: 0.6273
 epoch: 78, train_loss: 0.3725, test_loss: 1.0505, test_f1: 0.6469
 epoch: 79, train_loss: 0.3606, test_loss: 1.1552, test_f1: 0.6424
 epoch: 80, train_loss: 0.3560, test_loss: 1.1263, test_f1: 0.6540
 epoch: 81, train_loss: 0.3587, test_loss: 0.9926, test_f1: 0.6727
 epoch: 82, train_loss: 0.3644, test_loss: 1.1345, test_f1: 0.6513
 epoch: 83, train_loss: 0.3675, test_loss: 0.9945, test_f1: 0.6579
 epoch: 84, train_loss: 0.3560, test_loss: 1.1413, test_f1: 0.6526
 epoch: 85, train_loss: 0.3419, test_loss: 1.0894, test_f1: 0.6645
 epoch: 86, train_loss: 0.3359, test_loss: 1.1722, test_f1: 0.6487
 epoch: 87, train_loss: 0.3260, test_loss: 1.1145, test_f1: 0.6429
 epoch: 88, train_loss: 0.3546, test_loss: 1.1192, test_f1: 0.6464
 epoch: 89, train_loss: 0.3614, test_loss: 1.0664, test_f1: 0.6645
 epoch: 90, train_loss: 0.3427, test_loss: 1.1994, test_f1: 0.6276
 epoch: 91, train_loss: 0.3427, test_loss: 1.0551, test_f1: 0.6855
 epoch: 92, train_loss: 0.3244, test_loss: 1.1003, test_f1: 0.6699
 epoch: 93, train_loss: 0.3299, test_loss: 1.1287, test_f1: 0.6869
 epoch: 94, train_loss: 0.3203, test_loss: 1.2229, test_f1: 0.6858
 epoch: 95, train_loss: 0.3255, test_loss: 1.1304, test_f1: 0.6799
 epoch: 96, train_loss: 0.3199, test_loss: 1.1153, test_f1: 0.6800
 epoch: 97, train_loss: 0.3472, test_loss: 1.0819, test_f1: 0.6564
 epoch: 98, train_loss: 0.3282, test_loss: 1.0909, test_f1: 0.6987
 epoch: 99, train_loss: 0.3202, test_loss: 1.0819, test_f1: 0.6577
##################ITERATION #7 ****************************************
 epoch: 0, train_loss: 1.9064, test_loss: 1.3286, test_f1: 0.2503
 epoch: 1, train_loss: 1.0555, test_loss: 1.1126, test_f1: 0.3490
 epoch: 2, train_loss: 0.9955, test_loss: 1.0452, test_f1: 0.3658
 epoch: 3, train_loss: 0.9511, test_loss: 0.9864, test_f1: 0.4342
 epoch: 4, train_loss: 0.9147, test_loss: 0.9766, test_f1: 0.4630
 epoch: 5, train_loss: 0.9179, test_loss: 1.0562, test_f1: 0.4955
 epoch: 6, train_loss: 0.8922, test_loss: 0.9588, test_f1: 0.5170
 epoch: 7, train_loss: 0.8704, test_loss: 0.9747, test_f1: 0.4438
 epoch: 8, train_loss: 0.8430, test_loss: 1.0068, test_f1: 0.4824
 epoch: 9, train_loss: 0.8177, test_loss: 0.8604, test_f1: 0.5484
 epoch: 10, train_loss: 0.8203, test_loss: 0.8854, test_f1: 0.5565
 epoch: 11, train_loss: 0.7985, test_loss: 0.8611, test_f1: 0.5730
 epoch: 12, train_loss: 0.7994, test_loss: 0.9268, test_f1: 0.5409
 epoch: 13, train_loss: 0.7851, test_loss: 0.8231, test_f1: 0.5813
 epoch: 14, train_loss: 0.8019, test_loss: 0.9577, test_f1: 0.5449
 epoch: 15, train_loss: 0.8002, test_loss: 0.7991, test_f1: 0.5846
 epoch: 16, train_loss: 0.7632, test_loss: 0.8656, test_f1: 0.5657
 epoch: 17, train_loss: 0.7450, test_loss: 0.9802, test_f1: 0.5584
 epoch: 18, train_loss: 0.7441, test_loss: 0.8821, test_f1: 0.5952
 epoch: 19, train_loss: 0.7399, test_loss: 0.9212, test_f1: 0.5782
 epoch: 20, train_loss: 0.7321, test_loss: 0.9313, test_f1: 0.5776
 epoch: 21, train_loss: 0.7128, test_loss: 0.9151, test_f1: 0.5413
 epoch: 22, train_loss: 0.7034, test_loss: 0.8501, test_f1: 0.5823
 epoch: 23, train_loss: 0.7041, test_loss: 0.8373, test_f1: 0.6224
 epoch: 24, train_loss: 0.7126, test_loss: 0.9140, test_f1: 0.5783
 epoch: 25, train_loss: 0.6996, test_loss: 0.8953, test_f1: 0.5786
 epoch: 26, train_loss: 0.6882, test_loss: 0.9992, test_f1: 0.5931
 epoch: 27, train_loss: 0.6842, test_loss: 0.8105, test_f1: 0.5806
 epoch: 28, train_loss: 0.6768, test_loss: 0.9766, test_f1: 0.5897
 epoch: 29, train_loss: 0.6550, test_loss: 0.8788, test_f1: 0.5883
 epoch: 30, train_loss: 0.6607, test_loss: 0.8270, test_f1: 0.6281
 epoch: 31, train_loss: 0.6631, test_loss: 1.0121, test_f1: 0.5488
 epoch: 32, train_loss: 0.6249, test_loss: 0.8335, test_f1: 0.6221
 epoch: 33, train_loss: 0.6111, test_loss: 0.8671, test_f1: 0.6248
 epoch: 34, train_loss: 0.6241, test_loss: 0.8156, test_f1: 0.6321
 epoch: 35, train_loss: 0.6205, test_loss: 1.0143, test_f1: 0.5603
 epoch: 36, train_loss: 0.6324, test_loss: 1.0039, test_f1: 0.5801
 epoch: 37, train_loss: 0.6457, test_loss: 0.8700, test_f1: 0.5816
 epoch: 38, train_loss: 0.6292, test_loss: 0.8423, test_f1: 0.5825
 epoch: 39, train_loss: 0.6566, test_loss: 1.0130, test_f1: 0.5497
 epoch: 40, train_loss: 0.6127, test_loss: 0.8138, test_f1: 0.6551
 epoch: 41, train_loss: 0.6035, test_loss: 0.7497, test_f1: 0.6604
 epoch: 42, train_loss: 0.6038, test_loss: 0.9555, test_f1: 0.5749
 epoch: 43, train_loss: 0.5862, test_loss: 0.9661, test_f1: 0.5747
 epoch: 44, train_loss: 0.5901, test_loss: 0.8301, test_f1: 0.6363
 epoch: 45, train_loss: 0.5824, test_loss: 0.8249, test_f1: 0.6658
 epoch: 46, train_loss: 0.5698, test_loss: 0.9328, test_f1: 0.6378
 epoch: 47, train_loss: 0.5801, test_loss: 1.1332, test_f1: 0.6123
 epoch: 48, train_loss: 0.5691, test_loss: 0.9703, test_f1: 0.6296
 epoch: 49, train_loss: 0.5352, test_loss: 1.0019, test_f1: 0.5720
 epoch: 50, train_loss: 0.5323, test_loss: 0.9517, test_f1: 0.6311
 epoch: 51, train_loss: 0.5126, test_loss: 0.8921, test_f1: 0.6503
 epoch: 52, train_loss: 0.4930, test_loss: 1.0460, test_f1: 0.6039
 epoch: 53, train_loss: 0.4640, test_loss: 0.9313, test_f1: 0.6332
 epoch: 54, train_loss: 0.4327, test_loss: 0.9473, test_f1: 0.6585
 epoch: 55, train_loss: 0.4443, test_loss: 0.8844, test_f1: 0.6526
 epoch: 56, train_loss: 0.4380, test_loss: 0.9797, test_f1: 0.6461
 epoch: 57, train_loss: 0.4282, test_loss: 0.9164, test_f1: 0.6618
 epoch: 58, train_loss: 0.4531, test_loss: 0.9769, test_f1: 0.6249
 epoch: 59, train_loss: 0.4278, test_loss: 1.0709, test_f1: 0.6071
 epoch: 60, train_loss: 0.4462, test_loss: 0.9332, test_f1: 0.6715
 epoch: 61, train_loss: 0.4254, test_loss: 0.8941, test_f1: 0.6592
 epoch: 62, train_loss: 0.4346, test_loss: 0.9226, test_f1: 0.6467
 epoch: 63, train_loss: 0.4061, test_loss: 1.0450, test_f1: 0.6234
 epoch: 64, train_loss: 0.4064, test_loss: 0.9203, test_f1: 0.6541
 epoch: 65, train_loss: 0.4072, test_loss: 1.0468, test_f1: 0.6252
 epoch: 66, train_loss: 0.4003, test_loss: 0.9237, test_f1: 0.6545
 epoch: 67, train_loss: 0.4360, test_loss: 1.0765, test_f1: 0.5794
 epoch: 68, train_loss: 0.4119, test_loss: 0.9735, test_f1: 0.6380
 epoch: 69, train_loss: 0.3915, test_loss: 1.0413, test_f1: 0.6662
 epoch: 70, train_loss: 0.4254, test_loss: 1.0803, test_f1: 0.6329
 epoch: 71, train_loss: 0.4002, test_loss: 1.0679, test_f1: 0.6529
 epoch: 72, train_loss: 0.3847, test_loss: 0.9881, test_f1: 0.6580
 epoch: 73, train_loss: 0.3777, test_loss: 1.0638, test_f1: 0.6104
 epoch: 74, train_loss: 0.3852, test_loss: 1.3681, test_f1: 0.5863
 epoch: 75, train_loss: 0.3919, test_loss: 0.9816, test_f1: 0.6558
 epoch: 76, train_loss: 0.3878, test_loss: 0.9418, test_f1: 0.6689
 epoch: 77, train_loss: 0.3849, test_loss: 1.2292, test_f1: 0.6400
 epoch: 78, train_loss: 0.3737, test_loss: 1.0255, test_f1: 0.6713
 epoch: 79, train_loss: 0.3809, test_loss: 1.0191, test_f1: 0.6804
 epoch: 80, train_loss: 0.3742, test_loss: 1.0467, test_f1: 0.6560
 epoch: 81, train_loss: 0.3467, test_loss: 1.0065, test_f1: 0.6613
 epoch: 82, train_loss: 0.3607, test_loss: 1.1236, test_f1: 0.6680
 epoch: 83, train_loss: 0.3421, test_loss: 1.0785, test_f1: 0.6417
 epoch: 84, train_loss: 0.3628, test_loss: 1.1048, test_f1: 0.6675
 epoch: 85, train_loss: 0.3627, test_loss: 1.0836, test_f1: 0.6551
 epoch: 86, train_loss: 0.3686, test_loss: 1.0391, test_f1: 0.6591
 epoch: 87, train_loss: 0.3491, test_loss: 1.0095, test_f1: 0.6755
 epoch: 88, train_loss: 0.3374, test_loss: 1.3385, test_f1: 0.6008
 epoch: 89, train_loss: 0.3207, test_loss: 1.1712, test_f1: 0.6309
 epoch: 90, train_loss: 0.3463, test_loss: 1.1507, test_f1: 0.6486
 epoch: 91, train_loss: 0.3451, test_loss: 1.2181, test_f1: 0.6522
 epoch: 92, train_loss: 0.3522, test_loss: 1.2498, test_f1: 0.6216
 epoch: 93, train_loss: 0.3441, test_loss: 1.0625, test_f1: 0.6853
 epoch: 94, train_loss: 0.3536, test_loss: 1.0928, test_f1: 0.6497
 epoch: 95, train_loss: 0.3309, test_loss: 1.1319, test_f1: 0.6604
 epoch: 96, train_loss: 0.3299, test_loss: 1.1408, test_f1: 0.6670
 epoch: 97, train_loss: 0.3122, test_loss: 1.1055, test_f1: 0.6662
 epoch: 98, train_loss: 0.3228, test_loss: 1.1079, test_f1: 0.6661
 epoch: 99, train_loss: 0.3151, test_loss: 1.0697, test_f1: 0.6771
##################ITERATION #8 ****************************************
 epoch: 0, train_loss: 1.6462, test_loss: 1.4863, test_f1: 0.2893
 epoch: 1, train_loss: 1.0091, test_loss: 1.1260, test_f1: 0.4324
 epoch: 2, train_loss: 0.9632, test_loss: 1.0394, test_f1: 0.4843
 epoch: 3, train_loss: 0.9262, test_loss: 1.0391, test_f1: 0.4782
 epoch: 4, train_loss: 0.9009, test_loss: 1.0637, test_f1: 0.5036
 epoch: 5, train_loss: 0.9088, test_loss: 0.9366, test_f1: 0.5610
 epoch: 6, train_loss: 0.8697, test_loss: 0.8776, test_f1: 0.5046
 epoch: 7, train_loss: 0.8364, test_loss: 0.9194, test_f1: 0.5642
 epoch: 8, train_loss: 0.8349, test_loss: 1.0248, test_f1: 0.5170
 epoch: 9, train_loss: 0.8494, test_loss: 0.9944, test_f1: 0.5076
 epoch: 10, train_loss: 0.8085, test_loss: 0.9892, test_f1: 0.4864
 epoch: 11, train_loss: 0.8165, test_loss: 0.9283, test_f1: 0.5479
 epoch: 12, train_loss: 0.8007, test_loss: 0.8519, test_f1: 0.6231
 epoch: 13, train_loss: 0.7743, test_loss: 0.9704, test_f1: 0.5280
 epoch: 14, train_loss: 0.7928, test_loss: 1.0856, test_f1: 0.5349
 epoch: 15, train_loss: 0.7898, test_loss: 0.9211, test_f1: 0.5632
 epoch: 16, train_loss: 0.7822, test_loss: 1.0890, test_f1: 0.5411
 epoch: 17, train_loss: 0.7534, test_loss: 1.1410, test_f1: 0.5314
 epoch: 18, train_loss: 0.7338, test_loss: 0.8721, test_f1: 0.5630
 epoch: 19, train_loss: 0.7129, test_loss: 0.9430, test_f1: 0.5909
 epoch: 20, train_loss: 0.7185, test_loss: 0.9641, test_f1: 0.5981
 epoch: 21, train_loss: 0.7116, test_loss: 0.8758, test_f1: 0.5925
 epoch: 22, train_loss: 0.7066, test_loss: 0.8656, test_f1: 0.6352
 epoch: 23, train_loss: 0.7133, test_loss: 1.0228, test_f1: 0.5116
 epoch: 24, train_loss: 0.6748, test_loss: 0.8456, test_f1: 0.5992
 epoch: 25, train_loss: 0.6932, test_loss: 0.8508, test_f1: 0.5912
 epoch: 26, train_loss: 0.6779, test_loss: 1.0523, test_f1: 0.5316
 epoch: 27, train_loss: 0.6948, test_loss: 1.0066, test_f1: 0.5976
 epoch: 28, train_loss: 0.6630, test_loss: 0.7842, test_f1: 0.6388
 epoch: 29, train_loss: 0.6333, test_loss: 0.9196, test_f1: 0.5569
 epoch: 30, train_loss: 0.6365, test_loss: 0.8328, test_f1: 0.6601
 epoch: 31, train_loss: 0.6090, test_loss: 0.8162, test_f1: 0.6134
 epoch: 32, train_loss: 0.6217, test_loss: 0.8939, test_f1: 0.6122
 epoch: 33, train_loss: 0.6019, test_loss: 0.9433, test_f1: 0.5905
 epoch: 34, train_loss: 0.6092, test_loss: 1.0505, test_f1: 0.5323
 epoch: 35, train_loss: 0.6002, test_loss: 0.9248, test_f1: 0.6260
 epoch: 36, train_loss: 0.5793, test_loss: 0.9896, test_f1: 0.6371
 epoch: 37, train_loss: 0.5811, test_loss: 0.9797, test_f1: 0.5867
 epoch: 38, train_loss: 0.5692, test_loss: 0.7833, test_f1: 0.6230
 epoch: 39, train_loss: 0.5462, test_loss: 0.7830, test_f1: 0.6601
 epoch: 40, train_loss: 0.5497, test_loss: 0.8105, test_f1: 0.5959
 epoch: 41, train_loss: 0.5595, test_loss: 1.5882, test_f1: 0.5167
 epoch: 42, train_loss: 0.5533, test_loss: 0.9024, test_f1: 0.6070
 epoch: 43, train_loss: 0.5367, test_loss: 0.8969, test_f1: 0.6437
 epoch: 44, train_loss: 0.5475, test_loss: 0.7853, test_f1: 0.6117
 epoch: 45, train_loss: 0.5423, test_loss: 0.8800, test_f1: 0.5960
 epoch: 46, train_loss: 0.5483, test_loss: 0.9529, test_f1: 0.5998
 epoch: 47, train_loss: 0.5492, test_loss: 1.7792, test_f1: 0.5037
 epoch: 48, train_loss: 0.5399, test_loss: 1.1351, test_f1: 0.5601
 epoch: 49, train_loss: 0.5357, test_loss: 1.0563, test_f1: 0.6265
 epoch: 50, train_loss: 0.5119, test_loss: 0.8596, test_f1: 0.6510
 epoch: 51, train_loss: 0.4587, test_loss: 0.8300, test_f1: 0.6680
 epoch: 52, train_loss: 0.4347, test_loss: 0.9275, test_f1: 0.6438
 epoch: 53, train_loss: 0.4290, test_loss: 0.9018, test_f1: 0.6593
 epoch: 54, train_loss: 0.4312, test_loss: 0.9567, test_f1: 0.6307
 epoch: 55, train_loss: 0.4091, test_loss: 0.9865, test_f1: 0.6485
 epoch: 56, train_loss: 0.4215, test_loss: 0.9593, test_f1: 0.6771
 epoch: 57, train_loss: 0.4041, test_loss: 0.8809, test_f1: 0.6596
 epoch: 58, train_loss: 0.4009, test_loss: 0.8673, test_f1: 0.6817
 epoch: 59, train_loss: 0.4117, test_loss: 0.9148, test_f1: 0.6679
 epoch: 60, train_loss: 0.4012, test_loss: 0.9222, test_f1: 0.6266
 epoch: 61, train_loss: 0.3973, test_loss: 0.9451, test_f1: 0.6761
 epoch: 62, train_loss: 0.3766, test_loss: 1.1920, test_f1: 0.6112
 epoch: 63, train_loss: 0.3909, test_loss: 0.9295, test_f1: 0.6973
 epoch: 64, train_loss: 0.3793, test_loss: 1.0630, test_f1: 0.6120
 epoch: 65, train_loss: 0.4107, test_loss: 1.2225, test_f1: 0.6109
 epoch: 66, train_loss: 0.4096, test_loss: 1.0248, test_f1: 0.6610
 epoch: 67, train_loss: 0.3762, test_loss: 0.9646, test_f1: 0.6818
 epoch: 68, train_loss: 0.3666, test_loss: 1.1935, test_f1: 0.6485
 epoch: 69, train_loss: 0.3719, test_loss: 1.0790, test_f1: 0.6519
 epoch: 70, train_loss: 0.3776, test_loss: 0.9655, test_f1: 0.6516
 epoch: 71, train_loss: 0.3704, test_loss: 0.9280, test_f1: 0.6609
 epoch: 72, train_loss: 0.3923, test_loss: 1.1058, test_f1: 0.6330
 epoch: 73, train_loss: 0.3743, test_loss: 1.0357, test_f1: 0.6654
 epoch: 74, train_loss: 0.3572, test_loss: 0.9156, test_f1: 0.6876
 epoch: 75, train_loss: 0.3399, test_loss: 1.1021, test_f1: 0.6550
 epoch: 76, train_loss: 0.3535, test_loss: 1.0239, test_f1: 0.6838
 epoch: 77, train_loss: 0.3680, test_loss: 1.1507, test_f1: 0.6616
 epoch: 78, train_loss: 0.3459, test_loss: 1.1543, test_f1: 0.6342
 epoch: 79, train_loss: 0.3584, test_loss: 1.0622, test_f1: 0.6293
 epoch: 80, train_loss: 0.3429, test_loss: 1.1622, test_f1: 0.6232
 epoch: 81, train_loss: 0.3468, test_loss: 1.2438, test_f1: 0.6110
 epoch: 82, train_loss: 0.3335, test_loss: 1.3324, test_f1: 0.6266
 epoch: 83, train_loss: 0.3348, test_loss: 1.2168, test_f1: 0.6469
 epoch: 84, train_loss: 0.3659, test_loss: 1.0976, test_f1: 0.6392
 epoch: 85, train_loss: 0.3627, test_loss: 1.2944, test_f1: 0.6364
 epoch: 86, train_loss: 0.3298, test_loss: 1.3474, test_f1: 0.6351
 epoch: 87, train_loss: 0.3305, test_loss: 1.0916, test_f1: 0.6519
 epoch: 88, train_loss: 0.3640, test_loss: 1.0110, test_f1: 0.6838
 epoch: 89, train_loss: 0.3277, test_loss: 1.0544, test_f1: 0.6611
 epoch: 90, train_loss: 0.3224, test_loss: 1.4411, test_f1: 0.6120
 epoch: 91, train_loss: 0.3350, test_loss: 1.1676, test_f1: 0.6461
 epoch: 92, train_loss: 0.3257, test_loss: 1.1502, test_f1: 0.6318
 epoch: 93, train_loss: 0.3094, test_loss: 1.1429, test_f1: 0.6443
 epoch: 94, train_loss: 0.3076, test_loss: 1.4679, test_f1: 0.6408
 epoch: 95, train_loss: 0.3180, test_loss: 1.1066, test_f1: 0.6431
 epoch: 96, train_loss: 0.3156, test_loss: 1.2056, test_f1: 0.6121
 epoch: 97, train_loss: 0.3054, test_loss: 1.2003, test_f1: 0.6381
 epoch: 98, train_loss: 0.2916, test_loss: 1.4182, test_f1: 0.6177
 epoch: 99, train_loss: 0.3116, test_loss: 1.3387, test_f1: 0.5744
##################ITERATION #9 ****************************************
 epoch: 0, train_loss: 1.5201, test_loss: 1.4599, test_f1: 0.2722
 epoch: 1, train_loss: 1.0316, test_loss: 1.1773, test_f1: 0.4023
 epoch: 2, train_loss: 0.9624, test_loss: 1.0466, test_f1: 0.4748
 epoch: 3, train_loss: 0.9288, test_loss: 1.1279, test_f1: 0.4857
 epoch: 4, train_loss: 0.9200, test_loss: 1.2504, test_f1: 0.4088
 epoch: 5, train_loss: 0.8804, test_loss: 0.9876, test_f1: 0.5121
 epoch: 6, train_loss: 0.8655, test_loss: 0.9777, test_f1: 0.5393
 epoch: 7, train_loss: 0.8422, test_loss: 0.9977, test_f1: 0.4875
 epoch: 8, train_loss: 0.8285, test_loss: 0.9435, test_f1: 0.5554
 epoch: 9, train_loss: 0.8140, test_loss: 0.9359, test_f1: 0.4858
 epoch: 10, train_loss: 0.8057, test_loss: 1.1364, test_f1: 0.4678
 epoch: 11, train_loss: 0.7859, test_loss: 0.8622, test_f1: 0.5515
 epoch: 12, train_loss: 0.7765, test_loss: 0.8178, test_f1: 0.5510
 epoch: 13, train_loss: 0.7746, test_loss: 0.9972, test_f1: 0.5455
 epoch: 14, train_loss: 0.7524, test_loss: 0.9453, test_f1: 0.5580
 epoch: 15, train_loss: 0.7455, test_loss: 0.9035, test_f1: 0.5558
 epoch: 16, train_loss: 0.7477, test_loss: 1.0504, test_f1: 0.5278
 epoch: 17, train_loss: 0.7376, test_loss: 1.0731, test_f1: 0.4450
 epoch: 18, train_loss: 0.7405, test_loss: 0.8954, test_f1: 0.5245
 epoch: 19, train_loss: 0.7339, test_loss: 0.9051, test_f1: 0.5170
 epoch: 20, train_loss: 0.7058, test_loss: 0.8189, test_f1: 0.5616
 epoch: 21, train_loss: 0.6899, test_loss: 0.8276, test_f1: 0.5374
 epoch: 22, train_loss: 0.7021, test_loss: 1.1075, test_f1: 0.5253
 epoch: 23, train_loss: 0.6762, test_loss: 0.9234, test_f1: 0.6174
 epoch: 24, train_loss: 0.6585, test_loss: 0.8336, test_f1: 0.6025
 epoch: 25, train_loss: 0.6716, test_loss: 0.8797, test_f1: 0.5605
 epoch: 26, train_loss: 0.7008, test_loss: 1.1423, test_f1: 0.4905
 epoch: 27, train_loss: 0.6771, test_loss: 0.8833, test_f1: 0.6064
 epoch: 28, train_loss: 0.6392, test_loss: 0.9380, test_f1: 0.5655
 epoch: 29, train_loss: 0.6410, test_loss: 0.8740, test_f1: 0.6319
 epoch: 30, train_loss: 0.6415, test_loss: 0.9923, test_f1: 0.5995
 epoch: 31, train_loss: 0.6468, test_loss: 0.9809, test_f1: 0.5279
 epoch: 32, train_loss: 0.6368, test_loss: 0.8415, test_f1: 0.6086
 epoch: 33, train_loss: 0.6019, test_loss: 0.9049, test_f1: 0.5852
 epoch: 34, train_loss: 0.6157, test_loss: 0.9349, test_f1: 0.6289
 epoch: 35, train_loss: 0.6186, test_loss: 0.9037, test_f1: 0.6072
 epoch: 36, train_loss: 0.6143, test_loss: 0.8017, test_f1: 0.6340
 epoch: 37, train_loss: 0.5933, test_loss: 0.9029, test_f1: 0.6150
 epoch: 38, train_loss: 0.6077, test_loss: 1.0090, test_f1: 0.5713
 epoch: 39, train_loss: 0.5991, test_loss: 0.7994, test_f1: 0.6333
 epoch: 40, train_loss: 0.5807, test_loss: 0.9362, test_f1: 0.6270
 epoch: 41, train_loss: 0.5792, test_loss: 0.8810, test_f1: 0.6494
 epoch: 42, train_loss: 0.5972, test_loss: 1.1020, test_f1: 0.5727
 epoch: 43, train_loss: 0.5712, test_loss: 0.8775, test_f1: 0.5966
 epoch: 44, train_loss: 0.5933, test_loss: 0.7980, test_f1: 0.6390
 epoch: 45, train_loss: 0.5755, test_loss: 1.3155, test_f1: 0.5880
 epoch: 46, train_loss: 0.5707, test_loss: 0.9728, test_f1: 0.6241
 epoch: 47, train_loss: 0.5545, test_loss: 0.9289, test_f1: 0.6458
 epoch: 48, train_loss: 0.5683, test_loss: 0.9384, test_f1: 0.6155
 epoch: 49, train_loss: 0.5369, test_loss: 1.0552, test_f1: 0.6085
 epoch: 50, train_loss: 0.5412, test_loss: 0.9328, test_f1: 0.6415
 epoch: 51, train_loss: 0.5056, test_loss: 0.9034, test_f1: 0.6341
 epoch: 52, train_loss: 0.4802, test_loss: 0.7819, test_f1: 0.6836
 epoch: 53, train_loss: 0.4815, test_loss: 0.8657, test_f1: 0.6682
 epoch: 54, train_loss: 0.4603, test_loss: 0.9765, test_f1: 0.6308
 epoch: 55, train_loss: 0.4404, test_loss: 0.8588, test_f1: 0.6451
 epoch: 56, train_loss: 0.4360, test_loss: 0.9302, test_f1: 0.6472
 epoch: 57, train_loss: 0.4576, test_loss: 0.8874, test_f1: 0.6521
 epoch: 58, train_loss: 0.4515, test_loss: 0.9155, test_f1: 0.6444
 epoch: 59, train_loss: 0.4360, test_loss: 1.0360, test_f1: 0.5988
 epoch: 60, train_loss: 0.4581, test_loss: 0.8850, test_f1: 0.6590
 epoch: 61, train_loss: 0.4401, test_loss: 0.9741, test_f1: 0.6599
 epoch: 62, train_loss: 0.4197, test_loss: 0.9886, test_f1: 0.6578
 epoch: 63, train_loss: 0.4032, test_loss: 1.0463, test_f1: 0.6226
 epoch: 64, train_loss: 0.4123, test_loss: 1.0993, test_f1: 0.6218
 epoch: 65, train_loss: 0.4206, test_loss: 1.0023, test_f1: 0.6286
 epoch: 66, train_loss: 0.4077, test_loss: 1.0987, test_f1: 0.6306
 epoch: 67, train_loss: 0.3978, test_loss: 1.0306, test_f1: 0.6282
 epoch: 68, train_loss: 0.4018, test_loss: 1.0323, test_f1: 0.6117
 epoch: 69, train_loss: 0.4190, test_loss: 1.0942, test_f1: 0.6272
 epoch: 70, train_loss: 0.4148, test_loss: 0.9801, test_f1: 0.6409
 epoch: 71, train_loss: 0.3956, test_loss: 1.1922, test_f1: 0.6192
 epoch: 72, train_loss: 0.3952, test_loss: 1.0854, test_f1: 0.6340
 epoch: 73, train_loss: 0.3871, test_loss: 1.1270, test_f1: 0.6260
 epoch: 74, train_loss: 0.3743, test_loss: 1.0717, test_f1: 0.6507
 epoch: 75, train_loss: 0.3908, test_loss: 1.1187, test_f1: 0.6406
 epoch: 76, train_loss: 0.3808, test_loss: 1.0579, test_f1: 0.6450
 epoch: 77, train_loss: 0.3855, test_loss: 1.0266, test_f1: 0.6559
 epoch: 78, train_loss: 0.3833, test_loss: 1.0625, test_f1: 0.6374
 epoch: 79, train_loss: 0.3662, test_loss: 1.1130, test_f1: 0.6475
 epoch: 80, train_loss: 0.3587, test_loss: 1.1940, test_f1: 0.6195
 epoch: 81, train_loss: 0.3444, test_loss: 1.2677, test_f1: 0.6066
 epoch: 82, train_loss: 0.3724, test_loss: 1.0796, test_f1: 0.6287
 epoch: 83, train_loss: 0.3676, test_loss: 1.3659, test_f1: 0.5810
 epoch: 84, train_loss: 0.3706, test_loss: 1.0818, test_f1: 0.6671
 epoch: 85, train_loss: 0.3719, test_loss: 1.1593, test_f1: 0.6059
 epoch: 86, train_loss: 0.3740, test_loss: 1.2071, test_f1: 0.6385
 epoch: 87, train_loss: 0.3654, test_loss: 1.0898, test_f1: 0.6773
 epoch: 88, train_loss: 0.3411, test_loss: 1.1987, test_f1: 0.6033
 epoch: 89, train_loss: 0.3458, test_loss: 1.0892, test_f1: 0.6257
 epoch: 90, train_loss: 0.3283, test_loss: 1.1833, test_f1: 0.6531
 epoch: 91, train_loss: 0.3423, test_loss: 1.2195, test_f1: 0.5996
 epoch: 92, train_loss: 0.3585, test_loss: 1.1524, test_f1: 0.6565
 epoch: 93, train_loss: 0.3388, test_loss: 1.2771, test_f1: 0.6350
 epoch: 94, train_loss: 0.3269, test_loss: 1.2045, test_f1: 0.5969
 epoch: 95, train_loss: 0.3365, test_loss: 1.3294, test_f1: 0.6172
 epoch: 96, train_loss: 0.3324, test_loss: 1.1872, test_f1: 0.6618
 epoch: 97, train_loss: 0.3436, test_loss: 1.1784, test_f1: 0.6467
 epoch: 98, train_loss: 0.3223, test_loss: 1.7033, test_f1: 0.5979
 epoch: 99, train_loss: 0.3216, test_loss: 1.0813, test_f1: 0.6551

Training completed in 421.99 seconds
Best F1: 0.6987 at epoch 98
Mean F1 across iterations: 0.6858  0.0124
========================FINAL RESULTS================================
FEGIN weighted F1: 0.6987  0.0124
python main.py --data ltspice_examples --representation component_pin --model FEGIN --layers 3 --hiddens 64 --batch_size 256 --lr 0.01 --emb_size 250 --epochs 100 --save_appendix component_pin_L3_H64_BS256_LR0.01_E250 --no_val
-----



STDERR:
  File "main.py", line 370, in <module>
    main()
  File "main.py", line 254, in main
    dataset = dataset_class(
  File "/home/philip/projects/ltspice_examples_code_repo/Circuit-Completion-Using-GNNs/component_classification_with_link_prediction_head/evaluation/FEGIN/kernel/circuit_datasets.py", line 15, in __init__
    self.data, self.slices = torch.load(self.processed_paths[0])
  File "/home/philip/.local/lib/python3.8/site-packages/torch/serialization.py", line 1040, in load
    warnings.warn(
  File "/usr/lib/python3.8/warnings.py", line 109, in _showwarnmsg
    sw(msg.message, msg.category, msg.filename, msg.lineno,
  File "main.py", line 47, in warn_with_traceback
    traceback.print_stack(file=log)
/home/philip/projects/ltspice_examples_code_repo/Circuit-Completion-Using-GNNs/component_classification_with_link_prediction_head/evaluation/FEGIN/kernel/circuit_datasets.py:15: FutureWarning: You are using `torch.load` with `weights_only=False` (the current default value), which uses the default pickle module implicitly. It is possible to construct malicious pickle data which will execute arbitrary code during unpickling (See https://github.com/pytorch/pytorch/blob/main/SECURITY.md#untrusted-models for more details). In a future release, the default value for `weights_only` will be flipped to `True`. This limits the functions that could be executed during unpickling. Arbitrary objects will no longer be allowed to be loaded via this mode unless they are explicitly allowlisted by the user via `torch.serialization.add_safe_globals`. We recommend you start setting `weights_only=True` for any use case where you don't have full control of the loaded file. Please open an issue on GitHub for any issues related to this experimental feature.
  self.data, self.slices = torch.load(self.processed_paths[0])
