STDOUT:
Results will be saved in /home/philip/projects/ltspice_examples_code_repo/Circuit-Completion-Using-GNNs/component_classification_with_link_prediction_head/evaluation/FEGIN/results/model_FEGIN_dataset_ltspice_examples
Command line input: python main.py --data ltspice_examples --representation component_net --model FEGIN --layers 4 --hiddens 32 --batch_size 256 --lr 0.0001 --emb_size 512 --epochs 100 --save_appendix component_net_L4_H32_BS256_LR0.0001_E512 --no_val
 is saved.
-----
ltspice_examples - FEGIN
Using 4 layers, 32 hidden units, h = 2
Loading component_net representation dataset
ENTERED
Training FEGIN on component_net representation
Train: 3558, Test: 846
##################ITERATION #0 ****************************************
 epoch: 0, train_loss: 1.3614, test_loss: 1.3607, test_f1: 0.2270
 epoch: 1, train_loss: 1.3572, test_loss: 1.3602, test_f1: 0.2270
 epoch: 2, train_loss: 1.3550, test_loss: 1.3598, test_f1: 0.2270
 epoch: 3, train_loss: 1.3517, test_loss: 1.3572, test_f1: 0.2270
 epoch: 4, train_loss: 1.3491, test_loss: 1.3531, test_f1: 0.2270
 epoch: 5, train_loss: 1.3461, test_loss: 1.3482, test_f1: 0.2270
 epoch: 6, train_loss: 1.3441, test_loss: 1.3439, test_f1: 0.2270
 epoch: 7, train_loss: 1.3394, test_loss: 1.3403, test_f1: 0.2270
 epoch: 8, train_loss: 1.3359, test_loss: 1.3359, test_f1: 0.2270
 epoch: 9, train_loss: 1.3329, test_loss: 1.3316, test_f1: 0.2270
 epoch: 10, train_loss: 1.3286, test_loss: 1.3278, test_f1: 0.2270
 epoch: 11, train_loss: 1.3253, test_loss: 1.3242, test_f1: 0.2270
 epoch: 12, train_loss: 1.3213, test_loss: 1.3198, test_f1: 0.2270
 epoch: 13, train_loss: 1.3177, test_loss: 1.3155, test_f1: 0.2270
 epoch: 14, train_loss: 1.3140, test_loss: 1.3111, test_f1: 0.2295
 epoch: 15, train_loss: 1.3090, test_loss: 1.3073, test_f1: 0.2320
 epoch: 16, train_loss: 1.3059, test_loss: 1.3040, test_f1: 0.2320
 epoch: 17, train_loss: 1.3005, test_loss: 1.3004, test_f1: 0.2392
 epoch: 18, train_loss: 1.2974, test_loss: 1.2962, test_f1: 0.2461
 epoch: 19, train_loss: 1.2939, test_loss: 1.2920, test_f1: 0.2484
 epoch: 20, train_loss: 1.2895, test_loss: 1.2880, test_f1: 0.2549
 epoch: 21, train_loss: 1.2831, test_loss: 1.2842, test_f1: 0.2611
 epoch: 22, train_loss: 1.2815, test_loss: 1.2807, test_f1: 0.2651
 epoch: 23, train_loss: 1.2763, test_loss: 1.2762, test_f1: 0.2737
 epoch: 24, train_loss: 1.2714, test_loss: 1.2711, test_f1: 0.2806
 epoch: 25, train_loss: 1.2673, test_loss: 1.2668, test_f1: 0.2867
 epoch: 26, train_loss: 1.2611, test_loss: 1.2629, test_f1: 0.2867
 epoch: 27, train_loss: 1.2592, test_loss: 1.2573, test_f1: 0.2980
 epoch: 28, train_loss: 1.2546, test_loss: 1.2533, test_f1: 0.3096
 epoch: 29, train_loss: 1.2468, test_loss: 1.2482, test_f1: 0.3138
 epoch: 30, train_loss: 1.2435, test_loss: 1.2421, test_f1: 0.3183
 epoch: 31, train_loss: 1.2376, test_loss: 1.2364, test_f1: 0.3303
 epoch: 32, train_loss: 1.2320, test_loss: 1.2309, test_f1: 0.3360
 epoch: 33, train_loss: 1.2285, test_loss: 1.2249, test_f1: 0.3465
 epoch: 34, train_loss: 1.2225, test_loss: 1.2184, test_f1: 0.3481
 epoch: 35, train_loss: 1.2179, test_loss: 1.2118, test_f1: 0.3616
 epoch: 36, train_loss: 1.2155, test_loss: 1.2034, test_f1: 0.3676
 epoch: 37, train_loss: 1.2054, test_loss: 1.1967, test_f1: 0.3743
 epoch: 38, train_loss: 1.1994, test_loss: 1.1901, test_f1: 0.3788
 epoch: 39, train_loss: 1.1943, test_loss: 1.1817, test_f1: 0.3850
 epoch: 40, train_loss: 1.1879, test_loss: 1.1745, test_f1: 0.3910
 epoch: 41, train_loss: 1.1791, test_loss: 1.1681, test_f1: 0.3932
 epoch: 42, train_loss: 1.1728, test_loss: 1.1601, test_f1: 0.3973
 epoch: 43, train_loss: 1.1621, test_loss: 1.1517, test_f1: 0.4012
 epoch: 44, train_loss: 1.1560, test_loss: 1.1450, test_f1: 0.4101
 epoch: 45, train_loss: 1.1485, test_loss: 1.1356, test_f1: 0.4162
 epoch: 46, train_loss: 1.1473, test_loss: 1.1287, test_f1: 0.4175
 epoch: 47, train_loss: 1.1349, test_loss: 1.1191, test_f1: 0.4235
 epoch: 48, train_loss: 1.1277, test_loss: 1.1135, test_f1: 0.4255
 epoch: 49, train_loss: 1.1242, test_loss: 1.1045, test_f1: 0.4277
 epoch: 50, train_loss: 1.1175, test_loss: 1.0970, test_f1: 0.4302
 epoch: 51, train_loss: 1.1165, test_loss: 1.0937, test_f1: 0.4321
 epoch: 52, train_loss: 1.1111, test_loss: 1.0906, test_f1: 0.4392
 epoch: 53, train_loss: 1.1050, test_loss: 1.0853, test_f1: 0.4398
 epoch: 54, train_loss: 1.1012, test_loss: 1.0819, test_f1: 0.4418
 epoch: 55, train_loss: 1.1032, test_loss: 1.0777, test_f1: 0.4549
 epoch: 56, train_loss: 1.0967, test_loss: 1.0740, test_f1: 0.4483
 epoch: 57, train_loss: 1.0918, test_loss: 1.0705, test_f1: 0.4547
 epoch: 58, train_loss: 1.0862, test_loss: 1.0685, test_f1: 0.4641
 epoch: 59, train_loss: 1.0851, test_loss: 1.0637, test_f1: 0.4625
 epoch: 60, train_loss: 1.0802, test_loss: 1.0612, test_f1: 0.4659
 epoch: 61, train_loss: 1.0806, test_loss: 1.0568, test_f1: 0.4821
 epoch: 62, train_loss: 1.0742, test_loss: 1.0530, test_f1: 0.4758
 epoch: 63, train_loss: 1.0750, test_loss: 1.0492, test_f1: 0.4809
 epoch: 64, train_loss: 1.0724, test_loss: 1.0458, test_f1: 0.4870
 epoch: 65, train_loss: 1.0626, test_loss: 1.0439, test_f1: 0.4889
 epoch: 66, train_loss: 1.0566, test_loss: 1.0393, test_f1: 0.4894
 epoch: 67, train_loss: 1.0623, test_loss: 1.0365, test_f1: 0.4866
 epoch: 68, train_loss: 1.0617, test_loss: 1.0353, test_f1: 0.4960
 epoch: 69, train_loss: 1.0558, test_loss: 1.0303, test_f1: 0.4911
 epoch: 70, train_loss: 1.0557, test_loss: 1.0292, test_f1: 0.4928
 epoch: 71, train_loss: 1.0529, test_loss: 1.0248, test_f1: 0.5089
 epoch: 72, train_loss: 1.0514, test_loss: 1.0207, test_f1: 0.4965
 epoch: 73, train_loss: 1.0416, test_loss: 1.0183, test_f1: 0.4996
 epoch: 74, train_loss: 1.0399, test_loss: 1.0156, test_f1: 0.5117
 epoch: 75, train_loss: 1.0392, test_loss: 1.0136, test_f1: 0.5145
 epoch: 76, train_loss: 1.0381, test_loss: 1.0096, test_f1: 0.5108
 epoch: 77, train_loss: 1.0333, test_loss: 1.0065, test_f1: 0.5134
 epoch: 78, train_loss: 1.0286, test_loss: 1.0041, test_f1: 0.5141
 epoch: 79, train_loss: 1.0236, test_loss: 1.0010, test_f1: 0.5157
 epoch: 80, train_loss: 1.0241, test_loss: 0.9995, test_f1: 0.5138
 epoch: 81, train_loss: 1.0283, test_loss: 0.9971, test_f1: 0.5140
 epoch: 82, train_loss: 1.0217, test_loss: 0.9942, test_f1: 0.5142
 epoch: 83, train_loss: 1.0187, test_loss: 0.9908, test_f1: 0.5157
 epoch: 84, train_loss: 1.0132, test_loss: 0.9873, test_f1: 0.5126
 epoch: 85, train_loss: 1.0155, test_loss: 0.9855, test_f1: 0.5043
 epoch: 86, train_loss: 1.0048, test_loss: 0.9830, test_f1: 0.5157
 epoch: 87, train_loss: 1.0114, test_loss: 0.9800, test_f1: 0.5054
 epoch: 88, train_loss: 1.0053, test_loss: 0.9778, test_f1: 0.5026
 epoch: 89, train_loss: 1.0083, test_loss: 0.9774, test_f1: 0.5058
 epoch: 90, train_loss: 0.9973, test_loss: 0.9767, test_f1: 0.5049
 epoch: 91, train_loss: 0.9973, test_loss: 0.9752, test_f1: 0.5088
 epoch: 92, train_loss: 0.9974, test_loss: 0.9740, test_f1: 0.5048
 epoch: 93, train_loss: 0.9928, test_loss: 0.9716, test_f1: 0.5091
 epoch: 94, train_loss: 0.9961, test_loss: 0.9704, test_f1: 0.5068
 epoch: 95, train_loss: 0.9867, test_loss: 0.9664, test_f1: 0.5077
 epoch: 96, train_loss: 0.9877, test_loss: 0.9617, test_f1: 0.5110
 epoch: 97, train_loss: 0.9778, test_loss: 0.9624, test_f1: 0.5089
 epoch: 98, train_loss: 0.9839, test_loss: 0.9600, test_f1: 0.5101
 epoch: 99, train_loss: 0.9794, test_loss: 0.9577, test_f1: 0.5121
##################ITERATION #1 ****************************************
 epoch: 0, train_loss: 1.3272, test_loss: 1.3359, test_f1: 0.2270
 epoch: 1, train_loss: 1.3198, test_loss: 1.3310, test_f1: 0.2270
 epoch: 2, train_loss: 1.3162, test_loss: 1.3251, test_f1: 0.2270
 epoch: 3, train_loss: 1.3113, test_loss: 1.3185, test_f1: 0.2270
 epoch: 4, train_loss: 1.3065, test_loss: 1.3132, test_f1: 0.2270
 epoch: 5, train_loss: 1.3006, test_loss: 1.3071, test_f1: 0.2270
 epoch: 6, train_loss: 1.2968, test_loss: 1.3013, test_f1: 0.2270
 epoch: 7, train_loss: 1.2909, test_loss: 1.2953, test_f1: 0.2270
 epoch: 8, train_loss: 1.2837, test_loss: 1.2894, test_f1: 0.2270
 epoch: 9, train_loss: 1.2802, test_loss: 1.2833, test_f1: 0.2270
 epoch: 10, train_loss: 1.2755, test_loss: 1.2777, test_f1: 0.2270
 epoch: 11, train_loss: 1.2676, test_loss: 1.2715, test_f1: 0.2270
 epoch: 12, train_loss: 1.2652, test_loss: 1.2655, test_f1: 0.2270
 epoch: 13, train_loss: 1.2599, test_loss: 1.2597, test_f1: 0.2270
 epoch: 14, train_loss: 1.2535, test_loss: 1.2537, test_f1: 0.2270
 epoch: 15, train_loss: 1.2495, test_loss: 1.2478, test_f1: 0.2270
 epoch: 16, train_loss: 1.2418, test_loss: 1.2416, test_f1: 0.2295
 epoch: 17, train_loss: 1.2371, test_loss: 1.2358, test_f1: 0.2506
 epoch: 18, train_loss: 1.2348, test_loss: 1.2295, test_f1: 0.2611
 epoch: 19, train_loss: 1.2269, test_loss: 1.2239, test_f1: 0.2728
 epoch: 20, train_loss: 1.2260, test_loss: 1.2188, test_f1: 0.2765
 epoch: 21, train_loss: 1.2206, test_loss: 1.2132, test_f1: 0.2801
 epoch: 22, train_loss: 1.2163, test_loss: 1.2078, test_f1: 0.2819
 epoch: 23, train_loss: 1.2117, test_loss: 1.2029, test_f1: 0.2921
 epoch: 24, train_loss: 1.2021, test_loss: 1.1958, test_f1: 0.3203
 epoch: 25, train_loss: 1.1976, test_loss: 1.1906, test_f1: 0.3369
 epoch: 26, train_loss: 1.1952, test_loss: 1.1846, test_f1: 0.3450
 epoch: 27, train_loss: 1.1923, test_loss: 1.1792, test_f1: 0.3600
 epoch: 28, train_loss: 1.1855, test_loss: 1.1728, test_f1: 0.3789
 epoch: 29, train_loss: 1.1822, test_loss: 1.1663, test_f1: 0.3953
 epoch: 30, train_loss: 1.1716, test_loss: 1.1603, test_f1: 0.4008
 epoch: 31, train_loss: 1.1664, test_loss: 1.1534, test_f1: 0.4104
 epoch: 32, train_loss: 1.1629, test_loss: 1.1467, test_f1: 0.4152
 epoch: 33, train_loss: 1.1609, test_loss: 1.1386, test_f1: 0.4243
 epoch: 34, train_loss: 1.1554, test_loss: 1.1314, test_f1: 0.4258
 epoch: 35, train_loss: 1.1406, test_loss: 1.1250, test_f1: 0.4428
 epoch: 36, train_loss: 1.1377, test_loss: 1.1172, test_f1: 0.4529
 epoch: 37, train_loss: 1.1355, test_loss: 1.1093, test_f1: 0.4604
 epoch: 38, train_loss: 1.1248, test_loss: 1.1023, test_f1: 0.4642
 epoch: 39, train_loss: 1.1189, test_loss: 1.0969, test_f1: 0.4645
 epoch: 40, train_loss: 1.1105, test_loss: 1.0881, test_f1: 0.4700
 epoch: 41, train_loss: 1.1138, test_loss: 1.0858, test_f1: 0.4639
 epoch: 42, train_loss: 1.1016, test_loss: 1.0757, test_f1: 0.4731
 epoch: 43, train_loss: 1.0945, test_loss: 1.0685, test_f1: 0.4779
 epoch: 44, train_loss: 1.0885, test_loss: 1.0635, test_f1: 0.4770
 epoch: 45, train_loss: 1.0818, test_loss: 1.0575, test_f1: 0.4839
 epoch: 46, train_loss: 1.0773, test_loss: 1.0507, test_f1: 0.4811
 epoch: 47, train_loss: 1.0683, test_loss: 1.0481, test_f1: 0.4807
 epoch: 48, train_loss: 1.0649, test_loss: 1.0407, test_f1: 0.4795
 epoch: 49, train_loss: 1.0581, test_loss: 1.0379, test_f1: 0.4786
 epoch: 50, train_loss: 1.0527, test_loss: 1.0315, test_f1: 0.4803
 epoch: 51, train_loss: 1.0460, test_loss: 1.0267, test_f1: 0.4809
 epoch: 52, train_loss: 1.0407, test_loss: 1.0248, test_f1: 0.4770
 epoch: 53, train_loss: 1.0374, test_loss: 1.0230, test_f1: 0.4782
 epoch: 54, train_loss: 1.0392, test_loss: 1.0184, test_f1: 0.4796
 epoch: 55, train_loss: 1.0299, test_loss: 1.0176, test_f1: 0.4797
 epoch: 56, train_loss: 1.0325, test_loss: 1.0166, test_f1: 0.4783
 epoch: 57, train_loss: 1.0316, test_loss: 1.0185, test_f1: 0.4776
 epoch: 58, train_loss: 1.0235, test_loss: 1.0128, test_f1: 0.4778
 epoch: 59, train_loss: 1.0221, test_loss: 1.0127, test_f1: 0.4791
 epoch: 60, train_loss: 1.0125, test_loss: 1.0093, test_f1: 0.4814
 epoch: 61, train_loss: 1.0134, test_loss: 1.0005, test_f1: 0.4787
 epoch: 62, train_loss: 1.0160, test_loss: 1.0040, test_f1: 0.4828
 epoch: 63, train_loss: 1.0026, test_loss: 1.0029, test_f1: 0.4864
 epoch: 64, train_loss: 1.0097, test_loss: 0.9957, test_f1: 0.4809
 epoch: 65, train_loss: 0.9993, test_loss: 0.9970, test_f1: 0.4880
 epoch: 66, train_loss: 1.0001, test_loss: 0.9978, test_f1: 0.4875
 epoch: 67, train_loss: 1.0017, test_loss: 0.9910, test_f1: 0.4836
 epoch: 68, train_loss: 1.0012, test_loss: 0.9957, test_f1: 0.4835
 epoch: 69, train_loss: 0.9978, test_loss: 0.9937, test_f1: 0.4881
 epoch: 70, train_loss: 0.9941, test_loss: 0.9937, test_f1: 0.4813
 epoch: 71, train_loss: 0.9907, test_loss: 0.9869, test_f1: 0.4856
 epoch: 72, train_loss: 0.9892, test_loss: 0.9913, test_f1: 0.4906
 epoch: 73, train_loss: 0.9808, test_loss: 0.9859, test_f1: 0.4877
 epoch: 74, train_loss: 0.9787, test_loss: 0.9846, test_f1: 0.4826
 epoch: 75, train_loss: 0.9870, test_loss: 0.9916, test_f1: 0.4868
 epoch: 76, train_loss: 0.9770, test_loss: 0.9865, test_f1: 0.4850
 epoch: 77, train_loss: 0.9800, test_loss: 0.9814, test_f1: 0.4883
 epoch: 78, train_loss: 0.9840, test_loss: 0.9806, test_f1: 0.4822
 epoch: 79, train_loss: 0.9723, test_loss: 0.9713, test_f1: 0.4849
 epoch: 80, train_loss: 0.9784, test_loss: 0.9755, test_f1: 0.4867
 epoch: 81, train_loss: 0.9704, test_loss: 0.9773, test_f1: 0.4836
 epoch: 82, train_loss: 0.9696, test_loss: 0.9719, test_f1: 0.4851
 epoch: 83, train_loss: 0.9594, test_loss: 0.9715, test_f1: 0.4878
 epoch: 84, train_loss: 0.9693, test_loss: 0.9739, test_f1: 0.4821
 epoch: 85, train_loss: 0.9673, test_loss: 0.9773, test_f1: 0.4829
 epoch: 86, train_loss: 0.9615, test_loss: 0.9729, test_f1: 0.4802
 epoch: 87, train_loss: 0.9661, test_loss: 0.9666, test_f1: 0.4816
 epoch: 88, train_loss: 0.9587, test_loss: 0.9619, test_f1: 0.4912
 epoch: 89, train_loss: 0.9590, test_loss: 0.9714, test_f1: 0.4826
 epoch: 90, train_loss: 0.9526, test_loss: 0.9657, test_f1: 0.4880
 epoch: 91, train_loss: 0.9556, test_loss: 0.9651, test_f1: 0.4845
 epoch: 92, train_loss: 0.9442, test_loss: 0.9727, test_f1: 0.4804
 epoch: 93, train_loss: 0.9536, test_loss: 0.9680, test_f1: 0.4885
 epoch: 94, train_loss: 0.9496, test_loss: 0.9647, test_f1: 0.4908
 epoch: 95, train_loss: 0.9429, test_loss: 0.9582, test_f1: 0.4917
 epoch: 96, train_loss: 0.9457, test_loss: 0.9533, test_f1: 0.4902
 epoch: 97, train_loss: 0.9476, test_loss: 0.9547, test_f1: 0.4889
 epoch: 98, train_loss: 0.9408, test_loss: 0.9570, test_f1: 0.4959
 epoch: 99, train_loss: 0.9405, test_loss: 0.9581, test_f1: 0.4911
##################ITERATION #2 ****************************************
 epoch: 0, train_loss: 1.3189, test_loss: 1.3268, test_f1: 0.2270
 epoch: 1, train_loss: 1.3081, test_loss: 1.3249, test_f1: 0.2270
 epoch: 2, train_loss: 1.2991, test_loss: 1.3160, test_f1: 0.2270
 epoch: 3, train_loss: 1.2876, test_loss: 1.3043, test_f1: 0.2270
 epoch: 4, train_loss: 1.2840, test_loss: 1.2932, test_f1: 0.2270
 epoch: 5, train_loss: 1.2773, test_loss: 1.2818, test_f1: 0.2764
 epoch: 6, train_loss: 1.2706, test_loss: 1.2611, test_f1: 0.3130
 epoch: 7, train_loss: 1.2607, test_loss: 1.2455, test_f1: 0.3251
 epoch: 8, train_loss: 1.2563, test_loss: 1.2352, test_f1: 0.3275
 epoch: 9, train_loss: 1.2472, test_loss: 1.2282, test_f1: 0.3328
 epoch: 10, train_loss: 1.2395, test_loss: 1.2193, test_f1: 0.3355
 epoch: 11, train_loss: 1.2365, test_loss: 1.2123, test_f1: 0.3414
 epoch: 12, train_loss: 1.2306, test_loss: 1.2062, test_f1: 0.3497
 epoch: 13, train_loss: 1.2241, test_loss: 1.2003, test_f1: 0.3612
 epoch: 14, train_loss: 1.2176, test_loss: 1.1941, test_f1: 0.3642
 epoch: 15, train_loss: 1.2178, test_loss: 1.1896, test_f1: 0.3668
 epoch: 16, train_loss: 1.2089, test_loss: 1.1855, test_f1: 0.3619
 epoch: 17, train_loss: 1.2040, test_loss: 1.1776, test_f1: 0.3637
 epoch: 18, train_loss: 1.1956, test_loss: 1.1723, test_f1: 0.3653
 epoch: 19, train_loss: 1.1971, test_loss: 1.1680, test_f1: 0.3663
 epoch: 20, train_loss: 1.1870, test_loss: 1.1620, test_f1: 0.3725
 epoch: 21, train_loss: 1.1814, test_loss: 1.1549, test_f1: 0.3742
 epoch: 22, train_loss: 1.1834, test_loss: 1.1518, test_f1: 0.3773
 epoch: 23, train_loss: 1.1728, test_loss: 1.1474, test_f1: 0.3817
 epoch: 24, train_loss: 1.1720, test_loss: 1.1434, test_f1: 0.3840
 epoch: 25, train_loss: 1.1627, test_loss: 1.1377, test_f1: 0.3955
 epoch: 26, train_loss: 1.1611, test_loss: 1.1332, test_f1: 0.4051
 epoch: 27, train_loss: 1.1561, test_loss: 1.1283, test_f1: 0.4080
 epoch: 28, train_loss: 1.1522, test_loss: 1.1247, test_f1: 0.4139
 epoch: 29, train_loss: 1.1526, test_loss: 1.1190, test_f1: 0.4131
 epoch: 30, train_loss: 1.1411, test_loss: 1.1131, test_f1: 0.4227
 epoch: 31, train_loss: 1.1396, test_loss: 1.1091, test_f1: 0.4351
 epoch: 32, train_loss: 1.1314, test_loss: 1.1036, test_f1: 0.4302
 epoch: 33, train_loss: 1.1242, test_loss: 1.1001, test_f1: 0.4301
 epoch: 34, train_loss: 1.1224, test_loss: 1.0961, test_f1: 0.4431
 epoch: 35, train_loss: 1.1218, test_loss: 1.0915, test_f1: 0.4506
 epoch: 36, train_loss: 1.1217, test_loss: 1.0876, test_f1: 0.4477
 epoch: 37, train_loss: 1.1166, test_loss: 1.0808, test_f1: 0.4552
 epoch: 38, train_loss: 1.1119, test_loss: 1.0775, test_f1: 0.4621
 epoch: 39, train_loss: 1.1080, test_loss: 1.0772, test_f1: 0.4606
 epoch: 40, train_loss: 1.1008, test_loss: 1.0693, test_f1: 0.4675
 epoch: 41, train_loss: 1.0941, test_loss: 1.0656, test_f1: 0.4679
 epoch: 42, train_loss: 1.0875, test_loss: 1.0600, test_f1: 0.4707
 epoch: 43, train_loss: 1.0825, test_loss: 1.0569, test_f1: 0.4731
 epoch: 44, train_loss: 1.0821, test_loss: 1.0523, test_f1: 0.4735
 epoch: 45, train_loss: 1.0778, test_loss: 1.0470, test_f1: 0.4699
 epoch: 46, train_loss: 1.0695, test_loss: 1.0441, test_f1: 0.4736
 epoch: 47, train_loss: 1.0704, test_loss: 1.0437, test_f1: 0.4683
 epoch: 48, train_loss: 1.0608, test_loss: 1.0396, test_f1: 0.4647
 epoch: 49, train_loss: 1.0573, test_loss: 1.0364, test_f1: 0.4677
 epoch: 50, train_loss: 1.0577, test_loss: 1.0348, test_f1: 0.4648
 epoch: 51, train_loss: 1.0477, test_loss: 1.0319, test_f1: 0.4600
 epoch: 52, train_loss: 1.0515, test_loss: 1.0292, test_f1: 0.4660
 epoch: 53, train_loss: 1.0473, test_loss: 1.0281, test_f1: 0.4678
 epoch: 54, train_loss: 1.0437, test_loss: 1.0263, test_f1: 0.4696
 epoch: 55, train_loss: 1.0457, test_loss: 1.0247, test_f1: 0.4696
 epoch: 56, train_loss: 1.0397, test_loss: 1.0238, test_f1: 0.4801
 epoch: 57, train_loss: 1.0359, test_loss: 1.0219, test_f1: 0.4718
 epoch: 58, train_loss: 1.0378, test_loss: 1.0209, test_f1: 0.4716
 epoch: 59, train_loss: 1.0366, test_loss: 1.0217, test_f1: 0.4779
 epoch: 60, train_loss: 1.0313, test_loss: 1.0190, test_f1: 0.4798
 epoch: 61, train_loss: 1.0290, test_loss: 1.0178, test_f1: 0.4725
 epoch: 62, train_loss: 1.0286, test_loss: 1.0166, test_f1: 0.4732
 epoch: 63, train_loss: 1.0310, test_loss: 1.0156, test_f1: 0.4815
 epoch: 64, train_loss: 1.0244, test_loss: 1.0148, test_f1: 0.4811
 epoch: 65, train_loss: 1.0197, test_loss: 1.0135, test_f1: 0.4827
 epoch: 66, train_loss: 1.0199, test_loss: 1.0124, test_f1: 0.4863
 epoch: 67, train_loss: 1.0173, test_loss: 1.0102, test_f1: 0.4863
 epoch: 68, train_loss: 1.0176, test_loss: 1.0091, test_f1: 0.4889
 epoch: 69, train_loss: 1.0198, test_loss: 1.0091, test_f1: 0.4915
 epoch: 70, train_loss: 1.0135, test_loss: 1.0078, test_f1: 0.4908
 epoch: 71, train_loss: 1.0069, test_loss: 1.0058, test_f1: 0.4890
 epoch: 72, train_loss: 1.0116, test_loss: 1.0052, test_f1: 0.4885
 epoch: 73, train_loss: 1.0065, test_loss: 1.0031, test_f1: 0.4869
 epoch: 74, train_loss: 1.0055, test_loss: 1.0034, test_f1: 0.4875
 epoch: 75, train_loss: 1.0074, test_loss: 1.0027, test_f1: 0.4872
 epoch: 76, train_loss: 1.0041, test_loss: 1.0032, test_f1: 0.4877
 epoch: 77, train_loss: 1.0050, test_loss: 1.0024, test_f1: 0.4861
 epoch: 78, train_loss: 0.9986, test_loss: 1.0006, test_f1: 0.4885
 epoch: 79, train_loss: 1.0087, test_loss: 0.9969, test_f1: 0.4851
 epoch: 80, train_loss: 0.9950, test_loss: 0.9976, test_f1: 0.4851
 epoch: 81, train_loss: 0.9965, test_loss: 0.9976, test_f1: 0.4872
 epoch: 82, train_loss: 0.9969, test_loss: 0.9973, test_f1: 0.4885
 epoch: 83, train_loss: 0.9895, test_loss: 0.9974, test_f1: 0.4863
 epoch: 84, train_loss: 0.9942, test_loss: 0.9958, test_f1: 0.4884
 epoch: 85, train_loss: 0.9821, test_loss: 0.9937, test_f1: 0.4851
 epoch: 86, train_loss: 0.9943, test_loss: 0.9942, test_f1: 0.4865
 epoch: 87, train_loss: 0.9874, test_loss: 0.9929, test_f1: 0.4868
 epoch: 88, train_loss: 0.9888, test_loss: 0.9908, test_f1: 0.4895
 epoch: 89, train_loss: 0.9851, test_loss: 0.9907, test_f1: 0.4920
 epoch: 90, train_loss: 0.9798, test_loss: 0.9911, test_f1: 0.4875
 epoch: 91, train_loss: 0.9829, test_loss: 0.9916, test_f1: 0.4860
 epoch: 92, train_loss: 0.9822, test_loss: 0.9903, test_f1: 0.4877
 epoch: 93, train_loss: 0.9841, test_loss: 0.9883, test_f1: 0.4948
 epoch: 94, train_loss: 0.9792, test_loss: 0.9860, test_f1: 0.4912
 epoch: 95, train_loss: 0.9790, test_loss: 0.9855, test_f1: 0.4888
 epoch: 96, train_loss: 0.9828, test_loss: 0.9852, test_f1: 0.4872
 epoch: 97, train_loss: 0.9732, test_loss: 0.9854, test_f1: 0.4935
 epoch: 98, train_loss: 0.9725, test_loss: 0.9836, test_f1: 0.4939
 epoch: 99, train_loss: 0.9717, test_loss: 0.9817, test_f1: 0.5002
##################ITERATION #3 ****************************************
 epoch: 0, train_loss: 1.3122, test_loss: 1.3197, test_f1: 0.2270
 epoch: 1, train_loss: 1.2941, test_loss: 1.3191, test_f1: 0.2270
 epoch: 2, train_loss: 1.2856, test_loss: 1.3094, test_f1: 0.2270
 epoch: 3, train_loss: 1.2770, test_loss: 1.2906, test_f1: 0.2270
 epoch: 4, train_loss: 1.2666, test_loss: 1.2717, test_f1: 0.2270
 epoch: 5, train_loss: 1.2603, test_loss: 1.2531, test_f1: 0.2270
 epoch: 6, train_loss: 1.2512, test_loss: 1.2380, test_f1: 0.2464
 epoch: 7, train_loss: 1.2425, test_loss: 1.2273, test_f1: 0.2698
 epoch: 8, train_loss: 1.2365, test_loss: 1.2204, test_f1: 0.2737
 epoch: 9, train_loss: 1.2294, test_loss: 1.2128, test_f1: 0.2851
 epoch: 10, train_loss: 1.2217, test_loss: 1.2055, test_f1: 0.3097
 epoch: 11, train_loss: 1.2143, test_loss: 1.1964, test_f1: 0.3300
 epoch: 12, train_loss: 1.2077, test_loss: 1.1891, test_f1: 0.3526
 epoch: 13, train_loss: 1.2030, test_loss: 1.1803, test_f1: 0.3697
 epoch: 14, train_loss: 1.1920, test_loss: 1.1720, test_f1: 0.3850
 epoch: 15, train_loss: 1.1847, test_loss: 1.1639, test_f1: 0.4005
 epoch: 16, train_loss: 1.1762, test_loss: 1.1554, test_f1: 0.4158
 epoch: 17, train_loss: 1.1670, test_loss: 1.1481, test_f1: 0.4207
 epoch: 18, train_loss: 1.1638, test_loss: 1.1398, test_f1: 0.4247
 epoch: 19, train_loss: 1.1604, test_loss: 1.1327, test_f1: 0.4256
 epoch: 20, train_loss: 1.1505, test_loss: 1.1248, test_f1: 0.4282
 epoch: 21, train_loss: 1.1431, test_loss: 1.1181, test_f1: 0.4306
 epoch: 22, train_loss: 1.1320, test_loss: 1.1099, test_f1: 0.4431
 epoch: 23, train_loss: 1.1286, test_loss: 1.1028, test_f1: 0.4470
 epoch: 24, train_loss: 1.1186, test_loss: 1.0936, test_f1: 0.4460
 epoch: 25, train_loss: 1.1143, test_loss: 1.0853, test_f1: 0.4469
 epoch: 26, train_loss: 1.1076, test_loss: 1.0790, test_f1: 0.4457
 epoch: 27, train_loss: 1.1002, test_loss: 1.0720, test_f1: 0.4415
 epoch: 28, train_loss: 1.0963, test_loss: 1.0660, test_f1: 0.4331
 epoch: 29, train_loss: 1.0872, test_loss: 1.0599, test_f1: 0.4393
 epoch: 30, train_loss: 1.0828, test_loss: 1.0540, test_f1: 0.4461
 epoch: 31, train_loss: 1.0744, test_loss: 1.0474, test_f1: 0.4422
 epoch: 32, train_loss: 1.0691, test_loss: 1.0419, test_f1: 0.4428
 epoch: 33, train_loss: 1.0672, test_loss: 1.0366, test_f1: 0.4430
 epoch: 34, train_loss: 1.0575, test_loss: 1.0324, test_f1: 0.4486
 epoch: 35, train_loss: 1.0527, test_loss: 1.0206, test_f1: 0.4531
 epoch: 36, train_loss: 1.0429, test_loss: 1.0213, test_f1: 0.4524
 epoch: 37, train_loss: 1.0412, test_loss: 1.0174, test_f1: 0.4564
 epoch: 38, train_loss: 1.0253, test_loss: 1.0083, test_f1: 0.4611
 epoch: 39, train_loss: 1.0257, test_loss: 1.0057, test_f1: 0.4570
 epoch: 40, train_loss: 1.0216, test_loss: 1.0074, test_f1: 0.4664
 epoch: 41, train_loss: 1.0106, test_loss: 1.0032, test_f1: 0.4662
 epoch: 42, train_loss: 1.0142, test_loss: 0.9945, test_f1: 0.4665
 epoch: 43, train_loss: 1.0103, test_loss: 0.9921, test_f1: 0.4766
 epoch: 44, train_loss: 0.9944, test_loss: 0.9901, test_f1: 0.4739
 epoch: 45, train_loss: 0.9990, test_loss: 0.9861, test_f1: 0.4695
 epoch: 46, train_loss: 0.9900, test_loss: 0.9838, test_f1: 0.4759
 epoch: 47, train_loss: 0.9906, test_loss: 0.9848, test_f1: 0.4752
 epoch: 48, train_loss: 0.9906, test_loss: 0.9791, test_f1: 0.4767
 epoch: 49, train_loss: 0.9784, test_loss: 0.9763, test_f1: 0.4783
 epoch: 50, train_loss: 0.9769, test_loss: 0.9749, test_f1: 0.4777
 epoch: 51, train_loss: 0.9775, test_loss: 0.9753, test_f1: 0.4803
 epoch: 52, train_loss: 0.9734, test_loss: 0.9749, test_f1: 0.4829
 epoch: 53, train_loss: 0.9698, test_loss: 0.9720, test_f1: 0.4850
 epoch: 54, train_loss: 0.9634, test_loss: 0.9743, test_f1: 0.4850
 epoch: 55, train_loss: 0.9607, test_loss: 0.9715, test_f1: 0.4843
 epoch: 56, train_loss: 0.9732, test_loss: 0.9700, test_f1: 0.4865
 epoch: 57, train_loss: 0.9616, test_loss: 0.9694, test_f1: 0.4849
 epoch: 58, train_loss: 0.9647, test_loss: 0.9683, test_f1: 0.4850
 epoch: 59, train_loss: 0.9590, test_loss: 0.9678, test_f1: 0.4863
 epoch: 60, train_loss: 0.9594, test_loss: 0.9638, test_f1: 0.4862
 epoch: 61, train_loss: 0.9597, test_loss: 0.9640, test_f1: 0.4861
 epoch: 62, train_loss: 0.9610, test_loss: 0.9625, test_f1: 0.4819
 epoch: 63, train_loss: 0.9549, test_loss: 0.9641, test_f1: 0.4853
 epoch: 64, train_loss: 0.9502, test_loss: 0.9629, test_f1: 0.4967
 epoch: 65, train_loss: 0.9463, test_loss: 0.9642, test_f1: 0.4939
 epoch: 66, train_loss: 0.9503, test_loss: 0.9615, test_f1: 0.4915
 epoch: 67, train_loss: 0.9459, test_loss: 0.9578, test_f1: 0.4906
 epoch: 68, train_loss: 0.9499, test_loss: 0.9638, test_f1: 0.4808
 epoch: 69, train_loss: 0.9402, test_loss: 0.9680, test_f1: 0.4912
 epoch: 70, train_loss: 0.9440, test_loss: 0.9646, test_f1: 0.4918
 epoch: 71, train_loss: 0.9363, test_loss: 0.9614, test_f1: 0.4853
 epoch: 72, train_loss: 0.9413, test_loss: 0.9642, test_f1: 0.4908
 epoch: 73, train_loss: 0.9412, test_loss: 0.9610, test_f1: 0.4865
 epoch: 74, train_loss: 0.9405, test_loss: 0.9624, test_f1: 0.4892
 epoch: 75, train_loss: 0.9440, test_loss: 0.9598, test_f1: 0.4897
 epoch: 76, train_loss: 0.9382, test_loss: 0.9619, test_f1: 0.4901
 epoch: 77, train_loss: 0.9312, test_loss: 0.9619, test_f1: 0.4913
 epoch: 78, train_loss: 0.9383, test_loss: 0.9606, test_f1: 0.4932
 epoch: 79, train_loss: 0.9302, test_loss: 0.9613, test_f1: 0.4959
 epoch: 80, train_loss: 0.9299, test_loss: 0.9589, test_f1: 0.5063
 epoch: 81, train_loss: 0.9332, test_loss: 0.9604, test_f1: 0.4998
 epoch: 82, train_loss: 0.9245, test_loss: 0.9553, test_f1: 0.5018
 epoch: 83, train_loss: 0.9292, test_loss: 0.9571, test_f1: 0.4913
 epoch: 84, train_loss: 0.9221, test_loss: 0.9568, test_f1: 0.4956
 epoch: 85, train_loss: 0.9165, test_loss: 0.9590, test_f1: 0.5000
 epoch: 86, train_loss: 0.9153, test_loss: 0.9558, test_f1: 0.4921
 epoch: 87, train_loss: 0.9128, test_loss: 0.9529, test_f1: 0.4937
 epoch: 88, train_loss: 0.9199, test_loss: 0.9553, test_f1: 0.4955
 epoch: 89, train_loss: 0.9137, test_loss: 0.9512, test_f1: 0.5039
 epoch: 90, train_loss: 0.9154, test_loss: 0.9541, test_f1: 0.4978
 epoch: 91, train_loss: 0.9250, test_loss: 0.9607, test_f1: 0.5014
 epoch: 92, train_loss: 0.9152, test_loss: 0.9616, test_f1: 0.5083
 epoch: 93, train_loss: 0.9171, test_loss: 0.9586, test_f1: 0.5018
 epoch: 94, train_loss: 0.9114, test_loss: 0.9570, test_f1: 0.5037
 epoch: 95, train_loss: 0.9142, test_loss: 0.9584, test_f1: 0.5060
 epoch: 96, train_loss: 0.9053, test_loss: 0.9569, test_f1: 0.5083
 epoch: 97, train_loss: 0.9071, test_loss: 0.9562, test_f1: 0.5063
 epoch: 98, train_loss: 0.9045, test_loss: 0.9580, test_f1: 0.4966
 epoch: 99, train_loss: 0.9077, test_loss: 0.9575, test_f1: 0.4937
##################ITERATION #4 ****************************************
 epoch: 0, train_loss: 1.3037, test_loss: 1.3164, test_f1: 0.2270
 epoch: 1, train_loss: 1.2783, test_loss: 1.3072, test_f1: 0.2270
 epoch: 2, train_loss: 1.2651, test_loss: 1.2897, test_f1: 0.2270
 epoch: 3, train_loss: 1.2574, test_loss: 1.2655, test_f1: 0.2270
 epoch: 4, train_loss: 1.2467, test_loss: 1.2433, test_f1: 0.2398
 epoch: 5, train_loss: 1.2407, test_loss: 1.2206, test_f1: 0.2704
 epoch: 6, train_loss: 1.2363, test_loss: 1.2050, test_f1: 0.2963
 epoch: 7, train_loss: 1.2260, test_loss: 1.1951, test_f1: 0.3044
 epoch: 8, train_loss: 1.2205, test_loss: 1.1872, test_f1: 0.3109
 epoch: 9, train_loss: 1.2153, test_loss: 1.1787, test_f1: 0.3181
 epoch: 10, train_loss: 1.2095, test_loss: 1.1708, test_f1: 0.3270
 epoch: 11, train_loss: 1.2055, test_loss: 1.1631, test_f1: 0.3362
 epoch: 12, train_loss: 1.1932, test_loss: 1.1575, test_f1: 0.3517
 epoch: 13, train_loss: 1.1913, test_loss: 1.1498, test_f1: 0.3722
 epoch: 14, train_loss: 1.1854, test_loss: 1.1420, test_f1: 0.3759
 epoch: 15, train_loss: 1.1712, test_loss: 1.1349, test_f1: 0.3803
 epoch: 16, train_loss: 1.1598, test_loss: 1.1305, test_f1: 0.4063
 epoch: 17, train_loss: 1.1597, test_loss: 1.1238, test_f1: 0.4133
 epoch: 18, train_loss: 1.1571, test_loss: 1.1156, test_f1: 0.4063
 epoch: 19, train_loss: 1.1429, test_loss: 1.1068, test_f1: 0.4107
 epoch: 20, train_loss: 1.1425, test_loss: 1.0992, test_f1: 0.4145
 epoch: 21, train_loss: 1.1358, test_loss: 1.0926, test_f1: 0.4250
 epoch: 22, train_loss: 1.1261, test_loss: 1.0872, test_f1: 0.4381
 epoch: 23, train_loss: 1.1204, test_loss: 1.0791, test_f1: 0.4423
 epoch: 24, train_loss: 1.1151, test_loss: 1.0715, test_f1: 0.4526
 epoch: 25, train_loss: 1.1113, test_loss: 1.0667, test_f1: 0.4523
 epoch: 26, train_loss: 1.0961, test_loss: 1.0597, test_f1: 0.4518
 epoch: 27, train_loss: 1.0907, test_loss: 1.0547, test_f1: 0.4540
 epoch: 28, train_loss: 1.0909, test_loss: 1.0477, test_f1: 0.4544
 epoch: 29, train_loss: 1.0814, test_loss: 1.0439, test_f1: 0.4617
 epoch: 30, train_loss: 1.0775, test_loss: 1.0364, test_f1: 0.4674
 epoch: 31, train_loss: 1.0614, test_loss: 1.0315, test_f1: 0.4602
 epoch: 32, train_loss: 1.0584, test_loss: 1.0211, test_f1: 0.4688
 epoch: 33, train_loss: 1.0540, test_loss: 1.0160, test_f1: 0.4680
 epoch: 34, train_loss: 1.0450, test_loss: 1.0151, test_f1: 0.4598
 epoch: 35, train_loss: 1.0390, test_loss: 1.0069, test_f1: 0.4621
 epoch: 36, train_loss: 1.0384, test_loss: 0.9998, test_f1: 0.4689
 epoch: 37, train_loss: 1.0308, test_loss: 0.9953, test_f1: 0.4648
 epoch: 38, train_loss: 1.0280, test_loss: 0.9891, test_f1: 0.4689
 epoch: 39, train_loss: 1.0216, test_loss: 0.9873, test_f1: 0.4706
 epoch: 40, train_loss: 1.0213, test_loss: 0.9867, test_f1: 0.4716
 epoch: 41, train_loss: 1.0198, test_loss: 0.9788, test_f1: 0.4813
 epoch: 42, train_loss: 1.0115, test_loss: 0.9758, test_f1: 0.4837
 epoch: 43, train_loss: 0.9982, test_loss: 0.9718, test_f1: 0.4800
 epoch: 44, train_loss: 1.0028, test_loss: 0.9640, test_f1: 0.4767
 epoch: 45, train_loss: 0.9996, test_loss: 0.9641, test_f1: 0.4820
 epoch: 46, train_loss: 0.9929, test_loss: 0.9627, test_f1: 0.4860
 epoch: 47, train_loss: 0.9806, test_loss: 0.9584, test_f1: 0.4873
 epoch: 48, train_loss: 0.9874, test_loss: 0.9553, test_f1: 0.4849
 epoch: 49, train_loss: 0.9774, test_loss: 0.9560, test_f1: 0.4858
 epoch: 50, train_loss: 0.9762, test_loss: 0.9629, test_f1: 0.4831
 epoch: 51, train_loss: 0.9720, test_loss: 0.9519, test_f1: 0.4873
 epoch: 52, train_loss: 0.9772, test_loss: 0.9541, test_f1: 0.4886
 epoch: 53, train_loss: 0.9672, test_loss: 0.9536, test_f1: 0.4849
 epoch: 54, train_loss: 0.9549, test_loss: 0.9517, test_f1: 0.4904
 epoch: 55, train_loss: 0.9715, test_loss: 0.9482, test_f1: 0.4946
 epoch: 56, train_loss: 0.9687, test_loss: 0.9470, test_f1: 0.4938
 epoch: 57, train_loss: 0.9622, test_loss: 0.9443, test_f1: 0.4901
 epoch: 58, train_loss: 0.9606, test_loss: 0.9500, test_f1: 0.4934
 epoch: 59, train_loss: 0.9557, test_loss: 0.9483, test_f1: 0.4925
 epoch: 60, train_loss: 0.9534, test_loss: 0.9485, test_f1: 0.4863
 epoch: 61, train_loss: 0.9551, test_loss: 0.9519, test_f1: 0.4887
 epoch: 62, train_loss: 0.9559, test_loss: 0.9487, test_f1: 0.4908
 epoch: 63, train_loss: 0.9600, test_loss: 0.9500, test_f1: 0.4942
 epoch: 64, train_loss: 0.9484, test_loss: 0.9447, test_f1: 0.4911
 epoch: 65, train_loss: 0.9481, test_loss: 0.9496, test_f1: 0.4894
 epoch: 66, train_loss: 0.9478, test_loss: 0.9459, test_f1: 0.4957
 epoch: 67, train_loss: 0.9433, test_loss: 0.9448, test_f1: 0.4990
 epoch: 68, train_loss: 0.9517, test_loss: 0.9479, test_f1: 0.4933
 epoch: 69, train_loss: 0.9482, test_loss: 0.9482, test_f1: 0.4920
 epoch: 70, train_loss: 0.9334, test_loss: 0.9443, test_f1: 0.4985
 epoch: 71, train_loss: 0.9429, test_loss: 0.9458, test_f1: 0.4946
 epoch: 72, train_loss: 0.9391, test_loss: 0.9459, test_f1: 0.4937
 epoch: 73, train_loss: 0.9376, test_loss: 0.9434, test_f1: 0.4997
 epoch: 74, train_loss: 0.9418, test_loss: 0.9465, test_f1: 0.4916
 epoch: 75, train_loss: 0.9306, test_loss: 0.9443, test_f1: 0.4987
 epoch: 76, train_loss: 0.9429, test_loss: 0.9426, test_f1: 0.5046
 epoch: 77, train_loss: 0.9265, test_loss: 0.9433, test_f1: 0.5006
 epoch: 78, train_loss: 0.9323, test_loss: 0.9448, test_f1: 0.4973
 epoch: 79, train_loss: 0.9252, test_loss: 0.9438, test_f1: 0.4984
 epoch: 80, train_loss: 0.9309, test_loss: 0.9467, test_f1: 0.4940
 epoch: 81, train_loss: 0.9315, test_loss: 0.9474, test_f1: 0.4942
 epoch: 82, train_loss: 0.9233, test_loss: 0.9463, test_f1: 0.4996
 epoch: 83, train_loss: 0.9240, test_loss: 0.9472, test_f1: 0.4970
 epoch: 84, train_loss: 0.9284, test_loss: 0.9450, test_f1: 0.4974
 epoch: 85, train_loss: 0.9203, test_loss: 0.9490, test_f1: 0.4974
 epoch: 86, train_loss: 0.9231, test_loss: 0.9513, test_f1: 0.4917
 epoch: 87, train_loss: 0.9170, test_loss: 0.9513, test_f1: 0.4896
 epoch: 88, train_loss: 0.9121, test_loss: 0.9487, test_f1: 0.4922
 epoch: 89, train_loss: 0.9210, test_loss: 0.9488, test_f1: 0.5034
 epoch: 90, train_loss: 0.9209, test_loss: 0.9541, test_f1: 0.4994
 epoch: 91, train_loss: 0.9114, test_loss: 0.9539, test_f1: 0.5048
 epoch: 92, train_loss: 0.9176, test_loss: 0.9475, test_f1: 0.5070
 epoch: 93, train_loss: 0.9151, test_loss: 0.9457, test_f1: 0.5090
 epoch: 94, train_loss: 0.9095, test_loss: 0.9478, test_f1: 0.5124
 epoch: 95, train_loss: 0.9027, test_loss: 0.9483, test_f1: 0.5128
 epoch: 96, train_loss: 0.9185, test_loss: 0.9476, test_f1: 0.5157
 epoch: 97, train_loss: 0.9140, test_loss: 0.9536, test_f1: 0.5110
 epoch: 98, train_loss: 0.9044, test_loss: 0.9546, test_f1: 0.5076
 epoch: 99, train_loss: 0.9064, test_loss: 0.9547, test_f1: 0.5058
##################ITERATION #5 ****************************************
 epoch: 0, train_loss: 1.3071, test_loss: 1.3305, test_f1: 0.2270
 epoch: 1, train_loss: 1.2758, test_loss: 1.3311, test_f1: 0.2270
 epoch: 2, train_loss: 1.2663, test_loss: 1.3280, test_f1: 0.2270
 epoch: 3, train_loss: 1.2502, test_loss: 1.3276, test_f1: 0.2270
 epoch: 4, train_loss: 1.2361, test_loss: 1.3064, test_f1: 0.2526
 epoch: 5, train_loss: 1.2271, test_loss: 1.2411, test_f1: 0.2582
 epoch: 6, train_loss: 1.2193, test_loss: 1.1954, test_f1: 0.2999
 epoch: 7, train_loss: 1.2145, test_loss: 1.1785, test_f1: 0.3055
 epoch: 8, train_loss: 1.2022, test_loss: 1.1690, test_f1: 0.3117
 epoch: 9, train_loss: 1.1935, test_loss: 1.1601, test_f1: 0.3402
 epoch: 10, train_loss: 1.1863, test_loss: 1.1523, test_f1: 0.3499
 epoch: 11, train_loss: 1.1860, test_loss: 1.1430, test_f1: 0.3598
 epoch: 12, train_loss: 1.1710, test_loss: 1.1349, test_f1: 0.3755
 epoch: 13, train_loss: 1.1728, test_loss: 1.1300, test_f1: 0.3806
 epoch: 14, train_loss: 1.1581, test_loss: 1.1222, test_f1: 0.4030
 epoch: 15, train_loss: 1.1541, test_loss: 1.1111, test_f1: 0.4137
 epoch: 16, train_loss: 1.1472, test_loss: 1.1070, test_f1: 0.4241
 epoch: 17, train_loss: 1.1424, test_loss: 1.0999, test_f1: 0.4221
 epoch: 18, train_loss: 1.1376, test_loss: 1.0940, test_f1: 0.4381
 epoch: 19, train_loss: 1.1310, test_loss: 1.0885, test_f1: 0.4446
 epoch: 20, train_loss: 1.1261, test_loss: 1.0842, test_f1: 0.4520
 epoch: 21, train_loss: 1.1165, test_loss: 1.0747, test_f1: 0.4614
 epoch: 22, train_loss: 1.1100, test_loss: 1.0674, test_f1: 0.4643
 epoch: 23, train_loss: 1.1102, test_loss: 1.0614, test_f1: 0.4713
 epoch: 24, train_loss: 1.1026, test_loss: 1.0578, test_f1: 0.4604
 epoch: 25, train_loss: 1.1017, test_loss: 1.0553, test_f1: 0.4676
 epoch: 26, train_loss: 1.0978, test_loss: 1.0486, test_f1: 0.4683
 epoch: 27, train_loss: 1.0823, test_loss: 1.0437, test_f1: 0.4590
 epoch: 28, train_loss: 1.0815, test_loss: 1.0337, test_f1: 0.4689
 epoch: 29, train_loss: 1.0787, test_loss: 1.0314, test_f1: 0.4592
 epoch: 30, train_loss: 1.0717, test_loss: 1.0280, test_f1: 0.4621
 epoch: 31, train_loss: 1.0669, test_loss: 1.0205, test_f1: 0.4682
 epoch: 32, train_loss: 1.0641, test_loss: 1.0206, test_f1: 0.4608
 epoch: 33, train_loss: 1.0533, test_loss: 1.0141, test_f1: 0.4610
 epoch: 34, train_loss: 1.0504, test_loss: 1.0066, test_f1: 0.4679
 epoch: 35, train_loss: 1.0446, test_loss: 1.0059, test_f1: 0.4687
 epoch: 36, train_loss: 1.0381, test_loss: 0.9978, test_f1: 0.4764
 epoch: 37, train_loss: 1.0357, test_loss: 0.9950, test_f1: 0.4777
 epoch: 38, train_loss: 1.0325, test_loss: 0.9908, test_f1: 0.4762
 epoch: 39, train_loss: 1.0335, test_loss: 0.9915, test_f1: 0.4825
 epoch: 40, train_loss: 1.0275, test_loss: 0.9872, test_f1: 0.4809
 epoch: 41, train_loss: 1.0190, test_loss: 0.9872, test_f1: 0.4808
 epoch: 42, train_loss: 1.0203, test_loss: 0.9825, test_f1: 0.4842
 epoch: 43, train_loss: 1.0212, test_loss: 0.9781, test_f1: 0.4923
 epoch: 44, train_loss: 1.0062, test_loss: 0.9769, test_f1: 0.4862
 epoch: 45, train_loss: 1.0007, test_loss: 0.9774, test_f1: 0.4860
 epoch: 46, train_loss: 0.9995, test_loss: 0.9745, test_f1: 0.4843
 epoch: 47, train_loss: 0.9941, test_loss: 0.9751, test_f1: 0.4885
 epoch: 48, train_loss: 1.0002, test_loss: 0.9711, test_f1: 0.4889
 epoch: 49, train_loss: 0.9988, test_loss: 0.9711, test_f1: 0.4961
 epoch: 50, train_loss: 0.9858, test_loss: 0.9718, test_f1: 0.4866
 epoch: 51, train_loss: 0.9856, test_loss: 0.9721, test_f1: 0.4894
 epoch: 52, train_loss: 0.9847, test_loss: 0.9717, test_f1: 0.4945
 epoch: 53, train_loss: 0.9819, test_loss: 0.9670, test_f1: 0.4914
 epoch: 54, train_loss: 0.9811, test_loss: 0.9724, test_f1: 0.4904
 epoch: 55, train_loss: 0.9901, test_loss: 0.9668, test_f1: 0.4953
 epoch: 56, train_loss: 0.9641, test_loss: 0.9662, test_f1: 0.4876
 epoch: 57, train_loss: 0.9820, test_loss: 0.9621, test_f1: 0.4947
 epoch: 58, train_loss: 0.9766, test_loss: 0.9619, test_f1: 0.4952
 epoch: 59, train_loss: 0.9631, test_loss: 0.9631, test_f1: 0.4934
 epoch: 60, train_loss: 0.9762, test_loss: 0.9600, test_f1: 0.4944
 epoch: 61, train_loss: 0.9701, test_loss: 0.9625, test_f1: 0.4936
 epoch: 62, train_loss: 0.9663, test_loss: 0.9592, test_f1: 0.4912
 epoch: 63, train_loss: 0.9623, test_loss: 0.9593, test_f1: 0.4929
 epoch: 64, train_loss: 0.9607, test_loss: 0.9565, test_f1: 0.4912
 epoch: 65, train_loss: 0.9655, test_loss: 0.9549, test_f1: 0.4949
 epoch: 66, train_loss: 0.9640, test_loss: 0.9626, test_f1: 0.4901
 epoch: 67, train_loss: 0.9655, test_loss: 0.9554, test_f1: 0.4911
 epoch: 68, train_loss: 0.9569, test_loss: 0.9501, test_f1: 0.4937
 epoch: 69, train_loss: 0.9651, test_loss: 0.9549, test_f1: 0.4885
 epoch: 70, train_loss: 0.9579, test_loss: 0.9490, test_f1: 0.4917
 epoch: 71, train_loss: 0.9672, test_loss: 0.9533, test_f1: 0.4905
 epoch: 72, train_loss: 0.9558, test_loss: 0.9522, test_f1: 0.4910
 epoch: 73, train_loss: 0.9502, test_loss: 0.9561, test_f1: 0.4902
 epoch: 74, train_loss: 0.9551, test_loss: 0.9494, test_f1: 0.4943
 epoch: 75, train_loss: 0.9485, test_loss: 0.9479, test_f1: 0.4914
 epoch: 76, train_loss: 0.9446, test_loss: 0.9476, test_f1: 0.4895
 epoch: 77, train_loss: 0.9411, test_loss: 0.9486, test_f1: 0.4955
 epoch: 78, train_loss: 0.9494, test_loss: 0.9549, test_f1: 0.4935
 epoch: 79, train_loss: 0.9439, test_loss: 0.9481, test_f1: 0.4906
 epoch: 80, train_loss: 0.9451, test_loss: 0.9525, test_f1: 0.4895
 epoch: 81, train_loss: 0.9478, test_loss: 0.9474, test_f1: 0.4961
 epoch: 82, train_loss: 0.9454, test_loss: 0.9467, test_f1: 0.4962
 epoch: 83, train_loss: 0.9446, test_loss: 0.9431, test_f1: 0.4937
 epoch: 84, train_loss: 0.9366, test_loss: 0.9486, test_f1: 0.4925
 epoch: 85, train_loss: 0.9399, test_loss: 0.9454, test_f1: 0.4944
 epoch: 86, train_loss: 0.9414, test_loss: 0.9398, test_f1: 0.4966
 epoch: 87, train_loss: 0.9392, test_loss: 0.9558, test_f1: 0.4970
 epoch: 88, train_loss: 0.9377, test_loss: 0.9466, test_f1: 0.4932
 epoch: 89, train_loss: 0.9333, test_loss: 0.9461, test_f1: 0.4966
 epoch: 90, train_loss: 0.9381, test_loss: 0.9483, test_f1: 0.4967
 epoch: 91, train_loss: 0.9344, test_loss: 0.9542, test_f1: 0.4919
 epoch: 92, train_loss: 0.9332, test_loss: 0.9474, test_f1: 0.4990
 epoch: 93, train_loss: 0.9281, test_loss: 0.9519, test_f1: 0.4966
 epoch: 94, train_loss: 0.9379, test_loss: 0.9440, test_f1: 0.4955
 epoch: 95, train_loss: 0.9300, test_loss: 0.9444, test_f1: 0.4978
 epoch: 96, train_loss: 0.9351, test_loss: 0.9445, test_f1: 0.4969
 epoch: 97, train_loss: 0.9288, test_loss: 0.9492, test_f1: 0.4955
 epoch: 98, train_loss: 0.9306, test_loss: 0.9443, test_f1: 0.4977
 epoch: 99, train_loss: 0.9244, test_loss: 0.9484, test_f1: 0.4927
##################ITERATION #6 ****************************************
 epoch: 0, train_loss: 1.3246, test_loss: 1.3125, test_f1: 0.2270
 epoch: 1, train_loss: 1.2813, test_loss: 1.3126, test_f1: 0.2270
 epoch: 2, train_loss: 1.2665, test_loss: 1.2959, test_f1: 0.2270
 epoch: 3, train_loss: 1.2439, test_loss: 1.2667, test_f1: 0.2270
 epoch: 4, train_loss: 1.2343, test_loss: 1.2229, test_f1: 0.2690
 epoch: 5, train_loss: 1.2283, test_loss: 1.1923, test_f1: 0.2783
 epoch: 6, train_loss: 1.2160, test_loss: 1.1750, test_f1: 0.2954
 epoch: 7, train_loss: 1.2070, test_loss: 1.1654, test_f1: 0.3070
 epoch: 8, train_loss: 1.1953, test_loss: 1.1543, test_f1: 0.3221
 epoch: 9, train_loss: 1.1905, test_loss: 1.1468, test_f1: 0.3334
 epoch: 10, train_loss: 1.1841, test_loss: 1.1381, test_f1: 0.3491
 epoch: 11, train_loss: 1.1774, test_loss: 1.1309, test_f1: 0.3576
 epoch: 12, train_loss: 1.1681, test_loss: 1.1212, test_f1: 0.3680
 epoch: 13, train_loss: 1.1612, test_loss: 1.1147, test_f1: 0.3768
 epoch: 14, train_loss: 1.1487, test_loss: 1.1060, test_f1: 0.3856
 epoch: 15, train_loss: 1.1450, test_loss: 1.0965, test_f1: 0.4088
 epoch: 16, train_loss: 1.1418, test_loss: 1.0877, test_f1: 0.4166
 epoch: 17, train_loss: 1.1370, test_loss: 1.0809, test_f1: 0.4246
 epoch: 18, train_loss: 1.1256, test_loss: 1.0748, test_f1: 0.4332
 epoch: 19, train_loss: 1.1220, test_loss: 1.0700, test_f1: 0.4356
 epoch: 20, train_loss: 1.1253, test_loss: 1.0600, test_f1: 0.4431
 epoch: 21, train_loss: 1.1052, test_loss: 1.0552, test_f1: 0.4430
 epoch: 22, train_loss: 1.1069, test_loss: 1.0502, test_f1: 0.4477
 epoch: 23, train_loss: 1.1041, test_loss: 1.0429, test_f1: 0.4495
 epoch: 24, train_loss: 1.0912, test_loss: 1.0379, test_f1: 0.4449
 epoch: 25, train_loss: 1.0890, test_loss: 1.0333, test_f1: 0.4528
 epoch: 26, train_loss: 1.0787, test_loss: 1.0283, test_f1: 0.4555
 epoch: 27, train_loss: 1.0834, test_loss: 1.0214, test_f1: 0.4582
 epoch: 28, train_loss: 1.0799, test_loss: 1.0169, test_f1: 0.4627
 epoch: 29, train_loss: 1.0652, test_loss: 1.0149, test_f1: 0.4668
 epoch: 30, train_loss: 1.0592, test_loss: 1.0107, test_f1: 0.4750
 epoch: 31, train_loss: 1.0586, test_loss: 1.0063, test_f1: 0.4807
 epoch: 32, train_loss: 1.0493, test_loss: 1.0040, test_f1: 0.4644
 epoch: 33, train_loss: 1.0516, test_loss: 0.9997, test_f1: 0.4793
 epoch: 34, train_loss: 1.0477, test_loss: 0.9965, test_f1: 0.4772
 epoch: 35, train_loss: 1.0531, test_loss: 0.9928, test_f1: 0.4714
 epoch: 36, train_loss: 1.0379, test_loss: 0.9871, test_f1: 0.4817
 epoch: 37, train_loss: 1.0334, test_loss: 0.9843, test_f1: 0.4831
 epoch: 38, train_loss: 1.0356, test_loss: 0.9830, test_f1: 0.4721
 epoch: 39, train_loss: 1.0262, test_loss: 0.9842, test_f1: 0.4582
 epoch: 40, train_loss: 1.0243, test_loss: 0.9778, test_f1: 0.4671
 epoch: 41, train_loss: 1.0181, test_loss: 0.9733, test_f1: 0.4745
 epoch: 42, train_loss: 1.0122, test_loss: 0.9721, test_f1: 0.4705
 epoch: 43, train_loss: 1.0156, test_loss: 0.9679, test_f1: 0.4874
 epoch: 44, train_loss: 1.0038, test_loss: 0.9647, test_f1: 0.4806
 epoch: 45, train_loss: 1.0029, test_loss: 0.9604, test_f1: 0.4838
 epoch: 46, train_loss: 0.9946, test_loss: 0.9596, test_f1: 0.4803
 epoch: 47, train_loss: 0.9929, test_loss: 0.9605, test_f1: 0.4736
 epoch: 48, train_loss: 0.9892, test_loss: 0.9528, test_f1: 0.4935
 epoch: 49, train_loss: 0.9983, test_loss: 0.9509, test_f1: 0.5095
 epoch: 50, train_loss: 0.9875, test_loss: 0.9456, test_f1: 0.5058
 epoch: 51, train_loss: 0.9920, test_loss: 0.9441, test_f1: 0.5034
 epoch: 52, train_loss: 0.9765, test_loss: 0.9456, test_f1: 0.5037
 epoch: 53, train_loss: 0.9777, test_loss: 0.9482, test_f1: 0.4964
 epoch: 54, train_loss: 0.9808, test_loss: 0.9441, test_f1: 0.5038
 epoch: 55, train_loss: 0.9813, test_loss: 0.9430, test_f1: 0.5019
 epoch: 56, train_loss: 0.9759, test_loss: 0.9399, test_f1: 0.5074
 epoch: 57, train_loss: 0.9799, test_loss: 0.9420, test_f1: 0.5019
 epoch: 58, train_loss: 0.9783, test_loss: 0.9386, test_f1: 0.5093
 epoch: 59, train_loss: 0.9768, test_loss: 0.9390, test_f1: 0.5064
 epoch: 60, train_loss: 0.9790, test_loss: 0.9372, test_f1: 0.5106
 epoch: 61, train_loss: 0.9807, test_loss: 0.9396, test_f1: 0.5031
 epoch: 62, train_loss: 0.9727, test_loss: 0.9389, test_f1: 0.5103
 epoch: 63, train_loss: 0.9651, test_loss: 0.9372, test_f1: 0.5005
 epoch: 64, train_loss: 0.9646, test_loss: 0.9359, test_f1: 0.5118
 epoch: 65, train_loss: 0.9648, test_loss: 0.9340, test_f1: 0.5162
 epoch: 66, train_loss: 0.9625, test_loss: 0.9338, test_f1: 0.5106
 epoch: 67, train_loss: 0.9597, test_loss: 0.9318, test_f1: 0.5106
 epoch: 68, train_loss: 0.9600, test_loss: 0.9306, test_f1: 0.5195
 epoch: 69, train_loss: 0.9581, test_loss: 0.9327, test_f1: 0.5124
 epoch: 70, train_loss: 0.9670, test_loss: 0.9314, test_f1: 0.5076
 epoch: 71, train_loss: 0.9654, test_loss: 0.9305, test_f1: 0.5092
 epoch: 72, train_loss: 0.9578, test_loss: 0.9242, test_f1: 0.5197
 epoch: 73, train_loss: 0.9592, test_loss: 0.9266, test_f1: 0.5059
 epoch: 74, train_loss: 0.9604, test_loss: 0.9271, test_f1: 0.5062
 epoch: 75, train_loss: 0.9523, test_loss: 0.9281, test_f1: 0.5104
 epoch: 76, train_loss: 0.9627, test_loss: 0.9239, test_f1: 0.5101
 epoch: 77, train_loss: 0.9496, test_loss: 0.9238, test_f1: 0.5109
 epoch: 78, train_loss: 0.9529, test_loss: 0.9246, test_f1: 0.5102
 epoch: 79, train_loss: 0.9526, test_loss: 0.9233, test_f1: 0.5118
 epoch: 80, train_loss: 0.9406, test_loss: 0.9273, test_f1: 0.5031
 epoch: 81, train_loss: 0.9464, test_loss: 0.9236, test_f1: 0.5086
 epoch: 82, train_loss: 0.9436, test_loss: 0.9226, test_f1: 0.5132
 epoch: 83, train_loss: 0.9456, test_loss: 0.9207, test_f1: 0.5104
 epoch: 84, train_loss: 0.9507, test_loss: 0.9141, test_f1: 0.5195
 epoch: 85, train_loss: 0.9446, test_loss: 0.9177, test_f1: 0.5176
 epoch: 86, train_loss: 0.9455, test_loss: 0.9169, test_f1: 0.5141
 epoch: 87, train_loss: 0.9473, test_loss: 0.9217, test_f1: 0.5122
 epoch: 88, train_loss: 0.9358, test_loss: 0.9187, test_f1: 0.5149
 epoch: 89, train_loss: 0.9342, test_loss: 0.9170, test_f1: 0.5170
 epoch: 90, train_loss: 0.9472, test_loss: 0.9145, test_f1: 0.5162
 epoch: 91, train_loss: 0.9372, test_loss: 0.9159, test_f1: 0.5153
 epoch: 92, train_loss: 0.9385, test_loss: 0.9116, test_f1: 0.5180
 epoch: 93, train_loss: 0.9339, test_loss: 0.9136, test_f1: 0.5140
 epoch: 94, train_loss: 0.9408, test_loss: 0.9172, test_f1: 0.5130
 epoch: 95, train_loss: 0.9328, test_loss: 0.9178, test_f1: 0.5095
 epoch: 96, train_loss: 0.9263, test_loss: 0.9212, test_f1: 0.5086
 epoch: 97, train_loss: 0.9321, test_loss: 0.9164, test_f1: 0.5074
 epoch: 98, train_loss: 0.9309, test_loss: 0.9148, test_f1: 0.5160
 epoch: 99, train_loss: 0.9255, test_loss: 0.9162, test_f1: 0.5120
##################ITERATION #7 ****************************************
 epoch: 0, train_loss: 1.3622, test_loss: 1.3358, test_f1: 0.2270
 epoch: 1, train_loss: 1.3119, test_loss: 1.3191, test_f1: 0.2270
 epoch: 2, train_loss: 1.2802, test_loss: 1.3108, test_f1: 0.2270
 epoch: 3, train_loss: 1.2730, test_loss: 1.2838, test_f1: 0.2270
 epoch: 4, train_loss: 1.2518, test_loss: 1.2436, test_f1: 0.2270
 epoch: 5, train_loss: 1.2358, test_loss: 1.2195, test_f1: 0.2439
 epoch: 6, train_loss: 1.2285, test_loss: 1.2063, test_f1: 0.2595
 epoch: 7, train_loss: 1.2214, test_loss: 1.1951, test_f1: 0.2763
 epoch: 8, train_loss: 1.2111, test_loss: 1.1849, test_f1: 0.3185
 epoch: 9, train_loss: 1.1968, test_loss: 1.1762, test_f1: 0.3356
 epoch: 10, train_loss: 1.1912, test_loss: 1.1665, test_f1: 0.3512
 epoch: 11, train_loss: 1.1841, test_loss: 1.1551, test_f1: 0.3673
 epoch: 12, train_loss: 1.1797, test_loss: 1.1465, test_f1: 0.3820
 epoch: 13, train_loss: 1.1783, test_loss: 1.1383, test_f1: 0.4047
 epoch: 14, train_loss: 1.1601, test_loss: 1.1312, test_f1: 0.4162
 epoch: 15, train_loss: 1.1555, test_loss: 1.1227, test_f1: 0.4264
 epoch: 16, train_loss: 1.1468, test_loss: 1.1142, test_f1: 0.4267
 epoch: 17, train_loss: 1.1326, test_loss: 1.1056, test_f1: 0.4344
 epoch: 18, train_loss: 1.1263, test_loss: 1.0952, test_f1: 0.4357
 epoch: 19, train_loss: 1.1171, test_loss: 1.0856, test_f1: 0.4388
 epoch: 20, train_loss: 1.1142, test_loss: 1.0772, test_f1: 0.4413
 epoch: 21, train_loss: 1.1047, test_loss: 1.0703, test_f1: 0.4405
 epoch: 22, train_loss: 1.0965, test_loss: 1.0632, test_f1: 0.4462
 epoch: 23, train_loss: 1.0837, test_loss: 1.0534, test_f1: 0.4578
 epoch: 24, train_loss: 1.0856, test_loss: 1.0451, test_f1: 0.4618
 epoch: 25, train_loss: 1.0819, test_loss: 1.0396, test_f1: 0.4615
 epoch: 26, train_loss: 1.0716, test_loss: 1.0327, test_f1: 0.4662
 epoch: 27, train_loss: 1.0682, test_loss: 1.0266, test_f1: 0.4632
 epoch: 28, train_loss: 1.0587, test_loss: 1.0201, test_f1: 0.4625
 epoch: 29, train_loss: 1.0558, test_loss: 1.0148, test_f1: 0.4703
 epoch: 30, train_loss: 1.0474, test_loss: 1.0101, test_f1: 0.4732
 epoch: 31, train_loss: 1.0491, test_loss: 1.0033, test_f1: 0.4749
 epoch: 32, train_loss: 1.0374, test_loss: 1.0007, test_f1: 0.4728
 epoch: 33, train_loss: 1.0306, test_loss: 0.9946, test_f1: 0.4735
 epoch: 34, train_loss: 1.0246, test_loss: 0.9901, test_f1: 0.4750
 epoch: 35, train_loss: 1.0252, test_loss: 0.9870, test_f1: 0.4759
 epoch: 36, train_loss: 1.0126, test_loss: 0.9864, test_f1: 0.4806
 epoch: 37, train_loss: 1.0139, test_loss: 0.9867, test_f1: 0.4796
 epoch: 38, train_loss: 1.0078, test_loss: 0.9780, test_f1: 0.4809
 epoch: 39, train_loss: 1.0011, test_loss: 0.9746, test_f1: 0.4799
 epoch: 40, train_loss: 1.0062, test_loss: 0.9756, test_f1: 0.4802
 epoch: 41, train_loss: 0.9908, test_loss: 0.9761, test_f1: 0.4848
 epoch: 42, train_loss: 1.0001, test_loss: 0.9760, test_f1: 0.4862
 epoch: 43, train_loss: 0.9877, test_loss: 0.9735, test_f1: 0.4853
 epoch: 44, train_loss: 0.9843, test_loss: 0.9738, test_f1: 0.4850
 epoch: 45, train_loss: 0.9803, test_loss: 0.9702, test_f1: 0.4869
 epoch: 46, train_loss: 0.9805, test_loss: 0.9679, test_f1: 0.4902
 epoch: 47, train_loss: 0.9765, test_loss: 0.9645, test_f1: 0.4937
 epoch: 48, train_loss: 0.9725, test_loss: 0.9619, test_f1: 0.4902
 epoch: 49, train_loss: 0.9719, test_loss: 0.9581, test_f1: 0.4941
 epoch: 50, train_loss: 0.9635, test_loss: 0.9603, test_f1: 0.4984
 epoch: 51, train_loss: 0.9585, test_loss: 0.9593, test_f1: 0.5016
 epoch: 52, train_loss: 0.9695, test_loss: 0.9632, test_f1: 0.5018
 epoch: 53, train_loss: 0.9709, test_loss: 0.9639, test_f1: 0.4982
 epoch: 54, train_loss: 0.9603, test_loss: 0.9633, test_f1: 0.4958
 epoch: 55, train_loss: 0.9583, test_loss: 0.9634, test_f1: 0.4990
 epoch: 56, train_loss: 0.9540, test_loss: 0.9590, test_f1: 0.5006
 epoch: 57, train_loss: 0.9572, test_loss: 0.9568, test_f1: 0.5002
 epoch: 58, train_loss: 0.9483, test_loss: 0.9560, test_f1: 0.5001
 epoch: 59, train_loss: 0.9548, test_loss: 0.9606, test_f1: 0.4989
 epoch: 60, train_loss: 0.9570, test_loss: 0.9622, test_f1: 0.5015
 epoch: 61, train_loss: 0.9517, test_loss: 0.9591, test_f1: 0.5015
 epoch: 62, train_loss: 0.9531, test_loss: 0.9580, test_f1: 0.5039
 epoch: 63, train_loss: 0.9613, test_loss: 0.9549, test_f1: 0.5020
 epoch: 64, train_loss: 0.9566, test_loss: 0.9606, test_f1: 0.5054
 epoch: 65, train_loss: 0.9543, test_loss: 0.9636, test_f1: 0.5041
 epoch: 66, train_loss: 0.9501, test_loss: 0.9590, test_f1: 0.5095
 epoch: 67, train_loss: 0.9508, test_loss: 0.9560, test_f1: 0.5044
 epoch: 68, train_loss: 0.9450, test_loss: 0.9565, test_f1: 0.5060
 epoch: 69, train_loss: 0.9473, test_loss: 0.9572, test_f1: 0.5045
 epoch: 70, train_loss: 0.9401, test_loss: 0.9660, test_f1: 0.5029
 epoch: 71, train_loss: 0.9473, test_loss: 0.9609, test_f1: 0.5008
 epoch: 72, train_loss: 0.9399, test_loss: 0.9633, test_f1: 0.4985
 epoch: 73, train_loss: 0.9425, test_loss: 0.9689, test_f1: 0.4981
 epoch: 74, train_loss: 0.9424, test_loss: 0.9637, test_f1: 0.5070
 epoch: 75, train_loss: 0.9416, test_loss: 0.9572, test_f1: 0.5076
 epoch: 76, train_loss: 0.9328, test_loss: 0.9637, test_f1: 0.5020
 epoch: 77, train_loss: 0.9362, test_loss: 0.9649, test_f1: 0.5004
 epoch: 78, train_loss: 0.9324, test_loss: 0.9576, test_f1: 0.4986
 epoch: 79, train_loss: 0.9350, test_loss: 0.9581, test_f1: 0.5020
 epoch: 80, train_loss: 0.9300, test_loss: 0.9654, test_f1: 0.4977
 epoch: 81, train_loss: 0.9379, test_loss: 0.9662, test_f1: 0.5004
 epoch: 82, train_loss: 0.9351, test_loss: 0.9615, test_f1: 0.4992
 epoch: 83, train_loss: 0.9317, test_loss: 0.9642, test_f1: 0.5004
 epoch: 84, train_loss: 0.9308, test_loss: 0.9653, test_f1: 0.5018
 epoch: 85, train_loss: 0.9324, test_loss: 0.9637, test_f1: 0.5000
 epoch: 86, train_loss: 0.9310, test_loss: 0.9647, test_f1: 0.5020
 epoch: 87, train_loss: 0.9210, test_loss: 0.9656, test_f1: 0.4980
 epoch: 88, train_loss: 0.9185, test_loss: 0.9680, test_f1: 0.5007
 epoch: 89, train_loss: 0.9387, test_loss: 0.9656, test_f1: 0.5009
 epoch: 90, train_loss: 0.9297, test_loss: 0.9657, test_f1: 0.4984
 epoch: 91, train_loss: 0.9193, test_loss: 0.9632, test_f1: 0.5019
 epoch: 92, train_loss: 0.9297, test_loss: 0.9586, test_f1: 0.5050
 epoch: 93, train_loss: 0.9310, test_loss: 0.9681, test_f1: 0.5062
 epoch: 94, train_loss: 0.9245, test_loss: 0.9656, test_f1: 0.5026
 epoch: 95, train_loss: 0.9206, test_loss: 0.9715, test_f1: 0.5001
 epoch: 96, train_loss: 0.9170, test_loss: 0.9667, test_f1: 0.5004
 epoch: 97, train_loss: 0.9158, test_loss: 0.9664, test_f1: 0.5035
 epoch: 98, train_loss: 0.9129, test_loss: 0.9663, test_f1: 0.4971
 epoch: 99, train_loss: 0.9175, test_loss: 0.9630, test_f1: 0.4990
##################ITERATION #8 ****************************************
 epoch: 0, train_loss: 1.3433, test_loss: 1.3133, test_f1: 0.2270
 epoch: 1, train_loss: 1.2747, test_loss: 1.2964, test_f1: 0.2270
 epoch: 2, train_loss: 1.2500, test_loss: 1.2828, test_f1: 0.2270
 epoch: 3, train_loss: 1.2286, test_loss: 1.2533, test_f1: 0.2521
 epoch: 4, train_loss: 1.2200, test_loss: 1.2115, test_f1: 0.2587
 epoch: 5, train_loss: 1.2080, test_loss: 1.1718, test_f1: 0.3347
 epoch: 6, train_loss: 1.2025, test_loss: 1.1536, test_f1: 0.3539
 epoch: 7, train_loss: 1.1893, test_loss: 1.1391, test_f1: 0.3682
 epoch: 8, train_loss: 1.1770, test_loss: 1.1304, test_f1: 0.3835
 epoch: 9, train_loss: 1.1755, test_loss: 1.1223, test_f1: 0.4021
 epoch: 10, train_loss: 1.1619, test_loss: 1.1138, test_f1: 0.4128
 epoch: 11, train_loss: 1.1571, test_loss: 1.1063, test_f1: 0.4222
 epoch: 12, train_loss: 1.1496, test_loss: 1.0984, test_f1: 0.4334
 epoch: 13, train_loss: 1.1384, test_loss: 1.0937, test_f1: 0.4374
 epoch: 14, train_loss: 1.1323, test_loss: 1.0868, test_f1: 0.4354
 epoch: 15, train_loss: 1.1381, test_loss: 1.0805, test_f1: 0.4532
 epoch: 16, train_loss: 1.1258, test_loss: 1.0720, test_f1: 0.4541
 epoch: 17, train_loss: 1.1147, test_loss: 1.0665, test_f1: 0.4629
 epoch: 18, train_loss: 1.1081, test_loss: 1.0590, test_f1: 0.4636
 epoch: 19, train_loss: 1.0977, test_loss: 1.0530, test_f1: 0.4609
 epoch: 20, train_loss: 1.1003, test_loss: 1.0457, test_f1: 0.4630
 epoch: 21, train_loss: 1.0824, test_loss: 1.0393, test_f1: 0.4662
 epoch: 22, train_loss: 1.0872, test_loss: 1.0330, test_f1: 0.4733
 epoch: 23, train_loss: 1.0887, test_loss: 1.0288, test_f1: 0.4695
 epoch: 24, train_loss: 1.0748, test_loss: 1.0219, test_f1: 0.4720
 epoch: 25, train_loss: 1.0598, test_loss: 1.0165, test_f1: 0.4752
 epoch: 26, train_loss: 1.0649, test_loss: 1.0120, test_f1: 0.4763
 epoch: 27, train_loss: 1.0585, test_loss: 1.0067, test_f1: 0.4786
 epoch: 28, train_loss: 1.0527, test_loss: 1.0029, test_f1: 0.4769
 epoch: 29, train_loss: 1.0458, test_loss: 0.9990, test_f1: 0.4792
 epoch: 30, train_loss: 1.0419, test_loss: 0.9958, test_f1: 0.4801
 epoch: 31, train_loss: 1.0314, test_loss: 0.9914, test_f1: 0.4819
 epoch: 32, train_loss: 1.0354, test_loss: 0.9884, test_f1: 0.4823
 epoch: 33, train_loss: 1.0252, test_loss: 0.9797, test_f1: 0.4819
 epoch: 34, train_loss: 1.0217, test_loss: 0.9772, test_f1: 0.4846
 epoch: 35, train_loss: 1.0179, test_loss: 0.9716, test_f1: 0.4865
 epoch: 36, train_loss: 1.0094, test_loss: 0.9700, test_f1: 0.4889
 epoch: 37, train_loss: 1.0018, test_loss: 0.9689, test_f1: 0.4784
 epoch: 38, train_loss: 1.0032, test_loss: 0.9659, test_f1: 0.4855
 epoch: 39, train_loss: 1.0005, test_loss: 0.9605, test_f1: 0.4835
 epoch: 40, train_loss: 1.0008, test_loss: 0.9592, test_f1: 0.4858
 epoch: 41, train_loss: 0.9871, test_loss: 0.9576, test_f1: 0.4807
 epoch: 42, train_loss: 0.9890, test_loss: 0.9568, test_f1: 0.4845
 epoch: 43, train_loss: 0.9869, test_loss: 0.9566, test_f1: 0.4834
 epoch: 44, train_loss: 0.9885, test_loss: 0.9526, test_f1: 0.4843
 epoch: 45, train_loss: 0.9791, test_loss: 0.9536, test_f1: 0.4857
 epoch: 46, train_loss: 0.9883, test_loss: 0.9509, test_f1: 0.4861
 epoch: 47, train_loss: 0.9740, test_loss: 0.9526, test_f1: 0.4912
 epoch: 48, train_loss: 0.9694, test_loss: 0.9516, test_f1: 0.5009
 epoch: 49, train_loss: 0.9743, test_loss: 0.9568, test_f1: 0.4969
 epoch: 50, train_loss: 0.9625, test_loss: 0.9557, test_f1: 0.5023
 epoch: 51, train_loss: 0.9673, test_loss: 0.9573, test_f1: 0.4975
 epoch: 52, train_loss: 0.9633, test_loss: 0.9570, test_f1: 0.5017
 epoch: 53, train_loss: 0.9499, test_loss: 0.9543, test_f1: 0.4983
 epoch: 54, train_loss: 0.9610, test_loss: 0.9523, test_f1: 0.4990
 epoch: 55, train_loss: 0.9557, test_loss: 0.9476, test_f1: 0.4945
 epoch: 56, train_loss: 0.9572, test_loss: 0.9501, test_f1: 0.5011
 epoch: 57, train_loss: 0.9609, test_loss: 0.9538, test_f1: 0.5041
 epoch: 58, train_loss: 0.9523, test_loss: 0.9533, test_f1: 0.5022
 epoch: 59, train_loss: 0.9438, test_loss: 0.9530, test_f1: 0.4992
 epoch: 60, train_loss: 0.9488, test_loss: 0.9507, test_f1: 0.5007
 epoch: 61, train_loss: 0.9497, test_loss: 0.9462, test_f1: 0.5016
 epoch: 62, train_loss: 0.9418, test_loss: 0.9497, test_f1: 0.5008
 epoch: 63, train_loss: 0.9526, test_loss: 0.9488, test_f1: 0.5034
 epoch: 64, train_loss: 0.9437, test_loss: 0.9521, test_f1: 0.5010
 epoch: 65, train_loss: 0.9459, test_loss: 0.9522, test_f1: 0.5024
 epoch: 66, train_loss: 0.9427, test_loss: 0.9465, test_f1: 0.5007
 epoch: 67, train_loss: 0.9473, test_loss: 0.9472, test_f1: 0.5034
 epoch: 68, train_loss: 0.9410, test_loss: 0.9454, test_f1: 0.5082
 epoch: 69, train_loss: 0.9510, test_loss: 0.9449, test_f1: 0.5053
 epoch: 70, train_loss: 0.9372, test_loss: 0.9493, test_f1: 0.5057
 epoch: 71, train_loss: 0.9373, test_loss: 0.9489, test_f1: 0.5048
 epoch: 72, train_loss: 0.9418, test_loss: 0.9483, test_f1: 0.5088
 epoch: 73, train_loss: 0.9307, test_loss: 0.9504, test_f1: 0.5094
 epoch: 74, train_loss: 0.9302, test_loss: 0.9429, test_f1: 0.5079
 epoch: 75, train_loss: 0.9319, test_loss: 0.9419, test_f1: 0.5093
 epoch: 76, train_loss: 0.9266, test_loss: 0.9385, test_f1: 0.5089
 epoch: 77, train_loss: 0.9296, test_loss: 0.9439, test_f1: 0.5091
 epoch: 78, train_loss: 0.9315, test_loss: 0.9429, test_f1: 0.5115
 epoch: 79, train_loss: 0.9332, test_loss: 0.9470, test_f1: 0.5136
 epoch: 80, train_loss: 0.9304, test_loss: 0.9414, test_f1: 0.5131
 epoch: 81, train_loss: 0.9264, test_loss: 0.9381, test_f1: 0.5145
 epoch: 82, train_loss: 0.9320, test_loss: 0.9397, test_f1: 0.5102
 epoch: 83, train_loss: 0.9204, test_loss: 0.9405, test_f1: 0.5159
 epoch: 84, train_loss: 0.9232, test_loss: 0.9395, test_f1: 0.5124
 epoch: 85, train_loss: 0.9252, test_loss: 0.9407, test_f1: 0.5085
 epoch: 86, train_loss: 0.9184, test_loss: 0.9400, test_f1: 0.5112
 epoch: 87, train_loss: 0.9268, test_loss: 0.9379, test_f1: 0.5102
 epoch: 88, train_loss: 0.9199, test_loss: 0.9358, test_f1: 0.5135
 epoch: 89, train_loss: 0.9206, test_loss: 0.9381, test_f1: 0.5171
 epoch: 90, train_loss: 0.9161, test_loss: 0.9337, test_f1: 0.5146
 epoch: 91, train_loss: 0.9149, test_loss: 0.9332, test_f1: 0.5167
 epoch: 92, train_loss: 0.9183, test_loss: 0.9374, test_f1: 0.5156
 epoch: 93, train_loss: 0.9137, test_loss: 0.9372, test_f1: 0.5175
 epoch: 94, train_loss: 0.9236, test_loss: 0.9370, test_f1: 0.5133
 epoch: 95, train_loss: 0.9164, test_loss: 0.9408, test_f1: 0.5099
 epoch: 96, train_loss: 0.9145, test_loss: 0.9445, test_f1: 0.5118
 epoch: 97, train_loss: 0.9082, test_loss: 0.9418, test_f1: 0.5104
 epoch: 98, train_loss: 0.9105, test_loss: 0.9399, test_f1: 0.5152
 epoch: 99, train_loss: 0.9116, test_loss: 0.9423, test_f1: 0.5131
##################ITERATION #9 ****************************************
 epoch: 0, train_loss: 1.4073, test_loss: 1.3745, test_f1: 0.2270
 epoch: 1, train_loss: 1.3299, test_loss: 1.3605, test_f1: 0.2270
 epoch: 2, train_loss: 1.2864, test_loss: 1.3314, test_f1: 0.2270
 epoch: 3, train_loss: 1.2637, test_loss: 1.2713, test_f1: 0.2560
 epoch: 4, train_loss: 1.2494, test_loss: 1.2186, test_f1: 0.3266
 epoch: 5, train_loss: 1.2316, test_loss: 1.1909, test_f1: 0.3447
 epoch: 6, train_loss: 1.2181, test_loss: 1.1747, test_f1: 0.3483
 epoch: 7, train_loss: 1.2065, test_loss: 1.1647, test_f1: 0.3496
 epoch: 8, train_loss: 1.1922, test_loss: 1.1539, test_f1: 0.3532
 epoch: 9, train_loss: 1.1861, test_loss: 1.1445, test_f1: 0.3638
 epoch: 10, train_loss: 1.1754, test_loss: 1.1353, test_f1: 0.3690
 epoch: 11, train_loss: 1.1644, test_loss: 1.1259, test_f1: 0.3899
 epoch: 12, train_loss: 1.1545, test_loss: 1.1135, test_f1: 0.4024
 epoch: 13, train_loss: 1.1543, test_loss: 1.1029, test_f1: 0.4213
 epoch: 14, train_loss: 1.1443, test_loss: 1.0947, test_f1: 0.4270
 epoch: 15, train_loss: 1.1321, test_loss: 1.0855, test_f1: 0.4323
 epoch: 16, train_loss: 1.1242, test_loss: 1.0787, test_f1: 0.4359
 epoch: 17, train_loss: 1.1129, test_loss: 1.0700, test_f1: 0.4404
 epoch: 18, train_loss: 1.1097, test_loss: 1.0638, test_f1: 0.4392
 epoch: 19, train_loss: 1.1033, test_loss: 1.0558, test_f1: 0.4437
 epoch: 20, train_loss: 1.0943, test_loss: 1.0500, test_f1: 0.4500
 epoch: 21, train_loss: 1.0913, test_loss: 1.0426, test_f1: 0.4472
 epoch: 22, train_loss: 1.0768, test_loss: 1.0369, test_f1: 0.4500
 epoch: 23, train_loss: 1.0739, test_loss: 1.0332, test_f1: 0.4529
 epoch: 24, train_loss: 1.0623, test_loss: 1.0275, test_f1: 0.4440
 epoch: 25, train_loss: 1.0632, test_loss: 1.0201, test_f1: 0.4705
 epoch: 26, train_loss: 1.0585, test_loss: 1.0206, test_f1: 0.4563
 epoch: 27, train_loss: 1.0543, test_loss: 1.0149, test_f1: 0.4568
 epoch: 28, train_loss: 1.0532, test_loss: 1.0102, test_f1: 0.4451
 epoch: 29, train_loss: 1.0364, test_loss: 1.0068, test_f1: 0.4600
 epoch: 30, train_loss: 1.0287, test_loss: 1.0038, test_f1: 0.4626
 epoch: 31, train_loss: 1.0277, test_loss: 0.9984, test_f1: 0.4826
 epoch: 32, train_loss: 1.0247, test_loss: 0.9958, test_f1: 0.4637
 epoch: 33, train_loss: 1.0289, test_loss: 0.9931, test_f1: 0.4810
 epoch: 34, train_loss: 1.0142, test_loss: 0.9935, test_f1: 0.4864
 epoch: 35, train_loss: 1.0110, test_loss: 0.9859, test_f1: 0.4820
 epoch: 36, train_loss: 1.0071, test_loss: 0.9854, test_f1: 0.4853
 epoch: 37, train_loss: 1.0063, test_loss: 0.9831, test_f1: 0.4832
 epoch: 38, train_loss: 1.0072, test_loss: 0.9785, test_f1: 0.4985
 epoch: 39, train_loss: 1.0016, test_loss: 0.9785, test_f1: 0.4943
 epoch: 40, train_loss: 0.9976, test_loss: 0.9779, test_f1: 0.4929
 epoch: 41, train_loss: 0.9926, test_loss: 0.9768, test_f1: 0.4903
 epoch: 42, train_loss: 0.9869, test_loss: 0.9729, test_f1: 0.4961
 epoch: 43, train_loss: 0.9917, test_loss: 0.9708, test_f1: 0.4850
 epoch: 44, train_loss: 0.9863, test_loss: 0.9722, test_f1: 0.4969
 epoch: 45, train_loss: 0.9735, test_loss: 0.9709, test_f1: 0.4975
 epoch: 46, train_loss: 0.9878, test_loss: 0.9714, test_f1: 0.4985
 epoch: 47, train_loss: 0.9707, test_loss: 0.9706, test_f1: 0.5032
 epoch: 48, train_loss: 0.9717, test_loss: 0.9682, test_f1: 0.5031
 epoch: 49, train_loss: 0.9710, test_loss: 0.9692, test_f1: 0.4921
 epoch: 50, train_loss: 0.9602, test_loss: 0.9679, test_f1: 0.4946
 epoch: 51, train_loss: 0.9647, test_loss: 0.9657, test_f1: 0.5004
 epoch: 52, train_loss: 0.9648, test_loss: 0.9626, test_f1: 0.4954
 epoch: 53, train_loss: 0.9587, test_loss: 0.9594, test_f1: 0.4959
 epoch: 54, train_loss: 0.9586, test_loss: 0.9590, test_f1: 0.4921
 epoch: 55, train_loss: 0.9571, test_loss: 0.9582, test_f1: 0.5031
 epoch: 56, train_loss: 0.9569, test_loss: 0.9591, test_f1: 0.5019
 epoch: 57, train_loss: 0.9500, test_loss: 0.9579, test_f1: 0.5016
 epoch: 58, train_loss: 0.9518, test_loss: 0.9574, test_f1: 0.5038
 epoch: 59, train_loss: 0.9464, test_loss: 0.9594, test_f1: 0.4998
 epoch: 60, train_loss: 0.9453, test_loss: 0.9553, test_f1: 0.5016
 epoch: 61, train_loss: 0.9464, test_loss: 0.9545, test_f1: 0.5009
 epoch: 62, train_loss: 0.9535, test_loss: 0.9555, test_f1: 0.5042
 epoch: 63, train_loss: 0.9501, test_loss: 0.9543, test_f1: 0.5065
 epoch: 64, train_loss: 0.9440, test_loss: 0.9561, test_f1: 0.5057
 epoch: 65, train_loss: 0.9442, test_loss: 0.9568, test_f1: 0.5037
 epoch: 66, train_loss: 0.9354, test_loss: 0.9579, test_f1: 0.4955
 epoch: 67, train_loss: 0.9425, test_loss: 0.9521, test_f1: 0.5049
 epoch: 68, train_loss: 0.9353, test_loss: 0.9535, test_f1: 0.5039
 epoch: 69, train_loss: 0.9373, test_loss: 0.9525, test_f1: 0.4984
 epoch: 70, train_loss: 0.9394, test_loss: 0.9538, test_f1: 0.4921
 epoch: 71, train_loss: 0.9347, test_loss: 0.9551, test_f1: 0.5012
 epoch: 72, train_loss: 0.9308, test_loss: 0.9526, test_f1: 0.5049
 epoch: 73, train_loss: 0.9383, test_loss: 0.9504, test_f1: 0.5037
 epoch: 74, train_loss: 0.9307, test_loss: 0.9507, test_f1: 0.5047
 epoch: 75, train_loss: 0.9327, test_loss: 0.9521, test_f1: 0.4973
 epoch: 76, train_loss: 0.9338, test_loss: 0.9542, test_f1: 0.5041
 epoch: 77, train_loss: 0.9235, test_loss: 0.9541, test_f1: 0.5034
 epoch: 78, train_loss: 0.9348, test_loss: 0.9509, test_f1: 0.5036
 epoch: 79, train_loss: 0.9250, test_loss: 0.9526, test_f1: 0.4995
 epoch: 80, train_loss: 0.9257, test_loss: 0.9505, test_f1: 0.5094
 epoch: 81, train_loss: 0.9177, test_loss: 0.9511, test_f1: 0.5149
 epoch: 82, train_loss: 0.9245, test_loss: 0.9504, test_f1: 0.5029
 epoch: 83, train_loss: 0.9240, test_loss: 0.9515, test_f1: 0.4963
 epoch: 84, train_loss: 0.9244, test_loss: 0.9483, test_f1: 0.5038
 epoch: 85, train_loss: 0.9240, test_loss: 0.9529, test_f1: 0.4995
 epoch: 86, train_loss: 0.9219, test_loss: 0.9486, test_f1: 0.5097
 epoch: 87, train_loss: 0.9238, test_loss: 0.9505, test_f1: 0.5006
 epoch: 88, train_loss: 0.9198, test_loss: 0.9510, test_f1: 0.4930
 epoch: 89, train_loss: 0.9143, test_loss: 0.9494, test_f1: 0.4958
 epoch: 90, train_loss: 0.9162, test_loss: 0.9497, test_f1: 0.4961
 epoch: 91, train_loss: 0.9152, test_loss: 0.9471, test_f1: 0.5049
 epoch: 92, train_loss: 0.9085, test_loss: 0.9476, test_f1: 0.5091
 epoch: 93, train_loss: 0.9161, test_loss: 0.9479, test_f1: 0.5131
 epoch: 94, train_loss: 0.9086, test_loss: 0.9495, test_f1: 0.5062
 epoch: 95, train_loss: 0.9067, test_loss: 0.9522, test_f1: 0.5013
 epoch: 96, train_loss: 0.9219, test_loss: 0.9499, test_f1: 0.4919
 epoch: 97, train_loss: 0.9067, test_loss: 0.9495, test_f1: 0.4938
 epoch: 98, train_loss: 0.9117, test_loss: 0.9526, test_f1: 0.5008
 epoch: 99, train_loss: 0.9104, test_loss: 0.9511, test_f1: 0.5009

Training completed in 396.62 seconds
Best F1: 0.5197 at epoch 72
Mean F1 across iterations: 0.5096  0.0081
========================FINAL RESULTS================================
FEGIN weighted F1: 0.5197  0.0081
python main.py --data ltspice_examples --representation component_net --model FEGIN --layers 4 --hiddens 32 --batch_size 256 --lr 0.0001 --emb_size 512 --epochs 100 --save_appendix component_net_L4_H32_BS256_LR0.0001_E512 --no_val
-----



STDERR:
  File "main.py", line 370, in <module>
    main()
  File "main.py", line 254, in main
    dataset = dataset_class(
  File "/home/philip/projects/ltspice_examples_code_repo/Circuit-Completion-Using-GNNs/component_classification_with_link_prediction_head/evaluation/FEGIN/kernel/circuit_datasets.py", line 15, in __init__
    self.data, self.slices = torch.load(self.processed_paths[0])
  File "/home/philip/.local/lib/python3.8/site-packages/torch/serialization.py", line 1040, in load
    warnings.warn(
  File "/usr/lib/python3.8/warnings.py", line 109, in _showwarnmsg
    sw(msg.message, msg.category, msg.filename, msg.lineno,
  File "main.py", line 47, in warn_with_traceback
    traceback.print_stack(file=log)
/home/philip/projects/ltspice_examples_code_repo/Circuit-Completion-Using-GNNs/component_classification_with_link_prediction_head/evaluation/FEGIN/kernel/circuit_datasets.py:15: FutureWarning: You are using `torch.load` with `weights_only=False` (the current default value), which uses the default pickle module implicitly. It is possible to construct malicious pickle data which will execute arbitrary code during unpickling (See https://github.com/pytorch/pytorch/blob/main/SECURITY.md#untrusted-models for more details). In a future release, the default value for `weights_only` will be flipped to `True`. This limits the functions that could be executed during unpickling. Arbitrary objects will no longer be allowed to be loaded via this mode unless they are explicitly allowlisted by the user via `torch.serialization.add_safe_globals`. We recommend you start setting `weights_only=True` for any use case where you don't have full control of the loaded file. Please open an issue on GitHub for any issues related to this experimental feature.
  self.data, self.slices = torch.load(self.processed_paths[0])
