STDOUT:
Results will be saved in /home/philip/projects/ltspice_examples_code_repo/Circuit-Completion-Using-GNNs/component_classification_with_link_prediction_head/evaluation/FEGIN/results/model_FEGIN_dataset_ltspice_demos
Command line input: python main.py --data ltspice_demos --representation component_pin --model FEGIN --layers 3 --hiddens 32 --batch_size 128 --lr 0.01 --emb_size 128 --epochs 100 --save_appendix component_pin_L3_H32_BS128_LR0.01_E128 --no_val
 is saved.
-----
ltspice_demos - FEGIN
Using 3 layers, 32 hidden units, h = 2
Loading component_pin representation dataset
ENTERED
Training FEGIN on component_pin representation
Train: 1565, Test: 383
##################ITERATION #0 ****************************************
 epoch: 0, train_loss: 1.2606, test_loss: 1.3117, test_f1: 0.2281
 epoch: 1, train_loss: 1.1593, test_loss: 1.4329, test_f1: 0.2698
 epoch: 2, train_loss: 1.0863, test_loss: 1.4428, test_f1: 0.3348
 epoch: 3, train_loss: 0.9870, test_loss: 1.2964, test_f1: 0.3820
 epoch: 4, train_loss: 0.9590, test_loss: 1.0941, test_f1: 0.4914
 epoch: 5, train_loss: 0.8957, test_loss: 1.2153, test_f1: 0.3851
 epoch: 6, train_loss: 0.8688, test_loss: 0.9764, test_f1: 0.4820
 epoch: 7, train_loss: 0.8557, test_loss: 3.7913, test_f1: 0.1257
 epoch: 8, train_loss: 0.8555, test_loss: 0.9750, test_f1: 0.5583
 epoch: 9, train_loss: 0.8010, test_loss: 0.9650, test_f1: 0.5949
 epoch: 10, train_loss: 0.7905, test_loss: 0.9268, test_f1: 0.5954
 epoch: 11, train_loss: 0.7847, test_loss: 1.2118, test_f1: 0.4073
 epoch: 12, train_loss: 0.7739, test_loss: 1.0240, test_f1: 0.5934
 epoch: 13, train_loss: 0.7781, test_loss: 5.7004, test_f1: 0.4446
 epoch: 14, train_loss: 0.7490, test_loss: 0.9447, test_f1: 0.5001
 epoch: 15, train_loss: 0.7493, test_loss: 1.4528, test_f1: 0.3900
 epoch: 16, train_loss: 0.7459, test_loss: 0.8834, test_f1: 0.5531
 epoch: 17, train_loss: 0.7204, test_loss: 1.0693, test_f1: 0.5738
 epoch: 18, train_loss: 0.7270, test_loss: 1.3636, test_f1: 0.4008
 epoch: 19, train_loss: 0.7347, test_loss: 1.4044, test_f1: 0.4557
 epoch: 20, train_loss: 0.7634, test_loss: 1.1972, test_f1: 0.5172
 epoch: 21, train_loss: 0.7050, test_loss: 1.0294, test_f1: 0.5918
 epoch: 22, train_loss: 0.6952, test_loss: 1.1560, test_f1: 0.5740
 epoch: 23, train_loss: 0.6933, test_loss: 1.0968, test_f1: 0.6010
 epoch: 24, train_loss: 0.7056, test_loss: 1.0784, test_f1: 0.5429
 epoch: 25, train_loss: 0.7083, test_loss: 1.0395, test_f1: 0.5681
 epoch: 26, train_loss: 0.6878, test_loss: 1.0799, test_f1: 0.5626
 epoch: 27, train_loss: 0.6881, test_loss: 0.9258, test_f1: 0.5981
 epoch: 28, train_loss: 0.6650, test_loss: 1.1356, test_f1: 0.6266
 epoch: 29, train_loss: 0.6517, test_loss: 1.2662, test_f1: 0.5737
 epoch: 30, train_loss: 0.6447, test_loss: 1.2752, test_f1: 0.5836
 epoch: 31, train_loss: 0.6429, test_loss: 1.1245, test_f1: 0.6013
 epoch: 32, train_loss: 0.6735, test_loss: 1.1375, test_f1: 0.5506
 epoch: 33, train_loss: 0.6354, test_loss: 1.1891, test_f1: 0.5821
 epoch: 34, train_loss: 0.6560, test_loss: 1.3840, test_f1: 0.5727
 epoch: 35, train_loss: 0.6430, test_loss: 1.4230, test_f1: 0.5484
 epoch: 36, train_loss: 0.6487, test_loss: 1.0962, test_f1: 0.5853
 epoch: 37, train_loss: 0.6212, test_loss: 1.2535, test_f1: 0.5339
 epoch: 38, train_loss: 0.6286, test_loss: 1.1533, test_f1: 0.5973
 epoch: 39, train_loss: 0.6566, test_loss: 0.9573, test_f1: 0.5215
 epoch: 40, train_loss: 0.6161, test_loss: 1.0492, test_f1: 0.5987
 epoch: 41, train_loss: 0.5849, test_loss: 1.0770, test_f1: 0.6007
 epoch: 42, train_loss: 0.5819, test_loss: 1.0374, test_f1: 0.6084
 epoch: 43, train_loss: 0.5630, test_loss: 1.1249, test_f1: 0.5523
 epoch: 44, train_loss: 0.5650, test_loss: 1.2333, test_f1: 0.5921
 epoch: 45, train_loss: 0.5498, test_loss: 1.4598, test_f1: 0.5002
 epoch: 46, train_loss: 0.5842, test_loss: 1.1045, test_f1: 0.5541
 epoch: 47, train_loss: 0.5662, test_loss: 1.6598, test_f1: 0.6062
 epoch: 48, train_loss: 0.5845, test_loss: 1.1941, test_f1: 0.6263
 epoch: 49, train_loss: 0.5440, test_loss: 1.4647, test_f1: 0.5994
 epoch: 50, train_loss: 0.5324, test_loss: 1.7495, test_f1: 0.5884
 epoch: 51, train_loss: 0.5206, test_loss: 1.3964, test_f1: 0.5795
 epoch: 52, train_loss: 0.4755, test_loss: 1.5652, test_f1: 0.5726
 epoch: 53, train_loss: 0.5167, test_loss: 1.6476, test_f1: 0.5673
 epoch: 54, train_loss: 0.5317, test_loss: 1.2318, test_f1: 0.5920
 epoch: 55, train_loss: 0.4875, test_loss: 1.1237, test_f1: 0.6486
 epoch: 56, train_loss: 0.4700, test_loss: 1.4678, test_f1: 0.6127
 epoch: 57, train_loss: 0.5044, test_loss: 1.4121, test_f1: 0.5962
 epoch: 58, train_loss: 0.4853, test_loss: 1.3637, test_f1: 0.5732
 epoch: 59, train_loss: 0.4860, test_loss: 1.6519, test_f1: 0.5766
 epoch: 60, train_loss: 0.4526, test_loss: 1.5030, test_f1: 0.6257
 epoch: 61, train_loss: 0.4415, test_loss: 1.4375, test_f1: 0.6145
 epoch: 62, train_loss: 0.4479, test_loss: 1.5066, test_f1: 0.5942
 epoch: 63, train_loss: 0.4350, test_loss: 1.6211, test_f1: 0.5697
 epoch: 64, train_loss: 0.4148, test_loss: 1.5589, test_f1: 0.5726
 epoch: 65, train_loss: 0.4343, test_loss: 1.7113, test_f1: 0.6094
 epoch: 66, train_loss: 0.4248, test_loss: 1.6753, test_f1: 0.6049
 epoch: 67, train_loss: 0.4404, test_loss: 1.7172, test_f1: 0.6145
 epoch: 68, train_loss: 0.4386, test_loss: 1.4733, test_f1: 0.6496
 epoch: 69, train_loss: 0.4212, test_loss: 1.7245, test_f1: 0.5801
 epoch: 70, train_loss: 0.4007, test_loss: 1.8661, test_f1: 0.6091
 epoch: 71, train_loss: 0.4255, test_loss: 1.6568, test_f1: 0.6276
 epoch: 72, train_loss: 0.4107, test_loss: 1.6578, test_f1: 0.5708
 epoch: 73, train_loss: 0.4387, test_loss: 1.4921, test_f1: 0.5831
 epoch: 74, train_loss: 0.4023, test_loss: 1.7338, test_f1: 0.5917
 epoch: 75, train_loss: 0.4085, test_loss: 1.7110, test_f1: 0.6009
 epoch: 76, train_loss: 0.3801, test_loss: 1.9453, test_f1: 0.5641
 epoch: 77, train_loss: 0.3917, test_loss: 1.8714, test_f1: 0.6287
 epoch: 78, train_loss: 0.3956, test_loss: 1.8793, test_f1: 0.6175
 epoch: 79, train_loss: 0.3846, test_loss: 1.8198, test_f1: 0.5855
 epoch: 80, train_loss: 0.3831, test_loss: 2.2307, test_f1: 0.5777
 epoch: 81, train_loss: 0.3499, test_loss: 1.8235, test_f1: 0.5978
 epoch: 82, train_loss: 0.3961, test_loss: 1.9669, test_f1: 0.6239
 epoch: 83, train_loss: 0.3837, test_loss: 1.9328, test_f1: 0.5862
 epoch: 84, train_loss: 0.4173, test_loss: 1.7557, test_f1: 0.5909
 epoch: 85, train_loss: 0.3674, test_loss: 1.6442, test_f1: 0.5957
 epoch: 86, train_loss: 0.3752, test_loss: 1.9824, test_f1: 0.5805
 epoch: 87, train_loss: 0.3609, test_loss: 2.3172, test_f1: 0.6250
 epoch: 88, train_loss: 0.3613, test_loss: 1.8441, test_f1: 0.6320
 epoch: 89, train_loss: 0.4158, test_loss: 1.8564, test_f1: 0.6056
 epoch: 90, train_loss: 0.3833, test_loss: 1.9379, test_f1: 0.5519
 epoch: 91, train_loss: 0.4016, test_loss: 1.7307, test_f1: 0.5936
 epoch: 92, train_loss: 0.4206, test_loss: 1.6862, test_f1: 0.6527
 epoch: 93, train_loss: 0.4038, test_loss: 1.9078, test_f1: 0.6069
 epoch: 94, train_loss: 0.3912, test_loss: 2.1294, test_f1: 0.5895
 epoch: 95, train_loss: 0.3942, test_loss: 1.8983, test_f1: 0.6112
 epoch: 96, train_loss: 0.3474, test_loss: 2.0635, test_f1: 0.6149
 epoch: 97, train_loss: 0.3423, test_loss: 2.1261, test_f1: 0.5928
 epoch: 98, train_loss: 0.3162, test_loss: 2.0727, test_f1: 0.6444
 epoch: 99, train_loss: 0.3309, test_loss: 1.9352, test_f1: 0.5991
##################ITERATION #1 ****************************************
 epoch: 0, train_loss: 1.1070, test_loss: 1.4270, test_f1: 0.2281
 epoch: 1, train_loss: 0.9644, test_loss: 1.6530, test_f1: 0.1175
 epoch: 2, train_loss: 0.8969, test_loss: 2.3666, test_f1: 0.0859
 epoch: 3, train_loss: 0.8738, test_loss: 1.5905, test_f1: 0.2821
 epoch: 4, train_loss: 0.8616, test_loss: 1.1465, test_f1: 0.4570
 epoch: 5, train_loss: 0.8077, test_loss: 1.1393, test_f1: 0.5723
 epoch: 6, train_loss: 0.7778, test_loss: 1.0897, test_f1: 0.5472
 epoch: 7, train_loss: 0.7881, test_loss: 1.3888, test_f1: 0.3333
 epoch: 8, train_loss: 0.7751, test_loss: 2.2143, test_f1: 0.3196
 epoch: 9, train_loss: 0.7420, test_loss: 1.3429, test_f1: 0.4238
 epoch: 10, train_loss: 0.7350, test_loss: 1.0152, test_f1: 0.6213
 epoch: 11, train_loss: 0.7187, test_loss: 1.1225, test_f1: 0.5847
 epoch: 12, train_loss: 0.7278, test_loss: 1.1359, test_f1: 0.5299
 epoch: 13, train_loss: 0.7177, test_loss: 1.0699, test_f1: 0.5750
 epoch: 14, train_loss: 0.6901, test_loss: 1.2543, test_f1: 0.4933
 epoch: 15, train_loss: 0.7024, test_loss: 1.1338, test_f1: 0.5363
 epoch: 16, train_loss: 0.7012, test_loss: 0.9031, test_f1: 0.5890
 epoch: 17, train_loss: 0.6890, test_loss: 1.0627, test_f1: 0.5891
 epoch: 18, train_loss: 0.6948, test_loss: 1.0910, test_f1: 0.5307
 epoch: 19, train_loss: 0.6996, test_loss: 1.0676, test_f1: 0.5644
 epoch: 20, train_loss: 0.6911, test_loss: 1.0532, test_f1: 0.5749
 epoch: 21, train_loss: 0.7105, test_loss: 1.1935, test_f1: 0.5188
 epoch: 22, train_loss: 0.6889, test_loss: 0.9772, test_f1: 0.6115
 epoch: 23, train_loss: 0.6612, test_loss: 0.9790, test_f1: 0.5579
 epoch: 24, train_loss: 0.6493, test_loss: 0.9769, test_f1: 0.6040
 epoch: 25, train_loss: 0.6239, test_loss: 1.0494, test_f1: 0.6196
 epoch: 26, train_loss: 0.6291, test_loss: 1.4620, test_f1: 0.3935
 epoch: 27, train_loss: 0.6468, test_loss: 1.0423, test_f1: 0.6239
 epoch: 28, train_loss: 0.6337, test_loss: 1.1989, test_f1: 0.5425
 epoch: 29, train_loss: 0.6243, test_loss: 1.0768, test_f1: 0.5413
 epoch: 30, train_loss: 0.6828, test_loss: 2.1204, test_f1: 0.4114
 epoch: 31, train_loss: 0.6388, test_loss: 1.0422, test_f1: 0.6071
 epoch: 32, train_loss: 0.6460, test_loss: 1.0506, test_f1: 0.5849
 epoch: 33, train_loss: 0.6458, test_loss: 1.5201, test_f1: 0.4704
 epoch: 34, train_loss: 0.6734, test_loss: 1.0309, test_f1: 0.5703
 epoch: 35, train_loss: 0.6376, test_loss: 1.0591, test_f1: 0.5879
 epoch: 36, train_loss: 0.6098, test_loss: 1.4163, test_f1: 0.5211
 epoch: 37, train_loss: 0.5993, test_loss: 1.4405, test_f1: 0.5541
 epoch: 38, train_loss: 0.6583, test_loss: 1.2980, test_f1: 0.6010
 epoch: 39, train_loss: 0.6260, test_loss: 1.3353, test_f1: 0.4377
 epoch: 40, train_loss: 0.6711, test_loss: 1.2969, test_f1: 0.5392
 epoch: 41, train_loss: 0.6475, test_loss: 1.1111, test_f1: 0.5682
 epoch: 42, train_loss: 0.5912, test_loss: 2.1040, test_f1: 0.5183
 epoch: 43, train_loss: 0.5716, test_loss: 1.6135, test_f1: 0.5914
 epoch: 44, train_loss: 0.5788, test_loss: 1.3099, test_f1: 0.5904
 epoch: 45, train_loss: 0.5619, test_loss: 1.2071, test_f1: 0.5663
 epoch: 46, train_loss: 0.5542, test_loss: 1.4726, test_f1: 0.5562
 epoch: 47, train_loss: 0.5873, test_loss: 1.7935, test_f1: 0.5443
 epoch: 48, train_loss: 0.6219, test_loss: 1.1143, test_f1: 0.5623
 epoch: 49, train_loss: 0.6187, test_loss: 1.2852, test_f1: 0.5410
 epoch: 50, train_loss: 0.5717, test_loss: 1.3086, test_f1: 0.6088
 epoch: 51, train_loss: 0.5429, test_loss: 1.2823, test_f1: 0.6242
 epoch: 52, train_loss: 0.5357, test_loss: 1.3203, test_f1: 0.6378
 epoch: 53, train_loss: 0.5175, test_loss: 1.5715, test_f1: 0.6091
 epoch: 54, train_loss: 0.5088, test_loss: 1.3181, test_f1: 0.6197
 epoch: 55, train_loss: 0.5088, test_loss: 1.3549, test_f1: 0.5959
 epoch: 56, train_loss: 0.5455, test_loss: 1.3380, test_f1: 0.5905
 epoch: 57, train_loss: 0.5199, test_loss: 1.3605, test_f1: 0.5959
 epoch: 58, train_loss: 0.4866, test_loss: 1.3241, test_f1: 0.6068
 epoch: 59, train_loss: 0.4801, test_loss: 1.4062, test_f1: 0.5717
 epoch: 60, train_loss: 0.4791, test_loss: 1.5546, test_f1: 0.5638
 epoch: 61, train_loss: 0.4858, test_loss: 1.7371, test_f1: 0.5964
 epoch: 62, train_loss: 0.5020, test_loss: 1.3842, test_f1: 0.5374
 epoch: 63, train_loss: 0.4881, test_loss: 1.6399, test_f1: 0.5961
 epoch: 64, train_loss: 0.4755, test_loss: 1.4425, test_f1: 0.5628
 epoch: 65, train_loss: 0.4780, test_loss: 1.8515, test_f1: 0.6036
 epoch: 66, train_loss: 0.4740, test_loss: 1.9321, test_f1: 0.6246
 epoch: 67, train_loss: 0.4450, test_loss: 1.7009, test_f1: 0.5489
 epoch: 68, train_loss: 0.4777, test_loss: 2.5371, test_f1: 0.5182
 epoch: 69, train_loss: 0.4949, test_loss: 1.6575, test_f1: 0.5985
 epoch: 70, train_loss: 0.4605, test_loss: 1.8830, test_f1: 0.6486
 epoch: 71, train_loss: 0.4474, test_loss: 1.7865, test_f1: 0.5424
 epoch: 72, train_loss: 0.4669, test_loss: 1.6255, test_f1: 0.6272
 epoch: 73, train_loss: 0.4669, test_loss: 1.9988, test_f1: 0.6103
 epoch: 74, train_loss: 0.4334, test_loss: 1.4936, test_f1: 0.6348
 epoch: 75, train_loss: 0.4521, test_loss: 1.7398, test_f1: 0.6257
 epoch: 76, train_loss: 0.4451, test_loss: 1.6965, test_f1: 0.5644
 epoch: 77, train_loss: 0.4339, test_loss: 1.7064, test_f1: 0.6230
 epoch: 78, train_loss: 0.4184, test_loss: 1.5427, test_f1: 0.6176
 epoch: 79, train_loss: 0.4102, test_loss: 2.0349, test_f1: 0.6316
 epoch: 80, train_loss: 0.4249, test_loss: 1.7291, test_f1: 0.6084
 epoch: 81, train_loss: 0.3853, test_loss: 2.1167, test_f1: 0.6015
 epoch: 82, train_loss: 0.4141, test_loss: 1.7776, test_f1: 0.6754
 epoch: 83, train_loss: 0.4574, test_loss: 1.5495, test_f1: 0.5871
 epoch: 84, train_loss: 0.4241, test_loss: 1.8811, test_f1: 0.6418
 epoch: 85, train_loss: 0.4242, test_loss: 2.2996, test_f1: 0.5855
 epoch: 86, train_loss: 0.4363, test_loss: 1.6350, test_f1: 0.5652
 epoch: 87, train_loss: 0.4333, test_loss: 2.2567, test_f1: 0.6009
 epoch: 88, train_loss: 0.4399, test_loss: 2.4942, test_f1: 0.5550
 epoch: 89, train_loss: 0.4065, test_loss: 2.0159, test_f1: 0.6127
 epoch: 90, train_loss: 0.3725, test_loss: 2.2370, test_f1: 0.6274
 epoch: 91, train_loss: 0.4051, test_loss: 1.8478, test_f1: 0.5568
 epoch: 92, train_loss: 0.3947, test_loss: 2.2622, test_f1: 0.6385
 epoch: 93, train_loss: 0.3845, test_loss: 2.2523, test_f1: 0.5950
 epoch: 94, train_loss: 0.4028, test_loss: 1.7287, test_f1: 0.5511
 epoch: 95, train_loss: 0.4111, test_loss: 1.7905, test_f1: 0.5717
 epoch: 96, train_loss: 0.3875, test_loss: 1.8636, test_f1: 0.5805
 epoch: 97, train_loss: 0.3976, test_loss: 2.4984, test_f1: 0.6142
 epoch: 98, train_loss: 0.4079, test_loss: 2.2101, test_f1: 0.5834
 epoch: 99, train_loss: 0.3906, test_loss: 1.6331, test_f1: 0.6007
##################ITERATION #2 ****************************************
 epoch: 0, train_loss: 1.1894, test_loss: 1.4703, test_f1: 0.3125
 epoch: 1, train_loss: 0.9947, test_loss: 1.2608, test_f1: 0.3843
 epoch: 2, train_loss: 0.9001, test_loss: 1.1787, test_f1: 0.4087
 epoch: 3, train_loss: 0.8450, test_loss: 1.0537, test_f1: 0.5483
 epoch: 4, train_loss: 0.8436, test_loss: 1.0970, test_f1: 0.5172
 epoch: 5, train_loss: 0.8227, test_loss: 1.0020, test_f1: 0.5672
 epoch: 6, train_loss: 0.8055, test_loss: 1.1988, test_f1: 0.4406
 epoch: 7, train_loss: 0.7873, test_loss: 1.0422, test_f1: 0.5400
 epoch: 8, train_loss: 0.7753, test_loss: 0.9395, test_f1: 0.6208
 epoch: 9, train_loss: 0.7667, test_loss: 1.0927, test_f1: 0.5310
 epoch: 10, train_loss: 0.7561, test_loss: 1.0739, test_f1: 0.5432
 epoch: 11, train_loss: 0.7461, test_loss: 1.3293, test_f1: 0.4893
 epoch: 12, train_loss: 0.7579, test_loss: 1.0118, test_f1: 0.5648
 epoch: 13, train_loss: 0.7425, test_loss: 0.9600, test_f1: 0.5494
 epoch: 14, train_loss: 0.7397, test_loss: 1.3469, test_f1: 0.5385
 epoch: 15, train_loss: 0.7138, test_loss: 1.1031, test_f1: 0.5573
 epoch: 16, train_loss: 0.7070, test_loss: 1.0160, test_f1: 0.5249
 epoch: 17, train_loss: 0.6955, test_loss: 0.9671, test_f1: 0.6378
 epoch: 18, train_loss: 0.6856, test_loss: 1.0610, test_f1: 0.6261
 epoch: 19, train_loss: 0.6797, test_loss: 1.0735, test_f1: 0.5530
 epoch: 20, train_loss: 0.6745, test_loss: 1.9831, test_f1: 0.5081
 epoch: 21, train_loss: 0.6970, test_loss: 1.3688, test_f1: 0.4529
 epoch: 22, train_loss: 0.6950, test_loss: 1.1974, test_f1: 0.5771
 epoch: 23, train_loss: 0.6879, test_loss: 0.9758, test_f1: 0.5848
 epoch: 24, train_loss: 0.6613, test_loss: 1.3963, test_f1: 0.4990
 epoch: 25, train_loss: 0.7062, test_loss: 1.0914, test_f1: 0.6070
 epoch: 26, train_loss: 0.6682, test_loss: 1.0490, test_f1: 0.5570
 epoch: 27, train_loss: 0.6570, test_loss: 1.1003, test_f1: 0.5294
 epoch: 28, train_loss: 0.6743, test_loss: 1.0811, test_f1: 0.5016
 epoch: 29, train_loss: 0.6805, test_loss: 1.2806, test_f1: 0.5812
 epoch: 30, train_loss: 0.6687, test_loss: 1.1433, test_f1: 0.5844
 epoch: 31, train_loss: 0.6920, test_loss: 0.9977, test_f1: 0.6034
 epoch: 32, train_loss: 0.6656, test_loss: 1.0641, test_f1: 0.6471
 epoch: 33, train_loss: 0.6244, test_loss: 0.9698, test_f1: 0.6638
 epoch: 34, train_loss: 0.6790, test_loss: 0.9364, test_f1: 0.5971
 epoch: 35, train_loss: 0.6725, test_loss: 1.2168, test_f1: 0.6138
 epoch: 36, train_loss: 0.6625, test_loss: 1.2461, test_f1: 0.5090
 epoch: 37, train_loss: 0.6489, test_loss: 1.1331, test_f1: 0.5350
 epoch: 38, train_loss: 0.6443, test_loss: 1.0150, test_f1: 0.6256
 epoch: 39, train_loss: 0.6132, test_loss: 1.1085, test_f1: 0.6010
 epoch: 40, train_loss: 0.6462, test_loss: 1.0663, test_f1: 0.6193
 epoch: 41, train_loss: 0.5854, test_loss: 1.1101, test_f1: 0.5944
 epoch: 42, train_loss: 0.5740, test_loss: 1.2435, test_f1: 0.6035
 epoch: 43, train_loss: 0.5702, test_loss: 1.1202, test_f1: 0.6284
 epoch: 44, train_loss: 0.5617, test_loss: 1.1733, test_f1: 0.6216
 epoch: 45, train_loss: 0.5686, test_loss: 1.4884, test_f1: 0.5172
 epoch: 46, train_loss: 0.6012, test_loss: 1.4381, test_f1: 0.5045
 epoch: 47, train_loss: 0.6023, test_loss: 1.1258, test_f1: 0.6101
 epoch: 48, train_loss: 0.5433, test_loss: 1.1588, test_f1: 0.6470
 epoch: 49, train_loss: 0.5375, test_loss: 1.1380, test_f1: 0.6499
 epoch: 50, train_loss: 0.5371, test_loss: 1.3128, test_f1: 0.6211
 epoch: 51, train_loss: 0.5207, test_loss: 1.0983, test_f1: 0.6427
 epoch: 52, train_loss: 0.5163, test_loss: 1.2753, test_f1: 0.6219
 epoch: 53, train_loss: 0.4927, test_loss: 1.2028, test_f1: 0.6296
 epoch: 54, train_loss: 0.4771, test_loss: 1.1616, test_f1: 0.6724
 epoch: 55, train_loss: 0.4802, test_loss: 1.3929, test_f1: 0.5993
 epoch: 56, train_loss: 0.5128, test_loss: 1.3424, test_f1: 0.5834
 epoch: 57, train_loss: 0.5120, test_loss: 1.2574, test_f1: 0.6629
 epoch: 58, train_loss: 0.4481, test_loss: 1.3936, test_f1: 0.6511
 epoch: 59, train_loss: 0.4674, test_loss: 1.2880, test_f1: 0.6365
 epoch: 60, train_loss: 0.4614, test_loss: 1.2482, test_f1: 0.6575
 epoch: 61, train_loss: 0.4662, test_loss: 1.4730, test_f1: 0.6243
 epoch: 62, train_loss: 0.4616, test_loss: 1.4276, test_f1: 0.6488
 epoch: 63, train_loss: 0.4548, test_loss: 1.4389, test_f1: 0.6323
 epoch: 64, train_loss: 0.5173, test_loss: 1.2106, test_f1: 0.6716
 epoch: 65, train_loss: 0.4944, test_loss: 1.2629, test_f1: 0.6615
 epoch: 66, train_loss: 0.4845, test_loss: 1.2344, test_f1: 0.6799
 epoch: 67, train_loss: 0.4612, test_loss: 1.5271, test_f1: 0.6252
 epoch: 68, train_loss: 0.4403, test_loss: 1.4325, test_f1: 0.6475
 epoch: 69, train_loss: 0.4225, test_loss: 1.3843, test_f1: 0.6303
 epoch: 70, train_loss: 0.4669, test_loss: 1.5381, test_f1: 0.6468
 epoch: 71, train_loss: 0.4564, test_loss: 1.2412, test_f1: 0.6924
 epoch: 72, train_loss: 0.4338, test_loss: 1.4683, test_f1: 0.6018
 epoch: 73, train_loss: 0.4390, test_loss: 1.4336, test_f1: 0.6467
 epoch: 74, train_loss: 0.4432, test_loss: 1.4453, test_f1: 0.6424
 epoch: 75, train_loss: 0.4492, test_loss: 1.5328, test_f1: 0.6261
 epoch: 76, train_loss: 0.4269, test_loss: 1.4358, test_f1: 0.6215
 epoch: 77, train_loss: 0.4501, test_loss: 1.3876, test_f1: 0.6124
 epoch: 78, train_loss: 0.4125, test_loss: 1.3179, test_f1: 0.6693
 epoch: 79, train_loss: 0.4326, test_loss: 1.4634, test_f1: 0.6482
 epoch: 80, train_loss: 0.4081, test_loss: 1.4943, test_f1: 0.6570
 epoch: 81, train_loss: 0.4260, test_loss: 1.3439, test_f1: 0.6900
 epoch: 82, train_loss: 0.4183, test_loss: 1.4419, test_f1: 0.6636
 epoch: 83, train_loss: 0.4163, test_loss: 1.4972, test_f1: 0.6247
 epoch: 84, train_loss: 0.4042, test_loss: 1.3659, test_f1: 0.6590
 epoch: 85, train_loss: 0.3910, test_loss: 1.5047, test_f1: 0.6702
 epoch: 86, train_loss: 0.4065, test_loss: 1.5126, test_f1: 0.6648
 epoch: 87, train_loss: 0.4019, test_loss: 1.8971, test_f1: 0.6345
 epoch: 88, train_loss: 0.4082, test_loss: 1.4843, test_f1: 0.6389
 epoch: 89, train_loss: 0.4066, test_loss: 1.5090, test_f1: 0.6558
 epoch: 90, train_loss: 0.4077, test_loss: 1.9567, test_f1: 0.6407
 epoch: 91, train_loss: 0.3935, test_loss: 1.6447, test_f1: 0.6509
 epoch: 92, train_loss: 0.4320, test_loss: 2.5373, test_f1: 0.4821
 epoch: 93, train_loss: 0.4076, test_loss: 1.4179, test_f1: 0.6827
 epoch: 94, train_loss: 0.3747, test_loss: 1.5722, test_f1: 0.6467
 epoch: 95, train_loss: 0.3786, test_loss: 1.5500, test_f1: 0.6365
 epoch: 96, train_loss: 0.4360, test_loss: 1.5884, test_f1: 0.5818
 epoch: 97, train_loss: 0.3971, test_loss: 1.7594, test_f1: 0.6146
 epoch: 98, train_loss: 0.3899, test_loss: 1.4190, test_f1: 0.6751
 epoch: 99, train_loss: 0.3659, test_loss: 1.5096, test_f1: 0.6414
##################ITERATION #3 ****************************************
 epoch: 0, train_loss: 1.2443, test_loss: 1.4662, test_f1: 0.1405
 epoch: 1, train_loss: 1.0172, test_loss: 1.3050, test_f1: 0.3460
 epoch: 2, train_loss: 0.9328, test_loss: 1.1770, test_f1: 0.4939
 epoch: 3, train_loss: 0.9130, test_loss: 1.0802, test_f1: 0.4809
 epoch: 4, train_loss: 0.8726, test_loss: 1.0882, test_f1: 0.4976
 epoch: 5, train_loss: 0.8556, test_loss: 1.3560, test_f1: 0.3647
 epoch: 6, train_loss: 0.8300, test_loss: 1.0892, test_f1: 0.5639
 epoch: 7, train_loss: 0.7908, test_loss: 1.1982, test_f1: 0.4102
 epoch: 8, train_loss: 0.7836, test_loss: 0.9602, test_f1: 0.6064
 epoch: 9, train_loss: 0.7805, test_loss: 1.1293, test_f1: 0.4783
 epoch: 10, train_loss: 0.7682, test_loss: 1.1582, test_f1: 0.5949
 epoch: 11, train_loss: 0.7633, test_loss: 1.0745, test_f1: 0.5473
 epoch: 12, train_loss: 0.7161, test_loss: 0.9582, test_f1: 0.6338
 epoch: 13, train_loss: 0.7362, test_loss: 1.0006, test_f1: 0.5916
 epoch: 14, train_loss: 0.6998, test_loss: 1.0866, test_f1: 0.4978
 epoch: 15, train_loss: 0.7255, test_loss: 1.2430, test_f1: 0.5288
 epoch: 16, train_loss: 0.7407, test_loss: 1.1238, test_f1: 0.4336
 epoch: 17, train_loss: 0.7237, test_loss: 1.0014, test_f1: 0.5961
 epoch: 18, train_loss: 0.7188, test_loss: 1.1294, test_f1: 0.6317
 epoch: 19, train_loss: 0.7043, test_loss: 1.0297, test_f1: 0.6172
 epoch: 20, train_loss: 0.6932, test_loss: 0.9479, test_f1: 0.6459
 epoch: 21, train_loss: 0.6573, test_loss: 1.2069, test_f1: 0.6433
 epoch: 22, train_loss: 0.6508, test_loss: 0.9626, test_f1: 0.6347
 epoch: 23, train_loss: 0.6745, test_loss: 0.9418, test_f1: 0.6686
 epoch: 24, train_loss: 0.7082, test_loss: 2.0906, test_f1: 0.3626
 epoch: 25, train_loss: 0.7459, test_loss: 3.1729, test_f1: 0.4570
 epoch: 26, train_loss: 0.6710, test_loss: 1.1012, test_f1: 0.5163
 epoch: 27, train_loss: 0.7289, test_loss: 1.1312, test_f1: 0.5105
 epoch: 28, train_loss: 0.6931, test_loss: 0.9549, test_f1: 0.6409
 epoch: 29, train_loss: 0.6573, test_loss: 0.9997, test_f1: 0.6358
 epoch: 30, train_loss: 0.6642, test_loss: 0.9753, test_f1: 0.6369
 epoch: 31, train_loss: 0.6471, test_loss: 1.0248, test_f1: 0.6288
 epoch: 32, train_loss: 0.6029, test_loss: 0.9476, test_f1: 0.6062
 epoch: 33, train_loss: 0.6110, test_loss: 1.3374, test_f1: 0.6260
 epoch: 34, train_loss: 0.6386, test_loss: 1.1202, test_f1: 0.6230
 epoch: 35, train_loss: 0.6106, test_loss: 1.0647, test_f1: 0.5926
 epoch: 36, train_loss: 0.6060, test_loss: 1.0168, test_f1: 0.6309
 epoch: 37, train_loss: 0.5819, test_loss: 1.1379, test_f1: 0.5924
 epoch: 38, train_loss: 0.5960, test_loss: 1.0920, test_f1: 0.6160
 epoch: 39, train_loss: 0.5813, test_loss: 1.0975, test_f1: 0.5674
 epoch: 40, train_loss: 0.5684, test_loss: 1.4381, test_f1: 0.6066
 epoch: 41, train_loss: 0.6130, test_loss: 1.3514, test_f1: 0.6187
 epoch: 42, train_loss: 0.6011, test_loss: 1.1560, test_f1: 0.6684
 epoch: 43, train_loss: 0.5854, test_loss: 1.1497, test_f1: 0.6296
 epoch: 44, train_loss: 0.5440, test_loss: 1.4770, test_f1: 0.5213
 epoch: 45, train_loss: 0.5646, test_loss: 1.0900, test_f1: 0.6663
 epoch: 46, train_loss: 0.5736, test_loss: 1.3162, test_f1: 0.5783
 epoch: 47, train_loss: 0.5846, test_loss: 1.1968, test_f1: 0.5237
 epoch: 48, train_loss: 0.5447, test_loss: 1.9440, test_f1: 0.5798
 epoch: 49, train_loss: 0.5657, test_loss: 1.4741, test_f1: 0.5096
 epoch: 50, train_loss: 0.5767, test_loss: 1.1925, test_f1: 0.6046
 epoch: 51, train_loss: 0.5432, test_loss: 1.1483, test_f1: 0.6523
 epoch: 52, train_loss: 0.5251, test_loss: 1.1390, test_f1: 0.6908
 epoch: 53, train_loss: 0.4673, test_loss: 1.2376, test_f1: 0.6545
 epoch: 54, train_loss: 0.4726, test_loss: 1.2453, test_f1: 0.6359
 epoch: 55, train_loss: 0.4646, test_loss: 1.2255, test_f1: 0.6612
 epoch: 56, train_loss: 0.4604, test_loss: 1.4006, test_f1: 0.6308
 epoch: 57, train_loss: 0.4562, test_loss: 1.3373, test_f1: 0.6283
 epoch: 58, train_loss: 0.4751, test_loss: 1.2628, test_f1: 0.6447
 epoch: 59, train_loss: 0.4491, test_loss: 1.3327, test_f1: 0.6231
 epoch: 60, train_loss: 0.4348, test_loss: 1.2991, test_f1: 0.6550
 epoch: 61, train_loss: 0.4555, test_loss: 1.3027, test_f1: 0.6136
 epoch: 62, train_loss: 0.4403, test_loss: 1.2732, test_f1: 0.6622
 epoch: 63, train_loss: 0.4333, test_loss: 1.6010, test_f1: 0.6193
 epoch: 64, train_loss: 0.4359, test_loss: 1.4702, test_f1: 0.6123
 epoch: 65, train_loss: 0.4532, test_loss: 1.3639, test_f1: 0.6146
 epoch: 66, train_loss: 0.4513, test_loss: 1.7210, test_f1: 0.6350
 epoch: 67, train_loss: 0.4833, test_loss: 1.3619, test_f1: 0.6451
 epoch: 68, train_loss: 0.4402, test_loss: 1.3296, test_f1: 0.6831
 epoch: 69, train_loss: 0.4156, test_loss: 1.3739, test_f1: 0.6518
 epoch: 70, train_loss: 0.4177, test_loss: 1.6399, test_f1: 0.6487
 epoch: 71, train_loss: 0.4371, test_loss: 1.6518, test_f1: 0.6503
 epoch: 72, train_loss: 0.4188, test_loss: 1.4516, test_f1: 0.6152
 epoch: 73, train_loss: 0.4302, test_loss: 1.8140, test_f1: 0.5957
 epoch: 74, train_loss: 0.4340, test_loss: 1.5836, test_f1: 0.6242
 epoch: 75, train_loss: 0.3983, test_loss: 1.3612, test_f1: 0.6409
 epoch: 76, train_loss: 0.3892, test_loss: 1.6774, test_f1: 0.6068
 epoch: 77, train_loss: 0.3908, test_loss: 1.8339, test_f1: 0.6172
 epoch: 78, train_loss: 0.4056, test_loss: 1.5529, test_f1: 0.5847
 epoch: 79, train_loss: 0.3872, test_loss: 1.5380, test_f1: 0.6257
 epoch: 80, train_loss: 0.3828, test_loss: 1.5781, test_f1: 0.5962
 epoch: 81, train_loss: 0.4215, test_loss: 1.7222, test_f1: 0.5790
 epoch: 82, train_loss: 0.4323, test_loss: 1.4893, test_f1: 0.6163
 epoch: 83, train_loss: 0.4229, test_loss: 1.5211, test_f1: 0.5617
 epoch: 84, train_loss: 0.4807, test_loss: 1.5804, test_f1: 0.6819
 epoch: 85, train_loss: 0.4567, test_loss: 1.6371, test_f1: 0.6174
 epoch: 86, train_loss: 0.4225, test_loss: 1.6560, test_f1: 0.6771
 epoch: 87, train_loss: 0.4440, test_loss: 1.3963, test_f1: 0.5923
 epoch: 88, train_loss: 0.3894, test_loss: 1.3570, test_f1: 0.6613
 epoch: 89, train_loss: 0.4249, test_loss: 1.5430, test_f1: 0.6426
 epoch: 90, train_loss: 0.3932, test_loss: 1.4672, test_f1: 0.6455
 epoch: 91, train_loss: 0.3720, test_loss: 1.9220, test_f1: 0.6138
 epoch: 92, train_loss: 0.3924, test_loss: 1.5183, test_f1: 0.6205
 epoch: 93, train_loss: 0.4030, test_loss: 1.6524, test_f1: 0.6454
 epoch: 94, train_loss: 0.4024, test_loss: 1.8208, test_f1: 0.6283
 epoch: 95, train_loss: 0.3707, test_loss: 1.5889, test_f1: 0.6283
 epoch: 96, train_loss: 0.3386, test_loss: 1.4426, test_f1: 0.6429
 epoch: 97, train_loss: 0.4021, test_loss: 1.6967, test_f1: 0.6506
 epoch: 98, train_loss: 0.3873, test_loss: 1.5357, test_f1: 0.6140
 epoch: 99, train_loss: 0.3679, test_loss: 2.4274, test_f1: 0.5948
##################ITERATION #4 ****************************************
 epoch: 0, train_loss: 1.1927, test_loss: 1.5606, test_f1: 0.3219
 epoch: 1, train_loss: 1.0000, test_loss: 1.2301, test_f1: 0.4147
 epoch: 2, train_loss: 0.9179, test_loss: 1.1120, test_f1: 0.5452
 epoch: 3, train_loss: 0.8728, test_loss: 1.0858, test_f1: 0.5207
 epoch: 4, train_loss: 0.8370, test_loss: 1.0214, test_f1: 0.5445
 epoch: 5, train_loss: 0.7981, test_loss: 1.0717, test_f1: 0.5634
 epoch: 6, train_loss: 0.8158, test_loss: 1.1565, test_f1: 0.4744
 epoch: 7, train_loss: 0.7973, test_loss: 1.4203, test_f1: 0.4626
 epoch: 8, train_loss: 0.8078, test_loss: 1.1176, test_f1: 0.5175
 epoch: 9, train_loss: 0.7745, test_loss: 1.1009, test_f1: 0.5855
 epoch: 10, train_loss: 0.7380, test_loss: 0.9452, test_f1: 0.5983
 epoch: 11, train_loss: 0.7110, test_loss: 1.7887, test_f1: 0.4255
 epoch: 12, train_loss: 0.7453, test_loss: 1.0754, test_f1: 0.5654
 epoch: 13, train_loss: 0.7177, test_loss: 1.0401, test_f1: 0.5552
 epoch: 14, train_loss: 0.7301, test_loss: 1.0897, test_f1: 0.5569
 epoch: 15, train_loss: 0.7416, test_loss: 1.0322, test_f1: 0.5999
 epoch: 16, train_loss: 0.7147, test_loss: 1.5901, test_f1: 0.4618
 epoch: 17, train_loss: 0.7193, test_loss: 0.9675, test_f1: 0.5695
 epoch: 18, train_loss: 0.7416, test_loss: 1.5218, test_f1: 0.4778
 epoch: 19, train_loss: 0.7246, test_loss: 1.0205, test_f1: 0.6169
 epoch: 20, train_loss: 0.6931, test_loss: 0.9964, test_f1: 0.5775
 epoch: 21, train_loss: 0.6933, test_loss: 1.1443, test_f1: 0.5809
 epoch: 22, train_loss: 0.6883, test_loss: 1.0822, test_f1: 0.5812
 epoch: 23, train_loss: 0.6639, test_loss: 1.2036, test_f1: 0.6332
 epoch: 24, train_loss: 0.6940, test_loss: 1.0574, test_f1: 0.5326
 epoch: 25, train_loss: 0.6463, test_loss: 1.5667, test_f1: 0.4846
 epoch: 26, train_loss: 0.6879, test_loss: 1.0935, test_f1: 0.5745
 epoch: 27, train_loss: 0.6852, test_loss: 1.0191, test_f1: 0.5932
 epoch: 28, train_loss: 0.6676, test_loss: 1.2958, test_f1: 0.4515
 epoch: 29, train_loss: 0.6684, test_loss: 1.2823, test_f1: 0.6315
 epoch: 30, train_loss: 0.6673, test_loss: 1.1076, test_f1: 0.5558
 epoch: 31, train_loss: 0.6381, test_loss: 1.9111, test_f1: 0.4809
 epoch: 32, train_loss: 0.6261, test_loss: 1.1159, test_f1: 0.6088
 epoch: 33, train_loss: 0.6159, test_loss: 1.1428, test_f1: 0.5847
 epoch: 34, train_loss: 0.6707, test_loss: 1.2748, test_f1: 0.4774
 epoch: 35, train_loss: 0.6478, test_loss: 1.2254, test_f1: 0.5950
 epoch: 36, train_loss: 0.6257, test_loss: 1.1276, test_f1: 0.6428
 epoch: 37, train_loss: 0.6195, test_loss: 1.4488, test_f1: 0.5227
 epoch: 38, train_loss: 0.5940, test_loss: 1.4780, test_f1: 0.5050
 epoch: 39, train_loss: 0.6270, test_loss: 1.1191, test_f1: 0.5934
 epoch: 40, train_loss: 0.6011, test_loss: 1.1364, test_f1: 0.6310
 epoch: 41, train_loss: 0.5810, test_loss: 1.2376, test_f1: 0.5776
 epoch: 42, train_loss: 0.5667, test_loss: 1.3101, test_f1: 0.6409
 epoch: 43, train_loss: 0.5944, test_loss: 1.2039, test_f1: 0.6158
 epoch: 44, train_loss: 0.5653, test_loss: 1.1583, test_f1: 0.5901
 epoch: 45, train_loss: 0.5694, test_loss: 1.4992, test_f1: 0.5871
 epoch: 46, train_loss: 0.5762, test_loss: 1.3324, test_f1: 0.6020
 epoch: 47, train_loss: 0.5663, test_loss: 1.4213, test_f1: 0.5885
 epoch: 48, train_loss: 0.5244, test_loss: 1.3356, test_f1: 0.5881
 epoch: 49, train_loss: 0.5388, test_loss: 1.2444, test_f1: 0.6355
 epoch: 50, train_loss: 0.5635, test_loss: 1.6798, test_f1: 0.4882
 epoch: 51, train_loss: 0.5479, test_loss: 1.3467, test_f1: 0.6469
 epoch: 52, train_loss: 0.5079, test_loss: 1.1678, test_f1: 0.6493
 epoch: 53, train_loss: 0.4690, test_loss: 1.3486, test_f1: 0.6049
 epoch: 54, train_loss: 0.4720, test_loss: 1.4459, test_f1: 0.5931
 epoch: 55, train_loss: 0.4540, test_loss: 1.3037, test_f1: 0.6295
 epoch: 56, train_loss: 0.4513, test_loss: 1.4321, test_f1: 0.5855
 epoch: 57, train_loss: 0.4466, test_loss: 1.3713, test_f1: 0.6382
 epoch: 58, train_loss: 0.4469, test_loss: 1.4074, test_f1: 0.6489
 epoch: 59, train_loss: 0.4852, test_loss: 1.2314, test_f1: 0.6372
 epoch: 60, train_loss: 0.4689, test_loss: 1.4610, test_f1: 0.6104
 epoch: 61, train_loss: 0.4381, test_loss: 1.3598, test_f1: 0.6043
 epoch: 62, train_loss: 0.4966, test_loss: 1.8123, test_f1: 0.5622
 epoch: 63, train_loss: 0.4748, test_loss: 1.3628, test_f1: 0.5980
 epoch: 64, train_loss: 0.4765, test_loss: 1.6511, test_f1: 0.6100
 epoch: 65, train_loss: 0.4469, test_loss: 1.6450, test_f1: 0.5845
 epoch: 66, train_loss: 0.4664, test_loss: 1.5577, test_f1: 0.6621
 epoch: 67, train_loss: 0.4248, test_loss: 1.4863, test_f1: 0.6398
 epoch: 68, train_loss: 0.4087, test_loss: 1.4968, test_f1: 0.5970
 epoch: 69, train_loss: 0.4525, test_loss: 1.4589, test_f1: 0.6653
 epoch: 70, train_loss: 0.4348, test_loss: 1.7112, test_f1: 0.6354
 epoch: 71, train_loss: 0.4256, test_loss: 1.8719, test_f1: 0.6189
 epoch: 72, train_loss: 0.4697, test_loss: 1.5364, test_f1: 0.6218
 epoch: 73, train_loss: 0.4329, test_loss: 1.5878, test_f1: 0.6422
 epoch: 74, train_loss: 0.3886, test_loss: 1.5889, test_f1: 0.6506
 epoch: 75, train_loss: 0.4418, test_loss: 1.8312, test_f1: 0.5986
 epoch: 76, train_loss: 0.4033, test_loss: 1.6000, test_f1: 0.6724
 epoch: 77, train_loss: 0.3803, test_loss: 1.6754, test_f1: 0.6650
 epoch: 78, train_loss: 0.3872, test_loss: 1.6978, test_f1: 0.6611
 epoch: 79, train_loss: 0.4221, test_loss: 1.8213, test_f1: 0.6562
 epoch: 80, train_loss: 0.3966, test_loss: 1.7428, test_f1: 0.6179
 epoch: 81, train_loss: 0.3681, test_loss: 1.6777, test_f1: 0.6202
 epoch: 82, train_loss: 0.4121, test_loss: 1.9205, test_f1: 0.6169
 epoch: 83, train_loss: 0.3682, test_loss: 2.0529, test_f1: 0.6322
 epoch: 84, train_loss: 0.4133, test_loss: 1.8507, test_f1: 0.5843
 epoch: 85, train_loss: 0.3853, test_loss: 1.9409, test_f1: 0.6785
 epoch: 86, train_loss: 0.3649, test_loss: 2.0807, test_f1: 0.6156
 epoch: 87, train_loss: 0.3930, test_loss: 1.8299, test_f1: 0.6569
 epoch: 88, train_loss: 0.3717, test_loss: 1.6823, test_f1: 0.6515
 epoch: 89, train_loss: 0.3592, test_loss: 1.6804, test_f1: 0.6292
 epoch: 90, train_loss: 0.3510, test_loss: 2.2440, test_f1: 0.5444
 epoch: 91, train_loss: 0.3448, test_loss: 2.0791, test_f1: 0.5956
 epoch: 92, train_loss: 0.3551, test_loss: 1.9142, test_f1: 0.6136
 epoch: 93, train_loss: 0.3754, test_loss: 1.9780, test_f1: 0.6470
 epoch: 94, train_loss: 0.3723, test_loss: 2.0200, test_f1: 0.6177
 epoch: 95, train_loss: 0.3678, test_loss: 2.1924, test_f1: 0.6324
 epoch: 96, train_loss: 0.3744, test_loss: 2.3674, test_f1: 0.5915
 epoch: 97, train_loss: 0.3218, test_loss: 1.7941, test_f1: 0.6135
 epoch: 98, train_loss: 0.3263, test_loss: 2.3942, test_f1: 0.6253
 epoch: 99, train_loss: 0.2984, test_loss: 2.8895, test_f1: 0.6177
##################ITERATION #5 ****************************************
 epoch: 0, train_loss: 1.2220, test_loss: 1.4349, test_f1: 0.3508
 epoch: 1, train_loss: 1.0183, test_loss: 1.4400, test_f1: 0.3662
 epoch: 2, train_loss: 0.9271, test_loss: 1.2755, test_f1: 0.4454
 epoch: 3, train_loss: 0.8776, test_loss: 1.0725, test_f1: 0.5031
 epoch: 4, train_loss: 0.8672, test_loss: 1.0233, test_f1: 0.5429
 epoch: 5, train_loss: 0.8293, test_loss: 1.0630, test_f1: 0.5225
 epoch: 6, train_loss: 0.8366, test_loss: 1.0750, test_f1: 0.5251
 epoch: 7, train_loss: 0.8332, test_loss: 1.1271, test_f1: 0.4382
 epoch: 8, train_loss: 0.8198, test_loss: 1.0004, test_f1: 0.5127
 epoch: 9, train_loss: 0.7853, test_loss: 1.0075, test_f1: 0.5536
 epoch: 10, train_loss: 0.7972, test_loss: 1.3062, test_f1: 0.4446
 epoch: 11, train_loss: 0.7625, test_loss: 1.4083, test_f1: 0.4624
 epoch: 12, train_loss: 0.7467, test_loss: 1.0754, test_f1: 0.6072
 epoch: 13, train_loss: 0.7572, test_loss: 1.1041, test_f1: 0.5690
 epoch: 14, train_loss: 0.7734, test_loss: 1.0368, test_f1: 0.6036
 epoch: 15, train_loss: 0.7781, test_loss: 1.2482, test_f1: 0.5355
 epoch: 16, train_loss: 0.7534, test_loss: 1.0650, test_f1: 0.6241
 epoch: 17, train_loss: 0.7336, test_loss: 1.3009, test_f1: 0.5027
 epoch: 18, train_loss: 0.7252, test_loss: 1.2147, test_f1: 0.5326
 epoch: 19, train_loss: 0.6963, test_loss: 1.1487, test_f1: 0.5975
 epoch: 20, train_loss: 0.6971, test_loss: 1.1215, test_f1: 0.6151
 epoch: 21, train_loss: 0.7003, test_loss: 1.0899, test_f1: 0.5590
 epoch: 22, train_loss: 0.6925, test_loss: 1.0869, test_f1: 0.5676
 epoch: 23, train_loss: 0.6888, test_loss: 1.2295, test_f1: 0.5212
 epoch: 24, train_loss: 0.7039, test_loss: 1.4262, test_f1: 0.5409
 epoch: 25, train_loss: 0.6815, test_loss: 1.3567, test_f1: 0.4896
 epoch: 26, train_loss: 0.6644, test_loss: 1.1842, test_f1: 0.6332
 epoch: 27, train_loss: 0.6624, test_loss: 1.2948, test_f1: 0.6089
 epoch: 28, train_loss: 0.6400, test_loss: 1.2972, test_f1: 0.6154
 epoch: 29, train_loss: 0.6516, test_loss: 1.2020, test_f1: 0.5858
 epoch: 30, train_loss: 0.6721, test_loss: 1.1168, test_f1: 0.5914
 epoch: 31, train_loss: 0.6943, test_loss: 1.3764, test_f1: 0.5761
 epoch: 32, train_loss: 0.6578, test_loss: 1.1462, test_f1: 0.6236
 epoch: 33, train_loss: 0.6559, test_loss: 1.0228, test_f1: 0.6107
 epoch: 34, train_loss: 0.6742, test_loss: 1.6693, test_f1: 0.5674
 epoch: 35, train_loss: 0.6409, test_loss: 1.1752, test_f1: 0.6314
 epoch: 36, train_loss: 0.6249, test_loss: 1.1466, test_f1: 0.5444
 epoch: 37, train_loss: 0.6285, test_loss: 1.6250, test_f1: 0.5109
 epoch: 38, train_loss: 0.6145, test_loss: 1.1558, test_f1: 0.6038
 epoch: 39, train_loss: 0.6138, test_loss: 1.8286, test_f1: 0.5085
 epoch: 40, train_loss: 0.6090, test_loss: 1.7949, test_f1: 0.4927
 epoch: 41, train_loss: 0.6088, test_loss: 1.6717, test_f1: 0.5593
 epoch: 42, train_loss: 0.6139, test_loss: 1.1884, test_f1: 0.5968
 epoch: 43, train_loss: 0.5974, test_loss: 1.2757, test_f1: 0.5964
 epoch: 44, train_loss: 0.5935, test_loss: 1.2773, test_f1: 0.6670
 epoch: 45, train_loss: 0.5966, test_loss: 1.5275, test_f1: 0.5070
 epoch: 46, train_loss: 0.6293, test_loss: 1.9024, test_f1: 0.4026
 epoch: 47, train_loss: 0.6243, test_loss: 1.1991, test_f1: 0.5747
 epoch: 48, train_loss: 0.5711, test_loss: 1.2788, test_f1: 0.6164
 epoch: 49, train_loss: 0.5602, test_loss: 1.1593, test_f1: 0.6395
 epoch: 50, train_loss: 0.5649, test_loss: 1.4222, test_f1: 0.6258
 epoch: 51, train_loss: 0.5490, test_loss: 1.3153, test_f1: 0.6100
 epoch: 52, train_loss: 0.5148, test_loss: 1.3095, test_f1: 0.6371
 epoch: 53, train_loss: 0.5126, test_loss: 1.3059, test_f1: 0.6428
 epoch: 54, train_loss: 0.4884, test_loss: 1.3638, test_f1: 0.5983
 epoch: 55, train_loss: 0.4828, test_loss: 1.4499, test_f1: 0.6236
 epoch: 56, train_loss: 0.4664, test_loss: 1.4011, test_f1: 0.6394
 epoch: 57, train_loss: 0.4631, test_loss: 1.2231, test_f1: 0.6389
 epoch: 58, train_loss: 0.4635, test_loss: 1.1991, test_f1: 0.6153
 epoch: 59, train_loss: 0.4744, test_loss: 1.6138, test_f1: 0.6122
 epoch: 60, train_loss: 0.4752, test_loss: 1.3205, test_f1: 0.5896
 epoch: 61, train_loss: 0.5031, test_loss: 1.3933, test_f1: 0.5696
 epoch: 62, train_loss: 0.4844, test_loss: 1.5976, test_f1: 0.6187
 epoch: 63, train_loss: 0.4759, test_loss: 1.6734, test_f1: 0.6019
 epoch: 64, train_loss: 0.4492, test_loss: 1.6274, test_f1: 0.5865
 epoch: 65, train_loss: 0.4329, test_loss: 1.4355, test_f1: 0.5705
 epoch: 66, train_loss: 0.4465, test_loss: 1.4769, test_f1: 0.5998
 epoch: 67, train_loss: 0.4359, test_loss: 1.6377, test_f1: 0.5827
 epoch: 68, train_loss: 0.4544, test_loss: 1.4036, test_f1: 0.5885
 epoch: 69, train_loss: 0.4281, test_loss: 1.4802, test_f1: 0.6193
 epoch: 70, train_loss: 0.4332, test_loss: 1.6603, test_f1: 0.5909
 epoch: 71, train_loss: 0.4228, test_loss: 1.5860, test_f1: 0.5733
 epoch: 72, train_loss: 0.4313, test_loss: 1.5096, test_f1: 0.5996
 epoch: 73, train_loss: 0.4255, test_loss: 1.5628, test_f1: 0.6327
 epoch: 74, train_loss: 0.4163, test_loss: 1.5836, test_f1: 0.5860
 epoch: 75, train_loss: 0.4415, test_loss: 1.6989, test_f1: 0.5851
 epoch: 76, train_loss: 0.4402, test_loss: 1.5271, test_f1: 0.6133
 epoch: 77, train_loss: 0.4344, test_loss: 1.5248, test_f1: 0.6187
 epoch: 78, train_loss: 0.4359, test_loss: 1.5366, test_f1: 0.5998
 epoch: 79, train_loss: 0.4270, test_loss: 1.4263, test_f1: 0.6003
 epoch: 80, train_loss: 0.4227, test_loss: 1.4097, test_f1: 0.6193
 epoch: 81, train_loss: 0.3732, test_loss: 1.5061, test_f1: 0.6182
 epoch: 82, train_loss: 0.3894, test_loss: 1.8283, test_f1: 0.6296
 epoch: 83, train_loss: 0.4035, test_loss: 2.0075, test_f1: 0.5650
 epoch: 84, train_loss: 0.3931, test_loss: 1.8218, test_f1: 0.5715
 epoch: 85, train_loss: 0.3863, test_loss: 1.5715, test_f1: 0.6303
 epoch: 86, train_loss: 0.3913, test_loss: 1.8751, test_f1: 0.5918
 epoch: 87, train_loss: 0.3882, test_loss: 1.7372, test_f1: 0.5931
 epoch: 88, train_loss: 0.3941, test_loss: 1.7948, test_f1: 0.6138
 epoch: 89, train_loss: 0.3993, test_loss: 1.8499, test_f1: 0.6371
 epoch: 90, train_loss: 0.3896, test_loss: 1.7585, test_f1: 0.6385
 epoch: 91, train_loss: 0.3542, test_loss: 1.7703, test_f1: 0.5993
 epoch: 92, train_loss: 0.3700, test_loss: 1.9912, test_f1: 0.5766
 epoch: 93, train_loss: 0.3925, test_loss: 1.8621, test_f1: 0.6123
 epoch: 94, train_loss: 0.3898, test_loss: 2.0775, test_f1: 0.5573
 epoch: 95, train_loss: 0.3977, test_loss: 1.8868, test_f1: 0.5823
 epoch: 96, train_loss: 0.3492, test_loss: 1.6834, test_f1: 0.6375
 epoch: 97, train_loss: 0.3809, test_loss: 1.7718, test_f1: 0.6220
 epoch: 98, train_loss: 0.3819, test_loss: 1.8200, test_f1: 0.5912
 epoch: 99, train_loss: 0.3735, test_loss: 2.0525, test_f1: 0.6193
##################ITERATION #6 ****************************************
 epoch: 0, train_loss: 1.3201, test_loss: 1.5187, test_f1: 0.3017
 epoch: 1, train_loss: 1.0538, test_loss: 1.4791, test_f1: 0.3184
 epoch: 2, train_loss: 1.0080, test_loss: 1.4198, test_f1: 0.3178
 epoch: 3, train_loss: 0.9747, test_loss: 1.3573, test_f1: 0.3582
 epoch: 4, train_loss: 0.9138, test_loss: 1.1682, test_f1: 0.5039
 epoch: 5, train_loss: 0.8693, test_loss: 1.5971, test_f1: 0.4143
 epoch: 6, train_loss: 0.8489, test_loss: 1.0564, test_f1: 0.5567
 epoch: 7, train_loss: 0.8255, test_loss: 1.0431, test_f1: 0.5451
 epoch: 8, train_loss: 0.8214, test_loss: 1.1069, test_f1: 0.5293
 epoch: 9, train_loss: 0.8012, test_loss: 1.2762, test_f1: 0.5080
 epoch: 10, train_loss: 0.8433, test_loss: 1.2639, test_f1: 0.4791
 epoch: 11, train_loss: 0.7761, test_loss: 0.9892, test_f1: 0.6166
 epoch: 12, train_loss: 0.7642, test_loss: 1.0463, test_f1: 0.5378
 epoch: 13, train_loss: 0.7587, test_loss: 1.1499, test_f1: 0.5736
 epoch: 14, train_loss: 0.7693, test_loss: 1.5567, test_f1: 0.4415
 epoch: 15, train_loss: 0.7435, test_loss: 0.9397, test_f1: 0.6466
 epoch: 16, train_loss: 0.7253, test_loss: 1.2647, test_f1: 0.5230
 epoch: 17, train_loss: 0.7270, test_loss: 1.0550, test_f1: 0.5553
 epoch: 18, train_loss: 0.7253, test_loss: 1.0594, test_f1: 0.6017
 epoch: 19, train_loss: 0.6927, test_loss: 1.0810, test_f1: 0.5966
 epoch: 20, train_loss: 0.7026, test_loss: 1.2618, test_f1: 0.5142
 epoch: 21, train_loss: 0.6920, test_loss: 1.4587, test_f1: 0.4754
 epoch: 22, train_loss: 0.7031, test_loss: 1.1871, test_f1: 0.5353
 epoch: 23, train_loss: 0.6723, test_loss: 1.3967, test_f1: 0.5378
 epoch: 24, train_loss: 0.7675, test_loss: 1.1183, test_f1: 0.6071
 epoch: 25, train_loss: 0.7056, test_loss: 0.9795, test_f1: 0.5417
 epoch: 26, train_loss: 0.6930, test_loss: 0.9910, test_f1: 0.5779
 epoch: 27, train_loss: 0.7219, test_loss: 0.9511, test_f1: 0.5824
 epoch: 28, train_loss: 0.7053, test_loss: 1.0930, test_f1: 0.5499
 epoch: 29, train_loss: 0.6724, test_loss: 0.9592, test_f1: 0.6337
 epoch: 30, train_loss: 0.6657, test_loss: 1.0042, test_f1: 0.6370
 epoch: 31, train_loss: 0.6486, test_loss: 1.1195, test_f1: 0.5837
 epoch: 32, train_loss: 0.7108, test_loss: 1.4129, test_f1: 0.5398
 epoch: 33, train_loss: 0.6969, test_loss: 1.1655, test_f1: 0.5675
 epoch: 34, train_loss: 0.6878, test_loss: 2.0738, test_f1: 0.5121
 epoch: 35, train_loss: 0.6896, test_loss: 1.0932, test_f1: 0.6057
 epoch: 36, train_loss: 0.6691, test_loss: 1.5198, test_f1: 0.5394
 epoch: 37, train_loss: 0.6386, test_loss: 1.0416, test_f1: 0.6281
 epoch: 38, train_loss: 0.6301, test_loss: 1.0381, test_f1: 0.6035
 epoch: 39, train_loss: 0.6329, test_loss: 1.0547, test_f1: 0.6253
 epoch: 40, train_loss: 0.6449, test_loss: 1.0030, test_f1: 0.6369
 epoch: 41, train_loss: 0.6097, test_loss: 0.9829, test_f1: 0.6314
 epoch: 42, train_loss: 0.6118, test_loss: 1.1693, test_f1: 0.5799
 epoch: 43, train_loss: 0.6153, test_loss: 0.9554, test_f1: 0.6385
 epoch: 44, train_loss: 0.6134, test_loss: 1.3635, test_f1: 0.5602
 epoch: 45, train_loss: 0.6272, test_loss: 1.1573, test_f1: 0.6082
 epoch: 46, train_loss: 0.6337, test_loss: 1.1973, test_f1: 0.5683
 epoch: 47, train_loss: 0.5977, test_loss: 1.6085, test_f1: 0.5439
 epoch: 48, train_loss: 0.5985, test_loss: 1.1997, test_f1: 0.6312
 epoch: 49, train_loss: 0.6046, test_loss: 1.1983, test_f1: 0.5963
 epoch: 50, train_loss: 0.5616, test_loss: 1.2373, test_f1: 0.5706
 epoch: 51, train_loss: 0.5437, test_loss: 1.3433, test_f1: 0.5649
 epoch: 52, train_loss: 0.5498, test_loss: 1.1682, test_f1: 0.5744
 epoch: 53, train_loss: 0.5312, test_loss: 1.2759, test_f1: 0.5805
 epoch: 54, train_loss: 0.5582, test_loss: 1.4287, test_f1: 0.5643
 epoch: 55, train_loss: 0.5220, test_loss: 1.4767, test_f1: 0.5886
 epoch: 56, train_loss: 0.5377, test_loss: 1.3490, test_f1: 0.5584
 epoch: 57, train_loss: 0.5287, test_loss: 2.4144, test_f1: 0.5363
 epoch: 58, train_loss: 0.5083, test_loss: 1.6595, test_f1: 0.5484
 epoch: 59, train_loss: 0.5254, test_loss: 1.5888, test_f1: 0.6338
 epoch: 60, train_loss: 0.5025, test_loss: 1.8351, test_f1: 0.6144
 epoch: 61, train_loss: 0.4986, test_loss: 1.7839, test_f1: 0.5789
 epoch: 62, train_loss: 0.5029, test_loss: 1.8004, test_f1: 0.5414
 epoch: 63, train_loss: 0.4842, test_loss: 1.7446, test_f1: 0.5564
 epoch: 64, train_loss: 0.5018, test_loss: 1.8038, test_f1: 0.5873
 epoch: 65, train_loss: 0.5321, test_loss: 1.5181, test_f1: 0.6115
 epoch: 66, train_loss: 0.4856, test_loss: 2.0796, test_f1: 0.5757
 epoch: 67, train_loss: 0.4662, test_loss: 2.1314, test_f1: 0.5276
 epoch: 68, train_loss: 0.4854, test_loss: 1.3881, test_f1: 0.6099
 epoch: 69, train_loss: 0.5126, test_loss: 1.4032, test_f1: 0.5697
 epoch: 70, train_loss: 0.5013, test_loss: 1.8701, test_f1: 0.5617
 epoch: 71, train_loss: 0.4910, test_loss: 1.4887, test_f1: 0.6173
 epoch: 72, train_loss: 0.5060, test_loss: 1.8808, test_f1: 0.5362
 epoch: 73, train_loss: 0.4663, test_loss: 1.4111, test_f1: 0.5631
 epoch: 74, train_loss: 0.4671, test_loss: 1.9823, test_f1: 0.5220
 epoch: 75, train_loss: 0.4638, test_loss: 1.7920, test_f1: 0.5593
 epoch: 76, train_loss: 0.4639, test_loss: 1.8332, test_f1: 0.5572
 epoch: 77, train_loss: 0.4673, test_loss: 1.4813, test_f1: 0.6078
 epoch: 78, train_loss: 0.4438, test_loss: 1.6757, test_f1: 0.5618
 epoch: 79, train_loss: 0.4544, test_loss: 1.6687, test_f1: 0.5990
 epoch: 80, train_loss: 0.4717, test_loss: 1.9379, test_f1: 0.5501
 epoch: 81, train_loss: 0.4341, test_loss: 1.7802, test_f1: 0.5719
 epoch: 82, train_loss: 0.4536, test_loss: 1.5663, test_f1: 0.5692
 epoch: 83, train_loss: 0.4574, test_loss: 1.4223, test_f1: 0.5961
 epoch: 84, train_loss: 0.5242, test_loss: 2.3322, test_f1: 0.4838
 epoch: 85, train_loss: 0.5139, test_loss: 2.0470, test_f1: 0.5207
 epoch: 86, train_loss: 0.4673, test_loss: 1.6324, test_f1: 0.5380
 epoch: 87, train_loss: 0.4503, test_loss: 1.8533, test_f1: 0.5805
 epoch: 88, train_loss: 0.4725, test_loss: 2.3590, test_f1: 0.5577
 epoch: 89, train_loss: 0.4458, test_loss: 1.7033, test_f1: 0.5418
 epoch: 90, train_loss: 0.4193, test_loss: 2.1359, test_f1: 0.5560
 epoch: 91, train_loss: 0.4496, test_loss: 2.0944, test_f1: 0.5648
 epoch: 92, train_loss: 0.4237, test_loss: 2.2530, test_f1: 0.5292
 epoch: 93, train_loss: 0.4417, test_loss: 2.1700, test_f1: 0.5328
 epoch: 94, train_loss: 0.4472, test_loss: 1.7491, test_f1: 0.5073
 epoch: 95, train_loss: 0.4429, test_loss: 1.9985, test_f1: 0.5167
 epoch: 96, train_loss: 0.4133, test_loss: 1.5627, test_f1: 0.5816
 epoch: 97, train_loss: 0.4364, test_loss: 1.3038, test_f1: 0.6398
 epoch: 98, train_loss: 0.4203, test_loss: 1.9000, test_f1: 0.5462
 epoch: 99, train_loss: 0.4382, test_loss: 1.6050, test_f1: 0.5878
##################ITERATION #7 ****************************************
 epoch: 0, train_loss: 1.3187, test_loss: 1.6609, test_f1: 0.3370
 epoch: 1, train_loss: 1.0287, test_loss: 1.2914, test_f1: 0.3719
 epoch: 2, train_loss: 0.9371, test_loss: 1.3957, test_f1: 0.3480
 epoch: 3, train_loss: 0.9469, test_loss: 1.1063, test_f1: 0.5369
 epoch: 4, train_loss: 0.8800, test_loss: 1.0723, test_f1: 0.5009
 epoch: 5, train_loss: 0.8500, test_loss: 1.0925, test_f1: 0.5726
 epoch: 6, train_loss: 0.8148, test_loss: 1.1338, test_f1: 0.5386
 epoch: 7, train_loss: 0.8087, test_loss: 1.4536, test_f1: 0.5153
 epoch: 8, train_loss: 0.7839, test_loss: 0.9498, test_f1: 0.6009
 epoch: 9, train_loss: 0.7859, test_loss: 1.1121, test_f1: 0.6014
 epoch: 10, train_loss: 0.7729, test_loss: 1.1744, test_f1: 0.4460
 epoch: 11, train_loss: 0.7656, test_loss: 1.0038, test_f1: 0.5817
 epoch: 12, train_loss: 0.7382, test_loss: 1.0911, test_f1: 0.5541
 epoch: 13, train_loss: 0.7775, test_loss: 0.9809, test_f1: 0.5957
 epoch: 14, train_loss: 0.7473, test_loss: 1.4585, test_f1: 0.3462
 epoch: 15, train_loss: 0.7282, test_loss: 0.9707, test_f1: 0.5896
 epoch: 16, train_loss: 0.7807, test_loss: 1.3094, test_f1: 0.5335
 epoch: 17, train_loss: 0.7637, test_loss: 1.3930, test_f1: 0.4905
 epoch: 18, train_loss: 0.7156, test_loss: 1.1436, test_f1: 0.5666
 epoch: 19, train_loss: 0.7026, test_loss: 0.9576, test_f1: 0.5998
 epoch: 20, train_loss: 0.7202, test_loss: 1.0975, test_f1: 0.5529
 epoch: 21, train_loss: 0.7458, test_loss: 1.0865, test_f1: 0.5922
 epoch: 22, train_loss: 0.7142, test_loss: 1.1537, test_f1: 0.5572
 epoch: 23, train_loss: 0.7307, test_loss: 1.1899, test_f1: 0.5350
 epoch: 24, train_loss: 0.7038, test_loss: 1.1459, test_f1: 0.4955
 epoch: 25, train_loss: 0.6972, test_loss: 1.1363, test_f1: 0.5036
 epoch: 26, train_loss: 0.6884, test_loss: 1.0980, test_f1: 0.5672
 epoch: 27, train_loss: 0.7033, test_loss: 0.9697, test_f1: 0.6165
 epoch: 28, train_loss: 0.6951, test_loss: 1.3102, test_f1: 0.4954
 epoch: 29, train_loss: 0.6955, test_loss: 1.1870, test_f1: 0.5339
 epoch: 30, train_loss: 0.6743, test_loss: 1.1023, test_f1: 0.5666
 epoch: 31, train_loss: 0.6613, test_loss: 0.9560, test_f1: 0.6274
 epoch: 32, train_loss: 0.7183, test_loss: 1.2063, test_f1: 0.4503
 epoch: 33, train_loss: 0.6972, test_loss: 1.2075, test_f1: 0.5314
 epoch: 34, train_loss: 0.6854, test_loss: 1.1700, test_f1: 0.5928
 epoch: 35, train_loss: 0.6788, test_loss: 1.1151, test_f1: 0.5484
 epoch: 36, train_loss: 0.6989, test_loss: 1.2731, test_f1: 0.5521
 epoch: 37, train_loss: 0.6657, test_loss: 0.9683, test_f1: 0.5878
 epoch: 38, train_loss: 0.6414, test_loss: 1.3072, test_f1: 0.5293
 epoch: 39, train_loss: 0.6619, test_loss: 1.0895, test_f1: 0.5802
 epoch: 40, train_loss: 0.6580, test_loss: 1.0756, test_f1: 0.5507
 epoch: 41, train_loss: 0.6413, test_loss: 1.2181, test_f1: 0.5796
 epoch: 42, train_loss: 0.6175, test_loss: 1.2421, test_f1: 0.5909
 epoch: 43, train_loss: 0.6097, test_loss: 0.9989, test_f1: 0.5821
 epoch: 44, train_loss: 0.6033, test_loss: 1.2157, test_f1: 0.5664
 epoch: 45, train_loss: 0.6356, test_loss: 1.8840, test_f1: 0.5145
 epoch: 46, train_loss: 0.6183, test_loss: 1.0549, test_f1: 0.5871
 epoch: 47, train_loss: 0.6331, test_loss: 1.0478, test_f1: 0.5873
 epoch: 48, train_loss: 0.6439, test_loss: 1.2451, test_f1: 0.6105
 epoch: 49, train_loss: 0.6311, test_loss: 1.1549, test_f1: 0.5617
 epoch: 50, train_loss: 0.6125, test_loss: 1.3105, test_f1: 0.5486
 epoch: 51, train_loss: 0.5695, test_loss: 1.1390, test_f1: 0.5949
 epoch: 52, train_loss: 0.5459, test_loss: 1.1644, test_f1: 0.5956
 epoch: 53, train_loss: 0.5546, test_loss: 1.5454, test_f1: 0.5426
 epoch: 54, train_loss: 0.5295, test_loss: 1.1596, test_f1: 0.5955
 epoch: 55, train_loss: 0.5260, test_loss: 1.2197, test_f1: 0.5696
 epoch: 56, train_loss: 0.5266, test_loss: 1.2984, test_f1: 0.5533
 epoch: 57, train_loss: 0.5394, test_loss: 1.3573, test_f1: 0.5712
 epoch: 58, train_loss: 0.5568, test_loss: 1.5414, test_f1: 0.5536
 epoch: 59, train_loss: 0.5201, test_loss: 1.5692, test_f1: 0.5789
 epoch: 60, train_loss: 0.5256, test_loss: 1.3035, test_f1: 0.5995
 epoch: 61, train_loss: 0.5381, test_loss: 1.4479, test_f1: 0.6009
 epoch: 62, train_loss: 0.5532, test_loss: 1.3779, test_f1: 0.5548
 epoch: 63, train_loss: 0.4951, test_loss: 1.5714, test_f1: 0.5411
 epoch: 64, train_loss: 0.5218, test_loss: 1.5482, test_f1: 0.5146
 epoch: 65, train_loss: 0.5209, test_loss: 1.5593, test_f1: 0.5662
 epoch: 66, train_loss: 0.5162, test_loss: 2.2438, test_f1: 0.5070
 epoch: 67, train_loss: 0.5283, test_loss: 1.2553, test_f1: 0.5798
 epoch: 68, train_loss: 0.5526, test_loss: 1.2174, test_f1: 0.5835
 epoch: 69, train_loss: 0.5311, test_loss: 1.5802, test_f1: 0.5513
 epoch: 70, train_loss: 0.4983, test_loss: 1.3448, test_f1: 0.5698
 epoch: 71, train_loss: 0.4803, test_loss: 1.3733, test_f1: 0.6027
 epoch: 72, train_loss: 0.5114, test_loss: 1.8571, test_f1: 0.5569
 epoch: 73, train_loss: 0.5327, test_loss: 1.0357, test_f1: 0.5897
 epoch: 74, train_loss: 0.5314, test_loss: 1.2427, test_f1: 0.5731
 epoch: 75, train_loss: 0.5190, test_loss: 1.3120, test_f1: 0.5835
 epoch: 76, train_loss: 0.4880, test_loss: 1.6028, test_f1: 0.5489
 epoch: 77, train_loss: 0.4760, test_loss: 1.3451, test_f1: 0.5963
 epoch: 78, train_loss: 0.4774, test_loss: 1.5602, test_f1: 0.5822
 epoch: 79, train_loss: 0.4964, test_loss: 1.6025, test_f1: 0.5891
 epoch: 80, train_loss: 0.4897, test_loss: 1.8212, test_f1: 0.5452
 epoch: 81, train_loss: 0.4861, test_loss: 1.3388, test_f1: 0.6197
 epoch: 82, train_loss: 0.4773, test_loss: 1.2756, test_f1: 0.5885
 epoch: 83, train_loss: 0.4780, test_loss: 1.7918, test_f1: 0.5544
 epoch: 84, train_loss: 0.4934, test_loss: 1.4667, test_f1: 0.5939
 epoch: 85, train_loss: 0.4532, test_loss: 1.5326, test_f1: 0.5879
 epoch: 86, train_loss: 0.4576, test_loss: 1.3757, test_f1: 0.6019
 epoch: 87, train_loss: 0.5030, test_loss: 1.4390, test_f1: 0.5676
 epoch: 88, train_loss: 0.4925, test_loss: 1.3542, test_f1: 0.5957
 epoch: 89, train_loss: 0.4559, test_loss: 1.5043, test_f1: 0.5904
 epoch: 90, train_loss: 0.4883, test_loss: 1.5390, test_f1: 0.5811
 epoch: 91, train_loss: 0.5088, test_loss: 1.7841, test_f1: 0.5712
 epoch: 92, train_loss: 0.4623, test_loss: 1.8330, test_f1: 0.5842
 epoch: 93, train_loss: 0.4664, test_loss: 1.3940, test_f1: 0.6160
 epoch: 94, train_loss: 0.4372, test_loss: 1.2137, test_f1: 0.6283
 epoch: 95, train_loss: 0.4307, test_loss: 1.4914, test_f1: 0.6104
 epoch: 96, train_loss: 0.4202, test_loss: 1.8064, test_f1: 0.5853
 epoch: 97, train_loss: 0.4143, test_loss: 1.9882, test_f1: 0.5949
 epoch: 98, train_loss: 0.4255, test_loss: 1.7976, test_f1: 0.5856
 epoch: 99, train_loss: 0.4247, test_loss: 1.6131, test_f1: 0.6159
##################ITERATION #8 ****************************************
 epoch: 0, train_loss: 1.2758, test_loss: 1.4945, test_f1: 0.3408
 epoch: 1, train_loss: 0.9845, test_loss: 1.5270, test_f1: 0.3188
 epoch: 2, train_loss: 0.9146, test_loss: 1.2926, test_f1: 0.3980
 epoch: 3, train_loss: 0.8798, test_loss: 1.0913, test_f1: 0.4509
 epoch: 4, train_loss: 0.8387, test_loss: 0.9777, test_f1: 0.5945
 epoch: 5, train_loss: 0.8191, test_loss: 1.0217, test_f1: 0.5548
 epoch: 6, train_loss: 0.8093, test_loss: 1.7526, test_f1: 0.4176
 epoch: 7, train_loss: 0.7985, test_loss: 1.9850, test_f1: 0.3541
 epoch: 8, train_loss: 0.8201, test_loss: 1.1473, test_f1: 0.5100
 epoch: 9, train_loss: 0.7725, test_loss: 0.9956, test_f1: 0.5917
 epoch: 10, train_loss: 0.7808, test_loss: 1.0464, test_f1: 0.5624
 epoch: 11, train_loss: 0.7690, test_loss: 1.5754, test_f1: 0.4235
 epoch: 12, train_loss: 0.7739, test_loss: 1.0309, test_f1: 0.5626
 epoch: 13, train_loss: 0.7256, test_loss: 1.1921, test_f1: 0.5232
 epoch: 14, train_loss: 0.7057, test_loss: 1.0250, test_f1: 0.6202
 epoch: 15, train_loss: 0.6984, test_loss: 1.0634, test_f1: 0.5958
 epoch: 16, train_loss: 0.7216, test_loss: 1.0756, test_f1: 0.5858
 epoch: 17, train_loss: 0.7134, test_loss: 1.3049, test_f1: 0.4763
 epoch: 18, train_loss: 0.7298, test_loss: 1.2109, test_f1: 0.5014
 epoch: 19, train_loss: 0.7156, test_loss: 2.7545, test_f1: 0.4365
 epoch: 20, train_loss: 0.7342, test_loss: 1.0015, test_f1: 0.5341
 epoch: 21, train_loss: 0.6984, test_loss: 0.9920, test_f1: 0.6235
 epoch: 22, train_loss: 0.7207, test_loss: 1.0549, test_f1: 0.5310
 epoch: 23, train_loss: 0.7162, test_loss: 1.2505, test_f1: 0.5244
 epoch: 24, train_loss: 0.6778, test_loss: 1.2855, test_f1: 0.5602
 epoch: 25, train_loss: 0.6615, test_loss: 1.1554, test_f1: 0.6074
 epoch: 26, train_loss: 0.6503, test_loss: 1.1547, test_f1: 0.5558
 epoch: 27, train_loss: 0.6237, test_loss: 0.9728, test_f1: 0.6391
 epoch: 28, train_loss: 0.6618, test_loss: 1.3720, test_f1: 0.4292
 epoch: 29, train_loss: 0.6377, test_loss: 1.0925, test_f1: 0.5900
 epoch: 30, train_loss: 0.6036, test_loss: 1.2934, test_f1: 0.6425
 epoch: 31, train_loss: 0.6098, test_loss: 1.1674, test_f1: 0.5936
 epoch: 32, train_loss: 0.6098, test_loss: 1.4147, test_f1: 0.5444
 epoch: 33, train_loss: 0.6196, test_loss: 1.4565, test_f1: 0.5905
 epoch: 34, train_loss: 0.6082, test_loss: 1.3710, test_f1: 0.5452
 epoch: 35, train_loss: 0.6393, test_loss: 1.4698, test_f1: 0.5583
 epoch: 36, train_loss: 0.6225, test_loss: 1.3910, test_f1: 0.4899
 epoch: 37, train_loss: 0.6331, test_loss: 1.3663, test_f1: 0.5371
 epoch: 38, train_loss: 0.6076, test_loss: 1.4141, test_f1: 0.5568
 epoch: 39, train_loss: 0.5997, test_loss: 1.2179, test_f1: 0.5878
 epoch: 40, train_loss: 0.5869, test_loss: 1.6698, test_f1: 0.4239
 epoch: 41, train_loss: 0.5945, test_loss: 1.2141, test_f1: 0.5951
 epoch: 42, train_loss: 0.5699, test_loss: 1.3850, test_f1: 0.5422
 epoch: 43, train_loss: 0.5591, test_loss: 1.4936, test_f1: 0.5190
 epoch: 44, train_loss: 0.5454, test_loss: 1.4686, test_f1: 0.5880
 epoch: 45, train_loss: 0.5394, test_loss: 1.6835, test_f1: 0.5514
 epoch: 46, train_loss: 0.5503, test_loss: 2.2743, test_f1: 0.4330
 epoch: 47, train_loss: 0.5635, test_loss: 1.4017, test_f1: 0.5052
 epoch: 48, train_loss: 0.5372, test_loss: 2.0761, test_f1: 0.4364
 epoch: 49, train_loss: 0.5319, test_loss: 1.3826, test_f1: 0.5561
 epoch: 50, train_loss: 0.5638, test_loss: 3.0131, test_f1: 0.3916
 epoch: 51, train_loss: 0.5534, test_loss: 1.2247, test_f1: 0.5857
 epoch: 52, train_loss: 0.4868, test_loss: 1.3869, test_f1: 0.6032
 epoch: 53, train_loss: 0.4642, test_loss: 1.4316, test_f1: 0.5567
 epoch: 54, train_loss: 0.4565, test_loss: 1.4225, test_f1: 0.5866
 epoch: 55, train_loss: 0.4262, test_loss: 1.3445, test_f1: 0.6085
 epoch: 56, train_loss: 0.4474, test_loss: 1.2322, test_f1: 0.6224
 epoch: 57, train_loss: 0.4351, test_loss: 1.6428, test_f1: 0.5672
 epoch: 58, train_loss: 0.4230, test_loss: 1.4794, test_f1: 0.6349
 epoch: 59, train_loss: 0.4286, test_loss: 1.2782, test_f1: 0.5556
 epoch: 60, train_loss: 0.4376, test_loss: 1.6219, test_f1: 0.6078
 epoch: 61, train_loss: 0.4239, test_loss: 1.6315, test_f1: 0.5519
 epoch: 62, train_loss: 0.4095, test_loss: 1.6327, test_f1: 0.5978
 epoch: 63, train_loss: 0.4212, test_loss: 1.4229, test_f1: 0.6461
 epoch: 64, train_loss: 0.4652, test_loss: 1.4997, test_f1: 0.5439
 epoch: 65, train_loss: 0.4238, test_loss: 1.5468, test_f1: 0.6044
 epoch: 66, train_loss: 0.4063, test_loss: 1.6715, test_f1: 0.6520
 epoch: 67, train_loss: 0.3962, test_loss: 1.5076, test_f1: 0.6304
 epoch: 68, train_loss: 0.3969, test_loss: 1.9919, test_f1: 0.5710
 epoch: 69, train_loss: 0.3839, test_loss: 1.6986, test_f1: 0.6043
 epoch: 70, train_loss: 0.4008, test_loss: 1.4342, test_f1: 0.6214
 epoch: 71, train_loss: 0.3792, test_loss: 1.6628, test_f1: 0.6443
 epoch: 72, train_loss: 0.4059, test_loss: 1.8081, test_f1: 0.6079
 epoch: 73, train_loss: 0.4128, test_loss: 1.4103, test_f1: 0.6765
 epoch: 74, train_loss: 0.3855, test_loss: 1.7326, test_f1: 0.6283
 epoch: 75, train_loss: 0.3694, test_loss: 1.5839, test_f1: 0.6444
 epoch: 76, train_loss: 0.3778, test_loss: 1.9459, test_f1: 0.5267
 epoch: 77, train_loss: 0.3898, test_loss: 2.1539, test_f1: 0.6141
 epoch: 78, train_loss: 0.3988, test_loss: 1.4753, test_f1: 0.6256
 epoch: 79, train_loss: 0.4010, test_loss: 1.9239, test_f1: 0.5991
 epoch: 80, train_loss: 0.3971, test_loss: 1.6672, test_f1: 0.6330
 epoch: 81, train_loss: 0.3652, test_loss: 2.0127, test_f1: 0.6151
 epoch: 82, train_loss: 0.3620, test_loss: 1.6048, test_f1: 0.5860
 epoch: 83, train_loss: 0.3949, test_loss: 1.7005, test_f1: 0.5756
 epoch: 84, train_loss: 0.3725, test_loss: 1.8124, test_f1: 0.5890
 epoch: 85, train_loss: 0.3611, test_loss: 2.1539, test_f1: 0.5939
 epoch: 86, train_loss: 0.3538, test_loss: 1.7695, test_f1: 0.5711
 epoch: 87, train_loss: 0.3669, test_loss: 1.8400, test_f1: 0.5888
 epoch: 88, train_loss: 0.3535, test_loss: 1.9585, test_f1: 0.6008
 epoch: 89, train_loss: 0.3612, test_loss: 1.7717, test_f1: 0.6620
 epoch: 90, train_loss: 0.3438, test_loss: 2.2534, test_f1: 0.5382
 epoch: 91, train_loss: 0.3425, test_loss: 2.1483, test_f1: 0.6264
 epoch: 92, train_loss: 0.3497, test_loss: 1.6374, test_f1: 0.6520
 epoch: 93, train_loss: 0.3587, test_loss: 1.6840, test_f1: 0.6143
 epoch: 94, train_loss: 0.3308, test_loss: 2.3558, test_f1: 0.5783
 epoch: 95, train_loss: 0.3371, test_loss: 2.3876, test_f1: 0.5264
 epoch: 96, train_loss: 0.3574, test_loss: 1.6597, test_f1: 0.6121
 epoch: 97, train_loss: 0.3500, test_loss: 1.9236, test_f1: 0.5920
 epoch: 98, train_loss: 0.3000, test_loss: 2.2516, test_f1: 0.5947
 epoch: 99, train_loss: 0.3026, test_loss: 2.4761, test_f1: 0.5847
##################ITERATION #9 ****************************************
 epoch: 0, train_loss: 1.3619, test_loss: 1.4994, test_f1: 0.3336
 epoch: 1, train_loss: 1.0478, test_loss: 1.2021, test_f1: 0.3214
 epoch: 2, train_loss: 0.9872, test_loss: 1.2248, test_f1: 0.3664
 epoch: 3, train_loss: 0.9402, test_loss: 1.0683, test_f1: 0.5572
 epoch: 4, train_loss: 0.9008, test_loss: 0.9698, test_f1: 0.5568
 epoch: 5, train_loss: 0.8748, test_loss: 1.0481, test_f1: 0.5400
 epoch: 6, train_loss: 0.8930, test_loss: 0.9777, test_f1: 0.5380
 epoch: 7, train_loss: 0.8777, test_loss: 1.0518, test_f1: 0.5278
 epoch: 8, train_loss: 0.8589, test_loss: 0.9883, test_f1: 0.5533
 epoch: 9, train_loss: 0.8572, test_loss: 1.0088, test_f1: 0.5647
 epoch: 10, train_loss: 0.7909, test_loss: 1.0584, test_f1: 0.5500
 epoch: 11, train_loss: 0.7820, test_loss: 0.9929, test_f1: 0.5996
 epoch: 12, train_loss: 0.7548, test_loss: 1.0094, test_f1: 0.5884
 epoch: 13, train_loss: 0.7282, test_loss: 0.9682, test_f1: 0.5455
 epoch: 14, train_loss: 0.7530, test_loss: 1.1372, test_f1: 0.5933
 epoch: 15, train_loss: 0.7361, test_loss: 1.2159, test_f1: 0.5597
 epoch: 16, train_loss: 0.7414, test_loss: 1.0465, test_f1: 0.5822
 epoch: 17, train_loss: 0.7210, test_loss: 1.2226, test_f1: 0.5770
 epoch: 18, train_loss: 0.7594, test_loss: 1.3860, test_f1: 0.4305
 epoch: 19, train_loss: 0.7374, test_loss: 1.1268, test_f1: 0.6081
 epoch: 20, train_loss: 0.6979, test_loss: 0.9750, test_f1: 0.6052
 epoch: 21, train_loss: 0.6820, test_loss: 1.2123, test_f1: 0.5606
 epoch: 22, train_loss: 0.7092, test_loss: 1.1589, test_f1: 0.5838
 epoch: 23, train_loss: 0.6707, test_loss: 1.0672, test_f1: 0.6251
 epoch: 24, train_loss: 0.6874, test_loss: 1.1710, test_f1: 0.6448
 epoch: 25, train_loss: 0.6519, test_loss: 1.0008, test_f1: 0.5819
 epoch: 26, train_loss: 0.6767, test_loss: 1.0713, test_f1: 0.5872
 epoch: 27, train_loss: 0.6649, test_loss: 0.9711, test_f1: 0.6026
 epoch: 28, train_loss: 0.6452, test_loss: 0.8957, test_f1: 0.6218
 epoch: 29, train_loss: 0.6580, test_loss: 0.9286, test_f1: 0.6362
 epoch: 30, train_loss: 0.6366, test_loss: 1.4763, test_f1: 0.5798
 epoch: 31, train_loss: 0.6388, test_loss: 1.1574, test_f1: 0.5823
 epoch: 32, train_loss: 0.6418, test_loss: 1.4380, test_f1: 0.5617
 epoch: 33, train_loss: 0.6140, test_loss: 1.0498, test_f1: 0.6292
 epoch: 34, train_loss: 0.6944, test_loss: 1.0962, test_f1: 0.5609
 epoch: 35, train_loss: 0.6673, test_loss: 1.0086, test_f1: 0.5904
 epoch: 36, train_loss: 0.6295, test_loss: 1.2371, test_f1: 0.5827
 epoch: 37, train_loss: 0.6520, test_loss: 0.9563, test_f1: 0.5790
 epoch: 38, train_loss: 0.6341, test_loss: 1.1637, test_f1: 0.6142
 epoch: 39, train_loss: 0.6257, test_loss: 1.0726, test_f1: 0.6173
 epoch: 40, train_loss: 0.6450, test_loss: 1.2104, test_f1: 0.5549
 epoch: 41, train_loss: 0.5875, test_loss: 1.1238, test_f1: 0.5571
 epoch: 42, train_loss: 0.5856, test_loss: 1.3525, test_f1: 0.5498
 epoch: 43, train_loss: 0.5882, test_loss: 1.0784, test_f1: 0.5677
 epoch: 44, train_loss: 0.5706, test_loss: 1.1526, test_f1: 0.5845
 epoch: 45, train_loss: 0.5565, test_loss: 1.1744, test_f1: 0.6072
 epoch: 46, train_loss: 0.5564, test_loss: 1.0165, test_f1: 0.5939
 epoch: 47, train_loss: 0.5623, test_loss: 1.0755, test_f1: 0.5979
 epoch: 48, train_loss: 0.5519, test_loss: 1.2576, test_f1: 0.5892
 epoch: 49, train_loss: 0.5580, test_loss: 0.9664, test_f1: 0.6288
 epoch: 50, train_loss: 0.6191, test_loss: 1.1227, test_f1: 0.5297
 epoch: 51, train_loss: 0.5959, test_loss: 1.0217, test_f1: 0.6026
 epoch: 52, train_loss: 0.5486, test_loss: 1.0482, test_f1: 0.6294
 epoch: 53, train_loss: 0.5328, test_loss: 1.1751, test_f1: 0.6330
 epoch: 54, train_loss: 0.5229, test_loss: 1.0673, test_f1: 0.5931
 epoch: 55, train_loss: 0.4821, test_loss: 1.0753, test_f1: 0.5993
 epoch: 56, train_loss: 0.5248, test_loss: 1.0118, test_f1: 0.6541
 epoch: 57, train_loss: 0.4969, test_loss: 0.9867, test_f1: 0.6340
 epoch: 58, train_loss: 0.4852, test_loss: 1.1642, test_f1: 0.6063
 epoch: 59, train_loss: 0.5081, test_loss: 1.0573, test_f1: 0.6274
 epoch: 60, train_loss: 0.4797, test_loss: 1.1128, test_f1: 0.6262
 epoch: 61, train_loss: 0.4779, test_loss: 1.2165, test_f1: 0.6118
 epoch: 62, train_loss: 0.4844, test_loss: 1.2669, test_f1: 0.6135
 epoch: 63, train_loss: 0.4736, test_loss: 1.1731, test_f1: 0.6603
 epoch: 64, train_loss: 0.4738, test_loss: 1.3356, test_f1: 0.6394
 epoch: 65, train_loss: 0.4926, test_loss: 1.5028, test_f1: 0.6189
 epoch: 66, train_loss: 0.4636, test_loss: 1.1965, test_f1: 0.6633
 epoch: 67, train_loss: 0.4583, test_loss: 1.1716, test_f1: 0.6646
 epoch: 68, train_loss: 0.4486, test_loss: 1.3230, test_f1: 0.6356
 epoch: 69, train_loss: 0.4479, test_loss: 1.4992, test_f1: 0.6373
 epoch: 70, train_loss: 0.4250, test_loss: 1.4186, test_f1: 0.6479
 epoch: 71, train_loss: 0.4505, test_loss: 1.2461, test_f1: 0.6437
 epoch: 72, train_loss: 0.4494, test_loss: 1.3904, test_f1: 0.5948
 epoch: 73, train_loss: 0.4174, test_loss: 1.4464, test_f1: 0.6648
 epoch: 74, train_loss: 0.4270, test_loss: 1.2737, test_f1: 0.6362
 epoch: 75, train_loss: 0.4364, test_loss: 1.3544, test_f1: 0.6368
 epoch: 76, train_loss: 0.4659, test_loss: 1.2380, test_f1: 0.6040
 epoch: 77, train_loss: 0.4577, test_loss: 1.4021, test_f1: 0.6250
 epoch: 78, train_loss: 0.4520, test_loss: 1.3497, test_f1: 0.6364
 epoch: 79, train_loss: 0.4756, test_loss: 1.3867, test_f1: 0.5994
 epoch: 80, train_loss: 0.4444, test_loss: 1.3260, test_f1: 0.6146
 epoch: 81, train_loss: 0.4189, test_loss: 1.1948, test_f1: 0.6581
 epoch: 82, train_loss: 0.4178, test_loss: 1.3884, test_f1: 0.6207
 epoch: 83, train_loss: 0.4188, test_loss: 1.4197, test_f1: 0.6360
 epoch: 84, train_loss: 0.4336, test_loss: 1.3753, test_f1: 0.6331
 epoch: 85, train_loss: 0.4177, test_loss: 1.3803, test_f1: 0.6245
 epoch: 86, train_loss: 0.3717, test_loss: 1.5211, test_f1: 0.6086
 epoch: 87, train_loss: 0.3705, test_loss: 1.4180, test_f1: 0.6037
 epoch: 88, train_loss: 0.4065, test_loss: 1.4328, test_f1: 0.6382
 epoch: 89, train_loss: 0.3793, test_loss: 1.4750, test_f1: 0.6485
 epoch: 90, train_loss: 0.4079, test_loss: 1.3932, test_f1: 0.6320
 epoch: 91, train_loss: 0.3969, test_loss: 1.4661, test_f1: 0.6397
 epoch: 92, train_loss: 0.3965, test_loss: 1.6616, test_f1: 0.6167
 epoch: 93, train_loss: 0.4021, test_loss: 1.3569, test_f1: 0.6385
 epoch: 94, train_loss: 0.4050, test_loss: 1.6280, test_f1: 0.5935
 epoch: 95, train_loss: 0.4131, test_loss: 1.2251, test_f1: 0.6223
 epoch: 96, train_loss: 0.4056, test_loss: 1.2402, test_f1: 0.6176
 epoch: 97, train_loss: 0.3815, test_loss: 1.7513, test_f1: 0.6182
 epoch: 98, train_loss: 0.3677, test_loss: 1.7944, test_f1: 0.6259
 epoch: 99, train_loss: 0.3633, test_loss: 1.2572, test_f1: 0.6743

Training completed in 335.80 seconds
Best F1: 0.6924 at epoch 71
Mean F1 across iterations: 0.6683  0.0191
========================FINAL RESULTS================================
FEGIN weighted F1: 0.6924  0.0191
python main.py --data ltspice_demos --representation component_pin --model FEGIN --layers 3 --hiddens 32 --batch_size 128 --lr 0.01 --emb_size 128 --epochs 100 --save_appendix component_pin_L3_H32_BS128_LR0.01_E128 --no_val
-----



STDERR:
  File "main.py", line 370, in <module>
    main()
  File "main.py", line 254, in main
    dataset = dataset_class(
  File "/home/philip/projects/ltspice_examples_code_repo/Circuit-Completion-Using-GNNs/component_classification_with_link_prediction_head/evaluation/FEGIN/kernel/circuit_datasets.py", line 15, in __init__
    self.data, self.slices = torch.load(self.processed_paths[0])
  File "/home/philip/.local/lib/python3.8/site-packages/torch/serialization.py", line 1040, in load
    warnings.warn(
  File "/usr/lib/python3.8/warnings.py", line 109, in _showwarnmsg
    sw(msg.message, msg.category, msg.filename, msg.lineno,
  File "main.py", line 47, in warn_with_traceback
    traceback.print_stack(file=log)
/home/philip/projects/ltspice_examples_code_repo/Circuit-Completion-Using-GNNs/component_classification_with_link_prediction_head/evaluation/FEGIN/kernel/circuit_datasets.py:15: FutureWarning: You are using `torch.load` with `weights_only=False` (the current default value), which uses the default pickle module implicitly. It is possible to construct malicious pickle data which will execute arbitrary code during unpickling (See https://github.com/pytorch/pytorch/blob/main/SECURITY.md#untrusted-models for more details). In a future release, the default value for `weights_only` will be flipped to `True`. This limits the functions that could be executed during unpickling. Arbitrary objects will no longer be allowed to be loaded via this mode unless they are explicitly allowlisted by the user via `torch.serialization.add_safe_globals`. We recommend you start setting `weights_only=True` for any use case where you don't have full control of the loaded file. Please open an issue on GitHub for any issues related to this experimental feature.
  self.data, self.slices = torch.load(self.processed_paths[0])
