STDOUT:
Results will be saved in /home/philip/projects/ltspice_examples_code_repo/Circuit-Completion-Using-GNNs/component_classification_with_link_prediction_head/evaluation/FEGIN/results/model_FEGIN_dataset_ltspice_examples
Command line input: python main.py --data ltspice_examples --representation component_component --model FEGIN --layers 4 --hiddens 64 --batch_size 32 --lr 0.001 --emb_size 128 --epochs 100 --save_appendix component_component_L4_H64_BS32_LR0.001_E128 --no_val
 is saved.
-----
ltspice_examples - FEGIN
Using 4 layers, 64 hidden units, h = 2
Loading component_component representation dataset
ENTERED
Training FEGIN on component_component representation
Train: 3556, Test: 845
##################ITERATION #0 ****************************************
 epoch: 0, train_loss: 1.2609, test_loss: 1.1766, test_f1: 0.3419
 epoch: 1, train_loss: 1.1712, test_loss: 1.0685, test_f1: 0.4408
 epoch: 2, train_loss: 1.1083, test_loss: 1.0152, test_f1: 0.5020
 epoch: 3, train_loss: 1.0598, test_loss: 1.0083, test_f1: 0.4534
 epoch: 4, train_loss: 1.0421, test_loss: 1.0049, test_f1: 0.4611
 epoch: 5, train_loss: 1.0240, test_loss: 1.0107, test_f1: 0.4753
 epoch: 6, train_loss: 0.9788, test_loss: 0.9495, test_f1: 0.4775
 epoch: 7, train_loss: 0.9812, test_loss: 0.9684, test_f1: 0.4887
 epoch: 8, train_loss: 0.9654, test_loss: 0.9739, test_f1: 0.5022
 epoch: 9, train_loss: 0.9329, test_loss: 0.9999, test_f1: 0.5156
 epoch: 10, train_loss: 0.9381, test_loss: 0.9808, test_f1: 0.5128
 epoch: 11, train_loss: 0.9277, test_loss: 0.9697, test_f1: 0.5291
 epoch: 12, train_loss: 0.9186, test_loss: 0.9673, test_f1: 0.5073
 epoch: 13, train_loss: 0.8981, test_loss: 0.9995, test_f1: 0.4942
 epoch: 14, train_loss: 0.8941, test_loss: 0.9780, test_f1: 0.5025
 epoch: 15, train_loss: 0.8743, test_loss: 1.0620, test_f1: 0.5341
 epoch: 16, train_loss: 0.8737, test_loss: 0.9947, test_f1: 0.5518
 epoch: 17, train_loss: 0.8514, test_loss: 0.9822, test_f1: 0.5482
 epoch: 18, train_loss: 0.8489, test_loss: 0.9390, test_f1: 0.5426
 epoch: 19, train_loss: 0.8451, test_loss: 1.0220, test_f1: 0.5377
 epoch: 20, train_loss: 0.8543, test_loss: 1.0639, test_f1: 0.5436
 epoch: 21, train_loss: 0.8597, test_loss: 1.0107, test_f1: 0.5224
 epoch: 22, train_loss: 0.8346, test_loss: 1.0546, test_f1: 0.5598
 epoch: 23, train_loss: 0.8293, test_loss: 1.0763, test_f1: 0.5495
 epoch: 24, train_loss: 0.8192, test_loss: 1.1311, test_f1: 0.5272
 epoch: 25, train_loss: 0.8089, test_loss: 1.0412, test_f1: 0.5408
 epoch: 26, train_loss: 0.8017, test_loss: 1.0375, test_f1: 0.5207
 epoch: 27, train_loss: 0.7997, test_loss: 1.0976, test_f1: 0.5457
 epoch: 28, train_loss: 0.7849, test_loss: 1.1172, test_f1: 0.5078
 epoch: 29, train_loss: 0.7816, test_loss: 1.1274, test_f1: 0.4893
 epoch: 30, train_loss: 0.7784, test_loss: 1.1042, test_f1: 0.5705
 epoch: 31, train_loss: 0.7641, test_loss: 1.0982, test_f1: 0.5493
 epoch: 32, train_loss: 0.7729, test_loss: 1.0810, test_f1: 0.5406
 epoch: 33, train_loss: 0.7508, test_loss: 1.2617, test_f1: 0.5271
 epoch: 34, train_loss: 0.8729, test_loss: 1.0964, test_f1: 0.5373
 epoch: 35, train_loss: 0.8063, test_loss: 1.1563, test_f1: 0.5270
 epoch: 36, train_loss: 0.7895, test_loss: 1.0630, test_f1: 0.5552
 epoch: 37, train_loss: 0.7661, test_loss: 1.1880, test_f1: 0.5194
 epoch: 38, train_loss: 0.7614, test_loss: 1.1623, test_f1: 0.5481
 epoch: 39, train_loss: 0.7389, test_loss: 1.1470, test_f1: 0.5390
 epoch: 40, train_loss: 0.7508, test_loss: 1.1289, test_f1: 0.5588
 epoch: 41, train_loss: 0.7462, test_loss: 1.1225, test_f1: 0.5546
 epoch: 42, train_loss: 0.7310, test_loss: 1.1445, test_f1: 0.5570
 epoch: 43, train_loss: 0.7141, test_loss: 1.2208, test_f1: 0.5183
 epoch: 44, train_loss: 0.7474, test_loss: 1.1485, test_f1: 0.5305
 epoch: 45, train_loss: 0.6969, test_loss: 1.1974, test_f1: 0.5475
 epoch: 46, train_loss: 0.7076, test_loss: 1.1770, test_f1: 0.5564
 epoch: 47, train_loss: 0.7005, test_loss: 1.2350, test_f1: 0.5707
 epoch: 48, train_loss: 0.7324, test_loss: 1.1820, test_f1: 0.5770
 epoch: 49, train_loss: 0.7011, test_loss: 1.2079, test_f1: 0.5330
 epoch: 50, train_loss: 0.7085, test_loss: 1.1967, test_f1: 0.5505
 epoch: 51, train_loss: 0.6722, test_loss: 1.1711, test_f1: 0.5624
 epoch: 52, train_loss: 0.6435, test_loss: 1.1626, test_f1: 0.5762
 epoch: 53, train_loss: 0.6419, test_loss: 1.2064, test_f1: 0.5491
 epoch: 54, train_loss: 0.6363, test_loss: 1.2062, test_f1: 0.5677
 epoch: 55, train_loss: 0.6270, test_loss: 1.2832, test_f1: 0.5766
 epoch: 56, train_loss: 0.6151, test_loss: 1.2412, test_f1: 0.5744
 epoch: 57, train_loss: 0.6254, test_loss: 1.2286, test_f1: 0.5571
 epoch: 58, train_loss: 0.6133, test_loss: 1.2074, test_f1: 0.5860
 epoch: 59, train_loss: 0.5956, test_loss: 1.2696, test_f1: 0.5797
 epoch: 60, train_loss: 0.5996, test_loss: 1.2981, test_f1: 0.5904
 epoch: 61, train_loss: 0.6217, test_loss: 1.2422, test_f1: 0.5602
 epoch: 62, train_loss: 0.6059, test_loss: 1.2607, test_f1: 0.5682
 epoch: 63, train_loss: 0.6207, test_loss: 1.1917, test_f1: 0.5830
 epoch: 64, train_loss: 0.5927, test_loss: 1.2388, test_f1: 0.5884
 epoch: 65, train_loss: 0.5841, test_loss: 1.2850, test_f1: 0.5675
 epoch: 66, train_loss: 0.5836, test_loss: 1.5019, test_f1: 0.5130
 epoch: 67, train_loss: 0.5970, test_loss: 1.2944, test_f1: 0.5487
 epoch: 68, train_loss: 0.5903, test_loss: 1.2328, test_f1: 0.5857
 epoch: 69, train_loss: 0.6038, test_loss: 1.2786, test_f1: 0.5731
 epoch: 70, train_loss: 0.5996, test_loss: 1.2535, test_f1: 0.5827
 epoch: 71, train_loss: 0.5885, test_loss: 1.2730, test_f1: 0.5737
 epoch: 72, train_loss: 0.5739, test_loss: 1.2499, test_f1: 0.5757
 epoch: 73, train_loss: 0.5576, test_loss: 1.2773, test_f1: 0.5862
 epoch: 74, train_loss: 0.5565, test_loss: 1.2315, test_f1: 0.5754
 epoch: 75, train_loss: 0.5650, test_loss: 1.3568, test_f1: 0.5642
 epoch: 76, train_loss: 0.5583, test_loss: 1.3933, test_f1: 0.5169
 epoch: 77, train_loss: 0.5650, test_loss: 1.3420, test_f1: 0.5587
 epoch: 78, train_loss: 0.5738, test_loss: 1.2806, test_f1: 0.5636
 epoch: 79, train_loss: 0.5525, test_loss: 1.3218, test_f1: 0.5576
 epoch: 80, train_loss: 0.5488, test_loss: 1.3410, test_f1: 0.5832
 epoch: 81, train_loss: 0.5443, test_loss: 1.3428, test_f1: 0.5935
 epoch: 82, train_loss: 0.5512, test_loss: 1.3619, test_f1: 0.5447
 epoch: 83, train_loss: 0.5482, test_loss: 1.3351, test_f1: 0.5804
 epoch: 84, train_loss: 0.5357, test_loss: 1.2621, test_f1: 0.5804
 epoch: 85, train_loss: 0.5468, test_loss: 1.3166, test_f1: 0.5589
 epoch: 86, train_loss: 0.5359, test_loss: 1.3375, test_f1: 0.5424
 epoch: 87, train_loss: 0.5390, test_loss: 1.3638, test_f1: 0.5504
 epoch: 88, train_loss: 0.5182, test_loss: 1.3278, test_f1: 0.5837
 epoch: 89, train_loss: 0.5274, test_loss: 1.3085, test_f1: 0.5878
 epoch: 90, train_loss: 0.5280, test_loss: 1.3311, test_f1: 0.5744
 epoch: 91, train_loss: 0.5243, test_loss: 1.4556, test_f1: 0.5288
 epoch: 92, train_loss: 0.5204, test_loss: 1.3646, test_f1: 0.5756
 epoch: 93, train_loss: 0.5114, test_loss: 1.4114, test_f1: 0.5897
 epoch: 94, train_loss: 0.5105, test_loss: 1.3525, test_f1: 0.5781
 epoch: 95, train_loss: 0.5166, test_loss: 1.4199, test_f1: 0.5614
 epoch: 96, train_loss: 0.5129, test_loss: 1.4100, test_f1: 0.5557
 epoch: 97, train_loss: 0.5121, test_loss: 1.4201, test_f1: 0.5736
 epoch: 98, train_loss: 0.5029, test_loss: 1.3688, test_f1: 0.5857
 epoch: 99, train_loss: 0.4921, test_loss: 1.4468, test_f1: 0.5878
##################ITERATION #1 ****************************************
 epoch: 0, train_loss: 1.2612, test_loss: 1.1936, test_f1: 0.4047
 epoch: 1, train_loss: 1.1525, test_loss: 1.0617, test_f1: 0.4654
 epoch: 2, train_loss: 1.1095, test_loss: 1.0010, test_f1: 0.4602
 epoch: 3, train_loss: 1.0533, test_loss: 0.9876, test_f1: 0.4633
 epoch: 4, train_loss: 1.0284, test_loss: 0.9238, test_f1: 0.4933
 epoch: 5, train_loss: 1.0112, test_loss: 0.9508, test_f1: 0.4797
 epoch: 6, train_loss: 0.9940, test_loss: 0.9255, test_f1: 0.4996
 epoch: 7, train_loss: 0.9807, test_loss: 0.9539, test_f1: 0.4751
 epoch: 8, train_loss: 0.9942, test_loss: 0.9070, test_f1: 0.4961
 epoch: 9, train_loss: 0.9762, test_loss: 0.9963, test_f1: 0.4403
 epoch: 10, train_loss: 0.9651, test_loss: 0.9585, test_f1: 0.4914
 epoch: 11, train_loss: 0.9214, test_loss: 0.9384, test_f1: 0.5067
 epoch: 12, train_loss: 0.9332, test_loss: 0.9331, test_f1: 0.5252
 epoch: 13, train_loss: 0.9181, test_loss: 0.9868, test_f1: 0.4910
 epoch: 14, train_loss: 0.8866, test_loss: 0.9795, test_f1: 0.5076
 epoch: 15, train_loss: 0.8914, test_loss: 0.9788, test_f1: 0.5187
 epoch: 16, train_loss: 0.8841, test_loss: 0.9992, test_f1: 0.5517
 epoch: 17, train_loss: 0.8731, test_loss: 1.0331, test_f1: 0.5222
 epoch: 18, train_loss: 0.8773, test_loss: 0.9680, test_f1: 0.5452
 epoch: 19, train_loss: 0.8724, test_loss: 1.1936, test_f1: 0.4952
 epoch: 20, train_loss: 0.8691, test_loss: 1.0563, test_f1: 0.5165
 epoch: 21, train_loss: 0.8581, test_loss: 0.9847, test_f1: 0.5114
 epoch: 22, train_loss: 0.8438, test_loss: 1.0057, test_f1: 0.5254
 epoch: 23, train_loss: 0.8374, test_loss: 1.0092, test_f1: 0.5458
 epoch: 24, train_loss: 0.8350, test_loss: 0.9949, test_f1: 0.5362
 epoch: 25, train_loss: 0.8474, test_loss: 0.9720, test_f1: 0.5693
 epoch: 26, train_loss: 0.8244, test_loss: 0.9703, test_f1: 0.5608
 epoch: 27, train_loss: 0.8027, test_loss: 0.9851, test_f1: 0.5403
 epoch: 28, train_loss: 0.7977, test_loss: 1.0644, test_f1: 0.5501
 epoch: 29, train_loss: 0.8035, test_loss: 0.9598, test_f1: 0.5472
 epoch: 30, train_loss: 0.7905, test_loss: 1.0164, test_f1: 0.5460
 epoch: 31, train_loss: 0.8223, test_loss: 0.9775, test_f1: 0.5450
 epoch: 32, train_loss: 0.7933, test_loss: 0.9954, test_f1: 0.5383
 epoch: 33, train_loss: 0.8048, test_loss: 1.0121, test_f1: 0.5510
 epoch: 34, train_loss: 0.7916, test_loss: 1.0593, test_f1: 0.5679
 epoch: 35, train_loss: 0.7792, test_loss: 1.0797, test_f1: 0.5291
 epoch: 36, train_loss: 0.7680, test_loss: 1.0695, test_f1: 0.5561
 epoch: 37, train_loss: 0.7596, test_loss: 1.0175, test_f1: 0.5546
 epoch: 38, train_loss: 0.7637, test_loss: 1.0887, test_f1: 0.5472
 epoch: 39, train_loss: 0.7579, test_loss: 1.1499, test_f1: 0.5162
 epoch: 40, train_loss: 0.7495, test_loss: 1.0628, test_f1: 0.5568
 epoch: 41, train_loss: 0.7466, test_loss: 1.0209, test_f1: 0.5598
 epoch: 42, train_loss: 0.7316, test_loss: 1.1110, test_f1: 0.5556
 epoch: 43, train_loss: 0.7619, test_loss: 1.1082, test_f1: 0.5266
 epoch: 44, train_loss: 0.7521, test_loss: 1.1061, test_f1: 0.5451
 epoch: 45, train_loss: 0.7384, test_loss: 1.1518, test_f1: 0.5474
 epoch: 46, train_loss: 0.7195, test_loss: 1.1072, test_f1: 0.5773
 epoch: 47, train_loss: 0.7327, test_loss: 1.0764, test_f1: 0.5619
 epoch: 48, train_loss: 0.6887, test_loss: 1.1050, test_f1: 0.5496
 epoch: 49, train_loss: 0.6933, test_loss: 1.1765, test_f1: 0.5356
 epoch: 50, train_loss: 0.6916, test_loss: 1.0773, test_f1: 0.5533
 epoch: 51, train_loss: 0.6484, test_loss: 1.1961, test_f1: 0.5603
 epoch: 52, train_loss: 0.6553, test_loss: 1.1615, test_f1: 0.5672
 epoch: 53, train_loss: 0.6400, test_loss: 1.1506, test_f1: 0.5590
 epoch: 54, train_loss: 0.6468, test_loss: 1.1671, test_f1: 0.5562
 epoch: 55, train_loss: 0.6384, test_loss: 1.1552, test_f1: 0.5615
 epoch: 56, train_loss: 0.6453, test_loss: 1.2808, test_f1: 0.5202
 epoch: 57, train_loss: 0.6104, test_loss: 1.1509, test_f1: 0.5632
 epoch: 58, train_loss: 0.6167, test_loss: 1.1361, test_f1: 0.5479
 epoch: 59, train_loss: 0.6354, test_loss: 1.1533, test_f1: 0.5332
 epoch: 60, train_loss: 0.6149, test_loss: 1.1770, test_f1: 0.5570
 epoch: 61, train_loss: 0.6182, test_loss: 1.2193, test_f1: 0.5517
 epoch: 62, train_loss: 0.5957, test_loss: 1.2444, test_f1: 0.5499
 epoch: 63, train_loss: 0.6016, test_loss: 1.2391, test_f1: 0.5427
 epoch: 64, train_loss: 0.5964, test_loss: 1.2064, test_f1: 0.5567
 epoch: 65, train_loss: 0.5871, test_loss: 1.2589, test_f1: 0.5650
 epoch: 66, train_loss: 0.5931, test_loss: 1.3166, test_f1: 0.5577
 epoch: 67, train_loss: 0.5918, test_loss: 1.1982, test_f1: 0.5382
 epoch: 68, train_loss: 0.5825, test_loss: 1.2306, test_f1: 0.5406
 epoch: 69, train_loss: 0.5847, test_loss: 1.1795, test_f1: 0.5605
 epoch: 70, train_loss: 0.5791, test_loss: 1.2002, test_f1: 0.5579
 epoch: 71, train_loss: 0.5845, test_loss: 1.2399, test_f1: 0.5541
 epoch: 72, train_loss: 0.5707, test_loss: 1.2624, test_f1: 0.5394
 epoch: 73, train_loss: 0.5633, test_loss: 1.2651, test_f1: 0.5577
 epoch: 74, train_loss: 0.5771, test_loss: 1.2389, test_f1: 0.5588
 epoch: 75, train_loss: 0.5746, test_loss: 1.2083, test_f1: 0.5458
 epoch: 76, train_loss: 0.5685, test_loss: 1.2076, test_f1: 0.5547
 epoch: 77, train_loss: 0.5553, test_loss: 1.3133, test_f1: 0.5608
 epoch: 78, train_loss: 0.5651, test_loss: 1.3230, test_f1: 0.5590
 epoch: 79, train_loss: 0.5444, test_loss: 1.3262, test_f1: 0.5337
 epoch: 80, train_loss: 0.5543, test_loss: 1.3121, test_f1: 0.5474
 epoch: 81, train_loss: 0.5440, test_loss: 1.4035, test_f1: 0.5474
 epoch: 82, train_loss: 0.5360, test_loss: 1.3846, test_f1: 0.5454
 epoch: 83, train_loss: 0.5375, test_loss: 1.3031, test_f1: 0.5604
 epoch: 84, train_loss: 0.5414, test_loss: 1.3007, test_f1: 0.5544
 epoch: 85, train_loss: 0.5456, test_loss: 1.2775, test_f1: 0.5736
 epoch: 86, train_loss: 0.5356, test_loss: 1.3356, test_f1: 0.5596
 epoch: 87, train_loss: 0.5352, test_loss: 1.2616, test_f1: 0.5737
 epoch: 88, train_loss: 0.5555, test_loss: 1.2981, test_f1: 0.5648
 epoch: 89, train_loss: 0.5439, test_loss: 1.2468, test_f1: 0.5541
 epoch: 90, train_loss: 0.5611, test_loss: 1.5011, test_f1: 0.5403
 epoch: 91, train_loss: 0.5169, test_loss: 1.3361, test_f1: 0.5631
 epoch: 92, train_loss: 0.5211, test_loss: 1.3958, test_f1: 0.5576
 epoch: 93, train_loss: 0.5032, test_loss: 1.3022, test_f1: 0.5750
 epoch: 94, train_loss: 0.5064, test_loss: 1.4294, test_f1: 0.5431
 epoch: 95, train_loss: 0.5151, test_loss: 1.3253, test_f1: 0.5921
 epoch: 96, train_loss: 0.4941, test_loss: 1.3857, test_f1: 0.5665
 epoch: 97, train_loss: 0.5097, test_loss: 1.4047, test_f1: 0.5391
 epoch: 98, train_loss: 0.4934, test_loss: 1.6275, test_f1: 0.5246
 epoch: 99, train_loss: 0.5355, test_loss: 1.4301, test_f1: 0.5784
##################ITERATION #2 ****************************************
 epoch: 0, train_loss: 1.2565, test_loss: 1.1386, test_f1: 0.4160
 epoch: 1, train_loss: 1.1375, test_loss: 1.0259, test_f1: 0.4558
 epoch: 2, train_loss: 1.0796, test_loss: 1.0280, test_f1: 0.4313
 epoch: 3, train_loss: 1.0495, test_loss: 0.9738, test_f1: 0.4729
 epoch: 4, train_loss: 1.0330, test_loss: 0.9758, test_f1: 0.4542
 epoch: 5, train_loss: 1.0037, test_loss: 0.9338, test_f1: 0.4890
 epoch: 6, train_loss: 0.9794, test_loss: 0.9194, test_f1: 0.4921
 epoch: 7, train_loss: 0.9855, test_loss: 0.9402, test_f1: 0.4691
 epoch: 8, train_loss: 0.9545, test_loss: 0.9442, test_f1: 0.5086
 epoch: 9, train_loss: 0.9371, test_loss: 0.9785, test_f1: 0.5120
 epoch: 10, train_loss: 0.9328, test_loss: 1.0778, test_f1: 0.4744
 epoch: 11, train_loss: 0.9177, test_loss: 0.9598, test_f1: 0.4860
 epoch: 12, train_loss: 0.9228, test_loss: 0.9252, test_f1: 0.4974
 epoch: 13, train_loss: 0.8933, test_loss: 0.9447, test_f1: 0.5172
 epoch: 14, train_loss: 0.8945, test_loss: 0.8985, test_f1: 0.5114
 epoch: 15, train_loss: 0.8958, test_loss: 0.9005, test_f1: 0.5216
 epoch: 16, train_loss: 0.8919, test_loss: 0.9801, test_f1: 0.5159
 epoch: 17, train_loss: 0.8992, test_loss: 0.8738, test_f1: 0.5774
 epoch: 18, train_loss: 0.8785, test_loss: 0.9704, test_f1: 0.4816
 epoch: 19, train_loss: 0.8628, test_loss: 0.9401, test_f1: 0.5401
 epoch: 20, train_loss: 0.8415, test_loss: 1.0742, test_f1: 0.4679
 epoch: 21, train_loss: 0.8433, test_loss: 0.9726, test_f1: 0.5546
 epoch: 22, train_loss: 0.8328, test_loss: 0.9427, test_f1: 0.5178
 epoch: 23, train_loss: 0.8385, test_loss: 0.9426, test_f1: 0.5383
 epoch: 24, train_loss: 0.8566, test_loss: 1.0345, test_f1: 0.5305
 epoch: 25, train_loss: 0.8238, test_loss: 1.0582, test_f1: 0.5092
 epoch: 26, train_loss: 0.8091, test_loss: 1.0982, test_f1: 0.5054
 epoch: 27, train_loss: 0.7914, test_loss: 1.0006, test_f1: 0.5570
 epoch: 28, train_loss: 0.7921, test_loss: 1.0501, test_f1: 0.5345
 epoch: 29, train_loss: 0.7821, test_loss: 1.0388, test_f1: 0.5409
 epoch: 30, train_loss: 0.7771, test_loss: 1.1007, test_f1: 0.5553
 epoch: 31, train_loss: 0.7903, test_loss: 1.0201, test_f1: 0.5429
 epoch: 32, train_loss: 0.7669, test_loss: 1.0725, test_f1: 0.5302
 epoch: 33, train_loss: 0.8058, test_loss: 1.0762, test_f1: 0.5219
 epoch: 34, train_loss: 0.7807, test_loss: 1.0923, test_f1: 0.5331
 epoch: 35, train_loss: 0.7846, test_loss: 1.0714, test_f1: 0.5351
 epoch: 36, train_loss: 0.7645, test_loss: 1.0376, test_f1: 0.5551
 epoch: 37, train_loss: 0.7527, test_loss: 1.0597, test_f1: 0.5234
 epoch: 38, train_loss: 0.7362, test_loss: 1.0091, test_f1: 0.5634
 epoch: 39, train_loss: 0.7509, test_loss: 1.0619, test_f1: 0.5243
 epoch: 40, train_loss: 0.7543, test_loss: 0.9854, test_f1: 0.5580
 epoch: 41, train_loss: 0.7371, test_loss: 1.0260, test_f1: 0.5531
 epoch: 42, train_loss: 0.7337, test_loss: 1.1216, test_f1: 0.5295
 epoch: 43, train_loss: 0.7345, test_loss: 1.0889, test_f1: 0.5417
 epoch: 44, train_loss: 0.7044, test_loss: 1.0894, test_f1: 0.5200
 epoch: 45, train_loss: 0.7251, test_loss: 1.1175, test_f1: 0.5238
 epoch: 46, train_loss: 0.7254, test_loss: 1.0519, test_f1: 0.5297
 epoch: 47, train_loss: 0.7431, test_loss: 1.0599, test_f1: 0.5429
 epoch: 48, train_loss: 0.7028, test_loss: 1.0808, test_f1: 0.5360
 epoch: 49, train_loss: 0.7005, test_loss: 1.1026, test_f1: 0.5115
 epoch: 50, train_loss: 0.6905, test_loss: 1.0987, test_f1: 0.5311
 epoch: 51, train_loss: 0.6660, test_loss: 1.0445, test_f1: 0.5500
 epoch: 52, train_loss: 0.6593, test_loss: 1.0194, test_f1: 0.5522
 epoch: 53, train_loss: 0.6430, test_loss: 1.0942, test_f1: 0.5363
 epoch: 54, train_loss: 0.6396, test_loss: 1.1387, test_f1: 0.5293
 epoch: 55, train_loss: 0.6436, test_loss: 1.1216, test_f1: 0.5457
 epoch: 56, train_loss: 0.6407, test_loss: 1.0381, test_f1: 0.5535
 epoch: 57, train_loss: 0.6192, test_loss: 1.0963, test_f1: 0.5416
 epoch: 58, train_loss: 0.6357, test_loss: 1.1328, test_f1: 0.5566
 epoch: 59, train_loss: 0.6267, test_loss: 1.1394, test_f1: 0.5443
 epoch: 60, train_loss: 0.6329, test_loss: 1.0436, test_f1: 0.5665
 epoch: 61, train_loss: 0.6141, test_loss: 1.0818, test_f1: 0.5379
 epoch: 62, train_loss: 0.6332, test_loss: 1.2351, test_f1: 0.5124
 epoch: 63, train_loss: 0.6174, test_loss: 1.1579, test_f1: 0.5143
 epoch: 64, train_loss: 0.6067, test_loss: 1.1283, test_f1: 0.5394
 epoch: 65, train_loss: 0.5991, test_loss: 1.1593, test_f1: 0.5455
 epoch: 66, train_loss: 0.6157, test_loss: 1.1072, test_f1: 0.5563
 epoch: 67, train_loss: 0.6144, test_loss: 1.1485, test_f1: 0.5570
 epoch: 68, train_loss: 0.5876, test_loss: 1.1167, test_f1: 0.5436
 epoch: 69, train_loss: 0.5856, test_loss: 1.1365, test_f1: 0.5177
 epoch: 70, train_loss: 0.6041, test_loss: 1.0300, test_f1: 0.5597
 epoch: 71, train_loss: 0.5931, test_loss: 1.1062, test_f1: 0.5563
 epoch: 72, train_loss: 0.5776, test_loss: 1.0513, test_f1: 0.5386
 epoch: 73, train_loss: 0.5748, test_loss: 1.0826, test_f1: 0.5656
 epoch: 74, train_loss: 0.5659, test_loss: 1.1511, test_f1: 0.5306
 epoch: 75, train_loss: 0.5711, test_loss: 1.1931, test_f1: 0.5479
 epoch: 76, train_loss: 0.5598, test_loss: 1.1714, test_f1: 0.5463
 epoch: 77, train_loss: 0.5616, test_loss: 1.1311, test_f1: 0.5360
 epoch: 78, train_loss: 0.5655, test_loss: 1.0697, test_f1: 0.5708
 epoch: 79, train_loss: 0.5533, test_loss: 1.3224, test_f1: 0.5377
 epoch: 80, train_loss: 0.5681, test_loss: 1.2584, test_f1: 0.5261
 epoch: 81, train_loss: 0.5638, test_loss: 1.2091, test_f1: 0.5557
 epoch: 82, train_loss: 0.5654, test_loss: 1.1651, test_f1: 0.5504
 epoch: 83, train_loss: 0.5556, test_loss: 1.1734, test_f1: 0.5223
 epoch: 84, train_loss: 0.5361, test_loss: 1.2080, test_f1: 0.5483
 epoch: 85, train_loss: 0.5872, test_loss: 1.1050, test_f1: 0.5490
 epoch: 86, train_loss: 0.5390, test_loss: 1.1977, test_f1: 0.5333
 epoch: 87, train_loss: 0.5229, test_loss: 1.2423, test_f1: 0.5596
 epoch: 88, train_loss: 0.5387, test_loss: 1.1440, test_f1: 0.5832
 epoch: 89, train_loss: 0.5404, test_loss: 1.2342, test_f1: 0.5249
 epoch: 90, train_loss: 0.5351, test_loss: 1.1955, test_f1: 0.5648
 epoch: 91, train_loss: 0.5371, test_loss: 1.2060, test_f1: 0.5631
 epoch: 92, train_loss: 0.5272, test_loss: 1.2779, test_f1: 0.5348
 epoch: 93, train_loss: 0.5200, test_loss: 1.1449, test_f1: 0.5546
 epoch: 94, train_loss: 0.5427, test_loss: 1.2354, test_f1: 0.5379
 epoch: 95, train_loss: 0.5266, test_loss: 1.2071, test_f1: 0.5682
 epoch: 96, train_loss: 0.5245, test_loss: 1.1845, test_f1: 0.5504
 epoch: 97, train_loss: 0.5355, test_loss: 1.2103, test_f1: 0.5614
 epoch: 98, train_loss: 0.5180, test_loss: 1.1995, test_f1: 0.5538
 epoch: 99, train_loss: 0.5136, test_loss: 1.1819, test_f1: 0.5616
##################ITERATION #3 ****************************************
 epoch: 0, train_loss: 1.2811, test_loss: 1.1525, test_f1: 0.3688
 epoch: 1, train_loss: 1.1334, test_loss: 1.0558, test_f1: 0.4456
 epoch: 2, train_loss: 1.0982, test_loss: 1.0390, test_f1: 0.4779
 epoch: 3, train_loss: 1.0535, test_loss: 0.9966, test_f1: 0.4569
 epoch: 4, train_loss: 1.0451, test_loss: 0.9622, test_f1: 0.4831
 epoch: 5, train_loss: 1.0108, test_loss: 0.9640, test_f1: 0.4879
 epoch: 6, train_loss: 1.0041, test_loss: 0.9449, test_f1: 0.5004
 epoch: 7, train_loss: 0.9702, test_loss: 0.9563, test_f1: 0.4738
 epoch: 8, train_loss: 0.9750, test_loss: 0.9535, test_f1: 0.4781
 epoch: 9, train_loss: 0.9593, test_loss: 0.9150, test_f1: 0.4997
 epoch: 10, train_loss: 0.9402, test_loss: 1.0061, test_f1: 0.5193
 epoch: 11, train_loss: 0.9195, test_loss: 0.9235, test_f1: 0.5103
 epoch: 12, train_loss: 0.9148, test_loss: 0.9212, test_f1: 0.5176
 epoch: 13, train_loss: 0.9190, test_loss: 0.9083, test_f1: 0.5110
 epoch: 14, train_loss: 0.9079, test_loss: 0.9441, test_f1: 0.4973
 epoch: 15, train_loss: 0.9223, test_loss: 0.9110, test_f1: 0.5355
 epoch: 16, train_loss: 0.8887, test_loss: 0.9064, test_f1: 0.5568
 epoch: 17, train_loss: 0.9038, test_loss: 0.9230, test_f1: 0.4987
 epoch: 18, train_loss: 0.8691, test_loss: 0.9255, test_f1: 0.5301
 epoch: 19, train_loss: 0.8591, test_loss: 0.9347, test_f1: 0.5483
 epoch: 20, train_loss: 0.8547, test_loss: 0.9445, test_f1: 0.5316
 epoch: 21, train_loss: 0.8590, test_loss: 0.9523, test_f1: 0.5173
 epoch: 22, train_loss: 0.8621, test_loss: 0.9749, test_f1: 0.5417
 epoch: 23, train_loss: 0.8535, test_loss: 0.9347, test_f1: 0.5529
 epoch: 24, train_loss: 0.8432, test_loss: 0.9859, test_f1: 0.5459
 epoch: 25, train_loss: 0.8463, test_loss: 0.9457, test_f1: 0.5339
 epoch: 26, train_loss: 0.8214, test_loss: 0.9886, test_f1: 0.5281
 epoch: 27, train_loss: 0.8189, test_loss: 0.9522, test_f1: 0.5527
 epoch: 28, train_loss: 0.8152, test_loss: 0.9571, test_f1: 0.5481
 epoch: 29, train_loss: 0.8112, test_loss: 0.9722, test_f1: 0.5584
 epoch: 30, train_loss: 0.7987, test_loss: 1.0065, test_f1: 0.5324
 epoch: 31, train_loss: 0.7912, test_loss: 0.9769, test_f1: 0.5367
 epoch: 32, train_loss: 0.7901, test_loss: 1.0224, test_f1: 0.5560
 epoch: 33, train_loss: 0.7739, test_loss: 1.0154, test_f1: 0.5816
 epoch: 34, train_loss: 0.7777, test_loss: 1.0114, test_f1: 0.5554
 epoch: 35, train_loss: 0.7700, test_loss: 1.0207, test_f1: 0.5450
 epoch: 36, train_loss: 0.7621, test_loss: 1.0122, test_f1: 0.5538
 epoch: 37, train_loss: 0.7400, test_loss: 1.0455, test_f1: 0.5614
 epoch: 38, train_loss: 0.7688, test_loss: 1.0307, test_f1: 0.5458
 epoch: 39, train_loss: 0.7581, test_loss: 1.0060, test_f1: 0.5421
 epoch: 40, train_loss: 0.7575, test_loss: 1.0525, test_f1: 0.5550
 epoch: 41, train_loss: 0.7352, test_loss: 1.0996, test_f1: 0.5611
 epoch: 42, train_loss: 0.7352, test_loss: 1.0716, test_f1: 0.5527
 epoch: 43, train_loss: 0.7289, test_loss: 1.0769, test_f1: 0.5254
 epoch: 44, train_loss: 0.7310, test_loss: 1.0251, test_f1: 0.5958
 epoch: 45, train_loss: 0.7134, test_loss: 1.0662, test_f1: 0.5568
 epoch: 46, train_loss: 0.8024, test_loss: 1.0383, test_f1: 0.5328
 epoch: 47, train_loss: 0.7364, test_loss: 1.0824, test_f1: 0.5292
 epoch: 48, train_loss: 0.7346, test_loss: 1.0765, test_f1: 0.5303
 epoch: 49, train_loss: 0.7179, test_loss: 1.0554, test_f1: 0.5404
 epoch: 50, train_loss: 0.7194, test_loss: 1.1062, test_f1: 0.5356
 epoch: 51, train_loss: 0.6797, test_loss: 1.0393, test_f1: 0.5841
 epoch: 52, train_loss: 0.6628, test_loss: 1.0766, test_f1: 0.5776
 epoch: 53, train_loss: 0.6565, test_loss: 1.1369, test_f1: 0.5378
 epoch: 54, train_loss: 0.6666, test_loss: 1.1091, test_f1: 0.5318
 epoch: 55, train_loss: 0.6390, test_loss: 1.2043, test_f1: 0.5345
 epoch: 56, train_loss: 0.6340, test_loss: 1.1929, test_f1: 0.5170
 epoch: 57, train_loss: 0.6474, test_loss: 1.1496, test_f1: 0.5489
 epoch: 58, train_loss: 0.6262, test_loss: 1.1782, test_f1: 0.5141
 epoch: 59, train_loss: 0.6257, test_loss: 1.1577, test_f1: 0.5304
 epoch: 60, train_loss: 0.6167, test_loss: 1.2456, test_f1: 0.5333
 epoch: 61, train_loss: 0.6143, test_loss: 1.2184, test_f1: 0.5141
 epoch: 62, train_loss: 0.6267, test_loss: 1.1886, test_f1: 0.5229
 epoch: 63, train_loss: 0.6206, test_loss: 1.1371, test_f1: 0.5423
 epoch: 64, train_loss: 0.6112, test_loss: 1.1483, test_f1: 0.5474
 epoch: 65, train_loss: 0.6027, test_loss: 1.1998, test_f1: 0.5300
 epoch: 66, train_loss: 0.5821, test_loss: 1.1655, test_f1: 0.5470
 epoch: 67, train_loss: 0.5890, test_loss: 1.1575, test_f1: 0.5437
 epoch: 68, train_loss: 0.5753, test_loss: 1.1909, test_f1: 0.5279
 epoch: 69, train_loss: 0.5816, test_loss: 1.2089, test_f1: 0.5346
 epoch: 70, train_loss: 0.5751, test_loss: 1.2363, test_f1: 0.5453
 epoch: 71, train_loss: 0.5774, test_loss: 1.1820, test_f1: 0.5301
 epoch: 72, train_loss: 0.5897, test_loss: 1.2342, test_f1: 0.5384
 epoch: 73, train_loss: 0.5951, test_loss: 1.1654, test_f1: 0.5595
 epoch: 74, train_loss: 0.6148, test_loss: 1.2293, test_f1: 0.5468
 epoch: 75, train_loss: 0.5842, test_loss: 1.2520, test_f1: 0.5261
 epoch: 76, train_loss: 0.6291, test_loss: 1.1516, test_f1: 0.5408
 epoch: 77, train_loss: 0.5978, test_loss: 1.1869, test_f1: 0.5639
 epoch: 78, train_loss: 0.6054, test_loss: 1.1541, test_f1: 0.5367
 epoch: 79, train_loss: 0.5973, test_loss: 1.2150, test_f1: 0.5198
 epoch: 80, train_loss: 0.5712, test_loss: 1.2238, test_f1: 0.5230
 epoch: 81, train_loss: 0.5663, test_loss: 1.2407, test_f1: 0.5207
 epoch: 82, train_loss: 0.5604, test_loss: 1.2476, test_f1: 0.5310
 epoch: 83, train_loss: 0.5553, test_loss: 1.2910, test_f1: 0.5119
 epoch: 84, train_loss: 0.5275, test_loss: 1.2657, test_f1: 0.5452
 epoch: 85, train_loss: 0.5406, test_loss: 1.2718, test_f1: 0.5444
 epoch: 86, train_loss: 0.5196, test_loss: 1.2968, test_f1: 0.5386
 epoch: 87, train_loss: 0.5370, test_loss: 1.3060, test_f1: 0.5391
 epoch: 88, train_loss: 0.5253, test_loss: 1.2674, test_f1: 0.5604
 epoch: 89, train_loss: 0.5313, test_loss: 1.2915, test_f1: 0.5534
 epoch: 90, train_loss: 0.5110, test_loss: 1.2631, test_f1: 0.5397
 epoch: 91, train_loss: 0.5264, test_loss: 1.2825, test_f1: 0.5495
 epoch: 92, train_loss: 0.5352, test_loss: 1.2547, test_f1: 0.5651
 epoch: 93, train_loss: 0.5237, test_loss: 1.2100, test_f1: 0.5524
 epoch: 94, train_loss: 0.5059, test_loss: 1.3560, test_f1: 0.5461
 epoch: 95, train_loss: 0.5585, test_loss: 1.2499, test_f1: 0.5326
 epoch: 96, train_loss: 0.5286, test_loss: 1.2489, test_f1: 0.5473
 epoch: 97, train_loss: 0.5246, test_loss: 1.3021, test_f1: 0.5315
 epoch: 98, train_loss: 0.5418, test_loss: 1.3941, test_f1: 0.5080
 epoch: 99, train_loss: 0.5204, test_loss: 1.3289, test_f1: 0.5381
##################ITERATION #4 ****************************************
 epoch: 0, train_loss: 1.3088, test_loss: 1.1383, test_f1: 0.3958
 epoch: 1, train_loss: 1.1724, test_loss: 1.0672, test_f1: 0.4292
 epoch: 2, train_loss: 1.1288, test_loss: 1.0335, test_f1: 0.4443
 epoch: 3, train_loss: 1.0840, test_loss: 1.0425, test_f1: 0.4650
 epoch: 4, train_loss: 1.0643, test_loss: 0.9619, test_f1: 0.4771
 epoch: 5, train_loss: 1.0270, test_loss: 0.9570, test_f1: 0.4855
 epoch: 6, train_loss: 1.0088, test_loss: 0.9993, test_f1: 0.4736
 epoch: 7, train_loss: 0.9885, test_loss: 0.9476, test_f1: 0.4757
 epoch: 8, train_loss: 0.9763, test_loss: 0.9671, test_f1: 0.4978
 epoch: 9, train_loss: 0.9662, test_loss: 1.0289, test_f1: 0.4859
 epoch: 10, train_loss: 0.9393, test_loss: 1.1170, test_f1: 0.4655
 epoch: 11, train_loss: 0.9457, test_loss: 0.9561, test_f1: 0.4987
 epoch: 12, train_loss: 0.9346, test_loss: 1.0146, test_f1: 0.4939
 epoch: 13, train_loss: 0.9230, test_loss: 0.9584, test_f1: 0.5152
 epoch: 14, train_loss: 0.9201, test_loss: 0.9508, test_f1: 0.5123
 epoch: 15, train_loss: 0.8921, test_loss: 0.9935, test_f1: 0.5213
 epoch: 16, train_loss: 0.8890, test_loss: 1.0428, test_f1: 0.5011
 epoch: 17, train_loss: 0.9124, test_loss: 0.9541, test_f1: 0.5050
 epoch: 18, train_loss: 0.8835, test_loss: 0.9835, test_f1: 0.5516
 epoch: 19, train_loss: 0.8813, test_loss: 0.9807, test_f1: 0.5212
 epoch: 20, train_loss: 0.8778, test_loss: 1.0020, test_f1: 0.5311
 epoch: 21, train_loss: 0.8586, test_loss: 0.9841, test_f1: 0.5258
 epoch: 22, train_loss: 0.8635, test_loss: 0.9908, test_f1: 0.5099
 epoch: 23, train_loss: 0.8467, test_loss: 1.0011, test_f1: 0.5279
 epoch: 24, train_loss: 0.8513, test_loss: 0.9892, test_f1: 0.5467
 epoch: 25, train_loss: 0.8558, test_loss: 0.9250, test_f1: 0.5561
 epoch: 26, train_loss: 0.8320, test_loss: 1.0128, test_f1: 0.5260
 epoch: 27, train_loss: 0.8268, test_loss: 0.9965, test_f1: 0.5223
 epoch: 28, train_loss: 0.8170, test_loss: 0.9735, test_f1: 0.5227
 epoch: 29, train_loss: 0.8140, test_loss: 1.0307, test_f1: 0.5663
 epoch: 30, train_loss: 0.8249, test_loss: 1.0715, test_f1: 0.5188
 epoch: 31, train_loss: 0.8542, test_loss: 0.9760, test_f1: 0.5408
 epoch: 32, train_loss: 0.8083, test_loss: 0.9619, test_f1: 0.5472
 epoch: 33, train_loss: 0.7919, test_loss: 0.9633, test_f1: 0.5223
 epoch: 34, train_loss: 0.7858, test_loss: 1.0162, test_f1: 0.5397
 epoch: 35, train_loss: 0.7646, test_loss: 1.0133, test_f1: 0.5325
 epoch: 36, train_loss: 0.7871, test_loss: 1.0310, test_f1: 0.5501
 epoch: 37, train_loss: 0.7830, test_loss: 0.9938, test_f1: 0.5437
 epoch: 38, train_loss: 0.7741, test_loss: 1.0982, test_f1: 0.5228
 epoch: 39, train_loss: 0.7625, test_loss: 1.0576, test_f1: 0.4953
 epoch: 40, train_loss: 0.7524, test_loss: 1.0368, test_f1: 0.5734
 epoch: 41, train_loss: 0.7597, test_loss: 1.0235, test_f1: 0.5735
 epoch: 42, train_loss: 0.7308, test_loss: 1.0344, test_f1: 0.5314
 epoch: 43, train_loss: 0.7420, test_loss: 1.0185, test_f1: 0.5326
 epoch: 44, train_loss: 0.7505, test_loss: 1.0512, test_f1: 0.5758
 epoch: 45, train_loss: 0.7351, test_loss: 1.0230, test_f1: 0.5832
 epoch: 46, train_loss: 0.7260, test_loss: 1.0954, test_f1: 0.5717
 epoch: 47, train_loss: 0.7089, test_loss: 1.0452, test_f1: 0.5606
 epoch: 48, train_loss: 0.7329, test_loss: 1.0623, test_f1: 0.5591
 epoch: 49, train_loss: 0.7108, test_loss: 1.1011, test_f1: 0.5368
 epoch: 50, train_loss: 0.6995, test_loss: 1.0537, test_f1: 0.5723
 epoch: 51, train_loss: 0.6618, test_loss: 1.0709, test_f1: 0.5622
 epoch: 52, train_loss: 0.6802, test_loss: 1.1144, test_f1: 0.5586
 epoch: 53, train_loss: 0.6619, test_loss: 1.0870, test_f1: 0.5620
 epoch: 54, train_loss: 0.6430, test_loss: 1.1068, test_f1: 0.5548
 epoch: 55, train_loss: 0.6398, test_loss: 1.1097, test_f1: 0.5595
 epoch: 56, train_loss: 0.6187, test_loss: 1.1057, test_f1: 0.5778
 epoch: 57, train_loss: 0.6260, test_loss: 1.2121, test_f1: 0.5463
 epoch: 58, train_loss: 0.6160, test_loss: 1.1516, test_f1: 0.5795
 epoch: 59, train_loss: 0.6201, test_loss: 1.1412, test_f1: 0.5663
 epoch: 60, train_loss: 0.6222, test_loss: 1.1037, test_f1: 0.5757
 epoch: 61, train_loss: 0.6032, test_loss: 1.1992, test_f1: 0.5612
 epoch: 62, train_loss: 0.5971, test_loss: 1.1391, test_f1: 0.5755
 epoch: 63, train_loss: 0.6181, test_loss: 1.1609, test_f1: 0.5722
 epoch: 64, train_loss: 0.6044, test_loss: 1.1579, test_f1: 0.5628
 epoch: 65, train_loss: 0.6179, test_loss: 1.0736, test_f1: 0.5535
 epoch: 66, train_loss: 0.5930, test_loss: 1.1322, test_f1: 0.5594
 epoch: 67, train_loss: 0.6134, test_loss: 1.1828, test_f1: 0.5563
 epoch: 68, train_loss: 0.5938, test_loss: 1.1313, test_f1: 0.5572
 epoch: 69, train_loss: 0.5721, test_loss: 1.1785, test_f1: 0.5797
 epoch: 70, train_loss: 0.5913, test_loss: 1.1369, test_f1: 0.5676
 epoch: 71, train_loss: 0.5632, test_loss: 1.1241, test_f1: 0.5658
 epoch: 72, train_loss: 0.5602, test_loss: 1.1442, test_f1: 0.5644
 epoch: 73, train_loss: 0.5861, test_loss: 1.1949, test_f1: 0.5479
 epoch: 74, train_loss: 0.5993, test_loss: 1.1565, test_f1: 0.5768
 epoch: 75, train_loss: 0.5625, test_loss: 1.2456, test_f1: 0.5462
 epoch: 76, train_loss: 0.5799, test_loss: 1.1948, test_f1: 0.5490
 epoch: 77, train_loss: 0.5581, test_loss: 1.2083, test_f1: 0.5616
 epoch: 78, train_loss: 0.5742, test_loss: 1.1947, test_f1: 0.5667
 epoch: 79, train_loss: 0.5821, test_loss: 1.1391, test_f1: 0.5670
 epoch: 80, train_loss: 0.5640, test_loss: 1.1682, test_f1: 0.5695
 epoch: 81, train_loss: 0.5573, test_loss: 1.1794, test_f1: 0.5575
 epoch: 82, train_loss: 0.5482, test_loss: 1.2267, test_f1: 0.5478
 epoch: 83, train_loss: 0.5427, test_loss: 1.1924, test_f1: 0.5556
 epoch: 84, train_loss: 0.5450, test_loss: 1.2438, test_f1: 0.5572
 epoch: 85, train_loss: 0.5496, test_loss: 1.2352, test_f1: 0.5644
 epoch: 86, train_loss: 0.5243, test_loss: 1.2128, test_f1: 0.5770
 epoch: 87, train_loss: 0.5379, test_loss: 1.1957, test_f1: 0.5463
 epoch: 88, train_loss: 0.5298, test_loss: 1.2108, test_f1: 0.5820
 epoch: 89, train_loss: 0.5371, test_loss: 1.1828, test_f1: 0.5474
 epoch: 90, train_loss: 0.5267, test_loss: 1.2414, test_f1: 0.5918
 epoch: 91, train_loss: 0.5428, test_loss: 1.2195, test_f1: 0.5414
 epoch: 92, train_loss: 0.5306, test_loss: 1.2579, test_f1: 0.5735
 epoch: 93, train_loss: 0.5028, test_loss: 1.2471, test_f1: 0.5701
 epoch: 94, train_loss: 0.5151, test_loss: 1.2527, test_f1: 0.5796
 epoch: 95, train_loss: 0.5361, test_loss: 1.2644, test_f1: 0.5765
 epoch: 96, train_loss: 0.5467, test_loss: 1.1726, test_f1: 0.5622
 epoch: 97, train_loss: 0.5064, test_loss: 1.2020, test_f1: 0.5947
 epoch: 98, train_loss: 0.5094, test_loss: 1.2151, test_f1: 0.5754
 epoch: 99, train_loss: 0.5025, test_loss: 1.2596, test_f1: 0.5653
##################ITERATION #5 ****************************************
 epoch: 0, train_loss: 1.3131, test_loss: 1.1275, test_f1: 0.4232
 epoch: 1, train_loss: 1.1761, test_loss: 1.0892, test_f1: 0.4060
 epoch: 2, train_loss: 1.1340, test_loss: 1.0341, test_f1: 0.4406
 epoch: 3, train_loss: 1.0947, test_loss: 1.0322, test_f1: 0.4227
 epoch: 4, train_loss: 1.0706, test_loss: 0.9642, test_f1: 0.4833
 epoch: 5, train_loss: 1.0542, test_loss: 0.9970, test_f1: 0.4409
 epoch: 6, train_loss: 1.0360, test_loss: 0.9621, test_f1: 0.4818
 epoch: 7, train_loss: 1.0159, test_loss: 1.0279, test_f1: 0.4592
 epoch: 8, train_loss: 1.0050, test_loss: 0.9551, test_f1: 0.4892
 epoch: 9, train_loss: 0.9986, test_loss: 0.9821, test_f1: 0.4959
 epoch: 10, train_loss: 0.9821, test_loss: 0.9393, test_f1: 0.4991
 epoch: 11, train_loss: 0.9755, test_loss: 0.9700, test_f1: 0.4674
 epoch: 12, train_loss: 0.9419, test_loss: 0.9336, test_f1: 0.4767
 epoch: 13, train_loss: 0.9491, test_loss: 0.9873, test_f1: 0.4973
 epoch: 14, train_loss: 0.9375, test_loss: 0.9285, test_f1: 0.4929
 epoch: 15, train_loss: 0.9255, test_loss: 0.9278, test_f1: 0.5118
 epoch: 16, train_loss: 0.9229, test_loss: 1.0003, test_f1: 0.5149
 epoch: 17, train_loss: 0.9079, test_loss: 0.9192, test_f1: 0.4760
 epoch: 18, train_loss: 0.9110, test_loss: 1.0000, test_f1: 0.5241
 epoch: 19, train_loss: 0.8865, test_loss: 0.9653, test_f1: 0.5206
 epoch: 20, train_loss: 0.8678, test_loss: 1.0409, test_f1: 0.5109
 epoch: 21, train_loss: 0.8691, test_loss: 1.0177, test_f1: 0.5086
 epoch: 22, train_loss: 0.8522, test_loss: 0.9435, test_f1: 0.5420
 epoch: 23, train_loss: 0.8717, test_loss: 1.0460, test_f1: 0.5297
 epoch: 24, train_loss: 0.8503, test_loss: 0.9598, test_f1: 0.5645
 epoch: 25, train_loss: 0.8355, test_loss: 1.0604, test_f1: 0.5109
 epoch: 26, train_loss: 0.8589, test_loss: 1.0342, test_f1: 0.5226
 epoch: 27, train_loss: 0.8227, test_loss: 1.0727, test_f1: 0.5345
 epoch: 28, train_loss: 0.8307, test_loss: 1.0573, test_f1: 0.5108
 epoch: 29, train_loss: 0.8211, test_loss: 1.0443, test_f1: 0.5374
 epoch: 30, train_loss: 0.8041, test_loss: 1.0564, test_f1: 0.5266
 epoch: 31, train_loss: 0.7963, test_loss: 1.0305, test_f1: 0.5552
 epoch: 32, train_loss: 0.7936, test_loss: 1.0851, test_f1: 0.5324
 epoch: 33, train_loss: 0.7812, test_loss: 1.0343, test_f1: 0.5184
 epoch: 34, train_loss: 0.7754, test_loss: 1.1292, test_f1: 0.5227
 epoch: 35, train_loss: 0.7828, test_loss: 1.2101, test_f1: 0.5071
 epoch: 36, train_loss: 0.7807, test_loss: 1.0980, test_f1: 0.5158
 epoch: 37, train_loss: 0.7718, test_loss: 1.1550, test_f1: 0.5120
 epoch: 38, train_loss: 0.7638, test_loss: 1.0731, test_f1: 0.5357
 epoch: 39, train_loss: 0.7948, test_loss: 1.1342, test_f1: 0.5260
 epoch: 40, train_loss: 0.7766, test_loss: 1.0889, test_f1: 0.5512
 epoch: 41, train_loss: 0.7481, test_loss: 1.1481, test_f1: 0.5207
 epoch: 42, train_loss: 0.7654, test_loss: 1.1138, test_f1: 0.5209
 epoch: 43, train_loss: 0.7437, test_loss: 1.1289, test_f1: 0.5319
 epoch: 44, train_loss: 0.7470, test_loss: 1.0401, test_f1: 0.5339
 epoch: 45, train_loss: 0.7757, test_loss: 1.0336, test_f1: 0.5394
 epoch: 46, train_loss: 0.7460, test_loss: 1.1748, test_f1: 0.5131
 epoch: 47, train_loss: 0.7408, test_loss: 1.1908, test_f1: 0.5229
 epoch: 48, train_loss: 0.7173, test_loss: 1.1357, test_f1: 0.5324
 epoch: 49, train_loss: 0.7225, test_loss: 1.1426, test_f1: 0.5367
 epoch: 50, train_loss: 0.7020, test_loss: 1.1050, test_f1: 0.5401
 epoch: 51, train_loss: 0.6881, test_loss: 1.1166, test_f1: 0.5418
 epoch: 52, train_loss: 0.6621, test_loss: 1.1152, test_f1: 0.5305
 epoch: 53, train_loss: 0.6684, test_loss: 1.1253, test_f1: 0.5332
 epoch: 54, train_loss: 0.6405, test_loss: 1.2137, test_f1: 0.5175
 epoch: 55, train_loss: 0.6682, test_loss: 1.0862, test_f1: 0.5276
 epoch: 56, train_loss: 0.6471, test_loss: 1.0750, test_f1: 0.5524
 epoch: 57, train_loss: 0.6583, test_loss: 1.1315, test_f1: 0.5528
 epoch: 58, train_loss: 0.6351, test_loss: 1.1568, test_f1: 0.5296
 epoch: 59, train_loss: 0.6212, test_loss: 1.2085, test_f1: 0.5333
 epoch: 60, train_loss: 0.6163, test_loss: 1.2582, test_f1: 0.5213
 epoch: 61, train_loss: 0.6200, test_loss: 1.1197, test_f1: 0.5347
 epoch: 62, train_loss: 0.6126, test_loss: 1.2021, test_f1: 0.5629
 epoch: 63, train_loss: 0.6281, test_loss: 1.1886, test_f1: 0.5268
 epoch: 64, train_loss: 0.6143, test_loss: 1.1023, test_f1: 0.5504
 epoch: 65, train_loss: 0.6025, test_loss: 1.1299, test_f1: 0.5604
 epoch: 66, train_loss: 0.6138, test_loss: 1.1264, test_f1: 0.5569
 epoch: 67, train_loss: 0.6091, test_loss: 1.1933, test_f1: 0.5507
 epoch: 68, train_loss: 0.6111, test_loss: 1.2265, test_f1: 0.5436
 epoch: 69, train_loss: 0.6008, test_loss: 1.1486, test_f1: 0.5537
 epoch: 70, train_loss: 0.5844, test_loss: 1.2388, test_f1: 0.5375
 epoch: 71, train_loss: 0.5941, test_loss: 1.3408, test_f1: 0.5282
 epoch: 72, train_loss: 0.6015, test_loss: 1.2355, test_f1: 0.5386
 epoch: 73, train_loss: 0.6013, test_loss: 1.2365, test_f1: 0.5567
 epoch: 74, train_loss: 0.5651, test_loss: 1.2879, test_f1: 0.5269
 epoch: 75, train_loss: 0.5672, test_loss: 1.2143, test_f1: 0.5611
 epoch: 76, train_loss: 0.5744, test_loss: 1.2219, test_f1: 0.5674
 epoch: 77, train_loss: 0.5811, test_loss: 1.1700, test_f1: 0.5609
 epoch: 78, train_loss: 0.5636, test_loss: 1.2085, test_f1: 0.5603
 epoch: 79, train_loss: 0.5720, test_loss: 1.3251, test_f1: 0.5866
 epoch: 80, train_loss: 0.5664, test_loss: 1.2125, test_f1: 0.5788
 epoch: 81, train_loss: 0.5736, test_loss: 1.2620, test_f1: 0.5600
 epoch: 82, train_loss: 0.5483, test_loss: 1.2651, test_f1: 0.5421
 epoch: 83, train_loss: 0.5704, test_loss: 1.2692, test_f1: 0.5557
 epoch: 84, train_loss: 0.5668, test_loss: 1.2119, test_f1: 0.5616
 epoch: 85, train_loss: 0.5576, test_loss: 1.3096, test_f1: 0.5551
 epoch: 86, train_loss: 0.5642, test_loss: 1.2135, test_f1: 0.5680
 epoch: 87, train_loss: 0.5443, test_loss: 1.4228, test_f1: 0.5351
 epoch: 88, train_loss: 0.5359, test_loss: 1.3739, test_f1: 0.5550
 epoch: 89, train_loss: 0.5363, test_loss: 1.3461, test_f1: 0.5682
 epoch: 90, train_loss: 0.5286, test_loss: 1.4644, test_f1: 0.5431
 epoch: 91, train_loss: 0.5863, test_loss: 1.3379, test_f1: 0.5369
 epoch: 92, train_loss: 0.5628, test_loss: 1.2593, test_f1: 0.5426
 epoch: 93, train_loss: 0.5258, test_loss: 1.3914, test_f1: 0.5642
 epoch: 94, train_loss: 0.5325, test_loss: 1.3604, test_f1: 0.5468
 epoch: 95, train_loss: 0.5398, test_loss: 1.2716, test_f1: 0.5511
 epoch: 96, train_loss: 0.5469, test_loss: 1.3748, test_f1: 0.5242
 epoch: 97, train_loss: 0.5095, test_loss: 1.3257, test_f1: 0.5517
 epoch: 98, train_loss: 0.5356, test_loss: 1.4726, test_f1: 0.5375
 epoch: 99, train_loss: 0.5283, test_loss: 1.3591, test_f1: 0.5246
##################ITERATION #6 ****************************************
 epoch: 0, train_loss: 1.2750, test_loss: 1.1360, test_f1: 0.4384
 epoch: 1, train_loss: 1.1711, test_loss: 1.0625, test_f1: 0.4803
 epoch: 2, train_loss: 1.1267, test_loss: 1.0486, test_f1: 0.4478
 epoch: 3, train_loss: 1.0891, test_loss: 0.9847, test_f1: 0.4909
 epoch: 4, train_loss: 1.0790, test_loss: 0.9797, test_f1: 0.4748
 epoch: 5, train_loss: 1.0668, test_loss: 0.9466, test_f1: 0.4949
 epoch: 6, train_loss: 1.0327, test_loss: 0.9330, test_f1: 0.4967
 epoch: 7, train_loss: 0.9963, test_loss: 0.9343, test_f1: 0.4910
 epoch: 8, train_loss: 0.9947, test_loss: 0.9009, test_f1: 0.5226
 epoch: 9, train_loss: 0.9664, test_loss: 0.9155, test_f1: 0.5314
 epoch: 10, train_loss: 0.9797, test_loss: 0.9091, test_f1: 0.4932
 epoch: 11, train_loss: 0.9568, test_loss: 0.9105, test_f1: 0.5084
 epoch: 12, train_loss: 0.9237, test_loss: 0.8745, test_f1: 0.5123
 epoch: 13, train_loss: 0.9368, test_loss: 0.8844, test_f1: 0.5228
 epoch: 14, train_loss: 0.9035, test_loss: 0.8719, test_f1: 0.5220
 epoch: 15, train_loss: 0.9129, test_loss: 1.0081, test_f1: 0.4855
 epoch: 16, train_loss: 0.9069, test_loss: 0.9646, test_f1: 0.5368
 epoch: 17, train_loss: 0.8971, test_loss: 0.9194, test_f1: 0.5362
 epoch: 18, train_loss: 0.8973, test_loss: 0.8957, test_f1: 0.5308
 epoch: 19, train_loss: 0.8874, test_loss: 0.8971, test_f1: 0.5301
 epoch: 20, train_loss: 0.8661, test_loss: 0.9572, test_f1: 0.5378
 epoch: 21, train_loss: 0.8768, test_loss: 0.9652, test_f1: 0.5341
 epoch: 22, train_loss: 0.8816, test_loss: 0.9644, test_f1: 0.5171
 epoch: 23, train_loss: 0.8601, test_loss: 0.8871, test_f1: 0.5414
 epoch: 24, train_loss: 0.8739, test_loss: 0.9703, test_f1: 0.5061
 epoch: 25, train_loss: 0.8656, test_loss: 0.9586, test_f1: 0.5352
 epoch: 26, train_loss: 0.8240, test_loss: 0.9076, test_f1: 0.5324
 epoch: 27, train_loss: 0.8298, test_loss: 0.9304, test_f1: 0.5337
 epoch: 28, train_loss: 0.8386, test_loss: 0.8914, test_f1: 0.5590
 epoch: 29, train_loss: 0.8093, test_loss: 1.0621, test_f1: 0.5261
 epoch: 30, train_loss: 0.8510, test_loss: 0.9855, test_f1: 0.5415
 epoch: 31, train_loss: 0.8089, test_loss: 0.9550, test_f1: 0.5372
 epoch: 32, train_loss: 0.8095, test_loss: 0.9741, test_f1: 0.5541
 epoch: 33, train_loss: 0.7900, test_loss: 1.0064, test_f1: 0.5263
 epoch: 34, train_loss: 0.7886, test_loss: 1.0443, test_f1: 0.5224
 epoch: 35, train_loss: 0.7972, test_loss: 1.1028, test_f1: 0.5103
 epoch: 36, train_loss: 0.7986, test_loss: 0.9691, test_f1: 0.5410
 epoch: 37, train_loss: 0.7886, test_loss: 1.0569, test_f1: 0.5414
 epoch: 38, train_loss: 0.7734, test_loss: 1.0052, test_f1: 0.5568
 epoch: 39, train_loss: 0.7576, test_loss: 1.0338, test_f1: 0.5350
 epoch: 40, train_loss: 0.7574, test_loss: 1.0490, test_f1: 0.5582
 epoch: 41, train_loss: 0.7474, test_loss: 1.0890, test_f1: 0.5200
 epoch: 42, train_loss: 0.7594, test_loss: 0.9956, test_f1: 0.5684
 epoch: 43, train_loss: 0.7620, test_loss: 1.1066, test_f1: 0.5179
 epoch: 44, train_loss: 0.7497, test_loss: 1.0270, test_f1: 0.5459
 epoch: 45, train_loss: 0.7294, test_loss: 0.9809, test_f1: 0.5565
 epoch: 46, train_loss: 0.7249, test_loss: 1.0503, test_f1: 0.5338
 epoch: 47, train_loss: 0.7189, test_loss: 0.9942, test_f1: 0.5397
 epoch: 48, train_loss: 0.7669, test_loss: 1.0009, test_f1: 0.5478
 epoch: 49, train_loss: 0.7180, test_loss: 1.0352, test_f1: 0.5486
 epoch: 50, train_loss: 0.6989, test_loss: 0.9781, test_f1: 0.5655
 epoch: 51, train_loss: 0.6982, test_loss: 1.0346, test_f1: 0.5425
 epoch: 52, train_loss: 0.6709, test_loss: 1.0580, test_f1: 0.5452
 epoch: 53, train_loss: 0.6512, test_loss: 1.0544, test_f1: 0.5478
 epoch: 54, train_loss: 0.6509, test_loss: 1.0555, test_f1: 0.5321
 epoch: 55, train_loss: 0.6578, test_loss: 1.0621, test_f1: 0.5522
 epoch: 56, train_loss: 0.6418, test_loss: 1.0490, test_f1: 0.5476
 epoch: 57, train_loss: 0.6442, test_loss: 1.0215, test_f1: 0.5586
 epoch: 58, train_loss: 0.6360, test_loss: 1.0413, test_f1: 0.5566
 epoch: 59, train_loss: 0.6313, test_loss: 1.0744, test_f1: 0.5511
 epoch: 60, train_loss: 0.6366, test_loss: 1.0503, test_f1: 0.5728
 epoch: 61, train_loss: 0.6155, test_loss: 1.1128, test_f1: 0.5684
 epoch: 62, train_loss: 0.6261, test_loss: 1.0819, test_f1: 0.5576
 epoch: 63, train_loss: 0.6317, test_loss: 1.1114, test_f1: 0.5446
 epoch: 64, train_loss: 0.6246, test_loss: 1.0888, test_f1: 0.5651
 epoch: 65, train_loss: 0.6162, test_loss: 1.0462, test_f1: 0.5871
 epoch: 66, train_loss: 0.6164, test_loss: 1.1346, test_f1: 0.5460
 epoch: 67, train_loss: 0.6105, test_loss: 1.1485, test_f1: 0.5545
 epoch: 68, train_loss: 0.6053, test_loss: 1.1571, test_f1: 0.5768
 epoch: 69, train_loss: 0.5818, test_loss: 1.1881, test_f1: 0.5378
 epoch: 70, train_loss: 0.5965, test_loss: 1.1646, test_f1: 0.5616
 epoch: 71, train_loss: 0.5855, test_loss: 1.1142, test_f1: 0.5594
 epoch: 72, train_loss: 0.5882, test_loss: 1.1005, test_f1: 0.5652
 epoch: 73, train_loss: 0.5944, test_loss: 1.1041, test_f1: 0.5462
 epoch: 74, train_loss: 0.5631, test_loss: 1.2129, test_f1: 0.5442
 epoch: 75, train_loss: 0.5836, test_loss: 1.0828, test_f1: 0.5635
 epoch: 76, train_loss: 0.5744, test_loss: 1.1502, test_f1: 0.5687
 epoch: 77, train_loss: 0.5632, test_loss: 1.1679, test_f1: 0.5752
 epoch: 78, train_loss: 0.5658, test_loss: 1.1529, test_f1: 0.5796
 epoch: 79, train_loss: 0.5610, test_loss: 1.2012, test_f1: 0.5646
 epoch: 80, train_loss: 0.5753, test_loss: 1.2096, test_f1: 0.5462
 epoch: 81, train_loss: 0.5489, test_loss: 1.2868, test_f1: 0.5518
 epoch: 82, train_loss: 0.5650, test_loss: 1.1113, test_f1: 0.5806
 epoch: 83, train_loss: 0.5579, test_loss: 1.1419, test_f1: 0.5809
 epoch: 84, train_loss: 0.5504, test_loss: 1.1638, test_f1: 0.5598
 epoch: 85, train_loss: 0.5486, test_loss: 1.1575, test_f1: 0.5491
 epoch: 86, train_loss: 0.5294, test_loss: 1.1784, test_f1: 0.5704
 epoch: 87, train_loss: 0.5307, test_loss: 1.1618, test_f1: 0.5582
 epoch: 88, train_loss: 0.5142, test_loss: 1.3616, test_f1: 0.5423
 epoch: 89, train_loss: 0.5550, test_loss: 1.1530, test_f1: 0.5932
 epoch: 90, train_loss: 0.5396, test_loss: 1.1540, test_f1: 0.5912
 epoch: 91, train_loss: 0.5338, test_loss: 1.2750, test_f1: 0.5413
 epoch: 92, train_loss: 0.5214, test_loss: 1.2651, test_f1: 0.5711
 epoch: 93, train_loss: 0.5165, test_loss: 1.2024, test_f1: 0.5751
 epoch: 94, train_loss: 0.5120, test_loss: 1.2286, test_f1: 0.5452
 epoch: 95, train_loss: 0.5174, test_loss: 1.2748, test_f1: 0.5596
 epoch: 96, train_loss: 0.5456, test_loss: 1.1846, test_f1: 0.5759
 epoch: 97, train_loss: 0.5264, test_loss: 1.1731, test_f1: 0.5816
 epoch: 98, train_loss: 0.5002, test_loss: 1.1752, test_f1: 0.5875
 epoch: 99, train_loss: 0.5107, test_loss: 1.1418, test_f1: 0.5711
##################ITERATION #7 ****************************************
 epoch: 0, train_loss: 1.3133, test_loss: 1.1442, test_f1: 0.3852
 epoch: 1, train_loss: 1.1724, test_loss: 1.0695, test_f1: 0.4371
 epoch: 2, train_loss: 1.1313, test_loss: 1.0578, test_f1: 0.4219
 epoch: 3, train_loss: 1.1197, test_loss: 1.0370, test_f1: 0.4091
 epoch: 4, train_loss: 1.0935, test_loss: 1.0050, test_f1: 0.4420
 epoch: 5, train_loss: 1.0613, test_loss: 1.0180, test_f1: 0.4552
 epoch: 6, train_loss: 1.0501, test_loss: 1.0528, test_f1: 0.4165
 epoch: 7, train_loss: 1.0467, test_loss: 0.9504, test_f1: 0.4785
 epoch: 8, train_loss: 1.0094, test_loss: 0.9240, test_f1: 0.5183
 epoch: 9, train_loss: 0.9968, test_loss: 0.9550, test_f1: 0.4754
 epoch: 10, train_loss: 0.9777, test_loss: 0.9256, test_f1: 0.5164
 epoch: 11, train_loss: 0.9610, test_loss: 0.9378, test_f1: 0.4790
 epoch: 12, train_loss: 0.9442, test_loss: 0.9891, test_f1: 0.4981
 epoch: 13, train_loss: 0.9414, test_loss: 1.0312, test_f1: 0.4821
 epoch: 14, train_loss: 0.9251, test_loss: 0.9799, test_f1: 0.5184
 epoch: 15, train_loss: 0.9353, test_loss: 1.0104, test_f1: 0.5174
 epoch: 16, train_loss: 0.9164, test_loss: 1.0511, test_f1: 0.4743
 epoch: 17, train_loss: 0.9095, test_loss: 0.9981, test_f1: 0.5009
 epoch: 18, train_loss: 0.8842, test_loss: 1.0504, test_f1: 0.5117
 epoch: 19, train_loss: 0.9088, test_loss: 1.0068, test_f1: 0.5173
 epoch: 20, train_loss: 0.9089, test_loss: 0.9373, test_f1: 0.5401
 epoch: 21, train_loss: 0.9071, test_loss: 0.9901, test_f1: 0.4995
 epoch: 22, train_loss: 0.8810, test_loss: 1.0094, test_f1: 0.5074
 epoch: 23, train_loss: 0.8765, test_loss: 0.9611, test_f1: 0.5332
 epoch: 24, train_loss: 0.8500, test_loss: 0.9796, test_f1: 0.5001
 epoch: 25, train_loss: 0.8547, test_loss: 1.0136, test_f1: 0.5306
 epoch: 26, train_loss: 0.8420, test_loss: 1.0262, test_f1: 0.4896
 epoch: 27, train_loss: 0.8276, test_loss: 1.0140, test_f1: 0.5399
 epoch: 28, train_loss: 0.8213, test_loss: 1.0822, test_f1: 0.5476
 epoch: 29, train_loss: 0.8273, test_loss: 1.0074, test_f1: 0.5401
 epoch: 30, train_loss: 0.8459, test_loss: 1.0253, test_f1: 0.5455
 epoch: 31, train_loss: 0.8081, test_loss: 1.1319, test_f1: 0.5330
 epoch: 32, train_loss: 0.8239, test_loss: 1.0267, test_f1: 0.5297
 epoch: 33, train_loss: 0.8051, test_loss: 1.0718, test_f1: 0.5577
 epoch: 34, train_loss: 0.7864, test_loss: 1.1203, test_f1: 0.5373
 epoch: 35, train_loss: 0.7728, test_loss: 1.1936, test_f1: 0.5100
 epoch: 36, train_loss: 0.7773, test_loss: 1.0705, test_f1: 0.5527
 epoch: 37, train_loss: 0.7671, test_loss: 1.1409, test_f1: 0.5153
 epoch: 38, train_loss: 0.7688, test_loss: 1.0909, test_f1: 0.5640
 epoch: 39, train_loss: 0.7953, test_loss: 1.0796, test_f1: 0.5164
 epoch: 40, train_loss: 0.7539, test_loss: 1.1379, test_f1: 0.5585
 epoch: 41, train_loss: 0.7601, test_loss: 1.1856, test_f1: 0.5648
 epoch: 42, train_loss: 0.7506, test_loss: 1.1337, test_f1: 0.5228
 epoch: 43, train_loss: 0.7497, test_loss: 1.0550, test_f1: 0.5639
 epoch: 44, train_loss: 0.7440, test_loss: 1.1361, test_f1: 0.5369
 epoch: 45, train_loss: 0.7427, test_loss: 1.0700, test_f1: 0.5478
 epoch: 46, train_loss: 0.7645, test_loss: 1.0894, test_f1: 0.5315
 epoch: 47, train_loss: 0.7276, test_loss: 1.1154, test_f1: 0.5330
 epoch: 48, train_loss: 0.7198, test_loss: 1.1816, test_f1: 0.5410
 epoch: 49, train_loss: 0.7088, test_loss: 1.2461, test_f1: 0.5499
 epoch: 50, train_loss: 0.7380, test_loss: 1.1585, test_f1: 0.5345
 epoch: 51, train_loss: 0.6690, test_loss: 1.2107, test_f1: 0.5548
 epoch: 52, train_loss: 0.6851, test_loss: 1.2141, test_f1: 0.5394
 epoch: 53, train_loss: 0.6579, test_loss: 1.2163, test_f1: 0.5677
 epoch: 54, train_loss: 0.6542, test_loss: 1.2499, test_f1: 0.5535
 epoch: 55, train_loss: 0.6462, test_loss: 1.2437, test_f1: 0.5736
 epoch: 56, train_loss: 0.6510, test_loss: 1.1990, test_f1: 0.5462
 epoch: 57, train_loss: 0.6282, test_loss: 1.3063, test_f1: 0.5636
 epoch: 58, train_loss: 0.6478, test_loss: 1.3059, test_f1: 0.5639
 epoch: 59, train_loss: 0.6397, test_loss: 1.2701, test_f1: 0.5399
 epoch: 60, train_loss: 0.6420, test_loss: 1.2955, test_f1: 0.5391
 epoch: 61, train_loss: 0.6266, test_loss: 1.3078, test_f1: 0.5290
 epoch: 62, train_loss: 0.6191, test_loss: 1.2555, test_f1: 0.5508
 epoch: 63, train_loss: 0.6183, test_loss: 1.2640, test_f1: 0.5404
 epoch: 64, train_loss: 0.6110, test_loss: 1.3148, test_f1: 0.5269
 epoch: 65, train_loss: 0.5967, test_loss: 1.3162, test_f1: 0.5425
 epoch: 66, train_loss: 0.5925, test_loss: 1.3347, test_f1: 0.5254
 epoch: 67, train_loss: 0.5964, test_loss: 1.3424, test_f1: 0.5288
 epoch: 68, train_loss: 0.6039, test_loss: 1.3051, test_f1: 0.5729
 epoch: 69, train_loss: 0.5912, test_loss: 1.2751, test_f1: 0.5509
 epoch: 70, train_loss: 0.5912, test_loss: 1.3511, test_f1: 0.5479
 epoch: 71, train_loss: 0.5998, test_loss: 1.3358, test_f1: 0.5703
 epoch: 72, train_loss: 0.5762, test_loss: 1.3020, test_f1: 0.5446
 epoch: 73, train_loss: 0.5824, test_loss: 1.2839, test_f1: 0.5585
 epoch: 74, train_loss: 0.5814, test_loss: 1.2799, test_f1: 0.5524
 epoch: 75, train_loss: 0.5718, test_loss: 1.3976, test_f1: 0.5203
 epoch: 76, train_loss: 0.5874, test_loss: 1.3147, test_f1: 0.5262
 epoch: 77, train_loss: 0.5728, test_loss: 1.3148, test_f1: 0.5792
 epoch: 78, train_loss: 0.5720, test_loss: 1.3156, test_f1: 0.5665
 epoch: 79, train_loss: 0.6228, test_loss: 1.3300, test_f1: 0.5602
 epoch: 80, train_loss: 0.6023, test_loss: 1.3186, test_f1: 0.5215
 epoch: 81, train_loss: 0.5809, test_loss: 1.3493, test_f1: 0.5314
 epoch: 82, train_loss: 0.5775, test_loss: 1.3888, test_f1: 0.5440
 epoch: 83, train_loss: 0.5557, test_loss: 1.3827, test_f1: 0.5341
 epoch: 84, train_loss: 0.5519, test_loss: 1.4201, test_f1: 0.5459
 epoch: 85, train_loss: 0.5452, test_loss: 1.4060, test_f1: 0.5357
 epoch: 86, train_loss: 0.5353, test_loss: 1.3945, test_f1: 0.5471
 epoch: 87, train_loss: 0.5319, test_loss: 1.3492, test_f1: 0.5485
 epoch: 88, train_loss: 0.5331, test_loss: 1.5030, test_f1: 0.5222
 epoch: 89, train_loss: 0.5478, test_loss: 1.4873, test_f1: 0.5365
 epoch: 90, train_loss: 0.5268, test_loss: 1.3928, test_f1: 0.5510
 epoch: 91, train_loss: 0.5298, test_loss: 1.3828, test_f1: 0.5481
 epoch: 92, train_loss: 0.5301, test_loss: 1.4319, test_f1: 0.5139
 epoch: 93, train_loss: 0.5276, test_loss: 1.4169, test_f1: 0.5810
 epoch: 94, train_loss: 0.5093, test_loss: 1.4505, test_f1: 0.5444
 epoch: 95, train_loss: 0.5023, test_loss: 1.4767, test_f1: 0.5404
 epoch: 96, train_loss: 0.5358, test_loss: 1.4614, test_f1: 0.5847
 epoch: 97, train_loss: 0.5158, test_loss: 1.4212, test_f1: 0.5855
 epoch: 98, train_loss: 0.5186, test_loss: 1.3820, test_f1: 0.5443
 epoch: 99, train_loss: 0.5197, test_loss: 1.3898, test_f1: 0.5547
##################ITERATION #8 ****************************************
 epoch: 0, train_loss: 1.3184, test_loss: 1.1285, test_f1: 0.4665
 epoch: 1, train_loss: 1.1734, test_loss: 1.0715, test_f1: 0.4599
 epoch: 2, train_loss: 1.1357, test_loss: 1.0059, test_f1: 0.5009
 epoch: 3, train_loss: 1.0942, test_loss: 0.9978, test_f1: 0.4764
 epoch: 4, train_loss: 1.0633, test_loss: 0.9807, test_f1: 0.4661
 epoch: 5, train_loss: 1.0518, test_loss: 0.9770, test_f1: 0.4824
 epoch: 6, train_loss: 1.0403, test_loss: 1.0583, test_f1: 0.4607
 epoch: 7, train_loss: 1.0276, test_loss: 0.9703, test_f1: 0.4855
 epoch: 8, train_loss: 1.0035, test_loss: 0.9692, test_f1: 0.5034
 epoch: 9, train_loss: 0.9912, test_loss: 0.9241, test_f1: 0.4988
 epoch: 10, train_loss: 0.9707, test_loss: 0.9767, test_f1: 0.4544
 epoch: 11, train_loss: 0.9663, test_loss: 0.9159, test_f1: 0.5432
 epoch: 12, train_loss: 0.9599, test_loss: 0.9631, test_f1: 0.4860
 epoch: 13, train_loss: 0.9392, test_loss: 0.9756, test_f1: 0.4702
 epoch: 14, train_loss: 0.9394, test_loss: 1.0753, test_f1: 0.4713
 epoch: 15, train_loss: 0.9274, test_loss: 0.8959, test_f1: 0.4919
 epoch: 16, train_loss: 0.9155, test_loss: 0.9331, test_f1: 0.5025
 epoch: 17, train_loss: 0.9097, test_loss: 0.9179, test_f1: 0.5162
 epoch: 18, train_loss: 0.9034, test_loss: 0.9773, test_f1: 0.4877
 epoch: 19, train_loss: 0.8803, test_loss: 1.0524, test_f1: 0.4562
 epoch: 20, train_loss: 0.8836, test_loss: 0.9626, test_f1: 0.5099
 epoch: 21, train_loss: 0.8938, test_loss: 0.9955, test_f1: 0.4827
 epoch: 22, train_loss: 0.8784, test_loss: 1.0021, test_f1: 0.5036
 epoch: 23, train_loss: 0.8730, test_loss: 0.9709, test_f1: 0.5129
 epoch: 24, train_loss: 0.8648, test_loss: 0.9767, test_f1: 0.5001
 epoch: 25, train_loss: 0.8644, test_loss: 0.9879, test_f1: 0.5369
 epoch: 26, train_loss: 0.8561, test_loss: 1.0443, test_f1: 0.5145
 epoch: 27, train_loss: 0.8452, test_loss: 0.9985, test_f1: 0.5115
 epoch: 28, train_loss: 0.8148, test_loss: 1.0156, test_f1: 0.5361
 epoch: 29, train_loss: 0.8345, test_loss: 1.0062, test_f1: 0.5474
 epoch: 30, train_loss: 0.8109, test_loss: 1.0457, test_f1: 0.4950
 epoch: 31, train_loss: 0.8176, test_loss: 1.0521, test_f1: 0.5277
 epoch: 32, train_loss: 0.8068, test_loss: 1.0252, test_f1: 0.5514
 epoch: 33, train_loss: 0.8081, test_loss: 0.9694, test_f1: 0.5608
 epoch: 34, train_loss: 0.8173, test_loss: 1.0133, test_f1: 0.5304
 epoch: 35, train_loss: 0.7982, test_loss: 1.0409, test_f1: 0.5025
 epoch: 36, train_loss: 0.8063, test_loss: 1.0810, test_f1: 0.5037
 epoch: 37, train_loss: 0.7839, test_loss: 1.0769, test_f1: 0.5172
 epoch: 38, train_loss: 0.7871, test_loss: 1.0255, test_f1: 0.5490
 epoch: 39, train_loss: 0.7931, test_loss: 1.0183, test_f1: 0.5236
 epoch: 40, train_loss: 0.7773, test_loss: 1.1149, test_f1: 0.5470
 epoch: 41, train_loss: 0.7702, test_loss: 1.1185, test_f1: 0.5040
 epoch: 42, train_loss: 0.7569, test_loss: 1.0768, test_f1: 0.5507
 epoch: 43, train_loss: 0.7542, test_loss: 1.1489, test_f1: 0.5249
 epoch: 44, train_loss: 0.7609, test_loss: 1.1087, test_f1: 0.5157
 epoch: 45, train_loss: 0.7357, test_loss: 1.1204, test_f1: 0.5042
 epoch: 46, train_loss: 0.7783, test_loss: 1.0002, test_f1: 0.5332
 epoch: 47, train_loss: 0.7585, test_loss: 1.1039, test_f1: 0.5699
 epoch: 48, train_loss: 0.7159, test_loss: 1.1043, test_f1: 0.5315
 epoch: 49, train_loss: 0.7493, test_loss: 1.0542, test_f1: 0.5191
 epoch: 50, train_loss: 0.7296, test_loss: 1.1708, test_f1: 0.5072
 epoch: 51, train_loss: 0.6911, test_loss: 1.0555, test_f1: 0.5371
 epoch: 52, train_loss: 0.6794, test_loss: 1.1274, test_f1: 0.5409
 epoch: 53, train_loss: 0.6716, test_loss: 1.1630, test_f1: 0.5409
 epoch: 54, train_loss: 0.6818, test_loss: 1.1614, test_f1: 0.5314
 epoch: 55, train_loss: 0.6673, test_loss: 1.1457, test_f1: 0.5482
 epoch: 56, train_loss: 0.6717, test_loss: 1.1651, test_f1: 0.5287
 epoch: 57, train_loss: 0.6687, test_loss: 1.1417, test_f1: 0.5273
 epoch: 58, train_loss: 0.6455, test_loss: 1.1565, test_f1: 0.5242
 epoch: 59, train_loss: 0.6639, test_loss: 1.1422, test_f1: 0.5416
 epoch: 60, train_loss: 0.6435, test_loss: 1.2030, test_f1: 0.5473
 epoch: 61, train_loss: 0.6448, test_loss: 1.1278, test_f1: 0.5500
 epoch: 62, train_loss: 0.6330, test_loss: 1.2676, test_f1: 0.5605
 epoch: 63, train_loss: 0.6226, test_loss: 1.1746, test_f1: 0.5712
 epoch: 64, train_loss: 0.6324, test_loss: 1.2048, test_f1: 0.5280
 epoch: 65, train_loss: 0.6319, test_loss: 1.2537, test_f1: 0.5193
 epoch: 66, train_loss: 0.6320, test_loss: 1.2305, test_f1: 0.5560
 epoch: 67, train_loss: 0.6546, test_loss: 1.2237, test_f1: 0.5459
 epoch: 68, train_loss: 0.6126, test_loss: 1.1942, test_f1: 0.5503
 epoch: 69, train_loss: 0.6196, test_loss: 1.2966, test_f1: 0.5371
 epoch: 70, train_loss: 0.6004, test_loss: 1.2835, test_f1: 0.5405
 epoch: 71, train_loss: 0.6178, test_loss: 1.2523, test_f1: 0.5547
 epoch: 72, train_loss: 0.5869, test_loss: 1.2373, test_f1: 0.5803
 epoch: 73, train_loss: 0.6088, test_loss: 1.2599, test_f1: 0.5784
 epoch: 74, train_loss: 0.5962, test_loss: 1.3253, test_f1: 0.5506
 epoch: 75, train_loss: 0.5997, test_loss: 1.2635, test_f1: 0.5458
 epoch: 76, train_loss: 0.6023, test_loss: 1.1827, test_f1: 0.5541
 epoch: 77, train_loss: 0.5950, test_loss: 1.2755, test_f1: 0.5488
 epoch: 78, train_loss: 0.5821, test_loss: 1.2270, test_f1: 0.5589
 epoch: 79, train_loss: 0.5593, test_loss: 1.2820, test_f1: 0.5680
 epoch: 80, train_loss: 0.5710, test_loss: 1.3553, test_f1: 0.5649
 epoch: 81, train_loss: 0.5816, test_loss: 1.2744, test_f1: 0.5635
 epoch: 82, train_loss: 0.5841, test_loss: 1.3425, test_f1: 0.5606
 epoch: 83, train_loss: 0.5943, test_loss: 1.2395, test_f1: 0.5666
 epoch: 84, train_loss: 0.5911, test_loss: 1.2623, test_f1: 0.5429
 epoch: 85, train_loss: 0.5642, test_loss: 1.3264, test_f1: 0.5591
 epoch: 86, train_loss: 0.5662, test_loss: 1.2848, test_f1: 0.5778
 epoch: 87, train_loss: 0.5629, test_loss: 1.3529, test_f1: 0.5589
 epoch: 88, train_loss: 0.5513, test_loss: 1.3388, test_f1: 0.5773
 epoch: 89, train_loss: 0.5419, test_loss: 1.3345, test_f1: 0.5607
 epoch: 90, train_loss: 0.5826, test_loss: 1.2820, test_f1: 0.5922
 epoch: 91, train_loss: 0.5515, test_loss: 1.4218, test_f1: 0.5483
 epoch: 92, train_loss: 0.5494, test_loss: 1.3851, test_f1: 0.5506
 epoch: 93, train_loss: 0.5295, test_loss: 1.3805, test_f1: 0.5681
 epoch: 94, train_loss: 0.5412, test_loss: 1.3584, test_f1: 0.5410
 epoch: 95, train_loss: 0.5543, test_loss: 1.3155, test_f1: 0.5837
 epoch: 96, train_loss: 0.5512, test_loss: 1.3302, test_f1: 0.5597
 epoch: 97, train_loss: 0.5197, test_loss: 1.2996, test_f1: 0.5582
 epoch: 98, train_loss: 0.5421, test_loss: 1.3157, test_f1: 0.5735
 epoch: 99, train_loss: 0.6071, test_loss: 1.2001, test_f1: 0.5583
##################ITERATION #9 ****************************************
 epoch: 0, train_loss: 1.3416, test_loss: 1.1526, test_f1: 0.3546
 epoch: 1, train_loss: 1.1598, test_loss: 1.0597, test_f1: 0.4606
 epoch: 2, train_loss: 1.1213, test_loss: 1.0174, test_f1: 0.4415
 epoch: 3, train_loss: 1.0860, test_loss: 0.9896, test_f1: 0.4919
 epoch: 4, train_loss: 1.0646, test_loss: 1.0160, test_f1: 0.4873
 epoch: 5, train_loss: 1.0507, test_loss: 0.9782, test_f1: 0.4983
 epoch: 6, train_loss: 1.0118, test_loss: 0.9887, test_f1: 0.4882
 epoch: 7, train_loss: 1.0076, test_loss: 1.0033, test_f1: 0.5116
 epoch: 8, train_loss: 0.9841, test_loss: 0.9277, test_f1: 0.4832
 epoch: 9, train_loss: 0.9764, test_loss: 1.0221, test_f1: 0.4756
 epoch: 10, train_loss: 0.9601, test_loss: 0.9452, test_f1: 0.5259
 epoch: 11, train_loss: 0.9390, test_loss: 0.9598, test_f1: 0.4720
 epoch: 12, train_loss: 0.9340, test_loss: 0.9354, test_f1: 0.5325
 epoch: 13, train_loss: 0.9295, test_loss: 0.9851, test_f1: 0.4877
 epoch: 14, train_loss: 0.9213, test_loss: 0.9704, test_f1: 0.4829
 epoch: 15, train_loss: 0.9100, test_loss: 1.0089, test_f1: 0.4943
 epoch: 16, train_loss: 0.9154, test_loss: 0.9163, test_f1: 0.5241
 epoch: 17, train_loss: 0.9216, test_loss: 0.9771, test_f1: 0.5011
 epoch: 18, train_loss: 0.8872, test_loss: 0.9396, test_f1: 0.5246
 epoch: 19, train_loss: 0.8707, test_loss: 0.9965, test_f1: 0.5139
 epoch: 20, train_loss: 0.8661, test_loss: 0.9860, test_f1: 0.5514
 epoch: 21, train_loss: 0.8592, test_loss: 0.8955, test_f1: 0.5585
 epoch: 22, train_loss: 0.8536, test_loss: 0.9685, test_f1: 0.5167
 epoch: 23, train_loss: 0.8533, test_loss: 1.0423, test_f1: 0.4974
 epoch: 24, train_loss: 0.8610, test_loss: 1.0603, test_f1: 0.5231
 epoch: 25, train_loss: 0.8475, test_loss: 0.9922, test_f1: 0.5775
 epoch: 26, train_loss: 0.8386, test_loss: 1.0825, test_f1: 0.5539
 epoch: 27, train_loss: 0.8327, test_loss: 1.0455, test_f1: 0.5487
 epoch: 28, train_loss: 0.8134, test_loss: 1.1422, test_f1: 0.5438
 epoch: 29, train_loss: 0.8034, test_loss: 1.0606, test_f1: 0.5816
 epoch: 30, train_loss: 0.8034, test_loss: 1.1669, test_f1: 0.4975
 epoch: 31, train_loss: 0.7922, test_loss: 1.0830, test_f1: 0.5452
 epoch: 32, train_loss: 0.7949, test_loss: 1.0594, test_f1: 0.5071
 epoch: 33, train_loss: 0.8159, test_loss: 1.1014, test_f1: 0.5311
 epoch: 34, train_loss: 0.7700, test_loss: 1.1201, test_f1: 0.5292
 epoch: 35, train_loss: 0.8621, test_loss: 1.0037, test_f1: 0.5195
 epoch: 36, train_loss: 0.8229, test_loss: 1.0722, test_f1: 0.5022
 epoch: 37, train_loss: 0.7896, test_loss: 1.0754, test_f1: 0.5192
 epoch: 38, train_loss: 0.7666, test_loss: 1.1054, test_f1: 0.5009
 epoch: 39, train_loss: 0.7895, test_loss: 1.1154, test_f1: 0.5218
 epoch: 40, train_loss: 0.7482, test_loss: 1.0769, test_f1: 0.5263
 epoch: 41, train_loss: 0.7654, test_loss: 1.1745, test_f1: 0.5081
 epoch: 42, train_loss: 0.7561, test_loss: 1.0775, test_f1: 0.5529
 epoch: 43, train_loss: 0.7411, test_loss: 1.0872, test_f1: 0.5785
 epoch: 44, train_loss: 0.7516, test_loss: 1.1067, test_f1: 0.5478
 epoch: 45, train_loss: 0.7457, test_loss: 1.0858, test_f1: 0.5186
 epoch: 46, train_loss: 0.7254, test_loss: 1.1632, test_f1: 0.5791
 epoch: 47, train_loss: 0.7304, test_loss: 1.1507, test_f1: 0.5187
 epoch: 48, train_loss: 0.7140, test_loss: 1.1777, test_f1: 0.5321
 epoch: 49, train_loss: 0.7152, test_loss: 1.1563, test_f1: 0.5239
 epoch: 50, train_loss: 0.7327, test_loss: 1.1571, test_f1: 0.5724
 epoch: 51, train_loss: 0.7052, test_loss: 1.1974, test_f1: 0.5516
 epoch: 52, train_loss: 0.6615, test_loss: 1.1571, test_f1: 0.5537
 epoch: 53, train_loss: 0.6622, test_loss: 1.1846, test_f1: 0.5264
 epoch: 54, train_loss: 0.6566, test_loss: 1.1452, test_f1: 0.5815
 epoch: 55, train_loss: 0.6403, test_loss: 1.1666, test_f1: 0.5707
 epoch: 56, train_loss: 0.6436, test_loss: 1.2099, test_f1: 0.5980
 epoch: 57, train_loss: 0.6252, test_loss: 1.2493, test_f1: 0.5621
 epoch: 58, train_loss: 0.6328, test_loss: 1.2403, test_f1: 0.5609
 epoch: 59, train_loss: 0.6635, test_loss: 1.2223, test_f1: 0.5477
 epoch: 60, train_loss: 0.6378, test_loss: 1.2551, test_f1: 0.5523
 epoch: 61, train_loss: 0.6200, test_loss: 1.2767, test_f1: 0.5598
 epoch: 62, train_loss: 0.6319, test_loss: 1.2496, test_f1: 0.5704
 epoch: 63, train_loss: 0.6172, test_loss: 1.3022, test_f1: 0.5547
 epoch: 64, train_loss: 0.6126, test_loss: 1.3212, test_f1: 0.5790
 epoch: 65, train_loss: 0.6176, test_loss: 1.2962, test_f1: 0.5641
 epoch: 66, train_loss: 0.5963, test_loss: 1.2969, test_f1: 0.5667
 epoch: 67, train_loss: 0.5933, test_loss: 1.4174, test_f1: 0.5245
 epoch: 68, train_loss: 0.6021, test_loss: 1.2909, test_f1: 0.5694
 epoch: 69, train_loss: 0.5957, test_loss: 1.2709, test_f1: 0.5803
 epoch: 70, train_loss: 0.6058, test_loss: 1.3217, test_f1: 0.5494
 epoch: 71, train_loss: 0.5932, test_loss: 1.2826, test_f1: 0.5795
 epoch: 72, train_loss: 0.5652, test_loss: 1.3560, test_f1: 0.5611
 epoch: 73, train_loss: 0.5889, test_loss: 1.2938, test_f1: 0.5789
 epoch: 74, train_loss: 0.5860, test_loss: 1.2772, test_f1: 0.5623
 epoch: 75, train_loss: 0.5904, test_loss: 1.3040, test_f1: 0.5741
 epoch: 76, train_loss: 0.5847, test_loss: 1.2835, test_f1: 0.5587
 epoch: 77, train_loss: 0.6030, test_loss: 1.3356, test_f1: 0.5654
 epoch: 78, train_loss: 0.5793, test_loss: 1.3449, test_f1: 0.5692
 epoch: 79, train_loss: 0.5658, test_loss: 1.3577, test_f1: 0.5807
 epoch: 80, train_loss: 0.5798, test_loss: 1.3440, test_f1: 0.5665
 epoch: 81, train_loss: 0.6053, test_loss: 1.3313, test_f1: 0.5734
 epoch: 82, train_loss: 0.6012, test_loss: 1.3122, test_f1: 0.5815
 epoch: 83, train_loss: 0.5731, test_loss: 1.3608, test_f1: 0.5610
 epoch: 84, train_loss: 0.5614, test_loss: 1.3545, test_f1: 0.5683
 epoch: 85, train_loss: 0.5512, test_loss: 1.3537, test_f1: 0.5750
 epoch: 86, train_loss: 0.5697, test_loss: 1.4210, test_f1: 0.5702
 epoch: 87, train_loss: 0.5664, test_loss: 1.3195, test_f1: 0.5766
 epoch: 88, train_loss: 0.5626, test_loss: 1.2486, test_f1: 0.5720
 epoch: 89, train_loss: 0.5245, test_loss: 1.3284, test_f1: 0.5637
 epoch: 90, train_loss: 0.5850, test_loss: 1.2921, test_f1: 0.5741
 epoch: 91, train_loss: 0.5458, test_loss: 1.2850, test_f1: 0.5778
 epoch: 92, train_loss: 0.5507, test_loss: 1.3258, test_f1: 0.5730
 epoch: 93, train_loss: 0.5499, test_loss: 1.3259, test_f1: 0.5651
 epoch: 94, train_loss: 0.5290, test_loss: 1.3496, test_f1: 0.5790
 epoch: 95, train_loss: 0.5411, test_loss: 1.3673, test_f1: 0.5803
 epoch: 96, train_loss: 0.5656, test_loss: 1.2975, test_f1: 0.5808
 epoch: 97, train_loss: 0.5417, test_loss: 1.3865, test_f1: 0.5919
 epoch: 98, train_loss: 0.5750, test_loss: 1.3091, test_f1: 0.5887
 epoch: 99, train_loss: 0.5177, test_loss: 1.3534, test_f1: 0.5680

Training completed in 1138.67 seconds
Best F1: 0.5980 at epoch 56
Mean F1 across iterations: 0.5915  0.0045
========================FINAL RESULTS================================
FEGIN weighted F1: 0.5980  0.0045
python main.py --data ltspice_examples --representation component_component --model FEGIN --layers 4 --hiddens 64 --batch_size 32 --lr 0.001 --emb_size 128 --epochs 100 --save_appendix component_component_L4_H64_BS32_LR0.001_E128 --no_val
-----



STDERR:
  File "main.py", line 370, in <module>
    main()
  File "main.py", line 254, in main
    dataset = dataset_class(
  File "/home/philip/projects/ltspice_examples_code_repo/Circuit-Completion-Using-GNNs/component_classification_with_link_prediction_head/evaluation/FEGIN/kernel/circuit_datasets.py", line 15, in __init__
    self.data, self.slices = torch.load(self.processed_paths[0])
  File "/home/philip/.local/lib/python3.8/site-packages/torch/serialization.py", line 1040, in load
    warnings.warn(
  File "/usr/lib/python3.8/warnings.py", line 109, in _showwarnmsg
    sw(msg.message, msg.category, msg.filename, msg.lineno,
  File "main.py", line 47, in warn_with_traceback
    traceback.print_stack(file=log)
/home/philip/projects/ltspice_examples_code_repo/Circuit-Completion-Using-GNNs/component_classification_with_link_prediction_head/evaluation/FEGIN/kernel/circuit_datasets.py:15: FutureWarning: You are using `torch.load` with `weights_only=False` (the current default value), which uses the default pickle module implicitly. It is possible to construct malicious pickle data which will execute arbitrary code during unpickling (See https://github.com/pytorch/pytorch/blob/main/SECURITY.md#untrusted-models for more details). In a future release, the default value for `weights_only` will be flipped to `True`. This limits the functions that could be executed during unpickling. Arbitrary objects will no longer be allowed to be loaded via this mode unless they are explicitly allowlisted by the user via `torch.serialization.add_safe_globals`. We recommend you start setting `weights_only=True` for any use case where you don't have full control of the loaded file. Please open an issue on GitHub for any issues related to this experimental feature.
  self.data, self.slices = torch.load(self.processed_paths[0])
