STDOUT:
Results will be saved in /home/philip/projects/ltspice_examples_code_repo/Circuit-Completion-Using-GNNs/component_classification_with_link_prediction_head/evaluation/FEGIN/results/model_FEGIN_dataset_ltspice_examples
Command line input: python main.py --data ltspice_examples --representation component_net --model FEGIN --layers 2 --hiddens 64 --batch_size 64 --lr 0.0001 --emb_size 128 --epochs 100 --save_appendix component_net_L2_H64_BS64_LR0.0001_E128 --no_val
 is saved.
-----
ltspice_examples - FEGIN
Using 2 layers, 64 hidden units, h = 2
Loading component_net representation dataset
ENTERED
Training FEGIN on component_net representation
Train: 3558, Test: 846
##################ITERATION #0 ****************************************
 epoch: 0, train_loss: 1.3604, test_loss: 1.3541, test_f1: 0.2270
 epoch: 1, train_loss: 1.3442, test_loss: 1.3421, test_f1: 0.2270
 epoch: 2, train_loss: 1.3303, test_loss: 1.3267, test_f1: 0.2270
 epoch: 3, train_loss: 1.3108, test_loss: 1.3026, test_f1: 0.2270
 epoch: 4, train_loss: 1.2851, test_loss: 1.2721, test_f1: 0.2271
 epoch: 5, train_loss: 1.2583, test_loss: 1.2465, test_f1: 0.2289
 epoch: 6, train_loss: 1.2361, test_loss: 1.2236, test_f1: 0.2677
 epoch: 7, train_loss: 1.2189, test_loss: 1.1998, test_f1: 0.3062
 epoch: 8, train_loss: 1.1944, test_loss: 1.1738, test_f1: 0.3417
 epoch: 9, train_loss: 1.1781, test_loss: 1.1470, test_f1: 0.3723
 epoch: 10, train_loss: 1.1545, test_loss: 1.1201, test_f1: 0.3954
 epoch: 11, train_loss: 1.1323, test_loss: 1.0909, test_f1: 0.4274
 epoch: 12, train_loss: 1.1069, test_loss: 1.0661, test_f1: 0.4432
 epoch: 13, train_loss: 1.0847, test_loss: 1.0410, test_f1: 0.4378
 epoch: 14, train_loss: 1.0626, test_loss: 1.0215, test_f1: 0.4403
 epoch: 15, train_loss: 1.0400, test_loss: 1.0077, test_f1: 0.4464
 epoch: 16, train_loss: 1.0246, test_loss: 0.9889, test_f1: 0.4609
 epoch: 17, train_loss: 1.0137, test_loss: 0.9748, test_f1: 0.4568
 epoch: 18, train_loss: 0.9977, test_loss: 0.9686, test_f1: 0.4689
 epoch: 19, train_loss: 0.9839, test_loss: 0.9567, test_f1: 0.4691
 epoch: 20, train_loss: 0.9763, test_loss: 0.9555, test_f1: 0.4730
 epoch: 21, train_loss: 0.9694, test_loss: 0.9530, test_f1: 0.4783
 epoch: 22, train_loss: 0.9606, test_loss: 0.9513, test_f1: 0.4720
 epoch: 23, train_loss: 0.9596, test_loss: 0.9475, test_f1: 0.4806
 epoch: 24, train_loss: 0.9486, test_loss: 0.9456, test_f1: 0.4827
 epoch: 25, train_loss: 0.9467, test_loss: 0.9371, test_f1: 0.4870
 epoch: 26, train_loss: 0.9415, test_loss: 0.9365, test_f1: 0.4970
 epoch: 27, train_loss: 0.9378, test_loss: 0.9421, test_f1: 0.4767
 epoch: 28, train_loss: 0.9303, test_loss: 0.9287, test_f1: 0.4989
 epoch: 29, train_loss: 0.9253, test_loss: 0.9329, test_f1: 0.4850
 epoch: 30, train_loss: 0.9254, test_loss: 0.9323, test_f1: 0.4875
 epoch: 31, train_loss: 0.9243, test_loss: 0.9317, test_f1: 0.4999
 epoch: 32, train_loss: 0.9198, test_loss: 0.9312, test_f1: 0.4883
 epoch: 33, train_loss: 0.9172, test_loss: 0.9242, test_f1: 0.4947
 epoch: 34, train_loss: 0.9176, test_loss: 0.9227, test_f1: 0.5013
 epoch: 35, train_loss: 0.9081, test_loss: 0.9224, test_f1: 0.5122
 epoch: 36, train_loss: 0.9134, test_loss: 0.9251, test_f1: 0.5116
 epoch: 37, train_loss: 0.9007, test_loss: 0.9254, test_f1: 0.4899
 epoch: 38, train_loss: 0.9011, test_loss: 0.9184, test_f1: 0.5134
 epoch: 39, train_loss: 0.8985, test_loss: 0.9071, test_f1: 0.5165
 epoch: 40, train_loss: 0.8930, test_loss: 0.9117, test_f1: 0.5156
 epoch: 41, train_loss: 0.8915, test_loss: 0.9240, test_f1: 0.4998
 epoch: 42, train_loss: 0.8852, test_loss: 0.8987, test_f1: 0.5287
 epoch: 43, train_loss: 0.8826, test_loss: 0.9161, test_f1: 0.5069
 epoch: 44, train_loss: 0.8770, test_loss: 0.9146, test_f1: 0.5098
 epoch: 45, train_loss: 0.8861, test_loss: 0.9066, test_f1: 0.5166
 epoch: 46, train_loss: 0.8826, test_loss: 0.9016, test_f1: 0.5199
 epoch: 47, train_loss: 0.8674, test_loss: 0.9088, test_f1: 0.5217
 epoch: 48, train_loss: 0.8729, test_loss: 0.9041, test_f1: 0.5096
 epoch: 49, train_loss: 0.8808, test_loss: 0.9241, test_f1: 0.5086
 epoch: 50, train_loss: 0.8715, test_loss: 0.9098, test_f1: 0.5132
 epoch: 51, train_loss: 0.8696, test_loss: 0.8947, test_f1: 0.5173
 epoch: 52, train_loss: 0.8571, test_loss: 0.9083, test_f1: 0.5146
 epoch: 53, train_loss: 0.8655, test_loss: 0.9066, test_f1: 0.5125
 epoch: 54, train_loss: 0.8640, test_loss: 0.9010, test_f1: 0.5126
 epoch: 55, train_loss: 0.8615, test_loss: 0.8885, test_f1: 0.5163
 epoch: 56, train_loss: 0.8583, test_loss: 0.9052, test_f1: 0.5128
 epoch: 57, train_loss: 0.8489, test_loss: 0.9000, test_f1: 0.5183
 epoch: 58, train_loss: 0.8602, test_loss: 0.9184, test_f1: 0.5139
 epoch: 59, train_loss: 0.8629, test_loss: 0.9224, test_f1: 0.5131
 epoch: 60, train_loss: 0.8567, test_loss: 0.8958, test_f1: 0.5166
 epoch: 61, train_loss: 0.8529, test_loss: 0.8996, test_f1: 0.5133
 epoch: 62, train_loss: 0.8483, test_loss: 0.8972, test_f1: 0.5160
 epoch: 63, train_loss: 0.8515, test_loss: 0.9008, test_f1: 0.5213
 epoch: 64, train_loss: 0.8565, test_loss: 0.9085, test_f1: 0.5222
 epoch: 65, train_loss: 0.8445, test_loss: 0.9071, test_f1: 0.5251
 epoch: 66, train_loss: 0.8427, test_loss: 0.9032, test_f1: 0.5249
 epoch: 67, train_loss: 0.8467, test_loss: 0.9130, test_f1: 0.5145
 epoch: 68, train_loss: 0.8495, test_loss: 0.9140, test_f1: 0.5139
 epoch: 69, train_loss: 0.8409, test_loss: 0.9162, test_f1: 0.5136
 epoch: 70, train_loss: 0.8423, test_loss: 0.9086, test_f1: 0.5175
 epoch: 71, train_loss: 0.8405, test_loss: 0.9157, test_f1: 0.5226
 epoch: 72, train_loss: 0.8391, test_loss: 0.9099, test_f1: 0.5218
 epoch: 73, train_loss: 0.8416, test_loss: 0.8844, test_f1: 0.5192
 epoch: 74, train_loss: 0.8435, test_loss: 0.9093, test_f1: 0.5275
 epoch: 75, train_loss: 0.8427, test_loss: 0.9048, test_f1: 0.5224
 epoch: 76, train_loss: 0.8392, test_loss: 0.9270, test_f1: 0.5190
 epoch: 77, train_loss: 0.8413, test_loss: 0.8995, test_f1: 0.5273
 epoch: 78, train_loss: 0.8364, test_loss: 0.9157, test_f1: 0.5251
 epoch: 79, train_loss: 0.8358, test_loss: 0.9036, test_f1: 0.5278
 epoch: 80, train_loss: 0.8313, test_loss: 0.8997, test_f1: 0.5237
 epoch: 81, train_loss: 0.8451, test_loss: 0.9159, test_f1: 0.5240
 epoch: 82, train_loss: 0.8259, test_loss: 0.9051, test_f1: 0.5270
 epoch: 83, train_loss: 0.8297, test_loss: 0.9259, test_f1: 0.5247
 epoch: 84, train_loss: 0.8327, test_loss: 0.9170, test_f1: 0.5267
 epoch: 85, train_loss: 0.8324, test_loss: 0.9008, test_f1: 0.5273
 epoch: 86, train_loss: 0.8303, test_loss: 0.9244, test_f1: 0.5246
 epoch: 87, train_loss: 0.8287, test_loss: 0.8955, test_f1: 0.5216
 epoch: 88, train_loss: 0.8244, test_loss: 0.9126, test_f1: 0.5280
 epoch: 89, train_loss: 0.8261, test_loss: 0.8998, test_f1: 0.5224
 epoch: 90, train_loss: 0.8246, test_loss: 0.9112, test_f1: 0.5249
 epoch: 91, train_loss: 0.8269, test_loss: 0.9142, test_f1: 0.5288
 epoch: 92, train_loss: 0.8305, test_loss: 0.9241, test_f1: 0.5220
 epoch: 93, train_loss: 0.8236, test_loss: 0.9079, test_f1: 0.5334
 epoch: 94, train_loss: 0.8265, test_loss: 0.9145, test_f1: 0.5280
 epoch: 95, train_loss: 0.8245, test_loss: 0.9162, test_f1: 0.5320
 epoch: 96, train_loss: 0.8179, test_loss: 0.9166, test_f1: 0.5279
 epoch: 97, train_loss: 0.8085, test_loss: 0.9217, test_f1: 0.5262
 epoch: 98, train_loss: 0.8166, test_loss: 0.9135, test_f1: 0.5256
 epoch: 99, train_loss: 0.8142, test_loss: 0.8993, test_f1: 0.5330
##################ITERATION #1 ****************************************
 epoch: 0, train_loss: 1.3087, test_loss: 1.2884, test_f1: 0.2270
 epoch: 1, train_loss: 1.2606, test_loss: 1.2374, test_f1: 0.2783
 epoch: 2, train_loss: 1.2379, test_loss: 1.2087, test_f1: 0.2875
 epoch: 3, train_loss: 1.2133, test_loss: 1.1769, test_f1: 0.3061
 epoch: 4, train_loss: 1.1857, test_loss: 1.1473, test_f1: 0.3517
 epoch: 5, train_loss: 1.1558, test_loss: 1.1177, test_f1: 0.3831
 epoch: 6, train_loss: 1.1300, test_loss: 1.0862, test_f1: 0.3914
 epoch: 7, train_loss: 1.1019, test_loss: 1.0557, test_f1: 0.3850
 epoch: 8, train_loss: 1.0721, test_loss: 1.0393, test_f1: 0.4060
 epoch: 9, train_loss: 1.0546, test_loss: 1.0181, test_f1: 0.4118
 epoch: 10, train_loss: 1.0387, test_loss: 1.0060, test_f1: 0.4360
 epoch: 11, train_loss: 1.0223, test_loss: 0.9955, test_f1: 0.4412
 epoch: 12, train_loss: 1.0106, test_loss: 0.9844, test_f1: 0.4561
 epoch: 13, train_loss: 0.9933, test_loss: 0.9713, test_f1: 0.4690
 epoch: 14, train_loss: 0.9889, test_loss: 0.9658, test_f1: 0.4648
 epoch: 15, train_loss: 0.9781, test_loss: 0.9601, test_f1: 0.4643
 epoch: 16, train_loss: 0.9764, test_loss: 0.9582, test_f1: 0.4738
 epoch: 17, train_loss: 0.9666, test_loss: 0.9533, test_f1: 0.4832
 epoch: 18, train_loss: 0.9588, test_loss: 0.9398, test_f1: 0.4981
 epoch: 19, train_loss: 0.9460, test_loss: 0.9407, test_f1: 0.4946
 epoch: 20, train_loss: 0.9419, test_loss: 0.9240, test_f1: 0.4898
 epoch: 21, train_loss: 0.9454, test_loss: 0.9246, test_f1: 0.4772
 epoch: 22, train_loss: 0.9273, test_loss: 0.9213, test_f1: 0.4981
 epoch: 23, train_loss: 0.9268, test_loss: 0.9159, test_f1: 0.4937
 epoch: 24, train_loss: 0.9210, test_loss: 0.9321, test_f1: 0.4805
 epoch: 25, train_loss: 0.9223, test_loss: 0.9128, test_f1: 0.5021
 epoch: 26, train_loss: 0.9125, test_loss: 0.9186, test_f1: 0.5085
 epoch: 27, train_loss: 0.9085, test_loss: 0.9222, test_f1: 0.5023
 epoch: 28, train_loss: 0.9052, test_loss: 0.9196, test_f1: 0.5167
 epoch: 29, train_loss: 0.9010, test_loss: 0.9005, test_f1: 0.5302
 epoch: 30, train_loss: 0.9021, test_loss: 0.9027, test_f1: 0.5136
 epoch: 31, train_loss: 0.8930, test_loss: 0.9161, test_f1: 0.5139
 epoch: 32, train_loss: 0.8983, test_loss: 0.9054, test_f1: 0.5183
 epoch: 33, train_loss: 0.8904, test_loss: 0.9084, test_f1: 0.5185
 epoch: 34, train_loss: 0.8936, test_loss: 0.9072, test_f1: 0.5229
 epoch: 35, train_loss: 0.8861, test_loss: 0.9123, test_f1: 0.5234
 epoch: 36, train_loss: 0.8805, test_loss: 0.9137, test_f1: 0.5302
 epoch: 37, train_loss: 0.8752, test_loss: 0.8944, test_f1: 0.5448
 epoch: 38, train_loss: 0.8759, test_loss: 0.8950, test_f1: 0.5324
 epoch: 39, train_loss: 0.8702, test_loss: 0.9146, test_f1: 0.5322
 epoch: 40, train_loss: 0.8613, test_loss: 0.9068, test_f1: 0.5387
 epoch: 41, train_loss: 0.8581, test_loss: 0.9072, test_f1: 0.5421
 epoch: 42, train_loss: 0.8689, test_loss: 0.9111, test_f1: 0.5286
 epoch: 43, train_loss: 0.8574, test_loss: 0.9082, test_f1: 0.5361
 epoch: 44, train_loss: 0.8584, test_loss: 0.8987, test_f1: 0.5504
 epoch: 45, train_loss: 0.8521, test_loss: 0.8955, test_f1: 0.5483
 epoch: 46, train_loss: 0.8531, test_loss: 0.9034, test_f1: 0.5443
 epoch: 47, train_loss: 0.8498, test_loss: 0.9106, test_f1: 0.5418
 epoch: 48, train_loss: 0.8547, test_loss: 0.9023, test_f1: 0.5445
 epoch: 49, train_loss: 0.8404, test_loss: 0.9133, test_f1: 0.5360
 epoch: 50, train_loss: 0.8319, test_loss: 0.9079, test_f1: 0.5472
 epoch: 51, train_loss: 0.8340, test_loss: 0.9099, test_f1: 0.5463
 epoch: 52, train_loss: 0.8405, test_loss: 0.9037, test_f1: 0.5625
 epoch: 53, train_loss: 0.8330, test_loss: 0.9034, test_f1: 0.5577
 epoch: 54, train_loss: 0.8320, test_loss: 0.9099, test_f1: 0.5355
 epoch: 55, train_loss: 0.8318, test_loss: 0.9097, test_f1: 0.5417
 epoch: 56, train_loss: 0.8257, test_loss: 0.9029, test_f1: 0.5668
 epoch: 57, train_loss: 0.8216, test_loss: 0.9063, test_f1: 0.5447
 epoch: 58, train_loss: 0.8310, test_loss: 0.9031, test_f1: 0.5571
 epoch: 59, train_loss: 0.8260, test_loss: 0.9098, test_f1: 0.5646
 epoch: 60, train_loss: 0.8218, test_loss: 0.9120, test_f1: 0.5508
 epoch: 61, train_loss: 0.8231, test_loss: 0.9099, test_f1: 0.5505
 epoch: 62, train_loss: 0.8207, test_loss: 0.9073, test_f1: 0.5436
 epoch: 63, train_loss: 0.8258, test_loss: 0.9189, test_f1: 0.5404
 epoch: 64, train_loss: 0.8154, test_loss: 0.9188, test_f1: 0.5350
 epoch: 65, train_loss: 0.8194, test_loss: 0.9090, test_f1: 0.5607
 epoch: 66, train_loss: 0.8153, test_loss: 0.9097, test_f1: 0.5675
 epoch: 67, train_loss: 0.8175, test_loss: 0.9113, test_f1: 0.5552
 epoch: 68, train_loss: 0.8190, test_loss: 0.9126, test_f1: 0.5554
 epoch: 69, train_loss: 0.8159, test_loss: 0.9133, test_f1: 0.5548
 epoch: 70, train_loss: 0.8107, test_loss: 0.9095, test_f1: 0.5570
 epoch: 71, train_loss: 0.8030, test_loss: 0.9072, test_f1: 0.5459
 epoch: 72, train_loss: 0.8058, test_loss: 0.9050, test_f1: 0.5582
 epoch: 73, train_loss: 0.8061, test_loss: 0.9173, test_f1: 0.5477
 epoch: 74, train_loss: 0.8075, test_loss: 0.9106, test_f1: 0.5530
 epoch: 75, train_loss: 0.8094, test_loss: 0.9065, test_f1: 0.5623
 epoch: 76, train_loss: 0.7929, test_loss: 0.9047, test_f1: 0.5583
 epoch: 77, train_loss: 0.8087, test_loss: 0.9066, test_f1: 0.5647
 epoch: 78, train_loss: 0.8003, test_loss: 0.9123, test_f1: 0.5643
 epoch: 79, train_loss: 0.7994, test_loss: 0.9120, test_f1: 0.5512
 epoch: 80, train_loss: 0.8005, test_loss: 0.9100, test_f1: 0.5559
 epoch: 81, train_loss: 0.7941, test_loss: 0.9130, test_f1: 0.5572
 epoch: 82, train_loss: 0.7965, test_loss: 0.9046, test_f1: 0.5720
 epoch: 83, train_loss: 0.8000, test_loss: 0.9086, test_f1: 0.5586
 epoch: 84, train_loss: 0.7935, test_loss: 0.9100, test_f1: 0.5641
 epoch: 85, train_loss: 0.7928, test_loss: 0.9097, test_f1: 0.5610
 epoch: 86, train_loss: 0.7876, test_loss: 0.9100, test_f1: 0.5634
 epoch: 87, train_loss: 0.7930, test_loss: 0.9059, test_f1: 0.5572
 epoch: 88, train_loss: 0.7996, test_loss: 0.9101, test_f1: 0.5635
 epoch: 89, train_loss: 0.7885, test_loss: 0.9073, test_f1: 0.5627
 epoch: 90, train_loss: 0.7859, test_loss: 0.9025, test_f1: 0.5741
 epoch: 91, train_loss: 0.7780, test_loss: 0.9137, test_f1: 0.5658
 epoch: 92, train_loss: 0.7877, test_loss: 0.9108, test_f1: 0.5623
 epoch: 93, train_loss: 0.7785, test_loss: 0.9169, test_f1: 0.5613
 epoch: 94, train_loss: 0.7896, test_loss: 0.9112, test_f1: 0.5670
 epoch: 95, train_loss: 0.7816, test_loss: 0.9127, test_f1: 0.5626
 epoch: 96, train_loss: 0.7863, test_loss: 0.9181, test_f1: 0.5524
 epoch: 97, train_loss: 0.7792, test_loss: 0.9136, test_f1: 0.5587
 epoch: 98, train_loss: 0.7819, test_loss: 0.9110, test_f1: 0.5668
 epoch: 99, train_loss: 0.7768, test_loss: 0.9187, test_f1: 0.5510
##################ITERATION #2 ****************************************
 epoch: 0, train_loss: 1.2873, test_loss: 1.2578, test_f1: 0.2270
 epoch: 1, train_loss: 1.2272, test_loss: 1.1821, test_f1: 0.3361
 epoch: 2, train_loss: 1.1906, test_loss: 1.1461, test_f1: 0.3372
 epoch: 3, train_loss: 1.1560, test_loss: 1.1121, test_f1: 0.3479
 epoch: 4, train_loss: 1.1236, test_loss: 1.0875, test_f1: 0.3619
 epoch: 5, train_loss: 1.0972, test_loss: 1.0620, test_f1: 0.3789
 epoch: 6, train_loss: 1.0777, test_loss: 1.0422, test_f1: 0.4028
 epoch: 7, train_loss: 1.0461, test_loss: 1.0216, test_f1: 0.4141
 epoch: 8, train_loss: 1.0364, test_loss: 1.0104, test_f1: 0.4223
 epoch: 9, train_loss: 1.0214, test_loss: 1.0018, test_f1: 0.4422
 epoch: 10, train_loss: 1.0112, test_loss: 0.9946, test_f1: 0.4531
 epoch: 11, train_loss: 1.0038, test_loss: 0.9842, test_f1: 0.4531
 epoch: 12, train_loss: 0.9981, test_loss: 0.9823, test_f1: 0.4686
 epoch: 13, train_loss: 0.9862, test_loss: 0.9799, test_f1: 0.4794
 epoch: 14, train_loss: 0.9771, test_loss: 0.9593, test_f1: 0.4753
 epoch: 15, train_loss: 0.9739, test_loss: 0.9721, test_f1: 0.4775
 epoch: 16, train_loss: 0.9702, test_loss: 0.9543, test_f1: 0.4873
 epoch: 17, train_loss: 0.9661, test_loss: 0.9520, test_f1: 0.4858
 epoch: 18, train_loss: 0.9549, test_loss: 0.9564, test_f1: 0.4876
 epoch: 19, train_loss: 0.9478, test_loss: 0.9523, test_f1: 0.4875
 epoch: 20, train_loss: 0.9447, test_loss: 0.9482, test_f1: 0.4955
 epoch: 21, train_loss: 0.9390, test_loss: 0.9343, test_f1: 0.5084
 epoch: 22, train_loss: 0.9426, test_loss: 0.9492, test_f1: 0.5000
 epoch: 23, train_loss: 0.9314, test_loss: 0.9395, test_f1: 0.5000
 epoch: 24, train_loss: 0.9270, test_loss: 0.9273, test_f1: 0.5064
 epoch: 25, train_loss: 0.9304, test_loss: 0.9279, test_f1: 0.5222
 epoch: 26, train_loss: 0.9223, test_loss: 0.9170, test_f1: 0.5010
 epoch: 27, train_loss: 0.9196, test_loss: 0.9227, test_f1: 0.5117
 epoch: 28, train_loss: 0.9188, test_loss: 0.9178, test_f1: 0.5193
 epoch: 29, train_loss: 0.9173, test_loss: 0.9147, test_f1: 0.5249
 epoch: 30, train_loss: 0.9212, test_loss: 0.9149, test_f1: 0.5246
 epoch: 31, train_loss: 0.9101, test_loss: 0.9293, test_f1: 0.5293
 epoch: 32, train_loss: 0.9074, test_loss: 0.9146, test_f1: 0.5268
 epoch: 33, train_loss: 0.9026, test_loss: 0.9198, test_f1: 0.5270
 epoch: 34, train_loss: 0.8983, test_loss: 0.8926, test_f1: 0.5343
 epoch: 35, train_loss: 0.8932, test_loss: 0.9270, test_f1: 0.5256
 epoch: 36, train_loss: 0.8938, test_loss: 0.9207, test_f1: 0.5312
 epoch: 37, train_loss: 0.8915, test_loss: 0.9015, test_f1: 0.5350
 epoch: 38, train_loss: 0.8855, test_loss: 0.9151, test_f1: 0.5230
 epoch: 39, train_loss: 0.8806, test_loss: 0.8961, test_f1: 0.5394
 epoch: 40, train_loss: 0.8838, test_loss: 0.9129, test_f1: 0.5355
 epoch: 41, train_loss: 0.8753, test_loss: 0.8986, test_f1: 0.5343
 epoch: 42, train_loss: 0.8768, test_loss: 0.8974, test_f1: 0.5411
 epoch: 43, train_loss: 0.8644, test_loss: 0.9039, test_f1: 0.5332
 epoch: 44, train_loss: 0.8713, test_loss: 0.8941, test_f1: 0.5350
 epoch: 45, train_loss: 0.8660, test_loss: 0.9272, test_f1: 0.5281
 epoch: 46, train_loss: 0.8643, test_loss: 0.8992, test_f1: 0.5526
 epoch: 47, train_loss: 0.8634, test_loss: 0.9064, test_f1: 0.5396
 epoch: 48, train_loss: 0.8628, test_loss: 0.8881, test_f1: 0.5474
 epoch: 49, train_loss: 0.8614, test_loss: 0.9040, test_f1: 0.5469
 epoch: 50, train_loss: 0.8486, test_loss: 0.9141, test_f1: 0.5418
 epoch: 51, train_loss: 0.8574, test_loss: 0.9066, test_f1: 0.5426
 epoch: 52, train_loss: 0.8446, test_loss: 0.9039, test_f1: 0.5455
 epoch: 53, train_loss: 0.8553, test_loss: 0.9004, test_f1: 0.5464
 epoch: 54, train_loss: 0.8423, test_loss: 0.8844, test_f1: 0.5507
 epoch: 55, train_loss: 0.8500, test_loss: 0.9043, test_f1: 0.5405
 epoch: 56, train_loss: 0.8313, test_loss: 0.8891, test_f1: 0.5471
 epoch: 57, train_loss: 0.8399, test_loss: 0.8940, test_f1: 0.5448
 epoch: 58, train_loss: 0.8322, test_loss: 0.9167, test_f1: 0.5383
 epoch: 59, train_loss: 0.8361, test_loss: 0.8902, test_f1: 0.5425
 epoch: 60, train_loss: 0.8255, test_loss: 0.8964, test_f1: 0.5445
 epoch: 61, train_loss: 0.8397, test_loss: 0.8885, test_f1: 0.5544
 epoch: 62, train_loss: 0.8276, test_loss: 0.8929, test_f1: 0.5464
 epoch: 63, train_loss: 0.8273, test_loss: 0.8918, test_f1: 0.5390
 epoch: 64, train_loss: 0.8275, test_loss: 0.8978, test_f1: 0.5474
 epoch: 65, train_loss: 0.8355, test_loss: 0.8851, test_f1: 0.5474
 epoch: 66, train_loss: 0.8256, test_loss: 0.9023, test_f1: 0.5305
 epoch: 67, train_loss: 0.8282, test_loss: 0.9088, test_f1: 0.5401
 epoch: 68, train_loss: 0.8342, test_loss: 0.8964, test_f1: 0.5507
 epoch: 69, train_loss: 0.8265, test_loss: 0.9046, test_f1: 0.5455
 epoch: 70, train_loss: 0.8236, test_loss: 0.9104, test_f1: 0.5377
 epoch: 71, train_loss: 0.8152, test_loss: 0.8902, test_f1: 0.5472
 epoch: 72, train_loss: 0.8210, test_loss: 0.8935, test_f1: 0.5403
 epoch: 73, train_loss: 0.8206, test_loss: 0.9041, test_f1: 0.5391
 epoch: 74, train_loss: 0.8228, test_loss: 0.8792, test_f1: 0.5471
 epoch: 75, train_loss: 0.8206, test_loss: 0.8881, test_f1: 0.5462
 epoch: 76, train_loss: 0.8166, test_loss: 0.9014, test_f1: 0.5371
 epoch: 77, train_loss: 0.8220, test_loss: 0.9050, test_f1: 0.5354
 epoch: 78, train_loss: 0.8126, test_loss: 0.9083, test_f1: 0.5342
 epoch: 79, train_loss: 0.8148, test_loss: 0.9065, test_f1: 0.5419
 epoch: 80, train_loss: 0.8086, test_loss: 0.9024, test_f1: 0.5428
 epoch: 81, train_loss: 0.8135, test_loss: 0.8805, test_f1: 0.5493
 epoch: 82, train_loss: 0.8141, test_loss: 0.9178, test_f1: 0.5401
 epoch: 83, train_loss: 0.8160, test_loss: 0.9022, test_f1: 0.5428
 epoch: 84, train_loss: 0.8121, test_loss: 0.8855, test_f1: 0.5458
 epoch: 85, train_loss: 0.8080, test_loss: 0.8843, test_f1: 0.5382
 epoch: 86, train_loss: 0.8081, test_loss: 0.8911, test_f1: 0.5471
 epoch: 87, train_loss: 0.8021, test_loss: 0.8959, test_f1: 0.5454
 epoch: 88, train_loss: 0.7998, test_loss: 0.8809, test_f1: 0.5487
 epoch: 89, train_loss: 0.8020, test_loss: 0.9028, test_f1: 0.5385
 epoch: 90, train_loss: 0.8052, test_loss: 0.9035, test_f1: 0.5420
 epoch: 91, train_loss: 0.7954, test_loss: 0.8957, test_f1: 0.5360
 epoch: 92, train_loss: 0.7943, test_loss: 0.8959, test_f1: 0.5422
 epoch: 93, train_loss: 0.7953, test_loss: 0.8872, test_f1: 0.5491
 epoch: 94, train_loss: 0.8018, test_loss: 0.9047, test_f1: 0.5399
 epoch: 95, train_loss: 0.7990, test_loss: 0.9030, test_f1: 0.5481
 epoch: 96, train_loss: 0.7927, test_loss: 0.9026, test_f1: 0.5410
 epoch: 97, train_loss: 0.7866, test_loss: 0.9008, test_f1: 0.5374
 epoch: 98, train_loss: 0.7862, test_loss: 0.8955, test_f1: 0.5382
 epoch: 99, train_loss: 0.7922, test_loss: 0.9032, test_f1: 0.5395
##################ITERATION #3 ****************************************
 epoch: 0, train_loss: 1.2625, test_loss: 1.2204, test_f1: 0.2452
 epoch: 1, train_loss: 1.1989, test_loss: 1.1604, test_f1: 0.3663
 epoch: 2, train_loss: 1.1731, test_loss: 1.1292, test_f1: 0.3869
 epoch: 3, train_loss: 1.1450, test_loss: 1.1005, test_f1: 0.4433
 epoch: 4, train_loss: 1.1247, test_loss: 1.0774, test_f1: 0.4470
 epoch: 5, train_loss: 1.1006, test_loss: 1.0585, test_f1: 0.4427
 epoch: 6, train_loss: 1.0773, test_loss: 1.0379, test_f1: 0.4480
 epoch: 7, train_loss: 1.0538, test_loss: 1.0184, test_f1: 0.4580
 epoch: 8, train_loss: 1.0418, test_loss: 1.0031, test_f1: 0.4513
 epoch: 9, train_loss: 1.0222, test_loss: 0.9946, test_f1: 0.4565
 epoch: 10, train_loss: 1.0132, test_loss: 0.9844, test_f1: 0.4603
 epoch: 11, train_loss: 0.9990, test_loss: 0.9815, test_f1: 0.4571
 epoch: 12, train_loss: 0.9886, test_loss: 0.9750, test_f1: 0.4639
 epoch: 13, train_loss: 0.9832, test_loss: 0.9633, test_f1: 0.4680
 epoch: 14, train_loss: 0.9747, test_loss: 0.9673, test_f1: 0.4669
 epoch: 15, train_loss: 0.9580, test_loss: 0.9654, test_f1: 0.4831
 epoch: 16, train_loss: 0.9565, test_loss: 0.9698, test_f1: 0.4870
 epoch: 17, train_loss: 0.9516, test_loss: 0.9598, test_f1: 0.4962
 epoch: 18, train_loss: 0.9527, test_loss: 0.9499, test_f1: 0.4887
 epoch: 19, train_loss: 0.9363, test_loss: 0.9564, test_f1: 0.4913
 epoch: 20, train_loss: 0.9336, test_loss: 0.9617, test_f1: 0.5017
 epoch: 21, train_loss: 0.9299, test_loss: 0.9588, test_f1: 0.5056
 epoch: 22, train_loss: 0.9236, test_loss: 0.9554, test_f1: 0.5135
 epoch: 23, train_loss: 0.9167, test_loss: 0.9432, test_f1: 0.5064
 epoch: 24, train_loss: 0.9099, test_loss: 0.9439, test_f1: 0.5076
 epoch: 25, train_loss: 0.9145, test_loss: 0.9583, test_f1: 0.5144
 epoch: 26, train_loss: 0.9052, test_loss: 0.9496, test_f1: 0.5202
 epoch: 27, train_loss: 0.9084, test_loss: 0.9804, test_f1: 0.5058
 epoch: 28, train_loss: 0.8982, test_loss: 0.9489, test_f1: 0.5068
 epoch: 29, train_loss: 0.8936, test_loss: 0.9263, test_f1: 0.5240
 epoch: 30, train_loss: 0.9055, test_loss: 0.9479, test_f1: 0.5013
 epoch: 31, train_loss: 0.8948, test_loss: 0.9400, test_f1: 0.5229
 epoch: 32, train_loss: 0.8754, test_loss: 0.9476, test_f1: 0.5095
 epoch: 33, train_loss: 0.8827, test_loss: 0.9379, test_f1: 0.5187
 epoch: 34, train_loss: 0.8778, test_loss: 0.9566, test_f1: 0.5012
 epoch: 35, train_loss: 0.8725, test_loss: 0.9539, test_f1: 0.5055
 epoch: 36, train_loss: 0.8591, test_loss: 0.9500, test_f1: 0.5074
 epoch: 37, train_loss: 0.8775, test_loss: 0.9512, test_f1: 0.5068
 epoch: 38, train_loss: 0.8549, test_loss: 0.9432, test_f1: 0.5093
 epoch: 39, train_loss: 0.8610, test_loss: 0.9450, test_f1: 0.5115
 epoch: 40, train_loss: 0.8596, test_loss: 0.9535, test_f1: 0.5067
 epoch: 41, train_loss: 0.8683, test_loss: 0.9624, test_f1: 0.5092
 epoch: 42, train_loss: 0.8498, test_loss: 0.9581, test_f1: 0.5030
 epoch: 43, train_loss: 0.8568, test_loss: 0.9498, test_f1: 0.5116
 epoch: 44, train_loss: 0.8475, test_loss: 0.9505, test_f1: 0.5118
 epoch: 45, train_loss: 0.8510, test_loss: 0.9558, test_f1: 0.5103
 epoch: 46, train_loss: 0.8402, test_loss: 0.9669, test_f1: 0.5093
 epoch: 47, train_loss: 0.8447, test_loss: 0.9438, test_f1: 0.5124
 epoch: 48, train_loss: 0.8313, test_loss: 0.9581, test_f1: 0.5100
 epoch: 49, train_loss: 0.8369, test_loss: 0.9664, test_f1: 0.5039
 epoch: 50, train_loss: 0.8337, test_loss: 0.9866, test_f1: 0.4909
 epoch: 51, train_loss: 0.8305, test_loss: 0.9714, test_f1: 0.5091
 epoch: 52, train_loss: 0.8276, test_loss: 0.9587, test_f1: 0.5017
 epoch: 53, train_loss: 0.8191, test_loss: 0.9782, test_f1: 0.4897
 epoch: 54, train_loss: 0.8315, test_loss: 0.9758, test_f1: 0.5131
 epoch: 55, train_loss: 0.8257, test_loss: 0.9715, test_f1: 0.5043
 epoch: 56, train_loss: 0.8135, test_loss: 0.9672, test_f1: 0.5058
 epoch: 57, train_loss: 0.8137, test_loss: 0.9662, test_f1: 0.5143
 epoch: 58, train_loss: 0.8266, test_loss: 0.9762, test_f1: 0.4930
 epoch: 59, train_loss: 0.8232, test_loss: 0.9786, test_f1: 0.5047
 epoch: 60, train_loss: 0.8240, test_loss: 0.9604, test_f1: 0.5090
 epoch: 61, train_loss: 0.8208, test_loss: 0.9880, test_f1: 0.5063
 epoch: 62, train_loss: 0.8242, test_loss: 0.9722, test_f1: 0.5213
 epoch: 63, train_loss: 0.8167, test_loss: 0.9780, test_f1: 0.5071
 epoch: 64, train_loss: 0.8203, test_loss: 0.9550, test_f1: 0.5114
 epoch: 65, train_loss: 0.8157, test_loss: 0.9803, test_f1: 0.5092
 epoch: 66, train_loss: 0.8187, test_loss: 0.9653, test_f1: 0.5104
 epoch: 67, train_loss: 0.8139, test_loss: 0.9733, test_f1: 0.5078
 epoch: 68, train_loss: 0.8097, test_loss: 0.9718, test_f1: 0.5132
 epoch: 69, train_loss: 0.8122, test_loss: 0.9644, test_f1: 0.4939
 epoch: 70, train_loss: 0.8138, test_loss: 0.9672, test_f1: 0.5090
 epoch: 71, train_loss: 0.7979, test_loss: 0.9744, test_f1: 0.5089
 epoch: 72, train_loss: 0.8075, test_loss: 0.9850, test_f1: 0.5076
 epoch: 73, train_loss: 0.7996, test_loss: 0.9706, test_f1: 0.5090
 epoch: 74, train_loss: 0.7986, test_loss: 0.9717, test_f1: 0.5043
 epoch: 75, train_loss: 0.8067, test_loss: 0.9897, test_f1: 0.4957
 epoch: 76, train_loss: 0.8020, test_loss: 0.9626, test_f1: 0.5028
 epoch: 77, train_loss: 0.7933, test_loss: 0.9769, test_f1: 0.4962
 epoch: 78, train_loss: 0.8032, test_loss: 0.9670, test_f1: 0.5028
 epoch: 79, train_loss: 0.8070, test_loss: 0.9794, test_f1: 0.5079
 epoch: 80, train_loss: 0.8014, test_loss: 0.9884, test_f1: 0.4905
 epoch: 81, train_loss: 0.8061, test_loss: 0.9672, test_f1: 0.5085
 epoch: 82, train_loss: 0.7914, test_loss: 0.9574, test_f1: 0.5060
 epoch: 83, train_loss: 0.8018, test_loss: 0.9718, test_f1: 0.4961
 epoch: 84, train_loss: 0.8004, test_loss: 0.9963, test_f1: 0.4934
 epoch: 85, train_loss: 0.8085, test_loss: 0.9757, test_f1: 0.4975
 epoch: 86, train_loss: 0.8012, test_loss: 0.9826, test_f1: 0.4990
 epoch: 87, train_loss: 0.7984, test_loss: 0.9777, test_f1: 0.5059
 epoch: 88, train_loss: 0.7912, test_loss: 0.9819, test_f1: 0.5083
 epoch: 89, train_loss: 0.7892, test_loss: 0.9901, test_f1: 0.5089
 epoch: 90, train_loss: 0.7876, test_loss: 0.9960, test_f1: 0.5129
 epoch: 91, train_loss: 0.7905, test_loss: 0.9816, test_f1: 0.5091
 epoch: 92, train_loss: 0.7905, test_loss: 1.0006, test_f1: 0.5127
 epoch: 93, train_loss: 0.7902, test_loss: 0.9804, test_f1: 0.5030
 epoch: 94, train_loss: 0.7849, test_loss: 0.9851, test_f1: 0.5138
 epoch: 95, train_loss: 0.7861, test_loss: 0.9929, test_f1: 0.5065
 epoch: 96, train_loss: 0.7922, test_loss: 0.9888, test_f1: 0.5119
 epoch: 97, train_loss: 0.7913, test_loss: 0.9892, test_f1: 0.5106
 epoch: 98, train_loss: 0.7780, test_loss: 0.9979, test_f1: 0.4936
 epoch: 99, train_loss: 0.7809, test_loss: 0.9978, test_f1: 0.5212
##################ITERATION #4 ****************************************
 epoch: 0, train_loss: 1.2557, test_loss: 1.1857, test_f1: 0.2801
 epoch: 1, train_loss: 1.1749, test_loss: 1.1122, test_f1: 0.3813
 epoch: 2, train_loss: 1.1452, test_loss: 1.0869, test_f1: 0.3965
 epoch: 3, train_loss: 1.1196, test_loss: 1.0602, test_f1: 0.4255
 epoch: 4, train_loss: 1.0976, test_loss: 1.0371, test_f1: 0.4457
 epoch: 5, train_loss: 1.0717, test_loss: 1.0258, test_f1: 0.4343
 epoch: 6, train_loss: 1.0594, test_loss: 1.0107, test_f1: 0.4626
 epoch: 7, train_loss: 1.0365, test_loss: 1.0033, test_f1: 0.4675
 epoch: 8, train_loss: 1.0142, test_loss: 0.9874, test_f1: 0.4610
 epoch: 9, train_loss: 1.0103, test_loss: 0.9767, test_f1: 0.5000
 epoch: 10, train_loss: 0.9981, test_loss: 0.9731, test_f1: 0.4818
 epoch: 11, train_loss: 0.9861, test_loss: 0.9622, test_f1: 0.4950
 epoch: 12, train_loss: 0.9765, test_loss: 0.9542, test_f1: 0.4903
 epoch: 13, train_loss: 0.9637, test_loss: 0.9551, test_f1: 0.4940
 epoch: 14, train_loss: 0.9556, test_loss: 0.9467, test_f1: 0.4870
 epoch: 15, train_loss: 0.9613, test_loss: 0.9542, test_f1: 0.4987
 epoch: 16, train_loss: 0.9442, test_loss: 0.9366, test_f1: 0.5178
 epoch: 17, train_loss: 0.9425, test_loss: 0.9416, test_f1: 0.5001
 epoch: 18, train_loss: 0.9374, test_loss: 0.9359, test_f1: 0.4999
 epoch: 19, train_loss: 0.9294, test_loss: 0.9333, test_f1: 0.5091
 epoch: 20, train_loss: 0.9241, test_loss: 0.9368, test_f1: 0.5046
 epoch: 21, train_loss: 0.9184, test_loss: 0.9295, test_f1: 0.5164
 epoch: 22, train_loss: 0.9154, test_loss: 0.9172, test_f1: 0.5375
 epoch: 23, train_loss: 0.9071, test_loss: 0.9200, test_f1: 0.5207
 epoch: 24, train_loss: 0.9045, test_loss: 0.9153, test_f1: 0.5343
 epoch: 25, train_loss: 0.8987, test_loss: 0.9288, test_f1: 0.5080
 epoch: 26, train_loss: 0.8874, test_loss: 0.9180, test_f1: 0.5371
 epoch: 27, train_loss: 0.8971, test_loss: 0.9209, test_f1: 0.5434
 epoch: 28, train_loss: 0.8877, test_loss: 0.9507, test_f1: 0.5036
 epoch: 29, train_loss: 0.8929, test_loss: 0.9207, test_f1: 0.5447
 epoch: 30, train_loss: 0.8830, test_loss: 0.9499, test_f1: 0.5089
 epoch: 31, train_loss: 0.8755, test_loss: 0.9217, test_f1: 0.5301
 epoch: 32, train_loss: 0.8737, test_loss: 0.9248, test_f1: 0.5328
 epoch: 33, train_loss: 0.8802, test_loss: 0.9202, test_f1: 0.5337
 epoch: 34, train_loss: 0.8665, test_loss: 0.9257, test_f1: 0.5239
 epoch: 35, train_loss: 0.8710, test_loss: 0.9205, test_f1: 0.5279
 epoch: 36, train_loss: 0.8603, test_loss: 0.9186, test_f1: 0.5419
 epoch: 37, train_loss: 0.8593, test_loss: 0.9228, test_f1: 0.5240
 epoch: 38, train_loss: 0.8541, test_loss: 0.9350, test_f1: 0.5336
 epoch: 39, train_loss: 0.8539, test_loss: 0.9140, test_f1: 0.5458
 epoch: 40, train_loss: 0.8592, test_loss: 0.9184, test_f1: 0.5457
 epoch: 41, train_loss: 0.8541, test_loss: 0.9180, test_f1: 0.5349
 epoch: 42, train_loss: 0.8444, test_loss: 0.9201, test_f1: 0.5455
 epoch: 43, train_loss: 0.8419, test_loss: 0.9196, test_f1: 0.5303
 epoch: 44, train_loss: 0.8335, test_loss: 0.9127, test_f1: 0.5451
 epoch: 45, train_loss: 0.8409, test_loss: 0.9080, test_f1: 0.5418
 epoch: 46, train_loss: 0.8321, test_loss: 0.9131, test_f1: 0.5379
 epoch: 47, train_loss: 0.8308, test_loss: 0.9052, test_f1: 0.5368
 epoch: 48, train_loss: 0.8289, test_loss: 0.9218, test_f1: 0.5467
 epoch: 49, train_loss: 0.8227, test_loss: 0.8954, test_f1: 0.5493
 epoch: 50, train_loss: 0.8168, test_loss: 0.9127, test_f1: 0.5486
 epoch: 51, train_loss: 0.8225, test_loss: 0.9156, test_f1: 0.5441
 epoch: 52, train_loss: 0.8278, test_loss: 0.9123, test_f1: 0.5444
 epoch: 53, train_loss: 0.8170, test_loss: 0.9153, test_f1: 0.5443
 epoch: 54, train_loss: 0.8122, test_loss: 0.9126, test_f1: 0.5445
 epoch: 55, train_loss: 0.8106, test_loss: 0.9262, test_f1: 0.5394
 epoch: 56, train_loss: 0.8058, test_loss: 0.9220, test_f1: 0.5393
 epoch: 57, train_loss: 0.8093, test_loss: 0.9277, test_f1: 0.5358
 epoch: 58, train_loss: 0.8151, test_loss: 0.9290, test_f1: 0.5352
 epoch: 59, train_loss: 0.8021, test_loss: 0.9187, test_f1: 0.5394
 epoch: 60, train_loss: 0.8086, test_loss: 0.9251, test_f1: 0.5447
 epoch: 61, train_loss: 0.8154, test_loss: 0.9177, test_f1: 0.5383
 epoch: 62, train_loss: 0.7991, test_loss: 0.9261, test_f1: 0.5398
 epoch: 63, train_loss: 0.8024, test_loss: 0.9281, test_f1: 0.5440
 epoch: 64, train_loss: 0.8048, test_loss: 0.9162, test_f1: 0.5359
 epoch: 65, train_loss: 0.8029, test_loss: 0.9173, test_f1: 0.5441
 epoch: 66, train_loss: 0.7995, test_loss: 0.9238, test_f1: 0.5445
 epoch: 67, train_loss: 0.8014, test_loss: 0.9052, test_f1: 0.5436
 epoch: 68, train_loss: 0.7932, test_loss: 0.9139, test_f1: 0.5441
 epoch: 69, train_loss: 0.8068, test_loss: 0.9246, test_f1: 0.5449
 epoch: 70, train_loss: 0.8031, test_loss: 0.9213, test_f1: 0.5537
 epoch: 71, train_loss: 0.7973, test_loss: 0.9390, test_f1: 0.5460
 epoch: 72, train_loss: 0.8048, test_loss: 0.9389, test_f1: 0.5512
 epoch: 73, train_loss: 0.7837, test_loss: 0.9435, test_f1: 0.5483
 epoch: 74, train_loss: 0.7986, test_loss: 0.9166, test_f1: 0.5531
 epoch: 75, train_loss: 0.7972, test_loss: 0.9222, test_f1: 0.5451
 epoch: 76, train_loss: 0.7897, test_loss: 0.9416, test_f1: 0.5398
 epoch: 77, train_loss: 0.7941, test_loss: 0.9478, test_f1: 0.5441
 epoch: 78, train_loss: 0.7799, test_loss: 0.9208, test_f1: 0.5484
 epoch: 79, train_loss: 0.7829, test_loss: 0.9333, test_f1: 0.5519
 epoch: 80, train_loss: 0.7769, test_loss: 0.9310, test_f1: 0.5471
 epoch: 81, train_loss: 0.7875, test_loss: 0.9393, test_f1: 0.5491
 epoch: 82, train_loss: 0.7868, test_loss: 0.9175, test_f1: 0.5567
 epoch: 83, train_loss: 0.7900, test_loss: 0.9210, test_f1: 0.5616
 epoch: 84, train_loss: 0.7813, test_loss: 0.9228, test_f1: 0.5563
 epoch: 85, train_loss: 0.7912, test_loss: 0.9195, test_f1: 0.5527
 epoch: 86, train_loss: 0.7687, test_loss: 0.9289, test_f1: 0.5600
 epoch: 87, train_loss: 0.7773, test_loss: 0.9382, test_f1: 0.5438
 epoch: 88, train_loss: 0.7800, test_loss: 0.9330, test_f1: 0.5547
 epoch: 89, train_loss: 0.7737, test_loss: 0.9229, test_f1: 0.5486
 epoch: 90, train_loss: 0.7777, test_loss: 0.9387, test_f1: 0.5590
 epoch: 91, train_loss: 0.7766, test_loss: 0.9446, test_f1: 0.5598
 epoch: 92, train_loss: 0.7754, test_loss: 0.9321, test_f1: 0.5622
 epoch: 93, train_loss: 0.7699, test_loss: 0.9340, test_f1: 0.5614
 epoch: 94, train_loss: 0.7595, test_loss: 0.9564, test_f1: 0.5602
 epoch: 95, train_loss: 0.7730, test_loss: 0.9340, test_f1: 0.5477
 epoch: 96, train_loss: 0.7665, test_loss: 0.9384, test_f1: 0.5627
 epoch: 97, train_loss: 0.7701, test_loss: 0.9320, test_f1: 0.5543
 epoch: 98, train_loss: 0.7770, test_loss: 0.9412, test_f1: 0.5579
 epoch: 99, train_loss: 0.7702, test_loss: 0.9303, test_f1: 0.5630
##################ITERATION #5 ****************************************
 epoch: 0, train_loss: 1.2897, test_loss: 1.1765, test_f1: 0.3234
 epoch: 1, train_loss: 1.1801, test_loss: 1.1190, test_f1: 0.3469
 epoch: 2, train_loss: 1.1478, test_loss: 1.0800, test_f1: 0.3758
 epoch: 3, train_loss: 1.1156, test_loss: 1.0554, test_f1: 0.3949
 epoch: 4, train_loss: 1.0918, test_loss: 1.0394, test_f1: 0.4256
 epoch: 5, train_loss: 1.0675, test_loss: 1.0303, test_f1: 0.4238
 epoch: 6, train_loss: 1.0445, test_loss: 1.0070, test_f1: 0.4497
 epoch: 7, train_loss: 1.0294, test_loss: 1.0047, test_f1: 0.4549
 epoch: 8, train_loss: 1.0229, test_loss: 0.9943, test_f1: 0.4579
 epoch: 9, train_loss: 1.0118, test_loss: 0.9859, test_f1: 0.4607
 epoch: 10, train_loss: 1.0003, test_loss: 0.9808, test_f1: 0.4571
 epoch: 11, train_loss: 0.9926, test_loss: 0.9682, test_f1: 0.4792
 epoch: 12, train_loss: 0.9800, test_loss: 0.9664, test_f1: 0.4865
 epoch: 13, train_loss: 0.9677, test_loss: 0.9604, test_f1: 0.4823
 epoch: 14, train_loss: 0.9715, test_loss: 0.9524, test_f1: 0.4830
 epoch: 15, train_loss: 0.9641, test_loss: 0.9644, test_f1: 0.5067
 epoch: 16, train_loss: 0.9590, test_loss: 0.9694, test_f1: 0.4903
 epoch: 17, train_loss: 0.9538, test_loss: 0.9540, test_f1: 0.4897
 epoch: 18, train_loss: 0.9423, test_loss: 0.9600, test_f1: 0.4864
 epoch: 19, train_loss: 0.9333, test_loss: 0.9354, test_f1: 0.5097
 epoch: 20, train_loss: 0.9359, test_loss: 0.9604, test_f1: 0.4942
 epoch: 21, train_loss: 0.9303, test_loss: 0.9358, test_f1: 0.5052
 epoch: 22, train_loss: 0.9266, test_loss: 0.9229, test_f1: 0.5155
 epoch: 23, train_loss: 0.9290, test_loss: 0.9404, test_f1: 0.5109
 epoch: 24, train_loss: 0.9185, test_loss: 0.9267, test_f1: 0.5103
 epoch: 25, train_loss: 0.9139, test_loss: 0.9298, test_f1: 0.5154
 epoch: 26, train_loss: 0.9037, test_loss: 0.9292, test_f1: 0.5202
 epoch: 27, train_loss: 0.9083, test_loss: 0.9294, test_f1: 0.5223
 epoch: 28, train_loss: 0.9051, test_loss: 0.9191, test_f1: 0.5111
 epoch: 29, train_loss: 0.9083, test_loss: 0.9264, test_f1: 0.5201
 epoch: 30, train_loss: 0.8958, test_loss: 0.9252, test_f1: 0.5282
 epoch: 31, train_loss: 0.8890, test_loss: 0.9052, test_f1: 0.5200
 epoch: 32, train_loss: 0.8904, test_loss: 0.9126, test_f1: 0.5328
 epoch: 33, train_loss: 0.8874, test_loss: 0.9165, test_f1: 0.5236
 epoch: 34, train_loss: 0.8877, test_loss: 0.9105, test_f1: 0.5312
 epoch: 35, train_loss: 0.8854, test_loss: 0.9278, test_f1: 0.5354
 epoch: 36, train_loss: 0.8821, test_loss: 0.9149, test_f1: 0.5526
 epoch: 37, train_loss: 0.8844, test_loss: 0.9410, test_f1: 0.5302
 epoch: 38, train_loss: 0.8731, test_loss: 0.9255, test_f1: 0.5406
 epoch: 39, train_loss: 0.8626, test_loss: 0.9184, test_f1: 0.5529
 epoch: 40, train_loss: 0.8679, test_loss: 0.9329, test_f1: 0.5335
 epoch: 41, train_loss: 0.8655, test_loss: 0.9265, test_f1: 0.5360
 epoch: 42, train_loss: 0.8676, test_loss: 0.9068, test_f1: 0.5420
 epoch: 43, train_loss: 0.8629, test_loss: 0.9286, test_f1: 0.5362
 epoch: 44, train_loss: 0.8552, test_loss: 0.9259, test_f1: 0.5336
 epoch: 45, train_loss: 0.8424, test_loss: 0.9194, test_f1: 0.5453
 epoch: 46, train_loss: 0.8494, test_loss: 0.9139, test_f1: 0.5378
 epoch: 47, train_loss: 0.8562, test_loss: 0.9247, test_f1: 0.5391
 epoch: 48, train_loss: 0.8406, test_loss: 0.9139, test_f1: 0.5442
 epoch: 49, train_loss: 0.8400, test_loss: 0.9324, test_f1: 0.5423
 epoch: 50, train_loss: 0.8462, test_loss: 0.9201, test_f1: 0.5453
 epoch: 51, train_loss: 0.8351, test_loss: 0.9049, test_f1: 0.5386
 epoch: 52, train_loss: 0.8385, test_loss: 0.9174, test_f1: 0.5442
 epoch: 53, train_loss: 0.8350, test_loss: 0.9130, test_f1: 0.5415
 epoch: 54, train_loss: 0.8331, test_loss: 0.9327, test_f1: 0.5460
 epoch: 55, train_loss: 0.8266, test_loss: 0.9204, test_f1: 0.5405
 epoch: 56, train_loss: 0.8371, test_loss: 0.9152, test_f1: 0.5507
 epoch: 57, train_loss: 0.8265, test_loss: 0.9184, test_f1: 0.5623
 epoch: 58, train_loss: 0.8302, test_loss: 0.9244, test_f1: 0.5373
 epoch: 59, train_loss: 0.8299, test_loss: 0.9182, test_f1: 0.5382
 epoch: 60, train_loss: 0.8261, test_loss: 0.9183, test_f1: 0.5432
 epoch: 61, train_loss: 0.8211, test_loss: 0.9190, test_f1: 0.5467
 epoch: 62, train_loss: 0.8229, test_loss: 0.9205, test_f1: 0.5682
 epoch: 63, train_loss: 0.8247, test_loss: 0.9081, test_f1: 0.5462
 epoch: 64, train_loss: 0.8307, test_loss: 0.9133, test_f1: 0.5426
 epoch: 65, train_loss: 0.8144, test_loss: 0.9116, test_f1: 0.5459
 epoch: 66, train_loss: 0.8163, test_loss: 0.9156, test_f1: 0.5418
 epoch: 67, train_loss: 0.8185, test_loss: 0.9223, test_f1: 0.5361
 epoch: 68, train_loss: 0.8096, test_loss: 0.9237, test_f1: 0.5411
 epoch: 69, train_loss: 0.8181, test_loss: 0.9229, test_f1: 0.5416
 epoch: 70, train_loss: 0.8110, test_loss: 0.9314, test_f1: 0.5424
 epoch: 71, train_loss: 0.8171, test_loss: 0.9141, test_f1: 0.5425
 epoch: 72, train_loss: 0.8236, test_loss: 0.9183, test_f1: 0.5395
 epoch: 73, train_loss: 0.8139, test_loss: 0.9232, test_f1: 0.5469
 epoch: 74, train_loss: 0.8178, test_loss: 0.9173, test_f1: 0.5431
 epoch: 75, train_loss: 0.8132, test_loss: 0.9232, test_f1: 0.5420
 epoch: 76, train_loss: 0.8041, test_loss: 0.9290, test_f1: 0.5427
 epoch: 77, train_loss: 0.8006, test_loss: 0.9230, test_f1: 0.5497
 epoch: 78, train_loss: 0.8158, test_loss: 0.9175, test_f1: 0.5438
 epoch: 79, train_loss: 0.8044, test_loss: 0.9136, test_f1: 0.5463
 epoch: 80, train_loss: 0.7995, test_loss: 0.9247, test_f1: 0.5407
 epoch: 81, train_loss: 0.8069, test_loss: 0.9081, test_f1: 0.5486
 epoch: 82, train_loss: 0.7972, test_loss: 0.9223, test_f1: 0.5462
 epoch: 83, train_loss: 0.7971, test_loss: 0.9127, test_f1: 0.5452
 epoch: 84, train_loss: 0.8000, test_loss: 0.9197, test_f1: 0.5464
 epoch: 85, train_loss: 0.8007, test_loss: 0.9018, test_f1: 0.5453
 epoch: 86, train_loss: 0.8017, test_loss: 0.9086, test_f1: 0.5516
 epoch: 87, train_loss: 0.7968, test_loss: 0.9202, test_f1: 0.5482
 epoch: 88, train_loss: 0.8060, test_loss: 0.9084, test_f1: 0.5451
 epoch: 89, train_loss: 0.8096, test_loss: 0.9082, test_f1: 0.5485
 epoch: 90, train_loss: 0.7925, test_loss: 0.9157, test_f1: 0.5494
 epoch: 91, train_loss: 0.7836, test_loss: 0.9266, test_f1: 0.5644
 epoch: 92, train_loss: 0.7898, test_loss: 0.9153, test_f1: 0.5495
 epoch: 93, train_loss: 0.7895, test_loss: 0.9074, test_f1: 0.5436
 epoch: 94, train_loss: 0.7935, test_loss: 0.9120, test_f1: 0.5554
 epoch: 95, train_loss: 0.7778, test_loss: 0.9112, test_f1: 0.5494
 epoch: 96, train_loss: 0.7966, test_loss: 0.9198, test_f1: 0.5516
 epoch: 97, train_loss: 0.7942, test_loss: 0.9062, test_f1: 0.5505
 epoch: 98, train_loss: 0.7861, test_loss: 0.9177, test_f1: 0.5485
 epoch: 99, train_loss: 0.7943, test_loss: 0.9242, test_f1: 0.5465
##################ITERATION #6 ****************************************
 epoch: 0, train_loss: 1.2761, test_loss: 1.1960, test_f1: 0.2913
 epoch: 1, train_loss: 1.1725, test_loss: 1.0827, test_f1: 0.3873
 epoch: 2, train_loss: 1.1435, test_loss: 1.0587, test_f1: 0.4150
 epoch: 3, train_loss: 1.1098, test_loss: 1.0354, test_f1: 0.4374
 epoch: 4, train_loss: 1.0827, test_loss: 1.0151, test_f1: 0.4364
 epoch: 5, train_loss: 1.0752, test_loss: 1.0138, test_f1: 0.4362
 epoch: 6, train_loss: 1.0513, test_loss: 0.9877, test_f1: 0.4459
 epoch: 7, train_loss: 1.0322, test_loss: 0.9738, test_f1: 0.4472
 epoch: 8, train_loss: 1.0196, test_loss: 0.9650, test_f1: 0.4721
 epoch: 9, train_loss: 1.0027, test_loss: 0.9651, test_f1: 0.4766
 epoch: 10, train_loss: 0.9973, test_loss: 0.9567, test_f1: 0.4796
 epoch: 11, train_loss: 0.9949, test_loss: 0.9559, test_f1: 0.4832
 epoch: 12, train_loss: 0.9904, test_loss: 0.9488, test_f1: 0.4717
 epoch: 13, train_loss: 0.9752, test_loss: 0.9364, test_f1: 0.4799
 epoch: 14, train_loss: 0.9630, test_loss: 0.9376, test_f1: 0.4847
 epoch: 15, train_loss: 0.9611, test_loss: 0.9240, test_f1: 0.4888
 epoch: 16, train_loss: 0.9511, test_loss: 0.9280, test_f1: 0.4902
 epoch: 17, train_loss: 0.9434, test_loss: 0.9197, test_f1: 0.5130
 epoch: 18, train_loss: 0.9362, test_loss: 0.9378, test_f1: 0.5127
 epoch: 19, train_loss: 0.9288, test_loss: 0.9104, test_f1: 0.5192
 epoch: 20, train_loss: 0.9252, test_loss: 0.9102, test_f1: 0.5176
 epoch: 21, train_loss: 0.9313, test_loss: 0.9189, test_f1: 0.5155
 epoch: 22, train_loss: 0.9170, test_loss: 0.9026, test_f1: 0.5139
 epoch: 23, train_loss: 0.9153, test_loss: 0.9169, test_f1: 0.5153
 epoch: 24, train_loss: 0.9110, test_loss: 0.9336, test_f1: 0.5170
 epoch: 25, train_loss: 0.9182, test_loss: 0.8798, test_f1: 0.5317
 epoch: 26, train_loss: 0.9066, test_loss: 0.8902, test_f1: 0.5206
 epoch: 27, train_loss: 0.8988, test_loss: 0.8943, test_f1: 0.5357
 epoch: 28, train_loss: 0.8884, test_loss: 0.9117, test_f1: 0.5155
 epoch: 29, train_loss: 0.8940, test_loss: 0.8898, test_f1: 0.5241
 epoch: 30, train_loss: 0.8872, test_loss: 0.9038, test_f1: 0.5217
 epoch: 31, train_loss: 0.8840, test_loss: 0.8852, test_f1: 0.5338
 epoch: 32, train_loss: 0.8890, test_loss: 0.8970, test_f1: 0.5201
 epoch: 33, train_loss: 0.8739, test_loss: 0.8970, test_f1: 0.5202
 epoch: 34, train_loss: 0.8740, test_loss: 0.9079, test_f1: 0.5408
 epoch: 35, train_loss: 0.8738, test_loss: 0.8808, test_f1: 0.5370
 epoch: 36, train_loss: 0.8734, test_loss: 0.8969, test_f1: 0.5243
 epoch: 37, train_loss: 0.8703, test_loss: 0.9010, test_f1: 0.5339
 epoch: 38, train_loss: 0.8621, test_loss: 0.9125, test_f1: 0.5181
 epoch: 39, train_loss: 0.8644, test_loss: 0.8908, test_f1: 0.5412
 epoch: 40, train_loss: 0.8592, test_loss: 0.8824, test_f1: 0.5358
 epoch: 41, train_loss: 0.8512, test_loss: 0.8956, test_f1: 0.5321
 epoch: 42, train_loss: 0.8469, test_loss: 0.8982, test_f1: 0.5265
 epoch: 43, train_loss: 0.8531, test_loss: 0.8800, test_f1: 0.5355
 epoch: 44, train_loss: 0.8462, test_loss: 0.8981, test_f1: 0.5177
 epoch: 45, train_loss: 0.8444, test_loss: 0.9140, test_f1: 0.5284
 epoch: 46, train_loss: 0.8552, test_loss: 0.8952, test_f1: 0.5273
 epoch: 47, train_loss: 0.8434, test_loss: 0.8994, test_f1: 0.5324
 epoch: 48, train_loss: 0.8415, test_loss: 0.9062, test_f1: 0.5376
 epoch: 49, train_loss: 0.8427, test_loss: 0.9121, test_f1: 0.5326
 epoch: 50, train_loss: 0.8379, test_loss: 0.8984, test_f1: 0.5270
 epoch: 51, train_loss: 0.8331, test_loss: 0.9013, test_f1: 0.5304
 epoch: 52, train_loss: 0.8312, test_loss: 0.9021, test_f1: 0.5316
 epoch: 53, train_loss: 0.8298, test_loss: 0.9075, test_f1: 0.5289
 epoch: 54, train_loss: 0.8278, test_loss: 0.9058, test_f1: 0.5341
 epoch: 55, train_loss: 0.8229, test_loss: 0.9014, test_f1: 0.5294
 epoch: 56, train_loss: 0.8244, test_loss: 0.8999, test_f1: 0.5291
 epoch: 57, train_loss: 0.8288, test_loss: 0.9002, test_f1: 0.5364
 epoch: 58, train_loss: 0.8314, test_loss: 0.9174, test_f1: 0.5293
 epoch: 59, train_loss: 0.8149, test_loss: 0.9184, test_f1: 0.5387
 epoch: 60, train_loss: 0.8268, test_loss: 0.9117, test_f1: 0.5301
 epoch: 61, train_loss: 0.8208, test_loss: 0.9052, test_f1: 0.5318
 epoch: 62, train_loss: 0.8206, test_loss: 0.9022, test_f1: 0.5293
 epoch: 63, train_loss: 0.8184, test_loss: 0.8975, test_f1: 0.5336
 epoch: 64, train_loss: 0.8188, test_loss: 0.9072, test_f1: 0.5377
 epoch: 65, train_loss: 0.8177, test_loss: 0.9062, test_f1: 0.5301
 epoch: 66, train_loss: 0.8123, test_loss: 0.9110, test_f1: 0.5337
 epoch: 67, train_loss: 0.8101, test_loss: 0.9098, test_f1: 0.5394
 epoch: 68, train_loss: 0.8112, test_loss: 0.9186, test_f1: 0.5324
 epoch: 69, train_loss: 0.8093, test_loss: 0.8986, test_f1: 0.5377
 epoch: 70, train_loss: 0.8147, test_loss: 0.9155, test_f1: 0.5356
 epoch: 71, train_loss: 0.8081, test_loss: 0.9280, test_f1: 0.5347
 epoch: 72, train_loss: 0.8168, test_loss: 0.9143, test_f1: 0.5239
 epoch: 73, train_loss: 0.8168, test_loss: 0.9140, test_f1: 0.5416
 epoch: 74, train_loss: 0.8201, test_loss: 0.9037, test_f1: 0.5310
 epoch: 75, train_loss: 0.8018, test_loss: 0.9145, test_f1: 0.5366
 epoch: 76, train_loss: 0.8078, test_loss: 0.9173, test_f1: 0.5340
 epoch: 77, train_loss: 0.8116, test_loss: 0.9068, test_f1: 0.5393
 epoch: 78, train_loss: 0.8078, test_loss: 0.9210, test_f1: 0.5273
 epoch: 79, train_loss: 0.8036, test_loss: 0.9122, test_f1: 0.5346
 epoch: 80, train_loss: 0.8013, test_loss: 0.9017, test_f1: 0.5348
 epoch: 81, train_loss: 0.7946, test_loss: 0.9038, test_f1: 0.5417
 epoch: 82, train_loss: 0.7976, test_loss: 0.9059, test_f1: 0.5406
 epoch: 83, train_loss: 0.8040, test_loss: 0.8998, test_f1: 0.5425
 epoch: 84, train_loss: 0.8012, test_loss: 0.9212, test_f1: 0.5432
 epoch: 85, train_loss: 0.8047, test_loss: 0.9155, test_f1: 0.5332
 epoch: 86, train_loss: 0.7919, test_loss: 0.9079, test_f1: 0.5448
 epoch: 87, train_loss: 0.7969, test_loss: 0.9004, test_f1: 0.5486
 epoch: 88, train_loss: 0.7960, test_loss: 0.9194, test_f1: 0.5368
 epoch: 89, train_loss: 0.7949, test_loss: 0.9086, test_f1: 0.5432
 epoch: 90, train_loss: 0.7945, test_loss: 0.9151, test_f1: 0.5462
 epoch: 91, train_loss: 0.7936, test_loss: 0.9090, test_f1: 0.5462
 epoch: 92, train_loss: 0.7981, test_loss: 0.9132, test_f1: 0.5321
 epoch: 93, train_loss: 0.7911, test_loss: 0.9139, test_f1: 0.5409
 epoch: 94, train_loss: 0.7858, test_loss: 0.9144, test_f1: 0.5458
 epoch: 95, train_loss: 0.7862, test_loss: 0.9213, test_f1: 0.5444
 epoch: 96, train_loss: 0.7865, test_loss: 0.9039, test_f1: 0.5402
 epoch: 97, train_loss: 0.7900, test_loss: 0.9017, test_f1: 0.5377
 epoch: 98, train_loss: 0.7842, test_loss: 0.9156, test_f1: 0.5427
 epoch: 99, train_loss: 0.7913, test_loss: 0.9110, test_f1: 0.5441
##################ITERATION #7 ****************************************
 epoch: 0, train_loss: 1.3185, test_loss: 1.1790, test_f1: 0.2836
 epoch: 1, train_loss: 1.1652, test_loss: 1.0939, test_f1: 0.3904
 epoch: 2, train_loss: 1.1303, test_loss: 1.0588, test_f1: 0.4001
 epoch: 3, train_loss: 1.0990, test_loss: 1.0364, test_f1: 0.4048
 epoch: 4, train_loss: 1.0740, test_loss: 1.0185, test_f1: 0.4046
 epoch: 5, train_loss: 1.0621, test_loss: 1.0023, test_f1: 0.4224
 epoch: 6, train_loss: 1.0447, test_loss: 0.9988, test_f1: 0.4224
 epoch: 7, train_loss: 1.0169, test_loss: 0.9882, test_f1: 0.4269
 epoch: 8, train_loss: 1.0137, test_loss: 0.9827, test_f1: 0.4588
 epoch: 9, train_loss: 1.0064, test_loss: 0.9827, test_f1: 0.4674
 epoch: 10, train_loss: 0.9947, test_loss: 0.9696, test_f1: 0.4833
 epoch: 11, train_loss: 0.9828, test_loss: 0.9724, test_f1: 0.4823
 epoch: 12, train_loss: 0.9734, test_loss: 0.9602, test_f1: 0.4780
 epoch: 13, train_loss: 0.9684, test_loss: 0.9457, test_f1: 0.4954
 epoch: 14, train_loss: 0.9629, test_loss: 0.9591, test_f1: 0.5001
 epoch: 15, train_loss: 0.9496, test_loss: 0.9473, test_f1: 0.5007
 epoch: 16, train_loss: 0.9511, test_loss: 0.9519, test_f1: 0.5022
 epoch: 17, train_loss: 0.9523, test_loss: 0.9547, test_f1: 0.4993
 epoch: 18, train_loss: 0.9437, test_loss: 0.9480, test_f1: 0.4998
 epoch: 19, train_loss: 0.9478, test_loss: 0.9434, test_f1: 0.5112
 epoch: 20, train_loss: 0.9338, test_loss: 0.9420, test_f1: 0.5175
 epoch: 21, train_loss: 0.9313, test_loss: 0.9476, test_f1: 0.5136
 epoch: 22, train_loss: 0.9313, test_loss: 0.9475, test_f1: 0.5054
 epoch: 23, train_loss: 0.9215, test_loss: 0.9404, test_f1: 0.5136
 epoch: 24, train_loss: 0.9233, test_loss: 0.9566, test_f1: 0.5118
 epoch: 25, train_loss: 0.9075, test_loss: 0.9392, test_f1: 0.4977
 epoch: 26, train_loss: 0.9028, test_loss: 0.9476, test_f1: 0.5146
 epoch: 27, train_loss: 0.9057, test_loss: 0.9454, test_f1: 0.5138
 epoch: 28, train_loss: 0.9067, test_loss: 0.9451, test_f1: 0.5181
 epoch: 29, train_loss: 0.9090, test_loss: 0.9451, test_f1: 0.5179
 epoch: 30, train_loss: 0.8958, test_loss: 0.9432, test_f1: 0.5181
 epoch: 31, train_loss: 0.8989, test_loss: 0.9316, test_f1: 0.5250
 epoch: 32, train_loss: 0.8941, test_loss: 0.9403, test_f1: 0.5209
 epoch: 33, train_loss: 0.8864, test_loss: 0.9413, test_f1: 0.5237
 epoch: 34, train_loss: 0.8939, test_loss: 0.9472, test_f1: 0.5121
 epoch: 35, train_loss: 0.8869, test_loss: 0.9312, test_f1: 0.5249
 epoch: 36, train_loss: 0.8791, test_loss: 0.9392, test_f1: 0.5255
 epoch: 37, train_loss: 0.8742, test_loss: 0.9332, test_f1: 0.5262
 epoch: 38, train_loss: 0.8749, test_loss: 0.9257, test_f1: 0.5182
 epoch: 39, train_loss: 0.8733, test_loss: 0.9423, test_f1: 0.5227
 epoch: 40, train_loss: 0.8719, test_loss: 0.9422, test_f1: 0.5192
 epoch: 41, train_loss: 0.8619, test_loss: 0.9459, test_f1: 0.5176
 epoch: 42, train_loss: 0.8621, test_loss: 0.9338, test_f1: 0.5221
 epoch: 43, train_loss: 0.8518, test_loss: 0.9391, test_f1: 0.5282
 epoch: 44, train_loss: 0.8693, test_loss: 0.9302, test_f1: 0.5160
 epoch: 45, train_loss: 0.8510, test_loss: 0.9406, test_f1: 0.5230
 epoch: 46, train_loss: 0.8476, test_loss: 0.9420, test_f1: 0.5180
 epoch: 47, train_loss: 0.8478, test_loss: 0.9366, test_f1: 0.5250
 epoch: 48, train_loss: 0.8406, test_loss: 0.9527, test_f1: 0.5099
 epoch: 49, train_loss: 0.8438, test_loss: 0.9341, test_f1: 0.5293
 epoch: 50, train_loss: 0.8464, test_loss: 0.9433, test_f1: 0.5206
 epoch: 51, train_loss: 0.8326, test_loss: 0.9397, test_f1: 0.5252
 epoch: 52, train_loss: 0.8385, test_loss: 0.9352, test_f1: 0.5263
 epoch: 53, train_loss: 0.8385, test_loss: 0.9391, test_f1: 0.5220
 epoch: 54, train_loss: 0.8357, test_loss: 0.9469, test_f1: 0.5247
 epoch: 55, train_loss: 0.8396, test_loss: 0.9439, test_f1: 0.5258
 epoch: 56, train_loss: 0.8363, test_loss: 0.9388, test_f1: 0.5256
 epoch: 57, train_loss: 0.8294, test_loss: 0.9387, test_f1: 0.5263
 epoch: 58, train_loss: 0.8204, test_loss: 0.9456, test_f1: 0.5343
 epoch: 59, train_loss: 0.8221, test_loss: 0.9414, test_f1: 0.5310
 epoch: 60, train_loss: 0.8252, test_loss: 0.9426, test_f1: 0.5224
 epoch: 61, train_loss: 0.8353, test_loss: 0.9483, test_f1: 0.5223
 epoch: 62, train_loss: 0.8121, test_loss: 0.9544, test_f1: 0.5282
 epoch: 63, train_loss: 0.8210, test_loss: 0.9424, test_f1: 0.5277
 epoch: 64, train_loss: 0.8176, test_loss: 0.9488, test_f1: 0.5298
 epoch: 65, train_loss: 0.8275, test_loss: 0.9569, test_f1: 0.5259
 epoch: 66, train_loss: 0.8148, test_loss: 0.9378, test_f1: 0.5230
 epoch: 67, train_loss: 0.8173, test_loss: 0.9486, test_f1: 0.5252
 epoch: 68, train_loss: 0.8213, test_loss: 0.9429, test_f1: 0.5221
 epoch: 69, train_loss: 0.8153, test_loss: 0.9481, test_f1: 0.5242
 epoch: 70, train_loss: 0.8168, test_loss: 0.9390, test_f1: 0.5325
 epoch: 71, train_loss: 0.8009, test_loss: 0.9445, test_f1: 0.5410
 epoch: 72, train_loss: 0.8051, test_loss: 0.9435, test_f1: 0.5289
 epoch: 73, train_loss: 0.8166, test_loss: 0.9467, test_f1: 0.5325
 epoch: 74, train_loss: 0.8133, test_loss: 0.9435, test_f1: 0.5304
 epoch: 75, train_loss: 0.8151, test_loss: 0.9449, test_f1: 0.5254
 epoch: 76, train_loss: 0.8026, test_loss: 0.9501, test_f1: 0.5294
 epoch: 77, train_loss: 0.8137, test_loss: 0.9483, test_f1: 0.5334
 epoch: 78, train_loss: 0.8188, test_loss: 0.9467, test_f1: 0.5383
 epoch: 79, train_loss: 0.8112, test_loss: 0.9528, test_f1: 0.5348
 epoch: 80, train_loss: 0.8064, test_loss: 0.9498, test_f1: 0.5254
 epoch: 81, train_loss: 0.8069, test_loss: 0.9527, test_f1: 0.5416
 epoch: 82, train_loss: 0.7988, test_loss: 0.9545, test_f1: 0.5296
 epoch: 83, train_loss: 0.8092, test_loss: 0.9538, test_f1: 0.5464
 epoch: 84, train_loss: 0.7972, test_loss: 0.9515, test_f1: 0.5394
 epoch: 85, train_loss: 0.8096, test_loss: 0.9499, test_f1: 0.5438
 epoch: 86, train_loss: 0.7981, test_loss: 0.9450, test_f1: 0.5459
 epoch: 87, train_loss: 0.8044, test_loss: 0.9597, test_f1: 0.5438
 epoch: 88, train_loss: 0.7940, test_loss: 0.9420, test_f1: 0.5357
 epoch: 89, train_loss: 0.7985, test_loss: 0.9569, test_f1: 0.5442
 epoch: 90, train_loss: 0.7946, test_loss: 0.9505, test_f1: 0.5430
 epoch: 91, train_loss: 0.7937, test_loss: 0.9619, test_f1: 0.5324
 epoch: 92, train_loss: 0.7984, test_loss: 0.9505, test_f1: 0.5448
 epoch: 93, train_loss: 0.7933, test_loss: 0.9552, test_f1: 0.5436
 epoch: 94, train_loss: 0.7981, test_loss: 0.9512, test_f1: 0.5489
 epoch: 95, train_loss: 0.7904, test_loss: 0.9573, test_f1: 0.5484
 epoch: 96, train_loss: 0.7957, test_loss: 0.9631, test_f1: 0.5396
 epoch: 97, train_loss: 0.7923, test_loss: 0.9603, test_f1: 0.5443
 epoch: 98, train_loss: 0.7877, test_loss: 0.9586, test_f1: 0.5528
 epoch: 99, train_loss: 0.8023, test_loss: 0.9435, test_f1: 0.5529
##################ITERATION #8 ****************************************
 epoch: 0, train_loss: 1.3209, test_loss: 1.2038, test_f1: 0.2693
 epoch: 1, train_loss: 1.1949, test_loss: 1.0975, test_f1: 0.3617
 epoch: 2, train_loss: 1.1597, test_loss: 1.0715, test_f1: 0.4086
 epoch: 3, train_loss: 1.1177, test_loss: 1.0592, test_f1: 0.4379
 epoch: 4, train_loss: 1.0916, test_loss: 1.0378, test_f1: 0.4354
 epoch: 5, train_loss: 1.0801, test_loss: 1.0272, test_f1: 0.4467
 epoch: 6, train_loss: 1.0606, test_loss: 1.0075, test_f1: 0.4472
 epoch: 7, train_loss: 1.0459, test_loss: 0.9971, test_f1: 0.4636
 epoch: 8, train_loss: 1.0394, test_loss: 0.9894, test_f1: 0.4708
 epoch: 9, train_loss: 1.0193, test_loss: 0.9877, test_f1: 0.4562
 epoch: 10, train_loss: 1.0195, test_loss: 0.9803, test_f1: 0.4601
 epoch: 11, train_loss: 1.0011, test_loss: 0.9721, test_f1: 0.4631
 epoch: 12, train_loss: 0.9943, test_loss: 0.9649, test_f1: 0.4772
 epoch: 13, train_loss: 0.9812, test_loss: 0.9591, test_f1: 0.4875
 epoch: 14, train_loss: 0.9777, test_loss: 0.9559, test_f1: 0.4870
 epoch: 15, train_loss: 0.9795, test_loss: 0.9592, test_f1: 0.4862
 epoch: 16, train_loss: 0.9716, test_loss: 0.9604, test_f1: 0.4860
 epoch: 17, train_loss: 0.9583, test_loss: 0.9496, test_f1: 0.4959
 epoch: 18, train_loss: 0.9481, test_loss: 0.9485, test_f1: 0.4846
 epoch: 19, train_loss: 0.9475, test_loss: 0.9493, test_f1: 0.4930
 epoch: 20, train_loss: 0.9393, test_loss: 0.9501, test_f1: 0.4905
 epoch: 21, train_loss: 0.9367, test_loss: 0.9492, test_f1: 0.5029
 epoch: 22, train_loss: 0.9411, test_loss: 0.9297, test_f1: 0.4954
 epoch: 23, train_loss: 0.9297, test_loss: 0.9341, test_f1: 0.5049
 epoch: 24, train_loss: 0.9241, test_loss: 0.9351, test_f1: 0.5170
 epoch: 25, train_loss: 0.9243, test_loss: 0.9327, test_f1: 0.5217
 epoch: 26, train_loss: 0.9133, test_loss: 0.9438, test_f1: 0.5191
 epoch: 27, train_loss: 0.9094, test_loss: 0.9472, test_f1: 0.5072
 epoch: 28, train_loss: 0.9109, test_loss: 0.9336, test_f1: 0.5299
 epoch: 29, train_loss: 0.9012, test_loss: 0.9205, test_f1: 0.5114
 epoch: 30, train_loss: 0.9061, test_loss: 0.9302, test_f1: 0.5299
 epoch: 31, train_loss: 0.8974, test_loss: 0.9401, test_f1: 0.5293
 epoch: 32, train_loss: 0.9074, test_loss: 0.9330, test_f1: 0.5169
 epoch: 33, train_loss: 0.8942, test_loss: 0.9298, test_f1: 0.5333
 epoch: 34, train_loss: 0.8857, test_loss: 0.9292, test_f1: 0.5385
 epoch: 35, train_loss: 0.8844, test_loss: 0.9261, test_f1: 0.5290
 epoch: 36, train_loss: 0.8822, test_loss: 0.9310, test_f1: 0.5233
 epoch: 37, train_loss: 0.8799, test_loss: 0.9386, test_f1: 0.5304
 epoch: 38, train_loss: 0.8810, test_loss: 0.9246, test_f1: 0.5278
 epoch: 39, train_loss: 0.8774, test_loss: 0.9089, test_f1: 0.5352
 epoch: 40, train_loss: 0.8744, test_loss: 0.9393, test_f1: 0.5236
 epoch: 41, train_loss: 0.8708, test_loss: 0.9158, test_f1: 0.5213
 epoch: 42, train_loss: 0.8745, test_loss: 0.9064, test_f1: 0.5102
 epoch: 43, train_loss: 0.8661, test_loss: 0.9085, test_f1: 0.5350
 epoch: 44, train_loss: 0.8600, test_loss: 0.9135, test_f1: 0.5273
 epoch: 45, train_loss: 0.8681, test_loss: 0.9211, test_f1: 0.5098
 epoch: 46, train_loss: 0.8546, test_loss: 0.9252, test_f1: 0.5222
 epoch: 47, train_loss: 0.8493, test_loss: 0.9500, test_f1: 0.5335
 epoch: 48, train_loss: 0.8516, test_loss: 0.8904, test_f1: 0.5299
 epoch: 49, train_loss: 0.8596, test_loss: 0.9250, test_f1: 0.5267
 epoch: 50, train_loss: 0.8528, test_loss: 0.9256, test_f1: 0.5237
 epoch: 51, train_loss: 0.8459, test_loss: 0.9085, test_f1: 0.5340
 epoch: 52, train_loss: 0.8475, test_loss: 0.9065, test_f1: 0.5399
 epoch: 53, train_loss: 0.8403, test_loss: 0.9222, test_f1: 0.5397
 epoch: 54, train_loss: 0.8388, test_loss: 0.9277, test_f1: 0.5451
 epoch: 55, train_loss: 0.8368, test_loss: 0.9141, test_f1: 0.5332
 epoch: 56, train_loss: 0.8487, test_loss: 0.9125, test_f1: 0.5415
 epoch: 57, train_loss: 0.8400, test_loss: 0.9283, test_f1: 0.5309
 epoch: 58, train_loss: 0.8393, test_loss: 0.9273, test_f1: 0.5383
 epoch: 59, train_loss: 0.8316, test_loss: 0.9250, test_f1: 0.5342
 epoch: 60, train_loss: 0.8310, test_loss: 0.9200, test_f1: 0.5491
 epoch: 61, train_loss: 0.8260, test_loss: 0.9253, test_f1: 0.5452
 epoch: 62, train_loss: 0.8269, test_loss: 0.9182, test_f1: 0.5345
 epoch: 63, train_loss: 0.8372, test_loss: 0.9333, test_f1: 0.5458
 epoch: 64, train_loss: 0.8305, test_loss: 0.9263, test_f1: 0.5444
 epoch: 65, train_loss: 0.8355, test_loss: 0.9122, test_f1: 0.5481
 epoch: 66, train_loss: 0.8294, test_loss: 0.9159, test_f1: 0.5349
 epoch: 67, train_loss: 0.8273, test_loss: 0.9284, test_f1: 0.5281
 epoch: 68, train_loss: 0.8266, test_loss: 0.9291, test_f1: 0.5376
 epoch: 69, train_loss: 0.8338, test_loss: 0.9279, test_f1: 0.5362
 epoch: 70, train_loss: 0.8285, test_loss: 0.9139, test_f1: 0.5526
 epoch: 71, train_loss: 0.8179, test_loss: 0.9216, test_f1: 0.5621
 epoch: 72, train_loss: 0.8221, test_loss: 0.9302, test_f1: 0.5286
 epoch: 73, train_loss: 0.8249, test_loss: 0.9030, test_f1: 0.5483
 epoch: 74, train_loss: 0.8171, test_loss: 0.9082, test_f1: 0.5514
 epoch: 75, train_loss: 0.8197, test_loss: 0.9180, test_f1: 0.5471
 epoch: 76, train_loss: 0.8222, test_loss: 0.9132, test_f1: 0.5396
 epoch: 77, train_loss: 0.8228, test_loss: 0.9141, test_f1: 0.5525
 epoch: 78, train_loss: 0.8158, test_loss: 0.9065, test_f1: 0.5561
 epoch: 79, train_loss: 0.8105, test_loss: 0.9233, test_f1: 0.5366
 epoch: 80, train_loss: 0.8080, test_loss: 0.9283, test_f1: 0.5513
 epoch: 81, train_loss: 0.8065, test_loss: 0.9134, test_f1: 0.5598
 epoch: 82, train_loss: 0.8111, test_loss: 0.9121, test_f1: 0.5468
 epoch: 83, train_loss: 0.8209, test_loss: 0.9235, test_f1: 0.5534
 epoch: 84, train_loss: 0.8030, test_loss: 0.9073, test_f1: 0.5493
 epoch: 85, train_loss: 0.8027, test_loss: 0.9189, test_f1: 0.5482
 epoch: 86, train_loss: 0.8178, test_loss: 0.9259, test_f1: 0.5641
 epoch: 87, train_loss: 0.8040, test_loss: 0.9258, test_f1: 0.5491
 epoch: 88, train_loss: 0.8028, test_loss: 0.9400, test_f1: 0.5454
 epoch: 89, train_loss: 0.8131, test_loss: 0.9311, test_f1: 0.5626
 epoch: 90, train_loss: 0.7939, test_loss: 0.9109, test_f1: 0.5431
 epoch: 91, train_loss: 0.7901, test_loss: 0.9273, test_f1: 0.5609
 epoch: 92, train_loss: 0.7954, test_loss: 0.9294, test_f1: 0.5485
 epoch: 93, train_loss: 0.7941, test_loss: 0.9144, test_f1: 0.5451
 epoch: 94, train_loss: 0.8014, test_loss: 0.9169, test_f1: 0.5572
 epoch: 95, train_loss: 0.7933, test_loss: 0.9184, test_f1: 0.5625
 epoch: 96, train_loss: 0.7967, test_loss: 0.9197, test_f1: 0.5566
 epoch: 97, train_loss: 0.7989, test_loss: 0.9278, test_f1: 0.5578
 epoch: 98, train_loss: 0.7943, test_loss: 0.9419, test_f1: 0.5482
 epoch: 99, train_loss: 0.7880, test_loss: 0.9129, test_f1: 0.5602
##################ITERATION #9 ****************************************
 epoch: 0, train_loss: 1.3522, test_loss: 1.1538, test_f1: 0.3263
 epoch: 1, train_loss: 1.1973, test_loss: 1.0917, test_f1: 0.3689
 epoch: 2, train_loss: 1.1456, test_loss: 1.0658, test_f1: 0.3854
 epoch: 3, train_loss: 1.1190, test_loss: 1.0393, test_f1: 0.4151
 epoch: 4, train_loss: 1.0867, test_loss: 1.0297, test_f1: 0.4173
 epoch: 5, train_loss: 1.0737, test_loss: 1.0150, test_f1: 0.4297
 epoch: 6, train_loss: 1.0573, test_loss: 1.0009, test_f1: 0.4365
 epoch: 7, train_loss: 1.0364, test_loss: 0.9922, test_f1: 0.4543
 epoch: 8, train_loss: 1.0292, test_loss: 0.9888, test_f1: 0.4638
 epoch: 9, train_loss: 1.0061, test_loss: 0.9947, test_f1: 0.4750
 epoch: 10, train_loss: 0.9973, test_loss: 0.9924, test_f1: 0.4695
 epoch: 11, train_loss: 0.9799, test_loss: 0.9857, test_f1: 0.4804
 epoch: 12, train_loss: 0.9806, test_loss: 0.9763, test_f1: 0.4842
 epoch: 13, train_loss: 0.9731, test_loss: 0.9716, test_f1: 0.4791
 epoch: 14, train_loss: 0.9679, test_loss: 0.9632, test_f1: 0.4839
 epoch: 15, train_loss: 0.9574, test_loss: 0.9785, test_f1: 0.4735
 epoch: 16, train_loss: 0.9483, test_loss: 0.9657, test_f1: 0.4876
 epoch: 17, train_loss: 0.9448, test_loss: 0.9565, test_f1: 0.4858
 epoch: 18, train_loss: 0.9436, test_loss: 0.9741, test_f1: 0.4847
 epoch: 19, train_loss: 0.9475, test_loss: 0.9566, test_f1: 0.4884
 epoch: 20, train_loss: 0.9344, test_loss: 0.9574, test_f1: 0.4905
 epoch: 21, train_loss: 0.9383, test_loss: 0.9489, test_f1: 0.4928
 epoch: 22, train_loss: 0.9417, test_loss: 0.9466, test_f1: 0.4929
 epoch: 23, train_loss: 0.9336, test_loss: 0.9447, test_f1: 0.5054
 epoch: 24, train_loss: 0.9207, test_loss: 0.9432, test_f1: 0.4977
 epoch: 25, train_loss: 0.9126, test_loss: 0.9302, test_f1: 0.5003
 epoch: 26, train_loss: 0.9128, test_loss: 0.9413, test_f1: 0.4980
 epoch: 27, train_loss: 0.9191, test_loss: 0.9375, test_f1: 0.5019
 epoch: 28, train_loss: 0.9171, test_loss: 0.9359, test_f1: 0.5003
 epoch: 29, train_loss: 0.9086, test_loss: 0.9380, test_f1: 0.5067
 epoch: 30, train_loss: 0.9069, test_loss: 0.9357, test_f1: 0.5011
 epoch: 31, train_loss: 0.8940, test_loss: 0.9307, test_f1: 0.5025
 epoch: 32, train_loss: 0.8855, test_loss: 0.9321, test_f1: 0.5142
 epoch: 33, train_loss: 0.8836, test_loss: 0.9374, test_f1: 0.5022
 epoch: 34, train_loss: 0.8881, test_loss: 0.9299, test_f1: 0.5101
 epoch: 35, train_loss: 0.8797, test_loss: 0.9375, test_f1: 0.5072
 epoch: 36, train_loss: 0.8827, test_loss: 0.9232, test_f1: 0.5184
 epoch: 37, train_loss: 0.8694, test_loss: 0.9199, test_f1: 0.5297
 epoch: 38, train_loss: 0.8670, test_loss: 0.9345, test_f1: 0.5292
 epoch: 39, train_loss: 0.8778, test_loss: 0.9231, test_f1: 0.5119
 epoch: 40, train_loss: 0.8599, test_loss: 0.9255, test_f1: 0.5176
 epoch: 41, train_loss: 0.8595, test_loss: 0.9182, test_f1: 0.5290
 epoch: 42, train_loss: 0.8670, test_loss: 0.9232, test_f1: 0.5353
 epoch: 43, train_loss: 0.8682, test_loss: 0.9246, test_f1: 0.5296
 epoch: 44, train_loss: 0.8452, test_loss: 0.9307, test_f1: 0.5209
 epoch: 45, train_loss: 0.8629, test_loss: 0.9202, test_f1: 0.5274
 epoch: 46, train_loss: 0.8589, test_loss: 0.9216, test_f1: 0.5267
 epoch: 47, train_loss: 0.8496, test_loss: 0.9154, test_f1: 0.5360
 epoch: 48, train_loss: 0.8433, test_loss: 0.9156, test_f1: 0.5312
 epoch: 49, train_loss: 0.8455, test_loss: 0.9099, test_f1: 0.5291
 epoch: 50, train_loss: 0.8521, test_loss: 0.9502, test_f1: 0.5108
 epoch: 51, train_loss: 0.8418, test_loss: 0.9069, test_f1: 0.5467
 epoch: 52, train_loss: 0.8277, test_loss: 0.9197, test_f1: 0.5389
 epoch: 53, train_loss: 0.8323, test_loss: 0.9139, test_f1: 0.5461
 epoch: 54, train_loss: 0.8388, test_loss: 0.9166, test_f1: 0.5437
 epoch: 55, train_loss: 0.8311, test_loss: 0.9117, test_f1: 0.5168
 epoch: 56, train_loss: 0.8299, test_loss: 0.9144, test_f1: 0.5360
 epoch: 57, train_loss: 0.8293, test_loss: 0.9129, test_f1: 0.5321
 epoch: 58, train_loss: 0.8282, test_loss: 0.9103, test_f1: 0.5417
 epoch: 59, train_loss: 0.8267, test_loss: 0.9190, test_f1: 0.5381
 epoch: 60, train_loss: 0.8331, test_loss: 0.9038, test_f1: 0.5505
 epoch: 61, train_loss: 0.8172, test_loss: 0.9117, test_f1: 0.5293
 epoch: 62, train_loss: 0.8260, test_loss: 0.9056, test_f1: 0.5519
 epoch: 63, train_loss: 0.8129, test_loss: 0.8952, test_f1: 0.5545
 epoch: 64, train_loss: 0.8106, test_loss: 0.8987, test_f1: 0.5533
 epoch: 65, train_loss: 0.8218, test_loss: 0.9043, test_f1: 0.5529
 epoch: 66, train_loss: 0.8189, test_loss: 0.9077, test_f1: 0.5571
 epoch: 67, train_loss: 0.8108, test_loss: 0.8990, test_f1: 0.5432
 epoch: 68, train_loss: 0.8196, test_loss: 0.9024, test_f1: 0.5559
 epoch: 69, train_loss: 0.8093, test_loss: 0.9070, test_f1: 0.5619
 epoch: 70, train_loss: 0.8144, test_loss: 0.8986, test_f1: 0.5372
 epoch: 71, train_loss: 0.8070, test_loss: 0.9152, test_f1: 0.5357
 epoch: 72, train_loss: 0.8140, test_loss: 0.9144, test_f1: 0.5394
 epoch: 73, train_loss: 0.8074, test_loss: 0.9216, test_f1: 0.5407
 epoch: 74, train_loss: 0.7960, test_loss: 0.9116, test_f1: 0.5453
 epoch: 75, train_loss: 0.8006, test_loss: 0.9133, test_f1: 0.5599
 epoch: 76, train_loss: 0.7994, test_loss: 0.9054, test_f1: 0.5462
 epoch: 77, train_loss: 0.7987, test_loss: 0.9063, test_f1: 0.5561
 epoch: 78, train_loss: 0.8046, test_loss: 0.9154, test_f1: 0.5480
 epoch: 79, train_loss: 0.7971, test_loss: 0.9013, test_f1: 0.5614
 epoch: 80, train_loss: 0.7971, test_loss: 0.9056, test_f1: 0.5562
 epoch: 81, train_loss: 0.7808, test_loss: 0.9072, test_f1: 0.5451
 epoch: 82, train_loss: 0.7901, test_loss: 0.9102, test_f1: 0.5644
 epoch: 83, train_loss: 0.7963, test_loss: 0.9159, test_f1: 0.5541
 epoch: 84, train_loss: 0.8026, test_loss: 0.9081, test_f1: 0.5628
 epoch: 85, train_loss: 0.7898, test_loss: 0.9071, test_f1: 0.5578
 epoch: 86, train_loss: 0.8069, test_loss: 0.9096, test_f1: 0.5622
 epoch: 87, train_loss: 0.7891, test_loss: 0.9153, test_f1: 0.5506
 epoch: 88, train_loss: 0.7930, test_loss: 0.9046, test_f1: 0.5591
 epoch: 89, train_loss: 0.7853, test_loss: 0.9076, test_f1: 0.5503
 epoch: 90, train_loss: 0.7834, test_loss: 0.9048, test_f1: 0.5611
 epoch: 91, train_loss: 0.7936, test_loss: 0.9255, test_f1: 0.5551
 epoch: 92, train_loss: 0.7835, test_loss: 0.9070, test_f1: 0.5636
 epoch: 93, train_loss: 0.7790, test_loss: 0.9122, test_f1: 0.5653
 epoch: 94, train_loss: 0.7771, test_loss: 0.9042, test_f1: 0.5654
 epoch: 95, train_loss: 0.7745, test_loss: 0.9088, test_f1: 0.5540
 epoch: 96, train_loss: 0.7849, test_loss: 0.9009, test_f1: 0.5662
 epoch: 97, train_loss: 0.7837, test_loss: 0.9081, test_f1: 0.5711
 epoch: 98, train_loss: 0.7862, test_loss: 0.9084, test_f1: 0.5766
 epoch: 99, train_loss: 0.7797, test_loss: 0.9273, test_f1: 0.5647

Training completed in 553.44 seconds
Best F1: 0.5766 at epoch 98
Mean F1 across iterations: 0.5559  0.0162
========================FINAL RESULTS================================
FEGIN weighted F1: 0.5766  0.0162
python main.py --data ltspice_examples --representation component_net --model FEGIN --layers 2 --hiddens 64 --batch_size 64 --lr 0.0001 --emb_size 128 --epochs 100 --save_appendix component_net_L2_H64_BS64_LR0.0001_E128 --no_val
-----



STDERR:
  File "main.py", line 370, in <module>
    main()
  File "main.py", line 254, in main
    dataset = dataset_class(
  File "/home/philip/projects/ltspice_examples_code_repo/Circuit-Completion-Using-GNNs/component_classification_with_link_prediction_head/evaluation/FEGIN/kernel/circuit_datasets.py", line 15, in __init__
    self.data, self.slices = torch.load(self.processed_paths[0])
  File "/home/philip/.local/lib/python3.8/site-packages/torch/serialization.py", line 1040, in load
    warnings.warn(
  File "/usr/lib/python3.8/warnings.py", line 109, in _showwarnmsg
    sw(msg.message, msg.category, msg.filename, msg.lineno,
  File "main.py", line 47, in warn_with_traceback
    traceback.print_stack(file=log)
/home/philip/projects/ltspice_examples_code_repo/Circuit-Completion-Using-GNNs/component_classification_with_link_prediction_head/evaluation/FEGIN/kernel/circuit_datasets.py:15: FutureWarning: You are using `torch.load` with `weights_only=False` (the current default value), which uses the default pickle module implicitly. It is possible to construct malicious pickle data which will execute arbitrary code during unpickling (See https://github.com/pytorch/pytorch/blob/main/SECURITY.md#untrusted-models for more details). In a future release, the default value for `weights_only` will be flipped to `True`. This limits the functions that could be executed during unpickling. Arbitrary objects will no longer be allowed to be loaded via this mode unless they are explicitly allowlisted by the user via `torch.serialization.add_safe_globals`. We recommend you start setting `weights_only=True` for any use case where you don't have full control of the loaded file. Please open an issue on GitHub for any issues related to this experimental feature.
  self.data, self.slices = torch.load(self.processed_paths[0])
