STDOUT:
Results will be saved in /home/philip/projects/ltspice_examples_code_repo/Circuit-Completion-Using-GNNs/component_classification_with_link_prediction_head/evaluation/FEGIN/results/model_FEGIN_dataset_ltspice_demos
Command line input: python main.py --data ltspice_demos --representation component_net --model FEGIN --layers 2 --hiddens 64 --batch_size 64 --lr 0.0001 --emb_size 128 --epochs 100 --save_appendix component_net_L2_H64_BS64_LR0.0001_E128 --no_val
 is saved.
-----
ltspice_demos - FEGIN
Using 2 layers, 64 hidden units, h = 2
Loading component_net representation dataset
ENTERED
Training FEGIN on component_net representation
Train: 1565, Test: 383
##################ITERATION #0 ****************************************
 epoch: 0, train_loss: 1.3706, test_loss: 1.3641, test_f1: 0.2281
 epoch: 1, train_loss: 1.3594, test_loss: 1.3595, test_f1: 0.2281
 epoch: 2, train_loss: 1.3531, test_loss: 1.3543, test_f1: 0.2281
 epoch: 3, train_loss: 1.3457, test_loss: 1.3491, test_f1: 0.2281
 epoch: 4, train_loss: 1.3373, test_loss: 1.3428, test_f1: 0.2281
 epoch: 5, train_loss: 1.3277, test_loss: 1.3357, test_f1: 0.2281
 epoch: 6, train_loss: 1.3145, test_loss: 1.3270, test_f1: 0.2281
 epoch: 7, train_loss: 1.2989, test_loss: 1.3168, test_f1: 0.2281
 epoch: 8, train_loss: 1.2836, test_loss: 1.3044, test_f1: 0.2629
 epoch: 9, train_loss: 1.2626, test_loss: 1.2911, test_f1: 0.2720
 epoch: 10, train_loss: 1.2429, test_loss: 1.2773, test_f1: 0.2720
 epoch: 11, train_loss: 1.2220, test_loss: 1.2627, test_f1: 0.2720
 epoch: 12, train_loss: 1.2065, test_loss: 1.2502, test_f1: 0.2912
 epoch: 13, train_loss: 1.1853, test_loss: 1.2389, test_f1: 0.3258
 epoch: 14, train_loss: 1.1735, test_loss: 1.2279, test_f1: 0.3256
 epoch: 15, train_loss: 1.1599, test_loss: 1.2191, test_f1: 0.3309
 epoch: 16, train_loss: 1.1468, test_loss: 1.2109, test_f1: 0.3368
 epoch: 17, train_loss: 1.1365, test_loss: 1.2038, test_f1: 0.3436
 epoch: 18, train_loss: 1.1248, test_loss: 1.1954, test_f1: 0.3495
 epoch: 19, train_loss: 1.1132, test_loss: 1.1870, test_f1: 0.3619
 epoch: 20, train_loss: 1.0982, test_loss: 1.1828, test_f1: 0.3688
 epoch: 21, train_loss: 1.0931, test_loss: 1.1766, test_f1: 0.3765
 epoch: 22, train_loss: 1.0838, test_loss: 1.1716, test_f1: 0.3813
 epoch: 23, train_loss: 1.0760, test_loss: 1.1620, test_f1: 0.3897
 epoch: 24, train_loss: 1.0643, test_loss: 1.1621, test_f1: 0.3915
 epoch: 25, train_loss: 1.0657, test_loss: 1.1519, test_f1: 0.3965
 epoch: 26, train_loss: 1.0485, test_loss: 1.1524, test_f1: 0.4112
 epoch: 27, train_loss: 1.0476, test_loss: 1.1390, test_f1: 0.3930
 epoch: 28, train_loss: 1.0341, test_loss: 1.1430, test_f1: 0.4034
 epoch: 29, train_loss: 1.0333, test_loss: 1.1411, test_f1: 0.4096
 epoch: 30, train_loss: 1.0278, test_loss: 1.1304, test_f1: 0.4205
 epoch: 31, train_loss: 1.0200, test_loss: 1.1274, test_f1: 0.4163
 epoch: 32, train_loss: 1.0108, test_loss: 1.1251, test_f1: 0.4138
 epoch: 33, train_loss: 1.0034, test_loss: 1.1225, test_f1: 0.4314
 epoch: 34, train_loss: 1.0061, test_loss: 1.1125, test_f1: 0.4282
 epoch: 35, train_loss: 1.0000, test_loss: 1.1098, test_f1: 0.4575
 epoch: 36, train_loss: 0.9935, test_loss: 1.1125, test_f1: 0.4532
 epoch: 37, train_loss: 0.9835, test_loss: 1.1041, test_f1: 0.4523
 epoch: 38, train_loss: 0.9863, test_loss: 1.1017, test_f1: 0.4632
 epoch: 39, train_loss: 0.9722, test_loss: 1.1164, test_f1: 0.4634
 epoch: 40, train_loss: 0.9700, test_loss: 1.0967, test_f1: 0.4571
 epoch: 41, train_loss: 0.9653, test_loss: 1.0971, test_f1: 0.4603
 epoch: 42, train_loss: 0.9653, test_loss: 1.0927, test_f1: 0.4673
 epoch: 43, train_loss: 0.9512, test_loss: 1.1023, test_f1: 0.4673
 epoch: 44, train_loss: 0.9584, test_loss: 1.0930, test_f1: 0.4605
 epoch: 45, train_loss: 0.9528, test_loss: 1.0794, test_f1: 0.4663
 epoch: 46, train_loss: 0.9416, test_loss: 1.0901, test_f1: 0.4679
 epoch: 47, train_loss: 0.9422, test_loss: 1.0894, test_f1: 0.4917
 epoch: 48, train_loss: 0.9359, test_loss: 1.0861, test_f1: 0.4842
 epoch: 49, train_loss: 0.9332, test_loss: 1.0869, test_f1: 0.4755
 epoch: 50, train_loss: 0.9263, test_loss: 1.0847, test_f1: 0.4760
 epoch: 51, train_loss: 0.9241, test_loss: 1.0786, test_f1: 0.4752
 epoch: 52, train_loss: 0.9205, test_loss: 1.0844, test_f1: 0.4740
 epoch: 53, train_loss: 0.9320, test_loss: 1.0902, test_f1: 0.4757
 epoch: 54, train_loss: 0.9213, test_loss: 1.0726, test_f1: 0.4775
 epoch: 55, train_loss: 0.9207, test_loss: 1.0805, test_f1: 0.4793
 epoch: 56, train_loss: 0.9171, test_loss: 1.0700, test_f1: 0.4742
 epoch: 57, train_loss: 0.9217, test_loss: 1.0713, test_f1: 0.4804
 epoch: 58, train_loss: 0.9096, test_loss: 1.0801, test_f1: 0.4825
 epoch: 59, train_loss: 0.9063, test_loss: 1.0764, test_f1: 0.4837
 epoch: 60, train_loss: 0.9108, test_loss: 1.0678, test_f1: 0.4827
 epoch: 61, train_loss: 0.9037, test_loss: 1.0722, test_f1: 0.4944
 epoch: 62, train_loss: 0.9166, test_loss: 1.0716, test_f1: 0.4830
 epoch: 63, train_loss: 0.8962, test_loss: 1.0743, test_f1: 0.4871
 epoch: 64, train_loss: 0.9022, test_loss: 1.0776, test_f1: 0.4715
 epoch: 65, train_loss: 0.9018, test_loss: 1.0736, test_f1: 0.4820
 epoch: 66, train_loss: 0.8943, test_loss: 1.0826, test_f1: 0.4871
 epoch: 67, train_loss: 0.8998, test_loss: 1.0883, test_f1: 0.4840
 epoch: 68, train_loss: 0.8981, test_loss: 1.0764, test_f1: 0.4870
 epoch: 69, train_loss: 0.8957, test_loss: 1.0741, test_f1: 0.4933
 epoch: 70, train_loss: 0.8953, test_loss: 1.0664, test_f1: 0.5036
 epoch: 71, train_loss: 0.8989, test_loss: 1.0749, test_f1: 0.5003
 epoch: 72, train_loss: 0.8917, test_loss: 1.0853, test_f1: 0.4870
 epoch: 73, train_loss: 0.8920, test_loss: 1.0903, test_f1: 0.4900
 epoch: 74, train_loss: 0.8845, test_loss: 1.0744, test_f1: 0.4871
 epoch: 75, train_loss: 0.8904, test_loss: 1.0805, test_f1: 0.4871
 epoch: 76, train_loss: 0.8910, test_loss: 1.0752, test_f1: 0.4871
 epoch: 77, train_loss: 0.8926, test_loss: 1.0708, test_f1: 0.4944
 epoch: 78, train_loss: 0.8917, test_loss: 1.0780, test_f1: 0.4975
 epoch: 79, train_loss: 0.8936, test_loss: 1.0711, test_f1: 0.5001
 epoch: 80, train_loss: 0.8828, test_loss: 1.0911, test_f1: 0.5136
 epoch: 81, train_loss: 0.8824, test_loss: 1.0807, test_f1: 0.4831
 epoch: 82, train_loss: 0.8814, test_loss: 1.0853, test_f1: 0.4949
 epoch: 83, train_loss: 0.8750, test_loss: 1.0770, test_f1: 0.5074
 epoch: 84, train_loss: 0.8734, test_loss: 1.0865, test_f1: 0.4962
 epoch: 85, train_loss: 0.8693, test_loss: 1.0724, test_f1: 0.4976
 epoch: 86, train_loss: 0.8731, test_loss: 1.0837, test_f1: 0.5038
 epoch: 87, train_loss: 0.8767, test_loss: 1.0826, test_f1: 0.4989
 epoch: 88, train_loss: 0.8804, test_loss: 1.0817, test_f1: 0.5054
 epoch: 89, train_loss: 0.8703, test_loss: 1.0877, test_f1: 0.4980
 epoch: 90, train_loss: 0.8775, test_loss: 1.0931, test_f1: 0.5027
 epoch: 91, train_loss: 0.8587, test_loss: 1.0816, test_f1: 0.4968
 epoch: 92, train_loss: 0.8614, test_loss: 1.0904, test_f1: 0.4980
 epoch: 93, train_loss: 0.8751, test_loss: 1.0965, test_f1: 0.5025
 epoch: 94, train_loss: 0.8579, test_loss: 1.1028, test_f1: 0.4996
 epoch: 95, train_loss: 0.8721, test_loss: 1.0942, test_f1: 0.5064
 epoch: 96, train_loss: 0.8631, test_loss: 1.0948, test_f1: 0.5054
 epoch: 97, train_loss: 0.8575, test_loss: 1.0819, test_f1: 0.5141
 epoch: 98, train_loss: 0.8558, test_loss: 1.0772, test_f1: 0.5201
 epoch: 99, train_loss: 0.8510, test_loss: 1.0899, test_f1: 0.5049
##################ITERATION #1 ****************************************
 epoch: 0, train_loss: 1.3117, test_loss: 1.3316, test_f1: 0.2281
 epoch: 1, train_loss: 1.2718, test_loss: 1.3152, test_f1: 0.2281
 epoch: 2, train_loss: 1.2511, test_loss: 1.2924, test_f1: 0.2281
 epoch: 3, train_loss: 1.2265, test_loss: 1.2740, test_f1: 0.2639
 epoch: 4, train_loss: 1.2041, test_loss: 1.2609, test_f1: 0.2744
 epoch: 5, train_loss: 1.1884, test_loss: 1.2477, test_f1: 0.2794
 epoch: 6, train_loss: 1.1739, test_loss: 1.2388, test_f1: 0.2784
 epoch: 7, train_loss: 1.1593, test_loss: 1.2265, test_f1: 0.2861
 epoch: 8, train_loss: 1.1416, test_loss: 1.2144, test_f1: 0.3065
 epoch: 9, train_loss: 1.1232, test_loss: 1.2032, test_f1: 0.3648
 epoch: 10, train_loss: 1.1166, test_loss: 1.1926, test_f1: 0.3788
 epoch: 11, train_loss: 1.1007, test_loss: 1.1811, test_f1: 0.3790
 epoch: 12, train_loss: 1.0921, test_loss: 1.1705, test_f1: 0.3842
 epoch: 13, train_loss: 1.0831, test_loss: 1.1655, test_f1: 0.3937
 epoch: 14, train_loss: 1.0752, test_loss: 1.1613, test_f1: 0.3964
 epoch: 15, train_loss: 1.0645, test_loss: 1.1541, test_f1: 0.4030
 epoch: 16, train_loss: 1.0519, test_loss: 1.1445, test_f1: 0.4128
 epoch: 17, train_loss: 1.0429, test_loss: 1.1381, test_f1: 0.4114
 epoch: 18, train_loss: 1.0329, test_loss: 1.1307, test_f1: 0.4106
 epoch: 19, train_loss: 1.0272, test_loss: 1.1222, test_f1: 0.4151
 epoch: 20, train_loss: 1.0222, test_loss: 1.1232, test_f1: 0.4216
 epoch: 21, train_loss: 1.0111, test_loss: 1.1099, test_f1: 0.4163
 epoch: 22, train_loss: 1.0133, test_loss: 1.1069, test_f1: 0.4190
 epoch: 23, train_loss: 0.9933, test_loss: 1.1124, test_f1: 0.4328
 epoch: 24, train_loss: 0.9995, test_loss: 1.0918, test_f1: 0.4224
 epoch: 25, train_loss: 0.9901, test_loss: 1.0931, test_f1: 0.4451
 epoch: 26, train_loss: 0.9817, test_loss: 1.0934, test_f1: 0.4389
 epoch: 27, train_loss: 0.9679, test_loss: 1.0828, test_f1: 0.4607
 epoch: 28, train_loss: 0.9666, test_loss: 1.0732, test_f1: 0.4616
 epoch: 29, train_loss: 0.9615, test_loss: 1.0829, test_f1: 0.4613
 epoch: 30, train_loss: 0.9627, test_loss: 1.0713, test_f1: 0.4808
 epoch: 31, train_loss: 0.9548, test_loss: 1.0586, test_f1: 0.4868
 epoch: 32, train_loss: 0.9523, test_loss: 1.0603, test_f1: 0.4825
 epoch: 33, train_loss: 0.9419, test_loss: 1.0668, test_f1: 0.5153
 epoch: 34, train_loss: 0.9416, test_loss: 1.0490, test_f1: 0.4910
 epoch: 35, train_loss: 0.9341, test_loss: 1.0644, test_f1: 0.4982
 epoch: 36, train_loss: 0.9293, test_loss: 1.0474, test_f1: 0.5001
 epoch: 37, train_loss: 0.9242, test_loss: 1.0651, test_f1: 0.5147
 epoch: 38, train_loss: 0.9234, test_loss: 1.0567, test_f1: 0.5164
 epoch: 39, train_loss: 0.9194, test_loss: 1.0566, test_f1: 0.4904
 epoch: 40, train_loss: 0.9222, test_loss: 1.0501, test_f1: 0.4998
 epoch: 41, train_loss: 0.9130, test_loss: 1.0447, test_f1: 0.5004
 epoch: 42, train_loss: 0.9035, test_loss: 1.0509, test_f1: 0.4990
 epoch: 43, train_loss: 0.9031, test_loss: 1.0411, test_f1: 0.5251
 epoch: 44, train_loss: 0.9018, test_loss: 1.0614, test_f1: 0.5049
 epoch: 45, train_loss: 0.8974, test_loss: 1.0489, test_f1: 0.5284
 epoch: 46, train_loss: 0.8948, test_loss: 1.0476, test_f1: 0.5269
 epoch: 47, train_loss: 0.8883, test_loss: 1.0436, test_f1: 0.5334
 epoch: 48, train_loss: 0.8813, test_loss: 1.0478, test_f1: 0.5190
 epoch: 49, train_loss: 0.8951, test_loss: 1.0525, test_f1: 0.5198
 epoch: 50, train_loss: 0.8871, test_loss: 1.0637, test_f1: 0.5291
 epoch: 51, train_loss: 0.8851, test_loss: 1.0595, test_f1: 0.5437
 epoch: 52, train_loss: 0.8778, test_loss: 1.0596, test_f1: 0.5511
 epoch: 53, train_loss: 0.8704, test_loss: 1.0577, test_f1: 0.5506
 epoch: 54, train_loss: 0.8854, test_loss: 1.0597, test_f1: 0.5447
 epoch: 55, train_loss: 0.8775, test_loss: 1.0647, test_f1: 0.5438
 epoch: 56, train_loss: 0.8797, test_loss: 1.0666, test_f1: 0.5434
 epoch: 57, train_loss: 0.8722, test_loss: 1.0628, test_f1: 0.5362
 epoch: 58, train_loss: 0.8657, test_loss: 1.0561, test_f1: 0.5480
 epoch: 59, train_loss: 0.8637, test_loss: 1.0742, test_f1: 0.5466
 epoch: 60, train_loss: 0.8718, test_loss: 1.0556, test_f1: 0.5393
 epoch: 61, train_loss: 0.8651, test_loss: 1.0502, test_f1: 0.5440
 epoch: 62, train_loss: 0.8597, test_loss: 1.0621, test_f1: 0.5446
 epoch: 63, train_loss: 0.8531, test_loss: 1.0543, test_f1: 0.5524
 epoch: 64, train_loss: 0.8725, test_loss: 1.0668, test_f1: 0.5474
 epoch: 65, train_loss: 0.8591, test_loss: 1.0625, test_f1: 0.5438
 epoch: 66, train_loss: 0.8655, test_loss: 1.0581, test_f1: 0.5594
 epoch: 67, train_loss: 0.8692, test_loss: 1.0571, test_f1: 0.5545
 epoch: 68, train_loss: 0.8601, test_loss: 1.0541, test_f1: 0.5539
 epoch: 69, train_loss: 0.8620, test_loss: 1.0524, test_f1: 0.5442
 epoch: 70, train_loss: 0.8606, test_loss: 1.0666, test_f1: 0.5520
 epoch: 71, train_loss: 0.8583, test_loss: 1.0570, test_f1: 0.5433
 epoch: 72, train_loss: 0.8556, test_loss: 1.0591, test_f1: 0.5578
 epoch: 73, train_loss: 0.8553, test_loss: 1.0755, test_f1: 0.5563
 epoch: 74, train_loss: 0.8572, test_loss: 1.0449, test_f1: 0.5539
 epoch: 75, train_loss: 0.8518, test_loss: 1.0635, test_f1: 0.5503
 epoch: 76, train_loss: 0.8655, test_loss: 1.0702, test_f1: 0.5569
 epoch: 77, train_loss: 0.8583, test_loss: 1.0742, test_f1: 0.5478
 epoch: 78, train_loss: 0.8489, test_loss: 1.0652, test_f1: 0.5506
 epoch: 79, train_loss: 0.8458, test_loss: 1.0647, test_f1: 0.5594
 epoch: 80, train_loss: 0.8567, test_loss: 1.0659, test_f1: 0.5455
 epoch: 81, train_loss: 0.8482, test_loss: 1.0704, test_f1: 0.5717
 epoch: 82, train_loss: 0.8506, test_loss: 1.0563, test_f1: 0.5687
 epoch: 83, train_loss: 0.8413, test_loss: 1.0622, test_f1: 0.5599
 epoch: 84, train_loss: 0.8460, test_loss: 1.0745, test_f1: 0.5456
 epoch: 85, train_loss: 0.8405, test_loss: 1.0699, test_f1: 0.5650
 epoch: 86, train_loss: 0.8456, test_loss: 1.0540, test_f1: 0.5763
 epoch: 87, train_loss: 0.8396, test_loss: 1.0682, test_f1: 0.5549
 epoch: 88, train_loss: 0.8440, test_loss: 1.0745, test_f1: 0.5591
 epoch: 89, train_loss: 0.8436, test_loss: 1.0810, test_f1: 0.5595
 epoch: 90, train_loss: 0.8366, test_loss: 1.0727, test_f1: 0.5489
 epoch: 91, train_loss: 0.8326, test_loss: 1.0744, test_f1: 0.5560
 epoch: 92, train_loss: 0.8350, test_loss: 1.0811, test_f1: 0.5573
 epoch: 93, train_loss: 0.8426, test_loss: 1.0756, test_f1: 0.5758
 epoch: 94, train_loss: 0.8304, test_loss: 1.0756, test_f1: 0.5585
 epoch: 95, train_loss: 0.8360, test_loss: 1.0789, test_f1: 0.5562
 epoch: 96, train_loss: 0.8258, test_loss: 1.0789, test_f1: 0.5581
 epoch: 97, train_loss: 0.8293, test_loss: 1.0833, test_f1: 0.5517
 epoch: 98, train_loss: 0.8193, test_loss: 1.0787, test_f1: 0.5626
 epoch: 99, train_loss: 0.8233, test_loss: 1.0678, test_f1: 0.5698
##################ITERATION #2 ****************************************
 epoch: 0, train_loss: 1.3062, test_loss: 1.3206, test_f1: 0.2281
 epoch: 1, train_loss: 1.2414, test_loss: 1.2869, test_f1: 0.2281
 epoch: 2, train_loss: 1.2150, test_loss: 1.2574, test_f1: 0.2336
 epoch: 3, train_loss: 1.1916, test_loss: 1.2361, test_f1: 0.2390
 epoch: 4, train_loss: 1.1656, test_loss: 1.2195, test_f1: 0.2857
 epoch: 5, train_loss: 1.1453, test_loss: 1.2036, test_f1: 0.3063
 epoch: 6, train_loss: 1.1266, test_loss: 1.1901, test_f1: 0.3464
 epoch: 7, train_loss: 1.1092, test_loss: 1.1815, test_f1: 0.3428
 epoch: 8, train_loss: 1.0958, test_loss: 1.1710, test_f1: 0.3508
 epoch: 9, train_loss: 1.0846, test_loss: 1.1640, test_f1: 0.3535
 epoch: 10, train_loss: 1.0690, test_loss: 1.1594, test_f1: 0.3517
 epoch: 11, train_loss: 1.0696, test_loss: 1.1520, test_f1: 0.3539
 epoch: 12, train_loss: 1.0590, test_loss: 1.1496, test_f1: 0.3522
 epoch: 13, train_loss: 1.0454, test_loss: 1.1436, test_f1: 0.3519
 epoch: 14, train_loss: 1.0354, test_loss: 1.1350, test_f1: 0.3521
 epoch: 15, train_loss: 1.0383, test_loss: 1.1275, test_f1: 0.3564
 epoch: 16, train_loss: 1.0365, test_loss: 1.1284, test_f1: 0.3909
 epoch: 17, train_loss: 1.0167, test_loss: 1.1298, test_f1: 0.3881
 epoch: 18, train_loss: 1.0139, test_loss: 1.1286, test_f1: 0.4253
 epoch: 19, train_loss: 1.0157, test_loss: 1.1199, test_f1: 0.4306
 epoch: 20, train_loss: 1.0178, test_loss: 1.1137, test_f1: 0.4327
 epoch: 21, train_loss: 1.0027, test_loss: 1.1080, test_f1: 0.4372
 epoch: 22, train_loss: 1.0019, test_loss: 1.1110, test_f1: 0.4421
 epoch: 23, train_loss: 0.9893, test_loss: 1.0965, test_f1: 0.4390
 epoch: 24, train_loss: 0.9832, test_loss: 1.1024, test_f1: 0.4563
 epoch: 25, train_loss: 0.9837, test_loss: 1.0880, test_f1: 0.4541
 epoch: 26, train_loss: 0.9711, test_loss: 1.0859, test_f1: 0.4656
 epoch: 27, train_loss: 0.9629, test_loss: 1.0910, test_f1: 0.4594
 epoch: 28, train_loss: 0.9656, test_loss: 1.0852, test_f1: 0.4906
 epoch: 29, train_loss: 0.9658, test_loss: 1.0801, test_f1: 0.4721
 epoch: 30, train_loss: 0.9530, test_loss: 1.0768, test_f1: 0.4767
 epoch: 31, train_loss: 0.9538, test_loss: 1.0717, test_f1: 0.4661
 epoch: 32, train_loss: 0.9489, test_loss: 1.0697, test_f1: 0.4791
 epoch: 33, train_loss: 0.9513, test_loss: 1.0614, test_f1: 0.5087
 epoch: 34, train_loss: 0.9349, test_loss: 1.0672, test_f1: 0.4786
 epoch: 35, train_loss: 0.9294, test_loss: 1.0685, test_f1: 0.4996
 epoch: 36, train_loss: 0.9296, test_loss: 1.0627, test_f1: 0.4959
 epoch: 37, train_loss: 0.9108, test_loss: 1.0651, test_f1: 0.4888
 epoch: 38, train_loss: 0.9238, test_loss: 1.0579, test_f1: 0.5133
 epoch: 39, train_loss: 0.9201, test_loss: 1.0697, test_f1: 0.4957
 epoch: 40, train_loss: 0.9148, test_loss: 1.0652, test_f1: 0.5204
 epoch: 41, train_loss: 0.9120, test_loss: 1.0872, test_f1: 0.5297
 epoch: 42, train_loss: 0.9087, test_loss: 1.0670, test_f1: 0.5310
 epoch: 43, train_loss: 0.9033, test_loss: 1.0731, test_f1: 0.5349
 epoch: 44, train_loss: 0.9028, test_loss: 1.0872, test_f1: 0.5274
 epoch: 45, train_loss: 0.8859, test_loss: 1.0768, test_f1: 0.5299
 epoch: 46, train_loss: 0.8941, test_loss: 1.0755, test_f1: 0.5032
 epoch: 47, train_loss: 0.8834, test_loss: 1.0752, test_f1: 0.5173
 epoch: 48, train_loss: 0.8972, test_loss: 1.0834, test_f1: 0.5067
 epoch: 49, train_loss: 0.8837, test_loss: 1.0916, test_f1: 0.5202
 epoch: 50, train_loss: 0.8813, test_loss: 1.0992, test_f1: 0.5061
 epoch: 51, train_loss: 0.8806, test_loss: 1.0811, test_f1: 0.4990
 epoch: 52, train_loss: 0.8758, test_loss: 1.0885, test_f1: 0.5155
 epoch: 53, train_loss: 0.8749, test_loss: 1.0849, test_f1: 0.5032
 epoch: 54, train_loss: 0.8676, test_loss: 1.0999, test_f1: 0.5288
 epoch: 55, train_loss: 0.8638, test_loss: 1.0919, test_f1: 0.5177
 epoch: 56, train_loss: 0.8620, test_loss: 1.0887, test_f1: 0.5233
 epoch: 57, train_loss: 0.8641, test_loss: 1.0975, test_f1: 0.4975
 epoch: 58, train_loss: 0.8628, test_loss: 1.1046, test_f1: 0.5280
 epoch: 59, train_loss: 0.8627, test_loss: 1.1137, test_f1: 0.5184
 epoch: 60, train_loss: 0.8653, test_loss: 1.0986, test_f1: 0.5264
 epoch: 61, train_loss: 0.8706, test_loss: 1.1083, test_f1: 0.5195
 epoch: 62, train_loss: 0.8584, test_loss: 1.1042, test_f1: 0.5060
 epoch: 63, train_loss: 0.8621, test_loss: 1.1125, test_f1: 0.5076
 epoch: 64, train_loss: 0.8486, test_loss: 1.1252, test_f1: 0.5303
 epoch: 65, train_loss: 0.8621, test_loss: 1.1139, test_f1: 0.5184
 epoch: 66, train_loss: 0.8632, test_loss: 1.1159, test_f1: 0.5132
 epoch: 67, train_loss: 0.8502, test_loss: 1.1180, test_f1: 0.5320
 epoch: 68, train_loss: 0.8593, test_loss: 1.1120, test_f1: 0.5392
 epoch: 69, train_loss: 0.8440, test_loss: 1.1148, test_f1: 0.5338
 epoch: 70, train_loss: 0.8608, test_loss: 1.1169, test_f1: 0.5415
 epoch: 71, train_loss: 0.8415, test_loss: 1.1139, test_f1: 0.5357
 epoch: 72, train_loss: 0.8424, test_loss: 1.1088, test_f1: 0.5411
 epoch: 73, train_loss: 0.8448, test_loss: 1.1099, test_f1: 0.5406
 epoch: 74, train_loss: 0.8391, test_loss: 1.1168, test_f1: 0.5545
 epoch: 75, train_loss: 0.8444, test_loss: 1.1309, test_f1: 0.5313
 epoch: 76, train_loss: 0.8414, test_loss: 1.1334, test_f1: 0.5403
 epoch: 77, train_loss: 0.8349, test_loss: 1.1129, test_f1: 0.5447
 epoch: 78, train_loss: 0.8365, test_loss: 1.1119, test_f1: 0.5316
 epoch: 79, train_loss: 0.8406, test_loss: 1.1138, test_f1: 0.5416
 epoch: 80, train_loss: 0.8462, test_loss: 1.1178, test_f1: 0.5353
 epoch: 81, train_loss: 0.8444, test_loss: 1.1480, test_f1: 0.5320
 epoch: 82, train_loss: 0.8366, test_loss: 1.1317, test_f1: 0.5351
 epoch: 83, train_loss: 0.8391, test_loss: 1.1479, test_f1: 0.5279
 epoch: 84, train_loss: 0.8225, test_loss: 1.1423, test_f1: 0.5309
 epoch: 85, train_loss: 0.8288, test_loss: 1.1375, test_f1: 0.5429
 epoch: 86, train_loss: 0.8354, test_loss: 1.1240, test_f1: 0.5328
 epoch: 87, train_loss: 0.8281, test_loss: 1.1225, test_f1: 0.5326
 epoch: 88, train_loss: 0.8270, test_loss: 1.1344, test_f1: 0.5340
 epoch: 89, train_loss: 0.8254, test_loss: 1.1379, test_f1: 0.5397
 epoch: 90, train_loss: 0.8370, test_loss: 1.1375, test_f1: 0.5418
 epoch: 91, train_loss: 0.8252, test_loss: 1.1401, test_f1: 0.5560
 epoch: 92, train_loss: 0.8199, test_loss: 1.1308, test_f1: 0.5495
 epoch: 93, train_loss: 0.8291, test_loss: 1.1664, test_f1: 0.5386
 epoch: 94, train_loss: 0.8264, test_loss: 1.1267, test_f1: 0.5437
 epoch: 95, train_loss: 0.8161, test_loss: 1.1340, test_f1: 0.5311
 epoch: 96, train_loss: 0.8279, test_loss: 1.1554, test_f1: 0.5447
 epoch: 97, train_loss: 0.8215, test_loss: 1.1504, test_f1: 0.5386
 epoch: 98, train_loss: 0.8200, test_loss: 1.1551, test_f1: 0.5278
 epoch: 99, train_loss: 0.8143, test_loss: 1.1345, test_f1: 0.5303
##################ITERATION #3 ****************************************
 epoch: 0, train_loss: 1.2543, test_loss: 1.3014, test_f1: 0.2281
 epoch: 1, train_loss: 1.1984, test_loss: 1.2801, test_f1: 0.2281
 epoch: 2, train_loss: 1.1704, test_loss: 1.2518, test_f1: 0.2744
 epoch: 3, train_loss: 1.1505, test_loss: 1.2242, test_f1: 0.3117
 epoch: 4, train_loss: 1.1284, test_loss: 1.2107, test_f1: 0.3341
 epoch: 5, train_loss: 1.1212, test_loss: 1.1998, test_f1: 0.3462
 epoch: 6, train_loss: 1.1095, test_loss: 1.1912, test_f1: 0.3986
 epoch: 7, train_loss: 1.0949, test_loss: 1.1830, test_f1: 0.4079
 epoch: 8, train_loss: 1.0859, test_loss: 1.1739, test_f1: 0.4164
 epoch: 9, train_loss: 1.0816, test_loss: 1.1677, test_f1: 0.4104
 epoch: 10, train_loss: 1.0728, test_loss: 1.1627, test_f1: 0.4128
 epoch: 11, train_loss: 1.0634, test_loss: 1.1577, test_f1: 0.4124
 epoch: 12, train_loss: 1.0563, test_loss: 1.1481, test_f1: 0.4125
 epoch: 13, train_loss: 1.0538, test_loss: 1.1446, test_f1: 0.4186
 epoch: 14, train_loss: 1.0407, test_loss: 1.1405, test_f1: 0.4320
 epoch: 15, train_loss: 1.0299, test_loss: 1.1359, test_f1: 0.4288
 epoch: 16, train_loss: 1.0338, test_loss: 1.1245, test_f1: 0.4420
 epoch: 17, train_loss: 1.0270, test_loss: 1.1301, test_f1: 0.4644
 epoch: 18, train_loss: 1.0129, test_loss: 1.1208, test_f1: 0.4648
 epoch: 19, train_loss: 1.0180, test_loss: 1.1204, test_f1: 0.4667
 epoch: 20, train_loss: 1.0000, test_loss: 1.1110, test_f1: 0.4739
 epoch: 21, train_loss: 0.9939, test_loss: 1.1186, test_f1: 0.4862
 epoch: 22, train_loss: 0.9976, test_loss: 1.1017, test_f1: 0.4746
 epoch: 23, train_loss: 0.9913, test_loss: 1.1009, test_f1: 0.4743
 epoch: 24, train_loss: 0.9802, test_loss: 1.1015, test_f1: 0.4686
 epoch: 25, train_loss: 0.9756, test_loss: 1.1006, test_f1: 0.4879
 epoch: 26, train_loss: 0.9784, test_loss: 1.0812, test_f1: 0.4921
 epoch: 27, train_loss: 0.9777, test_loss: 1.0850, test_f1: 0.4964
 epoch: 28, train_loss: 0.9660, test_loss: 1.0748, test_f1: 0.4890
 epoch: 29, train_loss: 0.9621, test_loss: 1.0817, test_f1: 0.4981
 epoch: 30, train_loss: 0.9485, test_loss: 1.0748, test_f1: 0.4863
 epoch: 31, train_loss: 0.9476, test_loss: 1.0714, test_f1: 0.5005
 epoch: 32, train_loss: 0.9502, test_loss: 1.0724, test_f1: 0.5006
 epoch: 33, train_loss: 0.9373, test_loss: 1.0735, test_f1: 0.5192
 epoch: 34, train_loss: 0.9312, test_loss: 1.0676, test_f1: 0.5051
 epoch: 35, train_loss: 0.9253, test_loss: 1.0747, test_f1: 0.5011
 epoch: 36, train_loss: 0.9322, test_loss: 1.0614, test_f1: 0.5164
 epoch: 37, train_loss: 0.9195, test_loss: 1.0550, test_f1: 0.5049
 epoch: 38, train_loss: 0.9198, test_loss: 1.0545, test_f1: 0.5040
 epoch: 39, train_loss: 0.9140, test_loss: 1.0581, test_f1: 0.5137
 epoch: 40, train_loss: 0.9156, test_loss: 1.0618, test_f1: 0.5041
 epoch: 41, train_loss: 0.9121, test_loss: 1.0618, test_f1: 0.5086
 epoch: 42, train_loss: 0.8990, test_loss: 1.0740, test_f1: 0.5036
 epoch: 43, train_loss: 0.8961, test_loss: 1.0417, test_f1: 0.5242
 epoch: 44, train_loss: 0.9047, test_loss: 1.0462, test_f1: 0.5375
 epoch: 45, train_loss: 0.8949, test_loss: 1.0374, test_f1: 0.5227
 epoch: 46, train_loss: 0.8890, test_loss: 1.0402, test_f1: 0.5184
 epoch: 47, train_loss: 0.8821, test_loss: 1.0419, test_f1: 0.5286
 epoch: 48, train_loss: 0.8798, test_loss: 1.0449, test_f1: 0.5375
 epoch: 49, train_loss: 0.8774, test_loss: 1.0477, test_f1: 0.5338
 epoch: 50, train_loss: 0.8795, test_loss: 1.0217, test_f1: 0.5381
 epoch: 51, train_loss: 0.8635, test_loss: 1.0276, test_f1: 0.5332
 epoch: 52, train_loss: 0.8651, test_loss: 1.0360, test_f1: 0.5477
 epoch: 53, train_loss: 0.8720, test_loss: 1.0362, test_f1: 0.5383
 epoch: 54, train_loss: 0.8582, test_loss: 1.0493, test_f1: 0.5362
 epoch: 55, train_loss: 0.8660, test_loss: 1.0307, test_f1: 0.5397
 epoch: 56, train_loss: 0.8633, test_loss: 1.0285, test_f1: 0.5539
 epoch: 57, train_loss: 0.8564, test_loss: 1.0418, test_f1: 0.5625
 epoch: 58, train_loss: 0.8633, test_loss: 1.0395, test_f1: 0.5594
 epoch: 59, train_loss: 0.8641, test_loss: 1.0379, test_f1: 0.5579
 epoch: 60, train_loss: 0.8491, test_loss: 1.0477, test_f1: 0.5567
 epoch: 61, train_loss: 0.8584, test_loss: 1.0413, test_f1: 0.5473
 epoch: 62, train_loss: 0.8543, test_loss: 1.0365, test_f1: 0.5469
 epoch: 63, train_loss: 0.8524, test_loss: 1.0460, test_f1: 0.5589
 epoch: 64, train_loss: 0.8490, test_loss: 1.0291, test_f1: 0.5482
 epoch: 65, train_loss: 0.8574, test_loss: 1.0364, test_f1: 0.5481
 epoch: 66, train_loss: 0.8501, test_loss: 1.0393, test_f1: 0.5480
 epoch: 67, train_loss: 0.8475, test_loss: 1.0334, test_f1: 0.5473
 epoch: 68, train_loss: 0.8429, test_loss: 1.0363, test_f1: 0.5492
 epoch: 69, train_loss: 0.8425, test_loss: 1.0365, test_f1: 0.5455
 epoch: 70, train_loss: 0.8351, test_loss: 1.0395, test_f1: 0.5572
 epoch: 71, train_loss: 0.8399, test_loss: 1.0313, test_f1: 0.5450
 epoch: 72, train_loss: 0.8488, test_loss: 1.0211, test_f1: 0.5643
 epoch: 73, train_loss: 0.8343, test_loss: 1.0421, test_f1: 0.5456
 epoch: 74, train_loss: 0.8325, test_loss: 1.0282, test_f1: 0.5643
 epoch: 75, train_loss: 0.8386, test_loss: 1.0177, test_f1: 0.5676
 epoch: 76, train_loss: 0.8392, test_loss: 1.0389, test_f1: 0.5551
 epoch: 77, train_loss: 0.8357, test_loss: 1.0311, test_f1: 0.5528
 epoch: 78, train_loss: 0.8264, test_loss: 1.0246, test_f1: 0.5656
 epoch: 79, train_loss: 0.8322, test_loss: 1.0338, test_f1: 0.5533
 epoch: 80, train_loss: 0.8354, test_loss: 1.0295, test_f1: 0.5616
 epoch: 81, train_loss: 0.8239, test_loss: 1.0300, test_f1: 0.5599
 epoch: 82, train_loss: 0.8347, test_loss: 1.0406, test_f1: 0.5487
 epoch: 83, train_loss: 0.8334, test_loss: 1.0182, test_f1: 0.5680
 epoch: 84, train_loss: 0.8217, test_loss: 1.0464, test_f1: 0.5568
 epoch: 85, train_loss: 0.8242, test_loss: 1.0268, test_f1: 0.5659
 epoch: 86, train_loss: 0.8250, test_loss: 1.0249, test_f1: 0.5509
 epoch: 87, train_loss: 0.8179, test_loss: 1.0297, test_f1: 0.5623
 epoch: 88, train_loss: 0.8257, test_loss: 1.0509, test_f1: 0.5649
 epoch: 89, train_loss: 0.8169, test_loss: 1.0235, test_f1: 0.5671
 epoch: 90, train_loss: 0.8146, test_loss: 1.0227, test_f1: 0.5758
 epoch: 91, train_loss: 0.8213, test_loss: 1.0383, test_f1: 0.5610
 epoch: 92, train_loss: 0.8202, test_loss: 1.0292, test_f1: 0.5683
 epoch: 93, train_loss: 0.8049, test_loss: 1.0408, test_f1: 0.5654
 epoch: 94, train_loss: 0.8154, test_loss: 1.0240, test_f1: 0.5697
 epoch: 95, train_loss: 0.8129, test_loss: 1.0400, test_f1: 0.5839
 epoch: 96, train_loss: 0.8085, test_loss: 1.0199, test_f1: 0.5715
 epoch: 97, train_loss: 0.8148, test_loss: 1.0374, test_f1: 0.5723
 epoch: 98, train_loss: 0.8093, test_loss: 1.0224, test_f1: 0.5605
 epoch: 99, train_loss: 0.8098, test_loss: 1.0038, test_f1: 0.5735
##################ITERATION #4 ****************************************
 epoch: 0, train_loss: 1.2681, test_loss: 1.2816, test_f1: 0.2281
 epoch: 1, train_loss: 1.1825, test_loss: 1.2412, test_f1: 0.2336
 epoch: 2, train_loss: 1.1536, test_loss: 1.2065, test_f1: 0.2977
 epoch: 3, train_loss: 1.1281, test_loss: 1.1825, test_f1: 0.3243
 epoch: 4, train_loss: 1.1130, test_loss: 1.1670, test_f1: 0.3402
 epoch: 5, train_loss: 1.0930, test_loss: 1.1575, test_f1: 0.3548
 epoch: 6, train_loss: 1.0789, test_loss: 1.1438, test_f1: 0.3645
 epoch: 7, train_loss: 1.0727, test_loss: 1.1384, test_f1: 0.4123
 epoch: 8, train_loss: 1.0588, test_loss: 1.1294, test_f1: 0.4363
 epoch: 9, train_loss: 1.0471, test_loss: 1.1240, test_f1: 0.4355
 epoch: 10, train_loss: 1.0409, test_loss: 1.1220, test_f1: 0.4647
 epoch: 11, train_loss: 1.0201, test_loss: 1.1122, test_f1: 0.4624
 epoch: 12, train_loss: 1.0149, test_loss: 1.1052, test_f1: 0.4668
 epoch: 13, train_loss: 1.0199, test_loss: 1.1042, test_f1: 0.4711
 epoch: 14, train_loss: 1.0041, test_loss: 1.1012, test_f1: 0.4709
 epoch: 15, train_loss: 0.9942, test_loss: 1.0984, test_f1: 0.4771
 epoch: 16, train_loss: 0.9952, test_loss: 1.0902, test_f1: 0.4769
 epoch: 17, train_loss: 0.9898, test_loss: 1.0856, test_f1: 0.4858
 epoch: 18, train_loss: 0.9791, test_loss: 1.0822, test_f1: 0.4841
 epoch: 19, train_loss: 0.9605, test_loss: 1.0792, test_f1: 0.4950
 epoch: 20, train_loss: 0.9538, test_loss: 1.0821, test_f1: 0.4970
 epoch: 21, train_loss: 0.9641, test_loss: 1.0696, test_f1: 0.5066
 epoch: 22, train_loss: 0.9586, test_loss: 1.0782, test_f1: 0.4928
 epoch: 23, train_loss: 0.9491, test_loss: 1.0713, test_f1: 0.5074
 epoch: 24, train_loss: 0.9452, test_loss: 1.0711, test_f1: 0.5195
 epoch: 25, train_loss: 0.9308, test_loss: 1.0772, test_f1: 0.5161
 epoch: 26, train_loss: 0.9442, test_loss: 1.0743, test_f1: 0.5127
 epoch: 27, train_loss: 0.9359, test_loss: 1.0624, test_f1: 0.5162
 epoch: 28, train_loss: 0.9341, test_loss: 1.0610, test_f1: 0.5200
 epoch: 29, train_loss: 0.9169, test_loss: 1.0599, test_f1: 0.5143
 epoch: 30, train_loss: 0.9219, test_loss: 1.0560, test_f1: 0.5153
 epoch: 31, train_loss: 0.9172, test_loss: 1.0596, test_f1: 0.5047
 epoch: 32, train_loss: 0.9261, test_loss: 1.0594, test_f1: 0.5227
 epoch: 33, train_loss: 0.9095, test_loss: 1.0575, test_f1: 0.5045
 epoch: 34, train_loss: 0.8994, test_loss: 1.0570, test_f1: 0.5197
 epoch: 35, train_loss: 0.9152, test_loss: 1.0627, test_f1: 0.5125
 epoch: 36, train_loss: 0.8910, test_loss: 1.0607, test_f1: 0.5011
 epoch: 37, train_loss: 0.8943, test_loss: 1.0545, test_f1: 0.5179
 epoch: 38, train_loss: 0.9013, test_loss: 1.0711, test_f1: 0.5210
 epoch: 39, train_loss: 0.8957, test_loss: 1.0617, test_f1: 0.5206
 epoch: 40, train_loss: 0.8859, test_loss: 1.0644, test_f1: 0.5093
 epoch: 41, train_loss: 0.8804, test_loss: 1.0602, test_f1: 0.5079
 epoch: 42, train_loss: 0.8748, test_loss: 1.0738, test_f1: 0.5326
 epoch: 43, train_loss: 0.8751, test_loss: 1.0648, test_f1: 0.5147
 epoch: 44, train_loss: 0.8721, test_loss: 1.0678, test_f1: 0.5398
 epoch: 45, train_loss: 0.8680, test_loss: 1.0648, test_f1: 0.5179
 epoch: 46, train_loss: 0.8705, test_loss: 1.0564, test_f1: 0.5208
 epoch: 47, train_loss: 0.8572, test_loss: 1.0703, test_f1: 0.5306
 epoch: 48, train_loss: 0.8571, test_loss: 1.0643, test_f1: 0.5361
 epoch: 49, train_loss: 0.8564, test_loss: 1.0760, test_f1: 0.5251
 epoch: 50, train_loss: 0.8529, test_loss: 1.0730, test_f1: 0.5287
 epoch: 51, train_loss: 0.8575, test_loss: 1.0586, test_f1: 0.5480
 epoch: 52, train_loss: 0.8472, test_loss: 1.0609, test_f1: 0.5386
 epoch: 53, train_loss: 0.8443, test_loss: 1.0589, test_f1: 0.5198
 epoch: 54, train_loss: 0.8505, test_loss: 1.0558, test_f1: 0.5207
 epoch: 55, train_loss: 0.8484, test_loss: 1.0557, test_f1: 0.5377
 epoch: 56, train_loss: 0.8461, test_loss: 1.0686, test_f1: 0.5467
 epoch: 57, train_loss: 0.8389, test_loss: 1.0624, test_f1: 0.5329
 epoch: 58, train_loss: 0.8496, test_loss: 1.0593, test_f1: 0.5224
 epoch: 59, train_loss: 0.8348, test_loss: 1.0653, test_f1: 0.5200
 epoch: 60, train_loss: 0.8423, test_loss: 1.0613, test_f1: 0.5341
 epoch: 61, train_loss: 0.8487, test_loss: 1.0609, test_f1: 0.5291
 epoch: 62, train_loss: 0.8389, test_loss: 1.0524, test_f1: 0.5469
 epoch: 63, train_loss: 0.8446, test_loss: 1.0600, test_f1: 0.5394
 epoch: 64, train_loss: 0.8357, test_loss: 1.0575, test_f1: 0.5525
 epoch: 65, train_loss: 0.8321, test_loss: 1.0520, test_f1: 0.5385
 epoch: 66, train_loss: 0.8308, test_loss: 1.0601, test_f1: 0.5416
 epoch: 67, train_loss: 0.8298, test_loss: 1.0598, test_f1: 0.5362
 epoch: 68, train_loss: 0.8207, test_loss: 1.0601, test_f1: 0.5355
 epoch: 69, train_loss: 0.8280, test_loss: 1.0654, test_f1: 0.5402
 epoch: 70, train_loss: 0.8146, test_loss: 1.0535, test_f1: 0.5367
 epoch: 71, train_loss: 0.8255, test_loss: 1.0519, test_f1: 0.5457
 epoch: 72, train_loss: 0.8168, test_loss: 1.0622, test_f1: 0.5541
 epoch: 73, train_loss: 0.8241, test_loss: 1.0553, test_f1: 0.5450
 epoch: 74, train_loss: 0.8229, test_loss: 1.0698, test_f1: 0.5341
 epoch: 75, train_loss: 0.8309, test_loss: 1.0581, test_f1: 0.5451
 epoch: 76, train_loss: 0.8119, test_loss: 1.0586, test_f1: 0.5558
 epoch: 77, train_loss: 0.8217, test_loss: 1.0619, test_f1: 0.5457
 epoch: 78, train_loss: 0.8143, test_loss: 1.0548, test_f1: 0.5397
 epoch: 79, train_loss: 0.8150, test_loss: 1.0609, test_f1: 0.5357
 epoch: 80, train_loss: 0.8164, test_loss: 1.0613, test_f1: 0.5373
 epoch: 81, train_loss: 0.8141, test_loss: 1.0506, test_f1: 0.5441
 epoch: 82, train_loss: 0.8030, test_loss: 1.0524, test_f1: 0.5523
 epoch: 83, train_loss: 0.8035, test_loss: 1.0761, test_f1: 0.5329
 epoch: 84, train_loss: 0.8198, test_loss: 1.0525, test_f1: 0.5539
 epoch: 85, train_loss: 0.8152, test_loss: 1.0684, test_f1: 0.5488
 epoch: 86, train_loss: 0.8001, test_loss: 1.0567, test_f1: 0.5403
 epoch: 87, train_loss: 0.8034, test_loss: 1.0614, test_f1: 0.5501
 epoch: 88, train_loss: 0.8025, test_loss: 1.0633, test_f1: 0.5429
 epoch: 89, train_loss: 0.8123, test_loss: 1.0740, test_f1: 0.5461
 epoch: 90, train_loss: 0.7950, test_loss: 1.0731, test_f1: 0.5476
 epoch: 91, train_loss: 0.8088, test_loss: 1.0734, test_f1: 0.5406
 epoch: 92, train_loss: 0.8075, test_loss: 1.0664, test_f1: 0.5411
 epoch: 93, train_loss: 0.7937, test_loss: 1.0729, test_f1: 0.5476
 epoch: 94, train_loss: 0.8001, test_loss: 1.0604, test_f1: 0.5502
 epoch: 95, train_loss: 0.8029, test_loss: 1.0618, test_f1: 0.5486
 epoch: 96, train_loss: 0.7953, test_loss: 1.0446, test_f1: 0.5557
 epoch: 97, train_loss: 0.7883, test_loss: 1.0588, test_f1: 0.5374
 epoch: 98, train_loss: 0.7976, test_loss: 1.0554, test_f1: 0.5438
 epoch: 99, train_loss: 0.7945, test_loss: 1.0684, test_f1: 0.5471
##################ITERATION #5 ****************************************
 epoch: 0, train_loss: 1.2393, test_loss: 1.2936, test_f1: 0.2281
 epoch: 1, train_loss: 1.1722, test_loss: 1.2496, test_f1: 0.2667
 epoch: 2, train_loss: 1.1545, test_loss: 1.2107, test_f1: 0.3402
 epoch: 3, train_loss: 1.1355, test_loss: 1.1916, test_f1: 0.3397
 epoch: 4, train_loss: 1.1103, test_loss: 1.1774, test_f1: 0.3541
 epoch: 5, train_loss: 1.0998, test_loss: 1.1676, test_f1: 0.3541
 epoch: 6, train_loss: 1.0754, test_loss: 1.1577, test_f1: 0.3542
 epoch: 7, train_loss: 1.0551, test_loss: 1.1491, test_f1: 0.3544
 epoch: 8, train_loss: 1.0453, test_loss: 1.1372, test_f1: 0.3565
 epoch: 9, train_loss: 1.0429, test_loss: 1.1333, test_f1: 0.3546
 epoch: 10, train_loss: 1.0307, test_loss: 1.1223, test_f1: 0.3586
 epoch: 11, train_loss: 1.0170, test_loss: 1.1238, test_f1: 0.3766
 epoch: 12, train_loss: 1.0121, test_loss: 1.1130, test_f1: 0.3748
 epoch: 13, train_loss: 1.0064, test_loss: 1.1033, test_f1: 0.3732
 epoch: 14, train_loss: 0.9896, test_loss: 1.1048, test_f1: 0.3752
 epoch: 15, train_loss: 0.9866, test_loss: 1.1037, test_f1: 0.3984
 epoch: 16, train_loss: 0.9769, test_loss: 1.1071, test_f1: 0.4248
 epoch: 17, train_loss: 0.9785, test_loss: 1.0939, test_f1: 0.4572
 epoch: 18, train_loss: 0.9668, test_loss: 1.0984, test_f1: 0.4474
 epoch: 19, train_loss: 0.9712, test_loss: 1.1013, test_f1: 0.4593
 epoch: 20, train_loss: 0.9568, test_loss: 1.1090, test_f1: 0.4616
 epoch: 21, train_loss: 0.9604, test_loss: 1.1098, test_f1: 0.4556
 epoch: 22, train_loss: 0.9400, test_loss: 1.0955, test_f1: 0.4592
 epoch: 23, train_loss: 0.9493, test_loss: 1.1042, test_f1: 0.4642
 epoch: 24, train_loss: 0.9442, test_loss: 1.1044, test_f1: 0.4674
 epoch: 25, train_loss: 0.9282, test_loss: 1.1193, test_f1: 0.4689
 epoch: 26, train_loss: 0.9246, test_loss: 1.1088, test_f1: 0.4725
 epoch: 27, train_loss: 0.9314, test_loss: 1.1215, test_f1: 0.4695
 epoch: 28, train_loss: 0.9108, test_loss: 1.1274, test_f1: 0.4725
 epoch: 29, train_loss: 0.9142, test_loss: 1.1055, test_f1: 0.4773
 epoch: 30, train_loss: 0.9254, test_loss: 1.1178, test_f1: 0.4828
 epoch: 31, train_loss: 0.9047, test_loss: 1.1139, test_f1: 0.4828
 epoch: 32, train_loss: 0.9109, test_loss: 1.1354, test_f1: 0.4865
 epoch: 33, train_loss: 0.9000, test_loss: 1.1397, test_f1: 0.4878
 epoch: 34, train_loss: 0.8979, test_loss: 1.1370, test_f1: 0.4944
 epoch: 35, train_loss: 0.8945, test_loss: 1.1378, test_f1: 0.4946
 epoch: 36, train_loss: 0.8888, test_loss: 1.1622, test_f1: 0.4858
 epoch: 37, train_loss: 0.8936, test_loss: 1.1422, test_f1: 0.4915
 epoch: 38, train_loss: 0.8983, test_loss: 1.1555, test_f1: 0.4928
 epoch: 39, train_loss: 0.8819, test_loss: 1.1699, test_f1: 0.4963
 epoch: 40, train_loss: 0.8820, test_loss: 1.1434, test_f1: 0.5028
 epoch: 41, train_loss: 0.8793, test_loss: 1.1679, test_f1: 0.5006
 epoch: 42, train_loss: 0.8760, test_loss: 1.1425, test_f1: 0.4940
 epoch: 43, train_loss: 0.8776, test_loss: 1.1561, test_f1: 0.5010
 epoch: 44, train_loss: 0.8740, test_loss: 1.1519, test_f1: 0.5047
 epoch: 45, train_loss: 0.8676, test_loss: 1.1825, test_f1: 0.5037
 epoch: 46, train_loss: 0.8617, test_loss: 1.1806, test_f1: 0.5152
 epoch: 47, train_loss: 0.8736, test_loss: 1.1796, test_f1: 0.5034
 epoch: 48, train_loss: 0.8688, test_loss: 1.1778, test_f1: 0.5118
 epoch: 49, train_loss: 0.8591, test_loss: 1.1641, test_f1: 0.5044
 epoch: 50, train_loss: 0.8604, test_loss: 1.1728, test_f1: 0.5029
 epoch: 51, train_loss: 0.8583, test_loss: 1.1721, test_f1: 0.4897
 epoch: 52, train_loss: 0.8541, test_loss: 1.1755, test_f1: 0.4893
 epoch: 53, train_loss: 0.8548, test_loss: 1.1626, test_f1: 0.5010
 epoch: 54, train_loss: 0.8521, test_loss: 1.1535, test_f1: 0.5028
 epoch: 55, train_loss: 0.8568, test_loss: 1.1644, test_f1: 0.5005
 epoch: 56, train_loss: 0.8505, test_loss: 1.1637, test_f1: 0.5098
 epoch: 57, train_loss: 0.8512, test_loss: 1.1656, test_f1: 0.5123
 epoch: 58, train_loss: 0.8520, test_loss: 1.1732, test_f1: 0.5065
 epoch: 59, train_loss: 0.8568, test_loss: 1.1712, test_f1: 0.5113
 epoch: 60, train_loss: 0.8449, test_loss: 1.1690, test_f1: 0.5171
 epoch: 61, train_loss: 0.8380, test_loss: 1.1765, test_f1: 0.5161
 epoch: 62, train_loss: 0.8377, test_loss: 1.1580, test_f1: 0.5097
 epoch: 63, train_loss: 0.8457, test_loss: 1.1579, test_f1: 0.5069
 epoch: 64, train_loss: 0.8508, test_loss: 1.1640, test_f1: 0.5115
 epoch: 65, train_loss: 0.8436, test_loss: 1.1441, test_f1: 0.5100
 epoch: 66, train_loss: 0.8393, test_loss: 1.1529, test_f1: 0.5120
 epoch: 67, train_loss: 0.8286, test_loss: 1.1501, test_f1: 0.5076
 epoch: 68, train_loss: 0.8401, test_loss: 1.1619, test_f1: 0.5153
 epoch: 69, train_loss: 0.8333, test_loss: 1.1565, test_f1: 0.5072
 epoch: 70, train_loss: 0.8372, test_loss: 1.1556, test_f1: 0.5041
 epoch: 71, train_loss: 0.8276, test_loss: 1.1582, test_f1: 0.5066
 epoch: 72, train_loss: 0.8497, test_loss: 1.1487, test_f1: 0.5104
 epoch: 73, train_loss: 0.8263, test_loss: 1.1617, test_f1: 0.5123
 epoch: 74, train_loss: 0.8274, test_loss: 1.1508, test_f1: 0.5099
 epoch: 75, train_loss: 0.8308, test_loss: 1.1383, test_f1: 0.5110
 epoch: 76, train_loss: 0.8333, test_loss: 1.1519, test_f1: 0.5004
 epoch: 77, train_loss: 0.8288, test_loss: 1.1535, test_f1: 0.5028
 epoch: 78, train_loss: 0.8343, test_loss: 1.1574, test_f1: 0.5040
 epoch: 79, train_loss: 0.8323, test_loss: 1.1420, test_f1: 0.5104
 epoch: 80, train_loss: 0.8246, test_loss: 1.1641, test_f1: 0.5047
 epoch: 81, train_loss: 0.8213, test_loss: 1.1651, test_f1: 0.5000
 epoch: 82, train_loss: 0.8288, test_loss: 1.1624, test_f1: 0.4915
 epoch: 83, train_loss: 0.8250, test_loss: 1.1444, test_f1: 0.4845
 epoch: 84, train_loss: 0.8241, test_loss: 1.1442, test_f1: 0.5049
 epoch: 85, train_loss: 0.8153, test_loss: 1.1384, test_f1: 0.4898
 epoch: 86, train_loss: 0.8155, test_loss: 1.1548, test_f1: 0.4969
 epoch: 87, train_loss: 0.8233, test_loss: 1.1598, test_f1: 0.5034
 epoch: 88, train_loss: 0.8173, test_loss: 1.1602, test_f1: 0.5048
 epoch: 89, train_loss: 0.8160, test_loss: 1.1368, test_f1: 0.4949
 epoch: 90, train_loss: 0.8287, test_loss: 1.1257, test_f1: 0.4917
 epoch: 91, train_loss: 0.8097, test_loss: 1.1272, test_f1: 0.4881
 epoch: 92, train_loss: 0.8210, test_loss: 1.1513, test_f1: 0.4910
 epoch: 93, train_loss: 0.8004, test_loss: 1.1512, test_f1: 0.4918
 epoch: 94, train_loss: 0.8156, test_loss: 1.1439, test_f1: 0.4879
 epoch: 95, train_loss: 0.8127, test_loss: 1.1568, test_f1: 0.4878
 epoch: 96, train_loss: 0.8168, test_loss: 1.1419, test_f1: 0.4938
 epoch: 97, train_loss: 0.8083, test_loss: 1.1393, test_f1: 0.4947
 epoch: 98, train_loss: 0.8041, test_loss: 1.1377, test_f1: 0.5099
 epoch: 99, train_loss: 0.8115, test_loss: 1.1402, test_f1: 0.4938
##################ITERATION #6 ****************************************
 epoch: 0, train_loss: 1.2612, test_loss: 1.2856, test_f1: 0.2281
 epoch: 1, train_loss: 1.1795, test_loss: 1.2495, test_f1: 0.3154
 epoch: 2, train_loss: 1.1613, test_loss: 1.2170, test_f1: 0.3508
 epoch: 3, train_loss: 1.1278, test_loss: 1.1978, test_f1: 0.3606
 epoch: 4, train_loss: 1.1145, test_loss: 1.1890, test_f1: 0.3648
 epoch: 5, train_loss: 1.0992, test_loss: 1.1800, test_f1: 0.3656
 epoch: 6, train_loss: 1.0780, test_loss: 1.1701, test_f1: 0.3660
 epoch: 7, train_loss: 1.0818, test_loss: 1.1664, test_f1: 0.4175
 epoch: 8, train_loss: 1.0655, test_loss: 1.1609, test_f1: 0.3744
 epoch: 9, train_loss: 1.0424, test_loss: 1.1471, test_f1: 0.4187
 epoch: 10, train_loss: 1.0437, test_loss: 1.1386, test_f1: 0.4190
 epoch: 11, train_loss: 1.0358, test_loss: 1.1258, test_f1: 0.4518
 epoch: 12, train_loss: 1.0185, test_loss: 1.1197, test_f1: 0.4619
 epoch: 13, train_loss: 1.0321, test_loss: 1.1188, test_f1: 0.4590
 epoch: 14, train_loss: 1.0163, test_loss: 1.1150, test_f1: 0.4727
 epoch: 15, train_loss: 1.0015, test_loss: 1.1065, test_f1: 0.4664
 epoch: 16, train_loss: 0.9902, test_loss: 1.1013, test_f1: 0.4701
 epoch: 17, train_loss: 0.9982, test_loss: 1.0979, test_f1: 0.4865
 epoch: 18, train_loss: 0.9776, test_loss: 1.0897, test_f1: 0.4899
 epoch: 19, train_loss: 0.9816, test_loss: 1.0912, test_f1: 0.4840
 epoch: 20, train_loss: 0.9766, test_loss: 1.0807, test_f1: 0.4944
 epoch: 21, train_loss: 0.9767, test_loss: 1.0782, test_f1: 0.4856
 epoch: 22, train_loss: 0.9755, test_loss: 1.0797, test_f1: 0.4941
 epoch: 23, train_loss: 0.9622, test_loss: 1.0709, test_f1: 0.5071
 epoch: 24, train_loss: 0.9494, test_loss: 1.0714, test_f1: 0.5059
 epoch: 25, train_loss: 0.9577, test_loss: 1.0727, test_f1: 0.5120
 epoch: 26, train_loss: 0.9427, test_loss: 1.0622, test_f1: 0.5059
 epoch: 27, train_loss: 0.9364, test_loss: 1.0644, test_f1: 0.5142
 epoch: 28, train_loss: 0.9399, test_loss: 1.0593, test_f1: 0.5023
 epoch: 29, train_loss: 0.9217, test_loss: 1.0582, test_f1: 0.5144
 epoch: 30, train_loss: 0.9272, test_loss: 1.0632, test_f1: 0.5142
 epoch: 31, train_loss: 0.9062, test_loss: 1.0542, test_f1: 0.5093
 epoch: 32, train_loss: 0.9139, test_loss: 1.0529, test_f1: 0.5086
 epoch: 33, train_loss: 0.9124, test_loss: 1.0552, test_f1: 0.5178
 epoch: 34, train_loss: 0.9131, test_loss: 1.0572, test_f1: 0.5114
 epoch: 35, train_loss: 0.9097, test_loss: 1.0481, test_f1: 0.5146
 epoch: 36, train_loss: 0.8975, test_loss: 1.0455, test_f1: 0.5086
 epoch: 37, train_loss: 0.8983, test_loss: 1.0508, test_f1: 0.5141
 epoch: 38, train_loss: 0.8908, test_loss: 1.0427, test_f1: 0.5075
 epoch: 39, train_loss: 0.8826, test_loss: 1.0456, test_f1: 0.5369
 epoch: 40, train_loss: 0.8820, test_loss: 1.0535, test_f1: 0.5371
 epoch: 41, train_loss: 0.8818, test_loss: 1.0544, test_f1: 0.5081
 epoch: 42, train_loss: 0.8789, test_loss: 1.0461, test_f1: 0.5214
 epoch: 43, train_loss: 0.8741, test_loss: 1.0562, test_f1: 0.5297
 epoch: 44, train_loss: 0.8654, test_loss: 1.0394, test_f1: 0.5150
 epoch: 45, train_loss: 0.8668, test_loss: 1.0525, test_f1: 0.5195
 epoch: 46, train_loss: 0.8629, test_loss: 1.0559, test_f1: 0.5509
 epoch: 47, train_loss: 0.8695, test_loss: 1.0681, test_f1: 0.5385
 epoch: 48, train_loss: 0.8617, test_loss: 1.0563, test_f1: 0.5484
 epoch: 49, train_loss: 0.8638, test_loss: 1.0445, test_f1: 0.5568
 epoch: 50, train_loss: 0.8525, test_loss: 1.0542, test_f1: 0.5462
 epoch: 51, train_loss: 0.8452, test_loss: 1.0574, test_f1: 0.5586
 epoch: 52, train_loss: 0.8452, test_loss: 1.0551, test_f1: 0.5597
 epoch: 53, train_loss: 0.8539, test_loss: 1.0460, test_f1: 0.5658
 epoch: 54, train_loss: 0.8454, test_loss: 1.0513, test_f1: 0.5516
 epoch: 55, train_loss: 0.8544, test_loss: 1.0464, test_f1: 0.5531
 epoch: 56, train_loss: 0.8506, test_loss: 1.0398, test_f1: 0.5725
 epoch: 57, train_loss: 0.8348, test_loss: 1.0493, test_f1: 0.5695
 epoch: 58, train_loss: 0.8341, test_loss: 1.0423, test_f1: 0.5590
 epoch: 59, train_loss: 0.8349, test_loss: 1.0524, test_f1: 0.5642
 epoch: 60, train_loss: 0.8345, test_loss: 1.0559, test_f1: 0.5620
 epoch: 61, train_loss: 0.8374, test_loss: 1.0440, test_f1: 0.5496
 epoch: 62, train_loss: 0.8392, test_loss: 1.0404, test_f1: 0.5638
 epoch: 63, train_loss: 0.8334, test_loss: 1.0274, test_f1: 0.5664
 epoch: 64, train_loss: 0.8329, test_loss: 1.0403, test_f1: 0.5639
 epoch: 65, train_loss: 0.8325, test_loss: 1.0459, test_f1: 0.5623
 epoch: 66, train_loss: 0.8272, test_loss: 1.0393, test_f1: 0.5707
 epoch: 67, train_loss: 0.8361, test_loss: 1.0485, test_f1: 0.5617
 epoch: 68, train_loss: 0.8253, test_loss: 1.0460, test_f1: 0.5586
 epoch: 69, train_loss: 0.8170, test_loss: 1.0311, test_f1: 0.5681
 epoch: 70, train_loss: 0.8231, test_loss: 1.0474, test_f1: 0.5689
 epoch: 71, train_loss: 0.8153, test_loss: 1.0485, test_f1: 0.5725
 epoch: 72, train_loss: 0.8166, test_loss: 1.0560, test_f1: 0.5543
 epoch: 73, train_loss: 0.8200, test_loss: 1.0443, test_f1: 0.5730
 epoch: 74, train_loss: 0.8155, test_loss: 1.0429, test_f1: 0.5749
 epoch: 75, train_loss: 0.8158, test_loss: 1.0601, test_f1: 0.5514
 epoch: 76, train_loss: 0.8168, test_loss: 1.0590, test_f1: 0.5483
 epoch: 77, train_loss: 0.8184, test_loss: 1.0410, test_f1: 0.5730
 epoch: 78, train_loss: 0.8035, test_loss: 1.0472, test_f1: 0.5651
 epoch: 79, train_loss: 0.8357, test_loss: 1.0317, test_f1: 0.5609
 epoch: 80, train_loss: 0.8102, test_loss: 1.0424, test_f1: 0.5655
 epoch: 81, train_loss: 0.8189, test_loss: 1.0508, test_f1: 0.5621
 epoch: 82, train_loss: 0.8047, test_loss: 1.0360, test_f1: 0.5724
 epoch: 83, train_loss: 0.8062, test_loss: 1.0542, test_f1: 0.5604
 epoch: 84, train_loss: 0.8128, test_loss: 1.0368, test_f1: 0.5570
 epoch: 85, train_loss: 0.8036, test_loss: 1.0571, test_f1: 0.5503
 epoch: 86, train_loss: 0.8068, test_loss: 1.0443, test_f1: 0.5483
 epoch: 87, train_loss: 0.8009, test_loss: 1.0521, test_f1: 0.5590
 epoch: 88, train_loss: 0.8105, test_loss: 1.0543, test_f1: 0.5573
 epoch: 89, train_loss: 0.7960, test_loss: 1.0561, test_f1: 0.5594
 epoch: 90, train_loss: 0.7946, test_loss: 1.0446, test_f1: 0.5629
 epoch: 91, train_loss: 0.8026, test_loss: 1.0573, test_f1: 0.5590
 epoch: 92, train_loss: 0.8024, test_loss: 1.0503, test_f1: 0.5703
 epoch: 93, train_loss: 0.7970, test_loss: 1.0573, test_f1: 0.5682
 epoch: 94, train_loss: 0.7942, test_loss: 1.0480, test_f1: 0.5686
 epoch: 95, train_loss: 0.7985, test_loss: 1.0416, test_f1: 0.5660
 epoch: 96, train_loss: 0.7879, test_loss: 1.0404, test_f1: 0.5499
 epoch: 97, train_loss: 0.7936, test_loss: 1.0667, test_f1: 0.5499
 epoch: 98, train_loss: 0.7946, test_loss: 1.0479, test_f1: 0.5772
 epoch: 99, train_loss: 0.7955, test_loss: 1.0491, test_f1: 0.5687
##################ITERATION #7 ****************************************
 epoch: 0, train_loss: 1.2495, test_loss: 1.3088, test_f1: 0.2281
 epoch: 1, train_loss: 1.1645, test_loss: 1.2600, test_f1: 0.2575
 epoch: 2, train_loss: 1.1494, test_loss: 1.2143, test_f1: 0.3238
 epoch: 3, train_loss: 1.1260, test_loss: 1.1944, test_f1: 0.4293
 epoch: 4, train_loss: 1.1137, test_loss: 1.1820, test_f1: 0.4437
 epoch: 5, train_loss: 1.1123, test_loss: 1.1691, test_f1: 0.4574
 epoch: 6, train_loss: 1.0914, test_loss: 1.1541, test_f1: 0.4646
 epoch: 7, train_loss: 1.0819, test_loss: 1.1438, test_f1: 0.4716
 epoch: 8, train_loss: 1.0719, test_loss: 1.1315, test_f1: 0.4818
 epoch: 9, train_loss: 1.0571, test_loss: 1.1265, test_f1: 0.4827
 epoch: 10, train_loss: 1.0413, test_loss: 1.1186, test_f1: 0.4918
 epoch: 11, train_loss: 1.0451, test_loss: 1.1063, test_f1: 0.4829
 epoch: 12, train_loss: 1.0143, test_loss: 1.0969, test_f1: 0.4849
 epoch: 13, train_loss: 1.0246, test_loss: 1.0927, test_f1: 0.4812
 epoch: 14, train_loss: 1.0074, test_loss: 1.0871, test_f1: 0.5088
 epoch: 15, train_loss: 0.9991, test_loss: 1.0850, test_f1: 0.5126
 epoch: 16, train_loss: 0.9938, test_loss: 1.0825, test_f1: 0.5121
 epoch: 17, train_loss: 0.9874, test_loss: 1.0708, test_f1: 0.4914
 epoch: 18, train_loss: 0.9834, test_loss: 1.0694, test_f1: 0.5273
 epoch: 19, train_loss: 0.9749, test_loss: 1.0739, test_f1: 0.5148
 epoch: 20, train_loss: 0.9696, test_loss: 1.0643, test_f1: 0.5097
 epoch: 21, train_loss: 0.9646, test_loss: 1.0681, test_f1: 0.5352
 epoch: 22, train_loss: 0.9597, test_loss: 1.0662, test_f1: 0.5172
 epoch: 23, train_loss: 0.9516, test_loss: 1.0635, test_f1: 0.5006
 epoch: 24, train_loss: 0.9471, test_loss: 1.0600, test_f1: 0.5093
 epoch: 25, train_loss: 0.9415, test_loss: 1.0653, test_f1: 0.5242
 epoch: 26, train_loss: 0.9375, test_loss: 1.0586, test_f1: 0.5302
 epoch: 27, train_loss: 0.9393, test_loss: 1.0548, test_f1: 0.5056
 epoch: 28, train_loss: 0.9206, test_loss: 1.0465, test_f1: 0.5111
 epoch: 29, train_loss: 0.9245, test_loss: 1.0487, test_f1: 0.4990
 epoch: 30, train_loss: 0.9291, test_loss: 1.0450, test_f1: 0.4948
 epoch: 31, train_loss: 0.9161, test_loss: 1.0425, test_f1: 0.5101
 epoch: 32, train_loss: 0.9187, test_loss: 1.0560, test_f1: 0.5141
 epoch: 33, train_loss: 0.9187, test_loss: 1.0386, test_f1: 0.5148
 epoch: 34, train_loss: 0.9146, test_loss: 1.0438, test_f1: 0.5310
 epoch: 35, train_loss: 0.9029, test_loss: 1.0436, test_f1: 0.5137
 epoch: 36, train_loss: 0.9007, test_loss: 1.0387, test_f1: 0.5266
 epoch: 37, train_loss: 0.9045, test_loss: 1.0353, test_f1: 0.5187
 epoch: 38, train_loss: 0.8943, test_loss: 1.0289, test_f1: 0.5198
 epoch: 39, train_loss: 0.8980, test_loss: 1.0357, test_f1: 0.5255
 epoch: 40, train_loss: 0.8988, test_loss: 1.0390, test_f1: 0.5208
 epoch: 41, train_loss: 0.8961, test_loss: 1.0377, test_f1: 0.5187
 epoch: 42, train_loss: 0.8740, test_loss: 1.0416, test_f1: 0.5246
 epoch: 43, train_loss: 0.8732, test_loss: 1.0299, test_f1: 0.5266
 epoch: 44, train_loss: 0.8761, test_loss: 1.0217, test_f1: 0.5251
 epoch: 45, train_loss: 0.8748, test_loss: 1.0281, test_f1: 0.5577
 epoch: 46, train_loss: 0.8733, test_loss: 1.0287, test_f1: 0.5316
 epoch: 47, train_loss: 0.8731, test_loss: 1.0267, test_f1: 0.5505
 epoch: 48, train_loss: 0.8746, test_loss: 1.0308, test_f1: 0.5387
 epoch: 49, train_loss: 0.8692, test_loss: 1.0173, test_f1: 0.5466
 epoch: 50, train_loss: 0.8675, test_loss: 1.0213, test_f1: 0.5777
 epoch: 51, train_loss: 0.8599, test_loss: 1.0220, test_f1: 0.5463
 epoch: 52, train_loss: 0.8641, test_loss: 1.0256, test_f1: 0.5819
 epoch: 53, train_loss: 0.8509, test_loss: 1.0279, test_f1: 0.5745
 epoch: 54, train_loss: 0.8540, test_loss: 1.0248, test_f1: 0.5675
 epoch: 55, train_loss: 0.8346, test_loss: 1.0280, test_f1: 0.5814
 epoch: 56, train_loss: 0.8439, test_loss: 1.0273, test_f1: 0.5615
 epoch: 57, train_loss: 0.8403, test_loss: 1.0273, test_f1: 0.5573
 epoch: 58, train_loss: 0.8521, test_loss: 1.0286, test_f1: 0.5720
 epoch: 59, train_loss: 0.8456, test_loss: 1.0285, test_f1: 0.5791
 epoch: 60, train_loss: 0.8359, test_loss: 1.0236, test_f1: 0.5672
 epoch: 61, train_loss: 0.8389, test_loss: 1.0261, test_f1: 0.5827
 epoch: 62, train_loss: 0.8357, test_loss: 1.0280, test_f1: 0.5809
 epoch: 63, train_loss: 0.8476, test_loss: 1.0239, test_f1: 0.5768
 epoch: 64, train_loss: 0.8433, test_loss: 1.0226, test_f1: 0.5897
 epoch: 65, train_loss: 0.8414, test_loss: 1.0129, test_f1: 0.5776
 epoch: 66, train_loss: 0.8372, test_loss: 1.0164, test_f1: 0.5915
 epoch: 67, train_loss: 0.8316, test_loss: 1.0155, test_f1: 0.5853
 epoch: 68, train_loss: 0.8310, test_loss: 1.0078, test_f1: 0.5872
 epoch: 69, train_loss: 0.8308, test_loss: 1.0093, test_f1: 0.5840
 epoch: 70, train_loss: 0.8151, test_loss: 1.0077, test_f1: 0.5894
 epoch: 71, train_loss: 0.8345, test_loss: 1.0049, test_f1: 0.5986
 epoch: 72, train_loss: 0.8296, test_loss: 1.0120, test_f1: 0.6008
 epoch: 73, train_loss: 0.8312, test_loss: 1.0106, test_f1: 0.5902
 epoch: 74, train_loss: 0.8298, test_loss: 1.0202, test_f1: 0.5968
 epoch: 75, train_loss: 0.8296, test_loss: 1.0138, test_f1: 0.5944
 epoch: 76, train_loss: 0.8140, test_loss: 1.0122, test_f1: 0.6012
 epoch: 77, train_loss: 0.8160, test_loss: 1.0154, test_f1: 0.6082
 epoch: 78, train_loss: 0.8208, test_loss: 1.0177, test_f1: 0.5790
 epoch: 79, train_loss: 0.8163, test_loss: 1.0156, test_f1: 0.5906
 epoch: 80, train_loss: 0.8210, test_loss: 1.0206, test_f1: 0.5801
 epoch: 81, train_loss: 0.8153, test_loss: 1.0200, test_f1: 0.5765
 epoch: 82, train_loss: 0.8121, test_loss: 1.0217, test_f1: 0.5977
 epoch: 83, train_loss: 0.7956, test_loss: 1.0261, test_f1: 0.5868
 epoch: 84, train_loss: 0.8025, test_loss: 1.0253, test_f1: 0.5817
 epoch: 85, train_loss: 0.8086, test_loss: 1.0263, test_f1: 0.5994
 epoch: 86, train_loss: 0.8067, test_loss: 1.0262, test_f1: 0.5897
 epoch: 87, train_loss: 0.8043, test_loss: 1.0332, test_f1: 0.5637
 epoch: 88, train_loss: 0.8099, test_loss: 1.0223, test_f1: 0.5848
 epoch: 89, train_loss: 0.8144, test_loss: 1.0251, test_f1: 0.5866
 epoch: 90, train_loss: 0.7977, test_loss: 1.0271, test_f1: 0.5746
 epoch: 91, train_loss: 0.8095, test_loss: 1.0237, test_f1: 0.5917
 epoch: 92, train_loss: 0.8064, test_loss: 1.0277, test_f1: 0.5997
 epoch: 93, train_loss: 0.8060, test_loss: 1.0347, test_f1: 0.5821
 epoch: 94, train_loss: 0.7933, test_loss: 1.0267, test_f1: 0.5669
 epoch: 95, train_loss: 0.7971, test_loss: 1.0224, test_f1: 0.5949
 epoch: 96, train_loss: 0.8027, test_loss: 1.0205, test_f1: 0.5874
 epoch: 97, train_loss: 0.8000, test_loss: 1.0204, test_f1: 0.5851
 epoch: 98, train_loss: 0.7928, test_loss: 1.0327, test_f1: 0.5841
 epoch: 99, train_loss: 0.7975, test_loss: 1.0339, test_f1: 0.5755
##################ITERATION #8 ****************************************
 epoch: 0, train_loss: 1.2268, test_loss: 1.2695, test_f1: 0.2281
 epoch: 1, train_loss: 1.1510, test_loss: 1.2230, test_f1: 0.3155
 epoch: 2, train_loss: 1.1361, test_loss: 1.1883, test_f1: 0.3512
 epoch: 3, train_loss: 1.1214, test_loss: 1.1758, test_f1: 0.3674
 epoch: 4, train_loss: 1.1022, test_loss: 1.1668, test_f1: 0.3957
 epoch: 5, train_loss: 1.0793, test_loss: 1.1533, test_f1: 0.3853
 epoch: 6, train_loss: 1.0677, test_loss: 1.1517, test_f1: 0.4117
 epoch: 7, train_loss: 1.0503, test_loss: 1.1448, test_f1: 0.4311
 epoch: 8, train_loss: 1.0572, test_loss: 1.1347, test_f1: 0.4435
 epoch: 9, train_loss: 1.0329, test_loss: 1.1311, test_f1: 0.4452
 epoch: 10, train_loss: 1.0246, test_loss: 1.1165, test_f1: 0.4621
 epoch: 11, train_loss: 1.0206, test_loss: 1.1066, test_f1: 0.4626
 epoch: 12, train_loss: 1.0062, test_loss: 1.0998, test_f1: 0.4777
 epoch: 13, train_loss: 0.9927, test_loss: 1.0950, test_f1: 0.4798
 epoch: 14, train_loss: 0.9964, test_loss: 1.0939, test_f1: 0.4917
 epoch: 15, train_loss: 0.9884, test_loss: 1.0799, test_f1: 0.5135
 epoch: 16, train_loss: 0.9776, test_loss: 1.0785, test_f1: 0.5198
 epoch: 17, train_loss: 0.9708, test_loss: 1.0781, test_f1: 0.5014
 epoch: 18, train_loss: 0.9699, test_loss: 1.0778, test_f1: 0.5124
 epoch: 19, train_loss: 0.9779, test_loss: 1.0709, test_f1: 0.5116
 epoch: 20, train_loss: 0.9468, test_loss: 1.0620, test_f1: 0.5122
 epoch: 21, train_loss: 0.9579, test_loss: 1.0745, test_f1: 0.5048
 epoch: 22, train_loss: 0.9513, test_loss: 1.0617, test_f1: 0.5241
 epoch: 23, train_loss: 0.9498, test_loss: 1.0576, test_f1: 0.5194
 epoch: 24, train_loss: 0.9402, test_loss: 1.0493, test_f1: 0.5555
 epoch: 25, train_loss: 0.9305, test_loss: 1.0502, test_f1: 0.5434
 epoch: 26, train_loss: 0.9163, test_loss: 1.0507, test_f1: 0.5432
 epoch: 27, train_loss: 0.9335, test_loss: 1.0582, test_f1: 0.5475
 epoch: 28, train_loss: 0.9209, test_loss: 1.0527, test_f1: 0.5592
 epoch: 29, train_loss: 0.9121, test_loss: 1.0376, test_f1: 0.5641
 epoch: 30, train_loss: 0.9245, test_loss: 1.0532, test_f1: 0.5438
 epoch: 31, train_loss: 0.9140, test_loss: 1.0439, test_f1: 0.5435
 epoch: 32, train_loss: 0.9071, test_loss: 1.0470, test_f1: 0.5562
 epoch: 33, train_loss: 0.8996, test_loss: 1.0453, test_f1: 0.5544
 epoch: 34, train_loss: 0.9090, test_loss: 1.0436, test_f1: 0.5542
 epoch: 35, train_loss: 0.8884, test_loss: 1.0408, test_f1: 0.5604
 epoch: 36, train_loss: 0.8907, test_loss: 1.0326, test_f1: 0.5572
 epoch: 37, train_loss: 0.8860, test_loss: 1.0345, test_f1: 0.5615
 epoch: 38, train_loss: 0.8729, test_loss: 1.0381, test_f1: 0.5679
 epoch: 39, train_loss: 0.8786, test_loss: 1.0358, test_f1: 0.5553
 epoch: 40, train_loss: 0.8845, test_loss: 1.0432, test_f1: 0.5602
 epoch: 41, train_loss: 0.8601, test_loss: 1.0412, test_f1: 0.5518
 epoch: 42, train_loss: 0.8774, test_loss: 1.0417, test_f1: 0.5600
 epoch: 43, train_loss: 0.8713, test_loss: 1.0252, test_f1: 0.5518
 epoch: 44, train_loss: 0.8633, test_loss: 1.0370, test_f1: 0.5589
 epoch: 45, train_loss: 0.8630, test_loss: 1.0503, test_f1: 0.5464
 epoch: 46, train_loss: 0.8594, test_loss: 1.0483, test_f1: 0.5425
 epoch: 47, train_loss: 0.8577, test_loss: 1.0543, test_f1: 0.5494
 epoch: 48, train_loss: 0.8570, test_loss: 1.0489, test_f1: 0.5531
 epoch: 49, train_loss: 0.8515, test_loss: 1.0498, test_f1: 0.5556
 epoch: 50, train_loss: 0.8490, test_loss: 1.0466, test_f1: 0.5431
 epoch: 51, train_loss: 0.8387, test_loss: 1.0423, test_f1: 0.5493
 epoch: 52, train_loss: 0.8293, test_loss: 1.0439, test_f1: 0.5350
 epoch: 53, train_loss: 0.8519, test_loss: 1.0437, test_f1: 0.5371
 epoch: 54, train_loss: 0.8336, test_loss: 1.0443, test_f1: 0.5403
 epoch: 55, train_loss: 0.8446, test_loss: 1.0446, test_f1: 0.5517
 epoch: 56, train_loss: 0.8376, test_loss: 1.0501, test_f1: 0.5425
 epoch: 57, train_loss: 0.8300, test_loss: 1.0468, test_f1: 0.5428
 epoch: 58, train_loss: 0.8378, test_loss: 1.0470, test_f1: 0.5580
 epoch: 59, train_loss: 0.8266, test_loss: 1.0437, test_f1: 0.5518
 epoch: 60, train_loss: 0.8270, test_loss: 1.0442, test_f1: 0.5449
 epoch: 61, train_loss: 0.8351, test_loss: 1.0410, test_f1: 0.5450
 epoch: 62, train_loss: 0.8262, test_loss: 1.0524, test_f1: 0.5461
 epoch: 63, train_loss: 0.8180, test_loss: 1.0486, test_f1: 0.5460
 epoch: 64, train_loss: 0.8261, test_loss: 1.0516, test_f1: 0.5442
 epoch: 65, train_loss: 0.8314, test_loss: 1.0677, test_f1: 0.5356
 epoch: 66, train_loss: 0.8291, test_loss: 1.0530, test_f1: 0.5416
 epoch: 67, train_loss: 0.8238, test_loss: 1.0535, test_f1: 0.5440
 epoch: 68, train_loss: 0.8259, test_loss: 1.0494, test_f1: 0.5425
 epoch: 69, train_loss: 0.8153, test_loss: 1.0560, test_f1: 0.5627
 epoch: 70, train_loss: 0.8229, test_loss: 1.0536, test_f1: 0.5545
 epoch: 71, train_loss: 0.8278, test_loss: 1.0545, test_f1: 0.5556
 epoch: 72, train_loss: 0.8131, test_loss: 1.0539, test_f1: 0.5579
 epoch: 73, train_loss: 0.7995, test_loss: 1.0578, test_f1: 0.5619
 epoch: 74, train_loss: 0.8063, test_loss: 1.0638, test_f1: 0.5601
 epoch: 75, train_loss: 0.8113, test_loss: 1.0567, test_f1: 0.5443
 epoch: 76, train_loss: 0.8201, test_loss: 1.0569, test_f1: 0.5487
 epoch: 77, train_loss: 0.8091, test_loss: 1.0602, test_f1: 0.5578
 epoch: 78, train_loss: 0.8034, test_loss: 1.0592, test_f1: 0.5459
 epoch: 79, train_loss: 0.8119, test_loss: 1.0526, test_f1: 0.5483
 epoch: 80, train_loss: 0.8013, test_loss: 1.0704, test_f1: 0.5489
 epoch: 81, train_loss: 0.8080, test_loss: 1.0593, test_f1: 0.5354
 epoch: 82, train_loss: 0.8093, test_loss: 1.0657, test_f1: 0.5465
 epoch: 83, train_loss: 0.7964, test_loss: 1.0633, test_f1: 0.5428
 epoch: 84, train_loss: 0.7974, test_loss: 1.0819, test_f1: 0.5483
 epoch: 85, train_loss: 0.7870, test_loss: 1.0749, test_f1: 0.5483
 epoch: 86, train_loss: 0.7917, test_loss: 1.0690, test_f1: 0.5537
 epoch: 87, train_loss: 0.7951, test_loss: 1.0617, test_f1: 0.5432
 epoch: 88, train_loss: 0.7937, test_loss: 1.0626, test_f1: 0.5538
 epoch: 89, train_loss: 0.7948, test_loss: 1.0652, test_f1: 0.5535
 epoch: 90, train_loss: 0.7787, test_loss: 1.0565, test_f1: 0.5591
 epoch: 91, train_loss: 0.7613, test_loss: 1.0563, test_f1: 0.5674
 epoch: 92, train_loss: 0.7949, test_loss: 1.0623, test_f1: 0.5530
 epoch: 93, train_loss: 0.7825, test_loss: 1.0709, test_f1: 0.5491
 epoch: 94, train_loss: 0.7897, test_loss: 1.0709, test_f1: 0.5609
 epoch: 95, train_loss: 0.7852, test_loss: 1.0750, test_f1: 0.5562
 epoch: 96, train_loss: 0.7754, test_loss: 1.0762, test_f1: 0.5648
 epoch: 97, train_loss: 0.7785, test_loss: 1.0745, test_f1: 0.5602
 epoch: 98, train_loss: 0.7809, test_loss: 1.0534, test_f1: 0.5619
 epoch: 99, train_loss: 0.7768, test_loss: 1.0773, test_f1: 0.5417
##################ITERATION #9 ****************************************
 epoch: 0, train_loss: 1.2676, test_loss: 1.2749, test_f1: 0.2281
 epoch: 1, train_loss: 1.1722, test_loss: 1.2322, test_f1: 0.2394
 epoch: 2, train_loss: 1.1504, test_loss: 1.1910, test_f1: 0.3416
 epoch: 3, train_loss: 1.1219, test_loss: 1.1693, test_f1: 0.3733
 epoch: 4, train_loss: 1.1175, test_loss: 1.1548, test_f1: 0.3553
 epoch: 5, train_loss: 1.0980, test_loss: 1.1389, test_f1: 0.3546
 epoch: 6, train_loss: 1.0775, test_loss: 1.1267, test_f1: 0.3602
 epoch: 7, train_loss: 1.0738, test_loss: 1.1206, test_f1: 0.3795
 epoch: 8, train_loss: 1.0780, test_loss: 1.1165, test_f1: 0.3758
 epoch: 9, train_loss: 1.0475, test_loss: 1.1120, test_f1: 0.3743
 epoch: 10, train_loss: 1.0384, test_loss: 1.0985, test_f1: 0.3721
 epoch: 11, train_loss: 1.0468, test_loss: 1.0914, test_f1: 0.3878
 epoch: 12, train_loss: 1.0358, test_loss: 1.0850, test_f1: 0.3949
 epoch: 13, train_loss: 1.0236, test_loss: 1.0841, test_f1: 0.4185
 epoch: 14, train_loss: 1.0077, test_loss: 1.0729, test_f1: 0.4471
 epoch: 15, train_loss: 1.0130, test_loss: 1.0881, test_f1: 0.4647
 epoch: 16, train_loss: 1.0024, test_loss: 1.0711, test_f1: 0.4514
 epoch: 17, train_loss: 0.9894, test_loss: 1.0634, test_f1: 0.4632
 epoch: 18, train_loss: 0.9752, test_loss: 1.0605, test_f1: 0.4698
 epoch: 19, train_loss: 0.9798, test_loss: 1.0630, test_f1: 0.4740
 epoch: 20, train_loss: 0.9794, test_loss: 1.0613, test_f1: 0.4761
 epoch: 21, train_loss: 0.9659, test_loss: 1.0482, test_f1: 0.4821
 epoch: 22, train_loss: 0.9549, test_loss: 1.0346, test_f1: 0.4889
 epoch: 23, train_loss: 0.9516, test_loss: 1.0417, test_f1: 0.4842
 epoch: 24, train_loss: 0.9510, test_loss: 1.0377, test_f1: 0.4928
 epoch: 25, train_loss: 0.9519, test_loss: 1.0420, test_f1: 0.4779
 epoch: 26, train_loss: 0.9413, test_loss: 1.0364, test_f1: 0.4852
 epoch: 27, train_loss: 0.9361, test_loss: 1.0350, test_f1: 0.4927
 epoch: 28, train_loss: 0.9458, test_loss: 1.0330, test_f1: 0.4989
 epoch: 29, train_loss: 0.9251, test_loss: 1.0398, test_f1: 0.4927
 epoch: 30, train_loss: 0.9303, test_loss: 1.0436, test_f1: 0.4947
 epoch: 31, train_loss: 0.9217, test_loss: 1.0429, test_f1: 0.4851
 epoch: 32, train_loss: 0.9115, test_loss: 1.0362, test_f1: 0.4815
 epoch: 33, train_loss: 0.9152, test_loss: 1.0400, test_f1: 0.4927
 epoch: 34, train_loss: 0.9001, test_loss: 1.0299, test_f1: 0.4994
 epoch: 35, train_loss: 0.9133, test_loss: 1.0385, test_f1: 0.5200
 epoch: 36, train_loss: 0.8956, test_loss: 1.0395, test_f1: 0.5043
 epoch: 37, train_loss: 0.9088, test_loss: 1.0290, test_f1: 0.5109
 epoch: 38, train_loss: 0.8921, test_loss: 1.0349, test_f1: 0.5158
 epoch: 39, train_loss: 0.8906, test_loss: 1.0405, test_f1: 0.5150
 epoch: 40, train_loss: 0.9007, test_loss: 1.0394, test_f1: 0.5055
 epoch: 41, train_loss: 0.8862, test_loss: 1.0618, test_f1: 0.5069
 epoch: 42, train_loss: 0.8866, test_loss: 1.0556, test_f1: 0.5182
 epoch: 43, train_loss: 0.8883, test_loss: 1.0375, test_f1: 0.5085
 epoch: 44, train_loss: 0.8847, test_loss: 1.0396, test_f1: 0.5054
 epoch: 45, train_loss: 0.8782, test_loss: 1.0460, test_f1: 0.5035
 epoch: 46, train_loss: 0.8870, test_loss: 1.0468, test_f1: 0.5140
 epoch: 47, train_loss: 0.8694, test_loss: 1.0557, test_f1: 0.5019
 epoch: 48, train_loss: 0.8766, test_loss: 1.0533, test_f1: 0.5251
 epoch: 49, train_loss: 0.8667, test_loss: 1.0439, test_f1: 0.5334
 epoch: 50, train_loss: 0.8604, test_loss: 1.0507, test_f1: 0.5280
 epoch: 51, train_loss: 0.8748, test_loss: 1.0536, test_f1: 0.5258
 epoch: 52, train_loss: 0.8595, test_loss: 1.0581, test_f1: 0.5366
 epoch: 53, train_loss: 0.8561, test_loss: 1.0531, test_f1: 0.5348
 epoch: 54, train_loss: 0.8621, test_loss: 1.0567, test_f1: 0.5134
 epoch: 55, train_loss: 0.8533, test_loss: 1.0421, test_f1: 0.5267
 epoch: 56, train_loss: 0.8529, test_loss: 1.0442, test_f1: 0.5168
 epoch: 57, train_loss: 0.8587, test_loss: 1.0466, test_f1: 0.5234
 epoch: 58, train_loss: 0.8667, test_loss: 1.0549, test_f1: 0.5237
 epoch: 59, train_loss: 0.8540, test_loss: 1.0573, test_f1: 0.5470
 epoch: 60, train_loss: 0.8501, test_loss: 1.0446, test_f1: 0.5335
 epoch: 61, train_loss: 0.8589, test_loss: 1.0567, test_f1: 0.5359
 epoch: 62, train_loss: 0.8450, test_loss: 1.0444, test_f1: 0.5228
 epoch: 63, train_loss: 0.8460, test_loss: 1.0590, test_f1: 0.5261
 epoch: 64, train_loss: 0.8533, test_loss: 1.0633, test_f1: 0.5272
 epoch: 65, train_loss: 0.8352, test_loss: 1.0572, test_f1: 0.5379
 epoch: 66, train_loss: 0.8463, test_loss: 1.0604, test_f1: 0.5354
 epoch: 67, train_loss: 0.8365, test_loss: 1.0535, test_f1: 0.5407
 epoch: 68, train_loss: 0.8325, test_loss: 1.0493, test_f1: 0.5371
 epoch: 69, train_loss: 0.8406, test_loss: 1.0501, test_f1: 0.5280
 epoch: 70, train_loss: 0.8342, test_loss: 1.0550, test_f1: 0.5412
 epoch: 71, train_loss: 0.8460, test_loss: 1.0492, test_f1: 0.5378
 epoch: 72, train_loss: 0.8302, test_loss: 1.0530, test_f1: 0.5436
 epoch: 73, train_loss: 0.8268, test_loss: 1.0533, test_f1: 0.5377
 epoch: 74, train_loss: 0.8352, test_loss: 1.0529, test_f1: 0.5312
 epoch: 75, train_loss: 0.8352, test_loss: 1.0566, test_f1: 0.5428
 epoch: 76, train_loss: 0.8333, test_loss: 1.0538, test_f1: 0.5391
 epoch: 77, train_loss: 0.8335, test_loss: 1.0462, test_f1: 0.5471
 epoch: 78, train_loss: 0.8361, test_loss: 1.0388, test_f1: 0.5533
 epoch: 79, train_loss: 0.8312, test_loss: 1.0377, test_f1: 0.5387
 epoch: 80, train_loss: 0.8381, test_loss: 1.0386, test_f1: 0.5432
 epoch: 81, train_loss: 0.8311, test_loss: 1.0520, test_f1: 0.5562
 epoch: 82, train_loss: 0.8313, test_loss: 1.0429, test_f1: 0.5507
 epoch: 83, train_loss: 0.8259, test_loss: 1.0479, test_f1: 0.5513
 epoch: 84, train_loss: 0.8213, test_loss: 1.0388, test_f1: 0.5650
 epoch: 85, train_loss: 0.8158, test_loss: 1.0422, test_f1: 0.5675
 epoch: 86, train_loss: 0.8146, test_loss: 1.0408, test_f1: 0.5528
 epoch: 87, train_loss: 0.8226, test_loss: 1.0431, test_f1: 0.5601
 epoch: 88, train_loss: 0.8220, test_loss: 1.0373, test_f1: 0.5652
 epoch: 89, train_loss: 0.8241, test_loss: 1.0495, test_f1: 0.5521
 epoch: 90, train_loss: 0.8265, test_loss: 1.0553, test_f1: 0.5460
 epoch: 91, train_loss: 0.8145, test_loss: 1.0342, test_f1: 0.5700
 epoch: 92, train_loss: 0.8286, test_loss: 1.0348, test_f1: 0.5670
 epoch: 93, train_loss: 0.8225, test_loss: 1.0456, test_f1: 0.5522
 epoch: 94, train_loss: 0.8185, test_loss: 1.0461, test_f1: 0.5621
 epoch: 95, train_loss: 0.8089, test_loss: 1.0373, test_f1: 0.5626
 epoch: 96, train_loss: 0.8123, test_loss: 1.0383, test_f1: 0.5674
 epoch: 97, train_loss: 0.8064, test_loss: 1.0437, test_f1: 0.5564
 epoch: 98, train_loss: 0.8105, test_loss: 1.0502, test_f1: 0.5595
 epoch: 99, train_loss: 0.8188, test_loss: 1.0426, test_f1: 0.5444

Training completed in 526.69 seconds
Best F1: 0.6082 at epoch 77
Mean F1 across iterations: 0.5632  0.0264
========================FINAL RESULTS================================
FEGIN weighted F1: 0.6082  0.0264
python main.py --data ltspice_demos --representation component_net --model FEGIN --layers 2 --hiddens 64 --batch_size 64 --lr 0.0001 --emb_size 128 --epochs 100 --save_appendix component_net_L2_H64_BS64_LR0.0001_E128 --no_val
-----



STDERR:
  File "main.py", line 370, in <module>
    main()
  File "main.py", line 254, in main
    dataset = dataset_class(
  File "/home/philip/projects/ltspice_examples_code_repo/Circuit-Completion-Using-GNNs/component_classification_with_link_prediction_head/evaluation/FEGIN/kernel/circuit_datasets.py", line 15, in __init__
    self.data, self.slices = torch.load(self.processed_paths[0])
  File "/home/philip/.local/lib/python3.8/site-packages/torch/serialization.py", line 1040, in load
    warnings.warn(
  File "/usr/lib/python3.8/warnings.py", line 109, in _showwarnmsg
    sw(msg.message, msg.category, msg.filename, msg.lineno,
  File "main.py", line 47, in warn_with_traceback
    traceback.print_stack(file=log)
/home/philip/projects/ltspice_examples_code_repo/Circuit-Completion-Using-GNNs/component_classification_with_link_prediction_head/evaluation/FEGIN/kernel/circuit_datasets.py:15: FutureWarning: You are using `torch.load` with `weights_only=False` (the current default value), which uses the default pickle module implicitly. It is possible to construct malicious pickle data which will execute arbitrary code during unpickling (See https://github.com/pytorch/pytorch/blob/main/SECURITY.md#untrusted-models for more details). In a future release, the default value for `weights_only` will be flipped to `True`. This limits the functions that could be executed during unpickling. Arbitrary objects will no longer be allowed to be loaded via this mode unless they are explicitly allowlisted by the user via `torch.serialization.add_safe_globals`. We recommend you start setting `weights_only=True` for any use case where you don't have full control of the loaded file. Please open an issue on GitHub for any issues related to this experimental feature.
  self.data, self.slices = torch.load(self.processed_paths[0])
