STDOUT:
Results will be saved in /home/philip/projects/ltspice_examples_code_repo/Circuit-Completion-Using-GNNs/component_classification_with_link_prediction_head/evaluation/FEGIN/results/model_FEGIN_dataset_ltspice_demos
Command line input: python main.py --data ltspice_demos --representation component_component --model FEGIN --layers 4 --hiddens 64 --batch_size 32 --lr 0.001 --emb_size 128 --epochs 100 --save_appendix component_component_L4_H64_BS32_LR0.001_E128 --no_val
 is saved.
-----
ltspice_demos - FEGIN
Using 4 layers, 64 hidden units, h = 2
Loading component_component representation dataset
ENTERED
Training FEGIN on component_component representation
Train: 1565, Test: 383
##################ITERATION #0 ****************************************
 epoch: 0, train_loss: 1.2535, test_loss: 1.3530, test_f1: 0.3200
 epoch: 1, train_loss: 1.1631, test_loss: 1.2646, test_f1: 0.3674
 epoch: 2, train_loss: 1.1056, test_loss: 1.2075, test_f1: 0.3311
 epoch: 3, train_loss: 1.0584, test_loss: 1.2274, test_f1: 0.3804
 epoch: 4, train_loss: 1.0357, test_loss: 1.1955, test_f1: 0.4415
 epoch: 5, train_loss: 1.0120, test_loss: 1.1527, test_f1: 0.4913
 epoch: 6, train_loss: 0.9741, test_loss: 1.2605, test_f1: 0.5360
 epoch: 7, train_loss: 0.9435, test_loss: 1.2350, test_f1: 0.5335
 epoch: 8, train_loss: 0.9155, test_loss: 1.2279, test_f1: 0.5353
 epoch: 9, train_loss: 0.8738, test_loss: 1.3744, test_f1: 0.5340
 epoch: 10, train_loss: 0.8588, test_loss: 1.1628, test_f1: 0.5523
 epoch: 11, train_loss: 0.8315, test_loss: 1.1634, test_f1: 0.6034
 epoch: 12, train_loss: 0.8323, test_loss: 1.2126, test_f1: 0.5580
 epoch: 13, train_loss: 0.8107, test_loss: 1.1977, test_f1: 0.5345
 epoch: 14, train_loss: 0.7768, test_loss: 1.3466, test_f1: 0.5261
 epoch: 15, train_loss: 0.7892, test_loss: 1.2461, test_f1: 0.5684
 epoch: 16, train_loss: 0.7559, test_loss: 1.2898, test_f1: 0.5792
 epoch: 17, train_loss: 0.7605, test_loss: 1.2349, test_f1: 0.5823
 epoch: 18, train_loss: 0.7480, test_loss: 1.1953, test_f1: 0.5899
 epoch: 19, train_loss: 0.7155, test_loss: 1.4291, test_f1: 0.5699
 epoch: 20, train_loss: 0.7107, test_loss: 1.2953, test_f1: 0.6155
 epoch: 21, train_loss: 0.6999, test_loss: 1.4467, test_f1: 0.5520
 epoch: 22, train_loss: 0.6879, test_loss: 1.3381, test_f1: 0.5624
 epoch: 23, train_loss: 0.6726, test_loss: 1.5318, test_f1: 0.5493
 epoch: 24, train_loss: 0.6818, test_loss: 1.3805, test_f1: 0.5491
 epoch: 25, train_loss: 0.6581, test_loss: 1.5969, test_f1: 0.5231
 epoch: 26, train_loss: 0.6533, test_loss: 1.5688, test_f1: 0.5226
 epoch: 27, train_loss: 0.6612, test_loss: 1.6878, test_f1: 0.5099
 epoch: 28, train_loss: 0.5969, test_loss: 1.7988, test_f1: 0.5767
 epoch: 29, train_loss: 0.6071, test_loss: 1.8910, test_f1: 0.5371
 epoch: 30, train_loss: 0.6127, test_loss: 1.5462, test_f1: 0.6355
 epoch: 31, train_loss: 0.6145, test_loss: 1.5182, test_f1: 0.5678
 epoch: 32, train_loss: 0.6115, test_loss: 1.8784, test_f1: 0.5127
 epoch: 33, train_loss: 0.6066, test_loss: 1.8093, test_f1: 0.5146
 epoch: 34, train_loss: 0.5640, test_loss: 1.7214, test_f1: 0.5454
 epoch: 35, train_loss: 0.5518, test_loss: 1.6208, test_f1: 0.6135
 epoch: 36, train_loss: 0.5390, test_loss: 1.8742, test_f1: 0.5414
 epoch: 37, train_loss: 0.5358, test_loss: 2.1589, test_f1: 0.5524
 epoch: 38, train_loss: 0.5560, test_loss: 1.8000, test_f1: 0.5228
 epoch: 39, train_loss: 0.5444, test_loss: 1.8913, test_f1: 0.5535
 epoch: 40, train_loss: 0.5303, test_loss: 1.7992, test_f1: 0.5724
 epoch: 41, train_loss: 0.5902, test_loss: 1.7788, test_f1: 0.5808
 epoch: 42, train_loss: 0.5519, test_loss: 1.7136, test_f1: 0.5868
 epoch: 43, train_loss: 0.5409, test_loss: 1.6443, test_f1: 0.5457
 epoch: 44, train_loss: 0.4887, test_loss: 1.8764, test_f1: 0.5244
 epoch: 45, train_loss: 0.4966, test_loss: 2.4868, test_f1: 0.5561
 epoch: 46, train_loss: 0.5356, test_loss: 2.0814, test_f1: 0.5518
 epoch: 47, train_loss: 0.4669, test_loss: 2.1294, test_f1: 0.5649
 epoch: 48, train_loss: 0.4747, test_loss: 2.3358, test_f1: 0.5651
 epoch: 49, train_loss: 0.4849, test_loss: 1.8979, test_f1: 0.5827
 epoch: 50, train_loss: 0.4978, test_loss: 1.8993, test_f1: 0.5447
 epoch: 51, train_loss: 0.4468, test_loss: 2.2616, test_f1: 0.5593
 epoch: 52, train_loss: 0.4080, test_loss: 2.0606, test_f1: 0.5595
 epoch: 53, train_loss: 0.3889, test_loss: 2.4287, test_f1: 0.5417
 epoch: 54, train_loss: 0.3982, test_loss: 1.8695, test_f1: 0.5572
 epoch: 55, train_loss: 0.3879, test_loss: 2.3398, test_f1: 0.5490
 epoch: 56, train_loss: 0.3642, test_loss: 2.6480, test_f1: 0.5557
 epoch: 57, train_loss: 0.3670, test_loss: 2.4610, test_f1: 0.5559
 epoch: 58, train_loss: 0.3574, test_loss: 2.3447, test_f1: 0.5731
 epoch: 59, train_loss: 0.3587, test_loss: 2.2693, test_f1: 0.5605
 epoch: 60, train_loss: 0.3219, test_loss: 2.3092, test_f1: 0.5747
 epoch: 61, train_loss: 0.3727, test_loss: 2.4264, test_f1: 0.5876
 epoch: 62, train_loss: 0.4018, test_loss: 2.1300, test_f1: 0.5962
 epoch: 63, train_loss: 0.3489, test_loss: 2.3775, test_f1: 0.5564
 epoch: 64, train_loss: 0.3354, test_loss: 2.6302, test_f1: 0.5639
 epoch: 65, train_loss: 0.3268, test_loss: 2.6480, test_f1: 0.5472
 epoch: 66, train_loss: 0.3343, test_loss: 2.4875, test_f1: 0.5740
 epoch: 67, train_loss: 0.3321, test_loss: 2.3858, test_f1: 0.5556
 epoch: 68, train_loss: 0.3428, test_loss: 2.4006, test_f1: 0.5405
 epoch: 69, train_loss: 0.3442, test_loss: 2.3810, test_f1: 0.5862
 epoch: 70, train_loss: 0.3332, test_loss: 2.2830, test_f1: 0.5826
 epoch: 71, train_loss: 0.3217, test_loss: 2.5304, test_f1: 0.5840
 epoch: 72, train_loss: 0.3138, test_loss: 2.6214, test_f1: 0.5837
 epoch: 73, train_loss: 0.2935, test_loss: 2.8246, test_f1: 0.5598
 epoch: 74, train_loss: 0.3197, test_loss: 3.1225, test_f1: 0.5355
 epoch: 75, train_loss: 0.2993, test_loss: 2.6918, test_f1: 0.5530
 epoch: 76, train_loss: 0.3089, test_loss: 2.9037, test_f1: 0.5760
 epoch: 77, train_loss: 0.3245, test_loss: 2.7074, test_f1: 0.5608
 epoch: 78, train_loss: 0.3244, test_loss: 2.5023, test_f1: 0.6150
 epoch: 79, train_loss: 0.3080, test_loss: 2.6492, test_f1: 0.5891
 epoch: 80, train_loss: 0.3008, test_loss: 2.9461, test_f1: 0.5800
 epoch: 81, train_loss: 0.2936, test_loss: 2.7626, test_f1: 0.5714
 epoch: 82, train_loss: 0.3053, test_loss: 2.5572, test_f1: 0.5735
 epoch: 83, train_loss: 0.2936, test_loss: 2.6732, test_f1: 0.5541
 epoch: 84, train_loss: 0.2970, test_loss: 2.6791, test_f1: 0.5379
 epoch: 85, train_loss: 0.2712, test_loss: 2.8269, test_f1: 0.5892
 epoch: 86, train_loss: 0.2810, test_loss: 2.8471, test_f1: 0.5484
 epoch: 87, train_loss: 0.2897, test_loss: 2.7788, test_f1: 0.5709
 epoch: 88, train_loss: 0.3020, test_loss: 2.7790, test_f1: 0.5814
 epoch: 89, train_loss: 0.2688, test_loss: 2.6545, test_f1: 0.5854
 epoch: 90, train_loss: 0.2587, test_loss: 3.3316, test_f1: 0.5907
 epoch: 91, train_loss: 0.2833, test_loss: 3.2920, test_f1: 0.5850
 epoch: 92, train_loss: 0.2650, test_loss: 2.9010, test_f1: 0.5872
 epoch: 93, train_loss: 0.2868, test_loss: 3.2963, test_f1: 0.5708
 epoch: 94, train_loss: 0.2599, test_loss: 2.9702, test_f1: 0.5809
 epoch: 95, train_loss: 0.2741, test_loss: 3.3068, test_f1: 0.5789
 epoch: 96, train_loss: 0.2654, test_loss: 3.4390, test_f1: 0.5904
 epoch: 97, train_loss: 0.2393, test_loss: 3.5136, test_f1: 0.5650
 epoch: 98, train_loss: 0.2843, test_loss: 2.8354, test_f1: 0.5898
 epoch: 99, train_loss: 0.2646, test_loss: 3.2728, test_f1: 0.5791
##################ITERATION #1 ****************************************
 epoch: 0, train_loss: 1.2225, test_loss: 1.2603, test_f1: 0.4806
 epoch: 1, train_loss: 1.1078, test_loss: 1.2087, test_f1: 0.4945
 epoch: 2, train_loss: 1.0545, test_loss: 1.2757, test_f1: 0.4633
 epoch: 3, train_loss: 1.0468, test_loss: 1.2053, test_f1: 0.4952
 epoch: 4, train_loss: 1.0097, test_loss: 1.2158, test_f1: 0.4605
 epoch: 5, train_loss: 0.9554, test_loss: 1.1150, test_f1: 0.5014
 epoch: 6, train_loss: 0.9275, test_loss: 1.2381, test_f1: 0.4790
 epoch: 7, train_loss: 0.9036, test_loss: 1.1443, test_f1: 0.5447
 epoch: 8, train_loss: 0.8747, test_loss: 1.1808, test_f1: 0.5376
 epoch: 9, train_loss: 0.8433, test_loss: 1.1509, test_f1: 0.5566
 epoch: 10, train_loss: 0.8596, test_loss: 1.0650, test_f1: 0.5975
 epoch: 11, train_loss: 0.8653, test_loss: 1.0792, test_f1: 0.5631
 epoch: 12, train_loss: 0.8183, test_loss: 1.1579, test_f1: 0.5432
 epoch: 13, train_loss: 0.8024, test_loss: 1.2672, test_f1: 0.5424
 epoch: 14, train_loss: 0.7956, test_loss: 1.2447, test_f1: 0.5520
 epoch: 15, train_loss: 0.7673, test_loss: 1.3065, test_f1: 0.5400
 epoch: 16, train_loss: 0.7578, test_loss: 1.3184, test_f1: 0.5576
 epoch: 17, train_loss: 0.7530, test_loss: 1.5672, test_f1: 0.5367
 epoch: 18, train_loss: 0.7658, test_loss: 1.2910, test_f1: 0.5750
 epoch: 19, train_loss: 0.7361, test_loss: 1.4437, test_f1: 0.5733
 epoch: 20, train_loss: 0.7247, test_loss: 1.5917, test_f1: 0.4928
 epoch: 21, train_loss: 0.7330, test_loss: 1.4674, test_f1: 0.5454
 epoch: 22, train_loss: 0.7306, test_loss: 1.5499, test_f1: 0.5517
 epoch: 23, train_loss: 0.7028, test_loss: 1.5531, test_f1: 0.5418
 epoch: 24, train_loss: 0.6898, test_loss: 1.6938, test_f1: 0.5821
 epoch: 25, train_loss: 0.6907, test_loss: 1.4867, test_f1: 0.5467
 epoch: 26, train_loss: 0.6838, test_loss: 1.4063, test_f1: 0.5121
 epoch: 27, train_loss: 0.6592, test_loss: 1.7198, test_f1: 0.5320
 epoch: 28, train_loss: 0.6725, test_loss: 1.6026, test_f1: 0.5443
 epoch: 29, train_loss: 0.6178, test_loss: 1.6903, test_f1: 0.5151
 epoch: 30, train_loss: 0.6211, test_loss: 1.7251, test_f1: 0.5729
 epoch: 31, train_loss: 0.6718, test_loss: 1.7556, test_f1: 0.5640
 epoch: 32, train_loss: 0.6504, test_loss: 1.7036, test_f1: 0.5645
 epoch: 33, train_loss: 0.6049, test_loss: 1.8936, test_f1: 0.4979
 epoch: 34, train_loss: 0.5745, test_loss: 1.9470, test_f1: 0.5375
 epoch: 35, train_loss: 0.5938, test_loss: 1.6937, test_f1: 0.5279
 epoch: 36, train_loss: 0.5898, test_loss: 1.8109, test_f1: 0.5201
 epoch: 37, train_loss: 0.5993, test_loss: 1.7520, test_f1: 0.5357
 epoch: 38, train_loss: 0.5717, test_loss: 1.9838, test_f1: 0.5759
 epoch: 39, train_loss: 0.5552, test_loss: 1.9885, test_f1: 0.5295
 epoch: 40, train_loss: 0.5574, test_loss: 1.8202, test_f1: 0.5579
 epoch: 41, train_loss: 0.5633, test_loss: 1.8545, test_f1: 0.5518
 epoch: 42, train_loss: 0.5725, test_loss: 1.9985, test_f1: 0.5260
 epoch: 43, train_loss: 0.5462, test_loss: 1.6245, test_f1: 0.5648
 epoch: 44, train_loss: 0.5094, test_loss: 2.1223, test_f1: 0.5201
 epoch: 45, train_loss: 0.5142, test_loss: 1.8127, test_f1: 0.5365
 epoch: 46, train_loss: 0.5512, test_loss: 1.7932, test_f1: 0.5333
 epoch: 47, train_loss: 0.5253, test_loss: 1.5958, test_f1: 0.6180
 epoch: 48, train_loss: 0.5278, test_loss: 1.8918, test_f1: 0.5612
 epoch: 49, train_loss: 0.5089, test_loss: 2.1751, test_f1: 0.5266
 epoch: 50, train_loss: 0.5090, test_loss: 2.0098, test_f1: 0.5943
 epoch: 51, train_loss: 0.4683, test_loss: 2.1321, test_f1: 0.5649
 epoch: 52, train_loss: 0.4314, test_loss: 2.1713, test_f1: 0.5521
 epoch: 53, train_loss: 0.4347, test_loss: 2.0957, test_f1: 0.5332
 epoch: 54, train_loss: 0.4007, test_loss: 2.1838, test_f1: 0.5747
 epoch: 55, train_loss: 0.3948, test_loss: 2.3735, test_f1: 0.5522
 epoch: 56, train_loss: 0.3912, test_loss: 2.5157, test_f1: 0.5836
 epoch: 57, train_loss: 0.4172, test_loss: 2.3731, test_f1: 0.5580
 epoch: 58, train_loss: 0.3828, test_loss: 2.3086, test_f1: 0.5736
 epoch: 59, train_loss: 0.3698, test_loss: 2.5113, test_f1: 0.5609
 epoch: 60, train_loss: 0.3962, test_loss: 2.5265, test_f1: 0.5083
 epoch: 61, train_loss: 0.3988, test_loss: 2.6278, test_f1: 0.5431
 epoch: 62, train_loss: 0.3629, test_loss: 2.6217, test_f1: 0.5466
 epoch: 63, train_loss: 0.3711, test_loss: 2.5299, test_f1: 0.5628
 epoch: 64, train_loss: 0.3444, test_loss: 2.9059, test_f1: 0.5554
 epoch: 65, train_loss: 0.3770, test_loss: 2.8480, test_f1: 0.5293
 epoch: 66, train_loss: 0.3662, test_loss: 2.5776, test_f1: 0.5657
 epoch: 67, train_loss: 0.3468, test_loss: 2.7904, test_f1: 0.5496
 epoch: 68, train_loss: 0.3567, test_loss: 2.6262, test_f1: 0.5496
 epoch: 69, train_loss: 0.3371, test_loss: 2.8573, test_f1: 0.5248
 epoch: 70, train_loss: 0.3339, test_loss: 2.9453, test_f1: 0.5352
 epoch: 71, train_loss: 0.3409, test_loss: 2.7231, test_f1: 0.5416
 epoch: 72, train_loss: 0.3670, test_loss: 2.9070, test_f1: 0.5589
 epoch: 73, train_loss: 0.3570, test_loss: 3.1511, test_f1: 0.5273
 epoch: 74, train_loss: 0.3422, test_loss: 2.8582, test_f1: 0.5308
 epoch: 75, train_loss: 0.3360, test_loss: 2.7074, test_f1: 0.5530
 epoch: 76, train_loss: 0.3067, test_loss: 2.7385, test_f1: 0.5358
 epoch: 77, train_loss: 0.3462, test_loss: 3.1205, test_f1: 0.5402
 epoch: 78, train_loss: 0.3369, test_loss: 2.7208, test_f1: 0.5489
 epoch: 79, train_loss: 0.3366, test_loss: 2.8111, test_f1: 0.5357
 epoch: 80, train_loss: 0.3167, test_loss: 2.8591, test_f1: 0.5130
 epoch: 81, train_loss: 0.3126, test_loss: 2.9091, test_f1: 0.5205
 epoch: 82, train_loss: 0.2892, test_loss: 3.0685, test_f1: 0.5124
 epoch: 83, train_loss: 0.3022, test_loss: 2.9892, test_f1: 0.5268
 epoch: 84, train_loss: 0.3288, test_loss: 3.0506, test_f1: 0.5388
 epoch: 85, train_loss: 0.3068, test_loss: 2.8936, test_f1: 0.5305
 epoch: 86, train_loss: 0.2854, test_loss: 2.8822, test_f1: 0.5247
 epoch: 87, train_loss: 0.3092, test_loss: 3.2178, test_f1: 0.5604
 epoch: 88, train_loss: 0.3167, test_loss: 3.1227, test_f1: 0.5331
 epoch: 89, train_loss: 0.2922, test_loss: 2.9476, test_f1: 0.5384
 epoch: 90, train_loss: 0.2918, test_loss: 2.9788, test_f1: 0.5385
 epoch: 91, train_loss: 0.2752, test_loss: 2.9317, test_f1: 0.5311
 epoch: 92, train_loss: 0.2886, test_loss: 2.8557, test_f1: 0.5859
 epoch: 93, train_loss: 0.3033, test_loss: 3.1387, test_f1: 0.5393
 epoch: 94, train_loss: 0.2701, test_loss: 2.8526, test_f1: 0.5522
 epoch: 95, train_loss: 0.2838, test_loss: 3.1193, test_f1: 0.5521
 epoch: 96, train_loss: 0.2954, test_loss: 3.3154, test_f1: 0.5509
 epoch: 97, train_loss: 0.3012, test_loss: 3.0157, test_f1: 0.5567
 epoch: 98, train_loss: 0.2793, test_loss: 3.1038, test_f1: 0.5851
 epoch: 99, train_loss: 0.2753, test_loss: 3.0090, test_f1: 0.5451
##################ITERATION #2 ****************************************
 epoch: 0, train_loss: 1.2289, test_loss: 1.2707, test_f1: 0.3656
 epoch: 1, train_loss: 1.1124, test_loss: 1.2234, test_f1: 0.3676
 epoch: 2, train_loss: 1.0809, test_loss: 1.1981, test_f1: 0.5102
 epoch: 3, train_loss: 1.0304, test_loss: 1.2647, test_f1: 0.4911
 epoch: 4, train_loss: 1.0250, test_loss: 1.1515, test_f1: 0.5389
 epoch: 5, train_loss: 0.9691, test_loss: 1.3223, test_f1: 0.5450
 epoch: 6, train_loss: 0.9412, test_loss: 1.2556, test_f1: 0.5438
 epoch: 7, train_loss: 0.9293, test_loss: 1.1876, test_f1: 0.5273
 epoch: 8, train_loss: 0.8995, test_loss: 1.1675, test_f1: 0.5847
 epoch: 9, train_loss: 0.8920, test_loss: 1.2240, test_f1: 0.5898
 epoch: 10, train_loss: 0.8466, test_loss: 1.1922, test_f1: 0.5830
 epoch: 11, train_loss: 0.8766, test_loss: 1.2599, test_f1: 0.5064
 epoch: 12, train_loss: 0.8516, test_loss: 1.9614, test_f1: 0.5194
 epoch: 13, train_loss: 0.8270, test_loss: 1.3505, test_f1: 0.5413
 epoch: 14, train_loss: 0.7934, test_loss: 1.3669, test_f1: 0.5289
 epoch: 15, train_loss: 0.7912, test_loss: 1.4640, test_f1: 0.5472
 epoch: 16, train_loss: 0.8131, test_loss: 1.4847, test_f1: 0.5432
 epoch: 17, train_loss: 0.7769, test_loss: 1.4361, test_f1: 0.5579
 epoch: 18, train_loss: 0.7804, test_loss: 1.5386, test_f1: 0.5558
 epoch: 19, train_loss: 0.7718, test_loss: 1.5560, test_f1: 0.5163
 epoch: 20, train_loss: 0.7630, test_loss: 1.4104, test_f1: 0.5610
 epoch: 21, train_loss: 0.7396, test_loss: 1.7237, test_f1: 0.4959
 epoch: 22, train_loss: 0.7294, test_loss: 1.4430, test_f1: 0.5954
 epoch: 23, train_loss: 0.7060, test_loss: 1.7329, test_f1: 0.5819
 epoch: 24, train_loss: 0.7251, test_loss: 1.9043, test_f1: 0.5616
 epoch: 25, train_loss: 0.7235, test_loss: 1.6843, test_f1: 0.5859
 epoch: 26, train_loss: 0.6865, test_loss: 1.7247, test_f1: 0.5129
 epoch: 27, train_loss: 0.6769, test_loss: 1.7754, test_f1: 0.4724
 epoch: 28, train_loss: 0.6741, test_loss: 1.7980, test_f1: 0.5520
 epoch: 29, train_loss: 0.6959, test_loss: 1.5564, test_f1: 0.5417
 epoch: 30, train_loss: 0.6675, test_loss: 1.6103, test_f1: 0.5754
 epoch: 31, train_loss: 0.6744, test_loss: 1.6229, test_f1: 0.5835
 epoch: 32, train_loss: 0.6499, test_loss: 1.3016, test_f1: 0.5742
 epoch: 33, train_loss: 0.6545, test_loss: 1.5406, test_f1: 0.4801
 epoch: 34, train_loss: 0.6216, test_loss: 1.5721, test_f1: 0.5101
 epoch: 35, train_loss: 0.6250, test_loss: 1.4271, test_f1: 0.5849
 epoch: 36, train_loss: 0.5947, test_loss: 1.9712, test_f1: 0.5352
 epoch: 37, train_loss: 0.6283, test_loss: 1.8024, test_f1: 0.5617
 epoch: 38, train_loss: 0.6047, test_loss: 1.8049, test_f1: 0.5794
 epoch: 39, train_loss: 0.5715, test_loss: 2.3957, test_f1: 0.4996
 epoch: 40, train_loss: 0.5792, test_loss: 1.8514, test_f1: 0.5085
 epoch: 41, train_loss: 0.6450, test_loss: 1.7434, test_f1: 0.5559
 epoch: 42, train_loss: 0.5808, test_loss: 2.1201, test_f1: 0.5659
 epoch: 43, train_loss: 0.5756, test_loss: 1.9223, test_f1: 0.5424
 epoch: 44, train_loss: 0.5554, test_loss: 2.0282, test_f1: 0.5256
 epoch: 45, train_loss: 0.5281, test_loss: 2.2005, test_f1: 0.5956
 epoch: 46, train_loss: 0.5205, test_loss: 2.2860, test_f1: 0.5481
 epoch: 47, train_loss: 0.5606, test_loss: 2.0225, test_f1: 0.5532
 epoch: 48, train_loss: 0.5932, test_loss: 2.1785, test_f1: 0.5336
 epoch: 49, train_loss: 0.5397, test_loss: 2.4077, test_f1: 0.5750
 epoch: 50, train_loss: 0.5262, test_loss: 2.5287, test_f1: 0.5160
 epoch: 51, train_loss: 0.4935, test_loss: 1.9786, test_f1: 0.5615
 epoch: 52, train_loss: 0.4658, test_loss: 2.3853, test_f1: 0.5397
 epoch: 53, train_loss: 0.4514, test_loss: 2.8699, test_f1: 0.5177
 epoch: 54, train_loss: 0.4306, test_loss: 2.3594, test_f1: 0.5615
 epoch: 55, train_loss: 0.4543, test_loss: 2.9399, test_f1: 0.5327
 epoch: 56, train_loss: 0.4485, test_loss: 2.8360, test_f1: 0.5326
 epoch: 57, train_loss: 0.4377, test_loss: 2.4124, test_f1: 0.5881
 epoch: 58, train_loss: 0.4226, test_loss: 3.4024, test_f1: 0.5663
 epoch: 59, train_loss: 0.4366, test_loss: 3.1020, test_f1: 0.5625
 epoch: 60, train_loss: 0.3999, test_loss: 3.2802, test_f1: 0.5924
 epoch: 61, train_loss: 0.4130, test_loss: 2.5841, test_f1: 0.5851
 epoch: 62, train_loss: 0.4360, test_loss: 3.5105, test_f1: 0.5461
 epoch: 63, train_loss: 0.4270, test_loss: 2.6144, test_f1: 0.5507
 epoch: 64, train_loss: 0.4212, test_loss: 2.7381, test_f1: 0.5643
 epoch: 65, train_loss: 0.4008, test_loss: 3.4971, test_f1: 0.5151
 epoch: 66, train_loss: 0.3949, test_loss: 2.6413, test_f1: 0.5471
 epoch: 67, train_loss: 0.3934, test_loss: 2.1593, test_f1: 0.5813
 epoch: 68, train_loss: 0.3860, test_loss: 2.9713, test_f1: 0.5423
 epoch: 69, train_loss: 0.4159, test_loss: 3.0744, test_f1: 0.5452
 epoch: 70, train_loss: 0.3895, test_loss: 4.0988, test_f1: 0.5373
 epoch: 71, train_loss: 0.4068, test_loss: 2.5381, test_f1: 0.5414
 epoch: 72, train_loss: 0.3808, test_loss: 3.3618, test_f1: 0.5245
 epoch: 73, train_loss: 0.3478, test_loss: 2.5348, test_f1: 0.5514
 epoch: 74, train_loss: 0.3591, test_loss: 2.3661, test_f1: 0.5696
 epoch: 75, train_loss: 0.3790, test_loss: 3.0109, test_f1: 0.5765
 epoch: 76, train_loss: 0.3835, test_loss: 2.9533, test_f1: 0.5832
 epoch: 77, train_loss: 0.4041, test_loss: 2.5270, test_f1: 0.5935
 epoch: 78, train_loss: 0.3639, test_loss: 3.2682, test_f1: 0.5823
 epoch: 79, train_loss: 0.3672, test_loss: 2.5648, test_f1: 0.5799
 epoch: 80, train_loss: 0.3803, test_loss: 3.0171, test_f1: 0.5447
 epoch: 81, train_loss: 0.3651, test_loss: 2.5493, test_f1: 0.5917
 epoch: 82, train_loss: 0.3564, test_loss: 2.5751, test_f1: 0.5527
 epoch: 83, train_loss: 0.3726, test_loss: 2.7568, test_f1: 0.6057
 epoch: 84, train_loss: 0.3497, test_loss: 3.2032, test_f1: 0.5750
 epoch: 85, train_loss: 0.3396, test_loss: 2.8756, test_f1: 0.5826
 epoch: 86, train_loss: 0.3714, test_loss: 3.1299, test_f1: 0.5642
 epoch: 87, train_loss: 0.3454, test_loss: 3.1487, test_f1: 0.5575
 epoch: 88, train_loss: 0.3321, test_loss: 3.4782, test_f1: 0.5942
 epoch: 89, train_loss: 0.3387, test_loss: 3.4626, test_f1: 0.5674
 epoch: 90, train_loss: 0.3415, test_loss: 3.7356, test_f1: 0.5255
 epoch: 91, train_loss: 0.3552, test_loss: 2.9334, test_f1: 0.5805
 epoch: 92, train_loss: 0.2925, test_loss: 3.0982, test_f1: 0.5584
 epoch: 93, train_loss: 0.3163, test_loss: 3.4937, test_f1: 0.5513
 epoch: 94, train_loss: 0.3372, test_loss: 3.6221, test_f1: 0.5698
 epoch: 95, train_loss: 0.3230, test_loss: 3.4131, test_f1: 0.5532
 epoch: 96, train_loss: 0.2981, test_loss: 3.5665, test_f1: 0.5474
 epoch: 97, train_loss: 0.3558, test_loss: 3.3255, test_f1: 0.5525
 epoch: 98, train_loss: 0.3203, test_loss: 3.8688, test_f1: 0.5397
 epoch: 99, train_loss: 0.3139, test_loss: 4.0731, test_f1: 0.5626
##################ITERATION #3 ****************************************
 epoch: 0, train_loss: 1.2576, test_loss: 1.3654, test_f1: 0.4541
 epoch: 1, train_loss: 1.1456, test_loss: 1.3274, test_f1: 0.4842
 epoch: 2, train_loss: 1.0864, test_loss: 1.4847, test_f1: 0.4248
 epoch: 3, train_loss: 1.0624, test_loss: 1.2463, test_f1: 0.5295
 epoch: 4, train_loss: 1.0299, test_loss: 1.2921, test_f1: 0.5083
 epoch: 5, train_loss: 0.9962, test_loss: 1.2281, test_f1: 0.4860
 epoch: 6, train_loss: 0.9909, test_loss: 1.2656, test_f1: 0.5215
 epoch: 7, train_loss: 0.9661, test_loss: 1.2268, test_f1: 0.5328
 epoch: 8, train_loss: 0.9426, test_loss: 1.3084, test_f1: 0.5444
 epoch: 9, train_loss: 0.9124, test_loss: 1.2898, test_f1: 0.5201
 epoch: 10, train_loss: 0.8883, test_loss: 1.3553, test_f1: 0.4994
 epoch: 11, train_loss: 0.9041, test_loss: 1.1702, test_f1: 0.5660
 epoch: 12, train_loss: 0.8803, test_loss: 1.3082, test_f1: 0.5795
 epoch: 13, train_loss: 0.8668, test_loss: 1.2471, test_f1: 0.5612
 epoch: 14, train_loss: 0.8467, test_loss: 1.3171, test_f1: 0.5916
 epoch: 15, train_loss: 0.8390, test_loss: 1.2541, test_f1: 0.5735
 epoch: 16, train_loss: 0.8116, test_loss: 1.1963, test_f1: 0.5838
 epoch: 17, train_loss: 0.8081, test_loss: 1.1731, test_f1: 0.5804
 epoch: 18, train_loss: 0.7886, test_loss: 1.1533, test_f1: 0.5780
 epoch: 19, train_loss: 0.8032, test_loss: 1.4713, test_f1: 0.4700
 epoch: 20, train_loss: 0.7826, test_loss: 1.2152, test_f1: 0.5716
 epoch: 21, train_loss: 0.7778, test_loss: 1.1432, test_f1: 0.5595
 epoch: 22, train_loss: 0.7452, test_loss: 1.1980, test_f1: 0.5913
 epoch: 23, train_loss: 0.7559, test_loss: 1.2153, test_f1: 0.5903
 epoch: 24, train_loss: 0.7613, test_loss: 1.3277, test_f1: 0.6014
 epoch: 25, train_loss: 0.7147, test_loss: 1.2398, test_f1: 0.5468
 epoch: 26, train_loss: 0.7556, test_loss: 1.6566, test_f1: 0.5136
 epoch: 27, train_loss: 0.7517, test_loss: 1.3272, test_f1: 0.5827
 epoch: 28, train_loss: 0.7270, test_loss: 1.3592, test_f1: 0.6070
 epoch: 29, train_loss: 0.7231, test_loss: 1.3536, test_f1: 0.5662
 epoch: 30, train_loss: 0.7255, test_loss: 1.7100, test_f1: 0.5031
 epoch: 31, train_loss: 0.6907, test_loss: 1.3779, test_f1: 0.6143
 epoch: 32, train_loss: 0.6828, test_loss: 1.3667, test_f1: 0.6228
 epoch: 33, train_loss: 0.7261, test_loss: 1.6929, test_f1: 0.5867
 epoch: 34, train_loss: 0.6857, test_loss: 1.6815, test_f1: 0.6007
 epoch: 35, train_loss: 0.6883, test_loss: 1.6145, test_f1: 0.6055
 epoch: 36, train_loss: 0.6526, test_loss: 1.6344, test_f1: 0.5984
 epoch: 37, train_loss: 0.6558, test_loss: 1.7343, test_f1: 0.5599
 epoch: 38, train_loss: 0.6560, test_loss: 1.7086, test_f1: 0.4982
 epoch: 39, train_loss: 0.6508, test_loss: 1.7078, test_f1: 0.5706
 epoch: 40, train_loss: 0.6367, test_loss: 1.6632, test_f1: 0.6213
 epoch: 41, train_loss: 0.6091, test_loss: 1.6165, test_f1: 0.6226
 epoch: 42, train_loss: 0.6603, test_loss: 1.5470, test_f1: 0.5585
 epoch: 43, train_loss: 0.6469, test_loss: 1.7323, test_f1: 0.5864
 epoch: 44, train_loss: 0.6155, test_loss: 1.6835, test_f1: 0.6237
 epoch: 45, train_loss: 0.6284, test_loss: 1.7365, test_f1: 0.5346
 epoch: 46, train_loss: 0.6491, test_loss: 1.3177, test_f1: 0.6317
 epoch: 47, train_loss: 0.5765, test_loss: 1.6114, test_f1: 0.5938
 epoch: 48, train_loss: 0.6358, test_loss: 2.1111, test_f1: 0.5066
 epoch: 49, train_loss: 0.5773, test_loss: 1.7746, test_f1: 0.5352
 epoch: 50, train_loss: 0.5777, test_loss: 1.8731, test_f1: 0.5848
 epoch: 51, train_loss: 0.5486, test_loss: 1.8999, test_f1: 0.5333
 epoch: 52, train_loss: 0.5341, test_loss: 1.6386, test_f1: 0.6015
 epoch: 53, train_loss: 0.5164, test_loss: 1.9271, test_f1: 0.5555
 epoch: 54, train_loss: 0.5035, test_loss: 1.7442, test_f1: 0.5981
 epoch: 55, train_loss: 0.5233, test_loss: 1.9770, test_f1: 0.5662
 epoch: 56, train_loss: 0.4992, test_loss: 2.0218, test_f1: 0.5763
 epoch: 57, train_loss: 0.4840, test_loss: 1.9843, test_f1: 0.5822
 epoch: 58, train_loss: 0.4946, test_loss: 2.4129, test_f1: 0.5516
 epoch: 59, train_loss: 0.4989, test_loss: 1.9531, test_f1: 0.5613
 epoch: 60, train_loss: 0.5127, test_loss: 2.2901, test_f1: 0.5569
 epoch: 61, train_loss: 0.4799, test_loss: 2.2174, test_f1: 0.5819
 epoch: 62, train_loss: 0.5070, test_loss: 2.3075, test_f1: 0.5863
 epoch: 63, train_loss: 0.4738, test_loss: 2.0949, test_f1: 0.5900
 epoch: 64, train_loss: 0.4629, test_loss: 2.3015, test_f1: 0.5775
 epoch: 65, train_loss: 0.4477, test_loss: 2.4902, test_f1: 0.5324
 epoch: 66, train_loss: 0.4474, test_loss: 2.3354, test_f1: 0.5922
 epoch: 67, train_loss: 0.4659, test_loss: 2.3945, test_f1: 0.5810
 epoch: 68, train_loss: 0.4863, test_loss: 2.2561, test_f1: 0.5198
 epoch: 69, train_loss: 0.4447, test_loss: 2.3938, test_f1: 0.5393
 epoch: 70, train_loss: 0.4578, test_loss: 2.3993, test_f1: 0.5435
 epoch: 71, train_loss: 0.4451, test_loss: 2.4545, test_f1: 0.5792
 epoch: 72, train_loss: 0.4253, test_loss: 2.3273, test_f1: 0.6063
 epoch: 73, train_loss: 0.4278, test_loss: 2.8178, test_f1: 0.5364
 epoch: 74, train_loss: 0.4238, test_loss: 2.4611, test_f1: 0.5480
 epoch: 75, train_loss: 0.4287, test_loss: 2.3002, test_f1: 0.5451
 epoch: 76, train_loss: 0.4167, test_loss: 2.4031, test_f1: 0.5371
 epoch: 77, train_loss: 0.4368, test_loss: 2.7277, test_f1: 0.5250
 epoch: 78, train_loss: 0.4331, test_loss: 2.6469, test_f1: 0.5718
 epoch: 79, train_loss: 0.4181, test_loss: 2.2582, test_f1: 0.5848
 epoch: 80, train_loss: 0.4154, test_loss: 2.8344, test_f1: 0.5775
 epoch: 81, train_loss: 0.4177, test_loss: 2.9022, test_f1: 0.5396
 epoch: 82, train_loss: 0.3927, test_loss: 2.5752, test_f1: 0.6109
 epoch: 83, train_loss: 0.4037, test_loss: 3.0614, test_f1: 0.5285
 epoch: 84, train_loss: 0.3702, test_loss: 2.4005, test_f1: 0.5939
 epoch: 85, train_loss: 0.3829, test_loss: 2.7211, test_f1: 0.5585
 epoch: 86, train_loss: 0.4168, test_loss: 2.9013, test_f1: 0.5796
 epoch: 87, train_loss: 0.4082, test_loss: 2.1429, test_f1: 0.5635
 epoch: 88, train_loss: 0.3908, test_loss: 2.4692, test_f1: 0.5622
 epoch: 89, train_loss: 0.4086, test_loss: 2.5197, test_f1: 0.5575
 epoch: 90, train_loss: 0.3672, test_loss: 2.8636, test_f1: 0.5374
 epoch: 91, train_loss: 0.3700, test_loss: 2.2032, test_f1: 0.5778
 epoch: 92, train_loss: 0.3368, test_loss: 2.4406, test_f1: 0.5517
 epoch: 93, train_loss: 0.3770, test_loss: 2.4825, test_f1: 0.5780
 epoch: 94, train_loss: 0.3659, test_loss: 2.6020, test_f1: 0.5734
 epoch: 95, train_loss: 0.3274, test_loss: 2.2354, test_f1: 0.5649
 epoch: 96, train_loss: 0.3725, test_loss: 2.5735, test_f1: 0.5816
 epoch: 97, train_loss: 0.3944, test_loss: 2.5151, test_f1: 0.5828
 epoch: 98, train_loss: 0.3562, test_loss: 2.2587, test_f1: 0.5846
 epoch: 99, train_loss: 0.3582, test_loss: 2.3378, test_f1: 0.5829
##################ITERATION #4 ****************************************
 epoch: 0, train_loss: 1.2809, test_loss: 1.2376, test_f1: 0.4903
 epoch: 1, train_loss: 1.1317, test_loss: 1.2610, test_f1: 0.4716
 epoch: 2, train_loss: 1.0828, test_loss: 1.2220, test_f1: 0.5250
 epoch: 3, train_loss: 1.0738, test_loss: 1.2552, test_f1: 0.4850
 epoch: 4, train_loss: 1.0269, test_loss: 1.1822, test_f1: 0.5287
 epoch: 5, train_loss: 1.0182, test_loss: 1.1828, test_f1: 0.5295
 epoch: 6, train_loss: 1.0040, test_loss: 1.1780, test_f1: 0.5353
 epoch: 7, train_loss: 0.9500, test_loss: 1.2103, test_f1: 0.5042
 epoch: 8, train_loss: 0.9468, test_loss: 1.1235, test_f1: 0.5044
 epoch: 9, train_loss: 0.9646, test_loss: 1.1272, test_f1: 0.5035
 epoch: 10, train_loss: 0.9323, test_loss: 1.2569, test_f1: 0.4777
 epoch: 11, train_loss: 0.9084, test_loss: 1.1274, test_f1: 0.4501
 epoch: 12, train_loss: 0.8890, test_loss: 1.1572, test_f1: 0.5018
 epoch: 13, train_loss: 0.8985, test_loss: 1.0465, test_f1: 0.5231
 epoch: 14, train_loss: 0.8618, test_loss: 1.1666, test_f1: 0.5296
 epoch: 15, train_loss: 0.8523, test_loss: 1.5740, test_f1: 0.5707
 epoch: 16, train_loss: 0.8441, test_loss: 2.0187, test_f1: 0.5823
 epoch: 17, train_loss: 0.8417, test_loss: 1.2368, test_f1: 0.5812
 epoch: 18, train_loss: 0.7969, test_loss: 1.0725, test_f1: 0.5679
 epoch: 19, train_loss: 0.7881, test_loss: 1.0979, test_f1: 0.5937
 epoch: 20, train_loss: 0.7994, test_loss: 1.1053, test_f1: 0.5771
 epoch: 21, train_loss: 0.7909, test_loss: 1.1114, test_f1: 0.5661
 epoch: 22, train_loss: 0.7661, test_loss: 1.1273, test_f1: 0.6201
 epoch: 23, train_loss: 0.7794, test_loss: 1.1148, test_f1: 0.6157
 epoch: 24, train_loss: 0.7587, test_loss: 1.5580, test_f1: 0.5867
 epoch: 25, train_loss: 0.7570, test_loss: 1.5622, test_f1: 0.4838
 epoch: 26, train_loss: 0.7479, test_loss: 1.6461, test_f1: 0.5738
 epoch: 27, train_loss: 0.7292, test_loss: 1.1314, test_f1: 0.6050
 epoch: 28, train_loss: 0.7307, test_loss: 1.5581, test_f1: 0.6235
 epoch: 29, train_loss: 0.7076, test_loss: 3.4800, test_f1: 0.5628
 epoch: 30, train_loss: 0.7225, test_loss: 1.5157, test_f1: 0.5798
 epoch: 31, train_loss: 0.7255, test_loss: 2.3135, test_f1: 0.4845
 epoch: 32, train_loss: 0.6794, test_loss: 1.5507, test_f1: 0.5959
 epoch: 33, train_loss: 0.7039, test_loss: 1.1992, test_f1: 0.5785
 epoch: 34, train_loss: 0.7000, test_loss: 1.5816, test_f1: 0.5342
 epoch: 35, train_loss: 0.6728, test_loss: 1.3881, test_f1: 0.5285
 epoch: 36, train_loss: 0.6618, test_loss: 1.3525, test_f1: 0.5249
 epoch: 37, train_loss: 0.6476, test_loss: 1.2869, test_f1: 0.6177
 epoch: 38, train_loss: 0.6700, test_loss: 1.6317, test_f1: 0.4806
 epoch: 39, train_loss: 0.6507, test_loss: 1.4331, test_f1: 0.6090
 epoch: 40, train_loss: 0.6618, test_loss: 1.2330, test_f1: 0.6149
 epoch: 41, train_loss: 0.6414, test_loss: 1.3305, test_f1: 0.6098
 epoch: 42, train_loss: 0.6326, test_loss: 1.3397, test_f1: 0.5594
 epoch: 43, train_loss: 0.5906, test_loss: 1.4088, test_f1: 0.5547
 epoch: 44, train_loss: 0.6057, test_loss: 1.3473, test_f1: 0.5879
 epoch: 45, train_loss: 0.5994, test_loss: 1.3246, test_f1: 0.5688
 epoch: 46, train_loss: 0.5999, test_loss: 1.5310, test_f1: 0.5975
 epoch: 47, train_loss: 0.6104, test_loss: 1.5300, test_f1: 0.5366
 epoch: 48, train_loss: 0.5921, test_loss: 1.5346, test_f1: 0.5801
 epoch: 49, train_loss: 0.5950, test_loss: 1.6018, test_f1: 0.5789
 epoch: 50, train_loss: 0.5739, test_loss: 1.7650, test_f1: 0.5941
 epoch: 51, train_loss: 0.5517, test_loss: 1.5686, test_f1: 0.5934
 epoch: 52, train_loss: 0.5453, test_loss: 1.8025, test_f1: 0.5554
 epoch: 53, train_loss: 0.5225, test_loss: 2.0054, test_f1: 0.5614
 epoch: 54, train_loss: 0.5143, test_loss: 1.7346, test_f1: 0.5966
 epoch: 55, train_loss: 0.4897, test_loss: 1.7620, test_f1: 0.5922
 epoch: 56, train_loss: 0.4844, test_loss: 1.6206, test_f1: 0.6120
 epoch: 57, train_loss: 0.5183, test_loss: 1.7173, test_f1: 0.5621
 epoch: 58, train_loss: 0.4843, test_loss: 1.5919, test_f1: 0.5731
 epoch: 59, train_loss: 0.4677, test_loss: 1.7581, test_f1: 0.5596
 epoch: 60, train_loss: 0.4907, test_loss: 1.6679, test_f1: 0.5443
 epoch: 61, train_loss: 0.4821, test_loss: 1.6858, test_f1: 0.5381
 epoch: 62, train_loss: 0.4794, test_loss: 1.6286, test_f1: 0.5774
 epoch: 63, train_loss: 0.4586, test_loss: 1.7624, test_f1: 0.6139
 epoch: 64, train_loss: 0.4405, test_loss: 1.7609, test_f1: 0.5861
 epoch: 65, train_loss: 0.4554, test_loss: 2.1297, test_f1: 0.6058
 epoch: 66, train_loss: 0.4489, test_loss: 1.7162, test_f1: 0.6146
 epoch: 67, train_loss: 0.4853, test_loss: 1.7717, test_f1: 0.5854
 epoch: 68, train_loss: 0.4547, test_loss: 1.7741, test_f1: 0.5820
 epoch: 69, train_loss: 0.4720, test_loss: 1.7897, test_f1: 0.5700
 epoch: 70, train_loss: 0.4328, test_loss: 1.7848, test_f1: 0.5834
 epoch: 71, train_loss: 0.4272, test_loss: 2.0793, test_f1: 0.5604
 epoch: 72, train_loss: 0.4565, test_loss: 1.9735, test_f1: 0.5481
 epoch: 73, train_loss: 0.4215, test_loss: 1.9284, test_f1: 0.5771
 epoch: 74, train_loss: 0.4113, test_loss: 2.0074, test_f1: 0.5864
 epoch: 75, train_loss: 0.4357, test_loss: 1.9176, test_f1: 0.5806
 epoch: 76, train_loss: 0.4274, test_loss: 1.8086, test_f1: 0.5914
 epoch: 77, train_loss: 0.4212, test_loss: 1.8231, test_f1: 0.5548
 epoch: 78, train_loss: 0.4006, test_loss: 1.9021, test_f1: 0.5899
 epoch: 79, train_loss: 0.4048, test_loss: 2.0088, test_f1: 0.5491
 epoch: 80, train_loss: 0.4404, test_loss: 1.8718, test_f1: 0.5668
 epoch: 81, train_loss: 0.4133, test_loss: 2.2677, test_f1: 0.5717
 epoch: 82, train_loss: 0.3910, test_loss: 1.9917, test_f1: 0.5917
 epoch: 83, train_loss: 0.3956, test_loss: 1.9226, test_f1: 0.6257
 epoch: 84, train_loss: 0.3858, test_loss: 2.3035, test_f1: 0.5905
 epoch: 85, train_loss: 0.3955, test_loss: 2.6146, test_f1: 0.5428
 epoch: 86, train_loss: 0.3863, test_loss: 2.3782, test_f1: 0.5820
 epoch: 87, train_loss: 0.3956, test_loss: 2.2246, test_f1: 0.5692
 epoch: 88, train_loss: 0.3925, test_loss: 2.4894, test_f1: 0.5931
 epoch: 89, train_loss: 0.4075, test_loss: 1.9221, test_f1: 0.5996
 epoch: 90, train_loss: 0.4088, test_loss: 2.2708, test_f1: 0.6090
 epoch: 91, train_loss: 0.3781, test_loss: 2.1850, test_f1: 0.5694
 epoch: 92, train_loss: 0.3888, test_loss: 2.4432, test_f1: 0.5493
 epoch: 93, train_loss: 0.3837, test_loss: 2.4156, test_f1: 0.5806
 epoch: 94, train_loss: 0.3966, test_loss: 2.5530, test_f1: 0.5676
 epoch: 95, train_loss: 0.3638, test_loss: 2.3168, test_f1: 0.6186
 epoch: 96, train_loss: 0.3424, test_loss: 2.6658, test_f1: 0.5675
 epoch: 97, train_loss: 0.3530, test_loss: 3.0413, test_f1: 0.5657
 epoch: 98, train_loss: 0.4073, test_loss: 2.4808, test_f1: 0.5673
 epoch: 99, train_loss: 0.3494, test_loss: 2.6982, test_f1: 0.5934
##################ITERATION #5 ****************************************
 epoch: 0, train_loss: 1.3013, test_loss: 1.5092, test_f1: 0.3977
 epoch: 1, train_loss: 1.1618, test_loss: 1.2335, test_f1: 0.5083
 epoch: 2, train_loss: 1.0844, test_loss: 1.2415, test_f1: 0.4795
 epoch: 3, train_loss: 1.0614, test_loss: 1.3553, test_f1: 0.4974
 epoch: 4, train_loss: 1.0177, test_loss: 1.1205, test_f1: 0.5414
 epoch: 5, train_loss: 0.9630, test_loss: 1.1890, test_f1: 0.5053
 epoch: 6, train_loss: 0.9699, test_loss: 1.2388, test_f1: 0.5027
 epoch: 7, train_loss: 0.9421, test_loss: 1.2669, test_f1: 0.6043
 epoch: 8, train_loss: 0.8858, test_loss: 1.1921, test_f1: 0.5511
 epoch: 9, train_loss: 0.8901, test_loss: 1.3139, test_f1: 0.5952
 epoch: 10, train_loss: 0.8813, test_loss: 1.9318, test_f1: 0.5983
 epoch: 11, train_loss: 0.8742, test_loss: 1.2520, test_f1: 0.5758
 epoch: 12, train_loss: 0.8852, test_loss: 1.1947, test_f1: 0.6030
 epoch: 13, train_loss: 0.8380, test_loss: 1.1340, test_f1: 0.5532
 epoch: 14, train_loss: 0.8379, test_loss: 1.2910, test_f1: 0.5336
 epoch: 15, train_loss: 0.8132, test_loss: 1.2566, test_f1: 0.5307
 epoch: 16, train_loss: 0.8130, test_loss: 1.0720, test_f1: 0.6185
 epoch: 17, train_loss: 0.8223, test_loss: 1.3003, test_f1: 0.5826
 epoch: 18, train_loss: 0.8155, test_loss: 1.2717, test_f1: 0.5684
 epoch: 19, train_loss: 0.7696, test_loss: 1.0965, test_f1: 0.5916
 epoch: 20, train_loss: 0.7612, test_loss: 1.0842, test_f1: 0.6486
 epoch: 21, train_loss: 0.7758, test_loss: 1.2088, test_f1: 0.5770
 epoch: 22, train_loss: 0.7577, test_loss: 1.3687, test_f1: 0.5270
 epoch: 23, train_loss: 0.7753, test_loss: 1.0740, test_f1: 0.6018
 epoch: 24, train_loss: 0.7432, test_loss: 1.3199, test_f1: 0.6026
 epoch: 25, train_loss: 0.6920, test_loss: 1.2250, test_f1: 0.5669
 epoch: 26, train_loss: 0.7354, test_loss: 1.2160, test_f1: 0.6007
 epoch: 27, train_loss: 0.7206, test_loss: 1.2971, test_f1: 0.5946
 epoch: 28, train_loss: 0.7188, test_loss: 1.2988, test_f1: 0.6108
 epoch: 29, train_loss: 0.7104, test_loss: 1.2672, test_f1: 0.5899
 epoch: 30, train_loss: 0.6637, test_loss: 1.1509, test_f1: 0.5971
 epoch: 31, train_loss: 0.6838, test_loss: 1.3737, test_f1: 0.5688
 epoch: 32, train_loss: 0.6725, test_loss: 1.2392, test_f1: 0.6279
 epoch: 33, train_loss: 0.6545, test_loss: 1.2578, test_f1: 0.6008
 epoch: 34, train_loss: 0.6919, test_loss: 1.2356, test_f1: 0.5914
 epoch: 35, train_loss: 0.6574, test_loss: 1.2636, test_f1: 0.5965
 epoch: 36, train_loss: 0.6317, test_loss: 1.3213, test_f1: 0.5670
 epoch: 37, train_loss: 0.6611, test_loss: 1.2267, test_f1: 0.6148
 epoch: 38, train_loss: 0.6352, test_loss: 1.2057, test_f1: 0.5983
 epoch: 39, train_loss: 0.6079, test_loss: 1.2716, test_f1: 0.5933
 epoch: 40, train_loss: 0.5991, test_loss: 1.4636, test_f1: 0.6133
 epoch: 41, train_loss: 0.6189, test_loss: 1.4060, test_f1: 0.6032
 epoch: 42, train_loss: 0.6100, test_loss: 1.4427, test_f1: 0.5904
 epoch: 43, train_loss: 0.6014, test_loss: 1.2883, test_f1: 0.6138
 epoch: 44, train_loss: 0.5865, test_loss: 1.3184, test_f1: 0.5928
 epoch: 45, train_loss: 0.6000, test_loss: 1.4245, test_f1: 0.5775
 epoch: 46, train_loss: 0.5835, test_loss: 1.6423, test_f1: 0.5639
 epoch: 47, train_loss: 0.5940, test_loss: 1.5544, test_f1: 0.5631
 epoch: 48, train_loss: 0.5535, test_loss: 1.5322, test_f1: 0.5712
 epoch: 49, train_loss: 0.5692, test_loss: 1.5550, test_f1: 0.5837
 epoch: 50, train_loss: 0.5519, test_loss: 1.6134, test_f1: 0.5263
 epoch: 51, train_loss: 0.5150, test_loss: 1.6437, test_f1: 0.5757
 epoch: 52, train_loss: 0.5268, test_loss: 1.5788, test_f1: 0.5753
 epoch: 53, train_loss: 0.4717, test_loss: 1.5318, test_f1: 0.5617
 epoch: 54, train_loss: 0.4939, test_loss: 1.6331, test_f1: 0.5690
 epoch: 55, train_loss: 0.4588, test_loss: 1.7309, test_f1: 0.5620
 epoch: 56, train_loss: 0.4610, test_loss: 1.6639, test_f1: 0.5752
 epoch: 57, train_loss: 0.4646, test_loss: 1.5589, test_f1: 0.5807
 epoch: 58, train_loss: 0.4574, test_loss: 1.5453, test_f1: 0.5836
 epoch: 59, train_loss: 0.4445, test_loss: 1.6133, test_f1: 0.5934
 epoch: 60, train_loss: 0.4573, test_loss: 1.6038, test_f1: 0.6088
 epoch: 61, train_loss: 0.4290, test_loss: 1.8431, test_f1: 0.5775
 epoch: 62, train_loss: 0.4367, test_loss: 1.7325, test_f1: 0.5870
 epoch: 63, train_loss: 0.4272, test_loss: 1.7836, test_f1: 0.5745
 epoch: 64, train_loss: 0.4397, test_loss: 1.8300, test_f1: 0.5936
 epoch: 65, train_loss: 0.4341, test_loss: 2.0769, test_f1: 0.5523
 epoch: 66, train_loss: 0.4323, test_loss: 1.8446, test_f1: 0.5715
 epoch: 67, train_loss: 0.4220, test_loss: 1.8220, test_f1: 0.5683
 epoch: 68, train_loss: 0.4008, test_loss: 1.9261, test_f1: 0.5664
 epoch: 69, train_loss: 0.4172, test_loss: 1.9361, test_f1: 0.5860
 epoch: 70, train_loss: 0.3902, test_loss: 2.0547, test_f1: 0.5774
 epoch: 71, train_loss: 0.4097, test_loss: 2.0804, test_f1: 0.5597
 epoch: 72, train_loss: 0.4113, test_loss: 1.9972, test_f1: 0.5884
 epoch: 73, train_loss: 0.4007, test_loss: 2.0244, test_f1: 0.5669
 epoch: 74, train_loss: 0.4043, test_loss: 1.8701, test_f1: 0.5638
 epoch: 75, train_loss: 0.4045, test_loss: 1.9402, test_f1: 0.5697
 epoch: 76, train_loss: 0.4079, test_loss: 2.0973, test_f1: 0.5936
 epoch: 77, train_loss: 0.3902, test_loss: 2.1369, test_f1: 0.5859
 epoch: 78, train_loss: 0.3849, test_loss: 1.9271, test_f1: 0.6080
 epoch: 79, train_loss: 0.3681, test_loss: 2.0729, test_f1: 0.5606
 epoch: 80, train_loss: 0.3862, test_loss: 2.0883, test_f1: 0.5787
 epoch: 81, train_loss: 0.3676, test_loss: 2.2589, test_f1: 0.5605
 epoch: 82, train_loss: 0.3654, test_loss: 2.2734, test_f1: 0.5634
 epoch: 83, train_loss: 0.3597, test_loss: 2.1084, test_f1: 0.5807
 epoch: 84, train_loss: 0.3602, test_loss: 2.3626, test_f1: 0.6011
 epoch: 85, train_loss: 0.3593, test_loss: 2.3683, test_f1: 0.5999
 epoch: 86, train_loss: 0.3629, test_loss: 2.2548, test_f1: 0.5700
 epoch: 87, train_loss: 0.3895, test_loss: 2.3881, test_f1: 0.5704
 epoch: 88, train_loss: 0.3542, test_loss: 2.3623, test_f1: 0.5554
 epoch: 89, train_loss: 0.3704, test_loss: 2.4401, test_f1: 0.5722
 epoch: 90, train_loss: 0.3626, test_loss: 2.0693, test_f1: 0.5954
 epoch: 91, train_loss: 0.3750, test_loss: 2.1227, test_f1: 0.5753
 epoch: 92, train_loss: 0.3445, test_loss: 2.3132, test_f1: 0.5950
 epoch: 93, train_loss: 0.3541, test_loss: 2.2752, test_f1: 0.5616
 epoch: 94, train_loss: 0.3106, test_loss: 2.3026, test_f1: 0.5870
 epoch: 95, train_loss: 0.3398, test_loss: 2.0861, test_f1: 0.6080
 epoch: 96, train_loss: 0.3452, test_loss: 2.2537, test_f1: 0.5840
 epoch: 97, train_loss: 0.3368, test_loss: 2.2317, test_f1: 0.6262
 epoch: 98, train_loss: 0.3425, test_loss: 2.2719, test_f1: 0.5693
 epoch: 99, train_loss: 0.3472, test_loss: 2.0603, test_f1: 0.5840
##################ITERATION #6 ****************************************
 epoch: 0, train_loss: 1.3152, test_loss: 1.3348, test_f1: 0.4096
 epoch: 1, train_loss: 1.1417, test_loss: 1.2552, test_f1: 0.4540
 epoch: 2, train_loss: 1.0565, test_loss: 1.1888, test_f1: 0.5155
 epoch: 3, train_loss: 1.0182, test_loss: 1.1698, test_f1: 0.5401
 epoch: 4, train_loss: 0.9997, test_loss: 1.2025, test_f1: 0.5301
 epoch: 5, train_loss: 0.9867, test_loss: 1.1231, test_f1: 0.5867
 epoch: 6, train_loss: 0.9422, test_loss: 1.4073, test_f1: 0.4666
 epoch: 7, train_loss: 0.9346, test_loss: 1.1212, test_f1: 0.5613
 epoch: 8, train_loss: 0.9204, test_loss: 1.1106, test_f1: 0.5539
 epoch: 9, train_loss: 0.8941, test_loss: 1.1759, test_f1: 0.5175
 epoch: 10, train_loss: 0.8618, test_loss: 1.1060, test_f1: 0.5801
 epoch: 11, train_loss: 0.8715, test_loss: 1.1280, test_f1: 0.5691
 epoch: 12, train_loss: 0.8764, test_loss: 1.1889, test_f1: 0.5219
 epoch: 13, train_loss: 0.8579, test_loss: 1.1119, test_f1: 0.6202
 epoch: 14, train_loss: 0.8199, test_loss: 1.2048, test_f1: 0.5694
 epoch: 15, train_loss: 0.8365, test_loss: 1.2368, test_f1: 0.5413
 epoch: 16, train_loss: 0.8432, test_loss: 1.1719, test_f1: 0.6298
 epoch: 17, train_loss: 0.8174, test_loss: 1.0821, test_f1: 0.5648
 epoch: 18, train_loss: 0.7737, test_loss: 1.0875, test_f1: 0.5761
 epoch: 19, train_loss: 0.7809, test_loss: 1.1997, test_f1: 0.5874
 epoch: 20, train_loss: 0.7873, test_loss: 1.1097, test_f1: 0.6012
 epoch: 21, train_loss: 0.7627, test_loss: 1.2686, test_f1: 0.5573
 epoch: 22, train_loss: 0.7495, test_loss: 1.1369, test_f1: 0.5951
 epoch: 23, train_loss: 0.7523, test_loss: 1.0998, test_f1: 0.6030
 epoch: 24, train_loss: 0.7492, test_loss: 1.1622, test_f1: 0.5947
 epoch: 25, train_loss: 0.7312, test_loss: 1.1802, test_f1: 0.5656
 epoch: 26, train_loss: 0.7210, test_loss: 1.1170, test_f1: 0.6052
 epoch: 27, train_loss: 0.7215, test_loss: 1.3317, test_f1: 0.5123
 epoch: 28, train_loss: 0.7194, test_loss: 1.1305, test_f1: 0.6088
 epoch: 29, train_loss: 0.7211, test_loss: 1.2566, test_f1: 0.5358
 epoch: 30, train_loss: 0.7126, test_loss: 1.1852, test_f1: 0.6243
 epoch: 31, train_loss: 0.6959, test_loss: 1.1889, test_f1: 0.6119
 epoch: 32, train_loss: 0.6933, test_loss: 1.2374, test_f1: 0.5834
 epoch: 33, train_loss: 0.6723, test_loss: 1.2260, test_f1: 0.5855
 epoch: 34, train_loss: 0.6809, test_loss: 1.1908, test_f1: 0.6160
 epoch: 35, train_loss: 0.6710, test_loss: 1.2449, test_f1: 0.5600
 epoch: 36, train_loss: 0.6882, test_loss: 1.2391, test_f1: 0.5656
 epoch: 37, train_loss: 0.6323, test_loss: 1.2599, test_f1: 0.5823
 epoch: 38, train_loss: 0.6437, test_loss: 1.2776, test_f1: 0.5993
 epoch: 39, train_loss: 0.6429, test_loss: 1.3505, test_f1: 0.5737
 epoch: 40, train_loss: 0.6139, test_loss: 1.3625, test_f1: 0.5565
 epoch: 41, train_loss: 0.6211, test_loss: 1.3880, test_f1: 0.6128
 epoch: 42, train_loss: 0.6130, test_loss: 1.3566, test_f1: 0.5604
 epoch: 43, train_loss: 0.6438, test_loss: 1.6253, test_f1: 0.5638
 epoch: 44, train_loss: 0.6324, test_loss: 1.4998, test_f1: 0.5616
 epoch: 45, train_loss: 0.5920, test_loss: 1.5013, test_f1: 0.5677
 epoch: 46, train_loss: 0.5918, test_loss: 1.5333, test_f1: 0.5594
 epoch: 47, train_loss: 0.5968, test_loss: 1.4823, test_f1: 0.5409
 epoch: 48, train_loss: 0.5841, test_loss: 1.7811, test_f1: 0.5174
 epoch: 49, train_loss: 0.5945, test_loss: 1.3633, test_f1: 0.5861
 epoch: 50, train_loss: 0.5707, test_loss: 1.5220, test_f1: 0.6167
 epoch: 51, train_loss: 0.5259, test_loss: 1.5753, test_f1: 0.5913
 epoch: 52, train_loss: 0.5234, test_loss: 1.5102, test_f1: 0.6088
 epoch: 53, train_loss: 0.5212, test_loss: 1.5955, test_f1: 0.6027
 epoch: 54, train_loss: 0.5044, test_loss: 1.4553, test_f1: 0.6154
 epoch: 55, train_loss: 0.4912, test_loss: 1.5570, test_f1: 0.6054
 epoch: 56, train_loss: 0.4743, test_loss: 1.6860, test_f1: 0.5671
 epoch: 57, train_loss: 0.4977, test_loss: 1.6109, test_f1: 0.6060
 epoch: 58, train_loss: 0.4739, test_loss: 1.7418, test_f1: 0.5898
 epoch: 59, train_loss: 0.4477, test_loss: 1.6480, test_f1: 0.6441
 epoch: 60, train_loss: 0.4811, test_loss: 1.7777, test_f1: 0.6357
 epoch: 61, train_loss: 0.4756, test_loss: 1.6224, test_f1: 0.6034
 epoch: 62, train_loss: 0.4571, test_loss: 1.5437, test_f1: 0.5774
 epoch: 63, train_loss: 0.4356, test_loss: 1.7474, test_f1: 0.6118
 epoch: 64, train_loss: 0.4329, test_loss: 1.8751, test_f1: 0.5913
 epoch: 65, train_loss: 0.4336, test_loss: 1.9166, test_f1: 0.5898
 epoch: 66, train_loss: 0.4564, test_loss: 1.9733, test_f1: 0.6088
 epoch: 67, train_loss: 0.4359, test_loss: 1.8312, test_f1: 0.6188
 epoch: 68, train_loss: 0.4294, test_loss: 2.0141, test_f1: 0.6138
 epoch: 69, train_loss: 0.4427, test_loss: 1.9798, test_f1: 0.5965
 epoch: 70, train_loss: 0.4099, test_loss: 1.9631, test_f1: 0.5912
 epoch: 71, train_loss: 0.4301, test_loss: 1.9886, test_f1: 0.6001
 epoch: 72, train_loss: 0.4065, test_loss: 2.1609, test_f1: 0.5916
 epoch: 73, train_loss: 0.4156, test_loss: 2.1252, test_f1: 0.6018
 epoch: 74, train_loss: 0.4067, test_loss: 2.1933, test_f1: 0.5976
 epoch: 75, train_loss: 0.3843, test_loss: 2.0863, test_f1: 0.5853
 epoch: 76, train_loss: 0.3802, test_loss: 2.0457, test_f1: 0.6189
 epoch: 77, train_loss: 0.4131, test_loss: 2.1331, test_f1: 0.6197
 epoch: 78, train_loss: 0.4055, test_loss: 1.8512, test_f1: 0.6073
 epoch: 79, train_loss: 0.3792, test_loss: 2.0842, test_f1: 0.6199
 epoch: 80, train_loss: 0.4039, test_loss: 2.3031, test_f1: 0.5720
 epoch: 81, train_loss: 0.3642, test_loss: 2.2321, test_f1: 0.5911
 epoch: 82, train_loss: 0.3800, test_loss: 1.9269, test_f1: 0.6369
 epoch: 83, train_loss: 0.4145, test_loss: 1.9126, test_f1: 0.6462
 epoch: 84, train_loss: 0.3914, test_loss: 2.1687, test_f1: 0.5738
 epoch: 85, train_loss: 0.3591, test_loss: 2.0042, test_f1: 0.5995
 epoch: 86, train_loss: 0.3586, test_loss: 2.1416, test_f1: 0.5463
 epoch: 87, train_loss: 0.3681, test_loss: 2.2127, test_f1: 0.6031
 epoch: 88, train_loss: 0.3949, test_loss: 2.1396, test_f1: 0.6154
 epoch: 89, train_loss: 0.3752, test_loss: 2.2384, test_f1: 0.5706
 epoch: 90, train_loss: 0.3751, test_loss: 2.1413, test_f1: 0.5849
 epoch: 91, train_loss: 0.3319, test_loss: 2.2627, test_f1: 0.5996
 epoch: 92, train_loss: 0.3506, test_loss: 2.1229, test_f1: 0.5984
 epoch: 93, train_loss: 0.3494, test_loss: 2.1666, test_f1: 0.5790
 epoch: 94, train_loss: 0.3637, test_loss: 2.1815, test_f1: 0.5661
 epoch: 95, train_loss: 0.3735, test_loss: 2.3280, test_f1: 0.6250
 epoch: 96, train_loss: 0.3369, test_loss: 2.1524, test_f1: 0.5875
 epoch: 97, train_loss: 0.3582, test_loss: 2.1195, test_f1: 0.6017
 epoch: 98, train_loss: 0.3335, test_loss: 1.9714, test_f1: 0.6065
 epoch: 99, train_loss: 0.3443, test_loss: 2.1703, test_f1: 0.5992
##################ITERATION #7 ****************************************
 epoch: 0, train_loss: 1.3059, test_loss: 1.2533, test_f1: 0.4463
 epoch: 1, train_loss: 1.0998, test_loss: 1.2233, test_f1: 0.5078
 epoch: 2, train_loss: 1.0366, test_loss: 1.2450, test_f1: 0.5205
 epoch: 3, train_loss: 0.9850, test_loss: 1.1390, test_f1: 0.5214
 epoch: 4, train_loss: 0.9681, test_loss: 1.1367, test_f1: 0.5467
 epoch: 5, train_loss: 0.9413, test_loss: 1.1578, test_f1: 0.5704
 epoch: 6, train_loss: 0.9193, test_loss: 1.1536, test_f1: 0.5296
 epoch: 7, train_loss: 0.8910, test_loss: 1.1280, test_f1: 0.5406
 epoch: 8, train_loss: 0.8624, test_loss: 1.1827, test_f1: 0.5059
 epoch: 9, train_loss: 0.8669, test_loss: 1.1276, test_f1: 0.5554
 epoch: 10, train_loss: 0.8491, test_loss: 1.1320, test_f1: 0.5304
 epoch: 11, train_loss: 0.8265, test_loss: 1.1207, test_f1: 0.5399
 epoch: 12, train_loss: 0.8138, test_loss: 1.1456, test_f1: 0.5392
 epoch: 13, train_loss: 0.7989, test_loss: 1.2393, test_f1: 0.5555
 epoch: 14, train_loss: 0.7895, test_loss: 1.2088, test_f1: 0.5146
 epoch: 15, train_loss: 0.7822, test_loss: 1.1698, test_f1: 0.5578
 epoch: 16, train_loss: 0.7462, test_loss: 1.1954, test_f1: 0.5641
 epoch: 17, train_loss: 0.7509, test_loss: 1.2406, test_f1: 0.5910
 epoch: 18, train_loss: 0.7148, test_loss: 1.4294, test_f1: 0.4944
 epoch: 19, train_loss: 0.7346, test_loss: 1.2045, test_f1: 0.5682
 epoch: 20, train_loss: 0.7185, test_loss: 1.2183, test_f1: 0.5627
 epoch: 21, train_loss: 0.6919, test_loss: 1.2441, test_f1: 0.5792
 epoch: 22, train_loss: 0.6969, test_loss: 1.2994, test_f1: 0.5548
 epoch: 23, train_loss: 0.7001, test_loss: 1.2804, test_f1: 0.5638
 epoch: 24, train_loss: 0.6759, test_loss: 1.2971, test_f1: 0.5692
 epoch: 25, train_loss: 0.6751, test_loss: 1.2994, test_f1: 0.5221
 epoch: 26, train_loss: 0.6838, test_loss: 1.3470, test_f1: 0.5683
 epoch: 27, train_loss: 0.6466, test_loss: 1.3521, test_f1: 0.5922
 epoch: 28, train_loss: 0.6729, test_loss: 1.3522, test_f1: 0.5905
 epoch: 29, train_loss: 0.6267, test_loss: 1.4483, test_f1: 0.5587
 epoch: 30, train_loss: 0.6240, test_loss: 1.5962, test_f1: 0.5498
 epoch: 31, train_loss: 0.6213, test_loss: 1.5259, test_f1: 0.5780
 epoch: 32, train_loss: 0.6101, test_loss: 1.5225, test_f1: 0.5541
 epoch: 33, train_loss: 0.6231, test_loss: 1.5978, test_f1: 0.5667
 epoch: 34, train_loss: 0.6017, test_loss: 1.4495, test_f1: 0.5683
 epoch: 35, train_loss: 0.5854, test_loss: 1.8176, test_f1: 0.5376
 epoch: 36, train_loss: 0.5655, test_loss: 1.7663, test_f1: 0.5328
 epoch: 37, train_loss: 0.5497, test_loss: 1.6073, test_f1: 0.5828
 epoch: 38, train_loss: 0.5762, test_loss: 1.5899, test_f1: 0.5969
 epoch: 39, train_loss: 0.5784, test_loss: 1.8294, test_f1: 0.5306
 epoch: 40, train_loss: 0.6010, test_loss: 1.8269, test_f1: 0.5791
 epoch: 41, train_loss: 0.5712, test_loss: 1.5068, test_f1: 0.5972
 epoch: 42, train_loss: 0.5192, test_loss: 1.5901, test_f1: 0.6198
 epoch: 43, train_loss: 0.5212, test_loss: 1.4551, test_f1: 0.6017
 epoch: 44, train_loss: 0.5614, test_loss: 1.4623, test_f1: 0.5696
 epoch: 45, train_loss: 0.5991, test_loss: 1.3997, test_f1: 0.5903
 epoch: 46, train_loss: 0.5453, test_loss: 1.4728, test_f1: 0.5921
 epoch: 47, train_loss: 0.5168, test_loss: 1.6415, test_f1: 0.5607
 epoch: 48, train_loss: 0.5160, test_loss: 1.5567, test_f1: 0.5673
 epoch: 49, train_loss: 0.5188, test_loss: 1.8027, test_f1: 0.5643
 epoch: 50, train_loss: 0.5140, test_loss: 1.7662, test_f1: 0.5808
 epoch: 51, train_loss: 0.4682, test_loss: 1.7367, test_f1: 0.5535
 epoch: 52, train_loss: 0.4353, test_loss: 1.8212, test_f1: 0.5765
 epoch: 53, train_loss: 0.4223, test_loss: 1.8803, test_f1: 0.5613
 epoch: 54, train_loss: 0.4008, test_loss: 2.0370, test_f1: 0.5731
 epoch: 55, train_loss: 0.4066, test_loss: 1.7725, test_f1: 0.5995
 epoch: 56, train_loss: 0.4368, test_loss: 1.8956, test_f1: 0.5879
 epoch: 57, train_loss: 0.4192, test_loss: 1.9457, test_f1: 0.5772
 epoch: 58, train_loss: 0.4040, test_loss: 1.8782, test_f1: 0.5808
 epoch: 59, train_loss: 0.4011, test_loss: 1.9349, test_f1: 0.5821
 epoch: 60, train_loss: 0.3962, test_loss: 2.1050, test_f1: 0.5751
 epoch: 61, train_loss: 0.3892, test_loss: 2.1306, test_f1: 0.5833
 epoch: 62, train_loss: 0.3841, test_loss: 2.1548, test_f1: 0.5590
 epoch: 63, train_loss: 0.3827, test_loss: 1.9606, test_f1: 0.5952
 epoch: 64, train_loss: 0.3748, test_loss: 1.9099, test_f1: 0.5801
 epoch: 65, train_loss: 0.3859, test_loss: 2.0249, test_f1: 0.5926
 epoch: 66, train_loss: 0.3728, test_loss: 2.0222, test_f1: 0.5972
 epoch: 67, train_loss: 0.3843, test_loss: 2.0588, test_f1: 0.5613
 epoch: 68, train_loss: 0.3775, test_loss: 2.1846, test_f1: 0.5486
 epoch: 69, train_loss: 0.3544, test_loss: 2.1335, test_f1: 0.5620
 epoch: 70, train_loss: 0.3756, test_loss: 2.0437, test_f1: 0.5746
 epoch: 71, train_loss: 0.3456, test_loss: 2.2120, test_f1: 0.5672
 epoch: 72, train_loss: 0.3607, test_loss: 2.0593, test_f1: 0.5671
 epoch: 73, train_loss: 0.3582, test_loss: 2.2838, test_f1: 0.5546
 epoch: 74, train_loss: 0.3512, test_loss: 2.0757, test_f1: 0.5999
 epoch: 75, train_loss: 0.3450, test_loss: 2.1974, test_f1: 0.5665
 epoch: 76, train_loss: 0.3427, test_loss: 2.1542, test_f1: 0.5762
 epoch: 77, train_loss: 0.3368, test_loss: 2.0806, test_f1: 0.5861
 epoch: 78, train_loss: 0.3184, test_loss: 2.3437, test_f1: 0.5605
 epoch: 79, train_loss: 0.3177, test_loss: 2.3734, test_f1: 0.5809
 epoch: 80, train_loss: 0.3502, test_loss: 2.3054, test_f1: 0.5841
 epoch: 81, train_loss: 0.3254, test_loss: 2.1548, test_f1: 0.5721
 epoch: 82, train_loss: 0.3378, test_loss: 2.5024, test_f1: 0.5796
 epoch: 83, train_loss: 0.3329, test_loss: 2.3222, test_f1: 0.5687
 epoch: 84, train_loss: 0.3354, test_loss: 2.2984, test_f1: 0.5644
 epoch: 85, train_loss: 0.3246, test_loss: 2.3267, test_f1: 0.5755
 epoch: 86, train_loss: 0.3345, test_loss: 2.5388, test_f1: 0.5416
 epoch: 87, train_loss: 0.3102, test_loss: 2.4869, test_f1: 0.5713
 epoch: 88, train_loss: 0.3319, test_loss: 2.3631, test_f1: 0.5671
 epoch: 89, train_loss: 0.3055, test_loss: 2.3742, test_f1: 0.5820
 epoch: 90, train_loss: 0.3268, test_loss: 2.2235, test_f1: 0.5862
 epoch: 91, train_loss: 0.3252, test_loss: 2.2227, test_f1: 0.5994
 epoch: 92, train_loss: 0.2992, test_loss: 2.4576, test_f1: 0.5727
 epoch: 93, train_loss: 0.2932, test_loss: 2.4059, test_f1: 0.5658
 epoch: 94, train_loss: 0.3081, test_loss: 2.3493, test_f1: 0.5765
 epoch: 95, train_loss: 0.2908, test_loss: 2.2768, test_f1: 0.5795
 epoch: 96, train_loss: 0.3191, test_loss: 2.4659, test_f1: 0.5711
 epoch: 97, train_loss: 0.2931, test_loss: 2.2546, test_f1: 0.6070
 epoch: 98, train_loss: 0.3055, test_loss: 2.3270, test_f1: 0.5807
 epoch: 99, train_loss: 0.2837, test_loss: 2.4586, test_f1: 0.5837
##################ITERATION #8 ****************************************
 epoch: 0, train_loss: 1.3032, test_loss: 1.2746, test_f1: 0.4731
 epoch: 1, train_loss: 1.1309, test_loss: 1.1796, test_f1: 0.4897
 epoch: 2, train_loss: 1.0871, test_loss: 1.1667, test_f1: 0.5211
 epoch: 3, train_loss: 1.0458, test_loss: 1.1835, test_f1: 0.5231
 epoch: 4, train_loss: 0.9920, test_loss: 1.2493, test_f1: 0.4838
 epoch: 5, train_loss: 0.9822, test_loss: 1.1552, test_f1: 0.5737
 epoch: 6, train_loss: 0.9799, test_loss: 1.1068, test_f1: 0.5798
 epoch: 7, train_loss: 0.9257, test_loss: 1.1377, test_f1: 0.5522
 epoch: 8, train_loss: 0.9260, test_loss: 1.2078, test_f1: 0.5093
 epoch: 9, train_loss: 0.9149, test_loss: 1.0870, test_f1: 0.5826
 epoch: 10, train_loss: 0.8964, test_loss: 1.2623, test_f1: 0.5587
 epoch: 11, train_loss: 0.8735, test_loss: 1.2303, test_f1: 0.5258
 epoch: 12, train_loss: 0.8904, test_loss: 1.4410, test_f1: 0.5972
 epoch: 13, train_loss: 0.8702, test_loss: 1.0928, test_f1: 0.6217
 epoch: 14, train_loss: 0.8404, test_loss: 1.0573, test_f1: 0.5966
 epoch: 15, train_loss: 0.8155, test_loss: 1.2195, test_f1: 0.5464
 epoch: 16, train_loss: 0.8017, test_loss: 1.2007, test_f1: 0.5399
 epoch: 17, train_loss: 0.7685, test_loss: 1.2524, test_f1: 0.5540
 epoch: 18, train_loss: 0.7985, test_loss: 1.3875, test_f1: 0.6090
 epoch: 19, train_loss: 0.7880, test_loss: 1.1563, test_f1: 0.6005
 epoch: 20, train_loss: 0.7896, test_loss: 1.3143, test_f1: 0.5720
 epoch: 21, train_loss: 0.7347, test_loss: 1.4280, test_f1: 0.5872
 epoch: 22, train_loss: 0.7397, test_loss: 1.4748, test_f1: 0.5356
 epoch: 23, train_loss: 0.7439, test_loss: 1.2946, test_f1: 0.5739
 epoch: 24, train_loss: 0.7166, test_loss: 1.4459, test_f1: 0.5263
 epoch: 25, train_loss: 0.7346, test_loss: 1.3985, test_f1: 0.5630
 epoch: 26, train_loss: 0.7066, test_loss: 1.4558, test_f1: 0.5694
 epoch: 27, train_loss: 0.6981, test_loss: 1.5219, test_f1: 0.5782
 epoch: 28, train_loss: 0.6762, test_loss: 1.6365, test_f1: 0.5220
 epoch: 29, train_loss: 0.6687, test_loss: 1.5921, test_f1: 0.5570
 epoch: 30, train_loss: 0.6977, test_loss: 1.5819, test_f1: 0.5811
 epoch: 31, train_loss: 0.6636, test_loss: 1.7337, test_f1: 0.5318
 epoch: 32, train_loss: 0.6483, test_loss: 1.5676, test_f1: 0.5348
 epoch: 33, train_loss: 0.6479, test_loss: 1.6697, test_f1: 0.5269
 epoch: 34, train_loss: 0.6626, test_loss: 1.6364, test_f1: 0.5279
 epoch: 35, train_loss: 0.6304, test_loss: 1.5282, test_f1: 0.5848
 epoch: 36, train_loss: 0.6259, test_loss: 1.8548, test_f1: 0.5361
 epoch: 37, train_loss: 0.6358, test_loss: 1.8398, test_f1: 0.5577
 epoch: 38, train_loss: 0.6195, test_loss: 1.6259, test_f1: 0.5833
 epoch: 39, train_loss: 0.6160, test_loss: 1.7286, test_f1: 0.5963
 epoch: 40, train_loss: 0.5879, test_loss: 1.7282, test_f1: 0.5657
 epoch: 41, train_loss: 0.5880, test_loss: 1.9505, test_f1: 0.5862
 epoch: 42, train_loss: 0.5668, test_loss: 1.8489, test_f1: 0.5578
 epoch: 43, train_loss: 0.5815, test_loss: 2.1783, test_f1: 0.5397
 epoch: 44, train_loss: 0.6003, test_loss: 2.2744, test_f1: 0.5084
 epoch: 45, train_loss: 0.6026, test_loss: 1.8566, test_f1: 0.5606
 epoch: 46, train_loss: 0.5630, test_loss: 1.9514, test_f1: 0.6027
 epoch: 47, train_loss: 0.5572, test_loss: 2.2336, test_f1: 0.5511
 epoch: 48, train_loss: 0.5670, test_loss: 2.0135, test_f1: 0.5687
 epoch: 49, train_loss: 0.5621, test_loss: 2.0926, test_f1: 0.5663
 epoch: 50, train_loss: 0.5603, test_loss: 2.0616, test_f1: 0.5730
 epoch: 51, train_loss: 0.5000, test_loss: 2.2011, test_f1: 0.5631
 epoch: 52, train_loss: 0.4799, test_loss: 2.0808, test_f1: 0.5666
 epoch: 53, train_loss: 0.4596, test_loss: 2.3549, test_f1: 0.5543
 epoch: 54, train_loss: 0.4592, test_loss: 2.1580, test_f1: 0.5593
 epoch: 55, train_loss: 0.4509, test_loss: 2.4075, test_f1: 0.5550
 epoch: 56, train_loss: 0.4450, test_loss: 2.4045, test_f1: 0.5830
 epoch: 57, train_loss: 0.4358, test_loss: 2.4154, test_f1: 0.5951
 epoch: 58, train_loss: 0.4351, test_loss: 2.5073, test_f1: 0.5498
 epoch: 59, train_loss: 0.4358, test_loss: 2.5832, test_f1: 0.5902
 epoch: 60, train_loss: 0.4547, test_loss: 2.3522, test_f1: 0.5645
 epoch: 61, train_loss: 0.4186, test_loss: 2.4146, test_f1: 0.5774
 epoch: 62, train_loss: 0.4345, test_loss: 2.4806, test_f1: 0.5362
 epoch: 63, train_loss: 0.4178, test_loss: 2.7315, test_f1: 0.5330
 epoch: 64, train_loss: 0.4024, test_loss: 2.7362, test_f1: 0.5690
 epoch: 65, train_loss: 0.4279, test_loss: 2.5588, test_f1: 0.5602
 epoch: 66, train_loss: 0.3822, test_loss: 2.7794, test_f1: 0.5589
 epoch: 67, train_loss: 0.4115, test_loss: 2.6426, test_f1: 0.6105
 epoch: 68, train_loss: 0.3969, test_loss: 2.6933, test_f1: 0.5621
 epoch: 69, train_loss: 0.4162, test_loss: 2.4911, test_f1: 0.5617
 epoch: 70, train_loss: 0.3912, test_loss: 2.5383, test_f1: 0.5655
 epoch: 71, train_loss: 0.4037, test_loss: 2.3763, test_f1: 0.5532
 epoch: 72, train_loss: 0.4032, test_loss: 2.3320, test_f1: 0.5873
 epoch: 73, train_loss: 0.3910, test_loss: 2.4517, test_f1: 0.5844
 epoch: 74, train_loss: 0.3578, test_loss: 2.9408, test_f1: 0.5248
 epoch: 75, train_loss: 0.4061, test_loss: 2.4647, test_f1: 0.5585
 epoch: 76, train_loss: 0.3741, test_loss: 2.7417, test_f1: 0.5474
 epoch: 77, train_loss: 0.3765, test_loss: 2.4737, test_f1: 0.5709
 epoch: 78, train_loss: 0.3916, test_loss: 2.9543, test_f1: 0.5503
 epoch: 79, train_loss: 0.3445, test_loss: 2.8771, test_f1: 0.5459
 epoch: 80, train_loss: 0.3699, test_loss: 2.9330, test_f1: 0.5757
 epoch: 81, train_loss: 0.3924, test_loss: 2.6046, test_f1: 0.5683
 epoch: 82, train_loss: 0.3507, test_loss: 2.6298, test_f1: 0.5761
 epoch: 83, train_loss: 0.3651, test_loss: 2.7507, test_f1: 0.5614
 epoch: 84, train_loss: 0.3576, test_loss: 2.3876, test_f1: 0.5599
 epoch: 85, train_loss: 0.3468, test_loss: 2.6926, test_f1: 0.5544
 epoch: 86, train_loss: 0.3709, test_loss: 2.7430, test_f1: 0.5765
 epoch: 87, train_loss: 0.3547, test_loss: 2.6138, test_f1: 0.5518
 epoch: 88, train_loss: 0.3666, test_loss: 2.6757, test_f1: 0.5696
 epoch: 89, train_loss: 0.3817, test_loss: 2.7968, test_f1: 0.5717
 epoch: 90, train_loss: 0.3554, test_loss: 2.9644, test_f1: 0.5779
 epoch: 91, train_loss: 0.3244, test_loss: 2.5036, test_f1: 0.5709
 epoch: 92, train_loss: 0.3610, test_loss: 2.6292, test_f1: 0.5794
 epoch: 93, train_loss: 0.3656, test_loss: 2.4050, test_f1: 0.5824
 epoch: 94, train_loss: 0.3320, test_loss: 2.7210, test_f1: 0.5517
 epoch: 95, train_loss: 0.3551, test_loss: 2.2991, test_f1: 0.6022
 epoch: 96, train_loss: 0.3434, test_loss: 2.4640, test_f1: 0.5920
 epoch: 97, train_loss: 0.3310, test_loss: 2.4141, test_f1: 0.5975
 epoch: 98, train_loss: 0.3236, test_loss: 2.7336, test_f1: 0.5912
 epoch: 99, train_loss: 0.3129, test_loss: 2.8464, test_f1: 0.5608
##################ITERATION #9 ****************************************
 epoch: 0, train_loss: 1.3489, test_loss: 1.3135, test_f1: 0.3156
 epoch: 1, train_loss: 1.1793, test_loss: 1.2054, test_f1: 0.4392
 epoch: 2, train_loss: 1.0890, test_loss: 1.2598, test_f1: 0.5021
 epoch: 3, train_loss: 1.0405, test_loss: 1.2044, test_f1: 0.5321
 epoch: 4, train_loss: 1.0106, test_loss: 1.0814, test_f1: 0.5773
 epoch: 5, train_loss: 0.9758, test_loss: 1.1670, test_f1: 0.5406
 epoch: 6, train_loss: 0.9584, test_loss: 1.1942, test_f1: 0.5383
 epoch: 7, train_loss: 0.9306, test_loss: 1.1788, test_f1: 0.5590
 epoch: 8, train_loss: 0.9021, test_loss: 1.3667, test_f1: 0.5291
 epoch: 9, train_loss: 0.8984, test_loss: 1.3316, test_f1: 0.5170
 epoch: 10, train_loss: 0.8639, test_loss: 1.4922, test_f1: 0.5624
 epoch: 11, train_loss: 0.8588, test_loss: 1.4279, test_f1: 0.5510
 epoch: 12, train_loss: 0.8297, test_loss: 1.4465, test_f1: 0.5588
 epoch: 13, train_loss: 0.8020, test_loss: 1.4505, test_f1: 0.5522
 epoch: 14, train_loss: 0.8141, test_loss: 1.3039, test_f1: 0.5874
 epoch: 15, train_loss: 0.7828, test_loss: 1.3029, test_f1: 0.5559
 epoch: 16, train_loss: 0.7886, test_loss: 1.2649, test_f1: 0.5776
 epoch: 17, train_loss: 0.7544, test_loss: 1.3442, test_f1: 0.5275
 epoch: 18, train_loss: 0.7552, test_loss: 1.4101, test_f1: 0.5707
 epoch: 19, train_loss: 0.7482, test_loss: 1.5389, test_f1: 0.5514
 epoch: 20, train_loss: 0.7215, test_loss: 1.5585, test_f1: 0.5603
 epoch: 21, train_loss: 0.7454, test_loss: 1.6612, test_f1: 0.5794
 epoch: 22, train_loss: 0.6996, test_loss: 1.4879, test_f1: 0.5812
 epoch: 23, train_loss: 0.6994, test_loss: 1.5570, test_f1: 0.5401
 epoch: 24, train_loss: 0.7301, test_loss: 1.6055, test_f1: 0.6160
 epoch: 25, train_loss: 0.6777, test_loss: 1.4712, test_f1: 0.5810
 epoch: 26, train_loss: 0.6673, test_loss: 1.6837, test_f1: 0.6064
 epoch: 27, train_loss: 0.6723, test_loss: 1.8112, test_f1: 0.5606
 epoch: 28, train_loss: 0.6473, test_loss: 1.8367, test_f1: 0.5691
 epoch: 29, train_loss: 0.6278, test_loss: 2.1195, test_f1: 0.6013
 epoch: 30, train_loss: 0.6463, test_loss: 2.0588, test_f1: 0.5592
 epoch: 31, train_loss: 0.6383, test_loss: 1.6090, test_f1: 0.5930
 epoch: 32, train_loss: 0.6359, test_loss: 1.5820, test_f1: 0.5683
 epoch: 33, train_loss: 0.5829, test_loss: 2.0076, test_f1: 0.5684
 epoch: 34, train_loss: 0.6013, test_loss: 2.0876, test_f1: 0.5753
 epoch: 35, train_loss: 0.5944, test_loss: 1.9657, test_f1: 0.5895
 epoch: 36, train_loss: 0.5786, test_loss: 1.9219, test_f1: 0.5990
 epoch: 37, train_loss: 0.5607, test_loss: 2.0126, test_f1: 0.6357
 epoch: 38, train_loss: 0.5778, test_loss: 1.8520, test_f1: 0.5765
 epoch: 39, train_loss: 0.5483, test_loss: 1.9062, test_f1: 0.6137
 epoch: 40, train_loss: 0.5710, test_loss: 1.8031, test_f1: 0.5957
 epoch: 41, train_loss: 0.5488, test_loss: 1.5239, test_f1: 0.6256
 epoch: 42, train_loss: 0.5408, test_loss: 1.9525, test_f1: 0.5600
 epoch: 43, train_loss: 0.5258, test_loss: 1.9720, test_f1: 0.5701
 epoch: 44, train_loss: 0.5405, test_loss: 1.7638, test_f1: 0.6353
 epoch: 45, train_loss: 0.5096, test_loss: 2.0471, test_f1: 0.5856
 epoch: 46, train_loss: 0.5140, test_loss: 1.9352, test_f1: 0.5889
 epoch: 47, train_loss: 0.5142, test_loss: 2.7991, test_f1: 0.5669
 epoch: 48, train_loss: 0.4789, test_loss: 2.4356, test_f1: 0.5985
 epoch: 49, train_loss: 0.5154, test_loss: 2.3459, test_f1: 0.5784
 epoch: 50, train_loss: 0.4931, test_loss: 1.9987, test_f1: 0.5963
 epoch: 51, train_loss: 0.4498, test_loss: 1.8889, test_f1: 0.6159
 epoch: 52, train_loss: 0.4056, test_loss: 2.0528, test_f1: 0.6182
 epoch: 53, train_loss: 0.4137, test_loss: 2.1834, test_f1: 0.5789
 epoch: 54, train_loss: 0.4060, test_loss: 2.3856, test_f1: 0.5979
 epoch: 55, train_loss: 0.4065, test_loss: 2.2207, test_f1: 0.5979
 epoch: 56, train_loss: 0.3982, test_loss: 2.0742, test_f1: 0.6029
 epoch: 57, train_loss: 0.4038, test_loss: 2.1299, test_f1: 0.5843
 epoch: 58, train_loss: 0.3925, test_loss: 2.0744, test_f1: 0.5851
 epoch: 59, train_loss: 0.4133, test_loss: 2.2929, test_f1: 0.5707
 epoch: 60, train_loss: 0.3526, test_loss: 2.3793, test_f1: 0.5933
 epoch: 61, train_loss: 0.3404, test_loss: 2.4555, test_f1: 0.6110
 epoch: 62, train_loss: 0.3469, test_loss: 2.5561, test_f1: 0.5864
 epoch: 63, train_loss: 0.3668, test_loss: 2.9521, test_f1: 0.5509
 epoch: 64, train_loss: 0.3501, test_loss: 2.7273, test_f1: 0.5837
 epoch: 65, train_loss: 0.3440, test_loss: 3.0528, test_f1: 0.5594
 epoch: 66, train_loss: 0.3777, test_loss: 2.7949, test_f1: 0.5792
 epoch: 67, train_loss: 0.3415, test_loss: 3.1272, test_f1: 0.6051
 epoch: 68, train_loss: 0.3766, test_loss: 2.7510, test_f1: 0.6072
 epoch: 69, train_loss: 0.3512, test_loss: 2.4914, test_f1: 0.6039
 epoch: 70, train_loss: 0.3440, test_loss: 2.5187, test_f1: 0.5938
 epoch: 71, train_loss: 0.3077, test_loss: 2.7811, test_f1: 0.5931
 epoch: 72, train_loss: 0.3172, test_loss: 2.7005, test_f1: 0.5551
 epoch: 73, train_loss: 0.3268, test_loss: 2.5293, test_f1: 0.6013
 epoch: 74, train_loss: 0.3498, test_loss: 2.4284, test_f1: 0.5972
 epoch: 75, train_loss: 0.3291, test_loss: 2.5315, test_f1: 0.5960
 epoch: 76, train_loss: 0.3313, test_loss: 2.7327, test_f1: 0.5972
 epoch: 77, train_loss: 0.3284, test_loss: 2.6985, test_f1: 0.5855
 epoch: 78, train_loss: 0.3204, test_loss: 2.5844, test_f1: 0.5825
 epoch: 79, train_loss: 0.3278, test_loss: 2.9477, test_f1: 0.5929
 epoch: 80, train_loss: 0.2925, test_loss: 3.3231, test_f1: 0.5967
 epoch: 81, train_loss: 0.2937, test_loss: 3.0715, test_f1: 0.5759
 epoch: 82, train_loss: 0.3162, test_loss: 2.9940, test_f1: 0.5809
 epoch: 83, train_loss: 0.2958, test_loss: 2.8476, test_f1: 0.6181
 epoch: 84, train_loss: 0.2949, test_loss: 3.1877, test_f1: 0.5859
 epoch: 85, train_loss: 0.2815, test_loss: 2.5973, test_f1: 0.5889
 epoch: 86, train_loss: 0.3024, test_loss: 3.2540, test_f1: 0.5799
 epoch: 87, train_loss: 0.2955, test_loss: 3.2665, test_f1: 0.5941
 epoch: 88, train_loss: 0.3259, test_loss: 2.8456, test_f1: 0.6091
 epoch: 89, train_loss: 0.3100, test_loss: 3.1043, test_f1: 0.5796
 epoch: 90, train_loss: 0.2901, test_loss: 2.9586, test_f1: 0.6015
 epoch: 91, train_loss: 0.2941, test_loss: 3.0419, test_f1: 0.5919
 epoch: 92, train_loss: 0.2745, test_loss: 3.1240, test_f1: 0.6101
 epoch: 93, train_loss: 0.3126, test_loss: 3.3655, test_f1: 0.5942
 epoch: 94, train_loss: 0.3115, test_loss: 3.0611, test_f1: 0.6068
 epoch: 95, train_loss: 0.2777, test_loss: 2.8799, test_f1: 0.5792
 epoch: 96, train_loss: 0.2759, test_loss: 3.1090, test_f1: 0.5900
 epoch: 97, train_loss: 0.2950, test_loss: 3.1033, test_f1: 0.6041
 epoch: 98, train_loss: 0.2959, test_loss: 2.9536, test_f1: 0.5861
 epoch: 99, train_loss: 0.2750, test_loss: 3.2188, test_f1: 0.5851

Training completed in 665.83 seconds
Best F1: 0.6486 at epoch 20
Mean F1 across iterations: 0.6289  0.0126
========================FINAL RESULTS================================
FEGIN weighted F1: 0.6486  0.0126
python main.py --data ltspice_demos --representation component_component --model FEGIN --layers 4 --hiddens 64 --batch_size 32 --lr 0.001 --emb_size 128 --epochs 100 --save_appendix component_component_L4_H64_BS32_LR0.001_E128 --no_val
-----



STDERR:
  File "main.py", line 370, in <module>
    main()
  File "main.py", line 254, in main
    dataset = dataset_class(
  File "/home/philip/projects/ltspice_examples_code_repo/Circuit-Completion-Using-GNNs/component_classification_with_link_prediction_head/evaluation/FEGIN/kernel/circuit_datasets.py", line 15, in __init__
    self.data, self.slices = torch.load(self.processed_paths[0])
  File "/home/philip/.local/lib/python3.8/site-packages/torch/serialization.py", line 1040, in load
    warnings.warn(
  File "/usr/lib/python3.8/warnings.py", line 109, in _showwarnmsg
    sw(msg.message, msg.category, msg.filename, msg.lineno,
  File "main.py", line 47, in warn_with_traceback
    traceback.print_stack(file=log)
/home/philip/projects/ltspice_examples_code_repo/Circuit-Completion-Using-GNNs/component_classification_with_link_prediction_head/evaluation/FEGIN/kernel/circuit_datasets.py:15: FutureWarning: You are using `torch.load` with `weights_only=False` (the current default value), which uses the default pickle module implicitly. It is possible to construct malicious pickle data which will execute arbitrary code during unpickling (See https://github.com/pytorch/pytorch/blob/main/SECURITY.md#untrusted-models for more details). In a future release, the default value for `weights_only` will be flipped to `True`. This limits the functions that could be executed during unpickling. Arbitrary objects will no longer be allowed to be loaded via this mode unless they are explicitly allowlisted by the user via `torch.serialization.add_safe_globals`. We recommend you start setting `weights_only=True` for any use case where you don't have full control of the loaded file. Please open an issue on GitHub for any issues related to this experimental feature.
  self.data, self.slices = torch.load(self.processed_paths[0])
