STDOUT:
Results will be saved in /home/philip/projects/llm_inference_code_repo/Circuit-Completion-Using-GNNs/component_classification_with_link_prediction_head/evaluation/FEGIN/results/model_FEGIN_dataset_ltspice_examples
Command line input: python main.py --data ltspice_examples --representation component_component --model FEGIN --layers 3 --hiddens 32 --batch_size 256 --lr 0.01 --emb_size 250 --epochs 100 --save_appendix component_component_L3_H32_BS256_LR0.01_E250 --no_val
 is saved.
-----
ltspice_examples - FEGIN
Using 3 layers, 32 hidden units, h = 2
Loading component_component representation dataset
ENTERED
Training FEGIN on component_component representation
Train: 3556, Test: 845
##################ITERATION #0 ****************************************
 epoch: 0, train_loss: 1.3013, test_loss: 1.2548, test_f1: 0.2274
 epoch: 1, train_loss: 1.2500, test_loss: 1.2081, test_f1: 0.3065
 epoch: 2, train_loss: 1.1928, test_loss: 1.1828, test_f1: 0.4187
 epoch: 3, train_loss: 1.1482, test_loss: 1.0859, test_f1: 0.4429
 epoch: 4, train_loss: 1.0892, test_loss: 1.0457, test_f1: 0.4571
 epoch: 5, train_loss: 1.0493, test_loss: 0.9594, test_f1: 0.4797
 epoch: 6, train_loss: 1.0273, test_loss: 1.0083, test_f1: 0.4859
 epoch: 7, train_loss: 1.0287, test_loss: 1.0732, test_f1: 0.4800
 epoch: 8, train_loss: 0.9851, test_loss: 1.1694, test_f1: 0.4869
 epoch: 9, train_loss: 0.9647, test_loss: 1.0622, test_f1: 0.5092
 epoch: 10, train_loss: 0.9649, test_loss: 1.0692, test_f1: 0.4978
 epoch: 11, train_loss: 0.9374, test_loss: 1.0377, test_f1: 0.4712
 epoch: 12, train_loss: 0.9241, test_loss: 1.1916, test_f1: 0.4423
 epoch: 13, train_loss: 0.9231, test_loss: 1.0760, test_f1: 0.5364
 epoch: 14, train_loss: 0.9298, test_loss: 1.0190, test_f1: 0.5417
 epoch: 15, train_loss: 0.9115, test_loss: 1.0673, test_f1: 0.4903
 epoch: 16, train_loss: 0.8871, test_loss: 1.1805, test_f1: 0.5121
 epoch: 17, train_loss: 0.8939, test_loss: 1.3928, test_f1: 0.4096
 epoch: 18, train_loss: 0.8743, test_loss: 1.0051, test_f1: 0.5415
 epoch: 19, train_loss: 0.8681, test_loss: 1.1037, test_f1: 0.5061
 epoch: 20, train_loss: 0.8497, test_loss: 1.0458, test_f1: 0.5091
 epoch: 21, train_loss: 0.8498, test_loss: 1.1862, test_f1: 0.5232
 epoch: 22, train_loss: 0.8493, test_loss: 1.1811, test_f1: 0.5181
 epoch: 23, train_loss: 0.8178, test_loss: 1.0711, test_f1: 0.5596
 epoch: 24, train_loss: 0.8509, test_loss: 1.0685, test_f1: 0.5136
 epoch: 25, train_loss: 0.8299, test_loss: 1.1077, test_f1: 0.5094
 epoch: 26, train_loss: 0.8420, test_loss: 1.1255, test_f1: 0.5032
 epoch: 27, train_loss: 0.8232, test_loss: 1.1511, test_f1: 0.5488
 epoch: 28, train_loss: 0.8230, test_loss: 1.1707, test_f1: 0.4961
 epoch: 29, train_loss: 0.8090, test_loss: 1.0828, test_f1: 0.5577
 epoch: 30, train_loss: 0.8167, test_loss: 1.0752, test_f1: 0.5489
 epoch: 31, train_loss: 0.8000, test_loss: 1.1558, test_f1: 0.4973
 epoch: 32, train_loss: 0.8009, test_loss: 1.1546, test_f1: 0.4795
 epoch: 33, train_loss: 0.8053, test_loss: 1.2745, test_f1: 0.5286
 epoch: 34, train_loss: 0.7779, test_loss: 1.1338, test_f1: 0.5174
 epoch: 35, train_loss: 0.7819, test_loss: 1.1176, test_f1: 0.5631
 epoch: 36, train_loss: 0.7710, test_loss: 1.2979, test_f1: 0.5368
 epoch: 37, train_loss: 0.7772, test_loss: 1.1510, test_f1: 0.5538
 epoch: 38, train_loss: 0.7569, test_loss: 1.1295, test_f1: 0.5241
 epoch: 39, train_loss: 0.7478, test_loss: 1.3414, test_f1: 0.5367
 epoch: 40, train_loss: 0.7395, test_loss: 1.2261, test_f1: 0.5493
 epoch: 41, train_loss: 0.7521, test_loss: 1.3476, test_f1: 0.4784
 epoch: 42, train_loss: 0.7639, test_loss: 1.1676, test_f1: 0.5234
 epoch: 43, train_loss: 0.7658, test_loss: 1.2203, test_f1: 0.5517
 epoch: 44, train_loss: 0.7550, test_loss: 1.2635, test_f1: 0.5615
 epoch: 45, train_loss: 0.7406, test_loss: 1.4074, test_f1: 0.5338
 epoch: 46, train_loss: 0.7310, test_loss: 1.2832, test_f1: 0.5200
 epoch: 47, train_loss: 0.7555, test_loss: 1.1474, test_f1: 0.5219
 epoch: 48, train_loss: 0.7612, test_loss: 1.3408, test_f1: 0.5199
 epoch: 49, train_loss: 0.7397, test_loss: 1.3089, test_f1: 0.5612
 epoch: 50, train_loss: 0.7260, test_loss: 1.2638, test_f1: 0.5051
 epoch: 51, train_loss: 0.7057, test_loss: 1.2261, test_f1: 0.5221
 epoch: 52, train_loss: 0.6834, test_loss: 1.2093, test_f1: 0.5248
 epoch: 53, train_loss: 0.6709, test_loss: 1.3325, test_f1: 0.5178
 epoch: 54, train_loss: 0.6750, test_loss: 1.1416, test_f1: 0.5743
 epoch: 55, train_loss: 0.6664, test_loss: 1.2135, test_f1: 0.5683
 epoch: 56, train_loss: 0.6548, test_loss: 1.3212, test_f1: 0.5289
 epoch: 57, train_loss: 0.6519, test_loss: 1.3167, test_f1: 0.5419
 epoch: 58, train_loss: 0.6474, test_loss: 1.2649, test_f1: 0.5880
 epoch: 59, train_loss: 0.6480, test_loss: 1.3174, test_f1: 0.5394
 epoch: 60, train_loss: 0.6322, test_loss: 1.3337, test_f1: 0.5519
 epoch: 61, train_loss: 0.6280, test_loss: 1.2295, test_f1: 0.5883
 epoch: 62, train_loss: 0.6296, test_loss: 1.3599, test_f1: 0.5546
 epoch: 63, train_loss: 0.6343, test_loss: 1.2823, test_f1: 0.5629
 epoch: 64, train_loss: 0.6336, test_loss: 1.2633, test_f1: 0.5418
 epoch: 65, train_loss: 0.6387, test_loss: 1.4511, test_f1: 0.5146
 epoch: 66, train_loss: 0.6371, test_loss: 1.5094, test_f1: 0.5138
 epoch: 67, train_loss: 0.6165, test_loss: 1.3943, test_f1: 0.5932
 epoch: 68, train_loss: 0.6314, test_loss: 1.4793, test_f1: 0.5120
 epoch: 69, train_loss: 0.6200, test_loss: 1.4659, test_f1: 0.5513
 epoch: 70, train_loss: 0.6304, test_loss: 1.4056, test_f1: 0.5282
 epoch: 71, train_loss: 0.6228, test_loss: 1.3032, test_f1: 0.5460
 epoch: 72, train_loss: 0.6073, test_loss: 1.4250, test_f1: 0.5447
 epoch: 73, train_loss: 0.6057, test_loss: 1.3859, test_f1: 0.5597
 epoch: 74, train_loss: 0.5868, test_loss: 1.4971, test_f1: 0.5591
 epoch: 75, train_loss: 0.6292, test_loss: 1.4132, test_f1: 0.5413
 epoch: 76, train_loss: 0.6020, test_loss: 1.3424, test_f1: 0.5793
 epoch: 77, train_loss: 0.5904, test_loss: 1.4371, test_f1: 0.5571
 epoch: 78, train_loss: 0.5974, test_loss: 1.4781, test_f1: 0.5476
 epoch: 79, train_loss: 0.5839, test_loss: 1.3730, test_f1: 0.5755
 epoch: 80, train_loss: 0.5807, test_loss: 1.4114, test_f1: 0.5318
 epoch: 81, train_loss: 0.5814, test_loss: 1.4844, test_f1: 0.5210
 epoch: 82, train_loss: 0.6097, test_loss: 1.4084, test_f1: 0.5591
 epoch: 83, train_loss: 0.5914, test_loss: 1.3926, test_f1: 0.5568
 epoch: 84, train_loss: 0.5693, test_loss: 1.4259, test_f1: 0.5728
 epoch: 85, train_loss: 0.5745, test_loss: 1.4998, test_f1: 0.5387
 epoch: 86, train_loss: 0.5603, test_loss: 1.4059, test_f1: 0.6023
 epoch: 87, train_loss: 0.5551, test_loss: 1.5639, test_f1: 0.5612
 epoch: 88, train_loss: 0.5813, test_loss: 1.4878, test_f1: 0.5746
 epoch: 89, train_loss: 0.5584, test_loss: 1.5204, test_f1: 0.5982
 epoch: 90, train_loss: 0.5487, test_loss: 1.5431, test_f1: 0.5465
 epoch: 91, train_loss: 0.5359, test_loss: 1.7443, test_f1: 0.5930
 epoch: 92, train_loss: 0.5369, test_loss: 1.4992, test_f1: 0.5370
 epoch: 93, train_loss: 0.5570, test_loss: 1.5872, test_f1: 0.5651
 epoch: 94, train_loss: 0.5382, test_loss: 1.5925, test_f1: 0.5733
 epoch: 95, train_loss: 0.5711, test_loss: 1.6755, test_f1: 0.5607
 epoch: 96, train_loss: 0.5785, test_loss: 1.6448, test_f1: 0.5603
 epoch: 97, train_loss: 0.5365, test_loss: 1.5004, test_f1: 0.5832
 epoch: 98, train_loss: 0.5403, test_loss: 1.6445, test_f1: 0.5058
 epoch: 99, train_loss: 0.5561, test_loss: 1.4147, test_f1: 0.5574
##################ITERATION #1 ****************************************
 epoch: 0, train_loss: 1.2500, test_loss: 1.2389, test_f1: 0.2574
 epoch: 1, train_loss: 1.1406, test_loss: 1.1057, test_f1: 0.4000
 epoch: 2, train_loss: 1.1035, test_loss: 1.0511, test_f1: 0.4524
 epoch: 3, train_loss: 1.0622, test_loss: 1.1289, test_f1: 0.4497
 epoch: 4, train_loss: 1.0565, test_loss: 1.0589, test_f1: 0.4529
 epoch: 5, train_loss: 1.0028, test_loss: 0.9518, test_f1: 0.4894
 epoch: 6, train_loss: 0.9873, test_loss: 1.0965, test_f1: 0.4635
 epoch: 7, train_loss: 0.9682, test_loss: 1.0656, test_f1: 0.4593
 epoch: 8, train_loss: 0.9500, test_loss: 1.0515, test_f1: 0.4836
 epoch: 9, train_loss: 0.9399, test_loss: 1.0217, test_f1: 0.4914
 epoch: 10, train_loss: 0.9352, test_loss: 1.0053, test_f1: 0.4922
 epoch: 11, train_loss: 0.9393, test_loss: 0.9831, test_f1: 0.5103
 epoch: 12, train_loss: 0.9059, test_loss: 1.0584, test_f1: 0.4957
 epoch: 13, train_loss: 0.9018, test_loss: 1.0620, test_f1: 0.4701
 epoch: 14, train_loss: 0.8768, test_loss: 1.0189, test_f1: 0.4824
 epoch: 15, train_loss: 0.8727, test_loss: 1.0832, test_f1: 0.4937
 epoch: 16, train_loss: 0.8634, test_loss: 0.9958, test_f1: 0.4966
 epoch: 17, train_loss: 0.8578, test_loss: 1.0332, test_f1: 0.5039
 epoch: 18, train_loss: 0.8673, test_loss: 1.0064, test_f1: 0.5079
 epoch: 19, train_loss: 0.8661, test_loss: 0.9809, test_f1: 0.5098
 epoch: 20, train_loss: 0.8553, test_loss: 1.0419, test_f1: 0.5072
 epoch: 21, train_loss: 0.8552, test_loss: 1.0741, test_f1: 0.5325
 epoch: 22, train_loss: 0.8442, test_loss: 1.0555, test_f1: 0.5041
 epoch: 23, train_loss: 0.8437, test_loss: 1.0422, test_f1: 0.5157
 epoch: 24, train_loss: 0.8271, test_loss: 1.1609, test_f1: 0.4354
 epoch: 25, train_loss: 0.8079, test_loss: 1.0977, test_f1: 0.4924
 epoch: 26, train_loss: 0.8027, test_loss: 1.0374, test_f1: 0.4947
 epoch: 27, train_loss: 0.8140, test_loss: 1.0959, test_f1: 0.4927
 epoch: 28, train_loss: 0.7882, test_loss: 1.0518, test_f1: 0.5353
 epoch: 29, train_loss: 0.7984, test_loss: 1.0540, test_f1: 0.5335
 epoch: 30, train_loss: 0.7964, test_loss: 1.1059, test_f1: 0.5034
 epoch: 31, train_loss: 0.7967, test_loss: 1.1029, test_f1: 0.5194
 epoch: 32, train_loss: 0.7928, test_loss: 1.1477, test_f1: 0.4927
 epoch: 33, train_loss: 0.7858, test_loss: 1.0619, test_f1: 0.5510
 epoch: 34, train_loss: 0.7797, test_loss: 1.0287, test_f1: 0.5600
 epoch: 35, train_loss: 0.7922, test_loss: 1.1275, test_f1: 0.4789
 epoch: 36, train_loss: 0.7652, test_loss: 1.1075, test_f1: 0.5234
 epoch: 37, train_loss: 0.7518, test_loss: 1.1066, test_f1: 0.5218
 epoch: 38, train_loss: 0.7654, test_loss: 1.0838, test_f1: 0.5199
 epoch: 39, train_loss: 0.7444, test_loss: 1.1181, test_f1: 0.5039
 epoch: 40, train_loss: 0.7353, test_loss: 1.1540, test_f1: 0.5036
 epoch: 41, train_loss: 0.7435, test_loss: 1.1066, test_f1: 0.5140
 epoch: 42, train_loss: 0.7184, test_loss: 1.1200, test_f1: 0.5417
 epoch: 43, train_loss: 0.7438, test_loss: 1.2554, test_f1: 0.4920
 epoch: 44, train_loss: 0.7360, test_loss: 1.0200, test_f1: 0.4995
 epoch: 45, train_loss: 0.7364, test_loss: 1.1583, test_f1: 0.5242
 epoch: 46, train_loss: 0.7350, test_loss: 1.0921, test_f1: 0.5424
 epoch: 47, train_loss: 0.7274, test_loss: 1.0599, test_f1: 0.5400
 epoch: 48, train_loss: 0.7208, test_loss: 1.3019, test_f1: 0.4870
 epoch: 49, train_loss: 0.7053, test_loss: 1.2774, test_f1: 0.4995
 epoch: 50, train_loss: 0.7002, test_loss: 1.1482, test_f1: 0.5201
 epoch: 51, train_loss: 0.7027, test_loss: 1.1486, test_f1: 0.4966
 epoch: 52, train_loss: 0.6543, test_loss: 1.1769, test_f1: 0.5262
 epoch: 53, train_loss: 0.6476, test_loss: 1.2027, test_f1: 0.5342
 epoch: 54, train_loss: 0.6321, test_loss: 1.2610, test_f1: 0.5112
 epoch: 55, train_loss: 0.6385, test_loss: 1.2444, test_f1: 0.5184
 epoch: 56, train_loss: 0.6376, test_loss: 1.1161, test_f1: 0.5376
 epoch: 57, train_loss: 0.6461, test_loss: 1.1892, test_f1: 0.5149
 epoch: 58, train_loss: 0.6313, test_loss: 1.2980, test_f1: 0.5102
 epoch: 59, train_loss: 0.6349, test_loss: 1.2255, test_f1: 0.5359
 epoch: 60, train_loss: 0.6260, test_loss: 1.2454, test_f1: 0.5263
 epoch: 61, train_loss: 0.6232, test_loss: 1.3074, test_f1: 0.4926
 epoch: 62, train_loss: 0.6292, test_loss: 1.2847, test_f1: 0.5248
 epoch: 63, train_loss: 0.6183, test_loss: 1.3134, test_f1: 0.5153
 epoch: 64, train_loss: 0.6093, test_loss: 1.3006, test_f1: 0.5318
 epoch: 65, train_loss: 0.5999, test_loss: 1.2718, test_f1: 0.5206
 epoch: 66, train_loss: 0.5940, test_loss: 1.3434, test_f1: 0.5130
 epoch: 67, train_loss: 0.5941, test_loss: 1.2749, test_f1: 0.5311
 epoch: 68, train_loss: 0.6127, test_loss: 1.3266, test_f1: 0.5340
 epoch: 69, train_loss: 0.6115, test_loss: 1.1965, test_f1: 0.5460
 epoch: 70, train_loss: 0.5928, test_loss: 1.3336, test_f1: 0.5062
 epoch: 71, train_loss: 0.5826, test_loss: 1.3239, test_f1: 0.5217
 epoch: 72, train_loss: 0.5960, test_loss: 1.5175, test_f1: 0.4978
 epoch: 73, train_loss: 0.5901, test_loss: 1.4231, test_f1: 0.5050
 epoch: 74, train_loss: 0.5943, test_loss: 1.2474, test_f1: 0.5243
 epoch: 75, train_loss: 0.5786, test_loss: 1.3801, test_f1: 0.5234
 epoch: 76, train_loss: 0.5696, test_loss: 1.3392, test_f1: 0.5061
 epoch: 77, train_loss: 0.5679, test_loss: 1.3004, test_f1: 0.5357
 epoch: 78, train_loss: 0.5626, test_loss: 1.4476, test_f1: 0.5416
 epoch: 79, train_loss: 0.5526, test_loss: 1.4425, test_f1: 0.5319
 epoch: 80, train_loss: 0.6049, test_loss: 1.3928, test_f1: 0.5008
 epoch: 81, train_loss: 0.5553, test_loss: 1.4229, test_f1: 0.5280
 epoch: 82, train_loss: 0.5637, test_loss: 1.3739, test_f1: 0.5314
 epoch: 83, train_loss: 0.5739, test_loss: 1.4126, test_f1: 0.4969
 epoch: 84, train_loss: 0.5908, test_loss: 1.4289, test_f1: 0.5362
 epoch: 85, train_loss: 0.5892, test_loss: 1.4305, test_f1: 0.5090
 epoch: 86, train_loss: 0.5723, test_loss: 1.3448, test_f1: 0.5159
 epoch: 87, train_loss: 0.5575, test_loss: 1.4101, test_f1: 0.5175
 epoch: 88, train_loss: 0.5395, test_loss: 1.4747, test_f1: 0.5304
 epoch: 89, train_loss: 0.5617, test_loss: 1.6315, test_f1: 0.5249
 epoch: 90, train_loss: 0.5609, test_loss: 1.3918, test_f1: 0.5280
 epoch: 91, train_loss: 0.5459, test_loss: 1.3401, test_f1: 0.5473
 epoch: 92, train_loss: 0.5413, test_loss: 1.6971, test_f1: 0.4790
 epoch: 93, train_loss: 0.5329, test_loss: 1.6515, test_f1: 0.4997
 epoch: 94, train_loss: 0.5442, test_loss: 1.4805, test_f1: 0.5378
 epoch: 95, train_loss: 0.5560, test_loss: 1.4115, test_f1: 0.5295
 epoch: 96, train_loss: 0.5396, test_loss: 1.6498, test_f1: 0.4897
 epoch: 97, train_loss: 0.5307, test_loss: 1.6048, test_f1: 0.5087
 epoch: 98, train_loss: 0.5182, test_loss: 1.3890, test_f1: 0.5340
 epoch: 99, train_loss: 0.5289, test_loss: 1.6955, test_f1: 0.5133
##################ITERATION #2 ****************************************
 epoch: 0, train_loss: 1.3086, test_loss: 1.2510, test_f1: 0.2274
 epoch: 1, train_loss: 1.1993, test_loss: 1.2139, test_f1: 0.3813
 epoch: 2, train_loss: 1.1550, test_loss: 1.1090, test_f1: 0.4343
 epoch: 3, train_loss: 1.1075, test_loss: 1.0444, test_f1: 0.4653
 epoch: 4, train_loss: 1.0690, test_loss: 0.9779, test_f1: 0.5037
 epoch: 5, train_loss: 1.0610, test_loss: 1.0846, test_f1: 0.4212
 epoch: 6, train_loss: 1.0422, test_loss: 1.0480, test_f1: 0.4537
 epoch: 7, train_loss: 1.0044, test_loss: 1.0819, test_f1: 0.4574
 epoch: 8, train_loss: 0.9992, test_loss: 0.9802, test_f1: 0.5232
 epoch: 9, train_loss: 0.9782, test_loss: 0.9193, test_f1: 0.5025
 epoch: 10, train_loss: 0.9485, test_loss: 0.9423, test_f1: 0.5100
 epoch: 11, train_loss: 0.9342, test_loss: 0.9585, test_f1: 0.5086
 epoch: 12, train_loss: 0.9227, test_loss: 0.9031, test_f1: 0.4895
 epoch: 13, train_loss: 0.9044, test_loss: 0.9876, test_f1: 0.4922
 epoch: 14, train_loss: 0.9038, test_loss: 0.9258, test_f1: 0.5192
 epoch: 15, train_loss: 0.9009, test_loss: 0.9950, test_f1: 0.5091
 epoch: 16, train_loss: 0.8847, test_loss: 0.9584, test_f1: 0.5391
 epoch: 17, train_loss: 0.8715, test_loss: 0.9652, test_f1: 0.5229
 epoch: 18, train_loss: 0.8652, test_loss: 1.0144, test_f1: 0.5046
 epoch: 19, train_loss: 0.8790, test_loss: 0.9568, test_f1: 0.5238
 epoch: 20, train_loss: 0.8499, test_loss: 1.0914, test_f1: 0.4804
 epoch: 21, train_loss: 0.8551, test_loss: 1.0228, test_f1: 0.5190
 epoch: 22, train_loss: 0.8750, test_loss: 0.9765, test_f1: 0.5222
 epoch: 23, train_loss: 0.8645, test_loss: 1.0184, test_f1: 0.5339
 epoch: 24, train_loss: 0.8445, test_loss: 1.0060, test_f1: 0.5337
 epoch: 25, train_loss: 0.8272, test_loss: 1.0118, test_f1: 0.5414
 epoch: 26, train_loss: 0.8047, test_loss: 0.9853, test_f1: 0.5357
 epoch: 27, train_loss: 0.7957, test_loss: 1.0495, test_f1: 0.5254
 epoch: 28, train_loss: 0.8022, test_loss: 1.1819, test_f1: 0.4782
 epoch: 29, train_loss: 0.8057, test_loss: 1.0980, test_f1: 0.5226
 epoch: 30, train_loss: 0.8016, test_loss: 1.0302, test_f1: 0.5374
 epoch: 31, train_loss: 0.7823, test_loss: 1.0276, test_f1: 0.5507
 epoch: 32, train_loss: 0.7786, test_loss: 1.0643, test_f1: 0.5623
 epoch: 33, train_loss: 0.7879, test_loss: 1.0434, test_f1: 0.5159
 epoch: 34, train_loss: 0.7854, test_loss: 1.0790, test_f1: 0.5435
 epoch: 35, train_loss: 0.7595, test_loss: 1.0281, test_f1: 0.5518
 epoch: 36, train_loss: 0.7813, test_loss: 1.0501, test_f1: 0.5103
 epoch: 37, train_loss: 0.7945, test_loss: 1.0703, test_f1: 0.5416
 epoch: 38, train_loss: 0.7722, test_loss: 1.0694, test_f1: 0.5456
 epoch: 39, train_loss: 0.7778, test_loss: 1.3018, test_f1: 0.4927
 epoch: 40, train_loss: 0.7680, test_loss: 1.0480, test_f1: 0.5435
 epoch: 41, train_loss: 0.7792, test_loss: 1.1037, test_f1: 0.5271
 epoch: 42, train_loss: 0.7557, test_loss: 1.0306, test_f1: 0.5491
 epoch: 43, train_loss: 0.7399, test_loss: 1.0746, test_f1: 0.5672
 epoch: 44, train_loss: 0.7436, test_loss: 1.0145, test_f1: 0.5414
 epoch: 45, train_loss: 0.7295, test_loss: 1.1619, test_f1: 0.5135
 epoch: 46, train_loss: 0.7606, test_loss: 1.1073, test_f1: 0.5537
 epoch: 47, train_loss: 0.7472, test_loss: 1.1853, test_f1: 0.4952
 epoch: 48, train_loss: 0.7471, test_loss: 1.0911, test_f1: 0.5747
 epoch: 49, train_loss: 0.7487, test_loss: 1.0779, test_f1: 0.5217
 epoch: 50, train_loss: 0.7408, test_loss: 1.0496, test_f1: 0.5659
 epoch: 51, train_loss: 0.6999, test_loss: 1.1316, test_f1: 0.5177
 epoch: 52, train_loss: 0.6779, test_loss: 1.1148, test_f1: 0.5415
 epoch: 53, train_loss: 0.6652, test_loss: 1.0982, test_f1: 0.5419
 epoch: 54, train_loss: 0.6611, test_loss: 1.1205, test_f1: 0.5476
 epoch: 55, train_loss: 0.6521, test_loss: 1.1956, test_f1: 0.5257
 epoch: 56, train_loss: 0.6536, test_loss: 1.0775, test_f1: 0.5677
 epoch: 57, train_loss: 0.6660, test_loss: 1.0741, test_f1: 0.5580
 epoch: 58, train_loss: 0.6617, test_loss: 1.1694, test_f1: 0.5379
 epoch: 59, train_loss: 0.6461, test_loss: 1.0954, test_f1: 0.5686
 epoch: 60, train_loss: 0.6420, test_loss: 1.1460, test_f1: 0.5693
 epoch: 61, train_loss: 0.6487, test_loss: 1.1415, test_f1: 0.5464
 epoch: 62, train_loss: 0.6322, test_loss: 1.2084, test_f1: 0.5680
 epoch: 63, train_loss: 0.6221, test_loss: 1.2272, test_f1: 0.5326
 epoch: 64, train_loss: 0.6288, test_loss: 1.1620, test_f1: 0.5624
 epoch: 65, train_loss: 0.6143, test_loss: 1.2182, test_f1: 0.5085
 epoch: 66, train_loss: 0.6271, test_loss: 1.2177, test_f1: 0.5427
 epoch: 67, train_loss: 0.6149, test_loss: 1.1429, test_f1: 0.5554
 epoch: 68, train_loss: 0.6320, test_loss: 1.2123, test_f1: 0.5721
 epoch: 69, train_loss: 0.6184, test_loss: 1.1657, test_f1: 0.5697
 epoch: 70, train_loss: 0.6156, test_loss: 1.2689, test_f1: 0.5396
 epoch: 71, train_loss: 0.6333, test_loss: 1.1954, test_f1: 0.5676
 epoch: 72, train_loss: 0.6093, test_loss: 1.2564, test_f1: 0.5303
 epoch: 73, train_loss: 0.6105, test_loss: 1.2623, test_f1: 0.5296
 epoch: 74, train_loss: 0.5955, test_loss: 1.2443, test_f1: 0.5535
 epoch: 75, train_loss: 0.6023, test_loss: 1.3329, test_f1: 0.5350
 epoch: 76, train_loss: 0.5986, test_loss: 1.3097, test_f1: 0.5458
 epoch: 77, train_loss: 0.6016, test_loss: 1.2729, test_f1: 0.5384
 epoch: 78, train_loss: 0.5876, test_loss: 1.2642, test_f1: 0.5275
 epoch: 79, train_loss: 0.5766, test_loss: 1.2361, test_f1: 0.5660
 epoch: 80, train_loss: 0.5739, test_loss: 1.2152, test_f1: 0.5713
 epoch: 81, train_loss: 0.5787, test_loss: 1.3180, test_f1: 0.5338
 epoch: 82, train_loss: 0.5832, test_loss: 1.2815, test_f1: 0.5301
 epoch: 83, train_loss: 0.5932, test_loss: 1.3521, test_f1: 0.5573
 epoch: 84, train_loss: 0.5789, test_loss: 1.3667, test_f1: 0.5442
 epoch: 85, train_loss: 0.5866, test_loss: 1.2722, test_f1: 0.5267
 epoch: 86, train_loss: 0.5948, test_loss: 1.3916, test_f1: 0.5366
 epoch: 87, train_loss: 0.5690, test_loss: 1.2759, test_f1: 0.5507
 epoch: 88, train_loss: 0.5835, test_loss: 1.2433, test_f1: 0.5494
 epoch: 89, train_loss: 0.5790, test_loss: 1.3279, test_f1: 0.5384
 epoch: 90, train_loss: 0.5574, test_loss: 1.2808, test_f1: 0.5362
 epoch: 91, train_loss: 0.5599, test_loss: 1.3874, test_f1: 0.5285
 epoch: 92, train_loss: 0.5785, test_loss: 1.4002, test_f1: 0.5273
 epoch: 93, train_loss: 0.5567, test_loss: 1.2986, test_f1: 0.5634
 epoch: 94, train_loss: 0.5513, test_loss: 1.3571, test_f1: 0.5383
 epoch: 95, train_loss: 0.5534, test_loss: 1.4112, test_f1: 0.5384
 epoch: 96, train_loss: 0.5624, test_loss: 1.3681, test_f1: 0.5284
 epoch: 97, train_loss: 0.5307, test_loss: 1.3406, test_f1: 0.5659
 epoch: 98, train_loss: 0.5206, test_loss: 1.4474, test_f1: 0.5343
 epoch: 99, train_loss: 0.5365, test_loss: 1.3213, test_f1: 0.5514
##################ITERATION #3 ****************************************
 epoch: 0, train_loss: 1.3806, test_loss: 1.2600, test_f1: 0.2270
 epoch: 1, train_loss: 1.2361, test_loss: 1.2084, test_f1: 0.2752
 epoch: 2, train_loss: 1.1941, test_loss: 1.1509, test_f1: 0.3888
 epoch: 3, train_loss: 1.1460, test_loss: 1.0945, test_f1: 0.4139
 epoch: 4, train_loss: 1.1136, test_loss: 1.0618, test_f1: 0.4629
 epoch: 5, train_loss: 1.0827, test_loss: 1.0783, test_f1: 0.4375
 epoch: 6, train_loss: 1.0603, test_loss: 1.1032, test_f1: 0.4388
 epoch: 7, train_loss: 1.0390, test_loss: 1.0101, test_f1: 0.4615
 epoch: 8, train_loss: 0.9876, test_loss: 1.0620, test_f1: 0.4285
 epoch: 9, train_loss: 0.9675, test_loss: 1.3269, test_f1: 0.4269
 epoch: 10, train_loss: 0.9536, test_loss: 0.8967, test_f1: 0.4826
 epoch: 11, train_loss: 0.9311, test_loss: 0.9342, test_f1: 0.4967
 epoch: 12, train_loss: 0.9231, test_loss: 1.0899, test_f1: 0.4608
 epoch: 13, train_loss: 0.9095, test_loss: 0.9909, test_f1: 0.4727
 epoch: 14, train_loss: 0.9091, test_loss: 1.0746, test_f1: 0.4769
 epoch: 15, train_loss: 0.8823, test_loss: 0.9660, test_f1: 0.4953
 epoch: 16, train_loss: 0.8715, test_loss: 1.0277, test_f1: 0.5112
 epoch: 17, train_loss: 0.8805, test_loss: 0.9535, test_f1: 0.5034
 epoch: 18, train_loss: 0.8668, test_loss: 0.9156, test_f1: 0.5247
 epoch: 19, train_loss: 0.8397, test_loss: 1.0813, test_f1: 0.4866
 epoch: 20, train_loss: 0.8415, test_loss: 1.0446, test_f1: 0.5140
 epoch: 21, train_loss: 0.8180, test_loss: 0.9742, test_f1: 0.5220
 epoch: 22, train_loss: 0.8145, test_loss: 1.0718, test_f1: 0.5343
 epoch: 23, train_loss: 0.8264, test_loss: 1.0426, test_f1: 0.4782
 epoch: 24, train_loss: 0.8095, test_loss: 1.0547, test_f1: 0.5243
 epoch: 25, train_loss: 0.8165, test_loss: 1.0615, test_f1: 0.5419
 epoch: 26, train_loss: 0.7927, test_loss: 1.2209, test_f1: 0.4980
 epoch: 27, train_loss: 0.8007, test_loss: 1.0198, test_f1: 0.5223
 epoch: 28, train_loss: 0.7814, test_loss: 1.0010, test_f1: 0.5241
 epoch: 29, train_loss: 0.7873, test_loss: 1.0774, test_f1: 0.5304
 epoch: 30, train_loss: 0.7953, test_loss: 0.9737, test_f1: 0.5282
 epoch: 31, train_loss: 0.8204, test_loss: 0.9531, test_f1: 0.5753
 epoch: 32, train_loss: 0.7884, test_loss: 0.9797, test_f1: 0.5535
 epoch: 33, train_loss: 0.7828, test_loss: 1.3876, test_f1: 0.4412
 epoch: 34, train_loss: 0.7680, test_loss: 1.0599, test_f1: 0.5322
 epoch: 35, train_loss: 0.7821, test_loss: 0.9791, test_f1: 0.5532
 epoch: 36, train_loss: 0.7464, test_loss: 1.0741, test_f1: 0.5076
 epoch: 37, train_loss: 0.7608, test_loss: 1.0843, test_f1: 0.5217
 epoch: 38, train_loss: 0.7577, test_loss: 1.0159, test_f1: 0.5563
 epoch: 39, train_loss: 0.7513, test_loss: 0.9966, test_f1: 0.5555
 epoch: 40, train_loss: 0.7462, test_loss: 1.0967, test_f1: 0.5489
 epoch: 41, train_loss: 0.7502, test_loss: 1.0522, test_f1: 0.5570
 epoch: 42, train_loss: 0.7224, test_loss: 1.2587, test_f1: 0.4848
 epoch: 43, train_loss: 0.7170, test_loss: 1.0719, test_f1: 0.5479
 epoch: 44, train_loss: 0.7309, test_loss: 0.9928, test_f1: 0.5357
 epoch: 45, train_loss: 0.7278, test_loss: 1.1010, test_f1: 0.5081
 epoch: 46, train_loss: 0.7179, test_loss: 1.1522, test_f1: 0.5396
 epoch: 47, train_loss: 0.7027, test_loss: 1.0670, test_f1: 0.5311
 epoch: 48, train_loss: 0.7251, test_loss: 1.0641, test_f1: 0.5426
 epoch: 49, train_loss: 0.7410, test_loss: 1.1206, test_f1: 0.5196
 epoch: 50, train_loss: 0.7155, test_loss: 1.0910, test_f1: 0.5081
 epoch: 51, train_loss: 0.6936, test_loss: 1.0538, test_f1: 0.5091
 epoch: 52, train_loss: 0.6634, test_loss: 1.0363, test_f1: 0.5402
 epoch: 53, train_loss: 0.6386, test_loss: 1.0833, test_f1: 0.5206
 epoch: 54, train_loss: 0.6386, test_loss: 1.0844, test_f1: 0.5411
 epoch: 55, train_loss: 0.6369, test_loss: 1.1563, test_f1: 0.5212
 epoch: 56, train_loss: 0.6194, test_loss: 1.1303, test_f1: 0.5227
 epoch: 57, train_loss: 0.6228, test_loss: 1.0787, test_f1: 0.5404
 epoch: 58, train_loss: 0.6224, test_loss: 1.1086, test_f1: 0.5180
 epoch: 59, train_loss: 0.5982, test_loss: 1.2769, test_f1: 0.4971
 epoch: 60, train_loss: 0.6173, test_loss: 1.3227, test_f1: 0.4993
 epoch: 61, train_loss: 0.6212, test_loss: 1.2242, test_f1: 0.5194
 epoch: 62, train_loss: 0.6058, test_loss: 1.1125, test_f1: 0.5726
 epoch: 63, train_loss: 0.6195, test_loss: 1.1801, test_f1: 0.5179
 epoch: 64, train_loss: 0.6053, test_loss: 1.3991, test_f1: 0.4926
 epoch: 65, train_loss: 0.6031, test_loss: 1.1580, test_f1: 0.5441
 epoch: 66, train_loss: 0.5951, test_loss: 1.3885, test_f1: 0.5044
 epoch: 67, train_loss: 0.6009, test_loss: 1.3770, test_f1: 0.5152
 epoch: 68, train_loss: 0.5898, test_loss: 1.1970, test_f1: 0.5482
 epoch: 69, train_loss: 0.5877, test_loss: 1.3436, test_f1: 0.5083
 epoch: 70, train_loss: 0.5909, test_loss: 1.3000, test_f1: 0.5136
 epoch: 71, train_loss: 0.5829, test_loss: 1.3001, test_f1: 0.5326
 epoch: 72, train_loss: 0.5904, test_loss: 1.2113, test_f1: 0.5625
 epoch: 73, train_loss: 0.5886, test_loss: 1.3548, test_f1: 0.5273
 epoch: 74, train_loss: 0.5760, test_loss: 1.1994, test_f1: 0.5441
 epoch: 75, train_loss: 0.5671, test_loss: 1.2716, test_f1: 0.5523
 epoch: 76, train_loss: 0.5732, test_loss: 1.2568, test_f1: 0.5512
 epoch: 77, train_loss: 0.6101, test_loss: 1.1909, test_f1: 0.5126
 epoch: 78, train_loss: 0.5724, test_loss: 1.2568, test_f1: 0.5387
 epoch: 79, train_loss: 0.5608, test_loss: 1.2484, test_f1: 0.5347
 epoch: 80, train_loss: 0.5728, test_loss: 1.2519, test_f1: 0.5489
 epoch: 81, train_loss: 0.5407, test_loss: 1.3220, test_f1: 0.5244
 epoch: 82, train_loss: 0.5458, test_loss: 1.3919, test_f1: 0.5348
 epoch: 83, train_loss: 0.5471, test_loss: 1.5754, test_f1: 0.4770
 epoch: 84, train_loss: 0.5484, test_loss: 1.3570, test_f1: 0.5351
 epoch: 85, train_loss: 0.5318, test_loss: 1.4030, test_f1: 0.5536
 epoch: 86, train_loss: 0.5466, test_loss: 1.4059, test_f1: 0.5313
 epoch: 87, train_loss: 0.5497, test_loss: 1.4936, test_f1: 0.5421
 epoch: 88, train_loss: 0.5567, test_loss: 1.5529, test_f1: 0.5317
 epoch: 89, train_loss: 0.5333, test_loss: 1.5920, test_f1: 0.5150
 epoch: 90, train_loss: 0.5377, test_loss: 1.5931, test_f1: 0.4904
 epoch: 91, train_loss: 0.5348, test_loss: 1.3980, test_f1: 0.5194
 epoch: 92, train_loss: 0.5167, test_loss: 1.4608, test_f1: 0.5255
 epoch: 93, train_loss: 0.5217, test_loss: 1.5225, test_f1: 0.5305
 epoch: 94, train_loss: 0.5293, test_loss: 1.4233, test_f1: 0.5279
 epoch: 95, train_loss: 0.5329, test_loss: 1.4167, test_f1: 0.5229
 epoch: 96, train_loss: 0.5272, test_loss: 1.4272, test_f1: 0.5269
 epoch: 97, train_loss: 0.5151, test_loss: 1.4836, test_f1: 0.5327
 epoch: 98, train_loss: 0.5161, test_loss: 1.5175, test_f1: 0.5257
 epoch: 99, train_loss: 0.5260, test_loss: 1.5380, test_f1: 0.5466
##################ITERATION #4 ****************************************
 epoch: 0, train_loss: 1.4356, test_loss: 1.2924, test_f1: 0.2563
 epoch: 1, train_loss: 1.1933, test_loss: 1.1258, test_f1: 0.3728
 epoch: 2, train_loss: 1.1378, test_loss: 1.0647, test_f1: 0.4385
 epoch: 3, train_loss: 1.0872, test_loss: 1.0538, test_f1: 0.4218
 epoch: 4, train_loss: 1.0493, test_loss: 1.0008, test_f1: 0.4858
 epoch: 5, train_loss: 1.0200, test_loss: 1.0519, test_f1: 0.4654
 epoch: 6, train_loss: 0.9873, test_loss: 1.0111, test_f1: 0.4656
 epoch: 7, train_loss: 0.9693, test_loss: 1.0252, test_f1: 0.5144
 epoch: 8, train_loss: 0.9587, test_loss: 1.0125, test_f1: 0.4619
 epoch: 9, train_loss: 0.9434, test_loss: 1.0395, test_f1: 0.4744
 epoch: 10, train_loss: 0.9227, test_loss: 1.0935, test_f1: 0.5008
 epoch: 11, train_loss: 0.9185, test_loss: 1.0963, test_f1: 0.4633
 epoch: 12, train_loss: 0.9004, test_loss: 1.0443, test_f1: 0.5037
 epoch: 13, train_loss: 0.8941, test_loss: 0.9848, test_f1: 0.5380
 epoch: 14, train_loss: 0.8876, test_loss: 1.0581, test_f1: 0.4815
 epoch: 15, train_loss: 0.8850, test_loss: 1.0188, test_f1: 0.5202
 epoch: 16, train_loss: 0.8761, test_loss: 1.0407, test_f1: 0.4747
 epoch: 17, train_loss: 0.8585, test_loss: 1.0288, test_f1: 0.4996
 epoch: 18, train_loss: 0.8395, test_loss: 1.0506, test_f1: 0.5004
 epoch: 19, train_loss: 0.8478, test_loss: 1.0493, test_f1: 0.5250
 epoch: 20, train_loss: 0.8429, test_loss: 1.0177, test_f1: 0.5691
 epoch: 21, train_loss: 0.8302, test_loss: 1.1186, test_f1: 0.5280
 epoch: 22, train_loss: 0.8259, test_loss: 1.0622, test_f1: 0.5358
 epoch: 23, train_loss: 0.8020, test_loss: 1.0089, test_f1: 0.5152
 epoch: 24, train_loss: 0.8018, test_loss: 1.0535, test_f1: 0.5140
 epoch: 25, train_loss: 0.8121, test_loss: 1.0147, test_f1: 0.5372
 epoch: 26, train_loss: 0.7895, test_loss: 1.0283, test_f1: 0.5390
 epoch: 27, train_loss: 0.7843, test_loss: 1.0649, test_f1: 0.5305
 epoch: 28, train_loss: 0.8040, test_loss: 1.0631, test_f1: 0.5276
 epoch: 29, train_loss: 0.8181, test_loss: 1.1899, test_f1: 0.4651
 epoch: 30, train_loss: 0.7940, test_loss: 1.0932, test_f1: 0.5248
 epoch: 31, train_loss: 0.7887, test_loss: 1.0316, test_f1: 0.5351
 epoch: 32, train_loss: 0.7772, test_loss: 1.0411, test_f1: 0.5355
 epoch: 33, train_loss: 0.7576, test_loss: 1.0645, test_f1: 0.5354
 epoch: 34, train_loss: 0.7575, test_loss: 1.0962, test_f1: 0.5363
 epoch: 35, train_loss: 0.7493, test_loss: 1.1022, test_f1: 0.5273
 epoch: 36, train_loss: 0.7620, test_loss: 1.0973, test_f1: 0.5466
 epoch: 37, train_loss: 0.7438, test_loss: 1.1198, test_f1: 0.5012
 epoch: 38, train_loss: 0.7586, test_loss: 1.0920, test_f1: 0.5301
 epoch: 39, train_loss: 0.7672, test_loss: 1.1960, test_f1: 0.5005
 epoch: 40, train_loss: 0.7456, test_loss: 1.1732, test_f1: 0.5316
 epoch: 41, train_loss: 0.7425, test_loss: 1.0402, test_f1: 0.5528
 epoch: 42, train_loss: 0.7159, test_loss: 1.0855, test_f1: 0.5564
 epoch: 43, train_loss: 0.7186, test_loss: 1.0724, test_f1: 0.5389
 epoch: 44, train_loss: 0.7211, test_loss: 1.1616, test_f1: 0.5404
 epoch: 45, train_loss: 0.7177, test_loss: 1.1323, test_f1: 0.5317
 epoch: 46, train_loss: 0.7133, test_loss: 1.1027, test_f1: 0.5258
 epoch: 47, train_loss: 0.7163, test_loss: 1.1385, test_f1: 0.5440
 epoch: 48, train_loss: 0.7059, test_loss: 1.0926, test_f1: 0.5508
 epoch: 49, train_loss: 0.6939, test_loss: 1.1018, test_f1: 0.5200
 epoch: 50, train_loss: 0.6695, test_loss: 1.1081, test_f1: 0.5515
 epoch: 51, train_loss: 0.6562, test_loss: 1.1354, test_f1: 0.5458
 epoch: 52, train_loss: 0.6435, test_loss: 1.1341, test_f1: 0.5763
 epoch: 53, train_loss: 0.6286, test_loss: 1.2049, test_f1: 0.5403
 epoch: 54, train_loss: 0.6270, test_loss: 1.1417, test_f1: 0.5482
 epoch: 55, train_loss: 0.6101, test_loss: 1.2245, test_f1: 0.5621
 epoch: 56, train_loss: 0.5974, test_loss: 1.1604, test_f1: 0.5665
 epoch: 57, train_loss: 0.6025, test_loss: 1.2141, test_f1: 0.5454
 epoch: 58, train_loss: 0.6019, test_loss: 1.2421, test_f1: 0.5288
 epoch: 59, train_loss: 0.5955, test_loss: 1.1700, test_f1: 0.5741
 epoch: 60, train_loss: 0.6150, test_loss: 1.2107, test_f1: 0.5629
 epoch: 61, train_loss: 0.6004, test_loss: 1.2592, test_f1: 0.5490
 epoch: 62, train_loss: 0.5847, test_loss: 1.1717, test_f1: 0.5687
 epoch: 63, train_loss: 0.5740, test_loss: 1.2162, test_f1: 0.5529
 epoch: 64, train_loss: 0.5841, test_loss: 1.1808, test_f1: 0.5505
 epoch: 65, train_loss: 0.5806, test_loss: 1.2052, test_f1: 0.5446
 epoch: 66, train_loss: 0.5769, test_loss: 1.1829, test_f1: 0.5495
 epoch: 67, train_loss: 0.6123, test_loss: 1.2143, test_f1: 0.5689
 epoch: 68, train_loss: 0.5877, test_loss: 1.1648, test_f1: 0.5681
 epoch: 69, train_loss: 0.5826, test_loss: 1.4587, test_f1: 0.5493
 epoch: 70, train_loss: 0.5931, test_loss: 1.2427, test_f1: 0.5580
 epoch: 71, train_loss: 0.5826, test_loss: 1.2698, test_f1: 0.5275
 epoch: 72, train_loss: 0.5705, test_loss: 1.3417, test_f1: 0.5271
 epoch: 73, train_loss: 0.5740, test_loss: 1.2935, test_f1: 0.5310
 epoch: 74, train_loss: 0.5722, test_loss: 1.1801, test_f1: 0.5547
 epoch: 75, train_loss: 0.5751, test_loss: 1.4215, test_f1: 0.5208
 epoch: 76, train_loss: 0.5721, test_loss: 1.2149, test_f1: 0.5537
 epoch: 77, train_loss: 0.5639, test_loss: 1.2222, test_f1: 0.5899
 epoch: 78, train_loss: 0.5545, test_loss: 1.3470, test_f1: 0.5283
 epoch: 79, train_loss: 0.5574, test_loss: 1.2444, test_f1: 0.5625
 epoch: 80, train_loss: 0.5475, test_loss: 1.5697, test_f1: 0.4980
 epoch: 81, train_loss: 0.5626, test_loss: 1.2753, test_f1: 0.5603
 epoch: 82, train_loss: 0.5595, test_loss: 1.3725, test_f1: 0.5496
 epoch: 83, train_loss: 0.5544, test_loss: 1.2568, test_f1: 0.5594
 epoch: 84, train_loss: 0.5485, test_loss: 1.3353, test_f1: 0.5407
 epoch: 85, train_loss: 0.5544, test_loss: 1.4891, test_f1: 0.5237
 epoch: 86, train_loss: 0.5404, test_loss: 1.3719, test_f1: 0.5239
 epoch: 87, train_loss: 0.5338, test_loss: 1.3036, test_f1: 0.5421
 epoch: 88, train_loss: 0.5276, test_loss: 1.4444, test_f1: 0.5411
 epoch: 89, train_loss: 0.5143, test_loss: 1.2801, test_f1: 0.5648
 epoch: 90, train_loss: 0.5196, test_loss: 1.4413, test_f1: 0.5312
 epoch: 91, train_loss: 0.5402, test_loss: 1.3139, test_f1: 0.5694
 epoch: 92, train_loss: 0.5648, test_loss: 1.2482, test_f1: 0.5744
 epoch: 93, train_loss: 0.5497, test_loss: 1.2255, test_f1: 0.5852
 epoch: 94, train_loss: 0.5341, test_loss: 1.3496, test_f1: 0.5307
 epoch: 95, train_loss: 0.5524, test_loss: 1.2477, test_f1: 0.5619
 epoch: 96, train_loss: 0.5413, test_loss: 1.2561, test_f1: 0.5718
 epoch: 97, train_loss: 0.5069, test_loss: 1.3644, test_f1: 0.5640
 epoch: 98, train_loss: 0.5119, test_loss: 1.3932, test_f1: 0.5458
 epoch: 99, train_loss: 0.5116, test_loss: 1.3644, test_f1: 0.5266
##################ITERATION #5 ****************************************
 epoch: 0, train_loss: 1.4609, test_loss: 1.2690, test_f1: 0.2451
 epoch: 1, train_loss: 1.2602, test_loss: 1.2284, test_f1: 0.2613
 epoch: 2, train_loss: 1.2203, test_loss: 1.1864, test_f1: 0.3384
 epoch: 3, train_loss: 1.1900, test_loss: 1.1419, test_f1: 0.3792
 epoch: 4, train_loss: 1.1563, test_loss: 1.1082, test_f1: 0.4040
 epoch: 5, train_loss: 1.1257, test_loss: 1.2091, test_f1: 0.3671
 epoch: 6, train_loss: 1.0979, test_loss: 1.0201, test_f1: 0.4758
 epoch: 7, train_loss: 1.0750, test_loss: 1.0222, test_f1: 0.4600
 epoch: 8, train_loss: 1.0471, test_loss: 1.2073, test_f1: 0.4203
 epoch: 9, train_loss: 1.0117, test_loss: 1.0312, test_f1: 0.4490
 epoch: 10, train_loss: 0.9932, test_loss: 0.9696, test_f1: 0.4786
 epoch: 11, train_loss: 0.9721, test_loss: 0.9459, test_f1: 0.4803
 epoch: 12, train_loss: 0.9444, test_loss: 1.0671, test_f1: 0.4412
 epoch: 13, train_loss: 0.9445, test_loss: 1.0245, test_f1: 0.4630
 epoch: 14, train_loss: 0.9410, test_loss: 0.9811, test_f1: 0.4762
 epoch: 15, train_loss: 0.9167, test_loss: 0.9941, test_f1: 0.4816
 epoch: 16, train_loss: 0.9104, test_loss: 1.0932, test_f1: 0.4797
 epoch: 17, train_loss: 0.9046, test_loss: 1.0175, test_f1: 0.5156
 epoch: 18, train_loss: 0.8785, test_loss: 1.0334, test_f1: 0.4962
 epoch: 19, train_loss: 0.8758, test_loss: 1.0114, test_f1: 0.5211
 epoch: 20, train_loss: 0.8858, test_loss: 1.0838, test_f1: 0.5055
 epoch: 21, train_loss: 0.8590, test_loss: 1.0460, test_f1: 0.4716
 epoch: 22, train_loss: 0.8737, test_loss: 1.0349, test_f1: 0.5140
 epoch: 23, train_loss: 0.8556, test_loss: 0.9123, test_f1: 0.5045
 epoch: 24, train_loss: 0.8554, test_loss: 1.0898, test_f1: 0.4748
 epoch: 25, train_loss: 0.8456, test_loss: 1.0723, test_f1: 0.4876
 epoch: 26, train_loss: 0.8526, test_loss: 1.0666, test_f1: 0.4906
 epoch: 27, train_loss: 0.8391, test_loss: 1.0656, test_f1: 0.4997
 epoch: 28, train_loss: 0.8280, test_loss: 1.0598, test_f1: 0.4953
 epoch: 29, train_loss: 0.8226, test_loss: 1.1157, test_f1: 0.4927
 epoch: 30, train_loss: 0.8231, test_loss: 1.1266, test_f1: 0.5181
 epoch: 31, train_loss: 0.8125, test_loss: 1.0715, test_f1: 0.5151
 epoch: 32, train_loss: 0.8016, test_loss: 1.0578, test_f1: 0.5022
 epoch: 33, train_loss: 0.8162, test_loss: 1.0042, test_f1: 0.5136
 epoch: 34, train_loss: 0.8019, test_loss: 1.1578, test_f1: 0.4936
 epoch: 35, train_loss: 0.8312, test_loss: 1.1020, test_f1: 0.4978
 epoch: 36, train_loss: 0.8312, test_loss: 1.0149, test_f1: 0.5036
 epoch: 37, train_loss: 0.7970, test_loss: 1.0801, test_f1: 0.5451
 epoch: 38, train_loss: 0.8015, test_loss: 1.0917, test_f1: 0.5212
 epoch: 39, train_loss: 0.7891, test_loss: 1.0617, test_f1: 0.5221
 epoch: 40, train_loss: 0.7783, test_loss: 1.0574, test_f1: 0.5287
 epoch: 41, train_loss: 0.7517, test_loss: 1.0614, test_f1: 0.5410
 epoch: 42, train_loss: 0.7744, test_loss: 1.0982, test_f1: 0.5370
 epoch: 43, train_loss: 0.7883, test_loss: 1.0333, test_f1: 0.5356
 epoch: 44, train_loss: 0.7826, test_loss: 0.9454, test_f1: 0.5511
 epoch: 45, train_loss: 0.7565, test_loss: 1.0503, test_f1: 0.5012
 epoch: 46, train_loss: 0.7452, test_loss: 1.1057, test_f1: 0.5498
 epoch: 47, train_loss: 0.7359, test_loss: 1.1093, test_f1: 0.5219
 epoch: 48, train_loss: 0.7362, test_loss: 1.1130, test_f1: 0.5450
 epoch: 49, train_loss: 0.7341, test_loss: 1.0147, test_f1: 0.5489
 epoch: 50, train_loss: 0.7330, test_loss: 1.1396, test_f1: 0.5366
 epoch: 51, train_loss: 0.7018, test_loss: 1.0974, test_f1: 0.5427
 epoch: 52, train_loss: 0.6953, test_loss: 1.0711, test_f1: 0.5698
 epoch: 53, train_loss: 0.6919, test_loss: 1.1249, test_f1: 0.5303
 epoch: 54, train_loss: 0.6717, test_loss: 1.0601, test_f1: 0.5622
 epoch: 55, train_loss: 0.6767, test_loss: 1.1189, test_f1: 0.5481
 epoch: 56, train_loss: 0.6613, test_loss: 1.1790, test_f1: 0.5443
 epoch: 57, train_loss: 0.6648, test_loss: 1.1031, test_f1: 0.5361
 epoch: 58, train_loss: 0.6401, test_loss: 1.0778, test_f1: 0.5513
 epoch: 59, train_loss: 0.6494, test_loss: 1.1456, test_f1: 0.5502
 epoch: 60, train_loss: 0.6428, test_loss: 1.1684, test_f1: 0.5439
 epoch: 61, train_loss: 0.6340, test_loss: 1.1935, test_f1: 0.5328
 epoch: 62, train_loss: 0.6229, test_loss: 1.1948, test_f1: 0.5341
 epoch: 63, train_loss: 0.6487, test_loss: 1.1445, test_f1: 0.5451
 epoch: 64, train_loss: 0.6344, test_loss: 1.2367, test_f1: 0.5218
 epoch: 65, train_loss: 0.6369, test_loss: 1.1402, test_f1: 0.5727
 epoch: 66, train_loss: 0.6486, test_loss: 1.2900, test_f1: 0.5224
 epoch: 67, train_loss: 0.6220, test_loss: 1.1783, test_f1: 0.5661
 epoch: 68, train_loss: 0.6250, test_loss: 1.1999, test_f1: 0.5440
 epoch: 69, train_loss: 0.6319, test_loss: 1.1645, test_f1: 0.5751
 epoch: 70, train_loss: 0.6259, test_loss: 1.1394, test_f1: 0.5707
 epoch: 71, train_loss: 0.6158, test_loss: 1.2459, test_f1: 0.5505
 epoch: 72, train_loss: 0.6161, test_loss: 1.2194, test_f1: 0.5405
 epoch: 73, train_loss: 0.6508, test_loss: 1.2047, test_f1: 0.5576
 epoch: 74, train_loss: 0.6159, test_loss: 1.0951, test_f1: 0.5649
 epoch: 75, train_loss: 0.5977, test_loss: 1.1738, test_f1: 0.5567
 epoch: 76, train_loss: 0.5886, test_loss: 1.2314, test_f1: 0.5503
 epoch: 77, train_loss: 0.5796, test_loss: 1.2391, test_f1: 0.5367
 epoch: 78, train_loss: 0.6028, test_loss: 1.2667, test_f1: 0.5374
 epoch: 79, train_loss: 0.5842, test_loss: 1.1706, test_f1: 0.5649
 epoch: 80, train_loss: 0.5958, test_loss: 1.3988, test_f1: 0.5306
 epoch: 81, train_loss: 0.5780, test_loss: 1.2803, test_f1: 0.5604
 epoch: 82, train_loss: 0.5934, test_loss: 1.3458, test_f1: 0.5269
 epoch: 83, train_loss: 0.5771, test_loss: 1.2014, test_f1: 0.5685
 epoch: 84, train_loss: 0.6005, test_loss: 1.0936, test_f1: 0.5579
 epoch: 85, train_loss: 0.5922, test_loss: 1.1902, test_f1: 0.5442
 epoch: 86, train_loss: 0.5678, test_loss: 1.2052, test_f1: 0.5582
 epoch: 87, train_loss: 0.5848, test_loss: 1.2789, test_f1: 0.5378
 epoch: 88, train_loss: 0.5708, test_loss: 1.3302, test_f1: 0.5308
 epoch: 89, train_loss: 0.5650, test_loss: 1.3274, test_f1: 0.5520
 epoch: 90, train_loss: 0.5870, test_loss: 1.2791, test_f1: 0.5655
 epoch: 91, train_loss: 0.5618, test_loss: 1.2362, test_f1: 0.5527
 epoch: 92, train_loss: 0.5836, test_loss: 1.3247, test_f1: 0.5194
 epoch: 93, train_loss: 0.5803, test_loss: 1.2726, test_f1: 0.5302
 epoch: 94, train_loss: 0.5615, test_loss: 1.3515, test_f1: 0.5342
 epoch: 95, train_loss: 0.5621, test_loss: 1.3163, test_f1: 0.5677
 epoch: 96, train_loss: 0.5658, test_loss: 1.2742, test_f1: 0.5650
 epoch: 97, train_loss: 0.5488, test_loss: 1.3206, test_f1: 0.5345
 epoch: 98, train_loss: 0.5697, test_loss: 1.5365, test_f1: 0.5110
 epoch: 99, train_loss: 0.5571, test_loss: 1.2956, test_f1: 0.5492
##################ITERATION #6 ****************************************
 epoch: 0, train_loss: 1.3994, test_loss: 1.2723, test_f1: 0.2788
 epoch: 1, train_loss: 1.2105, test_loss: 1.1873, test_f1: 0.3185
 epoch: 2, train_loss: 1.1650, test_loss: 1.1464, test_f1: 0.3864
 epoch: 3, train_loss: 1.1355, test_loss: 1.0786, test_f1: 0.4293
 epoch: 4, train_loss: 1.1078, test_loss: 1.0486, test_f1: 0.4335
 epoch: 5, train_loss: 1.0781, test_loss: 1.1086, test_f1: 0.4307
 epoch: 6, train_loss: 1.0531, test_loss: 1.0844, test_f1: 0.4368
 epoch: 7, train_loss: 1.0414, test_loss: 0.9608, test_f1: 0.4970
 epoch: 8, train_loss: 1.0142, test_loss: 1.1159, test_f1: 0.4482
 epoch: 9, train_loss: 0.9799, test_loss: 0.9995, test_f1: 0.4978
 epoch: 10, train_loss: 0.9768, test_loss: 1.0123, test_f1: 0.4647
 epoch: 11, train_loss: 0.9636, test_loss: 1.0624, test_f1: 0.4843
 epoch: 12, train_loss: 0.9642, test_loss: 0.9687, test_f1: 0.5060
 epoch: 13, train_loss: 0.9428, test_loss: 0.9455, test_f1: 0.5154
 epoch: 14, train_loss: 0.9195, test_loss: 0.9974, test_f1: 0.4887
 epoch: 15, train_loss: 0.9264, test_loss: 1.0881, test_f1: 0.4856
 epoch: 16, train_loss: 0.9544, test_loss: 1.0041, test_f1: 0.4858
 epoch: 17, train_loss: 0.9113, test_loss: 0.9448, test_f1: 0.5143
 epoch: 18, train_loss: 0.8916, test_loss: 0.9651, test_f1: 0.5122
 epoch: 19, train_loss: 0.8905, test_loss: 0.9967, test_f1: 0.5142
 epoch: 20, train_loss: 0.8677, test_loss: 0.9946, test_f1: 0.5131
 epoch: 21, train_loss: 0.8774, test_loss: 0.9471, test_f1: 0.5153
 epoch: 22, train_loss: 0.8704, test_loss: 1.0317, test_f1: 0.4880
 epoch: 23, train_loss: 0.8690, test_loss: 1.1083, test_f1: 0.4890
 epoch: 24, train_loss: 0.8614, test_loss: 1.1491, test_f1: 0.5054
 epoch: 25, train_loss: 0.8526, test_loss: 1.1962, test_f1: 0.4413
 epoch: 26, train_loss: 0.8313, test_loss: 1.0320, test_f1: 0.5121
 epoch: 27, train_loss: 0.8171, test_loss: 0.9562, test_f1: 0.5106
 epoch: 28, train_loss: 0.8176, test_loss: 1.2733, test_f1: 0.4568
 epoch: 29, train_loss: 0.8143, test_loss: 1.0625, test_f1: 0.5135
 epoch: 30, train_loss: 0.8359, test_loss: 1.0215, test_f1: 0.5244
 epoch: 31, train_loss: 0.8245, test_loss: 0.9842, test_f1: 0.5352
 epoch: 32, train_loss: 0.8122, test_loss: 1.0770, test_f1: 0.4980
 epoch: 33, train_loss: 0.8143, test_loss: 1.0218, test_f1: 0.5284
 epoch: 34, train_loss: 0.8161, test_loss: 1.0118, test_f1: 0.5012
 epoch: 35, train_loss: 0.8184, test_loss: 1.0209, test_f1: 0.5196
 epoch: 36, train_loss: 0.8160, test_loss: 1.0795, test_f1: 0.5418
 epoch: 37, train_loss: 0.7870, test_loss: 1.0415, test_f1: 0.5240
 epoch: 38, train_loss: 0.7999, test_loss: 1.1178, test_f1: 0.4996
 epoch: 39, train_loss: 0.7939, test_loss: 1.1345, test_f1: 0.4688
 epoch: 40, train_loss: 0.7652, test_loss: 1.0740, test_f1: 0.5272
 epoch: 41, train_loss: 0.7573, test_loss: 1.0719, test_f1: 0.5209
 epoch: 42, train_loss: 0.7815, test_loss: 0.9989, test_f1: 0.5166
 epoch: 43, train_loss: 0.7750, test_loss: 1.0394, test_f1: 0.5221
 epoch: 44, train_loss: 0.7563, test_loss: 1.0903, test_f1: 0.5381
 epoch: 45, train_loss: 0.7624, test_loss: 1.1542, test_f1: 0.5267
 epoch: 46, train_loss: 0.7709, test_loss: 1.1061, test_f1: 0.5128
 epoch: 47, train_loss: 0.7721, test_loss: 1.2636, test_f1: 0.5011
 epoch: 48, train_loss: 0.7539, test_loss: 1.2234, test_f1: 0.5078
 epoch: 49, train_loss: 0.7287, test_loss: 1.1302, test_f1: 0.5469
 epoch: 50, train_loss: 0.7271, test_loss: 1.0767, test_f1: 0.5271
 epoch: 51, train_loss: 0.7151, test_loss: 1.1094, test_f1: 0.5156
 epoch: 52, train_loss: 0.6974, test_loss: 1.1306, test_f1: 0.5272
 epoch: 53, train_loss: 0.6878, test_loss: 1.1811, test_f1: 0.4913
 epoch: 54, train_loss: 0.6829, test_loss: 1.0920, test_f1: 0.5095
 epoch: 55, train_loss: 0.6787, test_loss: 1.1667, test_f1: 0.5311
 epoch: 56, train_loss: 0.6649, test_loss: 1.0986, test_f1: 0.5401
 epoch: 57, train_loss: 0.6502, test_loss: 1.1403, test_f1: 0.5347
 epoch: 58, train_loss: 0.6706, test_loss: 1.2228, test_f1: 0.5350
 epoch: 59, train_loss: 0.6630, test_loss: 1.1703, test_f1: 0.5361
 epoch: 60, train_loss: 0.6514, test_loss: 1.1385, test_f1: 0.5257
 epoch: 61, train_loss: 0.6526, test_loss: 1.3371, test_f1: 0.5089
 epoch: 62, train_loss: 0.6536, test_loss: 1.3656, test_f1: 0.5410
 epoch: 63, train_loss: 0.6450, test_loss: 1.2913, test_f1: 0.5045
 epoch: 64, train_loss: 0.6387, test_loss: 1.1589, test_f1: 0.5491
 epoch: 65, train_loss: 0.6334, test_loss: 1.3210, test_f1: 0.5348
 epoch: 66, train_loss: 0.6501, test_loss: 1.2681, test_f1: 0.5072
 epoch: 67, train_loss: 0.6416, test_loss: 1.3766, test_f1: 0.4929
 epoch: 68, train_loss: 0.6462, test_loss: 1.2228, test_f1: 0.5379
 epoch: 69, train_loss: 0.6218, test_loss: 1.2738, test_f1: 0.5321
 epoch: 70, train_loss: 0.6269, test_loss: 1.2164, test_f1: 0.5203
 epoch: 71, train_loss: 0.6530, test_loss: 1.1654, test_f1: 0.5274
 epoch: 72, train_loss: 0.6356, test_loss: 1.2813, test_f1: 0.5268
 epoch: 73, train_loss: 0.6323, test_loss: 1.1911, test_f1: 0.5450
 epoch: 74, train_loss: 0.6282, test_loss: 1.3791, test_f1: 0.5321
 epoch: 75, train_loss: 0.6189, test_loss: 1.3010, test_f1: 0.5384
 epoch: 76, train_loss: 0.6282, test_loss: 1.3650, test_f1: 0.5221
 epoch: 77, train_loss: 0.6364, test_loss: 1.3990, test_f1: 0.4992
 epoch: 78, train_loss: 0.6317, test_loss: 1.2325, test_f1: 0.5320
 epoch: 79, train_loss: 0.6174, test_loss: 1.2015, test_f1: 0.5470
 epoch: 80, train_loss: 0.6079, test_loss: 1.3300, test_f1: 0.5162
 epoch: 81, train_loss: 0.6045, test_loss: 1.3939, test_f1: 0.5466
 epoch: 82, train_loss: 0.6177, test_loss: 1.2662, test_f1: 0.5355
 epoch: 83, train_loss: 0.6019, test_loss: 1.4013, test_f1: 0.5229
 epoch: 84, train_loss: 0.6100, test_loss: 1.3690, test_f1: 0.5296
 epoch: 85, train_loss: 0.5994, test_loss: 1.2165, test_f1: 0.5200
 epoch: 86, train_loss: 0.5865, test_loss: 1.2724, test_f1: 0.5150
 epoch: 87, train_loss: 0.5901, test_loss: 1.3797, test_f1: 0.5105
 epoch: 88, train_loss: 0.5943, test_loss: 1.2974, test_f1: 0.5503
 epoch: 89, train_loss: 0.6000, test_loss: 1.2438, test_f1: 0.5431
 epoch: 90, train_loss: 0.6022, test_loss: 1.4422, test_f1: 0.5130
 epoch: 91, train_loss: 0.5850, test_loss: 1.3286, test_f1: 0.5384
 epoch: 92, train_loss: 0.5860, test_loss: 1.5102, test_f1: 0.5088
 epoch: 93, train_loss: 0.5721, test_loss: 1.4103, test_f1: 0.4817
 epoch: 94, train_loss: 0.5839, test_loss: 1.6040, test_f1: 0.5189
 epoch: 95, train_loss: 0.5749, test_loss: 1.4891, test_f1: 0.5057
 epoch: 96, train_loss: 0.5963, test_loss: 1.3486, test_f1: 0.5310
 epoch: 97, train_loss: 0.5907, test_loss: 1.2506, test_f1: 0.5478
 epoch: 98, train_loss: 0.5969, test_loss: 1.4608, test_f1: 0.5117
 epoch: 99, train_loss: 0.5684, test_loss: 1.5990, test_f1: 0.4833
##################ITERATION #7 ****************************************
 epoch: 0, train_loss: 1.3609, test_loss: 1.3438, test_f1: 0.2612
 epoch: 1, train_loss: 1.1758, test_loss: 1.1502, test_f1: 0.3801
 epoch: 2, train_loss: 1.1045, test_loss: 1.0665, test_f1: 0.4751
 epoch: 3, train_loss: 1.0597, test_loss: 0.9959, test_f1: 0.4929
 epoch: 4, train_loss: 1.0264, test_loss: 0.9685, test_f1: 0.4638
 epoch: 5, train_loss: 1.0037, test_loss: 1.1240, test_f1: 0.4258
 epoch: 6, train_loss: 0.9799, test_loss: 0.9509, test_f1: 0.5178
 epoch: 7, train_loss: 0.9642, test_loss: 0.9792, test_f1: 0.5067
 epoch: 8, train_loss: 0.9677, test_loss: 0.9849, test_f1: 0.4972
 epoch: 9, train_loss: 0.9385, test_loss: 0.9510, test_f1: 0.5044
 epoch: 10, train_loss: 0.9322, test_loss: 0.9826, test_f1: 0.5014
 epoch: 11, train_loss: 0.9261, test_loss: 1.0126, test_f1: 0.4926
 epoch: 12, train_loss: 0.9034, test_loss: 1.1891, test_f1: 0.4637
 epoch: 13, train_loss: 0.8891, test_loss: 0.9835, test_f1: 0.5024
 epoch: 14, train_loss: 0.8831, test_loss: 1.0037, test_f1: 0.5223
 epoch: 15, train_loss: 0.8904, test_loss: 1.0465, test_f1: 0.5030
 epoch: 16, train_loss: 0.8700, test_loss: 1.0232, test_f1: 0.4960
 epoch: 17, train_loss: 0.8487, test_loss: 0.9747, test_f1: 0.5386
 epoch: 18, train_loss: 0.8456, test_loss: 1.0832, test_f1: 0.4832
 epoch: 19, train_loss: 0.8373, test_loss: 1.0468, test_f1: 0.5033
 epoch: 20, train_loss: 0.8499, test_loss: 1.0199, test_f1: 0.5119
 epoch: 21, train_loss: 0.8341, test_loss: 1.0242, test_f1: 0.5089
 epoch: 22, train_loss: 0.8172, test_loss: 0.9925, test_f1: 0.5282
 epoch: 23, train_loss: 0.8280, test_loss: 0.9453, test_f1: 0.5258
 epoch: 24, train_loss: 0.8011, test_loss: 1.0390, test_f1: 0.5181
 epoch: 25, train_loss: 0.8189, test_loss: 1.0747, test_f1: 0.4943
 epoch: 26, train_loss: 0.8249, test_loss: 0.9975, test_f1: 0.5452
 epoch: 27, train_loss: 0.8144, test_loss: 1.0040, test_f1: 0.5274
 epoch: 28, train_loss: 0.8071, test_loss: 1.0700, test_f1: 0.5204
 epoch: 29, train_loss: 0.7843, test_loss: 1.0222, test_f1: 0.5456
 epoch: 30, train_loss: 0.8001, test_loss: 1.0401, test_f1: 0.5426
 epoch: 31, train_loss: 0.7922, test_loss: 1.0076, test_f1: 0.5459
 epoch: 32, train_loss: 0.7685, test_loss: 1.0862, test_f1: 0.5141
 epoch: 33, train_loss: 0.7727, test_loss: 1.1580, test_f1: 0.5296
 epoch: 34, train_loss: 0.7591, test_loss: 0.9951, test_f1: 0.5421
 epoch: 35, train_loss: 0.7755, test_loss: 1.0636, test_f1: 0.5341
 epoch: 36, train_loss: 0.7597, test_loss: 1.2259, test_f1: 0.5193
 epoch: 37, train_loss: 0.7677, test_loss: 1.0309, test_f1: 0.5456
 epoch: 38, train_loss: 0.7686, test_loss: 1.0913, test_f1: 0.5440
 epoch: 39, train_loss: 0.7524, test_loss: 1.0626, test_f1: 0.5330
 epoch: 40, train_loss: 0.7609, test_loss: 0.9979, test_f1: 0.5514
 epoch: 41, train_loss: 0.7541, test_loss: 1.0432, test_f1: 0.5400
 epoch: 42, train_loss: 0.7413, test_loss: 1.0869, test_f1: 0.5222
 epoch: 43, train_loss: 0.7397, test_loss: 1.1092, test_f1: 0.5559
 epoch: 44, train_loss: 0.7273, test_loss: 1.0613, test_f1: 0.5500
 epoch: 45, train_loss: 0.7385, test_loss: 1.1382, test_f1: 0.5327
 epoch: 46, train_loss: 0.7567, test_loss: 1.1052, test_f1: 0.5176
 epoch: 47, train_loss: 0.7433, test_loss: 1.0944, test_f1: 0.5294
 epoch: 48, train_loss: 0.7350, test_loss: 1.1020, test_f1: 0.5558
 epoch: 49, train_loss: 0.7093, test_loss: 1.1019, test_f1: 0.5419
 epoch: 50, train_loss: 0.7219, test_loss: 1.1376, test_f1: 0.5093
 epoch: 51, train_loss: 0.6893, test_loss: 1.0457, test_f1: 0.5766
 epoch: 52, train_loss: 0.6560, test_loss: 1.1069, test_f1: 0.5563
 epoch: 53, train_loss: 0.6630, test_loss: 1.1134, test_f1: 0.5635
 epoch: 54, train_loss: 0.6493, test_loss: 1.1418, test_f1: 0.5322
 epoch: 55, train_loss: 0.6339, test_loss: 1.1367, test_f1: 0.5622
 epoch: 56, train_loss: 0.6316, test_loss: 1.1469, test_f1: 0.5767
 epoch: 57, train_loss: 0.6151, test_loss: 1.1721, test_f1: 0.5421
 epoch: 58, train_loss: 0.6268, test_loss: 1.1500, test_f1: 0.5516
 epoch: 59, train_loss: 0.6227, test_loss: 1.2362, test_f1: 0.5392
 epoch: 60, train_loss: 0.6209, test_loss: 1.1264, test_f1: 0.5489
 epoch: 61, train_loss: 0.6381, test_loss: 1.1486, test_f1: 0.5678
 epoch: 62, train_loss: 0.6170, test_loss: 1.2052, test_f1: 0.5495
 epoch: 63, train_loss: 0.6151, test_loss: 1.1921, test_f1: 0.5459
 epoch: 64, train_loss: 0.6109, test_loss: 1.1814, test_f1: 0.5456
 epoch: 65, train_loss: 0.6018, test_loss: 1.1529, test_f1: 0.5477
 epoch: 66, train_loss: 0.5954, test_loss: 1.2335, test_f1: 0.5684
 epoch: 67, train_loss: 0.6087, test_loss: 1.1590, test_f1: 0.5623
 epoch: 68, train_loss: 0.6172, test_loss: 1.2033, test_f1: 0.5686
 epoch: 69, train_loss: 0.5977, test_loss: 1.1790, test_f1: 0.5374
 epoch: 70, train_loss: 0.6069, test_loss: 1.1931, test_f1: 0.5587
 epoch: 71, train_loss: 0.6005, test_loss: 1.2684, test_f1: 0.5395
 epoch: 72, train_loss: 0.5804, test_loss: 1.1465, test_f1: 0.5792
 epoch: 73, train_loss: 0.5717, test_loss: 1.1988, test_f1: 0.5610
 epoch: 74, train_loss: 0.5774, test_loss: 1.1897, test_f1: 0.5437
 epoch: 75, train_loss: 0.5817, test_loss: 1.2597, test_f1: 0.5259
 epoch: 76, train_loss: 0.5611, test_loss: 1.1997, test_f1: 0.5639
 epoch: 77, train_loss: 0.5642, test_loss: 1.2973, test_f1: 0.5368
 epoch: 78, train_loss: 0.5762, test_loss: 1.1646, test_f1: 0.5639
 epoch: 79, train_loss: 0.5775, test_loss: 1.1601, test_f1: 0.5338
 epoch: 80, train_loss: 0.5954, test_loss: 1.2230, test_f1: 0.5176
 epoch: 81, train_loss: 0.5985, test_loss: 1.2792, test_f1: 0.5192
 epoch: 82, train_loss: 0.6036, test_loss: 1.1743, test_f1: 0.5661
 epoch: 83, train_loss: 0.5662, test_loss: 1.1936, test_f1: 0.5405
 epoch: 84, train_loss: 0.5566, test_loss: 1.2302, test_f1: 0.5426
 epoch: 85, train_loss: 0.5552, test_loss: 1.2460, test_f1: 0.5357
 epoch: 86, train_loss: 0.5639, test_loss: 1.2223, test_f1: 0.5568
 epoch: 87, train_loss: 0.5556, test_loss: 1.2421, test_f1: 0.5417
 epoch: 88, train_loss: 0.5481, test_loss: 1.2221, test_f1: 0.5449
 epoch: 89, train_loss: 0.5552, test_loss: 1.2709, test_f1: 0.5484
 epoch: 90, train_loss: 0.5247, test_loss: 1.3081, test_f1: 0.5132
 epoch: 91, train_loss: 0.5406, test_loss: 1.2514, test_f1: 0.5297
 epoch: 92, train_loss: 0.5425, test_loss: 1.3538, test_f1: 0.5583
 epoch: 93, train_loss: 0.5396, test_loss: 1.2298, test_f1: 0.5499
 epoch: 94, train_loss: 0.5455, test_loss: 1.2989, test_f1: 0.5530
 epoch: 95, train_loss: 0.5405, test_loss: 1.2534, test_f1: 0.5587
 epoch: 96, train_loss: 0.5260, test_loss: 1.2913, test_f1: 0.5474
 epoch: 97, train_loss: 0.5488, test_loss: 1.2982, test_f1: 0.5521
 epoch: 98, train_loss: 0.5257, test_loss: 1.3513, test_f1: 0.5367
 epoch: 99, train_loss: 0.5606, test_loss: 1.2351, test_f1: 0.5555
##################ITERATION #8 ****************************************
 epoch: 0, train_loss: 1.3755, test_loss: 1.4015, test_f1: 0.2461
 epoch: 1, train_loss: 1.2128, test_loss: 1.2052, test_f1: 0.3196
 epoch: 2, train_loss: 1.1619, test_loss: 1.1269, test_f1: 0.4031
 epoch: 3, train_loss: 1.1120, test_loss: 1.1052, test_f1: 0.4417
 epoch: 4, train_loss: 1.0631, test_loss: 1.1382, test_f1: 0.4228
 epoch: 5, train_loss: 1.0463, test_loss: 1.1348, test_f1: 0.4276
 epoch: 6, train_loss: 1.0209, test_loss: 1.0785, test_f1: 0.4267
 epoch: 7, train_loss: 1.0022, test_loss: 1.0697, test_f1: 0.4554
 epoch: 8, train_loss: 0.9804, test_loss: 1.1189, test_f1: 0.4600
 epoch: 9, train_loss: 0.9654, test_loss: 0.9351, test_f1: 0.5021
 epoch: 10, train_loss: 0.9393, test_loss: 1.0044, test_f1: 0.5060
 epoch: 11, train_loss: 0.9311, test_loss: 1.0282, test_f1: 0.4787
 epoch: 12, train_loss: 0.9154, test_loss: 0.9080, test_f1: 0.5515
 epoch: 13, train_loss: 0.9155, test_loss: 0.9450, test_f1: 0.5217
 epoch: 14, train_loss: 0.8805, test_loss: 1.0385, test_f1: 0.5072
 epoch: 15, train_loss: 0.8717, test_loss: 0.9794, test_f1: 0.5114
 epoch: 16, train_loss: 0.8653, test_loss: 0.9585, test_f1: 0.5298
 epoch: 17, train_loss: 0.8536, test_loss: 1.1709, test_f1: 0.4693
 epoch: 18, train_loss: 0.8550, test_loss: 0.9490, test_f1: 0.5167
 epoch: 19, train_loss: 0.8284, test_loss: 0.9964, test_f1: 0.5488
 epoch: 20, train_loss: 0.8336, test_loss: 0.9933, test_f1: 0.5444
 epoch: 21, train_loss: 0.8327, test_loss: 1.0815, test_f1: 0.5211
 epoch: 22, train_loss: 0.8291, test_loss: 0.9916, test_f1: 0.5528
 epoch: 23, train_loss: 0.7965, test_loss: 0.9310, test_f1: 0.5429
 epoch: 24, train_loss: 0.8090, test_loss: 1.0556, test_f1: 0.5330
 epoch: 25, train_loss: 0.8106, test_loss: 1.0800, test_f1: 0.5410
 epoch: 26, train_loss: 0.8117, test_loss: 1.0144, test_f1: 0.5063
 epoch: 27, train_loss: 0.7952, test_loss: 1.0157, test_f1: 0.5362
 epoch: 28, train_loss: 0.7926, test_loss: 1.0314, test_f1: 0.5088
 epoch: 29, train_loss: 0.7863, test_loss: 1.1609, test_f1: 0.4951
 epoch: 30, train_loss: 0.7739, test_loss: 1.0072, test_f1: 0.5517
 epoch: 31, train_loss: 0.7732, test_loss: 1.0224, test_f1: 0.5724
 epoch: 32, train_loss: 0.7619, test_loss: 1.0509, test_f1: 0.5623
 epoch: 33, train_loss: 0.7524, test_loss: 1.0690, test_f1: 0.5416
 epoch: 34, train_loss: 0.7523, test_loss: 1.0775, test_f1: 0.5148
 epoch: 35, train_loss: 0.7516, test_loss: 1.0291, test_f1: 0.5722
 epoch: 36, train_loss: 0.7574, test_loss: 1.1252, test_f1: 0.5509
 epoch: 37, train_loss: 0.7267, test_loss: 1.2567, test_f1: 0.5207
 epoch: 38, train_loss: 0.7384, test_loss: 1.0592, test_f1: 0.5463
 epoch: 39, train_loss: 0.7196, test_loss: 1.1462, test_f1: 0.5290
 epoch: 40, train_loss: 0.7274, test_loss: 1.0085, test_f1: 0.5818
 epoch: 41, train_loss: 0.6968, test_loss: 1.1644, test_f1: 0.5222
 epoch: 42, train_loss: 0.7005, test_loss: 1.0716, test_f1: 0.5768
 epoch: 43, train_loss: 0.7146, test_loss: 1.1023, test_f1: 0.5267
 epoch: 44, train_loss: 0.6935, test_loss: 1.1135, test_f1: 0.5623
 epoch: 45, train_loss: 0.6891, test_loss: 1.1171, test_f1: 0.5638
 epoch: 46, train_loss: 0.6990, test_loss: 1.2690, test_f1: 0.5652
 epoch: 47, train_loss: 0.7083, test_loss: 1.4541, test_f1: 0.5250
 epoch: 48, train_loss: 0.7002, test_loss: 1.0935, test_f1: 0.5310
 epoch: 49, train_loss: 0.6755, test_loss: 1.0805, test_f1: 0.5584
 epoch: 50, train_loss: 0.6843, test_loss: 1.2852, test_f1: 0.5273
 epoch: 51, train_loss: 0.6699, test_loss: 1.1546, test_f1: 0.5426
 epoch: 52, train_loss: 0.6481, test_loss: 1.1275, test_f1: 0.5421
 epoch: 53, train_loss: 0.6195, test_loss: 1.1460, test_f1: 0.5533
 epoch: 54, train_loss: 0.5973, test_loss: 1.1811, test_f1: 0.5578
 epoch: 55, train_loss: 0.5995, test_loss: 1.3051, test_f1: 0.5516
 epoch: 56, train_loss: 0.6107, test_loss: 1.2652, test_f1: 0.5644
 epoch: 57, train_loss: 0.5953, test_loss: 1.3066, test_f1: 0.5633
 epoch: 58, train_loss: 0.5899, test_loss: 1.2365, test_f1: 0.5391
 epoch: 59, train_loss: 0.6059, test_loss: 1.2742, test_f1: 0.5424
 epoch: 60, train_loss: 0.5748, test_loss: 1.4972, test_f1: 0.5391
 epoch: 61, train_loss: 0.5871, test_loss: 1.2527, test_f1: 0.5716
 epoch: 62, train_loss: 0.5744, test_loss: 1.2689, test_f1: 0.5592
 epoch: 63, train_loss: 0.5788, test_loss: 1.1490, test_f1: 0.5754
 epoch: 64, train_loss: 0.5565, test_loss: 1.2965, test_f1: 0.5622
 epoch: 65, train_loss: 0.5709, test_loss: 1.6016, test_f1: 0.5223
 epoch: 66, train_loss: 0.5968, test_loss: 1.2570, test_f1: 0.5739
 epoch: 67, train_loss: 0.5556, test_loss: 1.3724, test_f1: 0.5511
 epoch: 68, train_loss: 0.5468, test_loss: 1.3037, test_f1: 0.5857
 epoch: 69, train_loss: 0.5583, test_loss: 1.2794, test_f1: 0.5953
 epoch: 70, train_loss: 0.5762, test_loss: 1.3100, test_f1: 0.5769
 epoch: 71, train_loss: 0.5423, test_loss: 1.3749, test_f1: 0.5815
 epoch: 72, train_loss: 0.5356, test_loss: 1.4516, test_f1: 0.5587
 epoch: 73, train_loss: 0.5377, test_loss: 1.3060, test_f1: 0.5488
 epoch: 74, train_loss: 0.5496, test_loss: 1.4572, test_f1: 0.5935
 epoch: 75, train_loss: 0.5445, test_loss: 1.3837, test_f1: 0.5505
 epoch: 76, train_loss: 0.5155, test_loss: 1.3850, test_f1: 0.5471
 epoch: 77, train_loss: 0.5223, test_loss: 1.3456, test_f1: 0.5677
 epoch: 78, train_loss: 0.5290, test_loss: 1.4518, test_f1: 0.5380
 epoch: 79, train_loss: 0.5262, test_loss: 1.5442, test_f1: 0.5384
 epoch: 80, train_loss: 0.5241, test_loss: 1.5694, test_f1: 0.5332
 epoch: 81, train_loss: 0.5287, test_loss: 1.6626, test_f1: 0.5334
 epoch: 82, train_loss: 0.5335, test_loss: 1.8722, test_f1: 0.5105
 epoch: 83, train_loss: 0.5385, test_loss: 1.5987, test_f1: 0.5580
 epoch: 84, train_loss: 0.5181, test_loss: 1.2205, test_f1: 0.5875
 epoch: 85, train_loss: 0.5226, test_loss: 1.7731, test_f1: 0.5259
 epoch: 86, train_loss: 0.5028, test_loss: 1.4321, test_f1: 0.5484
 epoch: 87, train_loss: 0.5254, test_loss: 1.4714, test_f1: 0.5787
 epoch: 88, train_loss: 0.5185, test_loss: 1.5809, test_f1: 0.5721
 epoch: 89, train_loss: 0.5041, test_loss: 1.7314, test_f1: 0.5514
 epoch: 90, train_loss: 0.5114, test_loss: 1.7898, test_f1: 0.5591
 epoch: 91, train_loss: 0.5157, test_loss: 1.5444, test_f1: 0.5588
 epoch: 92, train_loss: 0.4962, test_loss: 1.9517, test_f1: 0.5479
 epoch: 93, train_loss: 0.4944, test_loss: 1.7341, test_f1: 0.5920
 epoch: 94, train_loss: 0.4837, test_loss: 1.7424, test_f1: 0.5549
 epoch: 95, train_loss: 0.4870, test_loss: 1.6465, test_f1: 0.5507
 epoch: 96, train_loss: 0.4749, test_loss: 1.4882, test_f1: 0.5825
 epoch: 97, train_loss: 0.4703, test_loss: 1.5460, test_f1: 0.5494
 epoch: 98, train_loss: 0.4837, test_loss: 1.2939, test_f1: 0.6028
 epoch: 99, train_loss: 0.4962, test_loss: 1.7625, test_f1: 0.5559
##################ITERATION #9 ****************************************
 epoch: 0, train_loss: 1.4158, test_loss: 1.3027, test_f1: 0.2359
 epoch: 1, train_loss: 1.1961, test_loss: 1.1725, test_f1: 0.3691
 epoch: 2, train_loss: 1.1290, test_loss: 1.0576, test_f1: 0.4431
 epoch: 3, train_loss: 1.1052, test_loss: 1.0481, test_f1: 0.4296
 epoch: 4, train_loss: 1.0684, test_loss: 1.0067, test_f1: 0.5034
 epoch: 5, train_loss: 1.0279, test_loss: 1.0271, test_f1: 0.4461
 epoch: 6, train_loss: 1.0193, test_loss: 0.9923, test_f1: 0.4844
 epoch: 7, train_loss: 1.0001, test_loss: 1.0111, test_f1: 0.5240
 epoch: 8, train_loss: 0.9732, test_loss: 1.0876, test_f1: 0.4712
 epoch: 9, train_loss: 0.9692, test_loss: 1.0270, test_f1: 0.4993
 epoch: 10, train_loss: 0.9814, test_loss: 1.1984, test_f1: 0.4771
 epoch: 11, train_loss: 0.9489, test_loss: 1.1080, test_f1: 0.4577
 epoch: 12, train_loss: 0.9523, test_loss: 0.9588, test_f1: 0.5124
 epoch: 13, train_loss: 0.9261, test_loss: 0.9929, test_f1: 0.5199
 epoch: 14, train_loss: 0.9170, test_loss: 1.0987, test_f1: 0.4978
 epoch: 15, train_loss: 0.9042, test_loss: 0.9780, test_f1: 0.5101
 epoch: 16, train_loss: 0.8998, test_loss: 1.0429, test_f1: 0.5107
 epoch: 17, train_loss: 0.8831, test_loss: 1.2316, test_f1: 0.4424
 epoch: 18, train_loss: 0.8691, test_loss: 1.0117, test_f1: 0.5263
 epoch: 19, train_loss: 0.8658, test_loss: 1.0234, test_f1: 0.5068
 epoch: 20, train_loss: 0.8362, test_loss: 1.0417, test_f1: 0.5193
 epoch: 21, train_loss: 0.8427, test_loss: 1.0236, test_f1: 0.5059
 epoch: 22, train_loss: 0.8414, test_loss: 1.0503, test_f1: 0.5174
 epoch: 23, train_loss: 0.8515, test_loss: 1.0045, test_f1: 0.5043
 epoch: 24, train_loss: 0.8286, test_loss: 1.0465, test_f1: 0.5029
 epoch: 25, train_loss: 0.8397, test_loss: 1.1123, test_f1: 0.4625
 epoch: 26, train_loss: 0.8309, test_loss: 1.0329, test_f1: 0.5167
 epoch: 27, train_loss: 0.8263, test_loss: 1.0306, test_f1: 0.4841
 epoch: 28, train_loss: 0.8131, test_loss: 1.0967, test_f1: 0.5418
 epoch: 29, train_loss: 0.8144, test_loss: 1.0117, test_f1: 0.5458
 epoch: 30, train_loss: 0.7922, test_loss: 1.0646, test_f1: 0.5312
 epoch: 31, train_loss: 0.7862, test_loss: 1.1131, test_f1: 0.4861
 epoch: 32, train_loss: 0.7909, test_loss: 1.1108, test_f1: 0.4862
 epoch: 33, train_loss: 0.7796, test_loss: 1.0048, test_f1: 0.5093
 epoch: 34, train_loss: 0.7880, test_loss: 1.0886, test_f1: 0.5196
 epoch: 35, train_loss: 0.7864, test_loss: 1.0185, test_f1: 0.5371
 epoch: 36, train_loss: 0.7799, test_loss: 1.0415, test_f1: 0.5288
 epoch: 37, train_loss: 0.7661, test_loss: 1.0384, test_f1: 0.5354
 epoch: 38, train_loss: 0.7498, test_loss: 1.0310, test_f1: 0.5532
 epoch: 39, train_loss: 0.7623, test_loss: 1.0105, test_f1: 0.5458
 epoch: 40, train_loss: 0.7636, test_loss: 1.0724, test_f1: 0.5275
 epoch: 41, train_loss: 0.7596, test_loss: 1.1632, test_f1: 0.5096
 epoch: 42, train_loss: 0.7440, test_loss: 0.9908, test_f1: 0.5355
 epoch: 43, train_loss: 0.7429, test_loss: 0.9918, test_f1: 0.5179
 epoch: 44, train_loss: 0.7355, test_loss: 1.0372, test_f1: 0.5689
 epoch: 45, train_loss: 0.7230, test_loss: 1.0804, test_f1: 0.5291
 epoch: 46, train_loss: 0.7451, test_loss: 1.0423, test_f1: 0.5162
 epoch: 47, train_loss: 0.7235, test_loss: 1.0188, test_f1: 0.5712
 epoch: 48, train_loss: 0.7221, test_loss: 1.0375, test_f1: 0.5358
 epoch: 49, train_loss: 0.7511, test_loss: 1.2918, test_f1: 0.4881
 epoch: 50, train_loss: 0.7428, test_loss: 1.0365, test_f1: 0.5302
 epoch: 51, train_loss: 0.6893, test_loss: 1.0309, test_f1: 0.5465
 epoch: 52, train_loss: 0.6735, test_loss: 0.9995, test_f1: 0.5590
 epoch: 53, train_loss: 0.6582, test_loss: 1.0773, test_f1: 0.5529
 epoch: 54, train_loss: 0.6611, test_loss: 1.0708, test_f1: 0.5630
 epoch: 55, train_loss: 0.6575, test_loss: 1.0188, test_f1: 0.5523
 epoch: 56, train_loss: 0.6427, test_loss: 1.0640, test_f1: 0.5546
 epoch: 57, train_loss: 0.6455, test_loss: 1.0141, test_f1: 0.5755
 epoch: 58, train_loss: 0.6530, test_loss: 1.0588, test_f1: 0.5594
 epoch: 59, train_loss: 0.6320, test_loss: 1.1285, test_f1: 0.5847
 epoch: 60, train_loss: 0.6298, test_loss: 1.0760, test_f1: 0.5441
 epoch: 61, train_loss: 0.6214, test_loss: 1.1172, test_f1: 0.5523
 epoch: 62, train_loss: 0.6313, test_loss: 1.1082, test_f1: 0.5206
 epoch: 63, train_loss: 0.6551, test_loss: 1.1901, test_f1: 0.5477
 epoch: 64, train_loss: 0.6440, test_loss: 1.0997, test_f1: 0.5579
 epoch: 65, train_loss: 0.6335, test_loss: 1.1234, test_f1: 0.5234
 epoch: 66, train_loss: 0.6393, test_loss: 1.1365, test_f1: 0.5446
 epoch: 67, train_loss: 0.6258, test_loss: 1.1461, test_f1: 0.5569
 epoch: 68, train_loss: 0.6079, test_loss: 1.1170, test_f1: 0.5820
 epoch: 69, train_loss: 0.6120, test_loss: 1.1234, test_f1: 0.5540
 epoch: 70, train_loss: 0.6273, test_loss: 1.1167, test_f1: 0.5355
 epoch: 71, train_loss: 0.6144, test_loss: 1.0800, test_f1: 0.5634
 epoch: 72, train_loss: 0.6054, test_loss: 1.1315, test_f1: 0.5715
 epoch: 73, train_loss: 0.6146, test_loss: 0.9969, test_f1: 0.6018
 epoch: 74, train_loss: 0.5921, test_loss: 1.0732, test_f1: 0.5919
 epoch: 75, train_loss: 0.6101, test_loss: 1.0616, test_f1: 0.5818
 epoch: 76, train_loss: 0.5962, test_loss: 1.2049, test_f1: 0.5312
 epoch: 77, train_loss: 0.6129, test_loss: 1.2004, test_f1: 0.5402
 epoch: 78, train_loss: 0.6232, test_loss: 1.0857, test_f1: 0.5678
 epoch: 79, train_loss: 0.5793, test_loss: 1.3066, test_f1: 0.5197
 epoch: 80, train_loss: 0.5849, test_loss: 1.1450, test_f1: 0.5504
 epoch: 81, train_loss: 0.5830, test_loss: 1.2144, test_f1: 0.5629
 epoch: 82, train_loss: 0.5935, test_loss: 1.1467, test_f1: 0.5703
 epoch: 83, train_loss: 0.5931, test_loss: 1.2899, test_f1: 0.4994
 epoch: 84, train_loss: 0.5733, test_loss: 1.2913, test_f1: 0.5360
 epoch: 85, train_loss: 0.6069, test_loss: 1.1198, test_f1: 0.5515
 epoch: 86, train_loss: 0.6099, test_loss: 1.1387, test_f1: 0.5667
 epoch: 87, train_loss: 0.5819, test_loss: 1.1760, test_f1: 0.5514
 epoch: 88, train_loss: 0.5724, test_loss: 1.1508, test_f1: 0.5649
 epoch: 89, train_loss: 0.5841, test_loss: 1.0947, test_f1: 0.5880
 epoch: 90, train_loss: 0.5541, test_loss: 1.3183, test_f1: 0.5488
 epoch: 91, train_loss: 0.5614, test_loss: 1.1761, test_f1: 0.5808
 epoch: 92, train_loss: 0.5486, test_loss: 1.1364, test_f1: 0.5833
 epoch: 93, train_loss: 0.5371, test_loss: 1.2657, test_f1: 0.5685
 epoch: 94, train_loss: 0.5505, test_loss: 1.1814, test_f1: 0.5768
 epoch: 95, train_loss: 0.5814, test_loss: 1.1945, test_f1: 0.5394
 epoch: 96, train_loss: 0.6064, test_loss: 1.2922, test_f1: 0.5163
 epoch: 97, train_loss: 0.5634, test_loss: 1.1503, test_f1: 0.5606
 epoch: 98, train_loss: 0.5329, test_loss: 1.1586, test_f1: 0.5751
 epoch: 99, train_loss: 0.5305, test_loss: 1.1567, test_f1: 0.5958

Training completed in 489.17 seconds
Best F1: 0.6028 at epoch 98
Mean F1 across iterations: 0.5811  0.0171
========================FINAL RESULTS================================
FEGIN weighted F1: 0.6028  0.0171
python main.py --data ltspice_examples --representation component_component --model FEGIN --layers 3 --hiddens 32 --batch_size 256 --lr 0.01 --emb_size 250 --epochs 100 --save_appendix component_component_L3_H32_BS256_LR0.01_E250 --no_val
-----



STDERR:
  File "main.py", line 370, in <module>
    main()
  File "main.py", line 254, in main
    dataset = dataset_class(
  File "/home/philip/projects/llm_inference_code_repo/Circuit-Completion-Using-GNNs/component_classification_with_link_prediction_head/evaluation/FEGIN/kernel/circuit_datasets.py", line 15, in __init__
    self.data, self.slices = torch.load(self.processed_paths[0])
  File "/home/philip/.local/lib/python3.8/site-packages/torch/serialization.py", line 1040, in load
    warnings.warn(
  File "/usr/lib/python3.8/warnings.py", line 109, in _showwarnmsg
    sw(msg.message, msg.category, msg.filename, msg.lineno,
  File "main.py", line 47, in warn_with_traceback
    traceback.print_stack(file=log)
/home/philip/projects/llm_inference_code_repo/Circuit-Completion-Using-GNNs/component_classification_with_link_prediction_head/evaluation/FEGIN/kernel/circuit_datasets.py:15: FutureWarning: You are using `torch.load` with `weights_only=False` (the current default value), which uses the default pickle module implicitly. It is possible to construct malicious pickle data which will execute arbitrary code during unpickling (See https://github.com/pytorch/pytorch/blob/main/SECURITY.md#untrusted-models for more details). In a future release, the default value for `weights_only` will be flipped to `True`. This limits the functions that could be executed during unpickling. Arbitrary objects will no longer be allowed to be loaded via this mode unless they are explicitly allowlisted by the user via `torch.serialization.add_safe_globals`. We recommend you start setting `weights_only=True` for any use case where you don't have full control of the loaded file. Please open an issue on GitHub for any issues related to this experimental feature.
  self.data, self.slices = torch.load(self.processed_paths[0])
