STDOUT:
Results will be saved in /home/philip/projects/llm_inference_code_repo/Circuit-Completion-Using-GNNs/component_classification_with_link_prediction_head/evaluation/FEGIN/results/model_FEGIN_dataset_ltspice_examples
Command line input: python main.py --data ltspice_examples --representation component_net --model FEGIN --layers 4 --hiddens 32 --batch_size 32 --lr 0.01 --emb_size 128 --epochs 100 --save_appendix component_net_L4_H32_BS32_LR0.01_E128 --no_val
 is saved.
-----
ltspice_examples - FEGIN
Using 4 layers, 32 hidden units, h = 2
Loading component_net representation dataset
ENTERED
Training FEGIN on component_net representation
Train: 3558, Test: 846
##################ITERATION #0 ****************************************
 epoch: 0, train_loss: 1.1553, test_loss: 1.0952, test_f1: 0.3493
 epoch: 1, train_loss: 1.0510, test_loss: 1.0467, test_f1: 0.4476
 epoch: 2, train_loss: 1.0239, test_loss: 1.0220, test_f1: 0.4390
 epoch: 3, train_loss: 1.0038, test_loss: 1.0046, test_f1: 0.4998
 epoch: 4, train_loss: 0.9896, test_loss: 0.9947, test_f1: 0.4833
 epoch: 5, train_loss: 0.9833, test_loss: 1.0173, test_f1: 0.4474
 epoch: 6, train_loss: 0.9800, test_loss: 0.9771, test_f1: 0.4730
 epoch: 7, train_loss: 0.9654, test_loss: 0.9756, test_f1: 0.5124
 epoch: 8, train_loss: 0.9511, test_loss: 0.9624, test_f1: 0.4982
 epoch: 9, train_loss: 0.9722, test_loss: 0.9915, test_f1: 0.5300
 epoch: 10, train_loss: 0.9457, test_loss: 1.0099, test_f1: 0.5156
 epoch: 11, train_loss: 0.9537, test_loss: 0.9321, test_f1: 0.4941
 epoch: 12, train_loss: 0.9498, test_loss: 0.9813, test_f1: 0.4950
 epoch: 13, train_loss: 0.9437, test_loss: 0.9572, test_f1: 0.4959
 epoch: 14, train_loss: 0.9578, test_loss: 0.9485, test_f1: 0.5425
 epoch: 15, train_loss: 0.9362, test_loss: 0.9362, test_f1: 0.4987
 epoch: 16, train_loss: 0.9347, test_loss: 0.9139, test_f1: 0.5295
 epoch: 17, train_loss: 0.9129, test_loss: 0.9591, test_f1: 0.4756
 epoch: 18, train_loss: 0.9202, test_loss: 0.9479, test_f1: 0.4989
 epoch: 19, train_loss: 0.9168, test_loss: 0.8967, test_f1: 0.5100
 epoch: 20, train_loss: 0.9078, test_loss: 0.9550, test_f1: 0.5721
 epoch: 21, train_loss: 0.8966, test_loss: 0.9888, test_f1: 0.5186
 epoch: 22, train_loss: 0.8973, test_loss: 0.9609, test_f1: 0.5071
 epoch: 23, train_loss: 0.9146, test_loss: 0.9373, test_f1: 0.5550
 epoch: 24, train_loss: 0.8949, test_loss: 0.9934, test_f1: 0.5446
 epoch: 25, train_loss: 0.8947, test_loss: 0.9860, test_f1: 0.4951
 epoch: 26, train_loss: 0.8933, test_loss: 0.9292, test_f1: 0.5004
 epoch: 27, train_loss: 0.8883, test_loss: 0.9601, test_f1: 0.5202
 epoch: 28, train_loss: 0.8745, test_loss: 0.9137, test_f1: 0.5702
 epoch: 29, train_loss: 0.8782, test_loss: 0.9868, test_f1: 0.5158
 epoch: 30, train_loss: 0.8651, test_loss: 0.8658, test_f1: 0.5255
 epoch: 31, train_loss: 0.8601, test_loss: 0.8482, test_f1: 0.5361
 epoch: 32, train_loss: 0.8841, test_loss: 0.9593, test_f1: 0.4976
 epoch: 33, train_loss: 0.8732, test_loss: 0.9965, test_f1: 0.5455
 epoch: 34, train_loss: 0.8661, test_loss: 0.9024, test_f1: 0.5324
 epoch: 35, train_loss: 0.8538, test_loss: 0.8961, test_f1: 0.5259
 epoch: 36, train_loss: 0.8543, test_loss: 0.9200, test_f1: 0.5463
 epoch: 37, train_loss: 0.8469, test_loss: 0.9470, test_f1: 0.5158
 epoch: 38, train_loss: 0.8581, test_loss: 0.8791, test_f1: 0.5498
 epoch: 39, train_loss: 0.8436, test_loss: 0.9845, test_f1: 0.5720
 epoch: 40, train_loss: 0.8577, test_loss: 0.8575, test_f1: 0.5636
 epoch: 41, train_loss: 0.8503, test_loss: 0.9162, test_f1: 0.5741
 epoch: 42, train_loss: 0.8291, test_loss: 0.9013, test_f1: 0.5695
 epoch: 43, train_loss: 0.8395, test_loss: 0.8321, test_f1: 0.5687
 epoch: 44, train_loss: 0.8343, test_loss: 0.8471, test_f1: 0.5595
 epoch: 45, train_loss: 0.8431, test_loss: 0.8377, test_f1: 0.5412
 epoch: 46, train_loss: 0.8600, test_loss: 0.9391, test_f1: 0.5552
 epoch: 47, train_loss: 0.8347, test_loss: 0.9149, test_f1: 0.5448
 epoch: 48, train_loss: 0.8388, test_loss: 0.9454, test_f1: 0.5596
 epoch: 49, train_loss: 0.8258, test_loss: 0.9714, test_f1: 0.5999
 epoch: 50, train_loss: 0.8418, test_loss: 0.8961, test_f1: 0.5884
 epoch: 51, train_loss: 0.8094, test_loss: 0.9249, test_f1: 0.6117
 epoch: 52, train_loss: 0.8071, test_loss: 0.8738, test_f1: 0.5943
 epoch: 53, train_loss: 0.8023, test_loss: 0.9072, test_f1: 0.5903
 epoch: 54, train_loss: 0.7897, test_loss: 0.9331, test_f1: 0.5939
 epoch: 55, train_loss: 0.7806, test_loss: 0.9440, test_f1: 0.5930
 epoch: 56, train_loss: 0.7898, test_loss: 0.8975, test_f1: 0.6147
 epoch: 57, train_loss: 0.7863, test_loss: 0.8664, test_f1: 0.5693
 epoch: 58, train_loss: 0.7695, test_loss: 0.9553, test_f1: 0.5914
 epoch: 59, train_loss: 0.7916, test_loss: 0.8840, test_f1: 0.6086
 epoch: 60, train_loss: 0.7733, test_loss: 0.9409, test_f1: 0.5742
 epoch: 61, train_loss: 0.7821, test_loss: 0.8925, test_f1: 0.6207
 epoch: 62, train_loss: 0.8398, test_loss: 0.9881, test_f1: 0.5878
 epoch: 63, train_loss: 0.8140, test_loss: 0.9310, test_f1: 0.5841
 epoch: 64, train_loss: 0.8032, test_loss: 0.8970, test_f1: 0.5583
 epoch: 65, train_loss: 0.7993, test_loss: 0.9340, test_f1: 0.6282
 epoch: 66, train_loss: 0.7973, test_loss: 0.9109, test_f1: 0.5961
 epoch: 67, train_loss: 0.7856, test_loss: 0.8883, test_f1: 0.5653
 epoch: 68, train_loss: 0.7770, test_loss: 0.9180, test_f1: 0.6264
 epoch: 69, train_loss: 0.7902, test_loss: 0.9808, test_f1: 0.6058
 epoch: 70, train_loss: 0.7690, test_loss: 0.9234, test_f1: 0.6082
 epoch: 71, train_loss: 0.7663, test_loss: 0.9125, test_f1: 0.5810
 epoch: 72, train_loss: 0.7644, test_loss: 0.9302, test_f1: 0.6033
 epoch: 73, train_loss: 0.7647, test_loss: 0.9150, test_f1: 0.5719
 epoch: 74, train_loss: 0.7634, test_loss: 0.9247, test_f1: 0.6270
 epoch: 75, train_loss: 0.7627, test_loss: 0.9797, test_f1: 0.6304
 epoch: 76, train_loss: 0.7521, test_loss: 0.9833, test_f1: 0.5690
 epoch: 77, train_loss: 0.7625, test_loss: 0.9465, test_f1: 0.5775
 epoch: 78, train_loss: 0.7455, test_loss: 0.9650, test_f1: 0.6517
 epoch: 79, train_loss: 0.7550, test_loss: 0.9187, test_f1: 0.6261
 epoch: 80, train_loss: 0.7620, test_loss: 0.9852, test_f1: 0.6415
 epoch: 81, train_loss: 0.7546, test_loss: 0.9712, test_f1: 0.6129
 epoch: 82, train_loss: 0.7718, test_loss: 0.9964, test_f1: 0.6262
 epoch: 83, train_loss: 0.7605, test_loss: 0.9345, test_f1: 0.6344
 epoch: 84, train_loss: 0.7449, test_loss: 1.0196, test_f1: 0.5822
 epoch: 85, train_loss: 0.7518, test_loss: 0.9599, test_f1: 0.6419
 epoch: 86, train_loss: 0.7425, test_loss: 0.9777, test_f1: 0.6136
 epoch: 87, train_loss: 0.7398, test_loss: 1.0052, test_f1: 0.6042
 epoch: 88, train_loss: 0.7428, test_loss: 0.9053, test_f1: 0.6172
 epoch: 89, train_loss: 0.7534, test_loss: 0.9547, test_f1: 0.6155
 epoch: 90, train_loss: 0.7403, test_loss: 1.1008, test_f1: 0.6381
 epoch: 91, train_loss: 0.7517, test_loss: 1.0056, test_f1: 0.6355
 epoch: 92, train_loss: 0.7481, test_loss: 1.0425, test_f1: 0.6145
 epoch: 93, train_loss: 0.7377, test_loss: 0.9885, test_f1: 0.6114
 epoch: 94, train_loss: 0.7444, test_loss: 0.9702, test_f1: 0.5993
 epoch: 95, train_loss: 0.7496, test_loss: 0.9865, test_f1: 0.6527
 epoch: 96, train_loss: 0.7484, test_loss: 0.9097, test_f1: 0.6420
 epoch: 97, train_loss: 0.7353, test_loss: 0.9549, test_f1: 0.6131
 epoch: 98, train_loss: 0.7292, test_loss: 0.9815, test_f1: 0.6378
 epoch: 99, train_loss: 0.7136, test_loss: 1.0518, test_f1: 0.6501
##################ITERATION #1 ****************************************
 epoch: 0, train_loss: 1.1638, test_loss: 1.0177, test_f1: 0.4823
 epoch: 1, train_loss: 1.0329, test_loss: 1.0365, test_f1: 0.4256
 epoch: 2, train_loss: 1.0040, test_loss: 1.0504, test_f1: 0.5024
 epoch: 3, train_loss: 0.9853, test_loss: 1.0683, test_f1: 0.4551
 epoch: 4, train_loss: 0.9840, test_loss: 0.9912, test_f1: 0.4563
 epoch: 5, train_loss: 0.9551, test_loss: 1.0443, test_f1: 0.4734
 epoch: 6, train_loss: 0.9685, test_loss: 0.9644, test_f1: 0.4897
 epoch: 7, train_loss: 0.9689, test_loss: 1.0854, test_f1: 0.4693
 epoch: 8, train_loss: 0.9536, test_loss: 0.9680, test_f1: 0.5517
 epoch: 9, train_loss: 0.9461, test_loss: 0.9657, test_f1: 0.4727
 epoch: 10, train_loss: 0.9556, test_loss: 0.9640, test_f1: 0.5007
 epoch: 11, train_loss: 0.9516, test_loss: 1.0787, test_f1: 0.5091
 epoch: 12, train_loss: 0.9315, test_loss: 0.9649, test_f1: 0.5166
 epoch: 13, train_loss: 0.9267, test_loss: 0.9770, test_f1: 0.5251
 epoch: 14, train_loss: 0.9380, test_loss: 1.0343, test_f1: 0.5168
 epoch: 15, train_loss: 0.9230, test_loss: 0.9549, test_f1: 0.5421
 epoch: 16, train_loss: 0.9452, test_loss: 0.9649, test_f1: 0.5020
 epoch: 17, train_loss: 0.9130, test_loss: 0.8919, test_f1: 0.5389
 epoch: 18, train_loss: 0.9072, test_loss: 0.9480, test_f1: 0.5051
 epoch: 19, train_loss: 0.8996, test_loss: 0.9806, test_f1: 0.5025
 epoch: 20, train_loss: 0.9065, test_loss: 0.9312, test_f1: 0.5027
 epoch: 21, train_loss: 0.9118, test_loss: 0.8936, test_f1: 0.5018
 epoch: 22, train_loss: 0.9275, test_loss: 0.8817, test_f1: 0.5603
 epoch: 23, train_loss: 0.8902, test_loss: 0.9527, test_f1: 0.5007
 epoch: 24, train_loss: 0.8754, test_loss: 0.9268, test_f1: 0.5116
 epoch: 25, train_loss: 0.8756, test_loss: 0.8720, test_f1: 0.5388
 epoch: 26, train_loss: 0.8855, test_loss: 0.9248, test_f1: 0.5988
 epoch: 27, train_loss: 0.8756, test_loss: 0.8941, test_f1: 0.5221
 epoch: 28, train_loss: 0.8695, test_loss: 0.8883, test_f1: 0.5187
 epoch: 29, train_loss: 0.8726, test_loss: 0.8970, test_f1: 0.5545
 epoch: 30, train_loss: 0.8638, test_loss: 0.9098, test_f1: 0.5296
 epoch: 31, train_loss: 0.8400, test_loss: 0.8865, test_f1: 0.5828
 epoch: 32, train_loss: 0.8529, test_loss: 0.9809, test_f1: 0.5552
 epoch: 33, train_loss: 0.8371, test_loss: 0.9586, test_f1: 0.5881
 epoch: 34, train_loss: 0.8340, test_loss: 0.9416, test_f1: 0.5443
 epoch: 35, train_loss: 0.8293, test_loss: 1.0318, test_f1: 0.5753
 epoch: 36, train_loss: 0.8328, test_loss: 0.9872, test_f1: 0.5852
 epoch: 37, train_loss: 0.8371, test_loss: 0.8955, test_f1: 0.5922
 epoch: 38, train_loss: 0.8255, test_loss: 0.9506, test_f1: 0.6113
 epoch: 39, train_loss: 0.8306, test_loss: 0.8938, test_f1: 0.5568
 epoch: 40, train_loss: 0.8342, test_loss: 0.9737, test_f1: 0.5809
 epoch: 41, train_loss: 0.8100, test_loss: 0.8667, test_f1: 0.5911
 epoch: 42, train_loss: 0.8133, test_loss: 0.9213, test_f1: 0.6072
 epoch: 43, train_loss: 0.8223, test_loss: 0.9155, test_f1: 0.5656
 epoch: 44, train_loss: 0.8195, test_loss: 0.9210, test_f1: 0.5558
 epoch: 45, train_loss: 0.8109, test_loss: 0.9001, test_f1: 0.5884
 epoch: 46, train_loss: 0.8014, test_loss: 0.9305, test_f1: 0.6100
 epoch: 47, train_loss: 0.8125, test_loss: 0.8708, test_f1: 0.5991
 epoch: 48, train_loss: 0.8088, test_loss: 0.8948, test_f1: 0.5785
 epoch: 49, train_loss: 0.8022, test_loss: 0.9490, test_f1: 0.5945
 epoch: 50, train_loss: 0.7936, test_loss: 0.9470, test_f1: 0.5826
 epoch: 51, train_loss: 0.7614, test_loss: 0.9511, test_f1: 0.6108
 epoch: 52, train_loss: 0.7551, test_loss: 0.9422, test_f1: 0.5945
 epoch: 53, train_loss: 0.7467, test_loss: 0.9274, test_f1: 0.6145
 epoch: 54, train_loss: 0.7503, test_loss: 0.9442, test_f1: 0.6257
 epoch: 55, train_loss: 0.7508, test_loss: 0.9693, test_f1: 0.6043
 epoch: 56, train_loss: 0.7598, test_loss: 0.9692, test_f1: 0.6027
 epoch: 57, train_loss: 0.7374, test_loss: 0.9641, test_f1: 0.6463
 epoch: 58, train_loss: 0.7391, test_loss: 0.9266, test_f1: 0.6088
 epoch: 59, train_loss: 0.7326, test_loss: 1.0332, test_f1: 0.6087
 epoch: 60, train_loss: 0.7470, test_loss: 0.9607, test_f1: 0.6332
 epoch: 61, train_loss: 0.7324, test_loss: 0.9695, test_f1: 0.6603
 epoch: 62, train_loss: 0.7198, test_loss: 0.9927, test_f1: 0.6355
 epoch: 63, train_loss: 0.7285, test_loss: 1.0428, test_f1: 0.6229
 epoch: 64, train_loss: 0.7506, test_loss: 1.0043, test_f1: 0.6425
 epoch: 65, train_loss: 0.7331, test_loss: 1.0024, test_f1: 0.5958
 epoch: 66, train_loss: 0.7191, test_loss: 1.0286, test_f1: 0.5855
 epoch: 67, train_loss: 0.7348, test_loss: 0.9778, test_f1: 0.6168
 epoch: 68, train_loss: 0.7257, test_loss: 0.9557, test_f1: 0.6080
 epoch: 69, train_loss: 0.7309, test_loss: 1.0086, test_f1: 0.6107
 epoch: 70, train_loss: 0.7261, test_loss: 0.9447, test_f1: 0.6321
 epoch: 71, train_loss: 0.7163, test_loss: 0.9889, test_f1: 0.6400
 epoch: 72, train_loss: 0.7494, test_loss: 0.9596, test_f1: 0.6385
 epoch: 73, train_loss: 0.7329, test_loss: 0.9273, test_f1: 0.6514
 epoch: 74, train_loss: 0.7216, test_loss: 0.9893, test_f1: 0.6468
 epoch: 75, train_loss: 0.7221, test_loss: 0.9660, test_f1: 0.6397
 epoch: 76, train_loss: 0.7080, test_loss: 1.0072, test_f1: 0.6338
 epoch: 77, train_loss: 0.7218, test_loss: 0.9710, test_f1: 0.6375
 epoch: 78, train_loss: 0.7150, test_loss: 0.9671, test_f1: 0.6422
 epoch: 79, train_loss: 0.7092, test_loss: 1.0131, test_f1: 0.6122
 epoch: 80, train_loss: 0.7142, test_loss: 1.0447, test_f1: 0.6240
 epoch: 81, train_loss: 0.7016, test_loss: 1.0362, test_f1: 0.6668
 epoch: 82, train_loss: 0.7106, test_loss: 0.9822, test_f1: 0.6360
 epoch: 83, train_loss: 0.7081, test_loss: 1.0609, test_f1: 0.6179
 epoch: 84, train_loss: 0.7249, test_loss: 0.9988, test_f1: 0.6243
 epoch: 85, train_loss: 0.7031, test_loss: 1.0306, test_f1: 0.5983
 epoch: 86, train_loss: 0.7285, test_loss: 0.9988, test_f1: 0.6315
 epoch: 87, train_loss: 0.7314, test_loss: 1.0757, test_f1: 0.6518
 epoch: 88, train_loss: 0.7013, test_loss: 1.0014, test_f1: 0.6509
 epoch: 89, train_loss: 0.6927, test_loss: 1.0553, test_f1: 0.6436
 epoch: 90, train_loss: 0.6999, test_loss: 1.0500, test_f1: 0.6501
 epoch: 91, train_loss: 0.6962, test_loss: 0.9497, test_f1: 0.6128
 epoch: 92, train_loss: 0.6931, test_loss: 1.0545, test_f1: 0.6288
 epoch: 93, train_loss: 0.6806, test_loss: 1.0015, test_f1: 0.6382
 epoch: 94, train_loss: 0.6875, test_loss: 1.0707, test_f1: 0.6269
 epoch: 95, train_loss: 0.6939, test_loss: 1.2126, test_f1: 0.6147
 epoch: 96, train_loss: 0.7040, test_loss: 1.0944, test_f1: 0.6131
 epoch: 97, train_loss: 0.6874, test_loss: 1.0588, test_f1: 0.6230
 epoch: 98, train_loss: 0.7011, test_loss: 1.0449, test_f1: 0.6163
 epoch: 99, train_loss: 0.6799, test_loss: 1.0885, test_f1: 0.6029
##################ITERATION #2 ****************************************
 epoch: 0, train_loss: 1.1938, test_loss: 1.1158, test_f1: 0.4155
 epoch: 1, train_loss: 1.0385, test_loss: 0.9607, test_f1: 0.4589
 epoch: 2, train_loss: 0.9999, test_loss: 0.9674, test_f1: 0.4725
 epoch: 3, train_loss: 0.9914, test_loss: 0.9818, test_f1: 0.4744
 epoch: 4, train_loss: 0.9758, test_loss: 1.0221, test_f1: 0.4739
 epoch: 5, train_loss: 0.9552, test_loss: 1.0009, test_f1: 0.4811
 epoch: 6, train_loss: 0.9525, test_loss: 0.9715, test_f1: 0.5424
 epoch: 7, train_loss: 0.9498, test_loss: 1.0166, test_f1: 0.4874
 epoch: 8, train_loss: 0.9346, test_loss: 1.0069, test_f1: 0.5288
 epoch: 9, train_loss: 0.9271, test_loss: 0.9850, test_f1: 0.5523
 epoch: 10, train_loss: 0.9278, test_loss: 0.9602, test_f1: 0.5315
 epoch: 11, train_loss: 0.9288, test_loss: 0.9354, test_f1: 0.5134
 epoch: 12, train_loss: 0.9089, test_loss: 0.9804, test_f1: 0.5038
 epoch: 13, train_loss: 0.8985, test_loss: 1.0579, test_f1: 0.4875
 epoch: 14, train_loss: 0.9046, test_loss: 0.9787, test_f1: 0.4873
 epoch: 15, train_loss: 0.9140, test_loss: 1.0402, test_f1: 0.4520
 epoch: 16, train_loss: 0.9226, test_loss: 0.9794, test_f1: 0.4793
 epoch: 17, train_loss: 0.9060, test_loss: 1.0313, test_f1: 0.4960
 epoch: 18, train_loss: 0.8999, test_loss: 1.0475, test_f1: 0.4991
 epoch: 19, train_loss: 0.9149, test_loss: 0.9719, test_f1: 0.4751
 epoch: 20, train_loss: 0.9052, test_loss: 0.9832, test_f1: 0.4933
 epoch: 21, train_loss: 0.8924, test_loss: 0.9288, test_f1: 0.5349
 epoch: 22, train_loss: 0.8879, test_loss: 0.9592, test_f1: 0.5199
 epoch: 23, train_loss: 0.8879, test_loss: 0.9775, test_f1: 0.5420
 epoch: 24, train_loss: 0.8920, test_loss: 0.9820, test_f1: 0.5232
 epoch: 25, train_loss: 0.8639, test_loss: 0.9354, test_f1: 0.5381
 epoch: 26, train_loss: 0.8633, test_loss: 0.9771, test_f1: 0.5801
 epoch: 27, train_loss: 0.8690, test_loss: 1.0103, test_f1: 0.4971
 epoch: 28, train_loss: 0.8653, test_loss: 0.9482, test_f1: 0.5167
 epoch: 29, train_loss: 0.8659, test_loss: 0.9541, test_f1: 0.5143
 epoch: 30, train_loss: 0.8536, test_loss: 0.9749, test_f1: 0.5220
 epoch: 31, train_loss: 0.8420, test_loss: 1.0200, test_f1: 0.4852
 epoch: 32, train_loss: 0.8447, test_loss: 1.0126, test_f1: 0.5193
 epoch: 33, train_loss: 0.8428, test_loss: 0.9900, test_f1: 0.5768
 epoch: 34, train_loss: 0.8432, test_loss: 0.9833, test_f1: 0.5040
 epoch: 35, train_loss: 0.8522, test_loss: 1.0648, test_f1: 0.5749
 epoch: 36, train_loss: 0.8389, test_loss: 0.9288, test_f1: 0.5215
 epoch: 37, train_loss: 0.8317, test_loss: 0.9629, test_f1: 0.5514
 epoch: 38, train_loss: 0.8208, test_loss: 0.9896, test_f1: 0.5338
 epoch: 39, train_loss: 0.8139, test_loss: 1.1248, test_f1: 0.5162
 epoch: 40, train_loss: 0.8254, test_loss: 0.9658, test_f1: 0.5429
 epoch: 41, train_loss: 0.8283, test_loss: 1.0726, test_f1: 0.5700
 epoch: 42, train_loss: 0.8143, test_loss: 1.0238, test_f1: 0.5934
 epoch: 43, train_loss: 0.8153, test_loss: 1.0013, test_f1: 0.5371
 epoch: 44, train_loss: 0.8249, test_loss: 1.0198, test_f1: 0.5770
 epoch: 45, train_loss: 0.8213, test_loss: 0.9923, test_f1: 0.5030
 epoch: 46, train_loss: 0.8445, test_loss: 1.0827, test_f1: 0.5641
 epoch: 47, train_loss: 0.8245, test_loss: 0.9366, test_f1: 0.5250
 epoch: 48, train_loss: 0.8106, test_loss: 0.9798, test_f1: 0.5909
 epoch: 49, train_loss: 0.8178, test_loss: 0.9632, test_f1: 0.5877
 epoch: 50, train_loss: 0.8133, test_loss: 0.9764, test_f1: 0.5933
 epoch: 51, train_loss: 0.7669, test_loss: 0.9934, test_f1: 0.6010
 epoch: 52, train_loss: 0.7769, test_loss: 0.9185, test_f1: 0.5923
 epoch: 53, train_loss: 0.7547, test_loss: 0.9512, test_f1: 0.6011
 epoch: 54, train_loss: 0.7531, test_loss: 0.9611, test_f1: 0.6100
 epoch: 55, train_loss: 0.7557, test_loss: 1.0148, test_f1: 0.5860
 epoch: 56, train_loss: 0.7568, test_loss: 0.9358, test_f1: 0.6191
 epoch: 57, train_loss: 0.7320, test_loss: 0.9989, test_f1: 0.6098
 epoch: 58, train_loss: 0.7512, test_loss: 1.0100, test_f1: 0.6242
 epoch: 59, train_loss: 0.7451, test_loss: 0.9796, test_f1: 0.6138
 epoch: 60, train_loss: 0.7549, test_loss: 0.9844, test_f1: 0.6507
 epoch: 61, train_loss: 0.7511, test_loss: 0.9564, test_f1: 0.6275
 epoch: 62, train_loss: 0.7443, test_loss: 0.9772, test_f1: 0.6369
 epoch: 63, train_loss: 0.7484, test_loss: 0.9399, test_f1: 0.6272
 epoch: 64, train_loss: 0.7503, test_loss: 0.9508, test_f1: 0.6196
 epoch: 65, train_loss: 0.7351, test_loss: 1.0774, test_f1: 0.6369
 epoch: 66, train_loss: 0.7234, test_loss: 0.9845, test_f1: 0.6176
 epoch: 67, train_loss: 0.7382, test_loss: 1.0517, test_f1: 0.6260
 epoch: 68, train_loss: 0.7289, test_loss: 0.9850, test_f1: 0.6189
 epoch: 69, train_loss: 0.7403, test_loss: 1.0418, test_f1: 0.6183
 epoch: 70, train_loss: 0.7432, test_loss: 0.9429, test_f1: 0.5897
 epoch: 71, train_loss: 0.7362, test_loss: 1.0230, test_f1: 0.6129
 epoch: 72, train_loss: 0.7405, test_loss: 0.9608, test_f1: 0.6179
 epoch: 73, train_loss: 0.7233, test_loss: 0.9764, test_f1: 0.6322
 epoch: 74, train_loss: 0.7270, test_loss: 0.9429, test_f1: 0.6426
 epoch: 75, train_loss: 0.7240, test_loss: 0.8928, test_f1: 0.6469
 epoch: 76, train_loss: 0.7222, test_loss: 0.9238, test_f1: 0.6248
 epoch: 77, train_loss: 0.7049, test_loss: 0.9275, test_f1: 0.6318
 epoch: 78, train_loss: 0.7043, test_loss: 1.0328, test_f1: 0.6420
 epoch: 79, train_loss: 0.7232, test_loss: 0.9985, test_f1: 0.6403
 epoch: 80, train_loss: 0.7021, test_loss: 1.0505, test_f1: 0.6179
 epoch: 81, train_loss: 0.7233, test_loss: 1.0108, test_f1: 0.5948
 epoch: 82, train_loss: 0.7148, test_loss: 0.9678, test_f1: 0.6402
 epoch: 83, train_loss: 0.7100, test_loss: 0.9779, test_f1: 0.5973
 epoch: 84, train_loss: 0.7155, test_loss: 1.0096, test_f1: 0.6302
 epoch: 85, train_loss: 0.7228, test_loss: 1.0507, test_f1: 0.6099
 epoch: 86, train_loss: 0.7277, test_loss: 0.9323, test_f1: 0.6280
 epoch: 87, train_loss: 0.7131, test_loss: 0.9821, test_f1: 0.6434
 epoch: 88, train_loss: 0.7117, test_loss: 1.0551, test_f1: 0.5999
 epoch: 89, train_loss: 0.7156, test_loss: 1.0540, test_f1: 0.5918
 epoch: 90, train_loss: 0.7079, test_loss: 1.0372, test_f1: 0.6005
 epoch: 91, train_loss: 0.7029, test_loss: 1.0309, test_f1: 0.5998
 epoch: 92, train_loss: 0.7098, test_loss: 0.9596, test_f1: 0.6357
 epoch: 93, train_loss: 0.7053, test_loss: 1.0335, test_f1: 0.6483
 epoch: 94, train_loss: 0.7079, test_loss: 0.9709, test_f1: 0.6455
 epoch: 95, train_loss: 0.6997, test_loss: 0.9647, test_f1: 0.6386
 epoch: 96, train_loss: 0.6823, test_loss: 1.0091, test_f1: 0.6497
 epoch: 97, train_loss: 0.7025, test_loss: 1.0797, test_f1: 0.6201
 epoch: 98, train_loss: 0.6966, test_loss: 1.1486, test_f1: 0.6061
 epoch: 99, train_loss: 0.7183, test_loss: 0.9963, test_f1: 0.6399
##################ITERATION #3 ****************************************
 epoch: 0, train_loss: 1.1510, test_loss: 1.0748, test_f1: 0.3681
 epoch: 1, train_loss: 1.0558, test_loss: 1.1467, test_f1: 0.4083
 epoch: 2, train_loss: 1.0176, test_loss: 1.0583, test_f1: 0.4434
 epoch: 3, train_loss: 1.0038, test_loss: 1.0109, test_f1: 0.4392
 epoch: 4, train_loss: 1.0021, test_loss: 0.9986, test_f1: 0.4633
 epoch: 5, train_loss: 1.0018, test_loss: 1.1442, test_f1: 0.4552
 epoch: 6, train_loss: 0.9857, test_loss: 1.0236, test_f1: 0.5333
 epoch: 7, train_loss: 0.9957, test_loss: 0.9811, test_f1: 0.4846
 epoch: 8, train_loss: 0.9740, test_loss: 0.9838, test_f1: 0.4578
 epoch: 9, train_loss: 0.9498, test_loss: 1.0540, test_f1: 0.4585
 epoch: 10, train_loss: 0.9755, test_loss: 1.0467, test_f1: 0.4522
 epoch: 11, train_loss: 0.9565, test_loss: 1.0155, test_f1: 0.4629
 epoch: 12, train_loss: 0.9577, test_loss: 0.9824, test_f1: 0.4997
 epoch: 13, train_loss: 0.9396, test_loss: 1.0143, test_f1: 0.5079
 epoch: 14, train_loss: 0.9479, test_loss: 0.9843, test_f1: 0.4984
 epoch: 15, train_loss: 0.9435, test_loss: 0.9489, test_f1: 0.4822
 epoch: 16, train_loss: 0.9395, test_loss: 0.9873, test_f1: 0.4718
 epoch: 17, train_loss: 0.9177, test_loss: 0.9852, test_f1: 0.4775
 epoch: 18, train_loss: 0.9138, test_loss: 1.0364, test_f1: 0.5488
 epoch: 19, train_loss: 0.9167, test_loss: 0.9380, test_f1: 0.5039
 epoch: 20, train_loss: 0.9402, test_loss: 0.9310, test_f1: 0.4963
 epoch: 21, train_loss: 0.9104, test_loss: 0.9484, test_f1: 0.4934
 epoch: 22, train_loss: 0.9069, test_loss: 0.9624, test_f1: 0.5080
 epoch: 23, train_loss: 0.9235, test_loss: 1.0150, test_f1: 0.4978
 epoch: 24, train_loss: 0.9141, test_loss: 0.9877, test_f1: 0.4877
 epoch: 25, train_loss: 0.9125, test_loss: 0.9604, test_f1: 0.5820
 epoch: 26, train_loss: 0.9000, test_loss: 0.9554, test_f1: 0.5111
 epoch: 27, train_loss: 0.9114, test_loss: 0.9646, test_f1: 0.5020
 epoch: 28, train_loss: 0.9052, test_loss: 0.9940, test_f1: 0.5539
 epoch: 29, train_loss: 0.8882, test_loss: 0.9274, test_f1: 0.5090
 epoch: 30, train_loss: 0.8869, test_loss: 1.0382, test_f1: 0.5197
 epoch: 31, train_loss: 0.8810, test_loss: 0.9627, test_f1: 0.5143
 epoch: 32, train_loss: 0.8759, test_loss: 1.0159, test_f1: 0.5349
 epoch: 33, train_loss: 0.8832, test_loss: 1.0034, test_f1: 0.5190
 epoch: 34, train_loss: 0.8811, test_loss: 1.0105, test_f1: 0.5080
 epoch: 35, train_loss: 0.8702, test_loss: 0.9652, test_f1: 0.5249
 epoch: 36, train_loss: 0.8817, test_loss: 0.9329, test_f1: 0.5217
 epoch: 37, train_loss: 0.8743, test_loss: 0.8986, test_f1: 0.5087
 epoch: 38, train_loss: 0.8707, test_loss: 0.9431, test_f1: 0.5618
 epoch: 39, train_loss: 0.8574, test_loss: 0.9351, test_f1: 0.5063
 epoch: 40, train_loss: 0.8555, test_loss: 0.9476, test_f1: 0.5750
 epoch: 41, train_loss: 0.8703, test_loss: 1.0140, test_f1: 0.5610
 epoch: 42, train_loss: 0.8663, test_loss: 0.9907, test_f1: 0.5084
 epoch: 43, train_loss: 0.8449, test_loss: 0.8619, test_f1: 0.5344
 epoch: 44, train_loss: 0.8502, test_loss: 0.8266, test_f1: 0.5831
 epoch: 45, train_loss: 0.8394, test_loss: 0.9466, test_f1: 0.5112
 epoch: 46, train_loss: 0.8315, test_loss: 0.8402, test_f1: 0.5364
 epoch: 47, train_loss: 0.8441, test_loss: 0.9057, test_f1: 0.5362
 epoch: 48, train_loss: 0.8367, test_loss: 0.8995, test_f1: 0.5414
 epoch: 49, train_loss: 0.8635, test_loss: 0.9998, test_f1: 0.5177
 epoch: 50, train_loss: 0.8272, test_loss: 0.9730, test_f1: 0.5919
 epoch: 51, train_loss: 0.8175, test_loss: 0.9197, test_f1: 0.5966
 epoch: 52, train_loss: 0.7993, test_loss: 0.9128, test_f1: 0.5667
 epoch: 53, train_loss: 0.8029, test_loss: 0.8913, test_f1: 0.5474
 epoch: 54, train_loss: 0.7968, test_loss: 0.9115, test_f1: 0.5452
 epoch: 55, train_loss: 0.8006, test_loss: 0.9023, test_f1: 0.5702
 epoch: 56, train_loss: 0.7865, test_loss: 0.9305, test_f1: 0.5963
 epoch: 57, train_loss: 0.8077, test_loss: 0.9230, test_f1: 0.5594
 epoch: 58, train_loss: 0.8058, test_loss: 0.9330, test_f1: 0.5869
 epoch: 59, train_loss: 0.7931, test_loss: 0.9199, test_f1: 0.5930
 epoch: 60, train_loss: 0.7908, test_loss: 0.9011, test_f1: 0.5455
 epoch: 61, train_loss: 0.7916, test_loss: 0.9198, test_f1: 0.5915
 epoch: 62, train_loss: 0.7805, test_loss: 0.9221, test_f1: 0.5363
 epoch: 63, train_loss: 0.7838, test_loss: 0.9244, test_f1: 0.5841
 epoch: 64, train_loss: 0.7848, test_loss: 0.8827, test_f1: 0.6157
 epoch: 65, train_loss: 0.7733, test_loss: 0.9369, test_f1: 0.5621
 epoch: 66, train_loss: 0.7695, test_loss: 0.9096, test_f1: 0.5984
 epoch: 67, train_loss: 0.7808, test_loss: 0.9242, test_f1: 0.5892
 epoch: 68, train_loss: 0.7769, test_loss: 0.9409, test_f1: 0.5916
 epoch: 69, train_loss: 0.7814, test_loss: 0.8946, test_f1: 0.5654
 epoch: 70, train_loss: 0.7668, test_loss: 0.8666, test_f1: 0.6165
 epoch: 71, train_loss: 0.7917, test_loss: 0.8595, test_f1: 0.6023
 epoch: 72, train_loss: 0.7691, test_loss: 0.8628, test_f1: 0.6076
 epoch: 73, train_loss: 0.7779, test_loss: 0.8588, test_f1: 0.6087
 epoch: 74, train_loss: 0.7780, test_loss: 0.9013, test_f1: 0.5793
 epoch: 75, train_loss: 0.7425, test_loss: 0.9341, test_f1: 0.6137
 epoch: 76, train_loss: 0.7622, test_loss: 0.8847, test_f1: 0.6257
 epoch: 77, train_loss: 0.7747, test_loss: 0.8954, test_f1: 0.6245
 epoch: 78, train_loss: 0.7649, test_loss: 0.9070, test_f1: 0.6282
 epoch: 79, train_loss: 0.7621, test_loss: 0.8696, test_f1: 0.6251
 epoch: 80, train_loss: 0.7598, test_loss: 0.9039, test_f1: 0.6093
 epoch: 81, train_loss: 0.7593, test_loss: 0.8915, test_f1: 0.6302
 epoch: 82, train_loss: 0.7616, test_loss: 0.9151, test_f1: 0.6175
 epoch: 83, train_loss: 0.7686, test_loss: 0.8574, test_f1: 0.5948
 epoch: 84, train_loss: 0.7564, test_loss: 0.9151, test_f1: 0.6060
 epoch: 85, train_loss: 0.7483, test_loss: 0.9284, test_f1: 0.5818
 epoch: 86, train_loss: 0.7590, test_loss: 0.8529, test_f1: 0.6219
 epoch: 87, train_loss: 0.7550, test_loss: 0.8804, test_f1: 0.5942
 epoch: 88, train_loss: 0.7548, test_loss: 0.9114, test_f1: 0.5987
 epoch: 89, train_loss: 0.7436, test_loss: 0.9179, test_f1: 0.6065
 epoch: 90, train_loss: 0.7452, test_loss: 0.9195, test_f1: 0.5735
 epoch: 91, train_loss: 0.7443, test_loss: 0.9091, test_f1: 0.5911
 epoch: 92, train_loss: 0.7274, test_loss: 0.8610, test_f1: 0.6281
 epoch: 93, train_loss: 0.7388, test_loss: 0.8960, test_f1: 0.6168
 epoch: 94, train_loss: 0.7355, test_loss: 0.9118, test_f1: 0.5970
 epoch: 95, train_loss: 0.7518, test_loss: 0.8924, test_f1: 0.5959
 epoch: 96, train_loss: 0.7366, test_loss: 0.8610, test_f1: 0.5857
 epoch: 97, train_loss: 0.7437, test_loss: 0.8595, test_f1: 0.5959
 epoch: 98, train_loss: 0.7436, test_loss: 0.8777, test_f1: 0.6094
 epoch: 99, train_loss: 0.7428, test_loss: 0.8786, test_f1: 0.6178
##################ITERATION #4 ****************************************
 epoch: 0, train_loss: 1.1961, test_loss: 1.0859, test_f1: 0.4188
 epoch: 1, train_loss: 1.0620, test_loss: 1.0640, test_f1: 0.4515
 epoch: 2, train_loss: 1.0208, test_loss: 0.9893, test_f1: 0.4891
 epoch: 3, train_loss: 1.0184, test_loss: 1.0749, test_f1: 0.4290
 epoch: 4, train_loss: 0.9936, test_loss: 0.9635, test_f1: 0.5345
 epoch: 5, train_loss: 1.0014, test_loss: 1.0045, test_f1: 0.4506
 epoch: 6, train_loss: 0.9825, test_loss: 1.0829, test_f1: 0.4491
 epoch: 7, train_loss: 0.9751, test_loss: 0.9503, test_f1: 0.4909
 epoch: 8, train_loss: 0.9582, test_loss: 1.0168, test_f1: 0.4634
 epoch: 9, train_loss: 0.9654, test_loss: 0.9093, test_f1: 0.5134
 epoch: 10, train_loss: 0.9751, test_loss: 0.9586, test_f1: 0.5019
 epoch: 11, train_loss: 0.9533, test_loss: 0.9582, test_f1: 0.5460
 epoch: 12, train_loss: 0.9340, test_loss: 0.9219, test_f1: 0.5113
 epoch: 13, train_loss: 0.9332, test_loss: 1.0036, test_f1: 0.5131
 epoch: 14, train_loss: 0.9354, test_loss: 0.9666, test_f1: 0.5007
 epoch: 15, train_loss: 0.9298, test_loss: 0.9988, test_f1: 0.5058
 epoch: 16, train_loss: 0.9330, test_loss: 1.0046, test_f1: 0.4733
 epoch: 17, train_loss: 0.9235, test_loss: 0.9064, test_f1: 0.5040
 epoch: 18, train_loss: 0.9292, test_loss: 1.0122, test_f1: 0.4721
 epoch: 19, train_loss: 0.9319, test_loss: 0.9805, test_f1: 0.4839
 epoch: 20, train_loss: 0.9112, test_loss: 0.9822, test_f1: 0.4716
 epoch: 21, train_loss: 0.9165, test_loss: 0.9478, test_f1: 0.4997
 epoch: 22, train_loss: 0.9201, test_loss: 1.0690, test_f1: 0.4821
 epoch: 23, train_loss: 0.9156, test_loss: 0.9531, test_f1: 0.4860
 epoch: 24, train_loss: 0.8991, test_loss: 0.9701, test_f1: 0.5095
 epoch: 25, train_loss: 0.9223, test_loss: 0.9779, test_f1: 0.4908
 epoch: 26, train_loss: 0.9185, test_loss: 0.9142, test_f1: 0.5045
 epoch: 27, train_loss: 0.8952, test_loss: 0.9529, test_f1: 0.5060
 epoch: 28, train_loss: 0.9047, test_loss: 0.9538, test_f1: 0.5204
 epoch: 29, train_loss: 0.8857, test_loss: 0.9776, test_f1: 0.5123
 epoch: 30, train_loss: 0.9044, test_loss: 0.9303, test_f1: 0.5070
 epoch: 31, train_loss: 0.8907, test_loss: 0.9277, test_f1: 0.5023
 epoch: 32, train_loss: 0.8816, test_loss: 0.8823, test_f1: 0.5143
 epoch: 33, train_loss: 0.8839, test_loss: 0.8929, test_f1: 0.5150
 epoch: 34, train_loss: 0.8891, test_loss: 0.9275, test_f1: 0.5659
 epoch: 35, train_loss: 0.8733, test_loss: 0.9849, test_f1: 0.4869
 epoch: 36, train_loss: 0.8982, test_loss: 0.8933, test_f1: 0.5129
 epoch: 37, train_loss: 0.8731, test_loss: 0.9407, test_f1: 0.5689
 epoch: 38, train_loss: 0.8634, test_loss: 0.9410, test_f1: 0.5568
 epoch: 39, train_loss: 0.8631, test_loss: 0.9327, test_f1: 0.5679
 epoch: 40, train_loss: 0.8664, test_loss: 1.0122, test_f1: 0.4708
 epoch: 41, train_loss: 0.8657, test_loss: 0.9395, test_f1: 0.5306
 epoch: 42, train_loss: 0.8776, test_loss: 0.9328, test_f1: 0.4946
 epoch: 43, train_loss: 0.8481, test_loss: 0.9360, test_f1: 0.5200
 epoch: 44, train_loss: 0.8611, test_loss: 0.9418, test_f1: 0.5264
 epoch: 45, train_loss: 0.8558, test_loss: 0.9810, test_f1: 0.5610
 epoch: 46, train_loss: 0.8410, test_loss: 0.9823, test_f1: 0.5613
 epoch: 47, train_loss: 0.8543, test_loss: 0.9452, test_f1: 0.5113
 epoch: 48, train_loss: 0.8424, test_loss: 0.8917, test_f1: 0.5291
 epoch: 49, train_loss: 0.8399, test_loss: 0.8482, test_f1: 0.5895
 epoch: 50, train_loss: 0.8489, test_loss: 0.8689, test_f1: 0.5260
 epoch: 51, train_loss: 0.8205, test_loss: 0.9013, test_f1: 0.5242
 epoch: 52, train_loss: 0.8103, test_loss: 0.8862, test_f1: 0.5747
 epoch: 53, train_loss: 0.7942, test_loss: 0.8874, test_f1: 0.5984
 epoch: 54, train_loss: 0.8039, test_loss: 0.8850, test_f1: 0.6184
 epoch: 55, train_loss: 0.7979, test_loss: 0.8714, test_f1: 0.5397
 epoch: 56, train_loss: 0.7949, test_loss: 0.8852, test_f1: 0.6007
 epoch: 57, train_loss: 0.7849, test_loss: 0.9064, test_f1: 0.5617
 epoch: 58, train_loss: 0.7922, test_loss: 0.9049, test_f1: 0.5513
 epoch: 59, train_loss: 0.7876, test_loss: 0.9087, test_f1: 0.5341
 epoch: 60, train_loss: 0.7761, test_loss: 0.8988, test_f1: 0.5996
 epoch: 61, train_loss: 0.7877, test_loss: 0.9404, test_f1: 0.6440
 epoch: 62, train_loss: 0.7973, test_loss: 0.8946, test_f1: 0.6170
 epoch: 63, train_loss: 0.7876, test_loss: 0.8811, test_f1: 0.6238
 epoch: 64, train_loss: 0.7738, test_loss: 0.8640, test_f1: 0.5967
 epoch: 65, train_loss: 0.7942, test_loss: 0.8725, test_f1: 0.6359
 epoch: 66, train_loss: 0.7819, test_loss: 0.8812, test_f1: 0.6122
 epoch: 67, train_loss: 0.7695, test_loss: 0.8848, test_f1: 0.6119
 epoch: 68, train_loss: 0.7727, test_loss: 0.9252, test_f1: 0.5442
 epoch: 69, train_loss: 0.7689, test_loss: 0.8642, test_f1: 0.6214
 epoch: 70, train_loss: 0.7808, test_loss: 0.8994, test_f1: 0.5916
 epoch: 71, train_loss: 0.7795, test_loss: 0.9082, test_f1: 0.6042
 epoch: 72, train_loss: 0.7673, test_loss: 0.8696, test_f1: 0.6128
 epoch: 73, train_loss: 0.7709, test_loss: 0.8960, test_f1: 0.5896
 epoch: 74, train_loss: 0.7725, test_loss: 0.8744, test_f1: 0.6123
 epoch: 75, train_loss: 0.7829, test_loss: 0.8880, test_f1: 0.6300
 epoch: 76, train_loss: 0.7728, test_loss: 0.8958, test_f1: 0.6227
 epoch: 77, train_loss: 0.7540, test_loss: 0.8655, test_f1: 0.6375
 epoch: 78, train_loss: 0.7639, test_loss: 0.8819, test_f1: 0.6465
 epoch: 79, train_loss: 0.7673, test_loss: 0.8805, test_f1: 0.6202
 epoch: 80, train_loss: 0.7520, test_loss: 0.8867, test_f1: 0.6302
 epoch: 81, train_loss: 0.7601, test_loss: 0.9129, test_f1: 0.6117
 epoch: 82, train_loss: 0.7564, test_loss: 0.8964, test_f1: 0.6170
 epoch: 83, train_loss: 0.7496, test_loss: 0.8795, test_f1: 0.6149
 epoch: 84, train_loss: 0.7653, test_loss: 0.8851, test_f1: 0.6434
 epoch: 85, train_loss: 0.7579, test_loss: 0.8988, test_f1: 0.6142
 epoch: 86, train_loss: 0.7428, test_loss: 0.8818, test_f1: 0.6287
 epoch: 87, train_loss: 0.7499, test_loss: 0.9075, test_f1: 0.6073
 epoch: 88, train_loss: 0.7521, test_loss: 0.9044, test_f1: 0.6033
 epoch: 89, train_loss: 0.7555, test_loss: 0.9190, test_f1: 0.6034
 epoch: 90, train_loss: 0.7441, test_loss: 0.8924, test_f1: 0.6254
 epoch: 91, train_loss: 0.7388, test_loss: 0.8874, test_f1: 0.6241
 epoch: 92, train_loss: 0.7450, test_loss: 0.8767, test_f1: 0.6624
 epoch: 93, train_loss: 0.7286, test_loss: 0.8981, test_f1: 0.6384
 epoch: 94, train_loss: 0.7331, test_loss: 0.8490, test_f1: 0.6091
 epoch: 95, train_loss: 0.7523, test_loss: 0.8858, test_f1: 0.6389
 epoch: 96, train_loss: 0.7352, test_loss: 0.8967, test_f1: 0.6114
 epoch: 97, train_loss: 0.7275, test_loss: 0.9168, test_f1: 0.6262
 epoch: 98, train_loss: 0.7143, test_loss: 0.8839, test_f1: 0.6571
 epoch: 99, train_loss: 0.7506, test_loss: 0.8935, test_f1: 0.6094
##################ITERATION #5 ****************************************
 epoch: 0, train_loss: 1.2024, test_loss: 1.0939, test_f1: 0.3586
 epoch: 1, train_loss: 1.0577, test_loss: 1.1273, test_f1: 0.4385
 epoch: 2, train_loss: 1.0297, test_loss: 1.0619, test_f1: 0.4837
 epoch: 3, train_loss: 1.0206, test_loss: 1.0955, test_f1: 0.5093
 epoch: 4, train_loss: 0.9999, test_loss: 1.0210, test_f1: 0.4563
 epoch: 5, train_loss: 0.9850, test_loss: 1.0261, test_f1: 0.4838
 epoch: 6, train_loss: 0.9813, test_loss: 0.9449, test_f1: 0.5295
 epoch: 7, train_loss: 0.9770, test_loss: 0.9522, test_f1: 0.4794
 epoch: 8, train_loss: 0.9753, test_loss: 0.9522, test_f1: 0.4786
 epoch: 9, train_loss: 0.9617, test_loss: 0.9955, test_f1: 0.4859
 epoch: 10, train_loss: 0.9607, test_loss: 0.9684, test_f1: 0.4937
 epoch: 11, train_loss: 0.9289, test_loss: 0.9669, test_f1: 0.5272
 epoch: 12, train_loss: 0.9316, test_loss: 0.9653, test_f1: 0.4824
 epoch: 13, train_loss: 0.9372, test_loss: 1.0460, test_f1: 0.4576
 epoch: 14, train_loss: 0.9370, test_loss: 0.8956, test_f1: 0.5170
 epoch: 15, train_loss: 0.9287, test_loss: 0.9243, test_f1: 0.5652
 epoch: 16, train_loss: 0.9066, test_loss: 1.0152, test_f1: 0.4999
 epoch: 17, train_loss: 0.9097, test_loss: 0.9589, test_f1: 0.4880
 epoch: 18, train_loss: 0.9043, test_loss: 0.9101, test_f1: 0.5156
 epoch: 19, train_loss: 0.9128, test_loss: 0.9651, test_f1: 0.5320
 epoch: 20, train_loss: 0.9080, test_loss: 0.9723, test_f1: 0.5048
 epoch: 21, train_loss: 0.8900, test_loss: 0.9479, test_f1: 0.5435
 epoch: 22, train_loss: 0.8982, test_loss: 0.9280, test_f1: 0.5488
 epoch: 23, train_loss: 0.8868, test_loss: 0.9872, test_f1: 0.5494
 epoch: 24, train_loss: 0.8872, test_loss: 0.9780, test_f1: 0.4876
 epoch: 25, train_loss: 0.8815, test_loss: 0.9698, test_f1: 0.5159
 epoch: 26, train_loss: 0.8755, test_loss: 0.9086, test_f1: 0.5280
 epoch: 27, train_loss: 0.8873, test_loss: 0.8736, test_f1: 0.5145
 epoch: 28, train_loss: 0.8770, test_loss: 0.9252, test_f1: 0.5362
 epoch: 29, train_loss: 0.8808, test_loss: 0.9517, test_f1: 0.5152
 epoch: 30, train_loss: 0.8684, test_loss: 0.9090, test_f1: 0.5322
 epoch: 31, train_loss: 0.8814, test_loss: 0.9156, test_f1: 0.5259
 epoch: 32, train_loss: 0.8831, test_loss: 0.8791, test_f1: 0.5815
 epoch: 33, train_loss: 0.8702, test_loss: 0.9095, test_f1: 0.4858
 epoch: 34, train_loss: 0.8617, test_loss: 0.9824, test_f1: 0.5518
 epoch: 35, train_loss: 0.8664, test_loss: 0.9290, test_f1: 0.4837
 epoch: 36, train_loss: 0.8684, test_loss: 0.9575, test_f1: 0.5688
 epoch: 37, train_loss: 0.8651, test_loss: 0.8442, test_f1: 0.5424
 epoch: 38, train_loss: 0.8539, test_loss: 0.9236, test_f1: 0.5083
 epoch: 39, train_loss: 0.8751, test_loss: 0.9783, test_f1: 0.5009
 epoch: 40, train_loss: 0.8881, test_loss: 0.9218, test_f1: 0.5660
 epoch: 41, train_loss: 0.8515, test_loss: 0.8600, test_f1: 0.5660
 epoch: 42, train_loss: 0.8466, test_loss: 0.9259, test_f1: 0.5296
 epoch: 43, train_loss: 0.8397, test_loss: 0.9386, test_f1: 0.5268
 epoch: 44, train_loss: 0.8267, test_loss: 0.9518, test_f1: 0.5052
 epoch: 45, train_loss: 0.8223, test_loss: 0.9017, test_f1: 0.5198
 epoch: 46, train_loss: 0.8482, test_loss: 0.8822, test_f1: 0.5917
 epoch: 47, train_loss: 0.8252, test_loss: 0.9020, test_f1: 0.5975
 epoch: 48, train_loss: 0.8354, test_loss: 0.9065, test_f1: 0.5241
 epoch: 49, train_loss: 0.8283, test_loss: 0.9842, test_f1: 0.5404
 epoch: 50, train_loss: 0.8327, test_loss: 0.8942, test_f1: 0.5811
 epoch: 51, train_loss: 0.7841, test_loss: 0.8860, test_f1: 0.5860
 epoch: 52, train_loss: 0.7868, test_loss: 0.8749, test_f1: 0.5973
 epoch: 53, train_loss: 0.7951, test_loss: 0.8957, test_f1: 0.6014
 epoch: 54, train_loss: 0.8004, test_loss: 0.8763, test_f1: 0.5537
 epoch: 55, train_loss: 0.7806, test_loss: 0.9351, test_f1: 0.5362
 epoch: 56, train_loss: 0.7804, test_loss: 0.8862, test_f1: 0.6024
 epoch: 57, train_loss: 0.7826, test_loss: 0.9289, test_f1: 0.5764
 epoch: 58, train_loss: 0.7685, test_loss: 0.8911, test_f1: 0.5750
 epoch: 59, train_loss: 0.7800, test_loss: 0.8873, test_f1: 0.5846
 epoch: 60, train_loss: 0.7753, test_loss: 0.8954, test_f1: 0.5620
 epoch: 61, train_loss: 0.7893, test_loss: 0.9128, test_f1: 0.6179
 epoch: 62, train_loss: 0.7590, test_loss: 0.9155, test_f1: 0.5866
 epoch: 63, train_loss: 0.7686, test_loss: 0.9081, test_f1: 0.5347
 epoch: 64, train_loss: 0.7745, test_loss: 0.8988, test_f1: 0.5945
 epoch: 65, train_loss: 0.7668, test_loss: 0.8992, test_f1: 0.5927
 epoch: 66, train_loss: 0.7569, test_loss: 0.9181, test_f1: 0.5454
 epoch: 67, train_loss: 0.7749, test_loss: 0.9063, test_f1: 0.6150
 epoch: 68, train_loss: 0.7601, test_loss: 0.9299, test_f1: 0.6041
 epoch: 69, train_loss: 0.7582, test_loss: 0.9081, test_f1: 0.6056
 epoch: 70, train_loss: 0.7584, test_loss: 0.9494, test_f1: 0.5960
 epoch: 71, train_loss: 0.7511, test_loss: 0.9140, test_f1: 0.5948
 epoch: 72, train_loss: 0.7359, test_loss: 0.8770, test_f1: 0.6255
 epoch: 73, train_loss: 0.7338, test_loss: 0.9128, test_f1: 0.5923
 epoch: 74, train_loss: 0.7532, test_loss: 0.9007, test_f1: 0.6159
 epoch: 75, train_loss: 0.7413, test_loss: 0.9020, test_f1: 0.5905
 epoch: 76, train_loss: 0.7428, test_loss: 0.9269, test_f1: 0.5878
 epoch: 77, train_loss: 0.7494, test_loss: 0.8660, test_f1: 0.6088
 epoch: 78, train_loss: 0.7437, test_loss: 0.8821, test_f1: 0.5996
 epoch: 79, train_loss: 0.7397, test_loss: 0.8687, test_f1: 0.6112
 epoch: 80, train_loss: 0.7313, test_loss: 0.8951, test_f1: 0.6169
 epoch: 81, train_loss: 0.7418, test_loss: 0.9082, test_f1: 0.6335
 epoch: 82, train_loss: 0.7464, test_loss: 0.9231, test_f1: 0.6189
 epoch: 83, train_loss: 0.7337, test_loss: 0.8882, test_f1: 0.6148
 epoch: 84, train_loss: 0.7301, test_loss: 0.8832, test_f1: 0.6010
 epoch: 85, train_loss: 0.7269, test_loss: 0.9080, test_f1: 0.6014
 epoch: 86, train_loss: 0.7270, test_loss: 0.9182, test_f1: 0.5895
 epoch: 87, train_loss: 0.7288, test_loss: 0.9042, test_f1: 0.6220
 epoch: 88, train_loss: 0.7294, test_loss: 0.9406, test_f1: 0.5788
 epoch: 89, train_loss: 0.7328, test_loss: 0.9259, test_f1: 0.6176
 epoch: 90, train_loss: 0.7307, test_loss: 0.9229, test_f1: 0.6246
 epoch: 91, train_loss: 0.7298, test_loss: 0.8812, test_f1: 0.6367
 epoch: 92, train_loss: 0.7200, test_loss: 0.8955, test_f1: 0.6192
 epoch: 93, train_loss: 0.7270, test_loss: 0.9061, test_f1: 0.6077
 epoch: 94, train_loss: 0.7222, test_loss: 0.9298, test_f1: 0.6000
 epoch: 95, train_loss: 0.7265, test_loss: 0.8955, test_f1: 0.6082
 epoch: 96, train_loss: 0.7242, test_loss: 0.9431, test_f1: 0.6000
 epoch: 97, train_loss: 0.7275, test_loss: 0.9034, test_f1: 0.6093
 epoch: 98, train_loss: 0.7111, test_loss: 0.9224, test_f1: 0.5941
 epoch: 99, train_loss: 0.7213, test_loss: 0.8802, test_f1: 0.6158
##################ITERATION #6 ****************************************
 epoch: 0, train_loss: 1.1563, test_loss: 1.1220, test_f1: 0.4384
 epoch: 1, train_loss: 1.0394, test_loss: 1.0052, test_f1: 0.4312
 epoch: 2, train_loss: 1.0128, test_loss: 1.0729, test_f1: 0.4513
 epoch: 3, train_loss: 1.0123, test_loss: 1.2780, test_f1: 0.4191
 epoch: 4, train_loss: 1.0113, test_loss: 1.0421, test_f1: 0.4939
 epoch: 5, train_loss: 0.9840, test_loss: 1.0087, test_f1: 0.4765
 epoch: 6, train_loss: 0.9803, test_loss: 0.9891, test_f1: 0.4443
 epoch: 7, train_loss: 0.9737, test_loss: 1.0259, test_f1: 0.4785
 epoch: 8, train_loss: 0.9702, test_loss: 1.0398, test_f1: 0.4541
 epoch: 9, train_loss: 0.9547, test_loss: 0.9912, test_f1: 0.4943
 epoch: 10, train_loss: 0.9643, test_loss: 1.0498, test_f1: 0.5357
 epoch: 11, train_loss: 0.9551, test_loss: 1.0225, test_f1: 0.4886
 epoch: 12, train_loss: 0.9333, test_loss: 1.0595, test_f1: 0.5190
 epoch: 13, train_loss: 0.9327, test_loss: 1.0735, test_f1: 0.4970
 epoch: 14, train_loss: 0.9450, test_loss: 1.0139, test_f1: 0.4675
 epoch: 15, train_loss: 0.9344, test_loss: 0.9726, test_f1: 0.5506
 epoch: 16, train_loss: 0.9417, test_loss: 1.0208, test_f1: 0.4655
 epoch: 17, train_loss: 0.9464, test_loss: 1.0791, test_f1: 0.5173
 epoch: 18, train_loss: 0.9290, test_loss: 1.0872, test_f1: 0.4532
 epoch: 19, train_loss: 0.9279, test_loss: 1.0946, test_f1: 0.4928
 epoch: 20, train_loss: 0.9164, test_loss: 1.0153, test_f1: 0.5068
 epoch: 21, train_loss: 0.9076, test_loss: 1.0494, test_f1: 0.4776
 epoch: 22, train_loss: 0.9205, test_loss: 1.0894, test_f1: 0.5073
 epoch: 23, train_loss: 0.8945, test_loss: 1.1098, test_f1: 0.5322
 epoch: 24, train_loss: 0.9286, test_loss: 1.0552, test_f1: 0.5050
 epoch: 25, train_loss: 0.9065, test_loss: 1.0173, test_f1: 0.4837
 epoch: 26, train_loss: 0.8977, test_loss: 0.9132, test_f1: 0.4888
 epoch: 27, train_loss: 0.8814, test_loss: 1.0576, test_f1: 0.5013
 epoch: 28, train_loss: 0.8841, test_loss: 1.0096, test_f1: 0.5007
 epoch: 29, train_loss: 0.8951, test_loss: 0.9705, test_f1: 0.5431
 epoch: 30, train_loss: 0.9005, test_loss: 1.0278, test_f1: 0.5430
 epoch: 31, train_loss: 0.8935, test_loss: 1.0340, test_f1: 0.5084
 epoch: 32, train_loss: 0.8968, test_loss: 0.9709, test_f1: 0.5562
 epoch: 33, train_loss: 0.8754, test_loss: 1.0770, test_f1: 0.5481
 epoch: 34, train_loss: 0.8986, test_loss: 0.9636, test_f1: 0.4999
 epoch: 35, train_loss: 0.8864, test_loss: 1.0149, test_f1: 0.5015
 epoch: 36, train_loss: 0.8905, test_loss: 1.0236, test_f1: 0.5684
 epoch: 37, train_loss: 0.8858, test_loss: 1.0084, test_f1: 0.5094
 epoch: 38, train_loss: 0.8666, test_loss: 1.0311, test_f1: 0.5663
 epoch: 39, train_loss: 0.8741, test_loss: 0.9876, test_f1: 0.4674
 epoch: 40, train_loss: 0.8705, test_loss: 0.9846, test_f1: 0.5750
 epoch: 41, train_loss: 0.8709, test_loss: 1.0432, test_f1: 0.5583
 epoch: 42, train_loss: 0.8802, test_loss: 1.0255, test_f1: 0.5512
 epoch: 43, train_loss: 0.8688, test_loss: 0.9727, test_f1: 0.5737
 epoch: 44, train_loss: 0.8617, test_loss: 1.0324, test_f1: 0.5648
 epoch: 45, train_loss: 0.8714, test_loss: 0.9963, test_f1: 0.5037
 epoch: 46, train_loss: 0.8764, test_loss: 1.0431, test_f1: 0.4969
 epoch: 47, train_loss: 0.8621, test_loss: 0.9643, test_f1: 0.5538
 epoch: 48, train_loss: 0.8546, test_loss: 1.0389, test_f1: 0.5542
 epoch: 49, train_loss: 0.8580, test_loss: 1.0462, test_f1: 0.4757
 epoch: 50, train_loss: 0.8456, test_loss: 1.0271, test_f1: 0.5058
 epoch: 51, train_loss: 0.8405, test_loss: 1.0144, test_f1: 0.5144
 epoch: 52, train_loss: 0.8224, test_loss: 0.9987, test_f1: 0.4972
 epoch: 53, train_loss: 0.8066, test_loss: 0.9510, test_f1: 0.5281
 epoch: 54, train_loss: 0.8209, test_loss: 0.9794, test_f1: 0.5168
 epoch: 55, train_loss: 0.8137, test_loss: 0.9811, test_f1: 0.5428
 epoch: 56, train_loss: 0.8020, test_loss: 0.9583, test_f1: 0.5903
 epoch: 57, train_loss: 0.7978, test_loss: 0.9893, test_f1: 0.5901
 epoch: 58, train_loss: 0.8025, test_loss: 1.0127, test_f1: 0.5722
 epoch: 59, train_loss: 0.7920, test_loss: 0.9712, test_f1: 0.6159
 epoch: 60, train_loss: 0.7927, test_loss: 1.0196, test_f1: 0.5603
 epoch: 61, train_loss: 0.7912, test_loss: 1.0565, test_f1: 0.5665
 epoch: 62, train_loss: 0.7744, test_loss: 0.9724, test_f1: 0.5672
 epoch: 63, train_loss: 0.7883, test_loss: 0.9837, test_f1: 0.5857
 epoch: 64, train_loss: 0.7831, test_loss: 0.9572, test_f1: 0.6214
 epoch: 65, train_loss: 0.7906, test_loss: 0.9862, test_f1: 0.5570
 epoch: 66, train_loss: 0.7724, test_loss: 0.9654, test_f1: 0.5422
 epoch: 67, train_loss: 0.7744, test_loss: 1.0251, test_f1: 0.5851
 epoch: 68, train_loss: 0.7778, test_loss: 1.0359, test_f1: 0.5928
 epoch: 69, train_loss: 0.7950, test_loss: 0.9960, test_f1: 0.5868
 epoch: 70, train_loss: 0.7788, test_loss: 1.0124, test_f1: 0.5346
 epoch: 71, train_loss: 0.7743, test_loss: 0.9808, test_f1: 0.5722
 epoch: 72, train_loss: 0.7838, test_loss: 1.0351, test_f1: 0.5792
 epoch: 73, train_loss: 0.7628, test_loss: 1.0612, test_f1: 0.5258
 epoch: 74, train_loss: 0.7872, test_loss: 1.0488, test_f1: 0.6046
 epoch: 75, train_loss: 0.7732, test_loss: 1.0057, test_f1: 0.6097
 epoch: 76, train_loss: 0.7748, test_loss: 0.9964, test_f1: 0.6029
 epoch: 77, train_loss: 0.7658, test_loss: 1.0166, test_f1: 0.5727
 epoch: 78, train_loss: 0.7637, test_loss: 1.0056, test_f1: 0.5787
 epoch: 79, train_loss: 0.7593, test_loss: 0.9782, test_f1: 0.5822
 epoch: 80, train_loss: 0.7570, test_loss: 1.1175, test_f1: 0.6134
 epoch: 81, train_loss: 0.7700, test_loss: 1.0258, test_f1: 0.5865
 epoch: 82, train_loss: 0.7592, test_loss: 1.1396, test_f1: 0.5518
 epoch: 83, train_loss: 0.7619, test_loss: 1.1352, test_f1: 0.6140
 epoch: 84, train_loss: 0.7409, test_loss: 1.1451, test_f1: 0.6133
 epoch: 85, train_loss: 0.7592, test_loss: 1.1352, test_f1: 0.6228
 epoch: 86, train_loss: 0.7638, test_loss: 1.0691, test_f1: 0.5594
 epoch: 87, train_loss: 0.7442, test_loss: 1.0425, test_f1: 0.6204
 epoch: 88, train_loss: 0.7509, test_loss: 1.0734, test_f1: 0.6614
 epoch: 89, train_loss: 0.7616, test_loss: 0.9656, test_f1: 0.6215
 epoch: 90, train_loss: 0.7525, test_loss: 1.0077, test_f1: 0.6101
 epoch: 91, train_loss: 0.7494, test_loss: 1.0518, test_f1: 0.5697
 epoch: 92, train_loss: 0.7451, test_loss: 1.0234, test_f1: 0.6293
 epoch: 93, train_loss: 0.7505, test_loss: 1.0343, test_f1: 0.5898
 epoch: 94, train_loss: 0.7561, test_loss: 1.0238, test_f1: 0.6389
 epoch: 95, train_loss: 0.7322, test_loss: 1.0709, test_f1: 0.6197
 epoch: 96, train_loss: 0.7483, test_loss: 1.0309, test_f1: 0.6333
 epoch: 97, train_loss: 0.7261, test_loss: 1.0809, test_f1: 0.6328
 epoch: 98, train_loss: 0.7443, test_loss: 1.0883, test_f1: 0.6322
 epoch: 99, train_loss: 0.7428, test_loss: 0.9834, test_f1: 0.6229
##################ITERATION #7 ****************************************
 epoch: 0, train_loss: 1.1638, test_loss: 1.1619, test_f1: 0.3847
 epoch: 1, train_loss: 1.0396, test_loss: 1.0541, test_f1: 0.4351
 epoch: 2, train_loss: 1.0133, test_loss: 1.0366, test_f1: 0.4212
 epoch: 3, train_loss: 0.9953, test_loss: 1.0001, test_f1: 0.5082
 epoch: 4, train_loss: 0.9977, test_loss: 1.0902, test_f1: 0.4345
 epoch: 5, train_loss: 0.9868, test_loss: 1.0319, test_f1: 0.4624
 epoch: 6, train_loss: 0.9827, test_loss: 1.0158, test_f1: 0.4689
 epoch: 7, train_loss: 0.9699, test_loss: 1.0620, test_f1: 0.4528
 epoch: 8, train_loss: 0.9699, test_loss: 0.9736, test_f1: 0.4550
 epoch: 9, train_loss: 0.9612, test_loss: 1.0307, test_f1: 0.4575
 epoch: 10, train_loss: 0.9393, test_loss: 1.0849, test_f1: 0.4266
 epoch: 11, train_loss: 0.9496, test_loss: 0.9941, test_f1: 0.5077
 epoch: 12, train_loss: 0.9619, test_loss: 0.9398, test_f1: 0.4811
 epoch: 13, train_loss: 0.9444, test_loss: 1.0476, test_f1: 0.4893
 epoch: 14, train_loss: 0.9400, test_loss: 0.9378, test_f1: 0.4609
 epoch: 15, train_loss: 0.9389, test_loss: 0.9379, test_f1: 0.4791
 epoch: 16, train_loss: 0.9711, test_loss: 0.9477, test_f1: 0.4824
 epoch: 17, train_loss: 0.9359, test_loss: 0.9790, test_f1: 0.4940
 epoch: 18, train_loss: 0.9207, test_loss: 0.9978, test_f1: 0.4809
 epoch: 19, train_loss: 0.9264, test_loss: 0.8894, test_f1: 0.5184
 epoch: 20, train_loss: 0.9224, test_loss: 0.9670, test_f1: 0.4913
 epoch: 21, train_loss: 0.9140, test_loss: 0.9661, test_f1: 0.4842
 epoch: 22, train_loss: 0.9433, test_loss: 0.9965, test_f1: 0.4780
 epoch: 23, train_loss: 0.9251, test_loss: 0.9852, test_f1: 0.4967
 epoch: 24, train_loss: 0.9257, test_loss: 0.9954, test_f1: 0.4934
 epoch: 25, train_loss: 0.9007, test_loss: 1.0049, test_f1: 0.4879
 epoch: 26, train_loss: 0.9153, test_loss: 1.0013, test_f1: 0.4822
 epoch: 27, train_loss: 0.9069, test_loss: 0.9628, test_f1: 0.4874
 epoch: 28, train_loss: 0.9038, test_loss: 0.9915, test_f1: 0.4996
 epoch: 29, train_loss: 0.8933, test_loss: 0.9855, test_f1: 0.4956
 epoch: 30, train_loss: 0.8914, test_loss: 0.9741, test_f1: 0.5542
 epoch: 31, train_loss: 0.8891, test_loss: 0.9934, test_f1: 0.4948
 epoch: 32, train_loss: 0.8871, test_loss: 0.9961, test_f1: 0.5019
 epoch: 33, train_loss: 0.8957, test_loss: 0.9944, test_f1: 0.4892
 epoch: 34, train_loss: 0.8764, test_loss: 0.9582, test_f1: 0.5380
 epoch: 35, train_loss: 0.8805, test_loss: 0.9947, test_f1: 0.5085
 epoch: 36, train_loss: 0.8874, test_loss: 0.9918, test_f1: 0.4979
 epoch: 37, train_loss: 0.8699, test_loss: 0.9891, test_f1: 0.4988
 epoch: 38, train_loss: 0.8652, test_loss: 0.8984, test_f1: 0.4990
 epoch: 39, train_loss: 0.8764, test_loss: 0.9817, test_f1: 0.4879
 epoch: 40, train_loss: 0.8672, test_loss: 0.9434, test_f1: 0.4844
 epoch: 41, train_loss: 0.8779, test_loss: 0.9710, test_f1: 0.4821
 epoch: 42, train_loss: 0.9058, test_loss: 0.9525, test_f1: 0.4981
 epoch: 43, train_loss: 0.8722, test_loss: 0.9036, test_f1: 0.4929
 epoch: 44, train_loss: 0.8714, test_loss: 0.9631, test_f1: 0.5015
 epoch: 45, train_loss: 0.8594, test_loss: 0.9254, test_f1: 0.5648
 epoch: 46, train_loss: 0.8731, test_loss: 0.9911, test_f1: 0.5596
 epoch: 47, train_loss: 0.8740, test_loss: 0.9547, test_f1: 0.4788
 epoch: 48, train_loss: 0.8622, test_loss: 0.9593, test_f1: 0.5080
 epoch: 49, train_loss: 0.8584, test_loss: 0.9091, test_f1: 0.5835
 epoch: 50, train_loss: 0.8551, test_loss: 0.9232, test_f1: 0.5121
 epoch: 51, train_loss: 0.8457, test_loss: 0.9391, test_f1: 0.5145
 epoch: 52, train_loss: 0.8288, test_loss: 0.9259, test_f1: 0.5838
 epoch: 53, train_loss: 0.8314, test_loss: 0.9364, test_f1: 0.5488
 epoch: 54, train_loss: 0.8144, test_loss: 0.9263, test_f1: 0.5618
 epoch: 55, train_loss: 0.8078, test_loss: 0.9392, test_f1: 0.5686
 epoch: 56, train_loss: 0.8229, test_loss: 0.9230, test_f1: 0.5546
 epoch: 57, train_loss: 0.8067, test_loss: 0.9126, test_f1: 0.5507
 epoch: 58, train_loss: 0.8120, test_loss: 0.9406, test_f1: 0.5120
 epoch: 59, train_loss: 0.7983, test_loss: 0.9165, test_f1: 0.5767
 epoch: 60, train_loss: 0.8135, test_loss: 0.9250, test_f1: 0.5854
 epoch: 61, train_loss: 0.8110, test_loss: 1.0010, test_f1: 0.5606
 epoch: 62, train_loss: 0.8063, test_loss: 0.8904, test_f1: 0.5991
 epoch: 63, train_loss: 0.7893, test_loss: 0.9294, test_f1: 0.5801
 epoch: 64, train_loss: 0.8035, test_loss: 0.9422, test_f1: 0.5742
 epoch: 65, train_loss: 0.8008, test_loss: 0.9755, test_f1: 0.5514
 epoch: 66, train_loss: 0.7870, test_loss: 0.9591, test_f1: 0.5815
 epoch: 67, train_loss: 0.8006, test_loss: 0.9500, test_f1: 0.5871
 epoch: 68, train_loss: 0.7879, test_loss: 0.9819, test_f1: 0.5796
 epoch: 69, train_loss: 0.7817, test_loss: 0.9448, test_f1: 0.6035
 epoch: 70, train_loss: 0.7867, test_loss: 0.9859, test_f1: 0.5727
 epoch: 71, train_loss: 0.7800, test_loss: 0.9782, test_f1: 0.5681
 epoch: 72, train_loss: 0.7895, test_loss: 0.9435, test_f1: 0.5855
 epoch: 73, train_loss: 0.7850, test_loss: 0.9216, test_f1: 0.6086
 epoch: 74, train_loss: 0.7842, test_loss: 0.9483, test_f1: 0.5910
 epoch: 75, train_loss: 0.7752, test_loss: 0.9766, test_f1: 0.5798
 epoch: 76, train_loss: 0.7871, test_loss: 0.9759, test_f1: 0.5936
 epoch: 77, train_loss: 0.7744, test_loss: 0.9306, test_f1: 0.6129
 epoch: 78, train_loss: 0.7771, test_loss: 0.9239, test_f1: 0.5942
 epoch: 79, train_loss: 0.7834, test_loss: 0.9089, test_f1: 0.5971
 epoch: 80, train_loss: 0.7756, test_loss: 1.0000, test_f1: 0.5921
 epoch: 81, train_loss: 0.7666, test_loss: 0.8964, test_f1: 0.6308
 epoch: 82, train_loss: 0.7768, test_loss: 0.9634, test_f1: 0.6537
 epoch: 83, train_loss: 0.7800, test_loss: 0.9898, test_f1: 0.5916
 epoch: 84, train_loss: 0.7673, test_loss: 1.1075, test_f1: 0.5636
 epoch: 85, train_loss: 0.8031, test_loss: 1.0180, test_f1: 0.6038
 epoch: 86, train_loss: 0.7934, test_loss: 0.9890, test_f1: 0.5964
 epoch: 87, train_loss: 0.7675, test_loss: 0.9446, test_f1: 0.6286
 epoch: 88, train_loss: 0.7637, test_loss: 0.9844, test_f1: 0.6140
 epoch: 89, train_loss: 0.7618, test_loss: 0.9736, test_f1: 0.5710
 epoch: 90, train_loss: 0.7639, test_loss: 0.9018, test_f1: 0.6140
 epoch: 91, train_loss: 0.7580, test_loss: 0.9857, test_f1: 0.6024
 epoch: 92, train_loss: 0.7489, test_loss: 0.9547, test_f1: 0.6082
 epoch: 93, train_loss: 0.7654, test_loss: 0.9463, test_f1: 0.6039
 epoch: 94, train_loss: 0.7445, test_loss: 0.9520, test_f1: 0.6149
 epoch: 95, train_loss: 0.7482, test_loss: 0.9890, test_f1: 0.6126
 epoch: 96, train_loss: 0.7509, test_loss: 0.9500, test_f1: 0.6183
 epoch: 97, train_loss: 0.7449, test_loss: 0.9945, test_f1: 0.6057
 epoch: 98, train_loss: 0.7547, test_loss: 0.9460, test_f1: 0.6040
 epoch: 99, train_loss: 0.7382, test_loss: 1.0168, test_f1: 0.5925
##################ITERATION #8 ****************************************
 epoch: 0, train_loss: 1.1605, test_loss: 1.0626, test_f1: 0.4594
 epoch: 1, train_loss: 1.0309, test_loss: 1.1082, test_f1: 0.4463
 epoch: 2, train_loss: 1.0276, test_loss: 1.0387, test_f1: 0.4413
 epoch: 3, train_loss: 1.0083, test_loss: 1.0282, test_f1: 0.4814
 epoch: 4, train_loss: 0.9974, test_loss: 1.0694, test_f1: 0.4769
 epoch: 5, train_loss: 0.9828, test_loss: 0.9807, test_f1: 0.4707
 epoch: 6, train_loss: 0.9732, test_loss: 1.0447, test_f1: 0.4668
 epoch: 7, train_loss: 0.9739, test_loss: 0.9891, test_f1: 0.4880
 epoch: 8, train_loss: 0.9510, test_loss: 0.9378, test_f1: 0.4806
 epoch: 9, train_loss: 0.9726, test_loss: 0.9777, test_f1: 0.4690
 epoch: 10, train_loss: 0.9430, test_loss: 0.9932, test_f1: 0.4985
 epoch: 11, train_loss: 0.9608, test_loss: 0.9911, test_f1: 0.4750
 epoch: 12, train_loss: 0.9505, test_loss: 1.0487, test_f1: 0.4808
 epoch: 13, train_loss: 0.9335, test_loss: 1.0521, test_f1: 0.4812
 epoch: 14, train_loss: 0.9381, test_loss: 1.0497, test_f1: 0.5028
 epoch: 15, train_loss: 0.9365, test_loss: 1.0052, test_f1: 0.4941
 epoch: 16, train_loss: 0.9341, test_loss: 0.9925, test_f1: 0.4986
 epoch: 17, train_loss: 0.9224, test_loss: 0.9298, test_f1: 0.4979
 epoch: 18, train_loss: 0.9171, test_loss: 0.9190, test_f1: 0.4839
 epoch: 19, train_loss: 0.9203, test_loss: 0.9789, test_f1: 0.5048
 epoch: 20, train_loss: 0.9153, test_loss: 0.9719, test_f1: 0.4957
 epoch: 21, train_loss: 0.9043, test_loss: 0.9784, test_f1: 0.5437
 epoch: 22, train_loss: 0.9038, test_loss: 1.0017, test_f1: 0.5284
 epoch: 23, train_loss: 0.9081, test_loss: 0.9819, test_f1: 0.5055
 epoch: 24, train_loss: 0.9031, test_loss: 0.9839, test_f1: 0.5094
 epoch: 25, train_loss: 0.9432, test_loss: 0.9959, test_f1: 0.4919
 epoch: 26, train_loss: 0.9311, test_loss: 0.9540, test_f1: 0.5075
 epoch: 27, train_loss: 0.9068, test_loss: 0.9662, test_f1: 0.5042
 epoch: 28, train_loss: 0.9179, test_loss: 1.0393, test_f1: 0.5408
 epoch: 29, train_loss: 0.9104, test_loss: 1.0731, test_f1: 0.5184
 epoch: 30, train_loss: 0.9411, test_loss: 1.0188, test_f1: 0.4779
 epoch: 31, train_loss: 0.9093, test_loss: 1.0010, test_f1: 0.5017
 epoch: 32, train_loss: 0.8999, test_loss: 0.9788, test_f1: 0.5089
 epoch: 33, train_loss: 0.8893, test_loss: 0.9237, test_f1: 0.5140
 epoch: 34, train_loss: 0.8885, test_loss: 1.0260, test_f1: 0.4952
 epoch: 35, train_loss: 0.8867, test_loss: 0.9928, test_f1: 0.5847
 epoch: 36, train_loss: 0.8791, test_loss: 1.0408, test_f1: 0.5957
 epoch: 37, train_loss: 0.8695, test_loss: 0.9819, test_f1: 0.5243
 epoch: 38, train_loss: 0.8735, test_loss: 0.8744, test_f1: 0.5718
 epoch: 39, train_loss: 0.8755, test_loss: 1.0434, test_f1: 0.5256
 epoch: 40, train_loss: 0.8582, test_loss: 0.9323, test_f1: 0.5738
 epoch: 41, train_loss: 0.8693, test_loss: 0.9636, test_f1: 0.5591
 epoch: 42, train_loss: 0.8489, test_loss: 0.9966, test_f1: 0.5997
 epoch: 43, train_loss: 0.8616, test_loss: 1.0130, test_f1: 0.4999
 epoch: 44, train_loss: 0.8364, test_loss: 0.9798, test_f1: 0.5708
 epoch: 45, train_loss: 0.8341, test_loss: 1.0864, test_f1: 0.6187
 epoch: 46, train_loss: 0.8306, test_loss: 1.0059, test_f1: 0.5171
 epoch: 47, train_loss: 0.8513, test_loss: 0.9637, test_f1: 0.5862
 epoch: 48, train_loss: 0.8374, test_loss: 1.0044, test_f1: 0.5611
 epoch: 49, train_loss: 0.8470, test_loss: 1.0085, test_f1: 0.6078
 epoch: 50, train_loss: 0.8431, test_loss: 1.0304, test_f1: 0.5677
 epoch: 51, train_loss: 0.8124, test_loss: 1.0141, test_f1: 0.6136
 epoch: 52, train_loss: 0.7985, test_loss: 1.0112, test_f1: 0.6270
 epoch: 53, train_loss: 0.7927, test_loss: 0.9402, test_f1: 0.6087
 epoch: 54, train_loss: 0.7976, test_loss: 1.0905, test_f1: 0.5891
 epoch: 55, train_loss: 0.8016, test_loss: 1.0085, test_f1: 0.6245
 epoch: 56, train_loss: 0.8001, test_loss: 1.0427, test_f1: 0.6059
 epoch: 57, train_loss: 0.7917, test_loss: 0.9820, test_f1: 0.6364
 epoch: 58, train_loss: 0.7905, test_loss: 0.9697, test_f1: 0.6234
 epoch: 59, train_loss: 0.7935, test_loss: 0.9927, test_f1: 0.5969
 epoch: 60, train_loss: 0.7843, test_loss: 0.9608, test_f1: 0.6237
 epoch: 61, train_loss: 0.7820, test_loss: 1.0321, test_f1: 0.6274
 epoch: 62, train_loss: 0.7697, test_loss: 1.0411, test_f1: 0.6287
 epoch: 63, train_loss: 0.7735, test_loss: 1.0051, test_f1: 0.6279
 epoch: 64, train_loss: 0.7826, test_loss: 0.9733, test_f1: 0.6303
 epoch: 65, train_loss: 0.7609, test_loss: 1.0068, test_f1: 0.6161
 epoch: 66, train_loss: 0.7701, test_loss: 0.9817, test_f1: 0.6159
 epoch: 67, train_loss: 0.7667, test_loss: 0.9990, test_f1: 0.6201
 epoch: 68, train_loss: 0.7592, test_loss: 0.9971, test_f1: 0.5914
 epoch: 69, train_loss: 0.7692, test_loss: 0.9434, test_f1: 0.6521
 epoch: 70, train_loss: 0.7573, test_loss: 0.9429, test_f1: 0.6332
 epoch: 71, train_loss: 0.7695, test_loss: 0.8995, test_f1: 0.6335
 epoch: 72, train_loss: 0.7542, test_loss: 0.9812, test_f1: 0.6068
 epoch: 73, train_loss: 0.7447, test_loss: 0.9890, test_f1: 0.6047
 epoch: 74, train_loss: 0.7654, test_loss: 1.0212, test_f1: 0.6333
 epoch: 75, train_loss: 0.7673, test_loss: 0.9425, test_f1: 0.6198
 epoch: 76, train_loss: 0.7562, test_loss: 0.9335, test_f1: 0.6206
 epoch: 77, train_loss: 0.7475, test_loss: 1.0093, test_f1: 0.6497
 epoch: 78, train_loss: 0.7432, test_loss: 0.9964, test_f1: 0.6333
 epoch: 79, train_loss: 0.7407, test_loss: 0.9646, test_f1: 0.6436
 epoch: 80, train_loss: 0.7437, test_loss: 0.9325, test_f1: 0.6474
 epoch: 81, train_loss: 0.7547, test_loss: 1.0084, test_f1: 0.6065
 epoch: 82, train_loss: 0.7412, test_loss: 0.9913, test_f1: 0.6472
 epoch: 83, train_loss: 0.7442, test_loss: 1.0329, test_f1: 0.6071
 epoch: 84, train_loss: 0.7409, test_loss: 0.9739, test_f1: 0.6326
 epoch: 85, train_loss: 0.7499, test_loss: 0.9903, test_f1: 0.6095
 epoch: 86, train_loss: 0.7249, test_loss: 3.2341, test_f1: 0.5845
 epoch: 87, train_loss: 0.7431, test_loss: 1.0424, test_f1: 0.6196
 epoch: 88, train_loss: 0.7360, test_loss: 1.0206, test_f1: 0.6149
 epoch: 89, train_loss: 0.7572, test_loss: 0.9856, test_f1: 0.6237
 epoch: 90, train_loss: 0.7453, test_loss: 0.9998, test_f1: 0.6304
 epoch: 91, train_loss: 0.7247, test_loss: 1.0543, test_f1: 0.6363
 epoch: 92, train_loss: 0.7311, test_loss: 1.2874, test_f1: 0.5889
 epoch: 93, train_loss: 0.7304, test_loss: 0.9835, test_f1: 0.6400
 epoch: 94, train_loss: 0.7290, test_loss: 0.9359, test_f1: 0.6530
 epoch: 95, train_loss: 0.7359, test_loss: 0.9444, test_f1: 0.6414
 epoch: 96, train_loss: 0.7287, test_loss: 1.0144, test_f1: 0.6261
 epoch: 97, train_loss: 0.7201, test_loss: 0.9110, test_f1: 0.6544
 epoch: 98, train_loss: 0.7334, test_loss: 0.9840, test_f1: 0.6371
 epoch: 99, train_loss: 0.7141, test_loss: 1.0106, test_f1: 0.6070
##################ITERATION #9 ****************************************
 epoch: 0, train_loss: 1.1382, test_loss: 1.1093, test_f1: 0.3916
 epoch: 1, train_loss: 1.0262, test_loss: 1.0815, test_f1: 0.3809
 epoch: 2, train_loss: 1.0079, test_loss: 1.0819, test_f1: 0.4295
 epoch: 3, train_loss: 1.0146, test_loss: 1.0045, test_f1: 0.4409
 epoch: 4, train_loss: 0.9865, test_loss: 1.0353, test_f1: 0.4899
 epoch: 5, train_loss: 0.9881, test_loss: 1.2376, test_f1: 0.3861
 epoch: 6, train_loss: 0.9728, test_loss: 0.9341, test_f1: 0.4956
 epoch: 7, train_loss: 0.9680, test_loss: 0.9915, test_f1: 0.4657
 epoch: 8, train_loss: 0.9630, test_loss: 1.0022, test_f1: 0.5000
 epoch: 9, train_loss: 0.9631, test_loss: 0.9992, test_f1: 0.4750
 epoch: 10, train_loss: 0.9609, test_loss: 0.9889, test_f1: 0.5290
 epoch: 11, train_loss: 0.9417, test_loss: 0.9332, test_f1: 0.4996
 epoch: 12, train_loss: 0.9375, test_loss: 1.0545, test_f1: 0.4733
 epoch: 13, train_loss: 0.9363, test_loss: 1.0053, test_f1: 0.5307
 epoch: 14, train_loss: 0.9398, test_loss: 0.9420, test_f1: 0.4863
 epoch: 15, train_loss: 0.9260, test_loss: 0.9244, test_f1: 0.5387
 epoch: 16, train_loss: 0.9363, test_loss: 1.0381, test_f1: 0.5217
 epoch: 17, train_loss: 0.9414, test_loss: 1.0544, test_f1: 0.5477
 epoch: 18, train_loss: 0.9453, test_loss: 1.0153, test_f1: 0.5340
 epoch: 19, train_loss: 0.9286, test_loss: 0.9903, test_f1: 0.4903
 epoch: 20, train_loss: 0.9439, test_loss: 0.9638, test_f1: 0.5665
 epoch: 21, train_loss: 0.9182, test_loss: 1.0058, test_f1: 0.5554
 epoch: 22, train_loss: 0.9011, test_loss: 0.9895, test_f1: 0.5482
 epoch: 23, train_loss: 0.9093, test_loss: 1.0006, test_f1: 0.5146
 epoch: 24, train_loss: 0.9064, test_loss: 0.9635, test_f1: 0.5753
 epoch: 25, train_loss: 0.9199, test_loss: 0.9939, test_f1: 0.4856
 epoch: 26, train_loss: 0.9175, test_loss: 0.9832, test_f1: 0.5512
 epoch: 27, train_loss: 0.8988, test_loss: 1.0085, test_f1: 0.5477
 epoch: 28, train_loss: 0.9027, test_loss: 0.9972, test_f1: 0.5703
 epoch: 29, train_loss: 0.8936, test_loss: 0.9463, test_f1: 0.5002
 epoch: 30, train_loss: 0.8926, test_loss: 0.9699, test_f1: 0.5318
 epoch: 31, train_loss: 0.8943, test_loss: 0.9951, test_f1: 0.4992
 epoch: 32, train_loss: 0.8918, test_loss: 1.0056, test_f1: 0.5660
 epoch: 33, train_loss: 0.8809, test_loss: 0.9547, test_f1: 0.5547
 epoch: 34, train_loss: 0.8675, test_loss: 0.9420, test_f1: 0.5730
 epoch: 35, train_loss: 0.8662, test_loss: 0.9801, test_f1: 0.5852
 epoch: 36, train_loss: 0.8523, test_loss: 0.9961, test_f1: 0.5231
 epoch: 37, train_loss: 0.8579, test_loss: 1.0540, test_f1: 0.5714
 epoch: 38, train_loss: 0.8633, test_loss: 0.9794, test_f1: 0.5443
 epoch: 39, train_loss: 0.8557, test_loss: 0.9854, test_f1: 0.6026
 epoch: 40, train_loss: 0.8531, test_loss: 0.9887, test_f1: 0.5866
 epoch: 41, train_loss: 0.8545, test_loss: 0.9600, test_f1: 0.5737
 epoch: 42, train_loss: 0.8570, test_loss: 0.9314, test_f1: 0.5550
 epoch: 43, train_loss: 0.8574, test_loss: 0.9586, test_f1: 0.5361
 epoch: 44, train_loss: 0.8592, test_loss: 0.9394, test_f1: 0.5686
 epoch: 45, train_loss: 0.8422, test_loss: 0.9472, test_f1: 0.5924
 epoch: 46, train_loss: 0.8563, test_loss: 0.9413, test_f1: 0.5253
 epoch: 47, train_loss: 0.8448, test_loss: 0.9689, test_f1: 0.5416
 epoch: 48, train_loss: 0.8324, test_loss: 0.9802, test_f1: 0.5914
 epoch: 49, train_loss: 0.8191, test_loss: 0.9684, test_f1: 0.5921
 epoch: 50, train_loss: 0.8364, test_loss: 0.9319, test_f1: 0.5957
 epoch: 51, train_loss: 0.7957, test_loss: 0.9690, test_f1: 0.6203
 epoch: 52, train_loss: 0.7943, test_loss: 0.9672, test_f1: 0.6084
 epoch: 53, train_loss: 0.8044, test_loss: 1.0052, test_f1: 0.6281
 epoch: 54, train_loss: 0.7924, test_loss: 0.9362, test_f1: 0.6063
 epoch: 55, train_loss: 0.7902, test_loss: 0.9515, test_f1: 0.6206
 epoch: 56, train_loss: 0.7918, test_loss: 0.9412, test_f1: 0.6140
 epoch: 57, train_loss: 0.7808, test_loss: 0.9289, test_f1: 0.6369
 epoch: 58, train_loss: 0.7702, test_loss: 0.9350, test_f1: 0.6056
 epoch: 59, train_loss: 0.7758, test_loss: 0.9697, test_f1: 0.6434
 epoch: 60, train_loss: 0.7762, test_loss: 0.9381, test_f1: 0.6286
 epoch: 61, train_loss: 0.7669, test_loss: 0.9749, test_f1: 0.5931
 epoch: 62, train_loss: 0.7704, test_loss: 0.9783, test_f1: 0.6386
 epoch: 63, train_loss: 0.7709, test_loss: 0.9546, test_f1: 0.6010
 epoch: 64, train_loss: 0.7654, test_loss: 0.9625, test_f1: 0.6261
 epoch: 65, train_loss: 0.7711, test_loss: 0.9650, test_f1: 0.6430
 epoch: 66, train_loss: 0.7794, test_loss: 0.9991, test_f1: 0.6083
 epoch: 67, train_loss: 0.7648, test_loss: 0.9575, test_f1: 0.5972
 epoch: 68, train_loss: 0.7616, test_loss: 1.0298, test_f1: 0.5948
 epoch: 69, train_loss: 0.7451, test_loss: 0.9733, test_f1: 0.6360
 epoch: 70, train_loss: 0.7507, test_loss: 0.9957, test_f1: 0.6392
 epoch: 71, train_loss: 0.7553, test_loss: 0.9675, test_f1: 0.6341
 epoch: 72, train_loss: 0.7733, test_loss: 0.9969, test_f1: 0.6222
 epoch: 73, train_loss: 0.7531, test_loss: 1.0113, test_f1: 0.6273
 epoch: 74, train_loss: 0.7566, test_loss: 1.0069, test_f1: 0.6243
 epoch: 75, train_loss: 0.7545, test_loss: 0.9725, test_f1: 0.6413
 epoch: 76, train_loss: 0.7534, test_loss: 1.0077, test_f1: 0.6384
 epoch: 77, train_loss: 0.7612, test_loss: 1.0284, test_f1: 0.6447
 epoch: 78, train_loss: 0.7541, test_loss: 0.9616, test_f1: 0.6471
 epoch: 79, train_loss: 0.7540, test_loss: 0.9792, test_f1: 0.6299
 epoch: 80, train_loss: 0.7476, test_loss: 0.9883, test_f1: 0.6240
 epoch: 81, train_loss: 0.7393, test_loss: 1.0396, test_f1: 0.6586
 epoch: 82, train_loss: 0.7294, test_loss: 1.0295, test_f1: 0.6503
 epoch: 83, train_loss: 0.7358, test_loss: 0.9624, test_f1: 0.6292
 epoch: 84, train_loss: 0.7418, test_loss: 0.9715, test_f1: 0.6344
 epoch: 85, train_loss: 0.7423, test_loss: 0.9919, test_f1: 0.6294
 epoch: 86, train_loss: 0.7459, test_loss: 1.0173, test_f1: 0.5851
 epoch: 87, train_loss: 0.7225, test_loss: 1.0208, test_f1: 0.6313
 epoch: 88, train_loss: 0.7390, test_loss: 1.0312, test_f1: 0.6379
 epoch: 89, train_loss: 0.7318, test_loss: 1.0795, test_f1: 0.6324
 epoch: 90, train_loss: 0.7272, test_loss: 1.0715, test_f1: 0.6261
 epoch: 91, train_loss: 0.7257, test_loss: 1.0425, test_f1: 0.6173
 epoch: 92, train_loss: 0.7358, test_loss: 0.9980, test_f1: 0.6245
 epoch: 93, train_loss: 0.7302, test_loss: 1.0533, test_f1: 0.6433
 epoch: 94, train_loss: 0.7340, test_loss: 1.0344, test_f1: 0.6275
 epoch: 95, train_loss: 0.7269, test_loss: 1.0600, test_f1: 0.6026
 epoch: 96, train_loss: 0.7304, test_loss: 1.1028, test_f1: 0.5972
 epoch: 97, train_loss: 0.7244, test_loss: 1.0735, test_f1: 0.5987
 epoch: 98, train_loss: 0.7360, test_loss: 1.0804, test_f1: 0.6383
 epoch: 99, train_loss: 0.7231, test_loss: 1.0224, test_f1: 0.6418

Training completed in 1130.98 seconds
Best F1: 0.6668 at epoch 81
Mean F1 across iterations: 0.6528  0.0108
========================FINAL RESULTS================================
FEGIN weighted F1: 0.6668  0.0108
python main.py --data ltspice_examples --representation component_net --model FEGIN --layers 4 --hiddens 32 --batch_size 32 --lr 0.01 --emb_size 128 --epochs 100 --save_appendix component_net_L4_H32_BS32_LR0.01_E128 --no_val
-----



STDERR:
  File "main.py", line 370, in <module>
    main()
  File "main.py", line 254, in main
    dataset = dataset_class(
  File "/home/philip/projects/llm_inference_code_repo/Circuit-Completion-Using-GNNs/component_classification_with_link_prediction_head/evaluation/FEGIN/kernel/circuit_datasets.py", line 15, in __init__
    self.data, self.slices = torch.load(self.processed_paths[0])
  File "/home/philip/.local/lib/python3.8/site-packages/torch/serialization.py", line 1040, in load
    warnings.warn(
  File "/usr/lib/python3.8/warnings.py", line 109, in _showwarnmsg
    sw(msg.message, msg.category, msg.filename, msg.lineno,
  File "main.py", line 47, in warn_with_traceback
    traceback.print_stack(file=log)
/home/philip/projects/llm_inference_code_repo/Circuit-Completion-Using-GNNs/component_classification_with_link_prediction_head/evaluation/FEGIN/kernel/circuit_datasets.py:15: FutureWarning: You are using `torch.load` with `weights_only=False` (the current default value), which uses the default pickle module implicitly. It is possible to construct malicious pickle data which will execute arbitrary code during unpickling (See https://github.com/pytorch/pytorch/blob/main/SECURITY.md#untrusted-models for more details). In a future release, the default value for `weights_only` will be flipped to `True`. This limits the functions that could be executed during unpickling. Arbitrary objects will no longer be allowed to be loaded via this mode unless they are explicitly allowlisted by the user via `torch.serialization.add_safe_globals`. We recommend you start setting `weights_only=True` for any use case where you don't have full control of the loaded file. Please open an issue on GitHub for any issues related to this experimental feature.
  self.data, self.slices = torch.load(self.processed_paths[0])
