STDOUT:
Results will be saved in /home/philip/projects/ltspice_examples_code_repo/Circuit-Completion-Using-GNNs/component_classification_with_link_prediction_head/evaluation/FEGIN/results/model_FEGIN_dataset_ltspice_examples
Command line input: python main.py --data ltspice_examples --representation component_pin --model FEGIN --layers 4 --hiddens 32 --batch_size 256 --lr 0.001 --emb_size 128 --epochs 100 --save_appendix component_pin_L4_H32_BS256_LR0.001_E128 --no_val
 is saved.
-----
ltspice_examples - FEGIN
Using 4 layers, 32 hidden units, h = 2
Loading component_pin representation dataset
ENTERED
Training FEGIN on component_pin representation
Train: 3560, Test: 848
##################ITERATION #0 ****************************************
 epoch: 0, train_loss: 1.3457, test_loss: 1.3400, test_f1: 0.2260
 epoch: 1, train_loss: 1.3089, test_loss: 1.3233, test_f1: 0.2260
 epoch: 2, train_loss: 1.2632, test_loss: 1.2995, test_f1: 0.2260
 epoch: 3, train_loss: 1.2072, test_loss: 1.2771, test_f1: 0.2260
 epoch: 4, train_loss: 1.1498, test_loss: 1.3153, test_f1: 0.2260
 epoch: 5, train_loss: 1.0903, test_loss: 1.1888, test_f1: 0.2601
 epoch: 6, train_loss: 1.0471, test_loss: 1.0616, test_f1: 0.3374
 epoch: 7, train_loss: 1.0171, test_loss: 1.0112, test_f1: 0.3820
 epoch: 8, train_loss: 1.0019, test_loss: 1.0204, test_f1: 0.3460
 epoch: 9, train_loss: 0.9967, test_loss: 1.0674, test_f1: 0.3522
 epoch: 10, train_loss: 0.9813, test_loss: 1.0251, test_f1: 0.3742
 epoch: 11, train_loss: 0.9688, test_loss: 1.0868, test_f1: 0.3644
 epoch: 12, train_loss: 0.9630, test_loss: 0.9782, test_f1: 0.4482
 epoch: 13, train_loss: 0.9482, test_loss: 0.9977, test_f1: 0.3936
 epoch: 14, train_loss: 0.9353, test_loss: 0.9877, test_f1: 0.4725
 epoch: 15, train_loss: 0.9304, test_loss: 0.9636, test_f1: 0.4663
 epoch: 16, train_loss: 0.9142, test_loss: 0.9373, test_f1: 0.4691
 epoch: 17, train_loss: 0.9131, test_loss: 1.0603, test_f1: 0.4703
 epoch: 18, train_loss: 0.9037, test_loss: 1.0589, test_f1: 0.4436
 epoch: 19, train_loss: 0.8953, test_loss: 0.9564, test_f1: 0.4707
 epoch: 20, train_loss: 0.8867, test_loss: 0.9406, test_f1: 0.4763
 epoch: 21, train_loss: 0.8734, test_loss: 0.9085, test_f1: 0.4972
 epoch: 22, train_loss: 0.8558, test_loss: 1.1039, test_f1: 0.4428
 epoch: 23, train_loss: 0.8558, test_loss: 1.0669, test_f1: 0.4803
 epoch: 24, train_loss: 0.8397, test_loss: 0.9445, test_f1: 0.4592
 epoch: 25, train_loss: 0.8411, test_loss: 0.9590, test_f1: 0.4768
 epoch: 26, train_loss: 0.8228, test_loss: 0.9773, test_f1: 0.4875
 epoch: 27, train_loss: 0.8117, test_loss: 0.9832, test_f1: 0.4880
 epoch: 28, train_loss: 0.8093, test_loss: 1.0130, test_f1: 0.4630
 epoch: 29, train_loss: 0.7982, test_loss: 1.0737, test_f1: 0.4777
 epoch: 30, train_loss: 0.7943, test_loss: 0.9585, test_f1: 0.4725
 epoch: 31, train_loss: 0.7899, test_loss: 0.8994, test_f1: 0.4849
 epoch: 32, train_loss: 0.7715, test_loss: 0.9175, test_f1: 0.5166
 epoch: 33, train_loss: 0.7731, test_loss: 0.9129, test_f1: 0.4969
 epoch: 34, train_loss: 0.7728, test_loss: 1.2036, test_f1: 0.4385
 epoch: 35, train_loss: 0.7514, test_loss: 0.9537, test_f1: 0.5005
 epoch: 36, train_loss: 0.7511, test_loss: 0.9657, test_f1: 0.5041
 epoch: 37, train_loss: 0.7475, test_loss: 0.9697, test_f1: 0.5007
 epoch: 38, train_loss: 0.7490, test_loss: 0.9162, test_f1: 0.5257
 epoch: 39, train_loss: 0.7169, test_loss: 0.9828, test_f1: 0.5049
 epoch: 40, train_loss: 0.7175, test_loss: 0.9420, test_f1: 0.5163
 epoch: 41, train_loss: 0.7053, test_loss: 0.9358, test_f1: 0.5033
 epoch: 42, train_loss: 0.6950, test_loss: 1.0344, test_f1: 0.4995
 epoch: 43, train_loss: 0.6990, test_loss: 1.0133, test_f1: 0.5053
 epoch: 44, train_loss: 0.6954, test_loss: 0.9737, test_f1: 0.5279
 epoch: 45, train_loss: 0.6811, test_loss: 0.9918, test_f1: 0.5084
 epoch: 46, train_loss: 0.6785, test_loss: 1.0457, test_f1: 0.4991
 epoch: 47, train_loss: 0.6889, test_loss: 0.9640, test_f1: 0.5190
 epoch: 48, train_loss: 0.6764, test_loss: 0.9977, test_f1: 0.5268
 epoch: 49, train_loss: 0.6679, test_loss: 1.0189, test_f1: 0.5200
 epoch: 50, train_loss: 0.6735, test_loss: 0.9761, test_f1: 0.5231
 epoch: 51, train_loss: 0.6567, test_loss: 0.9670, test_f1: 0.5379
 epoch: 52, train_loss: 0.6361, test_loss: 1.1151, test_f1: 0.4919
 epoch: 53, train_loss: 0.6237, test_loss: 1.0288, test_f1: 0.5181
 epoch: 54, train_loss: 0.6221, test_loss: 0.9764, test_f1: 0.5542
 epoch: 55, train_loss: 0.6196, test_loss: 1.0273, test_f1: 0.5275
 epoch: 56, train_loss: 0.6236, test_loss: 1.0303, test_f1: 0.5290
 epoch: 57, train_loss: 0.6129, test_loss: 1.0426, test_f1: 0.5532
 epoch: 58, train_loss: 0.6116, test_loss: 1.0725, test_f1: 0.5272
 epoch: 59, train_loss: 0.6078, test_loss: 1.0876, test_f1: 0.5255
 epoch: 60, train_loss: 0.6052, test_loss: 1.0514, test_f1: 0.5339
 epoch: 61, train_loss: 0.6030, test_loss: 1.0560, test_f1: 0.5358
 epoch: 62, train_loss: 0.6105, test_loss: 1.0502, test_f1: 0.5514
 epoch: 63, train_loss: 0.5942, test_loss: 1.0990, test_f1: 0.5615
 epoch: 64, train_loss: 0.6018, test_loss: 1.0555, test_f1: 0.5643
 epoch: 65, train_loss: 0.6024, test_loss: 1.0070, test_f1: 0.5562
 epoch: 66, train_loss: 0.5943, test_loss: 1.1406, test_f1: 0.5369
 epoch: 67, train_loss: 0.5893, test_loss: 1.1903, test_f1: 0.5223
 epoch: 68, train_loss: 0.6047, test_loss: 1.0798, test_f1: 0.5490
 epoch: 69, train_loss: 0.5872, test_loss: 1.0678, test_f1: 0.5570
 epoch: 70, train_loss: 0.5743, test_loss: 1.1389, test_f1: 0.5443
 epoch: 71, train_loss: 0.5792, test_loss: 1.0468, test_f1: 0.5487
 epoch: 72, train_loss: 0.5709, test_loss: 1.0767, test_f1: 0.5511
 epoch: 73, train_loss: 0.5689, test_loss: 1.0980, test_f1: 0.5729
 epoch: 74, train_loss: 0.5792, test_loss: 1.1248, test_f1: 0.5404
 epoch: 75, train_loss: 0.5593, test_loss: 1.0611, test_f1: 0.5697
 epoch: 76, train_loss: 0.5899, test_loss: 1.1683, test_f1: 0.5510
 epoch: 77, train_loss: 0.5710, test_loss: 1.0696, test_f1: 0.5563
 epoch: 78, train_loss: 0.5754, test_loss: 1.1122, test_f1: 0.5552
 epoch: 79, train_loss: 0.5777, test_loss: 1.1342, test_f1: 0.5719
 epoch: 80, train_loss: 0.5780, test_loss: 1.1236, test_f1: 0.5581
 epoch: 81, train_loss: 0.5787, test_loss: 1.0503, test_f1: 0.5820
 epoch: 82, train_loss: 0.5587, test_loss: 1.0864, test_f1: 0.5860
 epoch: 83, train_loss: 0.5649, test_loss: 1.1242, test_f1: 0.5665
 epoch: 84, train_loss: 0.5635, test_loss: 1.3146, test_f1: 0.5132
 epoch: 85, train_loss: 0.5488, test_loss: 1.0971, test_f1: 0.5821
 epoch: 86, train_loss: 0.5382, test_loss: 1.1037, test_f1: 0.5542
 epoch: 87, train_loss: 0.5510, test_loss: 1.1390, test_f1: 0.5610
 epoch: 88, train_loss: 0.5566, test_loss: 1.1014, test_f1: 0.5801
 epoch: 89, train_loss: 0.5371, test_loss: 1.1291, test_f1: 0.5912
 epoch: 90, train_loss: 0.5526, test_loss: 1.1862, test_f1: 0.5543
 epoch: 91, train_loss: 0.5424, test_loss: 1.2097, test_f1: 0.5365
 epoch: 92, train_loss: 0.5421, test_loss: 1.2864, test_f1: 0.5436
 epoch: 93, train_loss: 0.5439, test_loss: 1.1371, test_f1: 0.5537
 epoch: 94, train_loss: 0.5388, test_loss: 1.1729, test_f1: 0.5790
 epoch: 95, train_loss: 0.5344, test_loss: 1.1522, test_f1: 0.5819
 epoch: 96, train_loss: 0.5466, test_loss: 1.1511, test_f1: 0.5695
 epoch: 97, train_loss: 0.5277, test_loss: 1.1740, test_f1: 0.6027
 epoch: 98, train_loss: 0.5338, test_loss: 1.3118, test_f1: 0.5444
 epoch: 99, train_loss: 0.5298, test_loss: 1.1269, test_f1: 0.6066
##################ITERATION #1 ****************************************
 epoch: 0, train_loss: 1.2874, test_loss: 1.3029, test_f1: 0.2260
 epoch: 1, train_loss: 1.1798, test_loss: 1.2418, test_f1: 0.2260
 epoch: 2, train_loss: 1.1137, test_loss: 1.1478, test_f1: 0.3250
 epoch: 3, train_loss: 1.0676, test_loss: 1.0794, test_f1: 0.3672
 epoch: 4, train_loss: 1.0354, test_loss: 1.0485, test_f1: 0.4173
 epoch: 5, train_loss: 0.9968, test_loss: 1.0246, test_f1: 0.4634
 epoch: 6, train_loss: 0.9743, test_loss: 1.0105, test_f1: 0.4736
 epoch: 7, train_loss: 0.9508, test_loss: 0.9794, test_f1: 0.4828
 epoch: 8, train_loss: 0.9419, test_loss: 1.0700, test_f1: 0.4381
 epoch: 9, train_loss: 0.9202, test_loss: 0.9749, test_f1: 0.4919
 epoch: 10, train_loss: 0.8980, test_loss: 0.9897, test_f1: 0.4759
 epoch: 11, train_loss: 0.8871, test_loss: 0.9456, test_f1: 0.5057
 epoch: 12, train_loss: 0.8767, test_loss: 0.9468, test_f1: 0.5103
 epoch: 13, train_loss: 0.8603, test_loss: 0.9444, test_f1: 0.5151
 epoch: 14, train_loss: 0.8491, test_loss: 0.9326, test_f1: 0.5267
 epoch: 15, train_loss: 0.8229, test_loss: 0.9146, test_f1: 0.5270
 epoch: 16, train_loss: 0.8208, test_loss: 0.9729, test_f1: 0.4948
 epoch: 17, train_loss: 0.8058, test_loss: 0.9443, test_f1: 0.5131
 epoch: 18, train_loss: 0.7919, test_loss: 0.9826, test_f1: 0.5256
 epoch: 19, train_loss: 0.7928, test_loss: 0.9511, test_f1: 0.5240
 epoch: 20, train_loss: 0.7892, test_loss: 0.9427, test_f1: 0.5208
 epoch: 21, train_loss: 0.7776, test_loss: 0.9704, test_f1: 0.5086
 epoch: 22, train_loss: 0.7701, test_loss: 0.9078, test_f1: 0.5278
 epoch: 23, train_loss: 0.7649, test_loss: 0.9393, test_f1: 0.4975
 epoch: 24, train_loss: 0.7576, test_loss: 0.9033, test_f1: 0.5340
 epoch: 25, train_loss: 0.7617, test_loss: 0.9423, test_f1: 0.5230
 epoch: 26, train_loss: 0.7382, test_loss: 0.9502, test_f1: 0.5126
 epoch: 27, train_loss: 0.7452, test_loss: 0.9230, test_f1: 0.5310
 epoch: 28, train_loss: 0.7395, test_loss: 0.9904, test_f1: 0.5053
 epoch: 29, train_loss: 0.7188, test_loss: 0.8906, test_f1: 0.5369
 epoch: 30, train_loss: 0.7210, test_loss: 0.9217, test_f1: 0.5320
 epoch: 31, train_loss: 0.7144, test_loss: 0.9314, test_f1: 0.5428
 epoch: 32, train_loss: 0.7146, test_loss: 0.9297, test_f1: 0.5130
 epoch: 33, train_loss: 0.7061, test_loss: 0.9942, test_f1: 0.5083
 epoch: 34, train_loss: 0.7084, test_loss: 0.9413, test_f1: 0.5109
 epoch: 35, train_loss: 0.7131, test_loss: 0.9112, test_f1: 0.5317
 epoch: 36, train_loss: 0.6806, test_loss: 1.0101, test_f1: 0.4910
 epoch: 37, train_loss: 0.6765, test_loss: 0.9284, test_f1: 0.5303
 epoch: 38, train_loss: 0.6939, test_loss: 0.9419, test_f1: 0.5405
 epoch: 39, train_loss: 0.6762, test_loss: 0.9694, test_f1: 0.5134
 epoch: 40, train_loss: 0.6835, test_loss: 0.9595, test_f1: 0.5312
 epoch: 41, train_loss: 0.6800, test_loss: 1.0131, test_f1: 0.5201
 epoch: 42, train_loss: 0.6758, test_loss: 0.9049, test_f1: 0.5496
 epoch: 43, train_loss: 0.6631, test_loss: 0.9808, test_f1: 0.5434
 epoch: 44, train_loss: 0.6638, test_loss: 0.9293, test_f1: 0.5407
 epoch: 45, train_loss: 0.6717, test_loss: 1.1159, test_f1: 0.4731
 epoch: 46, train_loss: 0.6531, test_loss: 0.9329, test_f1: 0.5272
 epoch: 47, train_loss: 0.6404, test_loss: 0.9607, test_f1: 0.5333
 epoch: 48, train_loss: 0.6604, test_loss: 0.9863, test_f1: 0.5488
 epoch: 49, train_loss: 0.6618, test_loss: 0.9032, test_f1: 0.5417
 epoch: 50, train_loss: 0.6648, test_loss: 0.9408, test_f1: 0.5263
 epoch: 51, train_loss: 0.6359, test_loss: 0.9718, test_f1: 0.5282
 epoch: 52, train_loss: 0.6207, test_loss: 0.9247, test_f1: 0.5413
 epoch: 53, train_loss: 0.6217, test_loss: 0.9180, test_f1: 0.5523
 epoch: 54, train_loss: 0.6096, test_loss: 0.9813, test_f1: 0.5286
 epoch: 55, train_loss: 0.6148, test_loss: 0.9459, test_f1: 0.5404
 epoch: 56, train_loss: 0.6100, test_loss: 0.9542, test_f1: 0.5487
 epoch: 57, train_loss: 0.6036, test_loss: 0.9441, test_f1: 0.5380
 epoch: 58, train_loss: 0.5980, test_loss: 0.9167, test_f1: 0.5436
 epoch: 59, train_loss: 0.6043, test_loss: 0.9922, test_f1: 0.5415
 epoch: 60, train_loss: 0.5982, test_loss: 0.9054, test_f1: 0.5409
 epoch: 61, train_loss: 0.6000, test_loss: 0.9239, test_f1: 0.5686
 epoch: 62, train_loss: 0.5944, test_loss: 0.9468, test_f1: 0.5527
 epoch: 63, train_loss: 0.6015, test_loss: 0.9506, test_f1: 0.5622
 epoch: 64, train_loss: 0.5940, test_loss: 0.9836, test_f1: 0.5393
 epoch: 65, train_loss: 0.5817, test_loss: 1.0070, test_f1: 0.5376
 epoch: 66, train_loss: 0.5849, test_loss: 0.9378, test_f1: 0.5718
 epoch: 67, train_loss: 0.5962, test_loss: 0.9296, test_f1: 0.5649
 epoch: 68, train_loss: 0.5973, test_loss: 0.9222, test_f1: 0.5721
 epoch: 69, train_loss: 0.5952, test_loss: 0.9297, test_f1: 0.5675
 epoch: 70, train_loss: 0.5871, test_loss: 0.9826, test_f1: 0.5506
 epoch: 71, train_loss: 0.5817, test_loss: 0.9284, test_f1: 0.5634
 epoch: 72, train_loss: 0.5817, test_loss: 0.9957, test_f1: 0.5533
 epoch: 73, train_loss: 0.5804, test_loss: 0.9063, test_f1: 0.5619
 epoch: 74, train_loss: 0.5801, test_loss: 0.9900, test_f1: 0.5613
 epoch: 75, train_loss: 0.5899, test_loss: 0.9610, test_f1: 0.5676
 epoch: 76, train_loss: 0.5802, test_loss: 1.0434, test_f1: 0.5381
 epoch: 77, train_loss: 0.5893, test_loss: 0.8999, test_f1: 0.5802
 epoch: 78, train_loss: 0.5737, test_loss: 1.0128, test_f1: 0.5730
 epoch: 79, train_loss: 0.5746, test_loss: 1.0114, test_f1: 0.5488
 epoch: 80, train_loss: 0.5700, test_loss: 0.9479, test_f1: 0.5745
 epoch: 81, train_loss: 0.5624, test_loss: 0.9648, test_f1: 0.5746
 epoch: 82, train_loss: 0.5670, test_loss: 1.0420, test_f1: 0.5521
 epoch: 83, train_loss: 0.5664, test_loss: 1.0171, test_f1: 0.5498
 epoch: 84, train_loss: 0.5655, test_loss: 0.9755, test_f1: 0.5735
 epoch: 85, train_loss: 0.5666, test_loss: 0.9781, test_f1: 0.5725
 epoch: 86, train_loss: 0.5623, test_loss: 0.9388, test_f1: 0.5725
 epoch: 87, train_loss: 0.5631, test_loss: 0.9585, test_f1: 0.5786
 epoch: 88, train_loss: 0.5629, test_loss: 0.9842, test_f1: 0.5678
 epoch: 89, train_loss: 0.5581, test_loss: 0.9813, test_f1: 0.5737
 epoch: 90, train_loss: 0.5676, test_loss: 0.9429, test_f1: 0.5725
 epoch: 91, train_loss: 0.5620, test_loss: 1.0332, test_f1: 0.5658
 epoch: 92, train_loss: 0.5516, test_loss: 0.9740, test_f1: 0.5876
 epoch: 93, train_loss: 0.5380, test_loss: 1.0287, test_f1: 0.5552
 epoch: 94, train_loss: 0.5427, test_loss: 1.0148, test_f1: 0.5777
 epoch: 95, train_loss: 0.5493, test_loss: 1.0015, test_f1: 0.5717
 epoch: 96, train_loss: 0.5503, test_loss: 0.9917, test_f1: 0.5716
 epoch: 97, train_loss: 0.5641, test_loss: 1.0693, test_f1: 0.5680
 epoch: 98, train_loss: 0.5406, test_loss: 1.0547, test_f1: 0.5653
 epoch: 99, train_loss: 0.5503, test_loss: 1.0250, test_f1: 0.5721
##################ITERATION #2 ****************************************
 epoch: 0, train_loss: 1.2586, test_loss: 1.2906, test_f1: 0.2260
 epoch: 1, train_loss: 1.1409, test_loss: 1.2431, test_f1: 0.2260
 epoch: 2, train_loss: 1.0775, test_loss: 1.1568, test_f1: 0.3381
 epoch: 3, train_loss: 1.0307, test_loss: 1.0765, test_f1: 0.3914
 epoch: 4, train_loss: 0.9971, test_loss: 1.0038, test_f1: 0.4491
 epoch: 5, train_loss: 0.9651, test_loss: 0.9283, test_f1: 0.4789
 epoch: 6, train_loss: 0.9499, test_loss: 0.9674, test_f1: 0.4737
 epoch: 7, train_loss: 0.9317, test_loss: 0.9664, test_f1: 0.4938
 epoch: 8, train_loss: 0.9202, test_loss: 0.9940, test_f1: 0.4844
 epoch: 9, train_loss: 0.8997, test_loss: 1.0182, test_f1: 0.4527
 epoch: 10, train_loss: 0.8936, test_loss: 0.9387, test_f1: 0.4941
 epoch: 11, train_loss: 0.8812, test_loss: 0.9371, test_f1: 0.4918
 epoch: 12, train_loss: 0.8723, test_loss: 1.1247, test_f1: 0.4787
 epoch: 13, train_loss: 0.8590, test_loss: 0.9749, test_f1: 0.5180
 epoch: 14, train_loss: 0.8403, test_loss: 0.9546, test_f1: 0.5113
 epoch: 15, train_loss: 0.8371, test_loss: 0.8995, test_f1: 0.5107
 epoch: 16, train_loss: 0.8262, test_loss: 0.9805, test_f1: 0.5122
 epoch: 17, train_loss: 0.8035, test_loss: 0.9271, test_f1: 0.5221
 epoch: 18, train_loss: 0.8040, test_loss: 0.9947, test_f1: 0.5206
 epoch: 19, train_loss: 0.8117, test_loss: 0.9373, test_f1: 0.5063
 epoch: 20, train_loss: 0.7885, test_loss: 0.9223, test_f1: 0.5298
 epoch: 21, train_loss: 0.7702, test_loss: 0.9457, test_f1: 0.5276
 epoch: 22, train_loss: 0.7745, test_loss: 0.9460, test_f1: 0.5507
 epoch: 23, train_loss: 0.7667, test_loss: 0.9644, test_f1: 0.5352
 epoch: 24, train_loss: 0.7560, test_loss: 0.9540, test_f1: 0.5478
 epoch: 25, train_loss: 0.7413, test_loss: 0.9163, test_f1: 0.5528
 epoch: 26, train_loss: 0.7439, test_loss: 0.9257, test_f1: 0.5523
 epoch: 27, train_loss: 0.7295, test_loss: 1.0057, test_f1: 0.5563
 epoch: 28, train_loss: 0.7296, test_loss: 0.9589, test_f1: 0.5371
 epoch: 29, train_loss: 0.7269, test_loss: 1.0077, test_f1: 0.5453
 epoch: 30, train_loss: 0.7189, test_loss: 0.9437, test_f1: 0.5488
 epoch: 31, train_loss: 0.7215, test_loss: 1.0394, test_f1: 0.5397
 epoch: 32, train_loss: 0.7193, test_loss: 0.9261, test_f1: 0.5676
 epoch: 33, train_loss: 0.7081, test_loss: 0.8792, test_f1: 0.5893
 epoch: 34, train_loss: 0.6919, test_loss: 0.9348, test_f1: 0.5500
 epoch: 35, train_loss: 0.6937, test_loss: 0.9476, test_f1: 0.5448
 epoch: 36, train_loss: 0.6914, test_loss: 0.9367, test_f1: 0.5604
 epoch: 37, train_loss: 0.7118, test_loss: 0.9681, test_f1: 0.5739
 epoch: 38, train_loss: 0.6997, test_loss: 0.9248, test_f1: 0.5635
 epoch: 39, train_loss: 0.6823, test_loss: 0.9307, test_f1: 0.5671
 epoch: 40, train_loss: 0.6737, test_loss: 0.9305, test_f1: 0.5522
 epoch: 41, train_loss: 0.6774, test_loss: 0.9645, test_f1: 0.5806
 epoch: 42, train_loss: 0.6697, test_loss: 0.9358, test_f1: 0.5948
 epoch: 43, train_loss: 0.6568, test_loss: 0.9912, test_f1: 0.5474
 epoch: 44, train_loss: 0.6442, test_loss: 0.9167, test_f1: 0.5816
 epoch: 45, train_loss: 0.6552, test_loss: 1.0766, test_f1: 0.5495
 epoch: 46, train_loss: 0.6499, test_loss: 0.8970, test_f1: 0.5657
 epoch: 47, train_loss: 0.6353, test_loss: 0.9343, test_f1: 0.5815
 epoch: 48, train_loss: 0.6311, test_loss: 0.9011, test_f1: 0.5997
 epoch: 49, train_loss: 0.6379, test_loss: 0.9393, test_f1: 0.5941
 epoch: 50, train_loss: 0.6300, test_loss: 0.9334, test_f1: 0.5888
 epoch: 51, train_loss: 0.6104, test_loss: 0.9074, test_f1: 0.6009
 epoch: 52, train_loss: 0.6071, test_loss: 0.9763, test_f1: 0.5929
 epoch: 53, train_loss: 0.5939, test_loss: 0.8964, test_f1: 0.6128
 epoch: 54, train_loss: 0.5930, test_loss: 0.9724, test_f1: 0.5849
 epoch: 55, train_loss: 0.5942, test_loss: 0.9149, test_f1: 0.6040
 epoch: 56, train_loss: 0.5908, test_loss: 0.9518, test_f1: 0.5910
 epoch: 57, train_loss: 0.5930, test_loss: 0.9612, test_f1: 0.5770
 epoch: 58, train_loss: 0.5769, test_loss: 0.9196, test_f1: 0.6082
 epoch: 59, train_loss: 0.5799, test_loss: 0.9278, test_f1: 0.6035
 epoch: 60, train_loss: 0.5722, test_loss: 0.9372, test_f1: 0.5983
 epoch: 61, train_loss: 0.5906, test_loss: 0.9770, test_f1: 0.6036
 epoch: 62, train_loss: 0.5762, test_loss: 0.9353, test_f1: 0.5964
 epoch: 63, train_loss: 0.5747, test_loss: 0.9206, test_f1: 0.6114
 epoch: 64, train_loss: 0.5622, test_loss: 0.9333, test_f1: 0.5985
 epoch: 65, train_loss: 0.5787, test_loss: 0.9328, test_f1: 0.6069
 epoch: 66, train_loss: 0.5616, test_loss: 0.9461, test_f1: 0.5963
 epoch: 67, train_loss: 0.5647, test_loss: 0.9301, test_f1: 0.5995
 epoch: 68, train_loss: 0.5752, test_loss: 0.9891, test_f1: 0.5956
 epoch: 69, train_loss: 0.5676, test_loss: 0.9649, test_f1: 0.6065
 epoch: 70, train_loss: 0.5551, test_loss: 0.9888, test_f1: 0.5980
 epoch: 71, train_loss: 0.5535, test_loss: 0.9725, test_f1: 0.6027
 epoch: 72, train_loss: 0.5573, test_loss: 0.9640, test_f1: 0.5951
 epoch: 73, train_loss: 0.5738, test_loss: 0.9476, test_f1: 0.6039
 epoch: 74, train_loss: 0.5473, test_loss: 0.9822, test_f1: 0.5940
 epoch: 75, train_loss: 0.5621, test_loss: 0.9618, test_f1: 0.6001
 epoch: 76, train_loss: 0.5402, test_loss: 0.9618, test_f1: 0.6001
 epoch: 77, train_loss: 0.5346, test_loss: 0.9865, test_f1: 0.5973
 epoch: 78, train_loss: 0.5333, test_loss: 0.9661, test_f1: 0.5991
 epoch: 79, train_loss: 0.5324, test_loss: 0.9795, test_f1: 0.6158
 epoch: 80, train_loss: 0.5259, test_loss: 1.0015, test_f1: 0.5793
 epoch: 81, train_loss: 0.5322, test_loss: 0.9821, test_f1: 0.6092
 epoch: 82, train_loss: 0.5327, test_loss: 0.9787, test_f1: 0.5992
 epoch: 83, train_loss: 0.5442, test_loss: 0.9952, test_f1: 0.6254
 epoch: 84, train_loss: 0.5124, test_loss: 1.0765, test_f1: 0.5988
 epoch: 85, train_loss: 0.5218, test_loss: 0.9751, test_f1: 0.6167
 epoch: 86, train_loss: 0.5318, test_loss: 1.0328, test_f1: 0.6148
 epoch: 87, train_loss: 0.5284, test_loss: 0.9904, test_f1: 0.6238
 epoch: 88, train_loss: 0.5192, test_loss: 0.9888, test_f1: 0.6223
 epoch: 89, train_loss: 0.5100, test_loss: 1.0592, test_f1: 0.6023
 epoch: 90, train_loss: 0.5321, test_loss: 0.9953, test_f1: 0.6097
 epoch: 91, train_loss: 0.5220, test_loss: 1.0672, test_f1: 0.6109
 epoch: 92, train_loss: 0.5211, test_loss: 0.9940, test_f1: 0.6149
 epoch: 93, train_loss: 0.5082, test_loss: 0.9828, test_f1: 0.6213
 epoch: 94, train_loss: 0.5068, test_loss: 0.9984, test_f1: 0.5970
 epoch: 95, train_loss: 0.5055, test_loss: 1.0726, test_f1: 0.5961
 epoch: 96, train_loss: 0.5163, test_loss: 1.0569, test_f1: 0.6047
 epoch: 97, train_loss: 0.5207, test_loss: 0.9960, test_f1: 0.6045
 epoch: 98, train_loss: 0.5065, test_loss: 1.0493, test_f1: 0.6045
 epoch: 99, train_loss: 0.4991, test_loss: 1.0608, test_f1: 0.6023
##################ITERATION #3 ****************************************
 epoch: 0, train_loss: 1.2529, test_loss: 1.3225, test_f1: 0.2260
 epoch: 1, train_loss: 1.1231, test_loss: 1.3048, test_f1: 0.2260
 epoch: 2, train_loss: 1.0613, test_loss: 1.1953, test_f1: 0.3073
 epoch: 3, train_loss: 1.0266, test_loss: 1.0512, test_f1: 0.3963
 epoch: 4, train_loss: 0.9863, test_loss: 0.9715, test_f1: 0.4333
 epoch: 5, train_loss: 0.9580, test_loss: 0.9137, test_f1: 0.4949
 epoch: 6, train_loss: 0.9360, test_loss: 0.8960, test_f1: 0.5053
 epoch: 7, train_loss: 0.9236, test_loss: 0.8882, test_f1: 0.4935
 epoch: 8, train_loss: 0.8992, test_loss: 0.8823, test_f1: 0.5006
 epoch: 9, train_loss: 0.8937, test_loss: 0.8415, test_f1: 0.5437
 epoch: 10, train_loss: 0.8769, test_loss: 0.8606, test_f1: 0.5362
 epoch: 11, train_loss: 0.8655, test_loss: 0.8215, test_f1: 0.5442
 epoch: 12, train_loss: 0.8511, test_loss: 0.8272, test_f1: 0.5179
 epoch: 13, train_loss: 0.8435, test_loss: 0.8998, test_f1: 0.5053
 epoch: 14, train_loss: 0.8337, test_loss: 0.8090, test_f1: 0.5536
 epoch: 15, train_loss: 0.8304, test_loss: 0.8248, test_f1: 0.5187
 epoch: 16, train_loss: 0.8183, test_loss: 0.8546, test_f1: 0.5302
 epoch: 17, train_loss: 0.8101, test_loss: 0.8105, test_f1: 0.5446
 epoch: 18, train_loss: 0.8083, test_loss: 0.8877, test_f1: 0.5167
 epoch: 19, train_loss: 0.7984, test_loss: 0.8388, test_f1: 0.5423
 epoch: 20, train_loss: 0.7892, test_loss: 0.8807, test_f1: 0.5142
 epoch: 21, train_loss: 0.7804, test_loss: 0.8653, test_f1: 0.5385
 epoch: 22, train_loss: 0.7823, test_loss: 0.8753, test_f1: 0.5368
 epoch: 23, train_loss: 0.7725, test_loss: 0.8959, test_f1: 0.5376
 epoch: 24, train_loss: 0.7679, test_loss: 0.8294, test_f1: 0.5399
 epoch: 25, train_loss: 0.7539, test_loss: 0.8509, test_f1: 0.5338
 epoch: 26, train_loss: 0.7591, test_loss: 0.8747, test_f1: 0.5367
 epoch: 27, train_loss: 0.7353, test_loss: 0.8570, test_f1: 0.5326
 epoch: 28, train_loss: 0.7342, test_loss: 0.8270, test_f1: 0.5511
 epoch: 29, train_loss: 0.7345, test_loss: 0.9696, test_f1: 0.5000
 epoch: 30, train_loss: 0.7310, test_loss: 0.8798, test_f1: 0.5282
 epoch: 31, train_loss: 0.7225, test_loss: 0.8976, test_f1: 0.5430
 epoch: 32, train_loss: 0.7250, test_loss: 0.8792, test_f1: 0.5415
 epoch: 33, train_loss: 0.7163, test_loss: 0.8924, test_f1: 0.5238
 epoch: 34, train_loss: 0.7140, test_loss: 0.8320, test_f1: 0.5633
 epoch: 35, train_loss: 0.6928, test_loss: 0.8974, test_f1: 0.5406
 epoch: 36, train_loss: 0.6970, test_loss: 0.8484, test_f1: 0.5455
 epoch: 37, train_loss: 0.6906, test_loss: 0.8818, test_f1: 0.5157
 epoch: 38, train_loss: 0.7003, test_loss: 0.9190, test_f1: 0.5343
 epoch: 39, train_loss: 0.6854, test_loss: 0.8444, test_f1: 0.5438
 epoch: 40, train_loss: 0.6741, test_loss: 0.8483, test_f1: 0.5594
 epoch: 41, train_loss: 0.6821, test_loss: 0.9442, test_f1: 0.5362
 epoch: 42, train_loss: 0.6778, test_loss: 0.8989, test_f1: 0.5249
 epoch: 43, train_loss: 0.6556, test_loss: 0.8904, test_f1: 0.5509
 epoch: 44, train_loss: 0.6577, test_loss: 0.8812, test_f1: 0.5506
 epoch: 45, train_loss: 0.6530, test_loss: 0.8688, test_f1: 0.5580
 epoch: 46, train_loss: 0.6554, test_loss: 0.9056, test_f1: 0.5468
 epoch: 47, train_loss: 0.6485, test_loss: 0.8928, test_f1: 0.5652
 epoch: 48, train_loss: 0.6329, test_loss: 0.8849, test_f1: 0.5760
 epoch: 49, train_loss: 0.6476, test_loss: 0.9059, test_f1: 0.5597
 epoch: 50, train_loss: 0.6400, test_loss: 0.8901, test_f1: 0.5593
 epoch: 51, train_loss: 0.6233, test_loss: 0.8977, test_f1: 0.5616
 epoch: 52, train_loss: 0.6219, test_loss: 0.8716, test_f1: 0.5698
 epoch: 53, train_loss: 0.6140, test_loss: 0.9305, test_f1: 0.5460
 epoch: 54, train_loss: 0.6002, test_loss: 0.9158, test_f1: 0.5698
 epoch: 55, train_loss: 0.5986, test_loss: 0.8942, test_f1: 0.5614
 epoch: 56, train_loss: 0.5916, test_loss: 0.9037, test_f1: 0.5549
 epoch: 57, train_loss: 0.5869, test_loss: 0.9249, test_f1: 0.5630
 epoch: 58, train_loss: 0.5827, test_loss: 0.9067, test_f1: 0.5544
 epoch: 59, train_loss: 0.5943, test_loss: 0.9096, test_f1: 0.5677
 epoch: 60, train_loss: 0.5911, test_loss: 0.8732, test_f1: 0.5675
 epoch: 61, train_loss: 0.5979, test_loss: 0.9202, test_f1: 0.5682
 epoch: 62, train_loss: 0.5877, test_loss: 0.9153, test_f1: 0.5730
 epoch: 63, train_loss: 0.5766, test_loss: 0.9305, test_f1: 0.5669
 epoch: 64, train_loss: 0.5931, test_loss: 0.9477, test_f1: 0.5498
 epoch: 65, train_loss: 0.5768, test_loss: 0.9128, test_f1: 0.5604
 epoch: 66, train_loss: 0.5870, test_loss: 0.9411, test_f1: 0.5602
 epoch: 67, train_loss: 0.5866, test_loss: 0.9324, test_f1: 0.5564
 epoch: 68, train_loss: 0.5806, test_loss: 0.8992, test_f1: 0.5590
 epoch: 69, train_loss: 0.5819, test_loss: 0.9297, test_f1: 0.5591
 epoch: 70, train_loss: 0.5751, test_loss: 0.9138, test_f1: 0.5523
 epoch: 71, train_loss: 0.5665, test_loss: 0.9524, test_f1: 0.5407
 epoch: 72, train_loss: 0.5685, test_loss: 0.8832, test_f1: 0.5619
 epoch: 73, train_loss: 0.5678, test_loss: 0.9551, test_f1: 0.5693
 epoch: 74, train_loss: 0.5675, test_loss: 0.8808, test_f1: 0.5616
 epoch: 75, train_loss: 0.5649, test_loss: 0.9169, test_f1: 0.5714
 epoch: 76, train_loss: 0.5574, test_loss: 0.9614, test_f1: 0.5723
 epoch: 77, train_loss: 0.5640, test_loss: 0.9440, test_f1: 0.5668
 epoch: 78, train_loss: 0.5527, test_loss: 0.9300, test_f1: 0.5716
 epoch: 79, train_loss: 0.5544, test_loss: 0.9572, test_f1: 0.5596
 epoch: 80, train_loss: 0.5546, test_loss: 0.9354, test_f1: 0.5859
 epoch: 81, train_loss: 0.5541, test_loss: 0.9673, test_f1: 0.5401
 epoch: 82, train_loss: 0.5525, test_loss: 0.9580, test_f1: 0.5591
 epoch: 83, train_loss: 0.5495, test_loss: 0.9622, test_f1: 0.5682
 epoch: 84, train_loss: 0.5620, test_loss: 1.0212, test_f1: 0.5398
 epoch: 85, train_loss: 0.5476, test_loss: 0.9347, test_f1: 0.5885
 epoch: 86, train_loss: 0.5436, test_loss: 0.9669, test_f1: 0.5721
 epoch: 87, train_loss: 0.5327, test_loss: 0.9357, test_f1: 0.5607
 epoch: 88, train_loss: 0.5351, test_loss: 1.0310, test_f1: 0.5662
 epoch: 89, train_loss: 0.5369, test_loss: 1.0364, test_f1: 0.5520
 epoch: 90, train_loss: 0.5313, test_loss: 0.9685, test_f1: 0.5920
 epoch: 91, train_loss: 0.5461, test_loss: 1.0243, test_f1: 0.5802
 epoch: 92, train_loss: 0.5419, test_loss: 1.1115, test_f1: 0.5690
 epoch: 93, train_loss: 0.5336, test_loss: 0.9652, test_f1: 0.5996
 epoch: 94, train_loss: 0.5451, test_loss: 1.0347, test_f1: 0.5661
 epoch: 95, train_loss: 0.5361, test_loss: 0.9412, test_f1: 0.5679
 epoch: 96, train_loss: 0.5220, test_loss: 1.0063, test_f1: 0.5698
 epoch: 97, train_loss: 0.5255, test_loss: 1.1143, test_f1: 0.5596
 epoch: 98, train_loss: 0.5367, test_loss: 1.0423, test_f1: 0.5714
 epoch: 99, train_loss: 0.5219, test_loss: 0.9894, test_f1: 0.5515
##################ITERATION #4 ****************************************
 epoch: 0, train_loss: 1.2326, test_loss: 1.3314, test_f1: 0.2260
 epoch: 1, train_loss: 1.1073, test_loss: 1.3298, test_f1: 0.2260
 epoch: 2, train_loss: 1.0564, test_loss: 1.1566, test_f1: 0.2969
 epoch: 3, train_loss: 1.0489, test_loss: 1.1066, test_f1: 0.3699
 epoch: 4, train_loss: 1.0196, test_loss: 1.0467, test_f1: 0.4621
 epoch: 5, train_loss: 0.9957, test_loss: 1.0351, test_f1: 0.4473
 epoch: 6, train_loss: 0.9710, test_loss: 1.0041, test_f1: 0.5080
 epoch: 7, train_loss: 0.9582, test_loss: 0.9998, test_f1: 0.5107
 epoch: 8, train_loss: 0.9469, test_loss: 0.9860, test_f1: 0.5146
 epoch: 9, train_loss: 0.9231, test_loss: 0.9622, test_f1: 0.5190
 epoch: 10, train_loss: 0.9287, test_loss: 0.9587, test_f1: 0.5206
 epoch: 11, train_loss: 0.9146, test_loss: 1.0124, test_f1: 0.5079
 epoch: 12, train_loss: 0.9117, test_loss: 0.9519, test_f1: 0.5290
 epoch: 13, train_loss: 0.8948, test_loss: 0.9623, test_f1: 0.5240
 epoch: 14, train_loss: 0.8837, test_loss: 0.9478, test_f1: 0.5233
 epoch: 15, train_loss: 0.8818, test_loss: 0.9446, test_f1: 0.5368
 epoch: 16, train_loss: 0.8542, test_loss: 1.0284, test_f1: 0.5323
 epoch: 17, train_loss: 0.8463, test_loss: 0.9332, test_f1: 0.5242
 epoch: 18, train_loss: 0.8485, test_loss: 0.9747, test_f1: 0.5226
 epoch: 19, train_loss: 0.8249, test_loss: 0.9551, test_f1: 0.5356
 epoch: 20, train_loss: 0.8152, test_loss: 0.9069, test_f1: 0.5523
 epoch: 21, train_loss: 0.8009, test_loss: 0.9390, test_f1: 0.5428
 epoch: 22, train_loss: 0.8028, test_loss: 0.9355, test_f1: 0.5354
 epoch: 23, train_loss: 0.7896, test_loss: 0.9211, test_f1: 0.5434
 epoch: 24, train_loss: 0.7848, test_loss: 0.9385, test_f1: 0.5454
 epoch: 25, train_loss: 0.7856, test_loss: 0.9057, test_f1: 0.5461
 epoch: 26, train_loss: 0.7745, test_loss: 0.9501, test_f1: 0.5408
 epoch: 27, train_loss: 0.7567, test_loss: 0.9846, test_f1: 0.5223
 epoch: 28, train_loss: 0.7661, test_loss: 0.9148, test_f1: 0.5412
 epoch: 29, train_loss: 0.7654, test_loss: 1.0267, test_f1: 0.5055
 epoch: 30, train_loss: 0.7686, test_loss: 1.0943, test_f1: 0.4681
 epoch: 31, train_loss: 0.7539, test_loss: 0.8762, test_f1: 0.5665
 epoch: 32, train_loss: 0.7471, test_loss: 0.9303, test_f1: 0.5474
 epoch: 33, train_loss: 0.7492, test_loss: 0.9541, test_f1: 0.5167
 epoch: 34, train_loss: 0.7325, test_loss: 0.9163, test_f1: 0.5485
 epoch: 35, train_loss: 0.7276, test_loss: 0.9445, test_f1: 0.5324
 epoch: 36, train_loss: 0.7263, test_loss: 0.9462, test_f1: 0.5549
 epoch: 37, train_loss: 0.7089, test_loss: 0.9176, test_f1: 0.5634
 epoch: 38, train_loss: 0.7046, test_loss: 0.9359, test_f1: 0.5366
 epoch: 39, train_loss: 0.7004, test_loss: 0.8955, test_f1: 0.5548
 epoch: 40, train_loss: 0.6900, test_loss: 0.9155, test_f1: 0.5400
 epoch: 41, train_loss: 0.6854, test_loss: 0.9579, test_f1: 0.5277
 epoch: 42, train_loss: 0.6979, test_loss: 1.0366, test_f1: 0.5223
 epoch: 43, train_loss: 0.7030, test_loss: 0.9027, test_f1: 0.5676
 epoch: 44, train_loss: 0.6919, test_loss: 0.9038, test_f1: 0.5746
 epoch: 45, train_loss: 0.6820, test_loss: 0.9253, test_f1: 0.5777
 epoch: 46, train_loss: 0.6862, test_loss: 0.9694, test_f1: 0.5496
 epoch: 47, train_loss: 0.6753, test_loss: 0.9093, test_f1: 0.5553
 epoch: 48, train_loss: 0.6670, test_loss: 0.9273, test_f1: 0.5477
 epoch: 49, train_loss: 0.6549, test_loss: 0.9478, test_f1: 0.5418
 epoch: 50, train_loss: 0.6517, test_loss: 0.9490, test_f1: 0.5555
 epoch: 51, train_loss: 0.6390, test_loss: 0.9445, test_f1: 0.5401
 epoch: 52, train_loss: 0.6302, test_loss: 0.9337, test_f1: 0.5614
 epoch: 53, train_loss: 0.6396, test_loss: 0.9499, test_f1: 0.5512
 epoch: 54, train_loss: 0.6236, test_loss: 0.9628, test_f1: 0.5540
 epoch: 55, train_loss: 0.6109, test_loss: 0.9431, test_f1: 0.5844
 epoch: 56, train_loss: 0.6155, test_loss: 0.9524, test_f1: 0.5649
 epoch: 57, train_loss: 0.6171, test_loss: 0.9373, test_f1: 0.5709
 epoch: 58, train_loss: 0.6243, test_loss: 0.9400, test_f1: 0.5655
 epoch: 59, train_loss: 0.6036, test_loss: 0.9268, test_f1: 0.5911
 epoch: 60, train_loss: 0.6148, test_loss: 0.9755, test_f1: 0.5675
 epoch: 61, train_loss: 0.6084, test_loss: 0.9529, test_f1: 0.5848
 epoch: 62, train_loss: 0.6136, test_loss: 0.9750, test_f1: 0.5653
 epoch: 63, train_loss: 0.5997, test_loss: 0.9582, test_f1: 0.5582
 epoch: 64, train_loss: 0.6015, test_loss: 0.9543, test_f1: 0.5884
 epoch: 65, train_loss: 0.6079, test_loss: 0.9716, test_f1: 0.5806
 epoch: 66, train_loss: 0.5940, test_loss: 0.9961, test_f1: 0.5687
 epoch: 67, train_loss: 0.6072, test_loss: 0.9891, test_f1: 0.5744
 epoch: 68, train_loss: 0.6167, test_loss: 1.0002, test_f1: 0.5721
 epoch: 69, train_loss: 0.5879, test_loss: 1.0226, test_f1: 0.5628
 epoch: 70, train_loss: 0.5900, test_loss: 0.9685, test_f1: 0.5854
 epoch: 71, train_loss: 0.5969, test_loss: 0.9968, test_f1: 0.5839
 epoch: 72, train_loss: 0.5949, test_loss: 0.9925, test_f1: 0.5751
 epoch: 73, train_loss: 0.5753, test_loss: 0.9824, test_f1: 0.5839
 epoch: 74, train_loss: 0.5848, test_loss: 1.0261, test_f1: 0.5910
 epoch: 75, train_loss: 0.5809, test_loss: 0.9790, test_f1: 0.5812
 epoch: 76, train_loss: 0.5783, test_loss: 0.9741, test_f1: 0.5812
 epoch: 77, train_loss: 0.5939, test_loss: 1.0126, test_f1: 0.5756
 epoch: 78, train_loss: 0.5821, test_loss: 0.9733, test_f1: 0.5737
 epoch: 79, train_loss: 0.5760, test_loss: 1.0423, test_f1: 0.5827
 epoch: 80, train_loss: 0.5796, test_loss: 0.9951, test_f1: 0.5924
 epoch: 81, train_loss: 0.5766, test_loss: 1.0409, test_f1: 0.5791
 epoch: 82, train_loss: 0.5630, test_loss: 1.0097, test_f1: 0.5888
 epoch: 83, train_loss: 0.5670, test_loss: 1.0276, test_f1: 0.5701
 epoch: 84, train_loss: 0.5749, test_loss: 0.9814, test_f1: 0.5528
 epoch: 85, train_loss: 0.5692, test_loss: 1.0332, test_f1: 0.5876
 epoch: 86, train_loss: 0.5749, test_loss: 1.0207, test_f1: 0.5681
 epoch: 87, train_loss: 0.5794, test_loss: 0.9973, test_f1: 0.5931
 epoch: 88, train_loss: 0.5694, test_loss: 1.0207, test_f1: 0.5782
 epoch: 89, train_loss: 0.5572, test_loss: 0.9954, test_f1: 0.5957
 epoch: 90, train_loss: 0.5561, test_loss: 1.0533, test_f1: 0.5797
 epoch: 91, train_loss: 0.5663, test_loss: 1.0139, test_f1: 0.5782
 epoch: 92, train_loss: 0.5604, test_loss: 1.0085, test_f1: 0.5959
 epoch: 93, train_loss: 0.5698, test_loss: 1.0721, test_f1: 0.5862
 epoch: 94, train_loss: 0.5656, test_loss: 1.0436, test_f1: 0.6008
 epoch: 95, train_loss: 0.5481, test_loss: 0.9924, test_f1: 0.6180
 epoch: 96, train_loss: 0.5447, test_loss: 0.9959, test_f1: 0.5939
 epoch: 97, train_loss: 0.5508, test_loss: 1.0678, test_f1: 0.5702
 epoch: 98, train_loss: 0.5430, test_loss: 1.0463, test_f1: 0.5785
 epoch: 99, train_loss: 0.5578, test_loss: 1.0582, test_f1: 0.5778
##################ITERATION #5 ****************************************
 epoch: 0, train_loss: 1.2479, test_loss: 1.3385, test_f1: 0.2260
 epoch: 1, train_loss: 1.1128, test_loss: 1.2725, test_f1: 0.2611
 epoch: 2, train_loss: 1.0525, test_loss: 1.4747, test_f1: 0.2403
 epoch: 3, train_loss: 1.0170, test_loss: 1.1915, test_f1: 0.3457
 epoch: 4, train_loss: 0.9890, test_loss: 1.0375, test_f1: 0.4179
 epoch: 5, train_loss: 0.9593, test_loss: 0.9543, test_f1: 0.4806
 epoch: 6, train_loss: 0.9463, test_loss: 0.9473, test_f1: 0.5014
 epoch: 7, train_loss: 0.9207, test_loss: 0.9583, test_f1: 0.5066
 epoch: 8, train_loss: 0.9168, test_loss: 0.9685, test_f1: 0.5223
 epoch: 9, train_loss: 0.9097, test_loss: 0.9398, test_f1: 0.5206
 epoch: 10, train_loss: 0.8791, test_loss: 0.9437, test_f1: 0.5250
 epoch: 11, train_loss: 0.8713, test_loss: 0.9202, test_f1: 0.5369
 epoch: 12, train_loss: 0.8488, test_loss: 0.9377, test_f1: 0.5341
 epoch: 13, train_loss: 0.8480, test_loss: 0.8978, test_f1: 0.5154
 epoch: 14, train_loss: 0.8417, test_loss: 0.9230, test_f1: 0.5264
 epoch: 15, train_loss: 0.8192, test_loss: 0.9550, test_f1: 0.5233
 epoch: 16, train_loss: 0.8243, test_loss: 0.9146, test_f1: 0.5412
 epoch: 17, train_loss: 0.8231, test_loss: 0.9252, test_f1: 0.5521
 epoch: 18, train_loss: 0.7998, test_loss: 0.9003, test_f1: 0.5630
 epoch: 19, train_loss: 0.8010, test_loss: 0.8918, test_f1: 0.5566
 epoch: 20, train_loss: 0.8064, test_loss: 0.9171, test_f1: 0.5291
 epoch: 21, train_loss: 0.7840, test_loss: 0.9169, test_f1: 0.5483
 epoch: 22, train_loss: 0.7708, test_loss: 0.9408, test_f1: 0.5378
 epoch: 23, train_loss: 0.7700, test_loss: 0.9278, test_f1: 0.5449
 epoch: 24, train_loss: 0.7505, test_loss: 0.8727, test_f1: 0.5581
 epoch: 25, train_loss: 0.7695, test_loss: 1.0092, test_f1: 0.5421
 epoch: 26, train_loss: 0.7659, test_loss: 0.9412, test_f1: 0.5491
 epoch: 27, train_loss: 0.7537, test_loss: 0.9242, test_f1: 0.5608
 epoch: 28, train_loss: 0.7461, test_loss: 0.9163, test_f1: 0.5428
 epoch: 29, train_loss: 0.7429, test_loss: 0.8987, test_f1: 0.5646
 epoch: 30, train_loss: 0.7331, test_loss: 0.9994, test_f1: 0.5483
 epoch: 31, train_loss: 0.7257, test_loss: 0.8906, test_f1: 0.5786
 epoch: 32, train_loss: 0.7142, test_loss: 0.8934, test_f1: 0.5887
 epoch: 33, train_loss: 0.7221, test_loss: 0.9006, test_f1: 0.5824
 epoch: 34, train_loss: 0.7092, test_loss: 0.9966, test_f1: 0.5592
 epoch: 35, train_loss: 0.6943, test_loss: 0.9035, test_f1: 0.5849
 epoch: 36, train_loss: 0.7093, test_loss: 0.9128, test_f1: 0.5985
 epoch: 37, train_loss: 0.6893, test_loss: 0.8807, test_f1: 0.6103
 epoch: 38, train_loss: 0.7046, test_loss: 0.9123, test_f1: 0.5862
 epoch: 39, train_loss: 0.6884, test_loss: 0.9200, test_f1: 0.5747
 epoch: 40, train_loss: 0.6880, test_loss: 0.8965, test_f1: 0.6091
 epoch: 41, train_loss: 0.6689, test_loss: 0.9685, test_f1: 0.5797
 epoch: 42, train_loss: 0.6587, test_loss: 0.8793, test_f1: 0.6113
 epoch: 43, train_loss: 0.6630, test_loss: 0.8653, test_f1: 0.6090
 epoch: 44, train_loss: 0.6659, test_loss: 0.8859, test_f1: 0.6163
 epoch: 45, train_loss: 0.6507, test_loss: 0.9688, test_f1: 0.5784
 epoch: 46, train_loss: 0.6654, test_loss: 0.9494, test_f1: 0.5612
 epoch: 47, train_loss: 0.6558, test_loss: 0.9246, test_f1: 0.6045
 epoch: 48, train_loss: 0.6452, test_loss: 0.8910, test_f1: 0.6003
 epoch: 49, train_loss: 0.6551, test_loss: 0.9574, test_f1: 0.5921
 epoch: 50, train_loss: 0.6556, test_loss: 0.8991, test_f1: 0.5860
 epoch: 51, train_loss: 0.6350, test_loss: 0.9122, test_f1: 0.6138
 epoch: 52, train_loss: 0.6292, test_loss: 0.8808, test_f1: 0.6271
 epoch: 53, train_loss: 0.6068, test_loss: 0.8999, test_f1: 0.5984
 epoch: 54, train_loss: 0.6090, test_loss: 0.9048, test_f1: 0.6043
 epoch: 55, train_loss: 0.6019, test_loss: 0.8923, test_f1: 0.6331
 epoch: 56, train_loss: 0.6091, test_loss: 0.8687, test_f1: 0.6276
 epoch: 57, train_loss: 0.5959, test_loss: 0.9639, test_f1: 0.5859
 epoch: 58, train_loss: 0.5960, test_loss: 0.8955, test_f1: 0.6245
 epoch: 59, train_loss: 0.6027, test_loss: 0.9010, test_f1: 0.6177
 epoch: 60, train_loss: 0.6075, test_loss: 0.9566, test_f1: 0.6078
 epoch: 61, train_loss: 0.5867, test_loss: 0.8840, test_f1: 0.6226
 epoch: 62, train_loss: 0.5777, test_loss: 0.9079, test_f1: 0.6188
 epoch: 63, train_loss: 0.5680, test_loss: 0.9264, test_f1: 0.6285
 epoch: 64, train_loss: 0.5802, test_loss: 0.9055, test_f1: 0.6221
 epoch: 65, train_loss: 0.5726, test_loss: 0.8978, test_f1: 0.6307
 epoch: 66, train_loss: 0.5827, test_loss: 0.9409, test_f1: 0.6128
 epoch: 67, train_loss: 0.5726, test_loss: 0.9661, test_f1: 0.5720
 epoch: 68, train_loss: 0.5834, test_loss: 0.9335, test_f1: 0.6210
 epoch: 69, train_loss: 0.5774, test_loss: 0.9508, test_f1: 0.5890
 epoch: 70, train_loss: 0.5673, test_loss: 0.9246, test_f1: 0.6241
 epoch: 71, train_loss: 0.5622, test_loss: 0.9483, test_f1: 0.6046
 epoch: 72, train_loss: 0.5608, test_loss: 0.8834, test_f1: 0.6283
 epoch: 73, train_loss: 0.5619, test_loss: 0.9866, test_f1: 0.6108
 epoch: 74, train_loss: 0.5607, test_loss: 0.9139, test_f1: 0.6270
 epoch: 75, train_loss: 0.5514, test_loss: 0.9736, test_f1: 0.6145
 epoch: 76, train_loss: 0.5532, test_loss: 0.9548, test_f1: 0.6188
 epoch: 77, train_loss: 0.5598, test_loss: 0.9376, test_f1: 0.6151
 epoch: 78, train_loss: 0.5513, test_loss: 0.9421, test_f1: 0.6101
 epoch: 79, train_loss: 0.5476, test_loss: 0.9167, test_f1: 0.6206
 epoch: 80, train_loss: 0.5347, test_loss: 0.9906, test_f1: 0.6104
 epoch: 81, train_loss: 0.5454, test_loss: 0.9020, test_f1: 0.6314
 epoch: 82, train_loss: 0.5442, test_loss: 0.9424, test_f1: 0.6073
 epoch: 83, train_loss: 0.5265, test_loss: 0.9487, test_f1: 0.6116
 epoch: 84, train_loss: 0.5179, test_loss: 0.9238, test_f1: 0.6050
 epoch: 85, train_loss: 0.5348, test_loss: 0.9387, test_f1: 0.6212
 epoch: 86, train_loss: 0.5354, test_loss: 1.0128, test_f1: 0.5928
 epoch: 87, train_loss: 0.5247, test_loss: 0.9661, test_f1: 0.6243
 epoch: 88, train_loss: 0.5226, test_loss: 0.9790, test_f1: 0.6049
 epoch: 89, train_loss: 0.5242, test_loss: 1.0000, test_f1: 0.6041
 epoch: 90, train_loss: 0.5248, test_loss: 0.9776, test_f1: 0.6171
 epoch: 91, train_loss: 0.5179, test_loss: 0.9400, test_f1: 0.6307
 epoch: 92, train_loss: 0.5294, test_loss: 0.9971, test_f1: 0.6181
 epoch: 93, train_loss: 0.5156, test_loss: 0.9628, test_f1: 0.6020
 epoch: 94, train_loss: 0.5208, test_loss: 1.2169, test_f1: 0.5643
 epoch: 95, train_loss: 0.5118, test_loss: 0.9268, test_f1: 0.6164
 epoch: 96, train_loss: 0.5218, test_loss: 0.9221, test_f1: 0.6282
 epoch: 97, train_loss: 0.5015, test_loss: 0.9761, test_f1: 0.6204
 epoch: 98, train_loss: 0.5100, test_loss: 1.0174, test_f1: 0.5881
 epoch: 99, train_loss: 0.5062, test_loss: 0.9644, test_f1: 0.6111
##################ITERATION #6 ****************************************
 epoch: 0, train_loss: 1.4007, test_loss: 1.3891, test_f1: 0.2260
 epoch: 1, train_loss: 1.1610, test_loss: 1.3915, test_f1: 0.2262
 epoch: 2, train_loss: 1.0979, test_loss: 1.3532, test_f1: 0.2260
 epoch: 3, train_loss: 1.0648, test_loss: 1.1145, test_f1: 0.4059
 epoch: 4, train_loss: 1.0379, test_loss: 1.0042, test_f1: 0.4892
 epoch: 5, train_loss: 1.0215, test_loss: 0.9856, test_f1: 0.5074
 epoch: 6, train_loss: 0.9978, test_loss: 0.9890, test_f1: 0.4943
 epoch: 7, train_loss: 0.9851, test_loss: 0.9802, test_f1: 0.5094
 epoch: 8, train_loss: 0.9783, test_loss: 0.9770, test_f1: 0.5100
 epoch: 9, train_loss: 0.9634, test_loss: 0.9664, test_f1: 0.5087
 epoch: 10, train_loss: 0.9328, test_loss: 0.9535, test_f1: 0.5157
 epoch: 11, train_loss: 0.9334, test_loss: 0.9439, test_f1: 0.5162
 epoch: 12, train_loss: 0.9382, test_loss: 0.9573, test_f1: 0.5033
 epoch: 13, train_loss: 0.9065, test_loss: 0.9413, test_f1: 0.5267
 epoch: 14, train_loss: 0.9072, test_loss: 0.9422, test_f1: 0.5135
 epoch: 15, train_loss: 0.9003, test_loss: 0.9451, test_f1: 0.5036
 epoch: 16, train_loss: 0.8866, test_loss: 0.9131, test_f1: 0.5462
 epoch: 17, train_loss: 0.8793, test_loss: 0.9536, test_f1: 0.5148
 epoch: 18, train_loss: 0.8700, test_loss: 0.9458, test_f1: 0.5122
 epoch: 19, train_loss: 0.8574, test_loss: 0.9200, test_f1: 0.5236
 epoch: 20, train_loss: 0.8539, test_loss: 0.9218, test_f1: 0.5441
 epoch: 21, train_loss: 0.8499, test_loss: 0.9054, test_f1: 0.5170
 epoch: 22, train_loss: 0.8295, test_loss: 0.9143, test_f1: 0.5556
 epoch: 23, train_loss: 0.8267, test_loss: 0.9348, test_f1: 0.5678
 epoch: 24, train_loss: 0.8255, test_loss: 0.9086, test_f1: 0.5484
 epoch: 25, train_loss: 0.8156, test_loss: 0.8714, test_f1: 0.5394
 epoch: 26, train_loss: 0.8060, test_loss: 0.8755, test_f1: 0.5526
 epoch: 27, train_loss: 0.7996, test_loss: 0.8732, test_f1: 0.5595
 epoch: 28, train_loss: 0.7952, test_loss: 0.8913, test_f1: 0.5564
 epoch: 29, train_loss: 0.7892, test_loss: 0.8790, test_f1: 0.5669
 epoch: 30, train_loss: 0.7763, test_loss: 0.9108, test_f1: 0.5794
 epoch: 31, train_loss: 0.7787, test_loss: 0.9105, test_f1: 0.5866
 epoch: 32, train_loss: 0.7710, test_loss: 0.8984, test_f1: 0.5599
 epoch: 33, train_loss: 0.7663, test_loss: 0.9153, test_f1: 0.5640
 epoch: 34, train_loss: 0.7611, test_loss: 0.9267, test_f1: 0.5603
 epoch: 35, train_loss: 0.7571, test_loss: 0.8810, test_f1: 0.5740
 epoch: 36, train_loss: 0.7303, test_loss: 0.8980, test_f1: 0.5362
 epoch: 37, train_loss: 0.7506, test_loss: 0.8992, test_f1: 0.5724
 epoch: 38, train_loss: 0.7227, test_loss: 0.8936, test_f1: 0.5562
 epoch: 39, train_loss: 0.7236, test_loss: 0.9137, test_f1: 0.5436
 epoch: 40, train_loss: 0.7292, test_loss: 0.8857, test_f1: 0.5938
 epoch: 41, train_loss: 0.7231, test_loss: 0.9357, test_f1: 0.5595
 epoch: 42, train_loss: 0.7293, test_loss: 0.8950, test_f1: 0.5643
 epoch: 43, train_loss: 0.7205, test_loss: 0.8908, test_f1: 0.5886
 epoch: 44, train_loss: 0.7165, test_loss: 0.9451, test_f1: 0.6107
 epoch: 45, train_loss: 0.7057, test_loss: 0.8800, test_f1: 0.5972
 epoch: 46, train_loss: 0.7014, test_loss: 0.9785, test_f1: 0.6003
 epoch: 47, train_loss: 0.7061, test_loss: 0.8980, test_f1: 0.5766
 epoch: 48, train_loss: 0.6911, test_loss: 0.9291, test_f1: 0.5769
 epoch: 49, train_loss: 0.6839, test_loss: 0.9284, test_f1: 0.5962
 epoch: 50, train_loss: 0.6885, test_loss: 0.9008, test_f1: 0.5802
 epoch: 51, train_loss: 0.6750, test_loss: 0.8890, test_f1: 0.6072
 epoch: 52, train_loss: 0.6609, test_loss: 0.8997, test_f1: 0.6127
 epoch: 53, train_loss: 0.6453, test_loss: 0.8757, test_f1: 0.6177
 epoch: 54, train_loss: 0.6609, test_loss: 0.9043, test_f1: 0.5926
 epoch: 55, train_loss: 0.6566, test_loss: 0.8895, test_f1: 0.5957
 epoch: 56, train_loss: 0.6377, test_loss: 0.9025, test_f1: 0.6211
 epoch: 57, train_loss: 0.6411, test_loss: 0.8922, test_f1: 0.6099
 epoch: 58, train_loss: 0.6487, test_loss: 0.9068, test_f1: 0.6106
 epoch: 59, train_loss: 0.6369, test_loss: 0.9315, test_f1: 0.5997
 epoch: 60, train_loss: 0.6324, test_loss: 0.8659, test_f1: 0.6141
 epoch: 61, train_loss: 0.6346, test_loss: 0.8954, test_f1: 0.6196
 epoch: 62, train_loss: 0.6369, test_loss: 0.9308, test_f1: 0.5994
 epoch: 63, train_loss: 0.6272, test_loss: 0.9462, test_f1: 0.5888
 epoch: 64, train_loss: 0.6395, test_loss: 0.9196, test_f1: 0.6056
 epoch: 65, train_loss: 0.6361, test_loss: 0.9256, test_f1: 0.6107
 epoch: 66, train_loss: 0.6140, test_loss: 0.9129, test_f1: 0.6072
 epoch: 67, train_loss: 0.6223, test_loss: 0.9338, test_f1: 0.6029
 epoch: 68, train_loss: 0.6286, test_loss: 0.9297, test_f1: 0.6090
 epoch: 69, train_loss: 0.6178, test_loss: 0.9147, test_f1: 0.6123
 epoch: 70, train_loss: 0.6134, test_loss: 0.9445, test_f1: 0.6123
 epoch: 71, train_loss: 0.6122, test_loss: 0.9435, test_f1: 0.6286
 epoch: 72, train_loss: 0.6126, test_loss: 0.9108, test_f1: 0.6170
 epoch: 73, train_loss: 0.6037, test_loss: 0.9046, test_f1: 0.6101
 epoch: 74, train_loss: 0.6115, test_loss: 0.9512, test_f1: 0.6076
 epoch: 75, train_loss: 0.6159, test_loss: 0.9002, test_f1: 0.6096
 epoch: 76, train_loss: 0.5977, test_loss: 0.9335, test_f1: 0.6199
 epoch: 77, train_loss: 0.6023, test_loss: 0.9315, test_f1: 0.6144
 epoch: 78, train_loss: 0.6205, test_loss: 1.2338, test_f1: 0.5570
 epoch: 79, train_loss: 0.6081, test_loss: 0.9480, test_f1: 0.5820
 epoch: 80, train_loss: 0.5964, test_loss: 0.9165, test_f1: 0.6337
 epoch: 81, train_loss: 0.5941, test_loss: 0.9062, test_f1: 0.6103
 epoch: 82, train_loss: 0.5810, test_loss: 0.8878, test_f1: 0.6200
 epoch: 83, train_loss: 0.5855, test_loss: 0.9605, test_f1: 0.6172
 epoch: 84, train_loss: 0.5933, test_loss: 0.9387, test_f1: 0.6292
 epoch: 85, train_loss: 0.5821, test_loss: 0.9445, test_f1: 0.6307
 epoch: 86, train_loss: 0.5786, test_loss: 0.9645, test_f1: 0.6277
 epoch: 87, train_loss: 0.5798, test_loss: 0.9362, test_f1: 0.6362
 epoch: 88, train_loss: 0.5732, test_loss: 0.9272, test_f1: 0.6197
 epoch: 89, train_loss: 0.5907, test_loss: 0.9739, test_f1: 0.6091
 epoch: 90, train_loss: 0.5645, test_loss: 0.9505, test_f1: 0.6318
 epoch: 91, train_loss: 0.5777, test_loss: 0.9485, test_f1: 0.5982
 epoch: 92, train_loss: 0.5723, test_loss: 0.9853, test_f1: 0.6123
 epoch: 93, train_loss: 0.5759, test_loss: 0.9656, test_f1: 0.6055
 epoch: 94, train_loss: 0.5671, test_loss: 0.9874, test_f1: 0.6166
 epoch: 95, train_loss: 0.5752, test_loss: 0.9502, test_f1: 0.6269
 epoch: 96, train_loss: 0.5715, test_loss: 0.9727, test_f1: 0.6187
 epoch: 97, train_loss: 0.5545, test_loss: 0.9822, test_f1: 0.6316
 epoch: 98, train_loss: 0.5817, test_loss: 0.9517, test_f1: 0.6195
 epoch: 99, train_loss: 0.5607, test_loss: 0.9619, test_f1: 0.5846
##################ITERATION #7 ****************************************
 epoch: 0, train_loss: 1.3842, test_loss: 1.3621, test_f1: 0.2260
 epoch: 1, train_loss: 1.1866, test_loss: 1.3465, test_f1: 0.2260
 epoch: 2, train_loss: 1.1168, test_loss: 1.2061, test_f1: 0.2721
 epoch: 3, train_loss: 1.0570, test_loss: 1.0593, test_f1: 0.4334
 epoch: 4, train_loss: 1.0379, test_loss: 0.9921, test_f1: 0.4552
 epoch: 5, train_loss: 1.0031, test_loss: 0.9967, test_f1: 0.4595
 epoch: 6, train_loss: 0.9783, test_loss: 0.9604, test_f1: 0.4992
 epoch: 7, train_loss: 0.9483, test_loss: 0.9418, test_f1: 0.5066
 epoch: 8, train_loss: 0.9404, test_loss: 0.9469, test_f1: 0.4879
 epoch: 9, train_loss: 0.9352, test_loss: 0.8744, test_f1: 0.5136
 epoch: 10, train_loss: 0.9177, test_loss: 0.8628, test_f1: 0.5182
 epoch: 11, train_loss: 0.8857, test_loss: 0.8406, test_f1: 0.5345
 epoch: 12, train_loss: 0.8890, test_loss: 0.8548, test_f1: 0.5162
 epoch: 13, train_loss: 0.8740, test_loss: 0.9444, test_f1: 0.5189
 epoch: 14, train_loss: 0.8502, test_loss: 0.8398, test_f1: 0.5402
 epoch: 15, train_loss: 0.8450, test_loss: 0.8474, test_f1: 0.5627
 epoch: 16, train_loss: 0.8319, test_loss: 0.8451, test_f1: 0.5236
 epoch: 17, train_loss: 0.8301, test_loss: 0.8301, test_f1: 0.5466
 epoch: 18, train_loss: 0.8174, test_loss: 0.8296, test_f1: 0.5606
 epoch: 19, train_loss: 0.8084, test_loss: 0.8628, test_f1: 0.5389
 epoch: 20, train_loss: 0.8112, test_loss: 0.8143, test_f1: 0.5416
 epoch: 21, train_loss: 0.7961, test_loss: 0.8286, test_f1: 0.5376
 epoch: 22, train_loss: 0.7866, test_loss: 0.8267, test_f1: 0.5500
 epoch: 23, train_loss: 0.7911, test_loss: 0.8798, test_f1: 0.5306
 epoch: 24, train_loss: 0.7869, test_loss: 0.8879, test_f1: 0.5245
 epoch: 25, train_loss: 0.7676, test_loss: 0.8301, test_f1: 0.5455
 epoch: 26, train_loss: 0.7599, test_loss: 0.8066, test_f1: 0.5835
 epoch: 27, train_loss: 0.7648, test_loss: 0.8032, test_f1: 0.5937
 epoch: 28, train_loss: 0.7661, test_loss: 0.8060, test_f1: 0.5776
 epoch: 29, train_loss: 0.7662, test_loss: 0.8637, test_f1: 0.5675
 epoch: 30, train_loss: 0.7478, test_loss: 0.8017, test_f1: 0.5934
 epoch: 31, train_loss: 0.7465, test_loss: 0.9048, test_f1: 0.5727
 epoch: 32, train_loss: 0.7392, test_loss: 0.8243, test_f1: 0.5764
 epoch: 33, train_loss: 0.7296, test_loss: 0.8084, test_f1: 0.5741
 epoch: 34, train_loss: 0.7256, test_loss: 0.8450, test_f1: 0.5533
 epoch: 35, train_loss: 0.7282, test_loss: 0.9452, test_f1: 0.5356
 epoch: 36, train_loss: 0.7303, test_loss: 0.8468, test_f1: 0.5431
 epoch: 37, train_loss: 0.7248, test_loss: 0.8257, test_f1: 0.5788
 epoch: 38, train_loss: 0.7118, test_loss: 0.8623, test_f1: 0.5732
 epoch: 39, train_loss: 0.7144, test_loss: 0.8492, test_f1: 0.5672
 epoch: 40, train_loss: 0.7091, test_loss: 0.8649, test_f1: 0.5671
 epoch: 41, train_loss: 0.7099, test_loss: 0.8086, test_f1: 0.5836
 epoch: 42, train_loss: 0.7031, test_loss: 0.9408, test_f1: 0.5498
 epoch: 43, train_loss: 0.6933, test_loss: 0.8105, test_f1: 0.5741
 epoch: 44, train_loss: 0.6837, test_loss: 0.8613, test_f1: 0.5704
 epoch: 45, train_loss: 0.6904, test_loss: 0.9101, test_f1: 0.5677
 epoch: 46, train_loss: 0.6963, test_loss: 0.8616, test_f1: 0.5605
 epoch: 47, train_loss: 0.6770, test_loss: 0.7667, test_f1: 0.6077
 epoch: 48, train_loss: 0.6858, test_loss: 0.9402, test_f1: 0.5684
 epoch: 49, train_loss: 0.6708, test_loss: 0.9300, test_f1: 0.5565
 epoch: 50, train_loss: 0.6665, test_loss: 0.9977, test_f1: 0.5525
 epoch: 51, train_loss: 0.6520, test_loss: 0.9279, test_f1: 0.5611
 epoch: 52, train_loss: 0.6542, test_loss: 0.9052, test_f1: 0.5640
 epoch: 53, train_loss: 0.6507, test_loss: 0.8734, test_f1: 0.5848
 epoch: 54, train_loss: 0.6356, test_loss: 0.8848, test_f1: 0.5843
 epoch: 55, train_loss: 0.6325, test_loss: 0.8940, test_f1: 0.5651
 epoch: 56, train_loss: 0.6263, test_loss: 0.8763, test_f1: 0.5855
 epoch: 57, train_loss: 0.6297, test_loss: 0.9090, test_f1: 0.5781
 epoch: 58, train_loss: 0.6258, test_loss: 0.8905, test_f1: 0.5962
 epoch: 59, train_loss: 0.6301, test_loss: 0.9340, test_f1: 0.5806
 epoch: 60, train_loss: 0.6221, test_loss: 0.8862, test_f1: 0.5866
 epoch: 61, train_loss: 0.6204, test_loss: 0.9148, test_f1: 0.5843
 epoch: 62, train_loss: 0.6187, test_loss: 0.8859, test_f1: 0.5920
 epoch: 63, train_loss: 0.6232, test_loss: 0.8939, test_f1: 0.6007
 epoch: 64, train_loss: 0.6210, test_loss: 0.9269, test_f1: 0.5867
 epoch: 65, train_loss: 0.6193, test_loss: 0.9698, test_f1: 0.5824
 epoch: 66, train_loss: 0.6267, test_loss: 0.9065, test_f1: 0.5879
 epoch: 67, train_loss: 0.6146, test_loss: 0.8806, test_f1: 0.5762
 epoch: 68, train_loss: 0.6157, test_loss: 0.9032, test_f1: 0.6023
 epoch: 69, train_loss: 0.6125, test_loss: 0.9094, test_f1: 0.5899
 epoch: 70, train_loss: 0.6017, test_loss: 0.9001, test_f1: 0.5987
 epoch: 71, train_loss: 0.6092, test_loss: 0.8896, test_f1: 0.5784
 epoch: 72, train_loss: 0.5971, test_loss: 0.9049, test_f1: 0.6147
 epoch: 73, train_loss: 0.6052, test_loss: 0.9760, test_f1: 0.5939
 epoch: 74, train_loss: 0.6159, test_loss: 0.9482, test_f1: 0.5996
 epoch: 75, train_loss: 0.6034, test_loss: 0.9288, test_f1: 0.5885
 epoch: 76, train_loss: 0.6009, test_loss: 0.9459, test_f1: 0.5783
 epoch: 77, train_loss: 0.5986, test_loss: 0.9341, test_f1: 0.6067
 epoch: 78, train_loss: 0.5979, test_loss: 0.8846, test_f1: 0.5960
 epoch: 79, train_loss: 0.5846, test_loss: 0.9261, test_f1: 0.5923
 epoch: 80, train_loss: 0.5904, test_loss: 0.9183, test_f1: 0.6041
 epoch: 81, train_loss: 0.5971, test_loss: 0.8866, test_f1: 0.6055
 epoch: 82, train_loss: 0.5890, test_loss: 0.8815, test_f1: 0.6094
 epoch: 83, train_loss: 0.5821, test_loss: 0.9284, test_f1: 0.5965
 epoch: 84, train_loss: 0.5909, test_loss: 0.8276, test_f1: 0.6163
 epoch: 85, train_loss: 0.5770, test_loss: 0.9106, test_f1: 0.6197
 epoch: 86, train_loss: 0.5763, test_loss: 0.9535, test_f1: 0.5950
 epoch: 87, train_loss: 0.5742, test_loss: 0.9415, test_f1: 0.5863
 epoch: 88, train_loss: 0.5618, test_loss: 0.9437, test_f1: 0.6111
 epoch: 89, train_loss: 0.5698, test_loss: 0.9044, test_f1: 0.6061
 epoch: 90, train_loss: 0.5719, test_loss: 0.8722, test_f1: 0.6056
 epoch: 91, train_loss: 0.5749, test_loss: 0.8854, test_f1: 0.6048
 epoch: 92, train_loss: 0.5698, test_loss: 1.1796, test_f1: 0.5610
 epoch: 93, train_loss: 0.5583, test_loss: 0.9681, test_f1: 0.6001
 epoch: 94, train_loss: 0.5677, test_loss: 0.9390, test_f1: 0.5984
 epoch: 95, train_loss: 0.5771, test_loss: 0.8954, test_f1: 0.6108
 epoch: 96, train_loss: 0.5618, test_loss: 0.8851, test_f1: 0.6008
 epoch: 97, train_loss: 0.5484, test_loss: 0.9510, test_f1: 0.6066
 epoch: 98, train_loss: 0.5501, test_loss: 0.9890, test_f1: 0.5887
 epoch: 99, train_loss: 0.5551, test_loss: 0.9248, test_f1: 0.6100
##################ITERATION #8 ****************************************
 epoch: 0, train_loss: 1.2802, test_loss: 1.4581, test_f1: 0.2260
 epoch: 1, train_loss: 1.1180, test_loss: 1.2644, test_f1: 0.2260
 epoch: 2, train_loss: 1.0523, test_loss: 1.1351, test_f1: 0.3304
 epoch: 3, train_loss: 1.0056, test_loss: 1.0097, test_f1: 0.3870
 epoch: 4, train_loss: 0.9807, test_loss: 0.9444, test_f1: 0.4958
 epoch: 5, train_loss: 0.9735, test_loss: 0.9619, test_f1: 0.4932
 epoch: 6, train_loss: 0.9583, test_loss: 0.9263, test_f1: 0.5024
 epoch: 7, train_loss: 0.9286, test_loss: 0.9235, test_f1: 0.5365
 epoch: 8, train_loss: 0.9124, test_loss: 0.8981, test_f1: 0.5025
 epoch: 9, train_loss: 0.8918, test_loss: 0.8752, test_f1: 0.5306
 epoch: 10, train_loss: 0.8890, test_loss: 0.9079, test_f1: 0.5204
 epoch: 11, train_loss: 0.8678, test_loss: 0.9177, test_f1: 0.5295
 epoch: 12, train_loss: 0.8587, test_loss: 0.9583, test_f1: 0.5221
 epoch: 13, train_loss: 0.8525, test_loss: 0.8848, test_f1: 0.5042
 epoch: 14, train_loss: 0.8522, test_loss: 0.9073, test_f1: 0.5384
 epoch: 15, train_loss: 0.8320, test_loss: 0.9178, test_f1: 0.5398
 epoch: 16, train_loss: 0.8276, test_loss: 0.9453, test_f1: 0.5098
 epoch: 17, train_loss: 0.8126, test_loss: 0.8646, test_f1: 0.5344
 epoch: 18, train_loss: 0.8083, test_loss: 0.9308, test_f1: 0.5307
 epoch: 19, train_loss: 0.8025, test_loss: 0.9100, test_f1: 0.5455
 epoch: 20, train_loss: 0.7799, test_loss: 0.8880, test_f1: 0.5525
 epoch: 21, train_loss: 0.7689, test_loss: 0.8717, test_f1: 0.5651
 epoch: 22, train_loss: 0.7645, test_loss: 0.9125, test_f1: 0.5481
 epoch: 23, train_loss: 0.7756, test_loss: 0.9152, test_f1: 0.5698
 epoch: 24, train_loss: 0.7638, test_loss: 0.9294, test_f1: 0.5673
 epoch: 25, train_loss: 0.7651, test_loss: 0.9022, test_f1: 0.5330
 epoch: 26, train_loss: 0.7652, test_loss: 0.9210, test_f1: 0.5437
 epoch: 27, train_loss: 0.7527, test_loss: 0.9296, test_f1: 0.5673
 epoch: 28, train_loss: 0.7423, test_loss: 0.8770, test_f1: 0.5716
 epoch: 29, train_loss: 0.7386, test_loss: 0.8845, test_f1: 0.5876
 epoch: 30, train_loss: 0.7143, test_loss: 0.8736, test_f1: 0.5603
 epoch: 31, train_loss: 0.7195, test_loss: 0.8279, test_f1: 0.5804
 epoch: 32, train_loss: 0.7175, test_loss: 0.8418, test_f1: 0.5745
 epoch: 33, train_loss: 0.7070, test_loss: 0.8863, test_f1: 0.5742
 epoch: 34, train_loss: 0.6998, test_loss: 0.9194, test_f1: 0.5772
 epoch: 35, train_loss: 0.7019, test_loss: 0.8766, test_f1: 0.5747
 epoch: 36, train_loss: 0.6973, test_loss: 0.8664, test_f1: 0.5753
 epoch: 37, train_loss: 0.6841, test_loss: 0.9147, test_f1: 0.5667
 epoch: 38, train_loss: 0.6936, test_loss: 0.9423, test_f1: 0.5622
 epoch: 39, train_loss: 0.6973, test_loss: 0.9264, test_f1: 0.5819
 epoch: 40, train_loss: 0.7042, test_loss: 0.8800, test_f1: 0.5984
 epoch: 41, train_loss: 0.6759, test_loss: 0.9315, test_f1: 0.5689
 epoch: 42, train_loss: 0.6849, test_loss: 0.9033, test_f1: 0.5945
 epoch: 43, train_loss: 0.6842, test_loss: 0.9645, test_f1: 0.5739
 epoch: 44, train_loss: 0.6693, test_loss: 0.8956, test_f1: 0.5949
 epoch: 45, train_loss: 0.6708, test_loss: 0.9166, test_f1: 0.5769
 epoch: 46, train_loss: 0.6720, test_loss: 0.9142, test_f1: 0.5666
 epoch: 47, train_loss: 0.6496, test_loss: 0.8811, test_f1: 0.6063
 epoch: 48, train_loss: 0.6593, test_loss: 0.9353, test_f1: 0.5851
 epoch: 49, train_loss: 0.6576, test_loss: 0.9823, test_f1: 0.5386
 epoch: 50, train_loss: 0.6528, test_loss: 0.9598, test_f1: 0.5754
 epoch: 51, train_loss: 0.6337, test_loss: 0.9579, test_f1: 0.5790
 epoch: 52, train_loss: 0.6270, test_loss: 0.9445, test_f1: 0.5887
 epoch: 53, train_loss: 0.6260, test_loss: 0.9383, test_f1: 0.5833
 epoch: 54, train_loss: 0.6134, test_loss: 0.9183, test_f1: 0.5878
 epoch: 55, train_loss: 0.6334, test_loss: 0.9442, test_f1: 0.5946
 epoch: 56, train_loss: 0.6183, test_loss: 0.9230, test_f1: 0.5971
 epoch: 57, train_loss: 0.6136, test_loss: 0.9545, test_f1: 0.6017
 epoch: 58, train_loss: 0.6147, test_loss: 0.9272, test_f1: 0.6045
 epoch: 59, train_loss: 0.6156, test_loss: 0.9358, test_f1: 0.6210
 epoch: 60, train_loss: 0.6027, test_loss: 0.9389, test_f1: 0.6029
 epoch: 61, train_loss: 0.6016, test_loss: 0.9923, test_f1: 0.5906
 epoch: 62, train_loss: 0.5943, test_loss: 0.9126, test_f1: 0.5954
 epoch: 63, train_loss: 0.6033, test_loss: 0.9345, test_f1: 0.5896
 epoch: 64, train_loss: 0.5922, test_loss: 0.9801, test_f1: 0.5986
 epoch: 65, train_loss: 0.6018, test_loss: 0.9444, test_f1: 0.5961
 epoch: 66, train_loss: 0.5885, test_loss: 0.9281, test_f1: 0.6183
 epoch: 67, train_loss: 0.5867, test_loss: 1.0059, test_f1: 0.6227
 epoch: 68, train_loss: 0.5948, test_loss: 0.9983, test_f1: 0.5957
 epoch: 69, train_loss: 0.5787, test_loss: 1.0246, test_f1: 0.5842
 epoch: 70, train_loss: 0.5979, test_loss: 0.9694, test_f1: 0.5922
 epoch: 71, train_loss: 0.5948, test_loss: 0.9369, test_f1: 0.6011
 epoch: 72, train_loss: 0.5930, test_loss: 1.0397, test_f1: 0.5774
 epoch: 73, train_loss: 0.5828, test_loss: 0.9771, test_f1: 0.6076
 epoch: 74, train_loss: 0.5842, test_loss: 1.0151, test_f1: 0.5982
 epoch: 75, train_loss: 0.5854, test_loss: 1.0067, test_f1: 0.5894
 epoch: 76, train_loss: 0.5752, test_loss: 0.9826, test_f1: 0.5831
 epoch: 77, train_loss: 0.5620, test_loss: 1.0212, test_f1: 0.5823
 epoch: 78, train_loss: 0.5660, test_loss: 0.9745, test_f1: 0.5920
 epoch: 79, train_loss: 0.5656, test_loss: 1.0119, test_f1: 0.6015
 epoch: 80, train_loss: 0.5661, test_loss: 1.0076, test_f1: 0.5971
 epoch: 81, train_loss: 0.5778, test_loss: 1.0401, test_f1: 0.5917
 epoch: 82, train_loss: 0.5578, test_loss: 1.0019, test_f1: 0.6096
 epoch: 83, train_loss: 0.5558, test_loss: 1.0121, test_f1: 0.6010
 epoch: 84, train_loss: 0.5637, test_loss: 1.0089, test_f1: 0.5878
 epoch: 85, train_loss: 0.5598, test_loss: 1.0163, test_f1: 0.6052
 epoch: 86, train_loss: 0.5722, test_loss: 1.0475, test_f1: 0.5975
 epoch: 87, train_loss: 0.5573, test_loss: 0.9931, test_f1: 0.6059
 epoch: 88, train_loss: 0.5504, test_loss: 1.0171, test_f1: 0.5991
 epoch: 89, train_loss: 0.5474, test_loss: 1.0670, test_f1: 0.5901
 epoch: 90, train_loss: 0.5547, test_loss: 1.0494, test_f1: 0.5965
 epoch: 91, train_loss: 0.5660, test_loss: 1.0304, test_f1: 0.6022
 epoch: 92, train_loss: 0.5558, test_loss: 1.0625, test_f1: 0.6073
 epoch: 93, train_loss: 0.5583, test_loss: 1.0506, test_f1: 0.5843
 epoch: 94, train_loss: 0.5418, test_loss: 1.0240, test_f1: 0.5974
 epoch: 95, train_loss: 0.5304, test_loss: 1.0537, test_f1: 0.6166
 epoch: 96, train_loss: 0.5447, test_loss: 1.0598, test_f1: 0.5984
 epoch: 97, train_loss: 0.5436, test_loss: 1.0612, test_f1: 0.5913
 epoch: 98, train_loss: 0.5422, test_loss: 1.0918, test_f1: 0.5803
 epoch: 99, train_loss: 0.5435, test_loss: 1.1096, test_f1: 0.5996
##################ITERATION #9 ****************************************
 epoch: 0, train_loss: 1.4534, test_loss: 1.3705, test_f1: 0.2586
 epoch: 1, train_loss: 1.1379, test_loss: 1.3397, test_f1: 0.3740
 epoch: 2, train_loss: 1.0828, test_loss: 1.2692, test_f1: 0.3793
 epoch: 3, train_loss: 1.0595, test_loss: 1.1574, test_f1: 0.3997
 epoch: 4, train_loss: 1.0275, test_loss: 1.0023, test_f1: 0.4922
 epoch: 5, train_loss: 0.9914, test_loss: 0.9354, test_f1: 0.5177
 epoch: 6, train_loss: 0.9897, test_loss: 0.9434, test_f1: 0.5065
 epoch: 7, train_loss: 0.9634, test_loss: 0.9594, test_f1: 0.5004
 epoch: 8, train_loss: 0.9494, test_loss: 0.9082, test_f1: 0.5368
 epoch: 9, train_loss: 0.9246, test_loss: 0.9078, test_f1: 0.5159
 epoch: 10, train_loss: 0.9076, test_loss: 0.9238, test_f1: 0.5137
 epoch: 11, train_loss: 0.8966, test_loss: 0.8918, test_f1: 0.5212
 epoch: 12, train_loss: 0.8809, test_loss: 0.8825, test_f1: 0.5379
 epoch: 13, train_loss: 0.8683, test_loss: 0.9130, test_f1: 0.5566
 epoch: 14, train_loss: 0.8585, test_loss: 0.8246, test_f1: 0.5705
 epoch: 15, train_loss: 0.8459, test_loss: 0.9881, test_f1: 0.5477
 epoch: 16, train_loss: 0.8370, test_loss: 0.8525, test_f1: 0.5564
 epoch: 17, train_loss: 0.8269, test_loss: 0.8482, test_f1: 0.5602
 epoch: 18, train_loss: 0.8207, test_loss: 0.8611, test_f1: 0.5815
 epoch: 19, train_loss: 0.8186, test_loss: 0.8571, test_f1: 0.5764
 epoch: 20, train_loss: 0.8097, test_loss: 1.0267, test_f1: 0.5324
 epoch: 21, train_loss: 0.7991, test_loss: 0.8798, test_f1: 0.5664
 epoch: 22, train_loss: 0.8006, test_loss: 0.8508, test_f1: 0.5667
 epoch: 23, train_loss: 0.7941, test_loss: 0.8531, test_f1: 0.5887
 epoch: 24, train_loss: 0.7780, test_loss: 0.8119, test_f1: 0.5806
 epoch: 25, train_loss: 0.7758, test_loss: 0.8274, test_f1: 0.5888
 epoch: 26, train_loss: 0.7586, test_loss: 0.8726, test_f1: 0.5835
 epoch: 27, train_loss: 0.7606, test_loss: 0.8414, test_f1: 0.5921
 epoch: 28, train_loss: 0.7654, test_loss: 0.8590, test_f1: 0.5578
 epoch: 29, train_loss: 0.7510, test_loss: 0.8423, test_f1: 0.6012
 epoch: 30, train_loss: 0.7375, test_loss: 0.8558, test_f1: 0.6179
 epoch: 31, train_loss: 0.7371, test_loss: 0.8766, test_f1: 0.5682
 epoch: 32, train_loss: 0.7499, test_loss: 0.9295, test_f1: 0.5728
 epoch: 33, train_loss: 0.7170, test_loss: 0.8713, test_f1: 0.5822
 epoch: 34, train_loss: 0.7213, test_loss: 0.8507, test_f1: 0.5922
 epoch: 35, train_loss: 0.7084, test_loss: 0.8366, test_f1: 0.5913
 epoch: 36, train_loss: 0.7017, test_loss: 0.9698, test_f1: 0.5782
 epoch: 37, train_loss: 0.6970, test_loss: 0.8523, test_f1: 0.5842
 epoch: 38, train_loss: 0.6919, test_loss: 0.8580, test_f1: 0.5860
 epoch: 39, train_loss: 0.7028, test_loss: 0.7756, test_f1: 0.5922
 epoch: 40, train_loss: 0.6990, test_loss: 1.0610, test_f1: 0.5498
 epoch: 41, train_loss: 0.6707, test_loss: 0.8280, test_f1: 0.6014
 epoch: 42, train_loss: 0.6766, test_loss: 0.8507, test_f1: 0.5766
 epoch: 43, train_loss: 0.6658, test_loss: 0.8315, test_f1: 0.5956
 epoch: 44, train_loss: 0.6581, test_loss: 0.8885, test_f1: 0.5795
 epoch: 45, train_loss: 0.6635, test_loss: 0.7916, test_f1: 0.5942
 epoch: 46, train_loss: 0.6711, test_loss: 0.9280, test_f1: 0.5943
 epoch: 47, train_loss: 0.6655, test_loss: 0.8490, test_f1: 0.5779
 epoch: 48, train_loss: 0.6582, test_loss: 0.8556, test_f1: 0.5923
 epoch: 49, train_loss: 0.6562, test_loss: 0.8875, test_f1: 0.5742
 epoch: 50, train_loss: 0.6583, test_loss: 0.8418, test_f1: 0.6015
 epoch: 51, train_loss: 0.6433, test_loss: 0.8656, test_f1: 0.6207
 epoch: 52, train_loss: 0.6249, test_loss: 0.8495, test_f1: 0.5873
 epoch: 53, train_loss: 0.6149, test_loss: 0.8564, test_f1: 0.6067
 epoch: 54, train_loss: 0.6058, test_loss: 0.8418, test_f1: 0.6236
 epoch: 55, train_loss: 0.6026, test_loss: 0.8483, test_f1: 0.6017
 epoch: 56, train_loss: 0.6082, test_loss: 0.8156, test_f1: 0.6237
 epoch: 57, train_loss: 0.5974, test_loss: 0.8352, test_f1: 0.6234
 epoch: 58, train_loss: 0.6040, test_loss: 0.8706, test_f1: 0.5941
 epoch: 59, train_loss: 0.5949, test_loss: 0.8598, test_f1: 0.6039
 epoch: 60, train_loss: 0.5968, test_loss: 0.8245, test_f1: 0.6116
 epoch: 61, train_loss: 0.5875, test_loss: 0.8732, test_f1: 0.6134
 epoch: 62, train_loss: 0.5909, test_loss: 0.8574, test_f1: 0.6020
 epoch: 63, train_loss: 0.5783, test_loss: 0.8362, test_f1: 0.5856
 epoch: 64, train_loss: 0.5824, test_loss: 0.8767, test_f1: 0.5779
 epoch: 65, train_loss: 0.5950, test_loss: 0.8550, test_f1: 0.5964
 epoch: 66, train_loss: 0.5948, test_loss: 0.8282, test_f1: 0.6100
 epoch: 67, train_loss: 0.5756, test_loss: 0.8621, test_f1: 0.5741
 epoch: 68, train_loss: 0.5701, test_loss: 0.8411, test_f1: 0.6074
 epoch: 69, train_loss: 0.5837, test_loss: 0.8659, test_f1: 0.5783
 epoch: 70, train_loss: 0.5667, test_loss: 0.8697, test_f1: 0.5934
 epoch: 71, train_loss: 0.5748, test_loss: 0.8593, test_f1: 0.6082
 epoch: 72, train_loss: 0.5720, test_loss: 0.8495, test_f1: 0.6242
 epoch: 73, train_loss: 0.5789, test_loss: 0.9147, test_f1: 0.5882
 epoch: 74, train_loss: 0.5710, test_loss: 0.8922, test_f1: 0.5933
 epoch: 75, train_loss: 0.5763, test_loss: 0.8803, test_f1: 0.6109
 epoch: 76, train_loss: 0.5541, test_loss: 0.8947, test_f1: 0.6013
 epoch: 77, train_loss: 0.5569, test_loss: 0.9046, test_f1: 0.6065
 epoch: 78, train_loss: 0.5538, test_loss: 0.8825, test_f1: 0.5978
 epoch: 79, train_loss: 0.5627, test_loss: 0.8460, test_f1: 0.6015
 epoch: 80, train_loss: 0.5592, test_loss: 0.8595, test_f1: 0.6037
 epoch: 81, train_loss: 0.5389, test_loss: 0.8870, test_f1: 0.5878
 epoch: 82, train_loss: 0.5537, test_loss: 0.9123, test_f1: 0.5806
 epoch: 83, train_loss: 0.5479, test_loss: 0.8572, test_f1: 0.6139
 epoch: 84, train_loss: 0.5443, test_loss: 0.8824, test_f1: 0.5939
 epoch: 85, train_loss: 0.5533, test_loss: 0.8605, test_f1: 0.6053
 epoch: 86, train_loss: 0.5379, test_loss: 0.8677, test_f1: 0.6149
 epoch: 87, train_loss: 0.5376, test_loss: 0.8588, test_f1: 0.6206
 epoch: 88, train_loss: 0.5533, test_loss: 0.8333, test_f1: 0.6211
 epoch: 89, train_loss: 0.5384, test_loss: 0.8696, test_f1: 0.5951
 epoch: 90, train_loss: 0.5356, test_loss: 0.8848, test_f1: 0.5942
 epoch: 91, train_loss: 0.5265, test_loss: 0.8458, test_f1: 0.6408
 epoch: 92, train_loss: 0.5329, test_loss: 0.8845, test_f1: 0.6137
 epoch: 93, train_loss: 0.5338, test_loss: 0.8777, test_f1: 0.6240
 epoch: 94, train_loss: 0.5328, test_loss: 0.8522, test_f1: 0.6335
 epoch: 95, train_loss: 0.5388, test_loss: 0.9534, test_f1: 0.5913
 epoch: 96, train_loss: 0.5086, test_loss: 0.8568, test_f1: 0.6262
 epoch: 97, train_loss: 0.5144, test_loss: 0.8836, test_f1: 0.6088
 epoch: 98, train_loss: 0.5350, test_loss: 0.9168, test_f1: 0.5985
 epoch: 99, train_loss: 0.5203, test_loss: 0.9415, test_f1: 0.5993

Training completed in 425.50 seconds
Best F1: 0.6408 at epoch 91
Mean F1 across iterations: 0.6190  0.0159
========================FINAL RESULTS================================
FEGIN weighted F1: 0.6408  0.0159
python main.py --data ltspice_examples --representation component_pin --model FEGIN --layers 4 --hiddens 32 --batch_size 256 --lr 0.001 --emb_size 128 --epochs 100 --save_appendix component_pin_L4_H32_BS256_LR0.001_E128 --no_val
-----



STDERR:
  File "main.py", line 370, in <module>
    main()
  File "main.py", line 254, in main
    dataset = dataset_class(
  File "/home/philip/projects/ltspice_examples_code_repo/Circuit-Completion-Using-GNNs/component_classification_with_link_prediction_head/evaluation/FEGIN/kernel/circuit_datasets.py", line 15, in __init__
    self.data, self.slices = torch.load(self.processed_paths[0])
  File "/home/philip/.local/lib/python3.8/site-packages/torch/serialization.py", line 1040, in load
    warnings.warn(
  File "/usr/lib/python3.8/warnings.py", line 109, in _showwarnmsg
    sw(msg.message, msg.category, msg.filename, msg.lineno,
  File "main.py", line 47, in warn_with_traceback
    traceback.print_stack(file=log)
/home/philip/projects/ltspice_examples_code_repo/Circuit-Completion-Using-GNNs/component_classification_with_link_prediction_head/evaluation/FEGIN/kernel/circuit_datasets.py:15: FutureWarning: You are using `torch.load` with `weights_only=False` (the current default value), which uses the default pickle module implicitly. It is possible to construct malicious pickle data which will execute arbitrary code during unpickling (See https://github.com/pytorch/pytorch/blob/main/SECURITY.md#untrusted-models for more details). In a future release, the default value for `weights_only` will be flipped to `True`. This limits the functions that could be executed during unpickling. Arbitrary objects will no longer be allowed to be loaded via this mode unless they are explicitly allowlisted by the user via `torch.serialization.add_safe_globals`. We recommend you start setting `weights_only=True` for any use case where you don't have full control of the loaded file. Please open an issue on GitHub for any issues related to this experimental feature.
  self.data, self.slices = torch.load(self.processed_paths[0])
