STDOUT:
Results will be saved in /home/philip/projects/ltspice_examples_code_repo/Circuit-Completion-Using-GNNs/component_classification_with_link_prediction_head/evaluation/FEGIN/results/model_FEGIN_dataset_ltspice_demos
Command line input: python main.py --data ltspice_demos --representation component_net --model FEGIN --layers 5 --hiddens 32 --batch_size 128 --lr 0.0001 --emb_size 250 --epochs 100 --save_appendix component_net_L5_H32_BS128_LR0.0001_E250 --no_val
 is saved.
-----
ltspice_demos - FEGIN
Using 5 layers, 32 hidden units, h = 2
Loading component_net representation dataset
ENTERED
Training FEGIN on component_net representation
Train: 1565, Test: 383
##################ITERATION #0 ****************************************
 epoch: 0, train_loss: 1.4424, test_loss: 1.4341, test_f1: 0.0507
 epoch: 1, train_loss: 1.4358, test_loss: 1.4334, test_f1: 0.0507
 epoch: 2, train_loss: 1.4314, test_loss: 1.4294, test_f1: 0.0507
 epoch: 3, train_loss: 1.4279, test_loss: 1.4247, test_f1: 0.0559
 epoch: 4, train_loss: 1.4244, test_loss: 1.4228, test_f1: 0.0772
 epoch: 5, train_loss: 1.4210, test_loss: 1.4153, test_f1: 0.0933
 epoch: 6, train_loss: 1.4165, test_loss: 1.4089, test_f1: 0.1419
 epoch: 7, train_loss: 1.4119, test_loss: 1.4053, test_f1: 0.1459
 epoch: 8, train_loss: 1.4064, test_loss: 1.4005, test_f1: 0.1785
 epoch: 9, train_loss: 1.4016, test_loss: 1.3943, test_f1: 0.1905
 epoch: 10, train_loss: 1.3980, test_loss: 1.3919, test_f1: 0.1775
 epoch: 11, train_loss: 1.3899, test_loss: 1.3870, test_f1: 0.1999
 epoch: 12, train_loss: 1.3840, test_loss: 1.3830, test_f1: 0.2357
 epoch: 13, train_loss: 1.3765, test_loss: 1.3740, test_f1: 0.2447
 epoch: 14, train_loss: 1.3709, test_loss: 1.3693, test_f1: 0.2901
 epoch: 15, train_loss: 1.3620, test_loss: 1.3639, test_f1: 0.3670
 epoch: 16, train_loss: 1.3544, test_loss: 1.3566, test_f1: 0.4002
 epoch: 17, train_loss: 1.3452, test_loss: 1.3499, test_f1: 0.4014
 epoch: 18, train_loss: 1.3357, test_loss: 1.3383, test_f1: 0.4067
 epoch: 19, train_loss: 1.3288, test_loss: 1.3337, test_f1: 0.4028
 epoch: 20, train_loss: 1.3144, test_loss: 1.3212, test_f1: 0.3863
 epoch: 21, train_loss: 1.3047, test_loss: 1.3127, test_f1: 0.3897
 epoch: 22, train_loss: 1.2874, test_loss: 1.3067, test_f1: 0.3750
 epoch: 23, train_loss: 1.2774, test_loss: 1.2981, test_f1: 0.3860
 epoch: 24, train_loss: 1.2658, test_loss: 1.2909, test_f1: 0.3944
 epoch: 25, train_loss: 1.2563, test_loss: 1.2787, test_f1: 0.3856
 epoch: 26, train_loss: 1.2462, test_loss: 1.2719, test_f1: 0.3968
 epoch: 27, train_loss: 1.2334, test_loss: 1.2641, test_f1: 0.3915
 epoch: 28, train_loss: 1.2275, test_loss: 1.2574, test_f1: 0.3919
 epoch: 29, train_loss: 1.2209, test_loss: 1.2509, test_f1: 0.3923
 epoch: 30, train_loss: 1.2083, test_loss: 1.2417, test_f1: 0.3759
 epoch: 31, train_loss: 1.2073, test_loss: 1.2386, test_f1: 0.3699
 epoch: 32, train_loss: 1.1971, test_loss: 1.2359, test_f1: 0.3514
 epoch: 33, train_loss: 1.1900, test_loss: 1.2335, test_f1: 0.3335
 epoch: 34, train_loss: 1.1863, test_loss: 1.2277, test_f1: 0.3379
 epoch: 35, train_loss: 1.1798, test_loss: 1.2264, test_f1: 0.3391
 epoch: 36, train_loss: 1.1751, test_loss: 1.2259, test_f1: 0.3384
 epoch: 37, train_loss: 1.1715, test_loss: 1.2270, test_f1: 0.3099
 epoch: 38, train_loss: 1.1700, test_loss: 1.2188, test_f1: 0.3068
 epoch: 39, train_loss: 1.1578, test_loss: 1.2159, test_f1: 0.3084
 epoch: 40, train_loss: 1.1582, test_loss: 1.2161, test_f1: 0.3081
 epoch: 41, train_loss: 1.1541, test_loss: 1.2130, test_f1: 0.3082
 epoch: 42, train_loss: 1.1502, test_loss: 1.2131, test_f1: 0.3066
 epoch: 43, train_loss: 1.1479, test_loss: 1.2102, test_f1: 0.3083
 epoch: 44, train_loss: 1.1433, test_loss: 1.2127, test_f1: 0.3067
 epoch: 45, train_loss: 1.1409, test_loss: 1.2101, test_f1: 0.3067
 epoch: 46, train_loss: 1.1393, test_loss: 1.2151, test_f1: 0.3186
 epoch: 47, train_loss: 1.1372, test_loss: 1.2352, test_f1: 0.3163
 epoch: 48, train_loss: 1.1349, test_loss: 1.2320, test_f1: 0.3202
 epoch: 49, train_loss: 1.1291, test_loss: 1.2078, test_f1: 0.3185
 epoch: 50, train_loss: 1.1242, test_loss: 1.2033, test_f1: 0.3185
 epoch: 51, train_loss: 1.1270, test_loss: 1.2057, test_f1: 0.3171
 epoch: 52, train_loss: 1.1209, test_loss: 1.1974, test_f1: 0.3223
 epoch: 53, train_loss: 1.1207, test_loss: 1.1956, test_f1: 0.3186
 epoch: 54, train_loss: 1.1208, test_loss: 1.2001, test_f1: 0.3187
 epoch: 55, train_loss: 1.1223, test_loss: 1.1943, test_f1: 0.3186
 epoch: 56, train_loss: 1.1138, test_loss: 1.1926, test_f1: 0.3169
 epoch: 57, train_loss: 1.1152, test_loss: 1.2061, test_f1: 0.3203
 epoch: 58, train_loss: 1.1190, test_loss: 1.1988, test_f1: 0.3203
 epoch: 59, train_loss: 1.1091, test_loss: 1.1968, test_f1: 0.3186
 epoch: 60, train_loss: 1.1156, test_loss: 1.1982, test_f1: 0.3186
 epoch: 61, train_loss: 1.1196, test_loss: 1.1956, test_f1: 0.3239
 epoch: 62, train_loss: 1.1044, test_loss: 1.1921, test_f1: 0.3278
 epoch: 63, train_loss: 1.1191, test_loss: 1.1889, test_f1: 0.3313
 epoch: 64, train_loss: 1.1103, test_loss: 1.1977, test_f1: 0.3186
 epoch: 65, train_loss: 1.1002, test_loss: 1.1927, test_f1: 0.3261
 epoch: 66, train_loss: 1.1140, test_loss: 1.1849, test_f1: 0.3243
 epoch: 67, train_loss: 1.1092, test_loss: 1.1837, test_f1: 0.3534
 epoch: 68, train_loss: 1.1049, test_loss: 1.1882, test_f1: 0.3276
 epoch: 69, train_loss: 1.1019, test_loss: 1.1860, test_f1: 0.3239
 epoch: 70, train_loss: 1.0966, test_loss: 1.1837, test_f1: 0.3733
 epoch: 71, train_loss: 1.1016, test_loss: 1.1982, test_f1: 0.3681
 epoch: 72, train_loss: 1.0993, test_loss: 1.1856, test_f1: 0.3733
 epoch: 73, train_loss: 1.0991, test_loss: 1.1888, test_f1: 0.3733
 epoch: 74, train_loss: 1.1024, test_loss: 1.1852, test_f1: 0.3716
 epoch: 75, train_loss: 1.1007, test_loss: 1.1831, test_f1: 0.3767
 epoch: 76, train_loss: 1.0964, test_loss: 1.1851, test_f1: 0.3783
 epoch: 77, train_loss: 1.0934, test_loss: 1.1804, test_f1: 0.3819
 epoch: 78, train_loss: 1.0992, test_loss: 1.1841, test_f1: 0.3819
 epoch: 79, train_loss: 1.0949, test_loss: 1.1786, test_f1: 0.3821
 epoch: 80, train_loss: 1.0942, test_loss: 1.1823, test_f1: 0.3821
 epoch: 81, train_loss: 1.0873, test_loss: 1.1940, test_f1: 0.3821
 epoch: 82, train_loss: 1.0917, test_loss: 1.1888, test_f1: 0.3856
 epoch: 83, train_loss: 1.0842, test_loss: 1.1840, test_f1: 0.3910
 epoch: 84, train_loss: 1.0876, test_loss: 1.1777, test_f1: 0.3910
 epoch: 85, train_loss: 1.0929, test_loss: 1.1798, test_f1: 0.3891
 epoch: 86, train_loss: 1.0799, test_loss: 1.1801, test_f1: 0.3891
 epoch: 87, train_loss: 1.0809, test_loss: 1.1795, test_f1: 0.3891
 epoch: 88, train_loss: 1.0824, test_loss: 1.1997, test_f1: 0.3875
 epoch: 89, train_loss: 1.0821, test_loss: 1.1927, test_f1: 0.3891
 epoch: 90, train_loss: 1.0867, test_loss: 1.1774, test_f1: 0.3875
 epoch: 91, train_loss: 1.0828, test_loss: 1.1744, test_f1: 0.4005
 epoch: 92, train_loss: 1.0811, test_loss: 1.1817, test_f1: 0.3924
 epoch: 93, train_loss: 1.0755, test_loss: 1.1795, test_f1: 0.3925
 epoch: 94, train_loss: 1.0774, test_loss: 1.1777, test_f1: 0.3992
 epoch: 95, train_loss: 1.0732, test_loss: 1.1854, test_f1: 0.3988
 epoch: 96, train_loss: 1.0819, test_loss: 1.1762, test_f1: 0.3996
 epoch: 97, train_loss: 1.0736, test_loss: 1.1787, test_f1: 0.3876
 epoch: 98, train_loss: 1.0736, test_loss: 1.1732, test_f1: 0.3957
 epoch: 99, train_loss: 1.0773, test_loss: 1.1733, test_f1: 0.4005
##################ITERATION #1 ****************************************
 epoch: 0, train_loss: 1.3638, test_loss: 1.3796, test_f1: 0.2281
 epoch: 1, train_loss: 1.3483, test_loss: 1.3695, test_f1: 0.2281
 epoch: 2, train_loss: 1.3388, test_loss: 1.3612, test_f1: 0.2281
 epoch: 3, train_loss: 1.3263, test_loss: 1.3568, test_f1: 0.2270
 epoch: 4, train_loss: 1.3180, test_loss: 1.3490, test_f1: 0.2274
 epoch: 5, train_loss: 1.3062, test_loss: 1.3422, test_f1: 0.2274
 epoch: 6, train_loss: 1.2959, test_loss: 1.3341, test_f1: 0.2274
 epoch: 7, train_loss: 1.2842, test_loss: 1.3273, test_f1: 0.2263
 epoch: 8, train_loss: 1.2774, test_loss: 1.3200, test_f1: 0.2263
 epoch: 9, train_loss: 1.2652, test_loss: 1.3128, test_f1: 0.2329
 epoch: 10, train_loss: 1.2595, test_loss: 1.3054, test_f1: 0.2582
 epoch: 11, train_loss: 1.2458, test_loss: 1.2974, test_f1: 0.2835
 epoch: 12, train_loss: 1.2348, test_loss: 1.2883, test_f1: 0.2910
 epoch: 13, train_loss: 1.2296, test_loss: 1.2797, test_f1: 0.2952
 epoch: 14, train_loss: 1.2190, test_loss: 1.2751, test_f1: 0.3010
 epoch: 15, train_loss: 1.2073, test_loss: 1.2673, test_f1: 0.3170
 epoch: 16, train_loss: 1.2019, test_loss: 1.2602, test_f1: 0.3242
 epoch: 17, train_loss: 1.1959, test_loss: 1.2536, test_f1: 0.3113
 epoch: 18, train_loss: 1.1888, test_loss: 1.2480, test_f1: 0.3099
 epoch: 19, train_loss: 1.1853, test_loss: 1.2411, test_f1: 0.3184
 epoch: 20, train_loss: 1.1726, test_loss: 1.2363, test_f1: 0.3184
 epoch: 21, train_loss: 1.1749, test_loss: 1.2312, test_f1: 0.3134
 epoch: 22, train_loss: 1.1647, test_loss: 1.2258, test_f1: 0.3279
 epoch: 23, train_loss: 1.1688, test_loss: 1.2224, test_f1: 0.3336
 epoch: 24, train_loss: 1.1584, test_loss: 1.2174, test_f1: 0.3336
 epoch: 25, train_loss: 1.1526, test_loss: 1.2152, test_f1: 0.3388
 epoch: 26, train_loss: 1.1442, test_loss: 1.2101, test_f1: 0.3457
 epoch: 27, train_loss: 1.1494, test_loss: 1.2054, test_f1: 0.3549
 epoch: 28, train_loss: 1.1463, test_loss: 1.2022, test_f1: 0.3433
 epoch: 29, train_loss: 1.1403, test_loss: 1.1979, test_f1: 0.3414
 epoch: 30, train_loss: 1.1409, test_loss: 1.1951, test_f1: 0.3479
 epoch: 31, train_loss: 1.1361, test_loss: 1.1934, test_f1: 0.3470
 epoch: 32, train_loss: 1.1383, test_loss: 1.1884, test_f1: 0.3394
 epoch: 33, train_loss: 1.1326, test_loss: 1.1883, test_f1: 0.3408
 epoch: 34, train_loss: 1.1281, test_loss: 1.1843, test_f1: 0.3399
 epoch: 35, train_loss: 1.1244, test_loss: 1.1796, test_f1: 0.3555
 epoch: 36, train_loss: 1.1216, test_loss: 1.1761, test_f1: 0.3515
 epoch: 37, train_loss: 1.1261, test_loss: 1.1763, test_f1: 0.3555
 epoch: 38, train_loss: 1.1235, test_loss: 1.1743, test_f1: 0.3612
 epoch: 39, train_loss: 1.1185, test_loss: 1.1739, test_f1: 0.3599
 epoch: 40, train_loss: 1.1125, test_loss: 1.1741, test_f1: 0.3744
 epoch: 41, train_loss: 1.1161, test_loss: 1.1678, test_f1: 0.3725
 epoch: 42, train_loss: 1.1060, test_loss: 1.1643, test_f1: 0.3744
 epoch: 43, train_loss: 1.1118, test_loss: 1.1622, test_f1: 0.3766
 epoch: 44, train_loss: 1.1018, test_loss: 1.1600, test_f1: 0.3735
 epoch: 45, train_loss: 1.1078, test_loss: 1.1596, test_f1: 0.3818
 epoch: 46, train_loss: 1.1014, test_loss: 1.1565, test_f1: 0.3734
 epoch: 47, train_loss: 1.0961, test_loss: 1.1567, test_f1: 0.3781
 epoch: 48, train_loss: 1.0942, test_loss: 1.1522, test_f1: 0.3826
 epoch: 49, train_loss: 1.0973, test_loss: 1.1502, test_f1: 0.3873
 epoch: 50, train_loss: 1.0967, test_loss: 1.1483, test_f1: 0.3957
 epoch: 51, train_loss: 1.0902, test_loss: 1.1490, test_f1: 0.3891
 epoch: 52, train_loss: 1.0940, test_loss: 1.1475, test_f1: 0.3928
 epoch: 53, train_loss: 1.0938, test_loss: 1.1457, test_f1: 0.3866
 epoch: 54, train_loss: 1.0944, test_loss: 1.1439, test_f1: 0.3978
 epoch: 55, train_loss: 1.0922, test_loss: 1.1447, test_f1: 0.4067
 epoch: 56, train_loss: 1.0839, test_loss: 1.1438, test_f1: 0.3929
 epoch: 57, train_loss: 1.0871, test_loss: 1.1421, test_f1: 0.3947
 epoch: 58, train_loss: 1.0826, test_loss: 1.1403, test_f1: 0.4087
 epoch: 59, train_loss: 1.0860, test_loss: 1.1394, test_f1: 0.4069
 epoch: 60, train_loss: 1.0815, test_loss: 1.1392, test_f1: 0.4075
 epoch: 61, train_loss: 1.0848, test_loss: 1.1379, test_f1: 0.4049
 epoch: 62, train_loss: 1.0832, test_loss: 1.1368, test_f1: 0.4019
 epoch: 63, train_loss: 1.0809, test_loss: 1.1370, test_f1: 0.3952
 epoch: 64, train_loss: 1.0772, test_loss: 1.1383, test_f1: 0.4018
 epoch: 65, train_loss: 1.0729, test_loss: 1.1353, test_f1: 0.4098
 epoch: 66, train_loss: 1.0830, test_loss: 1.1380, test_f1: 0.4134
 epoch: 67, train_loss: 1.0810, test_loss: 1.1390, test_f1: 0.4141
 epoch: 68, train_loss: 1.0762, test_loss: 1.1320, test_f1: 0.4106
 epoch: 69, train_loss: 1.0773, test_loss: 1.1335, test_f1: 0.4078
 epoch: 70, train_loss: 1.0790, test_loss: 1.1324, test_f1: 0.4041
 epoch: 71, train_loss: 1.0734, test_loss: 1.1296, test_f1: 0.4118
 epoch: 72, train_loss: 1.0750, test_loss: 1.1341, test_f1: 0.4021
 epoch: 73, train_loss: 1.0778, test_loss: 1.1327, test_f1: 0.4078
 epoch: 74, train_loss: 1.0734, test_loss: 1.1290, test_f1: 0.4229
 epoch: 75, train_loss: 1.0744, test_loss: 1.1277, test_f1: 0.4140
 epoch: 76, train_loss: 1.0731, test_loss: 1.1290, test_f1: 0.4322
 epoch: 77, train_loss: 1.0650, test_loss: 1.1278, test_f1: 0.4169
 epoch: 78, train_loss: 1.0694, test_loss: 1.1285, test_f1: 0.4250
 epoch: 79, train_loss: 1.0727, test_loss: 1.1248, test_f1: 0.4148
 epoch: 80, train_loss: 1.0647, test_loss: 1.1235, test_f1: 0.4242
 epoch: 81, train_loss: 1.0630, test_loss: 1.1297, test_f1: 0.4280
 epoch: 82, train_loss: 1.0648, test_loss: 1.1262, test_f1: 0.4367
 epoch: 83, train_loss: 1.0626, test_loss: 1.1231, test_f1: 0.4323
 epoch: 84, train_loss: 1.0634, test_loss: 1.1226, test_f1: 0.4280
 epoch: 85, train_loss: 1.0622, test_loss: 1.1236, test_f1: 0.4318
 epoch: 86, train_loss: 1.0698, test_loss: 1.1225, test_f1: 0.4318
 epoch: 87, train_loss: 1.0694, test_loss: 1.1247, test_f1: 0.4268
 epoch: 88, train_loss: 1.0590, test_loss: 1.1253, test_f1: 0.4381
 epoch: 89, train_loss: 1.0665, test_loss: 1.1242, test_f1: 0.4449
 epoch: 90, train_loss: 1.0655, test_loss: 1.1252, test_f1: 0.4412
 epoch: 91, train_loss: 1.0598, test_loss: 1.1233, test_f1: 0.4473
 epoch: 92, train_loss: 1.0611, test_loss: 1.1232, test_f1: 0.4428
 epoch: 93, train_loss: 1.0583, test_loss: 1.1224, test_f1: 0.4463
 epoch: 94, train_loss: 1.0542, test_loss: 1.1224, test_f1: 0.4524
 epoch: 95, train_loss: 1.0608, test_loss: 1.1266, test_f1: 0.4400
 epoch: 96, train_loss: 1.0589, test_loss: 1.1237, test_f1: 0.4326
 epoch: 97, train_loss: 1.0570, test_loss: 1.1223, test_f1: 0.4444
 epoch: 98, train_loss: 1.0607, test_loss: 1.1202, test_f1: 0.4425
 epoch: 99, train_loss: 1.0525, test_loss: 1.1200, test_f1: 0.4466
##################ITERATION #2 ****************************************
 epoch: 0, train_loss: 1.3344, test_loss: 1.3677, test_f1: 0.2281
 epoch: 1, train_loss: 1.3159, test_loss: 1.3638, test_f1: 0.2281
 epoch: 2, train_loss: 1.3009, test_loss: 1.3608, test_f1: 0.2281
 epoch: 3, train_loss: 1.2933, test_loss: 1.3496, test_f1: 0.2281
 epoch: 4, train_loss: 1.2820, test_loss: 1.3354, test_f1: 0.2281
 epoch: 5, train_loss: 1.2673, test_loss: 1.3214, test_f1: 0.2281
 epoch: 6, train_loss: 1.2615, test_loss: 1.3087, test_f1: 0.2281
 epoch: 7, train_loss: 1.2524, test_loss: 1.2955, test_f1: 0.2281
 epoch: 8, train_loss: 1.2457, test_loss: 1.2908, test_f1: 0.2281
 epoch: 9, train_loss: 1.2327, test_loss: 1.2801, test_f1: 0.2281
 epoch: 10, train_loss: 1.2257, test_loss: 1.2725, test_f1: 0.2281
 epoch: 11, train_loss: 1.2159, test_loss: 1.2671, test_f1: 0.2281
 epoch: 12, train_loss: 1.2123, test_loss: 1.2603, test_f1: 0.2281
 epoch: 13, train_loss: 1.2049, test_loss: 1.2548, test_f1: 0.2281
 epoch: 14, train_loss: 1.1979, test_loss: 1.2494, test_f1: 0.2281
 epoch: 15, train_loss: 1.1888, test_loss: 1.2442, test_f1: 0.2281
 epoch: 16, train_loss: 1.1827, test_loss: 1.2398, test_f1: 0.2281
 epoch: 17, train_loss: 1.1779, test_loss: 1.2349, test_f1: 0.2281
 epoch: 18, train_loss: 1.1713, test_loss: 1.2310, test_f1: 0.2281
 epoch: 19, train_loss: 1.1694, test_loss: 1.2273, test_f1: 0.2281
 epoch: 20, train_loss: 1.1696, test_loss: 1.2223, test_f1: 0.2281
 epoch: 21, train_loss: 1.1652, test_loss: 1.2195, test_f1: 0.2281
 epoch: 22, train_loss: 1.1604, test_loss: 1.2161, test_f1: 0.2281
 epoch: 23, train_loss: 1.1550, test_loss: 1.2140, test_f1: 0.2281
 epoch: 24, train_loss: 1.1563, test_loss: 1.2108, test_f1: 0.2281
 epoch: 25, train_loss: 1.1454, test_loss: 1.2093, test_f1: 0.2281
 epoch: 26, train_loss: 1.1407, test_loss: 1.2070, test_f1: 0.2281
 epoch: 27, train_loss: 1.1418, test_loss: 1.2029, test_f1: 0.2281
 epoch: 28, train_loss: 1.1360, test_loss: 1.2010, test_f1: 0.2436
 epoch: 29, train_loss: 1.1398, test_loss: 1.1974, test_f1: 0.2396
 epoch: 30, train_loss: 1.1359, test_loss: 1.1961, test_f1: 0.2608
 epoch: 31, train_loss: 1.1310, test_loss: 1.1945, test_f1: 0.2709
 epoch: 32, train_loss: 1.1266, test_loss: 1.1919, test_f1: 0.2847
 epoch: 33, train_loss: 1.1269, test_loss: 1.1904, test_f1: 0.2950
 epoch: 34, train_loss: 1.1252, test_loss: 1.1862, test_f1: 0.2962
 epoch: 35, train_loss: 1.1189, test_loss: 1.1841, test_f1: 0.2983
 epoch: 36, train_loss: 1.1265, test_loss: 1.1843, test_f1: 0.3139
 epoch: 37, train_loss: 1.1199, test_loss: 1.1824, test_f1: 0.3160
 epoch: 38, train_loss: 1.1197, test_loss: 1.1795, test_f1: 0.3240
 epoch: 39, train_loss: 1.1078, test_loss: 1.1793, test_f1: 0.3396
 epoch: 40, train_loss: 1.1135, test_loss: 1.1781, test_f1: 0.3384
 epoch: 41, train_loss: 1.1121, test_loss: 1.1760, test_f1: 0.3339
 epoch: 42, train_loss: 1.1101, test_loss: 1.1720, test_f1: 0.3444
 epoch: 43, train_loss: 1.1085, test_loss: 1.1702, test_f1: 0.3501
 epoch: 44, train_loss: 1.1056, test_loss: 1.1694, test_f1: 0.3821
 epoch: 45, train_loss: 1.1069, test_loss: 1.1677, test_f1: 0.3957
 epoch: 46, train_loss: 1.1010, test_loss: 1.1662, test_f1: 0.4129
 epoch: 47, train_loss: 1.0950, test_loss: 1.1674, test_f1: 0.4457
 epoch: 48, train_loss: 1.0921, test_loss: 1.1679, test_f1: 0.4496
 epoch: 49, train_loss: 1.0985, test_loss: 1.1627, test_f1: 0.4443
 epoch: 50, train_loss: 1.0915, test_loss: 1.1611, test_f1: 0.4555
 epoch: 51, train_loss: 1.0853, test_loss: 1.1608, test_f1: 0.4586
 epoch: 52, train_loss: 1.0982, test_loss: 1.1606, test_f1: 0.4488
 epoch: 53, train_loss: 1.0866, test_loss: 1.1611, test_f1: 0.4548
 epoch: 54, train_loss: 1.0873, test_loss: 1.1622, test_f1: 0.4657
 epoch: 55, train_loss: 1.0847, test_loss: 1.1598, test_f1: 0.4590
 epoch: 56, train_loss: 1.0861, test_loss: 1.1594, test_f1: 0.4587
 epoch: 57, train_loss: 1.0875, test_loss: 1.1572, test_f1: 0.4587
 epoch: 58, train_loss: 1.0841, test_loss: 1.1617, test_f1: 0.4575
 epoch: 59, train_loss: 1.0904, test_loss: 1.1572, test_f1: 0.4681
 epoch: 60, train_loss: 1.0864, test_loss: 1.1573, test_f1: 0.4617
 epoch: 61, train_loss: 1.0787, test_loss: 1.1582, test_f1: 0.4645
 epoch: 62, train_loss: 1.0855, test_loss: 1.1583, test_f1: 0.4583
 epoch: 63, train_loss: 1.0824, test_loss: 1.1556, test_f1: 0.4615
 epoch: 64, train_loss: 1.0754, test_loss: 1.1563, test_f1: 0.4605
 epoch: 65, train_loss: 1.0798, test_loss: 1.1547, test_f1: 0.4658
 epoch: 66, train_loss: 1.0771, test_loss: 1.1552, test_f1: 0.4679
 epoch: 67, train_loss: 1.0818, test_loss: 1.1533, test_f1: 0.4679
 epoch: 68, train_loss: 1.0787, test_loss: 1.1585, test_f1: 0.4708
 epoch: 69, train_loss: 1.0706, test_loss: 1.1544, test_f1: 0.4636
 epoch: 70, train_loss: 1.0719, test_loss: 1.1531, test_f1: 0.4580
 epoch: 71, train_loss: 1.0778, test_loss: 1.1530, test_f1: 0.4759
 epoch: 72, train_loss: 1.0785, test_loss: 1.1515, test_f1: 0.4708
 epoch: 73, train_loss: 1.0702, test_loss: 1.1510, test_f1: 0.4707
 epoch: 74, train_loss: 1.0737, test_loss: 1.1485, test_f1: 0.4707
 epoch: 75, train_loss: 1.0735, test_loss: 1.1462, test_f1: 0.4497
 epoch: 76, train_loss: 1.0644, test_loss: 1.1449, test_f1: 0.4511
 epoch: 77, train_loss: 1.0664, test_loss: 1.1459, test_f1: 0.4514
 epoch: 78, train_loss: 1.0672, test_loss: 1.1439, test_f1: 0.4483
 epoch: 79, train_loss: 1.0701, test_loss: 1.1428, test_f1: 0.4362
 epoch: 80, train_loss: 1.0674, test_loss: 1.1428, test_f1: 0.4470
 epoch: 81, train_loss: 1.0611, test_loss: 1.1427, test_f1: 0.4427
 epoch: 82, train_loss: 1.0660, test_loss: 1.1446, test_f1: 0.4368
 epoch: 83, train_loss: 1.0661, test_loss: 1.1457, test_f1: 0.4477
 epoch: 84, train_loss: 1.0589, test_loss: 1.1462, test_f1: 0.4453
 epoch: 85, train_loss: 1.0644, test_loss: 1.1440, test_f1: 0.4416
 epoch: 86, train_loss: 1.0643, test_loss: 1.1472, test_f1: 0.4440
 epoch: 87, train_loss: 1.0645, test_loss: 1.1484, test_f1: 0.4487
 epoch: 88, train_loss: 1.0594, test_loss: 1.1427, test_f1: 0.4411
 epoch: 89, train_loss: 1.0637, test_loss: 1.1427, test_f1: 0.4534
 epoch: 90, train_loss: 1.0592, test_loss: 1.1429, test_f1: 0.4431
 epoch: 91, train_loss: 1.0640, test_loss: 1.1450, test_f1: 0.4358
 epoch: 92, train_loss: 1.0564, test_loss: 1.1417, test_f1: 0.4382
 epoch: 93, train_loss: 1.0598, test_loss: 1.1450, test_f1: 0.4387
 epoch: 94, train_loss: 1.0596, test_loss: 1.1409, test_f1: 0.4328
 epoch: 95, train_loss: 1.0495, test_loss: 1.1357, test_f1: 0.4284
 epoch: 96, train_loss: 1.0573, test_loss: 1.1365, test_f1: 0.4337
 epoch: 97, train_loss: 1.0514, test_loss: 1.1417, test_f1: 0.4395
 epoch: 98, train_loss: 1.0534, test_loss: 1.1417, test_f1: 0.4412
 epoch: 99, train_loss: 1.0523, test_loss: 1.1348, test_f1: 0.4421
##################ITERATION #3 ****************************************
 epoch: 0, train_loss: 1.3156, test_loss: 1.3540, test_f1: 0.2281
 epoch: 1, train_loss: 1.2939, test_loss: 1.3378, test_f1: 0.2281
 epoch: 2, train_loss: 1.2805, test_loss: 1.3268, test_f1: 0.2281
 epoch: 3, train_loss: 1.2659, test_loss: 1.3223, test_f1: 0.2281
 epoch: 4, train_loss: 1.2621, test_loss: 1.3178, test_f1: 0.2281
 epoch: 5, train_loss: 1.2530, test_loss: 1.3102, test_f1: 0.2281
 epoch: 6, train_loss: 1.2444, test_loss: 1.3008, test_f1: 0.2274
 epoch: 7, train_loss: 1.2313, test_loss: 1.2902, test_f1: 0.2337
 epoch: 8, train_loss: 1.2224, test_loss: 1.2805, test_f1: 0.2764
 epoch: 9, train_loss: 1.2240, test_loss: 1.2744, test_f1: 0.2749
 epoch: 10, train_loss: 1.2111, test_loss: 1.2691, test_f1: 0.2763
 epoch: 11, train_loss: 1.2052, test_loss: 1.2636, test_f1: 0.2929
 epoch: 12, train_loss: 1.1992, test_loss: 1.2585, test_f1: 0.2701
 epoch: 13, train_loss: 1.2015, test_loss: 1.2540, test_f1: 0.2919
 epoch: 14, train_loss: 1.1913, test_loss: 1.2492, test_f1: 0.2898
 epoch: 15, train_loss: 1.1868, test_loss: 1.2456, test_f1: 0.2913
 epoch: 16, train_loss: 1.1837, test_loss: 1.2424, test_f1: 0.2945
 epoch: 17, train_loss: 1.1747, test_loss: 1.2380, test_f1: 0.2945
 epoch: 18, train_loss: 1.1755, test_loss: 1.2315, test_f1: 0.2930
 epoch: 19, train_loss: 1.1720, test_loss: 1.2287, test_f1: 0.2914
 epoch: 20, train_loss: 1.1604, test_loss: 1.2248, test_f1: 0.2969
 epoch: 21, train_loss: 1.1632, test_loss: 1.2200, test_f1: 0.2969
 epoch: 22, train_loss: 1.1574, test_loss: 1.2145, test_f1: 0.2940
 epoch: 23, train_loss: 1.1586, test_loss: 1.2105, test_f1: 0.2979
 epoch: 24, train_loss: 1.1453, test_loss: 1.2077, test_f1: 0.2995
 epoch: 25, train_loss: 1.1516, test_loss: 1.2058, test_f1: 0.3008
 epoch: 26, train_loss: 1.1526, test_loss: 1.2014, test_f1: 0.3053
 epoch: 27, train_loss: 1.1437, test_loss: 1.2002, test_f1: 0.3128
 epoch: 28, train_loss: 1.1462, test_loss: 1.1968, test_f1: 0.3226
 epoch: 29, train_loss: 1.1379, test_loss: 1.1936, test_f1: 0.3226
 epoch: 30, train_loss: 1.1343, test_loss: 1.1904, test_f1: 0.3162
 epoch: 31, train_loss: 1.1320, test_loss: 1.1870, test_f1: 0.3082
 epoch: 32, train_loss: 1.1297, test_loss: 1.1839, test_f1: 0.3124
 epoch: 33, train_loss: 1.1312, test_loss: 1.1812, test_f1: 0.3166
 epoch: 34, train_loss: 1.1231, test_loss: 1.1832, test_f1: 0.3493
 epoch: 35, train_loss: 1.1284, test_loss: 1.1792, test_f1: 0.3154
 epoch: 36, train_loss: 1.1270, test_loss: 1.1760, test_f1: 0.3294
 epoch: 37, train_loss: 1.1191, test_loss: 1.1766, test_f1: 0.3629
 epoch: 38, train_loss: 1.1160, test_loss: 1.1732, test_f1: 0.3629
 epoch: 39, train_loss: 1.1211, test_loss: 1.1706, test_f1: 0.3568
 epoch: 40, train_loss: 1.1172, test_loss: 1.1707, test_f1: 0.3556
 epoch: 41, train_loss: 1.1098, test_loss: 1.1674, test_f1: 0.3568
 epoch: 42, train_loss: 1.1124, test_loss: 1.1643, test_f1: 0.3589
 epoch: 43, train_loss: 1.1064, test_loss: 1.1640, test_f1: 0.3631
 epoch: 44, train_loss: 1.1114, test_loss: 1.1647, test_f1: 0.3450
 epoch: 45, train_loss: 1.1121, test_loss: 1.1628, test_f1: 0.3699
 epoch: 46, train_loss: 1.1079, test_loss: 1.1603, test_f1: 0.3750
 epoch: 47, train_loss: 1.1051, test_loss: 1.1577, test_f1: 0.3867
 epoch: 48, train_loss: 1.0973, test_loss: 1.1596, test_f1: 0.3823
 epoch: 49, train_loss: 1.0993, test_loss: 1.1598, test_f1: 0.3723
 epoch: 50, train_loss: 1.0971, test_loss: 1.1547, test_f1: 0.3567
 epoch: 51, train_loss: 1.0951, test_loss: 1.1566, test_f1: 0.3806
 epoch: 52, train_loss: 1.0858, test_loss: 1.1641, test_f1: 0.3829
 epoch: 53, train_loss: 1.0888, test_loss: 1.1559, test_f1: 0.3946
 epoch: 54, train_loss: 1.0870, test_loss: 1.1577, test_f1: 0.3923
 epoch: 55, train_loss: 1.0937, test_loss: 1.1556, test_f1: 0.3915
 epoch: 56, train_loss: 1.0988, test_loss: 1.1547, test_f1: 0.3934
 epoch: 57, train_loss: 1.0868, test_loss: 1.1527, test_f1: 0.3855
 epoch: 58, train_loss: 1.0872, test_loss: 1.1598, test_f1: 0.3957
 epoch: 59, train_loss: 1.0862, test_loss: 1.1563, test_f1: 0.3862
 epoch: 60, train_loss: 1.0886, test_loss: 1.1561, test_f1: 0.3890
 epoch: 61, train_loss: 1.0872, test_loss: 1.1556, test_f1: 0.4012
 epoch: 62, train_loss: 1.0826, test_loss: 1.1523, test_f1: 0.3978
 epoch: 63, train_loss: 1.0809, test_loss: 1.1561, test_f1: 0.4025
 epoch: 64, train_loss: 1.0787, test_loss: 1.1523, test_f1: 0.3887
 epoch: 65, train_loss: 1.0824, test_loss: 1.1517, test_f1: 0.3838
 epoch: 66, train_loss: 1.0876, test_loss: 1.1476, test_f1: 0.3882
 epoch: 67, train_loss: 1.0822, test_loss: 1.1465, test_f1: 0.3873
 epoch: 68, train_loss: 1.0886, test_loss: 1.1497, test_f1: 0.3975
 epoch: 69, train_loss: 1.0675, test_loss: 1.1497, test_f1: 0.3920
 epoch: 70, train_loss: 1.0767, test_loss: 1.1461, test_f1: 0.3871
 epoch: 71, train_loss: 1.0792, test_loss: 1.1514, test_f1: 0.3915
 epoch: 72, train_loss: 1.0760, test_loss: 1.1486, test_f1: 0.3805
 epoch: 73, train_loss: 1.0753, test_loss: 1.1498, test_f1: 0.4011
 epoch: 74, train_loss: 1.0795, test_loss: 1.1450, test_f1: 0.3974
 epoch: 75, train_loss: 1.0709, test_loss: 1.1417, test_f1: 0.3915
 epoch: 76, train_loss: 1.0793, test_loss: 1.1420, test_f1: 0.3966
 epoch: 77, train_loss: 1.0744, test_loss: 1.1439, test_f1: 0.4138
 epoch: 78, train_loss: 1.0711, test_loss: 1.1460, test_f1: 0.3920
 epoch: 79, train_loss: 1.0725, test_loss: 1.1461, test_f1: 0.3926
 epoch: 80, train_loss: 1.0648, test_loss: 1.1454, test_f1: 0.3993
 epoch: 81, train_loss: 1.0686, test_loss: 1.1475, test_f1: 0.4064
 epoch: 82, train_loss: 1.0673, test_loss: 1.1494, test_f1: 0.4063
 epoch: 83, train_loss: 1.0640, test_loss: 1.1410, test_f1: 0.4008
 epoch: 84, train_loss: 1.0624, test_loss: 1.1450, test_f1: 0.4002
 epoch: 85, train_loss: 1.0680, test_loss: 1.1423, test_f1: 0.3972
 epoch: 86, train_loss: 1.0665, test_loss: 1.1407, test_f1: 0.4038
 epoch: 87, train_loss: 1.0605, test_loss: 1.1402, test_f1: 0.3945
 epoch: 88, train_loss: 1.0594, test_loss: 1.1412, test_f1: 0.4158
 epoch: 89, train_loss: 1.0667, test_loss: 1.1395, test_f1: 0.4108
 epoch: 90, train_loss: 1.0625, test_loss: 1.1417, test_f1: 0.4126
 epoch: 91, train_loss: 1.0638, test_loss: 1.1352, test_f1: 0.4160
 epoch: 92, train_loss: 1.0611, test_loss: 1.1303, test_f1: 0.4085
 epoch: 93, train_loss: 1.0683, test_loss: 1.1384, test_f1: 0.4117
 epoch: 94, train_loss: 1.0579, test_loss: 1.1409, test_f1: 0.4156
 epoch: 95, train_loss: 1.0598, test_loss: 1.1422, test_f1: 0.4229
 epoch: 96, train_loss: 1.0664, test_loss: 1.1496, test_f1: 0.4246
 epoch: 97, train_loss: 1.0578, test_loss: 1.1416, test_f1: 0.4244
 epoch: 98, train_loss: 1.0542, test_loss: 1.1397, test_f1: 0.4273
 epoch: 99, train_loss: 1.0605, test_loss: 1.1361, test_f1: 0.4306
##################ITERATION #4 ****************************************
 epoch: 0, train_loss: 1.3104, test_loss: 1.3626, test_f1: 0.2281
 epoch: 1, train_loss: 1.2864, test_loss: 1.3628, test_f1: 0.2281
 epoch: 2, train_loss: 1.2717, test_loss: 1.3480, test_f1: 0.2281
 epoch: 3, train_loss: 1.2575, test_loss: 1.3193, test_f1: 0.2281
 epoch: 4, train_loss: 1.2418, test_loss: 1.2939, test_f1: 0.2281
 epoch: 5, train_loss: 1.2327, test_loss: 1.2820, test_f1: 0.2281
 epoch: 6, train_loss: 1.2237, test_loss: 1.2708, test_f1: 0.2281
 epoch: 7, train_loss: 1.2154, test_loss: 1.2599, test_f1: 0.2281
 epoch: 8, train_loss: 1.2093, test_loss: 1.2484, test_f1: 0.2281
 epoch: 9, train_loss: 1.1982, test_loss: 1.2434, test_f1: 0.2281
 epoch: 10, train_loss: 1.1890, test_loss: 1.2384, test_f1: 0.2551
 epoch: 11, train_loss: 1.1861, test_loss: 1.2323, test_f1: 0.2824
 epoch: 12, train_loss: 1.1793, test_loss: 1.2278, test_f1: 0.2809
 epoch: 13, train_loss: 1.1802, test_loss: 1.2230, test_f1: 0.2910
 epoch: 14, train_loss: 1.1626, test_loss: 1.2218, test_f1: 0.2862
 epoch: 15, train_loss: 1.1533, test_loss: 1.2121, test_f1: 0.2904
 epoch: 16, train_loss: 1.1591, test_loss: 1.2065, test_f1: 0.2999
 epoch: 17, train_loss: 1.1570, test_loss: 1.2065, test_f1: 0.2937
 epoch: 18, train_loss: 1.1530, test_loss: 1.2035, test_f1: 0.3133
 epoch: 19, train_loss: 1.1547, test_loss: 1.1977, test_f1: 0.3374
 epoch: 20, train_loss: 1.1426, test_loss: 1.1951, test_f1: 0.3434
 epoch: 21, train_loss: 1.1426, test_loss: 1.1926, test_f1: 0.3553
 epoch: 22, train_loss: 1.1318, test_loss: 1.1890, test_f1: 0.3561
 epoch: 23, train_loss: 1.1339, test_loss: 1.1844, test_f1: 0.3564
 epoch: 24, train_loss: 1.1229, test_loss: 1.1838, test_f1: 0.3719
 epoch: 25, train_loss: 1.1281, test_loss: 1.1811, test_f1: 0.3492
 epoch: 26, train_loss: 1.1310, test_loss: 1.1768, test_f1: 0.3674
 epoch: 27, train_loss: 1.1236, test_loss: 1.1717, test_f1: 0.3625
 epoch: 28, train_loss: 1.1180, test_loss: 1.1696, test_f1: 0.3919
 epoch: 29, train_loss: 1.1221, test_loss: 1.1667, test_f1: 0.3861
 epoch: 30, train_loss: 1.1221, test_loss: 1.1616, test_f1: 0.3815
 epoch: 31, train_loss: 1.1035, test_loss: 1.1609, test_f1: 0.3838
 epoch: 32, train_loss: 1.1046, test_loss: 1.1607, test_f1: 0.3755
 epoch: 33, train_loss: 1.1099, test_loss: 1.1594, test_f1: 0.3770
 epoch: 34, train_loss: 1.1024, test_loss: 1.1582, test_f1: 0.3752
 epoch: 35, train_loss: 1.1056, test_loss: 1.1567, test_f1: 0.3939
 epoch: 36, train_loss: 1.1060, test_loss: 1.1554, test_f1: 0.4129
 epoch: 37, train_loss: 1.1029, test_loss: 1.1551, test_f1: 0.3867
 epoch: 38, train_loss: 1.0984, test_loss: 1.1520, test_f1: 0.3891
 epoch: 39, train_loss: 1.0932, test_loss: 1.1497, test_f1: 0.3907
 epoch: 40, train_loss: 1.0892, test_loss: 1.1482, test_f1: 0.3932
 epoch: 41, train_loss: 1.0940, test_loss: 1.1481, test_f1: 0.4013
 epoch: 42, train_loss: 1.0794, test_loss: 1.1490, test_f1: 0.3969
 epoch: 43, train_loss: 1.0844, test_loss: 1.1443, test_f1: 0.3953
 epoch: 44, train_loss: 1.0933, test_loss: 1.1437, test_f1: 0.4013
 epoch: 45, train_loss: 1.0796, test_loss: 1.1440, test_f1: 0.4101
 epoch: 46, train_loss: 1.0891, test_loss: 1.1432, test_f1: 0.4142
 epoch: 47, train_loss: 1.0905, test_loss: 1.1411, test_f1: 0.4006
 epoch: 48, train_loss: 1.0737, test_loss: 1.1419, test_f1: 0.4036
 epoch: 49, train_loss: 1.0765, test_loss: 1.1383, test_f1: 0.4116
 epoch: 50, train_loss: 1.0787, test_loss: 1.1305, test_f1: 0.4231
 epoch: 51, train_loss: 1.0723, test_loss: 1.1321, test_f1: 0.4317
 epoch: 52, train_loss: 1.0796, test_loss: 1.1300, test_f1: 0.4204
 epoch: 53, train_loss: 1.0789, test_loss: 1.1301, test_f1: 0.4362
 epoch: 54, train_loss: 1.0713, test_loss: 1.1318, test_f1: 0.4261
 epoch: 55, train_loss: 1.0731, test_loss: 1.1316, test_f1: 0.4276
 epoch: 56, train_loss: 1.0728, test_loss: 1.1300, test_f1: 0.4317
 epoch: 57, train_loss: 1.0746, test_loss: 1.1280, test_f1: 0.4316
 epoch: 58, train_loss: 1.0735, test_loss: 1.1290, test_f1: 0.4225
 epoch: 59, train_loss: 1.0716, test_loss: 1.1264, test_f1: 0.4287
 epoch: 60, train_loss: 1.0690, test_loss: 1.1284, test_f1: 0.4287
 epoch: 61, train_loss: 1.0621, test_loss: 1.1260, test_f1: 0.4293
 epoch: 62, train_loss: 1.0661, test_loss: 1.1272, test_f1: 0.4294
 epoch: 63, train_loss: 1.0569, test_loss: 1.1267, test_f1: 0.4380
 epoch: 64, train_loss: 1.0599, test_loss: 1.1254, test_f1: 0.4335
 epoch: 65, train_loss: 1.0611, test_loss: 1.1258, test_f1: 0.4310
 epoch: 66, train_loss: 1.0609, test_loss: 1.1286, test_f1: 0.4294
 epoch: 67, train_loss: 1.0630, test_loss: 1.1247, test_f1: 0.4344
 epoch: 68, train_loss: 1.0589, test_loss: 1.1262, test_f1: 0.4408
 epoch: 69, train_loss: 1.0648, test_loss: 1.1268, test_f1: 0.4195
 epoch: 70, train_loss: 1.0578, test_loss: 1.1253, test_f1: 0.4235
 epoch: 71, train_loss: 1.0554, test_loss: 1.1209, test_f1: 0.4312
 epoch: 72, train_loss: 1.0581, test_loss: 1.1223, test_f1: 0.4224
 epoch: 73, train_loss: 1.0584, test_loss: 1.1237, test_f1: 0.4234
 epoch: 74, train_loss: 1.0547, test_loss: 1.1257, test_f1: 0.4377
 epoch: 75, train_loss: 1.0609, test_loss: 1.1251, test_f1: 0.4239
 epoch: 76, train_loss: 1.0590, test_loss: 1.1269, test_f1: 0.4186
 epoch: 77, train_loss: 1.0561, test_loss: 1.1247, test_f1: 0.4167
 epoch: 78, train_loss: 1.0524, test_loss: 1.1244, test_f1: 0.4164
 epoch: 79, train_loss: 1.0456, test_loss: 1.1228, test_f1: 0.4178
 epoch: 80, train_loss: 1.0508, test_loss: 1.1160, test_f1: 0.4211
 epoch: 81, train_loss: 1.0536, test_loss: 1.1163, test_f1: 0.4291
 epoch: 82, train_loss: 1.0439, test_loss: 1.1188, test_f1: 0.4374
 epoch: 83, train_loss: 1.0517, test_loss: 1.1157, test_f1: 0.4332
 epoch: 84, train_loss: 1.0510, test_loss: 1.1186, test_f1: 0.4257
 epoch: 85, train_loss: 1.0539, test_loss: 1.1183, test_f1: 0.4162
 epoch: 86, train_loss: 1.0510, test_loss: 1.1177, test_f1: 0.4283
 epoch: 87, train_loss: 1.0578, test_loss: 1.1161, test_f1: 0.4368
 epoch: 88, train_loss: 1.0408, test_loss: 1.1144, test_f1: 0.4414
 epoch: 89, train_loss: 1.0479, test_loss: 1.1126, test_f1: 0.4236
 epoch: 90, train_loss: 1.0428, test_loss: 1.1136, test_f1: 0.4385
 epoch: 91, train_loss: 1.0443, test_loss: 1.1153, test_f1: 0.4255
 epoch: 92, train_loss: 1.0400, test_loss: 1.1141, test_f1: 0.4436
 epoch: 93, train_loss: 1.0424, test_loss: 1.1187, test_f1: 0.4287
 epoch: 94, train_loss: 1.0447, test_loss: 1.1128, test_f1: 0.4331
 epoch: 95, train_loss: 1.0439, test_loss: 1.1116, test_f1: 0.4159
 epoch: 96, train_loss: 1.0351, test_loss: 1.1116, test_f1: 0.4389
 epoch: 97, train_loss: 1.0393, test_loss: 1.1085, test_f1: 0.4341
 epoch: 98, train_loss: 1.0368, test_loss: 1.1072, test_f1: 0.4218
 epoch: 99, train_loss: 1.0366, test_loss: 1.1108, test_f1: 0.4444
##################ITERATION #5 ****************************************
 epoch: 0, train_loss: 1.2519, test_loss: 1.3435, test_f1: 0.2281
 epoch: 1, train_loss: 1.2303, test_loss: 1.3453, test_f1: 0.2281
 epoch: 2, train_loss: 1.2301, test_loss: 1.3173, test_f1: 0.2281
 epoch: 3, train_loss: 1.2146, test_loss: 1.2912, test_f1: 0.2281
 epoch: 4, train_loss: 1.2018, test_loss: 1.2759, test_f1: 0.2281
 epoch: 5, train_loss: 1.1954, test_loss: 1.2684, test_f1: 0.2281
 epoch: 6, train_loss: 1.1911, test_loss: 1.2468, test_f1: 0.2270
 epoch: 7, train_loss: 1.1928, test_loss: 1.2380, test_f1: 0.2614
 epoch: 8, train_loss: 1.1790, test_loss: 1.2327, test_f1: 0.2550
 epoch: 9, train_loss: 1.1690, test_loss: 1.2253, test_f1: 0.2927
 epoch: 10, train_loss: 1.1701, test_loss: 1.2159, test_f1: 0.3098
 epoch: 11, train_loss: 1.1683, test_loss: 1.2107, test_f1: 0.3037
 epoch: 12, train_loss: 1.1627, test_loss: 1.2055, test_f1: 0.3057
 epoch: 13, train_loss: 1.1597, test_loss: 1.2020, test_f1: 0.3023
 epoch: 14, train_loss: 1.1570, test_loss: 1.2022, test_f1: 0.3045
 epoch: 15, train_loss: 1.1496, test_loss: 1.1935, test_f1: 0.3023
 epoch: 16, train_loss: 1.1542, test_loss: 1.1920, test_f1: 0.3023
 epoch: 17, train_loss: 1.1425, test_loss: 1.1879, test_f1: 0.3027
 epoch: 18, train_loss: 1.1475, test_loss: 1.1832, test_f1: 0.3117
 epoch: 19, train_loss: 1.1365, test_loss: 1.1825, test_f1: 0.3080
 epoch: 20, train_loss: 1.1413, test_loss: 1.1801, test_f1: 0.3178
 epoch: 21, train_loss: 1.1341, test_loss: 1.1754, test_f1: 0.3263
 epoch: 22, train_loss: 1.1285, test_loss: 1.1742, test_f1: 0.3399
 epoch: 23, train_loss: 1.1270, test_loss: 1.1717, test_f1: 0.3442
 epoch: 24, train_loss: 1.1268, test_loss: 1.1672, test_f1: 0.3503
 epoch: 25, train_loss: 1.1185, test_loss: 1.1670, test_f1: 0.3430
 epoch: 26, train_loss: 1.1207, test_loss: 1.1635, test_f1: 0.3531
 epoch: 27, train_loss: 1.1134, test_loss: 1.1587, test_f1: 0.3584
 epoch: 28, train_loss: 1.1171, test_loss: 1.1559, test_f1: 0.3665
 epoch: 29, train_loss: 1.1112, test_loss: 1.1574, test_f1: 0.3694
 epoch: 30, train_loss: 1.0971, test_loss: 1.1551, test_f1: 0.3640
 epoch: 31, train_loss: 1.1131, test_loss: 1.1540, test_f1: 0.3779
 epoch: 32, train_loss: 1.1050, test_loss: 1.1509, test_f1: 0.3771
 epoch: 33, train_loss: 1.1074, test_loss: 1.1502, test_f1: 0.3683
 epoch: 34, train_loss: 1.0967, test_loss: 1.1468, test_f1: 0.3787
 epoch: 35, train_loss: 1.0970, test_loss: 1.1452, test_f1: 0.4081
 epoch: 36, train_loss: 1.1003, test_loss: 1.1460, test_f1: 0.4075
 epoch: 37, train_loss: 1.0951, test_loss: 1.1423, test_f1: 0.4126
 epoch: 38, train_loss: 1.0909, test_loss: 1.1416, test_f1: 0.4116
 epoch: 39, train_loss: 1.0841, test_loss: 1.1397, test_f1: 0.4221
 epoch: 40, train_loss: 1.0909, test_loss: 1.1377, test_f1: 0.4169
 epoch: 41, train_loss: 1.0887, test_loss: 1.1328, test_f1: 0.4137
 epoch: 42, train_loss: 1.0842, test_loss: 1.1342, test_f1: 0.4116
 epoch: 43, train_loss: 1.0933, test_loss: 1.1287, test_f1: 0.3903
 epoch: 44, train_loss: 1.0799, test_loss: 1.1278, test_f1: 0.4162
 epoch: 45, train_loss: 1.0851, test_loss: 1.1280, test_f1: 0.4126
 epoch: 46, train_loss: 1.0662, test_loss: 1.1264, test_f1: 0.4181
 epoch: 47, train_loss: 1.0752, test_loss: 1.1269, test_f1: 0.4224
 epoch: 48, train_loss: 1.0692, test_loss: 1.1256, test_f1: 0.4186
 epoch: 49, train_loss: 1.0781, test_loss: 1.1224, test_f1: 0.4302
 epoch: 50, train_loss: 1.0681, test_loss: 1.1192, test_f1: 0.4300
 epoch: 51, train_loss: 1.0730, test_loss: 1.1188, test_f1: 0.4108
 epoch: 52, train_loss: 1.0687, test_loss: 1.1204, test_f1: 0.4119
 epoch: 53, train_loss: 1.0706, test_loss: 1.1207, test_f1: 0.4109
 epoch: 54, train_loss: 1.0631, test_loss: 1.1190, test_f1: 0.4156
 epoch: 55, train_loss: 1.0595, test_loss: 1.1184, test_f1: 0.4387
 epoch: 56, train_loss: 1.0708, test_loss: 1.1204, test_f1: 0.4102
 epoch: 57, train_loss: 1.0723, test_loss: 1.1191, test_f1: 0.4181
 epoch: 58, train_loss: 1.0618, test_loss: 1.1162, test_f1: 0.4181
 epoch: 59, train_loss: 1.0563, test_loss: 1.1173, test_f1: 0.4151
 epoch: 60, train_loss: 1.0582, test_loss: 1.1180, test_f1: 0.4191
 epoch: 61, train_loss: 1.0530, test_loss: 1.1145, test_f1: 0.4116
 epoch: 62, train_loss: 1.0485, test_loss: 1.1151, test_f1: 0.4103
 epoch: 63, train_loss: 1.0558, test_loss: 1.1103, test_f1: 0.4206
 epoch: 64, train_loss: 1.0610, test_loss: 1.1161, test_f1: 0.4171
 epoch: 65, train_loss: 1.0513, test_loss: 1.1152, test_f1: 0.4085
 epoch: 66, train_loss: 1.0544, test_loss: 1.1101, test_f1: 0.4177
 epoch: 67, train_loss: 1.0604, test_loss: 1.1091, test_f1: 0.4255
 epoch: 68, train_loss: 1.0454, test_loss: 1.1062, test_f1: 0.4208
 epoch: 69, train_loss: 1.0494, test_loss: 1.1080, test_f1: 0.4162
 epoch: 70, train_loss: 1.0502, test_loss: 1.1058, test_f1: 0.4325
 epoch: 71, train_loss: 1.0512, test_loss: 1.1045, test_f1: 0.4463
 epoch: 72, train_loss: 1.0485, test_loss: 1.1042, test_f1: 0.4216
 epoch: 73, train_loss: 1.0484, test_loss: 1.1059, test_f1: 0.4322
 epoch: 74, train_loss: 1.0459, test_loss: 1.1060, test_f1: 0.4223
 epoch: 75, train_loss: 1.0473, test_loss: 1.1056, test_f1: 0.4186
 epoch: 76, train_loss: 1.0415, test_loss: 1.1069, test_f1: 0.4388
 epoch: 77, train_loss: 1.0468, test_loss: 1.1030, test_f1: 0.4150
 epoch: 78, train_loss: 1.0418, test_loss: 1.1038, test_f1: 0.4308
 epoch: 79, train_loss: 1.0466, test_loss: 1.1039, test_f1: 0.4234
 epoch: 80, train_loss: 1.0441, test_loss: 1.1015, test_f1: 0.4301
 epoch: 81, train_loss: 1.0423, test_loss: 1.1020, test_f1: 0.4318
 epoch: 82, train_loss: 1.0457, test_loss: 1.1021, test_f1: 0.4126
 epoch: 83, train_loss: 1.0378, test_loss: 1.1030, test_f1: 0.4212
 epoch: 84, train_loss: 1.0323, test_loss: 1.1074, test_f1: 0.4250
 epoch: 85, train_loss: 1.0424, test_loss: 1.1024, test_f1: 0.4230
 epoch: 86, train_loss: 1.0461, test_loss: 1.0953, test_f1: 0.4472
 epoch: 87, train_loss: 1.0354, test_loss: 1.0991, test_f1: 0.4446
 epoch: 88, train_loss: 1.0330, test_loss: 1.0991, test_f1: 0.4422
 epoch: 89, train_loss: 1.0427, test_loss: 1.1019, test_f1: 0.4234
 epoch: 90, train_loss: 1.0298, test_loss: 1.0995, test_f1: 0.4321
 epoch: 91, train_loss: 1.0357, test_loss: 1.0993, test_f1: 0.4270
 epoch: 92, train_loss: 1.0339, test_loss: 1.1022, test_f1: 0.4174
 epoch: 93, train_loss: 1.0296, test_loss: 1.1007, test_f1: 0.4441
 epoch: 94, train_loss: 1.0311, test_loss: 1.1000, test_f1: 0.4486
 epoch: 95, train_loss: 1.0328, test_loss: 1.0966, test_f1: 0.4329
 epoch: 96, train_loss: 1.0273, test_loss: 1.0955, test_f1: 0.4320
 epoch: 97, train_loss: 1.0250, test_loss: 1.0964, test_f1: 0.4221
 epoch: 98, train_loss: 1.0306, test_loss: 1.0977, test_f1: 0.4442
 epoch: 99, train_loss: 1.0368, test_loss: 1.0986, test_f1: 0.4401
##################ITERATION #6 ****************************************
 epoch: 0, train_loss: 1.2745, test_loss: 1.3306, test_f1: 0.2281
 epoch: 1, train_loss: 1.2532, test_loss: 1.3095, test_f1: 0.2281
 epoch: 2, train_loss: 1.2443, test_loss: 1.3091, test_f1: 0.2281
 epoch: 3, train_loss: 1.2309, test_loss: 1.3048, test_f1: 0.2281
 epoch: 4, train_loss: 1.2123, test_loss: 1.2830, test_f1: 0.2281
 epoch: 5, train_loss: 1.2061, test_loss: 1.2717, test_f1: 0.2281
 epoch: 6, train_loss: 1.1991, test_loss: 1.2619, test_f1: 0.2281
 epoch: 7, train_loss: 1.1927, test_loss: 1.2578, test_f1: 0.2285
 epoch: 8, train_loss: 1.1894, test_loss: 1.2558, test_f1: 0.2285
 epoch: 9, train_loss: 1.1843, test_loss: 1.2559, test_f1: 0.2285
 epoch: 10, train_loss: 1.1775, test_loss: 1.2629, test_f1: 0.2285
 epoch: 11, train_loss: 1.1682, test_loss: 1.2583, test_f1: 0.2289
 epoch: 12, train_loss: 1.1679, test_loss: 1.2470, test_f1: 0.2285
 epoch: 13, train_loss: 1.1600, test_loss: 1.2461, test_f1: 0.2285
 epoch: 14, train_loss: 1.1535, test_loss: 1.2444, test_f1: 0.2340
 epoch: 15, train_loss: 1.1510, test_loss: 1.2392, test_f1: 0.2349
 epoch: 16, train_loss: 1.1454, test_loss: 1.2305, test_f1: 0.2402
 epoch: 17, train_loss: 1.1411, test_loss: 1.2289, test_f1: 0.2583
 epoch: 18, train_loss: 1.1328, test_loss: 1.2280, test_f1: 0.2674
 epoch: 19, train_loss: 1.1360, test_loss: 1.2222, test_f1: 0.2809
 epoch: 20, train_loss: 1.1326, test_loss: 1.2229, test_f1: 0.2664
 epoch: 21, train_loss: 1.1216, test_loss: 1.2152, test_f1: 0.2970
 epoch: 22, train_loss: 1.1245, test_loss: 1.2131, test_f1: 0.3414
 epoch: 23, train_loss: 1.1249, test_loss: 1.2076, test_f1: 0.3477
 epoch: 24, train_loss: 1.1202, test_loss: 1.1964, test_f1: 0.3528
 epoch: 25, train_loss: 1.1110, test_loss: 1.1873, test_f1: 0.3492
 epoch: 26, train_loss: 1.1113, test_loss: 1.1966, test_f1: 0.3557
 epoch: 27, train_loss: 1.1116, test_loss: 1.1928, test_f1: 0.3321
 epoch: 28, train_loss: 1.1065, test_loss: 1.1749, test_f1: 0.3522
 epoch: 29, train_loss: 1.1016, test_loss: 1.1874, test_f1: 0.3477
 epoch: 30, train_loss: 1.0956, test_loss: 1.1746, test_f1: 0.3936
 epoch: 31, train_loss: 1.0957, test_loss: 1.1725, test_f1: 0.4114
 epoch: 32, train_loss: 1.0995, test_loss: 1.1761, test_f1: 0.4223
 epoch: 33, train_loss: 1.0932, test_loss: 1.1657, test_f1: 0.4016
 epoch: 34, train_loss: 1.0937, test_loss: 1.1612, test_f1: 0.4085
 epoch: 35, train_loss: 1.0920, test_loss: 1.1667, test_f1: 0.4081
 epoch: 36, train_loss: 1.0872, test_loss: 1.1697, test_f1: 0.4082
 epoch: 37, train_loss: 1.0732, test_loss: 1.1627, test_f1: 0.4150
 epoch: 38, train_loss: 1.0822, test_loss: 1.1531, test_f1: 0.4154
 epoch: 39, train_loss: 1.0804, test_loss: 1.1569, test_f1: 0.4321
 epoch: 40, train_loss: 1.0785, test_loss: 1.1536, test_f1: 0.4218
 epoch: 41, train_loss: 1.0758, test_loss: 1.1550, test_f1: 0.4145
 epoch: 42, train_loss: 1.0701, test_loss: 1.1515, test_f1: 0.4221
 epoch: 43, train_loss: 1.0666, test_loss: 1.1487, test_f1: 0.4045
 epoch: 44, train_loss: 1.0690, test_loss: 1.1445, test_f1: 0.4200
 epoch: 45, train_loss: 1.0645, test_loss: 1.1504, test_f1: 0.4298
 epoch: 46, train_loss: 1.0641, test_loss: 1.1522, test_f1: 0.4356
 epoch: 47, train_loss: 1.0747, test_loss: 1.1591, test_f1: 0.4518
 epoch: 48, train_loss: 1.0648, test_loss: 1.1575, test_f1: 0.4201
 epoch: 49, train_loss: 1.0632, test_loss: 1.1539, test_f1: 0.4210
 epoch: 50, train_loss: 1.0525, test_loss: 1.1511, test_f1: 0.4207
 epoch: 51, train_loss: 1.0586, test_loss: 1.1507, test_f1: 0.4277
 epoch: 52, train_loss: 1.0557, test_loss: 1.1567, test_f1: 0.4344
 epoch: 53, train_loss: 1.0460, test_loss: 1.1584, test_f1: 0.4310
 epoch: 54, train_loss: 1.0462, test_loss: 1.1574, test_f1: 0.4135
 epoch: 55, train_loss: 1.0520, test_loss: 1.1536, test_f1: 0.4378
 epoch: 56, train_loss: 1.0502, test_loss: 1.1557, test_f1: 0.4347
 epoch: 57, train_loss: 1.0451, test_loss: 1.1619, test_f1: 0.4565
 epoch: 58, train_loss: 1.0499, test_loss: 1.1603, test_f1: 0.4539
 epoch: 59, train_loss: 1.0470, test_loss: 1.1460, test_f1: 0.4355
 epoch: 60, train_loss: 1.0545, test_loss: 1.1460, test_f1: 0.4305
 epoch: 61, train_loss: 1.0534, test_loss: 1.1502, test_f1: 0.4357
 epoch: 62, train_loss: 1.0435, test_loss: 1.1474, test_f1: 0.4368
 epoch: 63, train_loss: 1.0485, test_loss: 1.1525, test_f1: 0.4326
 epoch: 64, train_loss: 1.0379, test_loss: 1.1539, test_f1: 0.4264
 epoch: 65, train_loss: 1.0386, test_loss: 1.1484, test_f1: 0.4318
 epoch: 66, train_loss: 1.0452, test_loss: 1.1509, test_f1: 0.4267
 epoch: 67, train_loss: 1.0465, test_loss: 1.1500, test_f1: 0.4293
 epoch: 68, train_loss: 1.0504, test_loss: 1.1408, test_f1: 0.4289
 epoch: 69, train_loss: 1.0426, test_loss: 1.1473, test_f1: 0.4361
 epoch: 70, train_loss: 1.0313, test_loss: 1.1494, test_f1: 0.4200
 epoch: 71, train_loss: 1.0379, test_loss: 1.1501, test_f1: 0.4346
 epoch: 72, train_loss: 1.0315, test_loss: 1.1437, test_f1: 0.4515
 epoch: 73, train_loss: 1.0370, test_loss: 1.1404, test_f1: 0.4362
 epoch: 74, train_loss: 1.0393, test_loss: 1.1576, test_f1: 0.4466
 epoch: 75, train_loss: 1.0352, test_loss: 1.1385, test_f1: 0.4332
 epoch: 76, train_loss: 1.0377, test_loss: 1.1557, test_f1: 0.4260
 epoch: 77, train_loss: 1.0411, test_loss: 1.1480, test_f1: 0.4261
 epoch: 78, train_loss: 1.0351, test_loss: 1.1510, test_f1: 0.4321
 epoch: 79, train_loss: 1.0386, test_loss: 1.1513, test_f1: 0.4268
 epoch: 80, train_loss: 1.0230, test_loss: 1.1496, test_f1: 0.4381
 epoch: 81, train_loss: 1.0273, test_loss: 1.1466, test_f1: 0.4475
 epoch: 82, train_loss: 1.0331, test_loss: 1.1480, test_f1: 0.4494
 epoch: 83, train_loss: 1.0230, test_loss: 1.1408, test_f1: 0.4302
 epoch: 84, train_loss: 1.0213, test_loss: 1.1505, test_f1: 0.4302
 epoch: 85, train_loss: 1.0312, test_loss: 1.1512, test_f1: 0.4302
 epoch: 86, train_loss: 1.0208, test_loss: 1.1527, test_f1: 0.4282
 epoch: 87, train_loss: 1.0292, test_loss: 1.1594, test_f1: 0.4268
 epoch: 88, train_loss: 1.0185, test_loss: 1.1589, test_f1: 0.4286
 epoch: 89, train_loss: 1.0211, test_loss: 1.1520, test_f1: 0.4334
 epoch: 90, train_loss: 1.0232, test_loss: 1.1592, test_f1: 0.4476
 epoch: 91, train_loss: 1.0199, test_loss: 1.1590, test_f1: 0.4448
 epoch: 92, train_loss: 1.0248, test_loss: 1.1617, test_f1: 0.4441
 epoch: 93, train_loss: 1.0187, test_loss: 1.1566, test_f1: 0.4338
 epoch: 94, train_loss: 1.0289, test_loss: 1.1498, test_f1: 0.4313
 epoch: 95, train_loss: 1.0122, test_loss: 1.1499, test_f1: 0.4294
 epoch: 96, train_loss: 1.0166, test_loss: 1.1593, test_f1: 0.4378
 epoch: 97, train_loss: 1.0140, test_loss: 1.1758, test_f1: 0.4356
 epoch: 98, train_loss: 1.0198, test_loss: 1.1742, test_f1: 0.4299
 epoch: 99, train_loss: 1.0098, test_loss: 1.1821, test_f1: 0.4341
##################ITERATION #7 ****************************************
 epoch: 0, train_loss: 1.2913, test_loss: 1.3888, test_f1: 0.2281
 epoch: 1, train_loss: 1.2469, test_loss: 1.3958, test_f1: 0.2075
 epoch: 2, train_loss: 1.2235, test_loss: 1.4004, test_f1: 0.1744
 epoch: 3, train_loss: 1.2109, test_loss: 1.3813, test_f1: 0.2182
 epoch: 4, train_loss: 1.1963, test_loss: 1.3611, test_f1: 0.2539
 epoch: 5, train_loss: 1.1874, test_loss: 1.3368, test_f1: 0.2718
 epoch: 6, train_loss: 1.1793, test_loss: 1.2738, test_f1: 0.2714
 epoch: 7, train_loss: 1.1752, test_loss: 1.2284, test_f1: 0.2621
 epoch: 8, train_loss: 1.1567, test_loss: 1.2096, test_f1: 0.3120
 epoch: 9, train_loss: 1.1535, test_loss: 1.2002, test_f1: 0.3151
 epoch: 10, train_loss: 1.1478, test_loss: 1.1975, test_f1: 0.3226
 epoch: 11, train_loss: 1.1354, test_loss: 1.1921, test_f1: 0.3446
 epoch: 12, train_loss: 1.1297, test_loss: 1.1827, test_f1: 0.3747
 epoch: 13, train_loss: 1.1238, test_loss: 1.1826, test_f1: 0.3661
 epoch: 14, train_loss: 1.1326, test_loss: 1.1753, test_f1: 0.3958
 epoch: 15, train_loss: 1.1245, test_loss: 1.1668, test_f1: 0.3928
 epoch: 16, train_loss: 1.1262, test_loss: 1.1724, test_f1: 0.3981
 epoch: 17, train_loss: 1.1148, test_loss: 1.1634, test_f1: 0.4063
 epoch: 18, train_loss: 1.1082, test_loss: 1.1687, test_f1: 0.3898
 epoch: 19, train_loss: 1.1147, test_loss: 1.1610, test_f1: 0.3911
 epoch: 20, train_loss: 1.1032, test_loss: 1.1540, test_f1: 0.4000
 epoch: 21, train_loss: 1.1006, test_loss: 1.1533, test_f1: 0.4038
 epoch: 22, train_loss: 1.1015, test_loss: 1.1449, test_f1: 0.4337
 epoch: 23, train_loss: 1.0967, test_loss: 1.1455, test_f1: 0.4137
 epoch: 24, train_loss: 1.0856, test_loss: 1.1456, test_f1: 0.4074
 epoch: 25, train_loss: 1.0885, test_loss: 1.1366, test_f1: 0.4451
 epoch: 26, train_loss: 1.0847, test_loss: 1.1382, test_f1: 0.4358
 epoch: 27, train_loss: 1.0859, test_loss: 1.1350, test_f1: 0.4485
 epoch: 28, train_loss: 1.0861, test_loss: 1.1390, test_f1: 0.4481
 epoch: 29, train_loss: 1.0771, test_loss: 1.1402, test_f1: 0.4215
 epoch: 30, train_loss: 1.0689, test_loss: 1.1378, test_f1: 0.4312
 epoch: 31, train_loss: 1.0714, test_loss: 1.1298, test_f1: 0.4440
 epoch: 32, train_loss: 1.0726, test_loss: 1.1336, test_f1: 0.4398
 epoch: 33, train_loss: 1.0712, test_loss: 1.1373, test_f1: 0.4468
 epoch: 34, train_loss: 1.0660, test_loss: 1.1279, test_f1: 0.4495
 epoch: 35, train_loss: 1.0650, test_loss: 1.1253, test_f1: 0.4473
 epoch: 36, train_loss: 1.0645, test_loss: 1.1370, test_f1: 0.4495
 epoch: 37, train_loss: 1.0662, test_loss: 1.1376, test_f1: 0.4475
 epoch: 38, train_loss: 1.0533, test_loss: 1.1311, test_f1: 0.4475
 epoch: 39, train_loss: 1.0515, test_loss: 1.1350, test_f1: 0.4476
 epoch: 40, train_loss: 1.0644, test_loss: 1.1296, test_f1: 0.4377
 epoch: 41, train_loss: 1.0515, test_loss: 1.1214, test_f1: 0.4573
 epoch: 42, train_loss: 1.0465, test_loss: 1.1272, test_f1: 0.4374
 epoch: 43, train_loss: 1.0498, test_loss: 1.1366, test_f1: 0.4502
 epoch: 44, train_loss: 1.0408, test_loss: 1.1427, test_f1: 0.4536
 epoch: 45, train_loss: 1.0352, test_loss: 1.1514, test_f1: 0.4438
 epoch: 46, train_loss: 1.0405, test_loss: 1.1368, test_f1: 0.4401
 epoch: 47, train_loss: 1.0481, test_loss: 1.1229, test_f1: 0.4501
 epoch: 48, train_loss: 1.0512, test_loss: 1.1263, test_f1: 0.4547
 epoch: 49, train_loss: 1.0403, test_loss: 1.1305, test_f1: 0.4420
 epoch: 50, train_loss: 1.0350, test_loss: 1.1268, test_f1: 0.4392
 epoch: 51, train_loss: 1.0290, test_loss: 1.1244, test_f1: 0.4400
 epoch: 52, train_loss: 1.0297, test_loss: 1.1231, test_f1: 0.4460
 epoch: 53, train_loss: 1.0409, test_loss: 1.1278, test_f1: 0.4488
 epoch: 54, train_loss: 1.0364, test_loss: 1.1268, test_f1: 0.4430
 epoch: 55, train_loss: 1.0333, test_loss: 1.1356, test_f1: 0.4411
 epoch: 56, train_loss: 1.0347, test_loss: 1.1230, test_f1: 0.4456
 epoch: 57, train_loss: 1.0239, test_loss: 1.1230, test_f1: 0.4434
 epoch: 58, train_loss: 1.0284, test_loss: 1.1196, test_f1: 0.4440
 epoch: 59, train_loss: 1.0331, test_loss: 1.1342, test_f1: 0.4533
 epoch: 60, train_loss: 1.0316, test_loss: 1.1306, test_f1: 0.4397
 epoch: 61, train_loss: 1.0299, test_loss: 1.1250, test_f1: 0.4397
 epoch: 62, train_loss: 1.0268, test_loss: 1.1238, test_f1: 0.4486
 epoch: 63, train_loss: 1.0308, test_loss: 1.1226, test_f1: 0.4486
 epoch: 64, train_loss: 1.0343, test_loss: 1.1255, test_f1: 0.4482
 epoch: 65, train_loss: 1.0261, test_loss: 1.1298, test_f1: 0.4463
 epoch: 66, train_loss: 1.0237, test_loss: 1.1200, test_f1: 0.4417
 epoch: 67, train_loss: 1.0265, test_loss: 1.1247, test_f1: 0.4463
 epoch: 68, train_loss: 1.0299, test_loss: 1.1365, test_f1: 0.4482
 epoch: 69, train_loss: 1.0284, test_loss: 1.1228, test_f1: 0.4479
 epoch: 70, train_loss: 1.0184, test_loss: 1.1216, test_f1: 0.4463
 epoch: 71, train_loss: 1.0152, test_loss: 1.1278, test_f1: 0.4483
 epoch: 72, train_loss: 1.0245, test_loss: 1.1399, test_f1: 0.4435
 epoch: 73, train_loss: 1.0275, test_loss: 1.1383, test_f1: 0.4480
 epoch: 74, train_loss: 1.0137, test_loss: 1.1280, test_f1: 0.4481
 epoch: 75, train_loss: 1.0134, test_loss: 1.1389, test_f1: 0.4437
 epoch: 76, train_loss: 1.0169, test_loss: 1.1561, test_f1: 0.4502
 epoch: 77, train_loss: 1.0210, test_loss: 1.1350, test_f1: 0.4590
 epoch: 78, train_loss: 1.0197, test_loss: 1.1373, test_f1: 0.4481
 epoch: 79, train_loss: 1.0178, test_loss: 1.1271, test_f1: 0.4509
 epoch: 80, train_loss: 1.0257, test_loss: 1.1406, test_f1: 0.4465
 epoch: 81, train_loss: 1.0245, test_loss: 1.1393, test_f1: 0.4525
 epoch: 82, train_loss: 1.0136, test_loss: 1.1375, test_f1: 0.4504
 epoch: 83, train_loss: 1.0100, test_loss: 1.1340, test_f1: 0.4502
 epoch: 84, train_loss: 1.0228, test_loss: 1.1286, test_f1: 0.4580
 epoch: 85, train_loss: 1.0170, test_loss: 1.1330, test_f1: 0.4520
 epoch: 86, train_loss: 1.0070, test_loss: 1.1346, test_f1: 0.4480
 epoch: 87, train_loss: 1.0120, test_loss: 1.1439, test_f1: 0.4587
 epoch: 88, train_loss: 1.0067, test_loss: 1.1292, test_f1: 0.4529
 epoch: 89, train_loss: 1.0133, test_loss: 1.1295, test_f1: 0.4514
 epoch: 90, train_loss: 1.0051, test_loss: 1.1382, test_f1: 0.4486
 epoch: 91, train_loss: 1.0114, test_loss: 1.1483, test_f1: 0.4529
 epoch: 92, train_loss: 1.0022, test_loss: 1.1287, test_f1: 0.4508
 epoch: 93, train_loss: 1.0015, test_loss: 1.1422, test_f1: 0.4441
 epoch: 94, train_loss: 1.0096, test_loss: 1.1395, test_f1: 0.4448
 epoch: 95, train_loss: 1.0039, test_loss: 1.1490, test_f1: 0.4522
 epoch: 96, train_loss: 1.0005, test_loss: 1.1531, test_f1: 0.4502
 epoch: 97, train_loss: 0.9975, test_loss: 1.1443, test_f1: 0.4505
 epoch: 98, train_loss: 0.9967, test_loss: 1.1428, test_f1: 0.4484
 epoch: 99, train_loss: 1.0070, test_loss: 1.1474, test_f1: 0.4489
##################ITERATION #8 ****************************************
 epoch: 0, train_loss: 1.2669, test_loss: 1.3548, test_f1: 0.2281
 epoch: 1, train_loss: 1.2468, test_loss: 1.3355, test_f1: 0.2281
 epoch: 2, train_loss: 1.2183, test_loss: 1.3281, test_f1: 0.2281
 epoch: 3, train_loss: 1.2083, test_loss: 1.3134, test_f1: 0.2281
 epoch: 4, train_loss: 1.2042, test_loss: 1.2957, test_f1: 0.2285
 epoch: 5, train_loss: 1.1908, test_loss: 1.2761, test_f1: 0.2397
 epoch: 6, train_loss: 1.1840, test_loss: 1.2479, test_f1: 0.2335
 epoch: 7, train_loss: 1.1741, test_loss: 1.2328, test_f1: 0.2446
 epoch: 8, train_loss: 1.1699, test_loss: 1.2259, test_f1: 0.2482
 epoch: 9, train_loss: 1.1625, test_loss: 1.2187, test_f1: 0.2783
 epoch: 10, train_loss: 1.1524, test_loss: 1.2109, test_f1: 0.2741
 epoch: 11, train_loss: 1.1546, test_loss: 1.2071, test_f1: 0.2814
 epoch: 12, train_loss: 1.1448, test_loss: 1.1990, test_f1: 0.2873
 epoch: 13, train_loss: 1.1401, test_loss: 1.1958, test_f1: 0.2900
 epoch: 14, train_loss: 1.1311, test_loss: 1.1877, test_f1: 0.2935
 epoch: 15, train_loss: 1.1269, test_loss: 1.1870, test_f1: 0.3098
 epoch: 16, train_loss: 1.1216, test_loss: 1.1853, test_f1: 0.3264
 epoch: 17, train_loss: 1.1125, test_loss: 1.1829, test_f1: 0.3416
 epoch: 18, train_loss: 1.1146, test_loss: 1.1761, test_f1: 0.3530
 epoch: 19, train_loss: 1.1019, test_loss: 1.1717, test_f1: 0.3651
 epoch: 20, train_loss: 1.1017, test_loss: 1.1723, test_f1: 0.3613
 epoch: 21, train_loss: 1.0986, test_loss: 1.1688, test_f1: 0.3634
 epoch: 22, train_loss: 1.1044, test_loss: 1.1649, test_f1: 0.3687
 epoch: 23, train_loss: 1.0956, test_loss: 1.1609, test_f1: 0.4025
 epoch: 24, train_loss: 1.0885, test_loss: 1.1596, test_f1: 0.3977
 epoch: 25, train_loss: 1.0923, test_loss: 1.1540, test_f1: 0.4017
 epoch: 26, train_loss: 1.0870, test_loss: 1.1538, test_f1: 0.4050
 epoch: 27, train_loss: 1.0930, test_loss: 1.1512, test_f1: 0.4090
 epoch: 28, train_loss: 1.0836, test_loss: 1.1452, test_f1: 0.4079
 epoch: 29, train_loss: 1.0862, test_loss: 1.1440, test_f1: 0.4075
 epoch: 30, train_loss: 1.0683, test_loss: 1.1422, test_f1: 0.4180
 epoch: 31, train_loss: 1.0675, test_loss: 1.1427, test_f1: 0.4205
 epoch: 32, train_loss: 1.0767, test_loss: 1.1340, test_f1: 0.4225
 epoch: 33, train_loss: 1.0739, test_loss: 1.1348, test_f1: 0.4331
 epoch: 34, train_loss: 1.0629, test_loss: 1.1393, test_f1: 0.4455
 epoch: 35, train_loss: 1.0661, test_loss: 1.1383, test_f1: 0.4264
 epoch: 36, train_loss: 1.0650, test_loss: 1.1338, test_f1: 0.4232
 epoch: 37, train_loss: 1.0655, test_loss: 1.1293, test_f1: 0.4410
 epoch: 38, train_loss: 1.0611, test_loss: 1.1259, test_f1: 0.4334
 epoch: 39, train_loss: 1.0625, test_loss: 1.1292, test_f1: 0.4451
 epoch: 40, train_loss: 1.0519, test_loss: 1.1279, test_f1: 0.4417
 epoch: 41, train_loss: 1.0555, test_loss: 1.1285, test_f1: 0.4335
 epoch: 42, train_loss: 1.0533, test_loss: 1.1258, test_f1: 0.4407
 epoch: 43, train_loss: 1.0526, test_loss: 1.1259, test_f1: 0.4397
 epoch: 44, train_loss: 1.0438, test_loss: 1.1335, test_f1: 0.4423
 epoch: 45, train_loss: 1.0466, test_loss: 1.1353, test_f1: 0.4362
 epoch: 46, train_loss: 1.0403, test_loss: 1.1267, test_f1: 0.4474
 epoch: 47, train_loss: 1.0456, test_loss: 1.1232, test_f1: 0.4472
 epoch: 48, train_loss: 1.0452, test_loss: 1.1207, test_f1: 0.4450
 epoch: 49, train_loss: 1.0473, test_loss: 1.1144, test_f1: 0.4450
 epoch: 50, train_loss: 1.0334, test_loss: 1.1095, test_f1: 0.4506
 epoch: 51, train_loss: 1.0280, test_loss: 1.1057, test_f1: 0.4475
 epoch: 52, train_loss: 1.0287, test_loss: 1.1129, test_f1: 0.4430
 epoch: 53, train_loss: 1.0304, test_loss: 1.1127, test_f1: 0.4490
 epoch: 54, train_loss: 1.0307, test_loss: 1.1094, test_f1: 0.4508
 epoch: 55, train_loss: 1.0311, test_loss: 1.1117, test_f1: 0.4450
 epoch: 56, train_loss: 1.0259, test_loss: 1.1074, test_f1: 0.4515
 epoch: 57, train_loss: 1.0163, test_loss: 1.1073, test_f1: 0.4452
 epoch: 58, train_loss: 1.0288, test_loss: 1.0997, test_f1: 0.4567
 epoch: 59, train_loss: 1.0320, test_loss: 1.1017, test_f1: 0.4520
 epoch: 60, train_loss: 1.0303, test_loss: 1.1034, test_f1: 0.4494
 epoch: 61, train_loss: 1.0255, test_loss: 1.0927, test_f1: 0.4535
 epoch: 62, train_loss: 1.0222, test_loss: 1.0968, test_f1: 0.4457
 epoch: 63, train_loss: 1.0215, test_loss: 1.0981, test_f1: 0.4463
 epoch: 64, train_loss: 1.0209, test_loss: 1.1039, test_f1: 0.4450
 epoch: 65, train_loss: 1.0219, test_loss: 1.1056, test_f1: 0.4539
 epoch: 66, train_loss: 1.0212, test_loss: 1.1002, test_f1: 0.4578
 epoch: 67, train_loss: 1.0233, test_loss: 1.0942, test_f1: 0.4558
 epoch: 68, train_loss: 1.0193, test_loss: 1.0961, test_f1: 0.4577
 epoch: 69, train_loss: 1.0206, test_loss: 1.1007, test_f1: 0.4478
 epoch: 70, train_loss: 1.0168, test_loss: 1.0964, test_f1: 0.4538
 epoch: 71, train_loss: 1.0155, test_loss: 1.0962, test_f1: 0.4502
 epoch: 72, train_loss: 1.0089, test_loss: 1.0992, test_f1: 0.4499
 epoch: 73, train_loss: 1.0143, test_loss: 1.0988, test_f1: 0.4488
 epoch: 74, train_loss: 1.0198, test_loss: 1.1009, test_f1: 0.4490
 epoch: 75, train_loss: 1.0090, test_loss: 1.0938, test_f1: 0.4482
 epoch: 76, train_loss: 1.0120, test_loss: 1.0944, test_f1: 0.4505
 epoch: 77, train_loss: 1.0158, test_loss: 1.0917, test_f1: 0.4452
 epoch: 78, train_loss: 1.0073, test_loss: 1.0840, test_f1: 0.4502
 epoch: 79, train_loss: 1.0094, test_loss: 1.0909, test_f1: 0.4495
 epoch: 80, train_loss: 1.0111, test_loss: 1.0939, test_f1: 0.4437
 epoch: 81, train_loss: 1.0119, test_loss: 1.0914, test_f1: 0.4527
 epoch: 82, train_loss: 0.9990, test_loss: 1.0936, test_f1: 0.4490
 epoch: 83, train_loss: 1.0001, test_loss: 1.0987, test_f1: 0.4474
 epoch: 84, train_loss: 1.0136, test_loss: 1.0965, test_f1: 0.4532
 epoch: 85, train_loss: 0.9983, test_loss: 1.0989, test_f1: 0.4548
 epoch: 86, train_loss: 1.0066, test_loss: 1.0968, test_f1: 0.4560
 epoch: 87, train_loss: 1.0004, test_loss: 1.0922, test_f1: 0.4519
 epoch: 88, train_loss: 1.0083, test_loss: 1.0896, test_f1: 0.4505
 epoch: 89, train_loss: 1.0012, test_loss: 1.0932, test_f1: 0.4589
 epoch: 90, train_loss: 1.0024, test_loss: 1.0913, test_f1: 0.4537
 epoch: 91, train_loss: 1.0049, test_loss: 1.0908, test_f1: 0.4618
 epoch: 92, train_loss: 0.9963, test_loss: 1.0876, test_f1: 0.4526
 epoch: 93, train_loss: 0.9901, test_loss: 1.0890, test_f1: 0.4550
 epoch: 94, train_loss: 1.0045, test_loss: 1.0884, test_f1: 0.4468
 epoch: 95, train_loss: 1.0002, test_loss: 1.0905, test_f1: 0.4547
 epoch: 96, train_loss: 0.9899, test_loss: 1.0902, test_f1: 0.4581
 epoch: 97, train_loss: 0.9855, test_loss: 1.0925, test_f1: 0.4486
 epoch: 98, train_loss: 0.9971, test_loss: 1.0927, test_f1: 0.4481
 epoch: 99, train_loss: 0.9856, test_loss: 1.0892, test_f1: 0.4516
##################ITERATION #9 ****************************************
 epoch: 0, train_loss: 1.2981, test_loss: 1.4232, test_f1: 0.0848
 epoch: 1, train_loss: 1.2305, test_loss: 1.3675, test_f1: 0.2281
 epoch: 2, train_loss: 1.2195, test_loss: 1.3428, test_f1: 0.2261
 epoch: 3, train_loss: 1.2002, test_loss: 1.3195, test_f1: 0.2354
 epoch: 4, train_loss: 1.1918, test_loss: 1.2826, test_f1: 0.2687
 epoch: 5, train_loss: 1.1819, test_loss: 1.2752, test_f1: 0.2976
 epoch: 6, train_loss: 1.1792, test_loss: 1.2578, test_f1: 0.2978
 epoch: 7, train_loss: 1.1700, test_loss: 1.2453, test_f1: 0.3026
 epoch: 8, train_loss: 1.1584, test_loss: 1.2284, test_f1: 0.3110
 epoch: 9, train_loss: 1.1493, test_loss: 1.2173, test_f1: 0.3049
 epoch: 10, train_loss: 1.1473, test_loss: 1.2141, test_f1: 0.3127
 epoch: 11, train_loss: 1.1434, test_loss: 1.2050, test_f1: 0.3159
 epoch: 12, train_loss: 1.1423, test_loss: 1.1995, test_f1: 0.3123
 epoch: 13, train_loss: 1.1375, test_loss: 1.1998, test_f1: 0.3173
 epoch: 14, train_loss: 1.1301, test_loss: 1.1967, test_f1: 0.3184
 epoch: 15, train_loss: 1.1296, test_loss: 1.1880, test_f1: 0.3186
 epoch: 16, train_loss: 1.1288, test_loss: 1.1905, test_f1: 0.3318
 epoch: 17, train_loss: 1.1199, test_loss: 1.1897, test_f1: 0.3329
 epoch: 18, train_loss: 1.1116, test_loss: 1.1794, test_f1: 0.3472
 epoch: 19, train_loss: 1.1105, test_loss: 1.1744, test_f1: 0.3535
 epoch: 20, train_loss: 1.1139, test_loss: 1.1760, test_f1: 0.3426
 epoch: 21, train_loss: 1.1010, test_loss: 1.1736, test_f1: 0.3562
 epoch: 22, train_loss: 1.1103, test_loss: 1.1722, test_f1: 0.3496
 epoch: 23, train_loss: 1.1048, test_loss: 1.1740, test_f1: 0.3561
 epoch: 24, train_loss: 1.1000, test_loss: 1.1675, test_f1: 0.3650
 epoch: 25, train_loss: 1.0881, test_loss: 1.1661, test_f1: 0.3677
 epoch: 26, train_loss: 1.0938, test_loss: 1.1653, test_f1: 0.3632
 epoch: 27, train_loss: 1.0936, test_loss: 1.1645, test_f1: 0.3646
 epoch: 28, train_loss: 1.0849, test_loss: 1.1644, test_f1: 0.3682
 epoch: 29, train_loss: 1.0842, test_loss: 1.1659, test_f1: 0.3605
 epoch: 30, train_loss: 1.0852, test_loss: 1.1646, test_f1: 0.3635
 epoch: 31, train_loss: 1.0769, test_loss: 1.1632, test_f1: 0.3895
 epoch: 32, train_loss: 1.0862, test_loss: 1.1656, test_f1: 0.3604
 epoch: 33, train_loss: 1.0775, test_loss: 1.1653, test_f1: 0.3606
 epoch: 34, train_loss: 1.0798, test_loss: 1.1567, test_f1: 0.3658
 epoch: 35, train_loss: 1.0829, test_loss: 1.1552, test_f1: 0.3965
 epoch: 36, train_loss: 1.0702, test_loss: 1.1582, test_f1: 0.4002
 epoch: 37, train_loss: 1.0645, test_loss: 1.1599, test_f1: 0.3689
 epoch: 38, train_loss: 1.0641, test_loss: 1.1627, test_f1: 0.4136
 epoch: 39, train_loss: 1.0677, test_loss: 1.1550, test_f1: 0.4261
 epoch: 40, train_loss: 1.0649, test_loss: 1.1623, test_f1: 0.3748
 epoch: 41, train_loss: 1.0583, test_loss: 1.1606, test_f1: 0.3657
 epoch: 42, train_loss: 1.0607, test_loss: 1.1569, test_f1: 0.4158
 epoch: 43, train_loss: 1.0609, test_loss: 1.1523, test_f1: 0.4170
 epoch: 44, train_loss: 1.0534, test_loss: 1.1423, test_f1: 0.4069
 epoch: 45, train_loss: 1.0645, test_loss: 1.1479, test_f1: 0.4308
 epoch: 46, train_loss: 1.0476, test_loss: 1.1487, test_f1: 0.4317
 epoch: 47, train_loss: 1.0573, test_loss: 1.1462, test_f1: 0.4294
 epoch: 48, train_loss: 1.0487, test_loss: 1.1356, test_f1: 0.4264
 epoch: 49, train_loss: 1.0549, test_loss: 1.1403, test_f1: 0.4280
 epoch: 50, train_loss: 1.0488, test_loss: 1.1413, test_f1: 0.4311
 epoch: 51, train_loss: 1.0435, test_loss: 1.1417, test_f1: 0.4350
 epoch: 52, train_loss: 1.0387, test_loss: 1.1411, test_f1: 0.4403
 epoch: 53, train_loss: 1.0467, test_loss: 1.1433, test_f1: 0.4370
 epoch: 54, train_loss: 1.0487, test_loss: 1.1392, test_f1: 0.4331
 epoch: 55, train_loss: 1.0454, test_loss: 1.1373, test_f1: 0.4270
 epoch: 56, train_loss: 1.0330, test_loss: 1.1402, test_f1: 0.4376
 epoch: 57, train_loss: 1.0538, test_loss: 1.1380, test_f1: 0.4408
 epoch: 58, train_loss: 1.0440, test_loss: 1.1356, test_f1: 0.4290
 epoch: 59, train_loss: 1.0384, test_loss: 1.1343, test_f1: 0.4294
 epoch: 60, train_loss: 1.0370, test_loss: 1.1362, test_f1: 0.4340
 epoch: 61, train_loss: 1.0369, test_loss: 1.1341, test_f1: 0.4335
 epoch: 62, train_loss: 1.0312, test_loss: 1.1334, test_f1: 0.4310
 epoch: 63, train_loss: 1.0331, test_loss: 1.1373, test_f1: 0.4260
 epoch: 64, train_loss: 1.0439, test_loss: 1.1347, test_f1: 0.4327
 epoch: 65, train_loss: 1.0321, test_loss: 1.1357, test_f1: 0.4364
 epoch: 66, train_loss: 1.0333, test_loss: 1.1349, test_f1: 0.4325
 epoch: 67, train_loss: 1.0277, test_loss: 1.1354, test_f1: 0.4343
 epoch: 68, train_loss: 1.0222, test_loss: 1.1365, test_f1: 0.4283
 epoch: 69, train_loss: 1.0371, test_loss: 1.1380, test_f1: 0.4494
 epoch: 70, train_loss: 1.0265, test_loss: 1.1380, test_f1: 0.4376
 epoch: 71, train_loss: 1.0305, test_loss: 1.1331, test_f1: 0.4438
 epoch: 72, train_loss: 1.0329, test_loss: 1.1319, test_f1: 0.4239
 epoch: 73, train_loss: 1.0293, test_loss: 1.1329, test_f1: 0.4302
 epoch: 74, train_loss: 1.0200, test_loss: 1.1330, test_f1: 0.4453
 epoch: 75, train_loss: 1.0206, test_loss: 1.1348, test_f1: 0.4490
 epoch: 76, train_loss: 1.0336, test_loss: 1.1341, test_f1: 0.4448
 epoch: 77, train_loss: 1.0307, test_loss: 1.1344, test_f1: 0.4531
 epoch: 78, train_loss: 1.0282, test_loss: 1.1314, test_f1: 0.4364
 epoch: 79, train_loss: 1.0313, test_loss: 1.1296, test_f1: 0.4285
 epoch: 80, train_loss: 1.0231, test_loss: 1.1348, test_f1: 0.4494
 epoch: 81, train_loss: 1.0335, test_loss: 1.1324, test_f1: 0.4504
 epoch: 82, train_loss: 1.0251, test_loss: 1.1303, test_f1: 0.4379
 epoch: 83, train_loss: 1.0207, test_loss: 1.1305, test_f1: 0.4444
 epoch: 84, train_loss: 1.0266, test_loss: 1.1355, test_f1: 0.4459
 epoch: 85, train_loss: 1.0135, test_loss: 1.1305, test_f1: 0.4482
 epoch: 86, train_loss: 1.0198, test_loss: 1.1297, test_f1: 0.4486
 epoch: 87, train_loss: 1.0155, test_loss: 1.1256, test_f1: 0.4423
 epoch: 88, train_loss: 1.0188, test_loss: 1.1351, test_f1: 0.4433
 epoch: 89, train_loss: 1.0183, test_loss: 1.1354, test_f1: 0.4449
 epoch: 90, train_loss: 1.0152, test_loss: 1.1248, test_f1: 0.4304
 epoch: 91, train_loss: 1.0148, test_loss: 1.1307, test_f1: 0.4454
 epoch: 92, train_loss: 1.0198, test_loss: 1.1279, test_f1: 0.4523
 epoch: 93, train_loss: 1.0269, test_loss: 1.1314, test_f1: 0.4548
 epoch: 94, train_loss: 1.0053, test_loss: 1.1315, test_f1: 0.4588
 epoch: 95, train_loss: 1.0108, test_loss: 1.1362, test_f1: 0.4597
 epoch: 96, train_loss: 1.0116, test_loss: 1.1361, test_f1: 0.4556
 epoch: 97, train_loss: 1.0072, test_loss: 1.1326, test_f1: 0.4645
 epoch: 98, train_loss: 1.0191, test_loss: 1.1244, test_f1: 0.4540
 epoch: 99, train_loss: 1.0113, test_loss: 1.1261, test_f1: 0.4401

Training completed in 365.71 seconds
Best F1: 0.4759 at epoch 71
Mean F1 across iterations: 0.4500  0.0185
========================FINAL RESULTS================================
FEGIN weighted F1: 0.4759  0.0185
python main.py --data ltspice_demos --representation component_net --model FEGIN --layers 5 --hiddens 32 --batch_size 128 --lr 0.0001 --emb_size 250 --epochs 100 --save_appendix component_net_L5_H32_BS128_LR0.0001_E250 --no_val
-----



STDERR:
  File "main.py", line 370, in <module>
    main()
  File "main.py", line 254, in main
    dataset = dataset_class(
  File "/home/philip/projects/ltspice_examples_code_repo/Circuit-Completion-Using-GNNs/component_classification_with_link_prediction_head/evaluation/FEGIN/kernel/circuit_datasets.py", line 15, in __init__
    self.data, self.slices = torch.load(self.processed_paths[0])
  File "/home/philip/.local/lib/python3.8/site-packages/torch/serialization.py", line 1040, in load
    warnings.warn(
  File "/usr/lib/python3.8/warnings.py", line 109, in _showwarnmsg
    sw(msg.message, msg.category, msg.filename, msg.lineno,
  File "main.py", line 47, in warn_with_traceback
    traceback.print_stack(file=log)
/home/philip/projects/ltspice_examples_code_repo/Circuit-Completion-Using-GNNs/component_classification_with_link_prediction_head/evaluation/FEGIN/kernel/circuit_datasets.py:15: FutureWarning: You are using `torch.load` with `weights_only=False` (the current default value), which uses the default pickle module implicitly. It is possible to construct malicious pickle data which will execute arbitrary code during unpickling (See https://github.com/pytorch/pytorch/blob/main/SECURITY.md#untrusted-models for more details). In a future release, the default value for `weights_only` will be flipped to `True`. This limits the functions that could be executed during unpickling. Arbitrary objects will no longer be allowed to be loaded via this mode unless they are explicitly allowlisted by the user via `torch.serialization.add_safe_globals`. We recommend you start setting `weights_only=True` for any use case where you don't have full control of the loaded file. Please open an issue on GitHub for any issues related to this experimental feature.
  self.data, self.slices = torch.load(self.processed_paths[0])
