STDOUT:
Results will be saved in /home/philip/projects/ltspice_examples_code_repo/Circuit-Completion-Using-GNNs/component_classification_with_link_prediction_head/evaluation/FEGIN/results/model_FEGIN_dataset_ltspice_demos
Command line input: python main.py --data ltspice_demos --representation component_pin --model FEGIN --layers 5 --hiddens 32 --batch_size 32 --lr 0.0001 --emb_size 250 --epochs 100 --save_appendix component_pin_L5_H32_BS32_LR0.0001_E250 --no_val
 is saved.
-----
ltspice_demos - FEGIN
Using 5 layers, 32 hidden units, h = 2
Loading component_pin representation dataset
ENTERED
Training FEGIN on component_pin representation
Train: 1565, Test: 383
##################ITERATION #0 ****************************************
 epoch: 0, train_loss: 1.4223, test_loss: 1.4096, test_f1: 0.0507
 epoch: 1, train_loss: 1.4073, test_loss: 1.3999, test_f1: 0.0507
 epoch: 2, train_loss: 1.3934, test_loss: 1.3884, test_f1: 0.0664
 epoch: 3, train_loss: 1.3758, test_loss: 1.3757, test_f1: 0.1947
 epoch: 4, train_loss: 1.3548, test_loss: 1.3602, test_f1: 0.3135
 epoch: 5, train_loss: 1.3277, test_loss: 1.3413, test_f1: 0.3196
 epoch: 6, train_loss: 1.2990, test_loss: 1.3192, test_f1: 0.3213
 epoch: 7, train_loss: 1.2737, test_loss: 1.2995, test_f1: 0.3231
 epoch: 8, train_loss: 1.2426, test_loss: 1.2816, test_f1: 0.3282
 epoch: 9, train_loss: 1.2274, test_loss: 1.2709, test_f1: 0.3392
 epoch: 10, train_loss: 1.2075, test_loss: 1.2606, test_f1: 0.3230
 epoch: 11, train_loss: 1.1955, test_loss: 1.2538, test_f1: 0.3264
 epoch: 12, train_loss: 1.1877, test_loss: 1.2451, test_f1: 0.3455
 epoch: 13, train_loss: 1.1763, test_loss: 1.2400, test_f1: 0.3540
 epoch: 14, train_loss: 1.1668, test_loss: 1.2316, test_f1: 0.3608
 epoch: 15, train_loss: 1.1620, test_loss: 1.2253, test_f1: 0.3712
 epoch: 16, train_loss: 1.1546, test_loss: 1.2199, test_f1: 0.3675
 epoch: 17, train_loss: 1.1469, test_loss: 1.2079, test_f1: 0.3566
 epoch: 18, train_loss: 1.1397, test_loss: 1.2029, test_f1: 0.3789
 epoch: 19, train_loss: 1.1316, test_loss: 1.2006, test_f1: 0.3699
 epoch: 20, train_loss: 1.1251, test_loss: 1.1841, test_f1: 0.3484
 epoch: 21, train_loss: 1.1192, test_loss: 1.1869, test_f1: 0.3733
 epoch: 22, train_loss: 1.1185, test_loss: 1.1712, test_f1: 0.3313
 epoch: 23, train_loss: 1.1106, test_loss: 1.1738, test_f1: 0.3856
 epoch: 24, train_loss: 1.1099, test_loss: 1.1625, test_f1: 0.3829
 epoch: 25, train_loss: 1.1070, test_loss: 1.1546, test_f1: 0.3897
 epoch: 26, train_loss: 1.0984, test_loss: 1.1502, test_f1: 0.4164
 epoch: 27, train_loss: 1.0898, test_loss: 1.1413, test_f1: 0.4712
 epoch: 28, train_loss: 1.0901, test_loss: 1.1409, test_f1: 0.4182
 epoch: 29, train_loss: 1.0897, test_loss: 1.1340, test_f1: 0.4209
 epoch: 30, train_loss: 1.0699, test_loss: 1.1417, test_f1: 0.4851
 epoch: 31, train_loss: 1.0703, test_loss: 1.1291, test_f1: 0.4304
 epoch: 32, train_loss: 1.0538, test_loss: 1.1204, test_f1: 0.4154
 epoch: 33, train_loss: 1.0604, test_loss: 1.1124, test_f1: 0.4073
 epoch: 34, train_loss: 1.0505, test_loss: 1.1155, test_f1: 0.4304
 epoch: 35, train_loss: 1.0420, test_loss: 1.1080, test_f1: 0.4140
 epoch: 36, train_loss: 1.0389, test_loss: 1.1032, test_f1: 0.4110
 epoch: 37, train_loss: 1.0289, test_loss: 1.1047, test_f1: 0.4066
 epoch: 38, train_loss: 1.0193, test_loss: 1.0971, test_f1: 0.4119
 epoch: 39, train_loss: 1.0214, test_loss: 1.0910, test_f1: 0.4146
 epoch: 40, train_loss: 1.0169, test_loss: 1.0921, test_f1: 0.4076
 epoch: 41, train_loss: 1.0041, test_loss: 1.0813, test_f1: 0.4025
 epoch: 42, train_loss: 0.9960, test_loss: 1.0774, test_f1: 0.4185
 epoch: 43, train_loss: 0.9852, test_loss: 1.0877, test_f1: 0.4100
 epoch: 44, train_loss: 0.9878, test_loss: 1.0625, test_f1: 0.4046
 epoch: 45, train_loss: 0.9694, test_loss: 1.0778, test_f1: 0.4136
 epoch: 46, train_loss: 0.9715, test_loss: 1.0604, test_f1: 0.4274
 epoch: 47, train_loss: 0.9538, test_loss: 1.0659, test_f1: 0.4197
 epoch: 48, train_loss: 0.9473, test_loss: 1.0625, test_f1: 0.4087
 epoch: 49, train_loss: 0.9364, test_loss: 1.0756, test_f1: 0.4320
 epoch: 50, train_loss: 0.9549, test_loss: 1.0755, test_f1: 0.4303
 epoch: 51, train_loss: 0.9334, test_loss: 1.0608, test_f1: 0.4228
 epoch: 52, train_loss: 0.9297, test_loss: 1.0647, test_f1: 0.4090
 epoch: 53, train_loss: 0.9284, test_loss: 1.0644, test_f1: 0.4139
 epoch: 54, train_loss: 0.9288, test_loss: 1.0660, test_f1: 0.4254
 epoch: 55, train_loss: 0.9280, test_loss: 1.0837, test_f1: 0.4177
 epoch: 56, train_loss: 0.9163, test_loss: 1.0604, test_f1: 0.4207
 epoch: 57, train_loss: 0.9173, test_loss: 1.0756, test_f1: 0.4210
 epoch: 58, train_loss: 0.9191, test_loss: 1.0736, test_f1: 0.4242
 epoch: 59, train_loss: 0.9002, test_loss: 1.0958, test_f1: 0.4140
 epoch: 60, train_loss: 0.9112, test_loss: 1.0710, test_f1: 0.4151
 epoch: 61, train_loss: 0.9054, test_loss: 1.0726, test_f1: 0.4042
 epoch: 62, train_loss: 0.9061, test_loss: 1.0922, test_f1: 0.4069
 epoch: 63, train_loss: 0.9109, test_loss: 1.0729, test_f1: 0.4214
 epoch: 64, train_loss: 0.9174, test_loss: 1.0931, test_f1: 0.4281
 epoch: 65, train_loss: 0.9074, test_loss: 1.1014, test_f1: 0.4238
 epoch: 66, train_loss: 0.8953, test_loss: 1.0701, test_f1: 0.4231
 epoch: 67, train_loss: 0.8929, test_loss: 1.0748, test_f1: 0.4112
 epoch: 68, train_loss: 0.8872, test_loss: 1.0796, test_f1: 0.4118
 epoch: 69, train_loss: 0.9026, test_loss: 1.0887, test_f1: 0.4239
 epoch: 70, train_loss: 0.8850, test_loss: 1.0708, test_f1: 0.4307
 epoch: 71, train_loss: 0.8903, test_loss: 1.0900, test_f1: 0.4193
 epoch: 72, train_loss: 0.8818, test_loss: 1.0669, test_f1: 0.4193
 epoch: 73, train_loss: 0.8857, test_loss: 1.0612, test_f1: 0.4231
 epoch: 74, train_loss: 0.8860, test_loss: 1.0852, test_f1: 0.4307
 epoch: 75, train_loss: 0.8773, test_loss: 1.0810, test_f1: 0.4303
 epoch: 76, train_loss: 0.8847, test_loss: 1.0771, test_f1: 0.4227
 epoch: 77, train_loss: 0.8876, test_loss: 1.0920, test_f1: 0.4465
 epoch: 78, train_loss: 0.8728, test_loss: 1.0637, test_f1: 0.4363
 epoch: 79, train_loss: 0.8841, test_loss: 1.0758, test_f1: 0.4395
 epoch: 80, train_loss: 0.8834, test_loss: 1.1068, test_f1: 0.4663
 epoch: 81, train_loss: 0.8730, test_loss: 1.0753, test_f1: 0.4384
 epoch: 82, train_loss: 0.8679, test_loss: 1.0857, test_f1: 0.4339
 epoch: 83, train_loss: 0.8782, test_loss: 1.0882, test_f1: 0.4639
 epoch: 84, train_loss: 0.8763, test_loss: 1.0789, test_f1: 0.4620
 epoch: 85, train_loss: 0.8563, test_loss: 1.0803, test_f1: 0.4556
 epoch: 86, train_loss: 0.8632, test_loss: 1.0794, test_f1: 0.4298
 epoch: 87, train_loss: 0.8658, test_loss: 1.0683, test_f1: 0.4334
 epoch: 88, train_loss: 0.8638, test_loss: 1.0806, test_f1: 0.4370
 epoch: 89, train_loss: 0.8517, test_loss: 1.0640, test_f1: 0.4699
 epoch: 90, train_loss: 0.8746, test_loss: 1.0998, test_f1: 0.4663
 epoch: 91, train_loss: 0.8681, test_loss: 1.0551, test_f1: 0.4741
 epoch: 92, train_loss: 0.8475, test_loss: 1.0643, test_f1: 0.4676
 epoch: 93, train_loss: 0.8641, test_loss: 1.0728, test_f1: 0.4617
 epoch: 94, train_loss: 0.8521, test_loss: 1.0959, test_f1: 0.4633
 epoch: 95, train_loss: 0.8663, test_loss: 1.1009, test_f1: 0.4706
 epoch: 96, train_loss: 0.8520, test_loss: 1.0902, test_f1: 0.4819
 epoch: 97, train_loss: 0.8534, test_loss: 1.1143, test_f1: 0.4844
 epoch: 98, train_loss: 0.8432, test_loss: 1.1114, test_f1: 0.4851
 epoch: 99, train_loss: 0.8425, test_loss: 1.0896, test_f1: 0.4808
##################ITERATION #1 ****************************************
 epoch: 0, train_loss: 1.3994, test_loss: 1.3885, test_f1: 0.0560
 epoch: 1, train_loss: 1.3460, test_loss: 1.3603, test_f1: 0.1990
 epoch: 2, train_loss: 1.3089, test_loss: 1.3364, test_f1: 0.2827
 epoch: 3, train_loss: 1.2772, test_loss: 1.3117, test_f1: 0.3043
 epoch: 4, train_loss: 1.2498, test_loss: 1.2926, test_f1: 0.3130
 epoch: 5, train_loss: 1.2228, test_loss: 1.2820, test_f1: 0.2931
 epoch: 6, train_loss: 1.2018, test_loss: 1.2739, test_f1: 0.2910
 epoch: 7, train_loss: 1.1958, test_loss: 1.2662, test_f1: 0.2910
 epoch: 8, train_loss: 1.1838, test_loss: 1.2592, test_f1: 0.2945
 epoch: 9, train_loss: 1.1793, test_loss: 1.2677, test_f1: 0.3020
 epoch: 10, train_loss: 1.1647, test_loss: 1.2617, test_f1: 0.3021
 epoch: 11, train_loss: 1.1623, test_loss: 1.2503, test_f1: 0.3244
 epoch: 12, train_loss: 1.1476, test_loss: 1.2466, test_f1: 0.3601
 epoch: 13, train_loss: 1.1359, test_loss: 1.2362, test_f1: 0.3746
 epoch: 14, train_loss: 1.1422, test_loss: 1.2275, test_f1: 0.3958
 epoch: 15, train_loss: 1.1153, test_loss: 1.2238, test_f1: 0.3686
 epoch: 16, train_loss: 1.1137, test_loss: 1.2271, test_f1: 0.3699
 epoch: 17, train_loss: 1.1069, test_loss: 1.2157, test_f1: 0.3574
 epoch: 18, train_loss: 1.1011, test_loss: 1.2077, test_f1: 0.3538
 epoch: 19, train_loss: 1.0854, test_loss: 1.1956, test_f1: 0.3664
 epoch: 20, train_loss: 1.0847, test_loss: 1.2070, test_f1: 0.3512
 epoch: 21, train_loss: 1.0711, test_loss: 1.1932, test_f1: 0.3568
 epoch: 22, train_loss: 1.0617, test_loss: 1.2057, test_f1: 0.3590
 epoch: 23, train_loss: 1.0597, test_loss: 1.1873, test_f1: 0.3793
 epoch: 24, train_loss: 1.0560, test_loss: 1.1806, test_f1: 0.3670
 epoch: 25, train_loss: 1.0407, test_loss: 1.1784, test_f1: 0.3646
 epoch: 26, train_loss: 1.0274, test_loss: 1.1792, test_f1: 0.3895
 epoch: 27, train_loss: 1.0435, test_loss: 1.1735, test_f1: 0.3606
 epoch: 28, train_loss: 1.0217, test_loss: 1.1762, test_f1: 0.3656
 epoch: 29, train_loss: 1.0177, test_loss: 1.1717, test_f1: 0.3837
 epoch: 30, train_loss: 1.0186, test_loss: 1.1644, test_f1: 0.3770
 epoch: 31, train_loss: 1.0075, test_loss: 1.1283, test_f1: 0.3693
 epoch: 32, train_loss: 0.9976, test_loss: 1.1550, test_f1: 0.3766
 epoch: 33, train_loss: 1.0134, test_loss: 1.1493, test_f1: 0.3978
 epoch: 34, train_loss: 1.0014, test_loss: 1.1400, test_f1: 0.3831
 epoch: 35, train_loss: 0.9839, test_loss: 1.1154, test_f1: 0.3819
 epoch: 36, train_loss: 0.9769, test_loss: 1.1121, test_f1: 0.3763
 epoch: 37, train_loss: 0.9881, test_loss: 1.1241, test_f1: 0.3916
 epoch: 38, train_loss: 0.9801, test_loss: 1.1556, test_f1: 0.3931
 epoch: 39, train_loss: 0.9638, test_loss: 1.1432, test_f1: 0.3719
 epoch: 40, train_loss: 0.9637, test_loss: 1.1300, test_f1: 0.4081
 epoch: 41, train_loss: 0.9620, test_loss: 1.1221, test_f1: 0.4042
 epoch: 42, train_loss: 0.9597, test_loss: 1.1331, test_f1: 0.3905
 epoch: 43, train_loss: 0.9584, test_loss: 1.1496, test_f1: 0.3998
 epoch: 44, train_loss: 0.9440, test_loss: 1.1272, test_f1: 0.4195
 epoch: 45, train_loss: 0.9362, test_loss: 1.1262, test_f1: 0.3908
 epoch: 46, train_loss: 0.9359, test_loss: 1.1070, test_f1: 0.4050
 epoch: 47, train_loss: 0.9306, test_loss: 1.0966, test_f1: 0.4300
 epoch: 48, train_loss: 0.9325, test_loss: 1.1269, test_f1: 0.4018
 epoch: 49, train_loss: 0.9371, test_loss: 1.1292, test_f1: 0.4096
 epoch: 50, train_loss: 0.9260, test_loss: 1.1334, test_f1: 0.3981
 epoch: 51, train_loss: 0.9168, test_loss: 1.0957, test_f1: 0.4458
 epoch: 52, train_loss: 0.9095, test_loss: 1.1087, test_f1: 0.4085
 epoch: 53, train_loss: 0.9207, test_loss: 1.1416, test_f1: 0.3906
 epoch: 54, train_loss: 0.9086, test_loss: 1.1030, test_f1: 0.3961
 epoch: 55, train_loss: 0.9118, test_loss: 1.1154, test_f1: 0.4173
 epoch: 56, train_loss: 0.9057, test_loss: 1.1064, test_f1: 0.3961
 epoch: 57, train_loss: 0.9066, test_loss: 1.1069, test_f1: 0.4225
 epoch: 58, train_loss: 0.9086, test_loss: 1.1268, test_f1: 0.4052
 epoch: 59, train_loss: 0.9139, test_loss: 1.0937, test_f1: 0.4052
 epoch: 60, train_loss: 0.8962, test_loss: 1.1266, test_f1: 0.4234
 epoch: 61, train_loss: 0.9037, test_loss: 1.1404, test_f1: 0.4075
 epoch: 62, train_loss: 0.8893, test_loss: 1.1146, test_f1: 0.4291
 epoch: 63, train_loss: 0.8983, test_loss: 1.0953, test_f1: 0.4442
 epoch: 64, train_loss: 0.9026, test_loss: 1.1004, test_f1: 0.4451
 epoch: 65, train_loss: 0.9025, test_loss: 1.1057, test_f1: 0.4223
 epoch: 66, train_loss: 0.8970, test_loss: 1.1234, test_f1: 0.4123
 epoch: 67, train_loss: 0.9002, test_loss: 1.1194, test_f1: 0.4396
 epoch: 68, train_loss: 0.8970, test_loss: 1.1684, test_f1: 0.4035
 epoch: 69, train_loss: 0.8930, test_loss: 1.1136, test_f1: 0.4166
 epoch: 70, train_loss: 0.8940, test_loss: 1.1260, test_f1: 0.4611
 epoch: 71, train_loss: 0.8835, test_loss: 1.1198, test_f1: 0.4295
 epoch: 72, train_loss: 0.8932, test_loss: 1.1382, test_f1: 0.4375
 epoch: 73, train_loss: 0.8735, test_loss: 1.1162, test_f1: 0.4346
 epoch: 74, train_loss: 0.8863, test_loss: 1.1164, test_f1: 0.4631
 epoch: 75, train_loss: 0.8724, test_loss: 1.1307, test_f1: 0.4173
 epoch: 76, train_loss: 0.8742, test_loss: 1.1345, test_f1: 0.4457
 epoch: 77, train_loss: 0.8859, test_loss: 1.1134, test_f1: 0.4538
 epoch: 78, train_loss: 0.8687, test_loss: 1.1093, test_f1: 0.4443
 epoch: 79, train_loss: 0.8784, test_loss: 1.1399, test_f1: 0.4421
 epoch: 80, train_loss: 0.8686, test_loss: 1.1290, test_f1: 0.4459
 epoch: 81, train_loss: 0.8815, test_loss: 1.1264, test_f1: 0.4500
 epoch: 82, train_loss: 0.8780, test_loss: 1.1026, test_f1: 0.4844
 epoch: 83, train_loss: 0.8742, test_loss: 1.1238, test_f1: 0.4523
 epoch: 84, train_loss: 0.8612, test_loss: 1.0542, test_f1: 0.4791
 epoch: 85, train_loss: 0.8792, test_loss: 1.1323, test_f1: 0.4501
 epoch: 86, train_loss: 0.8728, test_loss: 1.1041, test_f1: 0.4620
 epoch: 87, train_loss: 0.8683, test_loss: 1.1280, test_f1: 0.4505
 epoch: 88, train_loss: 0.8613, test_loss: 1.1235, test_f1: 0.4628
 epoch: 89, train_loss: 0.8723, test_loss: 1.1211, test_f1: 0.4709
 epoch: 90, train_loss: 0.8730, test_loss: 1.1257, test_f1: 0.4483
 epoch: 91, train_loss: 0.8474, test_loss: 1.1270, test_f1: 0.4712
 epoch: 92, train_loss: 0.8622, test_loss: 1.1423, test_f1: 0.4487
 epoch: 93, train_loss: 0.8622, test_loss: 1.1235, test_f1: 0.4678
 epoch: 94, train_loss: 0.8640, test_loss: 1.1207, test_f1: 0.4596
 epoch: 95, train_loss: 0.8590, test_loss: 1.1320, test_f1: 0.4656
 epoch: 96, train_loss: 0.8607, test_loss: 1.1067, test_f1: 0.4745
 epoch: 97, train_loss: 0.8514, test_loss: 1.1412, test_f1: 0.4429
 epoch: 98, train_loss: 0.8739, test_loss: 1.1254, test_f1: 0.4739
 epoch: 99, train_loss: 0.8534, test_loss: 1.1374, test_f1: 0.4673
##################ITERATION #2 ****************************************
 epoch: 0, train_loss: 1.3366, test_loss: 1.3345, test_f1: 0.2291
 epoch: 1, train_loss: 1.2823, test_loss: 1.3108, test_f1: 0.2479
 epoch: 2, train_loss: 1.2549, test_loss: 1.2932, test_f1: 0.2514
 epoch: 3, train_loss: 1.2373, test_loss: 1.2748, test_f1: 0.2581
 epoch: 4, train_loss: 1.2190, test_loss: 1.2633, test_f1: 0.2453
 epoch: 5, train_loss: 1.2006, test_loss: 1.2471, test_f1: 0.2607
 epoch: 6, train_loss: 1.1779, test_loss: 1.2388, test_f1: 0.3089
 epoch: 7, train_loss: 1.1671, test_loss: 1.2264, test_f1: 0.3430
 epoch: 8, train_loss: 1.1525, test_loss: 1.2154, test_f1: 0.3394
 epoch: 9, train_loss: 1.1338, test_loss: 1.2034, test_f1: 0.3441
 epoch: 10, train_loss: 1.1186, test_loss: 1.1906, test_f1: 0.3245
 epoch: 11, train_loss: 1.1132, test_loss: 1.1757, test_f1: 0.3326
 epoch: 12, train_loss: 1.0981, test_loss: 1.1671, test_f1: 0.3323
 epoch: 13, train_loss: 1.0896, test_loss: 1.1547, test_f1: 0.3354
 epoch: 14, train_loss: 1.0752, test_loss: 1.1527, test_f1: 0.3709
 epoch: 15, train_loss: 1.0652, test_loss: 1.1484, test_f1: 0.3874
 epoch: 16, train_loss: 1.0514, test_loss: 1.1465, test_f1: 0.3820
 epoch: 17, train_loss: 1.0418, test_loss: 1.1334, test_f1: 0.3962
 epoch: 18, train_loss: 1.0332, test_loss: 1.1231, test_f1: 0.4006
 epoch: 19, train_loss: 1.0234, test_loss: 1.1313, test_f1: 0.3855
 epoch: 20, train_loss: 1.0239, test_loss: 1.1262, test_f1: 0.3989
 epoch: 21, train_loss: 1.0159, test_loss: 1.1351, test_f1: 0.4025
 epoch: 22, train_loss: 1.0151, test_loss: 1.1120, test_f1: 0.3931
 epoch: 23, train_loss: 1.0034, test_loss: 1.1095, test_f1: 0.4014
 epoch: 24, train_loss: 0.9980, test_loss: 1.1114, test_f1: 0.3990
 epoch: 25, train_loss: 0.9861, test_loss: 1.1331, test_f1: 0.3969
 epoch: 26, train_loss: 0.9787, test_loss: 1.1210, test_f1: 0.4085
 epoch: 27, train_loss: 0.9841, test_loss: 1.1307, test_f1: 0.3987
 epoch: 28, train_loss: 0.9708, test_loss: 1.1283, test_f1: 0.4211
 epoch: 29, train_loss: 0.9670, test_loss: 1.1324, test_f1: 0.4014
 epoch: 30, train_loss: 0.9599, test_loss: 1.1148, test_f1: 0.4074
 epoch: 31, train_loss: 0.9634, test_loss: 1.0992, test_f1: 0.4098
 epoch: 32, train_loss: 0.9606, test_loss: 1.1375, test_f1: 0.3933
 epoch: 33, train_loss: 0.9509, test_loss: 1.1239, test_f1: 0.4224
 epoch: 34, train_loss: 0.9378, test_loss: 1.1007, test_f1: 0.4120
 epoch: 35, train_loss: 0.9375, test_loss: 1.1148, test_f1: 0.3954
 epoch: 36, train_loss: 0.9373, test_loss: 1.0938, test_f1: 0.4229
 epoch: 37, train_loss: 0.9177, test_loss: 1.1231, test_f1: 0.4239
 epoch: 38, train_loss: 0.9349, test_loss: 1.1099, test_f1: 0.4092
 epoch: 39, train_loss: 0.9255, test_loss: 1.1147, test_f1: 0.4010
 epoch: 40, train_loss: 0.9264, test_loss: 1.0998, test_f1: 0.4123
 epoch: 41, train_loss: 0.9129, test_loss: 1.1112, test_f1: 0.4178
 epoch: 42, train_loss: 0.9189, test_loss: 1.1247, test_f1: 0.4407
 epoch: 43, train_loss: 0.9086, test_loss: 1.1897, test_f1: 0.4077
 epoch: 44, train_loss: 0.9028, test_loss: 1.0989, test_f1: 0.4503
 epoch: 45, train_loss: 0.9005, test_loss: 1.1334, test_f1: 0.4352
 epoch: 46, train_loss: 0.9023, test_loss: 1.1316, test_f1: 0.4611
 epoch: 47, train_loss: 0.8885, test_loss: 1.0926, test_f1: 0.4420
 epoch: 48, train_loss: 0.8946, test_loss: 1.1232, test_f1: 0.4516
 epoch: 49, train_loss: 0.8768, test_loss: 1.0872, test_f1: 0.4719
 epoch: 50, train_loss: 0.8830, test_loss: 1.1119, test_f1: 0.4437
 epoch: 51, train_loss: 0.8819, test_loss: 1.0916, test_f1: 0.4537
 epoch: 52, train_loss: 0.8737, test_loss: 1.1089, test_f1: 0.4670
 epoch: 53, train_loss: 0.8769, test_loss: 1.1086, test_f1: 0.4894
 epoch: 54, train_loss: 0.8588, test_loss: 1.1359, test_f1: 0.4716
 epoch: 55, train_loss: 0.8604, test_loss: 1.1224, test_f1: 0.4792
 epoch: 56, train_loss: 0.8778, test_loss: 1.1254, test_f1: 0.4886
 epoch: 57, train_loss: 0.8673, test_loss: 1.1316, test_f1: 0.4920
 epoch: 58, train_loss: 0.8618, test_loss: 1.1298, test_f1: 0.4818
 epoch: 59, train_loss: 0.8553, test_loss: 1.1204, test_f1: 0.4874
 epoch: 60, train_loss: 0.8663, test_loss: 1.1528, test_f1: 0.4734
 epoch: 61, train_loss: 0.8561, test_loss: 1.1665, test_f1: 0.4773
 epoch: 62, train_loss: 0.8634, test_loss: 1.1423, test_f1: 0.4816
 epoch: 63, train_loss: 0.8520, test_loss: 1.1548, test_f1: 0.4971
 epoch: 64, train_loss: 0.8539, test_loss: 1.1394, test_f1: 0.4808
 epoch: 65, train_loss: 0.8623, test_loss: 1.1258, test_f1: 0.4825
 epoch: 66, train_loss: 0.8517, test_loss: 1.1126, test_f1: 0.4753
 epoch: 67, train_loss: 0.8409, test_loss: 1.1541, test_f1: 0.4994
 epoch: 68, train_loss: 0.8398, test_loss: 1.1554, test_f1: 0.4967
 epoch: 69, train_loss: 0.8485, test_loss: 1.1266, test_f1: 0.4897
 epoch: 70, train_loss: 0.8455, test_loss: 1.1732, test_f1: 0.5063
 epoch: 71, train_loss: 0.8508, test_loss: 1.1536, test_f1: 0.4980
 epoch: 72, train_loss: 0.8430, test_loss: 1.0998, test_f1: 0.4978
 epoch: 73, train_loss: 0.8378, test_loss: 1.1377, test_f1: 0.5171
 epoch: 74, train_loss: 0.8420, test_loss: 1.1151, test_f1: 0.5006
 epoch: 75, train_loss: 0.8436, test_loss: 1.1007, test_f1: 0.5064
 epoch: 76, train_loss: 0.8301, test_loss: 1.1315, test_f1: 0.5107
 epoch: 77, train_loss: 0.8462, test_loss: 1.1266, test_f1: 0.5265
 epoch: 78, train_loss: 0.8333, test_loss: 1.1571, test_f1: 0.5083
 epoch: 79, train_loss: 0.8272, test_loss: 1.1598, test_f1: 0.5046
 epoch: 80, train_loss: 0.8327, test_loss: 1.1545, test_f1: 0.4892
 epoch: 81, train_loss: 0.8242, test_loss: 1.1562, test_f1: 0.5038
 epoch: 82, train_loss: 0.8371, test_loss: 1.1219, test_f1: 0.5107
 epoch: 83, train_loss: 0.8342, test_loss: 1.1647, test_f1: 0.5217
 epoch: 84, train_loss: 0.8358, test_loss: 1.1904, test_f1: 0.5007
 epoch: 85, train_loss: 0.8181, test_loss: 1.1469, test_f1: 0.5131
 epoch: 86, train_loss: 0.8261, test_loss: 1.1748, test_f1: 0.5160
 epoch: 87, train_loss: 0.8271, test_loss: 1.1823, test_f1: 0.5169
 epoch: 88, train_loss: 0.8144, test_loss: 1.1595, test_f1: 0.5210
 epoch: 89, train_loss: 0.8232, test_loss: 1.1412, test_f1: 0.5214
 epoch: 90, train_loss: 0.8151, test_loss: 1.1663, test_f1: 0.5151
 epoch: 91, train_loss: 0.8309, test_loss: 1.1747, test_f1: 0.5200
 epoch: 92, train_loss: 0.8098, test_loss: 1.1947, test_f1: 0.5085
 epoch: 93, train_loss: 0.8198, test_loss: 1.1609, test_f1: 0.5152
 epoch: 94, train_loss: 0.8143, test_loss: 1.1695, test_f1: 0.5110
 epoch: 95, train_loss: 0.8088, test_loss: 1.1611, test_f1: 0.5127
 epoch: 96, train_loss: 0.8012, test_loss: 1.1627, test_f1: 0.5183
 epoch: 97, train_loss: 0.7970, test_loss: 1.1778, test_f1: 0.5199
 epoch: 98, train_loss: 0.8141, test_loss: 1.2030, test_f1: 0.5627
 epoch: 99, train_loss: 0.8229, test_loss: 1.2404, test_f1: 0.5257
##################ITERATION #3 ****************************************
 epoch: 0, train_loss: 1.3655, test_loss: 1.3461, test_f1: 0.2404
 epoch: 1, train_loss: 1.2959, test_loss: 1.3201, test_f1: 0.2442
 epoch: 2, train_loss: 1.2643, test_loss: 1.2968, test_f1: 0.2285
 epoch: 3, train_loss: 1.2429, test_loss: 1.2856, test_f1: 0.2311
 epoch: 4, train_loss: 1.2284, test_loss: 1.2726, test_f1: 0.2413
 epoch: 5, train_loss: 1.2117, test_loss: 1.2632, test_f1: 0.2371
 epoch: 6, train_loss: 1.1926, test_loss: 1.2470, test_f1: 0.2550
 epoch: 7, train_loss: 1.1831, test_loss: 1.2364, test_f1: 0.2867
 epoch: 8, train_loss: 1.1604, test_loss: 1.2254, test_f1: 0.3471
 epoch: 9, train_loss: 1.1508, test_loss: 1.2154, test_f1: 0.3766
 epoch: 10, train_loss: 1.1430, test_loss: 1.2083, test_f1: 0.3686
 epoch: 11, train_loss: 1.1151, test_loss: 1.1936, test_f1: 0.3877
 epoch: 12, train_loss: 1.1105, test_loss: 1.1889, test_f1: 0.3852
 epoch: 13, train_loss: 1.0989, test_loss: 1.1729, test_f1: 0.3983
 epoch: 14, train_loss: 1.0858, test_loss: 1.1744, test_f1: 0.3911
 epoch: 15, train_loss: 1.0726, test_loss: 1.1608, test_f1: 0.3951
 epoch: 16, train_loss: 1.0722, test_loss: 1.1549, test_f1: 0.4208
 epoch: 17, train_loss: 1.0622, test_loss: 1.1385, test_f1: 0.4228
 epoch: 18, train_loss: 1.0516, test_loss: 1.1317, test_f1: 0.4331
 epoch: 19, train_loss: 1.0398, test_loss: 1.1254, test_f1: 0.4406
 epoch: 20, train_loss: 1.0191, test_loss: 1.1170, test_f1: 0.4330
 epoch: 21, train_loss: 1.0228, test_loss: 1.1034, test_f1: 0.4407
 epoch: 22, train_loss: 1.0189, test_loss: 1.1060, test_f1: 0.4357
 epoch: 23, train_loss: 1.0084, test_loss: 1.1008, test_f1: 0.4395
 epoch: 24, train_loss: 1.0052, test_loss: 1.0984, test_f1: 0.4520
 epoch: 25, train_loss: 0.9949, test_loss: 1.0838, test_f1: 0.4666
 epoch: 26, train_loss: 0.9888, test_loss: 1.0695, test_f1: 0.4537
 epoch: 27, train_loss: 0.9849, test_loss: 1.0631, test_f1: 0.4433
 epoch: 28, train_loss: 0.9817, test_loss: 1.0491, test_f1: 0.4530
 epoch: 29, train_loss: 0.9791, test_loss: 1.0507, test_f1: 0.4651
 epoch: 30, train_loss: 0.9644, test_loss: 1.0354, test_f1: 0.4785
 epoch: 31, train_loss: 0.9617, test_loss: 1.0248, test_f1: 0.4857
 epoch: 32, train_loss: 0.9560, test_loss: 1.0238, test_f1: 0.4899
 epoch: 33, train_loss: 0.9501, test_loss: 1.0292, test_f1: 0.4803
 epoch: 34, train_loss: 0.9499, test_loss: 1.0176, test_f1: 0.5007
 epoch: 35, train_loss: 0.9461, test_loss: 1.0228, test_f1: 0.5080
 epoch: 36, train_loss: 0.9397, test_loss: 1.0165, test_f1: 0.5072
 epoch: 37, train_loss: 0.9238, test_loss: 1.0049, test_f1: 0.5121
 epoch: 38, train_loss: 0.9320, test_loss: 1.0286, test_f1: 0.5110
 epoch: 39, train_loss: 0.9280, test_loss: 1.0190, test_f1: 0.5067
 epoch: 40, train_loss: 0.9074, test_loss: 1.0058, test_f1: 0.5222
 epoch: 41, train_loss: 0.9131, test_loss: 1.0111, test_f1: 0.5153
 epoch: 42, train_loss: 0.9162, test_loss: 1.0059, test_f1: 0.5180
 epoch: 43, train_loss: 0.9183, test_loss: 1.0162, test_f1: 0.5181
 epoch: 44, train_loss: 0.9037, test_loss: 1.0103, test_f1: 0.5207
 epoch: 45, train_loss: 0.9016, test_loss: 1.0184, test_f1: 0.4898
 epoch: 46, train_loss: 0.8984, test_loss: 1.0094, test_f1: 0.5214
 epoch: 47, train_loss: 0.8994, test_loss: 0.9993, test_f1: 0.5091
 epoch: 48, train_loss: 0.9010, test_loss: 1.0190, test_f1: 0.5012
 epoch: 49, train_loss: 0.8918, test_loss: 1.0012, test_f1: 0.5205
 epoch: 50, train_loss: 0.8884, test_loss: 1.0046, test_f1: 0.4970
 epoch: 51, train_loss: 0.8788, test_loss: 1.0205, test_f1: 0.5068
 epoch: 52, train_loss: 0.8796, test_loss: 1.0015, test_f1: 0.5051
 epoch: 53, train_loss: 0.8772, test_loss: 0.9939, test_f1: 0.5234
 epoch: 54, train_loss: 0.8707, test_loss: 1.0058, test_f1: 0.5088
 epoch: 55, train_loss: 0.8721, test_loss: 0.9980, test_f1: 0.5220
 epoch: 56, train_loss: 0.8751, test_loss: 0.9904, test_f1: 0.5323
 epoch: 57, train_loss: 0.8631, test_loss: 0.9919, test_f1: 0.5265
 epoch: 58, train_loss: 0.8767, test_loss: 1.0079, test_f1: 0.5147
 epoch: 59, train_loss: 0.8692, test_loss: 1.0002, test_f1: 0.5229
 epoch: 60, train_loss: 0.8713, test_loss: 1.0013, test_f1: 0.5266
 epoch: 61, train_loss: 0.8649, test_loss: 0.9908, test_f1: 0.5402
 epoch: 62, train_loss: 0.8604, test_loss: 1.0029, test_f1: 0.5200
 epoch: 63, train_loss: 0.8679, test_loss: 0.9945, test_f1: 0.5286
 epoch: 64, train_loss: 0.8700, test_loss: 1.0279, test_f1: 0.5193
 epoch: 65, train_loss: 0.8624, test_loss: 1.0089, test_f1: 0.5139
 epoch: 66, train_loss: 0.8585, test_loss: 0.9834, test_f1: 0.5237
 epoch: 67, train_loss: 0.8582, test_loss: 0.9801, test_f1: 0.5210
 epoch: 68, train_loss: 0.8668, test_loss: 1.0170, test_f1: 0.5180
 epoch: 69, train_loss: 0.8612, test_loss: 0.9816, test_f1: 0.5195
 epoch: 70, train_loss: 0.8576, test_loss: 0.9887, test_f1: 0.5214
 epoch: 71, train_loss: 0.8428, test_loss: 1.0019, test_f1: 0.5194
 epoch: 72, train_loss: 0.8336, test_loss: 1.0126, test_f1: 0.5040
 epoch: 73, train_loss: 0.8431, test_loss: 1.0104, test_f1: 0.5230
 epoch: 74, train_loss: 0.8434, test_loss: 0.9819, test_f1: 0.5268
 epoch: 75, train_loss: 0.8424, test_loss: 0.9731, test_f1: 0.5472
 epoch: 76, train_loss: 0.8341, test_loss: 0.9765, test_f1: 0.5394
 epoch: 77, train_loss: 0.8445, test_loss: 0.9871, test_f1: 0.5175
 epoch: 78, train_loss: 0.8423, test_loss: 0.9931, test_f1: 0.5267
 epoch: 79, train_loss: 0.8338, test_loss: 0.9833, test_f1: 0.5361
 epoch: 80, train_loss: 0.8281, test_loss: 0.9879, test_f1: 0.5305
 epoch: 81, train_loss: 0.8408, test_loss: 0.9815, test_f1: 0.5432
 epoch: 82, train_loss: 0.8294, test_loss: 0.9913, test_f1: 0.5158
 epoch: 83, train_loss: 0.8260, test_loss: 0.9856, test_f1: 0.5327
 epoch: 84, train_loss: 0.8343, test_loss: 0.9681, test_f1: 0.5437
 epoch: 85, train_loss: 0.8333, test_loss: 0.9946, test_f1: 0.5144
 epoch: 86, train_loss: 0.8238, test_loss: 0.9692, test_f1: 0.5265
 epoch: 87, train_loss: 0.8150, test_loss: 0.9822, test_f1: 0.5172
 epoch: 88, train_loss: 0.8317, test_loss: 0.9876, test_f1: 0.5185
 epoch: 89, train_loss: 0.8298, test_loss: 0.9979, test_f1: 0.5317
 epoch: 90, train_loss: 0.8164, test_loss: 0.9902, test_f1: 0.5279
 epoch: 91, train_loss: 0.8191, test_loss: 0.9910, test_f1: 0.5171
 epoch: 92, train_loss: 0.8231, test_loss: 0.9893, test_f1: 0.5339
 epoch: 93, train_loss: 0.8245, test_loss: 0.9717, test_f1: 0.5553
 epoch: 94, train_loss: 0.8143, test_loss: 0.9794, test_f1: 0.5402
 epoch: 95, train_loss: 0.8236, test_loss: 0.9662, test_f1: 0.5415
 epoch: 96, train_loss: 0.8165, test_loss: 0.9599, test_f1: 0.5496
 epoch: 97, train_loss: 0.8118, test_loss: 0.9728, test_f1: 0.5439
 epoch: 98, train_loss: 0.8227, test_loss: 0.9683, test_f1: 0.5339
 epoch: 99, train_loss: 0.8105, test_loss: 1.0083, test_f1: 0.5340
##################ITERATION #4 ****************************************
 epoch: 0, train_loss: 1.3322, test_loss: 1.3417, test_f1: 0.2248
 epoch: 1, train_loss: 1.2723, test_loss: 1.3715, test_f1: 0.2643
 epoch: 2, train_loss: 1.2480, test_loss: 1.3352, test_f1: 0.2422
 epoch: 3, train_loss: 1.2291, test_loss: 1.3123, test_f1: 0.2349
 epoch: 4, train_loss: 1.2161, test_loss: 1.3164, test_f1: 0.2660
 epoch: 5, train_loss: 1.1923, test_loss: 1.3116, test_f1: 0.2650
 epoch: 6, train_loss: 1.1910, test_loss: 1.3122, test_f1: 0.2697
 epoch: 7, train_loss: 1.1884, test_loss: 1.2902, test_f1: 0.2710
 epoch: 8, train_loss: 1.1736, test_loss: 1.2743, test_f1: 0.2902
 epoch: 9, train_loss: 1.1613, test_loss: 1.2645, test_f1: 0.3415
 epoch: 10, train_loss: 1.1458, test_loss: 1.2445, test_f1: 0.3363
 epoch: 11, train_loss: 1.1473, test_loss: 1.2259, test_f1: 0.3696
 epoch: 12, train_loss: 1.1294, test_loss: 1.2094, test_f1: 0.3681
 epoch: 13, train_loss: 1.1167, test_loss: 1.2364, test_f1: 0.4059
 epoch: 14, train_loss: 1.1045, test_loss: 1.1906, test_f1: 0.4051
 epoch: 15, train_loss: 1.0997, test_loss: 1.1732, test_f1: 0.4023
 epoch: 16, train_loss: 1.0951, test_loss: 1.1631, test_f1: 0.4151
 epoch: 17, train_loss: 1.0858, test_loss: 1.1481, test_f1: 0.4235
 epoch: 18, train_loss: 1.0711, test_loss: 1.1489, test_f1: 0.4249
 epoch: 19, train_loss: 1.0634, test_loss: 1.1251, test_f1: 0.4432
 epoch: 20, train_loss: 1.0643, test_loss: 1.1358, test_f1: 0.4518
 epoch: 21, train_loss: 1.0575, test_loss: 1.1055, test_f1: 0.4577
 epoch: 22, train_loss: 1.0313, test_loss: 1.0935, test_f1: 0.4548
 epoch: 23, train_loss: 1.0261, test_loss: 1.0843, test_f1: 0.4457
 epoch: 24, train_loss: 1.0241, test_loss: 1.0787, test_f1: 0.4441
 epoch: 25, train_loss: 1.0091, test_loss: 1.0894, test_f1: 0.4719
 epoch: 26, train_loss: 1.0056, test_loss: 1.1103, test_f1: 0.4601
 epoch: 27, train_loss: 1.0007, test_loss: 1.0776, test_f1: 0.4762
 epoch: 28, train_loss: 0.9965, test_loss: 1.0588, test_f1: 0.4830
 epoch: 29, train_loss: 0.9762, test_loss: 1.0906, test_f1: 0.4635
 epoch: 30, train_loss: 0.9670, test_loss: 1.0500, test_f1: 0.4786
 epoch: 31, train_loss: 0.9716, test_loss: 1.0865, test_f1: 0.4808
 epoch: 32, train_loss: 0.9783, test_loss: 1.0392, test_f1: 0.4908
 epoch: 33, train_loss: 0.9544, test_loss: 1.0645, test_f1: 0.4698
 epoch: 34, train_loss: 0.9561, test_loss: 1.0677, test_f1: 0.4694
 epoch: 35, train_loss: 0.9552, test_loss: 1.0461, test_f1: 0.4962
 epoch: 36, train_loss: 0.9354, test_loss: 1.0507, test_f1: 0.5115
 epoch: 37, train_loss: 0.9379, test_loss: 1.0524, test_f1: 0.4943
 epoch: 38, train_loss: 0.9386, test_loss: 1.0545, test_f1: 0.4940
 epoch: 39, train_loss: 0.9392, test_loss: 1.0082, test_f1: 0.5099
 epoch: 40, train_loss: 0.9214, test_loss: 1.0433, test_f1: 0.5126
 epoch: 41, train_loss: 0.9181, test_loss: 1.0451, test_f1: 0.5328
 epoch: 42, train_loss: 0.9251, test_loss: 1.0472, test_f1: 0.5362
 epoch: 43, train_loss: 0.9150, test_loss: 1.0388, test_f1: 0.5048
 epoch: 44, train_loss: 0.9239, test_loss: 0.9864, test_f1: 0.5177
 epoch: 45, train_loss: 0.9164, test_loss: 1.0003, test_f1: 0.5459
 epoch: 46, train_loss: 0.9134, test_loss: 1.0108, test_f1: 0.5548
 epoch: 47, train_loss: 0.9057, test_loss: 0.9951, test_f1: 0.5587
 epoch: 48, train_loss: 0.8997, test_loss: 0.9907, test_f1: 0.5209
 epoch: 49, train_loss: 0.9041, test_loss: 0.9808, test_f1: 0.5552
 epoch: 50, train_loss: 0.9003, test_loss: 1.0397, test_f1: 0.5499
 epoch: 51, train_loss: 0.8920, test_loss: 0.9976, test_f1: 0.5357
 epoch: 52, train_loss: 0.8835, test_loss: 0.9911, test_f1: 0.5484
 epoch: 53, train_loss: 0.8753, test_loss: 0.9926, test_f1: 0.5339
 epoch: 54, train_loss: 0.8837, test_loss: 1.0056, test_f1: 0.5534
 epoch: 55, train_loss: 0.8915, test_loss: 0.9901, test_f1: 0.5567
 epoch: 56, train_loss: 0.8843, test_loss: 1.0004, test_f1: 0.5577
 epoch: 57, train_loss: 0.8831, test_loss: 1.0050, test_f1: 0.5507
 epoch: 58, train_loss: 0.8819, test_loss: 1.0059, test_f1: 0.5462
 epoch: 59, train_loss: 0.8768, test_loss: 0.9936, test_f1: 0.5421
 epoch: 60, train_loss: 0.8744, test_loss: 1.0017, test_f1: 0.5595
 epoch: 61, train_loss: 0.8855, test_loss: 1.0234, test_f1: 0.5595
 epoch: 62, train_loss: 0.8714, test_loss: 1.0307, test_f1: 0.5438
 epoch: 63, train_loss: 0.8791, test_loss: 0.9897, test_f1: 0.5412
 epoch: 64, train_loss: 0.8713, test_loss: 1.0057, test_f1: 0.5515
 epoch: 65, train_loss: 0.8630, test_loss: 1.0159, test_f1: 0.5491
 epoch: 66, train_loss: 0.8740, test_loss: 1.0263, test_f1: 0.5577
 epoch: 67, train_loss: 0.8748, test_loss: 1.0366, test_f1: 0.5517
 epoch: 68, train_loss: 0.8679, test_loss: 1.0150, test_f1: 0.5291
 epoch: 69, train_loss: 0.8570, test_loss: 1.0354, test_f1: 0.5634
 epoch: 70, train_loss: 0.8670, test_loss: 1.0298, test_f1: 0.5584
 epoch: 71, train_loss: 0.8585, test_loss: 1.0097, test_f1: 0.5413
 epoch: 72, train_loss: 0.8527, test_loss: 1.0266, test_f1: 0.5571
 epoch: 73, train_loss: 0.8455, test_loss: 1.0339, test_f1: 0.5582
 epoch: 74, train_loss: 0.8595, test_loss: 1.0234, test_f1: 0.5523
 epoch: 75, train_loss: 0.8533, test_loss: 1.0423, test_f1: 0.5652
 epoch: 76, train_loss: 0.8718, test_loss: 1.0210, test_f1: 0.5742
 epoch: 77, train_loss: 0.8581, test_loss: 1.0401, test_f1: 0.5582
 epoch: 78, train_loss: 0.8554, test_loss: 1.0318, test_f1: 0.5796
 epoch: 79, train_loss: 0.8512, test_loss: 1.0373, test_f1: 0.5564
 epoch: 80, train_loss: 0.8410, test_loss: 1.0425, test_f1: 0.5695
 epoch: 81, train_loss: 0.8564, test_loss: 1.0489, test_f1: 0.5487
 epoch: 82, train_loss: 0.8583, test_loss: 1.0156, test_f1: 0.5641
 epoch: 83, train_loss: 0.8563, test_loss: 1.0266, test_f1: 0.5562
 epoch: 84, train_loss: 0.8421, test_loss: 1.0447, test_f1: 0.5535
 epoch: 85, train_loss: 0.8431, test_loss: 1.0157, test_f1: 0.5562
 epoch: 86, train_loss: 0.8644, test_loss: 1.0284, test_f1: 0.5514
 epoch: 87, train_loss: 0.8322, test_loss: 1.0093, test_f1: 0.5449
 epoch: 88, train_loss: 0.8226, test_loss: 1.0188, test_f1: 0.5601
 epoch: 89, train_loss: 0.8474, test_loss: 1.0500, test_f1: 0.5578
 epoch: 90, train_loss: 0.8255, test_loss: 1.0453, test_f1: 0.5331
 epoch: 91, train_loss: 0.8366, test_loss: 1.0449, test_f1: 0.5333
 epoch: 92, train_loss: 0.8268, test_loss: 1.0588, test_f1: 0.5453
 epoch: 93, train_loss: 0.8416, test_loss: 1.0379, test_f1: 0.5320
 epoch: 94, train_loss: 0.8309, test_loss: 1.0413, test_f1: 0.5605
 epoch: 95, train_loss: 0.8266, test_loss: 1.0662, test_f1: 0.5539
 epoch: 96, train_loss: 0.8334, test_loss: 1.0589, test_f1: 0.5434
 epoch: 97, train_loss: 0.8200, test_loss: 1.0537, test_f1: 0.5446
 epoch: 98, train_loss: 0.8270, test_loss: 1.0514, test_f1: 0.5476
 epoch: 99, train_loss: 0.8223, test_loss: 1.0392, test_f1: 0.5318
##################ITERATION #5 ****************************************
 epoch: 0, train_loss: 1.3109, test_loss: 1.3366, test_f1: 0.2828
 epoch: 1, train_loss: 1.2692, test_loss: 1.3333, test_f1: 0.2692
 epoch: 2, train_loss: 1.2538, test_loss: 1.3090, test_f1: 0.2642
 epoch: 3, train_loss: 1.2378, test_loss: 1.2906, test_f1: 0.2608
 epoch: 4, train_loss: 1.2186, test_loss: 1.2881, test_f1: 0.2604
 epoch: 5, train_loss: 1.2023, test_loss: 1.2885, test_f1: 0.2621
 epoch: 6, train_loss: 1.1885, test_loss: 1.2542, test_f1: 0.2834
 epoch: 7, train_loss: 1.1793, test_loss: 1.2622, test_f1: 0.3172
 epoch: 8, train_loss: 1.1646, test_loss: 1.2311, test_f1: 0.3148
 epoch: 9, train_loss: 1.1576, test_loss: 1.2227, test_f1: 0.3589
 epoch: 10, train_loss: 1.1429, test_loss: 1.2176, test_f1: 0.3737
 epoch: 11, train_loss: 1.1307, test_loss: 1.2198, test_f1: 0.3759
 epoch: 12, train_loss: 1.1312, test_loss: 1.2098, test_f1: 0.4094
 epoch: 13, train_loss: 1.1088, test_loss: 1.1890, test_f1: 0.4100
 epoch: 14, train_loss: 1.1046, test_loss: 1.1611, test_f1: 0.4232
 epoch: 15, train_loss: 1.0966, test_loss: 1.1471, test_f1: 0.4553
 epoch: 16, train_loss: 1.0793, test_loss: 1.1533, test_f1: 0.4647
 epoch: 17, train_loss: 1.0729, test_loss: 1.1702, test_f1: 0.4464
 epoch: 18, train_loss: 1.0552, test_loss: 1.1526, test_f1: 0.4634
 epoch: 19, train_loss: 1.0462, test_loss: 1.1218, test_f1: 0.4772
 epoch: 20, train_loss: 1.0429, test_loss: 1.1119, test_f1: 0.4847
 epoch: 21, train_loss: 1.0206, test_loss: 1.1116, test_f1: 0.4966
 epoch: 22, train_loss: 1.0181, test_loss: 1.1054, test_f1: 0.4913
 epoch: 23, train_loss: 1.0146, test_loss: 1.1032, test_f1: 0.4866
 epoch: 24, train_loss: 0.9847, test_loss: 1.1101, test_f1: 0.4862
 epoch: 25, train_loss: 0.9974, test_loss: 1.1029, test_f1: 0.4928
 epoch: 26, train_loss: 0.9976, test_loss: 1.0970, test_f1: 0.5083
 epoch: 27, train_loss: 0.9749, test_loss: 1.0962, test_f1: 0.5020
 epoch: 28, train_loss: 0.9727, test_loss: 1.0738, test_f1: 0.4957
 epoch: 29, train_loss: 0.9843, test_loss: 1.0627, test_f1: 0.5172
 epoch: 30, train_loss: 0.9549, test_loss: 1.0748, test_f1: 0.5344
 epoch: 31, train_loss: 0.9565, test_loss: 1.0986, test_f1: 0.5166
 epoch: 32, train_loss: 0.9570, test_loss: 1.0849, test_f1: 0.5237
 epoch: 33, train_loss: 0.9376, test_loss: 1.0940, test_f1: 0.5113
 epoch: 34, train_loss: 0.9493, test_loss: 1.0633, test_f1: 0.5234
 epoch: 35, train_loss: 0.9432, test_loss: 1.0669, test_f1: 0.5142
 epoch: 36, train_loss: 0.9428, test_loss: 1.0687, test_f1: 0.5065
 epoch: 37, train_loss: 0.9275, test_loss: 1.0818, test_f1: 0.5065
 epoch: 38, train_loss: 0.9272, test_loss: 1.0629, test_f1: 0.5195
 epoch: 39, train_loss: 0.9219, test_loss: 1.0494, test_f1: 0.5205
 epoch: 40, train_loss: 0.9152, test_loss: 1.0429, test_f1: 0.5124
 epoch: 41, train_loss: 0.9178, test_loss: 1.0464, test_f1: 0.5311
 epoch: 42, train_loss: 0.8960, test_loss: 1.0220, test_f1: 0.5377
 epoch: 43, train_loss: 0.9049, test_loss: 1.0181, test_f1: 0.5362
 epoch: 44, train_loss: 0.9108, test_loss: 1.0204, test_f1: 0.5442
 epoch: 45, train_loss: 0.9068, test_loss: 1.0153, test_f1: 0.5548
 epoch: 46, train_loss: 0.8976, test_loss: 1.0237, test_f1: 0.5489
 epoch: 47, train_loss: 0.9037, test_loss: 1.0438, test_f1: 0.5499
 epoch: 48, train_loss: 0.8963, test_loss: 1.0333, test_f1: 0.5428
 epoch: 49, train_loss: 0.8903, test_loss: 1.0108, test_f1: 0.5508
 epoch: 50, train_loss: 0.8848, test_loss: 1.0517, test_f1: 0.5459
 epoch: 51, train_loss: 0.8785, test_loss: 1.0636, test_f1: 0.5273
 epoch: 52, train_loss: 0.8815, test_loss: 1.0869, test_f1: 0.5459
 epoch: 53, train_loss: 0.8795, test_loss: 1.0615, test_f1: 0.5343
 epoch: 54, train_loss: 0.8773, test_loss: 1.0777, test_f1: 0.5185
 epoch: 55, train_loss: 0.8709, test_loss: 1.0503, test_f1: 0.5321
 epoch: 56, train_loss: 0.8776, test_loss: 1.0783, test_f1: 0.5385
 epoch: 57, train_loss: 0.8717, test_loss: 1.0228, test_f1: 0.5588
 epoch: 58, train_loss: 0.8611, test_loss: 1.0236, test_f1: 0.5595
 epoch: 59, train_loss: 0.8643, test_loss: 1.0554, test_f1: 0.5552
 epoch: 60, train_loss: 0.8701, test_loss: 1.0683, test_f1: 0.5542
 epoch: 61, train_loss: 0.8572, test_loss: 1.0083, test_f1: 0.5576
 epoch: 62, train_loss: 0.8595, test_loss: 1.0147, test_f1: 0.5622
 epoch: 63, train_loss: 0.8724, test_loss: 1.0142, test_f1: 0.5654
 epoch: 64, train_loss: 0.8560, test_loss: 1.0350, test_f1: 0.5718
 epoch: 65, train_loss: 0.8514, test_loss: 1.0128, test_f1: 0.5698
 epoch: 66, train_loss: 0.8469, test_loss: 1.0133, test_f1: 0.5716
 epoch: 67, train_loss: 0.8626, test_loss: 1.0200, test_f1: 0.5443
 epoch: 68, train_loss: 0.8540, test_loss: 1.0155, test_f1: 0.5620
 epoch: 69, train_loss: 0.8508, test_loss: 1.0417, test_f1: 0.5507
 epoch: 70, train_loss: 0.8553, test_loss: 1.0203, test_f1: 0.5517
 epoch: 71, train_loss: 0.8511, test_loss: 1.0075, test_f1: 0.5715
 epoch: 72, train_loss: 0.8485, test_loss: 0.9997, test_f1: 0.5762
 epoch: 73, train_loss: 0.8356, test_loss: 1.0677, test_f1: 0.5378
 epoch: 74, train_loss: 0.8496, test_loss: 1.0328, test_f1: 0.5557
 epoch: 75, train_loss: 0.8591, test_loss: 0.9917, test_f1: 0.5698
 epoch: 76, train_loss: 0.8504, test_loss: 1.0067, test_f1: 0.5696
 epoch: 77, train_loss: 0.8437, test_loss: 1.0052, test_f1: 0.5648
 epoch: 78, train_loss: 0.8380, test_loss: 0.9832, test_f1: 0.5828
 epoch: 79, train_loss: 0.8253, test_loss: 1.0355, test_f1: 0.5645
 epoch: 80, train_loss: 0.8421, test_loss: 1.0457, test_f1: 0.5675
 epoch: 81, train_loss: 0.8322, test_loss: 1.0622, test_f1: 0.5602
 epoch: 82, train_loss: 0.8505, test_loss: 1.0415, test_f1: 0.5523
 epoch: 83, train_loss: 0.8384, test_loss: 1.1170, test_f1: 0.5454
 epoch: 84, train_loss: 0.8237, test_loss: 0.9975, test_f1: 0.5758
 epoch: 85, train_loss: 0.8325, test_loss: 0.9913, test_f1: 0.5753
 epoch: 86, train_loss: 0.8343, test_loss: 1.0179, test_f1: 0.5679
 epoch: 87, train_loss: 0.8323, test_loss: 1.0059, test_f1: 0.5804
 epoch: 88, train_loss: 0.8253, test_loss: 0.9871, test_f1: 0.5761
 epoch: 89, train_loss: 0.8215, test_loss: 0.9908, test_f1: 0.5797
 epoch: 90, train_loss: 0.8373, test_loss: 1.0637, test_f1: 0.5370
 epoch: 91, train_loss: 0.8331, test_loss: 1.0527, test_f1: 0.5261
 epoch: 92, train_loss: 0.8110, test_loss: 1.0428, test_f1: 0.5421
 epoch: 93, train_loss: 0.8164, test_loss: 1.0676, test_f1: 0.5350
 epoch: 94, train_loss: 0.8163, test_loss: 1.0693, test_f1: 0.5338
 epoch: 95, train_loss: 0.8346, test_loss: 1.0484, test_f1: 0.5520
 epoch: 96, train_loss: 0.8108, test_loss: 1.0546, test_f1: 0.5463
 epoch: 97, train_loss: 0.8191, test_loss: 1.0737, test_f1: 0.5400
 epoch: 98, train_loss: 0.8034, test_loss: 1.0570, test_f1: 0.5466
 epoch: 99, train_loss: 0.8318, test_loss: 1.0170, test_f1: 0.5748
##################ITERATION #6 ****************************************
 epoch: 0, train_loss: 1.3064, test_loss: 1.3135, test_f1: 0.2378
 epoch: 1, train_loss: 1.2223, test_loss: 1.2603, test_f1: 0.2759
 epoch: 2, train_loss: 1.1977, test_loss: 1.2548, test_f1: 0.3406
 epoch: 3, train_loss: 1.1796, test_loss: 1.2201, test_f1: 0.3599
 epoch: 4, train_loss: 1.1569, test_loss: 1.1961, test_f1: 0.3629
 epoch: 5, train_loss: 1.1254, test_loss: 1.1824, test_f1: 0.3807
 epoch: 6, train_loss: 1.1280, test_loss: 1.1609, test_f1: 0.3799
 epoch: 7, train_loss: 1.1117, test_loss: 1.1486, test_f1: 0.4190
 epoch: 8, train_loss: 1.0855, test_loss: 1.1340, test_f1: 0.4327
 epoch: 9, train_loss: 1.0795, test_loss: 1.1279, test_f1: 0.4476
 epoch: 10, train_loss: 1.0778, test_loss: 1.1186, test_f1: 0.4404
 epoch: 11, train_loss: 1.0621, test_loss: 1.1055, test_f1: 0.4271
 epoch: 12, train_loss: 1.0582, test_loss: 1.1019, test_f1: 0.4406
 epoch: 13, train_loss: 1.0427, test_loss: 1.0943, test_f1: 0.4397
 epoch: 14, train_loss: 1.0325, test_loss: 1.1033, test_f1: 0.4388
 epoch: 15, train_loss: 1.0346, test_loss: 1.0931, test_f1: 0.4269
 epoch: 16, train_loss: 1.0222, test_loss: 1.0944, test_f1: 0.4294
 epoch: 17, train_loss: 1.0180, test_loss: 1.0972, test_f1: 0.4442
 epoch: 18, train_loss: 1.0157, test_loss: 1.0867, test_f1: 0.4347
 epoch: 19, train_loss: 1.0002, test_loss: 1.0860, test_f1: 0.4402
 epoch: 20, train_loss: 0.9926, test_loss: 1.0691, test_f1: 0.4731
 epoch: 21, train_loss: 0.9807, test_loss: 1.0768, test_f1: 0.4549
 epoch: 22, train_loss: 0.9965, test_loss: 1.0717, test_f1: 0.4445
 epoch: 23, train_loss: 0.9848, test_loss: 1.0724, test_f1: 0.4446
 epoch: 24, train_loss: 0.9734, test_loss: 1.0546, test_f1: 0.4490
 epoch: 25, train_loss: 0.9703, test_loss: 1.0609, test_f1: 0.4535
 epoch: 26, train_loss: 0.9683, test_loss: 1.0622, test_f1: 0.4545
 epoch: 27, train_loss: 0.9618, test_loss: 1.0529, test_f1: 0.4722
 epoch: 28, train_loss: 0.9573, test_loss: 1.0594, test_f1: 0.4761
 epoch: 29, train_loss: 0.9557, test_loss: 1.0691, test_f1: 0.4806
 epoch: 30, train_loss: 0.9456, test_loss: 1.0605, test_f1: 0.4786
 epoch: 31, train_loss: 0.9534, test_loss: 1.0532, test_f1: 0.4834
 epoch: 32, train_loss: 0.9456, test_loss: 1.0213, test_f1: 0.4990
 epoch: 33, train_loss: 0.9361, test_loss: 1.0619, test_f1: 0.4900
 epoch: 34, train_loss: 0.9339, test_loss: 1.0601, test_f1: 0.4899
 epoch: 35, train_loss: 0.9228, test_loss: 1.0621, test_f1: 0.4942
 epoch: 36, train_loss: 0.9169, test_loss: 1.0634, test_f1: 0.5056
 epoch: 37, train_loss: 0.9217, test_loss: 1.0247, test_f1: 0.4978
 epoch: 38, train_loss: 0.9297, test_loss: 1.0671, test_f1: 0.4991
 epoch: 39, train_loss: 0.9211, test_loss: 1.0279, test_f1: 0.5153
 epoch: 40, train_loss: 0.9285, test_loss: 1.0890, test_f1: 0.5074
 epoch: 41, train_loss: 0.9219, test_loss: 1.0290, test_f1: 0.5220
 epoch: 42, train_loss: 0.9150, test_loss: 1.0717, test_f1: 0.5138
 epoch: 43, train_loss: 0.9218, test_loss: 1.0355, test_f1: 0.5112
 epoch: 44, train_loss: 0.9057, test_loss: 1.0040, test_f1: 0.5329
 epoch: 45, train_loss: 0.8992, test_loss: 1.0734, test_f1: 0.5185
 epoch: 46, train_loss: 0.9000, test_loss: 1.0510, test_f1: 0.5271
 epoch: 47, train_loss: 0.8969, test_loss: 1.0008, test_f1: 0.5348
 epoch: 48, train_loss: 0.8830, test_loss: 1.0507, test_f1: 0.5188
 epoch: 49, train_loss: 0.8824, test_loss: 1.0829, test_f1: 0.5283
 epoch: 50, train_loss: 0.8917, test_loss: 1.0926, test_f1: 0.5179
 epoch: 51, train_loss: 0.8922, test_loss: 1.0223, test_f1: 0.5269
 epoch: 52, train_loss: 0.8891, test_loss: 1.0368, test_f1: 0.5401
 epoch: 53, train_loss: 0.8852, test_loss: 1.0413, test_f1: 0.5390
 epoch: 54, train_loss: 0.8854, test_loss: 1.0458, test_f1: 0.5353
 epoch: 55, train_loss: 0.8680, test_loss: 1.1042, test_f1: 0.5198
 epoch: 56, train_loss: 0.8799, test_loss: 1.0854, test_f1: 0.5240
 epoch: 57, train_loss: 0.8745, test_loss: 1.0827, test_f1: 0.5281
 epoch: 58, train_loss: 0.8736, test_loss: 1.1326, test_f1: 0.5280
 epoch: 59, train_loss: 0.8809, test_loss: 1.0837, test_f1: 0.5197
 epoch: 60, train_loss: 0.8697, test_loss: 1.1068, test_f1: 0.5468
 epoch: 61, train_loss: 0.8586, test_loss: 1.0432, test_f1: 0.5345
 epoch: 62, train_loss: 0.8729, test_loss: 1.0661, test_f1: 0.5113
 epoch: 63, train_loss: 0.8621, test_loss: 1.0597, test_f1: 0.5375
 epoch: 64, train_loss: 0.8637, test_loss: 1.0736, test_f1: 0.5376
 epoch: 65, train_loss: 0.8666, test_loss: 1.0425, test_f1: 0.5246
 epoch: 66, train_loss: 0.8666, test_loss: 1.0628, test_f1: 0.5319
 epoch: 67, train_loss: 0.8675, test_loss: 1.1516, test_f1: 0.5430
 epoch: 68, train_loss: 0.8580, test_loss: 1.0943, test_f1: 0.5353
 epoch: 69, train_loss: 0.8609, test_loss: 1.0292, test_f1: 0.5100
 epoch: 70, train_loss: 0.8525, test_loss: 1.1187, test_f1: 0.5090
 epoch: 71, train_loss: 0.8529, test_loss: 1.1014, test_f1: 0.5364
 epoch: 72, train_loss: 0.8550, test_loss: 1.0781, test_f1: 0.5341
 epoch: 73, train_loss: 0.8559, test_loss: 1.0826, test_f1: 0.5341
 epoch: 74, train_loss: 0.8462, test_loss: 1.0646, test_f1: 0.5365
 epoch: 75, train_loss: 0.8522, test_loss: 1.1052, test_f1: 0.5368
 epoch: 76, train_loss: 0.8433, test_loss: 0.9954, test_f1: 0.5367
 epoch: 77, train_loss: 0.8337, test_loss: 1.0639, test_f1: 0.5350
 epoch: 78, train_loss: 0.8436, test_loss: 1.0253, test_f1: 0.5295
 epoch: 79, train_loss: 0.8529, test_loss: 1.0833, test_f1: 0.5246
 epoch: 80, train_loss: 0.8387, test_loss: 1.1506, test_f1: 0.5456
 epoch: 81, train_loss: 0.8350, test_loss: 1.1212, test_f1: 0.5206
 epoch: 82, train_loss: 0.8529, test_loss: 1.1283, test_f1: 0.5208
 epoch: 83, train_loss: 0.8356, test_loss: 1.1196, test_f1: 0.5217
 epoch: 84, train_loss: 0.8201, test_loss: 1.0731, test_f1: 0.5184
 epoch: 85, train_loss: 0.8428, test_loss: 1.1307, test_f1: 0.5412
 epoch: 86, train_loss: 0.8380, test_loss: 1.1878, test_f1: 0.5348
 epoch: 87, train_loss: 0.8337, test_loss: 1.1928, test_f1: 0.5056
 epoch: 88, train_loss: 0.8301, test_loss: 1.0032, test_f1: 0.5156
 epoch: 89, train_loss: 0.8139, test_loss: 1.1467, test_f1: 0.5049
 epoch: 90, train_loss: 0.8380, test_loss: 1.0543, test_f1: 0.5146
 epoch: 91, train_loss: 0.8180, test_loss: 1.1374, test_f1: 0.5210
 epoch: 92, train_loss: 0.8328, test_loss: 1.1013, test_f1: 0.5112
 epoch: 93, train_loss: 0.8211, test_loss: 1.0849, test_f1: 0.5142
 epoch: 94, train_loss: 0.8192, test_loss: 1.0852, test_f1: 0.5306
 epoch: 95, train_loss: 0.8261, test_loss: 1.0328, test_f1: 0.5079
 epoch: 96, train_loss: 0.8169, test_loss: 1.1516, test_f1: 0.5385
 epoch: 97, train_loss: 0.8131, test_loss: 1.1649, test_f1: 0.5442
 epoch: 98, train_loss: 0.8274, test_loss: 1.0318, test_f1: 0.5397
 epoch: 99, train_loss: 0.8068, test_loss: 1.1581, test_f1: 0.5216
##################ITERATION #7 ****************************************
 epoch: 0, train_loss: 1.3169, test_loss: 1.3630, test_f1: 0.2366
 epoch: 1, train_loss: 1.2441, test_loss: 1.3003, test_f1: 0.2670
 epoch: 2, train_loss: 1.2121, test_loss: 1.2715, test_f1: 0.2923
 epoch: 3, train_loss: 1.1763, test_loss: 1.2434, test_f1: 0.3445
 epoch: 4, train_loss: 1.1751, test_loss: 1.2339, test_f1: 0.3463
 epoch: 5, train_loss: 1.1602, test_loss: 1.2172, test_f1: 0.3353
 epoch: 6, train_loss: 1.1300, test_loss: 1.2007, test_f1: 0.3141
 epoch: 7, train_loss: 1.1197, test_loss: 1.1853, test_f1: 0.3434
 epoch: 8, train_loss: 1.1177, test_loss: 1.1719, test_f1: 0.3178
 epoch: 9, train_loss: 1.1028, test_loss: 1.1731, test_f1: 0.3671
 epoch: 10, train_loss: 1.0889, test_loss: 1.1612, test_f1: 0.3732
 epoch: 11, train_loss: 1.0719, test_loss: 1.1419, test_f1: 0.3605
 epoch: 12, train_loss: 1.0681, test_loss: 1.1374, test_f1: 0.3610
 epoch: 13, train_loss: 1.0516, test_loss: 1.1270, test_f1: 0.3933
 epoch: 14, train_loss: 1.0532, test_loss: 1.1109, test_f1: 0.3756
 epoch: 15, train_loss: 1.0337, test_loss: 1.1106, test_f1: 0.4035
 epoch: 16, train_loss: 1.0371, test_loss: 1.1083, test_f1: 0.4039
 epoch: 17, train_loss: 1.0149, test_loss: 1.1062, test_f1: 0.4136
 epoch: 18, train_loss: 1.0247, test_loss: 1.0998, test_f1: 0.4332
 epoch: 19, train_loss: 1.0086, test_loss: 1.0873, test_f1: 0.4254
 epoch: 20, train_loss: 0.9981, test_loss: 1.0846, test_f1: 0.4307
 epoch: 21, train_loss: 0.9915, test_loss: 1.0833, test_f1: 0.4653
 epoch: 22, train_loss: 0.9959, test_loss: 1.0711, test_f1: 0.4730
 epoch: 23, train_loss: 0.9878, test_loss: 1.0679, test_f1: 0.4529
 epoch: 24, train_loss: 0.9856, test_loss: 1.0650, test_f1: 0.4486
 epoch: 25, train_loss: 0.9756, test_loss: 1.0591, test_f1: 0.4548
 epoch: 26, train_loss: 0.9685, test_loss: 1.0646, test_f1: 0.4668
 epoch: 27, train_loss: 0.9650, test_loss: 1.0537, test_f1: 0.4815
 epoch: 28, train_loss: 0.9555, test_loss: 1.0487, test_f1: 0.4824
 epoch: 29, train_loss: 0.9548, test_loss: 1.0457, test_f1: 0.4895
 epoch: 30, train_loss: 0.9493, test_loss: 1.0370, test_f1: 0.4976
 epoch: 31, train_loss: 0.9344, test_loss: 1.0309, test_f1: 0.4889
 epoch: 32, train_loss: 0.9432, test_loss: 1.0377, test_f1: 0.4976
 epoch: 33, train_loss: 0.9332, test_loss: 1.0376, test_f1: 0.5336
 epoch: 34, train_loss: 0.9393, test_loss: 1.0297, test_f1: 0.4929
 epoch: 35, train_loss: 0.9243, test_loss: 1.0289, test_f1: 0.5022
 epoch: 36, train_loss: 0.9195, test_loss: 1.0358, test_f1: 0.5340
 epoch: 37, train_loss: 0.9162, test_loss: 1.0335, test_f1: 0.5054
 epoch: 38, train_loss: 0.9126, test_loss: 1.0229, test_f1: 0.4971
 epoch: 39, train_loss: 0.9093, test_loss: 1.0319, test_f1: 0.5106
 epoch: 40, train_loss: 0.9005, test_loss: 1.0293, test_f1: 0.5111
 epoch: 41, train_loss: 0.9105, test_loss: 1.0281, test_f1: 0.5247
 epoch: 42, train_loss: 0.8982, test_loss: 1.0226, test_f1: 0.5160
 epoch: 43, train_loss: 0.8935, test_loss: 1.0138, test_f1: 0.5142
 epoch: 44, train_loss: 0.9042, test_loss: 1.0203, test_f1: 0.5197
 epoch: 45, train_loss: 0.8966, test_loss: 1.0202, test_f1: 0.5111
 epoch: 46, train_loss: 0.8883, test_loss: 1.0077, test_f1: 0.5327
 epoch: 47, train_loss: 0.8851, test_loss: 1.0116, test_f1: 0.5384
 epoch: 48, train_loss: 0.8661, test_loss: 1.0227, test_f1: 0.5272
 epoch: 49, train_loss: 0.8572, test_loss: 1.0166, test_f1: 0.5147
 epoch: 50, train_loss: 0.8687, test_loss: 1.0045, test_f1: 0.5317
 epoch: 51, train_loss: 0.8631, test_loss: 0.9999, test_f1: 0.5258
 epoch: 52, train_loss: 0.8690, test_loss: 0.9952, test_f1: 0.5422
 epoch: 53, train_loss: 0.8745, test_loss: 1.0031, test_f1: 0.5608
 epoch: 54, train_loss: 0.8590, test_loss: 0.9895, test_f1: 0.5373
 epoch: 55, train_loss: 0.8576, test_loss: 0.9959, test_f1: 0.5378
 epoch: 56, train_loss: 0.8476, test_loss: 0.9971, test_f1: 0.5294
 epoch: 57, train_loss: 0.8505, test_loss: 1.0015, test_f1: 0.5292
 epoch: 58, train_loss: 0.8635, test_loss: 1.0019, test_f1: 0.5316
 epoch: 59, train_loss: 0.8424, test_loss: 1.0019, test_f1: 0.5346
 epoch: 60, train_loss: 0.8438, test_loss: 1.0054, test_f1: 0.5277
 epoch: 61, train_loss: 0.8536, test_loss: 1.0011, test_f1: 0.5166
 epoch: 62, train_loss: 0.8483, test_loss: 0.9852, test_f1: 0.5317
 epoch: 63, train_loss: 0.8412, test_loss: 0.9867, test_f1: 0.5321
 epoch: 64, train_loss: 0.8455, test_loss: 0.9907, test_f1: 0.5157
 epoch: 65, train_loss: 0.8449, test_loss: 0.9890, test_f1: 0.5401
 epoch: 66, train_loss: 0.8484, test_loss: 0.9763, test_f1: 0.5274
 epoch: 67, train_loss: 0.8402, test_loss: 0.9922, test_f1: 0.5352
 epoch: 68, train_loss: 0.8355, test_loss: 0.9986, test_f1: 0.5412
 epoch: 69, train_loss: 0.8424, test_loss: 0.9866, test_f1: 0.5524
 epoch: 70, train_loss: 0.8327, test_loss: 0.9874, test_f1: 0.5450
 epoch: 71, train_loss: 0.8198, test_loss: 0.9894, test_f1: 0.5345
 epoch: 72, train_loss: 0.8203, test_loss: 1.0178, test_f1: 0.5184
 epoch: 73, train_loss: 0.8186, test_loss: 0.9892, test_f1: 0.5364
 epoch: 74, train_loss: 0.8194, test_loss: 0.9777, test_f1: 0.5476
 epoch: 75, train_loss: 0.8215, test_loss: 0.9876, test_f1: 0.5334
 epoch: 76, train_loss: 0.8277, test_loss: 0.9802, test_f1: 0.5650
 epoch: 77, train_loss: 0.8206, test_loss: 0.9766, test_f1: 0.5776
 epoch: 78, train_loss: 0.8249, test_loss: 0.9804, test_f1: 0.5656
 epoch: 79, train_loss: 0.8097, test_loss: 1.0072, test_f1: 0.5291
 epoch: 80, train_loss: 0.8115, test_loss: 0.9742, test_f1: 0.5699
 epoch: 81, train_loss: 0.8119, test_loss: 0.9739, test_f1: 0.5774
 epoch: 82, train_loss: 0.8125, test_loss: 0.9784, test_f1: 0.5807
 epoch: 83, train_loss: 0.8052, test_loss: 1.0116, test_f1: 0.5492
 epoch: 84, train_loss: 0.8272, test_loss: 0.9850, test_f1: 0.5755
 epoch: 85, train_loss: 0.8026, test_loss: 0.9953, test_f1: 0.5702
 epoch: 86, train_loss: 0.8079, test_loss: 0.9836, test_f1: 0.5735
 epoch: 87, train_loss: 0.8187, test_loss: 0.9727, test_f1: 0.5756
 epoch: 88, train_loss: 0.8056, test_loss: 0.9874, test_f1: 0.5673
 epoch: 89, train_loss: 0.8018, test_loss: 0.9919, test_f1: 0.5739
 epoch: 90, train_loss: 0.7914, test_loss: 0.9798, test_f1: 0.5794
 epoch: 91, train_loss: 0.7925, test_loss: 0.9951, test_f1: 0.5653
 epoch: 92, train_loss: 0.8027, test_loss: 0.9899, test_f1: 0.5625
 epoch: 93, train_loss: 0.7896, test_loss: 1.0000, test_f1: 0.5746
 epoch: 94, train_loss: 0.8080, test_loss: 1.0034, test_f1: 0.5560
 epoch: 95, train_loss: 0.8066, test_loss: 1.0131, test_f1: 0.5547
 epoch: 96, train_loss: 0.7859, test_loss: 0.9887, test_f1: 0.5644
 epoch: 97, train_loss: 0.7840, test_loss: 0.9787, test_f1: 0.5791
 epoch: 98, train_loss: 0.7946, test_loss: 1.0057, test_f1: 0.5646
 epoch: 99, train_loss: 0.7814, test_loss: 0.9788, test_f1: 0.5717
##################ITERATION #8 ****************************************
 epoch: 0, train_loss: 1.3402, test_loss: 1.3768, test_f1: 0.2574
 epoch: 1, train_loss: 1.2402, test_loss: 1.2936, test_f1: 0.2404
 epoch: 2, train_loss: 1.2168, test_loss: 1.2599, test_f1: 0.2642
 epoch: 3, train_loss: 1.1900, test_loss: 1.2483, test_f1: 0.2801
 epoch: 4, train_loss: 1.1828, test_loss: 1.2127, test_f1: 0.3253
 epoch: 5, train_loss: 1.1614, test_loss: 1.2155, test_f1: 0.3777
 epoch: 6, train_loss: 1.1486, test_loss: 1.1976, test_f1: 0.3709
 epoch: 7, train_loss: 1.1338, test_loss: 1.1801, test_f1: 0.3927
 epoch: 8, train_loss: 1.1083, test_loss: 1.1672, test_f1: 0.3927
 epoch: 9, train_loss: 1.1031, test_loss: 1.1642, test_f1: 0.4142
 epoch: 10, train_loss: 1.0862, test_loss: 1.1621, test_f1: 0.4228
 epoch: 11, train_loss: 1.0879, test_loss: 1.1475, test_f1: 0.4190
 epoch: 12, train_loss: 1.0853, test_loss: 1.1368, test_f1: 0.4305
 epoch: 13, train_loss: 1.0623, test_loss: 1.1202, test_f1: 0.4184
 epoch: 14, train_loss: 1.0381, test_loss: 1.1120, test_f1: 0.4587
 epoch: 15, train_loss: 1.0472, test_loss: 1.0958, test_f1: 0.4530
 epoch: 16, train_loss: 1.0412, test_loss: 1.0929, test_f1: 0.4642
 epoch: 17, train_loss: 1.0179, test_loss: 1.0839, test_f1: 0.4728
 epoch: 18, train_loss: 1.0091, test_loss: 1.0695, test_f1: 0.4670
 epoch: 19, train_loss: 1.0219, test_loss: 1.0810, test_f1: 0.4581
 epoch: 20, train_loss: 1.0052, test_loss: 1.0704, test_f1: 0.4938
 epoch: 21, train_loss: 0.9940, test_loss: 1.0573, test_f1: 0.4857
 epoch: 22, train_loss: 0.9993, test_loss: 1.0629, test_f1: 0.4759
 epoch: 23, train_loss: 0.9985, test_loss: 1.0484, test_f1: 0.5112
 epoch: 24, train_loss: 0.9796, test_loss: 1.0602, test_f1: 0.4863
 epoch: 25, train_loss: 0.9717, test_loss: 1.0504, test_f1: 0.5027
 epoch: 26, train_loss: 0.9820, test_loss: 1.0430, test_f1: 0.5382
 epoch: 27, train_loss: 0.9627, test_loss: 1.0292, test_f1: 0.5545
 epoch: 28, train_loss: 0.9556, test_loss: 1.0402, test_f1: 0.5299
 epoch: 29, train_loss: 0.9444, test_loss: 1.0252, test_f1: 0.5539
 epoch: 30, train_loss: 0.9505, test_loss: 1.0255, test_f1: 0.5359
 epoch: 31, train_loss: 0.9439, test_loss: 1.0121, test_f1: 0.5585
 epoch: 32, train_loss: 0.9397, test_loss: 1.0093, test_f1: 0.5611
 epoch: 33, train_loss: 0.9328, test_loss: 1.0081, test_f1: 0.5564
 epoch: 34, train_loss: 0.9244, test_loss: 0.9957, test_f1: 0.5682
 epoch: 35, train_loss: 0.9106, test_loss: 1.0060, test_f1: 0.5503
 epoch: 36, train_loss: 0.9284, test_loss: 0.9957, test_f1: 0.5683
 epoch: 37, train_loss: 0.9178, test_loss: 1.0052, test_f1: 0.5582
 epoch: 38, train_loss: 0.8994, test_loss: 0.9945, test_f1: 0.5740
 epoch: 39, train_loss: 0.9143, test_loss: 1.0017, test_f1: 0.5664
 epoch: 40, train_loss: 0.8951, test_loss: 0.9872, test_f1: 0.5665
 epoch: 41, train_loss: 0.8961, test_loss: 0.9893, test_f1: 0.5793
 epoch: 42, train_loss: 0.8912, test_loss: 0.9986, test_f1: 0.5677
 epoch: 43, train_loss: 0.8933, test_loss: 0.9939, test_f1: 0.5653
 epoch: 44, train_loss: 0.8819, test_loss: 1.0038, test_f1: 0.5650
 epoch: 45, train_loss: 0.8768, test_loss: 1.0000, test_f1: 0.5606
 epoch: 46, train_loss: 0.8753, test_loss: 0.9932, test_f1: 0.5713
 epoch: 47, train_loss: 0.8787, test_loss: 0.9859, test_f1: 0.5685
 epoch: 48, train_loss: 0.8748, test_loss: 0.9948, test_f1: 0.5652
 epoch: 49, train_loss: 0.8610, test_loss: 0.9891, test_f1: 0.5821
 epoch: 50, train_loss: 0.8578, test_loss: 0.9817, test_f1: 0.5737
 epoch: 51, train_loss: 0.8498, test_loss: 0.9858, test_f1: 0.5612
 epoch: 52, train_loss: 0.8553, test_loss: 0.9895, test_f1: 0.5589
 epoch: 53, train_loss: 0.8582, test_loss: 0.9788, test_f1: 0.5714
 epoch: 54, train_loss: 0.8452, test_loss: 0.9805, test_f1: 0.5758
 epoch: 55, train_loss: 0.8454, test_loss: 0.9904, test_f1: 0.5746
 epoch: 56, train_loss: 0.8420, test_loss: 0.9806, test_f1: 0.5777
 epoch: 57, train_loss: 0.8470, test_loss: 0.9836, test_f1: 0.5762
 epoch: 58, train_loss: 0.8421, test_loss: 0.9715, test_f1: 0.5832
 epoch: 59, train_loss: 0.8338, test_loss: 0.9885, test_f1: 0.5452
 epoch: 60, train_loss: 0.8405, test_loss: 0.9679, test_f1: 0.5692
 epoch: 61, train_loss: 0.8363, test_loss: 0.9750, test_f1: 0.5774
 epoch: 62, train_loss: 0.8281, test_loss: 0.9866, test_f1: 0.5749
 epoch: 63, train_loss: 0.8217, test_loss: 0.9914, test_f1: 0.5641
 epoch: 64, train_loss: 0.8145, test_loss: 0.9908, test_f1: 0.5711
 epoch: 65, train_loss: 0.8339, test_loss: 0.9726, test_f1: 0.5918
 epoch: 66, train_loss: 0.8345, test_loss: 0.9869, test_f1: 0.5702
 epoch: 67, train_loss: 0.8319, test_loss: 0.9723, test_f1: 0.5930
 epoch: 68, train_loss: 0.8312, test_loss: 0.9841, test_f1: 0.5683
 epoch: 69, train_loss: 0.8345, test_loss: 0.9628, test_f1: 0.5912
 epoch: 70, train_loss: 0.8217, test_loss: 0.9814, test_f1: 0.5741
 epoch: 71, train_loss: 0.8247, test_loss: 0.9777, test_f1: 0.5794
 epoch: 72, train_loss: 0.7976, test_loss: 0.9607, test_f1: 0.5923
 epoch: 73, train_loss: 0.8001, test_loss: 0.9641, test_f1: 0.5837
 epoch: 74, train_loss: 0.8097, test_loss: 0.9788, test_f1: 0.5587
 epoch: 75, train_loss: 0.8044, test_loss: 0.9619, test_f1: 0.5818
 epoch: 76, train_loss: 0.7906, test_loss: 0.9639, test_f1: 0.5708
 epoch: 77, train_loss: 0.7845, test_loss: 0.9597, test_f1: 0.5820
 epoch: 78, train_loss: 0.7950, test_loss: 0.9660, test_f1: 0.5742
 epoch: 79, train_loss: 0.8153, test_loss: 0.9621, test_f1: 0.5994
 epoch: 80, train_loss: 0.7958, test_loss: 0.9626, test_f1: 0.5715
 epoch: 81, train_loss: 0.7991, test_loss: 0.9519, test_f1: 0.5821
 epoch: 82, train_loss: 0.7787, test_loss: 0.9632, test_f1: 0.5894
 epoch: 83, train_loss: 0.7935, test_loss: 0.9626, test_f1: 0.5842
 epoch: 84, train_loss: 0.7866, test_loss: 0.9563, test_f1: 0.5864
 epoch: 85, train_loss: 0.7925, test_loss: 0.9651, test_f1: 0.5789
 epoch: 86, train_loss: 0.7703, test_loss: 0.9663, test_f1: 0.5819
 epoch: 87, train_loss: 0.7905, test_loss: 0.9764, test_f1: 0.5817
 epoch: 88, train_loss: 0.7820, test_loss: 0.9638, test_f1: 0.5703
 epoch: 89, train_loss: 0.7838, test_loss: 0.9749, test_f1: 0.5666
 epoch: 90, train_loss: 0.7771, test_loss: 0.9682, test_f1: 0.5764
 epoch: 91, train_loss: 0.7829, test_loss: 0.9734, test_f1: 0.5626
 epoch: 92, train_loss: 0.7843, test_loss: 0.9823, test_f1: 0.5708
 epoch: 93, train_loss: 0.7700, test_loss: 0.9820, test_f1: 0.5569
 epoch: 94, train_loss: 0.7644, test_loss: 0.9820, test_f1: 0.5659
 epoch: 95, train_loss: 0.7651, test_loss: 0.9853, test_f1: 0.5702
 epoch: 96, train_loss: 0.7565, test_loss: 0.9765, test_f1: 0.5758
 epoch: 97, train_loss: 0.7712, test_loss: 0.9799, test_f1: 0.5761
 epoch: 98, train_loss: 0.7660, test_loss: 0.9729, test_f1: 0.5641
 epoch: 99, train_loss: 0.7715, test_loss: 0.9845, test_f1: 0.5617
##################ITERATION #9 ****************************************
 epoch: 0, train_loss: 1.2981, test_loss: 1.3109, test_f1: 0.2407
 epoch: 1, train_loss: 1.2165, test_loss: 1.2324, test_f1: 0.3125
 epoch: 2, train_loss: 1.1716, test_loss: 1.2097, test_f1: 0.3858
 epoch: 3, train_loss: 1.1475, test_loss: 1.1974, test_f1: 0.3821
 epoch: 4, train_loss: 1.1248, test_loss: 1.1707, test_f1: 0.3881
 epoch: 5, train_loss: 1.1013, test_loss: 1.1521, test_f1: 0.3971
 epoch: 6, train_loss: 1.0820, test_loss: 1.1366, test_f1: 0.3886
 epoch: 7, train_loss: 1.0577, test_loss: 1.1235, test_f1: 0.4004
 epoch: 8, train_loss: 1.0589, test_loss: 1.1140, test_f1: 0.4151
 epoch: 9, train_loss: 1.0341, test_loss: 1.1101, test_f1: 0.4770
 epoch: 10, train_loss: 1.0345, test_loss: 1.0983, test_f1: 0.4662
 epoch: 11, train_loss: 1.0197, test_loss: 1.0852, test_f1: 0.4968
 epoch: 12, train_loss: 1.0039, test_loss: 1.0665, test_f1: 0.5064
 epoch: 13, train_loss: 1.0015, test_loss: 1.0598, test_f1: 0.5137
 epoch: 14, train_loss: 0.9900, test_loss: 1.0536, test_f1: 0.5238
 epoch: 15, train_loss: 0.9955, test_loss: 1.0554, test_f1: 0.5329
 epoch: 16, train_loss: 0.9743, test_loss: 1.0425, test_f1: 0.5259
 epoch: 17, train_loss: 0.9631, test_loss: 1.0365, test_f1: 0.5256
 epoch: 18, train_loss: 0.9579, test_loss: 1.0194, test_f1: 0.5476
 epoch: 19, train_loss: 0.9478, test_loss: 1.0230, test_f1: 0.5441
 epoch: 20, train_loss: 0.9530, test_loss: 1.0241, test_f1: 0.5418
 epoch: 21, train_loss: 0.9381, test_loss: 1.0096, test_f1: 0.5380
 epoch: 22, train_loss: 0.9322, test_loss: 1.0040, test_f1: 0.5578
 epoch: 23, train_loss: 0.9325, test_loss: 1.0031, test_f1: 0.5551
 epoch: 24, train_loss: 0.9239, test_loss: 0.9964, test_f1: 0.5679
 epoch: 25, train_loss: 0.9308, test_loss: 0.9991, test_f1: 0.5582
 epoch: 26, train_loss: 0.9259, test_loss: 1.0003, test_f1: 0.5468
 epoch: 27, train_loss: 0.9178, test_loss: 0.9967, test_f1: 0.5511
 epoch: 28, train_loss: 0.9114, test_loss: 0.9939, test_f1: 0.5504
 epoch: 29, train_loss: 0.8957, test_loss: 0.9964, test_f1: 0.5670
 epoch: 30, train_loss: 0.9096, test_loss: 0.9934, test_f1: 0.5477
 epoch: 31, train_loss: 0.8985, test_loss: 0.9818, test_f1: 0.5803
 epoch: 32, train_loss: 0.8861, test_loss: 0.9775, test_f1: 0.5638
 epoch: 33, train_loss: 0.9008, test_loss: 0.9869, test_f1: 0.5575
 epoch: 34, train_loss: 0.8866, test_loss: 0.9883, test_f1: 0.5533
 epoch: 35, train_loss: 0.8808, test_loss: 0.9829, test_f1: 0.5573
 epoch: 36, train_loss: 0.8812, test_loss: 0.9775, test_f1: 0.5659
 epoch: 37, train_loss: 0.8838, test_loss: 0.9790, test_f1: 0.5545
 epoch: 38, train_loss: 0.8738, test_loss: 0.9714, test_f1: 0.5697
 epoch: 39, train_loss: 0.8727, test_loss: 0.9743, test_f1: 0.5621
 epoch: 40, train_loss: 0.8613, test_loss: 0.9841, test_f1: 0.5476
 epoch: 41, train_loss: 0.8480, test_loss: 0.9878, test_f1: 0.5374
 epoch: 42, train_loss: 0.8453, test_loss: 0.9925, test_f1: 0.5508
 epoch: 43, train_loss: 0.8569, test_loss: 0.9881, test_f1: 0.5498
 epoch: 44, train_loss: 0.8489, test_loss: 0.9763, test_f1: 0.5568
 epoch: 45, train_loss: 0.8455, test_loss: 0.9810, test_f1: 0.5572
 epoch: 46, train_loss: 0.8428, test_loss: 0.9648, test_f1: 0.5619
 epoch: 47, train_loss: 0.8387, test_loss: 0.9668, test_f1: 0.5501
 epoch: 48, train_loss: 0.8457, test_loss: 0.9826, test_f1: 0.5460
 epoch: 49, train_loss: 0.8297, test_loss: 0.9735, test_f1: 0.5561
 epoch: 50, train_loss: 0.8313, test_loss: 0.9916, test_f1: 0.5552
 epoch: 51, train_loss: 0.8212, test_loss: 0.9689, test_f1: 0.5668
 epoch: 52, train_loss: 0.8323, test_loss: 0.9697, test_f1: 0.5665
 epoch: 53, train_loss: 0.8318, test_loss: 0.9755, test_f1: 0.5757
 epoch: 54, train_loss: 0.8269, test_loss: 0.9874, test_f1: 0.5711
 epoch: 55, train_loss: 0.8207, test_loss: 0.9902, test_f1: 0.5865
 epoch: 56, train_loss: 0.8179, test_loss: 0.9784, test_f1: 0.5699
 epoch: 57, train_loss: 0.8153, test_loss: 0.9802, test_f1: 0.5773
 epoch: 58, train_loss: 0.8195, test_loss: 0.9879, test_f1: 0.5800
 epoch: 59, train_loss: 0.7960, test_loss: 0.9740, test_f1: 0.5679
 epoch: 60, train_loss: 0.7982, test_loss: 0.9815, test_f1: 0.5832
 epoch: 61, train_loss: 0.8070, test_loss: 0.9897, test_f1: 0.5715
 epoch: 62, train_loss: 0.8048, test_loss: 0.9747, test_f1: 0.5645
 epoch: 63, train_loss: 0.8150, test_loss: 0.9985, test_f1: 0.5648
 epoch: 64, train_loss: 0.8096, test_loss: 0.9931, test_f1: 0.5667
 epoch: 65, train_loss: 0.8064, test_loss: 0.9970, test_f1: 0.5677
 epoch: 66, train_loss: 0.8040, test_loss: 0.9824, test_f1: 0.5773
 epoch: 67, train_loss: 0.8061, test_loss: 0.9842, test_f1: 0.5856
 epoch: 68, train_loss: 0.7923, test_loss: 0.9795, test_f1: 0.5743
 epoch: 69, train_loss: 0.7950, test_loss: 0.9882, test_f1: 0.5905
 epoch: 70, train_loss: 0.7930, test_loss: 0.9733, test_f1: 0.5918
 epoch: 71, train_loss: 0.7916, test_loss: 0.9870, test_f1: 0.6069
 epoch: 72, train_loss: 0.7906, test_loss: 0.9841, test_f1: 0.5955
 epoch: 73, train_loss: 0.7918, test_loss: 0.9792, test_f1: 0.5983
 epoch: 74, train_loss: 0.7921, test_loss: 0.9744, test_f1: 0.5868
 epoch: 75, train_loss: 0.7977, test_loss: 0.9881, test_f1: 0.5867
 epoch: 76, train_loss: 0.7826, test_loss: 0.9766, test_f1: 0.6002
 epoch: 77, train_loss: 0.7937, test_loss: 0.9739, test_f1: 0.5876
 epoch: 78, train_loss: 0.7786, test_loss: 0.9945, test_f1: 0.5734
 epoch: 79, train_loss: 0.7895, test_loss: 0.9772, test_f1: 0.5820
 epoch: 80, train_loss: 0.7739, test_loss: 0.9828, test_f1: 0.5920
 epoch: 81, train_loss: 0.7847, test_loss: 0.9844, test_f1: 0.5895
 epoch: 82, train_loss: 0.7788, test_loss: 0.9737, test_f1: 0.5926
 epoch: 83, train_loss: 0.7658, test_loss: 0.9790, test_f1: 0.5843
 epoch: 84, train_loss: 0.7749, test_loss: 0.9966, test_f1: 0.5859
 epoch: 85, train_loss: 0.7784, test_loss: 0.9934, test_f1: 0.5842
 epoch: 86, train_loss: 0.7755, test_loss: 0.9961, test_f1: 0.5872
 epoch: 87, train_loss: 0.7606, test_loss: 0.9983, test_f1: 0.5863
 epoch: 88, train_loss: 0.7765, test_loss: 1.0020, test_f1: 0.5836
 epoch: 89, train_loss: 0.7718, test_loss: 0.9790, test_f1: 0.5838
 epoch: 90, train_loss: 0.7605, test_loss: 0.9933, test_f1: 0.5746
 epoch: 91, train_loss: 0.7669, test_loss: 1.0022, test_f1: 0.5759
 epoch: 92, train_loss: 0.7635, test_loss: 1.0017, test_f1: 0.5741
 epoch: 93, train_loss: 0.7621, test_loss: 0.9961, test_f1: 0.5999
 epoch: 94, train_loss: 0.7687, test_loss: 1.0163, test_f1: 0.5856
 epoch: 95, train_loss: 0.7585, test_loss: 1.0212, test_f1: 0.5732
 epoch: 96, train_loss: 0.7603, test_loss: 1.0141, test_f1: 0.5734
 epoch: 97, train_loss: 0.7665, test_loss: 0.9928, test_f1: 0.5884
 epoch: 98, train_loss: 0.7587, test_loss: 0.9924, test_f1: 0.5951
 epoch: 99, train_loss: 0.7669, test_loss: 1.0182, test_f1: 0.5834

Training completed in 737.94 seconds
Best F1: 0.6069 at epoch 71
Mean F1 across iterations: 0.5584  0.0407
========================FINAL RESULTS================================
FEGIN weighted F1: 0.6069  0.0407
python main.py --data ltspice_demos --representation component_pin --model FEGIN --layers 5 --hiddens 32 --batch_size 32 --lr 0.0001 --emb_size 250 --epochs 100 --save_appendix component_pin_L5_H32_BS32_LR0.0001_E250 --no_val
-----



STDERR:
  File "main.py", line 370, in <module>
    main()
  File "main.py", line 254, in main
    dataset = dataset_class(
  File "/home/philip/projects/ltspice_examples_code_repo/Circuit-Completion-Using-GNNs/component_classification_with_link_prediction_head/evaluation/FEGIN/kernel/circuit_datasets.py", line 15, in __init__
    self.data, self.slices = torch.load(self.processed_paths[0])
  File "/home/philip/.local/lib/python3.8/site-packages/torch/serialization.py", line 1040, in load
    warnings.warn(
  File "/usr/lib/python3.8/warnings.py", line 109, in _showwarnmsg
    sw(msg.message, msg.category, msg.filename, msg.lineno,
  File "main.py", line 47, in warn_with_traceback
    traceback.print_stack(file=log)
/home/philip/projects/ltspice_examples_code_repo/Circuit-Completion-Using-GNNs/component_classification_with_link_prediction_head/evaluation/FEGIN/kernel/circuit_datasets.py:15: FutureWarning: You are using `torch.load` with `weights_only=False` (the current default value), which uses the default pickle module implicitly. It is possible to construct malicious pickle data which will execute arbitrary code during unpickling (See https://github.com/pytorch/pytorch/blob/main/SECURITY.md#untrusted-models for more details). In a future release, the default value for `weights_only` will be flipped to `True`. This limits the functions that could be executed during unpickling. Arbitrary objects will no longer be allowed to be loaded via this mode unless they are explicitly allowlisted by the user via `torch.serialization.add_safe_globals`. We recommend you start setting `weights_only=True` for any use case where you don't have full control of the loaded file. Please open an issue on GitHub for any issues related to this experimental feature.
  self.data, self.slices = torch.load(self.processed_paths[0])
