STDOUT:
Results will be saved in /home/philip/projects/ltspice_examples_code_repo/Circuit-Completion-Using-GNNs/component_classification_with_link_prediction_head/evaluation/FEGIN/results/model_FEGIN_dataset_ltspice_demos
Command line input: python main.py --data ltspice_demos --representation component_pin --model FEGIN --layers 5 --hiddens 32 --batch_size 32 --lr 0.0001 --emb_size 250 --epochs 100 --save_appendix component_pin_L5_H32_BS32_LR0.0001_E250 --no_val
 is saved.
-----
ltspice_demos - FEGIN
Using 5 layers, 32 hidden units, h = 2
Loading component_pin representation dataset
ENTERED
Training FEGIN on component_pin representation
Train: 1565, Test: 383
##################ITERATION #0 ****************************************
 epoch: 0, train_loss: 1.4223, test_loss: 1.4096, test_f1: 0.0507
 epoch: 1, train_loss: 1.4072, test_loss: 1.3998, test_f1: 0.0507
 epoch: 2, train_loss: 1.3933, test_loss: 1.3882, test_f1: 0.0664
 epoch: 3, train_loss: 1.3758, test_loss: 1.3756, test_f1: 0.1980
 epoch: 4, train_loss: 1.3550, test_loss: 1.3597, test_f1: 0.3058
 epoch: 5, train_loss: 1.3274, test_loss: 1.3402, test_f1: 0.3231
 epoch: 6, train_loss: 1.2988, test_loss: 1.3182, test_f1: 0.3231
 epoch: 7, train_loss: 1.2736, test_loss: 1.2988, test_f1: 0.3231
 epoch: 8, train_loss: 1.2432, test_loss: 1.2815, test_f1: 0.3282
 epoch: 9, train_loss: 1.2289, test_loss: 1.2693, test_f1: 0.3249
 epoch: 10, train_loss: 1.2082, test_loss: 1.2604, test_f1: 0.3351
 epoch: 11, train_loss: 1.1960, test_loss: 1.2511, test_f1: 0.3410
 epoch: 12, train_loss: 1.1887, test_loss: 1.2424, test_f1: 0.3468
 epoch: 13, train_loss: 1.1771, test_loss: 1.2372, test_f1: 0.3432
 epoch: 14, train_loss: 1.1674, test_loss: 1.2288, test_f1: 0.3514
 epoch: 15, train_loss: 1.1638, test_loss: 1.2251, test_f1: 0.3657
 epoch: 16, train_loss: 1.1541, test_loss: 1.2172, test_f1: 0.3527
 epoch: 17, train_loss: 1.1471, test_loss: 1.2088, test_f1: 0.3548
 epoch: 18, train_loss: 1.1398, test_loss: 1.2043, test_f1: 0.3567
 epoch: 19, train_loss: 1.1324, test_loss: 1.1997, test_f1: 0.3968
 epoch: 20, train_loss: 1.1283, test_loss: 1.1868, test_f1: 0.3628
 epoch: 21, train_loss: 1.1206, test_loss: 1.1900, test_f1: 0.3926
 epoch: 22, train_loss: 1.1202, test_loss: 1.1725, test_f1: 0.3496
 epoch: 23, train_loss: 1.1118, test_loss: 1.1736, test_f1: 0.3946
 epoch: 24, train_loss: 1.1107, test_loss: 1.1614, test_f1: 0.3907
 epoch: 25, train_loss: 1.1082, test_loss: 1.1565, test_f1: 0.3986
 epoch: 26, train_loss: 1.1025, test_loss: 1.1516, test_f1: 0.3619
 epoch: 27, train_loss: 1.0948, test_loss: 1.1439, test_f1: 0.4445
 epoch: 28, train_loss: 1.0915, test_loss: 1.1370, test_f1: 0.4395
 epoch: 29, train_loss: 1.0906, test_loss: 1.1345, test_f1: 0.4579
 epoch: 30, train_loss: 1.0707, test_loss: 1.1354, test_f1: 0.4712
 epoch: 31, train_loss: 1.0719, test_loss: 1.1323, test_f1: 0.4533
 epoch: 32, train_loss: 1.0587, test_loss: 1.1215, test_f1: 0.4474
 epoch: 33, train_loss: 1.0684, test_loss: 1.1154, test_f1: 0.4314
 epoch: 34, train_loss: 1.0574, test_loss: 1.1181, test_f1: 0.4065
 epoch: 35, train_loss: 1.0500, test_loss: 1.1061, test_f1: 0.4381
 epoch: 36, train_loss: 1.0463, test_loss: 1.1058, test_f1: 0.4232
 epoch: 37, train_loss: 1.0391, test_loss: 1.1004, test_f1: 0.4114
 epoch: 38, train_loss: 1.0248, test_loss: 1.0933, test_f1: 0.4311
 epoch: 39, train_loss: 1.0327, test_loss: 1.0845, test_f1: 0.4380
 epoch: 40, train_loss: 1.0313, test_loss: 1.0792, test_f1: 0.4219
 epoch: 41, train_loss: 1.0133, test_loss: 1.0871, test_f1: 0.4137
 epoch: 42, train_loss: 1.0106, test_loss: 1.0758, test_f1: 0.4171
 epoch: 43, train_loss: 1.0008, test_loss: 1.0772, test_f1: 0.4042
 epoch: 44, train_loss: 0.9987, test_loss: 1.0618, test_f1: 0.4215
 epoch: 45, train_loss: 0.9831, test_loss: 1.0689, test_f1: 0.4202
 epoch: 46, train_loss: 0.9821, test_loss: 1.0576, test_f1: 0.4324
 epoch: 47, train_loss: 0.9688, test_loss: 1.0530, test_f1: 0.4361
 epoch: 48, train_loss: 0.9649, test_loss: 1.0605, test_f1: 0.4216
 epoch: 49, train_loss: 0.9511, test_loss: 1.0584, test_f1: 0.4373
 epoch: 50, train_loss: 0.9612, test_loss: 1.0611, test_f1: 0.4077
 epoch: 51, train_loss: 0.9423, test_loss: 1.0440, test_f1: 0.4406
 epoch: 52, train_loss: 0.9378, test_loss: 1.0473, test_f1: 0.4353
 epoch: 53, train_loss: 0.9394, test_loss: 1.0426, test_f1: 0.4373
 epoch: 54, train_loss: 0.9388, test_loss: 1.0500, test_f1: 0.4380
 epoch: 55, train_loss: 0.9335, test_loss: 1.0570, test_f1: 0.4400
 epoch: 56, train_loss: 0.9244, test_loss: 1.0290, test_f1: 0.4437
 epoch: 57, train_loss: 0.9256, test_loss: 1.0365, test_f1: 0.4578
 epoch: 58, train_loss: 0.9273, test_loss: 1.0364, test_f1: 0.4626
 epoch: 59, train_loss: 0.9111, test_loss: 1.0478, test_f1: 0.4549
 epoch: 60, train_loss: 0.9201, test_loss: 1.0278, test_f1: 0.4537
 epoch: 61, train_loss: 0.9153, test_loss: 1.0295, test_f1: 0.4579
 epoch: 62, train_loss: 0.9120, test_loss: 1.0475, test_f1: 0.4511
 epoch: 63, train_loss: 0.9104, test_loss: 1.0350, test_f1: 0.4721
 epoch: 64, train_loss: 0.9237, test_loss: 1.0334, test_f1: 0.4684
 epoch: 65, train_loss: 0.9076, test_loss: 1.0437, test_f1: 0.4573
 epoch: 66, train_loss: 0.8954, test_loss: 1.0198, test_f1: 0.4593
 epoch: 67, train_loss: 0.8958, test_loss: 1.0255, test_f1: 0.4648
 epoch: 68, train_loss: 0.8902, test_loss: 1.0400, test_f1: 0.4688
 epoch: 69, train_loss: 0.9031, test_loss: 1.0387, test_f1: 0.4762
 epoch: 70, train_loss: 0.8882, test_loss: 1.0210, test_f1: 0.4793
 epoch: 71, train_loss: 0.8935, test_loss: 1.0443, test_f1: 0.4774
 epoch: 72, train_loss: 0.8775, test_loss: 1.0373, test_f1: 0.5060
 epoch: 73, train_loss: 0.8897, test_loss: 1.0183, test_f1: 0.4849
 epoch: 74, train_loss: 0.8879, test_loss: 1.0264, test_f1: 0.5025
 epoch: 75, train_loss: 0.8748, test_loss: 1.0288, test_f1: 0.4881
 epoch: 76, train_loss: 0.8842, test_loss: 1.0251, test_f1: 0.4979
 epoch: 77, train_loss: 0.8890, test_loss: 1.0240, test_f1: 0.4784
 epoch: 78, train_loss: 0.8697, test_loss: 1.0248, test_f1: 0.5000
 epoch: 79, train_loss: 0.8835, test_loss: 1.0217, test_f1: 0.5030
 epoch: 80, train_loss: 0.8886, test_loss: 1.0455, test_f1: 0.5151
 epoch: 81, train_loss: 0.8718, test_loss: 1.0203, test_f1: 0.4997
 epoch: 82, train_loss: 0.8584, test_loss: 1.0374, test_f1: 0.5035
 epoch: 83, train_loss: 0.8730, test_loss: 1.0329, test_f1: 0.5167
 epoch: 84, train_loss: 0.8687, test_loss: 1.0352, test_f1: 0.5158
 epoch: 85, train_loss: 0.8624, test_loss: 1.0214, test_f1: 0.5131
 epoch: 86, train_loss: 0.8626, test_loss: 1.0273, test_f1: 0.5236
 epoch: 87, train_loss: 0.8671, test_loss: 1.0075, test_f1: 0.5152
 epoch: 88, train_loss: 0.8608, test_loss: 1.0024, test_f1: 0.5148
 epoch: 89, train_loss: 0.8526, test_loss: 1.0040, test_f1: 0.5264
 epoch: 90, train_loss: 0.8651, test_loss: 1.0262, test_f1: 0.5195
 epoch: 91, train_loss: 0.8633, test_loss: 1.0109, test_f1: 0.5246
 epoch: 92, train_loss: 0.8483, test_loss: 1.0107, test_f1: 0.5424
 epoch: 93, train_loss: 0.8613, test_loss: 1.0128, test_f1: 0.5308
 epoch: 94, train_loss: 0.8454, test_loss: 1.0303, test_f1: 0.5457
 epoch: 95, train_loss: 0.8511, test_loss: 1.0490, test_f1: 0.5369
 epoch: 96, train_loss: 0.8519, test_loss: 1.0061, test_f1: 0.5293
 epoch: 97, train_loss: 0.8465, test_loss: 1.0224, test_f1: 0.5360
 epoch: 98, train_loss: 0.8416, test_loss: 1.0352, test_f1: 0.5188
 epoch: 99, train_loss: 0.8384, test_loss: 1.0308, test_f1: 0.5589
##################ITERATION #1 ****************************************
 epoch: 0, train_loss: 1.3969, test_loss: 1.3845, test_f1: 0.0664
 epoch: 1, train_loss: 1.3421, test_loss: 1.3570, test_f1: 0.2136
 epoch: 2, train_loss: 1.3078, test_loss: 1.3351, test_f1: 0.2760
 epoch: 3, train_loss: 1.2780, test_loss: 1.3106, test_f1: 0.2992
 epoch: 4, train_loss: 1.2519, test_loss: 1.2880, test_f1: 0.3242
 epoch: 5, train_loss: 1.2243, test_loss: 1.2751, test_f1: 0.2852
 epoch: 6, train_loss: 1.2060, test_loss: 1.2668, test_f1: 0.2774
 epoch: 7, train_loss: 1.1993, test_loss: 1.2588, test_f1: 0.2825
 epoch: 8, train_loss: 1.1877, test_loss: 1.2509, test_f1: 0.2831
 epoch: 9, train_loss: 1.1857, test_loss: 1.2492, test_f1: 0.2920
 epoch: 10, train_loss: 1.1689, test_loss: 1.2449, test_f1: 0.3169
 epoch: 11, train_loss: 1.1667, test_loss: 1.2361, test_f1: 0.3309
 epoch: 12, train_loss: 1.1548, test_loss: 1.2348, test_f1: 0.3560
 epoch: 13, train_loss: 1.1424, test_loss: 1.2161, test_f1: 0.3741
 epoch: 14, train_loss: 1.1467, test_loss: 1.2125, test_f1: 0.3729
 epoch: 15, train_loss: 1.1200, test_loss: 1.2124, test_f1: 0.3435
 epoch: 16, train_loss: 1.1198, test_loss: 1.2108, test_f1: 0.3594
 epoch: 17, train_loss: 1.1099, test_loss: 1.1954, test_f1: 0.3423
 epoch: 18, train_loss: 1.0994, test_loss: 1.2021, test_f1: 0.3544
 epoch: 19, train_loss: 1.0868, test_loss: 1.1779, test_f1: 0.3784
 epoch: 20, train_loss: 1.0884, test_loss: 1.1848, test_f1: 0.3791
 epoch: 21, train_loss: 1.0672, test_loss: 1.1784, test_f1: 0.3554
 epoch: 22, train_loss: 1.0626, test_loss: 1.1793, test_f1: 0.3784
 epoch: 23, train_loss: 1.0569, test_loss: 1.1594, test_f1: 0.3748
 epoch: 24, train_loss: 1.0533, test_loss: 1.1544, test_f1: 0.3704
 epoch: 25, train_loss: 1.0363, test_loss: 1.1588, test_f1: 0.3700
 epoch: 26, train_loss: 1.0241, test_loss: 1.1671, test_f1: 0.3634
 epoch: 27, train_loss: 1.0373, test_loss: 1.1398, test_f1: 0.3744
 epoch: 28, train_loss: 1.0129, test_loss: 1.1615, test_f1: 0.3528
 epoch: 29, train_loss: 1.0070, test_loss: 1.1528, test_f1: 0.3814
 epoch: 30, train_loss: 1.0058, test_loss: 1.1467, test_f1: 0.3680
 epoch: 31, train_loss: 1.0004, test_loss: 1.1402, test_f1: 0.4037
 epoch: 32, train_loss: 0.9819, test_loss: 1.1259, test_f1: 0.3757
 epoch: 33, train_loss: 0.9938, test_loss: 1.1312, test_f1: 0.3815
 epoch: 34, train_loss: 0.9835, test_loss: 1.1181, test_f1: 0.3958
 epoch: 35, train_loss: 0.9788, test_loss: 1.1244, test_f1: 0.3803
 epoch: 36, train_loss: 0.9629, test_loss: 1.0994, test_f1: 0.3976
 epoch: 37, train_loss: 0.9714, test_loss: 1.1217, test_f1: 0.3917
 epoch: 38, train_loss: 0.9636, test_loss: 1.1024, test_f1: 0.4293
 epoch: 39, train_loss: 0.9481, test_loss: 1.0990, test_f1: 0.4110
 epoch: 40, train_loss: 0.9511, test_loss: 1.1108, test_f1: 0.4073
 epoch: 41, train_loss: 0.9512, test_loss: 1.1090, test_f1: 0.4148
 epoch: 42, train_loss: 0.9459, test_loss: 1.1139, test_f1: 0.3966
 epoch: 43, train_loss: 0.9361, test_loss: 1.1083, test_f1: 0.4279
 epoch: 44, train_loss: 0.9316, test_loss: 1.1614, test_f1: 0.3869
 epoch: 45, train_loss: 0.9285, test_loss: 1.1109, test_f1: 0.4060
 epoch: 46, train_loss: 0.9255, test_loss: 1.1220, test_f1: 0.4342
 epoch: 47, train_loss: 0.9231, test_loss: 1.1052, test_f1: 0.4155
 epoch: 48, train_loss: 0.9189, test_loss: 1.0855, test_f1: 0.4317
 epoch: 49, train_loss: 0.9208, test_loss: 1.1184, test_f1: 0.4081
 epoch: 50, train_loss: 0.9009, test_loss: 1.0875, test_f1: 0.4342
 epoch: 51, train_loss: 0.8980, test_loss: 1.1110, test_f1: 0.3769
 epoch: 52, train_loss: 0.8926, test_loss: 1.1037, test_f1: 0.3920
 epoch: 53, train_loss: 0.9044, test_loss: 1.0929, test_f1: 0.4092
 epoch: 54, train_loss: 0.8945, test_loss: 1.0842, test_f1: 0.4117
 epoch: 55, train_loss: 0.9048, test_loss: 1.0986, test_f1: 0.4031
 epoch: 56, train_loss: 0.8954, test_loss: 1.0834, test_f1: 0.4170
 epoch: 57, train_loss: 0.8947, test_loss: 1.0938, test_f1: 0.4093
 epoch: 58, train_loss: 0.8918, test_loss: 1.0980, test_f1: 0.4281
 epoch: 59, train_loss: 0.8923, test_loss: 1.0798, test_f1: 0.4005
 epoch: 60, train_loss: 0.8845, test_loss: 1.1113, test_f1: 0.4478
 epoch: 61, train_loss: 0.8893, test_loss: 1.1043, test_f1: 0.4414
 epoch: 62, train_loss: 0.8709, test_loss: 1.0862, test_f1: 0.4107
 epoch: 63, train_loss: 0.8868, test_loss: 1.0960, test_f1: 0.4372
 epoch: 64, train_loss: 0.8851, test_loss: 1.0889, test_f1: 0.4092
 epoch: 65, train_loss: 0.8789, test_loss: 1.0854, test_f1: 0.4058
 epoch: 66, train_loss: 0.8791, test_loss: 1.0849, test_f1: 0.4297
 epoch: 67, train_loss: 0.8893, test_loss: 1.0952, test_f1: 0.4173
 epoch: 68, train_loss: 0.8817, test_loss: 1.1139, test_f1: 0.4278
 epoch: 69, train_loss: 0.8769, test_loss: 1.1177, test_f1: 0.4303
 epoch: 70, train_loss: 0.8762, test_loss: 1.1213, test_f1: 0.4242
 epoch: 71, train_loss: 0.8678, test_loss: 1.0979, test_f1: 0.3991
 epoch: 72, train_loss: 0.8816, test_loss: 1.1073, test_f1: 0.3978
 epoch: 73, train_loss: 0.8594, test_loss: 1.0977, test_f1: 0.4002
 epoch: 74, train_loss: 0.8665, test_loss: 1.0962, test_f1: 0.4532
 epoch: 75, train_loss: 0.8600, test_loss: 1.1026, test_f1: 0.4323
 epoch: 76, train_loss: 0.8581, test_loss: 1.0974, test_f1: 0.4269
 epoch: 77, train_loss: 0.8691, test_loss: 1.1343, test_f1: 0.4382
 epoch: 78, train_loss: 0.8482, test_loss: 1.1069, test_f1: 0.4363
 epoch: 79, train_loss: 0.8634, test_loss: 1.1075, test_f1: 0.4221
 epoch: 80, train_loss: 0.8554, test_loss: 1.0780, test_f1: 0.4205
 epoch: 81, train_loss: 0.8623, test_loss: 1.0867, test_f1: 0.4308
 epoch: 82, train_loss: 0.8571, test_loss: 1.1026, test_f1: 0.4577
 epoch: 83, train_loss: 0.8553, test_loss: 1.0797, test_f1: 0.4241
 epoch: 84, train_loss: 0.8489, test_loss: 1.1106, test_f1: 0.4246
 epoch: 85, train_loss: 0.8642, test_loss: 1.0741, test_f1: 0.4489
 epoch: 86, train_loss: 0.8652, test_loss: 1.0912, test_f1: 0.4470
 epoch: 87, train_loss: 0.8564, test_loss: 1.0880, test_f1: 0.4572
 epoch: 88, train_loss: 0.8410, test_loss: 1.0852, test_f1: 0.4710
 epoch: 89, train_loss: 0.8510, test_loss: 1.0913, test_f1: 0.4420
 epoch: 90, train_loss: 0.8545, test_loss: 1.0747, test_f1: 0.4541
 epoch: 91, train_loss: 0.8302, test_loss: 1.0771, test_f1: 0.4584
 epoch: 92, train_loss: 0.8597, test_loss: 1.0818, test_f1: 0.4711
 epoch: 93, train_loss: 0.8443, test_loss: 1.0899, test_f1: 0.4458
 epoch: 94, train_loss: 0.8363, test_loss: 1.0868, test_f1: 0.4436
 epoch: 95, train_loss: 0.8407, test_loss: 1.1329, test_f1: 0.4700
 epoch: 96, train_loss: 0.8455, test_loss: 1.0996, test_f1: 0.4364
 epoch: 97, train_loss: 0.8373, test_loss: 1.1163, test_f1: 0.4664
 epoch: 98, train_loss: 0.8646, test_loss: 1.0922, test_f1: 0.4440
 epoch: 99, train_loss: 0.8235, test_loss: 1.1223, test_f1: 0.4713
##################ITERATION #2 ****************************************
 epoch: 0, train_loss: 1.3367, test_loss: 1.3361, test_f1: 0.2296
 epoch: 1, train_loss: 1.2808, test_loss: 1.3082, test_f1: 0.2451
 epoch: 2, train_loss: 1.2531, test_loss: 1.2943, test_f1: 0.2569
 epoch: 3, train_loss: 1.2356, test_loss: 1.2771, test_f1: 0.2516
 epoch: 4, train_loss: 1.2160, test_loss: 1.2620, test_f1: 0.2457
 epoch: 5, train_loss: 1.1976, test_loss: 1.2483, test_f1: 0.2524
 epoch: 6, train_loss: 1.1771, test_loss: 1.2402, test_f1: 0.2989
 epoch: 7, train_loss: 1.1665, test_loss: 1.2260, test_f1: 0.3529
 epoch: 8, train_loss: 1.1528, test_loss: 1.2199, test_f1: 0.3593
 epoch: 9, train_loss: 1.1335, test_loss: 1.2080, test_f1: 0.3667
 epoch: 10, train_loss: 1.1229, test_loss: 1.1957, test_f1: 0.3467
 epoch: 11, train_loss: 1.1162, test_loss: 1.1902, test_f1: 0.3491
 epoch: 12, train_loss: 1.1027, test_loss: 1.1772, test_f1: 0.3352
 epoch: 13, train_loss: 1.0951, test_loss: 1.1720, test_f1: 0.3355
 epoch: 14, train_loss: 1.0791, test_loss: 1.1680, test_f1: 0.3232
 epoch: 15, train_loss: 1.0711, test_loss: 1.1457, test_f1: 0.3456
 epoch: 16, train_loss: 1.0557, test_loss: 1.1553, test_f1: 0.3539
 epoch: 17, train_loss: 1.0450, test_loss: 1.1350, test_f1: 0.3975
 epoch: 18, train_loss: 1.0387, test_loss: 1.1299, test_f1: 0.3875
 epoch: 19, train_loss: 1.0278, test_loss: 1.1286, test_f1: 0.3915
 epoch: 20, train_loss: 1.0269, test_loss: 1.1196, test_f1: 0.3899
 epoch: 21, train_loss: 1.0199, test_loss: 1.1215, test_f1: 0.3971
 epoch: 22, train_loss: 1.0198, test_loss: 1.0991, test_f1: 0.3995
 epoch: 23, train_loss: 1.0069, test_loss: 1.1085, test_f1: 0.4004
 epoch: 24, train_loss: 0.9997, test_loss: 1.0949, test_f1: 0.3955
 epoch: 25, train_loss: 0.9909, test_loss: 1.0938, test_f1: 0.4031
 epoch: 26, train_loss: 0.9831, test_loss: 1.0911, test_f1: 0.4035
 epoch: 27, train_loss: 0.9865, test_loss: 1.0914, test_f1: 0.3994
 epoch: 28, train_loss: 0.9656, test_loss: 1.1238, test_f1: 0.3949
 epoch: 29, train_loss: 0.9652, test_loss: 1.1093, test_f1: 0.4039
 epoch: 30, train_loss: 0.9608, test_loss: 1.0861, test_f1: 0.4063
 epoch: 31, train_loss: 0.9624, test_loss: 1.0777, test_f1: 0.3986
 epoch: 32, train_loss: 0.9605, test_loss: 1.1205, test_f1: 0.3895
 epoch: 33, train_loss: 0.9516, test_loss: 1.0880, test_f1: 0.4021
 epoch: 34, train_loss: 0.9396, test_loss: 1.0547, test_f1: 0.3982
 epoch: 35, train_loss: 0.9431, test_loss: 1.0537, test_f1: 0.4134
 epoch: 36, train_loss: 0.9411, test_loss: 1.0630, test_f1: 0.4057
 epoch: 37, train_loss: 0.9226, test_loss: 1.0744, test_f1: 0.4177
 epoch: 38, train_loss: 0.9362, test_loss: 1.0638, test_f1: 0.4270
 epoch: 39, train_loss: 0.9311, test_loss: 1.0580, test_f1: 0.4248
 epoch: 40, train_loss: 0.9378, test_loss: 1.0470, test_f1: 0.4270
 epoch: 41, train_loss: 0.9185, test_loss: 1.0592, test_f1: 0.4273
 epoch: 42, train_loss: 0.9157, test_loss: 1.0659, test_f1: 0.4276
 epoch: 43, train_loss: 0.9111, test_loss: 1.1390, test_f1: 0.4093
 epoch: 44, train_loss: 0.9065, test_loss: 1.1036, test_f1: 0.4243
 epoch: 45, train_loss: 0.9066, test_loss: 1.0913, test_f1: 0.4385
 epoch: 46, train_loss: 0.8952, test_loss: 1.1260, test_f1: 0.4301
 epoch: 47, train_loss: 0.8869, test_loss: 1.0866, test_f1: 0.4454
 epoch: 48, train_loss: 0.8989, test_loss: 1.1007, test_f1: 0.4559
 epoch: 49, train_loss: 0.8859, test_loss: 1.0921, test_f1: 0.4599
 epoch: 50, train_loss: 0.8934, test_loss: 1.1106, test_f1: 0.4688
 epoch: 51, train_loss: 0.8870, test_loss: 1.0965, test_f1: 0.4474
 epoch: 52, train_loss: 0.8752, test_loss: 1.0962, test_f1: 0.4596
 epoch: 53, train_loss: 0.8825, test_loss: 1.1126, test_f1: 0.4538
 epoch: 54, train_loss: 0.8677, test_loss: 1.1816, test_f1: 0.4591
 epoch: 55, train_loss: 0.8633, test_loss: 1.1531, test_f1: 0.4426
 epoch: 56, train_loss: 0.8794, test_loss: 1.1553, test_f1: 0.4674
 epoch: 57, train_loss: 0.8775, test_loss: 1.1381, test_f1: 0.4685
 epoch: 58, train_loss: 0.8690, test_loss: 1.1525, test_f1: 0.4715
 epoch: 59, train_loss: 0.8595, test_loss: 1.1837, test_f1: 0.4531
 epoch: 60, train_loss: 0.8743, test_loss: 1.1967, test_f1: 0.4689
 epoch: 61, train_loss: 0.8585, test_loss: 1.2101, test_f1: 0.4687
 epoch: 62, train_loss: 0.8618, test_loss: 1.1823, test_f1: 0.4627
 epoch: 63, train_loss: 0.8611, test_loss: 1.1345, test_f1: 0.4766
 epoch: 64, train_loss: 0.8604, test_loss: 1.1831, test_f1: 0.4944
 epoch: 65, train_loss: 0.8694, test_loss: 1.1483, test_f1: 0.4729
 epoch: 66, train_loss: 0.8618, test_loss: 1.1795, test_f1: 0.4772
 epoch: 67, train_loss: 0.8508, test_loss: 1.1461, test_f1: 0.4812
 epoch: 68, train_loss: 0.8419, test_loss: 1.1819, test_f1: 0.4955
 epoch: 69, train_loss: 0.8480, test_loss: 1.1889, test_f1: 0.4887
 epoch: 70, train_loss: 0.8549, test_loss: 1.2202, test_f1: 0.4685
 epoch: 71, train_loss: 0.8514, test_loss: 1.1579, test_f1: 0.4828
 epoch: 72, train_loss: 0.8515, test_loss: 1.1979, test_f1: 0.4830
 epoch: 73, train_loss: 0.8471, test_loss: 1.1833, test_f1: 0.4604
 epoch: 74, train_loss: 0.8533, test_loss: 1.1923, test_f1: 0.4806
 epoch: 75, train_loss: 0.8487, test_loss: 1.1906, test_f1: 0.5019
 epoch: 76, train_loss: 0.8416, test_loss: 1.1549, test_f1: 0.5005
 epoch: 77, train_loss: 0.8446, test_loss: 1.1741, test_f1: 0.4919
 epoch: 78, train_loss: 0.8378, test_loss: 1.2246, test_f1: 0.4848
 epoch: 79, train_loss: 0.8367, test_loss: 1.1620, test_f1: 0.4831
 epoch: 80, train_loss: 0.8399, test_loss: 1.2440, test_f1: 0.4785
 epoch: 81, train_loss: 0.8319, test_loss: 1.2389, test_f1: 0.4942
 epoch: 82, train_loss: 0.8469, test_loss: 1.1721, test_f1: 0.4965
 epoch: 83, train_loss: 0.8379, test_loss: 1.2018, test_f1: 0.4953
 epoch: 84, train_loss: 0.8365, test_loss: 1.2558, test_f1: 0.4945
 epoch: 85, train_loss: 0.8266, test_loss: 1.2128, test_f1: 0.5001
 epoch: 86, train_loss: 0.8311, test_loss: 1.2784, test_f1: 0.4755
 epoch: 87, train_loss: 0.8354, test_loss: 1.2459, test_f1: 0.4848
 epoch: 88, train_loss: 0.8191, test_loss: 1.2967, test_f1: 0.5004
 epoch: 89, train_loss: 0.8319, test_loss: 1.2346, test_f1: 0.4972
 epoch: 90, train_loss: 0.8166, test_loss: 1.1908, test_f1: 0.5041
 epoch: 91, train_loss: 0.8331, test_loss: 1.2576, test_f1: 0.4958
 epoch: 92, train_loss: 0.8210, test_loss: 1.2096, test_f1: 0.4861
 epoch: 93, train_loss: 0.8241, test_loss: 1.2371, test_f1: 0.4836
 epoch: 94, train_loss: 0.8327, test_loss: 1.2337, test_f1: 0.4842
 epoch: 95, train_loss: 0.8156, test_loss: 1.2507, test_f1: 0.4883
 epoch: 96, train_loss: 0.8136, test_loss: 1.2325, test_f1: 0.4920
 epoch: 97, train_loss: 0.8076, test_loss: 1.2861, test_f1: 0.4794
 epoch: 98, train_loss: 0.8192, test_loss: 1.2243, test_f1: 0.4999
 epoch: 99, train_loss: 0.8253, test_loss: 1.2282, test_f1: 0.4981
##################ITERATION #3 ****************************************
 epoch: 0, train_loss: 1.3634, test_loss: 1.3453, test_f1: 0.2374
 epoch: 1, train_loss: 1.2962, test_loss: 1.3224, test_f1: 0.2490
 epoch: 2, train_loss: 1.2617, test_loss: 1.2959, test_f1: 0.2362
 epoch: 3, train_loss: 1.2409, test_loss: 1.2830, test_f1: 0.2306
 epoch: 4, train_loss: 1.2261, test_loss: 1.2713, test_f1: 0.2373
 epoch: 5, train_loss: 1.2088, test_loss: 1.2575, test_f1: 0.2417
 epoch: 6, train_loss: 1.1863, test_loss: 1.2432, test_f1: 0.2629
 epoch: 7, train_loss: 1.1786, test_loss: 1.2332, test_f1: 0.2855
 epoch: 8, train_loss: 1.1594, test_loss: 1.2269, test_f1: 0.3326
 epoch: 9, train_loss: 1.1483, test_loss: 1.2134, test_f1: 0.3852
 epoch: 10, train_loss: 1.1402, test_loss: 1.2077, test_f1: 0.3869
 epoch: 11, train_loss: 1.1134, test_loss: 1.1920, test_f1: 0.3965
 epoch: 12, train_loss: 1.1071, test_loss: 1.1830, test_f1: 0.3887
 epoch: 13, train_loss: 1.0944, test_loss: 1.1734, test_f1: 0.3863
 epoch: 14, train_loss: 1.0854, test_loss: 1.1688, test_f1: 0.3907
 epoch: 15, train_loss: 1.0721, test_loss: 1.1674, test_f1: 0.4039
 epoch: 16, train_loss: 1.0750, test_loss: 1.1608, test_f1: 0.4045
 epoch: 17, train_loss: 1.0628, test_loss: 1.1507, test_f1: 0.4139
 epoch: 18, train_loss: 1.0532, test_loss: 1.1388, test_f1: 0.4234
 epoch: 19, train_loss: 1.0435, test_loss: 1.1380, test_f1: 0.4329
 epoch: 20, train_loss: 1.0219, test_loss: 1.1416, test_f1: 0.4256
 epoch: 21, train_loss: 1.0266, test_loss: 1.1249, test_f1: 0.4140
 epoch: 22, train_loss: 1.0207, test_loss: 1.1316, test_f1: 0.4295
 epoch: 23, train_loss: 1.0114, test_loss: 1.1168, test_f1: 0.4344
 epoch: 24, train_loss: 1.0112, test_loss: 1.1196, test_f1: 0.4302
 epoch: 25, train_loss: 0.9973, test_loss: 1.1109, test_f1: 0.4673
 epoch: 26, train_loss: 0.9940, test_loss: 1.1040, test_f1: 0.4557
 epoch: 27, train_loss: 0.9903, test_loss: 1.0970, test_f1: 0.4384
 epoch: 28, train_loss: 0.9864, test_loss: 1.0931, test_f1: 0.4592
 epoch: 29, train_loss: 0.9793, test_loss: 1.0846, test_f1: 0.4582
 epoch: 30, train_loss: 0.9722, test_loss: 1.0804, test_f1: 0.4580
 epoch: 31, train_loss: 0.9708, test_loss: 1.0574, test_f1: 0.4715
 epoch: 32, train_loss: 0.9611, test_loss: 1.0669, test_f1: 0.4821
 epoch: 33, train_loss: 0.9606, test_loss: 1.0602, test_f1: 0.4687
 epoch: 34, train_loss: 0.9593, test_loss: 1.0585, test_f1: 0.4671
 epoch: 35, train_loss: 0.9514, test_loss: 1.0862, test_f1: 0.4751
 epoch: 36, train_loss: 0.9432, test_loss: 1.0691, test_f1: 0.4996
 epoch: 37, train_loss: 0.9321, test_loss: 1.0334, test_f1: 0.4787
 epoch: 38, train_loss: 0.9439, test_loss: 1.0405, test_f1: 0.4836
 epoch: 39, train_loss: 0.9347, test_loss: 1.0350, test_f1: 0.4900
 epoch: 40, train_loss: 0.9157, test_loss: 1.0243, test_f1: 0.4904
 epoch: 41, train_loss: 0.9210, test_loss: 1.0232, test_f1: 0.4865
 epoch: 42, train_loss: 0.9240, test_loss: 1.0181, test_f1: 0.4879
 epoch: 43, train_loss: 0.9287, test_loss: 1.0331, test_f1: 0.4863
 epoch: 44, train_loss: 0.9113, test_loss: 1.0432, test_f1: 0.4965
 epoch: 45, train_loss: 0.9053, test_loss: 1.0428, test_f1: 0.4836
 epoch: 46, train_loss: 0.9026, test_loss: 1.0290, test_f1: 0.4588
 epoch: 47, train_loss: 0.9055, test_loss: 1.0241, test_f1: 0.5168
 epoch: 48, train_loss: 0.9072, test_loss: 1.0158, test_f1: 0.5279
 epoch: 49, train_loss: 0.9046, test_loss: 1.0092, test_f1: 0.5264
 epoch: 50, train_loss: 0.8976, test_loss: 1.0057, test_f1: 0.5189
 epoch: 51, train_loss: 0.8871, test_loss: 1.0109, test_f1: 0.5251
 epoch: 52, train_loss: 0.8854, test_loss: 1.0064, test_f1: 0.5272
 epoch: 53, train_loss: 0.8847, test_loss: 0.9936, test_f1: 0.5333
 epoch: 54, train_loss: 0.8814, test_loss: 1.0047, test_f1: 0.5090
 epoch: 55, train_loss: 0.8762, test_loss: 1.0233, test_f1: 0.5058
 epoch: 56, train_loss: 0.8797, test_loss: 1.0136, test_f1: 0.5246
 epoch: 57, train_loss: 0.8699, test_loss: 1.0134, test_f1: 0.5127
 epoch: 58, train_loss: 0.8875, test_loss: 1.0337, test_f1: 0.5172
 epoch: 59, train_loss: 0.8800, test_loss: 1.0407, test_f1: 0.5074
 epoch: 60, train_loss: 0.8798, test_loss: 1.0210, test_f1: 0.5103
 epoch: 61, train_loss: 0.8679, test_loss: 1.0136, test_f1: 0.5096
 epoch: 62, train_loss: 0.8632, test_loss: 1.0288, test_f1: 0.5026
 epoch: 63, train_loss: 0.8745, test_loss: 1.0236, test_f1: 0.5063
 epoch: 64, train_loss: 0.8764, test_loss: 1.0157, test_f1: 0.5084
 epoch: 65, train_loss: 0.8684, test_loss: 1.0253, test_f1: 0.5191
 epoch: 66, train_loss: 0.8624, test_loss: 1.0264, test_f1: 0.5242
 epoch: 67, train_loss: 0.8649, test_loss: 1.0147, test_f1: 0.5401
 epoch: 68, train_loss: 0.8727, test_loss: 1.0733, test_f1: 0.5187
 epoch: 69, train_loss: 0.8674, test_loss: 1.0556, test_f1: 0.5223
 epoch: 70, train_loss: 0.8669, test_loss: 1.0460, test_f1: 0.5197
 epoch: 71, train_loss: 0.8565, test_loss: 1.0748, test_f1: 0.5205
 epoch: 72, train_loss: 0.8433, test_loss: 1.0322, test_f1: 0.5132
 epoch: 73, train_loss: 0.8480, test_loss: 1.0610, test_f1: 0.5141
 epoch: 74, train_loss: 0.8477, test_loss: 1.0143, test_f1: 0.5301
 epoch: 75, train_loss: 0.8439, test_loss: 0.9924, test_f1: 0.5478
 epoch: 76, train_loss: 0.8412, test_loss: 1.0195, test_f1: 0.5320
 epoch: 77, train_loss: 0.8568, test_loss: 1.0165, test_f1: 0.5220
 epoch: 78, train_loss: 0.8481, test_loss: 1.0499, test_f1: 0.5158
 epoch: 79, train_loss: 0.8418, test_loss: 1.0485, test_f1: 0.5104
 epoch: 80, train_loss: 0.8392, test_loss: 1.0510, test_f1: 0.5285
 epoch: 81, train_loss: 0.8493, test_loss: 1.0164, test_f1: 0.5296
 epoch: 82, train_loss: 0.8352, test_loss: 1.0869, test_f1: 0.5247
 epoch: 83, train_loss: 0.8357, test_loss: 1.0706, test_f1: 0.5353
 epoch: 84, train_loss: 0.8432, test_loss: 1.0599, test_f1: 0.5265
 epoch: 85, train_loss: 0.8443, test_loss: 1.0685, test_f1: 0.5361
 epoch: 86, train_loss: 0.8303, test_loss: 1.0313, test_f1: 0.5165
 epoch: 87, train_loss: 0.8175, test_loss: 1.0450, test_f1: 0.5303
 epoch: 88, train_loss: 0.8396, test_loss: 1.0870, test_f1: 0.5217
 epoch: 89, train_loss: 0.8376, test_loss: 1.1036, test_f1: 0.5307
 epoch: 90, train_loss: 0.8186, test_loss: 1.0884, test_f1: 0.5140
 epoch: 91, train_loss: 0.8190, test_loss: 1.0954, test_f1: 0.5153
 epoch: 92, train_loss: 0.8265, test_loss: 1.0950, test_f1: 0.5185
 epoch: 93, train_loss: 0.8311, test_loss: 1.0305, test_f1: 0.5316
 epoch: 94, train_loss: 0.8231, test_loss: 1.0908, test_f1: 0.5185
 epoch: 95, train_loss: 0.8263, test_loss: 1.0930, test_f1: 0.5270
 epoch: 96, train_loss: 0.8176, test_loss: 1.0858, test_f1: 0.5276
 epoch: 97, train_loss: 0.8140, test_loss: 1.1122, test_f1: 0.5269
 epoch: 98, train_loss: 0.8237, test_loss: 1.0917, test_f1: 0.5225
 epoch: 99, train_loss: 0.8149, test_loss: 1.1279, test_f1: 0.5257
##################ITERATION #4 ****************************************
 epoch: 0, train_loss: 1.3247, test_loss: 1.3439, test_f1: 0.2281
 epoch: 1, train_loss: 1.2688, test_loss: 1.3452, test_f1: 0.2381
 epoch: 2, train_loss: 1.2442, test_loss: 1.3145, test_f1: 0.2326
 epoch: 3, train_loss: 1.2300, test_loss: 1.3014, test_f1: 0.2325
 epoch: 4, train_loss: 1.2149, test_loss: 1.2911, test_f1: 0.2474
 epoch: 5, train_loss: 1.1935, test_loss: 1.2938, test_f1: 0.2498
 epoch: 6, train_loss: 1.1892, test_loss: 1.2920, test_f1: 0.2727
 epoch: 7, train_loss: 1.1874, test_loss: 1.2716, test_f1: 0.2709
 epoch: 8, train_loss: 1.1759, test_loss: 1.2526, test_f1: 0.3180
 epoch: 9, train_loss: 1.1619, test_loss: 1.2456, test_f1: 0.3569
 epoch: 10, train_loss: 1.1415, test_loss: 1.2181, test_f1: 0.3591
 epoch: 11, train_loss: 1.1450, test_loss: 1.2072, test_f1: 0.3906
 epoch: 12, train_loss: 1.1244, test_loss: 1.1975, test_f1: 0.3856
 epoch: 13, train_loss: 1.1144, test_loss: 1.2035, test_f1: 0.4035
 epoch: 14, train_loss: 1.1011, test_loss: 1.1867, test_f1: 0.4053
 epoch: 15, train_loss: 1.0953, test_loss: 1.1724, test_f1: 0.4072
 epoch: 16, train_loss: 1.0932, test_loss: 1.1565, test_f1: 0.4164
 epoch: 17, train_loss: 1.0781, test_loss: 1.1521, test_f1: 0.4270
 epoch: 18, train_loss: 1.0676, test_loss: 1.1353, test_f1: 0.4182
 epoch: 19, train_loss: 1.0594, test_loss: 1.1100, test_f1: 0.4509
 epoch: 20, train_loss: 1.0566, test_loss: 1.1060, test_f1: 0.4373
 epoch: 21, train_loss: 1.0484, test_loss: 1.0870, test_f1: 0.4496
 epoch: 22, train_loss: 1.0208, test_loss: 1.1031, test_f1: 0.4471
 epoch: 23, train_loss: 1.0192, test_loss: 1.0826, test_f1: 0.4569
 epoch: 24, train_loss: 1.0190, test_loss: 1.0953, test_f1: 0.4465
 epoch: 25, train_loss: 0.9984, test_loss: 1.0828, test_f1: 0.4592
 epoch: 26, train_loss: 0.9944, test_loss: 1.0873, test_f1: 0.4804
 epoch: 27, train_loss: 0.9922, test_loss: 1.0616, test_f1: 0.4875
 epoch: 28, train_loss: 0.9897, test_loss: 1.0880, test_f1: 0.4865
 epoch: 29, train_loss: 0.9774, test_loss: 1.0880, test_f1: 0.4798
 epoch: 30, train_loss: 0.9623, test_loss: 1.0376, test_f1: 0.5147
 epoch: 31, train_loss: 0.9702, test_loss: 1.0622, test_f1: 0.4918
 epoch: 32, train_loss: 0.9722, test_loss: 1.0366, test_f1: 0.4990
 epoch: 33, train_loss: 0.9548, test_loss: 1.0371, test_f1: 0.5245
 epoch: 34, train_loss: 0.9477, test_loss: 1.0390, test_f1: 0.5224
 epoch: 35, train_loss: 0.9578, test_loss: 1.0146, test_f1: 0.5111
 epoch: 36, train_loss: 0.9304, test_loss: 1.0281, test_f1: 0.5308
 epoch: 37, train_loss: 0.9345, test_loss: 1.0516, test_f1: 0.5482
 epoch: 38, train_loss: 0.9319, test_loss: 1.0238, test_f1: 0.5511
 epoch: 39, train_loss: 0.9282, test_loss: 0.9833, test_f1: 0.5537
 epoch: 40, train_loss: 0.9206, test_loss: 1.0097, test_f1: 0.5483
 epoch: 41, train_loss: 0.9248, test_loss: 1.0210, test_f1: 0.5587
 epoch: 42, train_loss: 0.9193, test_loss: 0.9967, test_f1: 0.5429
 epoch: 43, train_loss: 0.9094, test_loss: 0.9778, test_f1: 0.5678
 epoch: 44, train_loss: 0.9203, test_loss: 0.9896, test_f1: 0.5568
 epoch: 45, train_loss: 0.9104, test_loss: 1.0408, test_f1: 0.5647
 epoch: 46, train_loss: 0.9085, test_loss: 1.0325, test_f1: 0.5740
 epoch: 47, train_loss: 0.8971, test_loss: 1.0229, test_f1: 0.5622
 epoch: 48, train_loss: 0.8906, test_loss: 0.9826, test_f1: 0.5770
 epoch: 49, train_loss: 0.8984, test_loss: 1.0107, test_f1: 0.5859
 epoch: 50, train_loss: 0.8990, test_loss: 0.9945, test_f1: 0.5885
 epoch: 51, train_loss: 0.8866, test_loss: 0.9838, test_f1: 0.5754
 epoch: 52, train_loss: 0.8774, test_loss: 1.0018, test_f1: 0.5713
 epoch: 53, train_loss: 0.8689, test_loss: 0.9802, test_f1: 0.5689
 epoch: 54, train_loss: 0.8797, test_loss: 0.9887, test_f1: 0.5718
 epoch: 55, train_loss: 0.8806, test_loss: 0.9867, test_f1: 0.5814
 epoch: 56, train_loss: 0.8802, test_loss: 0.9931, test_f1: 0.5809
 epoch: 57, train_loss: 0.8808, test_loss: 0.9943, test_f1: 0.5786
 epoch: 58, train_loss: 0.8740, test_loss: 0.9815, test_f1: 0.5898
 epoch: 59, train_loss: 0.8746, test_loss: 1.0015, test_f1: 0.6140
 epoch: 60, train_loss: 0.8674, test_loss: 1.0050, test_f1: 0.5938
 epoch: 61, train_loss: 0.8743, test_loss: 0.9846, test_f1: 0.6013
 epoch: 62, train_loss: 0.8686, test_loss: 0.9659, test_f1: 0.5994
 epoch: 63, train_loss: 0.8698, test_loss: 0.9976, test_f1: 0.5913
 epoch: 64, train_loss: 0.8617, test_loss: 1.0093, test_f1: 0.5817
 epoch: 65, train_loss: 0.8642, test_loss: 1.0132, test_f1: 0.5701
 epoch: 66, train_loss: 0.8616, test_loss: 1.0049, test_f1: 0.5917
 epoch: 67, train_loss: 0.8638, test_loss: 0.9765, test_f1: 0.5927
 epoch: 68, train_loss: 0.8613, test_loss: 1.0002, test_f1: 0.5766
 epoch: 69, train_loss: 0.8584, test_loss: 0.9855, test_f1: 0.5924
 epoch: 70, train_loss: 0.8620, test_loss: 1.0038, test_f1: 0.5806
 epoch: 71, train_loss: 0.8557, test_loss: 0.9998, test_f1: 0.5789
 epoch: 72, train_loss: 0.8440, test_loss: 0.9663, test_f1: 0.5999
 epoch: 73, train_loss: 0.8399, test_loss: 1.0163, test_f1: 0.5749
 epoch: 74, train_loss: 0.8579, test_loss: 0.9990, test_f1: 0.5875
 epoch: 75, train_loss: 0.8468, test_loss: 0.9752, test_f1: 0.6125
 epoch: 76, train_loss: 0.8614, test_loss: 1.0009, test_f1: 0.6126
 epoch: 77, train_loss: 0.8479, test_loss: 0.9679, test_f1: 0.5945
 epoch: 78, train_loss: 0.8521, test_loss: 0.9545, test_f1: 0.5975
 epoch: 79, train_loss: 0.8451, test_loss: 1.0049, test_f1: 0.5900
 epoch: 80, train_loss: 0.8343, test_loss: 0.9831, test_f1: 0.5868
 epoch: 81, train_loss: 0.8526, test_loss: 0.9739, test_f1: 0.5845
 epoch: 82, train_loss: 0.8487, test_loss: 1.0041, test_f1: 0.5863
 epoch: 83, train_loss: 0.8494, test_loss: 1.0332, test_f1: 0.5748
 epoch: 84, train_loss: 0.8292, test_loss: 1.0027, test_f1: 0.6077
 epoch: 85, train_loss: 0.8384, test_loss: 1.0065, test_f1: 0.5830
 epoch: 86, train_loss: 0.8470, test_loss: 1.0085, test_f1: 0.5756
 epoch: 87, train_loss: 0.8256, test_loss: 1.0113, test_f1: 0.5702
 epoch: 88, train_loss: 0.8192, test_loss: 1.0217, test_f1: 0.5820
 epoch: 89, train_loss: 0.8415, test_loss: 1.0391, test_f1: 0.5871
 epoch: 90, train_loss: 0.8194, test_loss: 1.0070, test_f1: 0.5960
 epoch: 91, train_loss: 0.8343, test_loss: 0.9925, test_f1: 0.5791
 epoch: 92, train_loss: 0.8108, test_loss: 1.0053, test_f1: 0.5813
 epoch: 93, train_loss: 0.8367, test_loss: 0.9738, test_f1: 0.5862
 epoch: 94, train_loss: 0.8220, test_loss: 0.9895, test_f1: 0.5885
 epoch: 95, train_loss: 0.8266, test_loss: 1.0284, test_f1: 0.5870
 epoch: 96, train_loss: 0.8189, test_loss: 0.9943, test_f1: 0.6045
 epoch: 97, train_loss: 0.8166, test_loss: 1.0232, test_f1: 0.5860
 epoch: 98, train_loss: 0.8226, test_loss: 0.9793, test_f1: 0.5871
 epoch: 99, train_loss: 0.8203, test_loss: 0.9940, test_f1: 0.6014
##################ITERATION #5 ****************************************
 epoch: 0, train_loss: 1.3061, test_loss: 1.3309, test_f1: 0.2774
 epoch: 1, train_loss: 1.2650, test_loss: 1.3231, test_f1: 0.2708
 epoch: 2, train_loss: 1.2531, test_loss: 1.3011, test_f1: 0.2664
 epoch: 3, train_loss: 1.2321, test_loss: 1.2956, test_f1: 0.2648
 epoch: 4, train_loss: 1.2154, test_loss: 1.2846, test_f1: 0.2651
 epoch: 5, train_loss: 1.1992, test_loss: 1.2673, test_f1: 0.2534
 epoch: 6, train_loss: 1.1860, test_loss: 1.2619, test_f1: 0.2991
 epoch: 7, train_loss: 1.1807, test_loss: 1.2401, test_f1: 0.3105
 epoch: 8, train_loss: 1.1604, test_loss: 1.2346, test_f1: 0.3272
 epoch: 9, train_loss: 1.1595, test_loss: 1.2278, test_f1: 0.3486
 epoch: 10, train_loss: 1.1425, test_loss: 1.2245, test_f1: 0.3733
 epoch: 11, train_loss: 1.1322, test_loss: 1.2344, test_f1: 0.3801
 epoch: 12, train_loss: 1.1231, test_loss: 1.2002, test_f1: 0.4121
 epoch: 13, train_loss: 1.1051, test_loss: 1.1848, test_f1: 0.4280
 epoch: 14, train_loss: 1.1043, test_loss: 1.1699, test_f1: 0.4494
 epoch: 15, train_loss: 1.0952, test_loss: 1.1799, test_f1: 0.4506
 epoch: 16, train_loss: 1.0813, test_loss: 1.1483, test_f1: 0.4745
 epoch: 17, train_loss: 1.0652, test_loss: 1.1361, test_f1: 0.4686
 epoch: 18, train_loss: 1.0564, test_loss: 1.1447, test_f1: 0.4123
 epoch: 19, train_loss: 1.0456, test_loss: 1.1372, test_f1: 0.4754
 epoch: 20, train_loss: 1.0517, test_loss: 1.1182, test_f1: 0.4514
 epoch: 21, train_loss: 1.0289, test_loss: 1.1221, test_f1: 0.4759
 epoch: 22, train_loss: 1.0220, test_loss: 1.1173, test_f1: 0.4960
 epoch: 23, train_loss: 1.0207, test_loss: 1.1383, test_f1: 0.4753
 epoch: 24, train_loss: 0.9931, test_loss: 1.1293, test_f1: 0.4889
 epoch: 25, train_loss: 1.0048, test_loss: 1.1068, test_f1: 0.4909
 epoch: 26, train_loss: 1.0004, test_loss: 1.1152, test_f1: 0.4884
 epoch: 27, train_loss: 0.9760, test_loss: 1.0932, test_f1: 0.4986
 epoch: 28, train_loss: 0.9796, test_loss: 1.0931, test_f1: 0.4961
 epoch: 29, train_loss: 0.9869, test_loss: 1.0848, test_f1: 0.5095
 epoch: 30, train_loss: 0.9556, test_loss: 1.0771, test_f1: 0.5014
 epoch: 31, train_loss: 0.9645, test_loss: 1.1222, test_f1: 0.5078
 epoch: 32, train_loss: 0.9655, test_loss: 1.1527, test_f1: 0.5068
 epoch: 33, train_loss: 0.9482, test_loss: 1.0804, test_f1: 0.5140
 epoch: 34, train_loss: 0.9520, test_loss: 1.0817, test_f1: 0.5091
 epoch: 35, train_loss: 0.9514, test_loss: 1.0558, test_f1: 0.5214
 epoch: 36, train_loss: 0.9508, test_loss: 1.0628, test_f1: 0.5204
 epoch: 37, train_loss: 0.9353, test_loss: 1.0478, test_f1: 0.5249
 epoch: 38, train_loss: 0.9331, test_loss: 1.0482, test_f1: 0.5277
 epoch: 39, train_loss: 0.9295, test_loss: 1.0473, test_f1: 0.5150
 epoch: 40, train_loss: 0.9251, test_loss: 1.0723, test_f1: 0.5153
 epoch: 41, train_loss: 0.9269, test_loss: 1.0521, test_f1: 0.5218
 epoch: 42, train_loss: 0.9093, test_loss: 1.0560, test_f1: 0.5162
 epoch: 43, train_loss: 0.9086, test_loss: 1.0306, test_f1: 0.5098
 epoch: 44, train_loss: 0.9174, test_loss: 1.0434, test_f1: 0.5337
 epoch: 45, train_loss: 0.9107, test_loss: 1.0543, test_f1: 0.5286
 epoch: 46, train_loss: 0.9024, test_loss: 1.0338, test_f1: 0.5311
 epoch: 47, train_loss: 0.9113, test_loss: 1.0527, test_f1: 0.5540
 epoch: 48, train_loss: 0.9002, test_loss: 1.0585, test_f1: 0.5202
 epoch: 49, train_loss: 0.8929, test_loss: 1.0375, test_f1: 0.5296
 epoch: 50, train_loss: 0.8905, test_loss: 1.0556, test_f1: 0.5276
 epoch: 51, train_loss: 0.8839, test_loss: 1.0530, test_f1: 0.5262
 epoch: 52, train_loss: 0.8881, test_loss: 1.0771, test_f1: 0.5324
 epoch: 53, train_loss: 0.8887, test_loss: 1.0468, test_f1: 0.5316
 epoch: 54, train_loss: 0.8843, test_loss: 1.0746, test_f1: 0.5300
 epoch: 55, train_loss: 0.8768, test_loss: 1.0295, test_f1: 0.5378
 epoch: 56, train_loss: 0.8810, test_loss: 1.0411, test_f1: 0.5289
 epoch: 57, train_loss: 0.8751, test_loss: 1.0438, test_f1: 0.5363
 epoch: 58, train_loss: 0.8670, test_loss: 1.0437, test_f1: 0.5424
 epoch: 59, train_loss: 0.8703, test_loss: 1.0259, test_f1: 0.5455
 epoch: 60, train_loss: 0.8823, test_loss: 1.0295, test_f1: 0.5511
 epoch: 61, train_loss: 0.8690, test_loss: 1.0214, test_f1: 0.5547
 epoch: 62, train_loss: 0.8685, test_loss: 1.0289, test_f1: 0.5507
 epoch: 63, train_loss: 0.8837, test_loss: 1.0247, test_f1: 0.5508
 epoch: 64, train_loss: 0.8648, test_loss: 1.0246, test_f1: 0.5494
 epoch: 65, train_loss: 0.8631, test_loss: 1.0287, test_f1: 0.5504
 epoch: 66, train_loss: 0.8508, test_loss: 1.0317, test_f1: 0.5649
 epoch: 67, train_loss: 0.8634, test_loss: 1.0212, test_f1: 0.5584
 epoch: 68, train_loss: 0.8587, test_loss: 1.0188, test_f1: 0.5528
 epoch: 69, train_loss: 0.8621, test_loss: 1.0487, test_f1: 0.5480
 epoch: 70, train_loss: 0.8551, test_loss: 1.0318, test_f1: 0.5620
 epoch: 71, train_loss: 0.8577, test_loss: 1.0297, test_f1: 0.5635
 epoch: 72, train_loss: 0.8485, test_loss: 1.0148, test_f1: 0.5564
 epoch: 73, train_loss: 0.8481, test_loss: 1.0407, test_f1: 0.5391
 epoch: 74, train_loss: 0.8611, test_loss: 1.0240, test_f1: 0.5503
 epoch: 75, train_loss: 0.8632, test_loss: 1.0334, test_f1: 0.5453
 epoch: 76, train_loss: 0.8524, test_loss: 1.0730, test_f1: 0.5410
 epoch: 77, train_loss: 0.8497, test_loss: 1.0478, test_f1: 0.5515
 epoch: 78, train_loss: 0.8484, test_loss: 1.0290, test_f1: 0.5667
 epoch: 79, train_loss: 0.8364, test_loss: 1.0355, test_f1: 0.5659
 epoch: 80, train_loss: 0.8524, test_loss: 1.0287, test_f1: 0.5648
 epoch: 81, train_loss: 0.8348, test_loss: 1.0476, test_f1: 0.5466
 epoch: 82, train_loss: 0.8507, test_loss: 1.0360, test_f1: 0.5490
 epoch: 83, train_loss: 0.8423, test_loss: 1.0732, test_f1: 0.5523
 epoch: 84, train_loss: 0.8311, test_loss: 1.0333, test_f1: 0.5521
 epoch: 85, train_loss: 0.8403, test_loss: 1.0306, test_f1: 0.5615
 epoch: 86, train_loss: 0.8373, test_loss: 1.0211, test_f1: 0.5694
 epoch: 87, train_loss: 0.8446, test_loss: 1.0492, test_f1: 0.5430
 epoch: 88, train_loss: 0.8295, test_loss: 1.0253, test_f1: 0.5655
 epoch: 89, train_loss: 0.8296, test_loss: 1.0368, test_f1: 0.5404
 epoch: 90, train_loss: 0.8326, test_loss: 1.0403, test_f1: 0.5647
 epoch: 91, train_loss: 0.8353, test_loss: 1.0347, test_f1: 0.5568
 epoch: 92, train_loss: 0.8226, test_loss: 1.0352, test_f1: 0.5413
 epoch: 93, train_loss: 0.8250, test_loss: 1.0414, test_f1: 0.5471
 epoch: 94, train_loss: 0.8209, test_loss: 1.0399, test_f1: 0.5566
 epoch: 95, train_loss: 0.8408, test_loss: 1.0340, test_f1: 0.5618
 epoch: 96, train_loss: 0.8126, test_loss: 1.0287, test_f1: 0.5726
 epoch: 97, train_loss: 0.8270, test_loss: 1.0616, test_f1: 0.5545
 epoch: 98, train_loss: 0.8044, test_loss: 1.0436, test_f1: 0.5763
 epoch: 99, train_loss: 0.8398, test_loss: 1.0353, test_f1: 0.5580
##################ITERATION #6 ****************************************
 epoch: 0, train_loss: 1.3091, test_loss: 1.3150, test_f1: 0.2430
 epoch: 1, train_loss: 1.2246, test_loss: 1.2637, test_f1: 0.2631
 epoch: 2, train_loss: 1.1974, test_loss: 1.2523, test_f1: 0.3406
 epoch: 3, train_loss: 1.1775, test_loss: 1.2196, test_f1: 0.3627
 epoch: 4, train_loss: 1.1574, test_loss: 1.1919, test_f1: 0.3650
 epoch: 5, train_loss: 1.1242, test_loss: 1.1851, test_f1: 0.3519
 epoch: 6, train_loss: 1.1296, test_loss: 1.1633, test_f1: 0.3677
 epoch: 7, train_loss: 1.1115, test_loss: 1.1521, test_f1: 0.3865
 epoch: 8, train_loss: 1.0855, test_loss: 1.1411, test_f1: 0.4159
 epoch: 9, train_loss: 1.0839, test_loss: 1.1295, test_f1: 0.4429
 epoch: 10, train_loss: 1.0789, test_loss: 1.1177, test_f1: 0.4441
 epoch: 11, train_loss: 1.0647, test_loss: 1.1093, test_f1: 0.4217
 epoch: 12, train_loss: 1.0605, test_loss: 1.1005, test_f1: 0.4278
 epoch: 13, train_loss: 1.0485, test_loss: 1.0902, test_f1: 0.4262
 epoch: 14, train_loss: 1.0373, test_loss: 1.0955, test_f1: 0.4233
 epoch: 15, train_loss: 1.0387, test_loss: 1.0869, test_f1: 0.4140
 epoch: 16, train_loss: 1.0273, test_loss: 1.0932, test_f1: 0.4026
 epoch: 17, train_loss: 1.0207, test_loss: 1.0942, test_f1: 0.4159
 epoch: 18, train_loss: 1.0213, test_loss: 1.0892, test_f1: 0.4121
 epoch: 19, train_loss: 1.0087, test_loss: 1.0802, test_f1: 0.4267
 epoch: 20, train_loss: 0.9961, test_loss: 1.0703, test_f1: 0.4434
 epoch: 21, train_loss: 0.9873, test_loss: 1.0856, test_f1: 0.4345
 epoch: 22, train_loss: 1.0015, test_loss: 1.0861, test_f1: 0.4370
 epoch: 23, train_loss: 0.9892, test_loss: 1.0998, test_f1: 0.4453
 epoch: 24, train_loss: 0.9769, test_loss: 1.0889, test_f1: 0.4506
 epoch: 25, train_loss: 0.9765, test_loss: 1.0838, test_f1: 0.4217
 epoch: 26, train_loss: 0.9786, test_loss: 1.0746, test_f1: 0.4420
 epoch: 27, train_loss: 0.9698, test_loss: 1.0945, test_f1: 0.4508
 epoch: 28, train_loss: 0.9656, test_loss: 1.0971, test_f1: 0.4566
 epoch: 29, train_loss: 0.9674, test_loss: 1.0982, test_f1: 0.4663
 epoch: 30, train_loss: 0.9515, test_loss: 1.0696, test_f1: 0.4642
 epoch: 31, train_loss: 0.9613, test_loss: 1.0947, test_f1: 0.4738
 epoch: 32, train_loss: 0.9517, test_loss: 1.0285, test_f1: 0.4941
 epoch: 33, train_loss: 0.9457, test_loss: 1.0528, test_f1: 0.4667
 epoch: 34, train_loss: 0.9466, test_loss: 1.0708, test_f1: 0.4912
 epoch: 35, train_loss: 0.9329, test_loss: 1.0903, test_f1: 0.4925
 epoch: 36, train_loss: 0.9246, test_loss: 1.0724, test_f1: 0.4839
 epoch: 37, train_loss: 0.9304, test_loss: 1.0676, test_f1: 0.4810
 epoch: 38, train_loss: 0.9322, test_loss: 1.0867, test_f1: 0.4871
 epoch: 39, train_loss: 0.9269, test_loss: 1.0404, test_f1: 0.4957
 epoch: 40, train_loss: 0.9365, test_loss: 1.1292, test_f1: 0.4936
 epoch: 41, train_loss: 0.9273, test_loss: 1.1003, test_f1: 0.4994
 epoch: 42, train_loss: 0.9242, test_loss: 1.0698, test_f1: 0.4965
 epoch: 43, train_loss: 0.9241, test_loss: 1.0740, test_f1: 0.5101
 epoch: 44, train_loss: 0.9123, test_loss: 1.0126, test_f1: 0.5077
 epoch: 45, train_loss: 0.9112, test_loss: 1.0826, test_f1: 0.4980
 epoch: 46, train_loss: 0.9096, test_loss: 1.0894, test_f1: 0.5126
 epoch: 47, train_loss: 0.9012, test_loss: 1.0592, test_f1: 0.5182
 epoch: 48, train_loss: 0.8942, test_loss: 1.1247, test_f1: 0.5156
 epoch: 49, train_loss: 0.8916, test_loss: 1.1855, test_f1: 0.5169
 epoch: 50, train_loss: 0.8940, test_loss: 1.1725, test_f1: 0.5117
 epoch: 51, train_loss: 0.9001, test_loss: 1.1691, test_f1: 0.5169
 epoch: 52, train_loss: 0.8985, test_loss: 1.1128, test_f1: 0.5213
 epoch: 53, train_loss: 0.8921, test_loss: 1.1546, test_f1: 0.5349
 epoch: 54, train_loss: 0.8950, test_loss: 1.1550, test_f1: 0.5248
 epoch: 55, train_loss: 0.8792, test_loss: 1.1722, test_f1: 0.5224
 epoch: 56, train_loss: 0.8864, test_loss: 1.2308, test_f1: 0.5128
 epoch: 57, train_loss: 0.8836, test_loss: 1.2298, test_f1: 0.5230
 epoch: 58, train_loss: 0.8818, test_loss: 1.2756, test_f1: 0.5254
 epoch: 59, train_loss: 0.8884, test_loss: 1.1922, test_f1: 0.5327
 epoch: 60, train_loss: 0.8790, test_loss: 1.2004, test_f1: 0.5266
 epoch: 61, train_loss: 0.8718, test_loss: 1.2181, test_f1: 0.5233
 epoch: 62, train_loss: 0.8772, test_loss: 1.1998, test_f1: 0.5114
 epoch: 63, train_loss: 0.8722, test_loss: 1.2668, test_f1: 0.5243
 epoch: 64, train_loss: 0.8709, test_loss: 1.2267, test_f1: 0.5305
 epoch: 65, train_loss: 0.8761, test_loss: 1.2032, test_f1: 0.5130
 epoch: 66, train_loss: 0.8754, test_loss: 1.2008, test_f1: 0.5328
 epoch: 67, train_loss: 0.8765, test_loss: 1.2776, test_f1: 0.5207
 epoch: 68, train_loss: 0.8729, test_loss: 1.2113, test_f1: 0.5233
 epoch: 69, train_loss: 0.8744, test_loss: 1.1263, test_f1: 0.5068
 epoch: 70, train_loss: 0.8609, test_loss: 1.2061, test_f1: 0.5161
 epoch: 71, train_loss: 0.8664, test_loss: 1.2462, test_f1: 0.5341
 epoch: 72, train_loss: 0.8698, test_loss: 1.2653, test_f1: 0.5257
 epoch: 73, train_loss: 0.8690, test_loss: 1.2211, test_f1: 0.5292
 epoch: 74, train_loss: 0.8634, test_loss: 1.1809, test_f1: 0.5307
 epoch: 75, train_loss: 0.8645, test_loss: 1.2223, test_f1: 0.5293
 epoch: 76, train_loss: 0.8591, test_loss: 1.1754, test_f1: 0.5220
 epoch: 77, train_loss: 0.8426, test_loss: 1.2404, test_f1: 0.5241
 epoch: 78, train_loss: 0.8533, test_loss: 1.2127, test_f1: 0.5247
 epoch: 79, train_loss: 0.8562, test_loss: 1.2667, test_f1: 0.5338
 epoch: 80, train_loss: 0.8536, test_loss: 1.3095, test_f1: 0.5127
 epoch: 81, train_loss: 0.8471, test_loss: 1.3299, test_f1: 0.5267
 epoch: 82, train_loss: 0.8619, test_loss: 1.2481, test_f1: 0.5156
 epoch: 83, train_loss: 0.8459, test_loss: 1.3165, test_f1: 0.5110
 epoch: 84, train_loss: 0.8427, test_loss: 1.2569, test_f1: 0.5071
 epoch: 85, train_loss: 0.8522, test_loss: 1.2463, test_f1: 0.5216
 epoch: 86, train_loss: 0.8535, test_loss: 1.3140, test_f1: 0.5193
 epoch: 87, train_loss: 0.8523, test_loss: 1.3160, test_f1: 0.5145
 epoch: 88, train_loss: 0.8458, test_loss: 1.1865, test_f1: 0.5302
 epoch: 89, train_loss: 0.8301, test_loss: 1.3439, test_f1: 0.5195
 epoch: 90, train_loss: 0.8505, test_loss: 1.2754, test_f1: 0.5208
 epoch: 91, train_loss: 0.8323, test_loss: 1.3201, test_f1: 0.5137
 epoch: 92, train_loss: 0.8474, test_loss: 1.3057, test_f1: 0.5218
 epoch: 93, train_loss: 0.8364, test_loss: 1.2315, test_f1: 0.5125
 epoch: 94, train_loss: 0.8325, test_loss: 1.2556, test_f1: 0.5152
 epoch: 95, train_loss: 0.8375, test_loss: 1.1922, test_f1: 0.5386
 epoch: 96, train_loss: 0.8314, test_loss: 1.3184, test_f1: 0.5208
 epoch: 97, train_loss: 0.8278, test_loss: 1.2581, test_f1: 0.5241
 epoch: 98, train_loss: 0.8355, test_loss: 1.2260, test_f1: 0.5221
 epoch: 99, train_loss: 0.8216, test_loss: 1.4117, test_f1: 0.5303
##################ITERATION #7 ****************************************
 epoch: 0, train_loss: 1.3168, test_loss: 1.3680, test_f1: 0.2349
 epoch: 1, train_loss: 1.2466, test_loss: 1.2985, test_f1: 0.2444
 epoch: 2, train_loss: 1.2146, test_loss: 1.2801, test_f1: 0.2743
 epoch: 3, train_loss: 1.1841, test_loss: 1.2617, test_f1: 0.3191
 epoch: 4, train_loss: 1.1787, test_loss: 1.2432, test_f1: 0.3517
 epoch: 5, train_loss: 1.1661, test_loss: 1.2264, test_f1: 0.3491
 epoch: 6, train_loss: 1.1333, test_loss: 1.2117, test_f1: 0.3305
 epoch: 7, train_loss: 1.1203, test_loss: 1.1940, test_f1: 0.3257
 epoch: 8, train_loss: 1.1171, test_loss: 1.1919, test_f1: 0.3265
 epoch: 9, train_loss: 1.1031, test_loss: 1.1815, test_f1: 0.3372
 epoch: 10, train_loss: 1.0895, test_loss: 1.1726, test_f1: 0.3217
 epoch: 11, train_loss: 1.0758, test_loss: 1.1652, test_f1: 0.3573
 epoch: 12, train_loss: 1.0694, test_loss: 1.1528, test_f1: 0.3318
 epoch: 13, train_loss: 1.0559, test_loss: 1.1454, test_f1: 0.3360
 epoch: 14, train_loss: 1.0577, test_loss: 1.1325, test_f1: 0.3376
 epoch: 15, train_loss: 1.0320, test_loss: 1.1266, test_f1: 0.3783
 epoch: 16, train_loss: 1.0374, test_loss: 1.1195, test_f1: 0.3931
 epoch: 17, train_loss: 1.0153, test_loss: 1.1150, test_f1: 0.4024
 epoch: 18, train_loss: 1.0248, test_loss: 1.1058, test_f1: 0.4076
 epoch: 19, train_loss: 1.0114, test_loss: 1.1039, test_f1: 0.4261
 epoch: 20, train_loss: 0.9974, test_loss: 1.1018, test_f1: 0.4487
 epoch: 21, train_loss: 0.9965, test_loss: 1.0933, test_f1: 0.4508
 epoch: 22, train_loss: 0.9956, test_loss: 1.0854, test_f1: 0.4446
 epoch: 23, train_loss: 0.9853, test_loss: 1.0811, test_f1: 0.4473
 epoch: 24, train_loss: 0.9838, test_loss: 1.0776, test_f1: 0.4471
 epoch: 25, train_loss: 0.9719, test_loss: 1.0789, test_f1: 0.4716
 epoch: 26, train_loss: 0.9700, test_loss: 1.0863, test_f1: 0.4673
 epoch: 27, train_loss: 0.9683, test_loss: 1.0731, test_f1: 0.4515
 epoch: 28, train_loss: 0.9531, test_loss: 1.0681, test_f1: 0.4675
 epoch: 29, train_loss: 0.9553, test_loss: 1.0738, test_f1: 0.4807
 epoch: 30, train_loss: 0.9522, test_loss: 1.0809, test_f1: 0.4811
 epoch: 31, train_loss: 0.9365, test_loss: 1.0744, test_f1: 0.4810
 epoch: 32, train_loss: 0.9457, test_loss: 1.0786, test_f1: 0.4789
 epoch: 33, train_loss: 0.9369, test_loss: 1.0690, test_f1: 0.5055
 epoch: 34, train_loss: 0.9346, test_loss: 1.0672, test_f1: 0.4808
 epoch: 35, train_loss: 0.9247, test_loss: 1.0686, test_f1: 0.5031
 epoch: 36, train_loss: 0.9261, test_loss: 1.0665, test_f1: 0.4763
 epoch: 37, train_loss: 0.9182, test_loss: 1.0550, test_f1: 0.4968
 epoch: 38, train_loss: 0.9120, test_loss: 1.0607, test_f1: 0.4898
 epoch: 39, train_loss: 0.9110, test_loss: 1.0623, test_f1: 0.4904
 epoch: 40, train_loss: 0.9021, test_loss: 1.0657, test_f1: 0.4948
 epoch: 41, train_loss: 0.9047, test_loss: 1.0760, test_f1: 0.4948
 epoch: 42, train_loss: 0.8998, test_loss: 1.0649, test_f1: 0.4903
 epoch: 43, train_loss: 0.8925, test_loss: 1.0520, test_f1: 0.4961
 epoch: 44, train_loss: 0.8971, test_loss: 1.0823, test_f1: 0.4873
 epoch: 45, train_loss: 0.8928, test_loss: 1.0610, test_f1: 0.5071
 epoch: 46, train_loss: 0.8872, test_loss: 1.0538, test_f1: 0.5111
 epoch: 47, train_loss: 0.8819, test_loss: 1.0514, test_f1: 0.5194
 epoch: 48, train_loss: 0.8714, test_loss: 1.0707, test_f1: 0.5057
 epoch: 49, train_loss: 0.8665, test_loss: 1.0485, test_f1: 0.5128
 epoch: 50, train_loss: 0.8648, test_loss: 1.0281, test_f1: 0.5129
 epoch: 51, train_loss: 0.8589, test_loss: 1.0336, test_f1: 0.5145
 epoch: 52, train_loss: 0.8775, test_loss: 1.0361, test_f1: 0.5155
 epoch: 53, train_loss: 0.8688, test_loss: 1.0535, test_f1: 0.5021
 epoch: 54, train_loss: 0.8633, test_loss: 1.0381, test_f1: 0.5076
 epoch: 55, train_loss: 0.8654, test_loss: 1.0483, test_f1: 0.5150
 epoch: 56, train_loss: 0.8525, test_loss: 1.0452, test_f1: 0.5097
 epoch: 57, train_loss: 0.8454, test_loss: 1.0482, test_f1: 0.5147
 epoch: 58, train_loss: 0.8670, test_loss: 1.0524, test_f1: 0.5019
 epoch: 59, train_loss: 0.8412, test_loss: 1.0435, test_f1: 0.5217
 epoch: 60, train_loss: 0.8408, test_loss: 1.0424, test_f1: 0.5198
 epoch: 61, train_loss: 0.8622, test_loss: 1.0471, test_f1: 0.4988
 epoch: 62, train_loss: 0.8484, test_loss: 1.0454, test_f1: 0.5101
 epoch: 63, train_loss: 0.8499, test_loss: 1.0372, test_f1: 0.5126
 epoch: 64, train_loss: 0.8424, test_loss: 1.0440, test_f1: 0.5029
 epoch: 65, train_loss: 0.8482, test_loss: 1.0425, test_f1: 0.5123
 epoch: 66, train_loss: 0.8428, test_loss: 1.0393, test_f1: 0.5040
 epoch: 67, train_loss: 0.8397, test_loss: 1.0412, test_f1: 0.5098
 epoch: 68, train_loss: 0.8375, test_loss: 1.0479, test_f1: 0.5151
 epoch: 69, train_loss: 0.8467, test_loss: 1.0419, test_f1: 0.5055
 epoch: 70, train_loss: 0.8352, test_loss: 1.0404, test_f1: 0.5107
 epoch: 71, train_loss: 0.8345, test_loss: 1.0428, test_f1: 0.5201
 epoch: 72, train_loss: 0.8242, test_loss: 1.0452, test_f1: 0.5013
 epoch: 73, train_loss: 0.8185, test_loss: 1.0355, test_f1: 0.5164
 epoch: 74, train_loss: 0.8208, test_loss: 1.0338, test_f1: 0.5300
 epoch: 75, train_loss: 0.8227, test_loss: 1.0417, test_f1: 0.5208
 epoch: 76, train_loss: 0.8312, test_loss: 1.0304, test_f1: 0.5255
 epoch: 77, train_loss: 0.8117, test_loss: 1.0368, test_f1: 0.5307
 epoch: 78, train_loss: 0.8209, test_loss: 1.0286, test_f1: 0.5215
 epoch: 79, train_loss: 0.8077, test_loss: 1.0288, test_f1: 0.5211
 epoch: 80, train_loss: 0.8174, test_loss: 1.0292, test_f1: 0.5141
 epoch: 81, train_loss: 0.8199, test_loss: 1.0345, test_f1: 0.5225
 epoch: 82, train_loss: 0.8155, test_loss: 1.0251, test_f1: 0.5168
 epoch: 83, train_loss: 0.8152, test_loss: 1.0321, test_f1: 0.5118
 epoch: 84, train_loss: 0.8200, test_loss: 1.0256, test_f1: 0.5141
 epoch: 85, train_loss: 0.8022, test_loss: 1.0280, test_f1: 0.5326
 epoch: 86, train_loss: 0.8026, test_loss: 1.0149, test_f1: 0.5571
 epoch: 87, train_loss: 0.8178, test_loss: 1.0180, test_f1: 0.5644
 epoch: 88, train_loss: 0.8072, test_loss: 1.0157, test_f1: 0.5338
 epoch: 89, train_loss: 0.7966, test_loss: 1.0185, test_f1: 0.5323
 epoch: 90, train_loss: 0.8004, test_loss: 1.0121, test_f1: 0.5208
 epoch: 91, train_loss: 0.7920, test_loss: 1.0168, test_f1: 0.5535
 epoch: 92, train_loss: 0.8046, test_loss: 1.0241, test_f1: 0.5206
 epoch: 93, train_loss: 0.7885, test_loss: 1.0262, test_f1: 0.5409
 epoch: 94, train_loss: 0.8025, test_loss: 1.0156, test_f1: 0.5391
 epoch: 95, train_loss: 0.8066, test_loss: 1.0282, test_f1: 0.5212
 epoch: 96, train_loss: 0.7860, test_loss: 1.0117, test_f1: 0.5456
 epoch: 97, train_loss: 0.7781, test_loss: 1.0126, test_f1: 0.5495
 epoch: 98, train_loss: 0.7941, test_loss: 1.0067, test_f1: 0.5667
 epoch: 99, train_loss: 0.7748, test_loss: 1.0216, test_f1: 0.5501
##################ITERATION #8 ****************************************
 epoch: 0, train_loss: 1.3423, test_loss: 1.3803, test_f1: 0.2761
 epoch: 1, train_loss: 1.2422, test_loss: 1.2835, test_f1: 0.2368
 epoch: 2, train_loss: 1.2159, test_loss: 1.2542, test_f1: 0.2595
 epoch: 3, train_loss: 1.1933, test_loss: 1.2390, test_f1: 0.2861
 epoch: 4, train_loss: 1.1876, test_loss: 1.2199, test_f1: 0.3121
 epoch: 5, train_loss: 1.1673, test_loss: 1.2070, test_f1: 0.3454
 epoch: 6, train_loss: 1.1461, test_loss: 1.1928, test_f1: 0.3512
 epoch: 7, train_loss: 1.1386, test_loss: 1.1746, test_f1: 0.3539
 epoch: 8, train_loss: 1.1080, test_loss: 1.1577, test_f1: 0.3725
 epoch: 9, train_loss: 1.1071, test_loss: 1.1560, test_f1: 0.4109
 epoch: 10, train_loss: 1.0939, test_loss: 1.1582, test_f1: 0.4081
 epoch: 11, train_loss: 1.0898, test_loss: 1.1554, test_f1: 0.3954
 epoch: 12, train_loss: 1.0824, test_loss: 1.1408, test_f1: 0.4115
 epoch: 13, train_loss: 1.0590, test_loss: 1.1378, test_f1: 0.4218
 epoch: 14, train_loss: 1.0434, test_loss: 1.1491, test_f1: 0.4149
 epoch: 15, train_loss: 1.0508, test_loss: 1.1310, test_f1: 0.4257
 epoch: 16, train_loss: 1.0482, test_loss: 1.1295, test_f1: 0.4416
 epoch: 17, train_loss: 1.0312, test_loss: 1.1159, test_f1: 0.4454
 epoch: 18, train_loss: 1.0177, test_loss: 1.1086, test_f1: 0.4442
 epoch: 19, train_loss: 1.0254, test_loss: 1.1127, test_f1: 0.4520
 epoch: 20, train_loss: 1.0057, test_loss: 1.1090, test_f1: 0.4656
 epoch: 21, train_loss: 0.9986, test_loss: 1.0808, test_f1: 0.4683
 epoch: 22, train_loss: 1.0036, test_loss: 1.1065, test_f1: 0.4597
 epoch: 23, train_loss: 1.0103, test_loss: 1.0939, test_f1: 0.4767
 epoch: 24, train_loss: 0.9873, test_loss: 1.1068, test_f1: 0.4915
 epoch: 25, train_loss: 0.9810, test_loss: 1.1057, test_f1: 0.4799
 epoch: 26, train_loss: 0.9895, test_loss: 1.0916, test_f1: 0.5112
 epoch: 27, train_loss: 0.9725, test_loss: 1.0864, test_f1: 0.4928
 epoch: 28, train_loss: 0.9653, test_loss: 1.0831, test_f1: 0.4893
 epoch: 29, train_loss: 0.9547, test_loss: 1.0630, test_f1: 0.4894
 epoch: 30, train_loss: 0.9571, test_loss: 1.0745, test_f1: 0.4961
 epoch: 31, train_loss: 0.9542, test_loss: 1.0702, test_f1: 0.4817
 epoch: 32, train_loss: 0.9455, test_loss: 1.0507, test_f1: 0.5037
 epoch: 33, train_loss: 0.9417, test_loss: 1.0468, test_f1: 0.5048
 epoch: 34, train_loss: 0.9360, test_loss: 1.0584, test_f1: 0.4902
 epoch: 35, train_loss: 0.9238, test_loss: 1.0668, test_f1: 0.4663
 epoch: 36, train_loss: 0.9343, test_loss: 1.0305, test_f1: 0.4995
 epoch: 37, train_loss: 0.9310, test_loss: 1.0419, test_f1: 0.5148
 epoch: 38, train_loss: 0.9153, test_loss: 1.0311, test_f1: 0.5278
 epoch: 39, train_loss: 0.9251, test_loss: 1.0038, test_f1: 0.5234
 epoch: 40, train_loss: 0.9129, test_loss: 1.0329, test_f1: 0.5219
 epoch: 41, train_loss: 0.9048, test_loss: 1.0395, test_f1: 0.5196
 epoch: 42, train_loss: 0.9056, test_loss: 1.0704, test_f1: 0.5075
 epoch: 43, train_loss: 0.8951, test_loss: 1.0254, test_f1: 0.5255
 epoch: 44, train_loss: 0.8938, test_loss: 1.0374, test_f1: 0.5105
 epoch: 45, train_loss: 0.8940, test_loss: 1.0281, test_f1: 0.5123
 epoch: 46, train_loss: 0.8868, test_loss: 1.0243, test_f1: 0.5277
 epoch: 47, train_loss: 0.8777, test_loss: 1.0340, test_f1: 0.5141
 epoch: 48, train_loss: 0.8852, test_loss: 1.0319, test_f1: 0.5322
 epoch: 49, train_loss: 0.8697, test_loss: 1.0348, test_f1: 0.5123
 epoch: 50, train_loss: 0.8644, test_loss: 1.0262, test_f1: 0.5241
 epoch: 51, train_loss: 0.8660, test_loss: 1.0444, test_f1: 0.5093
 epoch: 52, train_loss: 0.8610, test_loss: 1.0250, test_f1: 0.5099
 epoch: 53, train_loss: 0.8596, test_loss: 1.0359, test_f1: 0.5517
 epoch: 54, train_loss: 0.8556, test_loss: 1.0544, test_f1: 0.5379
 epoch: 55, train_loss: 0.8573, test_loss: 1.0342, test_f1: 0.5161
 epoch: 56, train_loss: 0.8521, test_loss: 1.0181, test_f1: 0.5416
 epoch: 57, train_loss: 0.8517, test_loss: 1.0387, test_f1: 0.5218
 epoch: 58, train_loss: 0.8534, test_loss: 1.0340, test_f1: 0.5483
 epoch: 59, train_loss: 0.8342, test_loss: 1.0399, test_f1: 0.5321
 epoch: 60, train_loss: 0.8476, test_loss: 1.0412, test_f1: 0.5564
 epoch: 61, train_loss: 0.8416, test_loss: 1.0453, test_f1: 0.5167
 epoch: 62, train_loss: 0.8359, test_loss: 1.0336, test_f1: 0.5259
 epoch: 63, train_loss: 0.8300, test_loss: 1.0543, test_f1: 0.5347
 epoch: 64, train_loss: 0.8170, test_loss: 1.0173, test_f1: 0.5418
 epoch: 65, train_loss: 0.8458, test_loss: 1.0321, test_f1: 0.5512
 epoch: 66, train_loss: 0.8522, test_loss: 1.0350, test_f1: 0.5511
 epoch: 67, train_loss: 0.8377, test_loss: 1.0155, test_f1: 0.5450
 epoch: 68, train_loss: 0.8414, test_loss: 1.0309, test_f1: 0.5392
 epoch: 69, train_loss: 0.8490, test_loss: 1.0384, test_f1: 0.5414
 epoch: 70, train_loss: 0.8272, test_loss: 1.0480, test_f1: 0.5162
 epoch: 71, train_loss: 0.8220, test_loss: 1.0393, test_f1: 0.5334
 epoch: 72, train_loss: 0.8043, test_loss: 1.0281, test_f1: 0.5564
 epoch: 73, train_loss: 0.8074, test_loss: 1.0412, test_f1: 0.5701
 epoch: 74, train_loss: 0.8173, test_loss: 1.0514, test_f1: 0.5464
 epoch: 75, train_loss: 0.8182, test_loss: 1.0402, test_f1: 0.5429
 epoch: 76, train_loss: 0.8069, test_loss: 1.0236, test_f1: 0.5583
 epoch: 77, train_loss: 0.7928, test_loss: 1.0584, test_f1: 0.5647
 epoch: 78, train_loss: 0.7981, test_loss: 1.0277, test_f1: 0.5524
 epoch: 79, train_loss: 0.8142, test_loss: 1.0467, test_f1: 0.5509
 epoch: 80, train_loss: 0.8018, test_loss: 1.0711, test_f1: 0.5528
 epoch: 81, train_loss: 0.8096, test_loss: 1.0326, test_f1: 0.5691
 epoch: 82, train_loss: 0.7940, test_loss: 1.0633, test_f1: 0.5564
 epoch: 83, train_loss: 0.8038, test_loss: 1.0654, test_f1: 0.5503
 epoch: 84, train_loss: 0.7994, test_loss: 1.0466, test_f1: 0.5560
 epoch: 85, train_loss: 0.7937, test_loss: 1.0591, test_f1: 0.5688
 epoch: 86, train_loss: 0.7884, test_loss: 1.1175, test_f1: 0.5488
 epoch: 87, train_loss: 0.7970, test_loss: 1.0928, test_f1: 0.5485
 epoch: 88, train_loss: 0.7990, test_loss: 1.0706, test_f1: 0.5623
 epoch: 89, train_loss: 0.7969, test_loss: 1.1245, test_f1: 0.5395
 epoch: 90, train_loss: 0.7827, test_loss: 1.0857, test_f1: 0.5536
 epoch: 91, train_loss: 0.8032, test_loss: 1.1135, test_f1: 0.5347
 epoch: 92, train_loss: 0.7953, test_loss: 1.1043, test_f1: 0.5364
 epoch: 93, train_loss: 0.7761, test_loss: 1.1172, test_f1: 0.5338
 epoch: 94, train_loss: 0.7654, test_loss: 1.1074, test_f1: 0.5439
 epoch: 95, train_loss: 0.7746, test_loss: 1.0842, test_f1: 0.5712
 epoch: 96, train_loss: 0.7748, test_loss: 1.1014, test_f1: 0.5457
 epoch: 97, train_loss: 0.7712, test_loss: 1.0857, test_f1: 0.5571
 epoch: 98, train_loss: 0.7775, test_loss: 1.1051, test_f1: 0.5462
 epoch: 99, train_loss: 0.7762, test_loss: 1.1138, test_f1: 0.5468
##################ITERATION #9 ****************************************
 epoch: 0, train_loss: 1.3006, test_loss: 1.3040, test_f1: 0.2412
 epoch: 1, train_loss: 1.2159, test_loss: 1.2337, test_f1: 0.3208
 epoch: 2, train_loss: 1.1753, test_loss: 1.2136, test_f1: 0.3618
 epoch: 3, train_loss: 1.1513, test_loss: 1.2060, test_f1: 0.3647
 epoch: 4, train_loss: 1.1272, test_loss: 1.1749, test_f1: 0.3507
 epoch: 5, train_loss: 1.1023, test_loss: 1.1590, test_f1: 0.3645
 epoch: 6, train_loss: 1.0840, test_loss: 1.1397, test_f1: 0.3644
 epoch: 7, train_loss: 1.0626, test_loss: 1.1286, test_f1: 0.3903
 epoch: 8, train_loss: 1.0636, test_loss: 1.1130, test_f1: 0.3987
 epoch: 9, train_loss: 1.0382, test_loss: 1.1086, test_f1: 0.4556
 epoch: 10, train_loss: 1.0427, test_loss: 1.0853, test_f1: 0.4270
 epoch: 11, train_loss: 1.0232, test_loss: 1.0792, test_f1: 0.5128
 epoch: 12, train_loss: 1.0093, test_loss: 1.0679, test_f1: 0.5038
 epoch: 13, train_loss: 1.0103, test_loss: 1.0722, test_f1: 0.5131
 epoch: 14, train_loss: 0.9937, test_loss: 1.0548, test_f1: 0.5194
 epoch: 15, train_loss: 0.9976, test_loss: 1.0601, test_f1: 0.5335
 epoch: 16, train_loss: 0.9782, test_loss: 1.0644, test_f1: 0.5209
 epoch: 17, train_loss: 0.9694, test_loss: 1.0478, test_f1: 0.5178
 epoch: 18, train_loss: 0.9672, test_loss: 1.0126, test_f1: 0.5603
 epoch: 19, train_loss: 0.9553, test_loss: 1.0411, test_f1: 0.5521
 epoch: 20, train_loss: 0.9538, test_loss: 1.0310, test_f1: 0.5408
 epoch: 21, train_loss: 0.9414, test_loss: 1.0119, test_f1: 0.5502
 epoch: 22, train_loss: 0.9396, test_loss: 1.0088, test_f1: 0.5474
 epoch: 23, train_loss: 0.9394, test_loss: 1.0101, test_f1: 0.5469
 epoch: 24, train_loss: 0.9261, test_loss: 0.9908, test_f1: 0.5689
 epoch: 25, train_loss: 0.9331, test_loss: 0.9929, test_f1: 0.5537
 epoch: 26, train_loss: 0.9296, test_loss: 0.9949, test_f1: 0.5602
 epoch: 27, train_loss: 0.9251, test_loss: 0.9909, test_f1: 0.5338
 epoch: 28, train_loss: 0.9157, test_loss: 0.9937, test_f1: 0.5473
 epoch: 29, train_loss: 0.9030, test_loss: 0.9989, test_f1: 0.5467
 epoch: 30, train_loss: 0.9143, test_loss: 0.9733, test_f1: 0.5645
 epoch: 31, train_loss: 0.9064, test_loss: 0.9705, test_f1: 0.5603
 epoch: 32, train_loss: 0.8922, test_loss: 0.9662, test_f1: 0.5789
 epoch: 33, train_loss: 0.9031, test_loss: 0.9925, test_f1: 0.5397
 epoch: 34, train_loss: 0.8873, test_loss: 0.9850, test_f1: 0.5541
 epoch: 35, train_loss: 0.8837, test_loss: 0.9756, test_f1: 0.5482
 epoch: 36, train_loss: 0.8864, test_loss: 0.9801, test_f1: 0.5565
 epoch: 37, train_loss: 0.8894, test_loss: 0.9981, test_f1: 0.5319
 epoch: 38, train_loss: 0.8767, test_loss: 0.9741, test_f1: 0.5534
 epoch: 39, train_loss: 0.8810, test_loss: 0.9658, test_f1: 0.5591
 epoch: 40, train_loss: 0.8617, test_loss: 0.9907, test_f1: 0.5388
 epoch: 41, train_loss: 0.8520, test_loss: 0.9795, test_f1: 0.5466
 epoch: 42, train_loss: 0.8558, test_loss: 0.9768, test_f1: 0.5631
 epoch: 43, train_loss: 0.8666, test_loss: 0.9764, test_f1: 0.5691
 epoch: 44, train_loss: 0.8582, test_loss: 0.9499, test_f1: 0.5770
 epoch: 45, train_loss: 0.8528, test_loss: 0.9727, test_f1: 0.5473
 epoch: 46, train_loss: 0.8458, test_loss: 0.9623, test_f1: 0.5647
 epoch: 47, train_loss: 0.8473, test_loss: 0.9567, test_f1: 0.5659
 epoch: 48, train_loss: 0.8527, test_loss: 0.9616, test_f1: 0.5553
 epoch: 49, train_loss: 0.8299, test_loss: 0.9628, test_f1: 0.5602
 epoch: 50, train_loss: 0.8399, test_loss: 0.9625, test_f1: 0.5710
 epoch: 51, train_loss: 0.8235, test_loss: 0.9573, test_f1: 0.5648
 epoch: 52, train_loss: 0.8329, test_loss: 0.9588, test_f1: 0.5726
 epoch: 53, train_loss: 0.8339, test_loss: 0.9502, test_f1: 0.5774
 epoch: 54, train_loss: 0.8271, test_loss: 0.9574, test_f1: 0.5632
 epoch: 55, train_loss: 0.8282, test_loss: 0.9515, test_f1: 0.5860
 epoch: 56, train_loss: 0.8233, test_loss: 0.9617, test_f1: 0.5711
 epoch: 57, train_loss: 0.8220, test_loss: 0.9642, test_f1: 0.5683
 epoch: 58, train_loss: 0.8197, test_loss: 0.9622, test_f1: 0.5737
 epoch: 59, train_loss: 0.8051, test_loss: 0.9555, test_f1: 0.5779
 epoch: 60, train_loss: 0.8039, test_loss: 0.9546, test_f1: 0.5810
 epoch: 61, train_loss: 0.8142, test_loss: 0.9619, test_f1: 0.5768
 epoch: 62, train_loss: 0.8074, test_loss: 0.9464, test_f1: 0.5764
 epoch: 63, train_loss: 0.8219, test_loss: 0.9712, test_f1: 0.5678
 epoch: 64, train_loss: 0.8096, test_loss: 0.9677, test_f1: 0.5722
 epoch: 65, train_loss: 0.8104, test_loss: 0.9716, test_f1: 0.5732
 epoch: 66, train_loss: 0.8129, test_loss: 0.9561, test_f1: 0.5937
 epoch: 67, train_loss: 0.8112, test_loss: 0.9537, test_f1: 0.5773
 epoch: 68, train_loss: 0.7988, test_loss: 0.9548, test_f1: 0.5760
 epoch: 69, train_loss: 0.7946, test_loss: 0.9499, test_f1: 0.5760
 epoch: 70, train_loss: 0.7957, test_loss: 0.9561, test_f1: 0.5857
 epoch: 71, train_loss: 0.7974, test_loss: 0.9683, test_f1: 0.5843
 epoch: 72, train_loss: 0.7924, test_loss: 0.9559, test_f1: 0.5764
 epoch: 73, train_loss: 0.7923, test_loss: 0.9525, test_f1: 0.5766
 epoch: 74, train_loss: 0.7936, test_loss: 0.9521, test_f1: 0.5896
 epoch: 75, train_loss: 0.8008, test_loss: 0.9708, test_f1: 0.5644
 epoch: 76, train_loss: 0.7881, test_loss: 0.9539, test_f1: 0.5814
 epoch: 77, train_loss: 0.7991, test_loss: 0.9527, test_f1: 0.5920
 epoch: 78, train_loss: 0.7806, test_loss: 0.9604, test_f1: 0.5912
 epoch: 79, train_loss: 0.7965, test_loss: 0.9359, test_f1: 0.5953
 epoch: 80, train_loss: 0.7732, test_loss: 0.9469, test_f1: 0.6032
 epoch: 81, train_loss: 0.7847, test_loss: 0.9445, test_f1: 0.6076
 epoch: 82, train_loss: 0.7840, test_loss: 0.9530, test_f1: 0.6023
 epoch: 83, train_loss: 0.7743, test_loss: 0.9464, test_f1: 0.5950
 epoch: 84, train_loss: 0.7765, test_loss: 0.9536, test_f1: 0.5957
 epoch: 85, train_loss: 0.7836, test_loss: 0.9455, test_f1: 0.5983
 epoch: 86, train_loss: 0.7727, test_loss: 0.9499, test_f1: 0.6021
 epoch: 87, train_loss: 0.7638, test_loss: 0.9657, test_f1: 0.5788
 epoch: 88, train_loss: 0.7739, test_loss: 0.9690, test_f1: 0.6007
 epoch: 89, train_loss: 0.7696, test_loss: 0.9436, test_f1: 0.5913
 epoch: 90, train_loss: 0.7671, test_loss: 0.9433, test_f1: 0.5927
 epoch: 91, train_loss: 0.7696, test_loss: 0.9643, test_f1: 0.5718
 epoch: 92, train_loss: 0.7636, test_loss: 0.9497, test_f1: 0.5806
 epoch: 93, train_loss: 0.7648, test_loss: 0.9666, test_f1: 0.5630
 epoch: 94, train_loss: 0.7714, test_loss: 0.9738, test_f1: 0.5931
 epoch: 95, train_loss: 0.7576, test_loss: 0.9694, test_f1: 0.5869
 epoch: 96, train_loss: 0.7609, test_loss: 0.9759, test_f1: 0.5764
 epoch: 97, train_loss: 0.7630, test_loss: 0.9534, test_f1: 0.5895
 epoch: 98, train_loss: 0.7611, test_loss: 0.9615, test_f1: 0.5873
 epoch: 99, train_loss: 0.7639, test_loss: 0.9565, test_f1: 0.5784

Training completed in 734.04 seconds
Best F1: 0.6140 at epoch 59
Mean F1 across iterations: 0.5556  0.0412
========================FINAL RESULTS================================
FEGIN weighted F1: 0.6140  0.0412
python main.py --data ltspice_demos --representation component_pin --model FEGIN --layers 5 --hiddens 32 --batch_size 32 --lr 0.0001 --emb_size 250 --epochs 100 --save_appendix component_pin_L5_H32_BS32_LR0.0001_E250 --no_val
-----



STDERR:
  File "main.py", line 370, in <module>
    main()
  File "main.py", line 254, in main
    dataset = dataset_class(
  File "/home/philip/projects/ltspice_examples_code_repo/Circuit-Completion-Using-GNNs/component_classification_with_link_prediction_head/evaluation/FEGIN/kernel/circuit_datasets.py", line 15, in __init__
    self.data, self.slices = torch.load(self.processed_paths[0])
  File "/home/philip/.local/lib/python3.8/site-packages/torch/serialization.py", line 1040, in load
    warnings.warn(
  File "/usr/lib/python3.8/warnings.py", line 109, in _showwarnmsg
    sw(msg.message, msg.category, msg.filename, msg.lineno,
  File "main.py", line 47, in warn_with_traceback
    traceback.print_stack(file=log)
/home/philip/projects/ltspice_examples_code_repo/Circuit-Completion-Using-GNNs/component_classification_with_link_prediction_head/evaluation/FEGIN/kernel/circuit_datasets.py:15: FutureWarning: You are using `torch.load` with `weights_only=False` (the current default value), which uses the default pickle module implicitly. It is possible to construct malicious pickle data which will execute arbitrary code during unpickling (See https://github.com/pytorch/pytorch/blob/main/SECURITY.md#untrusted-models for more details). In a future release, the default value for `weights_only` will be flipped to `True`. This limits the functions that could be executed during unpickling. Arbitrary objects will no longer be allowed to be loaded via this mode unless they are explicitly allowlisted by the user via `torch.serialization.add_safe_globals`. We recommend you start setting `weights_only=True` for any use case where you don't have full control of the loaded file. Please open an issue on GitHub for any issues related to this experimental feature.
  self.data, self.slices = torch.load(self.processed_paths[0])
