STDOUT:
Results will be saved in /home/philip/projects/llm_inference_code_repo/Circuit-Completion-Using-GNNs/component_classification_with_link_prediction_head/evaluation/FEGIN/results/model_FEGIN_dataset_ltspice_examples
Command line input: python main.py --data ltspice_examples --representation component_pin --model FEGIN --layers 4 --hiddens 64 --batch_size 256 --lr 0.0001 --emb_size 128 --epochs 100 --save_appendix component_pin_L4_H64_BS256_LR0.0001_E128 --no_val
 is saved.
-----
ltspice_examples - FEGIN
Using 4 layers, 64 hidden units, h = 2
Loading component_pin representation dataset
ENTERED
Training FEGIN on component_pin representation
Train: 3560, Test: 848
##################ITERATION #0 ****************************************
 epoch: 0, train_loss: 1.3937, test_loss: 1.3919, test_f1: 0.0303
 epoch: 1, train_loss: 1.3859, test_loss: 1.3881, test_f1: 0.0398
 epoch: 2, train_loss: 1.3810, test_loss: 1.3828, test_f1: 0.2610
 epoch: 3, train_loss: 1.3755, test_loss: 1.3762, test_f1: 0.3400
 epoch: 4, train_loss: 1.3691, test_loss: 1.3679, test_f1: 0.3223
 epoch: 5, train_loss: 1.3612, test_loss: 1.3580, test_f1: 0.3118
 epoch: 6, train_loss: 1.3527, test_loss: 1.3473, test_f1: 0.3132
 epoch: 7, train_loss: 1.3413, test_loss: 1.3353, test_f1: 0.3119
 epoch: 8, train_loss: 1.3294, test_loss: 1.3211, test_f1: 0.3186
 epoch: 9, train_loss: 1.3152, test_loss: 1.3052, test_f1: 0.3252
 epoch: 10, train_loss: 1.2975, test_loss: 1.2870, test_f1: 0.3272
 epoch: 11, train_loss: 1.2782, test_loss: 1.2640, test_f1: 0.3344
 epoch: 12, train_loss: 1.2585, test_loss: 1.2408, test_f1: 0.3371
 epoch: 13, train_loss: 1.2354, test_loss: 1.2166, test_f1: 0.3371
 epoch: 14, train_loss: 1.2152, test_loss: 1.1919, test_f1: 0.3371
 epoch: 15, train_loss: 1.1918, test_loss: 1.1686, test_f1: 0.3371
 epoch: 16, train_loss: 1.1719, test_loss: 1.1497, test_f1: 0.3371
 epoch: 17, train_loss: 1.1542, test_loss: 1.1255, test_f1: 0.3419
 epoch: 18, train_loss: 1.1279, test_loss: 1.1076, test_f1: 0.3419
 epoch: 19, train_loss: 1.1107, test_loss: 1.0887, test_f1: 0.3438
 epoch: 20, train_loss: 1.0930, test_loss: 1.0742, test_f1: 0.3438
 epoch: 21, train_loss: 1.0766, test_loss: 1.0582, test_f1: 0.3457
 epoch: 22, train_loss: 1.0612, test_loss: 1.0477, test_f1: 0.3447
 epoch: 23, train_loss: 1.0538, test_loss: 1.0351, test_f1: 0.3447
 epoch: 24, train_loss: 1.0431, test_loss: 1.0324, test_f1: 0.3448
 epoch: 25, train_loss: 1.0302, test_loss: 1.0231, test_f1: 0.3498
 epoch: 26, train_loss: 1.0184, test_loss: 1.0165, test_f1: 0.3522
 epoch: 27, train_loss: 1.0060, test_loss: 1.0049, test_f1: 0.3650
 epoch: 28, train_loss: 0.9998, test_loss: 1.0044, test_f1: 0.3624
 epoch: 29, train_loss: 0.9922, test_loss: 0.9945, test_f1: 0.3659
 epoch: 30, train_loss: 0.9900, test_loss: 0.9849, test_f1: 0.3693
 epoch: 31, train_loss: 0.9780, test_loss: 0.9954, test_f1: 0.4275
 epoch: 32, train_loss: 0.9742, test_loss: 0.9951, test_f1: 0.4099
 epoch: 33, train_loss: 0.9738, test_loss: 0.9976, test_f1: 0.4249
 epoch: 34, train_loss: 0.9630, test_loss: 0.9868, test_f1: 0.4275
 epoch: 35, train_loss: 0.9530, test_loss: 0.9878, test_f1: 0.4521
 epoch: 36, train_loss: 0.9505, test_loss: 0.9934, test_f1: 0.4588
 epoch: 37, train_loss: 0.9483, test_loss: 0.9713, test_f1: 0.4543
 epoch: 38, train_loss: 0.9366, test_loss: 1.0044, test_f1: 0.4414
 epoch: 39, train_loss: 0.9340, test_loss: 0.9856, test_f1: 0.4776
 epoch: 40, train_loss: 0.9320, test_loss: 0.9539, test_f1: 0.4710
 epoch: 41, train_loss: 0.9248, test_loss: 0.9736, test_f1: 0.4715
 epoch: 42, train_loss: 0.9164, test_loss: 0.9845, test_f1: 0.4861
 epoch: 43, train_loss: 0.9198, test_loss: 0.9875, test_f1: 0.4677
 epoch: 44, train_loss: 0.9127, test_loss: 0.9783, test_f1: 0.4952
 epoch: 45, train_loss: 0.9026, test_loss: 0.9808, test_f1: 0.4745
 epoch: 46, train_loss: 0.9005, test_loss: 0.9794, test_f1: 0.4556
 epoch: 47, train_loss: 0.8982, test_loss: 0.9717, test_f1: 0.4976
 epoch: 48, train_loss: 0.8965, test_loss: 0.9593, test_f1: 0.4996
 epoch: 49, train_loss: 0.8924, test_loss: 0.9433, test_f1: 0.4989
 epoch: 50, train_loss: 0.8846, test_loss: 0.9335, test_f1: 0.5117
 epoch: 51, train_loss: 0.8713, test_loss: 0.9566, test_f1: 0.5078
 epoch: 52, train_loss: 0.8721, test_loss: 0.9439, test_f1: 0.5094
 epoch: 53, train_loss: 0.8707, test_loss: 0.9516, test_f1: 0.5077
 epoch: 54, train_loss: 0.8667, test_loss: 0.9518, test_f1: 0.5114
 epoch: 55, train_loss: 0.8629, test_loss: 0.9407, test_f1: 0.5160
 epoch: 56, train_loss: 0.8645, test_loss: 0.9342, test_f1: 0.5177
 epoch: 57, train_loss: 0.8558, test_loss: 0.9366, test_f1: 0.5177
 epoch: 58, train_loss: 0.8583, test_loss: 0.9365, test_f1: 0.5159
 epoch: 59, train_loss: 0.8558, test_loss: 0.9485, test_f1: 0.5191
 epoch: 60, train_loss: 0.8554, test_loss: 0.9513, test_f1: 0.5249
 epoch: 61, train_loss: 0.8569, test_loss: 0.9494, test_f1: 0.5264
 epoch: 62, train_loss: 0.8495, test_loss: 0.9486, test_f1: 0.5254
 epoch: 63, train_loss: 0.8477, test_loss: 0.9434, test_f1: 0.5292
 epoch: 64, train_loss: 0.8460, test_loss: 0.9419, test_f1: 0.5317
 epoch: 65, train_loss: 0.8456, test_loss: 0.9360, test_f1: 0.5320
 epoch: 66, train_loss: 0.8369, test_loss: 0.9604, test_f1: 0.5245
 epoch: 67, train_loss: 0.8454, test_loss: 0.9289, test_f1: 0.5314
 epoch: 68, train_loss: 0.8348, test_loss: 0.9222, test_f1: 0.5344
 epoch: 69, train_loss: 0.8371, test_loss: 0.9437, test_f1: 0.5330
 epoch: 70, train_loss: 0.8375, test_loss: 0.9419, test_f1: 0.5264
 epoch: 71, train_loss: 0.8247, test_loss: 0.9374, test_f1: 0.5355
 epoch: 72, train_loss: 0.8305, test_loss: 0.9358, test_f1: 0.5359
 epoch: 73, train_loss: 0.8208, test_loss: 0.9260, test_f1: 0.5368
 epoch: 74, train_loss: 0.8145, test_loss: 0.9275, test_f1: 0.5354
 epoch: 75, train_loss: 0.8131, test_loss: 0.9348, test_f1: 0.5380
 epoch: 76, train_loss: 0.8171, test_loss: 0.9338, test_f1: 0.5391
 epoch: 77, train_loss: 0.8145, test_loss: 0.9535, test_f1: 0.5348
 epoch: 78, train_loss: 0.8142, test_loss: 0.9188, test_f1: 0.5360
 epoch: 79, train_loss: 0.8157, test_loss: 0.9517, test_f1: 0.5317
 epoch: 80, train_loss: 0.8092, test_loss: 0.9354, test_f1: 0.5417
 epoch: 81, train_loss: 0.8033, test_loss: 0.9039, test_f1: 0.5423
 epoch: 82, train_loss: 0.8076, test_loss: 0.9336, test_f1: 0.5406
 epoch: 83, train_loss: 0.8099, test_loss: 0.9304, test_f1: 0.5416
 epoch: 84, train_loss: 0.8087, test_loss: 0.9434, test_f1: 0.5404
 epoch: 85, train_loss: 0.8031, test_loss: 0.9323, test_f1: 0.5479
 epoch: 86, train_loss: 0.8061, test_loss: 0.9329, test_f1: 0.5484
 epoch: 87, train_loss: 0.7954, test_loss: 0.9235, test_f1: 0.5444
 epoch: 88, train_loss: 0.7904, test_loss: 0.9253, test_f1: 0.5347
 epoch: 89, train_loss: 0.7894, test_loss: 0.9244, test_f1: 0.5465
 epoch: 90, train_loss: 0.7922, test_loss: 0.9201, test_f1: 0.5456
 epoch: 91, train_loss: 0.7829, test_loss: 0.9368, test_f1: 0.5437
 epoch: 92, train_loss: 0.7866, test_loss: 0.9057, test_f1: 0.5403
 epoch: 93, train_loss: 0.7846, test_loss: 0.9255, test_f1: 0.5489
 epoch: 94, train_loss: 0.7863, test_loss: 0.9352, test_f1: 0.5410
 epoch: 95, train_loss: 0.7848, test_loss: 0.9228, test_f1: 0.5392
 epoch: 96, train_loss: 0.7801, test_loss: 0.9046, test_f1: 0.5451
 epoch: 97, train_loss: 0.7814, test_loss: 0.9179, test_f1: 0.5389
 epoch: 98, train_loss: 0.7850, test_loss: 0.9310, test_f1: 0.5462
 epoch: 99, train_loss: 0.7849, test_loss: 0.9134, test_f1: 0.5392
##################ITERATION #1 ****************************************
 epoch: 0, train_loss: 1.3491, test_loss: 1.3547, test_f1: 0.2260
 epoch: 1, train_loss: 1.3285, test_loss: 1.3457, test_f1: 0.2260
 epoch: 2, train_loss: 1.3146, test_loss: 1.3324, test_f1: 0.2260
 epoch: 3, train_loss: 1.2997, test_loss: 1.3042, test_f1: 0.2260
 epoch: 4, train_loss: 1.2814, test_loss: 1.2723, test_f1: 0.2335
 epoch: 5, train_loss: 1.2626, test_loss: 1.2455, test_f1: 0.3186
 epoch: 6, train_loss: 1.2429, test_loss: 1.2204, test_f1: 0.3510
 epoch: 7, train_loss: 1.2177, test_loss: 1.1939, test_f1: 0.3412
 epoch: 8, train_loss: 1.1949, test_loss: 1.1661, test_f1: 0.3410
 epoch: 9, train_loss: 1.1727, test_loss: 1.1416, test_f1: 0.3409
 epoch: 10, train_loss: 1.1482, test_loss: 1.1181, test_f1: 0.3409
 epoch: 11, train_loss: 1.1282, test_loss: 1.0992, test_f1: 0.3400
 epoch: 12, train_loss: 1.1054, test_loss: 1.0836, test_f1: 0.3425
 epoch: 13, train_loss: 1.0902, test_loss: 1.0690, test_f1: 0.3614
 epoch: 14, train_loss: 1.0757, test_loss: 1.0583, test_f1: 0.3705
 epoch: 15, train_loss: 1.0548, test_loss: 1.0502, test_f1: 0.3705
 epoch: 16, train_loss: 1.0439, test_loss: 1.0422, test_f1: 0.4048
 epoch: 17, train_loss: 1.0320, test_loss: 1.0355, test_f1: 0.4098
 epoch: 18, train_loss: 1.0266, test_loss: 1.0320, test_f1: 0.4278
 epoch: 19, train_loss: 1.0177, test_loss: 1.0242, test_f1: 0.4223
 epoch: 20, train_loss: 1.0065, test_loss: 1.0210, test_f1: 0.4408
 epoch: 21, train_loss: 0.9968, test_loss: 1.0157, test_f1: 0.4479
 epoch: 22, train_loss: 0.9856, test_loss: 1.0123, test_f1: 0.4532
 epoch: 23, train_loss: 0.9789, test_loss: 1.0069, test_f1: 0.4709
 epoch: 24, train_loss: 0.9745, test_loss: 1.0038, test_f1: 0.4879
 epoch: 25, train_loss: 0.9733, test_loss: 0.9986, test_f1: 0.4893
 epoch: 26, train_loss: 0.9597, test_loss: 1.0009, test_f1: 0.4735
 epoch: 27, train_loss: 0.9527, test_loss: 0.9902, test_f1: 0.4906
 epoch: 28, train_loss: 0.9516, test_loss: 0.9858, test_f1: 0.4943
 epoch: 29, train_loss: 0.9486, test_loss: 0.9825, test_f1: 0.4896
 epoch: 30, train_loss: 0.9339, test_loss: 0.9829, test_f1: 0.4969
 epoch: 31, train_loss: 0.9252, test_loss: 0.9782, test_f1: 0.5023
 epoch: 32, train_loss: 0.9267, test_loss: 0.9669, test_f1: 0.5049
 epoch: 33, train_loss: 0.9188, test_loss: 0.9721, test_f1: 0.5076
 epoch: 34, train_loss: 0.9060, test_loss: 0.9680, test_f1: 0.5044
 epoch: 35, train_loss: 0.9020, test_loss: 0.9552, test_f1: 0.5023
 epoch: 36, train_loss: 0.8991, test_loss: 0.9530, test_f1: 0.5160
 epoch: 37, train_loss: 0.8931, test_loss: 0.9532, test_f1: 0.5131
 epoch: 38, train_loss: 0.8832, test_loss: 0.9422, test_f1: 0.5113
 epoch: 39, train_loss: 0.8814, test_loss: 0.9416, test_f1: 0.5261
 epoch: 40, train_loss: 0.8821, test_loss: 0.9261, test_f1: 0.5196
 epoch: 41, train_loss: 0.8769, test_loss: 0.9296, test_f1: 0.5139
 epoch: 42, train_loss: 0.8662, test_loss: 0.9653, test_f1: 0.5105
 epoch: 43, train_loss: 0.8569, test_loss: 0.9296, test_f1: 0.5369
 epoch: 44, train_loss: 0.8540, test_loss: 0.9205, test_f1: 0.5288
 epoch: 45, train_loss: 0.8509, test_loss: 0.9135, test_f1: 0.5416
 epoch: 46, train_loss: 0.8502, test_loss: 0.9097, test_f1: 0.5421
 epoch: 47, train_loss: 0.8354, test_loss: 0.9070, test_f1: 0.5378
 epoch: 48, train_loss: 0.8333, test_loss: 0.9259, test_f1: 0.5245
 epoch: 49, train_loss: 0.8351, test_loss: 0.9146, test_f1: 0.5288
 epoch: 50, train_loss: 0.8203, test_loss: 0.9056, test_f1: 0.5449
 epoch: 51, train_loss: 0.8178, test_loss: 0.9067, test_f1: 0.5469
 epoch: 52, train_loss: 0.8201, test_loss: 0.9011, test_f1: 0.5420
 epoch: 53, train_loss: 0.8080, test_loss: 0.8914, test_f1: 0.5455
 epoch: 54, train_loss: 0.8122, test_loss: 0.9019, test_f1: 0.5487
 epoch: 55, train_loss: 0.8038, test_loss: 0.9079, test_f1: 0.5465
 epoch: 56, train_loss: 0.8133, test_loss: 0.8961, test_f1: 0.5474
 epoch: 57, train_loss: 0.8068, test_loss: 0.9017, test_f1: 0.5485
 epoch: 58, train_loss: 0.8022, test_loss: 0.9031, test_f1: 0.5409
 epoch: 59, train_loss: 0.8016, test_loss: 0.9073, test_f1: 0.5368
 epoch: 60, train_loss: 0.7918, test_loss: 0.9012, test_f1: 0.5445
 epoch: 61, train_loss: 0.7950, test_loss: 0.9078, test_f1: 0.5357
 epoch: 62, train_loss: 0.8009, test_loss: 0.9024, test_f1: 0.5520
 epoch: 63, train_loss: 0.7884, test_loss: 0.8996, test_f1: 0.5466
 epoch: 64, train_loss: 0.7856, test_loss: 0.8978, test_f1: 0.5511
 epoch: 65, train_loss: 0.7866, test_loss: 0.8993, test_f1: 0.5403
 epoch: 66, train_loss: 0.7817, test_loss: 0.9051, test_f1: 0.5465
 epoch: 67, train_loss: 0.7855, test_loss: 0.8865, test_f1: 0.5545
 epoch: 68, train_loss: 0.7811, test_loss: 0.9011, test_f1: 0.5439
 epoch: 69, train_loss: 0.7717, test_loss: 0.9053, test_f1: 0.5454
 epoch: 70, train_loss: 0.7716, test_loss: 0.9031, test_f1: 0.5511
 epoch: 71, train_loss: 0.7765, test_loss: 0.9003, test_f1: 0.5448
 epoch: 72, train_loss: 0.7744, test_loss: 0.9000, test_f1: 0.5453
 epoch: 73, train_loss: 0.7693, test_loss: 0.9037, test_f1: 0.5456
 epoch: 74, train_loss: 0.7622, test_loss: 0.9020, test_f1: 0.5523
 epoch: 75, train_loss: 0.7586, test_loss: 0.9026, test_f1: 0.5407
 epoch: 76, train_loss: 0.7590, test_loss: 0.9029, test_f1: 0.5466
 epoch: 77, train_loss: 0.7640, test_loss: 0.8934, test_f1: 0.5390
 epoch: 78, train_loss: 0.7578, test_loss: 0.9054, test_f1: 0.5380
 epoch: 79, train_loss: 0.7593, test_loss: 0.9034, test_f1: 0.5536
 epoch: 80, train_loss: 0.7568, test_loss: 0.9026, test_f1: 0.5488
 epoch: 81, train_loss: 0.7517, test_loss: 0.9123, test_f1: 0.5377
 epoch: 82, train_loss: 0.7588, test_loss: 0.8959, test_f1: 0.5448
 epoch: 83, train_loss: 0.7396, test_loss: 0.8999, test_f1: 0.5439
 epoch: 84, train_loss: 0.7461, test_loss: 0.8973, test_f1: 0.5483
 epoch: 85, train_loss: 0.7470, test_loss: 0.8973, test_f1: 0.5459
 epoch: 86, train_loss: 0.7405, test_loss: 0.9086, test_f1: 0.5513
 epoch: 87, train_loss: 0.7408, test_loss: 0.9048, test_f1: 0.5354
 epoch: 88, train_loss: 0.7359, test_loss: 0.8963, test_f1: 0.5491
 epoch: 89, train_loss: 0.7370, test_loss: 0.9026, test_f1: 0.5397
 epoch: 90, train_loss: 0.7407, test_loss: 0.9135, test_f1: 0.5315
 epoch: 91, train_loss: 0.7242, test_loss: 0.9189, test_f1: 0.5350
 epoch: 92, train_loss: 0.7450, test_loss: 0.9108, test_f1: 0.5442
 epoch: 93, train_loss: 0.7386, test_loss: 0.9027, test_f1: 0.5389
 epoch: 94, train_loss: 0.7354, test_loss: 0.9081, test_f1: 0.5435
 epoch: 95, train_loss: 0.7297, test_loss: 0.9178, test_f1: 0.5308
 epoch: 96, train_loss: 0.7290, test_loss: 0.9087, test_f1: 0.5360
 epoch: 97, train_loss: 0.7199, test_loss: 0.9033, test_f1: 0.5528
 epoch: 98, train_loss: 0.7233, test_loss: 0.9222, test_f1: 0.5460
 epoch: 99, train_loss: 0.7268, test_loss: 0.9088, test_f1: 0.5360
##################ITERATION #2 ****************************************
 epoch: 0, train_loss: 1.3275, test_loss: 1.3385, test_f1: 0.2260
 epoch: 1, train_loss: 1.3038, test_loss: 1.3290, test_f1: 0.2260
 epoch: 2, train_loss: 1.2892, test_loss: 1.3139, test_f1: 0.2260
 epoch: 3, train_loss: 1.2721, test_loss: 1.2849, test_f1: 0.2260
 epoch: 4, train_loss: 1.2524, test_loss: 1.2499, test_f1: 0.2406
 epoch: 5, train_loss: 1.2343, test_loss: 1.2179, test_f1: 0.3545
 epoch: 6, train_loss: 1.2138, test_loss: 1.1891, test_f1: 0.3917
 epoch: 7, train_loss: 1.1919, test_loss: 1.1627, test_f1: 0.3927
 epoch: 8, train_loss: 1.1703, test_loss: 1.1391, test_f1: 0.3970
 epoch: 9, train_loss: 1.1518, test_loss: 1.1176, test_f1: 0.4134
 epoch: 10, train_loss: 1.1304, test_loss: 1.0995, test_f1: 0.4205
 epoch: 11, train_loss: 1.1114, test_loss: 1.0826, test_f1: 0.4289
 epoch: 12, train_loss: 1.0942, test_loss: 1.0685, test_f1: 0.4302
 epoch: 13, train_loss: 1.0746, test_loss: 1.0629, test_f1: 0.4263
 epoch: 14, train_loss: 1.0640, test_loss: 1.0453, test_f1: 0.4480
 epoch: 15, train_loss: 1.0538, test_loss: 1.0379, test_f1: 0.4324
 epoch: 16, train_loss: 1.0362, test_loss: 1.0269, test_f1: 0.4448
 epoch: 17, train_loss: 1.0301, test_loss: 1.0257, test_f1: 0.4559
 epoch: 18, train_loss: 1.0243, test_loss: 1.0182, test_f1: 0.4444
 epoch: 19, train_loss: 1.0177, test_loss: 1.0110, test_f1: 0.4475
 epoch: 20, train_loss: 1.0033, test_loss: 1.0067, test_f1: 0.4359
 epoch: 21, train_loss: 0.9943, test_loss: 1.0056, test_f1: 0.4583
 epoch: 22, train_loss: 0.9879, test_loss: 1.0035, test_f1: 0.4521
 epoch: 23, train_loss: 0.9788, test_loss: 0.9938, test_f1: 0.4440
 epoch: 24, train_loss: 0.9758, test_loss: 0.9930, test_f1: 0.4521
 epoch: 25, train_loss: 0.9657, test_loss: 0.9898, test_f1: 0.4583
 epoch: 26, train_loss: 0.9594, test_loss: 0.9805, test_f1: 0.4648
 epoch: 27, train_loss: 0.9504, test_loss: 0.9852, test_f1: 0.4627
 epoch: 28, train_loss: 0.9500, test_loss: 0.9831, test_f1: 0.4643
 epoch: 29, train_loss: 0.9402, test_loss: 0.9850, test_f1: 0.4647
 epoch: 30, train_loss: 0.9265, test_loss: 0.9827, test_f1: 0.4639
 epoch: 31, train_loss: 0.9283, test_loss: 0.9866, test_f1: 0.4787
 epoch: 32, train_loss: 0.9251, test_loss: 0.9830, test_f1: 0.4714
 epoch: 33, train_loss: 0.9195, test_loss: 0.9738, test_f1: 0.4862
 epoch: 34, train_loss: 0.9164, test_loss: 0.9821, test_f1: 0.4999
 epoch: 35, train_loss: 0.9129, test_loss: 0.9679, test_f1: 0.4804
 epoch: 36, train_loss: 0.9022, test_loss: 0.9727, test_f1: 0.4970
 epoch: 37, train_loss: 0.8986, test_loss: 0.9729, test_f1: 0.4988
 epoch: 38, train_loss: 0.8907, test_loss: 0.9619, test_f1: 0.4929
 epoch: 39, train_loss: 0.8841, test_loss: 0.9797, test_f1: 0.5001
 epoch: 40, train_loss: 0.8806, test_loss: 0.9538, test_f1: 0.5072
 epoch: 41, train_loss: 0.8765, test_loss: 0.9712, test_f1: 0.4927
 epoch: 42, train_loss: 0.8728, test_loss: 0.9729, test_f1: 0.4964
 epoch: 43, train_loss: 0.8666, test_loss: 0.9648, test_f1: 0.4975
 epoch: 44, train_loss: 0.8588, test_loss: 0.9505, test_f1: 0.5147
 epoch: 45, train_loss: 0.8532, test_loss: 0.9664, test_f1: 0.4940
 epoch: 46, train_loss: 0.8466, test_loss: 0.9569, test_f1: 0.5037
 epoch: 47, train_loss: 0.8427, test_loss: 0.9723, test_f1: 0.5155
 epoch: 48, train_loss: 0.8417, test_loss: 0.9419, test_f1: 0.4961
 epoch: 49, train_loss: 0.8369, test_loss: 0.9413, test_f1: 0.5252
 epoch: 50, train_loss: 0.8307, test_loss: 0.9623, test_f1: 0.5189
 epoch: 51, train_loss: 0.8201, test_loss: 0.9394, test_f1: 0.5155
 epoch: 52, train_loss: 0.8080, test_loss: 0.9392, test_f1: 0.5137
 epoch: 53, train_loss: 0.8087, test_loss: 0.9460, test_f1: 0.5235
 epoch: 54, train_loss: 0.8141, test_loss: 0.9421, test_f1: 0.5241
 epoch: 55, train_loss: 0.8051, test_loss: 0.9470, test_f1: 0.5157
 epoch: 56, train_loss: 0.8062, test_loss: 0.9405, test_f1: 0.5239
 epoch: 57, train_loss: 0.8052, test_loss: 0.9457, test_f1: 0.5286
 epoch: 58, train_loss: 0.7946, test_loss: 0.9457, test_f1: 0.5206
 epoch: 59, train_loss: 0.7939, test_loss: 0.9386, test_f1: 0.5335
 epoch: 60, train_loss: 0.7937, test_loss: 0.9388, test_f1: 0.5364
 epoch: 61, train_loss: 0.7950, test_loss: 0.9516, test_f1: 0.5213
 epoch: 62, train_loss: 0.7914, test_loss: 0.9339, test_f1: 0.5222
 epoch: 63, train_loss: 0.7944, test_loss: 0.9481, test_f1: 0.5342
 epoch: 64, train_loss: 0.7889, test_loss: 0.9370, test_f1: 0.5247
 epoch: 65, train_loss: 0.7915, test_loss: 0.9310, test_f1: 0.5200
 epoch: 66, train_loss: 0.7800, test_loss: 0.9394, test_f1: 0.5294
 epoch: 67, train_loss: 0.7809, test_loss: 0.9364, test_f1: 0.5234
 epoch: 68, train_loss: 0.7807, test_loss: 0.9412, test_f1: 0.5186
 epoch: 69, train_loss: 0.7740, test_loss: 0.9366, test_f1: 0.5294
 epoch: 70, train_loss: 0.7692, test_loss: 0.9332, test_f1: 0.5226
 epoch: 71, train_loss: 0.7683, test_loss: 0.9349, test_f1: 0.5207
 epoch: 72, train_loss: 0.7732, test_loss: 0.9383, test_f1: 0.5339
 epoch: 73, train_loss: 0.7681, test_loss: 0.9308, test_f1: 0.5289
 epoch: 74, train_loss: 0.7602, test_loss: 0.9411, test_f1: 0.5305
 epoch: 75, train_loss: 0.7625, test_loss: 0.9332, test_f1: 0.5260
 epoch: 76, train_loss: 0.7541, test_loss: 0.9360, test_f1: 0.5253
 epoch: 77, train_loss: 0.7617, test_loss: 0.9317, test_f1: 0.5321
 epoch: 78, train_loss: 0.7633, test_loss: 0.9358, test_f1: 0.5331
 epoch: 79, train_loss: 0.7556, test_loss: 0.9351, test_f1: 0.5256
 epoch: 80, train_loss: 0.7545, test_loss: 0.9318, test_f1: 0.5274
 epoch: 81, train_loss: 0.7473, test_loss: 0.9324, test_f1: 0.5281
 epoch: 82, train_loss: 0.7482, test_loss: 0.9290, test_f1: 0.5271
 epoch: 83, train_loss: 0.7411, test_loss: 0.9363, test_f1: 0.5267
 epoch: 84, train_loss: 0.7407, test_loss: 0.9322, test_f1: 0.5284
 epoch: 85, train_loss: 0.7310, test_loss: 0.9180, test_f1: 0.5341
 epoch: 86, train_loss: 0.7351, test_loss: 0.9275, test_f1: 0.5317
 epoch: 87, train_loss: 0.7261, test_loss: 0.9232, test_f1: 0.5316
 epoch: 88, train_loss: 0.7321, test_loss: 0.9259, test_f1: 0.5340
 epoch: 89, train_loss: 0.7269, test_loss: 0.9178, test_f1: 0.5354
 epoch: 90, train_loss: 0.7271, test_loss: 0.9278, test_f1: 0.5289
 epoch: 91, train_loss: 0.7254, test_loss: 0.9289, test_f1: 0.5367
 epoch: 92, train_loss: 0.7330, test_loss: 0.9242, test_f1: 0.5377
 epoch: 93, train_loss: 0.7258, test_loss: 0.9236, test_f1: 0.5376
 epoch: 94, train_loss: 0.7146, test_loss: 0.9279, test_f1: 0.5333
 epoch: 95, train_loss: 0.7197, test_loss: 0.9416, test_f1: 0.5422
 epoch: 96, train_loss: 0.7123, test_loss: 0.9173, test_f1: 0.5493
 epoch: 97, train_loss: 0.7214, test_loss: 0.9294, test_f1: 0.5488
 epoch: 98, train_loss: 0.7255, test_loss: 0.9250, test_f1: 0.5492
 epoch: 99, train_loss: 0.7026, test_loss: 0.9204, test_f1: 0.5425
##################ITERATION #3 ****************************************
 epoch: 0, train_loss: 1.3147, test_loss: 1.3222, test_f1: 0.2260
 epoch: 1, train_loss: 1.2823, test_loss: 1.3051, test_f1: 0.2260
 epoch: 2, train_loss: 1.2594, test_loss: 1.2761, test_f1: 0.2260
 epoch: 3, train_loss: 1.2341, test_loss: 1.2312, test_f1: 0.2367
 epoch: 4, train_loss: 1.2103, test_loss: 1.1862, test_f1: 0.3606
 epoch: 5, train_loss: 1.1894, test_loss: 1.1512, test_f1: 0.4192
 epoch: 6, train_loss: 1.1635, test_loss: 1.1253, test_f1: 0.4488
 epoch: 7, train_loss: 1.1445, test_loss: 1.1028, test_f1: 0.4544
 epoch: 8, train_loss: 1.1231, test_loss: 1.0849, test_f1: 0.4601
 epoch: 9, train_loss: 1.1015, test_loss: 1.0696, test_f1: 0.4599
 epoch: 10, train_loss: 1.0849, test_loss: 1.0556, test_f1: 0.4543
 epoch: 11, train_loss: 1.0672, test_loss: 1.0427, test_f1: 0.4607
 epoch: 12, train_loss: 1.0555, test_loss: 1.0294, test_f1: 0.4688
 epoch: 13, train_loss: 1.0386, test_loss: 1.0211, test_f1: 0.4704
 epoch: 14, train_loss: 1.0311, test_loss: 1.0139, test_f1: 0.4765
 epoch: 15, train_loss: 1.0091, test_loss: 1.0113, test_f1: 0.4734
 epoch: 16, train_loss: 1.0085, test_loss: 1.0065, test_f1: 0.4777
 epoch: 17, train_loss: 0.9955, test_loss: 0.9918, test_f1: 0.4899
 epoch: 18, train_loss: 0.9913, test_loss: 0.9859, test_f1: 0.4828
 epoch: 19, train_loss: 0.9738, test_loss: 0.9851, test_f1: 0.4913
 epoch: 20, train_loss: 0.9656, test_loss: 0.9793, test_f1: 0.4927
 epoch: 21, train_loss: 0.9608, test_loss: 0.9685, test_f1: 0.5006
 epoch: 22, train_loss: 0.9473, test_loss: 0.9562, test_f1: 0.5201
 epoch: 23, train_loss: 0.9406, test_loss: 0.9570, test_f1: 0.5171
 epoch: 24, train_loss: 0.9337, test_loss: 0.9504, test_f1: 0.5076
 epoch: 25, train_loss: 0.9245, test_loss: 0.9365, test_f1: 0.5258
 epoch: 26, train_loss: 0.9114, test_loss: 0.9367, test_f1: 0.5269
 epoch: 27, train_loss: 0.9022, test_loss: 0.9374, test_f1: 0.5330
 epoch: 28, train_loss: 0.9016, test_loss: 0.9308, test_f1: 0.5040
 epoch: 29, train_loss: 0.8992, test_loss: 0.9322, test_f1: 0.5253
 epoch: 30, train_loss: 0.8798, test_loss: 0.9164, test_f1: 0.5253
 epoch: 31, train_loss: 0.8786, test_loss: 0.9223, test_f1: 0.5240
 epoch: 32, train_loss: 0.8709, test_loss: 0.9142, test_f1: 0.5231
 epoch: 33, train_loss: 0.8656, test_loss: 0.9187, test_f1: 0.5199
 epoch: 34, train_loss: 0.8632, test_loss: 0.9290, test_f1: 0.4992
 epoch: 35, train_loss: 0.8504, test_loss: 0.9220, test_f1: 0.5251
 epoch: 36, train_loss: 0.8519, test_loss: 0.9084, test_f1: 0.5232
 epoch: 37, train_loss: 0.8337, test_loss: 0.9451, test_f1: 0.5012
 epoch: 38, train_loss: 0.8327, test_loss: 0.9409, test_f1: 0.4907
 epoch: 39, train_loss: 0.8121, test_loss: 0.9141, test_f1: 0.5299
 epoch: 40, train_loss: 0.8289, test_loss: 0.9365, test_f1: 0.5147
 epoch: 41, train_loss: 0.8091, test_loss: 0.9413, test_f1: 0.5214
 epoch: 42, train_loss: 0.8096, test_loss: 0.9206, test_f1: 0.5337
 epoch: 43, train_loss: 0.7933, test_loss: 0.9396, test_f1: 0.5156
 epoch: 44, train_loss: 0.7996, test_loss: 0.9437, test_f1: 0.5378
 epoch: 45, train_loss: 0.7926, test_loss: 0.9423, test_f1: 0.5233
 epoch: 46, train_loss: 0.7846, test_loss: 0.9349, test_f1: 0.5246
 epoch: 47, train_loss: 0.7864, test_loss: 0.9758, test_f1: 0.5110
 epoch: 48, train_loss: 0.7757, test_loss: 0.9295, test_f1: 0.5462
 epoch: 49, train_loss: 0.7752, test_loss: 0.9354, test_f1: 0.5396
 epoch: 50, train_loss: 0.7575, test_loss: 0.9420, test_f1: 0.5251
 epoch: 51, train_loss: 0.7591, test_loss: 0.9471, test_f1: 0.5272
 epoch: 52, train_loss: 0.7586, test_loss: 0.9432, test_f1: 0.5406
 epoch: 53, train_loss: 0.7480, test_loss: 0.9330, test_f1: 0.5489
 epoch: 54, train_loss: 0.7509, test_loss: 0.9451, test_f1: 0.5322
 epoch: 55, train_loss: 0.7393, test_loss: 0.9518, test_f1: 0.5363
 epoch: 56, train_loss: 0.7378, test_loss: 0.9644, test_f1: 0.5247
 epoch: 57, train_loss: 0.7338, test_loss: 0.9764, test_f1: 0.5206
 epoch: 58, train_loss: 0.7371, test_loss: 0.9479, test_f1: 0.5272
 epoch: 59, train_loss: 0.7382, test_loss: 0.9662, test_f1: 0.5340
 epoch: 60, train_loss: 0.7264, test_loss: 0.9601, test_f1: 0.5383
 epoch: 61, train_loss: 0.7338, test_loss: 0.9629, test_f1: 0.5335
 epoch: 62, train_loss: 0.7307, test_loss: 0.9501, test_f1: 0.5345
 epoch: 63, train_loss: 0.7312, test_loss: 0.9650, test_f1: 0.5359
 epoch: 64, train_loss: 0.7227, test_loss: 0.9671, test_f1: 0.5306
 epoch: 65, train_loss: 0.7208, test_loss: 0.9548, test_f1: 0.5314
 epoch: 66, train_loss: 0.7218, test_loss: 0.9602, test_f1: 0.5364
 epoch: 67, train_loss: 0.7110, test_loss: 0.9708, test_f1: 0.5332
 epoch: 68, train_loss: 0.7119, test_loss: 0.9636, test_f1: 0.5349
 epoch: 69, train_loss: 0.7080, test_loss: 0.9702, test_f1: 0.5366
 epoch: 70, train_loss: 0.7065, test_loss: 0.9806, test_f1: 0.5324
 epoch: 71, train_loss: 0.7172, test_loss: 0.9754, test_f1: 0.5299
 epoch: 72, train_loss: 0.7008, test_loss: 0.9805, test_f1: 0.5362
 epoch: 73, train_loss: 0.7199, test_loss: 0.9720, test_f1: 0.5492
 epoch: 74, train_loss: 0.7048, test_loss: 0.9745, test_f1: 0.5349
 epoch: 75, train_loss: 0.6924, test_loss: 0.9790, test_f1: 0.5281
 epoch: 76, train_loss: 0.7107, test_loss: 0.9682, test_f1: 0.5331
 epoch: 77, train_loss: 0.7019, test_loss: 0.9778, test_f1: 0.5302
 epoch: 78, train_loss: 0.7197, test_loss: 0.9729, test_f1: 0.5334
 epoch: 79, train_loss: 0.6926, test_loss: 0.9831, test_f1: 0.5361
 epoch: 80, train_loss: 0.6959, test_loss: 0.9611, test_f1: 0.5634
 epoch: 81, train_loss: 0.6780, test_loss: 0.9678, test_f1: 0.5420
 epoch: 82, train_loss: 0.6933, test_loss: 0.9910, test_f1: 0.5336
 epoch: 83, train_loss: 0.6831, test_loss: 0.9877, test_f1: 0.5301
 epoch: 84, train_loss: 0.6825, test_loss: 0.9914, test_f1: 0.5369
 epoch: 85, train_loss: 0.6873, test_loss: 0.9933, test_f1: 0.5425
 epoch: 86, train_loss: 0.6820, test_loss: 1.0048, test_f1: 0.5341
 epoch: 87, train_loss: 0.6725, test_loss: 1.0147, test_f1: 0.5318
 epoch: 88, train_loss: 0.6762, test_loss: 0.9962, test_f1: 0.5362
 epoch: 89, train_loss: 0.6727, test_loss: 1.0087, test_f1: 0.5302
 epoch: 90, train_loss: 0.6686, test_loss: 0.9877, test_f1: 0.5438
 epoch: 91, train_loss: 0.6683, test_loss: 1.0160, test_f1: 0.5380
 epoch: 92, train_loss: 0.6783, test_loss: 1.0068, test_f1: 0.5371
 epoch: 93, train_loss: 0.6742, test_loss: 1.0010, test_f1: 0.5427
 epoch: 94, train_loss: 0.6646, test_loss: 1.0075, test_f1: 0.5371
 epoch: 95, train_loss: 0.6744, test_loss: 1.0010, test_f1: 0.5404
 epoch: 96, train_loss: 0.6672, test_loss: 1.0110, test_f1: 0.5384
 epoch: 97, train_loss: 0.6602, test_loss: 1.0113, test_f1: 0.5349
 epoch: 98, train_loss: 0.6659, test_loss: 1.0130, test_f1: 0.5378
 epoch: 99, train_loss: 0.6542, test_loss: 1.0120, test_f1: 0.5419
##################ITERATION #4 ****************************************
 epoch: 0, train_loss: 1.2918, test_loss: 1.3242, test_f1: 0.2260
 epoch: 1, train_loss: 1.2527, test_loss: 1.3112, test_f1: 0.2260
 epoch: 2, train_loss: 1.2338, test_loss: 1.2837, test_f1: 0.2260
 epoch: 3, train_loss: 1.2122, test_loss: 1.2376, test_f1: 0.2336
 epoch: 4, train_loss: 1.1893, test_loss: 1.1881, test_f1: 0.3905
 epoch: 5, train_loss: 1.1648, test_loss: 1.1429, test_f1: 0.4214
 epoch: 6, train_loss: 1.1444, test_loss: 1.1053, test_f1: 0.4252
 epoch: 7, train_loss: 1.1251, test_loss: 1.0790, test_f1: 0.4456
 epoch: 8, train_loss: 1.1034, test_loss: 1.0618, test_f1: 0.4474
 epoch: 9, train_loss: 1.0834, test_loss: 1.0495, test_f1: 0.4482
 epoch: 10, train_loss: 1.0698, test_loss: 1.0403, test_f1: 0.4512
 epoch: 11, train_loss: 1.0523, test_loss: 1.0290, test_f1: 0.4626
 epoch: 12, train_loss: 1.0369, test_loss: 1.0208, test_f1: 0.4518
 epoch: 13, train_loss: 1.0244, test_loss: 1.0110, test_f1: 0.4661
 epoch: 14, train_loss: 1.0028, test_loss: 1.0064, test_f1: 0.4804
 epoch: 15, train_loss: 0.9964, test_loss: 1.0011, test_f1: 0.4864
 epoch: 16, train_loss: 0.9784, test_loss: 0.9916, test_f1: 0.4909
 epoch: 17, train_loss: 0.9756, test_loss: 0.9908, test_f1: 0.4902
 epoch: 18, train_loss: 0.9629, test_loss: 0.9803, test_f1: 0.4928
 epoch: 19, train_loss: 0.9568, test_loss: 0.9795, test_f1: 0.4966
 epoch: 20, train_loss: 0.9527, test_loss: 0.9776, test_f1: 0.5040
 epoch: 21, train_loss: 0.9472, test_loss: 0.9733, test_f1: 0.4982
 epoch: 22, train_loss: 0.9305, test_loss: 0.9720, test_f1: 0.4986
 epoch: 23, train_loss: 0.9217, test_loss: 0.9655, test_f1: 0.4997
 epoch: 24, train_loss: 0.9169, test_loss: 0.9632, test_f1: 0.5124
 epoch: 25, train_loss: 0.9042, test_loss: 0.9553, test_f1: 0.5122
 epoch: 26, train_loss: 0.9046, test_loss: 0.9336, test_f1: 0.5073
 epoch: 27, train_loss: 0.8945, test_loss: 0.9558, test_f1: 0.5149
 epoch: 28, train_loss: 0.8835, test_loss: 0.9410, test_f1: 0.5177
 epoch: 29, train_loss: 0.8834, test_loss: 0.9332, test_f1: 0.5228
 epoch: 30, train_loss: 0.8693, test_loss: 0.9334, test_f1: 0.5241
 epoch: 31, train_loss: 0.8668, test_loss: 0.9158, test_f1: 0.5187
 epoch: 32, train_loss: 0.8619, test_loss: 0.9351, test_f1: 0.5168
 epoch: 33, train_loss: 0.8435, test_loss: 0.9447, test_f1: 0.5177
 epoch: 34, train_loss: 0.8490, test_loss: 0.9160, test_f1: 0.5248
 epoch: 35, train_loss: 0.8443, test_loss: 0.9201, test_f1: 0.5215
 epoch: 36, train_loss: 0.8313, test_loss: 0.9126, test_f1: 0.5150
 epoch: 37, train_loss: 0.8266, test_loss: 0.9420, test_f1: 0.5224
 epoch: 38, train_loss: 0.8206, test_loss: 0.9156, test_f1: 0.5294
 epoch: 39, train_loss: 0.8150, test_loss: 0.9217, test_f1: 0.5215
 epoch: 40, train_loss: 0.8116, test_loss: 0.9214, test_f1: 0.5209
 epoch: 41, train_loss: 0.8034, test_loss: 0.9156, test_f1: 0.5193
 epoch: 42, train_loss: 0.8017, test_loss: 0.9125, test_f1: 0.5248
 epoch: 43, train_loss: 0.7867, test_loss: 0.9259, test_f1: 0.5397
 epoch: 44, train_loss: 0.7885, test_loss: 0.9023, test_f1: 0.5562
 epoch: 45, train_loss: 0.7763, test_loss: 0.9363, test_f1: 0.5400
 epoch: 46, train_loss: 0.7790, test_loss: 0.9266, test_f1: 0.5372
 epoch: 47, train_loss: 0.7722, test_loss: 0.9087, test_f1: 0.5432
 epoch: 48, train_loss: 0.7627, test_loss: 0.9405, test_f1: 0.5450
 epoch: 49, train_loss: 0.7597, test_loss: 0.9223, test_f1: 0.5422
 epoch: 50, train_loss: 0.7569, test_loss: 0.9081, test_f1: 0.5505
 epoch: 51, train_loss: 0.7501, test_loss: 0.9160, test_f1: 0.5392
 epoch: 52, train_loss: 0.7527, test_loss: 0.8986, test_f1: 0.5497
 epoch: 53, train_loss: 0.7415, test_loss: 0.9141, test_f1: 0.5492
 epoch: 54, train_loss: 0.7385, test_loss: 0.9200, test_f1: 0.5525
 epoch: 55, train_loss: 0.7412, test_loss: 0.9226, test_f1: 0.5517
 epoch: 56, train_loss: 0.7342, test_loss: 0.9078, test_f1: 0.5522
 epoch: 57, train_loss: 0.7269, test_loss: 0.9025, test_f1: 0.5596
 epoch: 58, train_loss: 0.7392, test_loss: 0.9311, test_f1: 0.5492
 epoch: 59, train_loss: 0.7369, test_loss: 0.9179, test_f1: 0.5535
 epoch: 60, train_loss: 0.7170, test_loss: 0.9334, test_f1: 0.5558
 epoch: 61, train_loss: 0.7268, test_loss: 0.9283, test_f1: 0.5495
 epoch: 62, train_loss: 0.7192, test_loss: 0.9211, test_f1: 0.5470
 epoch: 63, train_loss: 0.7179, test_loss: 0.9421, test_f1: 0.5570
 epoch: 64, train_loss: 0.7105, test_loss: 0.9354, test_f1: 0.5535
 epoch: 65, train_loss: 0.7163, test_loss: 0.9341, test_f1: 0.5637
 epoch: 66, train_loss: 0.7165, test_loss: 0.9362, test_f1: 0.5528
 epoch: 67, train_loss: 0.7151, test_loss: 0.9566, test_f1: 0.5570
 epoch: 68, train_loss: 0.7089, test_loss: 0.9618, test_f1: 0.5538
 epoch: 69, train_loss: 0.7022, test_loss: 0.9559, test_f1: 0.5554
 epoch: 70, train_loss: 0.7065, test_loss: 0.9661, test_f1: 0.5572
 epoch: 71, train_loss: 0.7020, test_loss: 0.9705, test_f1: 0.5585
 epoch: 72, train_loss: 0.7002, test_loss: 0.9709, test_f1: 0.5415
 epoch: 73, train_loss: 0.7169, test_loss: 0.9497, test_f1: 0.5531
 epoch: 74, train_loss: 0.7058, test_loss: 0.9657, test_f1: 0.5529
 epoch: 75, train_loss: 0.6968, test_loss: 0.9651, test_f1: 0.5543
 epoch: 76, train_loss: 0.7069, test_loss: 0.9822, test_f1: 0.5573
 epoch: 77, train_loss: 0.6928, test_loss: 0.9748, test_f1: 0.5560
 epoch: 78, train_loss: 0.7005, test_loss: 0.9573, test_f1: 0.5569
 epoch: 79, train_loss: 0.6890, test_loss: 0.9687, test_f1: 0.5576
 epoch: 80, train_loss: 0.6942, test_loss: 0.9802, test_f1: 0.5553
 epoch: 81, train_loss: 0.6792, test_loss: 0.9911, test_f1: 0.5564
 epoch: 82, train_loss: 0.6896, test_loss: 0.9911, test_f1: 0.5602
 epoch: 83, train_loss: 0.6853, test_loss: 0.9933, test_f1: 0.5472
 epoch: 84, train_loss: 0.6871, test_loss: 1.0021, test_f1: 0.5506
 epoch: 85, train_loss: 0.6775, test_loss: 0.9861, test_f1: 0.5562
 epoch: 86, train_loss: 0.6799, test_loss: 0.9793, test_f1: 0.5551
 epoch: 87, train_loss: 0.6743, test_loss: 0.9973, test_f1: 0.5545
 epoch: 88, train_loss: 0.6857, test_loss: 0.9950, test_f1: 0.5519
 epoch: 89, train_loss: 0.6814, test_loss: 1.0055, test_f1: 0.5538
 epoch: 90, train_loss: 0.6777, test_loss: 1.0045, test_f1: 0.5530
 epoch: 91, train_loss: 0.6715, test_loss: 0.9935, test_f1: 0.5505
 epoch: 92, train_loss: 0.6650, test_loss: 1.0103, test_f1: 0.5482
 epoch: 93, train_loss: 0.6751, test_loss: 1.0030, test_f1: 0.5543
 epoch: 94, train_loss: 0.6662, test_loss: 1.0000, test_f1: 0.5575
 epoch: 95, train_loss: 0.6790, test_loss: 1.0262, test_f1: 0.5559
 epoch: 96, train_loss: 0.6689, test_loss: 1.0218, test_f1: 0.5453
 epoch: 97, train_loss: 0.6606, test_loss: 1.0317, test_f1: 0.5446
 epoch: 98, train_loss: 0.6656, test_loss: 1.0352, test_f1: 0.5404
 epoch: 99, train_loss: 0.6641, test_loss: 1.0560, test_f1: 0.5407
##################ITERATION #5 ****************************************
 epoch: 0, train_loss: 1.2742, test_loss: 1.3000, test_f1: 0.2260
 epoch: 1, train_loss: 1.2102, test_loss: 1.2779, test_f1: 0.2260
 epoch: 2, train_loss: 1.1804, test_loss: 1.2301, test_f1: 0.2286
 epoch: 3, train_loss: 1.1545, test_loss: 1.1732, test_f1: 0.3627
 epoch: 4, train_loss: 1.1338, test_loss: 1.1153, test_f1: 0.4283
 epoch: 5, train_loss: 1.1121, test_loss: 1.0770, test_f1: 0.4654
 epoch: 6, train_loss: 1.0945, test_loss: 1.0573, test_f1: 0.4547
 epoch: 7, train_loss: 1.0798, test_loss: 1.0435, test_f1: 0.4553
 epoch: 8, train_loss: 1.0613, test_loss: 1.0304, test_f1: 0.4589
 epoch: 9, train_loss: 1.0526, test_loss: 1.0169, test_f1: 0.4591
 epoch: 10, train_loss: 1.0306, test_loss: 1.0147, test_f1: 0.4679
 epoch: 11, train_loss: 1.0202, test_loss: 1.0033, test_f1: 0.4774
 epoch: 12, train_loss: 1.0119, test_loss: 0.9992, test_f1: 0.4791
 epoch: 13, train_loss: 1.0014, test_loss: 0.9885, test_f1: 0.4870
 epoch: 14, train_loss: 0.9949, test_loss: 0.9965, test_f1: 0.4725
 epoch: 15, train_loss: 0.9868, test_loss: 0.9799, test_f1: 0.4756
 epoch: 16, train_loss: 0.9763, test_loss: 0.9790, test_f1: 0.4779
 epoch: 17, train_loss: 0.9631, test_loss: 0.9784, test_f1: 0.4856
 epoch: 18, train_loss: 0.9569, test_loss: 0.9750, test_f1: 0.4862
 epoch: 19, train_loss: 0.9445, test_loss: 0.9648, test_f1: 0.4952
 epoch: 20, train_loss: 0.9371, test_loss: 0.9561, test_f1: 0.4949
 epoch: 21, train_loss: 0.9334, test_loss: 0.9652, test_f1: 0.4914
 epoch: 22, train_loss: 0.9231, test_loss: 0.9619, test_f1: 0.4937
 epoch: 23, train_loss: 0.9177, test_loss: 0.9599, test_f1: 0.4969
 epoch: 24, train_loss: 0.9056, test_loss: 0.9557, test_f1: 0.5005
 epoch: 25, train_loss: 0.8996, test_loss: 0.9565, test_f1: 0.5059
 epoch: 26, train_loss: 0.8981, test_loss: 0.9749, test_f1: 0.4883
 epoch: 27, train_loss: 0.8951, test_loss: 0.9430, test_f1: 0.5085
 epoch: 28, train_loss: 0.8742, test_loss: 0.9494, test_f1: 0.5110
 epoch: 29, train_loss: 0.8701, test_loss: 0.9506, test_f1: 0.5185
 epoch: 30, train_loss: 0.8699, test_loss: 0.9553, test_f1: 0.5064
 epoch: 31, train_loss: 0.8649, test_loss: 0.9547, test_f1: 0.5001
 epoch: 32, train_loss: 0.8628, test_loss: 0.9598, test_f1: 0.5026
 epoch: 33, train_loss: 0.8452, test_loss: 0.9651, test_f1: 0.5143
 epoch: 34, train_loss: 0.8441, test_loss: 0.9569, test_f1: 0.5186
 epoch: 35, train_loss: 0.8501, test_loss: 0.9679, test_f1: 0.5183
 epoch: 36, train_loss: 0.8390, test_loss: 0.9748, test_f1: 0.5192
 epoch: 37, train_loss: 0.8279, test_loss: 0.9670, test_f1: 0.5324
 epoch: 38, train_loss: 0.8241, test_loss: 0.9787, test_f1: 0.5168
 epoch: 39, train_loss: 0.8267, test_loss: 0.9719, test_f1: 0.5231
 epoch: 40, train_loss: 0.8138, test_loss: 0.9742, test_f1: 0.5234
 epoch: 41, train_loss: 0.8126, test_loss: 0.9644, test_f1: 0.5426
 epoch: 42, train_loss: 0.8124, test_loss: 0.9750, test_f1: 0.5204
 epoch: 43, train_loss: 0.8021, test_loss: 0.9898, test_f1: 0.5300
 epoch: 44, train_loss: 0.7919, test_loss: 0.9770, test_f1: 0.5331
 epoch: 45, train_loss: 0.7886, test_loss: 0.9612, test_f1: 0.5385
 epoch: 46, train_loss: 0.7972, test_loss: 0.9878, test_f1: 0.5250
 epoch: 47, train_loss: 0.7789, test_loss: 0.9913, test_f1: 0.5336
 epoch: 48, train_loss: 0.7759, test_loss: 0.9833, test_f1: 0.5434
 epoch: 49, train_loss: 0.7763, test_loss: 0.9791, test_f1: 0.5361
 epoch: 50, train_loss: 0.7776, test_loss: 0.9817, test_f1: 0.5327
 epoch: 51, train_loss: 0.7760, test_loss: 0.9800, test_f1: 0.5325
 epoch: 52, train_loss: 0.7649, test_loss: 0.9900, test_f1: 0.5324
 epoch: 53, train_loss: 0.7712, test_loss: 1.0049, test_f1: 0.5288
 epoch: 54, train_loss: 0.7603, test_loss: 0.9945, test_f1: 0.5369
 epoch: 55, train_loss: 0.7575, test_loss: 0.9858, test_f1: 0.5348
 epoch: 56, train_loss: 0.7504, test_loss: 0.9921, test_f1: 0.5352
 epoch: 57, train_loss: 0.7544, test_loss: 0.9904, test_f1: 0.5321
 epoch: 58, train_loss: 0.7576, test_loss: 0.9980, test_f1: 0.5327
 epoch: 59, train_loss: 0.7498, test_loss: 0.9988, test_f1: 0.5346
 epoch: 60, train_loss: 0.7479, test_loss: 1.0211, test_f1: 0.5263
 epoch: 61, train_loss: 0.7443, test_loss: 1.0128, test_f1: 0.5327
 epoch: 62, train_loss: 0.7511, test_loss: 1.0020, test_f1: 0.5341
 epoch: 63, train_loss: 0.7512, test_loss: 1.0099, test_f1: 0.5347
 epoch: 64, train_loss: 0.7353, test_loss: 1.0067, test_f1: 0.5347
 epoch: 65, train_loss: 0.7408, test_loss: 1.0063, test_f1: 0.5265
 epoch: 66, train_loss: 0.7355, test_loss: 0.9961, test_f1: 0.5300
 epoch: 67, train_loss: 0.7278, test_loss: 0.9940, test_f1: 0.5362
 epoch: 68, train_loss: 0.7364, test_loss: 1.0117, test_f1: 0.5370
 epoch: 69, train_loss: 0.7344, test_loss: 1.0361, test_f1: 0.5351
 epoch: 70, train_loss: 0.7344, test_loss: 1.0260, test_f1: 0.5352
 epoch: 71, train_loss: 0.7416, test_loss: 1.0009, test_f1: 0.5325
 epoch: 72, train_loss: 0.7327, test_loss: 1.0203, test_f1: 0.5297
 epoch: 73, train_loss: 0.7294, test_loss: 1.0257, test_f1: 0.5329
 epoch: 74, train_loss: 0.7208, test_loss: 1.0295, test_f1: 0.5399
 epoch: 75, train_loss: 0.7205, test_loss: 1.0196, test_f1: 0.5342
 epoch: 76, train_loss: 0.7258, test_loss: 1.0275, test_f1: 0.5379
 epoch: 77, train_loss: 0.7233, test_loss: 1.0218, test_f1: 0.5333
 epoch: 78, train_loss: 0.7257, test_loss: 1.0260, test_f1: 0.5278
 epoch: 79, train_loss: 0.7261, test_loss: 1.0433, test_f1: 0.5311
 epoch: 80, train_loss: 0.7174, test_loss: 1.0338, test_f1: 0.5346
 epoch: 81, train_loss: 0.7117, test_loss: 1.0357, test_f1: 0.5328
 epoch: 82, train_loss: 0.7203, test_loss: 1.0280, test_f1: 0.5408
 epoch: 83, train_loss: 0.7243, test_loss: 1.0163, test_f1: 0.5376
 epoch: 84, train_loss: 0.7022, test_loss: 1.0364, test_f1: 0.5366
 epoch: 85, train_loss: 0.7192, test_loss: 1.0490, test_f1: 0.5346
 epoch: 86, train_loss: 0.7031, test_loss: 1.0580, test_f1: 0.5329
 epoch: 87, train_loss: 0.7090, test_loss: 1.0469, test_f1: 0.5356
 epoch: 88, train_loss: 0.7070, test_loss: 1.0379, test_f1: 0.5394
 epoch: 89, train_loss: 0.7082, test_loss: 1.0417, test_f1: 0.5381
 epoch: 90, train_loss: 0.6990, test_loss: 1.0542, test_f1: 0.5341
 epoch: 91, train_loss: 0.6943, test_loss: 1.0392, test_f1: 0.5513
 epoch: 92, train_loss: 0.7005, test_loss: 1.0379, test_f1: 0.5440
 epoch: 93, train_loss: 0.6957, test_loss: 1.0613, test_f1: 0.5317
 epoch: 94, train_loss: 0.6979, test_loss: 1.0482, test_f1: 0.5398
 epoch: 95, train_loss: 0.7011, test_loss: 1.0530, test_f1: 0.5333
 epoch: 96, train_loss: 0.6918, test_loss: 1.0602, test_f1: 0.5396
 epoch: 97, train_loss: 0.7047, test_loss: 1.0366, test_f1: 0.5482
 epoch: 98, train_loss: 0.6925, test_loss: 1.0477, test_f1: 0.5340
 epoch: 99, train_loss: 0.6878, test_loss: 1.0627, test_f1: 0.5316
##################ITERATION #6 ****************************************
 epoch: 0, train_loss: 1.2693, test_loss: 1.3059, test_f1: 0.2260
 epoch: 1, train_loss: 1.2088, test_loss: 1.3032, test_f1: 0.2336
 epoch: 2, train_loss: 1.1763, test_loss: 1.3046, test_f1: 0.3029
 epoch: 3, train_loss: 1.1639, test_loss: 1.2430, test_f1: 0.3002
 epoch: 4, train_loss: 1.1355, test_loss: 1.1397, test_f1: 0.4069
 epoch: 5, train_loss: 1.1132, test_loss: 1.0839, test_f1: 0.4623
 epoch: 6, train_loss: 1.0886, test_loss: 1.0571, test_f1: 0.4739
 epoch: 7, train_loss: 1.0664, test_loss: 1.0384, test_f1: 0.4745
 epoch: 8, train_loss: 1.0527, test_loss: 1.0216, test_f1: 0.4718
 epoch: 9, train_loss: 1.0391, test_loss: 1.0080, test_f1: 0.4695
 epoch: 10, train_loss: 1.0245, test_loss: 0.9998, test_f1: 0.4694
 epoch: 11, train_loss: 1.0081, test_loss: 0.9926, test_f1: 0.4716
 epoch: 12, train_loss: 0.9987, test_loss: 0.9800, test_f1: 0.4769
 epoch: 13, train_loss: 0.9904, test_loss: 0.9758, test_f1: 0.4899
 epoch: 14, train_loss: 0.9823, test_loss: 0.9741, test_f1: 0.4836
 epoch: 15, train_loss: 0.9652, test_loss: 0.9613, test_f1: 0.4727
 epoch: 16, train_loss: 0.9594, test_loss: 0.9535, test_f1: 0.4742
 epoch: 17, train_loss: 0.9455, test_loss: 0.9453, test_f1: 0.4783
 epoch: 18, train_loss: 0.9371, test_loss: 0.9398, test_f1: 0.4801
 epoch: 19, train_loss: 0.9308, test_loss: 0.9435, test_f1: 0.4844
 epoch: 20, train_loss: 0.9232, test_loss: 0.9372, test_f1: 0.4771
 epoch: 21, train_loss: 0.9144, test_loss: 0.9568, test_f1: 0.4891
 epoch: 22, train_loss: 0.9072, test_loss: 0.9439, test_f1: 0.4943
 epoch: 23, train_loss: 0.8955, test_loss: 0.9576, test_f1: 0.4955
 epoch: 24, train_loss: 0.8949, test_loss: 0.9326, test_f1: 0.4765
 epoch: 25, train_loss: 0.8793, test_loss: 0.9361, test_f1: 0.4756
 epoch: 26, train_loss: 0.8797, test_loss: 0.9675, test_f1: 0.4862
 epoch: 27, train_loss: 0.8767, test_loss: 0.9304, test_f1: 0.4850
 epoch: 28, train_loss: 0.8610, test_loss: 0.9447, test_f1: 0.4902
 epoch: 29, train_loss: 0.8546, test_loss: 0.9238, test_f1: 0.4777
 epoch: 30, train_loss: 0.8561, test_loss: 0.9238, test_f1: 0.4967
 epoch: 31, train_loss: 0.8466, test_loss: 0.9262, test_f1: 0.4917
 epoch: 32, train_loss: 0.8405, test_loss: 0.9167, test_f1: 0.5002
 epoch: 33, train_loss: 0.8342, test_loss: 0.9275, test_f1: 0.5144
 epoch: 34, train_loss: 0.8243, test_loss: 0.9266, test_f1: 0.4998
 epoch: 35, train_loss: 0.8291, test_loss: 0.9406, test_f1: 0.5123
 epoch: 36, train_loss: 0.8203, test_loss: 0.9177, test_f1: 0.5252
 epoch: 37, train_loss: 0.8165, test_loss: 0.9363, test_f1: 0.5170
 epoch: 38, train_loss: 0.8046, test_loss: 0.9237, test_f1: 0.5183
 epoch: 39, train_loss: 0.8083, test_loss: 0.9563, test_f1: 0.5161
 epoch: 40, train_loss: 0.7882, test_loss: 0.9225, test_f1: 0.5169
 epoch: 41, train_loss: 0.7959, test_loss: 0.9181, test_f1: 0.5191
 epoch: 42, train_loss: 0.7812, test_loss: 0.9379, test_f1: 0.5171
 epoch: 43, train_loss: 0.7810, test_loss: 0.9303, test_f1: 0.5274
 epoch: 44, train_loss: 0.7746, test_loss: 0.9285, test_f1: 0.5218
 epoch: 45, train_loss: 0.7722, test_loss: 0.9459, test_f1: 0.5219
 epoch: 46, train_loss: 0.7721, test_loss: 0.9495, test_f1: 0.5137
 epoch: 47, train_loss: 0.7746, test_loss: 0.9474, test_f1: 0.5191
 epoch: 48, train_loss: 0.7611, test_loss: 0.9367, test_f1: 0.5309
 epoch: 49, train_loss: 0.7545, test_loss: 0.9442, test_f1: 0.5151
 epoch: 50, train_loss: 0.7545, test_loss: 0.9251, test_f1: 0.5185
 epoch: 51, train_loss: 0.7521, test_loss: 0.9278, test_f1: 0.5162
 epoch: 52, train_loss: 0.7465, test_loss: 0.9416, test_f1: 0.5171
 epoch: 53, train_loss: 0.7409, test_loss: 0.9223, test_f1: 0.5177
 epoch: 54, train_loss: 0.7468, test_loss: 0.9561, test_f1: 0.5158
 epoch: 55, train_loss: 0.7303, test_loss: 0.9284, test_f1: 0.5126
 epoch: 56, train_loss: 0.7359, test_loss: 0.9295, test_f1: 0.5223
 epoch: 57, train_loss: 0.7389, test_loss: 0.9440, test_f1: 0.5255
 epoch: 58, train_loss: 0.7407, test_loss: 0.9319, test_f1: 0.5263
 epoch: 59, train_loss: 0.7222, test_loss: 0.9452, test_f1: 0.5237
 epoch: 60, train_loss: 0.7198, test_loss: 0.9367, test_f1: 0.5240
 epoch: 61, train_loss: 0.7281, test_loss: 0.9409, test_f1: 0.5327
 epoch: 62, train_loss: 0.7219, test_loss: 0.9474, test_f1: 0.5281
 epoch: 63, train_loss: 0.7225, test_loss: 0.9335, test_f1: 0.5270
 epoch: 64, train_loss: 0.7159, test_loss: 0.9371, test_f1: 0.5267
 epoch: 65, train_loss: 0.7222, test_loss: 0.9362, test_f1: 0.5118
 epoch: 66, train_loss: 0.7097, test_loss: 0.9492, test_f1: 0.5277
 epoch: 67, train_loss: 0.7106, test_loss: 0.9360, test_f1: 0.5180
 epoch: 68, train_loss: 0.7073, test_loss: 0.9609, test_f1: 0.5191
 epoch: 69, train_loss: 0.7119, test_loss: 0.9529, test_f1: 0.5172
 epoch: 70, train_loss: 0.7041, test_loss: 0.9576, test_f1: 0.5231
 epoch: 71, train_loss: 0.7079, test_loss: 0.9621, test_f1: 0.5254
 epoch: 72, train_loss: 0.7035, test_loss: 0.9590, test_f1: 0.5084
 epoch: 73, train_loss: 0.7010, test_loss: 0.9472, test_f1: 0.5218
 epoch: 74, train_loss: 0.7061, test_loss: 0.9590, test_f1: 0.5240
 epoch: 75, train_loss: 0.6985, test_loss: 0.9681, test_f1: 0.5252
 epoch: 76, train_loss: 0.6878, test_loss: 0.9486, test_f1: 0.5199
 epoch: 77, train_loss: 0.7074, test_loss: 0.9683, test_f1: 0.5276
 epoch: 78, train_loss: 0.6935, test_loss: 0.9606, test_f1: 0.5149
 epoch: 79, train_loss: 0.6945, test_loss: 0.9620, test_f1: 0.5177
 epoch: 80, train_loss: 0.6895, test_loss: 0.9789, test_f1: 0.5149
 epoch: 81, train_loss: 0.6888, test_loss: 0.9728, test_f1: 0.5165
 epoch: 82, train_loss: 0.6849, test_loss: 0.9614, test_f1: 0.5253
 epoch: 83, train_loss: 0.6873, test_loss: 0.9540, test_f1: 0.5347
 epoch: 84, train_loss: 0.6771, test_loss: 0.9639, test_f1: 0.5257
 epoch: 85, train_loss: 0.6779, test_loss: 0.9589, test_f1: 0.5257
 epoch: 86, train_loss: 0.6870, test_loss: 0.9668, test_f1: 0.5282
 epoch: 87, train_loss: 0.6825, test_loss: 0.9680, test_f1: 0.5269
 epoch: 88, train_loss: 0.6755, test_loss: 0.9720, test_f1: 0.5303
 epoch: 89, train_loss: 0.6853, test_loss: 0.9863, test_f1: 0.5220
 epoch: 90, train_loss: 0.6734, test_loss: 0.9796, test_f1: 0.5198
 epoch: 91, train_loss: 0.6750, test_loss: 0.9778, test_f1: 0.5175
 epoch: 92, train_loss: 0.6805, test_loss: 0.9821, test_f1: 0.5234
 epoch: 93, train_loss: 0.6831, test_loss: 0.9923, test_f1: 0.5357
 epoch: 94, train_loss: 0.6732, test_loss: 0.9751, test_f1: 0.5269
 epoch: 95, train_loss: 0.6670, test_loss: 0.9867, test_f1: 0.5327
 epoch: 96, train_loss: 0.6667, test_loss: 0.9644, test_f1: 0.5223
 epoch: 97, train_loss: 0.6533, test_loss: 0.9796, test_f1: 0.5325
 epoch: 98, train_loss: 0.6581, test_loss: 0.9873, test_f1: 0.5348
 epoch: 99, train_loss: 0.6626, test_loss: 0.9684, test_f1: 0.5307
##################ITERATION #7 ****************************************
 epoch: 0, train_loss: 1.2865, test_loss: 1.3020, test_f1: 0.2260
 epoch: 1, train_loss: 1.2223, test_loss: 1.2944, test_f1: 0.2260
 epoch: 2, train_loss: 1.1936, test_loss: 1.2711, test_f1: 0.2260
 epoch: 3, train_loss: 1.1672, test_loss: 1.2287, test_f1: 0.3190
 epoch: 4, train_loss: 1.1411, test_loss: 1.1685, test_f1: 0.3908
 epoch: 5, train_loss: 1.1246, test_loss: 1.1174, test_f1: 0.4040
 epoch: 6, train_loss: 1.1045, test_loss: 1.0817, test_f1: 0.4335
 epoch: 7, train_loss: 1.0903, test_loss: 1.0614, test_f1: 0.4377
 epoch: 8, train_loss: 1.0762, test_loss: 1.0414, test_f1: 0.4415
 epoch: 9, train_loss: 1.0600, test_loss: 1.0344, test_f1: 0.4510
 epoch: 10, train_loss: 1.0456, test_loss: 1.0267, test_f1: 0.4414
 epoch: 11, train_loss: 1.0344, test_loss: 1.0141, test_f1: 0.4438
 epoch: 12, train_loss: 1.0219, test_loss: 1.0068, test_f1: 0.4567
 epoch: 13, train_loss: 1.0155, test_loss: 1.0056, test_f1: 0.4561
 epoch: 14, train_loss: 0.9983, test_loss: 0.9904, test_f1: 0.4546
 epoch: 15, train_loss: 0.9991, test_loss: 1.0025, test_f1: 0.4502
 epoch: 16, train_loss: 0.9873, test_loss: 0.9863, test_f1: 0.4691
 epoch: 17, train_loss: 0.9788, test_loss: 0.9840, test_f1: 0.4675
 epoch: 18, train_loss: 0.9728, test_loss: 0.9780, test_f1: 0.4812
 epoch: 19, train_loss: 0.9716, test_loss: 0.9889, test_f1: 0.4854
 epoch: 20, train_loss: 0.9618, test_loss: 0.9892, test_f1: 0.4671
 epoch: 21, train_loss: 0.9481, test_loss: 0.9738, test_f1: 0.4883
 epoch: 22, train_loss: 0.9435, test_loss: 0.9718, test_f1: 0.4968
 epoch: 23, train_loss: 0.9467, test_loss: 0.9868, test_f1: 0.4801
 epoch: 24, train_loss: 0.9293, test_loss: 0.9654, test_f1: 0.4917
 epoch: 25, train_loss: 0.9219, test_loss: 0.9611, test_f1: 0.4951
 epoch: 26, train_loss: 0.9165, test_loss: 0.9564, test_f1: 0.4990
 epoch: 27, train_loss: 0.9140, test_loss: 0.9670, test_f1: 0.4924
 epoch: 28, train_loss: 0.9049, test_loss: 0.9630, test_f1: 0.5036
 epoch: 29, train_loss: 0.8997, test_loss: 0.9656, test_f1: 0.5114
 epoch: 30, train_loss: 0.8962, test_loss: 0.9676, test_f1: 0.5154
 epoch: 31, train_loss: 0.8905, test_loss: 0.9643, test_f1: 0.5088
 epoch: 32, train_loss: 0.8870, test_loss: 0.9552, test_f1: 0.5160
 epoch: 33, train_loss: 0.8742, test_loss: 0.9787, test_f1: 0.5025
 epoch: 34, train_loss: 0.8707, test_loss: 0.9546, test_f1: 0.5135
 epoch: 35, train_loss: 0.8669, test_loss: 0.9625, test_f1: 0.5131
 epoch: 36, train_loss: 0.8665, test_loss: 0.9915, test_f1: 0.5100
 epoch: 37, train_loss: 0.8568, test_loss: 0.9836, test_f1: 0.5149
 epoch: 38, train_loss: 0.8569, test_loss: 0.9831, test_f1: 0.5172
 epoch: 39, train_loss: 0.8578, test_loss: 0.9765, test_f1: 0.5130
 epoch: 40, train_loss: 0.8485, test_loss: 0.9809, test_f1: 0.5144
 epoch: 41, train_loss: 0.8312, test_loss: 0.9955, test_f1: 0.5227
 epoch: 42, train_loss: 0.8291, test_loss: 0.9993, test_f1: 0.5145
 epoch: 43, train_loss: 0.8293, test_loss: 0.9872, test_f1: 0.5162
 epoch: 44, train_loss: 0.8302, test_loss: 1.0292, test_f1: 0.5124
 epoch: 45, train_loss: 0.8204, test_loss: 0.9902, test_f1: 0.5171
 epoch: 46, train_loss: 0.8129, test_loss: 0.9891, test_f1: 0.5285
 epoch: 47, train_loss: 0.8080, test_loss: 1.0160, test_f1: 0.5246
 epoch: 48, train_loss: 0.8003, test_loss: 1.0041, test_f1: 0.5113
 epoch: 49, train_loss: 0.8111, test_loss: 0.9884, test_f1: 0.5110
 epoch: 50, train_loss: 0.7978, test_loss: 1.0261, test_f1: 0.5024
 epoch: 51, train_loss: 0.7886, test_loss: 1.0025, test_f1: 0.5185
 epoch: 52, train_loss: 0.7979, test_loss: 0.9816, test_f1: 0.5289
 epoch: 53, train_loss: 0.7898, test_loss: 0.9895, test_f1: 0.5204
 epoch: 54, train_loss: 0.7919, test_loss: 0.9944, test_f1: 0.5278
 epoch: 55, train_loss: 0.7833, test_loss: 1.0047, test_f1: 0.5155
 epoch: 56, train_loss: 0.7722, test_loss: 1.0059, test_f1: 0.5245
 epoch: 57, train_loss: 0.7859, test_loss: 0.9867, test_f1: 0.5313
 epoch: 58, train_loss: 0.7855, test_loss: 0.9982, test_f1: 0.5185
 epoch: 59, train_loss: 0.7687, test_loss: 1.0064, test_f1: 0.5178
 epoch: 60, train_loss: 0.7696, test_loss: 1.0047, test_f1: 0.5168
 epoch: 61, train_loss: 0.7698, test_loss: 0.9903, test_f1: 0.5220
 epoch: 62, train_loss: 0.7676, test_loss: 0.9906, test_f1: 0.5302
 epoch: 63, train_loss: 0.7665, test_loss: 1.0055, test_f1: 0.5177
 epoch: 64, train_loss: 0.7650, test_loss: 0.9967, test_f1: 0.5192
 epoch: 65, train_loss: 0.7561, test_loss: 0.9910, test_f1: 0.5174
 epoch: 66, train_loss: 0.7528, test_loss: 0.9921, test_f1: 0.5211
 epoch: 67, train_loss: 0.7554, test_loss: 1.0040, test_f1: 0.5201
 epoch: 68, train_loss: 0.7479, test_loss: 0.9957, test_f1: 0.5232
 epoch: 69, train_loss: 0.7443, test_loss: 1.0032, test_f1: 0.5212
 epoch: 70, train_loss: 0.7394, test_loss: 0.9990, test_f1: 0.5237
 epoch: 71, train_loss: 0.7449, test_loss: 1.0154, test_f1: 0.5201
 epoch: 72, train_loss: 0.7425, test_loss: 1.0086, test_f1: 0.5261
 epoch: 73, train_loss: 0.7460, test_loss: 1.0051, test_f1: 0.5335
 epoch: 74, train_loss: 0.7481, test_loss: 1.0117, test_f1: 0.5218
 epoch: 75, train_loss: 0.7383, test_loss: 1.0102, test_f1: 0.5252
 epoch: 76, train_loss: 0.7380, test_loss: 0.9980, test_f1: 0.5244
 epoch: 77, train_loss: 0.7384, test_loss: 1.0001, test_f1: 0.5332
 epoch: 78, train_loss: 0.7401, test_loss: 0.9862, test_f1: 0.5327
 epoch: 79, train_loss: 0.7269, test_loss: 1.0025, test_f1: 0.5199
 epoch: 80, train_loss: 0.7346, test_loss: 1.0036, test_f1: 0.5311
 epoch: 81, train_loss: 0.7352, test_loss: 1.0038, test_f1: 0.5263
 epoch: 82, train_loss: 0.7375, test_loss: 1.0110, test_f1: 0.5248
 epoch: 83, train_loss: 0.7411, test_loss: 1.0005, test_f1: 0.5245
 epoch: 84, train_loss: 0.7314, test_loss: 1.0057, test_f1: 0.5205
 epoch: 85, train_loss: 0.7193, test_loss: 1.0181, test_f1: 0.5311
 epoch: 86, train_loss: 0.7254, test_loss: 1.0132, test_f1: 0.5282
 epoch: 87, train_loss: 0.7213, test_loss: 1.0167, test_f1: 0.5215
 epoch: 88, train_loss: 0.7170, test_loss: 1.0232, test_f1: 0.5166
 epoch: 89, train_loss: 0.7142, test_loss: 0.9999, test_f1: 0.5329
 epoch: 90, train_loss: 0.7177, test_loss: 1.0129, test_f1: 0.5213
 epoch: 91, train_loss: 0.7239, test_loss: 1.0297, test_f1: 0.5234
 epoch: 92, train_loss: 0.7069, test_loss: 1.0002, test_f1: 0.5349
 epoch: 93, train_loss: 0.7084, test_loss: 0.9962, test_f1: 0.5341
 epoch: 94, train_loss: 0.7059, test_loss: 1.0093, test_f1: 0.5313
 epoch: 95, train_loss: 0.7137, test_loss: 1.0294, test_f1: 0.5226
 epoch: 96, train_loss: 0.7102, test_loss: 1.0069, test_f1: 0.5280
 epoch: 97, train_loss: 0.7029, test_loss: 1.0150, test_f1: 0.5208
 epoch: 98, train_loss: 0.7013, test_loss: 1.0183, test_f1: 0.5166
 epoch: 99, train_loss: 0.7050, test_loss: 1.0147, test_f1: 0.5219
##################ITERATION #8 ****************************************
 epoch: 0, train_loss: 1.2957, test_loss: 1.3006, test_f1: 0.2260
 epoch: 1, train_loss: 1.2174, test_loss: 1.2685, test_f1: 0.2260
 epoch: 2, train_loss: 1.1813, test_loss: 1.2102, test_f1: 0.2260
 epoch: 3, train_loss: 1.1519, test_loss: 1.1456, test_f1: 0.3002
 epoch: 4, train_loss: 1.1275, test_loss: 1.1082, test_f1: 0.4120
 epoch: 5, train_loss: 1.1069, test_loss: 1.0683, test_f1: 0.4574
 epoch: 6, train_loss: 1.0845, test_loss: 1.0440, test_f1: 0.4563
 epoch: 7, train_loss: 1.0708, test_loss: 1.0236, test_f1: 0.4647
 epoch: 8, train_loss: 1.0491, test_loss: 1.0087, test_f1: 0.4645
 epoch: 9, train_loss: 1.0415, test_loss: 0.9994, test_f1: 0.4669
 epoch: 10, train_loss: 1.0304, test_loss: 0.9967, test_f1: 0.4683
 epoch: 11, train_loss: 1.0170, test_loss: 0.9856, test_f1: 0.4652
 epoch: 12, train_loss: 1.0008, test_loss: 0.9777, test_f1: 0.4733
 epoch: 13, train_loss: 0.9953, test_loss: 0.9749, test_f1: 0.4818
 epoch: 14, train_loss: 0.9854, test_loss: 0.9673, test_f1: 0.4842
 epoch: 15, train_loss: 0.9751, test_loss: 0.9525, test_f1: 0.4894
 epoch: 16, train_loss: 0.9715, test_loss: 0.9470, test_f1: 0.4954
 epoch: 17, train_loss: 0.9569, test_loss: 0.9475, test_f1: 0.5084
 epoch: 18, train_loss: 0.9527, test_loss: 0.9448, test_f1: 0.5016
 epoch: 19, train_loss: 0.9443, test_loss: 0.9368, test_f1: 0.5116
 epoch: 20, train_loss: 0.9376, test_loss: 0.9437, test_f1: 0.5070
 epoch: 21, train_loss: 0.9278, test_loss: 0.9228, test_f1: 0.5188
 epoch: 22, train_loss: 0.9205, test_loss: 0.9160, test_f1: 0.5192
 epoch: 23, train_loss: 0.9195, test_loss: 0.9104, test_f1: 0.5314
 epoch: 24, train_loss: 0.9068, test_loss: 0.9173, test_f1: 0.5175
 epoch: 25, train_loss: 0.9002, test_loss: 0.9075, test_f1: 0.5185
 epoch: 26, train_loss: 0.8983, test_loss: 0.9105, test_f1: 0.5270
 epoch: 27, train_loss: 0.8918, test_loss: 0.9163, test_f1: 0.5174
 epoch: 28, train_loss: 0.8945, test_loss: 0.9087, test_f1: 0.5283
 epoch: 29, train_loss: 0.8850, test_loss: 0.9059, test_f1: 0.5126
 epoch: 30, train_loss: 0.8812, test_loss: 0.9029, test_f1: 0.5073
 epoch: 31, train_loss: 0.8661, test_loss: 0.9024, test_f1: 0.5168
 epoch: 32, train_loss: 0.8660, test_loss: 0.9012, test_f1: 0.5140
 epoch: 33, train_loss: 0.8637, test_loss: 0.9005, test_f1: 0.5191
 epoch: 34, train_loss: 0.8518, test_loss: 0.9054, test_f1: 0.5106
 epoch: 35, train_loss: 0.8477, test_loss: 0.8903, test_f1: 0.5232
 epoch: 36, train_loss: 0.8373, test_loss: 0.9083, test_f1: 0.5146
 epoch: 37, train_loss: 0.8368, test_loss: 0.8899, test_f1: 0.5310
 epoch: 38, train_loss: 0.8333, test_loss: 0.8831, test_f1: 0.5265
 epoch: 39, train_loss: 0.8334, test_loss: 0.9030, test_f1: 0.5338
 epoch: 40, train_loss: 0.8187, test_loss: 0.8852, test_f1: 0.5403
 epoch: 41, train_loss: 0.8166, test_loss: 0.8774, test_f1: 0.5465
 epoch: 42, train_loss: 0.8113, test_loss: 0.8814, test_f1: 0.5367
 epoch: 43, train_loss: 0.8138, test_loss: 0.9085, test_f1: 0.5277
 epoch: 44, train_loss: 0.7984, test_loss: 0.9059, test_f1: 0.5330
 epoch: 45, train_loss: 0.8046, test_loss: 0.9079, test_f1: 0.5315
 epoch: 46, train_loss: 0.7983, test_loss: 0.8993, test_f1: 0.5302
 epoch: 47, train_loss: 0.7951, test_loss: 0.9123, test_f1: 0.5479
 epoch: 48, train_loss: 0.7854, test_loss: 0.9021, test_f1: 0.5322
 epoch: 49, train_loss: 0.7767, test_loss: 0.9048, test_f1: 0.5374
 epoch: 50, train_loss: 0.7780, test_loss: 0.9435, test_f1: 0.5159
 epoch: 51, train_loss: 0.7734, test_loss: 0.9413, test_f1: 0.5149
 epoch: 52, train_loss: 0.7669, test_loss: 0.9317, test_f1: 0.5230
 epoch: 53, train_loss: 0.7651, test_loss: 0.9386, test_f1: 0.5318
 epoch: 54, train_loss: 0.7658, test_loss: 0.9486, test_f1: 0.5197
 epoch: 55, train_loss: 0.7633, test_loss: 0.9108, test_f1: 0.5387
 epoch: 56, train_loss: 0.7584, test_loss: 0.9152, test_f1: 0.5360
 epoch: 57, train_loss: 0.7506, test_loss: 0.9172, test_f1: 0.5337
 epoch: 58, train_loss: 0.7490, test_loss: 0.9301, test_f1: 0.5163
 epoch: 59, train_loss: 0.7537, test_loss: 0.9369, test_f1: 0.5169
 epoch: 60, train_loss: 0.7506, test_loss: 0.9573, test_f1: 0.5285
 epoch: 61, train_loss: 0.7532, test_loss: 0.9416, test_f1: 0.5217
 epoch: 62, train_loss: 0.7371, test_loss: 0.9213, test_f1: 0.5309
 epoch: 63, train_loss: 0.7424, test_loss: 0.9258, test_f1: 0.5312
 epoch: 64, train_loss: 0.7451, test_loss: 0.9253, test_f1: 0.5334
 epoch: 65, train_loss: 0.7367, test_loss: 0.9117, test_f1: 0.5325
 epoch: 66, train_loss: 0.7416, test_loss: 0.9431, test_f1: 0.5284
 epoch: 67, train_loss: 0.7394, test_loss: 0.9365, test_f1: 0.5275
 epoch: 68, train_loss: 0.7399, test_loss: 0.9314, test_f1: 0.5389
 epoch: 69, train_loss: 0.7272, test_loss: 0.9260, test_f1: 0.5362
 epoch: 70, train_loss: 0.7318, test_loss: 0.9304, test_f1: 0.5459
 epoch: 71, train_loss: 0.7225, test_loss: 0.9258, test_f1: 0.5324
 epoch: 72, train_loss: 0.7179, test_loss: 0.9441, test_f1: 0.5311
 epoch: 73, train_loss: 0.7223, test_loss: 0.9551, test_f1: 0.5366
 epoch: 74, train_loss: 0.7255, test_loss: 0.9544, test_f1: 0.5322
 epoch: 75, train_loss: 0.7184, test_loss: 0.9560, test_f1: 0.5254
 epoch: 76, train_loss: 0.7178, test_loss: 0.9455, test_f1: 0.5382
 epoch: 77, train_loss: 0.7166, test_loss: 0.9484, test_f1: 0.5350
 epoch: 78, train_loss: 0.7202, test_loss: 0.9645, test_f1: 0.5347
 epoch: 79, train_loss: 0.6982, test_loss: 0.9613, test_f1: 0.5297
 epoch: 80, train_loss: 0.7088, test_loss: 0.9464, test_f1: 0.5322
 epoch: 81, train_loss: 0.7140, test_loss: 0.9734, test_f1: 0.5313
 epoch: 82, train_loss: 0.7144, test_loss: 0.9436, test_f1: 0.5286
 epoch: 83, train_loss: 0.7166, test_loss: 0.9392, test_f1: 0.5369
 epoch: 84, train_loss: 0.7031, test_loss: 0.9396, test_f1: 0.5398
 epoch: 85, train_loss: 0.6895, test_loss: 0.9370, test_f1: 0.5465
 epoch: 86, train_loss: 0.7013, test_loss: 0.9386, test_f1: 0.5412
 epoch: 87, train_loss: 0.7036, test_loss: 0.9602, test_f1: 0.5413
 epoch: 88, train_loss: 0.6902, test_loss: 0.9567, test_f1: 0.5351
 epoch: 89, train_loss: 0.6884, test_loss: 0.9827, test_f1: 0.5292
 epoch: 90, train_loss: 0.6849, test_loss: 0.9865, test_f1: 0.5378
 epoch: 91, train_loss: 0.6972, test_loss: 0.9595, test_f1: 0.5362
 epoch: 92, train_loss: 0.6893, test_loss: 0.9775, test_f1: 0.5326
 epoch: 93, train_loss: 0.6941, test_loss: 0.9644, test_f1: 0.5430
 epoch: 94, train_loss: 0.6911, test_loss: 0.9687, test_f1: 0.5419
 epoch: 95, train_loss: 0.6806, test_loss: 0.9734, test_f1: 0.5322
 epoch: 96, train_loss: 0.6860, test_loss: 0.9658, test_f1: 0.5333
 epoch: 97, train_loss: 0.6818, test_loss: 0.9580, test_f1: 0.5468
 epoch: 98, train_loss: 0.6847, test_loss: 0.9807, test_f1: 0.5265
 epoch: 99, train_loss: 0.6793, test_loss: 0.9658, test_f1: 0.5229
##################ITERATION #9 ****************************************
 epoch: 0, train_loss: 1.3050, test_loss: 1.3099, test_f1: 0.2260
 epoch: 1, train_loss: 1.2098, test_loss: 1.2681, test_f1: 0.2260
 epoch: 2, train_loss: 1.1720, test_loss: 1.2077, test_f1: 0.2839
 epoch: 3, train_loss: 1.1468, test_loss: 1.1526, test_f1: 0.3992
 epoch: 4, train_loss: 1.1212, test_loss: 1.1098, test_f1: 0.4356
 epoch: 5, train_loss: 1.1099, test_loss: 1.0836, test_f1: 0.4204
 epoch: 6, train_loss: 1.0812, test_loss: 1.0665, test_f1: 0.4553
 epoch: 7, train_loss: 1.0695, test_loss: 1.0527, test_f1: 0.4569
 epoch: 8, train_loss: 1.0528, test_loss: 1.0410, test_f1: 0.4819
 epoch: 9, train_loss: 1.0363, test_loss: 1.0313, test_f1: 0.4904
 epoch: 10, train_loss: 1.0294, test_loss: 1.0286, test_f1: 0.4825
 epoch: 11, train_loss: 1.0145, test_loss: 1.0118, test_f1: 0.4942
 epoch: 12, train_loss: 1.0131, test_loss: 1.0083, test_f1: 0.4894
 epoch: 13, train_loss: 1.0038, test_loss: 0.9963, test_f1: 0.5001
 epoch: 14, train_loss: 0.9884, test_loss: 0.9913, test_f1: 0.4979
 epoch: 15, train_loss: 0.9800, test_loss: 0.9903, test_f1: 0.4955
 epoch: 16, train_loss: 0.9705, test_loss: 0.9810, test_f1: 0.4981
 epoch: 17, train_loss: 0.9603, test_loss: 0.9778, test_f1: 0.4954
 epoch: 18, train_loss: 0.9556, test_loss: 0.9721, test_f1: 0.5002
 epoch: 19, train_loss: 0.9421, test_loss: 0.9745, test_f1: 0.5059
 epoch: 20, train_loss: 0.9416, test_loss: 0.9598, test_f1: 0.5032
 epoch: 21, train_loss: 0.9289, test_loss: 0.9657, test_f1: 0.5077
 epoch: 22, train_loss: 0.9262, test_loss: 0.9538, test_f1: 0.5183
 epoch: 23, train_loss: 0.9212, test_loss: 0.9636, test_f1: 0.5250
 epoch: 24, train_loss: 0.9113, test_loss: 0.9575, test_f1: 0.5188
 epoch: 25, train_loss: 0.9049, test_loss: 0.9544, test_f1: 0.5251
 epoch: 26, train_loss: 0.8971, test_loss: 0.9525, test_f1: 0.5136
 epoch: 27, train_loss: 0.8879, test_loss: 0.9465, test_f1: 0.5181
 epoch: 28, train_loss: 0.8772, test_loss: 0.9481, test_f1: 0.5177
 epoch: 29, train_loss: 0.8849, test_loss: 0.9485, test_f1: 0.5239
 epoch: 30, train_loss: 0.8773, test_loss: 0.9490, test_f1: 0.5189
 epoch: 31, train_loss: 0.8636, test_loss: 0.9437, test_f1: 0.5353
 epoch: 32, train_loss: 0.8593, test_loss: 0.9422, test_f1: 0.5413
 epoch: 33, train_loss: 0.8591, test_loss: 0.9408, test_f1: 0.5227
 epoch: 34, train_loss: 0.8524, test_loss: 0.9432, test_f1: 0.5318
 epoch: 35, train_loss: 0.8403, test_loss: 0.9351, test_f1: 0.5335
 epoch: 36, train_loss: 0.8334, test_loss: 0.9391, test_f1: 0.5293
 epoch: 37, train_loss: 0.8330, test_loss: 0.9359, test_f1: 0.5353
 epoch: 38, train_loss: 0.8297, test_loss: 0.9381, test_f1: 0.5385
 epoch: 39, train_loss: 0.8258, test_loss: 0.9370, test_f1: 0.5354
 epoch: 40, train_loss: 0.8175, test_loss: 0.9491, test_f1: 0.5356
 epoch: 41, train_loss: 0.8169, test_loss: 0.9343, test_f1: 0.5492
 epoch: 42, train_loss: 0.8090, test_loss: 0.9382, test_f1: 0.5460
 epoch: 43, train_loss: 0.8013, test_loss: 0.9319, test_f1: 0.5357
 epoch: 44, train_loss: 0.8004, test_loss: 0.9440, test_f1: 0.5464
 epoch: 45, train_loss: 0.7953, test_loss: 0.9416, test_f1: 0.5508
 epoch: 46, train_loss: 0.7900, test_loss: 0.9444, test_f1: 0.5471
 epoch: 47, train_loss: 0.7739, test_loss: 0.9466, test_f1: 0.5425
 epoch: 48, train_loss: 0.7743, test_loss: 0.9484, test_f1: 0.5489
 epoch: 49, train_loss: 0.7761, test_loss: 0.9612, test_f1: 0.5411
 epoch: 50, train_loss: 0.7668, test_loss: 0.9490, test_f1: 0.5514
 epoch: 51, train_loss: 0.7638, test_loss: 0.9499, test_f1: 0.5462
 epoch: 52, train_loss: 0.7612, test_loss: 0.9473, test_f1: 0.5445
 epoch: 53, train_loss: 0.7535, test_loss: 0.9440, test_f1: 0.5454
 epoch: 54, train_loss: 0.7514, test_loss: 0.9328, test_f1: 0.5508
 epoch: 55, train_loss: 0.7456, test_loss: 0.9409, test_f1: 0.5492
 epoch: 56, train_loss: 0.7524, test_loss: 0.9421, test_f1: 0.5417
 epoch: 57, train_loss: 0.7450, test_loss: 0.9453, test_f1: 0.5430
 epoch: 58, train_loss: 0.7461, test_loss: 0.9602, test_f1: 0.5382
 epoch: 59, train_loss: 0.7435, test_loss: 0.9544, test_f1: 0.5487
 epoch: 60, train_loss: 0.7370, test_loss: 0.9381, test_f1: 0.5562
 epoch: 61, train_loss: 0.7456, test_loss: 0.9476, test_f1: 0.5569
 epoch: 62, train_loss: 0.7386, test_loss: 0.9604, test_f1: 0.5502
 epoch: 63, train_loss: 0.7239, test_loss: 0.9591, test_f1: 0.5512
 epoch: 64, train_loss: 0.7273, test_loss: 0.9439, test_f1: 0.5505
 epoch: 65, train_loss: 0.7237, test_loss: 0.9566, test_f1: 0.5454
 epoch: 66, train_loss: 0.7369, test_loss: 0.9582, test_f1: 0.5494
 epoch: 67, train_loss: 0.7273, test_loss: 0.9530, test_f1: 0.5532
 epoch: 68, train_loss: 0.7182, test_loss: 0.9613, test_f1: 0.5434
 epoch: 69, train_loss: 0.7352, test_loss: 0.9439, test_f1: 0.5533
 epoch: 70, train_loss: 0.7175, test_loss: 0.9554, test_f1: 0.5454
 epoch: 71, train_loss: 0.7229, test_loss: 0.9682, test_f1: 0.5428
 epoch: 72, train_loss: 0.7103, test_loss: 0.9573, test_f1: 0.5614
 epoch: 73, train_loss: 0.7099, test_loss: 0.9699, test_f1: 0.5525
 epoch: 74, train_loss: 0.7100, test_loss: 0.9679, test_f1: 0.5457
 epoch: 75, train_loss: 0.7140, test_loss: 0.9703, test_f1: 0.5560
 epoch: 76, train_loss: 0.7047, test_loss: 0.9706, test_f1: 0.5590
 epoch: 77, train_loss: 0.7013, test_loss: 0.9863, test_f1: 0.5571
 epoch: 78, train_loss: 0.6954, test_loss: 0.9750, test_f1: 0.5606
 epoch: 79, train_loss: 0.6922, test_loss: 0.9824, test_f1: 0.5398
 epoch: 80, train_loss: 0.7080, test_loss: 0.9818, test_f1: 0.5570
 epoch: 81, train_loss: 0.6980, test_loss: 0.9729, test_f1: 0.5499
 epoch: 82, train_loss: 0.6880, test_loss: 0.9774, test_f1: 0.5490
 epoch: 83, train_loss: 0.7103, test_loss: 0.9708, test_f1: 0.5438
 epoch: 84, train_loss: 0.6972, test_loss: 0.9812, test_f1: 0.5499
 epoch: 85, train_loss: 0.6916, test_loss: 1.0041, test_f1: 0.5386
 epoch: 86, train_loss: 0.6803, test_loss: 1.0012, test_f1: 0.5391
 epoch: 87, train_loss: 0.6919, test_loss: 1.0065, test_f1: 0.5361
 epoch: 88, train_loss: 0.6818, test_loss: 1.0007, test_f1: 0.5347
 epoch: 89, train_loss: 0.6722, test_loss: 0.9978, test_f1: 0.5388
 epoch: 90, train_loss: 0.6793, test_loss: 1.0132, test_f1: 0.5399
 epoch: 91, train_loss: 0.6854, test_loss: 1.0230, test_f1: 0.5320
 epoch: 92, train_loss: 0.6797, test_loss: 1.0178, test_f1: 0.5308
 epoch: 93, train_loss: 0.6815, test_loss: 0.9952, test_f1: 0.5435
 epoch: 94, train_loss: 0.6850, test_loss: 1.0033, test_f1: 0.5397
 epoch: 95, train_loss: 0.6733, test_loss: 1.0027, test_f1: 0.5451
 epoch: 96, train_loss: 0.6738, test_loss: 1.0014, test_f1: 0.5494
 epoch: 97, train_loss: 0.6720, test_loss: 1.0142, test_f1: 0.5355
 epoch: 98, train_loss: 0.6695, test_loss: 1.0241, test_f1: 0.5406
 epoch: 99, train_loss: 0.6636, test_loss: 1.0248, test_f1: 0.5346

Training completed in 847.51 seconds
Best F1: 0.5637 at epoch 65
Mean F1 across iterations: 0.5511  0.0097
========================FINAL RESULTS================================
FEGIN weighted F1: 0.5637  0.0097
python main.py --data ltspice_examples --representation component_pin --model FEGIN --layers 4 --hiddens 64 --batch_size 256 --lr 0.0001 --emb_size 128 --epochs 100 --save_appendix component_pin_L4_H64_BS256_LR0.0001_E128 --no_val
-----



STDERR:
  File "main.py", line 370, in <module>
    main()
  File "main.py", line 254, in main
    dataset = dataset_class(
  File "/home/philip/projects/llm_inference_code_repo/Circuit-Completion-Using-GNNs/component_classification_with_link_prediction_head/evaluation/FEGIN/kernel/circuit_datasets.py", line 15, in __init__
    self.data, self.slices = torch.load(self.processed_paths[0])
  File "/home/philip/.local/lib/python3.8/site-packages/torch/serialization.py", line 1040, in load
    warnings.warn(
  File "/usr/lib/python3.8/warnings.py", line 109, in _showwarnmsg
    sw(msg.message, msg.category, msg.filename, msg.lineno,
  File "main.py", line 47, in warn_with_traceback
    traceback.print_stack(file=log)
/home/philip/projects/llm_inference_code_repo/Circuit-Completion-Using-GNNs/component_classification_with_link_prediction_head/evaluation/FEGIN/kernel/circuit_datasets.py:15: FutureWarning: You are using `torch.load` with `weights_only=False` (the current default value), which uses the default pickle module implicitly. It is possible to construct malicious pickle data which will execute arbitrary code during unpickling (See https://github.com/pytorch/pytorch/blob/main/SECURITY.md#untrusted-models for more details). In a future release, the default value for `weights_only` will be flipped to `True`. This limits the functions that could be executed during unpickling. Arbitrary objects will no longer be allowed to be loaded via this mode unless they are explicitly allowlisted by the user via `torch.serialization.add_safe_globals`. We recommend you start setting `weights_only=True` for any use case where you don't have full control of the loaded file. Please open an issue on GitHub for any issues related to this experimental feature.
  self.data, self.slices = torch.load(self.processed_paths[0])
