STDOUT:
Results will be saved in /home/philip/projects/ltspice_examples_code_repo/Circuit-Completion-Using-GNNs/component_classification_with_link_prediction_head/evaluation/FEGIN/results/model_FEGIN_dataset_ltspice_examples
Command line input: python main.py --data ltspice_examples --representation component_net --model FEGIN --layers 2 --hiddens 16 --batch_size 256 --lr 0.001 --emb_size 250 --epochs 100 --save_appendix component_net_L2_H16_BS256_LR0.001_E250 --no_val
 is saved.
-----
ltspice_examples - FEGIN
Using 2 layers, 16 hidden units, h = 2
Loading component_net representation dataset
ENTERED
Training FEGIN on component_net representation
Train: 3558, Test: 846
##################ITERATION #0 ****************************************
 epoch: 0, train_loss: 1.4087, test_loss: 1.3918, test_f1: 0.1004
 epoch: 1, train_loss: 1.3876, test_loss: 1.3821, test_f1: 0.1004
 epoch: 2, train_loss: 1.3740, test_loss: 1.3699, test_f1: 0.1004
 epoch: 3, train_loss: 1.3585, test_loss: 1.3522, test_f1: 0.1703
 epoch: 4, train_loss: 1.3376, test_loss: 1.3266, test_f1: 0.3331
 epoch: 5, train_loss: 1.3141, test_loss: 1.2949, test_f1: 0.2373
 epoch: 6, train_loss: 1.2866, test_loss: 1.2683, test_f1: 0.2285
 epoch: 7, train_loss: 1.2665, test_loss: 1.2492, test_f1: 0.2289
 epoch: 8, train_loss: 1.2531, test_loss: 1.2319, test_f1: 0.2368
 epoch: 9, train_loss: 1.2419, test_loss: 1.2168, test_f1: 0.2439
 epoch: 10, train_loss: 1.2283, test_loss: 1.2008, test_f1: 0.2809
 epoch: 11, train_loss: 1.2103, test_loss: 1.1864, test_f1: 0.2994
 epoch: 12, train_loss: 1.1926, test_loss: 1.1639, test_f1: 0.3683
 epoch: 13, train_loss: 1.1840, test_loss: 1.1495, test_f1: 0.3833
 epoch: 14, train_loss: 1.1660, test_loss: 1.1271, test_f1: 0.3992
 epoch: 15, train_loss: 1.1470, test_loss: 1.1087, test_f1: 0.3959
 epoch: 16, train_loss: 1.1300, test_loss: 1.1016, test_f1: 0.4032
 epoch: 17, train_loss: 1.1123, test_loss: 1.0764, test_f1: 0.4088
 epoch: 18, train_loss: 1.1114, test_loss: 1.0865, test_f1: 0.3877
 epoch: 19, train_loss: 1.0893, test_loss: 1.0489, test_f1: 0.4287
 epoch: 20, train_loss: 1.0837, test_loss: 1.0533, test_f1: 0.3998
 epoch: 21, train_loss: 1.0706, test_loss: 1.0385, test_f1: 0.4233
 epoch: 22, train_loss: 1.0580, test_loss: 1.0296, test_f1: 0.4050
 epoch: 23, train_loss: 1.0486, test_loss: 1.0209, test_f1: 0.4440
 epoch: 24, train_loss: 1.0522, test_loss: 1.0195, test_f1: 0.4665
 epoch: 25, train_loss: 1.0343, test_loss: 1.0203, test_f1: 0.4627
 epoch: 26, train_loss: 1.0317, test_loss: 1.0149, test_f1: 0.4618
 epoch: 27, train_loss: 1.0212, test_loss: 0.9971, test_f1: 0.4611
 epoch: 28, train_loss: 1.0233, test_loss: 1.0108, test_f1: 0.4564
 epoch: 29, train_loss: 1.0157, test_loss: 0.9862, test_f1: 0.4630
 epoch: 30, train_loss: 1.0062, test_loss: 0.9786, test_f1: 0.4794
 epoch: 31, train_loss: 1.0126, test_loss: 1.0003, test_f1: 0.4660
 epoch: 32, train_loss: 1.0041, test_loss: 0.9853, test_f1: 0.4678
 epoch: 33, train_loss: 1.0002, test_loss: 1.0017, test_f1: 0.4803
 epoch: 34, train_loss: 0.9951, test_loss: 0.9790, test_f1: 0.4825
 epoch: 35, train_loss: 0.9864, test_loss: 0.9788, test_f1: 0.4610
 epoch: 36, train_loss: 0.9875, test_loss: 0.9803, test_f1: 0.4724
 epoch: 37, train_loss: 0.9845, test_loss: 1.0021, test_f1: 0.4714
 epoch: 38, train_loss: 0.9872, test_loss: 0.9831, test_f1: 0.4743
 epoch: 39, train_loss: 0.9800, test_loss: 0.9540, test_f1: 0.4859
 epoch: 40, train_loss: 0.9703, test_loss: 0.9825, test_f1: 0.4856
 epoch: 41, train_loss: 0.9808, test_loss: 0.9734, test_f1: 0.4857
 epoch: 42, train_loss: 0.9745, test_loss: 0.9586, test_f1: 0.4810
 epoch: 43, train_loss: 0.9685, test_loss: 0.9440, test_f1: 0.4987
 epoch: 44, train_loss: 0.9632, test_loss: 0.9564, test_f1: 0.4883
 epoch: 45, train_loss: 0.9667, test_loss: 0.9987, test_f1: 0.4764
 epoch: 46, train_loss: 0.9543, test_loss: 0.9346, test_f1: 0.5099
 epoch: 47, train_loss: 0.9426, test_loss: 0.9467, test_f1: 0.5067
 epoch: 48, train_loss: 0.9506, test_loss: 0.9287, test_f1: 0.5000
 epoch: 49, train_loss: 0.9410, test_loss: 0.9703, test_f1: 0.4969
 epoch: 50, train_loss: 0.9527, test_loss: 0.9428, test_f1: 0.5127
 epoch: 51, train_loss: 0.9409, test_loss: 0.9607, test_f1: 0.5106
 epoch: 52, train_loss: 0.9390, test_loss: 0.9294, test_f1: 0.4942
 epoch: 53, train_loss: 0.9334, test_loss: 0.9447, test_f1: 0.4986
 epoch: 54, train_loss: 0.9337, test_loss: 0.9296, test_f1: 0.4914
 epoch: 55, train_loss: 0.9300, test_loss: 0.9464, test_f1: 0.4959
 epoch: 56, train_loss: 0.9305, test_loss: 0.9370, test_f1: 0.4947
 epoch: 57, train_loss: 0.9337, test_loss: 0.9235, test_f1: 0.5139
 epoch: 58, train_loss: 0.9337, test_loss: 0.9653, test_f1: 0.5197
 epoch: 59, train_loss: 0.9302, test_loss: 0.9207, test_f1: 0.5072
 epoch: 60, train_loss: 0.9220, test_loss: 0.9491, test_f1: 0.4999
 epoch: 61, train_loss: 0.9259, test_loss: 0.9269, test_f1: 0.4948
 epoch: 62, train_loss: 0.9243, test_loss: 0.9501, test_f1: 0.5234
 epoch: 63, train_loss: 0.9177, test_loss: 0.9347, test_f1: 0.5173
 epoch: 64, train_loss: 0.9160, test_loss: 0.9288, test_f1: 0.5301
 epoch: 65, train_loss: 0.9167, test_loss: 0.9361, test_f1: 0.5129
 epoch: 66, train_loss: 0.9173, test_loss: 0.9278, test_f1: 0.5143
 epoch: 67, train_loss: 0.9100, test_loss: 0.9332, test_f1: 0.5056
 epoch: 68, train_loss: 0.9161, test_loss: 0.9245, test_f1: 0.5198
 epoch: 69, train_loss: 0.9080, test_loss: 0.9498, test_f1: 0.5290
 epoch: 70, train_loss: 0.9171, test_loss: 0.9130, test_f1: 0.5277
 epoch: 71, train_loss: 0.9135, test_loss: 0.9357, test_f1: 0.5123
 epoch: 72, train_loss: 0.9134, test_loss: 0.9307, test_f1: 0.5190
 epoch: 73, train_loss: 0.9089, test_loss: 0.9369, test_f1: 0.5054
 epoch: 74, train_loss: 0.9072, test_loss: 0.9285, test_f1: 0.5138
 epoch: 75, train_loss: 0.9068, test_loss: 0.9248, test_f1: 0.5039
 epoch: 76, train_loss: 0.9021, test_loss: 0.9170, test_f1: 0.5268
 epoch: 77, train_loss: 0.9033, test_loss: 0.9321, test_f1: 0.5155
 epoch: 78, train_loss: 0.9105, test_loss: 0.9144, test_f1: 0.5194
 epoch: 79, train_loss: 0.9012, test_loss: 0.9375, test_f1: 0.5315
 epoch: 80, train_loss: 0.9028, test_loss: 0.9120, test_f1: 0.4987
 epoch: 81, train_loss: 0.9014, test_loss: 0.9205, test_f1: 0.5213
 epoch: 82, train_loss: 0.8892, test_loss: 0.9184, test_f1: 0.4926
 epoch: 83, train_loss: 0.8962, test_loss: 0.9098, test_f1: 0.5129
 epoch: 84, train_loss: 0.8946, test_loss: 0.9046, test_f1: 0.5087
 epoch: 85, train_loss: 0.8872, test_loss: 0.9185, test_f1: 0.5047
 epoch: 86, train_loss: 0.8920, test_loss: 0.9265, test_f1: 0.5306
 epoch: 87, train_loss: 0.8834, test_loss: 0.9157, test_f1: 0.5075
 epoch: 88, train_loss: 0.9013, test_loss: 0.9174, test_f1: 0.5234
 epoch: 89, train_loss: 0.8982, test_loss: 0.9331, test_f1: 0.4895
 epoch: 90, train_loss: 0.8937, test_loss: 0.9207, test_f1: 0.5246
 epoch: 91, train_loss: 0.8963, test_loss: 0.9099, test_f1: 0.5185
 epoch: 92, train_loss: 0.8899, test_loss: 0.9310, test_f1: 0.5147
 epoch: 93, train_loss: 0.8896, test_loss: 0.9290, test_f1: 0.5085
 epoch: 94, train_loss: 0.8818, test_loss: 0.9170, test_f1: 0.5113
 epoch: 95, train_loss: 0.8823, test_loss: 0.9109, test_f1: 0.5160
 epoch: 96, train_loss: 0.8811, test_loss: 0.9360, test_f1: 0.5331
 epoch: 97, train_loss: 0.8812, test_loss: 0.9207, test_f1: 0.5305
 epoch: 98, train_loss: 0.8801, test_loss: 0.9296, test_f1: 0.5049
 epoch: 99, train_loss: 0.8885, test_loss: 0.9299, test_f1: 0.5284
##################ITERATION #1 ****************************************
 epoch: 0, train_loss: 1.3246, test_loss: 1.3329, test_f1: 0.1005
 epoch: 1, train_loss: 1.2836, test_loss: 1.3115, test_f1: 0.2270
 epoch: 2, train_loss: 1.2584, test_loss: 1.2679, test_f1: 0.2270
 epoch: 3, train_loss: 1.2357, test_loss: 1.2225, test_f1: 0.2549
 epoch: 4, train_loss: 1.2166, test_loss: 1.1851, test_f1: 0.3203
 epoch: 5, train_loss: 1.1917, test_loss: 1.1505, test_f1: 0.3268
 epoch: 6, train_loss: 1.1671, test_loss: 1.1209, test_f1: 0.3382
 epoch: 7, train_loss: 1.1439, test_loss: 1.0995, test_f1: 0.3525
 epoch: 8, train_loss: 1.1246, test_loss: 1.0875, test_f1: 0.3560
 epoch: 9, train_loss: 1.1106, test_loss: 1.0749, test_f1: 0.3791
 epoch: 10, train_loss: 1.0992, test_loss: 1.0599, test_f1: 0.3835
 epoch: 11, train_loss: 1.0892, test_loss: 1.0501, test_f1: 0.4025
 epoch: 12, train_loss: 1.0744, test_loss: 1.0386, test_f1: 0.4055
 epoch: 13, train_loss: 1.0677, test_loss: 1.0325, test_f1: 0.4067
 epoch: 14, train_loss: 1.0641, test_loss: 1.0244, test_f1: 0.4151
 epoch: 15, train_loss: 1.0506, test_loss: 1.0212, test_f1: 0.4133
 epoch: 16, train_loss: 1.0465, test_loss: 1.0164, test_f1: 0.4282
 epoch: 17, train_loss: 1.0304, test_loss: 1.0123, test_f1: 0.4368
 epoch: 18, train_loss: 1.0316, test_loss: 1.0003, test_f1: 0.4251
 epoch: 19, train_loss: 1.0225, test_loss: 1.0204, test_f1: 0.4469
 epoch: 20, train_loss: 1.0085, test_loss: 0.9934, test_f1: 0.4434
 epoch: 21, train_loss: 1.0072, test_loss: 0.9869, test_f1: 0.4462
 epoch: 22, train_loss: 1.0014, test_loss: 1.0004, test_f1: 0.4472
 epoch: 23, train_loss: 0.9944, test_loss: 0.9901, test_f1: 0.4459
 epoch: 24, train_loss: 0.9862, test_loss: 0.9845, test_f1: 0.4520
 epoch: 25, train_loss: 0.9891, test_loss: 0.9850, test_f1: 0.4629
 epoch: 26, train_loss: 0.9800, test_loss: 0.9898, test_f1: 0.4680
 epoch: 27, train_loss: 0.9719, test_loss: 0.9931, test_f1: 0.4571
 epoch: 28, train_loss: 0.9670, test_loss: 0.9713, test_f1: 0.4674
 epoch: 29, train_loss: 0.9683, test_loss: 0.9804, test_f1: 0.4765
 epoch: 30, train_loss: 0.9641, test_loss: 0.9740, test_f1: 0.4799
 epoch: 31, train_loss: 0.9566, test_loss: 0.9779, test_f1: 0.4957
 epoch: 32, train_loss: 0.9475, test_loss: 0.9853, test_f1: 0.4771
 epoch: 33, train_loss: 0.9522, test_loss: 0.9708, test_f1: 0.4924
 epoch: 34, train_loss: 0.9478, test_loss: 0.9991, test_f1: 0.4878
 epoch: 35, train_loss: 0.9450, test_loss: 0.9883, test_f1: 0.5022
 epoch: 36, train_loss: 0.9413, test_loss: 0.9812, test_f1: 0.4983
 epoch: 37, train_loss: 0.9418, test_loss: 0.9758, test_f1: 0.5014
 epoch: 38, train_loss: 0.9384, test_loss: 1.0027, test_f1: 0.4806
 epoch: 39, train_loss: 0.9261, test_loss: 0.9963, test_f1: 0.4862
 epoch: 40, train_loss: 0.9274, test_loss: 0.9762, test_f1: 0.5005
 epoch: 41, train_loss: 0.9260, test_loss: 0.9777, test_f1: 0.5083
 epoch: 42, train_loss: 0.9135, test_loss: 1.0058, test_f1: 0.4936
 epoch: 43, train_loss: 0.9284, test_loss: 0.9751, test_f1: 0.5215
 epoch: 44, train_loss: 0.9137, test_loss: 0.9764, test_f1: 0.4983
 epoch: 45, train_loss: 0.9092, test_loss: 0.9702, test_f1: 0.5168
 epoch: 46, train_loss: 0.9112, test_loss: 0.9928, test_f1: 0.4982
 epoch: 47, train_loss: 0.9084, test_loss: 1.0005, test_f1: 0.5063
 epoch: 48, train_loss: 0.9116, test_loss: 0.9572, test_f1: 0.5205
 epoch: 49, train_loss: 0.8996, test_loss: 1.0066, test_f1: 0.4956
 epoch: 50, train_loss: 0.9017, test_loss: 0.9242, test_f1: 0.5160
 epoch: 51, train_loss: 0.9054, test_loss: 0.9496, test_f1: 0.5137
 epoch: 52, train_loss: 0.8908, test_loss: 0.9613, test_f1: 0.5150
 epoch: 53, train_loss: 0.8862, test_loss: 0.9520, test_f1: 0.5188
 epoch: 54, train_loss: 0.8901, test_loss: 0.9707, test_f1: 0.5198
 epoch: 55, train_loss: 0.8926, test_loss: 0.9640, test_f1: 0.5198
 epoch: 56, train_loss: 0.8866, test_loss: 0.9587, test_f1: 0.5093
 epoch: 57, train_loss: 0.8941, test_loss: 0.9664, test_f1: 0.5176
 epoch: 58, train_loss: 0.8839, test_loss: 0.9781, test_f1: 0.5113
 epoch: 59, train_loss: 0.8857, test_loss: 0.9592, test_f1: 0.5146
 epoch: 60, train_loss: 0.8906, test_loss: 0.9683, test_f1: 0.5169
 epoch: 61, train_loss: 0.8766, test_loss: 0.9488, test_f1: 0.5172
 epoch: 62, train_loss: 0.8797, test_loss: 0.9735, test_f1: 0.5100
 epoch: 63, train_loss: 0.8828, test_loss: 0.9629, test_f1: 0.5193
 epoch: 64, train_loss: 0.8855, test_loss: 0.9658, test_f1: 0.5167
 epoch: 65, train_loss: 0.8902, test_loss: 0.9920, test_f1: 0.5151
 epoch: 66, train_loss: 0.8851, test_loss: 0.9616, test_f1: 0.5187
 epoch: 67, train_loss: 0.8810, test_loss: 0.9533, test_f1: 0.5065
 epoch: 68, train_loss: 0.8780, test_loss: 0.9673, test_f1: 0.5130
 epoch: 69, train_loss: 0.8698, test_loss: 0.9668, test_f1: 0.5207
 epoch: 70, train_loss: 0.8770, test_loss: 0.9619, test_f1: 0.5176
 epoch: 71, train_loss: 0.8699, test_loss: 0.9778, test_f1: 0.5126
 epoch: 72, train_loss: 0.8745, test_loss: 0.9582, test_f1: 0.5183
 epoch: 73, train_loss: 0.8762, test_loss: 0.9676, test_f1: 0.5093
 epoch: 74, train_loss: 0.8655, test_loss: 0.9691, test_f1: 0.5035
 epoch: 75, train_loss: 0.8799, test_loss: 0.9645, test_f1: 0.5134
 epoch: 76, train_loss: 0.8694, test_loss: 0.9657, test_f1: 0.5183
 epoch: 77, train_loss: 0.8629, test_loss: 0.9437, test_f1: 0.5112
 epoch: 78, train_loss: 0.8641, test_loss: 0.9501, test_f1: 0.5094
 epoch: 79, train_loss: 0.8716, test_loss: 0.9648, test_f1: 0.5128
 epoch: 80, train_loss: 0.8698, test_loss: 0.9855, test_f1: 0.5074
 epoch: 81, train_loss: 0.8615, test_loss: 0.9619, test_f1: 0.5176
 epoch: 82, train_loss: 0.8645, test_loss: 0.9784, test_f1: 0.5024
 epoch: 83, train_loss: 0.8600, test_loss: 0.9756, test_f1: 0.5147
 epoch: 84, train_loss: 0.8692, test_loss: 0.9760, test_f1: 0.5126
 epoch: 85, train_loss: 0.8677, test_loss: 0.9791, test_f1: 0.5092
 epoch: 86, train_loss: 0.8603, test_loss: 0.9752, test_f1: 0.5092
 epoch: 87, train_loss: 0.8650, test_loss: 0.9927, test_f1: 0.5053
 epoch: 88, train_loss: 0.8499, test_loss: 0.9625, test_f1: 0.5175
 epoch: 89, train_loss: 0.8593, test_loss: 0.9778, test_f1: 0.5243
 epoch: 90, train_loss: 0.8646, test_loss: 0.9841, test_f1: 0.5089
 epoch: 91, train_loss: 0.8456, test_loss: 0.9678, test_f1: 0.5095
 epoch: 92, train_loss: 0.8586, test_loss: 0.9770, test_f1: 0.5067
 epoch: 93, train_loss: 0.8548, test_loss: 0.9813, test_f1: 0.5128
 epoch: 94, train_loss: 0.8597, test_loss: 1.0041, test_f1: 0.5039
 epoch: 95, train_loss: 0.8520, test_loss: 0.9779, test_f1: 0.5087
 epoch: 96, train_loss: 0.8502, test_loss: 0.9918, test_f1: 0.5097
 epoch: 97, train_loss: 0.8477, test_loss: 0.9756, test_f1: 0.5084
 epoch: 98, train_loss: 0.8512, test_loss: 0.9860, test_f1: 0.5106
 epoch: 99, train_loss: 0.8547, test_loss: 0.9738, test_f1: 0.5103
##################ITERATION #2 ****************************************
 epoch: 0, train_loss: 1.2947, test_loss: 1.3152, test_f1: 0.2270
 epoch: 1, train_loss: 1.2403, test_loss: 1.3010, test_f1: 0.2270
 epoch: 2, train_loss: 1.2196, test_loss: 1.2565, test_f1: 0.2270
 epoch: 3, train_loss: 1.1955, test_loss: 1.2045, test_f1: 0.2289
 epoch: 4, train_loss: 1.1773, test_loss: 1.1573, test_f1: 0.2931
 epoch: 5, train_loss: 1.1484, test_loss: 1.1154, test_f1: 0.3825
 epoch: 6, train_loss: 1.1286, test_loss: 1.0899, test_f1: 0.3870
 epoch: 7, train_loss: 1.1140, test_loss: 1.0725, test_f1: 0.3934
 epoch: 8, train_loss: 1.0918, test_loss: 1.0567, test_f1: 0.3856
 epoch: 9, train_loss: 1.0792, test_loss: 1.0352, test_f1: 0.3842
 epoch: 10, train_loss: 1.0661, test_loss: 1.0260, test_f1: 0.4006
 epoch: 11, train_loss: 1.0559, test_loss: 1.0208, test_f1: 0.3951
 epoch: 12, train_loss: 1.0443, test_loss: 1.0172, test_f1: 0.3914
 epoch: 13, train_loss: 1.0277, test_loss: 1.0045, test_f1: 0.4207
 epoch: 14, train_loss: 1.0263, test_loss: 1.0179, test_f1: 0.4225
 epoch: 15, train_loss: 1.0281, test_loss: 1.0085, test_f1: 0.4160
 epoch: 16, train_loss: 1.0184, test_loss: 0.9957, test_f1: 0.4312
 epoch: 17, train_loss: 1.0078, test_loss: 1.0056, test_f1: 0.4263
 epoch: 18, train_loss: 1.0112, test_loss: 0.9966, test_f1: 0.4271
 epoch: 19, train_loss: 1.0182, test_loss: 1.0098, test_f1: 0.4482
 epoch: 20, train_loss: 1.0033, test_loss: 0.9946, test_f1: 0.4452
 epoch: 21, train_loss: 0.9873, test_loss: 0.9911, test_f1: 0.4454
 epoch: 22, train_loss: 0.9859, test_loss: 0.9846, test_f1: 0.4773
 epoch: 23, train_loss: 0.9879, test_loss: 0.9700, test_f1: 0.4858
 epoch: 24, train_loss: 0.9758, test_loss: 0.9764, test_f1: 0.4746
 epoch: 25, train_loss: 0.9714, test_loss: 0.9742, test_f1: 0.4821
 epoch: 26, train_loss: 0.9821, test_loss: 0.9857, test_f1: 0.4769
 epoch: 27, train_loss: 0.9746, test_loss: 0.9790, test_f1: 0.4882
 epoch: 28, train_loss: 0.9708, test_loss: 0.9869, test_f1: 0.4858
 epoch: 29, train_loss: 0.9700, test_loss: 0.9840, test_f1: 0.4673
 epoch: 30, train_loss: 0.9579, test_loss: 0.9697, test_f1: 0.4841
 epoch: 31, train_loss: 0.9514, test_loss: 0.9679, test_f1: 0.4933
 epoch: 32, train_loss: 0.9555, test_loss: 0.9820, test_f1: 0.5007
 epoch: 33, train_loss: 0.9525, test_loss: 0.9577, test_f1: 0.4871
 epoch: 34, train_loss: 0.9539, test_loss: 1.0139, test_f1: 0.4830
 epoch: 35, train_loss: 0.9464, test_loss: 0.9619, test_f1: 0.4949
 epoch: 36, train_loss: 0.9431, test_loss: 0.9860, test_f1: 0.4858
 epoch: 37, train_loss: 0.9386, test_loss: 0.9682, test_f1: 0.4980
 epoch: 38, train_loss: 0.9388, test_loss: 0.9495, test_f1: 0.5049
 epoch: 39, train_loss: 0.9430, test_loss: 0.9762, test_f1: 0.5094
 epoch: 40, train_loss: 0.9412, test_loss: 0.9810, test_f1: 0.4907
 epoch: 41, train_loss: 0.9336, test_loss: 0.9758, test_f1: 0.4739
 epoch: 42, train_loss: 0.9252, test_loss: 0.9660, test_f1: 0.5037
 epoch: 43, train_loss: 0.9357, test_loss: 0.9584, test_f1: 0.5045
 epoch: 44, train_loss: 0.9294, test_loss: 0.9401, test_f1: 0.5043
 epoch: 45, train_loss: 0.9209, test_loss: 0.9849, test_f1: 0.4873
 epoch: 46, train_loss: 0.9310, test_loss: 0.9951, test_f1: 0.4846
 epoch: 47, train_loss: 0.9217, test_loss: 0.9762, test_f1: 0.4913
 epoch: 48, train_loss: 0.9202, test_loss: 0.9660, test_f1: 0.4926
 epoch: 49, train_loss: 0.9139, test_loss: 0.9628, test_f1: 0.5067
 epoch: 50, train_loss: 0.9096, test_loss: 0.9591, test_f1: 0.5084
 epoch: 51, train_loss: 0.9094, test_loss: 0.9633, test_f1: 0.5071
 epoch: 52, train_loss: 0.9061, test_loss: 0.9393, test_f1: 0.5130
 epoch: 53, train_loss: 0.9114, test_loss: 0.9690, test_f1: 0.5061
 epoch: 54, train_loss: 0.9100, test_loss: 0.9536, test_f1: 0.4974
 epoch: 55, train_loss: 0.9034, test_loss: 0.9635, test_f1: 0.5133
 epoch: 56, train_loss: 0.9037, test_loss: 0.9767, test_f1: 0.5108
 epoch: 57, train_loss: 0.9268, test_loss: 0.9684, test_f1: 0.4954
 epoch: 58, train_loss: 0.8997, test_loss: 0.9674, test_f1: 0.5134
 epoch: 59, train_loss: 0.8977, test_loss: 0.9675, test_f1: 0.5139
 epoch: 60, train_loss: 0.9041, test_loss: 0.9568, test_f1: 0.4987
 epoch: 61, train_loss: 0.9002, test_loss: 0.9530, test_f1: 0.5044
 epoch: 62, train_loss: 0.9032, test_loss: 0.9612, test_f1: 0.5046
 epoch: 63, train_loss: 0.8949, test_loss: 0.9655, test_f1: 0.5041
 epoch: 64, train_loss: 0.8965, test_loss: 0.9581, test_f1: 0.5141
 epoch: 65, train_loss: 0.8976, test_loss: 0.9597, test_f1: 0.5058
 epoch: 66, train_loss: 0.8950, test_loss: 0.9696, test_f1: 0.5086
 epoch: 67, train_loss: 0.8941, test_loss: 0.9558, test_f1: 0.5123
 epoch: 68, train_loss: 0.8926, test_loss: 0.9460, test_f1: 0.5109
 epoch: 69, train_loss: 0.8931, test_loss: 0.9730, test_f1: 0.5151
 epoch: 70, train_loss: 0.8981, test_loss: 0.9567, test_f1: 0.5097
 epoch: 71, train_loss: 0.8952, test_loss: 0.9456, test_f1: 0.5128
 epoch: 72, train_loss: 0.8811, test_loss: 0.9634, test_f1: 0.5122
 epoch: 73, train_loss: 0.8828, test_loss: 0.9581, test_f1: 0.5146
 epoch: 74, train_loss: 0.8832, test_loss: 0.9620, test_f1: 0.5099
 epoch: 75, train_loss: 0.8943, test_loss: 0.9490, test_f1: 0.5181
 epoch: 76, train_loss: 0.8831, test_loss: 0.9539, test_f1: 0.5193
 epoch: 77, train_loss: 0.8861, test_loss: 0.9516, test_f1: 0.5150
 epoch: 78, train_loss: 0.8833, test_loss: 0.9670, test_f1: 0.5082
 epoch: 79, train_loss: 0.8817, test_loss: 0.9656, test_f1: 0.5246
 epoch: 80, train_loss: 0.8809, test_loss: 0.9489, test_f1: 0.5193
 epoch: 81, train_loss: 0.8861, test_loss: 0.9687, test_f1: 0.5181
 epoch: 82, train_loss: 0.8885, test_loss: 0.9661, test_f1: 0.5204
 epoch: 83, train_loss: 0.8801, test_loss: 0.9590, test_f1: 0.5215
 epoch: 84, train_loss: 0.8808, test_loss: 0.9555, test_f1: 0.5182
 epoch: 85, train_loss: 0.8718, test_loss: 0.9307, test_f1: 0.5169
 epoch: 86, train_loss: 0.8839, test_loss: 0.9387, test_f1: 0.5207
 epoch: 87, train_loss: 0.8748, test_loss: 0.9444, test_f1: 0.5247
 epoch: 88, train_loss: 0.8807, test_loss: 0.9262, test_f1: 0.5271
 epoch: 89, train_loss: 0.8734, test_loss: 0.9586, test_f1: 0.5148
 epoch: 90, train_loss: 0.8677, test_loss: 0.9476, test_f1: 0.5161
 epoch: 91, train_loss: 0.8768, test_loss: 0.9640, test_f1: 0.5155
 epoch: 92, train_loss: 0.8686, test_loss: 0.9357, test_f1: 0.5248
 epoch: 93, train_loss: 0.8764, test_loss: 0.9656, test_f1: 0.5234
 epoch: 94, train_loss: 0.8664, test_loss: 0.9636, test_f1: 0.5076
 epoch: 95, train_loss: 0.8695, test_loss: 0.9471, test_f1: 0.5308
 epoch: 96, train_loss: 0.8773, test_loss: 0.9154, test_f1: 0.5210
 epoch: 97, train_loss: 0.8690, test_loss: 0.9482, test_f1: 0.5077
 epoch: 98, train_loss: 0.8602, test_loss: 0.9608, test_f1: 0.5219
 epoch: 99, train_loss: 0.8576, test_loss: 0.9368, test_f1: 0.5245
##################ITERATION #3 ****************************************
 epoch: 0, train_loss: 1.2904, test_loss: 1.3203, test_f1: 0.2270
 epoch: 1, train_loss: 1.2318, test_loss: 1.2917, test_f1: 0.2270
 epoch: 2, train_loss: 1.2022, test_loss: 1.2637, test_f1: 0.2270
 epoch: 3, train_loss: 1.1866, test_loss: 1.2289, test_f1: 0.2295
 epoch: 4, train_loss: 1.1690, test_loss: 1.1910, test_f1: 0.2575
 epoch: 5, train_loss: 1.1568, test_loss: 1.1280, test_f1: 0.3552
 epoch: 6, train_loss: 1.1496, test_loss: 1.0995, test_f1: 0.3751
 epoch: 7, train_loss: 1.1356, test_loss: 1.0960, test_f1: 0.3786
 epoch: 8, train_loss: 1.1220, test_loss: 1.0801, test_f1: 0.3990
 epoch: 9, train_loss: 1.1162, test_loss: 1.0705, test_f1: 0.4045
 epoch: 10, train_loss: 1.1092, test_loss: 1.0487, test_f1: 0.4048
 epoch: 11, train_loss: 1.1043, test_loss: 1.0435, test_f1: 0.4156
 epoch: 12, train_loss: 1.0938, test_loss: 1.0431, test_f1: 0.4056
 epoch: 13, train_loss: 1.0734, test_loss: 1.0334, test_f1: 0.4017
 epoch: 14, train_loss: 1.0722, test_loss: 1.0308, test_f1: 0.3950
 epoch: 15, train_loss: 1.0742, test_loss: 1.0252, test_f1: 0.4110
 epoch: 16, train_loss: 1.0580, test_loss: 1.0152, test_f1: 0.4122
 epoch: 17, train_loss: 1.0651, test_loss: 1.0175, test_f1: 0.4365
 epoch: 18, train_loss: 1.0486, test_loss: 1.0159, test_f1: 0.4235
 epoch: 19, train_loss: 1.0491, test_loss: 1.0168, test_f1: 0.4384
 epoch: 20, train_loss: 1.0435, test_loss: 1.0168, test_f1: 0.4375
 epoch: 21, train_loss: 1.0286, test_loss: 1.0018, test_f1: 0.4399
 epoch: 22, train_loss: 1.0254, test_loss: 1.0084, test_f1: 0.4433
 epoch: 23, train_loss: 1.0165, test_loss: 1.0223, test_f1: 0.4442
 epoch: 24, train_loss: 1.0096, test_loss: 1.0037, test_f1: 0.4517
 epoch: 25, train_loss: 1.0054, test_loss: 1.0090, test_f1: 0.4637
 epoch: 26, train_loss: 1.0031, test_loss: 0.9968, test_f1: 0.4570
 epoch: 27, train_loss: 1.0025, test_loss: 1.0019, test_f1: 0.4476
 epoch: 28, train_loss: 0.9992, test_loss: 1.0060, test_f1: 0.4533
 epoch: 29, train_loss: 0.9824, test_loss: 1.0058, test_f1: 0.4754
 epoch: 30, train_loss: 0.9804, test_loss: 1.0113, test_f1: 0.4647
 epoch: 31, train_loss: 0.9774, test_loss: 0.9974, test_f1: 0.4733
 epoch: 32, train_loss: 0.9804, test_loss: 1.0054, test_f1: 0.4749
 epoch: 33, train_loss: 0.9782, test_loss: 1.0031, test_f1: 0.4723
 epoch: 34, train_loss: 0.9758, test_loss: 1.0126, test_f1: 0.4835
 epoch: 35, train_loss: 0.9703, test_loss: 1.0008, test_f1: 0.4674
 epoch: 36, train_loss: 0.9748, test_loss: 1.0000, test_f1: 0.4760
 epoch: 37, train_loss: 0.9635, test_loss: 0.9997, test_f1: 0.4800
 epoch: 38, train_loss: 0.9621, test_loss: 0.9980, test_f1: 0.4827
 epoch: 39, train_loss: 0.9569, test_loss: 1.0035, test_f1: 0.4821
 epoch: 40, train_loss: 0.9626, test_loss: 0.9908, test_f1: 0.4800
 epoch: 41, train_loss: 0.9547, test_loss: 0.9915, test_f1: 0.4818
 epoch: 42, train_loss: 0.9521, test_loss: 1.0114, test_f1: 0.4907
 epoch: 43, train_loss: 0.9532, test_loss: 0.9979, test_f1: 0.4772
 epoch: 44, train_loss: 0.9566, test_loss: 0.9988, test_f1: 0.4805
 epoch: 45, train_loss: 0.9494, test_loss: 0.9930, test_f1: 0.4736
 epoch: 46, train_loss: 0.9456, test_loss: 0.9788, test_f1: 0.4807
 epoch: 47, train_loss: 0.9484, test_loss: 0.9766, test_f1: 0.4826
 epoch: 48, train_loss: 0.9474, test_loss: 0.9824, test_f1: 0.4892
 epoch: 49, train_loss: 0.9396, test_loss: 0.9801, test_f1: 0.4746
 epoch: 50, train_loss: 0.9454, test_loss: 0.9795, test_f1: 0.4858
 epoch: 51, train_loss: 0.9396, test_loss: 0.9746, test_f1: 0.4854
 epoch: 52, train_loss: 0.9444, test_loss: 0.9827, test_f1: 0.4907
 epoch: 53, train_loss: 0.9388, test_loss: 0.9734, test_f1: 0.4841
 epoch: 54, train_loss: 0.9398, test_loss: 0.9605, test_f1: 0.4831
 epoch: 55, train_loss: 0.9382, test_loss: 0.9673, test_f1: 0.4837
 epoch: 56, train_loss: 0.9339, test_loss: 0.9655, test_f1: 0.4839
 epoch: 57, train_loss: 0.9353, test_loss: 1.0009, test_f1: 0.4860
 epoch: 58, train_loss: 0.9339, test_loss: 0.9717, test_f1: 0.4790
 epoch: 59, train_loss: 0.9335, test_loss: 0.9729, test_f1: 0.4954
 epoch: 60, train_loss: 0.9296, test_loss: 0.9758, test_f1: 0.4885
 epoch: 61, train_loss: 0.9295, test_loss: 0.9709, test_f1: 0.4852
 epoch: 62, train_loss: 0.9256, test_loss: 0.9811, test_f1: 0.4876
 epoch: 63, train_loss: 0.9339, test_loss: 0.9726, test_f1: 0.4906
 epoch: 64, train_loss: 0.9338, test_loss: 0.9750, test_f1: 0.4891
 epoch: 65, train_loss: 0.9244, test_loss: 0.9852, test_f1: 0.4878
 epoch: 66, train_loss: 0.9289, test_loss: 0.9674, test_f1: 0.4876
 epoch: 67, train_loss: 0.9328, test_loss: 0.9736, test_f1: 0.4858
 epoch: 68, train_loss: 0.9275, test_loss: 0.9886, test_f1: 0.4966
 epoch: 69, train_loss: 0.9197, test_loss: 0.9660, test_f1: 0.4845
 epoch: 70, train_loss: 0.9235, test_loss: 0.9854, test_f1: 0.5025
 epoch: 71, train_loss: 0.9263, test_loss: 0.9773, test_f1: 0.4955
 epoch: 72, train_loss: 0.9251, test_loss: 0.9635, test_f1: 0.4845
 epoch: 73, train_loss: 0.9197, test_loss: 0.9914, test_f1: 0.4894
 epoch: 74, train_loss: 0.9182, test_loss: 0.9724, test_f1: 0.4925
 epoch: 75, train_loss: 0.9206, test_loss: 0.9739, test_f1: 0.4934
 epoch: 76, train_loss: 0.9319, test_loss: 0.9687, test_f1: 0.4932
 epoch: 77, train_loss: 0.9152, test_loss: 0.9801, test_f1: 0.4901
 epoch: 78, train_loss: 0.9173, test_loss: 0.9725, test_f1: 0.4857
 epoch: 79, train_loss: 0.9207, test_loss: 0.9767, test_f1: 0.4865
 epoch: 80, train_loss: 0.9117, test_loss: 0.9646, test_f1: 0.4883
 epoch: 81, train_loss: 0.9133, test_loss: 0.9661, test_f1: 0.4880
 epoch: 82, train_loss: 0.9196, test_loss: 0.9710, test_f1: 0.4910
 epoch: 83, train_loss: 0.9111, test_loss: 0.9620, test_f1: 0.4887
 epoch: 84, train_loss: 0.9110, test_loss: 0.9655, test_f1: 0.4879
 epoch: 85, train_loss: 0.9094, test_loss: 0.9722, test_f1: 0.4943
 epoch: 86, train_loss: 0.9057, test_loss: 0.9737, test_f1: 0.4904
 epoch: 87, train_loss: 0.9129, test_loss: 0.9700, test_f1: 0.4897
 epoch: 88, train_loss: 0.9140, test_loss: 0.9802, test_f1: 0.4850
 epoch: 89, train_loss: 0.9059, test_loss: 0.9650, test_f1: 0.4843
 epoch: 90, train_loss: 0.9057, test_loss: 0.9763, test_f1: 0.4882
 epoch: 91, train_loss: 0.9011, test_loss: 0.9787, test_f1: 0.4987
 epoch: 92, train_loss: 0.9116, test_loss: 0.9825, test_f1: 0.4895
 epoch: 93, train_loss: 0.9012, test_loss: 0.9776, test_f1: 0.4889
 epoch: 94, train_loss: 0.8995, test_loss: 0.9573, test_f1: 0.4944
 epoch: 95, train_loss: 0.8955, test_loss: 0.9702, test_f1: 0.4882
 epoch: 96, train_loss: 0.9042, test_loss: 0.9522, test_f1: 0.4925
 epoch: 97, train_loss: 0.9069, test_loss: 0.9795, test_f1: 0.4922
 epoch: 98, train_loss: 0.9040, test_loss: 0.9774, test_f1: 0.4989
 epoch: 99, train_loss: 0.9091, test_loss: 0.9844, test_f1: 0.4900
##################ITERATION #4 ****************************************
 epoch: 0, train_loss: 1.3040, test_loss: 1.3446, test_f1: 0.2270
 epoch: 1, train_loss: 1.2266, test_loss: 1.2849, test_f1: 0.2270
 epoch: 2, train_loss: 1.1980, test_loss: 1.2366, test_f1: 0.2416
 epoch: 3, train_loss: 1.1661, test_loss: 1.1909, test_f1: 0.2735
 epoch: 4, train_loss: 1.1571, test_loss: 1.1451, test_f1: 0.3080
 epoch: 5, train_loss: 1.1375, test_loss: 1.1022, test_f1: 0.3485
 epoch: 6, train_loss: 1.1253, test_loss: 1.0845, test_f1: 0.3495
 epoch: 7, train_loss: 1.1019, test_loss: 1.0597, test_f1: 0.3577
 epoch: 8, train_loss: 1.0874, test_loss: 1.0485, test_f1: 0.3619
 epoch: 9, train_loss: 1.0779, test_loss: 1.0318, test_f1: 0.3612
 epoch: 10, train_loss: 1.0700, test_loss: 1.0226, test_f1: 0.3766
 epoch: 11, train_loss: 1.0604, test_loss: 1.0153, test_f1: 0.3850
 epoch: 12, train_loss: 1.0461, test_loss: 1.0146, test_f1: 0.3923
 epoch: 13, train_loss: 1.0398, test_loss: 1.0060, test_f1: 0.4224
 epoch: 14, train_loss: 1.0288, test_loss: 1.0046, test_f1: 0.4284
 epoch: 15, train_loss: 1.0157, test_loss: 0.9961, test_f1: 0.4432
 epoch: 16, train_loss: 1.0206, test_loss: 0.9976, test_f1: 0.4377
 epoch: 17, train_loss: 1.0103, test_loss: 0.9897, test_f1: 0.4375
 epoch: 18, train_loss: 1.0185, test_loss: 1.0139, test_f1: 0.4194
 epoch: 19, train_loss: 1.0191, test_loss: 0.9873, test_f1: 0.4750
 epoch: 20, train_loss: 1.0112, test_loss: 0.9870, test_f1: 0.4607
 epoch: 21, train_loss: 1.0023, test_loss: 0.9968, test_f1: 0.4603
 epoch: 22, train_loss: 0.9985, test_loss: 0.9817, test_f1: 0.4805
 epoch: 23, train_loss: 1.0001, test_loss: 0.9886, test_f1: 0.4716
 epoch: 24, train_loss: 0.9827, test_loss: 0.9855, test_f1: 0.4639
 epoch: 25, train_loss: 0.9887, test_loss: 0.9888, test_f1: 0.4754
 epoch: 26, train_loss: 0.9863, test_loss: 0.9809, test_f1: 0.4834
 epoch: 27, train_loss: 0.9815, test_loss: 0.9845, test_f1: 0.4939
 epoch: 28, train_loss: 0.9739, test_loss: 0.9852, test_f1: 0.4611
 epoch: 29, train_loss: 0.9723, test_loss: 0.9768, test_f1: 0.4907
 epoch: 30, train_loss: 0.9683, test_loss: 0.9797, test_f1: 0.4928
 epoch: 31, train_loss: 0.9682, test_loss: 0.9775, test_f1: 0.4929
 epoch: 32, train_loss: 0.9512, test_loss: 0.9776, test_f1: 0.4873
 epoch: 33, train_loss: 0.9556, test_loss: 0.9891, test_f1: 0.4785
 epoch: 34, train_loss: 0.9612, test_loss: 0.9793, test_f1: 0.4880
 epoch: 35, train_loss: 0.9509, test_loss: 0.9824, test_f1: 0.5063
 epoch: 36, train_loss: 0.9587, test_loss: 0.9829, test_f1: 0.5006
 epoch: 37, train_loss: 0.9491, test_loss: 0.9913, test_f1: 0.4958
 epoch: 38, train_loss: 0.9410, test_loss: 0.9870, test_f1: 0.4927
 epoch: 39, train_loss: 0.9389, test_loss: 0.9768, test_f1: 0.4865
 epoch: 40, train_loss: 0.9428, test_loss: 0.9770, test_f1: 0.5060
 epoch: 41, train_loss: 0.9469, test_loss: 0.9862, test_f1: 0.4885
 epoch: 42, train_loss: 0.9475, test_loss: 0.9864, test_f1: 0.4929
 epoch: 43, train_loss: 0.9275, test_loss: 0.9774, test_f1: 0.5067
 epoch: 44, train_loss: 0.9336, test_loss: 0.9882, test_f1: 0.4889
 epoch: 45, train_loss: 0.9328, test_loss: 1.0011, test_f1: 0.4833
 epoch: 46, train_loss: 0.9192, test_loss: 0.9928, test_f1: 0.4979
 epoch: 47, train_loss: 0.9286, test_loss: 0.9841, test_f1: 0.4985
 epoch: 48, train_loss: 0.9202, test_loss: 0.9926, test_f1: 0.4935
 epoch: 49, train_loss: 0.9243, test_loss: 0.9891, test_f1: 0.4918
 epoch: 50, train_loss: 0.9178, test_loss: 0.9950, test_f1: 0.4993
 epoch: 51, train_loss: 0.9097, test_loss: 0.9833, test_f1: 0.4958
 epoch: 52, train_loss: 0.9047, test_loss: 0.9872, test_f1: 0.4973
 epoch: 53, train_loss: 0.9182, test_loss: 0.9832, test_f1: 0.5081
 epoch: 54, train_loss: 0.9037, test_loss: 0.9851, test_f1: 0.5015
 epoch: 55, train_loss: 0.9125, test_loss: 0.9864, test_f1: 0.5006
 epoch: 56, train_loss: 0.9025, test_loss: 0.9800, test_f1: 0.5139
 epoch: 57, train_loss: 0.9112, test_loss: 0.9889, test_f1: 0.4984
 epoch: 58, train_loss: 0.9036, test_loss: 0.9838, test_f1: 0.5089
 epoch: 59, train_loss: 0.9007, test_loss: 0.9820, test_f1: 0.5033
 epoch: 60, train_loss: 0.9080, test_loss: 0.9788, test_f1: 0.5081
 epoch: 61, train_loss: 0.8992, test_loss: 0.9797, test_f1: 0.5093
 epoch: 62, train_loss: 0.9086, test_loss: 0.9823, test_f1: 0.5099
 epoch: 63, train_loss: 0.9034, test_loss: 0.9905, test_f1: 0.4935
 epoch: 64, train_loss: 0.8953, test_loss: 0.9849, test_f1: 0.5111
 epoch: 65, train_loss: 0.9020, test_loss: 0.9870, test_f1: 0.4996
 epoch: 66, train_loss: 0.9047, test_loss: 0.9797, test_f1: 0.5089
 epoch: 67, train_loss: 0.9030, test_loss: 0.9852, test_f1: 0.5064
 epoch: 68, train_loss: 0.8925, test_loss: 0.9813, test_f1: 0.5096
 epoch: 69, train_loss: 0.8956, test_loss: 0.9859, test_f1: 0.5035
 epoch: 70, train_loss: 0.8940, test_loss: 0.9822, test_f1: 0.5144
 epoch: 71, train_loss: 0.8909, test_loss: 0.9908, test_f1: 0.5096
 epoch: 72, train_loss: 0.8880, test_loss: 0.9902, test_f1: 0.5118
 epoch: 73, train_loss: 0.8906, test_loss: 0.9969, test_f1: 0.4924
 epoch: 74, train_loss: 0.8923, test_loss: 0.9802, test_f1: 0.5132
 epoch: 75, train_loss: 0.8863, test_loss: 0.9834, test_f1: 0.5087
 epoch: 76, train_loss: 0.8926, test_loss: 0.9806, test_f1: 0.5152
 epoch: 77, train_loss: 0.8909, test_loss: 0.9832, test_f1: 0.5036
 epoch: 78, train_loss: 0.8863, test_loss: 0.9883, test_f1: 0.5126
 epoch: 79, train_loss: 0.8796, test_loss: 0.9821, test_f1: 0.5167
 epoch: 80, train_loss: 0.8830, test_loss: 0.9938, test_f1: 0.4920
 epoch: 81, train_loss: 0.8881, test_loss: 0.9912, test_f1: 0.5134
 epoch: 82, train_loss: 0.8848, test_loss: 0.9948, test_f1: 0.5041
 epoch: 83, train_loss: 0.8797, test_loss: 0.9936, test_f1: 0.5070
 epoch: 84, train_loss: 0.8791, test_loss: 1.0017, test_f1: 0.5047
 epoch: 85, train_loss: 0.8781, test_loss: 0.9914, test_f1: 0.5037
 epoch: 86, train_loss: 0.8814, test_loss: 0.9906, test_f1: 0.5116
 epoch: 87, train_loss: 0.8806, test_loss: 1.0008, test_f1: 0.5076
 epoch: 88, train_loss: 0.8808, test_loss: 0.9954, test_f1: 0.5126
 epoch: 89, train_loss: 0.8852, test_loss: 0.9944, test_f1: 0.5115
 epoch: 90, train_loss: 0.8813, test_loss: 0.9999, test_f1: 0.5000
 epoch: 91, train_loss: 0.8826, test_loss: 0.9994, test_f1: 0.5097
 epoch: 92, train_loss: 0.8827, test_loss: 0.9976, test_f1: 0.5081
 epoch: 93, train_loss: 0.8859, test_loss: 0.9945, test_f1: 0.5033
 epoch: 94, train_loss: 0.8693, test_loss: 1.0005, test_f1: 0.5020
 epoch: 95, train_loss: 0.8829, test_loss: 0.9931, test_f1: 0.5013
 epoch: 96, train_loss: 0.8774, test_loss: 0.9982, test_f1: 0.5116
 epoch: 97, train_loss: 0.8732, test_loss: 0.9936, test_f1: 0.5163
 epoch: 98, train_loss: 0.8779, test_loss: 0.9930, test_f1: 0.5075
 epoch: 99, train_loss: 0.8759, test_loss: 0.9854, test_f1: 0.5138
##################ITERATION #5 ****************************************
 epoch: 0, train_loss: 1.3439, test_loss: 1.3649, test_f1: 0.2270
 epoch: 1, train_loss: 1.2442, test_loss: 1.3147, test_f1: 0.2270
 epoch: 2, train_loss: 1.2157, test_loss: 1.2471, test_f1: 0.2270
 epoch: 3, train_loss: 1.1970, test_loss: 1.1770, test_f1: 0.2952
 epoch: 4, train_loss: 1.1860, test_loss: 1.1483, test_f1: 0.3278
 epoch: 5, train_loss: 1.1698, test_loss: 1.1258, test_f1: 0.3336
 epoch: 6, train_loss: 1.1522, test_loss: 1.1120, test_f1: 0.3451
 epoch: 7, train_loss: 1.1373, test_loss: 1.0948, test_f1: 0.3462
 epoch: 8, train_loss: 1.1241, test_loss: 1.0820, test_f1: 0.3501
 epoch: 9, train_loss: 1.1121, test_loss: 1.0795, test_f1: 0.3503
 epoch: 10, train_loss: 1.0943, test_loss: 1.1043, test_f1: 0.3398
 epoch: 11, train_loss: 1.0844, test_loss: 1.0651, test_f1: 0.3573
 epoch: 12, train_loss: 1.0757, test_loss: 1.0762, test_f1: 0.3555
 epoch: 13, train_loss: 1.0725, test_loss: 1.0522, test_f1: 0.3565
 epoch: 14, train_loss: 1.0608, test_loss: 1.0487, test_f1: 0.3575
 epoch: 15, train_loss: 1.0532, test_loss: 1.0539, test_f1: 0.3712
 epoch: 16, train_loss: 1.0426, test_loss: 1.0186, test_f1: 0.3576
 epoch: 17, train_loss: 1.0402, test_loss: 1.0620, test_f1: 0.3792
 epoch: 18, train_loss: 1.0292, test_loss: 1.1086, test_f1: 0.3675
 epoch: 19, train_loss: 1.0287, test_loss: 1.0210, test_f1: 0.4016
 epoch: 20, train_loss: 1.0245, test_loss: 1.0891, test_f1: 0.3936
 epoch: 21, train_loss: 1.0144, test_loss: 0.9882, test_f1: 0.4107
 epoch: 22, train_loss: 1.0117, test_loss: 1.0096, test_f1: 0.4309
 epoch: 23, train_loss: 1.0017, test_loss: 1.0086, test_f1: 0.4312
 epoch: 24, train_loss: 0.9973, test_loss: 0.9821, test_f1: 0.4335
 epoch: 25, train_loss: 0.9919, test_loss: 0.9744, test_f1: 0.4401
 epoch: 26, train_loss: 0.9787, test_loss: 0.9749, test_f1: 0.4588
 epoch: 27, train_loss: 0.9911, test_loss: 0.9897, test_f1: 0.4619
 epoch: 28, train_loss: 0.9819, test_loss: 1.0035, test_f1: 0.4486
 epoch: 29, train_loss: 0.9697, test_loss: 0.9567, test_f1: 0.4774
 epoch: 30, train_loss: 0.9731, test_loss: 0.9646, test_f1: 0.4412
 epoch: 31, train_loss: 0.9682, test_loss: 0.9598, test_f1: 0.4684
 epoch: 32, train_loss: 0.9681, test_loss: 0.9517, test_f1: 0.4765
 epoch: 33, train_loss: 0.9596, test_loss: 0.9616, test_f1: 0.4481
 epoch: 34, train_loss: 0.9613, test_loss: 0.9466, test_f1: 0.4789
 epoch: 35, train_loss: 0.9537, test_loss: 0.9728, test_f1: 0.4925
 epoch: 36, train_loss: 0.9480, test_loss: 0.9711, test_f1: 0.4884
 epoch: 37, train_loss: 0.9483, test_loss: 0.9364, test_f1: 0.4898
 epoch: 38, train_loss: 0.9519, test_loss: 1.0173, test_f1: 0.4486
 epoch: 39, train_loss: 0.9489, test_loss: 0.9603, test_f1: 0.4872
 epoch: 40, train_loss: 0.9445, test_loss: 0.9954, test_f1: 0.4772
 epoch: 41, train_loss: 0.9380, test_loss: 0.9509, test_f1: 0.5018
 epoch: 42, train_loss: 0.9391, test_loss: 0.9342, test_f1: 0.4854
 epoch: 43, train_loss: 0.9454, test_loss: 0.9267, test_f1: 0.5210
 epoch: 44, train_loss: 0.9355, test_loss: 1.0032, test_f1: 0.4752
 epoch: 45, train_loss: 0.9369, test_loss: 0.9315, test_f1: 0.5143
 epoch: 46, train_loss: 0.9322, test_loss: 0.9475, test_f1: 0.4882
 epoch: 47, train_loss: 0.9317, test_loss: 0.9291, test_f1: 0.5061
 epoch: 48, train_loss: 0.9291, test_loss: 1.0277, test_f1: 0.4913
 epoch: 49, train_loss: 0.9258, test_loss: 0.9851, test_f1: 0.4953
 epoch: 50, train_loss: 0.9335, test_loss: 0.9569, test_f1: 0.5047
 epoch: 51, train_loss: 0.9287, test_loss: 0.9958, test_f1: 0.5038
 epoch: 52, train_loss: 0.9270, test_loss: 0.9504, test_f1: 0.4888
 epoch: 53, train_loss: 0.9247, test_loss: 1.0191, test_f1: 0.4900
 epoch: 54, train_loss: 0.9213, test_loss: 0.9562, test_f1: 0.5129
 epoch: 55, train_loss: 0.9131, test_loss: 0.9494, test_f1: 0.5068
 epoch: 56, train_loss: 0.9153, test_loss: 1.0179, test_f1: 0.4819
 epoch: 57, train_loss: 0.9175, test_loss: 0.9458, test_f1: 0.5063
 epoch: 58, train_loss: 0.9089, test_loss: 0.9779, test_f1: 0.4956
 epoch: 59, train_loss: 0.9191, test_loss: 0.9497, test_f1: 0.5018
 epoch: 60, train_loss: 0.9223, test_loss: 1.0018, test_f1: 0.5014
 epoch: 61, train_loss: 0.9180, test_loss: 0.9245, test_f1: 0.5041
 epoch: 62, train_loss: 0.9151, test_loss: 1.0336, test_f1: 0.4982
 epoch: 63, train_loss: 0.9104, test_loss: 0.9837, test_f1: 0.4922
 epoch: 64, train_loss: 0.9095, test_loss: 0.9257, test_f1: 0.5084
 epoch: 65, train_loss: 0.9124, test_loss: 0.9405, test_f1: 0.5032
 epoch: 66, train_loss: 0.9139, test_loss: 0.9379, test_f1: 0.5078
 epoch: 67, train_loss: 0.9074, test_loss: 0.9407, test_f1: 0.5079
 epoch: 68, train_loss: 0.9089, test_loss: 0.9453, test_f1: 0.5085
 epoch: 69, train_loss: 0.9125, test_loss: 0.9654, test_f1: 0.4971
 epoch: 70, train_loss: 0.9180, test_loss: 1.0645, test_f1: 0.4860
 epoch: 71, train_loss: 0.9101, test_loss: 0.9651, test_f1: 0.4907
 epoch: 72, train_loss: 0.9123, test_loss: 0.9857, test_f1: 0.5054
 epoch: 73, train_loss: 0.9095, test_loss: 0.9936, test_f1: 0.4854
 epoch: 74, train_loss: 0.8987, test_loss: 0.9462, test_f1: 0.5041
 epoch: 75, train_loss: 0.9056, test_loss: 0.9716, test_f1: 0.4951
 epoch: 76, train_loss: 0.9045, test_loss: 0.9639, test_f1: 0.5074
 epoch: 77, train_loss: 0.9063, test_loss: 0.9403, test_f1: 0.5071
 epoch: 78, train_loss: 0.8994, test_loss: 0.9302, test_f1: 0.5098
 epoch: 79, train_loss: 0.9051, test_loss: 0.9315, test_f1: 0.5124
 epoch: 80, train_loss: 0.9000, test_loss: 1.0161, test_f1: 0.5025
 epoch: 81, train_loss: 0.8989, test_loss: 0.9752, test_f1: 0.5028
 epoch: 82, train_loss: 0.8992, test_loss: 0.9472, test_f1: 0.5120
 epoch: 83, train_loss: 0.8984, test_loss: 0.9646, test_f1: 0.5001
 epoch: 84, train_loss: 0.9124, test_loss: 0.9976, test_f1: 0.4969
 epoch: 85, train_loss: 0.9076, test_loss: 0.9269, test_f1: 0.5228
 epoch: 86, train_loss: 0.9010, test_loss: 1.0488, test_f1: 0.4919
 epoch: 87, train_loss: 0.8975, test_loss: 0.9646, test_f1: 0.5036
 epoch: 88, train_loss: 0.8948, test_loss: 0.9958, test_f1: 0.5057
 epoch: 89, train_loss: 0.9019, test_loss: 0.9224, test_f1: 0.5117
 epoch: 90, train_loss: 0.8917, test_loss: 0.9691, test_f1: 0.5108
 epoch: 91, train_loss: 0.8967, test_loss: 0.9789, test_f1: 0.4962
 epoch: 92, train_loss: 0.8951, test_loss: 0.9140, test_f1: 0.5268
 epoch: 93, train_loss: 0.8900, test_loss: 0.9497, test_f1: 0.4974
 epoch: 94, train_loss: 0.8994, test_loss: 0.9691, test_f1: 0.4960
 epoch: 95, train_loss: 0.8964, test_loss: 1.0400, test_f1: 0.5062
 epoch: 96, train_loss: 0.8956, test_loss: 0.9197, test_f1: 0.5221
 epoch: 97, train_loss: 0.8864, test_loss: 0.9852, test_f1: 0.5027
 epoch: 98, train_loss: 0.8920, test_loss: 0.9429, test_f1: 0.5135
 epoch: 99, train_loss: 0.8927, test_loss: 0.9466, test_f1: 0.5071
##################ITERATION #6 ****************************************
 epoch: 0, train_loss: 1.3697, test_loss: 1.3116, test_f1: 0.2270
 epoch: 1, train_loss: 1.2519, test_loss: 1.2557, test_f1: 0.2270
 epoch: 2, train_loss: 1.2139, test_loss: 1.2061, test_f1: 0.2716
 epoch: 3, train_loss: 1.1741, test_loss: 1.1652, test_f1: 0.3243
 epoch: 4, train_loss: 1.1507, test_loss: 1.1383, test_f1: 0.3576
 epoch: 5, train_loss: 1.1384, test_loss: 1.1075, test_f1: 0.3632
 epoch: 6, train_loss: 1.1300, test_loss: 1.0780, test_f1: 0.3936
 epoch: 7, train_loss: 1.1185, test_loss: 1.0806, test_f1: 0.3919
 epoch: 8, train_loss: 1.1090, test_loss: 1.0665, test_f1: 0.3931
 epoch: 9, train_loss: 1.0971, test_loss: 1.0638, test_f1: 0.4165
 epoch: 10, train_loss: 1.0963, test_loss: 1.0773, test_f1: 0.3995
 epoch: 11, train_loss: 1.0788, test_loss: 1.0623, test_f1: 0.4235
 epoch: 12, train_loss: 1.0687, test_loss: 1.0566, test_f1: 0.4198
 epoch: 13, train_loss: 1.0627, test_loss: 1.0426, test_f1: 0.4458
 epoch: 14, train_loss: 1.0463, test_loss: 1.0422, test_f1: 0.4275
 epoch: 15, train_loss: 1.0435, test_loss: 1.0504, test_f1: 0.4183
 epoch: 16, train_loss: 1.0322, test_loss: 1.0462, test_f1: 0.4124
 epoch: 17, train_loss: 1.0365, test_loss: 1.0249, test_f1: 0.4426
 epoch: 18, train_loss: 1.0275, test_loss: 1.0264, test_f1: 0.4479
 epoch: 19, train_loss: 1.0172, test_loss: 1.0253, test_f1: 0.4415
 epoch: 20, train_loss: 1.0164, test_loss: 1.0234, test_f1: 0.4528
 epoch: 21, train_loss: 1.0149, test_loss: 1.0163, test_f1: 0.4504
 epoch: 22, train_loss: 1.0078, test_loss: 1.0212, test_f1: 0.4532
 epoch: 23, train_loss: 1.0061, test_loss: 1.0332, test_f1: 0.4420
 epoch: 24, train_loss: 1.0015, test_loss: 1.0013, test_f1: 0.4588
 epoch: 25, train_loss: 1.0049, test_loss: 1.0112, test_f1: 0.4424
 epoch: 26, train_loss: 0.9973, test_loss: 1.0148, test_f1: 0.4539
 epoch: 27, train_loss: 0.9892, test_loss: 1.0074, test_f1: 0.4530
 epoch: 28, train_loss: 0.9797, test_loss: 1.0099, test_f1: 0.4506
 epoch: 29, train_loss: 0.9818, test_loss: 1.0102, test_f1: 0.4537
 epoch: 30, train_loss: 0.9758, test_loss: 1.0005, test_f1: 0.4602
 epoch: 31, train_loss: 0.9852, test_loss: 0.9910, test_f1: 0.4583
 epoch: 32, train_loss: 0.9743, test_loss: 1.0106, test_f1: 0.4732
 epoch: 33, train_loss: 0.9672, test_loss: 0.9993, test_f1: 0.4791
 epoch: 34, train_loss: 0.9636, test_loss: 0.9911, test_f1: 0.4784
 epoch: 35, train_loss: 0.9605, test_loss: 0.9891, test_f1: 0.4749
 epoch: 36, train_loss: 0.9577, test_loss: 0.9946, test_f1: 0.4812
 epoch: 37, train_loss: 0.9615, test_loss: 0.9946, test_f1: 0.4952
 epoch: 38, train_loss: 0.9448, test_loss: 0.9839, test_f1: 0.4722
 epoch: 39, train_loss: 0.9469, test_loss: 0.9809, test_f1: 0.4752
 epoch: 40, train_loss: 0.9408, test_loss: 0.9729, test_f1: 0.4777
 epoch: 41, train_loss: 0.9447, test_loss: 0.9702, test_f1: 0.4969
 epoch: 42, train_loss: 0.9381, test_loss: 0.9895, test_f1: 0.4764
 epoch: 43, train_loss: 0.9353, test_loss: 0.9724, test_f1: 0.5025
 epoch: 44, train_loss: 0.9335, test_loss: 0.9680, test_f1: 0.4991
 epoch: 45, train_loss: 0.9325, test_loss: 0.9750, test_f1: 0.5017
 epoch: 46, train_loss: 0.9274, test_loss: 0.9769, test_f1: 0.5064
 epoch: 47, train_loss: 0.9350, test_loss: 0.9800, test_f1: 0.5088
 epoch: 48, train_loss: 0.9236, test_loss: 0.9832, test_f1: 0.5005
 epoch: 49, train_loss: 0.9192, test_loss: 0.9831, test_f1: 0.5053
 epoch: 50, train_loss: 0.9180, test_loss: 0.9819, test_f1: 0.5003
 epoch: 51, train_loss: 0.9279, test_loss: 0.9783, test_f1: 0.5134
 epoch: 52, train_loss: 0.9144, test_loss: 0.9734, test_f1: 0.5078
 epoch: 53, train_loss: 0.9255, test_loss: 0.9714, test_f1: 0.5025
 epoch: 54, train_loss: 0.9198, test_loss: 0.9660, test_f1: 0.5060
 epoch: 55, train_loss: 0.9145, test_loss: 0.9630, test_f1: 0.5167
 epoch: 56, train_loss: 0.9100, test_loss: 0.9729, test_f1: 0.5210
 epoch: 57, train_loss: 0.9236, test_loss: 0.9647, test_f1: 0.5167
 epoch: 58, train_loss: 0.9135, test_loss: 0.9577, test_f1: 0.5093
 epoch: 59, train_loss: 0.9155, test_loss: 0.9632, test_f1: 0.5113
 epoch: 60, train_loss: 0.9086, test_loss: 0.9662, test_f1: 0.5222
 epoch: 61, train_loss: 0.9144, test_loss: 0.9662, test_f1: 0.5125
 epoch: 62, train_loss: 0.9011, test_loss: 0.9686, test_f1: 0.5242
 epoch: 63, train_loss: 0.9054, test_loss: 0.9655, test_f1: 0.5155
 epoch: 64, train_loss: 0.9098, test_loss: 0.9589, test_f1: 0.5212
 epoch: 65, train_loss: 0.9068, test_loss: 0.9620, test_f1: 0.5269
 epoch: 66, train_loss: 0.9097, test_loss: 0.9646, test_f1: 0.5234
 epoch: 67, train_loss: 0.9083, test_loss: 0.9672, test_f1: 0.5113
 epoch: 68, train_loss: 0.9073, test_loss: 0.9651, test_f1: 0.5118
 epoch: 69, train_loss: 0.8998, test_loss: 0.9556, test_f1: 0.5254
 epoch: 70, train_loss: 0.8951, test_loss: 0.9645, test_f1: 0.5291
 epoch: 71, train_loss: 0.9034, test_loss: 0.9570, test_f1: 0.5294
 epoch: 72, train_loss: 0.9028, test_loss: 0.9606, test_f1: 0.5242
 epoch: 73, train_loss: 0.9029, test_loss: 0.9627, test_f1: 0.5150
 epoch: 74, train_loss: 0.8942, test_loss: 0.9575, test_f1: 0.5292
 epoch: 75, train_loss: 0.9018, test_loss: 0.9724, test_f1: 0.5181
 epoch: 76, train_loss: 0.9039, test_loss: 0.9614, test_f1: 0.5292
 epoch: 77, train_loss: 0.8982, test_loss: 0.9623, test_f1: 0.5288
 epoch: 78, train_loss: 0.8962, test_loss: 0.9568, test_f1: 0.5274
 epoch: 79, train_loss: 0.8970, test_loss: 0.9618, test_f1: 0.5253
 epoch: 80, train_loss: 0.8915, test_loss: 0.9672, test_f1: 0.5274
 epoch: 81, train_loss: 0.8997, test_loss: 0.9610, test_f1: 0.5315
 epoch: 82, train_loss: 0.8921, test_loss: 0.9598, test_f1: 0.5243
 epoch: 83, train_loss: 0.8927, test_loss: 0.9575, test_f1: 0.5274
 epoch: 84, train_loss: 0.8907, test_loss: 0.9566, test_f1: 0.5316
 epoch: 85, train_loss: 0.8972, test_loss: 0.9654, test_f1: 0.5280
 epoch: 86, train_loss: 0.8868, test_loss: 0.9808, test_f1: 0.5231
 epoch: 87, train_loss: 0.8867, test_loss: 0.9632, test_f1: 0.5303
 epoch: 88, train_loss: 0.8823, test_loss: 0.9676, test_f1: 0.5261
 epoch: 89, train_loss: 0.8918, test_loss: 0.9616, test_f1: 0.5338
 epoch: 90, train_loss: 0.8915, test_loss: 0.9702, test_f1: 0.5267
 epoch: 91, train_loss: 0.8941, test_loss: 0.9691, test_f1: 0.5302
 epoch: 92, train_loss: 0.8959, test_loss: 0.9868, test_f1: 0.5210
 epoch: 93, train_loss: 0.8908, test_loss: 0.9713, test_f1: 0.5331
 epoch: 94, train_loss: 0.8925, test_loss: 0.9743, test_f1: 0.5279
 epoch: 95, train_loss: 0.8892, test_loss: 0.9774, test_f1: 0.5271
 epoch: 96, train_loss: 0.8900, test_loss: 0.9635, test_f1: 0.5300
 epoch: 97, train_loss: 0.8827, test_loss: 0.9666, test_f1: 0.5194
 epoch: 98, train_loss: 0.8916, test_loss: 0.9679, test_f1: 0.5354
 epoch: 99, train_loss: 0.8790, test_loss: 0.9837, test_f1: 0.5234
##################ITERATION #7 ****************************************
 epoch: 0, train_loss: 1.4025, test_loss: 1.3208, test_f1: 0.2270
 epoch: 1, train_loss: 1.2696, test_loss: 1.3255, test_f1: 0.2270
 epoch: 2, train_loss: 1.2371, test_loss: 1.2901, test_f1: 0.2270
 epoch: 3, train_loss: 1.2200, test_loss: 1.2315, test_f1: 0.2320
 epoch: 4, train_loss: 1.2032, test_loss: 1.1854, test_f1: 0.3213
 epoch: 5, train_loss: 1.1919, test_loss: 1.1609, test_f1: 0.3348
 epoch: 6, train_loss: 1.1748, test_loss: 1.1328, test_f1: 0.3537
 epoch: 7, train_loss: 1.1641, test_loss: 1.1177, test_f1: 0.3655
 epoch: 8, train_loss: 1.1445, test_loss: 1.1003, test_f1: 0.3812
 epoch: 9, train_loss: 1.1284, test_loss: 1.0823, test_f1: 0.3670
 epoch: 10, train_loss: 1.1157, test_loss: 1.0681, test_f1: 0.3669
 epoch: 11, train_loss: 1.1052, test_loss: 1.0557, test_f1: 0.3670
 epoch: 12, train_loss: 1.0936, test_loss: 1.0403, test_f1: 0.4020
 epoch: 13, train_loss: 1.0815, test_loss: 1.0289, test_f1: 0.4122
 epoch: 14, train_loss: 1.0737, test_loss: 1.0239, test_f1: 0.4230
 epoch: 15, train_loss: 1.0553, test_loss: 1.0171, test_f1: 0.4257
 epoch: 16, train_loss: 1.0559, test_loss: 1.0267, test_f1: 0.4278
 epoch: 17, train_loss: 1.0452, test_loss: 1.0060, test_f1: 0.4318
 epoch: 18, train_loss: 1.0376, test_loss: 1.0111, test_f1: 0.4370
 epoch: 19, train_loss: 1.0304, test_loss: 1.0023, test_f1: 0.4455
 epoch: 20, train_loss: 1.0260, test_loss: 0.9969, test_f1: 0.4514
 epoch: 21, train_loss: 1.0184, test_loss: 1.0161, test_f1: 0.4525
 epoch: 22, train_loss: 1.0079, test_loss: 1.0091, test_f1: 0.4461
 epoch: 23, train_loss: 1.0065, test_loss: 1.0066, test_f1: 0.4327
 epoch: 24, train_loss: 1.0064, test_loss: 0.9777, test_f1: 0.4529
 epoch: 25, train_loss: 0.9958, test_loss: 0.9998, test_f1: 0.4496
 epoch: 26, train_loss: 0.9881, test_loss: 0.9727, test_f1: 0.4575
 epoch: 27, train_loss: 0.9801, test_loss: 0.9697, test_f1: 0.4522
 epoch: 28, train_loss: 0.9794, test_loss: 0.9586, test_f1: 0.4532
 epoch: 29, train_loss: 0.9814, test_loss: 1.1037, test_f1: 0.4037
 epoch: 30, train_loss: 0.9706, test_loss: 0.9750, test_f1: 0.4731
 epoch: 31, train_loss: 0.9679, test_loss: 0.9947, test_f1: 0.4664
 epoch: 32, train_loss: 0.9691, test_loss: 0.9496, test_f1: 0.4680
 epoch: 33, train_loss: 0.9568, test_loss: 0.9459, test_f1: 0.4708
 epoch: 34, train_loss: 0.9634, test_loss: 0.9657, test_f1: 0.4713
 epoch: 35, train_loss: 0.9575, test_loss: 1.0103, test_f1: 0.4669
 epoch: 36, train_loss: 0.9654, test_loss: 0.9754, test_f1: 0.4709
 epoch: 37, train_loss: 0.9606, test_loss: 0.9453, test_f1: 0.4781
 epoch: 38, train_loss: 0.9506, test_loss: 0.9530, test_f1: 0.4708
 epoch: 39, train_loss: 0.9497, test_loss: 0.9391, test_f1: 0.4697
 epoch: 40, train_loss: 0.9481, test_loss: 0.9250, test_f1: 0.4921
 epoch: 41, train_loss: 0.9442, test_loss: 0.9328, test_f1: 0.4797
 epoch: 42, train_loss: 0.9440, test_loss: 0.9636, test_f1: 0.4690
 epoch: 43, train_loss: 0.9439, test_loss: 0.9234, test_f1: 0.4926
 epoch: 44, train_loss: 0.9418, test_loss: 0.9477, test_f1: 0.4795
 epoch: 45, train_loss: 0.9432, test_loss: 0.9874, test_f1: 0.4698
 epoch: 46, train_loss: 0.9305, test_loss: 0.9239, test_f1: 0.4876
 epoch: 47, train_loss: 0.9354, test_loss: 0.9769, test_f1: 0.4789
 epoch: 48, train_loss: 0.9336, test_loss: 0.9272, test_f1: 0.5003
 epoch: 49, train_loss: 0.9283, test_loss: 0.9401, test_f1: 0.4889
 epoch: 50, train_loss: 0.9249, test_loss: 0.9490, test_f1: 0.4870
 epoch: 51, train_loss: 0.9251, test_loss: 0.9386, test_f1: 0.4856
 epoch: 52, train_loss: 0.9257, test_loss: 0.9461, test_f1: 0.4915
 epoch: 53, train_loss: 0.9212, test_loss: 0.9712, test_f1: 0.4770
 epoch: 54, train_loss: 0.9138, test_loss: 0.9768, test_f1: 0.4714
 epoch: 55, train_loss: 0.9131, test_loss: 0.9622, test_f1: 0.4790
 epoch: 56, train_loss: 0.9271, test_loss: 0.9462, test_f1: 0.4834
 epoch: 57, train_loss: 0.9216, test_loss: 0.9493, test_f1: 0.4855
 epoch: 58, train_loss: 0.9163, test_loss: 0.9608, test_f1: 0.4802
 epoch: 59, train_loss: 0.9163, test_loss: 0.9380, test_f1: 0.4924
 epoch: 60, train_loss: 0.9101, test_loss: 0.9664, test_f1: 0.4778
 epoch: 61, train_loss: 0.9146, test_loss: 0.9505, test_f1: 0.4765
 epoch: 62, train_loss: 0.9112, test_loss: 0.9430, test_f1: 0.4871
 epoch: 63, train_loss: 0.9096, test_loss: 0.9527, test_f1: 0.4924
 epoch: 64, train_loss: 0.9259, test_loss: 0.9713, test_f1: 0.4807
 epoch: 65, train_loss: 0.9130, test_loss: 0.9448, test_f1: 0.4929
 epoch: 66, train_loss: 0.9037, test_loss: 0.9605, test_f1: 0.4849
 epoch: 67, train_loss: 0.9144, test_loss: 0.9345, test_f1: 0.4975
 epoch: 68, train_loss: 0.9018, test_loss: 1.0322, test_f1: 0.4743
 epoch: 69, train_loss: 0.9138, test_loss: 0.9319, test_f1: 0.4947
 epoch: 70, train_loss: 0.9044, test_loss: 0.9695, test_f1: 0.4867
 epoch: 71, train_loss: 0.9061, test_loss: 0.9518, test_f1: 0.4883
 epoch: 72, train_loss: 0.9077, test_loss: 0.9409, test_f1: 0.4927
 epoch: 73, train_loss: 0.9094, test_loss: 0.9471, test_f1: 0.4859
 epoch: 74, train_loss: 0.9079, test_loss: 0.9728, test_f1: 0.4813
 epoch: 75, train_loss: 0.8940, test_loss: 0.9659, test_f1: 0.4798
 epoch: 76, train_loss: 0.8946, test_loss: 0.9359, test_f1: 0.4948
 epoch: 77, train_loss: 0.8977, test_loss: 0.9521, test_f1: 0.4853
 epoch: 78, train_loss: 0.8974, test_loss: 0.9695, test_f1: 0.4886
 epoch: 79, train_loss: 0.9027, test_loss: 0.9531, test_f1: 0.4852
 epoch: 80, train_loss: 0.8952, test_loss: 0.9595, test_f1: 0.4878
 epoch: 81, train_loss: 0.8929, test_loss: 0.9496, test_f1: 0.4971
 epoch: 82, train_loss: 0.9059, test_loss: 0.9950, test_f1: 0.4863
 epoch: 83, train_loss: 0.8950, test_loss: 0.9673, test_f1: 0.4827
 epoch: 84, train_loss: 0.8859, test_loss: 0.9630, test_f1: 0.4828
 epoch: 85, train_loss: 0.8983, test_loss: 0.9618, test_f1: 0.4820
 epoch: 86, train_loss: 0.8960, test_loss: 0.9735, test_f1: 0.4851
 epoch: 87, train_loss: 0.9077, test_loss: 0.9237, test_f1: 0.5020
 epoch: 88, train_loss: 0.8971, test_loss: 0.9436, test_f1: 0.4996
 epoch: 89, train_loss: 0.8915, test_loss: 0.9642, test_f1: 0.4893
 epoch: 90, train_loss: 0.8892, test_loss: 0.9331, test_f1: 0.4920
 epoch: 91, train_loss: 0.8889, test_loss: 0.9543, test_f1: 0.4913
 epoch: 92, train_loss: 0.8909, test_loss: 0.9441, test_f1: 0.4877
 epoch: 93, train_loss: 0.8955, test_loss: 0.9431, test_f1: 0.4958
 epoch: 94, train_loss: 0.8868, test_loss: 0.9803, test_f1: 0.4838
 epoch: 95, train_loss: 0.8856, test_loss: 0.9608, test_f1: 0.4856
 epoch: 96, train_loss: 0.8881, test_loss: 0.9547, test_f1: 0.4851
 epoch: 97, train_loss: 0.8841, test_loss: 0.9432, test_f1: 0.4953
 epoch: 98, train_loss: 0.8825, test_loss: 0.9581, test_f1: 0.4886
 epoch: 99, train_loss: 0.8832, test_loss: 0.9609, test_f1: 0.4897
##################ITERATION #8 ****************************************
 epoch: 0, train_loss: 1.3394, test_loss: 1.3452, test_f1: 0.2270
 epoch: 1, train_loss: 1.2173, test_loss: 1.3262, test_f1: 0.2270
 epoch: 2, train_loss: 1.2033, test_loss: 1.2568, test_f1: 0.2416
 epoch: 3, train_loss: 1.1778, test_loss: 1.1762, test_f1: 0.3169
 epoch: 4, train_loss: 1.1471, test_loss: 1.1158, test_f1: 0.3323
 epoch: 5, train_loss: 1.1293, test_loss: 1.0849, test_f1: 0.3542
 epoch: 6, train_loss: 1.0971, test_loss: 1.0636, test_f1: 0.3661
 epoch: 7, train_loss: 1.0875, test_loss: 1.0516, test_f1: 0.3711
 epoch: 8, train_loss: 1.0837, test_loss: 1.0421, test_f1: 0.3783
 epoch: 9, train_loss: 1.0798, test_loss: 1.0318, test_f1: 0.3942
 epoch: 10, train_loss: 1.0589, test_loss: 1.0307, test_f1: 0.3958
 epoch: 11, train_loss: 1.0599, test_loss: 1.0218, test_f1: 0.4049
 epoch: 12, train_loss: 1.0464, test_loss: 1.0202, test_f1: 0.4200
 epoch: 13, train_loss: 1.0366, test_loss: 1.0156, test_f1: 0.4273
 epoch: 14, train_loss: 1.0311, test_loss: 1.0109, test_f1: 0.4331
 epoch: 15, train_loss: 1.0263, test_loss: 1.0020, test_f1: 0.4440
 epoch: 16, train_loss: 1.0182, test_loss: 1.0041, test_f1: 0.4385
 epoch: 17, train_loss: 1.0060, test_loss: 0.9859, test_f1: 0.4448
 epoch: 18, train_loss: 1.0017, test_loss: 0.9864, test_f1: 0.4482
 epoch: 19, train_loss: 0.9996, test_loss: 0.9791, test_f1: 0.4627
 epoch: 20, train_loss: 1.0018, test_loss: 0.9734, test_f1: 0.4492
 epoch: 21, train_loss: 0.9921, test_loss: 0.9794, test_f1: 0.4558
 epoch: 22, train_loss: 0.9948, test_loss: 0.9763, test_f1: 0.4696
 epoch: 23, train_loss: 0.9908, test_loss: 0.9722, test_f1: 0.4824
 epoch: 24, train_loss: 0.9830, test_loss: 0.9749, test_f1: 0.4633
 epoch: 25, train_loss: 0.9793, test_loss: 0.9651, test_f1: 0.4806
 epoch: 26, train_loss: 0.9781, test_loss: 0.9667, test_f1: 0.4645
 epoch: 27, train_loss: 0.9659, test_loss: 0.9689, test_f1: 0.4653
 epoch: 28, train_loss: 0.9635, test_loss: 0.9510, test_f1: 0.4819
 epoch: 29, train_loss: 0.9585, test_loss: 0.9481, test_f1: 0.4680
 epoch: 30, train_loss: 0.9525, test_loss: 0.9404, test_f1: 0.4746
 epoch: 31, train_loss: 0.9534, test_loss: 0.9330, test_f1: 0.4857
 epoch: 32, train_loss: 0.9483, test_loss: 0.9293, test_f1: 0.4856
 epoch: 33, train_loss: 0.9527, test_loss: 0.9346, test_f1: 0.4852
 epoch: 34, train_loss: 0.9363, test_loss: 0.9370, test_f1: 0.4799
 epoch: 35, train_loss: 0.9426, test_loss: 0.9349, test_f1: 0.4812
 epoch: 36, train_loss: 0.9516, test_loss: 0.9274, test_f1: 0.4865
 epoch: 37, train_loss: 0.9291, test_loss: 0.9237, test_f1: 0.4825
 epoch: 38, train_loss: 0.9411, test_loss: 0.9315, test_f1: 0.4943
 epoch: 39, train_loss: 0.9256, test_loss: 0.9187, test_f1: 0.4934
 epoch: 40, train_loss: 0.9414, test_loss: 0.9181, test_f1: 0.4913
 epoch: 41, train_loss: 0.9227, test_loss: 0.9205, test_f1: 0.4897
 epoch: 42, train_loss: 0.9221, test_loss: 0.9289, test_f1: 0.4874
 epoch: 43, train_loss: 0.9262, test_loss: 0.9190, test_f1: 0.4965
 epoch: 44, train_loss: 0.9191, test_loss: 0.9261, test_f1: 0.4854
 epoch: 45, train_loss: 0.9242, test_loss: 0.9257, test_f1: 0.4850
 epoch: 46, train_loss: 0.9163, test_loss: 0.9137, test_f1: 0.4958
 epoch: 47, train_loss: 0.9188, test_loss: 0.9226, test_f1: 0.4910
 epoch: 48, train_loss: 0.9097, test_loss: 0.9117, test_f1: 0.4935
 epoch: 49, train_loss: 0.9110, test_loss: 0.9118, test_f1: 0.5004
 epoch: 50, train_loss: 0.9017, test_loss: 0.9251, test_f1: 0.4954
 epoch: 51, train_loss: 0.9007, test_loss: 0.9194, test_f1: 0.4990
 epoch: 52, train_loss: 0.8980, test_loss: 0.9193, test_f1: 0.4930
 epoch: 53, train_loss: 0.9033, test_loss: 0.9187, test_f1: 0.4937
 epoch: 54, train_loss: 0.9017, test_loss: 0.9193, test_f1: 0.4952
 epoch: 55, train_loss: 0.9015, test_loss: 0.9158, test_f1: 0.4958
 epoch: 56, train_loss: 0.9012, test_loss: 0.9261, test_f1: 0.4948
 epoch: 57, train_loss: 0.9006, test_loss: 0.9129, test_f1: 0.5022
 epoch: 58, train_loss: 0.9054, test_loss: 0.9125, test_f1: 0.4971
 epoch: 59, train_loss: 0.8978, test_loss: 0.9100, test_f1: 0.5016
 epoch: 60, train_loss: 0.9033, test_loss: 0.9229, test_f1: 0.4947
 epoch: 61, train_loss: 0.8953, test_loss: 0.9182, test_f1: 0.5005
 epoch: 62, train_loss: 0.9031, test_loss: 0.9115, test_f1: 0.4988
 epoch: 63, train_loss: 0.8894, test_loss: 0.9111, test_f1: 0.5052
 epoch: 64, train_loss: 0.8921, test_loss: 0.9071, test_f1: 0.4996
 epoch: 65, train_loss: 0.8964, test_loss: 0.9177, test_f1: 0.5033
 epoch: 66, train_loss: 0.8906, test_loss: 0.9074, test_f1: 0.5130
 epoch: 67, train_loss: 0.8980, test_loss: 0.9073, test_f1: 0.4985
 epoch: 68, train_loss: 0.8995, test_loss: 0.9087, test_f1: 0.4973
 epoch: 69, train_loss: 0.8928, test_loss: 0.9013, test_f1: 0.5021
 epoch: 70, train_loss: 0.8951, test_loss: 0.9081, test_f1: 0.4969
 epoch: 71, train_loss: 0.8863, test_loss: 0.9015, test_f1: 0.5016
 epoch: 72, train_loss: 0.8886, test_loss: 0.9037, test_f1: 0.4951
 epoch: 73, train_loss: 0.8794, test_loss: 0.8979, test_f1: 0.4998
 epoch: 74, train_loss: 0.8835, test_loss: 0.9037, test_f1: 0.4925
 epoch: 75, train_loss: 0.8857, test_loss: 0.9056, test_f1: 0.4998
 epoch: 76, train_loss: 0.8871, test_loss: 0.8983, test_f1: 0.5009
 epoch: 77, train_loss: 0.8867, test_loss: 0.9002, test_f1: 0.5028
 epoch: 78, train_loss: 0.8751, test_loss: 0.9160, test_f1: 0.4981
 epoch: 79, train_loss: 0.8811, test_loss: 0.9094, test_f1: 0.5013
 epoch: 80, train_loss: 0.8816, test_loss: 0.8999, test_f1: 0.5042
 epoch: 81, train_loss: 0.8773, test_loss: 0.9035, test_f1: 0.4990
 epoch: 82, train_loss: 0.8828, test_loss: 0.8995, test_f1: 0.5058
 epoch: 83, train_loss: 0.8771, test_loss: 0.8929, test_f1: 0.4992
 epoch: 84, train_loss: 0.8751, test_loss: 0.9005, test_f1: 0.4994
 epoch: 85, train_loss: 0.8741, test_loss: 0.9030, test_f1: 0.5002
 epoch: 86, train_loss: 0.8804, test_loss: 0.9125, test_f1: 0.5045
 epoch: 87, train_loss: 0.8778, test_loss: 0.8981, test_f1: 0.5045
 epoch: 88, train_loss: 0.8717, test_loss: 0.9012, test_f1: 0.5040
 epoch: 89, train_loss: 0.8721, test_loss: 0.8941, test_f1: 0.5074
 epoch: 90, train_loss: 0.8806, test_loss: 0.9100, test_f1: 0.5007
 epoch: 91, train_loss: 0.8798, test_loss: 0.8983, test_f1: 0.4933
 epoch: 92, train_loss: 0.8734, test_loss: 0.9015, test_f1: 0.4934
 epoch: 93, train_loss: 0.8625, test_loss: 0.9007, test_f1: 0.5015
 epoch: 94, train_loss: 0.8728, test_loss: 0.8985, test_f1: 0.5008
 epoch: 95, train_loss: 0.8694, test_loss: 0.8979, test_f1: 0.5006
 epoch: 96, train_loss: 0.8709, test_loss: 0.9056, test_f1: 0.5049
 epoch: 97, train_loss: 0.8724, test_loss: 0.9043, test_f1: 0.4969
 epoch: 98, train_loss: 0.8709, test_loss: 0.9070, test_f1: 0.5068
 epoch: 99, train_loss: 0.8756, test_loss: 0.9024, test_f1: 0.5014
##################ITERATION #9 ****************************************
 epoch: 0, train_loss: 1.4885, test_loss: 1.3572, test_f1: 0.2582
 epoch: 1, train_loss: 1.2809, test_loss: 1.3088, test_f1: 0.2720
 epoch: 2, train_loss: 1.2414, test_loss: 1.2421, test_f1: 0.3115
 epoch: 3, train_loss: 1.1896, test_loss: 1.1644, test_f1: 0.3537
 epoch: 4, train_loss: 1.1612, test_loss: 1.1088, test_f1: 0.3668
 epoch: 5, train_loss: 1.1421, test_loss: 1.0704, test_f1: 0.3518
 epoch: 6, train_loss: 1.1221, test_loss: 1.0547, test_f1: 0.3539
 epoch: 7, train_loss: 1.0900, test_loss: 1.0529, test_f1: 0.3527
 epoch: 8, train_loss: 1.0881, test_loss: 1.0438, test_f1: 0.3543
 epoch: 9, train_loss: 1.0756, test_loss: 1.0328, test_f1: 0.3553
 epoch: 10, train_loss: 1.0837, test_loss: 1.0335, test_f1: 0.3581
 epoch: 11, train_loss: 1.0728, test_loss: 1.0239, test_f1: 0.3548
 epoch: 12, train_loss: 1.0648, test_loss: 1.0194, test_f1: 0.3687
 epoch: 13, train_loss: 1.0551, test_loss: 1.0211, test_f1: 0.3634
 epoch: 14, train_loss: 1.0508, test_loss: 1.0167, test_f1: 0.3708
 epoch: 15, train_loss: 1.0387, test_loss: 1.0070, test_f1: 0.3790
 epoch: 16, train_loss: 1.0330, test_loss: 1.0060, test_f1: 0.3822
 epoch: 17, train_loss: 1.0275, test_loss: 1.0097, test_f1: 0.3899
 epoch: 18, train_loss: 1.0255, test_loss: 1.0183, test_f1: 0.3858
 epoch: 19, train_loss: 1.0105, test_loss: 0.9978, test_f1: 0.4101
 epoch: 20, train_loss: 1.0114, test_loss: 1.0074, test_f1: 0.4108
 epoch: 21, train_loss: 1.0124, test_loss: 0.9900, test_f1: 0.4222
 epoch: 22, train_loss: 1.0054, test_loss: 0.9947, test_f1: 0.4106
 epoch: 23, train_loss: 0.9961, test_loss: 0.9914, test_f1: 0.4208
 epoch: 24, train_loss: 0.9957, test_loss: 0.9832, test_f1: 0.4355
 epoch: 25, train_loss: 1.0040, test_loss: 0.9735, test_f1: 0.4270
 epoch: 26, train_loss: 0.9937, test_loss: 0.9830, test_f1: 0.4321
 epoch: 27, train_loss: 0.9828, test_loss: 0.9765, test_f1: 0.4600
 epoch: 28, train_loss: 0.9791, test_loss: 0.9623, test_f1: 0.4513
 epoch: 29, train_loss: 0.9809, test_loss: 0.9629, test_f1: 0.4739
 epoch: 30, train_loss: 0.9733, test_loss: 0.9700, test_f1: 0.4579
 epoch: 31, train_loss: 0.9734, test_loss: 0.9609, test_f1: 0.4716
 epoch: 32, train_loss: 0.9706, test_loss: 0.9621, test_f1: 0.4637
 epoch: 33, train_loss: 0.9685, test_loss: 0.9622, test_f1: 0.4713
 epoch: 34, train_loss: 0.9634, test_loss: 0.9475, test_f1: 0.4848
 epoch: 35, train_loss: 0.9628, test_loss: 0.9567, test_f1: 0.4902
 epoch: 36, train_loss: 0.9592, test_loss: 0.9537, test_f1: 0.4895
 epoch: 37, train_loss: 0.9547, test_loss: 0.9499, test_f1: 0.4956
 epoch: 38, train_loss: 0.9513, test_loss: 0.9574, test_f1: 0.4955
 epoch: 39, train_loss: 0.9520, test_loss: 0.9499, test_f1: 0.5055
 epoch: 40, train_loss: 0.9559, test_loss: 0.9351, test_f1: 0.4955
 epoch: 41, train_loss: 0.9488, test_loss: 0.9461, test_f1: 0.5039
 epoch: 42, train_loss: 0.9379, test_loss: 0.9416, test_f1: 0.4987
 epoch: 43, train_loss: 0.9418, test_loss: 0.9258, test_f1: 0.5169
 epoch: 44, train_loss: 0.9395, test_loss: 0.9437, test_f1: 0.5135
 epoch: 45, train_loss: 0.9433, test_loss: 0.9339, test_f1: 0.5070
 epoch: 46, train_loss: 0.9450, test_loss: 0.9539, test_f1: 0.4973
 epoch: 47, train_loss: 0.9397, test_loss: 0.9295, test_f1: 0.5107
 epoch: 48, train_loss: 0.9389, test_loss: 0.9575, test_f1: 0.5011
 epoch: 49, train_loss: 0.9442, test_loss: 0.9241, test_f1: 0.5123
 epoch: 50, train_loss: 0.9261, test_loss: 0.9446, test_f1: 0.5096
 epoch: 51, train_loss: 0.9312, test_loss: 0.9287, test_f1: 0.5157
 epoch: 52, train_loss: 0.9232, test_loss: 0.9371, test_f1: 0.5116
 epoch: 53, train_loss: 0.9256, test_loss: 0.9258, test_f1: 0.5162
 epoch: 54, train_loss: 0.9205, test_loss: 0.9295, test_f1: 0.5110
 epoch: 55, train_loss: 0.9201, test_loss: 0.9302, test_f1: 0.5146
 epoch: 56, train_loss: 0.9255, test_loss: 0.9353, test_f1: 0.5197
 epoch: 57, train_loss: 0.9339, test_loss: 0.9314, test_f1: 0.5139
 epoch: 58, train_loss: 0.9242, test_loss: 0.9192, test_f1: 0.5203
 epoch: 59, train_loss: 0.9252, test_loss: 0.9280, test_f1: 0.5172
 epoch: 60, train_loss: 0.9222, test_loss: 0.9273, test_f1: 0.5137
 epoch: 61, train_loss: 0.9221, test_loss: 0.9358, test_f1: 0.5110
 epoch: 62, train_loss: 0.9162, test_loss: 0.9166, test_f1: 0.5200
 epoch: 63, train_loss: 0.9222, test_loss: 0.9303, test_f1: 0.5184
 epoch: 64, train_loss: 0.9156, test_loss: 0.9211, test_f1: 0.5166
 epoch: 65, train_loss: 0.9241, test_loss: 0.9187, test_f1: 0.5164
 epoch: 66, train_loss: 0.9183, test_loss: 0.9197, test_f1: 0.5203
 epoch: 67, train_loss: 0.9064, test_loss: 0.9504, test_f1: 0.5202
 epoch: 68, train_loss: 0.9129, test_loss: 0.9159, test_f1: 0.5270
 epoch: 69, train_loss: 0.9077, test_loss: 0.9167, test_f1: 0.5254
 epoch: 70, train_loss: 0.9166, test_loss: 0.9144, test_f1: 0.5218
 epoch: 71, train_loss: 0.9183, test_loss: 0.9270, test_f1: 0.5186
 epoch: 72, train_loss: 0.9138, test_loss: 0.9143, test_f1: 0.5208
 epoch: 73, train_loss: 0.9111, test_loss: 0.9127, test_f1: 0.5229
 epoch: 74, train_loss: 0.9121, test_loss: 0.9571, test_f1: 0.5234
 epoch: 75, train_loss: 0.9074, test_loss: 0.9140, test_f1: 0.5203
 epoch: 76, train_loss: 0.9061, test_loss: 0.9209, test_f1: 0.5282
 epoch: 77, train_loss: 0.9116, test_loss: 0.9183, test_f1: 0.5341
 epoch: 78, train_loss: 0.9026, test_loss: 0.9140, test_f1: 0.5274
 epoch: 79, train_loss: 0.9065, test_loss: 0.9137, test_f1: 0.5276
 epoch: 80, train_loss: 0.9057, test_loss: 0.9279, test_f1: 0.5290
 epoch: 81, train_loss: 0.9050, test_loss: 0.9114, test_f1: 0.5283
 epoch: 82, train_loss: 0.9026, test_loss: 0.9108, test_f1: 0.5278
 epoch: 83, train_loss: 0.9060, test_loss: 0.9213, test_f1: 0.5300
 epoch: 84, train_loss: 0.9044, test_loss: 0.9157, test_f1: 0.5264
 epoch: 85, train_loss: 0.9084, test_loss: 0.9141, test_f1: 0.5368
 epoch: 86, train_loss: 0.9064, test_loss: 0.9186, test_f1: 0.5262
 epoch: 87, train_loss: 0.9089, test_loss: 0.9152, test_f1: 0.5221
 epoch: 88, train_loss: 0.9034, test_loss: 0.9128, test_f1: 0.5306
 epoch: 89, train_loss: 0.9035, test_loss: 0.9088, test_f1: 0.5328
 epoch: 90, train_loss: 0.9004, test_loss: 0.9162, test_f1: 0.5203
 epoch: 91, train_loss: 0.8960, test_loss: 0.9096, test_f1: 0.5338
 epoch: 92, train_loss: 0.8921, test_loss: 0.9109, test_f1: 0.5321
 epoch: 93, train_loss: 0.8914, test_loss: 0.9085, test_f1: 0.5234
 epoch: 94, train_loss: 0.8910, test_loss: 0.9181, test_f1: 0.5306
 epoch: 95, train_loss: 0.8856, test_loss: 0.9115, test_f1: 0.5365
 epoch: 96, train_loss: 0.8874, test_loss: 0.9088, test_f1: 0.5286
 epoch: 97, train_loss: 0.8977, test_loss: 0.9068, test_f1: 0.5315
 epoch: 98, train_loss: 0.8951, test_loss: 0.9130, test_f1: 0.5313
 epoch: 99, train_loss: 0.8982, test_loss: 0.9171, test_f1: 0.5291

Training completed in 372.59 seconds
Best F1: 0.5368 at epoch 85
Mean F1 across iterations: 0.5222  0.0123
========================FINAL RESULTS================================
FEGIN weighted F1: 0.5368  0.0123
python main.py --data ltspice_examples --representation component_net --model FEGIN --layers 2 --hiddens 16 --batch_size 256 --lr 0.001 --emb_size 250 --epochs 100 --save_appendix component_net_L2_H16_BS256_LR0.001_E250 --no_val
-----



STDERR:
  File "main.py", line 370, in <module>
    main()
  File "main.py", line 254, in main
    dataset = dataset_class(
  File "/home/philip/projects/ltspice_examples_code_repo/Circuit-Completion-Using-GNNs/component_classification_with_link_prediction_head/evaluation/FEGIN/kernel/circuit_datasets.py", line 15, in __init__
    self.data, self.slices = torch.load(self.processed_paths[0])
  File "/home/philip/.local/lib/python3.8/site-packages/torch/serialization.py", line 1040, in load
    warnings.warn(
  File "/usr/lib/python3.8/warnings.py", line 109, in _showwarnmsg
    sw(msg.message, msg.category, msg.filename, msg.lineno,
  File "main.py", line 47, in warn_with_traceback
    traceback.print_stack(file=log)
/home/philip/projects/ltspice_examples_code_repo/Circuit-Completion-Using-GNNs/component_classification_with_link_prediction_head/evaluation/FEGIN/kernel/circuit_datasets.py:15: FutureWarning: You are using `torch.load` with `weights_only=False` (the current default value), which uses the default pickle module implicitly. It is possible to construct malicious pickle data which will execute arbitrary code during unpickling (See https://github.com/pytorch/pytorch/blob/main/SECURITY.md#untrusted-models for more details). In a future release, the default value for `weights_only` will be flipped to `True`. This limits the functions that could be executed during unpickling. Arbitrary objects will no longer be allowed to be loaded via this mode unless they are explicitly allowlisted by the user via `torch.serialization.add_safe_globals`. We recommend you start setting `weights_only=True` for any use case where you don't have full control of the loaded file. Please open an issue on GitHub for any issues related to this experimental feature.
  self.data, self.slices = torch.load(self.processed_paths[0])
