STDOUT:
Results will be saved in /home/philip/projects/ltspice_examples_code_repo/Circuit-Completion-Using-GNNs/component_classification_with_link_prediction_head/evaluation/FEGIN/results/model_FEGIN_dataset_ltspice_demos
Command line input: python main.py --data ltspice_demos --representation component_pin --model FEGIN --layers 3 --hiddens 16 --batch_size 256 --lr 0.1 --emb_size 128 --epochs 100 --save_appendix component_pin_L3_H16_BS256_LR0.1_E128 --no_val
 is saved.
-----
ltspice_demos - FEGIN
Using 3 layers, 16 hidden units, h = 2
Loading component_pin representation dataset
ENTERED
Training FEGIN on component_pin representation
Train: 1565, Test: 383
##################ITERATION #0 ****************************************
 epoch: 0, train_loss: 1.3912, test_loss: 1.3046, test_f1: 0.2281
 epoch: 1, train_loss: 1.2681, test_loss: 1.3010, test_f1: 0.2281
 epoch: 2, train_loss: 1.2502, test_loss: 1.3081, test_f1: 0.1523
 epoch: 3, train_loss: 1.2378, test_loss: 1.2872, test_f1: 0.1872
 epoch: 4, train_loss: 1.1898, test_loss: 1.1799, test_f1: 0.3315
 epoch: 5, train_loss: 1.1392, test_loss: 1.1642, test_f1: 0.3344
 epoch: 6, train_loss: 1.1120, test_loss: 1.1253, test_f1: 0.3317
 epoch: 7, train_loss: 1.0811, test_loss: 1.1802, test_f1: 0.3714
 epoch: 8, train_loss: 1.0617, test_loss: 1.1506, test_f1: 0.4230
 epoch: 9, train_loss: 1.0527, test_loss: 1.1303, test_f1: 0.4123
 epoch: 10, train_loss: 1.0498, test_loss: 1.1471, test_f1: 0.4370
 epoch: 11, train_loss: 1.0789, test_loss: 1.4863, test_f1: 0.1755
 epoch: 12, train_loss: 1.0945, test_loss: 1.1347, test_f1: 0.4341
 epoch: 13, train_loss: 1.0715, test_loss: 1.1089, test_f1: 0.3365
 epoch: 14, train_loss: 1.0578, test_loss: 1.1516, test_f1: 0.3115
 epoch: 15, train_loss: 1.0762, test_loss: 1.1392, test_f1: 0.3370
 epoch: 16, train_loss: 1.0658, test_loss: 1.1419, test_f1: 0.3395
 epoch: 17, train_loss: 1.0521, test_loss: 1.1442, test_f1: 0.3395
 epoch: 18, train_loss: 1.0440, test_loss: 1.1547, test_f1: 0.4346
 epoch: 19, train_loss: 1.0291, test_loss: 1.1458, test_f1: 0.4348
 epoch: 20, train_loss: 1.0279, test_loss: 1.1344, test_f1: 0.3395
 epoch: 21, train_loss: 1.0336, test_loss: 1.1556, test_f1: 0.3344
 epoch: 22, train_loss: 1.0283, test_loss: 1.1471, test_f1: 0.4451
 epoch: 23, train_loss: 1.0337, test_loss: 1.1363, test_f1: 0.3370
 epoch: 24, train_loss: 1.0375, test_loss: 1.1383, test_f1: 0.3344
 epoch: 25, train_loss: 1.0400, test_loss: 1.1000, test_f1: 0.3853
 epoch: 26, train_loss: 1.0374, test_loss: 1.1289, test_f1: 0.4299
 epoch: 27, train_loss: 1.0339, test_loss: 1.0829, test_f1: 0.3797
 epoch: 28, train_loss: 1.0255, test_loss: 1.0964, test_f1: 0.3492
 epoch: 29, train_loss: 1.0226, test_loss: 1.1031, test_f1: 0.3632
 epoch: 30, train_loss: 1.0202, test_loss: 1.0998, test_f1: 0.3492
 epoch: 31, train_loss: 1.0237, test_loss: 1.1213, test_f1: 0.3395
 epoch: 32, train_loss: 1.0071, test_loss: 1.1279, test_f1: 0.4436
 epoch: 33, train_loss: 1.0116, test_loss: 1.4108, test_f1: 0.3455
 epoch: 34, train_loss: 1.0187, test_loss: 2.0224, test_f1: 0.3086
 epoch: 35, train_loss: 1.0305, test_loss: 1.1681, test_f1: 0.3317
 epoch: 36, train_loss: 1.0416, test_loss: 1.1143, test_f1: 0.4099
 epoch: 37, train_loss: 1.0206, test_loss: 1.1511, test_f1: 0.4023
 epoch: 38, train_loss: 1.0302, test_loss: 1.1353, test_f1: 0.3581
 epoch: 39, train_loss: 1.0260, test_loss: 1.1469, test_f1: 0.3528
 epoch: 40, train_loss: 1.0179, test_loss: 1.1566, test_f1: 0.3817
 epoch: 41, train_loss: 1.0052, test_loss: 1.1428, test_f1: 0.4238
 epoch: 42, train_loss: 1.0090, test_loss: 2.4807, test_f1: 0.2650
 epoch: 43, train_loss: 1.0156, test_loss: 1.0751, test_f1: 0.3375
 epoch: 44, train_loss: 1.0385, test_loss: 1.7544, test_f1: 0.3019
 epoch: 45, train_loss: 1.0124, test_loss: 1.0959, test_f1: 0.3344
 epoch: 46, train_loss: 1.0436, test_loss: 1.1089, test_f1: 0.3890
 epoch: 47, train_loss: 1.0601, test_loss: 1.1065, test_f1: 0.3375
 epoch: 48, train_loss: 1.0680, test_loss: 1.0830, test_f1: 0.4824
 epoch: 49, train_loss: 1.0167, test_loss: 1.0949, test_f1: 0.4039
 epoch: 50, train_loss: 1.0117, test_loss: 1.1765, test_f1: 0.3234
 epoch: 51, train_loss: 1.0323, test_loss: 1.1384, test_f1: 0.3463
 epoch: 52, train_loss: 1.0199, test_loss: 1.1106, test_f1: 0.4251
 epoch: 53, train_loss: 0.9922, test_loss: 1.0787, test_f1: 0.4349
 epoch: 54, train_loss: 0.9916, test_loss: 1.0731, test_f1: 0.4379
 epoch: 55, train_loss: 1.0000, test_loss: 1.0431, test_f1: 0.3492
 epoch: 56, train_loss: 0.9819, test_loss: 1.0580, test_f1: 0.3458
 epoch: 57, train_loss: 1.0219, test_loss: 1.0814, test_f1: 0.3433
 epoch: 58, train_loss: 1.0342, test_loss: 1.0468, test_f1: 0.3433
 epoch: 59, train_loss: 1.0041, test_loss: 1.0703, test_f1: 0.4439
 epoch: 60, train_loss: 0.9953, test_loss: 1.0511, test_f1: 0.3885
 epoch: 61, train_loss: 1.0053, test_loss: 1.0712, test_f1: 0.3492
 epoch: 62, train_loss: 0.9990, test_loss: 1.1053, test_f1: 0.3444
 epoch: 63, train_loss: 1.0022, test_loss: 1.0384, test_f1: 0.3422
 epoch: 64, train_loss: 0.9867, test_loss: 1.3702, test_f1: 0.3192
 epoch: 65, train_loss: 0.9778, test_loss: 1.0885, test_f1: 0.3304
 epoch: 66, train_loss: 0.9737, test_loss: 1.0249, test_f1: 0.4121
 epoch: 67, train_loss: 0.9638, test_loss: 1.0147, test_f1: 0.4529
 epoch: 68, train_loss: 0.9563, test_loss: 1.0790, test_f1: 0.4431
 epoch: 69, train_loss: 0.9993, test_loss: 1.1130, test_f1: 0.3520
 epoch: 70, train_loss: 1.0456, test_loss: 1.0996, test_f1: 0.3344
 epoch: 71, train_loss: 1.0235, test_loss: 2.4145, test_f1: 0.2909
 epoch: 72, train_loss: 1.0104, test_loss: 4.6410, test_f1: 0.2947
 epoch: 73, train_loss: 1.0174, test_loss: 1.5010, test_f1: 0.3056
 epoch: 74, train_loss: 1.0079, test_loss: 1.4324, test_f1: 0.3079
 epoch: 75, train_loss: 0.9943, test_loss: 1.2308, test_f1: 0.3062
 epoch: 76, train_loss: 0.9938, test_loss: 1.3614, test_f1: 0.3079
 epoch: 77, train_loss: 0.9881, test_loss: 1.4890, test_f1: 0.3060
 epoch: 78, train_loss: 0.9884, test_loss: 1.4055, test_f1: 0.3079
 epoch: 79, train_loss: 0.9801, test_loss: 1.2008, test_f1: 0.3181
 epoch: 80, train_loss: 0.9898, test_loss: 1.2711, test_f1: 0.3176
 epoch: 81, train_loss: 1.0139, test_loss: 1.3035, test_f1: 0.3180
 epoch: 82, train_loss: 1.0050, test_loss: 1.0856, test_f1: 0.3409
 epoch: 83, train_loss: 0.9865, test_loss: 1.0561, test_f1: 0.3492
 epoch: 84, train_loss: 0.9693, test_loss: 1.1027, test_f1: 0.3370
 epoch: 85, train_loss: 0.9547, test_loss: 1.3163, test_f1: 0.3159
 epoch: 86, train_loss: 0.9589, test_loss: 2.4372, test_f1: 0.3098
 epoch: 87, train_loss: 0.9585, test_loss: 2.3301, test_f1: 0.3079
 epoch: 88, train_loss: 0.9937, test_loss: 37.0620, test_f1: 0.0794
 epoch: 89, train_loss: 0.9583, test_loss: 1.4473, test_f1: 0.4121
 epoch: 90, train_loss: 0.9395, test_loss: 2.2750, test_f1: 0.3057
 epoch: 91, train_loss: 0.9608, test_loss: 1.2395, test_f1: 0.3224
 epoch: 92, train_loss: 0.9660, test_loss: 1.1870, test_f1: 0.3835
 epoch: 93, train_loss: 0.9994, test_loss: 1.1740, test_f1: 0.3631
 epoch: 94, train_loss: 0.9765, test_loss: 1.1046, test_f1: 0.3268
 epoch: 95, train_loss: 0.9709, test_loss: 1.0896, test_f1: 0.3292
 epoch: 96, train_loss: 0.9692, test_loss: 1.0884, test_f1: 0.3288
 epoch: 97, train_loss: 0.9717, test_loss: 1.0544, test_f1: 0.4227
 epoch: 98, train_loss: 0.9432, test_loss: 1.0577, test_f1: 0.3493
 epoch: 99, train_loss: 0.9503, test_loss: 1.7823, test_f1: 0.3116
##################ITERATION #1 ****************************************
 epoch: 0, train_loss: 1.3193, test_loss: 1.4121, test_f1: 0.2373
 epoch: 1, train_loss: 1.1867, test_loss: 1.3507, test_f1: 0.2281
 epoch: 2, train_loss: 1.1795, test_loss: 1.2100, test_f1: 0.2930
 epoch: 3, train_loss: 1.0981, test_loss: 2.5125, test_f1: 0.2290
 epoch: 4, train_loss: 1.0760, test_loss: 1.1043, test_f1: 0.3422
 epoch: 5, train_loss: 1.0747, test_loss: 1.1358, test_f1: 0.3344
 epoch: 6, train_loss: 1.0679, test_loss: 2.5635, test_f1: 0.2257
 epoch: 7, train_loss: 1.0510, test_loss: 2.3192, test_f1: 0.2257
 epoch: 8, train_loss: 1.0484, test_loss: 2.8081, test_f1: 0.2476
 epoch: 9, train_loss: 1.0401, test_loss: 1.9751, test_f1: 0.2984
 epoch: 10, train_loss: 1.0415, test_loss: 2.6173, test_f1: 0.2521
 epoch: 11, train_loss: 1.0255, test_loss: 1.8204, test_f1: 0.2298
 epoch: 12, train_loss: 1.0540, test_loss: 5.3040, test_f1: 0.2567
 epoch: 13, train_loss: 1.0656, test_loss: 2.2518, test_f1: 0.2832
 epoch: 14, train_loss: 1.0460, test_loss: 1.1972, test_f1: 0.3146
 epoch: 15, train_loss: 1.0404, test_loss: 1.3419, test_f1: 0.3109
 epoch: 16, train_loss: 1.0335, test_loss: 1.1683, test_f1: 0.3220
 epoch: 17, train_loss: 1.0346, test_loss: 1.1048, test_f1: 0.3395
 epoch: 18, train_loss: 1.0543, test_loss: 1.3608, test_f1: 0.2838
 epoch: 19, train_loss: 1.0503, test_loss: 1.3395, test_f1: 0.3149
 epoch: 20, train_loss: 1.0371, test_loss: 1.2005, test_f1: 0.3179
 epoch: 21, train_loss: 1.0292, test_loss: 1.1075, test_f1: 0.3412
 epoch: 22, train_loss: 1.0202, test_loss: 1.1260, test_f1: 0.3412
 epoch: 23, train_loss: 1.0192, test_loss: 1.1167, test_f1: 0.3420
 epoch: 24, train_loss: 1.0246, test_loss: 1.4035, test_f1: 0.3796
 epoch: 25, train_loss: 1.0058, test_loss: 1.8570, test_f1: 0.2894
 epoch: 26, train_loss: 0.9960, test_loss: 1.1992, test_f1: 0.3094
 epoch: 27, train_loss: 0.9972, test_loss: 1.1341, test_f1: 0.3420
 epoch: 28, train_loss: 1.0148, test_loss: 1.1450, test_f1: 0.3334
 epoch: 29, train_loss: 1.0054, test_loss: 1.1469, test_f1: 0.3262
 epoch: 30, train_loss: 1.0155, test_loss: 1.3335, test_f1: 0.3167
 epoch: 31, train_loss: 1.0055, test_loss: 7.7396, test_f1: 0.2331
 epoch: 32, train_loss: 1.0065, test_loss: 2.4833, test_f1: 0.2955
 epoch: 33, train_loss: 1.0145, test_loss: 1.1421, test_f1: 0.3538
 epoch: 34, train_loss: 1.0081, test_loss: 1.0814, test_f1: 0.4230
 epoch: 35, train_loss: 1.0051, test_loss: 1.2476, test_f1: 0.3650
 epoch: 36, train_loss: 1.0238, test_loss: 1.1401, test_f1: 0.3492
 epoch: 37, train_loss: 1.0060, test_loss: 1.2291, test_f1: 0.3115
 epoch: 38, train_loss: 0.9967, test_loss: 1.1168, test_f1: 0.3627
 epoch: 39, train_loss: 0.9828, test_loss: 2.8515, test_f1: 0.2758
 epoch: 40, train_loss: 0.9936, test_loss: 1.3966, test_f1: 0.3160
 epoch: 41, train_loss: 0.9987, test_loss: 1.8569, test_f1: 0.3849
 epoch: 42, train_loss: 1.0016, test_loss: 1.1752, test_f1: 0.3019
 epoch: 43, train_loss: 1.0066, test_loss: 1.2220, test_f1: 0.3235
 epoch: 44, train_loss: 0.9673, test_loss: 1.2378, test_f1: 0.3499
 epoch: 45, train_loss: 0.9736, test_loss: 1.1903, test_f1: 0.3913
 epoch: 46, train_loss: 1.0089, test_loss: 1.4211, test_f1: 0.4151
 epoch: 47, train_loss: 0.9704, test_loss: 1.3860, test_f1: 0.3983
 epoch: 48, train_loss: 0.9788, test_loss: 1.9437, test_f1: 0.4425
 epoch: 49, train_loss: 1.0058, test_loss: 1.3353, test_f1: 0.3930
 epoch: 50, train_loss: 1.0042, test_loss: 1.4984, test_f1: 0.4764
 epoch: 51, train_loss: 0.9654, test_loss: 1.6653, test_f1: 0.4037
 epoch: 52, train_loss: 0.9934, test_loss: 1.0942, test_f1: 0.4130
 epoch: 53, train_loss: 0.9901, test_loss: 1.0894, test_f1: 0.4127
 epoch: 54, train_loss: 0.9950, test_loss: 1.1166, test_f1: 0.3961
 epoch: 55, train_loss: 0.9686, test_loss: 1.5845, test_f1: 0.3773
 epoch: 56, train_loss: 0.9717, test_loss: 2.0154, test_f1: 0.3579
 epoch: 57, train_loss: 0.9576, test_loss: 2.2008, test_f1: 0.3573
 epoch: 58, train_loss: 0.9561, test_loss: 2.2822, test_f1: 0.3635
 epoch: 59, train_loss: 0.9342, test_loss: 1.9734, test_f1: 0.3646
 epoch: 60, train_loss: 0.9265, test_loss: 1.7852, test_f1: 0.4242
 epoch: 61, train_loss: 0.9226, test_loss: 2.1318, test_f1: 0.3791
 epoch: 62, train_loss: 0.9281, test_loss: 2.0337, test_f1: 0.4158
 epoch: 63, train_loss: 0.9239, test_loss: 1.9126, test_f1: 0.4151
 epoch: 64, train_loss: 0.9340, test_loss: 2.1932, test_f1: 0.4511
 epoch: 65, train_loss: 0.9504, test_loss: 1.6787, test_f1: 0.4562
 epoch: 66, train_loss: 0.9650, test_loss: 1.3091, test_f1: 0.4140
 epoch: 67, train_loss: 0.9434, test_loss: 1.5078, test_f1: 0.3960
 epoch: 68, train_loss: 0.9312, test_loss: 2.2818, test_f1: 0.3831
 epoch: 69, train_loss: 0.9478, test_loss: 1.9743, test_f1: 0.4657
 epoch: 70, train_loss: 0.9358, test_loss: 1.5858, test_f1: 0.4227
 epoch: 71, train_loss: 0.9785, test_loss: 1.1541, test_f1: 0.4111
 epoch: 72, train_loss: 0.9770, test_loss: 1.5101, test_f1: 0.4030
 epoch: 73, train_loss: 0.9491, test_loss: 2.4437, test_f1: 0.3712
 epoch: 74, train_loss: 0.9711, test_loss: 1.3527, test_f1: 0.3953
 epoch: 75, train_loss: 0.9742, test_loss: 1.1485, test_f1: 0.4292
 epoch: 76, train_loss: 0.9690, test_loss: 1.3323, test_f1: 0.4099
 epoch: 77, train_loss: 0.9433, test_loss: 1.0876, test_f1: 0.4178
 epoch: 78, train_loss: 0.9513, test_loss: 1.3909, test_f1: 0.3931
 epoch: 79, train_loss: 0.9422, test_loss: 1.3615, test_f1: 0.3998
 epoch: 80, train_loss: 0.9306, test_loss: 1.4389, test_f1: 0.4132
 epoch: 81, train_loss: 0.9134, test_loss: 1.4983, test_f1: 0.4196
 epoch: 82, train_loss: 0.9110, test_loss: 1.6042, test_f1: 0.4281
 epoch: 83, train_loss: 0.8948, test_loss: 1.6236, test_f1: 0.3864
 epoch: 84, train_loss: 0.8752, test_loss: 1.4805, test_f1: 0.3970
 epoch: 85, train_loss: 0.8823, test_loss: 1.7543, test_f1: 0.4447
 epoch: 86, train_loss: 0.8382, test_loss: 2.3881, test_f1: 0.4215
 epoch: 87, train_loss: 0.8934, test_loss: 2.0420, test_f1: 0.3537
 epoch: 88, train_loss: 0.8840, test_loss: 1.6686, test_f1: 0.4019
 epoch: 89, train_loss: 0.8862, test_loss: 2.0158, test_f1: 0.5094
 epoch: 90, train_loss: 0.8689, test_loss: 3.2236, test_f1: 0.4718
 epoch: 91, train_loss: 0.8582, test_loss: 3.1292, test_f1: 0.4519
 epoch: 92, train_loss: 0.8451, test_loss: 2.4187, test_f1: 0.4970
 epoch: 93, train_loss: 0.8480, test_loss: 1.9740, test_f1: 0.4489
 epoch: 94, train_loss: 0.8372, test_loss: 1.6674, test_f1: 0.4403
 epoch: 95, train_loss: 0.8529, test_loss: 1.6261, test_f1: 0.4033
 epoch: 96, train_loss: 0.8672, test_loss: 1.3534, test_f1: 0.4475
 epoch: 97, train_loss: 0.8553, test_loss: 2.3101, test_f1: 0.4514
 epoch: 98, train_loss: 1.0298, test_loss: 1.5325, test_f1: 0.4504
 epoch: 99, train_loss: 1.0151, test_loss: 1.8406, test_f1: 0.4084
##################ITERATION #2 ****************************************
 epoch: 0, train_loss: 1.2795, test_loss: 13.9170, test_f1: 0.1365
 epoch: 1, train_loss: 1.3205, test_loss: 1.3893, test_f1: 0.2373
 epoch: 2, train_loss: 1.2619, test_loss: 1.3119, test_f1: 0.3137
 epoch: 3, train_loss: 1.2657, test_loss: 1.2927, test_f1: 0.2281
 epoch: 4, train_loss: 1.2431, test_loss: 1.3648, test_f1: 0.2248
 epoch: 5, train_loss: 1.2275, test_loss: 1.2804, test_f1: 0.2328
 epoch: 6, train_loss: 1.1681, test_loss: 1.2397, test_f1: 0.2491
 epoch: 7, train_loss: 1.1176, test_loss: 1.2365, test_f1: 0.4108
 epoch: 8, train_loss: 1.0915, test_loss: 1.1466, test_f1: 0.3370
 epoch: 9, train_loss: 1.0706, test_loss: 1.1058, test_f1: 0.3508
 epoch: 10, train_loss: 1.0459, test_loss: 1.1632, test_f1: 0.3745
 epoch: 11, train_loss: 1.0516, test_loss: 1.1232, test_f1: 0.4038
 epoch: 12, train_loss: 1.0341, test_loss: 1.6390, test_f1: 0.2233
 epoch: 13, train_loss: 1.0391, test_loss: 1.1028, test_f1: 0.4165
 epoch: 14, train_loss: 1.0249, test_loss: 1.1190, test_f1: 0.4094
 epoch: 15, train_loss: 1.0293, test_loss: 1.6486, test_f1: 0.2886
 epoch: 16, train_loss: 1.0080, test_loss: 1.1864, test_f1: 0.3532
 epoch: 17, train_loss: 1.0031, test_loss: 1.1452, test_f1: 0.4010
 epoch: 18, train_loss: 0.9987, test_loss: 1.2374, test_f1: 0.3399
 epoch: 19, train_loss: 0.9909, test_loss: 1.1582, test_f1: 0.3819
 epoch: 20, train_loss: 0.9679, test_loss: 1.2449, test_f1: 0.4146
 epoch: 21, train_loss: 0.9674, test_loss: 1.2930, test_f1: 0.3900
 epoch: 22, train_loss: 0.9959, test_loss: 1.2735, test_f1: 0.3870
 epoch: 23, train_loss: 0.9887, test_loss: 1.1990, test_f1: 0.4157
 epoch: 24, train_loss: 0.9613, test_loss: 1.3349, test_f1: 0.4244
 epoch: 25, train_loss: 0.9938, test_loss: 1.4359, test_f1: 0.4013
 epoch: 26, train_loss: 0.9955, test_loss: 2.4796, test_f1: 0.3476
 epoch: 27, train_loss: 1.0008, test_loss: 1.5527, test_f1: 0.3054
 epoch: 28, train_loss: 1.0292, test_loss: 1.2720, test_f1: 0.3200
 epoch: 29, train_loss: 1.0175, test_loss: 1.4433, test_f1: 0.3995
 epoch: 30, train_loss: 0.9894, test_loss: 2.0087, test_f1: 0.1858
 epoch: 31, train_loss: 0.9998, test_loss: 1.1870, test_f1: 0.4216
 epoch: 32, train_loss: 1.0080, test_loss: 1.2900, test_f1: 0.3658
 epoch: 33, train_loss: 0.9984, test_loss: 1.1578, test_f1: 0.3786
 epoch: 34, train_loss: 0.9957, test_loss: 1.1558, test_f1: 0.3876
 epoch: 35, train_loss: 0.9885, test_loss: 1.4654, test_f1: 0.3565
 epoch: 36, train_loss: 1.0125, test_loss: 1.3796, test_f1: 0.3472
 epoch: 37, train_loss: 0.9996, test_loss: 1.2173, test_f1: 0.4195
 epoch: 38, train_loss: 0.9822, test_loss: 4.8882, test_f1: 0.3911
 epoch: 39, train_loss: 1.0067, test_loss: 1.4110, test_f1: 0.3661
 epoch: 40, train_loss: 0.9993, test_loss: 1.5196, test_f1: 0.3027
 epoch: 41, train_loss: 0.9880, test_loss: 1.3724, test_f1: 0.3854
 epoch: 42, train_loss: 0.9535, test_loss: 1.4085, test_f1: 0.3257
 epoch: 43, train_loss: 0.9701, test_loss: 1.2671, test_f1: 0.4235
 epoch: 44, train_loss: 0.9692, test_loss: 1.3844, test_f1: 0.4285
 epoch: 45, train_loss: 0.9855, test_loss: 1.6999, test_f1: 0.3585
 epoch: 46, train_loss: 0.9558, test_loss: 1.3685, test_f1: 0.3597
 epoch: 47, train_loss: 0.9603, test_loss: 1.1429, test_f1: 0.3941
 epoch: 48, train_loss: 0.9694, test_loss: 1.1238, test_f1: 0.4430
 epoch: 49, train_loss: 0.9592, test_loss: 1.2712, test_f1: 0.4506
 epoch: 50, train_loss: 0.9525, test_loss: 1.5552, test_f1: 0.4133
 epoch: 51, train_loss: 0.9502, test_loss: 1.3859, test_f1: 0.4140
 epoch: 52, train_loss: 0.9360, test_loss: 1.1540, test_f1: 0.4379
 epoch: 53, train_loss: 0.9413, test_loss: 1.1410, test_f1: 0.4393
 epoch: 54, train_loss: 0.9198, test_loss: 1.1960, test_f1: 0.4765
 epoch: 55, train_loss: 0.9164, test_loss: 1.1111, test_f1: 0.4343
 epoch: 56, train_loss: 0.9243, test_loss: 1.1214, test_f1: 0.4309
 epoch: 57, train_loss: 0.9103, test_loss: 1.1505, test_f1: 0.4449
 epoch: 58, train_loss: 0.9301, test_loss: 1.2608, test_f1: 0.4082
 epoch: 59, train_loss: 0.9573, test_loss: 1.2809, test_f1: 0.4148
 epoch: 60, train_loss: 0.9151, test_loss: 1.1510, test_f1: 0.4199
 epoch: 61, train_loss: 0.9192, test_loss: 1.2447, test_f1: 0.3344
 epoch: 62, train_loss: 0.9160, test_loss: 1.3398, test_f1: 0.2655
 epoch: 63, train_loss: 0.8981, test_loss: 1.4578, test_f1: 0.3704
 epoch: 64, train_loss: 0.8913, test_loss: 1.3630, test_f1: 0.4281
 epoch: 65, train_loss: 0.9034, test_loss: 1.2382, test_f1: 0.4314
 epoch: 66, train_loss: 0.8998, test_loss: 1.5615, test_f1: 0.3966
 epoch: 67, train_loss: 0.8902, test_loss: 1.2943, test_f1: 0.4736
 epoch: 68, train_loss: 0.8963, test_loss: 1.2586, test_f1: 0.4222
 epoch: 69, train_loss: 0.9231, test_loss: 1.2109, test_f1: 0.4341
 epoch: 70, train_loss: 0.9396, test_loss: 1.3902, test_f1: 0.4007
 epoch: 71, train_loss: 0.9105, test_loss: 1.2273, test_f1: 0.4357
 epoch: 72, train_loss: 0.9163, test_loss: 1.1675, test_f1: 0.4362
 epoch: 73, train_loss: 0.9141, test_loss: 1.7780, test_f1: 0.3536
 epoch: 74, train_loss: 0.9252, test_loss: 1.3655, test_f1: 0.3891
 epoch: 75, train_loss: 0.9146, test_loss: 1.3357, test_f1: 0.4137
 epoch: 76, train_loss: 0.8925, test_loss: 1.4722, test_f1: 0.4345
 epoch: 77, train_loss: 0.8932, test_loss: 1.7737, test_f1: 0.4186
 epoch: 78, train_loss: 0.8784, test_loss: 1.4253, test_f1: 0.4360
 epoch: 79, train_loss: 0.8968, test_loss: 1.2823, test_f1: 0.4442
 epoch: 80, train_loss: 0.8856, test_loss: 1.2400, test_f1: 0.4427
 epoch: 81, train_loss: 0.8685, test_loss: 1.3115, test_f1: 0.4327
 epoch: 82, train_loss: 0.8656, test_loss: 1.4649, test_f1: 0.4202
 epoch: 83, train_loss: 0.8745, test_loss: 1.5737, test_f1: 0.4199
 epoch: 84, train_loss: 0.8716, test_loss: 1.5371, test_f1: 0.4115
 epoch: 85, train_loss: 0.8694, test_loss: 1.4925, test_f1: 0.4231
 epoch: 86, train_loss: 0.8550, test_loss: 1.3593, test_f1: 0.4394
 epoch: 87, train_loss: 0.8537, test_loss: 1.5390, test_f1: 0.4287
 epoch: 88, train_loss: 0.8662, test_loss: 1.5288, test_f1: 0.4229
 epoch: 89, train_loss: 0.8674, test_loss: 1.6240, test_f1: 0.3878
 epoch: 90, train_loss: 0.8767, test_loss: 2.0417, test_f1: 0.4064
 epoch: 91, train_loss: 0.8795, test_loss: 1.6653, test_f1: 0.4271
 epoch: 92, train_loss: 0.8754, test_loss: 1.6491, test_f1: 0.4475
 epoch: 93, train_loss: 0.8777, test_loss: 2.0544, test_f1: 0.3984
 epoch: 94, train_loss: 0.9274, test_loss: 1.1325, test_f1: 0.4384
 epoch: 95, train_loss: 0.9432, test_loss: 1.0654, test_f1: 0.4626
 epoch: 96, train_loss: 0.9220, test_loss: 0.9855, test_f1: 0.4784
 epoch: 97, train_loss: 0.9130, test_loss: 1.0253, test_f1: 0.4614
 epoch: 98, train_loss: 0.9205, test_loss: 1.1674, test_f1: 0.3618
 epoch: 99, train_loss: 0.9183, test_loss: 1.2178, test_f1: 0.3444
##################ITERATION #3 ****************************************
 epoch: 0, train_loss: 1.5859, test_loss: 3.1032, test_f1: 0.2171
 epoch: 1, train_loss: 1.3416, test_loss: 1.3433, test_f1: 0.2281
 epoch: 2, train_loss: 1.2952, test_loss: 1.3145, test_f1: 0.2281
 epoch: 3, train_loss: 1.2564, test_loss: 1.3087, test_f1: 0.2281
 epoch: 4, train_loss: 1.2614, test_loss: 1.3091, test_f1: 0.2281
 epoch: 5, train_loss: 1.2616, test_loss: 1.3154, test_f1: 0.2281
 epoch: 6, train_loss: 1.2564, test_loss: 1.3034, test_f1: 0.2281
 epoch: 7, train_loss: 1.2561, test_loss: 1.3021, test_f1: 0.2281
 epoch: 8, train_loss: 1.2548, test_loss: 1.3154, test_f1: 0.2281
 epoch: 9, train_loss: 1.2604, test_loss: 1.3203, test_f1: 0.2281
 epoch: 10, train_loss: 1.2577, test_loss: 1.3041, test_f1: 0.2281
 epoch: 11, train_loss: 1.2530, test_loss: 1.3041, test_f1: 0.2281
 epoch: 12, train_loss: 1.2554, test_loss: 1.3083, test_f1: 0.2281
 epoch: 13, train_loss: 1.2536, test_loss: 1.3125, test_f1: 0.2281
 epoch: 14, train_loss: 1.2579, test_loss: 1.3055, test_f1: 0.2281
 epoch: 15, train_loss: 1.2557, test_loss: 1.3021, test_f1: 0.2281
 epoch: 16, train_loss: 1.2566, test_loss: 1.3069, test_f1: 0.2281
 epoch: 17, train_loss: 1.2537, test_loss: 1.3167, test_f1: 0.2281
 epoch: 18, train_loss: 1.2586, test_loss: 1.3061, test_f1: 0.2281
 epoch: 19, train_loss: 1.2548, test_loss: 1.2992, test_f1: 0.2281
 epoch: 20, train_loss: 1.2569, test_loss: 1.3128, test_f1: 0.2281
 epoch: 21, train_loss: 1.2574, test_loss: 1.3075, test_f1: 0.2281
 epoch: 22, train_loss: 1.2580, test_loss: 1.3002, test_f1: 0.2281
 epoch: 23, train_loss: 1.2577, test_loss: 1.3142, test_f1: 0.1365
 epoch: 24, train_loss: 1.2566, test_loss: 1.3043, test_f1: 0.2281
 epoch: 25, train_loss: 1.2534, test_loss: 1.3008, test_f1: 0.2281
 epoch: 26, train_loss: 1.2552, test_loss: 1.3026, test_f1: 0.2281
 epoch: 27, train_loss: 1.2548, test_loss: 1.3158, test_f1: 0.2281
 epoch: 28, train_loss: 1.2543, test_loss: 1.3040, test_f1: 0.2281
 epoch: 29, train_loss: 1.2530, test_loss: 1.3019, test_f1: 0.2281
 epoch: 30, train_loss: 1.2543, test_loss: 1.3034, test_f1: 0.2281
 epoch: 31, train_loss: 1.2545, test_loss: 1.3165, test_f1: 0.2281
 epoch: 32, train_loss: 1.2588, test_loss: 1.3065, test_f1: 0.2281
 epoch: 33, train_loss: 1.2571, test_loss: 1.3098, test_f1: 0.1365
 epoch: 34, train_loss: 1.2539, test_loss: 1.3115, test_f1: 0.2281
 epoch: 35, train_loss: 1.2546, test_loss: 1.3045, test_f1: 0.2281
 epoch: 36, train_loss: 1.2541, test_loss: 1.3046, test_f1: 0.2281
 epoch: 37, train_loss: 1.2540, test_loss: 1.3103, test_f1: 0.2281
 epoch: 38, train_loss: 1.2597, test_loss: 1.3103, test_f1: 0.2281
 epoch: 39, train_loss: 1.2584, test_loss: 1.3074, test_f1: 0.2281
 epoch: 40, train_loss: 1.2572, test_loss: 1.3133, test_f1: 0.2281
 epoch: 41, train_loss: 1.2591, test_loss: 1.3127, test_f1: 0.2281
 epoch: 42, train_loss: 1.2554, test_loss: 1.3066, test_f1: 0.2281
 epoch: 43, train_loss: 1.2554, test_loss: 1.3069, test_f1: 0.2281
 epoch: 44, train_loss: 1.2540, test_loss: 1.3054, test_f1: 0.2281
 epoch: 45, train_loss: 1.2555, test_loss: 1.3084, test_f1: 0.2281
 epoch: 46, train_loss: 1.2640, test_loss: 1.3155, test_f1: 0.2281
 epoch: 47, train_loss: 1.2566, test_loss: 1.3036, test_f1: 0.2281
 epoch: 48, train_loss: 1.2574, test_loss: 1.3100, test_f1: 0.2281
 epoch: 49, train_loss: 1.2611, test_loss: 1.3148, test_f1: 0.2281
 epoch: 50, train_loss: 1.2572, test_loss: 1.2995, test_f1: 0.2281
 epoch: 51, train_loss: 1.2561, test_loss: 1.3057, test_f1: 0.2281
 epoch: 52, train_loss: 1.2525, test_loss: 1.3073, test_f1: 0.2281
 epoch: 53, train_loss: 1.2530, test_loss: 1.3073, test_f1: 0.2281
 epoch: 54, train_loss: 1.2527, test_loss: 1.3123, test_f1: 0.2281
 epoch: 55, train_loss: 1.2537, test_loss: 1.3102, test_f1: 0.2281
 epoch: 56, train_loss: 1.2530, test_loss: 1.3078, test_f1: 0.2281
 epoch: 57, train_loss: 1.2521, test_loss: 1.2998, test_f1: 0.2281
 epoch: 58, train_loss: 1.2553, test_loss: 1.3008, test_f1: 0.2281
 epoch: 59, train_loss: 1.2538, test_loss: 1.3049, test_f1: 0.2281
 epoch: 60, train_loss: 1.2527, test_loss: 1.3032, test_f1: 0.2281
 epoch: 61, train_loss: 1.2522, test_loss: 1.3047, test_f1: 0.2281
 epoch: 62, train_loss: 1.2534, test_loss: 1.3021, test_f1: 0.2281
 epoch: 63, train_loss: 1.2524, test_loss: 1.3079, test_f1: 0.2281
 epoch: 64, train_loss: 1.2538, test_loss: 1.3097, test_f1: 0.2281
 epoch: 65, train_loss: 1.2538, test_loss: 1.3085, test_f1: 0.2281
 epoch: 66, train_loss: 1.2534, test_loss: 1.3064, test_f1: 0.2281
 epoch: 67, train_loss: 1.2530, test_loss: 1.3050, test_f1: 0.2281
 epoch: 68, train_loss: 1.2531, test_loss: 1.3050, test_f1: 0.2281
 epoch: 69, train_loss: 1.2534, test_loss: 1.3110, test_f1: 0.2281
 epoch: 70, train_loss: 1.2548, test_loss: 1.3023, test_f1: 0.2281
 epoch: 71, train_loss: 1.2524, test_loss: 1.3060, test_f1: 0.2281
 epoch: 72, train_loss: 1.2530, test_loss: 1.3071, test_f1: 0.2281
 epoch: 73, train_loss: 1.2535, test_loss: 1.3035, test_f1: 0.2281
 epoch: 74, train_loss: 1.2552, test_loss: 1.3031, test_f1: 0.2281
 epoch: 75, train_loss: 1.2528, test_loss: 1.3081, test_f1: 0.2281
 epoch: 76, train_loss: 1.2572, test_loss: 1.3109, test_f1: 0.2281
 epoch: 77, train_loss: 1.2549, test_loss: 1.3162, test_f1: 0.2281
 epoch: 78, train_loss: 1.2560, test_loss: 1.3032, test_f1: 0.2281
 epoch: 79, train_loss: 1.2540, test_loss: 1.3014, test_f1: 0.2281
 epoch: 80, train_loss: 1.2537, test_loss: 1.3067, test_f1: 0.2281
 epoch: 81, train_loss: 1.2545, test_loss: 1.3193, test_f1: 0.2281
 epoch: 82, train_loss: 1.2567, test_loss: 1.3070, test_f1: 0.2281
 epoch: 83, train_loss: 1.2532, test_loss: 1.3022, test_f1: 0.2281
 epoch: 84, train_loss: 1.2525, test_loss: 1.3076, test_f1: 0.2281
 epoch: 85, train_loss: 1.2545, test_loss: 1.3094, test_f1: 0.2281
 epoch: 86, train_loss: 1.2563, test_loss: 1.3031, test_f1: 0.2281
 epoch: 87, train_loss: 1.2555, test_loss: 1.3035, test_f1: 0.2281
 epoch: 88, train_loss: 1.2533, test_loss: 1.3051, test_f1: 0.2281
 epoch: 89, train_loss: 1.2534, test_loss: 1.3113, test_f1: 0.2281
 epoch: 90, train_loss: 1.2539, test_loss: 1.3097, test_f1: 0.2281
 epoch: 91, train_loss: 1.2541, test_loss: 1.3126, test_f1: 0.2281
 epoch: 92, train_loss: 1.2540, test_loss: 1.3112, test_f1: 0.2281
 epoch: 93, train_loss: 1.2537, test_loss: 1.3033, test_f1: 0.2281
 epoch: 94, train_loss: 1.2523, test_loss: 1.3062, test_f1: 0.2281
 epoch: 95, train_loss: 1.2535, test_loss: 1.3082, test_f1: 0.2281
 epoch: 96, train_loss: 1.2535, test_loss: 1.3075, test_f1: 0.2281
 epoch: 97, train_loss: 1.2530, test_loss: 1.3011, test_f1: 0.2281
 epoch: 98, train_loss: 1.2564, test_loss: 1.3066, test_f1: 0.2281
 epoch: 99, train_loss: 1.2543, test_loss: 1.3092, test_f1: 0.2281
##################ITERATION #4 ****************************************
 epoch: 0, train_loss: 1.5425, test_loss: 2.2509, test_f1: 0.2331
 epoch: 1, train_loss: 1.3226, test_loss: 1.4998, test_f1: 0.2281
 epoch: 2, train_loss: 1.2707, test_loss: 1.3861, test_f1: 0.2044
 epoch: 3, train_loss: 1.2206, test_loss: 1.2543, test_f1: 0.2281
 epoch: 4, train_loss: 1.1855, test_loss: 1.2673, test_f1: 0.2281
 epoch: 5, train_loss: 1.1664, test_loss: 1.2864, test_f1: 0.3364
 epoch: 6, train_loss: 1.0709, test_loss: 1.4961, test_f1: 0.2950
 epoch: 7, train_loss: 1.0330, test_loss: 1.4762, test_f1: 0.3397
 epoch: 8, train_loss: 1.0957, test_loss: 3.1622, test_f1: 0.2152
 epoch: 9, train_loss: 1.0886, test_loss: 1.2284, test_f1: 0.3176
 epoch: 10, train_loss: 1.0397, test_loss: 1.3847, test_f1: 0.3194
 epoch: 11, train_loss: 1.0011, test_loss: 1.0922, test_f1: 0.4074
 epoch: 12, train_loss: 0.9949, test_loss: 1.0980, test_f1: 0.4228
 epoch: 13, train_loss: 0.9732, test_loss: 2.3575, test_f1: 0.2214
 epoch: 14, train_loss: 0.9414, test_loss: 1.0775, test_f1: 0.4258
 epoch: 15, train_loss: 0.9449, test_loss: 1.0973, test_f1: 0.4210
 epoch: 16, train_loss: 0.9663, test_loss: 1.3087, test_f1: 0.3696
 epoch: 17, train_loss: 0.9607, test_loss: 1.3619, test_f1: 0.3320
 epoch: 18, train_loss: 0.9308, test_loss: 0.9938, test_f1: 0.4517
 epoch: 19, train_loss: 0.9622, test_loss: 1.1725, test_f1: 0.3820
 epoch: 20, train_loss: 0.9405, test_loss: 3.4132, test_f1: 0.2241
 epoch: 21, train_loss: 0.9710, test_loss: 1.0518, test_f1: 0.3322
 epoch: 22, train_loss: 0.9661, test_loss: 1.0332, test_f1: 0.4409
 epoch: 23, train_loss: 0.9324, test_loss: 1.2001, test_f1: 0.4131
 epoch: 24, train_loss: 0.9301, test_loss: 1.1160, test_f1: 0.3557
 epoch: 25, train_loss: 0.9059, test_loss: 1.1283, test_f1: 0.4065
 epoch: 26, train_loss: 0.9137, test_loss: 2.1760, test_f1: 0.3542
 epoch: 27, train_loss: 0.9292, test_loss: 1.1424, test_f1: 0.4278
 epoch: 28, train_loss: 0.9214, test_loss: 1.0951, test_f1: 0.4310
 epoch: 29, train_loss: 0.9081, test_loss: 1.0773, test_f1: 0.4196
 epoch: 30, train_loss: 0.9591, test_loss: 1.1144, test_f1: 0.4047
 epoch: 31, train_loss: 0.9888, test_loss: 1.0132, test_f1: 0.4454
 epoch: 32, train_loss: 0.9661, test_loss: 1.0193, test_f1: 0.4387
 epoch: 33, train_loss: 0.9410, test_loss: 1.1137, test_f1: 0.4089
 epoch: 34, train_loss: 0.9391, test_loss: 1.0704, test_f1: 0.4343
 epoch: 35, train_loss: 0.9420, test_loss: 1.5496, test_f1: 0.3776
 epoch: 36, train_loss: 0.9649, test_loss: 1.3511, test_f1: 0.3775
 epoch: 37, train_loss: 0.9600, test_loss: 1.0881, test_f1: 0.4068
 epoch: 38, train_loss: 0.9392, test_loss: 1.0630, test_f1: 0.3454
 epoch: 39, train_loss: 0.8995, test_loss: 1.2385, test_f1: 0.4088
 epoch: 40, train_loss: 0.9035, test_loss: 1.4782, test_f1: 0.4001
 epoch: 41, train_loss: 0.9102, test_loss: 1.2367, test_f1: 0.3986
 epoch: 42, train_loss: 0.9225, test_loss: 1.1633, test_f1: 0.4331
 epoch: 43, train_loss: 0.8957, test_loss: 1.2902, test_f1: 0.4264
 epoch: 44, train_loss: 0.8792, test_loss: 1.1157, test_f1: 0.4340
 epoch: 45, train_loss: 0.8691, test_loss: 1.9326, test_f1: 0.3908
 epoch: 46, train_loss: 0.8767, test_loss: 1.6326, test_f1: 0.4111
 epoch: 47, train_loss: 0.8705, test_loss: 1.1798, test_f1: 0.4449
 epoch: 48, train_loss: 0.8644, test_loss: 1.2502, test_f1: 0.4322
 epoch: 49, train_loss: 0.8871, test_loss: 1.0353, test_f1: 0.4588
 epoch: 50, train_loss: 0.9351, test_loss: 1.0404, test_f1: 0.4647
 epoch: 51, train_loss: 0.8924, test_loss: 1.0620, test_f1: 0.4422
 epoch: 52, train_loss: 0.8690, test_loss: 1.2253, test_f1: 0.4282
 epoch: 53, train_loss: 0.8685, test_loss: 1.2830, test_f1: 0.4260
 epoch: 54, train_loss: 0.8392, test_loss: 1.3438, test_f1: 0.4322
 epoch: 55, train_loss: 0.8417, test_loss: 1.3215, test_f1: 0.4181
 epoch: 56, train_loss: 0.8385, test_loss: 1.2322, test_f1: 0.4301
 epoch: 57, train_loss: 0.8273, test_loss: 1.2700, test_f1: 0.4338
 epoch: 58, train_loss: 0.8289, test_loss: 1.0714, test_f1: 0.4476
 epoch: 59, train_loss: 0.9093, test_loss: 1.1548, test_f1: 0.3960
 epoch: 60, train_loss: 0.9055, test_loss: 1.5566, test_f1: 0.3710
 epoch: 61, train_loss: 0.8901, test_loss: 2.4643, test_f1: 0.3375
 epoch: 62, train_loss: 0.8737, test_loss: 3.1015, test_f1: 0.3706
 epoch: 63, train_loss: 0.8707, test_loss: 1.6204, test_f1: 0.4348
 epoch: 64, train_loss: 0.8631, test_loss: 1.4285, test_f1: 0.4401
 epoch: 65, train_loss: 0.8632, test_loss: 1.4250, test_f1: 0.4311
 epoch: 66, train_loss: 0.8558, test_loss: 1.6344, test_f1: 0.4349
 epoch: 67, train_loss: 0.8387, test_loss: 2.0814, test_f1: 0.4352
 epoch: 68, train_loss: 0.8296, test_loss: 2.3232, test_f1: 0.4256
 epoch: 69, train_loss: 0.8228, test_loss: 1.6610, test_f1: 0.4344
 epoch: 70, train_loss: 0.8562, test_loss: 1.3859, test_f1: 0.4412
 epoch: 71, train_loss: 0.8502, test_loss: 1.2490, test_f1: 0.4523
 epoch: 72, train_loss: 0.9069, test_loss: 1.0930, test_f1: 0.4388
 epoch: 73, train_loss: 0.9205, test_loss: 1.1198, test_f1: 0.4225
 epoch: 74, train_loss: 0.8902, test_loss: 1.0766, test_f1: 0.4238
 epoch: 75, train_loss: 0.8656, test_loss: 1.1035, test_f1: 0.4251
 epoch: 76, train_loss: 0.8704, test_loss: 1.1297, test_f1: 0.4316
 epoch: 77, train_loss: 0.8717, test_loss: 1.1774, test_f1: 0.4328
 epoch: 78, train_loss: 0.8392, test_loss: 1.3404, test_f1: 0.4214
 epoch: 79, train_loss: 0.8258, test_loss: 1.0354, test_f1: 0.4457
 epoch: 80, train_loss: 0.8198, test_loss: 1.2489, test_f1: 0.4381
 epoch: 81, train_loss: 0.8321, test_loss: 1.3531, test_f1: 0.4434
 epoch: 82, train_loss: 0.8387, test_loss: 1.6098, test_f1: 0.4301
 epoch: 83, train_loss: 0.8217, test_loss: 1.5382, test_f1: 0.4264
 epoch: 84, train_loss: 0.8113, test_loss: 1.6625, test_f1: 0.4355
 epoch: 85, train_loss: 0.8145, test_loss: 1.8957, test_f1: 0.4366
 epoch: 86, train_loss: 0.8238, test_loss: 1.5901, test_f1: 0.4373
 epoch: 87, train_loss: 0.8374, test_loss: 1.6171, test_f1: 0.4445
 epoch: 88, train_loss: 0.8570, test_loss: 1.2559, test_f1: 0.4339
 epoch: 89, train_loss: 0.8479, test_loss: 1.9879, test_f1: 0.3920
 epoch: 90, train_loss: 0.8648, test_loss: 1.4959, test_f1: 0.4086
 epoch: 91, train_loss: 0.8383, test_loss: 1.4642, test_f1: 0.4112
 epoch: 92, train_loss: 0.8923, test_loss: 2.6116, test_f1: 0.3851
 epoch: 93, train_loss: 0.9161, test_loss: 2.3703, test_f1: 0.4100
 epoch: 94, train_loss: 0.9255, test_loss: 2.0093, test_f1: 0.4109
 epoch: 95, train_loss: 0.9058, test_loss: 1.3618, test_f1: 0.4214
 epoch: 96, train_loss: 0.8941, test_loss: 1.2179, test_f1: 0.4341
 epoch: 97, train_loss: 0.8602, test_loss: 1.6455, test_f1: 0.4207
 epoch: 98, train_loss: 0.8729, test_loss: 1.9756, test_f1: 0.3895
 epoch: 99, train_loss: 0.8621, test_loss: 1.8995, test_f1: 0.4152
##################ITERATION #5 ****************************************
 epoch: 0, train_loss: 1.2912, test_loss: 1.3093, test_f1: 0.2281
 epoch: 1, train_loss: 1.2366, test_loss: 2.0374, test_f1: 0.1593
 epoch: 2, train_loss: 1.1335, test_loss: 1.2437, test_f1: 0.2432
 epoch: 3, train_loss: 1.1020, test_loss: 1.3540, test_f1: 0.2902
 epoch: 4, train_loss: 1.0483, test_loss: 1.1305, test_f1: 0.3310
 epoch: 5, train_loss: 1.0247, test_loss: 1.2745, test_f1: 0.3193
 epoch: 6, train_loss: 1.0405, test_loss: 3.6930, test_f1: 0.1935
 epoch: 7, train_loss: 1.0396, test_loss: 1.1433, test_f1: 0.3979
 epoch: 8, train_loss: 1.0074, test_loss: 3.5066, test_f1: 0.2516
 epoch: 9, train_loss: 1.0088, test_loss: 1.1295, test_f1: 0.3819
 epoch: 10, train_loss: 1.0112, test_loss: 1.2835, test_f1: 0.3574
 epoch: 11, train_loss: 0.9822, test_loss: 1.3713, test_f1: 0.3034
 epoch: 12, train_loss: 0.9923, test_loss: 1.5883, test_f1: 0.3396
 epoch: 13, train_loss: 1.0258, test_loss: 2.1864, test_f1: 0.2349
 epoch: 14, train_loss: 0.9906, test_loss: 2.1267, test_f1: 0.2907
 epoch: 15, train_loss: 0.9709, test_loss: 1.1170, test_f1: 0.4111
 epoch: 16, train_loss: 0.9735, test_loss: 1.0992, test_f1: 0.4065
 epoch: 17, train_loss: 0.9453, test_loss: 1.1805, test_f1: 0.4102
 epoch: 18, train_loss: 0.9424, test_loss: 1.0823, test_f1: 0.4128
 epoch: 19, train_loss: 0.9281, test_loss: 1.0689, test_f1: 0.4185
 epoch: 20, train_loss: 0.9433, test_loss: 1.2159, test_f1: 0.3581
 epoch: 21, train_loss: 0.9471, test_loss: 1.1550, test_f1: 0.3620
 epoch: 22, train_loss: 0.9667, test_loss: 1.1286, test_f1: 0.4053
 epoch: 23, train_loss: 0.9838, test_loss: 1.1545, test_f1: 0.3999
 epoch: 24, train_loss: 0.9850, test_loss: 1.1254, test_f1: 0.3146
 epoch: 25, train_loss: 0.9547, test_loss: 1.2107, test_f1: 0.4181
 epoch: 26, train_loss: 0.9378, test_loss: 1.4291, test_f1: 0.4107
 epoch: 27, train_loss: 0.9667, test_loss: 6.5867, test_f1: 0.2288
 epoch: 28, train_loss: 0.9517, test_loss: 1.0705, test_f1: 0.4246
 epoch: 29, train_loss: 0.9547, test_loss: 1.1207, test_f1: 0.4258
 epoch: 30, train_loss: 0.9482, test_loss: 1.1171, test_f1: 0.4345
 epoch: 31, train_loss: 0.9626, test_loss: 1.1172, test_f1: 0.4282
 epoch: 32, train_loss: 0.9531, test_loss: 1.0918, test_f1: 0.4319
 epoch: 33, train_loss: 0.9547, test_loss: 1.0448, test_f1: 0.4327
 epoch: 34, train_loss: 0.9126, test_loss: 1.1410, test_f1: 0.4385
 epoch: 35, train_loss: 0.9035, test_loss: 1.3559, test_f1: 0.4800
 epoch: 36, train_loss: 0.9133, test_loss: 1.1036, test_f1: 0.4517
 epoch: 37, train_loss: 0.9343, test_loss: 1.2211, test_f1: 0.4090
 epoch: 38, train_loss: 0.9444, test_loss: 1.1030, test_f1: 0.4152
 epoch: 39, train_loss: 0.9250, test_loss: 1.0357, test_f1: 0.4526
 epoch: 40, train_loss: 0.8949, test_loss: 1.3698, test_f1: 0.4470
 epoch: 41, train_loss: 0.8878, test_loss: 1.1259, test_f1: 0.4273
 epoch: 42, train_loss: 0.9311, test_loss: 1.5861, test_f1: 0.3706
 epoch: 43, train_loss: 0.9067, test_loss: 2.7787, test_f1: 0.3609
 epoch: 44, train_loss: 0.8932, test_loss: 1.1455, test_f1: 0.3366
 epoch: 45, train_loss: 0.8966, test_loss: 1.7299, test_f1: 0.2965
 epoch: 46, train_loss: 0.9286, test_loss: 1.1058, test_f1: 0.4951
 epoch: 47, train_loss: 1.1289, test_loss: 1.3024, test_f1: 0.3166
 epoch: 48, train_loss: 1.1187, test_loss: 1.2461, test_f1: 0.3171
 epoch: 49, train_loss: 1.1271, test_loss: 1.1877, test_f1: 0.3459
 epoch: 50, train_loss: 1.0847, test_loss: 1.1924, test_f1: 0.3293
 epoch: 51, train_loss: 1.0734, test_loss: 1.1811, test_f1: 0.3493
 epoch: 52, train_loss: 1.0501, test_loss: 1.1125, test_f1: 0.3808
 epoch: 53, train_loss: 1.0179, test_loss: 1.0720, test_f1: 0.4129
 epoch: 54, train_loss: 0.9794, test_loss: 1.3248, test_f1: 0.4016
 epoch: 55, train_loss: 0.9686, test_loss: 1.1289, test_f1: 0.4051
 epoch: 56, train_loss: 0.9524, test_loss: 1.1477, test_f1: 0.3807
 epoch: 57, train_loss: 0.9290, test_loss: 1.2913, test_f1: 0.3949
 epoch: 58, train_loss: 0.9088, test_loss: 0.9904, test_f1: 0.4322
 epoch: 59, train_loss: 0.9072, test_loss: 0.9977, test_f1: 0.4375
 epoch: 60, train_loss: 0.9019, test_loss: 1.0996, test_f1: 0.4663
 epoch: 61, train_loss: 0.8879, test_loss: 1.0464, test_f1: 0.4400
 epoch: 62, train_loss: 0.9087, test_loss: 1.0216, test_f1: 0.4460
 epoch: 63, train_loss: 0.8787, test_loss: 1.0272, test_f1: 0.4461
 epoch: 64, train_loss: 0.8620, test_loss: 1.0663, test_f1: 0.4417
 epoch: 65, train_loss: 0.9054, test_loss: 1.0778, test_f1: 0.4295
 epoch: 66, train_loss: 0.9005, test_loss: 1.1187, test_f1: 0.4383
 epoch: 67, train_loss: 0.8634, test_loss: 1.0401, test_f1: 0.4407
 epoch: 68, train_loss: 0.8638, test_loss: 0.9642, test_f1: 0.4532
 epoch: 69, train_loss: 0.8602, test_loss: 1.0400, test_f1: 0.4486
 epoch: 70, train_loss: 0.8867, test_loss: 1.3570, test_f1: 0.4030
 epoch: 71, train_loss: 0.8721, test_loss: 0.9742, test_f1: 0.4679
 epoch: 72, train_loss: 0.8695, test_loss: 0.9871, test_f1: 0.4672
 epoch: 73, train_loss: 0.8524, test_loss: 1.0473, test_f1: 0.4795
 epoch: 74, train_loss: 0.8443, test_loss: 1.0860, test_f1: 0.4449
 epoch: 75, train_loss: 0.8554, test_loss: 1.4971, test_f1: 0.4589
 epoch: 76, train_loss: 0.8272, test_loss: 1.8869, test_f1: 0.4114
 epoch: 77, train_loss: 0.8649, test_loss: 2.4288, test_f1: 0.4053
 epoch: 78, train_loss: 0.8486, test_loss: 1.1742, test_f1: 0.4680
 epoch: 79, train_loss: 0.8387, test_loss: 1.0517, test_f1: 0.4585
 epoch: 80, train_loss: 0.8249, test_loss: 1.1779, test_f1: 0.4265
 epoch: 81, train_loss: 0.8392, test_loss: 1.3090, test_f1: 0.4740
 epoch: 82, train_loss: 0.8368, test_loss: 0.9505, test_f1: 0.5016
 epoch: 83, train_loss: 0.9658, test_loss: 0.9989, test_f1: 0.4447
 epoch: 84, train_loss: 0.9469, test_loss: 1.0063, test_f1: 0.4393
 epoch: 85, train_loss: 0.9519, test_loss: 1.0703, test_f1: 0.3977
 epoch: 86, train_loss: 0.9649, test_loss: 1.0592, test_f1: 0.4172
 epoch: 87, train_loss: 0.9753, test_loss: 1.0933, test_f1: 0.4093
 epoch: 88, train_loss: 0.9565, test_loss: 1.0803, test_f1: 0.4106
 epoch: 89, train_loss: 0.9363, test_loss: 0.9946, test_f1: 0.4545
 epoch: 90, train_loss: 0.9267, test_loss: 0.9735, test_f1: 0.4743
 epoch: 91, train_loss: 0.9253, test_loss: 0.9890, test_f1: 0.4681
 epoch: 92, train_loss: 0.9141, test_loss: 1.1356, test_f1: 0.4209
 epoch: 93, train_loss: 0.9336, test_loss: 1.1403, test_f1: 0.4483
 epoch: 94, train_loss: 0.9154, test_loss: 1.0700, test_f1: 0.4214
 epoch: 95, train_loss: 0.8957, test_loss: 1.2267, test_f1: 0.4115
 epoch: 96, train_loss: 0.9029, test_loss: 1.4779, test_f1: 0.3984
 epoch: 97, train_loss: 0.8838, test_loss: 1.5585, test_f1: 0.3983
 epoch: 98, train_loss: 0.8968, test_loss: 1.4340, test_f1: 0.3917
 epoch: 99, train_loss: 0.8807, test_loss: 1.1133, test_f1: 0.4284
##################ITERATION #6 ****************************************
 epoch: 0, train_loss: 1.3520, test_loss: 1.3369, test_f1: 0.2281
 epoch: 1, train_loss: 1.2772, test_loss: 1.3058, test_f1: 0.2281
 epoch: 2, train_loss: 1.2506, test_loss: 1.2973, test_f1: 0.1527
 epoch: 3, train_loss: 1.2114, test_loss: 1.2758, test_f1: 0.2877
 epoch: 4, train_loss: 1.1663, test_loss: 1.1795, test_f1: 0.3234
 epoch: 5, train_loss: 1.1158, test_loss: 1.2084, test_f1: 0.2913
 epoch: 6, train_loss: 1.0632, test_loss: 1.2779, test_f1: 0.2390
 epoch: 7, train_loss: 1.1050, test_loss: 1.1651, test_f1: 0.3202
 epoch: 8, train_loss: 1.0973, test_loss: 1.2377, test_f1: 0.3344
 epoch: 9, train_loss: 1.0590, test_loss: 1.2458, test_f1: 0.2441
 epoch: 10, train_loss: 1.0765, test_loss: 1.1451, test_f1: 0.3290
 epoch: 11, train_loss: 1.0426, test_loss: 1.1094, test_f1: 0.3317
 epoch: 12, train_loss: 1.0262, test_loss: 2.1911, test_f1: 0.3018
 epoch: 13, train_loss: 1.0405, test_loss: 2.8327, test_f1: 0.2258
 epoch: 14, train_loss: 1.0175, test_loss: 1.0965, test_f1: 0.4009
 epoch: 15, train_loss: 1.0092, test_loss: 1.3097, test_f1: 0.3519
 epoch: 16, train_loss: 0.9934, test_loss: 14.0504, test_f1: 0.0355
 epoch: 17, train_loss: 0.9990, test_loss: 9.5624, test_f1: 0.0937
 epoch: 18, train_loss: 1.0041, test_loss: 1.1990, test_f1: 0.3315
 epoch: 19, train_loss: 0.9928, test_loss: 1.2947, test_f1: 0.2262
 epoch: 20, train_loss: 0.9883, test_loss: 1.1248, test_f1: 0.3712
 epoch: 21, train_loss: 1.0144, test_loss: 1.0455, test_f1: 0.4147
 epoch: 22, train_loss: 0.9899, test_loss: 1.2238, test_f1: 0.3900
 epoch: 23, train_loss: 1.0269, test_loss: 1.1950, test_f1: 0.3226
 epoch: 24, train_loss: 1.0810, test_loss: 1.1198, test_f1: 0.3454
 epoch: 25, train_loss: 1.0448, test_loss: 1.2903, test_f1: 0.2675
 epoch: 26, train_loss: 1.0324, test_loss: 1.2762, test_f1: 0.2675
 epoch: 27, train_loss: 1.0308, test_loss: 1.3358, test_f1: 0.2631
 epoch: 28, train_loss: 1.0543, test_loss: 7.6412, test_f1: 0.1891
 epoch: 29, train_loss: 1.0416, test_loss: 10.1661, test_f1: 0.1459
 epoch: 30, train_loss: 1.0291, test_loss: 14.9163, test_f1: 0.0301
 epoch: 31, train_loss: 1.0416, test_loss: 1.1336, test_f1: 0.3501
 epoch: 32, train_loss: 1.0026, test_loss: 1.1025, test_f1: 0.3902
 epoch: 33, train_loss: 0.9972, test_loss: 1.3548, test_f1: 0.3717
 epoch: 34, train_loss: 1.0221, test_loss: 1.2864, test_f1: 0.3659
 epoch: 35, train_loss: 0.9767, test_loss: 1.1289, test_f1: 0.4478
 epoch: 36, train_loss: 0.9641, test_loss: 1.1643, test_f1: 0.3968
 epoch: 37, train_loss: 0.9734, test_loss: 1.7321, test_f1: 0.3879
 epoch: 38, train_loss: 0.9546, test_loss: 1.1274, test_f1: 0.4165
 epoch: 39, train_loss: 1.0150, test_loss: 1.1942, test_f1: 0.3673
 epoch: 40, train_loss: 1.0187, test_loss: 1.1967, test_f1: 0.3730
 epoch: 41, train_loss: 1.0251, test_loss: 1.1495, test_f1: 0.3805
 epoch: 42, train_loss: 0.9918, test_loss: 1.5365, test_f1: 0.3451
 epoch: 43, train_loss: 1.0630, test_loss: 1.1117, test_f1: 0.3974
 epoch: 44, train_loss: 1.0180, test_loss: 1.1256, test_f1: 0.3428
 epoch: 45, train_loss: 1.0259, test_loss: 1.0962, test_f1: 0.3412
 epoch: 46, train_loss: 1.0795, test_loss: 1.4512, test_f1: 0.2965
 epoch: 47, train_loss: 1.0238, test_loss: 1.1833, test_f1: 0.3245
 epoch: 48, train_loss: 1.0277, test_loss: 1.5583, test_f1: 0.2905
 epoch: 49, train_loss: 1.0359, test_loss: 1.1204, test_f1: 0.3395
 epoch: 50, train_loss: 0.9952, test_loss: 1.2565, test_f1: 0.3005
 epoch: 51, train_loss: 0.9867, test_loss: 1.1346, test_f1: 0.3352
 epoch: 52, train_loss: 0.9797, test_loss: 1.1915, test_f1: 0.3343
 epoch: 53, train_loss: 0.9666, test_loss: 1.2942, test_f1: 0.4184
 epoch: 54, train_loss: 0.9704, test_loss: 1.2154, test_f1: 0.3963
 epoch: 55, train_loss: 0.9723, test_loss: 1.2016, test_f1: 0.4304
 epoch: 56, train_loss: 0.9745, test_loss: 1.0689, test_f1: 0.4706
 epoch: 57, train_loss: 0.9581, test_loss: 1.0692, test_f1: 0.4601
 epoch: 58, train_loss: 0.9461, test_loss: 1.3243, test_f1: 0.3687
 epoch: 59, train_loss: 0.9329, test_loss: 1.1919, test_f1: 0.4225
 epoch: 60, train_loss: 0.9350, test_loss: 1.4222, test_f1: 0.3864
 epoch: 61, train_loss: 0.9211, test_loss: 1.7144, test_f1: 0.3991
 epoch: 62, train_loss: 0.9070, test_loss: 1.8337, test_f1: 0.3931
 epoch: 63, train_loss: 0.9142, test_loss: 1.3846, test_f1: 0.4182
 epoch: 64, train_loss: 0.9176, test_loss: 1.0881, test_f1: 0.4396
 epoch: 65, train_loss: 0.8885, test_loss: 1.1577, test_f1: 0.4274
 epoch: 66, train_loss: 0.9112, test_loss: 1.4415, test_f1: 0.3847
 epoch: 67, train_loss: 0.8834, test_loss: 1.3511, test_f1: 0.4291
 epoch: 68, train_loss: 0.9184, test_loss: 1.3002, test_f1: 0.3633
 epoch: 69, train_loss: 0.9450, test_loss: 1.0628, test_f1: 0.4441
 epoch: 70, train_loss: 0.9060, test_loss: 1.5224, test_f1: 0.3547
 epoch: 71, train_loss: 0.9192, test_loss: 1.2425, test_f1: 0.4150
 epoch: 72, train_loss: 0.9158, test_loss: 1.4323, test_f1: 0.3977
 epoch: 73, train_loss: 0.8971, test_loss: 1.4070, test_f1: 0.4033
 epoch: 74, train_loss: 0.8998, test_loss: 1.1083, test_f1: 0.4413
 epoch: 75, train_loss: 0.9274, test_loss: 0.9852, test_f1: 0.4720
 epoch: 76, train_loss: 0.8964, test_loss: 1.1749, test_f1: 0.4120
 epoch: 77, train_loss: 0.8946, test_loss: 1.0175, test_f1: 0.4567
 epoch: 78, train_loss: 0.8789, test_loss: 1.2735, test_f1: 0.4224
 epoch: 79, train_loss: 0.8802, test_loss: 1.1015, test_f1: 0.4477
 epoch: 80, train_loss: 0.8998, test_loss: 1.2637, test_f1: 0.4323
 epoch: 81, train_loss: 0.8789, test_loss: 1.0451, test_f1: 0.4522
 epoch: 82, train_loss: 0.9158, test_loss: 0.9915, test_f1: 0.4656
 epoch: 83, train_loss: 0.8953, test_loss: 1.1750, test_f1: 0.4206
 epoch: 84, train_loss: 0.8857, test_loss: 1.0482, test_f1: 0.4500
 epoch: 85, train_loss: 0.8884, test_loss: 0.9988, test_f1: 0.4682
 epoch: 86, train_loss: 0.8843, test_loss: 1.4573, test_f1: 0.4166
 epoch: 87, train_loss: 0.8768, test_loss: 2.1797, test_f1: 0.4121
 epoch: 88, train_loss: 0.8911, test_loss: 1.3759, test_f1: 0.4384
 epoch: 89, train_loss: 0.8735, test_loss: 1.4014, test_f1: 0.4285
 epoch: 90, train_loss: 0.8625, test_loss: 1.0437, test_f1: 0.4550
 epoch: 91, train_loss: 0.8530, test_loss: 1.1831, test_f1: 0.4474
 epoch: 92, train_loss: 0.8547, test_loss: 1.1829, test_f1: 0.4450
 epoch: 93, train_loss: 0.8491, test_loss: 1.1705, test_f1: 0.4151
 epoch: 94, train_loss: 0.8466, test_loss: 1.0767, test_f1: 0.4461
 epoch: 95, train_loss: 0.8368, test_loss: 1.0081, test_f1: 0.4635
 epoch: 96, train_loss: 0.8481, test_loss: 1.1527, test_f1: 0.3946
 epoch: 97, train_loss: 0.9620, test_loss: 1.2565, test_f1: 0.2974
 epoch: 98, train_loss: 0.9736, test_loss: 1.1425, test_f1: 0.4046
 epoch: 99, train_loss: 0.8895, test_loss: 1.0106, test_f1: 0.4490
##################ITERATION #7 ****************************************
 epoch: 0, train_loss: 1.3452, test_loss: 1.3254, test_f1: 0.2449
 epoch: 1, train_loss: 1.2574, test_loss: 1.3102, test_f1: 0.2281
 epoch: 2, train_loss: 1.2553, test_loss: 1.2975, test_f1: 0.2281
 epoch: 3, train_loss: 1.2376, test_loss: 1.3125, test_f1: 0.2281
 epoch: 4, train_loss: 1.1627, test_loss: 2.2248, test_f1: 0.0885
 epoch: 5, train_loss: 1.1406, test_loss: 2.3480, test_f1: 0.1616
 epoch: 6, train_loss: 1.1271, test_loss: 1.5886, test_f1: 0.2628
 epoch: 7, train_loss: 1.0546, test_loss: 1.8577, test_f1: 0.2042
 epoch: 8, train_loss: 1.0563, test_loss: 1.2228, test_f1: 0.3342
 epoch: 9, train_loss: 1.0381, test_loss: 4.0196, test_f1: 0.0639
 epoch: 10, train_loss: 0.9881, test_loss: 1.3282, test_f1: 0.3844
 epoch: 11, train_loss: 1.0071, test_loss: 2.2456, test_f1: 0.1748
 epoch: 12, train_loss: 1.0686, test_loss: 1.9927, test_f1: 0.1431
 epoch: 13, train_loss: 1.0366, test_loss: 1.9765, test_f1: 0.1591
 epoch: 14, train_loss: 1.0135, test_loss: 1.2119, test_f1: 0.3868
 epoch: 15, train_loss: 0.9833, test_loss: 1.1633, test_f1: 0.3890
 epoch: 16, train_loss: 0.9657, test_loss: 1.1706, test_f1: 0.4092
 epoch: 17, train_loss: 0.9701, test_loss: 1.0401, test_f1: 0.4285
 epoch: 18, train_loss: 0.9563, test_loss: 1.1002, test_f1: 0.3845
 epoch: 19, train_loss: 0.9499, test_loss: 1.0389, test_f1: 0.4311
 epoch: 20, train_loss: 0.9634, test_loss: 1.0562, test_f1: 0.4159
 epoch: 21, train_loss: 0.9718, test_loss: 1.0156, test_f1: 0.4327
 epoch: 22, train_loss: 0.9486, test_loss: 1.1898, test_f1: 0.3893
 epoch: 23, train_loss: 0.9260, test_loss: 1.5717, test_f1: 0.2003
 epoch: 24, train_loss: 0.9256, test_loss: 1.1079, test_f1: 0.3915
 epoch: 25, train_loss: 0.9381, test_loss: 1.2424, test_f1: 0.3884
 epoch: 26, train_loss: 0.9430, test_loss: 1.2231, test_f1: 0.4219
 epoch: 27, train_loss: 0.9428, test_loss: 1.0624, test_f1: 0.4335
 epoch: 28, train_loss: 0.9265, test_loss: 1.1194, test_f1: 0.4264
 epoch: 29, train_loss: 0.9120, test_loss: 1.1504, test_f1: 0.4004
 epoch: 30, train_loss: 0.9169, test_loss: 1.0210, test_f1: 0.4428
 epoch: 31, train_loss: 0.9280, test_loss: 1.0731, test_f1: 0.4288
 epoch: 32, train_loss: 0.9230, test_loss: 1.1139, test_f1: 0.4350
 epoch: 33, train_loss: 0.9564, test_loss: 1.1566, test_f1: 0.4133
 epoch: 34, train_loss: 0.9292, test_loss: 1.2160, test_f1: 0.4076
 epoch: 35, train_loss: 0.9146, test_loss: 1.2840, test_f1: 0.4160
 epoch: 36, train_loss: 0.9063, test_loss: 1.2801, test_f1: 0.4113
 epoch: 37, train_loss: 0.9044, test_loss: 1.4820, test_f1: 0.4053
 epoch: 38, train_loss: 0.9091, test_loss: 1.2484, test_f1: 0.3960
 epoch: 39, train_loss: 0.9030, test_loss: 1.0435, test_f1: 0.4636
 epoch: 40, train_loss: 0.9339, test_loss: 1.1340, test_f1: 0.3661
 epoch: 41, train_loss: 0.9251, test_loss: 1.2181, test_f1: 0.4035
 epoch: 42, train_loss: 0.9198, test_loss: 1.2880, test_f1: 0.4043
 epoch: 43, train_loss: 0.9005, test_loss: 3.1635, test_f1: 0.2525
 epoch: 44, train_loss: 0.9258, test_loss: 1.1471, test_f1: 0.4349
 epoch: 45, train_loss: 0.9855, test_loss: 1.4252, test_f1: 0.4292
 epoch: 46, train_loss: 0.9557, test_loss: 1.2677, test_f1: 0.3607
 epoch: 47, train_loss: 0.9688, test_loss: 1.4338, test_f1: 0.3487
 epoch: 48, train_loss: 1.0242, test_loss: 1.7084, test_f1: 0.3312
 epoch: 49, train_loss: 1.0992, test_loss: 1.2657, test_f1: 0.2806
 epoch: 50, train_loss: 1.0510, test_loss: 1.4417, test_f1: 0.3808
 epoch: 51, train_loss: 1.0228, test_loss: 1.2407, test_f1: 0.4621
 epoch: 52, train_loss: 0.9894, test_loss: 1.0520, test_f1: 0.4774
 epoch: 53, train_loss: 0.9688, test_loss: 1.0477, test_f1: 0.4321
 epoch: 54, train_loss: 0.9732, test_loss: 1.0342, test_f1: 0.4329
 epoch: 55, train_loss: 0.9576, test_loss: 1.0062, test_f1: 0.4410
 epoch: 56, train_loss: 0.9628, test_loss: 1.0084, test_f1: 0.4366
 epoch: 57, train_loss: 0.9509, test_loss: 1.0190, test_f1: 0.4418
 epoch: 58, train_loss: 0.9849, test_loss: 1.0234, test_f1: 0.4302
 epoch: 59, train_loss: 0.9680, test_loss: 1.0447, test_f1: 0.4220
 epoch: 60, train_loss: 0.9609, test_loss: 1.0556, test_f1: 0.4302
 epoch: 61, train_loss: 0.9441, test_loss: 1.2935, test_f1: 0.4018
 epoch: 62, train_loss: 0.9280, test_loss: 1.2833, test_f1: 0.3821
 epoch: 63, train_loss: 0.9445, test_loss: 1.0676, test_f1: 0.4334
 epoch: 64, train_loss: 0.9497, test_loss: 1.1047, test_f1: 0.4126
 epoch: 65, train_loss: 0.9245, test_loss: 1.2702, test_f1: 0.4294
 epoch: 66, train_loss: 0.9263, test_loss: 1.2246, test_f1: 0.4036
 epoch: 67, train_loss: 0.9363, test_loss: 1.1965, test_f1: 0.4449
 epoch: 68, train_loss: 0.9034, test_loss: 1.3050, test_f1: 0.4197
 epoch: 69, train_loss: 0.8903, test_loss: 1.4376, test_f1: 0.3866
 epoch: 70, train_loss: 0.9040, test_loss: 1.4229, test_f1: 0.4155
 epoch: 71, train_loss: 0.9134, test_loss: 1.3764, test_f1: 0.4152
 epoch: 72, train_loss: 0.9316, test_loss: 1.3312, test_f1: 0.4273
 epoch: 73, train_loss: 1.0955, test_loss: 1.5957, test_f1: 0.3652
 epoch: 74, train_loss: 1.1086, test_loss: 2.0533, test_f1: 0.3909
 epoch: 75, train_loss: 1.0657, test_loss: 1.4223, test_f1: 0.4097
 epoch: 76, train_loss: 1.0260, test_loss: 1.0911, test_f1: 0.4143
 epoch: 77, train_loss: 1.0120, test_loss: 1.1658, test_f1: 0.3943
 epoch: 78, train_loss: 1.0119, test_loss: 1.2139, test_f1: 0.3964
 epoch: 79, train_loss: 1.0126, test_loss: 1.1345, test_f1: 0.4042
 epoch: 80, train_loss: 0.9912, test_loss: 1.2173, test_f1: 0.4382
 epoch: 81, train_loss: 1.0000, test_loss: 1.1027, test_f1: 0.4820
 epoch: 82, train_loss: 0.9884, test_loss: 1.0913, test_f1: 0.4115
 epoch: 83, train_loss: 1.0099, test_loss: 1.0713, test_f1: 0.4127
 epoch: 84, train_loss: 0.9940, test_loss: 1.1316, test_f1: 0.4074
 epoch: 85, train_loss: 0.9586, test_loss: 1.1372, test_f1: 0.4028
 epoch: 86, train_loss: 0.9704, test_loss: 1.0739, test_f1: 0.4526
 epoch: 87, train_loss: 0.9708, test_loss: 1.0324, test_f1: 0.4298
 epoch: 88, train_loss: 0.9862, test_loss: 1.0464, test_f1: 0.4240
 epoch: 89, train_loss: 0.9571, test_loss: 1.1021, test_f1: 0.4076
 epoch: 90, train_loss: 0.9644, test_loss: 1.2261, test_f1: 0.3867
 epoch: 91, train_loss: 0.9610, test_loss: 1.1732, test_f1: 0.4065
 epoch: 92, train_loss: 0.9533, test_loss: 1.2975, test_f1: 0.4559
 epoch: 93, train_loss: 0.9215, test_loss: 1.2776, test_f1: 0.4061
 epoch: 94, train_loss: 0.9537, test_loss: 1.0662, test_f1: 0.4134
 epoch: 95, train_loss: 0.9099, test_loss: 1.0622, test_f1: 0.4326
 epoch: 96, train_loss: 0.9315, test_loss: 1.1044, test_f1: 0.4356
 epoch: 97, train_loss: 0.9266, test_loss: 1.1884, test_f1: 0.4152
 epoch: 98, train_loss: 0.9443, test_loss: 1.0624, test_f1: 0.4176
 epoch: 99, train_loss: 0.9465, test_loss: 1.0015, test_f1: 0.4440
##################ITERATION #8 ****************************************
 epoch: 0, train_loss: 1.3608, test_loss: 1.3873, test_f1: 0.1365
 epoch: 1, train_loss: 1.2566, test_loss: 1.3275, test_f1: 0.2281
 epoch: 2, train_loss: 1.2840, test_loss: 1.3021, test_f1: 0.2281
 epoch: 3, train_loss: 1.2237, test_loss: 1.3094, test_f1: 0.2572
 epoch: 4, train_loss: 1.1997, test_loss: 1.2045, test_f1: 0.3262
 epoch: 5, train_loss: 1.1940, test_loss: 1.1992, test_f1: 0.3146
 epoch: 6, train_loss: 1.1607, test_loss: 1.1704, test_f1: 0.3370
 epoch: 7, train_loss: 1.1666, test_loss: 1.1633, test_f1: 0.3806
 epoch: 8, train_loss: 1.1577, test_loss: 1.3954, test_f1: 0.3020
 epoch: 9, train_loss: 1.1711, test_loss: 1.1585, test_f1: 0.3262
 epoch: 10, train_loss: 1.1630, test_loss: 1.1359, test_f1: 0.3653
 epoch: 11, train_loss: 1.1747, test_loss: 1.1436, test_f1: 0.3444
 epoch: 12, train_loss: 1.1553, test_loss: 1.3408, test_f1: 0.2929
 epoch: 13, train_loss: 1.1409, test_loss: 1.1534, test_f1: 0.3395
 epoch: 14, train_loss: 1.1741, test_loss: 2.4868, test_f1: 0.2096
 epoch: 15, train_loss: 1.1824, test_loss: 1.2649, test_f1: 0.2631
 epoch: 16, train_loss: 1.1723, test_loss: 1.2155, test_f1: 0.3390
 epoch: 17, train_loss: 1.1584, test_loss: 1.1384, test_f1: 0.3317
 epoch: 18, train_loss: 1.1673, test_loss: 1.1293, test_f1: 0.3395
 epoch: 19, train_loss: 1.1712, test_loss: 1.1222, test_f1: 0.3370
 epoch: 20, train_loss: 1.1783, test_loss: 1.1496, test_f1: 0.3395
 epoch: 21, train_loss: 1.1637, test_loss: 1.1160, test_f1: 0.3395
 epoch: 22, train_loss: 1.1682, test_loss: 1.1984, test_f1: 0.3176
 epoch: 23, train_loss: 1.1726, test_loss: 1.1538, test_f1: 0.3344
 epoch: 24, train_loss: 1.1604, test_loss: 1.1247, test_f1: 0.3370
 epoch: 25, train_loss: 1.1461, test_loss: 1.1405, test_f1: 0.3344
 epoch: 26, train_loss: 1.1907, test_loss: 1.1512, test_f1: 0.2384
 epoch: 27, train_loss: 1.1708, test_loss: 1.1357, test_f1: 0.3370
 epoch: 28, train_loss: 1.1532, test_loss: 1.1178, test_f1: 0.3395
 epoch: 29, train_loss: 1.1581, test_loss: 1.1479, test_f1: 0.3344
 epoch: 30, train_loss: 1.1793, test_loss: 1.1614, test_f1: 0.3344
 epoch: 31, train_loss: 1.1620, test_loss: 1.1309, test_f1: 0.3344
 epoch: 32, train_loss: 1.1651, test_loss: 1.1698, test_f1: 0.3262
 epoch: 33, train_loss: 1.1633, test_loss: 1.1834, test_f1: 0.3331
 epoch: 34, train_loss: 1.1690, test_loss: 1.2047, test_f1: 0.2949
 epoch: 35, train_loss: 1.1754, test_loss: 1.9159, test_f1: 0.2847
 epoch: 36, train_loss: 1.1641, test_loss: 1.6734, test_f1: 0.2959
 epoch: 37, train_loss: 1.1823, test_loss: 1.3604, test_f1: 0.2281
 epoch: 38, train_loss: 1.1721, test_loss: 1.2283, test_f1: 0.2876
 epoch: 39, train_loss: 1.1797, test_loss: 1.1845, test_f1: 0.3205
 epoch: 40, train_loss: 1.1800, test_loss: 1.1298, test_f1: 0.3445
 epoch: 41, train_loss: 1.1731, test_loss: 1.1260, test_f1: 0.3370
 epoch: 42, train_loss: 1.1734, test_loss: 1.1188, test_f1: 0.3444
 epoch: 43, train_loss: 1.1557, test_loss: 1.1424, test_f1: 0.2384
 epoch: 44, train_loss: 1.1719, test_loss: 1.1117, test_f1: 0.3395
 epoch: 45, train_loss: 1.1678, test_loss: 1.1281, test_f1: 0.3370
 epoch: 46, train_loss: 1.1606, test_loss: 1.1267, test_f1: 0.3344
 epoch: 47, train_loss: 1.1706, test_loss: 1.1231, test_f1: 0.3370
 epoch: 48, train_loss: 1.1309, test_loss: 1.1030, test_f1: 0.3395
 epoch: 49, train_loss: 1.1189, test_loss: 1.1298, test_f1: 0.3375
 epoch: 50, train_loss: 1.0942, test_loss: 1.1269, test_f1: 0.3317
 epoch: 51, train_loss: 1.1112, test_loss: 1.1143, test_f1: 0.3420
 epoch: 52, train_loss: 1.0993, test_loss: 1.1388, test_f1: 0.3370
 epoch: 53, train_loss: 1.1067, test_loss: 1.0991, test_f1: 0.3492
 epoch: 54, train_loss: 1.1102, test_loss: 1.1138, test_f1: 0.3395
 epoch: 55, train_loss: 1.1001, test_loss: 1.1235, test_f1: 0.3395
 epoch: 56, train_loss: 1.0846, test_loss: 1.1359, test_f1: 0.3370
 epoch: 57, train_loss: 1.0874, test_loss: 1.0902, test_f1: 0.3515
 epoch: 58, train_loss: 1.0936, test_loss: 1.0830, test_f1: 0.3515
 epoch: 59, train_loss: 1.0877, test_loss: 1.1119, test_f1: 0.3395
 epoch: 60, train_loss: 1.0870, test_loss: 1.1312, test_f1: 0.3344
 epoch: 61, train_loss: 1.0882, test_loss: 1.1812, test_f1: 0.3115
 epoch: 62, train_loss: 1.1000, test_loss: 1.1343, test_f1: 0.3290
 epoch: 63, train_loss: 1.0865, test_loss: 1.1045, test_f1: 0.3420
 epoch: 64, train_loss: 1.1045, test_loss: 1.1251, test_f1: 0.3375
 epoch: 65, train_loss: 1.1100, test_loss: 1.1981, test_f1: 0.3121
 epoch: 66, train_loss: 1.0779, test_loss: 1.1140, test_f1: 0.3420
 epoch: 67, train_loss: 1.0948, test_loss: 1.3647, test_f1: 0.2281
 epoch: 68, train_loss: 1.1201, test_loss: 1.3553, test_f1: 0.2281
 epoch: 69, train_loss: 1.0909, test_loss: 1.1753, test_f1: 0.3176
 epoch: 70, train_loss: 1.0938, test_loss: 1.1938, test_f1: 0.3051
 epoch: 71, train_loss: 1.1061, test_loss: 1.2038, test_f1: 0.2984
 epoch: 72, train_loss: 1.0831, test_loss: 1.1463, test_f1: 0.3317
 epoch: 73, train_loss: 1.0661, test_loss: 1.1353, test_f1: 0.3344
 epoch: 74, train_loss: 1.0614, test_loss: 1.1210, test_f1: 0.3443
 epoch: 75, train_loss: 1.0609, test_loss: 1.1906, test_f1: 0.3212
 epoch: 76, train_loss: 1.0871, test_loss: 1.0928, test_f1: 0.3420
 epoch: 77, train_loss: 1.1185, test_loss: 1.1202, test_f1: 0.3395
 epoch: 78, train_loss: 1.0633, test_loss: 1.1185, test_f1: 0.3420
 epoch: 79, train_loss: 1.0626, test_loss: 1.1365, test_f1: 0.3399
 epoch: 80, train_loss: 1.0528, test_loss: 1.1230, test_f1: 0.3420
 epoch: 81, train_loss: 1.0488, test_loss: 1.0978, test_f1: 0.3420
 epoch: 82, train_loss: 1.0789, test_loss: 1.1314, test_f1: 0.3543
 epoch: 83, train_loss: 1.0654, test_loss: 1.1268, test_f1: 0.3344
 epoch: 84, train_loss: 1.0483, test_loss: 1.1330, test_f1: 0.3344
 epoch: 85, train_loss: 1.0580, test_loss: 1.1426, test_f1: 0.3344
 epoch: 86, train_loss: 1.0430, test_loss: 1.1526, test_f1: 0.3322
 epoch: 87, train_loss: 1.0435, test_loss: 1.1336, test_f1: 0.3317
 epoch: 88, train_loss: 1.0344, test_loss: 1.1332, test_f1: 0.3344
 epoch: 89, train_loss: 1.0247, test_loss: 1.1152, test_f1: 0.3545
 epoch: 90, train_loss: 1.0271, test_loss: 1.1034, test_f1: 0.3420
 epoch: 91, train_loss: 1.0244, test_loss: 1.1059, test_f1: 0.3492
 epoch: 92, train_loss: 1.0223, test_loss: 1.1198, test_f1: 0.3344
 epoch: 93, train_loss: 1.0238, test_loss: 1.1306, test_f1: 0.3400
 epoch: 94, train_loss: 1.0180, test_loss: 1.1573, test_f1: 0.3344
 epoch: 95, train_loss: 1.0318, test_loss: 1.1388, test_f1: 0.3344
 epoch: 96, train_loss: 1.0355, test_loss: 1.1579, test_f1: 0.3234
 epoch: 97, train_loss: 1.0483, test_loss: 1.1345, test_f1: 0.3338
 epoch: 98, train_loss: 1.0283, test_loss: 1.1244, test_f1: 0.3370
 epoch: 99, train_loss: 1.0272, test_loss: 1.1245, test_f1: 0.3420
##################ITERATION #9 ****************************************
 epoch: 0, train_loss: 1.6072, test_loss: 1.4871, test_f1: 0.2281
 epoch: 1, train_loss: 1.3641, test_loss: 1.4642, test_f1: 0.3405
 epoch: 2, train_loss: 1.2409, test_loss: 1.2360, test_f1: 0.2949
 epoch: 3, train_loss: 1.1848, test_loss: 1.5808, test_f1: 0.3093
 epoch: 4, train_loss: 1.1635, test_loss: 1.4743, test_f1: 0.2519
 epoch: 5, train_loss: 1.0757, test_loss: 2.2474, test_f1: 0.2648
 epoch: 6, train_loss: 1.0624, test_loss: 1.3298, test_f1: 0.2944
 epoch: 7, train_loss: 1.0509, test_loss: 1.1801, test_f1: 0.3532
 epoch: 8, train_loss: 1.0591, test_loss: 1.1645, test_f1: 0.3847
 epoch: 9, train_loss: 1.0280, test_loss: 1.2388, test_f1: 0.3667
 epoch: 10, train_loss: 1.0102, test_loss: 1.4954, test_f1: 0.2727
 epoch: 11, train_loss: 1.0047, test_loss: 1.9062, test_f1: 0.3078
 epoch: 12, train_loss: 0.9768, test_loss: 1.5075, test_f1: 0.3231
 epoch: 13, train_loss: 0.9940, test_loss: 1.3439, test_f1: 0.3191
 epoch: 14, train_loss: 1.0231, test_loss: 1.4193, test_f1: 0.2389
 epoch: 15, train_loss: 1.0318, test_loss: 1.2566, test_f1: 0.4123
 epoch: 16, train_loss: 1.0121, test_loss: 1.0481, test_f1: 0.4201
 epoch: 17, train_loss: 0.9895, test_loss: 1.1017, test_f1: 0.4342
 epoch: 18, train_loss: 0.9729, test_loss: 1.1832, test_f1: 0.4279
 epoch: 19, train_loss: 0.9667, test_loss: 1.0683, test_f1: 0.4303
 epoch: 20, train_loss: 0.9439, test_loss: 2.1126, test_f1: 0.3294
 epoch: 21, train_loss: 0.9230, test_loss: 2.0411, test_f1: 0.3448
 epoch: 22, train_loss: 0.9176, test_loss: 1.6484, test_f1: 0.3514
 epoch: 23, train_loss: 0.9061, test_loss: 1.4849, test_f1: 0.3755
 epoch: 24, train_loss: 0.9490, test_loss: 1.0919, test_f1: 0.4344
 epoch: 25, train_loss: 0.9349, test_loss: 1.5194, test_f1: 0.4066
 epoch: 26, train_loss: 0.9204, test_loss: 1.2041, test_f1: 0.4240
 epoch: 27, train_loss: 0.9171, test_loss: 1.1640, test_f1: 0.4438
 epoch: 28, train_loss: 0.9230, test_loss: 1.3314, test_f1: 0.4099
 epoch: 29, train_loss: 0.9433, test_loss: 1.9269, test_f1: 0.1682
 epoch: 30, train_loss: 0.9558, test_loss: 1.2187, test_f1: 0.3772
 epoch: 31, train_loss: 0.9785, test_loss: 6.6500, test_f1: 0.2984
 epoch: 32, train_loss: 0.9258, test_loss: 1.0503, test_f1: 0.4380
 epoch: 33, train_loss: 0.9972, test_loss: 1.0144, test_f1: 0.4349
 epoch: 34, train_loss: 0.9406, test_loss: 4.8816, test_f1: 0.3303
 epoch: 35, train_loss: 0.9268, test_loss: 1.1151, test_f1: 0.4148
 epoch: 36, train_loss: 0.9025, test_loss: 1.1137, test_f1: 0.4328
 epoch: 37, train_loss: 0.9149, test_loss: 1.0732, test_f1: 0.4315
 epoch: 38, train_loss: 0.9077, test_loss: 1.2499, test_f1: 0.4155
 epoch: 39, train_loss: 0.8934, test_loss: 1.3585, test_f1: 0.4049
 epoch: 40, train_loss: 0.8814, test_loss: 1.3390, test_f1: 0.3972
 epoch: 41, train_loss: 0.8987, test_loss: 1.1731, test_f1: 0.4172
 epoch: 42, train_loss: 0.8517, test_loss: 1.6757, test_f1: 0.4151
 epoch: 43, train_loss: 0.8649, test_loss: 4.0065, test_f1: 0.3281
 epoch: 44, train_loss: 0.9248, test_loss: 1.1327, test_f1: 0.4445
 epoch: 45, train_loss: 0.8650, test_loss: 1.1855, test_f1: 0.4261
 epoch: 46, train_loss: 0.8621, test_loss: 1.1206, test_f1: 0.4357
 epoch: 47, train_loss: 0.8556, test_loss: 2.0803, test_f1: 0.3812
 epoch: 48, train_loss: 0.8519, test_loss: 1.6487, test_f1: 0.3894
 epoch: 49, train_loss: 0.8393, test_loss: 2.5411, test_f1: 0.3800
 epoch: 50, train_loss: 0.8547, test_loss: 4.3847, test_f1: 0.3156
 epoch: 51, train_loss: 0.8627, test_loss: 2.5491, test_f1: 0.4087
 epoch: 52, train_loss: 0.8213, test_loss: 1.5212, test_f1: 0.4577
 epoch: 53, train_loss: 0.8124, test_loss: 1.8179, test_f1: 0.3951
 epoch: 54, train_loss: 0.8346, test_loss: 1.3707, test_f1: 0.4733
 epoch: 55, train_loss: 0.8672, test_loss: 1.1077, test_f1: 0.3683
 epoch: 56, train_loss: 0.8913, test_loss: 1.1523, test_f1: 0.4667
 epoch: 57, train_loss: 0.8630, test_loss: 1.2190, test_f1: 0.4484
 epoch: 58, train_loss: 0.8154, test_loss: 1.7816, test_f1: 0.4269
 epoch: 59, train_loss: 0.8202, test_loss: 1.7146, test_f1: 0.4124
 epoch: 60, train_loss: 0.8352, test_loss: 2.2879, test_f1: 0.3772
 epoch: 61, train_loss: 0.8681, test_loss: 3.4338, test_f1: 0.3428
 epoch: 62, train_loss: 0.8737, test_loss: 1.6893, test_f1: 0.4033
 epoch: 63, train_loss: 0.8607, test_loss: 1.3243, test_f1: 0.4410
 epoch: 64, train_loss: 0.8412, test_loss: 1.2614, test_f1: 0.4555
 epoch: 65, train_loss: 0.8307, test_loss: 1.2612, test_f1: 0.4602
 epoch: 66, train_loss: 0.8226, test_loss: 1.3662, test_f1: 0.4621
 epoch: 67, train_loss: 0.8423, test_loss: 1.3575, test_f1: 0.4020
 epoch: 68, train_loss: 0.8453, test_loss: 1.5206, test_f1: 0.4324
 epoch: 69, train_loss: 0.9840, test_loss: 1.3729, test_f1: 0.4009
 epoch: 70, train_loss: 0.9734, test_loss: 1.3007, test_f1: 0.4427
 epoch: 71, train_loss: 0.9135, test_loss: 1.5180, test_f1: 0.4322
 epoch: 72, train_loss: 0.8934, test_loss: 1.8447, test_f1: 0.3994
 epoch: 73, train_loss: 0.8889, test_loss: 1.7965, test_f1: 0.4163
 epoch: 74, train_loss: 0.8755, test_loss: 1.5340, test_f1: 0.4303
 epoch: 75, train_loss: 0.8540, test_loss: 1.1987, test_f1: 0.4354
 epoch: 76, train_loss: 0.8551, test_loss: 1.2942, test_f1: 0.4404
 epoch: 77, train_loss: 0.8203, test_loss: 1.4648, test_f1: 0.4460
 epoch: 78, train_loss: 0.8469, test_loss: 1.6725, test_f1: 0.4311
 epoch: 79, train_loss: 0.8298, test_loss: 1.9216, test_f1: 0.4278
 epoch: 80, train_loss: 0.8374, test_loss: 1.5525, test_f1: 0.4390
 epoch: 81, train_loss: 0.8197, test_loss: 1.5640, test_f1: 0.4407
 epoch: 82, train_loss: 0.8344, test_loss: 1.8827, test_f1: 0.4389
 epoch: 83, train_loss: 0.8240, test_loss: 1.6632, test_f1: 0.4370
 epoch: 84, train_loss: 0.8079, test_loss: 1.2783, test_f1: 0.4382
 epoch: 85, train_loss: 0.7977, test_loss: 1.2247, test_f1: 0.4364
 epoch: 86, train_loss: 0.7993, test_loss: 1.2244, test_f1: 0.4439
 epoch: 87, train_loss: 0.8174, test_loss: 1.5028, test_f1: 0.4417
 epoch: 88, train_loss: 0.7954, test_loss: 1.8726, test_f1: 0.4413
 epoch: 89, train_loss: 0.8043, test_loss: 1.5968, test_f1: 0.4436
 epoch: 90, train_loss: 0.8265, test_loss: 1.2288, test_f1: 0.4242
 epoch: 91, train_loss: 0.8512, test_loss: 1.2973, test_f1: 0.2975
 epoch: 92, train_loss: 0.8437, test_loss: 1.4761, test_f1: 0.4172
 epoch: 93, train_loss: 0.8281, test_loss: 1.3907, test_f1: 0.4531
 epoch: 94, train_loss: 0.8052, test_loss: 1.7237, test_f1: 0.4353
 epoch: 95, train_loss: 0.8017, test_loss: 1.5790, test_f1: 0.4455
 epoch: 96, train_loss: 0.8066, test_loss: 1.6922, test_f1: 0.3858
 epoch: 97, train_loss: 0.9068, test_loss: 1.1068, test_f1: 0.4392
 epoch: 98, train_loss: 0.9400, test_loss: 1.1955, test_f1: 0.3813
 epoch: 99, train_loss: 0.9659, test_loss: 1.1017, test_f1: 0.4124

Training completed in 297.90 seconds
Best F1: 0.5094 at epoch 89
Mean F1 across iterations: 0.4472  0.0802
========================FINAL RESULTS================================
FEGIN weighted F1: 0.5094  0.0802
python main.py --data ltspice_demos --representation component_pin --model FEGIN --layers 3 --hiddens 16 --batch_size 256 --lr 0.1 --emb_size 128 --epochs 100 --save_appendix component_pin_L3_H16_BS256_LR0.1_E128 --no_val
-----



STDERR:
  File "main.py", line 370, in <module>
    main()
  File "main.py", line 254, in main
    dataset = dataset_class(
  File "/home/philip/projects/ltspice_examples_code_repo/Circuit-Completion-Using-GNNs/component_classification_with_link_prediction_head/evaluation/FEGIN/kernel/circuit_datasets.py", line 15, in __init__
    self.data, self.slices = torch.load(self.processed_paths[0])
  File "/home/philip/.local/lib/python3.8/site-packages/torch/serialization.py", line 1040, in load
    warnings.warn(
  File "/usr/lib/python3.8/warnings.py", line 109, in _showwarnmsg
    sw(msg.message, msg.category, msg.filename, msg.lineno,
  File "main.py", line 47, in warn_with_traceback
    traceback.print_stack(file=log)
/home/philip/projects/ltspice_examples_code_repo/Circuit-Completion-Using-GNNs/component_classification_with_link_prediction_head/evaluation/FEGIN/kernel/circuit_datasets.py:15: FutureWarning: You are using `torch.load` with `weights_only=False` (the current default value), which uses the default pickle module implicitly. It is possible to construct malicious pickle data which will execute arbitrary code during unpickling (See https://github.com/pytorch/pytorch/blob/main/SECURITY.md#untrusted-models for more details). In a future release, the default value for `weights_only` will be flipped to `True`. This limits the functions that could be executed during unpickling. Arbitrary objects will no longer be allowed to be loaded via this mode unless they are explicitly allowlisted by the user via `torch.serialization.add_safe_globals`. We recommend you start setting `weights_only=True` for any use case where you don't have full control of the loaded file. Please open an issue on GitHub for any issues related to this experimental feature.
  self.data, self.slices = torch.load(self.processed_paths[0])
