STDOUT:
Results will be saved in /home/philip/projects/ltspice_examples_code_repo/Circuit-Completion-Using-GNNs/component_classification_with_link_prediction_head/evaluation/FEGIN/results/model_FEGIN_dataset_ltspice_examples
Command line input: python main.py --data ltspice_examples --representation component_net --model FEGIN --layers 2 --hiddens 128 --batch_size 64 --lr 0.0001 --emb_size 128 --epochs 100 --save_appendix component_net_L2_H128_BS64_LR0.0001_E128 --no_val
 is saved.
-----
ltspice_examples - FEGIN
Using 2 layers, 128 hidden units, h = 2
Loading component_net representation dataset
ENTERED
Training FEGIN on component_net representation
Train: 3558, Test: 846
##################ITERATION #0 ****************************************
 epoch: 0, train_loss: 1.3556, test_loss: 1.3344, test_f1: 0.2270
 epoch: 1, train_loss: 1.2907, test_loss: 1.2708, test_f1: 0.2270
 epoch: 2, train_loss: 1.2498, test_loss: 1.2248, test_f1: 0.2611
 epoch: 3, train_loss: 1.2116, test_loss: 1.1774, test_f1: 0.2996
 epoch: 4, train_loss: 1.1706, test_loss: 1.1227, test_f1: 0.3763
 epoch: 5, train_loss: 1.1245, test_loss: 1.0701, test_f1: 0.4268
 epoch: 6, train_loss: 1.0724, test_loss: 1.0302, test_f1: 0.4443
 epoch: 7, train_loss: 1.0294, test_loss: 0.9959, test_f1: 0.4619
 epoch: 8, train_loss: 0.9989, test_loss: 0.9699, test_f1: 0.4586
 epoch: 9, train_loss: 0.9783, test_loss: 0.9541, test_f1: 0.4866
 epoch: 10, train_loss: 0.9613, test_loss: 0.9462, test_f1: 0.4804
 epoch: 11, train_loss: 0.9493, test_loss: 0.9443, test_f1: 0.4878
 epoch: 12, train_loss: 0.9370, test_loss: 0.9342, test_f1: 0.4909
 epoch: 13, train_loss: 0.9250, test_loss: 0.9325, test_f1: 0.5162
 epoch: 14, train_loss: 0.9195, test_loss: 0.9381, test_f1: 0.4930
 epoch: 15, train_loss: 0.9169, test_loss: 0.9380, test_f1: 0.5111
 epoch: 16, train_loss: 0.9018, test_loss: 0.9428, test_f1: 0.4910
 epoch: 17, train_loss: 0.9013, test_loss: 0.9417, test_f1: 0.5093
 epoch: 18, train_loss: 0.8910, test_loss: 0.9325, test_f1: 0.5178
 epoch: 19, train_loss: 0.8925, test_loss: 0.9127, test_f1: 0.5309
 epoch: 20, train_loss: 0.8747, test_loss: 0.9234, test_f1: 0.5118
 epoch: 21, train_loss: 0.8762, test_loss: 0.9108, test_f1: 0.5300
 epoch: 22, train_loss: 0.8591, test_loss: 0.9089, test_f1: 0.5178
 epoch: 23, train_loss: 0.8559, test_loss: 0.8931, test_f1: 0.5210
 epoch: 24, train_loss: 0.8568, test_loss: 0.9402, test_f1: 0.5237
 epoch: 25, train_loss: 0.8434, test_loss: 0.9063, test_f1: 0.5229
 epoch: 26, train_loss: 0.8347, test_loss: 0.9077, test_f1: 0.5242
 epoch: 27, train_loss: 0.8347, test_loss: 0.9066, test_f1: 0.5303
 epoch: 28, train_loss: 0.8354, test_loss: 0.8852, test_f1: 0.5307
 epoch: 29, train_loss: 0.8227, test_loss: 0.9457, test_f1: 0.5254
 epoch: 30, train_loss: 0.8182, test_loss: 0.9232, test_f1: 0.5335
 epoch: 31, train_loss: 0.8124, test_loss: 0.9081, test_f1: 0.5390
 epoch: 32, train_loss: 0.8044, test_loss: 0.9170, test_f1: 0.5361
 epoch: 33, train_loss: 0.7999, test_loss: 0.8986, test_f1: 0.5360
 epoch: 34, train_loss: 0.7976, test_loss: 0.8864, test_f1: 0.5350
 epoch: 35, train_loss: 0.7997, test_loss: 0.9001, test_f1: 0.5267
 epoch: 36, train_loss: 0.7884, test_loss: 0.9392, test_f1: 0.5420
 epoch: 37, train_loss: 0.7899, test_loss: 0.9160, test_f1: 0.5324
 epoch: 38, train_loss: 0.7760, test_loss: 0.9362, test_f1: 0.5394
 epoch: 39, train_loss: 0.7748, test_loss: 0.9167, test_f1: 0.5513
 epoch: 40, train_loss: 0.7651, test_loss: 0.9335, test_f1: 0.5475
 epoch: 41, train_loss: 0.7688, test_loss: 0.9456, test_f1: 0.5442
 epoch: 42, train_loss: 0.7624, test_loss: 0.9150, test_f1: 0.5532
 epoch: 43, train_loss: 0.7603, test_loss: 0.9081, test_f1: 0.5445
 epoch: 44, train_loss: 0.7535, test_loss: 0.9423, test_f1: 0.5327
 epoch: 45, train_loss: 0.7549, test_loss: 0.9228, test_f1: 0.5441
 epoch: 46, train_loss: 0.7396, test_loss: 0.9089, test_f1: 0.5484
 epoch: 47, train_loss: 0.7450, test_loss: 0.9174, test_f1: 0.5625
 epoch: 48, train_loss: 0.7438, test_loss: 0.9139, test_f1: 0.5612
 epoch: 49, train_loss: 0.7410, test_loss: 0.9142, test_f1: 0.5467
 epoch: 50, train_loss: 0.7277, test_loss: 0.9004, test_f1: 0.5758
 epoch: 51, train_loss: 0.7218, test_loss: 0.9050, test_f1: 0.5659
 epoch: 52, train_loss: 0.7198, test_loss: 0.8994, test_f1: 0.5750
 epoch: 53, train_loss: 0.7107, test_loss: 0.9089, test_f1: 0.5784
 epoch: 54, train_loss: 0.7081, test_loss: 0.9202, test_f1: 0.5769
 epoch: 55, train_loss: 0.7179, test_loss: 0.9102, test_f1: 0.5660
 epoch: 56, train_loss: 0.7068, test_loss: 0.9134, test_f1: 0.5744
 epoch: 57, train_loss: 0.7098, test_loss: 0.9081, test_f1: 0.5830
 epoch: 58, train_loss: 0.7009, test_loss: 0.9161, test_f1: 0.5975
 epoch: 59, train_loss: 0.7023, test_loss: 0.9177, test_f1: 0.5695
 epoch: 60, train_loss: 0.7104, test_loss: 0.9203, test_f1: 0.5738
 epoch: 61, train_loss: 0.7042, test_loss: 0.9239, test_f1: 0.5728
 epoch: 62, train_loss: 0.6886, test_loss: 0.9148, test_f1: 0.5880
 epoch: 63, train_loss: 0.6996, test_loss: 0.9123, test_f1: 0.5821
 epoch: 64, train_loss: 0.6938, test_loss: 0.9368, test_f1: 0.5725
 epoch: 65, train_loss: 0.6945, test_loss: 0.9265, test_f1: 0.5775
 epoch: 66, train_loss: 0.6819, test_loss: 0.9301, test_f1: 0.5976
 epoch: 67, train_loss: 0.6845, test_loss: 0.9249, test_f1: 0.5973
 epoch: 68, train_loss: 0.6822, test_loss: 0.9463, test_f1: 0.5792
 epoch: 69, train_loss: 0.6876, test_loss: 0.9375, test_f1: 0.5914
 epoch: 70, train_loss: 0.6672, test_loss: 0.9518, test_f1: 0.5994
 epoch: 71, train_loss: 0.6803, test_loss: 0.9441, test_f1: 0.5731
 epoch: 72, train_loss: 0.6804, test_loss: 0.9439, test_f1: 0.6032
 epoch: 73, train_loss: 0.6827, test_loss: 0.9302, test_f1: 0.6094
 epoch: 74, train_loss: 0.6720, test_loss: 0.9253, test_f1: 0.6224
 epoch: 75, train_loss: 0.6746, test_loss: 0.9462, test_f1: 0.6077
 epoch: 76, train_loss: 0.6701, test_loss: 0.9224, test_f1: 0.6220
 epoch: 77, train_loss: 0.6756, test_loss: 0.9412, test_f1: 0.6094
 epoch: 78, train_loss: 0.6649, test_loss: 0.9397, test_f1: 0.6030
 epoch: 79, train_loss: 0.6596, test_loss: 0.9197, test_f1: 0.6159
 epoch: 80, train_loss: 0.6741, test_loss: 0.9568, test_f1: 0.6076
 epoch: 81, train_loss: 0.6570, test_loss: 0.9306, test_f1: 0.6147
 epoch: 82, train_loss: 0.6557, test_loss: 0.9490, test_f1: 0.6162
 epoch: 83, train_loss: 0.6657, test_loss: 0.9162, test_f1: 0.6387
 epoch: 84, train_loss: 0.6577, test_loss: 0.9305, test_f1: 0.6201
 epoch: 85, train_loss: 0.6487, test_loss: 0.9322, test_f1: 0.6223
 epoch: 86, train_loss: 0.6557, test_loss: 0.9381, test_f1: 0.6269
 epoch: 87, train_loss: 0.6546, test_loss: 0.9175, test_f1: 0.6353
 epoch: 88, train_loss: 0.6530, test_loss: 0.9312, test_f1: 0.6311
 epoch: 89, train_loss: 0.6539, test_loss: 0.9379, test_f1: 0.6417
 epoch: 90, train_loss: 0.6509, test_loss: 0.9247, test_f1: 0.6319
 epoch: 91, train_loss: 0.6365, test_loss: 0.9382, test_f1: 0.6264
 epoch: 92, train_loss: 0.6512, test_loss: 0.9527, test_f1: 0.6094
 epoch: 93, train_loss: 0.6517, test_loss: 0.9668, test_f1: 0.6298
 epoch: 94, train_loss: 0.6414, test_loss: 0.9421, test_f1: 0.6224
 epoch: 95, train_loss: 0.6477, test_loss: 0.9251, test_f1: 0.6420
 epoch: 96, train_loss: 0.6551, test_loss: 0.9437, test_f1: 0.6149
 epoch: 97, train_loss: 0.6453, test_loss: 0.9372, test_f1: 0.6466
 epoch: 98, train_loss: 0.6295, test_loss: 0.9637, test_f1: 0.6248
 epoch: 99, train_loss: 0.6292, test_loss: 0.9541, test_f1: 0.6096
##################ITERATION #1 ****************************************
 epoch: 0, train_loss: 1.2732, test_loss: 1.2295, test_f1: 0.2651
 epoch: 1, train_loss: 1.1731, test_loss: 1.1217, test_f1: 0.4097
 epoch: 2, train_loss: 1.1203, test_loss: 1.0633, test_f1: 0.4515
 epoch: 3, train_loss: 1.0716, test_loss: 1.0171, test_f1: 0.4733
 epoch: 4, train_loss: 1.0290, test_loss: 0.9823, test_f1: 0.4889
 epoch: 5, train_loss: 1.0026, test_loss: 0.9486, test_f1: 0.4909
 epoch: 6, train_loss: 0.9634, test_loss: 0.9538, test_f1: 0.4949
 epoch: 7, train_loss: 0.9555, test_loss: 0.9298, test_f1: 0.5004
 epoch: 8, train_loss: 0.9398, test_loss: 0.9212, test_f1: 0.5103
 epoch: 9, train_loss: 0.9333, test_loss: 0.9139, test_f1: 0.5099
 epoch: 10, train_loss: 0.9165, test_loss: 0.8975, test_f1: 0.5375
 epoch: 11, train_loss: 0.9038, test_loss: 0.8693, test_f1: 0.5368
 epoch: 12, train_loss: 0.9000, test_loss: 0.8731, test_f1: 0.5346
 epoch: 13, train_loss: 0.8838, test_loss: 0.8890, test_f1: 0.5412
 epoch: 14, train_loss: 0.8791, test_loss: 0.8731, test_f1: 0.5401
 epoch: 15, train_loss: 0.8672, test_loss: 0.9060, test_f1: 0.5344
 epoch: 16, train_loss: 0.8691, test_loss: 0.8962, test_f1: 0.5381
 epoch: 17, train_loss: 0.8557, test_loss: 0.8661, test_f1: 0.5356
 epoch: 18, train_loss: 0.8484, test_loss: 0.9038, test_f1: 0.5348
 epoch: 19, train_loss: 0.8415, test_loss: 0.8738, test_f1: 0.5484
 epoch: 20, train_loss: 0.8381, test_loss: 0.8781, test_f1: 0.5425
 epoch: 21, train_loss: 0.8368, test_loss: 0.8730, test_f1: 0.5658
 epoch: 22, train_loss: 0.8267, test_loss: 0.8928, test_f1: 0.5347
 epoch: 23, train_loss: 0.8263, test_loss: 0.8661, test_f1: 0.5460
 epoch: 24, train_loss: 0.8141, test_loss: 0.8758, test_f1: 0.5500
 epoch: 25, train_loss: 0.8096, test_loss: 0.8676, test_f1: 0.5377
 epoch: 26, train_loss: 0.8027, test_loss: 0.8859, test_f1: 0.5417
 epoch: 27, train_loss: 0.8007, test_loss: 0.9063, test_f1: 0.5432
 epoch: 28, train_loss: 0.8004, test_loss: 0.8760, test_f1: 0.5489
 epoch: 29, train_loss: 0.7885, test_loss: 0.9095, test_f1: 0.5357
 epoch: 30, train_loss: 0.7859, test_loss: 0.8907, test_f1: 0.5635
 epoch: 31, train_loss: 0.7828, test_loss: 0.8946, test_f1: 0.5594
 epoch: 32, train_loss: 0.7795, test_loss: 0.8552, test_f1: 0.5482
 epoch: 33, train_loss: 0.7718, test_loss: 0.8984, test_f1: 0.5562
 epoch: 34, train_loss: 0.7607, test_loss: 0.9077, test_f1: 0.5587
 epoch: 35, train_loss: 0.7594, test_loss: 0.8766, test_f1: 0.5641
 epoch: 36, train_loss: 0.7559, test_loss: 0.8931, test_f1: 0.5807
 epoch: 37, train_loss: 0.7452, test_loss: 0.8644, test_f1: 0.5951
 epoch: 38, train_loss: 0.7529, test_loss: 0.8957, test_f1: 0.5659
 epoch: 39, train_loss: 0.7369, test_loss: 0.8903, test_f1: 0.5628
 epoch: 40, train_loss: 0.7324, test_loss: 0.8817, test_f1: 0.5769
 epoch: 41, train_loss: 0.7278, test_loss: 0.8926, test_f1: 0.5564
 epoch: 42, train_loss: 0.7322, test_loss: 0.8546, test_f1: 0.5631
 epoch: 43, train_loss: 0.7232, test_loss: 0.9029, test_f1: 0.5641
 epoch: 44, train_loss: 0.7084, test_loss: 0.8823, test_f1: 0.5571
 epoch: 45, train_loss: 0.7176, test_loss: 0.8841, test_f1: 0.6122
 epoch: 46, train_loss: 0.7147, test_loss: 0.8718, test_f1: 0.6237
 epoch: 47, train_loss: 0.7187, test_loss: 0.8720, test_f1: 0.5905
 epoch: 48, train_loss: 0.7120, test_loss: 0.8637, test_f1: 0.6007
 epoch: 49, train_loss: 0.6996, test_loss: 0.8890, test_f1: 0.5830
 epoch: 50, train_loss: 0.6968, test_loss: 0.8882, test_f1: 0.5965
 epoch: 51, train_loss: 0.6875, test_loss: 0.8919, test_f1: 0.6105
 epoch: 52, train_loss: 0.6755, test_loss: 0.8885, test_f1: 0.6337
 epoch: 53, train_loss: 0.6835, test_loss: 0.8778, test_f1: 0.6306
 epoch: 54, train_loss: 0.6686, test_loss: 0.8968, test_f1: 0.6064
 epoch: 55, train_loss: 0.6826, test_loss: 0.8749, test_f1: 0.6145
 epoch: 56, train_loss: 0.6660, test_loss: 0.8799, test_f1: 0.6439
 epoch: 57, train_loss: 0.6623, test_loss: 0.9025, test_f1: 0.6073
 epoch: 58, train_loss: 0.6588, test_loss: 0.8764, test_f1: 0.6393
 epoch: 59, train_loss: 0.6645, test_loss: 0.9135, test_f1: 0.6031
 epoch: 60, train_loss: 0.6563, test_loss: 0.8832, test_f1: 0.6328
 epoch: 61, train_loss: 0.6631, test_loss: 0.9179, test_f1: 0.6221
 epoch: 62, train_loss: 0.6559, test_loss: 0.8870, test_f1: 0.6164
 epoch: 63, train_loss: 0.6493, test_loss: 0.8804, test_f1: 0.6409
 epoch: 64, train_loss: 0.6563, test_loss: 0.8803, test_f1: 0.6476
 epoch: 65, train_loss: 0.6532, test_loss: 0.8918, test_f1: 0.6208
 epoch: 66, train_loss: 0.6470, test_loss: 0.8949, test_f1: 0.6487
 epoch: 67, train_loss: 0.6493, test_loss: 0.9060, test_f1: 0.6322
 epoch: 68, train_loss: 0.6431, test_loss: 0.9056, test_f1: 0.6323
 epoch: 69, train_loss: 0.6402, test_loss: 0.9087, test_f1: 0.6226
 epoch: 70, train_loss: 0.6340, test_loss: 0.9016, test_f1: 0.6446
 epoch: 71, train_loss: 0.6423, test_loss: 0.9142, test_f1: 0.6389
 epoch: 72, train_loss: 0.6305, test_loss: 0.9136, test_f1: 0.6363
 epoch: 73, train_loss: 0.6358, test_loss: 0.9130, test_f1: 0.6334
 epoch: 74, train_loss: 0.6318, test_loss: 0.9333, test_f1: 0.6416
 epoch: 75, train_loss: 0.6288, test_loss: 0.9169, test_f1: 0.6329
 epoch: 76, train_loss: 0.6281, test_loss: 0.9277, test_f1: 0.6469
 epoch: 77, train_loss: 0.6218, test_loss: 0.9262, test_f1: 0.6291
 epoch: 78, train_loss: 0.6253, test_loss: 0.9562, test_f1: 0.6537
 epoch: 79, train_loss: 0.6178, test_loss: 0.9274, test_f1: 0.6407
 epoch: 80, train_loss: 0.6232, test_loss: 0.9347, test_f1: 0.6392
 epoch: 81, train_loss: 0.6245, test_loss: 0.9296, test_f1: 0.6362
 epoch: 82, train_loss: 0.6305, test_loss: 0.9258, test_f1: 0.6397
 epoch: 83, train_loss: 0.6188, test_loss: 0.9243, test_f1: 0.6654
 epoch: 84, train_loss: 0.6212, test_loss: 0.9158, test_f1: 0.6387
 epoch: 85, train_loss: 0.6148, test_loss: 0.9366, test_f1: 0.6478
 epoch: 86, train_loss: 0.6170, test_loss: 0.9562, test_f1: 0.6458
 epoch: 87, train_loss: 0.6151, test_loss: 0.9243, test_f1: 0.6461
 epoch: 88, train_loss: 0.6098, test_loss: 0.9311, test_f1: 0.6479
 epoch: 89, train_loss: 0.6060, test_loss: 0.9508, test_f1: 0.6738
 epoch: 90, train_loss: 0.6041, test_loss: 0.9598, test_f1: 0.6313
 epoch: 91, train_loss: 0.6157, test_loss: 0.9388, test_f1: 0.6584
 epoch: 92, train_loss: 0.5940, test_loss: 0.9465, test_f1: 0.6469
 epoch: 93, train_loss: 0.6011, test_loss: 0.9440, test_f1: 0.6578
 epoch: 94, train_loss: 0.5983, test_loss: 0.9563, test_f1: 0.6298
 epoch: 95, train_loss: 0.5898, test_loss: 0.9659, test_f1: 0.6287
 epoch: 96, train_loss: 0.5975, test_loss: 0.9325, test_f1: 0.6621
 epoch: 97, train_loss: 0.5904, test_loss: 0.9491, test_f1: 0.6483
 epoch: 98, train_loss: 0.5794, test_loss: 0.9508, test_f1: 0.6460
 epoch: 99, train_loss: 0.5843, test_loss: 0.9579, test_f1: 0.6456
##################ITERATION #2 ****************************************
 epoch: 0, train_loss: 1.2300, test_loss: 1.1724, test_f1: 0.3410
 epoch: 1, train_loss: 1.1186, test_loss: 1.0604, test_f1: 0.4673
 epoch: 2, train_loss: 1.0619, test_loss: 1.0133, test_f1: 0.4571
 epoch: 3, train_loss: 1.0191, test_loss: 0.9800, test_f1: 0.5007
 epoch: 4, train_loss: 0.9947, test_loss: 0.9508, test_f1: 0.4931
 epoch: 5, train_loss: 0.9718, test_loss: 0.9408, test_f1: 0.5320
 epoch: 6, train_loss: 0.9448, test_loss: 0.9238, test_f1: 0.5417
 epoch: 7, train_loss: 0.9393, test_loss: 0.9164, test_f1: 0.5452
 epoch: 8, train_loss: 0.9233, test_loss: 0.9120, test_f1: 0.5450
 epoch: 9, train_loss: 0.9103, test_loss: 0.9138, test_f1: 0.5507
 epoch: 10, train_loss: 0.9015, test_loss: 0.9051, test_f1: 0.5614
 epoch: 11, train_loss: 0.8912, test_loss: 0.8887, test_f1: 0.5643
 epoch: 12, train_loss: 0.8815, test_loss: 0.8926, test_f1: 0.5559
 epoch: 13, train_loss: 0.8742, test_loss: 0.8957, test_f1: 0.5698
 epoch: 14, train_loss: 0.8673, test_loss: 0.8756, test_f1: 0.5607
 epoch: 15, train_loss: 0.8503, test_loss: 0.9106, test_f1: 0.5645
 epoch: 16, train_loss: 0.8471, test_loss: 0.8926, test_f1: 0.5729
 epoch: 17, train_loss: 0.8428, test_loss: 0.8718, test_f1: 0.5724
 epoch: 18, train_loss: 0.8397, test_loss: 0.8801, test_f1: 0.5648
 epoch: 19, train_loss: 0.8293, test_loss: 0.8949, test_f1: 0.5539
 epoch: 20, train_loss: 0.8212, test_loss: 0.8965, test_f1: 0.5428
 epoch: 21, train_loss: 0.8097, test_loss: 0.8807, test_f1: 0.5816
 epoch: 22, train_loss: 0.8116, test_loss: 0.8681, test_f1: 0.5695
 epoch: 23, train_loss: 0.7997, test_loss: 0.8826, test_f1: 0.5900
 epoch: 24, train_loss: 0.7974, test_loss: 0.8868, test_f1: 0.5555
 epoch: 25, train_loss: 0.7968, test_loss: 0.8890, test_f1: 0.5643
 epoch: 26, train_loss: 0.7864, test_loss: 0.8724, test_f1: 0.5783
 epoch: 27, train_loss: 0.7798, test_loss: 0.8934, test_f1: 0.5482
 epoch: 28, train_loss: 0.7824, test_loss: 0.8966, test_f1: 0.5847
 epoch: 29, train_loss: 0.7670, test_loss: 0.8788, test_f1: 0.5837
 epoch: 30, train_loss: 0.7701, test_loss: 0.9042, test_f1: 0.5751
 epoch: 31, train_loss: 0.7615, test_loss: 0.9122, test_f1: 0.5956
 epoch: 32, train_loss: 0.7536, test_loss: 0.8544, test_f1: 0.6201
 epoch: 33, train_loss: 0.7459, test_loss: 0.8519, test_f1: 0.5950
 epoch: 34, train_loss: 0.7466, test_loss: 0.8818, test_f1: 0.5988
 epoch: 35, train_loss: 0.7457, test_loss: 0.8896, test_f1: 0.6044
 epoch: 36, train_loss: 0.7345, test_loss: 0.8760, test_f1: 0.6120
 epoch: 37, train_loss: 0.7380, test_loss: 0.9130, test_f1: 0.5952
 epoch: 38, train_loss: 0.7259, test_loss: 0.8919, test_f1: 0.5998
 epoch: 39, train_loss: 0.7182, test_loss: 0.8913, test_f1: 0.5844
 epoch: 40, train_loss: 0.7227, test_loss: 0.8850, test_f1: 0.6064
 epoch: 41, train_loss: 0.7199, test_loss: 0.9099, test_f1: 0.6128
 epoch: 42, train_loss: 0.7032, test_loss: 0.8790, test_f1: 0.6171
 epoch: 43, train_loss: 0.7093, test_loss: 0.8803, test_f1: 0.6217
 epoch: 44, train_loss: 0.6972, test_loss: 0.9207, test_f1: 0.6083
 epoch: 45, train_loss: 0.6994, test_loss: 0.9022, test_f1: 0.6116
 epoch: 46, train_loss: 0.6955, test_loss: 0.9066, test_f1: 0.6215
 epoch: 47, train_loss: 0.6904, test_loss: 0.8978, test_f1: 0.6313
 epoch: 48, train_loss: 0.6913, test_loss: 0.9043, test_f1: 0.6174
 epoch: 49, train_loss: 0.6789, test_loss: 0.9559, test_f1: 0.6091
 epoch: 50, train_loss: 0.6863, test_loss: 0.9302, test_f1: 0.6084
 epoch: 51, train_loss: 0.6596, test_loss: 0.9039, test_f1: 0.6273
 epoch: 52, train_loss: 0.6698, test_loss: 0.9150, test_f1: 0.6254
 epoch: 53, train_loss: 0.6557, test_loss: 0.9074, test_f1: 0.6400
 epoch: 54, train_loss: 0.6530, test_loss: 0.9134, test_f1: 0.6312
 epoch: 55, train_loss: 0.6536, test_loss: 0.9318, test_f1: 0.6277
 epoch: 56, train_loss: 0.6533, test_loss: 0.9139, test_f1: 0.6376
 epoch: 57, train_loss: 0.6462, test_loss: 0.9097, test_f1: 0.6214
 epoch: 58, train_loss: 0.6456, test_loss: 0.9130, test_f1: 0.6387
 epoch: 59, train_loss: 0.6466, test_loss: 0.9380, test_f1: 0.6398
 epoch: 60, train_loss: 0.6476, test_loss: 0.9555, test_f1: 0.6344
 epoch: 61, train_loss: 0.6453, test_loss: 0.9337, test_f1: 0.6357
 epoch: 62, train_loss: 0.6317, test_loss: 0.9702, test_f1: 0.6255
 epoch: 63, train_loss: 0.6348, test_loss: 0.9646, test_f1: 0.6048
 epoch: 64, train_loss: 0.6353, test_loss: 0.9223, test_f1: 0.6459
 epoch: 65, train_loss: 0.6316, test_loss: 0.9485, test_f1: 0.6364
 epoch: 66, train_loss: 0.6354, test_loss: 0.9612, test_f1: 0.6403
 epoch: 67, train_loss: 0.6291, test_loss: 0.9315, test_f1: 0.6422
 epoch: 68, train_loss: 0.6314, test_loss: 0.9646, test_f1: 0.6355
 epoch: 69, train_loss: 0.6293, test_loss: 0.9540, test_f1: 0.6332
 epoch: 70, train_loss: 0.6202, test_loss: 0.9437, test_f1: 0.6486
 epoch: 71, train_loss: 0.6194, test_loss: 0.9563, test_f1: 0.6208
 epoch: 72, train_loss: 0.6104, test_loss: 0.9445, test_f1: 0.6430
 epoch: 73, train_loss: 0.6243, test_loss: 0.9793, test_f1: 0.6380
 epoch: 74, train_loss: 0.6152, test_loss: 0.9692, test_f1: 0.6340
 epoch: 75, train_loss: 0.6207, test_loss: 0.9498, test_f1: 0.6579
 epoch: 76, train_loss: 0.6075, test_loss: 0.9761, test_f1: 0.6625
 epoch: 77, train_loss: 0.6143, test_loss: 0.9803, test_f1: 0.6499
 epoch: 78, train_loss: 0.6027, test_loss: 1.0122, test_f1: 0.6411
 epoch: 79, train_loss: 0.5971, test_loss: 0.9649, test_f1: 0.6569
 epoch: 80, train_loss: 0.5987, test_loss: 0.9603, test_f1: 0.6413
 epoch: 81, train_loss: 0.6008, test_loss: 0.9991, test_f1: 0.6519
 epoch: 82, train_loss: 0.5973, test_loss: 0.9948, test_f1: 0.6375
 epoch: 83, train_loss: 0.5994, test_loss: 0.9887, test_f1: 0.6585
 epoch: 84, train_loss: 0.5936, test_loss: 0.9814, test_f1: 0.6559
 epoch: 85, train_loss: 0.5957, test_loss: 0.9885, test_f1: 0.6411
 epoch: 86, train_loss: 0.5756, test_loss: 1.0002, test_f1: 0.6454
 epoch: 87, train_loss: 0.5936, test_loss: 1.0143, test_f1: 0.6511
 epoch: 88, train_loss: 0.5879, test_loss: 1.0042, test_f1: 0.6460
 epoch: 89, train_loss: 0.5929, test_loss: 0.9983, test_f1: 0.6657
 epoch: 90, train_loss: 0.5923, test_loss: 0.9789, test_f1: 0.6737
 epoch: 91, train_loss: 0.5872, test_loss: 1.0378, test_f1: 0.6570
 epoch: 92, train_loss: 0.5834, test_loss: 1.0207, test_f1: 0.6565
 epoch: 93, train_loss: 0.5768, test_loss: 1.0344, test_f1: 0.6643
 epoch: 94, train_loss: 0.5851, test_loss: 1.0161, test_f1: 0.6725
 epoch: 95, train_loss: 0.5701, test_loss: 1.0142, test_f1: 0.6438
 epoch: 96, train_loss: 0.5824, test_loss: 1.0334, test_f1: 0.6589
 epoch: 97, train_loss: 0.5800, test_loss: 1.0159, test_f1: 0.6759
 epoch: 98, train_loss: 0.5691, test_loss: 1.0126, test_f1: 0.6467
 epoch: 99, train_loss: 0.5632, test_loss: 1.0213, test_f1: 0.6643
##################ITERATION #3 ****************************************
 epoch: 0, train_loss: 1.2100, test_loss: 1.1335, test_f1: 0.3580
 epoch: 1, train_loss: 1.0859, test_loss: 1.0122, test_f1: 0.4978
 epoch: 2, train_loss: 1.0439, test_loss: 0.9903, test_f1: 0.4997
 epoch: 3, train_loss: 0.9989, test_loss: 0.9584, test_f1: 0.5281
 epoch: 4, train_loss: 0.9743, test_loss: 0.9380, test_f1: 0.5060
 epoch: 5, train_loss: 0.9646, test_loss: 0.9399, test_f1: 0.5241
 epoch: 6, train_loss: 0.9413, test_loss: 0.9244, test_f1: 0.5241
 epoch: 7, train_loss: 0.9333, test_loss: 0.9105, test_f1: 0.5520
 epoch: 8, train_loss: 0.9107, test_loss: 0.9053, test_f1: 0.5420
 epoch: 9, train_loss: 0.9031, test_loss: 0.9055, test_f1: 0.5409
 epoch: 10, train_loss: 0.8994, test_loss: 0.8938, test_f1: 0.5488
 epoch: 11, train_loss: 0.8788, test_loss: 0.9004, test_f1: 0.5590
 epoch: 12, train_loss: 0.8767, test_loss: 0.8948, test_f1: 0.5406
 epoch: 13, train_loss: 0.8661, test_loss: 0.8983, test_f1: 0.5489
 epoch: 14, train_loss: 0.8642, test_loss: 0.8869, test_f1: 0.5544
 epoch: 15, train_loss: 0.8559, test_loss: 0.9090, test_f1: 0.5452
 epoch: 16, train_loss: 0.8445, test_loss: 0.9012, test_f1: 0.5579
 epoch: 17, train_loss: 0.8453, test_loss: 0.8866, test_f1: 0.5506
 epoch: 18, train_loss: 0.8370, test_loss: 0.8979, test_f1: 0.5400
 epoch: 19, train_loss: 0.8285, test_loss: 0.8812, test_f1: 0.5385
 epoch: 20, train_loss: 0.8208, test_loss: 0.8815, test_f1: 0.5373
 epoch: 21, train_loss: 0.8071, test_loss: 0.9051, test_f1: 0.5408
 epoch: 22, train_loss: 0.8143, test_loss: 0.9126, test_f1: 0.5445
 epoch: 23, train_loss: 0.8091, test_loss: 0.8907, test_f1: 0.5434
 epoch: 24, train_loss: 0.7974, test_loss: 0.9126, test_f1: 0.5524
 epoch: 25, train_loss: 0.7970, test_loss: 0.9021, test_f1: 0.5453
 epoch: 26, train_loss: 0.7911, test_loss: 0.8915, test_f1: 0.5583
 epoch: 27, train_loss: 0.7825, test_loss: 0.9148, test_f1: 0.5663
 epoch: 28, train_loss: 0.7795, test_loss: 0.9156, test_f1: 0.5757
 epoch: 29, train_loss: 0.7681, test_loss: 0.9005, test_f1: 0.5837
 epoch: 30, train_loss: 0.7559, test_loss: 0.8974, test_f1: 0.5715
 epoch: 31, train_loss: 0.7589, test_loss: 0.9453, test_f1: 0.5391
 epoch: 32, train_loss: 0.7669, test_loss: 0.9277, test_f1: 0.5543
 epoch: 33, train_loss: 0.7415, test_loss: 0.9237, test_f1: 0.5934
 epoch: 34, train_loss: 0.7387, test_loss: 0.9105, test_f1: 0.5763
 epoch: 35, train_loss: 0.7464, test_loss: 0.9295, test_f1: 0.5802
 epoch: 36, train_loss: 0.7443, test_loss: 0.9375, test_f1: 0.5733
 epoch: 37, train_loss: 0.7391, test_loss: 0.9342, test_f1: 0.5726
 epoch: 38, train_loss: 0.7391, test_loss: 0.9513, test_f1: 0.5770
 epoch: 39, train_loss: 0.7223, test_loss: 0.9323, test_f1: 0.5689
 epoch: 40, train_loss: 0.7329, test_loss: 0.9303, test_f1: 0.5757
 epoch: 41, train_loss: 0.7266, test_loss: 0.9304, test_f1: 0.5837
 epoch: 42, train_loss: 0.7152, test_loss: 0.9668, test_f1: 0.5918
 epoch: 43, train_loss: 0.7158, test_loss: 0.9420, test_f1: 0.6119
 epoch: 44, train_loss: 0.6994, test_loss: 0.9504, test_f1: 0.5989
 epoch: 45, train_loss: 0.7084, test_loss: 0.9565, test_f1: 0.6021
 epoch: 46, train_loss: 0.6874, test_loss: 0.9510, test_f1: 0.6244
 epoch: 47, train_loss: 0.6899, test_loss: 0.9720, test_f1: 0.6036
 epoch: 48, train_loss: 0.6870, test_loss: 0.9693, test_f1: 0.6110
 epoch: 49, train_loss: 0.6852, test_loss: 0.9720, test_f1: 0.6021
 epoch: 50, train_loss: 0.6836, test_loss: 0.9506, test_f1: 0.5813
 epoch: 51, train_loss: 0.6759, test_loss: 0.9534, test_f1: 0.6100
 epoch: 52, train_loss: 0.6784, test_loss: 0.9845, test_f1: 0.6086
 epoch: 53, train_loss: 0.6667, test_loss: 0.9589, test_f1: 0.6049
 epoch: 54, train_loss: 0.6658, test_loss: 0.9926, test_f1: 0.6059
 epoch: 55, train_loss: 0.6657, test_loss: 0.9674, test_f1: 0.5955
 epoch: 56, train_loss: 0.6584, test_loss: 0.9700, test_f1: 0.6005
 epoch: 57, train_loss: 0.6460, test_loss: 0.9767, test_f1: 0.6048
 epoch: 58, train_loss: 0.6490, test_loss: 0.9769, test_f1: 0.5992
 epoch: 59, train_loss: 0.6577, test_loss: 0.9864, test_f1: 0.6043
 epoch: 60, train_loss: 0.6490, test_loss: 0.9891, test_f1: 0.6040
 epoch: 61, train_loss: 0.6579, test_loss: 0.9716, test_f1: 0.6132
 epoch: 62, train_loss: 0.6531, test_loss: 0.9583, test_f1: 0.6043
 epoch: 63, train_loss: 0.6540, test_loss: 0.9849, test_f1: 0.6095
 epoch: 64, train_loss: 0.6401, test_loss: 0.9863, test_f1: 0.6011
 epoch: 65, train_loss: 0.6362, test_loss: 0.9726, test_f1: 0.6337
 epoch: 66, train_loss: 0.6457, test_loss: 0.9833, test_f1: 0.6317
 epoch: 67, train_loss: 0.6440, test_loss: 0.9862, test_f1: 0.6311
 epoch: 68, train_loss: 0.6390, test_loss: 1.0033, test_f1: 0.6144
 epoch: 69, train_loss: 0.6353, test_loss: 1.0056, test_f1: 0.6070
 epoch: 70, train_loss: 0.6368, test_loss: 1.0143, test_f1: 0.6070
 epoch: 71, train_loss: 0.6283, test_loss: 1.0079, test_f1: 0.6126
 epoch: 72, train_loss: 0.6424, test_loss: 1.0102, test_f1: 0.6066
 epoch: 73, train_loss: 0.6381, test_loss: 1.0192, test_f1: 0.6113
 epoch: 74, train_loss: 0.6298, test_loss: 1.0126, test_f1: 0.6157
 epoch: 75, train_loss: 0.6252, test_loss: 1.0143, test_f1: 0.6124
 epoch: 76, train_loss: 0.6350, test_loss: 0.9995, test_f1: 0.6251
 epoch: 77, train_loss: 0.6202, test_loss: 0.9943, test_f1: 0.6130
 epoch: 78, train_loss: 0.6118, test_loss: 0.9953, test_f1: 0.6243
 epoch: 79, train_loss: 0.6133, test_loss: 1.0115, test_f1: 0.6113
 epoch: 80, train_loss: 0.6218, test_loss: 1.0080, test_f1: 0.6492
 epoch: 81, train_loss: 0.6221, test_loss: 1.0078, test_f1: 0.6222
 epoch: 82, train_loss: 0.6067, test_loss: 0.9828, test_f1: 0.6217
 epoch: 83, train_loss: 0.6161, test_loss: 0.9919, test_f1: 0.6264
 epoch: 84, train_loss: 0.6059, test_loss: 1.0188, test_f1: 0.6211
 epoch: 85, train_loss: 0.6165, test_loss: 1.0316, test_f1: 0.6150
 epoch: 86, train_loss: 0.6033, test_loss: 1.0081, test_f1: 0.6300
 epoch: 87, train_loss: 0.5895, test_loss: 1.0162, test_f1: 0.6525
 epoch: 88, train_loss: 0.5936, test_loss: 1.0367, test_f1: 0.6599
 epoch: 89, train_loss: 0.6053, test_loss: 1.0430, test_f1: 0.6508
 epoch: 90, train_loss: 0.6063, test_loss: 1.0247, test_f1: 0.6200
 epoch: 91, train_loss: 0.5995, test_loss: 1.0160, test_f1: 0.6276
 epoch: 92, train_loss: 0.6004, test_loss: 1.0457, test_f1: 0.6106
 epoch: 93, train_loss: 0.5946, test_loss: 1.0160, test_f1: 0.6356
 epoch: 94, train_loss: 0.5869, test_loss: 1.0239, test_f1: 0.6400
 epoch: 95, train_loss: 0.5928, test_loss: 1.0474, test_f1: 0.6377
 epoch: 96, train_loss: 0.6008, test_loss: 1.0574, test_f1: 0.6258
 epoch: 97, train_loss: 0.5934, test_loss: 1.0536, test_f1: 0.6190
 epoch: 98, train_loss: 0.5825, test_loss: 1.0566, test_f1: 0.6175
 epoch: 99, train_loss: 0.5785, test_loss: 1.0242, test_f1: 0.6387
##################ITERATION #4 ****************************************
 epoch: 0, train_loss: 1.2238, test_loss: 1.1162, test_f1: 0.4136
 epoch: 1, train_loss: 1.0991, test_loss: 1.0095, test_f1: 0.4852
 epoch: 2, train_loss: 1.0634, test_loss: 0.9760, test_f1: 0.5168
 epoch: 3, train_loss: 1.0363, test_loss: 0.9556, test_f1: 0.4633
 epoch: 4, train_loss: 1.0069, test_loss: 0.9487, test_f1: 0.5052
 epoch: 5, train_loss: 0.9829, test_loss: 0.9388, test_f1: 0.5258
 epoch: 6, train_loss: 0.9861, test_loss: 0.9261, test_f1: 0.5307
 epoch: 7, train_loss: 0.9550, test_loss: 0.9160, test_f1: 0.5289
 epoch: 8, train_loss: 0.9414, test_loss: 0.9118, test_f1: 0.5254
 epoch: 9, train_loss: 0.9208, test_loss: 0.8956, test_f1: 0.5377
 epoch: 10, train_loss: 0.9151, test_loss: 0.8942, test_f1: 0.5349
 epoch: 11, train_loss: 0.9055, test_loss: 0.9000, test_f1: 0.5456
 epoch: 12, train_loss: 0.9005, test_loss: 0.8870, test_f1: 0.5355
 epoch: 13, train_loss: 0.8933, test_loss: 0.8969, test_f1: 0.5393
 epoch: 14, train_loss: 0.8867, test_loss: 0.8990, test_f1: 0.5363
 epoch: 15, train_loss: 0.8735, test_loss: 0.8929, test_f1: 0.5297
 epoch: 16, train_loss: 0.8666, test_loss: 0.8606, test_f1: 0.5348
 epoch: 17, train_loss: 0.8509, test_loss: 0.8696, test_f1: 0.5306
 epoch: 18, train_loss: 0.8583, test_loss: 0.8696, test_f1: 0.5426
 epoch: 19, train_loss: 0.8520, test_loss: 0.8657, test_f1: 0.5509
 epoch: 20, train_loss: 0.8400, test_loss: 0.8824, test_f1: 0.5553
 epoch: 21, train_loss: 0.8315, test_loss: 0.8787, test_f1: 0.5370
 epoch: 22, train_loss: 0.8208, test_loss: 0.8743, test_f1: 0.5663
 epoch: 23, train_loss: 0.8170, test_loss: 0.8637, test_f1: 0.5476
 epoch: 24, train_loss: 0.8116, test_loss: 0.8736, test_f1: 0.5590
 epoch: 25, train_loss: 0.8173, test_loss: 0.8417, test_f1: 0.5544
 epoch: 26, train_loss: 0.8152, test_loss: 0.8589, test_f1: 0.5796
 epoch: 27, train_loss: 0.7930, test_loss: 0.8563, test_f1: 0.5404
 epoch: 28, train_loss: 0.7917, test_loss: 0.8808, test_f1: 0.5661
 epoch: 29, train_loss: 0.7961, test_loss: 0.8757, test_f1: 0.5583
 epoch: 30, train_loss: 0.7843, test_loss: 0.8685, test_f1: 0.5463
 epoch: 31, train_loss: 0.7819, test_loss: 0.8773, test_f1: 0.5764
 epoch: 32, train_loss: 0.7804, test_loss: 0.8810, test_f1: 0.5711
 epoch: 33, train_loss: 0.7701, test_loss: 0.8508, test_f1: 0.5708
 epoch: 34, train_loss: 0.7732, test_loss: 0.8912, test_f1: 0.5547
 epoch: 35, train_loss: 0.7518, test_loss: 0.8741, test_f1: 0.5747
 epoch: 36, train_loss: 0.7569, test_loss: 0.8792, test_f1: 0.5934
 epoch: 37, train_loss: 0.7560, test_loss: 0.8785, test_f1: 0.5762
 epoch: 38, train_loss: 0.7482, test_loss: 0.8982, test_f1: 0.5893
 epoch: 39, train_loss: 0.7429, test_loss: 0.8759, test_f1: 0.5829
 epoch: 40, train_loss: 0.7418, test_loss: 0.9010, test_f1: 0.5688
 epoch: 41, train_loss: 0.7352, test_loss: 0.8430, test_f1: 0.5858
 epoch: 42, train_loss: 0.7413, test_loss: 0.9076, test_f1: 0.6024
 epoch: 43, train_loss: 0.7401, test_loss: 0.9270, test_f1: 0.5473
 epoch: 44, train_loss: 0.7276, test_loss: 0.8921, test_f1: 0.5869
 epoch: 45, train_loss: 0.7205, test_loss: 0.9122, test_f1: 0.5915
 epoch: 46, train_loss: 0.7094, test_loss: 0.9016, test_f1: 0.5978
 epoch: 47, train_loss: 0.6994, test_loss: 0.9003, test_f1: 0.5893
 epoch: 48, train_loss: 0.7056, test_loss: 0.8836, test_f1: 0.6196
 epoch: 49, train_loss: 0.7118, test_loss: 0.8920, test_f1: 0.6202
 epoch: 50, train_loss: 0.6980, test_loss: 0.9014, test_f1: 0.6137
 epoch: 51, train_loss: 0.7019, test_loss: 0.9155, test_f1: 0.5985
 epoch: 52, train_loss: 0.6907, test_loss: 0.8998, test_f1: 0.6128
 epoch: 53, train_loss: 0.6819, test_loss: 0.9117, test_f1: 0.6178
 epoch: 54, train_loss: 0.6687, test_loss: 0.9080, test_f1: 0.6203
 epoch: 55, train_loss: 0.6790, test_loss: 0.9201, test_f1: 0.6199
 epoch: 56, train_loss: 0.6825, test_loss: 0.8805, test_f1: 0.6143
 epoch: 57, train_loss: 0.6689, test_loss: 0.9056, test_f1: 0.6284
 epoch: 58, train_loss: 0.6711, test_loss: 0.8926, test_f1: 0.6110
 epoch: 59, train_loss: 0.6594, test_loss: 0.9013, test_f1: 0.6258
 epoch: 60, train_loss: 0.6717, test_loss: 0.9326, test_f1: 0.5949
 epoch: 61, train_loss: 0.6648, test_loss: 0.9226, test_f1: 0.6035
 epoch: 62, train_loss: 0.6654, test_loss: 0.9191, test_f1: 0.6065
 epoch: 63, train_loss: 0.6598, test_loss: 0.9235, test_f1: 0.6204
 epoch: 64, train_loss: 0.6639, test_loss: 0.9242, test_f1: 0.6196
 epoch: 65, train_loss: 0.6570, test_loss: 0.9036, test_f1: 0.6166
 epoch: 66, train_loss: 0.6662, test_loss: 0.9317, test_f1: 0.6251
 epoch: 67, train_loss: 0.6447, test_loss: 0.9393, test_f1: 0.6157
 epoch: 68, train_loss: 0.6433, test_loss: 0.9415, test_f1: 0.6120
 epoch: 69, train_loss: 0.6414, test_loss: 0.9378, test_f1: 0.6209
 epoch: 70, train_loss: 0.6441, test_loss: 0.9424, test_f1: 0.6163
 epoch: 71, train_loss: 0.6435, test_loss: 0.9337, test_f1: 0.6293
 epoch: 72, train_loss: 0.6472, test_loss: 0.9307, test_f1: 0.6112
 epoch: 73, train_loss: 0.6427, test_loss: 0.9596, test_f1: 0.6233
 epoch: 74, train_loss: 0.6401, test_loss: 0.9393, test_f1: 0.6232
 epoch: 75, train_loss: 0.6417, test_loss: 0.9309, test_f1: 0.6168
 epoch: 76, train_loss: 0.6368, test_loss: 0.9395, test_f1: 0.6206
 epoch: 77, train_loss: 0.6296, test_loss: 0.9529, test_f1: 0.6337
 epoch: 78, train_loss: 0.6332, test_loss: 0.9317, test_f1: 0.6258
 epoch: 79, train_loss: 0.6288, test_loss: 0.9563, test_f1: 0.6218
 epoch: 80, train_loss: 0.6203, test_loss: 0.9420, test_f1: 0.6307
 epoch: 81, train_loss: 0.6236, test_loss: 0.9344, test_f1: 0.6265
 epoch: 82, train_loss: 0.6291, test_loss: 0.9447, test_f1: 0.6229
 epoch: 83, train_loss: 0.6257, test_loss: 0.9344, test_f1: 0.6306
 epoch: 84, train_loss: 0.6174, test_loss: 0.9370, test_f1: 0.6452
 epoch: 85, train_loss: 0.6076, test_loss: 0.9633, test_f1: 0.6358
 epoch: 86, train_loss: 0.6126, test_loss: 0.9567, test_f1: 0.6267
 epoch: 87, train_loss: 0.6222, test_loss: 0.9291, test_f1: 0.6412
 epoch: 88, train_loss: 0.6068, test_loss: 0.9779, test_f1: 0.6100
 epoch: 89, train_loss: 0.6049, test_loss: 0.9648, test_f1: 0.6268
 epoch: 90, train_loss: 0.6122, test_loss: 0.9678, test_f1: 0.6398
 epoch: 91, train_loss: 0.6173, test_loss: 0.9584, test_f1: 0.6367
 epoch: 92, train_loss: 0.5992, test_loss: 0.9856, test_f1: 0.6375
 epoch: 93, train_loss: 0.6115, test_loss: 0.9533, test_f1: 0.6437
 epoch: 94, train_loss: 0.6021, test_loss: 0.9731, test_f1: 0.6476
 epoch: 95, train_loss: 0.5947, test_loss: 0.9938, test_f1: 0.6230
 epoch: 96, train_loss: 0.5941, test_loss: 0.9784, test_f1: 0.6500
 epoch: 97, train_loss: 0.5952, test_loss: 0.9826, test_f1: 0.6374
 epoch: 98, train_loss: 0.5957, test_loss: 0.9923, test_f1: 0.6371
 epoch: 99, train_loss: 0.5940, test_loss: 1.0029, test_f1: 0.6289
##################ITERATION #5 ****************************************
 epoch: 0, train_loss: 1.2364, test_loss: 1.0790, test_f1: 0.4483
 epoch: 1, train_loss: 1.0955, test_loss: 1.0047, test_f1: 0.4654
 epoch: 2, train_loss: 1.0594, test_loss: 0.9747, test_f1: 0.4765
 epoch: 3, train_loss: 1.0136, test_loss: 0.9578, test_f1: 0.4865
 epoch: 4, train_loss: 0.9859, test_loss: 0.9514, test_f1: 0.4864
 epoch: 5, train_loss: 0.9828, test_loss: 0.9215, test_f1: 0.4930
 epoch: 6, train_loss: 0.9620, test_loss: 0.9411, test_f1: 0.5069
 epoch: 7, train_loss: 0.9384, test_loss: 0.9206, test_f1: 0.5211
 epoch: 8, train_loss: 0.9335, test_loss: 0.9247, test_f1: 0.5232
 epoch: 9, train_loss: 0.9252, test_loss: 0.9098, test_f1: 0.5273
 epoch: 10, train_loss: 0.9108, test_loss: 0.9189, test_f1: 0.5399
 epoch: 11, train_loss: 0.9143, test_loss: 0.9101, test_f1: 0.5318
 epoch: 12, train_loss: 0.8915, test_loss: 0.9099, test_f1: 0.5124
 epoch: 13, train_loss: 0.8881, test_loss: 0.9126, test_f1: 0.5375
 epoch: 14, train_loss: 0.8784, test_loss: 0.9086, test_f1: 0.5420
 epoch: 15, train_loss: 0.8643, test_loss: 0.9003, test_f1: 0.5554
 epoch: 16, train_loss: 0.8611, test_loss: 0.9209, test_f1: 0.5375
 epoch: 17, train_loss: 0.8497, test_loss: 0.9018, test_f1: 0.5537
 epoch: 18, train_loss: 0.8371, test_loss: 0.9245, test_f1: 0.5467
 epoch: 19, train_loss: 0.8398, test_loss: 0.8990, test_f1: 0.5662
 epoch: 20, train_loss: 0.8402, test_loss: 0.9011, test_f1: 0.5436
 epoch: 21, train_loss: 0.8260, test_loss: 0.9120, test_f1: 0.5528
 epoch: 22, train_loss: 0.8268, test_loss: 0.9031, test_f1: 0.5760
 epoch: 23, train_loss: 0.8192, test_loss: 0.8941, test_f1: 0.5711
 epoch: 24, train_loss: 0.8064, test_loss: 0.8933, test_f1: 0.5550
 epoch: 25, train_loss: 0.7989, test_loss: 0.8958, test_f1: 0.5621
 epoch: 26, train_loss: 0.7980, test_loss: 0.9227, test_f1: 0.5560
 epoch: 27, train_loss: 0.8078, test_loss: 0.9172, test_f1: 0.5499
 epoch: 28, train_loss: 0.7930, test_loss: 0.9047, test_f1: 0.5719
 epoch: 29, train_loss: 0.7813, test_loss: 0.9043, test_f1: 0.5648
 epoch: 30, train_loss: 0.7790, test_loss: 0.9069, test_f1: 0.5496
 epoch: 31, train_loss: 0.7743, test_loss: 0.8902, test_f1: 0.6017
 epoch: 32, train_loss: 0.7681, test_loss: 0.9041, test_f1: 0.5703
 epoch: 33, train_loss: 0.7620, test_loss: 0.8962, test_f1: 0.5595
 epoch: 34, train_loss: 0.7589, test_loss: 0.9016, test_f1: 0.6006
 epoch: 35, train_loss: 0.7612, test_loss: 0.9110, test_f1: 0.5953
 epoch: 36, train_loss: 0.7556, test_loss: 0.9097, test_f1: 0.5995
 epoch: 37, train_loss: 0.7551, test_loss: 0.9096, test_f1: 0.6146
 epoch: 38, train_loss: 0.7358, test_loss: 0.9195, test_f1: 0.5866
 epoch: 39, train_loss: 0.7417, test_loss: 0.9074, test_f1: 0.5870
 epoch: 40, train_loss: 0.7354, test_loss: 0.9089, test_f1: 0.5586
 epoch: 41, train_loss: 0.7345, test_loss: 0.9082, test_f1: 0.6053
 epoch: 42, train_loss: 0.7301, test_loss: 0.9914, test_f1: 0.5559
 epoch: 43, train_loss: 0.7239, test_loss: 0.9284, test_f1: 0.6077
 epoch: 44, train_loss: 0.7157, test_loss: 0.9448, test_f1: 0.5955
 epoch: 45, train_loss: 0.7210, test_loss: 0.9326, test_f1: 0.6025
 epoch: 46, train_loss: 0.7119, test_loss: 0.9178, test_f1: 0.6148
 epoch: 47, train_loss: 0.7000, test_loss: 0.9331, test_f1: 0.6200
 epoch: 48, train_loss: 0.6943, test_loss: 0.9482, test_f1: 0.5876
 epoch: 49, train_loss: 0.6968, test_loss: 0.9262, test_f1: 0.6007
 epoch: 50, train_loss: 0.6914, test_loss: 0.9193, test_f1: 0.6153
 epoch: 51, train_loss: 0.6835, test_loss: 0.9476, test_f1: 0.6216
 epoch: 52, train_loss: 0.6845, test_loss: 0.9650, test_f1: 0.5952
 epoch: 53, train_loss: 0.6691, test_loss: 0.9372, test_f1: 0.6178
 epoch: 54, train_loss: 0.6699, test_loss: 0.9431, test_f1: 0.6099
 epoch: 55, train_loss: 0.6769, test_loss: 0.9433, test_f1: 0.6053
 epoch: 56, train_loss: 0.6755, test_loss: 0.9476, test_f1: 0.6130
 epoch: 57, train_loss: 0.6694, test_loss: 0.9283, test_f1: 0.6314
 epoch: 58, train_loss: 0.6520, test_loss: 0.9386, test_f1: 0.6006
 epoch: 59, train_loss: 0.6614, test_loss: 0.9385, test_f1: 0.6105
 epoch: 60, train_loss: 0.6530, test_loss: 0.9404, test_f1: 0.6153
 epoch: 61, train_loss: 0.6599, test_loss: 0.9437, test_f1: 0.6156
 epoch: 62, train_loss: 0.6496, test_loss: 0.9538, test_f1: 0.6123
 epoch: 63, train_loss: 0.6577, test_loss: 0.9695, test_f1: 0.6156
 epoch: 64, train_loss: 0.6458, test_loss: 0.9541, test_f1: 0.6010
 epoch: 65, train_loss: 0.6465, test_loss: 0.9655, test_f1: 0.6119
 epoch: 66, train_loss: 0.6493, test_loss: 0.9408, test_f1: 0.6171
 epoch: 67, train_loss: 0.6412, test_loss: 0.9602, test_f1: 0.6101
 epoch: 68, train_loss: 0.6510, test_loss: 0.9576, test_f1: 0.6115
 epoch: 69, train_loss: 0.6409, test_loss: 0.9723, test_f1: 0.6112
 epoch: 70, train_loss: 0.6337, test_loss: 0.9523, test_f1: 0.6149
 epoch: 71, train_loss: 0.6460, test_loss: 0.9619, test_f1: 0.6338
 epoch: 72, train_loss: 0.6343, test_loss: 0.9805, test_f1: 0.6082
 epoch: 73, train_loss: 0.6486, test_loss: 0.9574, test_f1: 0.6198
 epoch: 74, train_loss: 0.6489, test_loss: 0.9603, test_f1: 0.6363
 epoch: 75, train_loss: 0.6201, test_loss: 0.9966, test_f1: 0.6100
 epoch: 76, train_loss: 0.6363, test_loss: 0.9759, test_f1: 0.6058
 epoch: 77, train_loss: 0.6349, test_loss: 0.9894, test_f1: 0.6194
 epoch: 78, train_loss: 0.6341, test_loss: 0.9894, test_f1: 0.6264
 epoch: 79, train_loss: 0.6467, test_loss: 0.9762, test_f1: 0.6336
 epoch: 80, train_loss: 0.6172, test_loss: 0.9937, test_f1: 0.6134
 epoch: 81, train_loss: 0.6191, test_loss: 0.9947, test_f1: 0.6306
 epoch: 82, train_loss: 0.6202, test_loss: 0.9786, test_f1: 0.6093
 epoch: 83, train_loss: 0.6172, test_loss: 0.9813, test_f1: 0.6089
 epoch: 84, train_loss: 0.6213, test_loss: 1.0078, test_f1: 0.5921
 epoch: 85, train_loss: 0.6215, test_loss: 0.9875, test_f1: 0.6105
 epoch: 86, train_loss: 0.6191, test_loss: 1.0012, test_f1: 0.6228
 epoch: 87, train_loss: 0.6162, test_loss: 1.0297, test_f1: 0.5966
 epoch: 88, train_loss: 0.6094, test_loss: 1.0251, test_f1: 0.6204
 epoch: 89, train_loss: 0.6076, test_loss: 1.0048, test_f1: 0.6179
 epoch: 90, train_loss: 0.6099, test_loss: 1.0019, test_f1: 0.6173
 epoch: 91, train_loss: 0.6006, test_loss: 1.0104, test_f1: 0.5906
 epoch: 92, train_loss: 0.6088, test_loss: 1.0067, test_f1: 0.6022
 epoch: 93, train_loss: 0.6081, test_loss: 1.0100, test_f1: 0.6123
 epoch: 94, train_loss: 0.6010, test_loss: 1.0152, test_f1: 0.6051
 epoch: 95, train_loss: 0.5928, test_loss: 1.0317, test_f1: 0.6039
 epoch: 96, train_loss: 0.6097, test_loss: 1.0028, test_f1: 0.6070
 epoch: 97, train_loss: 0.5886, test_loss: 1.0395, test_f1: 0.6167
 epoch: 98, train_loss: 0.6021, test_loss: 1.0081, test_f1: 0.6316
 epoch: 99, train_loss: 0.5998, test_loss: 1.0298, test_f1: 0.6272
##################ITERATION #6 ****************************************
 epoch: 0, train_loss: 1.2335, test_loss: 1.0768, test_f1: 0.4327
 epoch: 1, train_loss: 1.0836, test_loss: 0.9817, test_f1: 0.4995
 epoch: 2, train_loss: 1.0540, test_loss: 0.9524, test_f1: 0.5070
 epoch: 3, train_loss: 1.0232, test_loss: 0.9443, test_f1: 0.5111
 epoch: 4, train_loss: 0.9962, test_loss: 0.9276, test_f1: 0.5123
 epoch: 5, train_loss: 0.9724, test_loss: 0.9329, test_f1: 0.5207
 epoch: 6, train_loss: 0.9605, test_loss: 0.9174, test_f1: 0.5204
 epoch: 7, train_loss: 0.9382, test_loss: 0.9122, test_f1: 0.5447
 epoch: 8, train_loss: 0.9470, test_loss: 0.9059, test_f1: 0.5309
 epoch: 9, train_loss: 0.9162, test_loss: 0.9089, test_f1: 0.5411
 epoch: 10, train_loss: 0.9201, test_loss: 0.8931, test_f1: 0.5158
 epoch: 11, train_loss: 0.9130, test_loss: 0.9122, test_f1: 0.5331
 epoch: 12, train_loss: 0.8936, test_loss: 0.8984, test_f1: 0.5412
 epoch: 13, train_loss: 0.8973, test_loss: 0.9068, test_f1: 0.5352
 epoch: 14, train_loss: 0.8893, test_loss: 0.8866, test_f1: 0.5339
 epoch: 15, train_loss: 0.8725, test_loss: 0.8809, test_f1: 0.5328
 epoch: 16, train_loss: 0.8646, test_loss: 0.8806, test_f1: 0.5353
 epoch: 17, train_loss: 0.8636, test_loss: 0.8805, test_f1: 0.5351
 epoch: 18, train_loss: 0.8523, test_loss: 0.8862, test_f1: 0.5384
 epoch: 19, train_loss: 0.8506, test_loss: 0.8591, test_f1: 0.5462
 epoch: 20, train_loss: 0.8490, test_loss: 0.8696, test_f1: 0.5402
 epoch: 21, train_loss: 0.8480, test_loss: 0.8568, test_f1: 0.5624
 epoch: 22, train_loss: 0.8276, test_loss: 0.8916, test_f1: 0.5635
 epoch: 23, train_loss: 0.8182, test_loss: 0.8872, test_f1: 0.5604
 epoch: 24, train_loss: 0.8245, test_loss: 0.8950, test_f1: 0.5554
 epoch: 25, train_loss: 0.8196, test_loss: 0.8699, test_f1: 0.5512
 epoch: 26, train_loss: 0.8139, test_loss: 0.8562, test_f1: 0.5598
 epoch: 27, train_loss: 0.7916, test_loss: 0.8521, test_f1: 0.5652
 epoch: 28, train_loss: 0.7966, test_loss: 0.8948, test_f1: 0.5519
 epoch: 29, train_loss: 0.7974, test_loss: 0.8978, test_f1: 0.5590
 epoch: 30, train_loss: 0.7933, test_loss: 0.8592, test_f1: 0.5700
 epoch: 31, train_loss: 0.7764, test_loss: 0.8643, test_f1: 0.5814
 epoch: 32, train_loss: 0.7918, test_loss: 0.8494, test_f1: 0.5886
 epoch: 33, train_loss: 0.7748, test_loss: 0.8828, test_f1: 0.5702
 epoch: 34, train_loss: 0.7656, test_loss: 0.8780, test_f1: 0.5888
 epoch: 35, train_loss: 0.7609, test_loss: 0.8971, test_f1: 0.5824
 epoch: 36, train_loss: 0.7638, test_loss: 0.9074, test_f1: 0.5854
 epoch: 37, train_loss: 0.7621, test_loss: 0.9141, test_f1: 0.5609
 epoch: 38, train_loss: 0.7571, test_loss: 0.9082, test_f1: 0.5723
 epoch: 39, train_loss: 0.7480, test_loss: 0.9059, test_f1: 0.6074
 epoch: 40, train_loss: 0.7468, test_loss: 0.8970, test_f1: 0.5928
 epoch: 41, train_loss: 0.7420, test_loss: 0.8948, test_f1: 0.5849
 epoch: 42, train_loss: 0.7418, test_loss: 0.9168, test_f1: 0.5714
 epoch: 43, train_loss: 0.7243, test_loss: 0.9257, test_f1: 0.5900
 epoch: 44, train_loss: 0.7322, test_loss: 0.8830, test_f1: 0.6168
 epoch: 45, train_loss: 0.7232, test_loss: 0.9096, test_f1: 0.6083
 epoch: 46, train_loss: 0.7249, test_loss: 0.9117, test_f1: 0.5833
 epoch: 47, train_loss: 0.7236, test_loss: 0.8845, test_f1: 0.6162
 epoch: 48, train_loss: 0.7065, test_loss: 0.9215, test_f1: 0.5948
 epoch: 49, train_loss: 0.7021, test_loss: 0.9058, test_f1: 0.6376
 epoch: 50, train_loss: 0.7043, test_loss: 0.8968, test_f1: 0.6201
 epoch: 51, train_loss: 0.6958, test_loss: 0.8949, test_f1: 0.6146
 epoch: 52, train_loss: 0.6859, test_loss: 0.9099, test_f1: 0.6253
 epoch: 53, train_loss: 0.6770, test_loss: 0.9150, test_f1: 0.6272
 epoch: 54, train_loss: 0.6797, test_loss: 0.9331, test_f1: 0.6241
 epoch: 55, train_loss: 0.6742, test_loss: 0.9101, test_f1: 0.6213
 epoch: 56, train_loss: 0.6731, test_loss: 0.9179, test_f1: 0.6160
 epoch: 57, train_loss: 0.6668, test_loss: 0.9186, test_f1: 0.6127
 epoch: 58, train_loss: 0.6807, test_loss: 0.9077, test_f1: 0.6162
 epoch: 59, train_loss: 0.6700, test_loss: 0.9193, test_f1: 0.6342
 epoch: 60, train_loss: 0.6803, test_loss: 0.9372, test_f1: 0.6141
 epoch: 61, train_loss: 0.6672, test_loss: 0.9268, test_f1: 0.6074
 epoch: 62, train_loss: 0.6597, test_loss: 0.9103, test_f1: 0.6303
 epoch: 63, train_loss: 0.6460, test_loss: 0.9348, test_f1: 0.6378
 epoch: 64, train_loss: 0.6563, test_loss: 0.9264, test_f1: 0.6053
 epoch: 65, train_loss: 0.6491, test_loss: 0.9331, test_f1: 0.6096
 epoch: 66, train_loss: 0.6430, test_loss: 0.9266, test_f1: 0.6393
 epoch: 67, train_loss: 0.6459, test_loss: 0.9190, test_f1: 0.6220
 epoch: 68, train_loss: 0.6439, test_loss: 0.9235, test_f1: 0.6319
 epoch: 69, train_loss: 0.6428, test_loss: 0.9271, test_f1: 0.6176
 epoch: 70, train_loss: 0.6464, test_loss: 0.9459, test_f1: 0.6179
 epoch: 71, train_loss: 0.6552, test_loss: 0.9494, test_f1: 0.6336
 epoch: 72, train_loss: 0.6352, test_loss: 0.9420, test_f1: 0.6288
 epoch: 73, train_loss: 0.6392, test_loss: 0.9730, test_f1: 0.6012
 epoch: 74, train_loss: 0.6312, test_loss: 0.9242, test_f1: 0.6165
 epoch: 75, train_loss: 0.6351, test_loss: 0.9574, test_f1: 0.6337
 epoch: 76, train_loss: 0.6179, test_loss: 0.9315, test_f1: 0.6260
 epoch: 77, train_loss: 0.6334, test_loss: 0.9778, test_f1: 0.5977
 epoch: 78, train_loss: 0.6178, test_loss: 0.9671, test_f1: 0.6005
 epoch: 79, train_loss: 0.6219, test_loss: 0.9695, test_f1: 0.6186
 epoch: 80, train_loss: 0.6355, test_loss: 0.9411, test_f1: 0.6184
 epoch: 81, train_loss: 0.6082, test_loss: 0.9706, test_f1: 0.6308
 epoch: 82, train_loss: 0.6205, test_loss: 0.9699, test_f1: 0.6161
 epoch: 83, train_loss: 0.6134, test_loss: 0.9474, test_f1: 0.6208
 epoch: 84, train_loss: 0.6075, test_loss: 0.9678, test_f1: 0.6419
 epoch: 85, train_loss: 0.6165, test_loss: 0.9974, test_f1: 0.6033
 epoch: 86, train_loss: 0.6132, test_loss: 0.9624, test_f1: 0.6269
 epoch: 87, train_loss: 0.6044, test_loss: 0.9738, test_f1: 0.6133
 epoch: 88, train_loss: 0.6117, test_loss: 0.9700, test_f1: 0.6307
 epoch: 89, train_loss: 0.5981, test_loss: 0.9653, test_f1: 0.6375
 epoch: 90, train_loss: 0.5998, test_loss: 0.9651, test_f1: 0.6433
 epoch: 91, train_loss: 0.6045, test_loss: 1.0167, test_f1: 0.6118
 epoch: 92, train_loss: 0.6037, test_loss: 0.9836, test_f1: 0.6197
 epoch: 93, train_loss: 0.5868, test_loss: 0.9825, test_f1: 0.6411
 epoch: 94, train_loss: 0.6010, test_loss: 0.9672, test_f1: 0.6370
 epoch: 95, train_loss: 0.6010, test_loss: 0.9859, test_f1: 0.6437
 epoch: 96, train_loss: 0.5932, test_loss: 0.9849, test_f1: 0.6193
 epoch: 97, train_loss: 0.5904, test_loss: 0.9669, test_f1: 0.6179
 epoch: 98, train_loss: 0.5881, test_loss: 0.9831, test_f1: 0.6212
 epoch: 99, train_loss: 0.5833, test_loss: 0.9925, test_f1: 0.6198
##################ITERATION #7 ****************************************
 epoch: 0, train_loss: 1.3121, test_loss: 1.1168, test_f1: 0.4029
 epoch: 1, train_loss: 1.1364, test_loss: 0.9856, test_f1: 0.5101
 epoch: 2, train_loss: 1.0697, test_loss: 0.9525, test_f1: 0.5203
 epoch: 3, train_loss: 1.0404, test_loss: 0.9375, test_f1: 0.5123
 epoch: 4, train_loss: 1.0080, test_loss: 0.9318, test_f1: 0.5423
 epoch: 5, train_loss: 0.9879, test_loss: 0.9180, test_f1: 0.5361
 epoch: 6, train_loss: 0.9711, test_loss: 0.9052, test_f1: 0.5500
 epoch: 7, train_loss: 0.9592, test_loss: 0.9176, test_f1: 0.5268
 epoch: 8, train_loss: 0.9494, test_loss: 0.9156, test_f1: 0.5394
 epoch: 9, train_loss: 0.9354, test_loss: 0.8853, test_f1: 0.5556
 epoch: 10, train_loss: 0.9263, test_loss: 0.9172, test_f1: 0.5524
 epoch: 11, train_loss: 0.9139, test_loss: 0.8836, test_f1: 0.5538
 epoch: 12, train_loss: 0.9088, test_loss: 0.8952, test_f1: 0.5625
 epoch: 13, train_loss: 0.9048, test_loss: 0.9096, test_f1: 0.5561
 epoch: 14, train_loss: 0.8917, test_loss: 0.9209, test_f1: 0.5772
 epoch: 15, train_loss: 0.8751, test_loss: 0.8980, test_f1: 0.5526
 epoch: 16, train_loss: 0.8661, test_loss: 0.8934, test_f1: 0.5588
 epoch: 17, train_loss: 0.8677, test_loss: 0.9313, test_f1: 0.5718
 epoch: 18, train_loss: 0.8631, test_loss: 0.9037, test_f1: 0.5864
 epoch: 19, train_loss: 0.8581, test_loss: 0.9174, test_f1: 0.5694
 epoch: 20, train_loss: 0.8514, test_loss: 0.8863, test_f1: 0.5725
 epoch: 21, train_loss: 0.8465, test_loss: 0.8913, test_f1: 0.5788
 epoch: 22, train_loss: 0.8410, test_loss: 0.8842, test_f1: 0.5974
 epoch: 23, train_loss: 0.8385, test_loss: 0.8654, test_f1: 0.5971
 epoch: 24, train_loss: 0.8268, test_loss: 0.9144, test_f1: 0.5961
 epoch: 25, train_loss: 0.8282, test_loss: 0.9117, test_f1: 0.5938
 epoch: 26, train_loss: 0.8237, test_loss: 0.9020, test_f1: 0.5676
 epoch: 27, train_loss: 0.8104, test_loss: 0.9050, test_f1: 0.6041
 epoch: 28, train_loss: 0.8092, test_loss: 0.9031, test_f1: 0.5880
 epoch: 29, train_loss: 0.8066, test_loss: 0.9023, test_f1: 0.6025
 epoch: 30, train_loss: 0.7959, test_loss: 0.8764, test_f1: 0.5890
 epoch: 31, train_loss: 0.7933, test_loss: 0.9188, test_f1: 0.5862
 epoch: 32, train_loss: 0.7892, test_loss: 0.8950, test_f1: 0.6037
 epoch: 33, train_loss: 0.7896, test_loss: 0.8760, test_f1: 0.5949
 epoch: 34, train_loss: 0.7798, test_loss: 0.8882, test_f1: 0.5879
 epoch: 35, train_loss: 0.7711, test_loss: 0.8716, test_f1: 0.5916
 epoch: 36, train_loss: 0.7702, test_loss: 0.9253, test_f1: 0.5962
 epoch: 37, train_loss: 0.7596, test_loss: 0.9589, test_f1: 0.6094
 epoch: 38, train_loss: 0.7559, test_loss: 0.9039, test_f1: 0.6070
 epoch: 39, train_loss: 0.7618, test_loss: 0.9128, test_f1: 0.6273
 epoch: 40, train_loss: 0.7521, test_loss: 0.8651, test_f1: 0.6368
 epoch: 41, train_loss: 0.7410, test_loss: 0.9254, test_f1: 0.5994
 epoch: 42, train_loss: 0.7385, test_loss: 0.9201, test_f1: 0.6084
 epoch: 43, train_loss: 0.7431, test_loss: 0.9116, test_f1: 0.6223
 epoch: 44, train_loss: 0.7467, test_loss: 0.9167, test_f1: 0.6127
 epoch: 45, train_loss: 0.7340, test_loss: 0.9041, test_f1: 0.6176
 epoch: 46, train_loss: 0.7326, test_loss: 0.9196, test_f1: 0.6255
 epoch: 47, train_loss: 0.7272, test_loss: 0.9089, test_f1: 0.6119
 epoch: 48, train_loss: 0.7192, test_loss: 0.9406, test_f1: 0.6041
 epoch: 49, train_loss: 0.7050, test_loss: 0.9108, test_f1: 0.6355
 epoch: 50, train_loss: 0.7086, test_loss: 0.9241, test_f1: 0.6333
 epoch: 51, train_loss: 0.7047, test_loss: 0.9115, test_f1: 0.6228
 epoch: 52, train_loss: 0.6927, test_loss: 0.9095, test_f1: 0.6120
 epoch: 53, train_loss: 0.7019, test_loss: 0.8990, test_f1: 0.6320
 epoch: 54, train_loss: 0.7029, test_loss: 0.9363, test_f1: 0.6140
 epoch: 55, train_loss: 0.6905, test_loss: 0.9297, test_f1: 0.6123
 epoch: 56, train_loss: 0.6927, test_loss: 0.9479, test_f1: 0.6281
 epoch: 57, train_loss: 0.6808, test_loss: 0.9494, test_f1: 0.6260
 epoch: 58, train_loss: 0.6792, test_loss: 0.9219, test_f1: 0.6642
 epoch: 59, train_loss: 0.6791, test_loss: 0.9212, test_f1: 0.6302
 epoch: 60, train_loss: 0.6787, test_loss: 0.9488, test_f1: 0.6370
 epoch: 61, train_loss: 0.6717, test_loss: 0.9440, test_f1: 0.6373
 epoch: 62, train_loss: 0.6660, test_loss: 0.9574, test_f1: 0.6311
 epoch: 63, train_loss: 0.6700, test_loss: 0.9451, test_f1: 0.6409
 epoch: 64, train_loss: 0.6724, test_loss: 0.9369, test_f1: 0.6454
 epoch: 65, train_loss: 0.6662, test_loss: 0.9298, test_f1: 0.6256
 epoch: 66, train_loss: 0.6669, test_loss: 0.9147, test_f1: 0.6554
 epoch: 67, train_loss: 0.6677, test_loss: 0.9403, test_f1: 0.6345
 epoch: 68, train_loss: 0.6683, test_loss: 0.9504, test_f1: 0.6446
 epoch: 69, train_loss: 0.6505, test_loss: 0.9411, test_f1: 0.6367
 epoch: 70, train_loss: 0.6555, test_loss: 0.9391, test_f1: 0.6439
 epoch: 71, train_loss: 0.6604, test_loss: 0.9491, test_f1: 0.6389
 epoch: 72, train_loss: 0.6510, test_loss: 0.9488, test_f1: 0.6567
 epoch: 73, train_loss: 0.6530, test_loss: 0.9691, test_f1: 0.6422
 epoch: 74, train_loss: 0.6484, test_loss: 0.9798, test_f1: 0.6336
 epoch: 75, train_loss: 0.6418, test_loss: 0.9412, test_f1: 0.6422
 epoch: 76, train_loss: 0.6322, test_loss: 0.9790, test_f1: 0.6320
 epoch: 77, train_loss: 0.6379, test_loss: 0.9706, test_f1: 0.6134
 epoch: 78, train_loss: 0.6421, test_loss: 0.9761, test_f1: 0.6396
 epoch: 79, train_loss: 0.6394, test_loss: 0.9565, test_f1: 0.6569
 epoch: 80, train_loss: 0.6290, test_loss: 0.9574, test_f1: 0.6471
 epoch: 81, train_loss: 0.6267, test_loss: 0.9515, test_f1: 0.6495
 epoch: 82, train_loss: 0.6362, test_loss: 0.9792, test_f1: 0.6315
 epoch: 83, train_loss: 0.6172, test_loss: 0.9583, test_f1: 0.6459
 epoch: 84, train_loss: 0.6167, test_loss: 0.9875, test_f1: 0.6537
 epoch: 85, train_loss: 0.6350, test_loss: 0.9751, test_f1: 0.6471
 epoch: 86, train_loss: 0.6264, test_loss: 0.9762, test_f1: 0.6332
 epoch: 87, train_loss: 0.6167, test_loss: 0.9602, test_f1: 0.6464
 epoch: 88, train_loss: 0.6182, test_loss: 1.0003, test_f1: 0.6342
 epoch: 89, train_loss: 0.6219, test_loss: 0.9929, test_f1: 0.6341
 epoch: 90, train_loss: 0.6216, test_loss: 0.9653, test_f1: 0.6413
 epoch: 91, train_loss: 0.6095, test_loss: 0.9725, test_f1: 0.6377
 epoch: 92, train_loss: 0.6117, test_loss: 0.9840, test_f1: 0.6285
 epoch: 93, train_loss: 0.5930, test_loss: 0.9777, test_f1: 0.6488
 epoch: 94, train_loss: 0.6101, test_loss: 0.9835, test_f1: 0.6632
 epoch: 95, train_loss: 0.5980, test_loss: 1.0095, test_f1: 0.6519
 epoch: 96, train_loss: 0.6129, test_loss: 0.9978, test_f1: 0.6232
 epoch: 97, train_loss: 0.6018, test_loss: 0.9781, test_f1: 0.6349
 epoch: 98, train_loss: 0.6066, test_loss: 0.9925, test_f1: 0.6415
 epoch: 99, train_loss: 0.5991, test_loss: 0.9750, test_f1: 0.6674
##################ITERATION #8 ****************************************
 epoch: 0, train_loss: 1.2701, test_loss: 1.0596, test_f1: 0.4588
 epoch: 1, train_loss: 1.1274, test_loss: 1.0130, test_f1: 0.4806
 epoch: 2, train_loss: 1.0774, test_loss: 0.9833, test_f1: 0.5060
 epoch: 3, train_loss: 1.0525, test_loss: 0.9772, test_f1: 0.5001
 epoch: 4, train_loss: 1.0226, test_loss: 0.9757, test_f1: 0.5204
 epoch: 5, train_loss: 1.0089, test_loss: 0.9669, test_f1: 0.5135
 epoch: 6, train_loss: 0.9801, test_loss: 0.9471, test_f1: 0.5215
 epoch: 7, train_loss: 0.9786, test_loss: 0.9424, test_f1: 0.5142
 epoch: 8, train_loss: 0.9539, test_loss: 0.9378, test_f1: 0.5555
 epoch: 9, train_loss: 0.9347, test_loss: 0.9293, test_f1: 0.5213
 epoch: 10, train_loss: 0.9281, test_loss: 0.9345, test_f1: 0.5387
 epoch: 11, train_loss: 0.9256, test_loss: 0.9280, test_f1: 0.5396
 epoch: 12, train_loss: 0.9151, test_loss: 0.9336, test_f1: 0.5548
 epoch: 13, train_loss: 0.8948, test_loss: 0.9293, test_f1: 0.5568
 epoch: 14, train_loss: 0.8954, test_loss: 0.9210, test_f1: 0.5481
 epoch: 15, train_loss: 0.8803, test_loss: 0.9261, test_f1: 0.5687
 epoch: 16, train_loss: 0.8812, test_loss: 0.9026, test_f1: 0.5715
 epoch: 17, train_loss: 0.8648, test_loss: 0.9256, test_f1: 0.5628
 epoch: 18, train_loss: 0.8681, test_loss: 0.9120, test_f1: 0.5616
 epoch: 19, train_loss: 0.8576, test_loss: 0.9056, test_f1: 0.5703
 epoch: 20, train_loss: 0.8410, test_loss: 0.9164, test_f1: 0.5798
 epoch: 21, train_loss: 0.8443, test_loss: 0.9153, test_f1: 0.6189
 epoch: 22, train_loss: 0.8279, test_loss: 0.8972, test_f1: 0.5643
 epoch: 23, train_loss: 0.8292, test_loss: 0.9077, test_f1: 0.5724
 epoch: 24, train_loss: 0.8327, test_loss: 0.8887, test_f1: 0.5811
 epoch: 25, train_loss: 0.8214, test_loss: 0.9040, test_f1: 0.5668
 epoch: 26, train_loss: 0.8129, test_loss: 0.9024, test_f1: 0.5802
 epoch: 27, train_loss: 0.8049, test_loss: 0.8869, test_f1: 0.5895
 epoch: 28, train_loss: 0.8073, test_loss: 0.8815, test_f1: 0.5888
 epoch: 29, train_loss: 0.7996, test_loss: 0.9077, test_f1: 0.5882
 epoch: 30, train_loss: 0.7924, test_loss: 0.9019, test_f1: 0.5785
 epoch: 31, train_loss: 0.7817, test_loss: 0.8762, test_f1: 0.5968
 epoch: 32, train_loss: 0.7893, test_loss: 0.9009, test_f1: 0.5891
 epoch: 33, train_loss: 0.7660, test_loss: 0.9114, test_f1: 0.5915
 epoch: 34, train_loss: 0.7720, test_loss: 0.9036, test_f1: 0.6115
 epoch: 35, train_loss: 0.7649, test_loss: 0.9035, test_f1: 0.5908
 epoch: 36, train_loss: 0.7544, test_loss: 0.9176, test_f1: 0.6122
 epoch: 37, train_loss: 0.7676, test_loss: 0.8979, test_f1: 0.5735
 epoch: 38, train_loss: 0.7544, test_loss: 0.9262, test_f1: 0.5898
 epoch: 39, train_loss: 0.7460, test_loss: 0.9185, test_f1: 0.5823
 epoch: 40, train_loss: 0.7388, test_loss: 0.9225, test_f1: 0.6137
 epoch: 41, train_loss: 0.7624, test_loss: 0.9148, test_f1: 0.5845
 epoch: 42, train_loss: 0.7426, test_loss: 0.9078, test_f1: 0.6002
 epoch: 43, train_loss: 0.7279, test_loss: 0.9159, test_f1: 0.6009
 epoch: 44, train_loss: 0.7289, test_loss: 0.9082, test_f1: 0.5919
 epoch: 45, train_loss: 0.7287, test_loss: 0.9359, test_f1: 0.5958
 epoch: 46, train_loss: 0.7271, test_loss: 0.9349, test_f1: 0.6239
 epoch: 47, train_loss: 0.7128, test_loss: 0.9157, test_f1: 0.5918
 epoch: 48, train_loss: 0.7109, test_loss: 0.9493, test_f1: 0.6242
 epoch: 49, train_loss: 0.7117, test_loss: 0.9351, test_f1: 0.6301
 epoch: 50, train_loss: 0.7103, test_loss: 0.9340, test_f1: 0.6154
 epoch: 51, train_loss: 0.6997, test_loss: 0.9391, test_f1: 0.6179
 epoch: 52, train_loss: 0.6926, test_loss: 0.9420, test_f1: 0.6006
 epoch: 53, train_loss: 0.6953, test_loss: 0.9449, test_f1: 0.5941
 epoch: 54, train_loss: 0.6904, test_loss: 0.9339, test_f1: 0.6231
 epoch: 55, train_loss: 0.6932, test_loss: 0.9283, test_f1: 0.6169
 epoch: 56, train_loss: 0.6882, test_loss: 0.9554, test_f1: 0.6077
 epoch: 57, train_loss: 0.6869, test_loss: 0.9287, test_f1: 0.6150
 epoch: 58, train_loss: 0.6710, test_loss: 0.9369, test_f1: 0.6379
 epoch: 59, train_loss: 0.6705, test_loss: 0.9477, test_f1: 0.6112
 epoch: 60, train_loss: 0.6737, test_loss: 0.9462, test_f1: 0.5993
 epoch: 61, train_loss: 0.6772, test_loss: 0.9400, test_f1: 0.6166
 epoch: 62, train_loss: 0.6715, test_loss: 0.9423, test_f1: 0.6270
 epoch: 63, train_loss: 0.6703, test_loss: 0.9490, test_f1: 0.6363
 epoch: 64, train_loss: 0.6607, test_loss: 0.9498, test_f1: 0.6241
 epoch: 65, train_loss: 0.6567, test_loss: 0.9398, test_f1: 0.6365
 epoch: 66, train_loss: 0.6702, test_loss: 0.9448, test_f1: 0.6247
 epoch: 67, train_loss: 0.6618, test_loss: 0.9618, test_f1: 0.6194
 epoch: 68, train_loss: 0.6567, test_loss: 0.9391, test_f1: 0.6551
 epoch: 69, train_loss: 0.6644, test_loss: 0.9374, test_f1: 0.6664
 epoch: 70, train_loss: 0.6504, test_loss: 0.9486, test_f1: 0.6286
 epoch: 71, train_loss: 0.6502, test_loss: 0.9378, test_f1: 0.6449
 epoch: 72, train_loss: 0.6548, test_loss: 0.9421, test_f1: 0.6280
 epoch: 73, train_loss: 0.6482, test_loss: 0.9473, test_f1: 0.6408
 epoch: 74, train_loss: 0.6421, test_loss: 0.9663, test_f1: 0.6335
 epoch: 75, train_loss: 0.6546, test_loss: 0.9606, test_f1: 0.6106
 epoch: 76, train_loss: 0.6435, test_loss: 0.9362, test_f1: 0.6189
 epoch: 77, train_loss: 0.6435, test_loss: 0.9370, test_f1: 0.6199
 epoch: 78, train_loss: 0.6451, test_loss: 0.9338, test_f1: 0.6340
 epoch: 79, train_loss: 0.6377, test_loss: 0.9600, test_f1: 0.6538
 epoch: 80, train_loss: 0.6439, test_loss: 0.9486, test_f1: 0.6228
 epoch: 81, train_loss: 0.6361, test_loss: 0.9586, test_f1: 0.6254
 epoch: 82, train_loss: 0.6355, test_loss: 0.9603, test_f1: 0.6089
 epoch: 83, train_loss: 0.6426, test_loss: 0.9520, test_f1: 0.6325
 epoch: 84, train_loss: 0.6365, test_loss: 0.9617, test_f1: 0.6138
 epoch: 85, train_loss: 0.6296, test_loss: 0.9417, test_f1: 0.6234
 epoch: 86, train_loss: 0.6211, test_loss: 0.9522, test_f1: 0.6207
 epoch: 87, train_loss: 0.6289, test_loss: 0.9620, test_f1: 0.6422
 epoch: 88, train_loss: 0.6234, test_loss: 0.9666, test_f1: 0.6459
 epoch: 89, train_loss: 0.6143, test_loss: 0.9614, test_f1: 0.6165
 epoch: 90, train_loss: 0.6101, test_loss: 0.9778, test_f1: 0.6203
 epoch: 91, train_loss: 0.6074, test_loss: 0.9607, test_f1: 0.6579
 epoch: 92, train_loss: 0.6302, test_loss: 0.9719, test_f1: 0.6370
 epoch: 93, train_loss: 0.6188, test_loss: 0.9838, test_f1: 0.6253
 epoch: 94, train_loss: 0.6199, test_loss: 0.9529, test_f1: 0.6615
 epoch: 95, train_loss: 0.6147, test_loss: 0.9664, test_f1: 0.6234
 epoch: 96, train_loss: 0.6001, test_loss: 0.9809, test_f1: 0.6550
 epoch: 97, train_loss: 0.6150, test_loss: 0.9988, test_f1: 0.6206
 epoch: 98, train_loss: 0.6036, test_loss: 1.0093, test_f1: 0.6093
 epoch: 99, train_loss: 0.6010, test_loss: 0.9700, test_f1: 0.6596
##################ITERATION #9 ****************************************
 epoch: 0, train_loss: 1.3166, test_loss: 1.0755, test_f1: 0.4153
 epoch: 1, train_loss: 1.1184, test_loss: 0.9923, test_f1: 0.4808
 epoch: 2, train_loss: 1.0849, test_loss: 1.0036, test_f1: 0.4630
 epoch: 3, train_loss: 1.0417, test_loss: 0.9651, test_f1: 0.4789
 epoch: 4, train_loss: 1.0145, test_loss: 0.9527, test_f1: 0.5080
 epoch: 5, train_loss: 0.9913, test_loss: 0.9411, test_f1: 0.5202
 epoch: 6, train_loss: 0.9765, test_loss: 0.9320, test_f1: 0.5265
 epoch: 7, train_loss: 0.9713, test_loss: 0.9308, test_f1: 0.5221
 epoch: 8, train_loss: 0.9513, test_loss: 0.9285, test_f1: 0.5113
 epoch: 9, train_loss: 0.9419, test_loss: 0.9234, test_f1: 0.5324
 epoch: 10, train_loss: 0.9273, test_loss: 0.9161, test_f1: 0.5140
 epoch: 11, train_loss: 0.9238, test_loss: 0.9074, test_f1: 0.5410
 epoch: 12, train_loss: 0.9200, test_loss: 0.9067, test_f1: 0.5546
 epoch: 13, train_loss: 0.9108, test_loss: 0.8969, test_f1: 0.5574
 epoch: 14, train_loss: 0.8888, test_loss: 0.9037, test_f1: 0.5649
 epoch: 15, train_loss: 0.8853, test_loss: 0.8923, test_f1: 0.5685
 epoch: 16, train_loss: 0.8814, test_loss: 0.8912, test_f1: 0.5644
 epoch: 17, train_loss: 0.8691, test_loss: 0.9193, test_f1: 0.5457
 epoch: 18, train_loss: 0.8570, test_loss: 0.8926, test_f1: 0.5722
 epoch: 19, train_loss: 0.8504, test_loss: 0.8694, test_f1: 0.5747
 epoch: 20, train_loss: 0.8394, test_loss: 0.8723, test_f1: 0.5555
 epoch: 21, train_loss: 0.8324, test_loss: 0.8709, test_f1: 0.5558
 epoch: 22, train_loss: 0.8267, test_loss: 0.8814, test_f1: 0.5649
 epoch: 23, train_loss: 0.8287, test_loss: 0.8695, test_f1: 0.5812
 epoch: 24, train_loss: 0.8238, test_loss: 0.8588, test_f1: 0.5765
 epoch: 25, train_loss: 0.8145, test_loss: 0.8975, test_f1: 0.5649
 epoch: 26, train_loss: 0.8193, test_loss: 0.8860, test_f1: 0.5616
 epoch: 27, train_loss: 0.8028, test_loss: 0.8821, test_f1: 0.5649
 epoch: 28, train_loss: 0.8063, test_loss: 0.8704, test_f1: 0.5733
 epoch: 29, train_loss: 0.7899, test_loss: 0.8802, test_f1: 0.5819
 epoch: 30, train_loss: 0.7906, test_loss: 0.8717, test_f1: 0.5892
 epoch: 31, train_loss: 0.7806, test_loss: 0.8814, test_f1: 0.5873
 epoch: 32, train_loss: 0.7820, test_loss: 0.8924, test_f1: 0.5662
 epoch: 33, train_loss: 0.7770, test_loss: 0.8774, test_f1: 0.5898
 epoch: 34, train_loss: 0.7736, test_loss: 0.8585, test_f1: 0.5696
 epoch: 35, train_loss: 0.7641, test_loss: 0.8765, test_f1: 0.5898
 epoch: 36, train_loss: 0.7633, test_loss: 0.9076, test_f1: 0.5729
 epoch: 37, train_loss: 0.7685, test_loss: 0.8777, test_f1: 0.5838
 epoch: 38, train_loss: 0.7550, test_loss: 0.8896, test_f1: 0.5883
 epoch: 39, train_loss: 0.7545, test_loss: 0.8633, test_f1: 0.5998
 epoch: 40, train_loss: 0.7482, test_loss: 0.9061, test_f1: 0.5604
 epoch: 41, train_loss: 0.7451, test_loss: 0.9062, test_f1: 0.5983
 epoch: 42, train_loss: 0.7482, test_loss: 0.9135, test_f1: 0.5782
 epoch: 43, train_loss: 0.7423, test_loss: 0.8901, test_f1: 0.6053
 epoch: 44, train_loss: 0.7305, test_loss: 0.9032, test_f1: 0.5825
 epoch: 45, train_loss: 0.7371, test_loss: 0.8985, test_f1: 0.6148
 epoch: 46, train_loss: 0.7310, test_loss: 0.8779, test_f1: 0.5996
 epoch: 47, train_loss: 0.7247, test_loss: 0.9086, test_f1: 0.5958
 epoch: 48, train_loss: 0.7290, test_loss: 0.9235, test_f1: 0.5865
 epoch: 49, train_loss: 0.7138, test_loss: 0.9144, test_f1: 0.6080
 epoch: 50, train_loss: 0.7165, test_loss: 0.8937, test_f1: 0.6089
 epoch: 51, train_loss: 0.7164, test_loss: 0.9043, test_f1: 0.6150
 epoch: 52, train_loss: 0.7112, test_loss: 0.9161, test_f1: 0.5964
 epoch: 53, train_loss: 0.6976, test_loss: 0.9027, test_f1: 0.6206
 epoch: 54, train_loss: 0.6954, test_loss: 0.9164, test_f1: 0.6247
 epoch: 55, train_loss: 0.7040, test_loss: 0.9086, test_f1: 0.6195
 epoch: 56, train_loss: 0.6940, test_loss: 0.9154, test_f1: 0.6269
 epoch: 57, train_loss: 0.6970, test_loss: 0.9137, test_f1: 0.6062
 epoch: 58, train_loss: 0.6874, test_loss: 0.9148, test_f1: 0.6098
 epoch: 59, train_loss: 0.6868, test_loss: 0.9055, test_f1: 0.6026
 epoch: 60, train_loss: 0.6885, test_loss: 0.9019, test_f1: 0.6095
 epoch: 61, train_loss: 0.6872, test_loss: 0.9142, test_f1: 0.6181
 epoch: 62, train_loss: 0.6840, test_loss: 0.9150, test_f1: 0.6332
 epoch: 63, train_loss: 0.6899, test_loss: 0.9188, test_f1: 0.6268
 epoch: 64, train_loss: 0.6795, test_loss: 0.9092, test_f1: 0.6139
 epoch: 65, train_loss: 0.6921, test_loss: 0.9152, test_f1: 0.6222
 epoch: 66, train_loss: 0.6700, test_loss: 0.9021, test_f1: 0.6285
 epoch: 67, train_loss: 0.6841, test_loss: 0.9058, test_f1: 0.6161
 epoch: 68, train_loss: 0.6769, test_loss: 0.9117, test_f1: 0.6303
 epoch: 69, train_loss: 0.6747, test_loss: 0.9165, test_f1: 0.6273
 epoch: 70, train_loss: 0.6640, test_loss: 0.9180, test_f1: 0.6223
 epoch: 71, train_loss: 0.6661, test_loss: 0.9016, test_f1: 0.6190
 epoch: 72, train_loss: 0.6662, test_loss: 0.9208, test_f1: 0.6057
 epoch: 73, train_loss: 0.6674, test_loss: 0.9345, test_f1: 0.6137
 epoch: 74, train_loss: 0.6648, test_loss: 0.9253, test_f1: 0.6269
 epoch: 75, train_loss: 0.6591, test_loss: 0.9269, test_f1: 0.6216
 epoch: 76, train_loss: 0.6580, test_loss: 0.9385, test_f1: 0.6231
 epoch: 77, train_loss: 0.6604, test_loss: 0.9352, test_f1: 0.6301
 epoch: 78, train_loss: 0.6506, test_loss: 0.9141, test_f1: 0.6135
 epoch: 79, train_loss: 0.6551, test_loss: 0.9248, test_f1: 0.6179
 epoch: 80, train_loss: 0.6533, test_loss: 0.9040, test_f1: 0.6310
 epoch: 81, train_loss: 0.6497, test_loss: 0.9448, test_f1: 0.6150
 epoch: 82, train_loss: 0.6499, test_loss: 0.9530, test_f1: 0.6253
 epoch: 83, train_loss: 0.6482, test_loss: 0.9532, test_f1: 0.6254
 epoch: 84, train_loss: 0.6412, test_loss: 0.9429, test_f1: 0.6148
 epoch: 85, train_loss: 0.6449, test_loss: 0.9294, test_f1: 0.6205
 epoch: 86, train_loss: 0.6466, test_loss: 0.9284, test_f1: 0.6125
 epoch: 87, train_loss: 0.6493, test_loss: 0.9265, test_f1: 0.6340
 epoch: 88, train_loss: 0.6367, test_loss: 0.9159, test_f1: 0.6278
 epoch: 89, train_loss: 0.6443, test_loss: 0.9267, test_f1: 0.6221
 epoch: 90, train_loss: 0.6404, test_loss: 0.9337, test_f1: 0.6328
 epoch: 91, train_loss: 0.6327, test_loss: 0.9582, test_f1: 0.6227
 epoch: 92, train_loss: 0.6337, test_loss: 0.9492, test_f1: 0.6383
 epoch: 93, train_loss: 0.6390, test_loss: 0.9516, test_f1: 0.6217
 epoch: 94, train_loss: 0.6297, test_loss: 0.9371, test_f1: 0.6271
 epoch: 95, train_loss: 0.6299, test_loss: 0.9421, test_f1: 0.6281
 epoch: 96, train_loss: 0.6277, test_loss: 0.9260, test_f1: 0.6452
 epoch: 97, train_loss: 0.6241, test_loss: 0.9363, test_f1: 0.6420
 epoch: 98, train_loss: 0.6179, test_loss: 0.9477, test_f1: 0.6285
 epoch: 99, train_loss: 0.6198, test_loss: 0.9356, test_f1: 0.6436

Training completed in 558.10 seconds
Best F1: 0.6759 at epoch 97
Mean F1 across iterations: 0.6565  0.0132
========================FINAL RESULTS================================
FEGIN weighted F1: 0.6759  0.0132
python main.py --data ltspice_examples --representation component_net --model FEGIN --layers 2 --hiddens 128 --batch_size 64 --lr 0.0001 --emb_size 128 --epochs 100 --save_appendix component_net_L2_H128_BS64_LR0.0001_E128 --no_val
-----



STDERR:
  File "main.py", line 370, in <module>
    main()
  File "main.py", line 254, in main
    dataset = dataset_class(
  File "/home/philip/projects/ltspice_examples_code_repo/Circuit-Completion-Using-GNNs/component_classification_with_link_prediction_head/evaluation/FEGIN/kernel/circuit_datasets.py", line 15, in __init__
    self.data, self.slices = torch.load(self.processed_paths[0])
  File "/home/philip/.local/lib/python3.8/site-packages/torch/serialization.py", line 1040, in load
    warnings.warn(
  File "/usr/lib/python3.8/warnings.py", line 109, in _showwarnmsg
    sw(msg.message, msg.category, msg.filename, msg.lineno,
  File "main.py", line 47, in warn_with_traceback
    traceback.print_stack(file=log)
/home/philip/projects/ltspice_examples_code_repo/Circuit-Completion-Using-GNNs/component_classification_with_link_prediction_head/evaluation/FEGIN/kernel/circuit_datasets.py:15: FutureWarning: You are using `torch.load` with `weights_only=False` (the current default value), which uses the default pickle module implicitly. It is possible to construct malicious pickle data which will execute arbitrary code during unpickling (See https://github.com/pytorch/pytorch/blob/main/SECURITY.md#untrusted-models for more details). In a future release, the default value for `weights_only` will be flipped to `True`. This limits the functions that could be executed during unpickling. Arbitrary objects will no longer be allowed to be loaded via this mode unless they are explicitly allowlisted by the user via `torch.serialization.add_safe_globals`. We recommend you start setting `weights_only=True` for any use case where you don't have full control of the loaded file. Please open an issue on GitHub for any issues related to this experimental feature.
  self.data, self.slices = torch.load(self.processed_paths[0])
