STDOUT:
Results will be saved in /home/philip/projects/ltspice_examples_code_repo/Circuit-Completion-Using-GNNs/component_classification_with_link_prediction_head/evaluation/FEGIN/results/model_FEGIN_dataset_ltspice_demos
Command line input: python main.py --data ltspice_demos --representation component_net --model FEGIN --layers 2 --hiddens 128 --batch_size 256 --lr 0.001 --emb_size 250 --epochs 100 --save_appendix component_net_L2_H128_BS256_LR0.001_E250 --no_val
 is saved.
-----
ltspice_demos - FEGIN
Using 2 layers, 128 hidden units, h = 2
Loading component_net representation dataset
ENTERED
Training FEGIN on component_net representation
Train: 1565, Test: 383
##################ITERATION #0 ****************************************
 epoch: 0, train_loss: 1.3358, test_loss: 1.3438, test_f1: 0.2281
 epoch: 1, train_loss: 1.2075, test_loss: 1.3094, test_f1: 0.2583
 epoch: 2, train_loss: 1.1608, test_loss: 1.2832, test_f1: 0.2722
 epoch: 3, train_loss: 1.1224, test_loss: 1.2487, test_f1: 0.2723
 epoch: 4, train_loss: 1.0924, test_loss: 1.2104, test_f1: 0.3540
 epoch: 5, train_loss: 1.0487, test_loss: 1.1766, test_f1: 0.4117
 epoch: 6, train_loss: 1.0152, test_loss: 1.1417, test_f1: 0.4121
 epoch: 7, train_loss: 0.9864, test_loss: 1.1000, test_f1: 0.4379
 epoch: 8, train_loss: 0.9564, test_loss: 1.0896, test_f1: 0.5021
 epoch: 9, train_loss: 0.9367, test_loss: 1.0799, test_f1: 0.4706
 epoch: 10, train_loss: 0.9070, test_loss: 1.1098, test_f1: 0.5280
 epoch: 11, train_loss: 0.8966, test_loss: 1.1173, test_f1: 0.5458
 epoch: 12, train_loss: 0.8778, test_loss: 1.0617, test_f1: 0.5488
 epoch: 13, train_loss: 0.8709, test_loss: 1.0892, test_f1: 0.5273
 epoch: 14, train_loss: 0.8576, test_loss: 1.1186, test_f1: 0.5691
 epoch: 15, train_loss: 0.8437, test_loss: 1.1335, test_f1: 0.5256
 epoch: 16, train_loss: 0.8337, test_loss: 1.0621, test_f1: 0.5381
 epoch: 17, train_loss: 0.8356, test_loss: 1.0769, test_f1: 0.5532
 epoch: 18, train_loss: 0.8296, test_loss: 1.0295, test_f1: 0.5580
 epoch: 19, train_loss: 0.7995, test_loss: 0.9932, test_f1: 0.5807
 epoch: 20, train_loss: 0.7933, test_loss: 1.1356, test_f1: 0.5362
 epoch: 21, train_loss: 0.7720, test_loss: 1.2121, test_f1: 0.5136
 epoch: 22, train_loss: 0.7910, test_loss: 1.1745, test_f1: 0.5563
 epoch: 23, train_loss: 0.7696, test_loss: 1.0566, test_f1: 0.5976
 epoch: 24, train_loss: 0.7687, test_loss: 1.1277, test_f1: 0.5668
 epoch: 25, train_loss: 0.7320, test_loss: 1.1210, test_f1: 0.5512
 epoch: 26, train_loss: 0.7191, test_loss: 1.0868, test_f1: 0.5832
 epoch: 27, train_loss: 0.7194, test_loss: 1.1669, test_f1: 0.5623
 epoch: 28, train_loss: 0.7191, test_loss: 1.0242, test_f1: 0.6101
 epoch: 29, train_loss: 0.6998, test_loss: 1.0798, test_f1: 0.5760
 epoch: 30, train_loss: 0.7002, test_loss: 1.0261, test_f1: 0.5990
 epoch: 31, train_loss: 0.6731, test_loss: 1.0124, test_f1: 0.6035
 epoch: 32, train_loss: 0.6685, test_loss: 1.1379, test_f1: 0.5777
 epoch: 33, train_loss: 0.6422, test_loss: 1.0634, test_f1: 0.6043
 epoch: 34, train_loss: 0.6428, test_loss: 1.1028, test_f1: 0.5046
 epoch: 35, train_loss: 0.6463, test_loss: 1.1081, test_f1: 0.6010
 epoch: 36, train_loss: 0.6304, test_loss: 1.0724, test_f1: 0.5820
 epoch: 37, train_loss: 0.6127, test_loss: 1.1235, test_f1: 0.5779
 epoch: 38, train_loss: 0.6040, test_loss: 1.0452, test_f1: 0.5959
 epoch: 39, train_loss: 0.5937, test_loss: 1.1530, test_f1: 0.5994
 epoch: 40, train_loss: 0.6128, test_loss: 1.4142, test_f1: 0.5530
 epoch: 41, train_loss: 0.5924, test_loss: 1.2050, test_f1: 0.5540
 epoch: 42, train_loss: 0.5881, test_loss: 1.2412, test_f1: 0.5849
 epoch: 43, train_loss: 0.5833, test_loss: 1.3519, test_f1: 0.5776
 epoch: 44, train_loss: 0.5660, test_loss: 1.3380, test_f1: 0.5893
 epoch: 45, train_loss: 0.5874, test_loss: 1.7063, test_f1: 0.5151
 epoch: 46, train_loss: 0.6112, test_loss: 1.2780, test_f1: 0.5919
 epoch: 47, train_loss: 0.5966, test_loss: 1.3362, test_f1: 0.6282
 epoch: 48, train_loss: 0.5743, test_loss: 1.3138, test_f1: 0.5895
 epoch: 49, train_loss: 0.5655, test_loss: 1.1484, test_f1: 0.6208
 epoch: 50, train_loss: 0.5656, test_loss: 1.2192, test_f1: 0.5806
 epoch: 51, train_loss: 0.5466, test_loss: 1.1962, test_f1: 0.6058
 epoch: 52, train_loss: 0.5273, test_loss: 1.3105, test_f1: 0.5582
 epoch: 53, train_loss: 0.5043, test_loss: 1.2716, test_f1: 0.6078
 epoch: 54, train_loss: 0.4968, test_loss: 1.3137, test_f1: 0.5918
 epoch: 55, train_loss: 0.4826, test_loss: 1.3680, test_f1: 0.5897
 epoch: 56, train_loss: 0.4749, test_loss: 1.3047, test_f1: 0.6156
 epoch: 57, train_loss: 0.4721, test_loss: 1.4668, test_f1: 0.6230
 epoch: 58, train_loss: 0.4499, test_loss: 1.5050, test_f1: 0.5908
 epoch: 59, train_loss: 0.4599, test_loss: 1.4095, test_f1: 0.5954
 epoch: 60, train_loss: 0.4387, test_loss: 1.4253, test_f1: 0.6017
 epoch: 61, train_loss: 0.4358, test_loss: 1.4653, test_f1: 0.6030
 epoch: 62, train_loss: 0.4291, test_loss: 1.5381, test_f1: 0.5857
 epoch: 63, train_loss: 0.4353, test_loss: 1.6772, test_f1: 0.5697
 epoch: 64, train_loss: 0.4234, test_loss: 1.5577, test_f1: 0.6050
 epoch: 65, train_loss: 0.4146, test_loss: 1.5233, test_f1: 0.5774
 epoch: 66, train_loss: 0.4183, test_loss: 1.6081, test_f1: 0.6380
 epoch: 67, train_loss: 0.4245, test_loss: 1.5299, test_f1: 0.6497
 epoch: 68, train_loss: 0.4012, test_loss: 1.5109, test_f1: 0.6047
 epoch: 69, train_loss: 0.4016, test_loss: 1.5644, test_f1: 0.6209
 epoch: 70, train_loss: 0.3955, test_loss: 1.7488, test_f1: 0.5996
 epoch: 71, train_loss: 0.3774, test_loss: 1.6833, test_f1: 0.6275
 epoch: 72, train_loss: 0.3663, test_loss: 1.6178, test_f1: 0.6125
 epoch: 73, train_loss: 0.3951, test_loss: 1.7734, test_f1: 0.5948
 epoch: 74, train_loss: 0.4039, test_loss: 1.8527, test_f1: 0.6118
 epoch: 75, train_loss: 0.4016, test_loss: 2.1354, test_f1: 0.5776
 epoch: 76, train_loss: 0.3801, test_loss: 1.8142, test_f1: 0.6142
 epoch: 77, train_loss: 0.3778, test_loss: 1.7167, test_f1: 0.6098
 epoch: 78, train_loss: 0.3778, test_loss: 1.7531, test_f1: 0.6116
 epoch: 79, train_loss: 0.4075, test_loss: 1.6409, test_f1: 0.5947
 epoch: 80, train_loss: 0.3708, test_loss: 1.5905, test_f1: 0.5978
 epoch: 81, train_loss: 0.3604, test_loss: 1.7883, test_f1: 0.5784
 epoch: 82, train_loss: 0.3952, test_loss: 1.8682, test_f1: 0.5929
 epoch: 83, train_loss: 0.3751, test_loss: 1.7599, test_f1: 0.6379
 epoch: 84, train_loss: 0.3555, test_loss: 1.6746, test_f1: 0.6140
 epoch: 85, train_loss: 0.3439, test_loss: 1.7631, test_f1: 0.6044
 epoch: 86, train_loss: 0.3372, test_loss: 2.0217, test_f1: 0.5919
 epoch: 87, train_loss: 0.3300, test_loss: 1.8528, test_f1: 0.6016
 epoch: 88, train_loss: 0.3169, test_loss: 2.1427, test_f1: 0.5955
 epoch: 89, train_loss: 0.3189, test_loss: 2.5077, test_f1: 0.6106
 epoch: 90, train_loss: 0.3038, test_loss: 2.4222, test_f1: 0.5960
 epoch: 91, train_loss: 0.3215, test_loss: 2.3357, test_f1: 0.6107
 epoch: 92, train_loss: 0.3328, test_loss: 2.0479, test_f1: 0.5924
 epoch: 93, train_loss: 0.3177, test_loss: 2.1574, test_f1: 0.6195
 epoch: 94, train_loss: 0.3404, test_loss: 2.2513, test_f1: 0.5934
 epoch: 95, train_loss: 0.3345, test_loss: 2.0987, test_f1: 0.5949
 epoch: 96, train_loss: 0.3032, test_loss: 2.1907, test_f1: 0.6441
 epoch: 97, train_loss: 0.3254, test_loss: 1.9980, test_f1: 0.5916
 epoch: 98, train_loss: 0.3100, test_loss: 1.9870, test_f1: 0.5961
 epoch: 99, train_loss: 0.2863, test_loss: 2.2091, test_f1: 0.5952
##################ITERATION #1 ****************************************
 epoch: 0, train_loss: 1.2150, test_loss: 1.3162, test_f1: 0.1365
 epoch: 1, train_loss: 1.0695, test_loss: 1.2985, test_f1: 0.1365
 epoch: 2, train_loss: 1.0031, test_loss: 1.2613, test_f1: 0.1368
 epoch: 3, train_loss: 0.9793, test_loss: 1.1863, test_f1: 0.4003
 epoch: 4, train_loss: 0.9500, test_loss: 1.1329, test_f1: 0.4275
 epoch: 5, train_loss: 0.9210, test_loss: 1.0931, test_f1: 0.4419
 epoch: 6, train_loss: 0.8963, test_loss: 1.0579, test_f1: 0.4961
 epoch: 7, train_loss: 0.8794, test_loss: 1.0373, test_f1: 0.5297
 epoch: 8, train_loss: 0.8606, test_loss: 1.0095, test_f1: 0.5172
 epoch: 9, train_loss: 0.8358, test_loss: 1.0346, test_f1: 0.5222
 epoch: 10, train_loss: 0.8148, test_loss: 1.0612, test_f1: 0.5448
 epoch: 11, train_loss: 0.7798, test_loss: 1.0291, test_f1: 0.5792
 epoch: 12, train_loss: 0.7903, test_loss: 1.0860, test_f1: 0.4941
 epoch: 13, train_loss: 0.7822, test_loss: 1.0805, test_f1: 0.5629
 epoch: 14, train_loss: 0.7763, test_loss: 1.1270, test_f1: 0.5149
 epoch: 15, train_loss: 0.7588, test_loss: 1.2255, test_f1: 0.5577
 epoch: 16, train_loss: 0.7449, test_loss: 1.0917, test_f1: 0.5796
 epoch: 17, train_loss: 0.7300, test_loss: 1.0712, test_f1: 0.5773
 epoch: 18, train_loss: 0.7077, test_loss: 1.0135, test_f1: 0.5892
 epoch: 19, train_loss: 0.7244, test_loss: 1.0292, test_f1: 0.5714
 epoch: 20, train_loss: 0.7068, test_loss: 1.0409, test_f1: 0.6012
 epoch: 21, train_loss: 0.6820, test_loss: 1.0377, test_f1: 0.6068
 epoch: 22, train_loss: 0.6621, test_loss: 1.0614, test_f1: 0.6096
 epoch: 23, train_loss: 0.6425, test_loss: 1.0501, test_f1: 0.6003
 epoch: 24, train_loss: 0.6195, test_loss: 1.0723, test_f1: 0.5936
 epoch: 25, train_loss: 0.6186, test_loss: 1.2412, test_f1: 0.6287
 epoch: 26, train_loss: 0.6299, test_loss: 1.2128, test_f1: 0.5799
 epoch: 27, train_loss: 0.6283, test_loss: 1.3039, test_f1: 0.5349
 epoch: 28, train_loss: 0.6226, test_loss: 1.1625, test_f1: 0.5790
 epoch: 29, train_loss: 0.5763, test_loss: 1.0881, test_f1: 0.6145
 epoch: 30, train_loss: 0.5972, test_loss: 1.0948, test_f1: 0.5891
 epoch: 31, train_loss: 0.5786, test_loss: 1.1495, test_f1: 0.6201
 epoch: 32, train_loss: 0.5821, test_loss: 1.4684, test_f1: 0.5041
 epoch: 33, train_loss: 0.5761, test_loss: 1.2935, test_f1: 0.6167
 epoch: 34, train_loss: 0.5656, test_loss: 1.2933, test_f1: 0.5547
 epoch: 35, train_loss: 0.5587, test_loss: 1.2532, test_f1: 0.6407
 epoch: 36, train_loss: 0.5418, test_loss: 1.3679, test_f1: 0.5887
 epoch: 37, train_loss: 0.5388, test_loss: 1.1770, test_f1: 0.6106
 epoch: 38, train_loss: 0.5252, test_loss: 1.1685, test_f1: 0.6131
 epoch: 39, train_loss: 0.5036, test_loss: 1.3262, test_f1: 0.6049
 epoch: 40, train_loss: 0.5098, test_loss: 1.3973, test_f1: 0.6301
 epoch: 41, train_loss: 0.4919, test_loss: 1.2527, test_f1: 0.5977
 epoch: 42, train_loss: 0.4891, test_loss: 1.2848, test_f1: 0.6078
 epoch: 43, train_loss: 0.4758, test_loss: 1.5899, test_f1: 0.6232
 epoch: 44, train_loss: 0.4880, test_loss: 1.7982, test_f1: 0.5671
 epoch: 45, train_loss: 0.4725, test_loss: 1.4845, test_f1: 0.5977
 epoch: 46, train_loss: 0.4904, test_loss: 1.5966, test_f1: 0.6054
 epoch: 47, train_loss: 0.4835, test_loss: 1.3609, test_f1: 0.5976
 epoch: 48, train_loss: 0.4469, test_loss: 1.5314, test_f1: 0.5834
 epoch: 49, train_loss: 0.4424, test_loss: 1.5440, test_f1: 0.5886
 epoch: 50, train_loss: 0.4537, test_loss: 1.7124, test_f1: 0.6014
 epoch: 51, train_loss: 0.4279, test_loss: 1.5134, test_f1: 0.6076
 epoch: 52, train_loss: 0.4089, test_loss: 1.4434, test_f1: 0.6148
 epoch: 53, train_loss: 0.3904, test_loss: 1.3882, test_f1: 0.6072
 epoch: 54, train_loss: 0.3851, test_loss: 1.5046, test_f1: 0.6323
 epoch: 55, train_loss: 0.3770, test_loss: 1.5640, test_f1: 0.6473
 epoch: 56, train_loss: 0.3705, test_loss: 1.4574, test_f1: 0.6520
 epoch: 57, train_loss: 0.3817, test_loss: 1.6685, test_f1: 0.6305
 epoch: 58, train_loss: 0.3584, test_loss: 1.6623, test_f1: 0.6324
 epoch: 59, train_loss: 0.3763, test_loss: 1.6678, test_f1: 0.6195
 epoch: 60, train_loss: 0.3588, test_loss: 1.5299, test_f1: 0.6170
 epoch: 61, train_loss: 0.3422, test_loss: 1.5371, test_f1: 0.6290
 epoch: 62, train_loss: 0.3397, test_loss: 1.7013, test_f1: 0.6250
 epoch: 63, train_loss: 0.3174, test_loss: 1.6461, test_f1: 0.6298
 epoch: 64, train_loss: 0.3431, test_loss: 1.6721, test_f1: 0.6175
 epoch: 65, train_loss: 0.3067, test_loss: 1.7371, test_f1: 0.6163
 epoch: 66, train_loss: 0.3519, test_loss: 1.7102, test_f1: 0.5983
 epoch: 67, train_loss: 0.3232, test_loss: 1.8359, test_f1: 0.6186
 epoch: 68, train_loss: 0.3226, test_loss: 2.0218, test_f1: 0.5728
 epoch: 69, train_loss: 0.3319, test_loss: 2.0055, test_f1: 0.6097
 epoch: 70, train_loss: 0.3237, test_loss: 1.9035, test_f1: 0.6141
 epoch: 71, train_loss: 0.3362, test_loss: 1.9064, test_f1: 0.6142
 epoch: 72, train_loss: 0.3080, test_loss: 1.8577, test_f1: 0.6253
 epoch: 73, train_loss: 0.3111, test_loss: 1.9830, test_f1: 0.6354
 epoch: 74, train_loss: 0.3181, test_loss: 2.0290, test_f1: 0.6055
 epoch: 75, train_loss: 0.3346, test_loss: 1.8432, test_f1: 0.6299
 epoch: 76, train_loss: 0.2827, test_loss: 1.8920, test_f1: 0.6085
 epoch: 77, train_loss: 0.2863, test_loss: 2.0262, test_f1: 0.6132
 epoch: 78, train_loss: 0.2732, test_loss: 2.0612, test_f1: 0.5981
 epoch: 79, train_loss: 0.2962, test_loss: 1.9773, test_f1: 0.5949
 epoch: 80, train_loss: 0.2969, test_loss: 2.1421, test_f1: 0.5742
 epoch: 81, train_loss: 0.2752, test_loss: 1.9890, test_f1: 0.6361
 epoch: 82, train_loss: 0.2785, test_loss: 2.0125, test_f1: 0.6398
 epoch: 83, train_loss: 0.2851, test_loss: 1.9316, test_f1: 0.6156
 epoch: 84, train_loss: 0.2688, test_loss: 2.0044, test_f1: 0.6056
 epoch: 85, train_loss: 0.2790, test_loss: 2.0547, test_f1: 0.6249
 epoch: 86, train_loss: 0.2605, test_loss: 1.9082, test_f1: 0.6178
 epoch: 87, train_loss: 0.2736, test_loss: 1.9338, test_f1: 0.6063
 epoch: 88, train_loss: 0.2812, test_loss: 2.1943, test_f1: 0.6102
 epoch: 89, train_loss: 0.2741, test_loss: 2.0122, test_f1: 0.6213
 epoch: 90, train_loss: 0.2895, test_loss: 2.0800, test_f1: 0.6311
 epoch: 91, train_loss: 0.2801, test_loss: 1.9628, test_f1: 0.6261
 epoch: 92, train_loss: 0.2812, test_loss: 2.1447, test_f1: 0.6460
 epoch: 93, train_loss: 0.2715, test_loss: 2.2546, test_f1: 0.5949
 epoch: 94, train_loss: 0.2685, test_loss: 2.2155, test_f1: 0.6043
 epoch: 95, train_loss: 0.2622, test_loss: 2.0395, test_f1: 0.6232
 epoch: 96, train_loss: 0.2644, test_loss: 1.9661, test_f1: 0.6477
 epoch: 97, train_loss: 0.2537, test_loss: 1.8627, test_f1: 0.6273
 epoch: 98, train_loss: 0.2569, test_loss: 2.2796, test_f1: 0.5989
 epoch: 99, train_loss: 0.3076, test_loss: 2.4641, test_f1: 0.5664
##################ITERATION #2 ****************************************
 epoch: 0, train_loss: 1.2297, test_loss: 1.3175, test_f1: 0.1365
 epoch: 1, train_loss: 1.0528, test_loss: 1.2979, test_f1: 0.1365
 epoch: 2, train_loss: 0.9951, test_loss: 1.2529, test_f1: 0.2693
 epoch: 3, train_loss: 0.9559, test_loss: 1.2057, test_f1: 0.3811
 epoch: 4, train_loss: 0.9442, test_loss: 1.1785, test_f1: 0.4001
 epoch: 5, train_loss: 0.9238, test_loss: 1.1322, test_f1: 0.4680
 epoch: 6, train_loss: 0.8986, test_loss: 1.1237, test_f1: 0.4294
 epoch: 7, train_loss: 0.8889, test_loss: 1.1124, test_f1: 0.4524
 epoch: 8, train_loss: 0.8688, test_loss: 1.1091, test_f1: 0.5626
 epoch: 9, train_loss: 0.8648, test_loss: 1.0739, test_f1: 0.5732
 epoch: 10, train_loss: 0.8258, test_loss: 1.1067, test_f1: 0.5480
 epoch: 11, train_loss: 0.8198, test_loss: 1.0482, test_f1: 0.5829
 epoch: 12, train_loss: 0.8094, test_loss: 1.0794, test_f1: 0.5889
 epoch: 13, train_loss: 0.8275, test_loss: 1.0828, test_f1: 0.5475
 epoch: 14, train_loss: 0.7839, test_loss: 1.0023, test_f1: 0.6028
 epoch: 15, train_loss: 0.7704, test_loss: 1.0215, test_f1: 0.6044
 epoch: 16, train_loss: 0.7617, test_loss: 1.0343, test_f1: 0.5763
 epoch: 17, train_loss: 0.7591, test_loss: 1.0761, test_f1: 0.5788
 epoch: 18, train_loss: 0.7287, test_loss: 1.1119, test_f1: 0.5989
 epoch: 19, train_loss: 0.7417, test_loss: 1.1671, test_f1: 0.5905
 epoch: 20, train_loss: 0.7225, test_loss: 1.1432, test_f1: 0.5789
 epoch: 21, train_loss: 0.7246, test_loss: 1.0572, test_f1: 0.6186
 epoch: 22, train_loss: 0.7017, test_loss: 1.0372, test_f1: 0.6142
 epoch: 23, train_loss: 0.7017, test_loss: 1.0564, test_f1: 0.6185
 epoch: 24, train_loss: 0.6822, test_loss: 1.0815, test_f1: 0.5660
 epoch: 25, train_loss: 0.6695, test_loss: 1.1492, test_f1: 0.6120
 epoch: 26, train_loss: 0.6683, test_loss: 1.1306, test_f1: 0.6498
 epoch: 27, train_loss: 0.6727, test_loss: 1.1876, test_f1: 0.6005
 epoch: 28, train_loss: 0.6468, test_loss: 1.1438, test_f1: 0.6075
 epoch: 29, train_loss: 0.6420, test_loss: 1.2522, test_f1: 0.5474
 epoch: 30, train_loss: 0.6392, test_loss: 1.2015, test_f1: 0.5671
 epoch: 31, train_loss: 0.6218, test_loss: 1.2307, test_f1: 0.6090
 epoch: 32, train_loss: 0.6348, test_loss: 1.2630, test_f1: 0.5826
 epoch: 33, train_loss: 0.6231, test_loss: 1.1557, test_f1: 0.6184
 epoch: 34, train_loss: 0.6112, test_loss: 1.1640, test_f1: 0.6109
 epoch: 35, train_loss: 0.6078, test_loss: 1.2707, test_f1: 0.6219
 epoch: 36, train_loss: 0.5851, test_loss: 1.3200, test_f1: 0.5888
 epoch: 37, train_loss: 0.5894, test_loss: 1.2001, test_f1: 0.6231
 epoch: 38, train_loss: 0.5722, test_loss: 1.1753, test_f1: 0.5831
 epoch: 39, train_loss: 0.5860, test_loss: 1.1765, test_f1: 0.6179
 epoch: 40, train_loss: 0.6065, test_loss: 1.2377, test_f1: 0.6151
 epoch: 41, train_loss: 0.5762, test_loss: 1.4462, test_f1: 0.5980
 epoch: 42, train_loss: 0.5678, test_loss: 1.2832, test_f1: 0.5971
 epoch: 43, train_loss: 0.5513, test_loss: 1.2443, test_f1: 0.6095
 epoch: 44, train_loss: 0.5390, test_loss: 1.1770, test_f1: 0.6233
 epoch: 45, train_loss: 0.5143, test_loss: 1.2123, test_f1: 0.6523
 epoch: 46, train_loss: 0.5356, test_loss: 1.1725, test_f1: 0.6451
 epoch: 47, train_loss: 0.5032, test_loss: 1.2829, test_f1: 0.5703
 epoch: 48, train_loss: 0.4982, test_loss: 1.3492, test_f1: 0.6125
 epoch: 49, train_loss: 0.4928, test_loss: 1.5903, test_f1: 0.6086
 epoch: 50, train_loss: 0.4886, test_loss: 1.3711, test_f1: 0.6380
 epoch: 51, train_loss: 0.4739, test_loss: 1.2740, test_f1: 0.6464
 epoch: 52, train_loss: 0.4573, test_loss: 1.3171, test_f1: 0.6329
 epoch: 53, train_loss: 0.4655, test_loss: 1.3775, test_f1: 0.6164
 epoch: 54, train_loss: 0.4268, test_loss: 1.4455, test_f1: 0.6271
 epoch: 55, train_loss: 0.4348, test_loss: 1.4719, test_f1: 0.6151
 epoch: 56, train_loss: 0.4381, test_loss: 1.4677, test_f1: 0.6254
 epoch: 57, train_loss: 0.4120, test_loss: 1.5770, test_f1: 0.6029
 epoch: 58, train_loss: 0.4301, test_loss: 1.4284, test_f1: 0.6164
 epoch: 59, train_loss: 0.4001, test_loss: 1.4359, test_f1: 0.6243
 epoch: 60, train_loss: 0.4109, test_loss: 1.3707, test_f1: 0.6108
 epoch: 61, train_loss: 0.4162, test_loss: 1.5640, test_f1: 0.6334
 epoch: 62, train_loss: 0.3820, test_loss: 1.5064, test_f1: 0.6413
 epoch: 63, train_loss: 0.3836, test_loss: 1.6242, test_f1: 0.6415
 epoch: 64, train_loss: 0.4022, test_loss: 1.5705, test_f1: 0.6488
 epoch: 65, train_loss: 0.3710, test_loss: 1.5901, test_f1: 0.6365
 epoch: 66, train_loss: 0.3811, test_loss: 1.7469, test_f1: 0.6283
 epoch: 67, train_loss: 0.3867, test_loss: 1.6636, test_f1: 0.6488
 epoch: 68, train_loss: 0.3672, test_loss: 1.6312, test_f1: 0.6119
 epoch: 69, train_loss: 0.3587, test_loss: 1.5472, test_f1: 0.6171
 epoch: 70, train_loss: 0.3761, test_loss: 1.7442, test_f1: 0.6429
 epoch: 71, train_loss: 0.3508, test_loss: 1.6602, test_f1: 0.6209
 epoch: 72, train_loss: 0.3339, test_loss: 1.5692, test_f1: 0.6185
 epoch: 73, train_loss: 0.3425, test_loss: 1.6781, test_f1: 0.6470
 epoch: 74, train_loss: 0.3348, test_loss: 1.6704, test_f1: 0.6237
 epoch: 75, train_loss: 0.3491, test_loss: 1.7574, test_f1: 0.6254
 epoch: 76, train_loss: 0.3403, test_loss: 1.9306, test_f1: 0.6471
 epoch: 77, train_loss: 0.3476, test_loss: 1.8047, test_f1: 0.6476
 epoch: 78, train_loss: 0.3573, test_loss: 1.6348, test_f1: 0.6522
 epoch: 79, train_loss: 0.3546, test_loss: 1.8967, test_f1: 0.6695
 epoch: 80, train_loss: 0.3419, test_loss: 1.7756, test_f1: 0.6235
 epoch: 81, train_loss: 0.3332, test_loss: 1.7236, test_f1: 0.6163
 epoch: 82, train_loss: 0.3243, test_loss: 1.7715, test_f1: 0.6415
 epoch: 83, train_loss: 0.3617, test_loss: 1.8660, test_f1: 0.6488
 epoch: 84, train_loss: 0.3202, test_loss: 1.9420, test_f1: 0.6606
 epoch: 85, train_loss: 0.3331, test_loss: 2.0039, test_f1: 0.6544
 epoch: 86, train_loss: 0.3381, test_loss: 1.8024, test_f1: 0.6269
 epoch: 87, train_loss: 0.3255, test_loss: 1.9478, test_f1: 0.6042
 epoch: 88, train_loss: 0.2976, test_loss: 1.9028, test_f1: 0.6382
 epoch: 89, train_loss: 0.2978, test_loss: 2.0198, test_f1: 0.6375
 epoch: 90, train_loss: 0.3149, test_loss: 2.0033, test_f1: 0.6325
 epoch: 91, train_loss: 0.3220, test_loss: 1.8226, test_f1: 0.6315
 epoch: 92, train_loss: 0.3136, test_loss: 1.7585, test_f1: 0.6612
 epoch: 93, train_loss: 0.3058, test_loss: 1.8607, test_f1: 0.6756
 epoch: 94, train_loss: 0.2919, test_loss: 1.9331, test_f1: 0.6340
 epoch: 95, train_loss: 0.2870, test_loss: 1.8664, test_f1: 0.6585
 epoch: 96, train_loss: 0.3109, test_loss: 1.8896, test_f1: 0.6318
 epoch: 97, train_loss: 0.3290, test_loss: 1.9486, test_f1: 0.6184
 epoch: 98, train_loss: 0.3223, test_loss: 1.9078, test_f1: 0.6379
 epoch: 99, train_loss: 0.3222, test_loss: 2.0862, test_f1: 0.6246
##################ITERATION #3 ****************************************
 epoch: 0, train_loss: 1.2221, test_loss: 1.3038, test_f1: 0.1365
 epoch: 1, train_loss: 1.0371, test_loss: 1.2999, test_f1: 0.1365
 epoch: 2, train_loss: 0.9979, test_loss: 1.2318, test_f1: 0.2018
 epoch: 3, train_loss: 0.9727, test_loss: 1.1880, test_f1: 0.4126
 epoch: 4, train_loss: 0.9233, test_loss: 1.1707, test_f1: 0.3804
 epoch: 5, train_loss: 0.9019, test_loss: 1.1577, test_f1: 0.4046
 epoch: 6, train_loss: 0.8845, test_loss: 1.1167, test_f1: 0.4596
 epoch: 7, train_loss: 0.8514, test_loss: 1.0986, test_f1: 0.5130
 epoch: 8, train_loss: 0.8747, test_loss: 1.0941, test_f1: 0.4983
 epoch: 9, train_loss: 0.8487, test_loss: 1.1098, test_f1: 0.5258
 epoch: 10, train_loss: 0.8133, test_loss: 1.0920, test_f1: 0.5414
 epoch: 11, train_loss: 0.8113, test_loss: 1.1124, test_f1: 0.5468
 epoch: 12, train_loss: 0.7867, test_loss: 1.0708, test_f1: 0.5672
 epoch: 13, train_loss: 0.7925, test_loss: 1.0936, test_f1: 0.5584
 epoch: 14, train_loss: 0.7684, test_loss: 1.1250, test_f1: 0.5636
 epoch: 15, train_loss: 0.7543, test_loss: 1.0828, test_f1: 0.5868
 epoch: 16, train_loss: 0.7418, test_loss: 1.0792, test_f1: 0.6225
 epoch: 17, train_loss: 0.7237, test_loss: 1.0588, test_f1: 0.5869
 epoch: 18, train_loss: 0.7112, test_loss: 1.1938, test_f1: 0.5193
 epoch: 19, train_loss: 0.7044, test_loss: 1.1467, test_f1: 0.5864
 epoch: 20, train_loss: 0.7099, test_loss: 1.1345, test_f1: 0.5567
 epoch: 21, train_loss: 0.6920, test_loss: 1.1804, test_f1: 0.5840
 epoch: 22, train_loss: 0.6677, test_loss: 1.1698, test_f1: 0.5869
 epoch: 23, train_loss: 0.6487, test_loss: 1.1632, test_f1: 0.5957
 epoch: 24, train_loss: 0.6545, test_loss: 1.0976, test_f1: 0.6172
 epoch: 25, train_loss: 0.6502, test_loss: 1.2149, test_f1: 0.6210
 epoch: 26, train_loss: 0.6427, test_loss: 1.1271, test_f1: 0.5728
 epoch: 27, train_loss: 0.6410, test_loss: 1.0780, test_f1: 0.6139
 epoch: 28, train_loss: 0.6343, test_loss: 1.2302, test_f1: 0.6251
 epoch: 29, train_loss: 0.6150, test_loss: 1.1205, test_f1: 0.6376
 epoch: 30, train_loss: 0.6177, test_loss: 1.2499, test_f1: 0.5823
 epoch: 31, train_loss: 0.6080, test_loss: 1.2418, test_f1: 0.5730
 epoch: 32, train_loss: 0.6005, test_loss: 1.3427, test_f1: 0.5651
 epoch: 33, train_loss: 0.5876, test_loss: 1.4216, test_f1: 0.5431
 epoch: 34, train_loss: 0.5914, test_loss: 1.2493, test_f1: 0.5604
 epoch: 35, train_loss: 0.5748, test_loss: 1.4228, test_f1: 0.5734
 epoch: 36, train_loss: 0.5479, test_loss: 1.4226, test_f1: 0.5519
 epoch: 37, train_loss: 0.5262, test_loss: 1.3960, test_f1: 0.5664
 epoch: 38, train_loss: 0.5424, test_loss: 1.2593, test_f1: 0.6076
 epoch: 39, train_loss: 0.5517, test_loss: 1.4148, test_f1: 0.5999
 epoch: 40, train_loss: 0.5599, test_loss: 1.4496, test_f1: 0.5686
 epoch: 41, train_loss: 0.5322, test_loss: 1.2809, test_f1: 0.6046
 epoch: 42, train_loss: 0.5025, test_loss: 1.3242, test_f1: 0.5820
 epoch: 43, train_loss: 0.5400, test_loss: 1.5060, test_f1: 0.5892
 epoch: 44, train_loss: 0.5384, test_loss: 1.3854, test_f1: 0.5911
 epoch: 45, train_loss: 0.5599, test_loss: 1.3194, test_f1: 0.5474
 epoch: 46, train_loss: 0.5335, test_loss: 1.3789, test_f1: 0.5447
 epoch: 47, train_loss: 0.5067, test_loss: 1.3442, test_f1: 0.5975
 epoch: 48, train_loss: 0.5029, test_loss: 1.5463, test_f1: 0.5982
 epoch: 49, train_loss: 0.4633, test_loss: 1.4678, test_f1: 0.6057
 epoch: 50, train_loss: 0.4536, test_loss: 1.5654, test_f1: 0.5869
 epoch: 51, train_loss: 0.4369, test_loss: 1.5394, test_f1: 0.6006
 epoch: 52, train_loss: 0.4269, test_loss: 1.5529, test_f1: 0.6004
 epoch: 53, train_loss: 0.4156, test_loss: 1.5901, test_f1: 0.5840
 epoch: 54, train_loss: 0.4223, test_loss: 1.5976, test_f1: 0.5919
 epoch: 55, train_loss: 0.4051, test_loss: 1.5846, test_f1: 0.5766
 epoch: 56, train_loss: 0.4303, test_loss: 1.5856, test_f1: 0.5899
 epoch: 57, train_loss: 0.4105, test_loss: 1.6443, test_f1: 0.6083
 epoch: 58, train_loss: 0.4039, test_loss: 1.7518, test_f1: 0.6072
 epoch: 59, train_loss: 0.4030, test_loss: 1.7565, test_f1: 0.5742
 epoch: 60, train_loss: 0.3979, test_loss: 1.6043, test_f1: 0.5667
 epoch: 61, train_loss: 0.4311, test_loss: 1.6134, test_f1: 0.6005
 epoch: 62, train_loss: 0.3994, test_loss: 1.6061, test_f1: 0.5813
 epoch: 63, train_loss: 0.3776, test_loss: 1.5572, test_f1: 0.6018
 epoch: 64, train_loss: 0.3794, test_loss: 1.6081, test_f1: 0.5860
 epoch: 65, train_loss: 0.3701, test_loss: 1.7853, test_f1: 0.5972
 epoch: 66, train_loss: 0.3678, test_loss: 1.8320, test_f1: 0.5822
 epoch: 67, train_loss: 0.3495, test_loss: 1.8884, test_f1: 0.5877
 epoch: 68, train_loss: 0.3347, test_loss: 1.9454, test_f1: 0.5742
 epoch: 69, train_loss: 0.3471, test_loss: 1.7916, test_f1: 0.5832
 epoch: 70, train_loss: 0.3371, test_loss: 1.8309, test_f1: 0.5986
 epoch: 71, train_loss: 0.3276, test_loss: 2.0170, test_f1: 0.5843
 epoch: 72, train_loss: 0.3509, test_loss: 1.9041, test_f1: 0.5849
 epoch: 73, train_loss: 0.3405, test_loss: 1.7405, test_f1: 0.5743
 epoch: 74, train_loss: 0.3565, test_loss: 1.8244, test_f1: 0.5866
 epoch: 75, train_loss: 0.3402, test_loss: 1.7670, test_f1: 0.6010
 epoch: 76, train_loss: 0.3298, test_loss: 1.7517, test_f1: 0.5803
 epoch: 77, train_loss: 0.3171, test_loss: 1.6970, test_f1: 0.5961
 epoch: 78, train_loss: 0.2969, test_loss: 1.6566, test_f1: 0.5841
 epoch: 79, train_loss: 0.3062, test_loss: 1.8169, test_f1: 0.5943
 epoch: 80, train_loss: 0.3273, test_loss: 1.8841, test_f1: 0.5872
 epoch: 81, train_loss: 0.3118, test_loss: 1.9783, test_f1: 0.5780
 epoch: 82, train_loss: 0.3030, test_loss: 1.8681, test_f1: 0.6036
 epoch: 83, train_loss: 0.3032, test_loss: 1.8896, test_f1: 0.5958
 epoch: 84, train_loss: 0.2915, test_loss: 1.8414, test_f1: 0.6199
 epoch: 85, train_loss: 0.2777, test_loss: 1.8411, test_f1: 0.5848
 epoch: 86, train_loss: 0.3110, test_loss: 1.9227, test_f1: 0.5858
 epoch: 87, train_loss: 0.2747, test_loss: 1.8392, test_f1: 0.5917
 epoch: 88, train_loss: 0.2696, test_loss: 2.0717, test_f1: 0.5930
 epoch: 89, train_loss: 0.2682, test_loss: 2.1271, test_f1: 0.5757
 epoch: 90, train_loss: 0.2822, test_loss: 2.0295, test_f1: 0.5731
 epoch: 91, train_loss: 0.2687, test_loss: 2.2043, test_f1: 0.5938
 epoch: 92, train_loss: 0.2827, test_loss: 2.0980, test_f1: 0.5934
 epoch: 93, train_loss: 0.2668, test_loss: 1.9694, test_f1: 0.5816
 epoch: 94, train_loss: 0.2625, test_loss: 1.9577, test_f1: 0.5975
 epoch: 95, train_loss: 0.2925, test_loss: 1.9713, test_f1: 0.5667
 epoch: 96, train_loss: 0.2894, test_loss: 2.0105, test_f1: 0.5893
 epoch: 97, train_loss: 0.3624, test_loss: 2.0489, test_f1: 0.6071
 epoch: 98, train_loss: 0.3575, test_loss: 2.0946, test_f1: 0.5883
 epoch: 99, train_loss: 0.3159, test_loss: 2.1524, test_f1: 0.6048
##################ITERATION #4 ****************************************
 epoch: 0, train_loss: 1.2501, test_loss: 1.3397, test_f1: 0.1365
 epoch: 1, train_loss: 1.0851, test_loss: 1.3458, test_f1: 0.1365
 epoch: 2, train_loss: 1.0335, test_loss: 1.2911, test_f1: 0.1469
 epoch: 3, train_loss: 0.9710, test_loss: 1.2286, test_f1: 0.3588
 epoch: 4, train_loss: 0.9538, test_loss: 1.1464, test_f1: 0.4761
 epoch: 5, train_loss: 0.9450, test_loss: 1.1172, test_f1: 0.4102
 epoch: 6, train_loss: 0.9080, test_loss: 1.0749, test_f1: 0.4735
 epoch: 7, train_loss: 0.8769, test_loss: 1.0580, test_f1: 0.4726
 epoch: 8, train_loss: 0.8459, test_loss: 1.0857, test_f1: 0.4588
 epoch: 9, train_loss: 0.8536, test_loss: 1.0461, test_f1: 0.6174
 epoch: 10, train_loss: 0.8428, test_loss: 1.0498, test_f1: 0.5852
 epoch: 11, train_loss: 0.8144, test_loss: 1.0146, test_f1: 0.5942
 epoch: 12, train_loss: 0.8070, test_loss: 1.0411, test_f1: 0.5977
 epoch: 13, train_loss: 0.7866, test_loss: 1.0290, test_f1: 0.6133
 epoch: 14, train_loss: 0.7835, test_loss: 0.9954, test_f1: 0.5727
 epoch: 15, train_loss: 0.7506, test_loss: 1.0032, test_f1: 0.6188
 epoch: 16, train_loss: 0.7572, test_loss: 1.0052, test_f1: 0.6135
 epoch: 17, train_loss: 0.7533, test_loss: 1.0114, test_f1: 0.6178
 epoch: 18, train_loss: 0.7454, test_loss: 1.0063, test_f1: 0.6170
 epoch: 19, train_loss: 0.7385, test_loss: 1.0514, test_f1: 0.5894
 epoch: 20, train_loss: 0.7019, test_loss: 1.0863, test_f1: 0.6078
 epoch: 21, train_loss: 0.6933, test_loss: 1.0361, test_f1: 0.5938
 epoch: 22, train_loss: 0.7083, test_loss: 1.0782, test_f1: 0.6055
 epoch: 23, train_loss: 0.6785, test_loss: 1.0037, test_f1: 0.6493
 epoch: 24, train_loss: 0.6665, test_loss: 1.0877, test_f1: 0.5698
 epoch: 25, train_loss: 0.6943, test_loss: 1.2588, test_f1: 0.5420
 epoch: 26, train_loss: 0.6820, test_loss: 1.0658, test_f1: 0.6482
 epoch: 27, train_loss: 0.6614, test_loss: 1.0896, test_f1: 0.6238
 epoch: 28, train_loss: 0.6398, test_loss: 1.0485, test_f1: 0.6578
 epoch: 29, train_loss: 0.6227, test_loss: 1.0639, test_f1: 0.6101
 epoch: 30, train_loss: 0.6315, test_loss: 1.0270, test_f1: 0.6233
 epoch: 31, train_loss: 0.6246, test_loss: 1.0140, test_f1: 0.5978
 epoch: 32, train_loss: 0.6257, test_loss: 1.0617, test_f1: 0.6362
 epoch: 33, train_loss: 0.6436, test_loss: 1.1703, test_f1: 0.6036
 epoch: 34, train_loss: 0.6377, test_loss: 1.0963, test_f1: 0.6290
 epoch: 35, train_loss: 0.6238, test_loss: 1.1558, test_f1: 0.6272
 epoch: 36, train_loss: 0.6081, test_loss: 1.0966, test_f1: 0.6408
 epoch: 37, train_loss: 0.6064, test_loss: 1.1550, test_f1: 0.6377
 epoch: 38, train_loss: 0.6034, test_loss: 1.1746, test_f1: 0.6315
 epoch: 39, train_loss: 0.5648, test_loss: 1.1835, test_f1: 0.6289
 epoch: 40, train_loss: 0.5743, test_loss: 1.1180, test_f1: 0.6276
 epoch: 41, train_loss: 0.5768, test_loss: 1.4459, test_f1: 0.6134
 epoch: 42, train_loss: 0.5954, test_loss: 1.2257, test_f1: 0.6313
 epoch: 43, train_loss: 0.5717, test_loss: 1.1580, test_f1: 0.6219
 epoch: 44, train_loss: 0.5662, test_loss: 1.2191, test_f1: 0.6550
 epoch: 45, train_loss: 0.5626, test_loss: 1.2020, test_f1: 0.6518
 epoch: 46, train_loss: 0.5344, test_loss: 1.3152, test_f1: 0.6159
 epoch: 47, train_loss: 0.5229, test_loss: 1.1184, test_f1: 0.6452
 epoch: 48, train_loss: 0.5357, test_loss: 1.1820, test_f1: 0.6194
 epoch: 49, train_loss: 0.5052, test_loss: 1.2353, test_f1: 0.6451
 epoch: 50, train_loss: 0.5099, test_loss: 1.2573, test_f1: 0.6440
 epoch: 51, train_loss: 0.4931, test_loss: 1.2719, test_f1: 0.6460
 epoch: 52, train_loss: 0.4861, test_loss: 1.2526, test_f1: 0.6583
 epoch: 53, train_loss: 0.4895, test_loss: 1.3197, test_f1: 0.6503
 epoch: 54, train_loss: 0.4666, test_loss: 1.2421, test_f1: 0.6544
 epoch: 55, train_loss: 0.4699, test_loss: 1.2564, test_f1: 0.6523
 epoch: 56, train_loss: 0.4569, test_loss: 1.1807, test_f1: 0.6590
 epoch: 57, train_loss: 0.4792, test_loss: 1.1520, test_f1: 0.6715
 epoch: 58, train_loss: 0.4514, test_loss: 1.3461, test_f1: 0.6319
 epoch: 59, train_loss: 0.4332, test_loss: 1.2879, test_f1: 0.6509
 epoch: 60, train_loss: 0.4444, test_loss: 1.2494, test_f1: 0.6795
 epoch: 61, train_loss: 0.4131, test_loss: 1.3752, test_f1: 0.6507
 epoch: 62, train_loss: 0.4081, test_loss: 1.4047, test_f1: 0.6594
 epoch: 63, train_loss: 0.4226, test_loss: 1.3901, test_f1: 0.6268
 epoch: 64, train_loss: 0.4242, test_loss: 1.3182, test_f1: 0.6542
 epoch: 65, train_loss: 0.4319, test_loss: 1.3406, test_f1: 0.6488
 epoch: 66, train_loss: 0.4141, test_loss: 1.3406, test_f1: 0.6436
 epoch: 67, train_loss: 0.4043, test_loss: 1.3009, test_f1: 0.6233
 epoch: 68, train_loss: 0.4100, test_loss: 1.2904, test_f1: 0.6261
 epoch: 69, train_loss: 0.3968, test_loss: 1.4612, test_f1: 0.6113
 epoch: 70, train_loss: 0.4075, test_loss: 1.6066, test_f1: 0.6285
 epoch: 71, train_loss: 0.4180, test_loss: 1.2925, test_f1: 0.6737
 epoch: 72, train_loss: 0.4110, test_loss: 1.2597, test_f1: 0.6232
 epoch: 73, train_loss: 0.3936, test_loss: 1.2633, test_f1: 0.6399
 epoch: 74, train_loss: 0.4113, test_loss: 1.3247, test_f1: 0.6419
 epoch: 75, train_loss: 0.3874, test_loss: 1.3823, test_f1: 0.6376
 epoch: 76, train_loss: 0.3862, test_loss: 1.3454, test_f1: 0.6502
 epoch: 77, train_loss: 0.3770, test_loss: 1.4190, test_f1: 0.6394
 epoch: 78, train_loss: 0.3777, test_loss: 1.5530, test_f1: 0.6265
 epoch: 79, train_loss: 0.3526, test_loss: 1.5119, test_f1: 0.6195
 epoch: 80, train_loss: 0.3563, test_loss: 1.4677, test_f1: 0.6407
 epoch: 81, train_loss: 0.3339, test_loss: 1.4664, test_f1: 0.6440
 epoch: 82, train_loss: 0.3541, test_loss: 1.5831, test_f1: 0.6467
 epoch: 83, train_loss: 0.3509, test_loss: 1.5787, test_f1: 0.5957
 epoch: 84, train_loss: 0.3415, test_loss: 1.5498, test_f1: 0.6333
 epoch: 85, train_loss: 0.3388, test_loss: 1.4566, test_f1: 0.6298
 epoch: 86, train_loss: 0.3520, test_loss: 1.6196, test_f1: 0.6154
 epoch: 87, train_loss: 0.3569, test_loss: 1.5446, test_f1: 0.6214
 epoch: 88, train_loss: 0.3307, test_loss: 1.5297, test_f1: 0.6171
 epoch: 89, train_loss: 0.3273, test_loss: 1.5992, test_f1: 0.6382
 epoch: 90, train_loss: 0.3310, test_loss: 1.6258, test_f1: 0.6341
 epoch: 91, train_loss: 0.3164, test_loss: 1.6974, test_f1: 0.6263
 epoch: 92, train_loss: 0.2966, test_loss: 1.6192, test_f1: 0.6439
 epoch: 93, train_loss: 0.3026, test_loss: 1.6337, test_f1: 0.6427
 epoch: 94, train_loss: 0.3103, test_loss: 1.7386, test_f1: 0.6192
 epoch: 95, train_loss: 0.3172, test_loss: 1.6332, test_f1: 0.6178
 epoch: 96, train_loss: 0.3089, test_loss: 1.7623, test_f1: 0.6159
 epoch: 97, train_loss: 0.3253, test_loss: 1.6872, test_f1: 0.6233
 epoch: 98, train_loss: 0.3325, test_loss: 1.5910, test_f1: 0.6480
 epoch: 99, train_loss: 0.3011, test_loss: 1.6570, test_f1: 0.6362
##################ITERATION #5 ****************************************
 epoch: 0, train_loss: 1.3017, test_loss: 1.3747, test_f1: 0.1365
 epoch: 1, train_loss: 1.0566, test_loss: 1.3236, test_f1: 0.1680
 epoch: 2, train_loss: 1.0202, test_loss: 1.2999, test_f1: 0.2400
 epoch: 3, train_loss: 0.9542, test_loss: 1.2421, test_f1: 0.3962
 epoch: 4, train_loss: 0.9335, test_loss: 1.1475, test_f1: 0.4154
 epoch: 5, train_loss: 0.9361, test_loss: 1.1301, test_f1: 0.4323
 epoch: 6, train_loss: 0.8820, test_loss: 1.0697, test_f1: 0.5035
 epoch: 7, train_loss: 0.8860, test_loss: 1.0672, test_f1: 0.5303
 epoch: 8, train_loss: 0.8310, test_loss: 1.0833, test_f1: 0.4976
 epoch: 9, train_loss: 0.8205, test_loss: 1.0403, test_f1: 0.5661
 epoch: 10, train_loss: 0.8211, test_loss: 1.0298, test_f1: 0.5762
 epoch: 11, train_loss: 0.8076, test_loss: 1.0766, test_f1: 0.5681
 epoch: 12, train_loss: 0.7806, test_loss: 1.0944, test_f1: 0.5803
 epoch: 13, train_loss: 0.7753, test_loss: 1.1339, test_f1: 0.5489
 epoch: 14, train_loss: 0.7728, test_loss: 1.1330, test_f1: 0.5385
 epoch: 15, train_loss: 0.7627, test_loss: 1.1623, test_f1: 0.5511
 epoch: 16, train_loss: 0.7449, test_loss: 1.0924, test_f1: 0.5832
 epoch: 17, train_loss: 0.7385, test_loss: 1.0881, test_f1: 0.5880
 epoch: 18, train_loss: 0.7141, test_loss: 1.0542, test_f1: 0.5795
 epoch: 19, train_loss: 0.7279, test_loss: 1.1706, test_f1: 0.5919
 epoch: 20, train_loss: 0.7419, test_loss: 1.1820, test_f1: 0.5845
 epoch: 21, train_loss: 0.7217, test_loss: 1.2986, test_f1: 0.5629
 epoch: 22, train_loss: 0.7002, test_loss: 1.1747, test_f1: 0.5899
 epoch: 23, train_loss: 0.7068, test_loss: 1.0919, test_f1: 0.5810
 epoch: 24, train_loss: 0.6825, test_loss: 1.0994, test_f1: 0.5707
 epoch: 25, train_loss: 0.6974, test_loss: 1.0733, test_f1: 0.6166
 epoch: 26, train_loss: 0.6614, test_loss: 1.0659, test_f1: 0.6314
 epoch: 27, train_loss: 0.6524, test_loss: 1.2030, test_f1: 0.6085
 epoch: 28, train_loss: 0.6474, test_loss: 1.2164, test_f1: 0.6107
 epoch: 29, train_loss: 0.6197, test_loss: 1.2378, test_f1: 0.6396
 epoch: 30, train_loss: 0.6223, test_loss: 1.1692, test_f1: 0.5628
 epoch: 31, train_loss: 0.6218, test_loss: 1.3278, test_f1: 0.5803
 epoch: 32, train_loss: 0.6490, test_loss: 1.2043, test_f1: 0.6163
 epoch: 33, train_loss: 0.6026, test_loss: 1.2506, test_f1: 0.5714
 epoch: 34, train_loss: 0.6076, test_loss: 1.1674, test_f1: 0.6233
 epoch: 35, train_loss: 0.6062, test_loss: 1.0830, test_f1: 0.6217
 epoch: 36, train_loss: 0.5893, test_loss: 1.1996, test_f1: 0.6049
 epoch: 37, train_loss: 0.5926, test_loss: 1.3218, test_f1: 0.6005
 epoch: 38, train_loss: 0.5696, test_loss: 1.3070, test_f1: 0.5713
 epoch: 39, train_loss: 0.5664, test_loss: 1.4121, test_f1: 0.5678
 epoch: 40, train_loss: 0.5559, test_loss: 1.3059, test_f1: 0.6013
 epoch: 41, train_loss: 0.5798, test_loss: 1.2470, test_f1: 0.5765
 epoch: 42, train_loss: 0.5869, test_loss: 1.1542, test_f1: 0.6099
 epoch: 43, train_loss: 0.5759, test_loss: 1.2017, test_f1: 0.6297
 epoch: 44, train_loss: 0.5522, test_loss: 1.2799, test_f1: 0.6389
 epoch: 45, train_loss: 0.5531, test_loss: 1.2287, test_f1: 0.6165
 epoch: 46, train_loss: 0.5290, test_loss: 1.3344, test_f1: 0.6017
 epoch: 47, train_loss: 0.5114, test_loss: 1.2827, test_f1: 0.6174
 epoch: 48, train_loss: 0.4854, test_loss: 1.3219, test_f1: 0.6318
 epoch: 49, train_loss: 0.4810, test_loss: 1.3140, test_f1: 0.6003
 epoch: 50, train_loss: 0.5041, test_loss: 1.3416, test_f1: 0.5924
 epoch: 51, train_loss: 0.4924, test_loss: 1.3100, test_f1: 0.6377
 epoch: 52, train_loss: 0.4450, test_loss: 1.3199, test_f1: 0.6128
 epoch: 53, train_loss: 0.4624, test_loss: 1.3416, test_f1: 0.6082
 epoch: 54, train_loss: 0.4365, test_loss: 1.4009, test_f1: 0.5836
 epoch: 55, train_loss: 0.4502, test_loss: 1.4033, test_f1: 0.6149
 epoch: 56, train_loss: 0.4490, test_loss: 1.3706, test_f1: 0.6137
 epoch: 57, train_loss: 0.4317, test_loss: 1.3736, test_f1: 0.6201
 epoch: 58, train_loss: 0.4437, test_loss: 1.4066, test_f1: 0.5943
 epoch: 59, train_loss: 0.4465, test_loss: 1.3431, test_f1: 0.6089
 epoch: 60, train_loss: 0.4316, test_loss: 1.4564, test_f1: 0.6064
 epoch: 61, train_loss: 0.4343, test_loss: 1.4266, test_f1: 0.5891
 epoch: 62, train_loss: 0.4123, test_loss: 1.3905, test_f1: 0.5587
 epoch: 63, train_loss: 0.4038, test_loss: 1.4282, test_f1: 0.6096
 epoch: 64, train_loss: 0.3992, test_loss: 1.5522, test_f1: 0.6023
 epoch: 65, train_loss: 0.3985, test_loss: 1.4848, test_f1: 0.6111
 epoch: 66, train_loss: 0.3956, test_loss: 1.5696, test_f1: 0.6195
 epoch: 67, train_loss: 0.3884, test_loss: 1.5316, test_f1: 0.6159
 epoch: 68, train_loss: 0.3869, test_loss: 1.5694, test_f1: 0.6108
 epoch: 69, train_loss: 0.3984, test_loss: 1.5283, test_f1: 0.6029
 epoch: 70, train_loss: 0.3725, test_loss: 1.5375, test_f1: 0.5744
 epoch: 71, train_loss: 0.3607, test_loss: 1.5725, test_f1: 0.5959
 epoch: 72, train_loss: 0.3760, test_loss: 1.4953, test_f1: 0.6132
 epoch: 73, train_loss: 0.3877, test_loss: 1.5810, test_f1: 0.6168
 epoch: 74, train_loss: 0.3939, test_loss: 1.5897, test_f1: 0.6165
 epoch: 75, train_loss: 0.4060, test_loss: 1.6102, test_f1: 0.6065
 epoch: 76, train_loss: 0.3949, test_loss: 1.6250, test_f1: 0.5802
 epoch: 77, train_loss: 0.3848, test_loss: 1.6503, test_f1: 0.5921
 epoch: 78, train_loss: 0.3852, test_loss: 1.6033, test_f1: 0.5922
 epoch: 79, train_loss: 0.3607, test_loss: 1.5989, test_f1: 0.6086
 epoch: 80, train_loss: 0.3321, test_loss: 1.5942, test_f1: 0.6024
 epoch: 81, train_loss: 0.3575, test_loss: 1.6156, test_f1: 0.5897
 epoch: 82, train_loss: 0.3387, test_loss: 1.6467, test_f1: 0.5924
 epoch: 83, train_loss: 0.3329, test_loss: 1.7365, test_f1: 0.5944
 epoch: 84, train_loss: 0.3403, test_loss: 1.8492, test_f1: 0.6284
 epoch: 85, train_loss: 0.3445, test_loss: 1.7255, test_f1: 0.6139
 epoch: 86, train_loss: 0.3705, test_loss: 1.8858, test_f1: 0.5974
 epoch: 87, train_loss: 0.3779, test_loss: 1.7631, test_f1: 0.5896
 epoch: 88, train_loss: 0.3553, test_loss: 1.8371, test_f1: 0.5946
 epoch: 89, train_loss: 0.3339, test_loss: 1.7186, test_f1: 0.5944
 epoch: 90, train_loss: 0.3420, test_loss: 1.7022, test_f1: 0.6186
 epoch: 91, train_loss: 0.3619, test_loss: 1.6992, test_f1: 0.6170
 epoch: 92, train_loss: 0.3229, test_loss: 1.7238, test_f1: 0.6001
 epoch: 93, train_loss: 0.3230, test_loss: 1.6864, test_f1: 0.5973
 epoch: 94, train_loss: 0.3043, test_loss: 1.8316, test_f1: 0.5975
 epoch: 95, train_loss: 0.3151, test_loss: 1.8439, test_f1: 0.6174
 epoch: 96, train_loss: 0.2950, test_loss: 1.6130, test_f1: 0.6314
 epoch: 97, train_loss: 0.2978, test_loss: 1.9861, test_f1: 0.5916
 epoch: 98, train_loss: 0.2959, test_loss: 2.0659, test_f1: 0.5732
 epoch: 99, train_loss: 0.2898, test_loss: 1.9771, test_f1: 0.5969
##################ITERATION #6 ****************************************
 epoch: 0, train_loss: 1.3776, test_loss: 1.3754, test_f1: 0.1365
 epoch: 1, train_loss: 1.0631, test_loss: 1.3217, test_f1: 0.1365
 epoch: 2, train_loss: 1.0129, test_loss: 1.2640, test_f1: 0.2427
 epoch: 3, train_loss: 0.9734, test_loss: 1.1851, test_f1: 0.4060
 epoch: 4, train_loss: 0.9441, test_loss: 1.1312, test_f1: 0.4383
 epoch: 5, train_loss: 0.9106, test_loss: 1.1171, test_f1: 0.4601
 epoch: 6, train_loss: 0.8888, test_loss: 1.1067, test_f1: 0.4669
 epoch: 7, train_loss: 0.8739, test_loss: 1.0918, test_f1: 0.5310
 epoch: 8, train_loss: 0.8721, test_loss: 1.1340, test_f1: 0.5480
 epoch: 9, train_loss: 0.8637, test_loss: 1.0924, test_f1: 0.5636
 epoch: 10, train_loss: 0.8593, test_loss: 1.0308, test_f1: 0.5788
 epoch: 11, train_loss: 0.8434, test_loss: 1.0510, test_f1: 0.5774
 epoch: 12, train_loss: 0.8272, test_loss: 1.0752, test_f1: 0.5633
 epoch: 13, train_loss: 0.8277, test_loss: 1.0240, test_f1: 0.5882
 epoch: 14, train_loss: 0.7912, test_loss: 1.0740, test_f1: 0.5096
 epoch: 15, train_loss: 0.8115, test_loss: 1.0321, test_f1: 0.5631
 epoch: 16, train_loss: 0.7728, test_loss: 1.0369, test_f1: 0.5729
 epoch: 17, train_loss: 0.7834, test_loss: 1.0185, test_f1: 0.6132
 epoch: 18, train_loss: 0.7672, test_loss: 1.0444, test_f1: 0.6150
 epoch: 19, train_loss: 0.7594, test_loss: 1.0668, test_f1: 0.6070
 epoch: 20, train_loss: 0.7435, test_loss: 1.0731, test_f1: 0.5898
 epoch: 21, train_loss: 0.7396, test_loss: 1.0742, test_f1: 0.6001
 epoch: 22, train_loss: 0.7158, test_loss: 1.0245, test_f1: 0.6208
 epoch: 23, train_loss: 0.7013, test_loss: 1.0089, test_f1: 0.6032
 epoch: 24, train_loss: 0.6936, test_loss: 1.0100, test_f1: 0.6086
 epoch: 25, train_loss: 0.6680, test_loss: 1.0314, test_f1: 0.5975
 epoch: 26, train_loss: 0.6799, test_loss: 1.0979, test_f1: 0.6119
 epoch: 27, train_loss: 0.6564, test_loss: 1.0806, test_f1: 0.6163
 epoch: 28, train_loss: 0.6557, test_loss: 1.0968, test_f1: 0.6433
 epoch: 29, train_loss: 0.6459, test_loss: 1.0224, test_f1: 0.6235
 epoch: 30, train_loss: 0.6402, test_loss: 1.0931, test_f1: 0.5806
 epoch: 31, train_loss: 0.6582, test_loss: 1.2310, test_f1: 0.5289
 epoch: 32, train_loss: 0.6314, test_loss: 1.1938, test_f1: 0.5617
 epoch: 33, train_loss: 0.6271, test_loss: 1.2222, test_f1: 0.5798
 epoch: 34, train_loss: 0.6551, test_loss: 1.2089, test_f1: 0.5810
 epoch: 35, train_loss: 0.6405, test_loss: 1.1415, test_f1: 0.6128
 epoch: 36, train_loss: 0.6171, test_loss: 1.0857, test_f1: 0.6301
 epoch: 37, train_loss: 0.5896, test_loss: 1.0584, test_f1: 0.6116
 epoch: 38, train_loss: 0.5878, test_loss: 1.2242, test_f1: 0.5914
 epoch: 39, train_loss: 0.5777, test_loss: 1.2591, test_f1: 0.5644
 epoch: 40, train_loss: 0.5727, test_loss: 1.2985, test_f1: 0.5461
 epoch: 41, train_loss: 0.5565, test_loss: 1.2103, test_f1: 0.6382
 epoch: 42, train_loss: 0.5920, test_loss: 1.2625, test_f1: 0.5779
 epoch: 43, train_loss: 0.5705, test_loss: 1.2424, test_f1: 0.6329
 epoch: 44, train_loss: 0.5503, test_loss: 1.3421, test_f1: 0.6248
 epoch: 45, train_loss: 0.5532, test_loss: 1.2099, test_f1: 0.6124
 epoch: 46, train_loss: 0.5195, test_loss: 1.2285, test_f1: 0.5707
 epoch: 47, train_loss: 0.5330, test_loss: 1.2113, test_f1: 0.6212
 epoch: 48, train_loss: 0.5049, test_loss: 1.4084, test_f1: 0.6007
 epoch: 49, train_loss: 0.5786, test_loss: 1.4522, test_f1: 0.5767
 epoch: 50, train_loss: 0.5637, test_loss: 1.3410, test_f1: 0.6046
 epoch: 51, train_loss: 0.4970, test_loss: 1.3003, test_f1: 0.6017
 epoch: 52, train_loss: 0.4834, test_loss: 1.3258, test_f1: 0.6198
 epoch: 53, train_loss: 0.4866, test_loss: 1.2312, test_f1: 0.6345
 epoch: 54, train_loss: 0.4739, test_loss: 1.1856, test_f1: 0.6228
 epoch: 55, train_loss: 0.4902, test_loss: 1.1965, test_f1: 0.6206
 epoch: 56, train_loss: 0.4617, test_loss: 1.2020, test_f1: 0.6440
 epoch: 57, train_loss: 0.4344, test_loss: 1.1880, test_f1: 0.6514
 epoch: 58, train_loss: 0.4282, test_loss: 1.2442, test_f1: 0.6053
 epoch: 59, train_loss: 0.4365, test_loss: 1.3202, test_f1: 0.6068
 epoch: 60, train_loss: 0.4212, test_loss: 1.3142, test_f1: 0.6428
 epoch: 61, train_loss: 0.4296, test_loss: 1.3192, test_f1: 0.6076
 epoch: 62, train_loss: 0.4251, test_loss: 1.3450, test_f1: 0.6167
 epoch: 63, train_loss: 0.4159, test_loss: 1.3074, test_f1: 0.5938
 epoch: 64, train_loss: 0.4210, test_loss: 1.3535, test_f1: 0.5969
 epoch: 65, train_loss: 0.4211, test_loss: 1.5545, test_f1: 0.5634
 epoch: 66, train_loss: 0.4172, test_loss: 1.4189, test_f1: 0.5868
 epoch: 67, train_loss: 0.4012, test_loss: 1.4750, test_f1: 0.6067
 epoch: 68, train_loss: 0.4131, test_loss: 1.2867, test_f1: 0.6043
 epoch: 69, train_loss: 0.4116, test_loss: 1.3627, test_f1: 0.6112
 epoch: 70, train_loss: 0.4108, test_loss: 1.3143, test_f1: 0.6179
 epoch: 71, train_loss: 0.4091, test_loss: 1.4093, test_f1: 0.6302
 epoch: 72, train_loss: 0.4003, test_loss: 1.3931, test_f1: 0.6183
 epoch: 73, train_loss: 0.4079, test_loss: 1.3609, test_f1: 0.5912
 epoch: 74, train_loss: 0.3785, test_loss: 1.3385, test_f1: 0.6078
 epoch: 75, train_loss: 0.3654, test_loss: 1.4775, test_f1: 0.6291
 epoch: 76, train_loss: 0.3686, test_loss: 1.3921, test_f1: 0.6276
 epoch: 77, train_loss: 0.3598, test_loss: 1.4714, test_f1: 0.6115
 epoch: 78, train_loss: 0.3667, test_loss: 1.4659, test_f1: 0.5893
 epoch: 79, train_loss: 0.3497, test_loss: 1.4659, test_f1: 0.6118
 epoch: 80, train_loss: 0.3501, test_loss: 1.3813, test_f1: 0.6292
 epoch: 81, train_loss: 0.3431, test_loss: 1.5085, test_f1: 0.6513
 epoch: 82, train_loss: 0.3822, test_loss: 1.6009, test_f1: 0.6395
 epoch: 83, train_loss: 0.3387, test_loss: 1.3957, test_f1: 0.6155
 epoch: 84, train_loss: 0.3551, test_loss: 1.5762, test_f1: 0.6322
 epoch: 85, train_loss: 0.3277, test_loss: 1.5531, test_f1: 0.6460
 epoch: 86, train_loss: 0.3414, test_loss: 1.5521, test_f1: 0.6384
 epoch: 87, train_loss: 0.3508, test_loss: 1.6886, test_f1: 0.6327
 epoch: 88, train_loss: 0.3432, test_loss: 1.8370, test_f1: 0.6494
 epoch: 89, train_loss: 0.3418, test_loss: 1.8087, test_f1: 0.6330
 epoch: 90, train_loss: 0.3235, test_loss: 1.6526, test_f1: 0.6511
 epoch: 91, train_loss: 0.3087, test_loss: 1.6737, test_f1: 0.6252
 epoch: 92, train_loss: 0.3245, test_loss: 1.7976, test_f1: 0.6228
 epoch: 93, train_loss: 0.3504, test_loss: 1.6117, test_f1: 0.6257
 epoch: 94, train_loss: 0.3755, test_loss: 1.6571, test_f1: 0.6378
 epoch: 95, train_loss: 0.3856, test_loss: 1.6293, test_f1: 0.6287
 epoch: 96, train_loss: 0.3727, test_loss: 1.7736, test_f1: 0.6341
 epoch: 97, train_loss: 0.3386, test_loss: 1.7223, test_f1: 0.6415
 epoch: 98, train_loss: 0.3553, test_loss: 1.6381, test_f1: 0.6405
 epoch: 99, train_loss: 0.3238, test_loss: 1.6369, test_f1: 0.6578
##################ITERATION #7 ****************************************
 epoch: 0, train_loss: 1.3276, test_loss: 1.4976, test_f1: 0.1365
 epoch: 1, train_loss: 1.1035, test_loss: 1.3856, test_f1: 0.1710
 epoch: 2, train_loss: 1.0295, test_loss: 1.3836, test_f1: 0.1923
 epoch: 3, train_loss: 0.9838, test_loss: 1.3330, test_f1: 0.2281
 epoch: 4, train_loss: 0.9544, test_loss: 1.2637, test_f1: 0.2697
 epoch: 5, train_loss: 0.9359, test_loss: 1.2082, test_f1: 0.3220
 epoch: 6, train_loss: 0.9089, test_loss: 1.1372, test_f1: 0.3734
 epoch: 7, train_loss: 0.9005, test_loss: 1.0868, test_f1: 0.3999
 epoch: 8, train_loss: 0.8820, test_loss: 1.1066, test_f1: 0.4661
 epoch: 9, train_loss: 0.8559, test_loss: 1.0938, test_f1: 0.5314
 epoch: 10, train_loss: 0.8395, test_loss: 1.1052, test_f1: 0.4950
 epoch: 11, train_loss: 0.8206, test_loss: 1.0442, test_f1: 0.5511
 epoch: 12, train_loss: 0.8166, test_loss: 1.0245, test_f1: 0.5472
 epoch: 13, train_loss: 0.8126, test_loss: 1.0288, test_f1: 0.5518
 epoch: 14, train_loss: 0.7700, test_loss: 1.0391, test_f1: 0.5908
 epoch: 15, train_loss: 0.7661, test_loss: 1.0472, test_f1: 0.5929
 epoch: 16, train_loss: 0.7570, test_loss: 1.0469, test_f1: 0.5774
 epoch: 17, train_loss: 0.7321, test_loss: 1.1098, test_f1: 0.5534
 epoch: 18, train_loss: 0.7486, test_loss: 1.1629, test_f1: 0.5487
 epoch: 19, train_loss: 0.7168, test_loss: 1.1341, test_f1: 0.5974
 epoch: 20, train_loss: 0.7089, test_loss: 1.1257, test_f1: 0.6176
 epoch: 21, train_loss: 0.7080, test_loss: 1.2073, test_f1: 0.5539
 epoch: 22, train_loss: 0.7243, test_loss: 1.2883, test_f1: 0.5182
 epoch: 23, train_loss: 0.6964, test_loss: 1.1708, test_f1: 0.5899
 epoch: 24, train_loss: 0.6873, test_loss: 1.2611, test_f1: 0.5873
 epoch: 25, train_loss: 0.6746, test_loss: 1.2136, test_f1: 0.6103
 epoch: 26, train_loss: 0.6821, test_loss: 1.2305, test_f1: 0.5721
 epoch: 27, train_loss: 0.6537, test_loss: 1.1820, test_f1: 0.5654
 epoch: 28, train_loss: 0.6525, test_loss: 1.1780, test_f1: 0.5711
 epoch: 29, train_loss: 0.6424, test_loss: 1.1244, test_f1: 0.6197
 epoch: 30, train_loss: 0.6301, test_loss: 1.2087, test_f1: 0.6158
 epoch: 31, train_loss: 0.6259, test_loss: 1.2470, test_f1: 0.5826
 epoch: 32, train_loss: 0.6285, test_loss: 1.2323, test_f1: 0.6325
 epoch: 33, train_loss: 0.6225, test_loss: 1.2279, test_f1: 0.6083
 epoch: 34, train_loss: 0.5955, test_loss: 1.1911, test_f1: 0.6053
 epoch: 35, train_loss: 0.6125, test_loss: 1.1981, test_f1: 0.5737
 epoch: 36, train_loss: 0.5794, test_loss: 1.2742, test_f1: 0.6135
 epoch: 37, train_loss: 0.5682, test_loss: 1.2739, test_f1: 0.5843
 epoch: 38, train_loss: 0.5854, test_loss: 1.2423, test_f1: 0.6072
 epoch: 39, train_loss: 0.5605, test_loss: 1.2192, test_f1: 0.6284
 epoch: 40, train_loss: 0.5642, test_loss: 1.2732, test_f1: 0.6322
 epoch: 41, train_loss: 0.5359, test_loss: 1.4246, test_f1: 0.5967
 epoch: 42, train_loss: 0.5656, test_loss: 1.4763, test_f1: 0.5638
 epoch: 43, train_loss: 0.5422, test_loss: 1.4061, test_f1: 0.5559
 epoch: 44, train_loss: 0.5679, test_loss: 1.3804, test_f1: 0.6031
 epoch: 45, train_loss: 0.5486, test_loss: 1.4530, test_f1: 0.5983
 epoch: 46, train_loss: 0.5031, test_loss: 1.4994, test_f1: 0.5928
 epoch: 47, train_loss: 0.5005, test_loss: 1.3794, test_f1: 0.6131
 epoch: 48, train_loss: 0.4728, test_loss: 1.3043, test_f1: 0.6243
 epoch: 49, train_loss: 0.4748, test_loss: 1.2644, test_f1: 0.6443
 epoch: 50, train_loss: 0.5060, test_loss: 1.5203, test_f1: 0.5376
 epoch: 51, train_loss: 0.4500, test_loss: 1.5058, test_f1: 0.5651
 epoch: 52, train_loss: 0.4566, test_loss: 1.3851, test_f1: 0.6065
 epoch: 53, train_loss: 0.4731, test_loss: 1.4180, test_f1: 0.6095
 epoch: 54, train_loss: 0.4654, test_loss: 1.3885, test_f1: 0.5907
 epoch: 55, train_loss: 0.4540, test_loss: 1.3557, test_f1: 0.6017
 epoch: 56, train_loss: 0.4400, test_loss: 1.5238, test_f1: 0.6293
 epoch: 57, train_loss: 0.4272, test_loss: 1.5558, test_f1: 0.5896
 epoch: 58, train_loss: 0.4258, test_loss: 1.5497, test_f1: 0.5981
 epoch: 59, train_loss: 0.4251, test_loss: 1.7184, test_f1: 0.5816
 epoch: 60, train_loss: 0.4402, test_loss: 1.5858, test_f1: 0.6262
 epoch: 61, train_loss: 0.4438, test_loss: 1.5050, test_f1: 0.6402
 epoch: 62, train_loss: 0.4113, test_loss: 1.5422, test_f1: 0.5853
 epoch: 63, train_loss: 0.4220, test_loss: 1.5408, test_f1: 0.6362
 epoch: 64, train_loss: 0.4077, test_loss: 1.5224, test_f1: 0.6213
 epoch: 65, train_loss: 0.4013, test_loss: 1.5717, test_f1: 0.6255
 epoch: 66, train_loss: 0.3694, test_loss: 1.4891, test_f1: 0.5997
 epoch: 67, train_loss: 0.3677, test_loss: 1.4788, test_f1: 0.6012
 epoch: 68, train_loss: 0.3646, test_loss: 1.5729, test_f1: 0.6058
 epoch: 69, train_loss: 0.3548, test_loss: 1.7056, test_f1: 0.6215
 epoch: 70, train_loss: 0.3708, test_loss: 1.6317, test_f1: 0.6085
 epoch: 71, train_loss: 0.3499, test_loss: 1.5422, test_f1: 0.5930
 epoch: 72, train_loss: 0.3657, test_loss: 1.7050, test_f1: 0.6435
 epoch: 73, train_loss: 0.3587, test_loss: 1.9615, test_f1: 0.5995
 epoch: 74, train_loss: 0.3462, test_loss: 1.6913, test_f1: 0.6111
 epoch: 75, train_loss: 0.3504, test_loss: 1.6735, test_f1: 0.6231
 epoch: 76, train_loss: 0.3462, test_loss: 1.7041, test_f1: 0.6287
 epoch: 77, train_loss: 0.3344, test_loss: 1.5659, test_f1: 0.6409
 epoch: 78, train_loss: 0.3505, test_loss: 1.6109, test_f1: 0.5999
 epoch: 79, train_loss: 0.3419, test_loss: 1.7648, test_f1: 0.6058
 epoch: 80, train_loss: 0.3412, test_loss: 1.6829, test_f1: 0.6325
 epoch: 81, train_loss: 0.3263, test_loss: 1.6968, test_f1: 0.5930
 epoch: 82, train_loss: 0.3147, test_loss: 1.7338, test_f1: 0.5972
 epoch: 83, train_loss: 0.3144, test_loss: 1.6828, test_f1: 0.6078
 epoch: 84, train_loss: 0.3273, test_loss: 1.8123, test_f1: 0.6339
 epoch: 85, train_loss: 0.3212, test_loss: 1.9942, test_f1: 0.5749
 epoch: 86, train_loss: 0.3310, test_loss: 1.8029, test_f1: 0.5917
 epoch: 87, train_loss: 0.3007, test_loss: 1.8012, test_f1: 0.6272
 epoch: 88, train_loss: 0.3075, test_loss: 1.8520, test_f1: 0.6485
 epoch: 89, train_loss: 0.3105, test_loss: 1.8858, test_f1: 0.6034
 epoch: 90, train_loss: 0.3257, test_loss: 1.7896, test_f1: 0.6384
 epoch: 91, train_loss: 0.2878, test_loss: 1.7039, test_f1: 0.6269
 epoch: 92, train_loss: 0.2712, test_loss: 1.6981, test_f1: 0.5685
 epoch: 93, train_loss: 0.3002, test_loss: 1.7756, test_f1: 0.6121
 epoch: 94, train_loss: 0.2824, test_loss: 2.0481, test_f1: 0.6089
 epoch: 95, train_loss: 0.2973, test_loss: 2.0549, test_f1: 0.5944
 epoch: 96, train_loss: 0.3030, test_loss: 2.1659, test_f1: 0.6069
 epoch: 97, train_loss: 0.2799, test_loss: 1.9345, test_f1: 0.5929
 epoch: 98, train_loss: 0.2863, test_loss: 1.9639, test_f1: 0.5678
 epoch: 99, train_loss: 0.2755, test_loss: 2.0580, test_f1: 0.5996
##################ITERATION #8 ****************************************
 epoch: 0, train_loss: 1.4381, test_loss: 1.4026, test_f1: 0.1365
 epoch: 1, train_loss: 1.0971, test_loss: 1.3964, test_f1: 0.1365
 epoch: 2, train_loss: 1.0640, test_loss: 1.3354, test_f1: 0.1430
 epoch: 3, train_loss: 0.9991, test_loss: 1.3157, test_f1: 0.1416
 epoch: 4, train_loss: 0.9761, test_loss: 1.2328, test_f1: 0.3017
 epoch: 5, train_loss: 0.9370, test_loss: 1.1686, test_f1: 0.3758
 epoch: 6, train_loss: 0.9096, test_loss: 1.1259, test_f1: 0.4958
 epoch: 7, train_loss: 0.8922, test_loss: 1.1163, test_f1: 0.4858
 epoch: 8, train_loss: 0.8763, test_loss: 1.1507, test_f1: 0.4785
 epoch: 9, train_loss: 0.8428, test_loss: 1.1504, test_f1: 0.5256
 epoch: 10, train_loss: 0.8222, test_loss: 1.1227, test_f1: 0.5292
 epoch: 11, train_loss: 0.8288, test_loss: 1.1385, test_f1: 0.5561
 epoch: 12, train_loss: 0.8202, test_loss: 1.1441, test_f1: 0.5358
 epoch: 13, train_loss: 0.8170, test_loss: 1.1235, test_f1: 0.5541
 epoch: 14, train_loss: 0.8161, test_loss: 1.1288, test_f1: 0.6187
 epoch: 15, train_loss: 0.7919, test_loss: 1.1825, test_f1: 0.5867
 epoch: 16, train_loss: 0.7552, test_loss: 1.1477, test_f1: 0.5879
 epoch: 17, train_loss: 0.7771, test_loss: 1.2039, test_f1: 0.5963
 epoch: 18, train_loss: 0.7546, test_loss: 1.2592, test_f1: 0.5666
 epoch: 19, train_loss: 0.7485, test_loss: 1.1605, test_f1: 0.5538
 epoch: 20, train_loss: 0.7202, test_loss: 1.0915, test_f1: 0.6228
 epoch: 21, train_loss: 0.7063, test_loss: 1.1214, test_f1: 0.5546
 epoch: 22, train_loss: 0.7010, test_loss: 1.1340, test_f1: 0.6034
 epoch: 23, train_loss: 0.7015, test_loss: 1.1032, test_f1: 0.5883
 epoch: 24, train_loss: 0.6781, test_loss: 1.2474, test_f1: 0.6355
 epoch: 25, train_loss: 0.6700, test_loss: 1.2790, test_f1: 0.6215
 epoch: 26, train_loss: 0.6486, test_loss: 1.3181, test_f1: 0.5822
 epoch: 27, train_loss: 0.6341, test_loss: 1.3351, test_f1: 0.5858
 epoch: 28, train_loss: 0.6403, test_loss: 1.3419, test_f1: 0.5658
 epoch: 29, train_loss: 0.6444, test_loss: 1.2725, test_f1: 0.5908
 epoch: 30, train_loss: 0.6109, test_loss: 1.4468, test_f1: 0.5402
 epoch: 31, train_loss: 0.6012, test_loss: 1.3528, test_f1: 0.6184
 epoch: 32, train_loss: 0.6186, test_loss: 1.2247, test_f1: 0.6032
 epoch: 33, train_loss: 0.6148, test_loss: 1.3462, test_f1: 0.5810
 epoch: 34, train_loss: 0.6027, test_loss: 1.3861, test_f1: 0.5896
 epoch: 35, train_loss: 0.5953, test_loss: 1.4107, test_f1: 0.5304
 epoch: 36, train_loss: 0.5709, test_loss: 1.2920, test_f1: 0.5708
 epoch: 37, train_loss: 0.5581, test_loss: 1.1631, test_f1: 0.6155
 epoch: 38, train_loss: 0.5691, test_loss: 1.3679, test_f1: 0.6087
 epoch: 39, train_loss: 0.5887, test_loss: 1.3275, test_f1: 0.6259
 epoch: 40, train_loss: 0.5637, test_loss: 1.5572, test_f1: 0.5692
 epoch: 41, train_loss: 0.5858, test_loss: 1.2665, test_f1: 0.6266
 epoch: 42, train_loss: 0.5669, test_loss: 1.3663, test_f1: 0.6046
 epoch: 43, train_loss: 0.5529, test_loss: 1.6565, test_f1: 0.5796
 epoch: 44, train_loss: 0.5505, test_loss: 1.3880, test_f1: 0.6119
 epoch: 45, train_loss: 0.5541, test_loss: 1.2165, test_f1: 0.6247
 epoch: 46, train_loss: 0.5524, test_loss: 1.4170, test_f1: 0.5382
 epoch: 47, train_loss: 0.5794, test_loss: 1.3628, test_f1: 0.5810
 epoch: 48, train_loss: 0.5265, test_loss: 1.3480, test_f1: 0.6104
 epoch: 49, train_loss: 0.5361, test_loss: 1.6021, test_f1: 0.5800
 epoch: 50, train_loss: 0.5671, test_loss: 1.2876, test_f1: 0.5927
 epoch: 51, train_loss: 0.5131, test_loss: 1.2025, test_f1: 0.6168
 epoch: 52, train_loss: 0.4910, test_loss: 1.2038, test_f1: 0.6576
 epoch: 53, train_loss: 0.4695, test_loss: 1.3208, test_f1: 0.6256
 epoch: 54, train_loss: 0.4623, test_loss: 1.3557, test_f1: 0.6369
 epoch: 55, train_loss: 0.4564, test_loss: 1.2717, test_f1: 0.6234
 epoch: 56, train_loss: 0.4518, test_loss: 1.3441, test_f1: 0.6191
 epoch: 57, train_loss: 0.4580, test_loss: 1.3419, test_f1: 0.6498
 epoch: 58, train_loss: 0.4359, test_loss: 1.2790, test_f1: 0.6515
 epoch: 59, train_loss: 0.4376, test_loss: 1.3844, test_f1: 0.6409
 epoch: 60, train_loss: 0.4103, test_loss: 1.3791, test_f1: 0.6384
 epoch: 61, train_loss: 0.4228, test_loss: 1.4068, test_f1: 0.6452
 epoch: 62, train_loss: 0.3952, test_loss: 1.4873, test_f1: 0.6174
 epoch: 63, train_loss: 0.4088, test_loss: 1.4436, test_f1: 0.6135
 epoch: 64, train_loss: 0.3872, test_loss: 1.5151, test_f1: 0.6299
 epoch: 65, train_loss: 0.3930, test_loss: 1.4523, test_f1: 0.6058
 epoch: 66, train_loss: 0.3650, test_loss: 1.5334, test_f1: 0.6225
 epoch: 67, train_loss: 0.3681, test_loss: 1.6602, test_f1: 0.6104
 epoch: 68, train_loss: 0.3797, test_loss: 1.5841, test_f1: 0.5936
 epoch: 69, train_loss: 0.3816, test_loss: 1.6203, test_f1: 0.6516
 epoch: 70, train_loss: 0.3960, test_loss: 1.5608, test_f1: 0.6552
 epoch: 71, train_loss: 0.3760, test_loss: 1.4930, test_f1: 0.6041
 epoch: 72, train_loss: 0.4079, test_loss: 1.4542, test_f1: 0.5931
 epoch: 73, train_loss: 0.3844, test_loss: 1.3769, test_f1: 0.6456
 epoch: 74, train_loss: 0.3726, test_loss: 1.5591, test_f1: 0.6266
 epoch: 75, train_loss: 0.3472, test_loss: 1.4973, test_f1: 0.6038
 epoch: 76, train_loss: 0.3534, test_loss: 1.6592, test_f1: 0.5903
 epoch: 77, train_loss: 0.3509, test_loss: 1.7164, test_f1: 0.6164
 epoch: 78, train_loss: 0.3557, test_loss: 1.7229, test_f1: 0.6107
 epoch: 79, train_loss: 0.3748, test_loss: 1.6738, test_f1: 0.6063
 epoch: 80, train_loss: 0.3545, test_loss: 1.7569, test_f1: 0.6293
 epoch: 81, train_loss: 0.3557, test_loss: 1.6825, test_f1: 0.5878
 epoch: 82, train_loss: 0.3650, test_loss: 1.7180, test_f1: 0.6283
 epoch: 83, train_loss: 0.3556, test_loss: 1.5143, test_f1: 0.6241
 epoch: 84, train_loss: 0.3520, test_loss: 1.6186, test_f1: 0.6312
 epoch: 85, train_loss: 0.3276, test_loss: 1.5355, test_f1: 0.6127
 epoch: 86, train_loss: 0.3412, test_loss: 1.6131, test_f1: 0.6042
 epoch: 87, train_loss: 0.3184, test_loss: 1.6083, test_f1: 0.6343
 epoch: 88, train_loss: 0.3318, test_loss: 1.4834, test_f1: 0.6139
 epoch: 89, train_loss: 0.3571, test_loss: 1.6436, test_f1: 0.6460
 epoch: 90, train_loss: 0.3447, test_loss: 1.6359, test_f1: 0.6462
 epoch: 91, train_loss: 0.3221, test_loss: 1.5410, test_f1: 0.6513
 epoch: 92, train_loss: 0.3260, test_loss: 1.5029, test_f1: 0.6375
 epoch: 93, train_loss: 0.3080, test_loss: 1.6194, test_f1: 0.6660
 epoch: 94, train_loss: 0.2923, test_loss: 1.8395, test_f1: 0.6259
 epoch: 95, train_loss: 0.3163, test_loss: 1.6966, test_f1: 0.6370
 epoch: 96, train_loss: 0.3114, test_loss: 1.7950, test_f1: 0.6317
 epoch: 97, train_loss: 0.3136, test_loss: 1.7283, test_f1: 0.6110
 epoch: 98, train_loss: 0.3046, test_loss: 1.7882, test_f1: 0.6183
 epoch: 99, train_loss: 0.3213, test_loss: 1.7450, test_f1: 0.6408
##################ITERATION #9 ****************************************
 epoch: 0, train_loss: 1.4857, test_loss: 1.4463, test_f1: 0.1365
 epoch: 1, train_loss: 1.1482, test_loss: 1.4177, test_f1: 0.1365
 epoch: 2, train_loss: 1.0826, test_loss: 1.3124, test_f1: 0.1365
 epoch: 3, train_loss: 1.0080, test_loss: 1.2359, test_f1: 0.2630
 epoch: 4, train_loss: 0.9663, test_loss: 1.2311, test_f1: 0.3075
 epoch: 5, train_loss: 0.9394, test_loss: 1.1823, test_f1: 0.3909
 epoch: 6, train_loss: 0.9173, test_loss: 1.1572, test_f1: 0.4022
 epoch: 7, train_loss: 0.8981, test_loss: 1.1555, test_f1: 0.3956
 epoch: 8, train_loss: 0.8786, test_loss: 1.1171, test_f1: 0.4525
 epoch: 9, train_loss: 0.8596, test_loss: 1.0859, test_f1: 0.5725
 epoch: 10, train_loss: 0.8486, test_loss: 1.0873, test_f1: 0.5841
 epoch: 11, train_loss: 0.8417, test_loss: 1.1083, test_f1: 0.4661
 epoch: 12, train_loss: 0.8141, test_loss: 1.0934, test_f1: 0.5614
 epoch: 13, train_loss: 0.8089, test_loss: 1.1105, test_f1: 0.5974
 epoch: 14, train_loss: 0.7855, test_loss: 1.0472, test_f1: 0.6021
 epoch: 15, train_loss: 0.7663, test_loss: 1.0768, test_f1: 0.5249
 epoch: 16, train_loss: 0.7615, test_loss: 1.0884, test_f1: 0.5855
 epoch: 17, train_loss: 0.7485, test_loss: 1.0760, test_f1: 0.6081
 epoch: 18, train_loss: 0.7270, test_loss: 1.0890, test_f1: 0.6156
 epoch: 19, train_loss: 0.7397, test_loss: 1.1665, test_f1: 0.6067
 epoch: 20, train_loss: 0.7140, test_loss: 1.1818, test_f1: 0.6113
 epoch: 21, train_loss: 0.7196, test_loss: 1.1000, test_f1: 0.6327
 epoch: 22, train_loss: 0.7273, test_loss: 1.1227, test_f1: 0.5877
 epoch: 23, train_loss: 0.7186, test_loss: 1.2028, test_f1: 0.5976
 epoch: 24, train_loss: 0.7015, test_loss: 1.1823, test_f1: 0.6223
 epoch: 25, train_loss: 0.7026, test_loss: 1.2305, test_f1: 0.5760
 epoch: 26, train_loss: 0.6907, test_loss: 1.2635, test_f1: 0.5528
 epoch: 27, train_loss: 0.7019, test_loss: 1.2049, test_f1: 0.5915
 epoch: 28, train_loss: 0.6719, test_loss: 1.1939, test_f1: 0.6126
 epoch: 29, train_loss: 0.6651, test_loss: 1.1686, test_f1: 0.6037
 epoch: 30, train_loss: 0.6657, test_loss: 1.2437, test_f1: 0.5848
 epoch: 31, train_loss: 0.6363, test_loss: 1.2431, test_f1: 0.6023
 epoch: 32, train_loss: 0.6241, test_loss: 1.2548, test_f1: 0.5899
 epoch: 33, train_loss: 0.6180, test_loss: 1.1710, test_f1: 0.5780
 epoch: 34, train_loss: 0.6227, test_loss: 1.1579, test_f1: 0.6543
 epoch: 35, train_loss: 0.6157, test_loss: 1.3119, test_f1: 0.5727
 epoch: 36, train_loss: 0.6263, test_loss: 1.2043, test_f1: 0.5889
 epoch: 37, train_loss: 0.6138, test_loss: 1.3359, test_f1: 0.5860
 epoch: 38, train_loss: 0.6323, test_loss: 1.2857, test_f1: 0.6171
 epoch: 39, train_loss: 0.6295, test_loss: 1.2410, test_f1: 0.5672
 epoch: 40, train_loss: 0.5979, test_loss: 1.4095, test_f1: 0.5901
 epoch: 41, train_loss: 0.6051, test_loss: 1.3391, test_f1: 0.6212
 epoch: 42, train_loss: 0.5627, test_loss: 1.3550, test_f1: 0.5725
 epoch: 43, train_loss: 0.5839, test_loss: 1.2385, test_f1: 0.6061
 epoch: 44, train_loss: 0.5561, test_loss: 1.3122, test_f1: 0.6274
 epoch: 45, train_loss: 0.5488, test_loss: 1.3706, test_f1: 0.6261
 epoch: 46, train_loss: 0.5293, test_loss: 1.3766, test_f1: 0.5968
 epoch: 47, train_loss: 0.5276, test_loss: 1.3335, test_f1: 0.6090
 epoch: 48, train_loss: 0.5461, test_loss: 1.3186, test_f1: 0.5945
 epoch: 49, train_loss: 0.5387, test_loss: 1.3416, test_f1: 0.5839
 epoch: 50, train_loss: 0.5294, test_loss: 1.3282, test_f1: 0.5908
 epoch: 51, train_loss: 0.5275, test_loss: 1.3805, test_f1: 0.6073
 epoch: 52, train_loss: 0.5028, test_loss: 1.3867, test_f1: 0.6141
 epoch: 53, train_loss: 0.4888, test_loss: 1.3656, test_f1: 0.5996
 epoch: 54, train_loss: 0.4768, test_loss: 1.2868, test_f1: 0.6241
 epoch: 55, train_loss: 0.4809, test_loss: 1.2704, test_f1: 0.6313
 epoch: 56, train_loss: 0.4840, test_loss: 1.3295, test_f1: 0.6211
 epoch: 57, train_loss: 0.4918, test_loss: 1.5098, test_f1: 0.5759
 epoch: 58, train_loss: 0.4652, test_loss: 1.3658, test_f1: 0.6108
 epoch: 59, train_loss: 0.4633, test_loss: 1.4819, test_f1: 0.6076
 epoch: 60, train_loss: 0.4391, test_loss: 1.4400, test_f1: 0.6125
 epoch: 61, train_loss: 0.4418, test_loss: 1.4372, test_f1: 0.6032
 epoch: 62, train_loss: 0.4393, test_loss: 1.5445, test_f1: 0.6040
 epoch: 63, train_loss: 0.4458, test_loss: 1.4502, test_f1: 0.6012
 epoch: 64, train_loss: 0.4681, test_loss: 1.3692, test_f1: 0.6053
 epoch: 65, train_loss: 0.4501, test_loss: 1.4405, test_f1: 0.5912
 epoch: 66, train_loss: 0.4558, test_loss: 1.4979, test_f1: 0.5739
 epoch: 67, train_loss: 0.4334, test_loss: 1.4980, test_f1: 0.6079
 epoch: 68, train_loss: 0.4085, test_loss: 1.4114, test_f1: 0.6197
 epoch: 69, train_loss: 0.4138, test_loss: 1.5020, test_f1: 0.6363
 epoch: 70, train_loss: 0.4140, test_loss: 1.4171, test_f1: 0.6309
 epoch: 71, train_loss: 0.4077, test_loss: 1.4541, test_f1: 0.6354
 epoch: 72, train_loss: 0.4004, test_loss: 1.6075, test_f1: 0.6052
 epoch: 73, train_loss: 0.4228, test_loss: 1.5238, test_f1: 0.6280
 epoch: 74, train_loss: 0.3862, test_loss: 1.5409, test_f1: 0.6265
 epoch: 75, train_loss: 0.3926, test_loss: 1.4336, test_f1: 0.5777
 epoch: 76, train_loss: 0.3960, test_loss: 1.5843, test_f1: 0.6262
 epoch: 77, train_loss: 0.3863, test_loss: 1.5064, test_f1: 0.6036
 epoch: 78, train_loss: 0.3631, test_loss: 1.4622, test_f1: 0.6337
 epoch: 79, train_loss: 0.3919, test_loss: 1.6821, test_f1: 0.6290
 epoch: 80, train_loss: 0.3779, test_loss: 1.6153, test_f1: 0.6268
 epoch: 81, train_loss: 0.3569, test_loss: 1.7026, test_f1: 0.6266
 epoch: 82, train_loss: 0.3594, test_loss: 1.5200, test_f1: 0.6278
 epoch: 83, train_loss: 0.3636, test_loss: 1.5394, test_f1: 0.6219
 epoch: 84, train_loss: 0.3270, test_loss: 1.5837, test_f1: 0.5815
 epoch: 85, train_loss: 0.3549, test_loss: 1.6956, test_f1: 0.5952
 epoch: 86, train_loss: 0.3633, test_loss: 1.6011, test_f1: 0.6221
 epoch: 87, train_loss: 0.3568, test_loss: 1.5655, test_f1: 0.6305
 epoch: 88, train_loss: 0.3654, test_loss: 1.8432, test_f1: 0.6229
 epoch: 89, train_loss: 0.3492, test_loss: 1.8995, test_f1: 0.6271
 epoch: 90, train_loss: 0.3608, test_loss: 1.6941, test_f1: 0.6166
 epoch: 91, train_loss: 0.3551, test_loss: 1.6573, test_f1: 0.5442
 epoch: 92, train_loss: 0.3413, test_loss: 1.6544, test_f1: 0.6128
 epoch: 93, train_loss: 0.3348, test_loss: 1.6972, test_f1: 0.5988
 epoch: 94, train_loss: 0.3598, test_loss: 1.6934, test_f1: 0.6110
 epoch: 95, train_loss: 0.3249, test_loss: 1.6437, test_f1: 0.6241
 epoch: 96, train_loss: 0.3256, test_loss: 1.7878, test_f1: 0.6003
 epoch: 97, train_loss: 0.2990, test_loss: 1.5722, test_f1: 0.5920
 epoch: 98, train_loss: 0.3101, test_loss: 1.7506, test_f1: 0.5845
 epoch: 99, train_loss: 0.3313, test_loss: 1.7032, test_f1: 0.6069

Training completed in 283.65 seconds
Best F1: 0.6795 at epoch 60
Mean F1 across iterations: 0.6560  0.0133
========================FINAL RESULTS================================
FEGIN weighted F1: 0.6795  0.0133
python main.py --data ltspice_demos --representation component_net --model FEGIN --layers 2 --hiddens 128 --batch_size 256 --lr 0.001 --emb_size 250 --epochs 100 --save_appendix component_net_L2_H128_BS256_LR0.001_E250 --no_val
-----



STDERR:
  File "main.py", line 370, in <module>
    main()
  File "main.py", line 254, in main
    dataset = dataset_class(
  File "/home/philip/projects/ltspice_examples_code_repo/Circuit-Completion-Using-GNNs/component_classification_with_link_prediction_head/evaluation/FEGIN/kernel/circuit_datasets.py", line 15, in __init__
    self.data, self.slices = torch.load(self.processed_paths[0])
  File "/home/philip/.local/lib/python3.8/site-packages/torch/serialization.py", line 1040, in load
    warnings.warn(
  File "/usr/lib/python3.8/warnings.py", line 109, in _showwarnmsg
    sw(msg.message, msg.category, msg.filename, msg.lineno,
  File "main.py", line 47, in warn_with_traceback
    traceback.print_stack(file=log)
/home/philip/projects/ltspice_examples_code_repo/Circuit-Completion-Using-GNNs/component_classification_with_link_prediction_head/evaluation/FEGIN/kernel/circuit_datasets.py:15: FutureWarning: You are using `torch.load` with `weights_only=False` (the current default value), which uses the default pickle module implicitly. It is possible to construct malicious pickle data which will execute arbitrary code during unpickling (See https://github.com/pytorch/pytorch/blob/main/SECURITY.md#untrusted-models for more details). In a future release, the default value for `weights_only` will be flipped to `True`. This limits the functions that could be executed during unpickling. Arbitrary objects will no longer be allowed to be loaded via this mode unless they are explicitly allowlisted by the user via `torch.serialization.add_safe_globals`. We recommend you start setting `weights_only=True` for any use case where you don't have full control of the loaded file. Please open an issue on GitHub for any issues related to this experimental feature.
  self.data, self.slices = torch.load(self.processed_paths[0])
