STDOUT:
Results will be saved in /home/philip/projects/ltspice_examples_code_repo/Circuit-Completion-Using-GNNs/component_classification_with_link_prediction_head/evaluation/FEGIN/results/model_FEGIN_dataset_ltspice_examples
Command line input: python main.py --data ltspice_examples --representation component_pin_net --model FEGIN --layers 2 --hiddens 64 --batch_size 256 --lr 0.0001 --emb_size 250 --epochs 100 --save_appendix component_pin_net_L2_H64_BS256_LR0.0001_E250 --no_val
 is saved.
-----
ltspice_examples - FEGIN
Using 2 layers, 64 hidden units, h = 2
Loading component_pin_net representation dataset
ENTERED
Training FEGIN on component_pin_net representation
Train: 3558, Test: 846
##################ITERATION #0 ****************************************
 epoch: 0, train_loss: 1.3938, test_loss: 1.3924, test_f1: 0.1004
 epoch: 1, train_loss: 1.3854, test_loss: 1.3878, test_f1: 0.1004
 epoch: 2, train_loss: 1.3799, test_loss: 1.3824, test_f1: 0.1004
 epoch: 3, train_loss: 1.3731, test_loss: 1.3739, test_f1: 0.1162
 epoch: 4, train_loss: 1.3657, test_loss: 1.3633, test_f1: 0.1264
 epoch: 5, train_loss: 1.3557, test_loss: 1.3520, test_f1: 0.1436
 epoch: 6, train_loss: 1.3466, test_loss: 1.3395, test_f1: 0.2655
 epoch: 7, train_loss: 1.3338, test_loss: 1.3259, test_f1: 0.2809
 epoch: 8, train_loss: 1.3191, test_loss: 1.3113, test_f1: 0.2586
 epoch: 9, train_loss: 1.3049, test_loss: 1.2959, test_f1: 0.2555
 epoch: 10, train_loss: 1.2914, test_loss: 1.2800, test_f1: 0.2304
 epoch: 11, train_loss: 1.2741, test_loss: 1.2644, test_f1: 0.2302
 epoch: 12, train_loss: 1.2608, test_loss: 1.2502, test_f1: 0.2295
 epoch: 13, train_loss: 1.2504, test_loss: 1.2367, test_f1: 0.2270
 epoch: 14, train_loss: 1.2345, test_loss: 1.2237, test_f1: 0.2270
 epoch: 15, train_loss: 1.2271, test_loss: 1.2115, test_f1: 0.2270
 epoch: 16, train_loss: 1.2158, test_loss: 1.1998, test_f1: 0.2270
 epoch: 17, train_loss: 1.2086, test_loss: 1.1893, test_f1: 0.2679
 epoch: 18, train_loss: 1.1966, test_loss: 1.1791, test_f1: 0.2979
 epoch: 19, train_loss: 1.1889, test_loss: 1.1689, test_f1: 0.3155
 epoch: 20, train_loss: 1.1786, test_loss: 1.1590, test_f1: 0.3474
 epoch: 21, train_loss: 1.1732, test_loss: 1.1487, test_f1: 0.3684
 epoch: 22, train_loss: 1.1622, test_loss: 1.1386, test_f1: 0.3912
 epoch: 23, train_loss: 1.1538, test_loss: 1.1294, test_f1: 0.3900
 epoch: 24, train_loss: 1.1431, test_loss: 1.1190, test_f1: 0.4239
 epoch: 25, train_loss: 1.1345, test_loss: 1.1079, test_f1: 0.4267
 epoch: 26, train_loss: 1.1257, test_loss: 1.0974, test_f1: 0.4537
 epoch: 27, train_loss: 1.1122, test_loss: 1.0848, test_f1: 0.4577
 epoch: 28, train_loss: 1.1036, test_loss: 1.0734, test_f1: 0.4623
 epoch: 29, train_loss: 1.0920, test_loss: 1.0633, test_f1: 0.4741
 epoch: 30, train_loss: 1.0801, test_loss: 1.0529, test_f1: 0.4816
 epoch: 31, train_loss: 1.0725, test_loss: 1.0442, test_f1: 0.4767
 epoch: 32, train_loss: 1.0592, test_loss: 1.0338, test_f1: 0.4835
 epoch: 33, train_loss: 1.0566, test_loss: 1.0262, test_f1: 0.4800
 epoch: 34, train_loss: 1.0396, test_loss: 1.0199, test_f1: 0.4813
 epoch: 35, train_loss: 1.0377, test_loss: 1.0141, test_f1: 0.4818
 epoch: 36, train_loss: 1.0269, test_loss: 1.0067, test_f1: 0.4905
 epoch: 37, train_loss: 1.0180, test_loss: 1.0004, test_f1: 0.4974
 epoch: 38, train_loss: 1.0169, test_loss: 0.9978, test_f1: 0.4995
 epoch: 39, train_loss: 1.0049, test_loss: 0.9924, test_f1: 0.4941
 epoch: 40, train_loss: 1.0047, test_loss: 0.9917, test_f1: 0.4986
 epoch: 41, train_loss: 0.9965, test_loss: 0.9857, test_f1: 0.5036
 epoch: 42, train_loss: 0.9933, test_loss: 0.9827, test_f1: 0.5009
 epoch: 43, train_loss: 0.9903, test_loss: 0.9795, test_f1: 0.5003
 epoch: 44, train_loss: 0.9889, test_loss: 0.9787, test_f1: 0.4867
 epoch: 45, train_loss: 0.9860, test_loss: 0.9767, test_f1: 0.5029
 epoch: 46, train_loss: 0.9765, test_loss: 0.9702, test_f1: 0.5088
 epoch: 47, train_loss: 0.9774, test_loss: 0.9684, test_f1: 0.4953
 epoch: 48, train_loss: 0.9731, test_loss: 0.9664, test_f1: 0.5066
 epoch: 49, train_loss: 0.9758, test_loss: 0.9644, test_f1: 0.4996
 epoch: 50, train_loss: 0.9660, test_loss: 0.9695, test_f1: 0.5045
 epoch: 51, train_loss: 0.9621, test_loss: 0.9613, test_f1: 0.5092
 epoch: 52, train_loss: 0.9671, test_loss: 0.9597, test_f1: 0.5059
 epoch: 53, train_loss: 0.9640, test_loss: 0.9583, test_f1: 0.5072
 epoch: 54, train_loss: 0.9585, test_loss: 0.9576, test_f1: 0.5128
 epoch: 55, train_loss: 0.9580, test_loss: 0.9564, test_f1: 0.5119
 epoch: 56, train_loss: 0.9607, test_loss: 0.9565, test_f1: 0.5130
 epoch: 57, train_loss: 0.9562, test_loss: 0.9555, test_f1: 0.5076
 epoch: 58, train_loss: 0.9539, test_loss: 0.9540, test_f1: 0.5078
 epoch: 59, train_loss: 0.9547, test_loss: 0.9565, test_f1: 0.5053
 epoch: 60, train_loss: 0.9566, test_loss: 0.9533, test_f1: 0.5035
 epoch: 61, train_loss: 0.9528, test_loss: 0.9511, test_f1: 0.5118
 epoch: 62, train_loss: 0.9569, test_loss: 0.9531, test_f1: 0.5127
 epoch: 63, train_loss: 0.9507, test_loss: 0.9489, test_f1: 0.5147
 epoch: 64, train_loss: 0.9493, test_loss: 0.9477, test_f1: 0.5114
 epoch: 65, train_loss: 0.9485, test_loss: 0.9484, test_f1: 0.5133
 epoch: 66, train_loss: 0.9480, test_loss: 0.9505, test_f1: 0.5129
 epoch: 67, train_loss: 0.9489, test_loss: 0.9445, test_f1: 0.5208
 epoch: 68, train_loss: 0.9427, test_loss: 0.9456, test_f1: 0.5159
 epoch: 69, train_loss: 0.9455, test_loss: 0.9435, test_f1: 0.5150
 epoch: 70, train_loss: 0.9474, test_loss: 0.9436, test_f1: 0.5134
 epoch: 71, train_loss: 0.9380, test_loss: 0.9451, test_f1: 0.5148
 epoch: 72, train_loss: 0.9400, test_loss: 0.9426, test_f1: 0.5203
 epoch: 73, train_loss: 0.9391, test_loss: 0.9397, test_f1: 0.5161
 epoch: 74, train_loss: 0.9459, test_loss: 0.9383, test_f1: 0.5207
 epoch: 75, train_loss: 0.9333, test_loss: 0.9386, test_f1: 0.5128
 epoch: 76, train_loss: 0.9381, test_loss: 0.9365, test_f1: 0.5185
 epoch: 77, train_loss: 0.9346, test_loss: 0.9366, test_f1: 0.5088
 epoch: 78, train_loss: 0.9390, test_loss: 0.9351, test_f1: 0.5219
 epoch: 79, train_loss: 0.9325, test_loss: 0.9380, test_f1: 0.5219
 epoch: 80, train_loss: 0.9335, test_loss: 0.9364, test_f1: 0.5213
 epoch: 81, train_loss: 0.9271, test_loss: 0.9343, test_f1: 0.5156
 epoch: 82, train_loss: 0.9266, test_loss: 0.9342, test_f1: 0.5221
 epoch: 83, train_loss: 0.9277, test_loss: 0.9305, test_f1: 0.5179
 epoch: 84, train_loss: 0.9328, test_loss: 0.9322, test_f1: 0.5158
 epoch: 85, train_loss: 0.9307, test_loss: 0.9376, test_f1: 0.5310
 epoch: 86, train_loss: 0.9281, test_loss: 0.9330, test_f1: 0.5218
 epoch: 87, train_loss: 0.9292, test_loss: 0.9333, test_f1: 0.5187
 epoch: 88, train_loss: 0.9262, test_loss: 0.9333, test_f1: 0.5136
 epoch: 89, train_loss: 0.9220, test_loss: 0.9298, test_f1: 0.5323
 epoch: 90, train_loss: 0.9209, test_loss: 0.9316, test_f1: 0.5186
 epoch: 91, train_loss: 0.9260, test_loss: 0.9294, test_f1: 0.5219
 epoch: 92, train_loss: 0.9203, test_loss: 0.9324, test_f1: 0.5142
 epoch: 93, train_loss: 0.9142, test_loss: 0.9287, test_f1: 0.5150
 epoch: 94, train_loss: 0.9173, test_loss: 0.9286, test_f1: 0.5231
 epoch: 95, train_loss: 0.9185, test_loss: 0.9294, test_f1: 0.5236
 epoch: 96, train_loss: 0.9221, test_loss: 0.9261, test_f1: 0.5251
 epoch: 97, train_loss: 0.9131, test_loss: 0.9270, test_f1: 0.5340
 epoch: 98, train_loss: 0.9072, test_loss: 0.9231, test_f1: 0.5340
 epoch: 99, train_loss: 0.9135, test_loss: 0.9244, test_f1: 0.5263
##################ITERATION #1 ****************************************
 epoch: 0, train_loss: 1.3556, test_loss: 1.3668, test_f1: 0.1004
 epoch: 1, train_loss: 1.3351, test_loss: 1.3582, test_f1: 0.1004
 epoch: 2, train_loss: 1.3219, test_loss: 1.3466, test_f1: 0.2103
 epoch: 3, train_loss: 1.3072, test_loss: 1.3255, test_f1: 0.2578
 epoch: 4, train_loss: 1.2900, test_loss: 1.2911, test_f1: 0.2404
 epoch: 5, train_loss: 1.2744, test_loss: 1.2615, test_f1: 0.3144
 epoch: 6, train_loss: 1.2557, test_loss: 1.2368, test_f1: 0.3488
 epoch: 7, train_loss: 1.2353, test_loss: 1.2148, test_f1: 0.3403
 epoch: 8, train_loss: 1.2176, test_loss: 1.1938, test_f1: 0.3432
 epoch: 9, train_loss: 1.1999, test_loss: 1.1735, test_f1: 0.3460
 epoch: 10, train_loss: 1.1818, test_loss: 1.1541, test_f1: 0.3460
 epoch: 11, train_loss: 1.1640, test_loss: 1.1362, test_f1: 0.3460
 epoch: 12, train_loss: 1.1472, test_loss: 1.1205, test_f1: 0.3448
 epoch: 13, train_loss: 1.1315, test_loss: 1.1047, test_f1: 0.3438
 epoch: 14, train_loss: 1.1154, test_loss: 1.0904, test_f1: 0.3429
 epoch: 15, train_loss: 1.1055, test_loss: 1.0791, test_f1: 0.3428
 epoch: 16, train_loss: 1.0892, test_loss: 1.0694, test_f1: 0.3451
 epoch: 17, train_loss: 1.0829, test_loss: 1.0602, test_f1: 0.3497
 epoch: 18, train_loss: 1.0764, test_loss: 1.0518, test_f1: 0.3596
 epoch: 19, train_loss: 1.0660, test_loss: 1.0456, test_f1: 0.3637
 epoch: 20, train_loss: 1.0600, test_loss: 1.0396, test_f1: 0.3808
 epoch: 21, train_loss: 1.0531, test_loss: 1.0339, test_f1: 0.3863
 epoch: 22, train_loss: 1.0479, test_loss: 1.0288, test_f1: 0.3899
 epoch: 23, train_loss: 1.0389, test_loss: 1.0250, test_f1: 0.3979
 epoch: 24, train_loss: 1.0326, test_loss: 1.0193, test_f1: 0.4083
 epoch: 25, train_loss: 1.0293, test_loss: 1.0137, test_f1: 0.4114
 epoch: 26, train_loss: 1.0222, test_loss: 1.0096, test_f1: 0.4126
 epoch: 27, train_loss: 1.0231, test_loss: 1.0045, test_f1: 0.4121
 epoch: 28, train_loss: 1.0126, test_loss: 1.0007, test_f1: 0.4261
 epoch: 29, train_loss: 1.0070, test_loss: 0.9940, test_f1: 0.4337
 epoch: 30, train_loss: 1.0045, test_loss: 0.9906, test_f1: 0.4489
 epoch: 31, train_loss: 1.0047, test_loss: 0.9879, test_f1: 0.4460
 epoch: 32, train_loss: 1.0026, test_loss: 0.9871, test_f1: 0.4602
 epoch: 33, train_loss: 0.9927, test_loss: 0.9811, test_f1: 0.4711
 epoch: 34, train_loss: 0.9928, test_loss: 0.9795, test_f1: 0.4715
 epoch: 35, train_loss: 0.9818, test_loss: 0.9721, test_f1: 0.4789
 epoch: 36, train_loss: 0.9835, test_loss: 0.9677, test_f1: 0.4829
 epoch: 37, train_loss: 0.9815, test_loss: 0.9639, test_f1: 0.4772
 epoch: 38, train_loss: 0.9716, test_loss: 0.9607, test_f1: 0.4819
 epoch: 39, train_loss: 0.9742, test_loss: 0.9595, test_f1: 0.4859
 epoch: 40, train_loss: 0.9680, test_loss: 0.9548, test_f1: 0.4863
 epoch: 41, train_loss: 0.9644, test_loss: 0.9536, test_f1: 0.4947
 epoch: 42, train_loss: 0.9636, test_loss: 0.9511, test_f1: 0.4892
 epoch: 43, train_loss: 0.9582, test_loss: 0.9474, test_f1: 0.4913
 epoch: 44, train_loss: 0.9620, test_loss: 0.9449, test_f1: 0.4991
 epoch: 45, train_loss: 0.9555, test_loss: 0.9400, test_f1: 0.5039
 epoch: 46, train_loss: 0.9518, test_loss: 0.9370, test_f1: 0.4986
 epoch: 47, train_loss: 0.9492, test_loss: 0.9337, test_f1: 0.4972
 epoch: 48, train_loss: 0.9505, test_loss: 0.9365, test_f1: 0.5017
 epoch: 49, train_loss: 0.9461, test_loss: 0.9300, test_f1: 0.5025
 epoch: 50, train_loss: 0.9428, test_loss: 0.9291, test_f1: 0.5086
 epoch: 51, train_loss: 0.9331, test_loss: 0.9271, test_f1: 0.5079
 epoch: 52, train_loss: 0.9382, test_loss: 0.9231, test_f1: 0.5163
 epoch: 53, train_loss: 0.9337, test_loss: 0.9236, test_f1: 0.5069
 epoch: 54, train_loss: 0.9316, test_loss: 0.9240, test_f1: 0.5094
 epoch: 55, train_loss: 0.9342, test_loss: 0.9222, test_f1: 0.5112
 epoch: 56, train_loss: 0.9334, test_loss: 0.9203, test_f1: 0.5158
 epoch: 57, train_loss: 0.9271, test_loss: 0.9219, test_f1: 0.5102
 epoch: 58, train_loss: 0.9248, test_loss: 0.9203, test_f1: 0.5111
 epoch: 59, train_loss: 0.9225, test_loss: 0.9182, test_f1: 0.5134
 epoch: 60, train_loss: 0.9314, test_loss: 0.9165, test_f1: 0.5150
 epoch: 61, train_loss: 0.9280, test_loss: 0.9154, test_f1: 0.5199
 epoch: 62, train_loss: 0.9280, test_loss: 0.9127, test_f1: 0.5193
 epoch: 63, train_loss: 0.9244, test_loss: 0.9128, test_f1: 0.5220
 epoch: 64, train_loss: 0.9253, test_loss: 0.9109, test_f1: 0.5220
 epoch: 65, train_loss: 0.9214, test_loss: 0.9101, test_f1: 0.5210
 epoch: 66, train_loss: 0.9203, test_loss: 0.9099, test_f1: 0.5231
 epoch: 67, train_loss: 0.9191, test_loss: 0.9099, test_f1: 0.5201
 epoch: 68, train_loss: 0.9177, test_loss: 0.9092, test_f1: 0.5149
 epoch: 69, train_loss: 0.9137, test_loss: 0.9046, test_f1: 0.5263
 epoch: 70, train_loss: 0.9132, test_loss: 0.9048, test_f1: 0.5243
 epoch: 71, train_loss: 0.9162, test_loss: 0.9040, test_f1: 0.5217
 epoch: 72, train_loss: 0.9143, test_loss: 0.9048, test_f1: 0.5274
 epoch: 73, train_loss: 0.9077, test_loss: 0.8994, test_f1: 0.5246
 epoch: 74, train_loss: 0.9058, test_loss: 0.9029, test_f1: 0.5253
 epoch: 75, train_loss: 0.9107, test_loss: 0.9054, test_f1: 0.5198
 epoch: 76, train_loss: 0.9033, test_loss: 0.9007, test_f1: 0.5275
 epoch: 77, train_loss: 0.9079, test_loss: 0.8997, test_f1: 0.5306
 epoch: 78, train_loss: 0.8974, test_loss: 0.8990, test_f1: 0.5257
 epoch: 79, train_loss: 0.9056, test_loss: 0.8981, test_f1: 0.5240
 epoch: 80, train_loss: 0.9018, test_loss: 0.8951, test_f1: 0.5339
 epoch: 81, train_loss: 0.8998, test_loss: 0.8942, test_f1: 0.5350
 epoch: 82, train_loss: 0.8962, test_loss: 0.8928, test_f1: 0.5345
 epoch: 83, train_loss: 0.8948, test_loss: 0.8921, test_f1: 0.5357
 epoch: 84, train_loss: 0.8893, test_loss: 0.8927, test_f1: 0.5370
 epoch: 85, train_loss: 0.8934, test_loss: 0.8932, test_f1: 0.5320
 epoch: 86, train_loss: 0.8906, test_loss: 0.8921, test_f1: 0.5320
 epoch: 87, train_loss: 0.8978, test_loss: 0.8917, test_f1: 0.5296
 epoch: 88, train_loss: 0.8934, test_loss: 0.8890, test_f1: 0.5387
 epoch: 89, train_loss: 0.8843, test_loss: 0.8882, test_f1: 0.5378
 epoch: 90, train_loss: 0.8880, test_loss: 0.8872, test_f1: 0.5408
 epoch: 91, train_loss: 0.8841, test_loss: 0.8884, test_f1: 0.5372
 epoch: 92, train_loss: 0.8869, test_loss: 0.8882, test_f1: 0.5398
 epoch: 93, train_loss: 0.8825, test_loss: 0.8893, test_f1: 0.5336
 epoch: 94, train_loss: 0.8787, test_loss: 0.8851, test_f1: 0.5383
 epoch: 95, train_loss: 0.8773, test_loss: 0.8795, test_f1: 0.5404
 epoch: 96, train_loss: 0.8803, test_loss: 0.8819, test_f1: 0.5425
 epoch: 97, train_loss: 0.8760, test_loss: 0.8819, test_f1: 0.5381
 epoch: 98, train_loss: 0.8825, test_loss: 0.8820, test_f1: 0.5438
 epoch: 99, train_loss: 0.8746, test_loss: 0.8800, test_f1: 0.5425
##################ITERATION #2 ****************************************
 epoch: 0, train_loss: 1.3505, test_loss: 1.3593, test_f1: 0.2270
 epoch: 1, train_loss: 1.3227, test_loss: 1.3510, test_f1: 0.2270
 epoch: 2, train_loss: 1.3024, test_loss: 1.3340, test_f1: 0.2270
 epoch: 3, train_loss: 1.2857, test_loss: 1.3047, test_f1: 0.2527
 epoch: 4, train_loss: 1.2665, test_loss: 1.2666, test_f1: 0.3312
 epoch: 5, train_loss: 1.2445, test_loss: 1.2306, test_f1: 0.3509
 epoch: 6, train_loss: 1.2251, test_loss: 1.1991, test_f1: 0.3483
 epoch: 7, train_loss: 1.2052, test_loss: 1.1724, test_f1: 0.3441
 epoch: 8, train_loss: 1.1823, test_loss: 1.1470, test_f1: 0.3441
 epoch: 9, train_loss: 1.1653, test_loss: 1.1266, test_f1: 0.3460
 epoch: 10, train_loss: 1.1443, test_loss: 1.1085, test_f1: 0.3460
 epoch: 11, train_loss: 1.1307, test_loss: 1.0923, test_f1: 0.3460
 epoch: 12, train_loss: 1.1152, test_loss: 1.0790, test_f1: 0.3438
 epoch: 13, train_loss: 1.0985, test_loss: 1.0671, test_f1: 0.3448
 epoch: 14, train_loss: 1.0878, test_loss: 1.0579, test_f1: 0.3438
 epoch: 15, train_loss: 1.0782, test_loss: 1.0483, test_f1: 0.3513
 epoch: 16, train_loss: 1.0706, test_loss: 1.0423, test_f1: 0.3591
 epoch: 17, train_loss: 1.0600, test_loss: 1.0333, test_f1: 0.3729
 epoch: 18, train_loss: 1.0509, test_loss: 1.0298, test_f1: 0.3962
 epoch: 19, train_loss: 1.0445, test_loss: 1.0237, test_f1: 0.4066
 epoch: 20, train_loss: 1.0384, test_loss: 1.0174, test_f1: 0.4047
 epoch: 21, train_loss: 1.0337, test_loss: 1.0119, test_f1: 0.4142
 epoch: 22, train_loss: 1.0260, test_loss: 1.0087, test_f1: 0.4253
 epoch: 23, train_loss: 1.0215, test_loss: 1.0043, test_f1: 0.4247
 epoch: 24, train_loss: 1.0173, test_loss: 1.0008, test_f1: 0.4279
 epoch: 25, train_loss: 1.0109, test_loss: 0.9947, test_f1: 0.4277
 epoch: 26, train_loss: 1.0108, test_loss: 0.9877, test_f1: 0.4370
 epoch: 27, train_loss: 1.0043, test_loss: 0.9847, test_f1: 0.4397
 epoch: 28, train_loss: 0.9935, test_loss: 0.9815, test_f1: 0.4681
 epoch: 29, train_loss: 0.9910, test_loss: 0.9730, test_f1: 0.4635
 epoch: 30, train_loss: 0.9898, test_loss: 0.9691, test_f1: 0.4721
 epoch: 31, train_loss: 0.9871, test_loss: 0.9702, test_f1: 0.4787
 epoch: 32, train_loss: 0.9846, test_loss: 0.9652, test_f1: 0.4778
 epoch: 33, train_loss: 0.9730, test_loss: 0.9623, test_f1: 0.4790
 epoch: 34, train_loss: 0.9761, test_loss: 0.9561, test_f1: 0.4881
 epoch: 35, train_loss: 0.9728, test_loss: 0.9513, test_f1: 0.4859
 epoch: 36, train_loss: 0.9707, test_loss: 0.9491, test_f1: 0.4858
 epoch: 37, train_loss: 0.9671, test_loss: 0.9481, test_f1: 0.4873
 epoch: 38, train_loss: 0.9642, test_loss: 0.9465, test_f1: 0.4917
 epoch: 39, train_loss: 0.9582, test_loss: 0.9412, test_f1: 0.4876
 epoch: 40, train_loss: 0.9536, test_loss: 0.9372, test_f1: 0.4933
 epoch: 41, train_loss: 0.9500, test_loss: 0.9363, test_f1: 0.4885
 epoch: 42, train_loss: 0.9533, test_loss: 0.9329, test_f1: 0.4906
 epoch: 43, train_loss: 0.9429, test_loss: 0.9275, test_f1: 0.4905
 epoch: 44, train_loss: 0.9454, test_loss: 0.9277, test_f1: 0.4960
 epoch: 45, train_loss: 0.9398, test_loss: 0.9264, test_f1: 0.4916
 epoch: 46, train_loss: 0.9353, test_loss: 0.9242, test_f1: 0.4881
 epoch: 47, train_loss: 0.9335, test_loss: 0.9165, test_f1: 0.5018
 epoch: 48, train_loss: 0.9303, test_loss: 0.9179, test_f1: 0.5003
 epoch: 49, train_loss: 0.9299, test_loss: 0.9103, test_f1: 0.5154
 epoch: 50, train_loss: 0.9249, test_loss: 0.9110, test_f1: 0.5104
 epoch: 51, train_loss: 0.9195, test_loss: 0.9098, test_f1: 0.5122
 epoch: 52, train_loss: 0.9202, test_loss: 0.9089, test_f1: 0.5138
 epoch: 53, train_loss: 0.9182, test_loss: 0.9057, test_f1: 0.5243
 epoch: 54, train_loss: 0.9215, test_loss: 0.9055, test_f1: 0.5142
 epoch: 55, train_loss: 0.9148, test_loss: 0.9074, test_f1: 0.5031
 epoch: 56, train_loss: 0.9166, test_loss: 0.9085, test_f1: 0.5168
 epoch: 57, train_loss: 0.9121, test_loss: 0.9028, test_f1: 0.5163
 epoch: 58, train_loss: 0.9131, test_loss: 0.9014, test_f1: 0.5216
 epoch: 59, train_loss: 0.9104, test_loss: 0.9007, test_f1: 0.5243
 epoch: 60, train_loss: 0.9137, test_loss: 0.9012, test_f1: 0.5185
 epoch: 61, train_loss: 0.9118, test_loss: 0.9014, test_f1: 0.5246
 epoch: 62, train_loss: 0.9003, test_loss: 0.8974, test_f1: 0.5274
 epoch: 63, train_loss: 0.9061, test_loss: 0.8989, test_f1: 0.5247
 epoch: 64, train_loss: 0.9029, test_loss: 0.8979, test_f1: 0.5235
 epoch: 65, train_loss: 0.9050, test_loss: 0.8971, test_f1: 0.5277
 epoch: 66, train_loss: 0.8992, test_loss: 0.8940, test_f1: 0.5266
 epoch: 67, train_loss: 0.8984, test_loss: 0.8940, test_f1: 0.5325
 epoch: 68, train_loss: 0.8930, test_loss: 0.8939, test_f1: 0.5311
 epoch: 69, train_loss: 0.9011, test_loss: 0.8929, test_f1: 0.5343
 epoch: 70, train_loss: 0.8944, test_loss: 0.8879, test_f1: 0.5306
 epoch: 71, train_loss: 0.8926, test_loss: 0.8925, test_f1: 0.5343
 epoch: 72, train_loss: 0.8901, test_loss: 0.8873, test_f1: 0.5313
 epoch: 73, train_loss: 0.8900, test_loss: 0.8899, test_f1: 0.5337
 epoch: 74, train_loss: 0.8930, test_loss: 0.8856, test_f1: 0.5324
 epoch: 75, train_loss: 0.8911, test_loss: 0.8882, test_f1: 0.5271
 epoch: 76, train_loss: 0.8885, test_loss: 0.8867, test_f1: 0.5298
 epoch: 77, train_loss: 0.8868, test_loss: 0.8892, test_f1: 0.5370
 epoch: 78, train_loss: 0.8791, test_loss: 0.8849, test_f1: 0.5268
 epoch: 79, train_loss: 0.8813, test_loss: 0.8817, test_f1: 0.5284
 epoch: 80, train_loss: 0.8793, test_loss: 0.8832, test_f1: 0.5387
 epoch: 81, train_loss: 0.8787, test_loss: 0.8789, test_f1: 0.5371
 epoch: 82, train_loss: 0.8785, test_loss: 0.8809, test_f1: 0.5412
 epoch: 83, train_loss: 0.8814, test_loss: 0.8752, test_f1: 0.5342
 epoch: 84, train_loss: 0.8804, test_loss: 0.8750, test_f1: 0.5362
 epoch: 85, train_loss: 0.8747, test_loss: 0.8782, test_f1: 0.5279
 epoch: 86, train_loss: 0.8748, test_loss: 0.8741, test_f1: 0.5264
 epoch: 87, train_loss: 0.8672, test_loss: 0.8716, test_f1: 0.5475
 epoch: 88, train_loss: 0.8775, test_loss: 0.8735, test_f1: 0.5311
 epoch: 89, train_loss: 0.8695, test_loss: 0.8736, test_f1: 0.5394
 epoch: 90, train_loss: 0.8691, test_loss: 0.8712, test_f1: 0.5403
 epoch: 91, train_loss: 0.8669, test_loss: 0.8652, test_f1: 0.5395
 epoch: 92, train_loss: 0.8685, test_loss: 0.8717, test_f1: 0.5462
 epoch: 93, train_loss: 0.8651, test_loss: 0.8748, test_f1: 0.5334
 epoch: 94, train_loss: 0.8598, test_loss: 0.8729, test_f1: 0.5382
 epoch: 95, train_loss: 0.8641, test_loss: 0.8647, test_f1: 0.5398
 epoch: 96, train_loss: 0.8622, test_loss: 0.8664, test_f1: 0.5333
 epoch: 97, train_loss: 0.8615, test_loss: 0.8642, test_f1: 0.5399
 epoch: 98, train_loss: 0.8548, test_loss: 0.8625, test_f1: 0.5413
 epoch: 99, train_loss: 0.8617, test_loss: 0.8612, test_f1: 0.5442
##################ITERATION #3 ****************************************
 epoch: 0, train_loss: 1.3077, test_loss: 1.3171, test_f1: 0.2270
 epoch: 1, train_loss: 1.2740, test_loss: 1.2995, test_f1: 0.2270
 epoch: 2, train_loss: 1.2540, test_loss: 1.2725, test_f1: 0.2270
 epoch: 3, train_loss: 1.2377, test_loss: 1.2344, test_f1: 0.2270
 epoch: 4, train_loss: 1.2187, test_loss: 1.1996, test_f1: 0.3275
 epoch: 5, train_loss: 1.1970, test_loss: 1.1679, test_f1: 0.3548
 epoch: 6, train_loss: 1.1777, test_loss: 1.1409, test_f1: 0.3499
 epoch: 7, train_loss: 1.1576, test_loss: 1.1170, test_f1: 0.3478
 epoch: 8, train_loss: 1.1373, test_loss: 1.0962, test_f1: 0.3634
 epoch: 9, train_loss: 1.1146, test_loss: 1.0795, test_f1: 0.3939
 epoch: 10, train_loss: 1.0992, test_loss: 1.0647, test_f1: 0.4030
 epoch: 11, train_loss: 1.0852, test_loss: 1.0506, test_f1: 0.4053
 epoch: 12, train_loss: 1.0723, test_loss: 1.0388, test_f1: 0.4159
 epoch: 13, train_loss: 1.0578, test_loss: 1.0305, test_f1: 0.4261
 epoch: 14, train_loss: 1.0509, test_loss: 1.0215, test_f1: 0.4375
 epoch: 15, train_loss: 1.0453, test_loss: 1.0146, test_f1: 0.4364
 epoch: 16, train_loss: 1.0401, test_loss: 1.0068, test_f1: 0.4414
 epoch: 17, train_loss: 1.0278, test_loss: 1.0010, test_f1: 0.4393
 epoch: 18, train_loss: 1.0222, test_loss: 0.9967, test_f1: 0.4549
 epoch: 19, train_loss: 1.0145, test_loss: 0.9898, test_f1: 0.4531
 epoch: 20, train_loss: 1.0077, test_loss: 0.9834, test_f1: 0.4680
 epoch: 21, train_loss: 1.0049, test_loss: 0.9818, test_f1: 0.4708
 epoch: 22, train_loss: 0.9999, test_loss: 0.9771, test_f1: 0.4745
 epoch: 23, train_loss: 0.9935, test_loss: 0.9750, test_f1: 0.4799
 epoch: 24, train_loss: 0.9861, test_loss: 0.9711, test_f1: 0.4948
 epoch: 25, train_loss: 0.9855, test_loss: 0.9635, test_f1: 0.4890
 epoch: 26, train_loss: 0.9794, test_loss: 0.9598, test_f1: 0.4931
 epoch: 27, train_loss: 0.9752, test_loss: 0.9570, test_f1: 0.4922
 epoch: 28, train_loss: 0.9683, test_loss: 0.9527, test_f1: 0.4941
 epoch: 29, train_loss: 0.9674, test_loss: 0.9498, test_f1: 0.4945
 epoch: 30, train_loss: 0.9632, test_loss: 0.9459, test_f1: 0.4942
 epoch: 31, train_loss: 0.9616, test_loss: 0.9435, test_f1: 0.4945
 epoch: 32, train_loss: 0.9619, test_loss: 0.9412, test_f1: 0.4972
 epoch: 33, train_loss: 0.9484, test_loss: 0.9412, test_f1: 0.4969
 epoch: 34, train_loss: 0.9469, test_loss: 0.9348, test_f1: 0.5127
 epoch: 35, train_loss: 0.9424, test_loss: 0.9342, test_f1: 0.5141
 epoch: 36, train_loss: 0.9410, test_loss: 0.9303, test_f1: 0.5100
 epoch: 37, train_loss: 0.9393, test_loss: 0.9266, test_f1: 0.5172
 epoch: 38, train_loss: 0.9350, test_loss: 0.9248, test_f1: 0.5168
 epoch: 39, train_loss: 0.9327, test_loss: 0.9260, test_f1: 0.5100
 epoch: 40, train_loss: 0.9214, test_loss: 0.9178, test_f1: 0.5133
 epoch: 41, train_loss: 0.9232, test_loss: 0.9179, test_f1: 0.5224
 epoch: 42, train_loss: 0.9175, test_loss: 0.9093, test_f1: 0.5185
 epoch: 43, train_loss: 0.9150, test_loss: 0.9080, test_f1: 0.5186
 epoch: 44, train_loss: 0.9127, test_loss: 0.9058, test_f1: 0.5189
 epoch: 45, train_loss: 0.9192, test_loss: 0.9045, test_f1: 0.5227
 epoch: 46, train_loss: 0.9065, test_loss: 0.8970, test_f1: 0.5246
 epoch: 47, train_loss: 0.9064, test_loss: 0.9001, test_f1: 0.5179
 epoch: 48, train_loss: 0.9003, test_loss: 0.8955, test_f1: 0.5239
 epoch: 49, train_loss: 0.9024, test_loss: 0.8897, test_f1: 0.5223
 epoch: 50, train_loss: 0.9022, test_loss: 0.8864, test_f1: 0.5264
 epoch: 51, train_loss: 0.8880, test_loss: 0.8857, test_f1: 0.5238
 epoch: 52, train_loss: 0.8938, test_loss: 0.8856, test_f1: 0.5213
 epoch: 53, train_loss: 0.8865, test_loss: 0.8825, test_f1: 0.5244
 epoch: 54, train_loss: 0.8861, test_loss: 0.8794, test_f1: 0.5286
 epoch: 55, train_loss: 0.8875, test_loss: 0.8798, test_f1: 0.5303
 epoch: 56, train_loss: 0.8839, test_loss: 0.8793, test_f1: 0.5310
 epoch: 57, train_loss: 0.8857, test_loss: 0.8795, test_f1: 0.5276
 epoch: 58, train_loss: 0.8785, test_loss: 0.8805, test_f1: 0.5249
 epoch: 59, train_loss: 0.8824, test_loss: 0.8779, test_f1: 0.5312
 epoch: 60, train_loss: 0.8801, test_loss: 0.8760, test_f1: 0.5249
 epoch: 61, train_loss: 0.8781, test_loss: 0.8750, test_f1: 0.5277
 epoch: 62, train_loss: 0.8729, test_loss: 0.8755, test_f1: 0.5337
 epoch: 63, train_loss: 0.8743, test_loss: 0.8715, test_f1: 0.5313
 epoch: 64, train_loss: 0.8721, test_loss: 0.8697, test_f1: 0.5304
 epoch: 65, train_loss: 0.8667, test_loss: 0.8680, test_f1: 0.5294
 epoch: 66, train_loss: 0.8684, test_loss: 0.8669, test_f1: 0.5268
 epoch: 67, train_loss: 0.8666, test_loss: 0.8663, test_f1: 0.5313
 epoch: 68, train_loss: 0.8659, test_loss: 0.8648, test_f1: 0.5264
 epoch: 69, train_loss: 0.8694, test_loss: 0.8645, test_f1: 0.5282
 epoch: 70, train_loss: 0.8627, test_loss: 0.8642, test_f1: 0.5428
 epoch: 71, train_loss: 0.8619, test_loss: 0.8620, test_f1: 0.5300
 epoch: 72, train_loss: 0.8631, test_loss: 0.8610, test_f1: 0.5278
 epoch: 73, train_loss: 0.8604, test_loss: 0.8597, test_f1: 0.5305
 epoch: 74, train_loss: 0.8597, test_loss: 0.8595, test_f1: 0.5360
 epoch: 75, train_loss: 0.8543, test_loss: 0.8590, test_f1: 0.5285
 epoch: 76, train_loss: 0.8581, test_loss: 0.8573, test_f1: 0.5394
 epoch: 77, train_loss: 0.8587, test_loss: 0.8572, test_f1: 0.5292
 epoch: 78, train_loss: 0.8587, test_loss: 0.8563, test_f1: 0.5293
 epoch: 79, train_loss: 0.8535, test_loss: 0.8533, test_f1: 0.5391
 epoch: 80, train_loss: 0.8515, test_loss: 0.8558, test_f1: 0.5251
 epoch: 81, train_loss: 0.8499, test_loss: 0.8537, test_f1: 0.5316
 epoch: 82, train_loss: 0.8390, test_loss: 0.8514, test_f1: 0.5360
 epoch: 83, train_loss: 0.8434, test_loss: 0.8518, test_f1: 0.5273
 epoch: 84, train_loss: 0.8509, test_loss: 0.8515, test_f1: 0.5295
 epoch: 85, train_loss: 0.8448, test_loss: 0.8508, test_f1: 0.5318
 epoch: 86, train_loss: 0.8478, test_loss: 0.8525, test_f1: 0.5456
 epoch: 87, train_loss: 0.8483, test_loss: 0.8523, test_f1: 0.5350
 epoch: 88, train_loss: 0.8424, test_loss: 0.8518, test_f1: 0.5271
 epoch: 89, train_loss: 0.8463, test_loss: 0.8508, test_f1: 0.5289
 epoch: 90, train_loss: 0.8416, test_loss: 0.8482, test_f1: 0.5388
 epoch: 91, train_loss: 0.8444, test_loss: 0.8496, test_f1: 0.5309
 epoch: 92, train_loss: 0.8372, test_loss: 0.8496, test_f1: 0.5263
 epoch: 93, train_loss: 0.8325, test_loss: 0.8474, test_f1: 0.5303
 epoch: 94, train_loss: 0.8314, test_loss: 0.8445, test_f1: 0.5330
 epoch: 95, train_loss: 0.8303, test_loss: 0.8451, test_f1: 0.5277
 epoch: 96, train_loss: 0.8346, test_loss: 0.8383, test_f1: 0.5332
 epoch: 97, train_loss: 0.8353, test_loss: 0.8417, test_f1: 0.5275
 epoch: 98, train_loss: 0.8300, test_loss: 0.8362, test_f1: 0.5404
 epoch: 99, train_loss: 0.8264, test_loss: 0.8360, test_f1: 0.5431
##################ITERATION #4 ****************************************
 epoch: 0, train_loss: 1.3167, test_loss: 1.3351, test_f1: 0.2270
 epoch: 1, train_loss: 1.2814, test_loss: 1.3236, test_f1: 0.2270
 epoch: 2, train_loss: 1.2557, test_loss: 1.3012, test_f1: 0.2270
 epoch: 3, train_loss: 1.2362, test_loss: 1.2628, test_f1: 0.2320
 epoch: 4, train_loss: 1.2151, test_loss: 1.2198, test_f1: 0.3224
 epoch: 5, train_loss: 1.1985, test_loss: 1.1786, test_f1: 0.4221
 epoch: 6, train_loss: 1.1698, test_loss: 1.1435, test_f1: 0.4247
 epoch: 7, train_loss: 1.1521, test_loss: 1.1183, test_f1: 0.4265
 epoch: 8, train_loss: 1.1375, test_loss: 1.0975, test_f1: 0.4343
 epoch: 9, train_loss: 1.1178, test_loss: 1.0802, test_f1: 0.4309
 epoch: 10, train_loss: 1.1005, test_loss: 1.0654, test_f1: 0.4306
 epoch: 11, train_loss: 1.0896, test_loss: 1.0525, test_f1: 0.4340
 epoch: 12, train_loss: 1.0747, test_loss: 1.0422, test_f1: 0.4350
 epoch: 13, train_loss: 1.0682, test_loss: 1.0331, test_f1: 0.4409
 epoch: 14, train_loss: 1.0615, test_loss: 1.0258, test_f1: 0.4444
 epoch: 15, train_loss: 1.0449, test_loss: 1.0196, test_f1: 0.4384
 epoch: 16, train_loss: 1.0421, test_loss: 1.0134, test_f1: 0.4343
 epoch: 17, train_loss: 1.0287, test_loss: 1.0079, test_f1: 0.4380
 epoch: 18, train_loss: 1.0262, test_loss: 1.0022, test_f1: 0.4540
 epoch: 19, train_loss: 1.0196, test_loss: 0.9965, test_f1: 0.4575
 epoch: 20, train_loss: 1.0155, test_loss: 0.9921, test_f1: 0.4697
 epoch: 21, train_loss: 1.0112, test_loss: 0.9867, test_f1: 0.4681
 epoch: 22, train_loss: 1.0018, test_loss: 0.9824, test_f1: 0.4688
 epoch: 23, train_loss: 0.9999, test_loss: 0.9796, test_f1: 0.4693
 epoch: 24, train_loss: 0.9990, test_loss: 0.9749, test_f1: 0.4692
 epoch: 25, train_loss: 0.9878, test_loss: 0.9723, test_f1: 0.4756
 epoch: 26, train_loss: 0.9833, test_loss: 0.9671, test_f1: 0.4732
 epoch: 27, train_loss: 0.9832, test_loss: 0.9637, test_f1: 0.4796
 epoch: 28, train_loss: 0.9815, test_loss: 0.9609, test_f1: 0.4751
 epoch: 29, train_loss: 0.9760, test_loss: 0.9576, test_f1: 0.4773
 epoch: 30, train_loss: 0.9686, test_loss: 0.9571, test_f1: 0.4762
 epoch: 31, train_loss: 0.9631, test_loss: 0.9522, test_f1: 0.4882
 epoch: 32, train_loss: 0.9570, test_loss: 0.9474, test_f1: 0.4890
 epoch: 33, train_loss: 0.9598, test_loss: 0.9468, test_f1: 0.4840
 epoch: 34, train_loss: 0.9556, test_loss: 0.9434, test_f1: 0.4896
 epoch: 35, train_loss: 0.9531, test_loss: 0.9377, test_f1: 0.4832
 epoch: 36, train_loss: 0.9491, test_loss: 0.9338, test_f1: 0.4873
 epoch: 37, train_loss: 0.9470, test_loss: 0.9307, test_f1: 0.5016
 epoch: 38, train_loss: 0.9404, test_loss: 0.9277, test_f1: 0.5044
 epoch: 39, train_loss: 0.9413, test_loss: 0.9269, test_f1: 0.4962
 epoch: 40, train_loss: 0.9336, test_loss: 0.9181, test_f1: 0.5007
 epoch: 41, train_loss: 0.9301, test_loss: 0.9208, test_f1: 0.4988
 epoch: 42, train_loss: 0.9332, test_loss: 0.9149, test_f1: 0.5016
 epoch: 43, train_loss: 0.9210, test_loss: 0.9111, test_f1: 0.4987
 epoch: 44, train_loss: 0.9254, test_loss: 0.9126, test_f1: 0.5003
 epoch: 45, train_loss: 0.9206, test_loss: 0.9072, test_f1: 0.4967
 epoch: 46, train_loss: 0.9193, test_loss: 0.9060, test_f1: 0.5077
 epoch: 47, train_loss: 0.9150, test_loss: 0.9023, test_f1: 0.5089
 epoch: 48, train_loss: 0.9067, test_loss: 0.8986, test_f1: 0.5126
 epoch: 49, train_loss: 0.9102, test_loss: 0.8951, test_f1: 0.5103
 epoch: 50, train_loss: 0.9062, test_loss: 0.8957, test_f1: 0.5129
 epoch: 51, train_loss: 0.9057, test_loss: 0.8908, test_f1: 0.5114
 epoch: 52, train_loss: 0.8965, test_loss: 0.8883, test_f1: 0.5123
 epoch: 53, train_loss: 0.8947, test_loss: 0.8865, test_f1: 0.5127
 epoch: 54, train_loss: 0.9008, test_loss: 0.8854, test_f1: 0.5200
 epoch: 55, train_loss: 0.8972, test_loss: 0.8883, test_f1: 0.5152
 epoch: 56, train_loss: 0.8944, test_loss: 0.8858, test_f1: 0.5181
 epoch: 57, train_loss: 0.8903, test_loss: 0.8833, test_f1: 0.5213
 epoch: 58, train_loss: 0.8892, test_loss: 0.8800, test_f1: 0.5244
 epoch: 59, train_loss: 0.8830, test_loss: 0.8804, test_f1: 0.5200
 epoch: 60, train_loss: 0.8894, test_loss: 0.8812, test_f1: 0.5217
 epoch: 61, train_loss: 0.8844, test_loss: 0.8782, test_f1: 0.5293
 epoch: 62, train_loss: 0.8817, test_loss: 0.8725, test_f1: 0.5307
 epoch: 63, train_loss: 0.8836, test_loss: 0.8751, test_f1: 0.5299
 epoch: 64, train_loss: 0.8798, test_loss: 0.8761, test_f1: 0.5358
 epoch: 65, train_loss: 0.8850, test_loss: 0.8739, test_f1: 0.5272
 epoch: 66, train_loss: 0.8758, test_loss: 0.8733, test_f1: 0.5320
 epoch: 67, train_loss: 0.8781, test_loss: 0.8706, test_f1: 0.5334
 epoch: 68, train_loss: 0.8730, test_loss: 0.8667, test_f1: 0.5304
 epoch: 69, train_loss: 0.8737, test_loss: 0.8685, test_f1: 0.5362
 epoch: 70, train_loss: 0.8731, test_loss: 0.8664, test_f1: 0.5362
 epoch: 71, train_loss: 0.8721, test_loss: 0.8663, test_f1: 0.5364
 epoch: 72, train_loss: 0.8705, test_loss: 0.8658, test_f1: 0.5361
 epoch: 73, train_loss: 0.8666, test_loss: 0.8647, test_f1: 0.5335
 epoch: 74, train_loss: 0.8637, test_loss: 0.8629, test_f1: 0.5397
 epoch: 75, train_loss: 0.8722, test_loss: 0.8619, test_f1: 0.5411
 epoch: 76, train_loss: 0.8655, test_loss: 0.8628, test_f1: 0.5438
 epoch: 77, train_loss: 0.8631, test_loss: 0.8621, test_f1: 0.5392
 epoch: 78, train_loss: 0.8589, test_loss: 0.8574, test_f1: 0.5519
 epoch: 79, train_loss: 0.8536, test_loss: 0.8581, test_f1: 0.5437
 epoch: 80, train_loss: 0.8564, test_loss: 0.8606, test_f1: 0.5445
 epoch: 81, train_loss: 0.8529, test_loss: 0.8574, test_f1: 0.5554
 epoch: 82, train_loss: 0.8592, test_loss: 0.8570, test_f1: 0.5412
 epoch: 83, train_loss: 0.8613, test_loss: 0.8596, test_f1: 0.5518
 epoch: 84, train_loss: 0.8547, test_loss: 0.8578, test_f1: 0.5477
 epoch: 85, train_loss: 0.8518, test_loss: 0.8551, test_f1: 0.5572
 epoch: 86, train_loss: 0.8506, test_loss: 0.8569, test_f1: 0.5450
 epoch: 87, train_loss: 0.8516, test_loss: 0.8581, test_f1: 0.5511
 epoch: 88, train_loss: 0.8502, test_loss: 0.8527, test_f1: 0.5514
 epoch: 89, train_loss: 0.8572, test_loss: 0.8586, test_f1: 0.5545
 epoch: 90, train_loss: 0.8429, test_loss: 0.8516, test_f1: 0.5559
 epoch: 91, train_loss: 0.8450, test_loss: 0.8552, test_f1: 0.5555
 epoch: 92, train_loss: 0.8483, test_loss: 0.8547, test_f1: 0.5546
 epoch: 93, train_loss: 0.8470, test_loss: 0.8517, test_f1: 0.5486
 epoch: 94, train_loss: 0.8438, test_loss: 0.8508, test_f1: 0.5501
 epoch: 95, train_loss: 0.8446, test_loss: 0.8525, test_f1: 0.5576
 epoch: 96, train_loss: 0.8361, test_loss: 0.8478, test_f1: 0.5526
 epoch: 97, train_loss: 0.8427, test_loss: 0.8477, test_f1: 0.5543
 epoch: 98, train_loss: 0.8448, test_loss: 0.8514, test_f1: 0.5513
 epoch: 99, train_loss: 0.8451, test_loss: 0.8461, test_f1: 0.5639
##################ITERATION #5 ****************************************
 epoch: 0, train_loss: 1.3115, test_loss: 1.3170, test_f1: 0.2270
 epoch: 1, train_loss: 1.2512, test_loss: 1.2990, test_f1: 0.2270
 epoch: 2, train_loss: 1.2192, test_loss: 1.2633, test_f1: 0.2270
 epoch: 3, train_loss: 1.1948, test_loss: 1.2075, test_f1: 0.3030
 epoch: 4, train_loss: 1.1669, test_loss: 1.1457, test_f1: 0.3568
 epoch: 5, train_loss: 1.1375, test_loss: 1.1040, test_f1: 0.3893
 epoch: 6, train_loss: 1.1181, test_loss: 1.0802, test_f1: 0.4175
 epoch: 7, train_loss: 1.1048, test_loss: 1.0618, test_f1: 0.4274
 epoch: 8, train_loss: 1.0872, test_loss: 1.0490, test_f1: 0.4362
 epoch: 9, train_loss: 1.0761, test_loss: 1.0389, test_f1: 0.4497
 epoch: 10, train_loss: 1.0575, test_loss: 1.0294, test_f1: 0.4516
 epoch: 11, train_loss: 1.0546, test_loss: 1.0216, test_f1: 0.4438
 epoch: 12, train_loss: 1.0429, test_loss: 1.0162, test_f1: 0.4432
 epoch: 13, train_loss: 1.0288, test_loss: 1.0069, test_f1: 0.4561
 epoch: 14, train_loss: 1.0280, test_loss: 1.0001, test_f1: 0.4604
 epoch: 15, train_loss: 1.0175, test_loss: 0.9924, test_f1: 0.4666
 epoch: 16, train_loss: 1.0117, test_loss: 0.9868, test_f1: 0.4750
 epoch: 17, train_loss: 0.9992, test_loss: 0.9839, test_f1: 0.4788
 epoch: 18, train_loss: 1.0038, test_loss: 0.9796, test_f1: 0.4815
 epoch: 19, train_loss: 0.9949, test_loss: 0.9777, test_f1: 0.4849
 epoch: 20, train_loss: 0.9933, test_loss: 0.9726, test_f1: 0.4875
 epoch: 21, train_loss: 0.9846, test_loss: 0.9683, test_f1: 0.4830
 epoch: 22, train_loss: 0.9794, test_loss: 0.9668, test_f1: 0.4809
 epoch: 23, train_loss: 0.9714, test_loss: 0.9605, test_f1: 0.4871
 epoch: 24, train_loss: 0.9669, test_loss: 0.9586, test_f1: 0.4829
 epoch: 25, train_loss: 0.9655, test_loss: 0.9537, test_f1: 0.4828
 epoch: 26, train_loss: 0.9718, test_loss: 0.9498, test_f1: 0.4902
 epoch: 27, train_loss: 0.9618, test_loss: 0.9489, test_f1: 0.4810
 epoch: 28, train_loss: 0.9569, test_loss: 0.9477, test_f1: 0.4900
 epoch: 29, train_loss: 0.9492, test_loss: 0.9488, test_f1: 0.4983
 epoch: 30, train_loss: 0.9527, test_loss: 0.9433, test_f1: 0.5009
 epoch: 31, train_loss: 0.9501, test_loss: 0.9415, test_f1: 0.5030
 epoch: 32, train_loss: 0.9458, test_loss: 0.9340, test_f1: 0.5122
 epoch: 33, train_loss: 0.9411, test_loss: 0.9366, test_f1: 0.5001
 epoch: 34, train_loss: 0.9310, test_loss: 0.9349, test_f1: 0.5112
 epoch: 35, train_loss: 0.9269, test_loss: 0.9285, test_f1: 0.5123
 epoch: 36, train_loss: 0.9321, test_loss: 0.9258, test_f1: 0.5171
 epoch: 37, train_loss: 0.9280, test_loss: 0.9182, test_f1: 0.5200
 epoch: 38, train_loss: 0.9230, test_loss: 0.9165, test_f1: 0.5215
 epoch: 39, train_loss: 0.9214, test_loss: 0.9152, test_f1: 0.5206
 epoch: 40, train_loss: 0.9223, test_loss: 0.9134, test_f1: 0.5228
 epoch: 41, train_loss: 0.9095, test_loss: 0.9124, test_f1: 0.5292
 epoch: 42, train_loss: 0.9112, test_loss: 0.9066, test_f1: 0.5315
 epoch: 43, train_loss: 0.9095, test_loss: 0.9091, test_f1: 0.5294
 epoch: 44, train_loss: 0.9101, test_loss: 0.9071, test_f1: 0.5308
 epoch: 45, train_loss: 0.9046, test_loss: 0.9040, test_f1: 0.5314
 epoch: 46, train_loss: 0.8969, test_loss: 0.9024, test_f1: 0.5311
 epoch: 47, train_loss: 0.8958, test_loss: 0.8975, test_f1: 0.5308
 epoch: 48, train_loss: 0.8942, test_loss: 0.8963, test_f1: 0.5412
 epoch: 49, train_loss: 0.8992, test_loss: 0.8993, test_f1: 0.5259
 epoch: 50, train_loss: 0.8957, test_loss: 0.8941, test_f1: 0.5292
 epoch: 51, train_loss: 0.8890, test_loss: 0.8960, test_f1: 0.5290
 epoch: 52, train_loss: 0.8824, test_loss: 0.8919, test_f1: 0.5280
 epoch: 53, train_loss: 0.8803, test_loss: 0.8889, test_f1: 0.5344
 epoch: 54, train_loss: 0.8823, test_loss: 0.8883, test_f1: 0.5335
 epoch: 55, train_loss: 0.8853, test_loss: 0.8926, test_f1: 0.5288
 epoch: 56, train_loss: 0.8842, test_loss: 0.8879, test_f1: 0.5283
 epoch: 57, train_loss: 0.8837, test_loss: 0.8910, test_f1: 0.5295
 epoch: 58, train_loss: 0.8719, test_loss: 0.8895, test_f1: 0.5334
 epoch: 59, train_loss: 0.8839, test_loss: 0.8914, test_f1: 0.5334
 epoch: 60, train_loss: 0.8834, test_loss: 0.8883, test_f1: 0.5295
 epoch: 61, train_loss: 0.8758, test_loss: 0.8852, test_f1: 0.5331
 epoch: 62, train_loss: 0.8768, test_loss: 0.8823, test_f1: 0.5328
 epoch: 63, train_loss: 0.8635, test_loss: 0.8797, test_f1: 0.5295
 epoch: 64, train_loss: 0.8708, test_loss: 0.8811, test_f1: 0.5343
 epoch: 65, train_loss: 0.8742, test_loss: 0.8820, test_f1: 0.5327
 epoch: 66, train_loss: 0.8730, test_loss: 0.8798, test_f1: 0.5375
 epoch: 67, train_loss: 0.8734, test_loss: 0.8812, test_f1: 0.5444
 epoch: 68, train_loss: 0.8672, test_loss: 0.8772, test_f1: 0.5323
 epoch: 69, train_loss: 0.8687, test_loss: 0.8762, test_f1: 0.5387
 epoch: 70, train_loss: 0.8682, test_loss: 0.8746, test_f1: 0.5389
 epoch: 71, train_loss: 0.8640, test_loss: 0.8783, test_f1: 0.5358
 epoch: 72, train_loss: 0.8646, test_loss: 0.8761, test_f1: 0.5332
 epoch: 73, train_loss: 0.8604, test_loss: 0.8730, test_f1: 0.5344
 epoch: 74, train_loss: 0.8582, test_loss: 0.8715, test_f1: 0.5360
 epoch: 75, train_loss: 0.8533, test_loss: 0.8752, test_f1: 0.5363
 epoch: 76, train_loss: 0.8538, test_loss: 0.8768, test_f1: 0.5340
 epoch: 77, train_loss: 0.8577, test_loss: 0.8689, test_f1: 0.5388
 epoch: 78, train_loss: 0.8548, test_loss: 0.8708, test_f1: 0.5410
 epoch: 79, train_loss: 0.8560, test_loss: 0.8704, test_f1: 0.5436
 epoch: 80, train_loss: 0.8548, test_loss: 0.8679, test_f1: 0.5443
 epoch: 81, train_loss: 0.8604, test_loss: 0.8682, test_f1: 0.5407
 epoch: 82, train_loss: 0.8520, test_loss: 0.8730, test_f1: 0.5423
 epoch: 83, train_loss: 0.8541, test_loss: 0.8693, test_f1: 0.5414
 epoch: 84, train_loss: 0.8487, test_loss: 0.8708, test_f1: 0.5438
 epoch: 85, train_loss: 0.8501, test_loss: 0.8655, test_f1: 0.5476
 epoch: 86, train_loss: 0.8480, test_loss: 0.8649, test_f1: 0.5436
 epoch: 87, train_loss: 0.8494, test_loss: 0.8631, test_f1: 0.5494
 epoch: 88, train_loss: 0.8511, test_loss: 0.8608, test_f1: 0.5479
 epoch: 89, train_loss: 0.8417, test_loss: 0.8621, test_f1: 0.5513
 epoch: 90, train_loss: 0.8548, test_loss: 0.8643, test_f1: 0.5486
 epoch: 91, train_loss: 0.8457, test_loss: 0.8616, test_f1: 0.5486
 epoch: 92, train_loss: 0.8408, test_loss: 0.8638, test_f1: 0.5463
 epoch: 93, train_loss: 0.8360, test_loss: 0.8615, test_f1: 0.5454
 epoch: 94, train_loss: 0.8334, test_loss: 0.8565, test_f1: 0.5465
 epoch: 95, train_loss: 0.8436, test_loss: 0.8581, test_f1: 0.5464
 epoch: 96, train_loss: 0.8386, test_loss: 0.8592, test_f1: 0.5495
 epoch: 97, train_loss: 0.8332, test_loss: 0.8569, test_f1: 0.5497
 epoch: 98, train_loss: 0.8291, test_loss: 0.8569, test_f1: 0.5473
 epoch: 99, train_loss: 0.8358, test_loss: 0.8535, test_f1: 0.5513
##################ITERATION #6 ****************************************
 epoch: 0, train_loss: 1.3046, test_loss: 1.3147, test_f1: 0.2270
 epoch: 1, train_loss: 1.2321, test_loss: 1.2935, test_f1: 0.2270
 epoch: 2, train_loss: 1.2056, test_loss: 1.2295, test_f1: 0.2251
 epoch: 3, train_loss: 1.1756, test_loss: 1.1584, test_f1: 0.3398
 epoch: 4, train_loss: 1.1532, test_loss: 1.1138, test_f1: 0.4043
 epoch: 5, train_loss: 1.1273, test_loss: 1.0859, test_f1: 0.4219
 epoch: 6, train_loss: 1.1117, test_loss: 1.0626, test_f1: 0.4309
 epoch: 7, train_loss: 1.0898, test_loss: 1.0445, test_f1: 0.4294
 epoch: 8, train_loss: 1.0810, test_loss: 1.0327, test_f1: 0.4484
 epoch: 9, train_loss: 1.0662, test_loss: 1.0243, test_f1: 0.4549
 epoch: 10, train_loss: 1.0541, test_loss: 1.0174, test_f1: 0.4582
 epoch: 11, train_loss: 1.0485, test_loss: 1.0110, test_f1: 0.4596
 epoch: 12, train_loss: 1.0379, test_loss: 1.0050, test_f1: 0.4635
 epoch: 13, train_loss: 1.0325, test_loss: 0.9996, test_f1: 0.4594
 epoch: 14, train_loss: 1.0229, test_loss: 0.9976, test_f1: 0.4546
 epoch: 15, train_loss: 1.0167, test_loss: 0.9945, test_f1: 0.4654
 epoch: 16, train_loss: 1.0106, test_loss: 0.9888, test_f1: 0.4690
 epoch: 17, train_loss: 1.0108, test_loss: 0.9835, test_f1: 0.4679
 epoch: 18, train_loss: 1.0033, test_loss: 0.9825, test_f1: 0.4702
 epoch: 19, train_loss: 0.9960, test_loss: 0.9787, test_f1: 0.4796
 epoch: 20, train_loss: 0.9988, test_loss: 0.9763, test_f1: 0.4756
 epoch: 21, train_loss: 0.9983, test_loss: 0.9736, test_f1: 0.4831
 epoch: 22, train_loss: 0.9851, test_loss: 0.9687, test_f1: 0.4840
 epoch: 23, train_loss: 0.9828, test_loss: 0.9675, test_f1: 0.4824
 epoch: 24, train_loss: 0.9787, test_loss: 0.9690, test_f1: 0.4892
 epoch: 25, train_loss: 0.9739, test_loss: 0.9666, test_f1: 0.4840
 epoch: 26, train_loss: 0.9680, test_loss: 0.9602, test_f1: 0.4859
 epoch: 27, train_loss: 0.9701, test_loss: 0.9610, test_f1: 0.4886
 epoch: 28, train_loss: 0.9683, test_loss: 0.9583, test_f1: 0.4877
 epoch: 29, train_loss: 0.9669, test_loss: 0.9568, test_f1: 0.4916
 epoch: 30, train_loss: 0.9637, test_loss: 0.9554, test_f1: 0.4864
 epoch: 31, train_loss: 0.9618, test_loss: 0.9542, test_f1: 0.4880
 epoch: 32, train_loss: 0.9483, test_loss: 0.9501, test_f1: 0.4879
 epoch: 33, train_loss: 0.9476, test_loss: 0.9507, test_f1: 0.4837
 epoch: 34, train_loss: 0.9462, test_loss: 0.9417, test_f1: 0.5043
 epoch: 35, train_loss: 0.9401, test_loss: 0.9428, test_f1: 0.4964
 epoch: 36, train_loss: 0.9425, test_loss: 0.9420, test_f1: 0.4966
 epoch: 37, train_loss: 0.9355, test_loss: 0.9409, test_f1: 0.4990
 epoch: 38, train_loss: 0.9361, test_loss: 0.9317, test_f1: 0.4990
 epoch: 39, train_loss: 0.9369, test_loss: 0.9396, test_f1: 0.5112
 epoch: 40, train_loss: 0.9315, test_loss: 0.9283, test_f1: 0.5174
 epoch: 41, train_loss: 0.9235, test_loss: 0.9296, test_f1: 0.5141
 epoch: 42, train_loss: 0.9266, test_loss: 0.9264, test_f1: 0.5027
 epoch: 43, train_loss: 0.9186, test_loss: 0.9192, test_f1: 0.5154
 epoch: 44, train_loss: 0.9149, test_loss: 0.9142, test_f1: 0.5107
 epoch: 45, train_loss: 0.9175, test_loss: 0.9148, test_f1: 0.5096
 epoch: 46, train_loss: 0.9122, test_loss: 0.9112, test_f1: 0.5275
 epoch: 47, train_loss: 0.9088, test_loss: 0.9145, test_f1: 0.5412
 epoch: 48, train_loss: 0.9052, test_loss: 0.9117, test_f1: 0.5044
 epoch: 49, train_loss: 0.9112, test_loss: 0.9097, test_f1: 0.5247
 epoch: 50, train_loss: 0.9035, test_loss: 0.9195, test_f1: 0.5205
 epoch: 51, train_loss: 0.8971, test_loss: 0.9155, test_f1: 0.5323
 epoch: 52, train_loss: 0.8927, test_loss: 0.9073, test_f1: 0.5224
 epoch: 53, train_loss: 0.8949, test_loss: 0.9032, test_f1: 0.5368
 epoch: 54, train_loss: 0.8905, test_loss: 0.9005, test_f1: 0.5392
 epoch: 55, train_loss: 0.8895, test_loss: 0.9021, test_f1: 0.5323
 epoch: 56, train_loss: 0.8905, test_loss: 0.8961, test_f1: 0.5435
 epoch: 57, train_loss: 0.8943, test_loss: 0.8954, test_f1: 0.5389
 epoch: 58, train_loss: 0.8860, test_loss: 0.8940, test_f1: 0.5347
 epoch: 59, train_loss: 0.8909, test_loss: 0.9058, test_f1: 0.5318
 epoch: 60, train_loss: 0.8847, test_loss: 0.9007, test_f1: 0.5359
 epoch: 61, train_loss: 0.8858, test_loss: 0.8997, test_f1: 0.5339
 epoch: 62, train_loss: 0.8854, test_loss: 0.8964, test_f1: 0.5401
 epoch: 63, train_loss: 0.8737, test_loss: 0.8933, test_f1: 0.5419
 epoch: 64, train_loss: 0.8781, test_loss: 0.8898, test_f1: 0.5387
 epoch: 65, train_loss: 0.8737, test_loss: 0.8937, test_f1: 0.5483
 epoch: 66, train_loss: 0.8752, test_loss: 0.8904, test_f1: 0.5353
 epoch: 67, train_loss: 0.8719, test_loss: 0.8918, test_f1: 0.5506
 epoch: 68, train_loss: 0.8756, test_loss: 0.8898, test_f1: 0.5437
 epoch: 69, train_loss: 0.8765, test_loss: 0.8990, test_f1: 0.5280
 epoch: 70, train_loss: 0.8685, test_loss: 0.8862, test_f1: 0.5351
 epoch: 71, train_loss: 0.8680, test_loss: 0.8931, test_f1: 0.5451
 epoch: 72, train_loss: 0.8761, test_loss: 0.8851, test_f1: 0.5508
 epoch: 73, train_loss: 0.8705, test_loss: 0.8814, test_f1: 0.5487
 epoch: 74, train_loss: 0.8737, test_loss: 0.8911, test_f1: 0.5409
 epoch: 75, train_loss: 0.8695, test_loss: 0.8777, test_f1: 0.5345
 epoch: 76, train_loss: 0.8649, test_loss: 0.8889, test_f1: 0.5441
 epoch: 77, train_loss: 0.8651, test_loss: 0.8770, test_f1: 0.5433
 epoch: 78, train_loss: 0.8610, test_loss: 0.8868, test_f1: 0.5458
 epoch: 79, train_loss: 0.8559, test_loss: 0.8827, test_f1: 0.5433
 epoch: 80, train_loss: 0.8534, test_loss: 0.8792, test_f1: 0.5453
 epoch: 81, train_loss: 0.8565, test_loss: 0.8741, test_f1: 0.5501
 epoch: 82, train_loss: 0.8573, test_loss: 0.8744, test_f1: 0.5482
 epoch: 83, train_loss: 0.8507, test_loss: 0.8777, test_f1: 0.5491
 epoch: 84, train_loss: 0.8415, test_loss: 0.8760, test_f1: 0.5478
 epoch: 85, train_loss: 0.8523, test_loss: 0.8714, test_f1: 0.5500
 epoch: 86, train_loss: 0.8539, test_loss: 0.8761, test_f1: 0.5495
 epoch: 87, train_loss: 0.8505, test_loss: 0.8727, test_f1: 0.5497
 epoch: 88, train_loss: 0.8487, test_loss: 0.8693, test_f1: 0.5492
 epoch: 89, train_loss: 0.8481, test_loss: 0.8692, test_f1: 0.5433
 epoch: 90, train_loss: 0.8473, test_loss: 0.8686, test_f1: 0.5441
 epoch: 91, train_loss: 0.8420, test_loss: 0.8723, test_f1: 0.5463
 epoch: 92, train_loss: 0.8463, test_loss: 0.8653, test_f1: 0.5500
 epoch: 93, train_loss: 0.8412, test_loss: 0.8621, test_f1: 0.5590
 epoch: 94, train_loss: 0.8424, test_loss: 0.8729, test_f1: 0.5491
 epoch: 95, train_loss: 0.8409, test_loss: 0.8748, test_f1: 0.5485
 epoch: 96, train_loss: 0.8392, test_loss: 0.8662, test_f1: 0.5427
 epoch: 97, train_loss: 0.8368, test_loss: 0.8653, test_f1: 0.5465
 epoch: 98, train_loss: 0.8428, test_loss: 0.8753, test_f1: 0.5535
 epoch: 99, train_loss: 0.8388, test_loss: 0.8671, test_f1: 0.5534
##################ITERATION #7 ****************************************
 epoch: 0, train_loss: 1.2887, test_loss: 1.3062, test_f1: 0.2270
 epoch: 1, train_loss: 1.2235, test_loss: 1.2804, test_f1: 0.2270
 epoch: 2, train_loss: 1.1852, test_loss: 1.2383, test_f1: 0.2270
 epoch: 3, train_loss: 1.1596, test_loss: 1.1745, test_f1: 0.2314
 epoch: 4, train_loss: 1.1241, test_loss: 1.1135, test_f1: 0.4218
 epoch: 5, train_loss: 1.1045, test_loss: 1.0772, test_f1: 0.4395
 epoch: 6, train_loss: 1.0887, test_loss: 1.0552, test_f1: 0.4616
 epoch: 7, train_loss: 1.0806, test_loss: 1.0404, test_f1: 0.4719
 epoch: 8, train_loss: 1.0655, test_loss: 1.0335, test_f1: 0.4716
 epoch: 9, train_loss: 1.0488, test_loss: 1.0216, test_f1: 0.4687
 epoch: 10, train_loss: 1.0364, test_loss: 1.0164, test_f1: 0.4715
 epoch: 11, train_loss: 1.0292, test_loss: 1.0083, test_f1: 0.4762
 epoch: 12, train_loss: 1.0226, test_loss: 1.0024, test_f1: 0.4763
 epoch: 13, train_loss: 1.0143, test_loss: 0.9975, test_f1: 0.4765
 epoch: 14, train_loss: 1.0141, test_loss: 0.9923, test_f1: 0.4775
 epoch: 15, train_loss: 1.0022, test_loss: 0.9808, test_f1: 0.4797
 epoch: 16, train_loss: 0.9955, test_loss: 0.9764, test_f1: 0.4846
 epoch: 17, train_loss: 0.9901, test_loss: 0.9732, test_f1: 0.4937
 epoch: 18, train_loss: 0.9810, test_loss: 0.9661, test_f1: 0.4956
 epoch: 19, train_loss: 0.9774, test_loss: 0.9621, test_f1: 0.4876
 epoch: 20, train_loss: 0.9684, test_loss: 0.9573, test_f1: 0.5095
 epoch: 21, train_loss: 0.9676, test_loss: 0.9519, test_f1: 0.5122
 epoch: 22, train_loss: 0.9628, test_loss: 0.9507, test_f1: 0.5083
 epoch: 23, train_loss: 0.9525, test_loss: 0.9468, test_f1: 0.5156
 epoch: 24, train_loss: 0.9470, test_loss: 0.9368, test_f1: 0.5218
 epoch: 25, train_loss: 0.9449, test_loss: 0.9390, test_f1: 0.5263
 epoch: 26, train_loss: 0.9354, test_loss: 0.9327, test_f1: 0.5131
 epoch: 27, train_loss: 0.9328, test_loss: 0.9268, test_f1: 0.5382
 epoch: 28, train_loss: 0.9318, test_loss: 0.9317, test_f1: 0.5354
 epoch: 29, train_loss: 0.9269, test_loss: 0.9299, test_f1: 0.5138
 epoch: 30, train_loss: 0.9244, test_loss: 0.9283, test_f1: 0.5156
 epoch: 31, train_loss: 0.9180, test_loss: 0.9234, test_f1: 0.5319
 epoch: 32, train_loss: 0.9139, test_loss: 0.9242, test_f1: 0.5259
 epoch: 33, train_loss: 0.9062, test_loss: 0.9219, test_f1: 0.5308
 epoch: 34, train_loss: 0.9028, test_loss: 0.9196, test_f1: 0.5172
 epoch: 35, train_loss: 0.9034, test_loss: 0.9183, test_f1: 0.5362
 epoch: 36, train_loss: 0.9006, test_loss: 0.9190, test_f1: 0.5195
 epoch: 37, train_loss: 0.8946, test_loss: 0.9171, test_f1: 0.5286
 epoch: 38, train_loss: 0.8940, test_loss: 0.9118, test_f1: 0.5187
 epoch: 39, train_loss: 0.8933, test_loss: 0.9049, test_f1: 0.5354
 epoch: 40, train_loss: 0.8803, test_loss: 0.9042, test_f1: 0.5359
 epoch: 41, train_loss: 0.8825, test_loss: 0.9091, test_f1: 0.5369
 epoch: 42, train_loss: 0.8791, test_loss: 0.9099, test_f1: 0.5280
 epoch: 43, train_loss: 0.8716, test_loss: 0.9035, test_f1: 0.5380
 epoch: 44, train_loss: 0.8714, test_loss: 0.8993, test_f1: 0.5401
 epoch: 45, train_loss: 0.8619, test_loss: 0.9021, test_f1: 0.5390
 epoch: 46, train_loss: 0.8653, test_loss: 0.8952, test_f1: 0.5404
 epoch: 47, train_loss: 0.8678, test_loss: 0.8939, test_f1: 0.5520
 epoch: 48, train_loss: 0.8528, test_loss: 0.8992, test_f1: 0.5374
 epoch: 49, train_loss: 0.8583, test_loss: 0.8873, test_f1: 0.5496
 epoch: 50, train_loss: 0.8492, test_loss: 0.8909, test_f1: 0.5463
 epoch: 51, train_loss: 0.8537, test_loss: 0.8900, test_f1: 0.5485
 epoch: 52, train_loss: 0.8473, test_loss: 0.8856, test_f1: 0.5556
 epoch: 53, train_loss: 0.8505, test_loss: 0.8854, test_f1: 0.5546
 epoch: 54, train_loss: 0.8426, test_loss: 0.8914, test_f1: 0.5494
 epoch: 55, train_loss: 0.8401, test_loss: 0.8840, test_f1: 0.5547
 epoch: 56, train_loss: 0.8419, test_loss: 0.8848, test_f1: 0.5513
 epoch: 57, train_loss: 0.8369, test_loss: 0.8856, test_f1: 0.5535
 epoch: 58, train_loss: 0.8372, test_loss: 0.8806, test_f1: 0.5546
 epoch: 59, train_loss: 0.8357, test_loss: 0.8816, test_f1: 0.5520
 epoch: 60, train_loss: 0.8393, test_loss: 0.8829, test_f1: 0.5459
 epoch: 61, train_loss: 0.8361, test_loss: 0.8792, test_f1: 0.5526
 epoch: 62, train_loss: 0.8320, test_loss: 0.8767, test_f1: 0.5582
 epoch: 63, train_loss: 0.8393, test_loss: 0.8800, test_f1: 0.5631
 epoch: 64, train_loss: 0.8326, test_loss: 0.8807, test_f1: 0.5571
 epoch: 65, train_loss: 0.8291, test_loss: 0.8788, test_f1: 0.5548
 epoch: 66, train_loss: 0.8306, test_loss: 0.8765, test_f1: 0.5536
 epoch: 67, train_loss: 0.8325, test_loss: 0.8820, test_f1: 0.5520
 epoch: 68, train_loss: 0.8307, test_loss: 0.8794, test_f1: 0.5540
 epoch: 69, train_loss: 0.8240, test_loss: 0.8774, test_f1: 0.5527
 epoch: 70, train_loss: 0.8138, test_loss: 0.8735, test_f1: 0.5579
 epoch: 71, train_loss: 0.8168, test_loss: 0.8762, test_f1: 0.5513
 epoch: 72, train_loss: 0.8240, test_loss: 0.8735, test_f1: 0.5591
 epoch: 73, train_loss: 0.8171, test_loss: 0.8748, test_f1: 0.5553
 epoch: 74, train_loss: 0.8172, test_loss: 0.8804, test_f1: 0.5587
 epoch: 75, train_loss: 0.8192, test_loss: 0.8733, test_f1: 0.5652
 epoch: 76, train_loss: 0.8148, test_loss: 0.8677, test_f1: 0.5561
 epoch: 77, train_loss: 0.8129, test_loss: 0.8753, test_f1: 0.5560
 epoch: 78, train_loss: 0.8089, test_loss: 0.8713, test_f1: 0.5618
 epoch: 79, train_loss: 0.8072, test_loss: 0.8709, test_f1: 0.5651
 epoch: 80, train_loss: 0.8082, test_loss: 0.8695, test_f1: 0.5624
 epoch: 81, train_loss: 0.8064, test_loss: 0.8691, test_f1: 0.5608
 epoch: 82, train_loss: 0.8091, test_loss: 0.8666, test_f1: 0.5619
 epoch: 83, train_loss: 0.8045, test_loss: 0.8627, test_f1: 0.5600
 epoch: 84, train_loss: 0.8009, test_loss: 0.8663, test_f1: 0.5573
 epoch: 85, train_loss: 0.8006, test_loss: 0.8635, test_f1: 0.5563
 epoch: 86, train_loss: 0.8090, test_loss: 0.8685, test_f1: 0.5603
 epoch: 87, train_loss: 0.8028, test_loss: 0.8662, test_f1: 0.5633
 epoch: 88, train_loss: 0.7934, test_loss: 0.8660, test_f1: 0.5594
 epoch: 89, train_loss: 0.7945, test_loss: 0.8634, test_f1: 0.5653
 epoch: 90, train_loss: 0.8006, test_loss: 0.8648, test_f1: 0.5618
 epoch: 91, train_loss: 0.7930, test_loss: 0.8651, test_f1: 0.5599
 epoch: 92, train_loss: 0.8021, test_loss: 0.8668, test_f1: 0.5642
 epoch: 93, train_loss: 0.7926, test_loss: 0.8622, test_f1: 0.5631
 epoch: 94, train_loss: 0.7922, test_loss: 0.8644, test_f1: 0.5639
 epoch: 95, train_loss: 0.7927, test_loss: 0.8708, test_f1: 0.5628
 epoch: 96, train_loss: 0.7931, test_loss: 0.8653, test_f1: 0.5602
 epoch: 97, train_loss: 0.7926, test_loss: 0.8632, test_f1: 0.5645
 epoch: 98, train_loss: 0.7837, test_loss: 0.8644, test_f1: 0.5676
 epoch: 99, train_loss: 0.7800, test_loss: 0.8656, test_f1: 0.5628
##################ITERATION #8 ****************************************
 epoch: 0, train_loss: 1.3151, test_loss: 1.3457, test_f1: 0.2270
 epoch: 1, train_loss: 1.1946, test_loss: 1.3166, test_f1: 0.2270
 epoch: 2, train_loss: 1.1519, test_loss: 1.2428, test_f1: 0.2270
 epoch: 3, train_loss: 1.1209, test_loss: 1.1431, test_f1: 0.3116
 epoch: 4, train_loss: 1.0956, test_loss: 1.0698, test_f1: 0.3748
 epoch: 5, train_loss: 1.0818, test_loss: 1.0406, test_f1: 0.4241
 epoch: 6, train_loss: 1.0610, test_loss: 1.0289, test_f1: 0.4416
 epoch: 7, train_loss: 1.0480, test_loss: 1.0230, test_f1: 0.4543
 epoch: 8, train_loss: 1.0421, test_loss: 1.0158, test_f1: 0.4604
 epoch: 9, train_loss: 1.0375, test_loss: 1.0127, test_f1: 0.4563
 epoch: 10, train_loss: 1.0331, test_loss: 1.0065, test_f1: 0.4702
 epoch: 11, train_loss: 1.0225, test_loss: 1.0026, test_f1: 0.4690
 epoch: 12, train_loss: 1.0103, test_loss: 0.9972, test_f1: 0.4722
 epoch: 13, train_loss: 1.0096, test_loss: 0.9891, test_f1: 0.4862
 epoch: 14, train_loss: 1.0014, test_loss: 0.9845, test_f1: 0.4959
 epoch: 15, train_loss: 0.9967, test_loss: 0.9828, test_f1: 0.4889
 epoch: 16, train_loss: 0.9913, test_loss: 0.9784, test_f1: 0.5161
 epoch: 17, train_loss: 0.9873, test_loss: 0.9712, test_f1: 0.5176
 epoch: 18, train_loss: 0.9829, test_loss: 0.9674, test_f1: 0.5130
 epoch: 19, train_loss: 0.9733, test_loss: 0.9718, test_f1: 0.5150
 epoch: 20, train_loss: 0.9736, test_loss: 0.9621, test_f1: 0.5106
 epoch: 21, train_loss: 0.9741, test_loss: 0.9563, test_f1: 0.5115
 epoch: 22, train_loss: 0.9688, test_loss: 0.9561, test_f1: 0.5159
 epoch: 23, train_loss: 0.9648, test_loss: 0.9531, test_f1: 0.5213
 epoch: 24, train_loss: 0.9594, test_loss: 0.9514, test_f1: 0.5157
 epoch: 25, train_loss: 0.9489, test_loss: 0.9482, test_f1: 0.5179
 epoch: 26, train_loss: 0.9548, test_loss: 0.9510, test_f1: 0.5213
 epoch: 27, train_loss: 0.9423, test_loss: 0.9460, test_f1: 0.5207
 epoch: 28, train_loss: 0.9489, test_loss: 0.9400, test_f1: 0.5242
 epoch: 29, train_loss: 0.9444, test_loss: 0.9403, test_f1: 0.5242
 epoch: 30, train_loss: 0.9434, test_loss: 0.9366, test_f1: 0.5254
 epoch: 31, train_loss: 0.9336, test_loss: 0.9330, test_f1: 0.5390
 epoch: 32, train_loss: 0.9358, test_loss: 0.9326, test_f1: 0.5263
 epoch: 33, train_loss: 0.9318, test_loss: 0.9275, test_f1: 0.5215
 epoch: 34, train_loss: 0.9298, test_loss: 0.9290, test_f1: 0.5301
 epoch: 35, train_loss: 0.9274, test_loss: 0.9241, test_f1: 0.5215
 epoch: 36, train_loss: 0.9242, test_loss: 0.9260, test_f1: 0.5265
 epoch: 37, train_loss: 0.9152, test_loss: 0.9149, test_f1: 0.5223
 epoch: 38, train_loss: 0.9180, test_loss: 0.9146, test_f1: 0.5285
 epoch: 39, train_loss: 0.9168, test_loss: 0.9090, test_f1: 0.5332
 epoch: 40, train_loss: 0.9144, test_loss: 0.9237, test_f1: 0.5262
 epoch: 41, train_loss: 0.9062, test_loss: 0.9056, test_f1: 0.5283
 epoch: 42, train_loss: 0.9029, test_loss: 0.9091, test_f1: 0.5380
 epoch: 43, train_loss: 0.9000, test_loss: 0.9088, test_f1: 0.5372
 epoch: 44, train_loss: 0.9019, test_loss: 0.9059, test_f1: 0.5348
 epoch: 45, train_loss: 0.8956, test_loss: 0.8975, test_f1: 0.5436
 epoch: 46, train_loss: 0.8939, test_loss: 0.8988, test_f1: 0.5450
 epoch: 47, train_loss: 0.8958, test_loss: 0.8917, test_f1: 0.5391
 epoch: 48, train_loss: 0.8850, test_loss: 0.9002, test_f1: 0.5379
 epoch: 49, train_loss: 0.8826, test_loss: 0.8990, test_f1: 0.5391
 epoch: 50, train_loss: 0.8881, test_loss: 0.8967, test_f1: 0.5456
 epoch: 51, train_loss: 0.8726, test_loss: 0.8951, test_f1: 0.5381
 epoch: 52, train_loss: 0.8708, test_loss: 0.8981, test_f1: 0.5454
 epoch: 53, train_loss: 0.8736, test_loss: 0.8866, test_f1: 0.5489
 epoch: 54, train_loss: 0.8751, test_loss: 0.8865, test_f1: 0.5536
 epoch: 55, train_loss: 0.8720, test_loss: 0.8895, test_f1: 0.5393
 epoch: 56, train_loss: 0.8740, test_loss: 0.8893, test_f1: 0.5550
 epoch: 57, train_loss: 0.8739, test_loss: 0.8820, test_f1: 0.5463
 epoch: 58, train_loss: 0.8706, test_loss: 0.8855, test_f1: 0.5533
 epoch: 59, train_loss: 0.8718, test_loss: 0.8890, test_f1: 0.5539
 epoch: 60, train_loss: 0.8743, test_loss: 0.8872, test_f1: 0.5560
 epoch: 61, train_loss: 0.8675, test_loss: 0.8820, test_f1: 0.5609
 epoch: 62, train_loss: 0.8612, test_loss: 0.8823, test_f1: 0.5560
 epoch: 63, train_loss: 0.8640, test_loss: 0.8848, test_f1: 0.5617
 epoch: 64, train_loss: 0.8586, test_loss: 0.8834, test_f1: 0.5522
 epoch: 65, train_loss: 0.8685, test_loss: 0.8785, test_f1: 0.5599
 epoch: 66, train_loss: 0.8655, test_loss: 0.8850, test_f1: 0.5582
 epoch: 67, train_loss: 0.8630, test_loss: 0.8817, test_f1: 0.5621
 epoch: 68, train_loss: 0.8591, test_loss: 0.8774, test_f1: 0.5581
 epoch: 69, train_loss: 0.8570, test_loss: 0.8759, test_f1: 0.5643
 epoch: 70, train_loss: 0.8620, test_loss: 0.8784, test_f1: 0.5653
 epoch: 71, train_loss: 0.8601, test_loss: 0.8746, test_f1: 0.5676
 epoch: 72, train_loss: 0.8531, test_loss: 0.8784, test_f1: 0.5615
 epoch: 73, train_loss: 0.8499, test_loss: 0.8711, test_f1: 0.5689
 epoch: 74, train_loss: 0.8569, test_loss: 0.8772, test_f1: 0.5644
 epoch: 75, train_loss: 0.8555, test_loss: 0.8752, test_f1: 0.5618
 epoch: 76, train_loss: 0.8516, test_loss: 0.8734, test_f1: 0.5657
 epoch: 77, train_loss: 0.8497, test_loss: 0.8724, test_f1: 0.5684
 epoch: 78, train_loss: 0.8489, test_loss: 0.8740, test_f1: 0.5676
 epoch: 79, train_loss: 0.8487, test_loss: 0.8719, test_f1: 0.5655
 epoch: 80, train_loss: 0.8443, test_loss: 0.8712, test_f1: 0.5610
 epoch: 81, train_loss: 0.8444, test_loss: 0.8719, test_f1: 0.5687
 epoch: 82, train_loss: 0.8450, test_loss: 0.8714, test_f1: 0.5665
 epoch: 83, train_loss: 0.8434, test_loss: 0.8758, test_f1: 0.5685
 epoch: 84, train_loss: 0.8392, test_loss: 0.8766, test_f1: 0.5687
 epoch: 85, train_loss: 0.8388, test_loss: 0.8746, test_f1: 0.5635
 epoch: 86, train_loss: 0.8412, test_loss: 0.8657, test_f1: 0.5708
 epoch: 87, train_loss: 0.8335, test_loss: 0.8727, test_f1: 0.5672
 epoch: 88, train_loss: 0.8381, test_loss: 0.8709, test_f1: 0.5664
 epoch: 89, train_loss: 0.8326, test_loss: 0.8745, test_f1: 0.5659
 epoch: 90, train_loss: 0.8360, test_loss: 0.8677, test_f1: 0.5672
 epoch: 91, train_loss: 0.8377, test_loss: 0.8716, test_f1: 0.5709
 epoch: 92, train_loss: 0.8398, test_loss: 0.8723, test_f1: 0.5709
 epoch: 93, train_loss: 0.8390, test_loss: 0.8668, test_f1: 0.5708
 epoch: 94, train_loss: 0.8377, test_loss: 0.8702, test_f1: 0.5695
 epoch: 95, train_loss: 0.8316, test_loss: 0.8644, test_f1: 0.5675
 epoch: 96, train_loss: 0.8273, test_loss: 0.8689, test_f1: 0.5719
 epoch: 97, train_loss: 0.8260, test_loss: 0.8703, test_f1: 0.5696
 epoch: 98, train_loss: 0.8304, test_loss: 0.8663, test_f1: 0.5683
 epoch: 99, train_loss: 0.8267, test_loss: 0.8655, test_f1: 0.5677
##################ITERATION #9 ****************************************
 epoch: 0, train_loss: 1.3338, test_loss: 1.3187, test_f1: 0.2270
 epoch: 1, train_loss: 1.2243, test_loss: 1.2849, test_f1: 0.2270
 epoch: 2, train_loss: 1.1846, test_loss: 1.2407, test_f1: 0.2271
 epoch: 3, train_loss: 1.1489, test_loss: 1.1718, test_f1: 0.2787
 epoch: 4, train_loss: 1.1234, test_loss: 1.0979, test_f1: 0.3844
 epoch: 5, train_loss: 1.1063, test_loss: 1.0569, test_f1: 0.4307
 epoch: 6, train_loss: 1.0828, test_loss: 1.0351, test_f1: 0.4363
 epoch: 7, train_loss: 1.0745, test_loss: 1.0205, test_f1: 0.4292
 epoch: 8, train_loss: 1.0594, test_loss: 1.0099, test_f1: 0.4358
 epoch: 9, train_loss: 1.0556, test_loss: 1.0019, test_f1: 0.4434
 epoch: 10, train_loss: 1.0451, test_loss: 0.9949, test_f1: 0.4516
 epoch: 11, train_loss: 1.0330, test_loss: 0.9869, test_f1: 0.4577
 epoch: 12, train_loss: 1.0274, test_loss: 0.9818, test_f1: 0.4600
 epoch: 13, train_loss: 1.0186, test_loss: 0.9762, test_f1: 0.4648
 epoch: 14, train_loss: 1.0133, test_loss: 0.9727, test_f1: 0.4610
 epoch: 15, train_loss: 0.9973, test_loss: 0.9654, test_f1: 0.4770
 epoch: 16, train_loss: 1.0018, test_loss: 0.9596, test_f1: 0.4815
 epoch: 17, train_loss: 0.9927, test_loss: 0.9579, test_f1: 0.4784
 epoch: 18, train_loss: 0.9848, test_loss: 0.9528, test_f1: 0.4790
 epoch: 19, train_loss: 0.9789, test_loss: 0.9489, test_f1: 0.4799
 epoch: 20, train_loss: 0.9742, test_loss: 0.9468, test_f1: 0.4799
 epoch: 21, train_loss: 0.9666, test_loss: 0.9428, test_f1: 0.4804
 epoch: 22, train_loss: 0.9642, test_loss: 0.9405, test_f1: 0.4953
 epoch: 23, train_loss: 0.9658, test_loss: 0.9366, test_f1: 0.4908
 epoch: 24, train_loss: 0.9601, test_loss: 0.9325, test_f1: 0.5039
 epoch: 25, train_loss: 0.9524, test_loss: 0.9347, test_f1: 0.5082
 epoch: 26, train_loss: 0.9490, test_loss: 0.9295, test_f1: 0.5085
 epoch: 27, train_loss: 0.9483, test_loss: 0.9277, test_f1: 0.5129
 epoch: 28, train_loss: 0.9423, test_loss: 0.9263, test_f1: 0.5173
 epoch: 29, train_loss: 0.9416, test_loss: 0.9226, test_f1: 0.5204
 epoch: 30, train_loss: 0.9351, test_loss: 0.9184, test_f1: 0.5222
 epoch: 31, train_loss: 0.9323, test_loss: 0.9161, test_f1: 0.5219
 epoch: 32, train_loss: 0.9359, test_loss: 0.9141, test_f1: 0.5230
 epoch: 33, train_loss: 0.9262, test_loss: 0.9130, test_f1: 0.5236
 epoch: 34, train_loss: 0.9183, test_loss: 0.9081, test_f1: 0.5251
 epoch: 35, train_loss: 0.9265, test_loss: 0.9062, test_f1: 0.5251
 epoch: 36, train_loss: 0.9197, test_loss: 0.9088, test_f1: 0.5245
 epoch: 37, train_loss: 0.9173, test_loss: 0.9017, test_f1: 0.5293
 epoch: 38, train_loss: 0.9106, test_loss: 0.9024, test_f1: 0.5368
 epoch: 39, train_loss: 0.9047, test_loss: 0.9001, test_f1: 0.5406
 epoch: 40, train_loss: 0.9062, test_loss: 0.8975, test_f1: 0.5346
 epoch: 41, train_loss: 0.9042, test_loss: 0.8943, test_f1: 0.5294
 epoch: 42, train_loss: 0.9044, test_loss: 0.8899, test_f1: 0.5450
 epoch: 43, train_loss: 0.8936, test_loss: 0.8905, test_f1: 0.5370
 epoch: 44, train_loss: 0.8964, test_loss: 0.8872, test_f1: 0.5437
 epoch: 45, train_loss: 0.8907, test_loss: 0.8843, test_f1: 0.5437
 epoch: 46, train_loss: 0.8843, test_loss: 0.8849, test_f1: 0.5456
 epoch: 47, train_loss: 0.8853, test_loss: 0.8801, test_f1: 0.5462
 epoch: 48, train_loss: 0.8877, test_loss: 0.8765, test_f1: 0.5450
 epoch: 49, train_loss: 0.8765, test_loss: 0.8781, test_f1: 0.5449
 epoch: 50, train_loss: 0.8764, test_loss: 0.8740, test_f1: 0.5451
 epoch: 51, train_loss: 0.8689, test_loss: 0.8718, test_f1: 0.5479
 epoch: 52, train_loss: 0.8743, test_loss: 0.8736, test_f1: 0.5481
 epoch: 53, train_loss: 0.8726, test_loss: 0.8736, test_f1: 0.5492
 epoch: 54, train_loss: 0.8645, test_loss: 0.8720, test_f1: 0.5479
 epoch: 55, train_loss: 0.8673, test_loss: 0.8723, test_f1: 0.5552
 epoch: 56, train_loss: 0.8665, test_loss: 0.8712, test_f1: 0.5539
 epoch: 57, train_loss: 0.8719, test_loss: 0.8713, test_f1: 0.5494
 epoch: 58, train_loss: 0.8652, test_loss: 0.8714, test_f1: 0.5507
 epoch: 59, train_loss: 0.8661, test_loss: 0.8692, test_f1: 0.5551
 epoch: 60, train_loss: 0.8630, test_loss: 0.8686, test_f1: 0.5584
 epoch: 61, train_loss: 0.8591, test_loss: 0.8679, test_f1: 0.5587
 epoch: 62, train_loss: 0.8512, test_loss: 0.8683, test_f1: 0.5565
 epoch: 63, train_loss: 0.8515, test_loss: 0.8670, test_f1: 0.5623
 epoch: 64, train_loss: 0.8633, test_loss: 0.8676, test_f1: 0.5639
 epoch: 65, train_loss: 0.8489, test_loss: 0.8667, test_f1: 0.5591
 epoch: 66, train_loss: 0.8551, test_loss: 0.8653, test_f1: 0.5543
 epoch: 67, train_loss: 0.8506, test_loss: 0.8623, test_f1: 0.5638
 epoch: 68, train_loss: 0.8581, test_loss: 0.8628, test_f1: 0.5614
 epoch: 69, train_loss: 0.8528, test_loss: 0.8611, test_f1: 0.5560
 epoch: 70, train_loss: 0.8481, test_loss: 0.8630, test_f1: 0.5681
 epoch: 71, train_loss: 0.8517, test_loss: 0.8636, test_f1: 0.5691
 epoch: 72, train_loss: 0.8447, test_loss: 0.8644, test_f1: 0.5679
 epoch: 73, train_loss: 0.8387, test_loss: 0.8626, test_f1: 0.5656
 epoch: 74, train_loss: 0.8420, test_loss: 0.8606, test_f1: 0.5649
 epoch: 75, train_loss: 0.8546, test_loss: 0.8601, test_f1: 0.5714
 epoch: 76, train_loss: 0.8448, test_loss: 0.8603, test_f1: 0.5727
 epoch: 77, train_loss: 0.8432, test_loss: 0.8599, test_f1: 0.5721
 epoch: 78, train_loss: 0.8410, test_loss: 0.8604, test_f1: 0.5665
 epoch: 79, train_loss: 0.8378, test_loss: 0.8616, test_f1: 0.5656
 epoch: 80, train_loss: 0.8425, test_loss: 0.8605, test_f1: 0.5695
 epoch: 81, train_loss: 0.8413, test_loss: 0.8590, test_f1: 0.5642
 epoch: 82, train_loss: 0.8352, test_loss: 0.8605, test_f1: 0.5676
 epoch: 83, train_loss: 0.8301, test_loss: 0.8588, test_f1: 0.5675
 epoch: 84, train_loss: 0.8352, test_loss: 0.8603, test_f1: 0.5669
 epoch: 85, train_loss: 0.8347, test_loss: 0.8576, test_f1: 0.5654
 epoch: 86, train_loss: 0.8326, test_loss: 0.8573, test_f1: 0.5636
 epoch: 87, train_loss: 0.8257, test_loss: 0.8589, test_f1: 0.5678
 epoch: 88, train_loss: 0.8283, test_loss: 0.8570, test_f1: 0.5717
 epoch: 89, train_loss: 0.8306, test_loss: 0.8531, test_f1: 0.5660
 epoch: 90, train_loss: 0.8290, test_loss: 0.8538, test_f1: 0.5678
 epoch: 91, train_loss: 0.8312, test_loss: 0.8549, test_f1: 0.5678
 epoch: 92, train_loss: 0.8306, test_loss: 0.8555, test_f1: 0.5655
 epoch: 93, train_loss: 0.8273, test_loss: 0.8548, test_f1: 0.5659
 epoch: 94, train_loss: 0.8190, test_loss: 0.8522, test_f1: 0.5673
 epoch: 95, train_loss: 0.8201, test_loss: 0.8537, test_f1: 0.5642
 epoch: 96, train_loss: 0.8249, test_loss: 0.8538, test_f1: 0.5634
 epoch: 97, train_loss: 0.8280, test_loss: 0.8565, test_f1: 0.5654
 epoch: 98, train_loss: 0.8213, test_loss: 0.8591, test_f1: 0.5705
 epoch: 99, train_loss: 0.8176, test_loss: 0.8571, test_f1: 0.5700

Training completed in 405.19 seconds
Best F1: 0.5727 at epoch 76
Mean F1 across iterations: 0.5557  0.0125
========================FINAL RESULTS================================
FEGIN weighted F1: 0.5727  0.0125
python main.py --data ltspice_examples --representation component_pin_net --model FEGIN --layers 2 --hiddens 64 --batch_size 256 --lr 0.0001 --emb_size 250 --epochs 100 --save_appendix component_pin_net_L2_H64_BS256_LR0.0001_E250 --no_val
-----



STDERR:
  File "main.py", line 370, in <module>
    main()
  File "main.py", line 254, in main
    dataset = dataset_class(
  File "/home/philip/projects/ltspice_examples_code_repo/Circuit-Completion-Using-GNNs/component_classification_with_link_prediction_head/evaluation/FEGIN/kernel/circuit_datasets.py", line 15, in __init__
    self.data, self.slices = torch.load(self.processed_paths[0])
  File "/home/philip/.local/lib/python3.8/site-packages/torch/serialization.py", line 1040, in load
    warnings.warn(
  File "/usr/lib/python3.8/warnings.py", line 109, in _showwarnmsg
    sw(msg.message, msg.category, msg.filename, msg.lineno,
  File "main.py", line 47, in warn_with_traceback
    traceback.print_stack(file=log)
/home/philip/projects/ltspice_examples_code_repo/Circuit-Completion-Using-GNNs/component_classification_with_link_prediction_head/evaluation/FEGIN/kernel/circuit_datasets.py:15: FutureWarning: You are using `torch.load` with `weights_only=False` (the current default value), which uses the default pickle module implicitly. It is possible to construct malicious pickle data which will execute arbitrary code during unpickling (See https://github.com/pytorch/pytorch/blob/main/SECURITY.md#untrusted-models for more details). In a future release, the default value for `weights_only` will be flipped to `True`. This limits the functions that could be executed during unpickling. Arbitrary objects will no longer be allowed to be loaded via this mode unless they are explicitly allowlisted by the user via `torch.serialization.add_safe_globals`. We recommend you start setting `weights_only=True` for any use case where you don't have full control of the loaded file. Please open an issue on GitHub for any issues related to this experimental feature.
  self.data, self.slices = torch.load(self.processed_paths[0])
