STDOUT:
Results will be saved in /home/philip/projects/ltspice_examples_code_repo/Circuit-Completion-Using-GNNs/component_classification_with_link_prediction_head/evaluation/FEGIN/results/model_FEGIN_dataset_ltspice_examples
Command line input: python main.py --data ltspice_examples --representation component_component --model FEGIN --layers 4 --hiddens 64 --batch_size 32 --lr 0.001 --emb_size 128 --epochs 100 --save_appendix component_component_L4_H64_BS32_LR0.001_E128 --no_val
 is saved.
-----
ltspice_examples - FEGIN
Using 4 layers, 64 hidden units, h = 2
Loading component_component representation dataset
ENTERED
Training FEGIN on component_component representation
Train: 3556, Test: 845
##################ITERATION #0 ****************************************
 epoch: 0, train_loss: 1.2647, test_loss: 1.1855, test_f1: 0.3478
 epoch: 1, train_loss: 1.1548, test_loss: 1.0506, test_f1: 0.4486
 epoch: 2, train_loss: 1.0952, test_loss: 1.0107, test_f1: 0.4910
 epoch: 3, train_loss: 1.0620, test_loss: 0.9880, test_f1: 0.4488
 epoch: 4, train_loss: 1.0195, test_loss: 0.9694, test_f1: 0.4543
 epoch: 5, train_loss: 1.0046, test_loss: 1.0246, test_f1: 0.4525
 epoch: 6, train_loss: 0.9652, test_loss: 0.9527, test_f1: 0.4661
 epoch: 7, train_loss: 0.9850, test_loss: 0.9846, test_f1: 0.5049
 epoch: 8, train_loss: 0.9653, test_loss: 1.0302, test_f1: 0.4789
 epoch: 9, train_loss: 0.9427, test_loss: 0.9787, test_f1: 0.5088
 epoch: 10, train_loss: 0.9327, test_loss: 1.0038, test_f1: 0.5144
 epoch: 11, train_loss: 0.9363, test_loss: 0.9996, test_f1: 0.4942
 epoch: 12, train_loss: 0.9121, test_loss: 1.0135, test_f1: 0.4945
 epoch: 13, train_loss: 0.8930, test_loss: 1.0307, test_f1: 0.5199
 epoch: 14, train_loss: 0.8793, test_loss: 1.0582, test_f1: 0.5140
 epoch: 15, train_loss: 0.8622, test_loss: 1.1780, test_f1: 0.4720
 epoch: 16, train_loss: 0.8648, test_loss: 1.0147, test_f1: 0.5423
 epoch: 17, train_loss: 0.8387, test_loss: 0.9955, test_f1: 0.5603
 epoch: 18, train_loss: 0.8690, test_loss: 0.9788, test_f1: 0.5677
 epoch: 19, train_loss: 0.8410, test_loss: 1.1343, test_f1: 0.5020
 epoch: 20, train_loss: 0.8759, test_loss: 1.0200, test_f1: 0.5347
 epoch: 21, train_loss: 0.8472, test_loss: 1.0393, test_f1: 0.5219
 epoch: 22, train_loss: 0.8300, test_loss: 1.0411, test_f1: 0.5562
 epoch: 23, train_loss: 0.8149, test_loss: 1.0360, test_f1: 0.5283
 epoch: 24, train_loss: 0.8154, test_loss: 1.0661, test_f1: 0.5339
 epoch: 25, train_loss: 0.8118, test_loss: 1.0586, test_f1: 0.5229
 epoch: 26, train_loss: 0.7884, test_loss: 1.0913, test_f1: 0.5259
 epoch: 27, train_loss: 0.8011, test_loss: 1.0834, test_f1: 0.5505
 epoch: 28, train_loss: 0.7804, test_loss: 1.1406, test_f1: 0.5087
 epoch: 29, train_loss: 0.7792, test_loss: 0.9884, test_f1: 0.5501
 epoch: 30, train_loss: 0.7945, test_loss: 1.1078, test_f1: 0.5580
 epoch: 31, train_loss: 0.7761, test_loss: 1.1663, test_f1: 0.5253
 epoch: 32, train_loss: 0.7681, test_loss: 1.0935, test_f1: 0.5598
 epoch: 33, train_loss: 0.7510, test_loss: 1.1896, test_f1: 0.5168
 epoch: 34, train_loss: 0.7672, test_loss: 1.1095, test_f1: 0.5573
 epoch: 35, train_loss: 0.7525, test_loss: 1.1199, test_f1: 0.5702
 epoch: 36, train_loss: 0.7466, test_loss: 1.1534, test_f1: 0.5499
 epoch: 37, train_loss: 0.7685, test_loss: 1.1668, test_f1: 0.5513
 epoch: 38, train_loss: 0.7476, test_loss: 1.1247, test_f1: 0.5666
 epoch: 39, train_loss: 0.7186, test_loss: 1.2021, test_f1: 0.5490
 epoch: 40, train_loss: 0.7419, test_loss: 1.1717, test_f1: 0.5490
 epoch: 41, train_loss: 0.8097, test_loss: 1.0234, test_f1: 0.5496
 epoch: 42, train_loss: 0.7584, test_loss: 1.1208, test_f1: 0.5402
 epoch: 43, train_loss: 0.7134, test_loss: 1.1930, test_f1: 0.5319
 epoch: 44, train_loss: 0.7559, test_loss: 1.1639, test_f1: 0.5441
 epoch: 45, train_loss: 0.7031, test_loss: 1.0995, test_f1: 0.5382
 epoch: 46, train_loss: 0.7077, test_loss: 1.1252, test_f1: 0.5682
 epoch: 47, train_loss: 0.7059, test_loss: 1.1669, test_f1: 0.5351
 epoch: 48, train_loss: 0.7088, test_loss: 1.0892, test_f1: 0.5855
 epoch: 49, train_loss: 0.6926, test_loss: 1.1408, test_f1: 0.5674
 epoch: 50, train_loss: 0.6787, test_loss: 1.1853, test_f1: 0.5332
 epoch: 51, train_loss: 0.6518, test_loss: 1.1300, test_f1: 0.5709
 epoch: 52, train_loss: 0.6239, test_loss: 1.1629, test_f1: 0.5884
 epoch: 53, train_loss: 0.6400, test_loss: 1.1747, test_f1: 0.5728
 epoch: 54, train_loss: 0.6168, test_loss: 1.1716, test_f1: 0.5852
 epoch: 55, train_loss: 0.6250, test_loss: 1.2140, test_f1: 0.5717
 epoch: 56, train_loss: 0.6317, test_loss: 1.1683, test_f1: 0.5822
 epoch: 57, train_loss: 0.5985, test_loss: 1.1948, test_f1: 0.5529
 epoch: 58, train_loss: 0.6527, test_loss: 1.1795, test_f1: 0.5850
 epoch: 59, train_loss: 0.6206, test_loss: 1.1811, test_f1: 0.5735
 epoch: 60, train_loss: 0.5990, test_loss: 1.1887, test_f1: 0.5713
 epoch: 61, train_loss: 0.5937, test_loss: 1.2292, test_f1: 0.5574
 epoch: 62, train_loss: 0.5891, test_loss: 1.2258, test_f1: 0.5678
 epoch: 63, train_loss: 0.5949, test_loss: 1.1773, test_f1: 0.5742
 epoch: 64, train_loss: 0.5994, test_loss: 1.2603, test_f1: 0.5793
 epoch: 65, train_loss: 0.5929, test_loss: 1.2517, test_f1: 0.5916
 epoch: 66, train_loss: 0.5990, test_loss: 1.2226, test_f1: 0.5677
 epoch: 67, train_loss: 0.6004, test_loss: 1.2073, test_f1: 0.5549
 epoch: 68, train_loss: 0.5746, test_loss: 1.1820, test_f1: 0.5864
 epoch: 69, train_loss: 0.5833, test_loss: 1.2373, test_f1: 0.5654
 epoch: 70, train_loss: 0.5811, test_loss: 1.2214, test_f1: 0.5541
 epoch: 71, train_loss: 0.5746, test_loss: 1.1805, test_f1: 0.5755
 epoch: 72, train_loss: 0.5569, test_loss: 1.1763, test_f1: 0.5725
 epoch: 73, train_loss: 0.5696, test_loss: 1.2426, test_f1: 0.5586
 epoch: 74, train_loss: 0.5416, test_loss: 1.2948, test_f1: 0.5533
 epoch: 75, train_loss: 0.5571, test_loss: 1.3014, test_f1: 0.5760
 epoch: 76, train_loss: 0.5562, test_loss: 1.3034, test_f1: 0.5355
 epoch: 77, train_loss: 0.5621, test_loss: 1.2767, test_f1: 0.5312
 epoch: 78, train_loss: 0.5607, test_loss: 1.2319, test_f1: 0.5634
 epoch: 79, train_loss: 0.5370, test_loss: 1.3001, test_f1: 0.5692
 epoch: 80, train_loss: 0.5372, test_loss: 1.3288, test_f1: 0.5560
 epoch: 81, train_loss: 0.5288, test_loss: 1.3447, test_f1: 0.5701
 epoch: 82, train_loss: 0.5556, test_loss: 1.3930, test_f1: 0.5363
 epoch: 83, train_loss: 0.6029, test_loss: 1.3129, test_f1: 0.5481
 epoch: 84, train_loss: 0.5307, test_loss: 1.3646, test_f1: 0.5490
 epoch: 85, train_loss: 0.5331, test_loss: 1.3622, test_f1: 0.5411
 epoch: 86, train_loss: 0.5455, test_loss: 1.4093, test_f1: 0.5315
 epoch: 87, train_loss: 0.5786, test_loss: 1.4148, test_f1: 0.5366
 epoch: 88, train_loss: 0.5341, test_loss: 1.3506, test_f1: 0.5647
 epoch: 89, train_loss: 0.5319, test_loss: 1.2525, test_f1: 0.5833
 epoch: 90, train_loss: 0.5303, test_loss: 1.3653, test_f1: 0.5449
 epoch: 91, train_loss: 0.5324, test_loss: 1.4004, test_f1: 0.5507
 epoch: 92, train_loss: 0.5138, test_loss: 1.3831, test_f1: 0.5366
 epoch: 93, train_loss: 0.5097, test_loss: 1.4004, test_f1: 0.5576
 epoch: 94, train_loss: 0.5100, test_loss: 1.2639, test_f1: 0.6013
 epoch: 95, train_loss: 0.5010, test_loss: 1.3848, test_f1: 0.5558
 epoch: 96, train_loss: 0.5437, test_loss: 1.3649, test_f1: 0.5516
 epoch: 97, train_loss: 0.5047, test_loss: 1.3135, test_f1: 0.5731
 epoch: 98, train_loss: 0.4997, test_loss: 1.2912, test_f1: 0.5957
 epoch: 99, train_loss: 0.4830, test_loss: 1.3746, test_f1: 0.5859
##################ITERATION #1 ****************************************
 epoch: 0, train_loss: 1.2495, test_loss: 1.1430, test_f1: 0.4424
 epoch: 1, train_loss: 1.1446, test_loss: 1.0582, test_f1: 0.4377
 epoch: 2, train_loss: 1.1019, test_loss: 1.0521, test_f1: 0.4235
 epoch: 3, train_loss: 1.0697, test_loss: 1.0068, test_f1: 0.4649
 epoch: 4, train_loss: 1.0398, test_loss: 1.1160, test_f1: 0.4326
 epoch: 5, train_loss: 1.0125, test_loss: 0.9798, test_f1: 0.4453
 epoch: 6, train_loss: 1.0119, test_loss: 0.9469, test_f1: 0.4888
 epoch: 7, train_loss: 0.9932, test_loss: 0.9645, test_f1: 0.4752
 epoch: 8, train_loss: 0.9963, test_loss: 0.9179, test_f1: 0.5024
 epoch: 9, train_loss: 0.9614, test_loss: 1.0196, test_f1: 0.4488
 epoch: 10, train_loss: 0.9599, test_loss: 0.9626, test_f1: 0.4840
 epoch: 11, train_loss: 0.9217, test_loss: 0.9419, test_f1: 0.5233
 epoch: 12, train_loss: 0.9414, test_loss: 1.0021, test_f1: 0.5110
 epoch: 13, train_loss: 0.9249, test_loss: 0.9294, test_f1: 0.5172
 epoch: 14, train_loss: 0.8891, test_loss: 0.9772, test_f1: 0.4832
 epoch: 15, train_loss: 0.9082, test_loss: 0.9087, test_f1: 0.5346
 epoch: 16, train_loss: 0.8880, test_loss: 0.9517, test_f1: 0.5184
 epoch: 17, train_loss: 0.8804, test_loss: 0.9985, test_f1: 0.5302
 epoch: 18, train_loss: 0.8709, test_loss: 0.9360, test_f1: 0.5380
 epoch: 19, train_loss: 0.8593, test_loss: 0.9407, test_f1: 0.5306
 epoch: 20, train_loss: 0.8539, test_loss: 0.9839, test_f1: 0.5228
 epoch: 21, train_loss: 0.8631, test_loss: 0.9838, test_f1: 0.5076
 epoch: 22, train_loss: 0.8378, test_loss: 0.9252, test_f1: 0.5486
 epoch: 23, train_loss: 0.8337, test_loss: 1.0055, test_f1: 0.5448
 epoch: 24, train_loss: 0.8388, test_loss: 1.0470, test_f1: 0.5205
 epoch: 25, train_loss: 0.8239, test_loss: 1.0063, test_f1: 0.5393
 epoch: 26, train_loss: 0.8299, test_loss: 1.0313, test_f1: 0.5386
 epoch: 27, train_loss: 0.8312, test_loss: 1.0222, test_f1: 0.5261
 epoch: 28, train_loss: 0.8101, test_loss: 1.0159, test_f1: 0.5357
 epoch: 29, train_loss: 0.7916, test_loss: 1.0216, test_f1: 0.5478
 epoch: 30, train_loss: 0.8035, test_loss: 1.0203, test_f1: 0.5288
 epoch: 31, train_loss: 0.7987, test_loss: 1.0156, test_f1: 0.5206
 epoch: 32, train_loss: 0.7863, test_loss: 1.0196, test_f1: 0.5425
 epoch: 33, train_loss: 0.7771, test_loss: 1.0974, test_f1: 0.5254
 epoch: 34, train_loss: 0.7867, test_loss: 1.0230, test_f1: 0.5514
 epoch: 35, train_loss: 0.7875, test_loss: 1.0018, test_f1: 0.5504
 epoch: 36, train_loss: 0.7536, test_loss: 1.0170, test_f1: 0.5630
 epoch: 37, train_loss: 0.7861, test_loss: 1.0100, test_f1: 0.5548
 epoch: 38, train_loss: 0.7743, test_loss: 1.0017, test_f1: 0.5258
 epoch: 39, train_loss: 0.7402, test_loss: 1.0345, test_f1: 0.5425
 epoch: 40, train_loss: 0.7388, test_loss: 1.1091, test_f1: 0.5177
 epoch: 41, train_loss: 0.7429, test_loss: 1.0550, test_f1: 0.5322
 epoch: 42, train_loss: 0.7346, test_loss: 1.1248, test_f1: 0.5554
 epoch: 43, train_loss: 0.7282, test_loss: 1.2310, test_f1: 0.5086
 epoch: 44, train_loss: 0.7112, test_loss: 1.1755, test_f1: 0.5313
 epoch: 45, train_loss: 0.7311, test_loss: 1.0781, test_f1: 0.5705
 epoch: 46, train_loss: 0.7325, test_loss: 1.1006, test_f1: 0.5387
 epoch: 47, train_loss: 0.7262, test_loss: 1.0364, test_f1: 0.5555
 epoch: 48, train_loss: 0.7210, test_loss: 1.0629, test_f1: 0.5517
 epoch: 49, train_loss: 0.6982, test_loss: 1.0988, test_f1: 0.5486
 epoch: 50, train_loss: 0.7147, test_loss: 1.0889, test_f1: 0.5493
 epoch: 51, train_loss: 0.6605, test_loss: 1.1172, test_f1: 0.5582
 epoch: 52, train_loss: 0.7011, test_loss: 1.1076, test_f1: 0.5791
 epoch: 53, train_loss: 0.6822, test_loss: 1.1108, test_f1: 0.5507
 epoch: 54, train_loss: 0.6545, test_loss: 1.1272, test_f1: 0.5427
 epoch: 55, train_loss: 0.6468, test_loss: 1.1558, test_f1: 0.5315
 epoch: 56, train_loss: 0.6388, test_loss: 1.1346, test_f1: 0.5499
 epoch: 57, train_loss: 0.6337, test_loss: 1.1415, test_f1: 0.5432
 epoch: 58, train_loss: 0.6202, test_loss: 1.1014, test_f1: 0.5447
 epoch: 59, train_loss: 0.6400, test_loss: 1.1605, test_f1: 0.5278
 epoch: 60, train_loss: 0.6206, test_loss: 1.1330, test_f1: 0.5631
 epoch: 61, train_loss: 0.6171, test_loss: 1.1830, test_f1: 0.5567
 epoch: 62, train_loss: 0.6099, test_loss: 1.1990, test_f1: 0.5500
 epoch: 63, train_loss: 0.6144, test_loss: 1.1853, test_f1: 0.5661
 epoch: 64, train_loss: 0.5963, test_loss: 1.1889, test_f1: 0.5410
 epoch: 65, train_loss: 0.5884, test_loss: 1.1930, test_f1: 0.5520
 epoch: 66, train_loss: 0.5892, test_loss: 1.2069, test_f1: 0.5228
 epoch: 67, train_loss: 0.6168, test_loss: 1.1254, test_f1: 0.5610
 epoch: 68, train_loss: 0.5880, test_loss: 1.1660, test_f1: 0.5768
 epoch: 69, train_loss: 0.6043, test_loss: 1.1899, test_f1: 0.5654
 epoch: 70, train_loss: 0.5821, test_loss: 1.2456, test_f1: 0.5610
 epoch: 71, train_loss: 0.6005, test_loss: 1.2628, test_f1: 0.5621
 epoch: 72, train_loss: 0.5826, test_loss: 1.1961, test_f1: 0.5550
 epoch: 73, train_loss: 0.5788, test_loss: 1.2114, test_f1: 0.5665
 epoch: 74, train_loss: 0.5676, test_loss: 1.2093, test_f1: 0.5570
 epoch: 75, train_loss: 0.5926, test_loss: 1.1964, test_f1: 0.5427
 epoch: 76, train_loss: 0.5647, test_loss: 1.2395, test_f1: 0.5466
 epoch: 77, train_loss: 0.5413, test_loss: 1.2875, test_f1: 0.5591
 epoch: 78, train_loss: 0.5798, test_loss: 1.2157, test_f1: 0.5698
 epoch: 79, train_loss: 0.5582, test_loss: 1.2884, test_f1: 0.5665
 epoch: 80, train_loss: 0.6214, test_loss: 1.1965, test_f1: 0.5845
 epoch: 81, train_loss: 0.5651, test_loss: 1.2630, test_f1: 0.5645
 epoch: 82, train_loss: 0.5624, test_loss: 1.1895, test_f1: 0.5859
 epoch: 83, train_loss: 0.5600, test_loss: 1.2339, test_f1: 0.5776
 epoch: 84, train_loss: 0.5569, test_loss: 1.2291, test_f1: 0.5534
 epoch: 85, train_loss: 0.5436, test_loss: 1.1563, test_f1: 0.5730
 epoch: 86, train_loss: 0.5503, test_loss: 1.2123, test_f1: 0.5764
 epoch: 87, train_loss: 0.5257, test_loss: 1.2386, test_f1: 0.5650
 epoch: 88, train_loss: 0.5422, test_loss: 1.2774, test_f1: 0.5793
 epoch: 89, train_loss: 0.6271, test_loss: 1.2423, test_f1: 0.5848
 epoch: 90, train_loss: 0.5682, test_loss: 1.2271, test_f1: 0.5721
 epoch: 91, train_loss: 0.5349, test_loss: 1.2880, test_f1: 0.5429
 epoch: 92, train_loss: 0.5308, test_loss: 1.3039, test_f1: 0.5497
 epoch: 93, train_loss: 0.5166, test_loss: 1.3198, test_f1: 0.5795
 epoch: 94, train_loss: 0.5325, test_loss: 1.3177, test_f1: 0.5809
 epoch: 95, train_loss: 0.5409, test_loss: 1.2283, test_f1: 0.5686
 epoch: 96, train_loss: 0.5424, test_loss: 1.2545, test_f1: 0.5450
 epoch: 97, train_loss: 0.5048, test_loss: 1.2354, test_f1: 0.5558
 epoch: 98, train_loss: 0.5217, test_loss: 1.2471, test_f1: 0.5657
 epoch: 99, train_loss: 0.5154, test_loss: 1.2890, test_f1: 0.5797
##################ITERATION #2 ****************************************
 epoch: 0, train_loss: 1.2557, test_loss: 1.1566, test_f1: 0.4653
 epoch: 1, train_loss: 1.1366, test_loss: 1.0430, test_f1: 0.4893
 epoch: 2, train_loss: 1.0880, test_loss: 1.0102, test_f1: 0.4561
 epoch: 3, train_loss: 1.0482, test_loss: 0.9717, test_f1: 0.5141
 epoch: 4, train_loss: 1.0348, test_loss: 0.9715, test_f1: 0.4724
 epoch: 5, train_loss: 1.0031, test_loss: 0.9646, test_f1: 0.4909
 epoch: 6, train_loss: 1.0008, test_loss: 0.9765, test_f1: 0.4716
 epoch: 7, train_loss: 0.9873, test_loss: 0.9297, test_f1: 0.5281
 epoch: 8, train_loss: 0.9535, test_loss: 0.9373, test_f1: 0.5083
 epoch: 9, train_loss: 0.9501, test_loss: 0.9237, test_f1: 0.5371
 epoch: 10, train_loss: 0.9455, test_loss: 0.9034, test_f1: 0.5445
 epoch: 11, train_loss: 0.9318, test_loss: 0.9412, test_f1: 0.4935
 epoch: 12, train_loss: 0.9164, test_loss: 0.9047, test_f1: 0.5383
 epoch: 13, train_loss: 0.8996, test_loss: 0.9743, test_f1: 0.5224
 epoch: 14, train_loss: 0.9098, test_loss: 0.9482, test_f1: 0.5056
 epoch: 15, train_loss: 0.8998, test_loss: 0.9059, test_f1: 0.5060
 epoch: 16, train_loss: 0.8863, test_loss: 0.9613, test_f1: 0.4931
 epoch: 17, train_loss: 0.8971, test_loss: 0.9464, test_f1: 0.5415
 epoch: 18, train_loss: 0.8705, test_loss: 1.0122, test_f1: 0.4945
 epoch: 19, train_loss: 0.8587, test_loss: 0.9633, test_f1: 0.5402
 epoch: 20, train_loss: 0.8350, test_loss: 0.9928, test_f1: 0.5366
 epoch: 21, train_loss: 0.8327, test_loss: 0.9403, test_f1: 0.5325
 epoch: 22, train_loss: 0.8345, test_loss: 1.0362, test_f1: 0.5013
 epoch: 23, train_loss: 0.8175, test_loss: 1.0169, test_f1: 0.5228
 epoch: 24, train_loss: 0.8250, test_loss: 1.0351, test_f1: 0.5148
 epoch: 25, train_loss: 0.8033, test_loss: 1.0241, test_f1: 0.5228
 epoch: 26, train_loss: 0.8003, test_loss: 1.0118, test_f1: 0.5455
 epoch: 27, train_loss: 0.7954, test_loss: 1.0721, test_f1: 0.5195
 epoch: 28, train_loss: 0.8022, test_loss: 1.0596, test_f1: 0.5520
 epoch: 29, train_loss: 0.7869, test_loss: 1.0556, test_f1: 0.5109
 epoch: 30, train_loss: 0.7759, test_loss: 1.1275, test_f1: 0.5289
 epoch: 31, train_loss: 0.7833, test_loss: 1.1570, test_f1: 0.5153
 epoch: 32, train_loss: 0.7581, test_loss: 1.0752, test_f1: 0.5368
 epoch: 33, train_loss: 0.7660, test_loss: 1.0278, test_f1: 0.5329
 epoch: 34, train_loss: 0.7703, test_loss: 1.0536, test_f1: 0.5388
 epoch: 35, train_loss: 0.7549, test_loss: 1.2084, test_f1: 0.5540
 epoch: 36, train_loss: 0.7544, test_loss: 0.9534, test_f1: 0.5305
 epoch: 37, train_loss: 0.7466, test_loss: 1.0172, test_f1: 0.5481
 epoch: 38, train_loss: 0.7420, test_loss: 1.0277, test_f1: 0.5506
 epoch: 39, train_loss: 0.7263, test_loss: 1.0137, test_f1: 0.5583
 epoch: 40, train_loss: 0.7674, test_loss: 0.9770, test_f1: 0.5534
 epoch: 41, train_loss: 0.7834, test_loss: 0.9371, test_f1: 0.5691
 epoch: 42, train_loss: 0.7449, test_loss: 1.0249, test_f1: 0.5634
 epoch: 43, train_loss: 0.7298, test_loss: 1.0539, test_f1: 0.5302
 epoch: 44, train_loss: 0.7191, test_loss: 1.0472, test_f1: 0.5471
 epoch: 45, train_loss: 0.7247, test_loss: 1.0260, test_f1: 0.5583
 epoch: 46, train_loss: 0.7093, test_loss: 1.0501, test_f1: 0.5388
 epoch: 47, train_loss: 0.7146, test_loss: 1.0593, test_f1: 0.5475
 epoch: 48, train_loss: 0.7120, test_loss: 1.0587, test_f1: 0.5440
 epoch: 49, train_loss: 0.7471, test_loss: 1.0730, test_f1: 0.5362
 epoch: 50, train_loss: 0.7229, test_loss: 1.0714, test_f1: 0.5469
 epoch: 51, train_loss: 0.6611, test_loss: 1.0566, test_f1: 0.5361
 epoch: 52, train_loss: 0.6520, test_loss: 1.0647, test_f1: 0.5455
 epoch: 53, train_loss: 0.6480, test_loss: 1.0801, test_f1: 0.5475
 epoch: 54, train_loss: 0.6582, test_loss: 1.1677, test_f1: 0.5559
 epoch: 55, train_loss: 0.6397, test_loss: 1.1243, test_f1: 0.5418
 epoch: 56, train_loss: 0.6402, test_loss: 1.1498, test_f1: 0.5541
 epoch: 57, train_loss: 0.6143, test_loss: 1.1934, test_f1: 0.5604
 epoch: 58, train_loss: 0.6120, test_loss: 1.1788, test_f1: 0.5571
 epoch: 59, train_loss: 0.6331, test_loss: 1.1598, test_f1: 0.5476
 epoch: 60, train_loss: 0.6105, test_loss: 1.1357, test_f1: 0.5590
 epoch: 61, train_loss: 0.6087, test_loss: 1.1296, test_f1: 0.5733
 epoch: 62, train_loss: 0.6001, test_loss: 1.1632, test_f1: 0.5643
 epoch: 63, train_loss: 0.5871, test_loss: 1.1517, test_f1: 0.5658
 epoch: 64, train_loss: 0.5872, test_loss: 1.3092, test_f1: 0.5454
 epoch: 65, train_loss: 0.5761, test_loss: 1.2450, test_f1: 0.5678
 epoch: 66, train_loss: 0.5882, test_loss: 1.2051, test_f1: 0.5546
 epoch: 67, train_loss: 0.5902, test_loss: 1.3700, test_f1: 0.5189
 epoch: 68, train_loss: 0.5880, test_loss: 1.2267, test_f1: 0.5351
 epoch: 69, train_loss: 0.5647, test_loss: 1.2074, test_f1: 0.5441
 epoch: 70, train_loss: 0.5755, test_loss: 1.3046, test_f1: 0.5486
 epoch: 71, train_loss: 0.5651, test_loss: 1.2486, test_f1: 0.5541
 epoch: 72, train_loss: 0.5868, test_loss: 1.2380, test_f1: 0.5439
 epoch: 73, train_loss: 0.5790, test_loss: 1.3320, test_f1: 0.5483
 epoch: 74, train_loss: 0.5690, test_loss: 1.2616, test_f1: 0.5386
 epoch: 75, train_loss: 0.5588, test_loss: 1.3826, test_f1: 0.5266
 epoch: 76, train_loss: 0.5902, test_loss: 1.2308, test_f1: 0.5536
 epoch: 77, train_loss: 0.5540, test_loss: 1.3980, test_f1: 0.5315
 epoch: 78, train_loss: 0.5672, test_loss: 1.3111, test_f1: 0.5510
 epoch: 79, train_loss: 0.5430, test_loss: 1.2890, test_f1: 0.5484
 epoch: 80, train_loss: 0.5556, test_loss: 1.3922, test_f1: 0.5283
 epoch: 81, train_loss: 0.5470, test_loss: 1.3958, test_f1: 0.5198
 epoch: 82, train_loss: 0.5458, test_loss: 1.2665, test_f1: 0.5271
 epoch: 83, train_loss: 0.5369, test_loss: 1.3169, test_f1: 0.5266
 epoch: 84, train_loss: 0.5329, test_loss: 1.3928, test_f1: 0.5327
 epoch: 85, train_loss: 0.5423, test_loss: 1.2410, test_f1: 0.5281
 epoch: 86, train_loss: 0.5401, test_loss: 1.2619, test_f1: 0.5371
 epoch: 87, train_loss: 0.5358, test_loss: 1.2710, test_f1: 0.5609
 epoch: 88, train_loss: 0.5120, test_loss: 1.2719, test_f1: 0.5514
 epoch: 89, train_loss: 0.5219, test_loss: 1.5202, test_f1: 0.5278
 epoch: 90, train_loss: 0.5166, test_loss: 1.2932, test_f1: 0.5579
 epoch: 91, train_loss: 0.5109, test_loss: 1.2836, test_f1: 0.5706
 epoch: 92, train_loss: 0.5111, test_loss: 1.3331, test_f1: 0.5513
 epoch: 93, train_loss: 0.5309, test_loss: 1.3275, test_f1: 0.5396
 epoch: 94, train_loss: 0.5449, test_loss: 1.2774, test_f1: 0.5490
 epoch: 95, train_loss: 0.5173, test_loss: 1.3017, test_f1: 0.5519
 epoch: 96, train_loss: 0.5722, test_loss: 1.3032, test_f1: 0.5533
 epoch: 97, train_loss: 0.5098, test_loss: 1.2823, test_f1: 0.5692
 epoch: 98, train_loss: 0.4894, test_loss: 1.2778, test_f1: 0.5563
 epoch: 99, train_loss: 0.4973, test_loss: 1.3338, test_f1: 0.5496
##################ITERATION #3 ****************************************
 epoch: 0, train_loss: 1.2586, test_loss: 1.1317, test_f1: 0.3801
 epoch: 1, train_loss: 1.1376, test_loss: 1.0357, test_f1: 0.4555
 epoch: 2, train_loss: 1.0913, test_loss: 1.0307, test_f1: 0.4718
 epoch: 3, train_loss: 1.0441, test_loss: 0.9756, test_f1: 0.4837
 epoch: 4, train_loss: 1.0288, test_loss: 0.9922, test_f1: 0.4684
 epoch: 5, train_loss: 1.0016, test_loss: 0.9222, test_f1: 0.5131
 epoch: 6, train_loss: 0.9989, test_loss: 1.8401, test_f1: 0.4781
 epoch: 7, train_loss: 0.9724, test_loss: 1.0202, test_f1: 0.4809
 epoch: 8, train_loss: 0.9744, test_loss: 0.9164, test_f1: 0.5336
 epoch: 9, train_loss: 0.9597, test_loss: 0.9320, test_f1: 0.4985
 epoch: 10, train_loss: 0.9368, test_loss: 0.8739, test_f1: 0.5445
 epoch: 11, train_loss: 0.9361, test_loss: 0.9575, test_f1: 0.5303
 epoch: 12, train_loss: 0.9277, test_loss: 0.8705, test_f1: 0.5514
 epoch: 13, train_loss: 0.9099, test_loss: 0.9698, test_f1: 0.5055
 epoch: 14, train_loss: 0.9084, test_loss: 0.9393, test_f1: 0.5167
 epoch: 15, train_loss: 0.8993, test_loss: 0.9267, test_f1: 0.5219
 epoch: 16, train_loss: 0.8819, test_loss: 0.9373, test_f1: 0.5380
 epoch: 17, train_loss: 0.8715, test_loss: 0.9473, test_f1: 0.4963
 epoch: 18, train_loss: 0.8560, test_loss: 0.9783, test_f1: 0.5260
 epoch: 19, train_loss: 0.8515, test_loss: 0.9503, test_f1: 0.5171
 epoch: 20, train_loss: 0.8538, test_loss: 1.0125, test_f1: 0.5174
 epoch: 21, train_loss: 0.8664, test_loss: 0.9571, test_f1: 0.5403
 epoch: 22, train_loss: 0.8319, test_loss: 1.0076, test_f1: 0.5272
 epoch: 23, train_loss: 0.8379, test_loss: 1.0601, test_f1: 0.5154
 epoch: 24, train_loss: 0.8335, test_loss: 1.0308, test_f1: 0.5485
 epoch: 25, train_loss: 0.8242, test_loss: 1.0939, test_f1: 0.4989
 epoch: 26, train_loss: 0.8065, test_loss: 1.0788, test_f1: 0.5525
 epoch: 27, train_loss: 0.8304, test_loss: 0.9142, test_f1: 0.5427
 epoch: 28, train_loss: 0.8133, test_loss: 1.0125, test_f1: 0.5189
 epoch: 29, train_loss: 0.8035, test_loss: 1.0253, test_f1: 0.5539
 epoch: 30, train_loss: 0.8056, test_loss: 0.9947, test_f1: 0.5520
 epoch: 31, train_loss: 0.7800, test_loss: 0.9765, test_f1: 0.5170
 epoch: 32, train_loss: 0.7771, test_loss: 1.0116, test_f1: 0.5593
 epoch: 33, train_loss: 0.7732, test_loss: 1.0246, test_f1: 0.5753
 epoch: 34, train_loss: 0.7814, test_loss: 1.0882, test_f1: 0.5601
 epoch: 35, train_loss: 0.7766, test_loss: 1.0100, test_f1: 0.5545
 epoch: 36, train_loss: 0.7993, test_loss: 1.0294, test_f1: 0.5500
 epoch: 37, train_loss: 0.7573, test_loss: 1.0363, test_f1: 0.5706
 epoch: 38, train_loss: 0.7547, test_loss: 1.0167, test_f1: 0.5558
 epoch: 39, train_loss: 0.7978, test_loss: 0.9368, test_f1: 0.5490
 epoch: 40, train_loss: 0.7609, test_loss: 1.0364, test_f1: 0.5545
 epoch: 41, train_loss: 0.7472, test_loss: 1.0561, test_f1: 0.5397
 epoch: 42, train_loss: 0.7710, test_loss: 1.0380, test_f1: 0.5383
 epoch: 43, train_loss: 0.7533, test_loss: 1.0580, test_f1: 0.5633
 epoch: 44, train_loss: 0.7425, test_loss: 1.0178, test_f1: 0.5494
 epoch: 45, train_loss: 0.7330, test_loss: 1.0309, test_f1: 0.5186
 epoch: 46, train_loss: 0.7705, test_loss: 1.0704, test_f1: 0.5325
 epoch: 47, train_loss: 0.7601, test_loss: 1.0509, test_f1: 0.5133
 epoch: 48, train_loss: 0.7592, test_loss: 1.0736, test_f1: 0.5518
 epoch: 49, train_loss: 0.7450, test_loss: 1.0529, test_f1: 0.5564
 epoch: 50, train_loss: 0.7419, test_loss: 1.1172, test_f1: 0.5178
 epoch: 51, train_loss: 0.6955, test_loss: 1.0366, test_f1: 0.5518
 epoch: 52, train_loss: 0.6792, test_loss: 1.0856, test_f1: 0.5600
 epoch: 53, train_loss: 0.6696, test_loss: 1.1389, test_f1: 0.5493
 epoch: 54, train_loss: 0.6697, test_loss: 1.1568, test_f1: 0.5215
 epoch: 55, train_loss: 0.6605, test_loss: 1.1419, test_f1: 0.5513
 epoch: 56, train_loss: 0.6489, test_loss: 1.1760, test_f1: 0.5393
 epoch: 57, train_loss: 0.6621, test_loss: 1.1449, test_f1: 0.5421
 epoch: 58, train_loss: 0.6465, test_loss: 1.1379, test_f1: 0.5628
 epoch: 59, train_loss: 0.6297, test_loss: 1.1210, test_f1: 0.5389
 epoch: 60, train_loss: 0.6502, test_loss: 1.1800, test_f1: 0.5243
 epoch: 61, train_loss: 0.6458, test_loss: 1.1032, test_f1: 0.5471
 epoch: 62, train_loss: 0.6375, test_loss: 1.1680, test_f1: 0.5321
 epoch: 63, train_loss: 0.6365, test_loss: 1.1558, test_f1: 0.5616
 epoch: 64, train_loss: 0.6228, test_loss: 1.1317, test_f1: 0.5615
 epoch: 65, train_loss: 0.6281, test_loss: 1.1312, test_f1: 0.5332
 epoch: 66, train_loss: 0.6045, test_loss: 1.1780, test_f1: 0.5475
 epoch: 67, train_loss: 0.6065, test_loss: 1.2203, test_f1: 0.4993
 epoch: 68, train_loss: 0.6043, test_loss: 1.1516, test_f1: 0.5561
 epoch: 69, train_loss: 0.5910, test_loss: 1.1241, test_f1: 0.5471
 epoch: 70, train_loss: 0.6100, test_loss: 1.1369, test_f1: 0.5428
 epoch: 71, train_loss: 0.6164, test_loss: 1.2304, test_f1: 0.5281
 epoch: 72, train_loss: 0.5983, test_loss: 1.2251, test_f1: 0.5337
 epoch: 73, train_loss: 0.6006, test_loss: 1.2358, test_f1: 0.5277
 epoch: 74, train_loss: 0.6607, test_loss: 1.1878, test_f1: 0.5496
 epoch: 75, train_loss: 0.6044, test_loss: 1.2446, test_f1: 0.5164
 epoch: 76, train_loss: 0.5860, test_loss: 1.2201, test_f1: 0.5355
 epoch: 77, train_loss: 0.6063, test_loss: 1.2396, test_f1: 0.5423
 epoch: 78, train_loss: 0.5889, test_loss: 1.2279, test_f1: 0.5579
 epoch: 79, train_loss: 0.6054, test_loss: 1.2342, test_f1: 0.5366
 epoch: 80, train_loss: 0.5842, test_loss: 1.1463, test_f1: 0.5599
 epoch: 81, train_loss: 0.5751, test_loss: 1.1806, test_f1: 0.5460
 epoch: 82, train_loss: 0.5671, test_loss: 1.2730, test_f1: 0.5686
 epoch: 83, train_loss: 0.5678, test_loss: 1.2803, test_f1: 0.5544
 epoch: 84, train_loss: 0.5493, test_loss: 1.3368, test_f1: 0.5329
 epoch: 85, train_loss: 0.5864, test_loss: 1.2286, test_f1: 0.5562
 epoch: 86, train_loss: 0.5589, test_loss: 1.2736, test_f1: 0.5548
 epoch: 87, train_loss: 0.5547, test_loss: 1.2682, test_f1: 0.5368
 epoch: 88, train_loss: 0.5430, test_loss: 1.3050, test_f1: 0.5573
 epoch: 89, train_loss: 0.5562, test_loss: 1.3067, test_f1: 0.5736
 epoch: 90, train_loss: 0.5914, test_loss: 1.3056, test_f1: 0.5683
 epoch: 91, train_loss: 0.5942, test_loss: 1.1606, test_f1: 0.5649
 epoch: 92, train_loss: 0.5687, test_loss: 1.2141, test_f1: 0.5592
 epoch: 93, train_loss: 0.5701, test_loss: 1.1963, test_f1: 0.5378
 epoch: 94, train_loss: 0.5719, test_loss: 1.2178, test_f1: 0.5681
 epoch: 95, train_loss: 0.5571, test_loss: 1.2139, test_f1: 0.5579
 epoch: 96, train_loss: 0.5457, test_loss: 1.2420, test_f1: 0.5585
 epoch: 97, train_loss: 0.5339, test_loss: 1.2160, test_f1: 0.5556
 epoch: 98, train_loss: 0.5218, test_loss: 1.3509, test_f1: 0.5455
 epoch: 99, train_loss: 0.5390, test_loss: 1.3135, test_f1: 0.5629
##################ITERATION #4 ****************************************
 epoch: 0, train_loss: 1.2973, test_loss: 1.1222, test_f1: 0.4056
 epoch: 1, train_loss: 1.1696, test_loss: 1.0609, test_f1: 0.4283
 epoch: 2, train_loss: 1.1306, test_loss: 1.0539, test_f1: 0.4213
 epoch: 3, train_loss: 1.0894, test_loss: 1.0356, test_f1: 0.4238
 epoch: 4, train_loss: 1.0524, test_loss: 0.9441, test_f1: 0.4665
 epoch: 5, train_loss: 1.0456, test_loss: 0.9682, test_f1: 0.4631
 epoch: 6, train_loss: 1.0280, test_loss: 0.9929, test_f1: 0.4942
 epoch: 7, train_loss: 0.9937, test_loss: 0.9555, test_f1: 0.4583
 epoch: 8, train_loss: 0.9774, test_loss: 0.9501, test_f1: 0.5170
 epoch: 9, train_loss: 0.9627, test_loss: 1.0227, test_f1: 0.5088
 epoch: 10, train_loss: 0.9448, test_loss: 0.9790, test_f1: 0.4929
 epoch: 11, train_loss: 0.9360, test_loss: 0.9236, test_f1: 0.5089
 epoch: 12, train_loss: 0.9246, test_loss: 0.9673, test_f1: 0.5331
 epoch: 13, train_loss: 0.9302, test_loss: 0.9647, test_f1: 0.5078
 epoch: 14, train_loss: 0.9098, test_loss: 1.0113, test_f1: 0.4929
 epoch: 15, train_loss: 0.9138, test_loss: 0.9997, test_f1: 0.5159
 epoch: 16, train_loss: 0.8870, test_loss: 0.9463, test_f1: 0.5077
 epoch: 17, train_loss: 0.8953, test_loss: 0.9174, test_f1: 0.5162
 epoch: 18, train_loss: 0.8702, test_loss: 1.0179, test_f1: 0.5229
 epoch: 19, train_loss: 0.8921, test_loss: 0.9643, test_f1: 0.4980
 epoch: 20, train_loss: 0.8907, test_loss: 1.0097, test_f1: 0.5252
 epoch: 21, train_loss: 0.8764, test_loss: 0.9661, test_f1: 0.5178
 epoch: 22, train_loss: 0.8590, test_loss: 1.0290, test_f1: 0.5227
 epoch: 23, train_loss: 0.8336, test_loss: 1.0555, test_f1: 0.5048
 epoch: 24, train_loss: 0.8310, test_loss: 0.9864, test_f1: 0.5428
 epoch: 25, train_loss: 0.8219, test_loss: 0.9399, test_f1: 0.5376
 epoch: 26, train_loss: 0.8078, test_loss: 0.9381, test_f1: 0.5627
 epoch: 27, train_loss: 0.8104, test_loss: 1.0364, test_f1: 0.5232
 epoch: 28, train_loss: 0.7982, test_loss: 0.9612, test_f1: 0.5498
 epoch: 29, train_loss: 0.7957, test_loss: 1.0514, test_f1: 0.5437
 epoch: 30, train_loss: 0.8151, test_loss: 0.9796, test_f1: 0.5348
 epoch: 31, train_loss: 0.8249, test_loss: 1.0046, test_f1: 0.5414
 epoch: 32, train_loss: 0.7909, test_loss: 1.0391, test_f1: 0.5106
 epoch: 33, train_loss: 0.7941, test_loss: 0.9593, test_f1: 0.5535
 epoch: 34, train_loss: 0.7799, test_loss: 1.0446, test_f1: 0.5227
 epoch: 35, train_loss: 0.7690, test_loss: 1.0138, test_f1: 0.5779
 epoch: 36, train_loss: 0.7707, test_loss: 1.0144, test_f1: 0.5620
 epoch: 37, train_loss: 0.7665, test_loss: 1.0912, test_f1: 0.5426
 epoch: 38, train_loss: 0.7611, test_loss: 1.0892, test_f1: 0.5317
 epoch: 39, train_loss: 0.7634, test_loss: 1.0847, test_f1: 0.5318
 epoch: 40, train_loss: 0.7500, test_loss: 1.1026, test_f1: 0.5594
 epoch: 41, train_loss: 0.7459, test_loss: 1.0450, test_f1: 0.5653
 epoch: 42, train_loss: 0.7760, test_loss: 1.0447, test_f1: 0.5597
 epoch: 43, train_loss: 0.7484, test_loss: 1.0904, test_f1: 0.5436
 epoch: 44, train_loss: 0.7352, test_loss: 1.0251, test_f1: 0.5436
 epoch: 45, train_loss: 0.7284, test_loss: 1.1532, test_f1: 0.5427
 epoch: 46, train_loss: 0.7378, test_loss: 1.0959, test_f1: 0.5610
 epoch: 47, train_loss: 0.7333, test_loss: 1.0939, test_f1: 0.5525
 epoch: 48, train_loss: 0.7262, test_loss: 1.1080, test_f1: 0.5589
 epoch: 49, train_loss: 0.7062, test_loss: 1.1081, test_f1: 0.5436
 epoch: 50, train_loss: 0.7037, test_loss: 1.0708, test_f1: 0.5546
 epoch: 51, train_loss: 0.6855, test_loss: 1.0842, test_f1: 0.5610
 epoch: 52, train_loss: 0.6811, test_loss: 1.0837, test_f1: 0.5817
 epoch: 53, train_loss: 0.6574, test_loss: 1.0871, test_f1: 0.5609
 epoch: 54, train_loss: 0.6561, test_loss: 1.1344, test_f1: 0.5607
 epoch: 55, train_loss: 0.6476, test_loss: 1.1779, test_f1: 0.5403
 epoch: 56, train_loss: 0.6570, test_loss: 1.1358, test_f1: 0.5405
 epoch: 57, train_loss: 0.6475, test_loss: 1.1761, test_f1: 0.5632
 epoch: 58, train_loss: 0.6308, test_loss: 1.1107, test_f1: 0.5701
 epoch: 59, train_loss: 0.6342, test_loss: 1.1793, test_f1: 0.5500
 epoch: 60, train_loss: 0.6466, test_loss: 1.1686, test_f1: 0.5317
 epoch: 61, train_loss: 0.6282, test_loss: 1.1369, test_f1: 0.5657
 epoch: 62, train_loss: 0.6195, test_loss: 1.1974, test_f1: 0.5558
 epoch: 63, train_loss: 0.6218, test_loss: 1.1407, test_f1: 0.5857
 epoch: 64, train_loss: 0.6249, test_loss: 1.1243, test_f1: 0.5641
 epoch: 65, train_loss: 0.6399, test_loss: 1.1579, test_f1: 0.5691
 epoch: 66, train_loss: 0.6110, test_loss: 1.1457, test_f1: 0.5641
 epoch: 67, train_loss: 0.6184, test_loss: 1.1545, test_f1: 0.5581
 epoch: 68, train_loss: 0.6118, test_loss: 1.1888, test_f1: 0.5378
 epoch: 69, train_loss: 0.6038, test_loss: 1.2054, test_f1: 0.5416
 epoch: 70, train_loss: 0.6123, test_loss: 1.1236, test_f1: 0.5601
 epoch: 71, train_loss: 0.5904, test_loss: 1.1801, test_f1: 0.5490
 epoch: 72, train_loss: 0.5797, test_loss: 1.2275, test_f1: 0.5207
 epoch: 73, train_loss: 0.5842, test_loss: 1.1963, test_f1: 0.5409
 epoch: 74, train_loss: 0.6005, test_loss: 1.1942, test_f1: 0.5395
 epoch: 75, train_loss: 0.5814, test_loss: 1.2085, test_f1: 0.5713
 epoch: 76, train_loss: 0.6108, test_loss: 1.1989, test_f1: 0.5398
 epoch: 77, train_loss: 0.5803, test_loss: 1.2294, test_f1: 0.5458
 epoch: 78, train_loss: 0.5816, test_loss: 1.1881, test_f1: 0.5448
 epoch: 79, train_loss: 0.5965, test_loss: 1.1933, test_f1: 0.5489
 epoch: 80, train_loss: 0.5629, test_loss: 1.1939, test_f1: 0.5647
 epoch: 81, train_loss: 0.5779, test_loss: 1.2126, test_f1: 0.5715
 epoch: 82, train_loss: 0.5769, test_loss: 1.2190, test_f1: 0.5567
 epoch: 83, train_loss: 0.5685, test_loss: 1.2792, test_f1: 0.5418
 epoch: 84, train_loss: 0.5956, test_loss: 1.1719, test_f1: 0.5705
 epoch: 85, train_loss: 0.5487, test_loss: 1.2170, test_f1: 0.5660
 epoch: 86, train_loss: 0.5637, test_loss: 1.2686, test_f1: 0.5383
 epoch: 87, train_loss: 0.5663, test_loss: 1.2959, test_f1: 0.5302
 epoch: 88, train_loss: 0.5670, test_loss: 1.2230, test_f1: 0.5604
 epoch: 89, train_loss: 0.6111, test_loss: 1.1483, test_f1: 0.5704
 epoch: 90, train_loss: 0.5851, test_loss: 1.1694, test_f1: 0.5659
 epoch: 91, train_loss: 0.5642, test_loss: 1.1232, test_f1: 0.5631
 epoch: 92, train_loss: 0.5517, test_loss: 1.1619, test_f1: 0.5656
 epoch: 93, train_loss: 0.5366, test_loss: 1.2271, test_f1: 0.5371
 epoch: 94, train_loss: 0.5352, test_loss: 1.2131, test_f1: 0.5556
 epoch: 95, train_loss: 0.5612, test_loss: 1.1434, test_f1: 0.5915
 epoch: 96, train_loss: 0.5447, test_loss: 1.1801, test_f1: 0.5601
 epoch: 97, train_loss: 0.5428, test_loss: 1.1664, test_f1: 0.5584
 epoch: 98, train_loss: 0.5416, test_loss: 1.1829, test_f1: 0.5573
 epoch: 99, train_loss: 0.5315, test_loss: 1.2409, test_f1: 0.5480
##################ITERATION #5 ****************************************
 epoch: 0, train_loss: 1.3201, test_loss: 1.1540, test_f1: 0.4215
 epoch: 1, train_loss: 1.1716, test_loss: 1.0973, test_f1: 0.4396
 epoch: 2, train_loss: 1.1246, test_loss: 1.0352, test_f1: 0.4660
 epoch: 3, train_loss: 1.0939, test_loss: 1.0214, test_f1: 0.4514
 epoch: 4, train_loss: 1.0616, test_loss: 0.9940, test_f1: 0.4874
 epoch: 5, train_loss: 1.0422, test_loss: 0.9648, test_f1: 0.4584
 epoch: 6, train_loss: 1.0250, test_loss: 0.9319, test_f1: 0.4696
 epoch: 7, train_loss: 1.0004, test_loss: 1.0786, test_f1: 0.4187
 epoch: 8, train_loss: 0.9984, test_loss: 0.9917, test_f1: 0.4749
 epoch: 9, train_loss: 0.9754, test_loss: 1.0430, test_f1: 0.4839
 epoch: 10, train_loss: 0.9672, test_loss: 0.8924, test_f1: 0.4949
 epoch: 11, train_loss: 0.9548, test_loss: 1.0210, test_f1: 0.4865
 epoch: 12, train_loss: 0.9396, test_loss: 0.9493, test_f1: 0.4932
 epoch: 13, train_loss: 0.9261, test_loss: 0.9817, test_f1: 0.5165
 epoch: 14, train_loss: 0.9092, test_loss: 1.0124, test_f1: 0.4856
 epoch: 15, train_loss: 0.9014, test_loss: 1.0104, test_f1: 0.5214
 epoch: 16, train_loss: 0.9007, test_loss: 1.0556, test_f1: 0.4863
 epoch: 17, train_loss: 0.8848, test_loss: 0.9768, test_f1: 0.4945
 epoch: 18, train_loss: 0.8971, test_loss: 0.9962, test_f1: 0.5234
 epoch: 19, train_loss: 0.8777, test_loss: 1.0047, test_f1: 0.5095
 epoch: 20, train_loss: 0.8583, test_loss: 1.0421, test_f1: 0.5292
 epoch: 21, train_loss: 0.8726, test_loss: 1.0047, test_f1: 0.5139
 epoch: 22, train_loss: 0.8424, test_loss: 1.0488, test_f1: 0.5305
 epoch: 23, train_loss: 0.8444, test_loss: 1.0211, test_f1: 0.5337
 epoch: 24, train_loss: 0.8366, test_loss: 0.9871, test_f1: 0.5481
 epoch: 25, train_loss: 0.8296, test_loss: 1.1996, test_f1: 0.4836
 epoch: 26, train_loss: 0.8115, test_loss: 1.0493, test_f1: 0.5150
 epoch: 27, train_loss: 0.8312, test_loss: 1.1213, test_f1: 0.4941
 epoch: 28, train_loss: 0.8135, test_loss: 1.1373, test_f1: 0.5138
 epoch: 29, train_loss: 0.8199, test_loss: 1.0785, test_f1: 0.5533
 epoch: 30, train_loss: 0.7966, test_loss: 1.0343, test_f1: 0.5180
 epoch: 31, train_loss: 0.7951, test_loss: 1.1102, test_f1: 0.5100
 epoch: 32, train_loss: 0.7812, test_loss: 1.0949, test_f1: 0.5586
 epoch: 33, train_loss: 0.7744, test_loss: 1.0604, test_f1: 0.5376
 epoch: 34, train_loss: 0.7730, test_loss: 1.0149, test_f1: 0.5799
 epoch: 35, train_loss: 0.7821, test_loss: 1.1127, test_f1: 0.5185
 epoch: 36, train_loss: 0.7741, test_loss: 1.1185, test_f1: 0.5560
 epoch: 37, train_loss: 0.7628, test_loss: 1.0828, test_f1: 0.5644
 epoch: 38, train_loss: 0.7441, test_loss: 1.0570, test_f1: 0.5568
 epoch: 39, train_loss: 0.7415, test_loss: 1.1352, test_f1: 0.5361
 epoch: 40, train_loss: 0.7600, test_loss: 1.1052, test_f1: 0.5368
 epoch: 41, train_loss: 0.7519, test_loss: 1.1013, test_f1: 0.5656
 epoch: 42, train_loss: 0.7906, test_loss: 1.0710, test_f1: 0.5375
 epoch: 43, train_loss: 0.8000, test_loss: 1.1090, test_f1: 0.5278
 epoch: 44, train_loss: 0.7648, test_loss: 1.1143, test_f1: 0.5402
 epoch: 45, train_loss: 0.7463, test_loss: 1.1069, test_f1: 0.5529
 epoch: 46, train_loss: 0.7513, test_loss: 1.1688, test_f1: 0.5418
 epoch: 47, train_loss: 0.7426, test_loss: 1.1829, test_f1: 0.5331
 epoch: 48, train_loss: 0.7405, test_loss: 1.0949, test_f1: 0.5308
 epoch: 49, train_loss: 0.7718, test_loss: 1.1172, test_f1: 0.5403
 epoch: 50, train_loss: 0.7331, test_loss: 1.1405, test_f1: 0.5521
 epoch: 51, train_loss: 0.7026, test_loss: 1.1481, test_f1: 0.5556
 epoch: 52, train_loss: 0.6997, test_loss: 1.1591, test_f1: 0.5634
 epoch: 53, train_loss: 0.6883, test_loss: 1.1252, test_f1: 0.5515
 epoch: 54, train_loss: 0.6578, test_loss: 1.1956, test_f1: 0.5585
 epoch: 55, train_loss: 0.6733, test_loss: 1.1579, test_f1: 0.5564
 epoch: 56, train_loss: 0.6614, test_loss: 1.2376, test_f1: 0.5537
 epoch: 57, train_loss: 0.6542, test_loss: 1.1928, test_f1: 0.5620
 epoch: 58, train_loss: 0.6612, test_loss: 1.2283, test_f1: 0.5429
 epoch: 59, train_loss: 0.6351, test_loss: 1.2650, test_f1: 0.5398
 epoch: 60, train_loss: 0.6440, test_loss: 1.2655, test_f1: 0.5664
 epoch: 61, train_loss: 0.6403, test_loss: 1.1496, test_f1: 0.5739
 epoch: 62, train_loss: 0.6288, test_loss: 1.2436, test_f1: 0.5810
 epoch: 63, train_loss: 0.6402, test_loss: 1.2216, test_f1: 0.5657
 epoch: 64, train_loss: 0.6312, test_loss: 1.1775, test_f1: 0.5905
 epoch: 65, train_loss: 0.6192, test_loss: 1.1891, test_f1: 0.5604
 epoch: 66, train_loss: 0.6375, test_loss: 1.1763, test_f1: 0.5622
 epoch: 67, train_loss: 0.6049, test_loss: 1.2151, test_f1: 0.5647
 epoch: 68, train_loss: 0.6024, test_loss: 1.1769, test_f1: 0.5890
 epoch: 69, train_loss: 0.6052, test_loss: 1.2127, test_f1: 0.5405
 epoch: 70, train_loss: 0.6176, test_loss: 1.2273, test_f1: 0.5631
 epoch: 71, train_loss: 0.6054, test_loss: 1.2189, test_f1: 0.5911
 epoch: 72, train_loss: 0.6006, test_loss: 1.2262, test_f1: 0.5541
 epoch: 73, train_loss: 0.6006, test_loss: 1.1528, test_f1: 0.5843
 epoch: 74, train_loss: 0.5897, test_loss: 1.2665, test_f1: 0.5500
 epoch: 75, train_loss: 0.5901, test_loss: 1.2449, test_f1: 0.5557
 epoch: 76, train_loss: 0.6010, test_loss: 1.1819, test_f1: 0.5918
 epoch: 77, train_loss: 0.5855, test_loss: 1.2544, test_f1: 0.5724
 epoch: 78, train_loss: 0.5734, test_loss: 1.1902, test_f1: 0.5671
 epoch: 79, train_loss: 0.5679, test_loss: 1.2557, test_f1: 0.5742
 epoch: 80, train_loss: 0.5750, test_loss: 1.3157, test_f1: 0.5527
 epoch: 81, train_loss: 0.5774, test_loss: 1.3266, test_f1: 0.5644
 epoch: 82, train_loss: 0.5639, test_loss: 1.2825, test_f1: 0.5486
 epoch: 83, train_loss: 0.5764, test_loss: 1.2459, test_f1: 0.5623
 epoch: 84, train_loss: 0.5640, test_loss: 1.2556, test_f1: 0.5534
 epoch: 85, train_loss: 0.5858, test_loss: 1.2475, test_f1: 0.5651
 epoch: 86, train_loss: 0.5828, test_loss: 1.1759, test_f1: 0.5669
 epoch: 87, train_loss: 0.5528, test_loss: 1.2844, test_f1: 0.5497
 epoch: 88, train_loss: 0.5530, test_loss: 1.3032, test_f1: 0.5610
 epoch: 89, train_loss: 0.5430, test_loss: 1.3060, test_f1: 0.5570
 epoch: 90, train_loss: 0.5418, test_loss: 1.3156, test_f1: 0.5713
 epoch: 91, train_loss: 0.5618, test_loss: 1.2661, test_f1: 0.5816
 epoch: 92, train_loss: 0.5500, test_loss: 1.2819, test_f1: 0.5617
 epoch: 93, train_loss: 0.5484, test_loss: 1.2452, test_f1: 0.5643
 epoch: 94, train_loss: 0.5758, test_loss: 1.2158, test_f1: 0.5829
 epoch: 95, train_loss: 0.5429, test_loss: 1.3124, test_f1: 0.5701
 epoch: 96, train_loss: 0.5405, test_loss: 1.2969, test_f1: 0.5570
 epoch: 97, train_loss: 0.5117, test_loss: 1.2698, test_f1: 0.5795
 epoch: 98, train_loss: 0.5351, test_loss: 1.4213, test_f1: 0.5543
 epoch: 99, train_loss: 0.5177, test_loss: 1.3504, test_f1: 0.5540
##################ITERATION #6 ****************************************
 epoch: 0, train_loss: 1.2842, test_loss: 1.1391, test_f1: 0.4429
 epoch: 1, train_loss: 1.1658, test_loss: 1.0751, test_f1: 0.4187
 epoch: 2, train_loss: 1.1302, test_loss: 1.0293, test_f1: 0.4614
 epoch: 3, train_loss: 1.0862, test_loss: 1.0158, test_f1: 0.4618
 epoch: 4, train_loss: 1.0694, test_loss: 1.0091, test_f1: 0.4433
 epoch: 5, train_loss: 1.0435, test_loss: 0.9356, test_f1: 0.4811
 epoch: 6, train_loss: 1.0192, test_loss: 0.9165, test_f1: 0.5245
 epoch: 7, train_loss: 1.0047, test_loss: 0.9756, test_f1: 0.4887
 epoch: 8, train_loss: 0.9778, test_loss: 0.9122, test_f1: 0.5073
 epoch: 9, train_loss: 0.9663, test_loss: 0.9439, test_f1: 0.5148
 epoch: 10, train_loss: 0.9557, test_loss: 0.9025, test_f1: 0.4929
 epoch: 11, train_loss: 0.9432, test_loss: 0.8814, test_f1: 0.5117
 epoch: 12, train_loss: 0.9157, test_loss: 0.9539, test_f1: 0.4874
 epoch: 13, train_loss: 0.9282, test_loss: 0.9357, test_f1: 0.4910
 epoch: 14, train_loss: 0.9011, test_loss: 0.9391, test_f1: 0.4829
 epoch: 15, train_loss: 0.8931, test_loss: 0.9065, test_f1: 0.5165
 epoch: 16, train_loss: 0.8765, test_loss: 1.0865, test_f1: 0.4826
 epoch: 17, train_loss: 0.8794, test_loss: 0.9784, test_f1: 0.4870
 epoch: 18, train_loss: 0.8627, test_loss: 1.0288, test_f1: 0.4767
 epoch: 19, train_loss: 0.8463, test_loss: 0.9776, test_f1: 0.5190
 epoch: 20, train_loss: 0.8528, test_loss: 1.0268, test_f1: 0.5019
 epoch: 21, train_loss: 0.8633, test_loss: 0.9743, test_f1: 0.5345
 epoch: 22, train_loss: 0.8350, test_loss: 1.0239, test_f1: 0.5636
 epoch: 23, train_loss: 0.8366, test_loss: 0.9540, test_f1: 0.5326
 epoch: 24, train_loss: 0.8166, test_loss: 0.9822, test_f1: 0.5342
 epoch: 25, train_loss: 0.8201, test_loss: 0.9347, test_f1: 0.5339
 epoch: 26, train_loss: 0.7980, test_loss: 0.9205, test_f1: 0.5551
 epoch: 27, train_loss: 0.7914, test_loss: 1.0186, test_f1: 0.5606
 epoch: 28, train_loss: 0.7968, test_loss: 1.0871, test_f1: 0.5276
 epoch: 29, train_loss: 0.7871, test_loss: 0.9449, test_f1: 0.5518
 epoch: 30, train_loss: 0.8055, test_loss: 0.9759, test_f1: 0.5327
 epoch: 31, train_loss: 0.7677, test_loss: 1.0193, test_f1: 0.5683
 epoch: 32, train_loss: 0.7803, test_loss: 1.0805, test_f1: 0.5561
 epoch: 33, train_loss: 0.7932, test_loss: 1.0111, test_f1: 0.5236
 epoch: 34, train_loss: 0.8857, test_loss: 1.0725, test_f1: 0.5630
 epoch: 35, train_loss: 0.8060, test_loss: 1.0001, test_f1: 0.5334
 epoch: 36, train_loss: 0.7889, test_loss: 0.9704, test_f1: 0.5395
 epoch: 37, train_loss: 0.7825, test_loss: 1.0830, test_f1: 0.5371
 epoch: 38, train_loss: 0.7536, test_loss: 1.0433, test_f1: 0.5331
 epoch: 39, train_loss: 0.7481, test_loss: 1.0541, test_f1: 0.5284
 epoch: 40, train_loss: 0.7586, test_loss: 0.9707, test_f1: 0.5388
 epoch: 41, train_loss: 0.7351, test_loss: 1.1126, test_f1: 0.5215
 epoch: 42, train_loss: 0.7468, test_loss: 1.0835, test_f1: 0.5397
 epoch: 43, train_loss: 0.7435, test_loss: 1.1008, test_f1: 0.5551
 epoch: 44, train_loss: 0.7422, test_loss: 1.0776, test_f1: 0.5544
 epoch: 45, train_loss: 0.7166, test_loss: 1.0054, test_f1: 0.5581
 epoch: 46, train_loss: 0.7198, test_loss: 1.0977, test_f1: 0.5512
 epoch: 47, train_loss: 0.7003, test_loss: 1.0882, test_f1: 0.5406
 epoch: 48, train_loss: 0.6886, test_loss: 1.1040, test_f1: 0.5643
 epoch: 49, train_loss: 0.6913, test_loss: 1.0978, test_f1: 0.5791
 epoch: 50, train_loss: 0.6805, test_loss: 1.1086, test_f1: 0.5728
 epoch: 51, train_loss: 0.6598, test_loss: 1.1600, test_f1: 0.5488
 epoch: 52, train_loss: 0.6588, test_loss: 1.1931, test_f1: 0.5431
 epoch: 53, train_loss: 0.6473, test_loss: 1.1431, test_f1: 0.5567
 epoch: 54, train_loss: 0.6431, test_loss: 1.1802, test_f1: 0.5475
 epoch: 55, train_loss: 0.6282, test_loss: 1.1393, test_f1: 0.5544
 epoch: 56, train_loss: 0.6249, test_loss: 1.1031, test_f1: 0.5446
 epoch: 57, train_loss: 0.6319, test_loss: 1.2280, test_f1: 0.5519
 epoch: 58, train_loss: 0.6474, test_loss: 1.1742, test_f1: 0.5478
 epoch: 59, train_loss: 0.6169, test_loss: 1.1541, test_f1: 0.5447
 epoch: 60, train_loss: 0.5964, test_loss: 1.1700, test_f1: 0.5525
 epoch: 61, train_loss: 0.5947, test_loss: 1.2861, test_f1: 0.5425
 epoch: 62, train_loss: 0.6195, test_loss: 1.2095, test_f1: 0.5587
 epoch: 63, train_loss: 0.6170, test_loss: 1.1728, test_f1: 0.5463
 epoch: 64, train_loss: 0.5917, test_loss: 1.2259, test_f1: 0.5639
 epoch: 65, train_loss: 0.6167, test_loss: 1.1615, test_f1: 0.5396
 epoch: 66, train_loss: 0.6035, test_loss: 1.0659, test_f1: 0.5600
 epoch: 67, train_loss: 0.5941, test_loss: 1.1407, test_f1: 0.5389
 epoch: 68, train_loss: 0.5984, test_loss: 1.1019, test_f1: 0.5495
 epoch: 69, train_loss: 0.5988, test_loss: 1.0855, test_f1: 0.5695
 epoch: 70, train_loss: 0.5775, test_loss: 1.1510, test_f1: 0.5541
 epoch: 71, train_loss: 0.5752, test_loss: 1.1103, test_f1: 0.5714
 epoch: 72, train_loss: 0.5683, test_loss: 1.1168, test_f1: 0.5672
 epoch: 73, train_loss: 0.5898, test_loss: 1.1639, test_f1: 0.5877
 epoch: 74, train_loss: 0.5762, test_loss: 1.2016, test_f1: 0.5730
 epoch: 75, train_loss: 0.5833, test_loss: 1.0369, test_f1: 0.5871
 epoch: 76, train_loss: 0.5686, test_loss: 1.2251, test_f1: 0.5353
 epoch: 77, train_loss: 0.5662, test_loss: 1.2264, test_f1: 0.5866
 epoch: 78, train_loss: 0.5691, test_loss: 1.1832, test_f1: 0.5735
 epoch: 79, train_loss: 0.5713, test_loss: 1.1406, test_f1: 0.5769
 epoch: 80, train_loss: 0.5584, test_loss: 1.1019, test_f1: 0.5657
 epoch: 81, train_loss: 0.5384, test_loss: 1.2147, test_f1: 0.5390
 epoch: 82, train_loss: 0.5652, test_loss: 1.0981, test_f1: 0.5825
 epoch: 83, train_loss: 0.5535, test_loss: 1.0796, test_f1: 0.5700
 epoch: 84, train_loss: 0.5367, test_loss: 1.1075, test_f1: 0.5549
 epoch: 85, train_loss: 0.5337, test_loss: 1.1888, test_f1: 0.5597
 epoch: 86, train_loss: 0.5396, test_loss: 1.1385, test_f1: 0.5885
 epoch: 87, train_loss: 0.5363, test_loss: 1.3167, test_f1: 0.5432
 epoch: 88, train_loss: 0.5226, test_loss: 1.2298, test_f1: 0.5677
 epoch: 89, train_loss: 0.5314, test_loss: 1.2863, test_f1: 0.5541
 epoch: 90, train_loss: 0.5344, test_loss: 1.1211, test_f1: 0.5970
 epoch: 91, train_loss: 0.5349, test_loss: 1.1461, test_f1: 0.5742
 epoch: 92, train_loss: 0.5332, test_loss: 1.1680, test_f1: 0.5849
 epoch: 93, train_loss: 0.5300, test_loss: 1.2321, test_f1: 0.5402
 epoch: 94, train_loss: 0.5133, test_loss: 1.0655, test_f1: 0.5739
 epoch: 95, train_loss: 0.5121, test_loss: 1.2456, test_f1: 0.5757
 epoch: 96, train_loss: 0.5224, test_loss: 1.1313, test_f1: 0.5858
 epoch: 97, train_loss: 0.5116, test_loss: 1.2683, test_f1: 0.5632
 epoch: 98, train_loss: 0.5045, test_loss: 1.1883, test_f1: 0.5927
 epoch: 99, train_loss: 0.5163, test_loss: 1.3017, test_f1: 0.5524
##################ITERATION #7 ****************************************
 epoch: 0, train_loss: 1.2992, test_loss: 1.1505, test_f1: 0.4280
 epoch: 1, train_loss: 1.1743, test_loss: 1.0918, test_f1: 0.4541
 epoch: 2, train_loss: 1.1192, test_loss: 1.0315, test_f1: 0.4478
 epoch: 3, train_loss: 1.0930, test_loss: 1.0049, test_f1: 0.4617
 epoch: 4, train_loss: 1.0514, test_loss: 1.0467, test_f1: 0.4323
 epoch: 5, train_loss: 1.0188, test_loss: 0.9365, test_f1: 0.4558
 epoch: 6, train_loss: 1.0108, test_loss: 1.0321, test_f1: 0.4493
 epoch: 7, train_loss: 1.0106, test_loss: 1.0122, test_f1: 0.4367
 epoch: 8, train_loss: 1.0000, test_loss: 0.9228, test_f1: 0.4824
 epoch: 9, train_loss: 0.9760, test_loss: 0.9356, test_f1: 0.4849
 epoch: 10, train_loss: 0.9619, test_loss: 0.9855, test_f1: 0.4541
 epoch: 11, train_loss: 0.9575, test_loss: 0.9875, test_f1: 0.4986
 epoch: 12, train_loss: 0.9704, test_loss: 0.9456, test_f1: 0.4747
 epoch: 13, train_loss: 0.9425, test_loss: 1.0246, test_f1: 0.4606
 epoch: 14, train_loss: 0.9328, test_loss: 1.0353, test_f1: 0.4662
 epoch: 15, train_loss: 0.9162, test_loss: 1.0213, test_f1: 0.4412
 epoch: 16, train_loss: 0.9290, test_loss: 0.9991, test_f1: 0.4528
 epoch: 17, train_loss: 0.9408, test_loss: 0.9203, test_f1: 0.4723
 epoch: 18, train_loss: 0.9086, test_loss: 0.9991, test_f1: 0.4888
 epoch: 19, train_loss: 0.8916, test_loss: 0.9782, test_f1: 0.5235
 epoch: 20, train_loss: 0.8699, test_loss: 1.0618, test_f1: 0.5277
 epoch: 21, train_loss: 0.8791, test_loss: 0.9706, test_f1: 0.5148
 epoch: 22, train_loss: 0.8724, test_loss: 0.9674, test_f1: 0.4950
 epoch: 23, train_loss: 0.8606, test_loss: 0.9988, test_f1: 0.5332
 epoch: 24, train_loss: 0.8404, test_loss: 1.0446, test_f1: 0.4977
 epoch: 25, train_loss: 0.8350, test_loss: 0.9722, test_f1: 0.5221
 epoch: 26, train_loss: 0.8329, test_loss: 1.0124, test_f1: 0.5152
 epoch: 27, train_loss: 0.8172, test_loss: 1.0617, test_f1: 0.5273
 epoch: 28, train_loss: 0.8269, test_loss: 0.9977, test_f1: 0.5462
 epoch: 29, train_loss: 0.8168, test_loss: 0.9887, test_f1: 0.5637
 epoch: 30, train_loss: 0.8038, test_loss: 1.0462, test_f1: 0.5374
 epoch: 31, train_loss: 0.8071, test_loss: 1.0949, test_f1: 0.5051
 epoch: 32, train_loss: 0.7888, test_loss: 1.1092, test_f1: 0.4995
 epoch: 33, train_loss: 0.7879, test_loss: 1.0449, test_f1: 0.5179
 epoch: 34, train_loss: 0.7976, test_loss: 0.9972, test_f1: 0.5397
 epoch: 35, train_loss: 0.8027, test_loss: 1.0319, test_f1: 0.5211
 epoch: 36, train_loss: 0.7769, test_loss: 1.0079, test_f1: 0.5378
 epoch: 37, train_loss: 0.7755, test_loss: 1.0881, test_f1: 0.5261
 epoch: 38, train_loss: 0.7733, test_loss: 1.0696, test_f1: 0.5285
 epoch: 39, train_loss: 0.7623, test_loss: 1.0837, test_f1: 0.4999
 epoch: 40, train_loss: 0.8531, test_loss: 1.0071, test_f1: 0.5488
 epoch: 41, train_loss: 0.7913, test_loss: 1.0330, test_f1: 0.5570
 epoch: 42, train_loss: 0.7981, test_loss: 1.0799, test_f1: 0.5434
 epoch: 43, train_loss: 0.7790, test_loss: 1.0247, test_f1: 0.5158
 epoch: 44, train_loss: 0.7918, test_loss: 1.0540, test_f1: 0.5287
 epoch: 45, train_loss: 0.7631, test_loss: 0.9826, test_f1: 0.5502
 epoch: 46, train_loss: 0.7768, test_loss: 1.1158, test_f1: 0.5321
 epoch: 47, train_loss: 0.7539, test_loss: 1.1326, test_f1: 0.5187
 epoch: 48, train_loss: 0.7409, test_loss: 1.1104, test_f1: 0.5135
 epoch: 49, train_loss: 0.7540, test_loss: 1.0762, test_f1: 0.5239
 epoch: 50, train_loss: 0.7392, test_loss: 1.0392, test_f1: 0.5337
 epoch: 51, train_loss: 0.7053, test_loss: 1.0418, test_f1: 0.5542
 epoch: 52, train_loss: 0.6978, test_loss: 1.1064, test_f1: 0.5146
 epoch: 53, train_loss: 0.6813, test_loss: 1.1589, test_f1: 0.5454
 epoch: 54, train_loss: 0.6943, test_loss: 1.1071, test_f1: 0.5369
 epoch: 55, train_loss: 0.6675, test_loss: 1.0932, test_f1: 0.5477
 epoch: 56, train_loss: 0.6826, test_loss: 1.1050, test_f1: 0.5456
 epoch: 57, train_loss: 0.6857, test_loss: 1.1954, test_f1: 0.5358
 epoch: 58, train_loss: 0.6802, test_loss: 1.0837, test_f1: 0.5530
 epoch: 59, train_loss: 0.6599, test_loss: 1.1084, test_f1: 0.5477
 epoch: 60, train_loss: 0.6697, test_loss: 1.1211, test_f1: 0.5538
 epoch: 61, train_loss: 0.6500, test_loss: 1.1324, test_f1: 0.5503
 epoch: 62, train_loss: 0.6520, test_loss: 1.1979, test_f1: 0.5275
 epoch: 63, train_loss: 0.6366, test_loss: 1.2097, test_f1: 0.5287
 epoch: 64, train_loss: 0.6335, test_loss: 1.1788, test_f1: 0.5321
 epoch: 65, train_loss: 0.6418, test_loss: 1.1992, test_f1: 0.5473
 epoch: 66, train_loss: 0.6355, test_loss: 1.1753, test_f1: 0.5270
 epoch: 67, train_loss: 0.6332, test_loss: 1.1332, test_f1: 0.5355
 epoch: 68, train_loss: 0.6426, test_loss: 1.1952, test_f1: 0.5450
 epoch: 69, train_loss: 0.6214, test_loss: 1.1977, test_f1: 0.5451
 epoch: 70, train_loss: 0.6279, test_loss: 1.1786, test_f1: 0.5561
 epoch: 71, train_loss: 0.6393, test_loss: 1.1496, test_f1: 0.5526
 epoch: 72, train_loss: 0.6080, test_loss: 1.2299, test_f1: 0.5244
 epoch: 73, train_loss: 0.6318, test_loss: 1.1795, test_f1: 0.5428
 epoch: 74, train_loss: 0.6230, test_loss: 1.2052, test_f1: 0.5570
 epoch: 75, train_loss: 0.5995, test_loss: 1.1851, test_f1: 0.5627
 epoch: 76, train_loss: 0.6219, test_loss: 1.2068, test_f1: 0.5594
 epoch: 77, train_loss: 0.6000, test_loss: 1.1772, test_f1: 0.5695
 epoch: 78, train_loss: 0.6077, test_loss: 1.2034, test_f1: 0.5495
 epoch: 79, train_loss: 0.6026, test_loss: 1.3215, test_f1: 0.5630
 epoch: 80, train_loss: 0.5966, test_loss: 1.2616, test_f1: 0.5515
 epoch: 81, train_loss: 0.5828, test_loss: 1.2245, test_f1: 0.5620
 epoch: 82, train_loss: 0.5968, test_loss: 1.1858, test_f1: 0.5524
 epoch: 83, train_loss: 0.5895, test_loss: 1.2038, test_f1: 0.5494
 epoch: 84, train_loss: 0.5845, test_loss: 1.2837, test_f1: 0.5252
 epoch: 85, train_loss: 0.5832, test_loss: 1.1744, test_f1: 0.5616
 epoch: 86, train_loss: 0.5820, test_loss: 1.2802, test_f1: 0.5505
 epoch: 87, train_loss: 0.5730, test_loss: 1.2525, test_f1: 0.5522
 epoch: 88, train_loss: 0.5732, test_loss: 1.2969, test_f1: 0.5284
 epoch: 89, train_loss: 0.5794, test_loss: 1.2058, test_f1: 0.5688
 epoch: 90, train_loss: 0.5667, test_loss: 1.2654, test_f1: 0.5496
 epoch: 91, train_loss: 0.5590, test_loss: 1.3248, test_f1: 0.5248
 epoch: 92, train_loss: 0.5770, test_loss: 1.3161, test_f1: 0.5258
 epoch: 93, train_loss: 0.6156, test_loss: 1.2591, test_f1: 0.5519
 epoch: 94, train_loss: 0.5713, test_loss: 1.2268, test_f1: 0.5389
 epoch: 95, train_loss: 0.5570, test_loss: 1.3418, test_f1: 0.5211
 epoch: 96, train_loss: 0.5766, test_loss: 1.2809, test_f1: 0.5506
 epoch: 97, train_loss: 0.5551, test_loss: 1.2541, test_f1: 0.5534
 epoch: 98, train_loss: 0.5556, test_loss: 1.2284, test_f1: 0.5608
 epoch: 99, train_loss: 0.5713, test_loss: 1.2701, test_f1: 0.5589
##################ITERATION #8 ****************************************
 epoch: 0, train_loss: 1.3146, test_loss: 1.1349, test_f1: 0.4155
 epoch: 1, train_loss: 1.1717, test_loss: 1.0729, test_f1: 0.4561
 epoch: 2, train_loss: 1.1430, test_loss: 1.0375, test_f1: 0.4683
 epoch: 3, train_loss: 1.1099, test_loss: 1.0352, test_f1: 0.4718
 epoch: 4, train_loss: 1.0778, test_loss: 1.0196, test_f1: 0.4506
 epoch: 5, train_loss: 1.0545, test_loss: 1.0495, test_f1: 0.4092
 epoch: 6, train_loss: 1.0507, test_loss: 0.9622, test_f1: 0.4737
 epoch: 7, train_loss: 1.0230, test_loss: 0.9333, test_f1: 0.4990
 epoch: 8, train_loss: 1.0084, test_loss: 1.0146, test_f1: 0.4652
 epoch: 9, train_loss: 0.9920, test_loss: 0.9460, test_f1: 0.4798
 epoch: 10, train_loss: 0.9845, test_loss: 0.9253, test_f1: 0.5130
 epoch: 11, train_loss: 0.9873, test_loss: 0.9110, test_f1: 0.5157
 epoch: 12, train_loss: 0.9722, test_loss: 0.9447, test_f1: 0.4948
 epoch: 13, train_loss: 0.9526, test_loss: 0.9746, test_f1: 0.4660
 epoch: 14, train_loss: 0.9616, test_loss: 0.9765, test_f1: 0.5191
 epoch: 15, train_loss: 0.9426, test_loss: 0.9181, test_f1: 0.5126
 epoch: 16, train_loss: 0.9223, test_loss: 0.9202, test_f1: 0.5276
 epoch: 17, train_loss: 0.9195, test_loss: 0.9691, test_f1: 0.5180
 epoch: 18, train_loss: 0.9207, test_loss: 0.9129, test_f1: 0.5188
 epoch: 19, train_loss: 0.9161, test_loss: 0.9192, test_f1: 0.5141
 epoch: 20, train_loss: 0.8928, test_loss: 0.9828, test_f1: 0.5018
 epoch: 21, train_loss: 0.8929, test_loss: 0.9863, test_f1: 0.5115
 epoch: 22, train_loss: 0.8827, test_loss: 0.9559, test_f1: 0.5117
 epoch: 23, train_loss: 0.8748, test_loss: 0.9575, test_f1: 0.4994
 epoch: 24, train_loss: 0.8847, test_loss: 0.9940, test_f1: 0.5142
 epoch: 25, train_loss: 0.8760, test_loss: 0.9435, test_f1: 0.5567
 epoch: 26, train_loss: 0.8761, test_loss: 0.9757, test_f1: 0.5399
 epoch: 27, train_loss: 0.8512, test_loss: 0.9664, test_f1: 0.5086
 epoch: 28, train_loss: 0.8347, test_loss: 0.9831, test_f1: 0.5573
 epoch: 29, train_loss: 0.8401, test_loss: 0.9821, test_f1: 0.5372
 epoch: 30, train_loss: 0.8290, test_loss: 0.9783, test_f1: 0.5467
 epoch: 31, train_loss: 0.8027, test_loss: 1.0003, test_f1: 0.5357
 epoch: 32, train_loss: 0.8193, test_loss: 0.9850, test_f1: 0.5320
 epoch: 33, train_loss: 0.8001, test_loss: 1.0068, test_f1: 0.5420
 epoch: 34, train_loss: 0.7986, test_loss: 0.9875, test_f1: 0.5693
 epoch: 35, train_loss: 0.7982, test_loss: 0.9163, test_f1: 0.5356
 epoch: 36, train_loss: 0.7963, test_loss: 1.0710, test_f1: 0.5380
 epoch: 37, train_loss: 0.7798, test_loss: 1.0546, test_f1: 0.5411
 epoch: 38, train_loss: 0.7704, test_loss: 1.0552, test_f1: 0.5710
 epoch: 39, train_loss: 0.8241, test_loss: 1.0606, test_f1: 0.5367
 epoch: 40, train_loss: 0.8268, test_loss: 1.0387, test_f1: 0.5455
 epoch: 41, train_loss: 0.8057, test_loss: 1.0350, test_f1: 0.5537
 epoch: 42, train_loss: 0.7901, test_loss: 1.0371, test_f1: 0.5549
 epoch: 43, train_loss: 0.7708, test_loss: 1.0250, test_f1: 0.5382
 epoch: 44, train_loss: 0.7875, test_loss: 1.0248, test_f1: 0.5408
 epoch: 45, train_loss: 0.7665, test_loss: 1.0114, test_f1: 0.5697
 epoch: 46, train_loss: 0.7714, test_loss: 1.0097, test_f1: 0.5781
 epoch: 47, train_loss: 0.7657, test_loss: 1.0925, test_f1: 0.5556
 epoch: 48, train_loss: 0.7490, test_loss: 1.0926, test_f1: 0.5493
 epoch: 49, train_loss: 0.7396, test_loss: 1.1006, test_f1: 0.5598
 epoch: 50, train_loss: 0.7565, test_loss: 1.0905, test_f1: 0.5742
 epoch: 51, train_loss: 0.7061, test_loss: 1.1288, test_f1: 0.5542
 epoch: 52, train_loss: 0.6875, test_loss: 1.1380, test_f1: 0.5507
 epoch: 53, train_loss: 0.7013, test_loss: 1.1863, test_f1: 0.5392
 epoch: 54, train_loss: 0.6744, test_loss: 1.1216, test_f1: 0.5588
 epoch: 55, train_loss: 0.6725, test_loss: 1.2162, test_f1: 0.5360
 epoch: 56, train_loss: 0.6775, test_loss: 1.1479, test_f1: 0.5578
 epoch: 57, train_loss: 0.6778, test_loss: 1.1712, test_f1: 0.5678
 epoch: 58, train_loss: 0.6524, test_loss: 1.2101, test_f1: 0.5240
 epoch: 59, train_loss: 0.6907, test_loss: 1.1456, test_f1: 0.5773
 epoch: 60, train_loss: 0.6529, test_loss: 1.2036, test_f1: 0.5437
 epoch: 61, train_loss: 0.6510, test_loss: 1.1434, test_f1: 0.5503
 epoch: 62, train_loss: 0.6427, test_loss: 1.1567, test_f1: 0.5727
 epoch: 63, train_loss: 0.6317, test_loss: 1.1464, test_f1: 0.5682
 epoch: 64, train_loss: 0.6530, test_loss: 1.1664, test_f1: 0.5506
 epoch: 65, train_loss: 0.6305, test_loss: 1.1505, test_f1: 0.5749
 epoch: 66, train_loss: 0.6300, test_loss: 1.2453, test_f1: 0.5349
 epoch: 67, train_loss: 0.6480, test_loss: 1.2234, test_f1: 0.5513
 epoch: 68, train_loss: 0.6385, test_loss: 1.1577, test_f1: 0.5549
 epoch: 69, train_loss: 0.6276, test_loss: 1.3498, test_f1: 0.5000
 epoch: 70, train_loss: 0.6166, test_loss: 1.2873, test_f1: 0.5307
 epoch: 71, train_loss: 0.6319, test_loss: 1.2404, test_f1: 0.5597
 epoch: 72, train_loss: 0.6062, test_loss: 1.2899, test_f1: 0.5662
 epoch: 73, train_loss: 0.6040, test_loss: 1.2993, test_f1: 0.5567
 epoch: 74, train_loss: 0.6174, test_loss: 1.3533, test_f1: 0.5372
 epoch: 75, train_loss: 0.5903, test_loss: 1.2705, test_f1: 0.5610
 epoch: 76, train_loss: 0.5983, test_loss: 1.2680, test_f1: 0.5298
 epoch: 77, train_loss: 0.6096, test_loss: 1.2644, test_f1: 0.5681
 epoch: 78, train_loss: 0.5860, test_loss: 1.2466, test_f1: 0.5753
 epoch: 79, train_loss: 0.5940, test_loss: 1.3111, test_f1: 0.5394
 epoch: 80, train_loss: 0.5853, test_loss: 1.3132, test_f1: 0.5361
 epoch: 81, train_loss: 0.6011, test_loss: 1.3129, test_f1: 0.5647
 epoch: 82, train_loss: 0.5825, test_loss: 1.3277, test_f1: 0.5548
 epoch: 83, train_loss: 0.5898, test_loss: 1.3581, test_f1: 0.5461
 epoch: 84, train_loss: 0.5980, test_loss: 1.2884, test_f1: 0.5806
 epoch: 85, train_loss: 0.5791, test_loss: 1.2580, test_f1: 0.5592
 epoch: 86, train_loss: 0.5837, test_loss: 1.2771, test_f1: 0.5582
 epoch: 87, train_loss: 0.5805, test_loss: 1.3392, test_f1: 0.5635
 epoch: 88, train_loss: 0.5833, test_loss: 1.2934, test_f1: 0.5661
 epoch: 89, train_loss: 0.5809, test_loss: 1.3396, test_f1: 0.5292
 epoch: 90, train_loss: 0.5915, test_loss: 1.2577, test_f1: 0.5680
 epoch: 91, train_loss: 0.5718, test_loss: 1.2893, test_f1: 0.5786
 epoch: 92, train_loss: 0.5704, test_loss: 1.2214, test_f1: 0.5896
 epoch: 93, train_loss: 0.5663, test_loss: 1.2498, test_f1: 0.5657
 epoch: 94, train_loss: 0.5648, test_loss: 1.2034, test_f1: 0.5707
 epoch: 95, train_loss: 0.5832, test_loss: 1.2374, test_f1: 0.5629
 epoch: 96, train_loss: 0.5515, test_loss: 1.2649, test_f1: 0.5613
 epoch: 97, train_loss: 0.5519, test_loss: 1.2484, test_f1: 0.5587
 epoch: 98, train_loss: 0.5516, test_loss: 1.2781, test_f1: 0.5663
 epoch: 99, train_loss: 0.5449, test_loss: 1.2511, test_f1: 0.5489
##################ITERATION #9 ****************************************
 epoch: 0, train_loss: 1.3369, test_loss: 1.2310, test_f1: 0.3338
 epoch: 1, train_loss: 1.1697, test_loss: 1.0800, test_f1: 0.4618
 epoch: 2, train_loss: 1.1257, test_loss: 1.0398, test_f1: 0.4482
 epoch: 3, train_loss: 1.0904, test_loss: 0.9975, test_f1: 0.4536
 epoch: 4, train_loss: 1.0852, test_loss: 1.0057, test_f1: 0.4495
 epoch: 5, train_loss: 1.0464, test_loss: 0.9488, test_f1: 0.4875
 epoch: 6, train_loss: 1.0163, test_loss: 0.9698, test_f1: 0.4618
 epoch: 7, train_loss: 1.0116, test_loss: 1.0385, test_f1: 0.4497
 epoch: 8, train_loss: 1.0000, test_loss: 1.0048, test_f1: 0.4627
 epoch: 9, train_loss: 0.9826, test_loss: 0.9648, test_f1: 0.4684
 epoch: 10, train_loss: 0.9457, test_loss: 0.9591, test_f1: 0.4934
 epoch: 11, train_loss: 0.9464, test_loss: 0.9835, test_f1: 0.4780
 epoch: 12, train_loss: 0.9479, test_loss: 0.9618, test_f1: 0.4908
 epoch: 13, train_loss: 0.9234, test_loss: 0.9406, test_f1: 0.4761
 epoch: 14, train_loss: 0.9223, test_loss: 1.0071, test_f1: 0.4884
 epoch: 15, train_loss: 0.9123, test_loss: 1.0177, test_f1: 0.4719
 epoch: 16, train_loss: 0.9180, test_loss: 0.9571, test_f1: 0.4923
 epoch: 17, train_loss: 0.8869, test_loss: 0.9780, test_f1: 0.4989
 epoch: 18, train_loss: 0.8997, test_loss: 0.9575, test_f1: 0.4919
 epoch: 19, train_loss: 0.8817, test_loss: 0.9868, test_f1: 0.4873
 epoch: 20, train_loss: 0.8532, test_loss: 0.9555, test_f1: 0.5183
 epoch: 21, train_loss: 0.8681, test_loss: 0.9939, test_f1: 0.4977
 epoch: 22, train_loss: 0.8511, test_loss: 0.9492, test_f1: 0.5303
 epoch: 23, train_loss: 0.8781, test_loss: 0.9715, test_f1: 0.5061
 epoch: 24, train_loss: 0.8582, test_loss: 0.9994, test_f1: 0.5002
 epoch: 25, train_loss: 0.8343, test_loss: 0.9943, test_f1: 0.5295
 epoch: 26, train_loss: 0.8347, test_loss: 0.9767, test_f1: 0.5215
 epoch: 27, train_loss: 0.8380, test_loss: 0.9795, test_f1: 0.5189
 epoch: 28, train_loss: 0.8073, test_loss: 1.0332, test_f1: 0.5213
 epoch: 29, train_loss: 0.7991, test_loss: 1.0025, test_f1: 0.5079
 epoch: 30, train_loss: 0.7904, test_loss: 0.9749, test_f1: 0.5442
 epoch: 31, train_loss: 0.7940, test_loss: 0.9929, test_f1: 0.5560
 epoch: 32, train_loss: 0.7783, test_loss: 0.9897, test_f1: 0.5462
 epoch: 33, train_loss: 0.7964, test_loss: 1.0175, test_f1: 0.5316
 epoch: 34, train_loss: 0.7788, test_loss: 0.9916, test_f1: 0.5509
 epoch: 35, train_loss: 0.7811, test_loss: 0.9984, test_f1: 0.5409
 epoch: 36, train_loss: 0.7735, test_loss: 1.0674, test_f1: 0.5221
 epoch: 37, train_loss: 0.7954, test_loss: 1.0169, test_f1: 0.5420
 epoch: 38, train_loss: 0.7759, test_loss: 1.0175, test_f1: 0.5605
 epoch: 39, train_loss: 0.7691, test_loss: 1.0482, test_f1: 0.5433
 epoch: 40, train_loss: 0.7415, test_loss: 1.0262, test_f1: 0.5558
 epoch: 41, train_loss: 0.7546, test_loss: 1.1009, test_f1: 0.5328
 epoch: 42, train_loss: 0.7542, test_loss: 1.0347, test_f1: 0.5489
 epoch: 43, train_loss: 0.7505, test_loss: 1.0313, test_f1: 0.5463
 epoch: 44, train_loss: 0.7382, test_loss: 1.0662, test_f1: 0.5512
 epoch: 45, train_loss: 0.7185, test_loss: 1.0685, test_f1: 0.5214
 epoch: 46, train_loss: 0.7192, test_loss: 1.0011, test_f1: 0.5813
 epoch: 47, train_loss: 0.7209, test_loss: 1.0394, test_f1: 0.5531
 epoch: 48, train_loss: 0.6772, test_loss: 1.0407, test_f1: 0.5616
 epoch: 49, train_loss: 0.7154, test_loss: 1.0147, test_f1: 0.5623
 epoch: 50, train_loss: 0.7032, test_loss: 1.0694, test_f1: 0.5619
 epoch: 51, train_loss: 0.6685, test_loss: 1.0541, test_f1: 0.5580
 epoch: 52, train_loss: 0.6499, test_loss: 1.0682, test_f1: 0.5644
 epoch: 53, train_loss: 0.6537, test_loss: 1.1004, test_f1: 0.5508
 epoch: 54, train_loss: 0.6524, test_loss: 1.0616, test_f1: 0.5526
 epoch: 55, train_loss: 0.6403, test_loss: 1.0508, test_f1: 0.5709
 epoch: 56, train_loss: 0.6232, test_loss: 1.1029, test_f1: 0.5660
 epoch: 57, train_loss: 0.6290, test_loss: 1.1715, test_f1: 0.5406
 epoch: 58, train_loss: 0.6332, test_loss: 1.1123, test_f1: 0.5594
 epoch: 59, train_loss: 0.6240, test_loss: 1.1164, test_f1: 0.5549
 epoch: 60, train_loss: 0.6151, test_loss: 1.1150, test_f1: 0.5758
 epoch: 61, train_loss: 0.6063, test_loss: 1.1516, test_f1: 0.5712
 epoch: 62, train_loss: 0.6082, test_loss: 1.1350, test_f1: 0.5562
 epoch: 63, train_loss: 0.6088, test_loss: 1.1289, test_f1: 0.5653
 epoch: 64, train_loss: 0.6056, test_loss: 1.1937, test_f1: 0.5304
 epoch: 65, train_loss: 0.5916, test_loss: 1.1796, test_f1: 0.5602
 epoch: 66, train_loss: 0.5947, test_loss: 1.1375, test_f1: 0.5683
 epoch: 67, train_loss: 0.5950, test_loss: 1.1430, test_f1: 0.5516
 epoch: 68, train_loss: 0.5939, test_loss: 1.1722, test_f1: 0.5538
 epoch: 69, train_loss: 0.6019, test_loss: 1.2202, test_f1: 0.5786
 epoch: 70, train_loss: 0.5847, test_loss: 1.2743, test_f1: 0.5585
 epoch: 71, train_loss: 0.5798, test_loss: 1.1373, test_f1: 0.5501
 epoch: 72, train_loss: 0.5998, test_loss: 1.1710, test_f1: 0.5688
 epoch: 73, train_loss: 0.5890, test_loss: 1.1603, test_f1: 0.5702
 epoch: 74, train_loss: 0.5686, test_loss: 1.1868, test_f1: 0.5720
 epoch: 75, train_loss: 0.5732, test_loss: 1.2529, test_f1: 0.5862
 epoch: 76, train_loss: 0.5813, test_loss: 1.2042, test_f1: 0.5647
 epoch: 77, train_loss: 0.5832, test_loss: 1.2538, test_f1: 0.5459
 epoch: 78, train_loss: 0.5615, test_loss: 1.2188, test_f1: 0.5341
 epoch: 79, train_loss: 0.5592, test_loss: 1.2202, test_f1: 0.5754
 epoch: 80, train_loss: 0.5658, test_loss: 1.2270, test_f1: 0.5620
 epoch: 81, train_loss: 0.5519, test_loss: 1.1902, test_f1: 0.5647
 epoch: 82, train_loss: 0.5678, test_loss: 1.2273, test_f1: 0.5657
 epoch: 83, train_loss: 0.5459, test_loss: 1.2474, test_f1: 0.5637
 epoch: 84, train_loss: 0.5405, test_loss: 1.2176, test_f1: 0.5855
 epoch: 85, train_loss: 0.5538, test_loss: 1.2088, test_f1: 0.5601
 epoch: 86, train_loss: 0.5579, test_loss: 1.2138, test_f1: 0.5477
 epoch: 87, train_loss: 0.5516, test_loss: 1.1278, test_f1: 0.5829
 epoch: 88, train_loss: 0.5664, test_loss: 1.1771, test_f1: 0.5578
 epoch: 89, train_loss: 0.5353, test_loss: 1.2294, test_f1: 0.5450
 epoch: 90, train_loss: 0.5491, test_loss: 1.2390, test_f1: 0.5508
 epoch: 91, train_loss: 0.5306, test_loss: 1.1531, test_f1: 0.5759
 epoch: 92, train_loss: 0.5256, test_loss: 1.2003, test_f1: 0.5662
 epoch: 93, train_loss: 0.5526, test_loss: 1.1701, test_f1: 0.5739
 epoch: 94, train_loss: 0.5227, test_loss: 1.2113, test_f1: 0.5865
 epoch: 95, train_loss: 0.5147, test_loss: 1.2178, test_f1: 0.5864
 epoch: 96, train_loss: 0.5214, test_loss: 1.1888, test_f1: 0.5698
 epoch: 97, train_loss: 0.5059, test_loss: 1.2023, test_f1: 0.5900
 epoch: 98, train_loss: 0.5036, test_loss: 1.3071, test_f1: 0.5682
 epoch: 99, train_loss: 0.4794, test_loss: 1.2496, test_f1: 0.5901

Training completed in 1135.08 seconds
Best F1: 0.6013 at epoch 94
Mean F1 across iterations: 0.5865  0.0100
========================FINAL RESULTS================================
FEGIN weighted F1: 0.6013  0.0100
python main.py --data ltspice_examples --representation component_component --model FEGIN --layers 4 --hiddens 64 --batch_size 32 --lr 0.001 --emb_size 128 --epochs 100 --save_appendix component_component_L4_H64_BS32_LR0.001_E128 --no_val
-----



STDERR:
  File "main.py", line 370, in <module>
    main()
  File "main.py", line 254, in main
    dataset = dataset_class(
  File "/home/philip/projects/ltspice_examples_code_repo/Circuit-Completion-Using-GNNs/component_classification_with_link_prediction_head/evaluation/FEGIN/kernel/circuit_datasets.py", line 15, in __init__
    self.data, self.slices = torch.load(self.processed_paths[0])
  File "/home/philip/.local/lib/python3.8/site-packages/torch/serialization.py", line 1040, in load
    warnings.warn(
  File "/usr/lib/python3.8/warnings.py", line 109, in _showwarnmsg
    sw(msg.message, msg.category, msg.filename, msg.lineno,
  File "main.py", line 47, in warn_with_traceback
    traceback.print_stack(file=log)
/home/philip/projects/ltspice_examples_code_repo/Circuit-Completion-Using-GNNs/component_classification_with_link_prediction_head/evaluation/FEGIN/kernel/circuit_datasets.py:15: FutureWarning: You are using `torch.load` with `weights_only=False` (the current default value), which uses the default pickle module implicitly. It is possible to construct malicious pickle data which will execute arbitrary code during unpickling (See https://github.com/pytorch/pytorch/blob/main/SECURITY.md#untrusted-models for more details). In a future release, the default value for `weights_only` will be flipped to `True`. This limits the functions that could be executed during unpickling. Arbitrary objects will no longer be allowed to be loaded via this mode unless they are explicitly allowlisted by the user via `torch.serialization.add_safe_globals`. We recommend you start setting `weights_only=True` for any use case where you don't have full control of the loaded file. Please open an issue on GitHub for any issues related to this experimental feature.
  self.data, self.slices = torch.load(self.processed_paths[0])
