STDOUT:
Results will be saved in /home/philip/projects/llm_inference_code_repo/Circuit-Completion-Using-GNNs/component_classification_with_link_prediction_head/evaluation/FEGIN/results/model_FEGIN_dataset_ltspice_examples
Command line input: python main.py --data ltspice_examples --representation component_pin --model FEGIN --layers 6 --hiddens 32 --batch_size 32 --lr 0.01 --emb_size 512 --epochs 100 --save_appendix component_pin_L6_H32_BS32_LR0.01_E512 --no_val
 is saved.
-----
ltspice_examples - FEGIN
Using 6 layers, 32 hidden units, h = 2
Loading component_pin representation dataset
ENTERED
Training FEGIN on component_pin representation
Train: 3560, Test: 848
##################ITERATION #0 ****************************************
 epoch: 0, train_loss: 1.1930, test_loss: 1.1742, test_f1: 0.3351
 epoch: 1, train_loss: 1.0650, test_loss: 1.1341, test_f1: 0.3877
 epoch: 2, train_loss: 1.0473, test_loss: 1.1487, test_f1: 0.4204
 epoch: 3, train_loss: 1.0172, test_loss: 1.1247, test_f1: 0.3946
 epoch: 4, train_loss: 0.9792, test_loss: 1.0927, test_f1: 0.4841
 epoch: 5, train_loss: 1.0033, test_loss: 0.9942, test_f1: 0.4169
 epoch: 6, train_loss: 0.9834, test_loss: 0.9965, test_f1: 0.4523
 epoch: 7, train_loss: 0.9494, test_loss: 1.3250, test_f1: 0.4202
 epoch: 8, train_loss: 0.9475, test_loss: 0.9573, test_f1: 0.4498
 epoch: 9, train_loss: 0.9227, test_loss: 1.0025, test_f1: 0.3984
 epoch: 10, train_loss: 0.9440, test_loss: 0.9258, test_f1: 0.4977
 epoch: 11, train_loss: 0.9171, test_loss: 0.9862, test_f1: 0.5191
 epoch: 12, train_loss: 0.9115, test_loss: 0.9546, test_f1: 0.4649
 epoch: 13, train_loss: 0.9037, test_loss: 0.8465, test_f1: 0.5423
 epoch: 14, train_loss: 0.8892, test_loss: 0.8927, test_f1: 0.5083
 epoch: 15, train_loss: 0.8792, test_loss: 0.9120, test_f1: 0.5395
 epoch: 16, train_loss: 0.8771, test_loss: 0.9133, test_f1: 0.5227
 epoch: 17, train_loss: 0.8736, test_loss: 1.0110, test_f1: 0.4794
 epoch: 18, train_loss: 0.8717, test_loss: 0.8241, test_f1: 0.5561
 epoch: 19, train_loss: 0.8411, test_loss: 0.8729, test_f1: 0.5417
 epoch: 20, train_loss: 0.8526, test_loss: 0.8991, test_f1: 0.5168
 epoch: 21, train_loss: 0.8559, test_loss: 0.8799, test_f1: 0.5421
 epoch: 22, train_loss: 0.8577, test_loss: 0.8858, test_f1: 0.5187
 epoch: 23, train_loss: 0.8296, test_loss: 0.8964, test_f1: 0.5875
 epoch: 24, train_loss: 0.8336, test_loss: 0.8190, test_f1: 0.5950
 epoch: 25, train_loss: 0.8349, test_loss: 0.9258, test_f1: 0.5263
 epoch: 26, train_loss: 0.8136, test_loss: 0.8817, test_f1: 0.5185
 epoch: 27, train_loss: 0.8181, test_loss: 0.8834, test_f1: 0.4985
 epoch: 28, train_loss: 0.8189, test_loss: 0.9228, test_f1: 0.5357
 epoch: 29, train_loss: 0.8219, test_loss: 0.8524, test_f1: 0.5485
 epoch: 30, train_loss: 0.8096, test_loss: 0.9216, test_f1: 0.5360
 epoch: 31, train_loss: 0.8026, test_loss: 0.9730, test_f1: 0.4780
 epoch: 32, train_loss: 0.8002, test_loss: 0.9771, test_f1: 0.5092
 epoch: 33, train_loss: 0.7921, test_loss: 0.8562, test_f1: 0.5973
 epoch: 34, train_loss: 0.7781, test_loss: 0.8838, test_f1: 0.5265
 epoch: 35, train_loss: 0.7934, test_loss: 0.8204, test_f1: 0.5553
 epoch: 36, train_loss: 0.7720, test_loss: 0.8594, test_f1: 0.5482
 epoch: 37, train_loss: 0.8008, test_loss: 0.9041, test_f1: 0.5312
 epoch: 38, train_loss: 0.8012, test_loss: 0.8658, test_f1: 0.5451
 epoch: 39, train_loss: 0.7847, test_loss: 0.8666, test_f1: 0.5444
 epoch: 40, train_loss: 0.7723, test_loss: 0.9156, test_f1: 0.5526
 epoch: 41, train_loss: 0.7741, test_loss: 0.8930, test_f1: 0.5521
 epoch: 42, train_loss: 0.7604, test_loss: 0.9851, test_f1: 0.5357
 epoch: 43, train_loss: 0.7665, test_loss: 0.8950, test_f1: 0.5390
 epoch: 44, train_loss: 0.7469, test_loss: 0.9198, test_f1: 0.5308
 epoch: 45, train_loss: 0.7930, test_loss: 1.0140, test_f1: 0.5734
 epoch: 46, train_loss: 0.7894, test_loss: 0.9237, test_f1: 0.6124
 epoch: 47, train_loss: 0.7735, test_loss: 0.8991, test_f1: 0.5464
 epoch: 48, train_loss: 0.7619, test_loss: 0.9234, test_f1: 0.5509
 epoch: 49, train_loss: 0.7602, test_loss: 0.8807, test_f1: 0.5572
 epoch: 50, train_loss: 0.7714, test_loss: 0.8888, test_f1: 0.6114
 epoch: 51, train_loss: 0.7236, test_loss: 0.8772, test_f1: 0.5771
 epoch: 52, train_loss: 0.7208, test_loss: 0.9066, test_f1: 0.5510
 epoch: 53, train_loss: 0.7003, test_loss: 0.9602, test_f1: 0.5829
 epoch: 54, train_loss: 0.7022, test_loss: 0.9339, test_f1: 0.5811
 epoch: 55, train_loss: 0.7029, test_loss: 0.9171, test_f1: 0.5900
 epoch: 56, train_loss: 0.6931, test_loss: 0.8913, test_f1: 0.6049
 epoch: 57, train_loss: 0.6965, test_loss: 0.8544, test_f1: 0.6093
 epoch: 58, train_loss: 0.6871, test_loss: 0.9652, test_f1: 0.5860
 epoch: 59, train_loss: 0.6659, test_loss: 0.9214, test_f1: 0.6084
 epoch: 60, train_loss: 0.6842, test_loss: 0.8764, test_f1: 0.6169
 epoch: 61, train_loss: 0.6904, test_loss: 0.9070, test_f1: 0.5880
 epoch: 62, train_loss: 0.6726, test_loss: 0.9206, test_f1: 0.5880
 epoch: 63, train_loss: 0.6802, test_loss: 0.9239, test_f1: 0.6059
 epoch: 64, train_loss: 0.6616, test_loss: 0.9463, test_f1: 0.5577
 epoch: 65, train_loss: 0.6799, test_loss: 0.9452, test_f1: 0.6275
 epoch: 66, train_loss: 0.6694, test_loss: 0.9474, test_f1: 0.5822
 epoch: 67, train_loss: 0.6732, test_loss: 1.0012, test_f1: 0.5758
 epoch: 68, train_loss: 0.6708, test_loss: 0.9806, test_f1: 0.6130
 epoch: 69, train_loss: 0.6496, test_loss: 0.9871, test_f1: 0.5987
 epoch: 70, train_loss: 0.6580, test_loss: 0.9652, test_f1: 0.5528
 epoch: 71, train_loss: 0.6580, test_loss: 0.8748, test_f1: 0.6080
 epoch: 72, train_loss: 0.6622, test_loss: 0.8985, test_f1: 0.5911
 epoch: 73, train_loss: 0.6500, test_loss: 0.9577, test_f1: 0.5744
 epoch: 74, train_loss: 0.6556, test_loss: 0.8916, test_f1: 0.6221
 epoch: 75, train_loss: 0.6638, test_loss: 0.9311, test_f1: 0.5788
 epoch: 76, train_loss: 0.6565, test_loss: 0.9330, test_f1: 0.5856
 epoch: 77, train_loss: 0.6489, test_loss: 1.0183, test_f1: 0.5668
 epoch: 78, train_loss: 0.6551, test_loss: 0.8998, test_f1: 0.5848
 epoch: 79, train_loss: 0.6387, test_loss: 0.9649, test_f1: 0.5937
 epoch: 80, train_loss: 0.6471, test_loss: 1.0479, test_f1: 0.5944
 epoch: 81, train_loss: 0.6379, test_loss: 0.9797, test_f1: 0.5909
 epoch: 82, train_loss: 0.6281, test_loss: 1.0180, test_f1: 0.5657
 epoch: 83, train_loss: 0.6550, test_loss: 0.9758, test_f1: 0.6059
 epoch: 84, train_loss: 0.6187, test_loss: 0.9238, test_f1: 0.5668
 epoch: 85, train_loss: 0.6297, test_loss: 0.8616, test_f1: 0.6042
 epoch: 86, train_loss: 0.6264, test_loss: 1.0567, test_f1: 0.6165
 epoch: 87, train_loss: 0.6340, test_loss: 0.9988, test_f1: 0.6193
 epoch: 88, train_loss: 0.6376, test_loss: 0.9717, test_f1: 0.6253
 epoch: 89, train_loss: 0.6396, test_loss: 0.9371, test_f1: 0.6024
 epoch: 90, train_loss: 0.6210, test_loss: 0.9332, test_f1: 0.5599
 epoch: 91, train_loss: 0.6328, test_loss: 0.8984, test_f1: 0.5854
 epoch: 92, train_loss: 0.6132, test_loss: 0.8978, test_f1: 0.5994
 epoch: 93, train_loss: 0.6148, test_loss: 0.9649, test_f1: 0.6065
 epoch: 94, train_loss: 0.6307, test_loss: 0.8428, test_f1: 0.6334
 epoch: 95, train_loss: 0.6185, test_loss: 0.9425, test_f1: 0.6268
 epoch: 96, train_loss: 0.6063, test_loss: 0.9081, test_f1: 0.6330
 epoch: 97, train_loss: 0.6103, test_loss: 0.8626, test_f1: 0.6223
 epoch: 98, train_loss: 0.6184, test_loss: 0.9491, test_f1: 0.6153
 epoch: 99, train_loss: 0.6103, test_loss: 0.9531, test_f1: 0.6150
##################ITERATION #1 ****************************************
 epoch: 0, train_loss: 1.1533, test_loss: 1.1087, test_f1: 0.4014
 epoch: 1, train_loss: 1.0705, test_loss: 1.1989, test_f1: 0.3428
 epoch: 2, train_loss: 1.0388, test_loss: 1.0501, test_f1: 0.4005
 epoch: 3, train_loss: 1.0190, test_loss: 1.0399, test_f1: 0.4682
 epoch: 4, train_loss: 1.0056, test_loss: 0.9532, test_f1: 0.5331
 epoch: 5, train_loss: 0.9884, test_loss: 1.0785, test_f1: 0.5162
 epoch: 6, train_loss: 0.9714, test_loss: 0.9173, test_f1: 0.5062
 epoch: 7, train_loss: 0.9499, test_loss: 0.9661, test_f1: 0.4957
 epoch: 8, train_loss: 0.9229, test_loss: 0.9191, test_f1: 0.5248
 epoch: 9, train_loss: 0.9203, test_loss: 1.1318, test_f1: 0.4109
 epoch: 10, train_loss: 0.9060, test_loss: 1.0040, test_f1: 0.5064
 epoch: 11, train_loss: 0.9120, test_loss: 0.9019, test_f1: 0.5004
 epoch: 12, train_loss: 0.8861, test_loss: 0.9160, test_f1: 0.5056
 epoch: 13, train_loss: 0.8729, test_loss: 1.0941, test_f1: 0.4283
 epoch: 14, train_loss: 0.8559, test_loss: 0.9190, test_f1: 0.5090
 epoch: 15, train_loss: 0.8679, test_loss: 1.0315, test_f1: 0.3930
 epoch: 16, train_loss: 0.8706, test_loss: 0.9141, test_f1: 0.5102
 epoch: 17, train_loss: 0.8507, test_loss: 0.8598, test_f1: 0.5426
 epoch: 18, train_loss: 0.8529, test_loss: 0.9040, test_f1: 0.5271
 epoch: 19, train_loss: 0.8383, test_loss: 0.9369, test_f1: 0.5301
 epoch: 20, train_loss: 0.8526, test_loss: 0.9751, test_f1: 0.5221
 epoch: 21, train_loss: 0.8298, test_loss: 0.8698, test_f1: 0.5695
 epoch: 22, train_loss: 0.8398, test_loss: 0.9177, test_f1: 0.5177
 epoch: 23, train_loss: 0.8257, test_loss: 0.9840, test_f1: 0.5531
 epoch: 24, train_loss: 0.8141, test_loss: 0.8990, test_f1: 0.5828
 epoch: 25, train_loss: 0.8150, test_loss: 0.8904, test_f1: 0.5551
 epoch: 26, train_loss: 0.8033, test_loss: 0.9491, test_f1: 0.5324
 epoch: 27, train_loss: 0.8028, test_loss: 0.9888, test_f1: 0.5417
 epoch: 28, train_loss: 0.7909, test_loss: 0.8987, test_f1: 0.5111
 epoch: 29, train_loss: 0.7825, test_loss: 0.9516, test_f1: 0.5978
 epoch: 30, train_loss: 0.8072, test_loss: 0.9040, test_f1: 0.5575
 epoch: 31, train_loss: 0.8017, test_loss: 0.9885, test_f1: 0.5414
 epoch: 32, train_loss: 0.7880, test_loss: 0.9196, test_f1: 0.5586
 epoch: 33, train_loss: 0.7801, test_loss: 0.9657, test_f1: 0.5482
 epoch: 34, train_loss: 0.7637, test_loss: 0.9349, test_f1: 0.4994
 epoch: 35, train_loss: 0.7636, test_loss: 1.0980, test_f1: 0.5839
 epoch: 36, train_loss: 0.7594, test_loss: 1.0925, test_f1: 0.5370
 epoch: 37, train_loss: 0.7715, test_loss: 1.1577, test_f1: 0.4415
 epoch: 38, train_loss: 0.7696, test_loss: 1.1215, test_f1: 0.5957
 epoch: 39, train_loss: 0.7641, test_loss: 1.0236, test_f1: 0.5783
 epoch: 40, train_loss: 0.7431, test_loss: 0.9687, test_f1: 0.5717
 epoch: 41, train_loss: 0.7559, test_loss: 0.8435, test_f1: 0.6083
 epoch: 42, train_loss: 0.7623, test_loss: 0.9137, test_f1: 0.5586
 epoch: 43, train_loss: 0.7487, test_loss: 0.9798, test_f1: 0.5933
 epoch: 44, train_loss: 0.7867, test_loss: 0.9373, test_f1: 0.5323
 epoch: 45, train_loss: 0.7957, test_loss: 1.0244, test_f1: 0.5826
 epoch: 46, train_loss: 0.7617, test_loss: 0.9908, test_f1: 0.5941
 epoch: 47, train_loss: 0.7609, test_loss: 0.9115, test_f1: 0.5789
 epoch: 48, train_loss: 0.7504, test_loss: 0.9509, test_f1: 0.5846
 epoch: 49, train_loss: 0.7667, test_loss: 0.9086, test_f1: 0.5455
 epoch: 50, train_loss: 0.7457, test_loss: 1.0749, test_f1: 0.5348
 epoch: 51, train_loss: 0.7239, test_loss: 0.9927, test_f1: 0.6470
 epoch: 52, train_loss: 0.6994, test_loss: 1.0039, test_f1: 0.5730
 epoch: 53, train_loss: 0.7053, test_loss: 0.9596, test_f1: 0.5496
 epoch: 54, train_loss: 0.7043, test_loss: 1.0309, test_f1: 0.5804
 epoch: 55, train_loss: 0.6915, test_loss: 0.9420, test_f1: 0.6273
 epoch: 56, train_loss: 0.6927, test_loss: 1.0510, test_f1: 0.6153
 epoch: 57, train_loss: 0.6803, test_loss: 1.0438, test_f1: 0.5756
 epoch: 58, train_loss: 0.6765, test_loss: 0.9896, test_f1: 0.5726
 epoch: 59, train_loss: 0.6876, test_loss: 0.9593, test_f1: 0.6333
 epoch: 60, train_loss: 0.6870, test_loss: 0.9517, test_f1: 0.6453
 epoch: 61, train_loss: 0.6695, test_loss: 0.9460, test_f1: 0.6256
 epoch: 62, train_loss: 0.6609, test_loss: 1.0232, test_f1: 0.6082
 epoch: 63, train_loss: 0.6641, test_loss: 0.9474, test_f1: 0.6341
 epoch: 64, train_loss: 0.6695, test_loss: 0.9417, test_f1: 0.6484
 epoch: 65, train_loss: 0.6801, test_loss: 0.9797, test_f1: 0.6562
 epoch: 66, train_loss: 0.6604, test_loss: 1.0517, test_f1: 0.6299
 epoch: 67, train_loss: 0.6652, test_loss: 0.9527, test_f1: 0.6282
 epoch: 68, train_loss: 0.6728, test_loss: 1.0026, test_f1: 0.6602
 epoch: 69, train_loss: 0.6579, test_loss: 1.0403, test_f1: 0.6206
 epoch: 70, train_loss: 0.6689, test_loss: 1.0516, test_f1: 0.5903
 epoch: 71, train_loss: 0.6627, test_loss: 0.9524, test_f1: 0.6375
 epoch: 72, train_loss: 0.6667, test_loss: 0.9881, test_f1: 0.6331
 epoch: 73, train_loss: 0.6630, test_loss: 0.9540, test_f1: 0.6361
 epoch: 74, train_loss: 0.6763, test_loss: 0.9332, test_f1: 0.6566
 epoch: 75, train_loss: 0.6507, test_loss: 0.9426, test_f1: 0.6440
 epoch: 76, train_loss: 0.6453, test_loss: 0.9834, test_f1: 0.6126
 epoch: 77, train_loss: 0.6712, test_loss: 1.0148, test_f1: 0.6378
 epoch: 78, train_loss: 0.6440, test_loss: 0.9761, test_f1: 0.6567
 epoch: 79, train_loss: 0.6422, test_loss: 0.9736, test_f1: 0.6474
 epoch: 80, train_loss: 0.6532, test_loss: 0.9730, test_f1: 0.6128
 epoch: 81, train_loss: 0.6484, test_loss: 0.9651, test_f1: 0.6307
 epoch: 82, train_loss: 0.6537, test_loss: 1.0173, test_f1: 0.6398
 epoch: 83, train_loss: 0.6422, test_loss: 1.0290, test_f1: 0.5990
 epoch: 84, train_loss: 0.6447, test_loss: 0.9241, test_f1: 0.6162
 epoch: 85, train_loss: 0.6625, test_loss: 1.1066, test_f1: 0.6474
 epoch: 86, train_loss: 0.6332, test_loss: 1.2046, test_f1: 0.6346
 epoch: 87, train_loss: 0.6356, test_loss: 1.0788, test_f1: 0.6302
 epoch: 88, train_loss: 0.6353, test_loss: 1.0381, test_f1: 0.6429
 epoch: 89, train_loss: 0.6393, test_loss: 1.0723, test_f1: 0.6354
 epoch: 90, train_loss: 0.6293, test_loss: 1.0571, test_f1: 0.6391
 epoch: 91, train_loss: 0.6323, test_loss: 1.1701, test_f1: 0.6260
 epoch: 92, train_loss: 0.6453, test_loss: 1.1004, test_f1: 0.6402
 epoch: 93, train_loss: 0.6390, test_loss: 1.2015, test_f1: 0.6292
 epoch: 94, train_loss: 0.6386, test_loss: 1.0439, test_f1: 0.6302
 epoch: 95, train_loss: 0.6209, test_loss: 1.0914, test_f1: 0.6283
 epoch: 96, train_loss: 0.6227, test_loss: 1.0217, test_f1: 0.6108
 epoch: 97, train_loss: 0.6231, test_loss: 1.1935, test_f1: 0.6048
 epoch: 98, train_loss: 0.6282, test_loss: 1.0938, test_f1: 0.6547
 epoch: 99, train_loss: 0.6096, test_loss: 1.1579, test_f1: 0.6461
##################ITERATION #2 ****************************************
 epoch: 0, train_loss: 1.1188, test_loss: 1.1917, test_f1: 0.4133
 epoch: 1, train_loss: 1.0406, test_loss: 1.0465, test_f1: 0.4347
 epoch: 2, train_loss: 1.0035, test_loss: 1.0426, test_f1: 0.4883
 epoch: 3, train_loss: 1.0020, test_loss: 1.0456, test_f1: 0.4957
 epoch: 4, train_loss: 0.9937, test_loss: 0.9733, test_f1: 0.4783
 epoch: 5, train_loss: 0.9665, test_loss: 1.0462, test_f1: 0.4778
 epoch: 6, train_loss: 0.9679, test_loss: 0.9429, test_f1: 0.5281
 epoch: 7, train_loss: 0.9226, test_loss: 1.0169, test_f1: 0.5045
 epoch: 8, train_loss: 0.9397, test_loss: 0.9093, test_f1: 0.5444
 epoch: 9, train_loss: 0.9378, test_loss: 1.0703, test_f1: 0.5130
 epoch: 10, train_loss: 0.9118, test_loss: 0.8830, test_f1: 0.5185
 epoch: 11, train_loss: 0.9059, test_loss: 0.9753, test_f1: 0.5190
 epoch: 12, train_loss: 0.8896, test_loss: 0.8980, test_f1: 0.5375
 epoch: 13, train_loss: 0.8926, test_loss: 1.0075, test_f1: 0.4724
 epoch: 14, train_loss: 0.8800, test_loss: 0.9271, test_f1: 0.5335
 epoch: 15, train_loss: 0.8826, test_loss: 0.9746, test_f1: 0.4666
 epoch: 16, train_loss: 0.8604, test_loss: 0.9547, test_f1: 0.5231
 epoch: 17, train_loss: 0.8558, test_loss: 0.8514, test_f1: 0.6146
 epoch: 18, train_loss: 0.8523, test_loss: 1.1819, test_f1: 0.4517
 epoch: 19, train_loss: 0.8595, test_loss: 0.8681, test_f1: 0.5461
 epoch: 20, train_loss: 0.8328, test_loss: 0.9907, test_f1: 0.5069
 epoch: 21, train_loss: 0.8498, test_loss: 0.9934, test_f1: 0.4666
 epoch: 22, train_loss: 0.8549, test_loss: 1.0066, test_f1: 0.4860
 epoch: 23, train_loss: 0.8258, test_loss: 0.8598, test_f1: 0.5255
 epoch: 24, train_loss: 0.8295, test_loss: 0.9487, test_f1: 0.5182
 epoch: 25, train_loss: 0.8270, test_loss: 0.8387, test_f1: 0.5525
 epoch: 26, train_loss: 0.8125, test_loss: 0.8425, test_f1: 0.5409
 epoch: 27, train_loss: 0.8158, test_loss: 0.8434, test_f1: 0.5451
 epoch: 28, train_loss: 0.8258, test_loss: 0.8504, test_f1: 0.5242
 epoch: 29, train_loss: 0.8126, test_loss: 0.8604, test_f1: 0.5951
 epoch: 30, train_loss: 0.7850, test_loss: 0.8377, test_f1: 0.5464
 epoch: 31, train_loss: 0.7998, test_loss: 0.9503, test_f1: 0.5502
 epoch: 32, train_loss: 0.7914, test_loss: 0.9236, test_f1: 0.5266
 epoch: 33, train_loss: 0.8084, test_loss: 0.8928, test_f1: 0.5247
 epoch: 34, train_loss: 0.7787, test_loss: 0.8593, test_f1: 0.5457
 epoch: 35, train_loss: 0.7978, test_loss: 0.8803, test_f1: 0.5617
 epoch: 36, train_loss: 0.7758, test_loss: 0.8393, test_f1: 0.5385
 epoch: 37, train_loss: 0.7773, test_loss: 0.9177, test_f1: 0.5226
 epoch: 38, train_loss: 0.7704, test_loss: 0.9570, test_f1: 0.5221
 epoch: 39, train_loss: 0.7666, test_loss: 0.8177, test_f1: 0.5401
 epoch: 40, train_loss: 0.7691, test_loss: 0.8004, test_f1: 0.5528
 epoch: 41, train_loss: 0.7571, test_loss: 0.9250, test_f1: 0.5195
 epoch: 42, train_loss: 0.7726, test_loss: 0.8690, test_f1: 0.5610
 epoch: 43, train_loss: 0.7758, test_loss: 0.7811, test_f1: 0.5491
 epoch: 44, train_loss: 0.7516, test_loss: 0.8283, test_f1: 0.5647
 epoch: 45, train_loss: 0.7529, test_loss: 0.7918, test_f1: 0.5907
 epoch: 46, train_loss: 0.7539, test_loss: 0.9441, test_f1: 0.5404
 epoch: 47, train_loss: 0.7413, test_loss: 0.8338, test_f1: 0.6414
 epoch: 48, train_loss: 0.7533, test_loss: 0.9593, test_f1: 0.5732
 epoch: 49, train_loss: 0.7441, test_loss: 0.9100, test_f1: 0.6106
 epoch: 50, train_loss: 0.7453, test_loss: 0.7752, test_f1: 0.5716
 epoch: 51, train_loss: 0.7153, test_loss: 0.8548, test_f1: 0.5391
 epoch: 52, train_loss: 0.6959, test_loss: 0.7786, test_f1: 0.5716
 epoch: 53, train_loss: 0.6878, test_loss: 0.8217, test_f1: 0.5742
 epoch: 54, train_loss: 0.6883, test_loss: 0.7921, test_f1: 0.5876
 epoch: 55, train_loss: 0.6761, test_loss: 0.7963, test_f1: 0.5905
 epoch: 56, train_loss: 0.6851, test_loss: 0.8361, test_f1: 0.5860
 epoch: 57, train_loss: 0.6771, test_loss: 0.8602, test_f1: 0.5718
 epoch: 58, train_loss: 0.6821, test_loss: 0.8579, test_f1: 0.5911
 epoch: 59, train_loss: 0.6649, test_loss: 0.9577, test_f1: 0.5483
 epoch: 60, train_loss: 0.6849, test_loss: 0.9070, test_f1: 0.5859
 epoch: 61, train_loss: 0.6594, test_loss: 0.9161, test_f1: 0.5970
 epoch: 62, train_loss: 0.6672, test_loss: 0.7681, test_f1: 0.5895
 epoch: 63, train_loss: 0.6734, test_loss: 0.7873, test_f1: 0.5751
 epoch: 64, train_loss: 0.6779, test_loss: 0.8769, test_f1: 0.5927
 epoch: 65, train_loss: 0.6696, test_loss: 0.8774, test_f1: 0.6038
 epoch: 66, train_loss: 0.6544, test_loss: 0.8038, test_f1: 0.6039
 epoch: 67, train_loss: 0.6522, test_loss: 0.8747, test_f1: 0.5677
 epoch: 68, train_loss: 0.6713, test_loss: 0.8941, test_f1: 0.5853
 epoch: 69, train_loss: 0.6457, test_loss: 0.7342, test_f1: 0.5864
 epoch: 70, train_loss: 0.6634, test_loss: 0.7691, test_f1: 0.5826
 epoch: 71, train_loss: 0.6478, test_loss: 0.8271, test_f1: 0.6743
 epoch: 72, train_loss: 0.6628, test_loss: 0.8709, test_f1: 0.5971
 epoch: 73, train_loss: 0.6489, test_loss: 0.8825, test_f1: 0.5746
 epoch: 74, train_loss: 0.6540, test_loss: 0.8391, test_f1: 0.6443
 epoch: 75, train_loss: 0.6340, test_loss: 0.8719, test_f1: 0.6294
 epoch: 76, train_loss: 0.6495, test_loss: 0.8122, test_f1: 0.6684
 epoch: 77, train_loss: 0.6373, test_loss: 0.9085, test_f1: 0.6340
 epoch: 78, train_loss: 0.6472, test_loss: 0.8351, test_f1: 0.6760
 epoch: 79, train_loss: 0.6516, test_loss: 0.8431, test_f1: 0.6292
 epoch: 80, train_loss: 0.6416, test_loss: 0.9083, test_f1: 0.5674
 epoch: 81, train_loss: 0.6352, test_loss: 0.9831, test_f1: 0.6094
 epoch: 82, train_loss: 0.6330, test_loss: 0.8936, test_f1: 0.5948
 epoch: 83, train_loss: 0.6425, test_loss: 0.9003, test_f1: 0.6084
 epoch: 84, train_loss: 0.6333, test_loss: 0.8466, test_f1: 0.6466
 epoch: 85, train_loss: 0.6309, test_loss: 0.9158, test_f1: 0.6050
 epoch: 86, train_loss: 0.6276, test_loss: 0.8399, test_f1: 0.6327
 epoch: 87, train_loss: 0.6340, test_loss: 0.9599, test_f1: 0.5978
 epoch: 88, train_loss: 0.6390, test_loss: 0.8597, test_f1: 0.6249
 epoch: 89, train_loss: 0.6205, test_loss: 0.8878, test_f1: 0.6389
 epoch: 90, train_loss: 0.6341, test_loss: 0.9419, test_f1: 0.6230
 epoch: 91, train_loss: 0.6349, test_loss: 0.8616, test_f1: 0.6354
 epoch: 92, train_loss: 0.6179, test_loss: 1.0521, test_f1: 0.6294
 epoch: 93, train_loss: 0.6320, test_loss: 0.9497, test_f1: 0.6456
 epoch: 94, train_loss: 0.6195, test_loss: 0.8339, test_f1: 0.6281
 epoch: 95, train_loss: 0.6186, test_loss: 0.8523, test_f1: 0.6461
 epoch: 96, train_loss: 0.6153, test_loss: 0.9695, test_f1: 0.6180
 epoch: 97, train_loss: 0.6150, test_loss: 0.9405, test_f1: 0.6156
 epoch: 98, train_loss: 0.6075, test_loss: 0.8601, test_f1: 0.6469
 epoch: 99, train_loss: 0.6131, test_loss: 0.8073, test_f1: 0.6196
##################ITERATION #3 ****************************************
 epoch: 0, train_loss: 1.1636, test_loss: 1.0944, test_f1: 0.4386
 epoch: 1, train_loss: 1.0359, test_loss: 1.1105, test_f1: 0.3837
 epoch: 2, train_loss: 0.9700, test_loss: 0.9381, test_f1: 0.5374
 epoch: 3, train_loss: 0.9629, test_loss: 0.9479, test_f1: 0.4797
 epoch: 4, train_loss: 0.9328, test_loss: 1.0482, test_f1: 0.5329
 epoch: 5, train_loss: 0.9217, test_loss: 0.9044, test_f1: 0.5766
 epoch: 6, train_loss: 0.9123, test_loss: 0.9325, test_f1: 0.5196
 epoch: 7, train_loss: 0.9161, test_loss: 0.9870, test_f1: 0.5099
 epoch: 8, train_loss: 0.8984, test_loss: 0.9525, test_f1: 0.4852
 epoch: 9, train_loss: 0.8888, test_loss: 0.8851, test_f1: 0.5292
 epoch: 10, train_loss: 0.8806, test_loss: 0.8752, test_f1: 0.5523
 epoch: 11, train_loss: 0.8840, test_loss: 0.8637, test_f1: 0.5486
 epoch: 12, train_loss: 0.8859, test_loss: 0.8671, test_f1: 0.5428
 epoch: 13, train_loss: 0.8646, test_loss: 0.8939, test_f1: 0.5130
 epoch: 14, train_loss: 0.8731, test_loss: 0.8907, test_f1: 0.5434
 epoch: 15, train_loss: 0.8542, test_loss: 0.8524, test_f1: 0.5904
 epoch: 16, train_loss: 0.8482, test_loss: 0.8743, test_f1: 0.5773
 epoch: 17, train_loss: 0.8614, test_loss: 0.9695, test_f1: 0.5030
 epoch: 18, train_loss: 0.8570, test_loss: 1.0044, test_f1: 0.4694
 epoch: 19, train_loss: 0.8455, test_loss: 0.8641, test_f1: 0.6168
 epoch: 20, train_loss: 0.8313, test_loss: 0.9380, test_f1: 0.4929
 epoch: 21, train_loss: 0.8369, test_loss: 0.9354, test_f1: 0.5027
 epoch: 22, train_loss: 0.8133, test_loss: 0.8517, test_f1: 0.5717
 epoch: 23, train_loss: 0.8326, test_loss: 0.8288, test_f1: 0.5228
 epoch: 24, train_loss: 0.8202, test_loss: 0.8279, test_f1: 0.6008
 epoch: 25, train_loss: 0.8201, test_loss: 0.9327, test_f1: 0.5354
 epoch: 26, train_loss: 0.8185, test_loss: 0.8620, test_f1: 0.5726
 epoch: 27, train_loss: 0.8255, test_loss: 0.8257, test_f1: 0.6149
 epoch: 28, train_loss: 0.8140, test_loss: 0.9002, test_f1: 0.5490
 epoch: 29, train_loss: 0.8248, test_loss: 0.8277, test_f1: 0.5643
 epoch: 30, train_loss: 0.8096, test_loss: 0.8897, test_f1: 0.5371
 epoch: 31, train_loss: 0.8014, test_loss: 0.7670, test_f1: 0.5653
 epoch: 32, train_loss: 0.8019, test_loss: 0.8308, test_f1: 0.5468
 epoch: 33, train_loss: 0.8004, test_loss: 0.9312, test_f1: 0.5386
 epoch: 34, train_loss: 0.8065, test_loss: 0.7965, test_f1: 0.6129
 epoch: 35, train_loss: 0.7908, test_loss: 0.8192, test_f1: 0.5448
 epoch: 36, train_loss: 0.7825, test_loss: 0.8829, test_f1: 0.5396
 epoch: 37, train_loss: 0.7873, test_loss: 0.8141, test_f1: 0.5904
 epoch: 38, train_loss: 0.7678, test_loss: 0.7560, test_f1: 0.5607
 epoch: 39, train_loss: 0.7877, test_loss: 0.8429, test_f1: 0.5465
 epoch: 40, train_loss: 0.7662, test_loss: 0.8276, test_f1: 0.5648
 epoch: 41, train_loss: 0.7749, test_loss: 0.8369, test_f1: 0.5505
 epoch: 42, train_loss: 0.7687, test_loss: 0.8291, test_f1: 0.5630
 epoch: 43, train_loss: 0.7860, test_loss: 0.8405, test_f1: 0.5326
 epoch: 44, train_loss: 0.7633, test_loss: 0.8461, test_f1: 0.5378
 epoch: 45, train_loss: 0.7828, test_loss: 0.7985, test_f1: 0.5533
 epoch: 46, train_loss: 0.7813, test_loss: 0.8261, test_f1: 0.5304
 epoch: 47, train_loss: 0.7708, test_loss: 0.8540, test_f1: 0.6035
 epoch: 48, train_loss: 0.7674, test_loss: 0.8866, test_f1: 0.5361
 epoch: 49, train_loss: 0.7502, test_loss: 0.8426, test_f1: 0.5544
 epoch: 50, train_loss: 0.7459, test_loss: 0.8492, test_f1: 0.5523
 epoch: 51, train_loss: 0.7457, test_loss: 0.8281, test_f1: 0.5566
 epoch: 52, train_loss: 0.7289, test_loss: 0.9391, test_f1: 0.5924
 epoch: 53, train_loss: 0.7156, test_loss: 0.8315, test_f1: 0.5454
 epoch: 54, train_loss: 0.7269, test_loss: 0.8781, test_f1: 0.5656
 epoch: 55, train_loss: 0.7103, test_loss: 1.1248, test_f1: 0.5509
 epoch: 56, train_loss: 0.7107, test_loss: 0.9197, test_f1: 0.6163
 epoch: 57, train_loss: 0.7208, test_loss: 0.7938, test_f1: 0.6351
 epoch: 58, train_loss: 0.7132, test_loss: 0.8052, test_f1: 0.6075
 epoch: 59, train_loss: 0.7055, test_loss: 0.9290, test_f1: 0.5685
 epoch: 60, train_loss: 0.6934, test_loss: 0.8764, test_f1: 0.6055
 epoch: 61, train_loss: 0.7066, test_loss: 0.8084, test_f1: 0.6492
 epoch: 62, train_loss: 0.6898, test_loss: 0.8641, test_f1: 0.5931
 epoch: 63, train_loss: 0.7014, test_loss: 0.8239, test_f1: 0.6382
 epoch: 64, train_loss: 0.6841, test_loss: 0.8292, test_f1: 0.6217
 epoch: 65, train_loss: 0.6928, test_loss: 0.8440, test_f1: 0.5803
 epoch: 66, train_loss: 0.6854, test_loss: 0.8390, test_f1: 0.5747
 epoch: 67, train_loss: 0.6879, test_loss: 0.7993, test_f1: 0.6340
 epoch: 68, train_loss: 0.6897, test_loss: 0.8897, test_f1: 0.6033
 epoch: 69, train_loss: 0.6852, test_loss: 0.8966, test_f1: 0.5894
 epoch: 70, train_loss: 0.6831, test_loss: 0.8639, test_f1: 0.6189
 epoch: 71, train_loss: 0.6774, test_loss: 0.8311, test_f1: 0.6125
 epoch: 72, train_loss: 0.6991, test_loss: 0.8422, test_f1: 0.6180
 epoch: 73, train_loss: 0.6754, test_loss: 0.9206, test_f1: 0.5722
 epoch: 74, train_loss: 0.6886, test_loss: 0.9732, test_f1: 0.5568
 epoch: 75, train_loss: 0.6726, test_loss: 0.9712, test_f1: 0.5925
 epoch: 76, train_loss: 0.7011, test_loss: 0.8804, test_f1: 0.5891
 epoch: 77, train_loss: 0.6754, test_loss: 0.8009, test_f1: 0.6124
 epoch: 78, train_loss: 0.6866, test_loss: 0.8479, test_f1: 0.5713
 epoch: 79, train_loss: 0.6653, test_loss: 1.0890, test_f1: 0.5836
 epoch: 80, train_loss: 0.6770, test_loss: 0.9578, test_f1: 0.6052
 epoch: 81, train_loss: 0.6479, test_loss: 1.0689, test_f1: 0.5743
 epoch: 82, train_loss: 0.6709, test_loss: 0.9080, test_f1: 0.5984
 epoch: 83, train_loss: 0.6702, test_loss: 0.9492, test_f1: 0.6075
 epoch: 84, train_loss: 0.6702, test_loss: 0.9258, test_f1: 0.5816
 epoch: 85, train_loss: 0.6661, test_loss: 0.9097, test_f1: 0.6172
 epoch: 86, train_loss: 0.6578, test_loss: 0.9161, test_f1: 0.6379
 epoch: 87, train_loss: 0.6592, test_loss: 0.9078, test_f1: 0.6488
 epoch: 88, train_loss: 0.6587, test_loss: 1.0015, test_f1: 0.6152
 epoch: 89, train_loss: 0.6663, test_loss: 1.0469, test_f1: 0.5823
 epoch: 90, train_loss: 0.6611, test_loss: 0.9327, test_f1: 0.5919
 epoch: 91, train_loss: 0.6562, test_loss: 0.9763, test_f1: 0.5909
 epoch: 92, train_loss: 0.6550, test_loss: 0.9887, test_f1: 0.6106
 epoch: 93, train_loss: 0.6452, test_loss: 1.0885, test_f1: 0.6180
 epoch: 94, train_loss: 0.6438, test_loss: 0.9766, test_f1: 0.6071
 epoch: 95, train_loss: 0.6539, test_loss: 0.9286, test_f1: 0.6391
 epoch: 96, train_loss: 0.6373, test_loss: 1.0212, test_f1: 0.6145
 epoch: 97, train_loss: 0.6482, test_loss: 0.9405, test_f1: 0.6370
 epoch: 98, train_loss: 0.6468, test_loss: 1.0321, test_f1: 0.6137
 epoch: 99, train_loss: 0.6309, test_loss: 0.9356, test_f1: 0.6099
##################ITERATION #4 ****************************************
 epoch: 0, train_loss: 1.1738, test_loss: 1.1716, test_f1: 0.3297
 epoch: 1, train_loss: 1.0436, test_loss: 0.9834, test_f1: 0.4479
 epoch: 2, train_loss: 1.0197, test_loss: 1.0392, test_f1: 0.4841
 epoch: 3, train_loss: 1.0043, test_loss: 1.0398, test_f1: 0.4841
 epoch: 4, train_loss: 0.9903, test_loss: 1.0231, test_f1: 0.4432
 epoch: 5, train_loss: 0.9683, test_loss: 1.1590, test_f1: 0.4341
 epoch: 6, train_loss: 0.9646, test_loss: 1.0045, test_f1: 0.4727
 epoch: 7, train_loss: 0.9514, test_loss: 1.1123, test_f1: 0.4271
 epoch: 8, train_loss: 0.9261, test_loss: 0.9962, test_f1: 0.4414
 epoch: 9, train_loss: 0.9394, test_loss: 0.9769, test_f1: 0.5000
 epoch: 10, train_loss: 0.9236, test_loss: 1.1788, test_f1: 0.4290
 epoch: 11, train_loss: 0.9296, test_loss: 0.9371, test_f1: 0.4972
 epoch: 12, train_loss: 0.9403, test_loss: 1.0633, test_f1: 0.4160
 epoch: 13, train_loss: 0.9331, test_loss: 0.8861, test_f1: 0.5007
 epoch: 14, train_loss: 0.9201, test_loss: 0.9116, test_f1: 0.5103
 epoch: 15, train_loss: 0.9021, test_loss: 0.9284, test_f1: 0.5035
 epoch: 16, train_loss: 0.8986, test_loss: 0.8860, test_f1: 0.5285
 epoch: 17, train_loss: 0.8855, test_loss: 0.9357, test_f1: 0.5040
 epoch: 18, train_loss: 0.8877, test_loss: 0.9712, test_f1: 0.5117
 epoch: 19, train_loss: 0.9034, test_loss: 0.9549, test_f1: 0.4956
 epoch: 20, train_loss: 0.8727, test_loss: 0.9905, test_f1: 0.5034
 epoch: 21, train_loss: 0.9042, test_loss: 0.8679, test_f1: 0.5164
 epoch: 22, train_loss: 0.8600, test_loss: 0.9131, test_f1: 0.5105
 epoch: 23, train_loss: 0.8671, test_loss: 0.8376, test_f1: 0.5617
 epoch: 24, train_loss: 0.8674, test_loss: 0.8215, test_f1: 0.5342
 epoch: 25, train_loss: 0.8615, test_loss: 0.8516, test_f1: 0.5408
 epoch: 26, train_loss: 0.8435, test_loss: 0.8472, test_f1: 0.5813
 epoch: 27, train_loss: 0.8919, test_loss: 0.9009, test_f1: 0.5359
 epoch: 28, train_loss: 0.8550, test_loss: 1.0540, test_f1: 0.4752
 epoch: 29, train_loss: 0.8369, test_loss: 0.8624, test_f1: 0.5233
 epoch: 30, train_loss: 0.8318, test_loss: 0.8530, test_f1: 0.5474
 epoch: 31, train_loss: 0.8464, test_loss: 0.8473, test_f1: 0.5386
 epoch: 32, train_loss: 0.8390, test_loss: 0.8464, test_f1: 0.5375
 epoch: 33, train_loss: 0.8252, test_loss: 0.8914, test_f1: 0.5267
 epoch: 34, train_loss: 0.8147, test_loss: 0.8362, test_f1: 0.5482
 epoch: 35, train_loss: 0.8211, test_loss: 0.8296, test_f1: 0.5709
 epoch: 36, train_loss: 0.8257, test_loss: 0.8539, test_f1: 0.5220
 epoch: 37, train_loss: 0.8149, test_loss: 0.8484, test_f1: 0.5817
 epoch: 38, train_loss: 0.8203, test_loss: 0.9803, test_f1: 0.5373
 epoch: 39, train_loss: 0.8239, test_loss: 0.8362, test_f1: 0.5810
 epoch: 40, train_loss: 0.8244, test_loss: 0.8389, test_f1: 0.5430
 epoch: 41, train_loss: 0.7995, test_loss: 0.8858, test_f1: 0.5394
 epoch: 42, train_loss: 0.8058, test_loss: 0.8140, test_f1: 0.5345
 epoch: 43, train_loss: 0.8077, test_loss: 0.9056, test_f1: 0.5350
 epoch: 44, train_loss: 0.8191, test_loss: 0.8081, test_f1: 0.5577
 epoch: 45, train_loss: 0.8008, test_loss: 0.7922, test_f1: 0.5644
 epoch: 46, train_loss: 0.7960, test_loss: 0.8648, test_f1: 0.5388
 epoch: 47, train_loss: 0.7875, test_loss: 0.8482, test_f1: 0.5510
 epoch: 48, train_loss: 0.7963, test_loss: 0.8036, test_f1: 0.5509
 epoch: 49, train_loss: 0.7814, test_loss: 0.8108, test_f1: 0.5732
 epoch: 50, train_loss: 0.7696, test_loss: 0.8728, test_f1: 0.5779
 epoch: 51, train_loss: 0.7405, test_loss: 0.8489, test_f1: 0.5570
 epoch: 52, train_loss: 0.7444, test_loss: 0.8253, test_f1: 0.5682
 epoch: 53, train_loss: 0.7396, test_loss: 0.8459, test_f1: 0.5876
 epoch: 54, train_loss: 0.7222, test_loss: 0.8293, test_f1: 0.5569
 epoch: 55, train_loss: 0.7235, test_loss: 0.8332, test_f1: 0.5852
 epoch: 56, train_loss: 0.7485, test_loss: 0.8372, test_f1: 0.5804
 epoch: 57, train_loss: 0.7156, test_loss: 0.8446, test_f1: 0.5804
 epoch: 58, train_loss: 0.7161, test_loss: 0.8084, test_f1: 0.5609
 epoch: 59, train_loss: 0.7180, test_loss: 0.8073, test_f1: 0.5882
 epoch: 60, train_loss: 0.7015, test_loss: 0.7599, test_f1: 0.6286
 epoch: 61, train_loss: 0.7153, test_loss: 0.8609, test_f1: 0.5694
 epoch: 62, train_loss: 0.7213, test_loss: 0.8940, test_f1: 0.5596
 epoch: 63, train_loss: 0.6959, test_loss: 0.8403, test_f1: 0.5689
 epoch: 64, train_loss: 0.7086, test_loss: 0.7945, test_f1: 0.5895
 epoch: 65, train_loss: 0.7053, test_loss: 0.8536, test_f1: 0.5867
 epoch: 66, train_loss: 0.6986, test_loss: 0.8408, test_f1: 0.5851
 epoch: 67, train_loss: 0.6887, test_loss: 0.8713, test_f1: 0.5682
 epoch: 68, train_loss: 0.6926, test_loss: 0.8437, test_f1: 0.5786
 epoch: 69, train_loss: 0.6938, test_loss: 0.7836, test_f1: 0.5749
 epoch: 70, train_loss: 0.6830, test_loss: 0.8114, test_f1: 0.5806
 epoch: 71, train_loss: 0.6984, test_loss: 0.8506, test_f1: 0.5526
 epoch: 72, train_loss: 0.6993, test_loss: 0.8033, test_f1: 0.5850
 epoch: 73, train_loss: 0.6817, test_loss: 0.8139, test_f1: 0.5635
 epoch: 74, train_loss: 0.6798, test_loss: 0.8173, test_f1: 0.5923
 epoch: 75, train_loss: 0.6839, test_loss: 0.8628, test_f1: 0.5936
 epoch: 76, train_loss: 0.6793, test_loss: 0.7688, test_f1: 0.5870
 epoch: 77, train_loss: 0.6884, test_loss: 0.7776, test_f1: 0.5906
 epoch: 78, train_loss: 0.6787, test_loss: 0.7972, test_f1: 0.6088
 epoch: 79, train_loss: 0.6778, test_loss: 0.8351, test_f1: 0.6250
 epoch: 80, train_loss: 0.6746, test_loss: 0.7870, test_f1: 0.5884
 epoch: 81, train_loss: 0.6821, test_loss: 0.8754, test_f1: 0.5769
 epoch: 82, train_loss: 0.6761, test_loss: 0.9450, test_f1: 0.5580
 epoch: 83, train_loss: 0.6817, test_loss: 0.8594, test_f1: 0.5770
 epoch: 84, train_loss: 0.6757, test_loss: 0.7454, test_f1: 0.6490
 epoch: 85, train_loss: 0.6846, test_loss: 0.8250, test_f1: 0.6118
 epoch: 86, train_loss: 0.6678, test_loss: 0.8274, test_f1: 0.6525
 epoch: 87, train_loss: 0.6497, test_loss: 0.9476, test_f1: 0.5784
 epoch: 88, train_loss: 0.6404, test_loss: 0.8890, test_f1: 0.6031
 epoch: 89, train_loss: 0.6592, test_loss: 0.8069, test_f1: 0.6395
 epoch: 90, train_loss: 0.6602, test_loss: 0.7719, test_f1: 0.6157
 epoch: 91, train_loss: 0.6492, test_loss: 0.8404, test_f1: 0.6078
 epoch: 92, train_loss: 0.6516, test_loss: 0.8324, test_f1: 0.6249
 epoch: 93, train_loss: 0.6637, test_loss: 0.7872, test_f1: 0.6153
 epoch: 94, train_loss: 0.6621, test_loss: 0.7915, test_f1: 0.6243
 epoch: 95, train_loss: 0.6527, test_loss: 0.7902, test_f1: 0.6350
 epoch: 96, train_loss: 0.6512, test_loss: 0.8033, test_f1: 0.6279
 epoch: 97, train_loss: 0.6457, test_loss: 0.7575, test_f1: 0.5964
 epoch: 98, train_loss: 0.6490, test_loss: 0.8227, test_f1: 0.6104
 epoch: 99, train_loss: 0.6387, test_loss: 0.8296, test_f1: 0.6116
##################ITERATION #5 ****************************************
 epoch: 0, train_loss: 1.1671, test_loss: 1.1855, test_f1: 0.3841
 epoch: 1, train_loss: 1.0462, test_loss: 1.0503, test_f1: 0.4285
 epoch: 2, train_loss: 1.0300, test_loss: 1.0131, test_f1: 0.4618
 epoch: 3, train_loss: 0.9995, test_loss: 1.0461, test_f1: 0.4490
 epoch: 4, train_loss: 0.9828, test_loss: 1.0092, test_f1: 0.4696
 epoch: 5, train_loss: 0.9680, test_loss: 0.9525, test_f1: 0.4939
 epoch: 6, train_loss: 0.9600, test_loss: 1.0012, test_f1: 0.5034
 epoch: 7, train_loss: 0.9652, test_loss: 0.9500, test_f1: 0.4849
 epoch: 8, train_loss: 0.9564, test_loss: 0.9043, test_f1: 0.5197
 epoch: 9, train_loss: 0.9378, test_loss: 1.1296, test_f1: 0.4351
 epoch: 10, train_loss: 0.9324, test_loss: 0.8986, test_f1: 0.5298
 epoch: 11, train_loss: 0.9270, test_loss: 0.9350, test_f1: 0.4427
 epoch: 12, train_loss: 0.9091, test_loss: 0.9015, test_f1: 0.5578
 epoch: 13, train_loss: 0.9037, test_loss: 0.9137, test_f1: 0.5069
 epoch: 14, train_loss: 0.9079, test_loss: 0.9921, test_f1: 0.5121
 epoch: 15, train_loss: 0.8907, test_loss: 0.8906, test_f1: 0.4898
 epoch: 16, train_loss: 0.9154, test_loss: 0.9265, test_f1: 0.5333
 epoch: 17, train_loss: 0.8725, test_loss: 0.8776, test_f1: 0.5381
 epoch: 18, train_loss: 0.8777, test_loss: 0.9540, test_f1: 0.5408
 epoch: 19, train_loss: 0.8869, test_loss: 1.0820, test_f1: 0.4770
 epoch: 20, train_loss: 0.8771, test_loss: 0.9043, test_f1: 0.5466
 epoch: 21, train_loss: 0.8772, test_loss: 0.9121, test_f1: 0.5478
 epoch: 22, train_loss: 0.8598, test_loss: 1.0235, test_f1: 0.4949
 epoch: 23, train_loss: 0.8460, test_loss: 1.0382, test_f1: 0.5035
 epoch: 24, train_loss: 0.8482, test_loss: 0.9678, test_f1: 0.4626
 epoch: 25, train_loss: 0.8397, test_loss: 1.0801, test_f1: 0.4557
 epoch: 26, train_loss: 0.8526, test_loss: 0.8667, test_f1: 0.5419
 epoch: 27, train_loss: 0.8295, test_loss: 0.8759, test_f1: 0.5555
 epoch: 28, train_loss: 0.8392, test_loss: 0.9447, test_f1: 0.5722
 epoch: 29, train_loss: 0.8400, test_loss: 0.8127, test_f1: 0.5576
 epoch: 30, train_loss: 0.8231, test_loss: 0.8506, test_f1: 0.5550
 epoch: 31, train_loss: 0.8023, test_loss: 1.5464, test_f1: 0.4047
 epoch: 32, train_loss: 0.8504, test_loss: 0.9193, test_f1: 0.5788
 epoch: 33, train_loss: 0.8255, test_loss: 0.8751, test_f1: 0.5612
 epoch: 34, train_loss: 0.8008, test_loss: 0.8611, test_f1: 0.5527
 epoch: 35, train_loss: 0.8124, test_loss: 1.0326, test_f1: 0.4666
 epoch: 36, train_loss: 0.8190, test_loss: 0.9559, test_f1: 0.5102
 epoch: 37, train_loss: 0.7918, test_loss: 0.8523, test_f1: 0.5340
 epoch: 38, train_loss: 0.8214, test_loss: 0.8713, test_f1: 0.5599
 epoch: 39, train_loss: 0.8115, test_loss: 0.9187, test_f1: 0.5405
 epoch: 40, train_loss: 0.7942, test_loss: 0.8647, test_f1: 0.5477
 epoch: 41, train_loss: 0.8173, test_loss: 0.8507, test_f1: 0.5658
 epoch: 42, train_loss: 0.8023, test_loss: 0.9504, test_f1: 0.5373
 epoch: 43, train_loss: 0.7922, test_loss: 0.8576, test_f1: 0.5454
 epoch: 44, train_loss: 0.7956, test_loss: 0.9185, test_f1: 0.4883
 epoch: 45, train_loss: 0.7911, test_loss: 0.8797, test_f1: 0.5487
 epoch: 46, train_loss: 0.7939, test_loss: 0.8394, test_f1: 0.5589
 epoch: 47, train_loss: 0.7907, test_loss: 0.9734, test_f1: 0.5466
 epoch: 48, train_loss: 0.7915, test_loss: 0.8709, test_f1: 0.5332
 epoch: 49, train_loss: 0.7912, test_loss: 0.9038, test_f1: 0.5488
 epoch: 50, train_loss: 0.7757, test_loss: 0.8428, test_f1: 0.5576
 epoch: 51, train_loss: 0.7353, test_loss: 0.8485, test_f1: 0.5526
 epoch: 52, train_loss: 0.7352, test_loss: 0.8460, test_f1: 0.5805
 epoch: 53, train_loss: 0.7271, test_loss: 0.8473, test_f1: 0.5605
 epoch: 54, train_loss: 0.7153, test_loss: 0.8381, test_f1: 0.6436
 epoch: 55, train_loss: 0.7132, test_loss: 0.8418, test_f1: 0.6473
 epoch: 56, train_loss: 0.7103, test_loss: 0.8583, test_f1: 0.5683
 epoch: 57, train_loss: 0.7255, test_loss: 0.8840, test_f1: 0.6139
 epoch: 58, train_loss: 0.7008, test_loss: 0.9127, test_f1: 0.5921
 epoch: 59, train_loss: 0.7362, test_loss: 0.8883, test_f1: 0.6029
 epoch: 60, train_loss: 0.7170, test_loss: 0.8783, test_f1: 0.5896
 epoch: 61, train_loss: 0.7184, test_loss: 0.8479, test_f1: 0.6492
 epoch: 62, train_loss: 0.6977, test_loss: 0.8372, test_f1: 0.6210
 epoch: 63, train_loss: 0.7055, test_loss: 0.8817, test_f1: 0.5953
 epoch: 64, train_loss: 0.6953, test_loss: 0.7859, test_f1: 0.6385
 epoch: 65, train_loss: 0.7089, test_loss: 0.9135, test_f1: 0.5812
 epoch: 66, train_loss: 0.7067, test_loss: 0.8924, test_f1: 0.5701
 epoch: 67, train_loss: 0.6917, test_loss: 0.8785, test_f1: 0.5970
 epoch: 68, train_loss: 0.6974, test_loss: 0.8545, test_f1: 0.5701
 epoch: 69, train_loss: 0.6931, test_loss: 0.9802, test_f1: 0.6137
 epoch: 70, train_loss: 0.7126, test_loss: 0.8523, test_f1: 0.6188
 epoch: 71, train_loss: 0.6808, test_loss: 0.9476, test_f1: 0.6120
 epoch: 72, train_loss: 0.6778, test_loss: 0.8694, test_f1: 0.6346
 epoch: 73, train_loss: 0.6790, test_loss: 0.8889, test_f1: 0.5870
 epoch: 74, train_loss: 0.6967, test_loss: 0.9051, test_f1: 0.6134
 epoch: 75, train_loss: 0.6899, test_loss: 0.8503, test_f1: 0.5913
 epoch: 76, train_loss: 0.6839, test_loss: 0.8278, test_f1: 0.6475
 epoch: 77, train_loss: 0.6710, test_loss: 0.8858, test_f1: 0.5973
 epoch: 78, train_loss: 0.6879, test_loss: 0.8885, test_f1: 0.6441
 epoch: 79, train_loss: 0.6674, test_loss: 0.8460, test_f1: 0.6346
 epoch: 80, train_loss: 0.6604, test_loss: 0.9559, test_f1: 0.6324
 epoch: 81, train_loss: 0.6678, test_loss: 0.8991, test_f1: 0.6594
 epoch: 82, train_loss: 0.6617, test_loss: 0.8631, test_f1: 0.6101
 epoch: 83, train_loss: 0.6538, test_loss: 0.8537, test_f1: 0.6260
 epoch: 84, train_loss: 0.6686, test_loss: 0.9016, test_f1: 0.6098
 epoch: 85, train_loss: 0.6614, test_loss: 0.8655, test_f1: 0.6303
 epoch: 86, train_loss: 0.6483, test_loss: 0.9221, test_f1: 0.6083
 epoch: 87, train_loss: 0.6699, test_loss: 0.8723, test_f1: 0.6522
 epoch: 88, train_loss: 0.6637, test_loss: 0.9084, test_f1: 0.6538
 epoch: 89, train_loss: 0.6601, test_loss: 0.8728, test_f1: 0.5797
 epoch: 90, train_loss: 0.6306, test_loss: 0.9299, test_f1: 0.5962
 epoch: 91, train_loss: 0.6538, test_loss: 0.8925, test_f1: 0.6070
 epoch: 92, train_loss: 0.6516, test_loss: 0.9379, test_f1: 0.5927
 epoch: 93, train_loss: 0.6477, test_loss: 0.9269, test_f1: 0.5775
 epoch: 94, train_loss: 0.6411, test_loss: 0.9333, test_f1: 0.6190
 epoch: 95, train_loss: 0.6581, test_loss: 0.8500, test_f1: 0.6095
 epoch: 96, train_loss: 0.6469, test_loss: 0.8858, test_f1: 0.6435
 epoch: 97, train_loss: 0.6462, test_loss: 0.8569, test_f1: 0.6253
 epoch: 98, train_loss: 0.6381, test_loss: 0.9233, test_f1: 0.6193
 epoch: 99, train_loss: 0.6218, test_loss: 0.9156, test_f1: 0.6217
##################ITERATION #6 ****************************************
 epoch: 0, train_loss: 1.1331, test_loss: 1.3135, test_f1: 0.3946
 epoch: 1, train_loss: 1.0346, test_loss: 1.0922, test_f1: 0.4228
 epoch: 2, train_loss: 1.0245, test_loss: 0.9791, test_f1: 0.4848
 epoch: 3, train_loss: 0.9854, test_loss: 1.0590, test_f1: 0.4836
 epoch: 4, train_loss: 0.9732, test_loss: 0.9855, test_f1: 0.5037
 epoch: 5, train_loss: 0.9605, test_loss: 0.9454, test_f1: 0.5308
 epoch: 6, train_loss: 0.9304, test_loss: 1.0123, test_f1: 0.4640
 epoch: 7, train_loss: 0.9397, test_loss: 0.9532, test_f1: 0.4761
 epoch: 8, train_loss: 0.9166, test_loss: 0.9193, test_f1: 0.5231
 epoch: 9, train_loss: 0.9231, test_loss: 0.9593, test_f1: 0.5061
 epoch: 10, train_loss: 0.9197, test_loss: 0.9557, test_f1: 0.4957
 epoch: 11, train_loss: 0.9002, test_loss: 0.9765, test_f1: 0.4206
 epoch: 12, train_loss: 0.9226, test_loss: 0.8836, test_f1: 0.5235
 epoch: 13, train_loss: 0.9030, test_loss: 0.9916, test_f1: 0.4966
 epoch: 14, train_loss: 0.8835, test_loss: 0.8814, test_f1: 0.5166
 epoch: 15, train_loss: 0.8819, test_loss: 0.8692, test_f1: 0.5746
 epoch: 16, train_loss: 0.8741, test_loss: 0.9350, test_f1: 0.4904
 epoch: 17, train_loss: 0.8931, test_loss: 0.8455, test_f1: 0.5381
 epoch: 18, train_loss: 0.8618, test_loss: 0.8513, test_f1: 0.5707
 epoch: 19, train_loss: 0.8588, test_loss: 0.8648, test_f1: 0.5282
 epoch: 20, train_loss: 0.8524, test_loss: 0.8348, test_f1: 0.5919
 epoch: 21, train_loss: 0.8576, test_loss: 0.8448, test_f1: 0.5674
 epoch: 22, train_loss: 0.8592, test_loss: 0.8463, test_f1: 0.5628
 epoch: 23, train_loss: 0.8459, test_loss: 0.8399, test_f1: 0.5571
 epoch: 24, train_loss: 0.8293, test_loss: 0.8641, test_f1: 0.4968
 epoch: 25, train_loss: 0.8351, test_loss: 0.8376, test_f1: 0.5851
 epoch: 26, train_loss: 0.8348, test_loss: 0.8829, test_f1: 0.4799
 epoch: 27, train_loss: 0.8322, test_loss: 0.8005, test_f1: 0.5612
 epoch: 28, train_loss: 0.8229, test_loss: 0.8697, test_f1: 0.6032
 epoch: 29, train_loss: 0.8220, test_loss: 0.8309, test_f1: 0.5836
 epoch: 30, train_loss: 0.7994, test_loss: 0.8485, test_f1: 0.5299
 epoch: 31, train_loss: 0.8232, test_loss: 0.8853, test_f1: 0.5670
 epoch: 32, train_loss: 0.8110, test_loss: 0.9155, test_f1: 0.5265
 epoch: 33, train_loss: 0.8006, test_loss: 0.8448, test_f1: 0.5504
 epoch: 34, train_loss: 0.8247, test_loss: 0.7923, test_f1: 0.5986
 epoch: 35, train_loss: 0.7885, test_loss: 0.8779, test_f1: 0.5584
 epoch: 36, train_loss: 0.7877, test_loss: 0.7846, test_f1: 0.6291
 epoch: 37, train_loss: 0.7796, test_loss: 0.7999, test_f1: 0.6188
 epoch: 38, train_loss: 0.7746, test_loss: 0.8045, test_f1: 0.5992
 epoch: 39, train_loss: 0.7760, test_loss: 0.8157, test_f1: 0.5778
 epoch: 40, train_loss: 0.7699, test_loss: 0.8240, test_f1: 0.5633
 epoch: 41, train_loss: 0.7659, test_loss: 0.8572, test_f1: 0.6108
 epoch: 42, train_loss: 0.7632, test_loss: 0.8458, test_f1: 0.5821
 epoch: 43, train_loss: 0.7551, test_loss: 0.9464, test_f1: 0.5989
 epoch: 44, train_loss: 0.7601, test_loss: 0.8117, test_f1: 0.5739
 epoch: 45, train_loss: 0.7586, test_loss: 0.7784, test_f1: 0.6460
 epoch: 46, train_loss: 0.7588, test_loss: 0.8830, test_f1: 0.5506
 epoch: 47, train_loss: 0.7331, test_loss: 0.8199, test_f1: 0.6233
 epoch: 48, train_loss: 0.7507, test_loss: 0.8497, test_f1: 0.6112
 epoch: 49, train_loss: 0.7698, test_loss: 0.7954, test_f1: 0.5890
 epoch: 50, train_loss: 0.7456, test_loss: 0.8310, test_f1: 0.6212
 epoch: 51, train_loss: 0.7163, test_loss: 0.8010, test_f1: 0.5957
 epoch: 52, train_loss: 0.7121, test_loss: 0.8024, test_f1: 0.6196
 epoch: 53, train_loss: 0.6991, test_loss: 0.8395, test_f1: 0.6203
 epoch: 54, train_loss: 0.7005, test_loss: 0.8412, test_f1: 0.6125
 epoch: 55, train_loss: 0.7033, test_loss: 0.7722, test_f1: 0.6451
 epoch: 56, train_loss: 0.6888, test_loss: 0.8038, test_f1: 0.6029
 epoch: 57, train_loss: 0.6984, test_loss: 0.8163, test_f1: 0.6092
 epoch: 58, train_loss: 0.6981, test_loss: 0.7898, test_f1: 0.6231
 epoch: 59, train_loss: 0.6765, test_loss: 0.8009, test_f1: 0.6148
 epoch: 60, train_loss: 0.6943, test_loss: 0.7770, test_f1: 0.6062
 epoch: 61, train_loss: 0.6909, test_loss: 0.8406, test_f1: 0.6069
 epoch: 62, train_loss: 0.6782, test_loss: 0.8045, test_f1: 0.6220
 epoch: 63, train_loss: 0.6711, test_loss: 0.8030, test_f1: 0.6605
 epoch: 64, train_loss: 0.6805, test_loss: 0.8305, test_f1: 0.5994
 epoch: 65, train_loss: 0.6710, test_loss: 0.8088, test_f1: 0.6158
 epoch: 66, train_loss: 0.6834, test_loss: 0.8068, test_f1: 0.6167
 epoch: 67, train_loss: 0.6630, test_loss: 0.8068, test_f1: 0.6492
 epoch: 68, train_loss: 0.6584, test_loss: 0.8067, test_f1: 0.6283
 epoch: 69, train_loss: 0.6669, test_loss: 0.8084, test_f1: 0.5954
 epoch: 70, train_loss: 0.6585, test_loss: 0.7844, test_f1: 0.6372
 epoch: 71, train_loss: 0.6804, test_loss: 0.8425, test_f1: 0.5898
 epoch: 72, train_loss: 0.6703, test_loss: 0.8364, test_f1: 0.6415
 epoch: 73, train_loss: 0.6730, test_loss: 0.8002, test_f1: 0.6223
 epoch: 74, train_loss: 0.6614, test_loss: 0.8166, test_f1: 0.6435
 epoch: 75, train_loss: 0.6653, test_loss: 0.8801, test_f1: 0.5975
 epoch: 76, train_loss: 0.6533, test_loss: 0.8209, test_f1: 0.6325
 epoch: 77, train_loss: 0.6593, test_loss: 0.8393, test_f1: 0.6342
 epoch: 78, train_loss: 0.6470, test_loss: 0.8375, test_f1: 0.6267
 epoch: 79, train_loss: 0.6453, test_loss: 0.8654, test_f1: 0.6293
 epoch: 80, train_loss: 0.6536, test_loss: 0.7968, test_f1: 0.6257
 epoch: 81, train_loss: 0.6582, test_loss: 0.8695, test_f1: 0.6248
 epoch: 82, train_loss: 0.6727, test_loss: 0.8612, test_f1: 0.5963
 epoch: 83, train_loss: 0.6494, test_loss: 0.8578, test_f1: 0.6462
 epoch: 84, train_loss: 0.6217, test_loss: 0.8663, test_f1: 0.6292
 epoch: 85, train_loss: 0.6445, test_loss: 0.8173, test_f1: 0.6269
 epoch: 86, train_loss: 0.6450, test_loss: 0.8275, test_f1: 0.6341
 epoch: 87, train_loss: 0.6292, test_loss: 0.8522, test_f1: 0.6208
 epoch: 88, train_loss: 0.6391, test_loss: 0.8583, test_f1: 0.6074
 epoch: 89, train_loss: 0.6314, test_loss: 0.8495, test_f1: 0.6170
 epoch: 90, train_loss: 0.6400, test_loss: 0.8720, test_f1: 0.6299
 epoch: 91, train_loss: 0.6316, test_loss: 0.8750, test_f1: 0.5966
 epoch: 92, train_loss: 0.6307, test_loss: 0.8674, test_f1: 0.6360
 epoch: 93, train_loss: 0.6157, test_loss: 0.8305, test_f1: 0.6214
 epoch: 94, train_loss: 0.6190, test_loss: 0.8448, test_f1: 0.6575
 epoch: 95, train_loss: 0.6197, test_loss: 0.8807, test_f1: 0.5848
 epoch: 96, train_loss: 0.6284, test_loss: 0.8318, test_f1: 0.6341
 epoch: 97, train_loss: 0.6413, test_loss: 0.7911, test_f1: 0.6251
 epoch: 98, train_loss: 0.6283, test_loss: 0.8234, test_f1: 0.6181
 epoch: 99, train_loss: 0.6220, test_loss: 0.8577, test_f1: 0.6253
##################ITERATION #7 ****************************************
 epoch: 0, train_loss: 1.1755, test_loss: 1.1701, test_f1: 0.3429
 epoch: 1, train_loss: 1.0339, test_loss: 1.0713, test_f1: 0.4724
 epoch: 2, train_loss: 1.0039, test_loss: 1.0566, test_f1: 0.4215
 epoch: 3, train_loss: 1.0182, test_loss: 1.0649, test_f1: 0.4207
 epoch: 4, train_loss: 0.9897, test_loss: 1.0487, test_f1: 0.3971
 epoch: 5, train_loss: 0.9825, test_loss: 1.0605, test_f1: 0.4998
 epoch: 6, train_loss: 0.9531, test_loss: 1.0077, test_f1: 0.4753
 epoch: 7, train_loss: 0.9460, test_loss: 1.0184, test_f1: 0.4842
 epoch: 8, train_loss: 0.9633, test_loss: 1.0337, test_f1: 0.4738
 epoch: 9, train_loss: 0.9272, test_loss: 0.9479, test_f1: 0.4968
 epoch: 10, train_loss: 0.9331, test_loss: 1.0402, test_f1: 0.5193
 epoch: 11, train_loss: 0.9039, test_loss: 0.9341, test_f1: 0.5216
 epoch: 12, train_loss: 0.9040, test_loss: 0.9297, test_f1: 0.5138
 epoch: 13, train_loss: 0.8920, test_loss: 1.3036, test_f1: 0.4373
 epoch: 14, train_loss: 0.8926, test_loss: 0.9232, test_f1: 0.5081
 epoch: 15, train_loss: 0.9096, test_loss: 0.8820, test_f1: 0.5223
 epoch: 16, train_loss: 0.8777, test_loss: 0.9248, test_f1: 0.4922
 epoch: 17, train_loss: 0.8716, test_loss: 0.9256, test_f1: 0.5125
 epoch: 18, train_loss: 0.8542, test_loss: 0.8666, test_f1: 0.5529
 epoch: 19, train_loss: 0.8673, test_loss: 0.8651, test_f1: 0.5895
 epoch: 20, train_loss: 0.8435, test_loss: 0.9219, test_f1: 0.5982
 epoch: 21, train_loss: 0.8469, test_loss: 0.9601, test_f1: 0.5179
 epoch: 22, train_loss: 0.8385, test_loss: 0.8710, test_f1: 0.5391
 epoch: 23, train_loss: 0.8385, test_loss: 0.9044, test_f1: 0.5174
 epoch: 24, train_loss: 0.8367, test_loss: 0.8544, test_f1: 0.5432
 epoch: 25, train_loss: 0.8479, test_loss: 0.8851, test_f1: 0.5408
 epoch: 26, train_loss: 0.8217, test_loss: 0.9561, test_f1: 0.5327
 epoch: 27, train_loss: 0.8099, test_loss: 1.0216, test_f1: 0.5319
 epoch: 28, train_loss: 0.8153, test_loss: 0.9023, test_f1: 0.5590
 epoch: 29, train_loss: 0.8229, test_loss: 0.9195, test_f1: 0.5623
 epoch: 30, train_loss: 0.8254, test_loss: 0.8736, test_f1: 0.5839
 epoch: 31, train_loss: 0.7980, test_loss: 1.0506, test_f1: 0.5301
 epoch: 32, train_loss: 0.7955, test_loss: 0.8937, test_f1: 0.5763
 epoch: 33, train_loss: 0.7973, test_loss: 0.9439, test_f1: 0.5355
 epoch: 34, train_loss: 0.7949, test_loss: 1.0691, test_f1: 0.4833
 epoch: 35, train_loss: 0.8085, test_loss: 0.8423, test_f1: 0.5470
 epoch: 36, train_loss: 0.8056, test_loss: 0.9158, test_f1: 0.5319
 epoch: 37, train_loss: 0.8068, test_loss: 0.8524, test_f1: 0.5477
 epoch: 38, train_loss: 0.7834, test_loss: 0.9107, test_f1: 0.5823
 epoch: 39, train_loss: 0.7817, test_loss: 0.9859, test_f1: 0.5292
 epoch: 40, train_loss: 0.7795, test_loss: 0.8755, test_f1: 0.5308
 epoch: 41, train_loss: 0.7791, test_loss: 0.9768, test_f1: 0.5671
 epoch: 42, train_loss: 0.7640, test_loss: 0.8646, test_f1: 0.5990
 epoch: 43, train_loss: 0.7699, test_loss: 0.8482, test_f1: 0.5520
 epoch: 44, train_loss: 0.7691, test_loss: 0.8865, test_f1: 0.5587
 epoch: 45, train_loss: 0.7781, test_loss: 0.8468, test_f1: 0.5528
 epoch: 46, train_loss: 0.7613, test_loss: 0.9164, test_f1: 0.5494
 epoch: 47, train_loss: 0.7616, test_loss: 1.0064, test_f1: 0.5554
 epoch: 48, train_loss: 0.7572, test_loss: 0.8790, test_f1: 0.6020
 epoch: 49, train_loss: 0.7710, test_loss: 0.8829, test_f1: 0.6135
 epoch: 50, train_loss: 0.7598, test_loss: 0.9443, test_f1: 0.5842
 epoch: 51, train_loss: 0.7346, test_loss: 0.9170, test_f1: 0.6030
 epoch: 52, train_loss: 0.7192, test_loss: 0.9110, test_f1: 0.5919
 epoch: 53, train_loss: 0.7325, test_loss: 0.8732, test_f1: 0.6195
 epoch: 54, train_loss: 0.7305, test_loss: 0.8403, test_f1: 0.5951
 epoch: 55, train_loss: 0.6997, test_loss: 0.8895, test_f1: 0.6223
 epoch: 56, train_loss: 0.7041, test_loss: 0.8625, test_f1: 0.6123
 epoch: 57, train_loss: 0.6877, test_loss: 0.8868, test_f1: 0.5802
 epoch: 58, train_loss: 0.7093, test_loss: 0.9148, test_f1: 0.6118
 epoch: 59, train_loss: 0.6979, test_loss: 0.8813, test_f1: 0.6227
 epoch: 60, train_loss: 0.7057, test_loss: 0.8714, test_f1: 0.5861
 epoch: 61, train_loss: 0.6903, test_loss: 0.8363, test_f1: 0.6359
 epoch: 62, train_loss: 0.6800, test_loss: 0.8686, test_f1: 0.6283
 epoch: 63, train_loss: 0.6887, test_loss: 0.9148, test_f1: 0.6099
 epoch: 64, train_loss: 0.6776, test_loss: 0.9475, test_f1: 0.6045
 epoch: 65, train_loss: 0.6974, test_loss: 0.8552, test_f1: 0.5941
 epoch: 66, train_loss: 0.6900, test_loss: 0.9048, test_f1: 0.6081
 epoch: 67, train_loss: 0.6732, test_loss: 0.8992, test_f1: 0.6172
 epoch: 68, train_loss: 0.6736, test_loss: 0.9008, test_f1: 0.6045
 epoch: 69, train_loss: 0.6851, test_loss: 0.9943, test_f1: 0.5865
 epoch: 70, train_loss: 0.6786, test_loss: 0.8481, test_f1: 0.6259
 epoch: 71, train_loss: 0.6680, test_loss: 0.9281, test_f1: 0.5977
 epoch: 72, train_loss: 0.6649, test_loss: 0.8808, test_f1: 0.6241
 epoch: 73, train_loss: 0.6584, test_loss: 0.9592, test_f1: 0.6108
 epoch: 74, train_loss: 0.6632, test_loss: 0.9182, test_f1: 0.6013
 epoch: 75, train_loss: 0.6590, test_loss: 0.8849, test_f1: 0.6013
 epoch: 76, train_loss: 0.6525, test_loss: 0.8395, test_f1: 0.6226
 epoch: 77, train_loss: 0.6668, test_loss: 1.0187, test_f1: 0.5751
 epoch: 78, train_loss: 0.6687, test_loss: 0.9161, test_f1: 0.6004
 epoch: 79, train_loss: 0.6518, test_loss: 0.8524, test_f1: 0.6208
 epoch: 80, train_loss: 0.6498, test_loss: 0.8817, test_f1: 0.5995
 epoch: 81, train_loss: 0.6519, test_loss: 0.9125, test_f1: 0.6213
 epoch: 82, train_loss: 0.6593, test_loss: 0.8770, test_f1: 0.6062
 epoch: 83, train_loss: 0.6549, test_loss: 0.9159, test_f1: 0.6192
 epoch: 84, train_loss: 0.6522, test_loss: 0.9088, test_f1: 0.6190
 epoch: 85, train_loss: 0.6504, test_loss: 0.8814, test_f1: 0.6200
 epoch: 86, train_loss: 0.6432, test_loss: 0.9098, test_f1: 0.6255
 epoch: 87, train_loss: 0.6462, test_loss: 0.8688, test_f1: 0.6109
 epoch: 88, train_loss: 0.6591, test_loss: 0.9881, test_f1: 0.6225
 epoch: 89, train_loss: 0.6474, test_loss: 0.9354, test_f1: 0.6143
 epoch: 90, train_loss: 0.6526, test_loss: 0.9414, test_f1: 0.6105
 epoch: 91, train_loss: 0.6328, test_loss: 0.8356, test_f1: 0.6288
 epoch: 92, train_loss: 0.6322, test_loss: 0.9329, test_f1: 0.6330
 epoch: 93, train_loss: 0.6391, test_loss: 0.8439, test_f1: 0.6369
 epoch: 94, train_loss: 0.6248, test_loss: 0.8899, test_f1: 0.6366
 epoch: 95, train_loss: 0.6420, test_loss: 0.8882, test_f1: 0.6277
 epoch: 96, train_loss: 0.6218, test_loss: 0.8707, test_f1: 0.6332
 epoch: 97, train_loss: 0.6238, test_loss: 0.8730, test_f1: 0.5931
 epoch: 98, train_loss: 0.6202, test_loss: 0.8474, test_f1: 0.6093
 epoch: 99, train_loss: 0.6339, test_loss: 0.9259, test_f1: 0.6275
##################ITERATION #8 ****************************************
 epoch: 0, train_loss: 1.1629, test_loss: 1.0383, test_f1: 0.3390
 epoch: 1, train_loss: 1.0272, test_loss: 1.0769, test_f1: 0.4638
 epoch: 2, train_loss: 0.9805, test_loss: 1.1858, test_f1: 0.4665
 epoch: 3, train_loss: 0.9820, test_loss: 0.9671, test_f1: 0.4643
 epoch: 4, train_loss: 0.9894, test_loss: 1.0298, test_f1: 0.4556
 epoch: 5, train_loss: 0.9543, test_loss: 1.1868, test_f1: 0.3812
 epoch: 6, train_loss: 0.9385, test_loss: 0.9791, test_f1: 0.4801
 epoch: 7, train_loss: 0.9272, test_loss: 0.9506, test_f1: 0.5059
 epoch: 8, train_loss: 0.9261, test_loss: 0.9852, test_f1: 0.4645
 epoch: 9, train_loss: 0.9419, test_loss: 1.0075, test_f1: 0.4818
 epoch: 10, train_loss: 0.9183, test_loss: 0.9270, test_f1: 0.4899
 epoch: 11, train_loss: 0.9202, test_loss: 0.9467, test_f1: 0.5218
 epoch: 12, train_loss: 0.8907, test_loss: 0.9754, test_f1: 0.4701
 epoch: 13, train_loss: 0.8792, test_loss: 1.1457, test_f1: 0.4366
 epoch: 14, train_loss: 0.9036, test_loss: 1.0033, test_f1: 0.5459
 epoch: 15, train_loss: 0.8917, test_loss: 0.9871, test_f1: 0.5042
 epoch: 16, train_loss: 0.8815, test_loss: 0.9340, test_f1: 0.5883
 epoch: 17, train_loss: 0.8717, test_loss: 0.9775, test_f1: 0.5117
 epoch: 18, train_loss: 0.8478, test_loss: 0.8524, test_f1: 0.5915
 epoch: 19, train_loss: 0.8445, test_loss: 0.8683, test_f1: 0.5708
 epoch: 20, train_loss: 0.8568, test_loss: 1.0329, test_f1: 0.4475
 epoch: 21, train_loss: 0.8629, test_loss: 0.8687, test_f1: 0.5662
 epoch: 22, train_loss: 0.8596, test_loss: 0.8781, test_f1: 0.5346
 epoch: 23, train_loss: 0.8300, test_loss: 0.8964, test_f1: 0.5931
 epoch: 24, train_loss: 0.8247, test_loss: 1.0308, test_f1: 0.4942
 epoch: 25, train_loss: 0.8508, test_loss: 0.9222, test_f1: 0.5567
 epoch: 26, train_loss: 0.8359, test_loss: 0.8940, test_f1: 0.4908
 epoch: 27, train_loss: 0.8263, test_loss: 0.9143, test_f1: 0.5333
 epoch: 28, train_loss: 0.8317, test_loss: 0.9269, test_f1: 0.5030
 epoch: 29, train_loss: 0.8203, test_loss: 0.9148, test_f1: 0.5324
 epoch: 30, train_loss: 0.8205, test_loss: 0.9662, test_f1: 0.5237
 epoch: 31, train_loss: 0.8013, test_loss: 0.9048, test_f1: 0.5288
 epoch: 32, train_loss: 0.8209, test_loss: 0.8606, test_f1: 0.5491
 epoch: 33, train_loss: 0.8112, test_loss: 0.8921, test_f1: 0.5238
 epoch: 34, train_loss: 0.8075, test_loss: 0.9038, test_f1: 0.5324
 epoch: 35, train_loss: 0.7861, test_loss: 0.9657, test_f1: 0.5188
 epoch: 36, train_loss: 0.7990, test_loss: 0.9584, test_f1: 0.5091
 epoch: 37, train_loss: 0.7979, test_loss: 0.8964, test_f1: 0.5358
 epoch: 38, train_loss: 0.8052, test_loss: 0.9786, test_f1: 0.5599
 epoch: 39, train_loss: 0.7812, test_loss: 0.8767, test_f1: 0.5510
 epoch: 40, train_loss: 0.7798, test_loss: 0.9173, test_f1: 0.5776
 epoch: 41, train_loss: 0.7818, test_loss: 0.8942, test_f1: 0.5937
 epoch: 42, train_loss: 0.7945, test_loss: 0.9647, test_f1: 0.5441
 epoch: 43, train_loss: 0.7822, test_loss: 0.8340, test_f1: 0.5717
 epoch: 44, train_loss: 0.7707, test_loss: 0.8813, test_f1: 0.5465
 epoch: 45, train_loss: 0.7932, test_loss: 0.8319, test_f1: 0.5875
 epoch: 46, train_loss: 0.7551, test_loss: 0.8941, test_f1: 0.6026
 epoch: 47, train_loss: 0.7760, test_loss: 0.9010, test_f1: 0.5382
 epoch: 48, train_loss: 0.7516, test_loss: 0.8288, test_f1: 0.6166
 epoch: 49, train_loss: 0.7388, test_loss: 0.9103, test_f1: 0.5468
 epoch: 50, train_loss: 0.7649, test_loss: 0.8835, test_f1: 0.5951
 epoch: 51, train_loss: 0.7320, test_loss: 0.8349, test_f1: 0.5825
 epoch: 52, train_loss: 0.7234, test_loss: 0.9062, test_f1: 0.5796
 epoch: 53, train_loss: 0.7236, test_loss: 0.8347, test_f1: 0.6049
 epoch: 54, train_loss: 0.7083, test_loss: 0.8501, test_f1: 0.5650
 epoch: 55, train_loss: 0.7154, test_loss: 0.8606, test_f1: 0.5915
 epoch: 56, train_loss: 0.7077, test_loss: 0.8007, test_f1: 0.6200
 epoch: 57, train_loss: 0.7058, test_loss: 0.8852, test_f1: 0.5687
 epoch: 58, train_loss: 0.7033, test_loss: 0.8250, test_f1: 0.5818
 epoch: 59, train_loss: 0.6770, test_loss: 0.9007, test_f1: 0.5672
 epoch: 60, train_loss: 0.6875, test_loss: 0.8925, test_f1: 0.5655
 epoch: 61, train_loss: 0.6829, test_loss: 0.8740, test_f1: 0.6276
 epoch: 62, train_loss: 0.6872, test_loss: 0.7963, test_f1: 0.6345
 epoch: 63, train_loss: 0.6934, test_loss: 0.8212, test_f1: 0.5779
 epoch: 64, train_loss: 0.6901, test_loss: 0.8605, test_f1: 0.6186
 epoch: 65, train_loss: 0.7116, test_loss: 0.9152, test_f1: 0.5710
 epoch: 66, train_loss: 0.6926, test_loss: 0.9087, test_f1: 0.5737
 epoch: 67, train_loss: 0.7035, test_loss: 0.8497, test_f1: 0.6079
 epoch: 68, train_loss: 0.6959, test_loss: 0.8739, test_f1: 0.5731
 epoch: 69, train_loss: 0.6782, test_loss: 0.8680, test_f1: 0.5970
 epoch: 70, train_loss: 0.6871, test_loss: 0.9487, test_f1: 0.5230
 epoch: 71, train_loss: 0.6858, test_loss: 0.8799, test_f1: 0.5872
 epoch: 72, train_loss: 0.6693, test_loss: 0.9676, test_f1: 0.5718
 epoch: 73, train_loss: 0.6686, test_loss: 0.8824, test_f1: 0.6044
 epoch: 74, train_loss: 0.6571, test_loss: 0.8761, test_f1: 0.6038
 epoch: 75, train_loss: 0.6721, test_loss: 0.8515, test_f1: 0.6133
 epoch: 76, train_loss: 0.6668, test_loss: 0.8870, test_f1: 0.5535
 epoch: 77, train_loss: 0.6833, test_loss: 0.9040, test_f1: 0.5945
 epoch: 78, train_loss: 0.6692, test_loss: 0.8714, test_f1: 0.5586
 epoch: 79, train_loss: 0.6589, test_loss: 0.8534, test_f1: 0.5749
 epoch: 80, train_loss: 0.6565, test_loss: 0.8780, test_f1: 0.5798
 epoch: 81, train_loss: 0.6597, test_loss: 0.8888, test_f1: 0.6397
 epoch: 82, train_loss: 0.6697, test_loss: 0.8760, test_f1: 0.5308
 epoch: 83, train_loss: 0.6711, test_loss: 0.8876, test_f1: 0.6423
 epoch: 84, train_loss: 0.6801, test_loss: 0.8166, test_f1: 0.5884
 epoch: 85, train_loss: 0.6605, test_loss: 0.8785, test_f1: 0.5632
 epoch: 86, train_loss: 0.6567, test_loss: 0.8414, test_f1: 0.6231
 epoch: 87, train_loss: 0.6605, test_loss: 0.9612, test_f1: 0.5303
 epoch: 88, train_loss: 0.6663, test_loss: 0.8875, test_f1: 0.6260
 epoch: 89, train_loss: 0.6643, test_loss: 0.9457, test_f1: 0.5619
 epoch: 90, train_loss: 0.6604, test_loss: 0.8808, test_f1: 0.5649
 epoch: 91, train_loss: 0.6574, test_loss: 0.8549, test_f1: 0.5571
 epoch: 92, train_loss: 0.6414, test_loss: 0.8296, test_f1: 0.5753
 epoch: 93, train_loss: 0.6451, test_loss: 0.8635, test_f1: 0.5898
 epoch: 94, train_loss: 0.6400, test_loss: 0.8352, test_f1: 0.6324
 epoch: 95, train_loss: 0.6444, test_loss: 0.9306, test_f1: 0.5993
 epoch: 96, train_loss: 0.6557, test_loss: 0.8747, test_f1: 0.5803
 epoch: 97, train_loss: 0.6277, test_loss: 0.9384, test_f1: 0.5904
 epoch: 98, train_loss: 0.6481, test_loss: 0.8237, test_f1: 0.6191
 epoch: 99, train_loss: 0.6311, test_loss: 0.8169, test_f1: 0.6373
##################ITERATION #9 ****************************************
 epoch: 0, train_loss: 1.2095, test_loss: 1.1460, test_f1: 0.3481
 epoch: 1, train_loss: 1.0396, test_loss: 1.0144, test_f1: 0.4680
 epoch: 2, train_loss: 1.0154, test_loss: 1.0067, test_f1: 0.4928
 epoch: 3, train_loss: 0.9946, test_loss: 0.9951, test_f1: 0.4789
 epoch: 4, train_loss: 0.9752, test_loss: 0.9809, test_f1: 0.4794
 epoch: 5, train_loss: 0.9843, test_loss: 0.9797, test_f1: 0.4450
 epoch: 6, train_loss: 0.9510, test_loss: 0.9331, test_f1: 0.5016
 epoch: 7, train_loss: 0.9496, test_loss: 0.9168, test_f1: 0.4835
 epoch: 8, train_loss: 0.9276, test_loss: 0.9337, test_f1: 0.4979
 epoch: 9, train_loss: 0.9063, test_loss: 0.8684, test_f1: 0.4987
 epoch: 10, train_loss: 0.9096, test_loss: 0.9102, test_f1: 0.5088
 epoch: 11, train_loss: 0.8952, test_loss: 0.9420, test_f1: 0.5441
 epoch: 12, train_loss: 0.8837, test_loss: 0.9901, test_f1: 0.5436
 epoch: 13, train_loss: 0.8952, test_loss: 0.8605, test_f1: 0.5428
 epoch: 14, train_loss: 0.8895, test_loss: 0.8795, test_f1: 0.5433
 epoch: 15, train_loss: 0.8637, test_loss: 0.9083, test_f1: 0.5397
 epoch: 16, train_loss: 0.8781, test_loss: 0.9590, test_f1: 0.5442
 epoch: 17, train_loss: 0.8560, test_loss: 0.7967, test_f1: 0.5485
 epoch: 18, train_loss: 0.8636, test_loss: 0.8736, test_f1: 0.5452
 epoch: 19, train_loss: 0.8486, test_loss: 0.8196, test_f1: 0.6010
 epoch: 20, train_loss: 0.8308, test_loss: 0.8233, test_f1: 0.5494
 epoch: 21, train_loss: 0.8307, test_loss: 0.8654, test_f1: 0.5596
 epoch: 22, train_loss: 0.8379, test_loss: 0.8126, test_f1: 0.5544
 epoch: 23, train_loss: 0.8306, test_loss: 0.8046, test_f1: 0.5603
 epoch: 24, train_loss: 0.8366, test_loss: 0.7882, test_f1: 0.5941
 epoch: 25, train_loss: 0.8293, test_loss: 0.7843, test_f1: 0.5403
 epoch: 26, train_loss: 0.8364, test_loss: 0.8368, test_f1: 0.5516
 epoch: 27, train_loss: 0.8101, test_loss: 0.8508, test_f1: 0.5569
 epoch: 28, train_loss: 0.8227, test_loss: 0.8646, test_f1: 0.5498
 epoch: 29, train_loss: 0.7949, test_loss: 0.8427, test_f1: 0.6093
 epoch: 30, train_loss: 0.8090, test_loss: 0.8123, test_f1: 0.5685
 epoch: 31, train_loss: 0.7937, test_loss: 0.8560, test_f1: 0.5612
 epoch: 32, train_loss: 0.7939, test_loss: 0.8811, test_f1: 0.5502
 epoch: 33, train_loss: 0.7987, test_loss: 0.8456, test_f1: 0.5815
 epoch: 34, train_loss: 0.7779, test_loss: 0.8458, test_f1: 0.5606
 epoch: 35, train_loss: 0.8094, test_loss: 0.9312, test_f1: 0.5161
 epoch: 36, train_loss: 0.7943, test_loss: 0.8469, test_f1: 0.5482
 epoch: 37, train_loss: 0.7904, test_loss: 0.8306, test_f1: 0.5666
 epoch: 38, train_loss: 0.7850, test_loss: 0.8413, test_f1: 0.5613
 epoch: 39, train_loss: 0.7800, test_loss: 0.8294, test_f1: 0.5582
 epoch: 40, train_loss: 0.7756, test_loss: 0.8410, test_f1: 0.5732
 epoch: 41, train_loss: 0.7756, test_loss: 0.8268, test_f1: 0.5654
 epoch: 42, train_loss: 0.7691, test_loss: 0.9380, test_f1: 0.5386
 epoch: 43, train_loss: 0.7677, test_loss: 0.8563, test_f1: 0.5323
 epoch: 44, train_loss: 0.7565, test_loss: 0.8533, test_f1: 0.5529
 epoch: 45, train_loss: 0.7794, test_loss: 0.8094, test_f1: 0.5656
 epoch: 46, train_loss: 0.7597, test_loss: 0.8267, test_f1: 0.5333
 epoch: 47, train_loss: 0.7485, test_loss: 0.8142, test_f1: 0.5857
 epoch: 48, train_loss: 0.7531, test_loss: 0.8654, test_f1: 0.5519
 epoch: 49, train_loss: 0.7486, test_loss: 0.8567, test_f1: 0.5781
 epoch: 50, train_loss: 0.7580, test_loss: 0.7571, test_f1: 0.5746
 epoch: 51, train_loss: 0.7257, test_loss: 0.8421, test_f1: 0.5632
 epoch: 52, train_loss: 0.7127, test_loss: 0.7981, test_f1: 0.5686
 epoch: 53, train_loss: 0.7100, test_loss: 0.8283, test_f1: 0.5776
 epoch: 54, train_loss: 0.6989, test_loss: 0.8293, test_f1: 0.5765
 epoch: 55, train_loss: 0.6905, test_loss: 0.8337, test_f1: 0.5922
 epoch: 56, train_loss: 0.7075, test_loss: 0.8636, test_f1: 0.5712
 epoch: 57, train_loss: 0.6932, test_loss: 0.8952, test_f1: 0.5731
 epoch: 58, train_loss: 0.7322, test_loss: 0.8315, test_f1: 0.5666
 epoch: 59, train_loss: 0.7132, test_loss: 0.8264, test_f1: 0.5937
 epoch: 60, train_loss: 0.7118, test_loss: 0.8343, test_f1: 0.5737
 epoch: 61, train_loss: 0.7038, test_loss: 0.8414, test_f1: 0.5747
 epoch: 62, train_loss: 0.6819, test_loss: 0.7862, test_f1: 0.5930
 epoch: 63, train_loss: 0.6879, test_loss: 0.8221, test_f1: 0.5802
 epoch: 64, train_loss: 0.6989, test_loss: 0.8084, test_f1: 0.6140
 epoch: 65, train_loss: 0.6919, test_loss: 0.7377, test_f1: 0.5913
 epoch: 66, train_loss: 0.6825, test_loss: 0.8949, test_f1: 0.6047
 epoch: 67, train_loss: 0.6827, test_loss: 0.8398, test_f1: 0.5684
 epoch: 68, train_loss: 0.6813, test_loss: 0.8164, test_f1: 0.5964
 epoch: 69, train_loss: 0.6819, test_loss: 0.7970, test_f1: 0.6215
 epoch: 70, train_loss: 0.6727, test_loss: 0.8713, test_f1: 0.6022
 epoch: 71, train_loss: 0.6717, test_loss: 0.8075, test_f1: 0.6144
 epoch: 72, train_loss: 0.6717, test_loss: 0.7609, test_f1: 0.5884
 epoch: 73, train_loss: 0.6666, test_loss: 0.8501, test_f1: 0.5784
 epoch: 74, train_loss: 0.6518, test_loss: 0.7760, test_f1: 0.6444
 epoch: 75, train_loss: 0.6719, test_loss: 0.7921, test_f1: 0.5961
 epoch: 76, train_loss: 0.6581, test_loss: 0.8182, test_f1: 0.5833
 epoch: 77, train_loss: 0.6795, test_loss: 0.7625, test_f1: 0.6020
 epoch: 78, train_loss: 0.6756, test_loss: 0.8259, test_f1: 0.5856
 epoch: 79, train_loss: 0.6685, test_loss: 0.7700, test_f1: 0.5924
 epoch: 80, train_loss: 0.6549, test_loss: 0.8082, test_f1: 0.5879
 epoch: 81, train_loss: 0.6489, test_loss: 0.8102, test_f1: 0.5985
 epoch: 82, train_loss: 0.6532, test_loss: 0.9190, test_f1: 0.5505
 epoch: 83, train_loss: 0.6562, test_loss: 0.7846, test_f1: 0.5798
 epoch: 84, train_loss: 0.6630, test_loss: 0.7814, test_f1: 0.5767
 epoch: 85, train_loss: 0.6663, test_loss: 0.8867, test_f1: 0.5961
 epoch: 86, train_loss: 0.6538, test_loss: 0.8113, test_f1: 0.5855
 epoch: 87, train_loss: 0.6585, test_loss: 0.8046, test_f1: 0.5791
 epoch: 88, train_loss: 0.6489, test_loss: 0.8719, test_f1: 0.5882
 epoch: 89, train_loss: 0.6545, test_loss: 0.8442, test_f1: 0.6288
 epoch: 90, train_loss: 0.6456, test_loss: 0.7944, test_f1: 0.5909
 epoch: 91, train_loss: 0.6488, test_loss: 0.8426, test_f1: 0.5764
 epoch: 92, train_loss: 0.6971, test_loss: 0.7975, test_f1: 0.6110
 epoch: 93, train_loss: 0.6657, test_loss: 0.8123, test_f1: 0.6154
 epoch: 94, train_loss: 0.6494, test_loss: 0.8645, test_f1: 0.5843
 epoch: 95, train_loss: 0.6499, test_loss: 0.8399, test_f1: 0.6361
 epoch: 96, train_loss: 0.6436, test_loss: 0.8392, test_f1: 0.6084
 epoch: 97, train_loss: 0.6361, test_loss: 0.7365, test_f1: 0.6248
 epoch: 98, train_loss: 0.6464, test_loss: 0.8724, test_f1: 0.5906
 epoch: 99, train_loss: 0.6496, test_loss: 0.8553, test_f1: 0.5814

Training completed in 1638.99 seconds
Best F1: 0.6760 at epoch 78
Mean F1 across iterations: 0.6515  0.0123
========================FINAL RESULTS================================
FEGIN weighted F1: 0.6760  0.0123
python main.py --data ltspice_examples --representation component_pin --model FEGIN --layers 6 --hiddens 32 --batch_size 32 --lr 0.01 --emb_size 512 --epochs 100 --save_appendix component_pin_L6_H32_BS32_LR0.01_E512 --no_val
-----



STDERR:
  File "main.py", line 370, in <module>
    main()
  File "main.py", line 254, in main
    dataset = dataset_class(
  File "/home/philip/projects/llm_inference_code_repo/Circuit-Completion-Using-GNNs/component_classification_with_link_prediction_head/evaluation/FEGIN/kernel/circuit_datasets.py", line 15, in __init__
    self.data, self.slices = torch.load(self.processed_paths[0])
  File "/home/philip/.local/lib/python3.8/site-packages/torch/serialization.py", line 1040, in load
    warnings.warn(
  File "/usr/lib/python3.8/warnings.py", line 109, in _showwarnmsg
    sw(msg.message, msg.category, msg.filename, msg.lineno,
  File "main.py", line 47, in warn_with_traceback
    traceback.print_stack(file=log)
/home/philip/projects/llm_inference_code_repo/Circuit-Completion-Using-GNNs/component_classification_with_link_prediction_head/evaluation/FEGIN/kernel/circuit_datasets.py:15: FutureWarning: You are using `torch.load` with `weights_only=False` (the current default value), which uses the default pickle module implicitly. It is possible to construct malicious pickle data which will execute arbitrary code during unpickling (See https://github.com/pytorch/pytorch/blob/main/SECURITY.md#untrusted-models for more details). In a future release, the default value for `weights_only` will be flipped to `True`. This limits the functions that could be executed during unpickling. Arbitrary objects will no longer be allowed to be loaded via this mode unless they are explicitly allowlisted by the user via `torch.serialization.add_safe_globals`. We recommend you start setting `weights_only=True` for any use case where you don't have full control of the loaded file. Please open an issue on GitHub for any issues related to this experimental feature.
  self.data, self.slices = torch.load(self.processed_paths[0])
