STDOUT:
Results will be saved in /home/philip/projects/ltspice_examples_code_repo/Circuit-Completion-Using-GNNs/component_classification_with_link_prediction_head/evaluation/FEGIN/results/model_FEGIN_dataset_ltspice_examples
Command line input: python main.py --data ltspice_examples --representation component_pin --model FEGIN --layers 3 --hiddens 64 --batch_size 64 --lr 0.001 --emb_size 250 --epochs 100 --save_appendix component_pin_L3_H64_BS64_LR0.001_E250 --no_val
 is saved.
-----
ltspice_examples - FEGIN
Using 3 layers, 64 hidden units, h = 2
Loading component_pin representation dataset
ENTERED
Training FEGIN on component_pin representation
Train: 3560, Test: 848
##################ITERATION #0 ****************************************
 epoch: 0, train_loss: 1.2404, test_loss: 1.1806, test_f1: 0.3437
 epoch: 1, train_loss: 1.0406, test_loss: 1.0570, test_f1: 0.3658
 epoch: 2, train_loss: 1.0203, test_loss: 1.0467, test_f1: 0.4786
 epoch: 3, train_loss: 0.9815, test_loss: 1.0108, test_f1: 0.5187
 epoch: 4, train_loss: 0.9481, test_loss: 1.0280, test_f1: 0.4955
 epoch: 5, train_loss: 0.9166, test_loss: 0.9822, test_f1: 0.4972
 epoch: 6, train_loss: 0.8894, test_loss: 0.9946, test_f1: 0.4753
 epoch: 7, train_loss: 0.8566, test_loss: 0.9609, test_f1: 0.5261
 epoch: 8, train_loss: 0.8462, test_loss: 0.9125, test_f1: 0.5495
 epoch: 9, train_loss: 0.8216, test_loss: 1.0778, test_f1: 0.4657
 epoch: 10, train_loss: 0.8017, test_loss: 0.8879, test_f1: 0.5557
 epoch: 11, train_loss: 0.7838, test_loss: 0.9959, test_f1: 0.5196
 epoch: 12, train_loss: 0.7732, test_loss: 0.8810, test_f1: 0.5779
 epoch: 13, train_loss: 0.7672, test_loss: 0.9002, test_f1: 0.5527
 epoch: 14, train_loss: 0.7487, test_loss: 0.9038, test_f1: 0.5778
 epoch: 15, train_loss: 0.7396, test_loss: 0.9118, test_f1: 0.5700
 epoch: 16, train_loss: 0.7267, test_loss: 0.8932, test_f1: 0.5745
 epoch: 17, train_loss: 0.6973, test_loss: 0.9487, test_f1: 0.5538
 epoch: 18, train_loss: 0.7129, test_loss: 0.9159, test_f1: 0.5795
 epoch: 19, train_loss: 0.6938, test_loss: 0.8350, test_f1: 0.5659
 epoch: 20, train_loss: 0.6762, test_loss: 1.0257, test_f1: 0.5836
 epoch: 21, train_loss: 0.6709, test_loss: 0.9385, test_f1: 0.5999
 epoch: 22, train_loss: 0.6513, test_loss: 0.9155, test_f1: 0.5879
 epoch: 23, train_loss: 0.6484, test_loss: 0.8328, test_f1: 0.6077
 epoch: 24, train_loss: 0.6369, test_loss: 0.9289, test_f1: 0.5861
 epoch: 25, train_loss: 0.6299, test_loss: 0.9514, test_f1: 0.5872
 epoch: 26, train_loss: 0.6444, test_loss: 0.8522, test_f1: 0.5943
 epoch: 27, train_loss: 0.6380, test_loss: 0.8600, test_f1: 0.6131
 epoch: 28, train_loss: 0.6092, test_loss: 0.8781, test_f1: 0.5901
 epoch: 29, train_loss: 0.5956, test_loss: 1.0136, test_f1: 0.6135
 epoch: 30, train_loss: 0.5940, test_loss: 0.9977, test_f1: 0.5660
 epoch: 31, train_loss: 0.5882, test_loss: 0.9784, test_f1: 0.5931
 epoch: 32, train_loss: 0.5981, test_loss: 0.9089, test_f1: 0.6317
 epoch: 33, train_loss: 0.5710, test_loss: 0.9389, test_f1: 0.6120
 epoch: 34, train_loss: 0.5878, test_loss: 0.9862, test_f1: 0.5829
 epoch: 35, train_loss: 0.5596, test_loss: 1.0896, test_f1: 0.6128
 epoch: 36, train_loss: 0.5586, test_loss: 1.0356, test_f1: 0.6396
 epoch: 37, train_loss: 0.5560, test_loss: 0.9987, test_f1: 0.6415
 epoch: 38, train_loss: 0.5411, test_loss: 1.0523, test_f1: 0.6237
 epoch: 39, train_loss: 0.5320, test_loss: 0.9573, test_f1: 0.6125
 epoch: 40, train_loss: 0.5331, test_loss: 1.0036, test_f1: 0.6080
 epoch: 41, train_loss: 0.5265, test_loss: 0.9695, test_f1: 0.6382
 epoch: 42, train_loss: 0.5110, test_loss: 1.0520, test_f1: 0.6131
 epoch: 43, train_loss: 0.5146, test_loss: 0.9650, test_f1: 0.6365
 epoch: 44, train_loss: 0.4973, test_loss: 1.0857, test_f1: 0.6278
 epoch: 45, train_loss: 0.4818, test_loss: 1.1414, test_f1: 0.6203
 epoch: 46, train_loss: 0.4792, test_loss: 1.1051, test_f1: 0.6398
 epoch: 47, train_loss: 0.4677, test_loss: 1.1598, test_f1: 0.6281
 epoch: 48, train_loss: 0.4721, test_loss: 1.1962, test_f1: 0.6228
 epoch: 49, train_loss: 0.4672, test_loss: 1.1026, test_f1: 0.6358
 epoch: 50, train_loss: 0.4747, test_loss: 1.3497, test_f1: 0.5943
 epoch: 51, train_loss: 0.4266, test_loss: 1.0900, test_f1: 0.6190
 epoch: 52, train_loss: 0.4085, test_loss: 1.2580, test_f1: 0.6267
 epoch: 53, train_loss: 0.3854, test_loss: 1.2593, test_f1: 0.6232
 epoch: 54, train_loss: 0.4006, test_loss: 1.1889, test_f1: 0.6281
 epoch: 55, train_loss: 0.3911, test_loss: 1.1892, test_f1: 0.6403
 epoch: 56, train_loss: 0.3968, test_loss: 1.2869, test_f1: 0.6414
 epoch: 57, train_loss: 0.3799, test_loss: 1.3009, test_f1: 0.6350
 epoch: 58, train_loss: 0.3746, test_loss: 1.3337, test_f1: 0.6277
 epoch: 59, train_loss: 0.3672, test_loss: 1.2681, test_f1: 0.6251
 epoch: 60, train_loss: 0.3934, test_loss: 1.4314, test_f1: 0.6320
 epoch: 61, train_loss: 0.3847, test_loss: 1.3923, test_f1: 0.6272
 epoch: 62, train_loss: 0.3590, test_loss: 1.3341, test_f1: 0.6216
 epoch: 63, train_loss: 0.3548, test_loss: 1.4442, test_f1: 0.6288
 epoch: 64, train_loss: 0.3375, test_loss: 1.3766, test_f1: 0.6300
 epoch: 65, train_loss: 0.3548, test_loss: 1.3320, test_f1: 0.6421
 epoch: 66, train_loss: 0.3627, test_loss: 1.3906, test_f1: 0.6402
 epoch: 67, train_loss: 0.3590, test_loss: 1.4214, test_f1: 0.6091
 epoch: 68, train_loss: 0.3436, test_loss: 1.5072, test_f1: 0.6214
 epoch: 69, train_loss: 0.3516, test_loss: 1.5295, test_f1: 0.6302
 epoch: 70, train_loss: 0.3403, test_loss: 1.3883, test_f1: 0.6365
 epoch: 71, train_loss: 0.3318, test_loss: 1.2384, test_f1: 0.6489
 epoch: 72, train_loss: 0.3347, test_loss: 1.3109, test_f1: 0.6437
 epoch: 73, train_loss: 0.3411, test_loss: 1.3933, test_f1: 0.6600
 epoch: 74, train_loss: 0.3289, test_loss: 1.4210, test_f1: 0.6308
 epoch: 75, train_loss: 0.3369, test_loss: 1.4240, test_f1: 0.6272
 epoch: 76, train_loss: 0.3232, test_loss: 1.4100, test_f1: 0.6363
 epoch: 77, train_loss: 0.3115, test_loss: 1.4149, test_f1: 0.6385
 epoch: 78, train_loss: 0.3204, test_loss: 1.4842, test_f1: 0.6304
 epoch: 79, train_loss: 0.2981, test_loss: 1.5190, test_f1: 0.6079
 epoch: 80, train_loss: 0.3061, test_loss: 1.4013, test_f1: 0.6360
 epoch: 81, train_loss: 0.3039, test_loss: 1.4205, test_f1: 0.6171
 epoch: 82, train_loss: 0.2893, test_loss: 1.5509, test_f1: 0.6410
 epoch: 83, train_loss: 0.2943, test_loss: 1.5154, test_f1: 0.6400
 epoch: 84, train_loss: 0.3110, test_loss: 1.4872, test_f1: 0.6583
 epoch: 85, train_loss: 0.2991, test_loss: 1.5118, test_f1: 0.6275
 epoch: 86, train_loss: 0.3116, test_loss: 1.6583, test_f1: 0.6279
 epoch: 87, train_loss: 0.3026, test_loss: 1.3980, test_f1: 0.6414
 epoch: 88, train_loss: 0.2824, test_loss: 1.5308, test_f1: 0.6395
 epoch: 89, train_loss: 0.2674, test_loss: 1.6385, test_f1: 0.6511
 epoch: 90, train_loss: 0.2761, test_loss: 1.5263, test_f1: 0.6410
 epoch: 91, train_loss: 0.2708, test_loss: 1.5813, test_f1: 0.6549
 epoch: 92, train_loss: 0.2712, test_loss: 1.6885, test_f1: 0.6278
 epoch: 93, train_loss: 0.2745, test_loss: 1.4830, test_f1: 0.6253
 epoch: 94, train_loss: 0.2738, test_loss: 1.6016, test_f1: 0.6366
 epoch: 95, train_loss: 0.2842, test_loss: 1.6831, test_f1: 0.6306
 epoch: 96, train_loss: 0.2604, test_loss: 1.7498, test_f1: 0.6398
 epoch: 97, train_loss: 0.2700, test_loss: 1.7312, test_f1: 0.6406
 epoch: 98, train_loss: 0.2779, test_loss: 1.7093, test_f1: 0.6275
 epoch: 99, train_loss: 0.2525, test_loss: 1.5494, test_f1: 0.6395
##################ITERATION #1 ****************************************
 epoch: 0, train_loss: 1.1503, test_loss: 1.0405, test_f1: 0.4515
 epoch: 1, train_loss: 0.9822, test_loss: 1.0007, test_f1: 0.4980
 epoch: 2, train_loss: 0.9417, test_loss: 0.9470, test_f1: 0.5195
 epoch: 3, train_loss: 0.9061, test_loss: 0.8924, test_f1: 0.5102
 epoch: 4, train_loss: 0.8761, test_loss: 0.9512, test_f1: 0.5015
 epoch: 5, train_loss: 0.8668, test_loss: 0.9380, test_f1: 0.5262
 epoch: 6, train_loss: 0.8397, test_loss: 0.9206, test_f1: 0.5017
 epoch: 7, train_loss: 0.8315, test_loss: 0.9660, test_f1: 0.5456
 epoch: 8, train_loss: 0.8063, test_loss: 0.8586, test_f1: 0.5579
 epoch: 9, train_loss: 0.7855, test_loss: 0.8922, test_f1: 0.5406
 epoch: 10, train_loss: 0.7613, test_loss: 0.8615, test_f1: 0.5720
 epoch: 11, train_loss: 0.7454, test_loss: 0.9063, test_f1: 0.6034
 epoch: 12, train_loss: 0.7377, test_loss: 0.8899, test_f1: 0.5846
 epoch: 13, train_loss: 0.7376, test_loss: 0.8628, test_f1: 0.6085
 epoch: 14, train_loss: 0.7159, test_loss: 0.9554, test_f1: 0.5951
 epoch: 15, train_loss: 0.7065, test_loss: 0.9209, test_f1: 0.5752
 epoch: 16, train_loss: 0.6949, test_loss: 0.7907, test_f1: 0.5788
 epoch: 17, train_loss: 0.6715, test_loss: 0.8089, test_f1: 0.6159
 epoch: 18, train_loss: 0.6682, test_loss: 0.8517, test_f1: 0.5810
 epoch: 19, train_loss: 0.6703, test_loss: 0.8375, test_f1: 0.6039
 epoch: 20, train_loss: 0.6450, test_loss: 0.8492, test_f1: 0.5848
 epoch: 21, train_loss: 0.6382, test_loss: 0.8196, test_f1: 0.6014
 epoch: 22, train_loss: 0.6160, test_loss: 0.8501, test_f1: 0.6385
 epoch: 23, train_loss: 0.6052, test_loss: 0.8822, test_f1: 0.6005
 epoch: 24, train_loss: 0.5939, test_loss: 0.8859, test_f1: 0.6098
 epoch: 25, train_loss: 0.6188, test_loss: 0.8047, test_f1: 0.6078
 epoch: 26, train_loss: 0.5886, test_loss: 0.9898, test_f1: 0.6040
 epoch: 27, train_loss: 0.5951, test_loss: 0.8481, test_f1: 0.6328
 epoch: 28, train_loss: 0.5885, test_loss: 0.8967, test_f1: 0.6456
 epoch: 29, train_loss: 0.5918, test_loss: 0.8354, test_f1: 0.6558
 epoch: 30, train_loss: 0.5642, test_loss: 1.0184, test_f1: 0.5968
 epoch: 31, train_loss: 0.5547, test_loss: 0.9957, test_f1: 0.6030
 epoch: 32, train_loss: 0.5516, test_loss: 0.9125, test_f1: 0.6504
 epoch: 33, train_loss: 0.5474, test_loss: 0.9308, test_f1: 0.6210
 epoch: 34, train_loss: 0.5579, test_loss: 0.8027, test_f1: 0.6490
 epoch: 35, train_loss: 0.5313, test_loss: 0.8952, test_f1: 0.6379
 epoch: 36, train_loss: 0.5269, test_loss: 0.9886, test_f1: 0.6158
 epoch: 37, train_loss: 0.5162, test_loss: 0.9439, test_f1: 0.6474
 epoch: 38, train_loss: 0.5210, test_loss: 0.8213, test_f1: 0.6636
 epoch: 39, train_loss: 0.5009, test_loss: 1.2055, test_f1: 0.6038
 epoch: 40, train_loss: 0.4916, test_loss: 0.9662, test_f1: 0.6215
 epoch: 41, train_loss: 0.5013, test_loss: 1.0740, test_f1: 0.6445
 epoch: 42, train_loss: 0.4978, test_loss: 1.0461, test_f1: 0.6370
 epoch: 43, train_loss: 0.4859, test_loss: 0.9744, test_f1: 0.6619
 epoch: 44, train_loss: 0.4635, test_loss: 1.0696, test_f1: 0.6321
 epoch: 45, train_loss: 0.4669, test_loss: 0.9977, test_f1: 0.6423
 epoch: 46, train_loss: 0.4648, test_loss: 1.0116, test_f1: 0.6448
 epoch: 47, train_loss: 0.4609, test_loss: 1.0959, test_f1: 0.6465
 epoch: 48, train_loss: 0.4586, test_loss: 1.1306, test_f1: 0.6160
 epoch: 49, train_loss: 0.4433, test_loss: 1.1544, test_f1: 0.6468
 epoch: 50, train_loss: 0.4535, test_loss: 1.0664, test_f1: 0.6434
 epoch: 51, train_loss: 0.4064, test_loss: 1.0874, test_f1: 0.6375
 epoch: 52, train_loss: 0.3700, test_loss: 1.2308, test_f1: 0.6391
 epoch: 53, train_loss: 0.3863, test_loss: 1.1653, test_f1: 0.6441
 epoch: 54, train_loss: 0.3734, test_loss: 1.2027, test_f1: 0.6406
 epoch: 55, train_loss: 0.3590, test_loss: 1.1269, test_f1: 0.6724
 epoch: 56, train_loss: 0.3738, test_loss: 1.1332, test_f1: 0.6566
 epoch: 57, train_loss: 0.3643, test_loss: 1.1807, test_f1: 0.6509
 epoch: 58, train_loss: 0.3592, test_loss: 1.1963, test_f1: 0.6838
 epoch: 59, train_loss: 0.3584, test_loss: 1.2197, test_f1: 0.6551
 epoch: 60, train_loss: 0.3333, test_loss: 1.2720, test_f1: 0.6758
 epoch: 61, train_loss: 0.3471, test_loss: 1.3366, test_f1: 0.6587
 epoch: 62, train_loss: 0.3291, test_loss: 1.4237, test_f1: 0.6276
 epoch: 63, train_loss: 0.3483, test_loss: 1.2954, test_f1: 0.6511
 epoch: 64, train_loss: 0.3500, test_loss: 1.4115, test_f1: 0.6394
 epoch: 65, train_loss: 0.3256, test_loss: 1.3521, test_f1: 0.6753
 epoch: 66, train_loss: 0.3204, test_loss: 1.3283, test_f1: 0.6716
 epoch: 67, train_loss: 0.3174, test_loss: 1.2336, test_f1: 0.6502
 epoch: 68, train_loss: 0.3201, test_loss: 1.4140, test_f1: 0.6492
 epoch: 69, train_loss: 0.3152, test_loss: 1.4016, test_f1: 0.6523
 epoch: 70, train_loss: 0.3155, test_loss: 1.4566, test_f1: 0.6380
 epoch: 71, train_loss: 0.3072, test_loss: 1.5057, test_f1: 0.6575
 epoch: 72, train_loss: 0.3146, test_loss: 1.5007, test_f1: 0.6820
 epoch: 73, train_loss: 0.3047, test_loss: 1.4585, test_f1: 0.6653
 epoch: 74, train_loss: 0.3141, test_loss: 1.4029, test_f1: 0.6441
 epoch: 75, train_loss: 0.3268, test_loss: 1.4834, test_f1: 0.6563
 epoch: 76, train_loss: 0.3064, test_loss: 1.4360, test_f1: 0.6635
 epoch: 77, train_loss: 0.2999, test_loss: 1.4796, test_f1: 0.6589
 epoch: 78, train_loss: 0.2939, test_loss: 1.4588, test_f1: 0.6696
 epoch: 79, train_loss: 0.2957, test_loss: 1.6052, test_f1: 0.6508
 epoch: 80, train_loss: 0.2897, test_loss: 1.6284, test_f1: 0.6460
 epoch: 81, train_loss: 0.2880, test_loss: 1.4724, test_f1: 0.6569
 epoch: 82, train_loss: 0.2741, test_loss: 1.4542, test_f1: 0.6625
 epoch: 83, train_loss: 0.2926, test_loss: 1.5946, test_f1: 0.6470
 epoch: 84, train_loss: 0.2690, test_loss: 1.6161, test_f1: 0.6266
 epoch: 85, train_loss: 0.2952, test_loss: 1.7234, test_f1: 0.6408
 epoch: 86, train_loss: 0.2713, test_loss: 1.5345, test_f1: 0.6616
 epoch: 87, train_loss: 0.2655, test_loss: 1.5856, test_f1: 0.6657
 epoch: 88, train_loss: 0.2570, test_loss: 1.5664, test_f1: 0.6522
 epoch: 89, train_loss: 0.2548, test_loss: 1.7175, test_f1: 0.6515
 epoch: 90, train_loss: 0.2664, test_loss: 1.6753, test_f1: 0.6643
 epoch: 91, train_loss: 0.2685, test_loss: 1.5748, test_f1: 0.6673
 epoch: 92, train_loss: 0.2738, test_loss: 1.7129, test_f1: 0.6553
 epoch: 93, train_loss: 0.2518, test_loss: 1.7406, test_f1: 0.6502
 epoch: 94, train_loss: 0.2534, test_loss: 1.6699, test_f1: 0.6690
 epoch: 95, train_loss: 0.2630, test_loss: 1.6717, test_f1: 0.6688
 epoch: 96, train_loss: 0.2684, test_loss: 1.6580, test_f1: 0.6397
 epoch: 97, train_loss: 0.2542, test_loss: 1.7828, test_f1: 0.6563
 epoch: 98, train_loss: 0.2486, test_loss: 1.7361, test_f1: 0.6441
 epoch: 99, train_loss: 0.2548, test_loss: 1.7144, test_f1: 0.6607
##################ITERATION #2 ****************************************
 epoch: 0, train_loss: 1.1228, test_loss: 1.3754, test_f1: 0.2989
 epoch: 1, train_loss: 0.9865, test_loss: 0.9424, test_f1: 0.4678
 epoch: 2, train_loss: 0.9370, test_loss: 0.9839, test_f1: 0.4634
 epoch: 3, train_loss: 0.9053, test_loss: 0.9065, test_f1: 0.5460
 epoch: 4, train_loss: 0.8900, test_loss: 0.9176, test_f1: 0.5960
 epoch: 5, train_loss: 0.8584, test_loss: 0.9768, test_f1: 0.5163
 epoch: 6, train_loss: 0.8326, test_loss: 0.9141, test_f1: 0.5437
 epoch: 7, train_loss: 0.8227, test_loss: 0.8657, test_f1: 0.5622
 epoch: 8, train_loss: 0.8016, test_loss: 0.8838, test_f1: 0.5521
 epoch: 9, train_loss: 0.7896, test_loss: 0.8453, test_f1: 0.5943
 epoch: 10, train_loss: 0.7737, test_loss: 0.8207, test_f1: 0.6094
 epoch: 11, train_loss: 0.7516, test_loss: 0.8134, test_f1: 0.6230
 epoch: 12, train_loss: 0.7363, test_loss: 0.7670, test_f1: 0.5980
 epoch: 13, train_loss: 0.7307, test_loss: 0.9058, test_f1: 0.5431
 epoch: 14, train_loss: 0.7254, test_loss: 0.8264, test_f1: 0.6113
 epoch: 15, train_loss: 0.7168, test_loss: 0.8645, test_f1: 0.5880
 epoch: 16, train_loss: 0.7042, test_loss: 0.8685, test_f1: 0.5676
 epoch: 17, train_loss: 0.6836, test_loss: 0.9036, test_f1: 0.5844
 epoch: 18, train_loss: 0.6627, test_loss: 0.7847, test_f1: 0.6331
 epoch: 19, train_loss: 0.6660, test_loss: 0.8666, test_f1: 0.6062
 epoch: 20, train_loss: 0.6676, test_loss: 0.7995, test_f1: 0.6553
 epoch: 21, train_loss: 0.6460, test_loss: 0.8076, test_f1: 0.6120
 epoch: 22, train_loss: 0.6383, test_loss: 0.7223, test_f1: 0.6488
 epoch: 23, train_loss: 0.6481, test_loss: 0.8094, test_f1: 0.6400
 epoch: 24, train_loss: 0.6369, test_loss: 0.9039, test_f1: 0.6004
 epoch: 25, train_loss: 0.6132, test_loss: 0.8811, test_f1: 0.6003
 epoch: 26, train_loss: 0.5908, test_loss: 0.8854, test_f1: 0.6194
 epoch: 27, train_loss: 0.6006, test_loss: 0.8755, test_f1: 0.6047
 epoch: 28, train_loss: 0.5838, test_loss: 0.8534, test_f1: 0.6411
 epoch: 29, train_loss: 0.5872, test_loss: 0.8494, test_f1: 0.6243
 epoch: 30, train_loss: 0.5730, test_loss: 0.8201, test_f1: 0.6557
 epoch: 31, train_loss: 0.5904, test_loss: 0.8206, test_f1: 0.6332
 epoch: 32, train_loss: 0.5791, test_loss: 0.8387, test_f1: 0.6412
 epoch: 33, train_loss: 0.5432, test_loss: 0.9658, test_f1: 0.6121
 epoch: 34, train_loss: 0.5532, test_loss: 0.8103, test_f1: 0.6437
 epoch: 35, train_loss: 0.5522, test_loss: 0.8604, test_f1: 0.6230
 epoch: 36, train_loss: 0.5368, test_loss: 0.9359, test_f1: 0.5998
 epoch: 37, train_loss: 0.5359, test_loss: 0.8370, test_f1: 0.6183
 epoch: 38, train_loss: 0.5296, test_loss: 1.0165, test_f1: 0.6326
 epoch: 39, train_loss: 0.5093, test_loss: 0.9068, test_f1: 0.6410
 epoch: 40, train_loss: 0.5153, test_loss: 0.8715, test_f1: 0.6476
 epoch: 41, train_loss: 0.5109, test_loss: 0.8816, test_f1: 0.6273
 epoch: 42, train_loss: 0.5157, test_loss: 0.9303, test_f1: 0.6137
 epoch: 43, train_loss: 0.5034, test_loss: 1.0661, test_f1: 0.5910
 epoch: 44, train_loss: 0.5302, test_loss: 0.8972, test_f1: 0.6693
 epoch: 45, train_loss: 0.4851, test_loss: 0.8410, test_f1: 0.6701
 epoch: 46, train_loss: 0.4641, test_loss: 0.8810, test_f1: 0.6414
 epoch: 47, train_loss: 0.4797, test_loss: 0.8230, test_f1: 0.6431
 epoch: 48, train_loss: 0.4618, test_loss: 0.8333, test_f1: 0.6514
 epoch: 49, train_loss: 0.4713, test_loss: 0.8490, test_f1: 0.6463
 epoch: 50, train_loss: 0.4532, test_loss: 1.0420, test_f1: 0.6264
 epoch: 51, train_loss: 0.4289, test_loss: 0.8945, test_f1: 0.6368
 epoch: 52, train_loss: 0.4008, test_loss: 0.8925, test_f1: 0.6334
 epoch: 53, train_loss: 0.3982, test_loss: 0.8686, test_f1: 0.6718
 epoch: 54, train_loss: 0.3925, test_loss: 0.9715, test_f1: 0.6419
 epoch: 55, train_loss: 0.3927, test_loss: 0.9287, test_f1: 0.6584
 epoch: 56, train_loss: 0.3952, test_loss: 0.8979, test_f1: 0.6611
 epoch: 57, train_loss: 0.3899, test_loss: 0.9016, test_f1: 0.6705
 epoch: 58, train_loss: 0.3738, test_loss: 1.0262, test_f1: 0.6498
 epoch: 59, train_loss: 0.3742, test_loss: 0.8581, test_f1: 0.6890
 epoch: 60, train_loss: 0.3731, test_loss: 0.8718, test_f1: 0.6759
 epoch: 61, train_loss: 0.3629, test_loss: 0.9359, test_f1: 0.6706
 epoch: 62, train_loss: 0.3686, test_loss: 0.8778, test_f1: 0.6788
 epoch: 63, train_loss: 0.3453, test_loss: 0.9249, test_f1: 0.6760
 epoch: 64, train_loss: 0.3668, test_loss: 1.0339, test_f1: 0.6520
 epoch: 65, train_loss: 0.3593, test_loss: 1.0322, test_f1: 0.6794
 epoch: 66, train_loss: 0.3385, test_loss: 1.0475, test_f1: 0.6471
 epoch: 67, train_loss: 0.3588, test_loss: 1.0462, test_f1: 0.6544
 epoch: 68, train_loss: 0.3525, test_loss: 1.0185, test_f1: 0.6563
 epoch: 69, train_loss: 0.3442, test_loss: 1.0906, test_f1: 0.6517
 epoch: 70, train_loss: 0.3458, test_loss: 1.0759, test_f1: 0.6644
 epoch: 71, train_loss: 0.3272, test_loss: 1.0433, test_f1: 0.6641
 epoch: 72, train_loss: 0.3349, test_loss: 1.0425, test_f1: 0.6527
 epoch: 73, train_loss: 0.3366, test_loss: 1.0131, test_f1: 0.6640
 epoch: 74, train_loss: 0.3316, test_loss: 1.0880, test_f1: 0.6563
 epoch: 75, train_loss: 0.3305, test_loss: 1.1415, test_f1: 0.6697
 epoch: 76, train_loss: 0.3135, test_loss: 1.1217, test_f1: 0.6560
 epoch: 77, train_loss: 0.2991, test_loss: 1.1340, test_f1: 0.6542
 epoch: 78, train_loss: 0.3197, test_loss: 1.1142, test_f1: 0.6808
 epoch: 79, train_loss: 0.3130, test_loss: 1.0678, test_f1: 0.6808
 epoch: 80, train_loss: 0.3180, test_loss: 1.2229, test_f1: 0.6694
 epoch: 81, train_loss: 0.3017, test_loss: 1.1765, test_f1: 0.6695
 epoch: 82, train_loss: 0.3033, test_loss: 1.0893, test_f1: 0.6925
 epoch: 83, train_loss: 0.3170, test_loss: 1.0652, test_f1: 0.6609
 epoch: 84, train_loss: 0.2876, test_loss: 1.2333, test_f1: 0.6476
 epoch: 85, train_loss: 0.2817, test_loss: 1.2415, test_f1: 0.6639
 epoch: 86, train_loss: 0.2853, test_loss: 1.2127, test_f1: 0.6673
 epoch: 87, train_loss: 0.2881, test_loss: 1.1607, test_f1: 0.6740
 epoch: 88, train_loss: 0.3045, test_loss: 1.2640, test_f1: 0.6689
 epoch: 89, train_loss: 0.2707, test_loss: 1.0800, test_f1: 0.6703
 epoch: 90, train_loss: 0.2971, test_loss: 1.1622, test_f1: 0.6615
 epoch: 91, train_loss: 0.2912, test_loss: 1.2863, test_f1: 0.6552
 epoch: 92, train_loss: 0.2692, test_loss: 1.2552, test_f1: 0.6656
 epoch: 93, train_loss: 0.2704, test_loss: 1.3867, test_f1: 0.6521
 epoch: 94, train_loss: 0.2850, test_loss: 1.1577, test_f1: 0.6872
 epoch: 95, train_loss: 0.2515, test_loss: 1.2953, test_f1: 0.6626
 epoch: 96, train_loss: 0.2748, test_loss: 1.2486, test_f1: 0.6749
 epoch: 97, train_loss: 0.2549, test_loss: 1.2470, test_f1: 0.6679
 epoch: 98, train_loss: 0.2534, test_loss: 1.2727, test_f1: 0.6720
 epoch: 99, train_loss: 0.2503, test_loss: 1.3177, test_f1: 0.6743
##################ITERATION #3 ****************************************
 epoch: 0, train_loss: 1.1828, test_loss: 1.0070, test_f1: 0.4690
 epoch: 1, train_loss: 0.9809, test_loss: 0.9158, test_f1: 0.5194
 epoch: 2, train_loss: 0.9323, test_loss: 0.8692, test_f1: 0.5176
 epoch: 3, train_loss: 0.9011, test_loss: 0.8762, test_f1: 0.5581
 epoch: 4, train_loss: 0.8939, test_loss: 0.9036, test_f1: 0.5788
 epoch: 5, train_loss: 0.8656, test_loss: 0.8617, test_f1: 0.5401
 epoch: 6, train_loss: 0.8431, test_loss: 0.8683, test_f1: 0.5640
 epoch: 7, train_loss: 0.8398, test_loss: 0.9000, test_f1: 0.5821
 epoch: 8, train_loss: 0.8280, test_loss: 0.8669, test_f1: 0.5440
 epoch: 9, train_loss: 0.8162, test_loss: 0.8775, test_f1: 0.5787
 epoch: 10, train_loss: 0.7881, test_loss: 0.8991, test_f1: 0.5858
 epoch: 11, train_loss: 0.7612, test_loss: 0.8684, test_f1: 0.5888
 epoch: 12, train_loss: 0.7583, test_loss: 0.8689, test_f1: 0.5900
 epoch: 13, train_loss: 0.7409, test_loss: 0.8474, test_f1: 0.5866
 epoch: 14, train_loss: 0.7357, test_loss: 0.8999, test_f1: 0.5412
 epoch: 15, train_loss: 0.7304, test_loss: 0.8419, test_f1: 0.6025
 epoch: 16, train_loss: 0.7172, test_loss: 0.7814, test_f1: 0.6136
 epoch: 17, train_loss: 0.7043, test_loss: 0.8060, test_f1: 0.6171
 epoch: 18, train_loss: 0.6828, test_loss: 0.8558, test_f1: 0.6186
 epoch: 19, train_loss: 0.6881, test_loss: 0.8159, test_f1: 0.6496
 epoch: 20, train_loss: 0.6712, test_loss: 0.8131, test_f1: 0.6584
 epoch: 21, train_loss: 0.6577, test_loss: 0.8229, test_f1: 0.6492
 epoch: 22, train_loss: 0.6611, test_loss: 0.8079, test_f1: 0.6541
 epoch: 23, train_loss: 0.6460, test_loss: 0.7563, test_f1: 0.6652
 epoch: 24, train_loss: 0.6286, test_loss: 0.7925, test_f1: 0.6505
 epoch: 25, train_loss: 0.6197, test_loss: 0.8137, test_f1: 0.6364
 epoch: 26, train_loss: 0.6132, test_loss: 0.7968, test_f1: 0.6492
 epoch: 27, train_loss: 0.6122, test_loss: 0.8632, test_f1: 0.6305
 epoch: 28, train_loss: 0.5971, test_loss: 0.8060, test_f1: 0.6587
 epoch: 29, train_loss: 0.5992, test_loss: 0.8727, test_f1: 0.5966
 epoch: 30, train_loss: 0.5880, test_loss: 0.8805, test_f1: 0.6434
 epoch: 31, train_loss: 0.5822, test_loss: 0.8169, test_f1: 0.6707
 epoch: 32, train_loss: 0.5474, test_loss: 0.8039, test_f1: 0.6654
 epoch: 33, train_loss: 0.5393, test_loss: 0.8789, test_f1: 0.6322
 epoch: 34, train_loss: 0.5537, test_loss: 0.8686, test_f1: 0.6472
 epoch: 35, train_loss: 0.5425, test_loss: 0.8486, test_f1: 0.6424
 epoch: 36, train_loss: 0.5412, test_loss: 0.8012, test_f1: 0.6636
 epoch: 37, train_loss: 0.5348, test_loss: 0.8600, test_f1: 0.6718
 epoch: 38, train_loss: 0.5236, test_loss: 0.8304, test_f1: 0.6589
 epoch: 39, train_loss: 0.5213, test_loss: 0.8300, test_f1: 0.6462
 epoch: 40, train_loss: 0.4989, test_loss: 0.8647, test_f1: 0.6398
 epoch: 41, train_loss: 0.5069, test_loss: 0.8833, test_f1: 0.6341
 epoch: 42, train_loss: 0.5080, test_loss: 0.8708, test_f1: 0.6439
 epoch: 43, train_loss: 0.4956, test_loss: 0.8580, test_f1: 0.6633
 epoch: 44, train_loss: 0.4786, test_loss: 0.8196, test_f1: 0.6567
 epoch: 45, train_loss: 0.4686, test_loss: 0.8798, test_f1: 0.6312
 epoch: 46, train_loss: 0.4813, test_loss: 0.8726, test_f1: 0.6577
 epoch: 47, train_loss: 0.4851, test_loss: 0.8559, test_f1: 0.6443
 epoch: 48, train_loss: 0.4725, test_loss: 0.9740, test_f1: 0.6063
 epoch: 49, train_loss: 0.4672, test_loss: 0.9106, test_f1: 0.6473
 epoch: 50, train_loss: 0.4679, test_loss: 0.8821, test_f1: 0.6918
 epoch: 51, train_loss: 0.4119, test_loss: 0.8959, test_f1: 0.6791
 epoch: 52, train_loss: 0.4099, test_loss: 0.9163, test_f1: 0.6590
 epoch: 53, train_loss: 0.4006, test_loss: 0.9281, test_f1: 0.6858
 epoch: 54, train_loss: 0.3741, test_loss: 0.9263, test_f1: 0.6701
 epoch: 55, train_loss: 0.3794, test_loss: 0.9385, test_f1: 0.6767
 epoch: 56, train_loss: 0.3766, test_loss: 0.9698, test_f1: 0.6668
 epoch: 57, train_loss: 0.3674, test_loss: 0.9567, test_f1: 0.6780
 epoch: 58, train_loss: 0.3742, test_loss: 1.0091, test_f1: 0.6701
 epoch: 59, train_loss: 0.3732, test_loss: 1.1216, test_f1: 0.6377
 epoch: 60, train_loss: 0.3636, test_loss: 1.0023, test_f1: 0.6576
 epoch: 61, train_loss: 0.3582, test_loss: 1.0442, test_f1: 0.6555
 epoch: 62, train_loss: 0.3439, test_loss: 1.0199, test_f1: 0.6656
 epoch: 63, train_loss: 0.3466, test_loss: 1.0381, test_f1: 0.6684
 epoch: 64, train_loss: 0.3589, test_loss: 1.0237, test_f1: 0.6729
 epoch: 65, train_loss: 0.3490, test_loss: 1.0260, test_f1: 0.6710
 epoch: 66, train_loss: 0.3349, test_loss: 1.0418, test_f1: 0.6739
 epoch: 67, train_loss: 0.3343, test_loss: 1.0524, test_f1: 0.6809
 epoch: 68, train_loss: 0.3478, test_loss: 1.2120, test_f1: 0.6642
 epoch: 69, train_loss: 0.3560, test_loss: 1.0275, test_f1: 0.6619
 epoch: 70, train_loss: 0.3310, test_loss: 1.1073, test_f1: 0.6687
 epoch: 71, train_loss: 0.3273, test_loss: 0.9935, test_f1: 0.6865
 epoch: 72, train_loss: 0.3307, test_loss: 1.0781, test_f1: 0.6709
 epoch: 73, train_loss: 0.3241, test_loss: 1.0642, test_f1: 0.6737
 epoch: 74, train_loss: 0.3150, test_loss: 1.0298, test_f1: 0.6531
 epoch: 75, train_loss: 0.3172, test_loss: 1.1312, test_f1: 0.6724
 epoch: 76, train_loss: 0.3342, test_loss: 1.0902, test_f1: 0.6570
 epoch: 77, train_loss: 0.3114, test_loss: 1.1144, test_f1: 0.6569
 epoch: 78, train_loss: 0.2955, test_loss: 1.0849, test_f1: 0.6844
 epoch: 79, train_loss: 0.3064, test_loss: 1.0195, test_f1: 0.6973
 epoch: 80, train_loss: 0.3171, test_loss: 1.0793, test_f1: 0.6895
 epoch: 81, train_loss: 0.3047, test_loss: 1.0833, test_f1: 0.6798
 epoch: 82, train_loss: 0.3258, test_loss: 1.0606, test_f1: 0.6971
 epoch: 83, train_loss: 0.3013, test_loss: 1.1822, test_f1: 0.6611
 epoch: 84, train_loss: 0.2953, test_loss: 1.2430, test_f1: 0.6659
 epoch: 85, train_loss: 0.2810, test_loss: 1.1530, test_f1: 0.6651
 epoch: 86, train_loss: 0.2911, test_loss: 1.0401, test_f1: 0.6947
 epoch: 87, train_loss: 0.2664, test_loss: 1.1527, test_f1: 0.6890
 epoch: 88, train_loss: 0.2635, test_loss: 1.3021, test_f1: 0.6694
 epoch: 89, train_loss: 0.2803, test_loss: 1.1754, test_f1: 0.6593
 epoch: 90, train_loss: 0.3026, test_loss: 1.1449, test_f1: 0.6761
 epoch: 91, train_loss: 0.2794, test_loss: 1.3886, test_f1: 0.6686
 epoch: 92, train_loss: 0.2767, test_loss: 1.3450, test_f1: 0.6623
 epoch: 93, train_loss: 0.2766, test_loss: 1.3735, test_f1: 0.6653
 epoch: 94, train_loss: 0.2701, test_loss: 1.2588, test_f1: 0.6836
 epoch: 95, train_loss: 0.2935, test_loss: 1.3305, test_f1: 0.6371
 epoch: 96, train_loss: 0.2629, test_loss: 1.2355, test_f1: 0.6780
 epoch: 97, train_loss: 0.2485, test_loss: 1.4352, test_f1: 0.6502
 epoch: 98, train_loss: 0.2744, test_loss: 1.3695, test_f1: 0.6704
 epoch: 99, train_loss: 0.2687, test_loss: 1.2489, test_f1: 0.6655
##################ITERATION #4 ****************************************
 epoch: 0, train_loss: 1.2091, test_loss: 1.0643, test_f1: 0.4726
 epoch: 1, train_loss: 0.9831, test_loss: 1.0321, test_f1: 0.5021
 epoch: 2, train_loss: 0.9368, test_loss: 0.9708, test_f1: 0.5265
 epoch: 3, train_loss: 0.8997, test_loss: 0.9581, test_f1: 0.5060
 epoch: 4, train_loss: 0.8797, test_loss: 0.9122, test_f1: 0.5830
 epoch: 5, train_loss: 0.8632, test_loss: 0.9782, test_f1: 0.5038
 epoch: 6, train_loss: 0.8386, test_loss: 0.9118, test_f1: 0.5490
 epoch: 7, train_loss: 0.8332, test_loss: 0.8805, test_f1: 0.5801
 epoch: 8, train_loss: 0.8045, test_loss: 0.8668, test_f1: 0.5773
 epoch: 9, train_loss: 0.7966, test_loss: 0.9012, test_f1: 0.5488
 epoch: 10, train_loss: 0.7772, test_loss: 0.8747, test_f1: 0.5518
 epoch: 11, train_loss: 0.7596, test_loss: 0.9327, test_f1: 0.5538
 epoch: 12, train_loss: 0.7497, test_loss: 0.8484, test_f1: 0.5783
 epoch: 13, train_loss: 0.7559, test_loss: 0.8119, test_f1: 0.6175
 epoch: 14, train_loss: 0.7207, test_loss: 0.8560, test_f1: 0.5865
 epoch: 15, train_loss: 0.7026, test_loss: 0.9163, test_f1: 0.6105
 epoch: 16, train_loss: 0.7101, test_loss: 0.8569, test_f1: 0.5880
 epoch: 17, train_loss: 0.6935, test_loss: 0.8746, test_f1: 0.5848
 epoch: 18, train_loss: 0.6937, test_loss: 0.8959, test_f1: 0.6218
 epoch: 19, train_loss: 0.6766, test_loss: 0.8623, test_f1: 0.6127
 epoch: 20, train_loss: 0.6953, test_loss: 0.8164, test_f1: 0.6406
 epoch: 21, train_loss: 0.6594, test_loss: 0.8787, test_f1: 0.6220
 epoch: 22, train_loss: 0.6671, test_loss: 0.9293, test_f1: 0.5923
 epoch: 23, train_loss: 0.6563, test_loss: 0.8357, test_f1: 0.6594
 epoch: 24, train_loss: 0.6480, test_loss: 0.9773, test_f1: 0.5877
 epoch: 25, train_loss: 0.6376, test_loss: 0.8495, test_f1: 0.6496
 epoch: 26, train_loss: 0.6189, test_loss: 0.8355, test_f1: 0.6374
 epoch: 27, train_loss: 0.6181, test_loss: 0.9564, test_f1: 0.6531
 epoch: 28, train_loss: 0.6018, test_loss: 0.8722, test_f1: 0.6420
 epoch: 29, train_loss: 0.6052, test_loss: 0.8583, test_f1: 0.6208
 epoch: 30, train_loss: 0.5779, test_loss: 0.9156, test_f1: 0.6319
 epoch: 31, train_loss: 0.5986, test_loss: 0.8207, test_f1: 0.6695
 epoch: 32, train_loss: 0.5726, test_loss: 0.8464, test_f1: 0.6612
 epoch: 33, train_loss: 0.5732, test_loss: 0.8997, test_f1: 0.6406
 epoch: 34, train_loss: 0.5713, test_loss: 0.9389, test_f1: 0.6118
 epoch: 35, train_loss: 0.5700, test_loss: 0.9313, test_f1: 0.6350
 epoch: 36, train_loss: 0.5597, test_loss: 0.9629, test_f1: 0.6071
 epoch: 37, train_loss: 0.5492, test_loss: 0.8810, test_f1: 0.6591
 epoch: 38, train_loss: 0.5611, test_loss: 0.8898, test_f1: 0.6566
 epoch: 39, train_loss: 0.5315, test_loss: 0.9108, test_f1: 0.6442
 epoch: 40, train_loss: 0.5347, test_loss: 0.9765, test_f1: 0.6185
 epoch: 41, train_loss: 0.5378, test_loss: 0.8913, test_f1: 0.6544
 epoch: 42, train_loss: 0.5063, test_loss: 0.9352, test_f1: 0.6173
 epoch: 43, train_loss: 0.5156, test_loss: 0.9030, test_f1: 0.6343
 epoch: 44, train_loss: 0.4955, test_loss: 0.9033, test_f1: 0.6551
 epoch: 45, train_loss: 0.4972, test_loss: 0.8497, test_f1: 0.6703
 epoch: 46, train_loss: 0.4860, test_loss: 0.8451, test_f1: 0.6416
 epoch: 47, train_loss: 0.4891, test_loss: 0.9044, test_f1: 0.6654
 epoch: 48, train_loss: 0.4617, test_loss: 0.9105, test_f1: 0.6763
 epoch: 49, train_loss: 0.4717, test_loss: 0.9793, test_f1: 0.6648
 epoch: 50, train_loss: 0.4656, test_loss: 0.9299, test_f1: 0.6580
 epoch: 51, train_loss: 0.4313, test_loss: 0.9209, test_f1: 0.6732
 epoch: 52, train_loss: 0.4340, test_loss: 0.9430, test_f1: 0.6971
 epoch: 53, train_loss: 0.4001, test_loss: 0.9536, test_f1: 0.6817
 epoch: 54, train_loss: 0.3985, test_loss: 0.9675, test_f1: 0.6848
 epoch: 55, train_loss: 0.3938, test_loss: 1.0110, test_f1: 0.6649
 epoch: 56, train_loss: 0.3692, test_loss: 1.0161, test_f1: 0.7031
 epoch: 57, train_loss: 0.3853, test_loss: 1.0353, test_f1: 0.6619
 epoch: 58, train_loss: 0.3671, test_loss: 1.0555, test_f1: 0.6431
 epoch: 59, train_loss: 0.3767, test_loss: 0.9942, test_f1: 0.6693
 epoch: 60, train_loss: 0.3763, test_loss: 1.0232, test_f1: 0.6765
 epoch: 61, train_loss: 0.3785, test_loss: 1.0088, test_f1: 0.6489
 epoch: 62, train_loss: 0.3625, test_loss: 1.0799, test_f1: 0.6731
 epoch: 63, train_loss: 0.3588, test_loss: 1.0884, test_f1: 0.6382
 epoch: 64, train_loss: 0.3759, test_loss: 1.0729, test_f1: 0.6747
 epoch: 65, train_loss: 0.3525, test_loss: 1.1111, test_f1: 0.6736
 epoch: 66, train_loss: 0.3551, test_loss: 1.1246, test_f1: 0.6568
 epoch: 67, train_loss: 0.3414, test_loss: 1.1516, test_f1: 0.6790
 epoch: 68, train_loss: 0.3371, test_loss: 1.0233, test_f1: 0.6700
 epoch: 69, train_loss: 0.3433, test_loss: 1.1712, test_f1: 0.6632
 epoch: 70, train_loss: 0.3349, test_loss: 1.1120, test_f1: 0.6639
 epoch: 71, train_loss: 0.3314, test_loss: 1.1502, test_f1: 0.6632
 epoch: 72, train_loss: 0.3183, test_loss: 1.1885, test_f1: 0.6871
 epoch: 73, train_loss: 0.3560, test_loss: 1.1445, test_f1: 0.6331
 epoch: 74, train_loss: 0.3218, test_loss: 1.2237, test_f1: 0.6692
 epoch: 75, train_loss: 0.3200, test_loss: 1.2589, test_f1: 0.6705
 epoch: 76, train_loss: 0.3212, test_loss: 1.2107, test_f1: 0.6685
 epoch: 77, train_loss: 0.3163, test_loss: 1.3009, test_f1: 0.6199
 epoch: 78, train_loss: 0.3399, test_loss: 1.2458, test_f1: 0.6678
 epoch: 79, train_loss: 0.3069, test_loss: 1.2022, test_f1: 0.6568
 epoch: 80, train_loss: 0.3100, test_loss: 1.2147, test_f1: 0.6498
 epoch: 81, train_loss: 0.3226, test_loss: 1.3012, test_f1: 0.6573
 epoch: 82, train_loss: 0.3209, test_loss: 1.1761, test_f1: 0.6574
 epoch: 83, train_loss: 0.3108, test_loss: 1.3308, test_f1: 0.6525
 epoch: 84, train_loss: 0.3226, test_loss: 1.2225, test_f1: 0.6695
 epoch: 85, train_loss: 0.3034, test_loss: 1.2739, test_f1: 0.6590
 epoch: 86, train_loss: 0.3071, test_loss: 1.2813, test_f1: 0.6526
 epoch: 87, train_loss: 0.2968, test_loss: 1.3040, test_f1: 0.6718
 epoch: 88, train_loss: 0.3122, test_loss: 1.3324, test_f1: 0.6417
 epoch: 89, train_loss: 0.2917, test_loss: 1.3733, test_f1: 0.6688
 epoch: 90, train_loss: 0.2819, test_loss: 1.3101, test_f1: 0.6665
 epoch: 91, train_loss: 0.2767, test_loss: 1.3287, test_f1: 0.6736
 epoch: 92, train_loss: 0.2932, test_loss: 1.3276, test_f1: 0.6578
 epoch: 93, train_loss: 0.2836, test_loss: 1.4003, test_f1: 0.6377
 epoch: 94, train_loss: 0.2729, test_loss: 1.3341, test_f1: 0.6642
 epoch: 95, train_loss: 0.2842, test_loss: 1.3839, test_f1: 0.6823
 epoch: 96, train_loss: 0.2608, test_loss: 1.3229, test_f1: 0.6630
 epoch: 97, train_loss: 0.2675, test_loss: 1.3967, test_f1: 0.6709
 epoch: 98, train_loss: 0.2875, test_loss: 1.3986, test_f1: 0.6787
 epoch: 99, train_loss: 0.2613, test_loss: 1.3492, test_f1: 0.6598
##################ITERATION #5 ****************************************
 epoch: 0, train_loss: 1.2231, test_loss: 1.0008, test_f1: 0.5657
 epoch: 1, train_loss: 0.9841, test_loss: 0.9623, test_f1: 0.5239
 epoch: 2, train_loss: 0.9441, test_loss: 0.9465, test_f1: 0.5532
 epoch: 3, train_loss: 0.9210, test_loss: 1.1194, test_f1: 0.4814
 epoch: 4, train_loss: 0.9005, test_loss: 0.9010, test_f1: 0.5487
 epoch: 5, train_loss: 0.8682, test_loss: 0.9892, test_f1: 0.5517
 epoch: 6, train_loss: 0.8399, test_loss: 0.9228, test_f1: 0.5592
 epoch: 7, train_loss: 0.8449, test_loss: 0.8821, test_f1: 0.5527
 epoch: 8, train_loss: 0.8198, test_loss: 0.8985, test_f1: 0.5911
 epoch: 9, train_loss: 0.8088, test_loss: 0.9234, test_f1: 0.5831
 epoch: 10, train_loss: 0.7861, test_loss: 0.7780, test_f1: 0.6239
 epoch: 11, train_loss: 0.7728, test_loss: 0.9584, test_f1: 0.5563
 epoch: 12, train_loss: 0.7656, test_loss: 0.7958, test_f1: 0.6067
 epoch: 13, train_loss: 0.7619, test_loss: 0.8632, test_f1: 0.6096
 epoch: 14, train_loss: 0.7337, test_loss: 0.8627, test_f1: 0.6075
 epoch: 15, train_loss: 0.7323, test_loss: 0.8296, test_f1: 0.6032
 epoch: 16, train_loss: 0.7072, test_loss: 0.8440, test_f1: 0.6121
 epoch: 17, train_loss: 0.7108, test_loss: 0.9069, test_f1: 0.5994
 epoch: 18, train_loss: 0.6739, test_loss: 0.8688, test_f1: 0.6137
 epoch: 19, train_loss: 0.6775, test_loss: 0.7834, test_f1: 0.6178
 epoch: 20, train_loss: 0.6851, test_loss: 0.9083, test_f1: 0.6173
 epoch: 21, train_loss: 0.6604, test_loss: 0.8683, test_f1: 0.6110
 epoch: 22, train_loss: 0.6663, test_loss: 0.9297, test_f1: 0.6057
 epoch: 23, train_loss: 0.6573, test_loss: 0.8553, test_f1: 0.6111
 epoch: 24, train_loss: 0.6335, test_loss: 0.8840, test_f1: 0.5988
 epoch: 25, train_loss: 0.6295, test_loss: 0.8518, test_f1: 0.6138
 epoch: 26, train_loss: 0.6154, test_loss: 0.8734, test_f1: 0.6213
 epoch: 27, train_loss: 0.6036, test_loss: 0.8100, test_f1: 0.6201
 epoch: 28, train_loss: 0.5940, test_loss: 0.8349, test_f1: 0.6339
 epoch: 29, train_loss: 0.5793, test_loss: 0.9488, test_f1: 0.6343
 epoch: 30, train_loss: 0.5827, test_loss: 0.8917, test_f1: 0.6410
 epoch: 31, train_loss: 0.5965, test_loss: 0.8630, test_f1: 0.6571
 epoch: 32, train_loss: 0.5613, test_loss: 0.8874, test_f1: 0.5854
 epoch: 33, train_loss: 0.5606, test_loss: 0.8737, test_f1: 0.6106
 epoch: 34, train_loss: 0.5391, test_loss: 0.8559, test_f1: 0.6474
 epoch: 35, train_loss: 0.5748, test_loss: 0.9075, test_f1: 0.5819
 epoch: 36, train_loss: 0.5464, test_loss: 0.9782, test_f1: 0.6082
 epoch: 37, train_loss: 0.5614, test_loss: 0.9521, test_f1: 0.5994
 epoch: 38, train_loss: 0.5557, test_loss: 0.8878, test_f1: 0.6471
 epoch: 39, train_loss: 0.5138, test_loss: 0.9053, test_f1: 0.6178
 epoch: 40, train_loss: 0.5149, test_loss: 0.8691, test_f1: 0.6285
 epoch: 41, train_loss: 0.5151, test_loss: 0.9784, test_f1: 0.6502
 epoch: 42, train_loss: 0.5014, test_loss: 0.8093, test_f1: 0.6746
 epoch: 43, train_loss: 0.4992, test_loss: 0.9362, test_f1: 0.6084
 epoch: 44, train_loss: 0.4992, test_loss: 0.9495, test_f1: 0.6303
 epoch: 45, train_loss: 0.4772, test_loss: 0.9678, test_f1: 0.6304
 epoch: 46, train_loss: 0.4709, test_loss: 0.9378, test_f1: 0.6188
 epoch: 47, train_loss: 0.4664, test_loss: 1.0664, test_f1: 0.5595
 epoch: 48, train_loss: 0.4727, test_loss: 0.9237, test_f1: 0.6585
 epoch: 49, train_loss: 0.4709, test_loss: 1.1040, test_f1: 0.6244
 epoch: 50, train_loss: 0.4623, test_loss: 0.9992, test_f1: 0.6265
 epoch: 51, train_loss: 0.4413, test_loss: 0.9911, test_f1: 0.6357
 epoch: 52, train_loss: 0.4007, test_loss: 0.9248, test_f1: 0.6217
 epoch: 53, train_loss: 0.4021, test_loss: 0.9983, test_f1: 0.6347
 epoch: 54, train_loss: 0.3846, test_loss: 1.0348, test_f1: 0.6468
 epoch: 55, train_loss: 0.3738, test_loss: 1.0276, test_f1: 0.6320
 epoch: 56, train_loss: 0.3729, test_loss: 1.0076, test_f1: 0.6750
 epoch: 57, train_loss: 0.3881, test_loss: 1.0640, test_f1: 0.6703
 epoch: 58, train_loss: 0.3831, test_loss: 1.1454, test_f1: 0.6251
 epoch: 59, train_loss: 0.3666, test_loss: 1.0218, test_f1: 0.6503
 epoch: 60, train_loss: 0.3574, test_loss: 1.0160, test_f1: 0.6340
 epoch: 61, train_loss: 0.3705, test_loss: 1.0772, test_f1: 0.6399
 epoch: 62, train_loss: 0.3611, test_loss: 1.1574, test_f1: 0.6445
 epoch: 63, train_loss: 0.3532, test_loss: 1.0301, test_f1: 0.6499
 epoch: 64, train_loss: 0.3558, test_loss: 1.0678, test_f1: 0.6432
 epoch: 65, train_loss: 0.3671, test_loss: 1.1557, test_f1: 0.6420
 epoch: 66, train_loss: 0.3521, test_loss: 1.1383, test_f1: 0.6298
 epoch: 67, train_loss: 0.3446, test_loss: 1.1371, test_f1: 0.6762
 epoch: 68, train_loss: 0.3189, test_loss: 1.1754, test_f1: 0.6289
 epoch: 69, train_loss: 0.3405, test_loss: 1.0886, test_f1: 0.6397
 epoch: 70, train_loss: 0.3522, test_loss: 1.1512, test_f1: 0.6042
 epoch: 71, train_loss: 0.3308, test_loss: 1.1266, test_f1: 0.6572
 epoch: 72, train_loss: 0.3330, test_loss: 1.1418, test_f1: 0.6348
 epoch: 73, train_loss: 0.3286, test_loss: 1.1911, test_f1: 0.6521
 epoch: 74, train_loss: 0.3336, test_loss: 1.1651, test_f1: 0.6519
 epoch: 75, train_loss: 0.3191, test_loss: 1.2081, test_f1: 0.6560
 epoch: 76, train_loss: 0.3137, test_loss: 1.1663, test_f1: 0.6458
 epoch: 77, train_loss: 0.3343, test_loss: 1.1202, test_f1: 0.6303
 epoch: 78, train_loss: 0.3265, test_loss: 1.2051, test_f1: 0.6522
 epoch: 79, train_loss: 0.3164, test_loss: 1.2402, test_f1: 0.6649
 epoch: 80, train_loss: 0.3172, test_loss: 1.2006, test_f1: 0.6401
 epoch: 81, train_loss: 0.3188, test_loss: 1.1572, test_f1: 0.6386
 epoch: 82, train_loss: 0.3148, test_loss: 1.1778, test_f1: 0.6601
 epoch: 83, train_loss: 0.3171, test_loss: 1.2681, test_f1: 0.6499
 epoch: 84, train_loss: 0.3076, test_loss: 1.2128, test_f1: 0.6386
 epoch: 85, train_loss: 0.3102, test_loss: 1.2540, test_f1: 0.6545
 epoch: 86, train_loss: 0.3074, test_loss: 1.1755, test_f1: 0.6586
 epoch: 87, train_loss: 0.3058, test_loss: 1.2479, test_f1: 0.6622
 epoch: 88, train_loss: 0.2969, test_loss: 1.2028, test_f1: 0.6654
 epoch: 89, train_loss: 0.2936, test_loss: 1.2887, test_f1: 0.6347
 epoch: 90, train_loss: 0.2879, test_loss: 1.2125, test_f1: 0.6463
 epoch: 91, train_loss: 0.2755, test_loss: 1.1385, test_f1: 0.6555
 epoch: 92, train_loss: 0.2805, test_loss: 1.2510, test_f1: 0.6394
 epoch: 93, train_loss: 0.2772, test_loss: 1.2773, test_f1: 0.6419
 epoch: 94, train_loss: 0.2957, test_loss: 1.2379, test_f1: 0.6485
 epoch: 95, train_loss: 0.2623, test_loss: 1.2788, test_f1: 0.6698
 epoch: 96, train_loss: 0.2645, test_loss: 1.3375, test_f1: 0.6614
 epoch: 97, train_loss: 0.2964, test_loss: 1.2269, test_f1: 0.6705
 epoch: 98, train_loss: 0.2745, test_loss: 1.2058, test_f1: 0.6521
 epoch: 99, train_loss: 0.2679, test_loss: 1.3060, test_f1: 0.6311
##################ITERATION #6 ****************************************
 epoch: 0, train_loss: 1.3162, test_loss: 0.9941, test_f1: 0.4186
 epoch: 1, train_loss: 1.0143, test_loss: 1.0087, test_f1: 0.4853
 epoch: 2, train_loss: 0.9551, test_loss: 0.9941, test_f1: 0.4691
 epoch: 3, train_loss: 0.9324, test_loss: 0.9613, test_f1: 0.4966
 epoch: 4, train_loss: 0.9129, test_loss: 0.9364, test_f1: 0.5166
 epoch: 5, train_loss: 0.8969, test_loss: 0.9514, test_f1: 0.5315
 epoch: 6, train_loss: 0.8864, test_loss: 0.9433, test_f1: 0.5636
 epoch: 7, train_loss: 0.8566, test_loss: 0.9082, test_f1: 0.5783
 epoch: 8, train_loss: 0.8359, test_loss: 0.9017, test_f1: 0.5863
 epoch: 9, train_loss: 0.8332, test_loss: 0.9543, test_f1: 0.5632
 epoch: 10, train_loss: 0.8130, test_loss: 0.9740, test_f1: 0.5454
 epoch: 11, train_loss: 0.8049, test_loss: 0.8797, test_f1: 0.6146
 epoch: 12, train_loss: 0.7875, test_loss: 0.9095, test_f1: 0.5707
 epoch: 13, train_loss: 0.7547, test_loss: 0.8854, test_f1: 0.6033
 epoch: 14, train_loss: 0.7527, test_loss: 0.9357, test_f1: 0.5993
 epoch: 15, train_loss: 0.7457, test_loss: 0.8866, test_f1: 0.6155
 epoch: 16, train_loss: 0.7417, test_loss: 0.8912, test_f1: 0.6191
 epoch: 17, train_loss: 0.7384, test_loss: 0.9014, test_f1: 0.6024
 epoch: 18, train_loss: 0.7248, test_loss: 0.8486, test_f1: 0.6410
 epoch: 19, train_loss: 0.7189, test_loss: 0.9262, test_f1: 0.6013
 epoch: 20, train_loss: 0.7131, test_loss: 0.8790, test_f1: 0.6403
 epoch: 21, train_loss: 0.6976, test_loss: 0.8663, test_f1: 0.6443
 epoch: 22, train_loss: 0.6845, test_loss: 0.9289, test_f1: 0.6137
 epoch: 23, train_loss: 0.6780, test_loss: 0.8617, test_f1: 0.6493
 epoch: 24, train_loss: 0.6755, test_loss: 0.8754, test_f1: 0.6026
 epoch: 25, train_loss: 0.6642, test_loss: 0.8362, test_f1: 0.6431
 epoch: 26, train_loss: 0.6394, test_loss: 0.8940, test_f1: 0.6224
 epoch: 27, train_loss: 0.6359, test_loss: 0.8557, test_f1: 0.6384
 epoch: 28, train_loss: 0.6375, test_loss: 0.9593, test_f1: 0.6133
 epoch: 29, train_loss: 0.6215, test_loss: 0.8727, test_f1: 0.6289
 epoch: 30, train_loss: 0.6201, test_loss: 0.8863, test_f1: 0.6439
 epoch: 31, train_loss: 0.6344, test_loss: 0.8640, test_f1: 0.6193
 epoch: 32, train_loss: 0.5996, test_loss: 0.9207, test_f1: 0.6322
 epoch: 33, train_loss: 0.5918, test_loss: 0.8993, test_f1: 0.6501
 epoch: 34, train_loss: 0.5992, test_loss: 0.8482, test_f1: 0.6454
 epoch: 35, train_loss: 0.5754, test_loss: 0.9009, test_f1: 0.6382
 epoch: 36, train_loss: 0.5711, test_loss: 0.9050, test_f1: 0.6242
 epoch: 37, train_loss: 0.5609, test_loss: 0.9100, test_f1: 0.6259
 epoch: 38, train_loss: 0.5578, test_loss: 1.0287, test_f1: 0.6257
 epoch: 39, train_loss: 0.5609, test_loss: 0.9014, test_f1: 0.6442
 epoch: 40, train_loss: 0.5503, test_loss: 0.9134, test_f1: 0.6428
 epoch: 41, train_loss: 0.5841, test_loss: 1.0079, test_f1: 0.6082
 epoch: 42, train_loss: 0.5607, test_loss: 0.9712, test_f1: 0.6393
 epoch: 43, train_loss: 0.5268, test_loss: 0.8725, test_f1: 0.6665
 epoch: 44, train_loss: 0.5230, test_loss: 0.8805, test_f1: 0.6643
 epoch: 45, train_loss: 0.5287, test_loss: 0.9588, test_f1: 0.6226
 epoch: 46, train_loss: 0.5145, test_loss: 0.8444, test_f1: 0.6792
 epoch: 47, train_loss: 0.5078, test_loss: 0.9070, test_f1: 0.6726
 epoch: 48, train_loss: 0.4898, test_loss: 0.9149, test_f1: 0.6271
 epoch: 49, train_loss: 0.4981, test_loss: 0.9384, test_f1: 0.6526
 epoch: 50, train_loss: 0.5027, test_loss: 0.9493, test_f1: 0.6389
 epoch: 51, train_loss: 0.4473, test_loss: 0.8792, test_f1: 0.6720
 epoch: 52, train_loss: 0.4398, test_loss: 0.8599, test_f1: 0.6778
 epoch: 53, train_loss: 0.4438, test_loss: 0.9906, test_f1: 0.6341
 epoch: 54, train_loss: 0.4437, test_loss: 0.8882, test_f1: 0.6761
 epoch: 55, train_loss: 0.4120, test_loss: 0.9354, test_f1: 0.6690
 epoch: 56, train_loss: 0.4142, test_loss: 0.9378, test_f1: 0.6595
 epoch: 57, train_loss: 0.4024, test_loss: 0.9626, test_f1: 0.6657
 epoch: 58, train_loss: 0.4041, test_loss: 0.9714, test_f1: 0.6532
 epoch: 59, train_loss: 0.4051, test_loss: 0.9749, test_f1: 0.6445
 epoch: 60, train_loss: 0.4075, test_loss: 0.9709, test_f1: 0.6430
 epoch: 61, train_loss: 0.4066, test_loss: 1.0912, test_f1: 0.6301
 epoch: 62, train_loss: 0.4046, test_loss: 1.0091, test_f1: 0.6320
 epoch: 63, train_loss: 0.4013, test_loss: 1.0737, test_f1: 0.6429
 epoch: 64, train_loss: 0.3947, test_loss: 1.0520, test_f1: 0.6008
 epoch: 65, train_loss: 0.3807, test_loss: 0.9952, test_f1: 0.6481
 epoch: 66, train_loss: 0.3926, test_loss: 0.9591, test_f1: 0.6775
 epoch: 67, train_loss: 0.3849, test_loss: 1.0671, test_f1: 0.6539
 epoch: 68, train_loss: 0.3576, test_loss: 1.0576, test_f1: 0.6381
 epoch: 69, train_loss: 0.3752, test_loss: 0.9884, test_f1: 0.6662
 epoch: 70, train_loss: 0.3694, test_loss: 1.0260, test_f1: 0.6598
 epoch: 71, train_loss: 0.3744, test_loss: 1.0521, test_f1: 0.6613
 epoch: 72, train_loss: 0.3666, test_loss: 1.0097, test_f1: 0.6642
 epoch: 73, train_loss: 0.3745, test_loss: 1.0104, test_f1: 0.6658
 epoch: 74, train_loss: 0.3686, test_loss: 0.9992, test_f1: 0.6568
 epoch: 75, train_loss: 0.3692, test_loss: 1.0363, test_f1: 0.6673
 epoch: 76, train_loss: 0.3459, test_loss: 1.0876, test_f1: 0.6521
 epoch: 77, train_loss: 0.3570, test_loss: 0.9997, test_f1: 0.6754
 epoch: 78, train_loss: 0.3479, test_loss: 1.0837, test_f1: 0.6572
 epoch: 79, train_loss: 0.3598, test_loss: 1.1432, test_f1: 0.6215
 epoch: 80, train_loss: 0.3491, test_loss: 1.4040, test_f1: 0.5999
 epoch: 81, train_loss: 0.3506, test_loss: 1.1203, test_f1: 0.6549
 epoch: 82, train_loss: 0.3354, test_loss: 1.1664, test_f1: 0.6321
 epoch: 83, train_loss: 0.3421, test_loss: 1.0898, test_f1: 0.6492
 epoch: 84, train_loss: 0.3564, test_loss: 1.1072, test_f1: 0.6189
 epoch: 85, train_loss: 0.3322, test_loss: 1.0303, test_f1: 0.6556
 epoch: 86, train_loss: 0.3405, test_loss: 1.0870, test_f1: 0.6640
 epoch: 87, train_loss: 0.3296, test_loss: 1.1304, test_f1: 0.6430
 epoch: 88, train_loss: 0.3351, test_loss: 1.0742, test_f1: 0.6657
 epoch: 89, train_loss: 0.3235, test_loss: 1.1009, test_f1: 0.6586
 epoch: 90, train_loss: 0.3227, test_loss: 1.1442, test_f1: 0.6495
 epoch: 91, train_loss: 0.3424, test_loss: 1.0609, test_f1: 0.6697
 epoch: 92, train_loss: 0.3439, test_loss: 1.1448, test_f1: 0.6621
 epoch: 93, train_loss: 0.3051, test_loss: 1.1521, test_f1: 0.6404
 epoch: 94, train_loss: 0.3201, test_loss: 1.1541, test_f1: 0.6561
 epoch: 95, train_loss: 0.2964, test_loss: 1.1581, test_f1: 0.6574
 epoch: 96, train_loss: 0.3204, test_loss: 1.1137, test_f1: 0.6561
 epoch: 97, train_loss: 0.3161, test_loss: 1.0830, test_f1: 0.6590
 epoch: 98, train_loss: 0.3113, test_loss: 1.0952, test_f1: 0.6643
 epoch: 99, train_loss: 0.3070, test_loss: 1.1137, test_f1: 0.6568
##################ITERATION #7 ****************************************
 epoch: 0, train_loss: 1.2630, test_loss: 1.0294, test_f1: 0.4096
 epoch: 1, train_loss: 1.0077, test_loss: 0.9355, test_f1: 0.5311
 epoch: 2, train_loss: 0.9584, test_loss: 0.9337, test_f1: 0.5298
 epoch: 3, train_loss: 0.9170, test_loss: 0.9129, test_f1: 0.5195
 epoch: 4, train_loss: 0.8914, test_loss: 0.9581, test_f1: 0.5523
 epoch: 5, train_loss: 0.8747, test_loss: 0.9305, test_f1: 0.5644
 epoch: 6, train_loss: 0.8561, test_loss: 0.9026, test_f1: 0.6049
 epoch: 7, train_loss: 0.8379, test_loss: 0.9635, test_f1: 0.5556
 epoch: 8, train_loss: 0.8358, test_loss: 0.9579, test_f1: 0.5553
 epoch: 9, train_loss: 0.8047, test_loss: 0.8823, test_f1: 0.5883
 epoch: 10, train_loss: 0.7898, test_loss: 0.8448, test_f1: 0.6330
 epoch: 11, train_loss: 0.7790, test_loss: 0.8637, test_f1: 0.6236
 epoch: 12, train_loss: 0.7617, test_loss: 0.8452, test_f1: 0.6382
 epoch: 13, train_loss: 0.7702, test_loss: 0.8026, test_f1: 0.6288
 epoch: 14, train_loss: 0.7341, test_loss: 0.9110, test_f1: 0.5815
 epoch: 15, train_loss: 0.7221, test_loss: 0.8359, test_f1: 0.6270
 epoch: 16, train_loss: 0.7177, test_loss: 0.8043, test_f1: 0.6299
 epoch: 17, train_loss: 0.7168, test_loss: 0.8305, test_f1: 0.5931
 epoch: 18, train_loss: 0.6933, test_loss: 0.8685, test_f1: 0.6126
 epoch: 19, train_loss: 0.6903, test_loss: 0.9209, test_f1: 0.5814
 epoch: 20, train_loss: 0.6803, test_loss: 0.8155, test_f1: 0.6049
 epoch: 21, train_loss: 0.6735, test_loss: 0.8122, test_f1: 0.6368
 epoch: 22, train_loss: 0.6472, test_loss: 0.8586, test_f1: 0.6133
 epoch: 23, train_loss: 0.6405, test_loss: 0.8624, test_f1: 0.6412
 epoch: 24, train_loss: 0.6458, test_loss: 0.8695, test_f1: 0.6171
 epoch: 25, train_loss: 0.6209, test_loss: 0.7973, test_f1: 0.6428
 epoch: 26, train_loss: 0.6029, test_loss: 0.8052, test_f1: 0.6460
 epoch: 27, train_loss: 0.6140, test_loss: 0.7825, test_f1: 0.6331
 epoch: 28, train_loss: 0.6025, test_loss: 0.8338, test_f1: 0.6559
 epoch: 29, train_loss: 0.5919, test_loss: 0.7849, test_f1: 0.6599
 epoch: 30, train_loss: 0.5833, test_loss: 0.7959, test_f1: 0.6367
 epoch: 31, train_loss: 0.5589, test_loss: 0.7813, test_f1: 0.6444
 epoch: 32, train_loss: 0.5681, test_loss: 0.7957, test_f1: 0.6629
 epoch: 33, train_loss: 0.5657, test_loss: 0.7856, test_f1: 0.6540
 epoch: 34, train_loss: 0.5677, test_loss: 0.8762, test_f1: 0.6141
 epoch: 35, train_loss: 0.5657, test_loss: 0.8891, test_f1: 0.6188
 epoch: 36, train_loss: 0.5357, test_loss: 0.7639, test_f1: 0.6639
 epoch: 37, train_loss: 0.5186, test_loss: 0.8699, test_f1: 0.6517
 epoch: 38, train_loss: 0.5228, test_loss: 0.8874, test_f1: 0.6393
 epoch: 39, train_loss: 0.5311, test_loss: 0.8143, test_f1: 0.6180
 epoch: 40, train_loss: 0.5048, test_loss: 0.7525, test_f1: 0.6946
 epoch: 41, train_loss: 0.4912, test_loss: 0.7812, test_f1: 0.6660
 epoch: 42, train_loss: 0.5016, test_loss: 0.7979, test_f1: 0.6572
 epoch: 43, train_loss: 0.4868, test_loss: 0.8651, test_f1: 0.6296
 epoch: 44, train_loss: 0.5013, test_loss: 0.8463, test_f1: 0.6475
 epoch: 45, train_loss: 0.4823, test_loss: 0.7315, test_f1: 0.6700
 epoch: 46, train_loss: 0.4626, test_loss: 0.9664, test_f1: 0.6231
 epoch: 47, train_loss: 0.4575, test_loss: 0.9145, test_f1: 0.6293
 epoch: 48, train_loss: 0.4648, test_loss: 0.7826, test_f1: 0.6965
 epoch: 49, train_loss: 0.4646, test_loss: 0.8232, test_f1: 0.6718
 epoch: 50, train_loss: 0.4597, test_loss: 0.8089, test_f1: 0.6525
 epoch: 51, train_loss: 0.4140, test_loss: 0.8501, test_f1: 0.6408
 epoch: 52, train_loss: 0.3780, test_loss: 0.8748, test_f1: 0.6552
 epoch: 53, train_loss: 0.3696, test_loss: 0.8895, test_f1: 0.6497
 epoch: 54, train_loss: 0.3781, test_loss: 0.8992, test_f1: 0.6444
 epoch: 55, train_loss: 0.3724, test_loss: 0.8588, test_f1: 0.6618
 epoch: 56, train_loss: 0.3508, test_loss: 0.8535, test_f1: 0.6683
 epoch: 57, train_loss: 0.3519, test_loss: 0.8625, test_f1: 0.6848
 epoch: 58, train_loss: 0.3542, test_loss: 0.9650, test_f1: 0.6533
 epoch: 59, train_loss: 0.3391, test_loss: 0.8988, test_f1: 0.6661
 epoch: 60, train_loss: 0.3443, test_loss: 0.9109, test_f1: 0.6727
 epoch: 61, train_loss: 0.3414, test_loss: 0.9109, test_f1: 0.6694
 epoch: 62, train_loss: 0.3498, test_loss: 0.9767, test_f1: 0.6540
 epoch: 63, train_loss: 0.3180, test_loss: 0.8819, test_f1: 0.6699
 epoch: 64, train_loss: 0.3590, test_loss: 0.8401, test_f1: 0.6750
 epoch: 65, train_loss: 0.3327, test_loss: 0.9472, test_f1: 0.6566
 epoch: 66, train_loss: 0.3387, test_loss: 0.9244, test_f1: 0.6477
 epoch: 67, train_loss: 0.3270, test_loss: 0.9269, test_f1: 0.6745
 epoch: 68, train_loss: 0.3089, test_loss: 0.9201, test_f1: 0.6665
 epoch: 69, train_loss: 0.2940, test_loss: 0.9455, test_f1: 0.6524
 epoch: 70, train_loss: 0.3185, test_loss: 0.9254, test_f1: 0.6676
 epoch: 71, train_loss: 0.3076, test_loss: 0.9474, test_f1: 0.6490
 epoch: 72, train_loss: 0.3207, test_loss: 0.9645, test_f1: 0.6490
 epoch: 73, train_loss: 0.3136, test_loss: 1.0363, test_f1: 0.6691
 epoch: 74, train_loss: 0.3055, test_loss: 1.0528, test_f1: 0.6416
 epoch: 75, train_loss: 0.3098, test_loss: 1.0077, test_f1: 0.6679
 epoch: 76, train_loss: 0.3036, test_loss: 0.9914, test_f1: 0.6547
 epoch: 77, train_loss: 0.3143, test_loss: 0.9612, test_f1: 0.6653
 epoch: 78, train_loss: 0.2941, test_loss: 0.9799, test_f1: 0.6803
 epoch: 79, train_loss: 0.3041, test_loss: 0.9987, test_f1: 0.6548
 epoch: 80, train_loss: 0.2965, test_loss: 0.9801, test_f1: 0.6754
 epoch: 81, train_loss: 0.2983, test_loss: 0.9237, test_f1: 0.6698
 epoch: 82, train_loss: 0.2921, test_loss: 0.9405, test_f1: 0.6906
 epoch: 83, train_loss: 0.2946, test_loss: 1.0175, test_f1: 0.6664
 epoch: 84, train_loss: 0.2832, test_loss: 1.0619, test_f1: 0.6531
 epoch: 85, train_loss: 0.2706, test_loss: 1.0289, test_f1: 0.6387
 epoch: 86, train_loss: 0.2779, test_loss: 0.9870, test_f1: 0.6733
 epoch: 87, train_loss: 0.2656, test_loss: 1.0466, test_f1: 0.6471
 epoch: 88, train_loss: 0.2772, test_loss: 1.0345, test_f1: 0.6740
 epoch: 89, train_loss: 0.2885, test_loss: 1.1716, test_f1: 0.6429
 epoch: 90, train_loss: 0.2742, test_loss: 1.5657, test_f1: 0.6251
 epoch: 91, train_loss: 0.2567, test_loss: 1.1030, test_f1: 0.6758
 epoch: 92, train_loss: 0.2571, test_loss: 1.0996, test_f1: 0.6439
 epoch: 93, train_loss: 0.2578, test_loss: 1.0953, test_f1: 0.6710
 epoch: 94, train_loss: 0.2592, test_loss: 1.0648, test_f1: 0.6718
 epoch: 95, train_loss: 0.2511, test_loss: 1.1981, test_f1: 0.6232
 epoch: 96, train_loss: 0.2588, test_loss: 1.1398, test_f1: 0.6600
 epoch: 97, train_loss: 0.2566, test_loss: 1.1107, test_f1: 0.6622
 epoch: 98, train_loss: 0.2553, test_loss: 1.2174, test_f1: 0.6397
 epoch: 99, train_loss: 0.2596, test_loss: 1.1614, test_f1: 0.6382
##################ITERATION #8 ****************************************
 epoch: 0, train_loss: 1.3269, test_loss: 1.0015, test_f1: 0.5079
 epoch: 1, train_loss: 1.0014, test_loss: 0.9539, test_f1: 0.5122
 epoch: 2, train_loss: 0.9562, test_loss: 0.9071, test_f1: 0.5457
 epoch: 3, train_loss: 0.9266, test_loss: 0.8970, test_f1: 0.5446
 epoch: 4, train_loss: 0.8961, test_loss: 0.9288, test_f1: 0.5673
 epoch: 5, train_loss: 0.8854, test_loss: 0.8972, test_f1: 0.5722
 epoch: 6, train_loss: 0.8714, test_loss: 0.8873, test_f1: 0.5588
 epoch: 7, train_loss: 0.8444, test_loss: 0.8901, test_f1: 0.5605
 epoch: 8, train_loss: 0.8151, test_loss: 0.8877, test_f1: 0.5663
 epoch: 9, train_loss: 0.7984, test_loss: 0.8880, test_f1: 0.5690
 epoch: 10, train_loss: 0.8053, test_loss: 0.8661, test_f1: 0.6312
 epoch: 11, train_loss: 0.7827, test_loss: 0.9016, test_f1: 0.5790
 epoch: 12, train_loss: 0.7745, test_loss: 0.9096, test_f1: 0.5798
 epoch: 13, train_loss: 0.7568, test_loss: 0.8512, test_f1: 0.5759
 epoch: 14, train_loss: 0.7527, test_loss: 0.8759, test_f1: 0.6099
 epoch: 15, train_loss: 0.7238, test_loss: 0.8728, test_f1: 0.5598
 epoch: 16, train_loss: 0.7424, test_loss: 0.9096, test_f1: 0.5760
 epoch: 17, train_loss: 0.7245, test_loss: 0.8087, test_f1: 0.6049
 epoch: 18, train_loss: 0.7100, test_loss: 0.8584, test_f1: 0.6277
 epoch: 19, train_loss: 0.7054, test_loss: 0.9047, test_f1: 0.5861
 epoch: 20, train_loss: 0.6887, test_loss: 0.8135, test_f1: 0.6176
 epoch: 21, train_loss: 0.6649, test_loss: 0.8784, test_f1: 0.5704
 epoch: 22, train_loss: 0.6667, test_loss: 0.9197, test_f1: 0.5834
 epoch: 23, train_loss: 0.6583, test_loss: 0.8739, test_f1: 0.6046
 epoch: 24, train_loss: 0.6489, test_loss: 0.8342, test_f1: 0.5971
 epoch: 25, train_loss: 0.6267, test_loss: 0.8627, test_f1: 0.6015
 epoch: 26, train_loss: 0.6367, test_loss: 0.7618, test_f1: 0.6279
 epoch: 27, train_loss: 0.6301, test_loss: 0.8231, test_f1: 0.6015
 epoch: 28, train_loss: 0.6095, test_loss: 0.9090, test_f1: 0.6275
 epoch: 29, train_loss: 0.5908, test_loss: 0.8881, test_f1: 0.5949
 epoch: 30, train_loss: 0.5951, test_loss: 0.7628, test_f1: 0.6673
 epoch: 31, train_loss: 0.5855, test_loss: 0.8559, test_f1: 0.5912
 epoch: 32, train_loss: 0.5859, test_loss: 0.8200, test_f1: 0.6294
 epoch: 33, train_loss: 0.5789, test_loss: 0.7866, test_f1: 0.6585
 epoch: 34, train_loss: 0.5554, test_loss: 0.8422, test_f1: 0.6318
 epoch: 35, train_loss: 0.5483, test_loss: 0.8138, test_f1: 0.6454
 epoch: 36, train_loss: 0.5646, test_loss: 0.8706, test_f1: 0.6224
 epoch: 37, train_loss: 0.5615, test_loss: 0.8386, test_f1: 0.6239
 epoch: 38, train_loss: 0.5490, test_loss: 0.8203, test_f1: 0.6493
 epoch: 39, train_loss: 0.5456, test_loss: 0.9305, test_f1: 0.5769
 epoch: 40, train_loss: 0.5312, test_loss: 0.7890, test_f1: 0.6627
 epoch: 41, train_loss: 0.5346, test_loss: 0.8729, test_f1: 0.6297
 epoch: 42, train_loss: 0.5102, test_loss: 0.9785, test_f1: 0.5914
 epoch: 43, train_loss: 0.5145, test_loss: 0.8928, test_f1: 0.6182
 epoch: 44, train_loss: 0.5080, test_loss: 0.9122, test_f1: 0.6124
 epoch: 45, train_loss: 0.5224, test_loss: 0.8399, test_f1: 0.6364
 epoch: 46, train_loss: 0.5069, test_loss: 1.0063, test_f1: 0.6019
 epoch: 47, train_loss: 0.4977, test_loss: 0.9066, test_f1: 0.6158
 epoch: 48, train_loss: 0.4930, test_loss: 0.8173, test_f1: 0.6308
 epoch: 49, train_loss: 0.4728, test_loss: 1.1642, test_f1: 0.5908
 epoch: 50, train_loss: 0.4752, test_loss: 1.0085, test_f1: 0.6242
 epoch: 51, train_loss: 0.4424, test_loss: 0.8709, test_f1: 0.6647
 epoch: 52, train_loss: 0.4027, test_loss: 0.8838, test_f1: 0.6361
 epoch: 53, train_loss: 0.4019, test_loss: 0.9619, test_f1: 0.6304
 epoch: 54, train_loss: 0.3995, test_loss: 1.1040, test_f1: 0.6290
 epoch: 55, train_loss: 0.3964, test_loss: 1.1525, test_f1: 0.6171
 epoch: 56, train_loss: 0.4062, test_loss: 0.9912, test_f1: 0.6556
 epoch: 57, train_loss: 0.3831, test_loss: 1.0060, test_f1: 0.6368
 epoch: 58, train_loss: 0.3923, test_loss: 0.9439, test_f1: 0.6666
 epoch: 59, train_loss: 0.3821, test_loss: 0.9767, test_f1: 0.6276
 epoch: 60, train_loss: 0.4036, test_loss: 1.0011, test_f1: 0.6208
 epoch: 61, train_loss: 0.3692, test_loss: 1.0255, test_f1: 0.6567
 epoch: 62, train_loss: 0.3539, test_loss: 1.0780, test_f1: 0.6337
 epoch: 63, train_loss: 0.3545, test_loss: 1.0252, test_f1: 0.6303
 epoch: 64, train_loss: 0.3661, test_loss: 1.1120, test_f1: 0.6446
 epoch: 65, train_loss: 0.3497, test_loss: 1.0199, test_f1: 0.6297
 epoch: 66, train_loss: 0.3541, test_loss: 1.0058, test_f1: 0.6564
 epoch: 67, train_loss: 0.3507, test_loss: 1.1304, test_f1: 0.6555
 epoch: 68, train_loss: 0.3672, test_loss: 0.9911, test_f1: 0.6476
 epoch: 69, train_loss: 0.3417, test_loss: 1.2671, test_f1: 0.6094
 epoch: 70, train_loss: 0.3478, test_loss: 1.1949, test_f1: 0.6153
 epoch: 71, train_loss: 0.3383, test_loss: 1.0224, test_f1: 0.6597
 epoch: 72, train_loss: 0.3435, test_loss: 1.0419, test_f1: 0.6637
 epoch: 73, train_loss: 0.3468, test_loss: 1.1286, test_f1: 0.6331
 epoch: 74, train_loss: 0.3443, test_loss: 0.9927, test_f1: 0.6827
 epoch: 75, train_loss: 0.3258, test_loss: 1.0697, test_f1: 0.6687
 epoch: 76, train_loss: 0.3395, test_loss: 1.2629, test_f1: 0.6037
 epoch: 77, train_loss: 0.3371, test_loss: 1.0691, test_f1: 0.6636
 epoch: 78, train_loss: 0.3185, test_loss: 1.0105, test_f1: 0.6448
 epoch: 79, train_loss: 0.3188, test_loss: 1.0826, test_f1: 0.6709
 epoch: 80, train_loss: 0.2998, test_loss: 1.3369, test_f1: 0.6416
 epoch: 81, train_loss: 0.3188, test_loss: 1.1537, test_f1: 0.6210
 epoch: 82, train_loss: 0.3069, test_loss: 1.4107, test_f1: 0.5987
 epoch: 83, train_loss: 0.3186, test_loss: 1.4060, test_f1: 0.6251
 epoch: 84, train_loss: 0.3142, test_loss: 1.3172, test_f1: 0.6035
 epoch: 85, train_loss: 0.3109, test_loss: 1.1801, test_f1: 0.6379
 epoch: 86, train_loss: 0.3130, test_loss: 1.1835, test_f1: 0.6341
 epoch: 87, train_loss: 0.3103, test_loss: 1.2479, test_f1: 0.6076
 epoch: 88, train_loss: 0.3110, test_loss: 1.2829, test_f1: 0.6246
 epoch: 89, train_loss: 0.2896, test_loss: 1.4333, test_f1: 0.6105
 epoch: 90, train_loss: 0.2906, test_loss: 1.3159, test_f1: 0.6111
 epoch: 91, train_loss: 0.2829, test_loss: 1.3190, test_f1: 0.6123
 epoch: 92, train_loss: 0.2846, test_loss: 1.3855, test_f1: 0.6185
 epoch: 93, train_loss: 0.2892, test_loss: 1.2188, test_f1: 0.6317
 epoch: 94, train_loss: 0.2801, test_loss: 1.3862, test_f1: 0.6216
 epoch: 95, train_loss: 0.2830, test_loss: 1.4905, test_f1: 0.6146
 epoch: 96, train_loss: 0.3153, test_loss: 1.3127, test_f1: 0.6351
 epoch: 97, train_loss: 0.2951, test_loss: 1.1729, test_f1: 0.6290
 epoch: 98, train_loss: 0.2990, test_loss: 1.2455, test_f1: 0.6349
 epoch: 99, train_loss: 0.2789, test_loss: 1.3904, test_f1: 0.6196
##################ITERATION #9 ****************************************
 epoch: 0, train_loss: 1.2921, test_loss: 1.0909, test_f1: 0.3817
 epoch: 1, train_loss: 1.0139, test_loss: 0.9935, test_f1: 0.4944
 epoch: 2, train_loss: 0.9671, test_loss: 0.9939, test_f1: 0.4929
 epoch: 3, train_loss: 0.9450, test_loss: 0.9335, test_f1: 0.5194
 epoch: 4, train_loss: 0.9123, test_loss: 0.9351, test_f1: 0.5138
 epoch: 5, train_loss: 0.8988, test_loss: 0.9366, test_f1: 0.5292
 epoch: 6, train_loss: 0.8723, test_loss: 0.8970, test_f1: 0.5417
 epoch: 7, train_loss: 0.8510, test_loss: 0.8925, test_f1: 0.5494
 epoch: 8, train_loss: 0.8515, test_loss: 0.9423, test_f1: 0.5201
 epoch: 9, train_loss: 0.8224, test_loss: 0.8734, test_f1: 0.5901
 epoch: 10, train_loss: 0.8110, test_loss: 0.9225, test_f1: 0.5250
 epoch: 11, train_loss: 0.7790, test_loss: 0.8147, test_f1: 0.6028
 epoch: 12, train_loss: 0.7805, test_loss: 0.8515, test_f1: 0.5775
 epoch: 13, train_loss: 0.7685, test_loss: 1.0202, test_f1: 0.5439
 epoch: 14, train_loss: 0.7576, test_loss: 0.9373, test_f1: 0.5778
 epoch: 15, train_loss: 0.7601, test_loss: 0.8555, test_f1: 0.5658
 epoch: 16, train_loss: 0.7338, test_loss: 0.8258, test_f1: 0.5957
 epoch: 17, train_loss: 0.7252, test_loss: 0.7782, test_f1: 0.6192
 epoch: 18, train_loss: 0.7161, test_loss: 0.8471, test_f1: 0.5633
 epoch: 19, train_loss: 0.7102, test_loss: 0.7999, test_f1: 0.6009
 epoch: 20, train_loss: 0.6950, test_loss: 0.8729, test_f1: 0.5883
 epoch: 21, train_loss: 0.6797, test_loss: 0.9391, test_f1: 0.5299
 epoch: 22, train_loss: 0.6960, test_loss: 0.8818, test_f1: 0.6041
 epoch: 23, train_loss: 0.6796, test_loss: 0.9533, test_f1: 0.5640
 epoch: 24, train_loss: 0.6498, test_loss: 0.7858, test_f1: 0.6084
 epoch: 25, train_loss: 0.6523, test_loss: 0.8783, test_f1: 0.6014
 epoch: 26, train_loss: 0.6500, test_loss: 0.8852, test_f1: 0.5898
 epoch: 27, train_loss: 0.6320, test_loss: 0.8177, test_f1: 0.6292
 epoch: 28, train_loss: 0.6228, test_loss: 0.7650, test_f1: 0.6078
 epoch: 29, train_loss: 0.6239, test_loss: 0.9921, test_f1: 0.5560
 epoch: 30, train_loss: 0.6272, test_loss: 0.8025, test_f1: 0.6210
 epoch: 31, train_loss: 0.6126, test_loss: 0.7466, test_f1: 0.6567
 epoch: 32, train_loss: 0.6010, test_loss: 0.8259, test_f1: 0.6128
 epoch: 33, train_loss: 0.6024, test_loss: 0.8120, test_f1: 0.6097
 epoch: 34, train_loss: 0.5820, test_loss: 0.8718, test_f1: 0.5914
 epoch: 35, train_loss: 0.5796, test_loss: 0.8247, test_f1: 0.6160
 epoch: 36, train_loss: 0.5788, test_loss: 0.8147, test_f1: 0.6220
 epoch: 37, train_loss: 0.5727, test_loss: 0.7901, test_f1: 0.6325
 epoch: 38, train_loss: 0.5499, test_loss: 0.8433, test_f1: 0.6152
 epoch: 39, train_loss: 0.5671, test_loss: 1.0111, test_f1: 0.6028
 epoch: 40, train_loss: 0.5611, test_loss: 0.8146, test_f1: 0.6255
 epoch: 41, train_loss: 0.5350, test_loss: 0.8796, test_f1: 0.6103
 epoch: 42, train_loss: 0.5378, test_loss: 0.8210, test_f1: 0.6317
 epoch: 43, train_loss: 0.5320, test_loss: 0.8240, test_f1: 0.6202
 epoch: 44, train_loss: 0.5308, test_loss: 0.8202, test_f1: 0.6230
 epoch: 45, train_loss: 0.5406, test_loss: 0.8359, test_f1: 0.6308
 epoch: 46, train_loss: 0.5244, test_loss: 0.8640, test_f1: 0.6163
 epoch: 47, train_loss: 0.5019, test_loss: 0.8482, test_f1: 0.6299
 epoch: 48, train_loss: 0.5202, test_loss: 0.8446, test_f1: 0.6245
 epoch: 49, train_loss: 0.5237, test_loss: 0.7841, test_f1: 0.6307
 epoch: 50, train_loss: 0.4916, test_loss: 0.9130, test_f1: 0.5965
 epoch: 51, train_loss: 0.4696, test_loss: 0.7994, test_f1: 0.6572
 epoch: 52, train_loss: 0.4396, test_loss: 0.7886, test_f1: 0.6403
 epoch: 53, train_loss: 0.4278, test_loss: 0.7532, test_f1: 0.6436
 epoch: 54, train_loss: 0.4192, test_loss: 0.8311, test_f1: 0.6430
 epoch: 55, train_loss: 0.4240, test_loss: 0.8227, test_f1: 0.6106
 epoch: 56, train_loss: 0.4330, test_loss: 0.8164, test_f1: 0.6474
 epoch: 57, train_loss: 0.4301, test_loss: 0.8398, test_f1: 0.6408
 epoch: 58, train_loss: 0.4220, test_loss: 0.8323, test_f1: 0.6603
 epoch: 59, train_loss: 0.4035, test_loss: 0.8622, test_f1: 0.6346
 epoch: 60, train_loss: 0.4133, test_loss: 0.8407, test_f1: 0.6579
 epoch: 61, train_loss: 0.4065, test_loss: 0.8204, test_f1: 0.6690
 epoch: 62, train_loss: 0.4080, test_loss: 0.8253, test_f1: 0.6489
 epoch: 63, train_loss: 0.4147, test_loss: 0.9020, test_f1: 0.6411
 epoch: 64, train_loss: 0.3884, test_loss: 0.8586, test_f1: 0.6248
 epoch: 65, train_loss: 0.3992, test_loss: 0.8663, test_f1: 0.6610
 epoch: 66, train_loss: 0.3904, test_loss: 0.8651, test_f1: 0.6379
 epoch: 67, train_loss: 0.3883, test_loss: 0.8292, test_f1: 0.6726
 epoch: 68, train_loss: 0.3939, test_loss: 1.0071, test_f1: 0.6082
 epoch: 69, train_loss: 0.3905, test_loss: 0.8317, test_f1: 0.6604
 epoch: 70, train_loss: 0.3711, test_loss: 0.8618, test_f1: 0.6562
 epoch: 71, train_loss: 0.3680, test_loss: 0.8542, test_f1: 0.6363
 epoch: 72, train_loss: 0.3607, test_loss: 0.8823, test_f1: 0.6410
 epoch: 73, train_loss: 0.3998, test_loss: 0.8465, test_f1: 0.6382
 epoch: 74, train_loss: 0.3922, test_loss: 0.9349, test_f1: 0.6274
 epoch: 75, train_loss: 0.3918, test_loss: 0.7893, test_f1: 0.6708
 epoch: 76, train_loss: 0.3657, test_loss: 0.9358, test_f1: 0.6282
 epoch: 77, train_loss: 0.3500, test_loss: 0.8783, test_f1: 0.6540
 epoch: 78, train_loss: 0.3758, test_loss: 0.8682, test_f1: 0.6673
 epoch: 79, train_loss: 0.3581, test_loss: 0.8816, test_f1: 0.6410
 epoch: 80, train_loss: 0.3542, test_loss: 0.8733, test_f1: 0.6569
 epoch: 81, train_loss: 0.3258, test_loss: 0.9771, test_f1: 0.6442
 epoch: 82, train_loss: 0.3418, test_loss: 0.9253, test_f1: 0.6466
 epoch: 83, train_loss: 0.3609, test_loss: 0.8535, test_f1: 0.6425
 epoch: 84, train_loss: 0.3416, test_loss: 0.8944, test_f1: 0.6648
 epoch: 85, train_loss: 0.3536, test_loss: 0.9841, test_f1: 0.6384
 epoch: 86, train_loss: 0.3692, test_loss: 0.9152, test_f1: 0.6642
 epoch: 87, train_loss: 0.3404, test_loss: 0.9711, test_f1: 0.6601
 epoch: 88, train_loss: 0.3446, test_loss: 1.0107, test_f1: 0.6428
 epoch: 89, train_loss: 0.3528, test_loss: 0.9271, test_f1: 0.6565
 epoch: 90, train_loss: 0.3345, test_loss: 0.9953, test_f1: 0.6512
 epoch: 91, train_loss: 0.3110, test_loss: 0.9002, test_f1: 0.6678
 epoch: 92, train_loss: 0.3454, test_loss: 0.9787, test_f1: 0.6586
 epoch: 93, train_loss: 0.3422, test_loss: 0.9161, test_f1: 0.6532
 epoch: 94, train_loss: 0.3222, test_loss: 0.9859, test_f1: 0.6540
 epoch: 95, train_loss: 0.3061, test_loss: 0.9273, test_f1: 0.6823
 epoch: 96, train_loss: 0.3238, test_loss: 0.9938, test_f1: 0.6751
 epoch: 97, train_loss: 0.3105, test_loss: 0.9871, test_f1: 0.6589
 epoch: 98, train_loss: 0.3019, test_loss: 1.0683, test_f1: 0.6455
 epoch: 99, train_loss: 0.3279, test_loss: 1.0604, test_f1: 0.6256

Training completed in 642.90 seconds
Best F1: 0.7031 at epoch 56
Mean F1 across iterations: 0.6853  0.0119
========================FINAL RESULTS================================
FEGIN weighted F1: 0.7031  0.0119
python main.py --data ltspice_examples --representation component_pin --model FEGIN --layers 3 --hiddens 64 --batch_size 64 --lr 0.001 --emb_size 250 --epochs 100 --save_appendix component_pin_L3_H64_BS64_LR0.001_E250 --no_val
-----



STDERR:
  File "main.py", line 370, in <module>
    main()
  File "main.py", line 254, in main
    dataset = dataset_class(
  File "/home/philip/projects/ltspice_examples_code_repo/Circuit-Completion-Using-GNNs/component_classification_with_link_prediction_head/evaluation/FEGIN/kernel/circuit_datasets.py", line 15, in __init__
    self.data, self.slices = torch.load(self.processed_paths[0])
  File "/home/philip/.local/lib/python3.8/site-packages/torch/serialization.py", line 1040, in load
    warnings.warn(
  File "/usr/lib/python3.8/warnings.py", line 109, in _showwarnmsg
    sw(msg.message, msg.category, msg.filename, msg.lineno,
  File "main.py", line 47, in warn_with_traceback
    traceback.print_stack(file=log)
/home/philip/projects/ltspice_examples_code_repo/Circuit-Completion-Using-GNNs/component_classification_with_link_prediction_head/evaluation/FEGIN/kernel/circuit_datasets.py:15: FutureWarning: You are using `torch.load` with `weights_only=False` (the current default value), which uses the default pickle module implicitly. It is possible to construct malicious pickle data which will execute arbitrary code during unpickling (See https://github.com/pytorch/pytorch/blob/main/SECURITY.md#untrusted-models for more details). In a future release, the default value for `weights_only` will be flipped to `True`. This limits the functions that could be executed during unpickling. Arbitrary objects will no longer be allowed to be loaded via this mode unless they are explicitly allowlisted by the user via `torch.serialization.add_safe_globals`. We recommend you start setting `weights_only=True` for any use case where you don't have full control of the loaded file. Please open an issue on GitHub for any issues related to this experimental feature.
  self.data, self.slices = torch.load(self.processed_paths[0])
