STDOUT:
Results will be saved in /home/philip/projects/ltspice_examples_code_repo/Circuit-Completion-Using-GNNs/component_classification_with_link_prediction_head/evaluation/FEGIN/results/model_FEGIN_dataset_ltspice_examples
Command line input: python main.py --data ltspice_examples --representation component_pin --model FEGIN --layers 6 --hiddens 64 --batch_size 128 --lr 0.0001 --emb_size 250 --epochs 100 --save_appendix component_pin_L6_H64_BS128_LR0.0001_E250 --no_val
 is saved.
-----
ltspice_examples - FEGIN
Using 6 layers, 64 hidden units, h = 2
Loading component_pin representation dataset
ENTERED
Training FEGIN on component_pin representation
Train: 3560, Test: 848
##################ITERATION #0 ****************************************
 epoch: 0, train_loss: 1.3880, test_loss: 1.3843, test_f1: 0.1687
 epoch: 1, train_loss: 1.3699, test_loss: 1.3732, test_f1: 0.3287
 epoch: 2, train_loss: 1.3517, test_loss: 1.3463, test_f1: 0.2452
 epoch: 3, train_loss: 1.3256, test_loss: 1.3146, test_f1: 0.2260
 epoch: 4, train_loss: 1.2952, test_loss: 1.2807, test_f1: 0.2260
 epoch: 5, train_loss: 1.2692, test_loss: 1.2548, test_f1: 0.2260
 epoch: 6, train_loss: 1.2466, test_loss: 1.2313, test_f1: 0.2260
 epoch: 7, train_loss: 1.2297, test_loss: 1.2102, test_f1: 0.2260
 epoch: 8, train_loss: 1.2112, test_loss: 1.1883, test_f1: 0.2260
 epoch: 9, train_loss: 1.1998, test_loss: 1.1747, test_f1: 0.2260
 epoch: 10, train_loss: 1.1847, test_loss: 1.1596, test_f1: 0.3325
 epoch: 11, train_loss: 1.1697, test_loss: 1.1493, test_f1: 0.3467
 epoch: 12, train_loss: 1.1515, test_loss: 1.1309, test_f1: 0.3354
 epoch: 13, train_loss: 1.1341, test_loss: 1.1107, test_f1: 0.3661
 epoch: 14, train_loss: 1.1144, test_loss: 1.0967, test_f1: 0.4023
 epoch: 15, train_loss: 1.0940, test_loss: 1.0811, test_f1: 0.4225
 epoch: 16, train_loss: 1.0736, test_loss: 1.0582, test_f1: 0.4399
 epoch: 17, train_loss: 1.0493, test_loss: 1.0387, test_f1: 0.4390
 epoch: 18, train_loss: 1.0342, test_loss: 1.0257, test_f1: 0.4557
 epoch: 19, train_loss: 1.0219, test_loss: 1.0140, test_f1: 0.4298
 epoch: 20, train_loss: 1.0068, test_loss: 1.0106, test_f1: 0.4650
 epoch: 21, train_loss: 1.0068, test_loss: 1.0047, test_f1: 0.4377
 epoch: 22, train_loss: 0.9922, test_loss: 1.0081, test_f1: 0.4431
 epoch: 23, train_loss: 0.9844, test_loss: 1.0153, test_f1: 0.4466
 epoch: 24, train_loss: 0.9787, test_loss: 1.0089, test_f1: 0.4368
 epoch: 25, train_loss: 0.9723, test_loss: 1.0077, test_f1: 0.4837
 epoch: 26, train_loss: 0.9633, test_loss: 0.9969, test_f1: 0.4638
 epoch: 27, train_loss: 0.9653, test_loss: 0.9909, test_f1: 0.4609
 epoch: 28, train_loss: 0.9567, test_loss: 0.9927, test_f1: 0.4637
 epoch: 29, train_loss: 0.9502, test_loss: 1.0043, test_f1: 0.4841
 epoch: 30, train_loss: 0.9430, test_loss: 0.9907, test_f1: 0.4768
 epoch: 31, train_loss: 0.9438, test_loss: 0.9835, test_f1: 0.4742
 epoch: 32, train_loss: 0.9316, test_loss: 0.9916, test_f1: 0.4767
 epoch: 33, train_loss: 0.9305, test_loss: 0.9769, test_f1: 0.4753
 epoch: 34, train_loss: 0.9345, test_loss: 0.9679, test_f1: 0.4921
 epoch: 35, train_loss: 0.9283, test_loss: 0.9675, test_f1: 0.4936
 epoch: 36, train_loss: 0.9184, test_loss: 0.9893, test_f1: 0.4761
 epoch: 37, train_loss: 0.9176, test_loss: 0.9683, test_f1: 0.4884
 epoch: 38, train_loss: 0.9125, test_loss: 0.9684, test_f1: 0.4894
 epoch: 39, train_loss: 0.9101, test_loss: 0.9488, test_f1: 0.5093
 epoch: 40, train_loss: 0.9078, test_loss: 0.9396, test_f1: 0.4927
 epoch: 41, train_loss: 0.8951, test_loss: 0.9312, test_f1: 0.4987
 epoch: 42, train_loss: 0.8999, test_loss: 0.9314, test_f1: 0.5267
 epoch: 43, train_loss: 0.8833, test_loss: 0.9247, test_f1: 0.5027
 epoch: 44, train_loss: 0.8879, test_loss: 0.9247, test_f1: 0.5046
 epoch: 45, train_loss: 0.8728, test_loss: 0.9117, test_f1: 0.5243
 epoch: 46, train_loss: 0.8800, test_loss: 0.9019, test_f1: 0.5052
 epoch: 47, train_loss: 0.8670, test_loss: 0.8968, test_f1: 0.5147
 epoch: 48, train_loss: 0.8659, test_loss: 0.9331, test_f1: 0.5143
 epoch: 49, train_loss: 0.8742, test_loss: 0.9238, test_f1: 0.5121
 epoch: 50, train_loss: 0.8610, test_loss: 0.9077, test_f1: 0.5270
 epoch: 51, train_loss: 0.8549, test_loss: 0.9032, test_f1: 0.5210
 epoch: 52, train_loss: 0.8528, test_loss: 0.9009, test_f1: 0.5396
 epoch: 53, train_loss: 0.8467, test_loss: 0.8873, test_f1: 0.5230
 epoch: 54, train_loss: 0.8345, test_loss: 0.8834, test_f1: 0.5270
 epoch: 55, train_loss: 0.8416, test_loss: 0.8864, test_f1: 0.5320
 epoch: 56, train_loss: 0.8368, test_loss: 0.8914, test_f1: 0.5333
 epoch: 57, train_loss: 0.8395, test_loss: 0.8819, test_f1: 0.5189
 epoch: 58, train_loss: 0.8325, test_loss: 0.8881, test_f1: 0.5272
 epoch: 59, train_loss: 0.8247, test_loss: 0.8823, test_f1: 0.5232
 epoch: 60, train_loss: 0.8221, test_loss: 0.8836, test_f1: 0.5518
 epoch: 61, train_loss: 0.8198, test_loss: 0.8835, test_f1: 0.5347
 epoch: 62, train_loss: 0.8187, test_loss: 0.8823, test_f1: 0.5593
 epoch: 63, train_loss: 0.8139, test_loss: 0.8799, test_f1: 0.5454
 epoch: 64, train_loss: 0.8210, test_loss: 0.8819, test_f1: 0.5504
 epoch: 65, train_loss: 0.8160, test_loss: 0.8870, test_f1: 0.5378
 epoch: 66, train_loss: 0.8080, test_loss: 0.8757, test_f1: 0.5559
 epoch: 67, train_loss: 0.8059, test_loss: 0.8730, test_f1: 0.5616
 epoch: 68, train_loss: 0.8054, test_loss: 0.8705, test_f1: 0.5507
 epoch: 69, train_loss: 0.8061, test_loss: 0.8898, test_f1: 0.5393
 epoch: 70, train_loss: 0.8002, test_loss: 0.8606, test_f1: 0.5684
 epoch: 71, train_loss: 0.8055, test_loss: 0.8716, test_f1: 0.5428
 epoch: 72, train_loss: 0.7939, test_loss: 0.8678, test_f1: 0.5294
 epoch: 73, train_loss: 0.7931, test_loss: 0.8613, test_f1: 0.5492
 epoch: 74, train_loss: 0.7911, test_loss: 0.8646, test_f1: 0.5403
 epoch: 75, train_loss: 0.7832, test_loss: 0.8652, test_f1: 0.5551
 epoch: 76, train_loss: 0.7817, test_loss: 0.8559, test_f1: 0.5540
 epoch: 77, train_loss: 0.7786, test_loss: 0.8605, test_f1: 0.5513
 epoch: 78, train_loss: 0.7757, test_loss: 0.8610, test_f1: 0.5479
 epoch: 79, train_loss: 0.7827, test_loss: 0.8710, test_f1: 0.5455
 epoch: 80, train_loss: 0.7882, test_loss: 0.8581, test_f1: 0.5619
 epoch: 81, train_loss: 0.7734, test_loss: 0.8581, test_f1: 0.5639
 epoch: 82, train_loss: 0.7755, test_loss: 0.8629, test_f1: 0.5346
 epoch: 83, train_loss: 0.7721, test_loss: 0.8606, test_f1: 0.5651
 epoch: 84, train_loss: 0.7700, test_loss: 0.8554, test_f1: 0.5532
 epoch: 85, train_loss: 0.7672, test_loss: 0.8724, test_f1: 0.5411
 epoch: 86, train_loss: 0.7728, test_loss: 0.8505, test_f1: 0.5605
 epoch: 87, train_loss: 0.7546, test_loss: 0.8480, test_f1: 0.5627
 epoch: 88, train_loss: 0.7577, test_loss: 0.8452, test_f1: 0.5493
 epoch: 89, train_loss: 0.7497, test_loss: 0.8615, test_f1: 0.5530
 epoch: 90, train_loss: 0.7524, test_loss: 0.8501, test_f1: 0.5604
 epoch: 91, train_loss: 0.7591, test_loss: 0.8450, test_f1: 0.5761
 epoch: 92, train_loss: 0.7459, test_loss: 0.8569, test_f1: 0.5510
 epoch: 93, train_loss: 0.7437, test_loss: 0.8684, test_f1: 0.5442
 epoch: 94, train_loss: 0.7502, test_loss: 0.8527, test_f1: 0.5480
 epoch: 95, train_loss: 0.7439, test_loss: 0.8512, test_f1: 0.5648
 epoch: 96, train_loss: 0.7364, test_loss: 0.8539, test_f1: 0.5752
 epoch: 97, train_loss: 0.7387, test_loss: 0.8687, test_f1: 0.5550
 epoch: 98, train_loss: 0.7336, test_loss: 0.8539, test_f1: 0.5622
 epoch: 99, train_loss: 0.7319, test_loss: 0.8484, test_f1: 0.5582
##################ITERATION #1 ****************************************
 epoch: 0, train_loss: 1.3537, test_loss: 1.3573, test_f1: 0.2395
 epoch: 1, train_loss: 1.3099, test_loss: 1.3429, test_f1: 0.2260
 epoch: 2, train_loss: 1.2761, test_loss: 1.2655, test_f1: 0.2335
 epoch: 3, train_loss: 1.2408, test_loss: 1.2152, test_f1: 0.3310
 epoch: 4, train_loss: 1.2029, test_loss: 1.1746, test_f1: 0.3371
 epoch: 5, train_loss: 1.1701, test_loss: 1.1371, test_f1: 0.3410
 epoch: 6, train_loss: 1.1389, test_loss: 1.1107, test_f1: 0.3410
 epoch: 7, train_loss: 1.1081, test_loss: 1.0883, test_f1: 0.3389
 epoch: 8, train_loss: 1.0852, test_loss: 1.0675, test_f1: 0.3637
 epoch: 9, train_loss: 1.0587, test_loss: 1.0539, test_f1: 0.3814
 epoch: 10, train_loss: 1.0405, test_loss: 1.0465, test_f1: 0.4042
 epoch: 11, train_loss: 1.0283, test_loss: 1.0370, test_f1: 0.4278
 epoch: 12, train_loss: 1.0234, test_loss: 1.0333, test_f1: 0.4165
 epoch: 13, train_loss: 1.0009, test_loss: 1.0293, test_f1: 0.4459
 epoch: 14, train_loss: 0.9951, test_loss: 1.0283, test_f1: 0.4743
 epoch: 15, train_loss: 0.9843, test_loss: 1.0115, test_f1: 0.4655
 epoch: 16, train_loss: 0.9727, test_loss: 1.0058, test_f1: 0.4843
 epoch: 17, train_loss: 0.9633, test_loss: 0.9976, test_f1: 0.4881
 epoch: 18, train_loss: 0.9662, test_loss: 0.9950, test_f1: 0.5036
 epoch: 19, train_loss: 0.9416, test_loss: 0.9882, test_f1: 0.4949
 epoch: 20, train_loss: 0.9457, test_loss: 1.0032, test_f1: 0.4802
 epoch: 21, train_loss: 0.9261, test_loss: 0.9814, test_f1: 0.4960
 epoch: 22, train_loss: 0.9284, test_loss: 0.9863, test_f1: 0.5025
 epoch: 23, train_loss: 0.9195, test_loss: 0.9742, test_f1: 0.4952
 epoch: 24, train_loss: 0.9074, test_loss: 0.9675, test_f1: 0.5025
 epoch: 25, train_loss: 0.9053, test_loss: 0.9690, test_f1: 0.4981
 epoch: 26, train_loss: 0.8906, test_loss: 0.9635, test_f1: 0.5068
 epoch: 27, train_loss: 0.8850, test_loss: 0.9703, test_f1: 0.5080
 epoch: 28, train_loss: 0.8832, test_loss: 0.9700, test_f1: 0.4848
 epoch: 29, train_loss: 0.8710, test_loss: 0.9629, test_f1: 0.5260
 epoch: 30, train_loss: 0.8649, test_loss: 0.9674, test_f1: 0.4947
 epoch: 31, train_loss: 0.8698, test_loss: 0.9629, test_f1: 0.5130
 epoch: 32, train_loss: 0.8599, test_loss: 0.9559, test_f1: 0.5092
 epoch: 33, train_loss: 0.8524, test_loss: 0.9519, test_f1: 0.5164
 epoch: 34, train_loss: 0.8399, test_loss: 0.9586, test_f1: 0.5047
 epoch: 35, train_loss: 0.8396, test_loss: 0.9600, test_f1: 0.5132
 epoch: 36, train_loss: 0.8364, test_loss: 0.9507, test_f1: 0.5087
 epoch: 37, train_loss: 0.8178, test_loss: 0.9470, test_f1: 0.5114
 epoch: 38, train_loss: 0.8185, test_loss: 0.9404, test_f1: 0.5124
 epoch: 39, train_loss: 0.8089, test_loss: 0.9440, test_f1: 0.5345
 epoch: 40, train_loss: 0.8044, test_loss: 0.9416, test_f1: 0.5241
 epoch: 41, train_loss: 0.7969, test_loss: 0.9478, test_f1: 0.5318
 epoch: 42, train_loss: 0.7877, test_loss: 0.9461, test_f1: 0.5241
 epoch: 43, train_loss: 0.7892, test_loss: 0.9714, test_f1: 0.5116
 epoch: 44, train_loss: 0.7932, test_loss: 0.9591, test_f1: 0.5315
 epoch: 45, train_loss: 0.7838, test_loss: 0.9478, test_f1: 0.5353
 epoch: 46, train_loss: 0.7796, test_loss: 0.9270, test_f1: 0.5353
 epoch: 47, train_loss: 0.7732, test_loss: 0.9467, test_f1: 0.5288
 epoch: 48, train_loss: 0.7615, test_loss: 0.9505, test_f1: 0.5466
 epoch: 49, train_loss: 0.7546, test_loss: 0.9248, test_f1: 0.5470
 epoch: 50, train_loss: 0.7496, test_loss: 0.9488, test_f1: 0.5396
 epoch: 51, train_loss: 0.7461, test_loss: 0.9356, test_f1: 0.5466
 epoch: 52, train_loss: 0.7446, test_loss: 0.9340, test_f1: 0.5379
 epoch: 53, train_loss: 0.7368, test_loss: 0.9539, test_f1: 0.5352
 epoch: 54, train_loss: 0.7351, test_loss: 0.9505, test_f1: 0.5422
 epoch: 55, train_loss: 0.7200, test_loss: 0.9559, test_f1: 0.5403
 epoch: 56, train_loss: 0.7265, test_loss: 0.9576, test_f1: 0.5435
 epoch: 57, train_loss: 0.7211, test_loss: 0.9479, test_f1: 0.5320
 epoch: 58, train_loss: 0.7267, test_loss: 0.9442, test_f1: 0.5436
 epoch: 59, train_loss: 0.7312, test_loss: 0.9600, test_f1: 0.5411
 epoch: 60, train_loss: 0.7207, test_loss: 0.9523, test_f1: 0.5356
 epoch: 61, train_loss: 0.7160, test_loss: 0.9523, test_f1: 0.5336
 epoch: 62, train_loss: 0.7204, test_loss: 0.9594, test_f1: 0.5404
 epoch: 63, train_loss: 0.7234, test_loss: 0.9535, test_f1: 0.5447
 epoch: 64, train_loss: 0.7118, test_loss: 0.9628, test_f1: 0.5370
 epoch: 65, train_loss: 0.7085, test_loss: 0.9832, test_f1: 0.5387
 epoch: 66, train_loss: 0.7068, test_loss: 0.9709, test_f1: 0.5418
 epoch: 67, train_loss: 0.6955, test_loss: 0.9680, test_f1: 0.5366
 epoch: 68, train_loss: 0.7060, test_loss: 0.9672, test_f1: 0.5443
 epoch: 69, train_loss: 0.7002, test_loss: 0.9527, test_f1: 0.5480
 epoch: 70, train_loss: 0.6962, test_loss: 0.9644, test_f1: 0.5416
 epoch: 71, train_loss: 0.6858, test_loss: 0.9706, test_f1: 0.5389
 epoch: 72, train_loss: 0.7024, test_loss: 0.9783, test_f1: 0.5506
 epoch: 73, train_loss: 0.6979, test_loss: 0.9816, test_f1: 0.5394
 epoch: 74, train_loss: 0.6811, test_loss: 0.9868, test_f1: 0.5381
 epoch: 75, train_loss: 0.6900, test_loss: 0.9772, test_f1: 0.5440
 epoch: 76, train_loss: 0.6954, test_loss: 1.0051, test_f1: 0.5277
 epoch: 77, train_loss: 0.6852, test_loss: 0.9918, test_f1: 0.5541
 epoch: 78, train_loss: 0.6741, test_loss: 0.9901, test_f1: 0.5498
 epoch: 79, train_loss: 0.6800, test_loss: 0.9726, test_f1: 0.5456
 epoch: 80, train_loss: 0.6855, test_loss: 0.9849, test_f1: 0.5466
 epoch: 81, train_loss: 0.6825, test_loss: 0.9800, test_f1: 0.5292
 epoch: 82, train_loss: 0.6723, test_loss: 1.0029, test_f1: 0.5410
 epoch: 83, train_loss: 0.6737, test_loss: 1.0000, test_f1: 0.5480
 epoch: 84, train_loss: 0.6681, test_loss: 1.0065, test_f1: 0.5498
 epoch: 85, train_loss: 0.6765, test_loss: 1.0024, test_f1: 0.5360
 epoch: 86, train_loss: 0.6673, test_loss: 0.9977, test_f1: 0.5528
 epoch: 87, train_loss: 0.6634, test_loss: 0.9804, test_f1: 0.5540
 epoch: 88, train_loss: 0.6645, test_loss: 1.0042, test_f1: 0.5508
 epoch: 89, train_loss: 0.6514, test_loss: 1.0060, test_f1: 0.5458
 epoch: 90, train_loss: 0.6606, test_loss: 1.0111, test_f1: 0.5400
 epoch: 91, train_loss: 0.6504, test_loss: 1.0347, test_f1: 0.5462
 epoch: 92, train_loss: 0.6596, test_loss: 1.0264, test_f1: 0.5456
 epoch: 93, train_loss: 0.6611, test_loss: 0.9807, test_f1: 0.5445
 epoch: 94, train_loss: 0.6708, test_loss: 0.9986, test_f1: 0.5552
 epoch: 95, train_loss: 0.6538, test_loss: 1.0011, test_f1: 0.5418
 epoch: 96, train_loss: 0.6590, test_loss: 0.9998, test_f1: 0.5471
 epoch: 97, train_loss: 0.6483, test_loss: 1.0071, test_f1: 0.5436
 epoch: 98, train_loss: 0.6485, test_loss: 1.0129, test_f1: 0.5355
 epoch: 99, train_loss: 0.6515, test_loss: 1.0226, test_f1: 0.5465
##################ITERATION #2 ****************************************
 epoch: 0, train_loss: 1.3275, test_loss: 1.3404, test_f1: 0.2260
 epoch: 1, train_loss: 1.2830, test_loss: 1.2925, test_f1: 0.2783
 epoch: 2, train_loss: 1.2505, test_loss: 1.2263, test_f1: 0.3950
 epoch: 3, train_loss: 1.2145, test_loss: 1.1818, test_f1: 0.4245
 epoch: 4, train_loss: 1.1821, test_loss: 1.1401, test_f1: 0.4188
 epoch: 5, train_loss: 1.1463, test_loss: 1.1017, test_f1: 0.4419
 epoch: 6, train_loss: 1.1123, test_loss: 1.0745, test_f1: 0.4314
 epoch: 7, train_loss: 1.0822, test_loss: 1.0548, test_f1: 0.4457
 epoch: 8, train_loss: 1.0519, test_loss: 1.0367, test_f1: 0.4434
 epoch: 9, train_loss: 1.0360, test_loss: 1.0227, test_f1: 0.4565
 epoch: 10, train_loss: 1.0174, test_loss: 1.0101, test_f1: 0.4619
 epoch: 11, train_loss: 1.0139, test_loss: 1.0136, test_f1: 0.4385
 epoch: 12, train_loss: 0.9915, test_loss: 0.9972, test_f1: 0.4716
 epoch: 13, train_loss: 0.9810, test_loss: 0.9934, test_f1: 0.4810
 epoch: 14, train_loss: 0.9697, test_loss: 0.9923, test_f1: 0.4774
 epoch: 15, train_loss: 0.9619, test_loss: 0.9771, test_f1: 0.4851
 epoch: 16, train_loss: 0.9477, test_loss: 0.9777, test_f1: 0.4805
 epoch: 17, train_loss: 0.9396, test_loss: 0.9771, test_f1: 0.4779
 epoch: 18, train_loss: 0.9351, test_loss: 0.9816, test_f1: 0.4744
 epoch: 19, train_loss: 0.9326, test_loss: 0.9779, test_f1: 0.4815
 epoch: 20, train_loss: 0.9224, test_loss: 0.9731, test_f1: 0.4819
 epoch: 21, train_loss: 0.9085, test_loss: 0.9718, test_f1: 0.4830
 epoch: 22, train_loss: 0.9036, test_loss: 0.9655, test_f1: 0.4761
 epoch: 23, train_loss: 0.9017, test_loss: 0.9556, test_f1: 0.4903
 epoch: 24, train_loss: 0.8999, test_loss: 0.9813, test_f1: 0.4807
 epoch: 25, train_loss: 0.8852, test_loss: 0.9782, test_f1: 0.4867
 epoch: 26, train_loss: 0.8820, test_loss: 0.9580, test_f1: 0.4770
 epoch: 27, train_loss: 0.8717, test_loss: 0.9548, test_f1: 0.4932
 epoch: 28, train_loss: 0.8751, test_loss: 0.9931, test_f1: 0.4815
 epoch: 29, train_loss: 0.8584, test_loss: 1.0036, test_f1: 0.4918
 epoch: 30, train_loss: 0.8617, test_loss: 0.9701, test_f1: 0.4941
 epoch: 31, train_loss: 0.8558, test_loss: 0.9549, test_f1: 0.5028
 epoch: 32, train_loss: 0.8460, test_loss: 0.9803, test_f1: 0.4996
 epoch: 33, train_loss: 0.8436, test_loss: 0.9733, test_f1: 0.5078
 epoch: 34, train_loss: 0.8397, test_loss: 0.9805, test_f1: 0.4848
 epoch: 35, train_loss: 0.8408, test_loss: 0.9778, test_f1: 0.4921
 epoch: 36, train_loss: 0.8220, test_loss: 0.9813, test_f1: 0.4836
 epoch: 37, train_loss: 0.8140, test_loss: 0.9878, test_f1: 0.4891
 epoch: 38, train_loss: 0.8158, test_loss: 1.0322, test_f1: 0.4857
 epoch: 39, train_loss: 0.7964, test_loss: 0.9849, test_f1: 0.5071
 epoch: 40, train_loss: 0.8035, test_loss: 0.9986, test_f1: 0.4911
 epoch: 41, train_loss: 0.8010, test_loss: 1.0022, test_f1: 0.5010
 epoch: 42, train_loss: 0.8002, test_loss: 0.9928, test_f1: 0.4851
 epoch: 43, train_loss: 0.7899, test_loss: 1.0207, test_f1: 0.4927
 epoch: 44, train_loss: 0.7881, test_loss: 1.0073, test_f1: 0.5135
 epoch: 45, train_loss: 0.7831, test_loss: 0.9906, test_f1: 0.5038
 epoch: 46, train_loss: 0.7758, test_loss: 0.9984, test_f1: 0.5091
 epoch: 47, train_loss: 0.7718, test_loss: 0.9839, test_f1: 0.5136
 epoch: 48, train_loss: 0.7703, test_loss: 0.9940, test_f1: 0.4982
 epoch: 49, train_loss: 0.7627, test_loss: 0.9893, test_f1: 0.5067
 epoch: 50, train_loss: 0.7704, test_loss: 0.9723, test_f1: 0.5083
 epoch: 51, train_loss: 0.7513, test_loss: 1.0153, test_f1: 0.4993
 epoch: 52, train_loss: 0.7522, test_loss: 1.0107, test_f1: 0.4873
 epoch: 53, train_loss: 0.7519, test_loss: 1.0003, test_f1: 0.4911
 epoch: 54, train_loss: 0.7498, test_loss: 1.0076, test_f1: 0.5048
 epoch: 55, train_loss: 0.7438, test_loss: 1.0018, test_f1: 0.5001
 epoch: 56, train_loss: 0.7299, test_loss: 1.0071, test_f1: 0.5006
 epoch: 57, train_loss: 0.7407, test_loss: 1.0258, test_f1: 0.4905
 epoch: 58, train_loss: 0.7344, test_loss: 1.0035, test_f1: 0.4988
 epoch: 59, train_loss: 0.7400, test_loss: 1.0273, test_f1: 0.5039
 epoch: 60, train_loss: 0.7341, test_loss: 1.0212, test_f1: 0.4941
 epoch: 61, train_loss: 0.7254, test_loss: 1.0108, test_f1: 0.5224
 epoch: 62, train_loss: 0.7273, test_loss: 1.0284, test_f1: 0.4966
 epoch: 63, train_loss: 0.7239, test_loss: 1.0211, test_f1: 0.5018
 epoch: 64, train_loss: 0.7280, test_loss: 1.0284, test_f1: 0.4963
 epoch: 65, train_loss: 0.7131, test_loss: 1.0161, test_f1: 0.5032
 epoch: 66, train_loss: 0.7135, test_loss: 1.0473, test_f1: 0.4985
 epoch: 67, train_loss: 0.7239, test_loss: 1.0473, test_f1: 0.5009
 epoch: 68, train_loss: 0.7098, test_loss: 1.0386, test_f1: 0.5137
 epoch: 69, train_loss: 0.7060, test_loss: 1.0596, test_f1: 0.5113
 epoch: 70, train_loss: 0.7053, test_loss: 1.0589, test_f1: 0.4954
 epoch: 71, train_loss: 0.7085, test_loss: 1.0105, test_f1: 0.5001
 epoch: 72, train_loss: 0.7026, test_loss: 1.0356, test_f1: 0.5075
 epoch: 73, train_loss: 0.7084, test_loss: 1.0545, test_f1: 0.4902
 epoch: 74, train_loss: 0.7115, test_loss: 1.0226, test_f1: 0.5120
 epoch: 75, train_loss: 0.7069, test_loss: 1.0487, test_f1: 0.5088
 epoch: 76, train_loss: 0.7020, test_loss: 1.0392, test_f1: 0.5004
 epoch: 77, train_loss: 0.7016, test_loss: 1.0686, test_f1: 0.5044
 epoch: 78, train_loss: 0.7028, test_loss: 1.0344, test_f1: 0.5003
 epoch: 79, train_loss: 0.6929, test_loss: 1.0236, test_f1: 0.5097
 epoch: 80, train_loss: 0.6827, test_loss: 1.0624, test_f1: 0.4999
 epoch: 81, train_loss: 0.6903, test_loss: 1.0388, test_f1: 0.5064
 epoch: 82, train_loss: 0.6860, test_loss: 1.0602, test_f1: 0.5036
 epoch: 83, train_loss: 0.6986, test_loss: 1.0452, test_f1: 0.5114
 epoch: 84, train_loss: 0.6877, test_loss: 1.0573, test_f1: 0.5147
 epoch: 85, train_loss: 0.6903, test_loss: 1.0779, test_f1: 0.5019
 epoch: 86, train_loss: 0.6810, test_loss: 1.0683, test_f1: 0.5055
 epoch: 87, train_loss: 0.6977, test_loss: 1.1006, test_f1: 0.5110
 epoch: 88, train_loss: 0.6832, test_loss: 1.0224, test_f1: 0.5214
 epoch: 89, train_loss: 0.6841, test_loss: 1.0602, test_f1: 0.5121
 epoch: 90, train_loss: 0.6860, test_loss: 1.0795, test_f1: 0.5046
 epoch: 91, train_loss: 0.6721, test_loss: 1.0658, test_f1: 0.4999
 epoch: 92, train_loss: 0.6822, test_loss: 1.0538, test_f1: 0.5101
 epoch: 93, train_loss: 0.6667, test_loss: 1.0445, test_f1: 0.5091
 epoch: 94, train_loss: 0.6816, test_loss: 1.0539, test_f1: 0.5089
 epoch: 95, train_loss: 0.6679, test_loss: 1.0274, test_f1: 0.5038
 epoch: 96, train_loss: 0.6724, test_loss: 1.0441, test_f1: 0.5187
 epoch: 97, train_loss: 0.6782, test_loss: 1.0660, test_f1: 0.5157
 epoch: 98, train_loss: 0.6663, test_loss: 1.0441, test_f1: 0.5180
 epoch: 99, train_loss: 0.6691, test_loss: 1.0603, test_f1: 0.5124
##################ITERATION #3 ****************************************
 epoch: 0, train_loss: 1.2972, test_loss: 1.3074, test_f1: 0.2260
 epoch: 1, train_loss: 1.2480, test_loss: 1.2803, test_f1: 0.2260
 epoch: 2, train_loss: 1.2139, test_loss: 1.2098, test_f1: 0.2666
 epoch: 3, train_loss: 1.1799, test_loss: 1.1348, test_f1: 0.4273
 epoch: 4, train_loss: 1.1487, test_loss: 1.0934, test_f1: 0.4537
 epoch: 5, train_loss: 1.1190, test_loss: 1.0649, test_f1: 0.4601
 epoch: 6, train_loss: 1.0868, test_loss: 1.0369, test_f1: 0.4689
 epoch: 7, train_loss: 1.0611, test_loss: 1.0213, test_f1: 0.4850
 epoch: 8, train_loss: 1.0444, test_loss: 1.0088, test_f1: 0.5023
 epoch: 9, train_loss: 1.0299, test_loss: 0.9957, test_f1: 0.4949
 epoch: 10, train_loss: 1.0065, test_loss: 0.9895, test_f1: 0.4965
 epoch: 11, train_loss: 0.9868, test_loss: 0.9858, test_f1: 0.4929
 epoch: 12, train_loss: 0.9820, test_loss: 0.9787, test_f1: 0.4902
 epoch: 13, train_loss: 0.9639, test_loss: 0.9725, test_f1: 0.4902
 epoch: 14, train_loss: 0.9560, test_loss: 0.9723, test_f1: 0.4913
 epoch: 15, train_loss: 0.9423, test_loss: 0.9709, test_f1: 0.4903
 epoch: 16, train_loss: 0.9335, test_loss: 0.9597, test_f1: 0.4951
 epoch: 17, train_loss: 0.9298, test_loss: 0.9498, test_f1: 0.4968
 epoch: 18, train_loss: 0.9218, test_loss: 0.9493, test_f1: 0.5074
 epoch: 19, train_loss: 0.9073, test_loss: 0.9424, test_f1: 0.4830
 epoch: 20, train_loss: 0.9071, test_loss: 0.9386, test_f1: 0.4903
 epoch: 21, train_loss: 0.8970, test_loss: 0.9366, test_f1: 0.5156
 epoch: 22, train_loss: 0.8888, test_loss: 0.9171, test_f1: 0.5279
 epoch: 23, train_loss: 0.8776, test_loss: 0.9112, test_f1: 0.5252
 epoch: 24, train_loss: 0.8647, test_loss: 0.9191, test_f1: 0.5052
 epoch: 25, train_loss: 0.8671, test_loss: 0.9148, test_f1: 0.5205
 epoch: 26, train_loss: 0.8619, test_loss: 0.9301, test_f1: 0.5025
 epoch: 27, train_loss: 0.8535, test_loss: 0.9086, test_f1: 0.5124
 epoch: 28, train_loss: 0.8298, test_loss: 0.9245, test_f1: 0.5234
 epoch: 29, train_loss: 0.8307, test_loss: 0.9030, test_f1: 0.5415
 epoch: 30, train_loss: 0.8247, test_loss: 0.8897, test_f1: 0.5394
 epoch: 31, train_loss: 0.8209, test_loss: 0.8948, test_f1: 0.5468
 epoch: 32, train_loss: 0.8030, test_loss: 0.8918, test_f1: 0.5505
 epoch: 33, train_loss: 0.8074, test_loss: 0.9086, test_f1: 0.5479
 epoch: 34, train_loss: 0.7942, test_loss: 0.9070, test_f1: 0.5556
 epoch: 35, train_loss: 0.7822, test_loss: 0.9386, test_f1: 0.5501
 epoch: 36, train_loss: 0.7859, test_loss: 0.9187, test_f1: 0.5506
 epoch: 37, train_loss: 0.7832, test_loss: 0.9224, test_f1: 0.5437
 epoch: 38, train_loss: 0.7884, test_loss: 0.9173, test_f1: 0.5430
 epoch: 39, train_loss: 0.7727, test_loss: 0.9138, test_f1: 0.5561
 epoch: 40, train_loss: 0.7601, test_loss: 0.8988, test_f1: 0.5566
 epoch: 41, train_loss: 0.7490, test_loss: 0.9216, test_f1: 0.5561
 epoch: 42, train_loss: 0.7449, test_loss: 0.9009, test_f1: 0.5465
 epoch: 43, train_loss: 0.7492, test_loss: 0.9256, test_f1: 0.5526
 epoch: 44, train_loss: 0.7364, test_loss: 0.9219, test_f1: 0.5580
 epoch: 45, train_loss: 0.7364, test_loss: 0.9156, test_f1: 0.5618
 epoch: 46, train_loss: 0.7285, test_loss: 0.9465, test_f1: 0.5444
 epoch: 47, train_loss: 0.7379, test_loss: 0.9716, test_f1: 0.5542
 epoch: 48, train_loss: 0.7194, test_loss: 0.9984, test_f1: 0.5514
 epoch: 49, train_loss: 0.7086, test_loss: 0.9315, test_f1: 0.5469
 epoch: 50, train_loss: 0.7215, test_loss: 0.9413, test_f1: 0.5553
 epoch: 51, train_loss: 0.7019, test_loss: 0.9427, test_f1: 0.5630
 epoch: 52, train_loss: 0.6975, test_loss: 0.9505, test_f1: 0.5530
 epoch: 53, train_loss: 0.7031, test_loss: 0.9119, test_f1: 0.5519
 epoch: 54, train_loss: 0.6829, test_loss: 0.9184, test_f1: 0.5673
 epoch: 55, train_loss: 0.6945, test_loss: 0.9524, test_f1: 0.5513
 epoch: 56, train_loss: 0.6797, test_loss: 0.9387, test_f1: 0.5591
 epoch: 57, train_loss: 0.6772, test_loss: 0.9721, test_f1: 0.5491
 epoch: 58, train_loss: 0.6883, test_loss: 0.9507, test_f1: 0.5593
 epoch: 59, train_loss: 0.6769, test_loss: 0.9558, test_f1: 0.5665
 epoch: 60, train_loss: 0.6775, test_loss: 0.9342, test_f1: 0.5662
 epoch: 61, train_loss: 0.6826, test_loss: 0.9612, test_f1: 0.5621
 epoch: 62, train_loss: 0.6728, test_loss: 0.9461, test_f1: 0.5700
 epoch: 63, train_loss: 0.6616, test_loss: 0.9710, test_f1: 0.5654
 epoch: 64, train_loss: 0.6651, test_loss: 0.9806, test_f1: 0.5590
 epoch: 65, train_loss: 0.6572, test_loss: 0.9678, test_f1: 0.5650
 epoch: 66, train_loss: 0.6546, test_loss: 0.9666, test_f1: 0.5771
 epoch: 67, train_loss: 0.6707, test_loss: 0.9826, test_f1: 0.5734
 epoch: 68, train_loss: 0.6483, test_loss: 0.9672, test_f1: 0.5651
 epoch: 69, train_loss: 0.6539, test_loss: 0.9747, test_f1: 0.5731
 epoch: 70, train_loss: 0.6589, test_loss: 1.0017, test_f1: 0.5639
 epoch: 71, train_loss: 0.6471, test_loss: 0.9847, test_f1: 0.5634
 epoch: 72, train_loss: 0.6632, test_loss: 0.9706, test_f1: 0.5629
 epoch: 73, train_loss: 0.6516, test_loss: 0.9668, test_f1: 0.5664
 epoch: 74, train_loss: 0.6397, test_loss: 0.9822, test_f1: 0.5605
 epoch: 75, train_loss: 0.6390, test_loss: 0.9740, test_f1: 0.5682
 epoch: 76, train_loss: 0.6420, test_loss: 0.9838, test_f1: 0.5670
 epoch: 77, train_loss: 0.6412, test_loss: 0.9916, test_f1: 0.5571
 epoch: 78, train_loss: 0.6477, test_loss: 1.0218, test_f1: 0.5675
 epoch: 79, train_loss: 0.6398, test_loss: 1.0146, test_f1: 0.5588
 epoch: 80, train_loss: 0.6478, test_loss: 0.9892, test_f1: 0.5593
 epoch: 81, train_loss: 0.6398, test_loss: 0.9867, test_f1: 0.5754
 epoch: 82, train_loss: 0.6375, test_loss: 1.0012, test_f1: 0.5572
 epoch: 83, train_loss: 0.6290, test_loss: 0.9829, test_f1: 0.5769
 epoch: 84, train_loss: 0.6249, test_loss: 0.9973, test_f1: 0.5637
 epoch: 85, train_loss: 0.6395, test_loss: 0.9958, test_f1: 0.5648
 epoch: 86, train_loss: 0.6214, test_loss: 1.0322, test_f1: 0.5713
 epoch: 87, train_loss: 0.6384, test_loss: 0.9956, test_f1: 0.5725
 epoch: 88, train_loss: 0.6143, test_loss: 1.0057, test_f1: 0.5723
 epoch: 89, train_loss: 0.6139, test_loss: 1.0039, test_f1: 0.5563
 epoch: 90, train_loss: 0.6181, test_loss: 1.0167, test_f1: 0.5619
 epoch: 91, train_loss: 0.6173, test_loss: 1.0263, test_f1: 0.5755
 epoch: 92, train_loss: 0.6327, test_loss: 1.0111, test_f1: 0.5745
 epoch: 93, train_loss: 0.6365, test_loss: 0.9776, test_f1: 0.5647
 epoch: 94, train_loss: 0.6213, test_loss: 1.0072, test_f1: 0.5607
 epoch: 95, train_loss: 0.6186, test_loss: 1.0216, test_f1: 0.5676
 epoch: 96, train_loss: 0.6096, test_loss: 1.0266, test_f1: 0.5664
 epoch: 97, train_loss: 0.6134, test_loss: 1.0102, test_f1: 0.5679
 epoch: 98, train_loss: 0.6191, test_loss: 1.0180, test_f1: 0.5632
 epoch: 99, train_loss: 0.6128, test_loss: 1.0118, test_f1: 0.5694
##################ITERATION #4 ****************************************
 epoch: 0, train_loss: 1.2828, test_loss: 1.2856, test_f1: 0.2260
 epoch: 1, train_loss: 1.2243, test_loss: 1.2564, test_f1: 0.2260
 epoch: 2, train_loss: 1.1843, test_loss: 1.1495, test_f1: 0.3675
 epoch: 3, train_loss: 1.1432, test_loss: 1.0977, test_f1: 0.4384
 epoch: 4, train_loss: 1.1082, test_loss: 1.0622, test_f1: 0.4432
 epoch: 5, train_loss: 1.0726, test_loss: 1.0417, test_f1: 0.4472
 epoch: 6, train_loss: 1.0489, test_loss: 1.0274, test_f1: 0.4568
 epoch: 7, train_loss: 1.0285, test_loss: 1.0110, test_f1: 0.4649
 epoch: 8, train_loss: 1.0099, test_loss: 1.0082, test_f1: 0.4635
 epoch: 9, train_loss: 0.9936, test_loss: 0.9998, test_f1: 0.4731
 epoch: 10, train_loss: 0.9795, test_loss: 1.0108, test_f1: 0.4797
 epoch: 11, train_loss: 0.9660, test_loss: 0.9923, test_f1: 0.4799
 epoch: 12, train_loss: 0.9542, test_loss: 0.9763, test_f1: 0.4922
 epoch: 13, train_loss: 0.9505, test_loss: 0.9729, test_f1: 0.5050
 epoch: 14, train_loss: 0.9380, test_loss: 0.9646, test_f1: 0.4945
 epoch: 15, train_loss: 0.9301, test_loss: 0.9837, test_f1: 0.4974
 epoch: 16, train_loss: 0.9204, test_loss: 0.9606, test_f1: 0.5065
 epoch: 17, train_loss: 0.9049, test_loss: 0.9581, test_f1: 0.5057
 epoch: 18, train_loss: 0.9055, test_loss: 0.9496, test_f1: 0.5186
 epoch: 19, train_loss: 0.8959, test_loss: 0.9403, test_f1: 0.5296
 epoch: 20, train_loss: 0.8886, test_loss: 0.9312, test_f1: 0.5273
 epoch: 21, train_loss: 0.8815, test_loss: 0.9303, test_f1: 0.5156
 epoch: 22, train_loss: 0.8689, test_loss: 0.9314, test_f1: 0.5257
 epoch: 23, train_loss: 0.8573, test_loss: 0.9262, test_f1: 0.5478
 epoch: 24, train_loss: 0.8609, test_loss: 0.9378, test_f1: 0.5435
 epoch: 25, train_loss: 0.8505, test_loss: 0.9596, test_f1: 0.5157
 epoch: 26, train_loss: 0.8454, test_loss: 0.9278, test_f1: 0.5351
 epoch: 27, train_loss: 0.8370, test_loss: 0.9099, test_f1: 0.5422
 epoch: 28, train_loss: 0.8384, test_loss: 0.9562, test_f1: 0.5143
 epoch: 29, train_loss: 0.8353, test_loss: 0.9210, test_f1: 0.5506
 epoch: 30, train_loss: 0.8173, test_loss: 0.9037, test_f1: 0.5455
 epoch: 31, train_loss: 0.8250, test_loss: 0.9142, test_f1: 0.5613
 epoch: 32, train_loss: 0.8168, test_loss: 0.9296, test_f1: 0.5375
 epoch: 33, train_loss: 0.8038, test_loss: 0.9118, test_f1: 0.5473
 epoch: 34, train_loss: 0.8023, test_loss: 0.9187, test_f1: 0.5496
 epoch: 35, train_loss: 0.8005, test_loss: 0.8938, test_f1: 0.5644
 epoch: 36, train_loss: 0.7945, test_loss: 0.9102, test_f1: 0.5549
 epoch: 37, train_loss: 0.7945, test_loss: 0.9050, test_f1: 0.5478
 epoch: 38, train_loss: 0.7895, test_loss: 0.8966, test_f1: 0.5597
 epoch: 39, train_loss: 0.7759, test_loss: 0.8990, test_f1: 0.5532
 epoch: 40, train_loss: 0.7717, test_loss: 0.9117, test_f1: 0.5508
 epoch: 41, train_loss: 0.7702, test_loss: 0.9289, test_f1: 0.5383
 epoch: 42, train_loss: 0.7630, test_loss: 0.8902, test_f1: 0.5604
 epoch: 43, train_loss: 0.7554, test_loss: 0.9083, test_f1: 0.5456
 epoch: 44, train_loss: 0.7537, test_loss: 0.9065, test_f1: 0.5336
 epoch: 45, train_loss: 0.7528, test_loss: 0.9239, test_f1: 0.5321
 epoch: 46, train_loss: 0.7418, test_loss: 0.9203, test_f1: 0.5383
 epoch: 47, train_loss: 0.7470, test_loss: 0.9197, test_f1: 0.5560
 epoch: 48, train_loss: 0.7406, test_loss: 0.9272, test_f1: 0.5377
 epoch: 49, train_loss: 0.7307, test_loss: 0.9138, test_f1: 0.5502
 epoch: 50, train_loss: 0.7271, test_loss: 0.9380, test_f1: 0.5451
 epoch: 51, train_loss: 0.7248, test_loss: 0.9095, test_f1: 0.5565
 epoch: 52, train_loss: 0.7173, test_loss: 0.9213, test_f1: 0.5522
 epoch: 53, train_loss: 0.7035, test_loss: 0.9375, test_f1: 0.5455
 epoch: 54, train_loss: 0.7063, test_loss: 0.9157, test_f1: 0.5471
 epoch: 55, train_loss: 0.7043, test_loss: 0.9348, test_f1: 0.5480
 epoch: 56, train_loss: 0.7133, test_loss: 0.9291, test_f1: 0.5529
 epoch: 57, train_loss: 0.7015, test_loss: 0.9378, test_f1: 0.5551
 epoch: 58, train_loss: 0.7085, test_loss: 0.9517, test_f1: 0.5517
 epoch: 59, train_loss: 0.7013, test_loss: 0.9323, test_f1: 0.5608
 epoch: 60, train_loss: 0.6981, test_loss: 0.9225, test_f1: 0.5481
 epoch: 61, train_loss: 0.7027, test_loss: 0.9451, test_f1: 0.5396
 epoch: 62, train_loss: 0.6959, test_loss: 0.9256, test_f1: 0.5451
 epoch: 63, train_loss: 0.6927, test_loss: 0.9130, test_f1: 0.5534
 epoch: 64, train_loss: 0.6755, test_loss: 0.9362, test_f1: 0.5553
 epoch: 65, train_loss: 0.7040, test_loss: 0.9139, test_f1: 0.5552
 epoch: 66, train_loss: 0.6918, test_loss: 0.9369, test_f1: 0.5453
 epoch: 67, train_loss: 0.6840, test_loss: 0.9128, test_f1: 0.5593
 epoch: 68, train_loss: 0.6832, test_loss: 0.9263, test_f1: 0.5530
 epoch: 69, train_loss: 0.6733, test_loss: 0.9369, test_f1: 0.5541
 epoch: 70, train_loss: 0.6811, test_loss: 0.9309, test_f1: 0.5532
 epoch: 71, train_loss: 0.6757, test_loss: 0.9452, test_f1: 0.5564
 epoch: 72, train_loss: 0.6724, test_loss: 0.9422, test_f1: 0.5543
 epoch: 73, train_loss: 0.6728, test_loss: 0.9625, test_f1: 0.5518
 epoch: 74, train_loss: 0.6682, test_loss: 0.9445, test_f1: 0.5346
 epoch: 75, train_loss: 0.6770, test_loss: 0.9325, test_f1: 0.5448
 epoch: 76, train_loss: 0.6664, test_loss: 0.9633, test_f1: 0.5459
 epoch: 77, train_loss: 0.6597, test_loss: 0.9462, test_f1: 0.5519
 epoch: 78, train_loss: 0.6606, test_loss: 0.9581, test_f1: 0.5474
 epoch: 79, train_loss: 0.6645, test_loss: 0.9678, test_f1: 0.5535
 epoch: 80, train_loss: 0.6620, test_loss: 0.9613, test_f1: 0.5448
 epoch: 81, train_loss: 0.6554, test_loss: 0.9514, test_f1: 0.5518
 epoch: 82, train_loss: 0.6506, test_loss: 0.9316, test_f1: 0.5451
 epoch: 83, train_loss: 0.6711, test_loss: 0.9286, test_f1: 0.5385
 epoch: 84, train_loss: 0.6539, test_loss: 0.9391, test_f1: 0.5550
 epoch: 85, train_loss: 0.6540, test_loss: 0.9386, test_f1: 0.5554
 epoch: 86, train_loss: 0.6538, test_loss: 0.9373, test_f1: 0.5384
 epoch: 87, train_loss: 0.6467, test_loss: 0.9454, test_f1: 0.5479
 epoch: 88, train_loss: 0.6477, test_loss: 0.9716, test_f1: 0.5498
 epoch: 89, train_loss: 0.6467, test_loss: 0.9431, test_f1: 0.5558
 epoch: 90, train_loss: 0.6641, test_loss: 0.9390, test_f1: 0.5501
 epoch: 91, train_loss: 0.6520, test_loss: 0.9549, test_f1: 0.5387
 epoch: 92, train_loss: 0.6461, test_loss: 0.9228, test_f1: 0.5503
 epoch: 93, train_loss: 0.6413, test_loss: 0.9429, test_f1: 0.5428
 epoch: 94, train_loss: 0.6435, test_loss: 0.9556, test_f1: 0.5537
 epoch: 95, train_loss: 0.6425, test_loss: 0.9779, test_f1: 0.5472
 epoch: 96, train_loss: 0.6362, test_loss: 0.9567, test_f1: 0.5524
 epoch: 97, train_loss: 0.6326, test_loss: 0.9445, test_f1: 0.5564
 epoch: 98, train_loss: 0.6265, test_loss: 0.9801, test_f1: 0.5543
 epoch: 99, train_loss: 0.6395, test_loss: 0.9332, test_f1: 0.5534
##################ITERATION #5 ****************************************
 epoch: 0, train_loss: 1.2863, test_loss: 1.2923, test_f1: 0.2260
 epoch: 1, train_loss: 1.1895, test_loss: 1.1956, test_f1: 0.3060
 epoch: 2, train_loss: 1.1541, test_loss: 1.1034, test_f1: 0.4413
 epoch: 3, train_loss: 1.1262, test_loss: 1.0680, test_f1: 0.4601
 epoch: 4, train_loss: 1.0974, test_loss: 1.0458, test_f1: 0.4615
 epoch: 5, train_loss: 1.0715, test_loss: 1.0238, test_f1: 0.4725
 epoch: 6, train_loss: 1.0496, test_loss: 1.0111, test_f1: 0.4616
 epoch: 7, train_loss: 1.0338, test_loss: 0.9902, test_f1: 0.4822
 epoch: 8, train_loss: 1.0155, test_loss: 0.9828, test_f1: 0.4883
 epoch: 9, train_loss: 0.9894, test_loss: 0.9779, test_f1: 0.4835
 epoch: 10, train_loss: 0.9766, test_loss: 0.9768, test_f1: 0.4872
 epoch: 11, train_loss: 0.9616, test_loss: 0.9774, test_f1: 0.4861
 epoch: 12, train_loss: 0.9520, test_loss: 0.9785, test_f1: 0.4828
 epoch: 13, train_loss: 0.9352, test_loss: 0.9554, test_f1: 0.5039
 epoch: 14, train_loss: 0.9281, test_loss: 0.9514, test_f1: 0.5045
 epoch: 15, train_loss: 0.9081, test_loss: 0.9403, test_f1: 0.5254
 epoch: 16, train_loss: 0.9059, test_loss: 0.9610, test_f1: 0.5265
 epoch: 17, train_loss: 0.9051, test_loss: 0.9444, test_f1: 0.5208
 epoch: 18, train_loss: 0.8950, test_loss: 0.9669, test_f1: 0.5273
 epoch: 19, train_loss: 0.8873, test_loss: 0.9500, test_f1: 0.5296
 epoch: 20, train_loss: 0.8859, test_loss: 0.9449, test_f1: 0.5319
 epoch: 21, train_loss: 0.8698, test_loss: 0.9258, test_f1: 0.5340
 epoch: 22, train_loss: 0.8510, test_loss: 0.9444, test_f1: 0.5339
 epoch: 23, train_loss: 0.8561, test_loss: 0.9213, test_f1: 0.5439
 epoch: 24, train_loss: 0.8527, test_loss: 0.9368, test_f1: 0.5411
 epoch: 25, train_loss: 0.8372, test_loss: 0.9294, test_f1: 0.5458
 epoch: 26, train_loss: 0.8324, test_loss: 0.9329, test_f1: 0.5452
 epoch: 27, train_loss: 0.8351, test_loss: 0.9349, test_f1: 0.5433
 epoch: 28, train_loss: 0.8231, test_loss: 0.9205, test_f1: 0.5367
 epoch: 29, train_loss: 0.8259, test_loss: 0.9374, test_f1: 0.5265
 epoch: 30, train_loss: 0.8083, test_loss: 0.9220, test_f1: 0.5537
 epoch: 31, train_loss: 0.8040, test_loss: 0.9113, test_f1: 0.5408
 epoch: 32, train_loss: 0.8098, test_loss: 0.9152, test_f1: 0.5573
 epoch: 33, train_loss: 0.7980, test_loss: 0.9128, test_f1: 0.5506
 epoch: 34, train_loss: 0.7959, test_loss: 0.9112, test_f1: 0.5561
 epoch: 35, train_loss: 0.7906, test_loss: 0.9254, test_f1: 0.5483
 epoch: 36, train_loss: 0.7859, test_loss: 0.8970, test_f1: 0.5500
 epoch: 37, train_loss: 0.7807, test_loss: 0.9361, test_f1: 0.5639
 epoch: 38, train_loss: 0.7707, test_loss: 0.9434, test_f1: 0.5505
 epoch: 39, train_loss: 0.7644, test_loss: 0.9311, test_f1: 0.5502
 epoch: 40, train_loss: 0.7532, test_loss: 0.9038, test_f1: 0.5647
 epoch: 41, train_loss: 0.7483, test_loss: 0.9394, test_f1: 0.5503
 epoch: 42, train_loss: 0.7625, test_loss: 0.9325, test_f1: 0.5651
 epoch: 43, train_loss: 0.7465, test_loss: 0.9406, test_f1: 0.5507
 epoch: 44, train_loss: 0.7474, test_loss: 0.9263, test_f1: 0.5467
 epoch: 45, train_loss: 0.7436, test_loss: 0.8899, test_f1: 0.5727
 epoch: 46, train_loss: 0.7359, test_loss: 0.9203, test_f1: 0.5591
 epoch: 47, train_loss: 0.7350, test_loss: 0.9336, test_f1: 0.5708
 epoch: 48, train_loss: 0.7323, test_loss: 0.9264, test_f1: 0.5626
 epoch: 49, train_loss: 0.7236, test_loss: 0.9339, test_f1: 0.5652
 epoch: 50, train_loss: 0.7194, test_loss: 0.9325, test_f1: 0.5479
 epoch: 51, train_loss: 0.7101, test_loss: 0.9187, test_f1: 0.5488
 epoch: 52, train_loss: 0.7056, test_loss: 0.9300, test_f1: 0.5587
 epoch: 53, train_loss: 0.6970, test_loss: 0.9395, test_f1: 0.5505
 epoch: 54, train_loss: 0.7009, test_loss: 0.9279, test_f1: 0.5692
 epoch: 55, train_loss: 0.6978, test_loss: 0.9324, test_f1: 0.5583
 epoch: 56, train_loss: 0.6985, test_loss: 0.9113, test_f1: 0.5470
 epoch: 57, train_loss: 0.6919, test_loss: 0.9339, test_f1: 0.5598
 epoch: 58, train_loss: 0.6908, test_loss: 0.9120, test_f1: 0.5604
 epoch: 59, train_loss: 0.6784, test_loss: 0.9319, test_f1: 0.5645
 epoch: 60, train_loss: 0.6847, test_loss: 0.9250, test_f1: 0.5510
 epoch: 61, train_loss: 0.6789, test_loss: 0.9160, test_f1: 0.5655
 epoch: 62, train_loss: 0.6814, test_loss: 0.9219, test_f1: 0.5710
 epoch: 63, train_loss: 0.6787, test_loss: 0.9340, test_f1: 0.5623
 epoch: 64, train_loss: 0.6740, test_loss: 0.9318, test_f1: 0.5577
 epoch: 65, train_loss: 0.6761, test_loss: 0.9450, test_f1: 0.5451
 epoch: 66, train_loss: 0.6758, test_loss: 0.9406, test_f1: 0.5714
 epoch: 67, train_loss: 0.6594, test_loss: 0.9202, test_f1: 0.5679
 epoch: 68, train_loss: 0.6710, test_loss: 0.9303, test_f1: 0.5702
 epoch: 69, train_loss: 0.6658, test_loss: 0.9202, test_f1: 0.5634
 epoch: 70, train_loss: 0.6592, test_loss: 0.9348, test_f1: 0.5650
 epoch: 71, train_loss: 0.6758, test_loss: 0.9161, test_f1: 0.5763
 epoch: 72, train_loss: 0.6609, test_loss: 0.9169, test_f1: 0.5709
 epoch: 73, train_loss: 0.6553, test_loss: 0.9306, test_f1: 0.5747
 epoch: 74, train_loss: 0.6540, test_loss: 0.9351, test_f1: 0.5606
 epoch: 75, train_loss: 0.6575, test_loss: 0.9284, test_f1: 0.5686
 epoch: 76, train_loss: 0.6672, test_loss: 0.9665, test_f1: 0.5565
 epoch: 77, train_loss: 0.6418, test_loss: 0.9453, test_f1: 0.5696
 epoch: 78, train_loss: 0.6529, test_loss: 0.9478, test_f1: 0.5571
 epoch: 79, train_loss: 0.6525, test_loss: 0.9350, test_f1: 0.5735
 epoch: 80, train_loss: 0.6374, test_loss: 0.9246, test_f1: 0.5696
 epoch: 81, train_loss: 0.6447, test_loss: 0.9286, test_f1: 0.5825
 epoch: 82, train_loss: 0.6480, test_loss: 0.9365, test_f1: 0.5727
 epoch: 83, train_loss: 0.6412, test_loss: 0.9531, test_f1: 0.5617
 epoch: 84, train_loss: 0.6342, test_loss: 0.9274, test_f1: 0.5693
 epoch: 85, train_loss: 0.6428, test_loss: 0.9412, test_f1: 0.5689
 epoch: 86, train_loss: 0.6407, test_loss: 0.9653, test_f1: 0.5685
 epoch: 87, train_loss: 0.6393, test_loss: 0.9417, test_f1: 0.5674
 epoch: 88, train_loss: 0.6264, test_loss: 0.9387, test_f1: 0.5562
 epoch: 89, train_loss: 0.6318, test_loss: 0.9514, test_f1: 0.5700
 epoch: 90, train_loss: 0.6308, test_loss: 0.9310, test_f1: 0.5773
 epoch: 91, train_loss: 0.6220, test_loss: 0.9396, test_f1: 0.5701
 epoch: 92, train_loss: 0.6348, test_loss: 0.9603, test_f1: 0.5583
 epoch: 93, train_loss: 0.6250, test_loss: 0.9180, test_f1: 0.5673
 epoch: 94, train_loss: 0.6199, test_loss: 0.9346, test_f1: 0.5666
 epoch: 95, train_loss: 0.6155, test_loss: 0.9824, test_f1: 0.5518
 epoch: 96, train_loss: 0.6198, test_loss: 0.9572, test_f1: 0.5701
 epoch: 97, train_loss: 0.6189, test_loss: 0.9424, test_f1: 0.5813
 epoch: 98, train_loss: 0.6083, test_loss: 0.9612, test_f1: 0.5682
 epoch: 99, train_loss: 0.6288, test_loss: 0.9563, test_f1: 0.5752
##################ITERATION #6 ****************************************
 epoch: 0, train_loss: 1.2789, test_loss: 1.2742, test_f1: 0.2260
 epoch: 1, train_loss: 1.1795, test_loss: 1.1913, test_f1: 0.2748
 epoch: 2, train_loss: 1.1401, test_loss: 1.0808, test_f1: 0.4539
 epoch: 3, train_loss: 1.1039, test_loss: 1.0349, test_f1: 0.4617
 epoch: 4, train_loss: 1.0777, test_loss: 1.0058, test_f1: 0.4693
 epoch: 5, train_loss: 1.0460, test_loss: 0.9898, test_f1: 0.4703
 epoch: 6, train_loss: 1.0172, test_loss: 0.9838, test_f1: 0.4740
 epoch: 7, train_loss: 1.0119, test_loss: 0.9600, test_f1: 0.4947
 epoch: 8, train_loss: 0.9874, test_loss: 0.9493, test_f1: 0.4908
 epoch: 9, train_loss: 0.9780, test_loss: 0.9382, test_f1: 0.5151
 epoch: 10, train_loss: 0.9626, test_loss: 0.9397, test_f1: 0.5087
 epoch: 11, train_loss: 0.9456, test_loss: 0.9374, test_f1: 0.5109
 epoch: 12, train_loss: 0.9365, test_loss: 0.9435, test_f1: 0.5096
 epoch: 13, train_loss: 0.9268, test_loss: 0.9250, test_f1: 0.5151
 epoch: 14, train_loss: 0.9152, test_loss: 0.9233, test_f1: 0.5144
 epoch: 15, train_loss: 0.9080, test_loss: 0.9237, test_f1: 0.5273
 epoch: 16, train_loss: 0.8955, test_loss: 0.9316, test_f1: 0.5144
 epoch: 17, train_loss: 0.8870, test_loss: 0.9140, test_f1: 0.5181
 epoch: 18, train_loss: 0.8850, test_loss: 0.9242, test_f1: 0.5307
 epoch: 19, train_loss: 0.8703, test_loss: 0.8956, test_f1: 0.5450
 epoch: 20, train_loss: 0.8682, test_loss: 0.8823, test_f1: 0.5397
 epoch: 21, train_loss: 0.8652, test_loss: 0.9115, test_f1: 0.5322
 epoch: 22, train_loss: 0.8456, test_loss: 0.8974, test_f1: 0.5443
 epoch: 23, train_loss: 0.8463, test_loss: 0.8812, test_f1: 0.5676
 epoch: 24, train_loss: 0.8376, test_loss: 0.8954, test_f1: 0.5561
 epoch: 25, train_loss: 0.8342, test_loss: 0.8989, test_f1: 0.5531
 epoch: 26, train_loss: 0.8321, test_loss: 0.9087, test_f1: 0.5470
 epoch: 27, train_loss: 0.8180, test_loss: 0.8799, test_f1: 0.5518
 epoch: 28, train_loss: 0.8155, test_loss: 0.8642, test_f1: 0.5632
 epoch: 29, train_loss: 0.8097, test_loss: 0.8748, test_f1: 0.5591
 epoch: 30, train_loss: 0.7939, test_loss: 0.8663, test_f1: 0.5643
 epoch: 31, train_loss: 0.7957, test_loss: 0.9004, test_f1: 0.5556
 epoch: 32, train_loss: 0.7884, test_loss: 0.8866, test_f1: 0.5548
 epoch: 33, train_loss: 0.7953, test_loss: 0.8594, test_f1: 0.5532
 epoch: 34, train_loss: 0.7773, test_loss: 0.8608, test_f1: 0.5738
 epoch: 35, train_loss: 0.7848, test_loss: 0.8871, test_f1: 0.5583
 epoch: 36, train_loss: 0.7791, test_loss: 0.8732, test_f1: 0.5700
 epoch: 37, train_loss: 0.7745, test_loss: 0.8845, test_f1: 0.5608
 epoch: 38, train_loss: 0.7620, test_loss: 0.8931, test_f1: 0.5571
 epoch: 39, train_loss: 0.7589, test_loss: 0.8422, test_f1: 0.5633
 epoch: 40, train_loss: 0.7474, test_loss: 0.8534, test_f1: 0.5556
 epoch: 41, train_loss: 0.7530, test_loss: 0.8788, test_f1: 0.5623
 epoch: 42, train_loss: 0.7311, test_loss: 0.8671, test_f1: 0.5703
 epoch: 43, train_loss: 0.7291, test_loss: 0.8886, test_f1: 0.5737
 epoch: 44, train_loss: 0.7367, test_loss: 0.8592, test_f1: 0.5663
 epoch: 45, train_loss: 0.7291, test_loss: 0.9119, test_f1: 0.5506
 epoch: 46, train_loss: 0.7278, test_loss: 0.9121, test_f1: 0.5482
 epoch: 47, train_loss: 0.7419, test_loss: 0.9268, test_f1: 0.5485
 epoch: 48, train_loss: 0.7258, test_loss: 0.9389, test_f1: 0.5471
 epoch: 49, train_loss: 0.7194, test_loss: 0.8894, test_f1: 0.5616
 epoch: 50, train_loss: 0.7079, test_loss: 0.9081, test_f1: 0.5560
 epoch: 51, train_loss: 0.7150, test_loss: 0.9045, test_f1: 0.5601
 epoch: 52, train_loss: 0.6937, test_loss: 0.9146, test_f1: 0.5603
 epoch: 53, train_loss: 0.6888, test_loss: 0.8941, test_f1: 0.5463
 epoch: 54, train_loss: 0.6907, test_loss: 0.9011, test_f1: 0.5647
 epoch: 55, train_loss: 0.6943, test_loss: 0.9019, test_f1: 0.5584
 epoch: 56, train_loss: 0.6857, test_loss: 0.9132, test_f1: 0.5547
 epoch: 57, train_loss: 0.6901, test_loss: 0.9046, test_f1: 0.5615
 epoch: 58, train_loss: 0.6961, test_loss: 0.8907, test_f1: 0.5653
 epoch: 59, train_loss: 0.6849, test_loss: 0.9138, test_f1: 0.5610
 epoch: 60, train_loss: 0.6697, test_loss: 0.9217, test_f1: 0.5556
 epoch: 61, train_loss: 0.6753, test_loss: 0.9255, test_f1: 0.5595
 epoch: 62, train_loss: 0.6775, test_loss: 0.9482, test_f1: 0.5513
 epoch: 63, train_loss: 0.6801, test_loss: 0.9334, test_f1: 0.5580
 epoch: 64, train_loss: 0.6718, test_loss: 0.9174, test_f1: 0.5523
 epoch: 65, train_loss: 0.6695, test_loss: 0.9228, test_f1: 0.5513
 epoch: 66, train_loss: 0.6792, test_loss: 0.9093, test_f1: 0.5617
 epoch: 67, train_loss: 0.6729, test_loss: 0.9122, test_f1: 0.5626
 epoch: 68, train_loss: 0.6661, test_loss: 0.9425, test_f1: 0.5536
 epoch: 69, train_loss: 0.6522, test_loss: 0.9263, test_f1: 0.5646
 epoch: 70, train_loss: 0.6496, test_loss: 0.9648, test_f1: 0.5553
 epoch: 71, train_loss: 0.6596, test_loss: 0.9318, test_f1: 0.5551
 epoch: 72, train_loss: 0.6722, test_loss: 0.9607, test_f1: 0.5568
 epoch: 73, train_loss: 0.6578, test_loss: 0.9872, test_f1: 0.5604
 epoch: 74, train_loss: 0.6539, test_loss: 0.9701, test_f1: 0.5643
 epoch: 75, train_loss: 0.6578, test_loss: 0.9546, test_f1: 0.5590
 epoch: 76, train_loss: 0.6494, test_loss: 0.9187, test_f1: 0.5631
 epoch: 77, train_loss: 0.6475, test_loss: 0.9887, test_f1: 0.5462
 epoch: 78, train_loss: 0.6486, test_loss: 0.9638, test_f1: 0.5503
 epoch: 79, train_loss: 0.6312, test_loss: 0.9300, test_f1: 0.5553
 epoch: 80, train_loss: 0.6520, test_loss: 0.9686, test_f1: 0.5636
 epoch: 81, train_loss: 0.6541, test_loss: 0.9448, test_f1: 0.5683
 epoch: 82, train_loss: 0.6355, test_loss: 0.9592, test_f1: 0.5662
 epoch: 83, train_loss: 0.6492, test_loss: 0.9661, test_f1: 0.5653
 epoch: 84, train_loss: 0.6379, test_loss: 0.9786, test_f1: 0.5584
 epoch: 85, train_loss: 0.6435, test_loss: 0.9137, test_f1: 0.5703
 epoch: 86, train_loss: 0.6274, test_loss: 0.9345, test_f1: 0.5703
 epoch: 87, train_loss: 0.6392, test_loss: 0.9701, test_f1: 0.5818
 epoch: 88, train_loss: 0.6296, test_loss: 0.9687, test_f1: 0.5818
 epoch: 89, train_loss: 0.6365, test_loss: 0.9702, test_f1: 0.5901
 epoch: 90, train_loss: 0.6424, test_loss: 0.9981, test_f1: 0.5591
 epoch: 91, train_loss: 0.6395, test_loss: 0.9717, test_f1: 0.5736
 epoch: 92, train_loss: 0.6203, test_loss: 0.9936, test_f1: 0.5666
 epoch: 93, train_loss: 0.6258, test_loss: 1.0094, test_f1: 0.5798
 epoch: 94, train_loss: 0.6288, test_loss: 0.9895, test_f1: 0.5815
 epoch: 95, train_loss: 0.6281, test_loss: 0.9760, test_f1: 0.5831
 epoch: 96, train_loss: 0.6251, test_loss: 0.9655, test_f1: 0.5617
 epoch: 97, train_loss: 0.6328, test_loss: 0.9456, test_f1: 0.5873
 epoch: 98, train_loss: 0.6331, test_loss: 0.9803, test_f1: 0.5671
 epoch: 99, train_loss: 0.6051, test_loss: 0.9626, test_f1: 0.5767
##################ITERATION #7 ****************************************
 epoch: 0, train_loss: 1.2737, test_loss: 1.3004, test_f1: 0.2346
 epoch: 1, train_loss: 1.2028, test_loss: 1.2344, test_f1: 0.3341
 epoch: 2, train_loss: 1.1533, test_loss: 1.1246, test_f1: 0.4295
 epoch: 3, train_loss: 1.1233, test_loss: 1.0733, test_f1: 0.4496
 epoch: 4, train_loss: 1.0982, test_loss: 1.0504, test_f1: 0.4539
 epoch: 5, train_loss: 1.0718, test_loss: 1.0316, test_f1: 0.4554
 epoch: 6, train_loss: 1.0451, test_loss: 1.0206, test_f1: 0.4599
 epoch: 7, train_loss: 1.0378, test_loss: 1.0072, test_f1: 0.4638
 epoch: 8, train_loss: 1.0247, test_loss: 1.0070, test_f1: 0.4718
 epoch: 9, train_loss: 1.0081, test_loss: 1.0045, test_f1: 0.4664
 epoch: 10, train_loss: 1.0016, test_loss: 0.9868, test_f1: 0.4757
 epoch: 11, train_loss: 0.9961, test_loss: 0.9845, test_f1: 0.4732
 epoch: 12, train_loss: 0.9814, test_loss: 0.9862, test_f1: 0.4675
 epoch: 13, train_loss: 0.9863, test_loss: 0.9690, test_f1: 0.4903
 epoch: 14, train_loss: 0.9666, test_loss: 0.9652, test_f1: 0.4845
 epoch: 15, train_loss: 0.9633, test_loss: 0.9777, test_f1: 0.4867
 epoch: 16, train_loss: 0.9512, test_loss: 0.9598, test_f1: 0.4885
 epoch: 17, train_loss: 0.9381, test_loss: 0.9788, test_f1: 0.4930
 epoch: 18, train_loss: 0.9344, test_loss: 0.9509, test_f1: 0.5020
 epoch: 19, train_loss: 0.9197, test_loss: 0.9630, test_f1: 0.4865
 epoch: 20, train_loss: 0.9351, test_loss: 0.9667, test_f1: 0.4991
 epoch: 21, train_loss: 0.9273, test_loss: 1.0070, test_f1: 0.4887
 epoch: 22, train_loss: 0.9133, test_loss: 0.9546, test_f1: 0.5124
 epoch: 23, train_loss: 0.9093, test_loss: 0.9572, test_f1: 0.4968
 epoch: 24, train_loss: 0.8886, test_loss: 0.9424, test_f1: 0.5162
 epoch: 25, train_loss: 0.9025, test_loss: 0.9561, test_f1: 0.5112
 epoch: 26, train_loss: 0.8872, test_loss: 0.9452, test_f1: 0.5174
 epoch: 27, train_loss: 0.8793, test_loss: 0.9728, test_f1: 0.5103
 epoch: 28, train_loss: 0.8738, test_loss: 0.9254, test_f1: 0.5254
 epoch: 29, train_loss: 0.8688, test_loss: 0.9540, test_f1: 0.5222
 epoch: 30, train_loss: 0.8628, test_loss: 0.9474, test_f1: 0.5187
 epoch: 31, train_loss: 0.8548, test_loss: 0.9452, test_f1: 0.5229
 epoch: 32, train_loss: 0.8444, test_loss: 0.9420, test_f1: 0.5249
 epoch: 33, train_loss: 0.8535, test_loss: 0.9460, test_f1: 0.5205
 epoch: 34, train_loss: 0.8472, test_loss: 0.9393, test_f1: 0.5196
 epoch: 35, train_loss: 0.8383, test_loss: 0.9637, test_f1: 0.5239
 epoch: 36, train_loss: 0.8290, test_loss: 0.9515, test_f1: 0.5184
 epoch: 37, train_loss: 0.8311, test_loss: 0.9329, test_f1: 0.5154
 epoch: 38, train_loss: 0.8268, test_loss: 0.9252, test_f1: 0.5226
 epoch: 39, train_loss: 0.8153, test_loss: 0.9487, test_f1: 0.5167
 epoch: 40, train_loss: 0.8044, test_loss: 0.9117, test_f1: 0.5220
 epoch: 41, train_loss: 0.8127, test_loss: 0.9483, test_f1: 0.5182
 epoch: 42, train_loss: 0.7913, test_loss: 0.9249, test_f1: 0.5295
 epoch: 43, train_loss: 0.8027, test_loss: 0.9664, test_f1: 0.5406
 epoch: 44, train_loss: 0.7942, test_loss: 0.9355, test_f1: 0.5264
 epoch: 45, train_loss: 0.7971, test_loss: 0.9190, test_f1: 0.5347
 epoch: 46, train_loss: 0.7837, test_loss: 0.9479, test_f1: 0.5315
 epoch: 47, train_loss: 0.7712, test_loss: 0.9403, test_f1: 0.5390
 epoch: 48, train_loss: 0.7812, test_loss: 0.9608, test_f1: 0.5264
 epoch: 49, train_loss: 0.7761, test_loss: 0.9717, test_f1: 0.5045
 epoch: 50, train_loss: 0.7628, test_loss: 0.9563, test_f1: 0.5060
 epoch: 51, train_loss: 0.7599, test_loss: 0.9590, test_f1: 0.5145
 epoch: 52, train_loss: 0.7495, test_loss: 0.9593, test_f1: 0.5158
 epoch: 53, train_loss: 0.7479, test_loss: 0.9702, test_f1: 0.5099
 epoch: 54, train_loss: 0.7457, test_loss: 0.9525, test_f1: 0.5210
 epoch: 55, train_loss: 0.7413, test_loss: 0.9579, test_f1: 0.5333
 epoch: 56, train_loss: 0.7387, test_loss: 0.9447, test_f1: 0.5260
 epoch: 57, train_loss: 0.7372, test_loss: 0.9657, test_f1: 0.5185
 epoch: 58, train_loss: 0.7381, test_loss: 0.9493, test_f1: 0.5324
 epoch: 59, train_loss: 0.7502, test_loss: 0.9706, test_f1: 0.5259
 epoch: 60, train_loss: 0.7411, test_loss: 0.9573, test_f1: 0.5415
 epoch: 61, train_loss: 0.7401, test_loss: 0.9614, test_f1: 0.5225
 epoch: 62, train_loss: 0.7322, test_loss: 0.9574, test_f1: 0.5149
 epoch: 63, train_loss: 0.7396, test_loss: 0.9648, test_f1: 0.5296
 epoch: 64, train_loss: 0.7262, test_loss: 0.9560, test_f1: 0.5221
 epoch: 65, train_loss: 0.7325, test_loss: 0.9524, test_f1: 0.5272
 epoch: 66, train_loss: 0.7152, test_loss: 0.9468, test_f1: 0.5315
 epoch: 67, train_loss: 0.7262, test_loss: 0.9552, test_f1: 0.5113
 epoch: 68, train_loss: 0.7244, test_loss: 0.9483, test_f1: 0.5265
 epoch: 69, train_loss: 0.7160, test_loss: 0.9632, test_f1: 0.5278
 epoch: 70, train_loss: 0.7116, test_loss: 0.9768, test_f1: 0.5291
 epoch: 71, train_loss: 0.7150, test_loss: 0.9696, test_f1: 0.5144
 epoch: 72, train_loss: 0.6993, test_loss: 0.9757, test_f1: 0.5177
 epoch: 73, train_loss: 0.7087, test_loss: 0.9672, test_f1: 0.5229
 epoch: 74, train_loss: 0.7077, test_loss: 0.9706, test_f1: 0.5214
 epoch: 75, train_loss: 0.6963, test_loss: 0.9853, test_f1: 0.5184
 epoch: 76, train_loss: 0.7047, test_loss: 0.9564, test_f1: 0.5391
 epoch: 77, train_loss: 0.7021, test_loss: 0.9359, test_f1: 0.5236
 epoch: 78, train_loss: 0.6918, test_loss: 0.9394, test_f1: 0.5401
 epoch: 79, train_loss: 0.7003, test_loss: 0.9727, test_f1: 0.5239
 epoch: 80, train_loss: 0.7010, test_loss: 0.9781, test_f1: 0.5244
 epoch: 81, train_loss: 0.7037, test_loss: 0.9785, test_f1: 0.5242
 epoch: 82, train_loss: 0.6831, test_loss: 0.9361, test_f1: 0.5275
 epoch: 83, train_loss: 0.7010, test_loss: 0.9490, test_f1: 0.5336
 epoch: 84, train_loss: 0.6968, test_loss: 0.9432, test_f1: 0.5238
 epoch: 85, train_loss: 0.6863, test_loss: 0.9754, test_f1: 0.5266
 epoch: 86, train_loss: 0.6968, test_loss: 0.9623, test_f1: 0.5277
 epoch: 87, train_loss: 0.6756, test_loss: 0.9573, test_f1: 0.5408
 epoch: 88, train_loss: 0.6856, test_loss: 0.9851, test_f1: 0.5202
 epoch: 89, train_loss: 0.6865, test_loss: 0.9799, test_f1: 0.5245
 epoch: 90, train_loss: 0.6868, test_loss: 0.9850, test_f1: 0.5277
 epoch: 91, train_loss: 0.6932, test_loss: 1.0069, test_f1: 0.5299
 epoch: 92, train_loss: 0.6842, test_loss: 1.0039, test_f1: 0.5276
 epoch: 93, train_loss: 0.6762, test_loss: 1.0065, test_f1: 0.5327
 epoch: 94, train_loss: 0.6820, test_loss: 0.9680, test_f1: 0.5433
 epoch: 95, train_loss: 0.6742, test_loss: 1.0020, test_f1: 0.5365
 epoch: 96, train_loss: 0.6722, test_loss: 1.0135, test_f1: 0.5353
 epoch: 97, train_loss: 0.6714, test_loss: 1.0029, test_f1: 0.5430
 epoch: 98, train_loss: 0.6615, test_loss: 1.0044, test_f1: 0.5354
 epoch: 99, train_loss: 0.6650, test_loss: 1.0012, test_f1: 0.5238
##################ITERATION #8 ****************************************
 epoch: 0, train_loss: 1.2622, test_loss: 1.2634, test_f1: 0.2260
 epoch: 1, train_loss: 1.1845, test_loss: 1.1429, test_f1: 0.3821
 epoch: 2, train_loss: 1.1440, test_loss: 1.0748, test_f1: 0.4107
 epoch: 3, train_loss: 1.1123, test_loss: 1.0341, test_f1: 0.4671
 epoch: 4, train_loss: 1.0957, test_loss: 1.0215, test_f1: 0.4742
 epoch: 5, train_loss: 1.0727, test_loss: 1.0017, test_f1: 0.4998
 epoch: 6, train_loss: 1.0573, test_loss: 0.9903, test_f1: 0.4915
 epoch: 7, train_loss: 1.0469, test_loss: 0.9824, test_f1: 0.4851
 epoch: 8, train_loss: 1.0224, test_loss: 0.9897, test_f1: 0.4695
 epoch: 9, train_loss: 1.0339, test_loss: 0.9857, test_f1: 0.4750
 epoch: 10, train_loss: 1.0151, test_loss: 0.9868, test_f1: 0.4849
 epoch: 11, train_loss: 0.9942, test_loss: 0.9747, test_f1: 0.4731
 epoch: 12, train_loss: 0.9919, test_loss: 0.9606, test_f1: 0.4856
 epoch: 13, train_loss: 0.9777, test_loss: 0.9592, test_f1: 0.4751
 epoch: 14, train_loss: 0.9708, test_loss: 0.9434, test_f1: 0.4856
 epoch: 15, train_loss: 0.9631, test_loss: 0.9369, test_f1: 0.4874
 epoch: 16, train_loss: 0.9618, test_loss: 0.9490, test_f1: 0.4856
 epoch: 17, train_loss: 0.9477, test_loss: 0.9493, test_f1: 0.4870
 epoch: 18, train_loss: 0.9393, test_loss: 0.9361, test_f1: 0.4912
 epoch: 19, train_loss: 0.9232, test_loss: 0.9408, test_f1: 0.4832
 epoch: 20, train_loss: 0.9295, test_loss: 0.9377, test_f1: 0.4839
 epoch: 21, train_loss: 0.9260, test_loss: 0.9264, test_f1: 0.4926
 epoch: 22, train_loss: 0.9144, test_loss: 0.9295, test_f1: 0.4764
 epoch: 23, train_loss: 0.9120, test_loss: 0.9464, test_f1: 0.4748
 epoch: 24, train_loss: 0.9067, test_loss: 0.9339, test_f1: 0.4902
 epoch: 25, train_loss: 0.9034, test_loss: 0.9367, test_f1: 0.4862
 epoch: 26, train_loss: 0.8894, test_loss: 0.9336, test_f1: 0.4979
 epoch: 27, train_loss: 0.8814, test_loss: 0.9171, test_f1: 0.5097
 epoch: 28, train_loss: 0.8794, test_loss: 0.9223, test_f1: 0.4937
 epoch: 29, train_loss: 0.8760, test_loss: 0.9194, test_f1: 0.4984
 epoch: 30, train_loss: 0.8708, test_loss: 0.9313, test_f1: 0.4961
 epoch: 31, train_loss: 0.8614, test_loss: 0.9479, test_f1: 0.5099
 epoch: 32, train_loss: 0.8424, test_loss: 0.9339, test_f1: 0.5344
 epoch: 33, train_loss: 0.8623, test_loss: 0.9179, test_f1: 0.5390
 epoch: 34, train_loss: 0.8461, test_loss: 0.9121, test_f1: 0.5424
 epoch: 35, train_loss: 0.8401, test_loss: 0.9191, test_f1: 0.5436
 epoch: 36, train_loss: 0.8411, test_loss: 0.9188, test_f1: 0.5361
 epoch: 37, train_loss: 0.8323, test_loss: 0.9219, test_f1: 0.5385
 epoch: 38, train_loss: 0.8393, test_loss: 0.9156, test_f1: 0.5469
 epoch: 39, train_loss: 0.8233, test_loss: 0.8997, test_f1: 0.5431
 epoch: 40, train_loss: 0.8244, test_loss: 0.9434, test_f1: 0.5308
 epoch: 41, train_loss: 0.8024, test_loss: 0.9354, test_f1: 0.5336
 epoch: 42, train_loss: 0.8117, test_loss: 0.9349, test_f1: 0.5313
 epoch: 43, train_loss: 0.7903, test_loss: 0.9662, test_f1: 0.5056
 epoch: 44, train_loss: 0.7936, test_loss: 0.9138, test_f1: 0.5455
 epoch: 45, train_loss: 0.7961, test_loss: 0.9280, test_f1: 0.5410
 epoch: 46, train_loss: 0.7924, test_loss: 0.8752, test_f1: 0.5424
 epoch: 47, train_loss: 0.7892, test_loss: 0.9262, test_f1: 0.5373
 epoch: 48, train_loss: 0.7798, test_loss: 0.9397, test_f1: 0.5291
 epoch: 49, train_loss: 0.7770, test_loss: 0.9399, test_f1: 0.5438
 epoch: 50, train_loss: 0.7715, test_loss: 0.9377, test_f1: 0.5502
 epoch: 51, train_loss: 0.7611, test_loss: 0.9215, test_f1: 0.5387
 epoch: 52, train_loss: 0.7642, test_loss: 0.9154, test_f1: 0.5386
 epoch: 53, train_loss: 0.7607, test_loss: 0.9087, test_f1: 0.5509
 epoch: 54, train_loss: 0.7543, test_loss: 0.9451, test_f1: 0.5450
 epoch: 55, train_loss: 0.7455, test_loss: 0.9349, test_f1: 0.5321
 epoch: 56, train_loss: 0.7514, test_loss: 0.9269, test_f1: 0.5409
 epoch: 57, train_loss: 0.7572, test_loss: 0.9378, test_f1: 0.5413
 epoch: 58, train_loss: 0.7407, test_loss: 0.9311, test_f1: 0.5414
 epoch: 59, train_loss: 0.7431, test_loss: 0.9251, test_f1: 0.5500
 epoch: 60, train_loss: 0.7370, test_loss: 0.9271, test_f1: 0.5380
 epoch: 61, train_loss: 0.7319, test_loss: 0.9600, test_f1: 0.5454
 epoch: 62, train_loss: 0.7612, test_loss: 0.9485, test_f1: 0.5424
 epoch: 63, train_loss: 0.7406, test_loss: 0.9386, test_f1: 0.5455
 epoch: 64, train_loss: 0.7456, test_loss: 0.9503, test_f1: 0.5465
 epoch: 65, train_loss: 0.7316, test_loss: 0.9388, test_f1: 0.5417
 epoch: 66, train_loss: 0.7331, test_loss: 0.9493, test_f1: 0.5499
 epoch: 67, train_loss: 0.7226, test_loss: 0.9068, test_f1: 0.5558
 epoch: 68, train_loss: 0.7323, test_loss: 0.9295, test_f1: 0.5385
 epoch: 69, train_loss: 0.7249, test_loss: 0.9157, test_f1: 0.5507
 epoch: 70, train_loss: 0.7200, test_loss: 0.9303, test_f1: 0.5602
 epoch: 71, train_loss: 0.7205, test_loss: 0.9617, test_f1: 0.5526
 epoch: 72, train_loss: 0.7161, test_loss: 0.9397, test_f1: 0.5385
 epoch: 73, train_loss: 0.6977, test_loss: 0.9351, test_f1: 0.5452
 epoch: 74, train_loss: 0.7145, test_loss: 0.9525, test_f1: 0.5465
 epoch: 75, train_loss: 0.7244, test_loss: 0.9261, test_f1: 0.5478
 epoch: 76, train_loss: 0.7198, test_loss: 0.9566, test_f1: 0.5414
 epoch: 77, train_loss: 0.7044, test_loss: 0.9387, test_f1: 0.5480
 epoch: 78, train_loss: 0.7069, test_loss: 0.9598, test_f1: 0.5437
 epoch: 79, train_loss: 0.7046, test_loss: 0.9387, test_f1: 0.5504
 epoch: 80, train_loss: 0.7089, test_loss: 0.9522, test_f1: 0.5467
 epoch: 81, train_loss: 0.6915, test_loss: 0.9339, test_f1: 0.5411
 epoch: 82, train_loss: 0.7006, test_loss: 0.9391, test_f1: 0.5445
 epoch: 83, train_loss: 0.6877, test_loss: 0.9285, test_f1: 0.5552
 epoch: 84, train_loss: 0.7149, test_loss: 0.9329, test_f1: 0.5431
 epoch: 85, train_loss: 0.6897, test_loss: 0.9572, test_f1: 0.5551
 epoch: 86, train_loss: 0.7020, test_loss: 0.9371, test_f1: 0.5583
 epoch: 87, train_loss: 0.7042, test_loss: 0.9155, test_f1: 0.5575
 epoch: 88, train_loss: 0.6813, test_loss: 0.9612, test_f1: 0.5476
 epoch: 89, train_loss: 0.6925, test_loss: 0.9400, test_f1: 0.5517
 epoch: 90, train_loss: 0.6975, test_loss: 0.9752, test_f1: 0.5473
 epoch: 91, train_loss: 0.6853, test_loss: 0.9623, test_f1: 0.5550
 epoch: 92, train_loss: 0.6893, test_loss: 0.9427, test_f1: 0.5473
 epoch: 93, train_loss: 0.6775, test_loss: 0.9740, test_f1: 0.5427
 epoch: 94, train_loss: 0.6885, test_loss: 0.9537, test_f1: 0.5446
 epoch: 95, train_loss: 0.6835, test_loss: 0.9506, test_f1: 0.5486
 epoch: 96, train_loss: 0.6835, test_loss: 0.9752, test_f1: 0.5526
 epoch: 97, train_loss: 0.6803, test_loss: 0.9763, test_f1: 0.5571
 epoch: 98, train_loss: 0.6713, test_loss: 0.9542, test_f1: 0.5567
 epoch: 99, train_loss: 0.6782, test_loss: 0.9619, test_f1: 0.5578
##################ITERATION #9 ****************************************
 epoch: 0, train_loss: 1.2831, test_loss: 1.2697, test_f1: 0.3119
 epoch: 1, train_loss: 1.1728, test_loss: 1.1718, test_f1: 0.3742
 epoch: 2, train_loss: 1.1358, test_loss: 1.0717, test_f1: 0.4856
 epoch: 3, train_loss: 1.1017, test_loss: 1.0365, test_f1: 0.4771
 epoch: 4, train_loss: 1.0818, test_loss: 1.0257, test_f1: 0.4644
 epoch: 5, train_loss: 1.0533, test_loss: 1.0082, test_f1: 0.4898
 epoch: 6, train_loss: 1.0413, test_loss: 0.9915, test_f1: 0.4859
 epoch: 7, train_loss: 1.0210, test_loss: 0.9859, test_f1: 0.4765
 epoch: 8, train_loss: 1.0110, test_loss: 0.9844, test_f1: 0.4866
 epoch: 9, train_loss: 0.9959, test_loss: 0.9653, test_f1: 0.4924
 epoch: 10, train_loss: 0.9881, test_loss: 0.9615, test_f1: 0.5046
 epoch: 11, train_loss: 0.9714, test_loss: 0.9529, test_f1: 0.4976
 epoch: 12, train_loss: 0.9708, test_loss: 0.9450, test_f1: 0.5022
 epoch: 13, train_loss: 0.9550, test_loss: 0.9393, test_f1: 0.5119
 epoch: 14, train_loss: 0.9383, test_loss: 0.9458, test_f1: 0.5096
 epoch: 15, train_loss: 0.9319, test_loss: 0.9266, test_f1: 0.5080
 epoch: 16, train_loss: 0.9131, test_loss: 0.9406, test_f1: 0.5006
 epoch: 17, train_loss: 0.9169, test_loss: 0.9269, test_f1: 0.5254
 epoch: 18, train_loss: 0.8987, test_loss: 0.9417, test_f1: 0.5134
 epoch: 19, train_loss: 0.8959, test_loss: 0.9426, test_f1: 0.5322
 epoch: 20, train_loss: 0.8955, test_loss: 0.9403, test_f1: 0.5220
 epoch: 21, train_loss: 0.8865, test_loss: 0.9458, test_f1: 0.5262
 epoch: 22, train_loss: 0.8690, test_loss: 0.9412, test_f1: 0.5297
 epoch: 23, train_loss: 0.8612, test_loss: 0.9350, test_f1: 0.5358
 epoch: 24, train_loss: 0.8665, test_loss: 0.9381, test_f1: 0.5137
 epoch: 25, train_loss: 0.8545, test_loss: 0.9267, test_f1: 0.5295
 epoch: 26, train_loss: 0.8468, test_loss: 0.9414, test_f1: 0.5214
 epoch: 27, train_loss: 0.8456, test_loss: 0.9300, test_f1: 0.5479
 epoch: 28, train_loss: 0.8274, test_loss: 0.9312, test_f1: 0.5278
 epoch: 29, train_loss: 0.8275, test_loss: 0.9175, test_f1: 0.5445
 epoch: 30, train_loss: 0.8295, test_loss: 0.9353, test_f1: 0.5358
 epoch: 31, train_loss: 0.8237, test_loss: 0.9382, test_f1: 0.5321
 epoch: 32, train_loss: 0.8068, test_loss: 0.9376, test_f1: 0.5306
 epoch: 33, train_loss: 0.8073, test_loss: 0.9410, test_f1: 0.5305
 epoch: 34, train_loss: 0.7965, test_loss: 0.9430, test_f1: 0.5357
 epoch: 35, train_loss: 0.7976, test_loss: 0.9371, test_f1: 0.5360
 epoch: 36, train_loss: 0.7904, test_loss: 0.9540, test_f1: 0.5440
 epoch: 37, train_loss: 0.7926, test_loss: 0.9529, test_f1: 0.5299
 epoch: 38, train_loss: 0.7846, test_loss: 0.9284, test_f1: 0.5456
 epoch: 39, train_loss: 0.7698, test_loss: 0.9468, test_f1: 0.5427
 epoch: 40, train_loss: 0.7680, test_loss: 0.9584, test_f1: 0.5279
 epoch: 41, train_loss: 0.7657, test_loss: 0.9772, test_f1: 0.5314
 epoch: 42, train_loss: 0.7647, test_loss: 0.9405, test_f1: 0.5463
 epoch: 43, train_loss: 0.7579, test_loss: 0.9667, test_f1: 0.5320
 epoch: 44, train_loss: 0.7592, test_loss: 0.9525, test_f1: 0.5505
 epoch: 45, train_loss: 0.7385, test_loss: 0.9703, test_f1: 0.5473
 epoch: 46, train_loss: 0.7491, test_loss: 0.9574, test_f1: 0.5391
 epoch: 47, train_loss: 0.7287, test_loss: 0.9457, test_f1: 0.5435
 epoch: 48, train_loss: 0.7327, test_loss: 0.9642, test_f1: 0.5334
 epoch: 49, train_loss: 0.7419, test_loss: 0.9691, test_f1: 0.5422
 epoch: 50, train_loss: 0.7271, test_loss: 0.9586, test_f1: 0.5546
 epoch: 51, train_loss: 0.7293, test_loss: 0.9687, test_f1: 0.5458
 epoch: 52, train_loss: 0.7192, test_loss: 0.9799, test_f1: 0.5341
 epoch: 53, train_loss: 0.7157, test_loss: 0.9553, test_f1: 0.5495
 epoch: 54, train_loss: 0.7187, test_loss: 0.9735, test_f1: 0.5446
 epoch: 55, train_loss: 0.7041, test_loss: 0.9720, test_f1: 0.5437
 epoch: 56, train_loss: 0.7078, test_loss: 0.9968, test_f1: 0.5359
 epoch: 57, train_loss: 0.6999, test_loss: 0.9905, test_f1: 0.5420
 epoch: 58, train_loss: 0.7064, test_loss: 0.9904, test_f1: 0.5398
 epoch: 59, train_loss: 0.6951, test_loss: 0.9839, test_f1: 0.5405
 epoch: 60, train_loss: 0.7020, test_loss: 0.9857, test_f1: 0.5405
 epoch: 61, train_loss: 0.6956, test_loss: 0.9710, test_f1: 0.5484
 epoch: 62, train_loss: 0.6906, test_loss: 0.9773, test_f1: 0.5429
 epoch: 63, train_loss: 0.6933, test_loss: 0.9872, test_f1: 0.5414
 epoch: 64, train_loss: 0.6998, test_loss: 1.0198, test_f1: 0.5437
 epoch: 65, train_loss: 0.6981, test_loss: 0.9952, test_f1: 0.5387
 epoch: 66, train_loss: 0.6985, test_loss: 1.0028, test_f1: 0.5436
 epoch: 67, train_loss: 0.6903, test_loss: 1.0017, test_f1: 0.5388
 epoch: 68, train_loss: 0.6790, test_loss: 1.0016, test_f1: 0.5323
 epoch: 69, train_loss: 0.6759, test_loss: 0.9865, test_f1: 0.5607
 epoch: 70, train_loss: 0.6812, test_loss: 1.0062, test_f1: 0.5508
 epoch: 71, train_loss: 0.6752, test_loss: 1.0125, test_f1: 0.5458
 epoch: 72, train_loss: 0.6718, test_loss: 1.0069, test_f1: 0.5479
 epoch: 73, train_loss: 0.6822, test_loss: 1.0028, test_f1: 0.5481
 epoch: 74, train_loss: 0.6750, test_loss: 1.0216, test_f1: 0.5447
 epoch: 75, train_loss: 0.6706, test_loss: 0.9948, test_f1: 0.5555
 epoch: 76, train_loss: 0.6744, test_loss: 1.0106, test_f1: 0.5426
 epoch: 77, train_loss: 0.6838, test_loss: 0.9963, test_f1: 0.5558
 epoch: 78, train_loss: 0.6686, test_loss: 0.9977, test_f1: 0.5560
 epoch: 79, train_loss: 0.6743, test_loss: 1.0078, test_f1: 0.5462
 epoch: 80, train_loss: 0.6677, test_loss: 1.0007, test_f1: 0.5362
 epoch: 81, train_loss: 0.6618, test_loss: 1.0180, test_f1: 0.5335
 epoch: 82, train_loss: 0.6723, test_loss: 1.0052, test_f1: 0.5460
 epoch: 83, train_loss: 0.6559, test_loss: 1.0110, test_f1: 0.5514
 epoch: 84, train_loss: 0.6554, test_loss: 1.0127, test_f1: 0.5492
 epoch: 85, train_loss: 0.6563, test_loss: 1.0291, test_f1: 0.5410
 epoch: 86, train_loss: 0.6466, test_loss: 1.0249, test_f1: 0.5428
 epoch: 87, train_loss: 0.6565, test_loss: 1.0398, test_f1: 0.5317
 epoch: 88, train_loss: 0.6332, test_loss: 1.0504, test_f1: 0.5314
 epoch: 89, train_loss: 0.6575, test_loss: 1.0531, test_f1: 0.5437
 epoch: 90, train_loss: 0.6528, test_loss: 1.0804, test_f1: 0.5398
 epoch: 91, train_loss: 0.6540, test_loss: 1.0313, test_f1: 0.5364
 epoch: 92, train_loss: 0.6503, test_loss: 1.0107, test_f1: 0.5580
 epoch: 93, train_loss: 0.6394, test_loss: 1.0269, test_f1: 0.5383
 epoch: 94, train_loss: 0.6424, test_loss: 1.0564, test_f1: 0.5301
 epoch: 95, train_loss: 0.6507, test_loss: 1.0273, test_f1: 0.5505
 epoch: 96, train_loss: 0.6460, test_loss: 1.0550, test_f1: 0.5363
 epoch: 97, train_loss: 0.6340, test_loss: 1.0535, test_f1: 0.5438
 epoch: 98, train_loss: 0.6250, test_loss: 1.0376, test_f1: 0.5451
 epoch: 99, train_loss: 0.6532, test_loss: 1.0262, test_f1: 0.5424

Training completed in 586.24 seconds
Best F1: 0.5901 at epoch 89
Mean F1 across iterations: 0.5632  0.0190
========================FINAL RESULTS================================
FEGIN weighted F1: 0.5901  0.0190
python main.py --data ltspice_examples --representation component_pin --model FEGIN --layers 6 --hiddens 64 --batch_size 128 --lr 0.0001 --emb_size 250 --epochs 100 --save_appendix component_pin_L6_H64_BS128_LR0.0001_E250 --no_val
-----



STDERR:
  File "main.py", line 370, in <module>
    main()
  File "main.py", line 254, in main
    dataset = dataset_class(
  File "/home/philip/projects/ltspice_examples_code_repo/Circuit-Completion-Using-GNNs/component_classification_with_link_prediction_head/evaluation/FEGIN/kernel/circuit_datasets.py", line 15, in __init__
    self.data, self.slices = torch.load(self.processed_paths[0])
  File "/home/philip/.local/lib/python3.8/site-packages/torch/serialization.py", line 1040, in load
    warnings.warn(
  File "/usr/lib/python3.8/warnings.py", line 109, in _showwarnmsg
    sw(msg.message, msg.category, msg.filename, msg.lineno,
  File "main.py", line 47, in warn_with_traceback
    traceback.print_stack(file=log)
/home/philip/projects/ltspice_examples_code_repo/Circuit-Completion-Using-GNNs/component_classification_with_link_prediction_head/evaluation/FEGIN/kernel/circuit_datasets.py:15: FutureWarning: You are using `torch.load` with `weights_only=False` (the current default value), which uses the default pickle module implicitly. It is possible to construct malicious pickle data which will execute arbitrary code during unpickling (See https://github.com/pytorch/pytorch/blob/main/SECURITY.md#untrusted-models for more details). In a future release, the default value for `weights_only` will be flipped to `True`. This limits the functions that could be executed during unpickling. Arbitrary objects will no longer be allowed to be loaded via this mode unless they are explicitly allowlisted by the user via `torch.serialization.add_safe_globals`. We recommend you start setting `weights_only=True` for any use case where you don't have full control of the loaded file. Please open an issue on GitHub for any issues related to this experimental feature.
  self.data, self.slices = torch.load(self.processed_paths[0])
