STDOUT:
Results will be saved in /home/philip/projects/ltspice_examples_code_repo/Circuit-Completion-Using-GNNs/component_classification_with_link_prediction_head/evaluation/FEGIN/results/model_FEGIN_dataset_ltspice_examples
Command line input: python main.py --data ltspice_examples --representation component_component --model FEGIN --layers 2 --hiddens 128 --batch_size 32 --lr 0.0001 --emb_size 250 --epochs 100 --save_appendix component_component_L2_H128_BS32_LR0.0001_E250 --no_val
 is saved.
-----
ltspice_examples - FEGIN
Using 2 layers, 128 hidden units, h = 2
Loading component_component representation dataset
ENTERED
Training FEGIN on component_component representation
Train: 3556, Test: 845
##################ITERATION #0 ****************************************
 epoch: 0, train_loss: 1.3325, test_loss: 1.2692, test_f1: 0.2274
 epoch: 1, train_loss: 1.2562, test_loss: 1.2239, test_f1: 0.2274
 epoch: 2, train_loss: 1.2237, test_loss: 1.1883, test_f1: 0.3284
 epoch: 3, train_loss: 1.1908, test_loss: 1.1632, test_f1: 0.3547
 epoch: 4, train_loss: 1.1616, test_loss: 1.1299, test_f1: 0.4619
 epoch: 5, train_loss: 1.1307, test_loss: 1.1050, test_f1: 0.4482
 epoch: 6, train_loss: 1.1045, test_loss: 1.0694, test_f1: 0.4498
 epoch: 7, train_loss: 1.0876, test_loss: 1.0470, test_f1: 0.4748
 epoch: 8, train_loss: 1.0598, test_loss: 1.0390, test_f1: 0.4760
 epoch: 9, train_loss: 1.0477, test_loss: 1.0141, test_f1: 0.4675
 epoch: 10, train_loss: 1.0256, test_loss: 1.0008, test_f1: 0.4529
 epoch: 11, train_loss: 1.0029, test_loss: 1.0169, test_f1: 0.4653
 epoch: 12, train_loss: 0.9900, test_loss: 0.9828, test_f1: 0.4797
 epoch: 13, train_loss: 0.9846, test_loss: 0.9737, test_f1: 0.4964
 epoch: 14, train_loss: 0.9620, test_loss: 0.9746, test_f1: 0.5084
 epoch: 15, train_loss: 0.9575, test_loss: 0.9810, test_f1: 0.4940
 epoch: 16, train_loss: 0.9510, test_loss: 0.9782, test_f1: 0.5107
 epoch: 17, train_loss: 0.9336, test_loss: 0.9633, test_f1: 0.5137
 epoch: 18, train_loss: 0.9337, test_loss: 0.9912, test_f1: 0.4912
 epoch: 19, train_loss: 0.9235, test_loss: 0.9539, test_f1: 0.5227
 epoch: 20, train_loss: 0.9188, test_loss: 0.9814, test_f1: 0.5133
 epoch: 21, train_loss: 0.9019, test_loss: 0.9787, test_f1: 0.5194
 epoch: 22, train_loss: 0.8985, test_loss: 0.9822, test_f1: 0.5112
 epoch: 23, train_loss: 0.8949, test_loss: 0.9872, test_f1: 0.5276
 epoch: 24, train_loss: 0.8852, test_loss: 1.0002, test_f1: 0.5305
 epoch: 25, train_loss: 0.8732, test_loss: 1.0214, test_f1: 0.5125
 epoch: 26, train_loss: 0.8749, test_loss: 1.0142, test_f1: 0.5192
 epoch: 27, train_loss: 0.8715, test_loss: 1.0000, test_f1: 0.5074
 epoch: 28, train_loss: 0.8679, test_loss: 0.9932, test_f1: 0.5256
 epoch: 29, train_loss: 0.8432, test_loss: 1.0126, test_f1: 0.4913
 epoch: 30, train_loss: 0.8474, test_loss: 1.0051, test_f1: 0.4907
 epoch: 31, train_loss: 0.8324, test_loss: 1.0724, test_f1: 0.4982
 epoch: 32, train_loss: 0.8329, test_loss: 1.0385, test_f1: 0.5249
 epoch: 33, train_loss: 0.8259, test_loss: 1.0394, test_f1: 0.5115
 epoch: 34, train_loss: 0.8243, test_loss: 1.0611, test_f1: 0.5127
 epoch: 35, train_loss: 0.8112, test_loss: 1.1051, test_f1: 0.5012
 epoch: 36, train_loss: 0.8196, test_loss: 1.0716, test_f1: 0.5226
 epoch: 37, train_loss: 0.8073, test_loss: 1.0526, test_f1: 0.5088
 epoch: 38, train_loss: 0.8085, test_loss: 1.0872, test_f1: 0.5061
 epoch: 39, train_loss: 0.8060, test_loss: 1.0649, test_f1: 0.5168
 epoch: 40, train_loss: 0.7905, test_loss: 1.1416, test_f1: 0.4906
 epoch: 41, train_loss: 0.7969, test_loss: 1.1069, test_f1: 0.5192
 epoch: 42, train_loss: 0.7831, test_loss: 1.0788, test_f1: 0.5152
 epoch: 43, train_loss: 0.7757, test_loss: 1.1667, test_f1: 0.4916
 epoch: 44, train_loss: 0.7769, test_loss: 1.0996, test_f1: 0.5000
 epoch: 45, train_loss: 0.7633, test_loss: 1.0967, test_f1: 0.4937
 epoch: 46, train_loss: 0.7668, test_loss: 1.1278, test_f1: 0.4972
 epoch: 47, train_loss: 0.7449, test_loss: 1.1101, test_f1: 0.5230
 epoch: 48, train_loss: 0.7515, test_loss: 1.1321, test_f1: 0.5221
 epoch: 49, train_loss: 0.7498, test_loss: 1.1064, test_f1: 0.5219
 epoch: 50, train_loss: 0.7338, test_loss: 1.1611, test_f1: 0.5104
 epoch: 51, train_loss: 0.7302, test_loss: 1.1792, test_f1: 0.5102
 epoch: 52, train_loss: 0.7241, test_loss: 1.1660, test_f1: 0.5117
 epoch: 53, train_loss: 0.7191, test_loss: 1.2026, test_f1: 0.5269
 epoch: 54, train_loss: 0.7022, test_loss: 1.1364, test_f1: 0.5067
 epoch: 55, train_loss: 0.7187, test_loss: 1.1887, test_f1: 0.5076
 epoch: 56, train_loss: 0.7112, test_loss: 1.2100, test_f1: 0.4975
 epoch: 57, train_loss: 0.7174, test_loss: 1.2429, test_f1: 0.4944
 epoch: 58, train_loss: 0.7115, test_loss: 1.1644, test_f1: 0.5402
 epoch: 59, train_loss: 0.7050, test_loss: 1.2033, test_f1: 0.5155
 epoch: 60, train_loss: 0.7001, test_loss: 1.1748, test_f1: 0.5237
 epoch: 61, train_loss: 0.6980, test_loss: 1.2420, test_f1: 0.5148
 epoch: 62, train_loss: 0.7017, test_loss: 1.2101, test_f1: 0.5388
 epoch: 63, train_loss: 0.6961, test_loss: 1.2400, test_f1: 0.5189
 epoch: 64, train_loss: 0.6852, test_loss: 1.2268, test_f1: 0.5076
 epoch: 65, train_loss: 0.6753, test_loss: 1.1817, test_f1: 0.5406
 epoch: 66, train_loss: 0.6941, test_loss: 1.2565, test_f1: 0.5006
 epoch: 67, train_loss: 0.6900, test_loss: 1.2331, test_f1: 0.5417
 epoch: 68, train_loss: 0.6687, test_loss: 1.2033, test_f1: 0.5102
 epoch: 69, train_loss: 0.6913, test_loss: 1.2257, test_f1: 0.5274
 epoch: 70, train_loss: 0.6749, test_loss: 1.2371, test_f1: 0.5273
 epoch: 71, train_loss: 0.6637, test_loss: 1.2460, test_f1: 0.5101
 epoch: 72, train_loss: 0.6760, test_loss: 1.2189, test_f1: 0.5224
 epoch: 73, train_loss: 0.6761, test_loss: 1.2514, test_f1: 0.5281
 epoch: 74, train_loss: 0.6759, test_loss: 1.2338, test_f1: 0.5224
 epoch: 75, train_loss: 0.6696, test_loss: 1.2518, test_f1: 0.5266
 epoch: 76, train_loss: 0.6660, test_loss: 1.3074, test_f1: 0.5215
 epoch: 77, train_loss: 0.6693, test_loss: 1.2686, test_f1: 0.5293
 epoch: 78, train_loss: 0.6631, test_loss: 1.2068, test_f1: 0.5308
 epoch: 79, train_loss: 0.6658, test_loss: 1.2528, test_f1: 0.5524
 epoch: 80, train_loss: 0.6606, test_loss: 1.2780, test_f1: 0.5237
 epoch: 81, train_loss: 0.6558, test_loss: 1.2328, test_f1: 0.5536
 epoch: 82, train_loss: 0.6561, test_loss: 1.2377, test_f1: 0.5493
 epoch: 83, train_loss: 0.6565, test_loss: 1.2836, test_f1: 0.5345
 epoch: 84, train_loss: 0.6620, test_loss: 1.3056, test_f1: 0.5142
 epoch: 85, train_loss: 0.6513, test_loss: 1.2683, test_f1: 0.5261
 epoch: 86, train_loss: 0.6353, test_loss: 1.2628, test_f1: 0.5178
 epoch: 87, train_loss: 0.6487, test_loss: 1.3192, test_f1: 0.5335
 epoch: 88, train_loss: 0.6487, test_loss: 1.3133, test_f1: 0.5167
 epoch: 89, train_loss: 0.6351, test_loss: 1.2924, test_f1: 0.5236
 epoch: 90, train_loss: 0.6322, test_loss: 1.3535, test_f1: 0.5383
 epoch: 91, train_loss: 0.6426, test_loss: 1.2925, test_f1: 0.5253
 epoch: 92, train_loss: 0.6393, test_loss: 1.3260, test_f1: 0.5202
 epoch: 93, train_loss: 0.6444, test_loss: 1.3012, test_f1: 0.4981
 epoch: 94, train_loss: 0.6360, test_loss: 1.3076, test_f1: 0.5232
 epoch: 95, train_loss: 0.6210, test_loss: 1.3230, test_f1: 0.5369
 epoch: 96, train_loss: 0.6298, test_loss: 1.2635, test_f1: 0.5464
 epoch: 97, train_loss: 0.6193, test_loss: 1.3545, test_f1: 0.5404
 epoch: 98, train_loss: 0.6192, test_loss: 1.3368, test_f1: 0.5257
 epoch: 99, train_loss: 0.6202, test_loss: 1.3138, test_f1: 0.5364
##################ITERATION #1 ****************************************
 epoch: 0, train_loss: 1.2650, test_loss: 1.1826, test_f1: 0.4421
 epoch: 1, train_loss: 1.1923, test_loss: 1.1388, test_f1: 0.4538
 epoch: 2, train_loss: 1.1533, test_loss: 1.1068, test_f1: 0.4515
 epoch: 3, train_loss: 1.1299, test_loss: 1.0831, test_f1: 0.4676
 epoch: 4, train_loss: 1.0999, test_loss: 1.0652, test_f1: 0.4541
 epoch: 5, train_loss: 1.0836, test_loss: 1.0447, test_f1: 0.4689
 epoch: 6, train_loss: 1.0600, test_loss: 1.0149, test_f1: 0.4845
 epoch: 7, train_loss: 1.0462, test_loss: 1.0258, test_f1: 0.4805
 epoch: 8, train_loss: 1.0346, test_loss: 1.0117, test_f1: 0.4840
 epoch: 9, train_loss: 1.0213, test_loss: 1.0013, test_f1: 0.4796
 epoch: 10, train_loss: 1.0010, test_loss: 0.9804, test_f1: 0.4828
 epoch: 11, train_loss: 0.9939, test_loss: 0.9617, test_f1: 0.5084
 epoch: 12, train_loss: 0.9726, test_loss: 0.9629, test_f1: 0.5246
 epoch: 13, train_loss: 0.9603, test_loss: 0.9743, test_f1: 0.4879
 epoch: 14, train_loss: 0.9597, test_loss: 0.9746, test_f1: 0.4819
 epoch: 15, train_loss: 0.9449, test_loss: 0.9480, test_f1: 0.5028
 epoch: 16, train_loss: 0.9380, test_loss: 0.9592, test_f1: 0.4713
 epoch: 17, train_loss: 0.9236, test_loss: 0.9317, test_f1: 0.5109
 epoch: 18, train_loss: 0.9225, test_loss: 0.9253, test_f1: 0.5208
 epoch: 19, train_loss: 0.9005, test_loss: 0.9520, test_f1: 0.5206
 epoch: 20, train_loss: 0.9060, test_loss: 0.9708, test_f1: 0.4846
 epoch: 21, train_loss: 0.8905, test_loss: 0.9995, test_f1: 0.4698
 epoch: 22, train_loss: 0.8841, test_loss: 0.9964, test_f1: 0.4709
 epoch: 23, train_loss: 0.8867, test_loss: 0.9621, test_f1: 0.4840
 epoch: 24, train_loss: 0.8622, test_loss: 0.9881, test_f1: 0.4752
 epoch: 25, train_loss: 0.8667, test_loss: 0.9707, test_f1: 0.5003
 epoch: 26, train_loss: 0.8611, test_loss: 0.9884, test_f1: 0.4731
 epoch: 27, train_loss: 0.8512, test_loss: 1.0112, test_f1: 0.4790
 epoch: 28, train_loss: 0.8477, test_loss: 0.9685, test_f1: 0.5021
 epoch: 29, train_loss: 0.8433, test_loss: 1.0384, test_f1: 0.4727
 epoch: 30, train_loss: 0.8435, test_loss: 1.0168, test_f1: 0.4838
 epoch: 31, train_loss: 0.8409, test_loss: 0.9572, test_f1: 0.5085
 epoch: 32, train_loss: 0.8236, test_loss: 0.9714, test_f1: 0.5002
 epoch: 33, train_loss: 0.8187, test_loss: 0.9936, test_f1: 0.4835
 epoch: 34, train_loss: 0.8054, test_loss: 0.9875, test_f1: 0.4934
 epoch: 35, train_loss: 0.8062, test_loss: 1.0377, test_f1: 0.4818
 epoch: 36, train_loss: 0.8120, test_loss: 0.9544, test_f1: 0.5354
 epoch: 37, train_loss: 0.8046, test_loss: 1.0001, test_f1: 0.4992
 epoch: 38, train_loss: 0.7910, test_loss: 1.0043, test_f1: 0.4895
 epoch: 39, train_loss: 0.7814, test_loss: 1.0140, test_f1: 0.4859
 epoch: 40, train_loss: 0.7824, test_loss: 0.9722, test_f1: 0.5076
 epoch: 41, train_loss: 0.7698, test_loss: 1.0532, test_f1: 0.5010
 epoch: 42, train_loss: 0.7699, test_loss: 0.9814, test_f1: 0.5258
 epoch: 43, train_loss: 0.7630, test_loss: 1.0082, test_f1: 0.5057
 epoch: 44, train_loss: 0.7538, test_loss: 0.9735, test_f1: 0.5174
 epoch: 45, train_loss: 0.7568, test_loss: 1.1106, test_f1: 0.4733
 epoch: 46, train_loss: 0.7508, test_loss: 1.0333, test_f1: 0.5189
 epoch: 47, train_loss: 0.7709, test_loss: 1.0068, test_f1: 0.5292
 epoch: 48, train_loss: 0.7466, test_loss: 1.0210, test_f1: 0.5185
 epoch: 49, train_loss: 0.7415, test_loss: 1.1248, test_f1: 0.4912
 epoch: 50, train_loss: 0.7448, test_loss: 1.0729, test_f1: 0.4886
 epoch: 51, train_loss: 0.7296, test_loss: 1.0819, test_f1: 0.4861
 epoch: 52, train_loss: 0.7143, test_loss: 1.0616, test_f1: 0.5241
 epoch: 53, train_loss: 0.7099, test_loss: 1.1506, test_f1: 0.4783
 epoch: 54, train_loss: 0.7099, test_loss: 1.0854, test_f1: 0.4809
 epoch: 55, train_loss: 0.7095, test_loss: 1.1741, test_f1: 0.5015
 epoch: 56, train_loss: 0.6943, test_loss: 1.1167, test_f1: 0.4968
 epoch: 57, train_loss: 0.7071, test_loss: 1.0963, test_f1: 0.5244
 epoch: 58, train_loss: 0.6962, test_loss: 1.1088, test_f1: 0.5112
 epoch: 59, train_loss: 0.6930, test_loss: 1.0852, test_f1: 0.5236
 epoch: 60, train_loss: 0.6838, test_loss: 1.1298, test_f1: 0.4939
 epoch: 61, train_loss: 0.6836, test_loss: 1.1105, test_f1: 0.5331
 epoch: 62, train_loss: 0.6929, test_loss: 1.1688, test_f1: 0.5200
 epoch: 63, train_loss: 0.6794, test_loss: 1.1484, test_f1: 0.5006
 epoch: 64, train_loss: 0.6885, test_loss: 1.1905, test_f1: 0.4944
 epoch: 65, train_loss: 0.6757, test_loss: 1.1742, test_f1: 0.4925
 epoch: 66, train_loss: 0.6805, test_loss: 1.2098, test_f1: 0.4951
 epoch: 67, train_loss: 0.6670, test_loss: 1.2040, test_f1: 0.5002
 epoch: 68, train_loss: 0.6723, test_loss: 1.2350, test_f1: 0.5140
 epoch: 69, train_loss: 0.6642, test_loss: 1.0921, test_f1: 0.5198
 epoch: 70, train_loss: 0.6677, test_loss: 1.1868, test_f1: 0.5097
 epoch: 71, train_loss: 0.6701, test_loss: 1.2222, test_f1: 0.5094
 epoch: 72, train_loss: 0.6632, test_loss: 1.1771, test_f1: 0.4885
 epoch: 73, train_loss: 0.6635, test_loss: 1.2313, test_f1: 0.4873
 epoch: 74, train_loss: 0.6478, test_loss: 1.2772, test_f1: 0.5152
 epoch: 75, train_loss: 0.6587, test_loss: 1.2435, test_f1: 0.4971
 epoch: 76, train_loss: 0.6819, test_loss: 1.2226, test_f1: 0.4986
 epoch: 77, train_loss: 0.6810, test_loss: 1.2278, test_f1: 0.4978
 epoch: 78, train_loss: 0.6457, test_loss: 1.2655, test_f1: 0.4832
 epoch: 79, train_loss: 0.6416, test_loss: 1.2194, test_f1: 0.5141
 epoch: 80, train_loss: 0.6524, test_loss: 1.2281, test_f1: 0.4726
 epoch: 81, train_loss: 0.6429, test_loss: 1.2166, test_f1: 0.5057
 epoch: 82, train_loss: 0.6454, test_loss: 1.2429, test_f1: 0.4993
 epoch: 83, train_loss: 0.6375, test_loss: 1.2639, test_f1: 0.5100
 epoch: 84, train_loss: 0.6320, test_loss: 1.2688, test_f1: 0.5089
 epoch: 85, train_loss: 0.6213, test_loss: 1.3037, test_f1: 0.4773
 epoch: 86, train_loss: 0.6313, test_loss: 1.3007, test_f1: 0.4972
 epoch: 87, train_loss: 0.6301, test_loss: 1.3196, test_f1: 0.5128
 epoch: 88, train_loss: 0.6271, test_loss: 1.2404, test_f1: 0.5020
 epoch: 89, train_loss: 0.6261, test_loss: 1.3307, test_f1: 0.5093
 epoch: 90, train_loss: 0.6314, test_loss: 1.2507, test_f1: 0.4955
 epoch: 91, train_loss: 0.6382, test_loss: 1.2486, test_f1: 0.5011
 epoch: 92, train_loss: 0.6144, test_loss: 1.3547, test_f1: 0.5115
 epoch: 93, train_loss: 0.6131, test_loss: 1.3732, test_f1: 0.5187
 epoch: 94, train_loss: 0.6176, test_loss: 1.3672, test_f1: 0.5083
 epoch: 95, train_loss: 0.6087, test_loss: 1.3317, test_f1: 0.4964
 epoch: 96, train_loss: 0.5993, test_loss: 1.3290, test_f1: 0.5066
 epoch: 97, train_loss: 0.6105, test_loss: 1.3240, test_f1: 0.5100
 epoch: 98, train_loss: 0.6142, test_loss: 1.3717, test_f1: 0.5086
 epoch: 99, train_loss: 0.6087, test_loss: 1.3674, test_f1: 0.5160
##################ITERATION #2 ****************************************
 epoch: 0, train_loss: 1.2540, test_loss: 1.1485, test_f1: 0.4013
 epoch: 1, train_loss: 1.1702, test_loss: 1.1124, test_f1: 0.4267
 epoch: 2, train_loss: 1.1392, test_loss: 1.0862, test_f1: 0.4520
 epoch: 3, train_loss: 1.1236, test_loss: 1.0781, test_f1: 0.4489
 epoch: 4, train_loss: 1.0966, test_loss: 1.0501, test_f1: 0.4365
 epoch: 5, train_loss: 1.0779, test_loss: 1.0226, test_f1: 0.4727
 epoch: 6, train_loss: 1.0636, test_loss: 1.0123, test_f1: 0.4444
 epoch: 7, train_loss: 1.0449, test_loss: 0.9962, test_f1: 0.4681
 epoch: 8, train_loss: 1.0210, test_loss: 0.9874, test_f1: 0.4521
 epoch: 9, train_loss: 1.0192, test_loss: 0.9805, test_f1: 0.4606
 epoch: 10, train_loss: 1.0037, test_loss: 0.9599, test_f1: 0.4734
 epoch: 11, train_loss: 0.9897, test_loss: 0.9522, test_f1: 0.4905
 epoch: 12, train_loss: 0.9775, test_loss: 0.9529, test_f1: 0.4763
 epoch: 13, train_loss: 0.9593, test_loss: 0.9492, test_f1: 0.4832
 epoch: 14, train_loss: 0.9608, test_loss: 0.9557, test_f1: 0.4957
 epoch: 15, train_loss: 0.9492, test_loss: 0.9216, test_f1: 0.5072
 epoch: 16, train_loss: 0.9432, test_loss: 0.9107, test_f1: 0.5100
 epoch: 17, train_loss: 0.9377, test_loss: 0.9238, test_f1: 0.5051
 epoch: 18, train_loss: 0.9220, test_loss: 0.9066, test_f1: 0.5046
 epoch: 19, train_loss: 0.9089, test_loss: 0.9716, test_f1: 0.5033
 epoch: 20, train_loss: 0.9103, test_loss: 0.9310, test_f1: 0.5055
 epoch: 21, train_loss: 0.9070, test_loss: 0.9548, test_f1: 0.5031
 epoch: 22, train_loss: 0.8936, test_loss: 0.9234, test_f1: 0.5105
 epoch: 23, train_loss: 0.8864, test_loss: 0.9210, test_f1: 0.5158
 epoch: 24, train_loss: 0.8899, test_loss: 0.9131, test_f1: 0.5221
 epoch: 25, train_loss: 0.8774, test_loss: 0.9394, test_f1: 0.5102
 epoch: 26, train_loss: 0.8741, test_loss: 0.9294, test_f1: 0.5130
 epoch: 27, train_loss: 0.8665, test_loss: 0.9224, test_f1: 0.5286
 epoch: 28, train_loss: 0.8603, test_loss: 0.9267, test_f1: 0.5061
 epoch: 29, train_loss: 0.8689, test_loss: 0.9367, test_f1: 0.5182
 epoch: 30, train_loss: 0.8516, test_loss: 0.9492, test_f1: 0.5264
 epoch: 31, train_loss: 0.8594, test_loss: 0.9627, test_f1: 0.5091
 epoch: 32, train_loss: 0.8497, test_loss: 0.9619, test_f1: 0.4862
 epoch: 33, train_loss: 0.8356, test_loss: 0.9472, test_f1: 0.5033
 epoch: 34, train_loss: 0.8297, test_loss: 0.9700, test_f1: 0.5133
 epoch: 35, train_loss: 0.8318, test_loss: 0.9652, test_f1: 0.5252
 epoch: 36, train_loss: 0.8144, test_loss: 0.9768, test_f1: 0.5109
 epoch: 37, train_loss: 0.8303, test_loss: 0.9557, test_f1: 0.5123
 epoch: 38, train_loss: 0.8184, test_loss: 0.9449, test_f1: 0.5261
 epoch: 39, train_loss: 0.8006, test_loss: 0.9527, test_f1: 0.5271
 epoch: 40, train_loss: 0.7977, test_loss: 0.9754, test_f1: 0.5315
 epoch: 41, train_loss: 0.8044, test_loss: 0.9538, test_f1: 0.5302
 epoch: 42, train_loss: 0.8117, test_loss: 0.9711, test_f1: 0.5348
 epoch: 43, train_loss: 0.7908, test_loss: 0.9805, test_f1: 0.5184
 epoch: 44, train_loss: 0.7801, test_loss: 1.0038, test_f1: 0.5184
 epoch: 45, train_loss: 0.7766, test_loss: 0.9899, test_f1: 0.5321
 epoch: 46, train_loss: 0.7822, test_loss: 1.0513, test_f1: 0.5136
 epoch: 47, train_loss: 0.7685, test_loss: 1.0412, test_f1: 0.5128
 epoch: 48, train_loss: 0.7842, test_loss: 1.0001, test_f1: 0.5438
 epoch: 49, train_loss: 0.7768, test_loss: 0.9981, test_f1: 0.5246
 epoch: 50, train_loss: 0.7653, test_loss: 1.0292, test_f1: 0.5017
 epoch: 51, train_loss: 0.7523, test_loss: 1.0225, test_f1: 0.5357
 epoch: 52, train_loss: 0.7447, test_loss: 1.0154, test_f1: 0.5121
 epoch: 53, train_loss: 0.7335, test_loss: 1.0172, test_f1: 0.5379
 epoch: 54, train_loss: 0.7278, test_loss: 1.0584, test_f1: 0.5025
 epoch: 55, train_loss: 0.7407, test_loss: 1.0403, test_f1: 0.5406
 epoch: 56, train_loss: 0.7356, test_loss: 1.0179, test_f1: 0.5318
 epoch: 57, train_loss: 0.7263, test_loss: 1.0360, test_f1: 0.5169
 epoch: 58, train_loss: 0.7298, test_loss: 1.0548, test_f1: 0.5212
 epoch: 59, train_loss: 0.7256, test_loss: 1.0525, test_f1: 0.5237
 epoch: 60, train_loss: 0.7255, test_loss: 1.0286, test_f1: 0.5272
 epoch: 61, train_loss: 0.7104, test_loss: 1.0546, test_f1: 0.5254
 epoch: 62, train_loss: 0.7093, test_loss: 1.0513, test_f1: 0.5469
 epoch: 63, train_loss: 0.7192, test_loss: 1.0583, test_f1: 0.5341
 epoch: 64, train_loss: 0.7115, test_loss: 1.0712, test_f1: 0.5276
 epoch: 65, train_loss: 0.7284, test_loss: 1.0711, test_f1: 0.5168
 epoch: 66, train_loss: 0.7136, test_loss: 1.0602, test_f1: 0.5270
 epoch: 67, train_loss: 0.7039, test_loss: 1.0674, test_f1: 0.5297
 epoch: 68, train_loss: 0.7059, test_loss: 1.0651, test_f1: 0.5260
 epoch: 69, train_loss: 0.7057, test_loss: 1.1158, test_f1: 0.4971
 epoch: 70, train_loss: 0.6986, test_loss: 1.1022, test_f1: 0.4963
 epoch: 71, train_loss: 0.7078, test_loss: 1.1008, test_f1: 0.5204
 epoch: 72, train_loss: 0.7027, test_loss: 1.0506, test_f1: 0.5458
 epoch: 73, train_loss: 0.6960, test_loss: 1.0879, test_f1: 0.5234
 epoch: 74, train_loss: 0.6865, test_loss: 1.0662, test_f1: 0.5209
 epoch: 75, train_loss: 0.6850, test_loss: 1.1112, test_f1: 0.5112
 epoch: 76, train_loss: 0.6849, test_loss: 1.0937, test_f1: 0.5390
 epoch: 77, train_loss: 0.6931, test_loss: 1.0864, test_f1: 0.5305
 epoch: 78, train_loss: 0.6830, test_loss: 1.0998, test_f1: 0.5082
 epoch: 79, train_loss: 0.6768, test_loss: 1.0992, test_f1: 0.5358
 epoch: 80, train_loss: 0.6648, test_loss: 1.1131, test_f1: 0.5244
 epoch: 81, train_loss: 0.6806, test_loss: 1.0758, test_f1: 0.5328
 epoch: 82, train_loss: 0.6657, test_loss: 1.1265, test_f1: 0.5402
 epoch: 83, train_loss: 0.6830, test_loss: 1.1237, test_f1: 0.5227
 epoch: 84, train_loss: 0.6765, test_loss: 1.1203, test_f1: 0.5359
 epoch: 85, train_loss: 0.6686, test_loss: 1.1479, test_f1: 0.5239
 epoch: 86, train_loss: 0.6718, test_loss: 1.1046, test_f1: 0.5199
 epoch: 87, train_loss: 0.6779, test_loss: 1.1297, test_f1: 0.5172
 epoch: 88, train_loss: 0.6598, test_loss: 1.1330, test_f1: 0.5109
 epoch: 89, train_loss: 0.6592, test_loss: 1.1361, test_f1: 0.5036
 epoch: 90, train_loss: 0.6667, test_loss: 1.1262, test_f1: 0.5270
 epoch: 91, train_loss: 0.6659, test_loss: 1.1349, test_f1: 0.5125
 epoch: 92, train_loss: 0.6690, test_loss: 1.1371, test_f1: 0.5080
 epoch: 93, train_loss: 0.6546, test_loss: 1.1528, test_f1: 0.5026
 epoch: 94, train_loss: 0.6516, test_loss: 1.1578, test_f1: 0.5155
 epoch: 95, train_loss: 0.6565, test_loss: 1.2053, test_f1: 0.5110
 epoch: 96, train_loss: 0.6344, test_loss: 1.1562, test_f1: 0.5201
 epoch: 97, train_loss: 0.6396, test_loss: 1.1698, test_f1: 0.5350
 epoch: 98, train_loss: 0.6398, test_loss: 1.2014, test_f1: 0.5148
 epoch: 99, train_loss: 0.6526, test_loss: 1.1554, test_f1: 0.5222
##################ITERATION #3 ****************************************
 epoch: 0, train_loss: 1.2612, test_loss: 1.1560, test_f1: 0.4504
 epoch: 1, train_loss: 1.1891, test_loss: 1.1162, test_f1: 0.4552
 epoch: 2, train_loss: 1.1498, test_loss: 1.0967, test_f1: 0.4475
 epoch: 3, train_loss: 1.1354, test_loss: 1.0836, test_f1: 0.4511
 epoch: 4, train_loss: 1.1136, test_loss: 1.0524, test_f1: 0.4557
 epoch: 5, train_loss: 1.0865, test_loss: 1.0260, test_f1: 0.4452
 epoch: 6, train_loss: 1.0776, test_loss: 1.0128, test_f1: 0.4842
 epoch: 7, train_loss: 1.0516, test_loss: 1.0088, test_f1: 0.4508
 epoch: 8, train_loss: 1.0412, test_loss: 0.9800, test_f1: 0.4736
 epoch: 9, train_loss: 1.0168, test_loss: 0.9737, test_f1: 0.4789
 epoch: 10, train_loss: 1.0156, test_loss: 0.9672, test_f1: 0.4936
 epoch: 11, train_loss: 1.0122, test_loss: 0.9709, test_f1: 0.4699
 epoch: 12, train_loss: 0.9861, test_loss: 0.9677, test_f1: 0.4801
 epoch: 13, train_loss: 0.9870, test_loss: 0.9587, test_f1: 0.4986
 epoch: 14, train_loss: 0.9720, test_loss: 0.9435, test_f1: 0.4809
 epoch: 15, train_loss: 0.9648, test_loss: 0.9402, test_f1: 0.4934
 epoch: 16, train_loss: 0.9617, test_loss: 0.9567, test_f1: 0.4860
 epoch: 17, train_loss: 0.9525, test_loss: 0.9453, test_f1: 0.4557
 epoch: 18, train_loss: 0.9588, test_loss: 0.9545, test_f1: 0.4933
 epoch: 19, train_loss: 0.9384, test_loss: 0.9230, test_f1: 0.5060
 epoch: 20, train_loss: 0.9163, test_loss: 0.9441, test_f1: 0.5141
 epoch: 21, train_loss: 0.9117, test_loss: 0.9448, test_f1: 0.4952
 epoch: 22, train_loss: 0.9015, test_loss: 0.9551, test_f1: 0.4987
 epoch: 23, train_loss: 0.9032, test_loss: 0.9437, test_f1: 0.5066
 epoch: 24, train_loss: 0.9058, test_loss: 0.9454, test_f1: 0.4998
 epoch: 25, train_loss: 0.8983, test_loss: 0.9385, test_f1: 0.5004
 epoch: 26, train_loss: 0.8950, test_loss: 0.9578, test_f1: 0.4779
 epoch: 27, train_loss: 0.8784, test_loss: 0.9539, test_f1: 0.4937
 epoch: 28, train_loss: 0.8773, test_loss: 0.9644, test_f1: 0.4921
 epoch: 29, train_loss: 0.8651, test_loss: 0.9816, test_f1: 0.5160
 epoch: 30, train_loss: 0.8704, test_loss: 0.8990, test_f1: 0.5164
 epoch: 31, train_loss: 0.8648, test_loss: 0.9668, test_f1: 0.5011
 epoch: 32, train_loss: 0.8641, test_loss: 0.9608, test_f1: 0.5154
 epoch: 33, train_loss: 0.8546, test_loss: 0.9332, test_f1: 0.5104
 epoch: 34, train_loss: 0.8551, test_loss: 0.9618, test_f1: 0.5050
 epoch: 35, train_loss: 0.8473, test_loss: 0.9351, test_f1: 0.5208
 epoch: 36, train_loss: 0.8447, test_loss: 0.9473, test_f1: 0.5224
 epoch: 37, train_loss: 0.8447, test_loss: 0.9986, test_f1: 0.5082
 epoch: 38, train_loss: 0.8369, test_loss: 0.9719, test_f1: 0.5248
 epoch: 39, train_loss: 0.8256, test_loss: 0.9372, test_f1: 0.5357
 epoch: 40, train_loss: 0.8306, test_loss: 0.9699, test_f1: 0.5231
 epoch: 41, train_loss: 0.8136, test_loss: 0.9741, test_f1: 0.5200
 epoch: 42, train_loss: 0.8120, test_loss: 0.9808, test_f1: 0.5141
 epoch: 43, train_loss: 0.8063, test_loss: 0.9980, test_f1: 0.5257
 epoch: 44, train_loss: 0.8110, test_loss: 1.0089, test_f1: 0.4908
 epoch: 45, train_loss: 0.7918, test_loss: 0.9544, test_f1: 0.5321
 epoch: 46, train_loss: 0.8063, test_loss: 0.9712, test_f1: 0.5101
 epoch: 47, train_loss: 0.7862, test_loss: 0.9952, test_f1: 0.5222
 epoch: 48, train_loss: 0.7900, test_loss: 0.9648, test_f1: 0.5339
 epoch: 49, train_loss: 0.7854, test_loss: 0.9696, test_f1: 0.5193
 epoch: 50, train_loss: 0.7755, test_loss: 0.9771, test_f1: 0.5156
 epoch: 51, train_loss: 0.7660, test_loss: 0.9772, test_f1: 0.5212
 epoch: 52, train_loss: 0.7513, test_loss: 0.9837, test_f1: 0.5316
 epoch: 53, train_loss: 0.7575, test_loss: 1.0240, test_f1: 0.5145
 epoch: 54, train_loss: 0.7464, test_loss: 0.9961, test_f1: 0.5422
 epoch: 55, train_loss: 0.7534, test_loss: 1.0138, test_f1: 0.5411
 epoch: 56, train_loss: 0.7459, test_loss: 1.0760, test_f1: 0.5189
 epoch: 57, train_loss: 0.7545, test_loss: 1.0231, test_f1: 0.5342
 epoch: 58, train_loss: 0.7462, test_loss: 1.0133, test_f1: 0.5232
 epoch: 59, train_loss: 0.7465, test_loss: 1.0587, test_f1: 0.5247
 epoch: 60, train_loss: 0.7308, test_loss: 1.0673, test_f1: 0.5288
 epoch: 61, train_loss: 0.7360, test_loss: 1.0749, test_f1: 0.5286
 epoch: 62, train_loss: 0.7342, test_loss: 1.0423, test_f1: 0.5278
 epoch: 63, train_loss: 0.7352, test_loss: 1.0119, test_f1: 0.5280
 epoch: 64, train_loss: 0.7311, test_loss: 1.0153, test_f1: 0.5297
 epoch: 65, train_loss: 0.7346, test_loss: 1.0713, test_f1: 0.5160
 epoch: 66, train_loss: 0.7381, test_loss: 1.0054, test_f1: 0.5330
 epoch: 67, train_loss: 0.7416, test_loss: 1.0397, test_f1: 0.5413
 epoch: 68, train_loss: 0.7169, test_loss: 0.9988, test_f1: 0.5320
 epoch: 69, train_loss: 0.7184, test_loss: 1.0554, test_f1: 0.5227
 epoch: 70, train_loss: 0.7219, test_loss: 0.9941, test_f1: 0.5472
 epoch: 71, train_loss: 0.7199, test_loss: 1.0941, test_f1: 0.5218
 epoch: 72, train_loss: 0.7134, test_loss: 1.0820, test_f1: 0.5301
 epoch: 73, train_loss: 0.6971, test_loss: 1.0266, test_f1: 0.5426
 epoch: 74, train_loss: 0.7042, test_loss: 1.0265, test_f1: 0.5345
 epoch: 75, train_loss: 0.7128, test_loss: 1.1159, test_f1: 0.5509
 epoch: 76, train_loss: 0.6966, test_loss: 1.0478, test_f1: 0.5499
 epoch: 77, train_loss: 0.7033, test_loss: 1.0899, test_f1: 0.5340
 epoch: 78, train_loss: 0.7116, test_loss: 1.1324, test_f1: 0.5192
 epoch: 79, train_loss: 0.6985, test_loss: 1.0880, test_f1: 0.5221
 epoch: 80, train_loss: 0.7102, test_loss: 1.0372, test_f1: 0.5451
 epoch: 81, train_loss: 0.7016, test_loss: 1.0729, test_f1: 0.5108
 epoch: 82, train_loss: 0.6876, test_loss: 1.0519, test_f1: 0.5397
 epoch: 83, train_loss: 0.6894, test_loss: 1.0874, test_f1: 0.5274
 epoch: 84, train_loss: 0.6874, test_loss: 1.0462, test_f1: 0.5325
 epoch: 85, train_loss: 0.6809, test_loss: 1.1700, test_f1: 0.5185
 epoch: 86, train_loss: 0.6980, test_loss: 1.1168, test_f1: 0.5091
 epoch: 87, train_loss: 0.6965, test_loss: 1.0594, test_f1: 0.5592
 epoch: 88, train_loss: 0.6874, test_loss: 1.1257, test_f1: 0.5300
 epoch: 89, train_loss: 0.6831, test_loss: 1.0601, test_f1: 0.5215
 epoch: 90, train_loss: 0.6844, test_loss: 1.0759, test_f1: 0.5265
 epoch: 91, train_loss: 0.6774, test_loss: 1.0297, test_f1: 0.5419
 epoch: 92, train_loss: 0.6741, test_loss: 1.0879, test_f1: 0.5313
 epoch: 93, train_loss: 0.6691, test_loss: 1.1188, test_f1: 0.5418
 epoch: 94, train_loss: 0.6755, test_loss: 1.0629, test_f1: 0.5474
 epoch: 95, train_loss: 0.6801, test_loss: 1.0936, test_f1: 0.5284
 epoch: 96, train_loss: 0.6757, test_loss: 1.0863, test_f1: 0.5321
 epoch: 97, train_loss: 0.6611, test_loss: 1.1081, test_f1: 0.5319
 epoch: 98, train_loss: 0.6737, test_loss: 1.0487, test_f1: 0.5417
 epoch: 99, train_loss: 0.6757, test_loss: 1.0402, test_f1: 0.5457
##################ITERATION #4 ****************************************
 epoch: 0, train_loss: 1.2505, test_loss: 1.1028, test_f1: 0.4622
 epoch: 1, train_loss: 1.1554, test_loss: 1.0765, test_f1: 0.4624
 epoch: 2, train_loss: 1.1239, test_loss: 1.0459, test_f1: 0.4696
 epoch: 3, train_loss: 1.1041, test_loss: 1.0370, test_f1: 0.4458
 epoch: 4, train_loss: 1.0823, test_loss: 1.0123, test_f1: 0.4731
 epoch: 5, train_loss: 1.0611, test_loss: 0.9976, test_f1: 0.4507
 epoch: 6, train_loss: 1.0408, test_loss: 0.9927, test_f1: 0.4685
 epoch: 7, train_loss: 1.0337, test_loss: 0.9764, test_f1: 0.4731
 epoch: 8, train_loss: 1.0138, test_loss: 0.9908, test_f1: 0.4765
 epoch: 9, train_loss: 1.0122, test_loss: 0.9692, test_f1: 0.4783
 epoch: 10, train_loss: 0.9960, test_loss: 0.9629, test_f1: 0.4873
 epoch: 11, train_loss: 0.9881, test_loss: 0.9822, test_f1: 0.4853
 epoch: 12, train_loss: 0.9744, test_loss: 0.9678, test_f1: 0.4906
 epoch: 13, train_loss: 0.9662, test_loss: 0.9641, test_f1: 0.4997
 epoch: 14, train_loss: 0.9681, test_loss: 0.9728, test_f1: 0.4930
 epoch: 15, train_loss: 0.9534, test_loss: 1.0036, test_f1: 0.4942
 epoch: 16, train_loss: 0.9612, test_loss: 0.9659, test_f1: 0.5095
 epoch: 17, train_loss: 0.9426, test_loss: 0.9567, test_f1: 0.5159
 epoch: 18, train_loss: 0.9400, test_loss: 0.9440, test_f1: 0.5084
 epoch: 19, train_loss: 0.9320, test_loss: 0.9387, test_f1: 0.5238
 epoch: 20, train_loss: 0.9173, test_loss: 0.9323, test_f1: 0.5242
 epoch: 21, train_loss: 0.9072, test_loss: 0.9538, test_f1: 0.5314
 epoch: 22, train_loss: 0.9183, test_loss: 0.9663, test_f1: 0.5162
 epoch: 23, train_loss: 0.9020, test_loss: 0.9578, test_f1: 0.5190
 epoch: 24, train_loss: 0.8836, test_loss: 0.9611, test_f1: 0.5230
 epoch: 25, train_loss: 0.8899, test_loss: 0.9581, test_f1: 0.5048
 epoch: 26, train_loss: 0.8813, test_loss: 0.9830, test_f1: 0.5156
 epoch: 27, train_loss: 0.8784, test_loss: 0.9914, test_f1: 0.5094
 epoch: 28, train_loss: 0.8696, test_loss: 0.9841, test_f1: 0.5294
 epoch: 29, train_loss: 0.8569, test_loss: 1.0087, test_f1: 0.5206
 epoch: 30, train_loss: 0.8674, test_loss: 1.0166, test_f1: 0.5191
 epoch: 31, train_loss: 0.8637, test_loss: 0.9800, test_f1: 0.5260
 epoch: 32, train_loss: 0.8490, test_loss: 0.9907, test_f1: 0.5214
 epoch: 33, train_loss: 0.8516, test_loss: 1.0173, test_f1: 0.5328
 epoch: 34, train_loss: 0.8295, test_loss: 0.9676, test_f1: 0.5275
 epoch: 35, train_loss: 0.8350, test_loss: 0.9732, test_f1: 0.5421
 epoch: 36, train_loss: 0.8319, test_loss: 1.0038, test_f1: 0.5247
 epoch: 37, train_loss: 0.8253, test_loss: 0.9864, test_f1: 0.5343
 epoch: 38, train_loss: 0.8178, test_loss: 1.0222, test_f1: 0.5263
 epoch: 39, train_loss: 0.8217, test_loss: 1.0259, test_f1: 0.5394
 epoch: 40, train_loss: 0.8140, test_loss: 1.0076, test_f1: 0.5159
 epoch: 41, train_loss: 0.8071, test_loss: 1.0271, test_f1: 0.5324
 epoch: 42, train_loss: 0.8154, test_loss: 1.0346, test_f1: 0.5386
 epoch: 43, train_loss: 0.8089, test_loss: 1.0212, test_f1: 0.5330
 epoch: 44, train_loss: 0.7895, test_loss: 1.0434, test_f1: 0.5420
 epoch: 45, train_loss: 0.7976, test_loss: 1.0431, test_f1: 0.5420
 epoch: 46, train_loss: 0.7878, test_loss: 1.0526, test_f1: 0.5290
 epoch: 47, train_loss: 0.7929, test_loss: 1.0422, test_f1: 0.5385
 epoch: 48, train_loss: 0.7810, test_loss: 1.0456, test_f1: 0.5249
 epoch: 49, train_loss: 0.7687, test_loss: 1.0542, test_f1: 0.5357
 epoch: 50, train_loss: 0.7626, test_loss: 1.0637, test_f1: 0.5659
 epoch: 51, train_loss: 0.7561, test_loss: 1.0422, test_f1: 0.5502
 epoch: 52, train_loss: 0.7443, test_loss: 1.0440, test_f1: 0.5533
 epoch: 53, train_loss: 0.7495, test_loss: 1.0855, test_f1: 0.5473
 epoch: 54, train_loss: 0.7454, test_loss: 1.0650, test_f1: 0.5536
 epoch: 55, train_loss: 0.7655, test_loss: 1.0443, test_f1: 0.5479
 epoch: 56, train_loss: 0.7438, test_loss: 1.0589, test_f1: 0.5339
 epoch: 57, train_loss: 0.7472, test_loss: 1.0459, test_f1: 0.5424
 epoch: 58, train_loss: 0.7359, test_loss: 1.0516, test_f1: 0.5361
 epoch: 59, train_loss: 0.7492, test_loss: 1.1084, test_f1: 0.5337
 epoch: 60, train_loss: 0.7304, test_loss: 1.1359, test_f1: 0.5130
 epoch: 61, train_loss: 0.7300, test_loss: 1.0965, test_f1: 0.5227
 epoch: 62, train_loss: 0.7321, test_loss: 1.1101, test_f1: 0.5233
 epoch: 63, train_loss: 0.7225, test_loss: 1.0800, test_f1: 0.5217
 epoch: 64, train_loss: 0.7313, test_loss: 1.0766, test_f1: 0.5463
 epoch: 65, train_loss: 0.7208, test_loss: 1.1237, test_f1: 0.5349
 epoch: 66, train_loss: 0.7236, test_loss: 1.0906, test_f1: 0.5663
 epoch: 67, train_loss: 0.7276, test_loss: 1.1422, test_f1: 0.5331
 epoch: 68, train_loss: 0.7127, test_loss: 1.1000, test_f1: 0.5419
 epoch: 69, train_loss: 0.7045, test_loss: 1.1253, test_f1: 0.5326
 epoch: 70, train_loss: 0.7005, test_loss: 1.1974, test_f1: 0.5198
 epoch: 71, train_loss: 0.7052, test_loss: 1.1119, test_f1: 0.5310
 epoch: 72, train_loss: 0.7019, test_loss: 1.1383, test_f1: 0.5283
 epoch: 73, train_loss: 0.6990, test_loss: 1.1176, test_f1: 0.5409
 epoch: 74, train_loss: 0.6996, test_loss: 1.1150, test_f1: 0.5411
 epoch: 75, train_loss: 0.6989, test_loss: 1.1590, test_f1: 0.5429
 epoch: 76, train_loss: 0.7060, test_loss: 1.2168, test_f1: 0.5259
 epoch: 77, train_loss: 0.6960, test_loss: 1.1653, test_f1: 0.5415
 epoch: 78, train_loss: 0.6911, test_loss: 1.1743, test_f1: 0.5253
 epoch: 79, train_loss: 0.6892, test_loss: 1.1440, test_f1: 0.5389
 epoch: 80, train_loss: 0.6899, test_loss: 1.1481, test_f1: 0.5533
 epoch: 81, train_loss: 0.6703, test_loss: 1.1658, test_f1: 0.5528
 epoch: 82, train_loss: 0.6885, test_loss: 1.1327, test_f1: 0.5337
 epoch: 83, train_loss: 0.6750, test_loss: 1.1552, test_f1: 0.5344
 epoch: 84, train_loss: 0.6850, test_loss: 1.1892, test_f1: 0.5458
 epoch: 85, train_loss: 0.6875, test_loss: 1.1544, test_f1: 0.5449
 epoch: 86, train_loss: 0.6670, test_loss: 1.1497, test_f1: 0.5485
 epoch: 87, train_loss: 0.6743, test_loss: 1.1447, test_f1: 0.5464
 epoch: 88, train_loss: 0.6652, test_loss: 1.2133, test_f1: 0.5247
 epoch: 89, train_loss: 0.6610, test_loss: 1.1666, test_f1: 0.5335
 epoch: 90, train_loss: 0.6781, test_loss: 1.1821, test_f1: 0.5349
 epoch: 91, train_loss: 0.6590, test_loss: 1.1578, test_f1: 0.5467
 epoch: 92, train_loss: 0.6675, test_loss: 1.2524, test_f1: 0.5274
 epoch: 93, train_loss: 0.6643, test_loss: 1.1839, test_f1: 0.5452
 epoch: 94, train_loss: 0.6494, test_loss: 1.2109, test_f1: 0.5385
 epoch: 95, train_loss: 0.6634, test_loss: 1.2500, test_f1: 0.5093
 epoch: 96, train_loss: 0.6455, test_loss: 1.2166, test_f1: 0.5426
 epoch: 97, train_loss: 0.6577, test_loss: 1.2354, test_f1: 0.5272
 epoch: 98, train_loss: 0.6583, test_loss: 1.2262, test_f1: 0.5436
 epoch: 99, train_loss: 0.6507, test_loss: 1.2416, test_f1: 0.5376
##################ITERATION #5 ****************************************
 epoch: 0, train_loss: 1.3048, test_loss: 1.1611, test_f1: 0.4265
 epoch: 1, train_loss: 1.1918, test_loss: 1.1252, test_f1: 0.4092
 epoch: 2, train_loss: 1.1613, test_loss: 1.1011, test_f1: 0.4308
 epoch: 3, train_loss: 1.1346, test_loss: 1.0913, test_f1: 0.4235
 epoch: 4, train_loss: 1.1235, test_loss: 1.0893, test_f1: 0.4273
 epoch: 5, train_loss: 1.1057, test_loss: 1.0611, test_f1: 0.4369
 epoch: 6, train_loss: 1.0869, test_loss: 1.0378, test_f1: 0.4430
 epoch: 7, train_loss: 1.0797, test_loss: 1.0322, test_f1: 0.4499
 epoch: 8, train_loss: 1.0676, test_loss: 1.0365, test_f1: 0.4542
 epoch: 9, train_loss: 1.0492, test_loss: 1.0125, test_f1: 0.4552
 epoch: 10, train_loss: 1.0321, test_loss: 1.0205, test_f1: 0.4671
 epoch: 11, train_loss: 1.0272, test_loss: 0.9983, test_f1: 0.4664
 epoch: 12, train_loss: 1.0095, test_loss: 1.0284, test_f1: 0.4396
 epoch: 13, train_loss: 1.0037, test_loss: 0.9948, test_f1: 0.4637
 epoch: 14, train_loss: 0.9945, test_loss: 1.0001, test_f1: 0.4908
 epoch: 15, train_loss: 0.9931, test_loss: 0.9994, test_f1: 0.4748
 epoch: 16, train_loss: 0.9788, test_loss: 0.9799, test_f1: 0.4544
 epoch: 17, train_loss: 0.9705, test_loss: 0.9843, test_f1: 0.4437
 epoch: 18, train_loss: 0.9647, test_loss: 0.9798, test_f1: 0.4673
 epoch: 19, train_loss: 0.9558, test_loss: 0.9742, test_f1: 0.4553
 epoch: 20, train_loss: 0.9449, test_loss: 0.9819, test_f1: 0.4543
 epoch: 21, train_loss: 0.9507, test_loss: 0.9638, test_f1: 0.5109
 epoch: 22, train_loss: 0.9409, test_loss: 1.0080, test_f1: 0.4735
 epoch: 23, train_loss: 0.9317, test_loss: 0.9954, test_f1: 0.4655
 epoch: 24, train_loss: 0.9229, test_loss: 0.9653, test_f1: 0.4803
 epoch: 25, train_loss: 0.9177, test_loss: 1.0034, test_f1: 0.5037
 epoch: 26, train_loss: 0.9213, test_loss: 0.9955, test_f1: 0.4910
 epoch: 27, train_loss: 0.8991, test_loss: 0.9802, test_f1: 0.5083
 epoch: 28, train_loss: 0.9051, test_loss: 1.0075, test_f1: 0.5178
 epoch: 29, train_loss: 0.8945, test_loss: 1.0173, test_f1: 0.5052
 epoch: 30, train_loss: 0.9036, test_loss: 1.0169, test_f1: 0.4920
 epoch: 31, train_loss: 0.8723, test_loss: 0.9719, test_f1: 0.4933
 epoch: 32, train_loss: 0.8741, test_loss: 0.9858, test_f1: 0.5087
 epoch: 33, train_loss: 0.8734, test_loss: 1.0443, test_f1: 0.4824
 epoch: 34, train_loss: 0.8756, test_loss: 1.0248, test_f1: 0.5058
 epoch: 35, train_loss: 0.8659, test_loss: 1.0301, test_f1: 0.4921
 epoch: 36, train_loss: 0.8549, test_loss: 0.9876, test_f1: 0.5307
 epoch: 37, train_loss: 0.8509, test_loss: 1.0175, test_f1: 0.5038
 epoch: 38, train_loss: 0.8446, test_loss: 0.9640, test_f1: 0.5341
 epoch: 39, train_loss: 0.8347, test_loss: 1.0012, test_f1: 0.4944
 epoch: 40, train_loss: 0.8381, test_loss: 1.0090, test_f1: 0.5320
 epoch: 41, train_loss: 0.8416, test_loss: 1.0020, test_f1: 0.5220
 epoch: 42, train_loss: 0.8396, test_loss: 1.0237, test_f1: 0.4999
 epoch: 43, train_loss: 0.8321, test_loss: 1.0113, test_f1: 0.5312
 epoch: 44, train_loss: 0.8236, test_loss: 0.9945, test_f1: 0.5227
 epoch: 45, train_loss: 0.8256, test_loss: 0.9944, test_f1: 0.5411
 epoch: 46, train_loss: 0.8180, test_loss: 1.0305, test_f1: 0.5204
 epoch: 47, train_loss: 0.8219, test_loss: 1.0070, test_f1: 0.5218
 epoch: 48, train_loss: 0.8053, test_loss: 1.0491, test_f1: 0.5209
 epoch: 49, train_loss: 0.7987, test_loss: 1.0110, test_f1: 0.5408
 epoch: 50, train_loss: 0.8056, test_loss: 1.0366, test_f1: 0.5098
 epoch: 51, train_loss: 0.7939, test_loss: 1.0525, test_f1: 0.5168
 epoch: 52, train_loss: 0.7869, test_loss: 1.0444, test_f1: 0.5303
 epoch: 53, train_loss: 0.7970, test_loss: 1.0245, test_f1: 0.5109
 epoch: 54, train_loss: 0.7714, test_loss: 1.0349, test_f1: 0.5247
 epoch: 55, train_loss: 0.7740, test_loss: 1.0889, test_f1: 0.4960
 epoch: 56, train_loss: 0.7676, test_loss: 1.0335, test_f1: 0.5121
 epoch: 57, train_loss: 0.7663, test_loss: 1.0394, test_f1: 0.5338
 epoch: 58, train_loss: 0.7677, test_loss: 1.0114, test_f1: 0.5127
 epoch: 59, train_loss: 0.7607, test_loss: 1.0636, test_f1: 0.5237
 epoch: 60, train_loss: 0.7700, test_loss: 1.0704, test_f1: 0.5142
 epoch: 61, train_loss: 0.7650, test_loss: 1.0986, test_f1: 0.5144
 epoch: 62, train_loss: 0.7550, test_loss: 1.0596, test_f1: 0.5143
 epoch: 63, train_loss: 0.7682, test_loss: 1.0795, test_f1: 0.5197
 epoch: 64, train_loss: 0.7776, test_loss: 1.0972, test_f1: 0.5205
 epoch: 65, train_loss: 0.7588, test_loss: 1.0940, test_f1: 0.5290
 epoch: 66, train_loss: 0.7463, test_loss: 1.1139, test_f1: 0.5368
 epoch: 67, train_loss: 0.7391, test_loss: 1.1580, test_f1: 0.5304
 epoch: 68, train_loss: 0.7490, test_loss: 1.1152, test_f1: 0.5346
 epoch: 69, train_loss: 0.7488, test_loss: 1.1362, test_f1: 0.5257
 epoch: 70, train_loss: 0.7365, test_loss: 1.1203, test_f1: 0.5150
 epoch: 71, train_loss: 0.7436, test_loss: 1.1355, test_f1: 0.5208
 epoch: 72, train_loss: 0.7386, test_loss: 1.0718, test_f1: 0.5055
 epoch: 73, train_loss: 0.7368, test_loss: 1.0816, test_f1: 0.5145
 epoch: 74, train_loss: 0.7399, test_loss: 1.1427, test_f1: 0.5283
 epoch: 75, train_loss: 0.7277, test_loss: 1.1214, test_f1: 0.5055
 epoch: 76, train_loss: 0.7386, test_loss: 1.1566, test_f1: 0.5006
 epoch: 77, train_loss: 0.7221, test_loss: 1.1439, test_f1: 0.5353
 epoch: 78, train_loss: 0.7251, test_loss: 1.1365, test_f1: 0.5198
 epoch: 79, train_loss: 0.7160, test_loss: 1.1315, test_f1: 0.5364
 epoch: 80, train_loss: 0.7319, test_loss: 1.1420, test_f1: 0.5334
 epoch: 81, train_loss: 0.7367, test_loss: 1.1160, test_f1: 0.5429
 epoch: 82, train_loss: 0.7136, test_loss: 1.1595, test_f1: 0.5029
 epoch: 83, train_loss: 0.7163, test_loss: 1.1219, test_f1: 0.5112
 epoch: 84, train_loss: 0.7080, test_loss: 1.1201, test_f1: 0.5309
 epoch: 85, train_loss: 0.7037, test_loss: 1.1872, test_f1: 0.5253
 epoch: 86, train_loss: 0.7084, test_loss: 1.1853, test_f1: 0.5278
 epoch: 87, train_loss: 0.7340, test_loss: 1.1401, test_f1: 0.5257
 epoch: 88, train_loss: 0.7098, test_loss: 1.2033, test_f1: 0.5332
 epoch: 89, train_loss: 0.7065, test_loss: 1.1517, test_f1: 0.5127
 epoch: 90, train_loss: 0.6919, test_loss: 1.1078, test_f1: 0.5195
 epoch: 91, train_loss: 0.7056, test_loss: 1.2309, test_f1: 0.5294
 epoch: 92, train_loss: 0.6971, test_loss: 1.1630, test_f1: 0.5379
 epoch: 93, train_loss: 0.7112, test_loss: 1.2466, test_f1: 0.5250
 epoch: 94, train_loss: 0.7143, test_loss: 1.1891, test_f1: 0.5236
 epoch: 95, train_loss: 0.6992, test_loss: 1.2346, test_f1: 0.5077
 epoch: 96, train_loss: 0.7001, test_loss: 1.1838, test_f1: 0.5279
 epoch: 97, train_loss: 0.6932, test_loss: 1.1691, test_f1: 0.4985
 epoch: 98, train_loss: 0.6897, test_loss: 1.2628, test_f1: 0.5106
 epoch: 99, train_loss: 0.7001, test_loss: 1.2143, test_f1: 0.5227
##################ITERATION #6 ****************************************
 epoch: 0, train_loss: 1.3284, test_loss: 1.1421, test_f1: 0.4560
 epoch: 1, train_loss: 1.1775, test_loss: 1.1133, test_f1: 0.4603
 epoch: 2, train_loss: 1.1588, test_loss: 1.0897, test_f1: 0.4791
 epoch: 3, train_loss: 1.1221, test_loss: 1.0705, test_f1: 0.4748
 epoch: 4, train_loss: 1.1119, test_loss: 1.0578, test_f1: 0.4619
 epoch: 5, train_loss: 1.0850, test_loss: 1.0453, test_f1: 0.4751
 epoch: 6, train_loss: 1.0642, test_loss: 1.0527, test_f1: 0.4511
 epoch: 7, train_loss: 1.0511, test_loss: 1.0092, test_f1: 0.4573
 epoch: 8, train_loss: 1.0478, test_loss: 1.0152, test_f1: 0.4720
 epoch: 9, train_loss: 1.0336, test_loss: 0.9924, test_f1: 0.4861
 epoch: 10, train_loss: 1.0238, test_loss: 1.0162, test_f1: 0.4472
 epoch: 11, train_loss: 1.0115, test_loss: 0.9884, test_f1: 0.4643
 epoch: 12, train_loss: 0.9876, test_loss: 0.9895, test_f1: 0.4734
 epoch: 13, train_loss: 0.9894, test_loss: 0.9805, test_f1: 0.4636
 epoch: 14, train_loss: 0.9805, test_loss: 1.0006, test_f1: 0.4683
 epoch: 15, train_loss: 0.9741, test_loss: 0.9821, test_f1: 0.4875
 epoch: 16, train_loss: 0.9588, test_loss: 0.9685, test_f1: 0.5030
 epoch: 17, train_loss: 0.9613, test_loss: 1.0129, test_f1: 0.4514
 epoch: 18, train_loss: 0.9514, test_loss: 0.9855, test_f1: 0.4938
 epoch: 19, train_loss: 0.9505, test_loss: 0.9826, test_f1: 0.4959
 epoch: 20, train_loss: 0.9439, test_loss: 0.9924, test_f1: 0.4772
 epoch: 21, train_loss: 0.9331, test_loss: 0.9944, test_f1: 0.4825
 epoch: 22, train_loss: 0.9276, test_loss: 0.9936, test_f1: 0.4971
 epoch: 23, train_loss: 0.9247, test_loss: 0.9772, test_f1: 0.5108
 epoch: 24, train_loss: 0.9100, test_loss: 0.9871, test_f1: 0.4704
 epoch: 25, train_loss: 0.8996, test_loss: 0.9993, test_f1: 0.4955
 epoch: 26, train_loss: 0.9047, test_loss: 1.0054, test_f1: 0.5100
 epoch: 27, train_loss: 0.8972, test_loss: 1.0220, test_f1: 0.4770
 epoch: 28, train_loss: 0.8776, test_loss: 1.0034, test_f1: 0.5083
 epoch: 29, train_loss: 0.8837, test_loss: 1.0164, test_f1: 0.4993
 epoch: 30, train_loss: 0.8721, test_loss: 0.9980, test_f1: 0.5178
 epoch: 31, train_loss: 0.8776, test_loss: 1.0061, test_f1: 0.5154
 epoch: 32, train_loss: 0.8604, test_loss: 1.0208, test_f1: 0.5131
 epoch: 33, train_loss: 0.8666, test_loss: 1.0269, test_f1: 0.5132
 epoch: 34, train_loss: 0.8596, test_loss: 1.0130, test_f1: 0.5360
 epoch: 35, train_loss: 0.8515, test_loss: 1.0471, test_f1: 0.5158
 epoch: 36, train_loss: 0.8579, test_loss: 1.0366, test_f1: 0.5023
 epoch: 37, train_loss: 0.8449, test_loss: 1.0013, test_f1: 0.5124
 epoch: 38, train_loss: 0.8361, test_loss: 1.0184, test_f1: 0.5102
 epoch: 39, train_loss: 0.8359, test_loss: 1.0276, test_f1: 0.5155
 epoch: 40, train_loss: 0.8406, test_loss: 0.9716, test_f1: 0.5204
 epoch: 41, train_loss: 0.8264, test_loss: 1.0300, test_f1: 0.5191
 epoch: 42, train_loss: 0.8161, test_loss: 1.0042, test_f1: 0.5467
 epoch: 43, train_loss: 0.8226, test_loss: 1.0035, test_f1: 0.5229
 epoch: 44, train_loss: 0.8097, test_loss: 0.9994, test_f1: 0.5188
 epoch: 45, train_loss: 0.8165, test_loss: 1.0326, test_f1: 0.5047
 epoch: 46, train_loss: 0.7967, test_loss: 1.0059, test_f1: 0.5335
 epoch: 47, train_loss: 0.7925, test_loss: 0.9944, test_f1: 0.5278
 epoch: 48, train_loss: 0.7989, test_loss: 0.9795, test_f1: 0.5319
 epoch: 49, train_loss: 0.7840, test_loss: 0.9770, test_f1: 0.5334
 epoch: 50, train_loss: 0.7846, test_loss: 0.9842, test_f1: 0.5112
 epoch: 51, train_loss: 0.7718, test_loss: 0.9919, test_f1: 0.5224
 epoch: 52, train_loss: 0.7772, test_loss: 1.0304, test_f1: 0.5153
 epoch: 53, train_loss: 0.7732, test_loss: 0.9933, test_f1: 0.5424
 epoch: 54, train_loss: 0.7650, test_loss: 1.0145, test_f1: 0.5206
 epoch: 55, train_loss: 0.7667, test_loss: 1.0014, test_f1: 0.5283
 epoch: 56, train_loss: 0.7584, test_loss: 0.9972, test_f1: 0.5303
 epoch: 57, train_loss: 0.7454, test_loss: 1.0115, test_f1: 0.5250
 epoch: 58, train_loss: 0.7459, test_loss: 1.0541, test_f1: 0.5335
 epoch: 59, train_loss: 0.7459, test_loss: 1.0561, test_f1: 0.5265
 epoch: 60, train_loss: 0.7557, test_loss: 1.0651, test_f1: 0.5269
 epoch: 61, train_loss: 0.7582, test_loss: 1.0383, test_f1: 0.5257
 epoch: 62, train_loss: 0.7367, test_loss: 1.0403, test_f1: 0.5374
 epoch: 63, train_loss: 0.7280, test_loss: 1.0300, test_f1: 0.5425
 epoch: 64, train_loss: 0.7328, test_loss: 1.0295, test_f1: 0.5250
 epoch: 65, train_loss: 0.7283, test_loss: 1.0569, test_f1: 0.5382
 epoch: 66, train_loss: 0.7277, test_loss: 1.0289, test_f1: 0.5355
 epoch: 67, train_loss: 0.7384, test_loss: 1.0398, test_f1: 0.5451
 epoch: 68, train_loss: 0.7337, test_loss: 1.0463, test_f1: 0.5217
 epoch: 69, train_loss: 0.7239, test_loss: 1.0542, test_f1: 0.5324
 epoch: 70, train_loss: 0.7222, test_loss: 1.0419, test_f1: 0.5160
 epoch: 71, train_loss: 0.7254, test_loss: 1.0664, test_f1: 0.5351
 epoch: 72, train_loss: 0.7142, test_loss: 1.0453, test_f1: 0.5282
 epoch: 73, train_loss: 0.7247, test_loss: 1.0560, test_f1: 0.5374
 epoch: 74, train_loss: 0.7154, test_loss: 1.0970, test_f1: 0.5316
 epoch: 75, train_loss: 0.7261, test_loss: 1.0131, test_f1: 0.5370
 epoch: 76, train_loss: 0.7021, test_loss: 1.0356, test_f1: 0.5267
 epoch: 77, train_loss: 0.7173, test_loss: 1.0355, test_f1: 0.5320
 epoch: 78, train_loss: 0.7116, test_loss: 1.0409, test_f1: 0.5479
 epoch: 79, train_loss: 0.7070, test_loss: 1.0251, test_f1: 0.5555
 epoch: 80, train_loss: 0.7153, test_loss: 1.0344, test_f1: 0.5374
 epoch: 81, train_loss: 0.7066, test_loss: 1.0314, test_f1: 0.5477
 epoch: 82, train_loss: 0.7013, test_loss: 1.0584, test_f1: 0.5457
 epoch: 83, train_loss: 0.6922, test_loss: 1.1004, test_f1: 0.5135
 epoch: 84, train_loss: 0.7038, test_loss: 1.0872, test_f1: 0.5391
 epoch: 85, train_loss: 0.7125, test_loss: 1.0904, test_f1: 0.5391
 epoch: 86, train_loss: 0.6920, test_loss: 1.0897, test_f1: 0.5571
 epoch: 87, train_loss: 0.6928, test_loss: 1.0653, test_f1: 0.5340
 epoch: 88, train_loss: 0.7002, test_loss: 1.0822, test_f1: 0.5337
 epoch: 89, train_loss: 0.6897, test_loss: 1.0447, test_f1: 0.5388
 epoch: 90, train_loss: 0.6992, test_loss: 1.0617, test_f1: 0.5516
 epoch: 91, train_loss: 0.7012, test_loss: 1.1407, test_f1: 0.5115
 epoch: 92, train_loss: 0.6831, test_loss: 1.1090, test_f1: 0.5511
 epoch: 93, train_loss: 0.6772, test_loss: 1.0364, test_f1: 0.5376
 epoch: 94, train_loss: 0.6757, test_loss: 1.1104, test_f1: 0.5390
 epoch: 95, train_loss: 0.6843, test_loss: 1.0944, test_f1: 0.5340
 epoch: 96, train_loss: 0.6798, test_loss: 1.1096, test_f1: 0.5332
 epoch: 97, train_loss: 0.6817, test_loss: 1.1243, test_f1: 0.5270
 epoch: 98, train_loss: 0.6920, test_loss: 1.1079, test_f1: 0.5581
 epoch: 99, train_loss: 0.6831, test_loss: 1.1106, test_f1: 0.5313
##################ITERATION #7 ****************************************
 epoch: 0, train_loss: 1.3134, test_loss: 1.1422, test_f1: 0.4532
 epoch: 1, train_loss: 1.1922, test_loss: 1.0965, test_f1: 0.4504
 epoch: 2, train_loss: 1.1557, test_loss: 1.0748, test_f1: 0.4686
 epoch: 3, train_loss: 1.1296, test_loss: 1.0550, test_f1: 0.4799
 epoch: 4, train_loss: 1.1174, test_loss: 1.0402, test_f1: 0.4802
 epoch: 5, train_loss: 1.0971, test_loss: 1.0109, test_f1: 0.4867
 epoch: 6, train_loss: 1.0853, test_loss: 1.0054, test_f1: 0.4908
 epoch: 7, train_loss: 1.0590, test_loss: 0.9992, test_f1: 0.4802
 epoch: 8, train_loss: 1.0559, test_loss: 0.9743, test_f1: 0.4874
 epoch: 9, train_loss: 1.0465, test_loss: 0.9758, test_f1: 0.4972
 epoch: 10, train_loss: 1.0417, test_loss: 0.9735, test_f1: 0.5148
 epoch: 11, train_loss: 1.0322, test_loss: 0.9812, test_f1: 0.5011
 epoch: 12, train_loss: 1.0136, test_loss: 0.9631, test_f1: 0.5086
 epoch: 13, train_loss: 1.0027, test_loss: 0.9622, test_f1: 0.4595
 epoch: 14, train_loss: 0.9914, test_loss: 0.9693, test_f1: 0.4993
 epoch: 15, train_loss: 0.9689, test_loss: 0.9498, test_f1: 0.4895
 epoch: 16, train_loss: 0.9645, test_loss: 0.9448, test_f1: 0.5083
 epoch: 17, train_loss: 0.9762, test_loss: 0.9515, test_f1: 0.5156
 epoch: 18, train_loss: 0.9701, test_loss: 0.9506, test_f1: 0.4910
 epoch: 19, train_loss: 0.9570, test_loss: 0.9571, test_f1: 0.5123
 epoch: 20, train_loss: 0.9477, test_loss: 0.9475, test_f1: 0.5000
 epoch: 21, train_loss: 0.9466, test_loss: 0.9437, test_f1: 0.4985
 epoch: 22, train_loss: 0.9386, test_loss: 0.9391, test_f1: 0.5111
 epoch: 23, train_loss: 0.9265, test_loss: 0.9601, test_f1: 0.4880
 epoch: 24, train_loss: 0.9178, test_loss: 0.9419, test_f1: 0.5055
 epoch: 25, train_loss: 0.9082, test_loss: 0.9304, test_f1: 0.5232
 epoch: 26, train_loss: 0.9063, test_loss: 0.9428, test_f1: 0.5185
 epoch: 27, train_loss: 0.9132, test_loss: 0.9300, test_f1: 0.5405
 epoch: 28, train_loss: 0.8920, test_loss: 0.9364, test_f1: 0.5121
 epoch: 29, train_loss: 0.8985, test_loss: 0.9413, test_f1: 0.5217
 epoch: 30, train_loss: 0.8909, test_loss: 0.9599, test_f1: 0.5253
 epoch: 31, train_loss: 0.8882, test_loss: 0.9444, test_f1: 0.5252
 epoch: 32, train_loss: 0.8874, test_loss: 0.9339, test_f1: 0.5023
 epoch: 33, train_loss: 0.8703, test_loss: 0.9396, test_f1: 0.5173
 epoch: 34, train_loss: 0.8692, test_loss: 0.9608, test_f1: 0.5479
 epoch: 35, train_loss: 0.8595, test_loss: 0.9310, test_f1: 0.5365
 epoch: 36, train_loss: 0.8450, test_loss: 0.9466, test_f1: 0.5468
 epoch: 37, train_loss: 0.8632, test_loss: 0.9467, test_f1: 0.5192
 epoch: 38, train_loss: 0.8441, test_loss: 0.9525, test_f1: 0.5374
 epoch: 39, train_loss: 0.8506, test_loss: 0.9936, test_f1: 0.5255
 epoch: 40, train_loss: 0.8281, test_loss: 0.9757, test_f1: 0.5294
 epoch: 41, train_loss: 0.8420, test_loss: 0.9606, test_f1: 0.5476
 epoch: 42, train_loss: 0.8267, test_loss: 1.0235, test_f1: 0.5319
 epoch: 43, train_loss: 0.8174, test_loss: 0.9835, test_f1: 0.5337
 epoch: 44, train_loss: 0.8167, test_loss: 0.9640, test_f1: 0.5300
 epoch: 45, train_loss: 0.8204, test_loss: 1.0391, test_f1: 0.5253
 epoch: 46, train_loss: 0.8094, test_loss: 0.9661, test_f1: 0.5356
 epoch: 47, train_loss: 0.8133, test_loss: 1.0302, test_f1: 0.5298
 epoch: 48, train_loss: 0.8032, test_loss: 0.9694, test_f1: 0.5309
 epoch: 49, train_loss: 0.8042, test_loss: 0.9885, test_f1: 0.5412
 epoch: 50, train_loss: 0.8040, test_loss: 0.9728, test_f1: 0.5443
 epoch: 51, train_loss: 0.7853, test_loss: 0.9962, test_f1: 0.5375
 epoch: 52, train_loss: 0.7830, test_loss: 0.9964, test_f1: 0.5353
 epoch: 53, train_loss: 0.7873, test_loss: 0.9963, test_f1: 0.5329
 epoch: 54, train_loss: 0.7744, test_loss: 0.9810, test_f1: 0.5372
 epoch: 55, train_loss: 0.7691, test_loss: 0.9841, test_f1: 0.5374
 epoch: 56, train_loss: 0.7717, test_loss: 1.0009, test_f1: 0.5265
 epoch: 57, train_loss: 0.7584, test_loss: 0.9922, test_f1: 0.5442
 epoch: 58, train_loss: 0.7566, test_loss: 1.0040, test_f1: 0.5289
 epoch: 59, train_loss: 0.7515, test_loss: 1.0016, test_f1: 0.5386
 epoch: 60, train_loss: 0.7508, test_loss: 0.9678, test_f1: 0.5530
 epoch: 61, train_loss: 0.7577, test_loss: 1.0019, test_f1: 0.5359
 epoch: 62, train_loss: 0.7569, test_loss: 0.9999, test_f1: 0.5517
 epoch: 63, train_loss: 0.7461, test_loss: 1.0080, test_f1: 0.5507
 epoch: 64, train_loss: 0.7501, test_loss: 0.9893, test_f1: 0.5480
 epoch: 65, train_loss: 0.7486, test_loss: 1.0182, test_f1: 0.5534
 epoch: 66, train_loss: 0.7593, test_loss: 1.0242, test_f1: 0.5365
 epoch: 67, train_loss: 0.7410, test_loss: 1.0011, test_f1: 0.5474
 epoch: 68, train_loss: 0.7387, test_loss: 1.0538, test_f1: 0.5477
 epoch: 69, train_loss: 0.7368, test_loss: 1.0145, test_f1: 0.5299
 epoch: 70, train_loss: 0.7371, test_loss: 1.0324, test_f1: 0.5329
 epoch: 71, train_loss: 0.7439, test_loss: 1.0176, test_f1: 0.5377
 epoch: 72, train_loss: 0.7319, test_loss: 1.0229, test_f1: 0.5419
 epoch: 73, train_loss: 0.7270, test_loss: 1.0065, test_f1: 0.5415
 epoch: 74, train_loss: 0.7303, test_loss: 1.0289, test_f1: 0.5435
 epoch: 75, train_loss: 0.7240, test_loss: 1.0298, test_f1: 0.5520
 epoch: 76, train_loss: 0.7300, test_loss: 1.0246, test_f1: 0.5380
 epoch: 77, train_loss: 0.7208, test_loss: 1.0389, test_f1: 0.5534
 epoch: 78, train_loss: 0.7190, test_loss: 1.0140, test_f1: 0.5572
 epoch: 79, train_loss: 0.7141, test_loss: 1.0255, test_f1: 0.5458
 epoch: 80, train_loss: 0.7141, test_loss: 1.0736, test_f1: 0.5346
 epoch: 81, train_loss: 0.7122, test_loss: 1.0077, test_f1: 0.5509
 epoch: 82, train_loss: 0.7133, test_loss: 1.1075, test_f1: 0.5376
 epoch: 83, train_loss: 0.7093, test_loss: 1.0358, test_f1: 0.5415
 epoch: 84, train_loss: 0.7027, test_loss: 1.0407, test_f1: 0.5497
 epoch: 85, train_loss: 0.7020, test_loss: 1.0617, test_f1: 0.5427
 epoch: 86, train_loss: 0.7012, test_loss: 1.0497, test_f1: 0.5502
 epoch: 87, train_loss: 0.7091, test_loss: 1.0886, test_f1: 0.5340
 epoch: 88, train_loss: 0.7033, test_loss: 1.1441, test_f1: 0.5336
 epoch: 89, train_loss: 0.7086, test_loss: 1.0641, test_f1: 0.5333
 epoch: 90, train_loss: 0.6968, test_loss: 1.0846, test_f1: 0.5409
 epoch: 91, train_loss: 0.6927, test_loss: 1.0651, test_f1: 0.5424
 epoch: 92, train_loss: 0.6774, test_loss: 1.0827, test_f1: 0.5337
 epoch: 93, train_loss: 0.6925, test_loss: 1.0946, test_f1: 0.5478
 epoch: 94, train_loss: 0.6889, test_loss: 1.0710, test_f1: 0.5352
 epoch: 95, train_loss: 0.6863, test_loss: 1.0897, test_f1: 0.5369
 epoch: 96, train_loss: 0.6780, test_loss: 1.0641, test_f1: 0.5559
 epoch: 97, train_loss: 0.6820, test_loss: 1.0722, test_f1: 0.5505
 epoch: 98, train_loss: 0.6774, test_loss: 1.0960, test_f1: 0.5273
 epoch: 99, train_loss: 0.6877, test_loss: 1.1025, test_f1: 0.5305
##################ITERATION #8 ****************************************
 epoch: 0, train_loss: 1.3812, test_loss: 1.1765, test_f1: 0.4166
 epoch: 1, train_loss: 1.2135, test_loss: 1.1150, test_f1: 0.4414
 epoch: 2, train_loss: 1.1804, test_loss: 1.0804, test_f1: 0.4428
 epoch: 3, train_loss: 1.1601, test_loss: 1.0629, test_f1: 0.4506
 epoch: 4, train_loss: 1.1153, test_loss: 1.0476, test_f1: 0.4450
 epoch: 5, train_loss: 1.1047, test_loss: 1.0246, test_f1: 0.4794
 epoch: 6, train_loss: 1.0914, test_loss: 1.0216, test_f1: 0.4542
 epoch: 7, train_loss: 1.0748, test_loss: 1.0055, test_f1: 0.4667
 epoch: 8, train_loss: 1.0649, test_loss: 1.4442, test_f1: 0.4357
 epoch: 9, train_loss: 1.0328, test_loss: 0.9936, test_f1: 0.4533
 epoch: 10, train_loss: 1.0319, test_loss: 0.9862, test_f1: 0.4801
 epoch: 11, train_loss: 1.0158, test_loss: 0.9888, test_f1: 0.4864
 epoch: 12, train_loss: 0.9957, test_loss: 0.9782, test_f1: 0.4738
 epoch: 13, train_loss: 1.0078, test_loss: 0.9880, test_f1: 0.4847
 epoch: 14, train_loss: 0.9850, test_loss: 0.9962, test_f1: 0.4938
 epoch: 15, train_loss: 0.9919, test_loss: 1.0285, test_f1: 0.4726
 epoch: 16, train_loss: 0.9711, test_loss: 1.2523, test_f1: 0.4524
 epoch: 17, train_loss: 0.9689, test_loss: 1.1894, test_f1: 0.4683
 epoch: 18, train_loss: 0.9396, test_loss: 1.1459, test_f1: 0.4465
 epoch: 19, train_loss: 0.9443, test_loss: 1.2371, test_f1: 0.4712
 epoch: 20, train_loss: 0.9355, test_loss: 0.9817, test_f1: 0.4997
 epoch: 21, train_loss: 0.9313, test_loss: 0.9650, test_f1: 0.4670
 epoch: 22, train_loss: 0.9262, test_loss: 0.9712, test_f1: 0.4795
 epoch: 23, train_loss: 0.9352, test_loss: 1.0106, test_f1: 0.4660
 epoch: 24, train_loss: 0.9071, test_loss: 1.0141, test_f1: 0.4712
 epoch: 25, train_loss: 0.9016, test_loss: 1.0189, test_f1: 0.4847
 epoch: 26, train_loss: 0.8975, test_loss: 1.0095, test_f1: 0.4922
 epoch: 27, train_loss: 0.8778, test_loss: 1.1634, test_f1: 0.4750
 epoch: 28, train_loss: 0.8966, test_loss: 1.0543, test_f1: 0.4840
 epoch: 29, train_loss: 0.8860, test_loss: 1.0372, test_f1: 0.5025
 epoch: 30, train_loss: 0.8688, test_loss: 1.0632, test_f1: 0.4777
 epoch: 31, train_loss: 0.8584, test_loss: 0.9862, test_f1: 0.5099
 epoch: 32, train_loss: 0.8833, test_loss: 1.1290, test_f1: 0.4855
 epoch: 33, train_loss: 0.8594, test_loss: 1.0041, test_f1: 0.4869
 epoch: 34, train_loss: 0.8467, test_loss: 1.0221, test_f1: 0.4695
 epoch: 35, train_loss: 0.8462, test_loss: 1.0264, test_f1: 0.5109
 epoch: 36, train_loss: 0.8328, test_loss: 1.0350, test_f1: 0.4861
 epoch: 37, train_loss: 0.8393, test_loss: 1.0042, test_f1: 0.5002
 epoch: 38, train_loss: 0.8589, test_loss: 0.9921, test_f1: 0.5010
 epoch: 39, train_loss: 0.8389, test_loss: 0.9761, test_f1: 0.5017
 epoch: 40, train_loss: 0.8192, test_loss: 1.2204, test_f1: 0.4917
 epoch: 41, train_loss: 0.8244, test_loss: 1.1152, test_f1: 0.5013
 epoch: 42, train_loss: 0.8173, test_loss: 1.0130, test_f1: 0.5297
 epoch: 43, train_loss: 0.8178, test_loss: 1.0959, test_f1: 0.4992
 epoch: 44, train_loss: 0.8024, test_loss: 1.6886, test_f1: 0.4728
 epoch: 45, train_loss: 0.8043, test_loss: 1.2083, test_f1: 0.4811
 epoch: 46, train_loss: 0.8016, test_loss: 1.0429, test_f1: 0.5001
 epoch: 47, train_loss: 0.7942, test_loss: 1.0753, test_f1: 0.5026
 epoch: 48, train_loss: 0.7816, test_loss: 1.0904, test_f1: 0.5083
 epoch: 49, train_loss: 0.7900, test_loss: 1.0685, test_f1: 0.5253
 epoch: 50, train_loss: 0.7946, test_loss: 1.2274, test_f1: 0.4807
 epoch: 51, train_loss: 0.7668, test_loss: 1.0772, test_f1: 0.5241
 epoch: 52, train_loss: 0.7581, test_loss: 1.1000, test_f1: 0.5023
 epoch: 53, train_loss: 0.7559, test_loss: 1.1053, test_f1: 0.5001
 epoch: 54, train_loss: 0.7449, test_loss: 1.0902, test_f1: 0.5062
 epoch: 55, train_loss: 0.7528, test_loss: 1.1389, test_f1: 0.4856
 epoch: 56, train_loss: 0.7454, test_loss: 1.2006, test_f1: 0.4919
 epoch: 57, train_loss: 0.7523, test_loss: 1.1368, test_f1: 0.5074
 epoch: 58, train_loss: 0.7428, test_loss: 1.1838, test_f1: 0.4927
 epoch: 59, train_loss: 0.7427, test_loss: 1.2158, test_f1: 0.4956
 epoch: 60, train_loss: 0.7347, test_loss: 1.1573, test_f1: 0.4916
 epoch: 61, train_loss: 0.7238, test_loss: 1.2096, test_f1: 0.4873
 epoch: 62, train_loss: 0.7385, test_loss: 1.2324, test_f1: 0.4914
 epoch: 63, train_loss: 0.7196, test_loss: 1.2228, test_f1: 0.4825
 epoch: 64, train_loss: 0.7327, test_loss: 1.1418, test_f1: 0.5007
 epoch: 65, train_loss: 0.7272, test_loss: 1.3940, test_f1: 0.4882
 epoch: 66, train_loss: 0.7066, test_loss: 1.2105, test_f1: 0.4843
 epoch: 67, train_loss: 0.7259, test_loss: 1.2126, test_f1: 0.4886
 epoch: 68, train_loss: 0.7161, test_loss: 1.5465, test_f1: 0.4830
 epoch: 69, train_loss: 0.7180, test_loss: 1.2273, test_f1: 0.5025
 epoch: 70, train_loss: 0.7071, test_loss: 1.1895, test_f1: 0.4927
 epoch: 71, train_loss: 0.7177, test_loss: 1.2389, test_f1: 0.4833
 epoch: 72, train_loss: 0.7262, test_loss: 1.2460, test_f1: 0.4849
 epoch: 73, train_loss: 0.6977, test_loss: 1.3480, test_f1: 0.5016
 epoch: 74, train_loss: 0.7123, test_loss: 1.2211, test_f1: 0.5066
 epoch: 75, train_loss: 0.6987, test_loss: 1.3429, test_f1: 0.5090
 epoch: 76, train_loss: 0.6939, test_loss: 1.1825, test_f1: 0.5012
 epoch: 77, train_loss: 0.6953, test_loss: 1.2754, test_f1: 0.4964
 epoch: 78, train_loss: 0.6976, test_loss: 1.5399, test_f1: 0.5055
 epoch: 79, train_loss: 0.7049, test_loss: 1.2318, test_f1: 0.4881
 epoch: 80, train_loss: 0.6895, test_loss: 1.2969, test_f1: 0.4935
 epoch: 81, train_loss: 0.6956, test_loss: 1.2717, test_f1: 0.5020
 epoch: 82, train_loss: 0.7011, test_loss: 1.3230, test_f1: 0.5094
 epoch: 83, train_loss: 0.6789, test_loss: 1.2236, test_f1: 0.5127
 epoch: 84, train_loss: 0.6908, test_loss: 1.2165, test_f1: 0.5054
 epoch: 85, train_loss: 0.6999, test_loss: 1.1895, test_f1: 0.5031
 epoch: 86, train_loss: 0.6792, test_loss: 1.2557, test_f1: 0.5095
 epoch: 87, train_loss: 0.6826, test_loss: 1.2023, test_f1: 0.4977
 epoch: 88, train_loss: 0.6800, test_loss: 1.2306, test_f1: 0.5045
 epoch: 89, train_loss: 0.6599, test_loss: 1.2819, test_f1: 0.4989
 epoch: 90, train_loss: 0.6853, test_loss: 1.2834, test_f1: 0.4959
 epoch: 91, train_loss: 0.6597, test_loss: 1.2601, test_f1: 0.5105
 epoch: 92, train_loss: 0.6714, test_loss: 1.3593, test_f1: 0.5075
 epoch: 93, train_loss: 0.6666, test_loss: 1.1981, test_f1: 0.5031
 epoch: 94, train_loss: 0.6587, test_loss: 1.3221, test_f1: 0.5059
 epoch: 95, train_loss: 0.6760, test_loss: 1.3107, test_f1: 0.5053
 epoch: 96, train_loss: 0.6646, test_loss: 1.7191, test_f1: 0.5072
 epoch: 97, train_loss: 0.6602, test_loss: 1.3214, test_f1: 0.5062
 epoch: 98, train_loss: 0.6606, test_loss: 1.2795, test_f1: 0.5139
 epoch: 99, train_loss: 0.6577, test_loss: 1.3115, test_f1: 0.5011
##################ITERATION #9 ****************************************
 epoch: 0, train_loss: 1.3398, test_loss: 1.1171, test_f1: 0.4471
 epoch: 1, train_loss: 1.2136, test_loss: 1.0866, test_f1: 0.4821
 epoch: 2, train_loss: 1.1751, test_loss: 1.0654, test_f1: 0.4752
 epoch: 3, train_loss: 1.1430, test_loss: 1.0481, test_f1: 0.4340
 epoch: 4, train_loss: 1.1136, test_loss: 1.0445, test_f1: 0.4598
 epoch: 5, train_loss: 1.0958, test_loss: 1.0144, test_f1: 0.4787
 epoch: 6, train_loss: 1.0856, test_loss: 1.0054, test_f1: 0.4621
 epoch: 7, train_loss: 1.0511, test_loss: 0.9990, test_f1: 0.5030
 epoch: 8, train_loss: 1.0488, test_loss: 0.9900, test_f1: 0.4660
 epoch: 9, train_loss: 1.0257, test_loss: 0.9873, test_f1: 0.4681
 epoch: 10, train_loss: 1.0233, test_loss: 0.9695, test_f1: 0.4838
 epoch: 11, train_loss: 1.0080, test_loss: 0.9735, test_f1: 0.4648
 epoch: 12, train_loss: 0.9963, test_loss: 0.9469, test_f1: 0.4822
 epoch: 13, train_loss: 0.9842, test_loss: 0.9646, test_f1: 0.4892
 epoch: 14, train_loss: 0.9753, test_loss: 0.9482, test_f1: 0.4844
 epoch: 15, train_loss: 0.9720, test_loss: 0.9304, test_f1: 0.4881
 epoch: 16, train_loss: 0.9544, test_loss: 0.9326, test_f1: 0.4928
 epoch: 17, train_loss: 0.9546, test_loss: 0.9536, test_f1: 0.5082
 epoch: 18, train_loss: 0.9521, test_loss: 0.9627, test_f1: 0.4979
 epoch: 19, train_loss: 0.9410, test_loss: 0.9561, test_f1: 0.4898
 epoch: 20, train_loss: 0.9346, test_loss: 0.9276, test_f1: 0.5138
 epoch: 21, train_loss: 0.9201, test_loss: 0.9522, test_f1: 0.5240
 epoch: 22, train_loss: 0.9165, test_loss: 0.9465, test_f1: 0.4906
 epoch: 23, train_loss: 0.9263, test_loss: 0.9181, test_f1: 0.5240
 epoch: 24, train_loss: 0.9207, test_loss: 0.9736, test_f1: 0.5021
 epoch: 25, train_loss: 0.8964, test_loss: 0.9305, test_f1: 0.5202
 epoch: 26, train_loss: 0.8838, test_loss: 0.9500, test_f1: 0.5202
 epoch: 27, train_loss: 0.8889, test_loss: 0.9617, test_f1: 0.5123
 epoch: 28, train_loss: 0.8725, test_loss: 0.9600, test_f1: 0.5222
 epoch: 29, train_loss: 0.8701, test_loss: 0.9889, test_f1: 0.5112
 epoch: 30, train_loss: 0.8728, test_loss: 0.9566, test_f1: 0.5142
 epoch: 31, train_loss: 0.8844, test_loss: 0.9869, test_f1: 0.5094
 epoch: 32, train_loss: 0.8669, test_loss: 0.9794, test_f1: 0.5235
 epoch: 33, train_loss: 0.8647, test_loss: 0.9872, test_f1: 0.5219
 epoch: 34, train_loss: 0.8602, test_loss: 0.9776, test_f1: 0.5216
 epoch: 35, train_loss: 0.8386, test_loss: 0.9375, test_f1: 0.5382
 epoch: 36, train_loss: 0.8440, test_loss: 0.9896, test_f1: 0.5291
 epoch: 37, train_loss: 0.8399, test_loss: 0.9662, test_f1: 0.5252
 epoch: 38, train_loss: 0.8364, test_loss: 0.9814, test_f1: 0.5175
 epoch: 39, train_loss: 0.8278, test_loss: 0.9992, test_f1: 0.5261
 epoch: 40, train_loss: 0.8269, test_loss: 1.0089, test_f1: 0.5306
 epoch: 41, train_loss: 0.8201, test_loss: 0.9808, test_f1: 0.5466
 epoch: 42, train_loss: 0.8135, test_loss: 0.9758, test_f1: 0.5311
 epoch: 43, train_loss: 0.8153, test_loss: 0.9519, test_f1: 0.5370
 epoch: 44, train_loss: 0.8150, test_loss: 0.9819, test_f1: 0.5358
 epoch: 45, train_loss: 0.7923, test_loss: 1.0384, test_f1: 0.5289
 epoch: 46, train_loss: 0.8031, test_loss: 1.0294, test_f1: 0.5492
 epoch: 47, train_loss: 0.8136, test_loss: 1.0156, test_f1: 0.5523
 epoch: 48, train_loss: 0.7874, test_loss: 1.0469, test_f1: 0.5344
 epoch: 49, train_loss: 0.7922, test_loss: 1.0167, test_f1: 0.5211
 epoch: 50, train_loss: 0.7938, test_loss: 1.0527, test_f1: 0.5356
 epoch: 51, train_loss: 0.7786, test_loss: 1.0502, test_f1: 0.5543
 epoch: 52, train_loss: 0.7590, test_loss: 1.0372, test_f1: 0.5452
 epoch: 53, train_loss: 0.7753, test_loss: 1.0358, test_f1: 0.5333
 epoch: 54, train_loss: 0.7530, test_loss: 1.0243, test_f1: 0.5436
 epoch: 55, train_loss: 0.7501, test_loss: 1.0571, test_f1: 0.5335
 epoch: 56, train_loss: 0.7366, test_loss: 1.0350, test_f1: 0.5472
 epoch: 57, train_loss: 0.7626, test_loss: 1.0550, test_f1: 0.5288
 epoch: 58, train_loss: 0.7452, test_loss: 1.0632, test_f1: 0.5365
 epoch: 59, train_loss: 0.7621, test_loss: 1.0629, test_f1: 0.5451
 epoch: 60, train_loss: 0.7457, test_loss: 1.0641, test_f1: 0.5400
 epoch: 61, train_loss: 0.7451, test_loss: 1.0407, test_f1: 0.5430
 epoch: 62, train_loss: 0.7404, test_loss: 1.0703, test_f1: 0.5390
 epoch: 63, train_loss: 0.7347, test_loss: 1.0948, test_f1: 0.5230
 epoch: 64, train_loss: 0.7220, test_loss: 1.1095, test_f1: 0.5336
 epoch: 65, train_loss: 0.7395, test_loss: 1.0883, test_f1: 0.5353
 epoch: 66, train_loss: 0.7281, test_loss: 1.0835, test_f1: 0.5315
 epoch: 67, train_loss: 0.7292, test_loss: 1.1125, test_f1: 0.5345
 epoch: 68, train_loss: 0.7218, test_loss: 1.0788, test_f1: 0.5304
 epoch: 69, train_loss: 0.7278, test_loss: 1.0915, test_f1: 0.5405
 epoch: 70, train_loss: 0.7335, test_loss: 1.1054, test_f1: 0.5321
 epoch: 71, train_loss: 0.7238, test_loss: 1.1093, test_f1: 0.5576
 epoch: 72, train_loss: 0.7112, test_loss: 1.1222, test_f1: 0.5373
 epoch: 73, train_loss: 0.7160, test_loss: 1.1029, test_f1: 0.5273
 epoch: 74, train_loss: 0.7157, test_loss: 1.0718, test_f1: 0.5628
 epoch: 75, train_loss: 0.7141, test_loss: 1.1273, test_f1: 0.5345
 epoch: 76, train_loss: 0.7164, test_loss: 1.1214, test_f1: 0.5389
 epoch: 77, train_loss: 0.7079, test_loss: 1.1103, test_f1: 0.5426
 epoch: 78, train_loss: 0.7053, test_loss: 1.1339, test_f1: 0.5443
 epoch: 79, train_loss: 0.6986, test_loss: 1.1285, test_f1: 0.5291
 epoch: 80, train_loss: 0.7042, test_loss: 1.1222, test_f1: 0.5419
 epoch: 81, train_loss: 0.6957, test_loss: 1.1592, test_f1: 0.5371
 epoch: 82, train_loss: 0.7148, test_loss: 1.0948, test_f1: 0.5482
 epoch: 83, train_loss: 0.6930, test_loss: 1.1143, test_f1: 0.5493
 epoch: 84, train_loss: 0.6961, test_loss: 1.1688, test_f1: 0.5352
 epoch: 85, train_loss: 0.7046, test_loss: 1.1276, test_f1: 0.5366
 epoch: 86, train_loss: 0.6788, test_loss: 1.1121, test_f1: 0.5587
 epoch: 87, train_loss: 0.6919, test_loss: 1.1555, test_f1: 0.5382
 epoch: 88, train_loss: 0.6820, test_loss: 1.1385, test_f1: 0.5339
 epoch: 89, train_loss: 0.6813, test_loss: 1.1117, test_f1: 0.5517
 epoch: 90, train_loss: 0.6861, test_loss: 1.1125, test_f1: 0.5362
 epoch: 91, train_loss: 0.6954, test_loss: 1.1364, test_f1: 0.5400
 epoch: 92, train_loss: 0.6853, test_loss: 1.1535, test_f1: 0.5334
 epoch: 93, train_loss: 0.6763, test_loss: 1.1387, test_f1: 0.5319
 epoch: 94, train_loss: 0.6726, test_loss: 1.1399, test_f1: 0.5370
 epoch: 95, train_loss: 0.6735, test_loss: 1.1452, test_f1: 0.5286
 epoch: 96, train_loss: 0.6726, test_loss: 1.1839, test_f1: 0.5151
 epoch: 97, train_loss: 0.6643, test_loss: 1.1734, test_f1: 0.5335
 epoch: 98, train_loss: 0.6826, test_loss: 1.1612, test_f1: 0.5260
 epoch: 99, train_loss: 0.6711, test_loss: 1.1598, test_f1: 0.5273

Training completed in 792.31 seconds
Best F1: 0.5663 at epoch 66
Mean F1 across iterations: 0.5512  0.0115
========================FINAL RESULTS================================
FEGIN weighted F1: 0.5663  0.0115
python main.py --data ltspice_examples --representation component_component --model FEGIN --layers 2 --hiddens 128 --batch_size 32 --lr 0.0001 --emb_size 250 --epochs 100 --save_appendix component_component_L2_H128_BS32_LR0.0001_E250 --no_val
-----



STDERR:
  File "main.py", line 370, in <module>
    main()
  File "main.py", line 254, in main
    dataset = dataset_class(
  File "/home/philip/projects/ltspice_examples_code_repo/Circuit-Completion-Using-GNNs/component_classification_with_link_prediction_head/evaluation/FEGIN/kernel/circuit_datasets.py", line 15, in __init__
    self.data, self.slices = torch.load(self.processed_paths[0])
  File "/home/philip/.local/lib/python3.8/site-packages/torch/serialization.py", line 1040, in load
    warnings.warn(
  File "/usr/lib/python3.8/warnings.py", line 109, in _showwarnmsg
    sw(msg.message, msg.category, msg.filename, msg.lineno,
  File "main.py", line 47, in warn_with_traceback
    traceback.print_stack(file=log)
/home/philip/projects/ltspice_examples_code_repo/Circuit-Completion-Using-GNNs/component_classification_with_link_prediction_head/evaluation/FEGIN/kernel/circuit_datasets.py:15: FutureWarning: You are using `torch.load` with `weights_only=False` (the current default value), which uses the default pickle module implicitly. It is possible to construct malicious pickle data which will execute arbitrary code during unpickling (See https://github.com/pytorch/pytorch/blob/main/SECURITY.md#untrusted-models for more details). In a future release, the default value for `weights_only` will be flipped to `True`. This limits the functions that could be executed during unpickling. Arbitrary objects will no longer be allowed to be loaded via this mode unless they are explicitly allowlisted by the user via `torch.serialization.add_safe_globals`. We recommend you start setting `weights_only=True` for any use case where you don't have full control of the loaded file. Please open an issue on GitHub for any issues related to this experimental feature.
  self.data, self.slices = torch.load(self.processed_paths[0])
