STDOUT:
Results will be saved in /home/philip/projects/ltspice_examples_code_repo/Circuit-Completion-Using-GNNs/component_classification_with_link_prediction_head/evaluation/FEGIN/results/model_FEGIN_dataset_ltspice_examples
Command line input: python main.py --data ltspice_examples --representation component_pin --model FEGIN --layers 6 --hiddens 64 --batch_size 64 --lr 0.01 --emb_size 250 --epochs 100 --save_appendix component_pin_L6_H64_BS64_LR0.01_E250 --no_val
 is saved.
-----
ltspice_examples - FEGIN
Using 6 layers, 64 hidden units, h = 2
Loading component_pin representation dataset
ENTERED
Training FEGIN on component_pin representation
Train: 3560, Test: 848
##################ITERATION #0 ****************************************
 epoch: 0, train_loss: 1.1807, test_loss: 1.0716, test_f1: 0.3605
 epoch: 1, train_loss: 1.0689, test_loss: 1.1055, test_f1: 0.3605
 epoch: 2, train_loss: 1.0240, test_loss: 1.2414, test_f1: 0.3356
 epoch: 3, train_loss: 0.9950, test_loss: 1.0172, test_f1: 0.4574
 epoch: 4, train_loss: 0.9680, test_loss: 0.9519, test_f1: 0.5255
 epoch: 5, train_loss: 0.9477, test_loss: 1.0587, test_f1: 0.4450
 epoch: 6, train_loss: 0.9362, test_loss: 1.0692, test_f1: 0.4451
 epoch: 7, train_loss: 0.9188, test_loss: 0.9412, test_f1: 0.5084
 epoch: 8, train_loss: 0.8875, test_loss: 0.9430, test_f1: 0.4599
 epoch: 9, train_loss: 0.8893, test_loss: 0.8809, test_f1: 0.5346
 epoch: 10, train_loss: 0.8488, test_loss: 1.2767, test_f1: 0.4285
 epoch: 11, train_loss: 0.8410, test_loss: 1.2315, test_f1: 0.4335
 epoch: 12, train_loss: 0.8445, test_loss: 0.8910, test_f1: 0.4993
 epoch: 13, train_loss: 0.8255, test_loss: 0.8105, test_f1: 0.5690
 epoch: 14, train_loss: 0.8044, test_loss: 0.9651, test_f1: 0.5884
 epoch: 15, train_loss: 0.8021, test_loss: 0.8931, test_f1: 0.5763
 epoch: 16, train_loss: 0.7896, test_loss: 0.8272, test_f1: 0.5478
 epoch: 17, train_loss: 0.7957, test_loss: 0.8445, test_f1: 0.5569
 epoch: 18, train_loss: 0.7957, test_loss: 0.8493, test_f1: 0.5408
 epoch: 19, train_loss: 0.7648, test_loss: 1.0665, test_f1: 0.4982
 epoch: 20, train_loss: 0.7860, test_loss: 0.8391, test_f1: 0.5560
 epoch: 21, train_loss: 0.7630, test_loss: 0.7958, test_f1: 0.6174
 epoch: 22, train_loss: 0.7767, test_loss: 0.8535, test_f1: 0.5839
 epoch: 23, train_loss: 0.7486, test_loss: 0.8247, test_f1: 0.5406
 epoch: 24, train_loss: 0.7474, test_loss: 0.7587, test_f1: 0.6128
 epoch: 25, train_loss: 0.7467, test_loss: 0.9373, test_f1: 0.5345
 epoch: 26, train_loss: 0.7255, test_loss: 0.8434, test_f1: 0.5629
 epoch: 27, train_loss: 0.7476, test_loss: 1.0441, test_f1: 0.5811
 epoch: 28, train_loss: 0.7331, test_loss: 0.7632, test_f1: 0.5741
 epoch: 29, train_loss: 0.7104, test_loss: 0.9014, test_f1: 0.5785
 epoch: 30, train_loss: 0.7173, test_loss: 0.9344, test_f1: 0.5882
 epoch: 31, train_loss: 0.6973, test_loss: 0.9210, test_f1: 0.5717
 epoch: 32, train_loss: 0.7167, test_loss: 0.9600, test_f1: 0.5887
 epoch: 33, train_loss: 0.7016, test_loss: 0.8872, test_f1: 0.5853
 epoch: 34, train_loss: 0.7048, test_loss: 0.7719, test_f1: 0.5873
 epoch: 35, train_loss: 0.6713, test_loss: 0.9481, test_f1: 0.5366
 epoch: 36, train_loss: 0.6877, test_loss: 0.8936, test_f1: 0.6102
 epoch: 37, train_loss: 0.6939, test_loss: 0.7645, test_f1: 0.5603
 epoch: 38, train_loss: 0.6759, test_loss: 0.8217, test_f1: 0.5864
 epoch: 39, train_loss: 0.6966, test_loss: 1.1081, test_f1: 0.5374
 epoch: 40, train_loss: 0.6864, test_loss: 1.1913, test_f1: 0.5412
 epoch: 41, train_loss: 0.6694, test_loss: 0.8649, test_f1: 0.5709
 epoch: 42, train_loss: 0.6698, test_loss: 0.8275, test_f1: 0.5570
 epoch: 43, train_loss: 0.6757, test_loss: 0.8527, test_f1: 0.6329
 epoch: 44, train_loss: 0.6339, test_loss: 0.9503, test_f1: 0.5729
 epoch: 45, train_loss: 0.6461, test_loss: 0.9428, test_f1: 0.5794
 epoch: 46, train_loss: 0.6553, test_loss: 0.8856, test_f1: 0.5553
 epoch: 47, train_loss: 0.6418, test_loss: 0.9132, test_f1: 0.5606
 epoch: 48, train_loss: 0.6536, test_loss: 0.8849, test_f1: 0.5981
 epoch: 49, train_loss: 0.6335, test_loss: 0.9470, test_f1: 0.5625
 epoch: 50, train_loss: 0.6493, test_loss: 0.9463, test_f1: 0.5854
 epoch: 51, train_loss: 0.6049, test_loss: 0.9827, test_f1: 0.6288
 epoch: 52, train_loss: 0.5943, test_loss: 0.8910, test_f1: 0.6354
 epoch: 53, train_loss: 0.5573, test_loss: 0.9489, test_f1: 0.6414
 epoch: 54, train_loss: 0.5646, test_loss: 1.0152, test_f1: 0.6233
 epoch: 55, train_loss: 0.5504, test_loss: 1.1015, test_f1: 0.5923
 epoch: 56, train_loss: 0.5582, test_loss: 1.0206, test_f1: 0.6453
 epoch: 57, train_loss: 0.5461, test_loss: 1.1302, test_f1: 0.6483
 epoch: 58, train_loss: 0.5663, test_loss: 1.0874, test_f1: 0.6214
 epoch: 59, train_loss: 0.5580, test_loss: 1.0445, test_f1: 0.6158
 epoch: 60, train_loss: 0.5355, test_loss: 0.9598, test_f1: 0.6420
 epoch: 61, train_loss: 0.5370, test_loss: 1.0498, test_f1: 0.6381
 epoch: 62, train_loss: 0.5233, test_loss: 1.0669, test_f1: 0.6699
 epoch: 63, train_loss: 0.5522, test_loss: 0.9731, test_f1: 0.6579
 epoch: 64, train_loss: 0.5430, test_loss: 1.0183, test_f1: 0.6071
 epoch: 65, train_loss: 0.5515, test_loss: 0.9691, test_f1: 0.6031
 epoch: 66, train_loss: 0.5176, test_loss: 0.9945, test_f1: 0.6591
 epoch: 67, train_loss: 0.5191, test_loss: 1.0558, test_f1: 0.6237
 epoch: 68, train_loss: 0.5081, test_loss: 0.9774, test_f1: 0.6530
 epoch: 69, train_loss: 0.5233, test_loss: 0.9851, test_f1: 0.6623
 epoch: 70, train_loss: 0.5011, test_loss: 0.9884, test_f1: 0.6522
 epoch: 71, train_loss: 0.5155, test_loss: 1.0618, test_f1: 0.6406
 epoch: 72, train_loss: 0.5124, test_loss: 0.9956, test_f1: 0.6385
 epoch: 73, train_loss: 0.5187, test_loss: 0.9792, test_f1: 0.6823
 epoch: 74, train_loss: 0.5180, test_loss: 1.1133, test_f1: 0.6340
 epoch: 75, train_loss: 0.5144, test_loss: 0.9663, test_f1: 0.6339
 epoch: 76, train_loss: 0.5089, test_loss: 0.8885, test_f1: 0.6806
 epoch: 77, train_loss: 0.4847, test_loss: 0.9573, test_f1: 0.6618
 epoch: 78, train_loss: 0.4932, test_loss: 1.0312, test_f1: 0.6224
 epoch: 79, train_loss: 0.4891, test_loss: 0.9166, test_f1: 0.6946
 epoch: 80, train_loss: 0.5067, test_loss: 0.9728, test_f1: 0.5967
 epoch: 81, train_loss: 0.5040, test_loss: 0.9680, test_f1: 0.6097
 epoch: 82, train_loss: 0.4865, test_loss: 1.0541, test_f1: 0.6467
 epoch: 83, train_loss: 0.4868, test_loss: 0.9752, test_f1: 0.6512
 epoch: 84, train_loss: 0.4769, test_loss: 0.9231, test_f1: 0.6559
 epoch: 85, train_loss: 0.4789, test_loss: 0.9725, test_f1: 0.6643
 epoch: 86, train_loss: 0.4648, test_loss: 1.0324, test_f1: 0.6796
 epoch: 87, train_loss: 0.4643, test_loss: 0.9617, test_f1: 0.6762
 epoch: 88, train_loss: 0.4590, test_loss: 0.9782, test_f1: 0.6817
 epoch: 89, train_loss: 0.4704, test_loss: 1.1391, test_f1: 0.6618
 epoch: 90, train_loss: 0.4668, test_loss: 0.9678, test_f1: 0.6609
 epoch: 91, train_loss: 0.4436, test_loss: 1.0983, test_f1: 0.6614
 epoch: 92, train_loss: 0.4728, test_loss: 1.0534, test_f1: 0.6610
 epoch: 93, train_loss: 0.4642, test_loss: 1.0138, test_f1: 0.6590
 epoch: 94, train_loss: 0.4505, test_loss: 1.1349, test_f1: 0.6497
 epoch: 95, train_loss: 0.4473, test_loss: 1.1559, test_f1: 0.6406
 epoch: 96, train_loss: 0.4443, test_loss: 1.1277, test_f1: 0.6419
 epoch: 97, train_loss: 0.4491, test_loss: 1.1783, test_f1: 0.6312
 epoch: 98, train_loss: 0.4633, test_loss: 1.0150, test_f1: 0.6562
 epoch: 99, train_loss: 0.4451, test_loss: 1.0239, test_f1: 0.6247
##################ITERATION #1 ****************************************
 epoch: 0, train_loss: 1.1643, test_loss: 1.3506, test_f1: 0.4443
 epoch: 1, train_loss: 1.0498, test_loss: 1.0364, test_f1: 0.4683
 epoch: 2, train_loss: 1.0047, test_loss: 1.0170, test_f1: 0.4547
 epoch: 3, train_loss: 0.9878, test_loss: 1.0205, test_f1: 0.4704
 epoch: 4, train_loss: 0.9619, test_loss: 0.9054, test_f1: 0.5338
 epoch: 5, train_loss: 0.9488, test_loss: 1.8040, test_f1: 0.3508
 epoch: 6, train_loss: 0.9331, test_loss: 1.0402, test_f1: 0.4336
 epoch: 7, train_loss: 0.9040, test_loss: 0.9279, test_f1: 0.5129
 epoch: 8, train_loss: 0.9000, test_loss: 0.8742, test_f1: 0.5088
 epoch: 9, train_loss: 0.8709, test_loss: 1.2684, test_f1: 0.4248
 epoch: 10, train_loss: 0.8677, test_loss: 1.1996, test_f1: 0.5092
 epoch: 11, train_loss: 0.8592, test_loss: 0.9122, test_f1: 0.4912
 epoch: 12, train_loss: 0.8445, test_loss: 0.9311, test_f1: 0.4900
 epoch: 13, train_loss: 0.8653, test_loss: 0.9522, test_f1: 0.5559
 epoch: 14, train_loss: 0.8288, test_loss: 0.9070, test_f1: 0.5135
 epoch: 15, train_loss: 0.8168, test_loss: 0.8725, test_f1: 0.5300
 epoch: 16, train_loss: 0.8116, test_loss: 0.9333, test_f1: 0.5632
 epoch: 17, train_loss: 0.8101, test_loss: 0.8031, test_f1: 0.5291
 epoch: 18, train_loss: 0.7890, test_loss: 0.8489, test_f1: 0.5196
 epoch: 19, train_loss: 0.7926, test_loss: 0.7532, test_f1: 0.5564
 epoch: 20, train_loss: 0.7770, test_loss: 0.9043, test_f1: 0.5562
 epoch: 21, train_loss: 0.7678, test_loss: 0.8226, test_f1: 0.5472
 epoch: 22, train_loss: 0.7626, test_loss: 0.8532, test_f1: 0.5420
 epoch: 23, train_loss: 0.7858, test_loss: 0.9057, test_f1: 0.5189
 epoch: 24, train_loss: 0.7778, test_loss: 0.8041, test_f1: 0.6107
 epoch: 25, train_loss: 0.7579, test_loss: 0.7998, test_f1: 0.5916
 epoch: 26, train_loss: 0.7578, test_loss: 0.8226, test_f1: 0.5462
 epoch: 27, train_loss: 0.7194, test_loss: 0.9685, test_f1: 0.5191
 epoch: 28, train_loss: 0.7562, test_loss: 0.8000, test_f1: 0.5521
 epoch: 29, train_loss: 0.7598, test_loss: 0.8898, test_f1: 0.5149
 epoch: 30, train_loss: 0.7240, test_loss: 1.0548, test_f1: 0.5621
 epoch: 31, train_loss: 0.7271, test_loss: 0.8282, test_f1: 0.5773
 epoch: 32, train_loss: 0.7312, test_loss: 0.8252, test_f1: 0.5574
 epoch: 33, train_loss: 0.7164, test_loss: 0.8044, test_f1: 0.6216
 epoch: 34, train_loss: 0.6974, test_loss: 0.7771, test_f1: 0.5753
 epoch: 35, train_loss: 0.6903, test_loss: 0.7572, test_f1: 0.5764
 epoch: 36, train_loss: 0.6790, test_loss: 0.7470, test_f1: 0.6291
 epoch: 37, train_loss: 0.6765, test_loss: 0.7456, test_f1: 0.6313
 epoch: 38, train_loss: 0.6740, test_loss: 0.8115, test_f1: 0.5958
 epoch: 39, train_loss: 0.6872, test_loss: 0.7737, test_f1: 0.6257
 epoch: 40, train_loss: 0.6872, test_loss: 0.8666, test_f1: 0.6098
 epoch: 41, train_loss: 0.6599, test_loss: 0.8228, test_f1: 0.6174
 epoch: 42, train_loss: 0.6548, test_loss: 0.7880, test_f1: 0.6547
 epoch: 43, train_loss: 0.6679, test_loss: 0.7901, test_f1: 0.6588
 epoch: 44, train_loss: 0.6466, test_loss: 0.8308, test_f1: 0.6179
 epoch: 45, train_loss: 0.6475, test_loss: 0.8749, test_f1: 0.6032
 epoch: 46, train_loss: 0.6631, test_loss: 0.7552, test_f1: 0.6121
 epoch: 47, train_loss: 0.6287, test_loss: 0.9563, test_f1: 0.5983
 epoch: 48, train_loss: 0.6289, test_loss: 1.0155, test_f1: 0.5563
 epoch: 49, train_loss: 0.6211, test_loss: 0.7411, test_f1: 0.6864
 epoch: 50, train_loss: 0.6356, test_loss: 0.8055, test_f1: 0.6565
 epoch: 51, train_loss: 0.5859, test_loss: 0.7808, test_f1: 0.6429
 epoch: 52, train_loss: 0.5524, test_loss: 0.7148, test_f1: 0.6727
 epoch: 53, train_loss: 0.5515, test_loss: 0.8458, test_f1: 0.6240
 epoch: 54, train_loss: 0.5602, test_loss: 0.8293, test_f1: 0.6247
 epoch: 55, train_loss: 0.5398, test_loss: 0.7964, test_f1: 0.6417
 epoch: 56, train_loss: 0.5409, test_loss: 0.9306, test_f1: 0.6423
 epoch: 57, train_loss: 0.5450, test_loss: 0.8409, test_f1: 0.6329
 epoch: 58, train_loss: 0.5375, test_loss: 0.8693, test_f1: 0.6302
 epoch: 59, train_loss: 0.5209, test_loss: 1.1073, test_f1: 0.5821
 epoch: 60, train_loss: 0.5326, test_loss: 0.7418, test_f1: 0.6694
 epoch: 61, train_loss: 0.5278, test_loss: 0.9244, test_f1: 0.6374
 epoch: 62, train_loss: 0.5227, test_loss: 0.7905, test_f1: 0.6616
 epoch: 63, train_loss: 0.5215, test_loss: 0.8118, test_f1: 0.6593
 epoch: 64, train_loss: 0.4973, test_loss: 0.8323, test_f1: 0.6437
 epoch: 65, train_loss: 0.4930, test_loss: 0.7435, test_f1: 0.6596
 epoch: 66, train_loss: 0.5018, test_loss: 0.8069, test_f1: 0.6454
 epoch: 67, train_loss: 0.4822, test_loss: 0.8644, test_f1: 0.6467
 epoch: 68, train_loss: 0.4812, test_loss: 0.8338, test_f1: 0.6440
 epoch: 69, train_loss: 0.4819, test_loss: 0.8704, test_f1: 0.6699
 epoch: 70, train_loss: 0.4779, test_loss: 0.8884, test_f1: 0.6608
 epoch: 71, train_loss: 0.4814, test_loss: 1.0289, test_f1: 0.6421
 epoch: 72, train_loss: 0.4942, test_loss: 0.8924, test_f1: 0.6216
 epoch: 73, train_loss: 0.4781, test_loss: 0.8532, test_f1: 0.6510
 epoch: 74, train_loss: 0.4576, test_loss: 0.9912, test_f1: 0.6357
 epoch: 75, train_loss: 0.4770, test_loss: 0.8977, test_f1: 0.6643
 epoch: 76, train_loss: 0.4714, test_loss: 1.1134, test_f1: 0.6147
 epoch: 77, train_loss: 0.4605, test_loss: 1.0959, test_f1: 0.5996
 epoch: 78, train_loss: 0.4392, test_loss: 1.0150, test_f1: 0.6378
 epoch: 79, train_loss: 0.4611, test_loss: 0.9939, test_f1: 0.6394
 epoch: 80, train_loss: 0.4593, test_loss: 1.0692, test_f1: 0.6321
 epoch: 81, train_loss: 0.4390, test_loss: 1.0196, test_f1: 0.6550
 epoch: 82, train_loss: 0.4474, test_loss: 0.9803, test_f1: 0.6610
 epoch: 83, train_loss: 0.4436, test_loss: 1.1194, test_f1: 0.6121
 epoch: 84, train_loss: 0.4519, test_loss: 0.9612, test_f1: 0.6593
 epoch: 85, train_loss: 0.4414, test_loss: 0.9657, test_f1: 0.6521
 epoch: 86, train_loss: 0.4338, test_loss: 0.9852, test_f1: 0.6650
 epoch: 87, train_loss: 0.4291, test_loss: 0.9549, test_f1: 0.6559
 epoch: 88, train_loss: 0.4400, test_loss: 1.0091, test_f1: 0.6463
 epoch: 89, train_loss: 0.4107, test_loss: 1.0307, test_f1: 0.6393
 epoch: 90, train_loss: 0.4244, test_loss: 1.0871, test_f1: 0.6280
 epoch: 91, train_loss: 0.4176, test_loss: 1.0555, test_f1: 0.6567
 epoch: 92, train_loss: 0.4215, test_loss: 0.9275, test_f1: 0.6522
 epoch: 93, train_loss: 0.4349, test_loss: 0.9543, test_f1: 0.6552
 epoch: 94, train_loss: 0.4399, test_loss: 1.2233, test_f1: 0.6263
 epoch: 95, train_loss: 0.4256, test_loss: 1.4887, test_f1: 0.5621
 epoch: 96, train_loss: 0.4255, test_loss: 1.0242, test_f1: 0.6556
 epoch: 97, train_loss: 0.4039, test_loss: 1.0299, test_f1: 0.6573
 epoch: 98, train_loss: 0.4093, test_loss: 1.0865, test_f1: 0.6378
 epoch: 99, train_loss: 0.4161, test_loss: 0.9715, test_f1: 0.6469
##################ITERATION #2 ****************************************
 epoch: 0, train_loss: 1.1750, test_loss: 1.2442, test_f1: 0.3479
 epoch: 1, train_loss: 1.0445, test_loss: 1.1293, test_f1: 0.4756
 epoch: 2, train_loss: 0.9916, test_loss: 0.9949, test_f1: 0.4571
 epoch: 3, train_loss: 0.9716, test_loss: 1.1239, test_f1: 0.4514
 epoch: 4, train_loss: 0.9580, test_loss: 1.0511, test_f1: 0.4758
 epoch: 5, train_loss: 0.9477, test_loss: 0.9875, test_f1: 0.4759
 epoch: 6, train_loss: 0.9513, test_loss: 1.0405, test_f1: 0.4587
 epoch: 7, train_loss: 0.9144, test_loss: 1.1075, test_f1: 0.4498
 epoch: 8, train_loss: 0.9217, test_loss: 0.9699, test_f1: 0.4946
 epoch: 9, train_loss: 0.8809, test_loss: 1.0146, test_f1: 0.4894
 epoch: 10, train_loss: 0.8865, test_loss: 1.0197, test_f1: 0.4951
 epoch: 11, train_loss: 0.8687, test_loss: 0.8861, test_f1: 0.5533
 epoch: 12, train_loss: 0.8553, test_loss: 0.9078, test_f1: 0.5190
 epoch: 13, train_loss: 0.8434, test_loss: 0.9016, test_f1: 0.5258
 epoch: 14, train_loss: 0.8575, test_loss: 0.8793, test_f1: 0.5231
 epoch: 15, train_loss: 0.8263, test_loss: 0.8792, test_f1: 0.5213
 epoch: 16, train_loss: 0.8178, test_loss: 0.9082, test_f1: 0.5729
 epoch: 17, train_loss: 0.8261, test_loss: 0.8985, test_f1: 0.5540
 epoch: 18, train_loss: 0.8152, test_loss: 0.9414, test_f1: 0.5236
 epoch: 19, train_loss: 0.7997, test_loss: 0.9400, test_f1: 0.5258
 epoch: 20, train_loss: 0.7949, test_loss: 0.8946, test_f1: 0.5957
 epoch: 21, train_loss: 0.7853, test_loss: 0.9117, test_f1: 0.5126
 epoch: 22, train_loss: 0.7955, test_loss: 1.0599, test_f1: 0.5117
 epoch: 23, train_loss: 0.7592, test_loss: 0.9824, test_f1: 0.5825
 epoch: 24, train_loss: 0.7664, test_loss: 0.8941, test_f1: 0.5496
 epoch: 25, train_loss: 0.7471, test_loss: 0.8552, test_f1: 0.5539
 epoch: 26, train_loss: 0.7621, test_loss: 0.9762, test_f1: 0.5279
 epoch: 27, train_loss: 0.7527, test_loss: 0.7954, test_f1: 0.5846
 epoch: 28, train_loss: 0.7539, test_loss: 0.9805, test_f1: 0.5485
 epoch: 29, train_loss: 0.7399, test_loss: 0.8727, test_f1: 0.5586
 epoch: 30, train_loss: 0.7314, test_loss: 1.1169, test_f1: 0.5439
 epoch: 31, train_loss: 0.7309, test_loss: 1.0209, test_f1: 0.5437
 epoch: 32, train_loss: 0.7252, test_loss: 0.8609, test_f1: 0.5925
 epoch: 33, train_loss: 0.7158, test_loss: 0.7633, test_f1: 0.5974
 epoch: 34, train_loss: 0.7018, test_loss: 0.7830, test_f1: 0.6243
 epoch: 35, train_loss: 0.6961, test_loss: 0.9988, test_f1: 0.5575
 epoch: 36, train_loss: 0.6954, test_loss: 1.0321, test_f1: 0.5506
 epoch: 37, train_loss: 0.6825, test_loss: 1.0133, test_f1: 0.5569
 epoch: 38, train_loss: 0.6918, test_loss: 0.8504, test_f1: 0.6088
 epoch: 39, train_loss: 0.6792, test_loss: 0.8931, test_f1: 0.5710
 epoch: 40, train_loss: 0.6711, test_loss: 0.8935, test_f1: 0.5869
 epoch: 41, train_loss: 0.6744, test_loss: 1.0390, test_f1: 0.6045
 epoch: 42, train_loss: 0.6588, test_loss: 0.9269, test_f1: 0.6226
 epoch: 43, train_loss: 0.6599, test_loss: 0.7846, test_f1: 0.6604
 epoch: 44, train_loss: 0.6952, test_loss: 0.9363, test_f1: 0.6225
 epoch: 45, train_loss: 0.6482, test_loss: 0.9620, test_f1: 0.6143
 epoch: 46, train_loss: 0.6620, test_loss: 0.8537, test_f1: 0.6122
 epoch: 47, train_loss: 0.6343, test_loss: 1.1822, test_f1: 0.5337
 epoch: 48, train_loss: 0.6620, test_loss: 0.9174, test_f1: 0.5837
 epoch: 49, train_loss: 0.6222, test_loss: 0.9771, test_f1: 0.6298
 epoch: 50, train_loss: 0.6380, test_loss: 0.9719, test_f1: 0.5789
 epoch: 51, train_loss: 0.6050, test_loss: 0.9898, test_f1: 0.6523
 epoch: 52, train_loss: 0.6034, test_loss: 0.9737, test_f1: 0.6343
 epoch: 53, train_loss: 0.5719, test_loss: 0.9384, test_f1: 0.6222
 epoch: 54, train_loss: 0.5600, test_loss: 1.0270, test_f1: 0.6279
 epoch: 55, train_loss: 0.5528, test_loss: 1.0485, test_f1: 0.6032
 epoch: 56, train_loss: 0.5611, test_loss: 1.0795, test_f1: 0.5983
 epoch: 57, train_loss: 0.5508, test_loss: 1.0096, test_f1: 0.6343
 epoch: 58, train_loss: 0.5344, test_loss: 1.0660, test_f1: 0.6171
 epoch: 59, train_loss: 0.5338, test_loss: 1.2492, test_f1: 0.6247
 epoch: 60, train_loss: 0.5390, test_loss: 1.1651, test_f1: 0.6110
 epoch: 61, train_loss: 0.5513, test_loss: 1.1071, test_f1: 0.6161
 epoch: 62, train_loss: 0.5363, test_loss: 1.0133, test_f1: 0.6238
 epoch: 63, train_loss: 0.5327, test_loss: 1.0370, test_f1: 0.6116
 epoch: 64, train_loss: 0.5379, test_loss: 1.0344, test_f1: 0.6249
 epoch: 65, train_loss: 0.5310, test_loss: 1.0476, test_f1: 0.6136
 epoch: 66, train_loss: 0.5221, test_loss: 1.0624, test_f1: 0.5960
 epoch: 67, train_loss: 0.5113, test_loss: 0.9708, test_f1: 0.6331
 epoch: 68, train_loss: 0.5164, test_loss: 1.0503, test_f1: 0.6124
 epoch: 69, train_loss: 0.5124, test_loss: 1.0462, test_f1: 0.6225
 epoch: 70, train_loss: 0.5218, test_loss: 1.1698, test_f1: 0.5971
 epoch: 71, train_loss: 0.4991, test_loss: 1.1715, test_f1: 0.6206
 epoch: 72, train_loss: 0.5062, test_loss: 1.0532, test_f1: 0.6197
 epoch: 73, train_loss: 0.5097, test_loss: 0.9774, test_f1: 0.6090
 epoch: 74, train_loss: 0.5261, test_loss: 1.1656, test_f1: 0.6020
 epoch: 75, train_loss: 0.5584, test_loss: 1.0609, test_f1: 0.6148
 epoch: 76, train_loss: 0.5043, test_loss: 1.1247, test_f1: 0.6217
 epoch: 77, train_loss: 0.5165, test_loss: 1.1381, test_f1: 0.6199
 epoch: 78, train_loss: 0.4909, test_loss: 1.0554, test_f1: 0.6537
 epoch: 79, train_loss: 0.4913, test_loss: 1.1778, test_f1: 0.6105
 epoch: 80, train_loss: 0.4698, test_loss: 1.1254, test_f1: 0.6286
 epoch: 81, train_loss: 0.4832, test_loss: 1.1233, test_f1: 0.6243
 epoch: 82, train_loss: 0.4822, test_loss: 1.0576, test_f1: 0.6299
 epoch: 83, train_loss: 0.4785, test_loss: 0.9382, test_f1: 0.6024
 epoch: 84, train_loss: 0.4716, test_loss: 0.9932, test_f1: 0.6390
 epoch: 85, train_loss: 0.4521, test_loss: 1.0832, test_f1: 0.6043
 epoch: 86, train_loss: 0.4807, test_loss: 1.2038, test_f1: 0.5959
 epoch: 87, train_loss: 0.4819, test_loss: 1.0541, test_f1: 0.6161
 epoch: 88, train_loss: 0.4842, test_loss: 1.1140, test_f1: 0.6121
 epoch: 89, train_loss: 0.4618, test_loss: 1.2564, test_f1: 0.6007
 epoch: 90, train_loss: 0.4551, test_loss: 1.1350, test_f1: 0.6075
 epoch: 91, train_loss: 0.4643, test_loss: 1.0711, test_f1: 0.6233
 epoch: 92, train_loss: 0.4552, test_loss: 1.1160, test_f1: 0.6127
 epoch: 93, train_loss: 0.4593, test_loss: 1.0600, test_f1: 0.6112
 epoch: 94, train_loss: 0.4617, test_loss: 1.1318, test_f1: 0.5978
 epoch: 95, train_loss: 0.4542, test_loss: 1.1799, test_f1: 0.6259
 epoch: 96, train_loss: 0.4502, test_loss: 1.1536, test_f1: 0.6192
 epoch: 97, train_loss: 0.4260, test_loss: 1.1421, test_f1: 0.6435
 epoch: 98, train_loss: 0.4467, test_loss: 1.0655, test_f1: 0.6215
 epoch: 99, train_loss: 0.4344, test_loss: 1.1310, test_f1: 0.6209
##################ITERATION #3 ****************************************
 epoch: 0, train_loss: 1.1566, test_loss: 1.1034, test_f1: 0.4258
 epoch: 1, train_loss: 1.0311, test_loss: 1.0244, test_f1: 0.4873
 epoch: 2, train_loss: 0.9770, test_loss: 0.9477, test_f1: 0.4675
 epoch: 3, train_loss: 0.9360, test_loss: 0.9056, test_f1: 0.5738
 epoch: 4, train_loss: 0.9118, test_loss: 0.8682, test_f1: 0.5065
 epoch: 5, train_loss: 0.9063, test_loss: 0.9738, test_f1: 0.4977
 epoch: 6, train_loss: 0.8990, test_loss: 0.9262, test_f1: 0.4955
 epoch: 7, train_loss: 0.8605, test_loss: 0.9157, test_f1: 0.5440
 epoch: 8, train_loss: 0.8957, test_loss: 0.9399, test_f1: 0.5388
 epoch: 9, train_loss: 0.8995, test_loss: 1.2101, test_f1: 0.4395
 epoch: 10, train_loss: 0.8774, test_loss: 0.9223, test_f1: 0.5379
 epoch: 11, train_loss: 0.8732, test_loss: 0.9155, test_f1: 0.5628
 epoch: 12, train_loss: 0.8703, test_loss: 0.9617, test_f1: 0.5269
 epoch: 13, train_loss: 0.8431, test_loss: 0.8966, test_f1: 0.5775
 epoch: 14, train_loss: 0.8537, test_loss: 0.9173, test_f1: 0.5278
 epoch: 15, train_loss: 0.8537, test_loss: 1.0363, test_f1: 0.4911
 epoch: 16, train_loss: 0.8612, test_loss: 0.9656, test_f1: 0.5394
 epoch: 17, train_loss: 0.8610, test_loss: 0.8654, test_f1: 0.5447
 epoch: 18, train_loss: 0.8295, test_loss: 0.8956, test_f1: 0.5541
 epoch: 19, train_loss: 0.8428, test_loss: 1.0401, test_f1: 0.5416
 epoch: 20, train_loss: 0.8202, test_loss: 1.0836, test_f1: 0.5228
 epoch: 21, train_loss: 0.8226, test_loss: 0.9412, test_f1: 0.5532
 epoch: 22, train_loss: 0.8174, test_loss: 0.9009, test_f1: 0.5549
 epoch: 23, train_loss: 0.7953, test_loss: 0.8704, test_f1: 0.5605
 epoch: 24, train_loss: 0.7796, test_loss: 1.1604, test_f1: 0.4856
 epoch: 25, train_loss: 0.8012, test_loss: 0.9250, test_f1: 0.5551
 epoch: 26, train_loss: 0.7822, test_loss: 0.9106, test_f1: 0.5453
 epoch: 27, train_loss: 0.7780, test_loss: 0.9733, test_f1: 0.5211
 epoch: 28, train_loss: 0.7689, test_loss: 1.0755, test_f1: 0.5456
 epoch: 29, train_loss: 0.7700, test_loss: 1.9045, test_f1: 0.5146
 epoch: 30, train_loss: 0.7806, test_loss: 1.0554, test_f1: 0.5057
 epoch: 31, train_loss: 0.7629, test_loss: 1.0350, test_f1: 0.5634
 epoch: 32, train_loss: 0.7613, test_loss: 0.9608, test_f1: 0.5557
 epoch: 33, train_loss: 0.7506, test_loss: 1.0365, test_f1: 0.5249
 epoch: 34, train_loss: 0.7443, test_loss: 1.0687, test_f1: 0.5464
 epoch: 35, train_loss: 0.7476, test_loss: 0.9797, test_f1: 0.5345
 epoch: 36, train_loss: 0.7385, test_loss: 1.0245, test_f1: 0.5242
 epoch: 37, train_loss: 0.7371, test_loss: 0.8822, test_f1: 0.5918
 epoch: 38, train_loss: 0.7116, test_loss: 1.1778, test_f1: 0.5855
 epoch: 39, train_loss: 0.7182, test_loss: 1.1098, test_f1: 0.5286
 epoch: 40, train_loss: 0.7100, test_loss: 1.2086, test_f1: 0.4829
 epoch: 41, train_loss: 0.7327, test_loss: 1.2481, test_f1: 0.5354
 epoch: 42, train_loss: 0.7361, test_loss: 0.9461, test_f1: 0.5692
 epoch: 43, train_loss: 0.7321, test_loss: 0.9293, test_f1: 0.5603
 epoch: 44, train_loss: 0.7159, test_loss: 1.0324, test_f1: 0.5563
 epoch: 45, train_loss: 0.6950, test_loss: 0.9325, test_f1: 0.5629
 epoch: 46, train_loss: 0.7196, test_loss: 0.9935, test_f1: 0.5330
 epoch: 47, train_loss: 0.7339, test_loss: 1.0158, test_f1: 0.5678
 epoch: 48, train_loss: 0.6896, test_loss: 0.8793, test_f1: 0.5625
 epoch: 49, train_loss: 0.6881, test_loss: 0.8995, test_f1: 0.5824
 epoch: 50, train_loss: 0.7063, test_loss: 0.8745, test_f1: 0.5693
 epoch: 51, train_loss: 0.6645, test_loss: 0.9737, test_f1: 0.6169
 epoch: 52, train_loss: 0.6392, test_loss: 1.0076, test_f1: 0.5629
 epoch: 53, train_loss: 0.6296, test_loss: 0.9966, test_f1: 0.5776
 epoch: 54, train_loss: 0.6228, test_loss: 0.9538, test_f1: 0.5752
 epoch: 55, train_loss: 0.6253, test_loss: 1.0177, test_f1: 0.5734
 epoch: 56, train_loss: 0.6120, test_loss: 0.8746, test_f1: 0.6384
 epoch: 57, train_loss: 0.5941, test_loss: 0.9434, test_f1: 0.6026
 epoch: 58, train_loss: 0.5965, test_loss: 0.9145, test_f1: 0.6255
 epoch: 59, train_loss: 0.6139, test_loss: 0.9520, test_f1: 0.6421
 epoch: 60, train_loss: 0.6115, test_loss: 1.0005, test_f1: 0.5814
 epoch: 61, train_loss: 0.6010, test_loss: 0.9639, test_f1: 0.5957
 epoch: 62, train_loss: 0.6176, test_loss: 0.9503, test_f1: 0.5934
 epoch: 63, train_loss: 0.5855, test_loss: 1.0552, test_f1: 0.5747
 epoch: 64, train_loss: 0.5725, test_loss: 0.9268, test_f1: 0.5965
 epoch: 65, train_loss: 0.5949, test_loss: 1.0015, test_f1: 0.5929
 epoch: 66, train_loss: 0.5720, test_loss: 0.8963, test_f1: 0.6114
 epoch: 67, train_loss: 0.5927, test_loss: 0.9099, test_f1: 0.6219
 epoch: 68, train_loss: 0.5749, test_loss: 0.9464, test_f1: 0.6025
 epoch: 69, train_loss: 0.5735, test_loss: 0.9374, test_f1: 0.6332
 epoch: 70, train_loss: 0.5649, test_loss: 0.8861, test_f1: 0.6175
 epoch: 71, train_loss: 0.5688, test_loss: 0.9029, test_f1: 0.6273
 epoch: 72, train_loss: 0.5429, test_loss: 0.8605, test_f1: 0.6027
 epoch: 73, train_loss: 0.5774, test_loss: 0.9719, test_f1: 0.5779
 epoch: 74, train_loss: 0.5444, test_loss: 0.9297, test_f1: 0.6073
 epoch: 75, train_loss: 0.5408, test_loss: 0.8968, test_f1: 0.5931
 epoch: 76, train_loss: 0.5392, test_loss: 0.8857, test_f1: 0.6362
 epoch: 77, train_loss: 0.5306, test_loss: 0.9833, test_f1: 0.6206
 epoch: 78, train_loss: 0.5399, test_loss: 0.9757, test_f1: 0.6151
 epoch: 79, train_loss: 0.5414, test_loss: 1.0079, test_f1: 0.6098
 epoch: 80, train_loss: 0.5448, test_loss: 0.9359, test_f1: 0.6300
 epoch: 81, train_loss: 0.5235, test_loss: 0.9353, test_f1: 0.6328
 epoch: 82, train_loss: 0.5357, test_loss: 0.9681, test_f1: 0.6208
 epoch: 83, train_loss: 0.5419, test_loss: 0.8673, test_f1: 0.6180
 epoch: 84, train_loss: 0.5076, test_loss: 0.9434, test_f1: 0.6478
 epoch: 85, train_loss: 0.5069, test_loss: 1.0701, test_f1: 0.6253
 epoch: 86, train_loss: 0.5314, test_loss: 0.9854, test_f1: 0.6244
 epoch: 87, train_loss: 0.5226, test_loss: 1.0120, test_f1: 0.6157
 epoch: 88, train_loss: 0.5215, test_loss: 0.9026, test_f1: 0.6409
 epoch: 89, train_loss: 0.5136, test_loss: 0.9469, test_f1: 0.6485
 epoch: 90, train_loss: 0.5056, test_loss: 1.0315, test_f1: 0.6296
 epoch: 91, train_loss: 0.5109, test_loss: 1.1824, test_f1: 0.6360
 epoch: 92, train_loss: 0.5295, test_loss: 0.9945, test_f1: 0.6203
 epoch: 93, train_loss: 0.5040, test_loss: 0.9446, test_f1: 0.6433
 epoch: 94, train_loss: 0.4998, test_loss: 1.0554, test_f1: 0.5899
 epoch: 95, train_loss: 0.4878, test_loss: 0.9233, test_f1: 0.6510
 epoch: 96, train_loss: 0.5129, test_loss: 0.8805, test_f1: 0.6461
 epoch: 97, train_loss: 0.4912, test_loss: 0.9295, test_f1: 0.6222
 epoch: 98, train_loss: 0.5025, test_loss: 0.9003, test_f1: 0.6434
 epoch: 99, train_loss: 0.4834, test_loss: 0.8585, test_f1: 0.6527
##################ITERATION #4 ****************************************
 epoch: 0, train_loss: 1.1730, test_loss: 1.1359, test_f1: 0.4822
 epoch: 1, train_loss: 0.9695, test_loss: 1.0287, test_f1: 0.4889
 epoch: 2, train_loss: 0.9379, test_loss: 0.9457, test_f1: 0.5155
 epoch: 3, train_loss: 0.9256, test_loss: 1.0148, test_f1: 0.4864
 epoch: 4, train_loss: 0.9125, test_loss: 1.2101, test_f1: 0.4419
 epoch: 5, train_loss: 0.9024, test_loss: 1.4879, test_f1: 0.3637
 epoch: 6, train_loss: 0.8826, test_loss: 1.0073, test_f1: 0.5462
 epoch: 7, train_loss: 0.8870, test_loss: 0.9642, test_f1: 0.5205
 epoch: 8, train_loss: 0.8494, test_loss: 0.8434, test_f1: 0.5399
 epoch: 9, train_loss: 0.8475, test_loss: 0.9620, test_f1: 0.5616
 epoch: 10, train_loss: 0.8362, test_loss: 1.1496, test_f1: 0.5396
 epoch: 11, train_loss: 0.8290, test_loss: 0.8615, test_f1: 0.6239
 epoch: 12, train_loss: 0.7988, test_loss: 0.8010, test_f1: 0.6070
 epoch: 13, train_loss: 0.8297, test_loss: 0.9561, test_f1: 0.5354
 epoch: 14, train_loss: 0.8182, test_loss: 1.0378, test_f1: 0.5780
 epoch: 15, train_loss: 0.8081, test_loss: 1.3687, test_f1: 0.4820
 epoch: 16, train_loss: 0.7800, test_loss: 0.9019, test_f1: 0.5440
 epoch: 17, train_loss: 0.7859, test_loss: 0.8479, test_f1: 0.6449
 epoch: 18, train_loss: 0.7853, test_loss: 0.8179, test_f1: 0.5682
 epoch: 19, train_loss: 0.7607, test_loss: 0.7941, test_f1: 0.5507
 epoch: 20, train_loss: 0.7767, test_loss: 0.8071, test_f1: 0.6421
 epoch: 21, train_loss: 0.7491, test_loss: 1.6888, test_f1: 0.4356
 epoch: 22, train_loss: 0.7555, test_loss: 0.8399, test_f1: 0.5014
 epoch: 23, train_loss: 0.7651, test_loss: 1.1166, test_f1: 0.5095
 epoch: 24, train_loss: 0.7442, test_loss: 0.9347, test_f1: 0.5778
 epoch: 25, train_loss: 0.7398, test_loss: 0.7917, test_f1: 0.6292
 epoch: 26, train_loss: 0.7329, test_loss: 0.9128, test_f1: 0.5996
 epoch: 27, train_loss: 0.7140, test_loss: 0.8616, test_f1: 0.5763
 epoch: 28, train_loss: 0.7039, test_loss: 0.8888, test_f1: 0.5641
 epoch: 29, train_loss: 0.7343, test_loss: 0.7852, test_f1: 0.6114
 epoch: 30, train_loss: 0.7107, test_loss: 0.9948, test_f1: 0.5299
 epoch: 31, train_loss: 0.7060, test_loss: 0.7985, test_f1: 0.6011
 epoch: 32, train_loss: 0.7112, test_loss: 0.8567, test_f1: 0.5578
 epoch: 33, train_loss: 0.6946, test_loss: 0.8515, test_f1: 0.5770
 epoch: 34, train_loss: 0.6792, test_loss: 0.9644, test_f1: 0.5753
 epoch: 35, train_loss: 0.6929, test_loss: 0.7929, test_f1: 0.6199
 epoch: 36, train_loss: 0.6789, test_loss: 1.3784, test_f1: 0.5121
 epoch: 37, train_loss: 0.6899, test_loss: 0.8393, test_f1: 0.5601
 epoch: 38, train_loss: 0.6713, test_loss: 0.9047, test_f1: 0.5424
 epoch: 39, train_loss: 0.6816, test_loss: 0.8318, test_f1: 0.5788
 epoch: 40, train_loss: 0.6835, test_loss: 0.8496, test_f1: 0.5388
 epoch: 41, train_loss: 0.6668, test_loss: 0.9686, test_f1: 0.5893
 epoch: 42, train_loss: 0.6772, test_loss: 0.9267, test_f1: 0.5538
 epoch: 43, train_loss: 0.6937, test_loss: 0.8789, test_f1: 0.6437
 epoch: 44, train_loss: 0.6568, test_loss: 0.7706, test_f1: 0.6215
 epoch: 45, train_loss: 0.6579, test_loss: 0.8014, test_f1: 0.6176
 epoch: 46, train_loss: 0.6665, test_loss: 0.9271, test_f1: 0.6116
 epoch: 47, train_loss: 0.6368, test_loss: 0.8781, test_f1: 0.6223
 epoch: 48, train_loss: 0.6485, test_loss: 0.8674, test_f1: 0.6287
 epoch: 49, train_loss: 0.6613, test_loss: 0.8108, test_f1: 0.6268
 epoch: 50, train_loss: 0.6468, test_loss: 0.7467, test_f1: 0.6536
 epoch: 51, train_loss: 0.6178, test_loss: 0.8762, test_f1: 0.6024
 epoch: 52, train_loss: 0.5869, test_loss: 0.8217, test_f1: 0.6468
 epoch: 53, train_loss: 0.5820, test_loss: 0.8069, test_f1: 0.6439
 epoch: 54, train_loss: 0.5677, test_loss: 0.7227, test_f1: 0.6498
 epoch: 55, train_loss: 0.5832, test_loss: 0.8052, test_f1: 0.6421
 epoch: 56, train_loss: 0.5721, test_loss: 0.7778, test_f1: 0.6262
 epoch: 57, train_loss: 0.5593, test_loss: 0.8528, test_f1: 0.5983
 epoch: 58, train_loss: 0.5620, test_loss: 0.8916, test_f1: 0.5962
 epoch: 59, train_loss: 0.5442, test_loss: 0.7917, test_f1: 0.6554
 epoch: 60, train_loss: 0.5444, test_loss: 0.8190, test_f1: 0.6544
 epoch: 61, train_loss: 0.5322, test_loss: 0.8676, test_f1: 0.6337
 epoch: 62, train_loss: 0.5463, test_loss: 0.8876, test_f1: 0.6590
 epoch: 63, train_loss: 0.5516, test_loss: 0.9066, test_f1: 0.6141
 epoch: 64, train_loss: 0.5369, test_loss: 0.8207, test_f1: 0.6512
 epoch: 65, train_loss: 0.5316, test_loss: 0.8984, test_f1: 0.6132
 epoch: 66, train_loss: 0.5387, test_loss: 0.8291, test_f1: 0.6303
 epoch: 67, train_loss: 0.5285, test_loss: 0.7754, test_f1: 0.6053
 epoch: 68, train_loss: 0.5377, test_loss: 0.8135, test_f1: 0.6504
 epoch: 69, train_loss: 0.5211, test_loss: 0.8279, test_f1: 0.6478
 epoch: 70, train_loss: 0.5153, test_loss: 0.7652, test_f1: 0.6836
 epoch: 71, train_loss: 0.5033, test_loss: 0.8631, test_f1: 0.6459
 epoch: 72, train_loss: 0.5095, test_loss: 0.9395, test_f1: 0.6445
 epoch: 73, train_loss: 0.5222, test_loss: 0.7401, test_f1: 0.6701
 epoch: 74, train_loss: 0.5136, test_loss: 0.9113, test_f1: 0.6099
 epoch: 75, train_loss: 0.5114, test_loss: 0.8428, test_f1: 0.6317
 epoch: 76, train_loss: 0.5102, test_loss: 0.8793, test_f1: 0.6145
 epoch: 77, train_loss: 0.5017, test_loss: 0.7800, test_f1: 0.6584
 epoch: 78, train_loss: 0.5094, test_loss: 0.8142, test_f1: 0.6156
 epoch: 79, train_loss: 0.4998, test_loss: 0.7473, test_f1: 0.6787
 epoch: 80, train_loss: 0.4930, test_loss: 0.9211, test_f1: 0.6423
 epoch: 81, train_loss: 0.4795, test_loss: 0.9402, test_f1: 0.6170
 epoch: 82, train_loss: 0.4675, test_loss: 0.8421, test_f1: 0.6624
 epoch: 83, train_loss: 0.4872, test_loss: 0.8417, test_f1: 0.6667
 epoch: 84, train_loss: 0.5001, test_loss: 0.9735, test_f1: 0.6063
 epoch: 85, train_loss: 0.4872, test_loss: 0.8052, test_f1: 0.6804
 epoch: 86, train_loss: 0.4812, test_loss: 0.8916, test_f1: 0.6255
 epoch: 87, train_loss: 0.4907, test_loss: 0.8492, test_f1: 0.6299
 epoch: 88, train_loss: 0.4654, test_loss: 0.9114, test_f1: 0.6527
 epoch: 89, train_loss: 0.4538, test_loss: 0.8411, test_f1: 0.6537
 epoch: 90, train_loss: 0.4664, test_loss: 0.9876, test_f1: 0.6289
 epoch: 91, train_loss: 0.4741, test_loss: 1.0162, test_f1: 0.6255
 epoch: 92, train_loss: 0.4739, test_loss: 0.8345, test_f1: 0.6417
 epoch: 93, train_loss: 0.4661, test_loss: 0.7995, test_f1: 0.6463
 epoch: 94, train_loss: 0.4592, test_loss: 0.8938, test_f1: 0.6430
 epoch: 95, train_loss: 0.4462, test_loss: 0.9430, test_f1: 0.6398
 epoch: 96, train_loss: 0.4646, test_loss: 0.8854, test_f1: 0.6530
 epoch: 97, train_loss: 0.4387, test_loss: 0.8230, test_f1: 0.6600
 epoch: 98, train_loss: 0.4381, test_loss: 0.9157, test_f1: 0.6557
 epoch: 99, train_loss: 0.4300, test_loss: 0.8795, test_f1: 0.6477
##################ITERATION #5 ****************************************
 epoch: 0, train_loss: 1.1696, test_loss: 1.0881, test_f1: 0.4013
 epoch: 1, train_loss: 1.0283, test_loss: 1.0445, test_f1: 0.4936
 epoch: 2, train_loss: 1.0049, test_loss: 1.0503, test_f1: 0.4714
 epoch: 3, train_loss: 0.9649, test_loss: 1.0120, test_f1: 0.5131
 epoch: 4, train_loss: 0.9510, test_loss: 0.9989, test_f1: 0.4816
 epoch: 5, train_loss: 0.9204, test_loss: 0.9382, test_f1: 0.5463
 epoch: 6, train_loss: 0.9060, test_loss: 0.9526, test_f1: 0.5523
 epoch: 7, train_loss: 0.8957, test_loss: 0.9482, test_f1: 0.5095
 epoch: 8, train_loss: 0.8937, test_loss: 1.0415, test_f1: 0.4984
 epoch: 9, train_loss: 0.8751, test_loss: 1.0312, test_f1: 0.5149
 epoch: 10, train_loss: 0.8835, test_loss: 0.9055, test_f1: 0.5483
 epoch: 11, train_loss: 0.8517, test_loss: 0.8708, test_f1: 0.5783
 epoch: 12, train_loss: 0.8358, test_loss: 0.9951, test_f1: 0.4941
 epoch: 13, train_loss: 0.8455, test_loss: 0.9289, test_f1: 0.5329
 epoch: 14, train_loss: 0.8190, test_loss: 0.8561, test_f1: 0.5770
 epoch: 15, train_loss: 0.8170, test_loss: 0.8360, test_f1: 0.5828
 epoch: 16, train_loss: 0.8032, test_loss: 1.0460, test_f1: 0.5249
 epoch: 17, train_loss: 0.7990, test_loss: 0.9552, test_f1: 0.5640
 epoch: 18, train_loss: 0.8037, test_loss: 0.9611, test_f1: 0.4910
 epoch: 19, train_loss: 0.7933, test_loss: 1.3093, test_f1: 0.4572
 epoch: 20, train_loss: 0.8079, test_loss: 0.8784, test_f1: 0.5250
 epoch: 21, train_loss: 0.7927, test_loss: 0.9096, test_f1: 0.6002
 epoch: 22, train_loss: 0.7760, test_loss: 0.8956, test_f1: 0.5778
 epoch: 23, train_loss: 0.7736, test_loss: 1.0164, test_f1: 0.5398
 epoch: 24, train_loss: 0.7574, test_loss: 1.0006, test_f1: 0.5580
 epoch: 25, train_loss: 0.7615, test_loss: 0.8877, test_f1: 0.5318
 epoch: 26, train_loss: 0.7542, test_loss: 1.0105, test_f1: 0.5684
 epoch: 27, train_loss: 0.7536, test_loss: 1.3285, test_f1: 0.4905
 epoch: 28, train_loss: 0.7590, test_loss: 0.9886, test_f1: 0.5970
 epoch: 29, train_loss: 0.7391, test_loss: 0.9156, test_f1: 0.5372
 epoch: 30, train_loss: 0.7197, test_loss: 0.8812, test_f1: 0.6014
 epoch: 31, train_loss: 0.7209, test_loss: 1.0347, test_f1: 0.5514
 epoch: 32, train_loss: 0.7211, test_loss: 0.8898, test_f1: 0.6241
 epoch: 33, train_loss: 0.7277, test_loss: 0.8794, test_f1: 0.5644
 epoch: 34, train_loss: 0.7278, test_loss: 0.9188, test_f1: 0.6129
 epoch: 35, train_loss: 0.6990, test_loss: 0.9482, test_f1: 0.6155
 epoch: 36, train_loss: 0.7124, test_loss: 0.8609, test_f1: 0.5814
 epoch: 37, train_loss: 0.7135, test_loss: 0.9456, test_f1: 0.5927
 epoch: 38, train_loss: 0.7117, test_loss: 0.8859, test_f1: 0.5961
 epoch: 39, train_loss: 0.6908, test_loss: 0.8602, test_f1: 0.6255
 epoch: 40, train_loss: 0.6849, test_loss: 0.8897, test_f1: 0.6178
 epoch: 41, train_loss: 0.6809, test_loss: 1.1200, test_f1: 0.5627
 epoch: 42, train_loss: 0.6908, test_loss: 0.9827, test_f1: 0.5878
 epoch: 43, train_loss: 0.6728, test_loss: 0.9532, test_f1: 0.5973
 epoch: 44, train_loss: 0.6732, test_loss: 0.9211, test_f1: 0.6111
 epoch: 45, train_loss: 0.6727, test_loss: 0.9187, test_f1: 0.6162
 epoch: 46, train_loss: 0.6712, test_loss: 0.9073, test_f1: 0.5857
 epoch: 47, train_loss: 0.6524, test_loss: 0.8747, test_f1: 0.5895
 epoch: 48, train_loss: 0.6607, test_loss: 0.9697, test_f1: 0.6346
 epoch: 49, train_loss: 0.6520, test_loss: 0.8378, test_f1: 0.5827
 epoch: 50, train_loss: 0.6589, test_loss: 0.8869, test_f1: 0.6267
 epoch: 51, train_loss: 0.5996, test_loss: 0.9084, test_f1: 0.6478
 epoch: 52, train_loss: 0.5791, test_loss: 0.9261, test_f1: 0.6325
 epoch: 53, train_loss: 0.5797, test_loss: 0.9605, test_f1: 0.6349
 epoch: 54, train_loss: 0.5757, test_loss: 0.9373, test_f1: 0.6279
 epoch: 55, train_loss: 0.5689, test_loss: 0.9630, test_f1: 0.6235
 epoch: 56, train_loss: 0.5642, test_loss: 0.9647, test_f1: 0.6124
 epoch: 57, train_loss: 0.5500, test_loss: 0.9837, test_f1: 0.6167
 epoch: 58, train_loss: 0.5531, test_loss: 0.9890, test_f1: 0.6227
 epoch: 59, train_loss: 0.5470, test_loss: 1.0355, test_f1: 0.6446
 epoch: 60, train_loss: 0.5587, test_loss: 0.9909, test_f1: 0.6521
 epoch: 61, train_loss: 0.5532, test_loss: 0.8520, test_f1: 0.6719
 epoch: 62, train_loss: 0.5392, test_loss: 1.0695, test_f1: 0.6263
 epoch: 63, train_loss: 0.5342, test_loss: 0.9438, test_f1: 0.6352
 epoch: 64, train_loss: 0.5318, test_loss: 1.0391, test_f1: 0.6494
 epoch: 65, train_loss: 0.5324, test_loss: 1.0590, test_f1: 0.6128
 epoch: 66, train_loss: 0.5213, test_loss: 1.0382, test_f1: 0.6319
 epoch: 67, train_loss: 0.5313, test_loss: 1.1110, test_f1: 0.6475
 epoch: 68, train_loss: 0.5156, test_loss: 1.0185, test_f1: 0.6173
 epoch: 69, train_loss: 0.5201, test_loss: 1.0040, test_f1: 0.6224
 epoch: 70, train_loss: 0.5094, test_loss: 1.0614, test_f1: 0.6348
 epoch: 71, train_loss: 0.5114, test_loss: 1.0225, test_f1: 0.6511
 epoch: 72, train_loss: 0.5055, test_loss: 1.0944, test_f1: 0.6489
 epoch: 73, train_loss: 0.5123, test_loss: 1.0658, test_f1: 0.6451
 epoch: 74, train_loss: 0.5103, test_loss: 0.9861, test_f1: 0.6476
 epoch: 75, train_loss: 0.4952, test_loss: 1.0759, test_f1: 0.6536
 epoch: 76, train_loss: 0.5048, test_loss: 1.1161, test_f1: 0.6562
 epoch: 77, train_loss: 0.4933, test_loss: 1.1639, test_f1: 0.6605
 epoch: 78, train_loss: 0.4889, test_loss: 1.0521, test_f1: 0.6582
 epoch: 79, train_loss: 0.4966, test_loss: 1.2196, test_f1: 0.6379
 epoch: 80, train_loss: 0.4864, test_loss: 1.1015, test_f1: 0.6807
 epoch: 81, train_loss: 0.4917, test_loss: 1.1111, test_f1: 0.6514
 epoch: 82, train_loss: 0.5012, test_loss: 0.9166, test_f1: 0.6241
 epoch: 83, train_loss: 0.4896, test_loss: 1.0577, test_f1: 0.6455
 epoch: 84, train_loss: 0.4751, test_loss: 1.0417, test_f1: 0.6928
 epoch: 85, train_loss: 0.4664, test_loss: 1.0211, test_f1: 0.6545
 epoch: 86, train_loss: 0.4779, test_loss: 1.1960, test_f1: 0.6344
 epoch: 87, train_loss: 0.4792, test_loss: 1.0991, test_f1: 0.6544
 epoch: 88, train_loss: 0.4684, test_loss: 1.2036, test_f1: 0.6245
 epoch: 89, train_loss: 0.4673, test_loss: 1.1000, test_f1: 0.6562
 epoch: 90, train_loss: 0.4663, test_loss: 1.1197, test_f1: 0.6541
 epoch: 91, train_loss: 0.4443, test_loss: 1.1718, test_f1: 0.6531
 epoch: 92, train_loss: 0.4620, test_loss: 1.1542, test_f1: 0.6634
 epoch: 93, train_loss: 0.4383, test_loss: 1.1541, test_f1: 0.6569
 epoch: 94, train_loss: 0.4510, test_loss: 1.1790, test_f1: 0.6468
 epoch: 95, train_loss: 0.4709, test_loss: 1.3262, test_f1: 0.6324
 epoch: 96, train_loss: 0.4304, test_loss: 1.1837, test_f1: 0.6674
 epoch: 97, train_loss: 0.4194, test_loss: 1.2359, test_f1: 0.6454
 epoch: 98, train_loss: 0.4394, test_loss: 1.3409, test_f1: 0.6789
 epoch: 99, train_loss: 0.4351, test_loss: 1.2755, test_f1: 0.6583
##################ITERATION #6 ****************************************
 epoch: 0, train_loss: 1.1857, test_loss: 1.0841, test_f1: 0.4303
 epoch: 1, train_loss: 1.0095, test_loss: 1.0616, test_f1: 0.4702
 epoch: 2, train_loss: 0.9822, test_loss: 1.0521, test_f1: 0.5158
 epoch: 3, train_loss: 0.9590, test_loss: 0.9877, test_f1: 0.5171
 epoch: 4, train_loss: 0.9431, test_loss: 1.0371, test_f1: 0.5295
 epoch: 5, train_loss: 0.9175, test_loss: 0.9499, test_f1: 0.5205
 epoch: 6, train_loss: 0.8955, test_loss: 1.0566, test_f1: 0.5089
 epoch: 7, train_loss: 0.8658, test_loss: 0.8449, test_f1: 0.5667
 epoch: 8, train_loss: 0.8672, test_loss: 1.0915, test_f1: 0.4636
 epoch: 9, train_loss: 0.8590, test_loss: 0.9105, test_f1: 0.5408
 epoch: 10, train_loss: 0.8404, test_loss: 0.9813, test_f1: 0.5296
 epoch: 11, train_loss: 0.8223, test_loss: 0.9347, test_f1: 0.5328
 epoch: 12, train_loss: 0.8072, test_loss: 0.8246, test_f1: 0.5320
 epoch: 13, train_loss: 0.8323, test_loss: 0.8822, test_f1: 0.5696
 epoch: 14, train_loss: 0.8155, test_loss: 0.8876, test_f1: 0.5432
 epoch: 15, train_loss: 0.7903, test_loss: 0.9252, test_f1: 0.5627
 epoch: 16, train_loss: 0.8006, test_loss: 0.8710, test_f1: 0.5334
 epoch: 17, train_loss: 0.8147, test_loss: 0.8086, test_f1: 0.6226
 epoch: 18, train_loss: 0.8086, test_loss: 0.8670, test_f1: 0.5938
 epoch: 19, train_loss: 0.7804, test_loss: 0.8944, test_f1: 0.5705
 epoch: 20, train_loss: 0.7915, test_loss: 0.8226, test_f1: 0.5584
 epoch: 21, train_loss: 0.7502, test_loss: 0.8547, test_f1: 0.5655
 epoch: 22, train_loss: 0.7549, test_loss: 0.8146, test_f1: 0.6315
 epoch: 23, train_loss: 0.7437, test_loss: 0.8757, test_f1: 0.6064
 epoch: 24, train_loss: 0.7476, test_loss: 0.9521, test_f1: 0.6353
 epoch: 25, train_loss: 0.7405, test_loss: 0.8781, test_f1: 0.6225
 epoch: 26, train_loss: 0.7313, test_loss: 0.8489, test_f1: 0.6171
 epoch: 27, train_loss: 0.7210, test_loss: 0.8256, test_f1: 0.6091
 epoch: 28, train_loss: 0.7234, test_loss: 1.3624, test_f1: 0.5179
 epoch: 29, train_loss: 0.7361, test_loss: 0.7818, test_f1: 0.5858
 epoch: 30, train_loss: 0.7183, test_loss: 0.8277, test_f1: 0.6124
 epoch: 31, train_loss: 0.7118, test_loss: 0.8820, test_f1: 0.6011
 epoch: 32, train_loss: 0.6997, test_loss: 0.8820, test_f1: 0.5768
 epoch: 33, train_loss: 0.7055, test_loss: 0.9516, test_f1: 0.5898
 epoch: 34, train_loss: 0.6906, test_loss: 0.9870, test_f1: 0.5422
 epoch: 35, train_loss: 0.7099, test_loss: 0.9845, test_f1: 0.5396
 epoch: 36, train_loss: 0.7219, test_loss: 0.8705, test_f1: 0.6395
 epoch: 37, train_loss: 0.6838, test_loss: 0.9047, test_f1: 0.6537
 epoch: 38, train_loss: 0.7007, test_loss: 0.8618, test_f1: 0.6332
 epoch: 39, train_loss: 0.6825, test_loss: 0.8437, test_f1: 0.6267
 epoch: 40, train_loss: 0.6746, test_loss: 0.7318, test_f1: 0.6610
 epoch: 41, train_loss: 0.6668, test_loss: 0.8345, test_f1: 0.6246
 epoch: 42, train_loss: 0.6671, test_loss: 0.7788, test_f1: 0.6570
 epoch: 43, train_loss: 0.6533, test_loss: 1.0860, test_f1: 0.5383
 epoch: 44, train_loss: 0.6708, test_loss: 0.8953, test_f1: 0.6061
 epoch: 45, train_loss: 0.6487, test_loss: 0.8207, test_f1: 0.6555
 epoch: 46, train_loss: 0.6372, test_loss: 0.8979, test_f1: 0.6050
 epoch: 47, train_loss: 0.6440, test_loss: 0.9078, test_f1: 0.5992
 epoch: 48, train_loss: 0.6369, test_loss: 0.7989, test_f1: 0.6493
 epoch: 49, train_loss: 0.6184, test_loss: 0.8502, test_f1: 0.6636
 epoch: 50, train_loss: 0.6249, test_loss: 0.8972, test_f1: 0.6404
 epoch: 51, train_loss: 0.5718, test_loss: 0.8550, test_f1: 0.6544
 epoch: 52, train_loss: 0.5869, test_loss: 0.8038, test_f1: 0.6688
 epoch: 53, train_loss: 0.5511, test_loss: 0.8488, test_f1: 0.6582
 epoch: 54, train_loss: 0.5566, test_loss: 0.9372, test_f1: 0.6560
 epoch: 55, train_loss: 0.5392, test_loss: 0.8677, test_f1: 0.6664
 epoch: 56, train_loss: 0.5316, test_loss: 0.9779, test_f1: 0.6140
 epoch: 57, train_loss: 0.5501, test_loss: 0.9873, test_f1: 0.6453
 epoch: 58, train_loss: 0.5322, test_loss: 0.8941, test_f1: 0.6554
 epoch: 59, train_loss: 0.5450, test_loss: 0.8491, test_f1: 0.6671
 epoch: 60, train_loss: 0.5286, test_loss: 0.8492, test_f1: 0.6752
 epoch: 61, train_loss: 0.5183, test_loss: 0.8540, test_f1: 0.6928
 epoch: 62, train_loss: 0.5181, test_loss: 0.9166, test_f1: 0.6779
 epoch: 63, train_loss: 0.5070, test_loss: 0.9844, test_f1: 0.6593
 epoch: 64, train_loss: 0.4908, test_loss: 0.9868, test_f1: 0.6627
 epoch: 65, train_loss: 0.4940, test_loss: 0.9998, test_f1: 0.6762
 epoch: 66, train_loss: 0.4937, test_loss: 1.0731, test_f1: 0.6393
 epoch: 67, train_loss: 0.5101, test_loss: 0.9294, test_f1: 0.6794
 epoch: 68, train_loss: 0.5090, test_loss: 1.0072, test_f1: 0.6584
 epoch: 69, train_loss: 0.4972, test_loss: 0.9612, test_f1: 0.6755
 epoch: 70, train_loss: 0.4825, test_loss: 0.8729, test_f1: 0.6783
 epoch: 71, train_loss: 0.4748, test_loss: 1.6623, test_f1: 0.6644
 epoch: 72, train_loss: 0.5032, test_loss: 0.9893, test_f1: 0.6570
 epoch: 73, train_loss: 0.4722, test_loss: 0.9234, test_f1: 0.6770
 epoch: 74, train_loss: 0.4842, test_loss: 1.0266, test_f1: 0.6512
 epoch: 75, train_loss: 0.4661, test_loss: 1.0853, test_f1: 0.6500
 epoch: 76, train_loss: 0.4657, test_loss: 0.8928, test_f1: 0.6683
 epoch: 77, train_loss: 0.4924, test_loss: 0.9637, test_f1: 0.6853
 epoch: 78, train_loss: 0.4633, test_loss: 0.9533, test_f1: 0.6929
 epoch: 79, train_loss: 0.4735, test_loss: 0.9380, test_f1: 0.6843
 epoch: 80, train_loss: 0.4639, test_loss: 0.9551, test_f1: 0.6838
 epoch: 81, train_loss: 0.4654, test_loss: 0.9294, test_f1: 0.6804
 epoch: 82, train_loss: 0.4679, test_loss: 0.9458, test_f1: 0.6772
 epoch: 83, train_loss: 0.4609, test_loss: 0.9132, test_f1: 0.6668
 epoch: 84, train_loss: 0.4455, test_loss: 1.0118, test_f1: 0.6794
 epoch: 85, train_loss: 0.4615, test_loss: 0.9013, test_f1: 0.6721
 epoch: 86, train_loss: 0.4395, test_loss: 1.0988, test_f1: 0.6750
 epoch: 87, train_loss: 0.4387, test_loss: 0.9555, test_f1: 0.6942
 epoch: 88, train_loss: 0.4260, test_loss: 0.9906, test_f1: 0.6650
 epoch: 89, train_loss: 0.4710, test_loss: 1.0795, test_f1: 0.6518
 epoch: 90, train_loss: 0.4324, test_loss: 1.0721, test_f1: 0.6977
 epoch: 91, train_loss: 0.4140, test_loss: 0.9059, test_f1: 0.6937
 epoch: 92, train_loss: 0.4326, test_loss: 0.9742, test_f1: 0.6876
 epoch: 93, train_loss: 0.4031, test_loss: 1.0984, test_f1: 0.6946
 epoch: 94, train_loss: 0.4445, test_loss: 1.0194, test_f1: 0.6742
 epoch: 95, train_loss: 0.4335, test_loss: 0.9908, test_f1: 0.6912
 epoch: 96, train_loss: 0.4023, test_loss: 1.0332, test_f1: 0.6789
 epoch: 97, train_loss: 0.4293, test_loss: 1.2055, test_f1: 0.6555
 epoch: 98, train_loss: 0.4342, test_loss: 1.0355, test_f1: 0.6783
 epoch: 99, train_loss: 0.4127, test_loss: 1.0630, test_f1: 0.6909
##################ITERATION #7 ****************************************
 epoch: 0, train_loss: 1.2072, test_loss: 1.1097, test_f1: 0.3527
 epoch: 1, train_loss: 1.0634, test_loss: 1.0737, test_f1: 0.4044
 epoch: 2, train_loss: 1.0308, test_loss: 1.1267, test_f1: 0.3643
 epoch: 3, train_loss: 1.0122, test_loss: 1.1036, test_f1: 0.4962
 epoch: 4, train_loss: 0.9971, test_loss: 1.1631, test_f1: 0.4199
 epoch: 5, train_loss: 0.9818, test_loss: 1.0763, test_f1: 0.4674
 epoch: 6, train_loss: 0.9529, test_loss: 0.9951, test_f1: 0.4758
 epoch: 7, train_loss: 0.9515, test_loss: 1.1094, test_f1: 0.5120
 epoch: 8, train_loss: 0.9502, test_loss: 1.0429, test_f1: 0.4746
 epoch: 9, train_loss: 0.9253, test_loss: 1.0574, test_f1: 0.4897
 epoch: 10, train_loss: 0.9131, test_loss: 1.0869, test_f1: 0.5194
 epoch: 11, train_loss: 0.9167, test_loss: 0.9111, test_f1: 0.5621
 epoch: 12, train_loss: 0.8761, test_loss: 0.9223, test_f1: 0.5356
 epoch: 13, train_loss: 0.8685, test_loss: 1.1317, test_f1: 0.4739
 epoch: 14, train_loss: 0.8696, test_loss: 1.2035, test_f1: 0.4070
 epoch: 15, train_loss: 0.8689, test_loss: 0.9706, test_f1: 0.5927
 epoch: 16, train_loss: 0.8486, test_loss: 1.1756, test_f1: 0.4555
 epoch: 17, train_loss: 0.8299, test_loss: 1.0273, test_f1: 0.5170
 epoch: 18, train_loss: 0.8537, test_loss: 0.9225, test_f1: 0.5136
 epoch: 19, train_loss: 0.8445, test_loss: 0.9162, test_f1: 0.5288
 epoch: 20, train_loss: 0.8216, test_loss: 0.9844, test_f1: 0.5317
 epoch: 21, train_loss: 0.8377, test_loss: 0.9313, test_f1: 0.5444
 epoch: 22, train_loss: 0.7974, test_loss: 1.0353, test_f1: 0.5447
 epoch: 23, train_loss: 0.8095, test_loss: 0.9908, test_f1: 0.5181
 epoch: 24, train_loss: 0.8161, test_loss: 0.9410, test_f1: 0.5222
 epoch: 25, train_loss: 0.8009, test_loss: 0.9134, test_f1: 0.5436
 epoch: 26, train_loss: 0.8009, test_loss: 0.9009, test_f1: 0.5313
 epoch: 27, train_loss: 0.7768, test_loss: 0.9330, test_f1: 0.5781
 epoch: 28, train_loss: 0.7820, test_loss: 1.0950, test_f1: 0.5005
 epoch: 29, train_loss: 0.7507, test_loss: 0.9439, test_f1: 0.5391
 epoch: 30, train_loss: 0.7811, test_loss: 0.9798, test_f1: 0.5475
 epoch: 31, train_loss: 0.7639, test_loss: 0.9462, test_f1: 0.5312
 epoch: 32, train_loss: 0.7635, test_loss: 0.9303, test_f1: 0.5313
 epoch: 33, train_loss: 0.7716, test_loss: 0.8992, test_f1: 0.5664
 epoch: 34, train_loss: 0.7455, test_loss: 0.9113, test_f1: 0.5749
 epoch: 35, train_loss: 0.7438, test_loss: 0.9162, test_f1: 0.6173
 epoch: 36, train_loss: 0.7199, test_loss: 1.0048, test_f1: 0.5547
 epoch: 37, train_loss: 0.7306, test_loss: 0.9227, test_f1: 0.5925
 epoch: 38, train_loss: 0.7329, test_loss: 0.9585, test_f1: 0.5402
 epoch: 39, train_loss: 0.7283, test_loss: 0.9329, test_f1: 0.5213
 epoch: 40, train_loss: 0.7048, test_loss: 0.8687, test_f1: 0.5501
 epoch: 41, train_loss: 0.7195, test_loss: 0.9862, test_f1: 0.5763
 epoch: 42, train_loss: 0.6950, test_loss: 0.8836, test_f1: 0.6157
 epoch: 43, train_loss: 0.7103, test_loss: 0.9245, test_f1: 0.5350
 epoch: 44, train_loss: 0.7090, test_loss: 0.9680, test_f1: 0.5239
 epoch: 45, train_loss: 0.6941, test_loss: 0.8917, test_f1: 0.6002
 epoch: 46, train_loss: 0.6846, test_loss: 0.8871, test_f1: 0.6398
 epoch: 47, train_loss: 0.6625, test_loss: 1.0598, test_f1: 0.5358
 epoch: 48, train_loss: 0.6701, test_loss: 0.9796, test_f1: 0.6222
 epoch: 49, train_loss: 0.6694, test_loss: 1.0483, test_f1: 0.5416
 epoch: 50, train_loss: 0.6623, test_loss: 1.0240, test_f1: 0.6038
 epoch: 51, train_loss: 0.6368, test_loss: 0.9516, test_f1: 0.6091
 epoch: 52, train_loss: 0.6142, test_loss: 0.9000, test_f1: 0.6292
 epoch: 53, train_loss: 0.6011, test_loss: 0.9556, test_f1: 0.5780
 epoch: 54, train_loss: 0.6076, test_loss: 0.9909, test_f1: 0.5980
 epoch: 55, train_loss: 0.6028, test_loss: 0.9704, test_f1: 0.6589
 epoch: 56, train_loss: 0.6062, test_loss: 0.9494, test_f1: 0.6442
 epoch: 57, train_loss: 0.6110, test_loss: 0.9820, test_f1: 0.6246
 epoch: 58, train_loss: 0.5925, test_loss: 0.9649, test_f1: 0.6269
 epoch: 59, train_loss: 0.5816, test_loss: 1.0594, test_f1: 0.5958
 epoch: 60, train_loss: 0.5828, test_loss: 0.9464, test_f1: 0.6018
 epoch: 61, train_loss: 0.5868, test_loss: 1.0787, test_f1: 0.6079
 epoch: 62, train_loss: 0.5814, test_loss: 1.0013, test_f1: 0.6281
 epoch: 63, train_loss: 0.5739, test_loss: 1.0441, test_f1: 0.6394
 epoch: 64, train_loss: 0.5873, test_loss: 0.9934, test_f1: 0.6512
 epoch: 65, train_loss: 0.5613, test_loss: 1.0628, test_f1: 0.6458
 epoch: 66, train_loss: 0.5682, test_loss: 1.0820, test_f1: 0.6315
 epoch: 67, train_loss: 0.5864, test_loss: 0.9632, test_f1: 0.6468
 epoch: 68, train_loss: 0.5569, test_loss: 1.0086, test_f1: 0.6239
 epoch: 69, train_loss: 0.5469, test_loss: 0.9869, test_f1: 0.6329
 epoch: 70, train_loss: 0.5480, test_loss: 0.9193, test_f1: 0.6320
 epoch: 71, train_loss: 0.5531, test_loss: 1.0134, test_f1: 0.5837
 epoch: 72, train_loss: 0.5530, test_loss: 1.0148, test_f1: 0.6072
 epoch: 73, train_loss: 0.5467, test_loss: 1.0559, test_f1: 0.6088
 epoch: 74, train_loss: 0.5539, test_loss: 1.0330, test_f1: 0.6400
 epoch: 75, train_loss: 0.5276, test_loss: 1.0184, test_f1: 0.6186
 epoch: 76, train_loss: 0.5073, test_loss: 1.1394, test_f1: 0.6223
 epoch: 77, train_loss: 0.5444, test_loss: 1.0152, test_f1: 0.6246
 epoch: 78, train_loss: 0.5236, test_loss: 1.0750, test_f1: 0.6468
 epoch: 79, train_loss: 0.5087, test_loss: 1.1368, test_f1: 0.6044
 epoch: 80, train_loss: 0.5096, test_loss: 1.1143, test_f1: 0.6300
 epoch: 81, train_loss: 0.5351, test_loss: 1.0688, test_f1: 0.6420
 epoch: 82, train_loss: 0.5017, test_loss: 1.1151, test_f1: 0.6092
 epoch: 83, train_loss: 0.4869, test_loss: 1.1950, test_f1: 0.6218
 epoch: 84, train_loss: 0.5226, test_loss: 1.0717, test_f1: 0.6297
 epoch: 85, train_loss: 0.5102, test_loss: 1.1229, test_f1: 0.6201
 epoch: 86, train_loss: 0.5001, test_loss: 1.0629, test_f1: 0.6340
 epoch: 87, train_loss: 0.5036, test_loss: 1.1652, test_f1: 0.6168
 epoch: 88, train_loss: 0.4998, test_loss: 1.1183, test_f1: 0.6366
 epoch: 89, train_loss: 0.4817, test_loss: 1.0526, test_f1: 0.6355
 epoch: 90, train_loss: 0.4764, test_loss: 1.0698, test_f1: 0.6238
 epoch: 91, train_loss: 0.4745, test_loss: 1.1124, test_f1: 0.6462
 epoch: 92, train_loss: 0.4492, test_loss: 1.2454, test_f1: 0.6157
 epoch: 93, train_loss: 0.5051, test_loss: 1.0571, test_f1: 0.6285
 epoch: 94, train_loss: 0.5055, test_loss: 1.0523, test_f1: 0.6306
 epoch: 95, train_loss: 0.4917, test_loss: 1.0692, test_f1: 0.6804
 epoch: 96, train_loss: 0.4639, test_loss: 1.1151, test_f1: 0.6423
 epoch: 97, train_loss: 0.4572, test_loss: 1.1692, test_f1: 0.6351
 epoch: 98, train_loss: 0.4766, test_loss: 1.0180, test_f1: 0.6651
 epoch: 99, train_loss: 0.4645, test_loss: 1.0237, test_f1: 0.6399
##################ITERATION #8 ****************************************
 epoch: 0, train_loss: 1.1696, test_loss: 1.0627, test_f1: 0.4360
 epoch: 1, train_loss: 1.0015, test_loss: 1.0688, test_f1: 0.4341
 epoch: 2, train_loss: 0.9779, test_loss: 1.0525, test_f1: 0.5118
 epoch: 3, train_loss: 0.9387, test_loss: 1.0839, test_f1: 0.5315
 epoch: 4, train_loss: 0.9406, test_loss: 0.9881, test_f1: 0.4735
 epoch: 5, train_loss: 0.9191, test_loss: 0.9329, test_f1: 0.5218
 epoch: 6, train_loss: 0.9007, test_loss: 0.8943, test_f1: 0.5412
 epoch: 7, train_loss: 0.8859, test_loss: 0.9214, test_f1: 0.5463
 epoch: 8, train_loss: 0.8791, test_loss: 0.9601, test_f1: 0.5374
 epoch: 9, train_loss: 0.8559, test_loss: 0.8348, test_f1: 0.5435
 epoch: 10, train_loss: 0.8655, test_loss: 0.8706, test_f1: 0.5530
 epoch: 11, train_loss: 0.8286, test_loss: 0.8687, test_f1: 0.5516
 epoch: 12, train_loss: 0.8172, test_loss: 1.0570, test_f1: 0.4785
 epoch: 13, train_loss: 0.8350, test_loss: 0.8265, test_f1: 0.5510
 epoch: 14, train_loss: 0.8156, test_loss: 0.8345, test_f1: 0.5717
 epoch: 15, train_loss: 0.8083, test_loss: 0.8773, test_f1: 0.5418
 epoch: 16, train_loss: 0.8033, test_loss: 0.8160, test_f1: 0.6139
 epoch: 17, train_loss: 0.7778, test_loss: 0.8494, test_f1: 0.5489
 epoch: 18, train_loss: 0.7752, test_loss: 0.8645, test_f1: 0.5851
 epoch: 19, train_loss: 0.7872, test_loss: 0.8452, test_f1: 0.5658
 epoch: 20, train_loss: 0.7754, test_loss: 0.9769, test_f1: 0.5910
 epoch: 21, train_loss: 0.7651, test_loss: 0.8767, test_f1: 0.5474
 epoch: 22, train_loss: 0.7468, test_loss: 0.8322, test_f1: 0.6067
 epoch: 23, train_loss: 0.7470, test_loss: 0.9245, test_f1: 0.5294
 epoch: 24, train_loss: 0.7456, test_loss: 1.1062, test_f1: 0.5226
 epoch: 25, train_loss: 0.7653, test_loss: 0.8733, test_f1: 0.5947
 epoch: 26, train_loss: 0.7433, test_loss: 0.8186, test_f1: 0.6379
 epoch: 27, train_loss: 0.7195, test_loss: 0.8464, test_f1: 0.5679
 epoch: 28, train_loss: 0.7176, test_loss: 0.9043, test_f1: 0.5951
 epoch: 29, train_loss: 0.7337, test_loss: 0.8489, test_f1: 0.5692
 epoch: 30, train_loss: 0.7227, test_loss: 0.9379, test_f1: 0.5848
 epoch: 31, train_loss: 0.7030, test_loss: 0.8474, test_f1: 0.6080
 epoch: 32, train_loss: 0.7028, test_loss: 0.8262, test_f1: 0.5782
 epoch: 33, train_loss: 0.6817, test_loss: 0.8551, test_f1: 0.6014
 epoch: 34, train_loss: 0.6773, test_loss: 0.9656, test_f1: 0.5967
 epoch: 35, train_loss: 0.6818, test_loss: 0.9144, test_f1: 0.5668
 epoch: 36, train_loss: 0.6796, test_loss: 0.8746, test_f1: 0.5970
 epoch: 37, train_loss: 0.6763, test_loss: 0.8559, test_f1: 0.6241
 epoch: 38, train_loss: 0.6750, test_loss: 1.0396, test_f1: 0.5298
 epoch: 39, train_loss: 0.6704, test_loss: 0.9445, test_f1: 0.5837
 epoch: 40, train_loss: 0.6719, test_loss: 0.8751, test_f1: 0.6039
 epoch: 41, train_loss: 0.6461, test_loss: 0.8079, test_f1: 0.5885
 epoch: 42, train_loss: 0.6751, test_loss: 0.9338, test_f1: 0.6204
 epoch: 43, train_loss: 0.6571, test_loss: 0.9429, test_f1: 0.6111
 epoch: 44, train_loss: 0.6442, test_loss: 0.8956, test_f1: 0.5895
 epoch: 45, train_loss: 0.6618, test_loss: 1.0067, test_f1: 0.5799
 epoch: 46, train_loss: 0.6433, test_loss: 0.8531, test_f1: 0.6242
 epoch: 47, train_loss: 0.6208, test_loss: 0.9524, test_f1: 0.5683
 epoch: 48, train_loss: 0.6286, test_loss: 0.9714, test_f1: 0.5811
 epoch: 49, train_loss: 0.6165, test_loss: 1.1001, test_f1: 0.5696
 epoch: 50, train_loss: 0.6322, test_loss: 1.1139, test_f1: 0.5146
 epoch: 51, train_loss: 0.6033, test_loss: 0.9271, test_f1: 0.6219
 epoch: 52, train_loss: 0.5651, test_loss: 0.9742, test_f1: 0.5957
 epoch: 53, train_loss: 0.5543, test_loss: 1.3426, test_f1: 0.5566
 epoch: 54, train_loss: 0.5522, test_loss: 1.0334, test_f1: 0.6040
 epoch: 55, train_loss: 0.5413, test_loss: 1.0887, test_f1: 0.6104
 epoch: 56, train_loss: 0.5264, test_loss: 1.0319, test_f1: 0.6177
 epoch: 57, train_loss: 0.5327, test_loss: 1.0043, test_f1: 0.6105
 epoch: 58, train_loss: 0.5229, test_loss: 0.9980, test_f1: 0.6190
 epoch: 59, train_loss: 0.5465, test_loss: 1.0534, test_f1: 0.5734
 epoch: 60, train_loss: 0.5227, test_loss: 1.0845, test_f1: 0.5717
 epoch: 61, train_loss: 0.5168, test_loss: 1.2242, test_f1: 0.5816
 epoch: 62, train_loss: 0.5023, test_loss: 1.2256, test_f1: 0.5854
 epoch: 63, train_loss: 0.5144, test_loss: 1.1710, test_f1: 0.6245
 epoch: 64, train_loss: 0.5168, test_loss: 1.1897, test_f1: 0.5966
 epoch: 65, train_loss: 0.4942, test_loss: 1.2362, test_f1: 0.6008
 epoch: 66, train_loss: 0.5009, test_loss: 1.0283, test_f1: 0.6236
 epoch: 67, train_loss: 0.4860, test_loss: 1.1327, test_f1: 0.6288
 epoch: 68, train_loss: 0.4735, test_loss: 1.2334, test_f1: 0.6048
 epoch: 69, train_loss: 0.4897, test_loss: 1.2111, test_f1: 0.6280
 epoch: 70, train_loss: 0.4823, test_loss: 1.1292, test_f1: 0.6431
 epoch: 71, train_loss: 0.4815, test_loss: 1.3092, test_f1: 0.6226
 epoch: 72, train_loss: 0.4861, test_loss: 1.0896, test_f1: 0.6519
 epoch: 73, train_loss: 0.4547, test_loss: 1.3456, test_f1: 0.6057
 epoch: 74, train_loss: 0.4830, test_loss: 1.3706, test_f1: 0.6132
 epoch: 75, train_loss: 0.4782, test_loss: 1.2241, test_f1: 0.6435
 epoch: 76, train_loss: 0.4559, test_loss: 1.3420, test_f1: 0.6240
 epoch: 77, train_loss: 0.4608, test_loss: 1.3921, test_f1: 0.6077
 epoch: 78, train_loss: 0.4627, test_loss: 1.1845, test_f1: 0.6071
 epoch: 79, train_loss: 0.4676, test_loss: 1.2771, test_f1: 0.6246
 epoch: 80, train_loss: 0.4761, test_loss: 1.2799, test_f1: 0.6220
 epoch: 81, train_loss: 0.4588, test_loss: 1.2823, test_f1: 0.6236
 epoch: 82, train_loss: 0.4281, test_loss: 1.3499, test_f1: 0.6217
 epoch: 83, train_loss: 0.4422, test_loss: 1.4930, test_f1: 0.6027
 epoch: 84, train_loss: 0.4511, test_loss: 1.2853, test_f1: 0.6583
 epoch: 85, train_loss: 0.4637, test_loss: 1.2694, test_f1: 0.6183
 epoch: 86, train_loss: 0.4399, test_loss: 1.2916, test_f1: 0.6319
 epoch: 87, train_loss: 0.4345, test_loss: 1.5117, test_f1: 0.6046
 epoch: 88, train_loss: 0.4378, test_loss: 1.4250, test_f1: 0.5988
 epoch: 89, train_loss: 0.4365, test_loss: 1.2678, test_f1: 0.6506
 epoch: 90, train_loss: 0.4227, test_loss: 1.2675, test_f1: 0.6314
 epoch: 91, train_loss: 0.4039, test_loss: 1.2484, test_f1: 0.6537
 epoch: 92, train_loss: 0.4173, test_loss: 1.4518, test_f1: 0.6355
 epoch: 93, train_loss: 0.4258, test_loss: 1.3072, test_f1: 0.6458
 epoch: 94, train_loss: 0.4471, test_loss: 1.6422, test_f1: 0.5990
 epoch: 95, train_loss: 0.4171, test_loss: 1.4742, test_f1: 0.6511
 epoch: 96, train_loss: 0.4234, test_loss: 1.4125, test_f1: 0.6522
 epoch: 97, train_loss: 0.4199, test_loss: 1.3838, test_f1: 0.6353
 epoch: 98, train_loss: 0.4019, test_loss: 1.5094, test_f1: 0.5950
 epoch: 99, train_loss: 0.4179, test_loss: 1.4829, test_f1: 0.6146
##################ITERATION #9 ****************************************
 epoch: 0, train_loss: 1.2401, test_loss: 1.1051, test_f1: 0.4191
 epoch: 1, train_loss: 1.0419, test_loss: 1.0815, test_f1: 0.4696
 epoch: 2, train_loss: 0.9968, test_loss: 0.9466, test_f1: 0.5117
 epoch: 3, train_loss: 0.9612, test_loss: 1.3803, test_f1: 0.3788
 epoch: 4, train_loss: 0.9554, test_loss: 0.8937, test_f1: 0.5098
 epoch: 5, train_loss: 0.9518, test_loss: 1.0965, test_f1: 0.4821
 epoch: 6, train_loss: 0.9097, test_loss: 1.0065, test_f1: 0.4965
 epoch: 7, train_loss: 0.9004, test_loss: 1.4889, test_f1: 0.3483
 epoch: 8, train_loss: 0.9042, test_loss: 1.9849, test_f1: 0.3717
 epoch: 9, train_loss: 0.8800, test_loss: 0.9186, test_f1: 0.5075
 epoch: 10, train_loss: 0.8693, test_loss: 1.1703, test_f1: 0.5380
 epoch: 11, train_loss: 0.8585, test_loss: 1.0934, test_f1: 0.4796
 epoch: 12, train_loss: 0.8409, test_loss: 0.8786, test_f1: 0.5547
 epoch: 13, train_loss: 0.8378, test_loss: 0.9204, test_f1: 0.5764
 epoch: 14, train_loss: 0.8549, test_loss: 0.9581, test_f1: 0.5025
 epoch: 15, train_loss: 0.8080, test_loss: 0.9311, test_f1: 0.5019
 epoch: 16, train_loss: 0.8281, test_loss: 0.9289, test_f1: 0.5295
 epoch: 17, train_loss: 0.8051, test_loss: 0.8448, test_f1: 0.5852
 epoch: 18, train_loss: 0.7987, test_loss: 0.8661, test_f1: 0.5289
 epoch: 19, train_loss: 0.7995, test_loss: 0.9594, test_f1: 0.5059
 epoch: 20, train_loss: 0.7826, test_loss: 0.8433, test_f1: 0.5679
 epoch: 21, train_loss: 0.8067, test_loss: 0.8564, test_f1: 0.5438
 epoch: 22, train_loss: 0.8078, test_loss: 0.8884, test_f1: 0.5560
 epoch: 23, train_loss: 0.7751, test_loss: 0.8578, test_f1: 0.5224
 epoch: 24, train_loss: 0.7711, test_loss: 0.8393, test_f1: 0.5568
 epoch: 25, train_loss: 0.7699, test_loss: 0.9206, test_f1: 0.5564
 epoch: 26, train_loss: 0.7668, test_loss: 0.9516, test_f1: 0.5433
 epoch: 27, train_loss: 0.7636, test_loss: 0.9322, test_f1: 0.5700
 epoch: 28, train_loss: 0.7459, test_loss: 0.9719, test_f1: 0.5492
 epoch: 29, train_loss: 0.7377, test_loss: 0.8807, test_f1: 0.5484
 epoch: 30, train_loss: 0.7442, test_loss: 0.8287, test_f1: 0.6391
 epoch: 31, train_loss: 0.7294, test_loss: 0.9886, test_f1: 0.5943
 epoch: 32, train_loss: 0.7299, test_loss: 0.9143, test_f1: 0.5895
 epoch: 33, train_loss: 0.7230, test_loss: 0.8636, test_f1: 0.6226
 epoch: 34, train_loss: 0.7076, test_loss: 0.9237, test_f1: 0.5673
 epoch: 35, train_loss: 0.7215, test_loss: 0.8855, test_f1: 0.5517
 epoch: 36, train_loss: 0.6908, test_loss: 0.8546, test_f1: 0.6552
 epoch: 37, train_loss: 0.6883, test_loss: 0.8287, test_f1: 0.6462
 epoch: 38, train_loss: 0.6966, test_loss: 0.9264, test_f1: 0.5640
 epoch: 39, train_loss: 0.6698, test_loss: 0.8760, test_f1: 0.6085
 epoch: 40, train_loss: 0.6971, test_loss: 0.9081, test_f1: 0.6167
 epoch: 41, train_loss: 0.6718, test_loss: 0.8668, test_f1: 0.6430
 epoch: 42, train_loss: 0.6533, test_loss: 0.8756, test_f1: 0.6063
 epoch: 43, train_loss: 0.6559, test_loss: 0.8560, test_f1: 0.6277
 epoch: 44, train_loss: 0.6639, test_loss: 0.8361, test_f1: 0.6583
 epoch: 45, train_loss: 0.6279, test_loss: 0.8676, test_f1: 0.6352
 epoch: 46, train_loss: 0.6425, test_loss: 0.8618, test_f1: 0.6210
 epoch: 47, train_loss: 0.6356, test_loss: 0.7686, test_f1: 0.6165
 epoch: 48, train_loss: 0.6519, test_loss: 1.0176, test_f1: 0.5878
 epoch: 49, train_loss: 0.6371, test_loss: 1.0197, test_f1: 0.5454
 epoch: 50, train_loss: 0.6336, test_loss: 0.7033, test_f1: 0.6838
 epoch: 51, train_loss: 0.6042, test_loss: 0.9605, test_f1: 0.6389
 epoch: 52, train_loss: 0.5816, test_loss: 0.8563, test_f1: 0.6595
 epoch: 53, train_loss: 0.5676, test_loss: 0.9655, test_f1: 0.6091
 epoch: 54, train_loss: 0.5676, test_loss: 0.8688, test_f1: 0.6231
 epoch: 55, train_loss: 0.5482, test_loss: 0.9342, test_f1: 0.6457
 epoch: 56, train_loss: 0.5472, test_loss: 0.8675, test_f1: 0.6253
 epoch: 57, train_loss: 0.5433, test_loss: 0.9710, test_f1: 0.6150
 epoch: 58, train_loss: 0.5463, test_loss: 1.0216, test_f1: 0.6595
 epoch: 59, train_loss: 0.5426, test_loss: 0.9891, test_f1: 0.6324
 epoch: 60, train_loss: 0.5164, test_loss: 0.8589, test_f1: 0.6543
 epoch: 61, train_loss: 0.5150, test_loss: 1.0059, test_f1: 0.6129
 epoch: 62, train_loss: 0.5228, test_loss: 0.8428, test_f1: 0.6187
 epoch: 63, train_loss: 0.5142, test_loss: 0.8439, test_f1: 0.6154
 epoch: 64, train_loss: 0.5272, test_loss: 0.9700, test_f1: 0.6258
 epoch: 65, train_loss: 0.5232, test_loss: 0.8984, test_f1: 0.6269
 epoch: 66, train_loss: 0.5058, test_loss: 1.0414, test_f1: 0.6418
 epoch: 67, train_loss: 0.5192, test_loss: 0.8878, test_f1: 0.6321
 epoch: 68, train_loss: 0.4923, test_loss: 1.0162, test_f1: 0.6359
 epoch: 69, train_loss: 0.4976, test_loss: 1.0051, test_f1: 0.6038
 epoch: 70, train_loss: 0.4949, test_loss: 0.9542, test_f1: 0.6470
 epoch: 71, train_loss: 0.4971, test_loss: 0.9850, test_f1: 0.6163
 epoch: 72, train_loss: 0.4942, test_loss: 1.0660, test_f1: 0.6464
 epoch: 73, train_loss: 0.4726, test_loss: 1.0782, test_f1: 0.6301
 epoch: 74, train_loss: 0.4850, test_loss: 1.0172, test_f1: 0.6282
 epoch: 75, train_loss: 0.4969, test_loss: 0.9123, test_f1: 0.6307
 epoch: 76, train_loss: 0.4758, test_loss: 0.9258, test_f1: 0.6384
 epoch: 77, train_loss: 0.4743, test_loss: 1.0351, test_f1: 0.6135
 epoch: 78, train_loss: 0.4890, test_loss: 1.0047, test_f1: 0.6316
 epoch: 79, train_loss: 0.4842, test_loss: 1.0862, test_f1: 0.6299
 epoch: 80, train_loss: 0.4760, test_loss: 1.0072, test_f1: 0.6464
 epoch: 81, train_loss: 0.4657, test_loss: 0.9384, test_f1: 0.6317
 epoch: 82, train_loss: 0.4655, test_loss: 1.0286, test_f1: 0.6248
 epoch: 83, train_loss: 0.4775, test_loss: 1.1361, test_f1: 0.6535
 epoch: 84, train_loss: 0.4619, test_loss: 0.9998, test_f1: 0.6377
 epoch: 85, train_loss: 0.4591, test_loss: 0.9609, test_f1: 0.6481
 epoch: 86, train_loss: 0.4557, test_loss: 0.9660, test_f1: 0.6358
 epoch: 87, train_loss: 0.4621, test_loss: 0.9831, test_f1: 0.6444
 epoch: 88, train_loss: 0.4713, test_loss: 1.1215, test_f1: 0.6446
 epoch: 89, train_loss: 0.4547, test_loss: 1.0782, test_f1: 0.6409
 epoch: 90, train_loss: 0.4638, test_loss: 1.1105, test_f1: 0.6645
 epoch: 91, train_loss: 0.4474, test_loss: 0.9830, test_f1: 0.6543
 epoch: 92, train_loss: 0.4399, test_loss: 1.0453, test_f1: 0.6352
 epoch: 93, train_loss: 0.4322, test_loss: 1.2723, test_f1: 0.6251
 epoch: 94, train_loss: 0.4484, test_loss: 1.1869, test_f1: 0.6411
 epoch: 95, train_loss: 0.4538, test_loss: 1.4195, test_f1: 0.6219
 epoch: 96, train_loss: 0.4474, test_loss: 1.0829, test_f1: 0.6573
 epoch: 97, train_loss: 0.4534, test_loss: 1.0494, test_f1: 0.6846
 epoch: 98, train_loss: 0.4473, test_loss: 0.8843, test_f1: 0.6324
 epoch: 99, train_loss: 0.4298, test_loss: 1.0576, test_f1: 0.6257

Training completed in 886.79 seconds
Best F1: 0.6977 at epoch 90
Mean F1 across iterations: 0.6791  0.0154
========================FINAL RESULTS================================
FEGIN weighted F1: 0.6977  0.0154
python main.py --data ltspice_examples --representation component_pin --model FEGIN --layers 6 --hiddens 64 --batch_size 64 --lr 0.01 --emb_size 250 --epochs 100 --save_appendix component_pin_L6_H64_BS64_LR0.01_E250 --no_val
-----



STDERR:
  File "main.py", line 370, in <module>
    main()
  File "main.py", line 254, in main
    dataset = dataset_class(
  File "/home/philip/projects/ltspice_examples_code_repo/Circuit-Completion-Using-GNNs/component_classification_with_link_prediction_head/evaluation/FEGIN/kernel/circuit_datasets.py", line 15, in __init__
    self.data, self.slices = torch.load(self.processed_paths[0])
  File "/home/philip/.local/lib/python3.8/site-packages/torch/serialization.py", line 1040, in load
    warnings.warn(
  File "/usr/lib/python3.8/warnings.py", line 109, in _showwarnmsg
    sw(msg.message, msg.category, msg.filename, msg.lineno,
  File "main.py", line 47, in warn_with_traceback
    traceback.print_stack(file=log)
/home/philip/projects/ltspice_examples_code_repo/Circuit-Completion-Using-GNNs/component_classification_with_link_prediction_head/evaluation/FEGIN/kernel/circuit_datasets.py:15: FutureWarning: You are using `torch.load` with `weights_only=False` (the current default value), which uses the default pickle module implicitly. It is possible to construct malicious pickle data which will execute arbitrary code during unpickling (See https://github.com/pytorch/pytorch/blob/main/SECURITY.md#untrusted-models for more details). In a future release, the default value for `weights_only` will be flipped to `True`. This limits the functions that could be executed during unpickling. Arbitrary objects will no longer be allowed to be loaded via this mode unless they are explicitly allowlisted by the user via `torch.serialization.add_safe_globals`. We recommend you start setting `weights_only=True` for any use case where you don't have full control of the loaded file. Please open an issue on GitHub for any issues related to this experimental feature.
  self.data, self.slices = torch.load(self.processed_paths[0])
