STDOUT:
Results will be saved in /home/philip/projects/ltspice_examples_code_repo/Circuit-Completion-Using-GNNs/component_classification_with_link_prediction_head/evaluation/FEGIN/results/model_FEGIN_dataset_ltspice_examples
Command line input: python main.py --data ltspice_examples --representation component_pin_net --model FEGIN --layers 2 --hiddens 128 --batch_size 64 --lr 0.001 --emb_size 128 --epochs 100 --save_appendix component_pin_net_L2_H128_BS64_LR0.001_E128 --no_val
 is saved.
-----
ltspice_examples - FEGIN
Using 2 layers, 128 hidden units, h = 2
Loading component_pin_net representation dataset
ENTERED
Training FEGIN on component_pin_net representation
Train: 3558, Test: 846
##################ITERATION #0 ****************************************
 epoch: 0, train_loss: 1.1340, test_loss: 1.0376, test_f1: 0.3960
 epoch: 1, train_loss: 0.9897, test_loss: 0.9437, test_f1: 0.5069
 epoch: 2, train_loss: 0.9542, test_loss: 0.9711, test_f1: 0.5068
 epoch: 3, train_loss: 0.9286, test_loss: 0.9345, test_f1: 0.4950
 epoch: 4, train_loss: 0.9101, test_loss: 0.8736, test_f1: 0.5181
 epoch: 5, train_loss: 0.8886, test_loss: 0.8627, test_f1: 0.5356
 epoch: 6, train_loss: 0.8655, test_loss: 0.8704, test_f1: 0.5358
 epoch: 7, train_loss: 0.8367, test_loss: 0.8750, test_f1: 0.5684
 epoch: 8, train_loss: 0.8181, test_loss: 0.8912, test_f1: 0.5119
 epoch: 9, train_loss: 0.8004, test_loss: 0.8210, test_f1: 0.5722
 epoch: 10, train_loss: 0.7788, test_loss: 0.8901, test_f1: 0.5614
 epoch: 11, train_loss: 0.7726, test_loss: 0.8544, test_f1: 0.6152
 epoch: 12, train_loss: 0.7452, test_loss: 0.7858, test_f1: 0.6110
 epoch: 13, train_loss: 0.7204, test_loss: 0.7621, test_f1: 0.5780
 epoch: 14, train_loss: 0.7212, test_loss: 0.8109, test_f1: 0.6134
 epoch: 15, train_loss: 0.6952, test_loss: 0.7598, test_f1: 0.6291
 epoch: 16, train_loss: 0.6857, test_loss: 0.7191, test_f1: 0.6403
 epoch: 17, train_loss: 0.6838, test_loss: 0.7792, test_f1: 0.6227
 epoch: 18, train_loss: 0.6744, test_loss: 0.7281, test_f1: 0.6338
 epoch: 19, train_loss: 0.6456, test_loss: 0.7594, test_f1: 0.6336
 epoch: 20, train_loss: 0.6286, test_loss: 0.7525, test_f1: 0.6730
 epoch: 21, train_loss: 0.6075, test_loss: 0.7675, test_f1: 0.6500
 epoch: 22, train_loss: 0.6178, test_loss: 0.7999, test_f1: 0.6567
 epoch: 23, train_loss: 0.5906, test_loss: 0.7518, test_f1: 0.6701
 epoch: 24, train_loss: 0.5893, test_loss: 0.8287, test_f1: 0.6443
 epoch: 25, train_loss: 0.5828, test_loss: 0.7699, test_f1: 0.6241
 epoch: 26, train_loss: 0.5817, test_loss: 0.7955, test_f1: 0.6595
 epoch: 27, train_loss: 0.5696, test_loss: 0.7249, test_f1: 0.6409
 epoch: 28, train_loss: 0.5518, test_loss: 0.9187, test_f1: 0.6663
 epoch: 29, train_loss: 0.5321, test_loss: 0.9932, test_f1: 0.6458
 epoch: 30, train_loss: 0.5228, test_loss: 0.9378, test_f1: 0.6508
 epoch: 31, train_loss: 0.5313, test_loss: 0.8318, test_f1: 0.6480
 epoch: 32, train_loss: 0.5089, test_loss: 0.8796, test_f1: 0.6715
 epoch: 33, train_loss: 0.4806, test_loss: 0.9517, test_f1: 0.6773
 epoch: 34, train_loss: 0.5168, test_loss: 0.9471, test_f1: 0.6545
 epoch: 35, train_loss: 0.4755, test_loss: 0.8654, test_f1: 0.7026
 epoch: 36, train_loss: 0.4866, test_loss: 0.8910, test_f1: 0.6767
 epoch: 37, train_loss: 0.4664, test_loss: 0.9826, test_f1: 0.6816
 epoch: 38, train_loss: 0.4564, test_loss: 1.0782, test_f1: 0.6523
 epoch: 39, train_loss: 0.4448, test_loss: 1.1890, test_f1: 0.6466
 epoch: 40, train_loss: 0.4612, test_loss: 1.0735, test_f1: 0.6716
 epoch: 41, train_loss: 0.4256, test_loss: 1.1182, test_f1: 0.6492
 epoch: 42, train_loss: 0.4429, test_loss: 1.0522, test_f1: 0.6541
 epoch: 43, train_loss: 0.4119, test_loss: 1.0280, test_f1: 0.6715
 epoch: 44, train_loss: 0.4043, test_loss: 1.0522, test_f1: 0.6804
 epoch: 45, train_loss: 0.4206, test_loss: 1.0775, test_f1: 0.6828
 epoch: 46, train_loss: 0.3826, test_loss: 1.0250, test_f1: 0.7030
 epoch: 47, train_loss: 0.4090, test_loss: 1.0396, test_f1: 0.6973
 epoch: 48, train_loss: 0.3816, test_loss: 1.0019, test_f1: 0.6899
 epoch: 49, train_loss: 0.3672, test_loss: 1.1315, test_f1: 0.6859
 epoch: 50, train_loss: 0.3658, test_loss: 1.1788, test_f1: 0.6590
 epoch: 51, train_loss: 0.3343, test_loss: 1.2220, test_f1: 0.6890
 epoch: 52, train_loss: 0.3127, test_loss: 1.2590, test_f1: 0.6864
 epoch: 53, train_loss: 0.2977, test_loss: 1.2470, test_f1: 0.6744
 epoch: 54, train_loss: 0.2894, test_loss: 1.3307, test_f1: 0.6911
 epoch: 55, train_loss: 0.2867, test_loss: 1.3071, test_f1: 0.6936
 epoch: 56, train_loss: 0.2846, test_loss: 1.3058, test_f1: 0.6904
 epoch: 57, train_loss: 0.2756, test_loss: 1.4006, test_f1: 0.6878
 epoch: 58, train_loss: 0.2722, test_loss: 1.3836, test_f1: 0.6773
 epoch: 59, train_loss: 0.2727, test_loss: 1.2819, test_f1: 0.6730
 epoch: 60, train_loss: 0.2916, test_loss: 1.4334, test_f1: 0.6802
 epoch: 61, train_loss: 0.2683, test_loss: 1.2617, test_f1: 0.6972
 epoch: 62, train_loss: 0.2650, test_loss: 1.4209, test_f1: 0.6843
 epoch: 63, train_loss: 0.2669, test_loss: 1.4218, test_f1: 0.6888
 epoch: 64, train_loss: 0.2590, test_loss: 1.4820, test_f1: 0.6756
 epoch: 65, train_loss: 0.2573, test_loss: 1.6028, test_f1: 0.6715
 epoch: 66, train_loss: 0.2661, test_loss: 1.4494, test_f1: 0.6847
 epoch: 67, train_loss: 0.2599, test_loss: 1.5634, test_f1: 0.6767
 epoch: 68, train_loss: 0.2606, test_loss: 1.5250, test_f1: 0.6661
 epoch: 69, train_loss: 0.2430, test_loss: 1.5272, test_f1: 0.6870
 epoch: 70, train_loss: 0.2551, test_loss: 1.5482, test_f1: 0.6813
 epoch: 71, train_loss: 0.2593, test_loss: 1.5729, test_f1: 0.6738
 epoch: 72, train_loss: 0.2435, test_loss: 1.6241, test_f1: 0.6774
 epoch: 73, train_loss: 0.2455, test_loss: 1.5346, test_f1: 0.6687
 epoch: 74, train_loss: 0.2357, test_loss: 1.5381, test_f1: 0.6629
 epoch: 75, train_loss: 0.2341, test_loss: 1.5501, test_f1: 0.6895
 epoch: 76, train_loss: 0.2161, test_loss: 1.6930, test_f1: 0.6657
 epoch: 77, train_loss: 0.2287, test_loss: 1.6642, test_f1: 0.6597
 epoch: 78, train_loss: 0.2243, test_loss: 1.5153, test_f1: 0.6892
 epoch: 79, train_loss: 0.2464, test_loss: 1.6617, test_f1: 0.6783
 epoch: 80, train_loss: 0.2132, test_loss: 1.6180, test_f1: 0.6785
 epoch: 81, train_loss: 0.2044, test_loss: 1.6811, test_f1: 0.6662
 epoch: 82, train_loss: 0.2276, test_loss: 1.6721, test_f1: 0.6766
 epoch: 83, train_loss: 0.2374, test_loss: 1.5692, test_f1: 0.6800
 epoch: 84, train_loss: 0.2018, test_loss: 1.7543, test_f1: 0.6610
 epoch: 85, train_loss: 0.2113, test_loss: 1.5715, test_f1: 0.6798
 epoch: 86, train_loss: 0.2086, test_loss: 1.6791, test_f1: 0.6696
 epoch: 87, train_loss: 0.2134, test_loss: 1.6248, test_f1: 0.6667
 epoch: 88, train_loss: 0.1939, test_loss: 1.7925, test_f1: 0.6647
 epoch: 89, train_loss: 0.1863, test_loss: 1.7637, test_f1: 0.6754
 epoch: 90, train_loss: 0.1896, test_loss: 1.7556, test_f1: 0.6729
 epoch: 91, train_loss: 0.1852, test_loss: 1.7519, test_f1: 0.6663
 epoch: 92, train_loss: 0.1807, test_loss: 1.7255, test_f1: 0.6865
 epoch: 93, train_loss: 0.1872, test_loss: 1.7185, test_f1: 0.6723
 epoch: 94, train_loss: 0.1930, test_loss: 1.7896, test_f1: 0.6772
 epoch: 95, train_loss: 0.1789, test_loss: 1.7486, test_f1: 0.6775
 epoch: 96, train_loss: 0.1950, test_loss: 1.8014, test_f1: 0.6771
 epoch: 97, train_loss: 0.1765, test_loss: 1.8933, test_f1: 0.6766
 epoch: 98, train_loss: 0.1863, test_loss: 1.7340, test_f1: 0.6717
 epoch: 99, train_loss: 0.1700, test_loss: 1.7137, test_f1: 0.6675
##################ITERATION #1 ****************************************
 epoch: 0, train_loss: 1.0526, test_loss: 0.9916, test_f1: 0.4545
 epoch: 1, train_loss: 0.9509, test_loss: 0.8927, test_f1: 0.5422
 epoch: 2, train_loss: 0.9059, test_loss: 0.8953, test_f1: 0.5456
 epoch: 3, train_loss: 0.8841, test_loss: 0.8269, test_f1: 0.5819
 epoch: 4, train_loss: 0.8504, test_loss: 0.8051, test_f1: 0.6049
 epoch: 5, train_loss: 0.8334, test_loss: 0.8812, test_f1: 0.5718
 epoch: 6, train_loss: 0.8007, test_loss: 0.8527, test_f1: 0.5754
 epoch: 7, train_loss: 0.7885, test_loss: 0.7860, test_f1: 0.6151
 epoch: 8, train_loss: 0.7798, test_loss: 0.7607, test_f1: 0.6124
 epoch: 9, train_loss: 0.7422, test_loss: 0.8007, test_f1: 0.6165
 epoch: 10, train_loss: 0.7209, test_loss: 0.7401, test_f1: 0.6410
 epoch: 11, train_loss: 0.7011, test_loss: 0.7540, test_f1: 0.6889
 epoch: 12, train_loss: 0.6991, test_loss: 0.7199, test_f1: 0.6574
 epoch: 13, train_loss: 0.6766, test_loss: 0.7303, test_f1: 0.6670
 epoch: 14, train_loss: 0.6764, test_loss: 0.6949, test_f1: 0.6538
 epoch: 15, train_loss: 0.6384, test_loss: 0.7853, test_f1: 0.6684
 epoch: 16, train_loss: 0.6335, test_loss: 0.7487, test_f1: 0.6934
 epoch: 17, train_loss: 0.6244, test_loss: 0.7050, test_f1: 0.6781
 epoch: 18, train_loss: 0.6135, test_loss: 0.7577, test_f1: 0.6351
 epoch: 19, train_loss: 0.6055, test_loss: 0.8785, test_f1: 0.6407
 epoch: 20, train_loss: 0.6054, test_loss: 0.8215, test_f1: 0.6748
 epoch: 21, train_loss: 0.5692, test_loss: 0.8099, test_f1: 0.6521
 epoch: 22, train_loss: 0.5786, test_loss: 0.7935, test_f1: 0.6592
 epoch: 23, train_loss: 0.5530, test_loss: 0.7733, test_f1: 0.6398
 epoch: 24, train_loss: 0.5397, test_loss: 0.8689, test_f1: 0.6426
 epoch: 25, train_loss: 0.5408, test_loss: 0.8024, test_f1: 0.6574
 epoch: 26, train_loss: 0.5315, test_loss: 0.8639, test_f1: 0.6445
 epoch: 27, train_loss: 0.5015, test_loss: 0.8855, test_f1: 0.6776
 epoch: 28, train_loss: 0.5142, test_loss: 0.8351, test_f1: 0.6472
 epoch: 29, train_loss: 0.5130, test_loss: 0.8557, test_f1: 0.6787
 epoch: 30, train_loss: 0.5051, test_loss: 0.8768, test_f1: 0.6377
 epoch: 31, train_loss: 0.4737, test_loss: 0.9159, test_f1: 0.6705
 epoch: 32, train_loss: 0.4649, test_loss: 0.8508, test_f1: 0.6646
 epoch: 33, train_loss: 0.4896, test_loss: 0.8367, test_f1: 0.6805
 epoch: 34, train_loss: 0.4722, test_loss: 0.9998, test_f1: 0.6574
 epoch: 35, train_loss: 0.4514, test_loss: 0.9215, test_f1: 0.6834
 epoch: 36, train_loss: 0.4235, test_loss: 0.9503, test_f1: 0.7161
 epoch: 37, train_loss: 0.4326, test_loss: 0.9296, test_f1: 0.6734
 epoch: 38, train_loss: 0.4229, test_loss: 1.0306, test_f1: 0.6504
 epoch: 39, train_loss: 0.4117, test_loss: 0.9301, test_f1: 0.6779
 epoch: 40, train_loss: 0.4098, test_loss: 1.0784, test_f1: 0.6691
 epoch: 41, train_loss: 0.4085, test_loss: 0.9897, test_f1: 0.6793
 epoch: 42, train_loss: 0.4082, test_loss: 0.9745, test_f1: 0.7194
 epoch: 43, train_loss: 0.4045, test_loss: 1.0175, test_f1: 0.6660
 epoch: 44, train_loss: 0.3948, test_loss: 1.0025, test_f1: 0.6669
 epoch: 45, train_loss: 0.3685, test_loss: 1.1319, test_f1: 0.6757
 epoch: 46, train_loss: 0.3647, test_loss: 1.1297, test_f1: 0.6842
 epoch: 47, train_loss: 0.3635, test_loss: 1.1203, test_f1: 0.6861
 epoch: 48, train_loss: 0.3760, test_loss: 1.0871, test_f1: 0.6623
 epoch: 49, train_loss: 0.3659, test_loss: 1.1144, test_f1: 0.6661
 epoch: 50, train_loss: 0.3348, test_loss: 1.0644, test_f1: 0.6942
 epoch: 51, train_loss: 0.3033, test_loss: 1.2061, test_f1: 0.6625
 epoch: 52, train_loss: 0.2822, test_loss: 1.2114, test_f1: 0.7035
 epoch: 53, train_loss: 0.2896, test_loss: 1.2368, test_f1: 0.6932
 epoch: 54, train_loss: 0.2915, test_loss: 1.1938, test_f1: 0.6872
 epoch: 55, train_loss: 0.2903, test_loss: 1.2148, test_f1: 0.6964
 epoch: 56, train_loss: 0.2646, test_loss: 1.2028, test_f1: 0.6832
 epoch: 57, train_loss: 0.2786, test_loss: 1.2504, test_f1: 0.6828
 epoch: 58, train_loss: 0.2665, test_loss: 1.3984, test_f1: 0.6664
 epoch: 59, train_loss: 0.2667, test_loss: 1.3261, test_f1: 0.6797
 epoch: 60, train_loss: 0.2590, test_loss: 1.3817, test_f1: 0.6715
 epoch: 61, train_loss: 0.2517, test_loss: 1.4272, test_f1: 0.6534
 epoch: 62, train_loss: 0.2340, test_loss: 1.4511, test_f1: 0.6748
 epoch: 63, train_loss: 0.2444, test_loss: 1.4133, test_f1: 0.6847
 epoch: 64, train_loss: 0.2485, test_loss: 1.3455, test_f1: 0.6908
 epoch: 65, train_loss: 0.2437, test_loss: 1.3665, test_f1: 0.6870
 epoch: 66, train_loss: 0.2528, test_loss: 1.3678, test_f1: 0.6902
 epoch: 67, train_loss: 0.2374, test_loss: 1.4180, test_f1: 0.6709
 epoch: 68, train_loss: 0.2213, test_loss: 1.4063, test_f1: 0.6747
 epoch: 69, train_loss: 0.2372, test_loss: 1.4922, test_f1: 0.6647
 epoch: 70, train_loss: 0.2383, test_loss: 1.2778, test_f1: 0.6900
 epoch: 71, train_loss: 0.2258, test_loss: 1.4061, test_f1: 0.6608
 epoch: 72, train_loss: 0.2329, test_loss: 1.4270, test_f1: 0.6767
 epoch: 73, train_loss: 0.2197, test_loss: 1.3713, test_f1: 0.6782
 epoch: 74, train_loss: 0.2213, test_loss: 1.4332, test_f1: 0.6824
 epoch: 75, train_loss: 0.2134, test_loss: 1.6291, test_f1: 0.6707
 epoch: 76, train_loss: 0.2163, test_loss: 1.3532, test_f1: 0.6918
 epoch: 77, train_loss: 0.2010, test_loss: 1.5758, test_f1: 0.6843
 epoch: 78, train_loss: 0.2027, test_loss: 1.5780, test_f1: 0.6497
 epoch: 79, train_loss: 0.2156, test_loss: 1.4636, test_f1: 0.6752
 epoch: 80, train_loss: 0.1998, test_loss: 1.4856, test_f1: 0.6714
 epoch: 81, train_loss: 0.2000, test_loss: 1.5445, test_f1: 0.6788
 epoch: 82, train_loss: 0.1950, test_loss: 1.6820, test_f1: 0.6858
 epoch: 83, train_loss: 0.2123, test_loss: 1.5647, test_f1: 0.6823
 epoch: 84, train_loss: 0.1920, test_loss: 1.5883, test_f1: 0.6796
 epoch: 85, train_loss: 0.1932, test_loss: 1.6389, test_f1: 0.6744
 epoch: 86, train_loss: 0.1990, test_loss: 1.6745, test_f1: 0.6939
 epoch: 87, train_loss: 0.2022, test_loss: 1.6491, test_f1: 0.6579
 epoch: 88, train_loss: 0.1888, test_loss: 1.7044, test_f1: 0.6596
 epoch: 89, train_loss: 0.2052, test_loss: 1.6829, test_f1: 0.6640
 epoch: 90, train_loss: 0.1766, test_loss: 1.7320, test_f1: 0.6765
 epoch: 91, train_loss: 0.1857, test_loss: 1.6283, test_f1: 0.6709
 epoch: 92, train_loss: 0.1943, test_loss: 1.7015, test_f1: 0.6744
 epoch: 93, train_loss: 0.1802, test_loss: 1.7414, test_f1: 0.6850
 epoch: 94, train_loss: 0.1932, test_loss: 1.7987, test_f1: 0.6864
 epoch: 95, train_loss: 0.1725, test_loss: 1.7411, test_f1: 0.6720
 epoch: 96, train_loss: 0.1823, test_loss: 1.7901, test_f1: 0.6804
 epoch: 97, train_loss: 0.1883, test_loss: 1.6505, test_f1: 0.6728
 epoch: 98, train_loss: 0.1718, test_loss: 1.8121, test_f1: 0.6877
 epoch: 99, train_loss: 0.1657, test_loss: 1.7534, test_f1: 0.6893
##################ITERATION #2 ****************************************
 epoch: 0, train_loss: 1.1340, test_loss: 1.0180, test_f1: 0.4476
 epoch: 1, train_loss: 0.9460, test_loss: 0.9008, test_f1: 0.5285
 epoch: 2, train_loss: 0.8941, test_loss: 0.8634, test_f1: 0.5550
 epoch: 3, train_loss: 0.8592, test_loss: 0.8376, test_f1: 0.5938
 epoch: 4, train_loss: 0.8436, test_loss: 0.8742, test_f1: 0.5732
 epoch: 5, train_loss: 0.8075, test_loss: 0.7918, test_f1: 0.6209
 epoch: 6, train_loss: 0.7908, test_loss: 0.8204, test_f1: 0.6329
 epoch: 7, train_loss: 0.7785, test_loss: 0.8143, test_f1: 0.6100
 epoch: 8, train_loss: 0.7589, test_loss: 0.7831, test_f1: 0.6398
 epoch: 9, train_loss: 0.7427, test_loss: 0.7732, test_f1: 0.6557
 epoch: 10, train_loss: 0.7336, test_loss: 0.8106, test_f1: 0.6379
 epoch: 11, train_loss: 0.7014, test_loss: 0.7085, test_f1: 0.6620
 epoch: 12, train_loss: 0.6866, test_loss: 0.7141, test_f1: 0.6594
 epoch: 13, train_loss: 0.6881, test_loss: 0.7482, test_f1: 0.6733
 epoch: 14, train_loss: 0.6801, test_loss: 0.8158, test_f1: 0.6250
 epoch: 15, train_loss: 0.6553, test_loss: 0.7485, test_f1: 0.6726
 epoch: 16, train_loss: 0.6406, test_loss: 0.8506, test_f1: 0.6335
 epoch: 17, train_loss: 0.6174, test_loss: 0.8051, test_f1: 0.6429
 epoch: 18, train_loss: 0.6197, test_loss: 0.8119, test_f1: 0.6393
 epoch: 19, train_loss: 0.5997, test_loss: 0.8030, test_f1: 0.6678
 epoch: 20, train_loss: 0.5886, test_loss: 0.7841, test_f1: 0.6431
 epoch: 21, train_loss: 0.5780, test_loss: 0.7495, test_f1: 0.6575
 epoch: 22, train_loss: 0.5882, test_loss: 0.8179, test_f1: 0.6477
 epoch: 23, train_loss: 0.5488, test_loss: 0.8668, test_f1: 0.6332
 epoch: 24, train_loss: 0.5425, test_loss: 0.7900, test_f1: 0.6639
 epoch: 25, train_loss: 0.5241, test_loss: 0.8671, test_f1: 0.6457
 epoch: 26, train_loss: 0.5307, test_loss: 0.8845, test_f1: 0.6733
 epoch: 27, train_loss: 0.4996, test_loss: 0.8496, test_f1: 0.6621
 epoch: 28, train_loss: 0.5040, test_loss: 0.9670, test_f1: 0.6667
 epoch: 29, train_loss: 0.4998, test_loss: 1.0775, test_f1: 0.6393
 epoch: 30, train_loss: 0.5050, test_loss: 1.0014, test_f1: 0.6116
 epoch: 31, train_loss: 0.4863, test_loss: 0.9452, test_f1: 0.6298
 epoch: 32, train_loss: 0.4793, test_loss: 0.9415, test_f1: 0.6793
 epoch: 33, train_loss: 0.4822, test_loss: 1.0485, test_f1: 0.6300
 epoch: 34, train_loss: 0.4546, test_loss: 0.9592, test_f1: 0.6439
 epoch: 35, train_loss: 0.4404, test_loss: 1.0378, test_f1: 0.6595
 epoch: 36, train_loss: 0.4396, test_loss: 1.0413, test_f1: 0.6541
 epoch: 37, train_loss: 0.4370, test_loss: 1.1151, test_f1: 0.6351
 epoch: 38, train_loss: 0.4432, test_loss: 0.9643, test_f1: 0.6713
 epoch: 39, train_loss: 0.4511, test_loss: 1.0287, test_f1: 0.6588
 epoch: 40, train_loss: 0.4114, test_loss: 1.1203, test_f1: 0.6410
 epoch: 41, train_loss: 0.3981, test_loss: 1.1586, test_f1: 0.6680
 epoch: 42, train_loss: 0.4016, test_loss: 1.2443, test_f1: 0.6510
 epoch: 43, train_loss: 0.4170, test_loss: 1.0797, test_f1: 0.6612
 epoch: 44, train_loss: 0.3882, test_loss: 1.2909, test_f1: 0.6283
 epoch: 45, train_loss: 0.4056, test_loss: 1.2152, test_f1: 0.6280
 epoch: 46, train_loss: 0.3954, test_loss: 1.1816, test_f1: 0.6604
 epoch: 47, train_loss: 0.3860, test_loss: 1.2225, test_f1: 0.6556
 epoch: 48, train_loss: 0.3629, test_loss: 1.2371, test_f1: 0.6700
 epoch: 49, train_loss: 0.3669, test_loss: 1.3293, test_f1: 0.6437
 epoch: 50, train_loss: 0.3578, test_loss: 1.1378, test_f1: 0.6748
 epoch: 51, train_loss: 0.3232, test_loss: 1.1757, test_f1: 0.6702
 epoch: 52, train_loss: 0.3062, test_loss: 1.2193, test_f1: 0.6754
 epoch: 53, train_loss: 0.2992, test_loss: 1.3177, test_f1: 0.6600
 epoch: 54, train_loss: 0.2861, test_loss: 1.2342, test_f1: 0.6701
 epoch: 55, train_loss: 0.2834, test_loss: 1.3574, test_f1: 0.6673
 epoch: 56, train_loss: 0.2770, test_loss: 1.3708, test_f1: 0.6753
 epoch: 57, train_loss: 0.2642, test_loss: 1.3967, test_f1: 0.6632
 epoch: 58, train_loss: 0.2767, test_loss: 1.3324, test_f1: 0.6637
 epoch: 59, train_loss: 0.2590, test_loss: 1.4586, test_f1: 0.6650
 epoch: 60, train_loss: 0.2687, test_loss: 1.5148, test_f1: 0.6559
 epoch: 61, train_loss: 0.2688, test_loss: 1.3522, test_f1: 0.6535
 epoch: 62, train_loss: 0.2610, test_loss: 1.4756, test_f1: 0.6576
 epoch: 63, train_loss: 0.2525, test_loss: 1.5232, test_f1: 0.6756
 epoch: 64, train_loss: 0.2420, test_loss: 1.4567, test_f1: 0.6751
 epoch: 65, train_loss: 0.2379, test_loss: 1.5427, test_f1: 0.6441
 epoch: 66, train_loss: 0.2539, test_loss: 1.5907, test_f1: 0.6542
 epoch: 67, train_loss: 0.2335, test_loss: 1.5593, test_f1: 0.6523
 epoch: 68, train_loss: 0.2396, test_loss: 1.4894, test_f1: 0.6716
 epoch: 69, train_loss: 0.2375, test_loss: 1.4176, test_f1: 0.6573
 epoch: 70, train_loss: 0.2426, test_loss: 1.4553, test_f1: 0.6724
 epoch: 71, train_loss: 0.2359, test_loss: 1.4890, test_f1: 0.6789
 epoch: 72, train_loss: 0.2273, test_loss: 1.5776, test_f1: 0.6698
 epoch: 73, train_loss: 0.2178, test_loss: 1.5394, test_f1: 0.6621
 epoch: 74, train_loss: 0.2451, test_loss: 1.5091, test_f1: 0.6767
 epoch: 75, train_loss: 0.2364, test_loss: 1.5562, test_f1: 0.6814
 epoch: 76, train_loss: 0.2292, test_loss: 1.6336, test_f1: 0.6655
 epoch: 77, train_loss: 0.2277, test_loss: 1.7317, test_f1: 0.6651
 epoch: 78, train_loss: 0.2074, test_loss: 1.6774, test_f1: 0.6657
 epoch: 79, train_loss: 0.2103, test_loss: 1.6859, test_f1: 0.6551
 epoch: 80, train_loss: 0.1982, test_loss: 1.6999, test_f1: 0.6590
 epoch: 81, train_loss: 0.2182, test_loss: 1.7649, test_f1: 0.6703
 epoch: 82, train_loss: 0.2191, test_loss: 1.7138, test_f1: 0.6726
 epoch: 83, train_loss: 0.2101, test_loss: 1.6893, test_f1: 0.6740
 epoch: 84, train_loss: 0.2136, test_loss: 1.5854, test_f1: 0.6685
 epoch: 85, train_loss: 0.2007, test_loss: 1.8293, test_f1: 0.6614
 epoch: 86, train_loss: 0.2168, test_loss: 1.7065, test_f1: 0.6821
 epoch: 87, train_loss: 0.2248, test_loss: 1.6614, test_f1: 0.6750
 epoch: 88, train_loss: 0.1989, test_loss: 1.6627, test_f1: 0.6663
 epoch: 89, train_loss: 0.2012, test_loss: 1.9350, test_f1: 0.6849
 epoch: 90, train_loss: 0.2063, test_loss: 1.7177, test_f1: 0.6592
 epoch: 91, train_loss: 0.2075, test_loss: 1.6185, test_f1: 0.6879
 epoch: 92, train_loss: 0.1918, test_loss: 1.7138, test_f1: 0.6682
 epoch: 93, train_loss: 0.1792, test_loss: 1.6914, test_f1: 0.6638
 epoch: 94, train_loss: 0.1887, test_loss: 1.7339, test_f1: 0.6662
 epoch: 95, train_loss: 0.1792, test_loss: 1.8846, test_f1: 0.6668
 epoch: 96, train_loss: 0.1977, test_loss: 1.7938, test_f1: 0.6744
 epoch: 97, train_loss: 0.1914, test_loss: 1.7888, test_f1: 0.6524
 epoch: 98, train_loss: 0.1920, test_loss: 1.8017, test_f1: 0.6604
 epoch: 99, train_loss: 0.1765, test_loss: 1.8286, test_f1: 0.6724
##################ITERATION #3 ****************************************
 epoch: 0, train_loss: 1.2814, test_loss: 0.9937, test_f1: 0.4560
 epoch: 1, train_loss: 0.9729, test_loss: 0.8938, test_f1: 0.5164
 epoch: 2, train_loss: 0.9228, test_loss: 0.8990, test_f1: 0.5030
 epoch: 3, train_loss: 0.8942, test_loss: 0.8428, test_f1: 0.5683
 epoch: 4, train_loss: 0.8827, test_loss: 0.8416, test_f1: 0.5953
 epoch: 5, train_loss: 0.8476, test_loss: 0.8211, test_f1: 0.5393
 epoch: 6, train_loss: 0.8355, test_loss: 0.8269, test_f1: 0.5763
 epoch: 7, train_loss: 0.8160, test_loss: 0.7693, test_f1: 0.6316
 epoch: 8, train_loss: 0.7871, test_loss: 0.7852, test_f1: 0.6196
 epoch: 9, train_loss: 0.7716, test_loss: 0.7505, test_f1: 0.6277
 epoch: 10, train_loss: 0.7508, test_loss: 0.8107, test_f1: 0.5794
 epoch: 11, train_loss: 0.7290, test_loss: 0.7619, test_f1: 0.6138
 epoch: 12, train_loss: 0.7176, test_loss: 0.7394, test_f1: 0.6649
 epoch: 13, train_loss: 0.7144, test_loss: 0.7814, test_f1: 0.5961
 epoch: 14, train_loss: 0.7117, test_loss: 0.7436, test_f1: 0.6517
 epoch: 15, train_loss: 0.6800, test_loss: 0.7064, test_f1: 0.6578
 epoch: 16, train_loss: 0.6501, test_loss: 0.6953, test_f1: 0.6526
 epoch: 17, train_loss: 0.6584, test_loss: 0.7151, test_f1: 0.6565
 epoch: 18, train_loss: 0.6381, test_loss: 0.7389, test_f1: 0.6662
 epoch: 19, train_loss: 0.6350, test_loss: 0.8547, test_f1: 0.5981
 epoch: 20, train_loss: 0.6205, test_loss: 0.7533, test_f1: 0.6408
 epoch: 21, train_loss: 0.6023, test_loss: 0.7785, test_f1: 0.6632
 epoch: 22, train_loss: 0.6132, test_loss: 0.7344, test_f1: 0.6605
 epoch: 23, train_loss: 0.6002, test_loss: 0.8174, test_f1: 0.6272
 epoch: 24, train_loss: 0.5733, test_loss: 0.7853, test_f1: 0.6604
 epoch: 25, train_loss: 0.5815, test_loss: 0.7762, test_f1: 0.6355
 epoch: 26, train_loss: 0.5724, test_loss: 0.7456, test_f1: 0.6667
 epoch: 27, train_loss: 0.5533, test_loss: 0.8345, test_f1: 0.6574
 epoch: 28, train_loss: 0.5428, test_loss: 0.7616, test_f1: 0.6796
 epoch: 29, train_loss: 0.5455, test_loss: 0.8327, test_f1: 0.6393
 epoch: 30, train_loss: 0.5164, test_loss: 0.7699, test_f1: 0.6728
 epoch: 31, train_loss: 0.5142, test_loss: 0.7699, test_f1: 0.6561
 epoch: 32, train_loss: 0.5212, test_loss: 0.7899, test_f1: 0.6495
 epoch: 33, train_loss: 0.5175, test_loss: 0.7554, test_f1: 0.6524
 epoch: 34, train_loss: 0.4922, test_loss: 0.9311, test_f1: 0.6515
 epoch: 35, train_loss: 0.5012, test_loss: 0.8365, test_f1: 0.6572
 epoch: 36, train_loss: 0.4751, test_loss: 0.8874, test_f1: 0.6534
 epoch: 37, train_loss: 0.4699, test_loss: 0.9258, test_f1: 0.6491
 epoch: 38, train_loss: 0.4617, test_loss: 0.8911, test_f1: 0.6884
 epoch: 39, train_loss: 0.4578, test_loss: 0.9036, test_f1: 0.6527
 epoch: 40, train_loss: 0.4754, test_loss: 0.8460, test_f1: 0.6516
 epoch: 41, train_loss: 0.4383, test_loss: 0.9096, test_f1: 0.6691
 epoch: 42, train_loss: 0.4313, test_loss: 0.9307, test_f1: 0.6540
 epoch: 43, train_loss: 0.4301, test_loss: 0.9397, test_f1: 0.6594
 epoch: 44, train_loss: 0.4226, test_loss: 0.9294, test_f1: 0.6361
 epoch: 45, train_loss: 0.4080, test_loss: 0.9908, test_f1: 0.6494
 epoch: 46, train_loss: 0.3958, test_loss: 0.9820, test_f1: 0.6480
 epoch: 47, train_loss: 0.4119, test_loss: 0.9402, test_f1: 0.6731
 epoch: 48, train_loss: 0.4111, test_loss: 0.9107, test_f1: 0.6705
 epoch: 49, train_loss: 0.3940, test_loss: 0.9922, test_f1: 0.6482
 epoch: 50, train_loss: 0.3942, test_loss: 1.0670, test_f1: 0.6553
 epoch: 51, train_loss: 0.3581, test_loss: 0.9801, test_f1: 0.6573
 epoch: 52, train_loss: 0.3204, test_loss: 1.0383, test_f1: 0.6650
 epoch: 53, train_loss: 0.3173, test_loss: 1.0335, test_f1: 0.6875
 epoch: 54, train_loss: 0.3162, test_loss: 1.0632, test_f1: 0.6695
 epoch: 55, train_loss: 0.2965, test_loss: 1.0968, test_f1: 0.6786
 epoch: 56, train_loss: 0.2905, test_loss: 1.0790, test_f1: 0.6768
 epoch: 57, train_loss: 0.3036, test_loss: 1.1201, test_f1: 0.6706
 epoch: 58, train_loss: 0.3034, test_loss: 1.1171, test_f1: 0.6703
 epoch: 59, train_loss: 0.3024, test_loss: 1.1451, test_f1: 0.6832
 epoch: 60, train_loss: 0.2739, test_loss: 1.1257, test_f1: 0.6748
 epoch: 61, train_loss: 0.2857, test_loss: 1.2155, test_f1: 0.6763
 epoch: 62, train_loss: 0.2656, test_loss: 1.2303, test_f1: 0.6840
 epoch: 63, train_loss: 0.2630, test_loss: 1.2437, test_f1: 0.6668
 epoch: 64, train_loss: 0.2769, test_loss: 1.2537, test_f1: 0.6751
 epoch: 65, train_loss: 0.2644, test_loss: 1.3069, test_f1: 0.6620
 epoch: 66, train_loss: 0.2691, test_loss: 1.2020, test_f1: 0.6854
 epoch: 67, train_loss: 0.2541, test_loss: 1.3369, test_f1: 0.6689
 epoch: 68, train_loss: 0.2471, test_loss: 1.2725, test_f1: 0.6855
 epoch: 69, train_loss: 0.2410, test_loss: 1.2923, test_f1: 0.6786
 epoch: 70, train_loss: 0.2413, test_loss: 1.2801, test_f1: 0.6718
 epoch: 71, train_loss: 0.2407, test_loss: 1.3730, test_f1: 0.6652
 epoch: 72, train_loss: 0.2408, test_loss: 1.3888, test_f1: 0.6650
 epoch: 73, train_loss: 0.2529, test_loss: 1.2234, test_f1: 0.6822
 epoch: 74, train_loss: 0.2343, test_loss: 1.2946, test_f1: 0.6886
 epoch: 75, train_loss: 0.2369, test_loss: 1.3582, test_f1: 0.6636
 epoch: 76, train_loss: 0.2320, test_loss: 1.3698, test_f1: 0.6863
 epoch: 77, train_loss: 0.2241, test_loss: 1.3855, test_f1: 0.6956
 epoch: 78, train_loss: 0.2186, test_loss: 1.4562, test_f1: 0.6647
 epoch: 79, train_loss: 0.2173, test_loss: 1.4904, test_f1: 0.6678
 epoch: 80, train_loss: 0.2115, test_loss: 1.4828, test_f1: 0.6678
 epoch: 81, train_loss: 0.2205, test_loss: 1.4511, test_f1: 0.6715
 epoch: 82, train_loss: 0.2229, test_loss: 1.4758, test_f1: 0.6680
 epoch: 83, train_loss: 0.2214, test_loss: 1.4493, test_f1: 0.6745
 epoch: 84, train_loss: 0.2064, test_loss: 1.4863, test_f1: 0.6620
 epoch: 85, train_loss: 0.2088, test_loss: 1.5122, test_f1: 0.6677
 epoch: 86, train_loss: 0.2285, test_loss: 1.5989, test_f1: 0.6724
 epoch: 87, train_loss: 0.2041, test_loss: 1.4721, test_f1: 0.6640
 epoch: 88, train_loss: 0.1914, test_loss: 1.4770, test_f1: 0.6639
 epoch: 89, train_loss: 0.2038, test_loss: 1.4598, test_f1: 0.6753
 epoch: 90, train_loss: 0.1877, test_loss: 1.5429, test_f1: 0.6576
 epoch: 91, train_loss: 0.2180, test_loss: 1.6034, test_f1: 0.6570
 epoch: 92, train_loss: 0.1884, test_loss: 1.4972, test_f1: 0.6652
 epoch: 93, train_loss: 0.1933, test_loss: 1.4981, test_f1: 0.6680
 epoch: 94, train_loss: 0.1953, test_loss: 1.5399, test_f1: 0.6955
 epoch: 95, train_loss: 0.1828, test_loss: 1.5205, test_f1: 0.6723
 epoch: 96, train_loss: 0.1888, test_loss: 1.4889, test_f1: 0.6796
 epoch: 97, train_loss: 0.1828, test_loss: 1.5637, test_f1: 0.6663
 epoch: 98, train_loss: 0.1693, test_loss: 1.5861, test_f1: 0.6676
 epoch: 99, train_loss: 0.1846, test_loss: 1.6064, test_f1: 0.6765
##################ITERATION #4 ****************************************
 epoch: 0, train_loss: 1.2738, test_loss: 1.0117, test_f1: 0.4852
 epoch: 1, train_loss: 0.9695, test_loss: 0.8986, test_f1: 0.5159
 epoch: 2, train_loss: 0.8996, test_loss: 0.8924, test_f1: 0.5503
 epoch: 3, train_loss: 0.8800, test_loss: 0.8678, test_f1: 0.5755
 epoch: 4, train_loss: 0.8618, test_loss: 0.8873, test_f1: 0.5052
 epoch: 5, train_loss: 0.8306, test_loss: 0.7884, test_f1: 0.6067
 epoch: 6, train_loss: 0.8069, test_loss: 0.7904, test_f1: 0.5996
 epoch: 7, train_loss: 0.7924, test_loss: 0.8042, test_f1: 0.6123
 epoch: 8, train_loss: 0.8027, test_loss: 0.7813, test_f1: 0.6318
 epoch: 9, train_loss: 0.7651, test_loss: 0.7627, test_f1: 0.6343
 epoch: 10, train_loss: 0.7681, test_loss: 0.7674, test_f1: 0.5992
 epoch: 11, train_loss: 0.7286, test_loss: 0.8096, test_f1: 0.6148
 epoch: 12, train_loss: 0.7214, test_loss: 0.7692, test_f1: 0.6103
 epoch: 13, train_loss: 0.7066, test_loss: 0.7203, test_f1: 0.6614
 epoch: 14, train_loss: 0.6841, test_loss: 0.8455, test_f1: 0.5951
 epoch: 15, train_loss: 0.6824, test_loss: 0.7751, test_f1: 0.6304
 epoch: 16, train_loss: 0.6628, test_loss: 0.7674, test_f1: 0.6591
 epoch: 17, train_loss: 0.6563, test_loss: 0.7884, test_f1: 0.6384
 epoch: 18, train_loss: 0.6368, test_loss: 0.8127, test_f1: 0.6300
 epoch: 19, train_loss: 0.6439, test_loss: 0.7822, test_f1: 0.6962
 epoch: 20, train_loss: 0.6359, test_loss: 0.8082, test_f1: 0.6537
 epoch: 21, train_loss: 0.6162, test_loss: 0.7886, test_f1: 0.6476
 epoch: 22, train_loss: 0.6092, test_loss: 0.7618, test_f1: 0.6328
 epoch: 23, train_loss: 0.5950, test_loss: 0.7852, test_f1: 0.6311
 epoch: 24, train_loss: 0.5740, test_loss: 0.7823, test_f1: 0.6458
 epoch: 25, train_loss: 0.5856, test_loss: 0.7098, test_f1: 0.6831
 epoch: 26, train_loss: 0.5700, test_loss: 0.7862, test_f1: 0.6768
 epoch: 27, train_loss: 0.5430, test_loss: 0.7912, test_f1: 0.6738
 epoch: 28, train_loss: 0.5532, test_loss: 0.8125, test_f1: 0.6705
 epoch: 29, train_loss: 0.5276, test_loss: 0.7292, test_f1: 0.6662
 epoch: 30, train_loss: 0.5349, test_loss: 0.7534, test_f1: 0.6752
 epoch: 31, train_loss: 0.5130, test_loss: 0.7802, test_f1: 0.6834
 epoch: 32, train_loss: 0.5085, test_loss: 0.8407, test_f1: 0.6797
 epoch: 33, train_loss: 0.5041, test_loss: 0.7595, test_f1: 0.6775
 epoch: 34, train_loss: 0.4841, test_loss: 0.8402, test_f1: 0.6575
 epoch: 35, train_loss: 0.4942, test_loss: 0.8246, test_f1: 0.6716
 epoch: 36, train_loss: 0.4728, test_loss: 0.7956, test_f1: 0.6841
 epoch: 37, train_loss: 0.4608, test_loss: 0.8609, test_f1: 0.6494
 epoch: 38, train_loss: 0.4541, test_loss: 0.8669, test_f1: 0.6869
 epoch: 39, train_loss: 0.4680, test_loss: 0.8107, test_f1: 0.6972
 epoch: 40, train_loss: 0.4518, test_loss: 0.8684, test_f1: 0.6772
 epoch: 41, train_loss: 0.4304, test_loss: 0.9238, test_f1: 0.6844
 epoch: 42, train_loss: 0.4260, test_loss: 0.9072, test_f1: 0.6668
 epoch: 43, train_loss: 0.4165, test_loss: 0.9720, test_f1: 0.6761
 epoch: 44, train_loss: 0.4167, test_loss: 0.9803, test_f1: 0.6547
 epoch: 45, train_loss: 0.4129, test_loss: 0.9806, test_f1: 0.6718
 epoch: 46, train_loss: 0.4114, test_loss: 0.9388, test_f1: 0.6665
 epoch: 47, train_loss: 0.3882, test_loss: 1.0263, test_f1: 0.6463
 epoch: 48, train_loss: 0.3998, test_loss: 0.9937, test_f1: 0.6675
 epoch: 49, train_loss: 0.3768, test_loss: 0.9806, test_f1: 0.6690
 epoch: 50, train_loss: 0.3638, test_loss: 1.0662, test_f1: 0.6619
 epoch: 51, train_loss: 0.3451, test_loss: 1.0373, test_f1: 0.6727
 epoch: 52, train_loss: 0.3201, test_loss: 1.0155, test_f1: 0.6764
 epoch: 53, train_loss: 0.3104, test_loss: 1.0195, test_f1: 0.6640
 epoch: 54, train_loss: 0.3066, test_loss: 1.0253, test_f1: 0.6876
 epoch: 55, train_loss: 0.2944, test_loss: 1.0675, test_f1: 0.6823
 epoch: 56, train_loss: 0.3026, test_loss: 1.1166, test_f1: 0.6750
 epoch: 57, train_loss: 0.3022, test_loss: 1.0973, test_f1: 0.6814
 epoch: 58, train_loss: 0.2717, test_loss: 1.0887, test_f1: 0.6730
 epoch: 59, train_loss: 0.2826, test_loss: 1.0747, test_f1: 0.7116
 epoch: 60, train_loss: 0.2901, test_loss: 1.0814, test_f1: 0.6722
 epoch: 61, train_loss: 0.2793, test_loss: 1.1223, test_f1: 0.6668
 epoch: 62, train_loss: 0.2984, test_loss: 1.1070, test_f1: 0.6709
 epoch: 63, train_loss: 0.2795, test_loss: 1.0696, test_f1: 0.6860
 epoch: 64, train_loss: 0.2813, test_loss: 1.0616, test_f1: 0.6970
 epoch: 65, train_loss: 0.2573, test_loss: 1.0856, test_f1: 0.7030
 epoch: 66, train_loss: 0.2694, test_loss: 1.1364, test_f1: 0.6972
 epoch: 67, train_loss: 0.2386, test_loss: 1.2132, test_f1: 0.6719
 epoch: 68, train_loss: 0.2565, test_loss: 1.2673, test_f1: 0.6533
 epoch: 69, train_loss: 0.2660, test_loss: 1.1803, test_f1: 0.6984
 epoch: 70, train_loss: 0.2547, test_loss: 1.1492, test_f1: 0.6756
 epoch: 71, train_loss: 0.2662, test_loss: 1.0527, test_f1: 0.6979
 epoch: 72, train_loss: 0.2464, test_loss: 1.2779, test_f1: 0.6722
 epoch: 73, train_loss: 0.2599, test_loss: 1.2087, test_f1: 0.6728
 epoch: 74, train_loss: 0.2636, test_loss: 1.1365, test_f1: 0.6883
 epoch: 75, train_loss: 0.2446, test_loss: 1.2542, test_f1: 0.6644
 epoch: 76, train_loss: 0.2404, test_loss: 1.2332, test_f1: 0.6836
 epoch: 77, train_loss: 0.2310, test_loss: 1.1875, test_f1: 0.6897
 epoch: 78, train_loss: 0.2270, test_loss: 1.2115, test_f1: 0.6662
 epoch: 79, train_loss: 0.2353, test_loss: 1.2478, test_f1: 0.6655
 epoch: 80, train_loss: 0.2122, test_loss: 1.3192, test_f1: 0.6713
 epoch: 81, train_loss: 0.2308, test_loss: 1.3257, test_f1: 0.6481
 epoch: 82, train_loss: 0.2122, test_loss: 1.2349, test_f1: 0.6765
 epoch: 83, train_loss: 0.2242, test_loss: 1.3838, test_f1: 0.6552
 epoch: 84, train_loss: 0.2175, test_loss: 1.4195, test_f1: 0.6644
 epoch: 85, train_loss: 0.2294, test_loss: 1.4028, test_f1: 0.6683
 epoch: 86, train_loss: 0.2101, test_loss: 1.3754, test_f1: 0.6736
 epoch: 87, train_loss: 0.2172, test_loss: 1.2848, test_f1: 0.6780
 epoch: 88, train_loss: 0.2116, test_loss: 1.3343, test_f1: 0.6794
 epoch: 89, train_loss: 0.2051, test_loss: 1.3897, test_f1: 0.6653
 epoch: 90, train_loss: 0.2141, test_loss: 1.4677, test_f1: 0.6676
 epoch: 91, train_loss: 0.2025, test_loss: 1.3276, test_f1: 0.6750
 epoch: 92, train_loss: 0.2055, test_loss: 1.2631, test_f1: 0.6834
 epoch: 93, train_loss: 0.2118, test_loss: 1.4006, test_f1: 0.6618
 epoch: 94, train_loss: 0.1891, test_loss: 1.3515, test_f1: 0.6788
 epoch: 95, train_loss: 0.1984, test_loss: 1.3040, test_f1: 0.6922
 epoch: 96, train_loss: 0.2047, test_loss: 1.4125, test_f1: 0.6828
 epoch: 97, train_loss: 0.1975, test_loss: 1.4682, test_f1: 0.6783
 epoch: 98, train_loss: 0.1972, test_loss: 1.3507, test_f1: 0.6752
 epoch: 99, train_loss: 0.2017, test_loss: 1.4066, test_f1: 0.6774
##################ITERATION #5 ****************************************
 epoch: 0, train_loss: 1.4017, test_loss: 1.0053, test_f1: 0.5086
 epoch: 1, train_loss: 0.9614, test_loss: 0.8787, test_f1: 0.5216
 epoch: 2, train_loss: 0.9239, test_loss: 0.8798, test_f1: 0.5401
 epoch: 3, train_loss: 0.8673, test_loss: 0.8830, test_f1: 0.5844
 epoch: 4, train_loss: 0.8498, test_loss: 0.8331, test_f1: 0.5903
 epoch: 5, train_loss: 0.8198, test_loss: 0.7960, test_f1: 0.6049
 epoch: 6, train_loss: 0.8007, test_loss: 0.7928, test_f1: 0.6149
 epoch: 7, train_loss: 0.7921, test_loss: 0.7894, test_f1: 0.6120
 epoch: 8, train_loss: 0.7695, test_loss: 0.7563, test_f1: 0.6256
 epoch: 9, train_loss: 0.7386, test_loss: 0.7730, test_f1: 0.6398
 epoch: 10, train_loss: 0.7199, test_loss: 0.7933, test_f1: 0.6260
 epoch: 11, train_loss: 0.7211, test_loss: 0.7472, test_f1: 0.6433
 epoch: 12, train_loss: 0.7116, test_loss: 0.7393, test_f1: 0.6392
 epoch: 13, train_loss: 0.6998, test_loss: 0.7759, test_f1: 0.6253
 epoch: 14, train_loss: 0.6827, test_loss: 0.7898, test_f1: 0.6401
 epoch: 15, train_loss: 0.6773, test_loss: 0.7699, test_f1: 0.6537
 epoch: 16, train_loss: 0.6705, test_loss: 0.7339, test_f1: 0.6534
 epoch: 17, train_loss: 0.6391, test_loss: 0.7290, test_f1: 0.6694
 epoch: 18, train_loss: 0.6278, test_loss: 0.7614, test_f1: 0.6594
 epoch: 19, train_loss: 0.6084, test_loss: 0.7297, test_f1: 0.6844
 epoch: 20, train_loss: 0.6232, test_loss: 0.7535, test_f1: 0.6852
 epoch: 21, train_loss: 0.6229, test_loss: 0.7848, test_f1: 0.6289
 epoch: 22, train_loss: 0.5958, test_loss: 0.7481, test_f1: 0.6622
 epoch: 23, train_loss: 0.5825, test_loss: 0.7769, test_f1: 0.6387
 epoch: 24, train_loss: 0.5767, test_loss: 0.8578, test_f1: 0.6315
 epoch: 25, train_loss: 0.5694, test_loss: 0.7240, test_f1: 0.6818
 epoch: 26, train_loss: 0.5652, test_loss: 0.8322, test_f1: 0.6899
 epoch: 27, train_loss: 0.5544, test_loss: 0.8046, test_f1: 0.6580
 epoch: 28, train_loss: 0.5372, test_loss: 0.8567, test_f1: 0.6592
 epoch: 29, train_loss: 0.5241, test_loss: 0.7938, test_f1: 0.6674
 epoch: 30, train_loss: 0.5218, test_loss: 0.8367, test_f1: 0.6474
 epoch: 31, train_loss: 0.5256, test_loss: 0.7945, test_f1: 0.6416
 epoch: 32, train_loss: 0.5121, test_loss: 0.7781, test_f1: 0.7113
 epoch: 33, train_loss: 0.5150, test_loss: 0.8539, test_f1: 0.6311
 epoch: 34, train_loss: 0.5020, test_loss: 0.7572, test_f1: 0.6955
 epoch: 35, train_loss: 0.4812, test_loss: 0.7705, test_f1: 0.6644
 epoch: 36, train_loss: 0.4900, test_loss: 0.7907, test_f1: 0.6854
 epoch: 37, train_loss: 0.4656, test_loss: 0.7953, test_f1: 0.6808
 epoch: 38, train_loss: 0.4715, test_loss: 0.7992, test_f1: 0.6846
 epoch: 39, train_loss: 0.4628, test_loss: 0.8221, test_f1: 0.6685
 epoch: 40, train_loss: 0.4516, test_loss: 0.8235, test_f1: 0.6709
 epoch: 41, train_loss: 0.4539, test_loss: 0.8520, test_f1: 0.6651
 epoch: 42, train_loss: 0.4429, test_loss: 0.8401, test_f1: 0.6689
 epoch: 43, train_loss: 0.4335, test_loss: 0.8753, test_f1: 0.6589
 epoch: 44, train_loss: 0.4377, test_loss: 0.8883, test_f1: 0.6608
 epoch: 45, train_loss: 0.4109, test_loss: 0.8760, test_f1: 0.6595
 epoch: 46, train_loss: 0.4014, test_loss: 0.8634, test_f1: 0.6829
 epoch: 47, train_loss: 0.4090, test_loss: 0.9534, test_f1: 0.6371
 epoch: 48, train_loss: 0.4077, test_loss: 0.9187, test_f1: 0.6658
 epoch: 49, train_loss: 0.3803, test_loss: 0.9945, test_f1: 0.6932
 epoch: 50, train_loss: 0.3725, test_loss: 0.8828, test_f1: 0.6784
 epoch: 51, train_loss: 0.3351, test_loss: 0.9596, test_f1: 0.6741
 epoch: 52, train_loss: 0.3223, test_loss: 0.9668, test_f1: 0.6905
 epoch: 53, train_loss: 0.3111, test_loss: 0.9919, test_f1: 0.6789
 epoch: 54, train_loss: 0.2993, test_loss: 1.0506, test_f1: 0.6798
 epoch: 55, train_loss: 0.2939, test_loss: 0.9830, test_f1: 0.7193
 epoch: 56, train_loss: 0.3063, test_loss: 1.0353, test_f1: 0.6987
 epoch: 57, train_loss: 0.2877, test_loss: 1.1164, test_f1: 0.6738
 epoch: 58, train_loss: 0.3024, test_loss: 1.0833, test_f1: 0.6935
 epoch: 59, train_loss: 0.2960, test_loss: 1.0766, test_f1: 0.6753
 epoch: 60, train_loss: 0.3009, test_loss: 1.1112, test_f1: 0.6927
 epoch: 61, train_loss: 0.2819, test_loss: 0.9778, test_f1: 0.6980
 epoch: 62, train_loss: 0.2726, test_loss: 1.1074, test_f1: 0.6874
 epoch: 63, train_loss: 0.2797, test_loss: 1.0408, test_f1: 0.6713
 epoch: 64, train_loss: 0.2679, test_loss: 1.1083, test_f1: 0.6881
 epoch: 65, train_loss: 0.2766, test_loss: 1.1591, test_f1: 0.6632
 epoch: 66, train_loss: 0.2596, test_loss: 1.1871, test_f1: 0.6700
 epoch: 67, train_loss: 0.2755, test_loss: 1.2173, test_f1: 0.6758
 epoch: 68, train_loss: 0.2615, test_loss: 1.1148, test_f1: 0.6744
 epoch: 69, train_loss: 0.2400, test_loss: 1.2208, test_f1: 0.6833
 epoch: 70, train_loss: 0.2489, test_loss: 1.1241, test_f1: 0.6758
 epoch: 71, train_loss: 0.2458, test_loss: 1.1701, test_f1: 0.6803
 epoch: 72, train_loss: 0.2277, test_loss: 1.1454, test_f1: 0.6805
 epoch: 73, train_loss: 0.2422, test_loss: 1.2468, test_f1: 0.6687
 epoch: 74, train_loss: 0.2323, test_loss: 1.2750, test_f1: 0.6683
 epoch: 75, train_loss: 0.2392, test_loss: 1.1787, test_f1: 0.6907
 epoch: 76, train_loss: 0.2488, test_loss: 1.2160, test_f1: 0.6770
 epoch: 77, train_loss: 0.2262, test_loss: 1.2747, test_f1: 0.6832
 epoch: 78, train_loss: 0.2304, test_loss: 1.2808, test_f1: 0.6673
 epoch: 79, train_loss: 0.2328, test_loss: 1.3451, test_f1: 0.6730
 epoch: 80, train_loss: 0.2441, test_loss: 1.1834, test_f1: 0.6863
 epoch: 81, train_loss: 0.2316, test_loss: 1.2529, test_f1: 0.6755
 epoch: 82, train_loss: 0.2248, test_loss: 1.2543, test_f1: 0.6692
 epoch: 83, train_loss: 0.2026, test_loss: 1.2939, test_f1: 0.6752
 epoch: 84, train_loss: 0.2100, test_loss: 1.2862, test_f1: 0.6714
 epoch: 85, train_loss: 0.2191, test_loss: 1.3321, test_f1: 0.6758
 epoch: 86, train_loss: 0.2048, test_loss: 1.3179, test_f1: 0.6597
 epoch: 87, train_loss: 0.2197, test_loss: 1.3789, test_f1: 0.6724
 epoch: 88, train_loss: 0.2248, test_loss: 1.2987, test_f1: 0.6997
 epoch: 89, train_loss: 0.2049, test_loss: 1.3249, test_f1: 0.6824
 epoch: 90, train_loss: 0.2059, test_loss: 1.2917, test_f1: 0.6774
 epoch: 91, train_loss: 0.2013, test_loss: 1.2923, test_f1: 0.6799
 epoch: 92, train_loss: 0.2169, test_loss: 1.2691, test_f1: 0.6844
 epoch: 93, train_loss: 0.2126, test_loss: 1.3210, test_f1: 0.6828
 epoch: 94, train_loss: 0.1914, test_loss: 1.3244, test_f1: 0.6736
 epoch: 95, train_loss: 0.2070, test_loss: 1.4527, test_f1: 0.6657
 epoch: 96, train_loss: 0.1950, test_loss: 1.4381, test_f1: 0.6733
 epoch: 97, train_loss: 0.1930, test_loss: 1.2945, test_f1: 0.6855
 epoch: 98, train_loss: 0.2144, test_loss: 1.4289, test_f1: 0.6578
 epoch: 99, train_loss: 0.1958, test_loss: 1.3096, test_f1: 0.7114
##################ITERATION #6 ****************************************
 epoch: 0, train_loss: 1.3841, test_loss: 1.0864, test_f1: 0.4233
 epoch: 1, train_loss: 0.9610, test_loss: 0.9249, test_f1: 0.5138
 epoch: 2, train_loss: 0.9208, test_loss: 0.8715, test_f1: 0.5509
 epoch: 3, train_loss: 0.8877, test_loss: 0.8681, test_f1: 0.5313
 epoch: 4, train_loss: 0.8696, test_loss: 0.8666, test_f1: 0.5892
 epoch: 5, train_loss: 0.8543, test_loss: 0.8348, test_f1: 0.5609
 epoch: 6, train_loss: 0.8143, test_loss: 0.8222, test_f1: 0.5737
 epoch: 7, train_loss: 0.8128, test_loss: 0.8671, test_f1: 0.5817
 epoch: 8, train_loss: 0.7991, test_loss: 0.7777, test_f1: 0.6255
 epoch: 9, train_loss: 0.7881, test_loss: 0.7842, test_f1: 0.6124
 epoch: 10, train_loss: 0.7559, test_loss: 0.7775, test_f1: 0.6139
 epoch: 11, train_loss: 0.7431, test_loss: 0.7859, test_f1: 0.6163
 epoch: 12, train_loss: 0.7354, test_loss: 0.8570, test_f1: 0.5896
 epoch: 13, train_loss: 0.7279, test_loss: 0.7699, test_f1: 0.6127
 epoch: 14, train_loss: 0.7129, test_loss: 0.8184, test_f1: 0.6362
 epoch: 15, train_loss: 0.6856, test_loss: 0.8553, test_f1: 0.5970
 epoch: 16, train_loss: 0.6846, test_loss: 0.7676, test_f1: 0.6298
 epoch: 17, train_loss: 0.6770, test_loss: 0.8675, test_f1: 0.6132
 epoch: 18, train_loss: 0.6624, test_loss: 0.7534, test_f1: 0.6624
 epoch: 19, train_loss: 0.6515, test_loss: 0.7750, test_f1: 0.6409
 epoch: 20, train_loss: 0.6300, test_loss: 0.8012, test_f1: 0.6383
 epoch: 21, train_loss: 0.6322, test_loss: 0.7652, test_f1: 0.6674
 epoch: 22, train_loss: 0.6367, test_loss: 0.7928, test_f1: 0.6787
 epoch: 23, train_loss: 0.6020, test_loss: 0.7932, test_f1: 0.6391
 epoch: 24, train_loss: 0.5958, test_loss: 0.8216, test_f1: 0.6707
 epoch: 25, train_loss: 0.5799, test_loss: 0.7822, test_f1: 0.6557
 epoch: 26, train_loss: 0.5772, test_loss: 0.7751, test_f1: 0.6452
 epoch: 27, train_loss: 0.5634, test_loss: 0.8375, test_f1: 0.6333
 epoch: 28, train_loss: 0.5590, test_loss: 0.8873, test_f1: 0.6498
 epoch: 29, train_loss: 0.5520, test_loss: 0.8424, test_f1: 0.6620
 epoch: 30, train_loss: 0.5544, test_loss: 0.8057, test_f1: 0.6752
 epoch: 31, train_loss: 0.5432, test_loss: 0.9143, test_f1: 0.6501
 epoch: 32, train_loss: 0.5252, test_loss: 0.8344, test_f1: 0.6486
 epoch: 33, train_loss: 0.5360, test_loss: 0.8581, test_f1: 0.6899
 epoch: 34, train_loss: 0.5272, test_loss: 0.8294, test_f1: 0.6773
 epoch: 35, train_loss: 0.4954, test_loss: 0.9006, test_f1: 0.6641
 epoch: 36, train_loss: 0.5084, test_loss: 0.8470, test_f1: 0.6620
 epoch: 37, train_loss: 0.4822, test_loss: 0.8643, test_f1: 0.6815
 epoch: 38, train_loss: 0.4764, test_loss: 0.8556, test_f1: 0.6825
 epoch: 39, train_loss: 0.4807, test_loss: 0.8401, test_f1: 0.6687
 epoch: 40, train_loss: 0.4753, test_loss: 1.0593, test_f1: 0.6374
 epoch: 41, train_loss: 0.4562, test_loss: 0.8938, test_f1: 0.6815
 epoch: 42, train_loss: 0.4630, test_loss: 0.8818, test_f1: 0.6863
 epoch: 43, train_loss: 0.4560, test_loss: 0.9037, test_f1: 0.6746
 epoch: 44, train_loss: 0.4416, test_loss: 0.9399, test_f1: 0.6892
 epoch: 45, train_loss: 0.4358, test_loss: 0.9431, test_f1: 0.6654
 epoch: 46, train_loss: 0.4477, test_loss: 0.9125, test_f1: 0.6582
 epoch: 47, train_loss: 0.4143, test_loss: 0.8694, test_f1: 0.7072
 epoch: 48, train_loss: 0.4000, test_loss: 0.9823, test_f1: 0.6694
 epoch: 49, train_loss: 0.4190, test_loss: 0.9019, test_f1: 0.6747
 epoch: 50, train_loss: 0.4134, test_loss: 0.9347, test_f1: 0.6732
 epoch: 51, train_loss: 0.3700, test_loss: 0.9432, test_f1: 0.6790
 epoch: 52, train_loss: 0.3551, test_loss: 1.0123, test_f1: 0.6729
 epoch: 53, train_loss: 0.3295, test_loss: 1.0457, test_f1: 0.6842
 epoch: 54, train_loss: 0.3236, test_loss: 1.0499, test_f1: 0.6752
 epoch: 55, train_loss: 0.3234, test_loss: 1.0298, test_f1: 0.6940
 epoch: 56, train_loss: 0.3012, test_loss: 0.9927, test_f1: 0.6790
 epoch: 57, train_loss: 0.3140, test_loss: 1.0437, test_f1: 0.6833
 epoch: 58, train_loss: 0.3086, test_loss: 1.1035, test_f1: 0.6679
 epoch: 59, train_loss: 0.3053, test_loss: 1.0411, test_f1: 0.6802
 epoch: 60, train_loss: 0.2890, test_loss: 1.1187, test_f1: 0.6816
 epoch: 61, train_loss: 0.3085, test_loss: 1.2234, test_f1: 0.6606
 epoch: 62, train_loss: 0.2852, test_loss: 1.0709, test_f1: 0.6800
 epoch: 63, train_loss: 0.3015, test_loss: 1.0951, test_f1: 0.6761
 epoch: 64, train_loss: 0.2972, test_loss: 1.1132, test_f1: 0.6720
 epoch: 65, train_loss: 0.2799, test_loss: 1.1201, test_f1: 0.6723
 epoch: 66, train_loss: 0.2868, test_loss: 1.2110, test_f1: 0.6603
 epoch: 67, train_loss: 0.2888, test_loss: 1.2279, test_f1: 0.6720
 epoch: 68, train_loss: 0.2818, test_loss: 1.1979, test_f1: 0.6598
 epoch: 69, train_loss: 0.2799, test_loss: 1.2087, test_f1: 0.6583
 epoch: 70, train_loss: 0.2655, test_loss: 1.1534, test_f1: 0.6689
 epoch: 71, train_loss: 0.2819, test_loss: 1.1540, test_f1: 0.6654
 epoch: 72, train_loss: 0.2682, test_loss: 1.2091, test_f1: 0.6609
 epoch: 73, train_loss: 0.2596, test_loss: 1.1540, test_f1: 0.6587
 epoch: 74, train_loss: 0.2578, test_loss: 1.2247, test_f1: 0.6610
 epoch: 75, train_loss: 0.2767, test_loss: 1.1223, test_f1: 0.6855
 epoch: 76, train_loss: 0.2634, test_loss: 1.1586, test_f1: 0.6898
 epoch: 77, train_loss: 0.2470, test_loss: 1.2449, test_f1: 0.6741
 epoch: 78, train_loss: 0.2547, test_loss: 1.2120, test_f1: 0.6822
 epoch: 79, train_loss: 0.2529, test_loss: 1.2522, test_f1: 0.6627
 epoch: 80, train_loss: 0.2447, test_loss: 1.3410, test_f1: 0.6696
 epoch: 81, train_loss: 0.2472, test_loss: 1.2270, test_f1: 0.6828
 epoch: 82, train_loss: 0.2338, test_loss: 1.2594, test_f1: 0.6736
 epoch: 83, train_loss: 0.2391, test_loss: 1.2886, test_f1: 0.6705
 epoch: 84, train_loss: 0.2456, test_loss: 1.2571, test_f1: 0.6928
 epoch: 85, train_loss: 0.2343, test_loss: 1.2830, test_f1: 0.6864
 epoch: 86, train_loss: 0.2328, test_loss: 1.2922, test_f1: 0.6628
 epoch: 87, train_loss: 0.2288, test_loss: 1.3412, test_f1: 0.6731
 epoch: 88, train_loss: 0.2397, test_loss: 1.3899, test_f1: 0.6700
 epoch: 89, train_loss: 0.2352, test_loss: 1.3913, test_f1: 0.6779
 epoch: 90, train_loss: 0.2192, test_loss: 1.3593, test_f1: 0.6786
 epoch: 91, train_loss: 0.2200, test_loss: 1.3500, test_f1: 0.6724
 epoch: 92, train_loss: 0.2067, test_loss: 1.3355, test_f1: 0.6642
 epoch: 93, train_loss: 0.2326, test_loss: 1.3320, test_f1: 0.6725
 epoch: 94, train_loss: 0.2236, test_loss: 1.4270, test_f1: 0.6397
 epoch: 95, train_loss: 0.2148, test_loss: 1.4294, test_f1: 0.6599
 epoch: 96, train_loss: 0.1949, test_loss: 1.4368, test_f1: 0.6539
 epoch: 97, train_loss: 0.2101, test_loss: 1.3601, test_f1: 0.6614
 epoch: 98, train_loss: 0.2099, test_loss: 1.3508, test_f1: 0.6601
 epoch: 99, train_loss: 0.1937, test_loss: 1.4230, test_f1: 0.6734
##################ITERATION #7 ****************************************
 epoch: 0, train_loss: 1.3084, test_loss: 1.1151, test_f1: 0.3693
 epoch: 1, train_loss: 0.9466, test_loss: 0.8983, test_f1: 0.5209
 epoch: 2, train_loss: 0.9182, test_loss: 0.9039, test_f1: 0.5712
 epoch: 3, train_loss: 0.8949, test_loss: 0.9166, test_f1: 0.5420
 epoch: 4, train_loss: 0.8660, test_loss: 0.8512, test_f1: 0.5867
 epoch: 5, train_loss: 0.8463, test_loss: 0.8062, test_f1: 0.6146
 epoch: 6, train_loss: 0.8333, test_loss: 0.8249, test_f1: 0.6338
 epoch: 7, train_loss: 0.8092, test_loss: 0.8129, test_f1: 0.6128
 epoch: 8, train_loss: 0.7890, test_loss: 0.7956, test_f1: 0.6383
 epoch: 9, train_loss: 0.7670, test_loss: 0.8021, test_f1: 0.6685
 epoch: 10, train_loss: 0.7503, test_loss: 0.7753, test_f1: 0.6141
 epoch: 11, train_loss: 0.7287, test_loss: 0.8103, test_f1: 0.6342
 epoch: 12, train_loss: 0.7190, test_loss: 0.7459, test_f1: 0.6467
 epoch: 13, train_loss: 0.7161, test_loss: 0.7653, test_f1: 0.6583
 epoch: 14, train_loss: 0.7151, test_loss: 0.7485, test_f1: 0.6514
 epoch: 15, train_loss: 0.6763, test_loss: 0.8193, test_f1: 0.6284
 epoch: 16, train_loss: 0.6735, test_loss: 0.7575, test_f1: 0.6534
 epoch: 17, train_loss: 0.6431, test_loss: 0.8234, test_f1: 0.6252
 epoch: 18, train_loss: 0.6541, test_loss: 0.8149, test_f1: 0.6198
 epoch: 19, train_loss: 0.6121, test_loss: 0.8690, test_f1: 0.6090
 epoch: 20, train_loss: 0.6230, test_loss: 0.7318, test_f1: 0.6724
 epoch: 21, train_loss: 0.6200, test_loss: 0.7939, test_f1: 0.6555
 epoch: 22, train_loss: 0.5991, test_loss: 0.7894, test_f1: 0.6512
 epoch: 23, train_loss: 0.5795, test_loss: 0.8670, test_f1: 0.6350
 epoch: 24, train_loss: 0.5775, test_loss: 0.7721, test_f1: 0.6451
 epoch: 25, train_loss: 0.5732, test_loss: 0.7924, test_f1: 0.6782
 epoch: 26, train_loss: 0.5711, test_loss: 0.8209, test_f1: 0.6649
 epoch: 27, train_loss: 0.5689, test_loss: 0.7550, test_f1: 0.6685
 epoch: 28, train_loss: 0.5441, test_loss: 0.8643, test_f1: 0.6442
 epoch: 29, train_loss: 0.5437, test_loss: 0.9789, test_f1: 0.6527
 epoch: 30, train_loss: 0.5220, test_loss: 0.8816, test_f1: 0.6923
 epoch: 31, train_loss: 0.5123, test_loss: 0.9279, test_f1: 0.6845
 epoch: 32, train_loss: 0.5522, test_loss: 0.7885, test_f1: 0.6725
 epoch: 33, train_loss: 0.5122, test_loss: 0.7993, test_f1: 0.6841
 epoch: 34, train_loss: 0.4919, test_loss: 0.8855, test_f1: 0.6891
 epoch: 35, train_loss: 0.4910, test_loss: 0.9033, test_f1: 0.6891
 epoch: 36, train_loss: 0.4961, test_loss: 0.8549, test_f1: 0.6928
 epoch: 37, train_loss: 0.4686, test_loss: 0.9314, test_f1: 0.6625
 epoch: 38, train_loss: 0.4887, test_loss: 0.8533, test_f1: 0.6735
 epoch: 39, train_loss: 0.4857, test_loss: 0.8260, test_f1: 0.6602
 epoch: 40, train_loss: 0.4681, test_loss: 0.8601, test_f1: 0.6632
 epoch: 41, train_loss: 0.4587, test_loss: 0.9917, test_f1: 0.6595
 epoch: 42, train_loss: 0.4472, test_loss: 0.9597, test_f1: 0.6697
 epoch: 43, train_loss: 0.4634, test_loss: 0.8380, test_f1: 0.6817
 epoch: 44, train_loss: 0.4491, test_loss: 0.9748, test_f1: 0.6977
 epoch: 45, train_loss: 0.4408, test_loss: 0.9987, test_f1: 0.6471
 epoch: 46, train_loss: 0.4183, test_loss: 0.9296, test_f1: 0.6860
 epoch: 47, train_loss: 0.4073, test_loss: 0.9601, test_f1: 0.6874
 epoch: 48, train_loss: 0.4078, test_loss: 0.9161, test_f1: 0.6945
 epoch: 49, train_loss: 0.4047, test_loss: 1.0620, test_f1: 0.6825
 epoch: 50, train_loss: 0.3975, test_loss: 0.9678, test_f1: 0.6869
 epoch: 51, train_loss: 0.3782, test_loss: 1.0910, test_f1: 0.6952
 epoch: 52, train_loss: 0.3544, test_loss: 1.0555, test_f1: 0.6921
 epoch: 53, train_loss: 0.3309, test_loss: 1.1564, test_f1: 0.6939
 epoch: 54, train_loss: 0.3240, test_loss: 1.1222, test_f1: 0.7002
 epoch: 55, train_loss: 0.3404, test_loss: 1.1098, test_f1: 0.6997
 epoch: 56, train_loss: 0.3174, test_loss: 1.0913, test_f1: 0.6954
 epoch: 57, train_loss: 0.3043, test_loss: 1.1277, test_f1: 0.6951
 epoch: 58, train_loss: 0.3128, test_loss: 1.1731, test_f1: 0.7081
 epoch: 59, train_loss: 0.3173, test_loss: 1.0491, test_f1: 0.6787
 epoch: 60, train_loss: 0.3074, test_loss: 1.0915, test_f1: 0.7066
 epoch: 61, train_loss: 0.2914, test_loss: 1.1566, test_f1: 0.6932
 epoch: 62, train_loss: 0.3122, test_loss: 1.1670, test_f1: 0.6989
 epoch: 63, train_loss: 0.2850, test_loss: 1.1597, test_f1: 0.7105
 epoch: 64, train_loss: 0.2933, test_loss: 1.1789, test_f1: 0.6950
 epoch: 65, train_loss: 0.2813, test_loss: 1.2637, test_f1: 0.7003
 epoch: 66, train_loss: 0.2629, test_loss: 1.2359, test_f1: 0.7010
 epoch: 67, train_loss: 0.2842, test_loss: 1.3505, test_f1: 0.6665
 epoch: 68, train_loss: 0.2593, test_loss: 1.1979, test_f1: 0.6960
 epoch: 69, train_loss: 0.2743, test_loss: 1.2367, test_f1: 0.7111
 epoch: 70, train_loss: 0.2685, test_loss: 1.3199, test_f1: 0.6819
 epoch: 71, train_loss: 0.2667, test_loss: 1.1965, test_f1: 0.7090
 epoch: 72, train_loss: 0.2623, test_loss: 1.2596, test_f1: 0.6723
 epoch: 73, train_loss: 0.2599, test_loss: 1.2595, test_f1: 0.6951
 epoch: 74, train_loss: 0.2659, test_loss: 1.2057, test_f1: 0.7038
 epoch: 75, train_loss: 0.2378, test_loss: 1.3271, test_f1: 0.6873
 epoch: 76, train_loss: 0.2558, test_loss: 1.2701, test_f1: 0.6895
 epoch: 77, train_loss: 0.2559, test_loss: 1.3265, test_f1: 0.6858
 epoch: 78, train_loss: 0.2339, test_loss: 1.2565, test_f1: 0.7020
 epoch: 79, train_loss: 0.2478, test_loss: 1.3065, test_f1: 0.7076
 epoch: 80, train_loss: 0.2442, test_loss: 1.3286, test_f1: 0.6896
 epoch: 81, train_loss: 0.2423, test_loss: 1.4236, test_f1: 0.7087
 epoch: 82, train_loss: 0.2354, test_loss: 1.3641, test_f1: 0.6856
 epoch: 83, train_loss: 0.2550, test_loss: 1.4043, test_f1: 0.6820
 epoch: 84, train_loss: 0.2324, test_loss: 1.4019, test_f1: 0.6913
 epoch: 85, train_loss: 0.2198, test_loss: 1.3108, test_f1: 0.7102
 epoch: 86, train_loss: 0.2325, test_loss: 1.4499, test_f1: 0.6774
 epoch: 87, train_loss: 0.2207, test_loss: 1.5141, test_f1: 0.6901
 epoch: 88, train_loss: 0.2219, test_loss: 1.4340, test_f1: 0.7024
 epoch: 89, train_loss: 0.2119, test_loss: 1.4140, test_f1: 0.6824
 epoch: 90, train_loss: 0.2251, test_loss: 1.5071, test_f1: 0.6850
 epoch: 91, train_loss: 0.2328, test_loss: 1.4652, test_f1: 0.6924
 epoch: 92, train_loss: 0.2159, test_loss: 1.5911, test_f1: 0.6837
 epoch: 93, train_loss: 0.2129, test_loss: 1.5009, test_f1: 0.6713
 epoch: 94, train_loss: 0.2176, test_loss: 1.5335, test_f1: 0.6883
 epoch: 95, train_loss: 0.2151, test_loss: 1.6112, test_f1: 0.6957
 epoch: 96, train_loss: 0.2214, test_loss: 1.5695, test_f1: 0.6987
 epoch: 97, train_loss: 0.2021, test_loss: 1.5263, test_f1: 0.6935
 epoch: 98, train_loss: 0.2023, test_loss: 1.6248, test_f1: 0.6897
 epoch: 99, train_loss: 0.2151, test_loss: 1.4882, test_f1: 0.6818
##################ITERATION #8 ****************************************
 epoch: 0, train_loss: 1.3984, test_loss: 0.9976, test_f1: 0.4464
 epoch: 1, train_loss: 0.9725, test_loss: 0.8973, test_f1: 0.5093
 epoch: 2, train_loss: 0.9352, test_loss: 0.8809, test_f1: 0.5106
 epoch: 3, train_loss: 0.8905, test_loss: 0.8421, test_f1: 0.5644
 epoch: 4, train_loss: 0.8690, test_loss: 0.8282, test_f1: 0.6011
 epoch: 5, train_loss: 0.8479, test_loss: 0.8472, test_f1: 0.5837
 epoch: 6, train_loss: 0.8414, test_loss: 0.8081, test_f1: 0.5867
 epoch: 7, train_loss: 0.8182, test_loss: 0.8055, test_f1: 0.6010
 epoch: 8, train_loss: 0.8056, test_loss: 0.8201, test_f1: 0.6467
 epoch: 9, train_loss: 0.7809, test_loss: 0.8448, test_f1: 0.5937
 epoch: 10, train_loss: 0.7643, test_loss: 0.7906, test_f1: 0.6235
 epoch: 11, train_loss: 0.7531, test_loss: 0.8027, test_f1: 0.6489
 epoch: 12, train_loss: 0.7291, test_loss: 0.8312, test_f1: 0.6214
 epoch: 13, train_loss: 0.6997, test_loss: 0.7902, test_f1: 0.6389
 epoch: 14, train_loss: 0.7121, test_loss: 0.7373, test_f1: 0.6469
 epoch: 15, train_loss: 0.6925, test_loss: 0.8234, test_f1: 0.6092
 epoch: 16, train_loss: 0.6822, test_loss: 0.7671, test_f1: 0.6657
 epoch: 17, train_loss: 0.6646, test_loss: 0.7753, test_f1: 0.6601
 epoch: 18, train_loss: 0.6551, test_loss: 0.7792, test_f1: 0.6467
 epoch: 19, train_loss: 0.6469, test_loss: 0.8046, test_f1: 0.6361
 epoch: 20, train_loss: 0.6420, test_loss: 0.7535, test_f1: 0.6791
 epoch: 21, train_loss: 0.6272, test_loss: 0.7718, test_f1: 0.6589
 epoch: 22, train_loss: 0.6029, test_loss: 0.7715, test_f1: 0.6662
 epoch: 23, train_loss: 0.5978, test_loss: 0.8176, test_f1: 0.6856
 epoch: 24, train_loss: 0.5897, test_loss: 0.7881, test_f1: 0.6355
 epoch: 25, train_loss: 0.5916, test_loss: 0.8289, test_f1: 0.6848
 epoch: 26, train_loss: 0.5753, test_loss: 0.8294, test_f1: 0.6452
 epoch: 27, train_loss: 0.5562, test_loss: 0.7343, test_f1: 0.6488
 epoch: 28, train_loss: 0.5559, test_loss: 0.8167, test_f1: 0.6970
 epoch: 29, train_loss: 0.5317, test_loss: 0.7871, test_f1: 0.6760
 epoch: 30, train_loss: 0.5165, test_loss: 0.9019, test_f1: 0.6504
 epoch: 31, train_loss: 0.5126, test_loss: 0.8812, test_f1: 0.6548
 epoch: 32, train_loss: 0.5133, test_loss: 0.8006, test_f1: 0.6577
 epoch: 33, train_loss: 0.4853, test_loss: 0.7905, test_f1: 0.6771
 epoch: 34, train_loss: 0.4941, test_loss: 0.7995, test_f1: 0.6864
 epoch: 35, train_loss: 0.4765, test_loss: 0.8521, test_f1: 0.6860
 epoch: 36, train_loss: 0.4944, test_loss: 0.8828, test_f1: 0.6503
 epoch: 37, train_loss: 0.4851, test_loss: 0.8461, test_f1: 0.7020
 epoch: 38, train_loss: 0.4648, test_loss: 0.8520, test_f1: 0.6737
 epoch: 39, train_loss: 0.4481, test_loss: 0.9482, test_f1: 0.6634
 epoch: 40, train_loss: 0.4686, test_loss: 0.8535, test_f1: 0.7064
 epoch: 41, train_loss: 0.4514, test_loss: 0.8129, test_f1: 0.6674
 epoch: 42, train_loss: 0.4346, test_loss: 0.8113, test_f1: 0.6795
 epoch: 43, train_loss: 0.4298, test_loss: 1.0230, test_f1: 0.6802
 epoch: 44, train_loss: 0.4195, test_loss: 0.8928, test_f1: 0.6962
 epoch: 45, train_loss: 0.4107, test_loss: 0.9437, test_f1: 0.6718
 epoch: 46, train_loss: 0.4024, test_loss: 1.0086, test_f1: 0.6755
 epoch: 47, train_loss: 0.3871, test_loss: 1.0879, test_f1: 0.6546
 epoch: 48, train_loss: 0.3876, test_loss: 0.9508, test_f1: 0.6819
 epoch: 49, train_loss: 0.3900, test_loss: 1.0282, test_f1: 0.6664
 epoch: 50, train_loss: 0.3701, test_loss: 0.9756, test_f1: 0.6701
 epoch: 51, train_loss: 0.3436, test_loss: 1.0248, test_f1: 0.6820
 epoch: 52, train_loss: 0.3357, test_loss: 1.1304, test_f1: 0.6685
 epoch: 53, train_loss: 0.3084, test_loss: 1.0643, test_f1: 0.6783
 epoch: 54, train_loss: 0.2886, test_loss: 1.1470, test_f1: 0.6921
 epoch: 55, train_loss: 0.3034, test_loss: 1.1582, test_f1: 0.6706
 epoch: 56, train_loss: 0.2782, test_loss: 1.2100, test_f1: 0.6713
 epoch: 57, train_loss: 0.3077, test_loss: 1.1653, test_f1: 0.6838
 epoch: 58, train_loss: 0.2715, test_loss: 1.1865, test_f1: 0.6706
 epoch: 59, train_loss: 0.2759, test_loss: 1.1784, test_f1: 0.7021
 epoch: 60, train_loss: 0.2966, test_loss: 1.1726, test_f1: 0.6782
 epoch: 61, train_loss: 0.2767, test_loss: 1.3163, test_f1: 0.6853
 epoch: 62, train_loss: 0.2758, test_loss: 1.2210, test_f1: 0.6834
 epoch: 63, train_loss: 0.2753, test_loss: 1.2472, test_f1: 0.6672
 epoch: 64, train_loss: 0.2756, test_loss: 1.1626, test_f1: 0.6602
 epoch: 65, train_loss: 0.2668, test_loss: 1.1810, test_f1: 0.6710
 epoch: 66, train_loss: 0.2537, test_loss: 1.2165, test_f1: 0.6795
 epoch: 67, train_loss: 0.2715, test_loss: 1.3100, test_f1: 0.6722
 epoch: 68, train_loss: 0.2521, test_loss: 1.2721, test_f1: 0.6827
 epoch: 69, train_loss: 0.2674, test_loss: 1.2434, test_f1: 0.6747
 epoch: 70, train_loss: 0.2372, test_loss: 1.3245, test_f1: 0.6891
 epoch: 71, train_loss: 0.2348, test_loss: 1.3578, test_f1: 0.6683
 epoch: 72, train_loss: 0.2665, test_loss: 1.3908, test_f1: 0.6745
 epoch: 73, train_loss: 0.2488, test_loss: 1.3380, test_f1: 0.6720
 epoch: 74, train_loss: 0.2325, test_loss: 1.3015, test_f1: 0.6755
 epoch: 75, train_loss: 0.2444, test_loss: 1.3030, test_f1: 0.6758
 epoch: 76, train_loss: 0.2125, test_loss: 1.3465, test_f1: 0.6900
 epoch: 77, train_loss: 0.2313, test_loss: 1.3766, test_f1: 0.6959
 epoch: 78, train_loss: 0.2485, test_loss: 1.3620, test_f1: 0.6934
 epoch: 79, train_loss: 0.2144, test_loss: 1.4531, test_f1: 0.6897
 epoch: 80, train_loss: 0.2073, test_loss: 1.4889, test_f1: 0.6865
 epoch: 81, train_loss: 0.2127, test_loss: 1.5569, test_f1: 0.6671
 epoch: 82, train_loss: 0.2184, test_loss: 1.4606, test_f1: 0.7002
 epoch: 83, train_loss: 0.2166, test_loss: 1.4210, test_f1: 0.6942
 epoch: 84, train_loss: 0.2330, test_loss: 1.3510, test_f1: 0.7005
 epoch: 85, train_loss: 0.2274, test_loss: 1.4754, test_f1: 0.6760
 epoch: 86, train_loss: 0.2093, test_loss: 1.5334, test_f1: 0.6969
 epoch: 87, train_loss: 0.2044, test_loss: 1.4940, test_f1: 0.6848
 epoch: 88, train_loss: 0.2011, test_loss: 1.5501, test_f1: 0.6881
 epoch: 89, train_loss: 0.2063, test_loss: 1.5656, test_f1: 0.6891
 epoch: 90, train_loss: 0.1967, test_loss: 1.5259, test_f1: 0.6760
 epoch: 91, train_loss: 0.1910, test_loss: 1.6896, test_f1: 0.6795
 epoch: 92, train_loss: 0.2074, test_loss: 1.5856, test_f1: 0.6749
 epoch: 93, train_loss: 0.1940, test_loss: 1.4682, test_f1: 0.6905
 epoch: 94, train_loss: 0.1931, test_loss: 1.6841, test_f1: 0.6844
 epoch: 95, train_loss: 0.2117, test_loss: 1.5915, test_f1: 0.7054
 epoch: 96, train_loss: 0.1891, test_loss: 1.5176, test_f1: 0.6947
 epoch: 97, train_loss: 0.1960, test_loss: 1.4983, test_f1: 0.6995
 epoch: 98, train_loss: 0.1794, test_loss: 1.5854, test_f1: 0.6874
 epoch: 99, train_loss: 0.1824, test_loss: 1.6017, test_f1: 0.6908
##################ITERATION #9 ****************************************
 epoch: 0, train_loss: 1.3512, test_loss: 0.9985, test_f1: 0.4404
 epoch: 1, train_loss: 0.9813, test_loss: 0.9195, test_f1: 0.5260
 epoch: 2, train_loss: 0.9425, test_loss: 0.8939, test_f1: 0.5568
 epoch: 3, train_loss: 0.9151, test_loss: 0.8523, test_f1: 0.5584
 epoch: 4, train_loss: 0.8752, test_loss: 0.8608, test_f1: 0.5935
 epoch: 5, train_loss: 0.8631, test_loss: 0.8068, test_f1: 0.6061
 epoch: 6, train_loss: 0.8426, test_loss: 0.8450, test_f1: 0.6003
 epoch: 7, train_loss: 0.8237, test_loss: 0.8010, test_f1: 0.5869
 epoch: 8, train_loss: 0.7853, test_loss: 0.7821, test_f1: 0.6230
 epoch: 9, train_loss: 0.7684, test_loss: 0.7866, test_f1: 0.6006
 epoch: 10, train_loss: 0.7622, test_loss: 0.7798, test_f1: 0.6267
 epoch: 11, train_loss: 0.7491, test_loss: 0.7316, test_f1: 0.6378
 epoch: 12, train_loss: 0.7227, test_loss: 0.7919, test_f1: 0.6531
 epoch: 13, train_loss: 0.7006, test_loss: 0.7905, test_f1: 0.6062
 epoch: 14, train_loss: 0.6980, test_loss: 0.7105, test_f1: 0.6631
 epoch: 15, train_loss: 0.7009, test_loss: 0.7610, test_f1: 0.6406
 epoch: 16, train_loss: 0.6701, test_loss: 0.7299, test_f1: 0.6433
 epoch: 17, train_loss: 0.6710, test_loss: 0.7334, test_f1: 0.6746
 epoch: 18, train_loss: 0.6253, test_loss: 0.7853, test_f1: 0.6335
 epoch: 19, train_loss: 0.6275, test_loss: 0.7487, test_f1: 0.6691
 epoch: 20, train_loss: 0.6156, test_loss: 0.7775, test_f1: 0.6758
 epoch: 21, train_loss: 0.6079, test_loss: 0.7787, test_f1: 0.6640
 epoch: 22, train_loss: 0.6079, test_loss: 0.7311, test_f1: 0.6438
 epoch: 23, train_loss: 0.5909, test_loss: 0.7094, test_f1: 0.6686
 epoch: 24, train_loss: 0.5760, test_loss: 0.7860, test_f1: 0.6844
 epoch: 25, train_loss: 0.5810, test_loss: 0.7345, test_f1: 0.6746
 epoch: 26, train_loss: 0.5493, test_loss: 0.7377, test_f1: 0.6746
 epoch: 27, train_loss: 0.5395, test_loss: 0.8136, test_f1: 0.6637
 epoch: 28, train_loss: 0.5688, test_loss: 0.8388, test_f1: 0.6762
 epoch: 29, train_loss: 0.5322, test_loss: 0.8227, test_f1: 0.6508
 epoch: 30, train_loss: 0.5194, test_loss: 0.8762, test_f1: 0.6553
 epoch: 31, train_loss: 0.5010, test_loss: 0.8423, test_f1: 0.6574
 epoch: 32, train_loss: 0.4860, test_loss: 0.8161, test_f1: 0.6592
 epoch: 33, train_loss: 0.4763, test_loss: 0.8797, test_f1: 0.6408
 epoch: 34, train_loss: 0.4855, test_loss: 0.9206, test_f1: 0.6343
 epoch: 35, train_loss: 0.5066, test_loss: 0.8251, test_f1: 0.6579
 epoch: 36, train_loss: 0.4849, test_loss: 0.8338, test_f1: 0.6742
 epoch: 37, train_loss: 0.4603, test_loss: 0.8511, test_f1: 0.6526
 epoch: 38, train_loss: 0.4639, test_loss: 0.8482, test_f1: 0.6536
 epoch: 39, train_loss: 0.4604, test_loss: 0.9230, test_f1: 0.6698
 epoch: 40, train_loss: 0.4362, test_loss: 0.8482, test_f1: 0.6590
 epoch: 41, train_loss: 0.4396, test_loss: 0.9283, test_f1: 0.6633
 epoch: 42, train_loss: 0.4239, test_loss: 0.8904, test_f1: 0.6870
 epoch: 43, train_loss: 0.4260, test_loss: 0.9201, test_f1: 0.6483
 epoch: 44, train_loss: 0.4131, test_loss: 0.9051, test_f1: 0.6605
 epoch: 45, train_loss: 0.3881, test_loss: 0.9240, test_f1: 0.6674
 epoch: 46, train_loss: 0.4043, test_loss: 1.0187, test_f1: 0.6570
 epoch: 47, train_loss: 0.4101, test_loss: 0.8799, test_f1: 0.6643
 epoch: 48, train_loss: 0.3726, test_loss: 0.9450, test_f1: 0.6717
 epoch: 49, train_loss: 0.3783, test_loss: 0.9764, test_f1: 0.6727
 epoch: 50, train_loss: 0.3854, test_loss: 0.9505, test_f1: 0.6553
 epoch: 51, train_loss: 0.3460, test_loss: 1.0028, test_f1: 0.6746
 epoch: 52, train_loss: 0.3208, test_loss: 1.0482, test_f1: 0.6652
 epoch: 53, train_loss: 0.3137, test_loss: 0.9370, test_f1: 0.6962
 epoch: 54, train_loss: 0.3058, test_loss: 0.9549, test_f1: 0.6728
 epoch: 55, train_loss: 0.2921, test_loss: 1.0494, test_f1: 0.6712
 epoch: 56, train_loss: 0.3038, test_loss: 1.0693, test_f1: 0.6611
 epoch: 57, train_loss: 0.2888, test_loss: 1.0771, test_f1: 0.6494
 epoch: 58, train_loss: 0.2755, test_loss: 1.1173, test_f1: 0.6607
 epoch: 59, train_loss: 0.2700, test_loss: 1.0965, test_f1: 0.6567
 epoch: 60, train_loss: 0.2776, test_loss: 1.1923, test_f1: 0.6541
 epoch: 61, train_loss: 0.2848, test_loss: 1.1948, test_f1: 0.6661
 epoch: 62, train_loss: 0.2627, test_loss: 1.1279, test_f1: 0.6794
 epoch: 63, train_loss: 0.2934, test_loss: 1.1088, test_f1: 0.6777
 epoch: 64, train_loss: 0.2734, test_loss: 1.2421, test_f1: 0.6658
 epoch: 65, train_loss: 0.2657, test_loss: 1.2506, test_f1: 0.6620
 epoch: 66, train_loss: 0.2552, test_loss: 1.2329, test_f1: 0.6609
 epoch: 67, train_loss: 0.2334, test_loss: 1.2387, test_f1: 0.6716
 epoch: 68, train_loss: 0.2552, test_loss: 1.3391, test_f1: 0.6547
 epoch: 69, train_loss: 0.2514, test_loss: 1.2239, test_f1: 0.6647
 epoch: 70, train_loss: 0.2533, test_loss: 1.2217, test_f1: 0.6779
 epoch: 71, train_loss: 0.2295, test_loss: 1.2659, test_f1: 0.6714
 epoch: 72, train_loss: 0.2447, test_loss: 1.2852, test_f1: 0.6560
 epoch: 73, train_loss: 0.2361, test_loss: 1.3420, test_f1: 0.6671
 epoch: 74, train_loss: 0.2267, test_loss: 1.1546, test_f1: 0.6804
 epoch: 75, train_loss: 0.2479, test_loss: 1.1910, test_f1: 0.6770
 epoch: 76, train_loss: 0.2356, test_loss: 1.2489, test_f1: 0.6744
 epoch: 77, train_loss: 0.2327, test_loss: 1.2843, test_f1: 0.6639
 epoch: 78, train_loss: 0.2485, test_loss: 1.2794, test_f1: 0.6400
 epoch: 79, train_loss: 0.2054, test_loss: 1.3467, test_f1: 0.6660
 epoch: 80, train_loss: 0.2445, test_loss: 1.3227, test_f1: 0.6626
 epoch: 81, train_loss: 0.2304, test_loss: 1.4421, test_f1: 0.6566
 epoch: 82, train_loss: 0.2295, test_loss: 1.3845, test_f1: 0.6520
 epoch: 83, train_loss: 0.2388, test_loss: 1.3334, test_f1: 0.6680
 epoch: 84, train_loss: 0.2044, test_loss: 1.4481, test_f1: 0.6719
 epoch: 85, train_loss: 0.1991, test_loss: 1.3478, test_f1: 0.6809
 epoch: 86, train_loss: 0.2086, test_loss: 1.4691, test_f1: 0.6729
 epoch: 87, train_loss: 0.2049, test_loss: 1.4387, test_f1: 0.6713
 epoch: 88, train_loss: 0.2045, test_loss: 1.3657, test_f1: 0.6680
 epoch: 89, train_loss: 0.1867, test_loss: 1.3729, test_f1: 0.6753
 epoch: 90, train_loss: 0.1974, test_loss: 1.3507, test_f1: 0.6774
 epoch: 91, train_loss: 0.2032, test_loss: 1.4521, test_f1: 0.6634
 epoch: 92, train_loss: 0.1949, test_loss: 1.4225, test_f1: 0.6693
 epoch: 93, train_loss: 0.2121, test_loss: 1.4301, test_f1: 0.6767
 epoch: 94, train_loss: 0.1777, test_loss: 1.3486, test_f1: 0.6773
 epoch: 95, train_loss: 0.2074, test_loss: 1.3652, test_f1: 0.6693
 epoch: 96, train_loss: 0.1917, test_loss: 1.3756, test_f1: 0.6711
 epoch: 97, train_loss: 0.2095, test_loss: 1.2980, test_f1: 0.6801
 epoch: 98, train_loss: 0.1929, test_loss: 1.5261, test_f1: 0.6661
 epoch: 99, train_loss: 0.1913, test_loss: 1.5055, test_f1: 0.6574

Training completed in 600.08 seconds
Best F1: 0.7194 at epoch 42
Mean F1 across iterations: 0.7058  0.0098
========================FINAL RESULTS================================
FEGIN weighted F1: 0.7194  0.0098
python main.py --data ltspice_examples --representation component_pin_net --model FEGIN --layers 2 --hiddens 128 --batch_size 64 --lr 0.001 --emb_size 128 --epochs 100 --save_appendix component_pin_net_L2_H128_BS64_LR0.001_E128 --no_val
-----



STDERR:
  File "main.py", line 370, in <module>
    main()
  File "main.py", line 254, in main
    dataset = dataset_class(
  File "/home/philip/projects/ltspice_examples_code_repo/Circuit-Completion-Using-GNNs/component_classification_with_link_prediction_head/evaluation/FEGIN/kernel/circuit_datasets.py", line 15, in __init__
    self.data, self.slices = torch.load(self.processed_paths[0])
  File "/home/philip/.local/lib/python3.8/site-packages/torch/serialization.py", line 1040, in load
    warnings.warn(
  File "/usr/lib/python3.8/warnings.py", line 109, in _showwarnmsg
    sw(msg.message, msg.category, msg.filename, msg.lineno,
  File "main.py", line 47, in warn_with_traceback
    traceback.print_stack(file=log)
/home/philip/projects/ltspice_examples_code_repo/Circuit-Completion-Using-GNNs/component_classification_with_link_prediction_head/evaluation/FEGIN/kernel/circuit_datasets.py:15: FutureWarning: You are using `torch.load` with `weights_only=False` (the current default value), which uses the default pickle module implicitly. It is possible to construct malicious pickle data which will execute arbitrary code during unpickling (See https://github.com/pytorch/pytorch/blob/main/SECURITY.md#untrusted-models for more details). In a future release, the default value for `weights_only` will be flipped to `True`. This limits the functions that could be executed during unpickling. Arbitrary objects will no longer be allowed to be loaded via this mode unless they are explicitly allowlisted by the user via `torch.serialization.add_safe_globals`. We recommend you start setting `weights_only=True` for any use case where you don't have full control of the loaded file. Please open an issue on GitHub for any issues related to this experimental feature.
  self.data, self.slices = torch.load(self.processed_paths[0])
