STDOUT:
Results will be saved in /home/philip/projects/ltspice_examples_code_repo/Circuit-Completion-Using-GNNs/component_classification_with_link_prediction_head/evaluation/FEGIN/results/model_FEGIN_dataset_ltspice_examples
Command line input: python main.py --data ltspice_examples --representation component_pin_net --model FEGIN --layers 2 --hiddens 128 --batch_size 64 --lr 0.001 --emb_size 128 --epochs 100 --save_appendix component_pin_net_L2_H128_BS64_LR0.001_E128 --no_val
 is saved.
-----
ltspice_examples - FEGIN
Using 2 layers, 128 hidden units, h = 2
Loading component_pin_net representation dataset
ENTERED
Training FEGIN on component_pin_net representation
Train: 3558, Test: 846
##################ITERATION #0 ****************************************
 epoch: 0, train_loss: 1.1335, test_loss: 1.0381, test_f1: 0.3858
 epoch: 1, train_loss: 0.9890, test_loss: 0.9418, test_f1: 0.5035
 epoch: 2, train_loss: 0.9510, test_loss: 0.9556, test_f1: 0.5166
 epoch: 3, train_loss: 0.9243, test_loss: 0.9229, test_f1: 0.5075
 epoch: 4, train_loss: 0.9044, test_loss: 0.8674, test_f1: 0.5400
 epoch: 5, train_loss: 0.8807, test_loss: 0.8938, test_f1: 0.5199
 epoch: 6, train_loss: 0.8619, test_loss: 0.8301, test_f1: 0.5430
 epoch: 7, train_loss: 0.8294, test_loss: 0.9139, test_f1: 0.5356
 epoch: 8, train_loss: 0.8175, test_loss: 0.8778, test_f1: 0.5397
 epoch: 9, train_loss: 0.7919, test_loss: 0.7751, test_f1: 0.6038
 epoch: 10, train_loss: 0.7725, test_loss: 0.8808, test_f1: 0.5946
 epoch: 11, train_loss: 0.7647, test_loss: 0.8496, test_f1: 0.6352
 epoch: 12, train_loss: 0.7473, test_loss: 0.8247, test_f1: 0.5949
 epoch: 13, train_loss: 0.7227, test_loss: 0.7926, test_f1: 0.6103
 epoch: 14, train_loss: 0.7135, test_loss: 0.8209, test_f1: 0.6225
 epoch: 15, train_loss: 0.7000, test_loss: 0.7196, test_f1: 0.6354
 epoch: 16, train_loss: 0.6834, test_loss: 0.7663, test_f1: 0.6145
 epoch: 17, train_loss: 0.6713, test_loss: 0.8091, test_f1: 0.6682
 epoch: 18, train_loss: 0.6598, test_loss: 0.7877, test_f1: 0.6513
 epoch: 19, train_loss: 0.6387, test_loss: 0.7468, test_f1: 0.6431
 epoch: 20, train_loss: 0.6219, test_loss: 0.8404, test_f1: 0.6453
 epoch: 21, train_loss: 0.6025, test_loss: 0.7351, test_f1: 0.6622
 epoch: 22, train_loss: 0.6068, test_loss: 0.8478, test_f1: 0.6558
 epoch: 23, train_loss: 0.5891, test_loss: 0.8121, test_f1: 0.6485
 epoch: 24, train_loss: 0.5656, test_loss: 0.8083, test_f1: 0.6758
 epoch: 25, train_loss: 0.5729, test_loss: 0.8021, test_f1: 0.6538
 epoch: 26, train_loss: 0.5613, test_loss: 0.8465, test_f1: 0.6770
 epoch: 27, train_loss: 0.5484, test_loss: 0.7383, test_f1: 0.6595
 epoch: 28, train_loss: 0.5375, test_loss: 0.8972, test_f1: 0.6440
 epoch: 29, train_loss: 0.5384, test_loss: 0.8343, test_f1: 0.6625
 epoch: 30, train_loss: 0.5003, test_loss: 0.8941, test_f1: 0.6613
 epoch: 31, train_loss: 0.5189, test_loss: 0.8667, test_f1: 0.6477
 epoch: 32, train_loss: 0.5013, test_loss: 0.9115, test_f1: 0.6646
 epoch: 33, train_loss: 0.4851, test_loss: 0.8251, test_f1: 0.6571
 epoch: 34, train_loss: 0.5117, test_loss: 0.8051, test_f1: 0.6725
 epoch: 35, train_loss: 0.4710, test_loss: 0.8368, test_f1: 0.6827
 epoch: 36, train_loss: 0.4778, test_loss: 0.9172, test_f1: 0.6660
 epoch: 37, train_loss: 0.4532, test_loss: 0.9233, test_f1: 0.6976
 epoch: 38, train_loss: 0.4435, test_loss: 0.8792, test_f1: 0.6650
 epoch: 39, train_loss: 0.4198, test_loss: 1.0154, test_f1: 0.6593
 epoch: 40, train_loss: 0.4467, test_loss: 0.9783, test_f1: 0.6785
 epoch: 41, train_loss: 0.4317, test_loss: 0.9624, test_f1: 0.6918
 epoch: 42, train_loss: 0.4359, test_loss: 1.1230, test_f1: 0.6402
 epoch: 43, train_loss: 0.4089, test_loss: 1.0226, test_f1: 0.6642
 epoch: 44, train_loss: 0.4174, test_loss: 0.9141, test_f1: 0.6792
 epoch: 45, train_loss: 0.4131, test_loss: 1.2443, test_f1: 0.6452
 epoch: 46, train_loss: 0.3848, test_loss: 1.0133, test_f1: 0.6824
 epoch: 47, train_loss: 0.3911, test_loss: 1.0050, test_f1: 0.6874
 epoch: 48, train_loss: 0.3691, test_loss: 0.9499, test_f1: 0.7026
 epoch: 49, train_loss: 0.3726, test_loss: 1.1264, test_f1: 0.6602
 epoch: 50, train_loss: 0.3766, test_loss: 1.0429, test_f1: 0.6769
 epoch: 51, train_loss: 0.3349, test_loss: 1.0708, test_f1: 0.6909
 epoch: 52, train_loss: 0.3190, test_loss: 1.1111, test_f1: 0.6992
 epoch: 53, train_loss: 0.3047, test_loss: 1.1378, test_f1: 0.6753
 epoch: 54, train_loss: 0.2776, test_loss: 1.1636, test_f1: 0.7129
 epoch: 55, train_loss: 0.2928, test_loss: 1.1926, test_f1: 0.6843
 epoch: 56, train_loss: 0.2877, test_loss: 1.2310, test_f1: 0.6787
 epoch: 57, train_loss: 0.2759, test_loss: 1.2586, test_f1: 0.6861
 epoch: 58, train_loss: 0.2685, test_loss: 1.3321, test_f1: 0.6737
 epoch: 59, train_loss: 0.2662, test_loss: 1.2353, test_f1: 0.6848
 epoch: 60, train_loss: 0.3000, test_loss: 1.2791, test_f1: 0.6785
 epoch: 61, train_loss: 0.2782, test_loss: 1.2492, test_f1: 0.6891
 epoch: 62, train_loss: 0.2723, test_loss: 1.3137, test_f1: 0.6687
 epoch: 63, train_loss: 0.2748, test_loss: 1.2329, test_f1: 0.7003
 epoch: 64, train_loss: 0.2594, test_loss: 1.2538, test_f1: 0.6985
 epoch: 65, train_loss: 0.2573, test_loss: 1.3729, test_f1: 0.6886
 epoch: 66, train_loss: 0.2654, test_loss: 1.3886, test_f1: 0.6858
 epoch: 67, train_loss: 0.2599, test_loss: 1.3268, test_f1: 0.6910
 epoch: 68, train_loss: 0.2622, test_loss: 1.4342, test_f1: 0.6942
 epoch: 69, train_loss: 0.2505, test_loss: 1.3774, test_f1: 0.6951
 epoch: 70, train_loss: 0.2593, test_loss: 1.3756, test_f1: 0.6706
 epoch: 71, train_loss: 0.2528, test_loss: 1.4518, test_f1: 0.6777
 epoch: 72, train_loss: 0.2463, test_loss: 1.5315, test_f1: 0.6804
 epoch: 73, train_loss: 0.2305, test_loss: 1.4482, test_f1: 0.6879
 epoch: 74, train_loss: 0.2374, test_loss: 1.4942, test_f1: 0.6707
 epoch: 75, train_loss: 0.2367, test_loss: 1.5447, test_f1: 0.6820
 epoch: 76, train_loss: 0.2256, test_loss: 1.5112, test_f1: 0.6877
 epoch: 77, train_loss: 0.2369, test_loss: 1.5705, test_f1: 0.6725
 epoch: 78, train_loss: 0.2247, test_loss: 1.3950, test_f1: 0.7009
 epoch: 79, train_loss: 0.2223, test_loss: 1.6382, test_f1: 0.6959
 epoch: 80, train_loss: 0.2009, test_loss: 1.6298, test_f1: 0.6821
 epoch: 81, train_loss: 0.1995, test_loss: 1.6413, test_f1: 0.6849
 epoch: 82, train_loss: 0.2251, test_loss: 1.6102, test_f1: 0.6849
 epoch: 83, train_loss: 0.2209, test_loss: 1.5584, test_f1: 0.6874
 epoch: 84, train_loss: 0.2108, test_loss: 1.6922, test_f1: 0.6729
 epoch: 85, train_loss: 0.2004, test_loss: 1.6390, test_f1: 0.6997
 epoch: 86, train_loss: 0.2100, test_loss: 1.5669, test_f1: 0.7028
 epoch: 87, train_loss: 0.2170, test_loss: 1.7216, test_f1: 0.6655
 epoch: 88, train_loss: 0.2080, test_loss: 1.6287, test_f1: 0.6767
 epoch: 89, train_loss: 0.1778, test_loss: 1.6819, test_f1: 0.6944
 epoch: 90, train_loss: 0.1928, test_loss: 1.7501, test_f1: 0.6891
 epoch: 91, train_loss: 0.1930, test_loss: 1.6124, test_f1: 0.6767
 epoch: 92, train_loss: 0.1859, test_loss: 1.7250, test_f1: 0.6950
 epoch: 93, train_loss: 0.1880, test_loss: 1.8007, test_f1: 0.6646
 epoch: 94, train_loss: 0.1887, test_loss: 1.8003, test_f1: 0.6572
 epoch: 95, train_loss: 0.1784, test_loss: 1.7451, test_f1: 0.6778
 epoch: 96, train_loss: 0.1740, test_loss: 1.8379, test_f1: 0.6609
 epoch: 97, train_loss: 0.1895, test_loss: 1.8365, test_f1: 0.6695
 epoch: 98, train_loss: 0.1732, test_loss: 1.7521, test_f1: 0.6745
 epoch: 99, train_loss: 0.1676, test_loss: 1.7387, test_f1: 0.6755
##################ITERATION #1 ****************************************
 epoch: 0, train_loss: 1.0499, test_loss: 0.9942, test_f1: 0.4726
 epoch: 1, train_loss: 0.9468, test_loss: 0.8925, test_f1: 0.5012
 epoch: 2, train_loss: 0.8961, test_loss: 0.8986, test_f1: 0.5464
 epoch: 3, train_loss: 0.8790, test_loss: 0.8244, test_f1: 0.6123
 epoch: 4, train_loss: 0.8534, test_loss: 0.8554, test_f1: 0.5446
 epoch: 5, train_loss: 0.8349, test_loss: 0.9131, test_f1: 0.5378
 epoch: 6, train_loss: 0.7964, test_loss: 0.8303, test_f1: 0.5750
 epoch: 7, train_loss: 0.7771, test_loss: 0.7998, test_f1: 0.6169
 epoch: 8, train_loss: 0.7697, test_loss: 0.7308, test_f1: 0.6517
 epoch: 9, train_loss: 0.7372, test_loss: 0.7736, test_f1: 0.6467
 epoch: 10, train_loss: 0.7250, test_loss: 0.7762, test_f1: 0.6458
 epoch: 11, train_loss: 0.6978, test_loss: 0.7682, test_f1: 0.6403
 epoch: 12, train_loss: 0.6914, test_loss: 0.7372, test_f1: 0.6482
 epoch: 13, train_loss: 0.6930, test_loss: 0.7437, test_f1: 0.6530
 epoch: 14, train_loss: 0.6703, test_loss: 0.7378, test_f1: 0.6637
 epoch: 15, train_loss: 0.6391, test_loss: 0.8187, test_f1: 0.6389
 epoch: 16, train_loss: 0.6283, test_loss: 0.7378, test_f1: 0.6763
 epoch: 17, train_loss: 0.6319, test_loss: 0.7867, test_f1: 0.6472
 epoch: 18, train_loss: 0.6153, test_loss: 0.9007, test_f1: 0.6410
 epoch: 19, train_loss: 0.5998, test_loss: 0.8208, test_f1: 0.6674
 epoch: 20, train_loss: 0.5976, test_loss: 0.9370, test_f1: 0.5999
 epoch: 21, train_loss: 0.5766, test_loss: 0.8618, test_f1: 0.6690
 epoch: 22, train_loss: 0.5754, test_loss: 0.8655, test_f1: 0.6727
 epoch: 23, train_loss: 0.5532, test_loss: 0.8485, test_f1: 0.6530
 epoch: 24, train_loss: 0.5272, test_loss: 0.8808, test_f1: 0.6499
 epoch: 25, train_loss: 0.5356, test_loss: 0.9668, test_f1: 0.6282
 epoch: 26, train_loss: 0.5200, test_loss: 0.9156, test_f1: 0.6459
 epoch: 27, train_loss: 0.5104, test_loss: 1.0112, test_f1: 0.6739
 epoch: 28, train_loss: 0.5046, test_loss: 0.9086, test_f1: 0.6801
 epoch: 29, train_loss: 0.4909, test_loss: 0.9615, test_f1: 0.6697
 epoch: 30, train_loss: 0.4990, test_loss: 1.0861, test_f1: 0.6345
 epoch: 31, train_loss: 0.4765, test_loss: 0.9270, test_f1: 0.6930
 epoch: 32, train_loss: 0.4601, test_loss: 0.9570, test_f1: 0.6740
 epoch: 33, train_loss: 0.4760, test_loss: 0.9435, test_f1: 0.6865
 epoch: 34, train_loss: 0.4598, test_loss: 1.0680, test_f1: 0.6668
 epoch: 35, train_loss: 0.4489, test_loss: 1.0963, test_f1: 0.6518
 epoch: 36, train_loss: 0.4223, test_loss: 1.0322, test_f1: 0.6773
 epoch: 37, train_loss: 0.4266, test_loss: 1.0733, test_f1: 0.6784
 epoch: 38, train_loss: 0.4382, test_loss: 1.0393, test_f1: 0.6484
 epoch: 39, train_loss: 0.4164, test_loss: 1.0411, test_f1: 0.6967
 epoch: 40, train_loss: 0.4055, test_loss: 1.0525, test_f1: 0.6612
 epoch: 41, train_loss: 0.4154, test_loss: 1.1456, test_f1: 0.6772
 epoch: 42, train_loss: 0.4081, test_loss: 1.1048, test_f1: 0.6629
 epoch: 43, train_loss: 0.3969, test_loss: 1.1211, test_f1: 0.6674
 epoch: 44, train_loss: 0.4045, test_loss: 1.1681, test_f1: 0.6662
 epoch: 45, train_loss: 0.3740, test_loss: 1.1847, test_f1: 0.6758
 epoch: 46, train_loss: 0.3574, test_loss: 1.2056, test_f1: 0.6878
 epoch: 47, train_loss: 0.3551, test_loss: 1.1806, test_f1: 0.6744
 epoch: 48, train_loss: 0.3709, test_loss: 1.2949, test_f1: 0.6608
 epoch: 49, train_loss: 0.3722, test_loss: 1.2522, test_f1: 0.6719
 epoch: 50, train_loss: 0.3315, test_loss: 1.3555, test_f1: 0.6760
 epoch: 51, train_loss: 0.3194, test_loss: 1.3296, test_f1: 0.6746
 epoch: 52, train_loss: 0.2974, test_loss: 1.2717, test_f1: 0.6913
 epoch: 53, train_loss: 0.2865, test_loss: 1.3527, test_f1: 0.6823
 epoch: 54, train_loss: 0.2680, test_loss: 1.4115, test_f1: 0.6903
 epoch: 55, train_loss: 0.2759, test_loss: 1.4578, test_f1: 0.6846
 epoch: 56, train_loss: 0.2581, test_loss: 1.4862, test_f1: 0.6972
 epoch: 57, train_loss: 0.2638, test_loss: 1.5768, test_f1: 0.6778
 epoch: 58, train_loss: 0.2560, test_loss: 1.7113, test_f1: 0.6586
 epoch: 59, train_loss: 0.2628, test_loss: 1.4899, test_f1: 0.6880
 epoch: 60, train_loss: 0.2454, test_loss: 1.5285, test_f1: 0.6844
 epoch: 61, train_loss: 0.2367, test_loss: 1.5183, test_f1: 0.6870
 epoch: 62, train_loss: 0.2414, test_loss: 1.6093, test_f1: 0.6905
 epoch: 63, train_loss: 0.2305, test_loss: 1.6291, test_f1: 0.6868
 epoch: 64, train_loss: 0.2532, test_loss: 1.6499, test_f1: 0.6679
 epoch: 65, train_loss: 0.2499, test_loss: 1.6817, test_f1: 0.6725
 epoch: 66, train_loss: 0.2479, test_loss: 1.5939, test_f1: 0.6792
 epoch: 67, train_loss: 0.2350, test_loss: 1.5756, test_f1: 0.6817
 epoch: 68, train_loss: 0.2183, test_loss: 1.7113, test_f1: 0.6925
 epoch: 69, train_loss: 0.2444, test_loss: 1.7107, test_f1: 0.6830
 epoch: 70, train_loss: 0.2361, test_loss: 1.6125, test_f1: 0.6954
 epoch: 71, train_loss: 0.2361, test_loss: 1.6162, test_f1: 0.6686
 epoch: 72, train_loss: 0.2279, test_loss: 1.5511, test_f1: 0.6818
 epoch: 73, train_loss: 0.2197, test_loss: 1.6551, test_f1: 0.6828
 epoch: 74, train_loss: 0.2149, test_loss: 1.7424, test_f1: 0.6856
 epoch: 75, train_loss: 0.2326, test_loss: 1.6990, test_f1: 0.6874
 epoch: 76, train_loss: 0.2129, test_loss: 1.7212, test_f1: 0.6847
 epoch: 77, train_loss: 0.1868, test_loss: 1.7215, test_f1: 0.6890
 epoch: 78, train_loss: 0.2106, test_loss: 1.8214, test_f1: 0.6822
 epoch: 79, train_loss: 0.2135, test_loss: 1.8467, test_f1: 0.6857
 epoch: 80, train_loss: 0.1995, test_loss: 1.6690, test_f1: 0.6832
 epoch: 81, train_loss: 0.2070, test_loss: 1.7794, test_f1: 0.6812
 epoch: 82, train_loss: 0.1901, test_loss: 1.8011, test_f1: 0.7029
 epoch: 83, train_loss: 0.2012, test_loss: 1.9424, test_f1: 0.6723
 epoch: 84, train_loss: 0.1913, test_loss: 1.8743, test_f1: 0.6851
 epoch: 85, train_loss: 0.1892, test_loss: 1.8646, test_f1: 0.6796
 epoch: 86, train_loss: 0.1864, test_loss: 1.8612, test_f1: 0.6929
 epoch: 87, train_loss: 0.2025, test_loss: 1.9103, test_f1: 0.6815
 epoch: 88, train_loss: 0.1925, test_loss: 1.8843, test_f1: 0.6912
 epoch: 89, train_loss: 0.2121, test_loss: 1.8649, test_f1: 0.6841
 epoch: 90, train_loss: 0.1700, test_loss: 1.9624, test_f1: 0.6878
 epoch: 91, train_loss: 0.1988, test_loss: 1.8760, test_f1: 0.6862
 epoch: 92, train_loss: 0.2016, test_loss: 1.8813, test_f1: 0.6726
 epoch: 93, train_loss: 0.1735, test_loss: 1.8996, test_f1: 0.6788
 epoch: 94, train_loss: 0.1762, test_loss: 1.8923, test_f1: 0.6894
 epoch: 95, train_loss: 0.1700, test_loss: 1.9859, test_f1: 0.6776
 epoch: 96, train_loss: 0.1658, test_loss: 1.8998, test_f1: 0.6830
 epoch: 97, train_loss: 0.1790, test_loss: 1.9377, test_f1: 0.6799
 epoch: 98, train_loss: 0.1770, test_loss: 1.9918, test_f1: 0.6809
 epoch: 99, train_loss: 0.1792, test_loss: 2.0094, test_f1: 0.6893
##################ITERATION #2 ****************************************
 epoch: 0, train_loss: 1.1345, test_loss: 0.9542, test_f1: 0.5156
 epoch: 1, train_loss: 0.9491, test_loss: 0.9032, test_f1: 0.5407
 epoch: 2, train_loss: 0.9013, test_loss: 0.8927, test_f1: 0.5772
 epoch: 3, train_loss: 0.8654, test_loss: 0.8615, test_f1: 0.5975
 epoch: 4, train_loss: 0.8448, test_loss: 0.8743, test_f1: 0.5880
 epoch: 5, train_loss: 0.8104, test_loss: 0.8005, test_f1: 0.5717
 epoch: 6, train_loss: 0.7945, test_loss: 0.8229, test_f1: 0.6303
 epoch: 7, train_loss: 0.8033, test_loss: 0.7702, test_f1: 0.6188
 epoch: 8, train_loss: 0.7631, test_loss: 0.8085, test_f1: 0.6158
 epoch: 9, train_loss: 0.7513, test_loss: 0.7543, test_f1: 0.6446
 epoch: 10, train_loss: 0.7287, test_loss: 0.8258, test_f1: 0.5925
 epoch: 11, train_loss: 0.7221, test_loss: 0.7687, test_f1: 0.6482
 epoch: 12, train_loss: 0.6897, test_loss: 0.7415, test_f1: 0.6239
 epoch: 13, train_loss: 0.6867, test_loss: 0.8154, test_f1: 0.5815
 epoch: 14, train_loss: 0.6643, test_loss: 0.7903, test_f1: 0.6511
 epoch: 15, train_loss: 0.6544, test_loss: 0.8695, test_f1: 0.6390
 epoch: 16, train_loss: 0.6411, test_loss: 0.8557, test_f1: 0.6573
 epoch: 17, train_loss: 0.6197, test_loss: 0.7882, test_f1: 0.6549
 epoch: 18, train_loss: 0.6076, test_loss: 0.7352, test_f1: 0.6553
 epoch: 19, train_loss: 0.6193, test_loss: 0.8853, test_f1: 0.6396
 epoch: 20, train_loss: 0.5921, test_loss: 0.7418, test_f1: 0.6661
 epoch: 21, train_loss: 0.5697, test_loss: 0.8396, test_f1: 0.6533
 epoch: 22, train_loss: 0.6040, test_loss: 0.8857, test_f1: 0.6416
 epoch: 23, train_loss: 0.5712, test_loss: 0.8673, test_f1: 0.6706
 epoch: 24, train_loss: 0.5408, test_loss: 0.8403, test_f1: 0.6577
 epoch: 25, train_loss: 0.5279, test_loss: 0.9646, test_f1: 0.6549
 epoch: 26, train_loss: 0.5192, test_loss: 0.9455, test_f1: 0.6606
 epoch: 27, train_loss: 0.5089, test_loss: 0.9044, test_f1: 0.6515
 epoch: 28, train_loss: 0.5086, test_loss: 1.0120, test_f1: 0.6705
 epoch: 29, train_loss: 0.4938, test_loss: 1.1469, test_f1: 0.6482
 epoch: 30, train_loss: 0.4955, test_loss: 0.9755, test_f1: 0.6521
 epoch: 31, train_loss: 0.4922, test_loss: 1.0398, test_f1: 0.6425
 epoch: 32, train_loss: 0.4708, test_loss: 1.0183, test_f1: 0.6643
 epoch: 33, train_loss: 0.4665, test_loss: 1.0031, test_f1: 0.6324
 epoch: 34, train_loss: 0.4414, test_loss: 0.9840, test_f1: 0.6500
 epoch: 35, train_loss: 0.4309, test_loss: 0.9831, test_f1: 0.6658
 epoch: 36, train_loss: 0.4412, test_loss: 1.0120, test_f1: 0.6627
 epoch: 37, train_loss: 0.4379, test_loss: 1.0525, test_f1: 0.6604
 epoch: 38, train_loss: 0.4323, test_loss: 1.0039, test_f1: 0.6736
 epoch: 39, train_loss: 0.4343, test_loss: 0.9417, test_f1: 0.6614
 epoch: 40, train_loss: 0.4160, test_loss: 1.0368, test_f1: 0.6676
 epoch: 41, train_loss: 0.4033, test_loss: 1.0196, test_f1: 0.6809
 epoch: 42, train_loss: 0.4017, test_loss: 1.0403, test_f1: 0.6733
 epoch: 43, train_loss: 0.4055, test_loss: 1.1412, test_f1: 0.6476
 epoch: 44, train_loss: 0.4020, test_loss: 1.1157, test_f1: 0.6589
 epoch: 45, train_loss: 0.3704, test_loss: 1.2002, test_f1: 0.6455
 epoch: 46, train_loss: 0.3717, test_loss: 1.1379, test_f1: 0.6579
 epoch: 47, train_loss: 0.3710, test_loss: 1.1309, test_f1: 0.6818
 epoch: 48, train_loss: 0.3749, test_loss: 1.1492, test_f1: 0.6703
 epoch: 49, train_loss: 0.3772, test_loss: 1.0741, test_f1: 0.6703
 epoch: 50, train_loss: 0.3423, test_loss: 1.2276, test_f1: 0.6225
 epoch: 51, train_loss: 0.3105, test_loss: 1.2197, test_f1: 0.6746
 epoch: 52, train_loss: 0.2996, test_loss: 1.1961, test_f1: 0.6679
 epoch: 53, train_loss: 0.3008, test_loss: 1.2406, test_f1: 0.6616
 epoch: 54, train_loss: 0.2746, test_loss: 1.2166, test_f1: 0.6742
 epoch: 55, train_loss: 0.2727, test_loss: 1.2523, test_f1: 0.6698
 epoch: 56, train_loss: 0.2756, test_loss: 1.3517, test_f1: 0.6847
 epoch: 57, train_loss: 0.2608, test_loss: 1.3555, test_f1: 0.6459
 epoch: 58, train_loss: 0.2591, test_loss: 1.3626, test_f1: 0.6801
 epoch: 59, train_loss: 0.2596, test_loss: 1.4299, test_f1: 0.6696
 epoch: 60, train_loss: 0.2440, test_loss: 1.4809, test_f1: 0.6622
 epoch: 61, train_loss: 0.2486, test_loss: 1.3879, test_f1: 0.6905
 epoch: 62, train_loss: 0.2212, test_loss: 1.4915, test_f1: 0.6745
 epoch: 63, train_loss: 0.2361, test_loss: 1.5430, test_f1: 0.6565
 epoch: 64, train_loss: 0.2283, test_loss: 1.5006, test_f1: 0.6516
 epoch: 65, train_loss: 0.2340, test_loss: 1.5979, test_f1: 0.6453
 epoch: 66, train_loss: 0.2351, test_loss: 1.5284, test_f1: 0.6730
 epoch: 67, train_loss: 0.2115, test_loss: 1.6846, test_f1: 0.6747
 epoch: 68, train_loss: 0.2322, test_loss: 1.5469, test_f1: 0.6500
 epoch: 69, train_loss: 0.2416, test_loss: 1.4777, test_f1: 0.6770
 epoch: 70, train_loss: 0.2323, test_loss: 1.5104, test_f1: 0.6357
 epoch: 71, train_loss: 0.2265, test_loss: 1.5926, test_f1: 0.6800
 epoch: 72, train_loss: 0.2194, test_loss: 1.4606, test_f1: 0.6752
 epoch: 73, train_loss: 0.2072, test_loss: 1.5449, test_f1: 0.6691
 epoch: 74, train_loss: 0.2143, test_loss: 1.4959, test_f1: 0.6600
 epoch: 75, train_loss: 0.2061, test_loss: 1.6506, test_f1: 0.6831
 epoch: 76, train_loss: 0.2144, test_loss: 1.6223, test_f1: 0.6695
 epoch: 77, train_loss: 0.2050, test_loss: 1.6859, test_f1: 0.6626
 epoch: 78, train_loss: 0.1946, test_loss: 1.6131, test_f1: 0.6676
 epoch: 79, train_loss: 0.2016, test_loss: 1.6376, test_f1: 0.6697
 epoch: 80, train_loss: 0.2097, test_loss: 1.5847, test_f1: 0.6520
 epoch: 81, train_loss: 0.2103, test_loss: 1.7222, test_f1: 0.6461
 epoch: 82, train_loss: 0.1837, test_loss: 1.5919, test_f1: 0.6687
 epoch: 83, train_loss: 0.2009, test_loss: 1.7582, test_f1: 0.6482
 epoch: 84, train_loss: 0.2161, test_loss: 1.5003, test_f1: 0.6675
 epoch: 85, train_loss: 0.1964, test_loss: 1.6398, test_f1: 0.6387
 epoch: 86, train_loss: 0.1932, test_loss: 1.6529, test_f1: 0.6514
 epoch: 87, train_loss: 0.1857, test_loss: 1.6985, test_f1: 0.6415
 epoch: 88, train_loss: 0.1819, test_loss: 1.7424, test_f1: 0.6670
 epoch: 89, train_loss: 0.1729, test_loss: 1.7415, test_f1: 0.6597
 epoch: 90, train_loss: 0.1795, test_loss: 1.7013, test_f1: 0.6571
 epoch: 91, train_loss: 0.1839, test_loss: 1.6222, test_f1: 0.6770
 epoch: 92, train_loss: 0.1804, test_loss: 1.7393, test_f1: 0.6776
 epoch: 93, train_loss: 0.1826, test_loss: 1.6862, test_f1: 0.6489
 epoch: 94, train_loss: 0.1710, test_loss: 1.7115, test_f1: 0.6399
 epoch: 95, train_loss: 0.1921, test_loss: 1.7929, test_f1: 0.6533
 epoch: 96, train_loss: 0.1778, test_loss: 1.8160, test_f1: 0.6599
 epoch: 97, train_loss: 0.1782, test_loss: 1.7879, test_f1: 0.6616
 epoch: 98, train_loss: 0.1704, test_loss: 1.6004, test_f1: 0.6571
 epoch: 99, train_loss: 0.1719, test_loss: 1.8017, test_f1: 0.6648
##################ITERATION #3 ****************************************
 epoch: 0, train_loss: 1.2097, test_loss: 0.9755, test_f1: 0.4192
 epoch: 1, train_loss: 0.9657, test_loss: 0.9248, test_f1: 0.5435
 epoch: 2, train_loss: 0.9016, test_loss: 0.8872, test_f1: 0.5535
 epoch: 3, train_loss: 0.8760, test_loss: 0.8404, test_f1: 0.5848
 epoch: 4, train_loss: 0.8749, test_loss: 0.8272, test_f1: 0.5880
 epoch: 5, train_loss: 0.8276, test_loss: 0.8071, test_f1: 0.5842
 epoch: 6, train_loss: 0.8005, test_loss: 0.8204, test_f1: 0.5606
 epoch: 7, train_loss: 0.7974, test_loss: 0.8095, test_f1: 0.6067
 epoch: 8, train_loss: 0.7823, test_loss: 0.7956, test_f1: 0.6380
 epoch: 9, train_loss: 0.7621, test_loss: 0.7934, test_f1: 0.6142
 epoch: 10, train_loss: 0.7355, test_loss: 0.7724, test_f1: 0.6377
 epoch: 11, train_loss: 0.7184, test_loss: 0.7678, test_f1: 0.6158
 epoch: 12, train_loss: 0.6930, test_loss: 0.7391, test_f1: 0.6286
 epoch: 13, train_loss: 0.7003, test_loss: 0.7182, test_f1: 0.6434
 epoch: 14, train_loss: 0.6875, test_loss: 0.7447, test_f1: 0.6360
 epoch: 15, train_loss: 0.6694, test_loss: 0.6965, test_f1: 0.6640
 epoch: 16, train_loss: 0.6377, test_loss: 0.7414, test_f1: 0.6477
 epoch: 17, train_loss: 0.6305, test_loss: 0.7302, test_f1: 0.6855
 epoch: 18, train_loss: 0.6301, test_loss: 0.7542, test_f1: 0.6514
 epoch: 19, train_loss: 0.6178, test_loss: 0.7793, test_f1: 0.6666
 epoch: 20, train_loss: 0.6087, test_loss: 0.7526, test_f1: 0.6303
 epoch: 21, train_loss: 0.6133, test_loss: 0.7886, test_f1: 0.6808
 epoch: 22, train_loss: 0.5767, test_loss: 0.7933, test_f1: 0.6763
 epoch: 23, train_loss: 0.5876, test_loss: 0.8409, test_f1: 0.6566
 epoch: 24, train_loss: 0.5728, test_loss: 0.7830, test_f1: 0.6647
 epoch: 25, train_loss: 0.5646, test_loss: 0.8177, test_f1: 0.6551
 epoch: 26, train_loss: 0.5403, test_loss: 0.7580, test_f1: 0.6708
 epoch: 27, train_loss: 0.5418, test_loss: 0.8439, test_f1: 0.6409
 epoch: 28, train_loss: 0.5436, test_loss: 0.8005, test_f1: 0.6548
 epoch: 29, train_loss: 0.5263, test_loss: 0.9513, test_f1: 0.6269
 epoch: 30, train_loss: 0.5055, test_loss: 0.8276, test_f1: 0.6510
 epoch: 31, train_loss: 0.5080, test_loss: 0.8497, test_f1: 0.6649
 epoch: 32, train_loss: 0.5018, test_loss: 0.8216, test_f1: 0.6440
 epoch: 33, train_loss: 0.5094, test_loss: 0.7920, test_f1: 0.6770
 epoch: 34, train_loss: 0.5003, test_loss: 0.8898, test_f1: 0.6571
 epoch: 35, train_loss: 0.4940, test_loss: 0.9107, test_f1: 0.6657
 epoch: 36, train_loss: 0.4725, test_loss: 0.9722, test_f1: 0.6522
 epoch: 37, train_loss: 0.4477, test_loss: 1.0239, test_f1: 0.6517
 epoch: 38, train_loss: 0.4504, test_loss: 0.9338, test_f1: 0.6494
 epoch: 39, train_loss: 0.4560, test_loss: 0.9510, test_f1: 0.6633
 epoch: 40, train_loss: 0.4425, test_loss: 0.9660, test_f1: 0.6632
 epoch: 41, train_loss: 0.4359, test_loss: 0.9347, test_f1: 0.6692
 epoch: 42, train_loss: 0.4223, test_loss: 1.0618, test_f1: 0.6563
 epoch: 43, train_loss: 0.4211, test_loss: 1.0717, test_f1: 0.6531
 epoch: 44, train_loss: 0.4079, test_loss: 0.9590, test_f1: 0.6615
 epoch: 45, train_loss: 0.4189, test_loss: 1.0668, test_f1: 0.6822
 epoch: 46, train_loss: 0.3916, test_loss: 1.0398, test_f1: 0.6531
 epoch: 47, train_loss: 0.3961, test_loss: 1.0853, test_f1: 0.6509
 epoch: 48, train_loss: 0.4079, test_loss: 1.0614, test_f1: 0.6554
 epoch: 49, train_loss: 0.3960, test_loss: 1.1344, test_f1: 0.6654
 epoch: 50, train_loss: 0.3661, test_loss: 1.1528, test_f1: 0.6584
 epoch: 51, train_loss: 0.3347, test_loss: 1.1134, test_f1: 0.6653
 epoch: 52, train_loss: 0.3252, test_loss: 1.2231, test_f1: 0.6561
 epoch: 53, train_loss: 0.3153, test_loss: 1.1828, test_f1: 0.6597
 epoch: 54, train_loss: 0.3182, test_loss: 1.1621, test_f1: 0.6601
 epoch: 55, train_loss: 0.2929, test_loss: 1.2679, test_f1: 0.6549
 epoch: 56, train_loss: 0.2866, test_loss: 1.2263, test_f1: 0.6551
 epoch: 57, train_loss: 0.2961, test_loss: 1.2477, test_f1: 0.6673
 epoch: 58, train_loss: 0.2980, test_loss: 1.1881, test_f1: 0.6600
 epoch: 59, train_loss: 0.2959, test_loss: 1.3000, test_f1: 0.6489
 epoch: 60, train_loss: 0.2781, test_loss: 1.2285, test_f1: 0.6540
 epoch: 61, train_loss: 0.2801, test_loss: 1.3986, test_f1: 0.6611
 epoch: 62, train_loss: 0.2780, test_loss: 1.3449, test_f1: 0.6602
 epoch: 63, train_loss: 0.2772, test_loss: 1.3374, test_f1: 0.6501
 epoch: 64, train_loss: 0.2693, test_loss: 1.3601, test_f1: 0.6580
 epoch: 65, train_loss: 0.2645, test_loss: 1.3530, test_f1: 0.6529
 epoch: 66, train_loss: 0.2683, test_loss: 1.3282, test_f1: 0.6585
 epoch: 67, train_loss: 0.2607, test_loss: 1.4162, test_f1: 0.6509
 epoch: 68, train_loss: 0.2663, test_loss: 1.4086, test_f1: 0.6541
 epoch: 69, train_loss: 0.2440, test_loss: 1.4315, test_f1: 0.6526
 epoch: 70, train_loss: 0.2562, test_loss: 1.4793, test_f1: 0.6497
 epoch: 71, train_loss: 0.2495, test_loss: 1.5422, test_f1: 0.6492
 epoch: 72, train_loss: 0.2512, test_loss: 1.4218, test_f1: 0.6561
 epoch: 73, train_loss: 0.2586, test_loss: 1.4019, test_f1: 0.6470
 epoch: 74, train_loss: 0.2403, test_loss: 1.4317, test_f1: 0.6661
 epoch: 75, train_loss: 0.2588, test_loss: 1.4482, test_f1: 0.6521
 epoch: 76, train_loss: 0.2363, test_loss: 1.4597, test_f1: 0.6603
 epoch: 77, train_loss: 0.2354, test_loss: 1.4250, test_f1: 0.6669
 epoch: 78, train_loss: 0.2358, test_loss: 1.5721, test_f1: 0.6562
 epoch: 79, train_loss: 0.2216, test_loss: 1.5154, test_f1: 0.6607
 epoch: 80, train_loss: 0.2380, test_loss: 1.5108, test_f1: 0.6862
 epoch: 81, train_loss: 0.2203, test_loss: 1.5410, test_f1: 0.6636
 epoch: 82, train_loss: 0.2237, test_loss: 1.5714, test_f1: 0.6529
 epoch: 83, train_loss: 0.2220, test_loss: 1.6034, test_f1: 0.6709
 epoch: 84, train_loss: 0.2017, test_loss: 1.6401, test_f1: 0.6420
 epoch: 85, train_loss: 0.2182, test_loss: 1.5166, test_f1: 0.6567
 epoch: 86, train_loss: 0.2235, test_loss: 1.5980, test_f1: 0.6645
 epoch: 87, train_loss: 0.2000, test_loss: 1.5909, test_f1: 0.6672
 epoch: 88, train_loss: 0.1874, test_loss: 1.6848, test_f1: 0.6575
 epoch: 89, train_loss: 0.2069, test_loss: 1.5479, test_f1: 0.6732
 epoch: 90, train_loss: 0.2097, test_loss: 1.6724, test_f1: 0.6476
 epoch: 91, train_loss: 0.2117, test_loss: 1.6752, test_f1: 0.6636
 epoch: 92, train_loss: 0.1965, test_loss: 1.7274, test_f1: 0.6602
 epoch: 93, train_loss: 0.1888, test_loss: 1.7214, test_f1: 0.6667
 epoch: 94, train_loss: 0.1969, test_loss: 1.6849, test_f1: 0.6715
 epoch: 95, train_loss: 0.1933, test_loss: 1.6647, test_f1: 0.6685
 epoch: 96, train_loss: 0.1898, test_loss: 1.7309, test_f1: 0.6707
 epoch: 97, train_loss: 0.1894, test_loss: 1.8497, test_f1: 0.6556
 epoch: 98, train_loss: 0.1878, test_loss: 1.7698, test_f1: 0.6558
 epoch: 99, train_loss: 0.1961, test_loss: 1.7130, test_f1: 0.6611
##################ITERATION #4 ****************************************
 epoch: 0, train_loss: 1.2554, test_loss: 1.0029, test_f1: 0.4766
 epoch: 1, train_loss: 0.9731, test_loss: 0.9094, test_f1: 0.5547
 epoch: 2, train_loss: 0.9154, test_loss: 0.9185, test_f1: 0.5651
 epoch: 3, train_loss: 0.9063, test_loss: 0.9038, test_f1: 0.5512
 epoch: 4, train_loss: 0.8726, test_loss: 0.8756, test_f1: 0.5525
 epoch: 5, train_loss: 0.8491, test_loss: 0.7970, test_f1: 0.6317
 epoch: 6, train_loss: 0.8215, test_loss: 0.8709, test_f1: 0.5697
 epoch: 7, train_loss: 0.8075, test_loss: 0.8465, test_f1: 0.6041
 epoch: 8, train_loss: 0.7879, test_loss: 0.8076, test_f1: 0.6322
 epoch: 9, train_loss: 0.7862, test_loss: 0.8085, test_f1: 0.6330
 epoch: 10, train_loss: 0.7776, test_loss: 0.7709, test_f1: 0.6221
 epoch: 11, train_loss: 0.7440, test_loss: 0.7976, test_f1: 0.6285
 epoch: 12, train_loss: 0.7326, test_loss: 0.7955, test_f1: 0.6160
 epoch: 13, train_loss: 0.7249, test_loss: 0.7431, test_f1: 0.6658
 epoch: 14, train_loss: 0.6920, test_loss: 0.7944, test_f1: 0.6593
 epoch: 15, train_loss: 0.7013, test_loss: 0.8098, test_f1: 0.5908
 epoch: 16, train_loss: 0.6661, test_loss: 0.7759, test_f1: 0.6640
 epoch: 17, train_loss: 0.6676, test_loss: 0.7685, test_f1: 0.6599
 epoch: 18, train_loss: 0.6553, test_loss: 0.8446, test_f1: 0.6432
 epoch: 19, train_loss: 0.6350, test_loss: 0.8285, test_f1: 0.6423
 epoch: 20, train_loss: 0.6396, test_loss: 0.8152, test_f1: 0.6643
 epoch: 21, train_loss: 0.6180, test_loss: 0.8025, test_f1: 0.6586
 epoch: 22, train_loss: 0.6178, test_loss: 0.7914, test_f1: 0.6655
 epoch: 23, train_loss: 0.6028, test_loss: 0.8147, test_f1: 0.6367
 epoch: 24, train_loss: 0.5908, test_loss: 0.7627, test_f1: 0.6814
 epoch: 25, train_loss: 0.5909, test_loss: 0.7957, test_f1: 0.6634
 epoch: 26, train_loss: 0.5822, test_loss: 0.8012, test_f1: 0.6570
 epoch: 27, train_loss: 0.5531, test_loss: 0.7853, test_f1: 0.6632
 epoch: 28, train_loss: 0.5501, test_loss: 0.7620, test_f1: 0.6856
 epoch: 29, train_loss: 0.5203, test_loss: 0.9107, test_f1: 0.6281
 epoch: 30, train_loss: 0.5345, test_loss: 0.8973, test_f1: 0.6769
 epoch: 31, train_loss: 0.5197, test_loss: 0.8190, test_f1: 0.6796
 epoch: 32, train_loss: 0.5070, test_loss: 0.8705, test_f1: 0.6540
 epoch: 33, train_loss: 0.5039, test_loss: 0.8520, test_f1: 0.6609
 epoch: 34, train_loss: 0.5047, test_loss: 0.8681, test_f1: 0.6804
 epoch: 35, train_loss: 0.5010, test_loss: 0.8631, test_f1: 0.6692
 epoch: 36, train_loss: 0.4696, test_loss: 0.8739, test_f1: 0.6780
 epoch: 37, train_loss: 0.4870, test_loss: 0.8857, test_f1: 0.6594
 epoch: 38, train_loss: 0.4801, test_loss: 0.8424, test_f1: 0.6683
 epoch: 39, train_loss: 0.4626, test_loss: 0.8469, test_f1: 0.6503
 epoch: 40, train_loss: 0.4672, test_loss: 0.8710, test_f1: 0.6910
 epoch: 41, train_loss: 0.4509, test_loss: 0.8812, test_f1: 0.6420
 epoch: 42, train_loss: 0.4356, test_loss: 0.9979, test_f1: 0.6855
 epoch: 43, train_loss: 0.4347, test_loss: 0.9203, test_f1: 0.6931
 epoch: 44, train_loss: 0.4290, test_loss: 0.9991, test_f1: 0.6262
 epoch: 45, train_loss: 0.3934, test_loss: 0.9981, test_f1: 0.6712
 epoch: 46, train_loss: 0.3991, test_loss: 0.9278, test_f1: 0.6718
 epoch: 47, train_loss: 0.4088, test_loss: 0.9546, test_f1: 0.6827
 epoch: 48, train_loss: 0.3993, test_loss: 0.9138, test_f1: 0.6958
 epoch: 49, train_loss: 0.3822, test_loss: 0.9466, test_f1: 0.6620
 epoch: 50, train_loss: 0.3986, test_loss: 1.0536, test_f1: 0.6638
 epoch: 51, train_loss: 0.3500, test_loss: 0.9911, test_f1: 0.6791
 epoch: 52, train_loss: 0.3219, test_loss: 1.0370, test_f1: 0.6753
 epoch: 53, train_loss: 0.3173, test_loss: 1.0752, test_f1: 0.6806
 epoch: 54, train_loss: 0.3028, test_loss: 1.0525, test_f1: 0.6889
 epoch: 55, train_loss: 0.2847, test_loss: 1.1296, test_f1: 0.6742
 epoch: 56, train_loss: 0.2946, test_loss: 1.1185, test_f1: 0.6885
 epoch: 57, train_loss: 0.3119, test_loss: 1.1180, test_f1: 0.6763
 epoch: 58, train_loss: 0.2844, test_loss: 1.1776, test_f1: 0.6847
 epoch: 59, train_loss: 0.2864, test_loss: 1.1681, test_f1: 0.6725
 epoch: 60, train_loss: 0.2862, test_loss: 1.1580, test_f1: 0.6693
 epoch: 61, train_loss: 0.2826, test_loss: 1.1611, test_f1: 0.6639
 epoch: 62, train_loss: 0.2996, test_loss: 1.2106, test_f1: 0.6603
 epoch: 63, train_loss: 0.2747, test_loss: 1.2108, test_f1: 0.6421
 epoch: 64, train_loss: 0.2693, test_loss: 1.3173, test_f1: 0.6506
 epoch: 65, train_loss: 0.2748, test_loss: 1.1677, test_f1: 0.6840
 epoch: 66, train_loss: 0.2666, test_loss: 1.2180, test_f1: 0.6762
 epoch: 67, train_loss: 0.2574, test_loss: 1.3094, test_f1: 0.6651
 epoch: 68, train_loss: 0.2602, test_loss: 1.3376, test_f1: 0.6404
 epoch: 69, train_loss: 0.2674, test_loss: 1.4623, test_f1: 0.6508
 epoch: 70, train_loss: 0.2520, test_loss: 1.2555, test_f1: 0.6759
 epoch: 71, train_loss: 0.2536, test_loss: 1.2828, test_f1: 0.6636
 epoch: 72, train_loss: 0.2422, test_loss: 1.3241, test_f1: 0.6518
 epoch: 73, train_loss: 0.2487, test_loss: 1.4246, test_f1: 0.6587
 epoch: 74, train_loss: 0.2562, test_loss: 1.2850, test_f1: 0.6660
 epoch: 75, train_loss: 0.2422, test_loss: 1.3357, test_f1: 0.6701
 epoch: 76, train_loss: 0.2344, test_loss: 1.2868, test_f1: 0.6743
 epoch: 77, train_loss: 0.2225, test_loss: 1.3702, test_f1: 0.6585
 epoch: 78, train_loss: 0.2232, test_loss: 1.4356, test_f1: 0.6667
 epoch: 79, train_loss: 0.2157, test_loss: 1.4115, test_f1: 0.6644
 epoch: 80, train_loss: 0.2135, test_loss: 1.3371, test_f1: 0.6550
 epoch: 81, train_loss: 0.2231, test_loss: 1.4488, test_f1: 0.6523
 epoch: 82, train_loss: 0.2256, test_loss: 1.3937, test_f1: 0.6666
 epoch: 83, train_loss: 0.2321, test_loss: 1.3472, test_f1: 0.6781
 epoch: 84, train_loss: 0.2217, test_loss: 1.4343, test_f1: 0.6712
 epoch: 85, train_loss: 0.2204, test_loss: 1.3867, test_f1: 0.6607
 epoch: 86, train_loss: 0.2175, test_loss: 1.3941, test_f1: 0.6707
 epoch: 87, train_loss: 0.2154, test_loss: 1.4439, test_f1: 0.6591
 epoch: 88, train_loss: 0.2096, test_loss: 1.4194, test_f1: 0.6657
 epoch: 89, train_loss: 0.2113, test_loss: 1.3661, test_f1: 0.6581
 epoch: 90, train_loss: 0.1953, test_loss: 1.4526, test_f1: 0.6620
 epoch: 91, train_loss: 0.2007, test_loss: 1.3588, test_f1: 0.6500
 epoch: 92, train_loss: 0.2067, test_loss: 1.2953, test_f1: 0.6780
 epoch: 93, train_loss: 0.1964, test_loss: 1.4607, test_f1: 0.6433
 epoch: 94, train_loss: 0.1949, test_loss: 1.5065, test_f1: 0.6693
 epoch: 95, train_loss: 0.2042, test_loss: 1.3678, test_f1: 0.6531
 epoch: 96, train_loss: 0.1946, test_loss: 1.4017, test_f1: 0.6705
 epoch: 97, train_loss: 0.2097, test_loss: 1.4622, test_f1: 0.6639
 epoch: 98, train_loss: 0.2040, test_loss: 1.3685, test_f1: 0.6654
 epoch: 99, train_loss: 0.2077, test_loss: 1.3369, test_f1: 0.6857
##################ITERATION #5 ****************************************
 epoch: 0, train_loss: 1.3782, test_loss: 1.0607, test_f1: 0.4535
 epoch: 1, train_loss: 0.9710, test_loss: 0.8871, test_f1: 0.5321
 epoch: 2, train_loss: 0.9228, test_loss: 0.8652, test_f1: 0.5291
 epoch: 3, train_loss: 0.8842, test_loss: 0.8690, test_f1: 0.5759
 epoch: 4, train_loss: 0.8687, test_loss: 0.8476, test_f1: 0.5575
 epoch: 5, train_loss: 0.8206, test_loss: 0.7898, test_f1: 0.6446
 epoch: 6, train_loss: 0.8251, test_loss: 0.8043, test_f1: 0.5929
 epoch: 7, train_loss: 0.8006, test_loss: 0.7993, test_f1: 0.6013
 epoch: 8, train_loss: 0.7802, test_loss: 0.7610, test_f1: 0.6306
 epoch: 9, train_loss: 0.7594, test_loss: 0.8228, test_f1: 0.6277
 epoch: 10, train_loss: 0.7376, test_loss: 0.7934, test_f1: 0.6376
 epoch: 11, train_loss: 0.7099, test_loss: 0.7289, test_f1: 0.6684
 epoch: 12, train_loss: 0.6963, test_loss: 0.7659, test_f1: 0.6650
 epoch: 13, train_loss: 0.7019, test_loss: 0.7403, test_f1: 0.6490
 epoch: 14, train_loss: 0.6820, test_loss: 0.7509, test_f1: 0.6408
 epoch: 15, train_loss: 0.6682, test_loss: 0.7409, test_f1: 0.6587
 epoch: 16, train_loss: 0.6564, test_loss: 0.7475, test_f1: 0.6666
 epoch: 17, train_loss: 0.6241, test_loss: 0.7401, test_f1: 0.6849
 epoch: 18, train_loss: 0.6386, test_loss: 0.7516, test_f1: 0.6652
 epoch: 19, train_loss: 0.5914, test_loss: 0.8188, test_f1: 0.6409
 epoch: 20, train_loss: 0.6216, test_loss: 0.7155, test_f1: 0.6713
 epoch: 21, train_loss: 0.5940, test_loss: 0.7244, test_f1: 0.6624
 epoch: 22, train_loss: 0.5821, test_loss: 0.7567, test_f1: 0.6697
 epoch: 23, train_loss: 0.5759, test_loss: 0.7075, test_f1: 0.6802
 epoch: 24, train_loss: 0.5702, test_loss: 0.7121, test_f1: 0.6941
 epoch: 25, train_loss: 0.5542, test_loss: 0.7421, test_f1: 0.6838
 epoch: 26, train_loss: 0.5486, test_loss: 0.7444, test_f1: 0.6743
 epoch: 27, train_loss: 0.5558, test_loss: 0.7434, test_f1: 0.6624
 epoch: 28, train_loss: 0.5267, test_loss: 0.7446, test_f1: 0.6811
 epoch: 29, train_loss: 0.5228, test_loss: 0.7212, test_f1: 0.6526
 epoch: 30, train_loss: 0.5041, test_loss: 0.7930, test_f1: 0.6673
 epoch: 31, train_loss: 0.4967, test_loss: 0.8314, test_f1: 0.6193
 epoch: 32, train_loss: 0.5088, test_loss: 0.7292, test_f1: 0.6831
 epoch: 33, train_loss: 0.4965, test_loss: 0.7663, test_f1: 0.6445
 epoch: 34, train_loss: 0.4839, test_loss: 0.8409, test_f1: 0.6512
 epoch: 35, train_loss: 0.4594, test_loss: 0.7437, test_f1: 0.6603
 epoch: 36, train_loss: 0.4537, test_loss: 0.8464, test_f1: 0.6735
 epoch: 37, train_loss: 0.4623, test_loss: 0.7525, test_f1: 0.6882
 epoch: 38, train_loss: 0.4333, test_loss: 0.8026, test_f1: 0.7078
 epoch: 39, train_loss: 0.4389, test_loss: 0.8285, test_f1: 0.6811
 epoch: 40, train_loss: 0.4584, test_loss: 0.8072, test_f1: 0.6748
 epoch: 41, train_loss: 0.4298, test_loss: 0.8675, test_f1: 0.6685
 epoch: 42, train_loss: 0.4133, test_loss: 0.9611, test_f1: 0.6623
 epoch: 43, train_loss: 0.4036, test_loss: 0.8373, test_f1: 0.6731
 epoch: 44, train_loss: 0.4113, test_loss: 0.8798, test_f1: 0.6870
 epoch: 45, train_loss: 0.3794, test_loss: 0.8185, test_f1: 0.6898
 epoch: 46, train_loss: 0.3853, test_loss: 0.9104, test_f1: 0.6792
 epoch: 47, train_loss: 0.3753, test_loss: 0.9805, test_f1: 0.6732
 epoch: 48, train_loss: 0.3933, test_loss: 0.8933, test_f1: 0.6763
 epoch: 49, train_loss: 0.3618, test_loss: 1.0030, test_f1: 0.6655
 epoch: 50, train_loss: 0.3693, test_loss: 1.0118, test_f1: 0.6646
 epoch: 51, train_loss: 0.3264, test_loss: 0.9660, test_f1: 0.6679
 epoch: 52, train_loss: 0.3070, test_loss: 0.9873, test_f1: 0.6623
 epoch: 53, train_loss: 0.2946, test_loss: 1.0113, test_f1: 0.6816
 epoch: 54, train_loss: 0.2819, test_loss: 1.0644, test_f1: 0.6861
 epoch: 55, train_loss: 0.2906, test_loss: 1.0617, test_f1: 0.6819
 epoch: 56, train_loss: 0.2794, test_loss: 1.0423, test_f1: 0.6772
 epoch: 57, train_loss: 0.2758, test_loss: 1.0531, test_f1: 0.6704
 epoch: 58, train_loss: 0.2816, test_loss: 1.0450, test_f1: 0.6755
 epoch: 59, train_loss: 0.2583, test_loss: 1.0989, test_f1: 0.6579
 epoch: 60, train_loss: 0.2765, test_loss: 1.0131, test_f1: 0.6846
 epoch: 61, train_loss: 0.2556, test_loss: 1.1202, test_f1: 0.6702
 epoch: 62, train_loss: 0.2551, test_loss: 1.1470, test_f1: 0.6565
 epoch: 63, train_loss: 0.2576, test_loss: 1.1417, test_f1: 0.6745
 epoch: 64, train_loss: 0.2470, test_loss: 1.1329, test_f1: 0.6632
 epoch: 65, train_loss: 0.2338, test_loss: 1.2488, test_f1: 0.6559
 epoch: 66, train_loss: 0.2572, test_loss: 1.1977, test_f1: 0.6582
 epoch: 67, train_loss: 0.2482, test_loss: 1.2589, test_f1: 0.6427
 epoch: 68, train_loss: 0.2545, test_loss: 1.1674, test_f1: 0.6622
 epoch: 69, train_loss: 0.2616, test_loss: 1.1759, test_f1: 0.6587
 epoch: 70, train_loss: 0.2543, test_loss: 1.1216, test_f1: 0.6796
 epoch: 71, train_loss: 0.2270, test_loss: 1.1890, test_f1: 0.6715
 epoch: 72, train_loss: 0.2181, test_loss: 1.1727, test_f1: 0.6858
 epoch: 73, train_loss: 0.2224, test_loss: 1.2171, test_f1: 0.6613
 epoch: 74, train_loss: 0.2114, test_loss: 1.2436, test_f1: 0.6823
 epoch: 75, train_loss: 0.2312, test_loss: 1.3126, test_f1: 0.6704
 epoch: 76, train_loss: 0.2178, test_loss: 1.2680, test_f1: 0.6818
 epoch: 77, train_loss: 0.2180, test_loss: 1.2781, test_f1: 0.6676
 epoch: 78, train_loss: 0.2457, test_loss: 1.2326, test_f1: 0.6658
 epoch: 79, train_loss: 0.2239, test_loss: 1.2835, test_f1: 0.6674
 epoch: 80, train_loss: 0.2230, test_loss: 1.1434, test_f1: 0.6878
 epoch: 81, train_loss: 0.2164, test_loss: 1.3255, test_f1: 0.6551
 epoch: 82, train_loss: 0.2107, test_loss: 1.2357, test_f1: 0.6678
 epoch: 83, train_loss: 0.1927, test_loss: 1.2637, test_f1: 0.6641
 epoch: 84, train_loss: 0.2169, test_loss: 1.2669, test_f1: 0.6838
 epoch: 85, train_loss: 0.2076, test_loss: 1.3051, test_f1: 0.6618
 epoch: 86, train_loss: 0.1988, test_loss: 1.2790, test_f1: 0.6553
 epoch: 87, train_loss: 0.2056, test_loss: 1.2841, test_f1: 0.6525
 epoch: 88, train_loss: 0.2073, test_loss: 1.2925, test_f1: 0.6487
 epoch: 89, train_loss: 0.1903, test_loss: 1.2511, test_f1: 0.6606
 epoch: 90, train_loss: 0.1824, test_loss: 1.3356, test_f1: 0.6611
 epoch: 91, train_loss: 0.2054, test_loss: 1.3772, test_f1: 0.6575
 epoch: 92, train_loss: 0.2032, test_loss: 1.3080, test_f1: 0.6638
 epoch: 93, train_loss: 0.1920, test_loss: 1.3323, test_f1: 0.6677
 epoch: 94, train_loss: 0.1877, test_loss: 1.3151, test_f1: 0.6706
 epoch: 95, train_loss: 0.1874, test_loss: 1.3610, test_f1: 0.6698
 epoch: 96, train_loss: 0.1822, test_loss: 1.3520, test_f1: 0.6669
 epoch: 97, train_loss: 0.1622, test_loss: 1.3305, test_f1: 0.6682
 epoch: 98, train_loss: 0.1906, test_loss: 1.3537, test_f1: 0.6516
 epoch: 99, train_loss: 0.1722, test_loss: 1.4845, test_f1: 0.6679
##################ITERATION #6 ****************************************
 epoch: 0, train_loss: 1.3581, test_loss: 1.0081, test_f1: 0.4512
 epoch: 1, train_loss: 0.9698, test_loss: 0.9034, test_f1: 0.5086
 epoch: 2, train_loss: 0.9249, test_loss: 0.8918, test_f1: 0.5426
 epoch: 3, train_loss: 0.8934, test_loss: 0.8911, test_f1: 0.5207
 epoch: 4, train_loss: 0.8675, test_loss: 0.8269, test_f1: 0.5925
 epoch: 5, train_loss: 0.8488, test_loss: 0.8291, test_f1: 0.5764
 epoch: 6, train_loss: 0.8110, test_loss: 0.7943, test_f1: 0.6052
 epoch: 7, train_loss: 0.8229, test_loss: 0.7957, test_f1: 0.6053
 epoch: 8, train_loss: 0.8134, test_loss: 0.7760, test_f1: 0.6254
 epoch: 9, train_loss: 0.7801, test_loss: 0.7997, test_f1: 0.6052
 epoch: 10, train_loss: 0.7613, test_loss: 0.7346, test_f1: 0.6294
 epoch: 11, train_loss: 0.7482, test_loss: 0.7641, test_f1: 0.6281
 epoch: 12, train_loss: 0.7264, test_loss: 0.7975, test_f1: 0.6218
 epoch: 13, train_loss: 0.7215, test_loss: 0.8144, test_f1: 0.6425
 epoch: 14, train_loss: 0.7098, test_loss: 0.7986, test_f1: 0.6204
 epoch: 15, train_loss: 0.6850, test_loss: 0.8008, test_f1: 0.6743
 epoch: 16, train_loss: 0.6813, test_loss: 0.7621, test_f1: 0.6540
 epoch: 17, train_loss: 0.6574, test_loss: 0.7418, test_f1: 0.6462
 epoch: 18, train_loss: 0.6581, test_loss: 0.7378, test_f1: 0.6555
 epoch: 19, train_loss: 0.6407, test_loss: 0.7858, test_f1: 0.6585
 epoch: 20, train_loss: 0.6344, test_loss: 0.7082, test_f1: 0.6686
 epoch: 21, train_loss: 0.6140, test_loss: 0.7131, test_f1: 0.6768
 epoch: 22, train_loss: 0.6041, test_loss: 0.7003, test_f1: 0.6639
 epoch: 23, train_loss: 0.6069, test_loss: 0.6971, test_f1: 0.6893
 epoch: 24, train_loss: 0.6008, test_loss: 0.7332, test_f1: 0.6861
 epoch: 25, train_loss: 0.5629, test_loss: 0.8081, test_f1: 0.6350
 epoch: 26, train_loss: 0.5670, test_loss: 0.7065, test_f1: 0.6939
 epoch: 27, train_loss: 0.5498, test_loss: 0.9056, test_f1: 0.6653
 epoch: 28, train_loss: 0.5631, test_loss: 0.7621, test_f1: 0.7032
 epoch: 29, train_loss: 0.5519, test_loss: 0.8008, test_f1: 0.6719
 epoch: 30, train_loss: 0.5395, test_loss: 0.7994, test_f1: 0.6827
 epoch: 31, train_loss: 0.5147, test_loss: 0.8576, test_f1: 0.6631
 epoch: 32, train_loss: 0.5221, test_loss: 0.8236, test_f1: 0.6708
 epoch: 33, train_loss: 0.5128, test_loss: 0.7188, test_f1: 0.6893
 epoch: 34, train_loss: 0.5046, test_loss: 0.8623, test_f1: 0.6655
 epoch: 35, train_loss: 0.5073, test_loss: 0.8602, test_f1: 0.6732
 epoch: 36, train_loss: 0.5044, test_loss: 0.7907, test_f1: 0.6893
 epoch: 37, train_loss: 0.4590, test_loss: 0.8774, test_f1: 0.6572
 epoch: 38, train_loss: 0.4668, test_loss: 0.7593, test_f1: 0.6739
 epoch: 39, train_loss: 0.4634, test_loss: 0.8640, test_f1: 0.6774
 epoch: 40, train_loss: 0.4706, test_loss: 0.9925, test_f1: 0.6667
 epoch: 41, train_loss: 0.4524, test_loss: 0.8506, test_f1: 0.6835
 epoch: 42, train_loss: 0.4798, test_loss: 0.8052, test_f1: 0.6823
 epoch: 43, train_loss: 0.4343, test_loss: 0.8158, test_f1: 0.6854
 epoch: 44, train_loss: 0.4224, test_loss: 1.0085, test_f1: 0.6423
 epoch: 45, train_loss: 0.4164, test_loss: 0.9383, test_f1: 0.6728
 epoch: 46, train_loss: 0.4293, test_loss: 0.9852, test_f1: 0.6672
 epoch: 47, train_loss: 0.4309, test_loss: 0.9183, test_f1: 0.6635
 epoch: 48, train_loss: 0.4124, test_loss: 0.9076, test_f1: 0.6657
 epoch: 49, train_loss: 0.3896, test_loss: 0.9859, test_f1: 0.6627
 epoch: 50, train_loss: 0.3900, test_loss: 0.9609, test_f1: 0.6963
 epoch: 51, train_loss: 0.3686, test_loss: 0.9941, test_f1: 0.6822
 epoch: 52, train_loss: 0.3543, test_loss: 1.0514, test_f1: 0.6933
 epoch: 53, train_loss: 0.3076, test_loss: 1.1512, test_f1: 0.6684
 epoch: 54, train_loss: 0.3257, test_loss: 1.0363, test_f1: 0.6726
 epoch: 55, train_loss: 0.3185, test_loss: 1.0455, test_f1: 0.6894
 epoch: 56, train_loss: 0.3103, test_loss: 1.1105, test_f1: 0.6837
 epoch: 57, train_loss: 0.3038, test_loss: 1.0977, test_f1: 0.7043
 epoch: 58, train_loss: 0.3099, test_loss: 1.0589, test_f1: 0.6855
 epoch: 59, train_loss: 0.3127, test_loss: 1.0829, test_f1: 0.7026
 epoch: 60, train_loss: 0.2993, test_loss: 1.1633, test_f1: 0.6880
 epoch: 61, train_loss: 0.2989, test_loss: 1.1213, test_f1: 0.7072
 epoch: 62, train_loss: 0.2986, test_loss: 1.0925, test_f1: 0.6942
 epoch: 63, train_loss: 0.2841, test_loss: 1.1886, test_f1: 0.6899
 epoch: 64, train_loss: 0.2888, test_loss: 1.1599, test_f1: 0.6841
 epoch: 65, train_loss: 0.2783, test_loss: 1.1355, test_f1: 0.6768
 epoch: 66, train_loss: 0.2717, test_loss: 1.1066, test_f1: 0.6744
 epoch: 67, train_loss: 0.2747, test_loss: 1.1714, test_f1: 0.6902
 epoch: 68, train_loss: 0.2920, test_loss: 1.2474, test_f1: 0.6771
 epoch: 69, train_loss: 0.2728, test_loss: 1.1879, test_f1: 0.6941
 epoch: 70, train_loss: 0.2657, test_loss: 1.1382, test_f1: 0.6876
 epoch: 71, train_loss: 0.2722, test_loss: 1.1714, test_f1: 0.6810
 epoch: 72, train_loss: 0.2735, test_loss: 1.2179, test_f1: 0.6803
 epoch: 73, train_loss: 0.2651, test_loss: 1.2095, test_f1: 0.6744
 epoch: 74, train_loss: 0.2525, test_loss: 1.1524, test_f1: 0.6794
 epoch: 75, train_loss: 0.2706, test_loss: 1.1429, test_f1: 0.6793
 epoch: 76, train_loss: 0.2472, test_loss: 1.1455, test_f1: 0.6951
 epoch: 77, train_loss: 0.2541, test_loss: 1.1873, test_f1: 0.6830
 epoch: 78, train_loss: 0.2488, test_loss: 1.2660, test_f1: 0.6758
 epoch: 79, train_loss: 0.2559, test_loss: 1.2699, test_f1: 0.6801
 epoch: 80, train_loss: 0.2495, test_loss: 1.3532, test_f1: 0.6664
 epoch: 81, train_loss: 0.2318, test_loss: 1.2546, test_f1: 0.6743
 epoch: 82, train_loss: 0.2286, test_loss: 1.2843, test_f1: 0.6734
 epoch: 83, train_loss: 0.2339, test_loss: 1.3496, test_f1: 0.6721
 epoch: 84, train_loss: 0.2476, test_loss: 1.3011, test_f1: 0.6825
 epoch: 85, train_loss: 0.2368, test_loss: 1.3031, test_f1: 0.6761
 epoch: 86, train_loss: 0.2284, test_loss: 1.2032, test_f1: 0.6985
 epoch: 87, train_loss: 0.2340, test_loss: 1.2514, test_f1: 0.6673
 epoch: 88, train_loss: 0.2355, test_loss: 1.2280, test_f1: 0.6824
 epoch: 89, train_loss: 0.2566, test_loss: 1.2872, test_f1: 0.6795
 epoch: 90, train_loss: 0.2146, test_loss: 1.2397, test_f1: 0.7002
 epoch: 91, train_loss: 0.2105, test_loss: 1.2865, test_f1: 0.6699
 epoch: 92, train_loss: 0.2184, test_loss: 1.4302, test_f1: 0.6669
 epoch: 93, train_loss: 0.2394, test_loss: 1.2514, test_f1: 0.6785
 epoch: 94, train_loss: 0.2162, test_loss: 1.3225, test_f1: 0.6784
 epoch: 95, train_loss: 0.2111, test_loss: 1.3786, test_f1: 0.6880
 epoch: 96, train_loss: 0.2113, test_loss: 1.3389, test_f1: 0.6821
 epoch: 97, train_loss: 0.2049, test_loss: 1.3634, test_f1: 0.6747
 epoch: 98, train_loss: 0.2018, test_loss: 1.2908, test_f1: 0.6675
 epoch: 99, train_loss: 0.2000, test_loss: 1.3993, test_f1: 0.6785
##################ITERATION #7 ****************************************
 epoch: 0, train_loss: 1.2828, test_loss: 1.1050, test_f1: 0.4068
 epoch: 1, train_loss: 0.9765, test_loss: 0.9492, test_f1: 0.5161
 epoch: 2, train_loss: 0.9325, test_loss: 0.9424, test_f1: 0.5500
 epoch: 3, train_loss: 0.8928, test_loss: 0.9072, test_f1: 0.5588
 epoch: 4, train_loss: 0.8845, test_loss: 0.8731, test_f1: 0.5498
 epoch: 5, train_loss: 0.8568, test_loss: 0.8435, test_f1: 0.5633
 epoch: 6, train_loss: 0.8365, test_loss: 0.8237, test_f1: 0.5887
 epoch: 7, train_loss: 0.8128, test_loss: 0.8274, test_f1: 0.5777
 epoch: 8, train_loss: 0.7925, test_loss: 0.8151, test_f1: 0.6120
 epoch: 9, train_loss: 0.7723, test_loss: 0.8074, test_f1: 0.6384
 epoch: 10, train_loss: 0.7483, test_loss: 0.8042, test_f1: 0.6398
 epoch: 11, train_loss: 0.7563, test_loss: 0.8028, test_f1: 0.6182
 epoch: 12, train_loss: 0.7371, test_loss: 0.7733, test_f1: 0.6322
 epoch: 13, train_loss: 0.7165, test_loss: 0.7930, test_f1: 0.6522
 epoch: 14, train_loss: 0.7054, test_loss: 0.7539, test_f1: 0.6481
 epoch: 15, train_loss: 0.6741, test_loss: 0.7810, test_f1: 0.6451
 epoch: 16, train_loss: 0.6553, test_loss: 0.7716, test_f1: 0.6323
 epoch: 17, train_loss: 0.6468, test_loss: 0.7312, test_f1: 0.6866
 epoch: 18, train_loss: 0.6496, test_loss: 0.8269, test_f1: 0.6187
 epoch: 19, train_loss: 0.6329, test_loss: 0.7901, test_f1: 0.6662
 epoch: 20, train_loss: 0.6271, test_loss: 0.7500, test_f1: 0.6472
 epoch: 21, train_loss: 0.6032, test_loss: 0.8515, test_f1: 0.6122
 epoch: 22, train_loss: 0.6047, test_loss: 0.8269, test_f1: 0.6494
 epoch: 23, train_loss: 0.5912, test_loss: 0.7445, test_f1: 0.6763
 epoch: 24, train_loss: 0.5672, test_loss: 0.7517, test_f1: 0.6617
 epoch: 25, train_loss: 0.5614, test_loss: 0.7494, test_f1: 0.6486
 epoch: 26, train_loss: 0.5732, test_loss: 0.7671, test_f1: 0.6447
 epoch: 27, train_loss: 0.5580, test_loss: 0.7501, test_f1: 0.6652
 epoch: 28, train_loss: 0.5370, test_loss: 0.8335, test_f1: 0.6544
 epoch: 29, train_loss: 0.5323, test_loss: 0.8037, test_f1: 0.6811
 epoch: 30, train_loss: 0.5195, test_loss: 0.8149, test_f1: 0.6503
 epoch: 31, train_loss: 0.5202, test_loss: 0.7915, test_f1: 0.6911
 epoch: 32, train_loss: 0.5365, test_loss: 0.7697, test_f1: 0.6775
 epoch: 33, train_loss: 0.4883, test_loss: 0.8495, test_f1: 0.6457
 epoch: 34, train_loss: 0.4857, test_loss: 0.8234, test_f1: 0.6749
 epoch: 35, train_loss: 0.4960, test_loss: 0.8049, test_f1: 0.6890
 epoch: 36, train_loss: 0.4800, test_loss: 0.7885, test_f1: 0.6697
 epoch: 37, train_loss: 0.4783, test_loss: 0.7464, test_f1: 0.7063
 epoch: 38, train_loss: 0.4589, test_loss: 0.8474, test_f1: 0.6420
 epoch: 39, train_loss: 0.4648, test_loss: 0.7390, test_f1: 0.6903
 epoch: 40, train_loss: 0.4570, test_loss: 0.7237, test_f1: 0.6848
 epoch: 41, train_loss: 0.4505, test_loss: 0.8331, test_f1: 0.6561
 epoch: 42, train_loss: 0.4284, test_loss: 0.8154, test_f1: 0.7114
 epoch: 43, train_loss: 0.4480, test_loss: 0.7404, test_f1: 0.6702
 epoch: 44, train_loss: 0.4436, test_loss: 0.8841, test_f1: 0.6644
 epoch: 45, train_loss: 0.4365, test_loss: 0.8383, test_f1: 0.7202
 epoch: 46, train_loss: 0.4156, test_loss: 0.8920, test_f1: 0.6560
 epoch: 47, train_loss: 0.4253, test_loss: 0.8262, test_f1: 0.7018
 epoch: 48, train_loss: 0.4061, test_loss: 0.8339, test_f1: 0.6728
 epoch: 49, train_loss: 0.4057, test_loss: 0.9358, test_f1: 0.6538
 epoch: 50, train_loss: 0.4020, test_loss: 0.8899, test_f1: 0.6762
 epoch: 51, train_loss: 0.3756, test_loss: 0.8983, test_f1: 0.6719
 epoch: 52, train_loss: 0.3637, test_loss: 0.9036, test_f1: 0.6935
 epoch: 53, train_loss: 0.3317, test_loss: 0.9488, test_f1: 0.6895
 epoch: 54, train_loss: 0.3154, test_loss: 0.9511, test_f1: 0.6751
 epoch: 55, train_loss: 0.3359, test_loss: 0.9882, test_f1: 0.6686
 epoch: 56, train_loss: 0.3136, test_loss: 0.9430, test_f1: 0.6768
 epoch: 57, train_loss: 0.3051, test_loss: 0.9669, test_f1: 0.6652
 epoch: 58, train_loss: 0.3054, test_loss: 1.0085, test_f1: 0.6807
 epoch: 59, train_loss: 0.2939, test_loss: 1.0082, test_f1: 0.6786
 epoch: 60, train_loss: 0.2964, test_loss: 1.0281, test_f1: 0.6736
 epoch: 61, train_loss: 0.2915, test_loss: 1.0013, test_f1: 0.6672
 epoch: 62, train_loss: 0.2896, test_loss: 1.0525, test_f1: 0.6728
 epoch: 63, train_loss: 0.2814, test_loss: 1.0486, test_f1: 0.6750
 epoch: 64, train_loss: 0.2797, test_loss: 1.0391, test_f1: 0.6785
 epoch: 65, train_loss: 0.2685, test_loss: 1.0966, test_f1: 0.6755
 epoch: 66, train_loss: 0.2619, test_loss: 1.1340, test_f1: 0.6658
 epoch: 67, train_loss: 0.2855, test_loss: 1.1963, test_f1: 0.6443
 epoch: 68, train_loss: 0.2763, test_loss: 1.1842, test_f1: 0.6559
 epoch: 69, train_loss: 0.2794, test_loss: 1.1201, test_f1: 0.6709
 epoch: 70, train_loss: 0.2565, test_loss: 1.1465, test_f1: 0.6647
 epoch: 71, train_loss: 0.2541, test_loss: 1.0870, test_f1: 0.6883
 epoch: 72, train_loss: 0.2633, test_loss: 1.1262, test_f1: 0.6621
 epoch: 73, train_loss: 0.2869, test_loss: 1.1950, test_f1: 0.6711
 epoch: 74, train_loss: 0.2615, test_loss: 1.1166, test_f1: 0.6843
 epoch: 75, train_loss: 0.2644, test_loss: 1.1878, test_f1: 0.6803
 epoch: 76, train_loss: 0.2478, test_loss: 1.1760, test_f1: 0.6729
 epoch: 77, train_loss: 0.2404, test_loss: 1.2178, test_f1: 0.6524
 epoch: 78, train_loss: 0.2469, test_loss: 1.2881, test_f1: 0.6726
 epoch: 79, train_loss: 0.2407, test_loss: 1.1082, test_f1: 0.6684
 epoch: 80, train_loss: 0.2505, test_loss: 1.1967, test_f1: 0.6606
 epoch: 81, train_loss: 0.2398, test_loss: 1.1373, test_f1: 0.6778
 epoch: 82, train_loss: 0.2282, test_loss: 1.1939, test_f1: 0.6703
 epoch: 83, train_loss: 0.2358, test_loss: 1.3276, test_f1: 0.6562
 epoch: 84, train_loss: 0.2393, test_loss: 1.2590, test_f1: 0.6652
 epoch: 85, train_loss: 0.2328, test_loss: 1.1859, test_f1: 0.6630
 epoch: 86, train_loss: 0.2259, test_loss: 1.2419, test_f1: 0.6632
 epoch: 87, train_loss: 0.2150, test_loss: 1.3326, test_f1: 0.6458
 epoch: 88, train_loss: 0.2204, test_loss: 1.3041, test_f1: 0.6635
 epoch: 89, train_loss: 0.2122, test_loss: 1.3623, test_f1: 0.6657
 epoch: 90, train_loss: 0.2261, test_loss: 1.3043, test_f1: 0.6634
 epoch: 91, train_loss: 0.2324, test_loss: 1.2907, test_f1: 0.6632
 epoch: 92, train_loss: 0.1979, test_loss: 1.3486, test_f1: 0.6636
 epoch: 93, train_loss: 0.2076, test_loss: 1.3053, test_f1: 0.6734
 epoch: 94, train_loss: 0.2055, test_loss: 1.3251, test_f1: 0.6687
 epoch: 95, train_loss: 0.2153, test_loss: 1.3801, test_f1: 0.6611
 epoch: 96, train_loss: 0.2321, test_loss: 1.1729, test_f1: 0.6864
 epoch: 97, train_loss: 0.2140, test_loss: 1.2959, test_f1: 0.6694
 epoch: 98, train_loss: 0.2151, test_loss: 1.3720, test_f1: 0.6710
 epoch: 99, train_loss: 0.1994, test_loss: 1.3131, test_f1: 0.6704
##################ITERATION #8 ****************************************
 epoch: 0, train_loss: 1.3334, test_loss: 0.9741, test_f1: 0.4319
 epoch: 1, train_loss: 0.9823, test_loss: 0.9046, test_f1: 0.5144
 epoch: 2, train_loss: 0.9390, test_loss: 0.8860, test_f1: 0.5060
 epoch: 3, train_loss: 0.8961, test_loss: 0.8322, test_f1: 0.5692
 epoch: 4, train_loss: 0.8717, test_loss: 0.8403, test_f1: 0.5748
 epoch: 5, train_loss: 0.8478, test_loss: 0.8199, test_f1: 0.5698
 epoch: 6, train_loss: 0.8384, test_loss: 0.7713, test_f1: 0.6285
 epoch: 7, train_loss: 0.8117, test_loss: 0.8015, test_f1: 0.6001
 epoch: 8, train_loss: 0.8194, test_loss: 0.7905, test_f1: 0.6287
 epoch: 9, train_loss: 0.7656, test_loss: 0.7774, test_f1: 0.6240
 epoch: 10, train_loss: 0.7458, test_loss: 0.8054, test_f1: 0.6163
 epoch: 11, train_loss: 0.7516, test_loss: 0.7115, test_f1: 0.6512
 epoch: 12, train_loss: 0.7280, test_loss: 0.7825, test_f1: 0.6322
 epoch: 13, train_loss: 0.7263, test_loss: 0.9065, test_f1: 0.6124
 epoch: 14, train_loss: 0.7131, test_loss: 0.7231, test_f1: 0.6384
 epoch: 15, train_loss: 0.6939, test_loss: 0.7311, test_f1: 0.6253
 epoch: 16, train_loss: 0.6698, test_loss: 0.7311, test_f1: 0.6659
 epoch: 17, train_loss: 0.6742, test_loss: 0.7477, test_f1: 0.6257
 epoch: 18, train_loss: 0.6500, test_loss: 0.7448, test_f1: 0.6540
 epoch: 19, train_loss: 0.6469, test_loss: 0.7489, test_f1: 0.6403
 epoch: 20, train_loss: 0.6412, test_loss: 0.7081, test_f1: 0.6453
 epoch: 21, train_loss: 0.6241, test_loss: 0.7443, test_f1: 0.6600
 epoch: 22, train_loss: 0.6086, test_loss: 0.7518, test_f1: 0.6284
 epoch: 23, train_loss: 0.6178, test_loss: 0.7922, test_f1: 0.6734
 epoch: 24, train_loss: 0.6060, test_loss: 0.7197, test_f1: 0.6551
 epoch: 25, train_loss: 0.5890, test_loss: 0.7660, test_f1: 0.6524
 epoch: 26, train_loss: 0.5597, test_loss: 0.7793, test_f1: 0.6203
 epoch: 27, train_loss: 0.5727, test_loss: 0.7358, test_f1: 0.6580
 epoch: 28, train_loss: 0.5533, test_loss: 0.7388, test_f1: 0.6734
 epoch: 29, train_loss: 0.5361, test_loss: 0.7349, test_f1: 0.6681
 epoch: 30, train_loss: 0.5234, test_loss: 0.8543, test_f1: 0.6459
 epoch: 31, train_loss: 0.5421, test_loss: 0.8504, test_f1: 0.5982
 epoch: 32, train_loss: 0.5154, test_loss: 0.7347, test_f1: 0.6607
 epoch: 33, train_loss: 0.5086, test_loss: 0.8252, test_f1: 0.6693
 epoch: 34, train_loss: 0.5116, test_loss: 0.8361, test_f1: 0.6581
 epoch: 35, train_loss: 0.5014, test_loss: 0.8238, test_f1: 0.6587
 epoch: 36, train_loss: 0.5044, test_loss: 0.8028, test_f1: 0.6492
 epoch: 37, train_loss: 0.4852, test_loss: 0.8480, test_f1: 0.6519
 epoch: 38, train_loss: 0.4636, test_loss: 0.8189, test_f1: 0.6550
 epoch: 39, train_loss: 0.4548, test_loss: 0.8730, test_f1: 0.6756
 epoch: 40, train_loss: 0.4703, test_loss: 0.7893, test_f1: 0.6798
 epoch: 41, train_loss: 0.4468, test_loss: 0.7916, test_f1: 0.6788
 epoch: 42, train_loss: 0.4276, test_loss: 0.8664, test_f1: 0.6769
 epoch: 43, train_loss: 0.4180, test_loss: 0.9702, test_f1: 0.6435
 epoch: 44, train_loss: 0.4220, test_loss: 0.9651, test_f1: 0.6543
 epoch: 45, train_loss: 0.4226, test_loss: 0.8703, test_f1: 0.6789
 epoch: 46, train_loss: 0.4106, test_loss: 0.9579, test_f1: 0.6382
 epoch: 47, train_loss: 0.4081, test_loss: 0.9272, test_f1: 0.6540
 epoch: 48, train_loss: 0.4063, test_loss: 0.9049, test_f1: 0.6702
 epoch: 49, train_loss: 0.4156, test_loss: 0.7923, test_f1: 0.6948
 epoch: 50, train_loss: 0.3902, test_loss: 0.8313, test_f1: 0.7055
 epoch: 51, train_loss: 0.3432, test_loss: 0.8804, test_f1: 0.6822
 epoch: 52, train_loss: 0.3482, test_loss: 0.9155, test_f1: 0.6732
 epoch: 53, train_loss: 0.3222, test_loss: 0.9577, test_f1: 0.6850
 epoch: 54, train_loss: 0.2950, test_loss: 0.9932, test_f1: 0.6937
 epoch: 55, train_loss: 0.3054, test_loss: 1.0011, test_f1: 0.6817
 epoch: 56, train_loss: 0.3115, test_loss: 1.0159, test_f1: 0.6870
 epoch: 57, train_loss: 0.3022, test_loss: 1.0962, test_f1: 0.6735
 epoch: 58, train_loss: 0.2914, test_loss: 1.0783, test_f1: 0.6770
 epoch: 59, train_loss: 0.2794, test_loss: 1.0189, test_f1: 0.6803
 epoch: 60, train_loss: 0.2978, test_loss: 1.0517, test_f1: 0.6754
 epoch: 61, train_loss: 0.2724, test_loss: 1.0844, test_f1: 0.6796
 epoch: 62, train_loss: 0.2938, test_loss: 1.1409, test_f1: 0.6829
 epoch: 63, train_loss: 0.2796, test_loss: 1.0712, test_f1: 0.6855
 epoch: 64, train_loss: 0.2766, test_loss: 1.0858, test_f1: 0.6761
 epoch: 65, train_loss: 0.2670, test_loss: 1.0498, test_f1: 0.6860
 epoch: 66, train_loss: 0.2802, test_loss: 1.1304, test_f1: 0.6767
 epoch: 67, train_loss: 0.2724, test_loss: 1.1575, test_f1: 0.6825
 epoch: 68, train_loss: 0.2488, test_loss: 1.1016, test_f1: 0.6868
 epoch: 69, train_loss: 0.2691, test_loss: 1.1375, test_f1: 0.6866
 epoch: 70, train_loss: 0.2539, test_loss: 1.1750, test_f1: 0.6784
 epoch: 71, train_loss: 0.2615, test_loss: 1.2026, test_f1: 0.6714
 epoch: 72, train_loss: 0.2634, test_loss: 1.1816, test_f1: 0.6844
 epoch: 73, train_loss: 0.2714, test_loss: 1.1311, test_f1: 0.6787
 epoch: 74, train_loss: 0.2319, test_loss: 1.2480, test_f1: 0.6775
 epoch: 75, train_loss: 0.2450, test_loss: 1.2643, test_f1: 0.6871
 epoch: 76, train_loss: 0.2316, test_loss: 1.2507, test_f1: 0.6889
 epoch: 77, train_loss: 0.2520, test_loss: 1.2394, test_f1: 0.6867
 epoch: 78, train_loss: 0.2443, test_loss: 1.3567, test_f1: 0.6662
 epoch: 79, train_loss: 0.2279, test_loss: 1.4095, test_f1: 0.6700
 epoch: 80, train_loss: 0.2149, test_loss: 1.3353, test_f1: 0.6668
 epoch: 81, train_loss: 0.2388, test_loss: 1.2206, test_f1: 0.6705
 epoch: 82, train_loss: 0.2086, test_loss: 1.2815, test_f1: 0.6881
 epoch: 83, train_loss: 0.2147, test_loss: 1.3314, test_f1: 0.6871
 epoch: 84, train_loss: 0.2287, test_loss: 1.2531, test_f1: 0.6808
 epoch: 85, train_loss: 0.2233, test_loss: 1.3114, test_f1: 0.6855
 epoch: 86, train_loss: 0.2203, test_loss: 1.3356, test_f1: 0.6910
 epoch: 87, train_loss: 0.2246, test_loss: 1.3906, test_f1: 0.6828
 epoch: 88, train_loss: 0.2251, test_loss: 1.3705, test_f1: 0.6731
 epoch: 89, train_loss: 0.2438, test_loss: 1.3043, test_f1: 0.6877
 epoch: 90, train_loss: 0.2208, test_loss: 1.3631, test_f1: 0.6743
 epoch: 91, train_loss: 0.2154, test_loss: 1.4223, test_f1: 0.6739
 epoch: 92, train_loss: 0.1960, test_loss: 1.3429, test_f1: 0.6831
 epoch: 93, train_loss: 0.2069, test_loss: 1.3662, test_f1: 0.6842
 epoch: 94, train_loss: 0.2148, test_loss: 1.4803, test_f1: 0.6595
 epoch: 95, train_loss: 0.1986, test_loss: 1.4111, test_f1: 0.6965
 epoch: 96, train_loss: 0.1903, test_loss: 1.4271, test_f1: 0.6943
 epoch: 97, train_loss: 0.1981, test_loss: 1.3476, test_f1: 0.6922
 epoch: 98, train_loss: 0.2030, test_loss: 1.4701, test_f1: 0.7013
 epoch: 99, train_loss: 0.2093, test_loss: 1.4134, test_f1: 0.6697
##################ITERATION #9 ****************************************
 epoch: 0, train_loss: 1.3557, test_loss: 1.0188, test_f1: 0.4099
 epoch: 1, train_loss: 0.9825, test_loss: 0.9607, test_f1: 0.5277
 epoch: 2, train_loss: 0.9478, test_loss: 0.9283, test_f1: 0.5256
 epoch: 3, train_loss: 0.9271, test_loss: 0.8708, test_f1: 0.5334
 epoch: 4, train_loss: 0.8858, test_loss: 0.8926, test_f1: 0.5845
 epoch: 5, train_loss: 0.8725, test_loss: 0.8435, test_f1: 0.5807
 epoch: 6, train_loss: 0.8415, test_loss: 0.8804, test_f1: 0.6219
 epoch: 7, train_loss: 0.8199, test_loss: 0.8798, test_f1: 0.6168
 epoch: 8, train_loss: 0.8009, test_loss: 0.7822, test_f1: 0.6434
 epoch: 9, train_loss: 0.7684, test_loss: 0.8225, test_f1: 0.6361
 epoch: 10, train_loss: 0.7742, test_loss: 0.8389, test_f1: 0.6166
 epoch: 11, train_loss: 0.7425, test_loss: 0.7929, test_f1: 0.6417
 epoch: 12, train_loss: 0.7195, test_loss: 0.8538, test_f1: 0.6430
 epoch: 13, train_loss: 0.7037, test_loss: 0.7375, test_f1: 0.6558
 epoch: 14, train_loss: 0.6872, test_loss: 0.7229, test_f1: 0.6823
 epoch: 15, train_loss: 0.7071, test_loss: 0.8112, test_f1: 0.6370
 epoch: 16, train_loss: 0.6663, test_loss: 0.8384, test_f1: 0.6530
 epoch: 17, train_loss: 0.6579, test_loss: 0.8425, test_f1: 0.6581
 epoch: 18, train_loss: 0.6328, test_loss: 0.8262, test_f1: 0.6449
 epoch: 19, train_loss: 0.6358, test_loss: 0.7723, test_f1: 0.6470
 epoch: 20, train_loss: 0.6218, test_loss: 0.7958, test_f1: 0.6618
 epoch: 21, train_loss: 0.6012, test_loss: 0.7785, test_f1: 0.6519
 epoch: 22, train_loss: 0.5910, test_loss: 0.7688, test_f1: 0.6521
 epoch: 23, train_loss: 0.5974, test_loss: 0.6669, test_f1: 0.6771
 epoch: 24, train_loss: 0.5804, test_loss: 0.8277, test_f1: 0.6758
 epoch: 25, train_loss: 0.5662, test_loss: 0.7938, test_f1: 0.6955
 epoch: 26, train_loss: 0.5452, test_loss: 0.8233, test_f1: 0.6844
 epoch: 27, train_loss: 0.5488, test_loss: 0.8387, test_f1: 0.6745
 epoch: 28, train_loss: 0.5464, test_loss: 0.9529, test_f1: 0.6748
 epoch: 29, train_loss: 0.5159, test_loss: 0.9129, test_f1: 0.6673
 epoch: 30, train_loss: 0.5150, test_loss: 0.9467, test_f1: 0.6801
 epoch: 31, train_loss: 0.5036, test_loss: 0.8403, test_f1: 0.6629
 epoch: 32, train_loss: 0.5214, test_loss: 0.8581, test_f1: 0.6851
 epoch: 33, train_loss: 0.4823, test_loss: 0.9112, test_f1: 0.6806
 epoch: 34, train_loss: 0.4778, test_loss: 0.9243, test_f1: 0.6480
 epoch: 35, train_loss: 0.4821, test_loss: 0.9015, test_f1: 0.6626
 epoch: 36, train_loss: 0.4652, test_loss: 0.8775, test_f1: 0.6535
 epoch: 37, train_loss: 0.4297, test_loss: 1.0019, test_f1: 0.6596
 epoch: 38, train_loss: 0.4660, test_loss: 0.8659, test_f1: 0.6845
 epoch: 39, train_loss: 0.4628, test_loss: 0.9216, test_f1: 0.6744
 epoch: 40, train_loss: 0.4341, test_loss: 0.9169, test_f1: 0.6702
 epoch: 41, train_loss: 0.4225, test_loss: 0.9633, test_f1: 0.6724
 epoch: 42, train_loss: 0.4297, test_loss: 0.9400, test_f1: 0.6914
 epoch: 43, train_loss: 0.4237, test_loss: 1.0343, test_f1: 0.6779
 epoch: 44, train_loss: 0.4192, test_loss: 0.9636, test_f1: 0.6752
 epoch: 45, train_loss: 0.3949, test_loss: 1.0578, test_f1: 0.6779
 epoch: 46, train_loss: 0.4009, test_loss: 1.0522, test_f1: 0.6516
 epoch: 47, train_loss: 0.4060, test_loss: 1.0797, test_f1: 0.6530
 epoch: 48, train_loss: 0.3916, test_loss: 1.0004, test_f1: 0.6673
 epoch: 49, train_loss: 0.3810, test_loss: 0.9482, test_f1: 0.6915
 epoch: 50, train_loss: 0.3812, test_loss: 0.9518, test_f1: 0.6983
 epoch: 51, train_loss: 0.3397, test_loss: 1.0409, test_f1: 0.7080
 epoch: 52, train_loss: 0.3163, test_loss: 1.0410, test_f1: 0.6910
 epoch: 53, train_loss: 0.3039, test_loss: 1.0763, test_f1: 0.6929
 epoch: 54, train_loss: 0.3145, test_loss: 1.0131, test_f1: 0.6907
 epoch: 55, train_loss: 0.2916, test_loss: 1.0588, test_f1: 0.6966
 epoch: 56, train_loss: 0.3022, test_loss: 1.1043, test_f1: 0.6828
 epoch: 57, train_loss: 0.2713, test_loss: 1.1645, test_f1: 0.6879
 epoch: 58, train_loss: 0.2890, test_loss: 1.1141, test_f1: 0.6860
 epoch: 59, train_loss: 0.2593, test_loss: 1.0947, test_f1: 0.6822
 epoch: 60, train_loss: 0.2764, test_loss: 1.1302, test_f1: 0.6826
 epoch: 61, train_loss: 0.2799, test_loss: 1.1708, test_f1: 0.6672
 epoch: 62, train_loss: 0.2633, test_loss: 1.1157, test_f1: 0.6662
 epoch: 63, train_loss: 0.2573, test_loss: 1.2569, test_f1: 0.6728
 epoch: 64, train_loss: 0.2642, test_loss: 1.2180, test_f1: 0.6811
 epoch: 65, train_loss: 0.2479, test_loss: 1.2577, test_f1: 0.6749
 epoch: 66, train_loss: 0.2773, test_loss: 1.2578, test_f1: 0.6819
 epoch: 67, train_loss: 0.2383, test_loss: 1.3020, test_f1: 0.6820
 epoch: 68, train_loss: 0.2723, test_loss: 1.3095, test_f1: 0.6712
 epoch: 69, train_loss: 0.2518, test_loss: 1.2281, test_f1: 0.6500
 epoch: 70, train_loss: 0.2485, test_loss: 1.3012, test_f1: 0.6721
 epoch: 71, train_loss: 0.2406, test_loss: 1.3156, test_f1: 0.6651
 epoch: 72, train_loss: 0.2306, test_loss: 1.3084, test_f1: 0.6823
 epoch: 73, train_loss: 0.2327, test_loss: 1.2942, test_f1: 0.6599
 epoch: 74, train_loss: 0.2305, test_loss: 1.2570, test_f1: 0.6713
 epoch: 75, train_loss: 0.2399, test_loss: 1.3874, test_f1: 0.6626
 epoch: 76, train_loss: 0.2213, test_loss: 1.4846, test_f1: 0.6612
 epoch: 77, train_loss: 0.2300, test_loss: 1.3884, test_f1: 0.6796
 epoch: 78, train_loss: 0.2248, test_loss: 1.3603, test_f1: 0.6872
 epoch: 79, train_loss: 0.2019, test_loss: 1.3767, test_f1: 0.6667
 epoch: 80, train_loss: 0.2203, test_loss: 1.3829, test_f1: 0.6726
 epoch: 81, train_loss: 0.2221, test_loss: 1.4266, test_f1: 0.6760
 epoch: 82, train_loss: 0.2168, test_loss: 1.4409, test_f1: 0.6709
 epoch: 83, train_loss: 0.2280, test_loss: 1.4320, test_f1: 0.6724
 epoch: 84, train_loss: 0.2098, test_loss: 1.4947, test_f1: 0.6723
 epoch: 85, train_loss: 0.1880, test_loss: 1.4311, test_f1: 0.6678
 epoch: 86, train_loss: 0.1982, test_loss: 1.5791, test_f1: 0.6788
 epoch: 87, train_loss: 0.2085, test_loss: 1.4496, test_f1: 0.6743
 epoch: 88, train_loss: 0.2035, test_loss: 1.5101, test_f1: 0.6670
 epoch: 89, train_loss: 0.1949, test_loss: 1.5648, test_f1: 0.6782
 epoch: 90, train_loss: 0.1900, test_loss: 1.5232, test_f1: 0.6718
 epoch: 91, train_loss: 0.2098, test_loss: 1.4832, test_f1: 0.6937
 epoch: 92, train_loss: 0.1915, test_loss: 1.3717, test_f1: 0.6862
 epoch: 93, train_loss: 0.1848, test_loss: 1.5408, test_f1: 0.6765
 epoch: 94, train_loss: 0.1864, test_loss: 1.4633, test_f1: 0.6762
 epoch: 95, train_loss: 0.1796, test_loss: 1.5331, test_f1: 0.6916
 epoch: 96, train_loss: 0.1802, test_loss: 1.5136, test_f1: 0.6783
 epoch: 97, train_loss: 0.1906, test_loss: 1.4068, test_f1: 0.6702
 epoch: 98, train_loss: 0.1833, test_loss: 1.5745, test_f1: 0.6712
 epoch: 99, train_loss: 0.1850, test_loss: 1.5547, test_f1: 0.6860

Training completed in 598.89 seconds
Best F1: 0.7202 at epoch 45
Mean F1 across iterations: 0.7037  0.0098
========================FINAL RESULTS================================
FEGIN weighted F1: 0.7202  0.0098
python main.py --data ltspice_examples --representation component_pin_net --model FEGIN --layers 2 --hiddens 128 --batch_size 64 --lr 0.001 --emb_size 128 --epochs 100 --save_appendix component_pin_net_L2_H128_BS64_LR0.001_E128 --no_val
-----



STDERR:
  File "main.py", line 370, in <module>
    main()
  File "main.py", line 254, in main
    dataset = dataset_class(
  File "/home/philip/projects/ltspice_examples_code_repo/Circuit-Completion-Using-GNNs/component_classification_with_link_prediction_head/evaluation/FEGIN/kernel/circuit_datasets.py", line 15, in __init__
    self.data, self.slices = torch.load(self.processed_paths[0])
  File "/home/philip/.local/lib/python3.8/site-packages/torch/serialization.py", line 1040, in load
    warnings.warn(
  File "/usr/lib/python3.8/warnings.py", line 109, in _showwarnmsg
    sw(msg.message, msg.category, msg.filename, msg.lineno,
  File "main.py", line 47, in warn_with_traceback
    traceback.print_stack(file=log)
/home/philip/projects/ltspice_examples_code_repo/Circuit-Completion-Using-GNNs/component_classification_with_link_prediction_head/evaluation/FEGIN/kernel/circuit_datasets.py:15: FutureWarning: You are using `torch.load` with `weights_only=False` (the current default value), which uses the default pickle module implicitly. It is possible to construct malicious pickle data which will execute arbitrary code during unpickling (See https://github.com/pytorch/pytorch/blob/main/SECURITY.md#untrusted-models for more details). In a future release, the default value for `weights_only` will be flipped to `True`. This limits the functions that could be executed during unpickling. Arbitrary objects will no longer be allowed to be loaded via this mode unless they are explicitly allowlisted by the user via `torch.serialization.add_safe_globals`. We recommend you start setting `weights_only=True` for any use case where you don't have full control of the loaded file. Please open an issue on GitHub for any issues related to this experimental feature.
  self.data, self.slices = torch.load(self.processed_paths[0])
