STDOUT:
Results will be saved in /home/philip/projects/ltspice_examples_code_repo/Circuit-Completion-Using-GNNs/component_classification_with_link_prediction_head/evaluation/FEGIN/results/model_FEGIN_dataset_ltspice_examples
Command line input: python main.py --data ltspice_examples --representation component_component --model FEGIN --layers 4 --hiddens 64 --batch_size 64 --lr 0.0001 --emb_size 250 --epochs 100 --save_appendix component_component_L4_H64_BS64_LR0.0001_E250 --no_val
 is saved.
-----
ltspice_examples - FEGIN
Using 4 layers, 64 hidden units, h = 2
Loading component_component representation dataset
ENTERED
Training FEGIN on component_component representation
Train: 3556, Test: 845
##################ITERATION #0 ****************************************
 epoch: 0, train_loss: 1.3625, test_loss: 1.3549, test_f1: 0.2274
 epoch: 1, train_loss: 1.3369, test_loss: 1.3302, test_f1: 0.2274
 epoch: 2, train_loss: 1.3116, test_loss: 1.2984, test_f1: 0.2274
 epoch: 3, train_loss: 1.2821, test_loss: 1.2715, test_f1: 0.2274
 epoch: 4, train_loss: 1.2661, test_loss: 1.2491, test_f1: 0.2274
 epoch: 5, train_loss: 1.2525, test_loss: 1.2305, test_f1: 0.2274
 epoch: 6, train_loss: 1.2358, test_loss: 1.2158, test_f1: 0.2274
 epoch: 7, train_loss: 1.2252, test_loss: 1.1988, test_f1: 0.2685
 epoch: 8, train_loss: 1.2138, test_loss: 1.1873, test_f1: 0.3344
 epoch: 9, train_loss: 1.2000, test_loss: 1.1704, test_f1: 0.3590
 epoch: 10, train_loss: 1.1895, test_loss: 1.1507, test_f1: 0.3741
 epoch: 11, train_loss: 1.1731, test_loss: 1.1375, test_f1: 0.3837
 epoch: 12, train_loss: 1.1587, test_loss: 1.1217, test_f1: 0.3853
 epoch: 13, train_loss: 1.1444, test_loss: 1.1082, test_f1: 0.3861
 epoch: 14, train_loss: 1.1355, test_loss: 1.0939, test_f1: 0.3953
 epoch: 15, train_loss: 1.1228, test_loss: 1.0838, test_f1: 0.3947
 epoch: 16, train_loss: 1.1104, test_loss: 1.0716, test_f1: 0.4554
 epoch: 17, train_loss: 1.1023, test_loss: 1.0701, test_f1: 0.4725
 epoch: 18, train_loss: 1.0917, test_loss: 1.0598, test_f1: 0.4657
 epoch: 19, train_loss: 1.0772, test_loss: 1.0549, test_f1: 0.4664
 epoch: 20, train_loss: 1.0724, test_loss: 1.0502, test_f1: 0.4695
 epoch: 21, train_loss: 1.0643, test_loss: 1.0456, test_f1: 0.4604
 epoch: 22, train_loss: 1.0609, test_loss: 1.0329, test_f1: 0.4737
 epoch: 23, train_loss: 1.0477, test_loss: 1.0190, test_f1: 0.4732
 epoch: 24, train_loss: 1.0386, test_loss: 1.0367, test_f1: 0.4704
 epoch: 25, train_loss: 1.0400, test_loss: 1.0223, test_f1: 0.4867
 epoch: 26, train_loss: 1.0216, test_loss: 1.0355, test_f1: 0.4726
 epoch: 27, train_loss: 1.0181, test_loss: 1.0300, test_f1: 0.4670
 epoch: 28, train_loss: 1.0174, test_loss: 1.0181, test_f1: 0.4751
 epoch: 29, train_loss: 1.0111, test_loss: 1.0096, test_f1: 0.4794
 epoch: 30, train_loss: 0.9995, test_loss: 1.0221, test_f1: 0.4689
 epoch: 31, train_loss: 0.9937, test_loss: 1.0064, test_f1: 0.4864
 epoch: 32, train_loss: 0.9938, test_loss: 1.0175, test_f1: 0.4735
 epoch: 33, train_loss: 0.9877, test_loss: 1.0247, test_f1: 0.4675
 epoch: 34, train_loss: 0.9874, test_loss: 1.0103, test_f1: 0.4727
 epoch: 35, train_loss: 0.9813, test_loss: 1.0067, test_f1: 0.4840
 epoch: 36, train_loss: 0.9731, test_loss: 1.0036, test_f1: 0.4771
 epoch: 37, train_loss: 0.9783, test_loss: 1.0094, test_f1: 0.4716
 epoch: 38, train_loss: 0.9671, test_loss: 0.9939, test_f1: 0.4855
 epoch: 39, train_loss: 0.9572, test_loss: 1.0024, test_f1: 0.4757
 epoch: 40, train_loss: 0.9672, test_loss: 1.0074, test_f1: 0.4870
 epoch: 41, train_loss: 0.9678, test_loss: 1.0077, test_f1: 0.4781
 epoch: 42, train_loss: 0.9560, test_loss: 1.0120, test_f1: 0.4972
 epoch: 43, train_loss: 0.9400, test_loss: 1.0322, test_f1: 0.4857
 epoch: 44, train_loss: 0.9457, test_loss: 1.0058, test_f1: 0.4870
 epoch: 45, train_loss: 0.9381, test_loss: 1.0111, test_f1: 0.4699
 epoch: 46, train_loss: 0.9466, test_loss: 1.0064, test_f1: 0.4830
 epoch: 47, train_loss: 0.9414, test_loss: 1.0154, test_f1: 0.4779
 epoch: 48, train_loss: 0.9334, test_loss: 1.0196, test_f1: 0.4648
 epoch: 49, train_loss: 0.9240, test_loss: 1.0159, test_f1: 0.4681
 epoch: 50, train_loss: 0.9275, test_loss: 1.0165, test_f1: 0.4664
 epoch: 51, train_loss: 0.9243, test_loss: 1.0040, test_f1: 0.4750
 epoch: 52, train_loss: 0.9161, test_loss: 1.0143, test_f1: 0.4782
 epoch: 53, train_loss: 0.9204, test_loss: 1.0190, test_f1: 0.4689
 epoch: 54, train_loss: 0.9154, test_loss: 1.0197, test_f1: 0.4635
 epoch: 55, train_loss: 0.9055, test_loss: 1.0351, test_f1: 0.4611
 epoch: 56, train_loss: 0.9031, test_loss: 1.0339, test_f1: 0.4682
 epoch: 57, train_loss: 0.9040, test_loss: 1.0414, test_f1: 0.4525
 epoch: 58, train_loss: 0.9120, test_loss: 1.0386, test_f1: 0.4547
 epoch: 59, train_loss: 0.8974, test_loss: 1.0539, test_f1: 0.4626
 epoch: 60, train_loss: 0.9149, test_loss: 1.0177, test_f1: 0.4631
 epoch: 61, train_loss: 0.8906, test_loss: 1.0552, test_f1: 0.4553
 epoch: 62, train_loss: 0.9023, test_loss: 1.0428, test_f1: 0.4702
 epoch: 63, train_loss: 0.9006, test_loss: 1.0179, test_f1: 0.4677
 epoch: 64, train_loss: 0.9171, test_loss: 1.0121, test_f1: 0.4650
 epoch: 65, train_loss: 0.8911, test_loss: 1.0290, test_f1: 0.4718
 epoch: 66, train_loss: 0.8982, test_loss: 1.0193, test_f1: 0.4610
 epoch: 67, train_loss: 0.8958, test_loss: 1.0321, test_f1: 0.4561
 epoch: 68, train_loss: 0.8841, test_loss: 1.0364, test_f1: 0.4657
 epoch: 69, train_loss: 0.8949, test_loss: 1.0475, test_f1: 0.4662
 epoch: 70, train_loss: 0.8761, test_loss: 1.0270, test_f1: 0.4525
 epoch: 71, train_loss: 0.8832, test_loss: 1.0483, test_f1: 0.4566
 epoch: 72, train_loss: 0.8785, test_loss: 1.0368, test_f1: 0.4533
 epoch: 73, train_loss: 0.8903, test_loss: 1.0285, test_f1: 0.4487
 epoch: 74, train_loss: 0.8754, test_loss: 1.0375, test_f1: 0.4536
 epoch: 75, train_loss: 0.8866, test_loss: 1.0429, test_f1: 0.4627
 epoch: 76, train_loss: 0.8730, test_loss: 1.0360, test_f1: 0.4643
 epoch: 77, train_loss: 0.8833, test_loss: 1.0617, test_f1: 0.4528
 epoch: 78, train_loss: 0.8839, test_loss: 1.0386, test_f1: 0.4625
 epoch: 79, train_loss: 0.8749, test_loss: 1.0523, test_f1: 0.4631
 epoch: 80, train_loss: 0.8694, test_loss: 1.0660, test_f1: 0.4557
 epoch: 81, train_loss: 0.8809, test_loss: 1.0865, test_f1: 0.4574
 epoch: 82, train_loss: 0.8756, test_loss: 1.0275, test_f1: 0.4628
 epoch: 83, train_loss: 0.8676, test_loss: 1.0686, test_f1: 0.4699
 epoch: 84, train_loss: 0.8689, test_loss: 1.0581, test_f1: 0.4518
 epoch: 85, train_loss: 0.8591, test_loss: 1.0750, test_f1: 0.4619
 epoch: 86, train_loss: 0.8599, test_loss: 1.0731, test_f1: 0.4505
 epoch: 87, train_loss: 0.8786, test_loss: 1.0354, test_f1: 0.4464
 epoch: 88, train_loss: 0.8628, test_loss: 1.0484, test_f1: 0.4553
 epoch: 89, train_loss: 0.8615, test_loss: 1.0506, test_f1: 0.4479
 epoch: 90, train_loss: 0.8598, test_loss: 1.0304, test_f1: 0.4531
 epoch: 91, train_loss: 0.8642, test_loss: 1.0445, test_f1: 0.4625
 epoch: 92, train_loss: 0.8485, test_loss: 1.0520, test_f1: 0.4465
 epoch: 93, train_loss: 0.8569, test_loss: 1.0307, test_f1: 0.4557
 epoch: 94, train_loss: 0.8589, test_loss: 1.0425, test_f1: 0.4707
 epoch: 95, train_loss: 0.8625, test_loss: 1.0587, test_f1: 0.4565
 epoch: 96, train_loss: 0.8763, test_loss: 1.0539, test_f1: 0.4597
 epoch: 97, train_loss: 0.8617, test_loss: 1.0147, test_f1: 0.4669
 epoch: 98, train_loss: 0.8576, test_loss: 1.0634, test_f1: 0.4591
 epoch: 99, train_loss: 0.8390, test_loss: 1.0824, test_f1: 0.4512
##################ITERATION #1 ****************************************
 epoch: 0, train_loss: 1.3494, test_loss: 1.3009, test_f1: 0.2452
 epoch: 1, train_loss: 1.2837, test_loss: 1.2547, test_f1: 0.2621
 epoch: 2, train_loss: 1.2542, test_loss: 1.2262, test_f1: 0.3217
 epoch: 3, train_loss: 1.2324, test_loss: 1.2036, test_f1: 0.3519
 epoch: 4, train_loss: 1.2145, test_loss: 1.1855, test_f1: 0.3834
 epoch: 5, train_loss: 1.1969, test_loss: 1.1684, test_f1: 0.4105
 epoch: 6, train_loss: 1.1915, test_loss: 1.1528, test_f1: 0.4150
 epoch: 7, train_loss: 1.1723, test_loss: 1.1368, test_f1: 0.4254
 epoch: 8, train_loss: 1.1657, test_loss: 1.1268, test_f1: 0.4314
 epoch: 9, train_loss: 1.1533, test_loss: 1.1129, test_f1: 0.4425
 epoch: 10, train_loss: 1.1437, test_loss: 1.1067, test_f1: 0.4321
 epoch: 11, train_loss: 1.1293, test_loss: 1.0971, test_f1: 0.4463
 epoch: 12, train_loss: 1.1207, test_loss: 1.0894, test_f1: 0.4474
 epoch: 13, train_loss: 1.1134, test_loss: 1.0776, test_f1: 0.4578
 epoch: 14, train_loss: 1.1044, test_loss: 1.0731, test_f1: 0.4636
 epoch: 15, train_loss: 1.1000, test_loss: 1.0736, test_f1: 0.4600
 epoch: 16, train_loss: 1.0922, test_loss: 1.0664, test_f1: 0.4444
 epoch: 17, train_loss: 1.0861, test_loss: 1.0627, test_f1: 0.4551
 epoch: 18, train_loss: 1.0804, test_loss: 1.0696, test_f1: 0.4530
 epoch: 19, train_loss: 1.0742, test_loss: 1.0639, test_f1: 0.4551
 epoch: 20, train_loss: 1.0656, test_loss: 1.0489, test_f1: 0.4619
 epoch: 21, train_loss: 1.0633, test_loss: 1.0478, test_f1: 0.4696
 epoch: 22, train_loss: 1.0501, test_loss: 1.0470, test_f1: 0.4559
 epoch: 23, train_loss: 1.0492, test_loss: 1.0361, test_f1: 0.4801
 epoch: 24, train_loss: 1.0408, test_loss: 1.0356, test_f1: 0.4593
 epoch: 25, train_loss: 1.0447, test_loss: 1.0264, test_f1: 0.4637
 epoch: 26, train_loss: 1.0386, test_loss: 1.0432, test_f1: 0.4597
 epoch: 27, train_loss: 1.0210, test_loss: 1.0422, test_f1: 0.4546
 epoch: 28, train_loss: 1.0158, test_loss: 1.0303, test_f1: 0.4645
 epoch: 29, train_loss: 1.0197, test_loss: 1.0238, test_f1: 0.4679
 epoch: 30, train_loss: 1.0075, test_loss: 1.0160, test_f1: 0.4850
 epoch: 31, train_loss: 1.0109, test_loss: 1.0022, test_f1: 0.4891
 epoch: 32, train_loss: 1.0008, test_loss: 1.0112, test_f1: 0.4640
 epoch: 33, train_loss: 0.9876, test_loss: 0.9999, test_f1: 0.4849
 epoch: 34, train_loss: 0.9939, test_loss: 1.0322, test_f1: 0.4565
 epoch: 35, train_loss: 0.9840, test_loss: 1.0090, test_f1: 0.4627
 epoch: 36, train_loss: 0.9719, test_loss: 1.0168, test_f1: 0.4835
 epoch: 37, train_loss: 0.9582, test_loss: 0.9819, test_f1: 0.5007
 epoch: 38, train_loss: 0.9588, test_loss: 0.9865, test_f1: 0.4890
 epoch: 39, train_loss: 0.9603, test_loss: 0.9884, test_f1: 0.5003
 epoch: 40, train_loss: 0.9450, test_loss: 0.9853, test_f1: 0.4929
 epoch: 41, train_loss: 0.9460, test_loss: 1.0307, test_f1: 0.4680
 epoch: 42, train_loss: 0.9412, test_loss: 0.9923, test_f1: 0.4770
 epoch: 43, train_loss: 0.9381, test_loss: 1.0077, test_f1: 0.4747
 epoch: 44, train_loss: 0.9417, test_loss: 0.9962, test_f1: 0.4767
 epoch: 45, train_loss: 0.9380, test_loss: 0.9909, test_f1: 0.4828
 epoch: 46, train_loss: 0.9222, test_loss: 1.0320, test_f1: 0.4830
 epoch: 47, train_loss: 0.9263, test_loss: 0.9830, test_f1: 0.4991
 epoch: 48, train_loss: 0.9228, test_loss: 1.0094, test_f1: 0.5070
 epoch: 49, train_loss: 0.9088, test_loss: 1.0000, test_f1: 0.4866
 epoch: 50, train_loss: 0.8958, test_loss: 1.0113, test_f1: 0.4752
 epoch: 51, train_loss: 0.8978, test_loss: 0.9953, test_f1: 0.4905
 epoch: 52, train_loss: 0.9015, test_loss: 0.9868, test_f1: 0.5049
 epoch: 53, train_loss: 0.8946, test_loss: 0.9908, test_f1: 0.4867
 epoch: 54, train_loss: 0.8759, test_loss: 1.0088, test_f1: 0.4816
 epoch: 55, train_loss: 0.8857, test_loss: 0.9855, test_f1: 0.5009
 epoch: 56, train_loss: 0.8813, test_loss: 0.9866, test_f1: 0.4982
 epoch: 57, train_loss: 0.8844, test_loss: 0.9728, test_f1: 0.5038
 epoch: 58, train_loss: 0.8782, test_loss: 0.9719, test_f1: 0.4949
 epoch: 59, train_loss: 0.8767, test_loss: 0.9665, test_f1: 0.5083
 epoch: 60, train_loss: 0.8783, test_loss: 0.9614, test_f1: 0.4990
 epoch: 61, train_loss: 0.8765, test_loss: 0.9700, test_f1: 0.5019
 epoch: 62, train_loss: 0.8780, test_loss: 0.9761, test_f1: 0.5079
 epoch: 63, train_loss: 0.8557, test_loss: 0.9758, test_f1: 0.5040
 epoch: 64, train_loss: 0.8628, test_loss: 0.9670, test_f1: 0.5010
 epoch: 65, train_loss: 0.8697, test_loss: 0.9882, test_f1: 0.5008
 epoch: 66, train_loss: 0.8616, test_loss: 0.9655, test_f1: 0.5085
 epoch: 67, train_loss: 0.8663, test_loss: 0.9831, test_f1: 0.5011
 epoch: 68, train_loss: 0.8593, test_loss: 0.9735, test_f1: 0.5094
 epoch: 69, train_loss: 0.8563, test_loss: 0.9687, test_f1: 0.5021
 epoch: 70, train_loss: 0.8436, test_loss: 0.9818, test_f1: 0.5047
 epoch: 71, train_loss: 0.8616, test_loss: 0.9862, test_f1: 0.5045
 epoch: 72, train_loss: 0.8478, test_loss: 0.9831, test_f1: 0.5021
 epoch: 73, train_loss: 0.8426, test_loss: 0.9831, test_f1: 0.5001
 epoch: 74, train_loss: 0.8450, test_loss: 0.9986, test_f1: 0.4875
 epoch: 75, train_loss: 0.8401, test_loss: 1.0099, test_f1: 0.4951
 epoch: 76, train_loss: 0.8331, test_loss: 1.0025, test_f1: 0.5028
 epoch: 77, train_loss: 0.8389, test_loss: 0.9913, test_f1: 0.4949
 epoch: 78, train_loss: 0.8327, test_loss: 0.9940, test_f1: 0.5082
 epoch: 79, train_loss: 0.8334, test_loss: 0.9578, test_f1: 0.5107
 epoch: 80, train_loss: 0.8387, test_loss: 0.9675, test_f1: 0.5155
 epoch: 81, train_loss: 0.8309, test_loss: 0.9916, test_f1: 0.5093
 epoch: 82, train_loss: 0.8249, test_loss: 1.0018, test_f1: 0.4926
 epoch: 83, train_loss: 0.8213, test_loss: 0.9853, test_f1: 0.4965
 epoch: 84, train_loss: 0.8344, test_loss: 0.9787, test_f1: 0.5055
 epoch: 85, train_loss: 0.8129, test_loss: 0.9714, test_f1: 0.5103
 epoch: 86, train_loss: 0.8146, test_loss: 0.9851, test_f1: 0.5126
 epoch: 87, train_loss: 0.8136, test_loss: 0.9950, test_f1: 0.5076
 epoch: 88, train_loss: 0.8272, test_loss: 0.9751, test_f1: 0.5061
 epoch: 89, train_loss: 0.8178, test_loss: 0.9729, test_f1: 0.5151
 epoch: 90, train_loss: 0.8201, test_loss: 1.0023, test_f1: 0.4961
 epoch: 91, train_loss: 0.8114, test_loss: 0.9863, test_f1: 0.5129
 epoch: 92, train_loss: 0.7972, test_loss: 0.9732, test_f1: 0.5251
 epoch: 93, train_loss: 0.8146, test_loss: 0.9817, test_f1: 0.5039
 epoch: 94, train_loss: 0.8081, test_loss: 0.9853, test_f1: 0.5160
 epoch: 95, train_loss: 0.8128, test_loss: 0.9813, test_f1: 0.5132
 epoch: 96, train_loss: 0.8092, test_loss: 0.9936, test_f1: 0.5106
 epoch: 97, train_loss: 0.8062, test_loss: 1.0061, test_f1: 0.5084
 epoch: 98, train_loss: 0.8060, test_loss: 0.9895, test_f1: 0.5232
 epoch: 99, train_loss: 0.8091, test_loss: 1.0126, test_f1: 0.5024
##################ITERATION #2 ****************************************
 epoch: 0, train_loss: 1.3160, test_loss: 1.2970, test_f1: 0.3060
 epoch: 1, train_loss: 1.2576, test_loss: 1.2382, test_f1: 0.3183
 epoch: 2, train_loss: 1.2346, test_loss: 1.2185, test_f1: 0.3423
 epoch: 3, train_loss: 1.2198, test_loss: 1.1977, test_f1: 0.3746
 epoch: 4, train_loss: 1.2092, test_loss: 1.1792, test_f1: 0.3865
 epoch: 5, train_loss: 1.1992, test_loss: 1.1637, test_f1: 0.3971
 epoch: 6, train_loss: 1.1860, test_loss: 1.1528, test_f1: 0.4150
 epoch: 7, train_loss: 1.1742, test_loss: 1.1430, test_f1: 0.4127
 epoch: 8, train_loss: 1.1589, test_loss: 1.1339, test_f1: 0.4249
 epoch: 9, train_loss: 1.1545, test_loss: 1.1176, test_f1: 0.4117
 epoch: 10, train_loss: 1.1409, test_loss: 1.1145, test_f1: 0.4115
 epoch: 11, train_loss: 1.1275, test_loss: 1.0980, test_f1: 0.4255
 epoch: 12, train_loss: 1.1237, test_loss: 1.0857, test_f1: 0.4436
 epoch: 13, train_loss: 1.1091, test_loss: 1.0822, test_f1: 0.4268
 epoch: 14, train_loss: 1.1024, test_loss: 1.0656, test_f1: 0.4321
 epoch: 15, train_loss: 1.0923, test_loss: 1.0637, test_f1: 0.4284
 epoch: 16, train_loss: 1.0879, test_loss: 1.0504, test_f1: 0.4277
 epoch: 17, train_loss: 1.0735, test_loss: 1.0531, test_f1: 0.4403
 epoch: 18, train_loss: 1.0663, test_loss: 1.0288, test_f1: 0.4602
 epoch: 19, train_loss: 1.0522, test_loss: 1.0281, test_f1: 0.4570
 epoch: 20, train_loss: 1.0512, test_loss: 1.0270, test_f1: 0.4673
 epoch: 21, train_loss: 1.0408, test_loss: 1.0115, test_f1: 0.4499
 epoch: 22, train_loss: 1.0350, test_loss: 1.0102, test_f1: 0.4644
 epoch: 23, train_loss: 1.0161, test_loss: 1.0062, test_f1: 0.4536
 epoch: 24, train_loss: 1.0137, test_loss: 0.9968, test_f1: 0.4436
 epoch: 25, train_loss: 1.0117, test_loss: 0.9932, test_f1: 0.4410
 epoch: 26, train_loss: 1.0075, test_loss: 0.9827, test_f1: 0.4480
 epoch: 27, train_loss: 0.9928, test_loss: 0.9833, test_f1: 0.4514
 epoch: 28, train_loss: 0.9903, test_loss: 0.9896, test_f1: 0.4505
 epoch: 29, train_loss: 0.9808, test_loss: 0.9864, test_f1: 0.4552
 epoch: 30, train_loss: 0.9780, test_loss: 0.9923, test_f1: 0.4454
 epoch: 31, train_loss: 0.9701, test_loss: 0.9778, test_f1: 0.4544
 epoch: 32, train_loss: 0.9599, test_loss: 0.9885, test_f1: 0.4619
 epoch: 33, train_loss: 0.9677, test_loss: 0.9744, test_f1: 0.4547
 epoch: 34, train_loss: 0.9534, test_loss: 0.9750, test_f1: 0.4546
 epoch: 35, train_loss: 0.9442, test_loss: 0.9712, test_f1: 0.4719
 epoch: 36, train_loss: 0.9430, test_loss: 0.9835, test_f1: 0.4483
 epoch: 37, train_loss: 0.9443, test_loss: 0.9905, test_f1: 0.4420
 epoch: 38, train_loss: 0.9417, test_loss: 0.9643, test_f1: 0.4690
 epoch: 39, train_loss: 0.9389, test_loss: 0.9615, test_f1: 0.4765
 epoch: 40, train_loss: 0.9225, test_loss: 0.9601, test_f1: 0.4777
 epoch: 41, train_loss: 0.9204, test_loss: 0.9702, test_f1: 0.4640
 epoch: 42, train_loss: 0.9172, test_loss: 0.9520, test_f1: 0.4810
 epoch: 43, train_loss: 0.9089, test_loss: 0.9658, test_f1: 0.4746
 epoch: 44, train_loss: 0.9056, test_loss: 0.9573, test_f1: 0.4874
 epoch: 45, train_loss: 0.9010, test_loss: 0.9619, test_f1: 0.4828
 epoch: 46, train_loss: 0.9047, test_loss: 0.9652, test_f1: 0.4784
 epoch: 47, train_loss: 0.9010, test_loss: 0.9876, test_f1: 0.4934
 epoch: 48, train_loss: 0.8985, test_loss: 0.9572, test_f1: 0.4918
 epoch: 49, train_loss: 0.8895, test_loss: 0.9615, test_f1: 0.4968
 epoch: 50, train_loss: 0.8854, test_loss: 0.9414, test_f1: 0.5078
 epoch: 51, train_loss: 0.8750, test_loss: 0.9583, test_f1: 0.4911
 epoch: 52, train_loss: 0.8826, test_loss: 0.9504, test_f1: 0.4960
 epoch: 53, train_loss: 0.8678, test_loss: 0.9550, test_f1: 0.4845
 epoch: 54, train_loss: 0.8703, test_loss: 0.9537, test_f1: 0.5034
 epoch: 55, train_loss: 0.8660, test_loss: 0.9652, test_f1: 0.4809
 epoch: 56, train_loss: 0.8711, test_loss: 0.9571, test_f1: 0.5052
 epoch: 57, train_loss: 0.8565, test_loss: 0.9672, test_f1: 0.4871
 epoch: 58, train_loss: 0.8746, test_loss: 0.9628, test_f1: 0.5107
 epoch: 59, train_loss: 0.8540, test_loss: 0.9489, test_f1: 0.5000
 epoch: 60, train_loss: 0.8613, test_loss: 0.9695, test_f1: 0.4983
 epoch: 61, train_loss: 0.8559, test_loss: 0.9588, test_f1: 0.5037
 epoch: 62, train_loss: 0.8537, test_loss: 0.9770, test_f1: 0.4918
 epoch: 63, train_loss: 0.8511, test_loss: 0.9546, test_f1: 0.4963
 epoch: 64, train_loss: 0.8506, test_loss: 0.9618, test_f1: 0.5036
 epoch: 65, train_loss: 0.8514, test_loss: 0.9624, test_f1: 0.5157
 epoch: 66, train_loss: 0.8296, test_loss: 0.9610, test_f1: 0.5059
 epoch: 67, train_loss: 0.8414, test_loss: 0.9785, test_f1: 0.5034
 epoch: 68, train_loss: 0.8456, test_loss: 0.9573, test_f1: 0.5103
 epoch: 69, train_loss: 0.8434, test_loss: 0.9641, test_f1: 0.5000
 epoch: 70, train_loss: 0.8350, test_loss: 0.9735, test_f1: 0.5162
 epoch: 71, train_loss: 0.8431, test_loss: 0.9669, test_f1: 0.5107
 epoch: 72, train_loss: 0.8276, test_loss: 0.9496, test_f1: 0.5122
 epoch: 73, train_loss: 0.8232, test_loss: 0.9817, test_f1: 0.5126
 epoch: 74, train_loss: 0.8299, test_loss: 0.9769, test_f1: 0.5000
 epoch: 75, train_loss: 0.8309, test_loss: 0.9685, test_f1: 0.5031
 epoch: 76, train_loss: 0.8288, test_loss: 0.9785, test_f1: 0.5115
 epoch: 77, train_loss: 0.8301, test_loss: 0.9840, test_f1: 0.5155
 epoch: 78, train_loss: 0.8238, test_loss: 0.9650, test_f1: 0.5160
 epoch: 79, train_loss: 0.8130, test_loss: 0.9847, test_f1: 0.5012
 epoch: 80, train_loss: 0.8214, test_loss: 0.9977, test_f1: 0.5151
 epoch: 81, train_loss: 0.8191, test_loss: 0.9852, test_f1: 0.5177
 epoch: 82, train_loss: 0.8195, test_loss: 0.9968, test_f1: 0.5095
 epoch: 83, train_loss: 0.8183, test_loss: 0.9841, test_f1: 0.5199
 epoch: 84, train_loss: 0.8174, test_loss: 0.9956, test_f1: 0.5092
 epoch: 85, train_loss: 0.8240, test_loss: 0.9969, test_f1: 0.4952
 epoch: 86, train_loss: 0.8176, test_loss: 0.9657, test_f1: 0.5172
 epoch: 87, train_loss: 0.8099, test_loss: 0.9925, test_f1: 0.4984
 epoch: 88, train_loss: 0.8086, test_loss: 0.9905, test_f1: 0.5049
 epoch: 89, train_loss: 0.8126, test_loss: 1.0146, test_f1: 0.5153
 epoch: 90, train_loss: 0.8080, test_loss: 0.9961, test_f1: 0.5078
 epoch: 91, train_loss: 0.8131, test_loss: 0.9997, test_f1: 0.5097
 epoch: 92, train_loss: 0.8023, test_loss: 1.0423, test_f1: 0.5015
 epoch: 93, train_loss: 0.8012, test_loss: 1.0012, test_f1: 0.5001
 epoch: 94, train_loss: 0.7997, test_loss: 0.9954, test_f1: 0.5003
 epoch: 95, train_loss: 0.7932, test_loss: 1.0093, test_f1: 0.4966
 epoch: 96, train_loss: 0.8196, test_loss: 1.0090, test_f1: 0.5037
 epoch: 97, train_loss: 0.7974, test_loss: 1.0267, test_f1: 0.4882
 epoch: 98, train_loss: 0.7914, test_loss: 1.0266, test_f1: 0.5142
 epoch: 99, train_loss: 0.8018, test_loss: 1.0099, test_f1: 0.5164
##################ITERATION #3 ****************************************
 epoch: 0, train_loss: 1.3074, test_loss: 1.2594, test_f1: 0.2819
 epoch: 1, train_loss: 1.2507, test_loss: 1.2194, test_f1: 0.3226
 epoch: 2, train_loss: 1.2321, test_loss: 1.1983, test_f1: 0.3575
 epoch: 3, train_loss: 1.2125, test_loss: 1.1854, test_f1: 0.3880
 epoch: 4, train_loss: 1.2039, test_loss: 1.1684, test_f1: 0.4090
 epoch: 5, train_loss: 1.1902, test_loss: 1.1556, test_f1: 0.4068
 epoch: 6, train_loss: 1.1721, test_loss: 1.1420, test_f1: 0.4273
 epoch: 7, train_loss: 1.1642, test_loss: 1.1369, test_f1: 0.4159
 epoch: 8, train_loss: 1.1571, test_loss: 1.1272, test_f1: 0.4168
 epoch: 9, train_loss: 1.1438, test_loss: 1.1233, test_f1: 0.4363
 epoch: 10, train_loss: 1.1401, test_loss: 1.1090, test_f1: 0.4263
 epoch: 11, train_loss: 1.1273, test_loss: 1.1061, test_f1: 0.4324
 epoch: 12, train_loss: 1.1179, test_loss: 1.0991, test_f1: 0.4337
 epoch: 13, train_loss: 1.1132, test_loss: 1.0937, test_f1: 0.4356
 epoch: 14, train_loss: 1.0979, test_loss: 1.0891, test_f1: 0.4464
 epoch: 15, train_loss: 1.0867, test_loss: 1.0749, test_f1: 0.4308
 epoch: 16, train_loss: 1.0844, test_loss: 1.0749, test_f1: 0.4574
 epoch: 17, train_loss: 1.0878, test_loss: 1.0669, test_f1: 0.4382
 epoch: 18, train_loss: 1.0598, test_loss: 1.0678, test_f1: 0.4483
 epoch: 19, train_loss: 1.0623, test_loss: 1.0665, test_f1: 0.4445
 epoch: 20, train_loss: 1.0595, test_loss: 1.0537, test_f1: 0.4684
 epoch: 21, train_loss: 1.0583, test_loss: 1.0569, test_f1: 0.4724
 epoch: 22, train_loss: 1.0407, test_loss: 1.0500, test_f1: 0.4697
 epoch: 23, train_loss: 1.0391, test_loss: 1.0537, test_f1: 0.4597
 epoch: 24, train_loss: 1.0352, test_loss: 1.0528, test_f1: 0.4810
 epoch: 25, train_loss: 1.0200, test_loss: 1.0572, test_f1: 0.4563
 epoch: 26, train_loss: 1.0237, test_loss: 1.0495, test_f1: 0.4646
 epoch: 27, train_loss: 1.0190, test_loss: 1.0493, test_f1: 0.4586
 epoch: 28, train_loss: 1.0156, test_loss: 1.0226, test_f1: 0.4980
 epoch: 29, train_loss: 1.0116, test_loss: 1.0464, test_f1: 0.4901
 epoch: 30, train_loss: 0.9958, test_loss: 1.0193, test_f1: 0.5046
 epoch: 31, train_loss: 0.9917, test_loss: 1.0255, test_f1: 0.4860
 epoch: 32, train_loss: 0.9815, test_loss: 1.0303, test_f1: 0.4924
 epoch: 33, train_loss: 0.9777, test_loss: 1.0328, test_f1: 0.4731
 epoch: 34, train_loss: 0.9635, test_loss: 1.0220, test_f1: 0.4968
 epoch: 35, train_loss: 0.9632, test_loss: 1.0385, test_f1: 0.4713
 epoch: 36, train_loss: 0.9615, test_loss: 1.0475, test_f1: 0.4850
 epoch: 37, train_loss: 0.9565, test_loss: 1.0354, test_f1: 0.4740
 epoch: 38, train_loss: 0.9551, test_loss: 1.0438, test_f1: 0.4789
 epoch: 39, train_loss: 0.9436, test_loss: 1.0457, test_f1: 0.4847
 epoch: 40, train_loss: 0.9334, test_loss: 1.0481, test_f1: 0.5066
 epoch: 41, train_loss: 0.9354, test_loss: 1.0606, test_f1: 0.4717
 epoch: 42, train_loss: 0.9391, test_loss: 1.0607, test_f1: 0.4832
 epoch: 43, train_loss: 0.9336, test_loss: 1.0672, test_f1: 0.4761
 epoch: 44, train_loss: 0.9289, test_loss: 1.0548, test_f1: 0.4884
 epoch: 45, train_loss: 0.9181, test_loss: 1.0510, test_f1: 0.4823
 epoch: 46, train_loss: 0.9130, test_loss: 1.0587, test_f1: 0.4831
 epoch: 47, train_loss: 0.9092, test_loss: 1.0563, test_f1: 0.4935
 epoch: 48, train_loss: 0.9087, test_loss: 1.0701, test_f1: 0.4956
 epoch: 49, train_loss: 0.9108, test_loss: 1.0665, test_f1: 0.4842
 epoch: 50, train_loss: 0.9040, test_loss: 1.0546, test_f1: 0.4954
 epoch: 51, train_loss: 0.8937, test_loss: 1.0632, test_f1: 0.5030
 epoch: 52, train_loss: 0.8858, test_loss: 1.0728, test_f1: 0.5045
 epoch: 53, train_loss: 0.8832, test_loss: 1.0681, test_f1: 0.5088
 epoch: 54, train_loss: 0.8998, test_loss: 1.0617, test_f1: 0.5035
 epoch: 55, train_loss: 0.8755, test_loss: 1.0514, test_f1: 0.5108
 epoch: 56, train_loss: 0.8746, test_loss: 1.0569, test_f1: 0.5106
 epoch: 57, train_loss: 0.8735, test_loss: 1.0618, test_f1: 0.5121
 epoch: 58, train_loss: 0.8719, test_loss: 1.0645, test_f1: 0.5099
 epoch: 59, train_loss: 0.8733, test_loss: 1.0663, test_f1: 0.5054
 epoch: 60, train_loss: 0.8691, test_loss: 1.0665, test_f1: 0.5037
 epoch: 61, train_loss: 0.8811, test_loss: 1.0607, test_f1: 0.5066
 epoch: 62, train_loss: 0.8657, test_loss: 1.0731, test_f1: 0.5049
 epoch: 63, train_loss: 0.8577, test_loss: 1.0618, test_f1: 0.5031
 epoch: 64, train_loss: 0.8698, test_loss: 1.0831, test_f1: 0.5141
 epoch: 65, train_loss: 0.8734, test_loss: 1.0815, test_f1: 0.5061
 epoch: 66, train_loss: 0.8594, test_loss: 1.0724, test_f1: 0.5093
 epoch: 67, train_loss: 0.8584, test_loss: 1.0635, test_f1: 0.5014
 epoch: 68, train_loss: 0.8734, test_loss: 1.0766, test_f1: 0.5055
 epoch: 69, train_loss: 0.8583, test_loss: 1.0702, test_f1: 0.5190
 epoch: 70, train_loss: 0.8472, test_loss: 1.0638, test_f1: 0.5029
 epoch: 71, train_loss: 0.8553, test_loss: 1.0844, test_f1: 0.5120
 epoch: 72, train_loss: 0.8467, test_loss: 1.0778, test_f1: 0.5141
 epoch: 73, train_loss: 0.8586, test_loss: 1.0563, test_f1: 0.5116
 epoch: 74, train_loss: 0.8455, test_loss: 1.0778, test_f1: 0.5020
 epoch: 75, train_loss: 0.8424, test_loss: 1.0768, test_f1: 0.5166
 epoch: 76, train_loss: 0.8522, test_loss: 1.0910, test_f1: 0.5062
 epoch: 77, train_loss: 0.8439, test_loss: 1.0738, test_f1: 0.5179
 epoch: 78, train_loss: 0.8426, test_loss: 1.0825, test_f1: 0.5114
 epoch: 79, train_loss: 0.8417, test_loss: 1.1076, test_f1: 0.5075
 epoch: 80, train_loss: 0.8328, test_loss: 1.0844, test_f1: 0.5094
 epoch: 81, train_loss: 0.8344, test_loss: 1.0852, test_f1: 0.5035
 epoch: 82, train_loss: 0.8346, test_loss: 1.0869, test_f1: 0.5167
 epoch: 83, train_loss: 0.8293, test_loss: 1.1225, test_f1: 0.5059
 epoch: 84, train_loss: 0.8391, test_loss: 1.0950, test_f1: 0.5150
 epoch: 85, train_loss: 0.8173, test_loss: 1.0919, test_f1: 0.5217
 epoch: 86, train_loss: 0.8363, test_loss: 1.0943, test_f1: 0.5058
 epoch: 87, train_loss: 0.8315, test_loss: 1.0782, test_f1: 0.5138
 epoch: 88, train_loss: 0.8207, test_loss: 1.0979, test_f1: 0.5132
 epoch: 89, train_loss: 0.8280, test_loss: 1.0878, test_f1: 0.5077
 epoch: 90, train_loss: 0.8272, test_loss: 1.1045, test_f1: 0.5140
 epoch: 91, train_loss: 0.8120, test_loss: 1.1027, test_f1: 0.5097
 epoch: 92, train_loss: 0.8232, test_loss: 1.1258, test_f1: 0.5168
 epoch: 93, train_loss: 0.8211, test_loss: 1.1096, test_f1: 0.5107
 epoch: 94, train_loss: 0.8173, test_loss: 1.1189, test_f1: 0.5103
 epoch: 95, train_loss: 0.8049, test_loss: 1.1155, test_f1: 0.5121
 epoch: 96, train_loss: 0.8169, test_loss: 1.0965, test_f1: 0.5210
 epoch: 97, train_loss: 0.8090, test_loss: 1.1064, test_f1: 0.5069
 epoch: 98, train_loss: 0.8025, test_loss: 1.0944, test_f1: 0.5114
 epoch: 99, train_loss: 0.8046, test_loss: 1.0915, test_f1: 0.5122
##################ITERATION #4 ****************************************
 epoch: 0, train_loss: 1.3081, test_loss: 1.2658, test_f1: 0.3176
 epoch: 1, train_loss: 1.2473, test_loss: 1.2196, test_f1: 0.3596
 epoch: 2, train_loss: 1.2300, test_loss: 1.2079, test_f1: 0.3625
 epoch: 3, train_loss: 1.2125, test_loss: 1.1945, test_f1: 0.4020
 epoch: 4, train_loss: 1.2061, test_loss: 1.1820, test_f1: 0.4070
 epoch: 5, train_loss: 1.1960, test_loss: 1.1644, test_f1: 0.4155
 epoch: 6, train_loss: 1.1917, test_loss: 1.1622, test_f1: 0.4006
 epoch: 7, train_loss: 1.1752, test_loss: 1.1521, test_f1: 0.4078
 epoch: 8, train_loss: 1.1700, test_loss: 1.1405, test_f1: 0.4150
 epoch: 9, train_loss: 1.1471, test_loss: 1.1288, test_f1: 0.4205
 epoch: 10, train_loss: 1.1586, test_loss: 1.1256, test_f1: 0.4302
 epoch: 11, train_loss: 1.1410, test_loss: 1.1204, test_f1: 0.4190
 epoch: 12, train_loss: 1.1368, test_loss: 1.1105, test_f1: 0.4211
 epoch: 13, train_loss: 1.1273, test_loss: 1.1094, test_f1: 0.4246
 epoch: 14, train_loss: 1.1168, test_loss: 1.0959, test_f1: 0.4385
 epoch: 15, train_loss: 1.1053, test_loss: 1.0891, test_f1: 0.4254
 epoch: 16, train_loss: 1.1156, test_loss: 1.0796, test_f1: 0.4277
 epoch: 17, train_loss: 1.1068, test_loss: 1.0801, test_f1: 0.4407
 epoch: 18, train_loss: 1.1042, test_loss: 1.0743, test_f1: 0.4422
 epoch: 19, train_loss: 1.0909, test_loss: 1.0605, test_f1: 0.4512
 epoch: 20, train_loss: 1.0833, test_loss: 1.0553, test_f1: 0.4529
 epoch: 21, train_loss: 1.0746, test_loss: 1.0584, test_f1: 0.4520
 epoch: 22, train_loss: 1.0653, test_loss: 1.0489, test_f1: 0.4470
 epoch: 23, train_loss: 1.0598, test_loss: 1.0355, test_f1: 0.4597
 epoch: 24, train_loss: 1.0599, test_loss: 1.0207, test_f1: 0.4624
 epoch: 25, train_loss: 1.0452, test_loss: 1.0233, test_f1: 0.4570
 epoch: 26, train_loss: 1.0422, test_loss: 1.0169, test_f1: 0.4728
 epoch: 27, train_loss: 1.0225, test_loss: 1.0056, test_f1: 0.4745
 epoch: 28, train_loss: 1.0273, test_loss: 1.0077, test_f1: 0.4759
 epoch: 29, train_loss: 1.0264, test_loss: 1.0004, test_f1: 0.4617
 epoch: 30, train_loss: 1.0216, test_loss: 1.0068, test_f1: 0.4510
 epoch: 31, train_loss: 1.0129, test_loss: 0.9965, test_f1: 0.4492
 epoch: 32, train_loss: 1.0086, test_loss: 0.9875, test_f1: 0.4676
 epoch: 33, train_loss: 1.0057, test_loss: 0.9873, test_f1: 0.4719
 epoch: 34, train_loss: 1.0021, test_loss: 0.9969, test_f1: 0.4473
 epoch: 35, train_loss: 0.9963, test_loss: 0.9796, test_f1: 0.4698
 epoch: 36, train_loss: 0.9791, test_loss: 0.9827, test_f1: 0.4594
 epoch: 37, train_loss: 0.9813, test_loss: 0.9872, test_f1: 0.4564
 epoch: 38, train_loss: 0.9823, test_loss: 0.9782, test_f1: 0.4699
 epoch: 39, train_loss: 0.9702, test_loss: 0.9911, test_f1: 0.4668
 epoch: 40, train_loss: 0.9655, test_loss: 0.9808, test_f1: 0.4608
 epoch: 41, train_loss: 0.9611, test_loss: 0.9947, test_f1: 0.4552
 epoch: 42, train_loss: 0.9602, test_loss: 0.9773, test_f1: 0.4843
 epoch: 43, train_loss: 0.9608, test_loss: 0.9787, test_f1: 0.4697
 epoch: 44, train_loss: 0.9511, test_loss: 0.9711, test_f1: 0.4829
 epoch: 45, train_loss: 0.9493, test_loss: 0.9820, test_f1: 0.4707
 epoch: 46, train_loss: 0.9400, test_loss: 0.9699, test_f1: 0.4789
 epoch: 47, train_loss: 0.9420, test_loss: 0.9826, test_f1: 0.4736
 epoch: 48, train_loss: 0.9487, test_loss: 0.9767, test_f1: 0.4713
 epoch: 49, train_loss: 0.9284, test_loss: 0.9731, test_f1: 0.4668
 epoch: 50, train_loss: 0.9241, test_loss: 0.9658, test_f1: 0.4899
 epoch: 51, train_loss: 0.9224, test_loss: 0.9850, test_f1: 0.4761
 epoch: 52, train_loss: 0.9047, test_loss: 0.9670, test_f1: 0.4762
 epoch: 53, train_loss: 0.9121, test_loss: 0.9700, test_f1: 0.4816
 epoch: 54, train_loss: 0.9059, test_loss: 0.9844, test_f1: 0.4886
 epoch: 55, train_loss: 0.9063, test_loss: 0.9725, test_f1: 0.4912
 epoch: 56, train_loss: 0.8990, test_loss: 1.0012, test_f1: 0.4817
 epoch: 57, train_loss: 0.9094, test_loss: 0.9744, test_f1: 0.4961
 epoch: 58, train_loss: 0.8866, test_loss: 1.0051, test_f1: 0.4712
 epoch: 59, train_loss: 0.9015, test_loss: 0.9759, test_f1: 0.4956
 epoch: 60, train_loss: 0.8904, test_loss: 0.9724, test_f1: 0.4898
 epoch: 61, train_loss: 0.8959, test_loss: 0.9859, test_f1: 0.4869
 epoch: 62, train_loss: 0.8984, test_loss: 0.9880, test_f1: 0.4933
 epoch: 63, train_loss: 0.8929, test_loss: 0.9862, test_f1: 0.5039
 epoch: 64, train_loss: 0.9028, test_loss: 0.9673, test_f1: 0.4986
 epoch: 65, train_loss: 0.8875, test_loss: 0.9831, test_f1: 0.4878
 epoch: 66, train_loss: 0.8672, test_loss: 0.9804, test_f1: 0.4788
 epoch: 67, train_loss: 0.8836, test_loss: 0.9812, test_f1: 0.4738
 epoch: 68, train_loss: 0.8805, test_loss: 1.0117, test_f1: 0.4727
 epoch: 69, train_loss: 0.8757, test_loss: 0.9944, test_f1: 0.4863
 epoch: 70, train_loss: 0.8750, test_loss: 0.9992, test_f1: 0.4960
 epoch: 71, train_loss: 0.8696, test_loss: 0.9850, test_f1: 0.4889
 epoch: 72, train_loss: 0.8652, test_loss: 0.9923, test_f1: 0.4986
 epoch: 73, train_loss: 0.8679, test_loss: 1.0109, test_f1: 0.4953
 epoch: 74, train_loss: 0.8755, test_loss: 1.0035, test_f1: 0.4966
 epoch: 75, train_loss: 0.8700, test_loss: 0.9985, test_f1: 0.4963
 epoch: 76, train_loss: 0.8649, test_loss: 1.0194, test_f1: 0.4859
 epoch: 77, train_loss: 0.8625, test_loss: 0.9922, test_f1: 0.4876
 epoch: 78, train_loss: 0.8689, test_loss: 1.0008, test_f1: 0.5029
 epoch: 79, train_loss: 0.8649, test_loss: 0.9973, test_f1: 0.5299
 epoch: 80, train_loss: 0.8648, test_loss: 0.9979, test_f1: 0.5005
 epoch: 81, train_loss: 0.8691, test_loss: 1.0037, test_f1: 0.4912
 epoch: 82, train_loss: 0.8507, test_loss: 1.0137, test_f1: 0.5070
 epoch: 83, train_loss: 0.8528, test_loss: 1.0369, test_f1: 0.5062
 epoch: 84, train_loss: 0.8587, test_loss: 1.0172, test_f1: 0.5147
 epoch: 85, train_loss: 0.8523, test_loss: 1.0305, test_f1: 0.4873
 epoch: 86, train_loss: 0.8460, test_loss: 1.0414, test_f1: 0.4861
 epoch: 87, train_loss: 0.8386, test_loss: 1.0053, test_f1: 0.5099
 epoch: 88, train_loss: 0.8515, test_loss: 1.0197, test_f1: 0.5055
 epoch: 89, train_loss: 0.8449, test_loss: 1.0202, test_f1: 0.5045
 epoch: 90, train_loss: 0.8392, test_loss: 0.9919, test_f1: 0.5066
 epoch: 91, train_loss: 0.8520, test_loss: 1.0295, test_f1: 0.5076
 epoch: 92, train_loss: 0.8350, test_loss: 1.0328, test_f1: 0.5019
 epoch: 93, train_loss: 0.8391, test_loss: 1.0230, test_f1: 0.5280
 epoch: 94, train_loss: 0.8243, test_loss: 1.0033, test_f1: 0.5118
 epoch: 95, train_loss: 0.8379, test_loss: 1.0356, test_f1: 0.5212
 epoch: 96, train_loss: 0.8292, test_loss: 1.0335, test_f1: 0.5238
 epoch: 97, train_loss: 0.8210, test_loss: 1.0583, test_f1: 0.5151
 epoch: 98, train_loss: 0.8324, test_loss: 1.0528, test_f1: 0.5187
 epoch: 99, train_loss: 0.8291, test_loss: 1.0374, test_f1: 0.5029
##################ITERATION #5 ****************************************
 epoch: 0, train_loss: 1.3076, test_loss: 1.2562, test_f1: 0.3212
 epoch: 1, train_loss: 1.2413, test_loss: 1.1881, test_f1: 0.4028
 epoch: 2, train_loss: 1.2183, test_loss: 1.1680, test_f1: 0.4091
 epoch: 3, train_loss: 1.2029, test_loss: 1.1566, test_f1: 0.4197
 epoch: 4, train_loss: 1.1887, test_loss: 1.1426, test_f1: 0.4159
 epoch: 5, train_loss: 1.1869, test_loss: 1.1308, test_f1: 0.4283
 epoch: 6, train_loss: 1.1682, test_loss: 1.1286, test_f1: 0.4280
 epoch: 7, train_loss: 1.1676, test_loss: 1.1236, test_f1: 0.4259
 epoch: 8, train_loss: 1.1485, test_loss: 1.1163, test_f1: 0.4517
 epoch: 9, train_loss: 1.1476, test_loss: 1.1154, test_f1: 0.4204
 epoch: 10, train_loss: 1.1402, test_loss: 1.1042, test_f1: 0.4484
 epoch: 11, train_loss: 1.1278, test_loss: 1.1029, test_f1: 0.4453
 epoch: 12, train_loss: 1.1273, test_loss: 1.0963, test_f1: 0.4298
 epoch: 13, train_loss: 1.1184, test_loss: 1.0869, test_f1: 0.4526
 epoch: 14, train_loss: 1.1047, test_loss: 1.0904, test_f1: 0.4358
 epoch: 15, train_loss: 1.1030, test_loss: 1.0798, test_f1: 0.4301
 epoch: 16, train_loss: 1.0994, test_loss: 1.0750, test_f1: 0.4320
 epoch: 17, train_loss: 1.0896, test_loss: 1.0635, test_f1: 0.4407
 epoch: 18, train_loss: 1.0909, test_loss: 1.0727, test_f1: 0.4309
 epoch: 19, train_loss: 1.0865, test_loss: 1.0561, test_f1: 0.4380
 epoch: 20, train_loss: 1.0812, test_loss: 1.0565, test_f1: 0.4384
 epoch: 21, train_loss: 1.0677, test_loss: 1.0438, test_f1: 0.4536
 epoch: 22, train_loss: 1.0639, test_loss: 1.0390, test_f1: 0.4391
 epoch: 23, train_loss: 1.0574, test_loss: 1.0403, test_f1: 0.4454
 epoch: 24, train_loss: 1.0620, test_loss: 1.0346, test_f1: 0.4503
 epoch: 25, train_loss: 1.0494, test_loss: 1.0542, test_f1: 0.4343
 epoch: 26, train_loss: 1.0500, test_loss: 1.0413, test_f1: 0.4438
 epoch: 27, train_loss: 1.0382, test_loss: 1.0433, test_f1: 0.4331
 epoch: 28, train_loss: 1.0277, test_loss: 1.0364, test_f1: 0.4159
 epoch: 29, train_loss: 1.0290, test_loss: 1.0193, test_f1: 0.4419
 epoch: 30, train_loss: 1.0239, test_loss: 1.0080, test_f1: 0.4361
 epoch: 31, train_loss: 1.0097, test_loss: 1.0214, test_f1: 0.4353
 epoch: 32, train_loss: 1.0050, test_loss: 1.0050, test_f1: 0.4425
 epoch: 33, train_loss: 0.9892, test_loss: 1.0286, test_f1: 0.4230
 epoch: 34, train_loss: 0.9820, test_loss: 1.0274, test_f1: 0.4392
 epoch: 35, train_loss: 0.9954, test_loss: 0.9951, test_f1: 0.4439
 epoch: 36, train_loss: 0.9823, test_loss: 1.0120, test_f1: 0.4460
 epoch: 37, train_loss: 0.9641, test_loss: 1.0089, test_f1: 0.4400
 epoch: 38, train_loss: 0.9684, test_loss: 0.9927, test_f1: 0.4503
 epoch: 39, train_loss: 0.9769, test_loss: 1.0032, test_f1: 0.4580
 epoch: 40, train_loss: 0.9773, test_loss: 0.9866, test_f1: 0.4681
 epoch: 41, train_loss: 0.9640, test_loss: 0.9887, test_f1: 0.4492
 epoch: 42, train_loss: 0.9615, test_loss: 1.0131, test_f1: 0.4415
 epoch: 43, train_loss: 0.9480, test_loss: 0.9969, test_f1: 0.4488
 epoch: 44, train_loss: 0.9417, test_loss: 0.9964, test_f1: 0.4408
 epoch: 45, train_loss: 0.9431, test_loss: 1.0041, test_f1: 0.4558
 epoch: 46, train_loss: 0.9335, test_loss: 0.9913, test_f1: 0.4426
 epoch: 47, train_loss: 0.9431, test_loss: 1.0044, test_f1: 0.4545
 epoch: 48, train_loss: 0.9286, test_loss: 0.9995, test_f1: 0.4611
 epoch: 49, train_loss: 0.9352, test_loss: 0.9878, test_f1: 0.4583
 epoch: 50, train_loss: 0.9152, test_loss: 0.9884, test_f1: 0.4456
 epoch: 51, train_loss: 0.9240, test_loss: 0.9966, test_f1: 0.4615
 epoch: 52, train_loss: 0.9169, test_loss: 1.0013, test_f1: 0.4467
 epoch: 53, train_loss: 0.9039, test_loss: 0.9820, test_f1: 0.4622
 epoch: 54, train_loss: 0.9036, test_loss: 0.9912, test_f1: 0.4451
 epoch: 55, train_loss: 0.8986, test_loss: 0.9968, test_f1: 0.4524
 epoch: 56, train_loss: 0.9024, test_loss: 1.0011, test_f1: 0.4640
 epoch: 57, train_loss: 0.8928, test_loss: 0.9927, test_f1: 0.4558
 epoch: 58, train_loss: 0.8930, test_loss: 0.9998, test_f1: 0.4578
 epoch: 59, train_loss: 0.9098, test_loss: 1.0105, test_f1: 0.4555
 epoch: 60, train_loss: 0.8991, test_loss: 0.9913, test_f1: 0.4643
 epoch: 61, train_loss: 0.8937, test_loss: 1.0146, test_f1: 0.4457
 epoch: 62, train_loss: 0.8817, test_loss: 1.0042, test_f1: 0.4549
 epoch: 63, train_loss: 0.8911, test_loss: 0.9938, test_f1: 0.4553
 epoch: 64, train_loss: 0.8749, test_loss: 1.0099, test_f1: 0.4552
 epoch: 65, train_loss: 0.8826, test_loss: 1.0138, test_f1: 0.4490
 epoch: 66, train_loss: 0.8819, test_loss: 1.0278, test_f1: 0.4526
 epoch: 67, train_loss: 0.8757, test_loss: 1.0282, test_f1: 0.4573
 epoch: 68, train_loss: 0.8786, test_loss: 0.9976, test_f1: 0.4630
 epoch: 69, train_loss: 0.8666, test_loss: 1.0128, test_f1: 0.4647
 epoch: 70, train_loss: 0.8695, test_loss: 1.0101, test_f1: 0.4635
 epoch: 71, train_loss: 0.8941, test_loss: 1.0307, test_f1: 0.4647
 epoch: 72, train_loss: 0.8668, test_loss: 1.0372, test_f1: 0.4625
 epoch: 73, train_loss: 0.8731, test_loss: 1.0206, test_f1: 0.4620
 epoch: 74, train_loss: 0.8703, test_loss: 1.0245, test_f1: 0.4651
 epoch: 75, train_loss: 0.8596, test_loss: 1.0327, test_f1: 0.4557
 epoch: 76, train_loss: 0.8765, test_loss: 1.0124, test_f1: 0.4668
 epoch: 77, train_loss: 0.8655, test_loss: 1.0172, test_f1: 0.4670
 epoch: 78, train_loss: 0.8614, test_loss: 1.0184, test_f1: 0.4619
 epoch: 79, train_loss: 0.8638, test_loss: 1.0213, test_f1: 0.4666
 epoch: 80, train_loss: 0.8632, test_loss: 1.0171, test_f1: 0.4659
 epoch: 81, train_loss: 0.8545, test_loss: 1.0377, test_f1: 0.4671
 epoch: 82, train_loss: 0.8524, test_loss: 1.0271, test_f1: 0.4634
 epoch: 83, train_loss: 0.8474, test_loss: 1.0333, test_f1: 0.4702
 epoch: 84, train_loss: 0.8401, test_loss: 1.0222, test_f1: 0.4606
 epoch: 85, train_loss: 0.8557, test_loss: 1.0340, test_f1: 0.4625
 epoch: 86, train_loss: 0.8506, test_loss: 1.0147, test_f1: 0.4846
 epoch: 87, train_loss: 0.8389, test_loss: 1.0411, test_f1: 0.4677
 epoch: 88, train_loss: 0.8293, test_loss: 1.0347, test_f1: 0.4731
 epoch: 89, train_loss: 0.8512, test_loss: 1.0292, test_f1: 0.4690
 epoch: 90, train_loss: 0.8451, test_loss: 1.0544, test_f1: 0.4678
 epoch: 91, train_loss: 0.8486, test_loss: 1.0487, test_f1: 0.4725
 epoch: 92, train_loss: 0.8344, test_loss: 1.0563, test_f1: 0.4685
 epoch: 93, train_loss: 0.8292, test_loss: 1.0592, test_f1: 0.4727
 epoch: 94, train_loss: 0.8308, test_loss: 1.0555, test_f1: 0.4744
 epoch: 95, train_loss: 0.8271, test_loss: 1.0689, test_f1: 0.4683
 epoch: 96, train_loss: 0.8387, test_loss: 1.0480, test_f1: 0.4737
 epoch: 97, train_loss: 0.8197, test_loss: 1.0578, test_f1: 0.4720
 epoch: 98, train_loss: 0.8217, test_loss: 1.0550, test_f1: 0.4745
 epoch: 99, train_loss: 0.8216, test_loss: 1.0591, test_f1: 0.4742
##################ITERATION #6 ****************************************
 epoch: 0, train_loss: 1.3162, test_loss: 1.2468, test_f1: 0.3341
 epoch: 1, train_loss: 1.2419, test_loss: 1.2019, test_f1: 0.4174
 epoch: 2, train_loss: 1.2100, test_loss: 1.1776, test_f1: 0.4251
 epoch: 3, train_loss: 1.1922, test_loss: 1.1624, test_f1: 0.4220
 epoch: 4, train_loss: 1.1771, test_loss: 1.1520, test_f1: 0.4297
 epoch: 5, train_loss: 1.1580, test_loss: 1.1358, test_f1: 0.4327
 epoch: 6, train_loss: 1.1503, test_loss: 1.1229, test_f1: 0.4451
 epoch: 7, train_loss: 1.1289, test_loss: 1.1058, test_f1: 0.4364
 epoch: 8, train_loss: 1.1246, test_loss: 1.0919, test_f1: 0.4297
 epoch: 9, train_loss: 1.1157, test_loss: 1.0862, test_f1: 0.4534
 epoch: 10, train_loss: 1.1152, test_loss: 1.0801, test_f1: 0.4575
 epoch: 11, train_loss: 1.0934, test_loss: 1.0747, test_f1: 0.4668
 epoch: 12, train_loss: 1.0810, test_loss: 1.0724, test_f1: 0.4579
 epoch: 13, train_loss: 1.0811, test_loss: 1.0585, test_f1: 0.4670
 epoch: 14, train_loss: 1.0587, test_loss: 1.0509, test_f1: 0.4710
 epoch: 15, train_loss: 1.0563, test_loss: 1.0485, test_f1: 0.4780
 epoch: 16, train_loss: 1.0615, test_loss: 1.0460, test_f1: 0.4684
 epoch: 17, train_loss: 1.0412, test_loss: 1.0424, test_f1: 0.4795
 epoch: 18, train_loss: 1.0408, test_loss: 1.0303, test_f1: 0.4852
 epoch: 19, train_loss: 1.0329, test_loss: 1.0374, test_f1: 0.4852
 epoch: 20, train_loss: 1.0320, test_loss: 1.0317, test_f1: 0.4719
 epoch: 21, train_loss: 1.0193, test_loss: 1.0128, test_f1: 0.4915
 epoch: 22, train_loss: 1.0130, test_loss: 1.0207, test_f1: 0.4877
 epoch: 23, train_loss: 1.0083, test_loss: 1.0281, test_f1: 0.4800
 epoch: 24, train_loss: 1.0055, test_loss: 1.0132, test_f1: 0.4826
 epoch: 25, train_loss: 0.9912, test_loss: 1.0234, test_f1: 0.4705
 epoch: 26, train_loss: 0.9906, test_loss: 1.0336, test_f1: 0.4785
 epoch: 27, train_loss: 0.9802, test_loss: 1.0125, test_f1: 0.4777
 epoch: 28, train_loss: 0.9729, test_loss: 1.0149, test_f1: 0.4760
 epoch: 29, train_loss: 0.9825, test_loss: 1.0139, test_f1: 0.4762
 epoch: 30, train_loss: 0.9793, test_loss: 1.0209, test_f1: 0.4724
 epoch: 31, train_loss: 0.9740, test_loss: 1.0028, test_f1: 0.4731
 epoch: 32, train_loss: 0.9600, test_loss: 0.9961, test_f1: 0.4831
 epoch: 33, train_loss: 0.9559, test_loss: 1.0117, test_f1: 0.4788
 epoch: 34, train_loss: 0.9489, test_loss: 1.0005, test_f1: 0.4907
 epoch: 35, train_loss: 0.9547, test_loss: 1.0065, test_f1: 0.4826
 epoch: 36, train_loss: 0.9532, test_loss: 0.9980, test_f1: 0.4926
 epoch: 37, train_loss: 0.9639, test_loss: 1.0011, test_f1: 0.4846
 epoch: 38, train_loss: 0.9439, test_loss: 1.0029, test_f1: 0.4813
 epoch: 39, train_loss: 0.9276, test_loss: 0.9973, test_f1: 0.4896
 epoch: 40, train_loss: 0.9305, test_loss: 1.0132, test_f1: 0.4815
 epoch: 41, train_loss: 0.9328, test_loss: 0.9909, test_f1: 0.4780
 epoch: 42, train_loss: 0.9200, test_loss: 1.0096, test_f1: 0.4724
 epoch: 43, train_loss: 0.9219, test_loss: 0.9945, test_f1: 0.4904
 epoch: 44, train_loss: 0.9219, test_loss: 1.0073, test_f1: 0.4766
 epoch: 45, train_loss: 0.9141, test_loss: 1.0091, test_f1: 0.4887
 epoch: 46, train_loss: 0.9121, test_loss: 0.9931, test_f1: 0.4902
 epoch: 47, train_loss: 0.8990, test_loss: 0.9923, test_f1: 0.4971
 epoch: 48, train_loss: 0.8985, test_loss: 0.9997, test_f1: 0.4850
 epoch: 49, train_loss: 0.8933, test_loss: 1.0021, test_f1: 0.4848
 epoch: 50, train_loss: 0.8969, test_loss: 1.0015, test_f1: 0.4792
 epoch: 51, train_loss: 0.8865, test_loss: 0.9950, test_f1: 0.4734
 epoch: 52, train_loss: 0.8859, test_loss: 0.9941, test_f1: 0.4748
 epoch: 53, train_loss: 0.8867, test_loss: 1.0142, test_f1: 0.4870
 epoch: 54, train_loss: 0.8845, test_loss: 1.0082, test_f1: 0.4759
 epoch: 55, train_loss: 0.8697, test_loss: 1.0229, test_f1: 0.4698
 epoch: 56, train_loss: 0.8790, test_loss: 1.0109, test_f1: 0.4779
 epoch: 57, train_loss: 0.8691, test_loss: 1.0123, test_f1: 0.4935
 epoch: 58, train_loss: 0.8720, test_loss: 1.0078, test_f1: 0.4863
 epoch: 59, train_loss: 0.8717, test_loss: 1.0175, test_f1: 0.5100
 epoch: 60, train_loss: 0.8767, test_loss: 1.0283, test_f1: 0.4921
 epoch: 61, train_loss: 0.8651, test_loss: 1.0214, test_f1: 0.4937
 epoch: 62, train_loss: 0.8715, test_loss: 1.0176, test_f1: 0.4883
 epoch: 63, train_loss: 0.8563, test_loss: 1.0125, test_f1: 0.4890
 epoch: 64, train_loss: 0.8560, test_loss: 1.0155, test_f1: 0.4880
 epoch: 65, train_loss: 0.8509, test_loss: 1.0322, test_f1: 0.4763
 epoch: 66, train_loss: 0.8594, test_loss: 1.0285, test_f1: 0.4862
 epoch: 67, train_loss: 0.8669, test_loss: 1.0042, test_f1: 0.5109
 epoch: 68, train_loss: 0.8526, test_loss: 1.0140, test_f1: 0.4968
 epoch: 69, train_loss: 0.8519, test_loss: 1.0119, test_f1: 0.4983
 epoch: 70, train_loss: 0.8580, test_loss: 1.0364, test_f1: 0.4835
 epoch: 71, train_loss: 0.8488, test_loss: 1.0178, test_f1: 0.5030
 epoch: 72, train_loss: 0.8486, test_loss: 1.0074, test_f1: 0.5092
 epoch: 73, train_loss: 0.8481, test_loss: 1.0096, test_f1: 0.5118
 epoch: 74, train_loss: 0.8512, test_loss: 1.0250, test_f1: 0.4910
 epoch: 75, train_loss: 0.8361, test_loss: 1.0022, test_f1: 0.4986
 epoch: 76, train_loss: 0.8482, test_loss: 1.0290, test_f1: 0.4849
 epoch: 77, train_loss: 0.8512, test_loss: 1.0393, test_f1: 0.4948
 epoch: 78, train_loss: 0.8496, test_loss: 1.0333, test_f1: 0.4900
 epoch: 79, train_loss: 0.8367, test_loss: 1.0427, test_f1: 0.5014
 epoch: 80, train_loss: 0.8431, test_loss: 1.0225, test_f1: 0.5123
 epoch: 81, train_loss: 0.8306, test_loss: 1.0363, test_f1: 0.5016
 epoch: 82, train_loss: 0.8383, test_loss: 1.0226, test_f1: 0.5008
 epoch: 83, train_loss: 0.8238, test_loss: 1.0364, test_f1: 0.4943
 epoch: 84, train_loss: 0.8234, test_loss: 1.0490, test_f1: 0.4737
 epoch: 85, train_loss: 0.8317, test_loss: 1.0302, test_f1: 0.5009
 epoch: 86, train_loss: 0.8370, test_loss: 1.0357, test_f1: 0.5108
 epoch: 87, train_loss: 0.8201, test_loss: 1.0577, test_f1: 0.4962
 epoch: 88, train_loss: 0.8150, test_loss: 1.0328, test_f1: 0.5093
 epoch: 89, train_loss: 0.8214, test_loss: 1.0548, test_f1: 0.4858
 epoch: 90, train_loss: 0.8132, test_loss: 1.0536, test_f1: 0.4896
 epoch: 91, train_loss: 0.8282, test_loss: 1.0393, test_f1: 0.5089
 epoch: 92, train_loss: 0.8062, test_loss: 1.0574, test_f1: 0.4849
 epoch: 93, train_loss: 0.8176, test_loss: 1.0380, test_f1: 0.5030
 epoch: 94, train_loss: 0.8091, test_loss: 1.0582, test_f1: 0.4929
 epoch: 95, train_loss: 0.8000, test_loss: 1.0490, test_f1: 0.4965
 epoch: 96, train_loss: 0.8085, test_loss: 1.0631, test_f1: 0.5091
 epoch: 97, train_loss: 0.8276, test_loss: 1.0496, test_f1: 0.5023
 epoch: 98, train_loss: 0.8095, test_loss: 1.0385, test_f1: 0.4927
 epoch: 99, train_loss: 0.8261, test_loss: 1.0586, test_f1: 0.4969
##################ITERATION #7 ****************************************
 epoch: 0, train_loss: 1.3024, test_loss: 1.2408, test_f1: 0.3807
 epoch: 1, train_loss: 1.2378, test_loss: 1.1958, test_f1: 0.4033
 epoch: 2, train_loss: 1.2228, test_loss: 1.1690, test_f1: 0.4169
 epoch: 3, train_loss: 1.1950, test_loss: 1.1432, test_f1: 0.4352
 epoch: 4, train_loss: 1.1884, test_loss: 1.1269, test_f1: 0.4439
 epoch: 5, train_loss: 1.1624, test_loss: 1.1142, test_f1: 0.4423
 epoch: 6, train_loss: 1.1621, test_loss: 1.1021, test_f1: 0.4373
 epoch: 7, train_loss: 1.1500, test_loss: 1.0996, test_f1: 0.4438
 epoch: 8, train_loss: 1.1454, test_loss: 1.0899, test_f1: 0.4474
 epoch: 9, train_loss: 1.1272, test_loss: 1.0775, test_f1: 0.4436
 epoch: 10, train_loss: 1.1334, test_loss: 1.0770, test_f1: 0.4466
 epoch: 11, train_loss: 1.1169, test_loss: 1.0700, test_f1: 0.4390
 epoch: 12, train_loss: 1.1061, test_loss: 1.0548, test_f1: 0.4388
 epoch: 13, train_loss: 1.0937, test_loss: 1.0559, test_f1: 0.4413
 epoch: 14, train_loss: 1.0837, test_loss: 1.0436, test_f1: 0.4570
 epoch: 15, train_loss: 1.0849, test_loss: 1.0478, test_f1: 0.4508
 epoch: 16, train_loss: 1.0819, test_loss: 1.0359, test_f1: 0.4581
 epoch: 17, train_loss: 1.0793, test_loss: 1.0359, test_f1: 0.4766
 epoch: 18, train_loss: 1.0725, test_loss: 1.0343, test_f1: 0.4535
 epoch: 19, train_loss: 1.0629, test_loss: 1.0266, test_f1: 0.4664
 epoch: 20, train_loss: 1.0517, test_loss: 1.0364, test_f1: 0.4668
 epoch: 21, train_loss: 1.0437, test_loss: 1.0267, test_f1: 0.4793
 epoch: 22, train_loss: 1.0546, test_loss: 1.0301, test_f1: 0.4634
 epoch: 23, train_loss: 1.0293, test_loss: 1.0203, test_f1: 0.4630
 epoch: 24, train_loss: 1.0334, test_loss: 1.0152, test_f1: 0.4848
 epoch: 25, train_loss: 1.0283, test_loss: 1.0214, test_f1: 0.4543
 epoch: 26, train_loss: 1.0228, test_loss: 1.0274, test_f1: 0.4596
 epoch: 27, train_loss: 1.0147, test_loss: 1.0100, test_f1: 0.4664
 epoch: 28, train_loss: 1.0120, test_loss: 1.0108, test_f1: 0.4607
 epoch: 29, train_loss: 1.0090, test_loss: 1.0016, test_f1: 0.4824
 epoch: 30, train_loss: 0.9989, test_loss: 1.0019, test_f1: 0.4684
 epoch: 31, train_loss: 0.9999, test_loss: 1.0076, test_f1: 0.4620
 epoch: 32, train_loss: 1.0088, test_loss: 1.0207, test_f1: 0.4421
 epoch: 33, train_loss: 0.9927, test_loss: 1.0056, test_f1: 0.4480
 epoch: 34, train_loss: 0.9719, test_loss: 1.0141, test_f1: 0.4525
 epoch: 35, train_loss: 0.9756, test_loss: 1.0161, test_f1: 0.4426
 epoch: 36, train_loss: 0.9809, test_loss: 1.0044, test_f1: 0.4654
 epoch: 37, train_loss: 0.9836, test_loss: 1.0453, test_f1: 0.4322
 epoch: 38, train_loss: 0.9764, test_loss: 1.0098, test_f1: 0.4656
 epoch: 39, train_loss: 0.9648, test_loss: 1.0094, test_f1: 0.4576
 epoch: 40, train_loss: 0.9424, test_loss: 1.0446, test_f1: 0.4426
 epoch: 41, train_loss: 0.9516, test_loss: 0.9939, test_f1: 0.4801
 epoch: 42, train_loss: 0.9456, test_loss: 1.0103, test_f1: 0.4518
 epoch: 43, train_loss: 0.9422, test_loss: 0.9958, test_f1: 0.4615
 epoch: 44, train_loss: 0.9516, test_loss: 1.0006, test_f1: 0.4715
 epoch: 45, train_loss: 0.9409, test_loss: 1.0072, test_f1: 0.4648
 epoch: 46, train_loss: 0.9397, test_loss: 1.0236, test_f1: 0.4629
 epoch: 47, train_loss: 0.9231, test_loss: 1.0282, test_f1: 0.4526
 epoch: 48, train_loss: 0.9260, test_loss: 1.0280, test_f1: 0.4424
 epoch: 49, train_loss: 0.9216, test_loss: 1.0428, test_f1: 0.4513
 epoch: 50, train_loss: 0.9162, test_loss: 1.0330, test_f1: 0.4642
 epoch: 51, train_loss: 0.9072, test_loss: 1.0043, test_f1: 0.4814
 epoch: 52, train_loss: 0.9104, test_loss: 1.0151, test_f1: 0.4782
 epoch: 53, train_loss: 0.9019, test_loss: 1.0083, test_f1: 0.4772
 epoch: 54, train_loss: 0.9128, test_loss: 1.0059, test_f1: 0.4673
 epoch: 55, train_loss: 0.8914, test_loss: 0.9927, test_f1: 0.4837
 epoch: 56, train_loss: 0.8948, test_loss: 0.9957, test_f1: 0.4892
 epoch: 57, train_loss: 0.8971, test_loss: 1.0434, test_f1: 0.4699
 epoch: 58, train_loss: 0.8952, test_loss: 1.0061, test_f1: 0.4716
 epoch: 59, train_loss: 0.8776, test_loss: 1.0241, test_f1: 0.4727
 epoch: 60, train_loss: 0.8897, test_loss: 1.0033, test_f1: 0.4775
 epoch: 61, train_loss: 0.8805, test_loss: 1.0312, test_f1: 0.4545
 epoch: 62, train_loss: 0.8847, test_loss: 1.0491, test_f1: 0.4545
 epoch: 63, train_loss: 0.8886, test_loss: 1.0379, test_f1: 0.4767
 epoch: 64, train_loss: 0.8888, test_loss: 1.0517, test_f1: 0.4503
 epoch: 65, train_loss: 0.8828, test_loss: 1.0434, test_f1: 0.4703
 epoch: 66, train_loss: 0.8785, test_loss: 1.0642, test_f1: 0.4627
 epoch: 67, train_loss: 0.8820, test_loss: 1.0293, test_f1: 0.4816
 epoch: 68, train_loss: 0.8640, test_loss: 1.0259, test_f1: 0.4803
 epoch: 69, train_loss: 0.8689, test_loss: 1.0210, test_f1: 0.4945
 epoch: 70, train_loss: 0.8648, test_loss: 1.0350, test_f1: 0.4748
 epoch: 71, train_loss: 0.8638, test_loss: 1.0130, test_f1: 0.5010
 epoch: 72, train_loss: 0.8695, test_loss: 1.0354, test_f1: 0.4993
 epoch: 73, train_loss: 0.8618, test_loss: 1.0351, test_f1: 0.4809
 epoch: 74, train_loss: 0.8732, test_loss: 1.0128, test_f1: 0.5034
 epoch: 75, train_loss: 0.8658, test_loss: 1.0166, test_f1: 0.5028
 epoch: 76, train_loss: 0.8547, test_loss: 1.0381, test_f1: 0.4939
 epoch: 77, train_loss: 0.8614, test_loss: 1.0446, test_f1: 0.4834
 epoch: 78, train_loss: 0.8578, test_loss: 1.0233, test_f1: 0.4940
 epoch: 79, train_loss: 0.8557, test_loss: 1.0376, test_f1: 0.5040
 epoch: 80, train_loss: 0.8434, test_loss: 1.0278, test_f1: 0.4995
 epoch: 81, train_loss: 0.8479, test_loss: 1.0447, test_f1: 0.4946
 epoch: 82, train_loss: 0.8700, test_loss: 1.0475, test_f1: 0.5084
 epoch: 83, train_loss: 0.8463, test_loss: 1.0381, test_f1: 0.4829
 epoch: 84, train_loss: 0.8535, test_loss: 1.0419, test_f1: 0.4895
 epoch: 85, train_loss: 0.8432, test_loss: 1.0450, test_f1: 0.4833
 epoch: 86, train_loss: 0.8377, test_loss: 1.0486, test_f1: 0.4898
 epoch: 87, train_loss: 0.8466, test_loss: 1.0381, test_f1: 0.4916
 epoch: 88, train_loss: 0.8323, test_loss: 1.0391, test_f1: 0.5000
 epoch: 89, train_loss: 0.8486, test_loss: 1.0242, test_f1: 0.4936
 epoch: 90, train_loss: 0.8354, test_loss: 1.0327, test_f1: 0.4923
 epoch: 91, train_loss: 0.8260, test_loss: 1.0322, test_f1: 0.5047
 epoch: 92, train_loss: 0.8201, test_loss: 1.0408, test_f1: 0.4979
 epoch: 93, train_loss: 0.8335, test_loss: 1.0530, test_f1: 0.4906
 epoch: 94, train_loss: 0.8205, test_loss: 1.0505, test_f1: 0.4837
 epoch: 95, train_loss: 0.8237, test_loss: 1.0508, test_f1: 0.5093
 epoch: 96, train_loss: 0.8286, test_loss: 1.0522, test_f1: 0.4776
 epoch: 97, train_loss: 0.8137, test_loss: 1.0720, test_f1: 0.4878
 epoch: 98, train_loss: 0.8245, test_loss: 1.0538, test_f1: 0.5048
 epoch: 99, train_loss: 0.8335, test_loss: 1.0664, test_f1: 0.4982
##################ITERATION #8 ****************************************
 epoch: 0, train_loss: 1.3239, test_loss: 1.1975, test_f1: 0.3803
 epoch: 1, train_loss: 1.2383, test_loss: 1.1625, test_f1: 0.4212
 epoch: 2, train_loss: 1.2213, test_loss: 1.1420, test_f1: 0.4644
 epoch: 3, train_loss: 1.1983, test_loss: 1.1252, test_f1: 0.4462
 epoch: 4, train_loss: 1.1898, test_loss: 1.1157, test_f1: 0.4650
 epoch: 5, train_loss: 1.1671, test_loss: 1.0971, test_f1: 0.4538
 epoch: 6, train_loss: 1.1691, test_loss: 1.0895, test_f1: 0.4696
 epoch: 7, train_loss: 1.1453, test_loss: 1.0703, test_f1: 0.4714
 epoch: 8, train_loss: 1.1411, test_loss: 1.0574, test_f1: 0.4627
 epoch: 9, train_loss: 1.1164, test_loss: 1.0551, test_f1: 0.4608
 epoch: 10, train_loss: 1.1220, test_loss: 1.0426, test_f1: 0.4444
 epoch: 11, train_loss: 1.1079, test_loss: 1.0349, test_f1: 0.4522
 epoch: 12, train_loss: 1.0909, test_loss: 1.0180, test_f1: 0.4685
 epoch: 13, train_loss: 1.0939, test_loss: 1.0241, test_f1: 0.4587
 epoch: 14, train_loss: 1.0789, test_loss: 1.0082, test_f1: 0.4699
 epoch: 15, train_loss: 1.0709, test_loss: 1.0056, test_f1: 0.4509
 epoch: 16, train_loss: 1.0688, test_loss: 1.0021, test_f1: 0.4666
 epoch: 17, train_loss: 1.0692, test_loss: 0.9955, test_f1: 0.4710
 epoch: 18, train_loss: 1.0598, test_loss: 1.0044, test_f1: 0.4590
 epoch: 19, train_loss: 1.0575, test_loss: 1.0098, test_f1: 0.4645
 epoch: 20, train_loss: 1.0453, test_loss: 0.9883, test_f1: 0.4765
 epoch: 21, train_loss: 1.0390, test_loss: 0.9838, test_f1: 0.4480
 epoch: 22, train_loss: 1.0205, test_loss: 0.9888, test_f1: 0.4605
 epoch: 23, train_loss: 1.0310, test_loss: 0.9729, test_f1: 0.4627
 epoch: 24, train_loss: 1.0180, test_loss: 0.9813, test_f1: 0.4454
 epoch: 25, train_loss: 1.0219, test_loss: 0.9767, test_f1: 0.4561
 epoch: 26, train_loss: 1.0087, test_loss: 0.9608, test_f1: 0.4800
 epoch: 27, train_loss: 1.0156, test_loss: 0.9765, test_f1: 0.4667
 epoch: 28, train_loss: 0.9972, test_loss: 0.9556, test_f1: 0.4838
 epoch: 29, train_loss: 1.0021, test_loss: 0.9563, test_f1: 0.4888
 epoch: 30, train_loss: 0.9870, test_loss: 0.9605, test_f1: 0.4876
 epoch: 31, train_loss: 0.9826, test_loss: 0.9531, test_f1: 0.4827
 epoch: 32, train_loss: 0.9817, test_loss: 0.9679, test_f1: 0.4833
 epoch: 33, train_loss: 0.9851, test_loss: 0.9463, test_f1: 0.4890
 epoch: 34, train_loss: 0.9832, test_loss: 0.9649, test_f1: 0.4871
 epoch: 35, train_loss: 0.9794, test_loss: 0.9641, test_f1: 0.4738
 epoch: 36, train_loss: 0.9625, test_loss: 0.9543, test_f1: 0.4874
 epoch: 37, train_loss: 0.9555, test_loss: 0.9764, test_f1: 0.4712
 epoch: 38, train_loss: 0.9617, test_loss: 0.9546, test_f1: 0.4771
 epoch: 39, train_loss: 0.9565, test_loss: 0.9597, test_f1: 0.4961
 epoch: 40, train_loss: 0.9478, test_loss: 0.9514, test_f1: 0.4996
 epoch: 41, train_loss: 0.9530, test_loss: 0.9642, test_f1: 0.4741
 epoch: 42, train_loss: 0.9514, test_loss: 0.9820, test_f1: 0.4776
 epoch: 43, train_loss: 0.9457, test_loss: 0.9822, test_f1: 0.4788
 epoch: 44, train_loss: 0.9396, test_loss: 0.9592, test_f1: 0.4794
 epoch: 45, train_loss: 0.9440, test_loss: 0.9491, test_f1: 0.4873
 epoch: 46, train_loss: 0.9226, test_loss: 0.9960, test_f1: 0.4766
 epoch: 47, train_loss: 0.9289, test_loss: 0.9671, test_f1: 0.4853
 epoch: 48, train_loss: 0.9266, test_loss: 0.9407, test_f1: 0.5039
 epoch: 49, train_loss: 0.9284, test_loss: 0.9931, test_f1: 0.4882
 epoch: 50, train_loss: 0.9205, test_loss: 0.9549, test_f1: 0.4860
 epoch: 51, train_loss: 0.9126, test_loss: 0.9328, test_f1: 0.4977
 epoch: 52, train_loss: 0.9107, test_loss: 0.9655, test_f1: 0.4897
 epoch: 53, train_loss: 0.8966, test_loss: 0.9707, test_f1: 0.4866
 epoch: 54, train_loss: 0.8970, test_loss: 0.9714, test_f1: 0.4841
 epoch: 55, train_loss: 0.8991, test_loss: 0.9546, test_f1: 0.5044
 epoch: 56, train_loss: 0.9011, test_loss: 0.9456, test_f1: 0.4924
 epoch: 57, train_loss: 0.8864, test_loss: 0.9503, test_f1: 0.5069
 epoch: 58, train_loss: 0.8842, test_loss: 0.9577, test_f1: 0.4890
 epoch: 59, train_loss: 0.8874, test_loss: 0.9459, test_f1: 0.4919
 epoch: 60, train_loss: 0.8832, test_loss: 0.9681, test_f1: 0.4862
 epoch: 61, train_loss: 0.8972, test_loss: 0.9619, test_f1: 0.4873
 epoch: 62, train_loss: 0.8876, test_loss: 0.9593, test_f1: 0.4881
 epoch: 63, train_loss: 0.8913, test_loss: 0.9562, test_f1: 0.5059
 epoch: 64, train_loss: 0.8832, test_loss: 0.9536, test_f1: 0.4868
 epoch: 65, train_loss: 0.8842, test_loss: 0.9842, test_f1: 0.4671
 epoch: 66, train_loss: 0.8794, test_loss: 0.9651, test_f1: 0.4986
 epoch: 67, train_loss: 0.8763, test_loss: 0.9827, test_f1: 0.4610
 epoch: 68, train_loss: 0.8663, test_loss: 0.9756, test_f1: 0.4811
 epoch: 69, train_loss: 0.8835, test_loss: 0.9858, test_f1: 0.4902
 epoch: 70, train_loss: 0.8784, test_loss: 0.9727, test_f1: 0.4794
 epoch: 71, train_loss: 0.8660, test_loss: 0.9831, test_f1: 0.4775
 epoch: 72, train_loss: 0.8666, test_loss: 0.9463, test_f1: 0.4837
 epoch: 73, train_loss: 0.8552, test_loss: 0.9817, test_f1: 0.4881
 epoch: 74, train_loss: 0.8667, test_loss: 0.9740, test_f1: 0.4909
 epoch: 75, train_loss: 0.8690, test_loss: 0.9727, test_f1: 0.5005
 epoch: 76, train_loss: 0.8620, test_loss: 0.9733, test_f1: 0.4720
 epoch: 77, train_loss: 0.8770, test_loss: 0.9738, test_f1: 0.4880
 epoch: 78, train_loss: 0.8608, test_loss: 0.9487, test_f1: 0.5038
 epoch: 79, train_loss: 0.8437, test_loss: 0.9707, test_f1: 0.4936
 epoch: 80, train_loss: 0.8452, test_loss: 0.9805, test_f1: 0.4763
 epoch: 81, train_loss: 0.8630, test_loss: 0.9842, test_f1: 0.4977
 epoch: 82, train_loss: 0.8572, test_loss: 0.9681, test_f1: 0.4906
 epoch: 83, train_loss: 0.8462, test_loss: 0.9799, test_f1: 0.4816
 epoch: 84, train_loss: 0.8534, test_loss: 0.9827, test_f1: 0.4841
 epoch: 85, train_loss: 0.8520, test_loss: 0.9736, test_f1: 0.4998
 epoch: 86, train_loss: 0.8609, test_loss: 0.9652, test_f1: 0.4876
 epoch: 87, train_loss: 0.8410, test_loss: 0.9694, test_f1: 0.4932
 epoch: 88, train_loss: 0.8463, test_loss: 0.9524, test_f1: 0.4840
 epoch: 89, train_loss: 0.8427, test_loss: 0.9472, test_f1: 0.4907
 epoch: 90, train_loss: 0.8461, test_loss: 0.9543, test_f1: 0.5070
 epoch: 91, train_loss: 0.8372, test_loss: 0.9576, test_f1: 0.5057
 epoch: 92, train_loss: 0.8426, test_loss: 0.9608, test_f1: 0.4989
 epoch: 93, train_loss: 0.8320, test_loss: 0.9701, test_f1: 0.4923
 epoch: 94, train_loss: 0.8343, test_loss: 0.9730, test_f1: 0.5098
 epoch: 95, train_loss: 0.8271, test_loss: 0.9680, test_f1: 0.4849
 epoch: 96, train_loss: 0.8251, test_loss: 0.9688, test_f1: 0.5084
 epoch: 97, train_loss: 0.8280, test_loss: 0.9683, test_f1: 0.4809
 epoch: 98, train_loss: 0.8310, test_loss: 0.9593, test_f1: 0.5165
 epoch: 99, train_loss: 0.8416, test_loss: 0.9659, test_f1: 0.4997
##################ITERATION #9 ****************************************
 epoch: 0, train_loss: 1.3287, test_loss: 1.2262, test_f1: 0.3294
 epoch: 1, train_loss: 1.2552, test_loss: 1.1876, test_f1: 0.4247
 epoch: 2, train_loss: 1.2321, test_loss: 1.1828, test_f1: 0.4506
 epoch: 3, train_loss: 1.2108, test_loss: 1.1531, test_f1: 0.4595
 epoch: 4, train_loss: 1.1820, test_loss: 1.1311, test_f1: 0.4689
 epoch: 5, train_loss: 1.1736, test_loss: 1.1217, test_f1: 0.4722
 epoch: 6, train_loss: 1.1636, test_loss: 1.1023, test_f1: 0.4777
 epoch: 7, train_loss: 1.1713, test_loss: 1.0893, test_f1: 0.4837
 epoch: 8, train_loss: 1.1387, test_loss: 1.0790, test_f1: 0.4801
 epoch: 9, train_loss: 1.1353, test_loss: 1.0809, test_f1: 0.4708
 epoch: 10, train_loss: 1.1245, test_loss: 1.0782, test_f1: 0.4547
 epoch: 11, train_loss: 1.1073, test_loss: 1.0606, test_f1: 0.4621
 epoch: 12, train_loss: 1.1035, test_loss: 1.0460, test_f1: 0.4758
 epoch: 13, train_loss: 1.0901, test_loss: 1.0516, test_f1: 0.4670
 epoch: 14, train_loss: 1.0798, test_loss: 1.0332, test_f1: 0.4674
 epoch: 15, train_loss: 1.0750, test_loss: 1.0442, test_f1: 0.4610
 epoch: 16, train_loss: 1.0776, test_loss: 1.0301, test_f1: 0.4654
 epoch: 17, train_loss: 1.0684, test_loss: 1.0178, test_f1: 0.4792
 epoch: 18, train_loss: 1.0605, test_loss: 1.0400, test_f1: 0.4718
 epoch: 19, train_loss: 1.0465, test_loss: 1.0214, test_f1: 0.4737
 epoch: 20, train_loss: 1.0507, test_loss: 1.0181, test_f1: 0.4747
 epoch: 21, train_loss: 1.0468, test_loss: 1.0216, test_f1: 0.4772
 epoch: 22, train_loss: 1.0352, test_loss: 1.0143, test_f1: 0.4822
 epoch: 23, train_loss: 1.0232, test_loss: 1.0052, test_f1: 0.4933
 epoch: 24, train_loss: 1.0298, test_loss: 1.0128, test_f1: 0.4901
 epoch: 25, train_loss: 1.0241, test_loss: 1.0105, test_f1: 0.4805
 epoch: 26, train_loss: 1.0231, test_loss: 1.0117, test_f1: 0.4888
 epoch: 27, train_loss: 1.0079, test_loss: 1.0080, test_f1: 0.4908
 epoch: 28, train_loss: 0.9929, test_loss: 1.0097, test_f1: 0.4813
 epoch: 29, train_loss: 0.9927, test_loss: 1.0123, test_f1: 0.4886
 epoch: 30, train_loss: 0.9868, test_loss: 1.0119, test_f1: 0.4826
 epoch: 31, train_loss: 0.9790, test_loss: 1.0057, test_f1: 0.4907
 epoch: 32, train_loss: 0.9839, test_loss: 1.0251, test_f1: 0.4811
 epoch: 33, train_loss: 0.9633, test_loss: 1.0417, test_f1: 0.4624
 epoch: 34, train_loss: 0.9727, test_loss: 1.0369, test_f1: 0.4785
 epoch: 35, train_loss: 0.9638, test_loss: 1.0300, test_f1: 0.4862
 epoch: 36, train_loss: 0.9695, test_loss: 1.0172, test_f1: 0.4986
 epoch: 37, train_loss: 0.9595, test_loss: 1.0179, test_f1: 0.4989
 epoch: 38, train_loss: 0.9621, test_loss: 1.0309, test_f1: 0.4804
 epoch: 39, train_loss: 0.9435, test_loss: 1.0315, test_f1: 0.4758
 epoch: 40, train_loss: 0.9499, test_loss: 1.0206, test_f1: 0.4833
 epoch: 41, train_loss: 0.9498, test_loss: 1.0129, test_f1: 0.4790
 epoch: 42, train_loss: 0.9385, test_loss: 1.0286, test_f1: 0.5058
 epoch: 43, train_loss: 0.9366, test_loss: 1.0238, test_f1: 0.5100
 epoch: 44, train_loss: 0.9241, test_loss: 1.0366, test_f1: 0.4905
 epoch: 45, train_loss: 0.9279, test_loss: 1.0472, test_f1: 0.5083
 epoch: 46, train_loss: 0.9112, test_loss: 1.0839, test_f1: 0.4923
 epoch: 47, train_loss: 0.9310, test_loss: 1.0383, test_f1: 0.5103
 epoch: 48, train_loss: 0.9095, test_loss: 1.0333, test_f1: 0.4986
 epoch: 49, train_loss: 0.9151, test_loss: 1.0709, test_f1: 0.5015
 epoch: 50, train_loss: 0.9071, test_loss: 1.1064, test_f1: 0.4918
 epoch: 51, train_loss: 0.9094, test_loss: 1.0569, test_f1: 0.5080
 epoch: 52, train_loss: 0.9055, test_loss: 1.0593, test_f1: 0.4919
 epoch: 53, train_loss: 0.9017, test_loss: 1.0629, test_f1: 0.4926
 epoch: 54, train_loss: 0.8949, test_loss: 1.0590, test_f1: 0.5019
 epoch: 55, train_loss: 0.8897, test_loss: 1.0345, test_f1: 0.5013
 epoch: 56, train_loss: 0.8980, test_loss: 1.0749, test_f1: 0.5045
 epoch: 57, train_loss: 0.8893, test_loss: 1.0493, test_f1: 0.4865
 epoch: 58, train_loss: 0.8891, test_loss: 1.0954, test_f1: 0.5036
 epoch: 59, train_loss: 0.8807, test_loss: 1.0822, test_f1: 0.4959
 epoch: 60, train_loss: 0.8789, test_loss: 1.0680, test_f1: 0.5014
 epoch: 61, train_loss: 0.8909, test_loss: 1.0584, test_f1: 0.5009
 epoch: 62, train_loss: 0.8831, test_loss: 1.0470, test_f1: 0.4995
 epoch: 63, train_loss: 0.8814, test_loss: 1.0583, test_f1: 0.5003
 epoch: 64, train_loss: 0.8783, test_loss: 1.1094, test_f1: 0.5040
 epoch: 65, train_loss: 0.8763, test_loss: 1.0920, test_f1: 0.4963
 epoch: 66, train_loss: 0.8687, test_loss: 1.0970, test_f1: 0.5124
 epoch: 67, train_loss: 0.8685, test_loss: 1.0815, test_f1: 0.5110
 epoch: 68, train_loss: 0.8623, test_loss: 1.1163, test_f1: 0.4845
 epoch: 69, train_loss: 0.8660, test_loss: 1.0983, test_f1: 0.5007
 epoch: 70, train_loss: 0.8685, test_loss: 1.1075, test_f1: 0.5026
 epoch: 71, train_loss: 0.8635, test_loss: 1.0927, test_f1: 0.4930
 epoch: 72, train_loss: 0.8625, test_loss: 1.1008, test_f1: 0.5016
 epoch: 73, train_loss: 0.8562, test_loss: 1.0908, test_f1: 0.5029
 epoch: 74, train_loss: 0.8474, test_loss: 1.1082, test_f1: 0.4976
 epoch: 75, train_loss: 0.8555, test_loss: 1.1298, test_f1: 0.5073
 epoch: 76, train_loss: 0.8706, test_loss: 1.1429, test_f1: 0.5140
 epoch: 77, train_loss: 0.8628, test_loss: 1.1273, test_f1: 0.5107
 epoch: 78, train_loss: 0.8541, test_loss: 1.1108, test_f1: 0.4968
 epoch: 79, train_loss: 0.8445, test_loss: 1.1038, test_f1: 0.5116
 epoch: 80, train_loss: 0.8575, test_loss: 1.1210, test_f1: 0.5012
 epoch: 81, train_loss: 0.8606, test_loss: 1.1132, test_f1: 0.5019
 epoch: 82, train_loss: 0.8470, test_loss: 1.1008, test_f1: 0.5112
 epoch: 83, train_loss: 0.8532, test_loss: 1.1218, test_f1: 0.5213
 epoch: 84, train_loss: 0.8437, test_loss: 1.1324, test_f1: 0.5185
 epoch: 85, train_loss: 0.8306, test_loss: 1.1396, test_f1: 0.5146
 epoch: 86, train_loss: 0.8489, test_loss: 1.1552, test_f1: 0.5151
 epoch: 87, train_loss: 0.8344, test_loss: 1.1741, test_f1: 0.5042
 epoch: 88, train_loss: 0.8324, test_loss: 1.1617, test_f1: 0.5185
 epoch: 89, train_loss: 0.8354, test_loss: 1.1501, test_f1: 0.5119
 epoch: 90, train_loss: 0.8403, test_loss: 1.1585, test_f1: 0.5115
 epoch: 91, train_loss: 0.8284, test_loss: 1.1510, test_f1: 0.5125
 epoch: 92, train_loss: 0.8327, test_loss: 1.1277, test_f1: 0.5418
 epoch: 93, train_loss: 0.8334, test_loss: 1.1585, test_f1: 0.5179
 epoch: 94, train_loss: 0.8193, test_loss: 1.1398, test_f1: 0.5092
 epoch: 95, train_loss: 0.8336, test_loss: 1.1498, test_f1: 0.5328
 epoch: 96, train_loss: 0.8295, test_loss: 1.1567, test_f1: 0.5349
 epoch: 97, train_loss: 0.8212, test_loss: 1.1426, test_f1: 0.5276
 epoch: 98, train_loss: 0.8262, test_loss: 1.1279, test_f1: 0.5276
 epoch: 99, train_loss: 0.8135, test_loss: 1.1692, test_f1: 0.5131

Training completed in 673.59 seconds
Best F1: 0.5418 at epoch 92
Mean F1 across iterations: 0.5158  0.0155
========================FINAL RESULTS================================
FEGIN weighted F1: 0.5418  0.0155
python main.py --data ltspice_examples --representation component_component --model FEGIN --layers 4 --hiddens 64 --batch_size 64 --lr 0.0001 --emb_size 250 --epochs 100 --save_appendix component_component_L4_H64_BS64_LR0.0001_E250 --no_val
-----



STDERR:
  File "main.py", line 370, in <module>
    main()
  File "main.py", line 254, in main
    dataset = dataset_class(
  File "/home/philip/projects/ltspice_examples_code_repo/Circuit-Completion-Using-GNNs/component_classification_with_link_prediction_head/evaluation/FEGIN/kernel/circuit_datasets.py", line 15, in __init__
    self.data, self.slices = torch.load(self.processed_paths[0])
  File "/home/philip/.local/lib/python3.8/site-packages/torch/serialization.py", line 1040, in load
    warnings.warn(
  File "/usr/lib/python3.8/warnings.py", line 109, in _showwarnmsg
    sw(msg.message, msg.category, msg.filename, msg.lineno,
  File "main.py", line 47, in warn_with_traceback
    traceback.print_stack(file=log)
/home/philip/projects/ltspice_examples_code_repo/Circuit-Completion-Using-GNNs/component_classification_with_link_prediction_head/evaluation/FEGIN/kernel/circuit_datasets.py:15: FutureWarning: You are using `torch.load` with `weights_only=False` (the current default value), which uses the default pickle module implicitly. It is possible to construct malicious pickle data which will execute arbitrary code during unpickling (See https://github.com/pytorch/pytorch/blob/main/SECURITY.md#untrusted-models for more details). In a future release, the default value for `weights_only` will be flipped to `True`. This limits the functions that could be executed during unpickling. Arbitrary objects will no longer be allowed to be loaded via this mode unless they are explicitly allowlisted by the user via `torch.serialization.add_safe_globals`. We recommend you start setting `weights_only=True` for any use case where you don't have full control of the loaded file. Please open an issue on GitHub for any issues related to this experimental feature.
  self.data, self.slices = torch.load(self.processed_paths[0])
