STDOUT:
Results will be saved in /home/philip/projects/ltspice_examples_code_repo/Circuit-Completion-Using-GNNs/component_classification_with_link_prediction_head/evaluation/FEGIN/results/model_FEGIN_dataset_ltspice_examples
Command line input: python main.py --data ltspice_examples --representation component_pin_net --model FEGIN --layers 6 --hiddens 64 --batch_size 64 --lr 0.001 --emb_size 512 --epochs 100 --save_appendix component_pin_net_L6_H64_BS64_LR0.001_E512 --no_val
 is saved.
-----
ltspice_examples - FEGIN
Using 6 layers, 64 hidden units, h = 2
Loading component_pin_net representation dataset
ENTERED
Training FEGIN on component_pin_net representation
Train: 3558, Test: 846
##################ITERATION #0 ****************************************
 epoch: 0, train_loss: 1.2068, test_loss: 1.1153, test_f1: 0.3412
 epoch: 1, train_loss: 1.0262, test_loss: 0.9762, test_f1: 0.5240
 epoch: 2, train_loss: 0.9860, test_loss: 1.0059, test_f1: 0.5052
 epoch: 3, train_loss: 0.9489, test_loss: 0.9850, test_f1: 0.5192
 epoch: 4, train_loss: 0.9162, test_loss: 0.9582, test_f1: 0.4872
 epoch: 5, train_loss: 0.8961, test_loss: 1.0141, test_f1: 0.4893
 epoch: 6, train_loss: 0.8710, test_loss: 0.9842, test_f1: 0.5006
 epoch: 7, train_loss: 0.8608, test_loss: 0.8872, test_f1: 0.5401
 epoch: 8, train_loss: 0.8497, test_loss: 0.9343, test_f1: 0.4911
 epoch: 9, train_loss: 0.8290, test_loss: 0.9453, test_f1: 0.5102
 epoch: 10, train_loss: 0.8135, test_loss: 0.8512, test_f1: 0.5619
 epoch: 11, train_loss: 0.8095, test_loss: 0.8368, test_f1: 0.5548
 epoch: 12, train_loss: 0.7782, test_loss: 0.7832, test_f1: 0.6216
 epoch: 13, train_loss: 0.7751, test_loss: 0.8608, test_f1: 0.6274
 epoch: 14, train_loss: 0.7480, test_loss: 0.9216, test_f1: 0.5913
 epoch: 15, train_loss: 0.7394, test_loss: 0.8741, test_f1: 0.5814
 epoch: 16, train_loss: 0.7384, test_loss: 0.7786, test_f1: 0.6033
 epoch: 17, train_loss: 0.7144, test_loss: 0.7349, test_f1: 0.6613
 epoch: 18, train_loss: 0.7115, test_loss: 0.8678, test_f1: 0.5879
 epoch: 19, train_loss: 0.6948, test_loss: 0.9376, test_f1: 0.6327
 epoch: 20, train_loss: 0.6807, test_loss: 0.8780, test_f1: 0.5839
 epoch: 21, train_loss: 0.6735, test_loss: 0.7721, test_f1: 0.6243
 epoch: 22, train_loss: 0.6534, test_loss: 0.8800, test_f1: 0.6226
 epoch: 23, train_loss: 0.6532, test_loss: 0.8145, test_f1: 0.5825
 epoch: 24, train_loss: 0.6273, test_loss: 0.8139, test_f1: 0.5840
 epoch: 25, train_loss: 0.6302, test_loss: 0.8225, test_f1: 0.6004
 epoch: 26, train_loss: 0.6272, test_loss: 0.7152, test_f1: 0.6705
 epoch: 27, train_loss: 0.6176, test_loss: 0.8409, test_f1: 0.6211
 epoch: 28, train_loss: 0.6157, test_loss: 0.8383, test_f1: 0.6332
 epoch: 29, train_loss: 0.6126, test_loss: 0.7678, test_f1: 0.6398
 epoch: 30, train_loss: 0.5758, test_loss: 0.7425, test_f1: 0.6741
 epoch: 31, train_loss: 0.5650, test_loss: 0.7949, test_f1: 0.6388
 epoch: 32, train_loss: 0.5477, test_loss: 0.8214, test_f1: 0.6407
 epoch: 33, train_loss: 0.5540, test_loss: 0.7241, test_f1: 0.6844
 epoch: 34, train_loss: 0.5549, test_loss: 0.9152, test_f1: 0.6470
 epoch: 35, train_loss: 0.5550, test_loss: 0.7433, test_f1: 0.6659
 epoch: 36, train_loss: 0.5365, test_loss: 0.8087, test_f1: 0.6484
 epoch: 37, train_loss: 0.5278, test_loss: 0.8407, test_f1: 0.6425
 epoch: 38, train_loss: 0.5469, test_loss: 0.8701, test_f1: 0.6556
 epoch: 39, train_loss: 0.5281, test_loss: 0.7812, test_f1: 0.6595
 epoch: 40, train_loss: 0.5071, test_loss: 0.9078, test_f1: 0.6507
 epoch: 41, train_loss: 0.5139, test_loss: 0.9325, test_f1: 0.6441
 epoch: 42, train_loss: 0.5065, test_loss: 0.7872, test_f1: 0.6535
 epoch: 43, train_loss: 0.4975, test_loss: 0.8998, test_f1: 0.6834
 epoch: 44, train_loss: 0.4777, test_loss: 1.0036, test_f1: 0.6375
 epoch: 45, train_loss: 0.5150, test_loss: 0.9198, test_f1: 0.6302
 epoch: 46, train_loss: 0.4953, test_loss: 0.7650, test_f1: 0.6617
 epoch: 47, train_loss: 0.4785, test_loss: 0.8519, test_f1: 0.6842
 epoch: 48, train_loss: 0.4768, test_loss: 0.9210, test_f1: 0.6325
 epoch: 49, train_loss: 0.4749, test_loss: 0.9156, test_f1: 0.6544
 epoch: 50, train_loss: 0.4478, test_loss: 0.9341, test_f1: 0.6601
 epoch: 51, train_loss: 0.4158, test_loss: 0.8469, test_f1: 0.6941
 epoch: 52, train_loss: 0.4085, test_loss: 0.8559, test_f1: 0.6937
 epoch: 53, train_loss: 0.3747, test_loss: 0.9463, test_f1: 0.6839
 epoch: 54, train_loss: 0.3737, test_loss: 0.9431, test_f1: 0.6953
 epoch: 55, train_loss: 0.3888, test_loss: 0.8955, test_f1: 0.6822
 epoch: 56, train_loss: 0.3607, test_loss: 0.9733, test_f1: 0.6872
 epoch: 57, train_loss: 0.3597, test_loss: 1.0263, test_f1: 0.6643
 epoch: 58, train_loss: 0.3615, test_loss: 1.0267, test_f1: 0.6791
 epoch: 59, train_loss: 0.3494, test_loss: 1.1138, test_f1: 0.6557
 epoch: 60, train_loss: 0.3614, test_loss: 1.0931, test_f1: 0.6362
 epoch: 61, train_loss: 0.3417, test_loss: 0.9346, test_f1: 0.7003
 epoch: 62, train_loss: 0.3351, test_loss: 1.0554, test_f1: 0.6768
 epoch: 63, train_loss: 0.3280, test_loss: 1.1249, test_f1: 0.6666
 epoch: 64, train_loss: 0.3318, test_loss: 0.9584, test_f1: 0.6842
 epoch: 65, train_loss: 0.3383, test_loss: 0.9623, test_f1: 0.6886
 epoch: 66, train_loss: 0.3327, test_loss: 1.0899, test_f1: 0.6895
 epoch: 67, train_loss: 0.3165, test_loss: 1.0504, test_f1: 0.6988
 epoch: 68, train_loss: 0.3177, test_loss: 1.0610, test_f1: 0.6706
 epoch: 69, train_loss: 0.3257, test_loss: 1.0376, test_f1: 0.7112
 epoch: 70, train_loss: 0.3165, test_loss: 1.0836, test_f1: 0.7136
 epoch: 71, train_loss: 0.3193, test_loss: 1.0869, test_f1: 0.6832
 epoch: 72, train_loss: 0.2995, test_loss: 1.1870, test_f1: 0.6838
 epoch: 73, train_loss: 0.3057, test_loss: 1.1256, test_f1: 0.7097
 epoch: 74, train_loss: 0.2944, test_loss: 1.2173, test_f1: 0.6875
 epoch: 75, train_loss: 0.3027, test_loss: 1.3014, test_f1: 0.6308
 epoch: 76, train_loss: 0.2919, test_loss: 1.3937, test_f1: 0.6809
 epoch: 77, train_loss: 0.3043, test_loss: 1.1995, test_f1: 0.6689
 epoch: 78, train_loss: 0.3135, test_loss: 1.1159, test_f1: 0.6940
 epoch: 79, train_loss: 0.2782, test_loss: 1.1734, test_f1: 0.6779
 epoch: 80, train_loss: 0.2772, test_loss: 1.0570, test_f1: 0.6967
 epoch: 81, train_loss: 0.2734, test_loss: 1.1820, test_f1: 0.6997
 epoch: 82, train_loss: 0.2614, test_loss: 1.1545, test_f1: 0.6906
 epoch: 83, train_loss: 0.2645, test_loss: 1.1528, test_f1: 0.6978
 epoch: 84, train_loss: 0.2705, test_loss: 1.1377, test_f1: 0.6893
 epoch: 85, train_loss: 0.2830, test_loss: 1.0034, test_f1: 0.7154
 epoch: 86, train_loss: 0.2686, test_loss: 1.1592, test_f1: 0.6997
 epoch: 87, train_loss: 0.2544, test_loss: 1.2098, test_f1: 0.7076
 epoch: 88, train_loss: 0.2435, test_loss: 1.2541, test_f1: 0.6986
 epoch: 89, train_loss: 0.2498, test_loss: 1.2731, test_f1: 0.7112
 epoch: 90, train_loss: 0.2530, test_loss: 1.2889, test_f1: 0.6919
 epoch: 91, train_loss: 0.2704, test_loss: 1.2175, test_f1: 0.7125
 epoch: 92, train_loss: 0.2556, test_loss: 1.2783, test_f1: 0.6817
 epoch: 93, train_loss: 0.2582, test_loss: 1.3398, test_f1: 0.6919
 epoch: 94, train_loss: 0.2499, test_loss: 1.3146, test_f1: 0.6991
 epoch: 95, train_loss: 0.2510, test_loss: 1.3256, test_f1: 0.7028
 epoch: 96, train_loss: 0.2438, test_loss: 1.3125, test_f1: 0.7075
 epoch: 97, train_loss: 0.2435, test_loss: 1.5516, test_f1: 0.6786
 epoch: 98, train_loss: 0.2309, test_loss: 1.4659, test_f1: 0.6749
 epoch: 99, train_loss: 0.2247, test_loss: 1.3991, test_f1: 0.7144
##################ITERATION #1 ****************************************
 epoch: 0, train_loss: 1.0869, test_loss: 1.1218, test_f1: 0.3427
 epoch: 1, train_loss: 1.0005, test_loss: 0.9445, test_f1: 0.5103
 epoch: 2, train_loss: 0.9522, test_loss: 0.9000, test_f1: 0.5420
 epoch: 3, train_loss: 0.9331, test_loss: 0.9546, test_f1: 0.5036
 epoch: 4, train_loss: 0.9076, test_loss: 0.9480, test_f1: 0.4961
 epoch: 5, train_loss: 0.8946, test_loss: 0.8551, test_f1: 0.5943
 epoch: 6, train_loss: 0.8602, test_loss: 0.8727, test_f1: 0.5485
 epoch: 7, train_loss: 0.8530, test_loss: 0.8465, test_f1: 0.5271
 epoch: 8, train_loss: 0.8515, test_loss: 0.8409, test_f1: 0.5681
 epoch: 9, train_loss: 0.8183, test_loss: 0.8353, test_f1: 0.5734
 epoch: 10, train_loss: 0.8036, test_loss: 0.7818, test_f1: 0.5942
 epoch: 11, train_loss: 0.7866, test_loss: 0.8596, test_f1: 0.5394
 epoch: 12, train_loss: 0.7805, test_loss: 0.7778, test_f1: 0.6137
 epoch: 13, train_loss: 0.7556, test_loss: 0.7485, test_f1: 0.6711
 epoch: 14, train_loss: 0.7364, test_loss: 0.7630, test_f1: 0.6132
 epoch: 15, train_loss: 0.7231, test_loss: 0.7840, test_f1: 0.6165
 epoch: 16, train_loss: 0.7277, test_loss: 0.7194, test_f1: 0.6861
 epoch: 17, train_loss: 0.7107, test_loss: 0.7809, test_f1: 0.6061
 epoch: 18, train_loss: 0.7042, test_loss: 0.7805, test_f1: 0.6177
 epoch: 19, train_loss: 0.6777, test_loss: 0.7112, test_f1: 0.6803
 epoch: 20, train_loss: 0.6792, test_loss: 0.7220, test_f1: 0.6508
 epoch: 21, train_loss: 0.6740, test_loss: 0.7795, test_f1: 0.6573
 epoch: 22, train_loss: 0.6392, test_loss: 0.7187, test_f1: 0.6680
 epoch: 23, train_loss: 0.6509, test_loss: 0.7495, test_f1: 0.6708
 epoch: 24, train_loss: 0.6382, test_loss: 0.7424, test_f1: 0.6497
 epoch: 25, train_loss: 0.6224, test_loss: 0.8361, test_f1: 0.6433
 epoch: 26, train_loss: 0.6334, test_loss: 0.7146, test_f1: 0.6602
 epoch: 27, train_loss: 0.6170, test_loss: 0.6951, test_f1: 0.6893
 epoch: 28, train_loss: 0.5954, test_loss: 0.7673, test_f1: 0.6643
 epoch: 29, train_loss: 0.5919, test_loss: 0.8424, test_f1: 0.6228
 epoch: 30, train_loss: 0.5891, test_loss: 0.7844, test_f1: 0.6533
 epoch: 31, train_loss: 0.5950, test_loss: 0.7036, test_f1: 0.6691
 epoch: 32, train_loss: 0.5780, test_loss: 0.7785, test_f1: 0.6522
 epoch: 33, train_loss: 0.5780, test_loss: 0.8476, test_f1: 0.6415
 epoch: 34, train_loss: 0.5711, test_loss: 0.8688, test_f1: 0.6435
 epoch: 35, train_loss: 0.5649, test_loss: 0.8036, test_f1: 0.6500
 epoch: 36, train_loss: 0.5532, test_loss: 0.8575, test_f1: 0.6392
 epoch: 37, train_loss: 0.5442, test_loss: 0.7717, test_f1: 0.6574
 epoch: 38, train_loss: 0.5539, test_loss: 0.8028, test_f1: 0.6527
 epoch: 39, train_loss: 0.5413, test_loss: 0.8167, test_f1: 0.6720
 epoch: 40, train_loss: 0.5210, test_loss: 0.9227, test_f1: 0.6690
 epoch: 41, train_loss: 0.5184, test_loss: 0.8235, test_f1: 0.6663
 epoch: 42, train_loss: 0.5351, test_loss: 0.7400, test_f1: 0.6870
 epoch: 43, train_loss: 0.5086, test_loss: 0.8437, test_f1: 0.6699
 epoch: 44, train_loss: 0.5125, test_loss: 0.8611, test_f1: 0.6763
 epoch: 45, train_loss: 0.5025, test_loss: 0.7447, test_f1: 0.6981
 epoch: 46, train_loss: 0.4729, test_loss: 0.9651, test_f1: 0.6599
 epoch: 47, train_loss: 0.4809, test_loss: 1.0557, test_f1: 0.6460
 epoch: 48, train_loss: 0.4814, test_loss: 0.9245, test_f1: 0.6339
 epoch: 49, train_loss: 0.4780, test_loss: 1.0110, test_f1: 0.6426
 epoch: 50, train_loss: 0.4661, test_loss: 0.7852, test_f1: 0.6886
 epoch: 51, train_loss: 0.4360, test_loss: 0.9927, test_f1: 0.6649
 epoch: 52, train_loss: 0.4212, test_loss: 0.9857, test_f1: 0.6785
 epoch: 53, train_loss: 0.3948, test_loss: 0.9987, test_f1: 0.6690
 epoch: 54, train_loss: 0.3987, test_loss: 0.9988, test_f1: 0.6772
 epoch: 55, train_loss: 0.3888, test_loss: 1.0560, test_f1: 0.6869
 epoch: 56, train_loss: 0.3817, test_loss: 1.1552, test_f1: 0.6597
 epoch: 57, train_loss: 0.3847, test_loss: 1.0205, test_f1: 0.6961
 epoch: 58, train_loss: 0.3691, test_loss: 0.9973, test_f1: 0.6912
 epoch: 59, train_loss: 0.3689, test_loss: 1.1522, test_f1: 0.6683
 epoch: 60, train_loss: 0.3595, test_loss: 1.1986, test_f1: 0.6478
 epoch: 61, train_loss: 0.3679, test_loss: 1.1531, test_f1: 0.6686
 epoch: 62, train_loss: 0.3555, test_loss: 1.1371, test_f1: 0.6794
 epoch: 63, train_loss: 0.3578, test_loss: 1.1903, test_f1: 0.6580
 epoch: 64, train_loss: 0.3567, test_loss: 1.1315, test_f1: 0.6799
 epoch: 65, train_loss: 0.3568, test_loss: 1.1055, test_f1: 0.6742
 epoch: 66, train_loss: 0.3391, test_loss: 1.1734, test_f1: 0.6516
 epoch: 67, train_loss: 0.3505, test_loss: 1.3538, test_f1: 0.6601
 epoch: 68, train_loss: 0.3235, test_loss: 1.2748, test_f1: 0.6511
 epoch: 69, train_loss: 0.3347, test_loss: 1.3626, test_f1: 0.6653
 epoch: 70, train_loss: 0.3498, test_loss: 1.4006, test_f1: 0.6733
 epoch: 71, train_loss: 0.3283, test_loss: 1.3453, test_f1: 0.6681
 epoch: 72, train_loss: 0.3050, test_loss: 1.3895, test_f1: 0.6760
 epoch: 73, train_loss: 0.3430, test_loss: 1.4085, test_f1: 0.6794
 epoch: 74, train_loss: 0.3067, test_loss: 1.4642, test_f1: 0.6586
 epoch: 75, train_loss: 0.3077, test_loss: 1.3606, test_f1: 0.6609
 epoch: 76, train_loss: 0.3049, test_loss: 1.5866, test_f1: 0.6572
 epoch: 77, train_loss: 0.3035, test_loss: 1.4997, test_f1: 0.6711
 epoch: 78, train_loss: 0.3215, test_loss: 1.5541, test_f1: 0.6592
 epoch: 79, train_loss: 0.3244, test_loss: 1.4992, test_f1: 0.6508
 epoch: 80, train_loss: 0.3045, test_loss: 1.5490, test_f1: 0.6578
 epoch: 81, train_loss: 0.3065, test_loss: 1.4575, test_f1: 0.6519
 epoch: 82, train_loss: 0.2901, test_loss: 1.5346, test_f1: 0.6586
 epoch: 83, train_loss: 0.2942, test_loss: 1.5043, test_f1: 0.6617
 epoch: 84, train_loss: 0.2937, test_loss: 1.6829, test_f1: 0.6593
 epoch: 85, train_loss: 0.2802, test_loss: 1.7690, test_f1: 0.6455
 epoch: 86, train_loss: 0.2928, test_loss: 1.6426, test_f1: 0.6556
 epoch: 87, train_loss: 0.3093, test_loss: 1.6281, test_f1: 0.6435
 epoch: 88, train_loss: 0.2924, test_loss: 1.6555, test_f1: 0.6510
 epoch: 89, train_loss: 0.2812, test_loss: 1.7686, test_f1: 0.6576
 epoch: 90, train_loss: 0.2706, test_loss: 1.6541, test_f1: 0.6655
 epoch: 91, train_loss: 0.2698, test_loss: 1.7777, test_f1: 0.6714
 epoch: 92, train_loss: 0.2605, test_loss: 1.7487, test_f1: 0.6570
 epoch: 93, train_loss: 0.2630, test_loss: 1.7745, test_f1: 0.6652
 epoch: 94, train_loss: 0.2663, test_loss: 1.7884, test_f1: 0.6473
 epoch: 95, train_loss: 0.2742, test_loss: 1.6044, test_f1: 0.6691
 epoch: 96, train_loss: 0.2758, test_loss: 1.7918, test_f1: 0.6729
 epoch: 97, train_loss: 0.2585, test_loss: 1.7687, test_f1: 0.6460
 epoch: 98, train_loss: 0.2787, test_loss: 1.7001, test_f1: 0.6544
 epoch: 99, train_loss: 0.2783, test_loss: 1.7356, test_f1: 0.6441
##################ITERATION #2 ****************************************
 epoch: 0, train_loss: 1.1103, test_loss: 1.4051, test_f1: 0.3568
 epoch: 1, train_loss: 0.9935, test_loss: 1.0032, test_f1: 0.5299
 epoch: 2, train_loss: 0.9581, test_loss: 0.9602, test_f1: 0.5126
 epoch: 3, train_loss: 0.9310, test_loss: 0.9481, test_f1: 0.5362
 epoch: 4, train_loss: 0.8890, test_loss: 0.9298, test_f1: 0.5323
 epoch: 5, train_loss: 0.8736, test_loss: 0.9374, test_f1: 0.5406
 epoch: 6, train_loss: 0.8558, test_loss: 0.9163, test_f1: 0.5624
 epoch: 7, train_loss: 0.8372, test_loss: 0.9252, test_f1: 0.5681
 epoch: 8, train_loss: 0.8254, test_loss: 0.8628, test_f1: 0.6011
 epoch: 9, train_loss: 0.7987, test_loss: 0.8758, test_f1: 0.5858
 epoch: 10, train_loss: 0.7829, test_loss: 0.8793, test_f1: 0.5779
 epoch: 11, train_loss: 0.7758, test_loss: 0.8311, test_f1: 0.6236
 epoch: 12, train_loss: 0.7599, test_loss: 0.8298, test_f1: 0.5956
 epoch: 13, train_loss: 0.7595, test_loss: 0.7901, test_f1: 0.6216
 epoch: 14, train_loss: 0.7418, test_loss: 0.7245, test_f1: 0.6625
 epoch: 15, train_loss: 0.7305, test_loss: 0.8153, test_f1: 0.5915
 epoch: 16, train_loss: 0.7136, test_loss: 0.7928, test_f1: 0.6221
 epoch: 17, train_loss: 0.7042, test_loss: 0.7992, test_f1: 0.6463
 epoch: 18, train_loss: 0.6877, test_loss: 0.8208, test_f1: 0.6195
 epoch: 19, train_loss: 0.6763, test_loss: 0.7293, test_f1: 0.6399
 epoch: 20, train_loss: 0.6637, test_loss: 0.7985, test_f1: 0.6236
 epoch: 21, train_loss: 0.6529, test_loss: 0.8559, test_f1: 0.6301
 epoch: 22, train_loss: 0.6554, test_loss: 0.8029, test_f1: 0.6434
 epoch: 23, train_loss: 0.6702, test_loss: 0.7118, test_f1: 0.6641
 epoch: 24, train_loss: 0.6252, test_loss: 0.7444, test_f1: 0.6577
 epoch: 25, train_loss: 0.6205, test_loss: 0.8009, test_f1: 0.6582
 epoch: 26, train_loss: 0.6284, test_loss: 0.7317, test_f1: 0.6779
 epoch: 27, train_loss: 0.6262, test_loss: 0.7981, test_f1: 0.6316
 epoch: 28, train_loss: 0.6038, test_loss: 0.8557, test_f1: 0.6396
 epoch: 29, train_loss: 0.5945, test_loss: 0.8576, test_f1: 0.6503
 epoch: 30, train_loss: 0.5765, test_loss: 0.8118, test_f1: 0.6766
 epoch: 31, train_loss: 0.5872, test_loss: 0.7909, test_f1: 0.6809
 epoch: 32, train_loss: 0.5592, test_loss: 0.8139, test_f1: 0.6670
 epoch: 33, train_loss: 0.5705, test_loss: 0.9547, test_f1: 0.6132
 epoch: 34, train_loss: 0.5471, test_loss: 0.7625, test_f1: 0.6656
 epoch: 35, train_loss: 0.5329, test_loss: 0.8526, test_f1: 0.6603
 epoch: 36, train_loss: 0.5308, test_loss: 0.9002, test_f1: 0.6436
 epoch: 37, train_loss: 0.5306, test_loss: 0.9646, test_f1: 0.6517
 epoch: 38, train_loss: 0.5292, test_loss: 0.7878, test_f1: 0.6622
 epoch: 39, train_loss: 0.5162, test_loss: 0.8753, test_f1: 0.6450
 epoch: 40, train_loss: 0.5151, test_loss: 0.9141, test_f1: 0.6541
 epoch: 41, train_loss: 0.5228, test_loss: 0.8920, test_f1: 0.6164
 epoch: 42, train_loss: 0.5083, test_loss: 0.9422, test_f1: 0.6296
 epoch: 43, train_loss: 0.4854, test_loss: 1.0047, test_f1: 0.6304
 epoch: 44, train_loss: 0.4779, test_loss: 0.9514, test_f1: 0.6467
 epoch: 45, train_loss: 0.4891, test_loss: 1.0247, test_f1: 0.6583
 epoch: 46, train_loss: 0.4744, test_loss: 0.9771, test_f1: 0.6414
 epoch: 47, train_loss: 0.4707, test_loss: 0.9071, test_f1: 0.6615
 epoch: 48, train_loss: 0.4717, test_loss: 0.8724, test_f1: 0.6686
 epoch: 49, train_loss: 0.4793, test_loss: 0.9025, test_f1: 0.6448
 epoch: 50, train_loss: 0.4501, test_loss: 1.0490, test_f1: 0.6431
 epoch: 51, train_loss: 0.4222, test_loss: 1.0699, test_f1: 0.6391
 epoch: 52, train_loss: 0.3936, test_loss: 1.0122, test_f1: 0.6614
 epoch: 53, train_loss: 0.3783, test_loss: 1.0934, test_f1: 0.6806
 epoch: 54, train_loss: 0.3823, test_loss: 1.0612, test_f1: 0.6581
 epoch: 55, train_loss: 0.3730, test_loss: 1.1310, test_f1: 0.6472
 epoch: 56, train_loss: 0.3983, test_loss: 1.1779, test_f1: 0.6410
 epoch: 57, train_loss: 0.3718, test_loss: 1.2127, test_f1: 0.6580
 epoch: 58, train_loss: 0.3626, test_loss: 1.1745, test_f1: 0.6605
 epoch: 59, train_loss: 0.3731, test_loss: 1.1481, test_f1: 0.6462
 epoch: 60, train_loss: 0.3588, test_loss: 1.1049, test_f1: 0.6711
 epoch: 61, train_loss: 0.3501, test_loss: 1.2541, test_f1: 0.6503
 epoch: 62, train_loss: 0.3476, test_loss: 1.2845, test_f1: 0.6437
 epoch: 63, train_loss: 0.3559, test_loss: 1.2096, test_f1: 0.6538
 epoch: 64, train_loss: 0.3457, test_loss: 1.2803, test_f1: 0.6779
 epoch: 65, train_loss: 0.3525, test_loss: 1.1671, test_f1: 0.6787
 epoch: 66, train_loss: 0.3188, test_loss: 1.2517, test_f1: 0.6690
 epoch: 67, train_loss: 0.3344, test_loss: 1.3336, test_f1: 0.6772
 epoch: 68, train_loss: 0.3327, test_loss: 1.3910, test_f1: 0.6564
 epoch: 69, train_loss: 0.3303, test_loss: 1.1441, test_f1: 0.6675
 epoch: 70, train_loss: 0.3269, test_loss: 1.3308, test_f1: 0.6684
 epoch: 71, train_loss: 0.3217, test_loss: 1.2870, test_f1: 0.6567
 epoch: 72, train_loss: 0.3243, test_loss: 1.2844, test_f1: 0.6347
 epoch: 73, train_loss: 0.3272, test_loss: 1.1597, test_f1: 0.6539
 epoch: 74, train_loss: 0.3100, test_loss: 1.2890, test_f1: 0.6545
 epoch: 75, train_loss: 0.2818, test_loss: 1.3208, test_f1: 0.6719
 epoch: 76, train_loss: 0.3220, test_loss: 1.1619, test_f1: 0.6668
 epoch: 77, train_loss: 0.3085, test_loss: 1.3758, test_f1: 0.6676
 epoch: 78, train_loss: 0.2956, test_loss: 1.5136, test_f1: 0.6673
 epoch: 79, train_loss: 0.2881, test_loss: 1.4466, test_f1: 0.6560
 epoch: 80, train_loss: 0.2730, test_loss: 1.4076, test_f1: 0.6673
 epoch: 81, train_loss: 0.3273, test_loss: 1.5447, test_f1: 0.6402
 epoch: 82, train_loss: 0.2921, test_loss: 1.4253, test_f1: 0.6616
 epoch: 83, train_loss: 0.2863, test_loss: 1.5474, test_f1: 0.6390
 epoch: 84, train_loss: 0.2881, test_loss: 1.5284, test_f1: 0.6539
 epoch: 85, train_loss: 0.2833, test_loss: 1.4482, test_f1: 0.6718
 epoch: 86, train_loss: 0.2959, test_loss: 1.4292, test_f1: 0.6727
 epoch: 87, train_loss: 0.2894, test_loss: 1.5225, test_f1: 0.6591
 epoch: 88, train_loss: 0.2864, test_loss: 1.4579, test_f1: 0.6487
 epoch: 89, train_loss: 0.2913, test_loss: 1.3415, test_f1: 0.6885
 epoch: 90, train_loss: 0.2584, test_loss: 1.4650, test_f1: 0.6646
 epoch: 91, train_loss: 0.2773, test_loss: 1.6640, test_f1: 0.6587
 epoch: 92, train_loss: 0.2588, test_loss: 1.4489, test_f1: 0.6743
 epoch: 93, train_loss: 0.2703, test_loss: 1.4804, test_f1: 0.6546
 epoch: 94, train_loss: 0.2454, test_loss: 1.6666, test_f1: 0.6511
 epoch: 95, train_loss: 0.2441, test_loss: 1.5600, test_f1: 0.6484
 epoch: 96, train_loss: 0.2590, test_loss: 1.5290, test_f1: 0.6439
 epoch: 97, train_loss: 0.2352, test_loss: 1.4842, test_f1: 0.6724
 epoch: 98, train_loss: 0.2427, test_loss: 1.6107, test_f1: 0.6594
 epoch: 99, train_loss: 0.2453, test_loss: 1.7050, test_f1: 0.6583
##################ITERATION #3 ****************************************
 epoch: 0, train_loss: 1.1494, test_loss: 1.0557, test_f1: 0.4204
 epoch: 1, train_loss: 0.9816, test_loss: 0.9865, test_f1: 0.5270
 epoch: 2, train_loss: 0.9533, test_loss: 0.9190, test_f1: 0.5151
 epoch: 3, train_loss: 0.9086, test_loss: 0.9171, test_f1: 0.4971
 epoch: 4, train_loss: 0.9014, test_loss: 0.9413, test_f1: 0.5551
 epoch: 5, train_loss: 0.8725, test_loss: 0.9054, test_f1: 0.5601
 epoch: 6, train_loss: 0.8584, test_loss: 0.9192, test_f1: 0.5361
 epoch: 7, train_loss: 0.8377, test_loss: 0.8464, test_f1: 0.5864
 epoch: 8, train_loss: 0.8234, test_loss: 0.8588, test_f1: 0.5699
 epoch: 9, train_loss: 0.8071, test_loss: 0.8368, test_f1: 0.6002
 epoch: 10, train_loss: 0.7902, test_loss: 0.8693, test_f1: 0.5643
 epoch: 11, train_loss: 0.7721, test_loss: 0.8478, test_f1: 0.6248
 epoch: 12, train_loss: 0.7523, test_loss: 0.8231, test_f1: 0.6142
 epoch: 13, train_loss: 0.7453, test_loss: 0.7880, test_f1: 0.6305
 epoch: 14, train_loss: 0.7348, test_loss: 0.8380, test_f1: 0.6000
 epoch: 15, train_loss: 0.7095, test_loss: 0.8137, test_f1: 0.6380
 epoch: 16, train_loss: 0.6980, test_loss: 0.7763, test_f1: 0.6300
 epoch: 17, train_loss: 0.6929, test_loss: 0.8059, test_f1: 0.6275
 epoch: 18, train_loss: 0.6891, test_loss: 0.7526, test_f1: 0.6153
 epoch: 19, train_loss: 0.6792, test_loss: 0.7873, test_f1: 0.6392
 epoch: 20, train_loss: 0.6642, test_loss: 0.7992, test_f1: 0.6326
 epoch: 21, train_loss: 0.6465, test_loss: 0.8840, test_f1: 0.6133
 epoch: 22, train_loss: 0.6259, test_loss: 0.8193, test_f1: 0.6310
 epoch: 23, train_loss: 0.6348, test_loss: 0.8052, test_f1: 0.6532
 epoch: 24, train_loss: 0.6163, test_loss: 0.7488, test_f1: 0.6801
 epoch: 25, train_loss: 0.6079, test_loss: 0.7976, test_f1: 0.6579
 epoch: 26, train_loss: 0.5972, test_loss: 0.8392, test_f1: 0.6471
 epoch: 27, train_loss: 0.6028, test_loss: 0.8062, test_f1: 0.6499
 epoch: 28, train_loss: 0.6165, test_loss: 0.8668, test_f1: 0.6496
 epoch: 29, train_loss: 0.5790, test_loss: 0.8241, test_f1: 0.6396
 epoch: 30, train_loss: 0.5929, test_loss: 0.8525, test_f1: 0.6434
 epoch: 31, train_loss: 0.5741, test_loss: 0.7856, test_f1: 0.6224
 epoch: 32, train_loss: 0.5715, test_loss: 0.9322, test_f1: 0.6411
 epoch: 33, train_loss: 0.5702, test_loss: 0.8152, test_f1: 0.6580
 epoch: 34, train_loss: 0.5605, test_loss: 0.8096, test_f1: 0.6606
 epoch: 35, train_loss: 0.5456, test_loss: 0.8105, test_f1: 0.6822
 epoch: 36, train_loss: 0.5324, test_loss: 0.9327, test_f1: 0.6589
 epoch: 37, train_loss: 0.5385, test_loss: 1.0117, test_f1: 0.6470
 epoch: 38, train_loss: 0.5127, test_loss: 0.8713, test_f1: 0.6612
 epoch: 39, train_loss: 0.5377, test_loss: 0.9055, test_f1: 0.6845
 epoch: 40, train_loss: 0.5229, test_loss: 0.8511, test_f1: 0.6564
 epoch: 41, train_loss: 0.5097, test_loss: 0.9900, test_f1: 0.6625
 epoch: 42, train_loss: 0.5020, test_loss: 0.8583, test_f1: 0.6553
 epoch: 43, train_loss: 0.4869, test_loss: 0.9715, test_f1: 0.6592
 epoch: 44, train_loss: 0.4812, test_loss: 1.0261, test_f1: 0.6380
 epoch: 45, train_loss: 0.4853, test_loss: 0.8994, test_f1: 0.6925
 epoch: 46, train_loss: 0.4863, test_loss: 0.8463, test_f1: 0.6862
 epoch: 47, train_loss: 0.4849, test_loss: 0.8534, test_f1: 0.6887
 epoch: 48, train_loss: 0.5101, test_loss: 0.9356, test_f1: 0.6695
 epoch: 49, train_loss: 0.4671, test_loss: 0.9917, test_f1: 0.6394
 epoch: 50, train_loss: 0.4630, test_loss: 0.9811, test_f1: 0.6731
 epoch: 51, train_loss: 0.4124, test_loss: 0.9233, test_f1: 0.6640
 epoch: 52, train_loss: 0.4011, test_loss: 0.9300, test_f1: 0.6825
 epoch: 53, train_loss: 0.3973, test_loss: 1.0395, test_f1: 0.6548
 epoch: 54, train_loss: 0.3718, test_loss: 1.0063, test_f1: 0.6773
 epoch: 55, train_loss: 0.3716, test_loss: 1.0112, test_f1: 0.6850
 epoch: 56, train_loss: 0.3690, test_loss: 0.9857, test_f1: 0.6689
 epoch: 57, train_loss: 0.3608, test_loss: 1.0691, test_f1: 0.6781
 epoch: 58, train_loss: 0.3571, test_loss: 1.0248, test_f1: 0.6825
 epoch: 59, train_loss: 0.3626, test_loss: 1.0440, test_f1: 0.6663
 epoch: 60, train_loss: 0.3537, test_loss: 1.0578, test_f1: 0.6807
 epoch: 61, train_loss: 0.3544, test_loss: 1.1462, test_f1: 0.6522
 epoch: 62, train_loss: 0.3399, test_loss: 1.1427, test_f1: 0.6653
 epoch: 63, train_loss: 0.3524, test_loss: 1.1281, test_f1: 0.6796
 epoch: 64, train_loss: 0.3459, test_loss: 1.0909, test_f1: 0.6863
 epoch: 65, train_loss: 0.3387, test_loss: 1.0862, test_f1: 0.6975
 epoch: 66, train_loss: 0.3237, test_loss: 1.0772, test_f1: 0.6967
 epoch: 67, train_loss: 0.3458, test_loss: 1.1751, test_f1: 0.6669
 epoch: 68, train_loss: 0.3199, test_loss: 1.1102, test_f1: 0.6681
 epoch: 69, train_loss: 0.3285, test_loss: 1.1420, test_f1: 0.6547
 epoch: 70, train_loss: 0.3224, test_loss: 1.1697, test_f1: 0.6677
 epoch: 71, train_loss: 0.3089, test_loss: 1.3078, test_f1: 0.6763
 epoch: 72, train_loss: 0.3108, test_loss: 1.2654, test_f1: 0.6688
 epoch: 73, train_loss: 0.3360, test_loss: 1.2808, test_f1: 0.6786
 epoch: 74, train_loss: 0.3063, test_loss: 1.2983, test_f1: 0.6657
 epoch: 75, train_loss: 0.3341, test_loss: 1.2716, test_f1: 0.6681
 epoch: 76, train_loss: 0.3019, test_loss: 1.3562, test_f1: 0.6686
 epoch: 77, train_loss: 0.3067, test_loss: 1.2573, test_f1: 0.6701
 epoch: 78, train_loss: 0.2858, test_loss: 1.3367, test_f1: 0.6785
 epoch: 79, train_loss: 0.3154, test_loss: 1.3474, test_f1: 0.6651
 epoch: 80, train_loss: 0.2860, test_loss: 1.3675, test_f1: 0.6357
 epoch: 81, train_loss: 0.2773, test_loss: 1.2646, test_f1: 0.6572
 epoch: 82, train_loss: 0.2724, test_loss: 1.4453, test_f1: 0.6671
 epoch: 83, train_loss: 0.2637, test_loss: 1.3570, test_f1: 0.6641
 epoch: 84, train_loss: 0.2727, test_loss: 1.4599, test_f1: 0.6530
 epoch: 85, train_loss: 0.2581, test_loss: 1.5048, test_f1: 0.6524
 epoch: 86, train_loss: 0.2842, test_loss: 1.3693, test_f1: 0.6717
 epoch: 87, train_loss: 0.2576, test_loss: 1.3870, test_f1: 0.6791
 epoch: 88, train_loss: 0.2691, test_loss: 1.3576, test_f1: 0.6820
 epoch: 89, train_loss: 0.2714, test_loss: 1.3914, test_f1: 0.6610
 epoch: 90, train_loss: 0.2532, test_loss: 1.4269, test_f1: 0.6668
 epoch: 91, train_loss: 0.2660, test_loss: 1.4782, test_f1: 0.6641
 epoch: 92, train_loss: 0.2558, test_loss: 1.3797, test_f1: 0.6843
 epoch: 93, train_loss: 0.2529, test_loss: 1.4273, test_f1: 0.6701
 epoch: 94, train_loss: 0.2568, test_loss: 1.3993, test_f1: 0.6799
 epoch: 95, train_loss: 0.2662, test_loss: 1.3613, test_f1: 0.6601
 epoch: 96, train_loss: 0.2528, test_loss: 1.4648, test_f1: 0.6574
 epoch: 97, train_loss: 0.2533, test_loss: 1.5289, test_f1: 0.6439
 epoch: 98, train_loss: 0.2582, test_loss: 1.5310, test_f1: 0.6574
 epoch: 99, train_loss: 0.2541, test_loss: 1.4511, test_f1: 0.6640
##################ITERATION #4 ****************************************
 epoch: 0, train_loss: 1.2475, test_loss: 1.2514, test_f1: 0.3401
 epoch: 1, train_loss: 1.0420, test_loss: 0.9667, test_f1: 0.5292
 epoch: 2, train_loss: 0.9676, test_loss: 0.9453, test_f1: 0.5078
 epoch: 3, train_loss: 0.9303, test_loss: 0.9455, test_f1: 0.5463
 epoch: 4, train_loss: 0.9070, test_loss: 0.8407, test_f1: 0.5770
 epoch: 5, train_loss: 0.8876, test_loss: 0.9008, test_f1: 0.5386
 epoch: 6, train_loss: 0.8663, test_loss: 0.8733, test_f1: 0.5693
 epoch: 7, train_loss: 0.8594, test_loss: 0.8134, test_f1: 0.6060
 epoch: 8, train_loss: 0.8271, test_loss: 0.7865, test_f1: 0.6235
 epoch: 9, train_loss: 0.8084, test_loss: 0.8392, test_f1: 0.6098
 epoch: 10, train_loss: 0.8222, test_loss: 0.8568, test_f1: 0.5937
 epoch: 11, train_loss: 0.8017, test_loss: 0.8151, test_f1: 0.6002
 epoch: 12, train_loss: 0.7982, test_loss: 0.7901, test_f1: 0.6413
 epoch: 13, train_loss: 0.7648, test_loss: 0.7442, test_f1: 0.6157
 epoch: 14, train_loss: 0.7737, test_loss: 0.7814, test_f1: 0.6222
 epoch: 15, train_loss: 0.7520, test_loss: 0.8000, test_f1: 0.6291
 epoch: 16, train_loss: 0.7389, test_loss: 0.8014, test_f1: 0.6061
 epoch: 17, train_loss: 0.7233, test_loss: 0.7768, test_f1: 0.6334
 epoch: 18, train_loss: 0.7094, test_loss: 0.7293, test_f1: 0.6384
 epoch: 19, train_loss: 0.7029, test_loss: 0.7935, test_f1: 0.6162
 epoch: 20, train_loss: 0.6854, test_loss: 0.7675, test_f1: 0.6415
 epoch: 21, train_loss: 0.6779, test_loss: 0.7315, test_f1: 0.6619
 epoch: 22, train_loss: 0.6709, test_loss: 0.7877, test_f1: 0.6389
 epoch: 23, train_loss: 0.6829, test_loss: 0.7614, test_f1: 0.6188
 epoch: 24, train_loss: 0.6702, test_loss: 0.7370, test_f1: 0.6310
 epoch: 25, train_loss: 0.6321, test_loss: 0.8106, test_f1: 0.6256
 epoch: 26, train_loss: 0.6549, test_loss: 0.8086, test_f1: 0.6438
 epoch: 27, train_loss: 0.6278, test_loss: 0.7910, test_f1: 0.6471
 epoch: 28, train_loss: 0.6418, test_loss: 0.7464, test_f1: 0.6582
 epoch: 29, train_loss: 0.6349, test_loss: 0.7721, test_f1: 0.6409
 epoch: 30, train_loss: 0.6113, test_loss: 0.7802, test_f1: 0.6572
 epoch: 31, train_loss: 0.6159, test_loss: 0.7809, test_f1: 0.6587
 epoch: 32, train_loss: 0.5972, test_loss: 0.7840, test_f1: 0.6835
 epoch: 33, train_loss: 0.5889, test_loss: 0.8034, test_f1: 0.6561
 epoch: 34, train_loss: 0.5883, test_loss: 0.8288, test_f1: 0.6674
 epoch: 35, train_loss: 0.5600, test_loss: 0.8300, test_f1: 0.6572
 epoch: 36, train_loss: 0.5700, test_loss: 0.9200, test_f1: 0.6184
 epoch: 37, train_loss: 0.5671, test_loss: 0.8839, test_f1: 0.6502
 epoch: 38, train_loss: 0.5557, test_loss: 0.8463, test_f1: 0.6399
 epoch: 39, train_loss: 0.5290, test_loss: 0.8492, test_f1: 0.6540
 epoch: 40, train_loss: 0.5268, test_loss: 0.8563, test_f1: 0.6611
 epoch: 41, train_loss: 0.5389, test_loss: 0.9324, test_f1: 0.6449
 epoch: 42, train_loss: 0.5285, test_loss: 0.9500, test_f1: 0.6501
 epoch: 43, train_loss: 0.5234, test_loss: 1.0014, test_f1: 0.6503
 epoch: 44, train_loss: 0.5089, test_loss: 0.8747, test_f1: 0.6579
 epoch: 45, train_loss: 0.5029, test_loss: 0.9588, test_f1: 0.6552
 epoch: 46, train_loss: 0.5022, test_loss: 0.9726, test_f1: 0.6391
 epoch: 47, train_loss: 0.4921, test_loss: 0.9993, test_f1: 0.6564
 epoch: 48, train_loss: 0.4866, test_loss: 1.0413, test_f1: 0.6535
 epoch: 49, train_loss: 0.5279, test_loss: 0.9870, test_f1: 0.6724
 epoch: 50, train_loss: 0.4940, test_loss: 1.0475, test_f1: 0.6428
 epoch: 51, train_loss: 0.4439, test_loss: 0.9922, test_f1: 0.6572
 epoch: 52, train_loss: 0.4368, test_loss: 1.0402, test_f1: 0.6718
 epoch: 53, train_loss: 0.4173, test_loss: 1.0164, test_f1: 0.6726
 epoch: 54, train_loss: 0.4098, test_loss: 1.0899, test_f1: 0.6812
 epoch: 55, train_loss: 0.3960, test_loss: 1.1059, test_f1: 0.6579
 epoch: 56, train_loss: 0.4131, test_loss: 1.0568, test_f1: 0.6639
 epoch: 57, train_loss: 0.3984, test_loss: 1.0285, test_f1: 0.6620
 epoch: 58, train_loss: 0.3833, test_loss: 1.1518, test_f1: 0.6682
 epoch: 59, train_loss: 0.3983, test_loss: 1.1196, test_f1: 0.6606
 epoch: 60, train_loss: 0.3996, test_loss: 1.1931, test_f1: 0.6661
 epoch: 61, train_loss: 0.3810, test_loss: 1.2044, test_f1: 0.6566
 epoch: 62, train_loss: 0.3715, test_loss: 1.1453, test_f1: 0.6626
 epoch: 63, train_loss: 0.3851, test_loss: 1.2582, test_f1: 0.6541
 epoch: 64, train_loss: 0.3628, test_loss: 1.2175, test_f1: 0.6679
 epoch: 65, train_loss: 0.3603, test_loss: 1.2226, test_f1: 0.6536
 epoch: 66, train_loss: 0.3661, test_loss: 1.2117, test_f1: 0.6436
 epoch: 67, train_loss: 0.3617, test_loss: 1.1947, test_f1: 0.6634
 epoch: 68, train_loss: 0.3701, test_loss: 1.2890, test_f1: 0.6713
 epoch: 69, train_loss: 0.3635, test_loss: 1.1755, test_f1: 0.6582
 epoch: 70, train_loss: 0.3432, test_loss: 1.3695, test_f1: 0.6444
 epoch: 71, train_loss: 0.3500, test_loss: 1.3182, test_f1: 0.6552
 epoch: 72, train_loss: 0.3496, test_loss: 1.3790, test_f1: 0.6576
 epoch: 73, train_loss: 0.3415, test_loss: 1.3175, test_f1: 0.6704
 epoch: 74, train_loss: 0.3335, test_loss: 1.3221, test_f1: 0.6513
 epoch: 75, train_loss: 0.3158, test_loss: 1.4605, test_f1: 0.6492
 epoch: 76, train_loss: 0.3358, test_loss: 1.2469, test_f1: 0.6563
 epoch: 77, train_loss: 0.3239, test_loss: 1.2934, test_f1: 0.6512
 epoch: 78, train_loss: 0.3182, test_loss: 1.3980, test_f1: 0.6551
 epoch: 79, train_loss: 0.3310, test_loss: 1.3823, test_f1: 0.6568
 epoch: 80, train_loss: 0.3055, test_loss: 1.3983, test_f1: 0.6569
 epoch: 81, train_loss: 0.3021, test_loss: 1.3819, test_f1: 0.6493
 epoch: 82, train_loss: 0.3095, test_loss: 1.4193, test_f1: 0.6436
 epoch: 83, train_loss: 0.3167, test_loss: 1.3528, test_f1: 0.6430
 epoch: 84, train_loss: 0.3107, test_loss: 1.3711, test_f1: 0.6493
 epoch: 85, train_loss: 0.2938, test_loss: 1.4869, test_f1: 0.6471
 epoch: 86, train_loss: 0.2872, test_loss: 1.3958, test_f1: 0.6722
 epoch: 87, train_loss: 0.3001, test_loss: 1.4629, test_f1: 0.6430
 epoch: 88, train_loss: 0.3079, test_loss: 1.5011, test_f1: 0.6562
 epoch: 89, train_loss: 0.2913, test_loss: 1.4817, test_f1: 0.6322
 epoch: 90, train_loss: 0.2847, test_loss: 1.5297, test_f1: 0.6553
 epoch: 91, train_loss: 0.2807, test_loss: 1.5211, test_f1: 0.6572
 epoch: 92, train_loss: 0.2507, test_loss: 1.6020, test_f1: 0.6531
 epoch: 93, train_loss: 0.2846, test_loss: 1.6553, test_f1: 0.6418
 epoch: 94, train_loss: 0.2752, test_loss: 1.5814, test_f1: 0.6328
 epoch: 95, train_loss: 0.2820, test_loss: 1.5172, test_f1: 0.6440
 epoch: 96, train_loss: 0.2732, test_loss: 1.6490, test_f1: 0.6434
 epoch: 97, train_loss: 0.2601, test_loss: 1.7274, test_f1: 0.6410
 epoch: 98, train_loss: 0.2608, test_loss: 1.5899, test_f1: 0.6378
 epoch: 99, train_loss: 0.2841, test_loss: 1.5612, test_f1: 0.6592
##################ITERATION #5 ****************************************
 epoch: 0, train_loss: 1.2459, test_loss: 1.2418, test_f1: 0.3127
 epoch: 1, train_loss: 0.9998, test_loss: 0.9256, test_f1: 0.5290
 epoch: 2, train_loss: 0.9502, test_loss: 0.8995, test_f1: 0.5108
 epoch: 3, train_loss: 0.9338, test_loss: 0.8972, test_f1: 0.5213
 epoch: 4, train_loss: 0.9165, test_loss: 0.8465, test_f1: 0.5445
 epoch: 5, train_loss: 0.8910, test_loss: 0.8150, test_f1: 0.5545
 epoch: 6, train_loss: 0.8593, test_loss: 0.8607, test_f1: 0.5694
 epoch: 7, train_loss: 0.8475, test_loss: 0.8121, test_f1: 0.6126
 epoch: 8, train_loss: 0.8464, test_loss: 0.8214, test_f1: 0.5834
 epoch: 9, train_loss: 0.8369, test_loss: 0.8199, test_f1: 0.5889
 epoch: 10, train_loss: 0.8014, test_loss: 0.8012, test_f1: 0.5897
 epoch: 11, train_loss: 0.7785, test_loss: 0.7645, test_f1: 0.5951
 epoch: 12, train_loss: 0.7646, test_loss: 0.7723, test_f1: 0.5934
 epoch: 13, train_loss: 0.7549, test_loss: 0.7849, test_f1: 0.6529
 epoch: 14, train_loss: 0.7553, test_loss: 0.7245, test_f1: 0.6242
 epoch: 15, train_loss: 0.7399, test_loss: 0.7729, test_f1: 0.6057
 epoch: 16, train_loss: 0.7306, test_loss: 0.7615, test_f1: 0.6366
 epoch: 17, train_loss: 0.7383, test_loss: 0.7580, test_f1: 0.6266
 epoch: 18, train_loss: 0.7278, test_loss: 0.7656, test_f1: 0.6215
 epoch: 19, train_loss: 0.7050, test_loss: 0.7603, test_f1: 0.6522
 epoch: 20, train_loss: 0.6999, test_loss: 0.8108, test_f1: 0.6288
 epoch: 21, train_loss: 0.6757, test_loss: 0.7284, test_f1: 0.6534
 epoch: 22, train_loss: 0.6788, test_loss: 0.7609, test_f1: 0.6314
 epoch: 23, train_loss: 0.6438, test_loss: 0.7406, test_f1: 0.6597
 epoch: 24, train_loss: 0.6525, test_loss: 0.7581, test_f1: 0.6814
 epoch: 25, train_loss: 0.6382, test_loss: 0.8377, test_f1: 0.6580
 epoch: 26, train_loss: 0.6299, test_loss: 0.8232, test_f1: 0.6395
 epoch: 27, train_loss: 0.6306, test_loss: 0.8168, test_f1: 0.6553
 epoch: 28, train_loss: 0.6047, test_loss: 0.7769, test_f1: 0.6593
 epoch: 29, train_loss: 0.6012, test_loss: 0.7234, test_f1: 0.6902
 epoch: 30, train_loss: 0.5889, test_loss: 0.7417, test_f1: 0.6661
 epoch: 31, train_loss: 0.5885, test_loss: 0.7499, test_f1: 0.6605
 epoch: 32, train_loss: 0.5713, test_loss: 0.7692, test_f1: 0.6623
 epoch: 33, train_loss: 0.5773, test_loss: 0.7799, test_f1: 0.6568
 epoch: 34, train_loss: 0.5644, test_loss: 0.7484, test_f1: 0.6625
 epoch: 35, train_loss: 0.5467, test_loss: 0.8271, test_f1: 0.6250
 epoch: 36, train_loss: 0.5591, test_loss: 0.8325, test_f1: 0.6505
 epoch: 37, train_loss: 0.5473, test_loss: 0.8386, test_f1: 0.6526
 epoch: 38, train_loss: 0.5323, test_loss: 0.8095, test_f1: 0.6627
 epoch: 39, train_loss: 0.5389, test_loss: 0.8121, test_f1: 0.6728
 epoch: 40, train_loss: 0.5196, test_loss: 0.8615, test_f1: 0.6431
 epoch: 41, train_loss: 0.5393, test_loss: 0.7537, test_f1: 0.6687
 epoch: 42, train_loss: 0.5095, test_loss: 0.7851, test_f1: 0.6963
 epoch: 43, train_loss: 0.5084, test_loss: 0.7945, test_f1: 0.6874
 epoch: 44, train_loss: 0.4920, test_loss: 0.7876, test_f1: 0.6858
 epoch: 45, train_loss: 0.4719, test_loss: 0.8597, test_f1: 0.6629
 epoch: 46, train_loss: 0.4990, test_loss: 0.9257, test_f1: 0.6676
 epoch: 47, train_loss: 0.4892, test_loss: 0.8625, test_f1: 0.6647
 epoch: 48, train_loss: 0.4922, test_loss: 0.8597, test_f1: 0.6756
 epoch: 49, train_loss: 0.4825, test_loss: 0.9966, test_f1: 0.6439
 epoch: 50, train_loss: 0.4619, test_loss: 0.7908, test_f1: 0.7016
 epoch: 51, train_loss: 0.4360, test_loss: 0.9319, test_f1: 0.6589
 epoch: 52, train_loss: 0.4042, test_loss: 0.8683, test_f1: 0.7032
 epoch: 53, train_loss: 0.3916, test_loss: 1.0173, test_f1: 0.6829
 epoch: 54, train_loss: 0.3789, test_loss: 0.9719, test_f1: 0.6936
 epoch: 55, train_loss: 0.3887, test_loss: 0.9620, test_f1: 0.6933
 epoch: 56, train_loss: 0.3884, test_loss: 1.0222, test_f1: 0.6753
 epoch: 57, train_loss: 0.3835, test_loss: 0.9508, test_f1: 0.7045
 epoch: 58, train_loss: 0.3628, test_loss: 1.0217, test_f1: 0.6838
 epoch: 59, train_loss: 0.3604, test_loss: 1.0353, test_f1: 0.6893
 epoch: 60, train_loss: 0.3720, test_loss: 1.0093, test_f1: 0.7010
 epoch: 61, train_loss: 0.3648, test_loss: 0.9774, test_f1: 0.6843
 epoch: 62, train_loss: 0.3466, test_loss: 1.0316, test_f1: 0.6902
 epoch: 63, train_loss: 0.3397, test_loss: 1.1892, test_f1: 0.6803
 epoch: 64, train_loss: 0.3552, test_loss: 1.1003, test_f1: 0.6783
 epoch: 65, train_loss: 0.3388, test_loss: 1.1195, test_f1: 0.6788
 epoch: 66, train_loss: 0.3385, test_loss: 1.0386, test_f1: 0.7034
 epoch: 67, train_loss: 0.3265, test_loss: 1.1236, test_f1: 0.6895
 epoch: 68, train_loss: 0.3464, test_loss: 1.1091, test_f1: 0.6983
 epoch: 69, train_loss: 0.3264, test_loss: 1.1391, test_f1: 0.6856
 epoch: 70, train_loss: 0.3123, test_loss: 1.1555, test_f1: 0.6919
 epoch: 71, train_loss: 0.3470, test_loss: 1.1284, test_f1: 0.6927
 epoch: 72, train_loss: 0.3112, test_loss: 1.2809, test_f1: 0.6775
 epoch: 73, train_loss: 0.3046, test_loss: 1.2024, test_f1: 0.6745
 epoch: 74, train_loss: 0.3206, test_loss: 1.1479, test_f1: 0.6992
 epoch: 75, train_loss: 0.3108, test_loss: 1.1497, test_f1: 0.6854
 epoch: 76, train_loss: 0.3108, test_loss: 1.2109, test_f1: 0.6735
 epoch: 77, train_loss: 0.2938, test_loss: 1.2263, test_f1: 0.6958
 epoch: 78, train_loss: 0.3133, test_loss: 1.2374, test_f1: 0.6983
 epoch: 79, train_loss: 0.2994, test_loss: 1.3284, test_f1: 0.6779
 epoch: 80, train_loss: 0.2998, test_loss: 1.3594, test_f1: 0.6638
 epoch: 81, train_loss: 0.2866, test_loss: 1.3760, test_f1: 0.6687
 epoch: 82, train_loss: 0.2761, test_loss: 1.3902, test_f1: 0.6810
 epoch: 83, train_loss: 0.2739, test_loss: 1.4610, test_f1: 0.6637
 epoch: 84, train_loss: 0.2958, test_loss: 1.4439, test_f1: 0.6487
 epoch: 85, train_loss: 0.2696, test_loss: 1.3736, test_f1: 0.6957
 epoch: 86, train_loss: 0.2910, test_loss: 1.2905, test_f1: 0.6860
 epoch: 87, train_loss: 0.2871, test_loss: 1.3773, test_f1: 0.6822
 epoch: 88, train_loss: 0.2792, test_loss: 1.3541, test_f1: 0.6893
 epoch: 89, train_loss: 0.2666, test_loss: 1.4580, test_f1: 0.6610
 epoch: 90, train_loss: 0.2715, test_loss: 1.3609, test_f1: 0.6822
 epoch: 91, train_loss: 0.2478, test_loss: 1.3239, test_f1: 0.6799
 epoch: 92, train_loss: 0.2642, test_loss: 1.3715, test_f1: 0.6998
 epoch: 93, train_loss: 0.2613, test_loss: 1.6074, test_f1: 0.6493
 epoch: 94, train_loss: 0.2545, test_loss: 1.4369, test_f1: 0.6691
 epoch: 95, train_loss: 0.2411, test_loss: 1.4571, test_f1: 0.6645
 epoch: 96, train_loss: 0.2731, test_loss: 1.3910, test_f1: 0.6814
 epoch: 97, train_loss: 0.2443, test_loss: 1.4424, test_f1: 0.6754
 epoch: 98, train_loss: 0.2580, test_loss: 1.3952, test_f1: 0.6818
 epoch: 99, train_loss: 0.2470, test_loss: 1.4921, test_f1: 0.6816
##################ITERATION #6 ****************************************
 epoch: 0, train_loss: 1.3195, test_loss: 1.3598, test_f1: 0.4011
 epoch: 1, train_loss: 1.0296, test_loss: 1.0046, test_f1: 0.4820
 epoch: 2, train_loss: 0.9690, test_loss: 0.9669, test_f1: 0.5224
 epoch: 3, train_loss: 0.9351, test_loss: 0.9672, test_f1: 0.5480
 epoch: 4, train_loss: 0.9079, test_loss: 0.9285, test_f1: 0.5979
 epoch: 5, train_loss: 0.8901, test_loss: 0.9283, test_f1: 0.5592
 epoch: 6, train_loss: 0.8651, test_loss: 0.8890, test_f1: 0.5722
 epoch: 7, train_loss: 0.8313, test_loss: 0.8614, test_f1: 0.6101
 epoch: 8, train_loss: 0.8337, test_loss: 0.8680, test_f1: 0.6006
 epoch: 9, train_loss: 0.7957, test_loss: 0.9151, test_f1: 0.5762
 epoch: 10, train_loss: 0.7973, test_loss: 0.8113, test_f1: 0.6181
 epoch: 11, train_loss: 0.7816, test_loss: 0.8414, test_f1: 0.6065
 epoch: 12, train_loss: 0.7684, test_loss: 0.7978, test_f1: 0.6105
 epoch: 13, train_loss: 0.7585, test_loss: 0.8824, test_f1: 0.5767
 epoch: 14, train_loss: 0.7569, test_loss: 0.8303, test_f1: 0.6082
 epoch: 15, train_loss: 0.7349, test_loss: 0.8031, test_f1: 0.6412
 epoch: 16, train_loss: 0.7222, test_loss: 0.7696, test_f1: 0.6201
 epoch: 17, train_loss: 0.7117, test_loss: 0.8101, test_f1: 0.6253
 epoch: 18, train_loss: 0.7090, test_loss: 0.8134, test_f1: 0.6053
 epoch: 19, train_loss: 0.6897, test_loss: 0.8207, test_f1: 0.6095
 epoch: 20, train_loss: 0.6816, test_loss: 0.7816, test_f1: 0.6492
 epoch: 21, train_loss: 0.6699, test_loss: 0.8776, test_f1: 0.6197
 epoch: 22, train_loss: 0.6839, test_loss: 0.8453, test_f1: 0.6299
 epoch: 23, train_loss: 0.6520, test_loss: 0.8096, test_f1: 0.6647
 epoch: 24, train_loss: 0.6425, test_loss: 0.8425, test_f1: 0.6145
 epoch: 25, train_loss: 0.6412, test_loss: 0.7686, test_f1: 0.6641
 epoch: 26, train_loss: 0.6258, test_loss: 0.8131, test_f1: 0.6489
 epoch: 27, train_loss: 0.6150, test_loss: 0.8723, test_f1: 0.6276
 epoch: 28, train_loss: 0.6131, test_loss: 0.9054, test_f1: 0.6274
 epoch: 29, train_loss: 0.6015, test_loss: 0.9305, test_f1: 0.6307
 epoch: 30, train_loss: 0.5982, test_loss: 0.8224, test_f1: 0.6363
 epoch: 31, train_loss: 0.5944, test_loss: 0.8951, test_f1: 0.6339
 epoch: 32, train_loss: 0.5895, test_loss: 0.8602, test_f1: 0.6260
 epoch: 33, train_loss: 0.5923, test_loss: 0.8527, test_f1: 0.6389
 epoch: 34, train_loss: 0.5741, test_loss: 0.8930, test_f1: 0.6403
 epoch: 35, train_loss: 0.5670, test_loss: 0.9175, test_f1: 0.6292
 epoch: 36, train_loss: 0.5544, test_loss: 0.8603, test_f1: 0.6229
 epoch: 37, train_loss: 0.5341, test_loss: 0.8652, test_f1: 0.6509
 epoch: 38, train_loss: 0.5596, test_loss: 0.8200, test_f1: 0.6408
 epoch: 39, train_loss: 0.5461, test_loss: 0.9328, test_f1: 0.6313
 epoch: 40, train_loss: 0.5351, test_loss: 0.9388, test_f1: 0.6368
 epoch: 41, train_loss: 0.5075, test_loss: 1.0698, test_f1: 0.6430
 epoch: 42, train_loss: 0.5176, test_loss: 0.8759, test_f1: 0.6440
 epoch: 43, train_loss: 0.5272, test_loss: 0.9589, test_f1: 0.6351
 epoch: 44, train_loss: 0.5199, test_loss: 1.0035, test_f1: 0.6388
 epoch: 45, train_loss: 0.5033, test_loss: 1.0515, test_f1: 0.6642
 epoch: 46, train_loss: 0.4893, test_loss: 1.0449, test_f1: 0.6214
 epoch: 47, train_loss: 0.5010, test_loss: 1.1073, test_f1: 0.6432
 epoch: 48, train_loss: 0.4914, test_loss: 0.9780, test_f1: 0.6436
 epoch: 49, train_loss: 0.4760, test_loss: 1.0101, test_f1: 0.6591
 epoch: 50, train_loss: 0.4940, test_loss: 1.2148, test_f1: 0.6106
 epoch: 51, train_loss: 0.4386, test_loss: 1.0423, test_f1: 0.6438
 epoch: 52, train_loss: 0.4078, test_loss: 1.1517, test_f1: 0.6629
 epoch: 53, train_loss: 0.4056, test_loss: 1.1775, test_f1: 0.6403
 epoch: 54, train_loss: 0.3971, test_loss: 1.1725, test_f1: 0.6627
 epoch: 55, train_loss: 0.3814, test_loss: 1.1613, test_f1: 0.6546
 epoch: 56, train_loss: 0.3951, test_loss: 1.3148, test_f1: 0.6573
 epoch: 57, train_loss: 0.3857, test_loss: 1.2151, test_f1: 0.6642
 epoch: 58, train_loss: 0.3868, test_loss: 1.2070, test_f1: 0.6473
 epoch: 59, train_loss: 0.3639, test_loss: 1.2881, test_f1: 0.6479
 epoch: 60, train_loss: 0.3716, test_loss: 1.2847, test_f1: 0.6521
 epoch: 61, train_loss: 0.3733, test_loss: 1.3494, test_f1: 0.6563
 epoch: 62, train_loss: 0.3661, test_loss: 1.3191, test_f1: 0.6373
 epoch: 63, train_loss: 0.3672, test_loss: 1.3026, test_f1: 0.6508
 epoch: 64, train_loss: 0.3617, test_loss: 1.3289, test_f1: 0.6350
 epoch: 65, train_loss: 0.3452, test_loss: 1.3322, test_f1: 0.6560
 epoch: 66, train_loss: 0.3721, test_loss: 1.3982, test_f1: 0.6610
 epoch: 67, train_loss: 0.3704, test_loss: 1.2514, test_f1: 0.6575
 epoch: 68, train_loss: 0.3329, test_loss: 1.3094, test_f1: 0.6675
 epoch: 69, train_loss: 0.3392, test_loss: 1.2406, test_f1: 0.6391
 epoch: 70, train_loss: 0.3311, test_loss: 1.5000, test_f1: 0.6463
 epoch: 71, train_loss: 0.3335, test_loss: 1.4817, test_f1: 0.6436
 epoch: 72, train_loss: 0.3447, test_loss: 1.2878, test_f1: 0.6555
 epoch: 73, train_loss: 0.3433, test_loss: 1.3339, test_f1: 0.6543
 epoch: 74, train_loss: 0.3157, test_loss: 1.4334, test_f1: 0.6227
 epoch: 75, train_loss: 0.3245, test_loss: 1.5296, test_f1: 0.6303
 epoch: 76, train_loss: 0.3073, test_loss: 1.4905, test_f1: 0.6435
 epoch: 77, train_loss: 0.3180, test_loss: 1.5046, test_f1: 0.6707
 epoch: 78, train_loss: 0.3233, test_loss: 1.4731, test_f1: 0.6450
 epoch: 79, train_loss: 0.3070, test_loss: 1.4750, test_f1: 0.6440
 epoch: 80, train_loss: 0.3177, test_loss: 1.5482, test_f1: 0.6203
 epoch: 81, train_loss: 0.3166, test_loss: 1.4789, test_f1: 0.6267
 epoch: 82, train_loss: 0.3038, test_loss: 1.4687, test_f1: 0.6438
 epoch: 83, train_loss: 0.3251, test_loss: 1.6324, test_f1: 0.6512
 epoch: 84, train_loss: 0.3185, test_loss: 1.5167, test_f1: 0.6342
 epoch: 85, train_loss: 0.3097, test_loss: 1.6558, test_f1: 0.6482
 epoch: 86, train_loss: 0.2806, test_loss: 1.5602, test_f1: 0.6437
 epoch: 87, train_loss: 0.2685, test_loss: 1.5731, test_f1: 0.6326
 epoch: 88, train_loss: 0.2809, test_loss: 1.6991, test_f1: 0.6381
 epoch: 89, train_loss: 0.2971, test_loss: 1.6539, test_f1: 0.6430
 epoch: 90, train_loss: 0.2937, test_loss: 1.5985, test_f1: 0.6392
 epoch: 91, train_loss: 0.2904, test_loss: 1.6523, test_f1: 0.6468
 epoch: 92, train_loss: 0.2676, test_loss: 1.7006, test_f1: 0.6479
 epoch: 93, train_loss: 0.2853, test_loss: 1.7350, test_f1: 0.6208
 epoch: 94, train_loss: 0.2855, test_loss: 1.7287, test_f1: 0.6313
 epoch: 95, train_loss: 0.2843, test_loss: 1.5544, test_f1: 0.6423
 epoch: 96, train_loss: 0.2632, test_loss: 1.6355, test_f1: 0.6461
 epoch: 97, train_loss: 0.2758, test_loss: 1.6223, test_f1: 0.6437
 epoch: 98, train_loss: 0.2708, test_loss: 1.6541, test_f1: 0.6375
 epoch: 99, train_loss: 0.2696, test_loss: 1.7297, test_f1: 0.6485
##################ITERATION #7 ****************************************
 epoch: 0, train_loss: 1.3826, test_loss: 1.1718, test_f1: 0.4177
 epoch: 1, train_loss: 1.0348, test_loss: 0.9806, test_f1: 0.4933
 epoch: 2, train_loss: 0.9785, test_loss: 0.9426, test_f1: 0.4965
 epoch: 3, train_loss: 0.9428, test_loss: 0.9345, test_f1: 0.4959
 epoch: 4, train_loss: 0.9375, test_loss: 0.8945, test_f1: 0.5439
 epoch: 5, train_loss: 0.9047, test_loss: 0.9083, test_f1: 0.5331
 epoch: 6, train_loss: 0.8883, test_loss: 0.8582, test_f1: 0.5980
 epoch: 7, train_loss: 0.8725, test_loss: 0.8444, test_f1: 0.5783
 epoch: 8, train_loss: 0.8477, test_loss: 0.8448, test_f1: 0.5761
 epoch: 9, train_loss: 0.8418, test_loss: 0.8209, test_f1: 0.5748
 epoch: 10, train_loss: 0.8216, test_loss: 0.8444, test_f1: 0.5644
 epoch: 11, train_loss: 0.7912, test_loss: 0.8212, test_f1: 0.6143
 epoch: 12, train_loss: 0.8060, test_loss: 0.7478, test_f1: 0.6459
 epoch: 13, train_loss: 0.7905, test_loss: 0.8109, test_f1: 0.5887
 epoch: 14, train_loss: 0.7990, test_loss: 0.7886, test_f1: 0.6086
 epoch: 15, train_loss: 0.7662, test_loss: 0.7870, test_f1: 0.5733
 epoch: 16, train_loss: 0.7538, test_loss: 0.7809, test_f1: 0.6090
 epoch: 17, train_loss: 0.7537, test_loss: 0.7984, test_f1: 0.6268
 epoch: 18, train_loss: 0.7312, test_loss: 0.7884, test_f1: 0.6421
 epoch: 19, train_loss: 0.7228, test_loss: 0.7771, test_f1: 0.6302
 epoch: 20, train_loss: 0.7276, test_loss: 0.8264, test_f1: 0.5835
 epoch: 21, train_loss: 0.7130, test_loss: 0.8456, test_f1: 0.5917
 epoch: 22, train_loss: 0.7050, test_loss: 0.8154, test_f1: 0.6155
 epoch: 23, train_loss: 0.6900, test_loss: 0.7867, test_f1: 0.6443
 epoch: 24, train_loss: 0.6897, test_loss: 0.8074, test_f1: 0.6409
 epoch: 25, train_loss: 0.6753, test_loss: 0.7431, test_f1: 0.6533
 epoch: 26, train_loss: 0.6761, test_loss: 0.7889, test_f1: 0.6286
 epoch: 27, train_loss: 0.6481, test_loss: 0.7566, test_f1: 0.6616
 epoch: 28, train_loss: 0.6333, test_loss: 0.7600, test_f1: 0.6830
 epoch: 29, train_loss: 0.6185, test_loss: 0.8061, test_f1: 0.6640
 epoch: 30, train_loss: 0.6236, test_loss: 0.7879, test_f1: 0.6700
 epoch: 31, train_loss: 0.6001, test_loss: 0.8596, test_f1: 0.6601
 epoch: 32, train_loss: 0.6071, test_loss: 0.7793, test_f1: 0.6722
 epoch: 33, train_loss: 0.5978, test_loss: 0.8282, test_f1: 0.6533
 epoch: 34, train_loss: 0.5907, test_loss: 0.7832, test_f1: 0.6460
 epoch: 35, train_loss: 0.5895, test_loss: 0.7653, test_f1: 0.6547
 epoch: 36, train_loss: 0.5813, test_loss: 0.7502, test_f1: 0.6802
 epoch: 37, train_loss: 0.5952, test_loss: 0.7715, test_f1: 0.6714
 epoch: 38, train_loss: 0.5594, test_loss: 0.7623, test_f1: 0.6794
 epoch: 39, train_loss: 0.5524, test_loss: 0.8469, test_f1: 0.6782
 epoch: 40, train_loss: 0.5632, test_loss: 0.7358, test_f1: 0.6707
 epoch: 41, train_loss: 0.5363, test_loss: 0.8692, test_f1: 0.6763
 epoch: 42, train_loss: 0.5402, test_loss: 0.8420, test_f1: 0.6770
 epoch: 43, train_loss: 0.5293, test_loss: 0.8462, test_f1: 0.6630
 epoch: 44, train_loss: 0.5331, test_loss: 0.8627, test_f1: 0.6577
 epoch: 45, train_loss: 0.5105, test_loss: 0.9172, test_f1: 0.6778
 epoch: 46, train_loss: 0.5141, test_loss: 0.9690, test_f1: 0.6113
 epoch: 47, train_loss: 0.5119, test_loss: 0.8622, test_f1: 0.6686
 epoch: 48, train_loss: 0.5031, test_loss: 0.8285, test_f1: 0.6630
 epoch: 49, train_loss: 0.5017, test_loss: 0.9300, test_f1: 0.6506
 epoch: 50, train_loss: 0.4825, test_loss: 0.9713, test_f1: 0.6685
 epoch: 51, train_loss: 0.4650, test_loss: 0.9354, test_f1: 0.6775
 epoch: 52, train_loss: 0.4326, test_loss: 0.9677, test_f1: 0.6751
 epoch: 53, train_loss: 0.4191, test_loss: 0.9611, test_f1: 0.6762
 epoch: 54, train_loss: 0.4084, test_loss: 0.9619, test_f1: 0.6773
 epoch: 55, train_loss: 0.4046, test_loss: 0.9734, test_f1: 0.6613
 epoch: 56, train_loss: 0.3959, test_loss: 0.9567, test_f1: 0.6787
 epoch: 57, train_loss: 0.4234, test_loss: 0.9863, test_f1: 0.6559
 epoch: 58, train_loss: 0.3914, test_loss: 0.9912, test_f1: 0.6678
 epoch: 59, train_loss: 0.3904, test_loss: 1.0099, test_f1: 0.6621
 epoch: 60, train_loss: 0.3835, test_loss: 1.0854, test_f1: 0.6803
 epoch: 61, train_loss: 0.3833, test_loss: 1.0100, test_f1: 0.6783
 epoch: 62, train_loss: 0.3756, test_loss: 1.1193, test_f1: 0.6578
 epoch: 63, train_loss: 0.3804, test_loss: 1.0644, test_f1: 0.6588
 epoch: 64, train_loss: 0.3722, test_loss: 1.1956, test_f1: 0.6534
 epoch: 65, train_loss: 0.3713, test_loss: 1.1368, test_f1: 0.6690
 epoch: 66, train_loss: 0.3766, test_loss: 1.0504, test_f1: 0.6604
 epoch: 67, train_loss: 0.3576, test_loss: 1.1597, test_f1: 0.6513
 epoch: 68, train_loss: 0.3673, test_loss: 1.0930, test_f1: 0.6808
 epoch: 69, train_loss: 0.3560, test_loss: 1.0931, test_f1: 0.6661
 epoch: 70, train_loss: 0.3643, test_loss: 1.1566, test_f1: 0.6422
 epoch: 71, train_loss: 0.3589, test_loss: 1.1030, test_f1: 0.6812
 epoch: 72, train_loss: 0.3619, test_loss: 1.1119, test_f1: 0.6495
 epoch: 73, train_loss: 0.3463, test_loss: 1.1484, test_f1: 0.6600
 epoch: 74, train_loss: 0.3553, test_loss: 1.2357, test_f1: 0.6555
 epoch: 75, train_loss: 0.3310, test_loss: 1.0521, test_f1: 0.6812
 epoch: 76, train_loss: 0.3235, test_loss: 1.2768, test_f1: 0.6602
 epoch: 77, train_loss: 0.3323, test_loss: 1.1057, test_f1: 0.6646
 epoch: 78, train_loss: 0.3326, test_loss: 1.1575, test_f1: 0.6784
 epoch: 79, train_loss: 0.3336, test_loss: 1.1307, test_f1: 0.6540
 epoch: 80, train_loss: 0.3454, test_loss: 1.1269, test_f1: 0.6697
 epoch: 81, train_loss: 0.3389, test_loss: 1.2402, test_f1: 0.6631
 epoch: 82, train_loss: 0.3248, test_loss: 1.2520, test_f1: 0.6523
 epoch: 83, train_loss: 0.3263, test_loss: 1.3697, test_f1: 0.6435
 epoch: 84, train_loss: 0.3156, test_loss: 1.2265, test_f1: 0.6612
 epoch: 85, train_loss: 0.3134, test_loss: 1.2219, test_f1: 0.6503
 epoch: 86, train_loss: 0.3084, test_loss: 1.2292, test_f1: 0.6510
 epoch: 87, train_loss: 0.3033, test_loss: 1.2433, test_f1: 0.6733
 epoch: 88, train_loss: 0.3176, test_loss: 1.3513, test_f1: 0.6488
 epoch: 89, train_loss: 0.3055, test_loss: 1.2759, test_f1: 0.6641
 epoch: 90, train_loss: 0.3171, test_loss: 1.2842, test_f1: 0.6556
 epoch: 91, train_loss: 0.3038, test_loss: 1.2700, test_f1: 0.6532
 epoch: 92, train_loss: 0.2856, test_loss: 1.2951, test_f1: 0.6467
 epoch: 93, train_loss: 0.3063, test_loss: 1.3714, test_f1: 0.6581
 epoch: 94, train_loss: 0.2839, test_loss: 1.4060, test_f1: 0.6567
 epoch: 95, train_loss: 0.2966, test_loss: 1.3535, test_f1: 0.6578
 epoch: 96, train_loss: 0.3085, test_loss: 1.2929, test_f1: 0.6588
 epoch: 97, train_loss: 0.3027, test_loss: 1.3306, test_f1: 0.6622
 epoch: 98, train_loss: 0.2923, test_loss: 1.3480, test_f1: 0.6624
 epoch: 99, train_loss: 0.3019, test_loss: 1.3931, test_f1: 0.6616
##################ITERATION #8 ****************************************
 epoch: 0, train_loss: 1.2651, test_loss: 1.1242, test_f1: 0.4429
 epoch: 1, train_loss: 1.0081, test_loss: 0.9340, test_f1: 0.5474
 epoch: 2, train_loss: 0.9537, test_loss: 0.9432, test_f1: 0.5323
 epoch: 3, train_loss: 0.9288, test_loss: 0.9084, test_f1: 0.5399
 epoch: 4, train_loss: 0.8881, test_loss: 0.8716, test_f1: 0.5765
 epoch: 5, train_loss: 0.8767, test_loss: 0.8475, test_f1: 0.5894
 epoch: 6, train_loss: 0.8597, test_loss: 0.8409, test_f1: 0.5570
 epoch: 7, train_loss: 0.8485, test_loss: 0.7835, test_f1: 0.6316
 epoch: 8, train_loss: 0.8245, test_loss: 0.7894, test_f1: 0.5991
 epoch: 9, train_loss: 0.7869, test_loss: 0.7742, test_f1: 0.6113
 epoch: 10, train_loss: 0.8033, test_loss: 0.8846, test_f1: 0.5591
 epoch: 11, train_loss: 0.7748, test_loss: 0.8198, test_f1: 0.5882
 epoch: 12, train_loss: 0.7616, test_loss: 0.7484, test_f1: 0.6525
 epoch: 13, train_loss: 0.7465, test_loss: 0.7563, test_f1: 0.6422
 epoch: 14, train_loss: 0.7370, test_loss: 0.7537, test_f1: 0.6711
 epoch: 15, train_loss: 0.7438, test_loss: 0.7422, test_f1: 0.6408
 epoch: 16, train_loss: 0.7205, test_loss: 0.7439, test_f1: 0.6627
 epoch: 17, train_loss: 0.6773, test_loss: 0.7304, test_f1: 0.6511
 epoch: 18, train_loss: 0.7104, test_loss: 0.7975, test_f1: 0.6393
 epoch: 19, train_loss: 0.6844, test_loss: 0.7183, test_f1: 0.6692
 epoch: 20, train_loss: 0.6672, test_loss: 0.7362, test_f1: 0.6512
 epoch: 21, train_loss: 0.6737, test_loss: 0.7811, test_f1: 0.6377
 epoch: 22, train_loss: 0.6357, test_loss: 0.7678, test_f1: 0.6640
 epoch: 23, train_loss: 0.6272, test_loss: 0.7297, test_f1: 0.6768
 epoch: 24, train_loss: 0.6419, test_loss: 0.8212, test_f1: 0.6362
 epoch: 25, train_loss: 0.6353, test_loss: 0.7668, test_f1: 0.6572
 epoch: 26, train_loss: 0.6350, test_loss: 0.7538, test_f1: 0.6747
 epoch: 27, train_loss: 0.6348, test_loss: 0.7191, test_f1: 0.6579
 epoch: 28, train_loss: 0.5876, test_loss: 0.7534, test_f1: 0.6816
 epoch: 29, train_loss: 0.5831, test_loss: 0.7833, test_f1: 0.6541
 epoch: 30, train_loss: 0.5872, test_loss: 0.7854, test_f1: 0.6460
 epoch: 31, train_loss: 0.5833, test_loss: 0.7177, test_f1: 0.7042
 epoch: 32, train_loss: 0.5553, test_loss: 0.7997, test_f1: 0.6437
 epoch: 33, train_loss: 0.5634, test_loss: 0.7823, test_f1: 0.6719
 epoch: 34, train_loss: 0.5714, test_loss: 0.7392, test_f1: 0.6933
 epoch: 35, train_loss: 0.5476, test_loss: 0.8139, test_f1: 0.6802
 epoch: 36, train_loss: 0.5358, test_loss: 0.8077, test_f1: 0.6677
 epoch: 37, train_loss: 0.5526, test_loss: 0.8771, test_f1: 0.6253
 epoch: 38, train_loss: 0.5352, test_loss: 0.7811, test_f1: 0.6846
 epoch: 39, train_loss: 0.5191, test_loss: 0.8039, test_f1: 0.6642
 epoch: 40, train_loss: 0.5391, test_loss: 0.8077, test_f1: 0.6750
 epoch: 41, train_loss: 0.5208, test_loss: 0.9536, test_f1: 0.6611
 epoch: 42, train_loss: 0.5265, test_loss: 0.7970, test_f1: 0.7062
 epoch: 43, train_loss: 0.5109, test_loss: 0.8111, test_f1: 0.6862
 epoch: 44, train_loss: 0.5014, test_loss: 0.7398, test_f1: 0.6873
 epoch: 45, train_loss: 0.4969, test_loss: 0.7998, test_f1: 0.6745
 epoch: 46, train_loss: 0.4936, test_loss: 0.8429, test_f1: 0.7019
 epoch: 47, train_loss: 0.4720, test_loss: 0.8113, test_f1: 0.6697
 epoch: 48, train_loss: 0.4924, test_loss: 0.8921, test_f1: 0.6879
 epoch: 49, train_loss: 0.4837, test_loss: 0.8965, test_f1: 0.6532
 epoch: 50, train_loss: 0.4710, test_loss: 0.8564, test_f1: 0.6685
 epoch: 51, train_loss: 0.4253, test_loss: 0.8217, test_f1: 0.6841
 epoch: 52, train_loss: 0.4023, test_loss: 0.9513, test_f1: 0.6771
 epoch: 53, train_loss: 0.3884, test_loss: 0.9134, test_f1: 0.6638
 epoch: 54, train_loss: 0.3994, test_loss: 0.9292, test_f1: 0.6613
 epoch: 55, train_loss: 0.3780, test_loss: 0.9487, test_f1: 0.6755
 epoch: 56, train_loss: 0.3832, test_loss: 0.9517, test_f1: 0.6621
 epoch: 57, train_loss: 0.3901, test_loss: 0.8868, test_f1: 0.6659
 epoch: 58, train_loss: 0.3650, test_loss: 0.9676, test_f1: 0.6682
 epoch: 59, train_loss: 0.3814, test_loss: 0.9724, test_f1: 0.6743
 epoch: 60, train_loss: 0.3634, test_loss: 0.9877, test_f1: 0.6684
 epoch: 61, train_loss: 0.3634, test_loss: 1.0533, test_f1: 0.6759
 epoch: 62, train_loss: 0.3567, test_loss: 1.0169, test_f1: 0.6726
 epoch: 63, train_loss: 0.3455, test_loss: 1.0556, test_f1: 0.6751
 epoch: 64, train_loss: 0.3496, test_loss: 1.1455, test_f1: 0.6467
 epoch: 65, train_loss: 0.3398, test_loss: 1.0610, test_f1: 0.6570
 epoch: 66, train_loss: 0.3316, test_loss: 1.1454, test_f1: 0.6584
 epoch: 67, train_loss: 0.3522, test_loss: 1.0163, test_f1: 0.6807
 epoch: 68, train_loss: 0.3474, test_loss: 1.0994, test_f1: 0.6726
 epoch: 69, train_loss: 0.3615, test_loss: 1.1481, test_f1: 0.6622
 epoch: 70, train_loss: 0.3579, test_loss: 1.0833, test_f1: 0.6693
 epoch: 71, train_loss: 0.3355, test_loss: 1.1600, test_f1: 0.6567
 epoch: 72, train_loss: 0.3448, test_loss: 1.0637, test_f1: 0.6827
 epoch: 73, train_loss: 0.3249, test_loss: 1.2089, test_f1: 0.6445
 epoch: 74, train_loss: 0.3090, test_loss: 1.1784, test_f1: 0.6678
 epoch: 75, train_loss: 0.3175, test_loss: 1.2113, test_f1: 0.6394
 epoch: 76, train_loss: 0.3363, test_loss: 1.1960, test_f1: 0.6489
 epoch: 77, train_loss: 0.3132, test_loss: 1.1897, test_f1: 0.6686
 epoch: 78, train_loss: 0.3207, test_loss: 1.2945, test_f1: 0.6604
 epoch: 79, train_loss: 0.3145, test_loss: 1.2288, test_f1: 0.6591
 epoch: 80, train_loss: 0.3022, test_loss: 1.1613, test_f1: 0.6739
 epoch: 81, train_loss: 0.3166, test_loss: 1.1747, test_f1: 0.6597
 epoch: 82, train_loss: 0.2943, test_loss: 1.1242, test_f1: 0.6489
 epoch: 83, train_loss: 0.3014, test_loss: 1.3192, test_f1: 0.6390
 epoch: 84, train_loss: 0.3006, test_loss: 1.1529, test_f1: 0.6663
 epoch: 85, train_loss: 0.2998, test_loss: 1.1836, test_f1: 0.6795
 epoch: 86, train_loss: 0.3022, test_loss: 1.1649, test_f1: 0.6737
 epoch: 87, train_loss: 0.2927, test_loss: 1.1912, test_f1: 0.6628
 epoch: 88, train_loss: 0.3016, test_loss: 1.1529, test_f1: 0.6671
 epoch: 89, train_loss: 0.2892, test_loss: 1.2027, test_f1: 0.6593
 epoch: 90, train_loss: 0.3056, test_loss: 1.2165, test_f1: 0.6680
 epoch: 91, train_loss: 0.2838, test_loss: 1.1786, test_f1: 0.6449
 epoch: 92, train_loss: 0.3013, test_loss: 1.3309, test_f1: 0.6544
 epoch: 93, train_loss: 0.2910, test_loss: 1.3113, test_f1: 0.6603
 epoch: 94, train_loss: 0.2944, test_loss: 1.2847, test_f1: 0.6640
 epoch: 95, train_loss: 0.2683, test_loss: 1.2964, test_f1: 0.6596
 epoch: 96, train_loss: 0.2716, test_loss: 1.2963, test_f1: 0.6491
 epoch: 97, train_loss: 0.2745, test_loss: 1.3104, test_f1: 0.6631
 epoch: 98, train_loss: 0.2685, test_loss: 1.4231, test_f1: 0.6555
 epoch: 99, train_loss: 0.2443, test_loss: 1.5005, test_f1: 0.6358
##################ITERATION #9 ****************************************
 epoch: 0, train_loss: 1.3429, test_loss: 1.2476, test_f1: 0.4001
 epoch: 1, train_loss: 1.0319, test_loss: 1.0541, test_f1: 0.5210
 epoch: 2, train_loss: 0.9909, test_loss: 0.9920, test_f1: 0.5401
 epoch: 3, train_loss: 0.9462, test_loss: 0.8916, test_f1: 0.5212
 epoch: 4, train_loss: 0.9262, test_loss: 0.9297, test_f1: 0.5438
 epoch: 5, train_loss: 0.8984, test_loss: 0.8494, test_f1: 0.6045
 epoch: 6, train_loss: 0.8802, test_loss: 0.8816, test_f1: 0.6131
 epoch: 7, train_loss: 0.8618, test_loss: 0.8552, test_f1: 0.5620
 epoch: 8, train_loss: 0.8398, test_loss: 0.8066, test_f1: 0.6012
 epoch: 9, train_loss: 0.8176, test_loss: 0.8047, test_f1: 0.6163
 epoch: 10, train_loss: 0.8115, test_loss: 0.7804, test_f1: 0.6179
 epoch: 11, train_loss: 0.8009, test_loss: 0.8115, test_f1: 0.6225
 epoch: 12, train_loss: 0.7883, test_loss: 0.8353, test_f1: 0.5745
 epoch: 13, train_loss: 0.7836, test_loss: 0.8365, test_f1: 0.5755
 epoch: 14, train_loss: 0.7674, test_loss: 0.8013, test_f1: 0.6264
 epoch: 15, train_loss: 0.7542, test_loss: 0.8604, test_f1: 0.6500
 epoch: 16, train_loss: 0.7471, test_loss: 0.7446, test_f1: 0.6641
 epoch: 17, train_loss: 0.7654, test_loss: 0.8468, test_f1: 0.5741
 epoch: 18, train_loss: 0.7233, test_loss: 0.7765, test_f1: 0.6571
 epoch: 19, train_loss: 0.7148, test_loss: 0.7484, test_f1: 0.6328
 epoch: 20, train_loss: 0.6911, test_loss: 0.7385, test_f1: 0.6612
 epoch: 21, train_loss: 0.6777, test_loss: 0.7724, test_f1: 0.6499
 epoch: 22, train_loss: 0.6658, test_loss: 0.8114, test_f1: 0.6108
 epoch: 23, train_loss: 0.6724, test_loss: 0.7631, test_f1: 0.6298
 epoch: 24, train_loss: 0.6693, test_loss: 0.8201, test_f1: 0.6392
 epoch: 25, train_loss: 0.6593, test_loss: 0.7138, test_f1: 0.6561
 epoch: 26, train_loss: 0.6474, test_loss: 0.7288, test_f1: 0.6264
 epoch: 27, train_loss: 0.6289, test_loss: 0.6939, test_f1: 0.6645
 epoch: 28, train_loss: 0.6186, test_loss: 0.7506, test_f1: 0.6671
 epoch: 29, train_loss: 0.6428, test_loss: 0.7512, test_f1: 0.6559
 epoch: 30, train_loss: 0.6126, test_loss: 0.7450, test_f1: 0.6601
 epoch: 31, train_loss: 0.5897, test_loss: 0.7297, test_f1: 0.6525
 epoch: 32, train_loss: 0.5724, test_loss: 0.7374, test_f1: 0.6503
 epoch: 33, train_loss: 0.5937, test_loss: 0.7541, test_f1: 0.6445
 epoch: 34, train_loss: 0.5746, test_loss: 0.7886, test_f1: 0.6403
 epoch: 35, train_loss: 0.5698, test_loss: 0.7635, test_f1: 0.6466
 epoch: 36, train_loss: 0.5652, test_loss: 0.7380, test_f1: 0.6459
 epoch: 37, train_loss: 0.5610, test_loss: 0.8090, test_f1: 0.6691
 epoch: 38, train_loss: 0.5423, test_loss: 0.8185, test_f1: 0.6412
 epoch: 39, train_loss: 0.5516, test_loss: 0.7175, test_f1: 0.6537
 epoch: 40, train_loss: 0.5333, test_loss: 0.7120, test_f1: 0.7041
 epoch: 41, train_loss: 0.5327, test_loss: 0.8025, test_f1: 0.6479
 epoch: 42, train_loss: 0.5248, test_loss: 0.7562, test_f1: 0.6836
 epoch: 43, train_loss: 0.4992, test_loss: 0.8044, test_f1: 0.6509
 epoch: 44, train_loss: 0.5241, test_loss: 0.8441, test_f1: 0.6534
 epoch: 45, train_loss: 0.5024, test_loss: 0.8982, test_f1: 0.6427
 epoch: 46, train_loss: 0.4882, test_loss: 0.7708, test_f1: 0.7079
 epoch: 47, train_loss: 0.5183, test_loss: 0.8175, test_f1: 0.6806
 epoch: 48, train_loss: 0.4808, test_loss: 0.8237, test_f1: 0.6575
 epoch: 49, train_loss: 0.4886, test_loss: 0.8284, test_f1: 0.6672
 epoch: 50, train_loss: 0.4700, test_loss: 0.8140, test_f1: 0.6813
 epoch: 51, train_loss: 0.4338, test_loss: 0.8451, test_f1: 0.6713
 epoch: 52, train_loss: 0.4118, test_loss: 0.8862, test_f1: 0.6785
 epoch: 53, train_loss: 0.4054, test_loss: 0.8935, test_f1: 0.6653
 epoch: 54, train_loss: 0.3966, test_loss: 0.9072, test_f1: 0.6993
 epoch: 55, train_loss: 0.3793, test_loss: 0.8982, test_f1: 0.7123
 epoch: 56, train_loss: 0.3599, test_loss: 0.9877, test_f1: 0.6916
 epoch: 57, train_loss: 0.3888, test_loss: 0.9748, test_f1: 0.6652
 epoch: 58, train_loss: 0.3810, test_loss: 0.8978, test_f1: 0.6826
 epoch: 59, train_loss: 0.3667, test_loss: 0.9302, test_f1: 0.6715
 epoch: 60, train_loss: 0.3553, test_loss: 1.0145, test_f1: 0.6613
 epoch: 61, train_loss: 0.3568, test_loss: 1.0142, test_f1: 0.6529
 epoch: 62, train_loss: 0.3376, test_loss: 1.1101, test_f1: 0.6559
 epoch: 63, train_loss: 0.3608, test_loss: 1.0682, test_f1: 0.6484
 epoch: 64, train_loss: 0.3573, test_loss: 1.0609, test_f1: 0.6650
 epoch: 65, train_loss: 0.3679, test_loss: 0.9521, test_f1: 0.6846
 epoch: 66, train_loss: 0.3487, test_loss: 0.9703, test_f1: 0.6682
 epoch: 67, train_loss: 0.3461, test_loss: 1.0163, test_f1: 0.6889
 epoch: 68, train_loss: 0.3348, test_loss: 1.1299, test_f1: 0.6630
 epoch: 69, train_loss: 0.3307, test_loss: 1.0394, test_f1: 0.6803
 epoch: 70, train_loss: 0.3206, test_loss: 0.9964, test_f1: 0.6865
 epoch: 71, train_loss: 0.3198, test_loss: 1.0931, test_f1: 0.6652
 epoch: 72, train_loss: 0.3257, test_loss: 1.1091, test_f1: 0.6783
 epoch: 73, train_loss: 0.3154, test_loss: 1.0854, test_f1: 0.6777
 epoch: 74, train_loss: 0.3308, test_loss: 1.1299, test_f1: 0.6664
 epoch: 75, train_loss: 0.3251, test_loss: 1.0841, test_f1: 0.6549
 epoch: 76, train_loss: 0.3154, test_loss: 1.1066, test_f1: 0.6830
 epoch: 77, train_loss: 0.3058, test_loss: 1.0751, test_f1: 0.6654
 epoch: 78, train_loss: 0.3010, test_loss: 1.2787, test_f1: 0.6623
 epoch: 79, train_loss: 0.3092, test_loss: 1.2682, test_f1: 0.6390
 epoch: 80, train_loss: 0.3040, test_loss: 1.2522, test_f1: 0.6594
 epoch: 81, train_loss: 0.3066, test_loss: 1.2463, test_f1: 0.6535
 epoch: 82, train_loss: 0.2902, test_loss: 1.1635, test_f1: 0.6631
 epoch: 83, train_loss: 0.3115, test_loss: 1.2672, test_f1: 0.6803
 epoch: 84, train_loss: 0.2941, test_loss: 1.2444, test_f1: 0.6475
 epoch: 85, train_loss: 0.2789, test_loss: 1.2522, test_f1: 0.6616
 epoch: 86, train_loss: 0.2827, test_loss: 1.1902, test_f1: 0.6705
 epoch: 87, train_loss: 0.2861, test_loss: 1.3440, test_f1: 0.6444
 epoch: 88, train_loss: 0.2977, test_loss: 1.2967, test_f1: 0.6539
 epoch: 89, train_loss: 0.2674, test_loss: 1.3536, test_f1: 0.6663
 epoch: 90, train_loss: 0.2621, test_loss: 1.4515, test_f1: 0.6556
 epoch: 91, train_loss: 0.2715, test_loss: 1.4183, test_f1: 0.6339
 epoch: 92, train_loss: 0.2615, test_loss: 1.4120, test_f1: 0.6486
 epoch: 93, train_loss: 0.2692, test_loss: 1.3902, test_f1: 0.6777
 epoch: 94, train_loss: 0.2753, test_loss: 1.3712, test_f1: 0.6584
 epoch: 95, train_loss: 0.2726, test_loss: 1.2651, test_f1: 0.6959
 epoch: 96, train_loss: 0.2435, test_loss: 1.4279, test_f1: 0.6688
 epoch: 97, train_loss: 0.2620, test_loss: 1.3777, test_f1: 0.6672
 epoch: 98, train_loss: 0.2367, test_loss: 1.4036, test_f1: 0.6687
 epoch: 99, train_loss: 0.2520, test_loss: 1.4014, test_f1: 0.6544

Training completed in 888.81 seconds
Best F1: 0.7154 at epoch 85
Mean F1 across iterations: 0.6960  0.0136
========================FINAL RESULTS================================
FEGIN weighted F1: 0.7154  0.0136
python main.py --data ltspice_examples --representation component_pin_net --model FEGIN --layers 6 --hiddens 64 --batch_size 64 --lr 0.001 --emb_size 512 --epochs 100 --save_appendix component_pin_net_L6_H64_BS64_LR0.001_E512 --no_val
-----



STDERR:
  File "main.py", line 370, in <module>
    main()
  File "main.py", line 254, in main
    dataset = dataset_class(
  File "/home/philip/projects/ltspice_examples_code_repo/Circuit-Completion-Using-GNNs/component_classification_with_link_prediction_head/evaluation/FEGIN/kernel/circuit_datasets.py", line 15, in __init__
    self.data, self.slices = torch.load(self.processed_paths[0])
  File "/home/philip/.local/lib/python3.8/site-packages/torch/serialization.py", line 1040, in load
    warnings.warn(
  File "/usr/lib/python3.8/warnings.py", line 109, in _showwarnmsg
    sw(msg.message, msg.category, msg.filename, msg.lineno,
  File "main.py", line 47, in warn_with_traceback
    traceback.print_stack(file=log)
/home/philip/projects/ltspice_examples_code_repo/Circuit-Completion-Using-GNNs/component_classification_with_link_prediction_head/evaluation/FEGIN/kernel/circuit_datasets.py:15: FutureWarning: You are using `torch.load` with `weights_only=False` (the current default value), which uses the default pickle module implicitly. It is possible to construct malicious pickle data which will execute arbitrary code during unpickling (See https://github.com/pytorch/pytorch/blob/main/SECURITY.md#untrusted-models for more details). In a future release, the default value for `weights_only` will be flipped to `True`. This limits the functions that could be executed during unpickling. Arbitrary objects will no longer be allowed to be loaded via this mode unless they are explicitly allowlisted by the user via `torch.serialization.add_safe_globals`. We recommend you start setting `weights_only=True` for any use case where you don't have full control of the loaded file. Please open an issue on GitHub for any issues related to this experimental feature.
  self.data, self.slices = torch.load(self.processed_paths[0])
