STDOUT:
Results will be saved in /home/philip/projects/ltspice_examples_code_repo/Circuit-Completion-Using-GNNs/component_classification_with_link_prediction_head/evaluation/FEGIN/results/model_FEGIN_dataset_ltspice_demos
Command line input: python main.py --data ltspice_demos --representation component_pin_net --model FEGIN --layers 2 --hiddens 32 --batch_size 256 --lr 0.1 --emb_size 512 --epochs 100 --save_appendix component_pin_net_L2_H32_BS256_LR0.1_E512 --no_val
 is saved.
-----
ltspice_demos - FEGIN
Using 2 layers, 32 hidden units, h = 2
Loading component_pin_net representation dataset
ENTERED
Training FEGIN on component_pin_net representation
Train: 1565, Test: 383
##################ITERATION #0 ****************************************
 epoch: 0, train_loss: 1.3014, test_loss: 2.0898, test_f1: 0.2281
 epoch: 1, train_loss: 1.1370, test_loss: 2.1478, test_f1: 0.2298
 epoch: 2, train_loss: 1.0696, test_loss: 1.3445, test_f1: 0.3593
 epoch: 3, train_loss: 1.0516, test_loss: 1.1602, test_f1: 0.4099
 epoch: 4, train_loss: 1.0631, test_loss: 1.1009, test_f1: 0.3988
 epoch: 5, train_loss: 1.0406, test_loss: 1.1234, test_f1: 0.3352
 epoch: 6, train_loss: 1.0278, test_loss: 1.1375, test_f1: 0.3355
 epoch: 7, train_loss: 1.0357, test_loss: 1.4725, test_f1: 0.2835
 epoch: 8, train_loss: 1.0305, test_loss: 1.1307, test_f1: 0.3968
 epoch: 9, train_loss: 1.0289, test_loss: 1.1553, test_f1: 0.3317
 epoch: 10, train_loss: 1.0271, test_loss: 1.1547, test_f1: 0.3317
 epoch: 11, train_loss: 1.0160, test_loss: 1.1585, test_f1: 0.3317
 epoch: 12, train_loss: 1.0230, test_loss: 1.1488, test_f1: 0.3377
 epoch: 13, train_loss: 1.0141, test_loss: 1.1233, test_f1: 0.3388
 epoch: 14, train_loss: 1.0083, test_loss: 1.1331, test_f1: 0.3451
 epoch: 15, train_loss: 1.0028, test_loss: 1.1043, test_f1: 0.3525
 epoch: 16, train_loss: 1.0029, test_loss: 1.1571, test_f1: 0.3317
 epoch: 17, train_loss: 1.0180, test_loss: 1.0929, test_f1: 0.3836
 epoch: 18, train_loss: 0.9909, test_loss: 2.2720, test_f1: 0.2884
 epoch: 19, train_loss: 1.0302, test_loss: 1.1912, test_f1: 0.3787
 epoch: 20, train_loss: 0.9999, test_loss: 0.9993, test_f1: 0.4363
 epoch: 21, train_loss: 1.0395, test_loss: 1.1737, test_f1: 0.3505
 epoch: 22, train_loss: 1.0302, test_loss: 1.1274, test_f1: 0.3728
 epoch: 23, train_loss: 1.0083, test_loss: 1.1748, test_f1: 0.3804
 epoch: 24, train_loss: 1.0487, test_loss: 5.1046, test_f1: 0.1823
 epoch: 25, train_loss: 0.9867, test_loss: 2.6139, test_f1: 0.2499
 epoch: 26, train_loss: 0.9931, test_loss: 1.2484, test_f1: 0.3400
 epoch: 27, train_loss: 0.9797, test_loss: 0.9948, test_f1: 0.4370
 epoch: 28, train_loss: 0.9756, test_loss: 1.0853, test_f1: 0.3761
 epoch: 29, train_loss: 0.9838, test_loss: 1.0199, test_f1: 0.4099
 epoch: 30, train_loss: 0.9763, test_loss: 1.1582, test_f1: 0.3637
 epoch: 31, train_loss: 0.9519, test_loss: 1.0825, test_f1: 0.4190
 epoch: 32, train_loss: 0.9658, test_loss: 1.0923, test_f1: 0.4153
 epoch: 33, train_loss: 0.9701, test_loss: 1.1935, test_f1: 0.3389
 epoch: 34, train_loss: 0.9738, test_loss: 1.0739, test_f1: 0.4133
 epoch: 35, train_loss: 0.9617, test_loss: 1.0559, test_f1: 0.4244
 epoch: 36, train_loss: 0.9587, test_loss: 1.0647, test_f1: 0.4163
 epoch: 37, train_loss: 0.9428, test_loss: 1.0918, test_f1: 0.4106
 epoch: 38, train_loss: 0.9651, test_loss: 1.0280, test_f1: 0.4285
 epoch: 39, train_loss: 0.9798, test_loss: 1.1327, test_f1: 0.3428
 epoch: 40, train_loss: 0.9733, test_loss: 1.2495, test_f1: 0.4267
 epoch: 41, train_loss: 1.1307, test_loss: 6.2914, test_f1: 0.0301
 epoch: 42, train_loss: 1.1648, test_loss: 5.7557, test_f1: 0.0505
 epoch: 43, train_loss: 1.0754, test_loss: 2.0413, test_f1: 0.2017
 epoch: 44, train_loss: 1.0298, test_loss: 1.1297, test_f1: 0.2471
 epoch: 45, train_loss: 1.0347, test_loss: 1.0703, test_f1: 0.4104
 epoch: 46, train_loss: 1.1652, test_loss: 1.1570, test_f1: 0.3394
 epoch: 47, train_loss: 1.1538, test_loss: 1.1718, test_f1: 0.3522
 epoch: 48, train_loss: 1.0961, test_loss: 1.1208, test_f1: 0.3824
 epoch: 49, train_loss: 1.0677, test_loss: 1.0571, test_f1: 0.4125
 epoch: 50, train_loss: 1.0477, test_loss: 1.0832, test_f1: 0.3609
 epoch: 51, train_loss: 1.0385, test_loss: 1.0835, test_f1: 0.3932
 epoch: 52, train_loss: 1.0350, test_loss: 1.0616, test_f1: 0.4153
 epoch: 53, train_loss: 0.9996, test_loss: 1.1274, test_f1: 0.3447
 epoch: 54, train_loss: 1.0045, test_loss: 1.0427, test_f1: 0.4207
 epoch: 55, train_loss: 0.9988, test_loss: 1.0357, test_f1: 0.4117
 epoch: 56, train_loss: 0.9902, test_loss: 1.0615, test_f1: 0.3989
 epoch: 57, train_loss: 0.9579, test_loss: 0.9960, test_f1: 0.4334
 epoch: 58, train_loss: 0.9782, test_loss: 1.0337, test_f1: 0.4177
 epoch: 59, train_loss: 0.9900, test_loss: 2.2048, test_f1: 0.3314
 epoch: 60, train_loss: 0.9746, test_loss: 1.0549, test_f1: 0.4171
 epoch: 61, train_loss: 0.9886, test_loss: 1.0121, test_f1: 0.4310
 epoch: 62, train_loss: 0.9834, test_loss: 0.9944, test_f1: 0.4356
 epoch: 63, train_loss: 0.9787, test_loss: 1.0469, test_f1: 0.4232
 epoch: 64, train_loss: 0.9759, test_loss: 1.0449, test_f1: 0.4232
 epoch: 65, train_loss: 0.9618, test_loss: 1.0431, test_f1: 0.4244
 epoch: 66, train_loss: 0.9847, test_loss: 1.0532, test_f1: 0.4207
 epoch: 67, train_loss: 0.9558, test_loss: 1.0430, test_f1: 0.4244
 epoch: 68, train_loss: 0.9656, test_loss: 1.0508, test_f1: 0.4207
 epoch: 69, train_loss: 0.9962, test_loss: 1.1590, test_f1: 0.3344
 epoch: 70, train_loss: 1.0257, test_loss: 1.1176, test_f1: 0.3370
 epoch: 71, train_loss: 1.0225, test_loss: 1.1499, test_f1: 0.3344
 epoch: 72, train_loss: 1.0347, test_loss: 1.1469, test_f1: 0.3317
 epoch: 73, train_loss: 1.0255, test_loss: 1.0890, test_f1: 0.3438
 epoch: 74, train_loss: 1.0155, test_loss: 1.1202, test_f1: 0.3370
 epoch: 75, train_loss: 1.0198, test_loss: 1.0960, test_f1: 0.3492
 epoch: 76, train_loss: 1.0151, test_loss: 1.1125, test_f1: 0.3370
 epoch: 77, train_loss: 1.0150, test_loss: 1.1222, test_f1: 0.3344
 epoch: 78, train_loss: 1.0246, test_loss: 1.1435, test_f1: 0.3344
 epoch: 79, train_loss: 1.0114, test_loss: 1.1313, test_f1: 0.3344
 epoch: 80, train_loss: 1.0186, test_loss: 1.1393, test_f1: 0.3371
 epoch: 81, train_loss: 1.0194, test_loss: 1.1116, test_f1: 0.3397
 epoch: 82, train_loss: 1.0256, test_loss: 1.1148, test_f1: 0.3370
 epoch: 83, train_loss: 1.0265, test_loss: 1.1340, test_f1: 0.3344
 epoch: 84, train_loss: 1.0385, test_loss: 1.1445, test_f1: 0.3290
 epoch: 85, train_loss: 1.0410, test_loss: 1.1220, test_f1: 0.3370
 epoch: 86, train_loss: 1.0225, test_loss: 1.1149, test_f1: 0.3395
 epoch: 87, train_loss: 1.0152, test_loss: 1.1103, test_f1: 0.3444
 epoch: 88, train_loss: 1.0272, test_loss: 1.1024, test_f1: 0.3381
 epoch: 89, train_loss: 1.0275, test_loss: 1.5397, test_f1: 0.2850
 epoch: 90, train_loss: 1.0319, test_loss: 1.1404, test_f1: 0.3344
 epoch: 91, train_loss: 1.0437, test_loss: 1.1035, test_f1: 0.3355
 epoch: 92, train_loss: 1.0213, test_loss: 1.2673, test_f1: 0.2913
 epoch: 93, train_loss: 1.0009, test_loss: 1.1134, test_f1: 0.3275
 epoch: 94, train_loss: 1.0141, test_loss: 1.0951, test_f1: 0.3415
 epoch: 95, train_loss: 0.9904, test_loss: 1.0841, test_f1: 0.3526
 epoch: 96, train_loss: 0.9619, test_loss: 1.0412, test_f1: 0.4042
 epoch: 97, train_loss: 0.9678, test_loss: 1.0532, test_f1: 0.4010
 epoch: 98, train_loss: 0.9715, test_loss: 1.1207, test_f1: 0.3395
 epoch: 99, train_loss: 0.9850, test_loss: 1.0564, test_f1: 0.4014
##################ITERATION #1 ****************************************
 epoch: 0, train_loss: 1.3324, test_loss: 1.3221, test_f1: 0.2281
 epoch: 1, train_loss: 1.2631, test_loss: 1.3061, test_f1: 0.2281
 epoch: 2, train_loss: 1.2532, test_loss: 1.3072, test_f1: 0.2281
 epoch: 3, train_loss: 1.2532, test_loss: 1.3080, test_f1: 0.2281
 epoch: 4, train_loss: 1.2541, test_loss: 1.3027, test_f1: 0.2281
 epoch: 5, train_loss: 1.2537, test_loss: 1.3011, test_f1: 0.2281
 epoch: 6, train_loss: 1.2532, test_loss: 1.3081, test_f1: 0.2281
 epoch: 7, train_loss: 1.2550, test_loss: 1.3125, test_f1: 0.2281
 epoch: 8, train_loss: 1.2578, test_loss: 1.3070, test_f1: 0.2281
 epoch: 9, train_loss: 1.2537, test_loss: 1.3036, test_f1: 0.2281
 epoch: 10, train_loss: 1.2532, test_loss: 1.3026, test_f1: 0.2281
 epoch: 11, train_loss: 1.2532, test_loss: 1.3064, test_f1: 0.2281
 epoch: 12, train_loss: 1.2531, test_loss: 1.3046, test_f1: 0.2281
 epoch: 13, train_loss: 1.2524, test_loss: 1.3028, test_f1: 0.2281
 epoch: 14, train_loss: 1.2525, test_loss: 1.3007, test_f1: 0.2281
 epoch: 15, train_loss: 1.2540, test_loss: 1.2992, test_f1: 0.2281
 epoch: 16, train_loss: 1.2542, test_loss: 1.3033, test_f1: 0.2281
 epoch: 17, train_loss: 1.2524, test_loss: 1.3029, test_f1: 0.2281
 epoch: 18, train_loss: 1.2523, test_loss: 1.3059, test_f1: 0.2281
 epoch: 19, train_loss: 1.2531, test_loss: 1.3079, test_f1: 0.2281
 epoch: 20, train_loss: 1.2528, test_loss: 1.3102, test_f1: 0.2281
 epoch: 21, train_loss: 1.2528, test_loss: 1.3081, test_f1: 0.2281
 epoch: 22, train_loss: 1.2522, test_loss: 1.3037, test_f1: 0.2281
 epoch: 23, train_loss: 1.2527, test_loss: 1.3018, test_f1: 0.2281
 epoch: 24, train_loss: 1.2527, test_loss: 1.3067, test_f1: 0.2281
 epoch: 25, train_loss: 1.2523, test_loss: 1.3045, test_f1: 0.2281
 epoch: 26, train_loss: 1.2520, test_loss: 1.3025, test_f1: 0.2281
 epoch: 27, train_loss: 1.2534, test_loss: 1.3022, test_f1: 0.2281
 epoch: 28, train_loss: 1.2544, test_loss: 1.3055, test_f1: 0.2281
 epoch: 29, train_loss: 1.2528, test_loss: 1.3052, test_f1: 0.2281
 epoch: 30, train_loss: 1.2531, test_loss: 1.3091, test_f1: 0.2281
 epoch: 31, train_loss: 1.2541, test_loss: 1.3108, test_f1: 0.2281
 epoch: 32, train_loss: 1.2533, test_loss: 1.3061, test_f1: 0.2281
 epoch: 33, train_loss: 1.2526, test_loss: 1.3050, test_f1: 0.2281
 epoch: 34, train_loss: 1.2536, test_loss: 1.3051, test_f1: 0.2281
 epoch: 35, train_loss: 1.2528, test_loss: 1.3035, test_f1: 0.2281
 epoch: 36, train_loss: 1.2524, test_loss: 1.3058, test_f1: 0.2281
 epoch: 37, train_loss: 1.2523, test_loss: 1.3069, test_f1: 0.2281
 epoch: 38, train_loss: 1.2528, test_loss: 1.3044, test_f1: 0.2281
 epoch: 39, train_loss: 1.2532, test_loss: 1.3053, test_f1: 0.2281
 epoch: 40, train_loss: 1.2544, test_loss: 1.3021, test_f1: 0.2281
 epoch: 41, train_loss: 1.2529, test_loss: 1.3054, test_f1: 0.2281
 epoch: 42, train_loss: 1.2524, test_loss: 1.3088, test_f1: 0.2281
 epoch: 43, train_loss: 1.2535, test_loss: 1.3086, test_f1: 0.2281
 epoch: 44, train_loss: 1.2531, test_loss: 1.3050, test_f1: 0.2281
 epoch: 45, train_loss: 1.2526, test_loss: 1.3060, test_f1: 0.2281
 epoch: 46, train_loss: 1.2521, test_loss: 1.3055, test_f1: 0.2281
 epoch: 47, train_loss: 1.2527, test_loss: 1.3037, test_f1: 0.2281
 epoch: 48, train_loss: 1.2523, test_loss: 1.3045, test_f1: 0.2281
 epoch: 49, train_loss: 1.2523, test_loss: 1.3057, test_f1: 0.2281
 epoch: 50, train_loss: 1.2527, test_loss: 1.3055, test_f1: 0.2281
 epoch: 51, train_loss: 1.2521, test_loss: 1.3044, test_f1: 0.2281
 epoch: 52, train_loss: 1.2530, test_loss: 1.3014, test_f1: 0.2281
 epoch: 53, train_loss: 1.2533, test_loss: 1.3020, test_f1: 0.2281
 epoch: 54, train_loss: 1.2521, test_loss: 1.3047, test_f1: 0.2281
 epoch: 55, train_loss: 1.2528, test_loss: 1.3091, test_f1: 0.2281
 epoch: 56, train_loss: 1.2536, test_loss: 1.3094, test_f1: 0.2281
 epoch: 57, train_loss: 1.2526, test_loss: 1.3060, test_f1: 0.2281
 epoch: 58, train_loss: 1.2521, test_loss: 1.3046, test_f1: 0.2281
 epoch: 59, train_loss: 1.2520, test_loss: 1.3038, test_f1: 0.2281
 epoch: 60, train_loss: 1.2523, test_loss: 1.3047, test_f1: 0.2281
 epoch: 61, train_loss: 1.2521, test_loss: 1.3038, test_f1: 0.2281
 epoch: 62, train_loss: 1.2520, test_loss: 1.3017, test_f1: 0.2281
 epoch: 63, train_loss: 1.2523, test_loss: 1.3028, test_f1: 0.2281
 epoch: 64, train_loss: 1.2525, test_loss: 1.3054, test_f1: 0.2281
 epoch: 65, train_loss: 1.2525, test_loss: 1.3077, test_f1: 0.2281
 epoch: 66, train_loss: 1.2525, test_loss: 1.3083, test_f1: 0.2281
 epoch: 67, train_loss: 1.2524, test_loss: 1.3086, test_f1: 0.2281
 epoch: 68, train_loss: 1.2526, test_loss: 1.3109, test_f1: 0.2281
 epoch: 69, train_loss: 1.2531, test_loss: 1.3104, test_f1: 0.2281
 epoch: 70, train_loss: 1.2527, test_loss: 1.3074, test_f1: 0.2281
 epoch: 71, train_loss: 1.2527, test_loss: 1.3047, test_f1: 0.2281
 epoch: 72, train_loss: 1.2525, test_loss: 1.3046, test_f1: 0.2281
 epoch: 73, train_loss: 1.2522, test_loss: 1.3043, test_f1: 0.2281
 epoch: 74, train_loss: 1.2522, test_loss: 1.3046, test_f1: 0.2281
 epoch: 75, train_loss: 1.2526, test_loss: 1.3060, test_f1: 0.2281
 epoch: 76, train_loss: 1.2527, test_loss: 1.3063, test_f1: 0.2281
 epoch: 77, train_loss: 1.2518, test_loss: 1.3057, test_f1: 0.2281
 epoch: 78, train_loss: 1.2523, test_loss: 1.3058, test_f1: 0.2281
 epoch: 79, train_loss: 1.2524, test_loss: 1.3047, test_f1: 0.2281
 epoch: 80, train_loss: 1.2520, test_loss: 1.3034, test_f1: 0.2281
 epoch: 81, train_loss: 1.2523, test_loss: 1.3036, test_f1: 0.2281
 epoch: 82, train_loss: 1.2523, test_loss: 1.3043, test_f1: 0.2281
 epoch: 83, train_loss: 1.2527, test_loss: 1.3065, test_f1: 0.2281
 epoch: 84, train_loss: 1.2525, test_loss: 1.3083, test_f1: 0.2281
 epoch: 85, train_loss: 1.2527, test_loss: 1.3086, test_f1: 0.2281
 epoch: 86, train_loss: 1.2524, test_loss: 1.3049, test_f1: 0.2281
 epoch: 87, train_loss: 1.2520, test_loss: 1.3051, test_f1: 0.2281
 epoch: 88, train_loss: 1.2522, test_loss: 1.3043, test_f1: 0.2281
 epoch: 89, train_loss: 1.2525, test_loss: 1.3036, test_f1: 0.2281
 epoch: 90, train_loss: 1.2522, test_loss: 1.3036, test_f1: 0.2281
 epoch: 91, train_loss: 1.2521, test_loss: 1.3054, test_f1: 0.2281
 epoch: 92, train_loss: 1.2525, test_loss: 1.3068, test_f1: 0.2281
 epoch: 93, train_loss: 1.2524, test_loss: 1.3059, test_f1: 0.2281
 epoch: 94, train_loss: 1.2527, test_loss: 1.3046, test_f1: 0.2281
 epoch: 95, train_loss: 1.2520, test_loss: 1.3029, test_f1: 0.2281
 epoch: 96, train_loss: 1.2523, test_loss: 1.3036, test_f1: 0.2281
 epoch: 97, train_loss: 1.2522, test_loss: 1.3044, test_f1: 0.2281
 epoch: 98, train_loss: 1.2522, test_loss: 1.3028, test_f1: 0.2281
 epoch: 99, train_loss: 1.2524, test_loss: 1.3027, test_f1: 0.2281
##################ITERATION #2 ****************************************
 epoch: 0, train_loss: 1.2785, test_loss: 1.3061, test_f1: 0.2281
 epoch: 1, train_loss: 1.2544, test_loss: 1.3101, test_f1: 0.2281
 epoch: 2, train_loss: 1.2550, test_loss: 1.3083, test_f1: 0.2281
 epoch: 3, train_loss: 1.2546, test_loss: 1.3022, test_f1: 0.2281
 epoch: 4, train_loss: 1.2539, test_loss: 1.3028, test_f1: 0.2281
 epoch: 5, train_loss: 1.2532, test_loss: 1.3038, test_f1: 0.2281
 epoch: 6, train_loss: 1.2520, test_loss: 1.3057, test_f1: 0.2281
 epoch: 7, train_loss: 1.2544, test_loss: 1.3085, test_f1: 0.2281
 epoch: 8, train_loss: 1.2541, test_loss: 1.3056, test_f1: 0.2281
 epoch: 9, train_loss: 1.2531, test_loss: 1.3068, test_f1: 0.2281
 epoch: 10, train_loss: 1.2526, test_loss: 1.3056, test_f1: 0.2281
 epoch: 11, train_loss: 1.2530, test_loss: 1.3030, test_f1: 0.2281
 epoch: 12, train_loss: 1.2522, test_loss: 1.3051, test_f1: 0.2281
 epoch: 13, train_loss: 1.2523, test_loss: 1.3031, test_f1: 0.2281
 epoch: 14, train_loss: 1.2525, test_loss: 1.3023, test_f1: 0.2281
 epoch: 15, train_loss: 1.2520, test_loss: 1.3043, test_f1: 0.2281
 epoch: 16, train_loss: 1.2533, test_loss: 1.3101, test_f1: 0.2281
 epoch: 17, train_loss: 1.2539, test_loss: 1.3101, test_f1: 0.2281
 epoch: 18, train_loss: 1.2522, test_loss: 1.3047, test_f1: 0.2281
 epoch: 19, train_loss: 1.2548, test_loss: 1.3021, test_f1: 0.2281
 epoch: 20, train_loss: 1.2532, test_loss: 1.3047, test_f1: 0.2281
 epoch: 21, train_loss: 1.2523, test_loss: 1.3065, test_f1: 0.2281
 epoch: 22, train_loss: 1.2533, test_loss: 1.3054, test_f1: 0.2281
 epoch: 23, train_loss: 1.2527, test_loss: 1.3047, test_f1: 0.2281
 epoch: 24, train_loss: 1.2527, test_loss: 1.3038, test_f1: 0.2281
 epoch: 25, train_loss: 1.2527, test_loss: 1.3090, test_f1: 0.2281
 epoch: 26, train_loss: 1.2541, test_loss: 1.3070, test_f1: 0.2281
 epoch: 27, train_loss: 1.2526, test_loss: 1.3032, test_f1: 0.2281
 epoch: 28, train_loss: 1.2520, test_loss: 1.3037, test_f1: 0.2281
 epoch: 29, train_loss: 1.2528, test_loss: 1.3037, test_f1: 0.2281
 epoch: 30, train_loss: 1.2535, test_loss: 1.3042, test_f1: 0.2281
 epoch: 31, train_loss: 1.2528, test_loss: 1.3060, test_f1: 0.2281
 epoch: 32, train_loss: 1.2528, test_loss: 1.3060, test_f1: 0.2281
 epoch: 33, train_loss: 1.2531, test_loss: 1.3073, test_f1: 0.2281
 epoch: 34, train_loss: 1.2526, test_loss: 1.3062, test_f1: 0.2281
 epoch: 35, train_loss: 1.2526, test_loss: 1.3076, test_f1: 0.2281
 epoch: 36, train_loss: 1.2530, test_loss: 1.3030, test_f1: 0.2281
 epoch: 37, train_loss: 1.2521, test_loss: 1.3037, test_f1: 0.2281
 epoch: 38, train_loss: 1.2531, test_loss: 1.3076, test_f1: 0.2281
 epoch: 39, train_loss: 1.2529, test_loss: 1.3082, test_f1: 0.2281
 epoch: 40, train_loss: 1.2524, test_loss: 1.3033, test_f1: 0.2281
 epoch: 41, train_loss: 1.2527, test_loss: 1.3021, test_f1: 0.2281
 epoch: 42, train_loss: 1.2538, test_loss: 1.3075, test_f1: 0.2281
 epoch: 43, train_loss: 1.2524, test_loss: 1.3062, test_f1: 0.2281
 epoch: 44, train_loss: 1.2535, test_loss: 1.3051, test_f1: 0.2281
 epoch: 45, train_loss: 1.2526, test_loss: 1.3049, test_f1: 0.2281
 epoch: 46, train_loss: 1.2553, test_loss: 1.3083, test_f1: 0.2281
 epoch: 47, train_loss: 1.2524, test_loss: 1.3070, test_f1: 0.2281
 epoch: 48, train_loss: 1.2534, test_loss: 1.3109, test_f1: 0.2281
 epoch: 49, train_loss: 1.2532, test_loss: 1.3065, test_f1: 0.2281
 epoch: 50, train_loss: 1.2522, test_loss: 1.3009, test_f1: 0.2281
 epoch: 51, train_loss: 1.2533, test_loss: 1.3017, test_f1: 0.2281
 epoch: 52, train_loss: 1.2530, test_loss: 1.3018, test_f1: 0.2281
 epoch: 53, train_loss: 1.2528, test_loss: 1.3016, test_f1: 0.2281
 epoch: 54, train_loss: 1.2524, test_loss: 1.3034, test_f1: 0.2281
 epoch: 55, train_loss: 1.2523, test_loss: 1.3034, test_f1: 0.2281
 epoch: 56, train_loss: 1.2521, test_loss: 1.3048, test_f1: 0.2281
 epoch: 57, train_loss: 1.2520, test_loss: 1.3041, test_f1: 0.2281
 epoch: 58, train_loss: 1.2522, test_loss: 1.3035, test_f1: 0.2281
 epoch: 59, train_loss: 1.2530, test_loss: 1.3052, test_f1: 0.2281
 epoch: 60, train_loss: 1.2541, test_loss: 1.3068, test_f1: 0.2281
 epoch: 61, train_loss: 1.2526, test_loss: 1.3035, test_f1: 0.2281
 epoch: 62, train_loss: 1.2528, test_loss: 1.3014, test_f1: 0.2281
 epoch: 63, train_loss: 1.2540, test_loss: 1.2997, test_f1: 0.2281
 epoch: 64, train_loss: 1.2544, test_loss: 1.3001, test_f1: 0.2281
 epoch: 65, train_loss: 1.2521, test_loss: 1.3043, test_f1: 0.2281
 epoch: 66, train_loss: 1.2525, test_loss: 1.3078, test_f1: 0.2281
 epoch: 67, train_loss: 1.2526, test_loss: 1.3085, test_f1: 0.2281
 epoch: 68, train_loss: 1.2526, test_loss: 1.3093, test_f1: 0.2281
 epoch: 69, train_loss: 1.2525, test_loss: 1.3082, test_f1: 0.2281
 epoch: 70, train_loss: 1.2524, test_loss: 1.3063, test_f1: 0.2281
 epoch: 71, train_loss: 1.2526, test_loss: 1.3053, test_f1: 0.2281
 epoch: 72, train_loss: 1.2528, test_loss: 1.3052, test_f1: 0.2281
 epoch: 73, train_loss: 1.2520, test_loss: 1.3051, test_f1: 0.2281
 epoch: 74, train_loss: 1.2522, test_loss: 1.3049, test_f1: 0.2281
 epoch: 75, train_loss: 1.2526, test_loss: 1.3068, test_f1: 0.2281
 epoch: 76, train_loss: 1.2523, test_loss: 1.3068, test_f1: 0.2281
 epoch: 77, train_loss: 1.2521, test_loss: 1.3045, test_f1: 0.2281
 epoch: 78, train_loss: 1.2527, test_loss: 1.3005, test_f1: 0.2281
 epoch: 79, train_loss: 1.2530, test_loss: 1.3008, test_f1: 0.2281
 epoch: 80, train_loss: 1.2528, test_loss: 1.3045, test_f1: 0.2281
 epoch: 81, train_loss: 1.2540, test_loss: 1.3060, test_f1: 0.2281
 epoch: 82, train_loss: 1.2525, test_loss: 1.3063, test_f1: 0.2281
 epoch: 83, train_loss: 1.2525, test_loss: 1.3070, test_f1: 0.2281
 epoch: 84, train_loss: 1.2526, test_loss: 1.3070, test_f1: 0.2281
 epoch: 85, train_loss: 1.2525, test_loss: 1.3064, test_f1: 0.2281
 epoch: 86, train_loss: 1.2519, test_loss: 1.3080, test_f1: 0.2281
 epoch: 87, train_loss: 1.2531, test_loss: 1.3092, test_f1: 0.2281
 epoch: 88, train_loss: 1.2525, test_loss: 1.3057, test_f1: 0.2281
 epoch: 89, train_loss: 1.2523, test_loss: 1.3031, test_f1: 0.2281
 epoch: 90, train_loss: 1.2524, test_loss: 1.3010, test_f1: 0.2281
 epoch: 91, train_loss: 1.2523, test_loss: 1.3024, test_f1: 0.2281
 epoch: 92, train_loss: 1.2523, test_loss: 1.3042, test_f1: 0.2281
 epoch: 93, train_loss: 1.2523, test_loss: 1.3043, test_f1: 0.2281
 epoch: 94, train_loss: 1.2523, test_loss: 1.3059, test_f1: 0.2281
 epoch: 95, train_loss: 1.2520, test_loss: 1.3045, test_f1: 0.2281
 epoch: 96, train_loss: 1.2521, test_loss: 1.3030, test_f1: 0.2281
 epoch: 97, train_loss: 1.2528, test_loss: 1.3001, test_f1: 0.2281
 epoch: 98, train_loss: 1.2530, test_loss: 1.2997, test_f1: 0.2281
 epoch: 99, train_loss: 1.2538, test_loss: 1.2993, test_f1: 0.2281
##################ITERATION #3 ****************************************
 epoch: 0, train_loss: 1.2551, test_loss: 1.3213, test_f1: 0.1365
 epoch: 1, train_loss: 1.2615, test_loss: 1.3254, test_f1: 0.1365
 epoch: 2, train_loss: 1.2567, test_loss: 1.3108, test_f1: 0.2281
 epoch: 3, train_loss: 1.2529, test_loss: 1.3025, test_f1: 0.2281
 epoch: 4, train_loss: 1.2532, test_loss: 1.3010, test_f1: 0.2281
 epoch: 5, train_loss: 1.2526, test_loss: 1.3065, test_f1: 0.2281
 epoch: 6, train_loss: 1.2526, test_loss: 1.3100, test_f1: 0.2281
 epoch: 7, train_loss: 1.2525, test_loss: 1.3080, test_f1: 0.2281
 epoch: 8, train_loss: 1.2531, test_loss: 1.3073, test_f1: 0.2281
 epoch: 9, train_loss: 1.2533, test_loss: 1.3028, test_f1: 0.2281
 epoch: 10, train_loss: 1.2528, test_loss: 1.3059, test_f1: 0.2281
 epoch: 11, train_loss: 1.2529, test_loss: 1.3091, test_f1: 0.2281
 epoch: 12, train_loss: 1.2537, test_loss: 1.3074, test_f1: 0.2281
 epoch: 13, train_loss: 1.2543, test_loss: 1.3061, test_f1: 0.2281
 epoch: 14, train_loss: 1.2523, test_loss: 1.3008, test_f1: 0.2281
 epoch: 15, train_loss: 1.2535, test_loss: 1.2991, test_f1: 0.2281
 epoch: 16, train_loss: 1.2530, test_loss: 1.3048, test_f1: 0.2281
 epoch: 17, train_loss: 1.2522, test_loss: 1.3055, test_f1: 0.2281
 epoch: 18, train_loss: 1.2527, test_loss: 1.3009, test_f1: 0.2281
 epoch: 19, train_loss: 1.2534, test_loss: 1.2999, test_f1: 0.2281
 epoch: 20, train_loss: 1.2546, test_loss: 1.3021, test_f1: 0.2281
 epoch: 21, train_loss: 1.2527, test_loss: 1.3069, test_f1: 0.2281
 epoch: 22, train_loss: 1.2539, test_loss: 1.3114, test_f1: 0.2281
 epoch: 23, train_loss: 1.2559, test_loss: 1.3147, test_f1: 0.1365
 epoch: 24, train_loss: 1.2548, test_loss: 1.3086, test_f1: 0.2281
 epoch: 25, train_loss: 1.2531, test_loss: 1.3101, test_f1: 0.2281
 epoch: 26, train_loss: 1.2528, test_loss: 1.3088, test_f1: 0.2281
 epoch: 27, train_loss: 1.2537, test_loss: 1.3033, test_f1: 0.2281
 epoch: 28, train_loss: 1.2526, test_loss: 1.3025, test_f1: 0.2281
 epoch: 29, train_loss: 1.2528, test_loss: 1.3045, test_f1: 0.2281
 epoch: 30, train_loss: 1.2525, test_loss: 1.3025, test_f1: 0.2281
 epoch: 31, train_loss: 1.2522, test_loss: 1.3016, test_f1: 0.2281
 epoch: 32, train_loss: 1.2532, test_loss: 1.3066, test_f1: 0.2281
 epoch: 33, train_loss: 1.2530, test_loss: 1.3080, test_f1: 0.2281
 epoch: 34, train_loss: 1.2527, test_loss: 1.3047, test_f1: 0.2281
 epoch: 35, train_loss: 1.2533, test_loss: 1.3041, test_f1: 0.2281
 epoch: 36, train_loss: 1.2535, test_loss: 1.3079, test_f1: 0.2281
 epoch: 37, train_loss: 1.2529, test_loss: 1.3096, test_f1: 0.2281
 epoch: 38, train_loss: 1.2527, test_loss: 1.3080, test_f1: 0.2281
 epoch: 39, train_loss: 1.2536, test_loss: 1.3049, test_f1: 0.2281
 epoch: 40, train_loss: 1.2527, test_loss: 1.3058, test_f1: 0.2281
 epoch: 41, train_loss: 1.2525, test_loss: 1.3059, test_f1: 0.2281
 epoch: 42, train_loss: 1.2532, test_loss: 1.3072, test_f1: 0.2281
 epoch: 43, train_loss: 1.2528, test_loss: 1.3026, test_f1: 0.2281
 epoch: 44, train_loss: 1.2539, test_loss: 1.3036, test_f1: 0.2281
 epoch: 45, train_loss: 1.2524, test_loss: 1.3041, test_f1: 0.2281
 epoch: 46, train_loss: 1.2525, test_loss: 1.3057, test_f1: 0.2281
 epoch: 47, train_loss: 1.2529, test_loss: 1.3042, test_f1: 0.2281
 epoch: 48, train_loss: 1.2522, test_loss: 1.3060, test_f1: 0.2281
 epoch: 49, train_loss: 1.2529, test_loss: 1.3091, test_f1: 0.2281
 epoch: 50, train_loss: 1.2529, test_loss: 1.3064, test_f1: 0.2281
 epoch: 51, train_loss: 1.2529, test_loss: 1.3055, test_f1: 0.2281
 epoch: 52, train_loss: 1.2527, test_loss: 1.3059, test_f1: 0.2281
 epoch: 53, train_loss: 1.2522, test_loss: 1.3043, test_f1: 0.2281
 epoch: 54, train_loss: 1.2524, test_loss: 1.3030, test_f1: 0.2281
 epoch: 55, train_loss: 1.2524, test_loss: 1.3019, test_f1: 0.2281
 epoch: 56, train_loss: 1.2525, test_loss: 1.3017, test_f1: 0.2281
 epoch: 57, train_loss: 1.2525, test_loss: 1.3014, test_f1: 0.2281
 epoch: 58, train_loss: 1.2529, test_loss: 1.3007, test_f1: 0.2281
 epoch: 59, train_loss: 1.2526, test_loss: 1.3024, test_f1: 0.2281
 epoch: 60, train_loss: 1.2521, test_loss: 1.3059, test_f1: 0.2281
 epoch: 61, train_loss: 1.2522, test_loss: 1.3084, test_f1: 0.2281
 epoch: 62, train_loss: 1.2525, test_loss: 1.3046, test_f1: 0.2281
 epoch: 63, train_loss: 1.2520, test_loss: 1.3022, test_f1: 0.2281
 epoch: 64, train_loss: 1.2523, test_loss: 1.3021, test_f1: 0.2281
 epoch: 65, train_loss: 1.2523, test_loss: 1.3012, test_f1: 0.2281
 epoch: 66, train_loss: 1.2530, test_loss: 1.2998, test_f1: 0.2281
 epoch: 67, train_loss: 1.2527, test_loss: 1.3020, test_f1: 0.2281
 epoch: 68, train_loss: 1.2527, test_loss: 1.3053, test_f1: 0.2281
 epoch: 69, train_loss: 1.2526, test_loss: 1.3066, test_f1: 0.2281
 epoch: 70, train_loss: 1.2527, test_loss: 1.3061, test_f1: 0.2281
 epoch: 71, train_loss: 1.2524, test_loss: 1.3053, test_f1: 0.2281
 epoch: 72, train_loss: 1.2522, test_loss: 1.3049, test_f1: 0.2281
 epoch: 73, train_loss: 1.2522, test_loss: 1.3034, test_f1: 0.2281
 epoch: 74, train_loss: 1.2527, test_loss: 1.3008, test_f1: 0.2281
 epoch: 75, train_loss: 1.2527, test_loss: 1.3032, test_f1: 0.2281
 epoch: 76, train_loss: 1.2533, test_loss: 1.3056, test_f1: 0.2281
 epoch: 77, train_loss: 1.2529, test_loss: 1.3051, test_f1: 0.2281
 epoch: 78, train_loss: 1.2519, test_loss: 1.3048, test_f1: 0.2281
 epoch: 79, train_loss: 1.2521, test_loss: 1.3042, test_f1: 0.2281
 epoch: 80, train_loss: 1.2522, test_loss: 1.3041, test_f1: 0.2281
 epoch: 81, train_loss: 1.2522, test_loss: 1.3032, test_f1: 0.2281
 epoch: 82, train_loss: 1.2522, test_loss: 1.3031, test_f1: 0.2281
 epoch: 83, train_loss: 1.2525, test_loss: 1.3050, test_f1: 0.2281
 epoch: 84, train_loss: 1.2522, test_loss: 1.3058, test_f1: 0.2281
 epoch: 85, train_loss: 1.2526, test_loss: 1.3059, test_f1: 0.2281
 epoch: 86, train_loss: 1.2527, test_loss: 1.3027, test_f1: 0.2281
 epoch: 87, train_loss: 1.2524, test_loss: 1.3028, test_f1: 0.2281
 epoch: 88, train_loss: 1.2526, test_loss: 1.3041, test_f1: 0.2281
 epoch: 89, train_loss: 1.2527, test_loss: 1.3054, test_f1: 0.2281
 epoch: 90, train_loss: 1.2531, test_loss: 1.3063, test_f1: 0.2281
 epoch: 91, train_loss: 1.2529, test_loss: 1.3050, test_f1: 0.2281
 epoch: 92, train_loss: 1.2525, test_loss: 1.3026, test_f1: 0.2281
 epoch: 93, train_loss: 1.2529, test_loss: 1.3014, test_f1: 0.2281
 epoch: 94, train_loss: 1.2530, test_loss: 1.3035, test_f1: 0.2281
 epoch: 95, train_loss: 1.2527, test_loss: 1.3033, test_f1: 0.2281
 epoch: 96, train_loss: 1.2526, test_loss: 1.3036, test_f1: 0.2281
 epoch: 97, train_loss: 1.2523, test_loss: 1.3047, test_f1: 0.2281
 epoch: 98, train_loss: 1.2523, test_loss: 1.3033, test_f1: 0.2281
 epoch: 99, train_loss: 1.2518, test_loss: 1.3031, test_f1: 0.2281
##################ITERATION #4 ****************************************
 epoch: 0, train_loss: 1.2561, test_loss: 1.3042, test_f1: 0.2281
 epoch: 1, train_loss: 1.2547, test_loss: 1.3028, test_f1: 0.2281
 epoch: 2, train_loss: 1.2533, test_loss: 1.3038, test_f1: 0.2281
 epoch: 3, train_loss: 1.2526, test_loss: 1.3048, test_f1: 0.2281
 epoch: 4, train_loss: 1.2524, test_loss: 1.3026, test_f1: 0.2281
 epoch: 5, train_loss: 1.2529, test_loss: 1.3053, test_f1: 0.2281
 epoch: 6, train_loss: 1.2530, test_loss: 1.3054, test_f1: 0.2281
 epoch: 7, train_loss: 1.2538, test_loss: 1.3059, test_f1: 0.2281
 epoch: 8, train_loss: 1.2541, test_loss: 1.3126, test_f1: 0.2281
 epoch: 9, train_loss: 1.2543, test_loss: 1.3088, test_f1: 0.2281
 epoch: 10, train_loss: 1.2536, test_loss: 1.3037, test_f1: 0.2281
 epoch: 11, train_loss: 1.2524, test_loss: 1.3026, test_f1: 0.2281
 epoch: 12, train_loss: 1.2529, test_loss: 1.3030, test_f1: 0.2281
 epoch: 13, train_loss: 1.2530, test_loss: 1.3103, test_f1: 0.2281
 epoch: 14, train_loss: 1.2545, test_loss: 1.3060, test_f1: 0.2281
 epoch: 15, train_loss: 1.2532, test_loss: 1.3048, test_f1: 0.2281
 epoch: 16, train_loss: 1.2526, test_loss: 1.3090, test_f1: 0.2281
 epoch: 17, train_loss: 1.2540, test_loss: 1.3145, test_f1: 0.1365
 epoch: 18, train_loss: 1.2549, test_loss: 1.3078, test_f1: 0.2281
 epoch: 19, train_loss: 1.2525, test_loss: 1.3073, test_f1: 0.2281
 epoch: 20, train_loss: 1.2554, test_loss: 1.3062, test_f1: 0.2281
 epoch: 21, train_loss: 1.2521, test_loss: 1.3053, test_f1: 0.2281
 epoch: 22, train_loss: 1.2534, test_loss: 1.3081, test_f1: 0.2281
 epoch: 23, train_loss: 1.2530, test_loss: 1.3056, test_f1: 0.2281
 epoch: 24, train_loss: 1.2525, test_loss: 1.3034, test_f1: 0.2281
 epoch: 25, train_loss: 1.2528, test_loss: 1.3017, test_f1: 0.2281
 epoch: 26, train_loss: 1.2542, test_loss: 1.3050, test_f1: 0.2281
 epoch: 27, train_loss: 1.2520, test_loss: 1.3109, test_f1: 0.2281
 epoch: 28, train_loss: 1.2536, test_loss: 1.3101, test_f1: 0.2281
 epoch: 29, train_loss: 1.2538, test_loss: 1.3026, test_f1: 0.2281
 epoch: 30, train_loss: 1.2526, test_loss: 1.3023, test_f1: 0.2281
 epoch: 31, train_loss: 1.2570, test_loss: 1.3091, test_f1: 0.1365
 epoch: 32, train_loss: 1.2548, test_loss: 1.3103, test_f1: 0.2281
 epoch: 33, train_loss: 1.2529, test_loss: 1.3081, test_f1: 0.2281
 epoch: 34, train_loss: 1.2527, test_loss: 1.3087, test_f1: 0.2281
 epoch: 35, train_loss: 1.2541, test_loss: 1.3095, test_f1: 0.2281
 epoch: 36, train_loss: 1.2541, test_loss: 1.3031, test_f1: 0.2281
 epoch: 37, train_loss: 1.2523, test_loss: 1.3070, test_f1: 0.2281
 epoch: 38, train_loss: 1.2528, test_loss: 1.3046, test_f1: 0.2281
 epoch: 39, train_loss: 1.2520, test_loss: 1.3032, test_f1: 0.2281
 epoch: 40, train_loss: 1.2528, test_loss: 1.3090, test_f1: 0.2281
 epoch: 41, train_loss: 1.2534, test_loss: 1.3073, test_f1: 0.2281
 epoch: 42, train_loss: 1.2531, test_loss: 1.3039, test_f1: 0.2281
 epoch: 43, train_loss: 1.2528, test_loss: 1.3028, test_f1: 0.2281
 epoch: 44, train_loss: 1.2534, test_loss: 1.3073, test_f1: 0.2281
 epoch: 45, train_loss: 1.2526, test_loss: 1.3069, test_f1: 0.2281
 epoch: 46, train_loss: 1.2520, test_loss: 1.3050, test_f1: 0.2281
 epoch: 47, train_loss: 1.2531, test_loss: 1.3042, test_f1: 0.2281
 epoch: 48, train_loss: 1.2533, test_loss: 1.3036, test_f1: 0.2281
 epoch: 49, train_loss: 1.2551, test_loss: 1.3061, test_f1: 0.2281
 epoch: 50, train_loss: 1.2535, test_loss: 1.3041, test_f1: 0.2281
 epoch: 51, train_loss: 1.2523, test_loss: 1.3044, test_f1: 0.2281
 epoch: 52, train_loss: 1.2523, test_loss: 1.3056, test_f1: 0.2281
 epoch: 53, train_loss: 1.2523, test_loss: 1.3079, test_f1: 0.2281
 epoch: 54, train_loss: 1.2524, test_loss: 1.3102, test_f1: 0.2281
 epoch: 55, train_loss: 1.2529, test_loss: 1.3071, test_f1: 0.2281
 epoch: 56, train_loss: 1.2525, test_loss: 1.3060, test_f1: 0.2281
 epoch: 57, train_loss: 1.2525, test_loss: 1.3055, test_f1: 0.2281
 epoch: 58, train_loss: 1.2523, test_loss: 1.3044, test_f1: 0.2281
 epoch: 59, train_loss: 1.2524, test_loss: 1.3033, test_f1: 0.2281
 epoch: 60, train_loss: 1.2525, test_loss: 1.3018, test_f1: 0.2281
 epoch: 61, train_loss: 1.2524, test_loss: 1.3027, test_f1: 0.2281
 epoch: 62, train_loss: 1.2525, test_loss: 1.3044, test_f1: 0.2281
 epoch: 63, train_loss: 1.2520, test_loss: 1.3068, test_f1: 0.2281
 epoch: 64, train_loss: 1.2520, test_loss: 1.3080, test_f1: 0.2281
 epoch: 65, train_loss: 1.2528, test_loss: 1.3087, test_f1: 0.2281
 epoch: 66, train_loss: 1.2523, test_loss: 1.3039, test_f1: 0.2281
 epoch: 67, train_loss: 1.2521, test_loss: 1.2999, test_f1: 0.2281
 epoch: 68, train_loss: 1.2533, test_loss: 1.2998, test_f1: 0.2281
 epoch: 69, train_loss: 1.2533, test_loss: 1.3022, test_f1: 0.2281
 epoch: 70, train_loss: 1.2521, test_loss: 1.3049, test_f1: 0.2281
 epoch: 71, train_loss: 1.2522, test_loss: 1.3060, test_f1: 0.2281
 epoch: 72, train_loss: 1.2521, test_loss: 1.3048, test_f1: 0.2281
 epoch: 73, train_loss: 1.2523, test_loss: 1.3059, test_f1: 0.2281
 epoch: 74, train_loss: 1.2523, test_loss: 1.3051, test_f1: 0.2281
 epoch: 75, train_loss: 1.2524, test_loss: 1.3070, test_f1: 0.2281
 epoch: 76, train_loss: 1.2524, test_loss: 1.3075, test_f1: 0.2281
 epoch: 77, train_loss: 1.2526, test_loss: 1.3039, test_f1: 0.2281
 epoch: 78, train_loss: 1.2527, test_loss: 1.3012, test_f1: 0.2281
 epoch: 79, train_loss: 1.2532, test_loss: 1.3011, test_f1: 0.2281
 epoch: 80, train_loss: 1.2527, test_loss: 1.3050, test_f1: 0.2281
 epoch: 81, train_loss: 1.2527, test_loss: 1.3067, test_f1: 0.2281
 epoch: 82, train_loss: 1.2530, test_loss: 1.3039, test_f1: 0.2281
 epoch: 83, train_loss: 1.2521, test_loss: 1.3037, test_f1: 0.2281
 epoch: 84, train_loss: 1.2522, test_loss: 1.3027, test_f1: 0.2281
 epoch: 85, train_loss: 1.2524, test_loss: 1.3023, test_f1: 0.2281
 epoch: 86, train_loss: 1.2524, test_loss: 1.3036, test_f1: 0.2281
 epoch: 87, train_loss: 1.2522, test_loss: 1.3054, test_f1: 0.2281
 epoch: 88, train_loss: 1.2523, test_loss: 1.3042, test_f1: 0.2281
 epoch: 89, train_loss: 1.2523, test_loss: 1.3031, test_f1: 0.2281
 epoch: 90, train_loss: 1.2524, test_loss: 1.3024, test_f1: 0.2281
 epoch: 91, train_loss: 1.2524, test_loss: 1.3037, test_f1: 0.2281
 epoch: 92, train_loss: 1.2521, test_loss: 1.3035, test_f1: 0.2281
 epoch: 93, train_loss: 1.2523, test_loss: 1.3037, test_f1: 0.2281
 epoch: 94, train_loss: 1.2526, test_loss: 1.3060, test_f1: 0.2281
 epoch: 95, train_loss: 1.2530, test_loss: 1.3086, test_f1: 0.2281
 epoch: 96, train_loss: 1.2529, test_loss: 1.3077, test_f1: 0.2281
 epoch: 97, train_loss: 1.2526, test_loss: 1.3083, test_f1: 0.2281
 epoch: 98, train_loss: 1.2525, test_loss: 1.3063, test_f1: 0.2281
 epoch: 99, train_loss: 1.2527, test_loss: 1.3054, test_f1: 0.2281
##################ITERATION #5 ****************************************
 epoch: 0, train_loss: 1.2544, test_loss: 1.3129, test_f1: 0.1365
 epoch: 1, train_loss: 1.2554, test_loss: 1.3143, test_f1: 0.2281
 epoch: 2, train_loss: 1.2534, test_loss: 1.3089, test_f1: 0.2281
 epoch: 3, train_loss: 1.2551, test_loss: 1.3056, test_f1: 0.2281
 epoch: 4, train_loss: 1.2537, test_loss: 1.3048, test_f1: 0.2281
 epoch: 5, train_loss: 1.2521, test_loss: 1.3030, test_f1: 0.2281
 epoch: 6, train_loss: 1.2533, test_loss: 1.3008, test_f1: 0.2281
 epoch: 7, train_loss: 1.2538, test_loss: 1.3015, test_f1: 0.2281
 epoch: 8, train_loss: 1.2536, test_loss: 1.3070, test_f1: 0.2281
 epoch: 9, train_loss: 1.2528, test_loss: 1.3091, test_f1: 0.2281
 epoch: 10, train_loss: 1.2534, test_loss: 1.3108, test_f1: 0.2281
 epoch: 11, train_loss: 1.2530, test_loss: 1.3054, test_f1: 0.2281
 epoch: 12, train_loss: 1.2525, test_loss: 1.3055, test_f1: 0.2281
 epoch: 13, train_loss: 1.2531, test_loss: 1.3013, test_f1: 0.2281
 epoch: 14, train_loss: 1.2528, test_loss: 1.3040, test_f1: 0.2281
 epoch: 15, train_loss: 1.2531, test_loss: 1.3143, test_f1: 0.2281
 epoch: 16, train_loss: 1.2553, test_loss: 1.3132, test_f1: 0.2281
 epoch: 17, train_loss: 1.2525, test_loss: 1.3055, test_f1: 0.2281
 epoch: 18, train_loss: 1.2522, test_loss: 1.3046, test_f1: 0.2281
 epoch: 19, train_loss: 1.2523, test_loss: 1.3047, test_f1: 0.2281
 epoch: 20, train_loss: 1.2522, test_loss: 1.3024, test_f1: 0.2281
 epoch: 21, train_loss: 1.2531, test_loss: 1.3015, test_f1: 0.2281
 epoch: 22, train_loss: 1.2528, test_loss: 1.3015, test_f1: 0.2281
 epoch: 23, train_loss: 1.2528, test_loss: 1.3031, test_f1: 0.2281
 epoch: 24, train_loss: 1.2530, test_loss: 1.3052, test_f1: 0.2281
 epoch: 25, train_loss: 1.2519, test_loss: 1.3057, test_f1: 0.2281
 epoch: 26, train_loss: 1.2541, test_loss: 1.3050, test_f1: 0.2281
 epoch: 27, train_loss: 1.2524, test_loss: 1.3058, test_f1: 0.2281
 epoch: 28, train_loss: 1.2534, test_loss: 1.3078, test_f1: 0.2281
 epoch: 29, train_loss: 1.2526, test_loss: 1.3061, test_f1: 0.2281
 epoch: 30, train_loss: 1.2526, test_loss: 1.3108, test_f1: 0.2281
 epoch: 31, train_loss: 1.2547, test_loss: 1.3095, test_f1: 0.2281
 epoch: 32, train_loss: 1.2528, test_loss: 1.3049, test_f1: 0.2281
 epoch: 33, train_loss: 1.2519, test_loss: 1.3036, test_f1: 0.2281
 epoch: 34, train_loss: 1.2525, test_loss: 1.3034, test_f1: 0.2281
 epoch: 35, train_loss: 1.2533, test_loss: 1.3069, test_f1: 0.2281
 epoch: 36, train_loss: 1.2531, test_loss: 1.3051, test_f1: 0.2281
 epoch: 37, train_loss: 1.2528, test_loss: 1.3050, test_f1: 0.2281
 epoch: 38, train_loss: 1.2528, test_loss: 1.3041, test_f1: 0.2281
 epoch: 39, train_loss: 1.2546, test_loss: 1.3126, test_f1: 0.2281
 epoch: 40, train_loss: 1.2528, test_loss: 1.3050, test_f1: 0.2281
 epoch: 41, train_loss: 1.2533, test_loss: 1.3015, test_f1: 0.2281
 epoch: 42, train_loss: 1.2520, test_loss: 1.3101, test_f1: 0.2281
 epoch: 43, train_loss: 1.2534, test_loss: 1.3172, test_f1: 0.2281
 epoch: 44, train_loss: 1.2546, test_loss: 1.3099, test_f1: 0.2281
 epoch: 45, train_loss: 1.2531, test_loss: 1.3025, test_f1: 0.2281
 epoch: 46, train_loss: 1.2532, test_loss: 1.3027, test_f1: 0.2281
 epoch: 47, train_loss: 1.2540, test_loss: 1.3033, test_f1: 0.2281
 epoch: 48, train_loss: 1.2544, test_loss: 1.3068, test_f1: 0.2281
 epoch: 49, train_loss: 1.2519, test_loss: 1.3078, test_f1: 0.2281
 epoch: 50, train_loss: 1.2537, test_loss: 1.3142, test_f1: 0.2281
 epoch: 51, train_loss: 1.2544, test_loss: 1.3124, test_f1: 0.2281
 epoch: 52, train_loss: 1.2534, test_loss: 1.3098, test_f1: 0.2281
 epoch: 53, train_loss: 1.2525, test_loss: 1.3063, test_f1: 0.2281
 epoch: 54, train_loss: 1.2520, test_loss: 1.3031, test_f1: 0.2281
 epoch: 55, train_loss: 1.2521, test_loss: 1.3038, test_f1: 0.2281
 epoch: 56, train_loss: 1.2524, test_loss: 1.3040, test_f1: 0.2281
 epoch: 57, train_loss: 1.2522, test_loss: 1.3083, test_f1: 0.2281
 epoch: 58, train_loss: 1.2530, test_loss: 1.3107, test_f1: 0.2281
 epoch: 59, train_loss: 1.2534, test_loss: 1.3096, test_f1: 0.2281
 epoch: 60, train_loss: 1.2526, test_loss: 1.3071, test_f1: 0.2281
 epoch: 61, train_loss: 1.2522, test_loss: 1.3059, test_f1: 0.2281
 epoch: 62, train_loss: 1.2522, test_loss: 1.3053, test_f1: 0.2281
 epoch: 63, train_loss: 1.2523, test_loss: 1.3053, test_f1: 0.2281
 epoch: 64, train_loss: 1.2523, test_loss: 1.3066, test_f1: 0.2281
 epoch: 65, train_loss: 1.2522, test_loss: 1.3062, test_f1: 0.2281
 epoch: 66, train_loss: 1.2521, test_loss: 1.3053, test_f1: 0.2281
 epoch: 67, train_loss: 1.2521, test_loss: 1.3034, test_f1: 0.2281
 epoch: 68, train_loss: 1.2524, test_loss: 1.3024, test_f1: 0.2281
 epoch: 69, train_loss: 1.2528, test_loss: 1.3033, test_f1: 0.2281
 epoch: 70, train_loss: 1.2525, test_loss: 1.3059, test_f1: 0.2281
 epoch: 71, train_loss: 1.2524, test_loss: 1.3085, test_f1: 0.2281
 epoch: 72, train_loss: 1.2528, test_loss: 1.3070, test_f1: 0.2281
 epoch: 73, train_loss: 1.2529, test_loss: 1.3087, test_f1: 0.2281
 epoch: 74, train_loss: 1.2532, test_loss: 1.3041, test_f1: 0.2281
 epoch: 75, train_loss: 1.2526, test_loss: 1.3021, test_f1: 0.2281
 epoch: 76, train_loss: 1.2530, test_loss: 1.3025, test_f1: 0.2281
 epoch: 77, train_loss: 1.2528, test_loss: 1.3048, test_f1: 0.2281
 epoch: 78, train_loss: 1.2522, test_loss: 1.3075, test_f1: 0.2281
 epoch: 79, train_loss: 1.2527, test_loss: 1.3086, test_f1: 0.2281
 epoch: 80, train_loss: 1.2526, test_loss: 1.3081, test_f1: 0.2281
 epoch: 81, train_loss: 1.2525, test_loss: 1.3075, test_f1: 0.2281
 epoch: 82, train_loss: 1.2524, test_loss: 1.3045, test_f1: 0.2281
 epoch: 83, train_loss: 1.2522, test_loss: 1.3059, test_f1: 0.2281
 epoch: 84, train_loss: 1.2530, test_loss: 1.3093, test_f1: 0.2281
 epoch: 85, train_loss: 1.2525, test_loss: 1.3061, test_f1: 0.2281
 epoch: 86, train_loss: 1.2521, test_loss: 1.3052, test_f1: 0.2281
 epoch: 87, train_loss: 1.2527, test_loss: 1.3071, test_f1: 0.2281
 epoch: 88, train_loss: 1.2532, test_loss: 1.3092, test_f1: 0.2281
 epoch: 89, train_loss: 1.2530, test_loss: 1.3058, test_f1: 0.2281
 epoch: 90, train_loss: 1.2522, test_loss: 1.3041, test_f1: 0.2281
 epoch: 91, train_loss: 1.2522, test_loss: 1.3033, test_f1: 0.2281
 epoch: 92, train_loss: 1.2529, test_loss: 1.3048, test_f1: 0.2281
 epoch: 93, train_loss: 1.2527, test_loss: 1.3058, test_f1: 0.2281
 epoch: 94, train_loss: 1.2521, test_loss: 1.3054, test_f1: 0.2281
 epoch: 95, train_loss: 1.2524, test_loss: 1.3046, test_f1: 0.2281
 epoch: 96, train_loss: 1.2526, test_loss: 1.3041, test_f1: 0.2281
 epoch: 97, train_loss: 1.2525, test_loss: 1.3053, test_f1: 0.2281
 epoch: 98, train_loss: 1.2523, test_loss: 1.3051, test_f1: 0.2281
 epoch: 99, train_loss: 1.2520, test_loss: 1.3044, test_f1: 0.2281
##################ITERATION #6 ****************************************
 epoch: 0, train_loss: 1.2563, test_loss: 1.3014, test_f1: 0.2281
 epoch: 1, train_loss: 1.2532, test_loss: 1.3035, test_f1: 0.2281
 epoch: 2, train_loss: 1.2534, test_loss: 1.3063, test_f1: 0.2281
 epoch: 3, train_loss: 1.2533, test_loss: 1.3053, test_f1: 0.2281
 epoch: 4, train_loss: 1.2489, test_loss: 5.5945, test_f1: 0.1365
 epoch: 5, train_loss: 1.2532, test_loss: 1.2982, test_f1: 0.2281
 epoch: 6, train_loss: 1.2536, test_loss: 2.1841, test_f1: 0.2281
 epoch: 7, train_loss: 1.2521, test_loss: 1.5175, test_f1: 0.2874
 epoch: 8, train_loss: 1.2491, test_loss: 1.4061, test_f1: 0.3123
 epoch: 9, train_loss: 1.2333, test_loss: 1.5159, test_f1: 0.2281
 epoch: 10, train_loss: 1.2356, test_loss: 1.3003, test_f1: 0.2281
 epoch: 11, train_loss: 1.2195, test_loss: 1.2887, test_f1: 0.2281
 epoch: 12, train_loss: 1.2229, test_loss: 1.2898, test_f1: 0.2583
 epoch: 13, train_loss: 1.2214, test_loss: 1.2625, test_f1: 0.2281
 epoch: 14, train_loss: 1.2011, test_loss: 1.8659, test_f1: 0.2270
 epoch: 15, train_loss: 1.1999, test_loss: 1.4763, test_f1: 0.2039
 epoch: 16, train_loss: 1.1993, test_loss: 1.4065, test_f1: 0.1500
 epoch: 17, train_loss: 1.1553, test_loss: 1.2720, test_f1: 0.2390
 epoch: 18, train_loss: 1.1509, test_loss: 1.2696, test_f1: 0.2498
 epoch: 19, train_loss: 1.1228, test_loss: 1.2994, test_f1: 0.2539
 epoch: 20, train_loss: 1.1070, test_loss: 1.2071, test_f1: 0.3262
 epoch: 21, train_loss: 1.0958, test_loss: 1.2355, test_f1: 0.3964
 epoch: 22, train_loss: 1.0962, test_loss: 1.2610, test_f1: 0.3262
 epoch: 23, train_loss: 1.0809, test_loss: 1.2220, test_f1: 0.3301
 epoch: 24, train_loss: 1.0579, test_loss: 1.1763, test_f1: 0.4307
 epoch: 25, train_loss: 1.1082, test_loss: 1.3397, test_f1: 0.2539
 epoch: 26, train_loss: 1.0900, test_loss: 1.1955, test_f1: 0.4242
 epoch: 27, train_loss: 1.0916, test_loss: 1.2277, test_f1: 0.2718
 epoch: 28, train_loss: 1.1217, test_loss: 1.3884, test_f1: 0.3605
 epoch: 29, train_loss: 1.1427, test_loss: 1.8760, test_f1: 0.1822
 epoch: 30, train_loss: 1.0853, test_loss: 1.4073, test_f1: 0.2978
 epoch: 31, train_loss: 1.1040, test_loss: 1.2798, test_f1: 0.2337
 epoch: 32, train_loss: 1.0778, test_loss: 1.1900, test_f1: 0.3262
 epoch: 33, train_loss: 1.0726, test_loss: 1.2433, test_f1: 0.3252
 epoch: 34, train_loss: 1.0611, test_loss: 1.2113, test_f1: 0.2855
 epoch: 35, train_loss: 1.0550, test_loss: 1.2871, test_f1: 0.3262
 epoch: 36, train_loss: 1.0566, test_loss: 1.2174, test_f1: 0.4198
 epoch: 37, train_loss: 1.0773, test_loss: 1.3144, test_f1: 0.3098
 epoch: 38, train_loss: 1.0606, test_loss: 1.1831, test_f1: 0.3852
 epoch: 39, train_loss: 1.0487, test_loss: 1.1654, test_f1: 0.3290
 epoch: 40, train_loss: 1.0502, test_loss: 1.1787, test_f1: 0.3262
 epoch: 41, train_loss: 1.0697, test_loss: 1.3693, test_f1: 0.3032
 epoch: 42, train_loss: 1.0532, test_loss: 1.2445, test_f1: 0.4021
 epoch: 43, train_loss: 1.0498, test_loss: 2.4866, test_f1: 0.1677
 epoch: 44, train_loss: 1.1152, test_loss: 1.3049, test_f1: 0.3363
 epoch: 45, train_loss: 1.0610, test_loss: 1.5455, test_f1: 0.1803
 epoch: 46, train_loss: 1.0645, test_loss: 1.5667, test_f1: 0.2682
 epoch: 47, train_loss: 1.0626, test_loss: 1.2877, test_f1: 0.2949
 epoch: 48, train_loss: 1.0541, test_loss: 1.2815, test_f1: 0.3648
 epoch: 49, train_loss: 1.0522, test_loss: 1.2363, test_f1: 0.3146
 epoch: 50, train_loss: 1.0597, test_loss: 1.1302, test_f1: 0.4248
 epoch: 51, train_loss: 1.0396, test_loss: 1.1670, test_f1: 0.3317
 epoch: 52, train_loss: 1.0386, test_loss: 1.1899, test_f1: 0.3317
 epoch: 53, train_loss: 1.0449, test_loss: 1.1248, test_f1: 0.3365
 epoch: 54, train_loss: 1.0414, test_loss: 1.1515, test_f1: 0.4167
 epoch: 55, train_loss: 1.0267, test_loss: 1.1436, test_f1: 0.3770
 epoch: 56, train_loss: 1.0335, test_loss: 1.1984, test_f1: 0.4246
 epoch: 57, train_loss: 1.0442, test_loss: 1.2437, test_f1: 0.4105
 epoch: 58, train_loss: 1.0298, test_loss: 1.2387, test_f1: 0.3687
 epoch: 59, train_loss: 1.0264, test_loss: 1.2421, test_f1: 0.4192
 epoch: 60, train_loss: 1.0322, test_loss: 1.2126, test_f1: 0.4209
 epoch: 61, train_loss: 1.0298, test_loss: 1.1491, test_f1: 0.3744
 epoch: 62, train_loss: 1.0290, test_loss: 1.1322, test_f1: 0.3719
 epoch: 63, train_loss: 1.0338, test_loss: 1.1356, test_f1: 0.3814
 epoch: 64, train_loss: 1.0321, test_loss: 1.1595, test_f1: 0.4298
 epoch: 65, train_loss: 1.0350, test_loss: 1.1248, test_f1: 0.3412
 epoch: 66, train_loss: 1.0304, test_loss: 1.1346, test_f1: 0.4394
 epoch: 67, train_loss: 1.0262, test_loss: 1.1499, test_f1: 0.3700
 epoch: 68, train_loss: 1.0420, test_loss: 1.1529, test_f1: 0.3290
 epoch: 69, train_loss: 1.0377, test_loss: 1.1692, test_f1: 0.3914
 epoch: 70, train_loss: 1.0357, test_loss: 1.1792, test_f1: 0.3436
 epoch: 71, train_loss: 1.0340, test_loss: 1.1627, test_f1: 0.4360
 epoch: 72, train_loss: 1.0386, test_loss: 1.1968, test_f1: 0.4279
 epoch: 73, train_loss: 1.0405, test_loss: 1.1831, test_f1: 0.4222
 epoch: 74, train_loss: 1.0375, test_loss: 1.1934, test_f1: 0.4003
 epoch: 75, train_loss: 1.0351, test_loss: 1.1751, test_f1: 0.4249
 epoch: 76, train_loss: 1.0256, test_loss: 1.2105, test_f1: 0.4253
 epoch: 77, train_loss: 1.0296, test_loss: 1.1573, test_f1: 0.3972
 epoch: 78, train_loss: 1.0195, test_loss: 1.1808, test_f1: 0.4342
 epoch: 79, train_loss: 1.0235, test_loss: 1.1678, test_f1: 0.4324
 epoch: 80, train_loss: 1.0268, test_loss: 1.1295, test_f1: 0.3838
 epoch: 81, train_loss: 1.0212, test_loss: 1.1646, test_f1: 0.4388
 epoch: 82, train_loss: 1.0287, test_loss: 1.1225, test_f1: 0.3395
 epoch: 83, train_loss: 1.0244, test_loss: 1.1373, test_f1: 0.4408
 epoch: 84, train_loss: 1.0096, test_loss: 1.1319, test_f1: 0.4219
 epoch: 85, train_loss: 1.0161, test_loss: 1.1316, test_f1: 0.4290
 epoch: 86, train_loss: 0.9986, test_loss: 1.1854, test_f1: 0.4393
 epoch: 87, train_loss: 1.0055, test_loss: 1.1474, test_f1: 0.4305
 epoch: 88, train_loss: 0.9984, test_loss: 1.1241, test_f1: 0.4214
 epoch: 89, train_loss: 1.0126, test_loss: 1.1202, test_f1: 0.3836
 epoch: 90, train_loss: 1.0040, test_loss: 1.1555, test_f1: 0.4433
 epoch: 91, train_loss: 1.0074, test_loss: 1.1210, test_f1: 0.3958
 epoch: 92, train_loss: 1.0200, test_loss: 1.1335, test_f1: 0.4455
 epoch: 93, train_loss: 1.0141, test_loss: 1.1181, test_f1: 0.3395
 epoch: 94, train_loss: 1.0116, test_loss: 1.1115, test_f1: 0.3395
 epoch: 95, train_loss: 1.0097, test_loss: 1.1162, test_f1: 0.4477
 epoch: 96, train_loss: 0.9880, test_loss: 1.1539, test_f1: 0.4297
 epoch: 97, train_loss: 1.0052, test_loss: 1.0913, test_f1: 0.3720
 epoch: 98, train_loss: 1.0005, test_loss: 1.1987, test_f1: 0.4361
 epoch: 99, train_loss: 1.0011, test_loss: 1.4624, test_f1: 0.2849
##################ITERATION #7 ****************************************
 epoch: 0, train_loss: 1.9549, test_loss: 4.8771, test_f1: 0.1365
 epoch: 1, train_loss: 1.1721, test_loss: 2.7550, test_f1: 0.1368
 epoch: 2, train_loss: 1.1046, test_loss: 2.7951, test_f1: 0.1368
 epoch: 3, train_loss: 1.0632, test_loss: 1.7713, test_f1: 0.1470
 epoch: 4, train_loss: 1.0674, test_loss: 1.4139, test_f1: 0.3414
 epoch: 5, train_loss: 1.0629, test_loss: 1.1879, test_f1: 0.3731
 epoch: 6, train_loss: 1.0424, test_loss: 1.1780, test_f1: 0.4288
 epoch: 7, train_loss: 1.0451, test_loss: 1.2071, test_f1: 0.4176
 epoch: 8, train_loss: 1.0352, test_loss: 1.2193, test_f1: 0.3115
 epoch: 9, train_loss: 1.0982, test_loss: 1.2810, test_f1: 0.3604
 epoch: 10, train_loss: 1.0739, test_loss: 1.1762, test_f1: 0.3615
 epoch: 11, train_loss: 1.0549, test_loss: 1.1438, test_f1: 0.4219
 epoch: 12, train_loss: 1.0454, test_loss: 1.1539, test_f1: 0.3731
 epoch: 13, train_loss: 1.0400, test_loss: 1.1404, test_f1: 0.4277
 epoch: 14, train_loss: 1.0307, test_loss: 1.1681, test_f1: 0.4225
 epoch: 15, train_loss: 1.0266, test_loss: 1.1740, test_f1: 0.3234
 epoch: 16, train_loss: 1.0263, test_loss: 1.1946, test_f1: 0.3940
 epoch: 17, train_loss: 1.0381, test_loss: 1.1823, test_f1: 0.3259
 epoch: 18, train_loss: 1.0411, test_loss: 1.1433, test_f1: 0.4272
 epoch: 19, train_loss: 1.0377, test_loss: 1.1174, test_f1: 0.3714
 epoch: 20, train_loss: 1.0247, test_loss: 1.1616, test_f1: 0.3176
 epoch: 21, train_loss: 1.0199, test_loss: 1.1587, test_f1: 0.4273
 epoch: 22, train_loss: 1.0454, test_loss: 1.2289, test_f1: 0.3970
 epoch: 23, train_loss: 1.0215, test_loss: 1.1215, test_f1: 0.4492
 epoch: 24, train_loss: 1.0235, test_loss: 1.1510, test_f1: 0.3290
 epoch: 25, train_loss: 1.0221, test_loss: 1.1446, test_f1: 0.4429
 epoch: 26, train_loss: 1.0216, test_loss: 1.1485, test_f1: 0.3317
 epoch: 27, train_loss: 1.0152, test_loss: 1.3156, test_f1: 0.4052
 epoch: 28, train_loss: 1.0044, test_loss: 1.1842, test_f1: 0.4472
 epoch: 29, train_loss: 1.0013, test_loss: 1.1459, test_f1: 0.3788
 epoch: 30, train_loss: 1.0216, test_loss: 1.1318, test_f1: 0.4275
 epoch: 31, train_loss: 1.0188, test_loss: 1.1232, test_f1: 0.4314
 epoch: 32, train_loss: 1.0135, test_loss: 1.1214, test_f1: 0.4247
 epoch: 33, train_loss: 1.0333, test_loss: 1.2872, test_f1: 0.2675
 epoch: 34, train_loss: 1.0128, test_loss: 1.1766, test_f1: 0.3969
 epoch: 35, train_loss: 1.0135, test_loss: 1.1227, test_f1: 0.3344
 epoch: 36, train_loss: 1.0122, test_loss: 1.1061, test_f1: 0.4296
 epoch: 37, train_loss: 1.0138, test_loss: 1.1144, test_f1: 0.3857
 epoch: 38, train_loss: 1.0021, test_loss: 1.1969, test_f1: 0.3176
 epoch: 39, train_loss: 1.0065, test_loss: 1.1164, test_f1: 0.4451
 epoch: 40, train_loss: 0.9897, test_loss: 1.1655, test_f1: 0.3205
 epoch: 41, train_loss: 0.9961, test_loss: 1.1190, test_f1: 0.4374
 epoch: 42, train_loss: 0.9886, test_loss: 1.1777, test_f1: 0.3290
 epoch: 43, train_loss: 1.0020, test_loss: 1.0894, test_f1: 0.4294
 epoch: 44, train_loss: 0.9947, test_loss: 1.0940, test_f1: 0.3438
 epoch: 45, train_loss: 1.0123, test_loss: 1.1938, test_f1: 0.4040
 epoch: 46, train_loss: 1.0187, test_loss: 1.1151, test_f1: 0.3344
 epoch: 47, train_loss: 1.0029, test_loss: 1.1424, test_f1: 0.4436
 epoch: 48, train_loss: 0.9937, test_loss: 1.1148, test_f1: 0.4344
 epoch: 49, train_loss: 0.9860, test_loss: 1.1258, test_f1: 0.3461
 epoch: 50, train_loss: 0.9827, test_loss: 1.1120, test_f1: 0.4512
 epoch: 51, train_loss: 0.9862, test_loss: 1.0657, test_f1: 0.3934
 epoch: 52, train_loss: 0.9824, test_loss: 1.1089, test_f1: 0.3370
 epoch: 53, train_loss: 0.9810, test_loss: 1.0807, test_f1: 0.4454
 epoch: 54, train_loss: 0.9768, test_loss: 1.0908, test_f1: 0.3468
 epoch: 55, train_loss: 0.9693, test_loss: 1.0713, test_f1: 0.4479
 epoch: 56, train_loss: 0.9687, test_loss: 1.0622, test_f1: 0.4489
 epoch: 57, train_loss: 0.9715, test_loss: 1.1226, test_f1: 0.3317
 epoch: 58, train_loss: 0.9722, test_loss: 1.1200, test_f1: 0.3616
 epoch: 59, train_loss: 0.9675, test_loss: 1.0771, test_f1: 0.4381
 epoch: 60, train_loss: 0.9693, test_loss: 1.0538, test_f1: 0.4446
 epoch: 61, train_loss: 0.9693, test_loss: 1.0752, test_f1: 0.3468
 epoch: 62, train_loss: 0.9743, test_loss: 1.0559, test_f1: 0.4023
 epoch: 63, train_loss: 0.9653, test_loss: 1.0493, test_f1: 0.3491
 epoch: 64, train_loss: 0.9645, test_loss: 1.0459, test_f1: 0.3491
 epoch: 65, train_loss: 0.9779, test_loss: 1.1057, test_f1: 0.3395
 epoch: 66, train_loss: 1.0110, test_loss: 1.0649, test_f1: 0.3476
 epoch: 67, train_loss: 0.9918, test_loss: 1.0565, test_f1: 0.4394
 epoch: 68, train_loss: 0.9908, test_loss: 1.1547, test_f1: 0.4465
 epoch: 69, train_loss: 0.9793, test_loss: 1.0989, test_f1: 0.3378
 epoch: 70, train_loss: 0.9764, test_loss: 1.1555, test_f1: 0.4239
 epoch: 71, train_loss: 0.9821, test_loss: 1.0956, test_f1: 0.3486
 epoch: 72, train_loss: 0.9618, test_loss: 1.0586, test_f1: 0.4481
 epoch: 73, train_loss: 0.9642, test_loss: 1.0623, test_f1: 0.3468
 epoch: 74, train_loss: 0.9482, test_loss: 1.0535, test_f1: 0.4229
 epoch: 75, train_loss: 0.9835, test_loss: 1.1221, test_f1: 0.3317
 epoch: 76, train_loss: 0.9787, test_loss: 1.0516, test_f1: 0.3468
 epoch: 77, train_loss: 0.9898, test_loss: 1.0631, test_f1: 0.4375
 epoch: 78, train_loss: 0.9776, test_loss: 1.1067, test_f1: 0.4327
 epoch: 79, train_loss: 0.9805, test_loss: 1.1128, test_f1: 0.4363
 epoch: 80, train_loss: 0.9845, test_loss: 1.1261, test_f1: 0.3921
 epoch: 81, train_loss: 1.0798, test_loss: 1.1188, test_f1: 0.3344
 epoch: 82, train_loss: 1.0918, test_loss: 1.1596, test_f1: 0.3115
 epoch: 83, train_loss: 1.0458, test_loss: 1.1531, test_f1: 0.4426
 epoch: 84, train_loss: 1.0236, test_loss: 1.0973, test_f1: 0.3395
 epoch: 85, train_loss: 1.0326, test_loss: 1.1080, test_f1: 0.3370
 epoch: 86, train_loss: 1.0234, test_loss: 1.0971, test_f1: 0.4428
 epoch: 87, train_loss: 1.0265, test_loss: 1.1453, test_f1: 0.4387
 epoch: 88, train_loss: 1.0390, test_loss: 1.1165, test_f1: 0.4313
 epoch: 89, train_loss: 1.0331, test_loss: 1.0956, test_f1: 0.4619
 epoch: 90, train_loss: 1.0130, test_loss: 1.1700, test_f1: 0.4363
 epoch: 91, train_loss: 1.0357, test_loss: 1.1033, test_f1: 0.3648
 epoch: 92, train_loss: 1.0188, test_loss: 1.1144, test_f1: 0.4329
 epoch: 93, train_loss: 1.0115, test_loss: 1.1357, test_f1: 0.3622
 epoch: 94, train_loss: 1.0241, test_loss: 1.1310, test_f1: 0.4453
 epoch: 95, train_loss: 1.0432, test_loss: 1.1161, test_f1: 0.4502
 epoch: 96, train_loss: 1.0416, test_loss: 1.1457, test_f1: 0.3594
 epoch: 97, train_loss: 1.0322, test_loss: 1.1617, test_f1: 0.4261
 epoch: 98, train_loss: 1.0208, test_loss: 1.1391, test_f1: 0.4143
 epoch: 99, train_loss: 1.0251, test_loss: 1.1269, test_f1: 0.3290
##################ITERATION #8 ****************************************
 epoch: 0, train_loss: 2.6903, test_loss: 2.0601, test_f1: 0.2491
 epoch: 1, train_loss: 1.2133, test_loss: 1.9015, test_f1: 0.1441
 epoch: 2, train_loss: 1.0859, test_loss: 1.3974, test_f1: 0.2866
 epoch: 3, train_loss: 1.0702, test_loss: 1.3828, test_f1: 0.3234
 epoch: 4, train_loss: 1.0557, test_loss: 1.2971, test_f1: 0.3621
 epoch: 5, train_loss: 1.0376, test_loss: 1.2193, test_f1: 0.3978
 epoch: 6, train_loss: 1.0723, test_loss: 1.1444, test_f1: 0.3698
 epoch: 7, train_loss: 1.0487, test_loss: 1.1201, test_f1: 0.3444
 epoch: 8, train_loss: 1.0600, test_loss: 1.1912, test_f1: 0.4367
 epoch: 9, train_loss: 1.0512, test_loss: 1.1162, test_f1: 0.3710
 epoch: 10, train_loss: 1.0415, test_loss: 1.2175, test_f1: 0.3997
 epoch: 11, train_loss: 1.0540, test_loss: 1.1256, test_f1: 0.3836
 epoch: 12, train_loss: 1.0325, test_loss: 1.1603, test_f1: 0.4287
 epoch: 13, train_loss: 1.0255, test_loss: 1.1373, test_f1: 0.4031
 epoch: 14, train_loss: 1.0313, test_loss: 1.1557, test_f1: 0.4286
 epoch: 15, train_loss: 1.0259, test_loss: 1.1159, test_f1: 0.3887
 epoch: 16, train_loss: 1.0176, test_loss: 1.2768, test_f1: 0.3833
 epoch: 17, train_loss: 1.0299, test_loss: 1.1184, test_f1: 0.3330
 epoch: 18, train_loss: 1.0242, test_loss: 1.1567, test_f1: 0.4173
 epoch: 19, train_loss: 1.0139, test_loss: 1.4339, test_f1: 0.3319
 epoch: 20, train_loss: 1.0034, test_loss: 1.2556, test_f1: 0.3443
 epoch: 21, train_loss: 1.0243, test_loss: 1.1287, test_f1: 0.3344
 epoch: 22, train_loss: 1.0220, test_loss: 1.1299, test_f1: 0.3344
 epoch: 23, train_loss: 0.9928, test_loss: 1.1068, test_f1: 0.3854
 epoch: 24, train_loss: 0.9958, test_loss: 1.1469, test_f1: 0.3344
 epoch: 25, train_loss: 1.0031, test_loss: 1.1159, test_f1: 0.4267
 epoch: 26, train_loss: 1.0258, test_loss: 1.2019, test_f1: 0.4001
 epoch: 27, train_loss: 1.0513, test_loss: 1.1781, test_f1: 0.3749
 epoch: 28, train_loss: 1.0097, test_loss: 1.3188, test_f1: 0.3943
 epoch: 29, train_loss: 1.0233, test_loss: 1.2797, test_f1: 0.4179
 epoch: 30, train_loss: 1.0228, test_loss: 1.1210, test_f1: 0.3344
 epoch: 31, train_loss: 1.0140, test_loss: 1.2201, test_f1: 0.3284
 epoch: 32, train_loss: 0.9930, test_loss: 1.0771, test_f1: 0.3420
 epoch: 33, train_loss: 1.0093, test_loss: 1.0928, test_f1: 0.4564
 epoch: 34, train_loss: 0.9960, test_loss: 1.1492, test_f1: 0.3271
 epoch: 35, train_loss: 0.9918, test_loss: 1.1354, test_f1: 0.4404
 epoch: 36, train_loss: 0.9841, test_loss: 1.1825, test_f1: 0.4292
 epoch: 37, train_loss: 0.9972, test_loss: 1.1256, test_f1: 0.3349
 epoch: 38, train_loss: 0.9912, test_loss: 1.1139, test_f1: 0.3342
 epoch: 39, train_loss: 0.9829, test_loss: 1.1398, test_f1: 0.4104
 epoch: 40, train_loss: 0.9741, test_loss: 1.1017, test_f1: 0.4633
 epoch: 41, train_loss: 0.9678, test_loss: 1.1080, test_f1: 0.3344
 epoch: 42, train_loss: 1.0326, test_loss: 1.3134, test_f1: 0.3118
 epoch: 43, train_loss: 1.0455, test_loss: 1.3317, test_f1: 0.2539
 epoch: 44, train_loss: 1.0084, test_loss: 1.3030, test_f1: 0.3083
 epoch: 45, train_loss: 1.0049, test_loss: 1.1427, test_f1: 0.4406
 epoch: 46, train_loss: 1.0429, test_loss: 1.2207, test_f1: 0.3118
 epoch: 47, train_loss: 1.0163, test_loss: 1.1990, test_f1: 0.3330
 epoch: 48, train_loss: 0.9994, test_loss: 1.1106, test_f1: 0.3344
 epoch: 49, train_loss: 0.9844, test_loss: 1.0726, test_f1: 0.4650
 epoch: 50, train_loss: 0.9889, test_loss: 1.1771, test_f1: 0.4613
 epoch: 51, train_loss: 0.9764, test_loss: 1.0878, test_f1: 0.4743
 epoch: 52, train_loss: 0.9677, test_loss: 1.1459, test_f1: 0.4609
 epoch: 53, train_loss: 0.9649, test_loss: 1.1240, test_f1: 0.4564
 epoch: 54, train_loss: 0.9708, test_loss: 1.0772, test_f1: 0.3952
 epoch: 55, train_loss: 0.9736, test_loss: 1.0609, test_f1: 0.4617
 epoch: 56, train_loss: 0.9654, test_loss: 1.0573, test_f1: 0.4759
 epoch: 57, train_loss: 0.9672, test_loss: 1.0910, test_f1: 0.4752
 epoch: 58, train_loss: 0.9568, test_loss: 1.0908, test_f1: 0.4835
 epoch: 59, train_loss: 0.9647, test_loss: 1.0580, test_f1: 0.4168
 epoch: 60, train_loss: 0.9794, test_loss: 1.0816, test_f1: 0.4189
 epoch: 61, train_loss: 0.9758, test_loss: 1.0479, test_f1: 0.4570
 epoch: 62, train_loss: 0.9799, test_loss: 1.0777, test_f1: 0.3901
 epoch: 63, train_loss: 0.9658, test_loss: 1.0775, test_f1: 0.4529
 epoch: 64, train_loss: 0.9528, test_loss: 1.0519, test_f1: 0.3403
 epoch: 65, train_loss: 0.9560, test_loss: 1.0430, test_f1: 0.4098
 epoch: 66, train_loss: 0.9502, test_loss: 1.0343, test_f1: 0.4067
 epoch: 67, train_loss: 0.9538, test_loss: 1.1298, test_f1: 0.4579
 epoch: 68, train_loss: 0.9507, test_loss: 1.0952, test_f1: 0.4512
 epoch: 69, train_loss: 0.9360, test_loss: 1.0592, test_f1: 0.3421
 epoch: 70, train_loss: 1.0493, test_loss: 1.2344, test_f1: 0.2838
 epoch: 71, train_loss: 1.0603, test_loss: 1.2732, test_f1: 0.2675
 epoch: 72, train_loss: 1.0089, test_loss: 1.1691, test_f1: 0.3592
 epoch: 73, train_loss: 0.9881, test_loss: 1.1849, test_f1: 0.3322
 epoch: 74, train_loss: 0.9832, test_loss: 1.1541, test_f1: 0.4242
 epoch: 75, train_loss: 0.9804, test_loss: 1.0847, test_f1: 0.4589
 epoch: 76, train_loss: 0.9660, test_loss: 1.1044, test_f1: 0.4715
 epoch: 77, train_loss: 0.9667, test_loss: 1.0340, test_f1: 0.4544
 epoch: 78, train_loss: 0.9674, test_loss: 1.0707, test_f1: 0.4852
 epoch: 79, train_loss: 0.9537, test_loss: 1.0579, test_f1: 0.3444
 epoch: 80, train_loss: 0.9443, test_loss: 1.0479, test_f1: 0.4845
 epoch: 81, train_loss: 0.9593, test_loss: 1.0336, test_f1: 0.3906
 epoch: 82, train_loss: 0.9501, test_loss: 1.0500, test_f1: 0.3907
 epoch: 83, train_loss: 0.9282, test_loss: 1.0549, test_f1: 0.4918
 epoch: 84, train_loss: 0.9390, test_loss: 1.1484, test_f1: 0.4371
 epoch: 85, train_loss: 0.9412, test_loss: 1.0692, test_f1: 0.4011
 epoch: 86, train_loss: 0.9288, test_loss: 1.0434, test_f1: 0.4856
 epoch: 87, train_loss: 0.9316, test_loss: 1.0734, test_f1: 0.4673
 epoch: 88, train_loss: 0.9358, test_loss: 1.0902, test_f1: 0.4737
 epoch: 89, train_loss: 0.9481, test_loss: 1.0647, test_f1: 0.4849
 epoch: 90, train_loss: 0.9296, test_loss: 1.0695, test_f1: 0.4486
 epoch: 91, train_loss: 0.9319, test_loss: 1.1282, test_f1: 0.4768
 epoch: 92, train_loss: 0.9868, test_loss: 1.0542, test_f1: 0.3431
 epoch: 93, train_loss: 0.9738, test_loss: 1.0599, test_f1: 0.4629
 epoch: 94, train_loss: 0.9654, test_loss: 1.0397, test_f1: 0.3883
 epoch: 95, train_loss: 0.9338, test_loss: 1.0734, test_f1: 0.4912
 epoch: 96, train_loss: 0.9443, test_loss: 1.0702, test_f1: 0.5035
 epoch: 97, train_loss: 0.9265, test_loss: 1.0601, test_f1: 0.3845
 epoch: 98, train_loss: 0.9304, test_loss: 1.0840, test_f1: 0.4764
 epoch: 99, train_loss: 0.9164, test_loss: 1.0859, test_f1: 0.5042
##################ITERATION #9 ****************************************
 epoch: 0, train_loss: 1.3480, test_loss: 2.2687, test_f1: 0.2226
 epoch: 1, train_loss: 1.1077, test_loss: 1.9841, test_f1: 0.2360
 epoch: 2, train_loss: 1.0628, test_loss: 1.2160, test_f1: 0.2581
 epoch: 3, train_loss: 1.0571, test_loss: 1.2981, test_f1: 0.3290
 epoch: 4, train_loss: 1.0519, test_loss: 1.5935, test_f1: 0.2037
 epoch: 5, train_loss: 1.0461, test_loss: 1.3231, test_f1: 0.3146
 epoch: 6, train_loss: 1.0295, test_loss: 1.3003, test_f1: 0.3018
 epoch: 7, train_loss: 1.0199, test_loss: 1.3823, test_f1: 0.2951
 epoch: 8, train_loss: 1.0089, test_loss: 1.1990, test_f1: 0.3336
 epoch: 9, train_loss: 1.0276, test_loss: 1.1484, test_f1: 0.4057
 epoch: 10, train_loss: 1.0132, test_loss: 1.2445, test_f1: 0.3510
 epoch: 11, train_loss: 1.0237, test_loss: 1.1124, test_f1: 0.3704
 epoch: 12, train_loss: 1.0134, test_loss: 1.1053, test_f1: 0.3733
 epoch: 13, train_loss: 1.0150, test_loss: 1.1680, test_f1: 0.3510
 epoch: 14, train_loss: 1.0327, test_loss: 1.8091, test_f1: 0.2490
 epoch: 15, train_loss: 1.0475, test_loss: 1.1012, test_f1: 0.3263
 epoch: 16, train_loss: 1.0239, test_loss: 1.1017, test_f1: 0.3536
 epoch: 17, train_loss: 1.0159, test_loss: 1.0914, test_f1: 0.4558
 epoch: 18, train_loss: 1.0821, test_loss: 1.0691, test_f1: 0.3513
 epoch: 19, train_loss: 1.0281, test_loss: 1.1038, test_f1: 0.3560
 epoch: 20, train_loss: 1.0208, test_loss: 1.2128, test_f1: 0.3205
 epoch: 21, train_loss: 1.0828, test_loss: 1.9406, test_f1: 0.2261
 epoch: 22, train_loss: 1.0413, test_loss: 2.4596, test_f1: 0.2108
 epoch: 23, train_loss: 1.0330, test_loss: 1.0988, test_f1: 0.3396
 epoch: 24, train_loss: 1.0324, test_loss: 1.1701, test_f1: 0.4262
 epoch: 25, train_loss: 1.0178, test_loss: 1.2536, test_f1: 0.3418
 epoch: 26, train_loss: 1.0132, test_loss: 1.1538, test_f1: 0.4377
 epoch: 27, train_loss: 1.0064, test_loss: 1.1647, test_f1: 0.4241
 epoch: 28, train_loss: 0.9941, test_loss: 1.0847, test_f1: 0.3316
 epoch: 29, train_loss: 0.9987, test_loss: 1.0813, test_f1: 0.4336
 epoch: 30, train_loss: 0.9900, test_loss: 1.1470, test_f1: 0.4118
 epoch: 31, train_loss: 1.0016, test_loss: 1.1167, test_f1: 0.3317
 epoch: 32, train_loss: 0.9810, test_loss: 1.1278, test_f1: 0.3346
 epoch: 33, train_loss: 0.9911, test_loss: 1.1790, test_f1: 0.3031
 epoch: 34, train_loss: 0.9827, test_loss: 2.3983, test_f1: 0.1983
 epoch: 35, train_loss: 1.0212, test_loss: 1.6748, test_f1: 0.2442
 epoch: 36, train_loss: 1.0125, test_loss: 1.1226, test_f1: 0.3171
 epoch: 37, train_loss: 0.9982, test_loss: 1.1502, test_f1: 0.3344
 epoch: 38, train_loss: 1.0049, test_loss: 1.1639, test_f1: 0.4151
 epoch: 39, train_loss: 0.9951, test_loss: 1.1611, test_f1: 0.3746
 epoch: 40, train_loss: 1.0025, test_loss: 1.1409, test_f1: 0.3226
 epoch: 41, train_loss: 0.9928, test_loss: 1.1338, test_f1: 0.4392
 epoch: 42, train_loss: 0.9887, test_loss: 1.2060, test_f1: 0.4286
 epoch: 43, train_loss: 1.0002, test_loss: 1.5172, test_f1: 0.2906
 epoch: 44, train_loss: 0.9778, test_loss: 1.6269, test_f1: 0.3420
 epoch: 45, train_loss: 0.9809, test_loss: 1.1731, test_f1: 0.3101
 epoch: 46, train_loss: 0.9734, test_loss: 1.0601, test_f1: 0.4575
 epoch: 47, train_loss: 0.9834, test_loss: 1.0603, test_f1: 0.3421
 epoch: 48, train_loss: 0.9847, test_loss: 2.9921, test_f1: 0.1933
 epoch: 49, train_loss: 1.2848, test_loss: 4.0641, test_f1: 0.0349
 epoch: 50, train_loss: 1.1785, test_loss: 1.1078, test_f1: 0.3468
 epoch: 51, train_loss: 1.0849, test_loss: 1.1674, test_f1: 0.2334
 epoch: 52, train_loss: 1.0739, test_loss: 1.1529, test_f1: 0.3290
 epoch: 53, train_loss: 1.0609, test_loss: 1.1231, test_f1: 0.3395
 epoch: 54, train_loss: 1.0608, test_loss: 1.1351, test_f1: 0.3395
 epoch: 55, train_loss: 1.0472, test_loss: 1.1625, test_f1: 0.3290
 epoch: 56, train_loss: 1.0560, test_loss: 1.1721, test_f1: 0.3290
 epoch: 57, train_loss: 1.0515, test_loss: 1.1573, test_f1: 0.3290
 epoch: 58, train_loss: 1.0535, test_loss: 1.1587, test_f1: 0.3290
 epoch: 59, train_loss: 1.0586, test_loss: 1.1607, test_f1: 0.3290
 epoch: 60, train_loss: 1.0624, test_loss: 1.1647, test_f1: 0.3290
 epoch: 61, train_loss: 1.0445, test_loss: 1.1467, test_f1: 0.3317
 epoch: 62, train_loss: 1.0768, test_loss: 1.1421, test_f1: 0.3317
 epoch: 63, train_loss: 1.0561, test_loss: 1.1581, test_f1: 0.3290
 epoch: 64, train_loss: 1.0485, test_loss: 1.1508, test_f1: 0.3317
 epoch: 65, train_loss: 1.0412, test_loss: 1.1354, test_f1: 0.3395
 epoch: 66, train_loss: 1.0377, test_loss: 1.1429, test_f1: 0.3395
 epoch: 67, train_loss: 1.0368, test_loss: 1.1364, test_f1: 0.3395
 epoch: 68, train_loss: 1.0320, test_loss: 1.1326, test_f1: 0.3395
 epoch: 69, train_loss: 1.0312, test_loss: 1.1427, test_f1: 0.3395
 epoch: 70, train_loss: 1.0273, test_loss: 1.1419, test_f1: 0.3395
 epoch: 71, train_loss: 1.0307, test_loss: 1.1348, test_f1: 0.3395
 epoch: 72, train_loss: 1.0315, test_loss: 1.1565, test_f1: 0.3317
 epoch: 73, train_loss: 1.0299, test_loss: 1.1401, test_f1: 0.3362
 epoch: 74, train_loss: 1.0351, test_loss: 1.2055, test_f1: 0.3146
 epoch: 75, train_loss: 1.0342, test_loss: 1.2322, test_f1: 0.3176
 epoch: 76, train_loss: 1.0337, test_loss: 1.1829, test_f1: 0.3262
 epoch: 77, train_loss: 1.0327, test_loss: 1.1446, test_f1: 0.3317
 epoch: 78, train_loss: 1.0368, test_loss: 1.1504, test_f1: 0.3317
 epoch: 79, train_loss: 1.0212, test_loss: 1.1685, test_f1: 0.3317
 epoch: 80, train_loss: 1.0243, test_loss: 1.1543, test_f1: 0.3344
 epoch: 81, train_loss: 1.0240, test_loss: 1.1571, test_f1: 0.3317
 epoch: 82, train_loss: 1.0216, test_loss: 1.1448, test_f1: 0.3344
 epoch: 83, train_loss: 1.0160, test_loss: 1.1611, test_f1: 0.2659
 epoch: 84, train_loss: 1.0194, test_loss: 1.1604, test_f1: 0.3395
 epoch: 85, train_loss: 1.0122, test_loss: 1.1288, test_f1: 0.3395
 epoch: 86, train_loss: 1.0363, test_loss: 1.1463, test_f1: 0.3395
 epoch: 87, train_loss: 1.0187, test_loss: 1.1742, test_f1: 0.2372
 epoch: 88, train_loss: 1.0213, test_loss: 1.1317, test_f1: 0.3388
 epoch: 89, train_loss: 1.0275, test_loss: 1.1362, test_f1: 0.3395
 epoch: 90, train_loss: 1.0220, test_loss: 1.1571, test_f1: 0.3317
 epoch: 91, train_loss: 1.0215, test_loss: 1.1606, test_f1: 0.3290
 epoch: 92, train_loss: 1.0239, test_loss: 1.2266, test_f1: 0.3083
 epoch: 93, train_loss: 1.0211, test_loss: 1.1732, test_f1: 0.3262
 epoch: 94, train_loss: 1.0280, test_loss: 1.1404, test_f1: 0.3317
 epoch: 95, train_loss: 1.0218, test_loss: 1.1173, test_f1: 0.3658
 epoch: 96, train_loss: 1.0202, test_loss: 1.1241, test_f1: 0.3395
 epoch: 97, train_loss: 1.0138, test_loss: 1.1401, test_f1: 0.3395
 epoch: 98, train_loss: 1.0163, test_loss: 1.1291, test_f1: 0.3395
 epoch: 99, train_loss: 1.0118, test_loss: 1.1311, test_f1: 0.3395

Training completed in 291.99 seconds
Best F1: 0.5042 at epoch 99
Mean F1 across iterations: 0.3449  0.1179
========================FINAL RESULTS================================
FEGIN weighted F1: 0.5042  0.1179
python main.py --data ltspice_demos --representation component_pin_net --model FEGIN --layers 2 --hiddens 32 --batch_size 256 --lr 0.1 --emb_size 512 --epochs 100 --save_appendix component_pin_net_L2_H32_BS256_LR0.1_E512 --no_val
-----



STDERR:
  File "main.py", line 370, in <module>
    main()
  File "main.py", line 254, in main
    dataset = dataset_class(
  File "/home/philip/projects/ltspice_examples_code_repo/Circuit-Completion-Using-GNNs/component_classification_with_link_prediction_head/evaluation/FEGIN/kernel/circuit_datasets.py", line 15, in __init__
    self.data, self.slices = torch.load(self.processed_paths[0])
  File "/home/philip/.local/lib/python3.8/site-packages/torch/serialization.py", line 1040, in load
    warnings.warn(
  File "/usr/lib/python3.8/warnings.py", line 109, in _showwarnmsg
    sw(msg.message, msg.category, msg.filename, msg.lineno,
  File "main.py", line 47, in warn_with_traceback
    traceback.print_stack(file=log)
/home/philip/projects/ltspice_examples_code_repo/Circuit-Completion-Using-GNNs/component_classification_with_link_prediction_head/evaluation/FEGIN/kernel/circuit_datasets.py:15: FutureWarning: You are using `torch.load` with `weights_only=False` (the current default value), which uses the default pickle module implicitly. It is possible to construct malicious pickle data which will execute arbitrary code during unpickling (See https://github.com/pytorch/pytorch/blob/main/SECURITY.md#untrusted-models for more details). In a future release, the default value for `weights_only` will be flipped to `True`. This limits the functions that could be executed during unpickling. Arbitrary objects will no longer be allowed to be loaded via this mode unless they are explicitly allowlisted by the user via `torch.serialization.add_safe_globals`. We recommend you start setting `weights_only=True` for any use case where you don't have full control of the loaded file. Please open an issue on GitHub for any issues related to this experimental feature.
  self.data, self.slices = torch.load(self.processed_paths[0])
