STDOUT:
Results will be saved in /home/philip/projects/ltspice_examples_code_repo/Circuit-Completion-Using-GNNs/component_classification_with_link_prediction_head/evaluation/FEGIN/results/model_FEGIN_dataset_ltspice_examples
Command line input: python main.py --data ltspice_examples --representation component_net --model FEGIN --layers 6 --hiddens 64 --batch_size 64 --lr 0.0001 --emb_size 512 --epochs 100 --save_appendix component_net_L6_H64_BS64_LR0.0001_E512 --no_val
 is saved.
-----
ltspice_examples - FEGIN
Using 6 layers, 64 hidden units, h = 2
Loading component_net representation dataset
ENTERED
Training FEGIN on component_net representation
Train: 3558, Test: 846
##################ITERATION #0 ****************************************
 epoch: 0, train_loss: 1.3850, test_loss: 1.3689, test_f1: 0.1183
 epoch: 1, train_loss: 1.3422, test_loss: 1.3145, test_f1: 0.2666
 epoch: 2, train_loss: 1.3070, test_loss: 1.2775, test_f1: 0.2775
 epoch: 3, train_loss: 1.2727, test_loss: 1.2434, test_f1: 0.2479
 epoch: 4, train_loss: 1.2458, test_loss: 1.2188, test_f1: 0.2540
 epoch: 5, train_loss: 1.2252, test_loss: 1.2019, test_f1: 0.2649
 epoch: 6, train_loss: 1.2049, test_loss: 1.1748, test_f1: 0.2817
 epoch: 7, train_loss: 1.1930, test_loss: 1.1552, test_f1: 0.3169
 epoch: 8, train_loss: 1.1750, test_loss: 1.1363, test_f1: 0.3668
 epoch: 9, train_loss: 1.1536, test_loss: 1.1198, test_f1: 0.4395
 epoch: 10, train_loss: 1.1359, test_loss: 1.1005, test_f1: 0.4910
 epoch: 11, train_loss: 1.1105, test_loss: 1.0694, test_f1: 0.5084
 epoch: 12, train_loss: 1.0943, test_loss: 1.0503, test_f1: 0.4671
 epoch: 13, train_loss: 1.0726, test_loss: 1.0252, test_f1: 0.5005
 epoch: 14, train_loss: 1.0485, test_loss: 1.0112, test_f1: 0.4926
 epoch: 15, train_loss: 1.0241, test_loss: 0.9878, test_f1: 0.5187
 epoch: 16, train_loss: 1.0042, test_loss: 0.9859, test_f1: 0.4856
 epoch: 17, train_loss: 0.9833, test_loss: 0.9731, test_f1: 0.4971
 epoch: 18, train_loss: 0.9785, test_loss: 0.9483, test_f1: 0.5221
 epoch: 19, train_loss: 0.9616, test_loss: 0.9426, test_f1: 0.5029
 epoch: 20, train_loss: 0.9438, test_loss: 0.9479, test_f1: 0.4965
 epoch: 21, train_loss: 0.9333, test_loss: 0.9433, test_f1: 0.5254
 epoch: 22, train_loss: 0.9257, test_loss: 0.9433, test_f1: 0.4836
 epoch: 23, train_loss: 0.9148, test_loss: 0.9376, test_f1: 0.5117
 epoch: 24, train_loss: 0.9077, test_loss: 0.9480, test_f1: 0.5120
 epoch: 25, train_loss: 0.8933, test_loss: 0.9439, test_f1: 0.5233
 epoch: 26, train_loss: 0.8978, test_loss: 0.9336, test_f1: 0.5345
 epoch: 27, train_loss: 0.8926, test_loss: 0.9388, test_f1: 0.5414
 epoch: 28, train_loss: 0.8739, test_loss: 0.9507, test_f1: 0.5048
 epoch: 29, train_loss: 0.8754, test_loss: 0.9425, test_f1: 0.5211
 epoch: 30, train_loss: 0.8672, test_loss: 0.9331, test_f1: 0.5236
 epoch: 31, train_loss: 0.8593, test_loss: 0.9365, test_f1: 0.5262
 epoch: 32, train_loss: 0.8576, test_loss: 0.9529, test_f1: 0.5213
 epoch: 33, train_loss: 0.8514, test_loss: 0.9569, test_f1: 0.5353
 epoch: 34, train_loss: 0.8326, test_loss: 0.9576, test_f1: 0.5290
 epoch: 35, train_loss: 0.8470, test_loss: 0.9550, test_f1: 0.5327
 epoch: 36, train_loss: 0.8380, test_loss: 0.9531, test_f1: 0.5396
 epoch: 37, train_loss: 0.8335, test_loss: 0.9357, test_f1: 0.5442
 epoch: 38, train_loss: 0.8308, test_loss: 0.9604, test_f1: 0.5306
 epoch: 39, train_loss: 0.8250, test_loss: 0.9414, test_f1: 0.5342
 epoch: 40, train_loss: 0.8252, test_loss: 0.9664, test_f1: 0.5412
 epoch: 41, train_loss: 0.8171, test_loss: 0.9686, test_f1: 0.5638
 epoch: 42, train_loss: 0.8139, test_loss: 0.9562, test_f1: 0.5646
 epoch: 43, train_loss: 0.8086, test_loss: 0.9645, test_f1: 0.5657
 epoch: 44, train_loss: 0.8083, test_loss: 0.9872, test_f1: 0.5108
 epoch: 45, train_loss: 0.8082, test_loss: 0.9608, test_f1: 0.5459
 epoch: 46, train_loss: 0.8086, test_loss: 0.9513, test_f1: 0.5699
 epoch: 47, train_loss: 0.8063, test_loss: 0.9471, test_f1: 0.5561
 epoch: 48, train_loss: 0.7966, test_loss: 0.9699, test_f1: 0.5540
 epoch: 49, train_loss: 0.8023, test_loss: 0.9751, test_f1: 0.5587
 epoch: 50, train_loss: 0.7957, test_loss: 0.9534, test_f1: 0.5723
 epoch: 51, train_loss: 0.7908, test_loss: 0.9554, test_f1: 0.5501
 epoch: 52, train_loss: 0.7817, test_loss: 0.9547, test_f1: 0.5527
 epoch: 53, train_loss: 0.7765, test_loss: 0.9410, test_f1: 0.5769
 epoch: 54, train_loss: 0.7613, test_loss: 0.9620, test_f1: 0.5546
 epoch: 55, train_loss: 0.7735, test_loss: 0.9493, test_f1: 0.5848
 epoch: 56, train_loss: 0.7675, test_loss: 0.9629, test_f1: 0.5656
 epoch: 57, train_loss: 0.7621, test_loss: 0.9643, test_f1: 0.5808
 epoch: 58, train_loss: 0.7757, test_loss: 0.9574, test_f1: 0.5921
 epoch: 59, train_loss: 0.7719, test_loss: 0.9557, test_f1: 0.5872
 epoch: 60, train_loss: 0.7694, test_loss: 0.9843, test_f1: 0.5717
 epoch: 61, train_loss: 0.7639, test_loss: 0.9637, test_f1: 0.5732
 epoch: 62, train_loss: 0.7692, test_loss: 0.9532, test_f1: 0.5688
 epoch: 63, train_loss: 0.7668, test_loss: 0.9577, test_f1: 0.5852
 epoch: 64, train_loss: 0.7529, test_loss: 0.9802, test_f1: 0.5930
 epoch: 65, train_loss: 0.7700, test_loss: 0.9818, test_f1: 0.5658
 epoch: 66, train_loss: 0.7695, test_loss: 0.9723, test_f1: 0.5828
 epoch: 67, train_loss: 0.7588, test_loss: 0.9731, test_f1: 0.5571
 epoch: 68, train_loss: 0.7569, test_loss: 0.9565, test_f1: 0.5932
 epoch: 69, train_loss: 0.7564, test_loss: 0.9805, test_f1: 0.5725
 epoch: 70, train_loss: 0.7465, test_loss: 0.9670, test_f1: 0.5924
 epoch: 71, train_loss: 0.7471, test_loss: 0.9738, test_f1: 0.6049
 epoch: 72, train_loss: 0.7595, test_loss: 0.9646, test_f1: 0.5996
 epoch: 73, train_loss: 0.7507, test_loss: 0.9647, test_f1: 0.5922
 epoch: 74, train_loss: 0.7461, test_loss: 0.9559, test_f1: 0.6063
 epoch: 75, train_loss: 0.7509, test_loss: 0.9644, test_f1: 0.5845
 epoch: 76, train_loss: 0.7495, test_loss: 0.9492, test_f1: 0.5904
 epoch: 77, train_loss: 0.7430, test_loss: 0.9622, test_f1: 0.5951
 epoch: 78, train_loss: 0.7397, test_loss: 0.9737, test_f1: 0.5746
 epoch: 79, train_loss: 0.7351, test_loss: 0.9614, test_f1: 0.5936
 epoch: 80, train_loss: 0.7413, test_loss: 0.9934, test_f1: 0.5817
 epoch: 81, train_loss: 0.7431, test_loss: 0.9601, test_f1: 0.5792
 epoch: 82, train_loss: 0.7538, test_loss: 0.9643, test_f1: 0.5899
 epoch: 83, train_loss: 0.7414, test_loss: 1.0005, test_f1: 0.5823
 epoch: 84, train_loss: 0.7314, test_loss: 0.9742, test_f1: 0.6017
 epoch: 85, train_loss: 0.7312, test_loss: 0.9693, test_f1: 0.6110
 epoch: 86, train_loss: 0.7423, test_loss: 0.9835, test_f1: 0.5846
 epoch: 87, train_loss: 0.7288, test_loss: 0.9984, test_f1: 0.5883
 epoch: 88, train_loss: 0.7334, test_loss: 0.9898, test_f1: 0.5699
 epoch: 89, train_loss: 0.7349, test_loss: 0.9862, test_f1: 0.5802
 epoch: 90, train_loss: 0.7420, test_loss: 0.9633, test_f1: 0.6027
 epoch: 91, train_loss: 0.7293, test_loss: 0.9959, test_f1: 0.6053
 epoch: 92, train_loss: 0.7348, test_loss: 0.9727, test_f1: 0.5862
 epoch: 93, train_loss: 0.7388, test_loss: 0.9715, test_f1: 0.5925
 epoch: 94, train_loss: 0.7353, test_loss: 0.9852, test_f1: 0.6016
 epoch: 95, train_loss: 0.7302, test_loss: 0.9756, test_f1: 0.5805
 epoch: 96, train_loss: 0.7282, test_loss: 0.9811, test_f1: 0.6021
 epoch: 97, train_loss: 0.7200, test_loss: 0.9752, test_f1: 0.6024
 epoch: 98, train_loss: 0.7168, test_loss: 0.9793, test_f1: 0.5681
 epoch: 99, train_loss: 0.7225, test_loss: 0.9810, test_f1: 0.5813
##################ITERATION #1 ****************************************
 epoch: 0, train_loss: 1.3119, test_loss: 1.2967, test_f1: 0.2549
 epoch: 1, train_loss: 1.2454, test_loss: 1.2100, test_f1: 0.3668
 epoch: 2, train_loss: 1.2100, test_loss: 1.1652, test_f1: 0.4008
 epoch: 3, train_loss: 1.1755, test_loss: 1.1139, test_f1: 0.4265
 epoch: 4, train_loss: 1.1363, test_loss: 1.0753, test_f1: 0.4538
 epoch: 5, train_loss: 1.0964, test_loss: 1.0387, test_f1: 0.4763
 epoch: 6, train_loss: 1.0660, test_loss: 1.0044, test_f1: 0.4711
 epoch: 7, train_loss: 1.0377, test_loss: 0.9738, test_f1: 0.4864
 epoch: 8, train_loss: 1.0183, test_loss: 0.9565, test_f1: 0.4908
 epoch: 9, train_loss: 1.0004, test_loss: 0.9515, test_f1: 0.4865
 epoch: 10, train_loss: 0.9801, test_loss: 0.9489, test_f1: 0.4803
 epoch: 11, train_loss: 0.9662, test_loss: 0.9451, test_f1: 0.5148
 epoch: 12, train_loss: 0.9499, test_loss: 0.9280, test_f1: 0.5024
 epoch: 13, train_loss: 0.9445, test_loss: 0.9433, test_f1: 0.4969
 epoch: 14, train_loss: 0.9363, test_loss: 0.9349, test_f1: 0.5200
 epoch: 15, train_loss: 0.9209, test_loss: 0.9288, test_f1: 0.5356
 epoch: 16, train_loss: 0.9166, test_loss: 0.9328, test_f1: 0.5299
 epoch: 17, train_loss: 0.9126, test_loss: 0.9172, test_f1: 0.5369
 epoch: 18, train_loss: 0.9014, test_loss: 0.9086, test_f1: 0.5526
 epoch: 19, train_loss: 0.8963, test_loss: 0.9216, test_f1: 0.5483
 epoch: 20, train_loss: 0.8916, test_loss: 0.9331, test_f1: 0.5244
 epoch: 21, train_loss: 0.8767, test_loss: 0.9374, test_f1: 0.5412
 epoch: 22, train_loss: 0.8735, test_loss: 0.9202, test_f1: 0.5547
 epoch: 23, train_loss: 0.8645, test_loss: 0.9151, test_f1: 0.5520
 epoch: 24, train_loss: 0.8611, test_loss: 0.9352, test_f1: 0.5496
 epoch: 25, train_loss: 0.8554, test_loss: 0.9162, test_f1: 0.5634
 epoch: 26, train_loss: 0.8651, test_loss: 0.8912, test_f1: 0.5618
 epoch: 27, train_loss: 0.8464, test_loss: 0.9182, test_f1: 0.5515
 epoch: 28, train_loss: 0.8426, test_loss: 0.9177, test_f1: 0.5579
 epoch: 29, train_loss: 0.8388, test_loss: 0.9214, test_f1: 0.5458
 epoch: 30, train_loss: 0.8330, test_loss: 0.9312, test_f1: 0.5630
 epoch: 31, train_loss: 0.8233, test_loss: 0.9145, test_f1: 0.5420
 epoch: 32, train_loss: 0.8265, test_loss: 0.8995, test_f1: 0.5680
 epoch: 33, train_loss: 0.8182, test_loss: 0.9019, test_f1: 0.5514
 epoch: 34, train_loss: 0.8207, test_loss: 0.8971, test_f1: 0.5628
 epoch: 35, train_loss: 0.8061, test_loss: 0.8866, test_f1: 0.5770
 epoch: 36, train_loss: 0.8035, test_loss: 0.9234, test_f1: 0.5713
 epoch: 37, train_loss: 0.8043, test_loss: 0.9214, test_f1: 0.5699
 epoch: 38, train_loss: 0.7964, test_loss: 0.9200, test_f1: 0.5659
 epoch: 39, train_loss: 0.8003, test_loss: 0.9256, test_f1: 0.5699
 epoch: 40, train_loss: 0.8010, test_loss: 0.9261, test_f1: 0.5735
 epoch: 41, train_loss: 0.7883, test_loss: 0.9560, test_f1: 0.5584
 epoch: 42, train_loss: 0.7850, test_loss: 0.9041, test_f1: 0.5784
 epoch: 43, train_loss: 0.7812, test_loss: 0.8917, test_f1: 0.5781
 epoch: 44, train_loss: 0.7762, test_loss: 0.9102, test_f1: 0.5806
 epoch: 45, train_loss: 0.7816, test_loss: 0.9093, test_f1: 0.5817
 epoch: 46, train_loss: 0.7847, test_loss: 0.9272, test_f1: 0.5777
 epoch: 47, train_loss: 0.7757, test_loss: 0.9094, test_f1: 0.5833
 epoch: 48, train_loss: 0.7661, test_loss: 0.9049, test_f1: 0.6048
 epoch: 49, train_loss: 0.7599, test_loss: 0.9554, test_f1: 0.5804
 epoch: 50, train_loss: 0.7676, test_loss: 0.8941, test_f1: 0.5993
 epoch: 51, train_loss: 0.7603, test_loss: 0.9074, test_f1: 0.5884
 epoch: 52, train_loss: 0.7453, test_loss: 0.9094, test_f1: 0.5887
 epoch: 53, train_loss: 0.7519, test_loss: 0.8925, test_f1: 0.5951
 epoch: 54, train_loss: 0.7318, test_loss: 0.9060, test_f1: 0.5926
 epoch: 55, train_loss: 0.7441, test_loss: 0.8893, test_f1: 0.5961
 epoch: 56, train_loss: 0.7328, test_loss: 0.9117, test_f1: 0.5915
 epoch: 57, train_loss: 0.7412, test_loss: 0.9129, test_f1: 0.5776
 epoch: 58, train_loss: 0.7491, test_loss: 0.9161, test_f1: 0.5843
 epoch: 59, train_loss: 0.7336, test_loss: 0.9031, test_f1: 0.5806
 epoch: 60, train_loss: 0.7291, test_loss: 0.9173, test_f1: 0.5747
 epoch: 61, train_loss: 0.7425, test_loss: 0.9146, test_f1: 0.5836
 epoch: 62, train_loss: 0.7357, test_loss: 0.9331, test_f1: 0.5771
 epoch: 63, train_loss: 0.7415, test_loss: 0.9236, test_f1: 0.5716
 epoch: 64, train_loss: 0.7258, test_loss: 0.9218, test_f1: 0.5790
 epoch: 65, train_loss: 0.7228, test_loss: 0.9302, test_f1: 0.5825
 epoch: 66, train_loss: 0.7224, test_loss: 0.9186, test_f1: 0.5873
 epoch: 67, train_loss: 0.7195, test_loss: 0.9045, test_f1: 0.5868
 epoch: 68, train_loss: 0.7311, test_loss: 0.9239, test_f1: 0.5993
 epoch: 69, train_loss: 0.7192, test_loss: 0.9115, test_f1: 0.5911
 epoch: 70, train_loss: 0.7192, test_loss: 0.9317, test_f1: 0.5746
 epoch: 71, train_loss: 0.7229, test_loss: 0.9088, test_f1: 0.6028
 epoch: 72, train_loss: 0.7109, test_loss: 0.9369, test_f1: 0.5879
 epoch: 73, train_loss: 0.7031, test_loss: 0.9241, test_f1: 0.5922
 epoch: 74, train_loss: 0.7161, test_loss: 0.9208, test_f1: 0.5888
 epoch: 75, train_loss: 0.7228, test_loss: 0.9248, test_f1: 0.5774
 epoch: 76, train_loss: 0.7134, test_loss: 0.9023, test_f1: 0.5972
 epoch: 77, train_loss: 0.7072, test_loss: 0.9165, test_f1: 0.5918
 epoch: 78, train_loss: 0.7030, test_loss: 0.9234, test_f1: 0.5964
 epoch: 79, train_loss: 0.7113, test_loss: 0.9239, test_f1: 0.5776
 epoch: 80, train_loss: 0.7104, test_loss: 0.9374, test_f1: 0.5868
 epoch: 81, train_loss: 0.6989, test_loss: 0.9274, test_f1: 0.5805
 epoch: 82, train_loss: 0.7023, test_loss: 0.9226, test_f1: 0.5893
 epoch: 83, train_loss: 0.6963, test_loss: 0.9244, test_f1: 0.5863
 epoch: 84, train_loss: 0.6892, test_loss: 0.9312, test_f1: 0.5866
 epoch: 85, train_loss: 0.6840, test_loss: 0.9198, test_f1: 0.5904
 epoch: 86, train_loss: 0.6995, test_loss: 0.9206, test_f1: 0.5966
 epoch: 87, train_loss: 0.7083, test_loss: 0.9304, test_f1: 0.5967
 epoch: 88, train_loss: 0.6900, test_loss: 0.9466, test_f1: 0.5799
 epoch: 89, train_loss: 0.6858, test_loss: 0.9228, test_f1: 0.6018
 epoch: 90, train_loss: 0.7001, test_loss: 0.9415, test_f1: 0.5895
 epoch: 91, train_loss: 0.6749, test_loss: 0.9355, test_f1: 0.5897
 epoch: 92, train_loss: 0.6897, test_loss: 0.9344, test_f1: 0.5899
 epoch: 93, train_loss: 0.6853, test_loss: 0.9557, test_f1: 0.5882
 epoch: 94, train_loss: 0.6946, test_loss: 0.9513, test_f1: 0.5798
 epoch: 95, train_loss: 0.6866, test_loss: 0.9442, test_f1: 0.5639
 epoch: 96, train_loss: 0.6770, test_loss: 0.9397, test_f1: 0.5904
 epoch: 97, train_loss: 0.6831, test_loss: 0.9392, test_f1: 0.6046
 epoch: 98, train_loss: 0.6824, test_loss: 0.9370, test_f1: 0.5977
 epoch: 99, train_loss: 0.6763, test_loss: 0.9418, test_f1: 0.5816
##################ITERATION #2 ****************************************
 epoch: 0, train_loss: 1.2665, test_loss: 1.2362, test_f1: 0.2747
 epoch: 1, train_loss: 1.1787, test_loss: 1.1254, test_f1: 0.4170
 epoch: 2, train_loss: 1.1411, test_loss: 1.0827, test_f1: 0.4343
 epoch: 3, train_loss: 1.1079, test_loss: 1.0481, test_f1: 0.4539
 epoch: 4, train_loss: 1.0808, test_loss: 1.0169, test_f1: 0.4747
 epoch: 5, train_loss: 1.0567, test_loss: 0.9954, test_f1: 0.4868
 epoch: 6, train_loss: 1.0389, test_loss: 0.9779, test_f1: 0.4928
 epoch: 7, train_loss: 1.0221, test_loss: 0.9667, test_f1: 0.4987
 epoch: 8, train_loss: 1.0108, test_loss: 0.9562, test_f1: 0.5093
 epoch: 9, train_loss: 0.9835, test_loss: 0.9446, test_f1: 0.5049
 epoch: 10, train_loss: 0.9806, test_loss: 0.9419, test_f1: 0.5014
 epoch: 11, train_loss: 0.9709, test_loss: 0.9196, test_f1: 0.5114
 epoch: 12, train_loss: 0.9608, test_loss: 0.9271, test_f1: 0.4917
 epoch: 13, train_loss: 0.9568, test_loss: 0.9112, test_f1: 0.5092
 epoch: 14, train_loss: 0.9364, test_loss: 0.9071, test_f1: 0.5017
 epoch: 15, train_loss: 0.9250, test_loss: 0.8883, test_f1: 0.5159
 epoch: 16, train_loss: 0.9252, test_loss: 0.9125, test_f1: 0.5173
 epoch: 17, train_loss: 0.9234, test_loss: 0.9133, test_f1: 0.5219
 epoch: 18, train_loss: 0.9110, test_loss: 0.8961, test_f1: 0.5174
 epoch: 19, train_loss: 0.9050, test_loss: 0.8824, test_f1: 0.5283
 epoch: 20, train_loss: 0.9018, test_loss: 0.9174, test_f1: 0.5377
 epoch: 21, train_loss: 0.8838, test_loss: 0.8844, test_f1: 0.5313
 epoch: 22, train_loss: 0.8848, test_loss: 0.9154, test_f1: 0.5236
 epoch: 23, train_loss: 0.8829, test_loss: 0.8970, test_f1: 0.5337
 epoch: 24, train_loss: 0.8800, test_loss: 0.9136, test_f1: 0.5339
 epoch: 25, train_loss: 0.8617, test_loss: 0.9013, test_f1: 0.5389
 epoch: 26, train_loss: 0.8687, test_loss: 0.9263, test_f1: 0.5173
 epoch: 27, train_loss: 0.8526, test_loss: 0.9198, test_f1: 0.5314
 epoch: 28, train_loss: 0.8549, test_loss: 0.8993, test_f1: 0.5797
 epoch: 29, train_loss: 0.8530, test_loss: 0.9422, test_f1: 0.5444
 epoch: 30, train_loss: 0.8455, test_loss: 0.9007, test_f1: 0.5596
 epoch: 31, train_loss: 0.8535, test_loss: 0.9122, test_f1: 0.5397
 epoch: 32, train_loss: 0.8429, test_loss: 0.9222, test_f1: 0.5433
 epoch: 33, train_loss: 0.8396, test_loss: 0.9409, test_f1: 0.5464
 epoch: 34, train_loss: 0.8396, test_loss: 0.9139, test_f1: 0.5582
 epoch: 35, train_loss: 0.8439, test_loss: 0.9317, test_f1: 0.5400
 epoch: 36, train_loss: 0.8322, test_loss: 0.9462, test_f1: 0.5536
 epoch: 37, train_loss: 0.8186, test_loss: 0.9341, test_f1: 0.5490
 epoch: 38, train_loss: 0.8166, test_loss: 0.9338, test_f1: 0.5661
 epoch: 39, train_loss: 0.8117, test_loss: 0.9314, test_f1: 0.5558
 epoch: 40, train_loss: 0.8068, test_loss: 0.9219, test_f1: 0.5561
 epoch: 41, train_loss: 0.8090, test_loss: 0.9120, test_f1: 0.5491
 epoch: 42, train_loss: 0.8131, test_loss: 0.9185, test_f1: 0.5756
 epoch: 43, train_loss: 0.8030, test_loss: 0.9094, test_f1: 0.5593
 epoch: 44, train_loss: 0.7986, test_loss: 0.9096, test_f1: 0.5846
 epoch: 45, train_loss: 0.7961, test_loss: 0.9336, test_f1: 0.5625
 epoch: 46, train_loss: 0.8005, test_loss: 0.9612, test_f1: 0.5782
 epoch: 47, train_loss: 0.8004, test_loss: 0.9466, test_f1: 0.5685
 epoch: 48, train_loss: 0.7864, test_loss: 0.9282, test_f1: 0.5541
 epoch: 49, train_loss: 0.7817, test_loss: 0.9400, test_f1: 0.5579
 epoch: 50, train_loss: 0.7810, test_loss: 0.9293, test_f1: 0.5637
 epoch: 51, train_loss: 0.7812, test_loss: 0.9428, test_f1: 0.5636
 epoch: 52, train_loss: 0.7789, test_loss: 0.9128, test_f1: 0.5651
 epoch: 53, train_loss: 0.7681, test_loss: 0.9400, test_f1: 0.5689
 epoch: 54, train_loss: 0.7720, test_loss: 0.9349, test_f1: 0.5699
 epoch: 55, train_loss: 0.7642, test_loss: 0.9223, test_f1: 0.5785
 epoch: 56, train_loss: 0.7756, test_loss: 0.9318, test_f1: 0.5810
 epoch: 57, train_loss: 0.7586, test_loss: 0.9424, test_f1: 0.5557
 epoch: 58, train_loss: 0.7624, test_loss: 0.9358, test_f1: 0.5721
 epoch: 59, train_loss: 0.7556, test_loss: 0.9397, test_f1: 0.5730
 epoch: 60, train_loss: 0.7648, test_loss: 0.9364, test_f1: 0.5916
 epoch: 61, train_loss: 0.7605, test_loss: 0.9358, test_f1: 0.5905
 epoch: 62, train_loss: 0.7617, test_loss: 0.9389, test_f1: 0.5904
 epoch: 63, train_loss: 0.7599, test_loss: 0.9362, test_f1: 0.5746
 epoch: 64, train_loss: 0.7497, test_loss: 0.9299, test_f1: 0.5804
 epoch: 65, train_loss: 0.7530, test_loss: 0.9331, test_f1: 0.5838
 epoch: 66, train_loss: 0.7594, test_loss: 0.9424, test_f1: 0.5715
 epoch: 67, train_loss: 0.7493, test_loss: 0.9450, test_f1: 0.5686
 epoch: 68, train_loss: 0.7441, test_loss: 0.9545, test_f1: 0.5709
 epoch: 69, train_loss: 0.7417, test_loss: 0.9493, test_f1: 0.5851
 epoch: 70, train_loss: 0.7455, test_loss: 0.9563, test_f1: 0.5756
 epoch: 71, train_loss: 0.7279, test_loss: 0.9551, test_f1: 0.5836
 epoch: 72, train_loss: 0.7364, test_loss: 0.9592, test_f1: 0.5786
 epoch: 73, train_loss: 0.7469, test_loss: 0.9546, test_f1: 0.5772
 epoch: 74, train_loss: 0.7494, test_loss: 0.9525, test_f1: 0.5822
 epoch: 75, train_loss: 0.7434, test_loss: 0.9518, test_f1: 0.5792
 epoch: 76, train_loss: 0.7421, test_loss: 0.9490, test_f1: 0.5755
 epoch: 77, train_loss: 0.7388, test_loss: 0.9687, test_f1: 0.5751
 epoch: 78, train_loss: 0.7362, test_loss: 0.9381, test_f1: 0.5898
 epoch: 79, train_loss: 0.7383, test_loss: 0.9506, test_f1: 0.5776
 epoch: 80, train_loss: 0.7294, test_loss: 0.9443, test_f1: 0.5832
 epoch: 81, train_loss: 0.7267, test_loss: 0.9508, test_f1: 0.5968
 epoch: 82, train_loss: 0.7291, test_loss: 0.9545, test_f1: 0.5798
 epoch: 83, train_loss: 0.7297, test_loss: 0.9631, test_f1: 0.5862
 epoch: 84, train_loss: 0.7373, test_loss: 0.9546, test_f1: 0.6055
 epoch: 85, train_loss: 0.7193, test_loss: 0.9487, test_f1: 0.6050
 epoch: 86, train_loss: 0.7252, test_loss: 0.9411, test_f1: 0.5998
 epoch: 87, train_loss: 0.7235, test_loss: 0.9895, test_f1: 0.5931
 epoch: 88, train_loss: 0.7326, test_loss: 0.9539, test_f1: 0.5991
 epoch: 89, train_loss: 0.7273, test_loss: 0.9667, test_f1: 0.5921
 epoch: 90, train_loss: 0.7157, test_loss: 0.9702, test_f1: 0.5861
 epoch: 91, train_loss: 0.7339, test_loss: 0.9678, test_f1: 0.5876
 epoch: 92, train_loss: 0.7177, test_loss: 0.9696, test_f1: 0.6004
 epoch: 93, train_loss: 0.7264, test_loss: 0.9500, test_f1: 0.5993
 epoch: 94, train_loss: 0.7190, test_loss: 0.9517, test_f1: 0.6071
 epoch: 95, train_loss: 0.7137, test_loss: 0.9768, test_f1: 0.5840
 epoch: 96, train_loss: 0.7183, test_loss: 0.9721, test_f1: 0.5991
 epoch: 97, train_loss: 0.7123, test_loss: 0.9529, test_f1: 0.6160
 epoch: 98, train_loss: 0.7111, test_loss: 0.9533, test_f1: 0.6111
 epoch: 99, train_loss: 0.7242, test_loss: 0.9624, test_f1: 0.6109
##################ITERATION #3 ****************************************
 epoch: 0, train_loss: 1.2688, test_loss: 1.2324, test_f1: 0.3560
 epoch: 1, train_loss: 1.1847, test_loss: 1.1392, test_f1: 0.4354
 epoch: 2, train_loss: 1.1512, test_loss: 1.0944, test_f1: 0.4548
 epoch: 3, train_loss: 1.1212, test_loss: 1.0605, test_f1: 0.4696
 epoch: 4, train_loss: 1.0931, test_loss: 1.0302, test_f1: 0.4855
 epoch: 5, train_loss: 1.0750, test_loss: 1.0125, test_f1: 0.4525
 epoch: 6, train_loss: 1.0508, test_loss: 1.0005, test_f1: 0.4913
 epoch: 7, train_loss: 1.0401, test_loss: 0.9855, test_f1: 0.5094
 epoch: 8, train_loss: 1.0127, test_loss: 0.9651, test_f1: 0.5086
 epoch: 9, train_loss: 1.0062, test_loss: 0.9641, test_f1: 0.4942
 epoch: 10, train_loss: 0.9904, test_loss: 0.9489, test_f1: 0.5311
 epoch: 11, train_loss: 0.9689, test_loss: 0.9405, test_f1: 0.5018
 epoch: 12, train_loss: 0.9656, test_loss: 0.9443, test_f1: 0.5102
 epoch: 13, train_loss: 0.9503, test_loss: 0.9476, test_f1: 0.4972
 epoch: 14, train_loss: 0.9476, test_loss: 0.9411, test_f1: 0.5284
 epoch: 15, train_loss: 0.9403, test_loss: 0.9399, test_f1: 0.5034
 epoch: 16, train_loss: 0.9335, test_loss: 0.9478, test_f1: 0.5179
 epoch: 17, train_loss: 0.9287, test_loss: 0.9488, test_f1: 0.5301
 epoch: 18, train_loss: 0.9191, test_loss: 0.9423, test_f1: 0.5269
 epoch: 19, train_loss: 0.9133, test_loss: 0.9265, test_f1: 0.5680
 epoch: 20, train_loss: 0.9027, test_loss: 0.9348, test_f1: 0.5547
 epoch: 21, train_loss: 0.9030, test_loss: 0.9468, test_f1: 0.5413
 epoch: 22, train_loss: 0.8958, test_loss: 0.9433, test_f1: 0.5490
 epoch: 23, train_loss: 0.8896, test_loss: 0.9422, test_f1: 0.5531
 epoch: 24, train_loss: 0.8824, test_loss: 0.9542, test_f1: 0.5469
 epoch: 25, train_loss: 0.8837, test_loss: 0.9752, test_f1: 0.5278
 epoch: 26, train_loss: 0.8682, test_loss: 0.9648, test_f1: 0.5399
 epoch: 27, train_loss: 0.8615, test_loss: 0.9654, test_f1: 0.5418
 epoch: 28, train_loss: 0.8579, test_loss: 0.9697, test_f1: 0.5487
 epoch: 29, train_loss: 0.8591, test_loss: 0.9598, test_f1: 0.5472
 epoch: 30, train_loss: 0.8529, test_loss: 0.9557, test_f1: 0.5482
 epoch: 31, train_loss: 0.8449, test_loss: 0.9489, test_f1: 0.5490
 epoch: 32, train_loss: 0.8533, test_loss: 0.9727, test_f1: 0.5548
 epoch: 33, train_loss: 0.8362, test_loss: 0.9645, test_f1: 0.5638
 epoch: 34, train_loss: 0.8355, test_loss: 0.9738, test_f1: 0.5635
 epoch: 35, train_loss: 0.8209, test_loss: 0.9745, test_f1: 0.5560
 epoch: 36, train_loss: 0.8228, test_loss: 0.9664, test_f1: 0.5606
 epoch: 37, train_loss: 0.8293, test_loss: 0.9827, test_f1: 0.5579
 epoch: 38, train_loss: 0.8203, test_loss: 0.9561, test_f1: 0.5740
 epoch: 39, train_loss: 0.8196, test_loss: 0.9627, test_f1: 0.5655
 epoch: 40, train_loss: 0.8138, test_loss: 0.9800, test_f1: 0.5572
 epoch: 41, train_loss: 0.8110, test_loss: 0.9849, test_f1: 0.5470
 epoch: 42, train_loss: 0.8016, test_loss: 0.9771, test_f1: 0.5555
 epoch: 43, train_loss: 0.8024, test_loss: 0.9798, test_f1: 0.5529
 epoch: 44, train_loss: 0.7990, test_loss: 0.9785, test_f1: 0.5593
 epoch: 45, train_loss: 0.8020, test_loss: 0.9731, test_f1: 0.5554
 epoch: 46, train_loss: 0.7888, test_loss: 0.9597, test_f1: 0.5642
 epoch: 47, train_loss: 0.7991, test_loss: 0.9804, test_f1: 0.5724
 epoch: 48, train_loss: 0.7925, test_loss: 0.9774, test_f1: 0.5553
 epoch: 49, train_loss: 0.7948, test_loss: 1.0142, test_f1: 0.5663
 epoch: 50, train_loss: 0.7779, test_loss: 0.9747, test_f1: 0.5612
 epoch: 51, train_loss: 0.7672, test_loss: 0.9774, test_f1: 0.5769
 epoch: 52, train_loss: 0.7679, test_loss: 1.0041, test_f1: 0.5665
 epoch: 53, train_loss: 0.7628, test_loss: 1.0022, test_f1: 0.5677
 epoch: 54, train_loss: 0.7611, test_loss: 1.0060, test_f1: 0.5768
 epoch: 55, train_loss: 0.7661, test_loss: 0.9917, test_f1: 0.5526
 epoch: 56, train_loss: 0.7581, test_loss: 1.0040, test_f1: 0.5650
 epoch: 57, train_loss: 0.7666, test_loss: 0.9963, test_f1: 0.5602
 epoch: 58, train_loss: 0.7526, test_loss: 0.9937, test_f1: 0.5646
 epoch: 59, train_loss: 0.7432, test_loss: 0.9948, test_f1: 0.5672
 epoch: 60, train_loss: 0.7631, test_loss: 0.9849, test_f1: 0.5709
 epoch: 61, train_loss: 0.7531, test_loss: 1.0202, test_f1: 0.5647
 epoch: 62, train_loss: 0.7492, test_loss: 1.0258, test_f1: 0.5568
 epoch: 63, train_loss: 0.7443, test_loss: 1.0094, test_f1: 0.5730
 epoch: 64, train_loss: 0.7453, test_loss: 1.0225, test_f1: 0.5742
 epoch: 65, train_loss: 0.7422, test_loss: 1.0016, test_f1: 0.5792
 epoch: 66, train_loss: 0.7432, test_loss: 1.0193, test_f1: 0.5671
 epoch: 67, train_loss: 0.7415, test_loss: 1.0074, test_f1: 0.5610
 epoch: 68, train_loss: 0.7452, test_loss: 1.0013, test_f1: 0.5611
 epoch: 69, train_loss: 0.7371, test_loss: 0.9953, test_f1: 0.5701
 epoch: 70, train_loss: 0.7324, test_loss: 1.0236, test_f1: 0.5532
 epoch: 71, train_loss: 0.7378, test_loss: 1.0306, test_f1: 0.5647
 epoch: 72, train_loss: 0.7267, test_loss: 1.0106, test_f1: 0.5533
 epoch: 73, train_loss: 0.7233, test_loss: 1.0200, test_f1: 0.5579
 epoch: 74, train_loss: 0.7304, test_loss: 1.0159, test_f1: 0.5580
 epoch: 75, train_loss: 0.7316, test_loss: 1.0321, test_f1: 0.5524
 epoch: 76, train_loss: 0.7361, test_loss: 1.0504, test_f1: 0.5837
 epoch: 77, train_loss: 0.7332, test_loss: 1.0086, test_f1: 0.5807
 epoch: 78, train_loss: 0.7193, test_loss: 1.0033, test_f1: 0.5731
 epoch: 79, train_loss: 0.7187, test_loss: 1.0062, test_f1: 0.5731
 epoch: 80, train_loss: 0.7252, test_loss: 1.0073, test_f1: 0.5834
 epoch: 81, train_loss: 0.7083, test_loss: 0.9833, test_f1: 0.5736
 epoch: 82, train_loss: 0.7230, test_loss: 1.0106, test_f1: 0.5771
 epoch: 83, train_loss: 0.7194, test_loss: 1.0240, test_f1: 0.5746
 epoch: 84, train_loss: 0.7129, test_loss: 1.0132, test_f1: 0.5757
 epoch: 85, train_loss: 0.7147, test_loss: 1.0265, test_f1: 0.5557
 epoch: 86, train_loss: 0.7093, test_loss: 1.0393, test_f1: 0.5749
 epoch: 87, train_loss: 0.7138, test_loss: 1.0294, test_f1: 0.5668
 epoch: 88, train_loss: 0.7128, test_loss: 1.0197, test_f1: 0.5717
 epoch: 89, train_loss: 0.7038, test_loss: 1.0108, test_f1: 0.5778
 epoch: 90, train_loss: 0.7076, test_loss: 1.0162, test_f1: 0.5779
 epoch: 91, train_loss: 0.6999, test_loss: 1.0182, test_f1: 0.5688
 epoch: 92, train_loss: 0.6985, test_loss: 1.0339, test_f1: 0.5787
 epoch: 93, train_loss: 0.7018, test_loss: 1.0188, test_f1: 0.5797
 epoch: 94, train_loss: 0.6924, test_loss: 1.0090, test_f1: 0.5700
 epoch: 95, train_loss: 0.6887, test_loss: 1.0004, test_f1: 0.5778
 epoch: 96, train_loss: 0.6984, test_loss: 1.0372, test_f1: 0.5666
 epoch: 97, train_loss: 0.7019, test_loss: 1.0014, test_f1: 0.5691
 epoch: 98, train_loss: 0.6968, test_loss: 1.0141, test_f1: 0.5607
 epoch: 99, train_loss: 0.6957, test_loss: 1.0297, test_f1: 0.5821
##################ITERATION #4 ****************************************
 epoch: 0, train_loss: 1.2549, test_loss: 1.2682, test_f1: 0.2852
 epoch: 1, train_loss: 1.1719, test_loss: 1.1144, test_f1: 0.3950
 epoch: 2, train_loss: 1.1342, test_loss: 1.0697, test_f1: 0.4267
 epoch: 3, train_loss: 1.1125, test_loss: 1.0388, test_f1: 0.4527
 epoch: 4, train_loss: 1.0910, test_loss: 1.0234, test_f1: 0.4583
 epoch: 5, train_loss: 1.0567, test_loss: 0.9978, test_f1: 0.4707
 epoch: 6, train_loss: 1.0401, test_loss: 0.9809, test_f1: 0.4923
 epoch: 7, train_loss: 1.0307, test_loss: 0.9706, test_f1: 0.4882
 epoch: 8, train_loss: 1.0201, test_loss: 0.9474, test_f1: 0.4896
 epoch: 9, train_loss: 0.9917, test_loss: 0.9555, test_f1: 0.4966
 epoch: 10, train_loss: 0.9877, test_loss: 0.9503, test_f1: 0.5069
 epoch: 11, train_loss: 0.9761, test_loss: 0.9319, test_f1: 0.5076
 epoch: 12, train_loss: 0.9646, test_loss: 0.9455, test_f1: 0.5128
 epoch: 13, train_loss: 0.9483, test_loss: 0.9390, test_f1: 0.5116
 epoch: 14, train_loss: 0.9527, test_loss: 0.9474, test_f1: 0.5224
 epoch: 15, train_loss: 0.9478, test_loss: 0.9404, test_f1: 0.5187
 epoch: 16, train_loss: 0.9418, test_loss: 0.9407, test_f1: 0.5198
 epoch: 17, train_loss: 0.9228, test_loss: 0.9322, test_f1: 0.5156
 epoch: 18, train_loss: 0.9246, test_loss: 0.9174, test_f1: 0.5320
 epoch: 19, train_loss: 0.9200, test_loss: 0.9580, test_f1: 0.5214
 epoch: 20, train_loss: 0.9188, test_loss: 0.9527, test_f1: 0.5257
 epoch: 21, train_loss: 0.9179, test_loss: 0.9769, test_f1: 0.5104
 epoch: 22, train_loss: 0.9071, test_loss: 0.9561, test_f1: 0.5252
 epoch: 23, train_loss: 0.9009, test_loss: 0.9499, test_f1: 0.5147
 epoch: 24, train_loss: 0.8920, test_loss: 0.9402, test_f1: 0.5331
 epoch: 25, train_loss: 0.8850, test_loss: 0.9542, test_f1: 0.5181
 epoch: 26, train_loss: 0.8847, test_loss: 0.9173, test_f1: 0.5394
 epoch: 27, train_loss: 0.8872, test_loss: 0.9450, test_f1: 0.5294
 epoch: 28, train_loss: 0.8712, test_loss: 0.9763, test_f1: 0.5129
 epoch: 29, train_loss: 0.8690, test_loss: 0.9334, test_f1: 0.5167
 epoch: 30, train_loss: 0.8732, test_loss: 0.9640, test_f1: 0.5244
 epoch: 31, train_loss: 0.8693, test_loss: 0.9544, test_f1: 0.5258
 epoch: 32, train_loss: 0.8535, test_loss: 0.9592, test_f1: 0.5217
 epoch: 33, train_loss: 0.8607, test_loss: 0.9760, test_f1: 0.5320
 epoch: 34, train_loss: 0.8552, test_loss: 0.9923, test_f1: 0.5245
 epoch: 35, train_loss: 0.8514, test_loss: 0.9453, test_f1: 0.5289
 epoch: 36, train_loss: 0.8497, test_loss: 0.9715, test_f1: 0.5308
 epoch: 37, train_loss: 0.8339, test_loss: 0.9583, test_f1: 0.5435
 epoch: 38, train_loss: 0.8308, test_loss: 0.9706, test_f1: 0.5575
 epoch: 39, train_loss: 0.8331, test_loss: 0.9876, test_f1: 0.5462
 epoch: 40, train_loss: 0.8206, test_loss: 0.9558, test_f1: 0.5453
 epoch: 41, train_loss: 0.8194, test_loss: 0.9885, test_f1: 0.5383
 epoch: 42, train_loss: 0.8281, test_loss: 0.9691, test_f1: 0.5494
 epoch: 43, train_loss: 0.8208, test_loss: 0.9513, test_f1: 0.5513
 epoch: 44, train_loss: 0.8211, test_loss: 0.9113, test_f1: 0.5425
 epoch: 45, train_loss: 0.8134, test_loss: 0.9482, test_f1: 0.5451
 epoch: 46, train_loss: 0.8093, test_loss: 0.9309, test_f1: 0.5475
 epoch: 47, train_loss: 0.8107, test_loss: 0.9649, test_f1: 0.5495
 epoch: 48, train_loss: 0.7914, test_loss: 0.9512, test_f1: 0.5540
 epoch: 49, train_loss: 0.7942, test_loss: 0.9455, test_f1: 0.5674
 epoch: 50, train_loss: 0.8038, test_loss: 0.9911, test_f1: 0.5472
 epoch: 51, train_loss: 0.7797, test_loss: 0.9827, test_f1: 0.5641
 epoch: 52, train_loss: 0.7824, test_loss: 0.9584, test_f1: 0.5794
 epoch: 53, train_loss: 0.7734, test_loss: 0.9458, test_f1: 0.5746
 epoch: 54, train_loss: 0.7792, test_loss: 0.9596, test_f1: 0.5813
 epoch: 55, train_loss: 0.7833, test_loss: 0.9438, test_f1: 0.5848
 epoch: 56, train_loss: 0.7720, test_loss: 0.9517, test_f1: 0.5812
 epoch: 57, train_loss: 0.7790, test_loss: 0.9648, test_f1: 0.5752
 epoch: 58, train_loss: 0.7790, test_loss: 0.9539, test_f1: 0.5726
 epoch: 59, train_loss: 0.7668, test_loss: 0.9511, test_f1: 0.5844
 epoch: 60, train_loss: 0.7748, test_loss: 0.9622, test_f1: 0.5910
 epoch: 61, train_loss: 0.7705, test_loss: 0.9472, test_f1: 0.5883
 epoch: 62, train_loss: 0.7609, test_loss: 0.9329, test_f1: 0.5695
 epoch: 63, train_loss: 0.7698, test_loss: 0.9451, test_f1: 0.5744
 epoch: 64, train_loss: 0.7686, test_loss: 0.9283, test_f1: 0.5860
 epoch: 65, train_loss: 0.7560, test_loss: 0.9576, test_f1: 0.5873
 epoch: 66, train_loss: 0.7537, test_loss: 0.9589, test_f1: 0.5811
 epoch: 67, train_loss: 0.7647, test_loss: 0.9756, test_f1: 0.5885
 epoch: 68, train_loss: 0.7652, test_loss: 0.9741, test_f1: 0.5961
 epoch: 69, train_loss: 0.7608, test_loss: 0.9890, test_f1: 0.5885
 epoch: 70, train_loss: 0.7556, test_loss: 0.9626, test_f1: 0.5851
 epoch: 71, train_loss: 0.7494, test_loss: 0.9630, test_f1: 0.5890
 epoch: 72, train_loss: 0.7520, test_loss: 0.9688, test_f1: 0.5919
 epoch: 73, train_loss: 0.7587, test_loss: 0.9856, test_f1: 0.5897
 epoch: 74, train_loss: 0.7497, test_loss: 0.9649, test_f1: 0.5809
 epoch: 75, train_loss: 0.7489, test_loss: 0.9828, test_f1: 0.5792
 epoch: 76, train_loss: 0.7484, test_loss: 0.9733, test_f1: 0.5921
 epoch: 77, train_loss: 0.7551, test_loss: 0.9606, test_f1: 0.5971
 epoch: 78, train_loss: 0.7397, test_loss: 0.9567, test_f1: 0.5982
 epoch: 79, train_loss: 0.7533, test_loss: 0.9611, test_f1: 0.5796
 epoch: 80, train_loss: 0.7464, test_loss: 0.9564, test_f1: 0.5826
 epoch: 81, train_loss: 0.7406, test_loss: 0.9803, test_f1: 0.5869
 epoch: 82, train_loss: 0.7477, test_loss: 0.9773, test_f1: 0.5959
 epoch: 83, train_loss: 0.7318, test_loss: 0.9680, test_f1: 0.5939
 epoch: 84, train_loss: 0.7407, test_loss: 0.9809, test_f1: 0.5901
 epoch: 85, train_loss: 0.7452, test_loss: 0.9888, test_f1: 0.5838
 epoch: 86, train_loss: 0.7433, test_loss: 0.9715, test_f1: 0.5974
 epoch: 87, train_loss: 0.7394, test_loss: 0.9726, test_f1: 0.6006
 epoch: 88, train_loss: 0.7258, test_loss: 0.9736, test_f1: 0.5994
 epoch: 89, train_loss: 0.7228, test_loss: 0.9724, test_f1: 0.5989
 epoch: 90, train_loss: 0.7368, test_loss: 0.9547, test_f1: 0.5965
 epoch: 91, train_loss: 0.7216, test_loss: 0.9629, test_f1: 0.6006
 epoch: 92, train_loss: 0.7202, test_loss: 0.9598, test_f1: 0.6001
 epoch: 93, train_loss: 0.7314, test_loss: 0.9688, test_f1: 0.6090
 epoch: 94, train_loss: 0.7356, test_loss: 0.9630, test_f1: 0.6065
 epoch: 95, train_loss: 0.7318, test_loss: 0.9906, test_f1: 0.5942
 epoch: 96, train_loss: 0.7202, test_loss: 0.9656, test_f1: 0.6092
 epoch: 97, train_loss: 0.7175, test_loss: 0.9827, test_f1: 0.5923
 epoch: 98, train_loss: 0.7160, test_loss: 0.9751, test_f1: 0.6041
 epoch: 99, train_loss: 0.7223, test_loss: 0.9751, test_f1: 0.6030
##################ITERATION #5 ****************************************
 epoch: 0, train_loss: 1.2558, test_loss: 1.2088, test_f1: 0.3807
 epoch: 1, train_loss: 1.1552, test_loss: 1.0893, test_f1: 0.4685
 epoch: 2, train_loss: 1.1255, test_loss: 1.0406, test_f1: 0.5021
 epoch: 3, train_loss: 1.0958, test_loss: 1.0147, test_f1: 0.4705
 epoch: 4, train_loss: 1.0711, test_loss: 0.9939, test_f1: 0.4872
 epoch: 5, train_loss: 1.0495, test_loss: 0.9780, test_f1: 0.4829
 epoch: 6, train_loss: 1.0240, test_loss: 0.9671, test_f1: 0.5019
 epoch: 7, train_loss: 1.0190, test_loss: 0.9556, test_f1: 0.5033
 epoch: 8, train_loss: 1.0006, test_loss: 0.9384, test_f1: 0.5030
 epoch: 9, train_loss: 0.9840, test_loss: 0.9379, test_f1: 0.5255
 epoch: 10, train_loss: 0.9814, test_loss: 0.9424, test_f1: 0.5123
 epoch: 11, train_loss: 0.9753, test_loss: 0.9230, test_f1: 0.5246
 epoch: 12, train_loss: 0.9614, test_loss: 0.9347, test_f1: 0.4986
 epoch: 13, train_loss: 0.9513, test_loss: 0.9432, test_f1: 0.5178
 epoch: 14, train_loss: 0.9387, test_loss: 0.9352, test_f1: 0.5227
 epoch: 15, train_loss: 0.9388, test_loss: 0.9299, test_f1: 0.5336
 epoch: 16, train_loss: 0.9257, test_loss: 0.9385, test_f1: 0.5197
 epoch: 17, train_loss: 0.9169, test_loss: 0.9224, test_f1: 0.5275
 epoch: 18, train_loss: 0.9118, test_loss: 0.9176, test_f1: 0.5216
 epoch: 19, train_loss: 0.9112, test_loss: 0.9261, test_f1: 0.5402
 epoch: 20, train_loss: 0.8979, test_loss: 0.9240, test_f1: 0.5278
 epoch: 21, train_loss: 0.8960, test_loss: 0.9257, test_f1: 0.5381
 epoch: 22, train_loss: 0.8977, test_loss: 0.9319, test_f1: 0.5283
 epoch: 23, train_loss: 0.8973, test_loss: 0.9254, test_f1: 0.5629
 epoch: 24, train_loss: 0.8874, test_loss: 0.9410, test_f1: 0.5541
 epoch: 25, train_loss: 0.8804, test_loss: 0.9286, test_f1: 0.5672
 epoch: 26, train_loss: 0.8745, test_loss: 0.9379, test_f1: 0.5453
 epoch: 27, train_loss: 0.8708, test_loss: 0.9484, test_f1: 0.5379
 epoch: 28, train_loss: 0.8675, test_loss: 0.9351, test_f1: 0.5548
 epoch: 29, train_loss: 0.8573, test_loss: 0.9382, test_f1: 0.5606
 epoch: 30, train_loss: 0.8514, test_loss: 0.9305, test_f1: 0.5823
 epoch: 31, train_loss: 0.8495, test_loss: 0.9277, test_f1: 0.5618
 epoch: 32, train_loss: 0.8510, test_loss: 0.9233, test_f1: 0.5727
 epoch: 33, train_loss: 0.8442, test_loss: 0.9240, test_f1: 0.5773
 epoch: 34, train_loss: 0.8477, test_loss: 0.9257, test_f1: 0.5821
 epoch: 35, train_loss: 0.8350, test_loss: 0.9564, test_f1: 0.5532
 epoch: 36, train_loss: 0.8370, test_loss: 0.9712, test_f1: 0.5630
 epoch: 37, train_loss: 0.8334, test_loss: 0.9290, test_f1: 0.5851
 epoch: 38, train_loss: 0.8177, test_loss: 0.9141, test_f1: 0.5831
 epoch: 39, train_loss: 0.8226, test_loss: 0.9396, test_f1: 0.5664
 epoch: 40, train_loss: 0.8199, test_loss: 0.9421, test_f1: 0.5686
 epoch: 41, train_loss: 0.8244, test_loss: 0.9526, test_f1: 0.5524
 epoch: 42, train_loss: 0.8077, test_loss: 0.9511, test_f1: 0.5642
 epoch: 43, train_loss: 0.7976, test_loss: 0.9344, test_f1: 0.5626
 epoch: 44, train_loss: 0.8038, test_loss: 0.9330, test_f1: 0.5772
 epoch: 45, train_loss: 0.8070, test_loss: 0.9313, test_f1: 0.5789
 epoch: 46, train_loss: 0.8010, test_loss: 0.9353, test_f1: 0.5644
 epoch: 47, train_loss: 0.7924, test_loss: 0.9192, test_f1: 0.5740
 epoch: 48, train_loss: 0.7895, test_loss: 0.9399, test_f1: 0.5776
 epoch: 49, train_loss: 0.7857, test_loss: 0.9301, test_f1: 0.5894
 epoch: 50, train_loss: 0.7818, test_loss: 0.9241, test_f1: 0.5893
 epoch: 51, train_loss: 0.7837, test_loss: 0.9299, test_f1: 0.5998
 epoch: 52, train_loss: 0.7760, test_loss: 0.9257, test_f1: 0.5886
 epoch: 53, train_loss: 0.7680, test_loss: 0.9142, test_f1: 0.5878
 epoch: 54, train_loss: 0.7708, test_loss: 0.9212, test_f1: 0.5818
 epoch: 55, train_loss: 0.7602, test_loss: 0.9359, test_f1: 0.5812
 epoch: 56, train_loss: 0.7644, test_loss: 0.9360, test_f1: 0.5861
 epoch: 57, train_loss: 0.7706, test_loss: 0.9203, test_f1: 0.5730
 epoch: 58, train_loss: 0.7589, test_loss: 0.9310, test_f1: 0.5791
 epoch: 59, train_loss: 0.7645, test_loss: 0.9270, test_f1: 0.5814
 epoch: 60, train_loss: 0.7543, test_loss: 0.9327, test_f1: 0.5832
 epoch: 61, train_loss: 0.7544, test_loss: 0.9269, test_f1: 0.5747
 epoch: 62, train_loss: 0.7491, test_loss: 0.9187, test_f1: 0.5746
 epoch: 63, train_loss: 0.7669, test_loss: 0.9264, test_f1: 0.5771
 epoch: 64, train_loss: 0.7394, test_loss: 0.9150, test_f1: 0.5847
 epoch: 65, train_loss: 0.7467, test_loss: 0.9021, test_f1: 0.5851
 epoch: 66, train_loss: 0.7397, test_loss: 0.9276, test_f1: 0.5914
 epoch: 67, train_loss: 0.7457, test_loss: 0.9084, test_f1: 0.6021
 epoch: 68, train_loss: 0.7442, test_loss: 0.9174, test_f1: 0.5815
 epoch: 69, train_loss: 0.7468, test_loss: 0.9197, test_f1: 0.5866
 epoch: 70, train_loss: 0.7319, test_loss: 0.9149, test_f1: 0.5933
 epoch: 71, train_loss: 0.7363, test_loss: 0.9183, test_f1: 0.5774
 epoch: 72, train_loss: 0.7329, test_loss: 0.9296, test_f1: 0.5844
 epoch: 73, train_loss: 0.7320, test_loss: 0.9217, test_f1: 0.5865
 epoch: 74, train_loss: 0.7358, test_loss: 0.9119, test_f1: 0.6046
 epoch: 75, train_loss: 0.7266, test_loss: 0.9188, test_f1: 0.6204
 epoch: 76, train_loss: 0.7274, test_loss: 0.9110, test_f1: 0.6168
 epoch: 77, train_loss: 0.7244, test_loss: 0.9251, test_f1: 0.6112
 epoch: 78, train_loss: 0.7319, test_loss: 0.9306, test_f1: 0.6087
 epoch: 79, train_loss: 0.7307, test_loss: 0.8951, test_f1: 0.6157
 epoch: 80, train_loss: 0.7227, test_loss: 0.9102, test_f1: 0.6015
 epoch: 81, train_loss: 0.7305, test_loss: 0.9207, test_f1: 0.6052
 epoch: 82, train_loss: 0.7106, test_loss: 0.9151, test_f1: 0.6069
 epoch: 83, train_loss: 0.7248, test_loss: 0.9055, test_f1: 0.5799
 epoch: 84, train_loss: 0.7219, test_loss: 0.9366, test_f1: 0.6055
 epoch: 85, train_loss: 0.7077, test_loss: 0.9334, test_f1: 0.5803
 epoch: 86, train_loss: 0.7023, test_loss: 0.9108, test_f1: 0.6187
 epoch: 87, train_loss: 0.7111, test_loss: 0.9039, test_f1: 0.6102
 epoch: 88, train_loss: 0.7167, test_loss: 0.9257, test_f1: 0.6081
 epoch: 89, train_loss: 0.6965, test_loss: 0.9400, test_f1: 0.5812
 epoch: 90, train_loss: 0.7031, test_loss: 0.9273, test_f1: 0.6058
 epoch: 91, train_loss: 0.6972, test_loss: 0.9185, test_f1: 0.6002
 epoch: 92, train_loss: 0.7131, test_loss: 0.9223, test_f1: 0.5967
 epoch: 93, train_loss: 0.7050, test_loss: 0.9463, test_f1: 0.5772
 epoch: 94, train_loss: 0.6975, test_loss: 0.9368, test_f1: 0.5927
 epoch: 95, train_loss: 0.7027, test_loss: 0.9254, test_f1: 0.5940
 epoch: 96, train_loss: 0.6943, test_loss: 0.9407, test_f1: 0.5998
 epoch: 97, train_loss: 0.6996, test_loss: 0.9399, test_f1: 0.6073
 epoch: 98, train_loss: 0.6892, test_loss: 0.9345, test_f1: 0.6018
 epoch: 99, train_loss: 0.6919, test_loss: 0.9252, test_f1: 0.6072
##################ITERATION #6 ****************************************
 epoch: 0, train_loss: 1.2435, test_loss: 1.1895, test_f1: 0.3766
 epoch: 1, train_loss: 1.1598, test_loss: 1.1074, test_f1: 0.4071
 epoch: 2, train_loss: 1.1295, test_loss: 1.0696, test_f1: 0.4310
 epoch: 3, train_loss: 1.1133, test_loss: 1.0363, test_f1: 0.4360
 epoch: 4, train_loss: 1.0900, test_loss: 1.0263, test_f1: 0.4512
 epoch: 5, train_loss: 1.0790, test_loss: 1.0090, test_f1: 0.4406
 epoch: 6, train_loss: 1.0586, test_loss: 0.9876, test_f1: 0.4630
 epoch: 7, train_loss: 1.0399, test_loss: 0.9840, test_f1: 0.5001
 epoch: 8, train_loss: 1.0281, test_loss: 0.9617, test_f1: 0.4842
 epoch: 9, train_loss: 1.0159, test_loss: 0.9596, test_f1: 0.4991
 epoch: 10, train_loss: 1.0031, test_loss: 0.9631, test_f1: 0.4935
 epoch: 11, train_loss: 1.0023, test_loss: 0.9481, test_f1: 0.4931
 epoch: 12, train_loss: 0.9824, test_loss: 0.9481, test_f1: 0.5079
 epoch: 13, train_loss: 0.9924, test_loss: 0.9547, test_f1: 0.4898
 epoch: 14, train_loss: 0.9805, test_loss: 0.9434, test_f1: 0.4969
 epoch: 15, train_loss: 0.9631, test_loss: 0.9333, test_f1: 0.5276
 epoch: 16, train_loss: 0.9560, test_loss: 0.9379, test_f1: 0.5131
 epoch: 17, train_loss: 0.9518, test_loss: 0.9385, test_f1: 0.5096
 epoch: 18, train_loss: 0.9417, test_loss: 0.9277, test_f1: 0.5220
 epoch: 19, train_loss: 0.9303, test_loss: 0.9388, test_f1: 0.5171
 epoch: 20, train_loss: 0.9302, test_loss: 0.9281, test_f1: 0.5142
 epoch: 21, train_loss: 0.9322, test_loss: 0.9523, test_f1: 0.5277
 epoch: 22, train_loss: 0.9328, test_loss: 0.9393, test_f1: 0.5263
 epoch: 23, train_loss: 0.9145, test_loss: 0.9302, test_f1: 0.5244
 epoch: 24, train_loss: 0.9108, test_loss: 0.9325, test_f1: 0.5382
 epoch: 25, train_loss: 0.9060, test_loss: 0.9468, test_f1: 0.4984
 epoch: 26, train_loss: 0.8972, test_loss: 0.9239, test_f1: 0.5216
 epoch: 27, train_loss: 0.8935, test_loss: 0.9482, test_f1: 0.5160
 epoch: 28, train_loss: 0.8905, test_loss: 0.9364, test_f1: 0.5302
 epoch: 29, train_loss: 0.8807, test_loss: 0.9319, test_f1: 0.5459
 epoch: 30, train_loss: 0.8790, test_loss: 0.9349, test_f1: 0.5487
 epoch: 31, train_loss: 0.8728, test_loss: 0.9522, test_f1: 0.5560
 epoch: 32, train_loss: 0.8781, test_loss: 0.9394, test_f1: 0.5424
 epoch: 33, train_loss: 0.8692, test_loss: 0.9246, test_f1: 0.5620
 epoch: 34, train_loss: 0.8608, test_loss: 0.9643, test_f1: 0.5269
 epoch: 35, train_loss: 0.8595, test_loss: 0.9484, test_f1: 0.5470
 epoch: 36, train_loss: 0.8498, test_loss: 0.9445, test_f1: 0.5557
 epoch: 37, train_loss: 0.8506, test_loss: 0.9395, test_f1: 0.5532
 epoch: 38, train_loss: 0.8585, test_loss: 0.9491, test_f1: 0.5561
 epoch: 39, train_loss: 0.8438, test_loss: 0.9405, test_f1: 0.5484
 epoch: 40, train_loss: 0.8360, test_loss: 0.9453, test_f1: 0.5550
 epoch: 41, train_loss: 0.8354, test_loss: 0.9613, test_f1: 0.5335
 epoch: 42, train_loss: 0.8328, test_loss: 0.9443, test_f1: 0.5618
 epoch: 43, train_loss: 0.8268, test_loss: 0.9578, test_f1: 0.5452
 epoch: 44, train_loss: 0.8348, test_loss: 0.9376, test_f1: 0.5637
 epoch: 45, train_loss: 0.8247, test_loss: 0.9527, test_f1: 0.5691
 epoch: 46, train_loss: 0.8207, test_loss: 0.9502, test_f1: 0.5708
 epoch: 47, train_loss: 0.8054, test_loss: 0.9469, test_f1: 0.5889
 epoch: 48, train_loss: 0.8186, test_loss: 0.9749, test_f1: 0.5553
 epoch: 49, train_loss: 0.8110, test_loss: 0.9358, test_f1: 0.5604
 epoch: 50, train_loss: 0.7992, test_loss: 0.9381, test_f1: 0.5775
 epoch: 51, train_loss: 0.7987, test_loss: 0.9598, test_f1: 0.5729
 epoch: 52, train_loss: 0.7975, test_loss: 0.9571, test_f1: 0.5642
 epoch: 53, train_loss: 0.7960, test_loss: 0.9636, test_f1: 0.5735
 epoch: 54, train_loss: 0.7931, test_loss: 0.9636, test_f1: 0.5607
 epoch: 55, train_loss: 0.7809, test_loss: 0.9643, test_f1: 0.5583
 epoch: 56, train_loss: 0.7881, test_loss: 0.9657, test_f1: 0.5749
 epoch: 57, train_loss: 0.7919, test_loss: 0.9693, test_f1: 0.5798
 epoch: 58, train_loss: 0.7780, test_loss: 0.9632, test_f1: 0.5875
 epoch: 59, train_loss: 0.7776, test_loss: 0.9562, test_f1: 0.5807
 epoch: 60, train_loss: 0.7739, test_loss: 0.9772, test_f1: 0.5671
 epoch: 61, train_loss: 0.7716, test_loss: 0.9673, test_f1: 0.5840
 epoch: 62, train_loss: 0.7714, test_loss: 0.9551, test_f1: 0.5921
 epoch: 63, train_loss: 0.7794, test_loss: 0.9605, test_f1: 0.5799
 epoch: 64, train_loss: 0.7734, test_loss: 0.9686, test_f1: 0.5659
 epoch: 65, train_loss: 0.7597, test_loss: 0.9641, test_f1: 0.5878
 epoch: 66, train_loss: 0.7665, test_loss: 0.9677, test_f1: 0.5727
 epoch: 67, train_loss: 0.7707, test_loss: 0.9656, test_f1: 0.5588
 epoch: 68, train_loss: 0.7697, test_loss: 0.9583, test_f1: 0.5748
 epoch: 69, train_loss: 0.7557, test_loss: 0.9772, test_f1: 0.6077
 epoch: 70, train_loss: 0.7560, test_loss: 0.9617, test_f1: 0.5857
 epoch: 71, train_loss: 0.7600, test_loss: 0.9598, test_f1: 0.5806
 epoch: 72, train_loss: 0.7636, test_loss: 0.9669, test_f1: 0.6020
 epoch: 73, train_loss: 0.7641, test_loss: 0.9660, test_f1: 0.6099
 epoch: 74, train_loss: 0.7484, test_loss: 0.9704, test_f1: 0.5903
 epoch: 75, train_loss: 0.7529, test_loss: 0.9611, test_f1: 0.5865
 epoch: 76, train_loss: 0.7526, test_loss: 0.9644, test_f1: 0.5808
 epoch: 77, train_loss: 0.7492, test_loss: 0.9546, test_f1: 0.6093
 epoch: 78, train_loss: 0.7518, test_loss: 0.9590, test_f1: 0.5829
 epoch: 79, train_loss: 0.7544, test_loss: 0.9512, test_f1: 0.6008
 epoch: 80, train_loss: 0.7488, test_loss: 0.9743, test_f1: 0.5888
 epoch: 81, train_loss: 0.7369, test_loss: 0.9615, test_f1: 0.6161
 epoch: 82, train_loss: 0.7470, test_loss: 0.9502, test_f1: 0.5830
 epoch: 83, train_loss: 0.7375, test_loss: 0.9545, test_f1: 0.6098
 epoch: 84, train_loss: 0.7472, test_loss: 0.9655, test_f1: 0.6007
 epoch: 85, train_loss: 0.7324, test_loss: 0.9690, test_f1: 0.6011
 epoch: 86, train_loss: 0.7365, test_loss: 0.9689, test_f1: 0.6005
 epoch: 87, train_loss: 0.7239, test_loss: 0.9653, test_f1: 0.5968
 epoch: 88, train_loss: 0.7246, test_loss: 0.9767, test_f1: 0.5984
 epoch: 89, train_loss: 0.7354, test_loss: 0.9762, test_f1: 0.5977
 epoch: 90, train_loss: 0.7297, test_loss: 0.9859, test_f1: 0.5909
 epoch: 91, train_loss: 0.7379, test_loss: 0.9773, test_f1: 0.5989
 epoch: 92, train_loss: 0.7111, test_loss: 0.9911, test_f1: 0.5753
 epoch: 93, train_loss: 0.7240, test_loss: 0.9655, test_f1: 0.5966
 epoch: 94, train_loss: 0.7269, test_loss: 0.9733, test_f1: 0.6019
 epoch: 95, train_loss: 0.7226, test_loss: 0.9704, test_f1: 0.5875
 epoch: 96, train_loss: 0.7106, test_loss: 0.9655, test_f1: 0.5942
 epoch: 97, train_loss: 0.7238, test_loss: 0.9775, test_f1: 0.6080
 epoch: 98, train_loss: 0.7119, test_loss: 0.9680, test_f1: 0.6220
 epoch: 99, train_loss: 0.7113, test_loss: 0.9930, test_f1: 0.6224
##################ITERATION #7 ****************************************
 epoch: 0, train_loss: 1.2999, test_loss: 1.1814, test_f1: 0.3320
 epoch: 1, train_loss: 1.1792, test_loss: 1.0745, test_f1: 0.4429
 epoch: 2, train_loss: 1.1468, test_loss: 1.0484, test_f1: 0.4465
 epoch: 3, train_loss: 1.1158, test_loss: 1.0228, test_f1: 0.4213
 epoch: 4, train_loss: 1.0883, test_loss: 1.0079, test_f1: 0.4678
 epoch: 5, train_loss: 1.0654, test_loss: 0.9820, test_f1: 0.5144
 epoch: 6, train_loss: 1.0371, test_loss: 0.9775, test_f1: 0.5164
 epoch: 7, train_loss: 1.0222, test_loss: 0.9829, test_f1: 0.4947
 epoch: 8, train_loss: 1.0046, test_loss: 0.9435, test_f1: 0.5202
 epoch: 9, train_loss: 0.9861, test_loss: 0.9534, test_f1: 0.5220
 epoch: 10, train_loss: 0.9787, test_loss: 0.9605, test_f1: 0.5217
 epoch: 11, train_loss: 0.9740, test_loss: 0.9339, test_f1: 0.5217
 epoch: 12, train_loss: 0.9546, test_loss: 0.9318, test_f1: 0.5205
 epoch: 13, train_loss: 0.9485, test_loss: 0.9454, test_f1: 0.5215
 epoch: 14, train_loss: 0.9510, test_loss: 0.9256, test_f1: 0.5345
 epoch: 15, train_loss: 0.9256, test_loss: 0.9202, test_f1: 0.5361
 epoch: 16, train_loss: 0.9316, test_loss: 0.9420, test_f1: 0.5379
 epoch: 17, train_loss: 0.9157, test_loss: 0.9223, test_f1: 0.5490
 epoch: 18, train_loss: 0.9086, test_loss: 0.9327, test_f1: 0.5519
 epoch: 19, train_loss: 0.9064, test_loss: 0.9179, test_f1: 0.5670
 epoch: 20, train_loss: 0.9022, test_loss: 0.9340, test_f1: 0.5442
 epoch: 21, train_loss: 0.8973, test_loss: 0.9318, test_f1: 0.5546
 epoch: 22, train_loss: 0.8991, test_loss: 0.9260, test_f1: 0.5420
 epoch: 23, train_loss: 0.8797, test_loss: 0.9398, test_f1: 0.5559
 epoch: 24, train_loss: 0.8787, test_loss: 0.9348, test_f1: 0.5628
 epoch: 25, train_loss: 0.8795, test_loss: 0.9411, test_f1: 0.5394
 epoch: 26, train_loss: 0.8774, test_loss: 0.9542, test_f1: 0.5638
 epoch: 27, train_loss: 0.8644, test_loss: 0.9465, test_f1: 0.5264
 epoch: 28, train_loss: 0.8652, test_loss: 0.9541, test_f1: 0.5349
 epoch: 29, train_loss: 0.8616, test_loss: 0.9669, test_f1: 0.5545
 epoch: 30, train_loss: 0.8604, test_loss: 0.9425, test_f1: 0.5754
 epoch: 31, train_loss: 0.8549, test_loss: 0.9561, test_f1: 0.5753
 epoch: 32, train_loss: 0.8462, test_loss: 0.9555, test_f1: 0.5559
 epoch: 33, train_loss: 0.8513, test_loss: 0.9398, test_f1: 0.5510
 epoch: 34, train_loss: 0.8461, test_loss: 0.9602, test_f1: 0.5630
 epoch: 35, train_loss: 0.8355, test_loss: 0.9428, test_f1: 0.5736
 epoch: 36, train_loss: 0.8325, test_loss: 0.9782, test_f1: 0.5706
 epoch: 37, train_loss: 0.8340, test_loss: 0.9523, test_f1: 0.5598
 epoch: 38, train_loss: 0.8277, test_loss: 0.9541, test_f1: 0.5712
 epoch: 39, train_loss: 0.8273, test_loss: 0.9388, test_f1: 0.5590
 epoch: 40, train_loss: 0.8162, test_loss: 0.9909, test_f1: 0.5631
 epoch: 41, train_loss: 0.8183, test_loss: 0.9640, test_f1: 0.5702
 epoch: 42, train_loss: 0.8247, test_loss: 0.9508, test_f1: 0.5541
 epoch: 43, train_loss: 0.8218, test_loss: 0.9488, test_f1: 0.5372
 epoch: 44, train_loss: 0.8196, test_loss: 0.9548, test_f1: 0.5611
 epoch: 45, train_loss: 0.8087, test_loss: 0.9570, test_f1: 0.5676
 epoch: 46, train_loss: 0.8029, test_loss: 0.9581, test_f1: 0.5515
 epoch: 47, train_loss: 0.8070, test_loss: 0.9523, test_f1: 0.5665
 epoch: 48, train_loss: 0.8039, test_loss: 0.9711, test_f1: 0.5544
 epoch: 49, train_loss: 0.8084, test_loss: 0.9433, test_f1: 0.5710
 epoch: 50, train_loss: 0.7878, test_loss: 0.9395, test_f1: 0.5784
 epoch: 51, train_loss: 0.7826, test_loss: 0.9533, test_f1: 0.5756
 epoch: 52, train_loss: 0.7813, test_loss: 0.9652, test_f1: 0.5692
 epoch: 53, train_loss: 0.7857, test_loss: 0.9592, test_f1: 0.5682
 epoch: 54, train_loss: 0.7738, test_loss: 0.9579, test_f1: 0.5601
 epoch: 55, train_loss: 0.7730, test_loss: 0.9491, test_f1: 0.5639
 epoch: 56, train_loss: 0.7731, test_loss: 0.9507, test_f1: 0.5583
 epoch: 57, train_loss: 0.7742, test_loss: 0.9504, test_f1: 0.5579
 epoch: 58, train_loss: 0.7737, test_loss: 0.9444, test_f1: 0.5619
 epoch: 59, train_loss: 0.7702, test_loss: 0.9536, test_f1: 0.5735
 epoch: 60, train_loss: 0.7662, test_loss: 0.9553, test_f1: 0.5755
 epoch: 61, train_loss: 0.7645, test_loss: 0.9542, test_f1: 0.5662
 epoch: 62, train_loss: 0.7599, test_loss: 0.9585, test_f1: 0.5694
 epoch: 63, train_loss: 0.7599, test_loss: 0.9668, test_f1: 0.5643
 epoch: 64, train_loss: 0.7733, test_loss: 0.9530, test_f1: 0.5640
 epoch: 65, train_loss: 0.7626, test_loss: 0.9667, test_f1: 0.5723
 epoch: 66, train_loss: 0.7421, test_loss: 0.9491, test_f1: 0.5457
 epoch: 67, train_loss: 0.7565, test_loss: 0.9603, test_f1: 0.5665
 epoch: 68, train_loss: 0.7532, test_loss: 0.9482, test_f1: 0.5743
 epoch: 69, train_loss: 0.7599, test_loss: 0.9589, test_f1: 0.5799
 epoch: 70, train_loss: 0.7559, test_loss: 0.9627, test_f1: 0.5667
 epoch: 71, train_loss: 0.7516, test_loss: 0.9662, test_f1: 0.5908
 epoch: 72, train_loss: 0.7579, test_loss: 0.9716, test_f1: 0.5746
 epoch: 73, train_loss: 0.7444, test_loss: 0.9724, test_f1: 0.5697
 epoch: 74, train_loss: 0.7567, test_loss: 0.9818, test_f1: 0.5722
 epoch: 75, train_loss: 0.7506, test_loss: 0.9707, test_f1: 0.5775
 epoch: 76, train_loss: 0.7465, test_loss: 0.9726, test_f1: 0.5753
 epoch: 77, train_loss: 0.7392, test_loss: 0.9906, test_f1: 0.5715
 epoch: 78, train_loss: 0.7431, test_loss: 0.9809, test_f1: 0.5758
 epoch: 79, train_loss: 0.7506, test_loss: 0.9573, test_f1: 0.5714
 epoch: 80, train_loss: 0.7524, test_loss: 0.9787, test_f1: 0.5899
 epoch: 81, train_loss: 0.7329, test_loss: 0.9830, test_f1: 0.5806
 epoch: 82, train_loss: 0.7328, test_loss: 0.9588, test_f1: 0.5800
 epoch: 83, train_loss: 0.7404, test_loss: 0.9762, test_f1: 0.5787
 epoch: 84, train_loss: 0.7393, test_loss: 0.9693, test_f1: 0.5909
 epoch: 85, train_loss: 0.7434, test_loss: 0.9773, test_f1: 0.5762
 epoch: 86, train_loss: 0.7276, test_loss: 0.9759, test_f1: 0.5764
 epoch: 87, train_loss: 0.7341, test_loss: 0.9735, test_f1: 0.5779
 epoch: 88, train_loss: 0.7088, test_loss: 0.9729, test_f1: 0.5863
 epoch: 89, train_loss: 0.7377, test_loss: 0.9791, test_f1: 0.5853
 epoch: 90, train_loss: 0.7283, test_loss: 0.9627, test_f1: 0.5875
 epoch: 91, train_loss: 0.7272, test_loss: 0.9659, test_f1: 0.5939
 epoch: 92, train_loss: 0.7230, test_loss: 0.9993, test_f1: 0.5870
 epoch: 93, train_loss: 0.7110, test_loss: 0.9690, test_f1: 0.5914
 epoch: 94, train_loss: 0.7179, test_loss: 0.9759, test_f1: 0.5936
 epoch: 95, train_loss: 0.7169, test_loss: 0.9691, test_f1: 0.5960
 epoch: 96, train_loss: 0.7268, test_loss: 0.9731, test_f1: 0.5869
 epoch: 97, train_loss: 0.7129, test_loss: 0.9782, test_f1: 0.5929
 epoch: 98, train_loss: 0.7213, test_loss: 0.9787, test_f1: 0.5949
 epoch: 99, train_loss: 0.7126, test_loss: 1.0188, test_f1: 0.5830
##################ITERATION #8 ****************************************
 epoch: 0, train_loss: 1.2306, test_loss: 1.2158, test_f1: 0.3017
 epoch: 1, train_loss: 1.1356, test_loss: 1.0673, test_f1: 0.4317
 epoch: 2, train_loss: 1.1077, test_loss: 1.0571, test_f1: 0.4344
 epoch: 3, train_loss: 1.0746, test_loss: 1.0375, test_f1: 0.4608
 epoch: 4, train_loss: 1.0567, test_loss: 1.0233, test_f1: 0.4844
 epoch: 5, train_loss: 1.0359, test_loss: 1.0082, test_f1: 0.4848
 epoch: 6, train_loss: 1.0228, test_loss: 1.0054, test_f1: 0.4760
 epoch: 7, train_loss: 1.0007, test_loss: 0.9997, test_f1: 0.4778
 epoch: 8, train_loss: 0.9887, test_loss: 0.9844, test_f1: 0.4871
 epoch: 9, train_loss: 0.9739, test_loss: 0.9778, test_f1: 0.4939
 epoch: 10, train_loss: 0.9630, test_loss: 0.9682, test_f1: 0.4982
 epoch: 11, train_loss: 0.9656, test_loss: 0.9719, test_f1: 0.5022
 epoch: 12, train_loss: 0.9499, test_loss: 0.9716, test_f1: 0.4846
 epoch: 13, train_loss: 0.9430, test_loss: 0.9554, test_f1: 0.4999
 epoch: 14, train_loss: 0.9374, test_loss: 0.9506, test_f1: 0.5078
 epoch: 15, train_loss: 0.9264, test_loss: 0.9549, test_f1: 0.5047
 epoch: 16, train_loss: 0.9094, test_loss: 0.9566, test_f1: 0.5087
 epoch: 17, train_loss: 0.8972, test_loss: 0.9609, test_f1: 0.5138
 epoch: 18, train_loss: 0.8981, test_loss: 0.9590, test_f1: 0.5141
 epoch: 19, train_loss: 0.8864, test_loss: 0.9527, test_f1: 0.5116
 epoch: 20, train_loss: 0.8896, test_loss: 0.9700, test_f1: 0.5436
 epoch: 21, train_loss: 0.8855, test_loss: 0.9674, test_f1: 0.5110
 epoch: 22, train_loss: 0.8787, test_loss: 0.9662, test_f1: 0.5126
 epoch: 23, train_loss: 0.8770, test_loss: 0.9785, test_f1: 0.4985
 epoch: 24, train_loss: 0.8660, test_loss: 0.9800, test_f1: 0.5030
 epoch: 25, train_loss: 0.8791, test_loss: 0.9795, test_f1: 0.5111
 epoch: 26, train_loss: 0.8634, test_loss: 0.9590, test_f1: 0.5076
 epoch: 27, train_loss: 0.8544, test_loss: 0.9824, test_f1: 0.5106
 epoch: 28, train_loss: 0.8622, test_loss: 0.9762, test_f1: 0.5155
 epoch: 29, train_loss: 0.8474, test_loss: 0.9513, test_f1: 0.5353
 epoch: 30, train_loss: 0.8598, test_loss: 0.9698, test_f1: 0.5077
 epoch: 31, train_loss: 0.8393, test_loss: 0.9742, test_f1: 0.5184
 epoch: 32, train_loss: 0.8426, test_loss: 0.9670, test_f1: 0.5267
 epoch: 33, train_loss: 0.8267, test_loss: 0.9784, test_f1: 0.5146
 epoch: 34, train_loss: 0.8310, test_loss: 0.9883, test_f1: 0.5197
 epoch: 35, train_loss: 0.8301, test_loss: 0.9756, test_f1: 0.5232
 epoch: 36, train_loss: 0.8096, test_loss: 0.9789, test_f1: 0.5338
 epoch: 37, train_loss: 0.8086, test_loss: 0.9625, test_f1: 0.5287
 epoch: 38, train_loss: 0.8122, test_loss: 0.9701, test_f1: 0.5368
 epoch: 39, train_loss: 0.8097, test_loss: 0.9859, test_f1: 0.5351
 epoch: 40, train_loss: 0.8071, test_loss: 0.9763, test_f1: 0.5407
 epoch: 41, train_loss: 0.8035, test_loss: 0.9868, test_f1: 0.5376
 epoch: 42, train_loss: 0.8170, test_loss: 0.9845, test_f1: 0.5333
 epoch: 43, train_loss: 0.7913, test_loss: 0.9699, test_f1: 0.5291
 epoch: 44, train_loss: 0.8019, test_loss: 0.9905, test_f1: 0.5416
 epoch: 45, train_loss: 0.7906, test_loss: 0.9743, test_f1: 0.5310
 epoch: 46, train_loss: 0.8003, test_loss: 0.9696, test_f1: 0.5559
 epoch: 47, train_loss: 0.7952, test_loss: 0.9786, test_f1: 0.5450
 epoch: 48, train_loss: 0.7875, test_loss: 0.9777, test_f1: 0.5525
 epoch: 49, train_loss: 0.7909, test_loss: 0.9702, test_f1: 0.5640
 epoch: 50, train_loss: 0.7779, test_loss: 0.9768, test_f1: 0.5493
 epoch: 51, train_loss: 0.7675, test_loss: 0.9642, test_f1: 0.5564
 epoch: 52, train_loss: 0.7612, test_loss: 0.9766, test_f1: 0.5487
 epoch: 53, train_loss: 0.7715, test_loss: 0.9746, test_f1: 0.5431
 epoch: 54, train_loss: 0.7661, test_loss: 0.9809, test_f1: 0.5469
 epoch: 55, train_loss: 0.7627, test_loss: 0.9789, test_f1: 0.5469
 epoch: 56, train_loss: 0.7450, test_loss: 0.9774, test_f1: 0.5476
 epoch: 57, train_loss: 0.7542, test_loss: 0.9785, test_f1: 0.5656
 epoch: 58, train_loss: 0.7570, test_loss: 0.9653, test_f1: 0.5585
 epoch: 59, train_loss: 0.7592, test_loss: 0.9716, test_f1: 0.5527
 epoch: 60, train_loss: 0.7483, test_loss: 0.9755, test_f1: 0.5651
 epoch: 61, train_loss: 0.7570, test_loss: 0.9678, test_f1: 0.5650
 epoch: 62, train_loss: 0.7559, test_loss: 0.9718, test_f1: 0.5552
 epoch: 63, train_loss: 0.7456, test_loss: 0.9699, test_f1: 0.5697
 epoch: 64, train_loss: 0.7592, test_loss: 0.9936, test_f1: 0.5589
 epoch: 65, train_loss: 0.7492, test_loss: 0.9905, test_f1: 0.5470
 epoch: 66, train_loss: 0.7528, test_loss: 0.9867, test_f1: 0.5654
 epoch: 67, train_loss: 0.7519, test_loss: 0.9778, test_f1: 0.5657
 epoch: 68, train_loss: 0.7445, test_loss: 0.9795, test_f1: 0.5622
 epoch: 69, train_loss: 0.7555, test_loss: 0.9783, test_f1: 0.5549
 epoch: 70, train_loss: 0.7442, test_loss: 0.9781, test_f1: 0.5715
 epoch: 71, train_loss: 0.7417, test_loss: 0.9762, test_f1: 0.5648
 epoch: 72, train_loss: 0.7455, test_loss: 0.9721, test_f1: 0.5589
 epoch: 73, train_loss: 0.7394, test_loss: 0.9816, test_f1: 0.5664
 epoch: 74, train_loss: 0.7369, test_loss: 0.9829, test_f1: 0.5681
 epoch: 75, train_loss: 0.7304, test_loss: 0.9812, test_f1: 0.5518
 epoch: 76, train_loss: 0.7275, test_loss: 0.9899, test_f1: 0.5586
 epoch: 77, train_loss: 0.7275, test_loss: 0.9846, test_f1: 0.5568
 epoch: 78, train_loss: 0.7214, test_loss: 0.9863, test_f1: 0.5661
 epoch: 79, train_loss: 0.7242, test_loss: 0.9800, test_f1: 0.5644
 epoch: 80, train_loss: 0.7298, test_loss: 0.9861, test_f1: 0.5510
 epoch: 81, train_loss: 0.7242, test_loss: 0.9810, test_f1: 0.5558
 epoch: 82, train_loss: 0.7311, test_loss: 0.9784, test_f1: 0.5578
 epoch: 83, train_loss: 0.7256, test_loss: 0.9868, test_f1: 0.5619
 epoch: 84, train_loss: 0.7285, test_loss: 0.9817, test_f1: 0.5846
 epoch: 85, train_loss: 0.7150, test_loss: 0.9984, test_f1: 0.5610
 epoch: 86, train_loss: 0.7219, test_loss: 0.9985, test_f1: 0.5636
 epoch: 87, train_loss: 0.7321, test_loss: 1.0005, test_f1: 0.5709
 epoch: 88, train_loss: 0.7139, test_loss: 0.9884, test_f1: 0.5560
 epoch: 89, train_loss: 0.7309, test_loss: 1.0008, test_f1: 0.5672
 epoch: 90, train_loss: 0.7245, test_loss: 0.9909, test_f1: 0.5648
 epoch: 91, train_loss: 0.7106, test_loss: 0.9774, test_f1: 0.5586
 epoch: 92, train_loss: 0.7124, test_loss: 0.9790, test_f1: 0.5585
 epoch: 93, train_loss: 0.7082, test_loss: 0.9781, test_f1: 0.5643
 epoch: 94, train_loss: 0.7020, test_loss: 0.9817, test_f1: 0.5693
 epoch: 95, train_loss: 0.6998, test_loss: 0.9875, test_f1: 0.5709
 epoch: 96, train_loss: 0.7032, test_loss: 0.9875, test_f1: 0.5523
 epoch: 97, train_loss: 0.7121, test_loss: 0.9876, test_f1: 0.5774
 epoch: 98, train_loss: 0.7010, test_loss: 0.9936, test_f1: 0.5798
 epoch: 99, train_loss: 0.7064, test_loss: 0.9916, test_f1: 0.5793
##################ITERATION #9 ****************************************
 epoch: 0, train_loss: 1.3192, test_loss: 1.2377, test_f1: 0.2825
 epoch: 1, train_loss: 1.1764, test_loss: 1.0859, test_f1: 0.4274
 epoch: 2, train_loss: 1.1472, test_loss: 1.0534, test_f1: 0.4528
 epoch: 3, train_loss: 1.1129, test_loss: 1.0263, test_f1: 0.4831
 epoch: 4, train_loss: 1.0868, test_loss: 1.0130, test_f1: 0.4752
 epoch: 5, train_loss: 1.0600, test_loss: 0.9846, test_f1: 0.5015
 epoch: 6, train_loss: 1.0490, test_loss: 0.9667, test_f1: 0.4724
 epoch: 7, train_loss: 1.0304, test_loss: 0.9726, test_f1: 0.4900
 epoch: 8, train_loss: 1.0163, test_loss: 0.9542, test_f1: 0.4972
 epoch: 9, train_loss: 0.9991, test_loss: 0.9573, test_f1: 0.5162
 epoch: 10, train_loss: 0.9898, test_loss: 0.9504, test_f1: 0.5030
 epoch: 11, train_loss: 0.9909, test_loss: 0.9422, test_f1: 0.5055
 epoch: 12, train_loss: 0.9818, test_loss: 0.9529, test_f1: 0.5039
 epoch: 13, train_loss: 0.9697, test_loss: 0.9411, test_f1: 0.4865
 epoch: 14, train_loss: 0.9548, test_loss: 0.9470, test_f1: 0.5130
 epoch: 15, train_loss: 0.9623, test_loss: 0.9417, test_f1: 0.5096
 epoch: 16, train_loss: 0.9481, test_loss: 0.9395, test_f1: 0.5023
 epoch: 17, train_loss: 0.9426, test_loss: 0.9329, test_f1: 0.5082
 epoch: 18, train_loss: 0.9344, test_loss: 0.9384, test_f1: 0.5009
 epoch: 19, train_loss: 0.9197, test_loss: 0.9347, test_f1: 0.4995
 epoch: 20, train_loss: 0.9215, test_loss: 0.9272, test_f1: 0.5036
 epoch: 21, train_loss: 0.9137, test_loss: 0.9248, test_f1: 0.5188
 epoch: 22, train_loss: 0.9112, test_loss: 0.9245, test_f1: 0.5223
 epoch: 23, train_loss: 0.8972, test_loss: 0.9332, test_f1: 0.5017
 epoch: 24, train_loss: 0.8921, test_loss: 0.9358, test_f1: 0.5172
 epoch: 25, train_loss: 0.8953, test_loss: 0.9459, test_f1: 0.5249
 epoch: 26, train_loss: 0.8808, test_loss: 0.9197, test_f1: 0.5134
 epoch: 27, train_loss: 0.8889, test_loss: 0.9262, test_f1: 0.5139
 epoch: 28, train_loss: 0.8856, test_loss: 0.9288, test_f1: 0.5203
 epoch: 29, train_loss: 0.8724, test_loss: 0.9367, test_f1: 0.5225
 epoch: 30, train_loss: 0.8668, test_loss: 0.9373, test_f1: 0.5264
 epoch: 31, train_loss: 0.8669, test_loss: 0.9224, test_f1: 0.5279
 epoch: 32, train_loss: 0.8613, test_loss: 0.9384, test_f1: 0.5223
 epoch: 33, train_loss: 0.8600, test_loss: 0.9204, test_f1: 0.5354
 epoch: 34, train_loss: 0.8550, test_loss: 0.9225, test_f1: 0.5363
 epoch: 35, train_loss: 0.8443, test_loss: 0.9268, test_f1: 0.5259
 epoch: 36, train_loss: 0.8448, test_loss: 0.9405, test_f1: 0.5384
 epoch: 37, train_loss: 0.8389, test_loss: 0.9324, test_f1: 0.5233
 epoch: 38, train_loss: 0.8465, test_loss: 0.9262, test_f1: 0.5475
 epoch: 39, train_loss: 0.8414, test_loss: 0.9244, test_f1: 0.5418
 epoch: 40, train_loss: 0.8205, test_loss: 0.9505, test_f1: 0.5429
 epoch: 41, train_loss: 0.8277, test_loss: 0.9423, test_f1: 0.5462
 epoch: 42, train_loss: 0.8340, test_loss: 0.9362, test_f1: 0.5479
 epoch: 43, train_loss: 0.8198, test_loss: 0.9357, test_f1: 0.5376
 epoch: 44, train_loss: 0.8134, test_loss: 0.9405, test_f1: 0.5520
 epoch: 45, train_loss: 0.8136, test_loss: 0.9307, test_f1: 0.5498
 epoch: 46, train_loss: 0.8053, test_loss: 0.9410, test_f1: 0.5519
 epoch: 47, train_loss: 0.8046, test_loss: 0.9399, test_f1: 0.5426
 epoch: 48, train_loss: 0.8135, test_loss: 0.9271, test_f1: 0.5471
 epoch: 49, train_loss: 0.8117, test_loss: 0.9373, test_f1: 0.5582
 epoch: 50, train_loss: 0.8011, test_loss: 0.9560, test_f1: 0.5493
 epoch: 51, train_loss: 0.7905, test_loss: 0.9442, test_f1: 0.5486
 epoch: 52, train_loss: 0.7876, test_loss: 0.9399, test_f1: 0.5514
 epoch: 53, train_loss: 0.7931, test_loss: 0.9346, test_f1: 0.5551
 epoch: 54, train_loss: 0.7862, test_loss: 0.9365, test_f1: 0.5527
 epoch: 55, train_loss: 0.7791, test_loss: 0.9299, test_f1: 0.5584
 epoch: 56, train_loss: 0.7789, test_loss: 0.9218, test_f1: 0.5703
 epoch: 57, train_loss: 0.7795, test_loss: 0.9383, test_f1: 0.5564
 epoch: 58, train_loss: 0.7776, test_loss: 0.9337, test_f1: 0.5770
 epoch: 59, train_loss: 0.7714, test_loss: 0.9337, test_f1: 0.5615
 epoch: 60, train_loss: 0.7779, test_loss: 0.9348, test_f1: 0.5714
 epoch: 61, train_loss: 0.7691, test_loss: 0.9451, test_f1: 0.5541
 epoch: 62, train_loss: 0.7744, test_loss: 0.9380, test_f1: 0.5632
 epoch: 63, train_loss: 0.7661, test_loss: 0.9463, test_f1: 0.5553
 epoch: 64, train_loss: 0.7591, test_loss: 0.9405, test_f1: 0.5610
 epoch: 65, train_loss: 0.7801, test_loss: 0.9463, test_f1: 0.5793
 epoch: 66, train_loss: 0.7679, test_loss: 0.9403, test_f1: 0.5541
 epoch: 67, train_loss: 0.7696, test_loss: 0.9438, test_f1: 0.5592
 epoch: 68, train_loss: 0.7665, test_loss: 0.9381, test_f1: 0.5583
 epoch: 69, train_loss: 0.7613, test_loss: 0.9420, test_f1: 0.5864
 epoch: 70, train_loss: 0.7656, test_loss: 0.9340, test_f1: 0.5564
 epoch: 71, train_loss: 0.7629, test_loss: 0.9366, test_f1: 0.5693
 epoch: 72, train_loss: 0.7594, test_loss: 0.9345, test_f1: 0.5785
 epoch: 73, train_loss: 0.7560, test_loss: 0.9339, test_f1: 0.5702
 epoch: 74, train_loss: 0.7505, test_loss: 0.9364, test_f1: 0.5753
 epoch: 75, train_loss: 0.7477, test_loss: 0.9616, test_f1: 0.5652
 epoch: 76, train_loss: 0.7550, test_loss: 0.9520, test_f1: 0.5694
 epoch: 77, train_loss: 0.7362, test_loss: 0.9422, test_f1: 0.5710
 epoch: 78, train_loss: 0.7443, test_loss: 0.9551, test_f1: 0.5777
 epoch: 79, train_loss: 0.7413, test_loss: 0.9378, test_f1: 0.5835
 epoch: 80, train_loss: 0.7319, test_loss: 0.9295, test_f1: 0.5898
 epoch: 81, train_loss: 0.7349, test_loss: 0.9451, test_f1: 0.5786
 epoch: 82, train_loss: 0.7422, test_loss: 0.9488, test_f1: 0.5729
 epoch: 83, train_loss: 0.7354, test_loss: 0.9499, test_f1: 0.5848
 epoch: 84, train_loss: 0.7369, test_loss: 0.9448, test_f1: 0.5624
 epoch: 85, train_loss: 0.7420, test_loss: 0.9372, test_f1: 0.5733
 epoch: 86, train_loss: 0.7268, test_loss: 0.9320, test_f1: 0.5733
 epoch: 87, train_loss: 0.7361, test_loss: 0.9308, test_f1: 0.5714
 epoch: 88, train_loss: 0.7315, test_loss: 0.9259, test_f1: 0.5763
 epoch: 89, train_loss: 0.7255, test_loss: 0.9339, test_f1: 0.5976
 epoch: 90, train_loss: 0.7214, test_loss: 0.9371, test_f1: 0.5745
 epoch: 91, train_loss: 0.7209, test_loss: 0.9294, test_f1: 0.5725
 epoch: 92, train_loss: 0.7137, test_loss: 0.9409, test_f1: 0.5848
 epoch: 93, train_loss: 0.7330, test_loss: 0.9453, test_f1: 0.5846
 epoch: 94, train_loss: 0.7244, test_loss: 0.9534, test_f1: 0.5689
 epoch: 95, train_loss: 0.7321, test_loss: 0.9420, test_f1: 0.5845
 epoch: 96, train_loss: 0.7171, test_loss: 0.9453, test_f1: 0.6049
 epoch: 97, train_loss: 0.7221, test_loss: 0.9487, test_f1: 0.6079
 epoch: 98, train_loss: 0.7159, test_loss: 0.9638, test_f1: 0.5769
 epoch: 99, train_loss: 0.7228, test_loss: 0.9442, test_f1: 0.5951

Training completed in 861.92 seconds
Best F1: 0.6224 at epoch 99
Mean F1 across iterations: 0.6056  0.0129
========================FINAL RESULTS================================
FEGIN weighted F1: 0.6224  0.0129
python main.py --data ltspice_examples --representation component_net --model FEGIN --layers 6 --hiddens 64 --batch_size 64 --lr 0.0001 --emb_size 512 --epochs 100 --save_appendix component_net_L6_H64_BS64_LR0.0001_E512 --no_val
-----



STDERR:
  File "main.py", line 370, in <module>
    main()
  File "main.py", line 254, in main
    dataset = dataset_class(
  File "/home/philip/projects/ltspice_examples_code_repo/Circuit-Completion-Using-GNNs/component_classification_with_link_prediction_head/evaluation/FEGIN/kernel/circuit_datasets.py", line 15, in __init__
    self.data, self.slices = torch.load(self.processed_paths[0])
  File "/home/philip/.local/lib/python3.8/site-packages/torch/serialization.py", line 1040, in load
    warnings.warn(
  File "/usr/lib/python3.8/warnings.py", line 109, in _showwarnmsg
    sw(msg.message, msg.category, msg.filename, msg.lineno,
  File "main.py", line 47, in warn_with_traceback
    traceback.print_stack(file=log)
/home/philip/projects/ltspice_examples_code_repo/Circuit-Completion-Using-GNNs/component_classification_with_link_prediction_head/evaluation/FEGIN/kernel/circuit_datasets.py:15: FutureWarning: You are using `torch.load` with `weights_only=False` (the current default value), which uses the default pickle module implicitly. It is possible to construct malicious pickle data which will execute arbitrary code during unpickling (See https://github.com/pytorch/pytorch/blob/main/SECURITY.md#untrusted-models for more details). In a future release, the default value for `weights_only` will be flipped to `True`. This limits the functions that could be executed during unpickling. Arbitrary objects will no longer be allowed to be loaded via this mode unless they are explicitly allowlisted by the user via `torch.serialization.add_safe_globals`. We recommend you start setting `weights_only=True` for any use case where you don't have full control of the loaded file. Please open an issue on GitHub for any issues related to this experimental feature.
  self.data, self.slices = torch.load(self.processed_paths[0])
