STDOUT:
Results will be saved in /home/philip/projects/ltspice_examples_code_repo/Circuit-Completion-Using-GNNs/component_classification_with_link_prediction_head/evaluation/FEGIN/results/model_FEGIN_dataset_ltspice_demos
Command line input: python main.py --data ltspice_demos --representation component_net --model FEGIN --layers 2 --hiddens 64 --batch_size 64 --lr 0.0001 --emb_size 128 --epochs 100 --save_appendix component_net_L2_H64_BS64_LR0.0001_E128 --no_val
 is saved.
-----
ltspice_demos - FEGIN
Using 2 layers, 64 hidden units, h = 2
Loading component_net representation dataset
ENTERED
Training FEGIN on component_net representation
Train: 1565, Test: 383
##################ITERATION #0 ****************************************
 epoch: 0, train_loss: 1.3706, test_loss: 1.3641, test_f1: 0.2281
 epoch: 1, train_loss: 1.3594, test_loss: 1.3595, test_f1: 0.2281
 epoch: 2, train_loss: 1.3531, test_loss: 1.3543, test_f1: 0.2281
 epoch: 3, train_loss: 1.3457, test_loss: 1.3491, test_f1: 0.2281
 epoch: 4, train_loss: 1.3373, test_loss: 1.3428, test_f1: 0.2281
 epoch: 5, train_loss: 1.3277, test_loss: 1.3358, test_f1: 0.2281
 epoch: 6, train_loss: 1.3146, test_loss: 1.3270, test_f1: 0.2281
 epoch: 7, train_loss: 1.2989, test_loss: 1.3169, test_f1: 0.2281
 epoch: 8, train_loss: 1.2836, test_loss: 1.3045, test_f1: 0.2629
 epoch: 9, train_loss: 1.2626, test_loss: 1.2913, test_f1: 0.2720
 epoch: 10, train_loss: 1.2430, test_loss: 1.2775, test_f1: 0.2720
 epoch: 11, train_loss: 1.2220, test_loss: 1.2629, test_f1: 0.2720
 epoch: 12, train_loss: 1.2066, test_loss: 1.2506, test_f1: 0.2912
 epoch: 13, train_loss: 1.1854, test_loss: 1.2395, test_f1: 0.3258
 epoch: 14, train_loss: 1.1736, test_loss: 1.2285, test_f1: 0.3256
 epoch: 15, train_loss: 1.1601, test_loss: 1.2197, test_f1: 0.3309
 epoch: 16, train_loss: 1.1470, test_loss: 1.2115, test_f1: 0.3368
 epoch: 17, train_loss: 1.1367, test_loss: 1.2048, test_f1: 0.3436
 epoch: 18, train_loss: 1.1251, test_loss: 1.1964, test_f1: 0.3494
 epoch: 19, train_loss: 1.1135, test_loss: 1.1884, test_f1: 0.3546
 epoch: 20, train_loss: 1.0985, test_loss: 1.1843, test_f1: 0.3686
 epoch: 21, train_loss: 1.0934, test_loss: 1.1793, test_f1: 0.3801
 epoch: 22, train_loss: 1.0840, test_loss: 1.1736, test_f1: 0.3825
 epoch: 23, train_loss: 1.0766, test_loss: 1.1645, test_f1: 0.3860
 epoch: 24, train_loss: 1.0645, test_loss: 1.1642, test_f1: 0.3913
 epoch: 25, train_loss: 1.0663, test_loss: 1.1547, test_f1: 0.3948
 epoch: 26, train_loss: 1.0489, test_loss: 1.1558, test_f1: 0.3971
 epoch: 27, train_loss: 1.0482, test_loss: 1.1415, test_f1: 0.3928
 epoch: 28, train_loss: 1.0349, test_loss: 1.1443, test_f1: 0.4062
 epoch: 29, train_loss: 1.0339, test_loss: 1.1423, test_f1: 0.4100
 epoch: 30, train_loss: 1.0287, test_loss: 1.1330, test_f1: 0.4266
 epoch: 31, train_loss: 1.0209, test_loss: 1.1296, test_f1: 0.4151
 epoch: 32, train_loss: 1.0113, test_loss: 1.1275, test_f1: 0.4237
 epoch: 33, train_loss: 1.0040, test_loss: 1.1229, test_f1: 0.4354
 epoch: 34, train_loss: 1.0073, test_loss: 1.1153, test_f1: 0.4282
 epoch: 35, train_loss: 1.0000, test_loss: 1.1122, test_f1: 0.4597
 epoch: 36, train_loss: 0.9940, test_loss: 1.1152, test_f1: 0.4534
 epoch: 37, train_loss: 0.9840, test_loss: 1.1051, test_f1: 0.4522
 epoch: 38, train_loss: 0.9868, test_loss: 1.1044, test_f1: 0.4664
 epoch: 39, train_loss: 0.9722, test_loss: 1.1179, test_f1: 0.4629
 epoch: 40, train_loss: 0.9701, test_loss: 1.1011, test_f1: 0.4593
 epoch: 41, train_loss: 0.9657, test_loss: 1.0983, test_f1: 0.4625
 epoch: 42, train_loss: 0.9648, test_loss: 1.0932, test_f1: 0.4674
 epoch: 43, train_loss: 0.9514, test_loss: 1.1067, test_f1: 0.4674
 epoch: 44, train_loss: 0.9589, test_loss: 1.0966, test_f1: 0.4646
 epoch: 45, train_loss: 0.9527, test_loss: 1.0800, test_f1: 0.4663
 epoch: 46, train_loss: 0.9418, test_loss: 1.0953, test_f1: 0.4695
 epoch: 47, train_loss: 0.9422, test_loss: 1.0932, test_f1: 0.4792
 epoch: 48, train_loss: 0.9356, test_loss: 1.0884, test_f1: 0.4828
 epoch: 49, train_loss: 0.9339, test_loss: 1.0933, test_f1: 0.4663
 epoch: 50, train_loss: 0.9262, test_loss: 1.0886, test_f1: 0.4816
 epoch: 51, train_loss: 0.9239, test_loss: 1.0810, test_f1: 0.4784
 epoch: 52, train_loss: 0.9198, test_loss: 1.0852, test_f1: 0.4768
 epoch: 53, train_loss: 0.9308, test_loss: 1.0940, test_f1: 0.4778
 epoch: 54, train_loss: 0.9203, test_loss: 1.0792, test_f1: 0.4863
 epoch: 55, train_loss: 0.9203, test_loss: 1.0822, test_f1: 0.4863
 epoch: 56, train_loss: 0.9159, test_loss: 1.0735, test_f1: 0.4822
 epoch: 57, train_loss: 0.9199, test_loss: 1.0767, test_f1: 0.4747
 epoch: 58, train_loss: 0.9078, test_loss: 1.0856, test_f1: 0.4873
 epoch: 59, train_loss: 0.9051, test_loss: 1.0817, test_f1: 0.4823
 epoch: 60, train_loss: 0.9111, test_loss: 1.0671, test_f1: 0.4957
 epoch: 61, train_loss: 0.9039, test_loss: 1.0772, test_f1: 0.5000
 epoch: 62, train_loss: 0.9160, test_loss: 1.0760, test_f1: 0.4886
 epoch: 63, train_loss: 0.8961, test_loss: 1.0836, test_f1: 0.4980
 epoch: 64, train_loss: 0.9019, test_loss: 1.0847, test_f1: 0.4784
 epoch: 65, train_loss: 0.9012, test_loss: 1.0810, test_f1: 0.4891
 epoch: 66, train_loss: 0.8937, test_loss: 1.0863, test_f1: 0.5051
 epoch: 67, train_loss: 0.8993, test_loss: 1.0975, test_f1: 0.4948
 epoch: 68, train_loss: 0.8980, test_loss: 1.0870, test_f1: 0.4940
 epoch: 69, train_loss: 0.8939, test_loss: 1.0839, test_f1: 0.4991
 epoch: 70, train_loss: 0.8950, test_loss: 1.0760, test_f1: 0.5051
 epoch: 71, train_loss: 0.8972, test_loss: 1.0802, test_f1: 0.5009
 epoch: 72, train_loss: 0.8909, test_loss: 1.0993, test_f1: 0.4877
 epoch: 73, train_loss: 0.8913, test_loss: 1.1016, test_f1: 0.4985
 epoch: 74, train_loss: 0.8837, test_loss: 1.0851, test_f1: 0.4996
 epoch: 75, train_loss: 0.8896, test_loss: 1.0938, test_f1: 0.4996
 epoch: 76, train_loss: 0.8896, test_loss: 1.0864, test_f1: 0.5001
 epoch: 77, train_loss: 0.8925, test_loss: 1.0804, test_f1: 0.5072
 epoch: 78, train_loss: 0.8906, test_loss: 1.0905, test_f1: 0.5119
 epoch: 79, train_loss: 0.8914, test_loss: 1.0872, test_f1: 0.5056
 epoch: 80, train_loss: 0.8802, test_loss: 1.1063, test_f1: 0.5250
 epoch: 81, train_loss: 0.8812, test_loss: 1.0934, test_f1: 0.4959
 epoch: 82, train_loss: 0.8809, test_loss: 1.1010, test_f1: 0.5027
 epoch: 83, train_loss: 0.8732, test_loss: 1.0969, test_f1: 0.5121
 epoch: 84, train_loss: 0.8724, test_loss: 1.0986, test_f1: 0.5065
 epoch: 85, train_loss: 0.8681, test_loss: 1.0848, test_f1: 0.5074
 epoch: 86, train_loss: 0.8722, test_loss: 1.0980, test_f1: 0.5044
 epoch: 87, train_loss: 0.8763, test_loss: 1.0952, test_f1: 0.5163
 epoch: 88, train_loss: 0.8789, test_loss: 1.0948, test_f1: 0.5109
 epoch: 89, train_loss: 0.8689, test_loss: 1.1006, test_f1: 0.5059
 epoch: 90, train_loss: 0.8765, test_loss: 1.1029, test_f1: 0.5163
 epoch: 91, train_loss: 0.8573, test_loss: 1.0933, test_f1: 0.5221
 epoch: 92, train_loss: 0.8605, test_loss: 1.1035, test_f1: 0.5184
 epoch: 93, train_loss: 0.8751, test_loss: 1.1077, test_f1: 0.5092
 epoch: 94, train_loss: 0.8564, test_loss: 1.1144, test_f1: 0.5080
 epoch: 95, train_loss: 0.8714, test_loss: 1.1056, test_f1: 0.5106
 epoch: 96, train_loss: 0.8625, test_loss: 1.1065, test_f1: 0.5213
 epoch: 97, train_loss: 0.8577, test_loss: 1.0887, test_f1: 0.5164
 epoch: 98, train_loss: 0.8550, test_loss: 1.0898, test_f1: 0.5309
 epoch: 99, train_loss: 0.8487, test_loss: 1.1029, test_f1: 0.5301
##################ITERATION #1 ****************************************
 epoch: 0, train_loss: 1.3116, test_loss: 1.3315, test_f1: 0.2281
 epoch: 1, train_loss: 1.2715, test_loss: 1.3150, test_f1: 0.2281
 epoch: 2, train_loss: 1.2509, test_loss: 1.2922, test_f1: 0.2281
 epoch: 3, train_loss: 1.2262, test_loss: 1.2743, test_f1: 0.2639
 epoch: 4, train_loss: 1.2039, test_loss: 1.2607, test_f1: 0.2744
 epoch: 5, train_loss: 1.1881, test_loss: 1.2476, test_f1: 0.2794
 epoch: 6, train_loss: 1.1736, test_loss: 1.2387, test_f1: 0.2784
 epoch: 7, train_loss: 1.1591, test_loss: 1.2263, test_f1: 0.2861
 epoch: 8, train_loss: 1.1415, test_loss: 1.2146, test_f1: 0.3102
 epoch: 9, train_loss: 1.1229, test_loss: 1.2026, test_f1: 0.3667
 epoch: 10, train_loss: 1.1160, test_loss: 1.1922, test_f1: 0.3788
 epoch: 11, train_loss: 1.1002, test_loss: 1.1806, test_f1: 0.3790
 epoch: 12, train_loss: 1.0916, test_loss: 1.1700, test_f1: 0.3822
 epoch: 13, train_loss: 1.0829, test_loss: 1.1646, test_f1: 0.3937
 epoch: 14, train_loss: 1.0750, test_loss: 1.1601, test_f1: 0.4120
 epoch: 15, train_loss: 1.0642, test_loss: 1.1535, test_f1: 0.4030
 epoch: 16, train_loss: 1.0517, test_loss: 1.1447, test_f1: 0.4109
 epoch: 17, train_loss: 1.0428, test_loss: 1.1365, test_f1: 0.4269
 epoch: 18, train_loss: 1.0325, test_loss: 1.1295, test_f1: 0.4134
 epoch: 19, train_loss: 1.0273, test_loss: 1.1230, test_f1: 0.4184
 epoch: 20, train_loss: 1.0222, test_loss: 1.1245, test_f1: 0.4197
 epoch: 21, train_loss: 1.0108, test_loss: 1.1102, test_f1: 0.4142
 epoch: 22, train_loss: 1.0132, test_loss: 1.1092, test_f1: 0.4152
 epoch: 23, train_loss: 0.9932, test_loss: 1.1145, test_f1: 0.4271
 epoch: 24, train_loss: 0.9996, test_loss: 1.0939, test_f1: 0.4224
 epoch: 25, train_loss: 0.9896, test_loss: 1.0927, test_f1: 0.4407
 epoch: 26, train_loss: 0.9814, test_loss: 1.0946, test_f1: 0.4312
 epoch: 27, train_loss: 0.9680, test_loss: 1.0819, test_f1: 0.4575
 epoch: 28, train_loss: 0.9662, test_loss: 1.0742, test_f1: 0.4650
 epoch: 29, train_loss: 0.9611, test_loss: 1.0831, test_f1: 0.4651
 epoch: 30, train_loss: 0.9624, test_loss: 1.0736, test_f1: 0.4808
 epoch: 31, train_loss: 0.9548, test_loss: 1.0616, test_f1: 0.4928
 epoch: 32, train_loss: 0.9523, test_loss: 1.0603, test_f1: 0.4780
 epoch: 33, train_loss: 0.9416, test_loss: 1.0644, test_f1: 0.4967
 epoch: 34, train_loss: 0.9411, test_loss: 1.0502, test_f1: 0.4886
 epoch: 35, train_loss: 0.9339, test_loss: 1.0679, test_f1: 0.4914
 epoch: 36, train_loss: 0.9296, test_loss: 1.0506, test_f1: 0.4973
 epoch: 37, train_loss: 0.9248, test_loss: 1.0607, test_f1: 0.5240
 epoch: 38, train_loss: 0.9232, test_loss: 1.0568, test_f1: 0.5101
 epoch: 39, train_loss: 0.9192, test_loss: 1.0556, test_f1: 0.4995
 epoch: 40, train_loss: 0.9226, test_loss: 1.0512, test_f1: 0.5027
 epoch: 41, train_loss: 0.9132, test_loss: 1.0437, test_f1: 0.5073
 epoch: 42, train_loss: 0.9040, test_loss: 1.0484, test_f1: 0.4976
 epoch: 43, train_loss: 0.9036, test_loss: 1.0410, test_f1: 0.5300
 epoch: 44, train_loss: 0.9020, test_loss: 1.0607, test_f1: 0.5047
 epoch: 45, train_loss: 0.8975, test_loss: 1.0486, test_f1: 0.5253
 epoch: 46, train_loss: 0.8949, test_loss: 1.0503, test_f1: 0.5152
 epoch: 47, train_loss: 0.8884, test_loss: 1.0430, test_f1: 0.5185
 epoch: 48, train_loss: 0.8825, test_loss: 1.0474, test_f1: 0.5265
 epoch: 49, train_loss: 0.8955, test_loss: 1.0489, test_f1: 0.5119
 epoch: 50, train_loss: 0.8866, test_loss: 1.0629, test_f1: 0.5289
 epoch: 51, train_loss: 0.8854, test_loss: 1.0578, test_f1: 0.5437
 epoch: 52, train_loss: 0.8778, test_loss: 1.0586, test_f1: 0.5487
 epoch: 53, train_loss: 0.8712, test_loss: 1.0557, test_f1: 0.5327
 epoch: 54, train_loss: 0.8859, test_loss: 1.0596, test_f1: 0.5387
 epoch: 55, train_loss: 0.8784, test_loss: 1.0626, test_f1: 0.5444
 epoch: 56, train_loss: 0.8810, test_loss: 1.0652, test_f1: 0.5351
 epoch: 57, train_loss: 0.8735, test_loss: 1.0645, test_f1: 0.5295
 epoch: 58, train_loss: 0.8670, test_loss: 1.0569, test_f1: 0.5483
 epoch: 59, train_loss: 0.8639, test_loss: 1.0742, test_f1: 0.5438
 epoch: 60, train_loss: 0.8724, test_loss: 1.0561, test_f1: 0.5296
 epoch: 61, train_loss: 0.8662, test_loss: 1.0491, test_f1: 0.5475
 epoch: 62, train_loss: 0.8606, test_loss: 1.0577, test_f1: 0.5416
 epoch: 63, train_loss: 0.8537, test_loss: 1.0514, test_f1: 0.5591
 epoch: 64, train_loss: 0.8726, test_loss: 1.0662, test_f1: 0.5436
 epoch: 65, train_loss: 0.8590, test_loss: 1.0574, test_f1: 0.5451
 epoch: 66, train_loss: 0.8661, test_loss: 1.0531, test_f1: 0.5499
 epoch: 67, train_loss: 0.8702, test_loss: 1.0558, test_f1: 0.5478
 epoch: 68, train_loss: 0.8603, test_loss: 1.0594, test_f1: 0.5488
 epoch: 69, train_loss: 0.8632, test_loss: 1.0549, test_f1: 0.5475
 epoch: 70, train_loss: 0.8610, test_loss: 1.0605, test_f1: 0.5538
 epoch: 71, train_loss: 0.8579, test_loss: 1.0523, test_f1: 0.5516
 epoch: 72, train_loss: 0.8560, test_loss: 1.0571, test_f1: 0.5550
 epoch: 73, train_loss: 0.8558, test_loss: 1.0752, test_f1: 0.5563
 epoch: 74, train_loss: 0.8581, test_loss: 1.0448, test_f1: 0.5347
 epoch: 75, train_loss: 0.8533, test_loss: 1.0637, test_f1: 0.5501
 epoch: 76, train_loss: 0.8665, test_loss: 1.0723, test_f1: 0.5598
 epoch: 77, train_loss: 0.8588, test_loss: 1.0715, test_f1: 0.5608
 epoch: 78, train_loss: 0.8503, test_loss: 1.0632, test_f1: 0.5641
 epoch: 79, train_loss: 0.8475, test_loss: 1.0577, test_f1: 0.5531
 epoch: 80, train_loss: 0.8573, test_loss: 1.0624, test_f1: 0.5471
 epoch: 81, train_loss: 0.8498, test_loss: 1.0677, test_f1: 0.5594
 epoch: 82, train_loss: 0.8524, test_loss: 1.0482, test_f1: 0.5703
 epoch: 83, train_loss: 0.8426, test_loss: 1.0553, test_f1: 0.5625
 epoch: 84, train_loss: 0.8477, test_loss: 1.0660, test_f1: 0.5555
 epoch: 85, train_loss: 0.8411, test_loss: 1.0668, test_f1: 0.5628
 epoch: 86, train_loss: 0.8463, test_loss: 1.0515, test_f1: 0.5720
 epoch: 87, train_loss: 0.8397, test_loss: 1.0614, test_f1: 0.5564
 epoch: 88, train_loss: 0.8443, test_loss: 1.0676, test_f1: 0.5598
 epoch: 89, train_loss: 0.8452, test_loss: 1.0763, test_f1: 0.5573
 epoch: 90, train_loss: 0.8374, test_loss: 1.0660, test_f1: 0.5556
 epoch: 91, train_loss: 0.8346, test_loss: 1.0775, test_f1: 0.5634
 epoch: 92, train_loss: 0.8358, test_loss: 1.0801, test_f1: 0.5706
 epoch: 93, train_loss: 0.8433, test_loss: 1.0696, test_f1: 0.5726
 epoch: 94, train_loss: 0.8325, test_loss: 1.0753, test_f1: 0.5580
 epoch: 95, train_loss: 0.8373, test_loss: 1.0697, test_f1: 0.5557
 epoch: 96, train_loss: 0.8285, test_loss: 1.0719, test_f1: 0.5580
 epoch: 97, train_loss: 0.8309, test_loss: 1.0754, test_f1: 0.5612
 epoch: 98, train_loss: 0.8206, test_loss: 1.0693, test_f1: 0.5690
 epoch: 99, train_loss: 0.8236, test_loss: 1.0571, test_f1: 0.5709
##################ITERATION #2 ****************************************
 epoch: 0, train_loss: 1.3060, test_loss: 1.3206, test_f1: 0.2281
 epoch: 1, train_loss: 1.2412, test_loss: 1.2868, test_f1: 0.2281
 epoch: 2, train_loss: 1.2149, test_loss: 1.2573, test_f1: 0.2336
 epoch: 3, train_loss: 1.1914, test_loss: 1.2363, test_f1: 0.2390
 epoch: 4, train_loss: 1.1652, test_loss: 1.2195, test_f1: 0.2857
 epoch: 5, train_loss: 1.1449, test_loss: 1.2032, test_f1: 0.3063
 epoch: 6, train_loss: 1.1265, test_loss: 1.1896, test_f1: 0.3464
 epoch: 7, train_loss: 1.1090, test_loss: 1.1821, test_f1: 0.3458
 epoch: 8, train_loss: 1.0958, test_loss: 1.1707, test_f1: 0.3508
 epoch: 9, train_loss: 1.0845, test_loss: 1.1640, test_f1: 0.3562
 epoch: 10, train_loss: 1.0692, test_loss: 1.1598, test_f1: 0.3517
 epoch: 11, train_loss: 1.0699, test_loss: 1.1524, test_f1: 0.3499
 epoch: 12, train_loss: 1.0593, test_loss: 1.1505, test_f1: 0.3519
 epoch: 13, train_loss: 1.0457, test_loss: 1.1437, test_f1: 0.3521
 epoch: 14, train_loss: 1.0357, test_loss: 1.1340, test_f1: 0.3546
 epoch: 15, train_loss: 1.0387, test_loss: 1.1263, test_f1: 0.3525
 epoch: 16, train_loss: 1.0364, test_loss: 1.1271, test_f1: 0.3579
 epoch: 17, train_loss: 1.0168, test_loss: 1.1289, test_f1: 0.3712
 epoch: 18, train_loss: 1.0141, test_loss: 1.1264, test_f1: 0.4342
 epoch: 19, train_loss: 1.0151, test_loss: 1.1177, test_f1: 0.4255
 epoch: 20, train_loss: 1.0168, test_loss: 1.1131, test_f1: 0.4365
 epoch: 21, train_loss: 1.0018, test_loss: 1.1055, test_f1: 0.4391
 epoch: 22, train_loss: 1.0009, test_loss: 1.1100, test_f1: 0.4416
 epoch: 23, train_loss: 0.9876, test_loss: 1.0952, test_f1: 0.4540
 epoch: 24, train_loss: 0.9821, test_loss: 1.1014, test_f1: 0.4563
 epoch: 25, train_loss: 0.9822, test_loss: 1.0885, test_f1: 0.4517
 epoch: 26, train_loss: 0.9704, test_loss: 1.0838, test_f1: 0.4633
 epoch: 27, train_loss: 0.9614, test_loss: 1.0868, test_f1: 0.4583
 epoch: 28, train_loss: 0.9647, test_loss: 1.0804, test_f1: 0.4992
 epoch: 29, train_loss: 0.9649, test_loss: 1.0797, test_f1: 0.4672
 epoch: 30, train_loss: 0.9515, test_loss: 1.0726, test_f1: 0.4767
 epoch: 31, train_loss: 0.9528, test_loss: 1.0710, test_f1: 0.4682
 epoch: 32, train_loss: 0.9479, test_loss: 1.0674, test_f1: 0.4700
 epoch: 33, train_loss: 0.9495, test_loss: 1.0638, test_f1: 0.4720
 epoch: 34, train_loss: 0.9340, test_loss: 1.0707, test_f1: 0.4870
 epoch: 35, train_loss: 0.9289, test_loss: 1.0812, test_f1: 0.5069
 epoch: 36, train_loss: 0.9297, test_loss: 1.0612, test_f1: 0.4952
 epoch: 37, train_loss: 0.9105, test_loss: 1.0658, test_f1: 0.4926
 epoch: 38, train_loss: 0.9227, test_loss: 1.0619, test_f1: 0.5025
 epoch: 39, train_loss: 0.9200, test_loss: 1.0725, test_f1: 0.4978
 epoch: 40, train_loss: 0.9147, test_loss: 1.0639, test_f1: 0.5161
 epoch: 41, train_loss: 0.9111, test_loss: 1.0873, test_f1: 0.5117
 epoch: 42, train_loss: 0.9081, test_loss: 1.0646, test_f1: 0.5108
 epoch: 43, train_loss: 0.9033, test_loss: 1.0721, test_f1: 0.5153
 epoch: 44, train_loss: 0.9039, test_loss: 1.0867, test_f1: 0.5148
 epoch: 45, train_loss: 0.8865, test_loss: 1.0757, test_f1: 0.5106
 epoch: 46, train_loss: 0.8940, test_loss: 1.0747, test_f1: 0.5033
 epoch: 47, train_loss: 0.8846, test_loss: 1.0682, test_f1: 0.4979
 epoch: 48, train_loss: 0.8976, test_loss: 1.0827, test_f1: 0.5055
 epoch: 49, train_loss: 0.8827, test_loss: 1.0948, test_f1: 0.5102
 epoch: 50, train_loss: 0.8816, test_loss: 1.1037, test_f1: 0.5038
 epoch: 51, train_loss: 0.8803, test_loss: 1.0859, test_f1: 0.4898
 epoch: 52, train_loss: 0.8769, test_loss: 1.0896, test_f1: 0.5139
 epoch: 53, train_loss: 0.8766, test_loss: 1.0902, test_f1: 0.4972
 epoch: 54, train_loss: 0.8675, test_loss: 1.1030, test_f1: 0.4989
 epoch: 55, train_loss: 0.8631, test_loss: 1.0987, test_f1: 0.5092
 epoch: 56, train_loss: 0.8627, test_loss: 1.0926, test_f1: 0.4995
 epoch: 57, train_loss: 0.8646, test_loss: 1.0993, test_f1: 0.4992
 epoch: 58, train_loss: 0.8636, test_loss: 1.1026, test_f1: 0.5014
 epoch: 59, train_loss: 0.8643, test_loss: 1.1202, test_f1: 0.4963
 epoch: 60, train_loss: 0.8648, test_loss: 1.0999, test_f1: 0.5061
 epoch: 61, train_loss: 0.8706, test_loss: 1.1091, test_f1: 0.5017
 epoch: 62, train_loss: 0.8602, test_loss: 1.1050, test_f1: 0.5015
 epoch: 63, train_loss: 0.8633, test_loss: 1.1160, test_f1: 0.4989
 epoch: 64, train_loss: 0.8517, test_loss: 1.1261, test_f1: 0.5104
 epoch: 65, train_loss: 0.8635, test_loss: 1.1114, test_f1: 0.5029
 epoch: 66, train_loss: 0.8652, test_loss: 1.1199, test_f1: 0.5083
 epoch: 67, train_loss: 0.8525, test_loss: 1.1166, test_f1: 0.5090
 epoch: 68, train_loss: 0.8595, test_loss: 1.1140, test_f1: 0.5115
 epoch: 69, train_loss: 0.8471, test_loss: 1.1185, test_f1: 0.5083
 epoch: 70, train_loss: 0.8619, test_loss: 1.1197, test_f1: 0.5075
 epoch: 71, train_loss: 0.8412, test_loss: 1.1192, test_f1: 0.5108
 epoch: 72, train_loss: 0.8445, test_loss: 1.1172, test_f1: 0.5245
 epoch: 73, train_loss: 0.8469, test_loss: 1.1163, test_f1: 0.5292
 epoch: 74, train_loss: 0.8403, test_loss: 1.1193, test_f1: 0.5360
 epoch: 75, train_loss: 0.8458, test_loss: 1.1382, test_f1: 0.5184
 epoch: 76, train_loss: 0.8431, test_loss: 1.1402, test_f1: 0.5191
 epoch: 77, train_loss: 0.8368, test_loss: 1.1167, test_f1: 0.5228
 epoch: 78, train_loss: 0.8389, test_loss: 1.1219, test_f1: 0.5220
 epoch: 79, train_loss: 0.8422, test_loss: 1.1250, test_f1: 0.5189
 epoch: 80, train_loss: 0.8486, test_loss: 1.1261, test_f1: 0.5250
 epoch: 81, train_loss: 0.8474, test_loss: 1.1596, test_f1: 0.5110
 epoch: 82, train_loss: 0.8382, test_loss: 1.1404, test_f1: 0.5273
 epoch: 83, train_loss: 0.8410, test_loss: 1.1515, test_f1: 0.5090
 epoch: 84, train_loss: 0.8250, test_loss: 1.1500, test_f1: 0.5134
 epoch: 85, train_loss: 0.8289, test_loss: 1.1370, test_f1: 0.5172
 epoch: 86, train_loss: 0.8388, test_loss: 1.1342, test_f1: 0.5331
 epoch: 87, train_loss: 0.8302, test_loss: 1.1302, test_f1: 0.5195
 epoch: 88, train_loss: 0.8299, test_loss: 1.1499, test_f1: 0.5291
 epoch: 89, train_loss: 0.8271, test_loss: 1.1507, test_f1: 0.5204
 epoch: 90, train_loss: 0.8392, test_loss: 1.1544, test_f1: 0.5132
 epoch: 91, train_loss: 0.8256, test_loss: 1.1577, test_f1: 0.5179
 epoch: 92, train_loss: 0.8217, test_loss: 1.1458, test_f1: 0.5182
 epoch: 93, train_loss: 0.8294, test_loss: 1.1703, test_f1: 0.5185
 epoch: 94, train_loss: 0.8302, test_loss: 1.1474, test_f1: 0.5246
 epoch: 95, train_loss: 0.8180, test_loss: 1.1520, test_f1: 0.5267
 epoch: 96, train_loss: 0.8305, test_loss: 1.1640, test_f1: 0.5170
 epoch: 97, train_loss: 0.8234, test_loss: 1.1696, test_f1: 0.5270
 epoch: 98, train_loss: 0.8219, test_loss: 1.1714, test_f1: 0.5162
 epoch: 99, train_loss: 0.8167, test_loss: 1.1576, test_f1: 0.5126
##################ITERATION #3 ****************************************
 epoch: 0, train_loss: 1.2542, test_loss: 1.3011, test_f1: 0.2281
 epoch: 1, train_loss: 1.1985, test_loss: 1.2799, test_f1: 0.2281
 epoch: 2, train_loss: 1.1706, test_loss: 1.2516, test_f1: 0.2744
 epoch: 3, train_loss: 1.1506, test_loss: 1.2245, test_f1: 0.3116
 epoch: 4, train_loss: 1.1287, test_loss: 1.2103, test_f1: 0.3339
 epoch: 5, train_loss: 1.1215, test_loss: 1.1998, test_f1: 0.3462
 epoch: 6, train_loss: 1.1095, test_loss: 1.1916, test_f1: 0.3973
 epoch: 7, train_loss: 1.0946, test_loss: 1.1829, test_f1: 0.4010
 epoch: 8, train_loss: 1.0860, test_loss: 1.1755, test_f1: 0.4164
 epoch: 9, train_loss: 1.0817, test_loss: 1.1663, test_f1: 0.4104
 epoch: 10, train_loss: 1.0724, test_loss: 1.1620, test_f1: 0.4126
 epoch: 11, train_loss: 1.0632, test_loss: 1.1582, test_f1: 0.4145
 epoch: 12, train_loss: 1.0561, test_loss: 1.1491, test_f1: 0.4163
 epoch: 13, train_loss: 1.0534, test_loss: 1.1451, test_f1: 0.4166
 epoch: 14, train_loss: 1.0404, test_loss: 1.1395, test_f1: 0.4295
 epoch: 15, train_loss: 1.0297, test_loss: 1.1322, test_f1: 0.4333
 epoch: 16, train_loss: 1.0324, test_loss: 1.1233, test_f1: 0.4362
 epoch: 17, train_loss: 1.0260, test_loss: 1.1279, test_f1: 0.4672
 epoch: 18, train_loss: 1.0120, test_loss: 1.1219, test_f1: 0.4598
 epoch: 19, train_loss: 1.0171, test_loss: 1.1195, test_f1: 0.4748
 epoch: 20, train_loss: 0.9994, test_loss: 1.1110, test_f1: 0.4810
 epoch: 21, train_loss: 0.9940, test_loss: 1.1173, test_f1: 0.4897
 epoch: 22, train_loss: 0.9980, test_loss: 1.0997, test_f1: 0.4701
 epoch: 23, train_loss: 0.9907, test_loss: 1.1004, test_f1: 0.4796
 epoch: 24, train_loss: 0.9793, test_loss: 1.0977, test_f1: 0.4767
 epoch: 25, train_loss: 0.9767, test_loss: 1.0959, test_f1: 0.4923
 epoch: 26, train_loss: 0.9785, test_loss: 1.0795, test_f1: 0.4920
 epoch: 27, train_loss: 0.9797, test_loss: 1.0824, test_f1: 0.5003
 epoch: 28, train_loss: 0.9675, test_loss: 1.0696, test_f1: 0.4941
 epoch: 29, train_loss: 0.9628, test_loss: 1.0760, test_f1: 0.4959
 epoch: 30, train_loss: 0.9497, test_loss: 1.0756, test_f1: 0.4800
 epoch: 31, train_loss: 0.9481, test_loss: 1.0700, test_f1: 0.4946
 epoch: 32, train_loss: 0.9500, test_loss: 1.0667, test_f1: 0.5018
 epoch: 33, train_loss: 0.9372, test_loss: 1.0751, test_f1: 0.5143
 epoch: 34, train_loss: 0.9311, test_loss: 1.0698, test_f1: 0.5127
 epoch: 35, train_loss: 0.9255, test_loss: 1.0640, test_f1: 0.5102
 epoch: 36, train_loss: 0.9320, test_loss: 1.0662, test_f1: 0.5079
 epoch: 37, train_loss: 0.9185, test_loss: 1.0655, test_f1: 0.4976
 epoch: 38, train_loss: 0.9198, test_loss: 1.0509, test_f1: 0.4979
 epoch: 39, train_loss: 0.9144, test_loss: 1.0568, test_f1: 0.5031
 epoch: 40, train_loss: 0.9156, test_loss: 1.0608, test_f1: 0.5287
 epoch: 41, train_loss: 0.9108, test_loss: 1.0588, test_f1: 0.5118
 epoch: 42, train_loss: 0.8974, test_loss: 1.0650, test_f1: 0.5033
 epoch: 43, train_loss: 0.8952, test_loss: 1.0404, test_f1: 0.5353
 epoch: 44, train_loss: 0.9042, test_loss: 1.0434, test_f1: 0.5486
 epoch: 45, train_loss: 0.8945, test_loss: 1.0398, test_f1: 0.5393
 epoch: 46, train_loss: 0.8882, test_loss: 1.0382, test_f1: 0.5123
 epoch: 47, train_loss: 0.8806, test_loss: 1.0446, test_f1: 0.5452
 epoch: 48, train_loss: 0.8797, test_loss: 1.0447, test_f1: 0.5456
 epoch: 49, train_loss: 0.8767, test_loss: 1.0465, test_f1: 0.5340
 epoch: 50, train_loss: 0.8797, test_loss: 1.0205, test_f1: 0.5334
 epoch: 51, train_loss: 0.8638, test_loss: 1.0271, test_f1: 0.5428
 epoch: 52, train_loss: 0.8651, test_loss: 1.0348, test_f1: 0.5476
 epoch: 53, train_loss: 0.8719, test_loss: 1.0277, test_f1: 0.5359
 epoch: 54, train_loss: 0.8581, test_loss: 1.0412, test_f1: 0.5492
 epoch: 55, train_loss: 0.8652, test_loss: 1.0234, test_f1: 0.5497
 epoch: 56, train_loss: 0.8599, test_loss: 1.0285, test_f1: 0.5511
 epoch: 57, train_loss: 0.8562, test_loss: 1.0456, test_f1: 0.5519
 epoch: 58, train_loss: 0.8604, test_loss: 1.0301, test_f1: 0.5582
 epoch: 59, train_loss: 0.8625, test_loss: 1.0324, test_f1: 0.5640
 epoch: 60, train_loss: 0.8509, test_loss: 1.0410, test_f1: 0.5512
 epoch: 61, train_loss: 0.8552, test_loss: 1.0377, test_f1: 0.5627
 epoch: 62, train_loss: 0.8549, test_loss: 1.0451, test_f1: 0.5521
 epoch: 63, train_loss: 0.8512, test_loss: 1.0356, test_f1: 0.5559
 epoch: 64, train_loss: 0.8501, test_loss: 1.0277, test_f1: 0.5622
 epoch: 65, train_loss: 0.8553, test_loss: 1.0276, test_f1: 0.5584
 epoch: 66, train_loss: 0.8476, test_loss: 1.0355, test_f1: 0.5528
 epoch: 67, train_loss: 0.8476, test_loss: 1.0305, test_f1: 0.5636
 epoch: 68, train_loss: 0.8430, test_loss: 1.0362, test_f1: 0.5485
 epoch: 69, train_loss: 0.8435, test_loss: 1.0434, test_f1: 0.5497
 epoch: 70, train_loss: 0.8359, test_loss: 1.0329, test_f1: 0.5578
 epoch: 71, train_loss: 0.8369, test_loss: 1.0356, test_f1: 0.5522
 epoch: 72, train_loss: 0.8475, test_loss: 1.0331, test_f1: 0.5482
 epoch: 73, train_loss: 0.8330, test_loss: 1.0341, test_f1: 0.5567
 epoch: 74, train_loss: 0.8311, test_loss: 1.0321, test_f1: 0.5601
 epoch: 75, train_loss: 0.8369, test_loss: 1.0243, test_f1: 0.5638
 epoch: 76, train_loss: 0.8371, test_loss: 1.0377, test_f1: 0.5663
 epoch: 77, train_loss: 0.8342, test_loss: 1.0285, test_f1: 0.5498
 epoch: 78, train_loss: 0.8243, test_loss: 1.0302, test_f1: 0.5631
 epoch: 79, train_loss: 0.8322, test_loss: 1.0382, test_f1: 0.5573
 epoch: 80, train_loss: 0.8327, test_loss: 1.0314, test_f1: 0.5671
 epoch: 81, train_loss: 0.8232, test_loss: 1.0341, test_f1: 0.5646
 epoch: 82, train_loss: 0.8363, test_loss: 1.0467, test_f1: 0.5491
 epoch: 83, train_loss: 0.8345, test_loss: 1.0189, test_f1: 0.5544
 epoch: 84, train_loss: 0.8205, test_loss: 1.0469, test_f1: 0.5463
 epoch: 85, train_loss: 0.8249, test_loss: 1.0256, test_f1: 0.5603
 epoch: 86, train_loss: 0.8225, test_loss: 1.0247, test_f1: 0.5694
 epoch: 87, train_loss: 0.8183, test_loss: 1.0435, test_f1: 0.5577
 epoch: 88, train_loss: 0.8277, test_loss: 1.0437, test_f1: 0.5658
 epoch: 89, train_loss: 0.8175, test_loss: 1.0292, test_f1: 0.5576
 epoch: 90, train_loss: 0.8127, test_loss: 1.0263, test_f1: 0.5557
 epoch: 91, train_loss: 0.8226, test_loss: 1.0336, test_f1: 0.5540
 epoch: 92, train_loss: 0.8190, test_loss: 1.0284, test_f1: 0.5601
 epoch: 93, train_loss: 0.8060, test_loss: 1.0436, test_f1: 0.5660
 epoch: 94, train_loss: 0.8145, test_loss: 1.0284, test_f1: 0.5727
 epoch: 95, train_loss: 0.8135, test_loss: 1.0459, test_f1: 0.5572
 epoch: 96, train_loss: 0.8077, test_loss: 1.0310, test_f1: 0.5624
 epoch: 97, train_loss: 0.8152, test_loss: 1.0436, test_f1: 0.5663
 epoch: 98, train_loss: 0.8114, test_loss: 1.0277, test_f1: 0.5777
 epoch: 99, train_loss: 0.8088, test_loss: 1.0129, test_f1: 0.5735
##################ITERATION #4 ****************************************
 epoch: 0, train_loss: 1.2673, test_loss: 1.2814, test_f1: 0.2281
 epoch: 1, train_loss: 1.1822, test_loss: 1.2410, test_f1: 0.2336
 epoch: 2, train_loss: 1.1537, test_loss: 1.2065, test_f1: 0.2977
 epoch: 3, train_loss: 1.1278, test_loss: 1.1831, test_f1: 0.3213
 epoch: 4, train_loss: 1.1128, test_loss: 1.1680, test_f1: 0.3404
 epoch: 5, train_loss: 1.0931, test_loss: 1.1570, test_f1: 0.3548
 epoch: 6, train_loss: 1.0788, test_loss: 1.1443, test_f1: 0.3610
 epoch: 7, train_loss: 1.0726, test_loss: 1.1390, test_f1: 0.4322
 epoch: 8, train_loss: 1.0589, test_loss: 1.1289, test_f1: 0.4454
 epoch: 9, train_loss: 1.0471, test_loss: 1.1210, test_f1: 0.4466
 epoch: 10, train_loss: 1.0405, test_loss: 1.1197, test_f1: 0.4586
 epoch: 11, train_loss: 1.0204, test_loss: 1.1135, test_f1: 0.4642
 epoch: 12, train_loss: 1.0147, test_loss: 1.1031, test_f1: 0.4628
 epoch: 13, train_loss: 1.0202, test_loss: 1.1031, test_f1: 0.4633
 epoch: 14, train_loss: 1.0043, test_loss: 1.1012, test_f1: 0.4672
 epoch: 15, train_loss: 0.9947, test_loss: 1.0953, test_f1: 0.4771
 epoch: 16, train_loss: 0.9952, test_loss: 1.0899, test_f1: 0.4786
 epoch: 17, train_loss: 0.9900, test_loss: 1.0860, test_f1: 0.4894
 epoch: 18, train_loss: 0.9789, test_loss: 1.0800, test_f1: 0.4825
 epoch: 19, train_loss: 0.9608, test_loss: 1.0781, test_f1: 0.4981
 epoch: 20, train_loss: 0.9537, test_loss: 1.0863, test_f1: 0.4968
 epoch: 21, train_loss: 0.9633, test_loss: 1.0698, test_f1: 0.5074
 epoch: 22, train_loss: 0.9579, test_loss: 1.0744, test_f1: 0.5095
 epoch: 23, train_loss: 0.9469, test_loss: 1.0719, test_f1: 0.5117
 epoch: 24, train_loss: 0.9434, test_loss: 1.0649, test_f1: 0.5338
 epoch: 25, train_loss: 0.9301, test_loss: 1.0858, test_f1: 0.5074
 epoch: 26, train_loss: 0.9442, test_loss: 1.0646, test_f1: 0.5030
 epoch: 27, train_loss: 0.9337, test_loss: 1.0671, test_f1: 0.5273
 epoch: 28, train_loss: 0.9335, test_loss: 1.0633, test_f1: 0.5199
 epoch: 29, train_loss: 0.9163, test_loss: 1.0622, test_f1: 0.5022
 epoch: 30, train_loss: 0.9224, test_loss: 1.0553, test_f1: 0.5107
 epoch: 31, train_loss: 0.9140, test_loss: 1.0589, test_f1: 0.4953
 epoch: 32, train_loss: 0.9252, test_loss: 1.0592, test_f1: 0.5195
 epoch: 33, train_loss: 0.9098, test_loss: 1.0552, test_f1: 0.5067
 epoch: 34, train_loss: 0.8997, test_loss: 1.0548, test_f1: 0.5424
 epoch: 35, train_loss: 0.9141, test_loss: 1.0613, test_f1: 0.5077
 epoch: 36, train_loss: 0.8905, test_loss: 1.0644, test_f1: 0.5175
 epoch: 37, train_loss: 0.8938, test_loss: 1.0516, test_f1: 0.5172
 epoch: 38, train_loss: 0.8999, test_loss: 1.0731, test_f1: 0.5264
 epoch: 39, train_loss: 0.8937, test_loss: 1.0630, test_f1: 0.5038
 epoch: 40, train_loss: 0.8825, test_loss: 1.0733, test_f1: 0.5031
 epoch: 41, train_loss: 0.8804, test_loss: 1.0546, test_f1: 0.5204
 epoch: 42, train_loss: 0.8738, test_loss: 1.0704, test_f1: 0.5251
 epoch: 43, train_loss: 0.8743, test_loss: 1.0690, test_f1: 0.5282
 epoch: 44, train_loss: 0.8702, test_loss: 1.0661, test_f1: 0.5473
 epoch: 45, train_loss: 0.8670, test_loss: 1.0666, test_f1: 0.5286
 epoch: 46, train_loss: 0.8698, test_loss: 1.0572, test_f1: 0.5253
 epoch: 47, train_loss: 0.8569, test_loss: 1.0675, test_f1: 0.5222
 epoch: 48, train_loss: 0.8562, test_loss: 1.0662, test_f1: 0.5462
 epoch: 49, train_loss: 0.8557, test_loss: 1.0721, test_f1: 0.5211
 epoch: 50, train_loss: 0.8515, test_loss: 1.0791, test_f1: 0.5234
 epoch: 51, train_loss: 0.8563, test_loss: 1.0609, test_f1: 0.5410
 epoch: 52, train_loss: 0.8472, test_loss: 1.0614, test_f1: 0.5545
 epoch: 53, train_loss: 0.8449, test_loss: 1.0616, test_f1: 0.5316
 epoch: 54, train_loss: 0.8518, test_loss: 1.0569, test_f1: 0.5492
 epoch: 55, train_loss: 0.8491, test_loss: 1.0647, test_f1: 0.5443
 epoch: 56, train_loss: 0.8453, test_loss: 1.0753, test_f1: 0.5417
 epoch: 57, train_loss: 0.8401, test_loss: 1.0702, test_f1: 0.5372
 epoch: 58, train_loss: 0.8499, test_loss: 1.0675, test_f1: 0.5423
 epoch: 59, train_loss: 0.8338, test_loss: 1.0724, test_f1: 0.5364
 epoch: 60, train_loss: 0.8437, test_loss: 1.0680, test_f1: 0.5453
 epoch: 61, train_loss: 0.8493, test_loss: 1.0671, test_f1: 0.5358
 epoch: 62, train_loss: 0.8399, test_loss: 1.0691, test_f1: 0.5574
 epoch: 63, train_loss: 0.8462, test_loss: 1.0667, test_f1: 0.5567
 epoch: 64, train_loss: 0.8350, test_loss: 1.0678, test_f1: 0.5378
 epoch: 65, train_loss: 0.8302, test_loss: 1.0608, test_f1: 0.5534
 epoch: 66, train_loss: 0.8331, test_loss: 1.0691, test_f1: 0.5505
 epoch: 67, train_loss: 0.8297, test_loss: 1.0639, test_f1: 0.5488
 epoch: 68, train_loss: 0.8203, test_loss: 1.0627, test_f1: 0.5540
 epoch: 69, train_loss: 0.8310, test_loss: 1.0761, test_f1: 0.5373
 epoch: 70, train_loss: 0.8149, test_loss: 1.0627, test_f1: 0.5475
 epoch: 71, train_loss: 0.8251, test_loss: 1.0612, test_f1: 0.5370
 epoch: 72, train_loss: 0.8160, test_loss: 1.0674, test_f1: 0.5371
 epoch: 73, train_loss: 0.8231, test_loss: 1.0587, test_f1: 0.5528
 epoch: 74, train_loss: 0.8236, test_loss: 1.0816, test_f1: 0.5443
 epoch: 75, train_loss: 0.8309, test_loss: 1.0702, test_f1: 0.5349
 epoch: 76, train_loss: 0.8123, test_loss: 1.0645, test_f1: 0.5405
 epoch: 77, train_loss: 0.8213, test_loss: 1.0716, test_f1: 0.5379
 epoch: 78, train_loss: 0.8155, test_loss: 1.0645, test_f1: 0.5312
 epoch: 79, train_loss: 0.8168, test_loss: 1.0758, test_f1: 0.5373
 epoch: 80, train_loss: 0.8174, test_loss: 1.0602, test_f1: 0.5484
 epoch: 81, train_loss: 0.8140, test_loss: 1.0517, test_f1: 0.5459
 epoch: 82, train_loss: 0.8030, test_loss: 1.0580, test_f1: 0.5455
 epoch: 83, train_loss: 0.8058, test_loss: 1.0802, test_f1: 0.5320
 epoch: 84, train_loss: 0.8200, test_loss: 1.0567, test_f1: 0.5457
 epoch: 85, train_loss: 0.8159, test_loss: 1.0766, test_f1: 0.5450
 epoch: 86, train_loss: 0.8008, test_loss: 1.0639, test_f1: 0.5484
 epoch: 87, train_loss: 0.8018, test_loss: 1.0697, test_f1: 0.5385
 epoch: 88, train_loss: 0.8025, test_loss: 1.0781, test_f1: 0.5421
 epoch: 89, train_loss: 0.8125, test_loss: 1.0803, test_f1: 0.5354
 epoch: 90, train_loss: 0.7955, test_loss: 1.0793, test_f1: 0.5429
 epoch: 91, train_loss: 0.8111, test_loss: 1.0764, test_f1: 0.5475
 epoch: 92, train_loss: 0.8099, test_loss: 1.0643, test_f1: 0.5473
 epoch: 93, train_loss: 0.7948, test_loss: 1.0864, test_f1: 0.5360
 epoch: 94, train_loss: 0.8024, test_loss: 1.0722, test_f1: 0.5429
 epoch: 95, train_loss: 0.8043, test_loss: 1.0761, test_f1: 0.5408
 epoch: 96, train_loss: 0.7969, test_loss: 1.0541, test_f1: 0.5434
 epoch: 97, train_loss: 0.7881, test_loss: 1.0617, test_f1: 0.5461
 epoch: 98, train_loss: 0.7985, test_loss: 1.0568, test_f1: 0.5527
 epoch: 99, train_loss: 0.7948, test_loss: 1.0727, test_f1: 0.5481
##################ITERATION #5 ****************************************
 epoch: 0, train_loss: 1.2391, test_loss: 1.2937, test_f1: 0.2281
 epoch: 1, train_loss: 1.1721, test_loss: 1.2500, test_f1: 0.2667
 epoch: 2, train_loss: 1.1535, test_loss: 1.2112, test_f1: 0.3370
 epoch: 3, train_loss: 1.1354, test_loss: 1.1926, test_f1: 0.3402
 epoch: 4, train_loss: 1.1105, test_loss: 1.1792, test_f1: 0.3496
 epoch: 5, train_loss: 1.1007, test_loss: 1.1655, test_f1: 0.3541
 epoch: 6, train_loss: 1.0772, test_loss: 1.1554, test_f1: 0.3542
 epoch: 7, train_loss: 1.0554, test_loss: 1.1472, test_f1: 0.3544
 epoch: 8, train_loss: 1.0467, test_loss: 1.1367, test_f1: 0.3563
 epoch: 9, train_loss: 1.0448, test_loss: 1.1371, test_f1: 0.3545
 epoch: 10, train_loss: 1.0321, test_loss: 1.1204, test_f1: 0.3571
 epoch: 11, train_loss: 1.0179, test_loss: 1.1267, test_f1: 0.3936
 epoch: 12, train_loss: 1.0143, test_loss: 1.1151, test_f1: 0.3726
 epoch: 13, train_loss: 1.0064, test_loss: 1.1077, test_f1: 0.3752
 epoch: 14, train_loss: 0.9917, test_loss: 1.1067, test_f1: 0.4026
 epoch: 15, train_loss: 0.9861, test_loss: 1.0978, test_f1: 0.4283
 epoch: 16, train_loss: 0.9767, test_loss: 1.1081, test_f1: 0.4162
 epoch: 17, train_loss: 0.9795, test_loss: 1.0921, test_f1: 0.4515
 epoch: 18, train_loss: 0.9666, test_loss: 1.0940, test_f1: 0.4062
 epoch: 19, train_loss: 0.9714, test_loss: 1.1007, test_f1: 0.4459
 epoch: 20, train_loss: 0.9564, test_loss: 1.1089, test_f1: 0.4541
 epoch: 21, train_loss: 0.9606, test_loss: 1.1099, test_f1: 0.4382
 epoch: 22, train_loss: 0.9398, test_loss: 1.0908, test_f1: 0.4677
 epoch: 23, train_loss: 0.9501, test_loss: 1.1002, test_f1: 0.4408
 epoch: 24, train_loss: 0.9439, test_loss: 1.0931, test_f1: 0.4468
 epoch: 25, train_loss: 0.9301, test_loss: 1.1047, test_f1: 0.4751
 epoch: 26, train_loss: 0.9247, test_loss: 1.1091, test_f1: 0.4749
 epoch: 27, train_loss: 0.9318, test_loss: 1.1094, test_f1: 0.4696
 epoch: 28, train_loss: 0.9124, test_loss: 1.1202, test_f1: 0.4803
 epoch: 29, train_loss: 0.9152, test_loss: 1.0997, test_f1: 0.4780
 epoch: 30, train_loss: 0.9256, test_loss: 1.1105, test_f1: 0.4904
 epoch: 31, train_loss: 0.9059, test_loss: 1.1048, test_f1: 0.4883
 epoch: 32, train_loss: 0.9140, test_loss: 1.1300, test_f1: 0.4951
 epoch: 33, train_loss: 0.9028, test_loss: 1.1401, test_f1: 0.5075
 epoch: 34, train_loss: 0.8992, test_loss: 1.1413, test_f1: 0.4999
 epoch: 35, train_loss: 0.8977, test_loss: 1.1332, test_f1: 0.4916
 epoch: 36, train_loss: 0.8916, test_loss: 1.1521, test_f1: 0.4932
 epoch: 37, train_loss: 0.8949, test_loss: 1.1362, test_f1: 0.5039
 epoch: 38, train_loss: 0.9023, test_loss: 1.1642, test_f1: 0.5017
 epoch: 39, train_loss: 0.8851, test_loss: 1.1627, test_f1: 0.5051
 epoch: 40, train_loss: 0.8855, test_loss: 1.1412, test_f1: 0.5192
 epoch: 41, train_loss: 0.8820, test_loss: 1.1584, test_f1: 0.5038
 epoch: 42, train_loss: 0.8794, test_loss: 1.1498, test_f1: 0.5024
 epoch: 43, train_loss: 0.8803, test_loss: 1.1661, test_f1: 0.5060
 epoch: 44, train_loss: 0.8766, test_loss: 1.1620, test_f1: 0.5077
 epoch: 45, train_loss: 0.8728, test_loss: 1.1804, test_f1: 0.5096
 epoch: 46, train_loss: 0.8686, test_loss: 1.1886, test_f1: 0.5284
 epoch: 47, train_loss: 0.8786, test_loss: 1.1930, test_f1: 0.5221
 epoch: 48, train_loss: 0.8709, test_loss: 1.1736, test_f1: 0.5075
 epoch: 49, train_loss: 0.8620, test_loss: 1.1801, test_f1: 0.5155
 epoch: 50, train_loss: 0.8637, test_loss: 1.1676, test_f1: 0.5136
 epoch: 51, train_loss: 0.8607, test_loss: 1.1718, test_f1: 0.5124
 epoch: 52, train_loss: 0.8563, test_loss: 1.1708, test_f1: 0.5194
 epoch: 53, train_loss: 0.8607, test_loss: 1.1621, test_f1: 0.5200
 epoch: 54, train_loss: 0.8575, test_loss: 1.1633, test_f1: 0.5047
 epoch: 55, train_loss: 0.8618, test_loss: 1.1703, test_f1: 0.5168
 epoch: 56, train_loss: 0.8548, test_loss: 1.1707, test_f1: 0.5201
 epoch: 57, train_loss: 0.8541, test_loss: 1.1666, test_f1: 0.5176
 epoch: 58, train_loss: 0.8585, test_loss: 1.1738, test_f1: 0.5102
 epoch: 59, train_loss: 0.8603, test_loss: 1.1688, test_f1: 0.5091
 epoch: 60, train_loss: 0.8477, test_loss: 1.1683, test_f1: 0.5147
 epoch: 61, train_loss: 0.8423, test_loss: 1.1686, test_f1: 0.5154
 epoch: 62, train_loss: 0.8406, test_loss: 1.1616, test_f1: 0.5085
 epoch: 63, train_loss: 0.8479, test_loss: 1.1605, test_f1: 0.5110
 epoch: 64, train_loss: 0.8569, test_loss: 1.1540, test_f1: 0.5123
 epoch: 65, train_loss: 0.8479, test_loss: 1.1490, test_f1: 0.5101
 epoch: 66, train_loss: 0.8412, test_loss: 1.1591, test_f1: 0.5113
 epoch: 67, train_loss: 0.8306, test_loss: 1.1583, test_f1: 0.5192
 epoch: 68, train_loss: 0.8444, test_loss: 1.1662, test_f1: 0.5126
 epoch: 69, train_loss: 0.8389, test_loss: 1.1732, test_f1: 0.5061
 epoch: 70, train_loss: 0.8390, test_loss: 1.1671, test_f1: 0.5036
 epoch: 71, train_loss: 0.8308, test_loss: 1.1634, test_f1: 0.5011
 epoch: 72, train_loss: 0.8515, test_loss: 1.1617, test_f1: 0.5036
 epoch: 73, train_loss: 0.8267, test_loss: 1.1657, test_f1: 0.5100
 epoch: 74, train_loss: 0.8276, test_loss: 1.1666, test_f1: 0.5077
 epoch: 75, train_loss: 0.8326, test_loss: 1.1559, test_f1: 0.5154
 epoch: 76, train_loss: 0.8342, test_loss: 1.1613, test_f1: 0.5118
 epoch: 77, train_loss: 0.8312, test_loss: 1.1586, test_f1: 0.5141
 epoch: 78, train_loss: 0.8344, test_loss: 1.1559, test_f1: 0.5189
 epoch: 79, train_loss: 0.8381, test_loss: 1.1579, test_f1: 0.5124
 epoch: 80, train_loss: 0.8254, test_loss: 1.1734, test_f1: 0.5127
 epoch: 81, train_loss: 0.8249, test_loss: 1.1726, test_f1: 0.5133
 epoch: 82, train_loss: 0.8312, test_loss: 1.1622, test_f1: 0.5181
 epoch: 83, train_loss: 0.8269, test_loss: 1.1499, test_f1: 0.5034
 epoch: 84, train_loss: 0.8301, test_loss: 1.1528, test_f1: 0.5151
 epoch: 85, train_loss: 0.8188, test_loss: 1.1530, test_f1: 0.5091
 epoch: 86, train_loss: 0.8149, test_loss: 1.1633, test_f1: 0.5056
 epoch: 87, train_loss: 0.8255, test_loss: 1.1760, test_f1: 0.5180
 epoch: 88, train_loss: 0.8190, test_loss: 1.1777, test_f1: 0.5035
 epoch: 89, train_loss: 0.8196, test_loss: 1.1590, test_f1: 0.5042
 epoch: 90, train_loss: 0.8330, test_loss: 1.1464, test_f1: 0.5089
 epoch: 91, train_loss: 0.8127, test_loss: 1.1409, test_f1: 0.5041
 epoch: 92, train_loss: 0.8194, test_loss: 1.1572, test_f1: 0.5223
 epoch: 93, train_loss: 0.8029, test_loss: 1.1545, test_f1: 0.5175
 epoch: 94, train_loss: 0.8162, test_loss: 1.1584, test_f1: 0.5165
 epoch: 95, train_loss: 0.8131, test_loss: 1.1690, test_f1: 0.5107
 epoch: 96, train_loss: 0.8175, test_loss: 1.1536, test_f1: 0.5050
 epoch: 97, train_loss: 0.8122, test_loss: 1.1464, test_f1: 0.4985
 epoch: 98, train_loss: 0.8095, test_loss: 1.1364, test_f1: 0.5135
 epoch: 99, train_loss: 0.8139, test_loss: 1.1464, test_f1: 0.5093
##################ITERATION #6 ****************************************
 epoch: 0, train_loss: 1.2611, test_loss: 1.2859, test_f1: 0.2281
 epoch: 1, train_loss: 1.1794, test_loss: 1.2488, test_f1: 0.3156
 epoch: 2, train_loss: 1.1612, test_loss: 1.2156, test_f1: 0.3559
 epoch: 3, train_loss: 1.1273, test_loss: 1.1968, test_f1: 0.3611
 epoch: 4, train_loss: 1.1139, test_loss: 1.1882, test_f1: 0.3652
 epoch: 5, train_loss: 1.0985, test_loss: 1.1804, test_f1: 0.3660
 epoch: 6, train_loss: 1.0777, test_loss: 1.1699, test_f1: 0.3703
 epoch: 7, train_loss: 1.0821, test_loss: 1.1666, test_f1: 0.3947
 epoch: 8, train_loss: 1.0655, test_loss: 1.1599, test_f1: 0.3729
 epoch: 9, train_loss: 1.0428, test_loss: 1.1474, test_f1: 0.4242
 epoch: 10, train_loss: 1.0439, test_loss: 1.1389, test_f1: 0.4170
 epoch: 11, train_loss: 1.0362, test_loss: 1.1259, test_f1: 0.4500
 epoch: 12, train_loss: 1.0188, test_loss: 1.1197, test_f1: 0.4691
 epoch: 13, train_loss: 1.0324, test_loss: 1.1173, test_f1: 0.4645
 epoch: 14, train_loss: 1.0155, test_loss: 1.1144, test_f1: 0.4760
 epoch: 15, train_loss: 1.0012, test_loss: 1.1067, test_f1: 0.4716
 epoch: 16, train_loss: 0.9899, test_loss: 1.1018, test_f1: 0.4688
 epoch: 17, train_loss: 0.9976, test_loss: 1.0988, test_f1: 0.4829
 epoch: 18, train_loss: 0.9786, test_loss: 1.0907, test_f1: 0.4878
 epoch: 19, train_loss: 0.9800, test_loss: 1.0916, test_f1: 0.4815
 epoch: 20, train_loss: 0.9754, test_loss: 1.0809, test_f1: 0.4994
 epoch: 21, train_loss: 0.9747, test_loss: 1.0779, test_f1: 0.4912
 epoch: 22, train_loss: 0.9752, test_loss: 1.0813, test_f1: 0.4912
 epoch: 23, train_loss: 0.9617, test_loss: 1.0725, test_f1: 0.5089
 epoch: 24, train_loss: 0.9483, test_loss: 1.0748, test_f1: 0.5093
 epoch: 25, train_loss: 0.9541, test_loss: 1.0715, test_f1: 0.5096
 epoch: 26, train_loss: 0.9420, test_loss: 1.0613, test_f1: 0.5124
 epoch: 27, train_loss: 0.9358, test_loss: 1.0593, test_f1: 0.5190
 epoch: 28, train_loss: 0.9373, test_loss: 1.0571, test_f1: 0.5103
 epoch: 29, train_loss: 0.9216, test_loss: 1.0563, test_f1: 0.5173
 epoch: 30, train_loss: 0.9260, test_loss: 1.0594, test_f1: 0.5271
 epoch: 31, train_loss: 0.9051, test_loss: 1.0543, test_f1: 0.5189
 epoch: 32, train_loss: 0.9121, test_loss: 1.0514, test_f1: 0.5064
 epoch: 33, train_loss: 0.9108, test_loss: 1.0600, test_f1: 0.5249
 epoch: 34, train_loss: 0.9126, test_loss: 1.0588, test_f1: 0.5153
 epoch: 35, train_loss: 0.9089, test_loss: 1.0443, test_f1: 0.5103
 epoch: 36, train_loss: 0.8964, test_loss: 1.0476, test_f1: 0.5169
 epoch: 37, train_loss: 0.8957, test_loss: 1.0542, test_f1: 0.5167
 epoch: 38, train_loss: 0.8896, test_loss: 1.0405, test_f1: 0.5049
 epoch: 39, train_loss: 0.8822, test_loss: 1.0477, test_f1: 0.5561
 epoch: 40, train_loss: 0.8805, test_loss: 1.0575, test_f1: 0.5343
 epoch: 41, train_loss: 0.8812, test_loss: 1.0499, test_f1: 0.5028
 epoch: 42, train_loss: 0.8775, test_loss: 1.0480, test_f1: 0.5592
 epoch: 43, train_loss: 0.8726, test_loss: 1.0517, test_f1: 0.5321
 epoch: 44, train_loss: 0.8646, test_loss: 1.0392, test_f1: 0.5388
 epoch: 45, train_loss: 0.8652, test_loss: 1.0521, test_f1: 0.5222
 epoch: 46, train_loss: 0.8614, test_loss: 1.0540, test_f1: 0.5534
 epoch: 47, train_loss: 0.8682, test_loss: 1.0603, test_f1: 0.5577
 epoch: 48, train_loss: 0.8596, test_loss: 1.0569, test_f1: 0.5598
 epoch: 49, train_loss: 0.8617, test_loss: 1.0433, test_f1: 0.5524
 epoch: 50, train_loss: 0.8517, test_loss: 1.0475, test_f1: 0.5574
 epoch: 51, train_loss: 0.8461, test_loss: 1.0511, test_f1: 0.5693
 epoch: 52, train_loss: 0.8431, test_loss: 1.0469, test_f1: 0.5692
 epoch: 53, train_loss: 0.8537, test_loss: 1.0417, test_f1: 0.5832
 epoch: 54, train_loss: 0.8461, test_loss: 1.0519, test_f1: 0.5630
 epoch: 55, train_loss: 0.8531, test_loss: 1.0496, test_f1: 0.5708
 epoch: 56, train_loss: 0.8498, test_loss: 1.0400, test_f1: 0.5796
 epoch: 57, train_loss: 0.8345, test_loss: 1.0506, test_f1: 0.5748
 epoch: 58, train_loss: 0.8345, test_loss: 1.0471, test_f1: 0.5621
 epoch: 59, train_loss: 0.8350, test_loss: 1.0553, test_f1: 0.5825
 epoch: 60, train_loss: 0.8352, test_loss: 1.0592, test_f1: 0.5677
 epoch: 61, train_loss: 0.8365, test_loss: 1.0499, test_f1: 0.5573
 epoch: 62, train_loss: 0.8413, test_loss: 1.0449, test_f1: 0.5782
 epoch: 63, train_loss: 0.8336, test_loss: 1.0322, test_f1: 0.5745
 epoch: 64, train_loss: 0.8331, test_loss: 1.0450, test_f1: 0.5681
 epoch: 65, train_loss: 0.8331, test_loss: 1.0450, test_f1: 0.5689
 epoch: 66, train_loss: 0.8284, test_loss: 1.0446, test_f1: 0.5683
 epoch: 67, train_loss: 0.8339, test_loss: 1.0500, test_f1: 0.5737
 epoch: 68, train_loss: 0.8258, test_loss: 1.0487, test_f1: 0.5738
 epoch: 69, train_loss: 0.8188, test_loss: 1.0414, test_f1: 0.5837
 epoch: 70, train_loss: 0.8227, test_loss: 1.0533, test_f1: 0.5690
 epoch: 71, train_loss: 0.8154, test_loss: 1.0507, test_f1: 0.5587
 epoch: 72, train_loss: 0.8173, test_loss: 1.0564, test_f1: 0.5647
 epoch: 73, train_loss: 0.8185, test_loss: 1.0518, test_f1: 0.5786
 epoch: 74, train_loss: 0.8154, test_loss: 1.0442, test_f1: 0.5743
 epoch: 75, train_loss: 0.8158, test_loss: 1.0570, test_f1: 0.5580
 epoch: 76, train_loss: 0.8180, test_loss: 1.0612, test_f1: 0.5685
 epoch: 77, train_loss: 0.8177, test_loss: 1.0417, test_f1: 0.5799
 epoch: 78, train_loss: 0.8032, test_loss: 1.0497, test_f1: 0.5714
 epoch: 79, train_loss: 0.8365, test_loss: 1.0330, test_f1: 0.5781
 epoch: 80, train_loss: 0.8104, test_loss: 1.0414, test_f1: 0.5675
 epoch: 81, train_loss: 0.8199, test_loss: 1.0554, test_f1: 0.5570
 epoch: 82, train_loss: 0.8046, test_loss: 1.0429, test_f1: 0.5697
 epoch: 83, train_loss: 0.8054, test_loss: 1.0558, test_f1: 0.5649
 epoch: 84, train_loss: 0.8143, test_loss: 1.0364, test_f1: 0.5693
 epoch: 85, train_loss: 0.8019, test_loss: 1.0501, test_f1: 0.5569
 epoch: 86, train_loss: 0.8074, test_loss: 1.0478, test_f1: 0.5486
 epoch: 87, train_loss: 0.8014, test_loss: 1.0591, test_f1: 0.5706
 epoch: 88, train_loss: 0.8112, test_loss: 1.0581, test_f1: 0.5666
 epoch: 89, train_loss: 0.7939, test_loss: 1.0615, test_f1: 0.5650
 epoch: 90, train_loss: 0.7959, test_loss: 1.0460, test_f1: 0.5683
 epoch: 91, train_loss: 0.8018, test_loss: 1.0588, test_f1: 0.5699
 epoch: 92, train_loss: 0.8028, test_loss: 1.0576, test_f1: 0.5593
 epoch: 93, train_loss: 0.7977, test_loss: 1.0622, test_f1: 0.5591
 epoch: 94, train_loss: 0.7970, test_loss: 1.0541, test_f1: 0.5583
 epoch: 95, train_loss: 0.7992, test_loss: 1.0424, test_f1: 0.5500
 epoch: 96, train_loss: 0.7906, test_loss: 1.0386, test_f1: 0.5656
 epoch: 97, train_loss: 0.7967, test_loss: 1.0689, test_f1: 0.5557
 epoch: 98, train_loss: 0.7945, test_loss: 1.0460, test_f1: 0.5665
 epoch: 99, train_loss: 0.7968, test_loss: 1.0504, test_f1: 0.5641
##################ITERATION #7 ****************************************
 epoch: 0, train_loss: 1.2496, test_loss: 1.3090, test_f1: 0.2281
 epoch: 1, train_loss: 1.1639, test_loss: 1.2592, test_f1: 0.2575
 epoch: 2, train_loss: 1.1483, test_loss: 1.2118, test_f1: 0.3279
 epoch: 3, train_loss: 1.1243, test_loss: 1.1937, test_f1: 0.4381
 epoch: 4, train_loss: 1.1123, test_loss: 1.1825, test_f1: 0.4402
 epoch: 5, train_loss: 1.1113, test_loss: 1.1686, test_f1: 0.4573
 epoch: 6, train_loss: 1.0904, test_loss: 1.1530, test_f1: 0.4657
 epoch: 7, train_loss: 1.0801, test_loss: 1.1437, test_f1: 0.4902
 epoch: 8, train_loss: 1.0707, test_loss: 1.1330, test_f1: 0.5087
 epoch: 9, train_loss: 1.0551, test_loss: 1.1274, test_f1: 0.4904
 epoch: 10, train_loss: 1.0386, test_loss: 1.1213, test_f1: 0.5049
 epoch: 11, train_loss: 1.0442, test_loss: 1.1089, test_f1: 0.4958
 epoch: 12, train_loss: 1.0133, test_loss: 1.0989, test_f1: 0.4960
 epoch: 13, train_loss: 1.0241, test_loss: 1.0963, test_f1: 0.5004
 epoch: 14, train_loss: 1.0076, test_loss: 1.0903, test_f1: 0.5027
 epoch: 15, train_loss: 0.9981, test_loss: 1.0899, test_f1: 0.5099
 epoch: 16, train_loss: 0.9942, test_loss: 1.0861, test_f1: 0.5124
 epoch: 17, train_loss: 0.9871, test_loss: 1.0720, test_f1: 0.5195
 epoch: 18, train_loss: 0.9835, test_loss: 1.0721, test_f1: 0.5317
 epoch: 19, train_loss: 0.9727, test_loss: 1.0749, test_f1: 0.5240
 epoch: 20, train_loss: 0.9697, test_loss: 1.0667, test_f1: 0.5370
 epoch: 21, train_loss: 0.9616, test_loss: 1.0666, test_f1: 0.5413
 epoch: 22, train_loss: 0.9612, test_loss: 1.0653, test_f1: 0.5162
 epoch: 23, train_loss: 0.9518, test_loss: 1.0620, test_f1: 0.5031
 epoch: 24, train_loss: 0.9461, test_loss: 1.0596, test_f1: 0.5006
 epoch: 25, train_loss: 0.9409, test_loss: 1.0625, test_f1: 0.5333
 epoch: 26, train_loss: 0.9361, test_loss: 1.0571, test_f1: 0.5269
 epoch: 27, train_loss: 0.9379, test_loss: 1.0542, test_f1: 0.5161
 epoch: 28, train_loss: 0.9210, test_loss: 1.0459, test_f1: 0.5049
 epoch: 29, train_loss: 0.9230, test_loss: 1.0460, test_f1: 0.5040
 epoch: 30, train_loss: 0.9285, test_loss: 1.0435, test_f1: 0.5050
 epoch: 31, train_loss: 0.9136, test_loss: 1.0417, test_f1: 0.5163
 epoch: 32, train_loss: 0.9183, test_loss: 1.0555, test_f1: 0.5320
 epoch: 33, train_loss: 0.9174, test_loss: 1.0359, test_f1: 0.5166
 epoch: 34, train_loss: 0.9142, test_loss: 1.0397, test_f1: 0.5333
 epoch: 35, train_loss: 0.9013, test_loss: 1.0434, test_f1: 0.5188
 epoch: 36, train_loss: 0.9013, test_loss: 1.0398, test_f1: 0.5463
 epoch: 37, train_loss: 0.9031, test_loss: 1.0358, test_f1: 0.5337
 epoch: 38, train_loss: 0.8923, test_loss: 1.0276, test_f1: 0.5339
 epoch: 39, train_loss: 0.8977, test_loss: 1.0314, test_f1: 0.5497
 epoch: 40, train_loss: 0.8979, test_loss: 1.0343, test_f1: 0.5525
 epoch: 41, train_loss: 0.8971, test_loss: 1.0369, test_f1: 0.5398
 epoch: 42, train_loss: 0.8724, test_loss: 1.0382, test_f1: 0.5251
 epoch: 43, train_loss: 0.8746, test_loss: 1.0284, test_f1: 0.5262
 epoch: 44, train_loss: 0.8759, test_loss: 1.0191, test_f1: 0.5326
 epoch: 45, train_loss: 0.8758, test_loss: 1.0286, test_f1: 0.5684
 epoch: 46, train_loss: 0.8730, test_loss: 1.0240, test_f1: 0.5413
 epoch: 47, train_loss: 0.8732, test_loss: 1.0214, test_f1: 0.5539
 epoch: 48, train_loss: 0.8775, test_loss: 1.0256, test_f1: 0.5500
 epoch: 49, train_loss: 0.8708, test_loss: 1.0159, test_f1: 0.5489
 epoch: 50, train_loss: 0.8703, test_loss: 1.0209, test_f1: 0.5713
 epoch: 51, train_loss: 0.8642, test_loss: 1.0207, test_f1: 0.5411
 epoch: 52, train_loss: 0.8636, test_loss: 1.0252, test_f1: 0.5426
 epoch: 53, train_loss: 0.8506, test_loss: 1.0258, test_f1: 0.5720
 epoch: 54, train_loss: 0.8540, test_loss: 1.0239, test_f1: 0.5544
 epoch: 55, train_loss: 0.8364, test_loss: 1.0262, test_f1: 0.5605
 epoch: 56, train_loss: 0.8441, test_loss: 1.0256, test_f1: 0.5724
 epoch: 57, train_loss: 0.8411, test_loss: 1.0282, test_f1: 0.5671
 epoch: 58, train_loss: 0.8532, test_loss: 1.0320, test_f1: 0.5704
 epoch: 59, train_loss: 0.8457, test_loss: 1.0290, test_f1: 0.5588
 epoch: 60, train_loss: 0.8386, test_loss: 1.0206, test_f1: 0.5646
 epoch: 61, train_loss: 0.8403, test_loss: 1.0234, test_f1: 0.5685
 epoch: 62, train_loss: 0.8402, test_loss: 1.0270, test_f1: 0.5822
 epoch: 63, train_loss: 0.8508, test_loss: 1.0278, test_f1: 0.5762
 epoch: 64, train_loss: 0.8428, test_loss: 1.0209, test_f1: 0.5913
 epoch: 65, train_loss: 0.8458, test_loss: 1.0173, test_f1: 0.5739
 epoch: 66, train_loss: 0.8409, test_loss: 1.0174, test_f1: 0.5607
 epoch: 67, train_loss: 0.8349, test_loss: 1.0194, test_f1: 0.5837
 epoch: 68, train_loss: 0.8327, test_loss: 1.0125, test_f1: 0.5730
 epoch: 69, train_loss: 0.8320, test_loss: 1.0131, test_f1: 0.5822
 epoch: 70, train_loss: 0.8172, test_loss: 1.0129, test_f1: 0.5833
 epoch: 71, train_loss: 0.8402, test_loss: 1.0101, test_f1: 0.5760
 epoch: 72, train_loss: 0.8300, test_loss: 1.0113, test_f1: 0.5894
 epoch: 73, train_loss: 0.8330, test_loss: 1.0093, test_f1: 0.5744
 epoch: 74, train_loss: 0.8298, test_loss: 1.0181, test_f1: 0.5789
 epoch: 75, train_loss: 0.8322, test_loss: 1.0111, test_f1: 0.5796
 epoch: 76, train_loss: 0.8183, test_loss: 1.0104, test_f1: 0.5826
 epoch: 77, train_loss: 0.8178, test_loss: 1.0155, test_f1: 0.5979
 epoch: 78, train_loss: 0.8260, test_loss: 1.0145, test_f1: 0.5771
 epoch: 79, train_loss: 0.8207, test_loss: 1.0097, test_f1: 0.5732
 epoch: 80, train_loss: 0.8276, test_loss: 1.0147, test_f1: 0.5802
 epoch: 81, train_loss: 0.8169, test_loss: 1.0137, test_f1: 0.5635
 epoch: 82, train_loss: 0.8155, test_loss: 1.0141, test_f1: 0.5784
 epoch: 83, train_loss: 0.7999, test_loss: 1.0216, test_f1: 0.5888
 epoch: 84, train_loss: 0.8049, test_loss: 1.0246, test_f1: 0.5734
 epoch: 85, train_loss: 0.8136, test_loss: 1.0164, test_f1: 0.5904
 epoch: 86, train_loss: 0.8078, test_loss: 1.0163, test_f1: 0.5783
 epoch: 87, train_loss: 0.8108, test_loss: 1.0235, test_f1: 0.5726
 epoch: 88, train_loss: 0.8146, test_loss: 1.0202, test_f1: 0.5973
 epoch: 89, train_loss: 0.8181, test_loss: 1.0210, test_f1: 0.5762
 epoch: 90, train_loss: 0.8027, test_loss: 1.0174, test_f1: 0.5976
 epoch: 91, train_loss: 0.8140, test_loss: 1.0195, test_f1: 0.5807
 epoch: 92, train_loss: 0.8101, test_loss: 1.0188, test_f1: 0.5857
 epoch: 93, train_loss: 0.8090, test_loss: 1.0251, test_f1: 0.5834
 epoch: 94, train_loss: 0.7959, test_loss: 1.0221, test_f1: 0.5718
 epoch: 95, train_loss: 0.8027, test_loss: 1.0153, test_f1: 0.5944
 epoch: 96, train_loss: 0.8110, test_loss: 1.0142, test_f1: 0.5888
 epoch: 97, train_loss: 0.8043, test_loss: 1.0168, test_f1: 0.5870
 epoch: 98, train_loss: 0.7970, test_loss: 1.0300, test_f1: 0.5770
 epoch: 99, train_loss: 0.8048, test_loss: 1.0325, test_f1: 0.5872
##################ITERATION #8 ****************************************
 epoch: 0, train_loss: 1.2263, test_loss: 1.2694, test_f1: 0.2281
 epoch: 1, train_loss: 1.1501, test_loss: 1.2236, test_f1: 0.3155
 epoch: 2, train_loss: 1.1361, test_loss: 1.1888, test_f1: 0.3620
 epoch: 3, train_loss: 1.1210, test_loss: 1.1780, test_f1: 0.3507
 epoch: 4, train_loss: 1.1014, test_loss: 1.1726, test_f1: 0.3544
 epoch: 5, train_loss: 1.0783, test_loss: 1.1576, test_f1: 0.3749
 epoch: 6, train_loss: 1.0669, test_loss: 1.1534, test_f1: 0.3660
 epoch: 7, train_loss: 1.0501, test_loss: 1.1478, test_f1: 0.3742
 epoch: 8, train_loss: 1.0561, test_loss: 1.1411, test_f1: 0.4315
 epoch: 9, train_loss: 1.0321, test_loss: 1.1322, test_f1: 0.4478
 epoch: 10, train_loss: 1.0239, test_loss: 1.1182, test_f1: 0.4278
 epoch: 11, train_loss: 1.0201, test_loss: 1.1088, test_f1: 0.4251
 epoch: 12, train_loss: 1.0068, test_loss: 1.1043, test_f1: 0.4632
 epoch: 13, train_loss: 0.9913, test_loss: 1.0978, test_f1: 0.4760
 epoch: 14, train_loss: 0.9956, test_loss: 1.0945, test_f1: 0.4595
 epoch: 15, train_loss: 0.9870, test_loss: 1.0831, test_f1: 0.4896
 epoch: 16, train_loss: 0.9760, test_loss: 1.0777, test_f1: 0.4976
 epoch: 17, train_loss: 0.9684, test_loss: 1.0743, test_f1: 0.5071
 epoch: 18, train_loss: 0.9690, test_loss: 1.0772, test_f1: 0.5187
 epoch: 19, train_loss: 0.9764, test_loss: 1.0720, test_f1: 0.5085
 epoch: 20, train_loss: 0.9440, test_loss: 1.0668, test_f1: 0.5104
 epoch: 21, train_loss: 0.9560, test_loss: 1.0683, test_f1: 0.5105
 epoch: 22, train_loss: 0.9494, test_loss: 1.0604, test_f1: 0.5264
 epoch: 23, train_loss: 0.9473, test_loss: 1.0628, test_f1: 0.5331
 epoch: 24, train_loss: 0.9405, test_loss: 1.0483, test_f1: 0.5271
 epoch: 25, train_loss: 0.9311, test_loss: 1.0515, test_f1: 0.5320
 epoch: 26, train_loss: 0.9153, test_loss: 1.0504, test_f1: 0.5215
 epoch: 27, train_loss: 0.9321, test_loss: 1.0537, test_f1: 0.5226
 epoch: 28, train_loss: 0.9184, test_loss: 1.0510, test_f1: 0.5234
 epoch: 29, train_loss: 0.9125, test_loss: 1.0398, test_f1: 0.5413
 epoch: 30, train_loss: 0.9210, test_loss: 1.0502, test_f1: 0.5338
 epoch: 31, train_loss: 0.9106, test_loss: 1.0465, test_f1: 0.5288
 epoch: 32, train_loss: 0.9035, test_loss: 1.0468, test_f1: 0.5459
 epoch: 33, train_loss: 0.8963, test_loss: 1.0462, test_f1: 0.5481
 epoch: 34, train_loss: 0.9072, test_loss: 1.0397, test_f1: 0.5547
 epoch: 35, train_loss: 0.8858, test_loss: 1.0346, test_f1: 0.5576
 epoch: 36, train_loss: 0.8889, test_loss: 1.0330, test_f1: 0.5789
 epoch: 37, train_loss: 0.8845, test_loss: 1.0383, test_f1: 0.5506
 epoch: 38, train_loss: 0.8713, test_loss: 1.0359, test_f1: 0.5488
 epoch: 39, train_loss: 0.8751, test_loss: 1.0257, test_f1: 0.5729
 epoch: 40, train_loss: 0.8797, test_loss: 1.0317, test_f1: 0.5745
 epoch: 41, train_loss: 0.8592, test_loss: 1.0457, test_f1: 0.5515
 epoch: 42, train_loss: 0.8731, test_loss: 1.0352, test_f1: 0.5604
 epoch: 43, train_loss: 0.8655, test_loss: 1.0367, test_f1: 0.5606
 epoch: 44, train_loss: 0.8600, test_loss: 1.0377, test_f1: 0.5604
 epoch: 45, train_loss: 0.8559, test_loss: 1.0477, test_f1: 0.5454
 epoch: 46, train_loss: 0.8508, test_loss: 1.0512, test_f1: 0.5365
 epoch: 47, train_loss: 0.8521, test_loss: 1.0570, test_f1: 0.5487
 epoch: 48, train_loss: 0.8492, test_loss: 1.0577, test_f1: 0.5436
 epoch: 49, train_loss: 0.8459, test_loss: 1.0591, test_f1: 0.5359
 epoch: 50, train_loss: 0.8409, test_loss: 1.0522, test_f1: 0.5389
 epoch: 51, train_loss: 0.8339, test_loss: 1.0581, test_f1: 0.5405
 epoch: 52, train_loss: 0.8226, test_loss: 1.0494, test_f1: 0.5344
 epoch: 53, train_loss: 0.8522, test_loss: 1.0517, test_f1: 0.5304
 epoch: 54, train_loss: 0.8281, test_loss: 1.0531, test_f1: 0.5384
 epoch: 55, train_loss: 0.8405, test_loss: 1.0572, test_f1: 0.5409
 epoch: 56, train_loss: 0.8320, test_loss: 1.0569, test_f1: 0.5237
 epoch: 57, train_loss: 0.8280, test_loss: 1.0590, test_f1: 0.5295
 epoch: 58, train_loss: 0.8282, test_loss: 1.0605, test_f1: 0.5423
 epoch: 59, train_loss: 0.8224, test_loss: 1.0522, test_f1: 0.5366
 epoch: 60, train_loss: 0.8237, test_loss: 1.0478, test_f1: 0.5359
 epoch: 61, train_loss: 0.8287, test_loss: 1.0459, test_f1: 0.5361
 epoch: 62, train_loss: 0.8226, test_loss: 1.0628, test_f1: 0.5353
 epoch: 63, train_loss: 0.8147, test_loss: 1.0666, test_f1: 0.5335
 epoch: 64, train_loss: 0.8186, test_loss: 1.0616, test_f1: 0.5230
 epoch: 65, train_loss: 0.8232, test_loss: 1.0770, test_f1: 0.5265
 epoch: 66, train_loss: 0.8244, test_loss: 1.0701, test_f1: 0.5347
 epoch: 67, train_loss: 0.8136, test_loss: 1.0631, test_f1: 0.5380
 epoch: 68, train_loss: 0.8169, test_loss: 1.0648, test_f1: 0.5321
 epoch: 69, train_loss: 0.8112, test_loss: 1.0746, test_f1: 0.5398
 epoch: 70, train_loss: 0.8137, test_loss: 1.0678, test_f1: 0.5367
 epoch: 71, train_loss: 0.8230, test_loss: 1.0775, test_f1: 0.5373
 epoch: 72, train_loss: 0.8091, test_loss: 1.0617, test_f1: 0.5404
 epoch: 73, train_loss: 0.7933, test_loss: 1.0791, test_f1: 0.5377
 epoch: 74, train_loss: 0.7985, test_loss: 1.0887, test_f1: 0.5285
 epoch: 75, train_loss: 0.8060, test_loss: 1.0784, test_f1: 0.5375
 epoch: 76, train_loss: 0.8115, test_loss: 1.0785, test_f1: 0.5364
 epoch: 77, train_loss: 0.8025, test_loss: 1.0820, test_f1: 0.5294
 epoch: 78, train_loss: 0.7929, test_loss: 1.0878, test_f1: 0.5238
 epoch: 79, train_loss: 0.8064, test_loss: 1.0762, test_f1: 0.5211
 epoch: 80, train_loss: 0.7962, test_loss: 1.0959, test_f1: 0.5276
 epoch: 81, train_loss: 0.7974, test_loss: 1.0830, test_f1: 0.5310
 epoch: 82, train_loss: 0.8033, test_loss: 1.0944, test_f1: 0.5328
 epoch: 83, train_loss: 0.7904, test_loss: 1.0890, test_f1: 0.5266
 epoch: 84, train_loss: 0.7826, test_loss: 1.1133, test_f1: 0.5263
 epoch: 85, train_loss: 0.7789, test_loss: 1.1043, test_f1: 0.5350
 epoch: 86, train_loss: 0.7861, test_loss: 1.0951, test_f1: 0.5473
 epoch: 87, train_loss: 0.7855, test_loss: 1.0867, test_f1: 0.5306
 epoch: 88, train_loss: 0.7856, test_loss: 1.0904, test_f1: 0.5309
 epoch: 89, train_loss: 0.7893, test_loss: 1.1043, test_f1: 0.5307
 epoch: 90, train_loss: 0.7721, test_loss: 1.0875, test_f1: 0.5427
 epoch: 91, train_loss: 0.7540, test_loss: 1.0898, test_f1: 0.5487
 epoch: 92, train_loss: 0.7866, test_loss: 1.1005, test_f1: 0.5190
 epoch: 93, train_loss: 0.7738, test_loss: 1.1143, test_f1: 0.5253
 epoch: 94, train_loss: 0.7804, test_loss: 1.1161, test_f1: 0.5406
 epoch: 95, train_loss: 0.7759, test_loss: 1.1181, test_f1: 0.5433
 epoch: 96, train_loss: 0.7684, test_loss: 1.1141, test_f1: 0.5403
 epoch: 97, train_loss: 0.7691, test_loss: 1.1272, test_f1: 0.5246
 epoch: 98, train_loss: 0.7734, test_loss: 1.0965, test_f1: 0.5302
 epoch: 99, train_loss: 0.7696, test_loss: 1.1195, test_f1: 0.5271
##################ITERATION #9 ****************************************
 epoch: 0, train_loss: 1.2682, test_loss: 1.2753, test_f1: 0.2281
 epoch: 1, train_loss: 1.1721, test_loss: 1.2328, test_f1: 0.2340
 epoch: 2, train_loss: 1.1502, test_loss: 1.1929, test_f1: 0.3392
 epoch: 3, train_loss: 1.1216, test_loss: 1.1719, test_f1: 0.3707
 epoch: 4, train_loss: 1.1174, test_loss: 1.1559, test_f1: 0.3500
 epoch: 5, train_loss: 1.0981, test_loss: 1.1388, test_f1: 0.3662
 epoch: 6, train_loss: 1.0775, test_loss: 1.1267, test_f1: 0.3580
 epoch: 7, train_loss: 1.0733, test_loss: 1.1214, test_f1: 0.3795
 epoch: 8, train_loss: 1.0774, test_loss: 1.1160, test_f1: 0.3707
 epoch: 9, train_loss: 1.0473, test_loss: 1.1129, test_f1: 0.3767
 epoch: 10, train_loss: 1.0391, test_loss: 1.1002, test_f1: 0.3699
 epoch: 11, train_loss: 1.0463, test_loss: 1.0942, test_f1: 0.3856
 epoch: 12, train_loss: 1.0359, test_loss: 1.0889, test_f1: 0.3903
 epoch: 13, train_loss: 1.0230, test_loss: 1.0880, test_f1: 0.4175
 epoch: 14, train_loss: 1.0075, test_loss: 1.0756, test_f1: 0.4471
 epoch: 15, train_loss: 1.0142, test_loss: 1.0877, test_f1: 0.4589
 epoch: 16, train_loss: 1.0028, test_loss: 1.0745, test_f1: 0.4559
 epoch: 17, train_loss: 0.9898, test_loss: 1.0700, test_f1: 0.4456
 epoch: 18, train_loss: 0.9760, test_loss: 1.0662, test_f1: 0.4662
 epoch: 19, train_loss: 0.9792, test_loss: 1.0690, test_f1: 0.4628
 epoch: 20, train_loss: 0.9813, test_loss: 1.0659, test_f1: 0.4697
 epoch: 21, train_loss: 0.9675, test_loss: 1.0533, test_f1: 0.4745
 epoch: 22, train_loss: 0.9541, test_loss: 1.0383, test_f1: 0.4847
 epoch: 23, train_loss: 0.9528, test_loss: 1.0443, test_f1: 0.4830
 epoch: 24, train_loss: 0.9535, test_loss: 1.0457, test_f1: 0.4891
 epoch: 25, train_loss: 0.9525, test_loss: 1.0461, test_f1: 0.4739
 epoch: 26, train_loss: 0.9419, test_loss: 1.0409, test_f1: 0.4791
 epoch: 27, train_loss: 0.9378, test_loss: 1.0410, test_f1: 0.4875
 epoch: 28, train_loss: 0.9483, test_loss: 1.0379, test_f1: 0.4935
 epoch: 29, train_loss: 0.9250, test_loss: 1.0426, test_f1: 0.4865
 epoch: 30, train_loss: 0.9309, test_loss: 1.0445, test_f1: 0.4901
 epoch: 31, train_loss: 0.9227, test_loss: 1.0513, test_f1: 0.4854
 epoch: 32, train_loss: 0.9121, test_loss: 1.0419, test_f1: 0.4745
 epoch: 33, train_loss: 0.9157, test_loss: 1.0421, test_f1: 0.4949
 epoch: 34, train_loss: 0.8992, test_loss: 1.0398, test_f1: 0.5043
 epoch: 35, train_loss: 0.9134, test_loss: 1.0407, test_f1: 0.5153
 epoch: 36, train_loss: 0.8947, test_loss: 1.0485, test_f1: 0.4859
 epoch: 37, train_loss: 0.9096, test_loss: 1.0382, test_f1: 0.4949
 epoch: 38, train_loss: 0.8904, test_loss: 1.0390, test_f1: 0.4888
 epoch: 39, train_loss: 0.8911, test_loss: 1.0450, test_f1: 0.5084
 epoch: 40, train_loss: 0.8978, test_loss: 1.0462, test_f1: 0.4981
 epoch: 41, train_loss: 0.8830, test_loss: 1.0688, test_f1: 0.5079
 epoch: 42, train_loss: 0.8845, test_loss: 1.0672, test_f1: 0.5167
 epoch: 43, train_loss: 0.8885, test_loss: 1.0530, test_f1: 0.5189
 epoch: 44, train_loss: 0.8836, test_loss: 1.0532, test_f1: 0.5154
 epoch: 45, train_loss: 0.8753, test_loss: 1.0568, test_f1: 0.5121
 epoch: 46, train_loss: 0.8854, test_loss: 1.0572, test_f1: 0.5150
 epoch: 47, train_loss: 0.8660, test_loss: 1.0695, test_f1: 0.5117
 epoch: 48, train_loss: 0.8749, test_loss: 1.0722, test_f1: 0.5263
 epoch: 49, train_loss: 0.8651, test_loss: 1.0590, test_f1: 0.5226
 epoch: 50, train_loss: 0.8573, test_loss: 1.0588, test_f1: 0.5273
 epoch: 51, train_loss: 0.8716, test_loss: 1.0615, test_f1: 0.5523
 epoch: 52, train_loss: 0.8571, test_loss: 1.0636, test_f1: 0.5463
 epoch: 53, train_loss: 0.8536, test_loss: 1.0660, test_f1: 0.5524
 epoch: 54, train_loss: 0.8614, test_loss: 1.0689, test_f1: 0.5349
 epoch: 55, train_loss: 0.8500, test_loss: 1.0518, test_f1: 0.5492
 epoch: 56, train_loss: 0.8484, test_loss: 1.0556, test_f1: 0.5319
 epoch: 57, train_loss: 0.8547, test_loss: 1.0617, test_f1: 0.5337
 epoch: 58, train_loss: 0.8658, test_loss: 1.0657, test_f1: 0.5223
 epoch: 59, train_loss: 0.8507, test_loss: 1.0665, test_f1: 0.5520
 epoch: 60, train_loss: 0.8463, test_loss: 1.0546, test_f1: 0.5390
 epoch: 61, train_loss: 0.8545, test_loss: 1.0626, test_f1: 0.5379
 epoch: 62, train_loss: 0.8420, test_loss: 1.0538, test_f1: 0.5413
 epoch: 63, train_loss: 0.8424, test_loss: 1.0730, test_f1: 0.5448
 epoch: 64, train_loss: 0.8470, test_loss: 1.0748, test_f1: 0.5445
 epoch: 65, train_loss: 0.8300, test_loss: 1.0705, test_f1: 0.5438
 epoch: 66, train_loss: 0.8430, test_loss: 1.0677, test_f1: 0.5485
 epoch: 67, train_loss: 0.8330, test_loss: 1.0632, test_f1: 0.5510
 epoch: 68, train_loss: 0.8304, test_loss: 1.0621, test_f1: 0.5524
 epoch: 69, train_loss: 0.8388, test_loss: 1.0706, test_f1: 0.5450
 epoch: 70, train_loss: 0.8312, test_loss: 1.0730, test_f1: 0.5502
 epoch: 71, train_loss: 0.8442, test_loss: 1.0616, test_f1: 0.5409
 epoch: 72, train_loss: 0.8264, test_loss: 1.0693, test_f1: 0.5377
 epoch: 73, train_loss: 0.8262, test_loss: 1.0760, test_f1: 0.5401
 epoch: 74, train_loss: 0.8308, test_loss: 1.0769, test_f1: 0.5458
 epoch: 75, train_loss: 0.8301, test_loss: 1.0836, test_f1: 0.5443
 epoch: 76, train_loss: 0.8314, test_loss: 1.0829, test_f1: 0.5480
 epoch: 77, train_loss: 0.8283, test_loss: 1.0701, test_f1: 0.5398
 epoch: 78, train_loss: 0.8324, test_loss: 1.0633, test_f1: 0.5316
 epoch: 79, train_loss: 0.8271, test_loss: 1.0642, test_f1: 0.5373
 epoch: 80, train_loss: 0.8330, test_loss: 1.0636, test_f1: 0.5426
 epoch: 81, train_loss: 0.8270, test_loss: 1.0730, test_f1: 0.5586
 epoch: 82, train_loss: 0.8296, test_loss: 1.0711, test_f1: 0.5741
 epoch: 83, train_loss: 0.8232, test_loss: 1.0828, test_f1: 0.5493
 epoch: 84, train_loss: 0.8154, test_loss: 1.0729, test_f1: 0.5554
 epoch: 85, train_loss: 0.8124, test_loss: 1.0747, test_f1: 0.5633
 epoch: 86, train_loss: 0.8108, test_loss: 1.0697, test_f1: 0.5539
 epoch: 87, train_loss: 0.8186, test_loss: 1.0739, test_f1: 0.5598
 epoch: 88, train_loss: 0.8209, test_loss: 1.0718, test_f1: 0.5532
 epoch: 89, train_loss: 0.8231, test_loss: 1.0853, test_f1: 0.5408
 epoch: 90, train_loss: 0.8264, test_loss: 1.0960, test_f1: 0.5545
 epoch: 91, train_loss: 0.8110, test_loss: 1.0676, test_f1: 0.5628
 epoch: 92, train_loss: 0.8242, test_loss: 1.0763, test_f1: 0.5569
 epoch: 93, train_loss: 0.8195, test_loss: 1.0871, test_f1: 0.5421
 epoch: 94, train_loss: 0.8149, test_loss: 1.0775, test_f1: 0.5394
 epoch: 95, train_loss: 0.8052, test_loss: 1.0795, test_f1: 0.5600
 epoch: 96, train_loss: 0.8098, test_loss: 1.0727, test_f1: 0.5571
 epoch: 97, train_loss: 0.8023, test_loss: 1.0766, test_f1: 0.5548
 epoch: 98, train_loss: 0.8074, test_loss: 1.0839, test_f1: 0.5581
 epoch: 99, train_loss: 0.8145, test_loss: 1.0843, test_f1: 0.5498

Training completed in 376.23 seconds
Best F1: 0.5979 at epoch 77
Mean F1 across iterations: 0.5638  0.0230
========================FINAL RESULTS================================
FEGIN weighted F1: 0.5979  0.0230
python main.py --data ltspice_demos --representation component_net --model FEGIN --layers 2 --hiddens 64 --batch_size 64 --lr 0.0001 --emb_size 128 --epochs 100 --save_appendix component_net_L2_H64_BS64_LR0.0001_E128 --no_val
-----



STDERR:
  File "main.py", line 370, in <module>
    main()
  File "main.py", line 254, in main
    dataset = dataset_class(
  File "/home/philip/projects/ltspice_examples_code_repo/Circuit-Completion-Using-GNNs/component_classification_with_link_prediction_head/evaluation/FEGIN/kernel/circuit_datasets.py", line 15, in __init__
    self.data, self.slices = torch.load(self.processed_paths[0])
  File "/home/philip/.local/lib/python3.8/site-packages/torch/serialization.py", line 1040, in load
    warnings.warn(
  File "/usr/lib/python3.8/warnings.py", line 109, in _showwarnmsg
    sw(msg.message, msg.category, msg.filename, msg.lineno,
  File "main.py", line 47, in warn_with_traceback
    traceback.print_stack(file=log)
/home/philip/projects/ltspice_examples_code_repo/Circuit-Completion-Using-GNNs/component_classification_with_link_prediction_head/evaluation/FEGIN/kernel/circuit_datasets.py:15: FutureWarning: You are using `torch.load` with `weights_only=False` (the current default value), which uses the default pickle module implicitly. It is possible to construct malicious pickle data which will execute arbitrary code during unpickling (See https://github.com/pytorch/pytorch/blob/main/SECURITY.md#untrusted-models for more details). In a future release, the default value for `weights_only` will be flipped to `True`. This limits the functions that could be executed during unpickling. Arbitrary objects will no longer be allowed to be loaded via this mode unless they are explicitly allowlisted by the user via `torch.serialization.add_safe_globals`. We recommend you start setting `weights_only=True` for any use case where you don't have full control of the loaded file. Please open an issue on GitHub for any issues related to this experimental feature.
  self.data, self.slices = torch.load(self.processed_paths[0])
