STDOUT:
Results will be saved in /home/philip/projects/llm_inference_code_repo/Circuit-Completion-Using-GNNs/component_classification_with_link_prediction_head/evaluation/FEGIN/results/model_FEGIN_dataset_ltspice_examples
Command line input: python main.py --data ltspice_examples --representation component_pin_net --model FEGIN --layers 2 --hiddens 128 --batch_size 32 --lr 0.01 --emb_size 128 --epochs 100 --save_appendix component_pin_net_L2_H128_BS32_LR0.01_E128 --no_val
 is saved.
-----
ltspice_examples - FEGIN
Using 2 layers, 128 hidden units, h = 2
Loading component_pin_net representation dataset
ENTERED
Training FEGIN on component_pin_net representation
Train: 3558, Test: 846
##################ITERATION #0 ****************************************
 epoch: 0, train_loss: 1.1203, test_loss: 1.2427, test_f1: 0.4190
 epoch: 1, train_loss: 1.0262, test_loss: 0.9832, test_f1: 0.4635
 epoch: 2, train_loss: 0.9834, test_loss: 1.1567, test_f1: 0.4843
 epoch: 3, train_loss: 0.9658, test_loss: 0.9654, test_f1: 0.5551
 epoch: 4, train_loss: 0.9619, test_loss: 0.9112, test_f1: 0.5056
 epoch: 5, train_loss: 0.9448, test_loss: 1.0662, test_f1: 0.4483
 epoch: 6, train_loss: 0.9476, test_loss: 0.9694, test_f1: 0.4695
 epoch: 7, train_loss: 0.9460, test_loss: 1.0004, test_f1: 0.5517
 epoch: 8, train_loss: 0.9167, test_loss: 1.0310, test_f1: 0.4859
 epoch: 9, train_loss: 0.9095, test_loss: 0.9719, test_f1: 0.5313
 epoch: 10, train_loss: 0.8718, test_loss: 0.9654, test_f1: 0.5359
 epoch: 11, train_loss: 0.8824, test_loss: 0.8921, test_f1: 0.5666
 epoch: 12, train_loss: 0.8692, test_loss: 0.8840, test_f1: 0.5155
 epoch: 13, train_loss: 0.8592, test_loss: 0.8820, test_f1: 0.6077
 epoch: 14, train_loss: 0.8619, test_loss: 0.9299, test_f1: 0.5281
 epoch: 15, train_loss: 0.8572, test_loss: 0.9372, test_f1: 0.4860
 epoch: 16, train_loss: 0.8450, test_loss: 1.2909, test_f1: 0.4064
 epoch: 17, train_loss: 0.8442, test_loss: 0.8828, test_f1: 0.5467
 epoch: 18, train_loss: 0.8253, test_loss: 0.8658, test_f1: 0.6103
 epoch: 19, train_loss: 0.8111, test_loss: 0.8752, test_f1: 0.5675
 epoch: 20, train_loss: 0.8244, test_loss: 0.9517, test_f1: 0.5785
 epoch: 21, train_loss: 0.8290, test_loss: 0.8551, test_f1: 0.5542
 epoch: 22, train_loss: 0.7980, test_loss: 0.8343, test_f1: 0.5757
 epoch: 23, train_loss: 0.8000, test_loss: 0.9373, test_f1: 0.5789
 epoch: 24, train_loss: 0.8481, test_loss: 0.9227, test_f1: 0.5606
 epoch: 25, train_loss: 0.8002, test_loss: 1.5380, test_f1: 0.4105
 epoch: 26, train_loss: 0.7989, test_loss: 0.8534, test_f1: 0.5769
 epoch: 27, train_loss: 0.7757, test_loss: 1.0084, test_f1: 0.5888
 epoch: 28, train_loss: 0.7886, test_loss: 0.9951, test_f1: 0.5959
 epoch: 29, train_loss: 0.7590, test_loss: 1.0101, test_f1: 0.5837
 epoch: 30, train_loss: 0.7492, test_loss: 0.8242, test_f1: 0.5839
 epoch: 31, train_loss: 0.7446, test_loss: 0.8812, test_f1: 0.5994
 epoch: 32, train_loss: 0.7474, test_loss: 0.8098, test_f1: 0.5859
 epoch: 33, train_loss: 0.7375, test_loss: 0.8230, test_f1: 0.6145
 epoch: 34, train_loss: 0.7096, test_loss: 1.1078, test_f1: 0.6302
 epoch: 35, train_loss: 0.7322, test_loss: 0.9739, test_f1: 0.5819
 epoch: 36, train_loss: 0.7189, test_loss: 0.8301, test_f1: 0.6180
 epoch: 37, train_loss: 0.7345, test_loss: 0.8348, test_f1: 0.5885
 epoch: 38, train_loss: 0.7227, test_loss: 0.8978, test_f1: 0.6052
 epoch: 39, train_loss: 0.6886, test_loss: 0.8465, test_f1: 0.6167
 epoch: 40, train_loss: 0.7043, test_loss: 1.0844, test_f1: 0.6116
 epoch: 41, train_loss: 0.6902, test_loss: 0.8690, test_f1: 0.6332
 epoch: 42, train_loss: 0.6870, test_loss: 0.9934, test_f1: 0.6038
 epoch: 43, train_loss: 0.6818, test_loss: 1.0210, test_f1: 0.6580
 epoch: 44, train_loss: 0.6833, test_loss: 1.0121, test_f1: 0.5836
 epoch: 45, train_loss: 0.6695, test_loss: 0.7664, test_f1: 0.6391
 epoch: 46, train_loss: 0.6626, test_loss: 1.0224, test_f1: 0.6154
 epoch: 47, train_loss: 0.6793, test_loss: 0.9145, test_f1: 0.6125
 epoch: 48, train_loss: 0.6565, test_loss: 1.1149, test_f1: 0.5992
 epoch: 49, train_loss: 0.6583, test_loss: 0.8857, test_f1: 0.6106
 epoch: 50, train_loss: 0.6619, test_loss: 0.8746, test_f1: 0.6162
 epoch: 51, train_loss: 0.6150, test_loss: 0.9232, test_f1: 0.6202
 epoch: 52, train_loss: 0.6125, test_loss: 0.9301, test_f1: 0.6142
 epoch: 53, train_loss: 0.5794, test_loss: 1.2897, test_f1: 0.6534
 epoch: 54, train_loss: 0.5704, test_loss: 0.9319, test_f1: 0.6410
 epoch: 55, train_loss: 0.5730, test_loss: 0.9673, test_f1: 0.6512
 epoch: 56, train_loss: 0.5591, test_loss: 0.9194, test_f1: 0.6169
 epoch: 57, train_loss: 0.5679, test_loss: 0.9769, test_f1: 0.6555
 epoch: 58, train_loss: 0.5364, test_loss: 0.9356, test_f1: 0.6342
 epoch: 59, train_loss: 0.5692, test_loss: 0.8714, test_f1: 0.6412
 epoch: 60, train_loss: 0.5666, test_loss: 0.8139, test_f1: 0.6317
 epoch: 61, train_loss: 0.5474, test_loss: 0.9532, test_f1: 0.6303
 epoch: 62, train_loss: 0.5423, test_loss: 1.0191, test_f1: 0.6696
 epoch: 63, train_loss: 0.5459, test_loss: 0.9536, test_f1: 0.6337
 epoch: 64, train_loss: 0.5330, test_loss: 0.9843, test_f1: 0.6736
 epoch: 65, train_loss: 0.5286, test_loss: 1.0282, test_f1: 0.6487
 epoch: 66, train_loss: 0.5275, test_loss: 1.0417, test_f1: 0.6549
 epoch: 67, train_loss: 0.5133, test_loss: 1.0961, test_f1: 0.6428
 epoch: 68, train_loss: 0.5165, test_loss: 0.9202, test_f1: 0.6741
 epoch: 69, train_loss: 0.5091, test_loss: 0.7992, test_f1: 0.6659
 epoch: 70, train_loss: 0.5052, test_loss: 1.1432, test_f1: 0.6444
 epoch: 71, train_loss: 0.5130, test_loss: 0.9514, test_f1: 0.6661
 epoch: 72, train_loss: 0.5020, test_loss: 0.9037, test_f1: 0.6775
 epoch: 73, train_loss: 0.5012, test_loss: 1.0601, test_f1: 0.6694
 epoch: 74, train_loss: 0.4981, test_loss: 1.0922, test_f1: 0.6786
 epoch: 75, train_loss: 0.4893, test_loss: 0.8961, test_f1: 0.6675
 epoch: 76, train_loss: 0.5009, test_loss: 1.0029, test_f1: 0.6539
 epoch: 77, train_loss: 0.5019, test_loss: 0.8057, test_f1: 0.6497
 epoch: 78, train_loss: 0.4841, test_loss: 0.9170, test_f1: 0.6974
 epoch: 79, train_loss: 0.4640, test_loss: 1.0033, test_f1: 0.6444
 epoch: 80, train_loss: 0.4741, test_loss: 1.1718, test_f1: 0.6319
 epoch: 81, train_loss: 0.4831, test_loss: 1.0516, test_f1: 0.6729
 epoch: 82, train_loss: 0.4855, test_loss: 1.0536, test_f1: 0.6625
 epoch: 83, train_loss: 0.4651, test_loss: 0.9992, test_f1: 0.6868
 epoch: 84, train_loss: 0.4757, test_loss: 0.8704, test_f1: 0.6810
 epoch: 85, train_loss: 0.4529, test_loss: 1.0698, test_f1: 0.6709
 epoch: 86, train_loss: 0.4489, test_loss: 0.8938, test_f1: 0.6607
 epoch: 87, train_loss: 0.4553, test_loss: 0.9881, test_f1: 0.6858
 epoch: 88, train_loss: 0.4753, test_loss: 0.9830, test_f1: 0.6870
 epoch: 89, train_loss: 0.4835, test_loss: 0.8870, test_f1: 0.6500
 epoch: 90, train_loss: 0.4603, test_loss: 1.0084, test_f1: 0.6683
 epoch: 91, train_loss: 0.4489, test_loss: 1.0275, test_f1: 0.6752
 epoch: 92, train_loss: 0.4679, test_loss: 1.0799, test_f1: 0.6685
 epoch: 93, train_loss: 0.4725, test_loss: 0.9819, test_f1: 0.6788
 epoch: 94, train_loss: 0.4301, test_loss: 1.0655, test_f1: 0.7048
 epoch: 95, train_loss: 0.4418, test_loss: 1.0574, test_f1: 0.6830
 epoch: 96, train_loss: 0.4538, test_loss: 0.8431, test_f1: 0.7008
 epoch: 97, train_loss: 0.4417, test_loss: 1.0553, test_f1: 0.6793
 epoch: 98, train_loss: 0.4416, test_loss: 1.1479, test_f1: 0.6575
 epoch: 99, train_loss: 0.4434, test_loss: 1.0369, test_f1: 0.6914
##################ITERATION #1 ****************************************
 epoch: 0, train_loss: 1.1084, test_loss: 1.0705, test_f1: 0.4591
 epoch: 1, train_loss: 0.9981, test_loss: 0.9995, test_f1: 0.4928
 epoch: 2, train_loss: 0.9641, test_loss: 1.0533, test_f1: 0.4769
 epoch: 3, train_loss: 0.9629, test_loss: 0.9404, test_f1: 0.5099
 epoch: 4, train_loss: 0.9379, test_loss: 1.0106, test_f1: 0.5525
 epoch: 5, train_loss: 0.9159, test_loss: 0.9524, test_f1: 0.4981
 epoch: 6, train_loss: 0.9289, test_loss: 1.0146, test_f1: 0.5039
 epoch: 7, train_loss: 0.9095, test_loss: 0.9718, test_f1: 0.5041
 epoch: 8, train_loss: 0.9021, test_loss: 1.0808, test_f1: 0.5204
 epoch: 9, train_loss: 0.8855, test_loss: 0.9247, test_f1: 0.5399
 epoch: 10, train_loss: 0.8732, test_loss: 0.9453, test_f1: 0.5290
 epoch: 11, train_loss: 0.8715, test_loss: 0.9145, test_f1: 0.5396
 epoch: 12, train_loss: 0.8815, test_loss: 0.9981, test_f1: 0.4996
 epoch: 13, train_loss: 0.8466, test_loss: 1.0641, test_f1: 0.5014
 epoch: 14, train_loss: 0.8447, test_loss: 0.9851, test_f1: 0.5204
 epoch: 15, train_loss: 0.8467, test_loss: 0.9412, test_f1: 0.5328
 epoch: 16, train_loss: 0.8389, test_loss: 0.9321, test_f1: 0.5466
 epoch: 17, train_loss: 0.8238, test_loss: 0.8296, test_f1: 0.5837
 epoch: 18, train_loss: 0.8067, test_loss: 0.8997, test_f1: 0.5661
 epoch: 19, train_loss: 0.8058, test_loss: 0.9666, test_f1: 0.5844
 epoch: 20, train_loss: 0.8226, test_loss: 0.9965, test_f1: 0.5874
 epoch: 21, train_loss: 0.8005, test_loss: 0.8515, test_f1: 0.6040
 epoch: 22, train_loss: 0.8024, test_loss: 0.8413, test_f1: 0.5613
 epoch: 23, train_loss: 0.7980, test_loss: 0.8735, test_f1: 0.6133
 epoch: 24, train_loss: 0.7981, test_loss: 1.0044, test_f1: 0.5441
 epoch: 25, train_loss: 0.7889, test_loss: 0.8806, test_f1: 0.5846
 epoch: 26, train_loss: 0.7830, test_loss: 0.8019, test_f1: 0.6476
 epoch: 27, train_loss: 0.7647, test_loss: 0.8042, test_f1: 0.6178
 epoch: 28, train_loss: 0.7892, test_loss: 0.8891, test_f1: 0.5570
 epoch: 29, train_loss: 0.7633, test_loss: 0.8493, test_f1: 0.5988
 epoch: 30, train_loss: 0.7627, test_loss: 0.9031, test_f1: 0.6253
 epoch: 31, train_loss: 0.7539, test_loss: 0.9352, test_f1: 0.5332
 epoch: 32, train_loss: 0.7590, test_loss: 0.8304, test_f1: 0.6421
 epoch: 33, train_loss: 0.7235, test_loss: 0.9238, test_f1: 0.5837
 epoch: 34, train_loss: 0.7493, test_loss: 0.8349, test_f1: 0.6412
 epoch: 35, train_loss: 0.7209, test_loss: 0.8828, test_f1: 0.5879
 epoch: 36, train_loss: 0.7262, test_loss: 0.9914, test_f1: 0.5987
 epoch: 37, train_loss: 0.7044, test_loss: 0.9637, test_f1: 0.6382
 epoch: 38, train_loss: 0.7135, test_loss: 0.8070, test_f1: 0.6068
 epoch: 39, train_loss: 0.7114, test_loss: 0.8361, test_f1: 0.6056
 epoch: 40, train_loss: 0.6969, test_loss: 0.8262, test_f1: 0.6455
 epoch: 41, train_loss: 0.6755, test_loss: 0.8014, test_f1: 0.6496
 epoch: 42, train_loss: 0.6801, test_loss: 0.8277, test_f1: 0.6057
 epoch: 43, train_loss: 0.7107, test_loss: 0.8640, test_f1: 0.6140
 epoch: 44, train_loss: 0.7018, test_loss: 0.8495, test_f1: 0.6261
 epoch: 45, train_loss: 0.7046, test_loss: 0.8277, test_f1: 0.6070
 epoch: 46, train_loss: 0.6797, test_loss: 0.8889, test_f1: 0.6249
 epoch: 47, train_loss: 0.6916, test_loss: 1.1754, test_f1: 0.6210
 epoch: 48, train_loss: 0.6887, test_loss: 0.9182, test_f1: 0.6252
 epoch: 49, train_loss: 0.6740, test_loss: 0.8447, test_f1: 0.5977
 epoch: 50, train_loss: 0.6708, test_loss: 0.7941, test_f1: 0.6251
 epoch: 51, train_loss: 0.6139, test_loss: 0.8073, test_f1: 0.6523
 epoch: 52, train_loss: 0.6118, test_loss: 0.7662, test_f1: 0.6654
 epoch: 53, train_loss: 0.5748, test_loss: 0.7944, test_f1: 0.6615
 epoch: 54, train_loss: 0.5877, test_loss: 0.7781, test_f1: 0.6678
 epoch: 55, train_loss: 0.5733, test_loss: 0.8311, test_f1: 0.6424
 epoch: 56, train_loss: 0.5777, test_loss: 0.8358, test_f1: 0.6553
 epoch: 57, train_loss: 0.5757, test_loss: 0.8479, test_f1: 0.6688
 epoch: 58, train_loss: 0.5643, test_loss: 0.8826, test_f1: 0.6561
 epoch: 59, train_loss: 0.5755, test_loss: 0.8000, test_f1: 0.6734
 epoch: 60, train_loss: 0.5492, test_loss: 0.7223, test_f1: 0.6755
 epoch: 61, train_loss: 0.5588, test_loss: 0.8053, test_f1: 0.6820
 epoch: 62, train_loss: 0.5513, test_loss: 0.7641, test_f1: 0.6734
 epoch: 63, train_loss: 0.5483, test_loss: 0.8097, test_f1: 0.6851
 epoch: 64, train_loss: 0.5315, test_loss: 0.9862, test_f1: 0.6655
 epoch: 65, train_loss: 0.5148, test_loss: 0.9987, test_f1: 0.6796
 epoch: 66, train_loss: 0.5330, test_loss: 0.9352, test_f1: 0.6795
 epoch: 67, train_loss: 0.5432, test_loss: 0.8998, test_f1: 0.6406
 epoch: 68, train_loss: 0.5308, test_loss: 0.7848, test_f1: 0.6648
 epoch: 69, train_loss: 0.5115, test_loss: 0.8499, test_f1: 0.6893
 epoch: 70, train_loss: 0.5288, test_loss: 0.8771, test_f1: 0.6662
 epoch: 71, train_loss: 0.5134, test_loss: 0.8805, test_f1: 0.6650
 epoch: 72, train_loss: 0.5090, test_loss: 0.8921, test_f1: 0.6608
 epoch: 73, train_loss: 0.5028, test_loss: 0.8149, test_f1: 0.6496
 epoch: 74, train_loss: 0.5089, test_loss: 0.7864, test_f1: 0.6587
 epoch: 75, train_loss: 0.4832, test_loss: 0.8721, test_f1: 0.6788
 epoch: 76, train_loss: 0.5160, test_loss: 0.8334, test_f1: 0.6604
 epoch: 77, train_loss: 0.4959, test_loss: 0.9012, test_f1: 0.6694
 epoch: 78, train_loss: 0.4819, test_loss: 0.9715, test_f1: 0.6652
 epoch: 79, train_loss: 0.4908, test_loss: 0.9674, test_f1: 0.6545
 epoch: 80, train_loss: 0.4688, test_loss: 1.0229, test_f1: 0.6442
 epoch: 81, train_loss: 0.4712, test_loss: 0.9197, test_f1: 0.6747
 epoch: 82, train_loss: 0.4918, test_loss: 1.0447, test_f1: 0.6673
 epoch: 83, train_loss: 0.4942, test_loss: 0.8325, test_f1: 0.6684
 epoch: 84, train_loss: 0.4753, test_loss: 0.9194, test_f1: 0.6680
 epoch: 85, train_loss: 0.5156, test_loss: 0.9681, test_f1: 0.6588
 epoch: 86, train_loss: 0.4646, test_loss: 0.9005, test_f1: 0.6600
 epoch: 87, train_loss: 0.4675, test_loss: 0.9806, test_f1: 0.6575
 epoch: 88, train_loss: 0.4727, test_loss: 0.9773, test_f1: 0.6662
 epoch: 89, train_loss: 0.4705, test_loss: 0.9296, test_f1: 0.6566
 epoch: 90, train_loss: 0.4497, test_loss: 1.1505, test_f1: 0.6695
 epoch: 91, train_loss: 0.4448, test_loss: 1.2087, test_f1: 0.6628
 epoch: 92, train_loss: 0.4557, test_loss: 0.9523, test_f1: 0.6797
 epoch: 93, train_loss: 0.4471, test_loss: 1.0606, test_f1: 0.6499
 epoch: 94, train_loss: 0.4849, test_loss: 1.0775, test_f1: 0.6328
 epoch: 95, train_loss: 0.4634, test_loss: 1.0186, test_f1: 0.6617
 epoch: 96, train_loss: 0.4404, test_loss: 0.9381, test_f1: 0.6788
 epoch: 97, train_loss: 0.4599, test_loss: 1.0265, test_f1: 0.6698
 epoch: 98, train_loss: 0.4382, test_loss: 0.9458, test_f1: 0.6707
 epoch: 99, train_loss: 0.4414, test_loss: 1.0231, test_f1: 0.6732
##################ITERATION #2 ****************************************
 epoch: 0, train_loss: 1.1277, test_loss: 1.0986, test_f1: 0.3395
 epoch: 1, train_loss: 1.0237, test_loss: 0.9414, test_f1: 0.5254
 epoch: 2, train_loss: 0.9809, test_loss: 1.0305, test_f1: 0.4568
 epoch: 3, train_loss: 0.9741, test_loss: 0.9728, test_f1: 0.4723
 epoch: 4, train_loss: 0.9701, test_loss: 0.9462, test_f1: 0.5208
 epoch: 5, train_loss: 0.9356, test_loss: 0.9342, test_f1: 0.5139
 epoch: 6, train_loss: 0.9118, test_loss: 0.8719, test_f1: 0.5710
 epoch: 7, train_loss: 0.9037, test_loss: 1.0991, test_f1: 0.4527
 epoch: 8, train_loss: 0.9009, test_loss: 0.8948, test_f1: 0.5884
 epoch: 9, train_loss: 0.8900, test_loss: 1.1013, test_f1: 0.4714
 epoch: 10, train_loss: 0.8801, test_loss: 0.9256, test_f1: 0.4858
 epoch: 11, train_loss: 0.8609, test_loss: 0.9831, test_f1: 0.5419
 epoch: 12, train_loss: 0.8428, test_loss: 0.8552, test_f1: 0.6095
 epoch: 13, train_loss: 0.8454, test_loss: 0.9432, test_f1: 0.5341
 epoch: 14, train_loss: 0.8411, test_loss: 0.9211, test_f1: 0.5643
 epoch: 15, train_loss: 0.8189, test_loss: 0.9254, test_f1: 0.5567
 epoch: 16, train_loss: 0.8113, test_loss: 1.0969, test_f1: 0.5031
 epoch: 17, train_loss: 0.8278, test_loss: 0.8974, test_f1: 0.5754
 epoch: 18, train_loss: 0.8165, test_loss: 0.9786, test_f1: 0.6013
 epoch: 19, train_loss: 0.8038, test_loss: 0.9058, test_f1: 0.6112
 epoch: 20, train_loss: 0.8033, test_loss: 0.9414, test_f1: 0.5506
 epoch: 21, train_loss: 0.7839, test_loss: 0.9556, test_f1: 0.5607
 epoch: 22, train_loss: 0.7729, test_loss: 0.9651, test_f1: 0.6026
 epoch: 23, train_loss: 0.7830, test_loss: 0.9169, test_f1: 0.6084
 epoch: 24, train_loss: 0.7667, test_loss: 0.9049, test_f1: 0.6053
 epoch: 25, train_loss: 0.7795, test_loss: 0.7867, test_f1: 0.5490
 epoch: 26, train_loss: 0.7727, test_loss: 0.9185, test_f1: 0.6128
 epoch: 27, train_loss: 0.7707, test_loss: 0.9724, test_f1: 0.5882
 epoch: 28, train_loss: 0.7547, test_loss: 0.9079, test_f1: 0.6217
 epoch: 29, train_loss: 0.7518, test_loss: 1.0105, test_f1: 0.6325
 epoch: 30, train_loss: 0.7544, test_loss: 0.8898, test_f1: 0.5889
 epoch: 31, train_loss: 0.7600, test_loss: 0.7953, test_f1: 0.6096
 epoch: 32, train_loss: 0.7462, test_loss: 0.9462, test_f1: 0.6251
 epoch: 33, train_loss: 0.7379, test_loss: 0.8101, test_f1: 0.6093
 epoch: 34, train_loss: 0.7093, test_loss: 0.8722, test_f1: 0.6251
 epoch: 35, train_loss: 0.7350, test_loss: 0.7736, test_f1: 0.6601
 epoch: 36, train_loss: 0.7211, test_loss: 0.7970, test_f1: 0.6356
 epoch: 37, train_loss: 0.7211, test_loss: 0.7441, test_f1: 0.6351
 epoch: 38, train_loss: 0.7110, test_loss: 0.9984, test_f1: 0.6218
 epoch: 39, train_loss: 0.7250, test_loss: 0.8202, test_f1: 0.6406
 epoch: 40, train_loss: 0.7167, test_loss: 0.8689, test_f1: 0.6303
 epoch: 41, train_loss: 0.7265, test_loss: 0.8811, test_f1: 0.6385
 epoch: 42, train_loss: 0.7029, test_loss: 0.9140, test_f1: 0.6032
 epoch: 43, train_loss: 0.6800, test_loss: 0.9116, test_f1: 0.6238
 epoch: 44, train_loss: 0.7049, test_loss: 0.8413, test_f1: 0.6376
 epoch: 45, train_loss: 0.6964, test_loss: 0.8363, test_f1: 0.6585
 epoch: 46, train_loss: 0.6907, test_loss: 0.8806, test_f1: 0.6351
 epoch: 47, train_loss: 0.6820, test_loss: 0.7968, test_f1: 0.6437
 epoch: 48, train_loss: 0.6661, test_loss: 0.7951, test_f1: 0.6296
 epoch: 49, train_loss: 0.7331, test_loss: 0.9547, test_f1: 0.6143
 epoch: 50, train_loss: 0.7074, test_loss: 0.7182, test_f1: 0.6577
 epoch: 51, train_loss: 0.6536, test_loss: 0.7416, test_f1: 0.6684
 epoch: 52, train_loss: 0.6534, test_loss: 0.7887, test_f1: 0.6548
 epoch: 53, train_loss: 0.6163, test_loss: 0.7689, test_f1: 0.6630
 epoch: 54, train_loss: 0.6163, test_loss: 0.7135, test_f1: 0.6749
 epoch: 55, train_loss: 0.6059, test_loss: 0.7170, test_f1: 0.6721
 epoch: 56, train_loss: 0.5896, test_loss: 0.7129, test_f1: 0.6798
 epoch: 57, train_loss: 0.6025, test_loss: 0.7367, test_f1: 0.7016
 epoch: 58, train_loss: 0.5856, test_loss: 0.6666, test_f1: 0.6811
 epoch: 59, train_loss: 0.5755, test_loss: 0.7767, test_f1: 0.6847
 epoch: 60, train_loss: 0.5842, test_loss: 0.8656, test_f1: 0.6757
 epoch: 61, train_loss: 0.5738, test_loss: 0.8212, test_f1: 0.6702
 epoch: 62, train_loss: 0.5846, test_loss: 0.8370, test_f1: 0.6617
 epoch: 63, train_loss: 0.5700, test_loss: 0.8274, test_f1: 0.6824
 epoch: 64, train_loss: 0.5728, test_loss: 0.8531, test_f1: 0.6813
 epoch: 65, train_loss: 0.5473, test_loss: 0.7805, test_f1: 0.7122
 epoch: 66, train_loss: 0.5457, test_loss: 0.7196, test_f1: 0.6886
 epoch: 67, train_loss: 0.5523, test_loss: 0.7721, test_f1: 0.6880
 epoch: 68, train_loss: 0.5411, test_loss: 0.8654, test_f1: 0.6655
 epoch: 69, train_loss: 0.5340, test_loss: 0.8063, test_f1: 0.6869
 epoch: 70, train_loss: 0.5440, test_loss: 0.7721, test_f1: 0.6853
 epoch: 71, train_loss: 0.5448, test_loss: 0.8743, test_f1: 0.6952
 epoch: 72, train_loss: 0.5367, test_loss: 0.7812, test_f1: 0.6919
 epoch: 73, train_loss: 0.5354, test_loss: 0.7933, test_f1: 0.6833
 epoch: 74, train_loss: 0.5360, test_loss: 0.7234, test_f1: 0.7025
 epoch: 75, train_loss: 0.5207, test_loss: 0.7305, test_f1: 0.7104
 epoch: 76, train_loss: 0.5070, test_loss: 0.8158, test_f1: 0.6876
 epoch: 77, train_loss: 0.5002, test_loss: 0.8461, test_f1: 0.6779
 epoch: 78, train_loss: 0.5204, test_loss: 0.8171, test_f1: 0.7084
 epoch: 79, train_loss: 0.5122, test_loss: 1.0594, test_f1: 0.6532
 epoch: 80, train_loss: 0.5344, test_loss: 0.7439, test_f1: 0.6836
 epoch: 81, train_loss: 0.5143, test_loss: 0.7797, test_f1: 0.6739
 epoch: 82, train_loss: 0.4985, test_loss: 0.7727, test_f1: 0.6767
 epoch: 83, train_loss: 0.5186, test_loss: 0.8223, test_f1: 0.6826
 epoch: 84, train_loss: 0.4891, test_loss: 0.8392, test_f1: 0.6775
 epoch: 85, train_loss: 0.4902, test_loss: 0.8105, test_f1: 0.6897
 epoch: 86, train_loss: 0.4927, test_loss: 0.9168, test_f1: 0.6818
 epoch: 87, train_loss: 0.5128, test_loss: 0.8488, test_f1: 0.6888
 epoch: 88, train_loss: 0.5095, test_loss: 0.8218, test_f1: 0.6974
 epoch: 89, train_loss: 0.4794, test_loss: 0.7264, test_f1: 0.7041
 epoch: 90, train_loss: 0.4707, test_loss: 0.9060, test_f1: 0.6425
 epoch: 91, train_loss: 0.4727, test_loss: 0.8577, test_f1: 0.6638
 epoch: 92, train_loss: 0.4929, test_loss: 0.7645, test_f1: 0.6849
 epoch: 93, train_loss: 0.4747, test_loss: 0.7369, test_f1: 0.6858
 epoch: 94, train_loss: 0.4765, test_loss: 0.7012, test_f1: 0.7065
 epoch: 95, train_loss: 0.4715, test_loss: 0.7779, test_f1: 0.6663
 epoch: 96, train_loss: 0.4479, test_loss: 0.8433, test_f1: 0.6929
 epoch: 97, train_loss: 0.4770, test_loss: 0.9128, test_f1: 0.7031
 epoch: 98, train_loss: 0.4444, test_loss: 0.8247, test_f1: 0.7067
 epoch: 99, train_loss: 0.4613, test_loss: 0.8224, test_f1: 0.7041
##################ITERATION #3 ****************************************
 epoch: 0, train_loss: 1.1171, test_loss: 1.1158, test_f1: 0.4577
 epoch: 1, train_loss: 0.9973, test_loss: 0.9917, test_f1: 0.4795
 epoch: 2, train_loss: 0.9593, test_loss: 0.9426, test_f1: 0.5374
 epoch: 3, train_loss: 0.9412, test_loss: 0.9505, test_f1: 0.4887
 epoch: 4, train_loss: 0.9357, test_loss: 0.9512, test_f1: 0.5053
 epoch: 5, train_loss: 0.9244, test_loss: 0.9114, test_f1: 0.5145
 epoch: 6, train_loss: 0.9067, test_loss: 0.8907, test_f1: 0.5218
 epoch: 7, train_loss: 0.8955, test_loss: 0.8883, test_f1: 0.5379
 epoch: 8, train_loss: 0.8859, test_loss: 0.9954, test_f1: 0.5228
 epoch: 9, train_loss: 0.8732, test_loss: 1.0380, test_f1: 0.4813
 epoch: 10, train_loss: 0.8644, test_loss: 0.9767, test_f1: 0.5335
 epoch: 11, train_loss: 0.8642, test_loss: 0.9155, test_f1: 0.5153
 epoch: 12, train_loss: 0.8501, test_loss: 0.9829, test_f1: 0.5923
 epoch: 13, train_loss: 0.8448, test_loss: 0.9147, test_f1: 0.5819
 epoch: 14, train_loss: 0.8352, test_loss: 0.8361, test_f1: 0.5505
 epoch: 15, train_loss: 0.8299, test_loss: 0.9079, test_f1: 0.5367
 epoch: 16, train_loss: 0.8275, test_loss: 0.9087, test_f1: 0.5799
 epoch: 17, train_loss: 0.8188, test_loss: 0.8227, test_f1: 0.5967
 epoch: 18, train_loss: 0.8157, test_loss: 0.8669, test_f1: 0.5515
 epoch: 19, train_loss: 0.8213, test_loss: 0.8473, test_f1: 0.5575
 epoch: 20, train_loss: 0.8021, test_loss: 0.7769, test_f1: 0.6275
 epoch: 21, train_loss: 0.7981, test_loss: 0.8771, test_f1: 0.6210
 epoch: 22, train_loss: 0.7977, test_loss: 0.8880, test_f1: 0.6239
 epoch: 23, train_loss: 0.7880, test_loss: 0.8816, test_f1: 0.5421
 epoch: 24, train_loss: 0.7745, test_loss: 0.8328, test_f1: 0.5796
 epoch: 25, train_loss: 0.7811, test_loss: 0.9187, test_f1: 0.5395
 epoch: 26, train_loss: 0.8320, test_loss: 0.8659, test_f1: 0.5719
 epoch: 27, train_loss: 0.8094, test_loss: 0.8570, test_f1: 0.6105
 epoch: 28, train_loss: 0.7624, test_loss: 0.7480, test_f1: 0.5854
 epoch: 29, train_loss: 0.7558, test_loss: 0.8136, test_f1: 0.6155
 epoch: 30, train_loss: 0.7400, test_loss: 0.7903, test_f1: 0.5997
 epoch: 31, train_loss: 0.7335, test_loss: 0.7903, test_f1: 0.6244
 epoch: 32, train_loss: 0.7351, test_loss: 0.8663, test_f1: 0.6409
 epoch: 33, train_loss: 0.7357, test_loss: 0.9070, test_f1: 0.6542
 epoch: 34, train_loss: 0.7307, test_loss: 0.7633, test_f1: 0.6406
 epoch: 35, train_loss: 0.6988, test_loss: 0.7741, test_f1: 0.6385
 epoch: 36, train_loss: 0.7196, test_loss: 0.7471, test_f1: 0.6138
 epoch: 37, train_loss: 0.7416, test_loss: 0.6856, test_f1: 0.6742
 epoch: 38, train_loss: 0.7087, test_loss: 0.7678, test_f1: 0.6075
 epoch: 39, train_loss: 0.7252, test_loss: 0.7530, test_f1: 0.5963
 epoch: 40, train_loss: 0.7096, test_loss: 0.7756, test_f1: 0.6281
 epoch: 41, train_loss: 0.7215, test_loss: 0.7660, test_f1: 0.6386
 epoch: 42, train_loss: 0.7166, test_loss: 0.7830, test_f1: 0.6078
 epoch: 43, train_loss: 0.6681, test_loss: 0.7914, test_f1: 0.6224
 epoch: 44, train_loss: 0.6785, test_loss: 0.8571, test_f1: 0.6682
 epoch: 45, train_loss: 0.6841, test_loss: 0.7855, test_f1: 0.6701
 epoch: 46, train_loss: 0.6833, test_loss: 0.7688, test_f1: 0.6423
 epoch: 47, train_loss: 0.6657, test_loss: 0.7978, test_f1: 0.6704
 epoch: 48, train_loss: 0.6865, test_loss: 0.8081, test_f1: 0.6226
 epoch: 49, train_loss: 0.6494, test_loss: 0.8271, test_f1: 0.6377
 epoch: 50, train_loss: 0.6729, test_loss: 0.7122, test_f1: 0.6882
 epoch: 51, train_loss: 0.5998, test_loss: 0.6759, test_f1: 0.6987
 epoch: 52, train_loss: 0.5947, test_loss: 0.7053, test_f1: 0.6674
 epoch: 53, train_loss: 0.5854, test_loss: 0.7417, test_f1: 0.6805
 epoch: 54, train_loss: 0.5595, test_loss: 0.7583, test_f1: 0.6797
 epoch: 55, train_loss: 0.5646, test_loss: 0.7846, test_f1: 0.6886
 epoch: 56, train_loss: 0.5666, test_loss: 0.7098, test_f1: 0.6857
 epoch: 57, train_loss: 0.5515, test_loss: 0.7829, test_f1: 0.6775
 epoch: 58, train_loss: 0.5596, test_loss: 0.7745, test_f1: 0.6967
 epoch: 59, train_loss: 0.5591, test_loss: 0.7607, test_f1: 0.6745
 epoch: 60, train_loss: 0.5572, test_loss: 0.8114, test_f1: 0.6649
 epoch: 61, train_loss: 0.5257, test_loss: 0.7703, test_f1: 0.6695
 epoch: 62, train_loss: 0.5394, test_loss: 0.7576, test_f1: 0.6994
 epoch: 63, train_loss: 0.5276, test_loss: 0.7414, test_f1: 0.6981
 epoch: 64, train_loss: 0.5150, test_loss: 0.8309, test_f1: 0.6271
 epoch: 65, train_loss: 0.5278, test_loss: 0.7537, test_f1: 0.6658
 epoch: 66, train_loss: 0.5273, test_loss: 0.8459, test_f1: 0.6788
 epoch: 67, train_loss: 0.5066, test_loss: 0.7901, test_f1: 0.6679
 epoch: 68, train_loss: 0.5348, test_loss: 0.7874, test_f1: 0.6684
 epoch: 69, train_loss: 0.5215, test_loss: 0.7471, test_f1: 0.6982
 epoch: 70, train_loss: 0.5072, test_loss: 0.7656, test_f1: 0.6941
 epoch: 71, train_loss: 0.5030, test_loss: 0.7807, test_f1: 0.6816
 epoch: 72, train_loss: 0.5140, test_loss: 0.7289, test_f1: 0.6890
 epoch: 73, train_loss: 0.4992, test_loss: 0.7734, test_f1: 0.6941
 epoch: 74, train_loss: 0.4919, test_loss: 0.7521, test_f1: 0.6661
 epoch: 75, train_loss: 0.4913, test_loss: 0.7908, test_f1: 0.6751
 epoch: 76, train_loss: 0.5115, test_loss: 0.7832, test_f1: 0.6620
 epoch: 77, train_loss: 0.4921, test_loss: 0.8171, test_f1: 0.6976
 epoch: 78, train_loss: 0.4883, test_loss: 0.8245, test_f1: 0.6751
 epoch: 79, train_loss: 0.4765, test_loss: 0.7632, test_f1: 0.6845
 epoch: 80, train_loss: 0.4744, test_loss: 0.8176, test_f1: 0.6768
 epoch: 81, train_loss: 0.4636, test_loss: 0.8215, test_f1: 0.6924
 epoch: 82, train_loss: 0.4554, test_loss: 0.8515, test_f1: 0.6840
 epoch: 83, train_loss: 0.4714, test_loss: 0.8357, test_f1: 0.6788
 epoch: 84, train_loss: 0.4645, test_loss: 0.7916, test_f1: 0.6869
 epoch: 85, train_loss: 0.4439, test_loss: 0.8886, test_f1: 0.6682
 epoch: 86, train_loss: 0.4738, test_loss: 0.8546, test_f1: 0.6425
 epoch: 87, train_loss: 0.4720, test_loss: 0.8145, test_f1: 0.6872
 epoch: 88, train_loss: 0.4497, test_loss: 0.8393, test_f1: 0.6843
 epoch: 89, train_loss: 0.4354, test_loss: 0.8088, test_f1: 0.6683
 epoch: 90, train_loss: 0.4304, test_loss: 0.7721, test_f1: 0.6949
 epoch: 91, train_loss: 0.4411, test_loss: 0.7906, test_f1: 0.7054
 epoch: 92, train_loss: 0.4224, test_loss: 0.8242, test_f1: 0.6964
 epoch: 93, train_loss: 0.4420, test_loss: 0.8091, test_f1: 0.6800
 epoch: 94, train_loss: 0.4391, test_loss: 0.7902, test_f1: 0.6906
 epoch: 95, train_loss: 0.4346, test_loss: 0.8156, test_f1: 0.6584
 epoch: 96, train_loss: 0.4501, test_loss: 0.7951, test_f1: 0.7216
 epoch: 97, train_loss: 0.4300, test_loss: 0.9244, test_f1: 0.6851
 epoch: 98, train_loss: 0.4117, test_loss: 0.8961, test_f1: 0.6749
 epoch: 99, train_loss: 0.4191, test_loss: 0.8479, test_f1: 0.6797
##################ITERATION #4 ****************************************
 epoch: 0, train_loss: 1.1212, test_loss: 1.1035, test_f1: 0.4996
 epoch: 1, train_loss: 0.9909, test_loss: 0.9590, test_f1: 0.5005
 epoch: 2, train_loss: 0.9786, test_loss: 0.9675, test_f1: 0.5059
 epoch: 3, train_loss: 0.9481, test_loss: 1.0261, test_f1: 0.4073
 epoch: 4, train_loss: 0.9238, test_loss: 0.9154, test_f1: 0.5019
 epoch: 5, train_loss: 0.9455, test_loss: 1.2041, test_f1: 0.3577
 epoch: 6, train_loss: 0.9101, test_loss: 0.8864, test_f1: 0.5542
 epoch: 7, train_loss: 0.8949, test_loss: 0.9323, test_f1: 0.5303
 epoch: 8, train_loss: 0.9041, test_loss: 0.8925, test_f1: 0.5125
 epoch: 9, train_loss: 0.8828, test_loss: 0.9423, test_f1: 0.5786
 epoch: 10, train_loss: 0.8678, test_loss: 1.1213, test_f1: 0.4508
 epoch: 11, train_loss: 0.8577, test_loss: 1.2487, test_f1: 0.3857
 epoch: 12, train_loss: 0.8815, test_loss: 0.9658, test_f1: 0.5312
 epoch: 13, train_loss: 0.8457, test_loss: 0.9628, test_f1: 0.5443
 epoch: 14, train_loss: 0.8428, test_loss: 0.8510, test_f1: 0.5596
 epoch: 15, train_loss: 0.8214, test_loss: 0.8664, test_f1: 0.5625
 epoch: 16, train_loss: 0.8296, test_loss: 0.9623, test_f1: 0.5267
 epoch: 17, train_loss: 0.8114, test_loss: 0.9630, test_f1: 0.5845
 epoch: 18, train_loss: 0.8057, test_loss: 0.9314, test_f1: 0.6107
 epoch: 19, train_loss: 0.8293, test_loss: 0.9827, test_f1: 0.5970
 epoch: 20, train_loss: 0.8012, test_loss: 0.8236, test_f1: 0.5568
 epoch: 21, train_loss: 0.8110, test_loss: 0.8791, test_f1: 0.6284
 epoch: 22, train_loss: 0.7628, test_loss: 0.8775, test_f1: 0.5814
 epoch: 23, train_loss: 0.7790, test_loss: 0.8985, test_f1: 0.5722
 epoch: 24, train_loss: 0.7554, test_loss: 0.9652, test_f1: 0.6171
 epoch: 25, train_loss: 0.7459, test_loss: 0.9675, test_f1: 0.6259
 epoch: 26, train_loss: 0.7798, test_loss: 0.9693, test_f1: 0.5736
 epoch: 27, train_loss: 0.7619, test_loss: 0.8823, test_f1: 0.6217
 epoch: 28, train_loss: 0.7448, test_loss: 0.9093, test_f1: 0.6341
 epoch: 29, train_loss: 0.7422, test_loss: 0.8143, test_f1: 0.6245
 epoch: 30, train_loss: 0.7457, test_loss: 0.9084, test_f1: 0.5435
 epoch: 31, train_loss: 0.7514, test_loss: 0.9136, test_f1: 0.5940
 epoch: 32, train_loss: 0.7374, test_loss: 0.8045, test_f1: 0.6104
 epoch: 33, train_loss: 0.7416, test_loss: 0.9780, test_f1: 0.5793
 epoch: 34, train_loss: 0.7162, test_loss: 0.9566, test_f1: 0.6256
 epoch: 35, train_loss: 0.7241, test_loss: 0.8597, test_f1: 0.6084
 epoch: 36, train_loss: 0.7221, test_loss: 0.7460, test_f1: 0.6294
 epoch: 37, train_loss: 0.6927, test_loss: 0.8476, test_f1: 0.6597
 epoch: 38, train_loss: 0.6853, test_loss: 0.9747, test_f1: 0.6355
 epoch: 39, train_loss: 0.6836, test_loss: 0.8085, test_f1: 0.6592
 epoch: 40, train_loss: 0.6828, test_loss: 0.8416, test_f1: 0.6657
 epoch: 41, train_loss: 0.6752, test_loss: 0.9008, test_f1: 0.5987
 epoch: 42, train_loss: 0.6529, test_loss: 0.9189, test_f1: 0.6597
 epoch: 43, train_loss: 0.6691, test_loss: 0.9780, test_f1: 0.6707
 epoch: 44, train_loss: 0.6631, test_loss: 1.1013, test_f1: 0.5975
 epoch: 45, train_loss: 0.6818, test_loss: 0.9190, test_f1: 0.6706
 epoch: 46, train_loss: 0.6926, test_loss: 0.8369, test_f1: 0.6817
 epoch: 47, train_loss: 0.6483, test_loss: 1.0218, test_f1: 0.6332
 epoch: 48, train_loss: 0.6468, test_loss: 0.7872, test_f1: 0.6246
 epoch: 49, train_loss: 0.6340, test_loss: 0.8849, test_f1: 0.6640
 epoch: 50, train_loss: 0.6280, test_loss: 0.8792, test_f1: 0.6077
 epoch: 51, train_loss: 0.5836, test_loss: 0.7546, test_f1: 0.6631
 epoch: 52, train_loss: 0.5631, test_loss: 0.7735, test_f1: 0.6863
 epoch: 53, train_loss: 0.5539, test_loss: 0.8393, test_f1: 0.6903
 epoch: 54, train_loss: 0.5453, test_loss: 0.8237, test_f1: 0.6946
 epoch: 55, train_loss: 0.5443, test_loss: 0.7821, test_f1: 0.6617
 epoch: 56, train_loss: 0.5327, test_loss: 0.8185, test_f1: 0.6661
 epoch: 57, train_loss: 0.5382, test_loss: 0.8270, test_f1: 0.6777
 epoch: 58, train_loss: 0.5067, test_loss: 0.8025, test_f1: 0.6982
 epoch: 59, train_loss: 0.5277, test_loss: 1.0185, test_f1: 0.6918
 epoch: 60, train_loss: 0.5491, test_loss: 0.8948, test_f1: 0.6697
 epoch: 61, train_loss: 0.5094, test_loss: 0.8302, test_f1: 0.6983
 epoch: 62, train_loss: 0.5109, test_loss: 0.8541, test_f1: 0.6781
 epoch: 63, train_loss: 0.4992, test_loss: 0.9164, test_f1: 0.6780
 epoch: 64, train_loss: 0.5170, test_loss: 0.7994, test_f1: 0.6967
 epoch: 65, train_loss: 0.4894, test_loss: 0.9445, test_f1: 0.6742
 epoch: 66, train_loss: 0.4941, test_loss: 0.8409, test_f1: 0.6665
 epoch: 67, train_loss: 0.4828, test_loss: 0.8236, test_f1: 0.7129
 epoch: 68, train_loss: 0.4792, test_loss: 0.9581, test_f1: 0.7142
 epoch: 69, train_loss: 0.4778, test_loss: 0.8085, test_f1: 0.6806
 epoch: 70, train_loss: 0.4852, test_loss: 0.8232, test_f1: 0.6809
 epoch: 71, train_loss: 0.4667, test_loss: 0.7532, test_f1: 0.6740
 epoch: 72, train_loss: 0.4724, test_loss: 0.7134, test_f1: 0.6972
 epoch: 73, train_loss: 0.4868, test_loss: 0.9322, test_f1: 0.7001
 epoch: 74, train_loss: 0.4880, test_loss: 0.8376, test_f1: 0.6820
 epoch: 75, train_loss: 0.4508, test_loss: 0.9305, test_f1: 0.6951
 epoch: 76, train_loss: 0.4652, test_loss: 0.9380, test_f1: 0.6956
 epoch: 77, train_loss: 0.4632, test_loss: 1.0253, test_f1: 0.6962
 epoch: 78, train_loss: 0.4442, test_loss: 0.8862, test_f1: 0.6660
 epoch: 79, train_loss: 0.4376, test_loss: 0.9189, test_f1: 0.6760
 epoch: 80, train_loss: 0.4490, test_loss: 0.8433, test_f1: 0.6847
 epoch: 81, train_loss: 0.4487, test_loss: 0.7527, test_f1: 0.7199
 epoch: 82, train_loss: 0.4304, test_loss: 0.8393, test_f1: 0.6899
 epoch: 83, train_loss: 0.4376, test_loss: 0.9036, test_f1: 0.6760
 epoch: 84, train_loss: 0.4367, test_loss: 0.8837, test_f1: 0.7012
 epoch: 85, train_loss: 0.4348, test_loss: 0.8578, test_f1: 0.7013
 epoch: 86, train_loss: 0.4222, test_loss: 0.9777, test_f1: 0.6809
 epoch: 87, train_loss: 0.4132, test_loss: 0.8638, test_f1: 0.6955
 epoch: 88, train_loss: 0.4143, test_loss: 0.9919, test_f1: 0.7015
 epoch: 89, train_loss: 0.4203, test_loss: 0.9142, test_f1: 0.7063
 epoch: 90, train_loss: 0.4180, test_loss: 0.9935, test_f1: 0.7071
 epoch: 91, train_loss: 0.3945, test_loss: 0.9829, test_f1: 0.6722
 epoch: 92, train_loss: 0.4083, test_loss: 1.0717, test_f1: 0.6832
 epoch: 93, train_loss: 0.4321, test_loss: 0.9436, test_f1: 0.6806
 epoch: 94, train_loss: 0.4056, test_loss: 1.0039, test_f1: 0.6566
 epoch: 95, train_loss: 0.4097, test_loss: 0.9335, test_f1: 0.6823
 epoch: 96, train_loss: 0.4066, test_loss: 0.8073, test_f1: 0.7000
 epoch: 97, train_loss: 0.4122, test_loss: 1.0214, test_f1: 0.6925
 epoch: 98, train_loss: 0.3981, test_loss: 1.0117, test_f1: 0.7010
 epoch: 99, train_loss: 0.4022, test_loss: 0.8922, test_f1: 0.6863
##################ITERATION #5 ****************************************
 epoch: 0, train_loss: 1.1459, test_loss: 1.0395, test_f1: 0.4274
 epoch: 1, train_loss: 1.0020, test_loss: 1.1396, test_f1: 0.4262
 epoch: 2, train_loss: 0.9862, test_loss: 1.2687, test_f1: 0.3646
 epoch: 3, train_loss: 0.9534, test_loss: 1.0115, test_f1: 0.5120
 epoch: 4, train_loss: 0.9372, test_loss: 0.9309, test_f1: 0.4999
 epoch: 5, train_loss: 0.9275, test_loss: 0.9646, test_f1: 0.5257
 epoch: 6, train_loss: 0.9251, test_loss: 0.9464, test_f1: 0.5086
 epoch: 7, train_loss: 0.8931, test_loss: 0.9299, test_f1: 0.5491
 epoch: 8, train_loss: 0.9068, test_loss: 0.8832, test_f1: 0.5491
 epoch: 9, train_loss: 0.8907, test_loss: 0.9431, test_f1: 0.5408
 epoch: 10, train_loss: 0.8845, test_loss: 0.9567, test_f1: 0.5395
 epoch: 11, train_loss: 0.8619, test_loss: 0.8858, test_f1: 0.5048
 epoch: 12, train_loss: 0.8658, test_loss: 0.9210, test_f1: 0.4985
 epoch: 13, train_loss: 0.8588, test_loss: 0.9114, test_f1: 0.5621
 epoch: 14, train_loss: 0.8356, test_loss: 0.9413, test_f1: 0.5273
 epoch: 15, train_loss: 0.8417, test_loss: 0.8136, test_f1: 0.5376
 epoch: 16, train_loss: 0.8723, test_loss: 0.9183, test_f1: 0.5334
 epoch: 17, train_loss: 0.8430, test_loss: 0.8897, test_f1: 0.5679
 epoch: 18, train_loss: 0.8172, test_loss: 0.7821, test_f1: 0.6026
 epoch: 19, train_loss: 0.8125, test_loss: 0.8156, test_f1: 0.5874
 epoch: 20, train_loss: 0.7913, test_loss: 0.8451, test_f1: 0.5824
 epoch: 21, train_loss: 0.7783, test_loss: 0.8938, test_f1: 0.5835
 epoch: 22, train_loss: 0.7829, test_loss: 0.9039, test_f1: 0.5918
 epoch: 23, train_loss: 0.7877, test_loss: 0.8008, test_f1: 0.6379
 epoch: 24, train_loss: 0.7635, test_loss: 0.7888, test_f1: 0.6026
 epoch: 25, train_loss: 0.7485, test_loss: 0.7317, test_f1: 0.6324
 epoch: 26, train_loss: 0.7448, test_loss: 0.8788, test_f1: 0.6567
 epoch: 27, train_loss: 0.7460, test_loss: 0.7493, test_f1: 0.6404
 epoch: 28, train_loss: 0.7111, test_loss: 0.7744, test_f1: 0.6384
 epoch: 29, train_loss: 0.6974, test_loss: 0.8053, test_f1: 0.6353
 epoch: 30, train_loss: 0.7110, test_loss: 0.7812, test_f1: 0.6241
 epoch: 31, train_loss: 0.7134, test_loss: 0.7571, test_f1: 0.6281
 epoch: 32, train_loss: 0.7111, test_loss: 0.7303, test_f1: 0.6446
 epoch: 33, train_loss: 0.7053, test_loss: 0.7646, test_f1: 0.6529
 epoch: 34, train_loss: 0.6855, test_loss: 0.9026, test_f1: 0.6463
 epoch: 35, train_loss: 0.6672, test_loss: 0.8181, test_f1: 0.6583
 epoch: 36, train_loss: 0.6507, test_loss: 0.7068, test_f1: 0.6699
 epoch: 37, train_loss: 0.6730, test_loss: 0.8020, test_f1: 0.6212
 epoch: 38, train_loss: 0.6896, test_loss: 0.7273, test_f1: 0.6679
 epoch: 39, train_loss: 0.6845, test_loss: 0.7439, test_f1: 0.6108
 epoch: 40, train_loss: 0.6731, test_loss: 0.7305, test_f1: 0.6726
 epoch: 41, train_loss: 0.6738, test_loss: 0.9991, test_f1: 0.6445
 epoch: 42, train_loss: 0.6570, test_loss: 0.6980, test_f1: 0.6828
 epoch: 43, train_loss: 0.6277, test_loss: 0.7559, test_f1: 0.6942
 epoch: 44, train_loss: 0.6592, test_loss: 0.7831, test_f1: 0.6614
 epoch: 45, train_loss: 0.6476, test_loss: 0.7381, test_f1: 0.6392
 epoch: 46, train_loss: 0.6191, test_loss: 0.8814, test_f1: 0.6786
 epoch: 47, train_loss: 0.6167, test_loss: 0.7200, test_f1: 0.6443
 epoch: 48, train_loss: 0.6521, test_loss: 0.7470, test_f1: 0.6787
 epoch: 49, train_loss: 0.6284, test_loss: 0.8080, test_f1: 0.6445
 epoch: 50, train_loss: 0.6190, test_loss: 0.7819, test_f1: 0.6817
 epoch: 51, train_loss: 0.5649, test_loss: 0.7755, test_f1: 0.6659
 epoch: 52, train_loss: 0.5493, test_loss: 0.8447, test_f1: 0.7093
 epoch: 53, train_loss: 0.5207, test_loss: 0.7177, test_f1: 0.6922
 epoch: 54, train_loss: 0.5107, test_loss: 0.7996, test_f1: 0.6752
 epoch: 55, train_loss: 0.5293, test_loss: 0.9350, test_f1: 0.6518
 epoch: 56, train_loss: 0.5253, test_loss: 0.8075, test_f1: 0.6727
 epoch: 57, train_loss: 0.5345, test_loss: 0.9296, test_f1: 0.6717
 epoch: 58, train_loss: 0.4998, test_loss: 0.7829, test_f1: 0.6667
 epoch: 59, train_loss: 0.4926, test_loss: 0.8717, test_f1: 0.6925
 epoch: 60, train_loss: 0.4973, test_loss: 0.8172, test_f1: 0.6821
 epoch: 61, train_loss: 0.4922, test_loss: 0.8645, test_f1: 0.6599
 epoch: 62, train_loss: 0.5385, test_loss: 0.8328, test_f1: 0.6956
 epoch: 63, train_loss: 0.5031, test_loss: 0.7734, test_f1: 0.6637
 epoch: 64, train_loss: 0.5150, test_loss: 0.7270, test_f1: 0.6639
 epoch: 65, train_loss: 0.5003, test_loss: 0.7650, test_f1: 0.6660
 epoch: 66, train_loss: 0.4874, test_loss: 0.7220, test_f1: 0.6657
 epoch: 67, train_loss: 0.4838, test_loss: 1.0772, test_f1: 0.6845
 epoch: 68, train_loss: 0.4856, test_loss: 1.0902, test_f1: 0.6729
 epoch: 69, train_loss: 0.4876, test_loss: 1.2413, test_f1: 0.6550
 epoch: 70, train_loss: 0.4856, test_loss: 0.8781, test_f1: 0.6954
 epoch: 71, train_loss: 0.4716, test_loss: 1.0855, test_f1: 0.6795
 epoch: 72, train_loss: 0.4748, test_loss: 0.9439, test_f1: 0.6954
 epoch: 73, train_loss: 0.4803, test_loss: 0.8740, test_f1: 0.6931
 epoch: 74, train_loss: 0.4757, test_loss: 0.8680, test_f1: 0.6685
 epoch: 75, train_loss: 0.4755, test_loss: 0.9121, test_f1: 0.6628
 epoch: 76, train_loss: 0.4627, test_loss: 0.9751, test_f1: 0.7154
 epoch: 77, train_loss: 0.4432, test_loss: 0.8838, test_f1: 0.6686
 epoch: 78, train_loss: 0.4455, test_loss: 1.0124, test_f1: 0.6690
 epoch: 79, train_loss: 0.4427, test_loss: 0.8754, test_f1: 0.6668
 epoch: 80, train_loss: 0.4623, test_loss: 1.2408, test_f1: 0.6584
 epoch: 81, train_loss: 0.4682, test_loss: 0.9089, test_f1: 0.6755
 epoch: 82, train_loss: 0.4325, test_loss: 1.1114, test_f1: 0.6755
 epoch: 83, train_loss: 0.4407, test_loss: 0.9929, test_f1: 0.6612
 epoch: 84, train_loss: 0.4686, test_loss: 0.9492, test_f1: 0.6826
 epoch: 85, train_loss: 0.4463, test_loss: 1.0406, test_f1: 0.6576
 epoch: 86, train_loss: 0.4591, test_loss: 0.9499, test_f1: 0.6717
 epoch: 87, train_loss: 0.4312, test_loss: 0.9578, test_f1: 0.6953
 epoch: 88, train_loss: 0.4366, test_loss: 0.9355, test_f1: 0.6803
 epoch: 89, train_loss: 0.4243, test_loss: 1.0434, test_f1: 0.6665
 epoch: 90, train_loss: 0.4250, test_loss: 1.2013, test_f1: 0.6665
 epoch: 91, train_loss: 0.4161, test_loss: 1.0708, test_f1: 0.6909
 epoch: 92, train_loss: 0.4152, test_loss: 0.9345, test_f1: 0.6669
 epoch: 93, train_loss: 0.4084, test_loss: 0.9408, test_f1: 0.6922
 epoch: 94, train_loss: 0.4214, test_loss: 0.9767, test_f1: 0.6603
 epoch: 95, train_loss: 0.4253, test_loss: 0.9832, test_f1: 0.6687
 epoch: 96, train_loss: 0.4230, test_loss: 0.9728, test_f1: 0.6700
 epoch: 97, train_loss: 0.4087, test_loss: 0.9516, test_f1: 0.6912
 epoch: 98, train_loss: 0.3992, test_loss: 1.1103, test_f1: 0.6838
 epoch: 99, train_loss: 0.4053, test_loss: 1.1876, test_f1: 0.6740
##################ITERATION #6 ****************************************
 epoch: 0, train_loss: 1.1298, test_loss: 1.0462, test_f1: 0.5036
 epoch: 1, train_loss: 1.0032, test_loss: 1.0501, test_f1: 0.4976
 epoch: 2, train_loss: 0.9742, test_loss: 0.9669, test_f1: 0.5078
 epoch: 3, train_loss: 0.9505, test_loss: 0.9711, test_f1: 0.5076
 epoch: 4, train_loss: 0.9446, test_loss: 1.0219, test_f1: 0.5016
 epoch: 5, train_loss: 0.9586, test_loss: 1.0456, test_f1: 0.4665
 epoch: 6, train_loss: 0.9368, test_loss: 0.9640, test_f1: 0.5131
 epoch: 7, train_loss: 0.9159, test_loss: 0.8762, test_f1: 0.5132
 epoch: 8, train_loss: 0.9076, test_loss: 0.9636, test_f1: 0.4985
 epoch: 9, train_loss: 0.8898, test_loss: 0.8778, test_f1: 0.5175
 epoch: 10, train_loss: 0.8860, test_loss: 1.2006, test_f1: 0.4745
 epoch: 11, train_loss: 0.8780, test_loss: 0.9018, test_f1: 0.5091
 epoch: 12, train_loss: 0.8839, test_loss: 0.8737, test_f1: 0.5322
 epoch: 13, train_loss: 0.8449, test_loss: 0.9226, test_f1: 0.5232
 epoch: 14, train_loss: 0.8472, test_loss: 1.1655, test_f1: 0.4604
 epoch: 15, train_loss: 0.8274, test_loss: 0.9958, test_f1: 0.5694
 epoch: 16, train_loss: 0.8286, test_loss: 0.9595, test_f1: 0.5240
 epoch: 17, train_loss: 0.8637, test_loss: 0.9465, test_f1: 0.5596
 epoch: 18, train_loss: 0.8322, test_loss: 1.0062, test_f1: 0.5538
 epoch: 19, train_loss: 0.8167, test_loss: 0.8880, test_f1: 0.6423
 epoch: 20, train_loss: 0.8034, test_loss: 0.8617, test_f1: 0.5939
 epoch: 21, train_loss: 0.7844, test_loss: 0.9262, test_f1: 0.6411
 epoch: 22, train_loss: 0.7954, test_loss: 1.1226, test_f1: 0.5577
 epoch: 23, train_loss: 0.7703, test_loss: 0.8449, test_f1: 0.6522
 epoch: 24, train_loss: 0.7723, test_loss: 0.8664, test_f1: 0.6061
 epoch: 25, train_loss: 0.7748, test_loss: 0.8794, test_f1: 0.6028
 epoch: 26, train_loss: 0.7816, test_loss: 0.8781, test_f1: 0.6219
 epoch: 27, train_loss: 0.7872, test_loss: 1.0114, test_f1: 0.6304
 epoch: 28, train_loss: 0.7473, test_loss: 0.8053, test_f1: 0.6563
 epoch: 29, train_loss: 0.7588, test_loss: 0.9672, test_f1: 0.6344
 epoch: 30, train_loss: 0.7313, test_loss: 0.9976, test_f1: 0.6204
 epoch: 31, train_loss: 0.7537, test_loss: 1.1440, test_f1: 0.5781
 epoch: 32, train_loss: 0.7381, test_loss: 0.9510, test_f1: 0.6346
 epoch: 33, train_loss: 0.7149, test_loss: 0.8436, test_f1: 0.6318
 epoch: 34, train_loss: 0.7300, test_loss: 0.9016, test_f1: 0.6496
 epoch: 35, train_loss: 0.7218, test_loss: 0.9423, test_f1: 0.6517
 epoch: 36, train_loss: 0.7156, test_loss: 1.1510, test_f1: 0.6119
 epoch: 37, train_loss: 0.7108, test_loss: 0.8642, test_f1: 0.6349
 epoch: 38, train_loss: 0.6929, test_loss: 0.9661, test_f1: 0.6330
 epoch: 39, train_loss: 0.7156, test_loss: 0.8608, test_f1: 0.6525
 epoch: 40, train_loss: 0.6929, test_loss: 0.9793, test_f1: 0.6457
 epoch: 41, train_loss: 0.7034, test_loss: 0.9652, test_f1: 0.6216
 epoch: 42, train_loss: 0.7017, test_loss: 0.7926, test_f1: 0.6456
 epoch: 43, train_loss: 0.6911, test_loss: 0.9675, test_f1: 0.6404
 epoch: 44, train_loss: 0.7148, test_loss: 0.8902, test_f1: 0.6465
 epoch: 45, train_loss: 0.7014, test_loss: 1.0431, test_f1: 0.6546
 epoch: 46, train_loss: 0.6577, test_loss: 0.9943, test_f1: 0.6528
 epoch: 47, train_loss: 0.6789, test_loss: 1.0003, test_f1: 0.6399
 epoch: 48, train_loss: 0.6483, test_loss: 1.1035, test_f1: 0.6645
 epoch: 49, train_loss: 0.6772, test_loss: 0.8546, test_f1: 0.6645
 epoch: 50, train_loss: 0.6523, test_loss: 0.9877, test_f1: 0.6743
 epoch: 51, train_loss: 0.6296, test_loss: 1.0041, test_f1: 0.6567
 epoch: 52, train_loss: 0.6014, test_loss: 0.9742, test_f1: 0.6798
 epoch: 53, train_loss: 0.5896, test_loss: 0.9631, test_f1: 0.6593
 epoch: 54, train_loss: 0.5856, test_loss: 1.0284, test_f1: 0.6780
 epoch: 55, train_loss: 0.5666, test_loss: 1.1923, test_f1: 0.6752
 epoch: 56, train_loss: 0.5742, test_loss: 1.0895, test_f1: 0.6904
 epoch: 57, train_loss: 0.5660, test_loss: 1.0963, test_f1: 0.6857
 epoch: 58, train_loss: 0.5808, test_loss: 1.1191, test_f1: 0.6744
 epoch: 59, train_loss: 0.5578, test_loss: 1.1319, test_f1: 0.6882
 epoch: 60, train_loss: 0.5594, test_loss: 1.1816, test_f1: 0.6856
 epoch: 61, train_loss: 0.5477, test_loss: 1.0729, test_f1: 0.6919
 epoch: 62, train_loss: 0.5654, test_loss: 0.9980, test_f1: 0.6863
 epoch: 63, train_loss: 0.5375, test_loss: 1.1388, test_f1: 0.6663
 epoch: 64, train_loss: 0.5320, test_loss: 1.0700, test_f1: 0.6677
 epoch: 65, train_loss: 0.5518, test_loss: 1.1892, test_f1: 0.6746
 epoch: 66, train_loss: 0.5304, test_loss: 1.2457, test_f1: 0.6784
 epoch: 67, train_loss: 0.5225, test_loss: 1.0954, test_f1: 0.6870
 epoch: 68, train_loss: 0.5189, test_loss: 1.1226, test_f1: 0.6863
 epoch: 69, train_loss: 0.5167, test_loss: 1.0128, test_f1: 0.6737
 epoch: 70, train_loss: 0.5301, test_loss: 0.9938, test_f1: 0.6752
 epoch: 71, train_loss: 0.5289, test_loss: 1.1317, test_f1: 0.6552
 epoch: 72, train_loss: 0.5586, test_loss: 1.2014, test_f1: 0.6716
 epoch: 73, train_loss: 0.5246, test_loss: 1.2027, test_f1: 0.6558
 epoch: 74, train_loss: 0.5281, test_loss: 1.0779, test_f1: 0.6793
 epoch: 75, train_loss: 0.5156, test_loss: 1.0064, test_f1: 0.6645
 epoch: 76, train_loss: 0.5292, test_loss: 1.0786, test_f1: 0.6722
 epoch: 77, train_loss: 0.5076, test_loss: 1.0696, test_f1: 0.6683
 epoch: 78, train_loss: 0.4785, test_loss: 1.0824, test_f1: 0.6989
 epoch: 79, train_loss: 0.4893, test_loss: 0.8751, test_f1: 0.6591
 epoch: 80, train_loss: 0.4984, test_loss: 1.1393, test_f1: 0.6718
 epoch: 81, train_loss: 0.4940, test_loss: 1.1149, test_f1: 0.6786
 epoch: 82, train_loss: 0.4804, test_loss: 1.2658, test_f1: 0.6408
 epoch: 83, train_loss: 0.5001, test_loss: 1.1416, test_f1: 0.6838
 epoch: 84, train_loss: 0.4775, test_loss: 1.0119, test_f1: 0.6666
 epoch: 85, train_loss: 0.4735, test_loss: 1.1578, test_f1: 0.6772
 epoch: 86, train_loss: 0.4817, test_loss: 1.0903, test_f1: 0.6821
 epoch: 87, train_loss: 0.4839, test_loss: 1.0483, test_f1: 0.6944
 epoch: 88, train_loss: 0.4818, test_loss: 1.1747, test_f1: 0.6829
 epoch: 89, train_loss: 0.4853, test_loss: 1.0497, test_f1: 0.6777
 epoch: 90, train_loss: 0.4563, test_loss: 0.9986, test_f1: 0.6706
 epoch: 91, train_loss: 0.4635, test_loss: 1.2480, test_f1: 0.6532
 epoch: 92, train_loss: 0.4813, test_loss: 1.0480, test_f1: 0.6851
 epoch: 93, train_loss: 0.4535, test_loss: 1.0742, test_f1: 0.6769
 epoch: 94, train_loss: 0.4755, test_loss: 1.1549, test_f1: 0.6959
 epoch: 95, train_loss: 0.4822, test_loss: 0.9900, test_f1: 0.6671
 epoch: 96, train_loss: 0.4548, test_loss: 1.0131, test_f1: 0.6846
 epoch: 97, train_loss: 0.4457, test_loss: 1.0204, test_f1: 0.6829
 epoch: 98, train_loss: 0.4521, test_loss: 0.9993, test_f1: 0.6812
 epoch: 99, train_loss: 0.4576, test_loss: 1.0804, test_f1: 0.6799
##################ITERATION #7 ****************************************
 epoch: 0, train_loss: 1.1504, test_loss: 1.0019, test_f1: 0.4869
 epoch: 1, train_loss: 1.0138, test_loss: 0.9666, test_f1: 0.4826
 epoch: 2, train_loss: 0.9930, test_loss: 1.0176, test_f1: 0.4690
 epoch: 3, train_loss: 0.9889, test_loss: 0.9745, test_f1: 0.4996
 epoch: 4, train_loss: 0.9375, test_loss: 1.0088, test_f1: 0.5357
 epoch: 5, train_loss: 0.9304, test_loss: 1.0131, test_f1: 0.4962
 epoch: 6, train_loss: 0.9261, test_loss: 0.9852, test_f1: 0.4999
 epoch: 7, train_loss: 0.8994, test_loss: 0.8962, test_f1: 0.5583
 epoch: 8, train_loss: 0.8785, test_loss: 0.9002, test_f1: 0.5183
 epoch: 9, train_loss: 0.8696, test_loss: 0.9962, test_f1: 0.6067
 epoch: 10, train_loss: 0.8457, test_loss: 1.0788, test_f1: 0.5210
 epoch: 11, train_loss: 0.8390, test_loss: 0.8391, test_f1: 0.5528
 epoch: 12, train_loss: 0.8532, test_loss: 0.8167, test_f1: 0.6244
 epoch: 13, train_loss: 0.8291, test_loss: 0.9114, test_f1: 0.6159
 epoch: 14, train_loss: 0.8347, test_loss: 0.9845, test_f1: 0.5606
 epoch: 15, train_loss: 0.8081, test_loss: 0.8256, test_f1: 0.5723
 epoch: 16, train_loss: 0.8016, test_loss: 0.8151, test_f1: 0.6266
 epoch: 17, train_loss: 0.7874, test_loss: 0.8750, test_f1: 0.6417
 epoch: 18, train_loss: 0.7972, test_loss: 0.8975, test_f1: 0.6206
 epoch: 19, train_loss: 0.7934, test_loss: 0.8037, test_f1: 0.5694
 epoch: 20, train_loss: 0.7580, test_loss: 0.8319, test_f1: 0.6167
 epoch: 21, train_loss: 0.7806, test_loss: 0.8467, test_f1: 0.6435
 epoch: 22, train_loss: 0.7583, test_loss: 0.8309, test_f1: 0.6087
 epoch: 23, train_loss: 0.7539, test_loss: 0.7660, test_f1: 0.6251
 epoch: 24, train_loss: 0.7412, test_loss: 0.7486, test_f1: 0.6812
 epoch: 25, train_loss: 0.7585, test_loss: 1.0019, test_f1: 0.5580
 epoch: 26, train_loss: 0.7713, test_loss: 0.7913, test_f1: 0.6341
 epoch: 27, train_loss: 0.7414, test_loss: 0.7482, test_f1: 0.6271
 epoch: 28, train_loss: 0.7383, test_loss: 0.8147, test_f1: 0.6110
 epoch: 29, train_loss: 0.7155, test_loss: 0.9853, test_f1: 0.6374
 epoch: 30, train_loss: 0.7276, test_loss: 0.8561, test_f1: 0.6165
 epoch: 31, train_loss: 0.7063, test_loss: 0.8712, test_f1: 0.6556
 epoch: 32, train_loss: 0.7101, test_loss: 0.9098, test_f1: 0.6350
 epoch: 33, train_loss: 0.7071, test_loss: 0.8237, test_f1: 0.6571
 epoch: 34, train_loss: 0.7129, test_loss: 0.8499, test_f1: 0.6677
 epoch: 35, train_loss: 0.7043, test_loss: 0.8483, test_f1: 0.6379
 epoch: 36, train_loss: 0.6789, test_loss: 0.7790, test_f1: 0.6659
 epoch: 37, train_loss: 0.6670, test_loss: 0.7882, test_f1: 0.6251
 epoch: 38, train_loss: 0.6548, test_loss: 0.8095, test_f1: 0.6757
 epoch: 39, train_loss: 0.6710, test_loss: 0.8761, test_f1: 0.6460
 epoch: 40, train_loss: 0.6876, test_loss: 0.9318, test_f1: 0.6513
 epoch: 41, train_loss: 0.6427, test_loss: 0.9369, test_f1: 0.6838
 epoch: 42, train_loss: 0.6416, test_loss: 0.8339, test_f1: 0.6683
 epoch: 43, train_loss: 0.6238, test_loss: 0.7820, test_f1: 0.6654
 epoch: 44, train_loss: 0.6274, test_loss: 0.8396, test_f1: 0.6708
 epoch: 45, train_loss: 0.6132, test_loss: 0.8358, test_f1: 0.6409
 epoch: 46, train_loss: 0.6607, test_loss: 0.9347, test_f1: 0.6785
 epoch: 47, train_loss: 0.6478, test_loss: 0.8613, test_f1: 0.6208
 epoch: 48, train_loss: 0.6550, test_loss: 0.7909, test_f1: 0.6833
 epoch: 49, train_loss: 0.6150, test_loss: 0.7527, test_f1: 0.6673
 epoch: 50, train_loss: 0.6040, test_loss: 0.7327, test_f1: 0.6807
 epoch: 51, train_loss: 0.5496, test_loss: 0.8658, test_f1: 0.6904
 epoch: 52, train_loss: 0.5223, test_loss: 0.8498, test_f1: 0.6886
 epoch: 53, train_loss: 0.5253, test_loss: 0.8480, test_f1: 0.6844
 epoch: 54, train_loss: 0.5273, test_loss: 0.8665, test_f1: 0.6833
 epoch: 55, train_loss: 0.5357, test_loss: 0.7821, test_f1: 0.6738
 epoch: 56, train_loss: 0.5201, test_loss: 0.8900, test_f1: 0.6864
 epoch: 57, train_loss: 0.4977, test_loss: 0.8998, test_f1: 0.6767
 epoch: 58, train_loss: 0.4895, test_loss: 0.9589, test_f1: 0.6761
 epoch: 59, train_loss: 0.4927, test_loss: 0.9933, test_f1: 0.6724
 epoch: 60, train_loss: 0.5041, test_loss: 0.8626, test_f1: 0.6618
 epoch: 61, train_loss: 0.4777, test_loss: 0.8560, test_f1: 0.6651
 epoch: 62, train_loss: 0.4996, test_loss: 0.8992, test_f1: 0.6811
 epoch: 63, train_loss: 0.4980, test_loss: 0.9800, test_f1: 0.6791
 epoch: 64, train_loss: 0.4826, test_loss: 1.0482, test_f1: 0.6774
 epoch: 65, train_loss: 0.4633, test_loss: 0.9327, test_f1: 0.6757
 epoch: 66, train_loss: 0.4605, test_loss: 0.9214, test_f1: 0.6832
 epoch: 67, train_loss: 0.4649, test_loss: 0.8816, test_f1: 0.6595
 epoch: 68, train_loss: 0.4705, test_loss: 0.9264, test_f1: 0.6654
 epoch: 69, train_loss: 0.4553, test_loss: 0.9967, test_f1: 0.6776
 epoch: 70, train_loss: 0.4598, test_loss: 1.0256, test_f1: 0.6683
 epoch: 71, train_loss: 0.4532, test_loss: 1.0160, test_f1: 0.6685
 epoch: 72, train_loss: 0.4524, test_loss: 1.0691, test_f1: 0.6687
 epoch: 73, train_loss: 0.4420, test_loss: 1.2295, test_f1: 0.6901
 epoch: 74, train_loss: 0.4483, test_loss: 1.0698, test_f1: 0.6881
 epoch: 75, train_loss: 0.4513, test_loss: 1.2040, test_f1: 0.6763
 epoch: 76, train_loss: 0.4433, test_loss: 1.1302, test_f1: 0.6705
 epoch: 77, train_loss: 0.4348, test_loss: 1.0330, test_f1: 0.6773
 epoch: 78, train_loss: 0.4246, test_loss: 1.1905, test_f1: 0.6973
 epoch: 79, train_loss: 0.4480, test_loss: 1.1924, test_f1: 0.7018
 epoch: 80, train_loss: 0.4426, test_loss: 1.0024, test_f1: 0.6795
 epoch: 81, train_loss: 0.4269, test_loss: 1.2458, test_f1: 0.6609
 epoch: 82, train_loss: 0.4653, test_loss: 1.3736, test_f1: 0.6696
 epoch: 83, train_loss: 0.4238, test_loss: 1.3290, test_f1: 0.6125
 epoch: 84, train_loss: 0.4084, test_loss: 1.3629, test_f1: 0.6736
 epoch: 85, train_loss: 0.4206, test_loss: 1.2570, test_f1: 0.6808
 epoch: 86, train_loss: 0.3962, test_loss: 1.2123, test_f1: 0.6737
 epoch: 87, train_loss: 0.4240, test_loss: 1.1402, test_f1: 0.6791
 epoch: 88, train_loss: 0.4259, test_loss: 1.3639, test_f1: 0.6670
 epoch: 89, train_loss: 0.4421, test_loss: 1.1445, test_f1: 0.6866
 epoch: 90, train_loss: 0.3891, test_loss: 1.4311, test_f1: 0.6860
 epoch: 91, train_loss: 0.4037, test_loss: 1.2958, test_f1: 0.6659
 epoch: 92, train_loss: 0.4078, test_loss: 1.0643, test_f1: 0.6695
 epoch: 93, train_loss: 0.4116, test_loss: 1.0879, test_f1: 0.6807
 epoch: 94, train_loss: 0.4096, test_loss: 1.4118, test_f1: 0.6858
 epoch: 95, train_loss: 0.3909, test_loss: 1.1955, test_f1: 0.6784
 epoch: 96, train_loss: 0.4067, test_loss: 1.2457, test_f1: 0.6649
 epoch: 97, train_loss: 0.3893, test_loss: 1.2026, test_f1: 0.6848
 epoch: 98, train_loss: 0.3937, test_loss: 1.2578, test_f1: 0.6842
 epoch: 99, train_loss: 0.3960, test_loss: 1.2741, test_f1: 0.6852
##################ITERATION #8 ****************************************
 epoch: 0, train_loss: 1.1153, test_loss: 1.0109, test_f1: 0.4261
 epoch: 1, train_loss: 0.9818, test_loss: 0.9863, test_f1: 0.5281
 epoch: 2, train_loss: 0.9373, test_loss: 0.9180, test_f1: 0.5221
 epoch: 3, train_loss: 0.9414, test_loss: 0.8942, test_f1: 0.5341
 epoch: 4, train_loss: 0.9128, test_loss: 0.9350, test_f1: 0.5439
 epoch: 5, train_loss: 0.9024, test_loss: 0.8916, test_f1: 0.5584
 epoch: 6, train_loss: 0.9241, test_loss: 0.9008, test_f1: 0.5813
 epoch: 7, train_loss: 0.8840, test_loss: 0.9199, test_f1: 0.5528
 epoch: 8, train_loss: 0.8867, test_loss: 0.9406, test_f1: 0.4976
 epoch: 9, train_loss: 0.8764, test_loss: 0.8681, test_f1: 0.5580
 epoch: 10, train_loss: 0.8525, test_loss: 0.9999, test_f1: 0.5786
 epoch: 11, train_loss: 0.8417, test_loss: 0.8227, test_f1: 0.6255
 epoch: 12, train_loss: 0.8284, test_loss: 0.9301, test_f1: 0.6036
 epoch: 13, train_loss: 0.8224, test_loss: 1.1007, test_f1: 0.5237
 epoch: 14, train_loss: 0.8135, test_loss: 0.9875, test_f1: 0.5310
 epoch: 15, train_loss: 0.8160, test_loss: 1.0397, test_f1: 0.5653
 epoch: 16, train_loss: 0.8344, test_loss: 0.9718, test_f1: 0.5500
 epoch: 17, train_loss: 0.8219, test_loss: 1.0200, test_f1: 0.5393
 epoch: 18, train_loss: 0.7955, test_loss: 0.9030, test_f1: 0.6130
 epoch: 19, train_loss: 0.8004, test_loss: 0.9831, test_f1: 0.6133
 epoch: 20, train_loss: 0.8281, test_loss: 2.8503, test_f1: 0.2146
 epoch: 21, train_loss: 0.9725, test_loss: 0.9265, test_f1: 0.5737
 epoch: 22, train_loss: 0.8951, test_loss: 0.9088, test_f1: 0.5533
 epoch: 23, train_loss: 0.8637, test_loss: 0.8473, test_f1: 0.5985
 epoch: 24, train_loss: 0.8191, test_loss: 0.8214, test_f1: 0.6092
 epoch: 25, train_loss: 0.8154, test_loss: 0.9087, test_f1: 0.6443
 epoch: 26, train_loss: 0.8096, test_loss: 0.8951, test_f1: 0.5799
 epoch: 27, train_loss: 0.7794, test_loss: 0.9144, test_f1: 0.6321
 epoch: 28, train_loss: 0.7888, test_loss: 0.8487, test_f1: 0.6205
 epoch: 29, train_loss: 0.7713, test_loss: 0.9685, test_f1: 0.6164
 epoch: 30, train_loss: 0.7544, test_loss: 0.8628, test_f1: 0.6014
 epoch: 31, train_loss: 0.7325, test_loss: 0.8375, test_f1: 0.6431
 epoch: 32, train_loss: 0.7562, test_loss: 0.9102, test_f1: 0.5900
 epoch: 33, train_loss: 0.7611, test_loss: 0.9044, test_f1: 0.6274
 epoch: 34, train_loss: 0.7265, test_loss: 0.8727, test_f1: 0.6102
 epoch: 35, train_loss: 0.7264, test_loss: 1.1455, test_f1: 0.6129
 epoch: 36, train_loss: 0.7138, test_loss: 1.0204, test_f1: 0.5855
 epoch: 37, train_loss: 0.7049, test_loss: 1.0548, test_f1: 0.5990
 epoch: 38, train_loss: 0.7284, test_loss: 0.9705, test_f1: 0.5743
 epoch: 39, train_loss: 0.6974, test_loss: 0.9877, test_f1: 0.6100
 epoch: 40, train_loss: 0.6862, test_loss: 0.8882, test_f1: 0.6779
 epoch: 41, train_loss: 0.7108, test_loss: 1.0763, test_f1: 0.6196
 epoch: 42, train_loss: 0.7121, test_loss: 0.9052, test_f1: 0.6455
 epoch: 43, train_loss: 0.6752, test_loss: 1.0665, test_f1: 0.6302
 epoch: 44, train_loss: 0.6619, test_loss: 1.1266, test_f1: 0.6450
 epoch: 45, train_loss: 0.6747, test_loss: 0.9750, test_f1: 0.6252
 epoch: 46, train_loss: 0.6811, test_loss: 1.2240, test_f1: 0.5406
 epoch: 47, train_loss: 0.6887, test_loss: 0.9228, test_f1: 0.6146
 epoch: 48, train_loss: 0.6783, test_loss: 0.8912, test_f1: 0.6493
 epoch: 49, train_loss: 0.6685, test_loss: 1.0329, test_f1: 0.6390
 epoch: 50, train_loss: 0.6697, test_loss: 0.9498, test_f1: 0.5985
 epoch: 51, train_loss: 0.6130, test_loss: 1.2387, test_f1: 0.6490
 epoch: 52, train_loss: 0.5839, test_loss: 0.9832, test_f1: 0.6762
 epoch: 53, train_loss: 0.5763, test_loss: 1.2390, test_f1: 0.6616
 epoch: 54, train_loss: 0.5827, test_loss: 0.9383, test_f1: 0.6725
 epoch: 55, train_loss: 0.5601, test_loss: 1.1807, test_f1: 0.6501
 epoch: 56, train_loss: 0.5847, test_loss: 1.0197, test_f1: 0.6738
 epoch: 57, train_loss: 0.5575, test_loss: 1.1409, test_f1: 0.6509
 epoch: 58, train_loss: 0.5667, test_loss: 1.0750, test_f1: 0.6694
 epoch: 59, train_loss: 0.5638, test_loss: 1.3161, test_f1: 0.6538
 epoch: 60, train_loss: 0.5572, test_loss: 1.1455, test_f1: 0.6259
 epoch: 61, train_loss: 0.5363, test_loss: 1.1826, test_f1: 0.6683
 epoch: 62, train_loss: 0.5479, test_loss: 1.1544, test_f1: 0.6753
 epoch: 63, train_loss: 0.5508, test_loss: 1.0122, test_f1: 0.6817
 epoch: 64, train_loss: 0.5333, test_loss: 1.0752, test_f1: 0.6737
 epoch: 65, train_loss: 0.5158, test_loss: 1.0233, test_f1: 0.6753
 epoch: 66, train_loss: 0.5268, test_loss: 1.1187, test_f1: 0.6725
 epoch: 67, train_loss: 0.5012, test_loss: 1.2144, test_f1: 0.6243
 epoch: 68, train_loss: 0.5225, test_loss: 1.2274, test_f1: 0.6610
 epoch: 69, train_loss: 0.5284, test_loss: 1.1065, test_f1: 0.6742
 epoch: 70, train_loss: 0.4922, test_loss: 1.2188, test_f1: 0.6710
 epoch: 71, train_loss: 0.4953, test_loss: 1.0879, test_f1: 0.6575
 epoch: 72, train_loss: 0.4923, test_loss: 1.1348, test_f1: 0.6441
 epoch: 73, train_loss: 0.4876, test_loss: 1.1287, test_f1: 0.6866
 epoch: 74, train_loss: 0.4835, test_loss: 1.1951, test_f1: 0.6202
 epoch: 75, train_loss: 0.4974, test_loss: 1.1798, test_f1: 0.6485
 epoch: 76, train_loss: 0.4818, test_loss: 1.0842, test_f1: 0.6786
 epoch: 77, train_loss: 0.5082, test_loss: 1.2293, test_f1: 0.6557
 epoch: 78, train_loss: 0.4815, test_loss: 1.1714, test_f1: 0.6538
 epoch: 79, train_loss: 0.5001, test_loss: 1.2200, test_f1: 0.6623
 epoch: 80, train_loss: 0.4853, test_loss: 1.1041, test_f1: 0.6793
 epoch: 81, train_loss: 0.4571, test_loss: 1.2678, test_f1: 0.6817
 epoch: 82, train_loss: 0.4756, test_loss: 1.2175, test_f1: 0.6888
 epoch: 83, train_loss: 0.4969, test_loss: 1.3841, test_f1: 0.6345
 epoch: 84, train_loss: 0.4516, test_loss: 1.1597, test_f1: 0.6732
 epoch: 85, train_loss: 0.4681, test_loss: 1.1327, test_f1: 0.6641
 epoch: 86, train_loss: 0.4741, test_loss: 1.3257, test_f1: 0.6533
 epoch: 87, train_loss: 0.4813, test_loss: 1.1987, test_f1: 0.6801
 epoch: 88, train_loss: 0.4690, test_loss: 1.1128, test_f1: 0.6855
 epoch: 89, train_loss: 0.4524, test_loss: 1.3969, test_f1: 0.6498
 epoch: 90, train_loss: 0.4911, test_loss: 1.1498, test_f1: 0.6653
 epoch: 91, train_loss: 0.4590, test_loss: 1.2731, test_f1: 0.6903
 epoch: 92, train_loss: 0.4249, test_loss: 1.3026, test_f1: 0.6829
 epoch: 93, train_loss: 0.4373, test_loss: 1.3172, test_f1: 0.6715
 epoch: 94, train_loss: 0.4436, test_loss: 1.3732, test_f1: 0.6920
 epoch: 95, train_loss: 0.4363, test_loss: 1.4156, test_f1: 0.6679
 epoch: 96, train_loss: 0.4237, test_loss: 1.1922, test_f1: 0.7096
 epoch: 97, train_loss: 0.4401, test_loss: 1.2723, test_f1: 0.6902
 epoch: 98, train_loss: 0.4396, test_loss: 1.2774, test_f1: 0.6951
 epoch: 99, train_loss: 0.4200, test_loss: 1.2344, test_f1: 0.6232
##################ITERATION #9 ****************************************
 epoch: 0, train_loss: 1.1186, test_loss: 1.0557, test_f1: 0.4829
 epoch: 1, train_loss: 0.9848, test_loss: 0.9460, test_f1: 0.4852
 epoch: 2, train_loss: 0.9480, test_loss: 0.9205, test_f1: 0.5295
 epoch: 3, train_loss: 0.9323, test_loss: 0.9818, test_f1: 0.4752
 epoch: 4, train_loss: 0.9307, test_loss: 0.9882, test_f1: 0.4499
 epoch: 5, train_loss: 0.8986, test_loss: 0.9245, test_f1: 0.5762
 epoch: 6, train_loss: 0.9017, test_loss: 0.8662, test_f1: 0.5991
 epoch: 7, train_loss: 0.8824, test_loss: 0.8975, test_f1: 0.5540
 epoch: 8, train_loss: 0.8956, test_loss: 0.9595, test_f1: 0.5151
 epoch: 9, train_loss: 0.8756, test_loss: 0.9294, test_f1: 0.4943
 epoch: 10, train_loss: 0.8704, test_loss: 0.8450, test_f1: 0.5784
 epoch: 11, train_loss: 0.8654, test_loss: 0.8371, test_f1: 0.6088
 epoch: 12, train_loss: 0.8382, test_loss: 0.8259, test_f1: 0.6199
 epoch: 13, train_loss: 0.8374, test_loss: 0.8636, test_f1: 0.5538
 epoch: 14, train_loss: 0.8195, test_loss: 0.8476, test_f1: 0.5505
 epoch: 15, train_loss: 0.8298, test_loss: 0.8220, test_f1: 0.6218
 epoch: 16, train_loss: 0.8114, test_loss: 0.8312, test_f1: 0.5535
 epoch: 17, train_loss: 0.7904, test_loss: 0.8777, test_f1: 0.5446
 epoch: 18, train_loss: 0.8004, test_loss: 1.0506, test_f1: 0.5420
 epoch: 19, train_loss: 0.7975, test_loss: 0.8628, test_f1: 0.5699
 epoch: 20, train_loss: 0.7866, test_loss: 0.8482, test_f1: 0.6263
 epoch: 21, train_loss: 0.7815, test_loss: 0.7586, test_f1: 0.6328
 epoch: 22, train_loss: 0.7623, test_loss: 0.8979, test_f1: 0.5275
 epoch: 23, train_loss: 0.7544, test_loss: 0.8413, test_f1: 0.6061
 epoch: 24, train_loss: 0.7665, test_loss: 0.8462, test_f1: 0.6358
 epoch: 25, train_loss: 0.7653, test_loss: 0.7505, test_f1: 0.6342
 epoch: 26, train_loss: 0.7320, test_loss: 0.9191, test_f1: 0.6266
 epoch: 27, train_loss: 0.7377, test_loss: 1.0384, test_f1: 0.6031
 epoch: 28, train_loss: 0.7631, test_loss: 0.9136, test_f1: 0.6005
 epoch: 29, train_loss: 0.7352, test_loss: 0.7913, test_f1: 0.6421
 epoch: 30, train_loss: 0.7189, test_loss: 0.7917, test_f1: 0.6085
 epoch: 31, train_loss: 0.7209, test_loss: 0.8756, test_f1: 0.6420
 epoch: 32, train_loss: 0.7243, test_loss: 0.7332, test_f1: 0.6224
 epoch: 33, train_loss: 0.6875, test_loss: 0.7746, test_f1: 0.6426
 epoch: 34, train_loss: 0.6895, test_loss: 0.7925, test_f1: 0.6428
 epoch: 35, train_loss: 0.6844, test_loss: 0.7419, test_f1: 0.6755
 epoch: 36, train_loss: 0.6806, test_loss: 0.7383, test_f1: 0.6641
 epoch: 37, train_loss: 0.6644, test_loss: 0.9411, test_f1: 0.6636
 epoch: 38, train_loss: 0.6678, test_loss: 0.7710, test_f1: 0.6324
 epoch: 39, train_loss: 0.7182, test_loss: 0.7770, test_f1: 0.6471
 epoch: 40, train_loss: 0.6682, test_loss: 0.7572, test_f1: 0.6569
 epoch: 41, train_loss: 0.6499, test_loss: 1.0793, test_f1: 0.6168
 epoch: 42, train_loss: 0.6992, test_loss: 0.8033, test_f1: 0.6576
 epoch: 43, train_loss: 0.6786, test_loss: 0.7689, test_f1: 0.6615
 epoch: 44, train_loss: 0.6554, test_loss: 0.7885, test_f1: 0.6563
 epoch: 45, train_loss: 0.6510, test_loss: 0.7659, test_f1: 0.6907
 epoch: 46, train_loss: 0.6361, test_loss: 0.7828, test_f1: 0.6424
 epoch: 47, train_loss: 0.6895, test_loss: 0.8131, test_f1: 0.6338
 epoch: 48, train_loss: 0.6597, test_loss: 0.6983, test_f1: 0.6657
 epoch: 49, train_loss: 0.6274, test_loss: 0.7873, test_f1: 0.6388
 epoch: 50, train_loss: 0.6471, test_loss: 0.7208, test_f1: 0.6579
 epoch: 51, train_loss: 0.5966, test_loss: 0.7418, test_f1: 0.6896
 epoch: 52, train_loss: 0.5625, test_loss: 0.7165, test_f1: 0.6727
 epoch: 53, train_loss: 0.5568, test_loss: 0.7559, test_f1: 0.6717
 epoch: 54, train_loss: 0.5560, test_loss: 0.7871, test_f1: 0.6810
 epoch: 55, train_loss: 0.5528, test_loss: 0.7586, test_f1: 0.6963
 epoch: 56, train_loss: 0.5707, test_loss: 0.7203, test_f1: 0.6871
 epoch: 57, train_loss: 0.5310, test_loss: 1.3016, test_f1: 0.7111
 epoch: 58, train_loss: 0.5395, test_loss: 0.6911, test_f1: 0.7084
 epoch: 59, train_loss: 0.5281, test_loss: 0.7629, test_f1: 0.6815
 epoch: 60, train_loss: 0.5337, test_loss: 0.7237, test_f1: 0.6976
 epoch: 61, train_loss: 0.5601, test_loss: 0.7751, test_f1: 0.6468
 epoch: 62, train_loss: 0.5264, test_loss: 0.7514, test_f1: 0.6658
 epoch: 63, train_loss: 0.5294, test_loss: 0.8070, test_f1: 0.6629
 epoch: 64, train_loss: 0.5128, test_loss: 0.8450, test_f1: 0.6767
 epoch: 65, train_loss: 0.5089, test_loss: 0.7952, test_f1: 0.6873
 epoch: 66, train_loss: 0.4937, test_loss: 0.7326, test_f1: 0.6941
 epoch: 67, train_loss: 0.4914, test_loss: 0.8393, test_f1: 0.6998
 epoch: 68, train_loss: 0.4807, test_loss: 0.9024, test_f1: 0.6861
 epoch: 69, train_loss: 0.4870, test_loss: 0.8121, test_f1: 0.7026
 epoch: 70, train_loss: 0.4985, test_loss: 1.0558, test_f1: 0.6255
 epoch: 71, train_loss: 0.4778, test_loss: 0.9328, test_f1: 0.6722
 epoch: 72, train_loss: 0.4940, test_loss: 0.9721, test_f1: 0.6781
 epoch: 73, train_loss: 0.4786, test_loss: 0.9192, test_f1: 0.6914
 epoch: 74, train_loss: 0.4578, test_loss: 0.8703, test_f1: 0.6828
 epoch: 75, train_loss: 0.4687, test_loss: 0.8297, test_f1: 0.7023
 epoch: 76, train_loss: 0.4691, test_loss: 0.8110, test_f1: 0.6695
 epoch: 77, train_loss: 0.4715, test_loss: 0.8973, test_f1: 0.6774
 epoch: 78, train_loss: 0.4691, test_loss: 0.8168, test_f1: 0.6844
 epoch: 79, train_loss: 0.4629, test_loss: 1.0036, test_f1: 0.6895
 epoch: 80, train_loss: 0.4740, test_loss: 1.0648, test_f1: 0.6591
 epoch: 81, train_loss: 0.4818, test_loss: 1.0573, test_f1: 0.6704
 epoch: 82, train_loss: 0.4631, test_loss: 1.1165, test_f1: 0.6708
 epoch: 83, train_loss: 0.4563, test_loss: 1.1327, test_f1: 0.6860
 epoch: 84, train_loss: 0.4497, test_loss: 1.0691, test_f1: 0.6971
 epoch: 85, train_loss: 0.4444, test_loss: 1.0121, test_f1: 0.7036
 epoch: 86, train_loss: 0.4389, test_loss: 0.9175, test_f1: 0.7160
 epoch: 87, train_loss: 0.4449, test_loss: 0.9459, test_f1: 0.6940
 epoch: 88, train_loss: 0.4325, test_loss: 0.9746, test_f1: 0.6960
 epoch: 89, train_loss: 0.4507, test_loss: 1.0949, test_f1: 0.7026
 epoch: 90, train_loss: 0.4507, test_loss: 0.9554, test_f1: 0.6933
 epoch: 91, train_loss: 0.4339, test_loss: 0.9086, test_f1: 0.7012
 epoch: 92, train_loss: 0.4230, test_loss: 1.0846, test_f1: 0.6900
 epoch: 93, train_loss: 0.4237, test_loss: 0.9075, test_f1: 0.7092
 epoch: 94, train_loss: 0.4750, test_loss: 0.9230, test_f1: 0.7012
 epoch: 95, train_loss: 0.4508, test_loss: 1.0637, test_f1: 0.6886
 epoch: 96, train_loss: 0.4147, test_loss: 1.0173, test_f1: 0.6903
 epoch: 97, train_loss: 0.4227, test_loss: 0.8719, test_f1: 0.7029
 epoch: 98, train_loss: 0.4151, test_loss: 1.0308, test_f1: 0.6939
 epoch: 99, train_loss: 0.4354, test_loss: 1.0465, test_f1: 0.6963

Training completed in 1446.61 seconds
Best F1: 0.7216 at epoch 96
Mean F1 across iterations: 0.7090  0.0097
========================FINAL RESULTS================================
FEGIN weighted F1: 0.7216  0.0097
python main.py --data ltspice_examples --representation component_pin_net --model FEGIN --layers 2 --hiddens 128 --batch_size 32 --lr 0.01 --emb_size 128 --epochs 100 --save_appendix component_pin_net_L2_H128_BS32_LR0.01_E128 --no_val
-----



STDERR:
  File "main.py", line 370, in <module>
    main()
  File "main.py", line 254, in main
    dataset = dataset_class(
  File "/home/philip/projects/llm_inference_code_repo/Circuit-Completion-Using-GNNs/component_classification_with_link_prediction_head/evaluation/FEGIN/kernel/circuit_datasets.py", line 15, in __init__
    self.data, self.slices = torch.load(self.processed_paths[0])
  File "/home/philip/.local/lib/python3.8/site-packages/torch/serialization.py", line 1040, in load
    warnings.warn(
  File "/usr/lib/python3.8/warnings.py", line 109, in _showwarnmsg
    sw(msg.message, msg.category, msg.filename, msg.lineno,
  File "main.py", line 47, in warn_with_traceback
    traceback.print_stack(file=log)
/home/philip/projects/llm_inference_code_repo/Circuit-Completion-Using-GNNs/component_classification_with_link_prediction_head/evaluation/FEGIN/kernel/circuit_datasets.py:15: FutureWarning: You are using `torch.load` with `weights_only=False` (the current default value), which uses the default pickle module implicitly. It is possible to construct malicious pickle data which will execute arbitrary code during unpickling (See https://github.com/pytorch/pytorch/blob/main/SECURITY.md#untrusted-models for more details). In a future release, the default value for `weights_only` will be flipped to `True`. This limits the functions that could be executed during unpickling. Arbitrary objects will no longer be allowed to be loaded via this mode unless they are explicitly allowlisted by the user via `torch.serialization.add_safe_globals`. We recommend you start setting `weights_only=True` for any use case where you don't have full control of the loaded file. Please open an issue on GitHub for any issues related to this experimental feature.
  self.data, self.slices = torch.load(self.processed_paths[0])
