STDOUT:
Results will be saved in /home/philip/projects/ltspice_examples_code_repo/Circuit-Completion-Using-GNNs/component_classification_with_link_prediction_head/evaluation/FEGIN/results/model_FEGIN_dataset_ltspice_examples
Command line input: python main.py --data ltspice_examples --representation component_pin --model FEGIN --layers 3 --hiddens 16 --batch_size 128 --lr 0.01 --emb_size 250 --epochs 100 --save_appendix component_pin_L3_H16_BS128_LR0.01_E250 --no_val
 is saved.
-----
ltspice_examples - FEGIN
Using 3 layers, 16 hidden units, h = 2
Loading component_pin representation dataset
ENTERED
Training FEGIN on component_pin representation
Train: 3560, Test: 848
##################ITERATION #0 ****************************************
 epoch: 0, train_loss: 1.2615, test_loss: 1.1831, test_f1: 0.2260
 epoch: 1, train_loss: 1.1163, test_loss: 1.0545, test_f1: 0.3984
 epoch: 2, train_loss: 1.0315, test_loss: 1.1521, test_f1: 0.4355
 epoch: 3, train_loss: 1.0077, test_loss: 1.0051, test_f1: 0.4540
 epoch: 4, train_loss: 0.9973, test_loss: 1.0448, test_f1: 0.4297
 epoch: 5, train_loss: 0.9882, test_loss: 1.0374, test_f1: 0.4326
 epoch: 6, train_loss: 0.9640, test_loss: 0.9794, test_f1: 0.4788
 epoch: 7, train_loss: 0.9499, test_loss: 0.9773, test_f1: 0.5007
 epoch: 8, train_loss: 0.9193, test_loss: 0.8856, test_f1: 0.5077
 epoch: 9, train_loss: 0.9267, test_loss: 1.0161, test_f1: 0.4770
 epoch: 10, train_loss: 0.9031, test_loss: 0.9847, test_f1: 0.4569
 epoch: 11, train_loss: 0.8856, test_loss: 0.9366, test_f1: 0.4922
 epoch: 12, train_loss: 0.8838, test_loss: 0.9182, test_f1: 0.5026
 epoch: 13, train_loss: 0.8980, test_loss: 0.9212, test_f1: 0.5073
 epoch: 14, train_loss: 0.8990, test_loss: 1.0213, test_f1: 0.4932
 epoch: 15, train_loss: 0.8774, test_loss: 0.8631, test_f1: 0.5136
 epoch: 16, train_loss: 0.8638, test_loss: 0.8643, test_f1: 0.5289
 epoch: 17, train_loss: 0.8571, test_loss: 0.9111, test_f1: 0.5397
 epoch: 18, train_loss: 0.8544, test_loss: 0.8498, test_f1: 0.5233
 epoch: 19, train_loss: 0.8461, test_loss: 0.8953, test_f1: 0.5155
 epoch: 20, train_loss: 0.8415, test_loss: 0.8577, test_f1: 0.5303
 epoch: 21, train_loss: 0.8249, test_loss: 0.8500, test_f1: 0.5418
 epoch: 22, train_loss: 0.8182, test_loss: 0.8713, test_f1: 0.5207
 epoch: 23, train_loss: 0.8174, test_loss: 0.8605, test_f1: 0.5514
 epoch: 24, train_loss: 0.8109, test_loss: 0.9595, test_f1: 0.5088
 epoch: 25, train_loss: 0.8181, test_loss: 0.8618, test_f1: 0.5386
 epoch: 26, train_loss: 0.8106, test_loss: 0.8677, test_f1: 0.6078
 epoch: 27, train_loss: 0.8190, test_loss: 0.9007, test_f1: 0.5239
 epoch: 28, train_loss: 0.8192, test_loss: 0.9446, test_f1: 0.5275
 epoch: 29, train_loss: 0.8046, test_loss: 0.8644, test_f1: 0.5490
 epoch: 30, train_loss: 0.8054, test_loss: 0.8399, test_f1: 0.5828
 epoch: 31, train_loss: 0.7886, test_loss: 0.9734, test_f1: 0.4636
 epoch: 32, train_loss: 0.7837, test_loss: 0.8548, test_f1: 0.5493
 epoch: 33, train_loss: 0.7873, test_loss: 0.8367, test_f1: 0.5501
 epoch: 34, train_loss: 0.7830, test_loss: 0.8649, test_f1: 0.5159
 epoch: 35, train_loss: 0.7854, test_loss: 0.9065, test_f1: 0.5172
 epoch: 36, train_loss: 0.7923, test_loss: 0.8404, test_f1: 0.5422
 epoch: 37, train_loss: 0.8301, test_loss: 0.8726, test_f1: 0.5302
 epoch: 38, train_loss: 0.7816, test_loss: 0.8771, test_f1: 0.5218
 epoch: 39, train_loss: 0.7943, test_loss: 0.9079, test_f1: 0.5176
 epoch: 40, train_loss: 0.7461, test_loss: 0.9027, test_f1: 0.5044
 epoch: 41, train_loss: 0.7819, test_loss: 0.8492, test_f1: 0.5493
 epoch: 42, train_loss: 0.7835, test_loss: 0.8286, test_f1: 0.5531
 epoch: 43, train_loss: 0.7592, test_loss: 0.8905, test_f1: 0.5453
 epoch: 44, train_loss: 0.7675, test_loss: 0.8909, test_f1: 0.4912
 epoch: 45, train_loss: 0.7735, test_loss: 0.8762, test_f1: 0.5776
 epoch: 46, train_loss: 0.7609, test_loss: 0.8964, test_f1: 0.5542
 epoch: 47, train_loss: 0.7545, test_loss: 0.8454, test_f1: 0.5542
 epoch: 48, train_loss: 0.7527, test_loss: 0.9617, test_f1: 0.4935
 epoch: 49, train_loss: 0.7532, test_loss: 0.8911, test_f1: 0.5421
 epoch: 50, train_loss: 0.7771, test_loss: 0.8126, test_f1: 0.5860
 epoch: 51, train_loss: 0.7409, test_loss: 0.8048, test_f1: 0.5637
 epoch: 52, train_loss: 0.7210, test_loss: 0.8183, test_f1: 0.5965
 epoch: 53, train_loss: 0.7098, test_loss: 0.8245, test_f1: 0.5823
 epoch: 54, train_loss: 0.7090, test_loss: 0.8597, test_f1: 0.5577
 epoch: 55, train_loss: 0.7087, test_loss: 0.8946, test_f1: 0.5670
 epoch: 56, train_loss: 0.7083, test_loss: 0.8042, test_f1: 0.6448
 epoch: 57, train_loss: 0.7150, test_loss: 0.8324, test_f1: 0.5688
 epoch: 58, train_loss: 0.7130, test_loss: 0.8595, test_f1: 0.5676
 epoch: 59, train_loss: 0.7112, test_loss: 0.8169, test_f1: 0.6014
 epoch: 60, train_loss: 0.7093, test_loss: 0.8551, test_f1: 0.5602
 epoch: 61, train_loss: 0.6890, test_loss: 0.8334, test_f1: 0.5749
 epoch: 62, train_loss: 0.6984, test_loss: 0.8329, test_f1: 0.6225
 epoch: 63, train_loss: 0.6972, test_loss: 0.8530, test_f1: 0.5832
 epoch: 64, train_loss: 0.6958, test_loss: 0.8568, test_f1: 0.5831
 epoch: 65, train_loss: 0.7048, test_loss: 0.8643, test_f1: 0.5765
 epoch: 66, train_loss: 0.6961, test_loss: 0.8202, test_f1: 0.6252
 epoch: 67, train_loss: 0.7003, test_loss: 0.8640, test_f1: 0.5764
 epoch: 68, train_loss: 0.6904, test_loss: 0.8603, test_f1: 0.5594
 epoch: 69, train_loss: 0.6864, test_loss: 0.8113, test_f1: 0.5701
 epoch: 70, train_loss: 0.6843, test_loss: 0.8569, test_f1: 0.5923
 epoch: 71, train_loss: 0.6853, test_loss: 0.8505, test_f1: 0.5767
 epoch: 72, train_loss: 0.6724, test_loss: 0.8329, test_f1: 0.5908
 epoch: 73, train_loss: 0.6789, test_loss: 0.8688, test_f1: 0.6145
 epoch: 74, train_loss: 0.6841, test_loss: 0.8303, test_f1: 0.5661
 epoch: 75, train_loss: 0.6863, test_loss: 0.8448, test_f1: 0.5949
 epoch: 76, train_loss: 0.6867, test_loss: 0.8561, test_f1: 0.5843
 epoch: 77, train_loss: 0.6750, test_loss: 0.8841, test_f1: 0.5574
 epoch: 78, train_loss: 0.6771, test_loss: 0.8325, test_f1: 0.6168
 epoch: 79, train_loss: 0.6641, test_loss: 0.8556, test_f1: 0.5649
 epoch: 80, train_loss: 0.6793, test_loss: 0.9243, test_f1: 0.5461
 epoch: 81, train_loss: 0.6607, test_loss: 0.8275, test_f1: 0.6093
 epoch: 82, train_loss: 0.6777, test_loss: 0.8580, test_f1: 0.6079
 epoch: 83, train_loss: 0.6758, test_loss: 0.8844, test_f1: 0.5831
 epoch: 84, train_loss: 0.6790, test_loss: 0.8074, test_f1: 0.5966
 epoch: 85, train_loss: 0.6760, test_loss: 0.8708, test_f1: 0.5787
 epoch: 86, train_loss: 0.6721, test_loss: 0.8264, test_f1: 0.6120
 epoch: 87, train_loss: 0.6692, test_loss: 0.8348, test_f1: 0.5963
 epoch: 88, train_loss: 0.6661, test_loss: 0.8319, test_f1: 0.6117
 epoch: 89, train_loss: 0.6679, test_loss: 0.8631, test_f1: 0.6248
 epoch: 90, train_loss: 0.6610, test_loss: 0.8696, test_f1: 0.6025
 epoch: 91, train_loss: 0.6688, test_loss: 0.8368, test_f1: 0.5852
 epoch: 92, train_loss: 0.6709, test_loss: 0.8471, test_f1: 0.6010
 epoch: 93, train_loss: 0.6702, test_loss: 0.8693, test_f1: 0.5697
 epoch: 94, train_loss: 0.6667, test_loss: 0.8137, test_f1: 0.6573
 epoch: 95, train_loss: 0.6504, test_loss: 0.8139, test_f1: 0.5949
 epoch: 96, train_loss: 0.6641, test_loss: 0.8430, test_f1: 0.5889
 epoch: 97, train_loss: 0.6522, test_loss: 0.8000, test_f1: 0.6176
 epoch: 98, train_loss: 0.6574, test_loss: 0.8748, test_f1: 0.5716
 epoch: 99, train_loss: 0.6594, test_loss: 0.8769, test_f1: 0.5473
##################ITERATION #1 ****************************************
 epoch: 0, train_loss: 1.1789, test_loss: 1.3591, test_f1: 0.2876
 epoch: 1, train_loss: 1.0467, test_loss: 1.0051, test_f1: 0.3906
 epoch: 2, train_loss: 0.9982, test_loss: 0.9460, test_f1: 0.4967
 epoch: 3, train_loss: 0.9702, test_loss: 1.0069, test_f1: 0.4794
 epoch: 4, train_loss: 0.9616, test_loss: 1.0098, test_f1: 0.4947
 epoch: 5, train_loss: 0.9423, test_loss: 0.9165, test_f1: 0.5299
 epoch: 6, train_loss: 0.9264, test_loss: 0.8923, test_f1: 0.5458
 epoch: 7, train_loss: 0.9162, test_loss: 0.9592, test_f1: 0.5422
 epoch: 8, train_loss: 0.9043, test_loss: 0.8937, test_f1: 0.5007
 epoch: 9, train_loss: 0.8847, test_loss: 0.9446, test_f1: 0.5122
 epoch: 10, train_loss: 0.8983, test_loss: 0.8777, test_f1: 0.5237
 epoch: 11, train_loss: 0.8866, test_loss: 0.8675, test_f1: 0.5701
 epoch: 12, train_loss: 0.8692, test_loss: 0.9428, test_f1: 0.5157
 epoch: 13, train_loss: 0.8647, test_loss: 0.8765, test_f1: 0.5469
 epoch: 14, train_loss: 0.8742, test_loss: 0.8849, test_f1: 0.5190
 epoch: 15, train_loss: 0.8910, test_loss: 0.9217, test_f1: 0.5040
 epoch: 16, train_loss: 0.8676, test_loss: 0.8458, test_f1: 0.5675
 epoch: 17, train_loss: 0.8467, test_loss: 1.0176, test_f1: 0.5105
 epoch: 18, train_loss: 0.8802, test_loss: 1.1178, test_f1: 0.5045
 epoch: 19, train_loss: 0.8511, test_loss: 0.8758, test_f1: 0.5181
 epoch: 20, train_loss: 0.8608, test_loss: 0.9916, test_f1: 0.4993
 epoch: 21, train_loss: 0.8433, test_loss: 0.9429, test_f1: 0.5131
 epoch: 22, train_loss: 0.8377, test_loss: 0.8735, test_f1: 0.5532
 epoch: 23, train_loss: 0.8339, test_loss: 0.9344, test_f1: 0.4826
 epoch: 24, train_loss: 0.8479, test_loss: 0.8474, test_f1: 0.5554
 epoch: 25, train_loss: 0.8376, test_loss: 0.9211, test_f1: 0.5243
 epoch: 26, train_loss: 0.8338, test_loss: 0.8373, test_f1: 0.5533
 epoch: 27, train_loss: 0.8100, test_loss: 0.8071, test_f1: 0.5678
 epoch: 28, train_loss: 0.8335, test_loss: 0.9276, test_f1: 0.4891
 epoch: 29, train_loss: 0.8338, test_loss: 0.8999, test_f1: 0.5138
 epoch: 30, train_loss: 0.8226, test_loss: 0.8684, test_f1: 0.5503
 epoch: 31, train_loss: 0.8210, test_loss: 0.8636, test_f1: 0.5486
 epoch: 32, train_loss: 0.8038, test_loss: 0.8701, test_f1: 0.5371
 epoch: 33, train_loss: 0.8135, test_loss: 0.8264, test_f1: 0.5473
 epoch: 34, train_loss: 0.8028, test_loss: 0.8281, test_f1: 0.5414
 epoch: 35, train_loss: 0.7922, test_loss: 0.9254, test_f1: 0.5352
 epoch: 36, train_loss: 0.8064, test_loss: 0.9387, test_f1: 0.5314
 epoch: 37, train_loss: 0.7910, test_loss: 0.8834, test_f1: 0.5476
 epoch: 38, train_loss: 0.8000, test_loss: 0.8703, test_f1: 0.5537
 epoch: 39, train_loss: 0.7912, test_loss: 0.9093, test_f1: 0.5178
 epoch: 40, train_loss: 0.7991, test_loss: 0.8000, test_f1: 0.5956
 epoch: 41, train_loss: 0.7822, test_loss: 0.8261, test_f1: 0.5340
 epoch: 42, train_loss: 0.7764, test_loss: 0.7924, test_f1: 0.5751
 epoch: 43, train_loss: 0.8026, test_loss: 0.8467, test_f1: 0.5439
 epoch: 44, train_loss: 0.7949, test_loss: 0.7874, test_f1: 0.5601
 epoch: 45, train_loss: 0.7882, test_loss: 0.7685, test_f1: 0.5647
 epoch: 46, train_loss: 0.7855, test_loss: 0.8577, test_f1: 0.5553
 epoch: 47, train_loss: 0.8037, test_loss: 0.8443, test_f1: 0.5245
 epoch: 48, train_loss: 0.7827, test_loss: 0.8284, test_f1: 0.5668
 epoch: 49, train_loss: 0.7638, test_loss: 0.8135, test_f1: 0.5551
 epoch: 50, train_loss: 0.7604, test_loss: 0.8956, test_f1: 0.5042
 epoch: 51, train_loss: 0.7559, test_loss: 0.8131, test_f1: 0.5468
 epoch: 52, train_loss: 0.7458, test_loss: 0.8252, test_f1: 0.5493
 epoch: 53, train_loss: 0.7431, test_loss: 0.8309, test_f1: 0.5344
 epoch: 54, train_loss: 0.7497, test_loss: 0.8346, test_f1: 0.5508
 epoch: 55, train_loss: 0.7370, test_loss: 0.7994, test_f1: 0.5641
 epoch: 56, train_loss: 0.7398, test_loss: 0.9015, test_f1: 0.5258
 epoch: 57, train_loss: 0.7293, test_loss: 0.8602, test_f1: 0.5472
 epoch: 58, train_loss: 0.7400, test_loss: 0.8641, test_f1: 0.5452
 epoch: 59, train_loss: 0.7346, test_loss: 0.8043, test_f1: 0.5614
 epoch: 60, train_loss: 0.7417, test_loss: 0.7587, test_f1: 0.5699
 epoch: 61, train_loss: 0.7169, test_loss: 0.7850, test_f1: 0.5590
 epoch: 62, train_loss: 0.7333, test_loss: 0.8484, test_f1: 0.5277
 epoch: 63, train_loss: 0.7306, test_loss: 0.7794, test_f1: 0.5741
 epoch: 64, train_loss: 0.7247, test_loss: 0.7482, test_f1: 0.5779
 epoch: 65, train_loss: 0.7219, test_loss: 0.7836, test_f1: 0.5775
 epoch: 66, train_loss: 0.7218, test_loss: 0.8101, test_f1: 0.5676
 epoch: 67, train_loss: 0.7116, test_loss: 0.7974, test_f1: 0.5482
 epoch: 68, train_loss: 0.7163, test_loss: 0.7906, test_f1: 0.5675
 epoch: 69, train_loss: 0.7203, test_loss: 0.8505, test_f1: 0.5551
 epoch: 70, train_loss: 0.7030, test_loss: 0.7541, test_f1: 0.5898
 epoch: 71, train_loss: 0.7032, test_loss: 0.8024, test_f1: 0.5457
 epoch: 72, train_loss: 0.7102, test_loss: 0.8414, test_f1: 0.6073
 epoch: 73, train_loss: 0.7050, test_loss: 0.7579, test_f1: 0.5504
 epoch: 74, train_loss: 0.7087, test_loss: 0.8190, test_f1: 0.5492
 epoch: 75, train_loss: 0.7133, test_loss: 0.7855, test_f1: 0.5545
 epoch: 76, train_loss: 0.7122, test_loss: 0.7816, test_f1: 0.5561
 epoch: 77, train_loss: 0.7088, test_loss: 0.8036, test_f1: 0.5432
 epoch: 78, train_loss: 0.7075, test_loss: 0.8450, test_f1: 0.5491
 epoch: 79, train_loss: 0.7009, test_loss: 0.8094, test_f1: 0.5450
 epoch: 80, train_loss: 0.7064, test_loss: 0.8199, test_f1: 0.5517
 epoch: 81, train_loss: 0.7116, test_loss: 0.8000, test_f1: 0.5616
 epoch: 82, train_loss: 0.6972, test_loss: 0.7778, test_f1: 0.5905
 epoch: 83, train_loss: 0.6866, test_loss: 0.8346, test_f1: 0.5391
 epoch: 84, train_loss: 0.6901, test_loss: 0.8128, test_f1: 0.5818
 epoch: 85, train_loss: 0.7001, test_loss: 0.9033, test_f1: 0.5578
 epoch: 86, train_loss: 0.6814, test_loss: 0.8993, test_f1: 0.5794
 epoch: 87, train_loss: 0.6997, test_loss: 0.8670, test_f1: 0.5466
 epoch: 88, train_loss: 0.6886, test_loss: 0.9138, test_f1: 0.5540
 epoch: 89, train_loss: 0.6962, test_loss: 0.7899, test_f1: 0.5712
 epoch: 90, train_loss: 0.7016, test_loss: 0.7750, test_f1: 0.5523
 epoch: 91, train_loss: 0.6976, test_loss: 0.8103, test_f1: 0.5626
 epoch: 92, train_loss: 0.6790, test_loss: 0.8807, test_f1: 0.5824
 epoch: 93, train_loss: 0.6774, test_loss: 0.8923, test_f1: 0.5318
 epoch: 94, train_loss: 0.6775, test_loss: 0.9218, test_f1: 0.5179
 epoch: 95, train_loss: 0.6981, test_loss: 0.8620, test_f1: 0.5459
 epoch: 96, train_loss: 0.6880, test_loss: 0.8625, test_f1: 0.5826
 epoch: 97, train_loss: 0.6664, test_loss: 0.8052, test_f1: 0.5747
 epoch: 98, train_loss: 0.6864, test_loss: 0.9290, test_f1: 0.5245
 epoch: 99, train_loss: 0.6881, test_loss: 0.8183, test_f1: 0.5615
##################ITERATION #2 ****************************************
 epoch: 0, train_loss: 1.1827, test_loss: 1.1638, test_f1: 0.3229
 epoch: 1, train_loss: 1.0449, test_loss: 1.1313, test_f1: 0.4469
 epoch: 2, train_loss: 1.0138, test_loss: 1.0421, test_f1: 0.4393
 epoch: 3, train_loss: 0.9756, test_loss: 0.9800, test_f1: 0.5110
 epoch: 4, train_loss: 0.9588, test_loss: 1.0481, test_f1: 0.4831
 epoch: 5, train_loss: 0.9384, test_loss: 0.9529, test_f1: 0.5284
 epoch: 6, train_loss: 0.9396, test_loss: 1.1094, test_f1: 0.4471
 epoch: 7, train_loss: 0.9132, test_loss: 0.9222, test_f1: 0.4982
 epoch: 8, train_loss: 0.8999, test_loss: 0.9304, test_f1: 0.5352
 epoch: 9, train_loss: 0.8884, test_loss: 1.0407, test_f1: 0.4874
 epoch: 10, train_loss: 0.8832, test_loss: 0.9045, test_f1: 0.5046
 epoch: 11, train_loss: 0.8647, test_loss: 0.9842, test_f1: 0.5076
 epoch: 12, train_loss: 0.8740, test_loss: 0.9180, test_f1: 0.5278
 epoch: 13, train_loss: 0.8575, test_loss: 0.9280, test_f1: 0.5215
 epoch: 14, train_loss: 0.8681, test_loss: 0.9832, test_f1: 0.4901
 epoch: 15, train_loss: 0.8663, test_loss: 0.9263, test_f1: 0.5212
 epoch: 16, train_loss: 0.8449, test_loss: 0.8578, test_f1: 0.5336
 epoch: 17, train_loss: 0.8356, test_loss: 1.0065, test_f1: 0.4274
 epoch: 18, train_loss: 0.8434, test_loss: 0.9631, test_f1: 0.5019
 epoch: 19, train_loss: 0.8259, test_loss: 0.8666, test_f1: 0.5411
 epoch: 20, train_loss: 0.8249, test_loss: 0.9350, test_f1: 0.5229
 epoch: 21, train_loss: 0.8150, test_loss: 0.8461, test_f1: 0.5386
 epoch: 22, train_loss: 0.8158, test_loss: 0.9027, test_f1: 0.5726
 epoch: 23, train_loss: 0.8233, test_loss: 0.9462, test_f1: 0.5072
 epoch: 24, train_loss: 0.8128, test_loss: 0.8912, test_f1: 0.5250
 epoch: 25, train_loss: 0.8257, test_loss: 0.8743, test_f1: 0.5468
 epoch: 26, train_loss: 0.8241, test_loss: 0.8676, test_f1: 0.5232
 epoch: 27, train_loss: 0.7936, test_loss: 0.8938, test_f1: 0.5733
 epoch: 28, train_loss: 0.8058, test_loss: 0.8826, test_f1: 0.5249
 epoch: 29, train_loss: 0.7983, test_loss: 0.9205, test_f1: 0.5411
 epoch: 30, train_loss: 0.7873, test_loss: 0.8762, test_f1: 0.5298
 epoch: 31, train_loss: 0.7946, test_loss: 0.9688, test_f1: 0.4944
 epoch: 32, train_loss: 0.7779, test_loss: 0.8501, test_f1: 0.5381
 epoch: 33, train_loss: 0.7753, test_loss: 0.8270, test_f1: 0.5569
 epoch: 34, train_loss: 0.7666, test_loss: 0.8570, test_f1: 0.5548
 epoch: 35, train_loss: 0.7622, test_loss: 0.8456, test_f1: 0.5608
 epoch: 36, train_loss: 0.7919, test_loss: 0.8617, test_f1: 0.5832
 epoch: 37, train_loss: 0.7854, test_loss: 1.0373, test_f1: 0.4967
 epoch: 38, train_loss: 0.7688, test_loss: 0.8173, test_f1: 0.6193
 epoch: 39, train_loss: 0.7751, test_loss: 0.8739, test_f1: 0.5649
 epoch: 40, train_loss: 0.7795, test_loss: 0.8876, test_f1: 0.5482
 epoch: 41, train_loss: 0.7522, test_loss: 0.9934, test_f1: 0.4990
 epoch: 42, train_loss: 0.7870, test_loss: 0.8699, test_f1: 0.5412
 epoch: 43, train_loss: 0.7584, test_loss: 0.8669, test_f1: 0.5529
 epoch: 44, train_loss: 0.7712, test_loss: 0.8380, test_f1: 0.5615
 epoch: 45, train_loss: 0.7609, test_loss: 0.8199, test_f1: 0.5825
 epoch: 46, train_loss: 0.7630, test_loss: 0.8089, test_f1: 0.6087
 epoch: 47, train_loss: 0.7470, test_loss: 0.8421, test_f1: 0.5696
 epoch: 48, train_loss: 0.7578, test_loss: 0.8804, test_f1: 0.5654
 epoch: 49, train_loss: 0.7975, test_loss: 0.8396, test_f1: 0.5551
 epoch: 50, train_loss: 0.7750, test_loss: 0.9238, test_f1: 0.5455
 epoch: 51, train_loss: 0.7390, test_loss: 0.8418, test_f1: 0.5510
 epoch: 52, train_loss: 0.7194, test_loss: 0.8486, test_f1: 0.5664
 epoch: 53, train_loss: 0.7335, test_loss: 0.8412, test_f1: 0.5824
 epoch: 54, train_loss: 0.7282, test_loss: 0.8759, test_f1: 0.5520
 epoch: 55, train_loss: 0.7154, test_loss: 0.8462, test_f1: 0.5835
 epoch: 56, train_loss: 0.7125, test_loss: 0.8685, test_f1: 0.5745
 epoch: 57, train_loss: 0.7040, test_loss: 0.8677, test_f1: 0.5619
 epoch: 58, train_loss: 0.7106, test_loss: 0.8377, test_f1: 0.5903
 epoch: 59, train_loss: 0.7115, test_loss: 0.8381, test_f1: 0.6032
 epoch: 60, train_loss: 0.7031, test_loss: 0.8965, test_f1: 0.5573
 epoch: 61, train_loss: 0.7084, test_loss: 0.9066, test_f1: 0.5713
 epoch: 62, train_loss: 0.7162, test_loss: 0.8999, test_f1: 0.5677
 epoch: 63, train_loss: 0.7179, test_loss: 0.9139, test_f1: 0.5617
 epoch: 64, train_loss: 0.7171, test_loss: 0.8925, test_f1: 0.5834
 epoch: 65, train_loss: 0.6985, test_loss: 0.8844, test_f1: 0.5978
 epoch: 66, train_loss: 0.7022, test_loss: 0.8675, test_f1: 0.6012
 epoch: 67, train_loss: 0.7049, test_loss: 0.9380, test_f1: 0.5801
 epoch: 68, train_loss: 0.6940, test_loss: 0.8569, test_f1: 0.5766
 epoch: 69, train_loss: 0.6901, test_loss: 0.8853, test_f1: 0.5997
 epoch: 70, train_loss: 0.7017, test_loss: 0.8661, test_f1: 0.5832
 epoch: 71, train_loss: 0.6952, test_loss: 0.9314, test_f1: 0.5775
 epoch: 72, train_loss: 0.7031, test_loss: 0.9304, test_f1: 0.5548
 epoch: 73, train_loss: 0.7105, test_loss: 0.9254, test_f1: 0.5903
 epoch: 74, train_loss: 0.6881, test_loss: 0.9826, test_f1: 0.5820
 epoch: 75, train_loss: 0.7019, test_loss: 0.8784, test_f1: 0.5610
 epoch: 76, train_loss: 0.6812, test_loss: 0.9446, test_f1: 0.5833
 epoch: 77, train_loss: 0.6932, test_loss: 0.9485, test_f1: 0.5777
 epoch: 78, train_loss: 0.6961, test_loss: 0.9312, test_f1: 0.5878
 epoch: 79, train_loss: 0.6992, test_loss: 0.9100, test_f1: 0.5978
 epoch: 80, train_loss: 0.7047, test_loss: 0.9196, test_f1: 0.5688
 epoch: 81, train_loss: 0.6920, test_loss: 0.8915, test_f1: 0.5980
 epoch: 82, train_loss: 0.6948, test_loss: 0.8953, test_f1: 0.6095
 epoch: 83, train_loss: 0.6776, test_loss: 0.9499, test_f1: 0.5418
 epoch: 84, train_loss: 0.6810, test_loss: 0.9071, test_f1: 0.5943
 epoch: 85, train_loss: 0.6988, test_loss: 0.8590, test_f1: 0.6148
 epoch: 86, train_loss: 0.6847, test_loss: 0.9375, test_f1: 0.5798
 epoch: 87, train_loss: 0.6875, test_loss: 0.9122, test_f1: 0.5673
 epoch: 88, train_loss: 0.6828, test_loss: 0.9160, test_f1: 0.5842
 epoch: 89, train_loss: 0.6739, test_loss: 0.9795, test_f1: 0.5790
 epoch: 90, train_loss: 0.6847, test_loss: 0.9141, test_f1: 0.5812
 epoch: 91, train_loss: 0.6848, test_loss: 0.8678, test_f1: 0.5943
 epoch: 92, train_loss: 0.6680, test_loss: 0.8932, test_f1: 0.5921
 epoch: 93, train_loss: 0.6641, test_loss: 0.9629, test_f1: 0.5730
 epoch: 94, train_loss: 0.6759, test_loss: 0.9356, test_f1: 0.5770
 epoch: 95, train_loss: 0.6677, test_loss: 0.8634, test_f1: 0.5881
 epoch: 96, train_loss: 0.6688, test_loss: 0.9047, test_f1: 0.5730
 epoch: 97, train_loss: 0.6789, test_loss: 0.9878, test_f1: 0.5496
 epoch: 98, train_loss: 0.6727, test_loss: 0.8595, test_f1: 0.6009
 epoch: 99, train_loss: 0.6745, test_loss: 0.8890, test_f1: 0.5937
##################ITERATION #3 ****************************************
 epoch: 0, train_loss: 1.1903, test_loss: 1.0984, test_f1: 0.3703
 epoch: 1, train_loss: 1.0474, test_loss: 1.0903, test_f1: 0.3659
 epoch: 2, train_loss: 1.0132, test_loss: 1.0207, test_f1: 0.4751
 epoch: 3, train_loss: 0.9848, test_loss: 1.0181, test_f1: 0.4727
 epoch: 4, train_loss: 0.9740, test_loss: 1.0113, test_f1: 0.4749
 epoch: 5, train_loss: 0.9712, test_loss: 0.9727, test_f1: 0.5115
 epoch: 6, train_loss: 0.9371, test_loss: 0.9693, test_f1: 0.4947
 epoch: 7, train_loss: 0.9219, test_loss: 1.0008, test_f1: 0.4472
 epoch: 8, train_loss: 0.9180, test_loss: 0.9361, test_f1: 0.5060
 epoch: 9, train_loss: 0.9090, test_loss: 1.0547, test_f1: 0.4551
 epoch: 10, train_loss: 0.9000, test_loss: 0.9780, test_f1: 0.4894
 epoch: 11, train_loss: 0.9069, test_loss: 0.9126, test_f1: 0.5141
 epoch: 12, train_loss: 0.9076, test_loss: 0.9792, test_f1: 0.4717
 epoch: 13, train_loss: 0.8830, test_loss: 0.9924, test_f1: 0.4901
 epoch: 14, train_loss: 0.8835, test_loss: 0.9380, test_f1: 0.5007
 epoch: 15, train_loss: 0.8932, test_loss: 0.9315, test_f1: 0.4832
 epoch: 16, train_loss: 0.8783, test_loss: 1.1061, test_f1: 0.4379
 epoch: 17, train_loss: 0.8554, test_loss: 1.0234, test_f1: 0.4859
 epoch: 18, train_loss: 0.8411, test_loss: 0.8403, test_f1: 0.5389
 epoch: 19, train_loss: 0.8515, test_loss: 0.9586, test_f1: 0.5289
 epoch: 20, train_loss: 0.8371, test_loss: 0.9420, test_f1: 0.5084
 epoch: 21, train_loss: 0.8563, test_loss: 0.9488, test_f1: 0.4878
 epoch: 22, train_loss: 0.8352, test_loss: 0.8387, test_f1: 0.5434
 epoch: 23, train_loss: 0.8297, test_loss: 0.8474, test_f1: 0.5395
 epoch: 24, train_loss: 0.8202, test_loss: 0.9892, test_f1: 0.5071
 epoch: 25, train_loss: 0.8473, test_loss: 0.8506, test_f1: 0.5317
 epoch: 26, train_loss: 0.8306, test_loss: 0.8963, test_f1: 0.5369
 epoch: 27, train_loss: 0.8154, test_loss: 0.8942, test_f1: 0.5179
 epoch: 28, train_loss: 0.8208, test_loss: 1.0698, test_f1: 0.4620
 epoch: 29, train_loss: 0.8123, test_loss: 0.8858, test_f1: 0.5399
 epoch: 30, train_loss: 0.8180, test_loss: 0.9587, test_f1: 0.5049
 epoch: 31, train_loss: 0.8169, test_loss: 1.1058, test_f1: 0.4767
 epoch: 32, train_loss: 0.8172, test_loss: 0.9125, test_f1: 0.5210
 epoch: 33, train_loss: 0.8164, test_loss: 1.0307, test_f1: 0.4899
 epoch: 34, train_loss: 0.8181, test_loss: 0.9058, test_f1: 0.5316
 epoch: 35, train_loss: 0.8203, test_loss: 0.8581, test_f1: 0.5495
 epoch: 36, train_loss: 0.8037, test_loss: 0.8616, test_f1: 0.5444
 epoch: 37, train_loss: 0.8174, test_loss: 0.9104, test_f1: 0.5269
 epoch: 38, train_loss: 0.8145, test_loss: 0.8554, test_f1: 0.5563
 epoch: 39, train_loss: 0.7998, test_loss: 0.8771, test_f1: 0.5492
 epoch: 40, train_loss: 0.7903, test_loss: 0.8372, test_f1: 0.5719
 epoch: 41, train_loss: 0.7876, test_loss: 1.0826, test_f1: 0.4775
 epoch: 42, train_loss: 0.8045, test_loss: 0.9311, test_f1: 0.5230
 epoch: 43, train_loss: 0.8031, test_loss: 0.8696, test_f1: 0.5426
 epoch: 44, train_loss: 0.8090, test_loss: 0.9132, test_f1: 0.5492
 epoch: 45, train_loss: 0.7921, test_loss: 0.8448, test_f1: 0.5540
 epoch: 46, train_loss: 0.7909, test_loss: 0.8568, test_f1: 0.5442
 epoch: 47, train_loss: 0.7768, test_loss: 0.8353, test_f1: 0.5515
 epoch: 48, train_loss: 0.7704, test_loss: 1.1308, test_f1: 0.4688
 epoch: 49, train_loss: 0.7810, test_loss: 0.8977, test_f1: 0.5492
 epoch: 50, train_loss: 0.7955, test_loss: 0.9024, test_f1: 0.5155
 epoch: 51, train_loss: 0.7791, test_loss: 0.9113, test_f1: 0.5449
 epoch: 52, train_loss: 0.7464, test_loss: 0.8914, test_f1: 0.5415
 epoch: 53, train_loss: 0.7529, test_loss: 0.8855, test_f1: 0.5489
 epoch: 54, train_loss: 0.7373, test_loss: 0.8866, test_f1: 0.5446
 epoch: 55, train_loss: 0.7493, test_loss: 0.8529, test_f1: 0.5559
 epoch: 56, train_loss: 0.7432, test_loss: 0.9694, test_f1: 0.5147
 epoch: 57, train_loss: 0.7364, test_loss: 0.8847, test_f1: 0.5563
 epoch: 58, train_loss: 0.7313, test_loss: 0.9205, test_f1: 0.5427
 epoch: 59, train_loss: 0.7379, test_loss: 0.8927, test_f1: 0.5525
 epoch: 60, train_loss: 0.7455, test_loss: 0.9038, test_f1: 0.5470
 epoch: 61, train_loss: 0.7394, test_loss: 0.8961, test_f1: 0.5541
 epoch: 62, train_loss: 0.7330, test_loss: 0.8511, test_f1: 0.5607
 epoch: 63, train_loss: 0.7347, test_loss: 0.9133, test_f1: 0.5400
 epoch: 64, train_loss: 0.7338, test_loss: 0.9360, test_f1: 0.5468
 epoch: 65, train_loss: 0.7228, test_loss: 0.8817, test_f1: 0.5597
 epoch: 66, train_loss: 0.7170, test_loss: 0.8883, test_f1: 0.5759
 epoch: 67, train_loss: 0.7157, test_loss: 0.8730, test_f1: 0.5817
 epoch: 68, train_loss: 0.7102, test_loss: 0.9112, test_f1: 0.5458
 epoch: 69, train_loss: 0.7050, test_loss: 0.8930, test_f1: 0.5569
 epoch: 70, train_loss: 0.7281, test_loss: 0.9742, test_f1: 0.5367
 epoch: 71, train_loss: 0.7267, test_loss: 0.9350, test_f1: 0.5509
 epoch: 72, train_loss: 0.7258, test_loss: 0.8845, test_f1: 0.5627
 epoch: 73, train_loss: 0.7234, test_loss: 0.8956, test_f1: 0.5818
 epoch: 74, train_loss: 0.7224, test_loss: 0.8860, test_f1: 0.5580
 epoch: 75, train_loss: 0.7092, test_loss: 0.9227, test_f1: 0.5732
 epoch: 76, train_loss: 0.7153, test_loss: 1.0134, test_f1: 0.5202
 epoch: 77, train_loss: 0.7187, test_loss: 0.9011, test_f1: 0.5774
 epoch: 78, train_loss: 0.7298, test_loss: 0.8855, test_f1: 0.5695
 epoch: 79, train_loss: 0.7120, test_loss: 0.9560, test_f1: 0.5477
 epoch: 80, train_loss: 0.7120, test_loss: 0.9878, test_f1: 0.5227
 epoch: 81, train_loss: 0.7190, test_loss: 0.9003, test_f1: 0.5764
 epoch: 82, train_loss: 0.7053, test_loss: 0.9154, test_f1: 0.5622
 epoch: 83, train_loss: 0.7135, test_loss: 0.9997, test_f1: 0.5367
 epoch: 84, train_loss: 0.7262, test_loss: 0.8952, test_f1: 0.5762
 epoch: 85, train_loss: 0.7009, test_loss: 0.8902, test_f1: 0.6039
 epoch: 86, train_loss: 0.7047, test_loss: 0.9531, test_f1: 0.5976
 epoch: 87, train_loss: 0.7225, test_loss: 0.9344, test_f1: 0.5645
 epoch: 88, train_loss: 0.7066, test_loss: 1.0050, test_f1: 0.5496
 epoch: 89, train_loss: 0.7063, test_loss: 0.9341, test_f1: 0.5954
 epoch: 90, train_loss: 0.7055, test_loss: 1.0174, test_f1: 0.5475
 epoch: 91, train_loss: 0.7156, test_loss: 0.9725, test_f1: 0.5540
 epoch: 92, train_loss: 0.7108, test_loss: 0.9431, test_f1: 0.5850
 epoch: 93, train_loss: 0.7064, test_loss: 1.0492, test_f1: 0.5189
 epoch: 94, train_loss: 0.7132, test_loss: 0.8830, test_f1: 0.6459
 epoch: 95, train_loss: 0.6983, test_loss: 0.9447, test_f1: 0.5758
 epoch: 96, train_loss: 0.6926, test_loss: 0.9144, test_f1: 0.5969
 epoch: 97, train_loss: 0.7047, test_loss: 0.9281, test_f1: 0.5934
 epoch: 98, train_loss: 0.6950, test_loss: 1.0162, test_f1: 0.5495
 epoch: 99, train_loss: 0.7019, test_loss: 0.9827, test_f1: 0.5602
##################ITERATION #4 ****************************************
 epoch: 0, train_loss: 1.1856, test_loss: 1.3443, test_f1: 0.2286
 epoch: 1, train_loss: 1.0409, test_loss: 1.0901, test_f1: 0.4039
 epoch: 2, train_loss: 1.0087, test_loss: 1.1140, test_f1: 0.3979
 epoch: 3, train_loss: 1.0034, test_loss: 1.0417, test_f1: 0.4888
 epoch: 4, train_loss: 1.0024, test_loss: 1.0315, test_f1: 0.4597
 epoch: 5, train_loss: 0.9487, test_loss: 1.1430, test_f1: 0.4610
 epoch: 6, train_loss: 0.9452, test_loss: 1.0387, test_f1: 0.4961
 epoch: 7, train_loss: 0.9212, test_loss: 1.0036, test_f1: 0.5267
 epoch: 8, train_loss: 0.9112, test_loss: 0.9440, test_f1: 0.4964
 epoch: 9, train_loss: 0.9054, test_loss: 1.4470, test_f1: 0.3400
 epoch: 10, train_loss: 0.9245, test_loss: 1.0402, test_f1: 0.4566
 epoch: 11, train_loss: 0.8842, test_loss: 0.9820, test_f1: 0.5053
 epoch: 12, train_loss: 0.9032, test_loss: 1.0239, test_f1: 0.4678
 epoch: 13, train_loss: 0.8790, test_loss: 0.9775, test_f1: 0.4845
 epoch: 14, train_loss: 0.8850, test_loss: 0.9741, test_f1: 0.4866
 epoch: 15, train_loss: 0.8657, test_loss: 0.9771, test_f1: 0.5048
 epoch: 16, train_loss: 0.8731, test_loss: 1.0521, test_f1: 0.4580
 epoch: 17, train_loss: 0.8644, test_loss: 0.9355, test_f1: 0.5146
 epoch: 18, train_loss: 0.8531, test_loss: 0.8748, test_f1: 0.5380
 epoch: 19, train_loss: 0.8624, test_loss: 1.0850, test_f1: 0.4408
 epoch: 20, train_loss: 0.8374, test_loss: 1.0213, test_f1: 0.5021
 epoch: 21, train_loss: 0.8454, test_loss: 0.8980, test_f1: 0.5065
 epoch: 22, train_loss: 0.8438, test_loss: 0.9450, test_f1: 0.5323
 epoch: 23, train_loss: 0.8303, test_loss: 0.8969, test_f1: 0.5319
 epoch: 24, train_loss: 0.8091, test_loss: 0.8835, test_f1: 0.5574
 epoch: 25, train_loss: 0.8127, test_loss: 0.9632, test_f1: 0.4904
 epoch: 26, train_loss: 0.8174, test_loss: 0.8746, test_f1: 0.5182
 epoch: 27, train_loss: 0.8165, test_loss: 1.0208, test_f1: 0.4930
 epoch: 28, train_loss: 0.8316, test_loss: 0.9256, test_f1: 0.5141
 epoch: 29, train_loss: 0.8231, test_loss: 0.9581, test_f1: 0.5184
 epoch: 30, train_loss: 0.8022, test_loss: 0.9315, test_f1: 0.5274
 epoch: 31, train_loss: 0.8112, test_loss: 0.9514, test_f1: 0.5289
 epoch: 32, train_loss: 0.7987, test_loss: 1.0430, test_f1: 0.4961
 epoch: 33, train_loss: 0.7805, test_loss: 0.8886, test_f1: 0.5563
 epoch: 34, train_loss: 0.7779, test_loss: 0.8855, test_f1: 0.5686
 epoch: 35, train_loss: 0.7947, test_loss: 0.9064, test_f1: 0.5708
 epoch: 36, train_loss: 0.7848, test_loss: 1.0919, test_f1: 0.4938
 epoch: 37, train_loss: 0.7802, test_loss: 0.8835, test_f1: 0.5434
 epoch: 38, train_loss: 0.7835, test_loss: 0.8594, test_f1: 0.5351
 epoch: 39, train_loss: 0.7928, test_loss: 0.8620, test_f1: 0.5367
 epoch: 40, train_loss: 0.7603, test_loss: 0.8830, test_f1: 0.5911
 epoch: 41, train_loss: 0.7762, test_loss: 0.9579, test_f1: 0.5427
 epoch: 42, train_loss: 0.7672, test_loss: 0.8968, test_f1: 0.5488
 epoch: 43, train_loss: 0.7612, test_loss: 0.8611, test_f1: 0.5859
 epoch: 44, train_loss: 0.7700, test_loss: 0.9237, test_f1: 0.5257
 epoch: 45, train_loss: 0.7646, test_loss: 0.8865, test_f1: 0.5414
 epoch: 46, train_loss: 0.7569, test_loss: 0.8651, test_f1: 0.5640
 epoch: 47, train_loss: 0.7579, test_loss: 0.8618, test_f1: 0.5705
 epoch: 48, train_loss: 0.7699, test_loss: 0.9251, test_f1: 0.5407
 epoch: 49, train_loss: 0.7457, test_loss: 0.9542, test_f1: 0.5384
 epoch: 50, train_loss: 0.7750, test_loss: 0.9136, test_f1: 0.5555
 epoch: 51, train_loss: 0.7299, test_loss: 0.8924, test_f1: 0.5362
 epoch: 52, train_loss: 0.7237, test_loss: 0.8688, test_f1: 0.5651
 epoch: 53, train_loss: 0.7255, test_loss: 0.9157, test_f1: 0.5482
 epoch: 54, train_loss: 0.7048, test_loss: 0.8982, test_f1: 0.5475
 epoch: 55, train_loss: 0.7071, test_loss: 0.8908, test_f1: 0.5467
 epoch: 56, train_loss: 0.7193, test_loss: 0.9625, test_f1: 0.5392
 epoch: 57, train_loss: 0.6976, test_loss: 0.8581, test_f1: 0.5779
 epoch: 58, train_loss: 0.7086, test_loss: 0.8678, test_f1: 0.5722
 epoch: 59, train_loss: 0.7154, test_loss: 0.8490, test_f1: 0.5557
 epoch: 60, train_loss: 0.6999, test_loss: 0.8666, test_f1: 0.5674
 epoch: 61, train_loss: 0.7075, test_loss: 0.8591, test_f1: 0.5629
 epoch: 62, train_loss: 0.7016, test_loss: 0.8794, test_f1: 0.5786
 epoch: 63, train_loss: 0.7038, test_loss: 0.8504, test_f1: 0.5591
 epoch: 64, train_loss: 0.6952, test_loss: 0.9105, test_f1: 0.5712
 epoch: 65, train_loss: 0.6896, test_loss: 0.9526, test_f1: 0.5354
 epoch: 66, train_loss: 0.6909, test_loss: 0.8729, test_f1: 0.5574
 epoch: 67, train_loss: 0.6991, test_loss: 0.9796, test_f1: 0.5280
 epoch: 68, train_loss: 0.6962, test_loss: 0.8869, test_f1: 0.5643
 epoch: 69, train_loss: 0.6835, test_loss: 0.8913, test_f1: 0.5525
 epoch: 70, train_loss: 0.6902, test_loss: 0.9840, test_f1: 0.5485
 epoch: 71, train_loss: 0.6930, test_loss: 0.8788, test_f1: 0.5482
 epoch: 72, train_loss: 0.6946, test_loss: 0.8842, test_f1: 0.5655
 epoch: 73, train_loss: 0.6881, test_loss: 1.0757, test_f1: 0.5228
 epoch: 74, train_loss: 0.6974, test_loss: 0.9127, test_f1: 0.5623
 epoch: 75, train_loss: 0.6830, test_loss: 0.8713, test_f1: 0.5597
 epoch: 76, train_loss: 0.6846, test_loss: 0.9994, test_f1: 0.5364
 epoch: 77, train_loss: 0.6817, test_loss: 0.9177, test_f1: 0.5758
 epoch: 78, train_loss: 0.6894, test_loss: 0.9079, test_f1: 0.5542
 epoch: 79, train_loss: 0.6858, test_loss: 0.9203, test_f1: 0.5493
 epoch: 80, train_loss: 0.6878, test_loss: 0.8659, test_f1: 0.5885
 epoch: 81, train_loss: 0.6791, test_loss: 0.9094, test_f1: 0.5539
 epoch: 82, train_loss: 0.6808, test_loss: 0.8966, test_f1: 0.5558
 epoch: 83, train_loss: 0.6715, test_loss: 0.9097, test_f1: 0.5714
 epoch: 84, train_loss: 0.6986, test_loss: 0.9013, test_f1: 0.5591
 epoch: 85, train_loss: 0.6867, test_loss: 0.9501, test_f1: 0.5386
 epoch: 86, train_loss: 0.6851, test_loss: 0.9502, test_f1: 0.5478
 epoch: 87, train_loss: 0.6778, test_loss: 0.9158, test_f1: 0.5961
 epoch: 88, train_loss: 0.6751, test_loss: 1.0082, test_f1: 0.5153
 epoch: 89, train_loss: 0.6853, test_loss: 0.9399, test_f1: 0.5976
 epoch: 90, train_loss: 0.6691, test_loss: 0.8997, test_f1: 0.5651
 epoch: 91, train_loss: 0.6854, test_loss: 0.9854, test_f1: 0.5305
 epoch: 92, train_loss: 0.6714, test_loss: 0.9578, test_f1: 0.5639
 epoch: 93, train_loss: 0.6717, test_loss: 0.9669, test_f1: 0.5474
 epoch: 94, train_loss: 0.6983, test_loss: 0.9003, test_f1: 0.5302
 epoch: 95, train_loss: 0.6833, test_loss: 0.8708, test_f1: 0.6163
 epoch: 96, train_loss: 0.6698, test_loss: 0.9208, test_f1: 0.5623
 epoch: 97, train_loss: 0.6723, test_loss: 0.9564, test_f1: 0.5289
 epoch: 98, train_loss: 0.6754, test_loss: 0.9085, test_f1: 0.5641
 epoch: 99, train_loss: 0.6698, test_loss: 0.9094, test_f1: 0.5750
##################ITERATION #5 ****************************************
 epoch: 0, train_loss: 1.1665, test_loss: 1.1678, test_f1: 0.3226
 epoch: 1, train_loss: 1.0313, test_loss: 1.0824, test_f1: 0.4300
 epoch: 2, train_loss: 1.0030, test_loss: 0.9893, test_f1: 0.4519
 epoch: 3, train_loss: 0.9687, test_loss: 0.9868, test_f1: 0.4887
 epoch: 4, train_loss: 0.9756, test_loss: 1.0389, test_f1: 0.4503
 epoch: 5, train_loss: 0.9573, test_loss: 0.9812, test_f1: 0.4930
 epoch: 6, train_loss: 0.9417, test_loss: 1.0553, test_f1: 0.4490
 epoch: 7, train_loss: 0.9205, test_loss: 1.0025, test_f1: 0.4422
 epoch: 8, train_loss: 0.8985, test_loss: 0.9385, test_f1: 0.4640
 epoch: 9, train_loss: 0.9048, test_loss: 0.9230, test_f1: 0.5544
 epoch: 10, train_loss: 0.8850, test_loss: 0.9227, test_f1: 0.5301
 epoch: 11, train_loss: 0.8778, test_loss: 1.0520, test_f1: 0.4467
 epoch: 12, train_loss: 0.8734, test_loss: 0.9654, test_f1: 0.4853
 epoch: 13, train_loss: 0.8589, test_loss: 0.9733, test_f1: 0.4726
 epoch: 14, train_loss: 0.8376, test_loss: 0.9455, test_f1: 0.5112
 epoch: 15, train_loss: 0.8430, test_loss: 0.9207, test_f1: 0.5551
 epoch: 16, train_loss: 0.8490, test_loss: 0.9464, test_f1: 0.5105
 epoch: 17, train_loss: 0.8422, test_loss: 0.9194, test_f1: 0.5576
 epoch: 18, train_loss: 0.8386, test_loss: 0.9382, test_f1: 0.5097
 epoch: 19, train_loss: 0.8319, test_loss: 0.9873, test_f1: 0.5181
 epoch: 20, train_loss: 0.8341, test_loss: 0.9922, test_f1: 0.5021
 epoch: 21, train_loss: 0.8195, test_loss: 1.0550, test_f1: 0.4953
 epoch: 22, train_loss: 0.8310, test_loss: 0.9666, test_f1: 0.5135
 epoch: 23, train_loss: 0.8207, test_loss: 1.0154, test_f1: 0.4653
 epoch: 24, train_loss: 0.8111, test_loss: 0.9573, test_f1: 0.5111
 epoch: 25, train_loss: 0.7893, test_loss: 0.9045, test_f1: 0.5409
 epoch: 26, train_loss: 0.8169, test_loss: 0.9675, test_f1: 0.5188
 epoch: 27, train_loss: 0.8206, test_loss: 0.9099, test_f1: 0.5190
 epoch: 28, train_loss: 0.8094, test_loss: 0.9038, test_f1: 0.5017
 epoch: 29, train_loss: 0.8007, test_loss: 0.9023, test_f1: 0.5511
 epoch: 30, train_loss: 0.7822, test_loss: 1.0424, test_f1: 0.5040
 epoch: 31, train_loss: 0.7935, test_loss: 1.0920, test_f1: 0.4926
 epoch: 32, train_loss: 0.7741, test_loss: 0.9540, test_f1: 0.5317
 epoch: 33, train_loss: 0.7799, test_loss: 0.9073, test_f1: 0.5487
 epoch: 34, train_loss: 0.7714, test_loss: 0.9612, test_f1: 0.5292
 epoch: 35, train_loss: 0.7694, test_loss: 0.8785, test_f1: 0.5201
 epoch: 36, train_loss: 0.7837, test_loss: 1.0478, test_f1: 0.4964
 epoch: 37, train_loss: 0.7627, test_loss: 0.9293, test_f1: 0.5759
 epoch: 38, train_loss: 0.7626, test_loss: 0.9020, test_f1: 0.5411
 epoch: 39, train_loss: 0.7817, test_loss: 1.0315, test_f1: 0.5546
 epoch: 40, train_loss: 0.7684, test_loss: 0.9095, test_f1: 0.5501
 epoch: 41, train_loss: 0.7745, test_loss: 0.9107, test_f1: 0.5274
 epoch: 42, train_loss: 0.7653, test_loss: 0.9415, test_f1: 0.5873
 epoch: 43, train_loss: 0.7573, test_loss: 0.8856, test_f1: 0.5356
 epoch: 44, train_loss: 0.7403, test_loss: 1.0657, test_f1: 0.5083
 epoch: 45, train_loss: 0.7548, test_loss: 0.8631, test_f1: 0.5459
 epoch: 46, train_loss: 0.7553, test_loss: 1.0629, test_f1: 0.4873
 epoch: 47, train_loss: 0.7477, test_loss: 0.9519, test_f1: 0.5276
 epoch: 48, train_loss: 0.7519, test_loss: 1.1286, test_f1: 0.4790
 epoch: 49, train_loss: 0.7672, test_loss: 0.9368, test_f1: 0.6019
 epoch: 50, train_loss: 0.7517, test_loss: 0.9569, test_f1: 0.5675
 epoch: 51, train_loss: 0.7226, test_loss: 0.9442, test_f1: 0.5359
 epoch: 52, train_loss: 0.7121, test_loss: 0.9367, test_f1: 0.5763
 epoch: 53, train_loss: 0.7107, test_loss: 0.9566, test_f1: 0.6092
 epoch: 54, train_loss: 0.7142, test_loss: 0.9912, test_f1: 0.5793
 epoch: 55, train_loss: 0.7252, test_loss: 0.9025, test_f1: 0.6101
 epoch: 56, train_loss: 0.7110, test_loss: 0.9706, test_f1: 0.5836
 epoch: 57, train_loss: 0.7006, test_loss: 0.9247, test_f1: 0.5879
 epoch: 58, train_loss: 0.7129, test_loss: 0.9800, test_f1: 0.5680
 epoch: 59, train_loss: 0.6979, test_loss: 0.9625, test_f1: 0.5801
 epoch: 60, train_loss: 0.6887, test_loss: 0.9470, test_f1: 0.5628
 epoch: 61, train_loss: 0.6952, test_loss: 0.9543, test_f1: 0.5952
 epoch: 62, train_loss: 0.6916, test_loss: 1.0374, test_f1: 0.5393
 epoch: 63, train_loss: 0.6947, test_loss: 1.0357, test_f1: 0.5546
 epoch: 64, train_loss: 0.6957, test_loss: 0.9948, test_f1: 0.5591
 epoch: 65, train_loss: 0.6950, test_loss: 1.0174, test_f1: 0.5685
 epoch: 66, train_loss: 0.7022, test_loss: 0.9234, test_f1: 0.6194
 epoch: 67, train_loss: 0.6857, test_loss: 0.9304, test_f1: 0.5895
 epoch: 68, train_loss: 0.6781, test_loss: 0.9650, test_f1: 0.6103
 epoch: 69, train_loss: 0.6874, test_loss: 0.9806, test_f1: 0.5729
 epoch: 70, train_loss: 0.6872, test_loss: 0.9381, test_f1: 0.6064
 epoch: 71, train_loss: 0.6889, test_loss: 0.9359, test_f1: 0.6133
 epoch: 72, train_loss: 0.7001, test_loss: 0.9116, test_f1: 0.6213
 epoch: 73, train_loss: 0.6972, test_loss: 0.9846, test_f1: 0.6120
 epoch: 74, train_loss: 0.6864, test_loss: 1.0204, test_f1: 0.6017
 epoch: 75, train_loss: 0.6790, test_loss: 1.0792, test_f1: 0.5924
 epoch: 76, train_loss: 0.6770, test_loss: 0.9913, test_f1: 0.6085
 epoch: 77, train_loss: 0.6885, test_loss: 0.9329, test_f1: 0.6192
 epoch: 78, train_loss: 0.6848, test_loss: 1.0964, test_f1: 0.5101
 epoch: 79, train_loss: 0.6744, test_loss: 1.0057, test_f1: 0.6052
 epoch: 80, train_loss: 0.7077, test_loss: 0.9589, test_f1: 0.6082
 epoch: 81, train_loss: 0.6788, test_loss: 1.0271, test_f1: 0.5889
 epoch: 82, train_loss: 0.6709, test_loss: 1.0003, test_f1: 0.5961
 epoch: 83, train_loss: 0.6791, test_loss: 0.9366, test_f1: 0.6243
 epoch: 84, train_loss: 0.6774, test_loss: 0.9637, test_f1: 0.6012
 epoch: 85, train_loss: 0.6701, test_loss: 1.0853, test_f1: 0.5802
 epoch: 86, train_loss: 0.6718, test_loss: 0.9961, test_f1: 0.5827
 epoch: 87, train_loss: 0.6711, test_loss: 0.9632, test_f1: 0.6074
 epoch: 88, train_loss: 0.6571, test_loss: 1.0087, test_f1: 0.5971
 epoch: 89, train_loss: 0.6680, test_loss: 0.9979, test_f1: 0.6145
 epoch: 90, train_loss: 0.6653, test_loss: 1.0341, test_f1: 0.6021
 epoch: 91, train_loss: 0.6687, test_loss: 1.0083, test_f1: 0.6053
 epoch: 92, train_loss: 0.6655, test_loss: 0.9928, test_f1: 0.5919
 epoch: 93, train_loss: 0.6680, test_loss: 0.9967, test_f1: 0.5941
 epoch: 94, train_loss: 0.6656, test_loss: 0.9786, test_f1: 0.5986
 epoch: 95, train_loss: 0.6498, test_loss: 0.9691, test_f1: 0.6273
 epoch: 96, train_loss: 0.6759, test_loss: 1.1559, test_f1: 0.5528
 epoch: 97, train_loss: 0.6657, test_loss: 0.9530, test_f1: 0.5850
 epoch: 98, train_loss: 0.6600, test_loss: 1.0286, test_f1: 0.5935
 epoch: 99, train_loss: 0.6617, test_loss: 0.9805, test_f1: 0.6220
##################ITERATION #6 ****************************************
 epoch: 0, train_loss: 1.1779, test_loss: 1.1660, test_f1: 0.2988
 epoch: 1, train_loss: 1.0649, test_loss: 1.1220, test_f1: 0.3676
 epoch: 2, train_loss: 1.0432, test_loss: 1.0868, test_f1: 0.4799
 epoch: 3, train_loss: 1.0206, test_loss: 1.1848, test_f1: 0.3721
 epoch: 4, train_loss: 0.9860, test_loss: 1.0427, test_f1: 0.4970
 epoch: 5, train_loss: 0.9635, test_loss: 1.1430, test_f1: 0.4067
 epoch: 6, train_loss: 0.9440, test_loss: 1.0526, test_f1: 0.4381
 epoch: 7, train_loss: 0.9420, test_loss: 1.0117, test_f1: 0.5009
 epoch: 8, train_loss: 0.9080, test_loss: 1.0152, test_f1: 0.4920
 epoch: 9, train_loss: 0.9047, test_loss: 1.0798, test_f1: 0.4738
 epoch: 10, train_loss: 0.9201, test_loss: 1.2034, test_f1: 0.3764
 epoch: 11, train_loss: 0.9283, test_loss: 0.9873, test_f1: 0.4849
 epoch: 12, train_loss: 0.8726, test_loss: 0.9776, test_f1: 0.5008
 epoch: 13, train_loss: 0.8719, test_loss: 0.9482, test_f1: 0.5116
 epoch: 14, train_loss: 0.8607, test_loss: 0.9140, test_f1: 0.5294
 epoch: 15, train_loss: 0.8380, test_loss: 1.0057, test_f1: 0.4726
 epoch: 16, train_loss: 0.8684, test_loss: 0.9372, test_f1: 0.4966
 epoch: 17, train_loss: 0.8427, test_loss: 1.0566, test_f1: 0.4437
 epoch: 18, train_loss: 0.8251, test_loss: 1.0100, test_f1: 0.5008
 epoch: 19, train_loss: 0.8385, test_loss: 0.8885, test_f1: 0.5364
 epoch: 20, train_loss: 0.8402, test_loss: 1.1922, test_f1: 0.4391
 epoch: 21, train_loss: 0.8166, test_loss: 1.0282, test_f1: 0.5240
 epoch: 22, train_loss: 0.8198, test_loss: 1.0596, test_f1: 0.4955
 epoch: 23, train_loss: 0.8391, test_loss: 1.1217, test_f1: 0.3994
 epoch: 24, train_loss: 0.8376, test_loss: 0.9710, test_f1: 0.5063
 epoch: 25, train_loss: 0.7970, test_loss: 0.9549, test_f1: 0.5027
 epoch: 26, train_loss: 0.7862, test_loss: 1.1404, test_f1: 0.4648
 epoch: 27, train_loss: 0.8105, test_loss: 1.0162, test_f1: 0.5476
 epoch: 28, train_loss: 0.8026, test_loss: 0.9101, test_f1: 0.5723
 epoch: 29, train_loss: 0.7958, test_loss: 0.9890, test_f1: 0.5213
 epoch: 30, train_loss: 0.7942, test_loss: 0.9079, test_f1: 0.5530
 epoch: 31, train_loss: 0.7858, test_loss: 1.0823, test_f1: 0.4954
 epoch: 32, train_loss: 0.7886, test_loss: 0.9410, test_f1: 0.5348
 epoch: 33, train_loss: 0.7747, test_loss: 0.7937, test_f1: 0.5769
 epoch: 34, train_loss: 0.7727, test_loss: 1.0087, test_f1: 0.5118
 epoch: 35, train_loss: 0.7786, test_loss: 0.9159, test_f1: 0.5398
 epoch: 36, train_loss: 0.7842, test_loss: 0.9022, test_f1: 0.5243
 epoch: 37, train_loss: 0.7776, test_loss: 0.7725, test_f1: 0.5663
 epoch: 38, train_loss: 0.7597, test_loss: 0.9000, test_f1: 0.5681
 epoch: 39, train_loss: 0.7412, test_loss: 0.9501, test_f1: 0.5517
 epoch: 40, train_loss: 0.7519, test_loss: 0.9414, test_f1: 0.5839
 epoch: 41, train_loss: 0.7512, test_loss: 0.8286, test_f1: 0.5807
 epoch: 42, train_loss: 0.7626, test_loss: 0.7998, test_f1: 0.5535
 epoch: 43, train_loss: 0.7543, test_loss: 0.9373, test_f1: 0.5217
 epoch: 44, train_loss: 0.7425, test_loss: 0.9604, test_f1: 0.5275
 epoch: 45, train_loss: 0.7348, test_loss: 0.7833, test_f1: 0.5859
 epoch: 46, train_loss: 0.7532, test_loss: 0.9139, test_f1: 0.5615
 epoch: 47, train_loss: 0.7402, test_loss: 0.9984, test_f1: 0.4985
 epoch: 48, train_loss: 0.7451, test_loss: 0.9109, test_f1: 0.6092
 epoch: 49, train_loss: 0.7398, test_loss: 0.8638, test_f1: 0.5659
 epoch: 50, train_loss: 0.7285, test_loss: 0.7881, test_f1: 0.6063
 epoch: 51, train_loss: 0.7023, test_loss: 0.8953, test_f1: 0.5631
 epoch: 52, train_loss: 0.7025, test_loss: 0.9057, test_f1: 0.5683
 epoch: 53, train_loss: 0.6874, test_loss: 0.8475, test_f1: 0.5660
 epoch: 54, train_loss: 0.6974, test_loss: 0.7743, test_f1: 0.5798
 epoch: 55, train_loss: 0.6871, test_loss: 0.8657, test_f1: 0.5816
 epoch: 56, train_loss: 0.6802, test_loss: 0.8199, test_f1: 0.5801
 epoch: 57, train_loss: 0.6795, test_loss: 0.8181, test_f1: 0.5732
 epoch: 58, train_loss: 0.6961, test_loss: 0.8817, test_f1: 0.5749
 epoch: 59, train_loss: 0.6958, test_loss: 0.7802, test_f1: 0.6166
 epoch: 60, train_loss: 0.6807, test_loss: 0.7778, test_f1: 0.5972
 epoch: 61, train_loss: 0.6748, test_loss: 0.7874, test_f1: 0.5918
 epoch: 62, train_loss: 0.6821, test_loss: 0.8543, test_f1: 0.5991
 epoch: 63, train_loss: 0.6817, test_loss: 0.8108, test_f1: 0.5740
 epoch: 64, train_loss: 0.6753, test_loss: 0.8239, test_f1: 0.5863
 epoch: 65, train_loss: 0.6745, test_loss: 0.8813, test_f1: 0.5716
 epoch: 66, train_loss: 0.6766, test_loss: 0.9067, test_f1: 0.5863
 epoch: 67, train_loss: 0.6798, test_loss: 0.9170, test_f1: 0.5517
 epoch: 68, train_loss: 0.6823, test_loss: 0.8639, test_f1: 0.5943
 epoch: 69, train_loss: 0.6761, test_loss: 0.8644, test_f1: 0.5905
 epoch: 70, train_loss: 0.6720, test_loss: 0.7802, test_f1: 0.6095
 epoch: 71, train_loss: 0.6934, test_loss: 0.9854, test_f1: 0.5416
 epoch: 72, train_loss: 0.6863, test_loss: 0.8918, test_f1: 0.5709
 epoch: 73, train_loss: 0.6713, test_loss: 0.8340, test_f1: 0.5828
 epoch: 74, train_loss: 0.6663, test_loss: 0.9151, test_f1: 0.6013
 epoch: 75, train_loss: 0.6543, test_loss: 0.9300, test_f1: 0.5750
 epoch: 76, train_loss: 0.6591, test_loss: 0.8701, test_f1: 0.5881
 epoch: 77, train_loss: 0.6713, test_loss: 0.9527, test_f1: 0.5846
 epoch: 78, train_loss: 0.6577, test_loss: 0.8737, test_f1: 0.5882
 epoch: 79, train_loss: 0.6601, test_loss: 0.9619, test_f1: 0.5773
 epoch: 80, train_loss: 0.6623, test_loss: 0.9082, test_f1: 0.5746
 epoch: 81, train_loss: 0.6519, test_loss: 0.8800, test_f1: 0.5788
 epoch: 82, train_loss: 0.6463, test_loss: 0.9663, test_f1: 0.5780
 epoch: 83, train_loss: 0.6482, test_loss: 0.9452, test_f1: 0.5829
 epoch: 84, train_loss: 0.6604, test_loss: 0.9104, test_f1: 0.5840
 epoch: 85, train_loss: 0.6568, test_loss: 0.9194, test_f1: 0.5800
 epoch: 86, train_loss: 0.6625, test_loss: 0.9638, test_f1: 0.5537
 epoch: 87, train_loss: 0.6558, test_loss: 0.8102, test_f1: 0.6078
 epoch: 88, train_loss: 0.6416, test_loss: 0.8744, test_f1: 0.5752
 epoch: 89, train_loss: 0.6432, test_loss: 0.9307, test_f1: 0.5684
 epoch: 90, train_loss: 0.6374, test_loss: 0.9203, test_f1: 0.5682
 epoch: 91, train_loss: 0.6532, test_loss: 0.9199, test_f1: 0.6015
 epoch: 92, train_loss: 0.6488, test_loss: 0.8025, test_f1: 0.6014
 epoch: 93, train_loss: 0.6529, test_loss: 0.9670, test_f1: 0.6153
 epoch: 94, train_loss: 0.6699, test_loss: 0.9041, test_f1: 0.5889
 epoch: 95, train_loss: 0.6365, test_loss: 0.9095, test_f1: 0.6420
 epoch: 96, train_loss: 0.6407, test_loss: 0.9594, test_f1: 0.5609
 epoch: 97, train_loss: 0.6575, test_loss: 0.9359, test_f1: 0.6240
 epoch: 98, train_loss: 0.6535, test_loss: 0.9089, test_f1: 0.5958
 epoch: 99, train_loss: 0.6540, test_loss: 0.9441, test_f1: 0.5862
##################ITERATION #7 ****************************************
 epoch: 0, train_loss: 1.1412, test_loss: 1.1056, test_f1: 0.3803
 epoch: 1, train_loss: 1.0255, test_loss: 1.0830, test_f1: 0.5133
 epoch: 2, train_loss: 0.9999, test_loss: 1.0974, test_f1: 0.4654
 epoch: 3, train_loss: 1.0008, test_loss: 1.0241, test_f1: 0.4764
 epoch: 4, train_loss: 0.9617, test_loss: 1.0307, test_f1: 0.4579
 epoch: 5, train_loss: 0.9440, test_loss: 1.0289, test_f1: 0.4982
 epoch: 6, train_loss: 0.9373, test_loss: 1.0684, test_f1: 0.4443
 epoch: 7, train_loss: 0.9264, test_loss: 1.0641, test_f1: 0.4389
 epoch: 8, train_loss: 0.9079, test_loss: 1.0441, test_f1: 0.4783
 epoch: 9, train_loss: 0.9078, test_loss: 1.2590, test_f1: 0.4057
 epoch: 10, train_loss: 0.8918, test_loss: 0.9558, test_f1: 0.5343
 epoch: 11, train_loss: 0.8952, test_loss: 1.0231, test_f1: 0.4708
 epoch: 12, train_loss: 0.8696, test_loss: 0.9883, test_f1: 0.5056
 epoch: 13, train_loss: 0.8708, test_loss: 0.9821, test_f1: 0.5145
 epoch: 14, train_loss: 0.8689, test_loss: 0.9668, test_f1: 0.4933
 epoch: 15, train_loss: 0.8514, test_loss: 0.9381, test_f1: 0.5319
 epoch: 16, train_loss: 0.8511, test_loss: 0.9874, test_f1: 0.5122
 epoch: 17, train_loss: 0.8551, test_loss: 0.9668, test_f1: 0.5006
 epoch: 18, train_loss: 0.8478, test_loss: 0.9667, test_f1: 0.5265
 epoch: 19, train_loss: 0.8335, test_loss: 1.0290, test_f1: 0.4859
 epoch: 20, train_loss: 0.8709, test_loss: 1.1103, test_f1: 0.4261
 epoch: 21, train_loss: 0.8495, test_loss: 0.9767, test_f1: 0.5005
 epoch: 22, train_loss: 0.8383, test_loss: 1.0195, test_f1: 0.4888
 epoch: 23, train_loss: 0.8357, test_loss: 0.9525, test_f1: 0.5061
 epoch: 24, train_loss: 0.8243, test_loss: 0.9303, test_f1: 0.5894
 epoch: 25, train_loss: 0.8195, test_loss: 1.1815, test_f1: 0.4424
 epoch: 26, train_loss: 0.8128, test_loss: 0.9376, test_f1: 0.5364
 epoch: 27, train_loss: 0.8024, test_loss: 0.9259, test_f1: 0.5149
 epoch: 28, train_loss: 0.8165, test_loss: 1.1439, test_f1: 0.4737
 epoch: 29, train_loss: 0.8055, test_loss: 1.1057, test_f1: 0.4740
 epoch: 30, train_loss: 0.8312, test_loss: 1.0623, test_f1: 0.4642
 epoch: 31, train_loss: 0.8076, test_loss: 0.9305, test_f1: 0.5553
 epoch: 32, train_loss: 0.7932, test_loss: 0.9039, test_f1: 0.5669
 epoch: 33, train_loss: 0.7901, test_loss: 0.9465, test_f1: 0.5566
 epoch: 34, train_loss: 0.7712, test_loss: 0.9981, test_f1: 0.5572
 epoch: 35, train_loss: 0.7727, test_loss: 0.9135, test_f1: 0.5389
 epoch: 36, train_loss: 0.7794, test_loss: 0.9669, test_f1: 0.5190
 epoch: 37, train_loss: 0.7914, test_loss: 0.9609, test_f1: 0.5452
 epoch: 38, train_loss: 0.7791, test_loss: 1.0271, test_f1: 0.5104
 epoch: 39, train_loss: 0.7737, test_loss: 0.9940, test_f1: 0.5241
 epoch: 40, train_loss: 0.7762, test_loss: 0.9470, test_f1: 0.5527
 epoch: 41, train_loss: 0.7709, test_loss: 1.1610, test_f1: 0.4884
 epoch: 42, train_loss: 0.7685, test_loss: 0.9513, test_f1: 0.5407
 epoch: 43, train_loss: 0.7656, test_loss: 1.0188, test_f1: 0.5163
 epoch: 44, train_loss: 0.7583, test_loss: 1.0028, test_f1: 0.5008
 epoch: 45, train_loss: 0.7675, test_loss: 0.9063, test_f1: 0.5658
 epoch: 46, train_loss: 0.7674, test_loss: 0.9345, test_f1: 0.5420
 epoch: 47, train_loss: 0.7766, test_loss: 0.9003, test_f1: 0.5391
 epoch: 48, train_loss: 0.7490, test_loss: 0.9495, test_f1: 0.5643
 epoch: 49, train_loss: 0.7513, test_loss: 0.9479, test_f1: 0.5546
 epoch: 50, train_loss: 0.7552, test_loss: 0.9417, test_f1: 0.6142
 epoch: 51, train_loss: 0.7311, test_loss: 0.9576, test_f1: 0.5334
 epoch: 52, train_loss: 0.7367, test_loss: 0.9713, test_f1: 0.5171
 epoch: 53, train_loss: 0.7351, test_loss: 1.0353, test_f1: 0.5356
 epoch: 54, train_loss: 0.7082, test_loss: 0.9331, test_f1: 0.5454
 epoch: 55, train_loss: 0.7208, test_loss: 0.9464, test_f1: 0.5486
 epoch: 56, train_loss: 0.7170, test_loss: 0.9897, test_f1: 0.5563
 epoch: 57, train_loss: 0.7136, test_loss: 0.9578, test_f1: 0.5599
 epoch: 58, train_loss: 0.7094, test_loss: 0.9859, test_f1: 0.5582
 epoch: 59, train_loss: 0.7156, test_loss: 1.0224, test_f1: 0.5255
 epoch: 60, train_loss: 0.7121, test_loss: 0.9414, test_f1: 0.5528
 epoch: 61, train_loss: 0.7042, test_loss: 0.9456, test_f1: 0.5384
 epoch: 62, train_loss: 0.7134, test_loss: 0.9351, test_f1: 0.5747
 epoch: 63, train_loss: 0.7111, test_loss: 0.9001, test_f1: 0.5745
 epoch: 64, train_loss: 0.7102, test_loss: 0.9567, test_f1: 0.5560
 epoch: 65, train_loss: 0.7112, test_loss: 1.1494, test_f1: 0.5142
 epoch: 66, train_loss: 0.7148, test_loss: 0.9633, test_f1: 0.5697
 epoch: 67, train_loss: 0.7024, test_loss: 0.9494, test_f1: 0.5568
 epoch: 68, train_loss: 0.6827, test_loss: 1.0115, test_f1: 0.5388
 epoch: 69, train_loss: 0.7051, test_loss: 0.9747, test_f1: 0.5614
 epoch: 70, train_loss: 0.6924, test_loss: 0.9729, test_f1: 0.5558
 epoch: 71, train_loss: 0.6895, test_loss: 0.9740, test_f1: 0.5475
 epoch: 72, train_loss: 0.6786, test_loss: 1.1363, test_f1: 0.5109
 epoch: 73, train_loss: 0.6894, test_loss: 1.1899, test_f1: 0.5191
 epoch: 74, train_loss: 0.7031, test_loss: 0.9459, test_f1: 0.5555
 epoch: 75, train_loss: 0.6994, test_loss: 0.9430, test_f1: 0.5518
 epoch: 76, train_loss: 0.6970, test_loss: 0.9902, test_f1: 0.5658
 epoch: 77, train_loss: 0.6940, test_loss: 0.9476, test_f1: 0.5630
 epoch: 78, train_loss: 0.6833, test_loss: 1.0684, test_f1: 0.5407
 epoch: 79, train_loss: 0.6792, test_loss: 1.0043, test_f1: 0.5605
 epoch: 80, train_loss: 0.6758, test_loss: 1.0207, test_f1: 0.5393
 epoch: 81, train_loss: 0.6842, test_loss: 1.0098, test_f1: 0.5589
 epoch: 82, train_loss: 0.6860, test_loss: 0.9254, test_f1: 0.5816
 epoch: 83, train_loss: 0.6884, test_loss: 0.9497, test_f1: 0.5616
 epoch: 84, train_loss: 0.6870, test_loss: 1.0160, test_f1: 0.5410
 epoch: 85, train_loss: 0.6830, test_loss: 1.0283, test_f1: 0.5313
 epoch: 86, train_loss: 0.6987, test_loss: 1.0441, test_f1: 0.5475
 epoch: 87, train_loss: 0.6768, test_loss: 1.0011, test_f1: 0.5667
 epoch: 88, train_loss: 0.6768, test_loss: 1.0678, test_f1: 0.5388
 epoch: 89, train_loss: 0.6871, test_loss: 0.9737, test_f1: 0.5680
 epoch: 90, train_loss: 0.6738, test_loss: 0.9710, test_f1: 0.5640
 epoch: 91, train_loss: 0.6728, test_loss: 0.9398, test_f1: 0.5955
 epoch: 92, train_loss: 0.6580, test_loss: 0.9632, test_f1: 0.5646
 epoch: 93, train_loss: 0.6631, test_loss: 0.9582, test_f1: 0.5926
 epoch: 94, train_loss: 0.6611, test_loss: 0.9844, test_f1: 0.5616
 epoch: 95, train_loss: 0.6600, test_loss: 0.9961, test_f1: 0.5642
 epoch: 96, train_loss: 0.6553, test_loss: 1.0455, test_f1: 0.5520
 epoch: 97, train_loss: 0.6625, test_loss: 1.0207, test_f1: 0.5637
 epoch: 98, train_loss: 0.6644, test_loss: 0.9613, test_f1: 0.5662
 epoch: 99, train_loss: 0.6610, test_loss: 0.9385, test_f1: 0.5798
##################ITERATION #8 ****************************************
 epoch: 0, train_loss: 1.1581, test_loss: 1.1183, test_f1: 0.3614
 epoch: 1, train_loss: 1.0240, test_loss: 1.0648, test_f1: 0.4621
 epoch: 2, train_loss: 0.9989, test_loss: 1.0561, test_f1: 0.5011
 epoch: 3, train_loss: 0.9793, test_loss: 1.0670, test_f1: 0.4580
 epoch: 4, train_loss: 0.9655, test_loss: 1.0588, test_f1: 0.4901
 epoch: 5, train_loss: 0.9585, test_loss: 1.1393, test_f1: 0.4360
 epoch: 6, train_loss: 0.9501, test_loss: 1.0586, test_f1: 0.4754
 epoch: 7, train_loss: 0.9643, test_loss: 1.0437, test_f1: 0.4836
 epoch: 8, train_loss: 0.9487, test_loss: 1.0457, test_f1: 0.4912
 epoch: 9, train_loss: 0.9305, test_loss: 1.0166, test_f1: 0.4997
 epoch: 10, train_loss: 0.9241, test_loss: 1.0511, test_f1: 0.4645
 epoch: 11, train_loss: 0.9068, test_loss: 1.0399, test_f1: 0.4769
 epoch: 12, train_loss: 0.8954, test_loss: 0.9583, test_f1: 0.5174
 epoch: 13, train_loss: 0.8974, test_loss: 0.9979, test_f1: 0.5108
 epoch: 14, train_loss: 0.9065, test_loss: 1.0064, test_f1: 0.5145
 epoch: 15, train_loss: 0.8927, test_loss: 0.9332, test_f1: 0.5231
 epoch: 16, train_loss: 0.8706, test_loss: 0.9865, test_f1: 0.5129
 epoch: 17, train_loss: 0.8565, test_loss: 0.9515, test_f1: 0.5411
 epoch: 18, train_loss: 0.8684, test_loss: 0.9072, test_f1: 0.5255
 epoch: 19, train_loss: 0.8507, test_loss: 0.9370, test_f1: 0.5228
 epoch: 20, train_loss: 0.8523, test_loss: 0.9474, test_f1: 0.5183
 epoch: 21, train_loss: 0.8338, test_loss: 1.0588, test_f1: 0.4404
 epoch: 22, train_loss: 0.8347, test_loss: 1.5350, test_f1: 0.3975
 epoch: 23, train_loss: 0.8322, test_loss: 1.0107, test_f1: 0.4650
 epoch: 24, train_loss: 0.8419, test_loss: 1.0236, test_f1: 0.4872
 epoch: 25, train_loss: 0.8399, test_loss: 0.9215, test_f1: 0.5171
 epoch: 26, train_loss: 0.8157, test_loss: 0.9304, test_f1: 0.5226
 epoch: 27, train_loss: 0.8063, test_loss: 0.9263, test_f1: 0.5245
 epoch: 28, train_loss: 0.8218, test_loss: 0.9385, test_f1: 0.5193
 epoch: 29, train_loss: 0.8433, test_loss: 1.0075, test_f1: 0.5489
 epoch: 30, train_loss: 0.8202, test_loss: 0.9130, test_f1: 0.5266
 epoch: 31, train_loss: 0.7959, test_loss: 0.9522, test_f1: 0.5027
 epoch: 32, train_loss: 0.7978, test_loss: 0.9195, test_f1: 0.5796
 epoch: 33, train_loss: 0.8101, test_loss: 0.8996, test_f1: 0.5898
 epoch: 34, train_loss: 0.8054, test_loss: 0.9343, test_f1: 0.5099
 epoch: 35, train_loss: 0.7876, test_loss: 0.9645, test_f1: 0.5290
 epoch: 36, train_loss: 0.8061, test_loss: 0.8944, test_f1: 0.5365
 epoch: 37, train_loss: 0.7989, test_loss: 0.9144, test_f1: 0.5368
 epoch: 38, train_loss: 0.7921, test_loss: 0.9895, test_f1: 0.5163
 epoch: 39, train_loss: 0.8017, test_loss: 0.9149, test_f1: 0.5394
 epoch: 40, train_loss: 0.7877, test_loss: 0.9399, test_f1: 0.5254
 epoch: 41, train_loss: 0.7714, test_loss: 0.9149, test_f1: 0.5302
 epoch: 42, train_loss: 0.7909, test_loss: 0.9760, test_f1: 0.4939
 epoch: 43, train_loss: 0.8140, test_loss: 0.9500, test_f1: 0.5393
 epoch: 44, train_loss: 0.7822, test_loss: 0.9071, test_f1: 0.5346
 epoch: 45, train_loss: 0.7712, test_loss: 0.9247, test_f1: 0.5365
 epoch: 46, train_loss: 0.7961, test_loss: 0.9332, test_f1: 0.5127
 epoch: 47, train_loss: 0.7789, test_loss: 0.9418, test_f1: 0.5232
 epoch: 48, train_loss: 0.7711, test_loss: 0.9476, test_f1: 0.5802
 epoch: 49, train_loss: 0.7729, test_loss: 0.9441, test_f1: 0.5321
 epoch: 50, train_loss: 0.7802, test_loss: 1.1309, test_f1: 0.4645
 epoch: 51, train_loss: 0.7481, test_loss: 0.9380, test_f1: 0.5175
 epoch: 52, train_loss: 0.7380, test_loss: 0.9749, test_f1: 0.5194
 epoch: 53, train_loss: 0.7426, test_loss: 0.9280, test_f1: 0.5334
 epoch: 54, train_loss: 0.7334, test_loss: 0.9480, test_f1: 0.5262
 epoch: 55, train_loss: 0.7399, test_loss: 1.0024, test_f1: 0.5067
 epoch: 56, train_loss: 0.7440, test_loss: 0.9200, test_f1: 0.5419
 epoch: 57, train_loss: 0.7323, test_loss: 0.9233, test_f1: 0.5453
 epoch: 58, train_loss: 0.7291, test_loss: 0.9378, test_f1: 0.5343
 epoch: 59, train_loss: 0.7295, test_loss: 0.9249, test_f1: 0.5402
 epoch: 60, train_loss: 0.7305, test_loss: 0.9485, test_f1: 0.5264
 epoch: 61, train_loss: 0.7270, test_loss: 0.9479, test_f1: 0.5410
 epoch: 62, train_loss: 0.7426, test_loss: 0.9405, test_f1: 0.5325
 epoch: 63, train_loss: 0.7280, test_loss: 0.9411, test_f1: 0.5304
 epoch: 64, train_loss: 0.7253, test_loss: 0.9227, test_f1: 0.5505
 epoch: 65, train_loss: 0.7442, test_loss: 0.9673, test_f1: 0.4999
 epoch: 66, train_loss: 0.7329, test_loss: 0.9467, test_f1: 0.5522
 epoch: 67, train_loss: 0.7254, test_loss: 0.9314, test_f1: 0.5435
 epoch: 68, train_loss: 0.7319, test_loss: 0.9625, test_f1: 0.5550
 epoch: 69, train_loss: 0.7370, test_loss: 0.9265, test_f1: 0.5980
 epoch: 70, train_loss: 0.7149, test_loss: 0.9650, test_f1: 0.5108
 epoch: 71, train_loss: 0.7178, test_loss: 0.9525, test_f1: 0.5444
 epoch: 72, train_loss: 0.7178, test_loss: 0.9406, test_f1: 0.5881
 epoch: 73, train_loss: 0.7134, test_loss: 0.9710, test_f1: 0.5333
 epoch: 74, train_loss: 0.7136, test_loss: 0.9601, test_f1: 0.5475
 epoch: 75, train_loss: 0.7146, test_loss: 0.9635, test_f1: 0.5929
 epoch: 76, train_loss: 0.7157, test_loss: 0.9538, test_f1: 0.5385
 epoch: 77, train_loss: 0.7052, test_loss: 1.0033, test_f1: 0.5325
 epoch: 78, train_loss: 0.7184, test_loss: 0.9328, test_f1: 0.5971
 epoch: 79, train_loss: 0.7248, test_loss: 0.9381, test_f1: 0.5637
 epoch: 80, train_loss: 0.7127, test_loss: 0.9627, test_f1: 0.5412
 epoch: 81, train_loss: 0.7130, test_loss: 0.9253, test_f1: 0.5832
 epoch: 82, train_loss: 0.7171, test_loss: 0.9626, test_f1: 0.5522
 epoch: 83, train_loss: 0.7069, test_loss: 0.9266, test_f1: 0.5558
 epoch: 84, train_loss: 0.7093, test_loss: 0.9727, test_f1: 0.5470
 epoch: 85, train_loss: 0.7153, test_loss: 0.9296, test_f1: 0.6005
 epoch: 86, train_loss: 0.7192, test_loss: 0.9491, test_f1: 0.5532
 epoch: 87, train_loss: 0.6967, test_loss: 0.9309, test_f1: 0.5607
 epoch: 88, train_loss: 0.6883, test_loss: 0.9939, test_f1: 0.5553
 epoch: 89, train_loss: 0.6968, test_loss: 0.9338, test_f1: 0.5618
 epoch: 90, train_loss: 0.6934, test_loss: 0.9533, test_f1: 0.5418
 epoch: 91, train_loss: 0.6985, test_loss: 0.9581, test_f1: 0.5556
 epoch: 92, train_loss: 0.6968, test_loss: 0.9559, test_f1: 0.6075
 epoch: 93, train_loss: 0.7108, test_loss: 0.9569, test_f1: 0.5428
 epoch: 94, train_loss: 0.7001, test_loss: 0.9646, test_f1: 0.5572
 epoch: 95, train_loss: 0.7065, test_loss: 0.9506, test_f1: 0.5441
 epoch: 96, train_loss: 0.6855, test_loss: 0.9433, test_f1: 0.6047
 epoch: 97, train_loss: 0.6963, test_loss: 0.9866, test_f1: 0.5382
 epoch: 98, train_loss: 0.6949, test_loss: 0.9369, test_f1: 0.5465
 epoch: 99, train_loss: 0.6989, test_loss: 0.9813, test_f1: 0.5391
##################ITERATION #9 ****************************************
 epoch: 0, train_loss: 1.1789, test_loss: 1.3028, test_f1: 0.2650
 epoch: 1, train_loss: 1.0392, test_loss: 1.2647, test_f1: 0.3823
 epoch: 2, train_loss: 1.0223, test_loss: 1.1371, test_f1: 0.4580
 epoch: 3, train_loss: 0.9929, test_loss: 0.9918, test_f1: 0.5388
 epoch: 4, train_loss: 0.9623, test_loss: 1.0747, test_f1: 0.4520
 epoch: 5, train_loss: 0.9521, test_loss: 1.0244, test_f1: 0.5120
 epoch: 6, train_loss: 0.9387, test_loss: 1.0473, test_f1: 0.4895
 epoch: 7, train_loss: 0.9219, test_loss: 1.0695, test_f1: 0.4897
 epoch: 8, train_loss: 0.9192, test_loss: 1.0024, test_f1: 0.4946
 epoch: 9, train_loss: 0.9036, test_loss: 0.9660, test_f1: 0.5161
 epoch: 10, train_loss: 0.8990, test_loss: 0.9236, test_f1: 0.5148
 epoch: 11, train_loss: 0.8959, test_loss: 0.9429, test_f1: 0.4988
 epoch: 12, train_loss: 0.8952, test_loss: 0.9334, test_f1: 0.5257
 epoch: 13, train_loss: 0.8799, test_loss: 0.9416, test_f1: 0.5529
 epoch: 14, train_loss: 0.8830, test_loss: 0.9905, test_f1: 0.4816
 epoch: 15, train_loss: 0.8888, test_loss: 1.0265, test_f1: 0.5710
 epoch: 16, train_loss: 0.8950, test_loss: 0.9737, test_f1: 0.5360
 epoch: 17, train_loss: 0.8685, test_loss: 0.9639, test_f1: 0.5381
 epoch: 18, train_loss: 0.8515, test_loss: 0.9440, test_f1: 0.5646
 epoch: 19, train_loss: 0.8595, test_loss: 0.9702, test_f1: 0.5524
 epoch: 20, train_loss: 0.8325, test_loss: 0.9479, test_f1: 0.5419
 epoch: 21, train_loss: 0.8448, test_loss: 1.0520, test_f1: 0.4548
 epoch: 22, train_loss: 0.8307, test_loss: 1.0658, test_f1: 0.4731
 epoch: 23, train_loss: 0.8353, test_loss: 0.9306, test_f1: 0.5307
 epoch: 24, train_loss: 0.8339, test_loss: 0.9375, test_f1: 0.5101
 epoch: 25, train_loss: 0.8152, test_loss: 1.1027, test_f1: 0.4987
 epoch: 26, train_loss: 0.8372, test_loss: 1.1442, test_f1: 0.4628
 epoch: 27, train_loss: 0.8456, test_loss: 0.9781, test_f1: 0.5666
 epoch: 28, train_loss: 0.8315, test_loss: 0.8791, test_f1: 0.5693
 epoch: 29, train_loss: 0.8330, test_loss: 0.9264, test_f1: 0.5586
 epoch: 30, train_loss: 0.8055, test_loss: 0.9584, test_f1: 0.5896
 epoch: 31, train_loss: 0.8198, test_loss: 0.9634, test_f1: 0.5787
 epoch: 32, train_loss: 0.7969, test_loss: 0.9053, test_f1: 0.6038
 epoch: 33, train_loss: 0.8158, test_loss: 0.9228, test_f1: 0.5234
 epoch: 34, train_loss: 0.8110, test_loss: 0.9730, test_f1: 0.4842
 epoch: 35, train_loss: 0.8045, test_loss: 0.9061, test_f1: 0.5288
 epoch: 36, train_loss: 0.8131, test_loss: 0.9181, test_f1: 0.5248
 epoch: 37, train_loss: 0.7931, test_loss: 0.9662, test_f1: 0.4920
 epoch: 38, train_loss: 0.7929, test_loss: 0.9115, test_f1: 0.5376
 epoch: 39, train_loss: 0.8026, test_loss: 0.8881, test_f1: 0.5873
 epoch: 40, train_loss: 0.8070, test_loss: 0.9310, test_f1: 0.5548
 epoch: 41, train_loss: 0.7907, test_loss: 0.9047, test_f1: 0.5757
 epoch: 42, train_loss: 0.7835, test_loss: 0.9155, test_f1: 0.5422
 epoch: 43, train_loss: 0.7779, test_loss: 0.9046, test_f1: 0.5804
 epoch: 44, train_loss: 0.7854, test_loss: 0.9063, test_f1: 0.6085
 epoch: 45, train_loss: 0.7782, test_loss: 0.9097, test_f1: 0.5953
 epoch: 46, train_loss: 0.7937, test_loss: 0.9420, test_f1: 0.5909
 epoch: 47, train_loss: 0.7757, test_loss: 0.9880, test_f1: 0.5704
 epoch: 48, train_loss: 0.7712, test_loss: 1.0173, test_f1: 0.5771
 epoch: 49, train_loss: 0.7872, test_loss: 0.8949, test_f1: 0.5862
 epoch: 50, train_loss: 0.7634, test_loss: 0.9104, test_f1: 0.5892
 epoch: 51, train_loss: 0.7496, test_loss: 0.9031, test_f1: 0.6148
 epoch: 52, train_loss: 0.7436, test_loss: 0.8931, test_f1: 0.6091
 epoch: 53, train_loss: 0.7297, test_loss: 0.8640, test_f1: 0.6141
 epoch: 54, train_loss: 0.7431, test_loss: 0.9850, test_f1: 0.5647
 epoch: 55, train_loss: 0.7288, test_loss: 0.9171, test_f1: 0.5818
 epoch: 56, train_loss: 0.7473, test_loss: 0.8859, test_f1: 0.6342
 epoch: 57, train_loss: 0.7219, test_loss: 0.8764, test_f1: 0.6192
 epoch: 58, train_loss: 0.7257, test_loss: 0.8954, test_f1: 0.6323
 epoch: 59, train_loss: 0.7199, test_loss: 0.9154, test_f1: 0.6137
 epoch: 60, train_loss: 0.7257, test_loss: 0.9117, test_f1: 0.6197
 epoch: 61, train_loss: 0.7147, test_loss: 0.8854, test_f1: 0.6130
 epoch: 62, train_loss: 0.7111, test_loss: 0.8919, test_f1: 0.6169
 epoch: 63, train_loss: 0.7202, test_loss: 0.9052, test_f1: 0.6240
 epoch: 64, train_loss: 0.7234, test_loss: 0.8911, test_f1: 0.6219
 epoch: 65, train_loss: 0.7106, test_loss: 0.9138, test_f1: 0.6293
 epoch: 66, train_loss: 0.7091, test_loss: 0.8899, test_f1: 0.6153
 epoch: 67, train_loss: 0.7013, test_loss: 0.8927, test_f1: 0.6105
 epoch: 68, train_loss: 0.7178, test_loss: 0.8933, test_f1: 0.6280
 epoch: 69, train_loss: 0.7081, test_loss: 0.9424, test_f1: 0.5996
 epoch: 70, train_loss: 0.7178, test_loss: 0.9335, test_f1: 0.5977
 epoch: 71, train_loss: 0.6961, test_loss: 0.9145, test_f1: 0.5754
 epoch: 72, train_loss: 0.6939, test_loss: 0.9624, test_f1: 0.5939
 epoch: 73, train_loss: 0.7307, test_loss: 0.9396, test_f1: 0.6206
 epoch: 74, train_loss: 0.7091, test_loss: 0.9262, test_f1: 0.6186
 epoch: 75, train_loss: 0.6936, test_loss: 0.8999, test_f1: 0.6233
 epoch: 76, train_loss: 0.6828, test_loss: 0.9188, test_f1: 0.6172
 epoch: 77, train_loss: 0.6924, test_loss: 0.8812, test_f1: 0.6241
 epoch: 78, train_loss: 0.7024, test_loss: 0.9130, test_f1: 0.6156
 epoch: 79, train_loss: 0.6985, test_loss: 0.9341, test_f1: 0.6018
 epoch: 80, train_loss: 0.6981, test_loss: 0.8900, test_f1: 0.6029
 epoch: 81, train_loss: 0.7057, test_loss: 0.9184, test_f1: 0.6276
 epoch: 82, train_loss: 0.7021, test_loss: 0.9376, test_f1: 0.6183
 epoch: 83, train_loss: 0.6849, test_loss: 0.9152, test_f1: 0.6197
 epoch: 84, train_loss: 0.6879, test_loss: 0.8871, test_f1: 0.6118
 epoch: 85, train_loss: 0.6906, test_loss: 0.9049, test_f1: 0.6238
 epoch: 86, train_loss: 0.6997, test_loss: 0.9060, test_f1: 0.6242
 epoch: 87, train_loss: 0.6873, test_loss: 0.8993, test_f1: 0.6323
 epoch: 88, train_loss: 0.7021, test_loss: 0.9007, test_f1: 0.6511
 epoch: 89, train_loss: 0.6978, test_loss: 0.9201, test_f1: 0.5956
 epoch: 90, train_loss: 0.6791, test_loss: 0.8987, test_f1: 0.5974
 epoch: 91, train_loss: 0.6948, test_loss: 0.9891, test_f1: 0.5848
 epoch: 92, train_loss: 0.6838, test_loss: 0.9364, test_f1: 0.5958
 epoch: 93, train_loss: 0.6970, test_loss: 0.8880, test_f1: 0.6176
 epoch: 94, train_loss: 0.7009, test_loss: 0.9928, test_f1: 0.6068
 epoch: 95, train_loss: 0.6761, test_loss: 0.9088, test_f1: 0.6235
 epoch: 96, train_loss: 0.6794, test_loss: 0.9037, test_f1: 0.6141
 epoch: 97, train_loss: 0.6703, test_loss: 0.9146, test_f1: 0.6188
 epoch: 98, train_loss: 0.6613, test_loss: 0.9521, test_f1: 0.6212
 epoch: 99, train_loss: 0.6847, test_loss: 0.9005, test_f1: 0.6375

Training completed in 488.74 seconds
Best F1: 0.6573 at epoch 94
Mean F1 across iterations: 0.6288  0.0178
========================FINAL RESULTS================================
FEGIN weighted F1: 0.6573  0.0178
python main.py --data ltspice_examples --representation component_pin --model FEGIN --layers 3 --hiddens 16 --batch_size 128 --lr 0.01 --emb_size 250 --epochs 100 --save_appendix component_pin_L3_H16_BS128_LR0.01_E250 --no_val
-----



STDERR:
  File "main.py", line 370, in <module>
    main()
  File "main.py", line 254, in main
    dataset = dataset_class(
  File "/home/philip/projects/ltspice_examples_code_repo/Circuit-Completion-Using-GNNs/component_classification_with_link_prediction_head/evaluation/FEGIN/kernel/circuit_datasets.py", line 15, in __init__
    self.data, self.slices = torch.load(self.processed_paths[0])
  File "/home/philip/.local/lib/python3.8/site-packages/torch/serialization.py", line 1040, in load
    warnings.warn(
  File "/usr/lib/python3.8/warnings.py", line 109, in _showwarnmsg
    sw(msg.message, msg.category, msg.filename, msg.lineno,
  File "main.py", line 47, in warn_with_traceback
    traceback.print_stack(file=log)
/home/philip/projects/ltspice_examples_code_repo/Circuit-Completion-Using-GNNs/component_classification_with_link_prediction_head/evaluation/FEGIN/kernel/circuit_datasets.py:15: FutureWarning: You are using `torch.load` with `weights_only=False` (the current default value), which uses the default pickle module implicitly. It is possible to construct malicious pickle data which will execute arbitrary code during unpickling (See https://github.com/pytorch/pytorch/blob/main/SECURITY.md#untrusted-models for more details). In a future release, the default value for `weights_only` will be flipped to `True`. This limits the functions that could be executed during unpickling. Arbitrary objects will no longer be allowed to be loaded via this mode unless they are explicitly allowlisted by the user via `torch.serialization.add_safe_globals`. We recommend you start setting `weights_only=True` for any use case where you don't have full control of the loaded file. Please open an issue on GitHub for any issues related to this experimental feature.
  self.data, self.slices = torch.load(self.processed_paths[0])
