STDOUT:
Results will be saved in /home/philip/projects/ltspice_examples_code_repo/Circuit-Completion-Using-GNNs/component_classification_with_link_prediction_head/evaluation/FEGIN/results/model_FEGIN_dataset_ltspice_demos
Command line input: python main.py --data ltspice_demos --representation component_net --model FEGIN --layers 4 --hiddens 32 --batch_size 32 --lr 0.01 --emb_size 128 --epochs 100 --save_appendix component_net_L4_H32_BS32_LR0.01_E128 --no_val
 is saved.
-----
ltspice_demos - FEGIN
Using 4 layers, 32 hidden units, h = 2
Loading component_net representation dataset
ENTERED
Training FEGIN on component_net representation
Train: 1565, Test: 383
##################ITERATION #0 ****************************************
 epoch: 0, train_loss: 1.2165, test_loss: 1.2294, test_f1: 0.3013
 epoch: 1, train_loss: 1.0624, test_loss: 1.1847, test_f1: 0.4296
 epoch: 2, train_loss: 1.0177, test_loss: 1.0957, test_f1: 0.4225
 epoch: 3, train_loss: 1.0024, test_loss: 1.0696, test_f1: 0.4733
 epoch: 4, train_loss: 0.9620, test_loss: 1.0858, test_f1: 0.4331
 epoch: 5, train_loss: 0.9599, test_loss: 1.0918, test_f1: 0.4913
 epoch: 6, train_loss: 0.9503, test_loss: 1.0889, test_f1: 0.4789
 epoch: 7, train_loss: 0.9412, test_loss: 1.1001, test_f1: 0.5295
 epoch: 8, train_loss: 0.9416, test_loss: 1.0921, test_f1: 0.4667
 epoch: 9, train_loss: 0.9366, test_loss: 1.1492, test_f1: 0.4855
 epoch: 10, train_loss: 0.9173, test_loss: 1.0806, test_f1: 0.5587
 epoch: 11, train_loss: 0.9101, test_loss: 1.0104, test_f1: 0.5585
 epoch: 12, train_loss: 0.8853, test_loss: 1.1447, test_f1: 0.5327
 epoch: 13, train_loss: 0.8980, test_loss: 1.0694, test_f1: 0.5111
 epoch: 14, train_loss: 0.8995, test_loss: 1.0501, test_f1: 0.5491
 epoch: 15, train_loss: 0.8969, test_loss: 1.0414, test_f1: 0.5444
 epoch: 16, train_loss: 0.8560, test_loss: 1.0531, test_f1: 0.5341
 epoch: 17, train_loss: 0.8496, test_loss: 1.0441, test_f1: 0.5426
 epoch: 18, train_loss: 0.8371, test_loss: 1.0307, test_f1: 0.5610
 epoch: 19, train_loss: 0.8277, test_loss: 1.0421, test_f1: 0.5827
 epoch: 20, train_loss: 0.8902, test_loss: 1.0179, test_f1: 0.5662
 epoch: 21, train_loss: 0.8671, test_loss: 1.0108, test_f1: 0.5975
 epoch: 22, train_loss: 0.8342, test_loss: 1.0673, test_f1: 0.5732
 epoch: 23, train_loss: 0.8186, test_loss: 1.1073, test_f1: 0.5457
 epoch: 24, train_loss: 0.8318, test_loss: 1.1623, test_f1: 0.4863
 epoch: 25, train_loss: 0.8352, test_loss: 1.0487, test_f1: 0.5472
 epoch: 26, train_loss: 0.8339, test_loss: 1.1691, test_f1: 0.5738
 epoch: 27, train_loss: 0.8202, test_loss: 1.0041, test_f1: 0.5775
 epoch: 28, train_loss: 0.8153, test_loss: 1.0873, test_f1: 0.5582
 epoch: 29, train_loss: 0.8016, test_loss: 1.0804, test_f1: 0.4525
 epoch: 30, train_loss: 0.7598, test_loss: 1.2929, test_f1: 0.5328
 epoch: 31, train_loss: 0.8070, test_loss: 1.1158, test_f1: 0.5637
 epoch: 32, train_loss: 0.7745, test_loss: 1.1060, test_f1: 0.5629
 epoch: 33, train_loss: 0.7395, test_loss: 1.2100, test_f1: 0.5535
 epoch: 34, train_loss: 0.7714, test_loss: 1.1151, test_f1: 0.4888
 epoch: 35, train_loss: 0.7662, test_loss: 1.0959, test_f1: 0.6126
 epoch: 36, train_loss: 0.7660, test_loss: 1.1257, test_f1: 0.5391
 epoch: 37, train_loss: 0.7527, test_loss: 1.0582, test_f1: 0.5737
 epoch: 38, train_loss: 0.7288, test_loss: 1.0928, test_f1: 0.5099
 epoch: 39, train_loss: 0.7391, test_loss: 1.0565, test_f1: 0.5577
 epoch: 40, train_loss: 0.7208, test_loss: 1.1327, test_f1: 0.5638
 epoch: 41, train_loss: 0.7265, test_loss: 1.0601, test_f1: 0.5624
 epoch: 42, train_loss: 0.7326, test_loss: 1.1367, test_f1: 0.5814
 epoch: 43, train_loss: 0.7413, test_loss: 1.1780, test_f1: 0.5643
 epoch: 44, train_loss: 0.7133, test_loss: 1.0603, test_f1: 0.5760
 epoch: 45, train_loss: 0.7075, test_loss: 1.0164, test_f1: 0.6028
 epoch: 46, train_loss: 0.7153, test_loss: 1.0140, test_f1: 0.5919
 epoch: 47, train_loss: 0.7081, test_loss: 1.2615, test_f1: 0.5198
 epoch: 48, train_loss: 0.6811, test_loss: 1.1230, test_f1: 0.5684
 epoch: 49, train_loss: 0.7005, test_loss: 1.2339, test_f1: 0.6093
 epoch: 50, train_loss: 0.7331, test_loss: 1.1610, test_f1: 0.5359
 epoch: 51, train_loss: 0.6832, test_loss: 1.0802, test_f1: 0.5706
 epoch: 52, train_loss: 0.6588, test_loss: 1.0986, test_f1: 0.6110
 epoch: 53, train_loss: 0.6434, test_loss: 1.2608, test_f1: 0.5761
 epoch: 54, train_loss: 0.6163, test_loss: 1.2131, test_f1: 0.6053
 epoch: 55, train_loss: 0.6305, test_loss: 1.2323, test_f1: 0.5657
 epoch: 56, train_loss: 0.6443, test_loss: 1.1519, test_f1: 0.6038
 epoch: 57, train_loss: 0.6548, test_loss: 1.1050, test_f1: 0.6088
 epoch: 58, train_loss: 0.6250, test_loss: 1.1105, test_f1: 0.5981
 epoch: 59, train_loss: 0.6287, test_loss: 1.1804, test_f1: 0.5632
 epoch: 60, train_loss: 0.6196, test_loss: 1.2226, test_f1: 0.5741
 epoch: 61, train_loss: 0.5854, test_loss: 1.2356, test_f1: 0.5650
 epoch: 62, train_loss: 0.5966, test_loss: 1.3249, test_f1: 0.5821
 epoch: 63, train_loss: 0.5893, test_loss: 1.4236, test_f1: 0.5839
 epoch: 64, train_loss: 0.6063, test_loss: 1.3919, test_f1: 0.5582
 epoch: 65, train_loss: 0.6259, test_loss: 1.1937, test_f1: 0.5860
 epoch: 66, train_loss: 0.5862, test_loss: 1.5000, test_f1: 0.5894
 epoch: 67, train_loss: 0.5792, test_loss: 1.3861, test_f1: 0.5979
 epoch: 68, train_loss: 0.5831, test_loss: 1.2796, test_f1: 0.5853
 epoch: 69, train_loss: 0.5831, test_loss: 1.1828, test_f1: 0.5453
 epoch: 70, train_loss: 0.5835, test_loss: 1.2686, test_f1: 0.5584
 epoch: 71, train_loss: 0.5884, test_loss: 1.4705, test_f1: 0.5738
 epoch: 72, train_loss: 0.5622, test_loss: 1.5315, test_f1: 0.5907
 epoch: 73, train_loss: 0.5971, test_loss: 1.5636, test_f1: 0.5867
 epoch: 74, train_loss: 0.5908, test_loss: 1.4256, test_f1: 0.5407
 epoch: 75, train_loss: 0.5897, test_loss: 1.4737, test_f1: 0.5350
 epoch: 76, train_loss: 0.5643, test_loss: 1.4315, test_f1: 0.5597
 epoch: 77, train_loss: 0.5506, test_loss: 1.2602, test_f1: 0.5618
 epoch: 78, train_loss: 0.5609, test_loss: 1.3011, test_f1: 0.5890
 epoch: 79, train_loss: 0.5668, test_loss: 1.3739, test_f1: 0.5860
 epoch: 80, train_loss: 0.5761, test_loss: 1.2634, test_f1: 0.5807
 epoch: 81, train_loss: 0.5891, test_loss: 1.4012, test_f1: 0.5683
 epoch: 82, train_loss: 0.5954, test_loss: 1.5258, test_f1: 0.5983
 epoch: 83, train_loss: 0.5689, test_loss: 1.4717, test_f1: 0.5648
 epoch: 84, train_loss: 0.5374, test_loss: 1.3134, test_f1: 0.6170
 epoch: 85, train_loss: 0.5479, test_loss: 1.3264, test_f1: 0.6131
 epoch: 86, train_loss: 0.5602, test_loss: 1.4240, test_f1: 0.5737
 epoch: 87, train_loss: 0.5438, test_loss: 1.2998, test_f1: 0.5280
 epoch: 88, train_loss: 0.5445, test_loss: 1.8697, test_f1: 0.5658
 epoch: 89, train_loss: 0.5513, test_loss: 1.5120, test_f1: 0.5696
 epoch: 90, train_loss: 0.5365, test_loss: 1.3609, test_f1: 0.5965
 epoch: 91, train_loss: 0.5689, test_loss: 1.4199, test_f1: 0.5861
 epoch: 92, train_loss: 0.5031, test_loss: 1.3512, test_f1: 0.5969
 epoch: 93, train_loss: 0.5544, test_loss: 1.2946, test_f1: 0.5826
 epoch: 94, train_loss: 0.5470, test_loss: 1.4361, test_f1: 0.6039
 epoch: 95, train_loss: 0.5315, test_loss: 1.4176, test_f1: 0.5564
 epoch: 96, train_loss: 0.5372, test_loss: 1.4629, test_f1: 0.6050
 epoch: 97, train_loss: 0.5263, test_loss: 1.5574, test_f1: 0.5900
 epoch: 98, train_loss: 0.5198, test_loss: 1.3976, test_f1: 0.5890
 epoch: 99, train_loss: 0.5288, test_loss: 1.5781, test_f1: 0.6084
##################ITERATION #1 ****************************************
 epoch: 0, train_loss: 1.1805, test_loss: 1.1704, test_f1: 0.4145
 epoch: 1, train_loss: 1.0101, test_loss: 1.0982, test_f1: 0.4406
 epoch: 2, train_loss: 1.0179, test_loss: 1.0288, test_f1: 0.4464
 epoch: 3, train_loss: 0.9701, test_loss: 1.0807, test_f1: 0.4323
 epoch: 4, train_loss: 0.9556, test_loss: 1.0922, test_f1: 0.4450
 epoch: 5, train_loss: 0.9450, test_loss: 1.0666, test_f1: 0.4570
 epoch: 6, train_loss: 0.9315, test_loss: 1.0232, test_f1: 0.5388
 epoch: 7, train_loss: 0.9114, test_loss: 1.0835, test_f1: 0.4563
 epoch: 8, train_loss: 0.9068, test_loss: 1.0532, test_f1: 0.5428
 epoch: 9, train_loss: 0.8944, test_loss: 0.9875, test_f1: 0.5566
 epoch: 10, train_loss: 0.8836, test_loss: 1.0745, test_f1: 0.5159
 epoch: 11, train_loss: 0.8820, test_loss: 1.0477, test_f1: 0.5492
 epoch: 12, train_loss: 0.8349, test_loss: 1.1581, test_f1: 0.5495
 epoch: 13, train_loss: 0.8302, test_loss: 1.0736, test_f1: 0.5315
 epoch: 14, train_loss: 0.8078, test_loss: 1.0172, test_f1: 0.5641
 epoch: 15, train_loss: 0.8141, test_loss: 1.0596, test_f1: 0.5495
 epoch: 16, train_loss: 0.8334, test_loss: 1.1297, test_f1: 0.5148
 epoch: 17, train_loss: 0.8203, test_loss: 1.0692, test_f1: 0.5415
 epoch: 18, train_loss: 0.8199, test_loss: 0.9972, test_f1: 0.5746
 epoch: 19, train_loss: 0.7980, test_loss: 0.9861, test_f1: 0.5849
 epoch: 20, train_loss: 0.7675, test_loss: 1.0071, test_f1: 0.5800
 epoch: 21, train_loss: 0.7924, test_loss: 1.0230, test_f1: 0.5469
 epoch: 22, train_loss: 0.7800, test_loss: 1.1768, test_f1: 0.4608
 epoch: 23, train_loss: 0.7576, test_loss: 1.1443, test_f1: 0.5285
 epoch: 24, train_loss: 0.7846, test_loss: 0.9852, test_f1: 0.5444
 epoch: 25, train_loss: 0.7737, test_loss: 1.0521, test_f1: 0.5755
 epoch: 26, train_loss: 0.7498, test_loss: 1.0180, test_f1: 0.5914
 epoch: 27, train_loss: 0.7493, test_loss: 1.1030, test_f1: 0.4926
 epoch: 28, train_loss: 0.7474, test_loss: 1.1072, test_f1: 0.5286
 epoch: 29, train_loss: 0.7529, test_loss: 1.0810, test_f1: 0.5488
 epoch: 30, train_loss: 0.7490, test_loss: 1.0735, test_f1: 0.5606
 epoch: 31, train_loss: 0.7157, test_loss: 1.0300, test_f1: 0.5564
 epoch: 32, train_loss: 0.7441, test_loss: 1.1731, test_f1: 0.4838
 epoch: 33, train_loss: 0.7327, test_loss: 1.0745, test_f1: 0.5877
 epoch: 34, train_loss: 0.7286, test_loss: 1.2719, test_f1: 0.4997
 epoch: 35, train_loss: 0.7083, test_loss: 1.0874, test_f1: 0.5858
 epoch: 36, train_loss: 0.7060, test_loss: 0.9868, test_f1: 0.6154
 epoch: 37, train_loss: 0.7175, test_loss: 1.0077, test_f1: 0.6096
 epoch: 38, train_loss: 0.7150, test_loss: 1.1548, test_f1: 0.5895
 epoch: 39, train_loss: 0.7498, test_loss: 1.1298, test_f1: 0.5707
 epoch: 40, train_loss: 0.6963, test_loss: 1.2538, test_f1: 0.5620
 epoch: 41, train_loss: 0.6835, test_loss: 1.0686, test_f1: 0.6002
 epoch: 42, train_loss: 0.6796, test_loss: 1.0510, test_f1: 0.5859
 epoch: 43, train_loss: 0.7003, test_loss: 1.0518, test_f1: 0.5793
 epoch: 44, train_loss: 0.6587, test_loss: 1.1015, test_f1: 0.5764
 epoch: 45, train_loss: 0.6370, test_loss: 1.1649, test_f1: 0.5762
 epoch: 46, train_loss: 0.6688, test_loss: 1.3206, test_f1: 0.5508
 epoch: 47, train_loss: 0.6637, test_loss: 1.1496, test_f1: 0.5544
 epoch: 48, train_loss: 0.6818, test_loss: 1.0049, test_f1: 0.5936
 epoch: 49, train_loss: 0.6956, test_loss: 1.4081, test_f1: 0.5176
 epoch: 50, train_loss: 0.6675, test_loss: 1.1207, test_f1: 0.5713
 epoch: 51, train_loss: 0.6551, test_loss: 1.1181, test_f1: 0.5402
 epoch: 52, train_loss: 0.6294, test_loss: 1.0547, test_f1: 0.5819
 epoch: 53, train_loss: 0.6259, test_loss: 1.2193, test_f1: 0.5801
 epoch: 54, train_loss: 0.6216, test_loss: 1.1750, test_f1: 0.6087
 epoch: 55, train_loss: 0.6199, test_loss: 1.1317, test_f1: 0.5237
 epoch: 56, train_loss: 0.6197, test_loss: 1.2165, test_f1: 0.5237
 epoch: 57, train_loss: 0.6216, test_loss: 1.1858, test_f1: 0.5633
 epoch: 58, train_loss: 0.5998, test_loss: 1.2945, test_f1: 0.5557
 epoch: 59, train_loss: 0.6154, test_loss: 1.2357, test_f1: 0.5530
 epoch: 60, train_loss: 0.6277, test_loss: 1.1646, test_f1: 0.5333
 epoch: 61, train_loss: 0.6050, test_loss: 1.1680, test_f1: 0.5488
 epoch: 62, train_loss: 0.6064, test_loss: 1.2334, test_f1: 0.5801
 epoch: 63, train_loss: 0.6134, test_loss: 1.1211, test_f1: 0.5940
 epoch: 64, train_loss: 0.5781, test_loss: 1.1721, test_f1: 0.5843
 epoch: 65, train_loss: 0.5754, test_loss: 1.2064, test_f1: 0.5762
 epoch: 66, train_loss: 0.5943, test_loss: 1.1599, test_f1: 0.6194
 epoch: 67, train_loss: 0.5816, test_loss: 1.2447, test_f1: 0.6021
 epoch: 68, train_loss: 0.5822, test_loss: 1.2386, test_f1: 0.6060
 epoch: 69, train_loss: 0.5900, test_loss: 1.2460, test_f1: 0.5725
 epoch: 70, train_loss: 0.5715, test_loss: 1.1828, test_f1: 0.6091
 epoch: 71, train_loss: 0.5511, test_loss: 1.2411, test_f1: 0.5720
 epoch: 72, train_loss: 0.5914, test_loss: 1.1861, test_f1: 0.5604
 epoch: 73, train_loss: 0.5823, test_loss: 1.1712, test_f1: 0.5665
 epoch: 74, train_loss: 0.5723, test_loss: 1.3225, test_f1: 0.5646
 epoch: 75, train_loss: 0.6059, test_loss: 1.1753, test_f1: 0.5979
 epoch: 76, train_loss: 0.5820, test_loss: 1.1597, test_f1: 0.5308
 epoch: 77, train_loss: 0.5637, test_loss: 1.3771, test_f1: 0.5504
 epoch: 78, train_loss: 0.5721, test_loss: 1.2836, test_f1: 0.5908
 epoch: 79, train_loss: 0.5716, test_loss: 1.3868, test_f1: 0.5540
 epoch: 80, train_loss: 0.5755, test_loss: 1.4360, test_f1: 0.5502
 epoch: 81, train_loss: 0.5408, test_loss: 1.3292, test_f1: 0.5694
 epoch: 82, train_loss: 0.5455, test_loss: 1.3137, test_f1: 0.5535
 epoch: 83, train_loss: 0.5863, test_loss: 1.1881, test_f1: 0.5955
 epoch: 84, train_loss: 0.5371, test_loss: 1.2574, test_f1: 0.6181
 epoch: 85, train_loss: 0.5624, test_loss: 1.3381, test_f1: 0.5630
 epoch: 86, train_loss: 0.5478, test_loss: 1.3204, test_f1: 0.5739
 epoch: 87, train_loss: 0.5727, test_loss: 1.3038, test_f1: 0.6090
 epoch: 88, train_loss: 0.5592, test_loss: 1.2806, test_f1: 0.5930
 epoch: 89, train_loss: 0.5410, test_loss: 1.2555, test_f1: 0.6025
 epoch: 90, train_loss: 0.5437, test_loss: 1.3113, test_f1: 0.5604
 epoch: 91, train_loss: 0.5577, test_loss: 1.3244, test_f1: 0.6047
 epoch: 92, train_loss: 0.5587, test_loss: 1.3393, test_f1: 0.6036
 epoch: 93, train_loss: 0.5472, test_loss: 1.3359, test_f1: 0.5808
 epoch: 94, train_loss: 0.5643, test_loss: 1.2582, test_f1: 0.5664
 epoch: 95, train_loss: 0.5164, test_loss: 1.3118, test_f1: 0.6081
 epoch: 96, train_loss: 0.5379, test_loss: 1.3109, test_f1: 0.6132
 epoch: 97, train_loss: 0.5486, test_loss: 1.2732, test_f1: 0.5784
 epoch: 98, train_loss: 0.5381, test_loss: 1.3555, test_f1: 0.6089
 epoch: 99, train_loss: 0.4984, test_loss: 1.3215, test_f1: 0.6041
##################ITERATION #2 ****************************************
 epoch: 0, train_loss: 1.1778, test_loss: 1.1662, test_f1: 0.3472
 epoch: 1, train_loss: 1.0564, test_loss: 1.0988, test_f1: 0.4180
 epoch: 2, train_loss: 0.9945, test_loss: 1.0456, test_f1: 0.5055
 epoch: 3, train_loss: 0.9891, test_loss: 1.0864, test_f1: 0.4014
 epoch: 4, train_loss: 0.9855, test_loss: 1.0416, test_f1: 0.4596
 epoch: 5, train_loss: 1.0092, test_loss: 1.1121, test_f1: 0.4977
 epoch: 6, train_loss: 0.9795, test_loss: 1.0987, test_f1: 0.5317
 epoch: 7, train_loss: 0.9526, test_loss: 1.1062, test_f1: 0.4922
 epoch: 8, train_loss: 0.9644, test_loss: 1.0665, test_f1: 0.4263
 epoch: 9, train_loss: 0.9477, test_loss: 1.0917, test_f1: 0.5540
 epoch: 10, train_loss: 0.9365, test_loss: 1.2811, test_f1: 0.4610
 epoch: 11, train_loss: 0.9246, test_loss: 1.0932, test_f1: 0.5361
 epoch: 12, train_loss: 0.9192, test_loss: 1.0754, test_f1: 0.4041
 epoch: 13, train_loss: 0.9261, test_loss: 1.0347, test_f1: 0.5413
 epoch: 14, train_loss: 0.9173, test_loss: 1.0375, test_f1: 0.5089
 epoch: 15, train_loss: 0.8855, test_loss: 1.0478, test_f1: 0.5166
 epoch: 16, train_loss: 0.8801, test_loss: 1.1339, test_f1: 0.5051
 epoch: 17, train_loss: 0.8727, test_loss: 1.0955, test_f1: 0.5294
 epoch: 18, train_loss: 0.8583, test_loss: 1.0443, test_f1: 0.5182
 epoch: 19, train_loss: 0.8379, test_loss: 1.0159, test_f1: 0.5658
 epoch: 20, train_loss: 0.8433, test_loss: 1.0815, test_f1: 0.5315
 epoch: 21, train_loss: 0.8332, test_loss: 1.1321, test_f1: 0.5415
 epoch: 22, train_loss: 0.8021, test_loss: 1.0888, test_f1: 0.5590
 epoch: 23, train_loss: 0.8073, test_loss: 1.1678, test_f1: 0.5319
 epoch: 24, train_loss: 0.8218, test_loss: 1.0533, test_f1: 0.5918
 epoch: 25, train_loss: 0.7976, test_loss: 1.1254, test_f1: 0.5229
 epoch: 26, train_loss: 0.7948, test_loss: 1.0831, test_f1: 0.5432
 epoch: 27, train_loss: 0.7682, test_loss: 1.0385, test_f1: 0.5313
 epoch: 28, train_loss: 0.7982, test_loss: 1.0679, test_f1: 0.5565
 epoch: 29, train_loss: 0.7647, test_loss: 1.0802, test_f1: 0.5529
 epoch: 30, train_loss: 0.7527, test_loss: 1.1879, test_f1: 0.5748
 epoch: 31, train_loss: 0.7863, test_loss: 1.1067, test_f1: 0.5455
 epoch: 32, train_loss: 0.7512, test_loss: 1.1420, test_f1: 0.5801
 epoch: 33, train_loss: 0.7537, test_loss: 1.1144, test_f1: 0.5603
 epoch: 34, train_loss: 0.7534, test_loss: 1.0836, test_f1: 0.5678
 epoch: 35, train_loss: 0.7615, test_loss: 1.1217, test_f1: 0.5769
 epoch: 36, train_loss: 0.7286, test_loss: 1.4979, test_f1: 0.5422
 epoch: 37, train_loss: 0.7513, test_loss: 1.1007, test_f1: 0.5249
 epoch: 38, train_loss: 0.7307, test_loss: 1.0872, test_f1: 0.5655
 epoch: 39, train_loss: 0.7418, test_loss: 1.2143, test_f1: 0.5114
 epoch: 40, train_loss: 0.7453, test_loss: 1.0652, test_f1: 0.5678
 epoch: 41, train_loss: 0.6948, test_loss: 1.2358, test_f1: 0.4961
 epoch: 42, train_loss: 0.7150, test_loss: 1.1075, test_f1: 0.5865
 epoch: 43, train_loss: 0.7042, test_loss: 1.0716, test_f1: 0.5855
 epoch: 44, train_loss: 0.7063, test_loss: 1.1190, test_f1: 0.6130
 epoch: 45, train_loss: 0.7034, test_loss: 1.1703, test_f1: 0.5907
 epoch: 46, train_loss: 0.7446, test_loss: 1.0753, test_f1: 0.6046
 epoch: 47, train_loss: 0.7018, test_loss: 1.1985, test_f1: 0.5712
 epoch: 48, train_loss: 0.7151, test_loss: 1.1117, test_f1: 0.5386
 epoch: 49, train_loss: 0.6880, test_loss: 1.2706, test_f1: 0.5289
 epoch: 50, train_loss: 0.6721, test_loss: 1.1369, test_f1: 0.5803
 epoch: 51, train_loss: 0.6401, test_loss: 1.3045, test_f1: 0.5693
 epoch: 52, train_loss: 0.6786, test_loss: 1.1099, test_f1: 0.5927
 epoch: 53, train_loss: 0.6194, test_loss: 1.2856, test_f1: 0.6033
 epoch: 54, train_loss: 0.6281, test_loss: 1.3374, test_f1: 0.5784
 epoch: 55, train_loss: 0.6051, test_loss: 1.2516, test_f1: 0.5827
 epoch: 56, train_loss: 0.6079, test_loss: 1.2335, test_f1: 0.6398
 epoch: 57, train_loss: 0.6309, test_loss: 1.3331, test_f1: 0.5531
 epoch: 58, train_loss: 0.5985, test_loss: 1.4192, test_f1: 0.5665
 epoch: 59, train_loss: 0.6007, test_loss: 1.3860, test_f1: 0.5865
 epoch: 60, train_loss: 0.6079, test_loss: 1.3182, test_f1: 0.6093
 epoch: 61, train_loss: 0.5931, test_loss: 1.2228, test_f1: 0.6007
 epoch: 62, train_loss: 0.5905, test_loss: 1.2983, test_f1: 0.6506
 epoch: 63, train_loss: 0.6077, test_loss: 1.2995, test_f1: 0.5782
 epoch: 64, train_loss: 0.5945, test_loss: 1.2904, test_f1: 0.5809
 epoch: 65, train_loss: 0.5863, test_loss: 1.2316, test_f1: 0.6020
 epoch: 66, train_loss: 0.6014, test_loss: 1.1757, test_f1: 0.6316
 epoch: 67, train_loss: 0.6026, test_loss: 1.2423, test_f1: 0.5653
 epoch: 68, train_loss: 0.5956, test_loss: 1.2855, test_f1: 0.5725
 epoch: 69, train_loss: 0.5623, test_loss: 1.2714, test_f1: 0.5962
 epoch: 70, train_loss: 0.5482, test_loss: 1.3641, test_f1: 0.5680
 epoch: 71, train_loss: 0.5553, test_loss: 1.2642, test_f1: 0.6118
 epoch: 72, train_loss: 0.5454, test_loss: 1.4705, test_f1: 0.5401
 epoch: 73, train_loss: 0.5569, test_loss: 1.3854, test_f1: 0.6102
 epoch: 74, train_loss: 0.5950, test_loss: 1.2549, test_f1: 0.5975
 epoch: 75, train_loss: 0.5746, test_loss: 1.2593, test_f1: 0.6237
 epoch: 76, train_loss: 0.5707, test_loss: 1.2893, test_f1: 0.6116
 epoch: 77, train_loss: 0.5646, test_loss: 1.3709, test_f1: 0.6086
 epoch: 78, train_loss: 0.5561, test_loss: 1.2229, test_f1: 0.6473
 epoch: 79, train_loss: 0.5598, test_loss: 1.4519, test_f1: 0.5962
 epoch: 80, train_loss: 0.5595, test_loss: 1.3294, test_f1: 0.5959
 epoch: 81, train_loss: 0.5452, test_loss: 1.2763, test_f1: 0.6350
 epoch: 82, train_loss: 0.5459, test_loss: 1.2173, test_f1: 0.6151
 epoch: 83, train_loss: 0.5502, test_loss: 1.4426, test_f1: 0.5739
 epoch: 84, train_loss: 0.5474, test_loss: 1.4743, test_f1: 0.5523
 epoch: 85, train_loss: 0.5530, test_loss: 1.4319, test_f1: 0.6072
 epoch: 86, train_loss: 0.5437, test_loss: 1.2638, test_f1: 0.6487
 epoch: 87, train_loss: 0.5408, test_loss: 1.2772, test_f1: 0.6154
 epoch: 88, train_loss: 0.5769, test_loss: 1.1755, test_f1: 0.5980
 epoch: 89, train_loss: 0.5382, test_loss: 1.2924, test_f1: 0.6135
 epoch: 90, train_loss: 0.5222, test_loss: 1.3153, test_f1: 0.6162
 epoch: 91, train_loss: 0.5497, test_loss: 1.4418, test_f1: 0.6442
 epoch: 92, train_loss: 0.5472, test_loss: 1.3716, test_f1: 0.6168
 epoch: 93, train_loss: 0.5106, test_loss: 1.3758, test_f1: 0.6343
 epoch: 94, train_loss: 0.5541, test_loss: 1.4291, test_f1: 0.6234
 epoch: 95, train_loss: 0.5260, test_loss: 1.4215, test_f1: 0.6255
 epoch: 96, train_loss: 0.5309, test_loss: 1.5063, test_f1: 0.6063
 epoch: 97, train_loss: 0.5220, test_loss: 1.3522, test_f1: 0.6353
 epoch: 98, train_loss: 0.5125, test_loss: 1.4360, test_f1: 0.6154
 epoch: 99, train_loss: 0.5042, test_loss: 1.4788, test_f1: 0.5928
##################ITERATION #3 ****************************************
 epoch: 0, train_loss: 1.1773, test_loss: 1.1884, test_f1: 0.3803
 epoch: 1, train_loss: 1.0374, test_loss: 1.0649, test_f1: 0.4886
 epoch: 2, train_loss: 0.9890, test_loss: 1.0456, test_f1: 0.4358
 epoch: 3, train_loss: 0.9915, test_loss: 1.0554, test_f1: 0.4689
 epoch: 4, train_loss: 0.9422, test_loss: 1.0439, test_f1: 0.4391
 epoch: 5, train_loss: 0.9511, test_loss: 1.1515, test_f1: 0.4761
 epoch: 6, train_loss: 0.9274, test_loss: 1.0891, test_f1: 0.5054
 epoch: 7, train_loss: 0.9071, test_loss: 1.0648, test_f1: 0.5275
 epoch: 8, train_loss: 0.8851, test_loss: 1.1382, test_f1: 0.4781
 epoch: 9, train_loss: 0.8727, test_loss: 0.9997, test_f1: 0.5384
 epoch: 10, train_loss: 0.8921, test_loss: 1.0528, test_f1: 0.4997
 epoch: 11, train_loss: 0.8497, test_loss: 1.1011, test_f1: 0.4944
 epoch: 12, train_loss: 0.8449, test_loss: 1.1395, test_f1: 0.5389
 epoch: 13, train_loss: 0.8690, test_loss: 1.0573, test_f1: 0.5178
 epoch: 14, train_loss: 0.8380, test_loss: 1.0133, test_f1: 0.5315
 epoch: 15, train_loss: 0.8051, test_loss: 1.2490, test_f1: 0.4944
 epoch: 16, train_loss: 0.8320, test_loss: 1.1011, test_f1: 0.4876
 epoch: 17, train_loss: 0.8207, test_loss: 1.1352, test_f1: 0.5581
 epoch: 18, train_loss: 0.8005, test_loss: 1.0621, test_f1: 0.5335
 epoch: 19, train_loss: 0.7767, test_loss: 1.0871, test_f1: 0.5406
 epoch: 20, train_loss: 0.7694, test_loss: 1.0177, test_f1: 0.5461
 epoch: 21, train_loss: 0.7685, test_loss: 0.9961, test_f1: 0.5921
 epoch: 22, train_loss: 0.7744, test_loss: 1.0137, test_f1: 0.5922
 epoch: 23, train_loss: 0.7614, test_loss: 1.0356, test_f1: 0.5890
 epoch: 24, train_loss: 0.7842, test_loss: 0.9972, test_f1: 0.5647
 epoch: 25, train_loss: 0.7413, test_loss: 1.0737, test_f1: 0.5546
 epoch: 26, train_loss: 0.7664, test_loss: 1.0785, test_f1: 0.5628
 epoch: 27, train_loss: 0.7508, test_loss: 1.1277, test_f1: 0.5609
 epoch: 28, train_loss: 0.7190, test_loss: 1.1959, test_f1: 0.5367
 epoch: 29, train_loss: 0.7498, test_loss: 1.1968, test_f1: 0.5511
 epoch: 30, train_loss: 0.7165, test_loss: 1.0031, test_f1: 0.5945
 epoch: 31, train_loss: 0.7507, test_loss: 1.1842, test_f1: 0.5424
 epoch: 32, train_loss: 0.7190, test_loss: 1.1337, test_f1: 0.5673
 epoch: 33, train_loss: 0.7185, test_loss: 1.1384, test_f1: 0.5582
 epoch: 34, train_loss: 0.7098, test_loss: 1.0953, test_f1: 0.5206
 epoch: 35, train_loss: 0.7043, test_loss: 1.0952, test_f1: 0.5404
 epoch: 36, train_loss: 0.7330, test_loss: 1.1727, test_f1: 0.5353
 epoch: 37, train_loss: 0.7310, test_loss: 1.4040, test_f1: 0.5099
 epoch: 38, train_loss: 0.7001, test_loss: 1.2334, test_f1: 0.4468
 epoch: 39, train_loss: 0.6754, test_loss: 1.0820, test_f1: 0.5941
 epoch: 40, train_loss: 0.6981, test_loss: 1.2918, test_f1: 0.5304
 epoch: 41, train_loss: 0.6921, test_loss: 1.1636, test_f1: 0.5909
 epoch: 42, train_loss: 0.6829, test_loss: 1.2006, test_f1: 0.5717
 epoch: 43, train_loss: 0.7053, test_loss: 1.1313, test_f1: 0.5918
 epoch: 44, train_loss: 0.6826, test_loss: 1.1315, test_f1: 0.6021
 epoch: 45, train_loss: 0.6741, test_loss: 1.1609, test_f1: 0.5868
 epoch: 46, train_loss: 0.6701, test_loss: 1.1582, test_f1: 0.5614
 epoch: 47, train_loss: 0.6388, test_loss: 1.3624, test_f1: 0.6038
 epoch: 48, train_loss: 0.6737, test_loss: 1.1192, test_f1: 0.5791
 epoch: 49, train_loss: 0.6627, test_loss: 1.1604, test_f1: 0.6006
 epoch: 50, train_loss: 0.6513, test_loss: 1.2148, test_f1: 0.5983
 epoch: 51, train_loss: 0.6319, test_loss: 1.2143, test_f1: 0.6452
 epoch: 52, train_loss: 0.6022, test_loss: 1.1834, test_f1: 0.6356
 epoch: 53, train_loss: 0.5741, test_loss: 1.2381, test_f1: 0.6211
 epoch: 54, train_loss: 0.5788, test_loss: 1.2512, test_f1: 0.6384
 epoch: 55, train_loss: 0.5862, test_loss: 1.2355, test_f1: 0.5987
 epoch: 56, train_loss: 0.5836, test_loss: 1.2932, test_f1: 0.6016
 epoch: 57, train_loss: 0.5848, test_loss: 1.3076, test_f1: 0.6101
 epoch: 58, train_loss: 0.5616, test_loss: 1.3838, test_f1: 0.6184
 epoch: 59, train_loss: 0.5936, test_loss: 1.1746, test_f1: 0.6597
 epoch: 60, train_loss: 0.5769, test_loss: 1.5467, test_f1: 0.6215
 epoch: 61, train_loss: 0.5782, test_loss: 1.2269, test_f1: 0.6113
 epoch: 62, train_loss: 0.5691, test_loss: 1.4129, test_f1: 0.6023
 epoch: 63, train_loss: 0.5669, test_loss: 1.2306, test_f1: 0.6540
 epoch: 64, train_loss: 0.5582, test_loss: 1.2225, test_f1: 0.6411
 epoch: 65, train_loss: 0.5365, test_loss: 1.4888, test_f1: 0.6064
 epoch: 66, train_loss: 0.5954, test_loss: 1.2755, test_f1: 0.6398
 epoch: 67, train_loss: 0.5506, test_loss: 1.2835, test_f1: 0.6342
 epoch: 68, train_loss: 0.5261, test_loss: 1.1809, test_f1: 0.6109
 epoch: 69, train_loss: 0.5735, test_loss: 1.1658, test_f1: 0.6149
 epoch: 70, train_loss: 0.5427, test_loss: 1.1845, test_f1: 0.6391
 epoch: 71, train_loss: 0.5401, test_loss: 1.3670, test_f1: 0.5930
 epoch: 72, train_loss: 0.5502, test_loss: 1.1959, test_f1: 0.6556
 epoch: 73, train_loss: 0.5221, test_loss: 1.3430, test_f1: 0.6517
 epoch: 74, train_loss: 0.5088, test_loss: 1.4672, test_f1: 0.5765
 epoch: 75, train_loss: 0.5766, test_loss: 1.3622, test_f1: 0.5956
 epoch: 76, train_loss: 0.5042, test_loss: 1.2088, test_f1: 0.6311
 epoch: 77, train_loss: 0.5354, test_loss: 1.3186, test_f1: 0.6290
 epoch: 78, train_loss: 0.5049, test_loss: 1.4200, test_f1: 0.6341
 epoch: 79, train_loss: 0.5452, test_loss: 1.2703, test_f1: 0.6494
 epoch: 80, train_loss: 0.5290, test_loss: 1.3068, test_f1: 0.6217
 epoch: 81, train_loss: 0.5403, test_loss: 1.3868, test_f1: 0.6274
 epoch: 82, train_loss: 0.5321, test_loss: 1.2929, test_f1: 0.6467
 epoch: 83, train_loss: 0.5176, test_loss: 1.4145, test_f1: 0.6228
 epoch: 84, train_loss: 0.5194, test_loss: 1.2758, test_f1: 0.6447
 epoch: 85, train_loss: 0.4897, test_loss: 1.3865, test_f1: 0.6179
 epoch: 86, train_loss: 0.5008, test_loss: 1.5507, test_f1: 0.6149
 epoch: 87, train_loss: 0.5310, test_loss: 1.3927, test_f1: 0.6157
 epoch: 88, train_loss: 0.4993, test_loss: 1.3576, test_f1: 0.6357
 epoch: 89, train_loss: 0.5177, test_loss: 1.5870, test_f1: 0.6375
 epoch: 90, train_loss: 0.5123, test_loss: 1.2796, test_f1: 0.6290
 epoch: 91, train_loss: 0.5014, test_loss: 1.2911, test_f1: 0.6443
 epoch: 92, train_loss: 0.4797, test_loss: 1.6426, test_f1: 0.6157
 epoch: 93, train_loss: 0.5252, test_loss: 1.4511, test_f1: 0.6207
 epoch: 94, train_loss: 0.5172, test_loss: 1.4589, test_f1: 0.6271
 epoch: 95, train_loss: 0.5062, test_loss: 1.2970, test_f1: 0.6268
 epoch: 96, train_loss: 0.4883, test_loss: 1.6038, test_f1: 0.6173
 epoch: 97, train_loss: 0.4989, test_loss: 1.3131, test_f1: 0.6389
 epoch: 98, train_loss: 0.5052, test_loss: 1.3016, test_f1: 0.6317
 epoch: 99, train_loss: 0.4546, test_loss: 1.5996, test_f1: 0.6022
##################ITERATION #4 ****************************************
 epoch: 0, train_loss: 1.2424, test_loss: 1.2688, test_f1: 0.2792
 epoch: 1, train_loss: 1.0812, test_loss: 1.1045, test_f1: 0.4663
 epoch: 2, train_loss: 1.0382, test_loss: 1.0716, test_f1: 0.4485
 epoch: 3, train_loss: 0.9862, test_loss: 1.0515, test_f1: 0.4979
 epoch: 4, train_loss: 0.9720, test_loss: 1.0402, test_f1: 0.5231
 epoch: 5, train_loss: 0.9761, test_loss: 1.1241, test_f1: 0.4342
 epoch: 6, train_loss: 0.9623, test_loss: 1.0538, test_f1: 0.5008
 epoch: 7, train_loss: 0.9459, test_loss: 1.0647, test_f1: 0.5119
 epoch: 8, train_loss: 0.9558, test_loss: 1.1554, test_f1: 0.4382
 epoch: 9, train_loss: 0.9198, test_loss: 1.0730, test_f1: 0.4798
 epoch: 10, train_loss: 0.9371, test_loss: 1.1283, test_f1: 0.5092
 epoch: 11, train_loss: 0.9220, test_loss: 1.0750, test_f1: 0.5504
 epoch: 12, train_loss: 0.9085, test_loss: 1.0032, test_f1: 0.5568
 epoch: 13, train_loss: 0.8722, test_loss: 1.0393, test_f1: 0.5370
 epoch: 14, train_loss: 0.8611, test_loss: 1.1155, test_f1: 0.5162
 epoch: 15, train_loss: 0.8666, test_loss: 0.9991, test_f1: 0.5893
 epoch: 16, train_loss: 0.8610, test_loss: 1.1052, test_f1: 0.5090
 epoch: 17, train_loss: 0.8422, test_loss: 1.0882, test_f1: 0.5256
 epoch: 18, train_loss: 0.8257, test_loss: 1.0794, test_f1: 0.5464
 epoch: 19, train_loss: 0.8224, test_loss: 1.0768, test_f1: 0.5322
 epoch: 20, train_loss: 0.8223, test_loss: 0.9733, test_f1: 0.5418
 epoch: 21, train_loss: 0.8032, test_loss: 1.0619, test_f1: 0.5685
 epoch: 22, train_loss: 0.7967, test_loss: 1.1065, test_f1: 0.5363
 epoch: 23, train_loss: 0.7713, test_loss: 1.0799, test_f1: 0.5708
 epoch: 24, train_loss: 0.7884, test_loss: 1.0527, test_f1: 0.5789
 epoch: 25, train_loss: 0.7697, test_loss: 1.0565, test_f1: 0.5530
 epoch: 26, train_loss: 0.7646, test_loss: 1.1207, test_f1: 0.6056
 epoch: 27, train_loss: 0.7567, test_loss: 1.1077, test_f1: 0.5767
 epoch: 28, train_loss: 0.7488, test_loss: 1.0425, test_f1: 0.5836
 epoch: 29, train_loss: 0.7776, test_loss: 1.0331, test_f1: 0.5946
 epoch: 30, train_loss: 0.7495, test_loss: 1.0098, test_f1: 0.5570
 epoch: 31, train_loss: 0.7491, test_loss: 1.1313, test_f1: 0.5756
 epoch: 32, train_loss: 0.7365, test_loss: 1.1117, test_f1: 0.5881
 epoch: 33, train_loss: 0.7269, test_loss: 1.1879, test_f1: 0.5247
 epoch: 34, train_loss: 0.7604, test_loss: 1.0611, test_f1: 0.5689
 epoch: 35, train_loss: 0.7185, test_loss: 1.0223, test_f1: 0.6239
 epoch: 36, train_loss: 0.7168, test_loss: 1.1296, test_f1: 0.6148
 epoch: 37, train_loss: 0.7096, test_loss: 0.9965, test_f1: 0.6174
 epoch: 38, train_loss: 0.6994, test_loss: 1.0495, test_f1: 0.6237
 epoch: 39, train_loss: 0.7409, test_loss: 1.0467, test_f1: 0.5667
 epoch: 40, train_loss: 0.6968, test_loss: 1.0448, test_f1: 0.6023
 epoch: 41, train_loss: 0.6824, test_loss: 1.0336, test_f1: 0.5768
 epoch: 42, train_loss: 0.7212, test_loss: 1.0297, test_f1: 0.5917
 epoch: 43, train_loss: 0.7125, test_loss: 1.0518, test_f1: 0.6250
 epoch: 44, train_loss: 0.6852, test_loss: 1.3123, test_f1: 0.5848
 epoch: 45, train_loss: 0.7390, test_loss: 1.3355, test_f1: 0.4608
 epoch: 46, train_loss: 0.7094, test_loss: 1.0540, test_f1: 0.6224
 epoch: 47, train_loss: 0.6886, test_loss: 1.1120, test_f1: 0.5702
 epoch: 48, train_loss: 0.6849, test_loss: 1.1325, test_f1: 0.6086
 epoch: 49, train_loss: 0.6937, test_loss: 1.1346, test_f1: 0.5651
 epoch: 50, train_loss: 0.6931, test_loss: 1.1059, test_f1: 0.5935
 epoch: 51, train_loss: 0.6012, test_loss: 1.1163, test_f1: 0.6270
 epoch: 52, train_loss: 0.6292, test_loss: 1.1388, test_f1: 0.5698
 epoch: 53, train_loss: 0.6107, test_loss: 1.2666, test_f1: 0.6185
 epoch: 54, train_loss: 0.5967, test_loss: 1.1400, test_f1: 0.6302
 epoch: 55, train_loss: 0.5907, test_loss: 1.1954, test_f1: 0.6192
 epoch: 56, train_loss: 0.5869, test_loss: 1.1547, test_f1: 0.6220
 epoch: 57, train_loss: 0.5763, test_loss: 1.1829, test_f1: 0.5905
 epoch: 58, train_loss: 0.5973, test_loss: 1.1702, test_f1: 0.6294
 epoch: 59, train_loss: 0.6046, test_loss: 1.1388, test_f1: 0.5960
 epoch: 60, train_loss: 0.5726, test_loss: 1.1978, test_f1: 0.6230
 epoch: 61, train_loss: 0.5764, test_loss: 1.1462, test_f1: 0.6328
 epoch: 62, train_loss: 0.5601, test_loss: 1.1932, test_f1: 0.6053
 epoch: 63, train_loss: 0.5871, test_loss: 1.3901, test_f1: 0.6146
 epoch: 64, train_loss: 0.5622, test_loss: 1.2980, test_f1: 0.6067
 epoch: 65, train_loss: 0.5740, test_loss: 1.3744, test_f1: 0.6063
 epoch: 66, train_loss: 0.5730, test_loss: 1.1827, test_f1: 0.5928
 epoch: 67, train_loss: 0.5347, test_loss: 1.3531, test_f1: 0.5834
 epoch: 68, train_loss: 0.5763, test_loss: 1.1401, test_f1: 0.6017
 epoch: 69, train_loss: 0.5628, test_loss: 1.3229, test_f1: 0.5754
 epoch: 70, train_loss: 0.5595, test_loss: 1.2968, test_f1: 0.6088
 epoch: 71, train_loss: 0.5505, test_loss: 1.3087, test_f1: 0.6066
 epoch: 72, train_loss: 0.5547, test_loss: 1.3414, test_f1: 0.6316
 epoch: 73, train_loss: 0.5693, test_loss: 1.3186, test_f1: 0.6039
 epoch: 74, train_loss: 0.5402, test_loss: 1.2586, test_f1: 0.5829
 epoch: 75, train_loss: 0.5274, test_loss: 1.2929, test_f1: 0.5908
 epoch: 76, train_loss: 0.5363, test_loss: 1.3542, test_f1: 0.6446
 epoch: 77, train_loss: 0.5299, test_loss: 1.4790, test_f1: 0.6271
 epoch: 78, train_loss: 0.5211, test_loss: 1.3566, test_f1: 0.6261
 epoch: 79, train_loss: 0.5530, test_loss: 1.2994, test_f1: 0.6234
 epoch: 80, train_loss: 0.5448, test_loss: 1.4879, test_f1: 0.6084
 epoch: 81, train_loss: 0.5305, test_loss: 1.3390, test_f1: 0.6103
 epoch: 82, train_loss: 0.5291, test_loss: 1.2108, test_f1: 0.6164
 epoch: 83, train_loss: 0.5273, test_loss: 1.4875, test_f1: 0.6191
 epoch: 84, train_loss: 0.5527, test_loss: 1.3045, test_f1: 0.5921
 epoch: 85, train_loss: 0.5272, test_loss: 1.4350, test_f1: 0.5884
 epoch: 86, train_loss: 0.4926, test_loss: 1.4085, test_f1: 0.5883
 epoch: 87, train_loss: 0.4940, test_loss: 1.4637, test_f1: 0.5953
 epoch: 88, train_loss: 0.5159, test_loss: 1.6297, test_f1: 0.6141
 epoch: 89, train_loss: 0.5196, test_loss: 1.4591, test_f1: 0.5944
 epoch: 90, train_loss: 0.4983, test_loss: 1.4306, test_f1: 0.6099
 epoch: 91, train_loss: 0.4621, test_loss: 1.5478, test_f1: 0.5797
 epoch: 92, train_loss: 0.4848, test_loss: 1.5768, test_f1: 0.5816
 epoch: 93, train_loss: 0.5069, test_loss: 1.5431, test_f1: 0.6226
 epoch: 94, train_loss: 0.5070, test_loss: 1.7398, test_f1: 0.6043
 epoch: 95, train_loss: 0.4951, test_loss: 1.4657, test_f1: 0.6105
 epoch: 96, train_loss: 0.4846, test_loss: 1.4591, test_f1: 0.6276
 epoch: 97, train_loss: 0.4618, test_loss: 1.6834, test_f1: 0.6283
 epoch: 98, train_loss: 0.5050, test_loss: 1.5002, test_f1: 0.5972
 epoch: 99, train_loss: 0.4847, test_loss: 1.4288, test_f1: 0.6258
##################ITERATION #5 ****************************************
 epoch: 0, train_loss: 1.2323, test_loss: 1.2510, test_f1: 0.3524
 epoch: 1, train_loss: 1.0664, test_loss: 1.1244, test_f1: 0.5053
 epoch: 2, train_loss: 1.0089, test_loss: 1.0822, test_f1: 0.5383
 epoch: 3, train_loss: 0.9616, test_loss: 1.0290, test_f1: 0.5009
 epoch: 4, train_loss: 0.9628, test_loss: 1.0922, test_f1: 0.5008
 epoch: 5, train_loss: 0.9580, test_loss: 1.0611, test_f1: 0.5176
 epoch: 6, train_loss: 0.9638, test_loss: 1.1017, test_f1: 0.4980
 epoch: 7, train_loss: 0.9251, test_loss: 1.0787, test_f1: 0.5141
 epoch: 8, train_loss: 0.9335, test_loss: 1.0535, test_f1: 0.5016
 epoch: 9, train_loss: 0.9503, test_loss: 1.0672, test_f1: 0.5462
 epoch: 10, train_loss: 0.9259, test_loss: 1.1192, test_f1: 0.5094
 epoch: 11, train_loss: 0.9241, test_loss: 1.0512, test_f1: 0.4943
 epoch: 12, train_loss: 0.9365, test_loss: 1.0948, test_f1: 0.5134
 epoch: 13, train_loss: 0.8977, test_loss: 1.0825, test_f1: 0.5368
 epoch: 14, train_loss: 0.9056, test_loss: 1.0611, test_f1: 0.5547
 epoch: 15, train_loss: 0.8922, test_loss: 1.0435, test_f1: 0.5909
 epoch: 16, train_loss: 0.8627, test_loss: 1.0596, test_f1: 0.4602
 epoch: 17, train_loss: 0.8792, test_loss: 1.0537, test_f1: 0.5413
 epoch: 18, train_loss: 0.8820, test_loss: 1.0090, test_f1: 0.5570
 epoch: 19, train_loss: 0.8960, test_loss: 1.0049, test_f1: 0.5648
 epoch: 20, train_loss: 0.8560, test_loss: 1.2347, test_f1: 0.4278
 epoch: 21, train_loss: 0.8443, test_loss: 1.0580, test_f1: 0.5628
 epoch: 22, train_loss: 0.8395, test_loss: 1.0290, test_f1: 0.5716
 epoch: 23, train_loss: 0.8674, test_loss: 1.0068, test_f1: 0.5748
 epoch: 24, train_loss: 0.8336, test_loss: 1.0419, test_f1: 0.5660
 epoch: 25, train_loss: 0.8240, test_loss: 1.0902, test_f1: 0.4973
 epoch: 26, train_loss: 0.8699, test_loss: 1.0262, test_f1: 0.5742
 epoch: 27, train_loss: 0.8026, test_loss: 1.0529, test_f1: 0.5128
 epoch: 28, train_loss: 0.7992, test_loss: 1.0590, test_f1: 0.5869
 epoch: 29, train_loss: 0.7967, test_loss: 1.0948, test_f1: 0.5280
 epoch: 30, train_loss: 0.7562, test_loss: 1.1030, test_f1: 0.5389
 epoch: 31, train_loss: 0.7475, test_loss: 1.3877, test_f1: 0.5545
 epoch: 32, train_loss: 0.7652, test_loss: 1.0941, test_f1: 0.5737
 epoch: 33, train_loss: 0.7662, test_loss: 1.0622, test_f1: 0.5631
 epoch: 34, train_loss: 0.7329, test_loss: 1.2769, test_f1: 0.5355
 epoch: 35, train_loss: 0.7586, test_loss: 1.1083, test_f1: 0.5520
 epoch: 36, train_loss: 0.7567, test_loss: 2.4072, test_f1: 0.4495
 epoch: 37, train_loss: 0.8077, test_loss: 1.0913, test_f1: 0.5223
 epoch: 38, train_loss: 0.7358, test_loss: 1.1129, test_f1: 0.5899
 epoch: 39, train_loss: 0.7502, test_loss: 1.0807, test_f1: 0.6091
 epoch: 40, train_loss: 0.7174, test_loss: 1.1278, test_f1: 0.5719
 epoch: 41, train_loss: 0.7496, test_loss: 1.1742, test_f1: 0.5290
 epoch: 42, train_loss: 0.7400, test_loss: 1.3948, test_f1: 0.5122
 epoch: 43, train_loss: 0.7460, test_loss: 1.0341, test_f1: 0.5376
 epoch: 44, train_loss: 0.7706, test_loss: 1.4394, test_f1: 0.5346
 epoch: 45, train_loss: 0.7470, test_loss: 1.1075, test_f1: 0.5846
 epoch: 46, train_loss: 0.7323, test_loss: 1.0655, test_f1: 0.5827
 epoch: 47, train_loss: 0.6877, test_loss: 1.1116, test_f1: 0.5322
 epoch: 48, train_loss: 0.7189, test_loss: 1.0869, test_f1: 0.5784
 epoch: 49, train_loss: 0.7589, test_loss: 0.9982, test_f1: 0.5115
 epoch: 50, train_loss: 0.7203, test_loss: 1.1106, test_f1: 0.5531
 epoch: 51, train_loss: 0.6835, test_loss: 1.0514, test_f1: 0.5708
 epoch: 52, train_loss: 0.6507, test_loss: 1.1411, test_f1: 0.5869
 epoch: 53, train_loss: 0.6430, test_loss: 1.1222, test_f1: 0.5924
 epoch: 54, train_loss: 0.6390, test_loss: 1.1628, test_f1: 0.5939
 epoch: 55, train_loss: 0.6579, test_loss: 1.0860, test_f1: 0.6107
 epoch: 56, train_loss: 0.6359, test_loss: 1.1107, test_f1: 0.5847
 epoch: 57, train_loss: 0.6414, test_loss: 1.1256, test_f1: 0.5622
 epoch: 58, train_loss: 0.6543, test_loss: 1.1034, test_f1: 0.5828
 epoch: 59, train_loss: 0.6983, test_loss: 1.0535, test_f1: 0.5939
 epoch: 60, train_loss: 0.6498, test_loss: 1.1234, test_f1: 0.5795
 epoch: 61, train_loss: 0.6407, test_loss: 1.1221, test_f1: 0.5988
 epoch: 62, train_loss: 0.6357, test_loss: 1.2339, test_f1: 0.5813
 epoch: 63, train_loss: 0.6239, test_loss: 1.1624, test_f1: 0.5902
 epoch: 64, train_loss: 0.6214, test_loss: 1.0909, test_f1: 0.6011
 epoch: 65, train_loss: 0.6241, test_loss: 1.1367, test_f1: 0.5798
 epoch: 66, train_loss: 0.6273, test_loss: 1.1328, test_f1: 0.5944
 epoch: 67, train_loss: 0.5923, test_loss: 1.2649, test_f1: 0.5562
 epoch: 68, train_loss: 0.6086, test_loss: 1.2021, test_f1: 0.5435
 epoch: 69, train_loss: 0.5812, test_loss: 1.1933, test_f1: 0.5959
 epoch: 70, train_loss: 0.5833, test_loss: 1.3425, test_f1: 0.5419
 epoch: 71, train_loss: 0.5902, test_loss: 1.2826, test_f1: 0.5737
 epoch: 72, train_loss: 0.5830, test_loss: 1.2285, test_f1: 0.5819
 epoch: 73, train_loss: 0.5787, test_loss: 1.1626, test_f1: 0.6167
 epoch: 74, train_loss: 0.5689, test_loss: 1.3133, test_f1: 0.6084
 epoch: 75, train_loss: 0.5823, test_loss: 1.2772, test_f1: 0.5656
 epoch: 76, train_loss: 0.5813, test_loss: 1.3083, test_f1: 0.5897
 epoch: 77, train_loss: 0.5586, test_loss: 1.2885, test_f1: 0.6012
 epoch: 78, train_loss: 0.6019, test_loss: 1.2157, test_f1: 0.5740
 epoch: 79, train_loss: 0.5647, test_loss: 1.2581, test_f1: 0.5951
 epoch: 80, train_loss: 0.5692, test_loss: 1.2383, test_f1: 0.5941
 epoch: 81, train_loss: 0.5828, test_loss: 1.1899, test_f1: 0.6046
 epoch: 82, train_loss: 0.5570, test_loss: 1.6061, test_f1: 0.6323
 epoch: 83, train_loss: 0.5733, test_loss: 1.3293, test_f1: 0.6083
 epoch: 84, train_loss: 0.5641, test_loss: 1.3585, test_f1: 0.6139
 epoch: 85, train_loss: 0.5814, test_loss: 1.3424, test_f1: 0.6192
 epoch: 86, train_loss: 0.5793, test_loss: 1.4330, test_f1: 0.5766
 epoch: 87, train_loss: 0.5729, test_loss: 1.2523, test_f1: 0.6375
 epoch: 88, train_loss: 0.5634, test_loss: 1.2234, test_f1: 0.6194
 epoch: 89, train_loss: 0.6023, test_loss: 1.2897, test_f1: 0.5362
 epoch: 90, train_loss: 0.6368, test_loss: 1.3110, test_f1: 0.5562
 epoch: 91, train_loss: 0.5729, test_loss: 1.3787, test_f1: 0.6099
 epoch: 92, train_loss: 0.5543, test_loss: 1.3180, test_f1: 0.5812
 epoch: 93, train_loss: 0.5447, test_loss: 1.3324, test_f1: 0.6000
 epoch: 94, train_loss: 0.5504, test_loss: 1.2576, test_f1: 0.6122
 epoch: 95, train_loss: 0.5603, test_loss: 1.3066, test_f1: 0.5871
 epoch: 96, train_loss: 0.5448, test_loss: 1.3605, test_f1: 0.5992
 epoch: 97, train_loss: 0.5366, test_loss: 1.2911, test_f1: 0.5951
 epoch: 98, train_loss: 0.5535, test_loss: 1.4333, test_f1: 0.5960
 epoch: 99, train_loss: 0.5186, test_loss: 1.4562, test_f1: 0.5821
##################ITERATION #6 ****************************************
 epoch: 0, train_loss: 1.2193, test_loss: 1.2611, test_f1: 0.3861
 epoch: 1, train_loss: 1.0603, test_loss: 1.0771, test_f1: 0.4726
 epoch: 2, train_loss: 1.0428, test_loss: 1.1046, test_f1: 0.4658
 epoch: 3, train_loss: 1.0003, test_loss: 1.1068, test_f1: 0.4781
 epoch: 4, train_loss: 1.0020, test_loss: 1.1879, test_f1: 0.4164
 epoch: 5, train_loss: 0.9633, test_loss: 1.0633, test_f1: 0.4966
 epoch: 6, train_loss: 0.9607, test_loss: 1.1343, test_f1: 0.5269
 epoch: 7, train_loss: 0.9646, test_loss: 1.1845, test_f1: 0.4677
 epoch: 8, train_loss: 0.9207, test_loss: 1.1100, test_f1: 0.5232
 epoch: 9, train_loss: 0.9180, test_loss: 1.0639, test_f1: 0.5102
 epoch: 10, train_loss: 0.9397, test_loss: 1.0330, test_f1: 0.5734
 epoch: 11, train_loss: 0.9111, test_loss: 1.0471, test_f1: 0.5529
 epoch: 12, train_loss: 0.9031, test_loss: 1.0052, test_f1: 0.5552
 epoch: 13, train_loss: 0.8813, test_loss: 1.0329, test_f1: 0.5649
 epoch: 14, train_loss: 0.8805, test_loss: 1.0325, test_f1: 0.5698
 epoch: 15, train_loss: 0.8614, test_loss: 0.9741, test_f1: 0.5942
 epoch: 16, train_loss: 0.8265, test_loss: 1.2312, test_f1: 0.4843
 epoch: 17, train_loss: 0.8234, test_loss: 1.0833, test_f1: 0.5578
 epoch: 18, train_loss: 0.8207, test_loss: 1.0810, test_f1: 0.5207
 epoch: 19, train_loss: 0.8146, test_loss: 1.2405, test_f1: 0.5189
 epoch: 20, train_loss: 0.7928, test_loss: 1.0773, test_f1: 0.5878
 epoch: 21, train_loss: 0.7808, test_loss: 1.0230, test_f1: 0.6082
 epoch: 22, train_loss: 0.8007, test_loss: 1.1552, test_f1: 0.5019
 epoch: 23, train_loss: 0.8019, test_loss: 1.1369, test_f1: 0.5537
 epoch: 24, train_loss: 0.7903, test_loss: 1.0956, test_f1: 0.5611
 epoch: 25, train_loss: 0.7748, test_loss: 1.0425, test_f1: 0.5784
 epoch: 26, train_loss: 0.7603, test_loss: 1.3720, test_f1: 0.5398
 epoch: 27, train_loss: 0.7937, test_loss: 1.0862, test_f1: 0.5564
 epoch: 28, train_loss: 0.8006, test_loss: 1.2434, test_f1: 0.5714
 epoch: 29, train_loss: 0.7681, test_loss: 1.2129, test_f1: 0.5720
 epoch: 30, train_loss: 0.7572, test_loss: 1.1246, test_f1: 0.5366
 epoch: 31, train_loss: 0.7231, test_loss: 1.2778, test_f1: 0.5529
 epoch: 32, train_loss: 0.7227, test_loss: 1.1090, test_f1: 0.5749
 epoch: 33, train_loss: 0.7311, test_loss: 1.1276, test_f1: 0.5352
 epoch: 34, train_loss: 0.7257, test_loss: 1.1114, test_f1: 0.5531
 epoch: 35, train_loss: 0.7035, test_loss: 1.1806, test_f1: 0.5071
 epoch: 36, train_loss: 0.7296, test_loss: 1.1185, test_f1: 0.5794
 epoch: 37, train_loss: 0.6879, test_loss: 1.1730, test_f1: 0.5328
 epoch: 38, train_loss: 0.7484, test_loss: 1.2080, test_f1: 0.5816
 epoch: 39, train_loss: 0.7105, test_loss: 1.5031, test_f1: 0.5421
 epoch: 40, train_loss: 0.7133, test_loss: 1.1996, test_f1: 0.5798
 epoch: 41, train_loss: 0.7099, test_loss: 1.1194, test_f1: 0.5702
 epoch: 42, train_loss: 0.6717, test_loss: 1.1413, test_f1: 0.5834
 epoch: 43, train_loss: 0.6763, test_loss: 1.2548, test_f1: 0.5278
 epoch: 44, train_loss: 0.6780, test_loss: 1.1393, test_f1: 0.5979
 epoch: 45, train_loss: 0.6871, test_loss: 1.2790, test_f1: 0.5699
 epoch: 46, train_loss: 0.6951, test_loss: 1.1654, test_f1: 0.5626
 epoch: 47, train_loss: 0.6927, test_loss: 1.1730, test_f1: 0.6131
 epoch: 48, train_loss: 0.6693, test_loss: 1.4349, test_f1: 0.4701
 epoch: 49, train_loss: 0.6763, test_loss: 1.5617, test_f1: 0.4966
 epoch: 50, train_loss: 0.6689, test_loss: 1.3742, test_f1: 0.5563
 epoch: 51, train_loss: 0.6417, test_loss: 1.3588, test_f1: 0.5740
 epoch: 52, train_loss: 0.6107, test_loss: 1.2793, test_f1: 0.5895
 epoch: 53, train_loss: 0.6073, test_loss: 1.1762, test_f1: 0.6108
 epoch: 54, train_loss: 0.6174, test_loss: 1.1988, test_f1: 0.6643
 epoch: 55, train_loss: 0.6143, test_loss: 1.2544, test_f1: 0.6164
 epoch: 56, train_loss: 0.5999, test_loss: 1.2525, test_f1: 0.6189
 epoch: 57, train_loss: 0.6187, test_loss: 1.2370, test_f1: 0.6292
 epoch: 58, train_loss: 0.6039, test_loss: 1.2564, test_f1: 0.6253
 epoch: 59, train_loss: 0.5906, test_loss: 1.2879, test_f1: 0.6258
 epoch: 60, train_loss: 0.6032, test_loss: 1.3480, test_f1: 0.6050
 epoch: 61, train_loss: 0.6007, test_loss: 1.3538, test_f1: 0.6154
 epoch: 62, train_loss: 0.5891, test_loss: 1.3957, test_f1: 0.5959
 epoch: 63, train_loss: 0.5819, test_loss: 1.3863, test_f1: 0.5660
 epoch: 64, train_loss: 0.6056, test_loss: 1.4594, test_f1: 0.5871
 epoch: 65, train_loss: 0.5744, test_loss: 1.4655, test_f1: 0.5953
 epoch: 66, train_loss: 0.5816, test_loss: 1.5097, test_f1: 0.6166
 epoch: 67, train_loss: 0.5793, test_loss: 1.3251, test_f1: 0.6335
 epoch: 68, train_loss: 0.5603, test_loss: 1.3744, test_f1: 0.6434
 epoch: 69, train_loss: 0.5638, test_loss: 1.3824, test_f1: 0.5810
 epoch: 70, train_loss: 0.5895, test_loss: 1.3400, test_f1: 0.6510
 epoch: 71, train_loss: 0.5728, test_loss: 1.3998, test_f1: 0.6263
 epoch: 72, train_loss: 0.5673, test_loss: 1.3989, test_f1: 0.6018
 epoch: 73, train_loss: 0.5354, test_loss: 1.4200, test_f1: 0.5817
 epoch: 74, train_loss: 0.5718, test_loss: 1.4975, test_f1: 0.5862
 epoch: 75, train_loss: 0.5645, test_loss: 1.4546, test_f1: 0.6148
 epoch: 76, train_loss: 0.5670, test_loss: 1.4926, test_f1: 0.6073
 epoch: 77, train_loss: 0.5282, test_loss: 1.4982, test_f1: 0.6482
 epoch: 78, train_loss: 0.5936, test_loss: 1.3264, test_f1: 0.6533
 epoch: 79, train_loss: 0.5422, test_loss: 1.4598, test_f1: 0.5978
 epoch: 80, train_loss: 0.5468, test_loss: 1.4676, test_f1: 0.5984
 epoch: 81, train_loss: 0.5260, test_loss: 1.4731, test_f1: 0.6245
 epoch: 82, train_loss: 0.5408, test_loss: 1.5028, test_f1: 0.6258
 epoch: 83, train_loss: 0.5310, test_loss: 1.6152, test_f1: 0.6296
 epoch: 84, train_loss: 0.5429, test_loss: 1.4365, test_f1: 0.5873
 epoch: 85, train_loss: 0.5063, test_loss: 1.6524, test_f1: 0.6371
 epoch: 86, train_loss: 0.5076, test_loss: 1.5612, test_f1: 0.6090
 epoch: 87, train_loss: 0.5315, test_loss: 1.6235, test_f1: 0.6361
 epoch: 88, train_loss: 0.5192, test_loss: 1.4919, test_f1: 0.6213
 epoch: 89, train_loss: 0.5408, test_loss: 1.4575, test_f1: 0.6137
 epoch: 90, train_loss: 0.5417, test_loss: 1.3939, test_f1: 0.6127
 epoch: 91, train_loss: 0.5415, test_loss: 1.4971, test_f1: 0.6468
 epoch: 92, train_loss: 0.5181, test_loss: 1.5759, test_f1: 0.6120
 epoch: 93, train_loss: 0.5135, test_loss: 1.4697, test_f1: 0.6271
 epoch: 94, train_loss: 0.5147, test_loss: 1.4648, test_f1: 0.6015
 epoch: 95, train_loss: 0.5242, test_loss: 1.4635, test_f1: 0.6598
 epoch: 96, train_loss: 0.5304, test_loss: 1.4537, test_f1: 0.6274
 epoch: 97, train_loss: 0.5196, test_loss: 1.5168, test_f1: 0.6231
 epoch: 98, train_loss: 0.5137, test_loss: 1.5484, test_f1: 0.6370
 epoch: 99, train_loss: 0.5094, test_loss: 1.5759, test_f1: 0.5967
##################ITERATION #7 ****************************************
 epoch: 0, train_loss: 1.2157, test_loss: 1.1568, test_f1: 0.4571
 epoch: 1, train_loss: 1.0933, test_loss: 1.1013, test_f1: 0.4864
 epoch: 2, train_loss: 1.0544, test_loss: 1.1144, test_f1: 0.4604
 epoch: 3, train_loss: 1.0148, test_loss: 1.0848, test_f1: 0.4506
 epoch: 4, train_loss: 0.9976, test_loss: 1.1099, test_f1: 0.4875
 epoch: 5, train_loss: 0.9676, test_loss: 1.1242, test_f1: 0.4893
 epoch: 6, train_loss: 0.9681, test_loss: 1.0616, test_f1: 0.5106
 epoch: 7, train_loss: 0.9647, test_loss: 1.0469, test_f1: 0.4643
 epoch: 8, train_loss: 0.9621, test_loss: 1.0486, test_f1: 0.5108
 epoch: 9, train_loss: 0.9689, test_loss: 1.1452, test_f1: 0.5301
 epoch: 10, train_loss: 0.9662, test_loss: 1.0229, test_f1: 0.5035
 epoch: 11, train_loss: 0.9464, test_loss: 1.0278, test_f1: 0.5196
 epoch: 12, train_loss: 0.9511, test_loss: 1.0435, test_f1: 0.4935
 epoch: 13, train_loss: 0.9379, test_loss: 1.0393, test_f1: 0.5156
 epoch: 14, train_loss: 0.9167, test_loss: 1.0553, test_f1: 0.5364
 epoch: 15, train_loss: 0.9606, test_loss: 1.0186, test_f1: 0.5064
 epoch: 16, train_loss: 0.9344, test_loss: 1.0532, test_f1: 0.4945
 epoch: 17, train_loss: 0.9225, test_loss: 1.0699, test_f1: 0.5058
 epoch: 18, train_loss: 0.9086, test_loss: 1.1452, test_f1: 0.5186
 epoch: 19, train_loss: 0.9127, test_loss: 1.1438, test_f1: 0.4936
 epoch: 20, train_loss: 0.9193, test_loss: 1.0368, test_f1: 0.5030
 epoch: 21, train_loss: 0.9044, test_loss: 1.0948, test_f1: 0.5371
 epoch: 22, train_loss: 0.9536, test_loss: 1.0304, test_f1: 0.5538
 epoch: 23, train_loss: 0.9159, test_loss: 1.0300, test_f1: 0.5046
 epoch: 24, train_loss: 0.8998, test_loss: 1.0786, test_f1: 0.5604
 epoch: 25, train_loss: 0.9011, test_loss: 1.1340, test_f1: 0.3882
 epoch: 26, train_loss: 0.8845, test_loss: 1.0678, test_f1: 0.4551
 epoch: 27, train_loss: 0.8635, test_loss: 1.0751, test_f1: 0.5467
 epoch: 28, train_loss: 0.8728, test_loss: 1.0758, test_f1: 0.5469
 epoch: 29, train_loss: 0.8534, test_loss: 1.1425, test_f1: 0.5025
 epoch: 30, train_loss: 0.8648, test_loss: 1.1330, test_f1: 0.5223
 epoch: 31, train_loss: 0.8465, test_loss: 1.0047, test_f1: 0.5555
 epoch: 32, train_loss: 0.8482, test_loss: 1.0901, test_f1: 0.5100
 epoch: 33, train_loss: 0.8403, test_loss: 1.0409, test_f1: 0.5538
 epoch: 34, train_loss: 0.8651, test_loss: 1.0460, test_f1: 0.5442
 epoch: 35, train_loss: 0.8362, test_loss: 1.1654, test_f1: 0.5208
 epoch: 36, train_loss: 0.8345, test_loss: 1.0611, test_f1: 0.5341
 epoch: 37, train_loss: 0.8090, test_loss: 1.1368, test_f1: 0.5484
 epoch: 38, train_loss: 0.7961, test_loss: 1.0671, test_f1: 0.5726
 epoch: 39, train_loss: 0.8191, test_loss: 1.0935, test_f1: 0.5520
 epoch: 40, train_loss: 0.7991, test_loss: 1.1418, test_f1: 0.5335
 epoch: 41, train_loss: 0.7949, test_loss: 1.0604, test_f1: 0.5219
 epoch: 42, train_loss: 0.7738, test_loss: 1.0919, test_f1: 0.5759
 epoch: 43, train_loss: 0.7837, test_loss: 1.2760, test_f1: 0.5366
 epoch: 44, train_loss: 0.7879, test_loss: 1.1387, test_f1: 0.5325
 epoch: 45, train_loss: 0.7673, test_loss: 1.1452, test_f1: 0.5907
 epoch: 46, train_loss: 0.7673, test_loss: 1.2927, test_f1: 0.5004
 epoch: 47, train_loss: 0.7419, test_loss: 1.2949, test_f1: 0.5558
 epoch: 48, train_loss: 0.7606, test_loss: 1.2491, test_f1: 0.5493
 epoch: 49, train_loss: 0.7353, test_loss: 2.2069, test_f1: 0.3975
 epoch: 50, train_loss: 0.7617, test_loss: 1.1260, test_f1: 0.5978
 epoch: 51, train_loss: 0.7171, test_loss: 1.1746, test_f1: 0.5675
 epoch: 52, train_loss: 0.6930, test_loss: 1.2445, test_f1: 0.5844
 epoch: 53, train_loss: 0.6818, test_loss: 1.2040, test_f1: 0.6151
 epoch: 54, train_loss: 0.7037, test_loss: 1.2022, test_f1: 0.6007
 epoch: 55, train_loss: 0.6724, test_loss: 1.3577, test_f1: 0.5722
 epoch: 56, train_loss: 0.6752, test_loss: 1.2267, test_f1: 0.5594
 epoch: 57, train_loss: 0.6746, test_loss: 1.3825, test_f1: 0.5684
 epoch: 58, train_loss: 0.6523, test_loss: 1.2666, test_f1: 0.5927
 epoch: 59, train_loss: 0.6392, test_loss: 1.3235, test_f1: 0.6084
 epoch: 60, train_loss: 0.6451, test_loss: 1.2954, test_f1: 0.5638
 epoch: 61, train_loss: 0.6653, test_loss: 1.2495, test_f1: 0.5853
 epoch: 62, train_loss: 0.6298, test_loss: 1.1890, test_f1: 0.5952
 epoch: 63, train_loss: 0.6541, test_loss: 1.4083, test_f1: 0.5690
 epoch: 64, train_loss: 0.6428, test_loss: 1.1929, test_f1: 0.6094
 epoch: 65, train_loss: 0.6279, test_loss: 1.2310, test_f1: 0.5674
 epoch: 66, train_loss: 0.6107, test_loss: 1.2729, test_f1: 0.5706
 epoch: 67, train_loss: 0.6125, test_loss: 1.5249, test_f1: 0.5676
 epoch: 68, train_loss: 0.6226, test_loss: 1.3879, test_f1: 0.5498
 epoch: 69, train_loss: 0.6203, test_loss: 1.2389, test_f1: 0.6042
 epoch: 70, train_loss: 0.6628, test_loss: 1.3072, test_f1: 0.5568
 epoch: 71, train_loss: 0.6683, test_loss: 1.1581, test_f1: 0.5897
 epoch: 72, train_loss: 0.6072, test_loss: 1.2388, test_f1: 0.6039
 epoch: 73, train_loss: 0.5821, test_loss: 1.3112, test_f1: 0.5590
 epoch: 74, train_loss: 0.5904, test_loss: 1.4103, test_f1: 0.5852
 epoch: 75, train_loss: 0.5981, test_loss: 1.2863, test_f1: 0.5855
 epoch: 76, train_loss: 0.6199, test_loss: 1.3614, test_f1: 0.5735
 epoch: 77, train_loss: 0.6135, test_loss: 1.3823, test_f1: 0.5216
 epoch: 78, train_loss: 0.5787, test_loss: 1.4019, test_f1: 0.6195
 epoch: 79, train_loss: 0.5780, test_loss: 1.4206, test_f1: 0.5766
 epoch: 80, train_loss: 0.5761, test_loss: 1.3307, test_f1: 0.5721
 epoch: 81, train_loss: 0.5953, test_loss: 1.2430, test_f1: 0.6358
 epoch: 82, train_loss: 0.5979, test_loss: 1.2801, test_f1: 0.6038
 epoch: 83, train_loss: 0.5750, test_loss: 1.2957, test_f1: 0.5951
 epoch: 84, train_loss: 0.5736, test_loss: 1.2352, test_f1: 0.5860
 epoch: 85, train_loss: 0.5766, test_loss: 1.3398, test_f1: 0.6042
 epoch: 86, train_loss: 0.5875, test_loss: 1.3187, test_f1: 0.6141
 epoch: 87, train_loss: 0.5550, test_loss: 1.3849, test_f1: 0.6061
 epoch: 88, train_loss: 0.5561, test_loss: 1.4580, test_f1: 0.5936
 epoch: 89, train_loss: 0.5534, test_loss: 1.3815, test_f1: 0.6167
 epoch: 90, train_loss: 0.5599, test_loss: 1.3598, test_f1: 0.6114
 epoch: 91, train_loss: 0.5456, test_loss: 1.4129, test_f1: 0.6104
 epoch: 92, train_loss: 0.5637, test_loss: 1.3929, test_f1: 0.6253
 epoch: 93, train_loss: 0.5395, test_loss: 1.6222, test_f1: 0.5893
 epoch: 94, train_loss: 0.5372, test_loss: 1.4845, test_f1: 0.5945
 epoch: 95, train_loss: 0.5433, test_loss: 1.4453, test_f1: 0.6009
 epoch: 96, train_loss: 0.5400, test_loss: 1.4610, test_f1: 0.6063
 epoch: 97, train_loss: 0.5597, test_loss: 1.3739, test_f1: 0.6230
 epoch: 98, train_loss: 0.5567, test_loss: 1.4654, test_f1: 0.5805
 epoch: 99, train_loss: 0.5451, test_loss: 1.4747, test_f1: 0.6019
##################ITERATION #8 ****************************************
 epoch: 0, train_loss: 1.2580, test_loss: 1.2448, test_f1: 0.3571
 epoch: 1, train_loss: 1.0305, test_loss: 1.0903, test_f1: 0.3766
 epoch: 2, train_loss: 0.9781, test_loss: 1.0506, test_f1: 0.5336
 epoch: 3, train_loss: 0.9836, test_loss: 1.0706, test_f1: 0.5236
 epoch: 4, train_loss: 0.9743, test_loss: 1.0338, test_f1: 0.5130
 epoch: 5, train_loss: 0.9714, test_loss: 1.0657, test_f1: 0.5444
 epoch: 6, train_loss: 0.9542, test_loss: 1.0262, test_f1: 0.5418
 epoch: 7, train_loss: 0.9151, test_loss: 1.0953, test_f1: 0.5510
 epoch: 8, train_loss: 0.9631, test_loss: 1.1242, test_f1: 0.5266
 epoch: 9, train_loss: 0.9188, test_loss: 1.0671, test_f1: 0.5476
 epoch: 10, train_loss: 0.9194, test_loss: 1.1569, test_f1: 0.5180
 epoch: 11, train_loss: 0.8981, test_loss: 1.0233, test_f1: 0.5662
 epoch: 12, train_loss: 0.8760, test_loss: 1.1911, test_f1: 0.5175
 epoch: 13, train_loss: 0.8734, test_loss: 1.0015, test_f1: 0.5447
 epoch: 14, train_loss: 0.8680, test_loss: 1.0190, test_f1: 0.5484
 epoch: 15, train_loss: 0.8333, test_loss: 1.0955, test_f1: 0.5722
 epoch: 16, train_loss: 0.8609, test_loss: 1.0753, test_f1: 0.5323
 epoch: 17, train_loss: 0.8345, test_loss: 1.1556, test_f1: 0.4896
 epoch: 18, train_loss: 0.8411, test_loss: 1.0332, test_f1: 0.5693
 epoch: 19, train_loss: 0.8135, test_loss: 1.0332, test_f1: 0.5699
 epoch: 20, train_loss: 0.7820, test_loss: 1.0753, test_f1: 0.5625
 epoch: 21, train_loss: 0.8036, test_loss: 1.1190, test_f1: 0.5465
 epoch: 22, train_loss: 0.8079, test_loss: 1.0218, test_f1: 0.5570
 epoch: 23, train_loss: 0.7748, test_loss: 1.1104, test_f1: 0.5331
 epoch: 24, train_loss: 0.7670, test_loss: 1.1288, test_f1: 0.5369
 epoch: 25, train_loss: 0.8013, test_loss: 1.0122, test_f1: 0.5618
 epoch: 26, train_loss: 0.7492, test_loss: 1.1466, test_f1: 0.5475
 epoch: 27, train_loss: 0.7573, test_loss: 1.1239, test_f1: 0.5811
 epoch: 28, train_loss: 0.7329, test_loss: 1.1870, test_f1: 0.5093
 epoch: 29, train_loss: 0.7378, test_loss: 1.1398, test_f1: 0.5681
 epoch: 30, train_loss: 0.7428, test_loss: 1.1139, test_f1: 0.5408
 epoch: 31, train_loss: 0.7425, test_loss: 1.0569, test_f1: 0.5847
 epoch: 32, train_loss: 0.7380, test_loss: 1.0098, test_f1: 0.5997
 epoch: 33, train_loss: 0.7226, test_loss: 1.1054, test_f1: 0.5565
 epoch: 34, train_loss: 0.7543, test_loss: 1.0977, test_f1: 0.5282
 epoch: 35, train_loss: 0.7285, test_loss: 1.0429, test_f1: 0.5869
 epoch: 36, train_loss: 0.7209, test_loss: 1.0705, test_f1: 0.4971
 epoch: 37, train_loss: 0.7237, test_loss: 1.0646, test_f1: 0.5657
 epoch: 38, train_loss: 0.7214, test_loss: 0.9356, test_f1: 0.6501
 epoch: 39, train_loss: 0.7082, test_loss: 1.1473, test_f1: 0.5984
 epoch: 40, train_loss: 0.7071, test_loss: 1.0257, test_f1: 0.6000
 epoch: 41, train_loss: 0.6953, test_loss: 1.0717, test_f1: 0.5774
 epoch: 42, train_loss: 0.6875, test_loss: 1.0865, test_f1: 0.5669
 epoch: 43, train_loss: 0.6673, test_loss: 1.0939, test_f1: 0.5976
 epoch: 44, train_loss: 0.6788, test_loss: 1.1060, test_f1: 0.5649
 epoch: 45, train_loss: 0.6678, test_loss: 1.0209, test_f1: 0.6210
 epoch: 46, train_loss: 0.6793, test_loss: 0.9970, test_f1: 0.6214
 epoch: 47, train_loss: 0.6657, test_loss: 1.2380, test_f1: 0.5813
 epoch: 48, train_loss: 0.6609, test_loss: 1.1832, test_f1: 0.5937
 epoch: 49, train_loss: 0.6521, test_loss: 1.0942, test_f1: 0.5974
 epoch: 50, train_loss: 0.6201, test_loss: 1.1461, test_f1: 0.6468
 epoch: 51, train_loss: 0.6156, test_loss: 1.1569, test_f1: 0.6071
 epoch: 52, train_loss: 0.6157, test_loss: 1.0950, test_f1: 0.6137
 epoch: 53, train_loss: 0.5531, test_loss: 1.1561, test_f1: 0.6177
 epoch: 54, train_loss: 0.5958, test_loss: 1.2537, test_f1: 0.6103
 epoch: 55, train_loss: 0.5935, test_loss: 1.1341, test_f1: 0.6370
 epoch: 56, train_loss: 0.6047, test_loss: 1.0946, test_f1: 0.6544
 epoch: 57, train_loss: 0.5745, test_loss: 1.0774, test_f1: 0.6154
 epoch: 58, train_loss: 0.5770, test_loss: 1.1582, test_f1: 0.6179
 epoch: 59, train_loss: 0.5658, test_loss: 1.2440, test_f1: 0.6425
 epoch: 60, train_loss: 0.5490, test_loss: 1.1370, test_f1: 0.5927
 epoch: 61, train_loss: 0.5489, test_loss: 1.1675, test_f1: 0.6123
 epoch: 62, train_loss: 0.5755, test_loss: 1.2570, test_f1: 0.5600
 epoch: 63, train_loss: 0.5640, test_loss: 1.1598, test_f1: 0.5916
 epoch: 64, train_loss: 0.5464, test_loss: 1.3350, test_f1: 0.5792
 epoch: 65, train_loss: 0.5370, test_loss: 1.3666, test_f1: 0.5910
 epoch: 66, train_loss: 0.5484, test_loss: 1.2468, test_f1: 0.5580
 epoch: 67, train_loss: 0.5439, test_loss: 1.1091, test_f1: 0.6450
 epoch: 68, train_loss: 0.5387, test_loss: 1.1496, test_f1: 0.6120
 epoch: 69, train_loss: 0.5201, test_loss: 1.2341, test_f1: 0.6169
 epoch: 70, train_loss: 0.5553, test_loss: 1.1541, test_f1: 0.6131
 epoch: 71, train_loss: 0.5445, test_loss: 1.1910, test_f1: 0.6228
 epoch: 72, train_loss: 0.5204, test_loss: 1.1644, test_f1: 0.6288
 epoch: 73, train_loss: 0.4989, test_loss: 1.2518, test_f1: 0.6104
 epoch: 74, train_loss: 0.5564, test_loss: 1.1575, test_f1: 0.6396
 epoch: 75, train_loss: 0.5308, test_loss: 1.2825, test_f1: 0.5975
 epoch: 76, train_loss: 0.5101, test_loss: 1.2990, test_f1: 0.6282
 epoch: 77, train_loss: 0.5376, test_loss: 1.2228, test_f1: 0.6407
 epoch: 78, train_loss: 0.5118, test_loss: 1.2004, test_f1: 0.5957
 epoch: 79, train_loss: 0.5308, test_loss: 1.3940, test_f1: 0.5966
 epoch: 80, train_loss: 0.5183, test_loss: 1.3369, test_f1: 0.6019
 epoch: 81, train_loss: 0.5005, test_loss: 1.2991, test_f1: 0.6709
 epoch: 82, train_loss: 0.5267, test_loss: 1.3055, test_f1: 0.6061
 epoch: 83, train_loss: 0.4927, test_loss: 1.3312, test_f1: 0.6001
 epoch: 84, train_loss: 0.4953, test_loss: 1.3820, test_f1: 0.5616
 epoch: 85, train_loss: 0.5098, test_loss: 1.2448, test_f1: 0.6221
 epoch: 86, train_loss: 0.5195, test_loss: 1.1899, test_f1: 0.6174
 epoch: 87, train_loss: 0.5039, test_loss: 1.4004, test_f1: 0.6236
 epoch: 88, train_loss: 0.4930, test_loss: 1.2782, test_f1: 0.6369
 epoch: 89, train_loss: 0.5018, test_loss: 1.3479, test_f1: 0.6483
 epoch: 90, train_loss: 0.5133, test_loss: 1.2382, test_f1: 0.6299
 epoch: 91, train_loss: 0.4678, test_loss: 1.2617, test_f1: 0.6325
 epoch: 92, train_loss: 0.5107, test_loss: 1.3792, test_f1: 0.6316
 epoch: 93, train_loss: 0.5102, test_loss: 1.2987, test_f1: 0.5848
 epoch: 94, train_loss: 0.4825, test_loss: 1.2910, test_f1: 0.6349
 epoch: 95, train_loss: 0.4662, test_loss: 1.5380, test_f1: 0.5417
 epoch: 96, train_loss: 0.4875, test_loss: 1.2699, test_f1: 0.6120
 epoch: 97, train_loss: 0.4788, test_loss: 1.3076, test_f1: 0.6041
 epoch: 98, train_loss: 0.4874, test_loss: 1.3377, test_f1: 0.6120
 epoch: 99, train_loss: 0.4983, test_loss: 1.3146, test_f1: 0.5758
##################ITERATION #9 ****************************************
 epoch: 0, train_loss: 1.2187, test_loss: 1.2398, test_f1: 0.4151
 epoch: 1, train_loss: 1.0600, test_loss: 1.0690, test_f1: 0.4984
 epoch: 2, train_loss: 1.0179, test_loss: 1.1024, test_f1: 0.4663
 epoch: 3, train_loss: 0.9906, test_loss: 1.0858, test_f1: 0.4708
 epoch: 4, train_loss: 0.9674, test_loss: 1.1121, test_f1: 0.4268
 epoch: 5, train_loss: 0.9875, test_loss: 1.1069, test_f1: 0.4387
 epoch: 6, train_loss: 0.9754, test_loss: 1.0298, test_f1: 0.4946
 epoch: 7, train_loss: 0.9476, test_loss: 0.9837, test_f1: 0.5074
 epoch: 8, train_loss: 0.9382, test_loss: 1.0141, test_f1: 0.4852
 epoch: 9, train_loss: 0.9320, test_loss: 1.0368, test_f1: 0.5123
 epoch: 10, train_loss: 0.9554, test_loss: 1.1708, test_f1: 0.4918
 epoch: 11, train_loss: 0.9384, test_loss: 0.9957, test_f1: 0.5328
 epoch: 12, train_loss: 0.9281, test_loss: 1.1088, test_f1: 0.4822
 epoch: 13, train_loss: 0.9454, test_loss: 1.2502, test_f1: 0.4586
 epoch: 14, train_loss: 0.9227, test_loss: 1.0081, test_f1: 0.5678
 epoch: 15, train_loss: 0.9226, test_loss: 1.0854, test_f1: 0.5038
 epoch: 16, train_loss: 0.9024, test_loss: 1.0409, test_f1: 0.4776
 epoch: 17, train_loss: 0.9053, test_loss: 1.0322, test_f1: 0.5390
 epoch: 18, train_loss: 0.8878, test_loss: 1.0016, test_f1: 0.5313
 epoch: 19, train_loss: 0.8905, test_loss: 1.0435, test_f1: 0.5630
 epoch: 20, train_loss: 0.8959, test_loss: 1.0373, test_f1: 0.5472
 epoch: 21, train_loss: 0.9045, test_loss: 1.0363, test_f1: 0.5546
 epoch: 22, train_loss: 0.8832, test_loss: 0.9792, test_f1: 0.5626
 epoch: 23, train_loss: 0.8802, test_loss: 1.2503, test_f1: 0.4187
 epoch: 24, train_loss: 0.8768, test_loss: 1.0429, test_f1: 0.5767
 epoch: 25, train_loss: 0.8811, test_loss: 0.9529, test_f1: 0.5504
 epoch: 26, train_loss: 0.8552, test_loss: 1.0388, test_f1: 0.5497
 epoch: 27, train_loss: 0.8368, test_loss: 1.0275, test_f1: 0.5763
 epoch: 28, train_loss: 0.8279, test_loss: 1.0367, test_f1: 0.5835
 epoch: 29, train_loss: 0.8181, test_loss: 1.0648, test_f1: 0.5286
 epoch: 30, train_loss: 0.8223, test_loss: 1.0729, test_f1: 0.4781
 epoch: 31, train_loss: 0.8149, test_loss: 1.0569, test_f1: 0.5517
 epoch: 32, train_loss: 0.8001, test_loss: 1.1054, test_f1: 0.5495
 epoch: 33, train_loss: 0.7805, test_loss: 1.1305, test_f1: 0.5507
 epoch: 34, train_loss: 0.7877, test_loss: 1.3493, test_f1: 0.5151
 epoch: 35, train_loss: 0.7742, test_loss: 1.0222, test_f1: 0.5534
 epoch: 36, train_loss: 0.7969, test_loss: 1.2474, test_f1: 0.4883
 epoch: 37, train_loss: 0.7591, test_loss: 1.2298, test_f1: 0.5318
 epoch: 38, train_loss: 0.8055, test_loss: 1.1063, test_f1: 0.5684
 epoch: 39, train_loss: 0.7812, test_loss: 1.2424, test_f1: 0.5078
 epoch: 40, train_loss: 0.7531, test_loss: 1.0559, test_f1: 0.5271
 epoch: 41, train_loss: 0.7533, test_loss: 1.0688, test_f1: 0.5799
 epoch: 42, train_loss: 0.7737, test_loss: 1.0903, test_f1: 0.6050
 epoch: 43, train_loss: 0.7326, test_loss: 1.0552, test_f1: 0.4961
 epoch: 44, train_loss: 0.7329, test_loss: 1.0695, test_f1: 0.5688
 epoch: 45, train_loss: 0.7310, test_loss: 1.0596, test_f1: 0.5523
 epoch: 46, train_loss: 0.7326, test_loss: 1.0508, test_f1: 0.5430
 epoch: 47, train_loss: 0.7176, test_loss: 1.0319, test_f1: 0.5454
 epoch: 48, train_loss: 0.7153, test_loss: 1.1092, test_f1: 0.5454
 epoch: 49, train_loss: 0.7049, test_loss: 1.1295, test_f1: 0.5816
 epoch: 50, train_loss: 0.6594, test_loss: 1.0461, test_f1: 0.6112
 epoch: 51, train_loss: 0.6645, test_loss: 1.1481, test_f1: 0.5520
 epoch: 52, train_loss: 0.6612, test_loss: 1.0911, test_f1: 0.6253
 epoch: 53, train_loss: 0.6419, test_loss: 1.2774, test_f1: 0.5396
 epoch: 54, train_loss: 0.6321, test_loss: 1.1309, test_f1: 0.6031
 epoch: 55, train_loss: 0.6327, test_loss: 1.1917, test_f1: 0.4925
 epoch: 56, train_loss: 0.6186, test_loss: 1.1405, test_f1: 0.6212
 epoch: 57, train_loss: 0.6118, test_loss: 1.1355, test_f1: 0.5687
 epoch: 58, train_loss: 0.6279, test_loss: 1.3579, test_f1: 0.5698
 epoch: 59, train_loss: 0.6184, test_loss: 1.3636, test_f1: 0.5626
 epoch: 60, train_loss: 0.6201, test_loss: 1.1101, test_f1: 0.6037
 epoch: 61, train_loss: 0.6169, test_loss: 1.2122, test_f1: 0.5784
 epoch: 62, train_loss: 0.5999, test_loss: 1.2557, test_f1: 0.5782
 epoch: 63, train_loss: 0.6010, test_loss: 1.2405, test_f1: 0.5496
 epoch: 64, train_loss: 0.6149, test_loss: 1.5003, test_f1: 0.5170
 epoch: 65, train_loss: 0.6026, test_loss: 1.3091, test_f1: 0.5401
 epoch: 66, train_loss: 0.5950, test_loss: 1.3608, test_f1: 0.5107
 epoch: 67, train_loss: 0.6038, test_loss: 1.7385, test_f1: 0.5436
 epoch: 68, train_loss: 0.5956, test_loss: 1.3383, test_f1: 0.5051
 epoch: 69, train_loss: 0.5736, test_loss: 1.2944, test_f1: 0.5233
 epoch: 70, train_loss: 0.5959, test_loss: 1.2604, test_f1: 0.5913
 epoch: 71, train_loss: 0.5704, test_loss: 1.3032, test_f1: 0.5514
 epoch: 72, train_loss: 0.5446, test_loss: 1.4751, test_f1: 0.5859
 epoch: 73, train_loss: 0.5611, test_loss: 1.3306, test_f1: 0.6142
 epoch: 74, train_loss: 0.5555, test_loss: 1.3954, test_f1: 0.5785
 epoch: 75, train_loss: 0.5656, test_loss: 1.4699, test_f1: 0.5983
 epoch: 76, train_loss: 0.5754, test_loss: 1.5677, test_f1: 0.5950
 epoch: 77, train_loss: 0.5719, test_loss: 1.4115, test_f1: 0.5539
 epoch: 78, train_loss: 0.5709, test_loss: 1.3505, test_f1: 0.5814
 epoch: 79, train_loss: 0.5556, test_loss: 1.3879, test_f1: 0.5463
 epoch: 80, train_loss: 0.5592, test_loss: 1.3827, test_f1: 0.5653
 epoch: 81, train_loss: 0.5229, test_loss: 1.4058, test_f1: 0.5598
 epoch: 82, train_loss: 0.5338, test_loss: 1.4628, test_f1: 0.5793
 epoch: 83, train_loss: 0.5488, test_loss: 1.3248, test_f1: 0.5971
 epoch: 84, train_loss: 0.5608, test_loss: 1.2696, test_f1: 0.5877
 epoch: 85, train_loss: 0.5565, test_loss: 1.3970, test_f1: 0.5941
 epoch: 86, train_loss: 0.5178, test_loss: 1.4202, test_f1: 0.5805
 epoch: 87, train_loss: 0.5294, test_loss: 1.4555, test_f1: 0.6096
 epoch: 88, train_loss: 0.5258, test_loss: 1.5257, test_f1: 0.6040
 epoch: 89, train_loss: 0.5387, test_loss: 1.6310, test_f1: 0.5921
 epoch: 90, train_loss: 0.5460, test_loss: 1.9668, test_f1: 0.5768
 epoch: 91, train_loss: 0.5260, test_loss: 1.4254, test_f1: 0.5721
 epoch: 92, train_loss: 0.5383, test_loss: 1.5019, test_f1: 0.5942
 epoch: 93, train_loss: 0.5444, test_loss: 1.5140, test_f1: 0.6184
 epoch: 94, train_loss: 0.5289, test_loss: 1.7524, test_f1: 0.6017
 epoch: 95, train_loss: 0.5130, test_loss: 1.7110, test_f1: 0.5805
 epoch: 96, train_loss: 0.5298, test_loss: 1.6003, test_f1: 0.5576
 epoch: 97, train_loss: 0.5273, test_loss: 1.3831, test_f1: 0.6088
 epoch: 98, train_loss: 0.5009, test_loss: 1.5934, test_f1: 0.5334
 epoch: 99, train_loss: 0.5179, test_loss: 1.7033, test_f1: 0.5898

Training completed in 975.10 seconds
Best F1: 0.6709 at epoch 81
Mean F1 across iterations: 0.6425  0.0179
========================FINAL RESULTS================================
FEGIN weighted F1: 0.6709  0.0179
python main.py --data ltspice_demos --representation component_net --model FEGIN --layers 4 --hiddens 32 --batch_size 32 --lr 0.01 --emb_size 128 --epochs 100 --save_appendix component_net_L4_H32_BS32_LR0.01_E128 --no_val
-----



STDERR:
  File "main.py", line 370, in <module>
    main()
  File "main.py", line 254, in main
    dataset = dataset_class(
  File "/home/philip/projects/ltspice_examples_code_repo/Circuit-Completion-Using-GNNs/component_classification_with_link_prediction_head/evaluation/FEGIN/kernel/circuit_datasets.py", line 15, in __init__
    self.data, self.slices = torch.load(self.processed_paths[0])
  File "/home/philip/.local/lib/python3.8/site-packages/torch/serialization.py", line 1040, in load
    warnings.warn(
  File "/usr/lib/python3.8/warnings.py", line 109, in _showwarnmsg
    sw(msg.message, msg.category, msg.filename, msg.lineno,
  File "main.py", line 47, in warn_with_traceback
    traceback.print_stack(file=log)
/home/philip/projects/ltspice_examples_code_repo/Circuit-Completion-Using-GNNs/component_classification_with_link_prediction_head/evaluation/FEGIN/kernel/circuit_datasets.py:15: FutureWarning: You are using `torch.load` with `weights_only=False` (the current default value), which uses the default pickle module implicitly. It is possible to construct malicious pickle data which will execute arbitrary code during unpickling (See https://github.com/pytorch/pytorch/blob/main/SECURITY.md#untrusted-models for more details). In a future release, the default value for `weights_only` will be flipped to `True`. This limits the functions that could be executed during unpickling. Arbitrary objects will no longer be allowed to be loaded via this mode unless they are explicitly allowlisted by the user via `torch.serialization.add_safe_globals`. We recommend you start setting `weights_only=True` for any use case where you don't have full control of the loaded file. Please open an issue on GitHub for any issues related to this experimental feature.
  self.data, self.slices = torch.load(self.processed_paths[0])
