STDOUT:
Results will be saved in /home/philip/projects/ltspice_examples_code_repo/Circuit-Completion-Using-GNNs/component_classification_with_link_prediction_head/evaluation/FEGIN/results/model_FEGIN_dataset_ltspice_examples
Command line input: python main.py --data ltspice_examples --representation component_pin --model FEGIN --layers 6 --hiddens 64 --batch_size 64 --lr 0.01 --emb_size 250 --epochs 100 --save_appendix component_pin_L6_H64_BS64_LR0.01_E250 --no_val
 is saved.
-----
ltspice_examples - FEGIN
Using 6 layers, 64 hidden units, h = 2
Loading component_pin representation dataset
ENTERED
Training FEGIN on component_pin representation
Train: 3560, Test: 848
##################ITERATION #0 ****************************************
 epoch: 0, train_loss: 1.1867, test_loss: 1.1660, test_f1: 0.4182
 epoch: 1, train_loss: 1.0550, test_loss: 1.1871, test_f1: 0.4180
 epoch: 2, train_loss: 0.9957, test_loss: 0.9464, test_f1: 0.4742
 epoch: 3, train_loss: 0.9741, test_loss: 1.0302, test_f1: 0.4968
 epoch: 4, train_loss: 0.9487, test_loss: 0.9396, test_f1: 0.4984
 epoch: 5, train_loss: 0.9056, test_loss: 1.0354, test_f1: 0.4664
 epoch: 6, train_loss: 0.8893, test_loss: 0.9444, test_f1: 0.5413
 epoch: 7, train_loss: 0.8880, test_loss: 0.9202, test_f1: 0.5088
 epoch: 8, train_loss: 0.8753, test_loss: 0.8562, test_f1: 0.5513
 epoch: 9, train_loss: 0.8498, test_loss: 0.8065, test_f1: 0.5475
 epoch: 10, train_loss: 0.8392, test_loss: 0.9410, test_f1: 0.4952
 epoch: 11, train_loss: 0.8451, test_loss: 0.9472, test_f1: 0.5326
 epoch: 12, train_loss: 0.8305, test_loss: 0.7782, test_f1: 0.5930
 epoch: 13, train_loss: 0.8119, test_loss: 0.8367, test_f1: 0.5691
 epoch: 14, train_loss: 0.7913, test_loss: 0.9854, test_f1: 0.6174
 epoch: 15, train_loss: 0.7921, test_loss: 0.8481, test_f1: 0.5523
 epoch: 16, train_loss: 0.7937, test_loss: 0.9008, test_f1: 0.5446
 epoch: 17, train_loss: 0.7777, test_loss: 0.8702, test_f1: 0.5338
 epoch: 18, train_loss: 0.7790, test_loss: 0.8667, test_f1: 0.5334
 epoch: 19, train_loss: 0.7547, test_loss: 0.9640, test_f1: 0.5593
 epoch: 20, train_loss: 0.7528, test_loss: 0.8789, test_f1: 0.5621
 epoch: 21, train_loss: 0.7476, test_loss: 0.8015, test_f1: 0.5614
 epoch: 22, train_loss: 0.7384, test_loss: 0.8763, test_f1: 0.6084
 epoch: 23, train_loss: 0.7583, test_loss: 0.8360, test_f1: 0.5458
 epoch: 24, train_loss: 0.7332, test_loss: 0.8305, test_f1: 0.6097
 epoch: 25, train_loss: 0.7341, test_loss: 0.9836, test_f1: 0.5510
 epoch: 26, train_loss: 0.7414, test_loss: 0.9683, test_f1: 0.5405
 epoch: 27, train_loss: 0.7400, test_loss: 1.0604, test_f1: 0.5646
 epoch: 28, train_loss: 0.7511, test_loss: 1.0867, test_f1: 0.5003
 epoch: 29, train_loss: 0.7421, test_loss: 0.8565, test_f1: 0.6195
 epoch: 30, train_loss: 0.7397, test_loss: 0.8851, test_f1: 0.5544
 epoch: 31, train_loss: 0.7185, test_loss: 0.8416, test_f1: 0.5461
 epoch: 32, train_loss: 0.7072, test_loss: 0.8840, test_f1: 0.6234
 epoch: 33, train_loss: 0.6886, test_loss: 0.9378, test_f1: 0.5591
 epoch: 34, train_loss: 0.7165, test_loss: 0.8039, test_f1: 0.5777
 epoch: 35, train_loss: 0.7212, test_loss: 1.0181, test_f1: 0.5135
 epoch: 36, train_loss: 0.7004, test_loss: 0.9405, test_f1: 0.6052
 epoch: 37, train_loss: 0.7260, test_loss: 0.8167, test_f1: 0.5754
 epoch: 38, train_loss: 0.6908, test_loss: 0.8161, test_f1: 0.5734
 epoch: 39, train_loss: 0.7020, test_loss: 1.0897, test_f1: 0.5635
 epoch: 40, train_loss: 0.7016, test_loss: 0.9195, test_f1: 0.5817
 epoch: 41, train_loss: 0.6604, test_loss: 1.1331, test_f1: 0.5284
 epoch: 42, train_loss: 0.6753, test_loss: 0.8769, test_f1: 0.6338
 epoch: 43, train_loss: 0.6701, test_loss: 1.0182, test_f1: 0.4810
 epoch: 44, train_loss: 0.6582, test_loss: 0.8541, test_f1: 0.5883
 epoch: 45, train_loss: 0.6539, test_loss: 0.8915, test_f1: 0.5757
 epoch: 46, train_loss: 0.6586, test_loss: 0.9617, test_f1: 0.5707
 epoch: 47, train_loss: 0.6347, test_loss: 0.9155, test_f1: 0.6139
 epoch: 48, train_loss: 0.6492, test_loss: 0.9151, test_f1: 0.6007
 epoch: 49, train_loss: 0.6335, test_loss: 0.9230, test_f1: 0.6067
 epoch: 50, train_loss: 0.6434, test_loss: 0.9268, test_f1: 0.5863
 epoch: 51, train_loss: 0.5987, test_loss: 0.9352, test_f1: 0.5839
 epoch: 52, train_loss: 0.5809, test_loss: 0.8888, test_f1: 0.6228
 epoch: 53, train_loss: 0.5608, test_loss: 0.9528, test_f1: 0.6469
 epoch: 54, train_loss: 0.5685, test_loss: 0.9786, test_f1: 0.6457
 epoch: 55, train_loss: 0.5559, test_loss: 0.9677, test_f1: 0.6206
 epoch: 56, train_loss: 0.5678, test_loss: 1.0260, test_f1: 0.6307
 epoch: 57, train_loss: 0.5639, test_loss: 0.9673, test_f1: 0.6157
 epoch: 58, train_loss: 0.5637, test_loss: 0.9870, test_f1: 0.5994
 epoch: 59, train_loss: 0.5558, test_loss: 0.9435, test_f1: 0.5640
 epoch: 60, train_loss: 0.5405, test_loss: 0.9774, test_f1: 0.6068
 epoch: 61, train_loss: 0.5330, test_loss: 1.0230, test_f1: 0.5706
 epoch: 62, train_loss: 0.5320, test_loss: 0.9239, test_f1: 0.6324
 epoch: 63, train_loss: 0.5299, test_loss: 0.9813, test_f1: 0.6339
 epoch: 64, train_loss: 0.5295, test_loss: 0.9806, test_f1: 0.6143
 epoch: 65, train_loss: 0.5435, test_loss: 1.0954, test_f1: 0.6126
 epoch: 66, train_loss: 0.5239, test_loss: 1.1083, test_f1: 0.6421
 epoch: 67, train_loss: 0.4947, test_loss: 1.0792, test_f1: 0.5809
 epoch: 68, train_loss: 0.5083, test_loss: 1.1441, test_f1: 0.6379
 epoch: 69, train_loss: 0.5275, test_loss: 1.0950, test_f1: 0.6316
 epoch: 70, train_loss: 0.5214, test_loss: 0.9787, test_f1: 0.6418
 epoch: 71, train_loss: 0.5056, test_loss: 1.0732, test_f1: 0.6612
 epoch: 72, train_loss: 0.5006, test_loss: 1.1128, test_f1: 0.6236
 epoch: 73, train_loss: 0.5042, test_loss: 1.1133, test_f1: 0.6547
 epoch: 74, train_loss: 0.4886, test_loss: 1.0599, test_f1: 0.6655
 epoch: 75, train_loss: 0.5127, test_loss: 1.0214, test_f1: 0.6435
 epoch: 76, train_loss: 0.4884, test_loss: 0.9805, test_f1: 0.6543
 epoch: 77, train_loss: 0.5061, test_loss: 1.0951, test_f1: 0.6506
 epoch: 78, train_loss: 0.4809, test_loss: 1.0238, test_f1: 0.6172
 epoch: 79, train_loss: 0.4872, test_loss: 0.9700, test_f1: 0.6546
 epoch: 80, train_loss: 0.4755, test_loss: 1.0301, test_f1: 0.6546
 epoch: 81, train_loss: 0.4863, test_loss: 1.0490, test_f1: 0.5940
 epoch: 82, train_loss: 0.4896, test_loss: 0.9999, test_f1: 0.6284
 epoch: 83, train_loss: 0.4682, test_loss: 1.0549, test_f1: 0.6421
 epoch: 84, train_loss: 0.4761, test_loss: 1.0866, test_f1: 0.6548
 epoch: 85, train_loss: 0.4722, test_loss: 1.0877, test_f1: 0.6344
 epoch: 86, train_loss: 0.4631, test_loss: 1.2241, test_f1: 0.6568
 epoch: 87, train_loss: 0.4606, test_loss: 0.9920, test_f1: 0.6437
 epoch: 88, train_loss: 0.4390, test_loss: 1.1513, test_f1: 0.6463
 epoch: 89, train_loss: 0.4519, test_loss: 1.1113, test_f1: 0.6627
 epoch: 90, train_loss: 0.4493, test_loss: 1.0807, test_f1: 0.6568
 epoch: 91, train_loss: 0.4588, test_loss: 1.1720, test_f1: 0.6301
 epoch: 92, train_loss: 0.4669, test_loss: 1.0712, test_f1: 0.6505
 epoch: 93, train_loss: 0.4591, test_loss: 1.1074, test_f1: 0.6432
 epoch: 94, train_loss: 0.4429, test_loss: 1.1616, test_f1: 0.6602
 epoch: 95, train_loss: 0.4549, test_loss: 1.1142, test_f1: 0.6655
 epoch: 96, train_loss: 0.4331, test_loss: 1.1898, test_f1: 0.6326
 epoch: 97, train_loss: 0.4380, test_loss: 1.1625, test_f1: 0.6204
 epoch: 98, train_loss: 0.4480, test_loss: 1.0369, test_f1: 0.6444
 epoch: 99, train_loss: 0.4239, test_loss: 1.2192, test_f1: 0.6417
##################ITERATION #1 ****************************************
 epoch: 0, train_loss: 1.1283, test_loss: 1.1518, test_f1: 0.4094
 epoch: 1, train_loss: 1.0276, test_loss: 1.0097, test_f1: 0.4580
 epoch: 2, train_loss: 0.9596, test_loss: 1.0122, test_f1: 0.4632
 epoch: 3, train_loss: 0.9459, test_loss: 0.9462, test_f1: 0.5255
 epoch: 4, train_loss: 0.9094, test_loss: 0.9549, test_f1: 0.5076
 epoch: 5, train_loss: 0.8842, test_loss: 0.8735, test_f1: 0.5205
 epoch: 6, train_loss: 0.8740, test_loss: 0.9004, test_f1: 0.5021
 epoch: 7, train_loss: 0.8509, test_loss: 1.1039, test_f1: 0.4594
 epoch: 8, train_loss: 0.8434, test_loss: 1.5180, test_f1: 0.3762
 epoch: 9, train_loss: 0.8487, test_loss: 0.9838, test_f1: 0.4800
 epoch: 10, train_loss: 0.8247, test_loss: 0.9854, test_f1: 0.5107
 epoch: 11, train_loss: 0.8120, test_loss: 1.4373, test_f1: 0.3793
 epoch: 12, train_loss: 0.8106, test_loss: 0.8305, test_f1: 0.5385
 epoch: 13, train_loss: 0.8352, test_loss: 1.0106, test_f1: 0.5064
 epoch: 14, train_loss: 0.7940, test_loss: 0.9238, test_f1: 0.5104
 epoch: 15, train_loss: 0.7782, test_loss: 0.8669, test_f1: 0.5377
 epoch: 16, train_loss: 0.7894, test_loss: 0.7803, test_f1: 0.6246
 epoch: 17, train_loss: 0.7558, test_loss: 0.8212, test_f1: 0.5379
 epoch: 18, train_loss: 0.7681, test_loss: 0.8677, test_f1: 0.5413
 epoch: 19, train_loss: 0.7540, test_loss: 0.8934, test_f1: 0.5365
 epoch: 20, train_loss: 0.7450, test_loss: 0.8692, test_f1: 0.5802
 epoch: 21, train_loss: 0.7477, test_loss: 0.8249, test_f1: 0.5531
 epoch: 22, train_loss: 0.7295, test_loss: 1.0202, test_f1: 0.5654
 epoch: 23, train_loss: 0.7396, test_loss: 0.9570, test_f1: 0.5504
 epoch: 24, train_loss: 0.7236, test_loss: 0.9074, test_f1: 0.5842
 epoch: 25, train_loss: 0.7226, test_loss: 0.9087, test_f1: 0.5192
 epoch: 26, train_loss: 0.7272, test_loss: 0.9268, test_f1: 0.5246
 epoch: 27, train_loss: 0.7019, test_loss: 1.0599, test_f1: 0.5407
 epoch: 28, train_loss: 0.7096, test_loss: 0.9987, test_f1: 0.5062
 epoch: 29, train_loss: 0.7054, test_loss: 0.8967, test_f1: 0.5888
 epoch: 30, train_loss: 0.6982, test_loss: 1.0718, test_f1: 0.6029
 epoch: 31, train_loss: 0.6944, test_loss: 0.9293, test_f1: 0.5692
 epoch: 32, train_loss: 0.6857, test_loss: 1.1063, test_f1: 0.5053
 epoch: 33, train_loss: 0.6972, test_loss: 0.8269, test_f1: 0.6101
 epoch: 34, train_loss: 0.6617, test_loss: 0.8589, test_f1: 0.6211
 epoch: 35, train_loss: 0.6492, test_loss: 0.8560, test_f1: 0.6089
 epoch: 36, train_loss: 0.6675, test_loss: 0.9173, test_f1: 0.6021
 epoch: 37, train_loss: 0.6434, test_loss: 1.1510, test_f1: 0.5645
 epoch: 38, train_loss: 0.6559, test_loss: 0.9291, test_f1: 0.5997
 epoch: 39, train_loss: 0.6532, test_loss: 0.8425, test_f1: 0.6073
 epoch: 40, train_loss: 0.6380, test_loss: 0.9147, test_f1: 0.6020
 epoch: 41, train_loss: 0.6319, test_loss: 0.8564, test_f1: 0.6252
 epoch: 42, train_loss: 0.6442, test_loss: 1.0494, test_f1: 0.5822
 epoch: 43, train_loss: 0.6384, test_loss: 1.0548, test_f1: 0.6002
 epoch: 44, train_loss: 0.6445, test_loss: 0.9120, test_f1: 0.6026
 epoch: 45, train_loss: 0.6304, test_loss: 1.2198, test_f1: 0.5779
 epoch: 46, train_loss: 0.6223, test_loss: 1.0301, test_f1: 0.5611
 epoch: 47, train_loss: 0.6021, test_loss: 1.1762, test_f1: 0.5840
 epoch: 48, train_loss: 0.5949, test_loss: 0.9178, test_f1: 0.6365
 epoch: 49, train_loss: 0.6097, test_loss: 0.9170, test_f1: 0.6113
 epoch: 50, train_loss: 0.6114, test_loss: 0.8812, test_f1: 0.6197
 epoch: 51, train_loss: 0.5817, test_loss: 0.9585, test_f1: 0.6393
 epoch: 52, train_loss: 0.5301, test_loss: 0.9419, test_f1: 0.6313
 epoch: 53, train_loss: 0.5377, test_loss: 0.9187, test_f1: 0.6361
 epoch: 54, train_loss: 0.5302, test_loss: 1.0172, test_f1: 0.6154
 epoch: 55, train_loss: 0.5157, test_loss: 1.1459, test_f1: 0.6381
 epoch: 56, train_loss: 0.5250, test_loss: 1.2160, test_f1: 0.6284
 epoch: 57, train_loss: 0.5243, test_loss: 1.0224, test_f1: 0.6224
 epoch: 58, train_loss: 0.5509, test_loss: 0.9993, test_f1: 0.6282
 epoch: 59, train_loss: 0.5129, test_loss: 1.0884, test_f1: 0.6303
 epoch: 60, train_loss: 0.5112, test_loss: 1.0243, test_f1: 0.5896
 epoch: 61, train_loss: 0.4840, test_loss: 1.0961, test_f1: 0.6401
 epoch: 62, train_loss: 0.5079, test_loss: 0.9901, test_f1: 0.6458
 epoch: 63, train_loss: 0.4907, test_loss: 1.0630, test_f1: 0.6251
 epoch: 64, train_loss: 0.4825, test_loss: 1.1464, test_f1: 0.6209
 epoch: 65, train_loss: 0.4767, test_loss: 1.0625, test_f1: 0.6105
 epoch: 66, train_loss: 0.4973, test_loss: 1.0616, test_f1: 0.6143
 epoch: 67, train_loss: 0.4926, test_loss: 1.1475, test_f1: 0.6278
 epoch: 68, train_loss: 0.4661, test_loss: 1.0735, test_f1: 0.6306
 epoch: 69, train_loss: 0.4680, test_loss: 1.1694, test_f1: 0.6212
 epoch: 70, train_loss: 0.4715, test_loss: 1.2981, test_f1: 0.6143
 epoch: 71, train_loss: 0.4805, test_loss: 1.0249, test_f1: 0.6146
 epoch: 72, train_loss: 0.4527, test_loss: 1.3060, test_f1: 0.5965
 epoch: 73, train_loss: 0.4626, test_loss: 1.0346, test_f1: 0.6487
 epoch: 74, train_loss: 0.4417, test_loss: 1.0815, test_f1: 0.6468
 epoch: 75, train_loss: 0.4788, test_loss: 1.1752, test_f1: 0.6311
 epoch: 76, train_loss: 0.4780, test_loss: 1.1817, test_f1: 0.6128
 epoch: 77, train_loss: 0.4648, test_loss: 1.1931, test_f1: 0.6272
 epoch: 78, train_loss: 0.4571, test_loss: 1.1945, test_f1: 0.6394
 epoch: 79, train_loss: 0.4593, test_loss: 1.1203, test_f1: 0.6508
 epoch: 80, train_loss: 0.4427, test_loss: 1.3339, test_f1: 0.6644
 epoch: 81, train_loss: 0.4201, test_loss: 1.5181, test_f1: 0.6392
 epoch: 82, train_loss: 0.4331, test_loss: 1.3012, test_f1: 0.6340
 epoch: 83, train_loss: 0.4373, test_loss: 1.1710, test_f1: 0.6376
 epoch: 84, train_loss: 0.4492, test_loss: 1.0898, test_f1: 0.6497
 epoch: 85, train_loss: 0.4366, test_loss: 1.0085, test_f1: 0.6568
 epoch: 86, train_loss: 0.4378, test_loss: 1.1620, test_f1: 0.6619
 epoch: 87, train_loss: 0.4109, test_loss: 1.3666, test_f1: 0.6097
 epoch: 88, train_loss: 0.4358, test_loss: 1.2430, test_f1: 0.6425
 epoch: 89, train_loss: 0.4287, test_loss: 1.3147, test_f1: 0.6444
 epoch: 90, train_loss: 0.4247, test_loss: 1.4043, test_f1: 0.6401
 epoch: 91, train_loss: 0.4128, test_loss: 1.3657, test_f1: 0.6173
 epoch: 92, train_loss: 0.3982, test_loss: 1.3047, test_f1: 0.6472
 epoch: 93, train_loss: 0.4140, test_loss: 1.3447, test_f1: 0.6359
 epoch: 94, train_loss: 0.4294, test_loss: 1.1882, test_f1: 0.6305
 epoch: 95, train_loss: 0.4116, test_loss: 1.2597, test_f1: 0.6278
 epoch: 96, train_loss: 0.4331, test_loss: 1.2522, test_f1: 0.6187
 epoch: 97, train_loss: 0.4119, test_loss: 1.2216, test_f1: 0.6188
 epoch: 98, train_loss: 0.4062, test_loss: 1.3834, test_f1: 0.6216
 epoch: 99, train_loss: 0.4236, test_loss: 1.6532, test_f1: 0.6163
##################ITERATION #2 ****************************************
 epoch: 0, train_loss: 1.1461, test_loss: 1.1282, test_f1: 0.4007
 epoch: 1, train_loss: 1.0372, test_loss: 1.1713, test_f1: 0.4394
 epoch: 2, train_loss: 1.0075, test_loss: 1.0351, test_f1: 0.4470
 epoch: 3, train_loss: 0.9799, test_loss: 1.0367, test_f1: 0.4728
 epoch: 4, train_loss: 0.9674, test_loss: 1.0031, test_f1: 0.4948
 epoch: 5, train_loss: 0.9609, test_loss: 1.0273, test_f1: 0.4776
 epoch: 6, train_loss: 0.9458, test_loss: 0.9995, test_f1: 0.4733
 epoch: 7, train_loss: 0.9430, test_loss: 1.0102, test_f1: 0.4857
 epoch: 8, train_loss: 0.9204, test_loss: 0.9807, test_f1: 0.4958
 epoch: 9, train_loss: 0.8936, test_loss: 0.8912, test_f1: 0.5190
 epoch: 10, train_loss: 0.8726, test_loss: 0.9031, test_f1: 0.5007
 epoch: 11, train_loss: 0.8882, test_loss: 1.0847, test_f1: 0.4868
 epoch: 12, train_loss: 0.8723, test_loss: 0.8542, test_f1: 0.5451
 epoch: 13, train_loss: 0.8425, test_loss: 0.9372, test_f1: 0.5285
 epoch: 14, train_loss: 0.8404, test_loss: 0.9284, test_f1: 0.5458
 epoch: 15, train_loss: 0.8339, test_loss: 0.8393, test_f1: 0.5203
 epoch: 16, train_loss: 0.8433, test_loss: 0.8647, test_f1: 0.5328
 epoch: 17, train_loss: 0.8242, test_loss: 0.8802, test_f1: 0.5518
 epoch: 18, train_loss: 0.8131, test_loss: 0.8359, test_f1: 0.5572
 epoch: 19, train_loss: 0.8155, test_loss: 0.7843, test_f1: 0.5713
 epoch: 20, train_loss: 0.7952, test_loss: 0.9310, test_f1: 0.5934
 epoch: 21, train_loss: 0.7905, test_loss: 0.8256, test_f1: 0.5321
 epoch: 22, train_loss: 0.7820, test_loss: 0.7920, test_f1: 0.5540
 epoch: 23, train_loss: 0.7740, test_loss: 0.8322, test_f1: 0.5408
 epoch: 24, train_loss: 0.8082, test_loss: 1.1260, test_f1: 0.4860
 epoch: 25, train_loss: 0.7667, test_loss: 0.8324, test_f1: 0.5393
 epoch: 26, train_loss: 0.7559, test_loss: 0.8912, test_f1: 0.5466
 epoch: 27, train_loss: 0.7554, test_loss: 0.8127, test_f1: 0.5690
 epoch: 28, train_loss: 0.7742, test_loss: 0.8874, test_f1: 0.5510
 epoch: 29, train_loss: 0.7328, test_loss: 1.0232, test_f1: 0.5102
 epoch: 30, train_loss: 0.7276, test_loss: 0.8548, test_f1: 0.5248
 epoch: 31, train_loss: 0.7402, test_loss: 1.1000, test_f1: 0.5022
 epoch: 32, train_loss: 0.7451, test_loss: 1.0065, test_f1: 0.5743
 epoch: 33, train_loss: 0.7312, test_loss: 0.9332, test_f1: 0.5301
 epoch: 34, train_loss: 0.7264, test_loss: 0.8737, test_f1: 0.5391
 epoch: 35, train_loss: 0.7082, test_loss: 0.9003, test_f1: 0.5597
 epoch: 36, train_loss: 0.7209, test_loss: 0.9494, test_f1: 0.5800
 epoch: 37, train_loss: 0.7119, test_loss: 0.9609, test_f1: 0.5896
 epoch: 38, train_loss: 0.7037, test_loss: 0.9218, test_f1: 0.5987
 epoch: 39, train_loss: 0.7083, test_loss: 0.8920, test_f1: 0.5428
 epoch: 40, train_loss: 0.7078, test_loss: 0.8466, test_f1: 0.5764
 epoch: 41, train_loss: 0.7008, test_loss: 1.0730, test_f1: 0.4980
 epoch: 42, train_loss: 0.7058, test_loss: 0.8390, test_f1: 0.6161
 epoch: 43, train_loss: 0.6790, test_loss: 0.8816, test_f1: 0.5839
 epoch: 44, train_loss: 0.7100, test_loss: 0.9218, test_f1: 0.6138
 epoch: 45, train_loss: 0.6801, test_loss: 0.8963, test_f1: 0.5694
 epoch: 46, train_loss: 0.6688, test_loss: 0.9333, test_f1: 0.5380
 epoch: 47, train_loss: 0.6667, test_loss: 0.8258, test_f1: 0.5819
 epoch: 48, train_loss: 0.6639, test_loss: 0.8874, test_f1: 0.5822
 epoch: 49, train_loss: 0.6431, test_loss: 1.1179, test_f1: 0.5649
 epoch: 50, train_loss: 0.6651, test_loss: 1.0216, test_f1: 0.5513
 epoch: 51, train_loss: 0.6168, test_loss: 0.9827, test_f1: 0.6141
 epoch: 52, train_loss: 0.6125, test_loss: 1.0020, test_f1: 0.6004
 epoch: 53, train_loss: 0.5947, test_loss: 0.8937, test_f1: 0.6283
 epoch: 54, train_loss: 0.5794, test_loss: 1.0346, test_f1: 0.6212
 epoch: 55, train_loss: 0.5942, test_loss: 0.9244, test_f1: 0.6006
 epoch: 56, train_loss: 0.5986, test_loss: 1.0633, test_f1: 0.6462
 epoch: 57, train_loss: 0.5958, test_loss: 1.0296, test_f1: 0.6459
 epoch: 58, train_loss: 0.5889, test_loss: 0.9545, test_f1: 0.6090
 epoch: 59, train_loss: 0.5784, test_loss: 1.0230, test_f1: 0.6355
 epoch: 60, train_loss: 0.5700, test_loss: 0.9008, test_f1: 0.6376
 epoch: 61, train_loss: 0.5915, test_loss: 0.9112, test_f1: 0.6275
 epoch: 62, train_loss: 0.5529, test_loss: 0.9853, test_f1: 0.6208
 epoch: 63, train_loss: 0.5794, test_loss: 0.8979, test_f1: 0.6396
 epoch: 64, train_loss: 0.5588, test_loss: 0.9449, test_f1: 0.6151
 epoch: 65, train_loss: 0.5659, test_loss: 1.0336, test_f1: 0.6182
 epoch: 66, train_loss: 0.5476, test_loss: 1.0150, test_f1: 0.6377
 epoch: 67, train_loss: 0.5608, test_loss: 1.1004, test_f1: 0.6292
 epoch: 68, train_loss: 0.5476, test_loss: 1.0472, test_f1: 0.6425
 epoch: 69, train_loss: 0.5562, test_loss: 1.0159, test_f1: 0.6328
 epoch: 70, train_loss: 0.5544, test_loss: 0.9999, test_f1: 0.6528
 epoch: 71, train_loss: 0.5435, test_loss: 0.9478, test_f1: 0.6406
 epoch: 72, train_loss: 0.5270, test_loss: 1.0631, test_f1: 0.6517
 epoch: 73, train_loss: 0.5444, test_loss: 1.1628, test_f1: 0.6023
 epoch: 74, train_loss: 0.5550, test_loss: 1.1443, test_f1: 0.6472
 epoch: 75, train_loss: 0.5477, test_loss: 0.9743, test_f1: 0.6434
 epoch: 76, train_loss: 0.5234, test_loss: 1.0761, test_f1: 0.6263
 epoch: 77, train_loss: 0.5410, test_loss: 1.0434, test_f1: 0.6601
 epoch: 78, train_loss: 0.5231, test_loss: 1.0019, test_f1: 0.6446
 epoch: 79, train_loss: 0.5309, test_loss: 1.1951, test_f1: 0.6239
 epoch: 80, train_loss: 0.5162, test_loss: 1.0680, test_f1: 0.6445
 epoch: 81, train_loss: 0.5111, test_loss: 1.0680, test_f1: 0.6385
 epoch: 82, train_loss: 0.5311, test_loss: 1.1150, test_f1: 0.6227
 epoch: 83, train_loss: 0.5112, test_loss: 1.0870, test_f1: 0.6364
 epoch: 84, train_loss: 0.5089, test_loss: 1.0674, test_f1: 0.6441
 epoch: 85, train_loss: 0.5112, test_loss: 1.0804, test_f1: 0.6267
 epoch: 86, train_loss: 0.5348, test_loss: 0.9348, test_f1: 0.6348
 epoch: 87, train_loss: 0.5042, test_loss: 1.0517, test_f1: 0.6148
 epoch: 88, train_loss: 0.5078, test_loss: 1.0279, test_f1: 0.6580
 epoch: 89, train_loss: 0.4882, test_loss: 1.0872, test_f1: 0.6274
 epoch: 90, train_loss: 0.5171, test_loss: 1.1005, test_f1: 0.6296
 epoch: 91, train_loss: 0.5117, test_loss: 1.0873, test_f1: 0.6417
 epoch: 92, train_loss: 0.5009, test_loss: 1.2132, test_f1: 0.5881
 epoch: 93, train_loss: 0.4945, test_loss: 1.0647, test_f1: 0.6359
 epoch: 94, train_loss: 0.5090, test_loss: 0.9869, test_f1: 0.6172
 epoch: 95, train_loss: 0.4954, test_loss: 1.0806, test_f1: 0.6641
 epoch: 96, train_loss: 0.5150, test_loss: 1.0274, test_f1: 0.6382
 epoch: 97, train_loss: 0.4803, test_loss: 1.0381, test_f1: 0.6443
 epoch: 98, train_loss: 0.4689, test_loss: 1.0627, test_f1: 0.6214
 epoch: 99, train_loss: 0.4863, test_loss: 1.1291, test_f1: 0.6101
##################ITERATION #3 ****************************************
 epoch: 0, train_loss: 1.1422, test_loss: 1.0886, test_f1: 0.3827
 epoch: 1, train_loss: 1.0432, test_loss: 1.0977, test_f1: 0.4713
 epoch: 2, train_loss: 1.0305, test_loss: 0.9997, test_f1: 0.4615
 epoch: 3, train_loss: 0.9980, test_loss: 1.0364, test_f1: 0.4462
 epoch: 4, train_loss: 0.9748, test_loss: 1.1316, test_f1: 0.4372
 epoch: 5, train_loss: 0.9753, test_loss: 0.9977, test_f1: 0.5030
 epoch: 6, train_loss: 0.9467, test_loss: 1.0442, test_f1: 0.4875
 epoch: 7, train_loss: 0.9430, test_loss: 0.9704, test_f1: 0.5030
 epoch: 8, train_loss: 0.9263, test_loss: 0.9610, test_f1: 0.4944
 epoch: 9, train_loss: 0.9151, test_loss: 0.9997, test_f1: 0.4187
 epoch: 10, train_loss: 0.8940, test_loss: 1.0070, test_f1: 0.5005
 epoch: 11, train_loss: 0.9063, test_loss: 1.0526, test_f1: 0.4580
 epoch: 12, train_loss: 0.8842, test_loss: 0.9626, test_f1: 0.4932
 epoch: 13, train_loss: 0.8738, test_loss: 0.9667, test_f1: 0.5684
 epoch: 14, train_loss: 0.8519, test_loss: 0.9888, test_f1: 0.5741
 epoch: 15, train_loss: 0.8643, test_loss: 1.0459, test_f1: 0.5249
 epoch: 16, train_loss: 0.8587, test_loss: 1.0095, test_f1: 0.5283
 epoch: 17, train_loss: 0.8633, test_loss: 0.9356, test_f1: 0.4930
 epoch: 18, train_loss: 0.8381, test_loss: 0.9451, test_f1: 0.5201
 epoch: 19, train_loss: 0.8234, test_loss: 0.9249, test_f1: 0.5482
 epoch: 20, train_loss: 0.8436, test_loss: 0.9274, test_f1: 0.5125
 epoch: 21, train_loss: 0.8477, test_loss: 0.9327, test_f1: 0.5816
 epoch: 22, train_loss: 0.7980, test_loss: 0.9795, test_f1: 0.5539
 epoch: 23, train_loss: 0.8172, test_loss: 1.0347, test_f1: 0.4893
 epoch: 24, train_loss: 0.8088, test_loss: 0.8914, test_f1: 0.5160
 epoch: 25, train_loss: 0.7875, test_loss: 0.9249, test_f1: 0.5099
 epoch: 26, train_loss: 0.8097, test_loss: 0.9495, test_f1: 0.5387
 epoch: 27, train_loss: 0.7968, test_loss: 0.9369, test_f1: 0.5100
 epoch: 28, train_loss: 0.7726, test_loss: 0.8909, test_f1: 0.5310
 epoch: 29, train_loss: 0.7654, test_loss: 0.9436, test_f1: 0.5434
 epoch: 30, train_loss: 0.7735, test_loss: 0.9571, test_f1: 0.4764
 epoch: 31, train_loss: 0.7987, test_loss: 0.9140, test_f1: 0.5808
 epoch: 32, train_loss: 0.7784, test_loss: 0.9078, test_f1: 0.5440
 epoch: 33, train_loss: 0.7490, test_loss: 0.8720, test_f1: 0.5687
 epoch: 34, train_loss: 0.7628, test_loss: 1.0422, test_f1: 0.5055
 epoch: 35, train_loss: 0.7482, test_loss: 1.0443, test_f1: 0.5160
 epoch: 36, train_loss: 0.7450, test_loss: 0.9565, test_f1: 0.4866
 epoch: 37, train_loss: 0.7583, test_loss: 0.8979, test_f1: 0.5784
 epoch: 38, train_loss: 0.7482, test_loss: 0.9039, test_f1: 0.5565
 epoch: 39, train_loss: 0.7147, test_loss: 0.9575, test_f1: 0.5530
 epoch: 40, train_loss: 0.7385, test_loss: 0.8324, test_f1: 0.5221
 epoch: 41, train_loss: 0.7278, test_loss: 0.8947, test_f1: 0.5058
 epoch: 42, train_loss: 0.7335, test_loss: 0.8197, test_f1: 0.5579
 epoch: 43, train_loss: 0.7269, test_loss: 1.0190, test_f1: 0.5758
 epoch: 44, train_loss: 0.7225, test_loss: 0.8441, test_f1: 0.5666
 epoch: 45, train_loss: 0.7489, test_loss: 0.8442, test_f1: 0.5551
 epoch: 46, train_loss: 0.7093, test_loss: 0.8265, test_f1: 0.5730
 epoch: 47, train_loss: 0.7314, test_loss: 0.8833, test_f1: 0.5959
 epoch: 48, train_loss: 0.6976, test_loss: 0.8717, test_f1: 0.5432
 epoch: 49, train_loss: 0.6913, test_loss: 0.8012, test_f1: 0.5359
 epoch: 50, train_loss: 0.6955, test_loss: 0.8757, test_f1: 0.6246
 epoch: 51, train_loss: 0.6564, test_loss: 0.8062, test_f1: 0.6266
 epoch: 52, train_loss: 0.6336, test_loss: 0.8438, test_f1: 0.6366
 epoch: 53, train_loss: 0.6304, test_loss: 0.7516, test_f1: 0.6137
 epoch: 54, train_loss: 0.6322, test_loss: 0.7982, test_f1: 0.5711
 epoch: 55, train_loss: 0.6488, test_loss: 0.8760, test_f1: 0.5868
 epoch: 56, train_loss: 0.6224, test_loss: 0.8545, test_f1: 0.6232
 epoch: 57, train_loss: 0.5989, test_loss: 0.9597, test_f1: 0.5826
 epoch: 58, train_loss: 0.6142, test_loss: 0.9479, test_f1: 0.6015
 epoch: 59, train_loss: 0.6050, test_loss: 0.9251, test_f1: 0.6231
 epoch: 60, train_loss: 0.6308, test_loss: 0.8539, test_f1: 0.6349
 epoch: 61, train_loss: 0.6090, test_loss: 0.8687, test_f1: 0.5965
 epoch: 62, train_loss: 0.6180, test_loss: 0.8198, test_f1: 0.6420
 epoch: 63, train_loss: 0.5982, test_loss: 0.8905, test_f1: 0.5994
 epoch: 64, train_loss: 0.5840, test_loss: 0.8094, test_f1: 0.6298
 epoch: 65, train_loss: 0.5642, test_loss: 0.9537, test_f1: 0.6303
 epoch: 66, train_loss: 0.5786, test_loss: 0.8329, test_f1: 0.6348
 epoch: 67, train_loss: 0.6014, test_loss: 0.7898, test_f1: 0.6158
 epoch: 68, train_loss: 0.5797, test_loss: 0.8385, test_f1: 0.6033
 epoch: 69, train_loss: 0.5773, test_loss: 0.8846, test_f1: 0.5819
 epoch: 70, train_loss: 0.5750, test_loss: 0.8355, test_f1: 0.6266
 epoch: 71, train_loss: 0.5656, test_loss: 0.8225, test_f1: 0.6310
 epoch: 72, train_loss: 0.5469, test_loss: 0.9250, test_f1: 0.6020
 epoch: 73, train_loss: 0.5591, test_loss: 0.8577, test_f1: 0.6077
 epoch: 74, train_loss: 0.5451, test_loss: 0.8230, test_f1: 0.6174
 epoch: 75, train_loss: 0.5515, test_loss: 0.9773, test_f1: 0.6382
 epoch: 76, train_loss: 0.5534, test_loss: 0.9595, test_f1: 0.6004
 epoch: 77, train_loss: 0.5436, test_loss: 0.8743, test_f1: 0.6166
 epoch: 78, train_loss: 0.5561, test_loss: 0.8684, test_f1: 0.5674
 epoch: 79, train_loss: 0.5608, test_loss: 0.9431, test_f1: 0.5893
 epoch: 80, train_loss: 0.5332, test_loss: 0.8870, test_f1: 0.6185
 epoch: 81, train_loss: 0.5186, test_loss: 1.0754, test_f1: 0.5579
 epoch: 82, train_loss: 0.5577, test_loss: 0.9303, test_f1: 0.6452
 epoch: 83, train_loss: 0.5415, test_loss: 0.8387, test_f1: 0.6446
 epoch: 84, train_loss: 0.5242, test_loss: 0.8375, test_f1: 0.6275
 epoch: 85, train_loss: 0.5189, test_loss: 0.8780, test_f1: 0.6450
 epoch: 86, train_loss: 0.5267, test_loss: 0.8496, test_f1: 0.6278
 epoch: 87, train_loss: 0.5131, test_loss: 0.8705, test_f1: 0.6205
 epoch: 88, train_loss: 0.5188, test_loss: 0.9201, test_f1: 0.6553
 epoch: 89, train_loss: 0.5061, test_loss: 1.0144, test_f1: 0.6400
 epoch: 90, train_loss: 0.4886, test_loss: 0.9461, test_f1: 0.6275
 epoch: 91, train_loss: 0.5080, test_loss: 0.9757, test_f1: 0.6428
 epoch: 92, train_loss: 0.5048, test_loss: 1.0249, test_f1: 0.6059
 epoch: 93, train_loss: 0.4933, test_loss: 0.9813, test_f1: 0.6299
 epoch: 94, train_loss: 0.4968, test_loss: 0.9257, test_f1: 0.6275
 epoch: 95, train_loss: 0.5041, test_loss: 0.9387, test_f1: 0.6563
 epoch: 96, train_loss: 0.4886, test_loss: 0.8770, test_f1: 0.6413
 epoch: 97, train_loss: 0.4812, test_loss: 0.8936, test_f1: 0.6563
 epoch: 98, train_loss: 0.4846, test_loss: 0.9884, test_f1: 0.6329
 epoch: 99, train_loss: 0.4922, test_loss: 0.9262, test_f1: 0.6251
##################ITERATION #4 ****************************************
 epoch: 0, train_loss: 1.1384, test_loss: 1.2602, test_f1: 0.3849
 epoch: 1, train_loss: 1.0325, test_loss: 1.1317, test_f1: 0.4344
 epoch: 2, train_loss: 0.9880, test_loss: 1.1131, test_f1: 0.4840
 epoch: 3, train_loss: 0.9699, test_loss: 1.0324, test_f1: 0.5142
 epoch: 4, train_loss: 0.9438, test_loss: 1.1235, test_f1: 0.5008
 epoch: 5, train_loss: 0.9143, test_loss: 1.0056, test_f1: 0.5225
 epoch: 6, train_loss: 0.9193, test_loss: 1.0357, test_f1: 0.5314
 epoch: 7, train_loss: 0.9015, test_loss: 0.9457, test_f1: 0.4618
 epoch: 8, train_loss: 0.8822, test_loss: 0.8360, test_f1: 0.5359
 epoch: 9, train_loss: 0.8749, test_loss: 0.9570, test_f1: 0.5411
 epoch: 10, train_loss: 0.8474, test_loss: 0.9735, test_f1: 0.4881
 epoch: 11, train_loss: 0.8509, test_loss: 1.0489, test_f1: 0.4329
 epoch: 12, train_loss: 0.8606, test_loss: 0.9283, test_f1: 0.5365
 epoch: 13, train_loss: 0.8556, test_loss: 0.8839, test_f1: 0.5365
 epoch: 14, train_loss: 0.8462, test_loss: 0.8965, test_f1: 0.6310
 epoch: 15, train_loss: 0.8510, test_loss: 1.0727, test_f1: 0.5404
 epoch: 16, train_loss: 0.8224, test_loss: 0.9917, test_f1: 0.5273
 epoch: 17, train_loss: 0.8112, test_loss: 0.9773, test_f1: 0.5717
 epoch: 18, train_loss: 0.8239, test_loss: 0.9246, test_f1: 0.5438
 epoch: 19, train_loss: 0.7973, test_loss: 0.9230, test_f1: 0.5111
 epoch: 20, train_loss: 0.8078, test_loss: 0.9220, test_f1: 0.5312
 epoch: 21, train_loss: 0.8047, test_loss: 1.0844, test_f1: 0.4858
 epoch: 22, train_loss: 0.8036, test_loss: 0.8577, test_f1: 0.5433
 epoch: 23, train_loss: 0.7957, test_loss: 0.9551, test_f1: 0.5102
 epoch: 24, train_loss: 0.7853, test_loss: 0.9472, test_f1: 0.5327
 epoch: 25, train_loss: 0.7961, test_loss: 1.1882, test_f1: 0.5230
 epoch: 26, train_loss: 0.7765, test_loss: 0.9142, test_f1: 0.5475
 epoch: 27, train_loss: 0.7485, test_loss: 1.0766, test_f1: 0.5591
 epoch: 28, train_loss: 0.7602, test_loss: 0.9142, test_f1: 0.5458
 epoch: 29, train_loss: 0.7529, test_loss: 0.9530, test_f1: 0.5733
 epoch: 30, train_loss: 0.7652, test_loss: 1.0307, test_f1: 0.5380
 epoch: 31, train_loss: 0.7365, test_loss: 0.9950, test_f1: 0.5635
 epoch: 32, train_loss: 0.7611, test_loss: 0.8495, test_f1: 0.5472
 epoch: 33, train_loss: 0.7412, test_loss: 0.8352, test_f1: 0.5694
 epoch: 34, train_loss: 0.7237, test_loss: 1.0487, test_f1: 0.5200
 epoch: 35, train_loss: 0.7306, test_loss: 0.8644, test_f1: 0.6238
 epoch: 36, train_loss: 0.7383, test_loss: 1.0653, test_f1: 0.5005
 epoch: 37, train_loss: 0.7283, test_loss: 0.8374, test_f1: 0.5419
 epoch: 38, train_loss: 0.7161, test_loss: 0.9654, test_f1: 0.5600
 epoch: 39, train_loss: 0.6897, test_loss: 1.0127, test_f1: 0.5112
 epoch: 40, train_loss: 0.7085, test_loss: 1.0643, test_f1: 0.5234
 epoch: 41, train_loss: 0.7021, test_loss: 0.9613, test_f1: 0.6184
 epoch: 42, train_loss: 0.7092, test_loss: 1.0498, test_f1: 0.4972
 epoch: 43, train_loss: 0.6943, test_loss: 0.9497, test_f1: 0.6065
 epoch: 44, train_loss: 0.6948, test_loss: 0.8993, test_f1: 0.6040
 epoch: 45, train_loss: 0.6960, test_loss: 0.7983, test_f1: 0.6199
 epoch: 46, train_loss: 0.6878, test_loss: 1.0071, test_f1: 0.5448
 epoch: 47, train_loss: 0.6819, test_loss: 0.8814, test_f1: 0.6056
 epoch: 48, train_loss: 0.6744, test_loss: 0.9201, test_f1: 0.6237
 epoch: 49, train_loss: 0.6604, test_loss: 0.9128, test_f1: 0.6136
 epoch: 50, train_loss: 0.6512, test_loss: 1.0185, test_f1: 0.6126
 epoch: 51, train_loss: 0.6390, test_loss: 0.9548, test_f1: 0.6156
 epoch: 52, train_loss: 0.6141, test_loss: 1.0735, test_f1: 0.5857
 epoch: 53, train_loss: 0.5991, test_loss: 0.8776, test_f1: 0.6166
 epoch: 54, train_loss: 0.5877, test_loss: 0.7884, test_f1: 0.6104
 epoch: 55, train_loss: 0.6026, test_loss: 0.8489, test_f1: 0.6242
 epoch: 56, train_loss: 0.5926, test_loss: 0.9347, test_f1: 0.6261
 epoch: 57, train_loss: 0.5769, test_loss: 0.9544, test_f1: 0.6423
 epoch: 58, train_loss: 0.5904, test_loss: 0.8393, test_f1: 0.6541
 epoch: 59, train_loss: 0.5893, test_loss: 0.8511, test_f1: 0.6552
 epoch: 60, train_loss: 0.5760, test_loss: 0.9495, test_f1: 0.6123
 epoch: 61, train_loss: 0.5628, test_loss: 0.9502, test_f1: 0.6360
 epoch: 62, train_loss: 0.5673, test_loss: 0.9953, test_f1: 0.6425
 epoch: 63, train_loss: 0.5606, test_loss: 1.0592, test_f1: 0.6226
 epoch: 64, train_loss: 0.5650, test_loss: 0.9405, test_f1: 0.6251
 epoch: 65, train_loss: 0.5813, test_loss: 0.8909, test_f1: 0.6399
 epoch: 66, train_loss: 0.5570, test_loss: 0.9279, test_f1: 0.6284
 epoch: 67, train_loss: 0.5471, test_loss: 1.0835, test_f1: 0.6255
 epoch: 68, train_loss: 0.5541, test_loss: 1.0274, test_f1: 0.6522
 epoch: 69, train_loss: 0.5448, test_loss: 0.9050, test_f1: 0.6626
 epoch: 70, train_loss: 0.5430, test_loss: 0.9026, test_f1: 0.6277
 epoch: 71, train_loss: 0.5575, test_loss: 0.9409, test_f1: 0.6265
 epoch: 72, train_loss: 0.5320, test_loss: 0.9349, test_f1: 0.6369
 epoch: 73, train_loss: 0.5286, test_loss: 0.8649, test_f1: 0.6510
 epoch: 74, train_loss: 0.5381, test_loss: 0.9477, test_f1: 0.6258
 epoch: 75, train_loss: 0.5347, test_loss: 0.9076, test_f1: 0.6452
 epoch: 76, train_loss: 0.5272, test_loss: 1.0796, test_f1: 0.6219
 epoch: 77, train_loss: 0.5262, test_loss: 0.9350, test_f1: 0.6381
 epoch: 78, train_loss: 0.5262, test_loss: 0.8590, test_f1: 0.6230
 epoch: 79, train_loss: 0.5390, test_loss: 0.9442, test_f1: 0.6373
 epoch: 80, train_loss: 0.5332, test_loss: 1.1867, test_f1: 0.6158
 epoch: 81, train_loss: 0.5308, test_loss: 1.0300, test_f1: 0.6485
 epoch: 82, train_loss: 0.4945, test_loss: 1.0049, test_f1: 0.6326
 epoch: 83, train_loss: 0.5171, test_loss: 0.8290, test_f1: 0.6436
 epoch: 84, train_loss: 0.5079, test_loss: 1.0080, test_f1: 0.6407
 epoch: 85, train_loss: 0.5110, test_loss: 1.0272, test_f1: 0.6214
 epoch: 86, train_loss: 0.4920, test_loss: 0.8891, test_f1: 0.6300
 epoch: 87, train_loss: 0.5110, test_loss: 0.9487, test_f1: 0.6206
 epoch: 88, train_loss: 0.4950, test_loss: 0.8763, test_f1: 0.6563
 epoch: 89, train_loss: 0.4883, test_loss: 1.1007, test_f1: 0.6335
 epoch: 90, train_loss: 0.4992, test_loss: 1.0828, test_f1: 0.6474
 epoch: 91, train_loss: 0.5051, test_loss: 1.0399, test_f1: 0.6253
 epoch: 92, train_loss: 0.4972, test_loss: 1.1246, test_f1: 0.6338
 epoch: 93, train_loss: 0.4921, test_loss: 0.9137, test_f1: 0.6518
 epoch: 94, train_loss: 0.5024, test_loss: 1.0319, test_f1: 0.6243
 epoch: 95, train_loss: 0.4933, test_loss: 1.1428, test_f1: 0.6086
 epoch: 96, train_loss: 0.4985, test_loss: 0.9415, test_f1: 0.6577
 epoch: 97, train_loss: 0.4837, test_loss: 1.0379, test_f1: 0.6115
 epoch: 98, train_loss: 0.4802, test_loss: 1.0497, test_f1: 0.6433
 epoch: 99, train_loss: 0.4833, test_loss: 1.0089, test_f1: 0.6463
##################ITERATION #5 ****************************************
 epoch: 0, train_loss: 1.1637, test_loss: 1.1271, test_f1: 0.4210
 epoch: 1, train_loss: 1.0399, test_loss: 1.0411, test_f1: 0.4844
 epoch: 2, train_loss: 1.0050, test_loss: 1.0375, test_f1: 0.4482
 epoch: 3, train_loss: 0.9632, test_loss: 0.9779, test_f1: 0.5080
 epoch: 4, train_loss: 0.9687, test_loss: 1.0038, test_f1: 0.4757
 epoch: 5, train_loss: 0.9248, test_loss: 0.9895, test_f1: 0.4838
 epoch: 6, train_loss: 0.9174, test_loss: 0.9573, test_f1: 0.4932
 epoch: 7, train_loss: 0.8861, test_loss: 1.0277, test_f1: 0.4489
 epoch: 8, train_loss: 0.8926, test_loss: 0.8967, test_f1: 0.5443
 epoch: 9, train_loss: 0.8581, test_loss: 0.8868, test_f1: 0.5227
 epoch: 10, train_loss: 0.8536, test_loss: 0.8525, test_f1: 0.5397
 epoch: 11, train_loss: 0.8510, test_loss: 0.9832, test_f1: 0.4700
 epoch: 12, train_loss: 0.8317, test_loss: 0.8416, test_f1: 0.5491
 epoch: 13, train_loss: 0.8346, test_loss: 0.8258, test_f1: 0.5420
 epoch: 14, train_loss: 0.8250, test_loss: 0.8345, test_f1: 0.5651
 epoch: 15, train_loss: 0.7863, test_loss: 0.8202, test_f1: 0.5400
 epoch: 16, train_loss: 0.7956, test_loss: 0.8364, test_f1: 0.5812
 epoch: 17, train_loss: 0.7926, test_loss: 0.8601, test_f1: 0.5265
 epoch: 18, train_loss: 0.7693, test_loss: 1.1158, test_f1: 0.4999
 epoch: 19, train_loss: 0.8017, test_loss: 0.7899, test_f1: 0.5555
 epoch: 20, train_loss: 0.7800, test_loss: 0.8706, test_f1: 0.5071
 epoch: 21, train_loss: 0.7576, test_loss: 0.8074, test_f1: 0.5817
 epoch: 22, train_loss: 0.7462, test_loss: 0.7631, test_f1: 0.5343
 epoch: 23, train_loss: 0.7364, test_loss: 0.9110, test_f1: 0.5552
 epoch: 24, train_loss: 0.7501, test_loss: 0.8965, test_f1: 0.5869
 epoch: 25, train_loss: 0.7538, test_loss: 0.9191, test_f1: 0.5349
 epoch: 26, train_loss: 0.7436, test_loss: 0.8805, test_f1: 0.5409
 epoch: 27, train_loss: 0.7291, test_loss: 0.8203, test_f1: 0.5248
 epoch: 28, train_loss: 0.7208, test_loss: 0.8998, test_f1: 0.6048
 epoch: 29, train_loss: 0.7194, test_loss: 0.9032, test_f1: 0.5299
 epoch: 30, train_loss: 0.7164, test_loss: 0.7614, test_f1: 0.6328
 epoch: 31, train_loss: 0.7210, test_loss: 0.8204, test_f1: 0.5567
 epoch: 32, train_loss: 0.7203, test_loss: 0.7501, test_f1: 0.5954
 epoch: 33, train_loss: 0.6846, test_loss: 0.7853, test_f1: 0.6177
 epoch: 34, train_loss: 0.6810, test_loss: 0.7481, test_f1: 0.6428
 epoch: 35, train_loss: 0.6907, test_loss: 0.8335, test_f1: 0.5669
 epoch: 36, train_loss: 0.6856, test_loss: 0.8636, test_f1: 0.5571
 epoch: 37, train_loss: 0.6890, test_loss: 0.9060, test_f1: 0.5707
 epoch: 38, train_loss: 0.6833, test_loss: 0.7852, test_f1: 0.6135
 epoch: 39, train_loss: 0.6785, test_loss: 0.8281, test_f1: 0.6098
 epoch: 40, train_loss: 0.6739, test_loss: 0.8449, test_f1: 0.5420
 epoch: 41, train_loss: 0.6612, test_loss: 0.8737, test_f1: 0.6065
 epoch: 42, train_loss: 0.6470, test_loss: 0.8612, test_f1: 0.5474
 epoch: 43, train_loss: 0.6241, test_loss: 0.9097, test_f1: 0.5084
 epoch: 44, train_loss: 0.6555, test_loss: 0.8033, test_f1: 0.6384
 epoch: 45, train_loss: 0.6454, test_loss: 0.8268, test_f1: 0.6115
 epoch: 46, train_loss: 0.6433, test_loss: 0.7773, test_f1: 0.5724
 epoch: 47, train_loss: 0.6291, test_loss: 0.8071, test_f1: 0.5745
 epoch: 48, train_loss: 0.6214, test_loss: 0.7383, test_f1: 0.6244
 epoch: 49, train_loss: 0.6265, test_loss: 0.7418, test_f1: 0.6081
 epoch: 50, train_loss: 0.6162, test_loss: 0.8796, test_f1: 0.5993
 epoch: 51, train_loss: 0.5644, test_loss: 0.7706, test_f1: 0.6538
 epoch: 52, train_loss: 0.5569, test_loss: 0.7766, test_f1: 0.6436
 epoch: 53, train_loss: 0.5531, test_loss: 0.8598, test_f1: 0.6056
 epoch: 54, train_loss: 0.5557, test_loss: 0.8400, test_f1: 0.6633
 epoch: 55, train_loss: 0.5483, test_loss: 0.7836, test_f1: 0.6318
 epoch: 56, train_loss: 0.5342, test_loss: 0.9922, test_f1: 0.6122
 epoch: 57, train_loss: 0.5180, test_loss: 0.8719, test_f1: 0.6446
 epoch: 58, train_loss: 0.5286, test_loss: 0.7617, test_f1: 0.6555
 epoch: 59, train_loss: 0.5055, test_loss: 0.8009, test_f1: 0.6488
 epoch: 60, train_loss: 0.5147, test_loss: 0.8682, test_f1: 0.6392
 epoch: 61, train_loss: 0.5284, test_loss: 0.8171, test_f1: 0.6318
 epoch: 62, train_loss: 0.5167, test_loss: 0.7719, test_f1: 0.6819
 epoch: 63, train_loss: 0.5066, test_loss: 0.8344, test_f1: 0.6527
 epoch: 64, train_loss: 0.5074, test_loss: 0.9352, test_f1: 0.6382
 epoch: 65, train_loss: 0.4854, test_loss: 0.9295, test_f1: 0.6603
 epoch: 66, train_loss: 0.4921, test_loss: 0.8924, test_f1: 0.6482
 epoch: 67, train_loss: 0.4786, test_loss: 0.9452, test_f1: 0.6666
 epoch: 68, train_loss: 0.5028, test_loss: 0.9098, test_f1: 0.6842
 epoch: 69, train_loss: 0.5096, test_loss: 0.9138, test_f1: 0.6358
 epoch: 70, train_loss: 0.4871, test_loss: 0.9697, test_f1: 0.6674
 epoch: 71, train_loss: 0.4812, test_loss: 1.0026, test_f1: 0.6448
 epoch: 72, train_loss: 0.4774, test_loss: 0.8457, test_f1: 0.6652
 epoch: 73, train_loss: 0.4622, test_loss: 0.8939, test_f1: 0.6428
 epoch: 74, train_loss: 0.4620, test_loss: 0.9488, test_f1: 0.6488
 epoch: 75, train_loss: 0.4838, test_loss: 0.8005, test_f1: 0.6504
 epoch: 76, train_loss: 0.4632, test_loss: 0.9396, test_f1: 0.6680
 epoch: 77, train_loss: 0.4699, test_loss: 1.2062, test_f1: 0.5590
 epoch: 78, train_loss: 0.4721, test_loss: 0.8766, test_f1: 0.6375
 epoch: 79, train_loss: 0.4759, test_loss: 0.9406, test_f1: 0.6566
 epoch: 80, train_loss: 0.4705, test_loss: 0.8955, test_f1: 0.6353
 epoch: 81, train_loss: 0.4639, test_loss: 0.8580, test_f1: 0.6510
 epoch: 82, train_loss: 0.4777, test_loss: 1.0101, test_f1: 0.6407
 epoch: 83, train_loss: 0.4645, test_loss: 1.0538, test_f1: 0.6199
 epoch: 84, train_loss: 0.4401, test_loss: 0.9581, test_f1: 0.6293
 epoch: 85, train_loss: 0.4547, test_loss: 0.8284, test_f1: 0.6295
 epoch: 86, train_loss: 0.4423, test_loss: 0.9165, test_f1: 0.6634
 epoch: 87, train_loss: 0.4356, test_loss: 0.9605, test_f1: 0.6182
 epoch: 88, train_loss: 0.4380, test_loss: 0.9593, test_f1: 0.6494
 epoch: 89, train_loss: 0.4653, test_loss: 0.9225, test_f1: 0.6276
 epoch: 90, train_loss: 0.4329, test_loss: 0.8935, test_f1: 0.6535
 epoch: 91, train_loss: 0.4473, test_loss: 0.8404, test_f1: 0.6445
 epoch: 92, train_loss: 0.4190, test_loss: 0.9191, test_f1: 0.6479
 epoch: 93, train_loss: 0.4324, test_loss: 0.9025, test_f1: 0.6347
 epoch: 94, train_loss: 0.4244, test_loss: 0.9881, test_f1: 0.6445
 epoch: 95, train_loss: 0.4277, test_loss: 0.9755, test_f1: 0.6488
 epoch: 96, train_loss: 0.4326, test_loss: 0.9299, test_f1: 0.6499
 epoch: 97, train_loss: 0.4124, test_loss: 0.9598, test_f1: 0.6559
 epoch: 98, train_loss: 0.4332, test_loss: 1.0492, test_f1: 0.6138
 epoch: 99, train_loss: 0.4111, test_loss: 0.8864, test_f1: 0.6400
##################ITERATION #6 ****************************************
 epoch: 0, train_loss: 1.1975, test_loss: 1.1050, test_f1: 0.3797
 epoch: 1, train_loss: 1.0405, test_loss: 1.0673, test_f1: 0.4540
 epoch: 2, train_loss: 1.0174, test_loss: 1.2689, test_f1: 0.3911
 epoch: 3, train_loss: 0.9811, test_loss: 1.0184, test_f1: 0.4673
 epoch: 4, train_loss: 0.9814, test_loss: 0.9885, test_f1: 0.4685
 epoch: 5, train_loss: 0.9458, test_loss: 1.0551, test_f1: 0.4686
 epoch: 6, train_loss: 0.9126, test_loss: 0.9269, test_f1: 0.5152
 epoch: 7, train_loss: 0.8928, test_loss: 0.9492, test_f1: 0.5299
 epoch: 8, train_loss: 0.9088, test_loss: 0.9456, test_f1: 0.4974
 epoch: 9, train_loss: 0.8841, test_loss: 0.9875, test_f1: 0.5240
 epoch: 10, train_loss: 0.8561, test_loss: 1.0017, test_f1: 0.5092
 epoch: 11, train_loss: 0.8463, test_loss: 0.9076, test_f1: 0.5269
 epoch: 12, train_loss: 0.8290, test_loss: 0.9358, test_f1: 0.5207
 epoch: 13, train_loss: 0.8481, test_loss: 0.9303, test_f1: 0.5111
 epoch: 14, train_loss: 0.8424, test_loss: 0.9620, test_f1: 0.5227
 epoch: 15, train_loss: 0.8116, test_loss: 0.9923, test_f1: 0.5208
 epoch: 16, train_loss: 0.8128, test_loss: 0.9678, test_f1: 0.4727
 epoch: 17, train_loss: 0.7852, test_loss: 0.8455, test_f1: 0.6205
 epoch: 18, train_loss: 0.7736, test_loss: 1.1508, test_f1: 0.4853
 epoch: 19, train_loss: 0.7849, test_loss: 0.9297, test_f1: 0.5509
 epoch: 20, train_loss: 0.7685, test_loss: 0.8359, test_f1: 0.5434
 epoch: 21, train_loss: 0.7524, test_loss: 0.9373, test_f1: 0.5532
 epoch: 22, train_loss: 0.7568, test_loss: 0.8626, test_f1: 0.5516
 epoch: 23, train_loss: 0.7396, test_loss: 0.9677, test_f1: 0.5490
 epoch: 24, train_loss: 0.7380, test_loss: 0.8449, test_f1: 0.5677
 epoch: 25, train_loss: 0.7170, test_loss: 0.8131, test_f1: 0.6130
 epoch: 26, train_loss: 0.7255, test_loss: 0.8802, test_f1: 0.5831
 epoch: 27, train_loss: 0.7241, test_loss: 0.8323, test_f1: 0.6075
 epoch: 28, train_loss: 0.7084, test_loss: 1.0079, test_f1: 0.5324
 epoch: 29, train_loss: 0.7540, test_loss: 0.9264, test_f1: 0.5102
 epoch: 30, train_loss: 0.6952, test_loss: 0.8091, test_f1: 0.5913
 epoch: 31, train_loss: 0.6976, test_loss: 0.8560, test_f1: 0.5690
 epoch: 32, train_loss: 0.6962, test_loss: 0.8392, test_f1: 0.5524
 epoch: 33, train_loss: 0.6964, test_loss: 0.9459, test_f1: 0.6131
 epoch: 34, train_loss: 0.7054, test_loss: 0.8592, test_f1: 0.6213
 epoch: 35, train_loss: 0.6946, test_loss: 0.9376, test_f1: 0.5464
 epoch: 36, train_loss: 0.6656, test_loss: 0.8721, test_f1: 0.6623
 epoch: 37, train_loss: 0.6638, test_loss: 0.9306, test_f1: 0.6527
 epoch: 38, train_loss: 0.6614, test_loss: 0.8290, test_f1: 0.6522
 epoch: 39, train_loss: 0.6534, test_loss: 0.8238, test_f1: 0.6400
 epoch: 40, train_loss: 0.6571, test_loss: 0.8756, test_f1: 0.5878
 epoch: 41, train_loss: 0.6621, test_loss: 0.8268, test_f1: 0.6374
 epoch: 42, train_loss: 0.6477, test_loss: 0.9707, test_f1: 0.6180
 epoch: 43, train_loss: 0.6554, test_loss: 0.9370, test_f1: 0.5792
 epoch: 44, train_loss: 0.6554, test_loss: 1.1826, test_f1: 0.5545
 epoch: 45, train_loss: 0.6448, test_loss: 0.8958, test_f1: 0.6067
 epoch: 46, train_loss: 0.6367, test_loss: 0.8886, test_f1: 0.6182
 epoch: 47, train_loss: 0.6602, test_loss: 0.8391, test_f1: 0.6146
 epoch: 48, train_loss: 0.6262, test_loss: 0.8558, test_f1: 0.6267
 epoch: 49, train_loss: 0.6131, test_loss: 1.1886, test_f1: 0.5900
 epoch: 50, train_loss: 0.5952, test_loss: 1.0013, test_f1: 0.6232
 epoch: 51, train_loss: 0.5861, test_loss: 0.9207, test_f1: 0.6514
 epoch: 52, train_loss: 0.5710, test_loss: 0.9418, test_f1: 0.6607
 epoch: 53, train_loss: 0.5560, test_loss: 0.8992, test_f1: 0.6797
 epoch: 54, train_loss: 0.5748, test_loss: 0.8867, test_f1: 0.6422
 epoch: 55, train_loss: 0.5647, test_loss: 0.8738, test_f1: 0.6515
 epoch: 56, train_loss: 0.5516, test_loss: 0.9757, test_f1: 0.6374
 epoch: 57, train_loss: 0.5340, test_loss: 0.8719, test_f1: 0.6487
 epoch: 58, train_loss: 0.5481, test_loss: 1.0204, test_f1: 0.6325
 epoch: 59, train_loss: 0.5318, test_loss: 0.8732, test_f1: 0.6611
 epoch: 60, train_loss: 0.5278, test_loss: 0.9173, test_f1: 0.6580
 epoch: 61, train_loss: 0.5102, test_loss: 1.0114, test_f1: 0.6388
 epoch: 62, train_loss: 0.5229, test_loss: 0.9563, test_f1: 0.6576
 epoch: 63, train_loss: 0.5109, test_loss: 1.0790, test_f1: 0.6370
 epoch: 64, train_loss: 0.5198, test_loss: 0.9734, test_f1: 0.6597
 epoch: 65, train_loss: 0.5133, test_loss: 0.9210, test_f1: 0.6682
 epoch: 66, train_loss: 0.5150, test_loss: 0.9528, test_f1: 0.6468
 epoch: 67, train_loss: 0.5092, test_loss: 0.9207, test_f1: 0.6734
 epoch: 68, train_loss: 0.5079, test_loss: 0.9271, test_f1: 0.6724
 epoch: 69, train_loss: 0.4967, test_loss: 0.9431, test_f1: 0.6608
 epoch: 70, train_loss: 0.4992, test_loss: 1.0017, test_f1: 0.6547
 epoch: 71, train_loss: 0.5097, test_loss: 1.1326, test_f1: 0.6447
 epoch: 72, train_loss: 0.5085, test_loss: 0.9636, test_f1: 0.6583
 epoch: 73, train_loss: 0.4973, test_loss: 0.9714, test_f1: 0.6307
 epoch: 74, train_loss: 0.4999, test_loss: 0.8835, test_f1: 0.6550
 epoch: 75, train_loss: 0.4804, test_loss: 0.9370, test_f1: 0.6607
 epoch: 76, train_loss: 0.4941, test_loss: 0.8487, test_f1: 0.6696
 epoch: 77, train_loss: 0.4882, test_loss: 0.9513, test_f1: 0.6547
 epoch: 78, train_loss: 0.5045, test_loss: 0.9980, test_f1: 0.6585
 epoch: 79, train_loss: 0.4687, test_loss: 0.9011, test_f1: 0.6820
 epoch: 80, train_loss: 0.4806, test_loss: 0.9717, test_f1: 0.6556
 epoch: 81, train_loss: 0.4880, test_loss: 0.8983, test_f1: 0.6619
 epoch: 82, train_loss: 0.4902, test_loss: 0.9268, test_f1: 0.6790
 epoch: 83, train_loss: 0.4733, test_loss: 0.9521, test_f1: 0.6588
 epoch: 84, train_loss: 0.4772, test_loss: 0.9407, test_f1: 0.6728
 epoch: 85, train_loss: 0.4936, test_loss: 0.9020, test_f1: 0.6475
 epoch: 86, train_loss: 0.4763, test_loss: 0.9538, test_f1: 0.6507
 epoch: 87, train_loss: 0.4664, test_loss: 0.8654, test_f1: 0.6582
 epoch: 88, train_loss: 0.4468, test_loss: 0.9298, test_f1: 0.6624
 epoch: 89, train_loss: 0.4686, test_loss: 0.9262, test_f1: 0.6857
 epoch: 90, train_loss: 0.4533, test_loss: 0.9962, test_f1: 0.6206
 epoch: 91, train_loss: 0.4558, test_loss: 1.0330, test_f1: 0.6162
 epoch: 92, train_loss: 0.4596, test_loss: 0.9875, test_f1: 0.6606
 epoch: 93, train_loss: 0.4375, test_loss: 1.0184, test_f1: 0.6538
 epoch: 94, train_loss: 0.4642, test_loss: 1.1796, test_f1: 0.6441
 epoch: 95, train_loss: 0.4640, test_loss: 0.8855, test_f1: 0.6695
 epoch: 96, train_loss: 0.4378, test_loss: 0.8577, test_f1: 0.6579
 epoch: 97, train_loss: 0.4687, test_loss: 1.0870, test_f1: 0.6639
 epoch: 98, train_loss: 0.4562, test_loss: 1.0080, test_f1: 0.6427
 epoch: 99, train_loss: 0.4557, test_loss: 0.8990, test_f1: 0.6646
##################ITERATION #7 ****************************************
 epoch: 0, train_loss: 1.1730, test_loss: 1.1123, test_f1: 0.4382
 epoch: 1, train_loss: 1.0505, test_loss: 1.0907, test_f1: 0.4667
 epoch: 2, train_loss: 0.9955, test_loss: 1.0730, test_f1: 0.4556
 epoch: 3, train_loss: 0.9886, test_loss: 1.0855, test_f1: 0.4975
 epoch: 4, train_loss: 0.9716, test_loss: 1.0960, test_f1: 0.4912
 epoch: 5, train_loss: 0.9507, test_loss: 1.0731, test_f1: 0.5407
 epoch: 6, train_loss: 0.9368, test_loss: 0.9981, test_f1: 0.5504
 epoch: 7, train_loss: 0.9274, test_loss: 0.9951, test_f1: 0.5222
 epoch: 8, train_loss: 0.9013, test_loss: 1.3694, test_f1: 0.4660
 epoch: 9, train_loss: 0.8993, test_loss: 1.0279, test_f1: 0.5037
 epoch: 10, train_loss: 0.9029, test_loss: 1.0985, test_f1: 0.5010
 epoch: 11, train_loss: 0.8735, test_loss: 1.0338, test_f1: 0.4800
 epoch: 12, train_loss: 0.8545, test_loss: 1.1621, test_f1: 0.4921
 epoch: 13, train_loss: 0.9099, test_loss: 0.9931, test_f1: 0.5179
 epoch: 14, train_loss: 0.8696, test_loss: 0.9587, test_f1: 0.5146
 epoch: 15, train_loss: 0.8477, test_loss: 0.9464, test_f1: 0.5319
 epoch: 16, train_loss: 0.8538, test_loss: 0.9236, test_f1: 0.5409
 epoch: 17, train_loss: 0.8220, test_loss: 0.9980, test_f1: 0.5232
 epoch: 18, train_loss: 0.8378, test_loss: 0.8409, test_f1: 0.5676
 epoch: 19, train_loss: 0.8255, test_loss: 0.9793, test_f1: 0.5196
 epoch: 20, train_loss: 0.8132, test_loss: 1.0134, test_f1: 0.5128
 epoch: 21, train_loss: 0.8059, test_loss: 0.9627, test_f1: 0.5272
 epoch: 22, train_loss: 0.7870, test_loss: 0.9883, test_f1: 0.5004
 epoch: 23, train_loss: 0.8009, test_loss: 1.0217, test_f1: 0.5203
 epoch: 24, train_loss: 0.8077, test_loss: 1.0358, test_f1: 0.5019
 epoch: 25, train_loss: 0.7949, test_loss: 0.9698, test_f1: 0.5496
 epoch: 26, train_loss: 0.7848, test_loss: 0.9178, test_f1: 0.5554
 epoch: 27, train_loss: 0.7768, test_loss: 1.0319, test_f1: 0.4998
 epoch: 28, train_loss: 0.7755, test_loss: 0.9884, test_f1: 0.5565
 epoch: 29, train_loss: 0.7899, test_loss: 1.0127, test_f1: 0.5426
 epoch: 30, train_loss: 0.7576, test_loss: 0.8914, test_f1: 0.5647
 epoch: 31, train_loss: 0.7465, test_loss: 0.9426, test_f1: 0.5680
 epoch: 32, train_loss: 0.7551, test_loss: 0.8088, test_f1: 0.5890
 epoch: 33, train_loss: 0.7578, test_loss: 0.9858, test_f1: 0.5934
 epoch: 34, train_loss: 0.7358, test_loss: 0.8306, test_f1: 0.5702
 epoch: 35, train_loss: 0.7395, test_loss: 0.9910, test_f1: 0.5237
 epoch: 36, train_loss: 0.7245, test_loss: 0.8640, test_f1: 0.5955
 epoch: 37, train_loss: 0.7334, test_loss: 0.9278, test_f1: 0.5535
 epoch: 38, train_loss: 0.7385, test_loss: 0.9972, test_f1: 0.5492
 epoch: 39, train_loss: 0.7395, test_loss: 0.9046, test_f1: 0.5587
 epoch: 40, train_loss: 0.7176, test_loss: 0.9051, test_f1: 0.5764
 epoch: 41, train_loss: 0.7244, test_loss: 0.9938, test_f1: 0.5676
 epoch: 42, train_loss: 0.7204, test_loss: 0.8469, test_f1: 0.5815
 epoch: 43, train_loss: 0.7012, test_loss: 0.8855, test_f1: 0.5809
 epoch: 44, train_loss: 0.7023, test_loss: 0.8283, test_f1: 0.5603
 epoch: 45, train_loss: 0.7227, test_loss: 0.8182, test_f1: 0.6060
 epoch: 46, train_loss: 0.6832, test_loss: 0.9792, test_f1: 0.6185
 epoch: 47, train_loss: 0.6766, test_loss: 0.9520, test_f1: 0.5750
 epoch: 48, train_loss: 0.6847, test_loss: 0.9100, test_f1: 0.6039
 epoch: 49, train_loss: 0.6943, test_loss: 0.9523, test_f1: 0.5247
 epoch: 50, train_loss: 0.6759, test_loss: 0.8286, test_f1: 0.6185
 epoch: 51, train_loss: 0.6608, test_loss: 1.0099, test_f1: 0.5888
 epoch: 52, train_loss: 0.6211, test_loss: 0.8383, test_f1: 0.6109
 epoch: 53, train_loss: 0.6207, test_loss: 0.9086, test_f1: 0.5831
 epoch: 54, train_loss: 0.6321, test_loss: 1.0737, test_f1: 0.5880
 epoch: 55, train_loss: 0.6169, test_loss: 0.8571, test_f1: 0.6092
 epoch: 56, train_loss: 0.6066, test_loss: 0.9291, test_f1: 0.6094
 epoch: 57, train_loss: 0.6059, test_loss: 0.8185, test_f1: 0.6474
 epoch: 58, train_loss: 0.6010, test_loss: 0.9156, test_f1: 0.6278
 epoch: 59, train_loss: 0.6000, test_loss: 0.8026, test_f1: 0.6676
 epoch: 60, train_loss: 0.5872, test_loss: 0.8474, test_f1: 0.6383
 epoch: 61, train_loss: 0.5808, test_loss: 0.8432, test_f1: 0.6088
 epoch: 62, train_loss: 0.5785, test_loss: 0.8754, test_f1: 0.6272
 epoch: 63, train_loss: 0.5852, test_loss: 0.7947, test_f1: 0.6260
 epoch: 64, train_loss: 0.5897, test_loss: 0.8048, test_f1: 0.6220
 epoch: 65, train_loss: 0.5778, test_loss: 0.8197, test_f1: 0.6135
 epoch: 66, train_loss: 0.5803, test_loss: 0.8085, test_f1: 0.6183
 epoch: 67, train_loss: 0.5961, test_loss: 0.8373, test_f1: 0.6339
 epoch: 68, train_loss: 0.5593, test_loss: 0.8533, test_f1: 0.6156
 epoch: 69, train_loss: 0.5557, test_loss: 0.9370, test_f1: 0.6207
 epoch: 70, train_loss: 0.5570, test_loss: 0.8427, test_f1: 0.6362
 epoch: 71, train_loss: 0.5563, test_loss: 0.8747, test_f1: 0.6350
 epoch: 72, train_loss: 0.5431, test_loss: 0.8358, test_f1: 0.6331
 epoch: 73, train_loss: 0.5474, test_loss: 0.8464, test_f1: 0.6392
 epoch: 74, train_loss: 0.5545, test_loss: 0.8285, test_f1: 0.6586
 epoch: 75, train_loss: 0.5328, test_loss: 0.8981, test_f1: 0.6441
 epoch: 76, train_loss: 0.5376, test_loss: 0.8399, test_f1: 0.6400
 epoch: 77, train_loss: 0.5510, test_loss: 0.9409, test_f1: 0.6478
 epoch: 78, train_loss: 0.5376, test_loss: 0.8696, test_f1: 0.6747
 epoch: 79, train_loss: 0.5468, test_loss: 0.8446, test_f1: 0.6516
 epoch: 80, train_loss: 0.5186, test_loss: 0.9324, test_f1: 0.6189
 epoch: 81, train_loss: 0.5421, test_loss: 0.9486, test_f1: 0.6393
 epoch: 82, train_loss: 0.5153, test_loss: 0.8319, test_f1: 0.6491
 epoch: 83, train_loss: 0.5196, test_loss: 0.8514, test_f1: 0.6601
 epoch: 84, train_loss: 0.5364, test_loss: 0.8030, test_f1: 0.6687
 epoch: 85, train_loss: 0.5175, test_loss: 0.8918, test_f1: 0.6269
 epoch: 86, train_loss: 0.5291, test_loss: 0.8079, test_f1: 0.6912
 epoch: 87, train_loss: 0.5059, test_loss: 0.9314, test_f1: 0.6308
 epoch: 88, train_loss: 0.5163, test_loss: 0.8376, test_f1: 0.6562
 epoch: 89, train_loss: 0.5067, test_loss: 0.9727, test_f1: 0.6204
 epoch: 90, train_loss: 0.5569, test_loss: 1.0010, test_f1: 0.6397
 epoch: 91, train_loss: 0.5025, test_loss: 0.7394, test_f1: 0.6447
 epoch: 92, train_loss: 0.4839, test_loss: 0.8769, test_f1: 0.6572
 epoch: 93, train_loss: 0.4979, test_loss: 0.8101, test_f1: 0.6703
 epoch: 94, train_loss: 0.5352, test_loss: 0.9045, test_f1: 0.6104
 epoch: 95, train_loss: 0.5143, test_loss: 0.8485, test_f1: 0.6605
 epoch: 96, train_loss: 0.4879, test_loss: 0.8880, test_f1: 0.6647
 epoch: 97, train_loss: 0.4998, test_loss: 0.7890, test_f1: 0.6610
 epoch: 98, train_loss: 0.4833, test_loss: 0.9066, test_f1: 0.6697
 epoch: 99, train_loss: 0.4968, test_loss: 0.8562, test_f1: 0.6820
##################ITERATION #8 ****************************************
 epoch: 0, train_loss: 1.1486, test_loss: 1.1322, test_f1: 0.4391
 epoch: 1, train_loss: 1.0304, test_loss: 0.9832, test_f1: 0.4650
 epoch: 2, train_loss: 0.9972, test_loss: 1.0301, test_f1: 0.4469
 epoch: 3, train_loss: 0.9717, test_loss: 1.0185, test_f1: 0.5060
 epoch: 4, train_loss: 0.9389, test_loss: 0.9403, test_f1: 0.5198
 epoch: 5, train_loss: 0.9229, test_loss: 0.9575, test_f1: 0.5227
 epoch: 6, train_loss: 0.8959, test_loss: 0.8690, test_f1: 0.5355
 epoch: 7, train_loss: 0.8998, test_loss: 0.8357, test_f1: 0.6159
 epoch: 8, train_loss: 0.8984, test_loss: 0.8883, test_f1: 0.5479
 epoch: 9, train_loss: 0.8656, test_loss: 0.8998, test_f1: 0.5758
 epoch: 10, train_loss: 0.8536, test_loss: 0.8881, test_f1: 0.5573
 epoch: 11, train_loss: 0.8540, test_loss: 0.8652, test_f1: 0.5433
 epoch: 12, train_loss: 0.8242, test_loss: 1.0249, test_f1: 0.5244
 epoch: 13, train_loss: 0.8590, test_loss: 0.9100, test_f1: 0.5289
 epoch: 14, train_loss: 0.8425, test_loss: 0.9912, test_f1: 0.4824
 epoch: 15, train_loss: 0.8297, test_loss: 1.0374, test_f1: 0.5105
 epoch: 16, train_loss: 0.8040, test_loss: 0.9105, test_f1: 0.5579
 epoch: 17, train_loss: 0.8133, test_loss: 0.9445, test_f1: 0.5314
 epoch: 18, train_loss: 0.8018, test_loss: 0.9891, test_f1: 0.5000
 epoch: 19, train_loss: 0.8012, test_loss: 0.8738, test_f1: 0.6243
 epoch: 20, train_loss: 0.8459, test_loss: 0.9913, test_f1: 0.5275
 epoch: 21, train_loss: 0.8102, test_loss: 0.9305, test_f1: 0.5539
 epoch: 22, train_loss: 0.7964, test_loss: 0.9853, test_f1: 0.5713
 epoch: 23, train_loss: 0.7818, test_loss: 0.9662, test_f1: 0.5918
 epoch: 24, train_loss: 0.7807, test_loss: 0.9012, test_f1: 0.5949
 epoch: 25, train_loss: 0.7730, test_loss: 0.9199, test_f1: 0.5594
 epoch: 26, train_loss: 0.7722, test_loss: 0.8732, test_f1: 0.6382
 epoch: 27, train_loss: 0.7626, test_loss: 0.8642, test_f1: 0.5860
 epoch: 28, train_loss: 0.7461, test_loss: 0.8807, test_f1: 0.6036
 epoch: 29, train_loss: 0.7645, test_loss: 0.9911, test_f1: 0.5388
 epoch: 30, train_loss: 0.7534, test_loss: 0.9384, test_f1: 0.5456
 epoch: 31, train_loss: 0.7357, test_loss: 0.8733, test_f1: 0.6048
 epoch: 32, train_loss: 0.7436, test_loss: 0.7971, test_f1: 0.5818
 epoch: 33, train_loss: 0.7225, test_loss: 0.8579, test_f1: 0.6074
 epoch: 34, train_loss: 0.7363, test_loss: 0.9218, test_f1: 0.5928
 epoch: 35, train_loss: 0.7055, test_loss: 0.9535, test_f1: 0.5674
 epoch: 36, train_loss: 0.7004, test_loss: 0.8587, test_f1: 0.6311
 epoch: 37, train_loss: 0.7044, test_loss: 0.9050, test_f1: 0.6275
 epoch: 38, train_loss: 0.6864, test_loss: 0.9597, test_f1: 0.5868
 epoch: 39, train_loss: 0.7145, test_loss: 0.9362, test_f1: 0.5767
 epoch: 40, train_loss: 0.7014, test_loss: 0.8294, test_f1: 0.6350
 epoch: 41, train_loss: 0.6798, test_loss: 0.8665, test_f1: 0.6065
 epoch: 42, train_loss: 0.6964, test_loss: 0.8877, test_f1: 0.5934
 epoch: 43, train_loss: 0.6997, test_loss: 0.9918, test_f1: 0.6067
 epoch: 44, train_loss: 0.6899, test_loss: 0.9350, test_f1: 0.6468
 epoch: 45, train_loss: 0.6837, test_loss: 0.9466, test_f1: 0.6523
 epoch: 46, train_loss: 0.6757, test_loss: 0.8915, test_f1: 0.6494
 epoch: 47, train_loss: 0.6660, test_loss: 0.9641, test_f1: 0.5589
 epoch: 48, train_loss: 0.6626, test_loss: 0.8849, test_f1: 0.6060
 epoch: 49, train_loss: 0.6454, test_loss: 1.0374, test_f1: 0.6109
 epoch: 50, train_loss: 0.6379, test_loss: 0.9213, test_f1: 0.6411
 epoch: 51, train_loss: 0.6293, test_loss: 0.9878, test_f1: 0.6252
 epoch: 52, train_loss: 0.6083, test_loss: 0.9974, test_f1: 0.6427
 epoch: 53, train_loss: 0.5777, test_loss: 1.0007, test_f1: 0.6355
 epoch: 54, train_loss: 0.5898, test_loss: 1.0073, test_f1: 0.6390
 epoch: 55, train_loss: 0.5943, test_loss: 0.9798, test_f1: 0.6504
 epoch: 56, train_loss: 0.5804, test_loss: 0.9943, test_f1: 0.6402
 epoch: 57, train_loss: 0.5794, test_loss: 1.0160, test_f1: 0.6409
 epoch: 58, train_loss: 0.5788, test_loss: 0.9804, test_f1: 0.6500
 epoch: 59, train_loss: 0.5628, test_loss: 0.9494, test_f1: 0.6271
 epoch: 60, train_loss: 0.5468, test_loss: 1.0583, test_f1: 0.6570
 epoch: 61, train_loss: 0.5481, test_loss: 1.0680, test_f1: 0.6382
 epoch: 62, train_loss: 0.5737, test_loss: 0.9636, test_f1: 0.6488
 epoch: 63, train_loss: 0.5591, test_loss: 0.9648, test_f1: 0.6378
 epoch: 64, train_loss: 0.5419, test_loss: 1.0736, test_f1: 0.6310
 epoch: 65, train_loss: 0.5515, test_loss: 0.8979, test_f1: 0.6509
 epoch: 66, train_loss: 0.5469, test_loss: 1.1062, test_f1: 0.6560
 epoch: 67, train_loss: 0.5319, test_loss: 1.0517, test_f1: 0.6267
 epoch: 68, train_loss: 0.5619, test_loss: 0.9691, test_f1: 0.6596
 epoch: 69, train_loss: 0.5310, test_loss: 1.0815, test_f1: 0.6173
 epoch: 70, train_loss: 0.5362, test_loss: 0.9900, test_f1: 0.6419
 epoch: 71, train_loss: 0.5302, test_loss: 1.0142, test_f1: 0.6358
 epoch: 72, train_loss: 0.5281, test_loss: 1.0540, test_f1: 0.6464
 epoch: 73, train_loss: 0.5204, test_loss: 0.9841, test_f1: 0.6570
 epoch: 74, train_loss: 0.5195, test_loss: 1.0052, test_f1: 0.6326
 epoch: 75, train_loss: 0.5139, test_loss: 1.0299, test_f1: 0.6649
 epoch: 76, train_loss: 0.5160, test_loss: 1.0716, test_f1: 0.6461
 epoch: 77, train_loss: 0.5157, test_loss: 1.1998, test_f1: 0.6395
 epoch: 78, train_loss: 0.5098, test_loss: 0.9795, test_f1: 0.6512
 epoch: 79, train_loss: 0.5289, test_loss: 0.9857, test_f1: 0.6568
 epoch: 80, train_loss: 0.5094, test_loss: 1.0773, test_f1: 0.6235
 epoch: 81, train_loss: 0.4912, test_loss: 1.0393, test_f1: 0.6501
 epoch: 82, train_loss: 0.4957, test_loss: 1.0206, test_f1: 0.6396
 epoch: 83, train_loss: 0.5055, test_loss: 1.1313, test_f1: 0.6351
 epoch: 84, train_loss: 0.4759, test_loss: 1.1167, test_f1: 0.6540
 epoch: 85, train_loss: 0.4741, test_loss: 1.1177, test_f1: 0.6401
 epoch: 86, train_loss: 0.4945, test_loss: 1.1252, test_f1: 0.6535
 epoch: 87, train_loss: 0.4958, test_loss: 1.1473, test_f1: 0.6655
 epoch: 88, train_loss: 0.4962, test_loss: 1.1071, test_f1: 0.6450
 epoch: 89, train_loss: 0.4842, test_loss: 1.1352, test_f1: 0.6528
 epoch: 90, train_loss: 0.4643, test_loss: 1.0940, test_f1: 0.6832
 epoch: 91, train_loss: 0.4727, test_loss: 1.0936, test_f1: 0.6342
 epoch: 92, train_loss: 0.4663, test_loss: 1.1948, test_f1: 0.6527
 epoch: 93, train_loss: 0.4740, test_loss: 0.9530, test_f1: 0.6567
 epoch: 94, train_loss: 0.4683, test_loss: 1.1097, test_f1: 0.6235
 epoch: 95, train_loss: 0.4736, test_loss: 1.1384, test_f1: 0.6445
 epoch: 96, train_loss: 0.4718, test_loss: 1.1797, test_f1: 0.6524
 epoch: 97, train_loss: 0.4626, test_loss: 1.1508, test_f1: 0.6480
 epoch: 98, train_loss: 0.4403, test_loss: 1.0813, test_f1: 0.6378
 epoch: 99, train_loss: 0.4878, test_loss: 1.1118, test_f1: 0.6227
##################ITERATION #9 ****************************************
 epoch: 0, train_loss: 1.1814, test_loss: 1.1070, test_f1: 0.4832
 epoch: 1, train_loss: 1.0539, test_loss: 1.0968, test_f1: 0.4788
 epoch: 2, train_loss: 1.0092, test_loss: 1.0684, test_f1: 0.4657
 epoch: 3, train_loss: 0.9981, test_loss: 1.2265, test_f1: 0.4931
 epoch: 4, train_loss: 0.9889, test_loss: 0.9720, test_f1: 0.5461
 epoch: 5, train_loss: 0.9796, test_loss: 1.0129, test_f1: 0.4445
 epoch: 6, train_loss: 0.9412, test_loss: 0.9942, test_f1: 0.4271
 epoch: 7, train_loss: 0.9426, test_loss: 0.9386, test_f1: 0.5464
 epoch: 8, train_loss: 0.9217, test_loss: 1.0124, test_f1: 0.5018
 epoch: 9, train_loss: 0.8903, test_loss: 0.8698, test_f1: 0.5217
 epoch: 10, train_loss: 0.9013, test_loss: 1.2199, test_f1: 0.4881
 epoch: 11, train_loss: 0.8820, test_loss: 1.1357, test_f1: 0.4342
 epoch: 12, train_loss: 0.8704, test_loss: 0.9787, test_f1: 0.5095
 epoch: 13, train_loss: 0.8781, test_loss: 0.9660, test_f1: 0.5112
 epoch: 14, train_loss: 0.8491, test_loss: 0.9190, test_f1: 0.5308
 epoch: 15, train_loss: 0.8309, test_loss: 1.0725, test_f1: 0.4741
 epoch: 16, train_loss: 0.8457, test_loss: 0.9921, test_f1: 0.5071
 epoch: 17, train_loss: 0.8339, test_loss: 0.9838, test_f1: 0.4924
 epoch: 18, train_loss: 0.8269, test_loss: 0.8551, test_f1: 0.5407
 epoch: 19, train_loss: 0.8036, test_loss: 0.9214, test_f1: 0.4942
 epoch: 20, train_loss: 0.8027, test_loss: 0.8943, test_f1: 0.5374
 epoch: 21, train_loss: 0.8093, test_loss: 0.7980, test_f1: 0.5459
 epoch: 22, train_loss: 0.8026, test_loss: 0.9154, test_f1: 0.5534
 epoch: 23, train_loss: 0.7723, test_loss: 0.8899, test_f1: 0.5417
 epoch: 24, train_loss: 0.7728, test_loss: 0.9154, test_f1: 0.5276
 epoch: 25, train_loss: 0.7857, test_loss: 0.9794, test_f1: 0.5093
 epoch: 26, train_loss: 0.7966, test_loss: 0.9779, test_f1: 0.5053
 epoch: 27, train_loss: 0.7909, test_loss: 0.9570, test_f1: 0.5227
 epoch: 28, train_loss: 0.7584, test_loss: 1.1138, test_f1: 0.4991
 epoch: 29, train_loss: 0.7559, test_loss: 0.8873, test_f1: 0.5255
 epoch: 30, train_loss: 0.7510, test_loss: 0.9147, test_f1: 0.5155
 epoch: 31, train_loss: 0.7376, test_loss: 1.1745, test_f1: 0.5442
 epoch: 32, train_loss: 0.7551, test_loss: 0.9697, test_f1: 0.5213
 epoch: 33, train_loss: 0.7342, test_loss: 0.9239, test_f1: 0.5468
 epoch: 34, train_loss: 0.7417, test_loss: 1.0891, test_f1: 0.5172
 epoch: 35, train_loss: 0.8000, test_loss: 0.9782, test_f1: 0.4886
 epoch: 36, train_loss: 0.7937, test_loss: 0.8469, test_f1: 0.5576
 epoch: 37, train_loss: 0.7454, test_loss: 0.8268, test_f1: 0.6260
 epoch: 38, train_loss: 0.7332, test_loss: 0.9421, test_f1: 0.5580
 epoch: 39, train_loss: 0.7270, test_loss: 0.9300, test_f1: 0.5536
 epoch: 40, train_loss: 0.7216, test_loss: 0.8226, test_f1: 0.5651
 epoch: 41, train_loss: 0.7130, test_loss: 0.8854, test_f1: 0.5575
 epoch: 42, train_loss: 0.7032, test_loss: 0.9866, test_f1: 0.5601
 epoch: 43, train_loss: 0.7146, test_loss: 0.8619, test_f1: 0.5451
 epoch: 44, train_loss: 0.7202, test_loss: 0.8615, test_f1: 0.6078
 epoch: 45, train_loss: 0.6771, test_loss: 0.8247, test_f1: 0.6302
 epoch: 46, train_loss: 0.7053, test_loss: 0.9967, test_f1: 0.5640
 epoch: 47, train_loss: 0.7129, test_loss: 0.8100, test_f1: 0.5952
 epoch: 48, train_loss: 0.6864, test_loss: 0.9053, test_f1: 0.6301
 epoch: 49, train_loss: 0.6830, test_loss: 1.0469, test_f1: 0.5622
 epoch: 50, train_loss: 0.6810, test_loss: 0.8277, test_f1: 0.5796
 epoch: 51, train_loss: 0.6513, test_loss: 0.8516, test_f1: 0.6030
 epoch: 52, train_loss: 0.6327, test_loss: 0.8138, test_f1: 0.6301
 epoch: 53, train_loss: 0.6223, test_loss: 0.8538, test_f1: 0.6331
 epoch: 54, train_loss: 0.6126, test_loss: 0.8947, test_f1: 0.6440
 epoch: 55, train_loss: 0.6036, test_loss: 0.9216, test_f1: 0.6466
 epoch: 56, train_loss: 0.5957, test_loss: 0.9859, test_f1: 0.6188
 epoch: 57, train_loss: 0.5870, test_loss: 0.9479, test_f1: 0.6344
 epoch: 58, train_loss: 0.6028, test_loss: 0.9647, test_f1: 0.6340
 epoch: 59, train_loss: 0.5890, test_loss: 0.8351, test_f1: 0.6528
 epoch: 60, train_loss: 0.5880, test_loss: 0.8478, test_f1: 0.6144
 epoch: 61, train_loss: 0.5753, test_loss: 0.9650, test_f1: 0.6429
 epoch: 62, train_loss: 0.5817, test_loss: 0.8130, test_f1: 0.6409
 epoch: 63, train_loss: 0.5848, test_loss: 0.9874, test_f1: 0.6665
 epoch: 64, train_loss: 0.5702, test_loss: 0.8851, test_f1: 0.6245
 epoch: 65, train_loss: 0.5929, test_loss: 0.7797, test_f1: 0.6304
 epoch: 66, train_loss: 0.5763, test_loss: 0.9462, test_f1: 0.6369
 epoch: 67, train_loss: 0.5653, test_loss: 0.8987, test_f1: 0.6132
 epoch: 68, train_loss: 0.5700, test_loss: 0.9180, test_f1: 0.6446
 epoch: 69, train_loss: 0.5624, test_loss: 0.8655, test_f1: 0.6175
 epoch: 70, train_loss: 0.5558, test_loss: 0.9195, test_f1: 0.6627
 epoch: 71, train_loss: 0.5733, test_loss: 1.0143, test_f1: 0.6341
 epoch: 72, train_loss: 0.5465, test_loss: 0.9479, test_f1: 0.6227
 epoch: 73, train_loss: 0.5472, test_loss: 0.9664, test_f1: 0.6535
 epoch: 74, train_loss: 0.5412, test_loss: 0.9384, test_f1: 0.6078
 epoch: 75, train_loss: 0.5572, test_loss: 0.9552, test_f1: 0.6547
 epoch: 76, train_loss: 0.5512, test_loss: 0.7634, test_f1: 0.6365
 epoch: 77, train_loss: 0.5678, test_loss: 0.7404, test_f1: 0.6664
 epoch: 78, train_loss: 0.5561, test_loss: 0.9404, test_f1: 0.6231
 epoch: 79, train_loss: 0.5429, test_loss: 0.9703, test_f1: 0.6254
 epoch: 80, train_loss: 0.5265, test_loss: 1.0296, test_f1: 0.6247
 epoch: 81, train_loss: 0.5341, test_loss: 0.8869, test_f1: 0.6081
 epoch: 82, train_loss: 0.5474, test_loss: 0.8882, test_f1: 0.5979
 epoch: 83, train_loss: 0.5328, test_loss: 1.0212, test_f1: 0.6196
 epoch: 84, train_loss: 0.5274, test_loss: 0.9443, test_f1: 0.6363
 epoch: 85, train_loss: 0.5167, test_loss: 0.9380, test_f1: 0.6030
 epoch: 86, train_loss: 0.5280, test_loss: 0.9948, test_f1: 0.6124
 epoch: 87, train_loss: 0.5279, test_loss: 1.0568, test_f1: 0.6390
 epoch: 88, train_loss: 0.5281, test_loss: 1.0449, test_f1: 0.6396
 epoch: 89, train_loss: 0.5507, test_loss: 0.7743, test_f1: 0.6681
 epoch: 90, train_loss: 0.5160, test_loss: 1.0686, test_f1: 0.6224
 epoch: 91, train_loss: 0.5212, test_loss: 0.8622, test_f1: 0.6207
 epoch: 92, train_loss: 0.5221, test_loss: 1.1469, test_f1: 0.6269
 epoch: 93, train_loss: 0.4941, test_loss: 0.9637, test_f1: 0.6488
 epoch: 94, train_loss: 0.4844, test_loss: 1.0156, test_f1: 0.6434
 epoch: 95, train_loss: 0.5171, test_loss: 0.9640, test_f1: 0.6320
 epoch: 96, train_loss: 0.4936, test_loss: 1.0015, test_f1: 0.6281
 epoch: 97, train_loss: 0.4793, test_loss: 0.8905, test_f1: 0.6365
 epoch: 98, train_loss: 0.4947, test_loss: 0.9933, test_f1: 0.6051
 epoch: 99, train_loss: 0.5066, test_loss: 1.0388, test_f1: 0.6286

Training completed in 909.24 seconds
Best F1: 0.6912 at epoch 86
Mean F1 across iterations: 0.6725  0.0116
========================FINAL RESULTS================================
FEGIN weighted F1: 0.6912  0.0116
python main.py --data ltspice_examples --representation component_pin --model FEGIN --layers 6 --hiddens 64 --batch_size 64 --lr 0.01 --emb_size 250 --epochs 100 --save_appendix component_pin_L6_H64_BS64_LR0.01_E250 --no_val
-----



STDERR:
  File "main.py", line 370, in <module>
    main()
  File "main.py", line 254, in main
    dataset = dataset_class(
  File "/home/philip/projects/ltspice_examples_code_repo/Circuit-Completion-Using-GNNs/component_classification_with_link_prediction_head/evaluation/FEGIN/kernel/circuit_datasets.py", line 15, in __init__
    self.data, self.slices = torch.load(self.processed_paths[0])
  File "/home/philip/.local/lib/python3.8/site-packages/torch/serialization.py", line 1040, in load
    warnings.warn(
  File "/usr/lib/python3.8/warnings.py", line 109, in _showwarnmsg
    sw(msg.message, msg.category, msg.filename, msg.lineno,
  File "main.py", line 47, in warn_with_traceback
    traceback.print_stack(file=log)
/home/philip/projects/ltspice_examples_code_repo/Circuit-Completion-Using-GNNs/component_classification_with_link_prediction_head/evaluation/FEGIN/kernel/circuit_datasets.py:15: FutureWarning: You are using `torch.load` with `weights_only=False` (the current default value), which uses the default pickle module implicitly. It is possible to construct malicious pickle data which will execute arbitrary code during unpickling (See https://github.com/pytorch/pytorch/blob/main/SECURITY.md#untrusted-models for more details). In a future release, the default value for `weights_only` will be flipped to `True`. This limits the functions that could be executed during unpickling. Arbitrary objects will no longer be allowed to be loaded via this mode unless they are explicitly allowlisted by the user via `torch.serialization.add_safe_globals`. We recommend you start setting `weights_only=True` for any use case where you don't have full control of the loaded file. Please open an issue on GitHub for any issues related to this experimental feature.
  self.data, self.slices = torch.load(self.processed_paths[0])
