STDOUT:
Results will be saved in /home/philip/projects/ltspice_examples_code_repo/Circuit-Completion-Using-GNNs/component_classification_with_link_prediction_head/evaluation/FEGIN/results/model_FEGIN_dataset_ltspice_examples
Command line input: python main.py --data ltspice_examples --representation component_component --model FEGIN --layers 3 --hiddens 16 --batch_size 64 --lr 0.0001 --emb_size 512 --epochs 100 --save_appendix component_component_L3_H16_BS64_LR0.0001_E512 --no_val
 is saved.
-----
ltspice_examples - FEGIN
Using 3 layers, 16 hidden units, h = 2
Loading component_component representation dataset
ENTERED
Training FEGIN on component_component representation
Train: 3556, Test: 845
##################ITERATION #0 ****************************************
 epoch: 0, train_loss: 1.3631, test_loss: 1.3546, test_f1: 0.2629
 epoch: 1, train_loss: 1.3561, test_loss: 1.3489, test_f1: 0.2356
 epoch: 2, train_loss: 1.3506, test_loss: 1.3433, test_f1: 0.2276
 epoch: 3, train_loss: 1.3459, test_loss: 1.3382, test_f1: 0.2274
 epoch: 4, train_loss: 1.3403, test_loss: 1.3331, test_f1: 0.2274
 epoch: 5, train_loss: 1.3341, test_loss: 1.3292, test_f1: 0.2274
 epoch: 6, train_loss: 1.3291, test_loss: 1.3228, test_f1: 0.2274
 epoch: 7, train_loss: 1.3247, test_loss: 1.3169, test_f1: 0.2274
 epoch: 8, train_loss: 1.3190, test_loss: 1.3135, test_f1: 0.2274
 epoch: 9, train_loss: 1.3145, test_loss: 1.3084, test_f1: 0.2274
 epoch: 10, train_loss: 1.3071, test_loss: 1.3034, test_f1: 0.2274
 epoch: 11, train_loss: 1.3053, test_loss: 1.2995, test_f1: 0.2274
 epoch: 12, train_loss: 1.2980, test_loss: 1.2961, test_f1: 0.2274
 epoch: 13, train_loss: 1.2967, test_loss: 1.2925, test_f1: 0.2274
 epoch: 14, train_loss: 1.2918, test_loss: 1.2902, test_f1: 0.2274
 epoch: 15, train_loss: 1.2919, test_loss: 1.2863, test_f1: 0.2274
 epoch: 16, train_loss: 1.2880, test_loss: 1.2844, test_f1: 0.2274
 epoch: 17, train_loss: 1.2853, test_loss: 1.2816, test_f1: 0.2274
 epoch: 18, train_loss: 1.2825, test_loss: 1.2806, test_f1: 0.2274
 epoch: 19, train_loss: 1.2773, test_loss: 1.2785, test_f1: 0.2274
 epoch: 20, train_loss: 1.2778, test_loss: 1.2769, test_f1: 0.2274
 epoch: 21, train_loss: 1.2691, test_loss: 1.2745, test_f1: 0.2274
 epoch: 22, train_loss: 1.2781, test_loss: 1.2717, test_f1: 0.2274
 epoch: 23, train_loss: 1.2731, test_loss: 1.2704, test_f1: 0.2274
 epoch: 24, train_loss: 1.2696, test_loss: 1.2693, test_f1: 0.2274
 epoch: 25, train_loss: 1.2661, test_loss: 1.2660, test_f1: 0.2274
 epoch: 26, train_loss: 1.2654, test_loss: 1.2642, test_f1: 0.2274
 epoch: 27, train_loss: 1.2594, test_loss: 1.2623, test_f1: 0.2274
 epoch: 28, train_loss: 1.2600, test_loss: 1.2601, test_f1: 0.2274
 epoch: 29, train_loss: 1.2571, test_loss: 1.2560, test_f1: 0.2274
 epoch: 30, train_loss: 1.2523, test_loss: 1.2543, test_f1: 0.2274
 epoch: 31, train_loss: 1.2479, test_loss: 1.2523, test_f1: 0.2274
 epoch: 32, train_loss: 1.2502, test_loss: 1.2500, test_f1: 0.2274
 epoch: 33, train_loss: 1.2462, test_loss: 1.2464, test_f1: 0.2477
 epoch: 34, train_loss: 1.2463, test_loss: 1.2464, test_f1: 0.2706
 epoch: 35, train_loss: 1.2441, test_loss: 1.2413, test_f1: 0.3070
 epoch: 36, train_loss: 1.2407, test_loss: 1.2394, test_f1: 0.3267
 epoch: 37, train_loss: 1.2380, test_loss: 1.2367, test_f1: 0.3352
 epoch: 38, train_loss: 1.2383, test_loss: 1.2337, test_f1: 0.3358
 epoch: 39, train_loss: 1.2330, test_loss: 1.2308, test_f1: 0.3417
 epoch: 40, train_loss: 1.2320, test_loss: 1.2281, test_f1: 0.3477
 epoch: 41, train_loss: 1.2294, test_loss: 1.2281, test_f1: 0.3568
 epoch: 42, train_loss: 1.2322, test_loss: 1.2244, test_f1: 0.3565
 epoch: 43, train_loss: 1.2208, test_loss: 1.2229, test_f1: 0.3575
 epoch: 44, train_loss: 1.2267, test_loss: 1.2210, test_f1: 0.3508
 epoch: 45, train_loss: 1.2188, test_loss: 1.2178, test_f1: 0.3476
 epoch: 46, train_loss: 1.2199, test_loss: 1.2154, test_f1: 0.3468
 epoch: 47, train_loss: 1.2255, test_loss: 1.2115, test_f1: 0.3491
 epoch: 48, train_loss: 1.2183, test_loss: 1.2119, test_f1: 0.3481
 epoch: 49, train_loss: 1.2162, test_loss: 1.2107, test_f1: 0.3544
 epoch: 50, train_loss: 1.2129, test_loss: 1.2079, test_f1: 0.3424
 epoch: 51, train_loss: 1.2091, test_loss: 1.2055, test_f1: 0.3458
 epoch: 52, train_loss: 1.2100, test_loss: 1.2067, test_f1: 0.3485
 epoch: 53, train_loss: 1.2125, test_loss: 1.2058, test_f1: 0.3411
 epoch: 54, train_loss: 1.2190, test_loss: 1.2030, test_f1: 0.3439
 epoch: 55, train_loss: 1.2103, test_loss: 1.2026, test_f1: 0.3441
 epoch: 56, train_loss: 1.2063, test_loss: 1.2026, test_f1: 0.3468
 epoch: 57, train_loss: 1.2098, test_loss: 1.2021, test_f1: 0.3414
 epoch: 58, train_loss: 1.2115, test_loss: 1.2005, test_f1: 0.3448
 epoch: 59, train_loss: 1.2094, test_loss: 1.2010, test_f1: 0.3418
 epoch: 60, train_loss: 1.2078, test_loss: 1.2004, test_f1: 0.3468
 epoch: 61, train_loss: 1.2078, test_loss: 1.1983, test_f1: 0.3468
 epoch: 62, train_loss: 1.2060, test_loss: 1.1981, test_f1: 0.3447
 epoch: 63, train_loss: 1.2035, test_loss: 1.1985, test_f1: 0.3408
 epoch: 64, train_loss: 1.2075, test_loss: 1.1969, test_f1: 0.3438
 epoch: 65, train_loss: 1.2048, test_loss: 1.1974, test_f1: 0.3455
 epoch: 66, train_loss: 1.2038, test_loss: 1.1951, test_f1: 0.3440
 epoch: 67, train_loss: 1.1986, test_loss: 1.1939, test_f1: 0.3433
 epoch: 68, train_loss: 1.1985, test_loss: 1.1945, test_f1: 0.3421
 epoch: 69, train_loss: 1.2033, test_loss: 1.1940, test_f1: 0.3449
 epoch: 70, train_loss: 1.2048, test_loss: 1.1933, test_f1: 0.3504
 epoch: 71, train_loss: 1.2006, test_loss: 1.1936, test_f1: 0.3460
 epoch: 72, train_loss: 1.1968, test_loss: 1.1922, test_f1: 0.3486
 epoch: 73, train_loss: 1.1983, test_loss: 1.1923, test_f1: 0.3510
 epoch: 74, train_loss: 1.1956, test_loss: 1.1917, test_f1: 0.3466
 epoch: 75, train_loss: 1.1957, test_loss: 1.1907, test_f1: 0.3466
 epoch: 76, train_loss: 1.2005, test_loss: 1.1907, test_f1: 0.3506
 epoch: 77, train_loss: 1.1910, test_loss: 1.1907, test_f1: 0.3491
 epoch: 78, train_loss: 1.1952, test_loss: 1.1882, test_f1: 0.3453
 epoch: 79, train_loss: 1.1969, test_loss: 1.1902, test_f1: 0.3476
 epoch: 80, train_loss: 1.1968, test_loss: 1.1896, test_f1: 0.3477
 epoch: 81, train_loss: 1.1926, test_loss: 1.1866, test_f1: 0.3486
 epoch: 82, train_loss: 1.1912, test_loss: 1.1878, test_f1: 0.3452
 epoch: 83, train_loss: 1.1876, test_loss: 1.1869, test_f1: 0.3500
 epoch: 84, train_loss: 1.1923, test_loss: 1.1862, test_f1: 0.3449
 epoch: 85, train_loss: 1.1872, test_loss: 1.1859, test_f1: 0.3467
 epoch: 86, train_loss: 1.1948, test_loss: 1.1851, test_f1: 0.3471
 epoch: 87, train_loss: 1.1889, test_loss: 1.1850, test_f1: 0.3469
 epoch: 88, train_loss: 1.1861, test_loss: 1.1860, test_f1: 0.3454
 epoch: 89, train_loss: 1.1874, test_loss: 1.1848, test_f1: 0.3433
 epoch: 90, train_loss: 1.1875, test_loss: 1.1849, test_f1: 0.3434
 epoch: 91, train_loss: 1.1845, test_loss: 1.1814, test_f1: 0.3481
 epoch: 92, train_loss: 1.1792, test_loss: 1.1837, test_f1: 0.3477
 epoch: 93, train_loss: 1.1874, test_loss: 1.1822, test_f1: 0.3459
 epoch: 94, train_loss: 1.1856, test_loss: 1.1825, test_f1: 0.3425
 epoch: 95, train_loss: 1.1847, test_loss: 1.1808, test_f1: 0.3489
 epoch: 96, train_loss: 1.1843, test_loss: 1.1791, test_f1: 0.3495
 epoch: 97, train_loss: 1.1840, test_loss: 1.1796, test_f1: 0.3456
 epoch: 98, train_loss: 1.1792, test_loss: 1.1800, test_f1: 0.3406
 epoch: 99, train_loss: 1.1802, test_loss: 1.1794, test_f1: 0.3469
##################ITERATION #1 ****************************************
 epoch: 0, train_loss: 1.3206, test_loss: 1.3225, test_f1: 0.2274
 epoch: 1, train_loss: 1.3144, test_loss: 1.3167, test_f1: 0.2274
 epoch: 2, train_loss: 1.3087, test_loss: 1.3122, test_f1: 0.2274
 epoch: 3, train_loss: 1.3051, test_loss: 1.3071, test_f1: 0.2274
 epoch: 4, train_loss: 1.3018, test_loss: 1.3033, test_f1: 0.2274
 epoch: 5, train_loss: 1.2993, test_loss: 1.3006, test_f1: 0.2274
 epoch: 6, train_loss: 1.2970, test_loss: 1.2969, test_f1: 0.2274
 epoch: 7, train_loss: 1.2931, test_loss: 1.2941, test_f1: 0.2274
 epoch: 8, train_loss: 1.2922, test_loss: 1.2905, test_f1: 0.2274
 epoch: 9, train_loss: 1.2872, test_loss: 1.2865, test_f1: 0.2274
 epoch: 10, train_loss: 1.2868, test_loss: 1.2833, test_f1: 0.2274
 epoch: 11, train_loss: 1.2830, test_loss: 1.2812, test_f1: 0.2274
 epoch: 12, train_loss: 1.2808, test_loss: 1.2790, test_f1: 0.2274
 epoch: 13, train_loss: 1.2791, test_loss: 1.2770, test_f1: 0.2274
 epoch: 14, train_loss: 1.2777, test_loss: 1.2733, test_f1: 0.2274
 epoch: 15, train_loss: 1.2756, test_loss: 1.2684, test_f1: 0.2274
 epoch: 16, train_loss: 1.2734, test_loss: 1.2673, test_f1: 0.2274
 epoch: 17, train_loss: 1.2732, test_loss: 1.2645, test_f1: 0.2266
 epoch: 18, train_loss: 1.2710, test_loss: 1.2626, test_f1: 0.2274
 epoch: 19, train_loss: 1.2682, test_loss: 1.2593, test_f1: 0.2555
 epoch: 20, train_loss: 1.2685, test_loss: 1.2565, test_f1: 0.2390
 epoch: 21, train_loss: 1.2663, test_loss: 1.2531, test_f1: 0.2555
 epoch: 22, train_loss: 1.2609, test_loss: 1.2495, test_f1: 0.2555
 epoch: 23, train_loss: 1.2631, test_loss: 1.2460, test_f1: 0.2555
 epoch: 24, train_loss: 1.2602, test_loss: 1.2433, test_f1: 0.2555
 epoch: 25, train_loss: 1.2575, test_loss: 1.2417, test_f1: 0.2555
 epoch: 26, train_loss: 1.2503, test_loss: 1.2367, test_f1: 0.2557
 epoch: 27, train_loss: 1.2520, test_loss: 1.2341, test_f1: 0.2579
 epoch: 28, train_loss: 1.2474, test_loss: 1.2331, test_f1: 0.2601
 epoch: 29, train_loss: 1.2488, test_loss: 1.2289, test_f1: 0.2712
 epoch: 30, train_loss: 1.2486, test_loss: 1.2273, test_f1: 0.2603
 epoch: 31, train_loss: 1.2422, test_loss: 1.2257, test_f1: 0.2607
 epoch: 32, train_loss: 1.2437, test_loss: 1.2223, test_f1: 0.2749
 epoch: 33, train_loss: 1.2429, test_loss: 1.2217, test_f1: 0.2651
 epoch: 34, train_loss: 1.2398, test_loss: 1.2178, test_f1: 0.2756
 epoch: 35, train_loss: 1.2380, test_loss: 1.2166, test_f1: 0.2946
 epoch: 36, train_loss: 1.2382, test_loss: 1.2150, test_f1: 0.3023
 epoch: 37, train_loss: 1.2345, test_loss: 1.2130, test_f1: 0.2942
 epoch: 38, train_loss: 1.2353, test_loss: 1.2102, test_f1: 0.3067
 epoch: 39, train_loss: 1.2342, test_loss: 1.2065, test_f1: 0.3167
 epoch: 40, train_loss: 1.2312, test_loss: 1.2064, test_f1: 0.3151
 epoch: 41, train_loss: 1.2318, test_loss: 1.2055, test_f1: 0.3183
 epoch: 42, train_loss: 1.2341, test_loss: 1.2022, test_f1: 0.3175
 epoch: 43, train_loss: 1.2279, test_loss: 1.2016, test_f1: 0.3246
 epoch: 44, train_loss: 1.2270, test_loss: 1.2022, test_f1: 0.3182
 epoch: 45, train_loss: 1.2273, test_loss: 1.1985, test_f1: 0.3281
 epoch: 46, train_loss: 1.2241, test_loss: 1.1990, test_f1: 0.3289
 epoch: 47, train_loss: 1.2233, test_loss: 1.1957, test_f1: 0.3288
 epoch: 48, train_loss: 1.2194, test_loss: 1.1952, test_f1: 0.3297
 epoch: 49, train_loss: 1.2211, test_loss: 1.1935, test_f1: 0.3400
 epoch: 50, train_loss: 1.2188, test_loss: 1.1923, test_f1: 0.3382
 epoch: 51, train_loss: 1.2233, test_loss: 1.1917, test_f1: 0.3352
 epoch: 52, train_loss: 1.2176, test_loss: 1.1907, test_f1: 0.3406
 epoch: 53, train_loss: 1.2196, test_loss: 1.1899, test_f1: 0.3293
 epoch: 54, train_loss: 1.2119, test_loss: 1.1892, test_f1: 0.3358
 epoch: 55, train_loss: 1.2156, test_loss: 1.1903, test_f1: 0.3217
 epoch: 56, train_loss: 1.2154, test_loss: 1.1885, test_f1: 0.3398
 epoch: 57, train_loss: 1.2135, test_loss: 1.1886, test_f1: 0.3357
 epoch: 58, train_loss: 1.2164, test_loss: 1.1890, test_f1: 0.3343
 epoch: 59, train_loss: 1.2158, test_loss: 1.1877, test_f1: 0.3401
 epoch: 60, train_loss: 1.2133, test_loss: 1.1876, test_f1: 0.3462
 epoch: 61, train_loss: 1.2100, test_loss: 1.1854, test_f1: 0.3449
 epoch: 62, train_loss: 1.2131, test_loss: 1.1852, test_f1: 0.3447
 epoch: 63, train_loss: 1.2105, test_loss: 1.1840, test_f1: 0.3425
 epoch: 64, train_loss: 1.2089, test_loss: 1.1850, test_f1: 0.3394
 epoch: 65, train_loss: 1.2098, test_loss: 1.1853, test_f1: 0.3450
 epoch: 66, train_loss: 1.2093, test_loss: 1.1837, test_f1: 0.3398
 epoch: 67, train_loss: 1.2061, test_loss: 1.1834, test_f1: 0.3340
 epoch: 68, train_loss: 1.2112, test_loss: 1.1839, test_f1: 0.3502
 epoch: 69, train_loss: 1.2106, test_loss: 1.1847, test_f1: 0.3438
 epoch: 70, train_loss: 1.2072, test_loss: 1.1823, test_f1: 0.3502
 epoch: 71, train_loss: 1.2074, test_loss: 1.1821, test_f1: 0.3455
 epoch: 72, train_loss: 1.2048, test_loss: 1.1817, test_f1: 0.3338
 epoch: 73, train_loss: 1.2107, test_loss: 1.1806, test_f1: 0.3505
 epoch: 74, train_loss: 1.2062, test_loss: 1.1798, test_f1: 0.3487
 epoch: 75, train_loss: 1.2078, test_loss: 1.1803, test_f1: 0.3488
 epoch: 76, train_loss: 1.2080, test_loss: 1.1788, test_f1: 0.3501
 epoch: 77, train_loss: 1.2000, test_loss: 1.1798, test_f1: 0.3492
 epoch: 78, train_loss: 1.2039, test_loss: 1.1780, test_f1: 0.3481
 epoch: 79, train_loss: 1.2017, test_loss: 1.1780, test_f1: 0.3486
 epoch: 80, train_loss: 1.1971, test_loss: 1.1764, test_f1: 0.3495
 epoch: 81, train_loss: 1.1966, test_loss: 1.1762, test_f1: 0.3495
 epoch: 82, train_loss: 1.2026, test_loss: 1.1753, test_f1: 0.3502
 epoch: 83, train_loss: 1.1969, test_loss: 1.1749, test_f1: 0.3358
 epoch: 84, train_loss: 1.1989, test_loss: 1.1744, test_f1: 0.3499
 epoch: 85, train_loss: 1.1947, test_loss: 1.1750, test_f1: 0.3432
 epoch: 86, train_loss: 1.1983, test_loss: 1.1755, test_f1: 0.3430
 epoch: 87, train_loss: 1.1973, test_loss: 1.1736, test_f1: 0.3479
 epoch: 88, train_loss: 1.1954, test_loss: 1.1726, test_f1: 0.3461
 epoch: 89, train_loss: 1.1972, test_loss: 1.1739, test_f1: 0.3525
 epoch: 90, train_loss: 1.1974, test_loss: 1.1730, test_f1: 0.3389
 epoch: 91, train_loss: 1.1917, test_loss: 1.1706, test_f1: 0.3527
 epoch: 92, train_loss: 1.1900, test_loss: 1.1716, test_f1: 0.3482
 epoch: 93, train_loss: 1.1965, test_loss: 1.1698, test_f1: 0.3457
 epoch: 94, train_loss: 1.1875, test_loss: 1.1692, test_f1: 0.3470
 epoch: 95, train_loss: 1.1876, test_loss: 1.1680, test_f1: 0.3525
 epoch: 96, train_loss: 1.1866, test_loss: 1.1674, test_f1: 0.3461
 epoch: 97, train_loss: 1.1863, test_loss: 1.1681, test_f1: 0.3549
 epoch: 98, train_loss: 1.1869, test_loss: 1.1661, test_f1: 0.3548
 epoch: 99, train_loss: 1.1901, test_loss: 1.1662, test_f1: 0.3583
##################ITERATION #2 ****************************************
 epoch: 0, train_loss: 1.3087, test_loss: 1.3142, test_f1: 0.2274
 epoch: 1, train_loss: 1.3024, test_loss: 1.3073, test_f1: 0.2274
 epoch: 2, train_loss: 1.2991, test_loss: 1.3021, test_f1: 0.2274
 epoch: 3, train_loss: 1.2918, test_loss: 1.2983, test_f1: 0.2274
 epoch: 4, train_loss: 1.2888, test_loss: 1.2928, test_f1: 0.2274
 epoch: 5, train_loss: 1.2853, test_loss: 1.2876, test_f1: 0.2274
 epoch: 6, train_loss: 1.2804, test_loss: 1.2827, test_f1: 0.2274
 epoch: 7, train_loss: 1.2740, test_loss: 1.2780, test_f1: 0.2274
 epoch: 8, train_loss: 1.2750, test_loss: 1.2723, test_f1: 0.2274
 epoch: 9, train_loss: 1.2683, test_loss: 1.2679, test_f1: 0.2274
 epoch: 10, train_loss: 1.2638, test_loss: 1.2630, test_f1: 0.2300
 epoch: 11, train_loss: 1.2638, test_loss: 1.2592, test_f1: 0.2449
 epoch: 12, train_loss: 1.2575, test_loss: 1.2556, test_f1: 0.2513
 epoch: 13, train_loss: 1.2566, test_loss: 1.2510, test_f1: 0.2535
 epoch: 14, train_loss: 1.2529, test_loss: 1.2462, test_f1: 0.2881
 epoch: 15, train_loss: 1.2496, test_loss: 1.2411, test_f1: 0.2918
 epoch: 16, train_loss: 1.2490, test_loss: 1.2391, test_f1: 0.2995
 epoch: 17, train_loss: 1.2475, test_loss: 1.2343, test_f1: 0.3097
 epoch: 18, train_loss: 1.2438, test_loss: 1.2321, test_f1: 0.3104
 epoch: 19, train_loss: 1.2438, test_loss: 1.2291, test_f1: 0.3167
 epoch: 20, train_loss: 1.2333, test_loss: 1.2262, test_f1: 0.3182
 epoch: 21, train_loss: 1.2382, test_loss: 1.2229, test_f1: 0.3256
 epoch: 22, train_loss: 1.2341, test_loss: 1.2218, test_f1: 0.3256
 epoch: 23, train_loss: 1.2342, test_loss: 1.2184, test_f1: 0.3289
 epoch: 24, train_loss: 1.2330, test_loss: 1.2182, test_f1: 0.3300
 epoch: 25, train_loss: 1.2280, test_loss: 1.2147, test_f1: 0.3298
 epoch: 26, train_loss: 1.2248, test_loss: 1.2133, test_f1: 0.3294
 epoch: 27, train_loss: 1.2262, test_loss: 1.2109, test_f1: 0.3256
 epoch: 28, train_loss: 1.2241, test_loss: 1.2099, test_f1: 0.3266
 epoch: 29, train_loss: 1.2226, test_loss: 1.2087, test_f1: 0.3287
 epoch: 30, train_loss: 1.2211, test_loss: 1.2088, test_f1: 0.3290
 epoch: 31, train_loss: 1.2234, test_loss: 1.2070, test_f1: 0.3306
 epoch: 32, train_loss: 1.2172, test_loss: 1.2039, test_f1: 0.3313
 epoch: 33, train_loss: 1.2205, test_loss: 1.2017, test_f1: 0.3353
 epoch: 34, train_loss: 1.2222, test_loss: 1.2014, test_f1: 0.3318
 epoch: 35, train_loss: 1.2255, test_loss: 1.2009, test_f1: 0.3361
 epoch: 36, train_loss: 1.2160, test_loss: 1.1979, test_f1: 0.3381
 epoch: 37, train_loss: 1.2135, test_loss: 1.1979, test_f1: 0.3385
 epoch: 38, train_loss: 1.2119, test_loss: 1.1978, test_f1: 0.3389
 epoch: 39, train_loss: 1.2122, test_loss: 1.1963, test_f1: 0.3395
 epoch: 40, train_loss: 1.2116, test_loss: 1.1947, test_f1: 0.3399
 epoch: 41, train_loss: 1.2129, test_loss: 1.1941, test_f1: 0.3379
 epoch: 42, train_loss: 1.2078, test_loss: 1.1944, test_f1: 0.3394
 epoch: 43, train_loss: 1.2122, test_loss: 1.1951, test_f1: 0.3399
 epoch: 44, train_loss: 1.2087, test_loss: 1.1933, test_f1: 0.3400
 epoch: 45, train_loss: 1.2078, test_loss: 1.1924, test_f1: 0.3400
 epoch: 46, train_loss: 1.2094, test_loss: 1.1901, test_f1: 0.3401
 epoch: 47, train_loss: 1.2057, test_loss: 1.1928, test_f1: 0.3396
 epoch: 48, train_loss: 1.2054, test_loss: 1.1902, test_f1: 0.3375
 epoch: 49, train_loss: 1.2023, test_loss: 1.1913, test_f1: 0.3414
 epoch: 50, train_loss: 1.2032, test_loss: 1.1887, test_f1: 0.3408
 epoch: 51, train_loss: 1.2010, test_loss: 1.1881, test_f1: 0.3396
 epoch: 52, train_loss: 1.2045, test_loss: 1.1883, test_f1: 0.3448
 epoch: 53, train_loss: 1.2003, test_loss: 1.1882, test_f1: 0.3422
 epoch: 54, train_loss: 1.2043, test_loss: 1.1888, test_f1: 0.3420
 epoch: 55, train_loss: 1.1998, test_loss: 1.1879, test_f1: 0.3473
 epoch: 56, train_loss: 1.1972, test_loss: 1.1876, test_f1: 0.3487
 epoch: 57, train_loss: 1.1946, test_loss: 1.1873, test_f1: 0.3420
 epoch: 58, train_loss: 1.2015, test_loss: 1.1863, test_f1: 0.3463
 epoch: 59, train_loss: 1.2003, test_loss: 1.1869, test_f1: 0.3397
 epoch: 60, train_loss: 1.1905, test_loss: 1.1859, test_f1: 0.3454
 epoch: 61, train_loss: 1.1957, test_loss: 1.1859, test_f1: 0.3406
 epoch: 62, train_loss: 1.1980, test_loss: 1.1855, test_f1: 0.3465
 epoch: 63, train_loss: 1.2004, test_loss: 1.1852, test_f1: 0.3525
 epoch: 64, train_loss: 1.1954, test_loss: 1.1857, test_f1: 0.3433
 epoch: 65, train_loss: 1.1971, test_loss: 1.1853, test_f1: 0.3418
 epoch: 66, train_loss: 1.1919, test_loss: 1.1850, test_f1: 0.3442
 epoch: 67, train_loss: 1.1948, test_loss: 1.1847, test_f1: 0.3527
 epoch: 68, train_loss: 1.1960, test_loss: 1.1851, test_f1: 0.3432
 epoch: 69, train_loss: 1.1887, test_loss: 1.1835, test_f1: 0.3482
 epoch: 70, train_loss: 1.1947, test_loss: 1.1835, test_f1: 0.3452
 epoch: 71, train_loss: 1.1912, test_loss: 1.1843, test_f1: 0.3469
 epoch: 72, train_loss: 1.1875, test_loss: 1.1830, test_f1: 0.3543
 epoch: 73, train_loss: 1.1848, test_loss: 1.1839, test_f1: 0.3483
 epoch: 74, train_loss: 1.1931, test_loss: 1.1829, test_f1: 0.3441
 epoch: 75, train_loss: 1.1887, test_loss: 1.1833, test_f1: 0.3441
 epoch: 76, train_loss: 1.1933, test_loss: 1.1836, test_f1: 0.3391
 epoch: 77, train_loss: 1.1896, test_loss: 1.1830, test_f1: 0.3474
 epoch: 78, train_loss: 1.1890, test_loss: 1.1825, test_f1: 0.3431
 epoch: 79, train_loss: 1.1930, test_loss: 1.1814, test_f1: 0.3477
 epoch: 80, train_loss: 1.1867, test_loss: 1.1836, test_f1: 0.3399
 epoch: 81, train_loss: 1.1896, test_loss: 1.1833, test_f1: 0.3430
 epoch: 82, train_loss: 1.1858, test_loss: 1.1818, test_f1: 0.3436
 epoch: 83, train_loss: 1.1935, test_loss: 1.1825, test_f1: 0.3373
 epoch: 84, train_loss: 1.1864, test_loss: 1.1826, test_f1: 0.3486
 epoch: 85, train_loss: 1.1896, test_loss: 1.1814, test_f1: 0.3519
 epoch: 86, train_loss: 1.1829, test_loss: 1.1822, test_f1: 0.3403
 epoch: 87, train_loss: 1.1896, test_loss: 1.1807, test_f1: 0.3501
 epoch: 88, train_loss: 1.1861, test_loss: 1.1814, test_f1: 0.3442
 epoch: 89, train_loss: 1.1893, test_loss: 1.1830, test_f1: 0.3409
 epoch: 90, train_loss: 1.1812, test_loss: 1.1831, test_f1: 0.3477
 epoch: 91, train_loss: 1.1818, test_loss: 1.1824, test_f1: 0.3430
 epoch: 92, train_loss: 1.1843, test_loss: 1.1811, test_f1: 0.3441
 epoch: 93, train_loss: 1.1813, test_loss: 1.1819, test_f1: 0.3437
 epoch: 94, train_loss: 1.1782, test_loss: 1.1812, test_f1: 0.3456
 epoch: 95, train_loss: 1.1837, test_loss: 1.1798, test_f1: 0.3478
 epoch: 96, train_loss: 1.1795, test_loss: 1.1780, test_f1: 0.3498
 epoch: 97, train_loss: 1.1864, test_loss: 1.1801, test_f1: 0.3521
 epoch: 98, train_loss: 1.1796, test_loss: 1.1804, test_f1: 0.3532
 epoch: 99, train_loss: 1.1784, test_loss: 1.1793, test_f1: 0.3512
##################ITERATION #3 ****************************************
 epoch: 0, train_loss: 1.3110, test_loss: 1.3193, test_f1: 0.2274
 epoch: 1, train_loss: 1.3034, test_loss: 1.3114, test_f1: 0.2274
 epoch: 2, train_loss: 1.3008, test_loss: 1.3076, test_f1: 0.2274
 epoch: 3, train_loss: 1.2953, test_loss: 1.3032, test_f1: 0.2274
 epoch: 4, train_loss: 1.2943, test_loss: 1.3004, test_f1: 0.2274
 epoch: 5, train_loss: 1.2890, test_loss: 1.2960, test_f1: 0.2274
 epoch: 6, train_loss: 1.2878, test_loss: 1.2947, test_f1: 0.2274
 epoch: 7, train_loss: 1.2834, test_loss: 1.2902, test_f1: 0.2274
 epoch: 8, train_loss: 1.2789, test_loss: 1.2866, test_f1: 0.2274
 epoch: 9, train_loss: 1.2771, test_loss: 1.2831, test_f1: 0.2274
 epoch: 10, train_loss: 1.2721, test_loss: 1.2804, test_f1: 0.2274
 epoch: 11, train_loss: 1.2711, test_loss: 1.2750, test_f1: 0.2274
 epoch: 12, train_loss: 1.2625, test_loss: 1.2687, test_f1: 0.2274
 epoch: 13, train_loss: 1.2638, test_loss: 1.2673, test_f1: 0.2274
 epoch: 14, train_loss: 1.2648, test_loss: 1.2618, test_f1: 0.2274
 epoch: 15, train_loss: 1.2656, test_loss: 1.2603, test_f1: 0.2274
 epoch: 16, train_loss: 1.2556, test_loss: 1.2567, test_f1: 0.2327
 epoch: 17, train_loss: 1.2547, test_loss: 1.2539, test_f1: 0.2327
 epoch: 18, train_loss: 1.2532, test_loss: 1.2530, test_f1: 0.2327
 epoch: 19, train_loss: 1.2522, test_loss: 1.2471, test_f1: 0.2327
 epoch: 20, train_loss: 1.2501, test_loss: 1.2460, test_f1: 0.2356
 epoch: 21, train_loss: 1.2448, test_loss: 1.2398, test_f1: 0.2328
 epoch: 22, train_loss: 1.2454, test_loss: 1.2379, test_f1: 0.2358
 epoch: 23, train_loss: 1.2449, test_loss: 1.2334, test_f1: 0.2361
 epoch: 24, train_loss: 1.2418, test_loss: 1.2319, test_f1: 0.2358
 epoch: 25, train_loss: 1.2382, test_loss: 1.2323, test_f1: 0.2437
 epoch: 26, train_loss: 1.2294, test_loss: 1.2252, test_f1: 0.2481
 epoch: 27, train_loss: 1.2351, test_loss: 1.2226, test_f1: 0.2369
 epoch: 28, train_loss: 1.2298, test_loss: 1.2206, test_f1: 0.2441
 epoch: 29, train_loss: 1.2294, test_loss: 1.2150, test_f1: 0.2645
 epoch: 30, train_loss: 1.2265, test_loss: 1.2157, test_f1: 0.2625
 epoch: 31, train_loss: 1.2229, test_loss: 1.2121, test_f1: 0.2632
 epoch: 32, train_loss: 1.2175, test_loss: 1.2116, test_f1: 0.2621
 epoch: 33, train_loss: 1.2181, test_loss: 1.2092, test_f1: 0.2640
 epoch: 34, train_loss: 1.2166, test_loss: 1.2022, test_f1: 0.2732
 epoch: 35, train_loss: 1.2200, test_loss: 1.2024, test_f1: 0.2724
 epoch: 36, train_loss: 1.2117, test_loss: 1.1965, test_f1: 0.2898
 epoch: 37, train_loss: 1.2143, test_loss: 1.1972, test_f1: 0.2794
 epoch: 38, train_loss: 1.2074, test_loss: 1.1956, test_f1: 0.3067
 epoch: 39, train_loss: 1.2090, test_loss: 1.1922, test_f1: 0.3115
 epoch: 40, train_loss: 1.2066, test_loss: 1.1905, test_f1: 0.3254
 epoch: 41, train_loss: 1.2106, test_loss: 1.1864, test_f1: 0.3174
 epoch: 42, train_loss: 1.2051, test_loss: 1.1857, test_f1: 0.3293
 epoch: 43, train_loss: 1.1975, test_loss: 1.1802, test_f1: 0.3454
 epoch: 44, train_loss: 1.2015, test_loss: 1.1756, test_f1: 0.3276
 epoch: 45, train_loss: 1.1985, test_loss: 1.1806, test_f1: 0.3381
 epoch: 46, train_loss: 1.1948, test_loss: 1.1774, test_f1: 0.3511
 epoch: 47, train_loss: 1.1957, test_loss: 1.1759, test_f1: 0.3626
 epoch: 48, train_loss: 1.1870, test_loss: 1.1685, test_f1: 0.3810
 epoch: 49, train_loss: 1.1928, test_loss: 1.1710, test_f1: 0.3857
 epoch: 50, train_loss: 1.1839, test_loss: 1.1665, test_f1: 0.3870
 epoch: 51, train_loss: 1.1882, test_loss: 1.1651, test_f1: 0.3749
 epoch: 52, train_loss: 1.1841, test_loss: 1.1676, test_f1: 0.3708
 epoch: 53, train_loss: 1.1871, test_loss: 1.1623, test_f1: 0.3900
 epoch: 54, train_loss: 1.1886, test_loss: 1.1645, test_f1: 0.3734
 epoch: 55, train_loss: 1.1803, test_loss: 1.1630, test_f1: 0.3825
 epoch: 56, train_loss: 1.1819, test_loss: 1.1615, test_f1: 0.3837
 epoch: 57, train_loss: 1.1799, test_loss: 1.1614, test_f1: 0.3780
 epoch: 58, train_loss: 1.1794, test_loss: 1.1627, test_f1: 0.3780
 epoch: 59, train_loss: 1.1837, test_loss: 1.1589, test_f1: 0.3940
 epoch: 60, train_loss: 1.1788, test_loss: 1.1601, test_f1: 0.3816
 epoch: 61, train_loss: 1.1826, test_loss: 1.1599, test_f1: 0.3902
 epoch: 62, train_loss: 1.1814, test_loss: 1.1603, test_f1: 0.3894
 epoch: 63, train_loss: 1.1791, test_loss: 1.1617, test_f1: 0.3865
 epoch: 64, train_loss: 1.1736, test_loss: 1.1574, test_f1: 0.3924
 epoch: 65, train_loss: 1.1825, test_loss: 1.1570, test_f1: 0.3949
 epoch: 66, train_loss: 1.1731, test_loss: 1.1573, test_f1: 0.3959
 epoch: 67, train_loss: 1.1768, test_loss: 1.1563, test_f1: 0.4044
 epoch: 68, train_loss: 1.1658, test_loss: 1.1565, test_f1: 0.4090
 epoch: 69, train_loss: 1.1705, test_loss: 1.1570, test_f1: 0.3965
 epoch: 70, train_loss: 1.1714, test_loss: 1.1551, test_f1: 0.4010
 epoch: 71, train_loss: 1.1650, test_loss: 1.1536, test_f1: 0.3984
 epoch: 72, train_loss: 1.1703, test_loss: 1.1537, test_f1: 0.4030
 epoch: 73, train_loss: 1.1580, test_loss: 1.1478, test_f1: 0.4126
 epoch: 74, train_loss: 1.1714, test_loss: 1.1471, test_f1: 0.4129
 epoch: 75, train_loss: 1.1678, test_loss: 1.1515, test_f1: 0.4118
 epoch: 76, train_loss: 1.1716, test_loss: 1.1540, test_f1: 0.4141
 epoch: 77, train_loss: 1.1641, test_loss: 1.1471, test_f1: 0.4201
 epoch: 78, train_loss: 1.1722, test_loss: 1.1463, test_f1: 0.4218
 epoch: 79, train_loss: 1.1637, test_loss: 1.1475, test_f1: 0.4214
 epoch: 80, train_loss: 1.1621, test_loss: 1.1448, test_f1: 0.4250
 epoch: 81, train_loss: 1.1661, test_loss: 1.1445, test_f1: 0.4198
 epoch: 82, train_loss: 1.1693, test_loss: 1.1447, test_f1: 0.4202
 epoch: 83, train_loss: 1.1539, test_loss: 1.1442, test_f1: 0.4272
 epoch: 84, train_loss: 1.1648, test_loss: 1.1448, test_f1: 0.4247
 epoch: 85, train_loss: 1.1624, test_loss: 1.1470, test_f1: 0.4078
 epoch: 86, train_loss: 1.1636, test_loss: 1.1412, test_f1: 0.4169
 epoch: 87, train_loss: 1.1611, test_loss: 1.1446, test_f1: 0.4134
 epoch: 88, train_loss: 1.1598, test_loss: 1.1442, test_f1: 0.4299
 epoch: 89, train_loss: 1.1596, test_loss: 1.1409, test_f1: 0.4233
 epoch: 90, train_loss: 1.1638, test_loss: 1.1420, test_f1: 0.4166
 epoch: 91, train_loss: 1.1579, test_loss: 1.1378, test_f1: 0.4115
 epoch: 92, train_loss: 1.1574, test_loss: 1.1444, test_f1: 0.4110
 epoch: 93, train_loss: 1.1566, test_loss: 1.1395, test_f1: 0.4101
 epoch: 94, train_loss: 1.1610, test_loss: 1.1376, test_f1: 0.4135
 epoch: 95, train_loss: 1.1540, test_loss: 1.1355, test_f1: 0.4253
 epoch: 96, train_loss: 1.1516, test_loss: 1.1370, test_f1: 0.4120
 epoch: 97, train_loss: 1.1488, test_loss: 1.1379, test_f1: 0.4106
 epoch: 98, train_loss: 1.1535, test_loss: 1.1363, test_f1: 0.4093
 epoch: 99, train_loss: 1.1606, test_loss: 1.1368, test_f1: 0.4163
##################ITERATION #4 ****************************************
 epoch: 0, train_loss: 1.3066, test_loss: 1.3074, test_f1: 0.2274
 epoch: 1, train_loss: 1.3004, test_loss: 1.2978, test_f1: 0.2274
 epoch: 2, train_loss: 1.2886, test_loss: 1.2920, test_f1: 0.2274
 epoch: 3, train_loss: 1.2856, test_loss: 1.2861, test_f1: 0.2274
 epoch: 4, train_loss: 1.2848, test_loss: 1.2825, test_f1: 0.2274
 epoch: 5, train_loss: 1.2769, test_loss: 1.2797, test_f1: 0.2274
 epoch: 6, train_loss: 1.2763, test_loss: 1.2736, test_f1: 0.2274
 epoch: 7, train_loss: 1.2707, test_loss: 1.2676, test_f1: 0.2325
 epoch: 8, train_loss: 1.2694, test_loss: 1.2653, test_f1: 0.2325
 epoch: 9, train_loss: 1.2613, test_loss: 1.2616, test_f1: 0.2435
 epoch: 10, train_loss: 1.2600, test_loss: 1.2550, test_f1: 0.2605
 epoch: 11, train_loss: 1.2589, test_loss: 1.2533, test_f1: 0.2658
 epoch: 12, train_loss: 1.2503, test_loss: 1.2494, test_f1: 0.2815
 epoch: 13, train_loss: 1.2509, test_loss: 1.2449, test_f1: 0.2768
 epoch: 14, train_loss: 1.2457, test_loss: 1.2425, test_f1: 0.2970
 epoch: 15, train_loss: 1.2438, test_loss: 1.2389, test_f1: 0.3005
 epoch: 16, train_loss: 1.2433, test_loss: 1.2357, test_f1: 0.2943
 epoch: 17, train_loss: 1.2416, test_loss: 1.2334, test_f1: 0.3015
 epoch: 18, train_loss: 1.2304, test_loss: 1.2289, test_f1: 0.3092
 epoch: 19, train_loss: 1.2318, test_loss: 1.2256, test_f1: 0.3268
 epoch: 20, train_loss: 1.2325, test_loss: 1.2244, test_f1: 0.3342
 epoch: 21, train_loss: 1.2296, test_loss: 1.2172, test_f1: 0.3302
 epoch: 22, train_loss: 1.2226, test_loss: 1.2136, test_f1: 0.3361
 epoch: 23, train_loss: 1.2239, test_loss: 1.2119, test_f1: 0.3253
 epoch: 24, train_loss: 1.2179, test_loss: 1.2082, test_f1: 0.3329
 epoch: 25, train_loss: 1.2172, test_loss: 1.2061, test_f1: 0.3346
 epoch: 26, train_loss: 1.2147, test_loss: 1.2021, test_f1: 0.3406
 epoch: 27, train_loss: 1.2114, test_loss: 1.1970, test_f1: 0.3447
 epoch: 28, train_loss: 1.2084, test_loss: 1.1924, test_f1: 0.3418
 epoch: 29, train_loss: 1.2056, test_loss: 1.1908, test_f1: 0.3431
 epoch: 30, train_loss: 1.2088, test_loss: 1.1889, test_f1: 0.3412
 epoch: 31, train_loss: 1.1984, test_loss: 1.1834, test_f1: 0.3394
 epoch: 32, train_loss: 1.1971, test_loss: 1.1817, test_f1: 0.3438
 epoch: 33, train_loss: 1.1963, test_loss: 1.1762, test_f1: 0.3447
 epoch: 34, train_loss: 1.1937, test_loss: 1.1752, test_f1: 0.3465
 epoch: 35, train_loss: 1.1919, test_loss: 1.1703, test_f1: 0.3623
 epoch: 36, train_loss: 1.1935, test_loss: 1.1690, test_f1: 0.3608
 epoch: 37, train_loss: 1.1902, test_loss: 1.1651, test_f1: 0.3765
 epoch: 38, train_loss: 1.1839, test_loss: 1.1597, test_f1: 0.3757
 epoch: 39, train_loss: 1.1879, test_loss: 1.1584, test_f1: 0.3776
 epoch: 40, train_loss: 1.1795, test_loss: 1.1541, test_f1: 0.3828
 epoch: 41, train_loss: 1.1791, test_loss: 1.1501, test_f1: 0.3910
 epoch: 42, train_loss: 1.1855, test_loss: 1.1489, test_f1: 0.4038
 epoch: 43, train_loss: 1.1772, test_loss: 1.1445, test_f1: 0.3987
 epoch: 44, train_loss: 1.1752, test_loss: 1.1422, test_f1: 0.3920
 epoch: 45, train_loss: 1.1684, test_loss: 1.1392, test_f1: 0.4000
 epoch: 46, train_loss: 1.1791, test_loss: 1.1345, test_f1: 0.4149
 epoch: 47, train_loss: 1.1765, test_loss: 1.1357, test_f1: 0.4113
 epoch: 48, train_loss: 1.1701, test_loss: 1.1321, test_f1: 0.4118
 epoch: 49, train_loss: 1.1683, test_loss: 1.1327, test_f1: 0.4156
 epoch: 50, train_loss: 1.1681, test_loss: 1.1240, test_f1: 0.4128
 epoch: 51, train_loss: 1.1580, test_loss: 1.1226, test_f1: 0.4165
 epoch: 52, train_loss: 1.1589, test_loss: 1.1253, test_f1: 0.4134
 epoch: 53, train_loss: 1.1585, test_loss: 1.1243, test_f1: 0.4060
 epoch: 54, train_loss: 1.1567, test_loss: 1.1190, test_f1: 0.4165
 epoch: 55, train_loss: 1.1590, test_loss: 1.1202, test_f1: 0.4124
 epoch: 56, train_loss: 1.1615, test_loss: 1.1201, test_f1: 0.4156
 epoch: 57, train_loss: 1.1592, test_loss: 1.1175, test_f1: 0.4202
 epoch: 58, train_loss: 1.1634, test_loss: 1.1188, test_f1: 0.4187
 epoch: 59, train_loss: 1.1531, test_loss: 1.1201, test_f1: 0.4225
 epoch: 60, train_loss: 1.1547, test_loss: 1.1147, test_f1: 0.4246
 epoch: 61, train_loss: 1.1546, test_loss: 1.1122, test_f1: 0.4301
 epoch: 62, train_loss: 1.1564, test_loss: 1.1119, test_f1: 0.4309
 epoch: 63, train_loss: 1.1545, test_loss: 1.1114, test_f1: 0.4320
 epoch: 64, train_loss: 1.1527, test_loss: 1.1115, test_f1: 0.4285
 epoch: 65, train_loss: 1.1449, test_loss: 1.1095, test_f1: 0.4267
 epoch: 66, train_loss: 1.1477, test_loss: 1.1066, test_f1: 0.4328
 epoch: 67, train_loss: 1.1478, test_loss: 1.1071, test_f1: 0.4353
 epoch: 68, train_loss: 1.1515, test_loss: 1.1066, test_f1: 0.4290
 epoch: 69, train_loss: 1.1491, test_loss: 1.1063, test_f1: 0.4339
 epoch: 70, train_loss: 1.1534, test_loss: 1.1054, test_f1: 0.4315
 epoch: 71, train_loss: 1.1443, test_loss: 1.1023, test_f1: 0.4303
 epoch: 72, train_loss: 1.1497, test_loss: 1.1014, test_f1: 0.4291
 epoch: 73, train_loss: 1.1459, test_loss: 1.1050, test_f1: 0.4234
 epoch: 74, train_loss: 1.1419, test_loss: 1.1037, test_f1: 0.4323
 epoch: 75, train_loss: 1.1447, test_loss: 1.1012, test_f1: 0.4293
 epoch: 76, train_loss: 1.1382, test_loss: 1.1007, test_f1: 0.4307
 epoch: 77, train_loss: 1.1395, test_loss: 1.1024, test_f1: 0.4277
 epoch: 78, train_loss: 1.1417, test_loss: 1.0980, test_f1: 0.4256
 epoch: 79, train_loss: 1.1387, test_loss: 1.1002, test_f1: 0.4258
 epoch: 80, train_loss: 1.1448, test_loss: 1.0979, test_f1: 0.4294
 epoch: 81, train_loss: 1.1386, test_loss: 1.0961, test_f1: 0.4298
 epoch: 82, train_loss: 1.1401, test_loss: 1.0972, test_f1: 0.4340
 epoch: 83, train_loss: 1.1364, test_loss: 1.0939, test_f1: 0.4323
 epoch: 84, train_loss: 1.1371, test_loss: 1.0939, test_f1: 0.4313
 epoch: 85, train_loss: 1.1361, test_loss: 1.0928, test_f1: 0.4282
 epoch: 86, train_loss: 1.1349, test_loss: 1.0930, test_f1: 0.4330
 epoch: 87, train_loss: 1.1396, test_loss: 1.0914, test_f1: 0.4346
 epoch: 88, train_loss: 1.1340, test_loss: 1.0920, test_f1: 0.4391
 epoch: 89, train_loss: 1.1461, test_loss: 1.0893, test_f1: 0.4318
 epoch: 90, train_loss: 1.1304, test_loss: 1.0903, test_f1: 0.4340
 epoch: 91, train_loss: 1.1387, test_loss: 1.0923, test_f1: 0.4411
 epoch: 92, train_loss: 1.1302, test_loss: 1.0917, test_f1: 0.4348
 epoch: 93, train_loss: 1.1275, test_loss: 1.0870, test_f1: 0.4347
 epoch: 94, train_loss: 1.1294, test_loss: 1.0878, test_f1: 0.4412
 epoch: 95, train_loss: 1.1312, test_loss: 1.0829, test_f1: 0.4326
 epoch: 96, train_loss: 1.1342, test_loss: 1.0815, test_f1: 0.4373
 epoch: 97, train_loss: 1.1269, test_loss: 1.0839, test_f1: 0.4363
 epoch: 98, train_loss: 1.1305, test_loss: 1.0828, test_f1: 0.4415
 epoch: 99, train_loss: 1.1323, test_loss: 1.0850, test_f1: 0.4366
##################ITERATION #5 ****************************************
 epoch: 0, train_loss: 1.3035, test_loss: 1.2996, test_f1: 0.2274
 epoch: 1, train_loss: 1.2887, test_loss: 1.2868, test_f1: 0.2274
 epoch: 2, train_loss: 1.2850, test_loss: 1.2796, test_f1: 0.2274
 epoch: 3, train_loss: 1.2770, test_loss: 1.2715, test_f1: 0.2266
 epoch: 4, train_loss: 1.2697, test_loss: 1.2649, test_f1: 0.2262
 epoch: 5, train_loss: 1.2642, test_loss: 1.2586, test_f1: 0.2410
 epoch: 6, train_loss: 1.2642, test_loss: 1.2520, test_f1: 0.2550
 epoch: 7, train_loss: 1.2614, test_loss: 1.2458, test_f1: 0.2618
 epoch: 8, train_loss: 1.2549, test_loss: 1.2405, test_f1: 0.2761
 epoch: 9, train_loss: 1.2525, test_loss: 1.2387, test_f1: 0.2920
 epoch: 10, train_loss: 1.2442, test_loss: 1.2325, test_f1: 0.2973
 epoch: 11, train_loss: 1.2435, test_loss: 1.2297, test_f1: 0.3058
 epoch: 12, train_loss: 1.2434, test_loss: 1.2243, test_f1: 0.3085
 epoch: 13, train_loss: 1.2381, test_loss: 1.2226, test_f1: 0.3125
 epoch: 14, train_loss: 1.2376, test_loss: 1.2194, test_f1: 0.3147
 epoch: 15, train_loss: 1.2382, test_loss: 1.2178, test_f1: 0.3226
 epoch: 16, train_loss: 1.2327, test_loss: 1.2123, test_f1: 0.3254
 epoch: 17, train_loss: 1.2357, test_loss: 1.2121, test_f1: 0.3325
 epoch: 18, train_loss: 1.2333, test_loss: 1.2107, test_f1: 0.3330
 epoch: 19, train_loss: 1.2336, test_loss: 1.2080, test_f1: 0.3355
 epoch: 20, train_loss: 1.2272, test_loss: 1.2050, test_f1: 0.3520
 epoch: 21, train_loss: 1.2287, test_loss: 1.2056, test_f1: 0.3487
 epoch: 22, train_loss: 1.2214, test_loss: 1.2031, test_f1: 0.3493
 epoch: 23, train_loss: 1.2184, test_loss: 1.2020, test_f1: 0.3558
 epoch: 24, train_loss: 1.2226, test_loss: 1.2008, test_f1: 0.3677
 epoch: 25, train_loss: 1.2255, test_loss: 1.1980, test_f1: 0.3695
 epoch: 26, train_loss: 1.2183, test_loss: 1.1993, test_f1: 0.3542
 epoch: 27, train_loss: 1.2200, test_loss: 1.1989, test_f1: 0.3664
 epoch: 28, train_loss: 1.2115, test_loss: 1.1987, test_f1: 0.3709
 epoch: 29, train_loss: 1.2170, test_loss: 1.1963, test_f1: 0.3702
 epoch: 30, train_loss: 1.2145, test_loss: 1.1951, test_f1: 0.3651
 epoch: 31, train_loss: 1.2084, test_loss: 1.1961, test_f1: 0.3782
 epoch: 32, train_loss: 1.2104, test_loss: 1.1966, test_f1: 0.3866
 epoch: 33, train_loss: 1.2029, test_loss: 1.1936, test_f1: 0.3877
 epoch: 34, train_loss: 1.2026, test_loss: 1.1951, test_f1: 0.3834
 epoch: 35, train_loss: 1.2071, test_loss: 1.1931, test_f1: 0.3747
 epoch: 36, train_loss: 1.2057, test_loss: 1.1898, test_f1: 0.3804
 epoch: 37, train_loss: 1.2011, test_loss: 1.1919, test_f1: 0.3875
 epoch: 38, train_loss: 1.2005, test_loss: 1.1891, test_f1: 0.3801
 epoch: 39, train_loss: 1.2020, test_loss: 1.1890, test_f1: 0.3778
 epoch: 40, train_loss: 1.2043, test_loss: 1.1884, test_f1: 0.3816
 epoch: 41, train_loss: 1.2007, test_loss: 1.1879, test_f1: 0.3870
 epoch: 42, train_loss: 1.1984, test_loss: 1.1865, test_f1: 0.3878
 epoch: 43, train_loss: 1.1986, test_loss: 1.1874, test_f1: 0.3850
 epoch: 44, train_loss: 1.1990, test_loss: 1.1859, test_f1: 0.3860
 epoch: 45, train_loss: 1.1981, test_loss: 1.1839, test_f1: 0.3880
 epoch: 46, train_loss: 1.1968, test_loss: 1.1854, test_f1: 0.3859
 epoch: 47, train_loss: 1.1938, test_loss: 1.1812, test_f1: 0.3780
 epoch: 48, train_loss: 1.1931, test_loss: 1.1846, test_f1: 0.3860
 epoch: 49, train_loss: 1.1919, test_loss: 1.1820, test_f1: 0.3868
 epoch: 50, train_loss: 1.1953, test_loss: 1.1819, test_f1: 0.3884
 epoch: 51, train_loss: 1.1901, test_loss: 1.1805, test_f1: 0.3904
 epoch: 52, train_loss: 1.1974, test_loss: 1.1808, test_f1: 0.3900
 epoch: 53, train_loss: 1.1910, test_loss: 1.1792, test_f1: 0.3855
 epoch: 54, train_loss: 1.1923, test_loss: 1.1814, test_f1: 0.3859
 epoch: 55, train_loss: 1.1937, test_loss: 1.1794, test_f1: 0.3859
 epoch: 56, train_loss: 1.1870, test_loss: 1.1785, test_f1: 0.3886
 epoch: 57, train_loss: 1.1880, test_loss: 1.1786, test_f1: 0.3922
 epoch: 58, train_loss: 1.1848, test_loss: 1.1796, test_f1: 0.3886
 epoch: 59, train_loss: 1.1809, test_loss: 1.1799, test_f1: 0.3930
 epoch: 60, train_loss: 1.1819, test_loss: 1.1766, test_f1: 0.3899
 epoch: 61, train_loss: 1.1843, test_loss: 1.1757, test_f1: 0.3918
 epoch: 62, train_loss: 1.1816, test_loss: 1.1746, test_f1: 0.3890
 epoch: 63, train_loss: 1.1819, test_loss: 1.1770, test_f1: 0.3909
 epoch: 64, train_loss: 1.1850, test_loss: 1.1798, test_f1: 0.3890
 epoch: 65, train_loss: 1.1878, test_loss: 1.1761, test_f1: 0.3924
 epoch: 66, train_loss: 1.1808, test_loss: 1.1742, test_f1: 0.3925
 epoch: 67, train_loss: 1.1806, test_loss: 1.1719, test_f1: 0.3849
 epoch: 68, train_loss: 1.1785, test_loss: 1.1742, test_f1: 0.3908
 epoch: 69, train_loss: 1.1820, test_loss: 1.1718, test_f1: 0.3919
 epoch: 70, train_loss: 1.1819, test_loss: 1.1733, test_f1: 0.3943
 epoch: 71, train_loss: 1.1794, test_loss: 1.1721, test_f1: 0.3939
 epoch: 72, train_loss: 1.1802, test_loss: 1.1723, test_f1: 0.3861
 epoch: 73, train_loss: 1.1775, test_loss: 1.1722, test_f1: 0.3865
 epoch: 74, train_loss: 1.1779, test_loss: 1.1703, test_f1: 0.3938
 epoch: 75, train_loss: 1.1763, test_loss: 1.1704, test_f1: 0.3868
 epoch: 76, train_loss: 1.1750, test_loss: 1.1716, test_f1: 0.3808
 epoch: 77, train_loss: 1.1795, test_loss: 1.1721, test_f1: 0.3886
 epoch: 78, train_loss: 1.1726, test_loss: 1.1699, test_f1: 0.3897
 epoch: 79, train_loss: 1.1716, test_loss: 1.1686, test_f1: 0.3929
 epoch: 80, train_loss: 1.1750, test_loss: 1.1680, test_f1: 0.3893
 epoch: 81, train_loss: 1.1802, test_loss: 1.1669, test_f1: 0.3892
 epoch: 82, train_loss: 1.1761, test_loss: 1.1635, test_f1: 0.3858
 epoch: 83, train_loss: 1.1763, test_loss: 1.1682, test_f1: 0.3878
 epoch: 84, train_loss: 1.1774, test_loss: 1.1644, test_f1: 0.3926
 epoch: 85, train_loss: 1.1677, test_loss: 1.1643, test_f1: 0.3928
 epoch: 86, train_loss: 1.1731, test_loss: 1.1624, test_f1: 0.3922
 epoch: 87, train_loss: 1.1774, test_loss: 1.1640, test_f1: 0.3937
 epoch: 88, train_loss: 1.1729, test_loss: 1.1606, test_f1: 0.3926
 epoch: 89, train_loss: 1.1702, test_loss: 1.1630, test_f1: 0.3951
 epoch: 90, train_loss: 1.1664, test_loss: 1.1589, test_f1: 0.3948
 epoch: 91, train_loss: 1.1736, test_loss: 1.1572, test_f1: 0.3996
 epoch: 92, train_loss: 1.1641, test_loss: 1.1620, test_f1: 0.3975
 epoch: 93, train_loss: 1.1752, test_loss: 1.1581, test_f1: 0.3997
 epoch: 94, train_loss: 1.1729, test_loss: 1.1566, test_f1: 0.4026
 epoch: 95, train_loss: 1.1613, test_loss: 1.1594, test_f1: 0.3938
 epoch: 96, train_loss: 1.1639, test_loss: 1.1557, test_f1: 0.3969
 epoch: 97, train_loss: 1.1590, test_loss: 1.1569, test_f1: 0.4038
 epoch: 98, train_loss: 1.1686, test_loss: 1.1559, test_f1: 0.3986
 epoch: 99, train_loss: 1.1708, test_loss: 1.1595, test_f1: 0.3986
##################ITERATION #6 ****************************************
 epoch: 0, train_loss: 1.3057, test_loss: 1.2962, test_f1: 0.2555
 epoch: 1, train_loss: 1.2953, test_loss: 1.2871, test_f1: 0.2667
 epoch: 2, train_loss: 1.2832, test_loss: 1.2801, test_f1: 0.2726
 epoch: 3, train_loss: 1.2837, test_loss: 1.2737, test_f1: 0.2711
 epoch: 4, train_loss: 1.2773, test_loss: 1.2684, test_f1: 0.2719
 epoch: 5, train_loss: 1.2714, test_loss: 1.2651, test_f1: 0.2713
 epoch: 6, train_loss: 1.2673, test_loss: 1.2597, test_f1: 0.2713
 epoch: 7, train_loss: 1.2659, test_loss: 1.2560, test_f1: 0.2735
 epoch: 8, train_loss: 1.2647, test_loss: 1.2533, test_f1: 0.2735
 epoch: 9, train_loss: 1.2598, test_loss: 1.2484, test_f1: 0.2714
 epoch: 10, train_loss: 1.2604, test_loss: 1.2448, test_f1: 0.2756
 epoch: 11, train_loss: 1.2569, test_loss: 1.2418, test_f1: 0.2810
 epoch: 12, train_loss: 1.2542, test_loss: 1.2382, test_f1: 0.2810
 epoch: 13, train_loss: 1.2509, test_loss: 1.2360, test_f1: 0.2830
 epoch: 14, train_loss: 1.2510, test_loss: 1.2359, test_f1: 0.2830
 epoch: 15, train_loss: 1.2474, test_loss: 1.2324, test_f1: 0.2919
 epoch: 16, train_loss: 1.2477, test_loss: 1.2324, test_f1: 0.2890
 epoch: 17, train_loss: 1.2454, test_loss: 1.2321, test_f1: 0.2948
 epoch: 18, train_loss: 1.2454, test_loss: 1.2304, test_f1: 0.2982
 epoch: 19, train_loss: 1.2359, test_loss: 1.2268, test_f1: 0.3000
 epoch: 20, train_loss: 1.2437, test_loss: 1.2254, test_f1: 0.3068
 epoch: 21, train_loss: 1.2384, test_loss: 1.2214, test_f1: 0.3093
 epoch: 22, train_loss: 1.2387, test_loss: 1.2205, test_f1: 0.3076
 epoch: 23, train_loss: 1.2361, test_loss: 1.2196, test_f1: 0.3125
 epoch: 24, train_loss: 1.2342, test_loss: 1.2155, test_f1: 0.3242
 epoch: 25, train_loss: 1.2383, test_loss: 1.2153, test_f1: 0.3324
 epoch: 26, train_loss: 1.2316, test_loss: 1.2148, test_f1: 0.3331
 epoch: 27, train_loss: 1.2319, test_loss: 1.2126, test_f1: 0.3368
 epoch: 28, train_loss: 1.2262, test_loss: 1.2099, test_f1: 0.3397
 epoch: 29, train_loss: 1.2241, test_loss: 1.2096, test_f1: 0.3431
 epoch: 30, train_loss: 1.2264, test_loss: 1.2073, test_f1: 0.3470
 epoch: 31, train_loss: 1.2249, test_loss: 1.2052, test_f1: 0.3424
 epoch: 32, train_loss: 1.2242, test_loss: 1.2033, test_f1: 0.3435
 epoch: 33, train_loss: 1.2184, test_loss: 1.1993, test_f1: 0.3548
 epoch: 34, train_loss: 1.2133, test_loss: 1.1976, test_f1: 0.3531
 epoch: 35, train_loss: 1.2164, test_loss: 1.1958, test_f1: 0.3597
 epoch: 36, train_loss: 1.2184, test_loss: 1.1949, test_f1: 0.3557
 epoch: 37, train_loss: 1.2160, test_loss: 1.1947, test_f1: 0.3541
 epoch: 38, train_loss: 1.2135, test_loss: 1.1920, test_f1: 0.3508
 epoch: 39, train_loss: 1.2152, test_loss: 1.1922, test_f1: 0.3353
 epoch: 40, train_loss: 1.2081, test_loss: 1.1920, test_f1: 0.3495
 epoch: 41, train_loss: 1.2027, test_loss: 1.1871, test_f1: 0.3592
 epoch: 42, train_loss: 1.2050, test_loss: 1.1833, test_f1: 0.3600
 epoch: 43, train_loss: 1.2019, test_loss: 1.1845, test_f1: 0.3624
 epoch: 44, train_loss: 1.2021, test_loss: 1.1847, test_f1: 0.3661
 epoch: 45, train_loss: 1.1986, test_loss: 1.1818, test_f1: 0.3682
 epoch: 46, train_loss: 1.1995, test_loss: 1.1838, test_f1: 0.3642
 epoch: 47, train_loss: 1.2012, test_loss: 1.1787, test_f1: 0.3621
 epoch: 48, train_loss: 1.1905, test_loss: 1.1801, test_f1: 0.3817
 epoch: 49, train_loss: 1.1962, test_loss: 1.1782, test_f1: 0.3800
 epoch: 50, train_loss: 1.1958, test_loss: 1.1814, test_f1: 0.3677
 epoch: 51, train_loss: 1.1929, test_loss: 1.1763, test_f1: 0.3845
 epoch: 52, train_loss: 1.1928, test_loss: 1.1746, test_f1: 0.3837
 epoch: 53, train_loss: 1.1892, test_loss: 1.1766, test_f1: 0.3716
 epoch: 54, train_loss: 1.1884, test_loss: 1.1770, test_f1: 0.3832
 epoch: 55, train_loss: 1.1857, test_loss: 1.1744, test_f1: 0.3852
 epoch: 56, train_loss: 1.1914, test_loss: 1.1747, test_f1: 0.3765
 epoch: 57, train_loss: 1.1901, test_loss: 1.1769, test_f1: 0.3806
 epoch: 58, train_loss: 1.1897, test_loss: 1.1771, test_f1: 0.3808
 epoch: 59, train_loss: 1.1948, test_loss: 1.1751, test_f1: 0.3798
 epoch: 60, train_loss: 1.1842, test_loss: 1.1743, test_f1: 0.3800
 epoch: 61, train_loss: 1.1825, test_loss: 1.1738, test_f1: 0.3811
 epoch: 62, train_loss: 1.1928, test_loss: 1.1720, test_f1: 0.3827
 epoch: 63, train_loss: 1.1855, test_loss: 1.1759, test_f1: 0.3732
 epoch: 64, train_loss: 1.1846, test_loss: 1.1721, test_f1: 0.3834
 epoch: 65, train_loss: 1.1792, test_loss: 1.1716, test_f1: 0.3882
 epoch: 66, train_loss: 1.1852, test_loss: 1.1700, test_f1: 0.3844
 epoch: 67, train_loss: 1.1884, test_loss: 1.1700, test_f1: 0.3896
 epoch: 68, train_loss: 1.1823, test_loss: 1.1703, test_f1: 0.3865
 epoch: 69, train_loss: 1.1803, test_loss: 1.1712, test_f1: 0.3872
 epoch: 70, train_loss: 1.1823, test_loss: 1.1696, test_f1: 0.3837
 epoch: 71, train_loss: 1.1776, test_loss: 1.1693, test_f1: 0.3810
 epoch: 72, train_loss: 1.1804, test_loss: 1.1673, test_f1: 0.3822
 epoch: 73, train_loss: 1.1808, test_loss: 1.1664, test_f1: 0.3904
 epoch: 74, train_loss: 1.1760, test_loss: 1.1696, test_f1: 0.3845
 epoch: 75, train_loss: 1.1757, test_loss: 1.1674, test_f1: 0.3902
 epoch: 76, train_loss: 1.1798, test_loss: 1.1661, test_f1: 0.3933
 epoch: 77, train_loss: 1.1766, test_loss: 1.1667, test_f1: 0.3959
 epoch: 78, train_loss: 1.1733, test_loss: 1.1670, test_f1: 0.3969
 epoch: 79, train_loss: 1.1796, test_loss: 1.1669, test_f1: 0.3944
 epoch: 80, train_loss: 1.1853, test_loss: 1.1663, test_f1: 0.3947
 epoch: 81, train_loss: 1.1726, test_loss: 1.1671, test_f1: 0.3923
 epoch: 82, train_loss: 1.1685, test_loss: 1.1654, test_f1: 0.3973
 epoch: 83, train_loss: 1.1730, test_loss: 1.1656, test_f1: 0.3916
 epoch: 84, train_loss: 1.1778, test_loss: 1.1632, test_f1: 0.3980
 epoch: 85, train_loss: 1.1724, test_loss: 1.1637, test_f1: 0.4025
 epoch: 86, train_loss: 1.1716, test_loss: 1.1633, test_f1: 0.3956
 epoch: 87, train_loss: 1.1814, test_loss: 1.1638, test_f1: 0.3983
 epoch: 88, train_loss: 1.1722, test_loss: 1.1617, test_f1: 0.3922
 epoch: 89, train_loss: 1.1716, test_loss: 1.1591, test_f1: 0.3938
 epoch: 90, train_loss: 1.1673, test_loss: 1.1609, test_f1: 0.3976
 epoch: 91, train_loss: 1.1656, test_loss: 1.1617, test_f1: 0.3956
 epoch: 92, train_loss: 1.1670, test_loss: 1.1610, test_f1: 0.3964
 epoch: 93, train_loss: 1.1662, test_loss: 1.1593, test_f1: 0.4025
 epoch: 94, train_loss: 1.1643, test_loss: 1.1602, test_f1: 0.3981
 epoch: 95, train_loss: 1.1674, test_loss: 1.1615, test_f1: 0.3968
 epoch: 96, train_loss: 1.1659, test_loss: 1.1608, test_f1: 0.3960
 epoch: 97, train_loss: 1.1674, test_loss: 1.1576, test_f1: 0.4026
 epoch: 98, train_loss: 1.1697, test_loss: 1.1583, test_f1: 0.3980
 epoch: 99, train_loss: 1.1607, test_loss: 1.1572, test_f1: 0.3999
##################ITERATION #7 ****************************************
 epoch: 0, train_loss: 1.3207, test_loss: 1.3132, test_f1: 0.2274
 epoch: 1, train_loss: 1.3030, test_loss: 1.2968, test_f1: 0.2389
 epoch: 2, train_loss: 1.2821, test_loss: 1.2888, test_f1: 0.2325
 epoch: 3, train_loss: 1.2832, test_loss: 1.2823, test_f1: 0.2447
 epoch: 4, train_loss: 1.2814, test_loss: 1.2748, test_f1: 0.2547
 epoch: 5, train_loss: 1.2803, test_loss: 1.2680, test_f1: 0.2609
 epoch: 6, train_loss: 1.2719, test_loss: 1.2623, test_f1: 0.2817
 epoch: 7, train_loss: 1.2608, test_loss: 1.2570, test_f1: 0.2793
 epoch: 8, train_loss: 1.2701, test_loss: 1.2527, test_f1: 0.2941
 epoch: 9, train_loss: 1.2619, test_loss: 1.2519, test_f1: 0.2839
 epoch: 10, train_loss: 1.2590, test_loss: 1.2470, test_f1: 0.2909
 epoch: 11, train_loss: 1.2520, test_loss: 1.2420, test_f1: 0.3069
 epoch: 12, train_loss: 1.2518, test_loss: 1.2407, test_f1: 0.2996
 epoch: 13, train_loss: 1.2491, test_loss: 1.2360, test_f1: 0.3137
 epoch: 14, train_loss: 1.2387, test_loss: 1.2318, test_f1: 0.3242
 epoch: 15, train_loss: 1.2400, test_loss: 1.2271, test_f1: 0.3363
 epoch: 16, train_loss: 1.2382, test_loss: 1.2223, test_f1: 0.3448
 epoch: 17, train_loss: 1.2349, test_loss: 1.2224, test_f1: 0.3219
 epoch: 18, train_loss: 1.2338, test_loss: 1.2204, test_f1: 0.3212
 epoch: 19, train_loss: 1.2341, test_loss: 1.2133, test_f1: 0.3493
 epoch: 20, train_loss: 1.2250, test_loss: 1.2133, test_f1: 0.3386
 epoch: 21, train_loss: 1.2201, test_loss: 1.2098, test_f1: 0.3449
 epoch: 22, train_loss: 1.2297, test_loss: 1.2044, test_f1: 0.3497
 epoch: 23, train_loss: 1.2203, test_loss: 1.2045, test_f1: 0.3494
 epoch: 24, train_loss: 1.2167, test_loss: 1.1999, test_f1: 0.3510
 epoch: 25, train_loss: 1.2233, test_loss: 1.1963, test_f1: 0.3510
 epoch: 26, train_loss: 1.2153, test_loss: 1.1933, test_f1: 0.3696
 epoch: 27, train_loss: 1.2105, test_loss: 1.1906, test_f1: 0.3547
 epoch: 28, train_loss: 1.2081, test_loss: 1.1887, test_f1: 0.3605
 epoch: 29, train_loss: 1.2072, test_loss: 1.1851, test_f1: 0.3565
 epoch: 30, train_loss: 1.2020, test_loss: 1.1819, test_f1: 0.3596
 epoch: 31, train_loss: 1.2023, test_loss: 1.1795, test_f1: 0.3541
 epoch: 32, train_loss: 1.1992, test_loss: 1.1771, test_f1: 0.3719
 epoch: 33, train_loss: 1.2015, test_loss: 1.1737, test_f1: 0.3524
 epoch: 34, train_loss: 1.1924, test_loss: 1.1755, test_f1: 0.3447
 epoch: 35, train_loss: 1.1972, test_loss: 1.1682, test_f1: 0.3589
 epoch: 36, train_loss: 1.1851, test_loss: 1.1666, test_f1: 0.3833
 epoch: 37, train_loss: 1.1897, test_loss: 1.1627, test_f1: 0.3530
 epoch: 38, train_loss: 1.1863, test_loss: 1.1594, test_f1: 0.3514
 epoch: 39, train_loss: 1.1842, test_loss: 1.1595, test_f1: 0.3616
 epoch: 40, train_loss: 1.1782, test_loss: 1.1538, test_f1: 0.3664
 epoch: 41, train_loss: 1.1771, test_loss: 1.1515, test_f1: 0.3698
 epoch: 42, train_loss: 1.1731, test_loss: 1.1495, test_f1: 0.4035
 epoch: 43, train_loss: 1.1796, test_loss: 1.1456, test_f1: 0.3862
 epoch: 44, train_loss: 1.1683, test_loss: 1.1456, test_f1: 0.3869
 epoch: 45, train_loss: 1.1715, test_loss: 1.1416, test_f1: 0.4213
 epoch: 46, train_loss: 1.1735, test_loss: 1.1404, test_f1: 0.4235
 epoch: 47, train_loss: 1.1651, test_loss: 1.1374, test_f1: 0.4270
 epoch: 48, train_loss: 1.1621, test_loss: 1.1348, test_f1: 0.4128
 epoch: 49, train_loss: 1.1626, test_loss: 1.1348, test_f1: 0.4206
 epoch: 50, train_loss: 1.1600, test_loss: 1.1308, test_f1: 0.4161
 epoch: 51, train_loss: 1.1577, test_loss: 1.1312, test_f1: 0.4166
 epoch: 52, train_loss: 1.1680, test_loss: 1.1291, test_f1: 0.4530
 epoch: 53, train_loss: 1.1602, test_loss: 1.1272, test_f1: 0.4301
 epoch: 54, train_loss: 1.1603, test_loss: 1.1257, test_f1: 0.4226
 epoch: 55, train_loss: 1.1555, test_loss: 1.1258, test_f1: 0.4233
 epoch: 56, train_loss: 1.1584, test_loss: 1.1250, test_f1: 0.4499
 epoch: 57, train_loss: 1.1577, test_loss: 1.1265, test_f1: 0.4244
 epoch: 58, train_loss: 1.1547, test_loss: 1.1261, test_f1: 0.4266
 epoch: 59, train_loss: 1.1502, test_loss: 1.1260, test_f1: 0.4286
 epoch: 60, train_loss: 1.1540, test_loss: 1.1218, test_f1: 0.4447
 epoch: 61, train_loss: 1.1507, test_loss: 1.1194, test_f1: 0.4301
 epoch: 62, train_loss: 1.1466, test_loss: 1.1177, test_f1: 0.4320
 epoch: 63, train_loss: 1.1437, test_loss: 1.1172, test_f1: 0.4341
 epoch: 64, train_loss: 1.1505, test_loss: 1.1172, test_f1: 0.4321
 epoch: 65, train_loss: 1.1497, test_loss: 1.1186, test_f1: 0.4305
 epoch: 66, train_loss: 1.1454, test_loss: 1.1157, test_f1: 0.4544
 epoch: 67, train_loss: 1.1565, test_loss: 1.1128, test_f1: 0.4545
 epoch: 68, train_loss: 1.1463, test_loss: 1.1142, test_f1: 0.4423
 epoch: 69, train_loss: 1.1473, test_loss: 1.1092, test_f1: 0.4387
 epoch: 70, train_loss: 1.1457, test_loss: 1.1131, test_f1: 0.4358
 epoch: 71, train_loss: 1.1381, test_loss: 1.1091, test_f1: 0.4448
 epoch: 72, train_loss: 1.1467, test_loss: 1.1085, test_f1: 0.4631
 epoch: 73, train_loss: 1.1440, test_loss: 1.1087, test_f1: 0.4346
 epoch: 74, train_loss: 1.1383, test_loss: 1.1066, test_f1: 0.4463
 epoch: 75, train_loss: 1.1383, test_loss: 1.1075, test_f1: 0.4624
 epoch: 76, train_loss: 1.1439, test_loss: 1.1063, test_f1: 0.4430
 epoch: 77, train_loss: 1.1412, test_loss: 1.1055, test_f1: 0.4621
 epoch: 78, train_loss: 1.1432, test_loss: 1.1050, test_f1: 0.4747
 epoch: 79, train_loss: 1.1403, test_loss: 1.1036, test_f1: 0.4638
 epoch: 80, train_loss: 1.1431, test_loss: 1.1028, test_f1: 0.4717
 epoch: 81, train_loss: 1.1372, test_loss: 1.1007, test_f1: 0.4520
 epoch: 82, train_loss: 1.1366, test_loss: 1.1002, test_f1: 0.4519
 epoch: 83, train_loss: 1.1413, test_loss: 1.1002, test_f1: 0.4399
 epoch: 84, train_loss: 1.1367, test_loss: 1.0979, test_f1: 0.4625
 epoch: 85, train_loss: 1.1264, test_loss: 1.0985, test_f1: 0.4682
 epoch: 86, train_loss: 1.1319, test_loss: 1.0964, test_f1: 0.4512
 epoch: 87, train_loss: 1.1323, test_loss: 1.0951, test_f1: 0.4543
 epoch: 88, train_loss: 1.1370, test_loss: 1.0965, test_f1: 0.4549
 epoch: 89, train_loss: 1.1323, test_loss: 1.0948, test_f1: 0.4660
 epoch: 90, train_loss: 1.1345, test_loss: 1.0942, test_f1: 0.4741
 epoch: 91, train_loss: 1.1323, test_loss: 1.0936, test_f1: 0.4483
 epoch: 92, train_loss: 1.1284, test_loss: 1.0917, test_f1: 0.4569
 epoch: 93, train_loss: 1.1345, test_loss: 1.0949, test_f1: 0.4651
 epoch: 94, train_loss: 1.1393, test_loss: 1.0895, test_f1: 0.4649
 epoch: 95, train_loss: 1.1234, test_loss: 1.0887, test_f1: 0.4749
 epoch: 96, train_loss: 1.1404, test_loss: 1.0891, test_f1: 0.4775
 epoch: 97, train_loss: 1.1229, test_loss: 1.0924, test_f1: 0.4803
 epoch: 98, train_loss: 1.1332, test_loss: 1.0902, test_f1: 0.4701
 epoch: 99, train_loss: 1.1294, test_loss: 1.0876, test_f1: 0.4829
##################ITERATION #8 ****************************************
 epoch: 0, train_loss: 1.3418, test_loss: 1.3186, test_f1: 0.2582
 epoch: 1, train_loss: 1.3130, test_loss: 1.2998, test_f1: 0.2586
 epoch: 2, train_loss: 1.2979, test_loss: 1.2879, test_f1: 0.2580
 epoch: 3, train_loss: 1.2850, test_loss: 1.2765, test_f1: 0.2678
 epoch: 4, train_loss: 1.2804, test_loss: 1.2638, test_f1: 0.2569
 epoch: 5, train_loss: 1.2697, test_loss: 1.2558, test_f1: 0.2747
 epoch: 6, train_loss: 1.2688, test_loss: 1.2453, test_f1: 0.2778
 epoch: 7, train_loss: 1.2598, test_loss: 1.2395, test_f1: 0.2848
 epoch: 8, train_loss: 1.2569, test_loss: 1.2309, test_f1: 0.2958
 epoch: 9, train_loss: 1.2527, test_loss: 1.2275, test_f1: 0.3054
 epoch: 10, train_loss: 1.2450, test_loss: 1.2135, test_f1: 0.3137
 epoch: 11, train_loss: 1.2366, test_loss: 1.2102, test_f1: 0.3069
 epoch: 12, train_loss: 1.2322, test_loss: 1.2028, test_f1: 0.3241
 epoch: 13, train_loss: 1.2279, test_loss: 1.1990, test_f1: 0.3257
 epoch: 14, train_loss: 1.2253, test_loss: 1.1948, test_f1: 0.3304
 epoch: 15, train_loss: 1.2222, test_loss: 1.1823, test_f1: 0.3219
 epoch: 16, train_loss: 1.2166, test_loss: 1.1755, test_f1: 0.3228
 epoch: 17, train_loss: 1.2158, test_loss: 1.1711, test_f1: 0.3243
 epoch: 18, train_loss: 1.2106, test_loss: 1.1684, test_f1: 0.3262
 epoch: 19, train_loss: 1.2060, test_loss: 1.1630, test_f1: 0.3262
 epoch: 20, train_loss: 1.2077, test_loss: 1.1581, test_f1: 0.3359
 epoch: 21, train_loss: 1.1992, test_loss: 1.1540, test_f1: 0.3409
 epoch: 22, train_loss: 1.1982, test_loss: 1.1443, test_f1: 0.3576
 epoch: 23, train_loss: 1.1912, test_loss: 1.1391, test_f1: 0.3726
 epoch: 24, train_loss: 1.1922, test_loss: 1.1344, test_f1: 0.3834
 epoch: 25, train_loss: 1.1906, test_loss: 1.1328, test_f1: 0.3844
 epoch: 26, train_loss: 1.1832, test_loss: 1.1258, test_f1: 0.3912
 epoch: 27, train_loss: 1.1854, test_loss: 1.1242, test_f1: 0.4000
 epoch: 28, train_loss: 1.1829, test_loss: 1.1178, test_f1: 0.4074
 epoch: 29, train_loss: 1.1786, test_loss: 1.1174, test_f1: 0.4097
 epoch: 30, train_loss: 1.1757, test_loss: 1.1131, test_f1: 0.4004
 epoch: 31, train_loss: 1.1660, test_loss: 1.1091, test_f1: 0.4065
 epoch: 32, train_loss: 1.1605, test_loss: 1.1082, test_f1: 0.4144
 epoch: 33, train_loss: 1.1699, test_loss: 1.1008, test_f1: 0.4348
 epoch: 34, train_loss: 1.1636, test_loss: 1.0980, test_f1: 0.4376
 epoch: 35, train_loss: 1.1586, test_loss: 1.0934, test_f1: 0.4523
 epoch: 36, train_loss: 1.1644, test_loss: 1.0881, test_f1: 0.4518
 epoch: 37, train_loss: 1.1580, test_loss: 1.0876, test_f1: 0.4530
 epoch: 38, train_loss: 1.1520, test_loss: 1.0819, test_f1: 0.4538
 epoch: 39, train_loss: 1.1546, test_loss: 1.0801, test_f1: 0.4485
 epoch: 40, train_loss: 1.1502, test_loss: 1.0784, test_f1: 0.4579
 epoch: 41, train_loss: 1.1530, test_loss: 1.0800, test_f1: 0.4617
 epoch: 42, train_loss: 1.1559, test_loss: 1.0750, test_f1: 0.4645
 epoch: 43, train_loss: 1.1449, test_loss: 1.0689, test_f1: 0.4660
 epoch: 44, train_loss: 1.1482, test_loss: 1.0668, test_f1: 0.4726
 epoch: 45, train_loss: 1.1424, test_loss: 1.0659, test_f1: 0.4792
 epoch: 46, train_loss: 1.1389, test_loss: 1.0623, test_f1: 0.4801
 epoch: 47, train_loss: 1.1308, test_loss: 1.0591, test_f1: 0.4943
 epoch: 48, train_loss: 1.1346, test_loss: 1.0579, test_f1: 0.4727
 epoch: 49, train_loss: 1.1435, test_loss: 1.0573, test_f1: 0.4899
 epoch: 50, train_loss: 1.1450, test_loss: 1.0548, test_f1: 0.4754
 epoch: 51, train_loss: 1.1337, test_loss: 1.0521, test_f1: 0.4758
 epoch: 52, train_loss: 1.1347, test_loss: 1.0530, test_f1: 0.4846
 epoch: 53, train_loss: 1.1277, test_loss: 1.0527, test_f1: 0.4779
 epoch: 54, train_loss: 1.1299, test_loss: 1.0480, test_f1: 0.4748
 epoch: 55, train_loss: 1.1297, test_loss: 1.0504, test_f1: 0.4800
 epoch: 56, train_loss: 1.1244, test_loss: 1.0469, test_f1: 0.4818
 epoch: 57, train_loss: 1.1208, test_loss: 1.0432, test_f1: 0.4848
 epoch: 58, train_loss: 1.1220, test_loss: 1.0423, test_f1: 0.4800
 epoch: 59, train_loss: 1.1163, test_loss: 1.0424, test_f1: 0.4820
 epoch: 60, train_loss: 1.1199, test_loss: 1.0387, test_f1: 0.4826
 epoch: 61, train_loss: 1.1189, test_loss: 1.0396, test_f1: 0.4993
 epoch: 62, train_loss: 1.1136, test_loss: 1.0386, test_f1: 0.4819
 epoch: 63, train_loss: 1.1184, test_loss: 1.0365, test_f1: 0.4786
 epoch: 64, train_loss: 1.1188, test_loss: 1.0362, test_f1: 0.4899
 epoch: 65, train_loss: 1.1221, test_loss: 1.0366, test_f1: 0.4814
 epoch: 66, train_loss: 1.1195, test_loss: 1.0343, test_f1: 0.4774
 epoch: 67, train_loss: 1.1167, test_loss: 1.0329, test_f1: 0.4896
 epoch: 68, train_loss: 1.1108, test_loss: 1.0288, test_f1: 0.4918
 epoch: 69, train_loss: 1.1150, test_loss: 1.0327, test_f1: 0.4808
 epoch: 70, train_loss: 1.1087, test_loss: 1.0287, test_f1: 0.4927
 epoch: 71, train_loss: 1.1070, test_loss: 1.0303, test_f1: 0.4967
 epoch: 72, train_loss: 1.1071, test_loss: 1.0276, test_f1: 0.4826
 epoch: 73, train_loss: 1.1095, test_loss: 1.0252, test_f1: 0.4859
 epoch: 74, train_loss: 1.1118, test_loss: 1.0242, test_f1: 0.4891
 epoch: 75, train_loss: 1.1212, test_loss: 1.0234, test_f1: 0.4847
 epoch: 76, train_loss: 1.1054, test_loss: 1.0235, test_f1: 0.4832
 epoch: 77, train_loss: 1.1090, test_loss: 1.0253, test_f1: 0.4832
 epoch: 78, train_loss: 1.1060, test_loss: 1.0219, test_f1: 0.4851
 epoch: 79, train_loss: 1.1053, test_loss: 1.0186, test_f1: 0.4800
 epoch: 80, train_loss: 1.1075, test_loss: 1.0195, test_f1: 0.4837
 epoch: 81, train_loss: 1.1062, test_loss: 1.0147, test_f1: 0.4871
 epoch: 82, train_loss: 1.1036, test_loss: 1.0161, test_f1: 0.5002
 epoch: 83, train_loss: 1.1001, test_loss: 1.0127, test_f1: 0.4833
 epoch: 84, train_loss: 1.1097, test_loss: 1.0141, test_f1: 0.4805
 epoch: 85, train_loss: 1.1029, test_loss: 1.0143, test_f1: 0.4887
 epoch: 86, train_loss: 1.0957, test_loss: 1.0112, test_f1: 0.4868
 epoch: 87, train_loss: 1.0994, test_loss: 1.0146, test_f1: 0.4884
 epoch: 88, train_loss: 1.0999, test_loss: 1.0132, test_f1: 0.4858
 epoch: 89, train_loss: 1.1022, test_loss: 1.0138, test_f1: 0.5011
 epoch: 90, train_loss: 1.0947, test_loss: 1.0108, test_f1: 0.4845
 epoch: 91, train_loss: 1.0894, test_loss: 1.0061, test_f1: 0.4950
 epoch: 92, train_loss: 1.0937, test_loss: 1.0082, test_f1: 0.4942
 epoch: 93, train_loss: 1.0905, test_loss: 1.0077, test_f1: 0.4981
 epoch: 94, train_loss: 1.0950, test_loss: 1.0086, test_f1: 0.4901
 epoch: 95, train_loss: 1.1016, test_loss: 1.0056, test_f1: 0.4878
 epoch: 96, train_loss: 1.0936, test_loss: 1.0015, test_f1: 0.4945
 epoch: 97, train_loss: 1.0931, test_loss: 1.0040, test_f1: 0.4999
 epoch: 98, train_loss: 1.0968, test_loss: 1.0067, test_f1: 0.4824
 epoch: 99, train_loss: 1.0922, test_loss: 1.0000, test_f1: 0.4920
##################ITERATION #9 ****************************************
 epoch: 0, train_loss: 1.3389, test_loss: 1.3314, test_f1: 0.2589
 epoch: 1, train_loss: 1.3163, test_loss: 1.3230, test_f1: 0.2589
 epoch: 2, train_loss: 1.3072, test_loss: 1.3123, test_f1: 0.2589
 epoch: 3, train_loss: 1.2992, test_loss: 1.3035, test_f1: 0.2589
 epoch: 4, train_loss: 1.2887, test_loss: 1.2969, test_f1: 0.2589
 epoch: 5, train_loss: 1.2804, test_loss: 1.2897, test_f1: 0.2589
 epoch: 6, train_loss: 1.2763, test_loss: 1.2844, test_f1: 0.2589
 epoch: 7, train_loss: 1.2726, test_loss: 1.2798, test_f1: 0.2589
 epoch: 8, train_loss: 1.2680, test_loss: 1.2752, test_f1: 0.2589
 epoch: 9, train_loss: 1.2689, test_loss: 1.2688, test_f1: 0.2477
 epoch: 10, train_loss: 1.2621, test_loss: 1.2656, test_f1: 0.2689
 epoch: 11, train_loss: 1.2623, test_loss: 1.2653, test_f1: 0.2552
 epoch: 12, train_loss: 1.2597, test_loss: 1.2609, test_f1: 0.2611
 epoch: 13, train_loss: 1.2553, test_loss: 1.2576, test_f1: 0.2581
 epoch: 14, train_loss: 1.2534, test_loss: 1.2556, test_f1: 0.2746
 epoch: 15, train_loss: 1.2543, test_loss: 1.2557, test_f1: 0.2747
 epoch: 16, train_loss: 1.2537, test_loss: 1.2524, test_f1: 0.2871
 epoch: 17, train_loss: 1.2494, test_loss: 1.2502, test_f1: 0.2887
 epoch: 18, train_loss: 1.2508, test_loss: 1.2452, test_f1: 0.2765
 epoch: 19, train_loss: 1.2475, test_loss: 1.2411, test_f1: 0.2876
 epoch: 20, train_loss: 1.2461, test_loss: 1.2390, test_f1: 0.2949
 epoch: 21, train_loss: 1.2465, test_loss: 1.2383, test_f1: 0.2939
 epoch: 22, train_loss: 1.2430, test_loss: 1.2391, test_f1: 0.2955
 epoch: 23, train_loss: 1.2442, test_loss: 1.2342, test_f1: 0.2961
 epoch: 24, train_loss: 1.2403, test_loss: 1.2318, test_f1: 0.2932
 epoch: 25, train_loss: 1.2407, test_loss: 1.2294, test_f1: 0.2943
 epoch: 26, train_loss: 1.2400, test_loss: 1.2278, test_f1: 0.3096
 epoch: 27, train_loss: 1.2399, test_loss: 1.2257, test_f1: 0.2962
 epoch: 28, train_loss: 1.2324, test_loss: 1.2244, test_f1: 0.2979
 epoch: 29, train_loss: 1.2291, test_loss: 1.2251, test_f1: 0.3198
 epoch: 30, train_loss: 1.2347, test_loss: 1.2210, test_f1: 0.2979
 epoch: 31, train_loss: 1.2266, test_loss: 1.2192, test_f1: 0.3091
 epoch: 32, train_loss: 1.2306, test_loss: 1.2173, test_f1: 0.3000
 epoch: 33, train_loss: 1.2290, test_loss: 1.2132, test_f1: 0.3015
 epoch: 34, train_loss: 1.2239, test_loss: 1.2112, test_f1: 0.3070
 epoch: 35, train_loss: 1.2295, test_loss: 1.2090, test_f1: 0.3087
 epoch: 36, train_loss: 1.2256, test_loss: 1.2060, test_f1: 0.3096
 epoch: 37, train_loss: 1.2259, test_loss: 1.2090, test_f1: 0.3099
 epoch: 38, train_loss: 1.2239, test_loss: 1.2052, test_f1: 0.3160
 epoch: 39, train_loss: 1.2219, test_loss: 1.2022, test_f1: 0.3178
 epoch: 40, train_loss: 1.2209, test_loss: 1.2029, test_f1: 0.3154
 epoch: 41, train_loss: 1.2188, test_loss: 1.1980, test_f1: 0.3179
 epoch: 42, train_loss: 1.2158, test_loss: 1.1941, test_f1: 0.3269
 epoch: 43, train_loss: 1.2127, test_loss: 1.1926, test_f1: 0.3275
 epoch: 44, train_loss: 1.2135, test_loss: 1.1921, test_f1: 0.3331
 epoch: 45, train_loss: 1.2120, test_loss: 1.1899, test_f1: 0.3336
 epoch: 46, train_loss: 1.2117, test_loss: 1.1871, test_f1: 0.3306
 epoch: 47, train_loss: 1.2009, test_loss: 1.1849, test_f1: 0.3311
 epoch: 48, train_loss: 1.2063, test_loss: 1.1821, test_f1: 0.3300
 epoch: 49, train_loss: 1.2099, test_loss: 1.1841, test_f1: 0.3321
 epoch: 50, train_loss: 1.2090, test_loss: 1.1781, test_f1: 0.3313
 epoch: 51, train_loss: 1.2062, test_loss: 1.1756, test_f1: 0.3338
 epoch: 52, train_loss: 1.2087, test_loss: 1.1762, test_f1: 0.3289
 epoch: 53, train_loss: 1.2006, test_loss: 1.1752, test_f1: 0.3322
 epoch: 54, train_loss: 1.1951, test_loss: 1.1765, test_f1: 0.3313
 epoch: 55, train_loss: 1.2066, test_loss: 1.1730, test_f1: 0.3301
 epoch: 56, train_loss: 1.1999, test_loss: 1.1726, test_f1: 0.3262
 epoch: 57, train_loss: 1.1993, test_loss: 1.1729, test_f1: 0.3292
 epoch: 58, train_loss: 1.2032, test_loss: 1.1740, test_f1: 0.3321
 epoch: 59, train_loss: 1.1983, test_loss: 1.1712, test_f1: 0.3307
 epoch: 60, train_loss: 1.2055, test_loss: 1.1726, test_f1: 0.3322
 epoch: 61, train_loss: 1.1984, test_loss: 1.1707, test_f1: 0.3315
 epoch: 62, train_loss: 1.1987, test_loss: 1.1688, test_f1: 0.3336
 epoch: 63, train_loss: 1.1975, test_loss: 1.1706, test_f1: 0.3352
 epoch: 64, train_loss: 1.1917, test_loss: 1.1684, test_f1: 0.3349
 epoch: 65, train_loss: 1.1935, test_loss: 1.1691, test_f1: 0.3345
 epoch: 66, train_loss: 1.1899, test_loss: 1.1668, test_f1: 0.3363
 epoch: 67, train_loss: 1.1948, test_loss: 1.1684, test_f1: 0.3397
 epoch: 68, train_loss: 1.1981, test_loss: 1.1688, test_f1: 0.3393
 epoch: 69, train_loss: 1.1932, test_loss: 1.1635, test_f1: 0.3411
 epoch: 70, train_loss: 1.1953, test_loss: 1.1628, test_f1: 0.3416
 epoch: 71, train_loss: 1.1946, test_loss: 1.1620, test_f1: 0.3308
 epoch: 72, train_loss: 1.1956, test_loss: 1.1627, test_f1: 0.3277
 epoch: 73, train_loss: 1.1917, test_loss: 1.1647, test_f1: 0.3328
 epoch: 74, train_loss: 1.1847, test_loss: 1.1598, test_f1: 0.3323
 epoch: 75, train_loss: 1.1854, test_loss: 1.1594, test_f1: 0.3369
 epoch: 76, train_loss: 1.1856, test_loss: 1.1587, test_f1: 0.3367
 epoch: 77, train_loss: 1.1843, test_loss: 1.1548, test_f1: 0.3432
 epoch: 78, train_loss: 1.1874, test_loss: 1.1556, test_f1: 0.3387
 epoch: 79, train_loss: 1.1897, test_loss: 1.1532, test_f1: 0.3430
 epoch: 80, train_loss: 1.1834, test_loss: 1.1528, test_f1: 0.3377
 epoch: 81, train_loss: 1.1868, test_loss: 1.1557, test_f1: 0.3417
 epoch: 82, train_loss: 1.1794, test_loss: 1.1539, test_f1: 0.3377
 epoch: 83, train_loss: 1.1867, test_loss: 1.1523, test_f1: 0.3368
 epoch: 84, train_loss: 1.1836, test_loss: 1.1516, test_f1: 0.3409
 epoch: 85, train_loss: 1.1925, test_loss: 1.1496, test_f1: 0.3417
 epoch: 86, train_loss: 1.1815, test_loss: 1.1523, test_f1: 0.3388
 epoch: 87, train_loss: 1.1828, test_loss: 1.1535, test_f1: 0.3417
 epoch: 88, train_loss: 1.1883, test_loss: 1.1484, test_f1: 0.3357
 epoch: 89, train_loss: 1.1849, test_loss: 1.1486, test_f1: 0.3342
 epoch: 90, train_loss: 1.1829, test_loss: 1.1489, test_f1: 0.3332
 epoch: 91, train_loss: 1.1807, test_loss: 1.1487, test_f1: 0.3449
 epoch: 92, train_loss: 1.1836, test_loss: 1.1503, test_f1: 0.3391
 epoch: 93, train_loss: 1.1769, test_loss: 1.1461, test_f1: 0.3390
 epoch: 94, train_loss: 1.1795, test_loss: 1.1455, test_f1: 0.3550
 epoch: 95, train_loss: 1.1778, test_loss: 1.1450, test_f1: 0.3513
 epoch: 96, train_loss: 1.1793, test_loss: 1.1433, test_f1: 0.3537
 epoch: 97, train_loss: 1.1764, test_loss: 1.1471, test_f1: 0.3532
 epoch: 98, train_loss: 1.1770, test_loss: 1.1432, test_f1: 0.3555
 epoch: 99, train_loss: 1.1783, test_loss: 1.1443, test_f1: 0.3595

Training completed in 608.20 seconds
Best F1: 0.5011 at epoch 89
Mean F1 across iterations: 0.4091  0.0512
========================FINAL RESULTS================================
FEGIN weighted F1: 0.5011  0.0512
python main.py --data ltspice_examples --representation component_component --model FEGIN --layers 3 --hiddens 16 --batch_size 64 --lr 0.0001 --emb_size 512 --epochs 100 --save_appendix component_component_L3_H16_BS64_LR0.0001_E512 --no_val
-----



STDERR:
  File "main.py", line 370, in <module>
    main()
  File "main.py", line 254, in main
    dataset = dataset_class(
  File "/home/philip/projects/ltspice_examples_code_repo/Circuit-Completion-Using-GNNs/component_classification_with_link_prediction_head/evaluation/FEGIN/kernel/circuit_datasets.py", line 15, in __init__
    self.data, self.slices = torch.load(self.processed_paths[0])
  File "/home/philip/.local/lib/python3.8/site-packages/torch/serialization.py", line 1040, in load
    warnings.warn(
  File "/usr/lib/python3.8/warnings.py", line 109, in _showwarnmsg
    sw(msg.message, msg.category, msg.filename, msg.lineno,
  File "main.py", line 47, in warn_with_traceback
    traceback.print_stack(file=log)
/home/philip/projects/ltspice_examples_code_repo/Circuit-Completion-Using-GNNs/component_classification_with_link_prediction_head/evaluation/FEGIN/kernel/circuit_datasets.py:15: FutureWarning: You are using `torch.load` with `weights_only=False` (the current default value), which uses the default pickle module implicitly. It is possible to construct malicious pickle data which will execute arbitrary code during unpickling (See https://github.com/pytorch/pytorch/blob/main/SECURITY.md#untrusted-models for more details). In a future release, the default value for `weights_only` will be flipped to `True`. This limits the functions that could be executed during unpickling. Arbitrary objects will no longer be allowed to be loaded via this mode unless they are explicitly allowlisted by the user via `torch.serialization.add_safe_globals`. We recommend you start setting `weights_only=True` for any use case where you don't have full control of the loaded file. Please open an issue on GitHub for any issues related to this experimental feature.
  self.data, self.slices = torch.load(self.processed_paths[0])
