STDOUT:
Results will be saved in /home/philip/projects/ltspice_examples_code_repo/Circuit-Completion-Using-GNNs/component_classification_with_link_prediction_head/evaluation/FEGIN/results/model_FEGIN_dataset_ltspice_examples
Command line input: python main.py --data ltspice_examples --representation component_pin_net --model FEGIN --layers 6 --hiddens 64 --batch_size 64 --lr 0.001 --emb_size 512 --epochs 100 --save_appendix component_pin_net_L6_H64_BS64_LR0.001_E512 --no_val
 is saved.
-----
ltspice_examples - FEGIN
Using 6 layers, 64 hidden units, h = 2
Loading component_pin_net representation dataset
ENTERED
Training FEGIN on component_pin_net representation
Train: 3558, Test: 846
##################ITERATION #0 ****************************************
 epoch: 0, train_loss: 1.2044, test_loss: 1.1137, test_f1: 0.3278
 epoch: 1, train_loss: 1.0251, test_loss: 0.9903, test_f1: 0.5410
 epoch: 2, train_loss: 0.9832, test_loss: 1.0030, test_f1: 0.5018
 epoch: 3, train_loss: 0.9553, test_loss: 1.0009, test_f1: 0.5026
 epoch: 4, train_loss: 0.9151, test_loss: 0.9067, test_f1: 0.5073
 epoch: 5, train_loss: 0.8978, test_loss: 0.9700, test_f1: 0.5153
 epoch: 6, train_loss: 0.8731, test_loss: 0.9073, test_f1: 0.5228
 epoch: 7, train_loss: 0.8663, test_loss: 0.8792, test_f1: 0.5250
 epoch: 8, train_loss: 0.8523, test_loss: 0.8971, test_f1: 0.5183
 epoch: 9, train_loss: 0.8260, test_loss: 0.8124, test_f1: 0.5506
 epoch: 10, train_loss: 0.8194, test_loss: 0.8327, test_f1: 0.5569
 epoch: 11, train_loss: 0.8308, test_loss: 0.8101, test_f1: 0.5711
 epoch: 12, train_loss: 0.7976, test_loss: 0.8187, test_f1: 0.6101
 epoch: 13, train_loss: 0.7899, test_loss: 0.9140, test_f1: 0.5991
 epoch: 14, train_loss: 0.7931, test_loss: 0.7963, test_f1: 0.5808
 epoch: 15, train_loss: 0.7718, test_loss: 0.8209, test_f1: 0.5808
 epoch: 16, train_loss: 0.7662, test_loss: 0.7724, test_f1: 0.5648
 epoch: 17, train_loss: 0.7560, test_loss: 0.7805, test_f1: 0.5745
 epoch: 18, train_loss: 0.7419, test_loss: 0.8158, test_f1: 0.5641
 epoch: 19, train_loss: 0.7173, test_loss: 0.8372, test_f1: 0.5930
 epoch: 20, train_loss: 0.7108, test_loss: 0.8725, test_f1: 0.5646
 epoch: 21, train_loss: 0.7035, test_loss: 0.8375, test_f1: 0.5952
 epoch: 22, train_loss: 0.6785, test_loss: 0.8919, test_f1: 0.5976
 epoch: 23, train_loss: 0.6786, test_loss: 0.9267, test_f1: 0.5596
 epoch: 24, train_loss: 0.6621, test_loss: 1.0502, test_f1: 0.5612
 epoch: 25, train_loss: 0.6577, test_loss: 0.7860, test_f1: 0.6135
 epoch: 26, train_loss: 0.6522, test_loss: 0.7527, test_f1: 0.6336
 epoch: 27, train_loss: 0.6605, test_loss: 0.7847, test_f1: 0.6172
 epoch: 28, train_loss: 0.6246, test_loss: 0.8980, test_f1: 0.6060
 epoch: 29, train_loss: 0.6355, test_loss: 0.7493, test_f1: 0.6106
 epoch: 30, train_loss: 0.6128, test_loss: 0.7636, test_f1: 0.6490
 epoch: 31, train_loss: 0.5909, test_loss: 0.8005, test_f1: 0.6515
 epoch: 32, train_loss: 0.5765, test_loss: 0.8880, test_f1: 0.6376
 epoch: 33, train_loss: 0.5851, test_loss: 0.7711, test_f1: 0.6578
 epoch: 34, train_loss: 0.5829, test_loss: 0.8388, test_f1: 0.6572
 epoch: 35, train_loss: 0.5831, test_loss: 0.8083, test_f1: 0.6548
 epoch: 36, train_loss: 0.5656, test_loss: 0.9454, test_f1: 0.6042
 epoch: 37, train_loss: 0.5669, test_loss: 0.8987, test_f1: 0.6410
 epoch: 38, train_loss: 0.5704, test_loss: 0.7636, test_f1: 0.6461
 epoch: 39, train_loss: 0.5294, test_loss: 0.9417, test_f1: 0.6465
 epoch: 40, train_loss: 0.5373, test_loss: 0.8199, test_f1: 0.6926
 epoch: 41, train_loss: 0.5315, test_loss: 0.9771, test_f1: 0.6308
 epoch: 42, train_loss: 0.5412, test_loss: 0.9050, test_f1: 0.6206
 epoch: 43, train_loss: 0.5201, test_loss: 0.7969, test_f1: 0.6762
 epoch: 44, train_loss: 0.5207, test_loss: 1.0852, test_f1: 0.5907
 epoch: 45, train_loss: 0.5109, test_loss: 0.8900, test_f1: 0.6425
 epoch: 46, train_loss: 0.4972, test_loss: 0.8928, test_f1: 0.6436
 epoch: 47, train_loss: 0.5155, test_loss: 0.8287, test_f1: 0.6736
 epoch: 48, train_loss: 0.5156, test_loss: 0.8265, test_f1: 0.6694
 epoch: 49, train_loss: 0.4891, test_loss: 0.8890, test_f1: 0.6577
 epoch: 50, train_loss: 0.4746, test_loss: 0.8701, test_f1: 0.6684
 epoch: 51, train_loss: 0.4469, test_loss: 0.8539, test_f1: 0.6660
 epoch: 52, train_loss: 0.4355, test_loss: 0.9365, test_f1: 0.6697
 epoch: 53, train_loss: 0.3880, test_loss: 0.9358, test_f1: 0.6793
 epoch: 54, train_loss: 0.4058, test_loss: 0.9304, test_f1: 0.6624
 epoch: 55, train_loss: 0.3972, test_loss: 0.9406, test_f1: 0.6818
 epoch: 56, train_loss: 0.3819, test_loss: 1.0365, test_f1: 0.6628
 epoch: 57, train_loss: 0.3778, test_loss: 1.0625, test_f1: 0.6685
 epoch: 58, train_loss: 0.4031, test_loss: 1.0077, test_f1: 0.6797
 epoch: 59, train_loss: 0.3672, test_loss: 0.9476, test_f1: 0.6826
 epoch: 60, train_loss: 0.3923, test_loss: 0.9296, test_f1: 0.6781
 epoch: 61, train_loss: 0.3738, test_loss: 0.9992, test_f1: 0.6837
 epoch: 62, train_loss: 0.3449, test_loss: 1.0268, test_f1: 0.6796
 epoch: 63, train_loss: 0.3524, test_loss: 1.1049, test_f1: 0.6800
 epoch: 64, train_loss: 0.3462, test_loss: 1.1302, test_f1: 0.6623
 epoch: 65, train_loss: 0.3390, test_loss: 1.1353, test_f1: 0.6721
 epoch: 66, train_loss: 0.3472, test_loss: 1.0695, test_f1: 0.6761
 epoch: 67, train_loss: 0.3271, test_loss: 1.1897, test_f1: 0.6816
 epoch: 68, train_loss: 0.3355, test_loss: 1.1349, test_f1: 0.6839
 epoch: 69, train_loss: 0.3408, test_loss: 1.1244, test_f1: 0.6880
 epoch: 70, train_loss: 0.3258, test_loss: 1.0968, test_f1: 0.7025
 epoch: 71, train_loss: 0.3149, test_loss: 1.1161, test_f1: 0.6882
 epoch: 72, train_loss: 0.3327, test_loss: 1.2434, test_f1: 0.6664
 epoch: 73, train_loss: 0.3291, test_loss: 1.1446, test_f1: 0.6791
 epoch: 74, train_loss: 0.3230, test_loss: 1.1193, test_f1: 0.6927
 epoch: 75, train_loss: 0.3210, test_loss: 1.0804, test_f1: 0.6679
 epoch: 76, train_loss: 0.2942, test_loss: 1.2238, test_f1: 0.6905
 epoch: 77, train_loss: 0.3035, test_loss: 1.2521, test_f1: 0.6702
 epoch: 78, train_loss: 0.3372, test_loss: 1.1932, test_f1: 0.6814
 epoch: 79, train_loss: 0.3193, test_loss: 1.1557, test_f1: 0.6784
 epoch: 80, train_loss: 0.2929, test_loss: 1.1562, test_f1: 0.7009
 epoch: 81, train_loss: 0.2921, test_loss: 1.1708, test_f1: 0.6948
 epoch: 82, train_loss: 0.2878, test_loss: 1.2314, test_f1: 0.6829
 epoch: 83, train_loss: 0.3003, test_loss: 1.2016, test_f1: 0.6958
 epoch: 84, train_loss: 0.2848, test_loss: 1.3159, test_f1: 0.6920
 epoch: 85, train_loss: 0.2980, test_loss: 1.2210, test_f1: 0.6807
 epoch: 86, train_loss: 0.2968, test_loss: 1.3170, test_f1: 0.6822
 epoch: 87, train_loss: 0.2585, test_loss: 1.3275, test_f1: 0.6889
 epoch: 88, train_loss: 0.2552, test_loss: 1.3332, test_f1: 0.6817
 epoch: 89, train_loss: 0.2639, test_loss: 1.3907, test_f1: 0.7039
 epoch: 90, train_loss: 0.2597, test_loss: 1.2533, test_f1: 0.6977
 epoch: 91, train_loss: 0.2656, test_loss: 1.3514, test_f1: 0.6863
 epoch: 92, train_loss: 0.2639, test_loss: 1.4042, test_f1: 0.6909
 epoch: 93, train_loss: 0.2799, test_loss: 1.3301, test_f1: 0.6665
 epoch: 94, train_loss: 0.2607, test_loss: 1.4492, test_f1: 0.6777
 epoch: 95, train_loss: 0.2389, test_loss: 1.5208, test_f1: 0.6900
 epoch: 96, train_loss: 0.2521, test_loss: 1.4955, test_f1: 0.6768
 epoch: 97, train_loss: 0.2411, test_loss: 1.5207, test_f1: 0.6757
 epoch: 98, train_loss: 0.2368, test_loss: 1.5812, test_f1: 0.6686
 epoch: 99, train_loss: 0.2455, test_loss: 1.6210, test_f1: 0.6592
##################ITERATION #1 ****************************************
 epoch: 0, train_loss: 1.0842, test_loss: 1.1688, test_f1: 0.3282
 epoch: 1, train_loss: 0.9898, test_loss: 0.9683, test_f1: 0.4900
 epoch: 2, train_loss: 0.9480, test_loss: 0.9134, test_f1: 0.4971
 epoch: 3, train_loss: 0.9265, test_loss: 0.9476, test_f1: 0.4965
 epoch: 4, train_loss: 0.9067, test_loss: 0.8764, test_f1: 0.5222
 epoch: 5, train_loss: 0.8899, test_loss: 0.8473, test_f1: 0.5567
 epoch: 6, train_loss: 0.8715, test_loss: 0.8181, test_f1: 0.5543
 epoch: 7, train_loss: 0.8598, test_loss: 0.8118, test_f1: 0.5724
 epoch: 8, train_loss: 0.8407, test_loss: 0.8261, test_f1: 0.5892
 epoch: 9, train_loss: 0.8096, test_loss: 0.8161, test_f1: 0.5830
 epoch: 10, train_loss: 0.8088, test_loss: 0.7786, test_f1: 0.5891
 epoch: 11, train_loss: 0.7750, test_loss: 0.8464, test_f1: 0.5954
 epoch: 12, train_loss: 0.7709, test_loss: 0.7441, test_f1: 0.6352
 epoch: 13, train_loss: 0.7425, test_loss: 0.7428, test_f1: 0.6432
 epoch: 14, train_loss: 0.7401, test_loss: 0.7621, test_f1: 0.6424
 epoch: 15, train_loss: 0.7355, test_loss: 0.7316, test_f1: 0.6531
 epoch: 16, train_loss: 0.7263, test_loss: 0.7244, test_f1: 0.6407
 epoch: 17, train_loss: 0.7084, test_loss: 0.7398, test_f1: 0.6420
 epoch: 18, train_loss: 0.7101, test_loss: 0.7620, test_f1: 0.6124
 epoch: 19, train_loss: 0.7041, test_loss: 0.7158, test_f1: 0.6685
 epoch: 20, train_loss: 0.6898, test_loss: 0.7634, test_f1: 0.6591
 epoch: 21, train_loss: 0.6713, test_loss: 0.7111, test_f1: 0.6669
 epoch: 22, train_loss: 0.6384, test_loss: 0.7184, test_f1: 0.6681
 epoch: 23, train_loss: 0.6549, test_loss: 0.7957, test_f1: 0.6631
 epoch: 24, train_loss: 0.6506, test_loss: 0.7142, test_f1: 0.6748
 epoch: 25, train_loss: 0.6381, test_loss: 0.7815, test_f1: 0.6357
 epoch: 26, train_loss: 0.6346, test_loss: 0.7177, test_f1: 0.6594
 epoch: 27, train_loss: 0.6124, test_loss: 0.7270, test_f1: 0.6628
 epoch: 28, train_loss: 0.6163, test_loss: 0.7538, test_f1: 0.6070
 epoch: 29, train_loss: 0.6021, test_loss: 0.7988, test_f1: 0.6521
 epoch: 30, train_loss: 0.5850, test_loss: 0.7169, test_f1: 0.6823
 epoch: 31, train_loss: 0.5899, test_loss: 0.8801, test_f1: 0.6784
 epoch: 32, train_loss: 0.5798, test_loss: 0.8515, test_f1: 0.6431
 epoch: 33, train_loss: 0.5747, test_loss: 0.8716, test_f1: 0.6602
 epoch: 34, train_loss: 0.5777, test_loss: 0.8596, test_f1: 0.6489
 epoch: 35, train_loss: 0.5547, test_loss: 0.8126, test_f1: 0.6729
 epoch: 36, train_loss: 0.5637, test_loss: 0.9623, test_f1: 0.6511
 epoch: 37, train_loss: 0.5386, test_loss: 0.7510, test_f1: 0.6647
 epoch: 38, train_loss: 0.5363, test_loss: 0.8859, test_f1: 0.6820
 epoch: 39, train_loss: 0.5297, test_loss: 0.8224, test_f1: 0.6305
 epoch: 40, train_loss: 0.5190, test_loss: 0.8247, test_f1: 0.6666
 epoch: 41, train_loss: 0.5171, test_loss: 0.8776, test_f1: 0.6585
 epoch: 42, train_loss: 0.5249, test_loss: 0.8350, test_f1: 0.6378
 epoch: 43, train_loss: 0.5073, test_loss: 0.9872, test_f1: 0.6623
 epoch: 44, train_loss: 0.5023, test_loss: 0.9104, test_f1: 0.6814
 epoch: 45, train_loss: 0.5031, test_loss: 1.0866, test_f1: 0.6365
 epoch: 46, train_loss: 0.4874, test_loss: 0.9491, test_f1: 0.6212
 epoch: 47, train_loss: 0.4790, test_loss: 0.8984, test_f1: 0.6673
 epoch: 48, train_loss: 0.4781, test_loss: 1.1511, test_f1: 0.6483
 epoch: 49, train_loss: 0.4737, test_loss: 1.0902, test_f1: 0.6354
 epoch: 50, train_loss: 0.4765, test_loss: 0.8454, test_f1: 0.6553
 epoch: 51, train_loss: 0.4329, test_loss: 1.0242, test_f1: 0.6588
 epoch: 52, train_loss: 0.4016, test_loss: 1.1341, test_f1: 0.6594
 epoch: 53, train_loss: 0.4070, test_loss: 1.0122, test_f1: 0.6534
 epoch: 54, train_loss: 0.3941, test_loss: 1.0955, test_f1: 0.6707
 epoch: 55, train_loss: 0.3881, test_loss: 1.2360, test_f1: 0.6742
 epoch: 56, train_loss: 0.3786, test_loss: 1.2130, test_f1: 0.6402
 epoch: 57, train_loss: 0.3769, test_loss: 1.2761, test_f1: 0.6520
 epoch: 58, train_loss: 0.3720, test_loss: 1.0693, test_f1: 0.6554
 epoch: 59, train_loss: 0.3666, test_loss: 1.2554, test_f1: 0.6560
 epoch: 60, train_loss: 0.3666, test_loss: 1.3188, test_f1: 0.6611
 epoch: 61, train_loss: 0.3643, test_loss: 1.3847, test_f1: 0.6766
 epoch: 62, train_loss: 0.3478, test_loss: 1.2983, test_f1: 0.6685
 epoch: 63, train_loss: 0.3498, test_loss: 1.3875, test_f1: 0.6569
 epoch: 64, train_loss: 0.3597, test_loss: 1.1193, test_f1: 0.6611
 epoch: 65, train_loss: 0.3680, test_loss: 1.3672, test_f1: 0.6791
 epoch: 66, train_loss: 0.3370, test_loss: 1.5259, test_f1: 0.6387
 epoch: 67, train_loss: 0.3549, test_loss: 1.5829, test_f1: 0.6612
 epoch: 68, train_loss: 0.3386, test_loss: 1.5992, test_f1: 0.6504
 epoch: 69, train_loss: 0.3317, test_loss: 1.5082, test_f1: 0.6733
 epoch: 70, train_loss: 0.3372, test_loss: 1.5109, test_f1: 0.6699
 epoch: 71, train_loss: 0.3219, test_loss: 1.4840, test_f1: 0.6675
 epoch: 72, train_loss: 0.3063, test_loss: 1.5280, test_f1: 0.6798
 epoch: 73, train_loss: 0.3519, test_loss: 1.5196, test_f1: 0.6754
 epoch: 74, train_loss: 0.3137, test_loss: 1.3917, test_f1: 0.6803
 epoch: 75, train_loss: 0.3238, test_loss: 1.4806, test_f1: 0.6648
 epoch: 76, train_loss: 0.3000, test_loss: 1.5548, test_f1: 0.6832
 epoch: 77, train_loss: 0.2978, test_loss: 1.4887, test_f1: 0.6811
 epoch: 78, train_loss: 0.3025, test_loss: 1.6080, test_f1: 0.6645
 epoch: 79, train_loss: 0.2966, test_loss: 1.5396, test_f1: 0.6630
 epoch: 80, train_loss: 0.2912, test_loss: 1.7959, test_f1: 0.6679
 epoch: 81, train_loss: 0.2898, test_loss: 1.4489, test_f1: 0.6725
 epoch: 82, train_loss: 0.2869, test_loss: 1.6351, test_f1: 0.6632
 epoch: 83, train_loss: 0.2900, test_loss: 1.6063, test_f1: 0.6572
 epoch: 84, train_loss: 0.2996, test_loss: 1.6316, test_f1: 0.6693
 epoch: 85, train_loss: 0.2758, test_loss: 1.7283, test_f1: 0.6569
 epoch: 86, train_loss: 0.2756, test_loss: 1.6406, test_f1: 0.6682
 epoch: 87, train_loss: 0.2938, test_loss: 1.6545, test_f1: 0.6673
 epoch: 88, train_loss: 0.2835, test_loss: 1.6552, test_f1: 0.6798
 epoch: 89, train_loss: 0.2797, test_loss: 1.8315, test_f1: 0.6698
 epoch: 90, train_loss: 0.2628, test_loss: 1.6731, test_f1: 0.6883
 epoch: 91, train_loss: 0.2623, test_loss: 1.7820, test_f1: 0.6752
 epoch: 92, train_loss: 0.2690, test_loss: 1.8467, test_f1: 0.6607
 epoch: 93, train_loss: 0.2587, test_loss: 1.8380, test_f1: 0.6648
 epoch: 94, train_loss: 0.2619, test_loss: 1.7942, test_f1: 0.6896
 epoch: 95, train_loss: 0.2641, test_loss: 1.6958, test_f1: 0.6737
 epoch: 96, train_loss: 0.2584, test_loss: 1.6817, test_f1: 0.6761
 epoch: 97, train_loss: 0.2537, test_loss: 1.7891, test_f1: 0.6666
 epoch: 98, train_loss: 0.2555, test_loss: 1.6007, test_f1: 0.6713
 epoch: 99, train_loss: 0.2647, test_loss: 1.7843, test_f1: 0.6746
##################ITERATION #2 ****************************************
 epoch: 0, train_loss: 1.1190, test_loss: 1.5595, test_f1: 0.2943
 epoch: 1, train_loss: 0.9924, test_loss: 0.9714, test_f1: 0.5183
 epoch: 2, train_loss: 0.9432, test_loss: 0.9638, test_f1: 0.5135
 epoch: 3, train_loss: 0.9366, test_loss: 0.9389, test_f1: 0.5149
 epoch: 4, train_loss: 0.8993, test_loss: 0.9066, test_f1: 0.5134
 epoch: 5, train_loss: 0.8655, test_loss: 0.8371, test_f1: 0.5736
 epoch: 6, train_loss: 0.8541, test_loss: 0.8344, test_f1: 0.5992
 epoch: 7, train_loss: 0.8322, test_loss: 0.8742, test_f1: 0.5508
 epoch: 8, train_loss: 0.8016, test_loss: 0.7982, test_f1: 0.5984
 epoch: 9, train_loss: 0.8049, test_loss: 0.8285, test_f1: 0.5782
 epoch: 10, train_loss: 0.7817, test_loss: 0.8677, test_f1: 0.6149
 epoch: 11, train_loss: 0.7811, test_loss: 0.8096, test_f1: 0.5848
 epoch: 12, train_loss: 0.7438, test_loss: 0.7721, test_f1: 0.5883
 epoch: 13, train_loss: 0.7479, test_loss: 0.7939, test_f1: 0.6018
 epoch: 14, train_loss: 0.7117, test_loss: 0.7580, test_f1: 0.6496
 epoch: 15, train_loss: 0.7227, test_loss: 0.8864, test_f1: 0.5821
 epoch: 16, train_loss: 0.7012, test_loss: 0.7349, test_f1: 0.6619
 epoch: 17, train_loss: 0.6984, test_loss: 0.6973, test_f1: 0.6856
 epoch: 18, train_loss: 0.6802, test_loss: 0.7020, test_f1: 0.6732
 epoch: 19, train_loss: 0.6652, test_loss: 0.7283, test_f1: 0.6566
 epoch: 20, train_loss: 0.6678, test_loss: 0.7305, test_f1: 0.6521
 epoch: 21, train_loss: 0.6490, test_loss: 0.7575, test_f1: 0.6157
 epoch: 22, train_loss: 0.6489, test_loss: 0.7294, test_f1: 0.6421
 epoch: 23, train_loss: 0.6246, test_loss: 0.7225, test_f1: 0.6910
 epoch: 24, train_loss: 0.6213, test_loss: 0.8080, test_f1: 0.5985
 epoch: 25, train_loss: 0.6393, test_loss: 0.7388, test_f1: 0.6463
 epoch: 26, train_loss: 0.6128, test_loss: 0.7071, test_f1: 0.6481
 epoch: 27, train_loss: 0.6045, test_loss: 0.7577, test_f1: 0.6243
 epoch: 28, train_loss: 0.5857, test_loss: 0.7272, test_f1: 0.6608
 epoch: 29, train_loss: 0.5875, test_loss: 0.6824, test_f1: 0.6842
 epoch: 30, train_loss: 0.5719, test_loss: 0.8089, test_f1: 0.6305
 epoch: 31, train_loss: 0.5967, test_loss: 0.7585, test_f1: 0.6750
 epoch: 32, train_loss: 0.5636, test_loss: 0.7545, test_f1: 0.6841
 epoch: 33, train_loss: 0.5658, test_loss: 0.8337, test_f1: 0.6541
 epoch: 34, train_loss: 0.5698, test_loss: 0.6823, test_f1: 0.7033
 epoch: 35, train_loss: 0.5389, test_loss: 0.7027, test_f1: 0.6695
 epoch: 36, train_loss: 0.5434, test_loss: 0.7231, test_f1: 0.6865
 epoch: 37, train_loss: 0.5497, test_loss: 0.7634, test_f1: 0.6852
 epoch: 38, train_loss: 0.5286, test_loss: 0.8352, test_f1: 0.6257
 epoch: 39, train_loss: 0.5001, test_loss: 0.8167, test_f1: 0.6494
 epoch: 40, train_loss: 0.5150, test_loss: 0.7529, test_f1: 0.6818
 epoch: 41, train_loss: 0.5200, test_loss: 0.7750, test_f1: 0.6579
 epoch: 42, train_loss: 0.4934, test_loss: 0.8468, test_f1: 0.6556
 epoch: 43, train_loss: 0.5035, test_loss: 0.7748, test_f1: 0.6695
 epoch: 44, train_loss: 0.4921, test_loss: 0.7414, test_f1: 0.6815
 epoch: 45, train_loss: 0.4812, test_loss: 0.8042, test_f1: 0.6561
 epoch: 46, train_loss: 0.4714, test_loss: 0.7806, test_f1: 0.6775
 epoch: 47, train_loss: 0.4857, test_loss: 0.7655, test_f1: 0.6704
 epoch: 48, train_loss: 0.4806, test_loss: 0.7955, test_f1: 0.6666
 epoch: 49, train_loss: 0.4824, test_loss: 0.7813, test_f1: 0.6777
 epoch: 50, train_loss: 0.4637, test_loss: 0.9458, test_f1: 0.6511
 epoch: 51, train_loss: 0.4254, test_loss: 0.9470, test_f1: 0.6698
 epoch: 52, train_loss: 0.4045, test_loss: 0.9476, test_f1: 0.6701
 epoch: 53, train_loss: 0.3929, test_loss: 0.9040, test_f1: 0.6814
 epoch: 54, train_loss: 0.3882, test_loss: 0.9734, test_f1: 0.6710
 epoch: 55, train_loss: 0.3774, test_loss: 0.9500, test_f1: 0.6887
 epoch: 56, train_loss: 0.3929, test_loss: 1.0418, test_f1: 0.6711
 epoch: 57, train_loss: 0.3664, test_loss: 1.0539, test_f1: 0.6672
 epoch: 58, train_loss: 0.3765, test_loss: 0.9265, test_f1: 0.6689
 epoch: 59, train_loss: 0.3690, test_loss: 1.0179, test_f1: 0.6668
 epoch: 60, train_loss: 0.3597, test_loss: 1.0348, test_f1: 0.6768
 epoch: 61, train_loss: 0.3609, test_loss: 1.0881, test_f1: 0.6636
 epoch: 62, train_loss: 0.3427, test_loss: 1.0525, test_f1: 0.6474
 epoch: 63, train_loss: 0.3547, test_loss: 1.0315, test_f1: 0.6797
 epoch: 64, train_loss: 0.3401, test_loss: 1.0510, test_f1: 0.6762
 epoch: 65, train_loss: 0.3246, test_loss: 1.0345, test_f1: 0.6777
 epoch: 66, train_loss: 0.3354, test_loss: 1.0821, test_f1: 0.6661
 epoch: 67, train_loss: 0.3451, test_loss: 1.1394, test_f1: 0.6827
 epoch: 68, train_loss: 0.3098, test_loss: 1.0306, test_f1: 0.6973
 epoch: 69, train_loss: 0.3341, test_loss: 1.0950, test_f1: 0.7032
 epoch: 70, train_loss: 0.3222, test_loss: 1.2749, test_f1: 0.6582
 epoch: 71, train_loss: 0.3150, test_loss: 1.1964, test_f1: 0.6831
 epoch: 72, train_loss: 0.3100, test_loss: 1.2608, test_f1: 0.6726
 epoch: 73, train_loss: 0.3520, test_loss: 1.2103, test_f1: 0.6733
 epoch: 74, train_loss: 0.3115, test_loss: 1.1149, test_f1: 0.6777
 epoch: 75, train_loss: 0.2939, test_loss: 1.2310, test_f1: 0.6653
 epoch: 76, train_loss: 0.3006, test_loss: 1.1482, test_f1: 0.6790
 epoch: 77, train_loss: 0.2804, test_loss: 1.2944, test_f1: 0.6822
 epoch: 78, train_loss: 0.2917, test_loss: 1.3098, test_f1: 0.6789
 epoch: 79, train_loss: 0.3069, test_loss: 1.3468, test_f1: 0.6541
 epoch: 80, train_loss: 0.2794, test_loss: 1.3223, test_f1: 0.6805
 epoch: 81, train_loss: 0.3046, test_loss: 1.3034, test_f1: 0.6748
 epoch: 82, train_loss: 0.2798, test_loss: 1.2677, test_f1: 0.6705
 epoch: 83, train_loss: 0.2631, test_loss: 1.3039, test_f1: 0.6811
 epoch: 84, train_loss: 0.2710, test_loss: 1.2742, test_f1: 0.6845
 epoch: 85, train_loss: 0.2915, test_loss: 1.3775, test_f1: 0.6616
 epoch: 86, train_loss: 0.2946, test_loss: 1.4572, test_f1: 0.6710
 epoch: 87, train_loss: 0.2977, test_loss: 1.4915, test_f1: 0.6280
 epoch: 88, train_loss: 0.2945, test_loss: 1.3992, test_f1: 0.6659
 epoch: 89, train_loss: 0.2733, test_loss: 1.2380, test_f1: 0.6784
 epoch: 90, train_loss: 0.2470, test_loss: 1.3593, test_f1: 0.6810
 epoch: 91, train_loss: 0.2633, test_loss: 1.3611, test_f1: 0.6696
 epoch: 92, train_loss: 0.2626, test_loss: 1.3606, test_f1: 0.6805
 epoch: 93, train_loss: 0.2503, test_loss: 1.3103, test_f1: 0.6807
 epoch: 94, train_loss: 0.2422, test_loss: 1.4662, test_f1: 0.6713
 epoch: 95, train_loss: 0.2442, test_loss: 1.5411, test_f1: 0.6888
 epoch: 96, train_loss: 0.2522, test_loss: 1.4593, test_f1: 0.6722
 epoch: 97, train_loss: 0.2450, test_loss: 1.4243, test_f1: 0.6781
 epoch: 98, train_loss: 0.2458, test_loss: 1.4421, test_f1: 0.6622
 epoch: 99, train_loss: 0.2444, test_loss: 1.5360, test_f1: 0.6646
##################ITERATION #3 ****************************************
 epoch: 0, train_loss: 1.1347, test_loss: 1.0704, test_f1: 0.4647
 epoch: 1, train_loss: 0.9730, test_loss: 0.9582, test_f1: 0.5138
 epoch: 2, train_loss: 0.9419, test_loss: 0.9319, test_f1: 0.5227
 epoch: 3, train_loss: 0.9020, test_loss: 0.9150, test_f1: 0.5353
 epoch: 4, train_loss: 0.8875, test_loss: 0.8962, test_f1: 0.5279
 epoch: 5, train_loss: 0.8611, test_loss: 0.9074, test_f1: 0.5538
 epoch: 6, train_loss: 0.8546, test_loss: 0.8642, test_f1: 0.5723
 epoch: 7, train_loss: 0.8152, test_loss: 0.8643, test_f1: 0.5716
 epoch: 8, train_loss: 0.8125, test_loss: 0.8140, test_f1: 0.5827
 epoch: 9, train_loss: 0.7993, test_loss: 0.7938, test_f1: 0.6117
 epoch: 10, train_loss: 0.7743, test_loss: 0.7572, test_f1: 0.5820
 epoch: 11, train_loss: 0.7659, test_loss: 0.7610, test_f1: 0.6042
 epoch: 12, train_loss: 0.7422, test_loss: 0.7509, test_f1: 0.6725
 epoch: 13, train_loss: 0.7274, test_loss: 0.7540, test_f1: 0.6475
 epoch: 14, train_loss: 0.7132, test_loss: 0.7830, test_f1: 0.6268
 epoch: 15, train_loss: 0.6959, test_loss: 0.7917, test_f1: 0.6721
 epoch: 16, train_loss: 0.6828, test_loss: 0.7616, test_f1: 0.6490
 epoch: 17, train_loss: 0.6624, test_loss: 0.7273, test_f1: 0.6508
 epoch: 18, train_loss: 0.6595, test_loss: 0.7611, test_f1: 0.6511
 epoch: 19, train_loss: 0.6583, test_loss: 0.7355, test_f1: 0.6636
 epoch: 20, train_loss: 0.6527, test_loss: 0.7923, test_f1: 0.6451
 epoch: 21, train_loss: 0.6305, test_loss: 0.7671, test_f1: 0.6409
 epoch: 22, train_loss: 0.6207, test_loss: 0.7350, test_f1: 0.6695
 epoch: 23, train_loss: 0.6194, test_loss: 0.7348, test_f1: 0.6417
 epoch: 24, train_loss: 0.6044, test_loss: 0.8102, test_f1: 0.6821
 epoch: 25, train_loss: 0.6020, test_loss: 0.7400, test_f1: 0.6840
 epoch: 26, train_loss: 0.5876, test_loss: 0.8686, test_f1: 0.6616
 epoch: 27, train_loss: 0.5729, test_loss: 0.8224, test_f1: 0.6503
 epoch: 28, train_loss: 0.5663, test_loss: 0.7604, test_f1: 0.6467
 epoch: 29, train_loss: 0.5554, test_loss: 0.7277, test_f1: 0.6865
 epoch: 30, train_loss: 0.5437, test_loss: 0.8577, test_f1: 0.6476
 epoch: 31, train_loss: 0.5624, test_loss: 0.7553, test_f1: 0.6742
 epoch: 32, train_loss: 0.5458, test_loss: 0.9173, test_f1: 0.6352
 epoch: 33, train_loss: 0.5554, test_loss: 0.7725, test_f1: 0.6516
 epoch: 34, train_loss: 0.5270, test_loss: 0.8290, test_f1: 0.6585
 epoch: 35, train_loss: 0.5283, test_loss: 0.7747, test_f1: 0.6477
 epoch: 36, train_loss: 0.5107, test_loss: 0.7779, test_f1: 0.6655
 epoch: 37, train_loss: 0.4983, test_loss: 0.9313, test_f1: 0.6421
 epoch: 38, train_loss: 0.4995, test_loss: 0.8042, test_f1: 0.6604
 epoch: 39, train_loss: 0.4936, test_loss: 0.7925, test_f1: 0.6675
 epoch: 40, train_loss: 0.4892, test_loss: 0.8586, test_f1: 0.6379
 epoch: 41, train_loss: 0.4861, test_loss: 0.9197, test_f1: 0.6659
 epoch: 42, train_loss: 0.4848, test_loss: 0.7784, test_f1: 0.6825
 epoch: 43, train_loss: 0.4820, test_loss: 0.8696, test_f1: 0.6554
 epoch: 44, train_loss: 0.4677, test_loss: 0.9806, test_f1: 0.6621
 epoch: 45, train_loss: 0.4634, test_loss: 0.8986, test_f1: 0.6721
 epoch: 46, train_loss: 0.4467, test_loss: 0.9147, test_f1: 0.6305
 epoch: 47, train_loss: 0.4577, test_loss: 0.8950, test_f1: 0.6639
 epoch: 48, train_loss: 0.4826, test_loss: 0.9124, test_f1: 0.6486
 epoch: 49, train_loss: 0.4509, test_loss: 1.1026, test_f1: 0.6355
 epoch: 50, train_loss: 0.4532, test_loss: 0.9542, test_f1: 0.6726
 epoch: 51, train_loss: 0.4038, test_loss: 1.0068, test_f1: 0.6554
 epoch: 52, train_loss: 0.3840, test_loss: 1.0368, test_f1: 0.6594
 epoch: 53, train_loss: 0.3672, test_loss: 1.1184, test_f1: 0.6635
 epoch: 54, train_loss: 0.3580, test_loss: 1.1310, test_f1: 0.6710
 epoch: 55, train_loss: 0.3559, test_loss: 1.0784, test_f1: 0.6660
 epoch: 56, train_loss: 0.3618, test_loss: 1.0819, test_f1: 0.6676
 epoch: 57, train_loss: 0.3451, test_loss: 1.1017, test_f1: 0.6748
 epoch: 58, train_loss: 0.3602, test_loss: 1.1746, test_f1: 0.6741
 epoch: 59, train_loss: 0.3408, test_loss: 1.0485, test_f1: 0.6813
 epoch: 60, train_loss: 0.3466, test_loss: 1.2115, test_f1: 0.6604
 epoch: 61, train_loss: 0.3397, test_loss: 1.1802, test_f1: 0.6611
 epoch: 62, train_loss: 0.3355, test_loss: 1.2109, test_f1: 0.6746
 epoch: 63, train_loss: 0.3258, test_loss: 1.3273, test_f1: 0.6715
 epoch: 64, train_loss: 0.3284, test_loss: 1.2523, test_f1: 0.6658
 epoch: 65, train_loss: 0.3116, test_loss: 1.3806, test_f1: 0.6673
 epoch: 66, train_loss: 0.3243, test_loss: 1.2074, test_f1: 0.6602
 epoch: 67, train_loss: 0.3312, test_loss: 1.2297, test_f1: 0.6710
 epoch: 68, train_loss: 0.3316, test_loss: 1.2824, test_f1: 0.6689
 epoch: 69, train_loss: 0.3109, test_loss: 1.3226, test_f1: 0.6677
 epoch: 70, train_loss: 0.3085, test_loss: 1.3030, test_f1: 0.6657
 epoch: 71, train_loss: 0.3125, test_loss: 1.3742, test_f1: 0.6595
 epoch: 72, train_loss: 0.3021, test_loss: 1.4028, test_f1: 0.6634
 epoch: 73, train_loss: 0.3215, test_loss: 1.3233, test_f1: 0.6640
 epoch: 74, train_loss: 0.3017, test_loss: 1.4575, test_f1: 0.6687
 epoch: 75, train_loss: 0.2860, test_loss: 1.3749, test_f1: 0.6843
 epoch: 76, train_loss: 0.2837, test_loss: 1.4748, test_f1: 0.6647
 epoch: 77, train_loss: 0.3129, test_loss: 1.4058, test_f1: 0.6656
 epoch: 78, train_loss: 0.2707, test_loss: 1.5821, test_f1: 0.6664
 epoch: 79, train_loss: 0.2983, test_loss: 1.5010, test_f1: 0.6612
 epoch: 80, train_loss: 0.2580, test_loss: 1.5155, test_f1: 0.6699
 epoch: 81, train_loss: 0.2826, test_loss: 1.4278, test_f1: 0.6672
 epoch: 82, train_loss: 0.2610, test_loss: 1.4981, test_f1: 0.6581
 epoch: 83, train_loss: 0.2706, test_loss: 1.4878, test_f1: 0.6590
 epoch: 84, train_loss: 0.2657, test_loss: 1.5972, test_f1: 0.6540
 epoch: 85, train_loss: 0.2507, test_loss: 1.5825, test_f1: 0.6588
 epoch: 86, train_loss: 0.2793, test_loss: 1.5728, test_f1: 0.6485
 epoch: 87, train_loss: 0.2706, test_loss: 1.7100, test_f1: 0.6515
 epoch: 88, train_loss: 0.2516, test_loss: 1.6769, test_f1: 0.6610
 epoch: 89, train_loss: 0.2623, test_loss: 1.5958, test_f1: 0.6653
 epoch: 90, train_loss: 0.2423, test_loss: 1.7498, test_f1: 0.6465
 epoch: 91, train_loss: 0.2796, test_loss: 1.6617, test_f1: 0.6598
 epoch: 92, train_loss: 0.2597, test_loss: 1.6214, test_f1: 0.6595
 epoch: 93, train_loss: 0.2436, test_loss: 1.6473, test_f1: 0.6593
 epoch: 94, train_loss: 0.2657, test_loss: 1.5368, test_f1: 0.6739
 epoch: 95, train_loss: 0.2664, test_loss: 1.6390, test_f1: 0.6520
 epoch: 96, train_loss: 0.2499, test_loss: 1.6043, test_f1: 0.6854
 epoch: 97, train_loss: 0.2556, test_loss: 1.6484, test_f1: 0.6671
 epoch: 98, train_loss: 0.2525, test_loss: 1.7730, test_f1: 0.6604
 epoch: 99, train_loss: 0.2513, test_loss: 1.5990, test_f1: 0.6721
##################ITERATION #4 ****************************************
 epoch: 0, train_loss: 1.2449, test_loss: 1.1568, test_f1: 0.4369
 epoch: 1, train_loss: 1.0404, test_loss: 1.0389, test_f1: 0.5040
 epoch: 2, train_loss: 0.9776, test_loss: 0.9586, test_f1: 0.5054
 epoch: 3, train_loss: 0.9411, test_loss: 0.9216, test_f1: 0.5226
 epoch: 4, train_loss: 0.9286, test_loss: 0.9459, test_f1: 0.5541
 epoch: 5, train_loss: 0.8983, test_loss: 0.9089, test_f1: 0.5632
 epoch: 6, train_loss: 0.8639, test_loss: 0.9157, test_f1: 0.5846
 epoch: 7, train_loss: 0.8466, test_loss: 0.8347, test_f1: 0.6211
 epoch: 8, train_loss: 0.8336, test_loss: 0.9332, test_f1: 0.5235
 epoch: 9, train_loss: 0.8100, test_loss: 0.9707, test_f1: 0.6067
 epoch: 10, train_loss: 0.8009, test_loss: 0.8413, test_f1: 0.5913
 epoch: 11, train_loss: 0.7794, test_loss: 0.8744, test_f1: 0.5958
 epoch: 12, train_loss: 0.7750, test_loss: 0.8308, test_f1: 0.6124
 epoch: 13, train_loss: 0.7642, test_loss: 0.8319, test_f1: 0.5948
 epoch: 14, train_loss: 0.7512, test_loss: 0.8230, test_f1: 0.6209
 epoch: 15, train_loss: 0.7316, test_loss: 0.8432, test_f1: 0.6128
 epoch: 16, train_loss: 0.7198, test_loss: 0.8018, test_f1: 0.6328
 epoch: 17, train_loss: 0.6994, test_loss: 0.7687, test_f1: 0.6254
 epoch: 18, train_loss: 0.6723, test_loss: 0.8671, test_f1: 0.6299
 epoch: 19, train_loss: 0.6886, test_loss: 0.8200, test_f1: 0.6343
 epoch: 20, train_loss: 0.6783, test_loss: 0.7968, test_f1: 0.6381
 epoch: 21, train_loss: 0.6481, test_loss: 0.8774, test_f1: 0.6150
 epoch: 22, train_loss: 0.6263, test_loss: 0.8648, test_f1: 0.6391
 epoch: 23, train_loss: 0.6573, test_loss: 0.7963, test_f1: 0.6738
 epoch: 24, train_loss: 0.6204, test_loss: 0.8304, test_f1: 0.6369
 epoch: 25, train_loss: 0.6338, test_loss: 0.8361, test_f1: 0.6438
 epoch: 26, train_loss: 0.6216, test_loss: 0.8080, test_f1: 0.6446
 epoch: 27, train_loss: 0.5892, test_loss: 0.8349, test_f1: 0.6773
 epoch: 28, train_loss: 0.5903, test_loss: 0.8929, test_f1: 0.6377
 epoch: 29, train_loss: 0.6025, test_loss: 0.8356, test_f1: 0.6379
 epoch: 30, train_loss: 0.5631, test_loss: 0.7839, test_f1: 0.6581
 epoch: 31, train_loss: 0.6046, test_loss: 0.8268, test_f1: 0.6418
 epoch: 32, train_loss: 0.5723, test_loss: 0.8249, test_f1: 0.6731
 epoch: 33, train_loss: 0.5512, test_loss: 0.8876, test_f1: 0.6201
 epoch: 34, train_loss: 0.5522, test_loss: 0.9033, test_f1: 0.6296
 epoch: 35, train_loss: 0.5436, test_loss: 0.9639, test_f1: 0.6420
 epoch: 36, train_loss: 0.5299, test_loss: 0.9753, test_f1: 0.6528
 epoch: 37, train_loss: 0.5156, test_loss: 1.0398, test_f1: 0.6647
 epoch: 38, train_loss: 0.5208, test_loss: 0.8475, test_f1: 0.6357
 epoch: 39, train_loss: 0.5159, test_loss: 0.9503, test_f1: 0.6360
 epoch: 40, train_loss: 0.5032, test_loss: 0.8925, test_f1: 0.6691
 epoch: 41, train_loss: 0.5075, test_loss: 1.0203, test_f1: 0.6310
 epoch: 42, train_loss: 0.5003, test_loss: 0.8960, test_f1: 0.6867
 epoch: 43, train_loss: 0.4817, test_loss: 1.0939, test_f1: 0.6445
 epoch: 44, train_loss: 0.4852, test_loss: 1.0124, test_f1: 0.6588
 epoch: 45, train_loss: 0.4659, test_loss: 1.0963, test_f1: 0.6702
 epoch: 46, train_loss: 0.4698, test_loss: 1.1178, test_f1: 0.6516
 epoch: 47, train_loss: 0.4486, test_loss: 0.9994, test_f1: 0.6432
 epoch: 48, train_loss: 0.4473, test_loss: 1.1866, test_f1: 0.6403
 epoch: 49, train_loss: 0.4592, test_loss: 1.0836, test_f1: 0.6624
 epoch: 50, train_loss: 0.4635, test_loss: 1.1170, test_f1: 0.6541
 epoch: 51, train_loss: 0.4038, test_loss: 1.1737, test_f1: 0.6640
 epoch: 52, train_loss: 0.3878, test_loss: 1.1242, test_f1: 0.6915
 epoch: 53, train_loss: 0.3748, test_loss: 1.2214, test_f1: 0.6740
 epoch: 54, train_loss: 0.3730, test_loss: 1.2235, test_f1: 0.6714
 epoch: 55, train_loss: 0.3603, test_loss: 1.1889, test_f1: 0.6598
 epoch: 56, train_loss: 0.3600, test_loss: 1.1555, test_f1: 0.6832
 epoch: 57, train_loss: 0.3499, test_loss: 1.2345, test_f1: 0.6723
 epoch: 58, train_loss: 0.3624, test_loss: 1.3180, test_f1: 0.6585
 epoch: 59, train_loss: 0.3467, test_loss: 1.3524, test_f1: 0.6606
 epoch: 60, train_loss: 0.3483, test_loss: 1.3269, test_f1: 0.6643
 epoch: 61, train_loss: 0.3425, test_loss: 1.4529, test_f1: 0.6396
 epoch: 62, train_loss: 0.3353, test_loss: 1.3577, test_f1: 0.6691
 epoch: 63, train_loss: 0.3352, test_loss: 1.2242, test_f1: 0.6662
 epoch: 64, train_loss: 0.3314, test_loss: 1.4310, test_f1: 0.6603
 epoch: 65, train_loss: 0.3076, test_loss: 1.3534, test_f1: 0.6763
 epoch: 66, train_loss: 0.3301, test_loss: 1.4194, test_f1: 0.6492
 epoch: 67, train_loss: 0.3210, test_loss: 1.5454, test_f1: 0.6648
 epoch: 68, train_loss: 0.3375, test_loss: 1.4897, test_f1: 0.6573
 epoch: 69, train_loss: 0.3205, test_loss: 1.5268, test_f1: 0.6506
 epoch: 70, train_loss: 0.3147, test_loss: 1.5304, test_f1: 0.6610
 epoch: 71, train_loss: 0.3040, test_loss: 1.5424, test_f1: 0.6350
 epoch: 72, train_loss: 0.3167, test_loss: 1.4991, test_f1: 0.6633
 epoch: 73, train_loss: 0.3120, test_loss: 1.4961, test_f1: 0.6471
 epoch: 74, train_loss: 0.2992, test_loss: 1.5102, test_f1: 0.6668
 epoch: 75, train_loss: 0.3024, test_loss: 1.5125, test_f1: 0.6671
 epoch: 76, train_loss: 0.3041, test_loss: 1.4410, test_f1: 0.6778
 epoch: 77, train_loss: 0.2824, test_loss: 1.5903, test_f1: 0.6564
 epoch: 78, train_loss: 0.2764, test_loss: 1.6268, test_f1: 0.6518
 epoch: 79, train_loss: 0.2880, test_loss: 1.6498, test_f1: 0.6683
 epoch: 80, train_loss: 0.2797, test_loss: 1.8203, test_f1: 0.6494
 epoch: 81, train_loss: 0.2891, test_loss: 1.6811, test_f1: 0.6635
 epoch: 82, train_loss: 0.2656, test_loss: 1.7059, test_f1: 0.6623
 epoch: 83, train_loss: 0.2746, test_loss: 1.8585, test_f1: 0.6628
 epoch: 84, train_loss: 0.2676, test_loss: 1.7318, test_f1: 0.6662
 epoch: 85, train_loss: 0.2733, test_loss: 1.7106, test_f1: 0.6640
 epoch: 86, train_loss: 0.2585, test_loss: 1.6742, test_f1: 0.6661
 epoch: 87, train_loss: 0.2639, test_loss: 1.6577, test_f1: 0.6654
 epoch: 88, train_loss: 0.2662, test_loss: 1.7266, test_f1: 0.6499
 epoch: 89, train_loss: 0.2648, test_loss: 1.7933, test_f1: 0.6638
 epoch: 90, train_loss: 0.2327, test_loss: 1.8631, test_f1: 0.6657
 epoch: 91, train_loss: 0.2464, test_loss: 1.8209, test_f1: 0.6556
 epoch: 92, train_loss: 0.2465, test_loss: 1.8082, test_f1: 0.6455
 epoch: 93, train_loss: 0.2638, test_loss: 1.8589, test_f1: 0.6434
 epoch: 94, train_loss: 0.2399, test_loss: 1.9473, test_f1: 0.6547
 epoch: 95, train_loss: 0.2517, test_loss: 1.9079, test_f1: 0.6637
 epoch: 96, train_loss: 0.2598, test_loss: 1.8490, test_f1: 0.6589
 epoch: 97, train_loss: 0.2442, test_loss: 1.8206, test_f1: 0.6671
 epoch: 98, train_loss: 0.2166, test_loss: 1.8343, test_f1: 0.6704
 epoch: 99, train_loss: 0.2409, test_loss: 1.7901, test_f1: 0.6698
##################ITERATION #5 ****************************************
 epoch: 0, train_loss: 1.2735, test_loss: 1.5484, test_f1: 0.3189
 epoch: 1, train_loss: 1.0325, test_loss: 1.0132, test_f1: 0.5214
 epoch: 2, train_loss: 0.9737, test_loss: 0.9378, test_f1: 0.5416
 epoch: 3, train_loss: 0.9521, test_loss: 0.9193, test_f1: 0.5579
 epoch: 4, train_loss: 0.9338, test_loss: 0.8649, test_f1: 0.5445
 epoch: 5, train_loss: 0.9095, test_loss: 0.8879, test_f1: 0.5384
 epoch: 6, train_loss: 0.8708, test_loss: 0.8432, test_f1: 0.5894
 epoch: 7, train_loss: 0.8654, test_loss: 0.8015, test_f1: 0.6006
 epoch: 8, train_loss: 0.8524, test_loss: 0.8012, test_f1: 0.6432
 epoch: 9, train_loss: 0.8198, test_loss: 0.7820, test_f1: 0.6229
 epoch: 10, train_loss: 0.7934, test_loss: 0.8149, test_f1: 0.5874
 epoch: 11, train_loss: 0.7904, test_loss: 0.7875, test_f1: 0.5700
 epoch: 12, train_loss: 0.7906, test_loss: 0.7887, test_f1: 0.6183
 epoch: 13, train_loss: 0.7743, test_loss: 0.7973, test_f1: 0.6249
 epoch: 14, train_loss: 0.7614, test_loss: 0.7536, test_f1: 0.6049
 epoch: 15, train_loss: 0.7701, test_loss: 0.7628, test_f1: 0.6436
 epoch: 16, train_loss: 0.7411, test_loss: 0.7242, test_f1: 0.6711
 epoch: 17, train_loss: 0.7181, test_loss: 0.7391, test_f1: 0.6421
 epoch: 18, train_loss: 0.7116, test_loss: 0.7548, test_f1: 0.6650
 epoch: 19, train_loss: 0.7182, test_loss: 0.7776, test_f1: 0.6364
 epoch: 20, train_loss: 0.6949, test_loss: 0.7673, test_f1: 0.6481
 epoch: 21, train_loss: 0.6888, test_loss: 0.7077, test_f1: 0.6731
 epoch: 22, train_loss: 0.6829, test_loss: 0.8122, test_f1: 0.6131
 epoch: 23, train_loss: 0.6669, test_loss: 0.7422, test_f1: 0.6572
 epoch: 24, train_loss: 0.6501, test_loss: 0.7445, test_f1: 0.6785
 epoch: 25, train_loss: 0.6420, test_loss: 0.7944, test_f1: 0.6399
 epoch: 26, train_loss: 0.6286, test_loss: 0.7586, test_f1: 0.6424
 epoch: 27, train_loss: 0.6159, test_loss: 0.7663, test_f1: 0.6465
 epoch: 28, train_loss: 0.6347, test_loss: 0.6819, test_f1: 0.6793
 epoch: 29, train_loss: 0.6017, test_loss: 0.6906, test_f1: 0.6731
 epoch: 30, train_loss: 0.5804, test_loss: 0.7663, test_f1: 0.6708
 epoch: 31, train_loss: 0.5846, test_loss: 0.7619, test_f1: 0.7068
 epoch: 32, train_loss: 0.5829, test_loss: 0.6791, test_f1: 0.6820
 epoch: 33, train_loss: 0.5774, test_loss: 0.7436, test_f1: 0.6548
 epoch: 34, train_loss: 0.5944, test_loss: 0.7204, test_f1: 0.6742
 epoch: 35, train_loss: 0.5782, test_loss: 0.7362, test_f1: 0.6874
 epoch: 36, train_loss: 0.5447, test_loss: 0.7870, test_f1: 0.6783
 epoch: 37, train_loss: 0.5515, test_loss: 0.7258, test_f1: 0.7224
 epoch: 38, train_loss: 0.5288, test_loss: 0.8016, test_f1: 0.6611
 epoch: 39, train_loss: 0.5208, test_loss: 0.6925, test_f1: 0.7101
 epoch: 40, train_loss: 0.5236, test_loss: 0.7835, test_f1: 0.6733
 epoch: 41, train_loss: 0.5247, test_loss: 0.7277, test_f1: 0.6795
 epoch: 42, train_loss: 0.5024, test_loss: 0.7549, test_f1: 0.6804
 epoch: 43, train_loss: 0.5155, test_loss: 0.7358, test_f1: 0.6934
 epoch: 44, train_loss: 0.5132, test_loss: 0.8171, test_f1: 0.6948
 epoch: 45, train_loss: 0.5240, test_loss: 0.7932, test_f1: 0.6686
 epoch: 46, train_loss: 0.4782, test_loss: 0.8111, test_f1: 0.6776
 epoch: 47, train_loss: 0.5021, test_loss: 0.6775, test_f1: 0.7288
 epoch: 48, train_loss: 0.4837, test_loss: 0.7827, test_f1: 0.7075
 epoch: 49, train_loss: 0.4752, test_loss: 0.7445, test_f1: 0.7107
 epoch: 50, train_loss: 0.4588, test_loss: 0.8301, test_f1: 0.7050
 epoch: 51, train_loss: 0.4298, test_loss: 0.7918, test_f1: 0.6991
 epoch: 52, train_loss: 0.4056, test_loss: 0.8188, test_f1: 0.6824
 epoch: 53, train_loss: 0.3935, test_loss: 0.9497, test_f1: 0.6638
 epoch: 54, train_loss: 0.3849, test_loss: 0.8978, test_f1: 0.6684
 epoch: 55, train_loss: 0.3759, test_loss: 0.8651, test_f1: 0.6787
 epoch: 56, train_loss: 0.3864, test_loss: 0.8897, test_f1: 0.6705
 epoch: 57, train_loss: 0.3913, test_loss: 0.9084, test_f1: 0.6615
 epoch: 58, train_loss: 0.3666, test_loss: 0.8836, test_f1: 0.6772
 epoch: 59, train_loss: 0.3679, test_loss: 0.9255, test_f1: 0.6619
 epoch: 60, train_loss: 0.3935, test_loss: 0.8904, test_f1: 0.6786
 epoch: 61, train_loss: 0.3821, test_loss: 0.8429, test_f1: 0.6703
 epoch: 62, train_loss: 0.3578, test_loss: 0.9268, test_f1: 0.6795
 epoch: 63, train_loss: 0.3414, test_loss: 0.9379, test_f1: 0.6679
 epoch: 64, train_loss: 0.3463, test_loss: 0.9634, test_f1: 0.6775
 epoch: 65, train_loss: 0.3362, test_loss: 0.9541, test_f1: 0.7016
 epoch: 66, train_loss: 0.3499, test_loss: 0.9550, test_f1: 0.6933
 epoch: 67, train_loss: 0.3291, test_loss: 0.9349, test_f1: 0.6780
 epoch: 68, train_loss: 0.3422, test_loss: 1.0305, test_f1: 0.6715
 epoch: 69, train_loss: 0.3438, test_loss: 0.9291, test_f1: 0.6754
 epoch: 70, train_loss: 0.2976, test_loss: 0.9064, test_f1: 0.6901
 epoch: 71, train_loss: 0.3289, test_loss: 0.9539, test_f1: 0.6682
 epoch: 72, train_loss: 0.3342, test_loss: 1.0654, test_f1: 0.6851
 epoch: 73, train_loss: 0.3118, test_loss: 1.0195, test_f1: 0.6811
 epoch: 74, train_loss: 0.3108, test_loss: 1.1024, test_f1: 0.6701
 epoch: 75, train_loss: 0.3215, test_loss: 1.1327, test_f1: 0.6847
 epoch: 76, train_loss: 0.2982, test_loss: 1.0681, test_f1: 0.6757
 epoch: 77, train_loss: 0.3135, test_loss: 1.1205, test_f1: 0.6843
 epoch: 78, train_loss: 0.2988, test_loss: 1.0832, test_f1: 0.6706
 epoch: 79, train_loss: 0.3006, test_loss: 1.1141, test_f1: 0.6762
 epoch: 80, train_loss: 0.2948, test_loss: 1.1244, test_f1: 0.6806
 epoch: 81, train_loss: 0.2997, test_loss: 1.1620, test_f1: 0.6800
 epoch: 82, train_loss: 0.2994, test_loss: 1.0798, test_f1: 0.6729
 epoch: 83, train_loss: 0.2859, test_loss: 1.0452, test_f1: 0.6735
 epoch: 84, train_loss: 0.3130, test_loss: 1.2096, test_f1: 0.6787
 epoch: 85, train_loss: 0.2702, test_loss: 1.1456, test_f1: 0.6899
 epoch: 86, train_loss: 0.2919, test_loss: 1.1038, test_f1: 0.6858
 epoch: 87, train_loss: 0.2777, test_loss: 1.1427, test_f1: 0.6855
 epoch: 88, train_loss: 0.2707, test_loss: 1.1075, test_f1: 0.6857
 epoch: 89, train_loss: 0.2727, test_loss: 1.2871, test_f1: 0.6754
 epoch: 90, train_loss: 0.2683, test_loss: 1.1475, test_f1: 0.6788
 epoch: 91, train_loss: 0.2493, test_loss: 1.1599, test_f1: 0.6622
 epoch: 92, train_loss: 0.2797, test_loss: 1.2826, test_f1: 0.6937
 epoch: 93, train_loss: 0.2611, test_loss: 1.2388, test_f1: 0.6827
 epoch: 94, train_loss: 0.2693, test_loss: 1.2038, test_f1: 0.6791
 epoch: 95, train_loss: 0.2736, test_loss: 1.2763, test_f1: 0.6673
 epoch: 96, train_loss: 0.2727, test_loss: 1.1017, test_f1: 0.6923
 epoch: 97, train_loss: 0.2421, test_loss: 1.3217, test_f1: 0.6783
 epoch: 98, train_loss: 0.2762, test_loss: 1.3540, test_f1: 0.6605
 epoch: 99, train_loss: 0.2446, test_loss: 1.3145, test_f1: 0.6817
##################ITERATION #6 ****************************************
 epoch: 0, train_loss: 1.3172, test_loss: 1.1036, test_f1: 0.3665
 epoch: 1, train_loss: 1.0103, test_loss: 0.9449, test_f1: 0.4838
 epoch: 2, train_loss: 0.9740, test_loss: 0.9190, test_f1: 0.5319
 epoch: 3, train_loss: 0.9432, test_loss: 0.9278, test_f1: 0.5015
 epoch: 4, train_loss: 0.9153, test_loss: 0.9041, test_f1: 0.5612
 epoch: 5, train_loss: 0.9039, test_loss: 0.9044, test_f1: 0.5583
 epoch: 6, train_loss: 0.8867, test_loss: 0.8413, test_f1: 0.5706
 epoch: 7, train_loss: 0.8582, test_loss: 0.8516, test_f1: 0.5712
 epoch: 8, train_loss: 0.8522, test_loss: 0.8346, test_f1: 0.5547
 epoch: 9, train_loss: 0.8207, test_loss: 0.8257, test_f1: 0.5534
 epoch: 10, train_loss: 0.8226, test_loss: 0.9297, test_f1: 0.5184
 epoch: 11, train_loss: 0.8064, test_loss: 0.8236, test_f1: 0.5939
 epoch: 12, train_loss: 0.7939, test_loss: 0.8307, test_f1: 0.6183
 epoch: 13, train_loss: 0.7873, test_loss: 0.8407, test_f1: 0.5665
 epoch: 14, train_loss: 0.7663, test_loss: 0.7770, test_f1: 0.6016
 epoch: 15, train_loss: 0.7531, test_loss: 0.7611, test_f1: 0.6458
 epoch: 16, train_loss: 0.7283, test_loss: 0.7851, test_f1: 0.6657
 epoch: 17, train_loss: 0.7388, test_loss: 0.7490, test_f1: 0.6365
 epoch: 18, train_loss: 0.7166, test_loss: 0.7695, test_f1: 0.6202
 epoch: 19, train_loss: 0.7085, test_loss: 0.7576, test_f1: 0.6539
 epoch: 20, train_loss: 0.6842, test_loss: 0.7392, test_f1: 0.6232
 epoch: 21, train_loss: 0.6958, test_loss: 0.7214, test_f1: 0.6456
 epoch: 22, train_loss: 0.6696, test_loss: 0.7096, test_f1: 0.6510
 epoch: 23, train_loss: 0.6638, test_loss: 0.7346, test_f1: 0.6582
 epoch: 24, train_loss: 0.6613, test_loss: 0.7582, test_f1: 0.6286
 epoch: 25, train_loss: 0.6430, test_loss: 0.7458, test_f1: 0.6615
 epoch: 26, train_loss: 0.6400, test_loss: 0.7550, test_f1: 0.6616
 epoch: 27, train_loss: 0.6310, test_loss: 0.7648, test_f1: 0.6369
 epoch: 28, train_loss: 0.6196, test_loss: 0.7954, test_f1: 0.6399
 epoch: 29, train_loss: 0.6031, test_loss: 0.8005, test_f1: 0.6262
 epoch: 30, train_loss: 0.6001, test_loss: 0.8019, test_f1: 0.6530
 epoch: 31, train_loss: 0.6088, test_loss: 0.8078, test_f1: 0.6294
 epoch: 32, train_loss: 0.5980, test_loss: 0.8333, test_f1: 0.6443
 epoch: 33, train_loss: 0.5961, test_loss: 0.7493, test_f1: 0.6571
 epoch: 34, train_loss: 0.5900, test_loss: 0.8315, test_f1: 0.6413
 epoch: 35, train_loss: 0.5767, test_loss: 0.7785, test_f1: 0.6690
 epoch: 36, train_loss: 0.5827, test_loss: 0.7066, test_f1: 0.6703
 epoch: 37, train_loss: 0.5575, test_loss: 0.8259, test_f1: 0.6727
 epoch: 38, train_loss: 0.5525, test_loss: 0.7490, test_f1: 0.6645
 epoch: 39, train_loss: 0.5630, test_loss: 0.7402, test_f1: 0.6848
 epoch: 40, train_loss: 0.5673, test_loss: 0.7676, test_f1: 0.6795
 epoch: 41, train_loss: 0.5490, test_loss: 0.7985, test_f1: 0.6449
 epoch: 42, train_loss: 0.5400, test_loss: 0.7873, test_f1: 0.6761
 epoch: 43, train_loss: 0.5301, test_loss: 0.7988, test_f1: 0.6627
 epoch: 44, train_loss: 0.5296, test_loss: 0.7878, test_f1: 0.6673
 epoch: 45, train_loss: 0.5168, test_loss: 0.7590, test_f1: 0.6818
 epoch: 46, train_loss: 0.5250, test_loss: 0.8615, test_f1: 0.6522
 epoch: 47, train_loss: 0.5032, test_loss: 0.7747, test_f1: 0.6650
 epoch: 48, train_loss: 0.5012, test_loss: 0.8666, test_f1: 0.6872
 epoch: 49, train_loss: 0.4811, test_loss: 0.8768, test_f1: 0.6709
 epoch: 50, train_loss: 0.5067, test_loss: 0.8854, test_f1: 0.6567
 epoch: 51, train_loss: 0.4473, test_loss: 0.8069, test_f1: 0.6850
 epoch: 52, train_loss: 0.4343, test_loss: 0.8655, test_f1: 0.6739
 epoch: 53, train_loss: 0.4206, test_loss: 0.8313, test_f1: 0.6838
 epoch: 54, train_loss: 0.4025, test_loss: 0.8785, test_f1: 0.6642
 epoch: 55, train_loss: 0.3953, test_loss: 0.8850, test_f1: 0.6597
 epoch: 56, train_loss: 0.4018, test_loss: 0.9224, test_f1: 0.6496
 epoch: 57, train_loss: 0.4108, test_loss: 0.9095, test_f1: 0.6541
 epoch: 58, train_loss: 0.4018, test_loss: 0.8835, test_f1: 0.6698
 epoch: 59, train_loss: 0.3934, test_loss: 0.8994, test_f1: 0.6947
 epoch: 60, train_loss: 0.3982, test_loss: 0.9549, test_f1: 0.6836
 epoch: 61, train_loss: 0.3803, test_loss: 0.9333, test_f1: 0.6779
 epoch: 62, train_loss: 0.3903, test_loss: 0.9106, test_f1: 0.6691
 epoch: 63, train_loss: 0.3845, test_loss: 0.9621, test_f1: 0.6665
 epoch: 64, train_loss: 0.3729, test_loss: 0.9670, test_f1: 0.6858
 epoch: 65, train_loss: 0.3673, test_loss: 0.9521, test_f1: 0.6716
 epoch: 66, train_loss: 0.3669, test_loss: 0.9894, test_f1: 0.6657
 epoch: 67, train_loss: 0.3764, test_loss: 0.9783, test_f1: 0.6959
 epoch: 68, train_loss: 0.3579, test_loss: 1.0088, test_f1: 0.6752
 epoch: 69, train_loss: 0.3533, test_loss: 0.9876, test_f1: 0.6779
 epoch: 70, train_loss: 0.3472, test_loss: 1.0117, test_f1: 0.6765
 epoch: 71, train_loss: 0.3546, test_loss: 0.9786, test_f1: 0.6881
 epoch: 72, train_loss: 0.3403, test_loss: 0.8970, test_f1: 0.6809
 epoch: 73, train_loss: 0.3498, test_loss: 0.8880, test_f1: 0.6791
 epoch: 74, train_loss: 0.3444, test_loss: 0.9843, test_f1: 0.6895
 epoch: 75, train_loss: 0.3511, test_loss: 0.9913, test_f1: 0.7002
 epoch: 76, train_loss: 0.3367, test_loss: 0.9787, test_f1: 0.6812
 epoch: 77, train_loss: 0.3351, test_loss: 0.9971, test_f1: 0.6878
 epoch: 78, train_loss: 0.3286, test_loss: 0.9955, test_f1: 0.6784
 epoch: 79, train_loss: 0.3132, test_loss: 1.1605, test_f1: 0.6664
 epoch: 80, train_loss: 0.3213, test_loss: 1.1948, test_f1: 0.6646
 epoch: 81, train_loss: 0.3303, test_loss: 1.1206, test_f1: 0.6642
 epoch: 82, train_loss: 0.3223, test_loss: 1.1481, test_f1: 0.6595
 epoch: 83, train_loss: 0.3310, test_loss: 1.0799, test_f1: 0.6620
 epoch: 84, train_loss: 0.3180, test_loss: 1.1165, test_f1: 0.6680
 epoch: 85, train_loss: 0.3122, test_loss: 1.1383, test_f1: 0.6626
 epoch: 86, train_loss: 0.3081, test_loss: 1.0126, test_f1: 0.6787
 epoch: 87, train_loss: 0.3102, test_loss: 1.1083, test_f1: 0.6857
 epoch: 88, train_loss: 0.2908, test_loss: 1.0690, test_f1: 0.6861
 epoch: 89, train_loss: 0.3074, test_loss: 1.0665, test_f1: 0.6995
 epoch: 90, train_loss: 0.2920, test_loss: 1.1518, test_f1: 0.6726
 epoch: 91, train_loss: 0.2964, test_loss: 1.1518, test_f1: 0.6744
 epoch: 92, train_loss: 0.2851, test_loss: 1.1784, test_f1: 0.6679
 epoch: 93, train_loss: 0.2979, test_loss: 1.1274, test_f1: 0.6834
 epoch: 94, train_loss: 0.2841, test_loss: 1.1617, test_f1: 0.6629
 epoch: 95, train_loss: 0.2784, test_loss: 1.1062, test_f1: 0.6825
 epoch: 96, train_loss: 0.3006, test_loss: 1.1815, test_f1: 0.6669
 epoch: 97, train_loss: 0.2978, test_loss: 1.1135, test_f1: 0.6854
 epoch: 98, train_loss: 0.2765, test_loss: 1.3603, test_f1: 0.6644
 epoch: 99, train_loss: 0.2841, test_loss: 1.2157, test_f1: 0.6452
##################ITERATION #7 ****************************************
 epoch: 0, train_loss: 1.3990, test_loss: 1.1148, test_f1: 0.3696
 epoch: 1, train_loss: 1.0203, test_loss: 0.9661, test_f1: 0.5109
 epoch: 2, train_loss: 0.9758, test_loss: 0.9072, test_f1: 0.4946
 epoch: 3, train_loss: 0.9366, test_loss: 0.9111, test_f1: 0.5060
 epoch: 4, train_loss: 0.9235, test_loss: 0.9310, test_f1: 0.5523
 epoch: 5, train_loss: 0.9030, test_loss: 0.8333, test_f1: 0.5628
 epoch: 6, train_loss: 0.9024, test_loss: 0.9050, test_f1: 0.5817
 epoch: 7, train_loss: 0.8887, test_loss: 0.8925, test_f1: 0.5567
 epoch: 8, train_loss: 0.8643, test_loss: 0.9179, test_f1: 0.5295
 epoch: 9, train_loss: 0.8537, test_loss: 0.8277, test_f1: 0.5541
 epoch: 10, train_loss: 0.8277, test_loss: 0.8951, test_f1: 0.5480
 epoch: 11, train_loss: 0.8022, test_loss: 0.8294, test_f1: 0.5753
 epoch: 12, train_loss: 0.8066, test_loss: 0.7806, test_f1: 0.6404
 epoch: 13, train_loss: 0.7772, test_loss: 0.8294, test_f1: 0.5545
 epoch: 14, train_loss: 0.7855, test_loss: 0.8089, test_f1: 0.6252
 epoch: 15, train_loss: 0.7689, test_loss: 0.7369, test_f1: 0.6242
 epoch: 16, train_loss: 0.7412, test_loss: 0.8331, test_f1: 0.5876
 epoch: 17, train_loss: 0.7468, test_loss: 0.7620, test_f1: 0.6177
 epoch: 18, train_loss: 0.7142, test_loss: 0.7484, test_f1: 0.6299
 epoch: 19, train_loss: 0.7179, test_loss: 0.8323, test_f1: 0.6163
 epoch: 20, train_loss: 0.6933, test_loss: 0.7617, test_f1: 0.6513
 epoch: 21, train_loss: 0.6866, test_loss: 0.7860, test_f1: 0.6149
 epoch: 22, train_loss: 0.6868, test_loss: 0.7204, test_f1: 0.6586
 epoch: 23, train_loss: 0.6812, test_loss: 0.7428, test_f1: 0.6630
 epoch: 24, train_loss: 0.6735, test_loss: 0.7626, test_f1: 0.6251
 epoch: 25, train_loss: 0.6557, test_loss: 0.7701, test_f1: 0.6395
 epoch: 26, train_loss: 0.6354, test_loss: 0.8495, test_f1: 0.6350
 epoch: 27, train_loss: 0.6322, test_loss: 0.7646, test_f1: 0.6557
 epoch: 28, train_loss: 0.6284, test_loss: 0.7981, test_f1: 0.6390
 epoch: 29, train_loss: 0.6228, test_loss: 0.7715, test_f1: 0.6614
 epoch: 30, train_loss: 0.6331, test_loss: 0.6918, test_f1: 0.6789
 epoch: 31, train_loss: 0.5961, test_loss: 0.7903, test_f1: 0.6807
 epoch: 32, train_loss: 0.5997, test_loss: 0.7903, test_f1: 0.6344
 epoch: 33, train_loss: 0.5883, test_loss: 0.7831, test_f1: 0.6631
 epoch: 34, train_loss: 0.5839, test_loss: 0.7622, test_f1: 0.6497
 epoch: 35, train_loss: 0.5786, test_loss: 0.7170, test_f1: 0.6768
 epoch: 36, train_loss: 0.5812, test_loss: 0.7773, test_f1: 0.6539
 epoch: 37, train_loss: 0.5828, test_loss: 0.8498, test_f1: 0.6296
 epoch: 38, train_loss: 0.5524, test_loss: 0.8351, test_f1: 0.6778
 epoch: 39, train_loss: 0.5680, test_loss: 0.8209, test_f1: 0.6557
 epoch: 40, train_loss: 0.5591, test_loss: 0.7536, test_f1: 0.6591
 epoch: 41, train_loss: 0.5331, test_loss: 0.7833, test_f1: 0.6699
 epoch: 42, train_loss: 0.5394, test_loss: 0.8182, test_f1: 0.6551
 epoch: 43, train_loss: 0.5419, test_loss: 0.8083, test_f1: 0.6591
 epoch: 44, train_loss: 0.5375, test_loss: 0.7891, test_f1: 0.6963
 epoch: 45, train_loss: 0.5285, test_loss: 0.7920, test_f1: 0.6540
 epoch: 46, train_loss: 0.5197, test_loss: 0.8394, test_f1: 0.6772
 epoch: 47, train_loss: 0.4997, test_loss: 0.9785, test_f1: 0.6519
 epoch: 48, train_loss: 0.4890, test_loss: 0.8417, test_f1: 0.6594
 epoch: 49, train_loss: 0.5262, test_loss: 0.8937, test_f1: 0.6549
 epoch: 50, train_loss: 0.5057, test_loss: 0.8289, test_f1: 0.6376
 epoch: 51, train_loss: 0.4650, test_loss: 0.9302, test_f1: 0.6585
 epoch: 52, train_loss: 0.4389, test_loss: 0.8859, test_f1: 0.6723
 epoch: 53, train_loss: 0.4388, test_loss: 0.9022, test_f1: 0.6592
 epoch: 54, train_loss: 0.4020, test_loss: 0.8753, test_f1: 0.6657
 epoch: 55, train_loss: 0.4103, test_loss: 0.9260, test_f1: 0.6832
 epoch: 56, train_loss: 0.3952, test_loss: 0.9461, test_f1: 0.6790
 epoch: 57, train_loss: 0.3974, test_loss: 0.9428, test_f1: 0.6662
 epoch: 58, train_loss: 0.3895, test_loss: 1.0111, test_f1: 0.6650
 epoch: 59, train_loss: 0.3958, test_loss: 1.0171, test_f1: 0.6657
 epoch: 60, train_loss: 0.3962, test_loss: 1.1118, test_f1: 0.6421
 epoch: 61, train_loss: 0.3815, test_loss: 1.0340, test_f1: 0.6675
 epoch: 62, train_loss: 0.3914, test_loss: 1.0626, test_f1: 0.6621
 epoch: 63, train_loss: 0.4063, test_loss: 0.9482, test_f1: 0.6688
 epoch: 64, train_loss: 0.3690, test_loss: 1.0655, test_f1: 0.6802
 epoch: 65, train_loss: 0.3704, test_loss: 1.1285, test_f1: 0.6660
 epoch: 66, train_loss: 0.3580, test_loss: 0.9971, test_f1: 0.6573
 epoch: 67, train_loss: 0.3681, test_loss: 1.1003, test_f1: 0.6660
 epoch: 68, train_loss: 0.3689, test_loss: 1.1154, test_f1: 0.6676
 epoch: 69, train_loss: 0.3482, test_loss: 1.1943, test_f1: 0.6510
 epoch: 70, train_loss: 0.3618, test_loss: 1.2631, test_f1: 0.6585
 epoch: 71, train_loss: 0.3585, test_loss: 1.1654, test_f1: 0.6621
 epoch: 72, train_loss: 0.3591, test_loss: 1.1613, test_f1: 0.6796
 epoch: 73, train_loss: 0.3533, test_loss: 1.2271, test_f1: 0.6651
 epoch: 74, train_loss: 0.3617, test_loss: 1.2295, test_f1: 0.6688
 epoch: 75, train_loss: 0.3332, test_loss: 1.1887, test_f1: 0.6723
 epoch: 76, train_loss: 0.3233, test_loss: 1.2500, test_f1: 0.6643
 epoch: 77, train_loss: 0.3431, test_loss: 1.2878, test_f1: 0.6274
 epoch: 78, train_loss: 0.3434, test_loss: 1.2264, test_f1: 0.6647
 epoch: 79, train_loss: 0.3313, test_loss: 1.2231, test_f1: 0.6675
 epoch: 80, train_loss: 0.3454, test_loss: 1.3448, test_f1: 0.6653
 epoch: 81, train_loss: 0.3342, test_loss: 1.1914, test_f1: 0.6624
 epoch: 82, train_loss: 0.3295, test_loss: 1.2428, test_f1: 0.6689
 epoch: 83, train_loss: 0.3349, test_loss: 1.2637, test_f1: 0.6666
 epoch: 84, train_loss: 0.3291, test_loss: 1.2049, test_f1: 0.6559
 epoch: 85, train_loss: 0.3123, test_loss: 1.2568, test_f1: 0.6803
 epoch: 86, train_loss: 0.3079, test_loss: 1.1880, test_f1: 0.6775
 epoch: 87, train_loss: 0.2803, test_loss: 1.2184, test_f1: 0.6899
 epoch: 88, train_loss: 0.3145, test_loss: 1.2366, test_f1: 0.6671
 epoch: 89, train_loss: 0.3246, test_loss: 1.1691, test_f1: 0.6688
 epoch: 90, train_loss: 0.2967, test_loss: 1.3180, test_f1: 0.6943
 epoch: 91, train_loss: 0.3172, test_loss: 1.2258, test_f1: 0.6732
 epoch: 92, train_loss: 0.2947, test_loss: 1.2628, test_f1: 0.6616
 epoch: 93, train_loss: 0.3006, test_loss: 1.3631, test_f1: 0.6695
 epoch: 94, train_loss: 0.2944, test_loss: 1.2219, test_f1: 0.6788
 epoch: 95, train_loss: 0.2881, test_loss: 1.2737, test_f1: 0.6833
 epoch: 96, train_loss: 0.2931, test_loss: 1.3162, test_f1: 0.6785
 epoch: 97, train_loss: 0.2742, test_loss: 1.3012, test_f1: 0.6606
 epoch: 98, train_loss: 0.2884, test_loss: 1.2823, test_f1: 0.6608
 epoch: 99, train_loss: 0.2802, test_loss: 1.4532, test_f1: 0.6705
##################ITERATION #8 ****************************************
 epoch: 0, train_loss: 1.2501, test_loss: 1.0516, test_f1: 0.4631
 epoch: 1, train_loss: 1.0093, test_loss: 0.9634, test_f1: 0.5292
 epoch: 2, train_loss: 0.9512, test_loss: 0.9580, test_f1: 0.5479
 epoch: 3, train_loss: 0.9322, test_loss: 0.9109, test_f1: 0.5570
 epoch: 4, train_loss: 0.9105, test_loss: 0.8877, test_f1: 0.5455
 epoch: 5, train_loss: 0.8834, test_loss: 0.8727, test_f1: 0.5951
 epoch: 6, train_loss: 0.8710, test_loss: 0.8518, test_f1: 0.5550
 epoch: 7, train_loss: 0.8580, test_loss: 0.7921, test_f1: 0.6519
 epoch: 8, train_loss: 0.8220, test_loss: 0.7925, test_f1: 0.5868
 epoch: 9, train_loss: 0.8095, test_loss: 0.8104, test_f1: 0.5747
 epoch: 10, train_loss: 0.8053, test_loss: 0.8069, test_f1: 0.5623
 epoch: 11, train_loss: 0.7853, test_loss: 0.8514, test_f1: 0.5576
 epoch: 12, train_loss: 0.7650, test_loss: 0.8013, test_f1: 0.6078
 epoch: 13, train_loss: 0.7566, test_loss: 0.7740, test_f1: 0.6032
 epoch: 14, train_loss: 0.7627, test_loss: 0.7833, test_f1: 0.5969
 epoch: 15, train_loss: 0.7399, test_loss: 0.7180, test_f1: 0.6604
 epoch: 16, train_loss: 0.7252, test_loss: 0.7484, test_f1: 0.6429
 epoch: 17, train_loss: 0.7027, test_loss: 0.7314, test_f1: 0.6302
 epoch: 18, train_loss: 0.7087, test_loss: 0.7443, test_f1: 0.6533
 epoch: 19, train_loss: 0.6855, test_loss: 0.7523, test_f1: 0.6362
 epoch: 20, train_loss: 0.6950, test_loss: 0.6877, test_f1: 0.6876
 epoch: 21, train_loss: 0.6925, test_loss: 0.7524, test_f1: 0.6170
 epoch: 22, train_loss: 0.6629, test_loss: 0.7670, test_f1: 0.6535
 epoch: 23, train_loss: 0.6530, test_loss: 0.6827, test_f1: 0.6651
 epoch: 24, train_loss: 0.6663, test_loss: 0.7232, test_f1: 0.6742
 epoch: 25, train_loss: 0.6597, test_loss: 0.7522, test_f1: 0.6400
 epoch: 26, train_loss: 0.6338, test_loss: 0.7207, test_f1: 0.6779
 epoch: 27, train_loss: 0.6480, test_loss: 0.7127, test_f1: 0.6836
 epoch: 28, train_loss: 0.6109, test_loss: 0.7256, test_f1: 0.6823
 epoch: 29, train_loss: 0.6048, test_loss: 0.6898, test_f1: 0.6780
 epoch: 30, train_loss: 0.5978, test_loss: 0.7547, test_f1: 0.6647
 epoch: 31, train_loss: 0.6135, test_loss: 0.7658, test_f1: 0.6710
 epoch: 32, train_loss: 0.5981, test_loss: 0.7274, test_f1: 0.6790
 epoch: 33, train_loss: 0.6161, test_loss: 0.7122, test_f1: 0.6957
 epoch: 34, train_loss: 0.5923, test_loss: 0.7123, test_f1: 0.6811
 epoch: 35, train_loss: 0.5852, test_loss: 0.7600, test_f1: 0.6694
 epoch: 36, train_loss: 0.5592, test_loss: 0.7947, test_f1: 0.6779
 epoch: 37, train_loss: 0.5574, test_loss: 0.7868, test_f1: 0.6810
 epoch: 38, train_loss: 0.5574, test_loss: 0.7364, test_f1: 0.7161
 epoch: 39, train_loss: 0.5574, test_loss: 0.7589, test_f1: 0.6897
 epoch: 40, train_loss: 0.5501, test_loss: 0.7356, test_f1: 0.6893
 epoch: 41, train_loss: 0.5394, test_loss: 0.8157, test_f1: 0.6659
 epoch: 42, train_loss: 0.5353, test_loss: 0.7672, test_f1: 0.6854
 epoch: 43, train_loss: 0.5380, test_loss: 0.8177, test_f1: 0.6877
 epoch: 44, train_loss: 0.5253, test_loss: 0.7216, test_f1: 0.6798
 epoch: 45, train_loss: 0.5363, test_loss: 0.8128, test_f1: 0.6914
 epoch: 46, train_loss: 0.5313, test_loss: 0.8970, test_f1: 0.6639
 epoch: 47, train_loss: 0.5068, test_loss: 0.7749, test_f1: 0.7175
 epoch: 48, train_loss: 0.5308, test_loss: 0.8065, test_f1: 0.7029
 epoch: 49, train_loss: 0.5209, test_loss: 0.8287, test_f1: 0.6982
 epoch: 50, train_loss: 0.4951, test_loss: 0.8429, test_f1: 0.6700
 epoch: 51, train_loss: 0.4421, test_loss: 0.8134, test_f1: 0.7013
 epoch: 52, train_loss: 0.4282, test_loss: 0.8669, test_f1: 0.6903
 epoch: 53, train_loss: 0.4135, test_loss: 0.8564, test_f1: 0.6984
 epoch: 54, train_loss: 0.4250, test_loss: 0.8212, test_f1: 0.6898
 epoch: 55, train_loss: 0.4046, test_loss: 0.8614, test_f1: 0.6849
 epoch: 56, train_loss: 0.3986, test_loss: 0.8773, test_f1: 0.7278
 epoch: 57, train_loss: 0.3993, test_loss: 0.8319, test_f1: 0.7041
 epoch: 58, train_loss: 0.3892, test_loss: 0.8341, test_f1: 0.7067
 epoch: 59, train_loss: 0.4037, test_loss: 0.8741, test_f1: 0.7026
 epoch: 60, train_loss: 0.3880, test_loss: 0.9249, test_f1: 0.6826
 epoch: 61, train_loss: 0.3851, test_loss: 0.9910, test_f1: 0.6972
 epoch: 62, train_loss: 0.3948, test_loss: 0.9218, test_f1: 0.7082
 epoch: 63, train_loss: 0.3982, test_loss: 0.8906, test_f1: 0.6953
 epoch: 64, train_loss: 0.3657, test_loss: 0.9839, test_f1: 0.7002
 epoch: 65, train_loss: 0.3691, test_loss: 0.9303, test_f1: 0.6954
 epoch: 66, train_loss: 0.3744, test_loss: 0.9466, test_f1: 0.6977
 epoch: 67, train_loss: 0.3788, test_loss: 0.9752, test_f1: 0.6734
 epoch: 68, train_loss: 0.3586, test_loss: 0.9299, test_f1: 0.7059
 epoch: 69, train_loss: 0.3615, test_loss: 1.0344, test_f1: 0.7076
 epoch: 70, train_loss: 0.3551, test_loss: 0.9261, test_f1: 0.6884
 epoch: 71, train_loss: 0.3569, test_loss: 1.0213, test_f1: 0.7010
 epoch: 72, train_loss: 0.3620, test_loss: 0.9411, test_f1: 0.7039
 epoch: 73, train_loss: 0.3415, test_loss: 0.9876, test_f1: 0.7019
 epoch: 74, train_loss: 0.3352, test_loss: 1.0504, test_f1: 0.7031
 epoch: 75, train_loss: 0.3306, test_loss: 1.0223, test_f1: 0.6959
 epoch: 76, train_loss: 0.3413, test_loss: 1.1611, test_f1: 0.6865
 epoch: 77, train_loss: 0.3352, test_loss: 1.0544, test_f1: 0.6918
 epoch: 78, train_loss: 0.3398, test_loss: 1.1150, test_f1: 0.6875
 epoch: 79, train_loss: 0.3318, test_loss: 1.0703, test_f1: 0.6867
 epoch: 80, train_loss: 0.3170, test_loss: 1.1328, test_f1: 0.6995
 epoch: 81, train_loss: 0.3253, test_loss: 1.0118, test_f1: 0.6867
 epoch: 82, train_loss: 0.3183, test_loss: 1.0937, test_f1: 0.6802
 epoch: 83, train_loss: 0.3108, test_loss: 1.1977, test_f1: 0.6870
 epoch: 84, train_loss: 0.3183, test_loss: 1.0941, test_f1: 0.6754
 epoch: 85, train_loss: 0.3086, test_loss: 1.1401, test_f1: 0.6713
 epoch: 86, train_loss: 0.3078, test_loss: 1.1164, test_f1: 0.6959
 epoch: 87, train_loss: 0.3099, test_loss: 1.2375, test_f1: 0.7002
 epoch: 88, train_loss: 0.2945, test_loss: 1.1125, test_f1: 0.6907
 epoch: 89, train_loss: 0.2851, test_loss: 1.2173, test_f1: 0.6836
 epoch: 90, train_loss: 0.3122, test_loss: 1.1681, test_f1: 0.6941
 epoch: 91, train_loss: 0.2935, test_loss: 1.1291, test_f1: 0.7093
 epoch: 92, train_loss: 0.3033, test_loss: 1.2544, test_f1: 0.6880
 epoch: 93, train_loss: 0.2962, test_loss: 1.3112, test_f1: 0.6683
 epoch: 94, train_loss: 0.2939, test_loss: 1.2568, test_f1: 0.6833
 epoch: 95, train_loss: 0.2657, test_loss: 1.3282, test_f1: 0.6768
 epoch: 96, train_loss: 0.2810, test_loss: 1.2370, test_f1: 0.7043
 epoch: 97, train_loss: 0.2967, test_loss: 1.3818, test_f1: 0.6862
 epoch: 98, train_loss: 0.2852, test_loss: 1.3279, test_f1: 0.6865
 epoch: 99, train_loss: 0.2725, test_loss: 1.4507, test_f1: 0.6627
##################ITERATION #9 ****************************************
 epoch: 0, train_loss: 1.3734, test_loss: 1.5231, test_f1: 0.3213
 epoch: 1, train_loss: 1.0326, test_loss: 0.9944, test_f1: 0.4849
 epoch: 2, train_loss: 0.9849, test_loss: 0.9133, test_f1: 0.5035
 epoch: 3, train_loss: 0.9503, test_loss: 0.9275, test_f1: 0.5356
 epoch: 4, train_loss: 0.9249, test_loss: 0.8949, test_f1: 0.5004
 epoch: 5, train_loss: 0.9100, test_loss: 0.9106, test_f1: 0.5767
 epoch: 6, train_loss: 0.8937, test_loss: 0.8467, test_f1: 0.5328
 epoch: 7, train_loss: 0.8737, test_loss: 0.8367, test_f1: 0.5432
 epoch: 8, train_loss: 0.8450, test_loss: 0.8285, test_f1: 0.5476
 epoch: 9, train_loss: 0.8622, test_loss: 0.8434, test_f1: 0.5749
 epoch: 10, train_loss: 0.8241, test_loss: 0.8791, test_f1: 0.5719
 epoch: 11, train_loss: 0.8169, test_loss: 0.8446, test_f1: 0.5853
 epoch: 12, train_loss: 0.7951, test_loss: 0.8288, test_f1: 0.6090
 epoch: 13, train_loss: 0.7842, test_loss: 0.8014, test_f1: 0.5799
 epoch: 14, train_loss: 0.7703, test_loss: 0.7510, test_f1: 0.6368
 epoch: 15, train_loss: 0.7674, test_loss: 0.7984, test_f1: 0.6186
 epoch: 16, train_loss: 0.7614, test_loss: 0.8200, test_f1: 0.6091
 epoch: 17, train_loss: 0.7401, test_loss: 0.8914, test_f1: 0.5669
 epoch: 18, train_loss: 0.7259, test_loss: 0.7410, test_f1: 0.6525
 epoch: 19, train_loss: 0.7289, test_loss: 0.7451, test_f1: 0.6620
 epoch: 20, train_loss: 0.7079, test_loss: 0.7750, test_f1: 0.6266
 epoch: 21, train_loss: 0.6916, test_loss: 0.8361, test_f1: 0.6051
 epoch: 22, train_loss: 0.6787, test_loss: 0.7228, test_f1: 0.6437
 epoch: 23, train_loss: 0.6802, test_loss: 0.7593, test_f1: 0.6533
 epoch: 24, train_loss: 0.6741, test_loss: 0.7923, test_f1: 0.6247
 epoch: 25, train_loss: 0.6478, test_loss: 0.7836, test_f1: 0.6381
 epoch: 26, train_loss: 0.6484, test_loss: 0.8417, test_f1: 0.6297
 epoch: 27, train_loss: 0.6477, test_loss: 0.8480, test_f1: 0.6250
 epoch: 28, train_loss: 0.6272, test_loss: 0.7535, test_f1: 0.6354
 epoch: 29, train_loss: 0.6505, test_loss: 0.9464, test_f1: 0.6053
 epoch: 30, train_loss: 0.6052, test_loss: 0.8359, test_f1: 0.6531
 epoch: 31, train_loss: 0.6097, test_loss: 0.7931, test_f1: 0.6543
 epoch: 32, train_loss: 0.5990, test_loss: 0.8017, test_f1: 0.6311
 epoch: 33, train_loss: 0.5974, test_loss: 0.7515, test_f1: 0.6313
 epoch: 34, train_loss: 0.5986, test_loss: 0.7828, test_f1: 0.6789
 epoch: 35, train_loss: 0.5792, test_loss: 0.8302, test_f1: 0.6764
 epoch: 36, train_loss: 0.5707, test_loss: 0.8287, test_f1: 0.6300
 epoch: 37, train_loss: 0.5710, test_loss: 0.8553, test_f1: 0.6412
 epoch: 38, train_loss: 0.5735, test_loss: 0.9078, test_f1: 0.6552
 epoch: 39, train_loss: 0.5413, test_loss: 0.7547, test_f1: 0.6621
 epoch: 40, train_loss: 0.5332, test_loss: 0.7861, test_f1: 0.6726
 epoch: 41, train_loss: 0.5442, test_loss: 0.7876, test_f1: 0.6579
 epoch: 42, train_loss: 0.5324, test_loss: 0.7797, test_f1: 0.6663
 epoch: 43, train_loss: 0.5090, test_loss: 0.9393, test_f1: 0.6446
 epoch: 44, train_loss: 0.5416, test_loss: 0.8202, test_f1: 0.6940
 epoch: 45, train_loss: 0.5052, test_loss: 0.7933, test_f1: 0.6744
 epoch: 46, train_loss: 0.4929, test_loss: 0.8518, test_f1: 0.6424
 epoch: 47, train_loss: 0.5258, test_loss: 0.8144, test_f1: 0.6640
 epoch: 48, train_loss: 0.4846, test_loss: 0.8406, test_f1: 0.6759
 epoch: 49, train_loss: 0.4914, test_loss: 0.8548, test_f1: 0.6390
 epoch: 50, train_loss: 0.4901, test_loss: 0.8349, test_f1: 0.6412
 epoch: 51, train_loss: 0.4581, test_loss: 0.8416, test_f1: 0.6742
 epoch: 52, train_loss: 0.4277, test_loss: 0.8082, test_f1: 0.6995
 epoch: 53, train_loss: 0.4179, test_loss: 0.9398, test_f1: 0.6701
 epoch: 54, train_loss: 0.4083, test_loss: 0.8924, test_f1: 0.6681
 epoch: 55, train_loss: 0.3982, test_loss: 0.9029, test_f1: 0.6792
 epoch: 56, train_loss: 0.3887, test_loss: 0.9585, test_f1: 0.6678
 epoch: 57, train_loss: 0.4012, test_loss: 0.9052, test_f1: 0.6621
 epoch: 58, train_loss: 0.4052, test_loss: 0.9306, test_f1: 0.6622
 epoch: 59, train_loss: 0.3846, test_loss: 0.8897, test_f1: 0.6797
 epoch: 60, train_loss: 0.3681, test_loss: 0.9683, test_f1: 0.6640
 epoch: 61, train_loss: 0.3717, test_loss: 1.0382, test_f1: 0.6559
 epoch: 62, train_loss: 0.3818, test_loss: 1.1148, test_f1: 0.6562
 epoch: 63, train_loss: 0.3896, test_loss: 1.0720, test_f1: 0.6682
 epoch: 64, train_loss: 0.3579, test_loss: 1.0780, test_f1: 0.6391
 epoch: 65, train_loss: 0.3592, test_loss: 0.9469, test_f1: 0.6615
 epoch: 66, train_loss: 0.3666, test_loss: 1.0281, test_f1: 0.6735
 epoch: 67, train_loss: 0.3418, test_loss: 1.0058, test_f1: 0.6869
 epoch: 68, train_loss: 0.3672, test_loss: 1.1299, test_f1: 0.6723
 epoch: 69, train_loss: 0.3670, test_loss: 1.1753, test_f1: 0.6426
 epoch: 70, train_loss: 0.3400, test_loss: 1.0598, test_f1: 0.6719
 epoch: 71, train_loss: 0.3203, test_loss: 1.0490, test_f1: 0.6646
 epoch: 72, train_loss: 0.3262, test_loss: 1.1340, test_f1: 0.6579
 epoch: 73, train_loss: 0.3379, test_loss: 1.1759, test_f1: 0.6650
 epoch: 74, train_loss: 0.3386, test_loss: 1.0468, test_f1: 0.6635
 epoch: 75, train_loss: 0.3420, test_loss: 1.1298, test_f1: 0.6616
 epoch: 76, train_loss: 0.3186, test_loss: 1.2039, test_f1: 0.6436
 epoch: 77, train_loss: 0.3368, test_loss: 1.1573, test_f1: 0.6508
 epoch: 78, train_loss: 0.3166, test_loss: 1.1519, test_f1: 0.6775
 epoch: 79, train_loss: 0.3416, test_loss: 1.1581, test_f1: 0.6599
 epoch: 80, train_loss: 0.3274, test_loss: 1.2694, test_f1: 0.6505
 epoch: 81, train_loss: 0.3108, test_loss: 1.1777, test_f1: 0.6654
 epoch: 82, train_loss: 0.3163, test_loss: 1.2310, test_f1: 0.6737
 epoch: 83, train_loss: 0.3255, test_loss: 1.1500, test_f1: 0.7029
 epoch: 84, train_loss: 0.3015, test_loss: 1.1052, test_f1: 0.6693
 epoch: 85, train_loss: 0.3103, test_loss: 1.2691, test_f1: 0.6492
 epoch: 86, train_loss: 0.3110, test_loss: 1.1239, test_f1: 0.6519
 epoch: 87, train_loss: 0.3058, test_loss: 1.2579, test_f1: 0.6626
 epoch: 88, train_loss: 0.3211, test_loss: 1.2583, test_f1: 0.6510
 epoch: 89, train_loss: 0.3094, test_loss: 1.2870, test_f1: 0.6618
 epoch: 90, train_loss: 0.2914, test_loss: 1.2365, test_f1: 0.6659
 epoch: 91, train_loss: 0.2855, test_loss: 1.2344, test_f1: 0.6711
 epoch: 92, train_loss: 0.2836, test_loss: 1.3334, test_f1: 0.6468
 epoch: 93, train_loss: 0.3189, test_loss: 1.2523, test_f1: 0.6571
 epoch: 94, train_loss: 0.2855, test_loss: 1.2650, test_f1: 0.6580
 epoch: 95, train_loss: 0.2809, test_loss: 1.2864, test_f1: 0.6640
 epoch: 96, train_loss: 0.2730, test_loss: 1.3784, test_f1: 0.6634
 epoch: 97, train_loss: 0.2759, test_loss: 1.2895, test_f1: 0.6642
 epoch: 98, train_loss: 0.2708, test_loss: 1.3654, test_f1: 0.6337
 epoch: 99, train_loss: 0.2717, test_loss: 1.2486, test_f1: 0.6740

Training completed in 895.22 seconds
Best F1: 0.7288 at epoch 47
Mean F1 across iterations: 0.7031  0.0139
========================FINAL RESULTS================================
FEGIN weighted F1: 0.7288  0.0139
python main.py --data ltspice_examples --representation component_pin_net --model FEGIN --layers 6 --hiddens 64 --batch_size 64 --lr 0.001 --emb_size 512 --epochs 100 --save_appendix component_pin_net_L6_H64_BS64_LR0.001_E512 --no_val
-----



STDERR:
  File "main.py", line 370, in <module>
    main()
  File "main.py", line 254, in main
    dataset = dataset_class(
  File "/home/philip/projects/ltspice_examples_code_repo/Circuit-Completion-Using-GNNs/component_classification_with_link_prediction_head/evaluation/FEGIN/kernel/circuit_datasets.py", line 15, in __init__
    self.data, self.slices = torch.load(self.processed_paths[0])
  File "/home/philip/.local/lib/python3.8/site-packages/torch/serialization.py", line 1040, in load
    warnings.warn(
  File "/usr/lib/python3.8/warnings.py", line 109, in _showwarnmsg
    sw(msg.message, msg.category, msg.filename, msg.lineno,
  File "main.py", line 47, in warn_with_traceback
    traceback.print_stack(file=log)
/home/philip/projects/ltspice_examples_code_repo/Circuit-Completion-Using-GNNs/component_classification_with_link_prediction_head/evaluation/FEGIN/kernel/circuit_datasets.py:15: FutureWarning: You are using `torch.load` with `weights_only=False` (the current default value), which uses the default pickle module implicitly. It is possible to construct malicious pickle data which will execute arbitrary code during unpickling (See https://github.com/pytorch/pytorch/blob/main/SECURITY.md#untrusted-models for more details). In a future release, the default value for `weights_only` will be flipped to `True`. This limits the functions that could be executed during unpickling. Arbitrary objects will no longer be allowed to be loaded via this mode unless they are explicitly allowlisted by the user via `torch.serialization.add_safe_globals`. We recommend you start setting `weights_only=True` for any use case where you don't have full control of the loaded file. Please open an issue on GitHub for any issues related to this experimental feature.
  self.data, self.slices = torch.load(self.processed_paths[0])
