STDOUT:
Results will be saved in /home/philip/projects/ltspice_examples_code_repo/Circuit-Completion-Using-GNNs/component_classification_with_link_prediction_head/evaluation/FEGIN/results/model_FEGIN_dataset_ltspice_examples
Command line input: python main.py --data ltspice_examples --representation component_pin_net --model FEGIN --layers 2 --hiddens 64 --batch_size 256 --lr 0.01 --emb_size 128 --epochs 100 --save_appendix component_pin_net_L2_H64_BS256_LR0.01_E128 --no_val
 is saved.
-----
ltspice_examples - FEGIN
Using 2 layers, 64 hidden units, h = 2
Loading component_pin_net representation dataset
ENTERED
Training FEGIN on component_pin_net representation
Train: 3558, Test: 846
##################ITERATION #0 ****************************************
 epoch: 0, train_loss: 1.2068, test_loss: 1.4540, test_f1: 0.2270
 epoch: 1, train_loss: 1.0092, test_loss: 1.4320, test_f1: 0.2528
 epoch: 2, train_loss: 0.9755, test_loss: 1.1210, test_f1: 0.4113
 epoch: 3, train_loss: 0.9622, test_loss: 0.9550, test_f1: 0.4723
 epoch: 4, train_loss: 0.9359, test_loss: 1.0084, test_f1: 0.4722
 epoch: 5, train_loss: 0.9339, test_loss: 1.0257, test_f1: 0.4732
 epoch: 6, train_loss: 0.9154, test_loss: 0.9116, test_f1: 0.5169
 epoch: 7, train_loss: 0.8986, test_loss: 1.0649, test_f1: 0.5279
 epoch: 8, train_loss: 0.8610, test_loss: 0.9818, test_f1: 0.4705
 epoch: 9, train_loss: 0.8546, test_loss: 0.8860, test_f1: 0.5122
 epoch: 10, train_loss: 0.8326, test_loss: 0.9571, test_f1: 0.5633
 epoch: 11, train_loss: 0.8306, test_loss: 0.8844, test_f1: 0.6069
 epoch: 12, train_loss: 0.8108, test_loss: 0.9756, test_f1: 0.5469
 epoch: 13, train_loss: 0.7883, test_loss: 0.8262, test_f1: 0.5883
 epoch: 14, train_loss: 0.7851, test_loss: 0.8365, test_f1: 0.6067
 epoch: 15, train_loss: 0.7615, test_loss: 0.8778, test_f1: 0.6006
 epoch: 16, train_loss: 0.7470, test_loss: 0.8658, test_f1: 0.5886
 epoch: 17, train_loss: 0.7476, test_loss: 1.0602, test_f1: 0.5143
 epoch: 18, train_loss: 0.7258, test_loss: 0.8460, test_f1: 0.6650
 epoch: 19, train_loss: 0.7135, test_loss: 1.0407, test_f1: 0.5429
 epoch: 20, train_loss: 0.7198, test_loss: 0.8373, test_f1: 0.6457
 epoch: 21, train_loss: 0.6864, test_loss: 0.9557, test_f1: 0.6304
 epoch: 22, train_loss: 0.6774, test_loss: 1.1700, test_f1: 0.5210
 epoch: 23, train_loss: 0.6791, test_loss: 0.8209, test_f1: 0.6495
 epoch: 24, train_loss: 0.6749, test_loss: 1.0197, test_f1: 0.5640
 epoch: 25, train_loss: 0.6391, test_loss: 1.1488, test_f1: 0.5673
 epoch: 26, train_loss: 0.6459, test_loss: 1.0067, test_f1: 0.6242
 epoch: 27, train_loss: 0.6225, test_loss: 0.8565, test_f1: 0.6386
 epoch: 28, train_loss: 0.6419, test_loss: 1.1093, test_f1: 0.5507
 epoch: 29, train_loss: 0.6445, test_loss: 1.0598, test_f1: 0.5895
 epoch: 30, train_loss: 0.6320, test_loss: 1.0254, test_f1: 0.5636
 epoch: 31, train_loss: 0.6092, test_loss: 1.2753, test_f1: 0.5820
 epoch: 32, train_loss: 0.5780, test_loss: 0.9549, test_f1: 0.6487
 epoch: 33, train_loss: 0.5898, test_loss: 0.9603, test_f1: 0.6496
 epoch: 34, train_loss: 0.5842, test_loss: 1.0352, test_f1: 0.6199
 epoch: 35, train_loss: 0.5770, test_loss: 0.9060, test_f1: 0.6666
 epoch: 36, train_loss: 0.5455, test_loss: 1.0609, test_f1: 0.6253
 epoch: 37, train_loss: 0.5533, test_loss: 1.0274, test_f1: 0.6563
 epoch: 38, train_loss: 0.5265, test_loss: 1.0809, test_f1: 0.6443
 epoch: 39, train_loss: 0.5349, test_loss: 1.0526, test_f1: 0.6462
 epoch: 40, train_loss: 0.5411, test_loss: 0.9640, test_f1: 0.6549
 epoch: 41, train_loss: 0.5050, test_loss: 1.1328, test_f1: 0.6234
 epoch: 42, train_loss: 0.5201, test_loss: 0.9875, test_f1: 0.6475
 epoch: 43, train_loss: 0.5029, test_loss: 1.0770, test_f1: 0.6404
 epoch: 44, train_loss: 0.4921, test_loss: 1.1191, test_f1: 0.6557
 epoch: 45, train_loss: 0.4943, test_loss: 0.9375, test_f1: 0.7025
 epoch: 46, train_loss: 0.4900, test_loss: 1.1220, test_f1: 0.6741
 epoch: 47, train_loss: 0.5181, test_loss: 1.1049, test_f1: 0.5995
 epoch: 48, train_loss: 0.5076, test_loss: 1.0352, test_f1: 0.6525
 epoch: 49, train_loss: 0.4886, test_loss: 1.0203, test_f1: 0.6442
 epoch: 50, train_loss: 0.4681, test_loss: 1.1160, test_f1: 0.5958
 epoch: 51, train_loss: 0.4574, test_loss: 1.1422, test_f1: 0.6804
 epoch: 52, train_loss: 0.4103, test_loss: 1.1044, test_f1: 0.6683
 epoch: 53, train_loss: 0.3902, test_loss: 1.1790, test_f1: 0.6609
 epoch: 54, train_loss: 0.3864, test_loss: 1.1422, test_f1: 0.6678
 epoch: 55, train_loss: 0.3835, test_loss: 1.1488, test_f1: 0.6778
 epoch: 56, train_loss: 0.3714, test_loss: 1.1800, test_f1: 0.6691
 epoch: 57, train_loss: 0.3927, test_loss: 1.3176, test_f1: 0.6389
 epoch: 58, train_loss: 0.3694, test_loss: 1.2449, test_f1: 0.6766
 epoch: 59, train_loss: 0.3694, test_loss: 1.4117, test_f1: 0.6268
 epoch: 60, train_loss: 0.3614, test_loss: 1.3267, test_f1: 0.6587
 epoch: 61, train_loss: 0.3646, test_loss: 1.3475, test_f1: 0.6547
 epoch: 62, train_loss: 0.3602, test_loss: 1.2221, test_f1: 0.6674
 epoch: 63, train_loss: 0.3532, test_loss: 1.2324, test_f1: 0.6595
 epoch: 64, train_loss: 0.3452, test_loss: 1.4194, test_f1: 0.6524
 epoch: 65, train_loss: 0.3502, test_loss: 1.3780, test_f1: 0.6664
 epoch: 66, train_loss: 0.3462, test_loss: 1.3001, test_f1: 0.6486
 epoch: 67, train_loss: 0.3414, test_loss: 1.2997, test_f1: 0.6450
 epoch: 68, train_loss: 0.3258, test_loss: 1.4505, test_f1: 0.6217
 epoch: 69, train_loss: 0.3237, test_loss: 1.3806, test_f1: 0.6792
 epoch: 70, train_loss: 0.3448, test_loss: 1.4281, test_f1: 0.6538
 epoch: 71, train_loss: 0.3453, test_loss: 1.3317, test_f1: 0.6621
 epoch: 72, train_loss: 0.3352, test_loss: 1.3212, test_f1: 0.6642
 epoch: 73, train_loss: 0.3107, test_loss: 1.4196, test_f1: 0.6364
 epoch: 74, train_loss: 0.3140, test_loss: 1.4768, test_f1: 0.6569
 epoch: 75, train_loss: 0.2988, test_loss: 1.5157, test_f1: 0.6563
 epoch: 76, train_loss: 0.3241, test_loss: 1.4385, test_f1: 0.6476
 epoch: 77, train_loss: 0.3082, test_loss: 1.4465, test_f1: 0.6661
 epoch: 78, train_loss: 0.3012, test_loss: 1.4749, test_f1: 0.6624
 epoch: 79, train_loss: 0.2965, test_loss: 1.3995, test_f1: 0.6831
 epoch: 80, train_loss: 0.2999, test_loss: 1.3867, test_f1: 0.6830
 epoch: 81, train_loss: 0.3032, test_loss: 1.5115, test_f1: 0.6601
 epoch: 82, train_loss: 0.3050, test_loss: 1.5508, test_f1: 0.6211
 epoch: 83, train_loss: 0.3133, test_loss: 1.6056, test_f1: 0.6230
 epoch: 84, train_loss: 0.3204, test_loss: 1.6018, test_f1: 0.6428
 epoch: 85, train_loss: 0.3146, test_loss: 1.4649, test_f1: 0.6554
 epoch: 86, train_loss: 0.3225, test_loss: 1.5395, test_f1: 0.6408
 epoch: 87, train_loss: 0.3053, test_loss: 1.4816, test_f1: 0.6458
 epoch: 88, train_loss: 0.2974, test_loss: 1.4642, test_f1: 0.6608
 epoch: 89, train_loss: 0.2815, test_loss: 1.4794, test_f1: 0.6434
 epoch: 90, train_loss: 0.2868, test_loss: 1.3789, test_f1: 0.6491
 epoch: 91, train_loss: 0.2643, test_loss: 1.3294, test_f1: 0.6836
 epoch: 92, train_loss: 0.2885, test_loss: 1.6124, test_f1: 0.6400
 epoch: 93, train_loss: 0.2685, test_loss: 1.5558, test_f1: 0.6510
 epoch: 94, train_loss: 0.2714, test_loss: 1.6928, test_f1: 0.6328
 epoch: 95, train_loss: 0.2713, test_loss: 1.5550, test_f1: 0.6657
 epoch: 96, train_loss: 0.2685, test_loss: 1.5660, test_f1: 0.6527
 epoch: 97, train_loss: 0.2903, test_loss: 1.3700, test_f1: 0.6641
 epoch: 98, train_loss: 0.2868, test_loss: 1.4675, test_f1: 0.6635
 epoch: 99, train_loss: 0.2826, test_loss: 1.6961, test_f1: 0.6515
##################ITERATION #1 ****************************************
 epoch: 0, train_loss: 1.2353, test_loss: 1.4271, test_f1: 0.2270
 epoch: 1, train_loss: 0.9966, test_loss: 1.3060, test_f1: 0.2781
 epoch: 2, train_loss: 0.9636, test_loss: 1.0392, test_f1: 0.4189
 epoch: 3, train_loss: 0.9272, test_loss: 1.0695, test_f1: 0.4114
 epoch: 4, train_loss: 0.9031, test_loss: 0.9673, test_f1: 0.5317
 epoch: 5, train_loss: 0.8937, test_loss: 1.0357, test_f1: 0.5469
 epoch: 6, train_loss: 0.8790, test_loss: 0.9940, test_f1: 0.4995
 epoch: 7, train_loss: 0.8684, test_loss: 0.8687, test_f1: 0.5760
 epoch: 8, train_loss: 0.8336, test_loss: 0.8406, test_f1: 0.5494
 epoch: 9, train_loss: 0.8049, test_loss: 0.8584, test_f1: 0.5808
 epoch: 10, train_loss: 0.7960, test_loss: 0.8409, test_f1: 0.5933
 epoch: 11, train_loss: 0.7911, test_loss: 0.8690, test_f1: 0.5834
 epoch: 12, train_loss: 0.7661, test_loss: 1.2731, test_f1: 0.4226
 epoch: 13, train_loss: 0.7698, test_loss: 0.9215, test_f1: 0.5747
 epoch: 14, train_loss: 0.7538, test_loss: 0.9700, test_f1: 0.5875
 epoch: 15, train_loss: 0.7315, test_loss: 0.7718, test_f1: 0.6110
 epoch: 16, train_loss: 0.7150, test_loss: 0.9039, test_f1: 0.5885
 epoch: 17, train_loss: 0.7087, test_loss: 0.9316, test_f1: 0.5778
 epoch: 18, train_loss: 0.7012, test_loss: 0.9929, test_f1: 0.5187
 epoch: 19, train_loss: 0.6764, test_loss: 0.9267, test_f1: 0.6081
 epoch: 20, train_loss: 0.6642, test_loss: 0.9068, test_f1: 0.5889
 epoch: 21, train_loss: 0.6618, test_loss: 0.7990, test_f1: 0.6219
 epoch: 22, train_loss: 0.6773, test_loss: 1.0026, test_f1: 0.6107
 epoch: 23, train_loss: 0.6417, test_loss: 0.9265, test_f1: 0.6339
 epoch: 24, train_loss: 0.6533, test_loss: 0.9751, test_f1: 0.6196
 epoch: 25, train_loss: 0.6570, test_loss: 1.0263, test_f1: 0.6182
 epoch: 26, train_loss: 0.6322, test_loss: 1.2584, test_f1: 0.6098
 epoch: 27, train_loss: 0.6454, test_loss: 1.1666, test_f1: 0.5908
 epoch: 28, train_loss: 0.6177, test_loss: 0.9236, test_f1: 0.6259
 epoch: 29, train_loss: 0.5885, test_loss: 1.2964, test_f1: 0.5410
 epoch: 30, train_loss: 0.6070, test_loss: 0.9222, test_f1: 0.6086
 epoch: 31, train_loss: 0.5632, test_loss: 1.1299, test_f1: 0.6263
 epoch: 32, train_loss: 0.5786, test_loss: 1.1239, test_f1: 0.6310
 epoch: 33, train_loss: 0.5619, test_loss: 1.1885, test_f1: 0.5919
 epoch: 34, train_loss: 0.5566, test_loss: 1.0070, test_f1: 0.6540
 epoch: 35, train_loss: 0.5713, test_loss: 1.2013, test_f1: 0.5901
 epoch: 36, train_loss: 0.5626, test_loss: 1.0503, test_f1: 0.6412
 epoch: 37, train_loss: 0.5457, test_loss: 1.1241, test_f1: 0.6133
 epoch: 38, train_loss: 0.5467, test_loss: 1.0825, test_f1: 0.6419
 epoch: 39, train_loss: 0.5158, test_loss: 1.1786, test_f1: 0.6325
 epoch: 40, train_loss: 0.5108, test_loss: 1.3270, test_f1: 0.5676
 epoch: 41, train_loss: 0.5412, test_loss: 1.1331, test_f1: 0.6112
 epoch: 42, train_loss: 0.5262, test_loss: 1.2004, test_f1: 0.6221
 epoch: 43, train_loss: 0.5328, test_loss: 1.6999, test_f1: 0.5924
 epoch: 44, train_loss: 0.4964, test_loss: 1.3113, test_f1: 0.6279
 epoch: 45, train_loss: 0.4715, test_loss: 1.2245, test_f1: 0.6140
 epoch: 46, train_loss: 0.4954, test_loss: 1.1497, test_f1: 0.6480
 epoch: 47, train_loss: 0.5192, test_loss: 1.2557, test_f1: 0.5992
 epoch: 48, train_loss: 0.5058, test_loss: 1.2852, test_f1: 0.6261
 epoch: 49, train_loss: 0.4636, test_loss: 1.3332, test_f1: 0.6095
 epoch: 50, train_loss: 0.4626, test_loss: 1.2428, test_f1: 0.6056
 epoch: 51, train_loss: 0.4199, test_loss: 1.2520, test_f1: 0.6503
 epoch: 52, train_loss: 0.4040, test_loss: 1.3857, test_f1: 0.6491
 epoch: 53, train_loss: 0.4112, test_loss: 1.3067, test_f1: 0.6650
 epoch: 54, train_loss: 0.4072, test_loss: 1.3128, test_f1: 0.6466
 epoch: 55, train_loss: 0.3752, test_loss: 1.3067, test_f1: 0.6546
 epoch: 56, train_loss: 0.3556, test_loss: 1.3709, test_f1: 0.6636
 epoch: 57, train_loss: 0.3660, test_loss: 1.4257, test_f1: 0.6361
 epoch: 58, train_loss: 0.3544, test_loss: 1.4440, test_f1: 0.6448
 epoch: 59, train_loss: 0.3584, test_loss: 1.3816, test_f1: 0.6391
 epoch: 60, train_loss: 0.3346, test_loss: 1.5326, test_f1: 0.6185
 epoch: 61, train_loss: 0.3682, test_loss: 1.3354, test_f1: 0.6571
 epoch: 62, train_loss: 0.3418, test_loss: 1.5593, test_f1: 0.6380
 epoch: 63, train_loss: 0.3166, test_loss: 1.5111, test_f1: 0.6308
 epoch: 64, train_loss: 0.3443, test_loss: 1.4173, test_f1: 0.6279
 epoch: 65, train_loss: 0.3482, test_loss: 1.4412, test_f1: 0.6341
 epoch: 66, train_loss: 0.3322, test_loss: 1.5107, test_f1: 0.6337
 epoch: 67, train_loss: 0.3411, test_loss: 1.6148, test_f1: 0.6298
 epoch: 68, train_loss: 0.3147, test_loss: 1.5218, test_f1: 0.6399
 epoch: 69, train_loss: 0.3562, test_loss: 1.4590, test_f1: 0.6404
 epoch: 70, train_loss: 0.3322, test_loss: 1.3862, test_f1: 0.6484
 epoch: 71, train_loss: 0.3339, test_loss: 1.7129, test_f1: 0.6156
 epoch: 72, train_loss: 0.3146, test_loss: 1.5334, test_f1: 0.6198
 epoch: 73, train_loss: 0.3209, test_loss: 1.6242, test_f1: 0.6436
 epoch: 74, train_loss: 0.3033, test_loss: 1.6144, test_f1: 0.6499
 epoch: 75, train_loss: 0.3140, test_loss: 1.8104, test_f1: 0.6309
 epoch: 76, train_loss: 0.3262, test_loss: 2.1137, test_f1: 0.5862
 epoch: 77, train_loss: 0.3183, test_loss: 1.5781, test_f1: 0.6445
 epoch: 78, train_loss: 0.2948, test_loss: 1.7062, test_f1: 0.6277
 epoch: 79, train_loss: 0.3064, test_loss: 1.8892, test_f1: 0.5865
 epoch: 80, train_loss: 0.2993, test_loss: 1.6593, test_f1: 0.6481
 epoch: 81, train_loss: 0.2897, test_loss: 1.6082, test_f1: 0.6318
 epoch: 82, train_loss: 0.2710, test_loss: 1.7091, test_f1: 0.6318
 epoch: 83, train_loss: 0.3116, test_loss: 1.7728, test_f1: 0.6282
 epoch: 84, train_loss: 0.2908, test_loss: 1.7008, test_f1: 0.6117
 epoch: 85, train_loss: 0.3023, test_loss: 1.6372, test_f1: 0.6558
 epoch: 86, train_loss: 0.2897, test_loss: 1.7757, test_f1: 0.6262
 epoch: 87, train_loss: 0.2920, test_loss: 1.7881, test_f1: 0.6168
 epoch: 88, train_loss: 0.2917, test_loss: 1.5259, test_f1: 0.6507
 epoch: 89, train_loss: 0.2922, test_loss: 1.7877, test_f1: 0.6409
 epoch: 90, train_loss: 0.3055, test_loss: 1.6447, test_f1: 0.6405
 epoch: 91, train_loss: 0.3084, test_loss: 1.6668, test_f1: 0.6257
 epoch: 92, train_loss: 0.2902, test_loss: 1.5281, test_f1: 0.6336
 epoch: 93, train_loss: 0.2825, test_loss: 1.5920, test_f1: 0.6535
 epoch: 94, train_loss: 0.2553, test_loss: 1.7421, test_f1: 0.6232
 epoch: 95, train_loss: 0.2597, test_loss: 1.8129, test_f1: 0.6559
 epoch: 96, train_loss: 0.2887, test_loss: 1.6925, test_f1: 0.6350
 epoch: 97, train_loss: 0.2804, test_loss: 1.8946, test_f1: 0.6441
 epoch: 98, train_loss: 0.2805, test_loss: 1.7971, test_f1: 0.6322
 epoch: 99, train_loss: 0.2370, test_loss: 1.8396, test_f1: 0.6375
##################ITERATION #2 ****************************************
 epoch: 0, train_loss: 1.4591, test_loss: 1.2541, test_f1: 0.3358
 epoch: 1, train_loss: 1.0180, test_loss: 1.1478, test_f1: 0.3422
 epoch: 2, train_loss: 0.9742, test_loss: 0.9998, test_f1: 0.4236
 epoch: 3, train_loss: 0.9414, test_loss: 0.9581, test_f1: 0.4951
 epoch: 4, train_loss: 0.9363, test_loss: 0.9457, test_f1: 0.4892
 epoch: 5, train_loss: 0.9177, test_loss: 0.9016, test_f1: 0.5396
 epoch: 6, train_loss: 0.9013, test_loss: 0.9153, test_f1: 0.5036
 epoch: 7, train_loss: 0.8727, test_loss: 0.9386, test_f1: 0.5115
 epoch: 8, train_loss: 0.8719, test_loss: 0.9740, test_f1: 0.4722
 epoch: 9, train_loss: 0.8927, test_loss: 0.9344, test_f1: 0.5117
 epoch: 10, train_loss: 0.8524, test_loss: 0.9466, test_f1: 0.5148
 epoch: 11, train_loss: 0.8502, test_loss: 0.8698, test_f1: 0.5684
 epoch: 12, train_loss: 0.8107, test_loss: 1.0013, test_f1: 0.4901
 epoch: 13, train_loss: 0.8001, test_loss: 0.9415, test_f1: 0.5608
 epoch: 14, train_loss: 0.7820, test_loss: 0.9003, test_f1: 0.5016
 epoch: 15, train_loss: 0.7807, test_loss: 0.9612, test_f1: 0.5249
 epoch: 16, train_loss: 0.7857, test_loss: 0.8765, test_f1: 0.5877
 epoch: 17, train_loss: 0.7527, test_loss: 1.0167, test_f1: 0.5117
 epoch: 18, train_loss: 0.7661, test_loss: 0.9852, test_f1: 0.4971
 epoch: 19, train_loss: 0.7454, test_loss: 0.8490, test_f1: 0.5833
 epoch: 20, train_loss: 0.7434, test_loss: 1.2022, test_f1: 0.4794
 epoch: 21, train_loss: 0.7219, test_loss: 0.8136, test_f1: 0.5931
 epoch: 22, train_loss: 0.7192, test_loss: 0.8745, test_f1: 0.6068
 epoch: 23, train_loss: 0.7212, test_loss: 0.8475, test_f1: 0.6408
 epoch: 24, train_loss: 0.6855, test_loss: 0.8602, test_f1: 0.5909
 epoch: 25, train_loss: 0.6914, test_loss: 0.8760, test_f1: 0.6283
 epoch: 26, train_loss: 0.6845, test_loss: 1.0646, test_f1: 0.5224
 epoch: 27, train_loss: 0.6741, test_loss: 0.8101, test_f1: 0.5966
 epoch: 28, train_loss: 0.6678, test_loss: 1.1908, test_f1: 0.4902
 epoch: 29, train_loss: 0.6789, test_loss: 0.8044, test_f1: 0.6342
 epoch: 30, train_loss: 0.6682, test_loss: 0.9710, test_f1: 0.5984
 epoch: 31, train_loss: 0.6489, test_loss: 0.9467, test_f1: 0.6519
 epoch: 32, train_loss: 0.6247, test_loss: 0.9512, test_f1: 0.6015
 epoch: 33, train_loss: 0.6503, test_loss: 0.8799, test_f1: 0.5910
 epoch: 34, train_loss: 0.6515, test_loss: 0.9213, test_f1: 0.5908
 epoch: 35, train_loss: 0.6293, test_loss: 0.7736, test_f1: 0.6366
 epoch: 36, train_loss: 0.6241, test_loss: 0.9625, test_f1: 0.5951
 epoch: 37, train_loss: 0.6011, test_loss: 0.9086, test_f1: 0.6249
 epoch: 38, train_loss: 0.6044, test_loss: 0.8538, test_f1: 0.6541
 epoch: 39, train_loss: 0.5899, test_loss: 0.8561, test_f1: 0.6472
 epoch: 40, train_loss: 0.5992, test_loss: 0.8433, test_f1: 0.6388
 epoch: 41, train_loss: 0.5910, test_loss: 1.0316, test_f1: 0.5972
 epoch: 42, train_loss: 0.6166, test_loss: 0.9578, test_f1: 0.5931
 epoch: 43, train_loss: 0.6230, test_loss: 0.9515, test_f1: 0.6175
 epoch: 44, train_loss: 0.5702, test_loss: 0.9210, test_f1: 0.6165
 epoch: 45, train_loss: 0.5927, test_loss: 0.9577, test_f1: 0.6007
 epoch: 46, train_loss: 0.5757, test_loss: 0.9993, test_f1: 0.5804
 epoch: 47, train_loss: 0.5420, test_loss: 0.9906, test_f1: 0.6285
 epoch: 48, train_loss: 0.5588, test_loss: 0.8269, test_f1: 0.6470
 epoch: 49, train_loss: 0.5415, test_loss: 0.9396, test_f1: 0.6196
 epoch: 50, train_loss: 0.5781, test_loss: 0.8251, test_f1: 0.6366
 epoch: 51, train_loss: 0.5448, test_loss: 0.8246, test_f1: 0.6675
 epoch: 52, train_loss: 0.4945, test_loss: 0.8354, test_f1: 0.6424
 epoch: 53, train_loss: 0.4697, test_loss: 0.7986, test_f1: 0.6544
 epoch: 54, train_loss: 0.4640, test_loss: 0.9363, test_f1: 0.6582
 epoch: 55, train_loss: 0.4546, test_loss: 0.8793, test_f1: 0.6545
 epoch: 56, train_loss: 0.4571, test_loss: 0.8688, test_f1: 0.6393
 epoch: 57, train_loss: 0.4618, test_loss: 0.8662, test_f1: 0.6575
 epoch: 58, train_loss: 0.4488, test_loss: 0.9323, test_f1: 0.6443
 epoch: 59, train_loss: 0.4401, test_loss: 0.9047, test_f1: 0.6830
 epoch: 60, train_loss: 0.4390, test_loss: 1.0449, test_f1: 0.6637
 epoch: 61, train_loss: 0.4309, test_loss: 0.8952, test_f1: 0.6735
 epoch: 62, train_loss: 0.4240, test_loss: 1.1421, test_f1: 0.6536
 epoch: 63, train_loss: 0.4223, test_loss: 1.0540, test_f1: 0.6660
 epoch: 64, train_loss: 0.4377, test_loss: 1.0168, test_f1: 0.6576
 epoch: 65, train_loss: 0.4471, test_loss: 1.0732, test_f1: 0.5953
 epoch: 66, train_loss: 0.4324, test_loss: 1.0866, test_f1: 0.6505
 epoch: 67, train_loss: 0.4172, test_loss: 1.0679, test_f1: 0.6463
 epoch: 68, train_loss: 0.4192, test_loss: 1.0645, test_f1: 0.6709
 epoch: 69, train_loss: 0.4323, test_loss: 1.0188, test_f1: 0.6490
 epoch: 70, train_loss: 0.3906, test_loss: 1.1823, test_f1: 0.6336
 epoch: 71, train_loss: 0.3949, test_loss: 1.0038, test_f1: 0.6635
 epoch: 72, train_loss: 0.4139, test_loss: 1.1028, test_f1: 0.6636
 epoch: 73, train_loss: 0.4206, test_loss: 1.0691, test_f1: 0.6681
 epoch: 74, train_loss: 0.4181, test_loss: 1.0773, test_f1: 0.6363
 epoch: 75, train_loss: 0.4286, test_loss: 1.0865, test_f1: 0.6736
 epoch: 76, train_loss: 0.3925, test_loss: 1.0546, test_f1: 0.6634
 epoch: 77, train_loss: 0.4063, test_loss: 1.1508, test_f1: 0.6633
 epoch: 78, train_loss: 0.4245, test_loss: 1.3726, test_f1: 0.5898
 epoch: 79, train_loss: 0.4108, test_loss: 1.3761, test_f1: 0.5692
 epoch: 80, train_loss: 0.3867, test_loss: 1.0589, test_f1: 0.6559
 epoch: 81, train_loss: 0.4040, test_loss: 1.1681, test_f1: 0.6154
 epoch: 82, train_loss: 0.4142, test_loss: 1.2754, test_f1: 0.6462
 epoch: 83, train_loss: 0.3731, test_loss: 1.0645, test_f1: 0.6770
 epoch: 84, train_loss: 0.3762, test_loss: 1.2658, test_f1: 0.5964
 epoch: 85, train_loss: 0.3804, test_loss: 1.3038, test_f1: 0.6419
 epoch: 86, train_loss: 0.3928, test_loss: 1.0828, test_f1: 0.6597
 epoch: 87, train_loss: 0.3723, test_loss: 1.1410, test_f1: 0.6712
 epoch: 88, train_loss: 0.3489, test_loss: 1.0941, test_f1: 0.6750
 epoch: 89, train_loss: 0.3779, test_loss: 1.1051, test_f1: 0.6623
 epoch: 90, train_loss: 0.3517, test_loss: 1.2015, test_f1: 0.6674
 epoch: 91, train_loss: 0.3611, test_loss: 1.1660, test_f1: 0.6805
 epoch: 92, train_loss: 0.3485, test_loss: 1.1647, test_f1: 0.6523
 epoch: 93, train_loss: 0.3483, test_loss: 1.3808, test_f1: 0.6667
 epoch: 94, train_loss: 0.3603, test_loss: 1.1985, test_f1: 0.6639
 epoch: 95, train_loss: 0.3505, test_loss: 1.2427, test_f1: 0.6816
 epoch: 96, train_loss: 0.3422, test_loss: 1.2898, test_f1: 0.6730
 epoch: 97, train_loss: 0.3514, test_loss: 1.3233, test_f1: 0.6577
 epoch: 98, train_loss: 0.3349, test_loss: 1.3365, test_f1: 0.6709
 epoch: 99, train_loss: 0.3408, test_loss: 1.3003, test_f1: 0.6802
##################ITERATION #3 ****************************************
 epoch: 0, train_loss: 1.5666, test_loss: 1.3500, test_f1: 0.2270
 epoch: 1, train_loss: 1.0309, test_loss: 1.0500, test_f1: 0.3547
 epoch: 2, train_loss: 0.9821, test_loss: 1.0456, test_f1: 0.3795
 epoch: 3, train_loss: 0.9492, test_loss: 0.9796, test_f1: 0.4841
 epoch: 4, train_loss: 0.9158, test_loss: 0.8933, test_f1: 0.5591
 epoch: 5, train_loss: 0.8998, test_loss: 0.9344, test_f1: 0.4815
 epoch: 6, train_loss: 0.8903, test_loss: 0.9582, test_f1: 0.5079
 epoch: 7, train_loss: 0.8692, test_loss: 1.2220, test_f1: 0.4739
 epoch: 8, train_loss: 0.8479, test_loss: 0.8719, test_f1: 0.5652
 epoch: 9, train_loss: 0.8303, test_loss: 0.8555, test_f1: 0.5701
 epoch: 10, train_loss: 0.8064, test_loss: 0.7889, test_f1: 0.6381
 epoch: 11, train_loss: 0.7945, test_loss: 0.9720, test_f1: 0.5310
 epoch: 12, train_loss: 0.7733, test_loss: 0.8460, test_f1: 0.5806
 epoch: 13, train_loss: 0.7723, test_loss: 0.9180, test_f1: 0.5367
 epoch: 14, train_loss: 0.7664, test_loss: 0.7859, test_f1: 0.6151
 epoch: 15, train_loss: 0.7336, test_loss: 0.8782, test_f1: 0.6099
 epoch: 16, train_loss: 0.7284, test_loss: 0.8326, test_f1: 0.6018
 epoch: 17, train_loss: 0.7363, test_loss: 0.8744, test_f1: 0.5905
 epoch: 18, train_loss: 0.7174, test_loss: 0.8685, test_f1: 0.6176
 epoch: 19, train_loss: 0.7021, test_loss: 0.7999, test_f1: 0.6108
 epoch: 20, train_loss: 0.7075, test_loss: 0.9416, test_f1: 0.6168
 epoch: 21, train_loss: 0.6940, test_loss: 0.9209, test_f1: 0.6171
 epoch: 22, train_loss: 0.6897, test_loss: 1.0183, test_f1: 0.5581
 epoch: 23, train_loss: 0.6896, test_loss: 1.1784, test_f1: 0.5383
 epoch: 24, train_loss: 0.6729, test_loss: 0.8866, test_f1: 0.6218
 epoch: 25, train_loss: 0.6623, test_loss: 0.9161, test_f1: 0.5908
 epoch: 26, train_loss: 0.6514, test_loss: 0.8102, test_f1: 0.5904
 epoch: 27, train_loss: 0.6555, test_loss: 0.8606, test_f1: 0.6334
 epoch: 28, train_loss: 0.6364, test_loss: 0.8721, test_f1: 0.6212
 epoch: 29, train_loss: 0.6573, test_loss: 0.8875, test_f1: 0.6233
 epoch: 30, train_loss: 0.6303, test_loss: 0.9641, test_f1: 0.5630
 epoch: 31, train_loss: 0.6264, test_loss: 0.8815, test_f1: 0.6453
 epoch: 32, train_loss: 0.6320, test_loss: 0.9693, test_f1: 0.6040
 epoch: 33, train_loss: 0.6245, test_loss: 1.1379, test_f1: 0.5771
 epoch: 34, train_loss: 0.6173, test_loss: 1.1688, test_f1: 0.5871
 epoch: 35, train_loss: 0.5907, test_loss: 0.9265, test_f1: 0.6367
 epoch: 36, train_loss: 0.6027, test_loss: 0.9206, test_f1: 0.5880
 epoch: 37, train_loss: 0.6086, test_loss: 0.9389, test_f1: 0.6292
 epoch: 38, train_loss: 0.5941, test_loss: 1.2558, test_f1: 0.5422
 epoch: 39, train_loss: 0.5899, test_loss: 1.0096, test_f1: 0.6079
 epoch: 40, train_loss: 0.5676, test_loss: 0.8159, test_f1: 0.6414
 epoch: 41, train_loss: 0.5808, test_loss: 0.8781, test_f1: 0.6285
 epoch: 42, train_loss: 0.5506, test_loss: 0.9552, test_f1: 0.6398
 epoch: 43, train_loss: 0.5370, test_loss: 1.0526, test_f1: 0.6085
 epoch: 44, train_loss: 0.5518, test_loss: 0.8077, test_f1: 0.6340
 epoch: 45, train_loss: 0.5488, test_loss: 0.9588, test_f1: 0.6228
 epoch: 46, train_loss: 0.5417, test_loss: 1.0669, test_f1: 0.6059
 epoch: 47, train_loss: 0.5248, test_loss: 0.9074, test_f1: 0.6303
 epoch: 48, train_loss: 0.5487, test_loss: 0.8714, test_f1: 0.6173
 epoch: 49, train_loss: 0.5244, test_loss: 0.8813, test_f1: 0.6683
 epoch: 50, train_loss: 0.5157, test_loss: 1.0345, test_f1: 0.6084
 epoch: 51, train_loss: 0.5084, test_loss: 0.8132, test_f1: 0.6502
 epoch: 52, train_loss: 0.4699, test_loss: 0.8019, test_f1: 0.6488
 epoch: 53, train_loss: 0.4403, test_loss: 1.0258, test_f1: 0.6377
 epoch: 54, train_loss: 0.4544, test_loss: 0.9159, test_f1: 0.6310
 epoch: 55, train_loss: 0.4269, test_loss: 0.9736, test_f1: 0.6230
 epoch: 56, train_loss: 0.4371, test_loss: 0.9956, test_f1: 0.6283
 epoch: 57, train_loss: 0.4287, test_loss: 0.9044, test_f1: 0.6361
 epoch: 58, train_loss: 0.4265, test_loss: 0.9619, test_f1: 0.6331
 epoch: 59, train_loss: 0.4291, test_loss: 1.0191, test_f1: 0.6694
 epoch: 60, train_loss: 0.4296, test_loss: 0.9818, test_f1: 0.6564
 epoch: 61, train_loss: 0.4250, test_loss: 1.0116, test_f1: 0.6236
 epoch: 62, train_loss: 0.4326, test_loss: 1.0037, test_f1: 0.6302
 epoch: 63, train_loss: 0.4029, test_loss: 0.9037, test_f1: 0.6640
 epoch: 64, train_loss: 0.3997, test_loss: 1.0396, test_f1: 0.6541
 epoch: 65, train_loss: 0.3953, test_loss: 0.9858, test_f1: 0.6440
 epoch: 66, train_loss: 0.4312, test_loss: 0.9257, test_f1: 0.6716
 epoch: 67, train_loss: 0.4104, test_loss: 1.0429, test_f1: 0.6188
 epoch: 68, train_loss: 0.4126, test_loss: 1.0381, test_f1: 0.6576
 epoch: 69, train_loss: 0.3838, test_loss: 0.9879, test_f1: 0.6410
 epoch: 70, train_loss: 0.3913, test_loss: 1.1010, test_f1: 0.6512
 epoch: 71, train_loss: 0.3812, test_loss: 1.0886, test_f1: 0.6516
 epoch: 72, train_loss: 0.3963, test_loss: 1.1829, test_f1: 0.6273
 epoch: 73, train_loss: 0.4037, test_loss: 1.0979, test_f1: 0.6621
 epoch: 74, train_loss: 0.3913, test_loss: 1.0705, test_f1: 0.6462
 epoch: 75, train_loss: 0.3741, test_loss: 1.0974, test_f1: 0.6552
 epoch: 76, train_loss: 0.3767, test_loss: 1.2244, test_f1: 0.6310
 epoch: 77, train_loss: 0.3915, test_loss: 0.9983, test_f1: 0.6365
 epoch: 78, train_loss: 0.3544, test_loss: 1.1777, test_f1: 0.6446
 epoch: 79, train_loss: 0.3568, test_loss: 1.3244, test_f1: 0.6573
 epoch: 80, train_loss: 0.3492, test_loss: 1.1453, test_f1: 0.6503
 epoch: 81, train_loss: 0.3831, test_loss: 1.3496, test_f1: 0.6466
 epoch: 82, train_loss: 0.3770, test_loss: 1.1999, test_f1: 0.6215
 epoch: 83, train_loss: 0.3841, test_loss: 1.1798, test_f1: 0.6387
 epoch: 84, train_loss: 0.3528, test_loss: 1.1381, test_f1: 0.6461
 epoch: 85, train_loss: 0.3619, test_loss: 1.1230, test_f1: 0.6242
 epoch: 86, train_loss: 0.3703, test_loss: 1.3318, test_f1: 0.6604
 epoch: 87, train_loss: 0.3720, test_loss: 1.2354, test_f1: 0.6397
 epoch: 88, train_loss: 0.3668, test_loss: 1.2494, test_f1: 0.6503
 epoch: 89, train_loss: 0.3637, test_loss: 1.1248, test_f1: 0.6387
 epoch: 90, train_loss: 0.3560, test_loss: 1.4368, test_f1: 0.6009
 epoch: 91, train_loss: 0.3608, test_loss: 1.3695, test_f1: 0.6588
 epoch: 92, train_loss: 0.3417, test_loss: 1.3356, test_f1: 0.6630
 epoch: 93, train_loss: 0.3437, test_loss: 1.2540, test_f1: 0.6514
 epoch: 94, train_loss: 0.3334, test_loss: 1.4421, test_f1: 0.6438
 epoch: 95, train_loss: 0.3492, test_loss: 1.2781, test_f1: 0.6534
 epoch: 96, train_loss: 0.3212, test_loss: 1.1891, test_f1: 0.6338
 epoch: 97, train_loss: 0.3325, test_loss: 1.3609, test_f1: 0.6418
 epoch: 98, train_loss: 0.3263, test_loss: 1.3613, test_f1: 0.6494
 epoch: 99, train_loss: 0.3320, test_loss: 1.3239, test_f1: 0.6256
##################ITERATION #4 ****************************************
 epoch: 0, train_loss: 1.4433, test_loss: 1.6989, test_f1: 0.2353
 epoch: 1, train_loss: 1.0278, test_loss: 1.4142, test_f1: 0.3021
 epoch: 2, train_loss: 0.9745, test_loss: 1.0045, test_f1: 0.4876
 epoch: 3, train_loss: 0.9572, test_loss: 0.9661, test_f1: 0.4947
 epoch: 4, train_loss: 0.9320, test_loss: 0.9402, test_f1: 0.5137
 epoch: 5, train_loss: 0.9107, test_loss: 0.9566, test_f1: 0.5032
 epoch: 6, train_loss: 0.8759, test_loss: 0.9599, test_f1: 0.4990
 epoch: 7, train_loss: 0.8790, test_loss: 0.9052, test_f1: 0.5235
 epoch: 8, train_loss: 0.8514, test_loss: 0.9213, test_f1: 0.5400
 epoch: 9, train_loss: 0.8383, test_loss: 0.9753, test_f1: 0.5380
 epoch: 10, train_loss: 0.8229, test_loss: 0.9142, test_f1: 0.5699
 epoch: 11, train_loss: 0.8019, test_loss: 1.0901, test_f1: 0.5238
 epoch: 12, train_loss: 0.8072, test_loss: 1.5388, test_f1: 0.4313
 epoch: 13, train_loss: 0.7968, test_loss: 0.8264, test_f1: 0.5614
 epoch: 14, train_loss: 0.7848, test_loss: 0.8305, test_f1: 0.5900
 epoch: 15, train_loss: 0.7635, test_loss: 1.0507, test_f1: 0.5352
 epoch: 16, train_loss: 0.7624, test_loss: 0.9093, test_f1: 0.5948
 epoch: 17, train_loss: 0.7264, test_loss: 0.7937, test_f1: 0.6279
 epoch: 18, train_loss: 0.7393, test_loss: 0.8429, test_f1: 0.5824
 epoch: 19, train_loss: 0.7293, test_loss: 0.8357, test_f1: 0.6113
 epoch: 20, train_loss: 0.7182, test_loss: 0.8600, test_f1: 0.6244
 epoch: 21, train_loss: 0.7035, test_loss: 0.8371, test_f1: 0.6019
 epoch: 22, train_loss: 0.6930, test_loss: 0.9415, test_f1: 0.6115
 epoch: 23, train_loss: 0.6784, test_loss: 0.8022, test_f1: 0.6414
 epoch: 24, train_loss: 0.6764, test_loss: 0.8488, test_f1: 0.6036
 epoch: 25, train_loss: 0.6563, test_loss: 1.1274, test_f1: 0.5280
 epoch: 26, train_loss: 0.6533, test_loss: 0.9840, test_f1: 0.6112
 epoch: 27, train_loss: 0.6240, test_loss: 0.8150, test_f1: 0.6202
 epoch: 28, train_loss: 0.6504, test_loss: 1.0698, test_f1: 0.5497
 epoch: 29, train_loss: 0.6590, test_loss: 1.1279, test_f1: 0.5234
 epoch: 30, train_loss: 0.6437, test_loss: 0.9662, test_f1: 0.5152
 epoch: 31, train_loss: 0.6386, test_loss: 0.9646, test_f1: 0.6213
 epoch: 32, train_loss: 0.6268, test_loss: 0.9170, test_f1: 0.6110
 epoch: 33, train_loss: 0.6158, test_loss: 1.0013, test_f1: 0.5740
 epoch: 34, train_loss: 0.6058, test_loss: 0.8153, test_f1: 0.6511
 epoch: 35, train_loss: 0.6107, test_loss: 1.1263, test_f1: 0.5778
 epoch: 36, train_loss: 0.5862, test_loss: 0.8231, test_f1: 0.6747
 epoch: 37, train_loss: 0.5758, test_loss: 0.9356, test_f1: 0.6328
 epoch: 38, train_loss: 0.5670, test_loss: 1.1425, test_f1: 0.5823
 epoch: 39, train_loss: 0.5583, test_loss: 0.9052, test_f1: 0.6535
 epoch: 40, train_loss: 0.5702, test_loss: 1.1625, test_f1: 0.5793
 epoch: 41, train_loss: 0.5497, test_loss: 1.0299, test_f1: 0.6132
 epoch: 42, train_loss: 0.5472, test_loss: 1.0016, test_f1: 0.6358
 epoch: 43, train_loss: 0.5644, test_loss: 0.9941, test_f1: 0.6289
 epoch: 44, train_loss: 0.5593, test_loss: 1.0332, test_f1: 0.6668
 epoch: 45, train_loss: 0.5170, test_loss: 0.8569, test_f1: 0.6559
 epoch: 46, train_loss: 0.5311, test_loss: 1.0679, test_f1: 0.6289
 epoch: 47, train_loss: 0.5500, test_loss: 1.1494, test_f1: 0.6048
 epoch: 48, train_loss: 0.5300, test_loss: 1.0670, test_f1: 0.6504
 epoch: 49, train_loss: 0.5322, test_loss: 1.1037, test_f1: 0.5930
 epoch: 50, train_loss: 0.5257, test_loss: 1.1448, test_f1: 0.6040
 epoch: 51, train_loss: 0.4998, test_loss: 1.0150, test_f1: 0.6545
 epoch: 52, train_loss: 0.4589, test_loss: 0.9476, test_f1: 0.6867
 epoch: 53, train_loss: 0.4594, test_loss: 0.9544, test_f1: 0.6944
 epoch: 54, train_loss: 0.4640, test_loss: 0.9363, test_f1: 0.6819
 epoch: 55, train_loss: 0.4414, test_loss: 1.0550, test_f1: 0.6855
 epoch: 56, train_loss: 0.4112, test_loss: 1.1124, test_f1: 0.6541
 epoch: 57, train_loss: 0.4211, test_loss: 1.0443, test_f1: 0.6498
 epoch: 58, train_loss: 0.4186, test_loss: 1.0815, test_f1: 0.6643
 epoch: 59, train_loss: 0.4195, test_loss: 1.1823, test_f1: 0.6664
 epoch: 60, train_loss: 0.4305, test_loss: 1.0321, test_f1: 0.7153
 epoch: 61, train_loss: 0.4098, test_loss: 1.1555, test_f1: 0.6690
 epoch: 62, train_loss: 0.4148, test_loss: 1.2470, test_f1: 0.6322
 epoch: 63, train_loss: 0.4084, test_loss: 1.1620, test_f1: 0.6978
 epoch: 64, train_loss: 0.3963, test_loss: 1.1639, test_f1: 0.6862
 epoch: 65, train_loss: 0.3883, test_loss: 1.2345, test_f1: 0.6761
 epoch: 66, train_loss: 0.3925, test_loss: 1.2403, test_f1: 0.6747
 epoch: 67, train_loss: 0.3812, test_loss: 1.2099, test_f1: 0.6952
 epoch: 68, train_loss: 0.3848, test_loss: 1.2427, test_f1: 0.6627
 epoch: 69, train_loss: 0.3896, test_loss: 1.1404, test_f1: 0.6982
 epoch: 70, train_loss: 0.3870, test_loss: 1.2138, test_f1: 0.6781
 epoch: 71, train_loss: 0.4005, test_loss: 1.2350, test_f1: 0.6518
 epoch: 72, train_loss: 0.3924, test_loss: 1.2626, test_f1: 0.6310
 epoch: 73, train_loss: 0.3972, test_loss: 1.2363, test_f1: 0.6813
 epoch: 74, train_loss: 0.3737, test_loss: 1.2145, test_f1: 0.6957
 epoch: 75, train_loss: 0.3849, test_loss: 1.0942, test_f1: 0.6973
 epoch: 76, train_loss: 0.3816, test_loss: 1.1861, test_f1: 0.6376
 epoch: 77, train_loss: 0.3755, test_loss: 1.1155, test_f1: 0.7139
 epoch: 78, train_loss: 0.3825, test_loss: 1.2616, test_f1: 0.6853
 epoch: 79, train_loss: 0.3677, test_loss: 1.2862, test_f1: 0.5924
 epoch: 80, train_loss: 0.3559, test_loss: 1.3330, test_f1: 0.6360
 epoch: 81, train_loss: 0.3619, test_loss: 1.1638, test_f1: 0.6621
 epoch: 82, train_loss: 0.3590, test_loss: 1.4244, test_f1: 0.6179
 epoch: 83, train_loss: 0.3489, test_loss: 1.3297, test_f1: 0.6762
 epoch: 84, train_loss: 0.3414, test_loss: 1.3768, test_f1: 0.6317
 epoch: 85, train_loss: 0.3524, test_loss: 1.5288, test_f1: 0.5740
 epoch: 86, train_loss: 0.3596, test_loss: 1.5671, test_f1: 0.6315
 epoch: 87, train_loss: 0.3360, test_loss: 1.4560, test_f1: 0.6239
 epoch: 88, train_loss: 0.3295, test_loss: 1.3154, test_f1: 0.6884
 epoch: 89, train_loss: 0.3337, test_loss: 1.2679, test_f1: 0.7074
 epoch: 90, train_loss: 0.3414, test_loss: 1.5332, test_f1: 0.5776
 epoch: 91, train_loss: 0.3500, test_loss: 1.2826, test_f1: 0.6863
 epoch: 92, train_loss: 0.3471, test_loss: 1.3666, test_f1: 0.6523
 epoch: 93, train_loss: 0.3719, test_loss: 1.3287, test_f1: 0.6461
 epoch: 94, train_loss: 0.3445, test_loss: 1.5331, test_f1: 0.6484
 epoch: 95, train_loss: 0.3542, test_loss: 1.4579, test_f1: 0.6492
 epoch: 96, train_loss: 0.3304, test_loss: 1.4515, test_f1: 0.6437
 epoch: 97, train_loss: 0.3308, test_loss: 1.3352, test_f1: 0.7095
 epoch: 98, train_loss: 0.2974, test_loss: 1.5005, test_f1: 0.6407
 epoch: 99, train_loss: 0.3212, test_loss: 1.5380, test_f1: 0.6318
##################ITERATION #5 ****************************************
 epoch: 0, train_loss: 1.4664, test_loss: 1.4190, test_f1: 0.2270
 epoch: 1, train_loss: 1.0143, test_loss: 1.1461, test_f1: 0.3389
 epoch: 2, train_loss: 0.9846, test_loss: 1.0283, test_f1: 0.3945
 epoch: 3, train_loss: 0.9533, test_loss: 0.9942, test_f1: 0.4311
 epoch: 4, train_loss: 0.9259, test_loss: 0.9854, test_f1: 0.5266
 epoch: 5, train_loss: 0.9075, test_loss: 1.0365, test_f1: 0.5098
 epoch: 6, train_loss: 0.8901, test_loss: 0.9358, test_f1: 0.5177
 epoch: 7, train_loss: 0.8671, test_loss: 0.9676, test_f1: 0.5213
 epoch: 8, train_loss: 0.8421, test_loss: 1.3318, test_f1: 0.4392
 epoch: 9, train_loss: 0.8537, test_loss: 0.9997, test_f1: 0.4799
 epoch: 10, train_loss: 0.8508, test_loss: 0.9937, test_f1: 0.5047
 epoch: 11, train_loss: 0.8157, test_loss: 0.8945, test_f1: 0.5530
 epoch: 12, train_loss: 0.8048, test_loss: 1.0206, test_f1: 0.4950
 epoch: 13, train_loss: 0.8130, test_loss: 0.8339, test_f1: 0.5757
 epoch: 14, train_loss: 0.7855, test_loss: 0.9194, test_f1: 0.5929
 epoch: 15, train_loss: 0.7746, test_loss: 0.9362, test_f1: 0.5489
 epoch: 16, train_loss: 0.7553, test_loss: 0.8659, test_f1: 0.5767
 epoch: 17, train_loss: 0.7511, test_loss: 0.8441, test_f1: 0.6054
 epoch: 18, train_loss: 0.7569, test_loss: 0.9974, test_f1: 0.5345
 epoch: 19, train_loss: 0.7416, test_loss: 0.8867, test_f1: 0.5925
 epoch: 20, train_loss: 0.7363, test_loss: 1.0096, test_f1: 0.5367
 epoch: 21, train_loss: 0.7338, test_loss: 0.8058, test_f1: 0.6028
 epoch: 22, train_loss: 0.7169, test_loss: 1.0335, test_f1: 0.5802
 epoch: 23, train_loss: 0.6861, test_loss: 1.1198, test_f1: 0.5736
 epoch: 24, train_loss: 0.6941, test_loss: 0.8853, test_f1: 0.6107
 epoch: 25, train_loss: 0.6939, test_loss: 0.9053, test_f1: 0.5901
 epoch: 26, train_loss: 0.6911, test_loss: 0.9637, test_f1: 0.5644
 epoch: 27, train_loss: 0.6792, test_loss: 0.8331, test_f1: 0.6468
 epoch: 28, train_loss: 0.6615, test_loss: 0.9091, test_f1: 0.6085
 epoch: 29, train_loss: 0.6488, test_loss: 0.9070, test_f1: 0.5962
 epoch: 30, train_loss: 0.6404, test_loss: 1.0380, test_f1: 0.5956
 epoch: 31, train_loss: 0.6434, test_loss: 1.1260, test_f1: 0.6081
 epoch: 32, train_loss: 0.6324, test_loss: 0.9147, test_f1: 0.6183
 epoch: 33, train_loss: 0.6209, test_loss: 1.1054, test_f1: 0.5772
 epoch: 34, train_loss: 0.6625, test_loss: 1.1521, test_f1: 0.4471
 epoch: 35, train_loss: 0.6777, test_loss: 0.9230, test_f1: 0.6022
 epoch: 36, train_loss: 0.6505, test_loss: 1.2077, test_f1: 0.5765
 epoch: 37, train_loss: 0.6372, test_loss: 0.8758, test_f1: 0.6132
 epoch: 38, train_loss: 0.6240, test_loss: 1.1425, test_f1: 0.5606
 epoch: 39, train_loss: 0.6126, test_loss: 0.9725, test_f1: 0.6205
 epoch: 40, train_loss: 0.6097, test_loss: 1.0432, test_f1: 0.6210
 epoch: 41, train_loss: 0.5844, test_loss: 1.1720, test_f1: 0.6079
 epoch: 42, train_loss: 0.5661, test_loss: 1.0559, test_f1: 0.6334
 epoch: 43, train_loss: 0.5731, test_loss: 0.8399, test_f1: 0.6862
 epoch: 44, train_loss: 0.5601, test_loss: 1.0835, test_f1: 0.6232
 epoch: 45, train_loss: 0.5687, test_loss: 1.1551, test_f1: 0.6049
 epoch: 46, train_loss: 0.5680, test_loss: 1.0983, test_f1: 0.6481
 epoch: 47, train_loss: 0.5777, test_loss: 0.9875, test_f1: 0.6585
 epoch: 48, train_loss: 0.5507, test_loss: 1.0267, test_f1: 0.6592
 epoch: 49, train_loss: 0.5494, test_loss: 1.1175, test_f1: 0.6187
 epoch: 50, train_loss: 0.5319, test_loss: 1.1259, test_f1: 0.6808
 epoch: 51, train_loss: 0.5234, test_loss: 1.0884, test_f1: 0.6421
 epoch: 52, train_loss: 0.5090, test_loss: 1.0342, test_f1: 0.6647
 epoch: 53, train_loss: 0.4793, test_loss: 1.1066, test_f1: 0.6598
 epoch: 54, train_loss: 0.4517, test_loss: 1.1470, test_f1: 0.6735
 epoch: 55, train_loss: 0.4741, test_loss: 1.0839, test_f1: 0.6834
 epoch: 56, train_loss: 0.4508, test_loss: 0.9869, test_f1: 0.7060
 epoch: 57, train_loss: 0.4591, test_loss: 1.0190, test_f1: 0.6817
 epoch: 58, train_loss: 0.4436, test_loss: 1.0872, test_f1: 0.6815
 epoch: 59, train_loss: 0.4607, test_loss: 1.2150, test_f1: 0.6748
 epoch: 60, train_loss: 0.4600, test_loss: 1.1072, test_f1: 0.6892
 epoch: 61, train_loss: 0.4400, test_loss: 1.1033, test_f1: 0.6572
 epoch: 62, train_loss: 0.4123, test_loss: 1.1425, test_f1: 0.6785
 epoch: 63, train_loss: 0.4318, test_loss: 1.1413, test_f1: 0.6611
 epoch: 64, train_loss: 0.4369, test_loss: 1.2180, test_f1: 0.6631
 epoch: 65, train_loss: 0.4481, test_loss: 1.2400, test_f1: 0.6763
 epoch: 66, train_loss: 0.4251, test_loss: 1.1147, test_f1: 0.6582
 epoch: 67, train_loss: 0.4221, test_loss: 1.2000, test_f1: 0.6694
 epoch: 68, train_loss: 0.4331, test_loss: 1.2199, test_f1: 0.6921
 epoch: 69, train_loss: 0.4189, test_loss: 1.2085, test_f1: 0.6750
 epoch: 70, train_loss: 0.4228, test_loss: 1.2584, test_f1: 0.6828
 epoch: 71, train_loss: 0.4110, test_loss: 1.1388, test_f1: 0.6402
 epoch: 72, train_loss: 0.4411, test_loss: 1.0976, test_f1: 0.6818
 epoch: 73, train_loss: 0.4139, test_loss: 1.3997, test_f1: 0.6555
 epoch: 74, train_loss: 0.4122, test_loss: 1.2548, test_f1: 0.6829
 epoch: 75, train_loss: 0.3955, test_loss: 1.3555, test_f1: 0.6869
 epoch: 76, train_loss: 0.3930, test_loss: 1.3016, test_f1: 0.6803
 epoch: 77, train_loss: 0.4080, test_loss: 1.4318, test_f1: 0.6678
 epoch: 78, train_loss: 0.4010, test_loss: 1.2420, test_f1: 0.6664
 epoch: 79, train_loss: 0.3883, test_loss: 1.3332, test_f1: 0.6569
 epoch: 80, train_loss: 0.4176, test_loss: 1.5815, test_f1: 0.6231
 epoch: 81, train_loss: 0.3871, test_loss: 1.3176, test_f1: 0.6907
 epoch: 82, train_loss: 0.3763, test_loss: 1.3083, test_f1: 0.6846
 epoch: 83, train_loss: 0.3878, test_loss: 1.3969, test_f1: 0.6604
 epoch: 84, train_loss: 0.3906, test_loss: 1.2439, test_f1: 0.7003
 epoch: 85, train_loss: 0.3745, test_loss: 1.3734, test_f1: 0.6920
 epoch: 86, train_loss: 0.3813, test_loss: 1.5325, test_f1: 0.6108
 epoch: 87, train_loss: 0.3732, test_loss: 1.2388, test_f1: 0.6893
 epoch: 88, train_loss: 0.3916, test_loss: 1.3651, test_f1: 0.6806
 epoch: 89, train_loss: 0.3659, test_loss: 1.3102, test_f1: 0.6753
 epoch: 90, train_loss: 0.3827, test_loss: 1.4688, test_f1: 0.6508
 epoch: 91, train_loss: 0.3596, test_loss: 1.4474, test_f1: 0.6973
 epoch: 92, train_loss: 0.3740, test_loss: 1.4177, test_f1: 0.6592
 epoch: 93, train_loss: 0.3766, test_loss: 1.6074, test_f1: 0.6691
 epoch: 94, train_loss: 0.3530, test_loss: 1.4586, test_f1: 0.6688
 epoch: 95, train_loss: 0.3669, test_loss: 1.4543, test_f1: 0.6320
 epoch: 96, train_loss: 0.3627, test_loss: 1.5484, test_f1: 0.6688
 epoch: 97, train_loss: 0.3677, test_loss: 1.3916, test_f1: 0.6684
 epoch: 98, train_loss: 0.3645, test_loss: 1.4617, test_f1: 0.6772
 epoch: 99, train_loss: 0.3406, test_loss: 1.4761, test_f1: 0.6866
##################ITERATION #6 ****************************************
 epoch: 0, train_loss: 1.5860, test_loss: 1.1376, test_f1: 0.3488
 epoch: 1, train_loss: 1.0449, test_loss: 1.0604, test_f1: 0.4510
 epoch: 2, train_loss: 1.0122, test_loss: 1.0569, test_f1: 0.4553
 epoch: 3, train_loss: 0.9803, test_loss: 1.0757, test_f1: 0.4696
 epoch: 4, train_loss: 0.9673, test_loss: 0.9901, test_f1: 0.5004
 epoch: 5, train_loss: 0.9456, test_loss: 1.0621, test_f1: 0.4717
 epoch: 6, train_loss: 0.9229, test_loss: 0.9963, test_f1: 0.4633
 epoch: 7, train_loss: 0.9220, test_loss: 0.9740, test_f1: 0.4977
 epoch: 8, train_loss: 0.9024, test_loss: 0.9969, test_f1: 0.5031
 epoch: 9, train_loss: 0.8893, test_loss: 0.9056, test_f1: 0.5261
 epoch: 10, train_loss: 0.8836, test_loss: 0.9810, test_f1: 0.5149
 epoch: 11, train_loss: 0.8703, test_loss: 0.8985, test_f1: 0.5268
 epoch: 12, train_loss: 0.8438, test_loss: 0.8763, test_f1: 0.5219
 epoch: 13, train_loss: 0.8349, test_loss: 0.8439, test_f1: 0.5828
 epoch: 14, train_loss: 0.8244, test_loss: 0.8911, test_f1: 0.5382
 epoch: 15, train_loss: 0.8223, test_loss: 0.8464, test_f1: 0.5469
 epoch: 16, train_loss: 0.8163, test_loss: 0.8627, test_f1: 0.5197
 epoch: 17, train_loss: 0.7916, test_loss: 0.8810, test_f1: 0.5534
 epoch: 18, train_loss: 0.7780, test_loss: 0.9616, test_f1: 0.5888
 epoch: 19, train_loss: 0.7753, test_loss: 0.9733, test_f1: 0.5606
 epoch: 20, train_loss: 0.7738, test_loss: 0.9773, test_f1: 0.5609
 epoch: 21, train_loss: 0.7710, test_loss: 0.8006, test_f1: 0.5710
 epoch: 22, train_loss: 0.7456, test_loss: 0.9166, test_f1: 0.6106
 epoch: 23, train_loss: 0.7354, test_loss: 0.7804, test_f1: 0.5876
 epoch: 24, train_loss: 0.7418, test_loss: 0.9810, test_f1: 0.6165
 epoch: 25, train_loss: 0.7063, test_loss: 0.7655, test_f1: 0.6197
 epoch: 26, train_loss: 0.7090, test_loss: 1.3404, test_f1: 0.5187
 epoch: 27, train_loss: 0.6923, test_loss: 0.8389, test_f1: 0.5864
 epoch: 28, train_loss: 0.6894, test_loss: 0.8388, test_f1: 0.6053
 epoch: 29, train_loss: 0.6897, test_loss: 0.8219, test_f1: 0.6050
 epoch: 30, train_loss: 0.6829, test_loss: 0.7824, test_f1: 0.6520
 epoch: 31, train_loss: 0.6787, test_loss: 0.8466, test_f1: 0.6296
 epoch: 32, train_loss: 0.6603, test_loss: 0.7838, test_f1: 0.6296
 epoch: 33, train_loss: 0.6450, test_loss: 0.9780, test_f1: 0.6366
 epoch: 34, train_loss: 0.6517, test_loss: 0.8612, test_f1: 0.5971
 epoch: 35, train_loss: 0.6486, test_loss: 0.8255, test_f1: 0.6106
 epoch: 36, train_loss: 0.6576, test_loss: 1.0917, test_f1: 0.5676
 epoch: 37, train_loss: 0.6487, test_loss: 0.8295, test_f1: 0.6194
 epoch: 38, train_loss: 0.6368, test_loss: 0.7402, test_f1: 0.6476
 epoch: 39, train_loss: 0.6322, test_loss: 0.8123, test_f1: 0.6512
 epoch: 40, train_loss: 0.6245, test_loss: 1.0026, test_f1: 0.6582
 epoch: 41, train_loss: 0.6001, test_loss: 0.8883, test_f1: 0.6640
 epoch: 42, train_loss: 0.5924, test_loss: 1.0199, test_f1: 0.6216
 epoch: 43, train_loss: 0.5897, test_loss: 0.7589, test_f1: 0.6519
 epoch: 44, train_loss: 0.6075, test_loss: 1.0287, test_f1: 0.6081
 epoch: 45, train_loss: 0.5950, test_loss: 0.9146, test_f1: 0.6253
 epoch: 46, train_loss: 0.6105, test_loss: 0.8242, test_f1: 0.6467
 epoch: 47, train_loss: 0.5702, test_loss: 0.7765, test_f1: 0.6380
 epoch: 48, train_loss: 0.5777, test_loss: 0.8478, test_f1: 0.6185
 epoch: 49, train_loss: 0.5437, test_loss: 0.9224, test_f1: 0.6237
 epoch: 50, train_loss: 0.5440, test_loss: 1.0185, test_f1: 0.6280
 epoch: 51, train_loss: 0.5209, test_loss: 0.8991, test_f1: 0.6651
 epoch: 52, train_loss: 0.4945, test_loss: 0.8327, test_f1: 0.6639
 epoch: 53, train_loss: 0.4761, test_loss: 0.7650, test_f1: 0.6473
 epoch: 54, train_loss: 0.4853, test_loss: 0.9452, test_f1: 0.6334
 epoch: 55, train_loss: 0.4737, test_loss: 0.9248, test_f1: 0.6542
 epoch: 56, train_loss: 0.4695, test_loss: 0.8711, test_f1: 0.6614
 epoch: 57, train_loss: 0.4675, test_loss: 0.9064, test_f1: 0.6658
 epoch: 58, train_loss: 0.4721, test_loss: 0.8724, test_f1: 0.6573
 epoch: 59, train_loss: 0.4746, test_loss: 1.0509, test_f1: 0.6414
 epoch: 60, train_loss: 0.4480, test_loss: 0.9553, test_f1: 0.6514
 epoch: 61, train_loss: 0.4467, test_loss: 0.8893, test_f1: 0.6596
 epoch: 62, train_loss: 0.4406, test_loss: 0.9473, test_f1: 0.6482
 epoch: 63, train_loss: 0.4520, test_loss: 0.9560, test_f1: 0.6387
 epoch: 64, train_loss: 0.4345, test_loss: 1.0402, test_f1: 0.6532
 epoch: 65, train_loss: 0.4394, test_loss: 1.1262, test_f1: 0.6444
 epoch: 66, train_loss: 0.4728, test_loss: 0.8936, test_f1: 0.6368
 epoch: 67, train_loss: 0.4442, test_loss: 0.9381, test_f1: 0.6494
 epoch: 68, train_loss: 0.4161, test_loss: 1.0328, test_f1: 0.6302
 epoch: 69, train_loss: 0.4340, test_loss: 0.9752, test_f1: 0.6468
 epoch: 70, train_loss: 0.4167, test_loss: 1.0133, test_f1: 0.6274
 epoch: 71, train_loss: 0.4134, test_loss: 1.0787, test_f1: 0.6392
 epoch: 72, train_loss: 0.4160, test_loss: 1.0517, test_f1: 0.6787
 epoch: 73, train_loss: 0.4072, test_loss: 0.9911, test_f1: 0.6462
 epoch: 74, train_loss: 0.4090, test_loss: 1.0350, test_f1: 0.6584
 epoch: 75, train_loss: 0.4181, test_loss: 1.3513, test_f1: 0.6061
 epoch: 76, train_loss: 0.4182, test_loss: 1.0958, test_f1: 0.6491
 epoch: 77, train_loss: 0.4175, test_loss: 1.2337, test_f1: 0.6212
 epoch: 78, train_loss: 0.4211, test_loss: 1.2404, test_f1: 0.6350
 epoch: 79, train_loss: 0.4309, test_loss: 1.1414, test_f1: 0.6449
 epoch: 80, train_loss: 0.4234, test_loss: 1.0242, test_f1: 0.6519
 epoch: 81, train_loss: 0.3780, test_loss: 1.0434, test_f1: 0.6581
 epoch: 82, train_loss: 0.3684, test_loss: 1.0065, test_f1: 0.6504
 epoch: 83, train_loss: 0.3832, test_loss: 1.1249, test_f1: 0.6541
 epoch: 84, train_loss: 0.3772, test_loss: 1.2417, test_f1: 0.6312
 epoch: 85, train_loss: 0.3715, test_loss: 1.2570, test_f1: 0.6407
 epoch: 86, train_loss: 0.3568, test_loss: 1.2115, test_f1: 0.6308
 epoch: 87, train_loss: 0.3739, test_loss: 1.2177, test_f1: 0.6368
 epoch: 88, train_loss: 0.3891, test_loss: 1.2840, test_f1: 0.6286
 epoch: 89, train_loss: 0.3765, test_loss: 1.1209, test_f1: 0.6331
 epoch: 90, train_loss: 0.3622, test_loss: 1.2755, test_f1: 0.6050
 epoch: 91, train_loss: 0.3643, test_loss: 1.2014, test_f1: 0.6551
 epoch: 92, train_loss: 0.3532, test_loss: 1.1344, test_f1: 0.6432
 epoch: 93, train_loss: 0.3562, test_loss: 1.1682, test_f1: 0.6422
 epoch: 94, train_loss: 0.3543, test_loss: 1.1544, test_f1: 0.6448
 epoch: 95, train_loss: 0.3727, test_loss: 1.2978, test_f1: 0.6314
 epoch: 96, train_loss: 0.3441, test_loss: 1.2550, test_f1: 0.6447
 epoch: 97, train_loss: 0.3789, test_loss: 1.2686, test_f1: 0.6260
 epoch: 98, train_loss: 0.3603, test_loss: 1.2080, test_f1: 0.6445
 epoch: 99, train_loss: 0.3604, test_loss: 1.2404, test_f1: 0.6304
##################ITERATION #7 ****************************************
 epoch: 0, train_loss: 1.4770, test_loss: 1.2305, test_f1: 0.3481
 epoch: 1, train_loss: 1.0030, test_loss: 1.1463, test_f1: 0.3569
 epoch: 2, train_loss: 0.9461, test_loss: 1.0430, test_f1: 0.4626
 epoch: 3, train_loss: 0.9183, test_loss: 0.9785, test_f1: 0.5002
 epoch: 4, train_loss: 0.8955, test_loss: 0.9446, test_f1: 0.5451
 epoch: 5, train_loss: 0.8662, test_loss: 0.8832, test_f1: 0.5742
 epoch: 6, train_loss: 0.8316, test_loss: 0.9686, test_f1: 0.5621
 epoch: 7, train_loss: 0.8316, test_loss: 0.8932, test_f1: 0.5495
 epoch: 8, train_loss: 0.8132, test_loss: 0.9348, test_f1: 0.5677
 epoch: 9, train_loss: 0.8046, test_loss: 0.8516, test_f1: 0.5773
 epoch: 10, train_loss: 0.7695, test_loss: 0.8849, test_f1: 0.5825
 epoch: 11, train_loss: 0.7652, test_loss: 0.8890, test_f1: 0.6094
 epoch: 12, train_loss: 0.7638, test_loss: 0.9392, test_f1: 0.6337
 epoch: 13, train_loss: 0.7428, test_loss: 0.8422, test_f1: 0.6179
 epoch: 14, train_loss: 0.7342, test_loss: 0.7865, test_f1: 0.6186
 epoch: 15, train_loss: 0.7284, test_loss: 2.1732, test_f1: 0.4122
 epoch: 16, train_loss: 0.7188, test_loss: 0.8718, test_f1: 0.6059
 epoch: 17, train_loss: 0.7035, test_loss: 1.0307, test_f1: 0.5650
 epoch: 18, train_loss: 0.6844, test_loss: 0.8506, test_f1: 0.6443
 epoch: 19, train_loss: 0.7048, test_loss: 1.0206, test_f1: 0.5882
 epoch: 20, train_loss: 0.6869, test_loss: 1.0303, test_f1: 0.5926
 epoch: 21, train_loss: 0.6777, test_loss: 1.0810, test_f1: 0.5388
 epoch: 22, train_loss: 0.6867, test_loss: 0.7956, test_f1: 0.6436
 epoch: 23, train_loss: 0.6637, test_loss: 0.8809, test_f1: 0.6238
 epoch: 24, train_loss: 0.6641, test_loss: 0.9284, test_f1: 0.6401
 epoch: 25, train_loss: 0.6409, test_loss: 0.9315, test_f1: 0.6141
 epoch: 26, train_loss: 0.6557, test_loss: 0.9510, test_f1: 0.6091
 epoch: 27, train_loss: 0.6331, test_loss: 1.0383, test_f1: 0.6004
 epoch: 28, train_loss: 0.6214, test_loss: 1.1569, test_f1: 0.6271
 epoch: 29, train_loss: 0.6073, test_loss: 1.4878, test_f1: 0.5081
 epoch: 30, train_loss: 0.5946, test_loss: 1.0448, test_f1: 0.5929
 epoch: 31, train_loss: 0.5941, test_loss: 0.8492, test_f1: 0.6695
 epoch: 32, train_loss: 0.6080, test_loss: 1.4412, test_f1: 0.5407
 epoch: 33, train_loss: 0.5906, test_loss: 0.9873, test_f1: 0.6452
 epoch: 34, train_loss: 0.5914, test_loss: 0.9871, test_f1: 0.6508
 epoch: 35, train_loss: 0.5871, test_loss: 1.0094, test_f1: 0.6117
 epoch: 36, train_loss: 0.5772, test_loss: 1.1377, test_f1: 0.6394
 epoch: 37, train_loss: 0.5781, test_loss: 0.9972, test_f1: 0.6132
 epoch: 38, train_loss: 0.5756, test_loss: 1.1001, test_f1: 0.6275
 epoch: 39, train_loss: 0.5577, test_loss: 1.2049, test_f1: 0.5932
 epoch: 40, train_loss: 0.5412, test_loss: 1.1969, test_f1: 0.6199
 epoch: 41, train_loss: 0.5410, test_loss: 1.0866, test_f1: 0.5926
 epoch: 42, train_loss: 0.5494, test_loss: 1.1280, test_f1: 0.6307
 epoch: 43, train_loss: 0.5539, test_loss: 1.2711, test_f1: 0.6170
 epoch: 44, train_loss: 0.5349, test_loss: 1.1179, test_f1: 0.6299
 epoch: 45, train_loss: 0.5195, test_loss: 1.1970, test_f1: 0.6152
 epoch: 46, train_loss: 0.5226, test_loss: 1.1234, test_f1: 0.5858
 epoch: 47, train_loss: 0.5121, test_loss: 1.2051, test_f1: 0.6536
 epoch: 48, train_loss: 0.5191, test_loss: 1.1782, test_f1: 0.6555
 epoch: 49, train_loss: 0.5217, test_loss: 1.4700, test_f1: 0.6158
 epoch: 50, train_loss: 0.5134, test_loss: 1.1719, test_f1: 0.6012
 epoch: 51, train_loss: 0.4833, test_loss: 1.2356, test_f1: 0.6112
 epoch: 52, train_loss: 0.4576, test_loss: 1.1805, test_f1: 0.6650
 epoch: 53, train_loss: 0.4302, test_loss: 1.2083, test_f1: 0.6208
 epoch: 54, train_loss: 0.4173, test_loss: 1.1422, test_f1: 0.6502
 epoch: 55, train_loss: 0.4180, test_loss: 1.1334, test_f1: 0.6497
 epoch: 56, train_loss: 0.4173, test_loss: 1.2506, test_f1: 0.6285
 epoch: 57, train_loss: 0.4146, test_loss: 1.2356, test_f1: 0.6379
 epoch: 58, train_loss: 0.4055, test_loss: 1.2820, test_f1: 0.6213
 epoch: 59, train_loss: 0.4202, test_loss: 1.2596, test_f1: 0.6398
 epoch: 60, train_loss: 0.3985, test_loss: 1.2814, test_f1: 0.6263
 epoch: 61, train_loss: 0.3993, test_loss: 1.1385, test_f1: 0.6458
 epoch: 62, train_loss: 0.3769, test_loss: 1.1820, test_f1: 0.6349
 epoch: 63, train_loss: 0.3837, test_loss: 1.2990, test_f1: 0.6260
 epoch: 64, train_loss: 0.3786, test_loss: 1.3037, test_f1: 0.6298
 epoch: 65, train_loss: 0.3805, test_loss: 1.3725, test_f1: 0.6355
 epoch: 66, train_loss: 0.3933, test_loss: 1.2350, test_f1: 0.6358
 epoch: 67, train_loss: 0.3818, test_loss: 1.2385, test_f1: 0.6516
 epoch: 68, train_loss: 0.3742, test_loss: 1.3322, test_f1: 0.6481
 epoch: 69, train_loss: 0.3655, test_loss: 1.5699, test_f1: 0.5955
 epoch: 70, train_loss: 0.3709, test_loss: 1.3628, test_f1: 0.6450
 epoch: 71, train_loss: 0.3534, test_loss: 1.2926, test_f1: 0.6151
 epoch: 72, train_loss: 0.3608, test_loss: 1.2808, test_f1: 0.6218
 epoch: 73, train_loss: 0.3646, test_loss: 1.3474, test_f1: 0.6337
 epoch: 74, train_loss: 0.3573, test_loss: 1.3689, test_f1: 0.6318
 epoch: 75, train_loss: 0.3827, test_loss: 1.3299, test_f1: 0.6322
 epoch: 76, train_loss: 0.3535, test_loss: 1.3787, test_f1: 0.6451
 epoch: 77, train_loss: 0.3594, test_loss: 1.2181, test_f1: 0.6183
 epoch: 78, train_loss: 0.3628, test_loss: 1.3082, test_f1: 0.6368
 epoch: 79, train_loss: 0.3612, test_loss: 1.2462, test_f1: 0.6400
 epoch: 80, train_loss: 0.3377, test_loss: 1.1798, test_f1: 0.6513
 epoch: 81, train_loss: 0.3573, test_loss: 1.2632, test_f1: 0.6335
 epoch: 82, train_loss: 0.3567, test_loss: 1.4843, test_f1: 0.6481
 epoch: 83, train_loss: 0.3484, test_loss: 1.3732, test_f1: 0.6481
 epoch: 84, train_loss: 0.3251, test_loss: 1.4022, test_f1: 0.6548
 epoch: 85, train_loss: 0.3271, test_loss: 1.4197, test_f1: 0.6116
 epoch: 86, train_loss: 0.3327, test_loss: 1.3599, test_f1: 0.6547
 epoch: 87, train_loss: 0.3294, test_loss: 1.4293, test_f1: 0.6223
 epoch: 88, train_loss: 0.3155, test_loss: 1.3908, test_f1: 0.6422
 epoch: 89, train_loss: 0.3113, test_loss: 1.3673, test_f1: 0.6644
 epoch: 90, train_loss: 0.3459, test_loss: 1.3087, test_f1: 0.6544
 epoch: 91, train_loss: 0.3339, test_loss: 1.2269, test_f1: 0.6597
 epoch: 92, train_loss: 0.3296, test_loss: 1.2813, test_f1: 0.6539
 epoch: 93, train_loss: 0.3199, test_loss: 1.4294, test_f1: 0.6571
 epoch: 94, train_loss: 0.3239, test_loss: 1.3838, test_f1: 0.6123
 epoch: 95, train_loss: 0.3147, test_loss: 1.2728, test_f1: 0.6306
 epoch: 96, train_loss: 0.3116, test_loss: 1.2746, test_f1: 0.6713
 epoch: 97, train_loss: 0.3136, test_loss: 1.4523, test_f1: 0.6220
 epoch: 98, train_loss: 0.3219, test_loss: 1.3595, test_f1: 0.6337
 epoch: 99, train_loss: 0.3158, test_loss: 1.4810, test_f1: 0.6554
##################ITERATION #8 ****************************************
 epoch: 0, train_loss: 1.5821, test_loss: 1.4329, test_f1: 0.2600
 epoch: 1, train_loss: 1.0221, test_loss: 1.1380, test_f1: 0.3850
 epoch: 2, train_loss: 0.9710, test_loss: 1.0423, test_f1: 0.4189
 epoch: 3, train_loss: 0.9415, test_loss: 0.9978, test_f1: 0.4685
 epoch: 4, train_loss: 0.9259, test_loss: 1.0256, test_f1: 0.5144
 epoch: 5, train_loss: 0.8995, test_loss: 0.9606, test_f1: 0.5570
 epoch: 6, train_loss: 0.8829, test_loss: 0.9575, test_f1: 0.5762
 epoch: 7, train_loss: 0.8616, test_loss: 0.9745, test_f1: 0.5562
 epoch: 8, train_loss: 0.8634, test_loss: 0.9892, test_f1: 0.5323
 epoch: 9, train_loss: 0.8412, test_loss: 0.9196, test_f1: 0.5381
 epoch: 10, train_loss: 0.8328, test_loss: 0.9167, test_f1: 0.5487
 epoch: 11, train_loss: 0.8226, test_loss: 0.9417, test_f1: 0.5854
 epoch: 12, train_loss: 0.7871, test_loss: 0.9563, test_f1: 0.5504
 epoch: 13, train_loss: 0.7755, test_loss: 0.8909, test_f1: 0.6265
 epoch: 14, train_loss: 0.7720, test_loss: 0.8640, test_f1: 0.6115
 epoch: 15, train_loss: 0.7661, test_loss: 0.9102, test_f1: 0.6002
 epoch: 16, train_loss: 0.7410, test_loss: 0.8932, test_f1: 0.6230
 epoch: 17, train_loss: 0.7144, test_loss: 1.1063, test_f1: 0.5498
 epoch: 18, train_loss: 0.7254, test_loss: 0.8338, test_f1: 0.6394
 epoch: 19, train_loss: 0.6856, test_loss: 0.8663, test_f1: 0.6197
 epoch: 20, train_loss: 0.6995, test_loss: 0.8171, test_f1: 0.6186
 epoch: 21, train_loss: 0.6875, test_loss: 0.9926, test_f1: 0.5906
 epoch: 22, train_loss: 0.6933, test_loss: 0.9854, test_f1: 0.6347
 epoch: 23, train_loss: 0.6814, test_loss: 0.8948, test_f1: 0.6529
 epoch: 24, train_loss: 0.6796, test_loss: 0.8357, test_f1: 0.5886
 epoch: 25, train_loss: 0.6827, test_loss: 0.9333, test_f1: 0.6160
 epoch: 26, train_loss: 0.6855, test_loss: 0.8928, test_f1: 0.6259
 epoch: 27, train_loss: 0.6678, test_loss: 0.7696, test_f1: 0.6421
 epoch: 28, train_loss: 0.6479, test_loss: 0.9642, test_f1: 0.5904
 epoch: 29, train_loss: 0.6462, test_loss: 1.0688, test_f1: 0.6223
 epoch: 30, train_loss: 0.6320, test_loss: 0.9151, test_f1: 0.6142
 epoch: 31, train_loss: 0.6123, test_loss: 0.9713, test_f1: 0.6165
 epoch: 32, train_loss: 0.5979, test_loss: 0.8435, test_f1: 0.6197
 epoch: 33, train_loss: 0.6126, test_loss: 0.9495, test_f1: 0.6340
 epoch: 34, train_loss: 0.6155, test_loss: 0.9392, test_f1: 0.6524
 epoch: 35, train_loss: 0.5789, test_loss: 0.9571, test_f1: 0.6156
 epoch: 36, train_loss: 0.5861, test_loss: 0.8694, test_f1: 0.6256
 epoch: 37, train_loss: 0.6024, test_loss: 1.1402, test_f1: 0.6485
 epoch: 38, train_loss: 0.5862, test_loss: 1.0622, test_f1: 0.6425
 epoch: 39, train_loss: 0.5677, test_loss: 0.9850, test_f1: 0.6317
 epoch: 40, train_loss: 0.5614, test_loss: 0.9289, test_f1: 0.6351
 epoch: 41, train_loss: 0.5432, test_loss: 0.9834, test_f1: 0.5815
 epoch: 42, train_loss: 0.5599, test_loss: 0.9325, test_f1: 0.6731
 epoch: 43, train_loss: 0.5727, test_loss: 1.3535, test_f1: 0.6351
 epoch: 44, train_loss: 0.5494, test_loss: 0.8253, test_f1: 0.6265
 epoch: 45, train_loss: 0.5376, test_loss: 1.0853, test_f1: 0.6074
 epoch: 46, train_loss: 0.5450, test_loss: 0.9051, test_f1: 0.6499
 epoch: 47, train_loss: 0.5257, test_loss: 1.1872, test_f1: 0.6295
 epoch: 48, train_loss: 0.5363, test_loss: 0.9958, test_f1: 0.6348
 epoch: 49, train_loss: 0.5176, test_loss: 1.0357, test_f1: 0.6452
 epoch: 50, train_loss: 0.5082, test_loss: 1.1486, test_f1: 0.6411
 epoch: 51, train_loss: 0.5018, test_loss: 1.1293, test_f1: 0.6121
 epoch: 52, train_loss: 0.4554, test_loss: 1.1351, test_f1: 0.6295
 epoch: 53, train_loss: 0.4606, test_loss: 1.2287, test_f1: 0.6304
 epoch: 54, train_loss: 0.4390, test_loss: 1.0404, test_f1: 0.6203
 epoch: 55, train_loss: 0.4427, test_loss: 1.1398, test_f1: 0.6368
 epoch: 56, train_loss: 0.4330, test_loss: 1.1826, test_f1: 0.6355
 epoch: 57, train_loss: 0.4310, test_loss: 1.1588, test_f1: 0.6424
 epoch: 58, train_loss: 0.4241, test_loss: 1.3122, test_f1: 0.6380
 epoch: 59, train_loss: 0.4211, test_loss: 1.2902, test_f1: 0.6374
 epoch: 60, train_loss: 0.4334, test_loss: 1.3066, test_f1: 0.6174
 epoch: 61, train_loss: 0.4182, test_loss: 1.3210, test_f1: 0.6566
 epoch: 62, train_loss: 0.4036, test_loss: 1.2293, test_f1: 0.6506
 epoch: 63, train_loss: 0.4223, test_loss: 1.0118, test_f1: 0.6374
 epoch: 64, train_loss: 0.4043, test_loss: 1.2218, test_f1: 0.6161
 epoch: 65, train_loss: 0.3939, test_loss: 1.4943, test_f1: 0.6295
 epoch: 66, train_loss: 0.3976, test_loss: 1.1147, test_f1: 0.6571
 epoch: 67, train_loss: 0.3972, test_loss: 1.1396, test_f1: 0.6419
 epoch: 68, train_loss: 0.3808, test_loss: 1.4464, test_f1: 0.6534
 epoch: 69, train_loss: 0.3889, test_loss: 1.3799, test_f1: 0.6257
 epoch: 70, train_loss: 0.3962, test_loss: 1.2830, test_f1: 0.6185
 epoch: 71, train_loss: 0.3996, test_loss: 1.2774, test_f1: 0.6393
 epoch: 72, train_loss: 0.3941, test_loss: 1.1827, test_f1: 0.6303
 epoch: 73, train_loss: 0.3924, test_loss: 1.3030, test_f1: 0.6593
 epoch: 74, train_loss: 0.3982, test_loss: 1.5316, test_f1: 0.6292
 epoch: 75, train_loss: 0.3788, test_loss: 1.6572, test_f1: 0.6276
 epoch: 76, train_loss: 0.3657, test_loss: 1.4990, test_f1: 0.6259
 epoch: 77, train_loss: 0.3477, test_loss: 1.6059, test_f1: 0.6436
 epoch: 78, train_loss: 0.3729, test_loss: 1.5110, test_f1: 0.6595
 epoch: 79, train_loss: 0.3942, test_loss: 1.2512, test_f1: 0.6326
 epoch: 80, train_loss: 0.3828, test_loss: 1.4530, test_f1: 0.6248
 epoch: 81, train_loss: 0.3818, test_loss: 1.5550, test_f1: 0.6393
 epoch: 82, train_loss: 0.3754, test_loss: 1.5689, test_f1: 0.6248
 epoch: 83, train_loss: 0.3793, test_loss: 1.4021, test_f1: 0.6078
 epoch: 84, train_loss: 0.3605, test_loss: 1.5261, test_f1: 0.6216
 epoch: 85, train_loss: 0.3824, test_loss: 1.4164, test_f1: 0.6392
 epoch: 86, train_loss: 0.3588, test_loss: 1.6568, test_f1: 0.6753
 epoch: 87, train_loss: 0.3568, test_loss: 1.5587, test_f1: 0.6532
 epoch: 88, train_loss: 0.3280, test_loss: 1.5651, test_f1: 0.6396
 epoch: 89, train_loss: 0.3341, test_loss: 1.7414, test_f1: 0.6106
 epoch: 90, train_loss: 0.3374, test_loss: 1.5306, test_f1: 0.6354
 epoch: 91, train_loss: 0.3439, test_loss: 1.6764, test_f1: 0.6060
 epoch: 92, train_loss: 0.3265, test_loss: 1.6920, test_f1: 0.6279
 epoch: 93, train_loss: 0.3355, test_loss: 1.5826, test_f1: 0.6458
 epoch: 94, train_loss: 0.3323, test_loss: 1.8141, test_f1: 0.6438
 epoch: 95, train_loss: 0.3472, test_loss: 2.3069, test_f1: 0.5783
 epoch: 96, train_loss: 0.3505, test_loss: 1.7480, test_f1: 0.6569
 epoch: 97, train_loss: 0.3430, test_loss: 1.6284, test_f1: 0.6564
 epoch: 98, train_loss: 0.3337, test_loss: 1.5620, test_f1: 0.6488
 epoch: 99, train_loss: 0.3265, test_loss: 1.9467, test_f1: 0.6305
##################ITERATION #9 ****************************************
 epoch: 0, train_loss: 1.6925, test_loss: 1.3279, test_f1: 0.2270
 epoch: 1, train_loss: 1.0544, test_loss: 1.1347, test_f1: 0.3422
 epoch: 2, train_loss: 0.9892, test_loss: 1.0883, test_f1: 0.3580
 epoch: 3, train_loss: 0.9414, test_loss: 1.0163, test_f1: 0.4251
 epoch: 4, train_loss: 0.9231, test_loss: 0.9973, test_f1: 0.4745
 epoch: 5, train_loss: 0.9095, test_loss: 0.9810, test_f1: 0.4965
 epoch: 6, train_loss: 0.8738, test_loss: 0.9717, test_f1: 0.4915
 epoch: 7, train_loss: 0.8579, test_loss: 1.0128, test_f1: 0.4768
 epoch: 8, train_loss: 0.8436, test_loss: 0.9446, test_f1: 0.4860
 epoch: 9, train_loss: 0.8279, test_loss: 0.9468, test_f1: 0.5520
 epoch: 10, train_loss: 0.8283, test_loss: 0.9141, test_f1: 0.5520
 epoch: 11, train_loss: 0.8100, test_loss: 0.9423, test_f1: 0.5451
 epoch: 12, train_loss: 0.8047, test_loss: 0.9326, test_f1: 0.5439
 epoch: 13, train_loss: 0.7872, test_loss: 0.8947, test_f1: 0.5604
 epoch: 14, train_loss: 0.7666, test_loss: 0.8539, test_f1: 0.5972
 epoch: 15, train_loss: 0.7560, test_loss: 0.8859, test_f1: 0.6073
 epoch: 16, train_loss: 0.7512, test_loss: 0.9447, test_f1: 0.5511
 epoch: 17, train_loss: 0.7437, test_loss: 0.8888, test_f1: 0.5689
 epoch: 18, train_loss: 0.7387, test_loss: 0.8399, test_f1: 0.5771
 epoch: 19, train_loss: 0.7355, test_loss: 0.9098, test_f1: 0.5916
 epoch: 20, train_loss: 0.7454, test_loss: 0.8163, test_f1: 0.6156
 epoch: 21, train_loss: 0.7069, test_loss: 0.8292, test_f1: 0.6214
 epoch: 22, train_loss: 0.7008, test_loss: 0.8657, test_f1: 0.5861
 epoch: 23, train_loss: 0.6990, test_loss: 0.8797, test_f1: 0.5739
 epoch: 24, train_loss: 0.6791, test_loss: 0.8584, test_f1: 0.6127
 epoch: 25, train_loss: 0.6799, test_loss: 0.8673, test_f1: 0.6250
 epoch: 26, train_loss: 0.6778, test_loss: 0.9040, test_f1: 0.6199
 epoch: 27, train_loss: 0.6835, test_loss: 0.8221, test_f1: 0.6496
 epoch: 28, train_loss: 0.6745, test_loss: 0.9726, test_f1: 0.6238
 epoch: 29, train_loss: 0.6646, test_loss: 0.9037, test_f1: 0.6180
 epoch: 30, train_loss: 0.6540, test_loss: 1.0065, test_f1: 0.6062
 epoch: 31, train_loss: 0.6599, test_loss: 0.9060, test_f1: 0.5818
 epoch: 32, train_loss: 0.6341, test_loss: 0.9819, test_f1: 0.6213
 epoch: 33, train_loss: 0.6402, test_loss: 0.8815, test_f1: 0.6297
 epoch: 34, train_loss: 0.6177, test_loss: 0.9279, test_f1: 0.6135
 epoch: 35, train_loss: 0.6125, test_loss: 1.1648, test_f1: 0.5865
 epoch: 36, train_loss: 0.6305, test_loss: 0.9465, test_f1: 0.6420
 epoch: 37, train_loss: 0.6365, test_loss: 0.7625, test_f1: 0.6555
 epoch: 38, train_loss: 0.6234, test_loss: 1.6090, test_f1: 0.4849
 epoch: 39, train_loss: 0.6097, test_loss: 0.8276, test_f1: 0.6595
 epoch: 40, train_loss: 0.5971, test_loss: 0.9529, test_f1: 0.6585
 epoch: 41, train_loss: 0.6078, test_loss: 0.8837, test_f1: 0.6700
 epoch: 42, train_loss: 0.5880, test_loss: 0.9294, test_f1: 0.6801
 epoch: 43, train_loss: 0.5874, test_loss: 0.9470, test_f1: 0.6684
 epoch: 44, train_loss: 0.5493, test_loss: 0.9181, test_f1: 0.6434
 epoch: 45, train_loss: 0.5457, test_loss: 1.0062, test_f1: 0.6482
 epoch: 46, train_loss: 0.5584, test_loss: 1.0250, test_f1: 0.6223
 epoch: 47, train_loss: 0.5428, test_loss: 0.9953, test_f1: 0.6391
 epoch: 48, train_loss: 0.5300, test_loss: 1.0383, test_f1: 0.6582
 epoch: 49, train_loss: 0.5267, test_loss: 0.9031, test_f1: 0.6682
 epoch: 50, train_loss: 0.5225, test_loss: 0.9050, test_f1: 0.6569
 epoch: 51, train_loss: 0.4999, test_loss: 1.0245, test_f1: 0.6783
 epoch: 52, train_loss: 0.4946, test_loss: 1.0513, test_f1: 0.6958
 epoch: 53, train_loss: 0.4707, test_loss: 1.0560, test_f1: 0.6575
 epoch: 54, train_loss: 0.4551, test_loss: 1.1322, test_f1: 0.6677
 epoch: 55, train_loss: 0.4551, test_loss: 1.0668, test_f1: 0.6770
 epoch: 56, train_loss: 0.4398, test_loss: 1.1515, test_f1: 0.6833
 epoch: 57, train_loss: 0.4436, test_loss: 1.2542, test_f1: 0.6189
 epoch: 58, train_loss: 0.4436, test_loss: 1.1833, test_f1: 0.6665
 epoch: 59, train_loss: 0.4240, test_loss: 1.1044, test_f1: 0.6613
 epoch: 60, train_loss: 0.4227, test_loss: 1.0849, test_f1: 0.7022
 epoch: 61, train_loss: 0.4175, test_loss: 1.1525, test_f1: 0.6479
 epoch: 62, train_loss: 0.4256, test_loss: 1.1681, test_f1: 0.6629
 epoch: 63, train_loss: 0.4171, test_loss: 1.1151, test_f1: 0.6703
 epoch: 64, train_loss: 0.4170, test_loss: 1.1489, test_f1: 0.6620
 epoch: 65, train_loss: 0.4119, test_loss: 1.3124, test_f1: 0.6075
 epoch: 66, train_loss: 0.4141, test_loss: 1.2993, test_f1: 0.6337
 epoch: 67, train_loss: 0.3860, test_loss: 1.1829, test_f1: 0.6480
 epoch: 68, train_loss: 0.4245, test_loss: 1.2912, test_f1: 0.6100
 epoch: 69, train_loss: 0.3790, test_loss: 1.2783, test_f1: 0.6511
 epoch: 70, train_loss: 0.3853, test_loss: 1.2525, test_f1: 0.6512
 epoch: 71, train_loss: 0.4028, test_loss: 1.1414, test_f1: 0.6644
 epoch: 72, train_loss: 0.3887, test_loss: 1.3376, test_f1: 0.6347
 epoch: 73, train_loss: 0.3900, test_loss: 1.2086, test_f1: 0.6778
 epoch: 74, train_loss: 0.3886, test_loss: 1.3276, test_f1: 0.6050
 epoch: 75, train_loss: 0.4074, test_loss: 1.2696, test_f1: 0.6621
 epoch: 76, train_loss: 0.4001, test_loss: 1.4726, test_f1: 0.6413
 epoch: 77, train_loss: 0.3954, test_loss: 1.1348, test_f1: 0.6386
 epoch: 78, train_loss: 0.3787, test_loss: 1.3477, test_f1: 0.6558
 epoch: 79, train_loss: 0.3666, test_loss: 1.3861, test_f1: 0.6140
 epoch: 80, train_loss: 0.3733, test_loss: 1.3562, test_f1: 0.6201
 epoch: 81, train_loss: 0.3653, test_loss: 1.3515, test_f1: 0.6794
 epoch: 82, train_loss: 0.3616, test_loss: 1.3706, test_f1: 0.6366
 epoch: 83, train_loss: 0.4045, test_loss: 1.1512, test_f1: 0.6751
 epoch: 84, train_loss: 0.3992, test_loss: 1.3340, test_f1: 0.6426
 epoch: 85, train_loss: 0.3683, test_loss: 1.3603, test_f1: 0.6556
 epoch: 86, train_loss: 0.3643, test_loss: 1.5003, test_f1: 0.6216
 epoch: 87, train_loss: 0.3638, test_loss: 1.8799, test_f1: 0.5339
 epoch: 88, train_loss: 0.3663, test_loss: 1.3342, test_f1: 0.6331
 epoch: 89, train_loss: 0.3652, test_loss: 1.2627, test_f1: 0.6378
 epoch: 90, train_loss: 0.3465, test_loss: 1.4376, test_f1: 0.6385
 epoch: 91, train_loss: 0.3492, test_loss: 1.3650, test_f1: 0.6648
 epoch: 92, train_loss: 0.3252, test_loss: 1.3382, test_f1: 0.6690
 epoch: 93, train_loss: 0.3448, test_loss: 1.5452, test_f1: 0.6406
 epoch: 94, train_loss: 0.3336, test_loss: 1.5755, test_f1: 0.6345
 epoch: 95, train_loss: 0.3513, test_loss: 1.3959, test_f1: 0.6683
 epoch: 96, train_loss: 0.3330, test_loss: 1.3270, test_f1: 0.6450
 epoch: 97, train_loss: 0.3271, test_loss: 1.7699, test_f1: 0.5985
 epoch: 98, train_loss: 0.3274, test_loss: 1.5709, test_f1: 0.6417
 epoch: 99, train_loss: 0.3197, test_loss: 1.4394, test_f1: 0.6442

Training completed in 410.23 seconds
Best F1: 0.7153 at epoch 60
Mean F1 across iterations: 0.6871  0.0168
========================FINAL RESULTS================================
FEGIN weighted F1: 0.7153  0.0168
python main.py --data ltspice_examples --representation component_pin_net --model FEGIN --layers 2 --hiddens 64 --batch_size 256 --lr 0.01 --emb_size 128 --epochs 100 --save_appendix component_pin_net_L2_H64_BS256_LR0.01_E128 --no_val
-----



STDERR:
  File "main.py", line 370, in <module>
    main()
  File "main.py", line 254, in main
    dataset = dataset_class(
  File "/home/philip/projects/ltspice_examples_code_repo/Circuit-Completion-Using-GNNs/component_classification_with_link_prediction_head/evaluation/FEGIN/kernel/circuit_datasets.py", line 15, in __init__
    self.data, self.slices = torch.load(self.processed_paths[0])
  File "/home/philip/.local/lib/python3.8/site-packages/torch/serialization.py", line 1040, in load
    warnings.warn(
  File "/usr/lib/python3.8/warnings.py", line 109, in _showwarnmsg
    sw(msg.message, msg.category, msg.filename, msg.lineno,
  File "main.py", line 47, in warn_with_traceback
    traceback.print_stack(file=log)
/home/philip/projects/ltspice_examples_code_repo/Circuit-Completion-Using-GNNs/component_classification_with_link_prediction_head/evaluation/FEGIN/kernel/circuit_datasets.py:15: FutureWarning: You are using `torch.load` with `weights_only=False` (the current default value), which uses the default pickle module implicitly. It is possible to construct malicious pickle data which will execute arbitrary code during unpickling (See https://github.com/pytorch/pytorch/blob/main/SECURITY.md#untrusted-models for more details). In a future release, the default value for `weights_only` will be flipped to `True`. This limits the functions that could be executed during unpickling. Arbitrary objects will no longer be allowed to be loaded via this mode unless they are explicitly allowlisted by the user via `torch.serialization.add_safe_globals`. We recommend you start setting `weights_only=True` for any use case where you don't have full control of the loaded file. Please open an issue on GitHub for any issues related to this experimental feature.
  self.data, self.slices = torch.load(self.processed_paths[0])
