STDOUT:
Results will be saved in /home/philip/projects/ltspice_examples_code_repo/Circuit-Completion-Using-GNNs/component_classification_with_link_prediction_head/evaluation/FEGIN/results/model_FEGIN_dataset_ltspice_demos
Command line input: python main.py --data ltspice_demos --representation component_pin --model FEGIN --layers 3 --hiddens 128 --batch_size 32 --lr 0.001 --emb_size 128 --epochs 100 --save_appendix component_pin_L3_H128_BS32_LR0.001_E128 --no_val
 is saved.
-----
ltspice_demos - FEGIN
Using 3 layers, 128 hidden units, h = 2
Loading component_pin representation dataset
ENTERED
Training FEGIN on component_pin representation
Train: 1565, Test: 383
##################ITERATION #0 ****************************************
 epoch: 0, train_loss: 1.2015, test_loss: 1.2017, test_f1: 0.3770
 epoch: 1, train_loss: 0.9798, test_loss: 1.0305, test_f1: 0.4841
 epoch: 2, train_loss: 0.8970, test_loss: 1.0578, test_f1: 0.5352
 epoch: 3, train_loss: 0.8568, test_loss: 1.0073, test_f1: 0.6103
 epoch: 4, train_loss: 0.7952, test_loss: 1.0466, test_f1: 0.4740
 epoch: 5, train_loss: 0.7679, test_loss: 1.0388, test_f1: 0.5540
 epoch: 6, train_loss: 0.7716, test_loss: 1.0884, test_f1: 0.5612
 epoch: 7, train_loss: 0.7555, test_loss: 1.0332, test_f1: 0.5255
 epoch: 8, train_loss: 0.6916, test_loss: 0.9207, test_f1: 0.6560
 epoch: 9, train_loss: 0.6738, test_loss: 0.9750, test_f1: 0.6121
 epoch: 10, train_loss: 0.6584, test_loss: 1.1715, test_f1: 0.5828
 epoch: 11, train_loss: 0.6692, test_loss: 1.0376, test_f1: 0.6303
 epoch: 12, train_loss: 0.6352, test_loss: 1.0252, test_f1: 0.6211
 epoch: 13, train_loss: 0.6261, test_loss: 1.1686, test_f1: 0.5910
 epoch: 14, train_loss: 0.6078, test_loss: 1.1179, test_f1: 0.6232
 epoch: 15, train_loss: 0.5807, test_loss: 1.0992, test_f1: 0.5911
 epoch: 16, train_loss: 0.5732, test_loss: 1.1666, test_f1: 0.6196
 epoch: 17, train_loss: 0.5629, test_loss: 1.1177, test_f1: 0.5983
 epoch: 18, train_loss: 0.5729, test_loss: 1.2151, test_f1: 0.5556
 epoch: 19, train_loss: 0.5529, test_loss: 1.0041, test_f1: 0.6385
 epoch: 20, train_loss: 0.5272, test_loss: 1.2240, test_f1: 0.6336
 epoch: 21, train_loss: 0.5002, test_loss: 1.2651, test_f1: 0.6537
 epoch: 22, train_loss: 0.5092, test_loss: 1.3069, test_f1: 0.6126
 epoch: 23, train_loss: 0.4507, test_loss: 1.3001, test_f1: 0.6556
 epoch: 24, train_loss: 0.4760, test_loss: 1.2543, test_f1: 0.6216
 epoch: 25, train_loss: 0.4353, test_loss: 1.3129, test_f1: 0.6659
 epoch: 26, train_loss: 0.4427, test_loss: 1.2975, test_f1: 0.6306
 epoch: 27, train_loss: 0.4243, test_loss: 1.4284, test_f1: 0.6117
 epoch: 28, train_loss: 0.4285, test_loss: 1.3307, test_f1: 0.6635
 epoch: 29, train_loss: 0.4130, test_loss: 1.3731, test_f1: 0.6601
 epoch: 30, train_loss: 0.4168, test_loss: 1.2357, test_f1: 0.6550
 epoch: 31, train_loss: 0.3844, test_loss: 1.4384, test_f1: 0.6536
 epoch: 32, train_loss: 0.3549, test_loss: 1.2831, test_f1: 0.6531
 epoch: 33, train_loss: 0.3789, test_loss: 1.4854, test_f1: 0.6192
 epoch: 34, train_loss: 0.3913, test_loss: 1.4960, test_f1: 0.6520
 epoch: 35, train_loss: 0.3431, test_loss: 1.5630, test_f1: 0.6508
 epoch: 36, train_loss: 0.3173, test_loss: 1.5484, test_f1: 0.6349
 epoch: 37, train_loss: 0.3173, test_loss: 1.7356, test_f1: 0.6377
 epoch: 38, train_loss: 0.3063, test_loss: 1.6397, test_f1: 0.6220
 epoch: 39, train_loss: 0.3059, test_loss: 1.6272, test_f1: 0.6467
 epoch: 40, train_loss: 0.3120, test_loss: 1.6911, test_f1: 0.6294
 epoch: 41, train_loss: 0.3275, test_loss: 1.5495, test_f1: 0.6501
 epoch: 42, train_loss: 0.2714, test_loss: 1.5165, test_f1: 0.6726
 epoch: 43, train_loss: 0.2817, test_loss: 1.8025, test_f1: 0.6213
 epoch: 44, train_loss: 0.3069, test_loss: 1.5868, test_f1: 0.5823
 epoch: 45, train_loss: 0.3011, test_loss: 1.7122, test_f1: 0.6308
 epoch: 46, train_loss: 0.2620, test_loss: 1.7440, test_f1: 0.6292
 epoch: 47, train_loss: 0.2453, test_loss: 1.8087, test_f1: 0.6056
 epoch: 48, train_loss: 0.2574, test_loss: 1.7111, test_f1: 0.6557
 epoch: 49, train_loss: 0.2541, test_loss: 1.6237, test_f1: 0.6510
 epoch: 50, train_loss: 0.2142, test_loss: 1.8269, test_f1: 0.6363
 epoch: 51, train_loss: 0.1863, test_loss: 2.2866, test_f1: 0.6197
 epoch: 52, train_loss: 0.1688, test_loss: 1.8681, test_f1: 0.6444
 epoch: 53, train_loss: 0.1764, test_loss: 2.3142, test_f1: 0.6151
 epoch: 54, train_loss: 0.1771, test_loss: 2.1549, test_f1: 0.6451
 epoch: 55, train_loss: 0.1439, test_loss: 2.0520, test_f1: 0.6631
 epoch: 56, train_loss: 0.1410, test_loss: 2.1384, test_f1: 0.6061
 epoch: 57, train_loss: 0.1618, test_loss: 2.2194, test_f1: 0.6167
 epoch: 58, train_loss: 0.1407, test_loss: 2.2495, test_f1: 0.6173
 epoch: 59, train_loss: 0.1654, test_loss: 2.3201, test_f1: 0.6521
 epoch: 60, train_loss: 0.1387, test_loss: 2.3155, test_f1: 0.6510
 epoch: 61, train_loss: 0.1249, test_loss: 2.4520, test_f1: 0.6245
 epoch: 62, train_loss: 0.1481, test_loss: 2.5130, test_f1: 0.6063
 epoch: 63, train_loss: 0.1161, test_loss: 2.5332, test_f1: 0.6335
 epoch: 64, train_loss: 0.1214, test_loss: 2.7314, test_f1: 0.6107
 epoch: 65, train_loss: 0.1223, test_loss: 2.4490, test_f1: 0.6515
 epoch: 66, train_loss: 0.1233, test_loss: 2.6647, test_f1: 0.6074
 epoch: 67, train_loss: 0.1253, test_loss: 2.5683, test_f1: 0.6149
 epoch: 68, train_loss: 0.1534, test_loss: 2.6568, test_f1: 0.6347
 epoch: 69, train_loss: 0.1309, test_loss: 2.6057, test_f1: 0.6122
 epoch: 70, train_loss: 0.1143, test_loss: 2.7194, test_f1: 0.6190
 epoch: 71, train_loss: 0.1298, test_loss: 2.5989, test_f1: 0.6250
 epoch: 72, train_loss: 0.1347, test_loss: 2.5036, test_f1: 0.6183
 epoch: 73, train_loss: 0.1074, test_loss: 2.7314, test_f1: 0.6227
 epoch: 74, train_loss: 0.0994, test_loss: 2.9676, test_f1: 0.6076
 epoch: 75, train_loss: 0.1067, test_loss: 2.9712, test_f1: 0.6028
 epoch: 76, train_loss: 0.1165, test_loss: 2.8467, test_f1: 0.6052
 epoch: 77, train_loss: 0.1107, test_loss: 2.8668, test_f1: 0.6180
 epoch: 78, train_loss: 0.0995, test_loss: 2.7987, test_f1: 0.6054
 epoch: 79, train_loss: 0.1380, test_loss: 2.9425, test_f1: 0.6000
 epoch: 80, train_loss: 0.1438, test_loss: 2.4473, test_f1: 0.6376
 epoch: 81, train_loss: 0.0849, test_loss: 2.5697, test_f1: 0.6366
 epoch: 82, train_loss: 0.0889, test_loss: 3.0587, test_f1: 0.6175
 epoch: 83, train_loss: 0.0876, test_loss: 3.0430, test_f1: 0.6045
 epoch: 84, train_loss: 0.0834, test_loss: 2.6596, test_f1: 0.6228
 epoch: 85, train_loss: 0.0851, test_loss: 2.8898, test_f1: 0.6338
 epoch: 86, train_loss: 0.0796, test_loss: 2.8245, test_f1: 0.6706
 epoch: 87, train_loss: 0.1202, test_loss: 2.7651, test_f1: 0.6626
 epoch: 88, train_loss: 0.1291, test_loss: 2.7612, test_f1: 0.6417
 epoch: 89, train_loss: 0.1045, test_loss: 2.9164, test_f1: 0.6645
 epoch: 90, train_loss: 0.0896, test_loss: 3.0231, test_f1: 0.6402
 epoch: 91, train_loss: 0.0934, test_loss: 2.8606, test_f1: 0.6602
 epoch: 92, train_loss: 0.0942, test_loss: 2.7667, test_f1: 0.6668
 epoch: 93, train_loss: 0.0853, test_loss: 3.0087, test_f1: 0.5858
 epoch: 94, train_loss: 0.0870, test_loss: 2.8448, test_f1: 0.6471
 epoch: 95, train_loss: 0.1031, test_loss: 3.1209, test_f1: 0.6509
 epoch: 96, train_loss: 0.1071, test_loss: 3.0159, test_f1: 0.6087
 epoch: 97, train_loss: 0.1053, test_loss: 3.0165, test_f1: 0.6417
 epoch: 98, train_loss: 0.0904, test_loss: 2.5805, test_f1: 0.6470
 epoch: 99, train_loss: 0.0887, test_loss: 3.1845, test_f1: 0.6061
##################ITERATION #1 ****************************************
 epoch: 0, train_loss: 1.1118, test_loss: 1.1108, test_f1: 0.4292
 epoch: 1, train_loss: 0.9090, test_loss: 1.0004, test_f1: 0.5807
 epoch: 2, train_loss: 0.8247, test_loss: 1.0381, test_f1: 0.5723
 epoch: 3, train_loss: 0.7899, test_loss: 1.0172, test_f1: 0.5824
 epoch: 4, train_loss: 0.7650, test_loss: 1.0771, test_f1: 0.5552
 epoch: 5, train_loss: 0.7565, test_loss: 1.0757, test_f1: 0.5850
 epoch: 6, train_loss: 0.7161, test_loss: 1.0613, test_f1: 0.5110
 epoch: 7, train_loss: 0.6691, test_loss: 1.0800, test_f1: 0.6222
 epoch: 8, train_loss: 0.6897, test_loss: 1.1038, test_f1: 0.6274
 epoch: 9, train_loss: 0.6608, test_loss: 1.0232, test_f1: 0.5968
 epoch: 10, train_loss: 0.6359, test_loss: 0.9715, test_f1: 0.6334
 epoch: 11, train_loss: 0.6309, test_loss: 1.0804, test_f1: 0.6273
 epoch: 12, train_loss: 0.6002, test_loss: 1.1087, test_f1: 0.5568
 epoch: 13, train_loss: 0.5753, test_loss: 1.0958, test_f1: 0.6139
 epoch: 14, train_loss: 0.5678, test_loss: 1.1763, test_f1: 0.6167
 epoch: 15, train_loss: 0.5113, test_loss: 1.1500, test_f1: 0.6003
 epoch: 16, train_loss: 0.5353, test_loss: 1.0982, test_f1: 0.6486
 epoch: 17, train_loss: 0.4906, test_loss: 1.2517, test_f1: 0.6366
 epoch: 18, train_loss: 0.5430, test_loss: 1.3028, test_f1: 0.6074
 epoch: 19, train_loss: 0.4736, test_loss: 1.2151, test_f1: 0.6302
 epoch: 20, train_loss: 0.4627, test_loss: 1.4689, test_f1: 0.5552
 epoch: 21, train_loss: 0.4750, test_loss: 1.2366, test_f1: 0.6291
 epoch: 22, train_loss: 0.4245, test_loss: 1.3851, test_f1: 0.6096
 epoch: 23, train_loss: 0.4272, test_loss: 1.3286, test_f1: 0.6100
 epoch: 24, train_loss: 0.4066, test_loss: 1.2148, test_f1: 0.6569
 epoch: 25, train_loss: 0.4554, test_loss: 1.1343, test_f1: 0.6369
 epoch: 26, train_loss: 0.4101, test_loss: 1.2550, test_f1: 0.6773
 epoch: 27, train_loss: 0.3737, test_loss: 1.1815, test_f1: 0.6129
 epoch: 28, train_loss: 0.4029, test_loss: 1.5376, test_f1: 0.5957
 epoch: 29, train_loss: 0.3627, test_loss: 1.2703, test_f1: 0.6437
 epoch: 30, train_loss: 0.3700, test_loss: 1.1530, test_f1: 0.6670
 epoch: 31, train_loss: 0.3479, test_loss: 1.1680, test_f1: 0.6712
 epoch: 32, train_loss: 0.3391, test_loss: 1.4136, test_f1: 0.6121
 epoch: 33, train_loss: 0.3399, test_loss: 1.6093, test_f1: 0.6534
 epoch: 34, train_loss: 0.3165, test_loss: 1.6384, test_f1: 0.6280
 epoch: 35, train_loss: 0.3164, test_loss: 1.3278, test_f1: 0.5959
 epoch: 36, train_loss: 0.2959, test_loss: 1.8349, test_f1: 0.6169
 epoch: 37, train_loss: 0.2815, test_loss: 1.6112, test_f1: 0.6624
 epoch: 38, train_loss: 0.2886, test_loss: 1.8064, test_f1: 0.5927
 epoch: 39, train_loss: 0.3038, test_loss: 1.8245, test_f1: 0.6300
 epoch: 40, train_loss: 0.2817, test_loss: 1.6515, test_f1: 0.6547
 epoch: 41, train_loss: 0.2503, test_loss: 1.7934, test_f1: 0.5913
 epoch: 42, train_loss: 0.2636, test_loss: 1.7439, test_f1: 0.6253
 epoch: 43, train_loss: 0.2721, test_loss: 1.5967, test_f1: 0.6332
 epoch: 44, train_loss: 0.2440, test_loss: 1.4879, test_f1: 0.6467
 epoch: 45, train_loss: 0.2274, test_loss: 1.7363, test_f1: 0.6690
 epoch: 46, train_loss: 0.2624, test_loss: 1.7318, test_f1: 0.6162
 epoch: 47, train_loss: 0.2602, test_loss: 1.8051, test_f1: 0.6079
 epoch: 48, train_loss: 0.2438, test_loss: 1.9172, test_f1: 0.6055
 epoch: 49, train_loss: 0.2372, test_loss: 1.6808, test_f1: 0.6321
 epoch: 50, train_loss: 0.1926, test_loss: 2.0319, test_f1: 0.6301
 epoch: 51, train_loss: 0.1768, test_loss: 2.0628, test_f1: 0.6398
 epoch: 52, train_loss: 0.1313, test_loss: 2.2178, test_f1: 0.5907
 epoch: 53, train_loss: 0.1553, test_loss: 2.0742, test_f1: 0.6223
 epoch: 54, train_loss: 0.1341, test_loss: 2.3050, test_f1: 0.6096
 epoch: 55, train_loss: 0.1190, test_loss: 2.1805, test_f1: 0.6336
 epoch: 56, train_loss: 0.1313, test_loss: 2.5202, test_f1: 0.6259
 epoch: 57, train_loss: 0.1230, test_loss: 2.2322, test_f1: 0.6412
 epoch: 58, train_loss: 0.1333, test_loss: 2.2815, test_f1: 0.6512
 epoch: 59, train_loss: 0.1571, test_loss: 2.3538, test_f1: 0.6177
 epoch: 60, train_loss: 0.1236, test_loss: 2.4427, test_f1: 0.6425
 epoch: 61, train_loss: 0.1110, test_loss: 2.4687, test_f1: 0.6257
 epoch: 62, train_loss: 0.1116, test_loss: 2.4647, test_f1: 0.6201
 epoch: 63, train_loss: 0.1115, test_loss: 2.5734, test_f1: 0.6259
 epoch: 64, train_loss: 0.1131, test_loss: 2.6190, test_f1: 0.6284
 epoch: 65, train_loss: 0.1097, test_loss: 2.6338, test_f1: 0.6472
 epoch: 66, train_loss: 0.1194, test_loss: 2.5538, test_f1: 0.6358
 epoch: 67, train_loss: 0.1032, test_loss: 2.5244, test_f1: 0.6324
 epoch: 68, train_loss: 0.1094, test_loss: 2.4236, test_f1: 0.6198
 epoch: 69, train_loss: 0.1376, test_loss: 3.2918, test_f1: 0.5921
 epoch: 70, train_loss: 0.1511, test_loss: 2.6294, test_f1: 0.6119
 epoch: 71, train_loss: 0.1204, test_loss: 2.6906, test_f1: 0.6377
 epoch: 72, train_loss: 0.1146, test_loss: 2.7419, test_f1: 0.6145
 epoch: 73, train_loss: 0.0955, test_loss: 2.5467, test_f1: 0.6623
 epoch: 74, train_loss: 0.1066, test_loss: 2.5359, test_f1: 0.6287
 epoch: 75, train_loss: 0.1058, test_loss: 2.9441, test_f1: 0.6238
 epoch: 76, train_loss: 0.0991, test_loss: 2.8923, test_f1: 0.6218
 epoch: 77, train_loss: 0.0912, test_loss: 2.9451, test_f1: 0.6031
 epoch: 78, train_loss: 0.0816, test_loss: 3.1698, test_f1: 0.6090
 epoch: 79, train_loss: 0.0849, test_loss: 2.9800, test_f1: 0.6445
 epoch: 80, train_loss: 0.0825, test_loss: 2.9545, test_f1: 0.6238
 epoch: 81, train_loss: 0.1012, test_loss: 3.0785, test_f1: 0.6109
 epoch: 82, train_loss: 0.0879, test_loss: 2.8115, test_f1: 0.6547
 epoch: 83, train_loss: 0.1350, test_loss: 2.7259, test_f1: 0.6423
 epoch: 84, train_loss: 0.1176, test_loss: 2.7955, test_f1: 0.6416
 epoch: 85, train_loss: 0.0869, test_loss: 2.9815, test_f1: 0.6015
 epoch: 86, train_loss: 0.0719, test_loss: 3.0092, test_f1: 0.6035
 epoch: 87, train_loss: 0.0701, test_loss: 2.9980, test_f1: 0.6250
 epoch: 88, train_loss: 0.1155, test_loss: 3.0986, test_f1: 0.6042
 epoch: 89, train_loss: 0.0817, test_loss: 2.9867, test_f1: 0.6074
 epoch: 90, train_loss: 0.0877, test_loss: 2.7535, test_f1: 0.6488
 epoch: 91, train_loss: 0.0709, test_loss: 2.7692, test_f1: 0.6493
 epoch: 92, train_loss: 0.1041, test_loss: 3.1237, test_f1: 0.6033
 epoch: 93, train_loss: 0.0613, test_loss: 2.9381, test_f1: 0.6107
 epoch: 94, train_loss: 0.0780, test_loss: 3.0186, test_f1: 0.6435
 epoch: 95, train_loss: 0.0832, test_loss: 2.9243, test_f1: 0.6470
 epoch: 96, train_loss: 0.0592, test_loss: 3.1612, test_f1: 0.6302
 epoch: 97, train_loss: 0.0718, test_loss: 3.7350, test_f1: 0.5890
 epoch: 98, train_loss: 0.0879, test_loss: 3.0878, test_f1: 0.6362
 epoch: 99, train_loss: 0.1096, test_loss: 2.9980, test_f1: 0.5886
##################ITERATION #2 ****************************************
 epoch: 0, train_loss: 1.0790, test_loss: 1.2439, test_f1: 0.4404
 epoch: 1, train_loss: 0.9009, test_loss: 0.9633, test_f1: 0.6084
 epoch: 2, train_loss: 0.8186, test_loss: 0.9890, test_f1: 0.6152
 epoch: 3, train_loss: 0.7637, test_loss: 0.9690, test_f1: 0.5924
 epoch: 4, train_loss: 0.7380, test_loss: 1.2187, test_f1: 0.5107
 epoch: 5, train_loss: 0.7168, test_loss: 0.9728, test_f1: 0.6022
 epoch: 6, train_loss: 0.6896, test_loss: 0.9996, test_f1: 0.5965
 epoch: 7, train_loss: 0.6760, test_loss: 1.1711, test_f1: 0.5839
 epoch: 8, train_loss: 0.6340, test_loss: 1.2424, test_f1: 0.5475
 epoch: 9, train_loss: 0.6662, test_loss: 1.0319, test_f1: 0.5666
 epoch: 10, train_loss: 0.6295, test_loss: 1.3058, test_f1: 0.5929
 epoch: 11, train_loss: 0.5962, test_loss: 1.0784, test_f1: 0.5377
 epoch: 12, train_loss: 0.6123, test_loss: 1.1981, test_f1: 0.5734
 epoch: 13, train_loss: 0.5689, test_loss: 1.0678, test_f1: 0.6384
 epoch: 14, train_loss: 0.6105, test_loss: 1.1783, test_f1: 0.6047
 epoch: 15, train_loss: 0.5833, test_loss: 1.0741, test_f1: 0.6638
 epoch: 16, train_loss: 0.5498, test_loss: 1.0323, test_f1: 0.5969
 epoch: 17, train_loss: 0.5079, test_loss: 1.2684, test_f1: 0.6439
 epoch: 18, train_loss: 0.5176, test_loss: 1.1505, test_f1: 0.6273
 epoch: 19, train_loss: 0.5107, test_loss: 1.4013, test_f1: 0.6075
 epoch: 20, train_loss: 0.4855, test_loss: 1.3661, test_f1: 0.5807
 epoch: 21, train_loss: 0.4474, test_loss: 1.2672, test_f1: 0.6669
 epoch: 22, train_loss: 0.4478, test_loss: 1.3739, test_f1: 0.5764
 epoch: 23, train_loss: 0.4813, test_loss: 1.5951, test_f1: 0.5693
 epoch: 24, train_loss: 0.4527, test_loss: 1.3279, test_f1: 0.6399
 epoch: 25, train_loss: 0.4357, test_loss: 1.5976, test_f1: 0.5856
 epoch: 26, train_loss: 0.4257, test_loss: 1.5289, test_f1: 0.6086
 epoch: 27, train_loss: 0.4044, test_loss: 1.4861, test_f1: 0.6471
 epoch: 28, train_loss: 0.3860, test_loss: 1.4036, test_f1: 0.6376
 epoch: 29, train_loss: 0.3689, test_loss: 1.5653, test_f1: 0.6577
 epoch: 30, train_loss: 0.3950, test_loss: 1.3996, test_f1: 0.6008
 epoch: 31, train_loss: 0.3942, test_loss: 1.3813, test_f1: 0.6617
 epoch: 32, train_loss: 0.3329, test_loss: 1.6998, test_f1: 0.6539
 epoch: 33, train_loss: 0.3388, test_loss: 1.5002, test_f1: 0.6445
 epoch: 34, train_loss: 0.3728, test_loss: 1.4980, test_f1: 0.6101
 epoch: 35, train_loss: 0.3590, test_loss: 1.2817, test_f1: 0.6823
 epoch: 36, train_loss: 0.3289, test_loss: 1.3650, test_f1: 0.6749
 epoch: 37, train_loss: 0.3441, test_loss: 1.5224, test_f1: 0.5967
 epoch: 38, train_loss: 0.3499, test_loss: 1.8208, test_f1: 0.6256
 epoch: 39, train_loss: 0.2751, test_loss: 1.9507, test_f1: 0.6063
 epoch: 40, train_loss: 0.3093, test_loss: 1.7720, test_f1: 0.6799
 epoch: 41, train_loss: 0.3110, test_loss: 1.4199, test_f1: 0.7085
 epoch: 42, train_loss: 0.2599, test_loss: 1.8318, test_f1: 0.6165
 epoch: 43, train_loss: 0.2863, test_loss: 1.7898, test_f1: 0.5918
 epoch: 44, train_loss: 0.3140, test_loss: 1.8936, test_f1: 0.6434
 epoch: 45, train_loss: 0.2521, test_loss: 1.8466, test_f1: 0.6515
 epoch: 46, train_loss: 0.2570, test_loss: 1.8512, test_f1: 0.6565
 epoch: 47, train_loss: 0.2451, test_loss: 2.0517, test_f1: 0.6609
 epoch: 48, train_loss: 0.2299, test_loss: 2.1255, test_f1: 0.6138
 epoch: 49, train_loss: 0.2663, test_loss: 1.8283, test_f1: 0.6473
 epoch: 50, train_loss: 0.2789, test_loss: 1.9212, test_f1: 0.6668
 epoch: 51, train_loss: 0.2267, test_loss: 1.6756, test_f1: 0.6871
 epoch: 52, train_loss: 0.1660, test_loss: 2.0578, test_f1: 0.6801
 epoch: 53, train_loss: 0.1727, test_loss: 2.0514, test_f1: 0.6549
 epoch: 54, train_loss: 0.1395, test_loss: 2.2417, test_f1: 0.6599
 epoch: 55, train_loss: 0.1333, test_loss: 2.4704, test_f1: 0.6173
 epoch: 56, train_loss: 0.1559, test_loss: 2.5077, test_f1: 0.6357
 epoch: 57, train_loss: 0.1351, test_loss: 2.3856, test_f1: 0.6126
 epoch: 58, train_loss: 0.1437, test_loss: 2.4021, test_f1: 0.6279
 epoch: 59, train_loss: 0.1621, test_loss: 2.6007, test_f1: 0.6340
 epoch: 60, train_loss: 0.1366, test_loss: 2.5694, test_f1: 0.6336
 epoch: 61, train_loss: 0.1431, test_loss: 2.4438, test_f1: 0.6635
 epoch: 62, train_loss: 0.1450, test_loss: 2.8375, test_f1: 0.6334
 epoch: 63, train_loss: 0.1127, test_loss: 2.6955, test_f1: 0.6203
 epoch: 64, train_loss: 0.1445, test_loss: 2.8518, test_f1: 0.6235
 epoch: 65, train_loss: 0.1275, test_loss: 2.5846, test_f1: 0.6239
 epoch: 66, train_loss: 0.1230, test_loss: 2.9181, test_f1: 0.6451
 epoch: 67, train_loss: 0.1295, test_loss: 3.0458, test_f1: 0.6342
 epoch: 68, train_loss: 0.1496, test_loss: 2.8426, test_f1: 0.6231
 epoch: 69, train_loss: 0.1181, test_loss: 2.7640, test_f1: 0.6659
 epoch: 70, train_loss: 0.1297, test_loss: 2.5466, test_f1: 0.6524
 epoch: 71, train_loss: 0.1348, test_loss: 2.5590, test_f1: 0.6295
 epoch: 72, train_loss: 0.1092, test_loss: 2.7805, test_f1: 0.6643
 epoch: 73, train_loss: 0.1038, test_loss: 2.8154, test_f1: 0.6778
 epoch: 74, train_loss: 0.0930, test_loss: 2.6857, test_f1: 0.6557
 epoch: 75, train_loss: 0.0988, test_loss: 2.8850, test_f1: 0.6527
 epoch: 76, train_loss: 0.1187, test_loss: 2.7840, test_f1: 0.6696
 epoch: 77, train_loss: 0.1346, test_loss: 2.7689, test_f1: 0.6485
 epoch: 78, train_loss: 0.1365, test_loss: 2.6984, test_f1: 0.6423
 epoch: 79, train_loss: 0.1247, test_loss: 2.7560, test_f1: 0.6578
 epoch: 80, train_loss: 0.0871, test_loss: 2.9515, test_f1: 0.6409
 epoch: 81, train_loss: 0.0882, test_loss: 3.1405, test_f1: 0.6223
 epoch: 82, train_loss: 0.0926, test_loss: 2.8950, test_f1: 0.6561
 epoch: 83, train_loss: 0.1110, test_loss: 3.2153, test_f1: 0.6311
 epoch: 84, train_loss: 0.0871, test_loss: 3.3336, test_f1: 0.6241
 epoch: 85, train_loss: 0.0861, test_loss: 3.1055, test_f1: 0.6349
 epoch: 86, train_loss: 0.1038, test_loss: 3.0137, test_f1: 0.6537
 epoch: 87, train_loss: 0.1094, test_loss: 2.9621, test_f1: 0.6429
 epoch: 88, train_loss: 0.0913, test_loss: 3.0087, test_f1: 0.6179
 epoch: 89, train_loss: 0.1101, test_loss: 2.7231, test_f1: 0.6503
 epoch: 90, train_loss: 0.1028, test_loss: 2.8996, test_f1: 0.6793
 epoch: 91, train_loss: 0.1008, test_loss: 3.2292, test_f1: 0.6252
 epoch: 92, train_loss: 0.0965, test_loss: 3.0741, test_f1: 0.6581
 epoch: 93, train_loss: 0.0833, test_loss: 2.9150, test_f1: 0.6583
 epoch: 94, train_loss: 0.0757, test_loss: 3.1977, test_f1: 0.6472
 epoch: 95, train_loss: 0.0784, test_loss: 3.2676, test_f1: 0.6572
 epoch: 96, train_loss: 0.1023, test_loss: 3.4476, test_f1: 0.6325
 epoch: 97, train_loss: 0.1061, test_loss: 3.1185, test_f1: 0.6033
 epoch: 98, train_loss: 0.1000, test_loss: 3.0154, test_f1: 0.6453
 epoch: 99, train_loss: 0.1155, test_loss: 3.3275, test_f1: 0.6259
##################ITERATION #3 ****************************************
 epoch: 0, train_loss: 1.1550, test_loss: 1.3682, test_f1: 0.3972
 epoch: 1, train_loss: 0.9362, test_loss: 1.0062, test_f1: 0.5770
 epoch: 2, train_loss: 0.8536, test_loss: 1.0302, test_f1: 0.5570
 epoch: 3, train_loss: 0.8106, test_loss: 0.9700, test_f1: 0.6217
 epoch: 4, train_loss: 0.7784, test_loss: 0.9862, test_f1: 0.5675
 epoch: 5, train_loss: 0.7528, test_loss: 1.2692, test_f1: 0.5020
 epoch: 6, train_loss: 0.7263, test_loss: 0.9930, test_f1: 0.5951
 epoch: 7, train_loss: 0.6991, test_loss: 1.1062, test_f1: 0.5634
 epoch: 8, train_loss: 0.6778, test_loss: 1.0780, test_f1: 0.5861
 epoch: 9, train_loss: 0.6676, test_loss: 1.0444, test_f1: 0.5933
 epoch: 10, train_loss: 0.7107, test_loss: 1.1585, test_f1: 0.6226
 epoch: 11, train_loss: 0.6607, test_loss: 1.3474, test_f1: 0.5717
 epoch: 12, train_loss: 0.6378, test_loss: 1.2872, test_f1: 0.5441
 epoch: 13, train_loss: 0.6236, test_loss: 1.0749, test_f1: 0.5846
 epoch: 14, train_loss: 0.6290, test_loss: 1.1186, test_f1: 0.5681
 epoch: 15, train_loss: 0.6123, test_loss: 1.0435, test_f1: 0.6131
 epoch: 16, train_loss: 0.5843, test_loss: 1.1081, test_f1: 0.6340
 epoch: 17, train_loss: 0.5722, test_loss: 1.2554, test_f1: 0.5866
 epoch: 18, train_loss: 0.5939, test_loss: 1.0433, test_f1: 0.6017
 epoch: 19, train_loss: 0.5545, test_loss: 1.2355, test_f1: 0.5964
 epoch: 20, train_loss: 0.5570, test_loss: 1.2159, test_f1: 0.6091
 epoch: 21, train_loss: 0.5505, test_loss: 1.0071, test_f1: 0.6468
 epoch: 22, train_loss: 0.5249, test_loss: 1.1963, test_f1: 0.6450
 epoch: 23, train_loss: 0.5209, test_loss: 0.9617, test_f1: 0.6670
 epoch: 24, train_loss: 0.5045, test_loss: 1.1997, test_f1: 0.6141
 epoch: 25, train_loss: 0.4751, test_loss: 1.0650, test_f1: 0.6563
 epoch: 26, train_loss: 0.4486, test_loss: 1.1661, test_f1: 0.6524
 epoch: 27, train_loss: 0.4456, test_loss: 1.2805, test_f1: 0.6066
 epoch: 28, train_loss: 0.4431, test_loss: 1.2292, test_f1: 0.6342
 epoch: 29, train_loss: 0.4189, test_loss: 1.1597, test_f1: 0.6281
 epoch: 30, train_loss: 0.4112, test_loss: 1.3862, test_f1: 0.6229
 epoch: 31, train_loss: 0.4416, test_loss: 1.2332, test_f1: 0.6279
 epoch: 32, train_loss: 0.4543, test_loss: 1.5237, test_f1: 0.5888
 epoch: 33, train_loss: 0.4153, test_loss: 1.2652, test_f1: 0.6553
 epoch: 34, train_loss: 0.4438, test_loss: 1.2231, test_f1: 0.6388
 epoch: 35, train_loss: 0.4045, test_loss: 1.3417, test_f1: 0.6412
 epoch: 36, train_loss: 0.3672, test_loss: 1.3088, test_f1: 0.6615
 epoch: 37, train_loss: 0.3572, test_loss: 1.5786, test_f1: 0.6092
 epoch: 38, train_loss: 0.3541, test_loss: 1.3600, test_f1: 0.6595
 epoch: 39, train_loss: 0.3612, test_loss: 1.5768, test_f1: 0.6232
 epoch: 40, train_loss: 0.3449, test_loss: 1.1389, test_f1: 0.6844
 epoch: 41, train_loss: 0.3670, test_loss: 1.3769, test_f1: 0.6034
 epoch: 42, train_loss: 0.3379, test_loss: 1.3943, test_f1: 0.6415
 epoch: 43, train_loss: 0.3038, test_loss: 1.4673, test_f1: 0.6184
 epoch: 44, train_loss: 0.3022, test_loss: 1.7626, test_f1: 0.6081
 epoch: 45, train_loss: 0.3225, test_loss: 1.4692, test_f1: 0.6340
 epoch: 46, train_loss: 0.2923, test_loss: 1.3613, test_f1: 0.6578
 epoch: 47, train_loss: 0.3048, test_loss: 1.5404, test_f1: 0.5842
 epoch: 48, train_loss: 0.2730, test_loss: 1.5369, test_f1: 0.6006
 epoch: 49, train_loss: 0.3072, test_loss: 1.5190, test_f1: 0.6398
 epoch: 50, train_loss: 0.3052, test_loss: 1.6274, test_f1: 0.6190
 epoch: 51, train_loss: 0.2597, test_loss: 1.6044, test_f1: 0.6215
 epoch: 52, train_loss: 0.2428, test_loss: 1.6588, test_f1: 0.6311
 epoch: 53, train_loss: 0.2036, test_loss: 1.6992, test_f1: 0.6374
 epoch: 54, train_loss: 0.2123, test_loss: 1.6344, test_f1: 0.6446
 epoch: 55, train_loss: 0.2002, test_loss: 1.6120, test_f1: 0.6574
 epoch: 56, train_loss: 0.1986, test_loss: 1.8297, test_f1: 0.6013
 epoch: 57, train_loss: 0.2260, test_loss: 1.4997, test_f1: 0.6650
 epoch: 58, train_loss: 0.1887, test_loss: 1.6515, test_f1: 0.6454
 epoch: 59, train_loss: 0.1771, test_loss: 1.6842, test_f1: 0.6521
 epoch: 60, train_loss: 0.1600, test_loss: 1.8395, test_f1: 0.6196
 epoch: 61, train_loss: 0.1822, test_loss: 2.0125, test_f1: 0.6399
 epoch: 62, train_loss: 0.1649, test_loss: 2.1731, test_f1: 0.6001
 epoch: 63, train_loss: 0.1586, test_loss: 1.8689, test_f1: 0.6137
 epoch: 64, train_loss: 0.1457, test_loss: 1.9169, test_f1: 0.6268
 epoch: 65, train_loss: 0.1972, test_loss: 1.9013, test_f1: 0.6051
 epoch: 66, train_loss: 0.1830, test_loss: 2.1719, test_f1: 0.6157
 epoch: 67, train_loss: 0.1821, test_loss: 1.9286, test_f1: 0.6511
 epoch: 68, train_loss: 0.1679, test_loss: 1.8657, test_f1: 0.6101
 epoch: 69, train_loss: 0.1580, test_loss: 1.8877, test_f1: 0.6145
 epoch: 70, train_loss: 0.1505, test_loss: 2.0160, test_f1: 0.6309
 epoch: 71, train_loss: 0.1395, test_loss: 1.9602, test_f1: 0.6170
 epoch: 72, train_loss: 0.1457, test_loss: 2.0024, test_f1: 0.6109
 epoch: 73, train_loss: 0.1349, test_loss: 2.0505, test_f1: 0.6469
 epoch: 74, train_loss: 0.1671, test_loss: 2.1294, test_f1: 0.6189
 epoch: 75, train_loss: 0.1601, test_loss: 2.2109, test_f1: 0.6254
 epoch: 76, train_loss: 0.1351, test_loss: 2.0652, test_f1: 0.6330
 epoch: 77, train_loss: 0.1274, test_loss: 2.3628, test_f1: 0.6085
 epoch: 78, train_loss: 0.1026, test_loss: 2.3069, test_f1: 0.6257
 epoch: 79, train_loss: 0.1321, test_loss: 2.2882, test_f1: 0.6324
 epoch: 80, train_loss: 0.1501, test_loss: 2.2279, test_f1: 0.6199
 epoch: 81, train_loss: 0.1484, test_loss: 2.1167, test_f1: 0.6129
 epoch: 82, train_loss: 0.1296, test_loss: 1.9519, test_f1: 0.6046
 epoch: 83, train_loss: 0.1210, test_loss: 2.1239, test_f1: 0.6319
 epoch: 84, train_loss: 0.1171, test_loss: 2.2968, test_f1: 0.6272
 epoch: 85, train_loss: 0.1541, test_loss: 2.0853, test_f1: 0.6125
 epoch: 86, train_loss: 0.1066, test_loss: 2.0738, test_f1: 0.6653
 epoch: 87, train_loss: 0.1341, test_loss: 2.1924, test_f1: 0.6267
 epoch: 88, train_loss: 0.1090, test_loss: 2.0130, test_f1: 0.6516
 epoch: 89, train_loss: 0.1140, test_loss: 2.3646, test_f1: 0.6132
 epoch: 90, train_loss: 0.1119, test_loss: 2.2427, test_f1: 0.6077
 epoch: 91, train_loss: 0.1231, test_loss: 2.4344, test_f1: 0.6169
 epoch: 92, train_loss: 0.1251, test_loss: 2.4346, test_f1: 0.6212
 epoch: 93, train_loss: 0.1358, test_loss: 2.2647, test_f1: 0.5953
 epoch: 94, train_loss: 0.1118, test_loss: 2.0982, test_f1: 0.6175
 epoch: 95, train_loss: 0.1399, test_loss: 2.1250, test_f1: 0.6442
 epoch: 96, train_loss: 0.1084, test_loss: 2.1813, test_f1: 0.6433
 epoch: 97, train_loss: 0.0981, test_loss: 2.1216, test_f1: 0.6360
 epoch: 98, train_loss: 0.1143, test_loss: 2.4163, test_f1: 0.6060
 epoch: 99, train_loss: 0.0955, test_loss: 2.4585, test_f1: 0.6027
##################ITERATION #4 ****************************************
 epoch: 0, train_loss: 1.1497, test_loss: 1.3847, test_f1: 0.3606
 epoch: 1, train_loss: 0.9324, test_loss: 1.0215, test_f1: 0.5758
 epoch: 2, train_loss: 0.8429, test_loss: 1.0632, test_f1: 0.5162
 epoch: 3, train_loss: 0.7909, test_loss: 1.2125, test_f1: 0.5232
 epoch: 4, train_loss: 0.7782, test_loss: 1.0841, test_f1: 0.5697
 epoch: 5, train_loss: 0.7474, test_loss: 1.0542, test_f1: 0.5746
 epoch: 6, train_loss: 0.7291, test_loss: 0.9736, test_f1: 0.6202
 epoch: 7, train_loss: 0.6884, test_loss: 0.9966, test_f1: 0.6166
 epoch: 8, train_loss: 0.6525, test_loss: 1.0123, test_f1: 0.5310
 epoch: 9, train_loss: 0.6528, test_loss: 1.0882, test_f1: 0.5701
 epoch: 10, train_loss: 0.6849, test_loss: 0.9477, test_f1: 0.6680
 epoch: 11, train_loss: 0.6425, test_loss: 1.0327, test_f1: 0.6105
 epoch: 12, train_loss: 0.6155, test_loss: 1.1406, test_f1: 0.5704
 epoch: 13, train_loss: 0.6359, test_loss: 0.9709, test_f1: 0.5866
 epoch: 14, train_loss: 0.5979, test_loss: 1.0217, test_f1: 0.6076
 epoch: 15, train_loss: 0.6044, test_loss: 1.0816, test_f1: 0.5979
 epoch: 16, train_loss: 0.5478, test_loss: 1.0691, test_f1: 0.6155
 epoch: 17, train_loss: 0.5406, test_loss: 1.0139, test_f1: 0.5849
 epoch: 18, train_loss: 0.5572, test_loss: 1.0655, test_f1: 0.6783
 epoch: 19, train_loss: 0.5154, test_loss: 1.0468, test_f1: 0.5919
 epoch: 20, train_loss: 0.4964, test_loss: 1.1361, test_f1: 0.6344
 epoch: 21, train_loss: 0.4798, test_loss: 1.1685, test_f1: 0.5805
 epoch: 22, train_loss: 0.4868, test_loss: 1.0559, test_f1: 0.6005
 epoch: 23, train_loss: 0.4869, test_loss: 1.0683, test_f1: 0.5997
 epoch: 24, train_loss: 0.4612, test_loss: 1.2461, test_f1: 0.6279
 epoch: 25, train_loss: 0.4508, test_loss: 1.2225, test_f1: 0.6249
 epoch: 26, train_loss: 0.4344, test_loss: 1.2382, test_f1: 0.6406
 epoch: 27, train_loss: 0.4235, test_loss: 1.2327, test_f1: 0.6350
 epoch: 28, train_loss: 0.4445, test_loss: 1.3363, test_f1: 0.6486
 epoch: 29, train_loss: 0.4121, test_loss: 1.5033, test_f1: 0.5921
 epoch: 30, train_loss: 0.4035, test_loss: 1.1149, test_f1: 0.6513
 epoch: 31, train_loss: 0.3707, test_loss: 1.4033, test_f1: 0.6075
 epoch: 32, train_loss: 0.3814, test_loss: 1.3721, test_f1: 0.6143
 epoch: 33, train_loss: 0.3721, test_loss: 1.4793, test_f1: 0.6380
 epoch: 34, train_loss: 0.4004, test_loss: 1.2286, test_f1: 0.6816
 epoch: 35, train_loss: 0.3399, test_loss: 1.3372, test_f1: 0.6784
 epoch: 36, train_loss: 0.3445, test_loss: 1.5609, test_f1: 0.6220
 epoch: 37, train_loss: 0.3729, test_loss: 1.3886, test_f1: 0.6251
 epoch: 38, train_loss: 0.3170, test_loss: 1.7955, test_f1: 0.5944
 epoch: 39, train_loss: 0.3974, test_loss: 1.5449, test_f1: 0.5692
 epoch: 40, train_loss: 0.3018, test_loss: 1.4543, test_f1: 0.6113
 epoch: 41, train_loss: 0.2948, test_loss: 1.5015, test_f1: 0.6432
 epoch: 42, train_loss: 0.2828, test_loss: 1.4649, test_f1: 0.7115
 epoch: 43, train_loss: 0.2763, test_loss: 1.6308, test_f1: 0.6338
 epoch: 44, train_loss: 0.2967, test_loss: 1.7445, test_f1: 0.6235
 epoch: 45, train_loss: 0.3246, test_loss: 1.6526, test_f1: 0.6457
 epoch: 46, train_loss: 0.2718, test_loss: 1.6354, test_f1: 0.6732
 epoch: 47, train_loss: 0.2523, test_loss: 1.7711, test_f1: 0.6534
 epoch: 48, train_loss: 0.2894, test_loss: 1.6983, test_f1: 0.6742
 epoch: 49, train_loss: 0.2417, test_loss: 2.0960, test_f1: 0.5941
 epoch: 50, train_loss: 0.2192, test_loss: 2.0167, test_f1: 0.6085
 epoch: 51, train_loss: 0.2396, test_loss: 1.8552, test_f1: 0.6396
 epoch: 52, train_loss: 0.1858, test_loss: 1.8538, test_f1: 0.6517
 epoch: 53, train_loss: 0.1697, test_loss: 2.0380, test_f1: 0.6257
 epoch: 54, train_loss: 0.1685, test_loss: 2.1054, test_f1: 0.6317
 epoch: 55, train_loss: 0.1601, test_loss: 1.9594, test_f1: 0.6611
 epoch: 56, train_loss: 0.1502, test_loss: 2.1403, test_f1: 0.6329
 epoch: 57, train_loss: 0.1644, test_loss: 1.9993, test_f1: 0.6237
 epoch: 58, train_loss: 0.1399, test_loss: 2.1568, test_f1: 0.6183
 epoch: 59, train_loss: 0.1332, test_loss: 2.3121, test_f1: 0.6157
 epoch: 60, train_loss: 0.1356, test_loss: 2.2175, test_f1: 0.6165
 epoch: 61, train_loss: 0.1591, test_loss: 2.3722, test_f1: 0.6347
 epoch: 62, train_loss: 0.1496, test_loss: 2.2158, test_f1: 0.6004
 epoch: 63, train_loss: 0.1321, test_loss: 2.6563, test_f1: 0.5938
 epoch: 64, train_loss: 0.1525, test_loss: 2.0095, test_f1: 0.6545
 epoch: 65, train_loss: 0.1493, test_loss: 2.3727, test_f1: 0.6221
 epoch: 66, train_loss: 0.1340, test_loss: 2.2908, test_f1: 0.6328
 epoch: 67, train_loss: 0.1189, test_loss: 2.3152, test_f1: 0.6443
 epoch: 68, train_loss: 0.1385, test_loss: 2.3825, test_f1: 0.6287
 epoch: 69, train_loss: 0.1423, test_loss: 2.4355, test_f1: 0.5965
 epoch: 70, train_loss: 0.1431, test_loss: 2.1583, test_f1: 0.6328
 epoch: 71, train_loss: 0.1633, test_loss: 2.1710, test_f1: 0.6320
 epoch: 72, train_loss: 0.1402, test_loss: 2.2906, test_f1: 0.6238
 epoch: 73, train_loss: 0.1380, test_loss: 2.5037, test_f1: 0.5988
 epoch: 74, train_loss: 0.1120, test_loss: 2.4140, test_f1: 0.6204
 epoch: 75, train_loss: 0.1231, test_loss: 2.3755, test_f1: 0.6589
 epoch: 76, train_loss: 0.1111, test_loss: 2.4816, test_f1: 0.6240
 epoch: 77, train_loss: 0.1202, test_loss: 2.6493, test_f1: 0.6081
 epoch: 78, train_loss: 0.1077, test_loss: 2.5989, test_f1: 0.6407
 epoch: 79, train_loss: 0.1204, test_loss: 2.4419, test_f1: 0.6328
 epoch: 80, train_loss: 0.1151, test_loss: 2.5038, test_f1: 0.6220
 epoch: 81, train_loss: 0.1170, test_loss: 2.5114, test_f1: 0.6125
 epoch: 82, train_loss: 0.0928, test_loss: 2.7509, test_f1: 0.6092
 epoch: 83, train_loss: 0.1470, test_loss: 2.7279, test_f1: 0.6033
 epoch: 84, train_loss: 0.1016, test_loss: 2.9174, test_f1: 0.5978
 epoch: 85, train_loss: 0.1040, test_loss: 3.0546, test_f1: 0.6078
 epoch: 86, train_loss: 0.1116, test_loss: 2.8978, test_f1: 0.6450
 epoch: 87, train_loss: 0.1073, test_loss: 2.7306, test_f1: 0.6194
 epoch: 88, train_loss: 0.0737, test_loss: 2.6481, test_f1: 0.6214
 epoch: 89, train_loss: 0.0972, test_loss: 2.5024, test_f1: 0.6357
 epoch: 90, train_loss: 0.1106, test_loss: 2.6365, test_f1: 0.6335
 epoch: 91, train_loss: 0.1150, test_loss: 2.7488, test_f1: 0.6211
 epoch: 92, train_loss: 0.1171, test_loss: 2.6521, test_f1: 0.6235
 epoch: 93, train_loss: 0.0968, test_loss: 2.6932, test_f1: 0.6392
 epoch: 94, train_loss: 0.1031, test_loss: 3.0276, test_f1: 0.5873
 epoch: 95, train_loss: 0.1085, test_loss: 2.6607, test_f1: 0.6192
 epoch: 96, train_loss: 0.1314, test_loss: 2.6585, test_f1: 0.6369
 epoch: 97, train_loss: 0.0964, test_loss: 2.8366, test_f1: 0.6301
 epoch: 98, train_loss: 0.0814, test_loss: 2.4266, test_f1: 0.6889
 epoch: 99, train_loss: 0.1256, test_loss: 2.5143, test_f1: 0.6334
##################ITERATION #5 ****************************************
 epoch: 0, train_loss: 1.2185, test_loss: 1.2026, test_f1: 0.3554
 epoch: 1, train_loss: 0.9547, test_loss: 1.0666, test_f1: 0.5352
 epoch: 2, train_loss: 0.8505, test_loss: 1.0218, test_f1: 0.5975
 epoch: 3, train_loss: 0.8251, test_loss: 1.0855, test_f1: 0.5434
 epoch: 4, train_loss: 0.7725, test_loss: 0.9808, test_f1: 0.6341
 epoch: 5, train_loss: 0.7695, test_loss: 1.0425, test_f1: 0.5148
 epoch: 6, train_loss: 0.7415, test_loss: 0.9956, test_f1: 0.5829
 epoch: 7, train_loss: 0.7159, test_loss: 1.1927, test_f1: 0.5445
 epoch: 8, train_loss: 0.6955, test_loss: 1.0423, test_f1: 0.6092
 epoch: 9, train_loss: 0.6952, test_loss: 1.0051, test_f1: 0.6013
 epoch: 10, train_loss: 0.6533, test_loss: 0.8901, test_f1: 0.6825
 epoch: 11, train_loss: 0.6341, test_loss: 0.9523, test_f1: 0.6226
 epoch: 12, train_loss: 0.6659, test_loss: 1.0978, test_f1: 0.6275
 epoch: 13, train_loss: 0.6731, test_loss: 1.0479, test_f1: 0.6629
 epoch: 14, train_loss: 0.6097, test_loss: 0.9635, test_f1: 0.5891
 epoch: 15, train_loss: 0.6367, test_loss: 0.9684, test_f1: 0.6324
 epoch: 16, train_loss: 0.5869, test_loss: 1.0630, test_f1: 0.6094
 epoch: 17, train_loss: 0.5455, test_loss: 1.0533, test_f1: 0.6183
 epoch: 18, train_loss: 0.5606, test_loss: 1.0856, test_f1: 0.6324
 epoch: 19, train_loss: 0.5617, test_loss: 1.0408, test_f1: 0.6299
 epoch: 20, train_loss: 0.5262, test_loss: 1.1241, test_f1: 0.5916
 epoch: 21, train_loss: 0.5236, test_loss: 1.1369, test_f1: 0.6201
 epoch: 22, train_loss: 0.5157, test_loss: 1.1722, test_f1: 0.6127
 epoch: 23, train_loss: 0.5374, test_loss: 1.0783, test_f1: 0.6829
 epoch: 24, train_loss: 0.4781, test_loss: 1.1490, test_f1: 0.6258
 epoch: 25, train_loss: 0.4891, test_loss: 1.1640, test_f1: 0.6032
 epoch: 26, train_loss: 0.4817, test_loss: 1.2640, test_f1: 0.6135
 epoch: 27, train_loss: 0.4662, test_loss: 1.1759, test_f1: 0.6225
 epoch: 28, train_loss: 0.4706, test_loss: 1.2286, test_f1: 0.6154
 epoch: 29, train_loss: 0.4264, test_loss: 1.3045, test_f1: 0.6309
 epoch: 30, train_loss: 0.4118, test_loss: 1.4946, test_f1: 0.5950
 epoch: 31, train_loss: 0.4418, test_loss: 1.2100, test_f1: 0.6060
 epoch: 32, train_loss: 0.3935, test_loss: 1.3394, test_f1: 0.6394
 epoch: 33, train_loss: 0.3827, test_loss: 1.2882, test_f1: 0.6306
 epoch: 34, train_loss: 0.3975, test_loss: 1.3945, test_f1: 0.5779
 epoch: 35, train_loss: 0.4220, test_loss: 1.1697, test_f1: 0.6493
 epoch: 36, train_loss: 0.4071, test_loss: 1.3415, test_f1: 0.5911
 epoch: 37, train_loss: 0.3418, test_loss: 1.6072, test_f1: 0.6073
 epoch: 38, train_loss: 0.3628, test_loss: 1.7874, test_f1: 0.5958
 epoch: 39, train_loss: 0.3581, test_loss: 1.4039, test_f1: 0.6226
 epoch: 40, train_loss: 0.3491, test_loss: 1.8258, test_f1: 0.5688
 epoch: 41, train_loss: 0.3629, test_loss: 1.3642, test_f1: 0.6125
 epoch: 42, train_loss: 0.3663, test_loss: 1.6394, test_f1: 0.5974
 epoch: 43, train_loss: 0.3470, test_loss: 1.5492, test_f1: 0.6115
 epoch: 44, train_loss: 0.3537, test_loss: 1.3228, test_f1: 0.6352
 epoch: 45, train_loss: 0.3270, test_loss: 1.5315, test_f1: 0.6452
 epoch: 46, train_loss: 0.3211, test_loss: 1.6076, test_f1: 0.5908
 epoch: 47, train_loss: 0.3127, test_loss: 1.6184, test_f1: 0.6125
 epoch: 48, train_loss: 0.2803, test_loss: 1.6818, test_f1: 0.5973
 epoch: 49, train_loss: 0.2955, test_loss: 1.4623, test_f1: 0.6190
 epoch: 50, train_loss: 0.2980, test_loss: 1.5662, test_f1: 0.5955
 epoch: 51, train_loss: 0.2074, test_loss: 1.6856, test_f1: 0.6416
 epoch: 52, train_loss: 0.2209, test_loss: 1.6444, test_f1: 0.6348
 epoch: 53, train_loss: 0.1963, test_loss: 1.7728, test_f1: 0.6250
 epoch: 54, train_loss: 0.1754, test_loss: 1.8643, test_f1: 0.6107
 epoch: 55, train_loss: 0.1831, test_loss: 2.0005, test_f1: 0.6159
 epoch: 56, train_loss: 0.1688, test_loss: 2.2915, test_f1: 0.5965
 epoch: 57, train_loss: 0.1761, test_loss: 1.8904, test_f1: 0.6371
 epoch: 58, train_loss: 0.1693, test_loss: 2.0954, test_f1: 0.6048
 epoch: 59, train_loss: 0.1944, test_loss: 2.0460, test_f1: 0.6229
 epoch: 60, train_loss: 0.1486, test_loss: 1.9523, test_f1: 0.6420
 epoch: 61, train_loss: 0.1820, test_loss: 2.0381, test_f1: 0.6104
 epoch: 62, train_loss: 0.1611, test_loss: 2.1114, test_f1: 0.5990
 epoch: 63, train_loss: 0.1562, test_loss: 2.0215, test_f1: 0.6218
 epoch: 64, train_loss: 0.1603, test_loss: 2.1809, test_f1: 0.6186
 epoch: 65, train_loss: 0.1482, test_loss: 2.1154, test_f1: 0.6384
 epoch: 66, train_loss: 0.1507, test_loss: 2.0973, test_f1: 0.6256
 epoch: 67, train_loss: 0.1865, test_loss: 2.1334, test_f1: 0.6635
 epoch: 68, train_loss: 0.1573, test_loss: 2.4060, test_f1: 0.6509
 epoch: 69, train_loss: 0.1397, test_loss: 2.2660, test_f1: 0.6583
 epoch: 70, train_loss: 0.1406, test_loss: 2.0661, test_f1: 0.6316
 epoch: 71, train_loss: 0.1532, test_loss: 2.1208, test_f1: 0.6326
 epoch: 72, train_loss: 0.1702, test_loss: 2.2177, test_f1: 0.6055
 epoch: 73, train_loss: 0.1501, test_loss: 2.0775, test_f1: 0.6180
 epoch: 74, train_loss: 0.1341, test_loss: 2.2251, test_f1: 0.6197
 epoch: 75, train_loss: 0.1405, test_loss: 2.6347, test_f1: 0.6152
 epoch: 76, train_loss: 0.1267, test_loss: 2.3759, test_f1: 0.5821
 epoch: 77, train_loss: 0.1461, test_loss: 2.5197, test_f1: 0.6329
 epoch: 78, train_loss: 0.1534, test_loss: 2.2305, test_f1: 0.6488
 epoch: 79, train_loss: 0.1181, test_loss: 2.4120, test_f1: 0.6249
 epoch: 80, train_loss: 0.1009, test_loss: 2.4793, test_f1: 0.6147
 epoch: 81, train_loss: 0.1137, test_loss: 2.4200, test_f1: 0.6153
 epoch: 82, train_loss: 0.1301, test_loss: 2.4664, test_f1: 0.6246
 epoch: 83, train_loss: 0.1076, test_loss: 2.5826, test_f1: 0.6210
 epoch: 84, train_loss: 0.1398, test_loss: 2.0988, test_f1: 0.6469
 epoch: 85, train_loss: 0.1074, test_loss: 2.4145, test_f1: 0.6180
 epoch: 86, train_loss: 0.0990, test_loss: 2.3049, test_f1: 0.6520
 epoch: 87, train_loss: 0.0898, test_loss: 2.4927, test_f1: 0.6223
 epoch: 88, train_loss: 0.1145, test_loss: 2.3967, test_f1: 0.6509
 epoch: 89, train_loss: 0.1428, test_loss: 2.2886, test_f1: 0.6198
 epoch: 90, train_loss: 0.1138, test_loss: 2.2823, test_f1: 0.6569
 epoch: 91, train_loss: 0.0980, test_loss: 2.4784, test_f1: 0.6589
 epoch: 92, train_loss: 0.1019, test_loss: 2.5688, test_f1: 0.6386
 epoch: 93, train_loss: 0.1107, test_loss: 2.8560, test_f1: 0.5978
 epoch: 94, train_loss: 0.1333, test_loss: 2.4069, test_f1: 0.6599
 epoch: 95, train_loss: 0.1297, test_loss: 2.3333, test_f1: 0.6215
 epoch: 96, train_loss: 0.1185, test_loss: 2.3884, test_f1: 0.6505
 epoch: 97, train_loss: 0.0805, test_loss: 2.7255, test_f1: 0.6173
 epoch: 98, train_loss: 0.0918, test_loss: 2.8007, test_f1: 0.6180
 epoch: 99, train_loss: 0.1031, test_loss: 2.7862, test_f1: 0.6143
##################ITERATION #6 ****************************************
 epoch: 0, train_loss: 1.1948, test_loss: 1.3478, test_f1: 0.2926
 epoch: 1, train_loss: 0.9303, test_loss: 1.1404, test_f1: 0.3847
 epoch: 2, train_loss: 0.8592, test_loss: 1.0845, test_f1: 0.5208
 epoch: 3, train_loss: 0.8124, test_loss: 1.0722, test_f1: 0.5240
 epoch: 4, train_loss: 0.7760, test_loss: 1.0582, test_f1: 0.5955
 epoch: 5, train_loss: 0.7602, test_loss: 0.9825, test_f1: 0.5964
 epoch: 6, train_loss: 0.7200, test_loss: 1.0441, test_f1: 0.6001
 epoch: 7, train_loss: 0.6883, test_loss: 0.9361, test_f1: 0.6221
 epoch: 8, train_loss: 0.6722, test_loss: 1.0127, test_f1: 0.5558
 epoch: 9, train_loss: 0.6821, test_loss: 0.9716, test_f1: 0.6135
 epoch: 10, train_loss: 0.6499, test_loss: 1.0348, test_f1: 0.5871
 epoch: 11, train_loss: 0.6311, test_loss: 1.0723, test_f1: 0.5995
 epoch: 12, train_loss: 0.6123, test_loss: 1.1650, test_f1: 0.5655
 epoch: 13, train_loss: 0.6148, test_loss: 1.0661, test_f1: 0.5606
 epoch: 14, train_loss: 0.5638, test_loss: 1.0368, test_f1: 0.5838
 epoch: 15, train_loss: 0.5748, test_loss: 1.0136, test_f1: 0.6744
 epoch: 16, train_loss: 0.5625, test_loss: 1.1500, test_f1: 0.5893
 epoch: 17, train_loss: 0.5350, test_loss: 1.1431, test_f1: 0.5190
 epoch: 18, train_loss: 0.5477, test_loss: 1.2554, test_f1: 0.5219
 epoch: 19, train_loss: 0.5107, test_loss: 1.2351, test_f1: 0.5374
 epoch: 20, train_loss: 0.4869, test_loss: 1.3827, test_f1: 0.5771
 epoch: 21, train_loss: 0.4857, test_loss: 1.1434, test_f1: 0.5490
 epoch: 22, train_loss: 0.5101, test_loss: 1.2549, test_f1: 0.5892
 epoch: 23, train_loss: 0.4648, test_loss: 1.2598, test_f1: 0.5746
 epoch: 24, train_loss: 0.4569, test_loss: 1.1840, test_f1: 0.6152
 epoch: 25, train_loss: 0.4255, test_loss: 1.2215, test_f1: 0.6127
 epoch: 26, train_loss: 0.4316, test_loss: 1.1208, test_f1: 0.6264
 epoch: 27, train_loss: 0.4108, test_loss: 1.0530, test_f1: 0.6466
 epoch: 28, train_loss: 0.3986, test_loss: 1.2456, test_f1: 0.6022
 epoch: 29, train_loss: 0.4269, test_loss: 1.2861, test_f1: 0.5846
 epoch: 30, train_loss: 0.3925, test_loss: 1.1213, test_f1: 0.6250
 epoch: 31, train_loss: 0.3437, test_loss: 1.3615, test_f1: 0.6037
 epoch: 32, train_loss: 0.3463, test_loss: 1.2409, test_f1: 0.6336
 epoch: 33, train_loss: 0.3742, test_loss: 1.5092, test_f1: 0.5488
 epoch: 34, train_loss: 0.4040, test_loss: 1.4284, test_f1: 0.6054
 epoch: 35, train_loss: 0.3555, test_loss: 1.3834, test_f1: 0.6075
 epoch: 36, train_loss: 0.3273, test_loss: 1.3396, test_f1: 0.6074
 epoch: 37, train_loss: 0.3102, test_loss: 1.6545, test_f1: 0.5454
 epoch: 38, train_loss: 0.3141, test_loss: 1.6039, test_f1: 0.5742
 epoch: 39, train_loss: 0.3337, test_loss: 1.2517, test_f1: 0.6452
 epoch: 40, train_loss: 0.3027, test_loss: 1.6193, test_f1: 0.6017
 epoch: 41, train_loss: 0.2613, test_loss: 1.5661, test_f1: 0.6025
 epoch: 42, train_loss: 0.2865, test_loss: 1.6376, test_f1: 0.5672
 epoch: 43, train_loss: 0.2839, test_loss: 1.6303, test_f1: 0.6087
 epoch: 44, train_loss: 0.3013, test_loss: 1.4953, test_f1: 0.6120
 epoch: 45, train_loss: 0.2926, test_loss: 1.6237, test_f1: 0.6204
 epoch: 46, train_loss: 0.2750, test_loss: 1.5975, test_f1: 0.5912
 epoch: 47, train_loss: 0.2573, test_loss: 1.5802, test_f1: 0.6106
 epoch: 48, train_loss: 0.2840, test_loss: 1.4060, test_f1: 0.6477
 epoch: 49, train_loss: 0.2541, test_loss: 1.6208, test_f1: 0.6124
 epoch: 50, train_loss: 0.2298, test_loss: 1.8279, test_f1: 0.6031
 epoch: 51, train_loss: 0.1771, test_loss: 1.8067, test_f1: 0.6311
 epoch: 52, train_loss: 0.1738, test_loss: 1.9887, test_f1: 0.6151
 epoch: 53, train_loss: 0.1523, test_loss: 1.8714, test_f1: 0.6045
 epoch: 54, train_loss: 0.1576, test_loss: 1.9660, test_f1: 0.6327
 epoch: 55, train_loss: 0.1323, test_loss: 2.0869, test_f1: 0.6136
 epoch: 56, train_loss: 0.1384, test_loss: 1.9690, test_f1: 0.6080
 epoch: 57, train_loss: 0.1447, test_loss: 2.0769, test_f1: 0.6211
 epoch: 58, train_loss: 0.1515, test_loss: 2.1515, test_f1: 0.5962
 epoch: 59, train_loss: 0.1393, test_loss: 2.1929, test_f1: 0.5976
 epoch: 60, train_loss: 0.1523, test_loss: 2.3621, test_f1: 0.5997
 epoch: 61, train_loss: 0.1400, test_loss: 2.2381, test_f1: 0.5868
 epoch: 62, train_loss: 0.1220, test_loss: 2.6305, test_f1: 0.5867
 epoch: 63, train_loss: 0.1322, test_loss: 2.2683, test_f1: 0.5960
 epoch: 64, train_loss: 0.1349, test_loss: 2.3112, test_f1: 0.6227
 epoch: 65, train_loss: 0.1467, test_loss: 2.1670, test_f1: 0.6508
 epoch: 66, train_loss: 0.1643, test_loss: 2.0909, test_f1: 0.6696
 epoch: 67, train_loss: 0.1569, test_loss: 2.4292, test_f1: 0.6152
 epoch: 68, train_loss: 0.1167, test_loss: 2.2344, test_f1: 0.6217
 epoch: 69, train_loss: 0.1277, test_loss: 2.3944, test_f1: 0.6168
 epoch: 70, train_loss: 0.1570, test_loss: 2.1238, test_f1: 0.6390
 epoch: 71, train_loss: 0.1226, test_loss: 2.4317, test_f1: 0.6206
 epoch: 72, train_loss: 0.1166, test_loss: 2.3923, test_f1: 0.6027
 epoch: 73, train_loss: 0.1202, test_loss: 2.6705, test_f1: 0.5907
 epoch: 74, train_loss: 0.1536, test_loss: 2.2031, test_f1: 0.6321
 epoch: 75, train_loss: 0.1384, test_loss: 2.2260, test_f1: 0.6162
 epoch: 76, train_loss: 0.1225, test_loss: 2.3779, test_f1: 0.6116
 epoch: 77, train_loss: 0.0963, test_loss: 2.7081, test_f1: 0.5935
 epoch: 78, train_loss: 0.1203, test_loss: 2.5925, test_f1: 0.5847
 epoch: 79, train_loss: 0.1129, test_loss: 2.5138, test_f1: 0.6052
 epoch: 80, train_loss: 0.1022, test_loss: 2.4609, test_f1: 0.5993
 epoch: 81, train_loss: 0.1226, test_loss: 2.6028, test_f1: 0.5790
 epoch: 82, train_loss: 0.1022, test_loss: 2.4048, test_f1: 0.5998
 epoch: 83, train_loss: 0.0954, test_loss: 2.5631, test_f1: 0.5991
 epoch: 84, train_loss: 0.1307, test_loss: 2.3023, test_f1: 0.6387
 epoch: 85, train_loss: 0.0938, test_loss: 2.3048, test_f1: 0.6199
 epoch: 86, train_loss: 0.1026, test_loss: 2.4994, test_f1: 0.5861
 epoch: 87, train_loss: 0.0820, test_loss: 2.8247, test_f1: 0.5809
 epoch: 88, train_loss: 0.0987, test_loss: 2.6170, test_f1: 0.6103
 epoch: 89, train_loss: 0.0790, test_loss: 2.7282, test_f1: 0.6146
 epoch: 90, train_loss: 0.1065, test_loss: 2.8665, test_f1: 0.6041
 epoch: 91, train_loss: 0.1089, test_loss: 2.6463, test_f1: 0.6065
 epoch: 92, train_loss: 0.1195, test_loss: 2.7109, test_f1: 0.6325
 epoch: 93, train_loss: 0.0853, test_loss: 2.9163, test_f1: 0.6067
 epoch: 94, train_loss: 0.0856, test_loss: 2.8533, test_f1: 0.5963
 epoch: 95, train_loss: 0.1126, test_loss: 2.7538, test_f1: 0.5970
 epoch: 96, train_loss: 0.1184, test_loss: 2.6652, test_f1: 0.5915
 epoch: 97, train_loss: 0.1007, test_loss: 2.6527, test_f1: 0.5781
 epoch: 98, train_loss: 0.1146, test_loss: 2.4468, test_f1: 0.6321
 epoch: 99, train_loss: 0.0891, test_loss: 3.1889, test_f1: 0.5755
##################ITERATION #7 ****************************************
 epoch: 0, train_loss: 1.2047, test_loss: 1.3423, test_f1: 0.2783
 epoch: 1, train_loss: 0.9111, test_loss: 1.0269, test_f1: 0.5320
 epoch: 2, train_loss: 0.8491, test_loss: 0.9524, test_f1: 0.5455
 epoch: 3, train_loss: 0.7669, test_loss: 0.9506, test_f1: 0.6036
 epoch: 4, train_loss: 0.7500, test_loss: 0.8893, test_f1: 0.6464
 epoch: 5, train_loss: 0.7427, test_loss: 0.9654, test_f1: 0.6101
 epoch: 6, train_loss: 0.7058, test_loss: 0.8835, test_f1: 0.6653
 epoch: 7, train_loss: 0.6788, test_loss: 1.1131, test_f1: 0.5587
 epoch: 8, train_loss: 0.6696, test_loss: 0.9388, test_f1: 0.6379
 epoch: 9, train_loss: 0.6463, test_loss: 0.9962, test_f1: 0.6399
 epoch: 10, train_loss: 0.6545, test_loss: 0.9647, test_f1: 0.6417
 epoch: 11, train_loss: 0.6084, test_loss: 0.9399, test_f1: 0.6154
 epoch: 12, train_loss: 0.6083, test_loss: 1.1198, test_f1: 0.5568
 epoch: 13, train_loss: 0.5794, test_loss: 1.0996, test_f1: 0.5856
 epoch: 14, train_loss: 0.5637, test_loss: 0.9777, test_f1: 0.6854
 epoch: 15, train_loss: 0.5793, test_loss: 0.9775, test_f1: 0.6605
 epoch: 16, train_loss: 0.5542, test_loss: 1.0665, test_f1: 0.5944
 epoch: 17, train_loss: 0.5611, test_loss: 1.2135, test_f1: 0.6040
 epoch: 18, train_loss: 0.4943, test_loss: 1.1510, test_f1: 0.5942
 epoch: 19, train_loss: 0.5128, test_loss: 1.1450, test_f1: 0.6426
 epoch: 20, train_loss: 0.5028, test_loss: 1.1484, test_f1: 0.6337
 epoch: 21, train_loss: 0.5204, test_loss: 0.9848, test_f1: 0.6330
 epoch: 22, train_loss: 0.4489, test_loss: 1.3465, test_f1: 0.5953
 epoch: 23, train_loss: 0.4419, test_loss: 1.2078, test_f1: 0.5683
 epoch: 24, train_loss: 0.4421, test_loss: 1.2622, test_f1: 0.5678
 epoch: 25, train_loss: 0.4262, test_loss: 1.2842, test_f1: 0.6393
 epoch: 26, train_loss: 0.4293, test_loss: 1.2922, test_f1: 0.5845
 epoch: 27, train_loss: 0.4375, test_loss: 1.3188, test_f1: 0.6013
 epoch: 28, train_loss: 0.4261, test_loss: 1.2602, test_f1: 0.6063
 epoch: 29, train_loss: 0.4177, test_loss: 1.3508, test_f1: 0.5776
 epoch: 30, train_loss: 0.3762, test_loss: 1.2562, test_f1: 0.6081
 epoch: 31, train_loss: 0.4234, test_loss: 1.2260, test_f1: 0.5936
 epoch: 32, train_loss: 0.3967, test_loss: 1.2904, test_f1: 0.5863
 epoch: 33, train_loss: 0.3923, test_loss: 1.4040, test_f1: 0.6076
 epoch: 34, train_loss: 0.3509, test_loss: 1.6340, test_f1: 0.5811
 epoch: 35, train_loss: 0.3236, test_loss: 1.5013, test_f1: 0.6133
 epoch: 36, train_loss: 0.3772, test_loss: 1.8820, test_f1: 0.5544
 epoch: 37, train_loss: 0.3637, test_loss: 1.3248, test_f1: 0.6075
 epoch: 38, train_loss: 0.3493, test_loss: 1.5794, test_f1: 0.5924
 epoch: 39, train_loss: 0.2877, test_loss: 1.7789, test_f1: 0.5848
 epoch: 40, train_loss: 0.3310, test_loss: 1.3526, test_f1: 0.6869
 epoch: 41, train_loss: 0.3199, test_loss: 1.5771, test_f1: 0.6721
 epoch: 42, train_loss: 0.3166, test_loss: 1.6750, test_f1: 0.5927
 epoch: 43, train_loss: 0.3237, test_loss: 1.6584, test_f1: 0.5856
 epoch: 44, train_loss: 0.2915, test_loss: 1.5492, test_f1: 0.6600
 epoch: 45, train_loss: 0.2800, test_loss: 1.7618, test_f1: 0.5860
 epoch: 46, train_loss: 0.3312, test_loss: 1.6916, test_f1: 0.5878
 epoch: 47, train_loss: 0.3548, test_loss: 1.5767, test_f1: 0.5816
 epoch: 48, train_loss: 0.2962, test_loss: 1.7406, test_f1: 0.6043
 epoch: 49, train_loss: 0.2716, test_loss: 1.6217, test_f1: 0.6482
 epoch: 50, train_loss: 0.2730, test_loss: 1.9024, test_f1: 0.6011
 epoch: 51, train_loss: 0.2309, test_loss: 1.7582, test_f1: 0.5928
 epoch: 52, train_loss: 0.1845, test_loss: 2.0960, test_f1: 0.5580
 epoch: 53, train_loss: 0.1796, test_loss: 2.0859, test_f1: 0.5800
 epoch: 54, train_loss: 0.1551, test_loss: 2.2284, test_f1: 0.5870
 epoch: 55, train_loss: 0.1794, test_loss: 2.1608, test_f1: 0.5904
 epoch: 56, train_loss: 0.1825, test_loss: 2.0827, test_f1: 0.5957
 epoch: 57, train_loss: 0.1533, test_loss: 2.1615, test_f1: 0.6029
 epoch: 58, train_loss: 0.1555, test_loss: 2.0984, test_f1: 0.5865
 epoch: 59, train_loss: 0.1423, test_loss: 2.4005, test_f1: 0.5779
 epoch: 60, train_loss: 0.1422, test_loss: 2.3220, test_f1: 0.5755
 epoch: 61, train_loss: 0.1359, test_loss: 2.6389, test_f1: 0.5897
 epoch: 62, train_loss: 0.1311, test_loss: 2.4948, test_f1: 0.5928
 epoch: 63, train_loss: 0.1457, test_loss: 2.3811, test_f1: 0.5923
 epoch: 64, train_loss: 0.1520, test_loss: 2.5498, test_f1: 0.5744
 epoch: 65, train_loss: 0.1217, test_loss: 2.2932, test_f1: 0.6149
 epoch: 66, train_loss: 0.1705, test_loss: 2.5532, test_f1: 0.5682
 epoch: 67, train_loss: 0.1423, test_loss: 2.3309, test_f1: 0.5997
 epoch: 68, train_loss: 0.1108, test_loss: 2.6629, test_f1: 0.5731
 epoch: 69, train_loss: 0.1407, test_loss: 2.5528, test_f1: 0.5688
 epoch: 70, train_loss: 0.1344, test_loss: 2.4453, test_f1: 0.6042
 epoch: 71, train_loss: 0.1383, test_loss: 2.6983, test_f1: 0.6014
 epoch: 72, train_loss: 0.1290, test_loss: 2.5811, test_f1: 0.6262
 epoch: 73, train_loss: 0.1458, test_loss: 2.3843, test_f1: 0.5984
 epoch: 74, train_loss: 0.1277, test_loss: 2.5672, test_f1: 0.5729
 epoch: 75, train_loss: 0.1600, test_loss: 2.5205, test_f1: 0.5630
 epoch: 76, train_loss: 0.1173, test_loss: 2.5049, test_f1: 0.5973
 epoch: 77, train_loss: 0.1037, test_loss: 2.5452, test_f1: 0.6184
 epoch: 78, train_loss: 0.1198, test_loss: 2.8579, test_f1: 0.5696
 epoch: 79, train_loss: 0.1104, test_loss: 2.6668, test_f1: 0.6008
 epoch: 80, train_loss: 0.1214, test_loss: 2.4669, test_f1: 0.6112
 epoch: 81, train_loss: 0.1181, test_loss: 2.3803, test_f1: 0.6017
 epoch: 82, train_loss: 0.1106, test_loss: 2.7183, test_f1: 0.6106
 epoch: 83, train_loss: 0.1326, test_loss: 2.7746, test_f1: 0.6119
 epoch: 84, train_loss: 0.1127, test_loss: 2.6850, test_f1: 0.5909
 epoch: 85, train_loss: 0.1353, test_loss: 2.3207, test_f1: 0.5910
 epoch: 86, train_loss: 0.1050, test_loss: 2.6856, test_f1: 0.6121
 epoch: 87, train_loss: 0.0993, test_loss: 2.7507, test_f1: 0.5804
 epoch: 88, train_loss: 0.0977, test_loss: 2.6184, test_f1: 0.6311
 epoch: 89, train_loss: 0.1112, test_loss: 2.6007, test_f1: 0.5984
 epoch: 90, train_loss: 0.1046, test_loss: 2.6353, test_f1: 0.6279
 epoch: 91, train_loss: 0.1174, test_loss: 2.5215, test_f1: 0.6080
 epoch: 92, train_loss: 0.1239, test_loss: 2.5508, test_f1: 0.6269
 epoch: 93, train_loss: 0.1240, test_loss: 2.4924, test_f1: 0.6200
 epoch: 94, train_loss: 0.0916, test_loss: 2.5745, test_f1: 0.6112
 epoch: 95, train_loss: 0.0971, test_loss: 3.0370, test_f1: 0.5799
 epoch: 96, train_loss: 0.1247, test_loss: 2.7038, test_f1: 0.5620
 epoch: 97, train_loss: 0.0904, test_loss: 2.8363, test_f1: 0.6031
 epoch: 98, train_loss: 0.0916, test_loss: 2.6568, test_f1: 0.6388
 epoch: 99, train_loss: 0.1279, test_loss: 3.0559, test_f1: 0.5918
##################ITERATION #8 ****************************************
 epoch: 0, train_loss: 1.2106, test_loss: 1.1259, test_f1: 0.5797
 epoch: 1, train_loss: 0.9296, test_loss: 1.0067, test_f1: 0.5770
 epoch: 2, train_loss: 0.8568, test_loss: 0.9042, test_f1: 0.6320
 epoch: 3, train_loss: 0.8014, test_loss: 0.9466, test_f1: 0.6211
 epoch: 4, train_loss: 0.7679, test_loss: 0.9564, test_f1: 0.6394
 epoch: 5, train_loss: 0.7218, test_loss: 1.0786, test_f1: 0.5994
 epoch: 6, train_loss: 0.6880, test_loss: 1.0201, test_f1: 0.6522
 epoch: 7, train_loss: 0.7229, test_loss: 0.9762, test_f1: 0.5686
 epoch: 8, train_loss: 0.6803, test_loss: 1.0621, test_f1: 0.5479
 epoch: 9, train_loss: 0.6357, test_loss: 1.1071, test_f1: 0.6012
 epoch: 10, train_loss: 0.6709, test_loss: 0.9798, test_f1: 0.6345
 epoch: 11, train_loss: 0.6026, test_loss: 1.3304, test_f1: 0.5540
 epoch: 12, train_loss: 0.6207, test_loss: 1.0944, test_f1: 0.6444
 epoch: 13, train_loss: 0.5890, test_loss: 1.0599, test_f1: 0.6597
 epoch: 14, train_loss: 0.5941, test_loss: 1.0468, test_f1: 0.6358
 epoch: 15, train_loss: 0.5518, test_loss: 1.0967, test_f1: 0.5597
 epoch: 16, train_loss: 0.5446, test_loss: 1.1272, test_f1: 0.5927
 epoch: 17, train_loss: 0.5348, test_loss: 1.2926, test_f1: 0.5791
 epoch: 18, train_loss: 0.5131, test_loss: 1.3770, test_f1: 0.5562
 epoch: 19, train_loss: 0.5089, test_loss: 1.1875, test_f1: 0.6366
 epoch: 20, train_loss: 0.5310, test_loss: 1.2467, test_f1: 0.6802
 epoch: 21, train_loss: 0.4781, test_loss: 1.3740, test_f1: 0.6206
 epoch: 22, train_loss: 0.4897, test_loss: 1.2156, test_f1: 0.6008
 epoch: 23, train_loss: 0.5156, test_loss: 1.1274, test_f1: 0.5870
 epoch: 24, train_loss: 0.4737, test_loss: 1.1661, test_f1: 0.6600
 epoch: 25, train_loss: 0.4452, test_loss: 1.1329, test_f1: 0.6536
 epoch: 26, train_loss: 0.4506, test_loss: 1.1201, test_f1: 0.6315
 epoch: 27, train_loss: 0.4668, test_loss: 1.2806, test_f1: 0.5941
 epoch: 28, train_loss: 0.4396, test_loss: 1.4097, test_f1: 0.5961
 epoch: 29, train_loss: 0.4029, test_loss: 1.4187, test_f1: 0.6222
 epoch: 30, train_loss: 0.4054, test_loss: 1.4896, test_f1: 0.5848
 epoch: 31, train_loss: 0.4284, test_loss: 1.3039, test_f1: 0.5726
 epoch: 32, train_loss: 0.3889, test_loss: 1.3233, test_f1: 0.6398
 epoch: 33, train_loss: 0.3628, test_loss: 1.4566, test_f1: 0.6424
 epoch: 34, train_loss: 0.3543, test_loss: 1.6059, test_f1: 0.6170
 epoch: 35, train_loss: 0.3880, test_loss: 1.4087, test_f1: 0.6083
 epoch: 36, train_loss: 0.3577, test_loss: 1.2401, test_f1: 0.6775
 epoch: 37, train_loss: 0.3063, test_loss: 1.4233, test_f1: 0.6550
 epoch: 38, train_loss: 0.3659, test_loss: 1.7071, test_f1: 0.5766
 epoch: 39, train_loss: 0.2876, test_loss: 1.5987, test_f1: 0.6236
 epoch: 40, train_loss: 0.3353, test_loss: 2.2190, test_f1: 0.6100
 epoch: 41, train_loss: 0.3092, test_loss: 1.7228, test_f1: 0.5898
 epoch: 42, train_loss: 0.3092, test_loss: 1.7059, test_f1: 0.6343
 epoch: 43, train_loss: 0.2955, test_loss: 1.9650, test_f1: 0.5741
 epoch: 44, train_loss: 0.2688, test_loss: 1.7613, test_f1: 0.6251
 epoch: 45, train_loss: 0.2465, test_loss: 1.6613, test_f1: 0.6476
 epoch: 46, train_loss: 0.2572, test_loss: 1.7195, test_f1: 0.6377
 epoch: 47, train_loss: 0.3073, test_loss: 1.5964, test_f1: 0.6419
 epoch: 48, train_loss: 0.2887, test_loss: 1.8342, test_f1: 0.6171
 epoch: 49, train_loss: 0.2552, test_loss: 1.6699, test_f1: 0.6269
 epoch: 50, train_loss: 0.2383, test_loss: 1.8688, test_f1: 0.5902
 epoch: 51, train_loss: 0.2128, test_loss: 2.1145, test_f1: 0.6191
 epoch: 52, train_loss: 0.1738, test_loss: 1.9633, test_f1: 0.6526
 epoch: 53, train_loss: 0.1650, test_loss: 2.0716, test_f1: 0.6556
 epoch: 54, train_loss: 0.1513, test_loss: 2.2454, test_f1: 0.6585
 epoch: 55, train_loss: 0.1594, test_loss: 2.0351, test_f1: 0.6419
 epoch: 56, train_loss: 0.1642, test_loss: 2.2840, test_f1: 0.6013
 epoch: 57, train_loss: 0.1631, test_loss: 2.3659, test_f1: 0.6073
 epoch: 58, train_loss: 0.1474, test_loss: 2.1232, test_f1: 0.6553
 epoch: 59, train_loss: 0.1656, test_loss: 2.1505, test_f1: 0.6173
 epoch: 60, train_loss: 0.1498, test_loss: 2.1910, test_f1: 0.6531
 epoch: 61, train_loss: 0.1794, test_loss: 2.2662, test_f1: 0.6402
 epoch: 62, train_loss: 0.1457, test_loss: 2.2644, test_f1: 0.6395
 epoch: 63, train_loss: 0.1273, test_loss: 2.2514, test_f1: 0.6709
 epoch: 64, train_loss: 0.0984, test_loss: 2.3839, test_f1: 0.6224
 epoch: 65, train_loss: 0.1295, test_loss: 2.3611, test_f1: 0.6700
 epoch: 66, train_loss: 0.1142, test_loss: 2.6286, test_f1: 0.6466
 epoch: 67, train_loss: 0.1374, test_loss: 2.6271, test_f1: 0.6076
 epoch: 68, train_loss: 0.1256, test_loss: 2.4240, test_f1: 0.6806
 epoch: 69, train_loss: 0.1512, test_loss: 2.4601, test_f1: 0.6385
 epoch: 70, train_loss: 0.1346, test_loss: 2.4557, test_f1: 0.6572
 epoch: 71, train_loss: 0.1555, test_loss: 2.4967, test_f1: 0.6452
 epoch: 72, train_loss: 0.1160, test_loss: 2.4379, test_f1: 0.6612
 epoch: 73, train_loss: 0.1298, test_loss: 2.2983, test_f1: 0.6648
 epoch: 74, train_loss: 0.1079, test_loss: 2.5512, test_f1: 0.6495
 epoch: 75, train_loss: 0.1130, test_loss: 2.3956, test_f1: 0.6663
 epoch: 76, train_loss: 0.1141, test_loss: 2.6079, test_f1: 0.6415
 epoch: 77, train_loss: 0.1370, test_loss: 2.3956, test_f1: 0.6372
 epoch: 78, train_loss: 0.0901, test_loss: 2.5074, test_f1: 0.6482
 epoch: 79, train_loss: 0.1028, test_loss: 2.7368, test_f1: 0.6495
 epoch: 80, train_loss: 0.1151, test_loss: 2.6080, test_f1: 0.6196
 epoch: 81, train_loss: 0.1210, test_loss: 2.5088, test_f1: 0.6434
 epoch: 82, train_loss: 0.1046, test_loss: 2.2703, test_f1: 0.6431
 epoch: 83, train_loss: 0.0828, test_loss: 2.6837, test_f1: 0.6676
 epoch: 84, train_loss: 0.0996, test_loss: 2.6034, test_f1: 0.6672
 epoch: 85, train_loss: 0.1046, test_loss: 2.5413, test_f1: 0.6634
 epoch: 86, train_loss: 0.0979, test_loss: 2.6033, test_f1: 0.6363
 epoch: 87, train_loss: 0.1130, test_loss: 2.8542, test_f1: 0.6131
 epoch: 88, train_loss: 0.1090, test_loss: 2.5887, test_f1: 0.6516
 epoch: 89, train_loss: 0.1087, test_loss: 2.5905, test_f1: 0.6671
 epoch: 90, train_loss: 0.1079, test_loss: 2.8129, test_f1: 0.6124
 epoch: 91, train_loss: 0.1101, test_loss: 2.6665, test_f1: 0.6271
 epoch: 92, train_loss: 0.0962, test_loss: 2.5386, test_f1: 0.6622
 epoch: 93, train_loss: 0.1083, test_loss: 2.5782, test_f1: 0.5907
 epoch: 94, train_loss: 0.0896, test_loss: 2.4925, test_f1: 0.6563
 epoch: 95, train_loss: 0.1170, test_loss: 2.3301, test_f1: 0.6522
 epoch: 96, train_loss: 0.0936, test_loss: 2.5533, test_f1: 0.6778
 epoch: 97, train_loss: 0.0901, test_loss: 2.5611, test_f1: 0.6587
 epoch: 98, train_loss: 0.0957, test_loss: 2.5610, test_f1: 0.6696
 epoch: 99, train_loss: 0.1059, test_loss: 2.6517, test_f1: 0.6176
##################ITERATION #9 ****************************************
 epoch: 0, train_loss: 1.2342, test_loss: 1.1703, test_f1: 0.4521
 epoch: 1, train_loss: 0.9185, test_loss: 1.0539, test_f1: 0.5432
 epoch: 2, train_loss: 0.8622, test_loss: 0.9588, test_f1: 0.5771
 epoch: 3, train_loss: 0.8042, test_loss: 0.9706, test_f1: 0.5665
 epoch: 4, train_loss: 0.7644, test_loss: 0.9795, test_f1: 0.5979
 epoch: 5, train_loss: 0.7410, test_loss: 1.0168, test_f1: 0.6209
 epoch: 6, train_loss: 0.7218, test_loss: 1.1492, test_f1: 0.5812
 epoch: 7, train_loss: 0.7044, test_loss: 1.1588, test_f1: 0.5736
 epoch: 8, train_loss: 0.7056, test_loss: 0.9850, test_f1: 0.5891
 epoch: 9, train_loss: 0.6506, test_loss: 1.0487, test_f1: 0.6035
 epoch: 10, train_loss: 0.6419, test_loss: 1.2118, test_f1: 0.5179
 epoch: 11, train_loss: 0.6317, test_loss: 1.2439, test_f1: 0.5450
 epoch: 12, train_loss: 0.6115, test_loss: 0.9275, test_f1: 0.6531
 epoch: 13, train_loss: 0.5995, test_loss: 1.1587, test_f1: 0.5897
 epoch: 14, train_loss: 0.6097, test_loss: 1.1381, test_f1: 0.5841
 epoch: 15, train_loss: 0.5951, test_loss: 0.9773, test_f1: 0.6320
 epoch: 16, train_loss: 0.5723, test_loss: 1.0169, test_f1: 0.6297
 epoch: 17, train_loss: 0.5815, test_loss: 1.0658, test_f1: 0.6118
 epoch: 18, train_loss: 0.5618, test_loss: 1.1746, test_f1: 0.5305
 epoch: 19, train_loss: 0.5489, test_loss: 1.0116, test_f1: 0.6340
 epoch: 20, train_loss: 0.5257, test_loss: 1.0265, test_f1: 0.6315
 epoch: 21, train_loss: 0.4879, test_loss: 1.4399, test_f1: 0.5834
 epoch: 22, train_loss: 0.5142, test_loss: 1.1879, test_f1: 0.5879
 epoch: 23, train_loss: 0.4964, test_loss: 1.0915, test_f1: 0.6250
 epoch: 24, train_loss: 0.4895, test_loss: 1.1702, test_f1: 0.6371
 epoch: 25, train_loss: 0.4699, test_loss: 1.1337, test_f1: 0.6550
 epoch: 26, train_loss: 0.4648, test_loss: 1.0636, test_f1: 0.6802
 epoch: 27, train_loss: 0.4254, test_loss: 1.2839, test_f1: 0.6102
 epoch: 28, train_loss: 0.4297, test_loss: 1.2363, test_f1: 0.6092
 epoch: 29, train_loss: 0.4119, test_loss: 1.2108, test_f1: 0.6249
 epoch: 30, train_loss: 0.4043, test_loss: 1.1427, test_f1: 0.6118
 epoch: 31, train_loss: 0.4121, test_loss: 1.4847, test_f1: 0.5825
 epoch: 32, train_loss: 0.3709, test_loss: 1.4248, test_f1: 0.6186
 epoch: 33, train_loss: 0.3777, test_loss: 1.4469, test_f1: 0.5956
 epoch: 34, train_loss: 0.4103, test_loss: 1.1341, test_f1: 0.6419
 epoch: 35, train_loss: 0.3722, test_loss: 1.4356, test_f1: 0.6196
 epoch: 36, train_loss: 0.3480, test_loss: 1.3756, test_f1: 0.6175
 epoch: 37, train_loss: 0.3705, test_loss: 1.3474, test_f1: 0.6412
 epoch: 38, train_loss: 0.3740, test_loss: 1.1945, test_f1: 0.6796
 epoch: 39, train_loss: 0.3487, test_loss: 1.2933, test_f1: 0.6519
 epoch: 40, train_loss: 0.3631, test_loss: 1.6435, test_f1: 0.6030
 epoch: 41, train_loss: 0.3726, test_loss: 1.3428, test_f1: 0.6342
 epoch: 42, train_loss: 0.3122, test_loss: 1.5478, test_f1: 0.6254
 epoch: 43, train_loss: 0.2933, test_loss: 1.3080, test_f1: 0.6410
 epoch: 44, train_loss: 0.2731, test_loss: 1.3448, test_f1: 0.6074
 epoch: 45, train_loss: 0.2638, test_loss: 1.5187, test_f1: 0.6341
 epoch: 46, train_loss: 0.3044, test_loss: 1.5348, test_f1: 0.6450
 epoch: 47, train_loss: 0.3001, test_loss: 1.4135, test_f1: 0.6360
 epoch: 48, train_loss: 0.2524, test_loss: 1.5682, test_f1: 0.6256
 epoch: 49, train_loss: 0.2578, test_loss: 1.9266, test_f1: 0.5754
 epoch: 50, train_loss: 0.2737, test_loss: 1.4295, test_f1: 0.6547
 epoch: 51, train_loss: 0.2327, test_loss: 1.6395, test_f1: 0.6207
 epoch: 52, train_loss: 0.1815, test_loss: 1.6727, test_f1: 0.6361
 epoch: 53, train_loss: 0.1976, test_loss: 1.5010, test_f1: 0.6805
 epoch: 54, train_loss: 0.1841, test_loss: 1.7327, test_f1: 0.6267
 epoch: 55, train_loss: 0.1989, test_loss: 1.7719, test_f1: 0.6172
 epoch: 56, train_loss: 0.1664, test_loss: 1.8504, test_f1: 0.6100
 epoch: 57, train_loss: 0.1469, test_loss: 1.8694, test_f1: 0.6383
 epoch: 58, train_loss: 0.1458, test_loss: 1.8666, test_f1: 0.6541
 epoch: 59, train_loss: 0.1363, test_loss: 2.0431, test_f1: 0.6150
 epoch: 60, train_loss: 0.1518, test_loss: 1.7509, test_f1: 0.6383
 epoch: 61, train_loss: 0.1488, test_loss: 1.9144, test_f1: 0.6570
 epoch: 62, train_loss: 0.1562, test_loss: 1.8973, test_f1: 0.6172
 epoch: 63, train_loss: 0.1383, test_loss: 2.0526, test_f1: 0.6112
 epoch: 64, train_loss: 0.1530, test_loss: 1.9691, test_f1: 0.6196
 epoch: 65, train_loss: 0.1448, test_loss: 2.2081, test_f1: 0.6011
 epoch: 66, train_loss: 0.1765, test_loss: 1.9465, test_f1: 0.5879
 epoch: 67, train_loss: 0.1655, test_loss: 1.9156, test_f1: 0.6066
 epoch: 68, train_loss: 0.1291, test_loss: 2.0531, test_f1: 0.5989
 epoch: 69, train_loss: 0.1386, test_loss: 1.8766, test_f1: 0.6175
 epoch: 70, train_loss: 0.1407, test_loss: 2.3049, test_f1: 0.6089
 epoch: 71, train_loss: 0.1380, test_loss: 2.3230, test_f1: 0.6128
 epoch: 72, train_loss: 0.1429, test_loss: 1.9984, test_f1: 0.6275
 epoch: 73, train_loss: 0.1605, test_loss: 2.3201, test_f1: 0.5633
 epoch: 74, train_loss: 0.1433, test_loss: 2.0826, test_f1: 0.6241
 epoch: 75, train_loss: 0.1295, test_loss: 2.4957, test_f1: 0.5649
 epoch: 76, train_loss: 0.1229, test_loss: 2.2632, test_f1: 0.5884
 epoch: 77, train_loss: 0.1377, test_loss: 2.0249, test_f1: 0.6400
 epoch: 78, train_loss: 0.1345, test_loss: 2.1045, test_f1: 0.6176
 epoch: 79, train_loss: 0.1257, test_loss: 2.0529, test_f1: 0.6379
 epoch: 80, train_loss: 0.1195, test_loss: 2.1326, test_f1: 0.6067
 epoch: 81, train_loss: 0.1064, test_loss: 2.2574, test_f1: 0.6001
 epoch: 82, train_loss: 0.1126, test_loss: 1.9608, test_f1: 0.6320
 epoch: 83, train_loss: 0.1409, test_loss: 2.3755, test_f1: 0.5945
 epoch: 84, train_loss: 0.1187, test_loss: 2.2211, test_f1: 0.6117
 epoch: 85, train_loss: 0.1173, test_loss: 2.2582, test_f1: 0.6333
 epoch: 86, train_loss: 0.1188, test_loss: 2.2334, test_f1: 0.6011
 epoch: 87, train_loss: 0.1051, test_loss: 2.2295, test_f1: 0.6248
 epoch: 88, train_loss: 0.1147, test_loss: 2.3301, test_f1: 0.6080
 epoch: 89, train_loss: 0.1240, test_loss: 2.3659, test_f1: 0.6042
 epoch: 90, train_loss: 0.1263, test_loss: 2.3447, test_f1: 0.6172
 epoch: 91, train_loss: 0.1091, test_loss: 2.3970, test_f1: 0.5832
 epoch: 92, train_loss: 0.1200, test_loss: 2.3055, test_f1: 0.6143
 epoch: 93, train_loss: 0.0982, test_loss: 2.4375, test_f1: 0.6091
 epoch: 94, train_loss: 0.1090, test_loss: 2.5330, test_f1: 0.6022
 epoch: 95, train_loss: 0.1060, test_loss: 2.4761, test_f1: 0.6056
 epoch: 96, train_loss: 0.1294, test_loss: 2.5239, test_f1: 0.5892
 epoch: 97, train_loss: 0.0955, test_loss: 2.6181, test_f1: 0.6279
 epoch: 98, train_loss: 0.0875, test_loss: 2.5435, test_f1: 0.5961
 epoch: 99, train_loss: 0.1028, test_loss: 2.4111, test_f1: 0.6132

Training completed in 604.00 seconds
Best F1: 0.7115 at epoch 42
Mean F1 across iterations: 0.6860  0.0127
========================FINAL RESULTS================================
FEGIN weighted F1: 0.7115  0.0127
python main.py --data ltspice_demos --representation component_pin --model FEGIN --layers 3 --hiddens 128 --batch_size 32 --lr 0.001 --emb_size 128 --epochs 100 --save_appendix component_pin_L3_H128_BS32_LR0.001_E128 --no_val
-----



STDERR:
  File "main.py", line 370, in <module>
    main()
  File "main.py", line 254, in main
    dataset = dataset_class(
  File "/home/philip/projects/ltspice_examples_code_repo/Circuit-Completion-Using-GNNs/component_classification_with_link_prediction_head/evaluation/FEGIN/kernel/circuit_datasets.py", line 15, in __init__
    self.data, self.slices = torch.load(self.processed_paths[0])
  File "/home/philip/.local/lib/python3.8/site-packages/torch/serialization.py", line 1040, in load
    warnings.warn(
  File "/usr/lib/python3.8/warnings.py", line 109, in _showwarnmsg
    sw(msg.message, msg.category, msg.filename, msg.lineno,
  File "main.py", line 47, in warn_with_traceback
    traceback.print_stack(file=log)
/home/philip/projects/ltspice_examples_code_repo/Circuit-Completion-Using-GNNs/component_classification_with_link_prediction_head/evaluation/FEGIN/kernel/circuit_datasets.py:15: FutureWarning: You are using `torch.load` with `weights_only=False` (the current default value), which uses the default pickle module implicitly. It is possible to construct malicious pickle data which will execute arbitrary code during unpickling (See https://github.com/pytorch/pytorch/blob/main/SECURITY.md#untrusted-models for more details). In a future release, the default value for `weights_only` will be flipped to `True`. This limits the functions that could be executed during unpickling. Arbitrary objects will no longer be allowed to be loaded via this mode unless they are explicitly allowlisted by the user via `torch.serialization.add_safe_globals`. We recommend you start setting `weights_only=True` for any use case where you don't have full control of the loaded file. Please open an issue on GitHub for any issues related to this experimental feature.
  self.data, self.slices = torch.load(self.processed_paths[0])
