STDOUT:
Results will be saved in /home/philip/projects/ltspice_examples_code_repo/Circuit-Completion-Using-GNNs/component_classification_with_link_prediction_head/evaluation/FEGIN/results/model_FEGIN_dataset_ltspice_examples
Command line input: python main.py --data ltspice_examples --representation component_pin --model FEGIN --layers 3 --hiddens 128 --batch_size 32 --lr 0.001 --emb_size 128 --epochs 100 --save_appendix component_pin_L3_H128_BS32_LR0.001_E128 --no_val
 is saved.
-----
ltspice_examples - FEGIN
Using 3 layers, 128 hidden units, h = 2
Loading component_pin representation dataset
ENTERED
Training FEGIN on component_pin representation
Train: 3560, Test: 848
##################ITERATION #0 ****************************************
 epoch: 0, train_loss: 1.1196, test_loss: 1.1010, test_f1: 0.3564
 epoch: 1, train_loss: 0.9864, test_loss: 0.9281, test_f1: 0.5162
 epoch: 2, train_loss: 0.9103, test_loss: 0.8721, test_f1: 0.5212
 epoch: 3, train_loss: 0.8656, test_loss: 0.9005, test_f1: 0.5124
 epoch: 4, train_loss: 0.8533, test_loss: 0.8458, test_f1: 0.5108
 epoch: 5, train_loss: 0.8204, test_loss: 0.8201, test_f1: 0.5978
 epoch: 6, train_loss: 0.8022, test_loss: 0.8231, test_f1: 0.5935
 epoch: 7, train_loss: 0.7888, test_loss: 0.8329, test_f1: 0.5991
 epoch: 8, train_loss: 0.7570, test_loss: 0.8271, test_f1: 0.5925
 epoch: 9, train_loss: 0.7667, test_loss: 0.9037, test_f1: 0.5578
 epoch: 10, train_loss: 0.7331, test_loss: 0.8964, test_f1: 0.5810
 epoch: 11, train_loss: 0.7330, test_loss: 0.8588, test_f1: 0.5770
 epoch: 12, train_loss: 0.7274, test_loss: 0.8048, test_f1: 0.5744
 epoch: 13, train_loss: 0.7119, test_loss: 0.8835, test_f1: 0.6073
 epoch: 14, train_loss: 0.7021, test_loss: 0.8275, test_f1: 0.5761
 epoch: 15, train_loss: 0.6893, test_loss: 0.8154, test_f1: 0.5884
 epoch: 16, train_loss: 0.6781, test_loss: 0.8270, test_f1: 0.6250
 epoch: 17, train_loss: 0.6713, test_loss: 1.1137, test_f1: 0.5150
 epoch: 18, train_loss: 0.6631, test_loss: 0.7990, test_f1: 0.6168
 epoch: 19, train_loss: 0.6496, test_loss: 0.8746, test_f1: 0.6144
 epoch: 20, train_loss: 0.6269, test_loss: 0.8188, test_f1: 0.6384
 epoch: 21, train_loss: 0.6229, test_loss: 0.7973, test_f1: 0.6433
 epoch: 22, train_loss: 0.6144, test_loss: 0.8674, test_f1: 0.6133
 epoch: 23, train_loss: 0.6105, test_loss: 0.8415, test_f1: 0.6487
 epoch: 24, train_loss: 0.5807, test_loss: 0.8550, test_f1: 0.6252
 epoch: 25, train_loss: 0.5678, test_loss: 0.8657, test_f1: 0.6336
 epoch: 26, train_loss: 0.5693, test_loss: 0.9241, test_f1: 0.6155
 epoch: 27, train_loss: 0.5611, test_loss: 0.9052, test_f1: 0.6213
 epoch: 28, train_loss: 0.5602, test_loss: 0.9279, test_f1: 0.6551
 epoch: 29, train_loss: 0.5439, test_loss: 0.8485, test_f1: 0.6525
 epoch: 30, train_loss: 0.5011, test_loss: 0.8718, test_f1: 0.6853
 epoch: 31, train_loss: 0.5227, test_loss: 0.9636, test_f1: 0.6125
 epoch: 32, train_loss: 0.5315, test_loss: 0.8793, test_f1: 0.6390
 epoch: 33, train_loss: 0.4856, test_loss: 0.9326, test_f1: 0.6541
 epoch: 34, train_loss: 0.4865, test_loss: 0.9925, test_f1: 0.6677
 epoch: 35, train_loss: 0.4976, test_loss: 0.8806, test_f1: 0.6706
 epoch: 36, train_loss: 0.4565, test_loss: 0.9626, test_f1: 0.6364
 epoch: 37, train_loss: 0.5018, test_loss: 1.1868, test_f1: 0.6434
 epoch: 38, train_loss: 0.4636, test_loss: 0.9312, test_f1: 0.6421
 epoch: 39, train_loss: 0.4572, test_loss: 0.9759, test_f1: 0.6685
 epoch: 40, train_loss: 0.4401, test_loss: 1.0201, test_f1: 0.6641
 epoch: 41, train_loss: 0.4430, test_loss: 1.0473, test_f1: 0.6697
 epoch: 42, train_loss: 0.4480, test_loss: 1.0625, test_f1: 0.6422
 epoch: 43, train_loss: 0.4198, test_loss: 0.9747, test_f1: 0.6690
 epoch: 44, train_loss: 0.4226, test_loss: 1.0104, test_f1: 0.6823
 epoch: 45, train_loss: 0.4266, test_loss: 1.0548, test_f1: 0.6711
 epoch: 46, train_loss: 0.3906, test_loss: 1.0669, test_f1: 0.6592
 epoch: 47, train_loss: 0.4027, test_loss: 1.0174, test_f1: 0.6698
 epoch: 48, train_loss: 0.3929, test_loss: 0.9097, test_f1: 0.6781
 epoch: 49, train_loss: 0.3863, test_loss: 1.0605, test_f1: 0.6861
 epoch: 50, train_loss: 0.3911, test_loss: 1.0012, test_f1: 0.6794
 epoch: 51, train_loss: 0.3463, test_loss: 1.0361, test_f1: 0.6774
 epoch: 52, train_loss: 0.3202, test_loss: 1.1142, test_f1: 0.6928
 epoch: 53, train_loss: 0.3043, test_loss: 1.1966, test_f1: 0.6794
 epoch: 54, train_loss: 0.2858, test_loss: 1.0921, test_f1: 0.7093
 epoch: 55, train_loss: 0.2855, test_loss: 1.2168, test_f1: 0.7003
 epoch: 56, train_loss: 0.2897, test_loss: 1.1809, test_f1: 0.6961
 epoch: 57, train_loss: 0.2825, test_loss: 1.2222, test_f1: 0.6903
 epoch: 58, train_loss: 0.2734, test_loss: 1.1536, test_f1: 0.7025
 epoch: 59, train_loss: 0.2741, test_loss: 1.2408, test_f1: 0.6878
 epoch: 60, train_loss: 0.2726, test_loss: 1.2557, test_f1: 0.6769
 epoch: 61, train_loss: 0.2709, test_loss: 1.2828, test_f1: 0.6676
 epoch: 62, train_loss: 0.2689, test_loss: 1.2677, test_f1: 0.6879
 epoch: 63, train_loss: 0.2504, test_loss: 1.3574, test_f1: 0.6968
 epoch: 64, train_loss: 0.2390, test_loss: 1.4659, test_f1: 0.6949
 epoch: 65, train_loss: 0.2460, test_loss: 1.4259, test_f1: 0.6997
 epoch: 66, train_loss: 0.2325, test_loss: 1.4412, test_f1: 0.6631
 epoch: 67, train_loss: 0.2291, test_loss: 1.4625, test_f1: 0.6958
 epoch: 68, train_loss: 0.2400, test_loss: 1.2872, test_f1: 0.7251
 epoch: 69, train_loss: 0.2537, test_loss: 1.3996, test_f1: 0.6846
 epoch: 70, train_loss: 0.2348, test_loss: 1.3474, test_f1: 0.6909
 epoch: 71, train_loss: 0.2223, test_loss: 1.4208, test_f1: 0.6777
 epoch: 72, train_loss: 0.2173, test_loss: 1.4734, test_f1: 0.6793
 epoch: 73, train_loss: 0.2217, test_loss: 1.5159, test_f1: 0.6668
 epoch: 74, train_loss: 0.2051, test_loss: 1.4901, test_f1: 0.6759
 epoch: 75, train_loss: 0.2082, test_loss: 1.6162, test_f1: 0.6914
 epoch: 76, train_loss: 0.2368, test_loss: 1.2733, test_f1: 0.7123
 epoch: 77, train_loss: 0.2173, test_loss: 1.5458, test_f1: 0.6445
 epoch: 78, train_loss: 0.2249, test_loss: 1.5813, test_f1: 0.6472
 epoch: 79, train_loss: 0.2078, test_loss: 1.5867, test_f1: 0.6690
 epoch: 80, train_loss: 0.1989, test_loss: 1.5828, test_f1: 0.6702
 epoch: 81, train_loss: 0.1877, test_loss: 1.6446, test_f1: 0.6948
 epoch: 82, train_loss: 0.2073, test_loss: 1.5319, test_f1: 0.6906
 epoch: 83, train_loss: 0.1992, test_loss: 1.6271, test_f1: 0.6588
 epoch: 84, train_loss: 0.1943, test_loss: 1.7116, test_f1: 0.6547
 epoch: 85, train_loss: 0.1986, test_loss: 1.6105, test_f1: 0.6616
 epoch: 86, train_loss: 0.1905, test_loss: 1.6767, test_f1: 0.6715
 epoch: 87, train_loss: 0.1811, test_loss: 1.6329, test_f1: 0.6837
 epoch: 88, train_loss: 0.1967, test_loss: 1.5720, test_f1: 0.6756
 epoch: 89, train_loss: 0.2086, test_loss: 1.4944, test_f1: 0.6953
 epoch: 90, train_loss: 0.1750, test_loss: 1.5233, test_f1: 0.6789
 epoch: 91, train_loss: 0.1788, test_loss: 1.6855, test_f1: 0.6774
 epoch: 92, train_loss: 0.1927, test_loss: 1.4997, test_f1: 0.6924
 epoch: 93, train_loss: 0.1802, test_loss: 1.5558, test_f1: 0.6893
 epoch: 94, train_loss: 0.1685, test_loss: 1.6238, test_f1: 0.6834
 epoch: 95, train_loss: 0.1662, test_loss: 1.5958, test_f1: 0.6967
 epoch: 96, train_loss: 0.1590, test_loss: 1.6337, test_f1: 0.6828
 epoch: 97, train_loss: 0.1782, test_loss: 1.6071, test_f1: 0.6849
 epoch: 98, train_loss: 0.1672, test_loss: 1.7236, test_f1: 0.6706
 epoch: 99, train_loss: 0.1743, test_loss: 1.6497, test_f1: 0.6828
##################ITERATION #1 ****************************************
 epoch: 0, train_loss: 1.1019, test_loss: 1.0498, test_f1: 0.4793
 epoch: 1, train_loss: 0.9407, test_loss: 0.9387, test_f1: 0.4849
 epoch: 2, train_loss: 0.9081, test_loss: 0.9292, test_f1: 0.5290
 epoch: 3, train_loss: 0.8424, test_loss: 0.9172, test_f1: 0.5414
 epoch: 4, train_loss: 0.8324, test_loss: 0.8269, test_f1: 0.5432
 epoch: 5, train_loss: 0.8288, test_loss: 0.8408, test_f1: 0.6048
 epoch: 6, train_loss: 0.7927, test_loss: 0.8269, test_f1: 0.5792
 epoch: 7, train_loss: 0.7598, test_loss: 0.8458, test_f1: 0.5849
 epoch: 8, train_loss: 0.7543, test_loss: 0.9094, test_f1: 0.5819
 epoch: 9, train_loss: 0.7498, test_loss: 0.8511, test_f1: 0.6110
 epoch: 10, train_loss: 0.7239, test_loss: 0.8930, test_f1: 0.5899
 epoch: 11, train_loss: 0.7015, test_loss: 0.8357, test_f1: 0.6055
 epoch: 12, train_loss: 0.6992, test_loss: 0.8967, test_f1: 0.5742
 epoch: 13, train_loss: 0.6778, test_loss: 0.7958, test_f1: 0.6230
 epoch: 14, train_loss: 0.6660, test_loss: 0.8761, test_f1: 0.6130
 epoch: 15, train_loss: 0.6504, test_loss: 0.8810, test_f1: 0.6408
 epoch: 16, train_loss: 0.6329, test_loss: 0.8432, test_f1: 0.6463
 epoch: 17, train_loss: 0.6244, test_loss: 0.8173, test_f1: 0.6123
 epoch: 18, train_loss: 0.6218, test_loss: 0.8760, test_f1: 0.6201
 epoch: 19, train_loss: 0.6220, test_loss: 0.8255, test_f1: 0.6378
 epoch: 20, train_loss: 0.5908, test_loss: 0.8973, test_f1: 0.6179
 epoch: 21, train_loss: 0.5945, test_loss: 0.9254, test_f1: 0.6128
 epoch: 22, train_loss: 0.5772, test_loss: 0.8715, test_f1: 0.6401
 epoch: 23, train_loss: 0.5604, test_loss: 0.8998, test_f1: 0.6071
 epoch: 24, train_loss: 0.5557, test_loss: 0.8889, test_f1: 0.6182
 epoch: 25, train_loss: 0.5185, test_loss: 0.8178, test_f1: 0.6829
 epoch: 26, train_loss: 0.5390, test_loss: 0.9075, test_f1: 0.6493
 epoch: 27, train_loss: 0.5027, test_loss: 0.9660, test_f1: 0.6605
 epoch: 28, train_loss: 0.5185, test_loss: 0.9578, test_f1: 0.6418
 epoch: 29, train_loss: 0.4991, test_loss: 0.9500, test_f1: 0.6324
 epoch: 30, train_loss: 0.4881, test_loss: 0.9226, test_f1: 0.6415
 epoch: 31, train_loss: 0.4818, test_loss: 1.0333, test_f1: 0.6385
 epoch: 32, train_loss: 0.4637, test_loss: 0.9768, test_f1: 0.6353
 epoch: 33, train_loss: 0.4902, test_loss: 0.8873, test_f1: 0.6788
 epoch: 34, train_loss: 0.4739, test_loss: 0.8630, test_f1: 0.6649
 epoch: 35, train_loss: 0.4630, test_loss: 0.8481, test_f1: 0.6823
 epoch: 36, train_loss: 0.4487, test_loss: 0.8963, test_f1: 0.6549
 epoch: 37, train_loss: 0.4313, test_loss: 0.9631, test_f1: 0.6523
 epoch: 38, train_loss: 0.4340, test_loss: 1.0650, test_f1: 0.6727
 epoch: 39, train_loss: 0.3881, test_loss: 0.9620, test_f1: 0.6791
 epoch: 40, train_loss: 0.3905, test_loss: 1.0321, test_f1: 0.6581
 epoch: 41, train_loss: 0.4065, test_loss: 0.8207, test_f1: 0.6683
 epoch: 42, train_loss: 0.3764, test_loss: 0.9324, test_f1: 0.6743
 epoch: 43, train_loss: 0.3716, test_loss: 0.9292, test_f1: 0.6768
 epoch: 44, train_loss: 0.4090, test_loss: 1.0843, test_f1: 0.6518
 epoch: 45, train_loss: 0.4165, test_loss: 0.9104, test_f1: 0.6581
 epoch: 46, train_loss: 0.3505, test_loss: 1.0673, test_f1: 0.6676
 epoch: 47, train_loss: 0.3700, test_loss: 1.0969, test_f1: 0.6700
 epoch: 48, train_loss: 0.3464, test_loss: 1.0299, test_f1: 0.6856
 epoch: 49, train_loss: 0.3538, test_loss: 0.9897, test_f1: 0.6661
 epoch: 50, train_loss: 0.3354, test_loss: 1.1510, test_f1: 0.6505
 epoch: 51, train_loss: 0.2986, test_loss: 1.0931, test_f1: 0.7027
 epoch: 52, train_loss: 0.2776, test_loss: 1.1115, test_f1: 0.6643
 epoch: 53, train_loss: 0.2756, test_loss: 1.2097, test_f1: 0.6514
 epoch: 54, train_loss: 0.2558, test_loss: 1.2395, test_f1: 0.6393
 epoch: 55, train_loss: 0.2511, test_loss: 1.1963, test_f1: 0.6649
 epoch: 56, train_loss: 0.2537, test_loss: 1.2563, test_f1: 0.6722
 epoch: 57, train_loss: 0.2230, test_loss: 1.3636, test_f1: 0.6534
 epoch: 58, train_loss: 0.2353, test_loss: 1.2570, test_f1: 0.6747
 epoch: 59, train_loss: 0.2423, test_loss: 1.3761, test_f1: 0.6505
 epoch: 60, train_loss: 0.2373, test_loss: 1.3034, test_f1: 0.6748
 epoch: 61, train_loss: 0.2497, test_loss: 1.2952, test_f1: 0.6839
 epoch: 62, train_loss: 0.2042, test_loss: 1.2903, test_f1: 0.6397
 epoch: 63, train_loss: 0.2250, test_loss: 1.3847, test_f1: 0.6697
 epoch: 64, train_loss: 0.2315, test_loss: 1.3632, test_f1: 0.6635
 epoch: 65, train_loss: 0.2055, test_loss: 1.5024, test_f1: 0.6339
 epoch: 66, train_loss: 0.2232, test_loss: 1.3779, test_f1: 0.6604
 epoch: 67, train_loss: 0.2067, test_loss: 1.4462, test_f1: 0.6707
 epoch: 68, train_loss: 0.2184, test_loss: 1.3944, test_f1: 0.6733
 epoch: 69, train_loss: 0.1884, test_loss: 1.5020, test_f1: 0.6438
 epoch: 70, train_loss: 0.1960, test_loss: 1.5019, test_f1: 0.6508
 epoch: 71, train_loss: 0.2024, test_loss: 1.5091, test_f1: 0.6474
 epoch: 72, train_loss: 0.2297, test_loss: 1.5191, test_f1: 0.6439
 epoch: 73, train_loss: 0.1987, test_loss: 1.6315, test_f1: 0.6291
 epoch: 74, train_loss: 0.1994, test_loss: 1.5243, test_f1: 0.6813
 epoch: 75, train_loss: 0.2098, test_loss: 1.3921, test_f1: 0.6354
 epoch: 76, train_loss: 0.2006, test_loss: 1.5118, test_f1: 0.6538
 epoch: 77, train_loss: 0.1877, test_loss: 1.5240, test_f1: 0.6586
 epoch: 78, train_loss: 0.1891, test_loss: 1.4249, test_f1: 0.6664
 epoch: 79, train_loss: 0.1727, test_loss: 1.4628, test_f1: 0.6442
 epoch: 80, train_loss: 0.1597, test_loss: 1.3833, test_f1: 0.6698
 epoch: 81, train_loss: 0.1643, test_loss: 1.6312, test_f1: 0.6485
 epoch: 82, train_loss: 0.1867, test_loss: 1.5685, test_f1: 0.6300
 epoch: 83, train_loss: 0.2541, test_loss: 1.3842, test_f1: 0.6546
 epoch: 84, train_loss: 0.2073, test_loss: 1.4419, test_f1: 0.6477
 epoch: 85, train_loss: 0.1783, test_loss: 1.5014, test_f1: 0.6675
 epoch: 86, train_loss: 0.1770, test_loss: 1.4570, test_f1: 0.6704
 epoch: 87, train_loss: 0.1821, test_loss: 1.4981, test_f1: 0.6954
 epoch: 88, train_loss: 0.1718, test_loss: 1.4873, test_f1: 0.6999
 epoch: 89, train_loss: 0.1611, test_loss: 1.5409, test_f1: 0.6713
 epoch: 90, train_loss: 0.1708, test_loss: 1.6854, test_f1: 0.6908
 epoch: 91, train_loss: 0.1500, test_loss: 1.5883, test_f1: 0.6535
 epoch: 92, train_loss: 0.1874, test_loss: 1.5448, test_f1: 0.6564
 epoch: 93, train_loss: 0.1647, test_loss: 1.5297, test_f1: 0.6696
 epoch: 94, train_loss: 0.1622, test_loss: 1.5976, test_f1: 0.6626
 epoch: 95, train_loss: 0.1532, test_loss: 1.5360, test_f1: 0.6716
 epoch: 96, train_loss: 0.1488, test_loss: 1.6911, test_f1: 0.6805
 epoch: 97, train_loss: 0.1648, test_loss: 1.6592, test_f1: 0.6355
 epoch: 98, train_loss: 0.1439, test_loss: 1.5534, test_f1: 0.6636
 epoch: 99, train_loss: 0.1542, test_loss: 1.6498, test_f1: 0.6753
##################ITERATION #2 ****************************************
 epoch: 0, train_loss: 1.1223, test_loss: 1.0413, test_f1: 0.4580
 epoch: 1, train_loss: 0.9590, test_loss: 0.9687, test_f1: 0.5022
 epoch: 2, train_loss: 0.9053, test_loss: 0.9935, test_f1: 0.5225
 epoch: 3, train_loss: 0.8672, test_loss: 0.9136, test_f1: 0.5576
 epoch: 4, train_loss: 0.8386, test_loss: 0.8828, test_f1: 0.5656
 epoch: 5, train_loss: 0.8394, test_loss: 0.8800, test_f1: 0.5778
 epoch: 6, train_loss: 0.8003, test_loss: 0.8533, test_f1: 0.5780
 epoch: 7, train_loss: 0.7702, test_loss: 0.8263, test_f1: 0.5425
 epoch: 8, train_loss: 0.7649, test_loss: 0.9009, test_f1: 0.5532
 epoch: 9, train_loss: 0.7503, test_loss: 0.9371, test_f1: 0.5880
 epoch: 10, train_loss: 0.7382, test_loss: 0.7950, test_f1: 0.6074
 epoch: 11, train_loss: 0.7098, test_loss: 0.8113, test_f1: 0.5993
 epoch: 12, train_loss: 0.6862, test_loss: 0.8162, test_f1: 0.6352
 epoch: 13, train_loss: 0.6951, test_loss: 0.8432, test_f1: 0.6273
 epoch: 14, train_loss: 0.6676, test_loss: 0.7896, test_f1: 0.6352
 epoch: 15, train_loss: 0.6652, test_loss: 0.8208, test_f1: 0.6347
 epoch: 16, train_loss: 0.6441, test_loss: 0.7784, test_f1: 0.6603
 epoch: 17, train_loss: 0.6286, test_loss: 0.8428, test_f1: 0.6180
 epoch: 18, train_loss: 0.6246, test_loss: 0.8478, test_f1: 0.6328
 epoch: 19, train_loss: 0.5978, test_loss: 0.8542, test_f1: 0.6262
 epoch: 20, train_loss: 0.5918, test_loss: 0.8303, test_f1: 0.6359
 epoch: 21, train_loss: 0.5983, test_loss: 0.8165, test_f1: 0.6530
 epoch: 22, train_loss: 0.5729, test_loss: 0.8358, test_f1: 0.6399
 epoch: 23, train_loss: 0.5855, test_loss: 0.7838, test_f1: 0.6520
 epoch: 24, train_loss: 0.5637, test_loss: 0.7623, test_f1: 0.6598
 epoch: 25, train_loss: 0.5555, test_loss: 0.8772, test_f1: 0.6101
 epoch: 26, train_loss: 0.5440, test_loss: 0.8149, test_f1: 0.6863
 epoch: 27, train_loss: 0.5257, test_loss: 0.9466, test_f1: 0.6255
 epoch: 28, train_loss: 0.5200, test_loss: 0.8379, test_f1: 0.6230
 epoch: 29, train_loss: 0.5282, test_loss: 0.8016, test_f1: 0.6658
 epoch: 30, train_loss: 0.5109, test_loss: 0.8802, test_f1: 0.6593
 epoch: 31, train_loss: 0.5228, test_loss: 0.7983, test_f1: 0.7030
 epoch: 32, train_loss: 0.4906, test_loss: 0.8692, test_f1: 0.6447
 epoch: 33, train_loss: 0.4932, test_loss: 0.8020, test_f1: 0.7138
 epoch: 34, train_loss: 0.4947, test_loss: 0.8358, test_f1: 0.6757
 epoch: 35, train_loss: 0.4705, test_loss: 0.8974, test_f1: 0.6676
 epoch: 36, train_loss: 0.4621, test_loss: 0.8942, test_f1: 0.6736
 epoch: 37, train_loss: 0.4719, test_loss: 0.8404, test_f1: 0.7022
 epoch: 38, train_loss: 0.4352, test_loss: 0.8854, test_f1: 0.6611
 epoch: 39, train_loss: 0.4516, test_loss: 0.9791, test_f1: 0.6308
 epoch: 40, train_loss: 0.4462, test_loss: 1.0284, test_f1: 0.6482
 epoch: 41, train_loss: 0.4258, test_loss: 0.8822, test_f1: 0.6674
 epoch: 42, train_loss: 0.4214, test_loss: 0.8872, test_f1: 0.6717
 epoch: 43, train_loss: 0.4360, test_loss: 0.9414, test_f1: 0.6683
 epoch: 44, train_loss: 0.4191, test_loss: 0.8708, test_f1: 0.6801
 epoch: 45, train_loss: 0.3881, test_loss: 0.8822, test_f1: 0.6724
 epoch: 46, train_loss: 0.4058, test_loss: 0.9653, test_f1: 0.6734
 epoch: 47, train_loss: 0.3913, test_loss: 0.9624, test_f1: 0.6708
 epoch: 48, train_loss: 0.3776, test_loss: 0.9918, test_f1: 0.6415
 epoch: 49, train_loss: 0.3631, test_loss: 1.0036, test_f1: 0.6660
 epoch: 50, train_loss: 0.3587, test_loss: 0.9671, test_f1: 0.6763
 epoch: 51, train_loss: 0.3224, test_loss: 1.0262, test_f1: 0.6534
 epoch: 52, train_loss: 0.3055, test_loss: 1.0284, test_f1: 0.6343
 epoch: 53, train_loss: 0.2912, test_loss: 1.0512, test_f1: 0.7020
 epoch: 54, train_loss: 0.2670, test_loss: 1.0502, test_f1: 0.6672
 epoch: 55, train_loss: 0.2689, test_loss: 1.0003, test_f1: 0.6830
 epoch: 56, train_loss: 0.2765, test_loss: 1.0767, test_f1: 0.6890
 epoch: 57, train_loss: 0.2655, test_loss: 1.1150, test_f1: 0.6460
 epoch: 58, train_loss: 0.2704, test_loss: 1.0454, test_f1: 0.6673
 epoch: 59, train_loss: 0.2713, test_loss: 1.1015, test_f1: 0.6888
 epoch: 60, train_loss: 0.2629, test_loss: 1.1503, test_f1: 0.6800
 epoch: 61, train_loss: 0.2476, test_loss: 1.2590, test_f1: 0.6431
 epoch: 62, train_loss: 0.2673, test_loss: 1.2835, test_f1: 0.6100
 epoch: 63, train_loss: 0.2583, test_loss: 1.0975, test_f1: 0.6645
 epoch: 64, train_loss: 0.2350, test_loss: 1.0652, test_f1: 0.6726
 epoch: 65, train_loss: 0.2358, test_loss: 1.2526, test_f1: 0.6669
 epoch: 66, train_loss: 0.2477, test_loss: 1.2368, test_f1: 0.6757
 epoch: 67, train_loss: 0.2211, test_loss: 1.2833, test_f1: 0.6635
 epoch: 68, train_loss: 0.2367, test_loss: 1.1170, test_f1: 0.6643
 epoch: 69, train_loss: 0.2088, test_loss: 1.2307, test_f1: 0.6707
 epoch: 70, train_loss: 0.2168, test_loss: 1.3327, test_f1: 0.6538
 epoch: 71, train_loss: 0.2066, test_loss: 1.3242, test_f1: 0.6638
 epoch: 72, train_loss: 0.2129, test_loss: 1.3134, test_f1: 0.6407
 epoch: 73, train_loss: 0.2005, test_loss: 1.2424, test_f1: 0.6848
 epoch: 74, train_loss: 0.2009, test_loss: 1.2204, test_f1: 0.6852
 epoch: 75, train_loss: 0.1940, test_loss: 1.2544, test_f1: 0.6879
 epoch: 76, train_loss: 0.2002, test_loss: 1.3745, test_f1: 0.6655
 epoch: 77, train_loss: 0.2125, test_loss: 1.3586, test_f1: 0.6610
 epoch: 78, train_loss: 0.1971, test_loss: 1.4605, test_f1: 0.6447
 epoch: 79, train_loss: 0.1878, test_loss: 1.3493, test_f1: 0.6825
 epoch: 80, train_loss: 0.2163, test_loss: 1.3876, test_f1: 0.6623
 epoch: 81, train_loss: 0.1918, test_loss: 1.4778, test_f1: 0.6728
 epoch: 82, train_loss: 0.1857, test_loss: 1.2421, test_f1: 0.7069
 epoch: 83, train_loss: 0.1827, test_loss: 1.3161, test_f1: 0.6915
 epoch: 84, train_loss: 0.1932, test_loss: 1.4441, test_f1: 0.6776
 epoch: 85, train_loss: 0.1946, test_loss: 1.4982, test_f1: 0.6446
 epoch: 86, train_loss: 0.1773, test_loss: 1.5243, test_f1: 0.6836
 epoch: 87, train_loss: 0.1827, test_loss: 1.5412, test_f1: 0.6550
 epoch: 88, train_loss: 0.2029, test_loss: 1.4199, test_f1: 0.6860
 epoch: 89, train_loss: 0.1745, test_loss: 1.4643, test_f1: 0.6620
 epoch: 90, train_loss: 0.1693, test_loss: 1.3028, test_f1: 0.6712
 epoch: 91, train_loss: 0.1624, test_loss: 1.7282, test_f1: 0.6607
 epoch: 92, train_loss: 0.1712, test_loss: 1.4312, test_f1: 0.6708
 epoch: 93, train_loss: 0.1619, test_loss: 1.5140, test_f1: 0.6613
 epoch: 94, train_loss: 0.1850, test_loss: 1.6527, test_f1: 0.6181
 epoch: 95, train_loss: 0.1769, test_loss: 1.2904, test_f1: 0.6865
 epoch: 96, train_loss: 0.1763, test_loss: 1.3031, test_f1: 0.7041
 epoch: 97, train_loss: 0.1572, test_loss: 1.3705, test_f1: 0.6417
 epoch: 98, train_loss: 0.1630, test_loss: 1.3657, test_f1: 0.6881
 epoch: 99, train_loss: 0.1579, test_loss: 1.5101, test_f1: 0.6627
##################ITERATION #3 ****************************************
 epoch: 0, train_loss: 1.1832, test_loss: 1.1340, test_f1: 0.4785
 epoch: 1, train_loss: 0.9514, test_loss: 0.9451, test_f1: 0.5502
 epoch: 2, train_loss: 0.9229, test_loss: 0.9013, test_f1: 0.5242
 epoch: 3, train_loss: 0.8907, test_loss: 0.9057, test_f1: 0.5467
 epoch: 4, train_loss: 0.8749, test_loss: 0.9391, test_f1: 0.5070
 epoch: 5, train_loss: 0.8560, test_loss: 0.9575, test_f1: 0.5883
 epoch: 6, train_loss: 0.8372, test_loss: 0.9075, test_f1: 0.5577
 epoch: 7, train_loss: 0.8261, test_loss: 0.8874, test_f1: 0.5854
 epoch: 8, train_loss: 0.7974, test_loss: 0.8640, test_f1: 0.5714
 epoch: 9, train_loss: 0.7777, test_loss: 0.9310, test_f1: 0.5423
 epoch: 10, train_loss: 0.7581, test_loss: 0.8634, test_f1: 0.5716
 epoch: 11, train_loss: 0.7534, test_loss: 0.8645, test_f1: 0.5946
 epoch: 12, train_loss: 0.7481, test_loss: 0.8197, test_f1: 0.5931
 epoch: 13, train_loss: 0.7175, test_loss: 0.8587, test_f1: 0.5892
 epoch: 14, train_loss: 0.7201, test_loss: 0.8593, test_f1: 0.6191
 epoch: 15, train_loss: 0.6973, test_loss: 0.8263, test_f1: 0.6324
 epoch: 16, train_loss: 0.6901, test_loss: 0.8601, test_f1: 0.5559
 epoch: 17, train_loss: 0.6827, test_loss: 0.8680, test_f1: 0.6146
 epoch: 18, train_loss: 0.6707, test_loss: 0.8118, test_f1: 0.6503
 epoch: 19, train_loss: 0.6669, test_loss: 0.8515, test_f1: 0.5989
 epoch: 20, train_loss: 0.6400, test_loss: 0.9312, test_f1: 0.6260
 epoch: 21, train_loss: 0.6407, test_loss: 0.7961, test_f1: 0.6338
 epoch: 22, train_loss: 0.6440, test_loss: 0.7971, test_f1: 0.6714
 epoch: 23, train_loss: 0.6109, test_loss: 0.8515, test_f1: 0.6463
 epoch: 24, train_loss: 0.6086, test_loss: 0.7992, test_f1: 0.6557
 epoch: 25, train_loss: 0.6196, test_loss: 0.8590, test_f1: 0.6455
 epoch: 26, train_loss: 0.6047, test_loss: 0.8500, test_f1: 0.6388
 epoch: 27, train_loss: 0.5687, test_loss: 0.7492, test_f1: 0.6645
 epoch: 28, train_loss: 0.5699, test_loss: 0.8312, test_f1: 0.6663
 epoch: 29, train_loss: 0.5696, test_loss: 0.8925, test_f1: 0.6416
 epoch: 30, train_loss: 0.5586, test_loss: 0.9253, test_f1: 0.6485
 epoch: 31, train_loss: 0.5318, test_loss: 0.8615, test_f1: 0.6409
 epoch: 32, train_loss: 0.5377, test_loss: 0.8158, test_f1: 0.6405
 epoch: 33, train_loss: 0.5176, test_loss: 0.8296, test_f1: 0.6379
 epoch: 34, train_loss: 0.5337, test_loss: 0.9738, test_f1: 0.6050
 epoch: 35, train_loss: 0.5042, test_loss: 0.7973, test_f1: 0.6794
 epoch: 36, train_loss: 0.4956, test_loss: 0.9020, test_f1: 0.6536
 epoch: 37, train_loss: 0.4819, test_loss: 0.9080, test_f1: 0.6689
 epoch: 38, train_loss: 0.4906, test_loss: 0.9601, test_f1: 0.6642
 epoch: 39, train_loss: 0.4965, test_loss: 1.0432, test_f1: 0.6479
 epoch: 40, train_loss: 0.4853, test_loss: 0.8828, test_f1: 0.6880
 epoch: 41, train_loss: 0.4555, test_loss: 1.0275, test_f1: 0.6629
 epoch: 42, train_loss: 0.4693, test_loss: 0.9404, test_f1: 0.6892
 epoch: 43, train_loss: 0.4734, test_loss: 1.0461, test_f1: 0.6765
 epoch: 44, train_loss: 0.4538, test_loss: 1.0166, test_f1: 0.6512
 epoch: 45, train_loss: 0.4393, test_loss: 0.9982, test_f1: 0.6724
 epoch: 46, train_loss: 0.4217, test_loss: 0.9734, test_f1: 0.6863
 epoch: 47, train_loss: 0.4113, test_loss: 1.0574, test_f1: 0.6138
 epoch: 48, train_loss: 0.4225, test_loss: 0.9938, test_f1: 0.6627
 epoch: 49, train_loss: 0.4249, test_loss: 0.9393, test_f1: 0.6944
 epoch: 50, train_loss: 0.4013, test_loss: 1.0078, test_f1: 0.6695
 epoch: 51, train_loss: 0.3797, test_loss: 1.0614, test_f1: 0.6721
 epoch: 52, train_loss: 0.3446, test_loss: 1.0364, test_f1: 0.6659
 epoch: 53, train_loss: 0.3230, test_loss: 1.0969, test_f1: 0.6783
 epoch: 54, train_loss: 0.3309, test_loss: 1.1064, test_f1: 0.6821
 epoch: 55, train_loss: 0.3162, test_loss: 1.1392, test_f1: 0.6772
 epoch: 56, train_loss: 0.3037, test_loss: 1.0879, test_f1: 0.6868
 epoch: 57, train_loss: 0.3077, test_loss: 1.2224, test_f1: 0.6787
 epoch: 58, train_loss: 0.2993, test_loss: 1.1709, test_f1: 0.6768
 epoch: 59, train_loss: 0.3100, test_loss: 1.2394, test_f1: 0.6722
 epoch: 60, train_loss: 0.3095, test_loss: 1.0770, test_f1: 0.6754
 epoch: 61, train_loss: 0.2912, test_loss: 1.2208, test_f1: 0.6559
 epoch: 62, train_loss: 0.2808, test_loss: 1.2124, test_f1: 0.6927
 epoch: 63, train_loss: 0.2867, test_loss: 1.1899, test_f1: 0.6853
 epoch: 64, train_loss: 0.2747, test_loss: 1.2173, test_f1: 0.6594
 epoch: 65, train_loss: 0.2712, test_loss: 1.2060, test_f1: 0.7106
 epoch: 66, train_loss: 0.2752, test_loss: 1.0986, test_f1: 0.6820
 epoch: 67, train_loss: 0.2744, test_loss: 1.2481, test_f1: 0.6683
 epoch: 68, train_loss: 0.2637, test_loss: 1.0999, test_f1: 0.7223
 epoch: 69, train_loss: 0.2784, test_loss: 1.2717, test_f1: 0.6708
 epoch: 70, train_loss: 0.2538, test_loss: 1.3214, test_f1: 0.6949
 epoch: 71, train_loss: 0.2470, test_loss: 1.2337, test_f1: 0.6876
 epoch: 72, train_loss: 0.2696, test_loss: 1.2329, test_f1: 0.6817
 epoch: 73, train_loss: 0.2465, test_loss: 1.2398, test_f1: 0.7211
 epoch: 74, train_loss: 0.2365, test_loss: 1.1506, test_f1: 0.6833
 epoch: 75, train_loss: 0.2500, test_loss: 1.2276, test_f1: 0.6831
 epoch: 76, train_loss: 0.2354, test_loss: 1.4287, test_f1: 0.6505
 epoch: 77, train_loss: 0.2321, test_loss: 1.2428, test_f1: 0.6824
 epoch: 78, train_loss: 0.2361, test_loss: 1.3901, test_f1: 0.6822
 epoch: 79, train_loss: 0.2285, test_loss: 1.1751, test_f1: 0.6803
 epoch: 80, train_loss: 0.2222, test_loss: 1.1597, test_f1: 0.6886
 epoch: 81, train_loss: 0.2246, test_loss: 1.1508, test_f1: 0.6965
 epoch: 82, train_loss: 0.2334, test_loss: 1.3509, test_f1: 0.6910
 epoch: 83, train_loss: 0.2368, test_loss: 1.3472, test_f1: 0.6569
 epoch: 84, train_loss: 0.2192, test_loss: 1.3494, test_f1: 0.6976
 epoch: 85, train_loss: 0.2127, test_loss: 1.4050, test_f1: 0.6816
 epoch: 86, train_loss: 0.2160, test_loss: 1.2157, test_f1: 0.6820
 epoch: 87, train_loss: 0.2031, test_loss: 1.3856, test_f1: 0.7040
 epoch: 88, train_loss: 0.1909, test_loss: 1.4350, test_f1: 0.6754
 epoch: 89, train_loss: 0.1960, test_loss: 1.4894, test_f1: 0.7037
 epoch: 90, train_loss: 0.2039, test_loss: 1.3878, test_f1: 0.6959
 epoch: 91, train_loss: 0.1907, test_loss: 1.4217, test_f1: 0.6844
 epoch: 92, train_loss: 0.1908, test_loss: 1.6790, test_f1: 0.6647
 epoch: 93, train_loss: 0.1838, test_loss: 1.5302, test_f1: 0.6754
 epoch: 94, train_loss: 0.2178, test_loss: 1.3566, test_f1: 0.7003
 epoch: 95, train_loss: 0.1748, test_loss: 1.3863, test_f1: 0.6923
 epoch: 96, train_loss: 0.1814, test_loss: 1.4794, test_f1: 0.6782
 epoch: 97, train_loss: 0.2067, test_loss: 1.4405, test_f1: 0.7005
 epoch: 98, train_loss: 0.1818, test_loss: 1.5266, test_f1: 0.6642
 epoch: 99, train_loss: 0.1771, test_loss: 1.4982, test_f1: 0.6817
##################ITERATION #4 ****************************************
 epoch: 0, train_loss: 1.2497, test_loss: 1.0293, test_f1: 0.4913
 epoch: 1, train_loss: 0.9911, test_loss: 1.0072, test_f1: 0.5002
 epoch: 2, train_loss: 0.9319, test_loss: 1.0171, test_f1: 0.5149
 epoch: 3, train_loss: 0.9122, test_loss: 1.0753, test_f1: 0.4942
 epoch: 4, train_loss: 0.8866, test_loss: 0.8856, test_f1: 0.5138
 epoch: 5, train_loss: 0.8524, test_loss: 0.8956, test_f1: 0.5276
 epoch: 6, train_loss: 0.8329, test_loss: 0.9025, test_f1: 0.5447
 epoch: 7, train_loss: 0.8165, test_loss: 0.9222, test_f1: 0.5413
 epoch: 8, train_loss: 0.8050, test_loss: 0.9135, test_f1: 0.5514
 epoch: 9, train_loss: 0.7694, test_loss: 0.8030, test_f1: 0.5831
 epoch: 10, train_loss: 0.7640, test_loss: 0.8655, test_f1: 0.5658
 epoch: 11, train_loss: 0.7575, test_loss: 0.8846, test_f1: 0.5973
 epoch: 12, train_loss: 0.7348, test_loss: 0.8797, test_f1: 0.6007
 epoch: 13, train_loss: 0.7160, test_loss: 0.8086, test_f1: 0.6422
 epoch: 14, train_loss: 0.7114, test_loss: 0.8901, test_f1: 0.6361
 epoch: 15, train_loss: 0.7027, test_loss: 0.8556, test_f1: 0.6326
 epoch: 16, train_loss: 0.6749, test_loss: 0.8412, test_f1: 0.6314
 epoch: 17, train_loss: 0.6779, test_loss: 0.8893, test_f1: 0.6020
 epoch: 18, train_loss: 0.6578, test_loss: 0.8233, test_f1: 0.6153
 epoch: 19, train_loss: 0.6591, test_loss: 0.7784, test_f1: 0.6418
 epoch: 20, train_loss: 0.6530, test_loss: 0.8102, test_f1: 0.6491
 epoch: 21, train_loss: 0.6260, test_loss: 0.8810, test_f1: 0.6229
 epoch: 22, train_loss: 0.6335, test_loss: 0.7928, test_f1: 0.6165
 epoch: 23, train_loss: 0.6238, test_loss: 0.7727, test_f1: 0.6534
 epoch: 24, train_loss: 0.5982, test_loss: 0.7708, test_f1: 0.6300
 epoch: 25, train_loss: 0.5847, test_loss: 0.8797, test_f1: 0.6254
 epoch: 26, train_loss: 0.5802, test_loss: 0.8005, test_f1: 0.6400
 epoch: 27, train_loss: 0.6078, test_loss: 0.7954, test_f1: 0.6441
 epoch: 28, train_loss: 0.5593, test_loss: 0.8308, test_f1: 0.6290
 epoch: 29, train_loss: 0.5661, test_loss: 0.9254, test_f1: 0.6356
 epoch: 30, train_loss: 0.5605, test_loss: 0.9337, test_f1: 0.6313
 epoch: 31, train_loss: 0.5494, test_loss: 0.7872, test_f1: 0.6601
 epoch: 32, train_loss: 0.5346, test_loss: 0.8515, test_f1: 0.6459
 epoch: 33, train_loss: 0.5223, test_loss: 0.9080, test_f1: 0.6355
 epoch: 34, train_loss: 0.5158, test_loss: 0.8759, test_f1: 0.6388
 epoch: 35, train_loss: 0.5015, test_loss: 1.0193, test_f1: 0.6284
 epoch: 36, train_loss: 0.4854, test_loss: 0.9440, test_f1: 0.5891
 epoch: 37, train_loss: 0.4928, test_loss: 0.8639, test_f1: 0.6526
 epoch: 38, train_loss: 0.4812, test_loss: 0.9094, test_f1: 0.6356
 epoch: 39, train_loss: 0.4807, test_loss: 0.7934, test_f1: 0.6604
 epoch: 40, train_loss: 0.4542, test_loss: 0.9055, test_f1: 0.6281
 epoch: 41, train_loss: 0.4434, test_loss: 0.7838, test_f1: 0.6900
 epoch: 42, train_loss: 0.4370, test_loss: 0.9939, test_f1: 0.6623
 epoch: 43, train_loss: 0.4634, test_loss: 0.7863, test_f1: 0.6831
 epoch: 44, train_loss: 0.4418, test_loss: 0.9871, test_f1: 0.6144
 epoch: 45, train_loss: 0.4515, test_loss: 0.8268, test_f1: 0.6759
 epoch: 46, train_loss: 0.4296, test_loss: 0.9826, test_f1: 0.6513
 epoch: 47, train_loss: 0.4248, test_loss: 0.8496, test_f1: 0.6875
 epoch: 48, train_loss: 0.4182, test_loss: 0.8582, test_f1: 0.6799
 epoch: 49, train_loss: 0.4103, test_loss: 0.9707, test_f1: 0.6681
 epoch: 50, train_loss: 0.4009, test_loss: 0.9142, test_f1: 0.6436
 epoch: 51, train_loss: 0.3452, test_loss: 1.0126, test_f1: 0.6709
 epoch: 52, train_loss: 0.3328, test_loss: 1.0227, test_f1: 0.6680
 epoch: 53, train_loss: 0.3391, test_loss: 1.0227, test_f1: 0.6639
 epoch: 54, train_loss: 0.3172, test_loss: 1.0656, test_f1: 0.6616
 epoch: 55, train_loss: 0.3085, test_loss: 1.0139, test_f1: 0.6609
 epoch: 56, train_loss: 0.2904, test_loss: 1.0939, test_f1: 0.6727
 epoch: 57, train_loss: 0.3085, test_loss: 1.1026, test_f1: 0.6559
 epoch: 58, train_loss: 0.2956, test_loss: 1.0725, test_f1: 0.6691
 epoch: 59, train_loss: 0.3054, test_loss: 1.0814, test_f1: 0.6647
 epoch: 60, train_loss: 0.2910, test_loss: 1.0747, test_f1: 0.6711
 epoch: 61, train_loss: 0.2964, test_loss: 1.0837, test_f1: 0.6619
 epoch: 62, train_loss: 0.2902, test_loss: 1.0480, test_f1: 0.6659
 epoch: 63, train_loss: 0.2997, test_loss: 1.0326, test_f1: 0.6676
 epoch: 64, train_loss: 0.2797, test_loss: 1.0237, test_f1: 0.6585
 epoch: 65, train_loss: 0.2762, test_loss: 1.1886, test_f1: 0.6734
 epoch: 66, train_loss: 0.2767, test_loss: 1.1427, test_f1: 0.6771
 epoch: 67, train_loss: 0.2576, test_loss: 1.2381, test_f1: 0.6476
 epoch: 68, train_loss: 0.2704, test_loss: 1.1704, test_f1: 0.6674
 epoch: 69, train_loss: 0.2616, test_loss: 1.1143, test_f1: 0.6566
 epoch: 70, train_loss: 0.2439, test_loss: 1.2421, test_f1: 0.6527
 epoch: 71, train_loss: 0.2529, test_loss: 1.2283, test_f1: 0.6390
 epoch: 72, train_loss: 0.2446, test_loss: 1.3975, test_f1: 0.6488
 epoch: 73, train_loss: 0.2457, test_loss: 1.2293, test_f1: 0.6604
 epoch: 74, train_loss: 0.2382, test_loss: 1.2711, test_f1: 0.6524
 epoch: 75, train_loss: 0.2412, test_loss: 1.2552, test_f1: 0.6596
 epoch: 76, train_loss: 0.2485, test_loss: 1.1650, test_f1: 0.6603
 epoch: 77, train_loss: 0.2566, test_loss: 1.1922, test_f1: 0.6460
 epoch: 78, train_loss: 0.2225, test_loss: 1.2581, test_f1: 0.6476
 epoch: 79, train_loss: 0.2170, test_loss: 1.2613, test_f1: 0.6524
 epoch: 80, train_loss: 0.2220, test_loss: 1.2475, test_f1: 0.6681
 epoch: 81, train_loss: 0.2443, test_loss: 1.2800, test_f1: 0.6718
 epoch: 82, train_loss: 0.2135, test_loss: 1.2834, test_f1: 0.6778
 epoch: 83, train_loss: 0.2198, test_loss: 1.3036, test_f1: 0.6595
 epoch: 84, train_loss: 0.2155, test_loss: 1.2478, test_f1: 0.6727
 epoch: 85, train_loss: 0.2007, test_loss: 1.2983, test_f1: 0.6949
 epoch: 86, train_loss: 0.2015, test_loss: 1.2478, test_f1: 0.6809
 epoch: 87, train_loss: 0.2089, test_loss: 1.3585, test_f1: 0.6644
 epoch: 88, train_loss: 0.2165, test_loss: 1.2022, test_f1: 0.6500
 epoch: 89, train_loss: 0.2068, test_loss: 1.3326, test_f1: 0.6537
 epoch: 90, train_loss: 0.2022, test_loss: 1.3444, test_f1: 0.6402
 epoch: 91, train_loss: 0.2042, test_loss: 1.3015, test_f1: 0.6793
 epoch: 92, train_loss: 0.1892, test_loss: 1.1959, test_f1: 0.6658
 epoch: 93, train_loss: 0.1980, test_loss: 1.1950, test_f1: 0.6648
 epoch: 94, train_loss: 0.2029, test_loss: 1.4064, test_f1: 0.6149
 epoch: 95, train_loss: 0.1966, test_loss: 1.3359, test_f1: 0.6608
 epoch: 96, train_loss: 0.2065, test_loss: 1.2588, test_f1: 0.6692
 epoch: 97, train_loss: 0.1992, test_loss: 1.2242, test_f1: 0.6706
 epoch: 98, train_loss: 0.2106, test_loss: 1.2753, test_f1: 0.6660
 epoch: 99, train_loss: 0.1929, test_loss: 1.3650, test_f1: 0.6607
##################ITERATION #5 ****************************************
 epoch: 0, train_loss: 1.1953, test_loss: 0.9851, test_f1: 0.5104
 epoch: 1, train_loss: 0.9451, test_loss: 0.8792, test_f1: 0.4938
 epoch: 2, train_loss: 0.8965, test_loss: 0.8455, test_f1: 0.5346
 epoch: 3, train_loss: 0.8872, test_loss: 0.8725, test_f1: 0.5342
 epoch: 4, train_loss: 0.8608, test_loss: 0.8123, test_f1: 0.5940
 epoch: 5, train_loss: 0.8312, test_loss: 0.8544, test_f1: 0.5548
 epoch: 6, train_loss: 0.8126, test_loss: 0.8256, test_f1: 0.5925
 epoch: 7, train_loss: 0.7855, test_loss: 0.7938, test_f1: 0.5848
 epoch: 8, train_loss: 0.7658, test_loss: 0.8198, test_f1: 0.5820
 epoch: 9, train_loss: 0.7455, test_loss: 0.7728, test_f1: 0.6074
 epoch: 10, train_loss: 0.7463, test_loss: 0.8970, test_f1: 0.5686
 epoch: 11, train_loss: 0.7464, test_loss: 0.7616, test_f1: 0.6332
 epoch: 12, train_loss: 0.7230, test_loss: 0.7819, test_f1: 0.5806
 epoch: 13, train_loss: 0.7146, test_loss: 0.6990, test_f1: 0.6188
 epoch: 14, train_loss: 0.6948, test_loss: 0.7503, test_f1: 0.6668
 epoch: 15, train_loss: 0.7053, test_loss: 0.8242, test_f1: 0.6403
 epoch: 16, train_loss: 0.6689, test_loss: 0.8010, test_f1: 0.6055
 epoch: 17, train_loss: 0.6674, test_loss: 0.8932, test_f1: 0.6235
 epoch: 18, train_loss: 0.6625, test_loss: 0.7485, test_f1: 0.6564
 epoch: 19, train_loss: 0.6384, test_loss: 0.8633, test_f1: 0.6165
 epoch: 20, train_loss: 0.6596, test_loss: 0.7732, test_f1: 0.6688
 epoch: 21, train_loss: 0.6267, test_loss: 0.8254, test_f1: 0.6365
 epoch: 22, train_loss: 0.6280, test_loss: 0.9030, test_f1: 0.6052
 epoch: 23, train_loss: 0.6197, test_loss: 0.7948, test_f1: 0.6394
 epoch: 24, train_loss: 0.5948, test_loss: 0.9513, test_f1: 0.5900
 epoch: 25, train_loss: 0.5861, test_loss: 0.7757, test_f1: 0.6397
 epoch: 26, train_loss: 0.5822, test_loss: 0.7952, test_f1: 0.6478
 epoch: 27, train_loss: 0.5653, test_loss: 0.7722, test_f1: 0.6709
 epoch: 28, train_loss: 0.5684, test_loss: 0.8843, test_f1: 0.6428
 epoch: 29, train_loss: 0.5702, test_loss: 0.8037, test_f1: 0.6721
 epoch: 30, train_loss: 0.5326, test_loss: 0.7839, test_f1: 0.6589
 epoch: 31, train_loss: 0.5284, test_loss: 0.8810, test_f1: 0.6628
 epoch: 32, train_loss: 0.5196, test_loss: 0.8480, test_f1: 0.6438
 epoch: 33, train_loss: 0.5184, test_loss: 0.7685, test_f1: 0.6739
 epoch: 34, train_loss: 0.4950, test_loss: 0.7955, test_f1: 0.6372
 epoch: 35, train_loss: 0.5104, test_loss: 0.8335, test_f1: 0.6654
 epoch: 36, train_loss: 0.4969, test_loss: 0.8968, test_f1: 0.6582
 epoch: 37, train_loss: 0.5085, test_loss: 0.8272, test_f1: 0.6785
 epoch: 38, train_loss: 0.4977, test_loss: 0.8604, test_f1: 0.6943
 epoch: 39, train_loss: 0.4537, test_loss: 0.8898, test_f1: 0.6784
 epoch: 40, train_loss: 0.4697, test_loss: 0.9426, test_f1: 0.6144
 epoch: 41, train_loss: 0.4596, test_loss: 0.9106, test_f1: 0.6777
 epoch: 42, train_loss: 0.4500, test_loss: 0.9304, test_f1: 0.6806
 epoch: 43, train_loss: 0.4715, test_loss: 0.9376, test_f1: 0.6690
 epoch: 44, train_loss: 0.4479, test_loss: 0.9825, test_f1: 0.6522
 epoch: 45, train_loss: 0.4606, test_loss: 0.9310, test_f1: 0.6495
 epoch: 46, train_loss: 0.4386, test_loss: 0.9105, test_f1: 0.6869
 epoch: 47, train_loss: 0.4145, test_loss: 0.8917, test_f1: 0.6932
 epoch: 48, train_loss: 0.4187, test_loss: 1.1103, test_f1: 0.6506
 epoch: 49, train_loss: 0.3994, test_loss: 0.9338, test_f1: 0.6489
 epoch: 50, train_loss: 0.4120, test_loss: 0.9429, test_f1: 0.6956
 epoch: 51, train_loss: 0.3516, test_loss: 0.9474, test_f1: 0.6920
 epoch: 52, train_loss: 0.3265, test_loss: 1.0099, test_f1: 0.6781
 epoch: 53, train_loss: 0.3217, test_loss: 1.0999, test_f1: 0.6884
 epoch: 54, train_loss: 0.3084, test_loss: 1.0609, test_f1: 0.7060
 epoch: 55, train_loss: 0.3060, test_loss: 0.9851, test_f1: 0.6958
 epoch: 56, train_loss: 0.2997, test_loss: 1.0104, test_f1: 0.7083
 epoch: 57, train_loss: 0.3057, test_loss: 1.1278, test_f1: 0.6826
 epoch: 58, train_loss: 0.2970, test_loss: 1.1063, test_f1: 0.6954
 epoch: 59, train_loss: 0.2854, test_loss: 1.1294, test_f1: 0.6918
 epoch: 60, train_loss: 0.2776, test_loss: 1.0829, test_f1: 0.6957
 epoch: 61, train_loss: 0.3157, test_loss: 1.0201, test_f1: 0.7104
 epoch: 62, train_loss: 0.2811, test_loss: 1.1449, test_f1: 0.6695
 epoch: 63, train_loss: 0.2675, test_loss: 1.1339, test_f1: 0.7005
 epoch: 64, train_loss: 0.2761, test_loss: 1.1627, test_f1: 0.6880
 epoch: 65, train_loss: 0.2751, test_loss: 1.1468, test_f1: 0.6753
 epoch: 66, train_loss: 0.2565, test_loss: 1.1883, test_f1: 0.7005
 epoch: 67, train_loss: 0.2677, test_loss: 1.1475, test_f1: 0.6927
 epoch: 68, train_loss: 0.2594, test_loss: 1.1583, test_f1: 0.7059
 epoch: 69, train_loss: 0.2338, test_loss: 1.1700, test_f1: 0.6883
 epoch: 70, train_loss: 0.2511, test_loss: 1.1308, test_f1: 0.6969
 epoch: 71, train_loss: 0.2680, test_loss: 1.2240, test_f1: 0.6709
 epoch: 72, train_loss: 0.2434, test_loss: 1.1176, test_f1: 0.7094
 epoch: 73, train_loss: 0.2218, test_loss: 1.2114, test_f1: 0.7042
 epoch: 74, train_loss: 0.2434, test_loss: 1.1856, test_f1: 0.6996
 epoch: 75, train_loss: 0.2224, test_loss: 1.3202, test_f1: 0.6740
 epoch: 76, train_loss: 0.2266, test_loss: 1.2899, test_f1: 0.6940
 epoch: 77, train_loss: 0.2307, test_loss: 1.2839, test_f1: 0.7041
 epoch: 78, train_loss: 0.2472, test_loss: 1.2380, test_f1: 0.6999
 epoch: 79, train_loss: 0.2412, test_loss: 1.2291, test_f1: 0.6790
 epoch: 80, train_loss: 0.2222, test_loss: 1.2855, test_f1: 0.6620
 epoch: 81, train_loss: 0.2531, test_loss: 1.2450, test_f1: 0.7001
 epoch: 82, train_loss: 0.2171, test_loss: 1.2039, test_f1: 0.6926
 epoch: 83, train_loss: 0.2270, test_loss: 1.3505, test_f1: 0.6941
 epoch: 84, train_loss: 0.2204, test_loss: 1.2859, test_f1: 0.6779
 epoch: 85, train_loss: 0.2254, test_loss: 1.2539, test_f1: 0.6929
 epoch: 86, train_loss: 0.2334, test_loss: 1.3677, test_f1: 0.6907
 epoch: 87, train_loss: 0.2204, test_loss: 1.3004, test_f1: 0.6918
 epoch: 88, train_loss: 0.2024, test_loss: 1.3441, test_f1: 0.6899
 epoch: 89, train_loss: 0.2168, test_loss: 1.2680, test_f1: 0.6745
 epoch: 90, train_loss: 0.2048, test_loss: 1.3091, test_f1: 0.7000
 epoch: 91, train_loss: 0.2025, test_loss: 1.4050, test_f1: 0.6551
 epoch: 92, train_loss: 0.1999, test_loss: 1.3492, test_f1: 0.7069
 epoch: 93, train_loss: 0.1929, test_loss: 1.4508, test_f1: 0.6813
 epoch: 94, train_loss: 0.1907, test_loss: 1.4818, test_f1: 0.6847
 epoch: 95, train_loss: 0.2030, test_loss: 1.4877, test_f1: 0.6828
 epoch: 96, train_loss: 0.1996, test_loss: 1.4798, test_f1: 0.7037
 epoch: 97, train_loss: 0.1971, test_loss: 1.4754, test_f1: 0.6637
 epoch: 98, train_loss: 0.1848, test_loss: 1.5413, test_f1: 0.6757
 epoch: 99, train_loss: 0.1751, test_loss: 1.4817, test_f1: 0.6751
##################ITERATION #6 ****************************************
 epoch: 0, train_loss: 1.2152, test_loss: 0.9807, test_f1: 0.5350
 epoch: 1, train_loss: 0.9673, test_loss: 0.9434, test_f1: 0.4956
 epoch: 2, train_loss: 0.9214, test_loss: 0.9884, test_f1: 0.5155
 epoch: 3, train_loss: 0.8953, test_loss: 0.9152, test_f1: 0.5212
 epoch: 4, train_loss: 0.8918, test_loss: 0.8620, test_f1: 0.5454
 epoch: 5, train_loss: 0.8423, test_loss: 0.9423, test_f1: 0.5403
 epoch: 6, train_loss: 0.8259, test_loss: 0.8531, test_f1: 0.5778
 epoch: 7, train_loss: 0.8061, test_loss: 0.8406, test_f1: 0.5424
 epoch: 8, train_loss: 0.7952, test_loss: 0.9055, test_f1: 0.5271
 epoch: 9, train_loss: 0.7893, test_loss: 1.0546, test_f1: 0.5007
 epoch: 10, train_loss: 0.7625, test_loss: 0.7984, test_f1: 0.6211
 epoch: 11, train_loss: 0.7448, test_loss: 0.9101, test_f1: 0.5459
 epoch: 12, train_loss: 0.7400, test_loss: 0.8826, test_f1: 0.6134
 epoch: 13, train_loss: 0.7146, test_loss: 0.7684, test_f1: 0.6324
 epoch: 14, train_loss: 0.7040, test_loss: 0.7888, test_f1: 0.6077
 epoch: 15, train_loss: 0.6905, test_loss: 0.7924, test_f1: 0.6311
 epoch: 16, train_loss: 0.6743, test_loss: 0.8536, test_f1: 0.6059
 epoch: 17, train_loss: 0.6674, test_loss: 0.8661, test_f1: 0.5739
 epoch: 18, train_loss: 0.6525, test_loss: 0.7873, test_f1: 0.6353
 epoch: 19, train_loss: 0.6578, test_loss: 0.8091, test_f1: 0.6156
 epoch: 20, train_loss: 0.6288, test_loss: 0.7951, test_f1: 0.6623
 epoch: 21, train_loss: 0.6152, test_loss: 0.8201, test_f1: 0.6395
 epoch: 22, train_loss: 0.6273, test_loss: 0.7933, test_f1: 0.6750
 epoch: 23, train_loss: 0.5911, test_loss: 0.8361, test_f1: 0.5988
 epoch: 24, train_loss: 0.6032, test_loss: 0.7937, test_f1: 0.6171
 epoch: 25, train_loss: 0.5837, test_loss: 0.8035, test_f1: 0.6492
 epoch: 26, train_loss: 0.5669, test_loss: 0.9007, test_f1: 0.6487
 epoch: 27, train_loss: 0.5548, test_loss: 0.9500, test_f1: 0.6199
 epoch: 28, train_loss: 0.5459, test_loss: 0.8324, test_f1: 0.6525
 epoch: 29, train_loss: 0.5437, test_loss: 0.9319, test_f1: 0.6348
 epoch: 30, train_loss: 0.5613, test_loss: 0.9343, test_f1: 0.6514
 epoch: 31, train_loss: 0.5234, test_loss: 0.9611, test_f1: 0.6338
 epoch: 32, train_loss: 0.5420, test_loss: 0.8609, test_f1: 0.6578
 epoch: 33, train_loss: 0.5056, test_loss: 0.9698, test_f1: 0.6589
 epoch: 34, train_loss: 0.5375, test_loss: 0.8978, test_f1: 0.6728
 epoch: 35, train_loss: 0.4829, test_loss: 1.0051, test_f1: 0.6563
 epoch: 36, train_loss: 0.4582, test_loss: 1.0269, test_f1: 0.6364
 epoch: 37, train_loss: 0.4780, test_loss: 1.0460, test_f1: 0.6253
 epoch: 38, train_loss: 0.4565, test_loss: 1.0262, test_f1: 0.6497
 epoch: 39, train_loss: 0.4639, test_loss: 1.0014, test_f1: 0.6299
 epoch: 40, train_loss: 0.4485, test_loss: 0.9037, test_f1: 0.6460
 epoch: 41, train_loss: 0.4769, test_loss: 0.9292, test_f1: 0.6620
 epoch: 42, train_loss: 0.4403, test_loss: 0.9481, test_f1: 0.6612
 epoch: 43, train_loss: 0.4349, test_loss: 0.9110, test_f1: 0.6812
 epoch: 44, train_loss: 0.4430, test_loss: 0.9774, test_f1: 0.6340
 epoch: 45, train_loss: 0.4282, test_loss: 1.0262, test_f1: 0.6915
 epoch: 46, train_loss: 0.4147, test_loss: 0.9768, test_f1: 0.6197
 epoch: 47, train_loss: 0.3975, test_loss: 1.0173, test_f1: 0.6661
 epoch: 48, train_loss: 0.3939, test_loss: 1.0656, test_f1: 0.6413
 epoch: 49, train_loss: 0.3844, test_loss: 1.3398, test_f1: 0.6296
 epoch: 50, train_loss: 0.3905, test_loss: 1.1651, test_f1: 0.6456
 epoch: 51, train_loss: 0.3255, test_loss: 1.1126, test_f1: 0.6624
 epoch: 52, train_loss: 0.3049, test_loss: 1.1547, test_f1: 0.6449
 epoch: 53, train_loss: 0.2940, test_loss: 1.2195, test_f1: 0.6479
 epoch: 54, train_loss: 0.3001, test_loss: 1.3099, test_f1: 0.6430
 epoch: 55, train_loss: 0.2983, test_loss: 1.1457, test_f1: 0.6404
 epoch: 56, train_loss: 0.2864, test_loss: 1.1863, test_f1: 0.6699
 epoch: 57, train_loss: 0.2996, test_loss: 1.2498, test_f1: 0.6480
 epoch: 58, train_loss: 0.2747, test_loss: 1.2321, test_f1: 0.6449
 epoch: 59, train_loss: 0.2950, test_loss: 1.2844, test_f1: 0.6426
 epoch: 60, train_loss: 0.2650, test_loss: 1.1996, test_f1: 0.6389
 epoch: 61, train_loss: 0.2713, test_loss: 1.3147, test_f1: 0.6531
 epoch: 62, train_loss: 0.2870, test_loss: 1.1786, test_f1: 0.6685
 epoch: 63, train_loss: 0.2583, test_loss: 1.3157, test_f1: 0.6562
 epoch: 64, train_loss: 0.2471, test_loss: 1.3738, test_f1: 0.6640
 epoch: 65, train_loss: 0.2428, test_loss: 1.3279, test_f1: 0.6383
 epoch: 66, train_loss: 0.2547, test_loss: 1.3029, test_f1: 0.6620
 epoch: 67, train_loss: 0.2431, test_loss: 1.3497, test_f1: 0.6603
 epoch: 68, train_loss: 0.2390, test_loss: 1.3678, test_f1: 0.6762
 epoch: 69, train_loss: 0.2425, test_loss: 1.4498, test_f1: 0.6371
 epoch: 70, train_loss: 0.2563, test_loss: 1.3461, test_f1: 0.6406
 epoch: 71, train_loss: 0.2524, test_loss: 1.4010, test_f1: 0.6375
 epoch: 72, train_loss: 0.2289, test_loss: 1.4566, test_f1: 0.6793
 epoch: 73, train_loss: 0.2193, test_loss: 1.4520, test_f1: 0.6705
 epoch: 74, train_loss: 0.2377, test_loss: 1.2535, test_f1: 0.6813
 epoch: 75, train_loss: 0.2139, test_loss: 1.5278, test_f1: 0.6610
 epoch: 76, train_loss: 0.2339, test_loss: 1.4135, test_f1: 0.6426
 epoch: 77, train_loss: 0.2086, test_loss: 1.5907, test_f1: 0.6449
 epoch: 78, train_loss: 0.2055, test_loss: 1.5397, test_f1: 0.6536
 epoch: 79, train_loss: 0.2091, test_loss: 1.5848, test_f1: 0.6446
 epoch: 80, train_loss: 0.2150, test_loss: 1.5117, test_f1: 0.6394
 epoch: 81, train_loss: 0.2143, test_loss: 1.5625, test_f1: 0.6296
 epoch: 82, train_loss: 0.2250, test_loss: 1.5978, test_f1: 0.6484
 epoch: 83, train_loss: 0.2085, test_loss: 1.7362, test_f1: 0.6471
 epoch: 84, train_loss: 0.1950, test_loss: 1.5733, test_f1: 0.6582
 epoch: 85, train_loss: 0.1888, test_loss: 1.6464, test_f1: 0.6388
 epoch: 86, train_loss: 0.2028, test_loss: 1.5993, test_f1: 0.6581
 epoch: 87, train_loss: 0.2031, test_loss: 1.6209, test_f1: 0.6661
 epoch: 88, train_loss: 0.1863, test_loss: 1.6693, test_f1: 0.6503
 epoch: 89, train_loss: 0.2044, test_loss: 1.7194, test_f1: 0.6410
 epoch: 90, train_loss: 0.1904, test_loss: 1.6073, test_f1: 0.6672
 epoch: 91, train_loss: 0.1884, test_loss: 1.7664, test_f1: 0.6390
 epoch: 92, train_loss: 0.1722, test_loss: 1.5741, test_f1: 0.6705
 epoch: 93, train_loss: 0.1755, test_loss: 1.7921, test_f1: 0.6426
 epoch: 94, train_loss: 0.1710, test_loss: 1.7823, test_f1: 0.6423
 epoch: 95, train_loss: 0.1767, test_loss: 1.7794, test_f1: 0.6538
 epoch: 96, train_loss: 0.1803, test_loss: 1.4667, test_f1: 0.6596
 epoch: 97, train_loss: 0.1858, test_loss: 1.6363, test_f1: 0.6478
 epoch: 98, train_loss: 0.1785, test_loss: 1.6435, test_f1: 0.6591
 epoch: 99, train_loss: 0.1834, test_loss: 1.6184, test_f1: 0.6453
##################ITERATION #7 ****************************************
 epoch: 0, train_loss: 1.1986, test_loss: 0.9823, test_f1: 0.5401
 epoch: 1, train_loss: 0.9624, test_loss: 0.9689, test_f1: 0.5594
 epoch: 2, train_loss: 0.9195, test_loss: 1.0440, test_f1: 0.5133
 epoch: 3, train_loss: 0.9069, test_loss: 0.9265, test_f1: 0.5526
 epoch: 4, train_loss: 0.8669, test_loss: 0.9155, test_f1: 0.5437
 epoch: 5, train_loss: 0.8403, test_loss: 0.9345, test_f1: 0.5149
 epoch: 6, train_loss: 0.8283, test_loss: 0.9264, test_f1: 0.5669
 epoch: 7, train_loss: 0.7860, test_loss: 0.8604, test_f1: 0.6010
 epoch: 8, train_loss: 0.7868, test_loss: 0.8806, test_f1: 0.5607
 epoch: 9, train_loss: 0.7712, test_loss: 0.8627, test_f1: 0.5798
 epoch: 10, train_loss: 0.7462, test_loss: 0.9254, test_f1: 0.5586
 epoch: 11, train_loss: 0.7336, test_loss: 0.8166, test_f1: 0.6159
 epoch: 12, train_loss: 0.7246, test_loss: 0.8262, test_f1: 0.6224
 epoch: 13, train_loss: 0.7109, test_loss: 0.7710, test_f1: 0.6017
 epoch: 14, train_loss: 0.6953, test_loss: 0.8460, test_f1: 0.6525
 epoch: 15, train_loss: 0.6680, test_loss: 0.8234, test_f1: 0.6188
 epoch: 16, train_loss: 0.6854, test_loss: 0.7622, test_f1: 0.6721
 epoch: 17, train_loss: 0.6727, test_loss: 0.8166, test_f1: 0.6341
 epoch: 18, train_loss: 0.6386, test_loss: 0.8689, test_f1: 0.6600
 epoch: 19, train_loss: 0.6595, test_loss: 0.8447, test_f1: 0.6161
 epoch: 20, train_loss: 0.6312, test_loss: 0.8336, test_f1: 0.6139
 epoch: 21, train_loss: 0.6311, test_loss: 0.8297, test_f1: 0.6369
 epoch: 22, train_loss: 0.6020, test_loss: 1.0830, test_f1: 0.5605
 epoch: 23, train_loss: 0.6054, test_loss: 0.8248, test_f1: 0.6309
 epoch: 24, train_loss: 0.5916, test_loss: 0.8572, test_f1: 0.6751
 epoch: 25, train_loss: 0.5920, test_loss: 0.7343, test_f1: 0.6871
 epoch: 26, train_loss: 0.5670, test_loss: 0.8607, test_f1: 0.6496
 epoch: 27, train_loss: 0.5539, test_loss: 0.8426, test_f1: 0.6827
 epoch: 28, train_loss: 0.5611, test_loss: 0.8677, test_f1: 0.6710
 epoch: 29, train_loss: 0.5327, test_loss: 0.8364, test_f1: 0.6468
 epoch: 30, train_loss: 0.5850, test_loss: 0.7492, test_f1: 0.6702
 epoch: 31, train_loss: 0.5450, test_loss: 1.0075, test_f1: 0.6623
 epoch: 32, train_loss: 0.5193, test_loss: 0.9143, test_f1: 0.6555
 epoch: 33, train_loss: 0.5062, test_loss: 0.8975, test_f1: 0.6738
 epoch: 34, train_loss: 0.4930, test_loss: 0.9571, test_f1: 0.6554
 epoch: 35, train_loss: 0.5048, test_loss: 0.7851, test_f1: 0.6613
 epoch: 36, train_loss: 0.4790, test_loss: 0.9012, test_f1: 0.6901
 epoch: 37, train_loss: 0.4750, test_loss: 0.8904, test_f1: 0.6855
 epoch: 38, train_loss: 0.4668, test_loss: 0.9266, test_f1: 0.6649
 epoch: 39, train_loss: 0.4536, test_loss: 0.8168, test_f1: 0.6618
 epoch: 40, train_loss: 0.4523, test_loss: 0.8780, test_f1: 0.6732
 epoch: 41, train_loss: 0.4507, test_loss: 0.8735, test_f1: 0.6579
 epoch: 42, train_loss: 0.4163, test_loss: 0.8945, test_f1: 0.6526
 epoch: 43, train_loss: 0.4414, test_loss: 0.8884, test_f1: 0.6626
 epoch: 44, train_loss: 0.4387, test_loss: 0.9535, test_f1: 0.6835
 epoch: 45, train_loss: 0.4181, test_loss: 0.9887, test_f1: 0.6771
 epoch: 46, train_loss: 0.3987, test_loss: 1.0148, test_f1: 0.6712
 epoch: 47, train_loss: 0.4098, test_loss: 0.9269, test_f1: 0.6767
 epoch: 48, train_loss: 0.3961, test_loss: 0.9462, test_f1: 0.6837
 epoch: 49, train_loss: 0.3882, test_loss: 1.0079, test_f1: 0.6729
 epoch: 50, train_loss: 0.3864, test_loss: 1.2069, test_f1: 0.6412
 epoch: 51, train_loss: 0.3537, test_loss: 1.1034, test_f1: 0.6660
 epoch: 52, train_loss: 0.3148, test_loss: 1.1077, test_f1: 0.6920
 epoch: 53, train_loss: 0.3071, test_loss: 1.1767, test_f1: 0.6643
 epoch: 54, train_loss: 0.3015, test_loss: 1.1919, test_f1: 0.6783
 epoch: 55, train_loss: 0.3018, test_loss: 1.2495, test_f1: 0.6737
 epoch: 56, train_loss: 0.2868, test_loss: 1.3058, test_f1: 0.6476
 epoch: 57, train_loss: 0.2877, test_loss: 1.3158, test_f1: 0.6908
 epoch: 58, train_loss: 0.2833, test_loss: 1.1995, test_f1: 0.6568
 epoch: 59, train_loss: 0.2952, test_loss: 1.1653, test_f1: 0.6745
 epoch: 60, train_loss: 0.2774, test_loss: 1.1425, test_f1: 0.6656
 epoch: 61, train_loss: 0.2736, test_loss: 1.2647, test_f1: 0.6779
 epoch: 62, train_loss: 0.2933, test_loss: 1.2196, test_f1: 0.6928
 epoch: 63, train_loss: 0.2674, test_loss: 1.2469, test_f1: 0.6771
 epoch: 64, train_loss: 0.2574, test_loss: 1.1674, test_f1: 0.7002
 epoch: 65, train_loss: 0.2476, test_loss: 1.2052, test_f1: 0.7124
 epoch: 66, train_loss: 0.2458, test_loss: 1.1764, test_f1: 0.6894
 epoch: 67, train_loss: 0.2475, test_loss: 1.2844, test_f1: 0.6783
 epoch: 68, train_loss: 0.2493, test_loss: 1.2527, test_f1: 0.6910
 epoch: 69, train_loss: 0.2562, test_loss: 1.1715, test_f1: 0.6862
 epoch: 70, train_loss: 0.2392, test_loss: 1.2580, test_f1: 0.6837
 epoch: 71, train_loss: 0.2432, test_loss: 1.2672, test_f1: 0.6800
 epoch: 72, train_loss: 0.2228, test_loss: 1.4044, test_f1: 0.6786
 epoch: 73, train_loss: 0.2405, test_loss: 1.2199, test_f1: 0.7029
 epoch: 74, train_loss: 0.2445, test_loss: 1.2717, test_f1: 0.6909
 epoch: 75, train_loss: 0.2218, test_loss: 1.3795, test_f1: 0.6895
 epoch: 76, train_loss: 0.2272, test_loss: 1.3824, test_f1: 0.6760
 epoch: 77, train_loss: 0.2250, test_loss: 1.3779, test_f1: 0.7048
 epoch: 78, train_loss: 0.2332, test_loss: 1.3327, test_f1: 0.6879
 epoch: 79, train_loss: 0.2453, test_loss: 1.4750, test_f1: 0.6401
 epoch: 80, train_loss: 0.2079, test_loss: 1.2592, test_f1: 0.7087
 epoch: 81, train_loss: 0.2163, test_loss: 1.3102, test_f1: 0.6667
 epoch: 82, train_loss: 0.2178, test_loss: 1.3464, test_f1: 0.6698
 epoch: 83, train_loss: 0.2110, test_loss: 1.5094, test_f1: 0.6677
 epoch: 84, train_loss: 0.2094, test_loss: 1.4224, test_f1: 0.6629
 epoch: 85, train_loss: 0.2071, test_loss: 1.4514, test_f1: 0.6870
 epoch: 86, train_loss: 0.2031, test_loss: 1.5246, test_f1: 0.6677
 epoch: 87, train_loss: 0.2006, test_loss: 1.3091, test_f1: 0.6979
 epoch: 88, train_loss: 0.2006, test_loss: 1.4832, test_f1: 0.6873
 epoch: 89, train_loss: 0.1883, test_loss: 1.4662, test_f1: 0.6657
 epoch: 90, train_loss: 0.2096, test_loss: 1.3947, test_f1: 0.6859
 epoch: 91, train_loss: 0.1965, test_loss: 1.4051, test_f1: 0.6778
 epoch: 92, train_loss: 0.1855, test_loss: 1.4357, test_f1: 0.6822
 epoch: 93, train_loss: 0.1873, test_loss: 1.4133, test_f1: 0.7015
 epoch: 94, train_loss: 0.2022, test_loss: 1.3913, test_f1: 0.6945
 epoch: 95, train_loss: 0.1905, test_loss: 1.5850, test_f1: 0.6656
 epoch: 96, train_loss: 0.1941, test_loss: 1.5754, test_f1: 0.6790
 epoch: 97, train_loss: 0.1839, test_loss: 1.4332, test_f1: 0.6742
 epoch: 98, train_loss: 0.1961, test_loss: 1.4386, test_f1: 0.7078
 epoch: 99, train_loss: 0.1806, test_loss: 1.4792, test_f1: 0.7016
##################ITERATION #8 ****************************************
 epoch: 0, train_loss: 1.1681, test_loss: 0.9954, test_f1: 0.5017
 epoch: 1, train_loss: 0.9742, test_loss: 0.9980, test_f1: 0.4560
 epoch: 2, train_loss: 0.9345, test_loss: 0.9415, test_f1: 0.4984
 epoch: 3, train_loss: 0.8971, test_loss: 0.9342, test_f1: 0.4860
 epoch: 4, train_loss: 0.8806, test_loss: 0.8189, test_f1: 0.5411
 epoch: 5, train_loss: 0.8373, test_loss: 0.9023, test_f1: 0.5207
 epoch: 6, train_loss: 0.8248, test_loss: 0.8340, test_f1: 0.5506
 epoch: 7, train_loss: 0.8060, test_loss: 0.8362, test_f1: 0.6040
 epoch: 8, train_loss: 0.7972, test_loss: 0.8486, test_f1: 0.5922
 epoch: 9, train_loss: 0.7820, test_loss: 0.9356, test_f1: 0.5467
 epoch: 10, train_loss: 0.7749, test_loss: 0.8185, test_f1: 0.6115
 epoch: 11, train_loss: 0.7228, test_loss: 0.8533, test_f1: 0.6048
 epoch: 12, train_loss: 0.7218, test_loss: 0.8957, test_f1: 0.5848
 epoch: 13, train_loss: 0.7085, test_loss: 0.8423, test_f1: 0.5931
 epoch: 14, train_loss: 0.6893, test_loss: 0.7833, test_f1: 0.6131
 epoch: 15, train_loss: 0.6855, test_loss: 0.8517, test_f1: 0.6301
 epoch: 16, train_loss: 0.6698, test_loss: 0.7723, test_f1: 0.6497
 epoch: 17, train_loss: 0.6591, test_loss: 0.8636, test_f1: 0.6128
 epoch: 18, train_loss: 0.6698, test_loss: 0.7827, test_f1: 0.6688
 epoch: 19, train_loss: 0.6530, test_loss: 0.8487, test_f1: 0.6284
 epoch: 20, train_loss: 0.6373, test_loss: 0.8869, test_f1: 0.6461
 epoch: 21, train_loss: 0.6253, test_loss: 0.9282, test_f1: 0.6298
 epoch: 22, train_loss: 0.6119, test_loss: 0.8458, test_f1: 0.6570
 epoch: 23, train_loss: 0.5888, test_loss: 0.7903, test_f1: 0.6590
 epoch: 24, train_loss: 0.6044, test_loss: 1.0143, test_f1: 0.6050
 epoch: 25, train_loss: 0.5710, test_loss: 0.7864, test_f1: 0.6092
 epoch: 26, train_loss: 0.5684, test_loss: 0.8559, test_f1: 0.6719
 epoch: 27, train_loss: 0.5581, test_loss: 0.8604, test_f1: 0.6926
 epoch: 28, train_loss: 0.5531, test_loss: 0.7914, test_f1: 0.6632
 epoch: 29, train_loss: 0.5384, test_loss: 0.8219, test_f1: 0.6725
 epoch: 30, train_loss: 0.5208, test_loss: 0.8662, test_f1: 0.6562
 epoch: 31, train_loss: 0.5272, test_loss: 0.7197, test_f1: 0.6813
 epoch: 32, train_loss: 0.5032, test_loss: 0.8445, test_f1: 0.6670
 epoch: 33, train_loss: 0.4904, test_loss: 0.8892, test_f1: 0.6289
 epoch: 34, train_loss: 0.4836, test_loss: 0.9126, test_f1: 0.6400
 epoch: 35, train_loss: 0.4760, test_loss: 0.9940, test_f1: 0.6448
 epoch: 36, train_loss: 0.4921, test_loss: 0.8549, test_f1: 0.6647
 epoch: 37, train_loss: 0.5069, test_loss: 0.8975, test_f1: 0.6619
 epoch: 38, train_loss: 0.4847, test_loss: 0.8343, test_f1: 0.6748
 epoch: 39, train_loss: 0.4449, test_loss: 0.8688, test_f1: 0.6766
 epoch: 40, train_loss: 0.4496, test_loss: 0.8161, test_f1: 0.6755
 epoch: 41, train_loss: 0.4516, test_loss: 0.7872, test_f1: 0.6549
 epoch: 42, train_loss: 0.4238, test_loss: 0.8779, test_f1: 0.6443
 epoch: 43, train_loss: 0.4386, test_loss: 0.9178, test_f1: 0.6674
 epoch: 44, train_loss: 0.4249, test_loss: 0.8433, test_f1: 0.7124
 epoch: 45, train_loss: 0.4162, test_loss: 0.8994, test_f1: 0.6640
 epoch: 46, train_loss: 0.4119, test_loss: 0.8630, test_f1: 0.6689
 epoch: 47, train_loss: 0.3989, test_loss: 0.9553, test_f1: 0.6556
 epoch: 48, train_loss: 0.3863, test_loss: 0.8062, test_f1: 0.6757
 epoch: 49, train_loss: 0.4118, test_loss: 0.8708, test_f1: 0.7027
 epoch: 50, train_loss: 0.3870, test_loss: 0.9337, test_f1: 0.6606
 epoch: 51, train_loss: 0.3293, test_loss: 0.9698, test_f1: 0.6630
 epoch: 52, train_loss: 0.3239, test_loss: 0.9851, test_f1: 0.6424
 epoch: 53, train_loss: 0.2935, test_loss: 1.0665, test_f1: 0.6798
 epoch: 54, train_loss: 0.3068, test_loss: 0.9962, test_f1: 0.6916
 epoch: 55, train_loss: 0.2841, test_loss: 1.0141, test_f1: 0.6950
 epoch: 56, train_loss: 0.3023, test_loss: 0.9715, test_f1: 0.6966
 epoch: 57, train_loss: 0.2806, test_loss: 0.9794, test_f1: 0.6840
 epoch: 58, train_loss: 0.2844, test_loss: 1.0728, test_f1: 0.6829
 epoch: 59, train_loss: 0.2881, test_loss: 1.0012, test_f1: 0.6674
 epoch: 60, train_loss: 0.2707, test_loss: 1.0750, test_f1: 0.6513
 epoch: 61, train_loss: 0.2776, test_loss: 0.9886, test_f1: 0.6856
 epoch: 62, train_loss: 0.2628, test_loss: 1.2010, test_f1: 0.6557
 epoch: 63, train_loss: 0.2748, test_loss: 0.9734, test_f1: 0.6832
 epoch: 64, train_loss: 0.2628, test_loss: 1.1151, test_f1: 0.6772
 epoch: 65, train_loss: 0.2523, test_loss: 1.1804, test_f1: 0.6835
 epoch: 66, train_loss: 0.2506, test_loss: 1.1353, test_f1: 0.6727
 epoch: 67, train_loss: 0.2613, test_loss: 1.2763, test_f1: 0.6602
 epoch: 68, train_loss: 0.2492, test_loss: 1.1826, test_f1: 0.6637
 epoch: 69, train_loss: 0.2289, test_loss: 1.1694, test_f1: 0.6568
 epoch: 70, train_loss: 0.2458, test_loss: 1.0776, test_f1: 0.6585
 epoch: 71, train_loss: 0.2468, test_loss: 1.2151, test_f1: 0.6605
 epoch: 72, train_loss: 0.2324, test_loss: 1.1357, test_f1: 0.6474
 epoch: 73, train_loss: 0.2411, test_loss: 1.0966, test_f1: 0.6659
 epoch: 74, train_loss: 0.2374, test_loss: 1.0960, test_f1: 0.6804
 epoch: 75, train_loss: 0.2124, test_loss: 1.2066, test_f1: 0.6487
 epoch: 76, train_loss: 0.2213, test_loss: 1.1935, test_f1: 0.6683
 epoch: 77, train_loss: 0.2363, test_loss: 1.1252, test_f1: 0.6669
 epoch: 78, train_loss: 0.2053, test_loss: 1.3115, test_f1: 0.6717
 epoch: 79, train_loss: 0.2160, test_loss: 1.2298, test_f1: 0.6688
 epoch: 80, train_loss: 0.2471, test_loss: 1.1318, test_f1: 0.6646
 epoch: 81, train_loss: 0.2343, test_loss: 1.3441, test_f1: 0.6858
 epoch: 82, train_loss: 0.2230, test_loss: 1.1357, test_f1: 0.6973
 epoch: 83, train_loss: 0.2070, test_loss: 1.1657, test_f1: 0.6620
 epoch: 84, train_loss: 0.2096, test_loss: 1.1938, test_f1: 0.6845
 epoch: 85, train_loss: 0.2265, test_loss: 1.2347, test_f1: 0.6584
 epoch: 86, train_loss: 0.2224, test_loss: 1.1731, test_f1: 0.6893
 epoch: 87, train_loss: 0.2107, test_loss: 1.0570, test_f1: 0.7052
 epoch: 88, train_loss: 0.2089, test_loss: 1.1783, test_f1: 0.6577
 epoch: 89, train_loss: 0.1904, test_loss: 1.2272, test_f1: 0.6687
 epoch: 90, train_loss: 0.2081, test_loss: 1.2260, test_f1: 0.6650
 epoch: 91, train_loss: 0.1940, test_loss: 1.1924, test_f1: 0.6714
 epoch: 92, train_loss: 0.1865, test_loss: 1.2033, test_f1: 0.6890
 epoch: 93, train_loss: 0.1889, test_loss: 1.1604, test_f1: 0.6640
 epoch: 94, train_loss: 0.2478, test_loss: 1.1881, test_f1: 0.6500
 epoch: 95, train_loss: 0.1943, test_loss: 1.2873, test_f1: 0.6442
 epoch: 96, train_loss: 0.2039, test_loss: 1.1195, test_f1: 0.6842
 epoch: 97, train_loss: 0.1961, test_loss: 1.1243, test_f1: 0.6788
 epoch: 98, train_loss: 0.2006, test_loss: 1.3845, test_f1: 0.6481
 epoch: 99, train_loss: 0.2058, test_loss: 1.2432, test_f1: 0.6630
##################ITERATION #9 ****************************************
 epoch: 0, train_loss: 1.2276, test_loss: 1.0822, test_f1: 0.4077
 epoch: 1, train_loss: 0.9876, test_loss: 0.9548, test_f1: 0.4738
 epoch: 2, train_loss: 0.9406, test_loss: 0.9173, test_f1: 0.4993
 epoch: 3, train_loss: 0.9071, test_loss: 0.9317, test_f1: 0.5619
 epoch: 4, train_loss: 0.8678, test_loss: 0.9209, test_f1: 0.4960
 epoch: 5, train_loss: 0.8462, test_loss: 0.8410, test_f1: 0.5924
 epoch: 6, train_loss: 0.8254, test_loss: 0.9930, test_f1: 0.4757
 epoch: 7, train_loss: 0.8093, test_loss: 0.8527, test_f1: 0.5893
 epoch: 8, train_loss: 0.7848, test_loss: 0.8837, test_f1: 0.5429
 epoch: 9, train_loss: 0.7831, test_loss: 0.8056, test_f1: 0.6330
 epoch: 10, train_loss: 0.7738, test_loss: 0.8148, test_f1: 0.5814
 epoch: 11, train_loss: 0.7415, test_loss: 0.8208, test_f1: 0.5957
 epoch: 12, train_loss: 0.7380, test_loss: 0.9025, test_f1: 0.6261
 epoch: 13, train_loss: 0.7170, test_loss: 0.8246, test_f1: 0.6433
 epoch: 14, train_loss: 0.7132, test_loss: 0.8288, test_f1: 0.6294
 epoch: 15, train_loss: 0.6938, test_loss: 0.8301, test_f1: 0.6484
 epoch: 16, train_loss: 0.6945, test_loss: 0.8394, test_f1: 0.6392
 epoch: 17, train_loss: 0.6860, test_loss: 0.8467, test_f1: 0.6390
 epoch: 18, train_loss: 0.6545, test_loss: 0.7787, test_f1: 0.6197
 epoch: 19, train_loss: 0.6504, test_loss: 0.8274, test_f1: 0.6549
 epoch: 20, train_loss: 0.6563, test_loss: 0.7998, test_f1: 0.6683
 epoch: 21, train_loss: 0.6197, test_loss: 0.8225, test_f1: 0.6707
 epoch: 22, train_loss: 0.6097, test_loss: 0.9505, test_f1: 0.6394
 epoch: 23, train_loss: 0.6068, test_loss: 0.8178, test_f1: 0.6465
 epoch: 24, train_loss: 0.6044, test_loss: 0.8495, test_f1: 0.6357
 epoch: 25, train_loss: 0.5902, test_loss: 0.7802, test_f1: 0.6724
 epoch: 26, train_loss: 0.5707, test_loss: 0.8381, test_f1: 0.6419
 epoch: 27, train_loss: 0.5804, test_loss: 0.8561, test_f1: 0.6853
 epoch: 28, train_loss: 0.5516, test_loss: 0.9018, test_f1: 0.6198
 epoch: 29, train_loss: 0.5578, test_loss: 0.8791, test_f1: 0.6755
 epoch: 30, train_loss: 0.5603, test_loss: 0.9944, test_f1: 0.6193
 epoch: 31, train_loss: 0.5220, test_loss: 0.8297, test_f1: 0.6803
 epoch: 32, train_loss: 0.5371, test_loss: 0.8920, test_f1: 0.6749
 epoch: 33, train_loss: 0.5248, test_loss: 0.9342, test_f1: 0.6297
 epoch: 34, train_loss: 0.5094, test_loss: 0.8050, test_f1: 0.6835
 epoch: 35, train_loss: 0.5201, test_loss: 0.9606, test_f1: 0.6436
 epoch: 36, train_loss: 0.5097, test_loss: 0.8277, test_f1: 0.6555
 epoch: 37, train_loss: 0.5114, test_loss: 0.9435, test_f1: 0.6538
 epoch: 38, train_loss: 0.4907, test_loss: 0.9676, test_f1: 0.6612
 epoch: 39, train_loss: 0.4694, test_loss: 0.8627, test_f1: 0.6648
 epoch: 40, train_loss: 0.4645, test_loss: 0.9092, test_f1: 0.6595
 epoch: 41, train_loss: 0.4631, test_loss: 0.8467, test_f1: 0.6688
 epoch: 42, train_loss: 0.4699, test_loss: 0.7922, test_f1: 0.7020
 epoch: 43, train_loss: 0.4340, test_loss: 0.8986, test_f1: 0.6911
 epoch: 44, train_loss: 0.4530, test_loss: 0.9314, test_f1: 0.6775
 epoch: 45, train_loss: 0.4411, test_loss: 0.9610, test_f1: 0.6485
 epoch: 46, train_loss: 0.4310, test_loss: 0.8454, test_f1: 0.6970
 epoch: 47, train_loss: 0.4140, test_loss: 0.9817, test_f1: 0.6708
 epoch: 48, train_loss: 0.4115, test_loss: 0.9730, test_f1: 0.6642
 epoch: 49, train_loss: 0.4138, test_loss: 0.9914, test_f1: 0.6686
 epoch: 50, train_loss: 0.4200, test_loss: 0.9153, test_f1: 0.6852
 epoch: 51, train_loss: 0.3706, test_loss: 0.9492, test_f1: 0.6940
 epoch: 52, train_loss: 0.3412, test_loss: 0.9692, test_f1: 0.6700
 epoch: 53, train_loss: 0.3238, test_loss: 0.9805, test_f1: 0.7074
 epoch: 54, train_loss: 0.3196, test_loss: 1.0357, test_f1: 0.6916
 epoch: 55, train_loss: 0.3087, test_loss: 1.1519, test_f1: 0.6738
 epoch: 56, train_loss: 0.3065, test_loss: 1.0763, test_f1: 0.6759
 epoch: 57, train_loss: 0.3301, test_loss: 1.0365, test_f1: 0.6687
 epoch: 58, train_loss: 0.3134, test_loss: 1.0990, test_f1: 0.6897
 epoch: 59, train_loss: 0.3012, test_loss: 1.0216, test_f1: 0.6852
 epoch: 60, train_loss: 0.2817, test_loss: 1.0875, test_f1: 0.6756
 epoch: 61, train_loss: 0.2885, test_loss: 1.1029, test_f1: 0.6679
 epoch: 62, train_loss: 0.2861, test_loss: 1.1872, test_f1: 0.6645
 epoch: 63, train_loss: 0.2810, test_loss: 1.0411, test_f1: 0.6764
 epoch: 64, train_loss: 0.2922, test_loss: 1.1019, test_f1: 0.6730
 epoch: 65, train_loss: 0.2621, test_loss: 1.1407, test_f1: 0.6671
 epoch: 66, train_loss: 0.2546, test_loss: 1.1865, test_f1: 0.6716
 epoch: 67, train_loss: 0.2627, test_loss: 1.1558, test_f1: 0.6603
 epoch: 68, train_loss: 0.2607, test_loss: 1.1970, test_f1: 0.6640
 epoch: 69, train_loss: 0.2488, test_loss: 1.2516, test_f1: 0.6565
 epoch: 70, train_loss: 0.2606, test_loss: 1.1603, test_f1: 0.6733
 epoch: 71, train_loss: 0.2557, test_loss: 1.1645, test_f1: 0.6730
 epoch: 72, train_loss: 0.2500, test_loss: 1.2818, test_f1: 0.6648
 epoch: 73, train_loss: 0.2492, test_loss: 1.2405, test_f1: 0.6669
 epoch: 74, train_loss: 0.2375, test_loss: 1.1784, test_f1: 0.6739
 epoch: 75, train_loss: 0.2518, test_loss: 1.2938, test_f1: 0.6469
 epoch: 76, train_loss: 0.2350, test_loss: 1.2354, test_f1: 0.6819
 epoch: 77, train_loss: 0.2457, test_loss: 1.3121, test_f1: 0.6663
 epoch: 78, train_loss: 0.2365, test_loss: 1.3741, test_f1: 0.6343
 epoch: 79, train_loss: 0.2256, test_loss: 1.2638, test_f1: 0.6734
 epoch: 80, train_loss: 0.2357, test_loss: 1.1346, test_f1: 0.6683
 epoch: 81, train_loss: 0.2239, test_loss: 1.2533, test_f1: 0.6446
 epoch: 82, train_loss: 0.2254, test_loss: 1.1791, test_f1: 0.6773
 epoch: 83, train_loss: 0.2334, test_loss: 1.2265, test_f1: 0.6823
 epoch: 84, train_loss: 0.2109, test_loss: 1.3864, test_f1: 0.6615
 epoch: 85, train_loss: 0.2084, test_loss: 1.4214, test_f1: 0.6474
 epoch: 86, train_loss: 0.2151, test_loss: 1.4310, test_f1: 0.6877
 epoch: 87, train_loss: 0.2260, test_loss: 1.3371, test_f1: 0.6797
 epoch: 88, train_loss: 0.2274, test_loss: 1.4174, test_f1: 0.6688
 epoch: 89, train_loss: 0.2174, test_loss: 1.4172, test_f1: 0.6657
 epoch: 90, train_loss: 0.2082, test_loss: 1.3385, test_f1: 0.6805
 epoch: 91, train_loss: 0.2056, test_loss: 1.3799, test_f1: 0.6655
 epoch: 92, train_loss: 0.1940, test_loss: 1.5069, test_f1: 0.6545
 epoch: 93, train_loss: 0.2025, test_loss: 1.4147, test_f1: 0.6931
 epoch: 94, train_loss: 0.1990, test_loss: 1.4144, test_f1: 0.6880
 epoch: 95, train_loss: 0.2127, test_loss: 1.2965, test_f1: 0.6726
 epoch: 96, train_loss: 0.1966, test_loss: 1.4283, test_f1: 0.6636
 epoch: 97, train_loss: 0.1862, test_loss: 1.5083, test_f1: 0.6578
 epoch: 98, train_loss: 0.1995, test_loss: 1.5208, test_f1: 0.6826
 epoch: 99, train_loss: 0.1955, test_loss: 1.3882, test_f1: 0.6624

Training completed in 969.00 seconds
Best F1: 0.7251 at epoch 68
Mean F1 across iterations: 0.7093  0.0102
========================FINAL RESULTS================================
FEGIN weighted F1: 0.7251  0.0102
python main.py --data ltspice_examples --representation component_pin --model FEGIN --layers 3 --hiddens 128 --batch_size 32 --lr 0.001 --emb_size 128 --epochs 100 --save_appendix component_pin_L3_H128_BS32_LR0.001_E128 --no_val
-----



STDERR:
  File "main.py", line 370, in <module>
    main()
  File "main.py", line 254, in main
    dataset = dataset_class(
  File "/home/philip/projects/ltspice_examples_code_repo/Circuit-Completion-Using-GNNs/component_classification_with_link_prediction_head/evaluation/FEGIN/kernel/circuit_datasets.py", line 15, in __init__
    self.data, self.slices = torch.load(self.processed_paths[0])
  File "/home/philip/.local/lib/python3.8/site-packages/torch/serialization.py", line 1040, in load
    warnings.warn(
  File "/usr/lib/python3.8/warnings.py", line 109, in _showwarnmsg
    sw(msg.message, msg.category, msg.filename, msg.lineno,
  File "main.py", line 47, in warn_with_traceback
    traceback.print_stack(file=log)
/home/philip/projects/ltspice_examples_code_repo/Circuit-Completion-Using-GNNs/component_classification_with_link_prediction_head/evaluation/FEGIN/kernel/circuit_datasets.py:15: FutureWarning: You are using `torch.load` with `weights_only=False` (the current default value), which uses the default pickle module implicitly. It is possible to construct malicious pickle data which will execute arbitrary code during unpickling (See https://github.com/pytorch/pytorch/blob/main/SECURITY.md#untrusted-models for more details). In a future release, the default value for `weights_only` will be flipped to `True`. This limits the functions that could be executed during unpickling. Arbitrary objects will no longer be allowed to be loaded via this mode unless they are explicitly allowlisted by the user via `torch.serialization.add_safe_globals`. We recommend you start setting `weights_only=True` for any use case where you don't have full control of the loaded file. Please open an issue on GitHub for any issues related to this experimental feature.
  self.data, self.slices = torch.load(self.processed_paths[0])
