STDOUT:
Results will be saved in /home/philip/projects/ltspice_examples_code_repo/Circuit-Completion-Using-GNNs/component_classification_with_link_prediction_head/evaluation/FEGIN/results/model_FEGIN_dataset_ltspice_examples
Command line input: python main.py --data ltspice_examples --representation component_component --model FEGIN --layers 3 --hiddens 16 --batch_size 256 --lr 0.001 --emb_size 128 --epochs 100 --save_appendix component_component_L3_H16_BS256_LR0.001_E128 --no_val
 is saved.
-----
ltspice_examples - FEGIN
Using 3 layers, 16 hidden units, h = 2
Loading component_component representation dataset
ENTERED
Training FEGIN on component_component representation
Train: 3556, Test: 845
##################ITERATION #0 ****************************************
 epoch: 0, train_loss: 1.3529, test_loss: 1.3466, test_f1: 0.2274
 epoch: 1, train_loss: 1.3288, test_loss: 1.3299, test_f1: 0.2274
 epoch: 2, train_loss: 1.3120, test_loss: 1.3087, test_f1: 0.2274
 epoch: 3, train_loss: 1.2965, test_loss: 1.2914, test_f1: 0.2274
 epoch: 4, train_loss: 1.2839, test_loss: 1.2820, test_f1: 0.2274
 epoch: 5, train_loss: 1.2761, test_loss: 1.2748, test_f1: 0.2274
 epoch: 6, train_loss: 1.2616, test_loss: 1.2637, test_f1: 0.2274
 epoch: 7, train_loss: 1.2526, test_loss: 1.2496, test_f1: 0.3051
 epoch: 8, train_loss: 1.2461, test_loss: 1.2377, test_f1: 0.3477
 epoch: 9, train_loss: 1.2363, test_loss: 1.2265, test_f1: 0.3457
 epoch: 10, train_loss: 1.2343, test_loss: 1.2193, test_f1: 0.3384
 epoch: 11, train_loss: 1.2207, test_loss: 1.2125, test_f1: 0.3354
 epoch: 12, train_loss: 1.2127, test_loss: 1.2030, test_f1: 0.3419
 epoch: 13, train_loss: 1.2026, test_loss: 1.1968, test_f1: 0.3410
 epoch: 14, train_loss: 1.1982, test_loss: 1.1951, test_f1: 0.3369
 epoch: 15, train_loss: 1.1939, test_loss: 1.1877, test_f1: 0.3545
 epoch: 16, train_loss: 1.1924, test_loss: 1.1809, test_f1: 0.3513
 epoch: 17, train_loss: 1.1810, test_loss: 1.1762, test_f1: 0.3507
 epoch: 18, train_loss: 1.1712, test_loss: 1.1746, test_f1: 0.3477
 epoch: 19, train_loss: 1.1716, test_loss: 1.1758, test_f1: 0.3499
 epoch: 20, train_loss: 1.1666, test_loss: 1.1708, test_f1: 0.3493
 epoch: 21, train_loss: 1.1613, test_loss: 1.1598, test_f1: 0.3523
 epoch: 22, train_loss: 1.1515, test_loss: 1.1511, test_f1: 0.3415
 epoch: 23, train_loss: 1.1499, test_loss: 1.1531, test_f1: 0.3444
 epoch: 24, train_loss: 1.1476, test_loss: 1.1423, test_f1: 0.3583
 epoch: 25, train_loss: 1.1338, test_loss: 1.1384, test_f1: 0.4060
 epoch: 26, train_loss: 1.1248, test_loss: 1.1325, test_f1: 0.4305
 epoch: 27, train_loss: 1.1223, test_loss: 1.1294, test_f1: 0.4307
 epoch: 28, train_loss: 1.1205, test_loss: 1.1285, test_f1: 0.4295
 epoch: 29, train_loss: 1.1096, test_loss: 1.1225, test_f1: 0.4318
 epoch: 30, train_loss: 1.1054, test_loss: 1.1141, test_f1: 0.4323
 epoch: 31, train_loss: 1.0985, test_loss: 1.1148, test_f1: 0.4408
 epoch: 32, train_loss: 1.0906, test_loss: 1.0988, test_f1: 0.4390
 epoch: 33, train_loss: 1.0731, test_loss: 1.0951, test_f1: 0.4341
 epoch: 34, train_loss: 1.0781, test_loss: 1.0862, test_f1: 0.4281
 epoch: 35, train_loss: 1.0781, test_loss: 1.0876, test_f1: 0.4280
 epoch: 36, train_loss: 1.0716, test_loss: 1.0775, test_f1: 0.4519
 epoch: 37, train_loss: 1.0619, test_loss: 1.0876, test_f1: 0.4302
 epoch: 38, train_loss: 1.0555, test_loss: 1.0656, test_f1: 0.4297
 epoch: 39, train_loss: 1.0485, test_loss: 1.0687, test_f1: 0.4349
 epoch: 40, train_loss: 1.0349, test_loss: 1.0593, test_f1: 0.4449
 epoch: 41, train_loss: 1.0299, test_loss: 1.0616, test_f1: 0.4431
 epoch: 42, train_loss: 1.0387, test_loss: 1.0567, test_f1: 0.4547
 epoch: 43, train_loss: 1.0306, test_loss: 1.0409, test_f1: 0.4631
 epoch: 44, train_loss: 1.0156, test_loss: 1.0530, test_f1: 0.4715
 epoch: 45, train_loss: 1.0147, test_loss: 1.0365, test_f1: 0.4495
 epoch: 46, train_loss: 1.0163, test_loss: 1.0389, test_f1: 0.4551
 epoch: 47, train_loss: 1.0027, test_loss: 1.0388, test_f1: 0.4772
 epoch: 48, train_loss: 1.0066, test_loss: 1.0388, test_f1: 0.4390
 epoch: 49, train_loss: 0.9981, test_loss: 1.0275, test_f1: 0.4609
 epoch: 50, train_loss: 0.9956, test_loss: 1.0201, test_f1: 0.4525
 epoch: 51, train_loss: 0.9865, test_loss: 1.0168, test_f1: 0.4645
 epoch: 52, train_loss: 0.9862, test_loss: 1.0229, test_f1: 0.4697
 epoch: 53, train_loss: 0.9797, test_loss: 1.0240, test_f1: 0.4841
 epoch: 54, train_loss: 0.9678, test_loss: 1.0145, test_f1: 0.4881
 epoch: 55, train_loss: 0.9734, test_loss: 1.0238, test_f1: 0.4701
 epoch: 56, train_loss: 0.9726, test_loss: 1.0204, test_f1: 0.4794
 epoch: 57, train_loss: 0.9747, test_loss: 1.0083, test_f1: 0.4806
 epoch: 58, train_loss: 0.9676, test_loss: 1.0086, test_f1: 0.4918
 epoch: 59, train_loss: 0.9621, test_loss: 1.0085, test_f1: 0.4887
 epoch: 60, train_loss: 0.9725, test_loss: 1.0187, test_f1: 0.4923
 epoch: 61, train_loss: 0.9556, test_loss: 1.0221, test_f1: 0.4616
 epoch: 62, train_loss: 0.9601, test_loss: 1.0117, test_f1: 0.4953
 epoch: 63, train_loss: 0.9562, test_loss: 1.0147, test_f1: 0.4900
 epoch: 64, train_loss: 0.9540, test_loss: 1.0112, test_f1: 0.4997
 epoch: 65, train_loss: 0.9580, test_loss: 1.0045, test_f1: 0.4957
 epoch: 66, train_loss: 0.9548, test_loss: 1.0104, test_f1: 0.4916
 epoch: 67, train_loss: 0.9465, test_loss: 1.0077, test_f1: 0.4874
 epoch: 68, train_loss: 0.9549, test_loss: 1.0086, test_f1: 0.4913
 epoch: 69, train_loss: 0.9542, test_loss: 1.0059, test_f1: 0.4963
 epoch: 70, train_loss: 0.9534, test_loss: 1.0053, test_f1: 0.5007
 epoch: 71, train_loss: 0.9485, test_loss: 1.0055, test_f1: 0.4921
 epoch: 72, train_loss: 0.9416, test_loss: 0.9983, test_f1: 0.5025
 epoch: 73, train_loss: 0.9422, test_loss: 1.0185, test_f1: 0.4889
 epoch: 74, train_loss: 0.9439, test_loss: 1.0014, test_f1: 0.5039
 epoch: 75, train_loss: 0.9342, test_loss: 1.0164, test_f1: 0.4855
 epoch: 76, train_loss: 0.9390, test_loss: 1.0015, test_f1: 0.5033
 epoch: 77, train_loss: 0.9386, test_loss: 1.0075, test_f1: 0.4945
 epoch: 78, train_loss: 0.9367, test_loss: 1.0149, test_f1: 0.5086
 epoch: 79, train_loss: 0.9314, test_loss: 1.0099, test_f1: 0.4878
 epoch: 80, train_loss: 0.9212, test_loss: 1.0130, test_f1: 0.4929
 epoch: 81, train_loss: 0.9325, test_loss: 1.0074, test_f1: 0.4980
 epoch: 82, train_loss: 0.9280, test_loss: 1.0184, test_f1: 0.5028
 epoch: 83, train_loss: 0.9243, test_loss: 1.0183, test_f1: 0.5048
 epoch: 84, train_loss: 0.9328, test_loss: 1.0117, test_f1: 0.5014
 epoch: 85, train_loss: 0.9221, test_loss: 1.0146, test_f1: 0.4974
 epoch: 86, train_loss: 0.9166, test_loss: 1.0010, test_f1: 0.5102
 epoch: 87, train_loss: 0.9156, test_loss: 1.0072, test_f1: 0.5136
 epoch: 88, train_loss: 0.9223, test_loss: 1.0052, test_f1: 0.5062
 epoch: 89, train_loss: 0.9108, test_loss: 1.0203, test_f1: 0.5046
 epoch: 90, train_loss: 0.9155, test_loss: 1.0200, test_f1: 0.5149
 epoch: 91, train_loss: 0.9183, test_loss: 1.0000, test_f1: 0.5084
 epoch: 92, train_loss: 0.9093, test_loss: 1.0119, test_f1: 0.5086
 epoch: 93, train_loss: 0.9099, test_loss: 1.0175, test_f1: 0.5062
 epoch: 94, train_loss: 0.9070, test_loss: 1.0120, test_f1: 0.5064
 epoch: 95, train_loss: 0.9130, test_loss: 1.0000, test_f1: 0.5166
 epoch: 96, train_loss: 0.9100, test_loss: 1.0061, test_f1: 0.5059
 epoch: 97, train_loss: 0.9031, test_loss: 1.0199, test_f1: 0.5091
 epoch: 98, train_loss: 0.9065, test_loss: 1.0139, test_f1: 0.4965
 epoch: 99, train_loss: 0.9009, test_loss: 1.0029, test_f1: 0.5077
##################ITERATION #1 ****************************************
 epoch: 0, train_loss: 1.3770, test_loss: 1.3773, test_f1: 0.2274
 epoch: 1, train_loss: 1.3287, test_loss: 1.3493, test_f1: 0.2274
 epoch: 2, train_loss: 1.3015, test_loss: 1.3063, test_f1: 0.2555
 epoch: 3, train_loss: 1.2837, test_loss: 1.2777, test_f1: 0.2555
 epoch: 4, train_loss: 1.2644, test_loss: 1.2601, test_f1: 0.2555
 epoch: 5, train_loss: 1.2540, test_loss: 1.2418, test_f1: 0.2648
 epoch: 6, train_loss: 1.2348, test_loss: 1.2203, test_f1: 0.3141
 epoch: 7, train_loss: 1.2288, test_loss: 1.2060, test_f1: 0.3250
 epoch: 8, train_loss: 1.2175, test_loss: 1.1975, test_f1: 0.3367
 epoch: 9, train_loss: 1.2099, test_loss: 1.1867, test_f1: 0.3523
 epoch: 10, train_loss: 1.1977, test_loss: 1.1821, test_f1: 0.3677
 epoch: 11, train_loss: 1.1905, test_loss: 1.1667, test_f1: 0.3885
 epoch: 12, train_loss: 1.1838, test_loss: 1.1624, test_f1: 0.3761
 epoch: 13, train_loss: 1.1814, test_loss: 1.1611, test_f1: 0.4177
 epoch: 14, train_loss: 1.1728, test_loss: 1.1555, test_f1: 0.4108
 epoch: 15, train_loss: 1.1710, test_loss: 1.1469, test_f1: 0.4072
 epoch: 16, train_loss: 1.1622, test_loss: 1.1495, test_f1: 0.3983
 epoch: 17, train_loss: 1.1523, test_loss: 1.1401, test_f1: 0.4158
 epoch: 18, train_loss: 1.1512, test_loss: 1.1396, test_f1: 0.4102
 epoch: 19, train_loss: 1.1427, test_loss: 1.1407, test_f1: 0.4221
 epoch: 20, train_loss: 1.1392, test_loss: 1.1307, test_f1: 0.4164
 epoch: 21, train_loss: 1.1322, test_loss: 1.1194, test_f1: 0.4262
 epoch: 22, train_loss: 1.1298, test_loss: 1.1172, test_f1: 0.4251
 epoch: 23, train_loss: 1.1290, test_loss: 1.1197, test_f1: 0.4487
 epoch: 24, train_loss: 1.1243, test_loss: 1.1071, test_f1: 0.4540
 epoch: 25, train_loss: 1.1146, test_loss: 1.1340, test_f1: 0.4523
 epoch: 26, train_loss: 1.1072, test_loss: 1.0993, test_f1: 0.4446
 epoch: 27, train_loss: 1.1080, test_loss: 1.1004, test_f1: 0.4566
 epoch: 28, train_loss: 1.1017, test_loss: 1.0995, test_f1: 0.4454
 epoch: 29, train_loss: 1.0984, test_loss: 1.0795, test_f1: 0.4842
 epoch: 30, train_loss: 1.0837, test_loss: 1.1084, test_f1: 0.4653
 epoch: 31, train_loss: 1.0876, test_loss: 1.0624, test_f1: 0.4689
 epoch: 32, train_loss: 1.0811, test_loss: 1.0770, test_f1: 0.4603
 epoch: 33, train_loss: 1.0768, test_loss: 1.0597, test_f1: 0.4795
 epoch: 34, train_loss: 1.0688, test_loss: 1.0682, test_f1: 0.4706
 epoch: 35, train_loss: 1.0785, test_loss: 1.0670, test_f1: 0.4674
 epoch: 36, train_loss: 1.0690, test_loss: 1.0741, test_f1: 0.4719
 epoch: 37, train_loss: 1.0685, test_loss: 1.0551, test_f1: 0.4594
 epoch: 38, train_loss: 1.0490, test_loss: 1.0473, test_f1: 0.4571
 epoch: 39, train_loss: 1.0571, test_loss: 1.0554, test_f1: 0.4677
 epoch: 40, train_loss: 1.0525, test_loss: 1.0472, test_f1: 0.4647
 epoch: 41, train_loss: 1.0434, test_loss: 1.0330, test_f1: 0.4816
 epoch: 42, train_loss: 1.0362, test_loss: 1.0706, test_f1: 0.4600
 epoch: 43, train_loss: 1.0388, test_loss: 1.0420, test_f1: 0.4694
 epoch: 44, train_loss: 1.0322, test_loss: 1.0450, test_f1: 0.4696
 epoch: 45, train_loss: 1.0438, test_loss: 1.0453, test_f1: 0.4656
 epoch: 46, train_loss: 1.0511, test_loss: 1.0345, test_f1: 0.4736
 epoch: 47, train_loss: 1.0443, test_loss: 1.0326, test_f1: 0.4699
 epoch: 48, train_loss: 1.0212, test_loss: 1.0412, test_f1: 0.4595
 epoch: 49, train_loss: 1.0259, test_loss: 1.0480, test_f1: 0.4711
 epoch: 50, train_loss: 1.0171, test_loss: 1.0274, test_f1: 0.4755
 epoch: 51, train_loss: 1.0221, test_loss: 1.0302, test_f1: 0.4779
 epoch: 52, train_loss: 1.0170, test_loss: 1.0284, test_f1: 0.4786
 epoch: 53, train_loss: 1.0084, test_loss: 1.0390, test_f1: 0.4621
 epoch: 54, train_loss: 1.0058, test_loss: 1.0283, test_f1: 0.4703
 epoch: 55, train_loss: 1.0092, test_loss: 1.0271, test_f1: 0.4727
 epoch: 56, train_loss: 1.0153, test_loss: 1.0432, test_f1: 0.4452
 epoch: 57, train_loss: 1.0132, test_loss: 1.0294, test_f1: 0.4688
 epoch: 58, train_loss: 1.0041, test_loss: 1.0241, test_f1: 0.4687
 epoch: 59, train_loss: 1.0005, test_loss: 1.0198, test_f1: 0.4711
 epoch: 60, train_loss: 0.9969, test_loss: 1.0316, test_f1: 0.4702
 epoch: 61, train_loss: 1.0028, test_loss: 1.0345, test_f1: 0.4636
 epoch: 62, train_loss: 0.9952, test_loss: 1.0284, test_f1: 0.4683
 epoch: 63, train_loss: 0.9875, test_loss: 1.0272, test_f1: 0.4693
 epoch: 64, train_loss: 1.0058, test_loss: 1.0410, test_f1: 0.4603
 epoch: 65, train_loss: 0.9996, test_loss: 1.0310, test_f1: 0.4621
 epoch: 66, train_loss: 0.9978, test_loss: 1.0368, test_f1: 0.4619
 epoch: 67, train_loss: 0.9979, test_loss: 1.0446, test_f1: 0.4677
 epoch: 68, train_loss: 0.9975, test_loss: 1.0376, test_f1: 0.4706
 epoch: 69, train_loss: 0.9863, test_loss: 1.0338, test_f1: 0.4702
 epoch: 70, train_loss: 0.9803, test_loss: 1.0352, test_f1: 0.4718
 epoch: 71, train_loss: 0.9841, test_loss: 1.0421, test_f1: 0.4660
 epoch: 72, train_loss: 0.9854, test_loss: 1.0423, test_f1: 0.4721
 epoch: 73, train_loss: 0.9851, test_loss: 1.0490, test_f1: 0.4684
 epoch: 74, train_loss: 0.9851, test_loss: 1.0552, test_f1: 0.4638
 epoch: 75, train_loss: 0.9821, test_loss: 1.0362, test_f1: 0.4658
 epoch: 76, train_loss: 0.9815, test_loss: 1.0468, test_f1: 0.4585
 epoch: 77, train_loss: 0.9867, test_loss: 1.0343, test_f1: 0.4676
 epoch: 78, train_loss: 0.9804, test_loss: 1.0345, test_f1: 0.4833
 epoch: 79, train_loss: 0.9874, test_loss: 1.0281, test_f1: 0.4687
 epoch: 80, train_loss: 0.9747, test_loss: 1.0497, test_f1: 0.4772
 epoch: 81, train_loss: 0.9834, test_loss: 1.0221, test_f1: 0.4754
 epoch: 82, train_loss: 0.9781, test_loss: 1.0446, test_f1: 0.4742
 epoch: 83, train_loss: 0.9760, test_loss: 1.0359, test_f1: 0.4753
 epoch: 84, train_loss: 0.9704, test_loss: 1.0384, test_f1: 0.4752
 epoch: 85, train_loss: 0.9740, test_loss: 1.0298, test_f1: 0.4696
 epoch: 86, train_loss: 0.9624, test_loss: 1.0285, test_f1: 0.4830
 epoch: 87, train_loss: 0.9692, test_loss: 1.0363, test_f1: 0.4666
 epoch: 88, train_loss: 0.9783, test_loss: 1.0504, test_f1: 0.4783
 epoch: 89, train_loss: 0.9624, test_loss: 1.0479, test_f1: 0.4698
 epoch: 90, train_loss: 0.9656, test_loss: 1.0334, test_f1: 0.4672
 epoch: 91, train_loss: 0.9658, test_loss: 1.0385, test_f1: 0.4753
 epoch: 92, train_loss: 0.9707, test_loss: 1.0415, test_f1: 0.4784
 epoch: 93, train_loss: 0.9634, test_loss: 1.0311, test_f1: 0.4743
 epoch: 94, train_loss: 0.9583, test_loss: 1.0373, test_f1: 0.4865
 epoch: 95, train_loss: 0.9568, test_loss: 1.0312, test_f1: 0.4807
 epoch: 96, train_loss: 0.9670, test_loss: 1.0465, test_f1: 0.4752
 epoch: 97, train_loss: 0.9603, test_loss: 1.0209, test_f1: 0.4808
 epoch: 98, train_loss: 0.9575, test_loss: 1.0239, test_f1: 0.4739
 epoch: 99, train_loss: 0.9591, test_loss: 1.0108, test_f1: 0.4841
##################ITERATION #2 ****************************************
 epoch: 0, train_loss: 1.3442, test_loss: 1.3341, test_f1: 0.2274
 epoch: 1, train_loss: 1.2946, test_loss: 1.3071, test_f1: 0.2274
 epoch: 2, train_loss: 1.2724, test_loss: 1.2810, test_f1: 0.2274
 epoch: 3, train_loss: 1.2602, test_loss: 1.2553, test_f1: 0.2274
 epoch: 4, train_loss: 1.2536, test_loss: 1.2386, test_f1: 0.2274
 epoch: 5, train_loss: 1.2375, test_loss: 1.2261, test_f1: 0.2563
 epoch: 6, train_loss: 1.2322, test_loss: 1.2158, test_f1: 0.2882
 epoch: 7, train_loss: 1.2223, test_loss: 1.2026, test_f1: 0.3074
 epoch: 8, train_loss: 1.2174, test_loss: 1.1975, test_f1: 0.3284
 epoch: 9, train_loss: 1.2080, test_loss: 1.1770, test_f1: 0.3687
 epoch: 10, train_loss: 1.2016, test_loss: 1.1647, test_f1: 0.3888
 epoch: 11, train_loss: 1.1969, test_loss: 1.1627, test_f1: 0.3943
 epoch: 12, train_loss: 1.1899, test_loss: 1.1500, test_f1: 0.4005
 epoch: 13, train_loss: 1.1847, test_loss: 1.1523, test_f1: 0.4078
 epoch: 14, train_loss: 1.1752, test_loss: 1.1336, test_f1: 0.4123
 epoch: 15, train_loss: 1.1603, test_loss: 1.1319, test_f1: 0.4053
 epoch: 16, train_loss: 1.1564, test_loss: 1.1184, test_f1: 0.4503
 epoch: 17, train_loss: 1.1429, test_loss: 1.1153, test_f1: 0.4461
 epoch: 18, train_loss: 1.1523, test_loss: 1.1114, test_f1: 0.4329
 epoch: 19, train_loss: 1.1420, test_loss: 1.1100, test_f1: 0.4304
 epoch: 20, train_loss: 1.1361, test_loss: 1.1044, test_f1: 0.4360
 epoch: 21, train_loss: 1.1299, test_loss: 1.0959, test_f1: 0.4573
 epoch: 22, train_loss: 1.1287, test_loss: 1.1051, test_f1: 0.4515
 epoch: 23, train_loss: 1.1206, test_loss: 1.0875, test_f1: 0.4520
 epoch: 24, train_loss: 1.1163, test_loss: 1.0926, test_f1: 0.4535
 epoch: 25, train_loss: 1.1142, test_loss: 1.0877, test_f1: 0.4599
 epoch: 26, train_loss: 1.1127, test_loss: 1.0842, test_f1: 0.4549
 epoch: 27, train_loss: 1.0963, test_loss: 1.0655, test_f1: 0.4879
 epoch: 28, train_loss: 1.0991, test_loss: 1.0626, test_f1: 0.4623
 epoch: 29, train_loss: 1.0921, test_loss: 1.0839, test_f1: 0.4512
 epoch: 30, train_loss: 1.0872, test_loss: 1.0560, test_f1: 0.4673
 epoch: 31, train_loss: 1.0798, test_loss: 1.0519, test_f1: 0.4673
 epoch: 32, train_loss: 1.0842, test_loss: 1.0602, test_f1: 0.4548
 epoch: 33, train_loss: 1.0744, test_loss: 1.0597, test_f1: 0.4559
 epoch: 34, train_loss: 1.0677, test_loss: 1.0498, test_f1: 0.4483
 epoch: 35, train_loss: 1.0629, test_loss: 1.0385, test_f1: 0.4922
 epoch: 36, train_loss: 1.0609, test_loss: 1.0258, test_f1: 0.4910
 epoch: 37, train_loss: 1.0579, test_loss: 1.0275, test_f1: 0.4703
 epoch: 38, train_loss: 1.0408, test_loss: 1.0311, test_f1: 0.4683
 epoch: 39, train_loss: 1.0469, test_loss: 1.0138, test_f1: 0.4971
 epoch: 40, train_loss: 1.0345, test_loss: 1.0089, test_f1: 0.4975
 epoch: 41, train_loss: 1.0328, test_loss: 1.0201, test_f1: 0.4569
 epoch: 42, train_loss: 1.0266, test_loss: 0.9996, test_f1: 0.4912
 epoch: 43, train_loss: 1.0241, test_loss: 1.0657, test_f1: 0.4388
 epoch: 44, train_loss: 1.0189, test_loss: 0.9926, test_f1: 0.5091
 epoch: 45, train_loss: 1.0132, test_loss: 1.0312, test_f1: 0.4661
 epoch: 46, train_loss: 1.0163, test_loss: 1.0014, test_f1: 0.4719
 epoch: 47, train_loss: 1.0083, test_loss: 1.0036, test_f1: 0.4798
 epoch: 48, train_loss: 1.0036, test_loss: 0.9757, test_f1: 0.4907
 epoch: 49, train_loss: 0.9971, test_loss: 0.9799, test_f1: 0.5074
 epoch: 50, train_loss: 0.9997, test_loss: 0.9900, test_f1: 0.4822
 epoch: 51, train_loss: 0.9957, test_loss: 0.9896, test_f1: 0.4745
 epoch: 52, train_loss: 0.9830, test_loss: 1.0035, test_f1: 0.4857
 epoch: 53, train_loss: 0.9801, test_loss: 0.9875, test_f1: 0.4853
 epoch: 54, train_loss: 0.9780, test_loss: 0.9909, test_f1: 0.4948
 epoch: 55, train_loss: 0.9791, test_loss: 0.9828, test_f1: 0.4825
 epoch: 56, train_loss: 0.9760, test_loss: 0.9932, test_f1: 0.4854
 epoch: 57, train_loss: 0.9681, test_loss: 0.9748, test_f1: 0.4858
 epoch: 58, train_loss: 0.9745, test_loss: 0.9724, test_f1: 0.4911
 epoch: 59, train_loss: 0.9783, test_loss: 0.9928, test_f1: 0.4692
 epoch: 60, train_loss: 0.9796, test_loss: 1.0112, test_f1: 0.4787
 epoch: 61, train_loss: 0.9661, test_loss: 0.9713, test_f1: 0.4817
 epoch: 62, train_loss: 0.9747, test_loss: 0.9837, test_f1: 0.4614
 epoch: 63, train_loss: 0.9612, test_loss: 1.0219, test_f1: 0.4827
 epoch: 64, train_loss: 0.9608, test_loss: 0.9713, test_f1: 0.4849
 epoch: 65, train_loss: 0.9718, test_loss: 0.9673, test_f1: 0.5009
 epoch: 66, train_loss: 0.9621, test_loss: 0.9803, test_f1: 0.4809
 epoch: 67, train_loss: 0.9727, test_loss: 0.9967, test_f1: 0.4732
 epoch: 68, train_loss: 0.9605, test_loss: 0.9770, test_f1: 0.4739
 epoch: 69, train_loss: 0.9588, test_loss: 0.9910, test_f1: 0.4846
 epoch: 70, train_loss: 0.9553, test_loss: 0.9896, test_f1: 0.4788
 epoch: 71, train_loss: 0.9609, test_loss: 0.9585, test_f1: 0.4805
 epoch: 72, train_loss: 0.9534, test_loss: 0.9745, test_f1: 0.4862
 epoch: 73, train_loss: 0.9451, test_loss: 0.9821, test_f1: 0.4787
 epoch: 74, train_loss: 0.9542, test_loss: 0.9819, test_f1: 0.4846
 epoch: 75, train_loss: 0.9503, test_loss: 0.9833, test_f1: 0.4830
 epoch: 76, train_loss: 0.9530, test_loss: 0.9860, test_f1: 0.4726
 epoch: 77, train_loss: 0.9524, test_loss: 0.9751, test_f1: 0.4823
 epoch: 78, train_loss: 0.9509, test_loss: 1.0251, test_f1: 0.4738
 epoch: 79, train_loss: 0.9583, test_loss: 0.9682, test_f1: 0.4859
 epoch: 80, train_loss: 0.9418, test_loss: 0.9937, test_f1: 0.4933
 epoch: 81, train_loss: 0.9498, test_loss: 0.9875, test_f1: 0.4729
 epoch: 82, train_loss: 0.9466, test_loss: 1.0045, test_f1: 0.4747
 epoch: 83, train_loss: 0.9394, test_loss: 0.9845, test_f1: 0.4918
 epoch: 84, train_loss: 0.9435, test_loss: 0.9706, test_f1: 0.4903
 epoch: 85, train_loss: 0.9396, test_loss: 0.9892, test_f1: 0.4953
 epoch: 86, train_loss: 0.9394, test_loss: 0.9559, test_f1: 0.4818
 epoch: 87, train_loss: 0.9418, test_loss: 0.9927, test_f1: 0.4734
 epoch: 88, train_loss: 0.9393, test_loss: 0.9675, test_f1: 0.4822
 epoch: 89, train_loss: 0.9321, test_loss: 1.0317, test_f1: 0.4721
 epoch: 90, train_loss: 0.9327, test_loss: 0.9609, test_f1: 0.4936
 epoch: 91, train_loss: 0.9415, test_loss: 0.9700, test_f1: 0.4907
 epoch: 92, train_loss: 0.9326, test_loss: 0.9604, test_f1: 0.4976
 epoch: 93, train_loss: 0.9348, test_loss: 0.9625, test_f1: 0.4835
 epoch: 94, train_loss: 0.9220, test_loss: 1.0040, test_f1: 0.4783
 epoch: 95, train_loss: 0.9254, test_loss: 0.9551, test_f1: 0.4980
 epoch: 96, train_loss: 0.9328, test_loss: 0.9728, test_f1: 0.4841
 epoch: 97, train_loss: 0.9277, test_loss: 0.9760, test_f1: 0.4961
 epoch: 98, train_loss: 0.9288, test_loss: 0.9700, test_f1: 0.4913
 epoch: 99, train_loss: 0.9198, test_loss: 0.9768, test_f1: 0.4816
##################ITERATION #3 ****************************************
 epoch: 0, train_loss: 1.4500, test_loss: 1.4413, test_f1: 0.2390
 epoch: 1, train_loss: 1.3229, test_loss: 1.3511, test_f1: 0.2318
 epoch: 2, train_loss: 1.2972, test_loss: 1.3083, test_f1: 0.2274
 epoch: 3, train_loss: 1.2759, test_loss: 1.2755, test_f1: 0.2274
 epoch: 4, train_loss: 1.2644, test_loss: 1.2495, test_f1: 0.2274
 epoch: 5, train_loss: 1.2551, test_loss: 1.2305, test_f1: 0.2301
 epoch: 6, train_loss: 1.2402, test_loss: 1.2188, test_f1: 0.2709
 epoch: 7, train_loss: 1.2381, test_loss: 1.2074, test_f1: 0.3080
 epoch: 8, train_loss: 1.2240, test_loss: 1.2004, test_f1: 0.3097
 epoch: 9, train_loss: 1.2170, test_loss: 1.1843, test_f1: 0.3334
 epoch: 10, train_loss: 1.2078, test_loss: 1.1731, test_f1: 0.3588
 epoch: 11, train_loss: 1.2004, test_loss: 1.1621, test_f1: 0.3716
 epoch: 12, train_loss: 1.1902, test_loss: 1.1599, test_f1: 0.3572
 epoch: 13, train_loss: 1.1866, test_loss: 1.1465, test_f1: 0.3928
 epoch: 14, train_loss: 1.1724, test_loss: 1.1350, test_f1: 0.4110
 epoch: 15, train_loss: 1.1663, test_loss: 1.1225, test_f1: 0.4217
 epoch: 16, train_loss: 1.1655, test_loss: 1.1182, test_f1: 0.4174
 epoch: 17, train_loss: 1.1488, test_loss: 1.1102, test_f1: 0.4248
 epoch: 18, train_loss: 1.1397, test_loss: 1.1074, test_f1: 0.4214
 epoch: 19, train_loss: 1.1485, test_loss: 1.1018, test_f1: 0.4339
 epoch: 20, train_loss: 1.1355, test_loss: 1.0904, test_f1: 0.4339
 epoch: 21, train_loss: 1.1277, test_loss: 1.0882, test_f1: 0.4408
 epoch: 22, train_loss: 1.1252, test_loss: 1.0945, test_f1: 0.4216
 epoch: 23, train_loss: 1.1187, test_loss: 1.0820, test_f1: 0.4340
 epoch: 24, train_loss: 1.1125, test_loss: 1.0814, test_f1: 0.4234
 epoch: 25, train_loss: 1.1055, test_loss: 1.0718, test_f1: 0.4283
 epoch: 26, train_loss: 1.1049, test_loss: 1.0727, test_f1: 0.4270
 epoch: 27, train_loss: 1.1052, test_loss: 1.0657, test_f1: 0.4344
 epoch: 28, train_loss: 1.0891, test_loss: 1.0674, test_f1: 0.4215
 epoch: 29, train_loss: 1.0911, test_loss: 1.0612, test_f1: 0.4289
 epoch: 30, train_loss: 1.0855, test_loss: 1.0771, test_f1: 0.4093
 epoch: 31, train_loss: 1.0928, test_loss: 1.0535, test_f1: 0.4299
 epoch: 32, train_loss: 1.0770, test_loss: 1.0537, test_f1: 0.4342
 epoch: 33, train_loss: 1.0768, test_loss: 1.0628, test_f1: 0.4281
 epoch: 34, train_loss: 1.0688, test_loss: 1.0479, test_f1: 0.4433
 epoch: 35, train_loss: 1.0672, test_loss: 1.0500, test_f1: 0.4432
 epoch: 36, train_loss: 1.0554, test_loss: 1.0404, test_f1: 0.4417
 epoch: 37, train_loss: 1.0549, test_loss: 1.0495, test_f1: 0.4407
 epoch: 38, train_loss: 1.0457, test_loss: 1.0402, test_f1: 0.4365
 epoch: 39, train_loss: 1.0433, test_loss: 1.0453, test_f1: 0.4319
 epoch: 40, train_loss: 1.0480, test_loss: 1.0312, test_f1: 0.4362
 epoch: 41, train_loss: 1.0356, test_loss: 1.0326, test_f1: 0.4327
 epoch: 42, train_loss: 1.0297, test_loss: 1.0282, test_f1: 0.4354
 epoch: 43, train_loss: 1.0200, test_loss: 1.0186, test_f1: 0.4514
 epoch: 44, train_loss: 1.0254, test_loss: 1.0097, test_f1: 0.4406
 epoch: 45, train_loss: 1.0170, test_loss: 1.0149, test_f1: 0.4502
 epoch: 46, train_loss: 1.0194, test_loss: 1.0166, test_f1: 0.4533
 epoch: 47, train_loss: 1.0180, test_loss: 1.0129, test_f1: 0.4549
 epoch: 48, train_loss: 1.0047, test_loss: 1.0221, test_f1: 0.4350
 epoch: 49, train_loss: 1.0039, test_loss: 1.0312, test_f1: 0.4447
 epoch: 50, train_loss: 1.0015, test_loss: 0.9910, test_f1: 0.4575
 epoch: 51, train_loss: 0.9958, test_loss: 0.9966, test_f1: 0.4489
 epoch: 52, train_loss: 0.9959, test_loss: 0.9977, test_f1: 0.4615
 epoch: 53, train_loss: 0.9914, test_loss: 1.0004, test_f1: 0.4551
 epoch: 54, train_loss: 0.9912, test_loss: 1.0020, test_f1: 0.4563
 epoch: 55, train_loss: 0.9931, test_loss: 1.0017, test_f1: 0.4529
 epoch: 56, train_loss: 0.9853, test_loss: 1.0092, test_f1: 0.4527
 epoch: 57, train_loss: 0.9863, test_loss: 1.0040, test_f1: 0.4598
 epoch: 58, train_loss: 0.9841, test_loss: 1.0068, test_f1: 0.4545
 epoch: 59, train_loss: 0.9754, test_loss: 0.9977, test_f1: 0.4534
 epoch: 60, train_loss: 0.9838, test_loss: 1.0063, test_f1: 0.4535
 epoch: 61, train_loss: 0.9740, test_loss: 1.0089, test_f1: 0.4422
 epoch: 62, train_loss: 0.9757, test_loss: 1.0094, test_f1: 0.4538
 epoch: 63, train_loss: 0.9714, test_loss: 1.0042, test_f1: 0.4615
 epoch: 64, train_loss: 0.9827, test_loss: 1.0051, test_f1: 0.4668
 epoch: 65, train_loss: 0.9678, test_loss: 1.0101, test_f1: 0.4585
 epoch: 66, train_loss: 0.9704, test_loss: 1.0159, test_f1: 0.4703
 epoch: 67, train_loss: 0.9736, test_loss: 1.0165, test_f1: 0.4787
 epoch: 68, train_loss: 0.9589, test_loss: 1.0139, test_f1: 0.4711
 epoch: 69, train_loss: 0.9619, test_loss: 1.0068, test_f1: 0.4689
 epoch: 70, train_loss: 0.9687, test_loss: 1.0056, test_f1: 0.4719
 epoch: 71, train_loss: 0.9714, test_loss: 1.0118, test_f1: 0.4632
 epoch: 72, train_loss: 0.9684, test_loss: 1.0040, test_f1: 0.4644
 epoch: 73, train_loss: 0.9525, test_loss: 1.0126, test_f1: 0.4636
 epoch: 74, train_loss: 0.9668, test_loss: 0.9998, test_f1: 0.4782
 epoch: 75, train_loss: 0.9619, test_loss: 1.0065, test_f1: 0.4592
 epoch: 76, train_loss: 0.9502, test_loss: 1.0049, test_f1: 0.4617
 epoch: 77, train_loss: 0.9483, test_loss: 0.9992, test_f1: 0.4749
 epoch: 78, train_loss: 0.9553, test_loss: 0.9992, test_f1: 0.4855
 epoch: 79, train_loss: 0.9681, test_loss: 1.0027, test_f1: 0.4782
 epoch: 80, train_loss: 0.9591, test_loss: 1.0142, test_f1: 0.4716
 epoch: 81, train_loss: 0.9518, test_loss: 1.0219, test_f1: 0.4904
 epoch: 82, train_loss: 0.9560, test_loss: 1.0029, test_f1: 0.4934
 epoch: 83, train_loss: 0.9532, test_loss: 1.0019, test_f1: 0.5057
 epoch: 84, train_loss: 0.9502, test_loss: 1.0248, test_f1: 0.4918
 epoch: 85, train_loss: 0.9484, test_loss: 1.0078, test_f1: 0.4939
 epoch: 86, train_loss: 0.9452, test_loss: 1.0040, test_f1: 0.4981
 epoch: 87, train_loss: 0.9436, test_loss: 1.0085, test_f1: 0.4934
 epoch: 88, train_loss: 0.9398, test_loss: 1.0139, test_f1: 0.4918
 epoch: 89, train_loss: 0.9454, test_loss: 1.0025, test_f1: 0.4952
 epoch: 90, train_loss: 0.9406, test_loss: 1.0068, test_f1: 0.5024
 epoch: 91, train_loss: 0.9437, test_loss: 1.0120, test_f1: 0.4860
 epoch: 92, train_loss: 0.9392, test_loss: 1.0061, test_f1: 0.4959
 epoch: 93, train_loss: 0.9450, test_loss: 1.0163, test_f1: 0.4952
 epoch: 94, train_loss: 0.9404, test_loss: 1.0032, test_f1: 0.5092
 epoch: 95, train_loss: 0.9356, test_loss: 1.0001, test_f1: 0.4915
 epoch: 96, train_loss: 0.9365, test_loss: 1.0054, test_f1: 0.4852
 epoch: 97, train_loss: 0.9295, test_loss: 1.0009, test_f1: 0.4818
 epoch: 98, train_loss: 0.9383, test_loss: 0.9963, test_f1: 0.4967
 epoch: 99, train_loss: 0.9367, test_loss: 0.9926, test_f1: 0.5073
##################ITERATION #4 ****************************************
 epoch: 0, train_loss: 1.3437, test_loss: 1.3210, test_f1: 0.2274
 epoch: 1, train_loss: 1.2890, test_loss: 1.2952, test_f1: 0.2274
 epoch: 2, train_loss: 1.2645, test_loss: 1.2585, test_f1: 0.2493
 epoch: 3, train_loss: 1.2479, test_loss: 1.2323, test_f1: 0.2869
 epoch: 4, train_loss: 1.2350, test_loss: 1.2180, test_f1: 0.3142
 epoch: 5, train_loss: 1.2303, test_loss: 1.2046, test_f1: 0.3328
 epoch: 6, train_loss: 1.2173, test_loss: 1.1930, test_f1: 0.3624
 epoch: 7, train_loss: 1.2084, test_loss: 1.1866, test_f1: 0.3568
 epoch: 8, train_loss: 1.2066, test_loss: 1.1759, test_f1: 0.3850
 epoch: 9, train_loss: 1.1995, test_loss: 1.1602, test_f1: 0.3965
 epoch: 10, train_loss: 1.1874, test_loss: 1.1435, test_f1: 0.4108
 epoch: 11, train_loss: 1.1780, test_loss: 1.1366, test_f1: 0.4118
 epoch: 12, train_loss: 1.1771, test_loss: 1.1235, test_f1: 0.4436
 epoch: 13, train_loss: 1.1569, test_loss: 1.1147, test_f1: 0.4446
 epoch: 14, train_loss: 1.1576, test_loss: 1.1098, test_f1: 0.4357
 epoch: 15, train_loss: 1.1488, test_loss: 1.0953, test_f1: 0.4183
 epoch: 16, train_loss: 1.1474, test_loss: 1.0957, test_f1: 0.4453
 epoch: 17, train_loss: 1.1337, test_loss: 1.0912, test_f1: 0.4472
 epoch: 18, train_loss: 1.1281, test_loss: 1.0762, test_f1: 0.4430
 epoch: 19, train_loss: 1.1316, test_loss: 1.0681, test_f1: 0.4389
 epoch: 20, train_loss: 1.1197, test_loss: 1.0581, test_f1: 0.4556
 epoch: 21, train_loss: 1.1088, test_loss: 1.0549, test_f1: 0.4600
 epoch: 22, train_loss: 1.1086, test_loss: 1.0536, test_f1: 0.4673
 epoch: 23, train_loss: 1.1000, test_loss: 1.0360, test_f1: 0.4650
 epoch: 24, train_loss: 1.0914, test_loss: 1.0330, test_f1: 0.4835
 epoch: 25, train_loss: 1.0875, test_loss: 1.0222, test_f1: 0.4798
 epoch: 26, train_loss: 1.0702, test_loss: 1.0165, test_f1: 0.4703
 epoch: 27, train_loss: 1.0694, test_loss: 1.0170, test_f1: 0.4790
 epoch: 28, train_loss: 1.0697, test_loss: 1.0097, test_f1: 0.4778
 epoch: 29, train_loss: 1.0551, test_loss: 1.0136, test_f1: 0.4789
 epoch: 30, train_loss: 1.0588, test_loss: 0.9889, test_f1: 0.4917
 epoch: 31, train_loss: 1.0466, test_loss: 0.9877, test_f1: 0.4887
 epoch: 32, train_loss: 1.0491, test_loss: 0.9844, test_f1: 0.4885
 epoch: 33, train_loss: 1.0366, test_loss: 0.9795, test_f1: 0.4975
 epoch: 34, train_loss: 1.0347, test_loss: 0.9698, test_f1: 0.5086
 epoch: 35, train_loss: 1.0285, test_loss: 0.9768, test_f1: 0.4768
 epoch: 36, train_loss: 1.0271, test_loss: 0.9763, test_f1: 0.4894
 epoch: 37, train_loss: 1.0346, test_loss: 0.9792, test_f1: 0.5025
 epoch: 38, train_loss: 1.0165, test_loss: 0.9637, test_f1: 0.4791
 epoch: 39, train_loss: 1.0184, test_loss: 0.9551, test_f1: 0.4855
 epoch: 40, train_loss: 1.0135, test_loss: 0.9755, test_f1: 0.5023
 epoch: 41, train_loss: 1.0109, test_loss: 0.9574, test_f1: 0.4926
 epoch: 42, train_loss: 1.0073, test_loss: 0.9668, test_f1: 0.4884
 epoch: 43, train_loss: 1.0139, test_loss: 0.9417, test_f1: 0.4935
 epoch: 44, train_loss: 1.0011, test_loss: 0.9569, test_f1: 0.4678
 epoch: 45, train_loss: 0.9963, test_loss: 0.9620, test_f1: 0.4826
 epoch: 46, train_loss: 0.9917, test_loss: 0.9429, test_f1: 0.5030
 epoch: 47, train_loss: 0.9923, test_loss: 0.9415, test_f1: 0.4945
 epoch: 48, train_loss: 0.9949, test_loss: 0.9462, test_f1: 0.5025
 epoch: 49, train_loss: 0.9864, test_loss: 0.9445, test_f1: 0.5028
 epoch: 50, train_loss: 0.9789, test_loss: 0.9460, test_f1: 0.4986
 epoch: 51, train_loss: 0.9832, test_loss: 0.9397, test_f1: 0.4950
 epoch: 52, train_loss: 0.9655, test_loss: 0.9430, test_f1: 0.4931
 epoch: 53, train_loss: 0.9779, test_loss: 0.9438, test_f1: 0.4958
 epoch: 54, train_loss: 0.9773, test_loss: 0.9385, test_f1: 0.4945
 epoch: 55, train_loss: 0.9679, test_loss: 0.9348, test_f1: 0.5014
 epoch: 56, train_loss: 0.9670, test_loss: 0.9451, test_f1: 0.4911
 epoch: 57, train_loss: 0.9668, test_loss: 0.9425, test_f1: 0.5013
 epoch: 58, train_loss: 0.9638, test_loss: 0.9396, test_f1: 0.5015
 epoch: 59, train_loss: 0.9629, test_loss: 0.9441, test_f1: 0.4921
 epoch: 60, train_loss: 0.9573, test_loss: 0.9431, test_f1: 0.4991
 epoch: 61, train_loss: 0.9605, test_loss: 0.9457, test_f1: 0.5023
 epoch: 62, train_loss: 0.9526, test_loss: 0.9353, test_f1: 0.5024
 epoch: 63, train_loss: 0.9639, test_loss: 0.9403, test_f1: 0.5040
 epoch: 64, train_loss: 0.9540, test_loss: 0.9339, test_f1: 0.5063
 epoch: 65, train_loss: 0.9633, test_loss: 0.9372, test_f1: 0.5026
 epoch: 66, train_loss: 0.9594, test_loss: 0.9447, test_f1: 0.4936
 epoch: 67, train_loss: 0.9572, test_loss: 0.9376, test_f1: 0.5067
 epoch: 68, train_loss: 0.9593, test_loss: 0.9299, test_f1: 0.5064
 epoch: 69, train_loss: 0.9487, test_loss: 0.9436, test_f1: 0.5022
 epoch: 70, train_loss: 0.9442, test_loss: 0.9443, test_f1: 0.5025
 epoch: 71, train_loss: 0.9444, test_loss: 0.9463, test_f1: 0.4963
 epoch: 72, train_loss: 0.9450, test_loss: 0.9307, test_f1: 0.5060
 epoch: 73, train_loss: 0.9493, test_loss: 0.9394, test_f1: 0.5050
 epoch: 74, train_loss: 0.9399, test_loss: 0.9312, test_f1: 0.5107
 epoch: 75, train_loss: 0.9420, test_loss: 0.9421, test_f1: 0.5011
 epoch: 76, train_loss: 0.9416, test_loss: 0.9365, test_f1: 0.5053
 epoch: 77, train_loss: 0.9530, test_loss: 0.9245, test_f1: 0.5015
 epoch: 78, train_loss: 0.9319, test_loss: 0.9391, test_f1: 0.4994
 epoch: 79, train_loss: 0.9357, test_loss: 0.9407, test_f1: 0.5055
 epoch: 80, train_loss: 0.9298, test_loss: 0.9304, test_f1: 0.5072
 epoch: 81, train_loss: 0.9373, test_loss: 0.9395, test_f1: 0.5024
 epoch: 82, train_loss: 0.9320, test_loss: 0.9224, test_f1: 0.5109
 epoch: 83, train_loss: 0.9376, test_loss: 0.9314, test_f1: 0.5114
 epoch: 84, train_loss: 0.9338, test_loss: 0.9346, test_f1: 0.5065
 epoch: 85, train_loss: 0.9405, test_loss: 0.9359, test_f1: 0.5028
 epoch: 86, train_loss: 0.9295, test_loss: 0.9373, test_f1: 0.5019
 epoch: 87, train_loss: 0.9413, test_loss: 0.9340, test_f1: 0.5019
 epoch: 88, train_loss: 0.9333, test_loss: 0.9310, test_f1: 0.5010
 epoch: 89, train_loss: 0.9287, test_loss: 0.9291, test_f1: 0.5119
 epoch: 90, train_loss: 0.9305, test_loss: 0.9329, test_f1: 0.4963
 epoch: 91, train_loss: 0.9264, test_loss: 0.9290, test_f1: 0.4981
 epoch: 92, train_loss: 0.9189, test_loss: 0.9210, test_f1: 0.5069
 epoch: 93, train_loss: 0.9232, test_loss: 0.9288, test_f1: 0.4985
 epoch: 94, train_loss: 0.9251, test_loss: 0.9458, test_f1: 0.4991
 epoch: 95, train_loss: 0.9138, test_loss: 0.9275, test_f1: 0.5106
 epoch: 96, train_loss: 0.9223, test_loss: 0.9337, test_f1: 0.4952
 epoch: 97, train_loss: 0.9253, test_loss: 0.9438, test_f1: 0.4941
 epoch: 98, train_loss: 0.9210, test_loss: 0.9310, test_f1: 0.5062
 epoch: 99, train_loss: 0.9180, test_loss: 0.9236, test_f1: 0.5166
##################ITERATION #5 ****************************************
 epoch: 0, train_loss: 1.3502, test_loss: 1.3266, test_f1: 0.2274
 epoch: 1, train_loss: 1.2888, test_loss: 1.3108, test_f1: 0.2274
 epoch: 2, train_loss: 1.2737, test_loss: 1.2904, test_f1: 0.2401
 epoch: 3, train_loss: 1.2527, test_loss: 1.2612, test_f1: 0.2609
 epoch: 4, train_loss: 1.2439, test_loss: 1.2354, test_f1: 0.2723
 epoch: 5, train_loss: 1.2420, test_loss: 1.2083, test_f1: 0.3104
 epoch: 6, train_loss: 1.2304, test_loss: 1.1923, test_f1: 0.3311
 epoch: 7, train_loss: 1.2137, test_loss: 1.1702, test_f1: 0.3682
 epoch: 8, train_loss: 1.2131, test_loss: 1.1635, test_f1: 0.3850
 epoch: 9, train_loss: 1.2040, test_loss: 1.1592, test_f1: 0.3913
 epoch: 10, train_loss: 1.1950, test_loss: 1.1493, test_f1: 0.3954
 epoch: 11, train_loss: 1.1838, test_loss: 1.1461, test_f1: 0.4008
 epoch: 12, train_loss: 1.1775, test_loss: 1.1358, test_f1: 0.4012
 epoch: 13, train_loss: 1.1731, test_loss: 1.1345, test_f1: 0.4082
 epoch: 14, train_loss: 1.1604, test_loss: 1.1351, test_f1: 0.4084
 epoch: 15, train_loss: 1.1555, test_loss: 1.1360, test_f1: 0.4083
 epoch: 16, train_loss: 1.1404, test_loss: 1.1221, test_f1: 0.4073
 epoch: 17, train_loss: 1.1367, test_loss: 1.1142, test_f1: 0.4092
 epoch: 18, train_loss: 1.1418, test_loss: 1.1103, test_f1: 0.4212
 epoch: 19, train_loss: 1.1233, test_loss: 1.1165, test_f1: 0.4217
 epoch: 20, train_loss: 1.1185, test_loss: 1.1134, test_f1: 0.4203
 epoch: 21, train_loss: 1.1129, test_loss: 1.1095, test_f1: 0.4239
 epoch: 22, train_loss: 1.1160, test_loss: 1.0943, test_f1: 0.4156
 epoch: 23, train_loss: 1.1100, test_loss: 1.1003, test_f1: 0.4261
 epoch: 24, train_loss: 1.1081, test_loss: 1.0880, test_f1: 0.4219
 epoch: 25, train_loss: 1.1100, test_loss: 1.0782, test_f1: 0.4387
 epoch: 26, train_loss: 1.0972, test_loss: 1.0740, test_f1: 0.4270
 epoch: 27, train_loss: 1.0960, test_loss: 1.0713, test_f1: 0.4388
 epoch: 28, train_loss: 1.0964, test_loss: 1.0621, test_f1: 0.4395
 epoch: 29, train_loss: 1.0881, test_loss: 1.0628, test_f1: 0.4384
 epoch: 30, train_loss: 1.0773, test_loss: 1.0669, test_f1: 0.4470
 epoch: 31, train_loss: 1.0823, test_loss: 1.0642, test_f1: 0.4508
 epoch: 32, train_loss: 1.0797, test_loss: 1.0604, test_f1: 0.4454
 epoch: 33, train_loss: 1.0650, test_loss: 1.0593, test_f1: 0.4492
 epoch: 34, train_loss: 1.0744, test_loss: 1.0680, test_f1: 0.4350
 epoch: 35, train_loss: 1.0606, test_loss: 1.0478, test_f1: 0.4570
 epoch: 36, train_loss: 1.0568, test_loss: 1.0408, test_f1: 0.4568
 epoch: 37, train_loss: 1.0552, test_loss: 1.0545, test_f1: 0.4441
 epoch: 38, train_loss: 1.0520, test_loss: 1.0547, test_f1: 0.4477
 epoch: 39, train_loss: 1.0544, test_loss: 1.0517, test_f1: 0.4498
 epoch: 40, train_loss: 1.0428, test_loss: 1.0578, test_f1: 0.4405
 epoch: 41, train_loss: 1.0373, test_loss: 1.0471, test_f1: 0.4213
 epoch: 42, train_loss: 1.0382, test_loss: 1.0278, test_f1: 0.4480
 epoch: 43, train_loss: 1.0311, test_loss: 1.0338, test_f1: 0.4496
 epoch: 44, train_loss: 1.0340, test_loss: 1.0142, test_f1: 0.4596
 epoch: 45, train_loss: 1.0262, test_loss: 1.0471, test_f1: 0.4403
 epoch: 46, train_loss: 1.0307, test_loss: 1.0279, test_f1: 0.4405
 epoch: 47, train_loss: 1.0360, test_loss: 1.0146, test_f1: 0.4512
 epoch: 48, train_loss: 1.0173, test_loss: 1.0194, test_f1: 0.4456
 epoch: 49, train_loss: 1.0203, test_loss: 1.0247, test_f1: 0.4341
 epoch: 50, train_loss: 1.0198, test_loss: 1.0064, test_f1: 0.4417
 epoch: 51, train_loss: 1.0126, test_loss: 1.0050, test_f1: 0.4573
 epoch: 52, train_loss: 1.0119, test_loss: 1.0097, test_f1: 0.4574
 epoch: 53, train_loss: 1.0123, test_loss: 1.0042, test_f1: 0.4496
 epoch: 54, train_loss: 1.0115, test_loss: 1.0004, test_f1: 0.4526
 epoch: 55, train_loss: 0.9963, test_loss: 1.0002, test_f1: 0.4506
 epoch: 56, train_loss: 0.9987, test_loss: 1.0014, test_f1: 0.4540
 epoch: 57, train_loss: 0.9907, test_loss: 1.0011, test_f1: 0.4576
 epoch: 58, train_loss: 0.9928, test_loss: 0.9987, test_f1: 0.4522
 epoch: 59, train_loss: 0.9995, test_loss: 0.9994, test_f1: 0.4500
 epoch: 60, train_loss: 0.9965, test_loss: 1.0066, test_f1: 0.4557
 epoch: 61, train_loss: 0.9978, test_loss: 0.9932, test_f1: 0.4539
 epoch: 62, train_loss: 0.9918, test_loss: 0.9901, test_f1: 0.4563
 epoch: 63, train_loss: 1.0059, test_loss: 1.0005, test_f1: 0.4528
 epoch: 64, train_loss: 0.9891, test_loss: 0.9921, test_f1: 0.4557
 epoch: 65, train_loss: 0.9856, test_loss: 0.9976, test_f1: 0.4555
 epoch: 66, train_loss: 0.9875, test_loss: 0.9974, test_f1: 0.4457
 epoch: 67, train_loss: 0.9803, test_loss: 0.9833, test_f1: 0.4576
 epoch: 68, train_loss: 0.9793, test_loss: 1.0215, test_f1: 0.4458
 epoch: 69, train_loss: 0.9804, test_loss: 0.9968, test_f1: 0.4599
 epoch: 70, train_loss: 0.9807, test_loss: 0.9964, test_f1: 0.4525
 epoch: 71, train_loss: 0.9703, test_loss: 0.9813, test_f1: 0.4625
 epoch: 72, train_loss: 0.9803, test_loss: 0.9990, test_f1: 0.4564
 epoch: 73, train_loss: 0.9672, test_loss: 0.9906, test_f1: 0.4497
 epoch: 74, train_loss: 0.9724, test_loss: 1.0130, test_f1: 0.4406
 epoch: 75, train_loss: 0.9687, test_loss: 0.9916, test_f1: 0.4533
 epoch: 76, train_loss: 0.9752, test_loss: 0.9929, test_f1: 0.4557
 epoch: 77, train_loss: 0.9745, test_loss: 0.9999, test_f1: 0.4585
 epoch: 78, train_loss: 0.9786, test_loss: 0.9995, test_f1: 0.4442
 epoch: 79, train_loss: 0.9572, test_loss: 0.9801, test_f1: 0.4562
 epoch: 80, train_loss: 0.9645, test_loss: 0.9860, test_f1: 0.4553
 epoch: 81, train_loss: 0.9573, test_loss: 0.9867, test_f1: 0.4470
 epoch: 82, train_loss: 0.9727, test_loss: 0.9968, test_f1: 0.4446
 epoch: 83, train_loss: 0.9662, test_loss: 0.9910, test_f1: 0.4538
 epoch: 84, train_loss: 0.9644, test_loss: 1.0081, test_f1: 0.4533
 epoch: 85, train_loss: 0.9681, test_loss: 0.9839, test_f1: 0.4529
 epoch: 86, train_loss: 0.9685, test_loss: 0.9845, test_f1: 0.4623
 epoch: 87, train_loss: 0.9731, test_loss: 0.9985, test_f1: 0.4533
 epoch: 88, train_loss: 0.9613, test_loss: 1.0046, test_f1: 0.4439
 epoch: 89, train_loss: 0.9571, test_loss: 0.9972, test_f1: 0.4433
 epoch: 90, train_loss: 0.9488, test_loss: 1.0005, test_f1: 0.4480
 epoch: 91, train_loss: 0.9555, test_loss: 0.9886, test_f1: 0.4592
 epoch: 92, train_loss: 0.9605, test_loss: 0.9795, test_f1: 0.4567
 epoch: 93, train_loss: 0.9522, test_loss: 0.9936, test_f1: 0.4562
 epoch: 94, train_loss: 0.9559, test_loss: 0.9862, test_f1: 0.4633
 epoch: 95, train_loss: 0.9510, test_loss: 0.9944, test_f1: 0.4547
 epoch: 96, train_loss: 0.9645, test_loss: 0.9820, test_f1: 0.4623
 epoch: 97, train_loss: 0.9538, test_loss: 1.0153, test_f1: 0.4686
 epoch: 98, train_loss: 0.9512, test_loss: 0.9819, test_f1: 0.4599
 epoch: 99, train_loss: 0.9570, test_loss: 0.9870, test_f1: 0.4551
##################ITERATION #6 ****************************************
 epoch: 0, train_loss: 1.4576, test_loss: 1.3673, test_f1: 0.2274
 epoch: 1, train_loss: 1.3260, test_loss: 1.3461, test_f1: 0.2274
 epoch: 2, train_loss: 1.3017, test_loss: 1.3096, test_f1: 0.2274
 epoch: 3, train_loss: 1.2848, test_loss: 1.2784, test_f1: 0.2521
 epoch: 4, train_loss: 1.2754, test_loss: 1.2483, test_f1: 0.3142
 epoch: 5, train_loss: 1.2511, test_loss: 1.2330, test_f1: 0.3092
 epoch: 6, train_loss: 1.2516, test_loss: 1.2259, test_f1: 0.3010
 epoch: 7, train_loss: 1.2419, test_loss: 1.2203, test_f1: 0.3199
 epoch: 8, train_loss: 1.2354, test_loss: 1.2186, test_f1: 0.3327
 epoch: 9, train_loss: 1.2356, test_loss: 1.2110, test_f1: 0.3387
 epoch: 10, train_loss: 1.2276, test_loss: 1.2127, test_f1: 0.3594
 epoch: 11, train_loss: 1.2283, test_loss: 1.2068, test_f1: 0.3631
 epoch: 12, train_loss: 1.2108, test_loss: 1.2038, test_f1: 0.3453
 epoch: 13, train_loss: 1.2163, test_loss: 1.1989, test_f1: 0.3650
 epoch: 14, train_loss: 1.1991, test_loss: 1.1951, test_f1: 0.3604
 epoch: 15, train_loss: 1.1975, test_loss: 1.1877, test_f1: 0.3793
 epoch: 16, train_loss: 1.1899, test_loss: 1.1775, test_f1: 0.3842
 epoch: 17, train_loss: 1.1932, test_loss: 1.1740, test_f1: 0.3900
 epoch: 18, train_loss: 1.1927, test_loss: 1.1769, test_f1: 0.3829
 epoch: 19, train_loss: 1.1909, test_loss: 1.1687, test_f1: 0.3953
 epoch: 20, train_loss: 1.1804, test_loss: 1.1602, test_f1: 0.4117
 epoch: 21, train_loss: 1.1744, test_loss: 1.1559, test_f1: 0.4164
 epoch: 22, train_loss: 1.1729, test_loss: 1.1504, test_f1: 0.4208
 epoch: 23, train_loss: 1.1724, test_loss: 1.1371, test_f1: 0.4249
 epoch: 24, train_loss: 1.1600, test_loss: 1.1329, test_f1: 0.4231
 epoch: 25, train_loss: 1.1558, test_loss: 1.1176, test_f1: 0.4322
 epoch: 26, train_loss: 1.1455, test_loss: 1.1088, test_f1: 0.4416
 epoch: 27, train_loss: 1.1400, test_loss: 1.1012, test_f1: 0.4447
 epoch: 28, train_loss: 1.1373, test_loss: 1.0842, test_f1: 0.4446
 epoch: 29, train_loss: 1.1260, test_loss: 1.0818, test_f1: 0.4442
 epoch: 30, train_loss: 1.1074, test_loss: 1.0638, test_f1: 0.4581
 epoch: 31, train_loss: 1.1082, test_loss: 1.0547, test_f1: 0.4496
 epoch: 32, train_loss: 1.1131, test_loss: 1.0541, test_f1: 0.4621
 epoch: 33, train_loss: 1.0886, test_loss: 1.0354, test_f1: 0.4603
 epoch: 34, train_loss: 1.0820, test_loss: 1.0164, test_f1: 0.4724
 epoch: 35, train_loss: 1.0850, test_loss: 1.0051, test_f1: 0.4655
 epoch: 36, train_loss: 1.0744, test_loss: 0.9954, test_f1: 0.4843
 epoch: 37, train_loss: 1.0706, test_loss: 0.9981, test_f1: 0.4651
 epoch: 38, train_loss: 1.0659, test_loss: 0.9870, test_f1: 0.4699
 epoch: 39, train_loss: 1.0432, test_loss: 0.9766, test_f1: 0.4832
 epoch: 40, train_loss: 1.0483, test_loss: 0.9759, test_f1: 0.4805
 epoch: 41, train_loss: 1.0320, test_loss: 0.9761, test_f1: 0.4780
 epoch: 42, train_loss: 1.0365, test_loss: 0.9831, test_f1: 0.4732
 epoch: 43, train_loss: 1.0233, test_loss: 0.9716, test_f1: 0.4692
 epoch: 44, train_loss: 1.0107, test_loss: 0.9557, test_f1: 0.4761
 epoch: 45, train_loss: 1.0154, test_loss: 0.9538, test_f1: 0.4781
 epoch: 46, train_loss: 1.0103, test_loss: 0.9517, test_f1: 0.4772
 epoch: 47, train_loss: 1.0040, test_loss: 0.9603, test_f1: 0.4624
 epoch: 48, train_loss: 1.0013, test_loss: 0.9557, test_f1: 0.4596
 epoch: 49, train_loss: 0.9972, test_loss: 0.9441, test_f1: 0.4763
 epoch: 50, train_loss: 0.9819, test_loss: 0.9520, test_f1: 0.4720
 epoch: 51, train_loss: 0.9813, test_loss: 0.9456, test_f1: 0.4859
 epoch: 52, train_loss: 0.9819, test_loss: 0.9362, test_f1: 0.4842
 epoch: 53, train_loss: 0.9750, test_loss: 0.9509, test_f1: 0.4700
 epoch: 54, train_loss: 0.9708, test_loss: 0.9427, test_f1: 0.4889
 epoch: 55, train_loss: 0.9726, test_loss: 0.9445, test_f1: 0.4617
 epoch: 56, train_loss: 0.9714, test_loss: 0.9502, test_f1: 0.4704
 epoch: 57, train_loss: 0.9665, test_loss: 0.9458, test_f1: 0.4626
 epoch: 58, train_loss: 0.9624, test_loss: 0.9327, test_f1: 0.4806
 epoch: 59, train_loss: 0.9706, test_loss: 0.9284, test_f1: 0.4939
 epoch: 60, train_loss: 0.9556, test_loss: 0.9357, test_f1: 0.4771
 epoch: 61, train_loss: 0.9612, test_loss: 0.9407, test_f1: 0.4636
 epoch: 62, train_loss: 0.9633, test_loss: 0.9371, test_f1: 0.4728
 epoch: 63, train_loss: 0.9517, test_loss: 0.9334, test_f1: 0.4842
 epoch: 64, train_loss: 0.9616, test_loss: 0.9324, test_f1: 0.4888
 epoch: 65, train_loss: 0.9564, test_loss: 0.9427, test_f1: 0.4620
 epoch: 66, train_loss: 0.9550, test_loss: 0.9403, test_f1: 0.4780
 epoch: 67, train_loss: 0.9506, test_loss: 0.9443, test_f1: 0.4706
 epoch: 68, train_loss: 0.9530, test_loss: 0.9493, test_f1: 0.4672
 epoch: 69, train_loss: 0.9482, test_loss: 0.9442, test_f1: 0.4631
 epoch: 70, train_loss: 0.9405, test_loss: 0.9323, test_f1: 0.4775
 epoch: 71, train_loss: 0.9429, test_loss: 0.9357, test_f1: 0.4808
 epoch: 72, train_loss: 0.9447, test_loss: 0.9398, test_f1: 0.4709
 epoch: 73, train_loss: 0.9328, test_loss: 0.9509, test_f1: 0.4637
 epoch: 74, train_loss: 0.9343, test_loss: 0.9524, test_f1: 0.4689
 epoch: 75, train_loss: 0.9400, test_loss: 0.9468, test_f1: 0.4726
 epoch: 76, train_loss: 0.9384, test_loss: 0.9393, test_f1: 0.4722
 epoch: 77, train_loss: 0.9293, test_loss: 0.9317, test_f1: 0.4773
 epoch: 78, train_loss: 0.9332, test_loss: 0.9348, test_f1: 0.4809
 epoch: 79, train_loss: 0.9331, test_loss: 0.9263, test_f1: 0.4825
 epoch: 80, train_loss: 0.9248, test_loss: 0.9395, test_f1: 0.4792
 epoch: 81, train_loss: 0.9292, test_loss: 0.9513, test_f1: 0.4742
 epoch: 82, train_loss: 0.9321, test_loss: 0.9465, test_f1: 0.4771
 epoch: 83, train_loss: 0.9256, test_loss: 0.9489, test_f1: 0.4747
 epoch: 84, train_loss: 0.9310, test_loss: 0.9354, test_f1: 0.4739
 epoch: 85, train_loss: 0.9206, test_loss: 0.9459, test_f1: 0.4708
 epoch: 86, train_loss: 0.9230, test_loss: 0.9435, test_f1: 0.4700
 epoch: 87, train_loss: 0.9184, test_loss: 0.9243, test_f1: 0.4909
 epoch: 88, train_loss: 0.9260, test_loss: 0.9267, test_f1: 0.4783
 epoch: 89, train_loss: 0.9184, test_loss: 0.9258, test_f1: 0.4892
 epoch: 90, train_loss: 0.9111, test_loss: 0.9382, test_f1: 0.4874
 epoch: 91, train_loss: 0.9238, test_loss: 0.9274, test_f1: 0.4856
 epoch: 92, train_loss: 0.9187, test_loss: 0.9296, test_f1: 0.4696
 epoch: 93, train_loss: 0.9063, test_loss: 0.9317, test_f1: 0.4755
 epoch: 94, train_loss: 0.9118, test_loss: 0.9389, test_f1: 0.4763
 epoch: 95, train_loss: 0.9136, test_loss: 0.9229, test_f1: 0.4961
 epoch: 96, train_loss: 0.9083, test_loss: 0.9343, test_f1: 0.4870
 epoch: 97, train_loss: 0.9061, test_loss: 0.9300, test_f1: 0.4856
 epoch: 98, train_loss: 0.9083, test_loss: 0.9362, test_f1: 0.4751
 epoch: 99, train_loss: 0.9089, test_loss: 0.9411, test_f1: 0.4785
##################ITERATION #7 ****************************************
 epoch: 0, train_loss: 1.3421, test_loss: 1.3201, test_f1: 0.2274
 epoch: 1, train_loss: 1.2771, test_loss: 1.2756, test_f1: 0.2274
 epoch: 2, train_loss: 1.2636, test_loss: 1.2509, test_f1: 0.2490
 epoch: 3, train_loss: 1.2517, test_loss: 1.2231, test_f1: 0.2836
 epoch: 4, train_loss: 1.2455, test_loss: 1.2173, test_f1: 0.2993
 epoch: 5, train_loss: 1.2393, test_loss: 1.2088, test_f1: 0.3101
 epoch: 6, train_loss: 1.2334, test_loss: 1.2002, test_f1: 0.3486
 epoch: 7, train_loss: 1.2229, test_loss: 1.1985, test_f1: 0.3437
 epoch: 8, train_loss: 1.2259, test_loss: 1.1930, test_f1: 0.3758
 epoch: 9, train_loss: 1.2109, test_loss: 1.1872, test_f1: 0.3600
 epoch: 10, train_loss: 1.2053, test_loss: 1.1812, test_f1: 0.3579
 epoch: 11, train_loss: 1.2039, test_loss: 1.1849, test_f1: 0.3819
 epoch: 12, train_loss: 1.2004, test_loss: 1.1788, test_f1: 0.3861
 epoch: 13, train_loss: 1.1859, test_loss: 1.1619, test_f1: 0.3889
 epoch: 14, train_loss: 1.1933, test_loss: 1.1531, test_f1: 0.3898
 epoch: 15, train_loss: 1.1884, test_loss: 1.1532, test_f1: 0.3907
 epoch: 16, train_loss: 1.1813, test_loss: 1.1514, test_f1: 0.3914
 epoch: 17, train_loss: 1.1709, test_loss: 1.1454, test_f1: 0.3994
 epoch: 18, train_loss: 1.1703, test_loss: 1.1399, test_f1: 0.4001
 epoch: 19, train_loss: 1.1541, test_loss: 1.1314, test_f1: 0.4086
 epoch: 20, train_loss: 1.1531, test_loss: 1.1314, test_f1: 0.4041
 epoch: 21, train_loss: 1.1486, test_loss: 1.1270, test_f1: 0.4039
 epoch: 22, train_loss: 1.1479, test_loss: 1.1003, test_f1: 0.4197
 epoch: 23, train_loss: 1.1425, test_loss: 1.1041, test_f1: 0.4196
 epoch: 24, train_loss: 1.1344, test_loss: 1.0955, test_f1: 0.4286
 epoch: 25, train_loss: 1.1247, test_loss: 1.0932, test_f1: 0.4342
 epoch: 26, train_loss: 1.1242, test_loss: 1.0922, test_f1: 0.4179
 epoch: 27, train_loss: 1.1166, test_loss: 1.0960, test_f1: 0.4311
 epoch: 28, train_loss: 1.1081, test_loss: 1.0728, test_f1: 0.4442
 epoch: 29, train_loss: 1.1005, test_loss: 1.0706, test_f1: 0.4410
 epoch: 30, train_loss: 1.0924, test_loss: 1.0746, test_f1: 0.4338
 epoch: 31, train_loss: 1.0999, test_loss: 1.0588, test_f1: 0.4474
 epoch: 32, train_loss: 1.0882, test_loss: 1.0627, test_f1: 0.4308
 epoch: 33, train_loss: 1.0826, test_loss: 1.0434, test_f1: 0.4602
 epoch: 34, train_loss: 1.0735, test_loss: 1.0459, test_f1: 0.4453
 epoch: 35, train_loss: 1.0715, test_loss: 1.0574, test_f1: 0.4383
 epoch: 36, train_loss: 1.0599, test_loss: 1.0399, test_f1: 0.4444
 epoch: 37, train_loss: 1.0710, test_loss: 1.0447, test_f1: 0.4455
 epoch: 38, train_loss: 1.0591, test_loss: 1.0300, test_f1: 0.4514
 epoch: 39, train_loss: 1.0583, test_loss: 1.0305, test_f1: 0.4587
 epoch: 40, train_loss: 1.0469, test_loss: 1.0383, test_f1: 0.4311
 epoch: 41, train_loss: 1.0505, test_loss: 1.0163, test_f1: 0.4378
 epoch: 42, train_loss: 1.0451, test_loss: 1.0284, test_f1: 0.4451
 epoch: 43, train_loss: 1.0379, test_loss: 1.0263, test_f1: 0.4501
 epoch: 44, train_loss: 1.0355, test_loss: 1.0279, test_f1: 0.4599
 epoch: 45, train_loss: 1.0370, test_loss: 1.0240, test_f1: 0.4542
 epoch: 46, train_loss: 1.0250, test_loss: 1.0251, test_f1: 0.4498
 epoch: 47, train_loss: 1.0252, test_loss: 1.0078, test_f1: 0.4606
 epoch: 48, train_loss: 1.0138, test_loss: 1.0470, test_f1: 0.4412
 epoch: 49, train_loss: 1.0059, test_loss: 1.0211, test_f1: 0.4752
 epoch: 50, train_loss: 1.0266, test_loss: 1.0267, test_f1: 0.4490
 epoch: 51, train_loss: 1.0091, test_loss: 1.0042, test_f1: 0.4792
 epoch: 52, train_loss: 1.0043, test_loss: 1.0206, test_f1: 0.4695
 epoch: 53, train_loss: 1.0006, test_loss: 0.9976, test_f1: 0.4745
 epoch: 54, train_loss: 0.9993, test_loss: 0.9994, test_f1: 0.4694
 epoch: 55, train_loss: 0.9952, test_loss: 1.0001, test_f1: 0.4681
 epoch: 56, train_loss: 0.9994, test_loss: 1.0144, test_f1: 0.4747
 epoch: 57, train_loss: 0.9999, test_loss: 1.0003, test_f1: 0.4762
 epoch: 58, train_loss: 0.9979, test_loss: 1.0145, test_f1: 0.4754
 epoch: 59, train_loss: 0.9908, test_loss: 1.0435, test_f1: 0.4624
 epoch: 60, train_loss: 1.0074, test_loss: 1.0137, test_f1: 0.4600
 epoch: 61, train_loss: 0.9836, test_loss: 1.0065, test_f1: 0.4810
 epoch: 62, train_loss: 0.9822, test_loss: 0.9967, test_f1: 0.4983
 epoch: 63, train_loss: 0.9799, test_loss: 0.9951, test_f1: 0.4802
 epoch: 64, train_loss: 0.9727, test_loss: 1.0144, test_f1: 0.4703
 epoch: 65, train_loss: 0.9731, test_loss: 1.0323, test_f1: 0.4395
 epoch: 66, train_loss: 0.9781, test_loss: 1.0331, test_f1: 0.4537
 epoch: 67, train_loss: 0.9683, test_loss: 1.0266, test_f1: 0.4561
 epoch: 68, train_loss: 0.9755, test_loss: 1.0500, test_f1: 0.4436
 epoch: 69, train_loss: 0.9733, test_loss: 1.0304, test_f1: 0.4476
 epoch: 70, train_loss: 0.9680, test_loss: 1.0211, test_f1: 0.4508
 epoch: 71, train_loss: 0.9689, test_loss: 1.0056, test_f1: 0.4801
 epoch: 72, train_loss: 0.9675, test_loss: 1.0106, test_f1: 0.4847
 epoch: 73, train_loss: 0.9667, test_loss: 1.0184, test_f1: 0.4640
 epoch: 74, train_loss: 0.9678, test_loss: 1.0206, test_f1: 0.4576
 epoch: 75, train_loss: 0.9685, test_loss: 1.0418, test_f1: 0.4712
 epoch: 76, train_loss: 0.9625, test_loss: 1.0163, test_f1: 0.4679
 epoch: 77, train_loss: 0.9675, test_loss: 1.0132, test_f1: 0.4724
 epoch: 78, train_loss: 0.9605, test_loss: 1.0354, test_f1: 0.4599
 epoch: 79, train_loss: 0.9614, test_loss: 1.0031, test_f1: 0.4719
 epoch: 80, train_loss: 0.9520, test_loss: 1.0350, test_f1: 0.4507
 epoch: 81, train_loss: 0.9486, test_loss: 1.0397, test_f1: 0.4604
 epoch: 82, train_loss: 0.9606, test_loss: 0.9950, test_f1: 0.4614
 epoch: 83, train_loss: 0.9465, test_loss: 1.0130, test_f1: 0.4702
 epoch: 84, train_loss: 0.9585, test_loss: 1.0736, test_f1: 0.4477
 epoch: 85, train_loss: 0.9582, test_loss: 1.0396, test_f1: 0.4477
 epoch: 86, train_loss: 0.9526, test_loss: 1.0959, test_f1: 0.4563
 epoch: 87, train_loss: 0.9427, test_loss: 1.0420, test_f1: 0.4464
 epoch: 88, train_loss: 0.9553, test_loss: 1.0317, test_f1: 0.4686
 epoch: 89, train_loss: 0.9462, test_loss: 1.0359, test_f1: 0.4614
 epoch: 90, train_loss: 0.9386, test_loss: 1.0277, test_f1: 0.4615
 epoch: 91, train_loss: 0.9408, test_loss: 1.0401, test_f1: 0.4579
 epoch: 92, train_loss: 0.9535, test_loss: 1.0217, test_f1: 0.4603
 epoch: 93, train_loss: 0.9413, test_loss: 1.0517, test_f1: 0.4496
 epoch: 94, train_loss: 0.9266, test_loss: 1.0392, test_f1: 0.4496
 epoch: 95, train_loss: 0.9420, test_loss: 1.0285, test_f1: 0.4609
 epoch: 96, train_loss: 0.9379, test_loss: 1.0291, test_f1: 0.4695
 epoch: 97, train_loss: 0.9420, test_loss: 1.0252, test_f1: 0.4701
 epoch: 98, train_loss: 0.9333, test_loss: 1.0416, test_f1: 0.4691
 epoch: 99, train_loss: 0.9462, test_loss: 1.0483, test_f1: 0.4563
##################ITERATION #8 ****************************************
 epoch: 0, train_loss: 1.3547, test_loss: 1.3261, test_f1: 0.2274
 epoch: 1, train_loss: 1.3002, test_loss: 1.2945, test_f1: 0.2274
 epoch: 2, train_loss: 1.2723, test_loss: 1.2674, test_f1: 0.2334
 epoch: 3, train_loss: 1.2568, test_loss: 1.2419, test_f1: 0.2501
 epoch: 4, train_loss: 1.2372, test_loss: 1.2227, test_f1: 0.2717
 epoch: 5, train_loss: 1.2405, test_loss: 1.2068, test_f1: 0.3076
 epoch: 6, train_loss: 1.2258, test_loss: 1.1914, test_f1: 0.3416
 epoch: 7, train_loss: 1.2133, test_loss: 1.1787, test_f1: 0.3661
 epoch: 8, train_loss: 1.2005, test_loss: 1.1555, test_f1: 0.4020
 epoch: 9, train_loss: 1.1969, test_loss: 1.1531, test_f1: 0.3996
 epoch: 10, train_loss: 1.1895, test_loss: 1.1432, test_f1: 0.3975
 epoch: 11, train_loss: 1.1671, test_loss: 1.1220, test_f1: 0.4131
 epoch: 12, train_loss: 1.1637, test_loss: 1.1098, test_f1: 0.4197
 epoch: 13, train_loss: 1.1633, test_loss: 1.1087, test_f1: 0.4094
 epoch: 14, train_loss: 1.1541, test_loss: 1.0884, test_f1: 0.4309
 epoch: 15, train_loss: 1.1413, test_loss: 1.0846, test_f1: 0.4252
 epoch: 16, train_loss: 1.1394, test_loss: 1.0743, test_f1: 0.4297
 epoch: 17, train_loss: 1.1313, test_loss: 1.0731, test_f1: 0.4278
 epoch: 18, train_loss: 1.1235, test_loss: 1.0657, test_f1: 0.4390
 epoch: 19, train_loss: 1.1260, test_loss: 1.0543, test_f1: 0.4672
 epoch: 20, train_loss: 1.1125, test_loss: 1.0704, test_f1: 0.4438
 epoch: 21, train_loss: 1.1165, test_loss: 1.0543, test_f1: 0.4630
 epoch: 22, train_loss: 1.0983, test_loss: 1.0392, test_f1: 0.4587
 epoch: 23, train_loss: 1.1043, test_loss: 1.0297, test_f1: 0.4665
 epoch: 24, train_loss: 1.0824, test_loss: 1.0370, test_f1: 0.4660
 epoch: 25, train_loss: 1.0822, test_loss: 1.0139, test_f1: 0.4815
 epoch: 26, train_loss: 1.0713, test_loss: 1.0174, test_f1: 0.4823
 epoch: 27, train_loss: 1.0745, test_loss: 1.0182, test_f1: 0.4737
 epoch: 28, train_loss: 1.0613, test_loss: 0.9990, test_f1: 0.4739
 epoch: 29, train_loss: 1.0582, test_loss: 1.0030, test_f1: 0.4991
 epoch: 30, train_loss: 1.0503, test_loss: 1.0008, test_f1: 0.4811
 epoch: 31, train_loss: 1.0502, test_loss: 0.9994, test_f1: 0.4789
 epoch: 32, train_loss: 1.0438, test_loss: 1.0166, test_f1: 0.4886
 epoch: 33, train_loss: 1.0484, test_loss: 0.9648, test_f1: 0.4989
 epoch: 34, train_loss: 1.0330, test_loss: 0.9853, test_f1: 0.4819
 epoch: 35, train_loss: 1.0279, test_loss: 0.9688, test_f1: 0.4987
 epoch: 36, train_loss: 1.0332, test_loss: 0.9687, test_f1: 0.4995
 epoch: 37, train_loss: 1.0156, test_loss: 0.9602, test_f1: 0.4903
 epoch: 38, train_loss: 1.0174, test_loss: 0.9679, test_f1: 0.4913
 epoch: 39, train_loss: 1.0133, test_loss: 0.9535, test_f1: 0.4855
 epoch: 40, train_loss: 1.0050, test_loss: 0.9741, test_f1: 0.4936
 epoch: 41, train_loss: 1.0050, test_loss: 0.9858, test_f1: 0.4976
 epoch: 42, train_loss: 1.0001, test_loss: 0.9661, test_f1: 0.4983
 epoch: 43, train_loss: 1.0021, test_loss: 0.9594, test_f1: 0.5023
 epoch: 44, train_loss: 0.9958, test_loss: 0.9694, test_f1: 0.4903
 epoch: 45, train_loss: 0.9899, test_loss: 0.9466, test_f1: 0.4950
 epoch: 46, train_loss: 0.9874, test_loss: 0.9793, test_f1: 0.4770
 epoch: 47, train_loss: 0.9858, test_loss: 0.9443, test_f1: 0.4907
 epoch: 48, train_loss: 0.9895, test_loss: 0.9661, test_f1: 0.4792
 epoch: 49, train_loss: 0.9746, test_loss: 0.9622, test_f1: 0.4935
 epoch: 50, train_loss: 0.9729, test_loss: 0.9634, test_f1: 0.4908
 epoch: 51, train_loss: 0.9653, test_loss: 0.9667, test_f1: 0.4931
 epoch: 52, train_loss: 0.9641, test_loss: 0.9707, test_f1: 0.4976
 epoch: 53, train_loss: 0.9467, test_loss: 0.9782, test_f1: 0.4993
 epoch: 54, train_loss: 0.9688, test_loss: 0.9587, test_f1: 0.4922
 epoch: 55, train_loss: 0.9582, test_loss: 0.9883, test_f1: 0.4865
 epoch: 56, train_loss: 0.9651, test_loss: 0.9575, test_f1: 0.4998
 epoch: 57, train_loss: 0.9578, test_loss: 0.9508, test_f1: 0.4908
 epoch: 58, train_loss: 0.9475, test_loss: 0.9871, test_f1: 0.4810
 epoch: 59, train_loss: 0.9511, test_loss: 0.9858, test_f1: 0.4926
 epoch: 60, train_loss: 0.9475, test_loss: 0.9840, test_f1: 0.4845
 epoch: 61, train_loss: 0.9575, test_loss: 0.9720, test_f1: 0.4939
 epoch: 62, train_loss: 0.9448, test_loss: 0.9750, test_f1: 0.4893
 epoch: 63, train_loss: 0.9478, test_loss: 0.9877, test_f1: 0.5008
 epoch: 64, train_loss: 0.9500, test_loss: 1.0038, test_f1: 0.4754
 epoch: 65, train_loss: 0.9532, test_loss: 0.9753, test_f1: 0.4871
 epoch: 66, train_loss: 0.9449, test_loss: 0.9804, test_f1: 0.4854
 epoch: 67, train_loss: 0.9416, test_loss: 0.9608, test_f1: 0.4873
 epoch: 68, train_loss: 0.9442, test_loss: 1.0038, test_f1: 0.4749
 epoch: 69, train_loss: 0.9379, test_loss: 0.9638, test_f1: 0.4940
 epoch: 70, train_loss: 0.9427, test_loss: 1.0340, test_f1: 0.4748
 epoch: 71, train_loss: 0.9414, test_loss: 1.0297, test_f1: 0.4744
 epoch: 72, train_loss: 0.9303, test_loss: 1.0263, test_f1: 0.4614
 epoch: 73, train_loss: 0.9299, test_loss: 0.9893, test_f1: 0.4685
 epoch: 74, train_loss: 0.9316, test_loss: 0.9823, test_f1: 0.4835
 epoch: 75, train_loss: 0.9319, test_loss: 0.9871, test_f1: 0.4854
 epoch: 76, train_loss: 0.9394, test_loss: 1.0320, test_f1: 0.4732
 epoch: 77, train_loss: 0.9276, test_loss: 0.9913, test_f1: 0.4804
 epoch: 78, train_loss: 0.9318, test_loss: 0.9962, test_f1: 0.4790
 epoch: 79, train_loss: 0.9298, test_loss: 1.0020, test_f1: 0.4758
 epoch: 80, train_loss: 0.9289, test_loss: 0.9846, test_f1: 0.4819
 epoch: 81, train_loss: 0.9245, test_loss: 1.0502, test_f1: 0.4631
 epoch: 82, train_loss: 0.9243, test_loss: 1.0073, test_f1: 0.4670
 epoch: 83, train_loss: 0.9137, test_loss: 1.0021, test_f1: 0.4783
 epoch: 84, train_loss: 0.9184, test_loss: 1.0085, test_f1: 0.4813
 epoch: 85, train_loss: 0.9139, test_loss: 0.9757, test_f1: 0.4886
 epoch: 86, train_loss: 0.9117, test_loss: 1.0099, test_f1: 0.4711
 epoch: 87, train_loss: 0.9217, test_loss: 0.9988, test_f1: 0.4610
 epoch: 88, train_loss: 0.9161, test_loss: 0.9815, test_f1: 0.4823
 epoch: 89, train_loss: 0.9190, test_loss: 0.9934, test_f1: 0.4888
 epoch: 90, train_loss: 0.9111, test_loss: 0.9925, test_f1: 0.4903
 epoch: 91, train_loss: 0.9080, test_loss: 1.0315, test_f1: 0.4721
 epoch: 92, train_loss: 0.9034, test_loss: 1.0201, test_f1: 0.4680
 epoch: 93, train_loss: 0.9162, test_loss: 1.0602, test_f1: 0.4619
 epoch: 94, train_loss: 0.9109, test_loss: 1.0387, test_f1: 0.4585
 epoch: 95, train_loss: 0.9124, test_loss: 0.9920, test_f1: 0.4793
 epoch: 96, train_loss: 0.9110, test_loss: 1.0233, test_f1: 0.4772
 epoch: 97, train_loss: 0.8990, test_loss: 1.0085, test_f1: 0.4840
 epoch: 98, train_loss: 0.8951, test_loss: 1.0472, test_f1: 0.4670
 epoch: 99, train_loss: 0.9045, test_loss: 1.0121, test_f1: 0.4747
##################ITERATION #9 ****************************************
 epoch: 0, train_loss: 1.5834, test_loss: 1.3038, test_f1: 0.2274
 epoch: 1, train_loss: 1.3306, test_loss: 1.2778, test_f1: 0.2300
 epoch: 2, train_loss: 1.2844, test_loss: 1.2622, test_f1: 0.2402
 epoch: 3, train_loss: 1.2759, test_loss: 1.2483, test_f1: 0.2465
 epoch: 4, train_loss: 1.2622, test_loss: 1.2240, test_f1: 0.2839
 epoch: 5, train_loss: 1.2408, test_loss: 1.2075, test_f1: 0.3102
 epoch: 6, train_loss: 1.2373, test_loss: 1.1935, test_f1: 0.3329
 epoch: 7, train_loss: 1.2346, test_loss: 1.1895, test_f1: 0.3393
 epoch: 8, train_loss: 1.2233, test_loss: 1.1783, test_f1: 0.3595
 epoch: 9, train_loss: 1.2210, test_loss: 1.1676, test_f1: 0.3650
 epoch: 10, train_loss: 1.2163, test_loss: 1.1662, test_f1: 0.3637
 epoch: 11, train_loss: 1.2036, test_loss: 1.1588, test_f1: 0.3849
 epoch: 12, train_loss: 1.1998, test_loss: 1.1505, test_f1: 0.3822
 epoch: 13, train_loss: 1.1950, test_loss: 1.1488, test_f1: 0.3962
 epoch: 14, train_loss: 1.1793, test_loss: 1.1443, test_f1: 0.3918
 epoch: 15, train_loss: 1.1785, test_loss: 1.1365, test_f1: 0.4016
 epoch: 16, train_loss: 1.1650, test_loss: 1.1281, test_f1: 0.4023
 epoch: 17, train_loss: 1.1617, test_loss: 1.1219, test_f1: 0.4083
 epoch: 18, train_loss: 1.1579, test_loss: 1.1220, test_f1: 0.4126
 epoch: 19, train_loss: 1.1460, test_loss: 1.1120, test_f1: 0.4096
 epoch: 20, train_loss: 1.1493, test_loss: 1.1119, test_f1: 0.4125
 epoch: 21, train_loss: 1.1402, test_loss: 1.1049, test_f1: 0.4177
 epoch: 22, train_loss: 1.1403, test_loss: 1.0996, test_f1: 0.4230
 epoch: 23, train_loss: 1.1250, test_loss: 1.0929, test_f1: 0.4351
 epoch: 24, train_loss: 1.1275, test_loss: 1.0837, test_f1: 0.4287
 epoch: 25, train_loss: 1.1186, test_loss: 1.0776, test_f1: 0.4318
 epoch: 26, train_loss: 1.1141, test_loss: 1.0725, test_f1: 0.4281
 epoch: 27, train_loss: 1.1041, test_loss: 1.0813, test_f1: 0.4230
 epoch: 28, train_loss: 1.0935, test_loss: 1.0598, test_f1: 0.4371
 epoch: 29, train_loss: 1.0894, test_loss: 1.0607, test_f1: 0.4380
 epoch: 30, train_loss: 1.0836, test_loss: 1.0483, test_f1: 0.4390
 epoch: 31, train_loss: 1.0842, test_loss: 1.0406, test_f1: 0.4460
 epoch: 32, train_loss: 1.0762, test_loss: 1.0527, test_f1: 0.4331
 epoch: 33, train_loss: 1.0816, test_loss: 1.0410, test_f1: 0.4403
 epoch: 34, train_loss: 1.0605, test_loss: 1.0286, test_f1: 0.4446
 epoch: 35, train_loss: 1.0721, test_loss: 1.0362, test_f1: 0.4438
 epoch: 36, train_loss: 1.0581, test_loss: 1.0194, test_f1: 0.4445
 epoch: 37, train_loss: 1.0610, test_loss: 1.0205, test_f1: 0.4579
 epoch: 38, train_loss: 1.0593, test_loss: 1.0260, test_f1: 0.4347
 epoch: 39, train_loss: 1.0401, test_loss: 1.0301, test_f1: 0.4493
 epoch: 40, train_loss: 1.0462, test_loss: 1.0400, test_f1: 0.4323
 epoch: 41, train_loss: 1.0435, test_loss: 1.0171, test_f1: 0.4436
 epoch: 42, train_loss: 1.0325, test_loss: 1.0131, test_f1: 0.4502
 epoch: 43, train_loss: 1.0292, test_loss: 1.0215, test_f1: 0.4455
 epoch: 44, train_loss: 1.0316, test_loss: 1.0112, test_f1: 0.4495
 epoch: 45, train_loss: 1.0238, test_loss: 0.9957, test_f1: 0.4564
 epoch: 46, train_loss: 1.0099, test_loss: 1.0219, test_f1: 0.4634
 epoch: 47, train_loss: 1.0135, test_loss: 0.9898, test_f1: 0.4595
 epoch: 48, train_loss: 1.0177, test_loss: 0.9916, test_f1: 0.4486
 epoch: 49, train_loss: 1.0116, test_loss: 1.0125, test_f1: 0.4498
 epoch: 50, train_loss: 1.0125, test_loss: 1.0085, test_f1: 0.4479
 epoch: 51, train_loss: 0.9962, test_loss: 0.9883, test_f1: 0.4698
 epoch: 52, train_loss: 0.9968, test_loss: 0.9839, test_f1: 0.4580
 epoch: 53, train_loss: 0.9975, test_loss: 0.9891, test_f1: 0.4536
 epoch: 54, train_loss: 0.9958, test_loss: 0.9983, test_f1: 0.4525
 epoch: 55, train_loss: 0.9781, test_loss: 0.9890, test_f1: 0.4536
 epoch: 56, train_loss: 0.9848, test_loss: 0.9855, test_f1: 0.4668
 epoch: 57, train_loss: 0.9899, test_loss: 1.0029, test_f1: 0.4533
 epoch: 58, train_loss: 0.9874, test_loss: 0.9793, test_f1: 0.4595
 epoch: 59, train_loss: 0.9767, test_loss: 0.9931, test_f1: 0.4631
 epoch: 60, train_loss: 0.9763, test_loss: 0.9940, test_f1: 0.4661
 epoch: 61, train_loss: 0.9643, test_loss: 0.9846, test_f1: 0.4642
 epoch: 62, train_loss: 0.9733, test_loss: 0.9849, test_f1: 0.4627
 epoch: 63, train_loss: 0.9770, test_loss: 0.9830, test_f1: 0.4700
 epoch: 64, train_loss: 0.9721, test_loss: 0.9825, test_f1: 0.4629
 epoch: 65, train_loss: 0.9675, test_loss: 0.9813, test_f1: 0.4679
 epoch: 66, train_loss: 0.9682, test_loss: 1.0002, test_f1: 0.4613
 epoch: 67, train_loss: 0.9612, test_loss: 0.9964, test_f1: 0.4593
 epoch: 68, train_loss: 0.9661, test_loss: 0.9835, test_f1: 0.4686
 epoch: 69, train_loss: 0.9494, test_loss: 1.0017, test_f1: 0.4630
 epoch: 70, train_loss: 0.9591, test_loss: 1.0002, test_f1: 0.4612
 epoch: 71, train_loss: 0.9510, test_loss: 0.9834, test_f1: 0.4685
 epoch: 72, train_loss: 0.9580, test_loss: 0.9949, test_f1: 0.4631
 epoch: 73, train_loss: 0.9449, test_loss: 0.9965, test_f1: 0.4711
 epoch: 74, train_loss: 0.9513, test_loss: 0.9927, test_f1: 0.4705
 epoch: 75, train_loss: 0.9556, test_loss: 0.9851, test_f1: 0.4666
 epoch: 76, train_loss: 0.9394, test_loss: 0.9991, test_f1: 0.4589
 epoch: 77, train_loss: 0.9468, test_loss: 0.9891, test_f1: 0.4643
 epoch: 78, train_loss: 0.9420, test_loss: 1.0057, test_f1: 0.4623
 epoch: 79, train_loss: 0.9388, test_loss: 0.9912, test_f1: 0.4667
 epoch: 80, train_loss: 0.9340, test_loss: 0.9985, test_f1: 0.4637
 epoch: 81, train_loss: 0.9335, test_loss: 0.9897, test_f1: 0.4725
 epoch: 82, train_loss: 0.9232, test_loss: 1.0109, test_f1: 0.4672
 epoch: 83, train_loss: 0.9336, test_loss: 1.0106, test_f1: 0.4635
 epoch: 84, train_loss: 0.9342, test_loss: 0.9946, test_f1: 0.4661
 epoch: 85, train_loss: 0.9229, test_loss: 0.9966, test_f1: 0.4687
 epoch: 86, train_loss: 0.9293, test_loss: 1.0095, test_f1: 0.4678
 epoch: 87, train_loss: 0.9231, test_loss: 0.9921, test_f1: 0.4799
 epoch: 88, train_loss: 0.9310, test_loss: 1.0085, test_f1: 0.4605
 epoch: 89, train_loss: 0.9204, test_loss: 1.0036, test_f1: 0.4618
 epoch: 90, train_loss: 0.9203, test_loss: 0.9995, test_f1: 0.4716
 epoch: 91, train_loss: 0.9293, test_loss: 0.9928, test_f1: 0.4586
 epoch: 92, train_loss: 0.9158, test_loss: 1.0033, test_f1: 0.4741
 epoch: 93, train_loss: 0.9153, test_loss: 1.0058, test_f1: 0.4601
 epoch: 94, train_loss: 0.9090, test_loss: 1.0099, test_f1: 0.4714
 epoch: 95, train_loss: 0.9205, test_loss: 1.0177, test_f1: 0.4669
 epoch: 96, train_loss: 0.9135, test_loss: 1.0047, test_f1: 0.4677
 epoch: 97, train_loss: 0.9140, test_loss: 1.0251, test_f1: 0.4689
 epoch: 98, train_loss: 0.9129, test_loss: 1.0210, test_f1: 0.4607
 epoch: 99, train_loss: 0.9047, test_loss: 1.0079, test_f1: 0.4792

Training completed in 374.79 seconds
Best F1: 0.5166 at epoch 99
Mean F1 across iterations: 0.4983  0.0151
========================FINAL RESULTS================================
FEGIN weighted F1: 0.5166  0.0151
python main.py --data ltspice_examples --representation component_component --model FEGIN --layers 3 --hiddens 16 --batch_size 256 --lr 0.001 --emb_size 128 --epochs 100 --save_appendix component_component_L3_H16_BS256_LR0.001_E128 --no_val
-----



STDERR:
  File "main.py", line 370, in <module>
    main()
  File "main.py", line 254, in main
    dataset = dataset_class(
  File "/home/philip/projects/ltspice_examples_code_repo/Circuit-Completion-Using-GNNs/component_classification_with_link_prediction_head/evaluation/FEGIN/kernel/circuit_datasets.py", line 15, in __init__
    self.data, self.slices = torch.load(self.processed_paths[0])
  File "/home/philip/.local/lib/python3.8/site-packages/torch/serialization.py", line 1040, in load
    warnings.warn(
  File "/usr/lib/python3.8/warnings.py", line 109, in _showwarnmsg
    sw(msg.message, msg.category, msg.filename, msg.lineno,
  File "main.py", line 47, in warn_with_traceback
    traceback.print_stack(file=log)
/home/philip/projects/ltspice_examples_code_repo/Circuit-Completion-Using-GNNs/component_classification_with_link_prediction_head/evaluation/FEGIN/kernel/circuit_datasets.py:15: FutureWarning: You are using `torch.load` with `weights_only=False` (the current default value), which uses the default pickle module implicitly. It is possible to construct malicious pickle data which will execute arbitrary code during unpickling (See https://github.com/pytorch/pytorch/blob/main/SECURITY.md#untrusted-models for more details). In a future release, the default value for `weights_only` will be flipped to `True`. This limits the functions that could be executed during unpickling. Arbitrary objects will no longer be allowed to be loaded via this mode unless they are explicitly allowlisted by the user via `torch.serialization.add_safe_globals`. We recommend you start setting `weights_only=True` for any use case where you don't have full control of the loaded file. Please open an issue on GitHub for any issues related to this experimental feature.
  self.data, self.slices = torch.load(self.processed_paths[0])
