STDOUT:
Results will be saved in /home/philip/projects/ltspice_examples_code_repo/Circuit-Completion-Using-GNNs/component_classification_with_link_prediction_head/evaluation/FEGIN/results/model_FEGIN_dataset_ltspice_demos
Command line input: python main.py --data ltspice_demos --representation component_pin --model FEGIN --layers 3 --hiddens 16 --batch_size 64 --lr 0.001 --emb_size 250 --epochs 100 --save_appendix component_pin_L3_H16_BS64_LR0.001_E250 --no_val
 is saved.
-----
ltspice_demos - FEGIN
Using 3 layers, 16 hidden units, h = 2
Loading component_pin representation dataset
ENTERED
Training FEGIN on component_pin representation
Train: 1565, Test: 383
##################ITERATION #0 ****************************************
 epoch: 0, train_loss: 1.3598, test_loss: 1.3479, test_f1: 0.2281
 epoch: 1, train_loss: 1.3307, test_loss: 1.3295, test_f1: 0.2281
 epoch: 2, train_loss: 1.3020, test_loss: 1.3014, test_f1: 0.2285
 epoch: 3, train_loss: 1.2623, test_loss: 1.2686, test_f1: 0.2252
 epoch: 4, train_loss: 1.2164, test_loss: 1.2439, test_f1: 0.2395
 epoch: 5, train_loss: 1.1683, test_loss: 1.2345, test_f1: 0.2420
 epoch: 6, train_loss: 1.1309, test_loss: 1.2035, test_f1: 0.2944
 epoch: 7, train_loss: 1.0745, test_loss: 1.3087, test_f1: 0.2548
 epoch: 8, train_loss: 1.0398, test_loss: 1.0878, test_f1: 0.3745
 epoch: 9, train_loss: 1.0045, test_loss: 1.1907, test_f1: 0.3811
 epoch: 10, train_loss: 0.9774, test_loss: 1.0663, test_f1: 0.3957
 epoch: 11, train_loss: 0.9622, test_loss: 1.6228, test_f1: 0.2084
 epoch: 12, train_loss: 0.9410, test_loss: 1.0926, test_f1: 0.4025
 epoch: 13, train_loss: 0.9317, test_loss: 1.0612, test_f1: 0.4948
 epoch: 14, train_loss: 0.9158, test_loss: 1.0409, test_f1: 0.4528
 epoch: 15, train_loss: 0.8939, test_loss: 1.0624, test_f1: 0.5324
 epoch: 16, train_loss: 0.8851, test_loss: 1.0323, test_f1: 0.5074
 epoch: 17, train_loss: 0.8758, test_loss: 1.1567, test_f1: 0.4348
 epoch: 18, train_loss: 0.8692, test_loss: 1.0010, test_f1: 0.5303
 epoch: 19, train_loss: 0.8572, test_loss: 1.0620, test_f1: 0.5227
 epoch: 20, train_loss: 0.8451, test_loss: 1.2525, test_f1: 0.5567
 epoch: 21, train_loss: 0.8358, test_loss: 1.0248, test_f1: 0.5442
 epoch: 22, train_loss: 0.8181, test_loss: 3.1681, test_f1: 0.5433
 epoch: 23, train_loss: 0.8286, test_loss: 1.1096, test_f1: 0.5414
 epoch: 24, train_loss: 0.8094, test_loss: 1.0250, test_f1: 0.5720
 epoch: 25, train_loss: 0.8064, test_loss: 0.9537, test_f1: 0.5179
 epoch: 26, train_loss: 0.8047, test_loss: 0.9776, test_f1: 0.5252
 epoch: 27, train_loss: 0.8015, test_loss: 0.9773, test_f1: 0.5797
 epoch: 28, train_loss: 0.8006, test_loss: 0.9472, test_f1: 0.5304
 epoch: 29, train_loss: 0.7866, test_loss: 1.3478, test_f1: 0.5869
 epoch: 30, train_loss: 0.7886, test_loss: 2.2094, test_f1: 0.4985
 epoch: 31, train_loss: 0.7830, test_loss: 2.2407, test_f1: 0.5654
 epoch: 32, train_loss: 0.7807, test_loss: 1.4019, test_f1: 0.3850
 epoch: 33, train_loss: 0.7831, test_loss: 1.8977, test_f1: 0.5515
 epoch: 34, train_loss: 0.7774, test_loss: 2.0516, test_f1: 0.5402
 epoch: 35, train_loss: 0.7707, test_loss: 1.2790, test_f1: 0.5534
 epoch: 36, train_loss: 0.7670, test_loss: 1.3542, test_f1: 0.5766
 epoch: 37, train_loss: 0.7472, test_loss: 1.6606, test_f1: 0.4889
 epoch: 38, train_loss: 0.7566, test_loss: 1.0952, test_f1: 0.5584
 epoch: 39, train_loss: 0.7615, test_loss: 1.1323, test_f1: 0.5525
 epoch: 40, train_loss: 0.7563, test_loss: 1.2954, test_f1: 0.4440
 epoch: 41, train_loss: 0.7560, test_loss: 1.0026, test_f1: 0.5897
 epoch: 42, train_loss: 0.7622, test_loss: 1.0656, test_f1: 0.5843
 epoch: 43, train_loss: 0.7442, test_loss: 1.1979, test_f1: 0.5634
 epoch: 44, train_loss: 0.7486, test_loss: 1.2265, test_f1: 0.4928
 epoch: 45, train_loss: 0.7397, test_loss: 1.9845, test_f1: 0.5729
 epoch: 46, train_loss: 0.7293, test_loss: 1.0139, test_f1: 0.5931
 epoch: 47, train_loss: 0.7226, test_loss: 1.6096, test_f1: 0.5008
 epoch: 48, train_loss: 0.7339, test_loss: 1.4873, test_f1: 0.5740
 epoch: 49, train_loss: 0.7250, test_loss: 1.1687, test_f1: 0.5793
 epoch: 50, train_loss: 0.7112, test_loss: 1.3883, test_f1: 0.5706
 epoch: 51, train_loss: 0.7236, test_loss: 1.1122, test_f1: 0.5633
 epoch: 52, train_loss: 0.7097, test_loss: 1.2996, test_f1: 0.5657
 epoch: 53, train_loss: 0.7144, test_loss: 1.1483, test_f1: 0.5529
 epoch: 54, train_loss: 0.7072, test_loss: 1.0546, test_f1: 0.5774
 epoch: 55, train_loss: 0.6998, test_loss: 1.1659, test_f1: 0.5637
 epoch: 56, train_loss: 0.6934, test_loss: 1.1449, test_f1: 0.5683
 epoch: 57, train_loss: 0.6958, test_loss: 1.2235, test_f1: 0.5670
 epoch: 58, train_loss: 0.6987, test_loss: 1.1186, test_f1: 0.5658
 epoch: 59, train_loss: 0.6981, test_loss: 1.1537, test_f1: 0.5718
 epoch: 60, train_loss: 0.6914, test_loss: 1.1551, test_f1: 0.5715
 epoch: 61, train_loss: 0.7018, test_loss: 1.0866, test_f1: 0.5656
 epoch: 62, train_loss: 0.6934, test_loss: 1.1426, test_f1: 0.5802
 epoch: 63, train_loss: 0.6966, test_loss: 1.1377, test_f1: 0.5685
 epoch: 64, train_loss: 0.6836, test_loss: 1.1201, test_f1: 0.5730
 epoch: 65, train_loss: 0.6914, test_loss: 1.1757, test_f1: 0.5743
 epoch: 66, train_loss: 0.6861, test_loss: 1.1264, test_f1: 0.5926
 epoch: 67, train_loss: 0.7053, test_loss: 1.0998, test_f1: 0.5706
 epoch: 68, train_loss: 0.6855, test_loss: 1.1101, test_f1: 0.5799
 epoch: 69, train_loss: 0.6766, test_loss: 1.1421, test_f1: 0.5860
 epoch: 70, train_loss: 0.6770, test_loss: 1.2862, test_f1: 0.5808
 epoch: 71, train_loss: 0.6709, test_loss: 1.1672, test_f1: 0.5330
 epoch: 72, train_loss: 0.6780, test_loss: 1.0772, test_f1: 0.5837
 epoch: 73, train_loss: 0.6727, test_loss: 1.2572, test_f1: 0.5579
 epoch: 74, train_loss: 0.6668, test_loss: 1.2461, test_f1: 0.5644
 epoch: 75, train_loss: 0.6681, test_loss: 1.1772, test_f1: 0.5718
 epoch: 76, train_loss: 0.6734, test_loss: 1.1751, test_f1: 0.5695
 epoch: 77, train_loss: 0.6682, test_loss: 1.2117, test_f1: 0.5939
 epoch: 78, train_loss: 0.6868, test_loss: 1.3461, test_f1: 0.5699
 epoch: 79, train_loss: 0.6674, test_loss: 1.2196, test_f1: 0.5743
 epoch: 80, train_loss: 0.6724, test_loss: 1.2403, test_f1: 0.5573
 epoch: 81, train_loss: 0.6778, test_loss: 1.3522, test_f1: 0.5627
 epoch: 82, train_loss: 0.6800, test_loss: 1.2302, test_f1: 0.5851
 epoch: 83, train_loss: 0.6694, test_loss: 1.2645, test_f1: 0.5799
 epoch: 84, train_loss: 0.6521, test_loss: 1.3666, test_f1: 0.5575
 epoch: 85, train_loss: 0.6600, test_loss: 1.2133, test_f1: 0.5695
 epoch: 86, train_loss: 0.6820, test_loss: 1.2879, test_f1: 0.5910
 epoch: 87, train_loss: 0.6680, test_loss: 1.2681, test_f1: 0.5852
 epoch: 88, train_loss: 0.6706, test_loss: 1.2864, test_f1: 0.5638
 epoch: 89, train_loss: 0.6547, test_loss: 1.3656, test_f1: 0.5614
 epoch: 90, train_loss: 0.6724, test_loss: 1.2629, test_f1: 0.5943
 epoch: 91, train_loss: 0.6620, test_loss: 1.1403, test_f1: 0.6123
 epoch: 92, train_loss: 0.6460, test_loss: 1.4040, test_f1: 0.5923
 epoch: 93, train_loss: 0.6613, test_loss: 1.2940, test_f1: 0.5863
 epoch: 94, train_loss: 0.6449, test_loss: 1.2910, test_f1: 0.5879
 epoch: 95, train_loss: 0.6498, test_loss: 1.2758, test_f1: 0.5817
 epoch: 96, train_loss: 0.6470, test_loss: 1.4127, test_f1: 0.5769
 epoch: 97, train_loss: 0.6588, test_loss: 1.2666, test_f1: 0.5685
 epoch: 98, train_loss: 0.6527, test_loss: 1.3378, test_f1: 0.5707
 epoch: 99, train_loss: 0.6659, test_loss: 1.3055, test_f1: 0.5744
##################ITERATION #1 ****************************************
 epoch: 0, train_loss: 1.3739, test_loss: 1.3102, test_f1: 0.2281
 epoch: 1, train_loss: 1.2582, test_loss: 1.2784, test_f1: 0.2281
 epoch: 2, train_loss: 1.2072, test_loss: 1.2552, test_f1: 0.2281
 epoch: 3, train_loss: 1.1858, test_loss: 1.2307, test_f1: 0.3051
 epoch: 4, train_loss: 1.1545, test_loss: 1.2068, test_f1: 0.3480
 epoch: 5, train_loss: 1.1252, test_loss: 1.1814, test_f1: 0.3641
 epoch: 6, train_loss: 1.0962, test_loss: 1.1662, test_f1: 0.3488
 epoch: 7, train_loss: 1.0655, test_loss: 1.1214, test_f1: 0.3636
 epoch: 8, train_loss: 1.0630, test_loss: 1.1116, test_f1: 0.3641
 epoch: 9, train_loss: 1.0278, test_loss: 1.1143, test_f1: 0.3757
 epoch: 10, train_loss: 1.0191, test_loss: 1.0861, test_f1: 0.3869
 epoch: 11, train_loss: 1.0027, test_loss: 1.0858, test_f1: 0.3685
 epoch: 12, train_loss: 0.9833, test_loss: 1.0634, test_f1: 0.4149
 epoch: 13, train_loss: 0.9721, test_loss: 1.0551, test_f1: 0.4260
 epoch: 14, train_loss: 0.9544, test_loss: 1.0435, test_f1: 0.4572
 epoch: 15, train_loss: 0.9398, test_loss: 1.0453, test_f1: 0.4524
 epoch: 16, train_loss: 0.9363, test_loss: 1.0484, test_f1: 0.4697
 epoch: 17, train_loss: 0.9218, test_loss: 1.0438, test_f1: 0.4760
 epoch: 18, train_loss: 0.9146, test_loss: 1.0396, test_f1: 0.4803
 epoch: 19, train_loss: 0.9109, test_loss: 1.0604, test_f1: 0.4570
 epoch: 20, train_loss: 0.8906, test_loss: 1.0274, test_f1: 0.5027
 epoch: 21, train_loss: 0.8693, test_loss: 1.0321, test_f1: 0.4890
 epoch: 22, train_loss: 0.8856, test_loss: 1.0246, test_f1: 0.4973
 epoch: 23, train_loss: 0.8521, test_loss: 1.0758, test_f1: 0.4964
 epoch: 24, train_loss: 0.8428, test_loss: 1.0378, test_f1: 0.4881
 epoch: 25, train_loss: 0.8417, test_loss: 1.0751, test_f1: 0.4943
 epoch: 26, train_loss: 0.8274, test_loss: 1.0215, test_f1: 0.4884
 epoch: 27, train_loss: 0.8159, test_loss: 1.0454, test_f1: 0.5011
 epoch: 28, train_loss: 0.8060, test_loss: 1.0173, test_f1: 0.4987
 epoch: 29, train_loss: 0.8024, test_loss: 1.0562, test_f1: 0.4943
 epoch: 30, train_loss: 0.7945, test_loss: 1.0458, test_f1: 0.5497
 epoch: 31, train_loss: 0.7686, test_loss: 1.0290, test_f1: 0.5190
 epoch: 32, train_loss: 0.7796, test_loss: 1.0907, test_f1: 0.5127
 epoch: 33, train_loss: 0.7552, test_loss: 1.0845, test_f1: 0.5061
 epoch: 34, train_loss: 0.7671, test_loss: 1.1468, test_f1: 0.4901
 epoch: 35, train_loss: 0.7713, test_loss: 1.1245, test_f1: 0.5179
 epoch: 36, train_loss: 0.7679, test_loss: 1.1148, test_f1: 0.5121
 epoch: 37, train_loss: 0.7516, test_loss: 1.0908, test_f1: 0.5287
 epoch: 38, train_loss: 0.7459, test_loss: 1.1153, test_f1: 0.5138
 epoch: 39, train_loss: 0.7440, test_loss: 1.1387, test_f1: 0.5477
 epoch: 40, train_loss: 0.7247, test_loss: 1.1457, test_f1: 0.5115
 epoch: 41, train_loss: 0.7393, test_loss: 1.1653, test_f1: 0.5146
 epoch: 42, train_loss: 0.7153, test_loss: 1.1100, test_f1: 0.5337
 epoch: 43, train_loss: 0.7068, test_loss: 1.1179, test_f1: 0.5575
 epoch: 44, train_loss: 0.7020, test_loss: 1.2145, test_f1: 0.4849
 epoch: 45, train_loss: 0.7179, test_loss: 1.1498, test_f1: 0.5345
 epoch: 46, train_loss: 0.7076, test_loss: 1.1462, test_f1: 0.5380
 epoch: 47, train_loss: 0.6954, test_loss: 1.2028, test_f1: 0.5355
 epoch: 48, train_loss: 0.7020, test_loss: 1.1356, test_f1: 0.5647
 epoch: 49, train_loss: 0.6944, test_loss: 1.0880, test_f1: 0.5515
 epoch: 50, train_loss: 0.6915, test_loss: 1.1646, test_f1: 0.5586
 epoch: 51, train_loss: 0.6776, test_loss: 1.1014, test_f1: 0.5615
 epoch: 52, train_loss: 0.6688, test_loss: 1.1663, test_f1: 0.5450
 epoch: 53, train_loss: 0.6818, test_loss: 1.1741, test_f1: 0.5747
 epoch: 54, train_loss: 0.6821, test_loss: 1.1319, test_f1: 0.5397
 epoch: 55, train_loss: 0.6691, test_loss: 1.1595, test_f1: 0.5488
 epoch: 56, train_loss: 0.6555, test_loss: 1.1570, test_f1: 0.5567
 epoch: 57, train_loss: 0.6695, test_loss: 1.1824, test_f1: 0.5544
 epoch: 58, train_loss: 0.6760, test_loss: 1.1745, test_f1: 0.5615
 epoch: 59, train_loss: 0.6636, test_loss: 1.1820, test_f1: 0.5561
 epoch: 60, train_loss: 0.6558, test_loss: 1.1690, test_f1: 0.5555
 epoch: 61, train_loss: 0.6559, test_loss: 1.2492, test_f1: 0.5496
 epoch: 62, train_loss: 0.6491, test_loss: 1.1585, test_f1: 0.5688
 epoch: 63, train_loss: 0.6603, test_loss: 1.2240, test_f1: 0.5467
 epoch: 64, train_loss: 0.6637, test_loss: 1.1900, test_f1: 0.5628
 epoch: 65, train_loss: 0.6531, test_loss: 1.1931, test_f1: 0.5478
 epoch: 66, train_loss: 0.6487, test_loss: 1.2344, test_f1: 0.5419
 epoch: 67, train_loss: 0.6455, test_loss: 1.1788, test_f1: 0.5431
 epoch: 68, train_loss: 0.6396, test_loss: 1.1950, test_f1: 0.5686
 epoch: 69, train_loss: 0.6491, test_loss: 1.1693, test_f1: 0.5624
 epoch: 70, train_loss: 0.6647, test_loss: 1.1977, test_f1: 0.5464
 epoch: 71, train_loss: 0.6591, test_loss: 1.2038, test_f1: 0.5605
 epoch: 72, train_loss: 0.6353, test_loss: 1.2204, test_f1: 0.5684
 epoch: 73, train_loss: 0.6332, test_loss: 1.1708, test_f1: 0.5724
 epoch: 74, train_loss: 0.6377, test_loss: 1.2354, test_f1: 0.5743
 epoch: 75, train_loss: 0.6381, test_loss: 1.2201, test_f1: 0.5533
 epoch: 76, train_loss: 0.6369, test_loss: 1.2161, test_f1: 0.5720
 epoch: 77, train_loss: 0.6287, test_loss: 1.1882, test_f1: 0.5776
 epoch: 78, train_loss: 0.6376, test_loss: 1.2099, test_f1: 0.5792
 epoch: 79, train_loss: 0.6284, test_loss: 1.2711, test_f1: 0.5660
 epoch: 80, train_loss: 0.6310, test_loss: 1.2249, test_f1: 0.5823
 epoch: 81, train_loss: 0.6416, test_loss: 1.2421, test_f1: 0.5616
 epoch: 82, train_loss: 0.6449, test_loss: 1.2509, test_f1: 0.5522
 epoch: 83, train_loss: 0.6296, test_loss: 1.2969, test_f1: 0.5583
 epoch: 84, train_loss: 0.6347, test_loss: 1.3029, test_f1: 0.5598
 epoch: 85, train_loss: 0.6372, test_loss: 1.2877, test_f1: 0.5626
 epoch: 86, train_loss: 0.6176, test_loss: 1.2829, test_f1: 0.5230
 epoch: 87, train_loss: 0.6161, test_loss: 1.2699, test_f1: 0.5634
 epoch: 88, train_loss: 0.6367, test_loss: 1.3343, test_f1: 0.5674
 epoch: 89, train_loss: 0.6249, test_loss: 1.3207, test_f1: 0.5782
 epoch: 90, train_loss: 0.6271, test_loss: 1.3091, test_f1: 0.5686
 epoch: 91, train_loss: 0.6197, test_loss: 1.3481, test_f1: 0.5410
 epoch: 92, train_loss: 0.6266, test_loss: 1.3302, test_f1: 0.5504
 epoch: 93, train_loss: 0.6192, test_loss: 1.2940, test_f1: 0.5799
 epoch: 94, train_loss: 0.6378, test_loss: 1.3493, test_f1: 0.5496
 epoch: 95, train_loss: 0.6162, test_loss: 1.3534, test_f1: 0.5480
 epoch: 96, train_loss: 0.6319, test_loss: 1.2880, test_f1: 0.5692
 epoch: 97, train_loss: 0.6165, test_loss: 1.3713, test_f1: 0.5510
 epoch: 98, train_loss: 0.6263, test_loss: 1.3292, test_f1: 0.5452
 epoch: 99, train_loss: 0.6293, test_loss: 1.3052, test_f1: 0.5426
##################ITERATION #2 ****************************************
 epoch: 0, train_loss: 1.3354, test_loss: 1.3012, test_f1: 0.2281
 epoch: 1, train_loss: 1.2225, test_loss: 1.2880, test_f1: 0.2281
 epoch: 2, train_loss: 1.1894, test_loss: 1.2480, test_f1: 0.2281
 epoch: 3, train_loss: 1.1473, test_loss: 1.2099, test_f1: 0.3078
 epoch: 4, train_loss: 1.0997, test_loss: 1.1660, test_f1: 0.3564
 epoch: 5, train_loss: 1.0678, test_loss: 1.1407, test_f1: 0.4063
 epoch: 6, train_loss: 1.0395, test_loss: 1.0821, test_f1: 0.4843
 epoch: 7, train_loss: 0.9927, test_loss: 1.0704, test_f1: 0.4606
 epoch: 8, train_loss: 0.9680, test_loss: 1.0336, test_f1: 0.5009
 epoch: 9, train_loss: 0.9552, test_loss: 1.0171, test_f1: 0.5492
 epoch: 10, train_loss: 0.9155, test_loss: 1.0278, test_f1: 0.5181
 epoch: 11, train_loss: 0.9060, test_loss: 0.9995, test_f1: 0.5348
 epoch: 12, train_loss: 0.8934, test_loss: 1.0126, test_f1: 0.5336
 epoch: 13, train_loss: 0.8864, test_loss: 1.0052, test_f1: 0.5344
 epoch: 14, train_loss: 0.8733, test_loss: 1.0088, test_f1: 0.5571
 epoch: 15, train_loss: 0.8736, test_loss: 1.0068, test_f1: 0.5530
 epoch: 16, train_loss: 0.8523, test_loss: 0.9836, test_f1: 0.5926
 epoch: 17, train_loss: 0.8433, test_loss: 1.0152, test_f1: 0.5613
 epoch: 18, train_loss: 0.8380, test_loss: 0.9909, test_f1: 0.5604
 epoch: 19, train_loss: 0.8206, test_loss: 1.0229, test_f1: 0.5873
 epoch: 20, train_loss: 0.8067, test_loss: 0.9932, test_f1: 0.5277
 epoch: 21, train_loss: 0.8098, test_loss: 0.9759, test_f1: 0.5806
 epoch: 22, train_loss: 0.8083, test_loss: 0.9528, test_f1: 0.5785
 epoch: 23, train_loss: 0.8024, test_loss: 1.0546, test_f1: 0.5078
 epoch: 24, train_loss: 0.7944, test_loss: 1.0593, test_f1: 0.5607
 epoch: 25, train_loss: 0.7824, test_loss: 1.0024, test_f1: 0.5610
 epoch: 26, train_loss: 0.7805, test_loss: 0.9952, test_f1: 0.5799
 epoch: 27, train_loss: 0.7625, test_loss: 1.0161, test_f1: 0.5679
 epoch: 28, train_loss: 0.7892, test_loss: 1.0225, test_f1: 0.5354
 epoch: 29, train_loss: 0.7763, test_loss: 1.0020, test_f1: 0.5911
 epoch: 30, train_loss: 0.7556, test_loss: 0.9994, test_f1: 0.5792
 epoch: 31, train_loss: 0.7656, test_loss: 1.0791, test_f1: 0.4839
 epoch: 32, train_loss: 0.7509, test_loss: 1.0442, test_f1: 0.5550
 epoch: 33, train_loss: 0.7336, test_loss: 0.9702, test_f1: 0.5909
 epoch: 34, train_loss: 0.7448, test_loss: 0.9807, test_f1: 0.6016
 epoch: 35, train_loss: 0.7500, test_loss: 0.9957, test_f1: 0.6173
 epoch: 36, train_loss: 0.7434, test_loss: 1.0929, test_f1: 0.4996
 epoch: 37, train_loss: 0.7504, test_loss: 1.0523, test_f1: 0.5965
 epoch: 38, train_loss: 0.7342, test_loss: 1.0738, test_f1: 0.5579
 epoch: 39, train_loss: 0.7113, test_loss: 1.1037, test_f1: 0.6039
 epoch: 40, train_loss: 0.7322, test_loss: 1.0281, test_f1: 0.5875
 epoch: 41, train_loss: 0.7444, test_loss: 1.0541, test_f1: 0.5434
 epoch: 42, train_loss: 0.7363, test_loss: 1.0822, test_f1: 0.5573
 epoch: 43, train_loss: 0.7253, test_loss: 1.0309, test_f1: 0.5807
 epoch: 44, train_loss: 0.7292, test_loss: 1.0920, test_f1: 0.5231
 epoch: 45, train_loss: 0.7271, test_loss: 1.0755, test_f1: 0.5874
 epoch: 46, train_loss: 0.7161, test_loss: 1.0884, test_f1: 0.5523
 epoch: 47, train_loss: 0.7042, test_loss: 1.1020, test_f1: 0.5376
 epoch: 48, train_loss: 0.7177, test_loss: 1.0180, test_f1: 0.5566
 epoch: 49, train_loss: 0.7069, test_loss: 1.1047, test_f1: 0.5752
 epoch: 50, train_loss: 0.7052, test_loss: 1.0755, test_f1: 0.5862
 epoch: 51, train_loss: 0.7064, test_loss: 1.0137, test_f1: 0.5684
 epoch: 52, train_loss: 0.6963, test_loss: 1.0582, test_f1: 0.6042
 epoch: 53, train_loss: 0.6885, test_loss: 1.1268, test_f1: 0.5938
 epoch: 54, train_loss: 0.6957, test_loss: 1.0570, test_f1: 0.5952
 epoch: 55, train_loss: 0.6919, test_loss: 1.1293, test_f1: 0.5754
 epoch: 56, train_loss: 0.6928, test_loss: 1.0486, test_f1: 0.6254
 epoch: 57, train_loss: 0.6832, test_loss: 1.1064, test_f1: 0.5838
 epoch: 58, train_loss: 0.6897, test_loss: 1.0068, test_f1: 0.6053
 epoch: 59, train_loss: 0.6933, test_loss: 1.0432, test_f1: 0.5744
 epoch: 60, train_loss: 0.6793, test_loss: 1.0435, test_f1: 0.6015
 epoch: 61, train_loss: 0.6806, test_loss: 1.0548, test_f1: 0.6177
 epoch: 62, train_loss: 0.6955, test_loss: 1.1214, test_f1: 0.6333
 epoch: 63, train_loss: 0.6805, test_loss: 1.1202, test_f1: 0.6064
 epoch: 64, train_loss: 0.6800, test_loss: 1.0982, test_f1: 0.6093
 epoch: 65, train_loss: 0.6741, test_loss: 1.1594, test_f1: 0.5720
 epoch: 66, train_loss: 0.6801, test_loss: 1.0934, test_f1: 0.6072
 epoch: 67, train_loss: 0.6778, test_loss: 1.1047, test_f1: 0.6106
 epoch: 68, train_loss: 0.6778, test_loss: 1.1043, test_f1: 0.6300
 epoch: 69, train_loss: 0.6842, test_loss: 1.0453, test_f1: 0.6207
 epoch: 70, train_loss: 0.6600, test_loss: 1.0995, test_f1: 0.6167
 epoch: 71, train_loss: 0.6663, test_loss: 1.1011, test_f1: 0.6285
 epoch: 72, train_loss: 0.6731, test_loss: 1.1254, test_f1: 0.6255
 epoch: 73, train_loss: 0.6824, test_loss: 1.0775, test_f1: 0.6123
 epoch: 74, train_loss: 0.6769, test_loss: 1.0514, test_f1: 0.6196
 epoch: 75, train_loss: 0.6745, test_loss: 1.1503, test_f1: 0.6203
 epoch: 76, train_loss: 0.6737, test_loss: 1.1503, test_f1: 0.6038
 epoch: 77, train_loss: 0.6737, test_loss: 1.1351, test_f1: 0.5719
 epoch: 78, train_loss: 0.6673, test_loss: 1.0783, test_f1: 0.6170
 epoch: 79, train_loss: 0.6577, test_loss: 1.1242, test_f1: 0.6228
 epoch: 80, train_loss: 0.6562, test_loss: 1.0723, test_f1: 0.6352
 epoch: 81, train_loss: 0.6539, test_loss: 1.1712, test_f1: 0.6130
 epoch: 82, train_loss: 0.6593, test_loss: 1.0495, test_f1: 0.6181
 epoch: 83, train_loss: 0.6527, test_loss: 1.1017, test_f1: 0.5912
 epoch: 84, train_loss: 0.6708, test_loss: 1.1029, test_f1: 0.6114
 epoch: 85, train_loss: 0.6567, test_loss: 1.1496, test_f1: 0.5733
 epoch: 86, train_loss: 0.6587, test_loss: 1.1639, test_f1: 0.6043
 epoch: 87, train_loss: 0.6526, test_loss: 1.0969, test_f1: 0.6291
 epoch: 88, train_loss: 0.6588, test_loss: 1.1369, test_f1: 0.6280
 epoch: 89, train_loss: 0.6695, test_loss: 1.1412, test_f1: 0.6091
 epoch: 90, train_loss: 0.6531, test_loss: 1.1370, test_f1: 0.5950
 epoch: 91, train_loss: 0.6582, test_loss: 1.1895, test_f1: 0.6151
 epoch: 92, train_loss: 0.6658, test_loss: 1.2375, test_f1: 0.6118
 epoch: 93, train_loss: 0.6504, test_loss: 1.1543, test_f1: 0.6133
 epoch: 94, train_loss: 0.6562, test_loss: 1.0616, test_f1: 0.6167
 epoch: 95, train_loss: 0.6537, test_loss: 1.0813, test_f1: 0.5899
 epoch: 96, train_loss: 0.6491, test_loss: 1.1942, test_f1: 0.5502
 epoch: 97, train_loss: 0.6440, test_loss: 1.2034, test_f1: 0.6180
 epoch: 98, train_loss: 0.6518, test_loss: 1.0741, test_f1: 0.6352
 epoch: 99, train_loss: 0.6562, test_loss: 1.2789, test_f1: 0.5922
##################ITERATION #3 ****************************************
 epoch: 0, train_loss: 1.2290, test_loss: 1.3299, test_f1: 0.2281
 epoch: 1, train_loss: 1.1408, test_loss: 1.2286, test_f1: 0.3170
 epoch: 2, train_loss: 1.0972, test_loss: 1.1379, test_f1: 0.4044
 epoch: 3, train_loss: 1.0633, test_loss: 1.0988, test_f1: 0.4636
 epoch: 4, train_loss: 1.0275, test_loss: 1.0711, test_f1: 0.4813
 epoch: 5, train_loss: 1.0149, test_loss: 1.0712, test_f1: 0.5073
 epoch: 6, train_loss: 0.9795, test_loss: 1.0512, test_f1: 0.4759
 epoch: 7, train_loss: 0.9486, test_loss: 1.0301, test_f1: 0.4983
 epoch: 8, train_loss: 0.9503, test_loss: 1.0080, test_f1: 0.5227
 epoch: 9, train_loss: 0.9304, test_loss: 1.0007, test_f1: 0.5183
 epoch: 10, train_loss: 0.9179, test_loss: 0.9912, test_f1: 0.5322
 epoch: 11, train_loss: 0.8989, test_loss: 1.0200, test_f1: 0.5236
 epoch: 12, train_loss: 0.8732, test_loss: 0.9648, test_f1: 0.5797
 epoch: 13, train_loss: 0.8787, test_loss: 1.0067, test_f1: 0.5280
 epoch: 14, train_loss: 0.8622, test_loss: 0.9701, test_f1: 0.5872
 epoch: 15, train_loss: 0.8534, test_loss: 0.9947, test_f1: 0.5423
 epoch: 16, train_loss: 0.8276, test_loss: 0.9804, test_f1: 0.5329
 epoch: 17, train_loss: 0.8228, test_loss: 0.9709, test_f1: 0.5642
 epoch: 18, train_loss: 0.8150, test_loss: 0.9825, test_f1: 0.5537
 epoch: 19, train_loss: 0.8096, test_loss: 0.9600, test_f1: 0.5794
 epoch: 20, train_loss: 0.8020, test_loss: 1.0632, test_f1: 0.4901
 epoch: 21, train_loss: 0.8027, test_loss: 0.9637, test_f1: 0.5669
 epoch: 22, train_loss: 0.8062, test_loss: 0.9316, test_f1: 0.5874
 epoch: 23, train_loss: 0.8076, test_loss: 1.0257, test_f1: 0.5388
 epoch: 24, train_loss: 0.7904, test_loss: 0.9599, test_f1: 0.5882
 epoch: 25, train_loss: 0.7923, test_loss: 1.0067, test_f1: 0.5348
 epoch: 26, train_loss: 0.7795, test_loss: 0.9569, test_f1: 0.5881
 epoch: 27, train_loss: 0.7609, test_loss: 0.9477, test_f1: 0.5802
 epoch: 28, train_loss: 0.7591, test_loss: 1.0227, test_f1: 0.5625
 epoch: 29, train_loss: 0.7715, test_loss: 0.9885, test_f1: 0.5876
 epoch: 30, train_loss: 0.7669, test_loss: 1.0041, test_f1: 0.5591
 epoch: 31, train_loss: 0.7526, test_loss: 0.9399, test_f1: 0.6037
 epoch: 32, train_loss: 0.7454, test_loss: 0.9871, test_f1: 0.5633
 epoch: 33, train_loss: 0.7286, test_loss: 1.0346, test_f1: 0.5308
 epoch: 34, train_loss: 0.7388, test_loss: 0.9661, test_f1: 0.5834
 epoch: 35, train_loss: 0.7365, test_loss: 0.9678, test_f1: 0.5383
 epoch: 36, train_loss: 0.7215, test_loss: 1.0479, test_f1: 0.5530
 epoch: 37, train_loss: 0.7240, test_loss: 1.0100, test_f1: 0.5778
 epoch: 38, train_loss: 0.7245, test_loss: 0.9604, test_f1: 0.5728
 epoch: 39, train_loss: 0.7084, test_loss: 1.0307, test_f1: 0.5741
 epoch: 40, train_loss: 0.7208, test_loss: 0.9697, test_f1: 0.5577
 epoch: 41, train_loss: 0.7086, test_loss: 1.0189, test_f1: 0.5460
 epoch: 42, train_loss: 0.7076, test_loss: 1.0218, test_f1: 0.5623
 epoch: 43, train_loss: 0.7010, test_loss: 1.0006, test_f1: 0.5800
 epoch: 44, train_loss: 0.7122, test_loss: 0.9685, test_f1: 0.5872
 epoch: 45, train_loss: 0.7007, test_loss: 0.9625, test_f1: 0.5986
 epoch: 46, train_loss: 0.6886, test_loss: 1.0342, test_f1: 0.5626
 epoch: 47, train_loss: 0.6978, test_loss: 1.0725, test_f1: 0.5694
 epoch: 48, train_loss: 0.7054, test_loss: 0.9314, test_f1: 0.6096
 epoch: 49, train_loss: 0.6924, test_loss: 1.1083, test_f1: 0.5500
 epoch: 50, train_loss: 0.6893, test_loss: 0.9432, test_f1: 0.6047
 epoch: 51, train_loss: 0.6698, test_loss: 0.9958, test_f1: 0.5789
 epoch: 52, train_loss: 0.6714, test_loss: 0.9707, test_f1: 0.6019
 epoch: 53, train_loss: 0.6689, test_loss: 1.0224, test_f1: 0.5903
 epoch: 54, train_loss: 0.6763, test_loss: 0.9699, test_f1: 0.6079
 epoch: 55, train_loss: 0.6649, test_loss: 1.0296, test_f1: 0.5794
 epoch: 56, train_loss: 0.6804, test_loss: 0.9807, test_f1: 0.5988
 epoch: 57, train_loss: 0.6708, test_loss: 1.0022, test_f1: 0.5833
 epoch: 58, train_loss: 0.6655, test_loss: 1.0434, test_f1: 0.6000
 epoch: 59, train_loss: 0.6652, test_loss: 1.0056, test_f1: 0.5849
 epoch: 60, train_loss: 0.6614, test_loss: 1.0174, test_f1: 0.5975
 epoch: 61, train_loss: 0.6585, test_loss: 0.9454, test_f1: 0.6123
 epoch: 62, train_loss: 0.6439, test_loss: 0.9990, test_f1: 0.5974
 epoch: 63, train_loss: 0.6786, test_loss: 1.0090, test_f1: 0.5869
 epoch: 64, train_loss: 0.6602, test_loss: 1.0151, test_f1: 0.5890
 epoch: 65, train_loss: 0.6665, test_loss: 1.0131, test_f1: 0.5830
 epoch: 66, train_loss: 0.6584, test_loss: 1.0164, test_f1: 0.5802
 epoch: 67, train_loss: 0.6588, test_loss: 1.0156, test_f1: 0.5729
 epoch: 68, train_loss: 0.6556, test_loss: 1.0155, test_f1: 0.5752
 epoch: 69, train_loss: 0.6621, test_loss: 1.0023, test_f1: 0.5874
 epoch: 70, train_loss: 0.6585, test_loss: 1.0397, test_f1: 0.5707
 epoch: 71, train_loss: 0.6762, test_loss: 1.0070, test_f1: 0.5775
 epoch: 72, train_loss: 0.6399, test_loss: 1.0556, test_f1: 0.5653
 epoch: 73, train_loss: 0.6496, test_loss: 0.9816, test_f1: 0.5859
 epoch: 74, train_loss: 0.6577, test_loss: 1.0542, test_f1: 0.5646
 epoch: 75, train_loss: 0.6624, test_loss: 1.0101, test_f1: 0.5934
 epoch: 76, train_loss: 0.6703, test_loss: 0.9692, test_f1: 0.5866
 epoch: 77, train_loss: 0.6510, test_loss: 1.0362, test_f1: 0.5833
 epoch: 78, train_loss: 0.6457, test_loss: 1.0544, test_f1: 0.5916
 epoch: 79, train_loss: 0.6566, test_loss: 1.0166, test_f1: 0.5799
 epoch: 80, train_loss: 0.6398, test_loss: 0.9897, test_f1: 0.5985
 epoch: 81, train_loss: 0.6575, test_loss: 0.9915, test_f1: 0.5946
 epoch: 82, train_loss: 0.6555, test_loss: 1.0188, test_f1: 0.5743
 epoch: 83, train_loss: 0.6497, test_loss: 1.0385, test_f1: 0.5878
 epoch: 84, train_loss: 0.6407, test_loss: 1.0006, test_f1: 0.5837
 epoch: 85, train_loss: 0.6391, test_loss: 0.9841, test_f1: 0.6074
 epoch: 86, train_loss: 0.6500, test_loss: 0.9501, test_f1: 0.6205
 epoch: 87, train_loss: 0.6402, test_loss: 1.0461, test_f1: 0.5806
 epoch: 88, train_loss: 0.6354, test_loss: 0.9474, test_f1: 0.6273
 epoch: 89, train_loss: 0.6469, test_loss: 1.0411, test_f1: 0.5952
 epoch: 90, train_loss: 0.6245, test_loss: 1.0462, test_f1: 0.5928
 epoch: 91, train_loss: 0.6317, test_loss: 1.0009, test_f1: 0.6118
 epoch: 92, train_loss: 0.6428, test_loss: 1.0649, test_f1: 0.5885
 epoch: 93, train_loss: 0.6271, test_loss: 1.0160, test_f1: 0.5937
 epoch: 94, train_loss: 0.6251, test_loss: 1.0233, test_f1: 0.5664
 epoch: 95, train_loss: 0.6204, test_loss: 1.0079, test_f1: 0.5991
 epoch: 96, train_loss: 0.6309, test_loss: 1.0064, test_f1: 0.5772
 epoch: 97, train_loss: 0.6324, test_loss: 1.0454, test_f1: 0.5733
 epoch: 98, train_loss: 0.6444, test_loss: 1.0284, test_f1: 0.5932
 epoch: 99, train_loss: 0.6262, test_loss: 1.0024, test_f1: 0.6242
##################ITERATION #4 ****************************************
 epoch: 0, train_loss: 1.6203, test_loss: 1.3323, test_f1: 0.2652
 epoch: 1, train_loss: 1.2274, test_loss: 1.2985, test_f1: 0.2467
 epoch: 2, train_loss: 1.1842, test_loss: 1.2118, test_f1: 0.3489
 epoch: 3, train_loss: 1.1439, test_loss: 1.1850, test_f1: 0.3833
 epoch: 4, train_loss: 1.1266, test_loss: 1.1549, test_f1: 0.4167
 epoch: 5, train_loss: 1.0974, test_loss: 1.1396, test_f1: 0.4297
 epoch: 6, train_loss: 1.0767, test_loss: 1.1119, test_f1: 0.4615
 epoch: 7, train_loss: 1.0410, test_loss: 1.0749, test_f1: 0.4783
 epoch: 8, train_loss: 1.0236, test_loss: 1.0718, test_f1: 0.4798
 epoch: 9, train_loss: 1.0107, test_loss: 1.0419, test_f1: 0.4961
 epoch: 10, train_loss: 0.9901, test_loss: 1.0290, test_f1: 0.5235
 epoch: 11, train_loss: 0.9781, test_loss: 1.0476, test_f1: 0.4934
 epoch: 12, train_loss: 0.9635, test_loss: 1.0057, test_f1: 0.5086
 epoch: 13, train_loss: 0.9740, test_loss: 1.0284, test_f1: 0.5046
 epoch: 14, train_loss: 0.9577, test_loss: 0.9825, test_f1: 0.5145
 epoch: 15, train_loss: 0.9245, test_loss: 0.9795, test_f1: 0.5218
 epoch: 16, train_loss: 0.9332, test_loss: 0.9812, test_f1: 0.5240
 epoch: 17, train_loss: 0.9122, test_loss: 0.9864, test_f1: 0.5231
 epoch: 18, train_loss: 0.9191, test_loss: 0.9852, test_f1: 0.5239
 epoch: 19, train_loss: 0.8983, test_loss: 0.9597, test_f1: 0.5280
 epoch: 20, train_loss: 0.8846, test_loss: 0.9697, test_f1: 0.5425
 epoch: 21, train_loss: 0.8840, test_loss: 0.9764, test_f1: 0.5263
 epoch: 22, train_loss: 0.8622, test_loss: 0.9485, test_f1: 0.5217
 epoch: 23, train_loss: 0.8591, test_loss: 0.9655, test_f1: 0.5535
 epoch: 24, train_loss: 0.8589, test_loss: 0.9532, test_f1: 0.5455
 epoch: 25, train_loss: 0.8332, test_loss: 0.9600, test_f1: 0.5340
 epoch: 26, train_loss: 0.8448, test_loss: 0.9848, test_f1: 0.5449
 epoch: 27, train_loss: 0.8408, test_loss: 0.9924, test_f1: 0.5426
 epoch: 28, train_loss: 0.8249, test_loss: 0.9839, test_f1: 0.5408
 epoch: 29, train_loss: 0.8198, test_loss: 0.9545, test_f1: 0.5539
 epoch: 30, train_loss: 0.8044, test_loss: 0.9853, test_f1: 0.5545
 epoch: 31, train_loss: 0.8184, test_loss: 0.9846, test_f1: 0.5357
 epoch: 32, train_loss: 0.7990, test_loss: 0.9557, test_f1: 0.5665
 epoch: 33, train_loss: 0.7960, test_loss: 0.9407, test_f1: 0.5913
 epoch: 34, train_loss: 0.8083, test_loss: 0.9699, test_f1: 0.5638
 epoch: 35, train_loss: 0.7937, test_loss: 0.9218, test_f1: 0.6186
 epoch: 36, train_loss: 0.8088, test_loss: 0.9344, test_f1: 0.5599
 epoch: 37, train_loss: 0.8015, test_loss: 0.9675, test_f1: 0.5423
 epoch: 38, train_loss: 0.7896, test_loss: 0.9712, test_f1: 0.5437
 epoch: 39, train_loss: 0.7895, test_loss: 0.9379, test_f1: 0.6104
 epoch: 40, train_loss: 0.7822, test_loss: 0.9383, test_f1: 0.5745
 epoch: 41, train_loss: 0.7811, test_loss: 0.9492, test_f1: 0.5542
 epoch: 42, train_loss: 0.7803, test_loss: 0.9334, test_f1: 0.5853
 epoch: 43, train_loss: 0.7703, test_loss: 0.9393, test_f1: 0.5900
 epoch: 44, train_loss: 0.7718, test_loss: 0.9051, test_f1: 0.5801
 epoch: 45, train_loss: 0.7684, test_loss: 0.9762, test_f1: 0.5888
 epoch: 46, train_loss: 0.7673, test_loss: 0.9322, test_f1: 0.5742
 epoch: 47, train_loss: 0.7580, test_loss: 1.0436, test_f1: 0.5382
 epoch: 48, train_loss: 0.7832, test_loss: 0.9670, test_f1: 0.5602
 epoch: 49, train_loss: 0.7528, test_loss: 0.9447, test_f1: 0.5879
 epoch: 50, train_loss: 0.7574, test_loss: 0.9137, test_f1: 0.5888
 epoch: 51, train_loss: 0.7381, test_loss: 0.9246, test_f1: 0.5893
 epoch: 52, train_loss: 0.7317, test_loss: 0.9278, test_f1: 0.5832
 epoch: 53, train_loss: 0.7227, test_loss: 0.9563, test_f1: 0.5982
 epoch: 54, train_loss: 0.7292, test_loss: 0.9363, test_f1: 0.5932
 epoch: 55, train_loss: 0.7219, test_loss: 0.9213, test_f1: 0.6123
 epoch: 56, train_loss: 0.7335, test_loss: 0.9139, test_f1: 0.6052
 epoch: 57, train_loss: 0.7339, test_loss: 0.9284, test_f1: 0.5809
 epoch: 58, train_loss: 0.7201, test_loss: 0.9381, test_f1: 0.6240
 epoch: 59, train_loss: 0.7221, test_loss: 0.9164, test_f1: 0.5957
 epoch: 60, train_loss: 0.7396, test_loss: 0.9135, test_f1: 0.6055
 epoch: 61, train_loss: 0.7057, test_loss: 0.9396, test_f1: 0.6127
 epoch: 62, train_loss: 0.7006, test_loss: 0.9175, test_f1: 0.6025
 epoch: 63, train_loss: 0.7308, test_loss: 0.9212, test_f1: 0.6134
 epoch: 64, train_loss: 0.7080, test_loss: 0.9127, test_f1: 0.5922
 epoch: 65, train_loss: 0.7170, test_loss: 0.9293, test_f1: 0.5858
 epoch: 66, train_loss: 0.7185, test_loss: 0.9249, test_f1: 0.5897
 epoch: 67, train_loss: 0.7011, test_loss: 0.9096, test_f1: 0.6156
 epoch: 68, train_loss: 0.7045, test_loss: 0.9581, test_f1: 0.5983
 epoch: 69, train_loss: 0.7271, test_loss: 0.9883, test_f1: 0.6015
 epoch: 70, train_loss: 0.7226, test_loss: 0.8888, test_f1: 0.6181
 epoch: 71, train_loss: 0.7035, test_loss: 0.9577, test_f1: 0.5756
 epoch: 72, train_loss: 0.6963, test_loss: 0.9233, test_f1: 0.6068
 epoch: 73, train_loss: 0.7107, test_loss: 0.9327, test_f1: 0.5956
 epoch: 74, train_loss: 0.7009, test_loss: 0.9509, test_f1: 0.6104
 epoch: 75, train_loss: 0.6913, test_loss: 0.9567, test_f1: 0.6028
 epoch: 76, train_loss: 0.7022, test_loss: 0.9310, test_f1: 0.5903
 epoch: 77, train_loss: 0.6952, test_loss: 0.9177, test_f1: 0.5897
 epoch: 78, train_loss: 0.6981, test_loss: 0.9318, test_f1: 0.6183
 epoch: 79, train_loss: 0.6943, test_loss: 0.9176, test_f1: 0.6283
 epoch: 80, train_loss: 0.6870, test_loss: 0.9514, test_f1: 0.6025
 epoch: 81, train_loss: 0.6817, test_loss: 0.9490, test_f1: 0.5856
 epoch: 82, train_loss: 0.6948, test_loss: 0.9375, test_f1: 0.6022
 epoch: 83, train_loss: 0.6897, test_loss: 0.9471, test_f1: 0.5995
 epoch: 84, train_loss: 0.6775, test_loss: 0.9550, test_f1: 0.5783
 epoch: 85, train_loss: 0.6952, test_loss: 0.9283, test_f1: 0.6148
 epoch: 86, train_loss: 0.6708, test_loss: 0.9033, test_f1: 0.6097
 epoch: 87, train_loss: 0.6761, test_loss: 0.9158, test_f1: 0.6099
 epoch: 88, train_loss: 0.6912, test_loss: 0.9474, test_f1: 0.5971
 epoch: 89, train_loss: 0.6799, test_loss: 0.9235, test_f1: 0.6046
 epoch: 90, train_loss: 0.6827, test_loss: 0.9303, test_f1: 0.5992
 epoch: 91, train_loss: 0.6879, test_loss: 0.9223, test_f1: 0.6013
 epoch: 92, train_loss: 0.6780, test_loss: 0.9934, test_f1: 0.5912
 epoch: 93, train_loss: 0.6623, test_loss: 0.9744, test_f1: 0.6038
 epoch: 94, train_loss: 0.6682, test_loss: 0.9377, test_f1: 0.5871
 epoch: 95, train_loss: 0.6659, test_loss: 0.9422, test_f1: 0.6047
 epoch: 96, train_loss: 0.6709, test_loss: 0.9477, test_f1: 0.5827
 epoch: 97, train_loss: 0.6488, test_loss: 0.9466, test_f1: 0.6047
 epoch: 98, train_loss: 0.6693, test_loss: 0.9529, test_f1: 0.5899
 epoch: 99, train_loss: 0.6852, test_loss: 0.9123, test_f1: 0.6158
##################ITERATION #5 ****************************************
 epoch: 0, train_loss: 1.3707, test_loss: 1.3620, test_f1: 0.2722
 epoch: 1, train_loss: 1.2261, test_loss: 1.3019, test_f1: 0.3327
 epoch: 2, train_loss: 1.1815, test_loss: 1.2404, test_f1: 0.3395
 epoch: 3, train_loss: 1.1335, test_loss: 1.2086, test_f1: 0.3904
 epoch: 4, train_loss: 1.1191, test_loss: 1.1749, test_f1: 0.4109
 epoch: 5, train_loss: 1.0843, test_loss: 1.1379, test_f1: 0.4602
 epoch: 6, train_loss: 1.0338, test_loss: 1.1123, test_f1: 0.4535
 epoch: 7, train_loss: 1.0291, test_loss: 1.1219, test_f1: 0.4657
 epoch: 8, train_loss: 1.0006, test_loss: 1.0992, test_f1: 0.4788
 epoch: 9, train_loss: 0.9834, test_loss: 1.0781, test_f1: 0.5254
 epoch: 10, train_loss: 0.9534, test_loss: 1.0366, test_f1: 0.5263
 epoch: 11, train_loss: 0.9382, test_loss: 1.0483, test_f1: 0.5282
 epoch: 12, train_loss: 0.9213, test_loss: 1.0348, test_f1: 0.5698
 epoch: 13, train_loss: 0.9165, test_loss: 1.0209, test_f1: 0.5564
 epoch: 14, train_loss: 0.8895, test_loss: 1.0282, test_f1: 0.5205
 epoch: 15, train_loss: 0.8900, test_loss: 1.0326, test_f1: 0.5555
 epoch: 16, train_loss: 0.8813, test_loss: 1.0568, test_f1: 0.5647
 epoch: 17, train_loss: 0.8613, test_loss: 1.0307, test_f1: 0.5604
 epoch: 18, train_loss: 0.8511, test_loss: 1.0107, test_f1: 0.5569
 epoch: 19, train_loss: 0.8414, test_loss: 1.0022, test_f1: 0.5363
 epoch: 20, train_loss: 0.8365, test_loss: 1.0215, test_f1: 0.5433
 epoch: 21, train_loss: 0.8329, test_loss: 1.0046, test_f1: 0.5468
 epoch: 22, train_loss: 0.8403, test_loss: 1.0155, test_f1: 0.5204
 epoch: 23, train_loss: 0.8195, test_loss: 1.0309, test_f1: 0.5266
 epoch: 24, train_loss: 0.8249, test_loss: 1.0091, test_f1: 0.5589
 epoch: 25, train_loss: 0.8025, test_loss: 1.0482, test_f1: 0.5435
 epoch: 26, train_loss: 0.8031, test_loss: 1.0531, test_f1: 0.4858
 epoch: 27, train_loss: 0.7907, test_loss: 1.0231, test_f1: 0.5306
 epoch: 28, train_loss: 0.8071, test_loss: 1.0573, test_f1: 0.5033
 epoch: 29, train_loss: 0.7978, test_loss: 1.0140, test_f1: 0.5304
 epoch: 30, train_loss: 0.7885, test_loss: 1.0338, test_f1: 0.5427
 epoch: 31, train_loss: 0.7856, test_loss: 1.0371, test_f1: 0.5601
 epoch: 32, train_loss: 0.7690, test_loss: 1.0382, test_f1: 0.5206
 epoch: 33, train_loss: 0.7803, test_loss: 1.0552, test_f1: 0.5406
 epoch: 34, train_loss: 0.7518, test_loss: 1.0202, test_f1: 0.5446
 epoch: 35, train_loss: 0.7734, test_loss: 1.1359, test_f1: 0.5160
 epoch: 36, train_loss: 0.7660, test_loss: 1.0277, test_f1: 0.5894
 epoch: 37, train_loss: 0.7683, test_loss: 1.0978, test_f1: 0.5315
 epoch: 38, train_loss: 0.7496, test_loss: 1.0845, test_f1: 0.5485
 epoch: 39, train_loss: 0.7339, test_loss: 1.0871, test_f1: 0.5380
 epoch: 40, train_loss: 0.7432, test_loss: 1.0753, test_f1: 0.5615
 epoch: 41, train_loss: 0.7312, test_loss: 1.1133, test_f1: 0.5150
 epoch: 42, train_loss: 0.7420, test_loss: 1.0946, test_f1: 0.5415
 epoch: 43, train_loss: 0.7381, test_loss: 1.0736, test_f1: 0.5533
 epoch: 44, train_loss: 0.7432, test_loss: 1.0398, test_f1: 0.5865
 epoch: 45, train_loss: 0.7287, test_loss: 1.1362, test_f1: 0.5576
 epoch: 46, train_loss: 0.7394, test_loss: 1.1065, test_f1: 0.5425
 epoch: 47, train_loss: 0.7297, test_loss: 1.0871, test_f1: 0.5501
 epoch: 48, train_loss: 0.7376, test_loss: 1.2239, test_f1: 0.5519
 epoch: 49, train_loss: 0.7413, test_loss: 1.0409, test_f1: 0.5472
 epoch: 50, train_loss: 0.7284, test_loss: 1.1954, test_f1: 0.5320
 epoch: 51, train_loss: 0.7126, test_loss: 1.1723, test_f1: 0.5317
 epoch: 52, train_loss: 0.7000, test_loss: 1.0802, test_f1: 0.5487
 epoch: 53, train_loss: 0.6988, test_loss: 1.1025, test_f1: 0.5612
 epoch: 54, train_loss: 0.7167, test_loss: 1.1719, test_f1: 0.5414
 epoch: 55, train_loss: 0.6910, test_loss: 1.1693, test_f1: 0.5323
 epoch: 56, train_loss: 0.7029, test_loss: 1.1131, test_f1: 0.5286
 epoch: 57, train_loss: 0.6933, test_loss: 1.1750, test_f1: 0.5071
 epoch: 58, train_loss: 0.6836, test_loss: 1.1617, test_f1: 0.5286
 epoch: 59, train_loss: 0.6964, test_loss: 1.1452, test_f1: 0.5177
 epoch: 60, train_loss: 0.7016, test_loss: 1.2027, test_f1: 0.5161
 epoch: 61, train_loss: 0.6956, test_loss: 1.1864, test_f1: 0.5199
 epoch: 62, train_loss: 0.6906, test_loss: 1.1818, test_f1: 0.5463
 epoch: 63, train_loss: 0.7026, test_loss: 1.1829, test_f1: 0.5317
 epoch: 64, train_loss: 0.6814, test_loss: 1.1758, test_f1: 0.5158
 epoch: 65, train_loss: 0.6873, test_loss: 1.2102, test_f1: 0.5045
 epoch: 66, train_loss: 0.6881, test_loss: 1.1714, test_f1: 0.5161
 epoch: 67, train_loss: 0.6805, test_loss: 1.1547, test_f1: 0.5429
 epoch: 68, train_loss: 0.6811, test_loss: 1.2028, test_f1: 0.5248
 epoch: 69, train_loss: 0.6741, test_loss: 1.2119, test_f1: 0.5255
 epoch: 70, train_loss: 0.6968, test_loss: 1.2200, test_f1: 0.5341
 epoch: 71, train_loss: 0.6817, test_loss: 1.1994, test_f1: 0.5453
 epoch: 72, train_loss: 0.6774, test_loss: 1.1755, test_f1: 0.5439
 epoch: 73, train_loss: 0.6849, test_loss: 1.2215, test_f1: 0.5468
 epoch: 74, train_loss: 0.6698, test_loss: 1.2999, test_f1: 0.5237
 epoch: 75, train_loss: 0.6636, test_loss: 1.2130, test_f1: 0.5606
 epoch: 76, train_loss: 0.6663, test_loss: 1.1906, test_f1: 0.5406
 epoch: 77, train_loss: 0.6642, test_loss: 1.2565, test_f1: 0.5253
 epoch: 78, train_loss: 0.6768, test_loss: 1.2350, test_f1: 0.5372
 epoch: 79, train_loss: 0.6592, test_loss: 1.2042, test_f1: 0.5363
 epoch: 80, train_loss: 0.6589, test_loss: 1.2549, test_f1: 0.5348
 epoch: 81, train_loss: 0.6676, test_loss: 1.1308, test_f1: 0.5464
 epoch: 82, train_loss: 0.6734, test_loss: 1.2663, test_f1: 0.5384
 epoch: 83, train_loss: 0.6673, test_loss: 1.2245, test_f1: 0.5457
 epoch: 84, train_loss: 0.6673, test_loss: 1.3109, test_f1: 0.5612
 epoch: 85, train_loss: 0.6686, test_loss: 1.2750, test_f1: 0.5363
 epoch: 86, train_loss: 0.6485, test_loss: 1.2066, test_f1: 0.5676
 epoch: 87, train_loss: 0.6501, test_loss: 1.2387, test_f1: 0.5591
 epoch: 88, train_loss: 0.6492, test_loss: 1.3040, test_f1: 0.5591
 epoch: 89, train_loss: 0.6666, test_loss: 1.2736, test_f1: 0.5380
 epoch: 90, train_loss: 0.6536, test_loss: 1.2874, test_f1: 0.5424
 epoch: 91, train_loss: 0.6600, test_loss: 1.2885, test_f1: 0.5356
 epoch: 92, train_loss: 0.6600, test_loss: 1.2623, test_f1: 0.5228
 epoch: 93, train_loss: 0.6620, test_loss: 1.2440, test_f1: 0.5220
 epoch: 94, train_loss: 0.6477, test_loss: 1.3858, test_f1: 0.5874
 epoch: 95, train_loss: 0.6551, test_loss: 1.2645, test_f1: 0.5434
 epoch: 96, train_loss: 0.6526, test_loss: 1.2901, test_f1: 0.5663
 epoch: 97, train_loss: 0.6486, test_loss: 1.2192, test_f1: 0.5521
 epoch: 98, train_loss: 0.6646, test_loss: 1.2398, test_f1: 0.5670
 epoch: 99, train_loss: 0.6482, test_loss: 1.2495, test_f1: 0.5637
##################ITERATION #6 ****************************************
 epoch: 0, train_loss: 1.6730, test_loss: 1.3516, test_f1: 0.2285
 epoch: 1, train_loss: 1.2867, test_loss: 1.3313, test_f1: 0.3409
 epoch: 2, train_loss: 1.2205, test_loss: 1.2674, test_f1: 0.3220
 epoch: 3, train_loss: 1.2323, test_loss: 1.2380, test_f1: 0.3443
 epoch: 4, train_loss: 1.1741, test_loss: 1.2115, test_f1: 0.3598
 epoch: 5, train_loss: 1.1723, test_loss: 1.1936, test_f1: 0.4211
 epoch: 6, train_loss: 1.1140, test_loss: 1.1917, test_f1: 0.4181
 epoch: 7, train_loss: 1.1011, test_loss: 1.1725, test_f1: 0.4348
 epoch: 8, train_loss: 1.0718, test_loss: 1.1552, test_f1: 0.4335
 epoch: 9, train_loss: 1.0524, test_loss: 1.1459, test_f1: 0.4823
 epoch: 10, train_loss: 1.0171, test_loss: 1.1208, test_f1: 0.4723
 epoch: 11, train_loss: 1.0160, test_loss: 1.1314, test_f1: 0.4695
 epoch: 12, train_loss: 0.9799, test_loss: 1.1251, test_f1: 0.4997
 epoch: 13, train_loss: 0.9882, test_loss: 1.1237, test_f1: 0.5001
 epoch: 14, train_loss: 0.9586, test_loss: 1.1151, test_f1: 0.4812
 epoch: 15, train_loss: 0.9340, test_loss: 1.1287, test_f1: 0.4784
 epoch: 16, train_loss: 0.9267, test_loss: 1.1042, test_f1: 0.5138
 epoch: 17, train_loss: 0.9294, test_loss: 1.1065, test_f1: 0.4630
 epoch: 18, train_loss: 0.9272, test_loss: 1.0779, test_f1: 0.4809
 epoch: 19, train_loss: 0.9086, test_loss: 1.0735, test_f1: 0.5138
 epoch: 20, train_loss: 0.8867, test_loss: 1.0920, test_f1: 0.4907
 epoch: 21, train_loss: 0.8768, test_loss: 1.1315, test_f1: 0.5210
 epoch: 22, train_loss: 0.8691, test_loss: 1.0464, test_f1: 0.5065
 epoch: 23, train_loss: 0.8785, test_loss: 1.2048, test_f1: 0.4149
 epoch: 24, train_loss: 0.8451, test_loss: 1.0495, test_f1: 0.5059
 epoch: 25, train_loss: 0.8340, test_loss: 1.0497, test_f1: 0.5213
 epoch: 26, train_loss: 0.8455, test_loss: 1.0601, test_f1: 0.5075
 epoch: 27, train_loss: 0.8373, test_loss: 1.1297, test_f1: 0.4910
 epoch: 28, train_loss: 0.8139, test_loss: 1.0605, test_f1: 0.5074
 epoch: 29, train_loss: 0.8109, test_loss: 1.0684, test_f1: 0.5123
 epoch: 30, train_loss: 0.8032, test_loss: 1.0786, test_f1: 0.4993
 epoch: 31, train_loss: 0.8030, test_loss: 1.1120, test_f1: 0.5001
 epoch: 32, train_loss: 0.7973, test_loss: 1.1180, test_f1: 0.5071
 epoch: 33, train_loss: 0.7832, test_loss: 1.1730, test_f1: 0.5150
 epoch: 34, train_loss: 0.7872, test_loss: 1.0977, test_f1: 0.5226
 epoch: 35, train_loss: 0.7769, test_loss: 1.0823, test_f1: 0.5348
 epoch: 36, train_loss: 0.7788, test_loss: 1.0846, test_f1: 0.4998
 epoch: 37, train_loss: 0.7693, test_loss: 1.2999, test_f1: 0.4407
 epoch: 38, train_loss: 0.7657, test_loss: 1.0829, test_f1: 0.5363
 epoch: 39, train_loss: 0.7695, test_loss: 1.0752, test_f1: 0.5166
 epoch: 40, train_loss: 0.7712, test_loss: 1.1450, test_f1: 0.5368
 epoch: 41, train_loss: 0.7676, test_loss: 1.1226, test_f1: 0.5055
 epoch: 42, train_loss: 0.7507, test_loss: 1.1022, test_f1: 0.5557
 epoch: 43, train_loss: 0.7468, test_loss: 1.1416, test_f1: 0.5216
 epoch: 44, train_loss: 0.7310, test_loss: 1.1555, test_f1: 0.5294
 epoch: 45, train_loss: 0.7286, test_loss: 1.1742, test_f1: 0.5417
 epoch: 46, train_loss: 0.7219, test_loss: 1.1089, test_f1: 0.5364
 epoch: 47, train_loss: 0.7276, test_loss: 1.1079, test_f1: 0.5270
 epoch: 48, train_loss: 0.7399, test_loss: 1.1277, test_f1: 0.5135
 epoch: 49, train_loss: 0.7124, test_loss: 1.1111, test_f1: 0.5497
 epoch: 50, train_loss: 0.7033, test_loss: 1.1338, test_f1: 0.5322
 epoch: 51, train_loss: 0.6960, test_loss: 1.1466, test_f1: 0.5398
 epoch: 52, train_loss: 0.7210, test_loss: 1.0936, test_f1: 0.5525
 epoch: 53, train_loss: 0.6965, test_loss: 1.1358, test_f1: 0.5472
 epoch: 54, train_loss: 0.6894, test_loss: 1.1613, test_f1: 0.5497
 epoch: 55, train_loss: 0.6864, test_loss: 1.1055, test_f1: 0.5406
 epoch: 56, train_loss: 0.7073, test_loss: 1.1115, test_f1: 0.5396
 epoch: 57, train_loss: 0.7077, test_loss: 1.1145, test_f1: 0.5305
 epoch: 58, train_loss: 0.6862, test_loss: 1.1305, test_f1: 0.5338
 epoch: 59, train_loss: 0.6777, test_loss: 1.1032, test_f1: 0.5578
 epoch: 60, train_loss: 0.6822, test_loss: 1.1656, test_f1: 0.5529
 epoch: 61, train_loss: 0.6866, test_loss: 1.1816, test_f1: 0.5349
 epoch: 62, train_loss: 0.6933, test_loss: 1.1861, test_f1: 0.5278
 epoch: 63, train_loss: 0.6853, test_loss: 1.1709, test_f1: 0.5573
 epoch: 64, train_loss: 0.6862, test_loss: 1.2097, test_f1: 0.5490
 epoch: 65, train_loss: 0.6841, test_loss: 1.2037, test_f1: 0.5446
 epoch: 66, train_loss: 0.6681, test_loss: 1.1521, test_f1: 0.5651
 epoch: 67, train_loss: 0.6811, test_loss: 1.1601, test_f1: 0.5747
 epoch: 68, train_loss: 0.6744, test_loss: 1.1636, test_f1: 0.5443
 epoch: 69, train_loss: 0.6713, test_loss: 1.2112, test_f1: 0.5556
 epoch: 70, train_loss: 0.6636, test_loss: 1.1439, test_f1: 0.5398
 epoch: 71, train_loss: 0.6746, test_loss: 1.1582, test_f1: 0.5333
 epoch: 72, train_loss: 0.6673, test_loss: 1.2140, test_f1: 0.5564
 epoch: 73, train_loss: 0.6728, test_loss: 1.1377, test_f1: 0.5597
 epoch: 74, train_loss: 0.6479, test_loss: 1.2350, test_f1: 0.5369
 epoch: 75, train_loss: 0.6740, test_loss: 1.1878, test_f1: 0.5593
 epoch: 76, train_loss: 0.6545, test_loss: 1.1766, test_f1: 0.5363
 epoch: 77, train_loss: 0.6478, test_loss: 1.1920, test_f1: 0.5472
 epoch: 78, train_loss: 0.6524, test_loss: 1.1938, test_f1: 0.5471
 epoch: 79, train_loss: 0.6473, test_loss: 1.2087, test_f1: 0.5475
 epoch: 80, train_loss: 0.6443, test_loss: 1.2696, test_f1: 0.5484
 epoch: 81, train_loss: 0.6438, test_loss: 1.2276, test_f1: 0.5345
 epoch: 82, train_loss: 0.6554, test_loss: 1.2464, test_f1: 0.5565
 epoch: 83, train_loss: 0.6324, test_loss: 1.2791, test_f1: 0.5335
 epoch: 84, train_loss: 0.6523, test_loss: 1.1279, test_f1: 0.5357
 epoch: 85, train_loss: 0.6368, test_loss: 1.2667, test_f1: 0.5604
 epoch: 86, train_loss: 0.6507, test_loss: 1.2814, test_f1: 0.5441
 epoch: 87, train_loss: 0.6519, test_loss: 1.1646, test_f1: 0.5487
 epoch: 88, train_loss: 0.6584, test_loss: 1.3190, test_f1: 0.5409
 epoch: 89, train_loss: 0.6436, test_loss: 1.2017, test_f1: 0.5543
 epoch: 90, train_loss: 0.6395, test_loss: 1.2579, test_f1: 0.5819
 epoch: 91, train_loss: 0.6408, test_loss: 1.2247, test_f1: 0.5351
 epoch: 92, train_loss: 0.6497, test_loss: 1.2379, test_f1: 0.5316
 epoch: 93, train_loss: 0.6360, test_loss: 1.2761, test_f1: 0.5239
 epoch: 94, train_loss: 0.6424, test_loss: 1.1582, test_f1: 0.5677
 epoch: 95, train_loss: 0.6422, test_loss: 1.2084, test_f1: 0.5704
 epoch: 96, train_loss: 0.6325, test_loss: 1.2406, test_f1: 0.5303
 epoch: 97, train_loss: 0.6215, test_loss: 1.2429, test_f1: 0.5456
 epoch: 98, train_loss: 0.6406, test_loss: 1.2695, test_f1: 0.5217
 epoch: 99, train_loss: 0.6363, test_loss: 1.2711, test_f1: 0.5204
##################ITERATION #7 ****************************************
 epoch: 0, train_loss: 1.3032, test_loss: 1.4022, test_f1: 0.2973
 epoch: 1, train_loss: 1.1340, test_loss: 1.2805, test_f1: 0.3366
 epoch: 2, train_loss: 1.0961, test_loss: 1.1027, test_f1: 0.4755
 epoch: 3, train_loss: 1.0678, test_loss: 1.1033, test_f1: 0.4673
 epoch: 4, train_loss: 1.0571, test_loss: 1.0811, test_f1: 0.4872
 epoch: 5, train_loss: 1.0175, test_loss: 1.0895, test_f1: 0.4953
 epoch: 6, train_loss: 1.0020, test_loss: 1.0993, test_f1: 0.4596
 epoch: 7, train_loss: 0.9887, test_loss: 1.0587, test_f1: 0.4965
 epoch: 8, train_loss: 0.9795, test_loss: 1.0401, test_f1: 0.5392
 epoch: 9, train_loss: 0.9554, test_loss: 1.0382, test_f1: 0.5175
 epoch: 10, train_loss: 0.9614, test_loss: 1.0501, test_f1: 0.5244
 epoch: 11, train_loss: 0.9415, test_loss: 1.0726, test_f1: 0.4851
 epoch: 12, train_loss: 0.9470, test_loss: 1.0095, test_f1: 0.5453
 epoch: 13, train_loss: 0.9056, test_loss: 1.0087, test_f1: 0.5410
 epoch: 14, train_loss: 0.8945, test_loss: 0.9945, test_f1: 0.5561
 epoch: 15, train_loss: 0.8889, test_loss: 1.0538, test_f1: 0.5148
 epoch: 16, train_loss: 0.8822, test_loss: 0.9994, test_f1: 0.5531
 epoch: 17, train_loss: 0.8875, test_loss: 1.0187, test_f1: 0.5512
 epoch: 18, train_loss: 0.8761, test_loss: 0.9877, test_f1: 0.5547
 epoch: 19, train_loss: 0.8704, test_loss: 1.0330, test_f1: 0.5393
 epoch: 20, train_loss: 0.8567, test_loss: 1.2181, test_f1: 0.5131
 epoch: 21, train_loss: 0.8543, test_loss: 1.0566, test_f1: 0.5376
 epoch: 22, train_loss: 0.8299, test_loss: 1.0784, test_f1: 0.5148
 epoch: 23, train_loss: 0.8424, test_loss: 1.0864, test_f1: 0.5482
 epoch: 24, train_loss: 0.8336, test_loss: 1.1695, test_f1: 0.4780
 epoch: 25, train_loss: 0.8098, test_loss: 1.0450, test_f1: 0.5558
 epoch: 26, train_loss: 0.8015, test_loss: 1.1344, test_f1: 0.5742
 epoch: 27, train_loss: 0.8188, test_loss: 1.1032, test_f1: 0.5642
 epoch: 28, train_loss: 0.8043, test_loss: 1.0848, test_f1: 0.5679
 epoch: 29, train_loss: 0.7918, test_loss: 1.0669, test_f1: 0.5606
 epoch: 30, train_loss: 0.7940, test_loss: 1.0820, test_f1: 0.5554
 epoch: 31, train_loss: 0.7874, test_loss: 1.2843, test_f1: 0.5374
 epoch: 32, train_loss: 0.7927, test_loss: 1.1148, test_f1: 0.5662
 epoch: 33, train_loss: 0.7900, test_loss: 1.1992, test_f1: 0.5450
 epoch: 34, train_loss: 0.7723, test_loss: 1.2143, test_f1: 0.5413
 epoch: 35, train_loss: 0.7898, test_loss: 1.1382, test_f1: 0.5625
 epoch: 36, train_loss: 0.7695, test_loss: 1.3458, test_f1: 0.5370
 epoch: 37, train_loss: 0.7620, test_loss: 1.2153, test_f1: 0.5414
 epoch: 38, train_loss: 0.7575, test_loss: 1.2187, test_f1: 0.5676
 epoch: 39, train_loss: 0.7599, test_loss: 1.1693, test_f1: 0.5706
 epoch: 40, train_loss: 0.7605, test_loss: 1.3744, test_f1: 0.5460
 epoch: 41, train_loss: 0.7492, test_loss: 1.2143, test_f1: 0.5498
 epoch: 42, train_loss: 0.7393, test_loss: 1.2208, test_f1: 0.5485
 epoch: 43, train_loss: 0.7530, test_loss: 1.2710, test_f1: 0.5598
 epoch: 44, train_loss: 0.7471, test_loss: 1.3127, test_f1: 0.5436
 epoch: 45, train_loss: 0.7617, test_loss: 1.2078, test_f1: 0.5444
 epoch: 46, train_loss: 0.7590, test_loss: 1.3692, test_f1: 0.5293
 epoch: 47, train_loss: 0.7337, test_loss: 1.3064, test_f1: 0.5471
 epoch: 48, train_loss: 0.7291, test_loss: 1.2286, test_f1: 0.5687
 epoch: 49, train_loss: 0.7179, test_loss: 1.2923, test_f1: 0.5588
 epoch: 50, train_loss: 0.7313, test_loss: 1.2746, test_f1: 0.5274
 epoch: 51, train_loss: 0.7226, test_loss: 1.3074, test_f1: 0.5810
 epoch: 52, train_loss: 0.7151, test_loss: 1.2791, test_f1: 0.5644
 epoch: 53, train_loss: 0.7306, test_loss: 1.2424, test_f1: 0.5657
 epoch: 54, train_loss: 0.7031, test_loss: 1.3272, test_f1: 0.5597
 epoch: 55, train_loss: 0.7129, test_loss: 1.2935, test_f1: 0.5556
 epoch: 56, train_loss: 0.7080, test_loss: 1.2506, test_f1: 0.5687
 epoch: 57, train_loss: 0.7116, test_loss: 1.2473, test_f1: 0.5588
 epoch: 58, train_loss: 0.7019, test_loss: 1.2864, test_f1: 0.5696
 epoch: 59, train_loss: 0.7016, test_loss: 1.3247, test_f1: 0.5614
 epoch: 60, train_loss: 0.6890, test_loss: 1.2783, test_f1: 0.5436
 epoch: 61, train_loss: 0.7210, test_loss: 1.2934, test_f1: 0.5678
 epoch: 62, train_loss: 0.6958, test_loss: 1.3278, test_f1: 0.5381
 epoch: 63, train_loss: 0.7054, test_loss: 1.2776, test_f1: 0.5391
 epoch: 64, train_loss: 0.6988, test_loss: 1.3120, test_f1: 0.5670
 epoch: 65, train_loss: 0.7080, test_loss: 1.2945, test_f1: 0.5320
 epoch: 66, train_loss: 0.6951, test_loss: 1.3586, test_f1: 0.5436
 epoch: 67, train_loss: 0.6879, test_loss: 1.2843, test_f1: 0.5506
 epoch: 68, train_loss: 0.6850, test_loss: 1.3322, test_f1: 0.5450
 epoch: 69, train_loss: 0.6928, test_loss: 1.3268, test_f1: 0.5592
 epoch: 70, train_loss: 0.6891, test_loss: 1.3059, test_f1: 0.5503
 epoch: 71, train_loss: 0.6945, test_loss: 1.4313, test_f1: 0.5322
 epoch: 72, train_loss: 0.6801, test_loss: 1.4169, test_f1: 0.5692
 epoch: 73, train_loss: 0.6872, test_loss: 1.3686, test_f1: 0.5695
 epoch: 74, train_loss: 0.7000, test_loss: 1.3795, test_f1: 0.5696
 epoch: 75, train_loss: 0.7030, test_loss: 1.3422, test_f1: 0.5402
 epoch: 76, train_loss: 0.6987, test_loss: 1.3073, test_f1: 0.5638
 epoch: 77, train_loss: 0.6953, test_loss: 1.2432, test_f1: 0.5633
 epoch: 78, train_loss: 0.6988, test_loss: 1.3572, test_f1: 0.5655
 epoch: 79, train_loss: 0.6967, test_loss: 1.2829, test_f1: 0.5443
 epoch: 80, train_loss: 0.6906, test_loss: 1.3519, test_f1: 0.5383
 epoch: 81, train_loss: 0.6872, test_loss: 1.4040, test_f1: 0.5356
 epoch: 82, train_loss: 0.6787, test_loss: 1.3684, test_f1: 0.5630
 epoch: 83, train_loss: 0.7006, test_loss: 1.3061, test_f1: 0.5351
 epoch: 84, train_loss: 0.6801, test_loss: 1.3313, test_f1: 0.5545
 epoch: 85, train_loss: 0.6841, test_loss: 1.3392, test_f1: 0.5651
 epoch: 86, train_loss: 0.6668, test_loss: 1.2925, test_f1: 0.5534
 epoch: 87, train_loss: 0.6697, test_loss: 1.3123, test_f1: 0.5705
 epoch: 88, train_loss: 0.6907, test_loss: 1.4563, test_f1: 0.5631
 epoch: 89, train_loss: 0.6693, test_loss: 1.3954, test_f1: 0.5604
 epoch: 90, train_loss: 0.6576, test_loss: 1.3344, test_f1: 0.5664
 epoch: 91, train_loss: 0.6869, test_loss: 1.3946, test_f1: 0.5577
 epoch: 92, train_loss: 0.6698, test_loss: 1.3900, test_f1: 0.5652
 epoch: 93, train_loss: 0.6672, test_loss: 1.4489, test_f1: 0.5415
 epoch: 94, train_loss: 0.6919, test_loss: 1.3934, test_f1: 0.5733
 epoch: 95, train_loss: 0.6727, test_loss: 1.4286, test_f1: 0.5778
 epoch: 96, train_loss: 0.6633, test_loss: 1.3063, test_f1: 0.5450
 epoch: 97, train_loss: 0.6763, test_loss: 1.3702, test_f1: 0.5632
 epoch: 98, train_loss: 0.6626, test_loss: 1.4870, test_f1: 0.5273
 epoch: 99, train_loss: 0.6682, test_loss: 1.4043, test_f1: 0.5563
##################ITERATION #8 ****************************************
 epoch: 0, train_loss: 1.3403, test_loss: 1.4881, test_f1: 0.2404
 epoch: 1, train_loss: 1.1510, test_loss: 1.3042, test_f1: 0.2710
 epoch: 2, train_loss: 1.1056, test_loss: 1.1520, test_f1: 0.4401
 epoch: 3, train_loss: 1.0697, test_loss: 1.0807, test_f1: 0.4907
 epoch: 4, train_loss: 1.0635, test_loss: 1.0900, test_f1: 0.5220
 epoch: 5, train_loss: 1.0303, test_loss: 1.0798, test_f1: 0.5363
 epoch: 6, train_loss: 1.0049, test_loss: 1.0402, test_f1: 0.5210
 epoch: 7, train_loss: 0.9865, test_loss: 1.0434, test_f1: 0.5180
 epoch: 8, train_loss: 0.9720, test_loss: 1.0498, test_f1: 0.5324
 epoch: 9, train_loss: 0.9684, test_loss: 1.0061, test_f1: 0.5648
 epoch: 10, train_loss: 0.9548, test_loss: 1.0436, test_f1: 0.4960
 epoch: 11, train_loss: 0.9344, test_loss: 1.0058, test_f1: 0.5192
 epoch: 12, train_loss: 0.9120, test_loss: 1.0020, test_f1: 0.5511
 epoch: 13, train_loss: 0.9160, test_loss: 0.9998, test_f1: 0.5412
 epoch: 14, train_loss: 0.9033, test_loss: 1.0000, test_f1: 0.5495
 epoch: 15, train_loss: 0.8990, test_loss: 0.9961, test_f1: 0.5352
 epoch: 16, train_loss: 0.8962, test_loss: 1.0006, test_f1: 0.5262
 epoch: 17, train_loss: 0.8676, test_loss: 0.9906, test_f1: 0.5284
 epoch: 18, train_loss: 0.8688, test_loss: 0.9840, test_f1: 0.5238
 epoch: 19, train_loss: 0.8633, test_loss: 1.0198, test_f1: 0.5132
 epoch: 20, train_loss: 0.8641, test_loss: 0.9760, test_f1: 0.5572
 epoch: 21, train_loss: 0.8485, test_loss: 0.9930, test_f1: 0.5269
 epoch: 22, train_loss: 0.8600, test_loss: 0.9455, test_f1: 0.5682
 epoch: 23, train_loss: 0.8412, test_loss: 0.9749, test_f1: 0.5632
 epoch: 24, train_loss: 0.8397, test_loss: 1.0253, test_f1: 0.5506
 epoch: 25, train_loss: 0.8250, test_loss: 0.9884, test_f1: 0.5307
 epoch: 26, train_loss: 0.8472, test_loss: 0.9408, test_f1: 0.5899
 epoch: 27, train_loss: 0.8131, test_loss: 0.9461, test_f1: 0.5541
 epoch: 28, train_loss: 0.8253, test_loss: 0.9528, test_f1: 0.5518
 epoch: 29, train_loss: 0.8039, test_loss: 0.9928, test_f1: 0.5451
 epoch: 30, train_loss: 0.8087, test_loss: 0.9810, test_f1: 0.5725
 epoch: 31, train_loss: 0.8066, test_loss: 0.9373, test_f1: 0.5788
 epoch: 32, train_loss: 0.7870, test_loss: 0.9874, test_f1: 0.5634
 epoch: 33, train_loss: 0.7875, test_loss: 0.9494, test_f1: 0.5888
 epoch: 34, train_loss: 0.7750, test_loss: 0.9821, test_f1: 0.5929
 epoch: 35, train_loss: 0.7658, test_loss: 0.9490, test_f1: 0.6125
 epoch: 36, train_loss: 0.7890, test_loss: 1.0915, test_f1: 0.5062
 epoch: 37, train_loss: 0.7818, test_loss: 1.0966, test_f1: 0.5863
 epoch: 38, train_loss: 0.7848, test_loss: 1.0301, test_f1: 0.6048
 epoch: 39, train_loss: 0.7681, test_loss: 1.0024, test_f1: 0.5841
 epoch: 40, train_loss: 0.7599, test_loss: 0.9384, test_f1: 0.5969
 epoch: 41, train_loss: 0.7471, test_loss: 0.9918, test_f1: 0.5926
 epoch: 42, train_loss: 0.7509, test_loss: 0.9558, test_f1: 0.5787
 epoch: 43, train_loss: 0.7522, test_loss: 0.9756, test_f1: 0.6353
 epoch: 44, train_loss: 0.7521, test_loss: 1.0588, test_f1: 0.5700
 epoch: 45, train_loss: 0.7472, test_loss: 0.9792, test_f1: 0.6153
 epoch: 46, train_loss: 0.7675, test_loss: 0.9969, test_f1: 0.5955
 epoch: 47, train_loss: 0.7481, test_loss: 0.9909, test_f1: 0.6127
 epoch: 48, train_loss: 0.7426, test_loss: 1.0227, test_f1: 0.5734
 epoch: 49, train_loss: 0.7212, test_loss: 1.0403, test_f1: 0.6147
 epoch: 50, train_loss: 0.7444, test_loss: 0.9807, test_f1: 0.5982
 epoch: 51, train_loss: 0.7239, test_loss: 1.0079, test_f1: 0.6410
 epoch: 52, train_loss: 0.7156, test_loss: 1.0654, test_f1: 0.6144
 epoch: 53, train_loss: 0.7279, test_loss: 1.0032, test_f1: 0.6043
 epoch: 54, train_loss: 0.7192, test_loss: 1.0478, test_f1: 0.6405
 epoch: 55, train_loss: 0.6950, test_loss: 1.0314, test_f1: 0.6052
 epoch: 56, train_loss: 0.7053, test_loss: 1.1088, test_f1: 0.5846
 epoch: 57, train_loss: 0.7119, test_loss: 1.0164, test_f1: 0.6066
 epoch: 58, train_loss: 0.7019, test_loss: 1.0384, test_f1: 0.6171
 epoch: 59, train_loss: 0.7159, test_loss: 1.0808, test_f1: 0.6003
 epoch: 60, train_loss: 0.7020, test_loss: 1.0450, test_f1: 0.6426
 epoch: 61, train_loss: 0.7114, test_loss: 1.0345, test_f1: 0.6007
 epoch: 62, train_loss: 0.7045, test_loss: 1.0297, test_f1: 0.6352
 epoch: 63, train_loss: 0.6918, test_loss: 1.1097, test_f1: 0.6117
 epoch: 64, train_loss: 0.7010, test_loss: 1.0789, test_f1: 0.6310
 epoch: 65, train_loss: 0.7091, test_loss: 1.1112, test_f1: 0.6063
 epoch: 66, train_loss: 0.7003, test_loss: 1.1024, test_f1: 0.6199
 epoch: 67, train_loss: 0.6881, test_loss: 1.1536, test_f1: 0.5891
 epoch: 68, train_loss: 0.6827, test_loss: 1.1767, test_f1: 0.5848
 epoch: 69, train_loss: 0.6881, test_loss: 1.1127, test_f1: 0.5929
 epoch: 70, train_loss: 0.6805, test_loss: 1.0685, test_f1: 0.5852
 epoch: 71, train_loss: 0.6801, test_loss: 1.1433, test_f1: 0.5971
 epoch: 72, train_loss: 0.7036, test_loss: 1.0594, test_f1: 0.6071
 epoch: 73, train_loss: 0.6987, test_loss: 1.0859, test_f1: 0.6183
 epoch: 74, train_loss: 0.6742, test_loss: 1.0616, test_f1: 0.6006
 epoch: 75, train_loss: 0.6948, test_loss: 1.2242, test_f1: 0.6004
 epoch: 76, train_loss: 0.6984, test_loss: 1.2007, test_f1: 0.5784
 epoch: 77, train_loss: 0.6835, test_loss: 1.1332, test_f1: 0.6277
 epoch: 78, train_loss: 0.6802, test_loss: 1.2045, test_f1: 0.6037
 epoch: 79, train_loss: 0.6902, test_loss: 1.1059, test_f1: 0.6062
 epoch: 80, train_loss: 0.6794, test_loss: 1.1926, test_f1: 0.6371
 epoch: 81, train_loss: 0.6786, test_loss: 1.1273, test_f1: 0.6101
 epoch: 82, train_loss: 0.6839, test_loss: 1.1657, test_f1: 0.5907
 epoch: 83, train_loss: 0.6686, test_loss: 1.2099, test_f1: 0.5790
 epoch: 84, train_loss: 0.6708, test_loss: 1.1002, test_f1: 0.6336
 epoch: 85, train_loss: 0.6807, test_loss: 1.2713, test_f1: 0.6205
 epoch: 86, train_loss: 0.6842, test_loss: 1.1625, test_f1: 0.5906
 epoch: 87, train_loss: 0.6763, test_loss: 1.1211, test_f1: 0.6515
 epoch: 88, train_loss: 0.6747, test_loss: 1.1770, test_f1: 0.5949
 epoch: 89, train_loss: 0.6690, test_loss: 1.4377, test_f1: 0.5974
 epoch: 90, train_loss: 0.6659, test_loss: 1.1416, test_f1: 0.6132
 epoch: 91, train_loss: 0.6649, test_loss: 1.1606, test_f1: 0.6042
 epoch: 92, train_loss: 0.6737, test_loss: 1.1814, test_f1: 0.6118
 epoch: 93, train_loss: 0.6687, test_loss: 1.1526, test_f1: 0.6337
 epoch: 94, train_loss: 0.6597, test_loss: 1.1809, test_f1: 0.6279
 epoch: 95, train_loss: 0.6596, test_loss: 1.2053, test_f1: 0.6157
 epoch: 96, train_loss: 0.6729, test_loss: 1.1810, test_f1: 0.5841
 epoch: 97, train_loss: 0.6777, test_loss: 1.1559, test_f1: 0.6363
 epoch: 98, train_loss: 0.6637, test_loss: 1.2000, test_f1: 0.6479
 epoch: 99, train_loss: 0.6703, test_loss: 1.2210, test_f1: 0.6294
##################ITERATION #9 ****************************************
 epoch: 0, train_loss: 1.3370, test_loss: 1.4716, test_f1: 0.2545
 epoch: 1, train_loss: 1.1395, test_loss: 1.3661, test_f1: 0.3261
 epoch: 2, train_loss: 1.0989, test_loss: 1.2700, test_f1: 0.3750
 epoch: 3, train_loss: 1.0746, test_loss: 1.2497, test_f1: 0.4317
 epoch: 4, train_loss: 1.0584, test_loss: 1.2384, test_f1: 0.4328
 epoch: 5, train_loss: 1.0278, test_loss: 1.1801, test_f1: 0.4484
 epoch: 6, train_loss: 1.0305, test_loss: 1.2447, test_f1: 0.4162
 epoch: 7, train_loss: 1.0149, test_loss: 1.1764, test_f1: 0.4354
 epoch: 8, train_loss: 1.0120, test_loss: 1.1937, test_f1: 0.4454
 epoch: 9, train_loss: 0.9870, test_loss: 1.1476, test_f1: 0.4750
 epoch: 10, train_loss: 0.9843, test_loss: 1.2321, test_f1: 0.4447
 epoch: 11, train_loss: 0.9694, test_loss: 1.2167, test_f1: 0.4649
 epoch: 12, train_loss: 0.9491, test_loss: 1.1387, test_f1: 0.5226
 epoch: 13, train_loss: 0.9523, test_loss: 1.0641, test_f1: 0.5309
 epoch: 14, train_loss: 0.9147, test_loss: 1.0162, test_f1: 0.5397
 epoch: 15, train_loss: 0.9059, test_loss: 1.0383, test_f1: 0.5288
 epoch: 16, train_loss: 0.9112, test_loss: 1.0163, test_f1: 0.5489
 epoch: 17, train_loss: 0.8791, test_loss: 1.0417, test_f1: 0.5386
 epoch: 18, train_loss: 0.8697, test_loss: 1.0167, test_f1: 0.5547
 epoch: 19, train_loss: 0.8547, test_loss: 0.9707, test_f1: 0.5499
 epoch: 20, train_loss: 0.8627, test_loss: 1.0301, test_f1: 0.5546
 epoch: 21, train_loss: 0.8473, test_loss: 0.9997, test_f1: 0.5622
 epoch: 22, train_loss: 0.8370, test_loss: 0.9969, test_f1: 0.5633
 epoch: 23, train_loss: 0.8317, test_loss: 0.9730, test_f1: 0.5499
 epoch: 24, train_loss: 0.8139, test_loss: 0.9960, test_f1: 0.5668
 epoch: 25, train_loss: 0.8068, test_loss: 1.1560, test_f1: 0.5267
 epoch: 26, train_loss: 0.8002, test_loss: 0.9783, test_f1: 0.5638
 epoch: 27, train_loss: 0.7961, test_loss: 1.0768, test_f1: 0.5305
 epoch: 28, train_loss: 0.7897, test_loss: 1.0786, test_f1: 0.5514
 epoch: 29, train_loss: 0.7741, test_loss: 0.9815, test_f1: 0.5647
 epoch: 30, train_loss: 0.7749, test_loss: 1.1775, test_f1: 0.5542
 epoch: 31, train_loss: 0.7852, test_loss: 1.1949, test_f1: 0.5215
 epoch: 32, train_loss: 0.7784, test_loss: 1.2296, test_f1: 0.5367
 epoch: 33, train_loss: 0.7697, test_loss: 1.0624, test_f1: 0.5635
 epoch: 34, train_loss: 0.7749, test_loss: 1.4562, test_f1: 0.5614
 epoch: 35, train_loss: 0.7615, test_loss: 0.9992, test_f1: 0.5740
 epoch: 36, train_loss: 0.7467, test_loss: 1.0896, test_f1: 0.5544
 epoch: 37, train_loss: 0.7464, test_loss: 1.1366, test_f1: 0.5746
 epoch: 38, train_loss: 0.7434, test_loss: 1.1613, test_f1: 0.5555
 epoch: 39, train_loss: 0.7322, test_loss: 1.0669, test_f1: 0.5801
 epoch: 40, train_loss: 0.7333, test_loss: 1.2483, test_f1: 0.5720
 epoch: 41, train_loss: 0.7319, test_loss: 1.2006, test_f1: 0.5680
 epoch: 42, train_loss: 0.7181, test_loss: 1.2904, test_f1: 0.5501
 epoch: 43, train_loss: 0.7318, test_loss: 1.2111, test_f1: 0.5471
 epoch: 44, train_loss: 0.7448, test_loss: 1.1033, test_f1: 0.5719
 epoch: 45, train_loss: 0.7159, test_loss: 1.5234, test_f1: 0.5905
 epoch: 46, train_loss: 0.7102, test_loss: 1.0889, test_f1: 0.5763
 epoch: 47, train_loss: 0.7405, test_loss: 1.5981, test_f1: 0.5513
 epoch: 48, train_loss: 0.7306, test_loss: 1.5038, test_f1: 0.5340
 epoch: 49, train_loss: 0.7206, test_loss: 1.0109, test_f1: 0.6014
 epoch: 50, train_loss: 0.7144, test_loss: 2.0902, test_f1: 0.5603
 epoch: 51, train_loss: 0.7188, test_loss: 1.2407, test_f1: 0.5405
 epoch: 52, train_loss: 0.6929, test_loss: 1.0944, test_f1: 0.5968
 epoch: 53, train_loss: 0.6929, test_loss: 1.0138, test_f1: 0.6095
 epoch: 54, train_loss: 0.6954, test_loss: 1.0226, test_f1: 0.6197
 epoch: 55, train_loss: 0.6826, test_loss: 1.1088, test_f1: 0.6181
 epoch: 56, train_loss: 0.6923, test_loss: 1.0057, test_f1: 0.6417
 epoch: 57, train_loss: 0.6963, test_loss: 1.0579, test_f1: 0.6208
 epoch: 58, train_loss: 0.6863, test_loss: 1.0208, test_f1: 0.5952
 epoch: 59, train_loss: 0.6884, test_loss: 1.3192, test_f1: 0.5865
 epoch: 60, train_loss: 0.6922, test_loss: 1.2147, test_f1: 0.5474
 epoch: 61, train_loss: 0.6845, test_loss: 1.4127, test_f1: 0.5576
 epoch: 62, train_loss: 0.6836, test_loss: 1.4127, test_f1: 0.5726
 epoch: 63, train_loss: 0.6801, test_loss: 1.6445, test_f1: 0.5688
 epoch: 64, train_loss: 0.6754, test_loss: 1.2104, test_f1: 0.5508
 epoch: 65, train_loss: 0.6775, test_loss: 1.0872, test_f1: 0.5694
 epoch: 66, train_loss: 0.6713, test_loss: 1.0113, test_f1: 0.6082
 epoch: 67, train_loss: 0.6670, test_loss: 1.0826, test_f1: 0.6129
 epoch: 68, train_loss: 0.6855, test_loss: 1.2121, test_f1: 0.6147
 epoch: 69, train_loss: 0.6798, test_loss: 1.4103, test_f1: 0.5764
 epoch: 70, train_loss: 0.6708, test_loss: 1.1519, test_f1: 0.6110
 epoch: 71, train_loss: 0.6732, test_loss: 1.3701, test_f1: 0.5900
 epoch: 72, train_loss: 0.6869, test_loss: 1.3873, test_f1: 0.5797
 epoch: 73, train_loss: 0.6891, test_loss: 1.2671, test_f1: 0.5648
 epoch: 74, train_loss: 0.6654, test_loss: 1.0465, test_f1: 0.6219
 epoch: 75, train_loss: 0.6626, test_loss: 1.1165, test_f1: 0.6135
 epoch: 76, train_loss: 0.6683, test_loss: 1.1263, test_f1: 0.6044
 epoch: 77, train_loss: 0.6609, test_loss: 1.1494, test_f1: 0.5938
 epoch: 78, train_loss: 0.6509, test_loss: 1.1187, test_f1: 0.6052
 epoch: 79, train_loss: 0.6589, test_loss: 1.2064, test_f1: 0.5978
 epoch: 80, train_loss: 0.6466, test_loss: 1.4410, test_f1: 0.5939
 epoch: 81, train_loss: 0.6645, test_loss: 1.2168, test_f1: 0.5512
 epoch: 82, train_loss: 0.6776, test_loss: 1.3542, test_f1: 0.6069
 epoch: 83, train_loss: 0.6613, test_loss: 1.1175, test_f1: 0.5902
 epoch: 84, train_loss: 0.6590, test_loss: 1.1138, test_f1: 0.6024
 epoch: 85, train_loss: 0.6679, test_loss: 1.1662, test_f1: 0.6227
 epoch: 86, train_loss: 0.6604, test_loss: 1.0611, test_f1: 0.6410
 epoch: 87, train_loss: 0.6573, test_loss: 1.0533, test_f1: 0.6279
 epoch: 88, train_loss: 0.6518, test_loss: 1.1047, test_f1: 0.5993
 epoch: 89, train_loss: 0.6508, test_loss: 1.1395, test_f1: 0.6066
 epoch: 90, train_loss: 0.6434, test_loss: 1.1192, test_f1: 0.6203
 epoch: 91, train_loss: 0.6501, test_loss: 1.5700, test_f1: 0.6150
 epoch: 92, train_loss: 0.6543, test_loss: 1.1135, test_f1: 0.6066
 epoch: 93, train_loss: 0.6515, test_loss: 1.1431, test_f1: 0.6171
 epoch: 94, train_loss: 0.6509, test_loss: 1.0924, test_f1: 0.6166
 epoch: 95, train_loss: 0.6448, test_loss: 1.2588, test_f1: 0.5974
 epoch: 96, train_loss: 0.6377, test_loss: 1.7091, test_f1: 0.6169
 epoch: 97, train_loss: 0.6534, test_loss: 1.0823, test_f1: 0.6220
 epoch: 98, train_loss: 0.6435, test_loss: 1.4864, test_f1: 0.5937
 epoch: 99, train_loss: 0.6338, test_loss: 1.3371, test_f1: 0.6166

Training completed in 610.60 seconds
Best F1: 0.6515 at epoch 87
Mean F1 across iterations: 0.6131  0.0259
========================FINAL RESULTS================================
FEGIN weighted F1: 0.6515  0.0259
python main.py --data ltspice_demos --representation component_pin --model FEGIN --layers 3 --hiddens 16 --batch_size 64 --lr 0.001 --emb_size 250 --epochs 100 --save_appendix component_pin_L3_H16_BS64_LR0.001_E250 --no_val
-----



STDERR:
  File "main.py", line 370, in <module>
    main()
  File "main.py", line 254, in main
    dataset = dataset_class(
  File "/home/philip/projects/ltspice_examples_code_repo/Circuit-Completion-Using-GNNs/component_classification_with_link_prediction_head/evaluation/FEGIN/kernel/circuit_datasets.py", line 15, in __init__
    self.data, self.slices = torch.load(self.processed_paths[0])
  File "/home/philip/.local/lib/python3.8/site-packages/torch/serialization.py", line 1040, in load
    warnings.warn(
  File "/usr/lib/python3.8/warnings.py", line 109, in _showwarnmsg
    sw(msg.message, msg.category, msg.filename, msg.lineno,
  File "main.py", line 47, in warn_with_traceback
    traceback.print_stack(file=log)
/home/philip/projects/ltspice_examples_code_repo/Circuit-Completion-Using-GNNs/component_classification_with_link_prediction_head/evaluation/FEGIN/kernel/circuit_datasets.py:15: FutureWarning: You are using `torch.load` with `weights_only=False` (the current default value), which uses the default pickle module implicitly. It is possible to construct malicious pickle data which will execute arbitrary code during unpickling (See https://github.com/pytorch/pytorch/blob/main/SECURITY.md#untrusted-models for more details). In a future release, the default value for `weights_only` will be flipped to `True`. This limits the functions that could be executed during unpickling. Arbitrary objects will no longer be allowed to be loaded via this mode unless they are explicitly allowlisted by the user via `torch.serialization.add_safe_globals`. We recommend you start setting `weights_only=True` for any use case where you don't have full control of the loaded file. Please open an issue on GitHub for any issues related to this experimental feature.
  self.data, self.slices = torch.load(self.processed_paths[0])
