STDOUT:
Results will be saved in /home/philip/projects/ltspice_examples_code_repo/Circuit-Completion-Using-GNNs/component_classification_with_link_prediction_head/evaluation/FEGIN/results/model_FEGIN_dataset_ltspice_examples
Command line input: python main.py --data ltspice_examples --representation component_pin_net --model FEGIN --layers 3 --hiddens 32 --batch_size 256 --lr 0.1 --emb_size 128 --epochs 100 --save_appendix component_pin_net_L3_H32_BS256_LR0.1_E128 --no_val
 is saved.
-----
ltspice_examples - FEGIN
Using 3 layers, 32 hidden units, h = 2
Loading component_pin_net representation dataset
ENTERED
Training FEGIN on component_pin_net representation
Train: 3558, Test: 846
##################ITERATION #0 ****************************************
 epoch: 0, train_loss: 1.4176, test_loss: 1.3142, test_f1: 0.2270
 epoch: 1, train_loss: 1.3006, test_loss: 1.2897, test_f1: 0.2270
 epoch: 2, train_loss: 1.2695, test_loss: 1.2282, test_f1: 0.2270
 epoch: 3, train_loss: 1.2517, test_loss: 1.1974, test_f1: 0.2270
 epoch: 4, train_loss: 1.2321, test_loss: 1.1693, test_f1: 0.2270
 epoch: 5, train_loss: 1.2139, test_loss: 1.1443, test_f1: 0.3553
 epoch: 6, train_loss: 1.2202, test_loss: 1.4534, test_f1: 0.0607
 epoch: 7, train_loss: 1.1846, test_loss: 1.1475, test_f1: 0.3252
 epoch: 8, train_loss: 1.1622, test_loss: 1.1172, test_f1: 0.3355
 epoch: 9, train_loss: 1.1636, test_loss: 1.1599, test_f1: 0.3094
 epoch: 10, train_loss: 1.1510, test_loss: 1.0801, test_f1: 0.3570
 epoch: 11, train_loss: 1.1420, test_loss: 1.0896, test_f1: 0.3549
 epoch: 12, train_loss: 1.1297, test_loss: 1.0804, test_f1: 0.3421
 epoch: 13, train_loss: 1.1405, test_loss: 1.1014, test_f1: 0.3432
 epoch: 14, train_loss: 1.1371, test_loss: 1.0927, test_f1: 0.3439
 epoch: 15, train_loss: 1.1476, test_loss: 1.1097, test_f1: 0.3479
 epoch: 16, train_loss: 1.1185, test_loss: 1.0812, test_f1: 0.3475
 epoch: 17, train_loss: 1.1206, test_loss: 1.1464, test_f1: 0.3312
 epoch: 18, train_loss: 1.1282, test_loss: 1.0953, test_f1: 0.3422
 epoch: 19, train_loss: 1.1022, test_loss: 1.2953, test_f1: 0.3093
 epoch: 20, train_loss: 1.0855, test_loss: 1.5814, test_f1: 0.3257
 epoch: 21, train_loss: 1.0994, test_loss: 1.1019, test_f1: 0.3457
 epoch: 22, train_loss: 1.1082, test_loss: 1.1677, test_f1: 0.3460
 epoch: 23, train_loss: 1.1184, test_loss: 1.0695, test_f1: 0.3533
 epoch: 24, train_loss: 1.0903, test_loss: 1.0805, test_f1: 0.3553
 epoch: 25, train_loss: 1.0878, test_loss: 1.1143, test_f1: 0.3502
 epoch: 26, train_loss: 1.0865, test_loss: 2.9219, test_f1: 0.0304
 epoch: 27, train_loss: 1.1179, test_loss: 1.1009, test_f1: 0.3865
 epoch: 28, train_loss: 1.1401, test_loss: 1.1295, test_f1: 0.3456
 epoch: 29, train_loss: 1.0820, test_loss: 1.1364, test_f1: 0.3458
 epoch: 30, train_loss: 1.0803, test_loss: 1.1426, test_f1: 0.3413
 epoch: 31, train_loss: 1.0691, test_loss: 1.1259, test_f1: 0.3422
 epoch: 32, train_loss: 1.0752, test_loss: 1.1153, test_f1: 0.3460
 epoch: 33, train_loss: 1.0686, test_loss: 1.0959, test_f1: 0.3435
 epoch: 34, train_loss: 1.0532, test_loss: 1.0836, test_f1: 0.3476
 epoch: 35, train_loss: 1.0833, test_loss: 1.1608, test_f1: 0.3403
 epoch: 36, train_loss: 1.0785, test_loss: 1.1114, test_f1: 0.3474
 epoch: 37, train_loss: 1.1190, test_loss: 1.1215, test_f1: 0.3413
 epoch: 38, train_loss: 1.0958, test_loss: 1.1105, test_f1: 0.3413
 epoch: 39, train_loss: 1.0810, test_loss: 1.0914, test_f1: 0.3640
 epoch: 40, train_loss: 1.0689, test_loss: 1.1011, test_f1: 0.3422
 epoch: 41, train_loss: 1.0485, test_loss: 1.0907, test_f1: 0.3422
 epoch: 42, train_loss: 1.0659, test_loss: 1.0958, test_f1: 0.3422
 epoch: 43, train_loss: 1.0659, test_loss: 1.0478, test_f1: 0.4139
 epoch: 44, train_loss: 1.0774, test_loss: 1.0820, test_f1: 0.3413
 epoch: 45, train_loss: 1.0737, test_loss: 1.1353, test_f1: 0.3460
 epoch: 46, train_loss: 1.0693, test_loss: 1.1072, test_f1: 0.3403
 epoch: 47, train_loss: 1.0823, test_loss: 1.0932, test_f1: 0.3413
 epoch: 48, train_loss: 1.0649, test_loss: 1.1133, test_f1: 0.3413
 epoch: 49, train_loss: 1.0863, test_loss: 1.1333, test_f1: 0.3403
 epoch: 50, train_loss: 1.0801, test_loss: 1.1308, test_f1: 0.3332
 epoch: 51, train_loss: 1.0656, test_loss: 1.1297, test_f1: 0.3413
 epoch: 52, train_loss: 1.0714, test_loss: 1.0967, test_f1: 0.3413
 epoch: 53, train_loss: 1.0576, test_loss: 1.1134, test_f1: 0.3413
 epoch: 54, train_loss: 1.0562, test_loss: 1.0886, test_f1: 0.3422
 epoch: 55, train_loss: 1.0520, test_loss: 1.1179, test_f1: 0.3399
 epoch: 56, train_loss: 1.0685, test_loss: 1.2874, test_f1: 0.3790
 epoch: 57, train_loss: 1.0540, test_loss: 1.1042, test_f1: 0.3460
 epoch: 58, train_loss: 1.0447, test_loss: 1.1448, test_f1: 0.3422
 epoch: 59, train_loss: 1.0383, test_loss: 1.1108, test_f1: 0.3441
 epoch: 60, train_loss: 1.0426, test_loss: 1.1030, test_f1: 0.3465
 epoch: 61, train_loss: 1.0449, test_loss: 1.0924, test_f1: 0.3460
 epoch: 62, train_loss: 1.0415, test_loss: 1.1001, test_f1: 0.3460
 epoch: 63, train_loss: 1.0311, test_loss: 1.1014, test_f1: 0.3422
 epoch: 64, train_loss: 1.0444, test_loss: 1.1150, test_f1: 0.3460
 epoch: 65, train_loss: 1.0462, test_loss: 1.1289, test_f1: 0.3460
 epoch: 66, train_loss: 1.0411, test_loss: 1.1034, test_f1: 0.3460
 epoch: 67, train_loss: 1.0849, test_loss: 1.0902, test_f1: 0.3486
 epoch: 68, train_loss: 1.0545, test_loss: 1.1311, test_f1: 0.3439
 epoch: 69, train_loss: 1.0337, test_loss: 1.1704, test_f1: 0.3467
 epoch: 70, train_loss: 1.0344, test_loss: 1.1131, test_f1: 0.3492
 epoch: 71, train_loss: 1.0432, test_loss: 1.1274, test_f1: 0.3430
 epoch: 72, train_loss: 1.0346, test_loss: 1.0957, test_f1: 0.3432
 epoch: 73, train_loss: 1.0195, test_loss: 1.1217, test_f1: 0.3439
 epoch: 74, train_loss: 1.0275, test_loss: 1.0955, test_f1: 0.3432
 epoch: 75, train_loss: 1.0327, test_loss: 1.1097, test_f1: 0.3427
 epoch: 76, train_loss: 1.0370, test_loss: 1.1510, test_f1: 0.3422
 epoch: 77, train_loss: 1.0300, test_loss: 1.1446, test_f1: 0.3422
 epoch: 78, train_loss: 1.0359, test_loss: 1.1328, test_f1: 0.4322
 epoch: 79, train_loss: 1.0288, test_loss: 1.1191, test_f1: 0.3438
 epoch: 80, train_loss: 1.0320, test_loss: 1.1107, test_f1: 0.3462
 epoch: 81, train_loss: 1.0586, test_loss: 1.1652, test_f1: 0.3422
 epoch: 82, train_loss: 1.0518, test_loss: 1.0913, test_f1: 0.3413
 epoch: 83, train_loss: 1.0491, test_loss: 1.1029, test_f1: 0.3413
 epoch: 84, train_loss: 1.0535, test_loss: 1.1391, test_f1: 0.3413
 epoch: 85, train_loss: 1.0448, test_loss: 1.0953, test_f1: 0.3460
 epoch: 86, train_loss: 1.0493, test_loss: 1.1157, test_f1: 0.3413
 epoch: 87, train_loss: 1.0429, test_loss: 1.1072, test_f1: 0.3413
 epoch: 88, train_loss: 1.0428, test_loss: 1.1057, test_f1: 0.3422
 epoch: 89, train_loss: 1.0368, test_loss: 1.1095, test_f1: 0.3415
 epoch: 90, train_loss: 1.0361, test_loss: 1.1455, test_f1: 0.3415
 epoch: 91, train_loss: 1.0390, test_loss: 1.1189, test_f1: 0.3422
 epoch: 92, train_loss: 1.0292, test_loss: 3.3676, test_f1: 0.1498
 epoch: 93, train_loss: 1.0225, test_loss: 1.1240, test_f1: 0.3427
 epoch: 94, train_loss: 1.0207, test_loss: 1.1219, test_f1: 0.3411
 epoch: 95, train_loss: 1.0461, test_loss: 1.1793, test_f1: 0.3422
 epoch: 96, train_loss: 1.0326, test_loss: 1.3693, test_f1: 0.3460
 epoch: 97, train_loss: 1.0278, test_loss: 1.0891, test_f1: 0.3487
 epoch: 98, train_loss: 1.0424, test_loss: 1.0995, test_f1: 0.3443
 epoch: 99, train_loss: 1.0331, test_loss: 1.0851, test_f1: 0.3465
##################ITERATION #1 ****************************************
 epoch: 0, train_loss: 2.8117, test_loss: 2.3858, test_f1: 0.0304
 epoch: 1, train_loss: 1.4340, test_loss: 1.4703, test_f1: 0.2322
 epoch: 2, train_loss: 1.3175, test_loss: 1.2061, test_f1: 0.3088
 epoch: 3, train_loss: 1.2351, test_loss: 1.1130, test_f1: 0.3374
 epoch: 4, train_loss: 1.2048, test_loss: 1.1426, test_f1: 0.3238
 epoch: 5, train_loss: 1.2039, test_loss: 1.1252, test_f1: 0.3316
 epoch: 6, train_loss: 1.2067, test_loss: 1.1118, test_f1: 0.3396
 epoch: 7, train_loss: 1.1894, test_loss: 1.1049, test_f1: 0.3364
 epoch: 8, train_loss: 1.1947, test_loss: 1.0881, test_f1: 0.3450
 epoch: 9, train_loss: 1.1961, test_loss: 1.0870, test_f1: 0.3431
 epoch: 10, train_loss: 1.1860, test_loss: 1.0946, test_f1: 0.3374
 epoch: 11, train_loss: 1.1881, test_loss: 1.0877, test_f1: 0.3590
 epoch: 12, train_loss: 1.1823, test_loss: 1.0920, test_f1: 0.3540
 epoch: 13, train_loss: 1.1683, test_loss: 1.0951, test_f1: 0.3413
 epoch: 14, train_loss: 1.1879, test_loss: 1.0788, test_f1: 0.3413
 epoch: 15, train_loss: 1.1806, test_loss: 1.0830, test_f1: 0.3482
 epoch: 16, train_loss: 1.1787, test_loss: 1.0911, test_f1: 0.3422
 epoch: 17, train_loss: 1.1726, test_loss: 1.0841, test_f1: 0.3545
 epoch: 18, train_loss: 1.1878, test_loss: 1.0929, test_f1: 0.3405
 epoch: 19, train_loss: 1.1601, test_loss: 1.0963, test_f1: 0.3401
 epoch: 20, train_loss: 1.1042, test_loss: 2.2657, test_f1: 0.1216
 epoch: 21, train_loss: 1.1107, test_loss: 1.6414, test_f1: 0.2508
 epoch: 22, train_loss: 1.0932, test_loss: 1.1117, test_f1: 0.3422
 epoch: 23, train_loss: 1.0953, test_loss: 2.1925, test_f1: 0.1516
 epoch: 24, train_loss: 1.1016, test_loss: 1.1132, test_f1: 0.3393
 epoch: 25, train_loss: 1.1030, test_loss: 1.8829, test_f1: 0.2179
 epoch: 26, train_loss: 1.1029, test_loss: 1.1273, test_f1: 0.3413
 epoch: 27, train_loss: 1.0837, test_loss: 1.0702, test_f1: 0.3501
 epoch: 28, train_loss: 1.0846, test_loss: 1.0662, test_f1: 0.3547
 epoch: 29, train_loss: 1.0996, test_loss: 1.1217, test_f1: 0.3388
 epoch: 30, train_loss: 1.0811, test_loss: 1.1809, test_f1: 0.3287
 epoch: 31, train_loss: 1.0785, test_loss: 1.9398, test_f1: 0.2215
 epoch: 32, train_loss: 1.0792, test_loss: 1.1205, test_f1: 0.3412
 epoch: 33, train_loss: 1.0623, test_loss: 1.1068, test_f1: 0.3422
 epoch: 34, train_loss: 1.0823, test_loss: 1.0871, test_f1: 0.3533
 epoch: 35, train_loss: 1.0783, test_loss: 1.1346, test_f1: 0.3414
 epoch: 36, train_loss: 1.0793, test_loss: 1.1061, test_f1: 0.3460
 epoch: 37, train_loss: 1.0659, test_loss: 1.1072, test_f1: 0.3460
 epoch: 38, train_loss: 1.0748, test_loss: 1.1106, test_f1: 0.3460
 epoch: 39, train_loss: 1.0784, test_loss: 1.1219, test_f1: 0.3406
 epoch: 40, train_loss: 1.0739, test_loss: 1.1135, test_f1: 0.3422
 epoch: 41, train_loss: 1.0806, test_loss: 1.2075, test_f1: 0.3194
 epoch: 42, train_loss: 1.0674, test_loss: 1.1215, test_f1: 0.3422
 epoch: 43, train_loss: 1.0780, test_loss: 1.1314, test_f1: 0.3358
 epoch: 44, train_loss: 1.0792, test_loss: 1.1460, test_f1: 0.3469
 epoch: 45, train_loss: 1.0775, test_loss: 1.1404, test_f1: 0.3422
 epoch: 46, train_loss: 1.0765, test_loss: 1.1396, test_f1: 0.3469
 epoch: 47, train_loss: 1.0716, test_loss: 1.1253, test_f1: 0.3412
 epoch: 48, train_loss: 1.0683, test_loss: 1.1086, test_f1: 0.3419
 epoch: 49, train_loss: 1.0685, test_loss: 1.1491, test_f1: 0.3406
 epoch: 50, train_loss: 1.0572, test_loss: 1.1388, test_f1: 0.3401
 epoch: 51, train_loss: 1.0474, test_loss: 1.1227, test_f1: 0.3426
 epoch: 52, train_loss: 1.0411, test_loss: 1.0963, test_f1: 0.3476
 epoch: 53, train_loss: 1.0479, test_loss: 1.1066, test_f1: 0.3456
 epoch: 54, train_loss: 1.0390, test_loss: 1.1211, test_f1: 0.3433
 epoch: 55, train_loss: 1.0514, test_loss: 1.1290, test_f1: 0.3422
 epoch: 56, train_loss: 1.0448, test_loss: 1.1444, test_f1: 0.3428
 epoch: 57, train_loss: 1.0464, test_loss: 1.1227, test_f1: 0.3460
 epoch: 58, train_loss: 1.0352, test_loss: 1.1003, test_f1: 0.3404
 epoch: 59, train_loss: 1.0372, test_loss: 1.1041, test_f1: 0.3441
 epoch: 60, train_loss: 1.0276, test_loss: 1.1139, test_f1: 0.3421
 epoch: 61, train_loss: 1.0263, test_loss: 1.1280, test_f1: 0.3440
 epoch: 62, train_loss: 1.0270, test_loss: 1.1089, test_f1: 0.3421
 epoch: 63, train_loss: 1.0264, test_loss: 1.0988, test_f1: 0.3433
 epoch: 64, train_loss: 1.0277, test_loss: 1.1141, test_f1: 0.3422
 epoch: 65, train_loss: 1.0272, test_loss: 1.0825, test_f1: 0.3469
 epoch: 66, train_loss: 1.0336, test_loss: 1.1122, test_f1: 0.3476
 epoch: 67, train_loss: 1.0180, test_loss: 1.0873, test_f1: 0.3531
 epoch: 68, train_loss: 1.0229, test_loss: 1.1265, test_f1: 0.3422
 epoch: 69, train_loss: 1.0357, test_loss: 1.1397, test_f1: 0.3402
 epoch: 70, train_loss: 1.0325, test_loss: 1.1284, test_f1: 0.3422
 epoch: 71, train_loss: 1.0378, test_loss: 1.1149, test_f1: 0.3441
 epoch: 72, train_loss: 1.0483, test_loss: 1.1426, test_f1: 0.3421
 epoch: 73, train_loss: 1.0306, test_loss: 1.1139, test_f1: 0.3422
 epoch: 74, train_loss: 1.0285, test_loss: 1.1335, test_f1: 0.3367
 epoch: 75, train_loss: 1.0219, test_loss: 1.1020, test_f1: 0.3479
 epoch: 76, train_loss: 1.0282, test_loss: 1.1113, test_f1: 0.3469
 epoch: 77, train_loss: 1.0284, test_loss: 1.1285, test_f1: 0.3422
 epoch: 78, train_loss: 1.0380, test_loss: 1.1157, test_f1: 0.3380
 epoch: 79, train_loss: 1.0252, test_loss: 1.1295, test_f1: 0.3398
 epoch: 80, train_loss: 1.0304, test_loss: 1.1430, test_f1: 0.3412
 epoch: 81, train_loss: 1.0315, test_loss: 1.1108, test_f1: 0.3435
 epoch: 82, train_loss: 1.0298, test_loss: 1.1043, test_f1: 0.3447
 epoch: 83, train_loss: 1.0574, test_loss: 1.1101, test_f1: 0.3467
 epoch: 84, train_loss: 1.0435, test_loss: 1.1318, test_f1: 0.3356
 epoch: 85, train_loss: 1.0320, test_loss: 1.1442, test_f1: 0.3358
 epoch: 86, train_loss: 1.0239, test_loss: 1.1258, test_f1: 0.3422
 epoch: 87, train_loss: 1.0197, test_loss: 1.1277, test_f1: 0.3395
 epoch: 88, train_loss: 1.0179, test_loss: 1.1049, test_f1: 0.3415
 epoch: 89, train_loss: 1.0227, test_loss: 1.1130, test_f1: 0.3426
 epoch: 90, train_loss: 1.0187, test_loss: 1.1466, test_f1: 0.3371
 epoch: 91, train_loss: 1.0225, test_loss: 1.1439, test_f1: 0.3441
 epoch: 92, train_loss: 1.0203, test_loss: 1.1105, test_f1: 0.3469
 epoch: 93, train_loss: 1.0264, test_loss: 1.1606, test_f1: 0.3371
 epoch: 94, train_loss: 1.0307, test_loss: 1.1517, test_f1: 0.3396
 epoch: 95, train_loss: 1.0198, test_loss: 1.1433, test_f1: 0.3398
 epoch: 96, train_loss: 1.0362, test_loss: 1.1520, test_f1: 0.3412
 epoch: 97, train_loss: 1.0327, test_loss: 1.1525, test_f1: 0.3422
 epoch: 98, train_loss: 1.0184, test_loss: 1.1066, test_f1: 0.3449
 epoch: 99, train_loss: 1.0241, test_loss: 1.1344, test_f1: 0.3387
##################ITERATION #2 ****************************************
 epoch: 0, train_loss: 1.6195, test_loss: 2.9738, test_f1: 0.0506
 epoch: 1, train_loss: 1.2241, test_loss: 1.1908, test_f1: 0.3186
 epoch: 2, train_loss: 1.0995, test_loss: 1.1572, test_f1: 0.3400
 epoch: 3, train_loss: 1.0777, test_loss: 1.1418, test_f1: 0.3422
 epoch: 4, train_loss: 1.0622, test_loss: 1.1585, test_f1: 0.3488
 epoch: 5, train_loss: 1.0490, test_loss: 1.1932, test_f1: 0.3180
 epoch: 6, train_loss: 1.0633, test_loss: 1.1322, test_f1: 0.3372
 epoch: 7, train_loss: 1.0601, test_loss: 1.1221, test_f1: 0.3436
 epoch: 8, train_loss: 1.0568, test_loss: 1.1181, test_f1: 0.3422
 epoch: 9, train_loss: 1.0521, test_loss: 1.1127, test_f1: 0.3555
 epoch: 10, train_loss: 1.0420, test_loss: 1.1137, test_f1: 0.3424
 epoch: 11, train_loss: 1.0399, test_loss: 1.1243, test_f1: 0.3482
 epoch: 12, train_loss: 1.0364, test_loss: 1.0958, test_f1: 0.3574
 epoch: 13, train_loss: 1.0358, test_loss: 1.0957, test_f1: 0.3688
 epoch: 14, train_loss: 1.0301, test_loss: 1.0452, test_f1: 0.3664
 epoch: 15, train_loss: 1.0327, test_loss: 1.1295, test_f1: 0.3587
 epoch: 16, train_loss: 1.0348, test_loss: 1.0393, test_f1: 0.3610
 epoch: 17, train_loss: 1.0285, test_loss: 1.3923, test_f1: 0.3085
 epoch: 18, train_loss: 1.0226, test_loss: 1.1904, test_f1: 0.3574
 epoch: 19, train_loss: 1.0170, test_loss: 1.0797, test_f1: 0.3981
 epoch: 20, train_loss: 1.0151, test_loss: 1.1744, test_f1: 0.3574
 epoch: 21, train_loss: 1.0289, test_loss: 1.0935, test_f1: 0.3580
 epoch: 22, train_loss: 1.0337, test_loss: 1.1003, test_f1: 0.3481
 epoch: 23, train_loss: 1.0203, test_loss: 1.1097, test_f1: 0.3545
 epoch: 24, train_loss: 1.0243, test_loss: 1.1171, test_f1: 0.3504
 epoch: 25, train_loss: 1.0128, test_loss: 1.0928, test_f1: 0.3476
 epoch: 26, train_loss: 1.0076, test_loss: 1.1157, test_f1: 0.3365
 epoch: 27, train_loss: 1.0041, test_loss: 1.1416, test_f1: 0.3514
 epoch: 28, train_loss: 1.0095, test_loss: 1.1158, test_f1: 0.3422
 epoch: 29, train_loss: 1.0017, test_loss: 1.0723, test_f1: 0.3546
 epoch: 30, train_loss: 0.9977, test_loss: 1.0939, test_f1: 0.3544
 epoch: 31, train_loss: 0.9954, test_loss: 1.0967, test_f1: 0.4723
 epoch: 32, train_loss: 1.0113, test_loss: 1.0885, test_f1: 0.3546
 epoch: 33, train_loss: 1.0152, test_loss: 1.1012, test_f1: 0.3937
 epoch: 34, train_loss: 1.0077, test_loss: 1.0885, test_f1: 0.3511
 epoch: 35, train_loss: 0.9913, test_loss: 1.0614, test_f1: 0.4047
 epoch: 36, train_loss: 0.9833, test_loss: 1.0693, test_f1: 0.4004
 epoch: 37, train_loss: 0.9876, test_loss: 1.1197, test_f1: 0.3422
 epoch: 38, train_loss: 0.9943, test_loss: 1.1034, test_f1: 0.3427
 epoch: 39, train_loss: 0.9857, test_loss: 1.0941, test_f1: 0.4264
 epoch: 40, train_loss: 0.9926, test_loss: 1.1710, test_f1: 0.3527
 epoch: 41, train_loss: 0.9869, test_loss: 1.0937, test_f1: 0.3447
 epoch: 42, train_loss: 0.9843, test_loss: 1.1013, test_f1: 0.5012
 epoch: 43, train_loss: 0.9861, test_loss: 1.0997, test_f1: 0.3807
 epoch: 44, train_loss: 0.9872, test_loss: 1.0668, test_f1: 0.4225
 epoch: 45, train_loss: 0.9959, test_loss: 1.0788, test_f1: 0.3896
 epoch: 46, train_loss: 0.9800, test_loss: 1.1134, test_f1: 0.3557
 epoch: 47, train_loss: 0.9853, test_loss: 1.1631, test_f1: 0.3441
 epoch: 48, train_loss: 1.0151, test_loss: 1.1560, test_f1: 0.3427
 epoch: 49, train_loss: 0.9913, test_loss: 1.0721, test_f1: 0.4497
 epoch: 50, train_loss: 0.9829, test_loss: 1.0828, test_f1: 0.4316
 epoch: 51, train_loss: 0.9704, test_loss: 1.0636, test_f1: 0.4739
 epoch: 52, train_loss: 0.9625, test_loss: 1.0632, test_f1: 0.4263
 epoch: 53, train_loss: 0.9596, test_loss: 1.0823, test_f1: 0.4764
 epoch: 54, train_loss: 0.9598, test_loss: 1.2332, test_f1: 0.4725
 epoch: 55, train_loss: 0.9595, test_loss: 1.0475, test_f1: 0.4989
 epoch: 56, train_loss: 0.9498, test_loss: 1.0788, test_f1: 0.4654
 epoch: 57, train_loss: 0.9534, test_loss: 1.0554, test_f1: 0.5041
 epoch: 58, train_loss: 0.9592, test_loss: 1.0695, test_f1: 0.4792
 epoch: 59, train_loss: 0.9567, test_loss: 1.0845, test_f1: 0.4410
 epoch: 60, train_loss: 0.9485, test_loss: 1.0456, test_f1: 0.4754
 epoch: 61, train_loss: 0.9465, test_loss: 1.0432, test_f1: 0.5092
 epoch: 62, train_loss: 0.9414, test_loss: 1.0631, test_f1: 0.4606
 epoch: 63, train_loss: 0.9344, test_loss: 1.0479, test_f1: 0.5098
 epoch: 64, train_loss: 0.9418, test_loss: 1.0547, test_f1: 0.4999
 epoch: 65, train_loss: 0.9374, test_loss: 1.0817, test_f1: 0.5163
 epoch: 66, train_loss: 0.9504, test_loss: 1.0648, test_f1: 0.4853
 epoch: 67, train_loss: 0.9449, test_loss: 1.0506, test_f1: 0.4013
 epoch: 68, train_loss: 0.9420, test_loss: 1.0510, test_f1: 0.4859
 epoch: 69, train_loss: 0.9358, test_loss: 1.0566, test_f1: 0.5130
 epoch: 70, train_loss: 0.9468, test_loss: 1.0926, test_f1: 0.4975
 epoch: 71, train_loss: 0.9428, test_loss: 1.0598, test_f1: 0.4447
 epoch: 72, train_loss: 0.9280, test_loss: 1.0504, test_f1: 0.4883
 epoch: 73, train_loss: 0.9244, test_loss: 1.0592, test_f1: 0.5024
 epoch: 74, train_loss: 0.9438, test_loss: 1.0629, test_f1: 0.5003
 epoch: 75, train_loss: 0.9566, test_loss: 1.1009, test_f1: 0.5095
 epoch: 76, train_loss: 0.9593, test_loss: 1.0790, test_f1: 0.3847
 epoch: 77, train_loss: 0.9439, test_loss: 1.0433, test_f1: 0.4886
 epoch: 78, train_loss: 0.9284, test_loss: 1.0642, test_f1: 0.4944
 epoch: 79, train_loss: 0.9272, test_loss: 1.1243, test_f1: 0.4973
 epoch: 80, train_loss: 0.9405, test_loss: 1.0512, test_f1: 0.5345
 epoch: 81, train_loss: 0.9147, test_loss: 1.0517, test_f1: 0.5164
 epoch: 82, train_loss: 0.9256, test_loss: 1.1356, test_f1: 0.5311
 epoch: 83, train_loss: 0.9227, test_loss: 1.0493, test_f1: 0.4965
 epoch: 84, train_loss: 0.9329, test_loss: 1.1087, test_f1: 0.4907
 epoch: 85, train_loss: 0.9254, test_loss: 1.0624, test_f1: 0.4919
 epoch: 86, train_loss: 0.9235, test_loss: 1.0513, test_f1: 0.5285
 epoch: 87, train_loss: 0.9295, test_loss: 1.0516, test_f1: 0.5209
 epoch: 88, train_loss: 0.9154, test_loss: 1.1045, test_f1: 0.4886
 epoch: 89, train_loss: 0.9216, test_loss: 1.0762, test_f1: 0.4888
 epoch: 90, train_loss: 0.9223, test_loss: 1.0524, test_f1: 0.5124
 epoch: 91, train_loss: 0.9184, test_loss: 1.1285, test_f1: 0.4817
 epoch: 92, train_loss: 0.9281, test_loss: 1.0664, test_f1: 0.4905
 epoch: 93, train_loss: 0.9145, test_loss: 1.0560, test_f1: 0.5010
 epoch: 94, train_loss: 0.9064, test_loss: 1.0787, test_f1: 0.4948
 epoch: 95, train_loss: 0.9172, test_loss: 1.1081, test_f1: 0.4877
 epoch: 96, train_loss: 0.9107, test_loss: 1.0572, test_f1: 0.5204
 epoch: 97, train_loss: 0.9023, test_loss: 1.0856, test_f1: 0.5077
 epoch: 98, train_loss: 0.9125, test_loss: 1.0828, test_f1: 0.5189
 epoch: 99, train_loss: 0.9197, test_loss: 1.0762, test_f1: 0.4691
##################ITERATION #3 ****************************************
 epoch: 0, train_loss: 2.1117, test_loss: 3.0159, test_f1: 0.2539
 epoch: 1, train_loss: 1.2840, test_loss: 1.2013, test_f1: 0.2607
 epoch: 2, train_loss: 1.2202, test_loss: 1.1698, test_f1: 0.3881
 epoch: 3, train_loss: 1.1770, test_loss: 1.1457, test_f1: 0.3673
 epoch: 4, train_loss: 1.1326, test_loss: 1.0916, test_f1: 0.3652
 epoch: 5, train_loss: 1.1199, test_loss: 1.0702, test_f1: 0.3559
 epoch: 6, train_loss: 1.1038, test_loss: 1.0594, test_f1: 0.3810
 epoch: 7, train_loss: 1.0961, test_loss: 1.0592, test_f1: 0.3840
 epoch: 8, train_loss: 1.0964, test_loss: 1.0723, test_f1: 0.3441
 epoch: 9, train_loss: 1.0928, test_loss: 1.0651, test_f1: 0.3432
 epoch: 10, train_loss: 1.0916, test_loss: 1.1094, test_f1: 0.3564
 epoch: 11, train_loss: 1.0777, test_loss: 1.0356, test_f1: 0.3422
 epoch: 12, train_loss: 1.0817, test_loss: 1.0457, test_f1: 0.3564
 epoch: 13, train_loss: 1.0745, test_loss: 1.0542, test_f1: 0.3545
 epoch: 14, train_loss: 1.0669, test_loss: 1.0414, test_f1: 0.3709
 epoch: 15, train_loss: 1.0785, test_loss: 2.1303, test_f1: 0.2525
 epoch: 16, train_loss: 1.1095, test_loss: 1.0550, test_f1: 0.3443
 epoch: 17, train_loss: 1.0871, test_loss: 1.1286, test_f1: 0.3324
 epoch: 18, train_loss: 1.0801, test_loss: 1.1507, test_f1: 0.3545
 epoch: 19, train_loss: 1.0634, test_loss: 1.1278, test_f1: 0.3710
 epoch: 20, train_loss: 1.0683, test_loss: 1.1451, test_f1: 0.3654
 epoch: 21, train_loss: 1.0669, test_loss: 1.0385, test_f1: 0.3745
 epoch: 22, train_loss: 1.0580, test_loss: 1.1388, test_f1: 0.3413
 epoch: 23, train_loss: 1.0537, test_loss: 1.1404, test_f1: 0.3422
 epoch: 24, train_loss: 1.0528, test_loss: 1.0664, test_f1: 0.3392
 epoch: 25, train_loss: 1.0487, test_loss: 1.1271, test_f1: 0.3531
 epoch: 26, train_loss: 1.0532, test_loss: 1.1227, test_f1: 0.3624
 epoch: 27, train_loss: 1.0451, test_loss: 1.1293, test_f1: 0.3642
 epoch: 28, train_loss: 1.0438, test_loss: 1.1290, test_f1: 0.3545
 epoch: 29, train_loss: 1.0394, test_loss: 1.1318, test_f1: 0.3441
 epoch: 30, train_loss: 1.0355, test_loss: 1.0213, test_f1: 0.3580
 epoch: 31, train_loss: 1.0394, test_loss: 1.1366, test_f1: 0.3386
 epoch: 32, train_loss: 1.0372, test_loss: 1.1675, test_f1: 0.4215
 epoch: 33, train_loss: 1.0467, test_loss: 1.1753, test_f1: 0.3879
 epoch: 34, train_loss: 1.0500, test_loss: 1.6899, test_f1: 0.2369
 epoch: 35, train_loss: 1.0756, test_loss: 1.4203, test_f1: 0.3607
 epoch: 36, train_loss: 1.0608, test_loss: 1.2203, test_f1: 0.4014
 epoch: 37, train_loss: 1.0422, test_loss: 1.1116, test_f1: 0.3518
 epoch: 38, train_loss: 1.0485, test_loss: 1.0549, test_f1: 0.3534
 epoch: 39, train_loss: 1.0609, test_loss: 1.1094, test_f1: 0.3673
 epoch: 40, train_loss: 1.0454, test_loss: 1.1453, test_f1: 0.3476
 epoch: 41, train_loss: 1.0508, test_loss: 1.0656, test_f1: 0.3512
 epoch: 42, train_loss: 1.0467, test_loss: 1.1090, test_f1: 0.3416
 epoch: 43, train_loss: 1.0526, test_loss: 1.1248, test_f1: 0.3582
 epoch: 44, train_loss: 1.0383, test_loss: 1.1563, test_f1: 0.3271
 epoch: 45, train_loss: 1.0418, test_loss: 1.1320, test_f1: 0.3429
 epoch: 46, train_loss: 1.0372, test_loss: 1.1223, test_f1: 0.3746
 epoch: 47, train_loss: 1.0370, test_loss: 1.0581, test_f1: 0.3553
 epoch: 48, train_loss: 1.0245, test_loss: 1.1632, test_f1: 0.3608
 epoch: 49, train_loss: 1.0317, test_loss: 1.1224, test_f1: 0.3422
 epoch: 50, train_loss: 1.0405, test_loss: 1.0996, test_f1: 0.3677
 epoch: 51, train_loss: 1.0286, test_loss: 1.0987, test_f1: 0.3455
 epoch: 52, train_loss: 1.0171, test_loss: 1.1005, test_f1: 0.3533
 epoch: 53, train_loss: 1.0090, test_loss: 1.1099, test_f1: 0.3703
 epoch: 54, train_loss: 1.0203, test_loss: 1.1915, test_f1: 0.3746
 epoch: 55, train_loss: 1.0148, test_loss: 1.1164, test_f1: 0.3548
 epoch: 56, train_loss: 1.0199, test_loss: 1.1263, test_f1: 0.3455
 epoch: 57, train_loss: 1.0165, test_loss: 1.0876, test_f1: 0.3719
 epoch: 58, train_loss: 1.0142, test_loss: 1.1455, test_f1: 0.3516
 epoch: 59, train_loss: 1.0153, test_loss: 1.1147, test_f1: 0.3450
 epoch: 60, train_loss: 1.0163, test_loss: 1.0903, test_f1: 0.3592
 epoch: 61, train_loss: 1.0082, test_loss: 1.1150, test_f1: 0.3548
 epoch: 62, train_loss: 1.0032, test_loss: 1.1053, test_f1: 0.3764
 epoch: 63, train_loss: 1.0026, test_loss: 1.1086, test_f1: 0.3867
 epoch: 64, train_loss: 1.0068, test_loss: 1.1074, test_f1: 0.3820
 epoch: 65, train_loss: 1.0014, test_loss: 1.1077, test_f1: 0.3919
 epoch: 66, train_loss: 0.9971, test_loss: 1.1122, test_f1: 0.3727
 epoch: 67, train_loss: 0.9948, test_loss: 1.0978, test_f1: 0.3765
 epoch: 68, train_loss: 1.0106, test_loss: 2.6697, test_f1: 0.3097
 epoch: 69, train_loss: 1.0114, test_loss: 1.0955, test_f1: 0.3466
 epoch: 70, train_loss: 1.0001, test_loss: 1.1252, test_f1: 0.3541
 epoch: 71, train_loss: 1.0142, test_loss: 1.1301, test_f1: 0.3550
 epoch: 72, train_loss: 0.9954, test_loss: 1.1362, test_f1: 0.3622
 epoch: 73, train_loss: 0.9828, test_loss: 1.0811, test_f1: 0.3768
 epoch: 74, train_loss: 0.9844, test_loss: 1.1573, test_f1: 0.4015
 epoch: 75, train_loss: 0.9860, test_loss: 1.0919, test_f1: 0.3703
 epoch: 76, train_loss: 0.9836, test_loss: 1.0817, test_f1: 0.3902
 epoch: 77, train_loss: 0.9859, test_loss: 1.1067, test_f1: 0.3537
 epoch: 78, train_loss: 0.9844, test_loss: 1.0788, test_f1: 0.4158
 epoch: 79, train_loss: 0.9779, test_loss: 1.1741, test_f1: 0.3977
 epoch: 80, train_loss: 0.9997, test_loss: 1.0972, test_f1: 0.3856
 epoch: 81, train_loss: 1.0030, test_loss: 1.0733, test_f1: 0.4128
 epoch: 82, train_loss: 0.9940, test_loss: 1.0769, test_f1: 0.3506
 epoch: 83, train_loss: 0.9937, test_loss: 1.1283, test_f1: 0.3846
 epoch: 84, train_loss: 0.9911, test_loss: 1.1383, test_f1: 0.3472
 epoch: 85, train_loss: 0.9835, test_loss: 1.1476, test_f1: 0.4166
 epoch: 86, train_loss: 1.0018, test_loss: 1.0085, test_f1: 0.4526
 epoch: 87, train_loss: 1.0028, test_loss: 1.1527, test_f1: 0.3893
 epoch: 88, train_loss: 0.9898, test_loss: 1.1351, test_f1: 0.3862
 epoch: 89, train_loss: 0.9820, test_loss: 1.0960, test_f1: 0.4866
 epoch: 90, train_loss: 0.9843, test_loss: 1.0955, test_f1: 0.3617
 epoch: 91, train_loss: 0.9859, test_loss: 1.1052, test_f1: 0.3590
 epoch: 92, train_loss: 0.9915, test_loss: 1.1806, test_f1: 0.4123
 epoch: 93, train_loss: 0.9834, test_loss: 1.0811, test_f1: 0.4982
 epoch: 94, train_loss: 0.9650, test_loss: 1.0779, test_f1: 0.4087
 epoch: 95, train_loss: 0.9678, test_loss: 1.0901, test_f1: 0.3647
 epoch: 96, train_loss: 0.9846, test_loss: 1.1041, test_f1: 0.3476
 epoch: 97, train_loss: 0.9809, test_loss: 1.1116, test_f1: 0.4269
 epoch: 98, train_loss: 0.9815, test_loss: 1.1191, test_f1: 0.4117
 epoch: 99, train_loss: 0.9819, test_loss: 1.0917, test_f1: 0.4651
##################ITERATION #4 ****************************************
 epoch: 0, train_loss: 2.1407, test_loss: 2.0944, test_f1: 0.2270
 epoch: 1, train_loss: 1.2323, test_loss: 1.1213, test_f1: 0.3360
 epoch: 2, train_loss: 1.1064, test_loss: 1.0527, test_f1: 0.3555
 epoch: 3, train_loss: 1.0877, test_loss: 1.0800, test_f1: 0.3413
 epoch: 4, train_loss: 1.0767, test_loss: 1.1325, test_f1: 0.3450
 epoch: 5, train_loss: 1.0777, test_loss: 1.1533, test_f1: 0.3589
 epoch: 6, train_loss: 1.0524, test_loss: 1.1204, test_f1: 0.3581
 epoch: 7, train_loss: 1.0576, test_loss: 1.1050, test_f1: 0.3466
 epoch: 8, train_loss: 1.0544, test_loss: 1.1897, test_f1: 0.3552
 epoch: 9, train_loss: 1.0552, test_loss: 1.0406, test_f1: 0.3878
 epoch: 10, train_loss: 1.0625, test_loss: 1.2411, test_f1: 0.3208
 epoch: 11, train_loss: 1.0619, test_loss: 1.2763, test_f1: 0.2690
 epoch: 12, train_loss: 1.0500, test_loss: 1.1417, test_f1: 0.3460
 epoch: 13, train_loss: 1.0624, test_loss: 1.0591, test_f1: 0.3441
 epoch: 14, train_loss: 1.0487, test_loss: 1.1127, test_f1: 0.3662
 epoch: 15, train_loss: 1.0296, test_loss: 1.1295, test_f1: 0.3356
 epoch: 16, train_loss: 1.0392, test_loss: 1.1562, test_f1: 0.3420
 epoch: 17, train_loss: 1.0443, test_loss: 1.0677, test_f1: 0.3553
 epoch: 18, train_loss: 1.0660, test_loss: 1.1118, test_f1: 0.3460
 epoch: 19, train_loss: 1.0488, test_loss: 1.1014, test_f1: 0.3710
 epoch: 20, train_loss: 1.0348, test_loss: 1.1081, test_f1: 0.3410
 epoch: 21, train_loss: 1.0146, test_loss: 1.0161, test_f1: 0.3862
 epoch: 22, train_loss: 1.0236, test_loss: 1.0903, test_f1: 0.3416
 epoch: 23, train_loss: 1.0273, test_loss: 1.0418, test_f1: 0.3748
 epoch: 24, train_loss: 1.0231, test_loss: 1.0826, test_f1: 0.4185
 epoch: 25, train_loss: 1.0417, test_loss: 1.1053, test_f1: 0.3439
 epoch: 26, train_loss: 1.0340, test_loss: 1.1044, test_f1: 0.3438
 epoch: 27, train_loss: 1.0179, test_loss: 1.1160, test_f1: 0.3425
 epoch: 28, train_loss: 1.0133, test_loss: 1.0841, test_f1: 0.3486
 epoch: 29, train_loss: 1.0246, test_loss: 1.0583, test_f1: 0.3775
 epoch: 30, train_loss: 1.0212, test_loss: 1.2222, test_f1: 0.3540
 epoch: 31, train_loss: 1.0168, test_loss: 1.0897, test_f1: 0.3460
 epoch: 32, train_loss: 1.0167, test_loss: 1.1141, test_f1: 0.3479
 epoch: 33, train_loss: 1.0144, test_loss: 1.0922, test_f1: 0.4247
 epoch: 34, train_loss: 1.0266, test_loss: 1.1906, test_f1: 0.3983
 epoch: 35, train_loss: 1.0181, test_loss: 1.1276, test_f1: 0.3671
 epoch: 36, train_loss: 1.0120, test_loss: 1.1064, test_f1: 0.3479
 epoch: 37, train_loss: 1.0082, test_loss: 1.1613, test_f1: 0.3476
 epoch: 38, train_loss: 1.0119, test_loss: 1.1442, test_f1: 0.3945
 epoch: 39, train_loss: 1.0043, test_loss: 1.1094, test_f1: 0.3705
 epoch: 40, train_loss: 1.0159, test_loss: 1.1042, test_f1: 0.3441
 epoch: 41, train_loss: 1.0120, test_loss: 1.3708, test_f1: 0.3643
 epoch: 42, train_loss: 1.0273, test_loss: 1.1490, test_f1: 0.3566
 epoch: 43, train_loss: 1.0140, test_loss: 1.1676, test_f1: 0.4202
 epoch: 44, train_loss: 0.9872, test_loss: 1.0732, test_f1: 0.4059
 epoch: 45, train_loss: 0.9965, test_loss: 1.0846, test_f1: 0.3605
 epoch: 46, train_loss: 0.9920, test_loss: 1.1051, test_f1: 0.4742
 epoch: 47, train_loss: 1.0216, test_loss: 1.0971, test_f1: 0.4429
 epoch: 48, train_loss: 0.9998, test_loss: 1.1136, test_f1: 0.4347
 epoch: 49, train_loss: 0.9923, test_loss: 1.1006, test_f1: 0.4166
 epoch: 50, train_loss: 0.9933, test_loss: 1.1245, test_f1: 0.3891
 epoch: 51, train_loss: 0.9893, test_loss: 1.0752, test_f1: 0.3769
 epoch: 52, train_loss: 0.9813, test_loss: 1.0693, test_f1: 0.4114
 epoch: 53, train_loss: 0.9745, test_loss: 1.0796, test_f1: 0.3671
 epoch: 54, train_loss: 0.9775, test_loss: 1.0590, test_f1: 0.3731
 epoch: 55, train_loss: 0.9765, test_loss: 1.0524, test_f1: 0.3901
 epoch: 56, train_loss: 0.9741, test_loss: 1.0492, test_f1: 0.3949
 epoch: 57, train_loss: 0.9811, test_loss: 1.0587, test_f1: 0.3991
 epoch: 58, train_loss: 0.9676, test_loss: 1.0526, test_f1: 0.3866
 epoch: 59, train_loss: 0.9668, test_loss: 1.0514, test_f1: 0.4876
 epoch: 60, train_loss: 0.9612, test_loss: 1.0477, test_f1: 0.5070
 epoch: 61, train_loss: 0.9648, test_loss: 1.0920, test_f1: 0.4330
 epoch: 62, train_loss: 0.9721, test_loss: 1.0659, test_f1: 0.3937
 epoch: 63, train_loss: 0.9621, test_loss: 1.0449, test_f1: 0.4015
 epoch: 64, train_loss: 0.9618, test_loss: 1.0636, test_f1: 0.4197
 epoch: 65, train_loss: 0.9558, test_loss: 1.0476, test_f1: 0.4271
 epoch: 66, train_loss: 0.9686, test_loss: 1.0737, test_f1: 0.4746
 epoch: 67, train_loss: 0.9647, test_loss: 1.0698, test_f1: 0.4729
 epoch: 68, train_loss: 0.9765, test_loss: 1.0695, test_f1: 0.4216
 epoch: 69, train_loss: 0.9650, test_loss: 1.0635, test_f1: 0.4870
 epoch: 70, train_loss: 0.9566, test_loss: 1.0492, test_f1: 0.3696
 epoch: 71, train_loss: 0.9552, test_loss: 1.0535, test_f1: 0.4921
 epoch: 72, train_loss: 0.9481, test_loss: 1.0749, test_f1: 0.4196
 epoch: 73, train_loss: 0.9844, test_loss: 1.1030, test_f1: 0.3902
 epoch: 74, train_loss: 0.9848, test_loss: 1.1089, test_f1: 0.4718
 epoch: 75, train_loss: 1.0062, test_loss: 1.0694, test_f1: 0.4092
 epoch: 76, train_loss: 0.9725, test_loss: 1.0544, test_f1: 0.4124
 epoch: 77, train_loss: 0.9554, test_loss: 1.0622, test_f1: 0.4660
 epoch: 78, train_loss: 0.9746, test_loss: 1.0645, test_f1: 0.4378
 epoch: 79, train_loss: 0.9735, test_loss: 1.0965, test_f1: 0.4725
 epoch: 80, train_loss: 0.9733, test_loss: 1.0864, test_f1: 0.3799
 epoch: 81, train_loss: 0.9605, test_loss: 1.0493, test_f1: 0.4188
 epoch: 82, train_loss: 0.9545, test_loss: 1.0664, test_f1: 0.4939
 epoch: 83, train_loss: 0.9480, test_loss: 1.0566, test_f1: 0.4476
 epoch: 84, train_loss: 0.9563, test_loss: 1.0657, test_f1: 0.3922
 epoch: 85, train_loss: 0.9436, test_loss: 1.0603, test_f1: 0.4410
 epoch: 86, train_loss: 0.9436, test_loss: 1.0606, test_f1: 0.4820
 epoch: 87, train_loss: 0.9386, test_loss: 1.0453, test_f1: 0.4975
 epoch: 88, train_loss: 0.9428, test_loss: 1.0480, test_f1: 0.4863
 epoch: 89, train_loss: 0.9436, test_loss: 1.0465, test_f1: 0.5090
 epoch: 90, train_loss: 0.9456, test_loss: 1.0616, test_f1: 0.5114
 epoch: 91, train_loss: 0.9491, test_loss: 1.0712, test_f1: 0.5019
 epoch: 92, train_loss: 0.9388, test_loss: 1.0612, test_f1: 0.4879
 epoch: 93, train_loss: 0.9392, test_loss: 1.0687, test_f1: 0.5025
 epoch: 94, train_loss: 0.9461, test_loss: 1.0556, test_f1: 0.4640
 epoch: 95, train_loss: 0.9473, test_loss: 1.0453, test_f1: 0.5142
 epoch: 96, train_loss: 0.9431, test_loss: 1.0583, test_f1: 0.3610
 epoch: 97, train_loss: 0.9397, test_loss: 1.0608, test_f1: 0.4206
 epoch: 98, train_loss: 0.9476, test_loss: 1.0455, test_f1: 0.4561
 epoch: 99, train_loss: 0.9515, test_loss: 1.1377, test_f1: 0.4736
##################ITERATION #5 ****************************************
 epoch: 0, train_loss: 1.9940, test_loss: 1.3442, test_f1: 0.2484
 epoch: 1, train_loss: 1.2858, test_loss: 1.2408, test_f1: 0.2819
 epoch: 2, train_loss: 1.1846, test_loss: 1.1334, test_f1: 0.3535
 epoch: 3, train_loss: 1.1043, test_loss: 1.1012, test_f1: 0.3473
 epoch: 4, train_loss: 1.0955, test_loss: 1.1949, test_f1: 0.3019
 epoch: 5, train_loss: 1.0792, test_loss: 1.1361, test_f1: 0.3412
 epoch: 6, train_loss: 1.0822, test_loss: 1.1331, test_f1: 0.3415
 epoch: 7, train_loss: 1.0646, test_loss: 1.1206, test_f1: 0.3889
 epoch: 8, train_loss: 1.0455, test_loss: 1.1865, test_f1: 0.3422
 epoch: 9, train_loss: 1.0419, test_loss: 1.1155, test_f1: 0.3641
 epoch: 10, train_loss: 1.0488, test_loss: 1.1068, test_f1: 0.3888
 epoch: 11, train_loss: 1.0407, test_loss: 1.1199, test_f1: 0.4214
 epoch: 12, train_loss: 1.0323, test_loss: 1.0401, test_f1: 0.3834
 epoch: 13, train_loss: 1.0368, test_loss: 1.1789, test_f1: 0.3799
 epoch: 14, train_loss: 1.0372, test_loss: 1.1351, test_f1: 0.3513
 epoch: 15, train_loss: 1.0168, test_loss: 1.2025, test_f1: 0.3905
 epoch: 16, train_loss: 1.0308, test_loss: 1.1093, test_f1: 0.3459
 epoch: 17, train_loss: 1.0387, test_loss: 1.2058, test_f1: 0.3845
 epoch: 18, train_loss: 1.0196, test_loss: 1.2293, test_f1: 0.3405
 epoch: 19, train_loss: 1.0215, test_loss: 1.1278, test_f1: 0.3771
 epoch: 20, train_loss: 1.0205, test_loss: 1.0962, test_f1: 0.3623
 epoch: 21, train_loss: 0.9997, test_loss: 1.0420, test_f1: 0.3567
 epoch: 22, train_loss: 1.0088, test_loss: 1.0643, test_f1: 0.3640
 epoch: 23, train_loss: 1.0468, test_loss: 1.1460, test_f1: 0.3505
 epoch: 24, train_loss: 1.0223, test_loss: 1.0942, test_f1: 0.3677
 epoch: 25, train_loss: 1.0251, test_loss: 1.1231, test_f1: 0.3678
 epoch: 26, train_loss: 1.0076, test_loss: 1.1771, test_f1: 0.3903
 epoch: 27, train_loss: 1.0107, test_loss: 1.0546, test_f1: 0.3554
 epoch: 28, train_loss: 1.0112, test_loss: 1.0837, test_f1: 0.3519
 epoch: 29, train_loss: 0.9988, test_loss: 1.1060, test_f1: 0.3798
 epoch: 30, train_loss: 0.9881, test_loss: 1.0817, test_f1: 0.4646
 epoch: 31, train_loss: 0.9953, test_loss: 1.1110, test_f1: 0.4194
 epoch: 32, train_loss: 0.9951, test_loss: 1.0750, test_f1: 0.5287
 epoch: 33, train_loss: 1.0013, test_loss: 1.1526, test_f1: 0.3977
 epoch: 34, train_loss: 1.0181, test_loss: 1.0923, test_f1: 0.3853
 epoch: 35, train_loss: 1.0112, test_loss: 1.1587, test_f1: 0.4470
 epoch: 36, train_loss: 1.0102, test_loss: 1.1129, test_f1: 0.3511
 epoch: 37, train_loss: 0.9893, test_loss: 1.0468, test_f1: 0.3723
 epoch: 38, train_loss: 0.9838, test_loss: 1.0816, test_f1: 0.3550
 epoch: 39, train_loss: 0.9775, test_loss: 1.0679, test_f1: 0.3617
 epoch: 40, train_loss: 1.0174, test_loss: 1.0947, test_f1: 0.3740
 epoch: 41, train_loss: 0.9990, test_loss: 1.0760, test_f1: 0.4775
 epoch: 42, train_loss: 1.0075, test_loss: 1.1405, test_f1: 0.4099
 epoch: 43, train_loss: 0.9934, test_loss: 1.0728, test_f1: 0.5265
 epoch: 44, train_loss: 1.0024, test_loss: 1.1408, test_f1: 0.4167
 epoch: 45, train_loss: 1.0030, test_loss: 1.0267, test_f1: 0.4417
 epoch: 46, train_loss: 0.9914, test_loss: 1.1919, test_f1: 0.3937
 epoch: 47, train_loss: 0.9900, test_loss: 1.0910, test_f1: 0.4564
 epoch: 48, train_loss: 1.0098, test_loss: 1.1226, test_f1: 0.3918
 epoch: 49, train_loss: 0.9940, test_loss: 1.1125, test_f1: 0.3858
 epoch: 50, train_loss: 1.0092, test_loss: 1.1209, test_f1: 0.3199
 epoch: 51, train_loss: 0.9975, test_loss: 1.1394, test_f1: 0.3593
 epoch: 52, train_loss: 0.9746, test_loss: 1.0762, test_f1: 0.3794
 epoch: 53, train_loss: 0.9609, test_loss: 1.0466, test_f1: 0.4944
 epoch: 54, train_loss: 0.9547, test_loss: 1.0641, test_f1: 0.4716
 epoch: 55, train_loss: 0.9579, test_loss: 1.0508, test_f1: 0.3820
 epoch: 56, train_loss: 0.9497, test_loss: 1.0670, test_f1: 0.4845
 epoch: 57, train_loss: 0.9464, test_loss: 1.0754, test_f1: 0.5119
 epoch: 58, train_loss: 0.9514, test_loss: 1.0444, test_f1: 0.4757
 epoch: 59, train_loss: 0.9555, test_loss: 1.1336, test_f1: 0.4314
 epoch: 60, train_loss: 0.9506, test_loss: 1.1031, test_f1: 0.3977
 epoch: 61, train_loss: 0.9422, test_loss: 1.1087, test_f1: 0.4777
 epoch: 62, train_loss: 0.9455, test_loss: 1.0697, test_f1: 0.4700
 epoch: 63, train_loss: 0.9363, test_loss: 1.0742, test_f1: 0.4760
 epoch: 64, train_loss: 0.9385, test_loss: 1.0889, test_f1: 0.4807
 epoch: 65, train_loss: 0.9189, test_loss: 1.0463, test_f1: 0.4826
 epoch: 66, train_loss: 0.9456, test_loss: 1.0496, test_f1: 0.4779
 epoch: 67, train_loss: 0.9281, test_loss: 1.0753, test_f1: 0.4785
 epoch: 68, train_loss: 0.9544, test_loss: 1.1111, test_f1: 0.5044
 epoch: 69, train_loss: 0.9486, test_loss: 1.1146, test_f1: 0.3747
 epoch: 70, train_loss: 0.9535, test_loss: 1.1538, test_f1: 0.4281
 epoch: 71, train_loss: 0.9377, test_loss: 1.1232, test_f1: 0.4647
 epoch: 72, train_loss: 0.9283, test_loss: 1.0867, test_f1: 0.4732
 epoch: 73, train_loss: 0.9611, test_loss: 1.1643, test_f1: 0.4287
 epoch: 74, train_loss: 0.9663, test_loss: 1.1481, test_f1: 0.4967
 epoch: 75, train_loss: 0.9336, test_loss: 1.0796, test_f1: 0.4797
 epoch: 76, train_loss: 0.9232, test_loss: 1.1250, test_f1: 0.4465
 epoch: 77, train_loss: 0.9320, test_loss: 1.0832, test_f1: 0.4531
 epoch: 78, train_loss: 0.9456, test_loss: 1.1124, test_f1: 0.4847
 epoch: 79, train_loss: 0.9398, test_loss: 1.0689, test_f1: 0.4854
 epoch: 80, train_loss: 0.9268, test_loss: 1.1233, test_f1: 0.4390
 epoch: 81, train_loss: 0.9289, test_loss: 1.0414, test_f1: 0.5138
 epoch: 82, train_loss: 0.9346, test_loss: 1.0825, test_f1: 0.4884
 epoch: 83, train_loss: 0.9392, test_loss: 1.1317, test_f1: 0.4294
 epoch: 84, train_loss: 0.9288, test_loss: 1.1151, test_f1: 0.4686
 epoch: 85, train_loss: 0.9294, test_loss: 1.1143, test_f1: 0.4493
 epoch: 86, train_loss: 0.9076, test_loss: 1.0586, test_f1: 0.4947
 epoch: 87, train_loss: 0.9183, test_loss: 1.2308, test_f1: 0.4513
 epoch: 88, train_loss: 0.9256, test_loss: 1.0721, test_f1: 0.4985
 epoch: 89, train_loss: 0.9210, test_loss: 1.0528, test_f1: 0.5137
 epoch: 90, train_loss: 0.9333, test_loss: 1.0787, test_f1: 0.4866
 epoch: 91, train_loss: 0.9440, test_loss: 1.0349, test_f1: 0.5189
 epoch: 92, train_loss: 0.9447, test_loss: 1.0471, test_f1: 0.5031
 epoch: 93, train_loss: 0.9175, test_loss: 1.0504, test_f1: 0.5144
 epoch: 94, train_loss: 0.9120, test_loss: 1.2031, test_f1: 0.3682
 epoch: 95, train_loss: 0.9182, test_loss: 1.0812, test_f1: 0.4819
 epoch: 96, train_loss: 0.9188, test_loss: 1.0909, test_f1: 0.4828
 epoch: 97, train_loss: 0.8980, test_loss: 1.0297, test_f1: 0.5166
 epoch: 98, train_loss: 0.8959, test_loss: 1.0462, test_f1: 0.5157
 epoch: 99, train_loss: 0.9063, test_loss: 1.2024, test_f1: 0.4602
##################ITERATION #6 ****************************************
 epoch: 0, train_loss: 1.7717, test_loss: 1.5636, test_f1: 0.3155
 epoch: 1, train_loss: 1.2014, test_loss: 1.3049, test_f1: 0.3400
 epoch: 2, train_loss: 1.1482, test_loss: 1.2750, test_f1: 0.3007
 epoch: 3, train_loss: 1.1106, test_loss: 1.1501, test_f1: 0.3755
 epoch: 4, train_loss: 1.0783, test_loss: 1.1449, test_f1: 0.3431
 epoch: 5, train_loss: 1.0710, test_loss: 1.4162, test_f1: 0.2671
 epoch: 6, train_loss: 1.0615, test_loss: 1.1045, test_f1: 0.3869
 epoch: 7, train_loss: 1.0460, test_loss: 1.1447, test_f1: 0.3380
 epoch: 8, train_loss: 1.0577, test_loss: 1.1247, test_f1: 0.3448
 epoch: 9, train_loss: 1.0360, test_loss: 1.1235, test_f1: 0.3828
 epoch: 10, train_loss: 1.0385, test_loss: 1.0933, test_f1: 0.3578
 epoch: 11, train_loss: 1.0535, test_loss: 1.1490, test_f1: 0.3988
 epoch: 12, train_loss: 1.0377, test_loss: 1.1936, test_f1: 0.3785
 epoch: 13, train_loss: 1.0285, test_loss: 1.0210, test_f1: 0.3582
 epoch: 14, train_loss: 1.0342, test_loss: 1.1541, test_f1: 0.3840
 epoch: 15, train_loss: 1.0177, test_loss: 1.1185, test_f1: 0.3647
 epoch: 16, train_loss: 1.0272, test_loss: 0.9838, test_f1: 0.3967
 epoch: 17, train_loss: 1.0181, test_loss: 1.1211, test_f1: 0.3524
 epoch: 18, train_loss: 1.0198, test_loss: 1.1252, test_f1: 0.3469
 epoch: 19, train_loss: 1.0119, test_loss: 1.1557, test_f1: 0.4364
 epoch: 20, train_loss: 1.0151, test_loss: 1.1184, test_f1: 0.3820
 epoch: 21, train_loss: 1.0135, test_loss: 1.1898, test_f1: 0.3360
 epoch: 22, train_loss: 1.0303, test_loss: 1.1463, test_f1: 0.3499
 epoch: 23, train_loss: 1.0363, test_loss: 1.1701, test_f1: 0.3653
 epoch: 24, train_loss: 1.0427, test_loss: 1.1805, test_f1: 0.3308
 epoch: 25, train_loss: 1.0431, test_loss: 1.1304, test_f1: 0.3598
 epoch: 26, train_loss: 1.0289, test_loss: 1.1246, test_f1: 0.4211
 epoch: 27, train_loss: 1.0165, test_loss: 1.1417, test_f1: 0.3712
 epoch: 28, train_loss: 1.0140, test_loss: 1.2991, test_f1: 0.2763
 epoch: 29, train_loss: 1.0359, test_loss: 1.1398, test_f1: 0.4191
 epoch: 30, train_loss: 1.0411, test_loss: 2.0751, test_f1: 0.3422
 epoch: 31, train_loss: 1.0336, test_loss: 1.3102, test_f1: 0.3396
 epoch: 32, train_loss: 1.0347, test_loss: 1.2018, test_f1: 0.4059
 epoch: 33, train_loss: 1.0190, test_loss: 1.1278, test_f1: 0.3556
 epoch: 34, train_loss: 1.0233, test_loss: 1.1384, test_f1: 0.3580
 epoch: 35, train_loss: 1.0249, test_loss: 1.1617, test_f1: 0.3422
 epoch: 36, train_loss: 1.0009, test_loss: 1.1063, test_f1: 0.3525
 epoch: 37, train_loss: 0.9924, test_loss: 1.0854, test_f1: 0.4083
 epoch: 38, train_loss: 0.9879, test_loss: 1.2266, test_f1: 0.4031
 epoch: 39, train_loss: 1.0056, test_loss: 1.1324, test_f1: 0.3753
 epoch: 40, train_loss: 1.0021, test_loss: 1.1291, test_f1: 0.4102
 epoch: 41, train_loss: 1.0091, test_loss: 1.1611, test_f1: 0.3478
 epoch: 42, train_loss: 1.0077, test_loss: 1.1269, test_f1: 0.4083
 epoch: 43, train_loss: 1.0053, test_loss: 1.2523, test_f1: 0.4087
 epoch: 44, train_loss: 1.0270, test_loss: 1.1006, test_f1: 0.3791
 epoch: 45, train_loss: 1.0353, test_loss: 1.1174, test_f1: 0.3477
 epoch: 46, train_loss: 1.0202, test_loss: 1.1829, test_f1: 0.3639
 epoch: 47, train_loss: 1.0088, test_loss: 1.1150, test_f1: 0.3701
 epoch: 48, train_loss: 0.9913, test_loss: 1.1095, test_f1: 0.3720
 epoch: 49, train_loss: 0.9859, test_loss: 1.0929, test_f1: 0.3856
 epoch: 50, train_loss: 1.0021, test_loss: 1.1381, test_f1: 0.4312
 epoch: 51, train_loss: 1.0001, test_loss: 1.4098, test_f1: 0.3545
 epoch: 52, train_loss: 0.9835, test_loss: 1.0895, test_f1: 0.3990
 epoch: 53, train_loss: 0.9816, test_loss: 1.0797, test_f1: 0.3961
 epoch: 54, train_loss: 0.9720, test_loss: 1.0813, test_f1: 0.4831
 epoch: 55, train_loss: 0.9764, test_loss: 1.1069, test_f1: 0.4241
 epoch: 56, train_loss: 0.9752, test_loss: 1.0938, test_f1: 0.5182
 epoch: 57, train_loss: 0.9845, test_loss: 1.0839, test_f1: 0.4791
 epoch: 58, train_loss: 0.9736, test_loss: 1.0753, test_f1: 0.4430
 epoch: 59, train_loss: 0.9646, test_loss: 1.1014, test_f1: 0.4079
 epoch: 60, train_loss: 0.9803, test_loss: 1.1093, test_f1: 0.3975
 epoch: 61, train_loss: 0.9684, test_loss: 1.0971, test_f1: 0.4223
 epoch: 62, train_loss: 0.9650, test_loss: 1.0743, test_f1: 0.4039
 epoch: 63, train_loss: 0.9809, test_loss: 1.1036, test_f1: 0.4093
 epoch: 64, train_loss: 0.9698, test_loss: 1.0795, test_f1: 0.4155
 epoch: 65, train_loss: 0.9659, test_loss: 1.0747, test_f1: 0.4242
 epoch: 66, train_loss: 0.9656, test_loss: 1.1179, test_f1: 0.3775
 epoch: 67, train_loss: 0.9889, test_loss: 1.1089, test_f1: 0.3920
 epoch: 68, train_loss: 0.9641, test_loss: 1.0868, test_f1: 0.4097
 epoch: 69, train_loss: 0.9558, test_loss: 1.0968, test_f1: 0.4310
 epoch: 70, train_loss: 0.9644, test_loss: 1.0977, test_f1: 0.4786
 epoch: 71, train_loss: 0.9858, test_loss: 1.1120, test_f1: 0.4079
 epoch: 72, train_loss: 0.9691, test_loss: 1.0750, test_f1: 0.4237
 epoch: 73, train_loss: 0.9570, test_loss: 1.0963, test_f1: 0.4035
 epoch: 74, train_loss: 0.9770, test_loss: 1.1239, test_f1: 0.4805
 epoch: 75, train_loss: 0.9568, test_loss: 1.0818, test_f1: 0.4100
 epoch: 76, train_loss: 0.9644, test_loss: 1.0966, test_f1: 0.4193
 epoch: 77, train_loss: 0.9619, test_loss: 1.1044, test_f1: 0.4165
 epoch: 78, train_loss: 0.9653, test_loss: 1.0760, test_f1: 0.4815
 epoch: 79, train_loss: 0.9552, test_loss: 1.0813, test_f1: 0.4423
 epoch: 80, train_loss: 0.9578, test_loss: 1.2136, test_f1: 0.4771
 epoch: 81, train_loss: 0.9521, test_loss: 1.0952, test_f1: 0.4060
 epoch: 82, train_loss: 0.9662, test_loss: 1.0870, test_f1: 0.3976
 epoch: 83, train_loss: 0.9693, test_loss: 1.1053, test_f1: 0.3785
 epoch: 84, train_loss: 0.9687, test_loss: 1.1325, test_f1: 0.4064
 epoch: 85, train_loss: 0.9545, test_loss: 1.1603, test_f1: 0.4596
 epoch: 86, train_loss: 0.9648, test_loss: 1.1137, test_f1: 0.4627
 epoch: 87, train_loss: 0.9645, test_loss: 1.1023, test_f1: 0.4111
 epoch: 88, train_loss: 0.9512, test_loss: 1.0980, test_f1: 0.4621
 epoch: 89, train_loss: 0.9566, test_loss: 1.1150, test_f1: 0.4686
 epoch: 90, train_loss: 0.9515, test_loss: 1.1060, test_f1: 0.4066
 epoch: 91, train_loss: 0.9856, test_loss: 1.1374, test_f1: 0.3647
 epoch: 92, train_loss: 0.9823, test_loss: 1.1174, test_f1: 0.3704
 epoch: 93, train_loss: 0.9658, test_loss: 1.0943, test_f1: 0.4834
 epoch: 94, train_loss: 0.9558, test_loss: 1.0768, test_f1: 0.4314
 epoch: 95, train_loss: 0.9539, test_loss: 1.0649, test_f1: 0.5042
 epoch: 96, train_loss: 0.9436, test_loss: 1.0589, test_f1: 0.4257
 epoch: 97, train_loss: 0.9492, test_loss: 1.0795, test_f1: 0.5072
 epoch: 98, train_loss: 0.9463, test_loss: 1.0695, test_f1: 0.5211
 epoch: 99, train_loss: 0.9423, test_loss: 1.0739, test_f1: 0.5028
##################ITERATION #7 ****************************************
 epoch: 0, train_loss: 1.3862, test_loss: 12.4386, test_f1: 0.0793
 epoch: 1, train_loss: 1.0919, test_loss: 1.1736, test_f1: 0.3339
 epoch: 2, train_loss: 1.0896, test_loss: 1.0926, test_f1: 0.3695
 epoch: 3, train_loss: 1.0639, test_loss: 1.1617, test_f1: 0.3555
 epoch: 4, train_loss: 1.0662, test_loss: 1.1522, test_f1: 0.3624
 epoch: 5, train_loss: 1.0601, test_loss: 1.1608, test_f1: 0.3550
 epoch: 6, train_loss: 1.0511, test_loss: 1.1598, test_f1: 0.3605
 epoch: 7, train_loss: 1.0434, test_loss: 1.1775, test_f1: 0.3546
 epoch: 8, train_loss: 1.0586, test_loss: 1.1980, test_f1: 0.3479
 epoch: 9, train_loss: 1.0609, test_loss: 1.1620, test_f1: 0.3880
 epoch: 10, train_loss: 1.0486, test_loss: 1.0951, test_f1: 0.3892
 epoch: 11, train_loss: 1.0322, test_loss: 1.2105, test_f1: 0.3536
 epoch: 12, train_loss: 1.0407, test_loss: 1.1848, test_f1: 0.3239
 epoch: 13, train_loss: 1.0470, test_loss: 1.1868, test_f1: 0.3422
 epoch: 14, train_loss: 1.0292, test_loss: 1.0604, test_f1: 0.3493
 epoch: 15, train_loss: 1.0102, test_loss: 1.0084, test_f1: 0.3689
 epoch: 16, train_loss: 1.0162, test_loss: 1.1704, test_f1: 0.3980
 epoch: 17, train_loss: 1.0239, test_loss: 1.1744, test_f1: 0.3671
 epoch: 18, train_loss: 1.0395, test_loss: 1.1479, test_f1: 0.3425
 epoch: 19, train_loss: 1.0277, test_loss: 1.0488, test_f1: 0.3916
 epoch: 20, train_loss: 1.0149, test_loss: 1.3300, test_f1: 0.3395
 epoch: 21, train_loss: 1.0356, test_loss: 1.2765, test_f1: 0.3612
 epoch: 22, train_loss: 1.0201, test_loss: 1.1968, test_f1: 0.3432
 epoch: 23, train_loss: 1.0218, test_loss: 1.4599, test_f1: 0.3155
 epoch: 24, train_loss: 1.0333, test_loss: 1.1652, test_f1: 0.3814
 epoch: 25, train_loss: 1.0381, test_loss: 1.1418, test_f1: 0.3819
 epoch: 26, train_loss: 1.0369, test_loss: 1.1406, test_f1: 0.3370
 epoch: 27, train_loss: 1.0219, test_loss: 1.1019, test_f1: 0.3899
 epoch: 28, train_loss: 1.0206, test_loss: 1.1961, test_f1: 0.3724
 epoch: 29, train_loss: 1.0094, test_loss: 1.1514, test_f1: 0.3448
 epoch: 30, train_loss: 1.0130, test_loss: 1.0070, test_f1: 0.3828
 epoch: 31, train_loss: 1.0362, test_loss: 1.0511, test_f1: 0.3888
 epoch: 32, train_loss: 1.0262, test_loss: 1.1463, test_f1: 0.3422
 epoch: 33, train_loss: 1.0063, test_loss: 1.1200, test_f1: 0.3732
 epoch: 34, train_loss: 1.0064, test_loss: 1.1496, test_f1: 0.4989
 epoch: 35, train_loss: 1.0167, test_loss: 1.1339, test_f1: 0.3428
 epoch: 36, train_loss: 1.0296, test_loss: 1.1074, test_f1: 0.3984
 epoch: 37, train_loss: 1.0047, test_loss: 1.1047, test_f1: 0.3752
 epoch: 38, train_loss: 0.9939, test_loss: 1.1348, test_f1: 0.3511
 epoch: 39, train_loss: 1.0219, test_loss: 1.1528, test_f1: 0.4464
 epoch: 40, train_loss: 1.0247, test_loss: 1.1310, test_f1: 0.3762
 epoch: 41, train_loss: 1.0047, test_loss: 1.1332, test_f1: 0.3767
 epoch: 42, train_loss: 1.0155, test_loss: 1.1348, test_f1: 0.3519
 epoch: 43, train_loss: 1.0173, test_loss: 1.1198, test_f1: 0.3747
 epoch: 44, train_loss: 1.0309, test_loss: 1.1655, test_f1: 0.3639
 epoch: 45, train_loss: 1.0222, test_loss: 1.1082, test_f1: 0.4641
 epoch: 46, train_loss: 1.0053, test_loss: 1.1215, test_f1: 0.3591
 epoch: 47, train_loss: 1.0060, test_loss: 1.1052, test_f1: 0.3757
 epoch: 48, train_loss: 1.0038, test_loss: 1.1472, test_f1: 0.4482
 epoch: 49, train_loss: 1.0044, test_loss: 1.1269, test_f1: 0.4231
 epoch: 50, train_loss: 1.0234, test_loss: 1.1747, test_f1: 0.3479
 epoch: 51, train_loss: 1.0127, test_loss: 1.0970, test_f1: 0.4196
 epoch: 52, train_loss: 0.9913, test_loss: 1.0767, test_f1: 0.4304
 epoch: 53, train_loss: 0.9860, test_loss: 1.0740, test_f1: 0.4092
 epoch: 54, train_loss: 0.9862, test_loss: 1.1117, test_f1: 0.4262
 epoch: 55, train_loss: 0.9827, test_loss: 1.1274, test_f1: 0.4513
 epoch: 56, train_loss: 0.9858, test_loss: 1.0962, test_f1: 0.4329
 epoch: 57, train_loss: 0.9684, test_loss: 1.0715, test_f1: 0.4219
 epoch: 58, train_loss: 0.9758, test_loss: 1.0976, test_f1: 0.3855
 epoch: 59, train_loss: 0.9657, test_loss: 1.0690, test_f1: 0.4746
 epoch: 60, train_loss: 0.9719, test_loss: 1.0899, test_f1: 0.4535
 epoch: 61, train_loss: 0.9891, test_loss: 1.1040, test_f1: 0.4218
 epoch: 62, train_loss: 0.9780, test_loss: 1.1232, test_f1: 0.4372
 epoch: 63, train_loss: 0.9816, test_loss: 1.0865, test_f1: 0.4006
 epoch: 64, train_loss: 0.9735, test_loss: 1.0792, test_f1: 0.4390
 epoch: 65, train_loss: 0.9796, test_loss: 1.1672, test_f1: 0.4332
 epoch: 66, train_loss: 0.9815, test_loss: 1.1034, test_f1: 0.4407
 epoch: 67, train_loss: 0.9627, test_loss: 1.0783, test_f1: 0.4372
 epoch: 68, train_loss: 0.9624, test_loss: 1.0883, test_f1: 0.4104
 epoch: 69, train_loss: 0.9610, test_loss: 1.0658, test_f1: 0.4266
 epoch: 70, train_loss: 0.9610, test_loss: 1.0789, test_f1: 0.4440
 epoch: 71, train_loss: 0.9835, test_loss: 1.1004, test_f1: 0.4469
 epoch: 72, train_loss: 1.0068, test_loss: 1.0817, test_f1: 0.4550
 epoch: 73, train_loss: 0.9856, test_loss: 1.1278, test_f1: 0.4101
 epoch: 74, train_loss: 0.9765, test_loss: 1.0908, test_f1: 0.4533
 epoch: 75, train_loss: 0.9752, test_loss: 1.0886, test_f1: 0.4212
 epoch: 76, train_loss: 0.9766, test_loss: 1.0985, test_f1: 0.4236
 epoch: 77, train_loss: 0.9668, test_loss: 1.0679, test_f1: 0.4111
 epoch: 78, train_loss: 0.9643, test_loss: 1.1259, test_f1: 0.3932
 epoch: 79, train_loss: 1.0144, test_loss: 1.3576, test_f1: 0.4166
 epoch: 80, train_loss: 1.0094, test_loss: 1.3266, test_f1: 0.3919
 epoch: 81, train_loss: 0.9795, test_loss: 1.1098, test_f1: 0.4130
 epoch: 82, train_loss: 0.9797, test_loss: 1.1151, test_f1: 0.3900
 epoch: 83, train_loss: 0.9656, test_loss: 1.1342, test_f1: 0.4394
 epoch: 84, train_loss: 0.9748, test_loss: 1.0946, test_f1: 0.4579
 epoch: 85, train_loss: 0.9925, test_loss: 1.1383, test_f1: 0.4513
 epoch: 86, train_loss: 0.9770, test_loss: 1.1191, test_f1: 0.4215
 epoch: 87, train_loss: 0.9593, test_loss: 1.1469, test_f1: 0.4492
 epoch: 88, train_loss: 0.9604, test_loss: 1.1121, test_f1: 0.4496
 epoch: 89, train_loss: 0.9537, test_loss: 1.0982, test_f1: 0.4053
 epoch: 90, train_loss: 0.9455, test_loss: 1.1078, test_f1: 0.4657
 epoch: 91, train_loss: 0.9573, test_loss: 1.0806, test_f1: 0.4947
 epoch: 92, train_loss: 0.9629, test_loss: 1.0808, test_f1: 0.4999
 epoch: 93, train_loss: 0.9524, test_loss: 1.1021, test_f1: 0.4803
 epoch: 94, train_loss: 0.9626, test_loss: 1.0695, test_f1: 0.4987
 epoch: 95, train_loss: 0.9564, test_loss: 1.0936, test_f1: 0.4504
 epoch: 96, train_loss: 0.9565, test_loss: 1.0809, test_f1: 0.4413
 epoch: 97, train_loss: 0.9503, test_loss: 1.1112, test_f1: 0.4322
 epoch: 98, train_loss: 0.9442, test_loss: 1.1271, test_f1: 0.4645
 epoch: 99, train_loss: 0.9400, test_loss: 1.1264, test_f1: 0.4309
##################ITERATION #8 ****************************************
 epoch: 0, train_loss: 1.5348, test_loss: 1.3173, test_f1: 0.2320
 epoch: 1, train_loss: 1.1350, test_loss: 1.2775, test_f1: 0.3222
 epoch: 2, train_loss: 1.1189, test_loss: 1.1175, test_f1: 0.3438
 epoch: 3, train_loss: 1.1099, test_loss: 1.1637, test_f1: 0.3316
 epoch: 4, train_loss: 1.0954, test_loss: 1.2333, test_f1: 0.3508
 epoch: 5, train_loss: 1.0816, test_loss: 1.1953, test_f1: 0.3503
 epoch: 6, train_loss: 1.0934, test_loss: 1.0836, test_f1: 0.3514
 epoch: 7, train_loss: 1.0912, test_loss: 1.1552, test_f1: 0.3422
 epoch: 8, train_loss: 1.0750, test_loss: 1.2169, test_f1: 0.3464
 epoch: 9, train_loss: 1.0806, test_loss: 1.2216, test_f1: 0.3365
 epoch: 10, train_loss: 1.0782, test_loss: 1.2233, test_f1: 0.3093
 epoch: 11, train_loss: 1.0813, test_loss: 1.1404, test_f1: 0.3386
 epoch: 12, train_loss: 1.0697, test_loss: 1.2125, test_f1: 0.3526
 epoch: 13, train_loss: 1.0604, test_loss: 1.9114, test_f1: 0.2697
 epoch: 14, train_loss: 1.0578, test_loss: 1.7925, test_f1: 0.2907
 epoch: 15, train_loss: 1.0737, test_loss: 1.1734, test_f1: 0.3558
 epoch: 16, train_loss: 1.0621, test_loss: 1.1680, test_f1: 0.3420
 epoch: 17, train_loss: 1.0510, test_loss: 1.2402, test_f1: 0.3283
 epoch: 18, train_loss: 1.0368, test_loss: 1.1873, test_f1: 0.3425
 epoch: 19, train_loss: 1.0581, test_loss: 1.1283, test_f1: 0.3718
 epoch: 20, train_loss: 1.0442, test_loss: 1.1507, test_f1: 0.3469
 epoch: 21, train_loss: 1.0348, test_loss: 1.1458, test_f1: 0.3418
 epoch: 22, train_loss: 1.0197, test_loss: 1.1488, test_f1: 0.3389
 epoch: 23, train_loss: 1.0242, test_loss: 1.1174, test_f1: 0.4067
 epoch: 24, train_loss: 1.0274, test_loss: 1.7477, test_f1: 0.2940
 epoch: 25, train_loss: 1.0206, test_loss: 1.3722, test_f1: 0.3719
 epoch: 26, train_loss: 1.0298, test_loss: 1.1540, test_f1: 0.3402
 epoch: 27, train_loss: 1.0243, test_loss: 1.1761, test_f1: 0.3765
 epoch: 28, train_loss: 1.0384, test_loss: 1.1576, test_f1: 0.4975
 epoch: 29, train_loss: 1.0383, test_loss: 1.1311, test_f1: 0.4558
 epoch: 30, train_loss: 1.0225, test_loss: 1.1239, test_f1: 0.3416
 epoch: 31, train_loss: 1.0193, test_loss: 1.2286, test_f1: 0.3377
 epoch: 32, train_loss: 1.0099, test_loss: 1.2098, test_f1: 0.3986
 epoch: 33, train_loss: 1.0139, test_loss: 1.1701, test_f1: 0.3659
 epoch: 34, train_loss: 1.0281, test_loss: 1.1296, test_f1: 0.3665
 epoch: 35, train_loss: 1.0163, test_loss: 1.1297, test_f1: 0.3500
 epoch: 36, train_loss: 1.0367, test_loss: 1.1567, test_f1: 0.3475
 epoch: 37, train_loss: 1.0160, test_loss: 1.5966, test_f1: 0.2903
 epoch: 38, train_loss: 1.0157, test_loss: 1.1510, test_f1: 0.3685
 epoch: 39, train_loss: 1.0088, test_loss: 1.1494, test_f1: 0.3401
 epoch: 40, train_loss: 1.0046, test_loss: 1.1396, test_f1: 0.3434
 epoch: 41, train_loss: 1.0039, test_loss: 1.1147, test_f1: 0.3432
 epoch: 42, train_loss: 1.0056, test_loss: 1.3995, test_f1: 0.3562
 epoch: 43, train_loss: 1.0152, test_loss: 1.1185, test_f1: 0.3690
 epoch: 44, train_loss: 1.0005, test_loss: 1.1656, test_f1: 0.4295
 epoch: 45, train_loss: 1.0038, test_loss: 1.2276, test_f1: 0.4342
 epoch: 46, train_loss: 1.0372, test_loss: 1.1966, test_f1: 0.3936
 epoch: 47, train_loss: 1.0550, test_loss: 1.0723, test_f1: 0.3956
 epoch: 48, train_loss: 1.0447, test_loss: 1.2452, test_f1: 0.3422
 epoch: 49, train_loss: 1.0396, test_loss: 1.1669, test_f1: 0.3427
 epoch: 50, train_loss: 1.0423, test_loss: 1.1552, test_f1: 0.3414
 epoch: 51, train_loss: 1.0059, test_loss: 1.0892, test_f1: 0.3972
 epoch: 52, train_loss: 1.0009, test_loss: 1.1120, test_f1: 0.3489
 epoch: 53, train_loss: 1.0054, test_loss: 1.1523, test_f1: 0.3996
 epoch: 54, train_loss: 1.0089, test_loss: 1.1161, test_f1: 0.3882
 epoch: 55, train_loss: 1.0055, test_loss: 1.1153, test_f1: 0.3654
 epoch: 56, train_loss: 0.9886, test_loss: 1.0825, test_f1: 0.3977
 epoch: 57, train_loss: 0.9710, test_loss: 1.0904, test_f1: 0.3605
 epoch: 58, train_loss: 0.9823, test_loss: 1.0809, test_f1: 0.3636
 epoch: 59, train_loss: 0.9874, test_loss: 1.0683, test_f1: 0.3827
 epoch: 60, train_loss: 0.9816, test_loss: 1.1622, test_f1: 0.4148
 epoch: 61, train_loss: 0.9741, test_loss: 1.1264, test_f1: 0.3885
 epoch: 62, train_loss: 0.9765, test_loss: 1.0729, test_f1: 0.3609
 epoch: 63, train_loss: 0.9706, test_loss: 1.0917, test_f1: 0.3755
 epoch: 64, train_loss: 0.9747, test_loss: 1.1178, test_f1: 0.4075
 epoch: 65, train_loss: 0.9675, test_loss: 1.1997, test_f1: 0.3750
 epoch: 66, train_loss: 0.9822, test_loss: 1.0720, test_f1: 0.3609
 epoch: 67, train_loss: 0.9803, test_loss: 1.1231, test_f1: 0.3798
 epoch: 68, train_loss: 0.9718, test_loss: 1.0581, test_f1: 0.3780
 epoch: 69, train_loss: 0.9867, test_loss: 1.1441, test_f1: 0.3579
 epoch: 70, train_loss: 0.9775, test_loss: 1.0934, test_f1: 0.3591
 epoch: 71, train_loss: 0.9749, test_loss: 1.0819, test_f1: 0.3794
 epoch: 72, train_loss: 0.9742, test_loss: 1.1086, test_f1: 0.3496
 epoch: 73, train_loss: 0.9705, test_loss: 1.0763, test_f1: 0.3752
 epoch: 74, train_loss: 0.9638, test_loss: 1.0614, test_f1: 0.3769
 epoch: 75, train_loss: 0.9581, test_loss: 1.0783, test_f1: 0.3976
 epoch: 76, train_loss: 0.9712, test_loss: 1.1402, test_f1: 0.3483
 epoch: 77, train_loss: 0.9738, test_loss: 1.0852, test_f1: 0.3605
 epoch: 78, train_loss: 0.9626, test_loss: 1.0583, test_f1: 0.4683
 epoch: 79, train_loss: 0.9419, test_loss: 1.0603, test_f1: 0.4160
 epoch: 80, train_loss: 0.9669, test_loss: 1.5204, test_f1: 0.3402
 epoch: 81, train_loss: 0.9710, test_loss: 1.1482, test_f1: 0.4005
 epoch: 82, train_loss: 0.9720, test_loss: 1.1873, test_f1: 0.4519
 epoch: 83, train_loss: 0.9817, test_loss: 1.1129, test_f1: 0.4169
 epoch: 84, train_loss: 0.9704, test_loss: 1.0707, test_f1: 0.3835
 epoch: 85, train_loss: 0.9741, test_loss: 1.1417, test_f1: 0.3422
 epoch: 86, train_loss: 0.9768, test_loss: 1.0792, test_f1: 0.3510
 epoch: 87, train_loss: 0.9668, test_loss: 1.0501, test_f1: 0.3742
 epoch: 88, train_loss: 0.9598, test_loss: 1.0538, test_f1: 0.4708
 epoch: 89, train_loss: 0.9577, test_loss: 1.0696, test_f1: 0.4593
 epoch: 90, train_loss: 0.9499, test_loss: 1.0463, test_f1: 0.3754
 epoch: 91, train_loss: 0.9511, test_loss: 1.0934, test_f1: 0.3531
 epoch: 92, train_loss: 0.9558, test_loss: 1.1722, test_f1: 0.3690
 epoch: 93, train_loss: 0.9838, test_loss: 1.0938, test_f1: 0.4604
 epoch: 94, train_loss: 0.9797, test_loss: 1.1176, test_f1: 0.3448
 epoch: 95, train_loss: 0.9568, test_loss: 1.0541, test_f1: 0.3778
 epoch: 96, train_loss: 0.9634, test_loss: 1.0461, test_f1: 0.3688
 epoch: 97, train_loss: 0.9579, test_loss: 1.1341, test_f1: 0.4758
 epoch: 98, train_loss: 0.9548, test_loss: 1.1431, test_f1: 0.3533
 epoch: 99, train_loss: 0.9444, test_loss: 1.0878, test_f1: 0.4726
##################ITERATION #9 ****************************************
 epoch: 0, train_loss: 1.6243, test_loss: 10.2294, test_f1: 0.0808
 epoch: 1, train_loss: 1.1091, test_loss: 1.1190, test_f1: 0.3969
 epoch: 2, train_loss: 1.0812, test_loss: 1.0419, test_f1: 0.3780
 epoch: 3, train_loss: 1.0622, test_loss: 1.1330, test_f1: 0.3556
 epoch: 4, train_loss: 1.0677, test_loss: 1.1341, test_f1: 0.3603
 epoch: 5, train_loss: 1.0527, test_loss: 1.1888, test_f1: 0.3673
 epoch: 6, train_loss: 1.0526, test_loss: 1.1287, test_f1: 0.3422
 epoch: 7, train_loss: 1.0590, test_loss: 1.1344, test_f1: 0.3559
 epoch: 8, train_loss: 1.0524, test_loss: 1.1382, test_f1: 0.3431
 epoch: 9, train_loss: 1.0442, test_loss: 1.1378, test_f1: 0.3431
 epoch: 10, train_loss: 1.0432, test_loss: 1.0635, test_f1: 0.3422
 epoch: 11, train_loss: 1.0568, test_loss: 1.0747, test_f1: 0.3519
 epoch: 12, train_loss: 1.0477, test_loss: 1.0339, test_f1: 0.3774
 epoch: 13, train_loss: 1.0457, test_loss: 1.1794, test_f1: 0.3423
 epoch: 14, train_loss: 1.0671, test_loss: 1.1379, test_f1: 0.3457
 epoch: 15, train_loss: 1.0616, test_loss: 1.0421, test_f1: 0.3403
 epoch: 16, train_loss: 1.0462, test_loss: 1.0612, test_f1: 0.3586
 epoch: 17, train_loss: 1.0527, test_loss: 1.1313, test_f1: 0.3422
 epoch: 18, train_loss: 1.0522, test_loss: 1.1286, test_f1: 0.3459
 epoch: 19, train_loss: 1.0382, test_loss: 1.1083, test_f1: 0.3696
 epoch: 20, train_loss: 1.0342, test_loss: 1.1171, test_f1: 0.3594
 epoch: 21, train_loss: 1.0427, test_loss: 1.1153, test_f1: 0.3552
 epoch: 22, train_loss: 1.0313, test_loss: 1.4159, test_f1: 0.2955
 epoch: 23, train_loss: 1.0370, test_loss: 1.1390, test_f1: 0.3548
 epoch: 24, train_loss: 1.0137, test_loss: 1.1094, test_f1: 0.4691
 epoch: 25, train_loss: 1.0986, test_loss: 1.1016, test_f1: 0.3767
 epoch: 26, train_loss: 1.0701, test_loss: 1.1182, test_f1: 0.3554
 epoch: 27, train_loss: 1.0401, test_loss: 1.1577, test_f1: 0.3403
 epoch: 28, train_loss: 1.0454, test_loss: 1.1854, test_f1: 0.3639
 epoch: 29, train_loss: 1.0298, test_loss: 1.1095, test_f1: 0.4390
 epoch: 30, train_loss: 1.0297, test_loss: 1.1035, test_f1: 0.3465
 epoch: 31, train_loss: 1.0460, test_loss: 1.0849, test_f1: 0.3595
 epoch: 32, train_loss: 1.0400, test_loss: 1.1300, test_f1: 0.3486
 epoch: 33, train_loss: 1.0314, test_loss: 1.1302, test_f1: 0.3422
 epoch: 34, train_loss: 1.0235, test_loss: 1.1045, test_f1: 0.3479
 epoch: 35, train_loss: 1.0373, test_loss: 1.1230, test_f1: 0.3460
 epoch: 36, train_loss: 1.0144, test_loss: 1.1029, test_f1: 0.3549
 epoch: 37, train_loss: 1.0223, test_loss: 1.0452, test_f1: 0.3593
 epoch: 38, train_loss: 1.0315, test_loss: 1.1129, test_f1: 0.3644
 epoch: 39, train_loss: 1.0236, test_loss: 1.0676, test_f1: 0.3569
 epoch: 40, train_loss: 1.0041, test_loss: 1.1168, test_f1: 0.4195
 epoch: 41, train_loss: 0.9944, test_loss: 1.0872, test_f1: 0.4387
 epoch: 42, train_loss: 0.9954, test_loss: 1.1254, test_f1: 0.3457
 epoch: 43, train_loss: 0.9997, test_loss: 1.0789, test_f1: 0.4632
 epoch: 44, train_loss: 0.9914, test_loss: 1.1491, test_f1: 0.3474
 epoch: 45, train_loss: 1.0056, test_loss: 1.1214, test_f1: 0.4704
 epoch: 46, train_loss: 1.0115, test_loss: 1.0635, test_f1: 0.4295
 epoch: 47, train_loss: 1.0196, test_loss: 1.1484, test_f1: 0.4647
 epoch: 48, train_loss: 1.0040, test_loss: 0.9817, test_f1: 0.4182
 epoch: 49, train_loss: 1.0008, test_loss: 1.0814, test_f1: 0.4036
 epoch: 50, train_loss: 1.0174, test_loss: 1.1745, test_f1: 0.3519
 epoch: 51, train_loss: 1.0129, test_loss: 1.1114, test_f1: 0.3481
 epoch: 52, train_loss: 0.9891, test_loss: 1.1083, test_f1: 0.4233
 epoch: 53, train_loss: 0.9858, test_loss: 1.0872, test_f1: 0.3814
 epoch: 54, train_loss: 0.9856, test_loss: 1.0796, test_f1: 0.4132
 epoch: 55, train_loss: 0.9811, test_loss: 1.0881, test_f1: 0.4354
 epoch: 56, train_loss: 0.9926, test_loss: 1.0762, test_f1: 0.4063
 epoch: 57, train_loss: 0.9891, test_loss: 1.0993, test_f1: 0.4037
 epoch: 58, train_loss: 0.9819, test_loss: 1.0878, test_f1: 0.4832
 epoch: 59, train_loss: 0.9798, test_loss: 1.0658, test_f1: 0.4286
 epoch: 60, train_loss: 0.9732, test_loss: 1.0795, test_f1: 0.3958
 epoch: 61, train_loss: 0.9705, test_loss: 1.0682, test_f1: 0.4201
 epoch: 62, train_loss: 0.9730, test_loss: 1.0774, test_f1: 0.4324
 epoch: 63, train_loss: 0.9755, test_loss: 1.0601, test_f1: 0.4352
 epoch: 64, train_loss: 0.9696, test_loss: 1.0421, test_f1: 0.4326
 epoch: 65, train_loss: 0.9762, test_loss: 1.0611, test_f1: 0.4028
 epoch: 66, train_loss: 0.9645, test_loss: 1.0796, test_f1: 0.4346
 epoch: 67, train_loss: 0.9753, test_loss: 1.0924, test_f1: 0.3826
 epoch: 68, train_loss: 0.9754, test_loss: 1.0336, test_f1: 0.4136
 epoch: 69, train_loss: 0.9786, test_loss: 1.0681, test_f1: 0.4156
 epoch: 70, train_loss: 0.9847, test_loss: 1.0940, test_f1: 0.4389
 epoch: 71, train_loss: 0.9709, test_loss: 1.0837, test_f1: 0.5175
 epoch: 72, train_loss: 0.9758, test_loss: 1.0956, test_f1: 0.4558
 epoch: 73, train_loss: 0.9716, test_loss: 1.0559, test_f1: 0.4495
 epoch: 74, train_loss: 0.9669, test_loss: 1.0734, test_f1: 0.5083
 epoch: 75, train_loss: 0.9763, test_loss: 1.0831, test_f1: 0.4269
 epoch: 76, train_loss: 0.9712, test_loss: 1.0655, test_f1: 0.4545
 epoch: 77, train_loss: 0.9588, test_loss: 1.0774, test_f1: 0.4574
 epoch: 78, train_loss: 0.9567, test_loss: 1.0651, test_f1: 0.5260
 epoch: 79, train_loss: 0.9550, test_loss: 1.1041, test_f1: 0.4890
 epoch: 80, train_loss: 0.9756, test_loss: 1.0731, test_f1: 0.5138
 epoch: 81, train_loss: 0.9677, test_loss: 1.0924, test_f1: 0.4758
 epoch: 82, train_loss: 0.9620, test_loss: 1.0742, test_f1: 0.4790
 epoch: 83, train_loss: 0.9617, test_loss: 0.9889, test_f1: 0.4911
 epoch: 84, train_loss: 0.9749, test_loss: 1.0612, test_f1: 0.5086
 epoch: 85, train_loss: 0.9582, test_loss: 1.0849, test_f1: 0.4769
 epoch: 86, train_loss: 0.9538, test_loss: 1.0709, test_f1: 0.4677
 epoch: 87, train_loss: 0.9598, test_loss: 1.0720, test_f1: 0.4265
 epoch: 88, train_loss: 0.9719, test_loss: 1.0914, test_f1: 0.5000
 epoch: 89, train_loss: 0.9632, test_loss: 1.0778, test_f1: 0.4303
 epoch: 90, train_loss: 0.9560, test_loss: 1.0881, test_f1: 0.4370
 epoch: 91, train_loss: 0.9522, test_loss: 1.0981, test_f1: 0.4468
 epoch: 92, train_loss: 0.9628, test_loss: 1.0972, test_f1: 0.4703
 epoch: 93, train_loss: 0.9517, test_loss: 1.0930, test_f1: 0.4364
 epoch: 94, train_loss: 0.9452, test_loss: 1.0926, test_f1: 0.4178
 epoch: 95, train_loss: 0.9476, test_loss: 1.0762, test_f1: 0.5122
 epoch: 96, train_loss: 0.9412, test_loss: 1.0583, test_f1: 0.4570
 epoch: 97, train_loss: 0.9565, test_loss: 1.0728, test_f1: 0.4613
 epoch: 98, train_loss: 0.9567, test_loss: 1.1175, test_f1: 0.4542
 epoch: 99, train_loss: 0.9549, test_loss: 1.1103, test_f1: 0.4717

Training completed in 415.02 seconds
Best F1: 0.5345 at epoch 80
Mean F1 across iterations: 0.4911  0.0520
========================FINAL RESULTS================================
FEGIN weighted F1: 0.5345  0.0520
python main.py --data ltspice_examples --representation component_pin_net --model FEGIN --layers 3 --hiddens 32 --batch_size 256 --lr 0.1 --emb_size 128 --epochs 100 --save_appendix component_pin_net_L3_H32_BS256_LR0.1_E128 --no_val
-----



STDERR:
  File "main.py", line 370, in <module>
    main()
  File "main.py", line 254, in main
    dataset = dataset_class(
  File "/home/philip/projects/ltspice_examples_code_repo/Circuit-Completion-Using-GNNs/component_classification_with_link_prediction_head/evaluation/FEGIN/kernel/circuit_datasets.py", line 15, in __init__
    self.data, self.slices = torch.load(self.processed_paths[0])
  File "/home/philip/.local/lib/python3.8/site-packages/torch/serialization.py", line 1040, in load
    warnings.warn(
  File "/usr/lib/python3.8/warnings.py", line 109, in _showwarnmsg
    sw(msg.message, msg.category, msg.filename, msg.lineno,
  File "main.py", line 47, in warn_with_traceback
    traceback.print_stack(file=log)
/home/philip/projects/ltspice_examples_code_repo/Circuit-Completion-Using-GNNs/component_classification_with_link_prediction_head/evaluation/FEGIN/kernel/circuit_datasets.py:15: FutureWarning: You are using `torch.load` with `weights_only=False` (the current default value), which uses the default pickle module implicitly. It is possible to construct malicious pickle data which will execute arbitrary code during unpickling (See https://github.com/pytorch/pytorch/blob/main/SECURITY.md#untrusted-models for more details). In a future release, the default value for `weights_only` will be flipped to `True`. This limits the functions that could be executed during unpickling. Arbitrary objects will no longer be allowed to be loaded via this mode unless they are explicitly allowlisted by the user via `torch.serialization.add_safe_globals`. We recommend you start setting `weights_only=True` for any use case where you don't have full control of the loaded file. Please open an issue on GitHub for any issues related to this experimental feature.
  self.data, self.slices = torch.load(self.processed_paths[0])
