STDOUT:
Results will be saved in /home/philip/projects/ltspice_examples_code_repo/Circuit-Completion-Using-GNNs/component_classification_with_link_prediction_head/evaluation/FEGIN/results/model_FEGIN_dataset_ltspice_examples
Command line input: python main.py --data ltspice_examples --representation component_pin --model FEGIN --layers 6 --hiddens 64 --batch_size 128 --lr 0.0001 --emb_size 250 --epochs 100 --save_appendix component_pin_L6_H64_BS128_LR0.0001_E250 --no_val
 is saved.
-----
ltspice_examples - FEGIN
Using 6 layers, 64 hidden units, h = 2
Loading component_pin representation dataset
ENTERED
Training FEGIN on component_pin representation
Train: 3560, Test: 848
##################ITERATION #0 ****************************************
 epoch: 0, train_loss: 1.3881, test_loss: 1.3844, test_f1: 0.1706
 epoch: 1, train_loss: 1.3701, test_loss: 1.3740, test_f1: 0.3259
 epoch: 2, train_loss: 1.3519, test_loss: 1.3471, test_f1: 0.2458
 epoch: 3, train_loss: 1.3259, test_loss: 1.3152, test_f1: 0.2260
 epoch: 4, train_loss: 1.2955, test_loss: 1.2818, test_f1: 0.2260
 epoch: 5, train_loss: 1.2689, test_loss: 1.2555, test_f1: 0.2260
 epoch: 6, train_loss: 1.2465, test_loss: 1.2323, test_f1: 0.2260
 epoch: 7, train_loss: 1.2298, test_loss: 1.2118, test_f1: 0.2260
 epoch: 8, train_loss: 1.2122, test_loss: 1.1907, test_f1: 0.2260
 epoch: 9, train_loss: 1.2008, test_loss: 1.1749, test_f1: 0.2335
 epoch: 10, train_loss: 1.1859, test_loss: 1.1610, test_f1: 0.3349
 epoch: 11, train_loss: 1.1712, test_loss: 1.1481, test_f1: 0.3494
 epoch: 12, train_loss: 1.1527, test_loss: 1.1295, test_f1: 0.3499
 epoch: 13, train_loss: 1.1338, test_loss: 1.1132, test_f1: 0.3570
 epoch: 14, train_loss: 1.1133, test_loss: 1.1017, test_f1: 0.3885
 epoch: 15, train_loss: 1.0917, test_loss: 1.0759, test_f1: 0.4074
 epoch: 16, train_loss: 1.0736, test_loss: 1.0562, test_f1: 0.4318
 epoch: 17, train_loss: 1.0477, test_loss: 1.0493, test_f1: 0.4557
 epoch: 18, train_loss: 1.0321, test_loss: 1.0266, test_f1: 0.4561
 epoch: 19, train_loss: 1.0160, test_loss: 1.0206, test_f1: 0.4251
 epoch: 20, train_loss: 1.0032, test_loss: 1.0169, test_f1: 0.4501
 epoch: 21, train_loss: 1.0042, test_loss: 1.0123, test_f1: 0.4301
 epoch: 22, train_loss: 0.9924, test_loss: 1.0226, test_f1: 0.4270
 epoch: 23, train_loss: 0.9858, test_loss: 1.0184, test_f1: 0.4569
 epoch: 24, train_loss: 0.9751, test_loss: 1.0222, test_f1: 0.4425
 epoch: 25, train_loss: 0.9687, test_loss: 1.0151, test_f1: 0.4855
 epoch: 26, train_loss: 0.9636, test_loss: 1.0075, test_f1: 0.4697
 epoch: 27, train_loss: 0.9633, test_loss: 0.9988, test_f1: 0.4600
 epoch: 28, train_loss: 0.9516, test_loss: 1.0127, test_f1: 0.4675
 epoch: 29, train_loss: 0.9427, test_loss: 0.9937, test_f1: 0.4562
 epoch: 30, train_loss: 0.9429, test_loss: 0.9944, test_f1: 0.4568
 epoch: 31, train_loss: 0.9421, test_loss: 0.9879, test_f1: 0.4787
 epoch: 32, train_loss: 0.9345, test_loss: 1.0016, test_f1: 0.4559
 epoch: 33, train_loss: 0.9255, test_loss: 0.9679, test_f1: 0.4882
 epoch: 34, train_loss: 0.9316, test_loss: 1.0017, test_f1: 0.5049
 epoch: 35, train_loss: 0.9299, test_loss: 1.0010, test_f1: 0.5137
 epoch: 36, train_loss: 0.9210, test_loss: 1.0109, test_f1: 0.5004
 epoch: 37, train_loss: 0.9179, test_loss: 0.9664, test_f1: 0.5015
 epoch: 38, train_loss: 0.9144, test_loss: 0.9652, test_f1: 0.5128
 epoch: 39, train_loss: 0.9113, test_loss: 0.9638, test_f1: 0.5160
 epoch: 40, train_loss: 0.9085, test_loss: 0.9694, test_f1: 0.5171
 epoch: 41, train_loss: 0.8999, test_loss: 0.9535, test_f1: 0.5175
 epoch: 42, train_loss: 0.9066, test_loss: 0.9533, test_f1: 0.5193
 epoch: 43, train_loss: 0.8884, test_loss: 0.9473, test_f1: 0.5017
 epoch: 44, train_loss: 0.8922, test_loss: 0.9542, test_f1: 0.5105
 epoch: 45, train_loss: 0.8721, test_loss: 0.9488, test_f1: 0.5257
 epoch: 46, train_loss: 0.8850, test_loss: 0.9200, test_f1: 0.5244
 epoch: 47, train_loss: 0.8718, test_loss: 0.9248, test_f1: 0.5211
 epoch: 48, train_loss: 0.8682, test_loss: 0.9388, test_f1: 0.5188
 epoch: 49, train_loss: 0.8700, test_loss: 0.9389, test_f1: 0.5327
 epoch: 50, train_loss: 0.8657, test_loss: 0.9168, test_f1: 0.5322
 epoch: 51, train_loss: 0.8581, test_loss: 0.9227, test_f1: 0.5264
 epoch: 52, train_loss: 0.8499, test_loss: 0.9302, test_f1: 0.5276
 epoch: 53, train_loss: 0.8472, test_loss: 0.8954, test_f1: 0.5499
 epoch: 54, train_loss: 0.8349, test_loss: 0.9233, test_f1: 0.5208
 epoch: 55, train_loss: 0.8399, test_loss: 0.8929, test_f1: 0.5416
 epoch: 56, train_loss: 0.8370, test_loss: 0.8930, test_f1: 0.5376
 epoch: 57, train_loss: 0.8433, test_loss: 0.8922, test_f1: 0.5407
 epoch: 58, train_loss: 0.8361, test_loss: 0.9048, test_f1: 0.5239
 epoch: 59, train_loss: 0.8228, test_loss: 0.8889, test_f1: 0.5389
 epoch: 60, train_loss: 0.8249, test_loss: 0.8930, test_f1: 0.5466
 epoch: 61, train_loss: 0.8180, test_loss: 0.8980, test_f1: 0.5534
 epoch: 62, train_loss: 0.8157, test_loss: 0.9124, test_f1: 0.5272
 epoch: 63, train_loss: 0.8164, test_loss: 0.9121, test_f1: 0.5334
 epoch: 64, train_loss: 0.8251, test_loss: 0.8877, test_f1: 0.5351
 epoch: 65, train_loss: 0.8118, test_loss: 0.9084, test_f1: 0.5284
 epoch: 66, train_loss: 0.8110, test_loss: 0.8999, test_f1: 0.5349
 epoch: 67, train_loss: 0.8078, test_loss: 0.9161, test_f1: 0.5314
 epoch: 68, train_loss: 0.8177, test_loss: 0.8895, test_f1: 0.5476
 epoch: 69, train_loss: 0.8085, test_loss: 0.8981, test_f1: 0.5506
 epoch: 70, train_loss: 0.7957, test_loss: 0.8998, test_f1: 0.5341
 epoch: 71, train_loss: 0.8098, test_loss: 0.9028, test_f1: 0.5360
 epoch: 72, train_loss: 0.7993, test_loss: 0.9117, test_f1: 0.5335
 epoch: 73, train_loss: 0.7968, test_loss: 0.8831, test_f1: 0.5550
 epoch: 74, train_loss: 0.7934, test_loss: 0.9225, test_f1: 0.5322
 epoch: 75, train_loss: 0.7883, test_loss: 0.8698, test_f1: 0.5510
 epoch: 76, train_loss: 0.7822, test_loss: 0.9010, test_f1: 0.5401
 epoch: 77, train_loss: 0.7779, test_loss: 0.8907, test_f1: 0.5445
 epoch: 78, train_loss: 0.7870, test_loss: 0.9095, test_f1: 0.5268
 epoch: 79, train_loss: 0.7893, test_loss: 0.9123, test_f1: 0.5335
 epoch: 80, train_loss: 0.7903, test_loss: 0.9023, test_f1: 0.5353
 epoch: 81, train_loss: 0.7809, test_loss: 0.9127, test_f1: 0.5247
 epoch: 82, train_loss: 0.7811, test_loss: 0.8693, test_f1: 0.5549
 epoch: 83, train_loss: 0.7760, test_loss: 0.8962, test_f1: 0.5429
 epoch: 84, train_loss: 0.7717, test_loss: 0.8984, test_f1: 0.5368
 epoch: 85, train_loss: 0.7698, test_loss: 0.8986, test_f1: 0.5429
 epoch: 86, train_loss: 0.7700, test_loss: 0.9009, test_f1: 0.5346
 epoch: 87, train_loss: 0.7578, test_loss: 0.8865, test_f1: 0.5453
 epoch: 88, train_loss: 0.7601, test_loss: 0.8778, test_f1: 0.5500
 epoch: 89, train_loss: 0.7565, test_loss: 0.8925, test_f1: 0.5517
 epoch: 90, train_loss: 0.7577, test_loss: 0.8967, test_f1: 0.5410
 epoch: 91, train_loss: 0.7617, test_loss: 0.8790, test_f1: 0.5561
 epoch: 92, train_loss: 0.7489, test_loss: 0.8917, test_f1: 0.5426
 epoch: 93, train_loss: 0.7511, test_loss: 0.9047, test_f1: 0.5279
 epoch: 94, train_loss: 0.7519, test_loss: 0.8738, test_f1: 0.5560
 epoch: 95, train_loss: 0.7494, test_loss: 0.9241, test_f1: 0.5295
 epoch: 96, train_loss: 0.7414, test_loss: 0.9079, test_f1: 0.5338
 epoch: 97, train_loss: 0.7524, test_loss: 0.8838, test_f1: 0.5542
 epoch: 98, train_loss: 0.7449, test_loss: 0.9256, test_f1: 0.5351
 epoch: 99, train_loss: 0.7445, test_loss: 0.8832, test_f1: 0.5653
##################ITERATION #1 ****************************************
 epoch: 0, train_loss: 1.3546, test_loss: 1.3581, test_f1: 0.2570
 epoch: 1, train_loss: 1.3119, test_loss: 1.3428, test_f1: 0.2260
 epoch: 2, train_loss: 1.2786, test_loss: 1.2681, test_f1: 0.2496
 epoch: 3, train_loss: 1.2436, test_loss: 1.2184, test_f1: 0.3340
 epoch: 4, train_loss: 1.2070, test_loss: 1.1803, test_f1: 0.3355
 epoch: 5, train_loss: 1.1762, test_loss: 1.1415, test_f1: 0.3400
 epoch: 6, train_loss: 1.1449, test_loss: 1.1141, test_f1: 0.3378
 epoch: 7, train_loss: 1.1115, test_loss: 1.0912, test_f1: 0.3374
 epoch: 8, train_loss: 1.0898, test_loss: 1.0762, test_f1: 0.3460
 epoch: 9, train_loss: 1.0619, test_loss: 1.0713, test_f1: 0.3463
 epoch: 10, train_loss: 1.0445, test_loss: 1.0528, test_f1: 0.4178
 epoch: 11, train_loss: 1.0316, test_loss: 1.0437, test_f1: 0.4031
 epoch: 12, train_loss: 1.0270, test_loss: 1.0457, test_f1: 0.4315
 epoch: 13, train_loss: 1.0069, test_loss: 1.0407, test_f1: 0.4504
 epoch: 14, train_loss: 1.0032, test_loss: 1.0421, test_f1: 0.4629
 epoch: 15, train_loss: 0.9912, test_loss: 1.0216, test_f1: 0.4848
 epoch: 16, train_loss: 0.9832, test_loss: 1.0207, test_f1: 0.4681
 epoch: 17, train_loss: 0.9710, test_loss: 1.0156, test_f1: 0.4705
 epoch: 18, train_loss: 0.9751, test_loss: 1.0148, test_f1: 0.4915
 epoch: 19, train_loss: 0.9542, test_loss: 1.0088, test_f1: 0.4893
 epoch: 20, train_loss: 0.9565, test_loss: 0.9989, test_f1: 0.4831
 epoch: 21, train_loss: 0.9416, test_loss: 0.9927, test_f1: 0.4914
 epoch: 22, train_loss: 0.9398, test_loss: 0.9956, test_f1: 0.5175
 epoch: 23, train_loss: 0.9332, test_loss: 1.0006, test_f1: 0.4913
 epoch: 24, train_loss: 0.9244, test_loss: 0.9816, test_f1: 0.5022
 epoch: 25, train_loss: 0.9201, test_loss: 0.9961, test_f1: 0.4783
 epoch: 26, train_loss: 0.9111, test_loss: 0.9923, test_f1: 0.4969
 epoch: 27, train_loss: 0.9060, test_loss: 0.9764, test_f1: 0.5128
 epoch: 28, train_loss: 0.8975, test_loss: 0.9872, test_f1: 0.4753
 epoch: 29, train_loss: 0.8887, test_loss: 0.9861, test_f1: 0.5062
 epoch: 30, train_loss: 0.8840, test_loss: 0.9802, test_f1: 0.4948
 epoch: 31, train_loss: 0.8875, test_loss: 0.9862, test_f1: 0.5053
 epoch: 32, train_loss: 0.8820, test_loss: 0.9765, test_f1: 0.5180
 epoch: 33, train_loss: 0.8705, test_loss: 0.9834, test_f1: 0.5072
 epoch: 34, train_loss: 0.8618, test_loss: 0.9702, test_f1: 0.5169
 epoch: 35, train_loss: 0.8586, test_loss: 0.9875, test_f1: 0.4954
 epoch: 36, train_loss: 0.8546, test_loss: 0.9872, test_f1: 0.5077
 epoch: 37, train_loss: 0.8399, test_loss: 0.9780, test_f1: 0.5075
 epoch: 38, train_loss: 0.8412, test_loss: 0.9792, test_f1: 0.5112
 epoch: 39, train_loss: 0.8325, test_loss: 0.9770, test_f1: 0.4972
 epoch: 40, train_loss: 0.8291, test_loss: 0.9722, test_f1: 0.5281
 epoch: 41, train_loss: 0.8185, test_loss: 0.9608, test_f1: 0.5249
 epoch: 42, train_loss: 0.8129, test_loss: 0.9786, test_f1: 0.5109
 epoch: 43, train_loss: 0.8051, test_loss: 0.9571, test_f1: 0.5219
 epoch: 44, train_loss: 0.8023, test_loss: 0.9693, test_f1: 0.5152
 epoch: 45, train_loss: 0.7918, test_loss: 0.9731, test_f1: 0.5275
 epoch: 46, train_loss: 0.7979, test_loss: 0.9577, test_f1: 0.5292
 epoch: 47, train_loss: 0.7869, test_loss: 0.9485, test_f1: 0.5450
 epoch: 48, train_loss: 0.7820, test_loss: 0.9543, test_f1: 0.5374
 epoch: 49, train_loss: 0.7704, test_loss: 0.9508, test_f1: 0.5271
 epoch: 50, train_loss: 0.7627, test_loss: 0.9748, test_f1: 0.5231
 epoch: 51, train_loss: 0.7591, test_loss: 0.9569, test_f1: 0.5377
 epoch: 52, train_loss: 0.7593, test_loss: 0.9752, test_f1: 0.5332
 epoch: 53, train_loss: 0.7535, test_loss: 0.9703, test_f1: 0.5388
 epoch: 54, train_loss: 0.7459, test_loss: 0.9707, test_f1: 0.5419
 epoch: 55, train_loss: 0.7385, test_loss: 0.9647, test_f1: 0.5442
 epoch: 56, train_loss: 0.7400, test_loss: 0.9775, test_f1: 0.5338
 epoch: 57, train_loss: 0.7361, test_loss: 0.9540, test_f1: 0.5413
 epoch: 58, train_loss: 0.7342, test_loss: 0.9675, test_f1: 0.5388
 epoch: 59, train_loss: 0.7350, test_loss: 0.9624, test_f1: 0.5331
 epoch: 60, train_loss: 0.7311, test_loss: 0.9700, test_f1: 0.5410
 epoch: 61, train_loss: 0.7284, test_loss: 0.9648, test_f1: 0.5455
 epoch: 62, train_loss: 0.7301, test_loss: 0.9656, test_f1: 0.5293
 epoch: 63, train_loss: 0.7312, test_loss: 0.9751, test_f1: 0.5453
 epoch: 64, train_loss: 0.7228, test_loss: 0.9616, test_f1: 0.5421
 epoch: 65, train_loss: 0.7246, test_loss: 0.9595, test_f1: 0.5512
 epoch: 66, train_loss: 0.7147, test_loss: 0.9645, test_f1: 0.5566
 epoch: 67, train_loss: 0.7076, test_loss: 0.9646, test_f1: 0.5522
 epoch: 68, train_loss: 0.7134, test_loss: 0.9848, test_f1: 0.5425
 epoch: 69, train_loss: 0.7162, test_loss: 0.9633, test_f1: 0.5401
 epoch: 70, train_loss: 0.7128, test_loss: 0.9767, test_f1: 0.5523
 epoch: 71, train_loss: 0.6970, test_loss: 0.9831, test_f1: 0.5283
 epoch: 72, train_loss: 0.7138, test_loss: 0.9890, test_f1: 0.5369
 epoch: 73, train_loss: 0.7074, test_loss: 0.9753, test_f1: 0.5494
 epoch: 74, train_loss: 0.6957, test_loss: 0.9616, test_f1: 0.5384
 epoch: 75, train_loss: 0.7028, test_loss: 0.9665, test_f1: 0.5388
 epoch: 76, train_loss: 0.7145, test_loss: 0.9694, test_f1: 0.5384
 epoch: 77, train_loss: 0.6945, test_loss: 0.9734, test_f1: 0.5313
 epoch: 78, train_loss: 0.6742, test_loss: 0.9915, test_f1: 0.5295
 epoch: 79, train_loss: 0.6819, test_loss: 0.9875, test_f1: 0.5263
 epoch: 80, train_loss: 0.6924, test_loss: 0.9952, test_f1: 0.5233
 epoch: 81, train_loss: 0.6939, test_loss: 0.9883, test_f1: 0.5407
 epoch: 82, train_loss: 0.6776, test_loss: 0.9788, test_f1: 0.5466
 epoch: 83, train_loss: 0.6769, test_loss: 0.9698, test_f1: 0.5374
 epoch: 84, train_loss: 0.6796, test_loss: 0.9820, test_f1: 0.5551
 epoch: 85, train_loss: 0.6820, test_loss: 0.9978, test_f1: 0.5180
 epoch: 86, train_loss: 0.6791, test_loss: 1.0031, test_f1: 0.5284
 epoch: 87, train_loss: 0.6833, test_loss: 0.9810, test_f1: 0.5464
 epoch: 88, train_loss: 0.6739, test_loss: 0.9955, test_f1: 0.5285
 epoch: 89, train_loss: 0.6643, test_loss: 0.9995, test_f1: 0.5370
 epoch: 90, train_loss: 0.6771, test_loss: 1.0051, test_f1: 0.5304
 epoch: 91, train_loss: 0.6570, test_loss: 0.9974, test_f1: 0.5377
 epoch: 92, train_loss: 0.6585, test_loss: 1.0049, test_f1: 0.5309
 epoch: 93, train_loss: 0.6635, test_loss: 1.0102, test_f1: 0.5200
 epoch: 94, train_loss: 0.6775, test_loss: 1.0036, test_f1: 0.5355
 epoch: 95, train_loss: 0.6621, test_loss: 1.0085, test_f1: 0.5413
 epoch: 96, train_loss: 0.6710, test_loss: 1.0065, test_f1: 0.5332
 epoch: 97, train_loss: 0.6639, test_loss: 0.9970, test_f1: 0.5401
 epoch: 98, train_loss: 0.6627, test_loss: 1.0050, test_f1: 0.5296
 epoch: 99, train_loss: 0.6588, test_loss: 1.0111, test_f1: 0.5320
##################ITERATION #2 ****************************************
 epoch: 0, train_loss: 1.3280, test_loss: 1.3436, test_f1: 0.2260
 epoch: 1, train_loss: 1.2852, test_loss: 1.2965, test_f1: 0.2680
 epoch: 2, train_loss: 1.2525, test_loss: 1.2298, test_f1: 0.3817
 epoch: 3, train_loss: 1.2164, test_loss: 1.1831, test_f1: 0.4107
 epoch: 4, train_loss: 1.1835, test_loss: 1.1459, test_f1: 0.4120
 epoch: 5, train_loss: 1.1486, test_loss: 1.1084, test_f1: 0.4341
 epoch: 6, train_loss: 1.1152, test_loss: 1.0815, test_f1: 0.4280
 epoch: 7, train_loss: 1.0877, test_loss: 1.0639, test_f1: 0.4258
 epoch: 8, train_loss: 1.0581, test_loss: 1.0441, test_f1: 0.4348
 epoch: 9, train_loss: 1.0450, test_loss: 1.0346, test_f1: 0.4403
 epoch: 10, train_loss: 1.0280, test_loss: 1.0175, test_f1: 0.4459
 epoch: 11, train_loss: 1.0218, test_loss: 1.0168, test_f1: 0.4493
 epoch: 12, train_loss: 1.0006, test_loss: 1.0063, test_f1: 0.4465
 epoch: 13, train_loss: 0.9908, test_loss: 1.0027, test_f1: 0.4742
 epoch: 14, train_loss: 0.9794, test_loss: 0.9848, test_f1: 0.4766
 epoch: 15, train_loss: 0.9688, test_loss: 0.9838, test_f1: 0.4784
 epoch: 16, train_loss: 0.9584, test_loss: 0.9938, test_f1: 0.4811
 epoch: 17, train_loss: 0.9462, test_loss: 0.9736, test_f1: 0.4945
 epoch: 18, train_loss: 0.9396, test_loss: 0.9730, test_f1: 0.4847
 epoch: 19, train_loss: 0.9411, test_loss: 0.9647, test_f1: 0.4882
 epoch: 20, train_loss: 0.9245, test_loss: 0.9499, test_f1: 0.4966
 epoch: 21, train_loss: 0.9154, test_loss: 0.9513, test_f1: 0.5131
 epoch: 22, train_loss: 0.9071, test_loss: 0.9538, test_f1: 0.5103
 epoch: 23, train_loss: 0.9004, test_loss: 0.9478, test_f1: 0.5020
 epoch: 24, train_loss: 0.8978, test_loss: 0.9606, test_f1: 0.5017
 epoch: 25, train_loss: 0.8836, test_loss: 0.9315, test_f1: 0.5066
 epoch: 26, train_loss: 0.8872, test_loss: 0.9425, test_f1: 0.5113
 epoch: 27, train_loss: 0.8794, test_loss: 0.9440, test_f1: 0.5083
 epoch: 28, train_loss: 0.8743, test_loss: 0.9401, test_f1: 0.5142
 epoch: 29, train_loss: 0.8593, test_loss: 0.9453, test_f1: 0.5054
 epoch: 30, train_loss: 0.8638, test_loss: 0.9443, test_f1: 0.4945
 epoch: 31, train_loss: 0.8556, test_loss: 0.9181, test_f1: 0.5220
 epoch: 32, train_loss: 0.8449, test_loss: 0.9395, test_f1: 0.5013
 epoch: 33, train_loss: 0.8445, test_loss: 0.9495, test_f1: 0.5182
 epoch: 34, train_loss: 0.8367, test_loss: 0.9349, test_f1: 0.5087
 epoch: 35, train_loss: 0.8407, test_loss: 0.9493, test_f1: 0.5088
 epoch: 36, train_loss: 0.8281, test_loss: 0.9254, test_f1: 0.5081
 epoch: 37, train_loss: 0.8118, test_loss: 0.9455, test_f1: 0.5008
 epoch: 38, train_loss: 0.8135, test_loss: 0.9570, test_f1: 0.5073
 epoch: 39, train_loss: 0.8045, test_loss: 0.9497, test_f1: 0.5083
 epoch: 40, train_loss: 0.8082, test_loss: 0.9575, test_f1: 0.5089
 epoch: 41, train_loss: 0.8068, test_loss: 0.9490, test_f1: 0.5109
 epoch: 42, train_loss: 0.7995, test_loss: 0.9446, test_f1: 0.5210
 epoch: 43, train_loss: 0.7849, test_loss: 0.9579, test_f1: 0.5138
 epoch: 44, train_loss: 0.7849, test_loss: 0.9642, test_f1: 0.5218
 epoch: 45, train_loss: 0.7810, test_loss: 0.9923, test_f1: 0.5227
 epoch: 46, train_loss: 0.7691, test_loss: 0.9496, test_f1: 0.5226
 epoch: 47, train_loss: 0.7711, test_loss: 0.9541, test_f1: 0.5007
 epoch: 48, train_loss: 0.7715, test_loss: 0.9379, test_f1: 0.5227
 epoch: 49, train_loss: 0.7587, test_loss: 0.9565, test_f1: 0.5253
 epoch: 50, train_loss: 0.7554, test_loss: 0.9371, test_f1: 0.5169
 epoch: 51, train_loss: 0.7433, test_loss: 0.9624, test_f1: 0.5268
 epoch: 52, train_loss: 0.7419, test_loss: 0.9717, test_f1: 0.5178
 epoch: 53, train_loss: 0.7534, test_loss: 0.9507, test_f1: 0.5184
 epoch: 54, train_loss: 0.7440, test_loss: 0.9737, test_f1: 0.5217
 epoch: 55, train_loss: 0.7442, test_loss: 0.9862, test_f1: 0.5176
 epoch: 56, train_loss: 0.7380, test_loss: 1.0006, test_f1: 0.5094
 epoch: 57, train_loss: 0.7402, test_loss: 0.9756, test_f1: 0.5080
 epoch: 58, train_loss: 0.7334, test_loss: 0.9551, test_f1: 0.5280
 epoch: 59, train_loss: 0.7365, test_loss: 1.0054, test_f1: 0.5253
 epoch: 60, train_loss: 0.7297, test_loss: 0.9789, test_f1: 0.5180
 epoch: 61, train_loss: 0.7169, test_loss: 0.9775, test_f1: 0.5205
 epoch: 62, train_loss: 0.7258, test_loss: 0.9875, test_f1: 0.5138
 epoch: 63, train_loss: 0.7229, test_loss: 0.9689, test_f1: 0.5261
 epoch: 64, train_loss: 0.7243, test_loss: 0.9652, test_f1: 0.5261
 epoch: 65, train_loss: 0.7158, test_loss: 0.9731, test_f1: 0.5072
 epoch: 66, train_loss: 0.7087, test_loss: 1.0023, test_f1: 0.5254
 epoch: 67, train_loss: 0.7185, test_loss: 0.9983, test_f1: 0.5251
 epoch: 68, train_loss: 0.7125, test_loss: 1.0174, test_f1: 0.5098
 epoch: 69, train_loss: 0.7120, test_loss: 1.0052, test_f1: 0.5144
 epoch: 70, train_loss: 0.7029, test_loss: 1.0020, test_f1: 0.5209
 epoch: 71, train_loss: 0.7048, test_loss: 0.9915, test_f1: 0.5155
 epoch: 72, train_loss: 0.6991, test_loss: 1.0068, test_f1: 0.5131
 epoch: 73, train_loss: 0.7055, test_loss: 0.9900, test_f1: 0.5264
 epoch: 74, train_loss: 0.7127, test_loss: 0.9970, test_f1: 0.5119
 epoch: 75, train_loss: 0.7034, test_loss: 0.9928, test_f1: 0.5056
 epoch: 76, train_loss: 0.6978, test_loss: 1.0045, test_f1: 0.5156
 epoch: 77, train_loss: 0.6990, test_loss: 0.9914, test_f1: 0.5042
 epoch: 78, train_loss: 0.6914, test_loss: 0.9923, test_f1: 0.5149
 epoch: 79, train_loss: 0.6840, test_loss: 1.0182, test_f1: 0.5131
 epoch: 80, train_loss: 0.6892, test_loss: 1.0024, test_f1: 0.5290
 epoch: 81, train_loss: 0.6856, test_loss: 1.0244, test_f1: 0.5149
 epoch: 82, train_loss: 0.6879, test_loss: 0.9959, test_f1: 0.5139
 epoch: 83, train_loss: 0.6903, test_loss: 1.0450, test_f1: 0.5044
 epoch: 84, train_loss: 0.6816, test_loss: 1.0324, test_f1: 0.5092
 epoch: 85, train_loss: 0.6878, test_loss: 1.0347, test_f1: 0.5078
 epoch: 86, train_loss: 0.6871, test_loss: 1.0287, test_f1: 0.5210
 epoch: 87, train_loss: 0.6909, test_loss: 1.0092, test_f1: 0.5284
 epoch: 88, train_loss: 0.6708, test_loss: 1.0025, test_f1: 0.5270
 epoch: 89, train_loss: 0.6776, test_loss: 1.0359, test_f1: 0.5267
 epoch: 90, train_loss: 0.6777, test_loss: 1.0700, test_f1: 0.5194
 epoch: 91, train_loss: 0.6739, test_loss: 1.0344, test_f1: 0.5137
 epoch: 92, train_loss: 0.6765, test_loss: 1.0221, test_f1: 0.5211
 epoch: 93, train_loss: 0.6664, test_loss: 1.0482, test_f1: 0.5150
 epoch: 94, train_loss: 0.6779, test_loss: 1.0393, test_f1: 0.5204
 epoch: 95, train_loss: 0.6654, test_loss: 1.0374, test_f1: 0.5209
 epoch: 96, train_loss: 0.6635, test_loss: 1.0423, test_f1: 0.5182
 epoch: 97, train_loss: 0.6633, test_loss: 1.0487, test_f1: 0.5172
 epoch: 98, train_loss: 0.6645, test_loss: 1.0529, test_f1: 0.5244
 epoch: 99, train_loss: 0.6627, test_loss: 1.0496, test_f1: 0.5268
##################ITERATION #3 ****************************************
 epoch: 0, train_loss: 1.2967, test_loss: 1.3073, test_f1: 0.2260
 epoch: 1, train_loss: 1.2476, test_loss: 1.2739, test_f1: 0.2260
 epoch: 2, train_loss: 1.2162, test_loss: 1.2191, test_f1: 0.2647
 epoch: 3, train_loss: 1.1835, test_loss: 1.1411, test_f1: 0.4218
 epoch: 4, train_loss: 1.1526, test_loss: 1.1053, test_f1: 0.4253
 epoch: 5, train_loss: 1.1244, test_loss: 1.0754, test_f1: 0.4537
 epoch: 6, train_loss: 1.0907, test_loss: 1.0487, test_f1: 0.4713
 epoch: 7, train_loss: 1.0665, test_loss: 1.0302, test_f1: 0.4816
 epoch: 8, train_loss: 1.0502, test_loss: 1.0148, test_f1: 0.4865
 epoch: 9, train_loss: 1.0321, test_loss: 1.0011, test_f1: 0.4779
 epoch: 10, train_loss: 1.0126, test_loss: 0.9868, test_f1: 0.4767
 epoch: 11, train_loss: 0.9935, test_loss: 0.9831, test_f1: 0.4825
 epoch: 12, train_loss: 0.9889, test_loss: 0.9720, test_f1: 0.4841
 epoch: 13, train_loss: 0.9708, test_loss: 0.9660, test_f1: 0.4788
 epoch: 14, train_loss: 0.9626, test_loss: 0.9728, test_f1: 0.4959
 epoch: 15, train_loss: 0.9453, test_loss: 0.9542, test_f1: 0.4814
 epoch: 16, train_loss: 0.9376, test_loss: 0.9619, test_f1: 0.4798
 epoch: 17, train_loss: 0.9344, test_loss: 0.9477, test_f1: 0.4949
 epoch: 18, train_loss: 0.9229, test_loss: 0.9526, test_f1: 0.4901
 epoch: 19, train_loss: 0.9134, test_loss: 0.9453, test_f1: 0.4840
 epoch: 20, train_loss: 0.9129, test_loss: 0.9325, test_f1: 0.4977
 epoch: 21, train_loss: 0.8985, test_loss: 0.9312, test_f1: 0.4867
 epoch: 22, train_loss: 0.8887, test_loss: 0.9210, test_f1: 0.5137
 epoch: 23, train_loss: 0.8827, test_loss: 0.9178, test_f1: 0.5248
 epoch: 24, train_loss: 0.8719, test_loss: 0.9388, test_f1: 0.4912
 epoch: 25, train_loss: 0.8708, test_loss: 0.9290, test_f1: 0.5013
 epoch: 26, train_loss: 0.8632, test_loss: 0.9105, test_f1: 0.5181
 epoch: 27, train_loss: 0.8606, test_loss: 0.8977, test_f1: 0.5135
 epoch: 28, train_loss: 0.8342, test_loss: 0.9060, test_f1: 0.5239
 epoch: 29, train_loss: 0.8367, test_loss: 0.9020, test_f1: 0.5184
 epoch: 30, train_loss: 0.8325, test_loss: 0.8837, test_f1: 0.5327
 epoch: 31, train_loss: 0.8299, test_loss: 0.8955, test_f1: 0.5274
 epoch: 32, train_loss: 0.8133, test_loss: 0.8864, test_f1: 0.5391
 epoch: 33, train_loss: 0.8139, test_loss: 0.8819, test_f1: 0.5415
 epoch: 34, train_loss: 0.7941, test_loss: 0.8878, test_f1: 0.5396
 epoch: 35, train_loss: 0.7863, test_loss: 0.8830, test_f1: 0.5547
 epoch: 36, train_loss: 0.7947, test_loss: 0.8898, test_f1: 0.5468
 epoch: 37, train_loss: 0.7882, test_loss: 0.8992, test_f1: 0.5428
 epoch: 38, train_loss: 0.7775, test_loss: 0.8875, test_f1: 0.5685
 epoch: 39, train_loss: 0.7787, test_loss: 0.9074, test_f1: 0.5464
 epoch: 40, train_loss: 0.7675, test_loss: 0.8912, test_f1: 0.5573
 epoch: 41, train_loss: 0.7539, test_loss: 0.8915, test_f1: 0.5561
 epoch: 42, train_loss: 0.7506, test_loss: 0.8890, test_f1: 0.5546
 epoch: 43, train_loss: 0.7624, test_loss: 0.9027, test_f1: 0.5589
 epoch: 44, train_loss: 0.7454, test_loss: 0.9178, test_f1: 0.5525
 epoch: 45, train_loss: 0.7387, test_loss: 0.9128, test_f1: 0.5597
 epoch: 46, train_loss: 0.7341, test_loss: 0.9230, test_f1: 0.5447
 epoch: 47, train_loss: 0.7393, test_loss: 0.9489, test_f1: 0.5386
 epoch: 48, train_loss: 0.7235, test_loss: 0.9195, test_f1: 0.5706
 epoch: 49, train_loss: 0.7123, test_loss: 0.9410, test_f1: 0.5605
 epoch: 50, train_loss: 0.7119, test_loss: 0.9402, test_f1: 0.5502
 epoch: 51, train_loss: 0.6940, test_loss: 0.9247, test_f1: 0.5556
 epoch: 52, train_loss: 0.6975, test_loss: 0.9492, test_f1: 0.5559
 epoch: 53, train_loss: 0.7057, test_loss: 0.9536, test_f1: 0.5476
 epoch: 54, train_loss: 0.6873, test_loss: 0.9485, test_f1: 0.5570
 epoch: 55, train_loss: 0.6857, test_loss: 0.9291, test_f1: 0.5761
 epoch: 56, train_loss: 0.6881, test_loss: 0.9282, test_f1: 0.5632
 epoch: 57, train_loss: 0.6785, test_loss: 0.9374, test_f1: 0.5651
 epoch: 58, train_loss: 0.6810, test_loss: 0.9187, test_f1: 0.5826
 epoch: 59, train_loss: 0.6779, test_loss: 0.9654, test_f1: 0.5668
 epoch: 60, train_loss: 0.6798, test_loss: 0.9458, test_f1: 0.5705
 epoch: 61, train_loss: 0.6819, test_loss: 0.9444, test_f1: 0.5679
 epoch: 62, train_loss: 0.6756, test_loss: 0.9579, test_f1: 0.5617
 epoch: 63, train_loss: 0.6574, test_loss: 0.9526, test_f1: 0.5538
 epoch: 64, train_loss: 0.6641, test_loss: 0.9607, test_f1: 0.5718
 epoch: 65, train_loss: 0.6524, test_loss: 0.9571, test_f1: 0.5635
 epoch: 66, train_loss: 0.6527, test_loss: 0.9833, test_f1: 0.5614
 epoch: 67, train_loss: 0.6687, test_loss: 0.9541, test_f1: 0.5653
 epoch: 68, train_loss: 0.6468, test_loss: 0.9579, test_f1: 0.5622
 epoch: 69, train_loss: 0.6410, test_loss: 0.9555, test_f1: 0.5666
 epoch: 70, train_loss: 0.6559, test_loss: 1.0123, test_f1: 0.5436
 epoch: 71, train_loss: 0.6468, test_loss: 0.9716, test_f1: 0.5547
 epoch: 72, train_loss: 0.6569, test_loss: 0.9955, test_f1: 0.5547
 epoch: 73, train_loss: 0.6421, test_loss: 0.9702, test_f1: 0.5586
 epoch: 74, train_loss: 0.6433, test_loss: 1.0116, test_f1: 0.5402
 epoch: 75, train_loss: 0.6405, test_loss: 0.9917, test_f1: 0.5567
 epoch: 76, train_loss: 0.6341, test_loss: 0.9815, test_f1: 0.5560
 epoch: 77, train_loss: 0.6380, test_loss: 0.9762, test_f1: 0.5609
 epoch: 78, train_loss: 0.6364, test_loss: 0.9891, test_f1: 0.5594
 epoch: 79, train_loss: 0.6337, test_loss: 0.9821, test_f1: 0.5540
 epoch: 80, train_loss: 0.6401, test_loss: 0.9808, test_f1: 0.5724
 epoch: 81, train_loss: 0.6294, test_loss: 1.0171, test_f1: 0.5558
 epoch: 82, train_loss: 0.6252, test_loss: 0.9905, test_f1: 0.5585
 epoch: 83, train_loss: 0.6196, test_loss: 0.9986, test_f1: 0.5573
 epoch: 84, train_loss: 0.6247, test_loss: 1.0225, test_f1: 0.5603
 epoch: 85, train_loss: 0.6353, test_loss: 1.0077, test_f1: 0.5596
 epoch: 86, train_loss: 0.6254, test_loss: 1.0235, test_f1: 0.5606
 epoch: 87, train_loss: 0.6228, test_loss: 1.0132, test_f1: 0.5620
 epoch: 88, train_loss: 0.6084, test_loss: 1.0080, test_f1: 0.5716
 epoch: 89, train_loss: 0.6085, test_loss: 0.9808, test_f1: 0.5711
 epoch: 90, train_loss: 0.6046, test_loss: 0.9743, test_f1: 0.5833
 epoch: 91, train_loss: 0.6113, test_loss: 1.0170, test_f1: 0.5668
 epoch: 92, train_loss: 0.6266, test_loss: 0.9924, test_f1: 0.5842
 epoch: 93, train_loss: 0.6294, test_loss: 0.9955, test_f1: 0.5538
 epoch: 94, train_loss: 0.6082, test_loss: 1.0333, test_f1: 0.5636
 epoch: 95, train_loss: 0.6053, test_loss: 1.0181, test_f1: 0.5579
 epoch: 96, train_loss: 0.6009, test_loss: 1.0280, test_f1: 0.5496
 epoch: 97, train_loss: 0.6038, test_loss: 1.0289, test_f1: 0.5565
 epoch: 98, train_loss: 0.6008, test_loss: 1.0343, test_f1: 0.5663
 epoch: 99, train_loss: 0.6032, test_loss: 1.0500, test_f1: 0.5592
##################ITERATION #4 ****************************************
 epoch: 0, train_loss: 1.2852, test_loss: 1.2878, test_f1: 0.2260
 epoch: 1, train_loss: 1.2322, test_loss: 1.2561, test_f1: 0.2260
 epoch: 2, train_loss: 1.1949, test_loss: 1.1669, test_f1: 0.3142
 epoch: 3, train_loss: 1.1586, test_loss: 1.1162, test_f1: 0.4312
 epoch: 4, train_loss: 1.1230, test_loss: 1.0834, test_f1: 0.4285
 epoch: 5, train_loss: 1.0871, test_loss: 1.0543, test_f1: 0.4522
 epoch: 6, train_loss: 1.0593, test_loss: 1.0366, test_f1: 0.4537
 epoch: 7, train_loss: 1.0401, test_loss: 1.0201, test_f1: 0.4531
 epoch: 8, train_loss: 1.0178, test_loss: 1.0067, test_f1: 0.4627
 epoch: 9, train_loss: 1.0029, test_loss: 1.0008, test_f1: 0.4631
 epoch: 10, train_loss: 0.9871, test_loss: 0.9971, test_f1: 0.4621
 epoch: 11, train_loss: 0.9727, test_loss: 0.9896, test_f1: 0.4765
 epoch: 12, train_loss: 0.9583, test_loss: 1.0031, test_f1: 0.4819
 epoch: 13, train_loss: 0.9572, test_loss: 0.9793, test_f1: 0.5026
 epoch: 14, train_loss: 0.9461, test_loss: 0.9758, test_f1: 0.4817
 epoch: 15, train_loss: 0.9366, test_loss: 0.9800, test_f1: 0.4900
 epoch: 16, train_loss: 0.9267, test_loss: 0.9810, test_f1: 0.4840
 epoch: 17, train_loss: 0.9094, test_loss: 0.9629, test_f1: 0.5016
 epoch: 18, train_loss: 0.9133, test_loss: 0.9650, test_f1: 0.5044
 epoch: 19, train_loss: 0.8991, test_loss: 0.9750, test_f1: 0.5144
 epoch: 20, train_loss: 0.8975, test_loss: 0.9547, test_f1: 0.5231
 epoch: 21, train_loss: 0.8909, test_loss: 0.9571, test_f1: 0.5206
 epoch: 22, train_loss: 0.8746, test_loss: 0.9582, test_f1: 0.5286
 epoch: 23, train_loss: 0.8630, test_loss: 0.9521, test_f1: 0.5308
 epoch: 24, train_loss: 0.8719, test_loss: 0.9636, test_f1: 0.5215
 epoch: 25, train_loss: 0.8598, test_loss: 0.9575, test_f1: 0.5255
 epoch: 26, train_loss: 0.8517, test_loss: 0.9663, test_f1: 0.5350
 epoch: 27, train_loss: 0.8458, test_loss: 0.9573, test_f1: 0.5353
 epoch: 28, train_loss: 0.8435, test_loss: 0.9651, test_f1: 0.5393
 epoch: 29, train_loss: 0.8424, test_loss: 0.9578, test_f1: 0.5416
 epoch: 30, train_loss: 0.8275, test_loss: 0.9378, test_f1: 0.5442
 epoch: 31, train_loss: 0.8271, test_loss: 0.9560, test_f1: 0.5517
 epoch: 32, train_loss: 0.8258, test_loss: 0.9406, test_f1: 0.5422
 epoch: 33, train_loss: 0.8110, test_loss: 0.9498, test_f1: 0.5506
 epoch: 34, train_loss: 0.8061, test_loss: 0.9580, test_f1: 0.5432
 epoch: 35, train_loss: 0.8017, test_loss: 0.9480, test_f1: 0.5480
 epoch: 36, train_loss: 0.7996, test_loss: 0.9567, test_f1: 0.5562
 epoch: 37, train_loss: 0.7973, test_loss: 0.9588, test_f1: 0.5553
 epoch: 38, train_loss: 0.7983, test_loss: 0.9416, test_f1: 0.5597
 epoch: 39, train_loss: 0.7828, test_loss: 0.9411, test_f1: 0.5495
 epoch: 40, train_loss: 0.7795, test_loss: 0.9474, test_f1: 0.5579
 epoch: 41, train_loss: 0.7766, test_loss: 0.9718, test_f1: 0.5445
 epoch: 42, train_loss: 0.7715, test_loss: 0.9426, test_f1: 0.5622
 epoch: 43, train_loss: 0.7655, test_loss: 0.9394, test_f1: 0.5597
 epoch: 44, train_loss: 0.7615, test_loss: 0.9383, test_f1: 0.5675
 epoch: 45, train_loss: 0.7665, test_loss: 0.9385, test_f1: 0.5631
 epoch: 46, train_loss: 0.7475, test_loss: 0.9580, test_f1: 0.5578
 epoch: 47, train_loss: 0.7471, test_loss: 0.9212, test_f1: 0.5733
 epoch: 48, train_loss: 0.7442, test_loss: 0.9611, test_f1: 0.5563
 epoch: 49, train_loss: 0.7399, test_loss: 0.9618, test_f1: 0.5636
 epoch: 50, train_loss: 0.7272, test_loss: 0.9636, test_f1: 0.5615
 epoch: 51, train_loss: 0.7298, test_loss: 0.9600, test_f1: 0.5751
 epoch: 52, train_loss: 0.7235, test_loss: 0.9488, test_f1: 0.5710
 epoch: 53, train_loss: 0.7092, test_loss: 0.9614, test_f1: 0.5654
 epoch: 54, train_loss: 0.7201, test_loss: 0.9721, test_f1: 0.5667
 epoch: 55, train_loss: 0.7111, test_loss: 0.9587, test_f1: 0.5706
 epoch: 56, train_loss: 0.7142, test_loss: 0.9527, test_f1: 0.5648
 epoch: 57, train_loss: 0.7139, test_loss: 0.9437, test_f1: 0.5576
 epoch: 58, train_loss: 0.7181, test_loss: 0.9494, test_f1: 0.5661
 epoch: 59, train_loss: 0.7076, test_loss: 0.9648, test_f1: 0.5686
 epoch: 60, train_loss: 0.7093, test_loss: 0.9545, test_f1: 0.5683
 epoch: 61, train_loss: 0.7074, test_loss: 0.9531, test_f1: 0.5646
 epoch: 62, train_loss: 0.6993, test_loss: 0.9552, test_f1: 0.5665
 epoch: 63, train_loss: 0.6956, test_loss: 0.9421, test_f1: 0.5732
 epoch: 64, train_loss: 0.6913, test_loss: 0.9570, test_f1: 0.5596
 epoch: 65, train_loss: 0.7043, test_loss: 0.9512, test_f1: 0.5675
 epoch: 66, train_loss: 0.6936, test_loss: 0.9509, test_f1: 0.5748
 epoch: 67, train_loss: 0.6978, test_loss: 0.9710, test_f1: 0.5635
 epoch: 68, train_loss: 0.6884, test_loss: 0.9519, test_f1: 0.5759
 epoch: 69, train_loss: 0.6860, test_loss: 0.9663, test_f1: 0.5669
 epoch: 70, train_loss: 0.6873, test_loss: 0.9513, test_f1: 0.5669
 epoch: 71, train_loss: 0.6866, test_loss: 0.9533, test_f1: 0.5707
 epoch: 72, train_loss: 0.6826, test_loss: 0.9484, test_f1: 0.5705
 epoch: 73, train_loss: 0.6741, test_loss: 0.9453, test_f1: 0.5675
 epoch: 74, train_loss: 0.6798, test_loss: 0.9622, test_f1: 0.5790
 epoch: 75, train_loss: 0.6804, test_loss: 0.9562, test_f1: 0.5696
 epoch: 76, train_loss: 0.6817, test_loss: 0.9695, test_f1: 0.5765
 epoch: 77, train_loss: 0.6648, test_loss: 0.9627, test_f1: 0.5647
 epoch: 78, train_loss: 0.6657, test_loss: 0.9654, test_f1: 0.5734
 epoch: 79, train_loss: 0.6641, test_loss: 0.9538, test_f1: 0.5717
 epoch: 80, train_loss: 0.6609, test_loss: 0.9664, test_f1: 0.5648
 epoch: 81, train_loss: 0.6601, test_loss: 0.9718, test_f1: 0.5739
 epoch: 82, train_loss: 0.6570, test_loss: 0.9689, test_f1: 0.5801
 epoch: 83, train_loss: 0.6715, test_loss: 0.9781, test_f1: 0.5697
 epoch: 84, train_loss: 0.6607, test_loss: 0.9682, test_f1: 0.5601
 epoch: 85, train_loss: 0.6575, test_loss: 0.9645, test_f1: 0.5622
 epoch: 86, train_loss: 0.6648, test_loss: 0.9764, test_f1: 0.5669
 epoch: 87, train_loss: 0.6554, test_loss: 0.9670, test_f1: 0.5670
 epoch: 88, train_loss: 0.6556, test_loss: 0.9764, test_f1: 0.5682
 epoch: 89, train_loss: 0.6665, test_loss: 0.9649, test_f1: 0.5736
 epoch: 90, train_loss: 0.6608, test_loss: 0.9568, test_f1: 0.5692
 epoch: 91, train_loss: 0.6570, test_loss: 0.9702, test_f1: 0.5677
 epoch: 92, train_loss: 0.6627, test_loss: 0.9648, test_f1: 0.5761
 epoch: 93, train_loss: 0.6503, test_loss: 0.9848, test_f1: 0.5571
 epoch: 94, train_loss: 0.6485, test_loss: 0.9906, test_f1: 0.5615
 epoch: 95, train_loss: 0.6422, test_loss: 0.9860, test_f1: 0.5568
 epoch: 96, train_loss: 0.6368, test_loss: 0.9525, test_f1: 0.5741
 epoch: 97, train_loss: 0.6416, test_loss: 0.9692, test_f1: 0.5734
 epoch: 98, train_loss: 0.6289, test_loss: 0.9821, test_f1: 0.5656
 epoch: 99, train_loss: 0.6414, test_loss: 0.9788, test_f1: 0.5698
##################ITERATION #5 ****************************************
 epoch: 0, train_loss: 1.2836, test_loss: 1.2917, test_f1: 0.2260
 epoch: 1, train_loss: 1.1877, test_loss: 1.2088, test_f1: 0.3014
 epoch: 2, train_loss: 1.1500, test_loss: 1.1011, test_f1: 0.4473
 epoch: 3, train_loss: 1.1215, test_loss: 1.0635, test_f1: 0.4607
 epoch: 4, train_loss: 1.0943, test_loss: 1.0422, test_f1: 0.4548
 epoch: 5, train_loss: 1.0643, test_loss: 1.0128, test_f1: 0.4687
 epoch: 6, train_loss: 1.0441, test_loss: 0.9974, test_f1: 0.4699
 epoch: 7, train_loss: 1.0265, test_loss: 0.9867, test_f1: 0.4681
 epoch: 8, train_loss: 1.0094, test_loss: 0.9792, test_f1: 0.4690
 epoch: 9, train_loss: 0.9904, test_loss: 0.9705, test_f1: 0.4720
 epoch: 10, train_loss: 0.9736, test_loss: 0.9640, test_f1: 0.4731
 epoch: 11, train_loss: 0.9603, test_loss: 0.9520, test_f1: 0.4813
 epoch: 12, train_loss: 0.9492, test_loss: 0.9736, test_f1: 0.4719
 epoch: 13, train_loss: 0.9407, test_loss: 0.9472, test_f1: 0.4876
 epoch: 14, train_loss: 0.9312, test_loss: 0.9469, test_f1: 0.4786
 epoch: 15, train_loss: 0.9070, test_loss: 0.9149, test_f1: 0.5039
 epoch: 16, train_loss: 0.9053, test_loss: 0.9371, test_f1: 0.5049
 epoch: 17, train_loss: 0.8981, test_loss: 0.9318, test_f1: 0.5067
 epoch: 18, train_loss: 0.8946, test_loss: 0.9350, test_f1: 0.5263
 epoch: 19, train_loss: 0.8818, test_loss: 0.9221, test_f1: 0.5154
 epoch: 20, train_loss: 0.8808, test_loss: 0.9282, test_f1: 0.5133
 epoch: 21, train_loss: 0.8628, test_loss: 0.9272, test_f1: 0.5133
 epoch: 22, train_loss: 0.8442, test_loss: 0.9290, test_f1: 0.5201
 epoch: 23, train_loss: 0.8509, test_loss: 0.9329, test_f1: 0.5087
 epoch: 24, train_loss: 0.8551, test_loss: 0.9385, test_f1: 0.5162
 epoch: 25, train_loss: 0.8319, test_loss: 0.9139, test_f1: 0.5287
 epoch: 26, train_loss: 0.8253, test_loss: 0.9234, test_f1: 0.5445
 epoch: 27, train_loss: 0.8306, test_loss: 0.9189, test_f1: 0.5205
 epoch: 28, train_loss: 0.8138, test_loss: 0.9253, test_f1: 0.5299
 epoch: 29, train_loss: 0.8115, test_loss: 0.9309, test_f1: 0.5307
 epoch: 30, train_loss: 0.8018, test_loss: 0.9087, test_f1: 0.5460
 epoch: 31, train_loss: 0.7942, test_loss: 0.9134, test_f1: 0.5327
 epoch: 32, train_loss: 0.8007, test_loss: 0.9175, test_f1: 0.5568
 epoch: 33, train_loss: 0.7892, test_loss: 0.9051, test_f1: 0.5556
 epoch: 34, train_loss: 0.7837, test_loss: 0.9059, test_f1: 0.5445
 epoch: 35, train_loss: 0.7782, test_loss: 0.9123, test_f1: 0.5456
 epoch: 36, train_loss: 0.7809, test_loss: 0.9339, test_f1: 0.5386
 epoch: 37, train_loss: 0.7714, test_loss: 0.9202, test_f1: 0.5411
 epoch: 38, train_loss: 0.7595, test_loss: 0.9077, test_f1: 0.5537
 epoch: 39, train_loss: 0.7475, test_loss: 0.8973, test_f1: 0.5469
 epoch: 40, train_loss: 0.7382, test_loss: 0.9231, test_f1: 0.5592
 epoch: 41, train_loss: 0.7350, test_loss: 0.9226, test_f1: 0.5385
 epoch: 42, train_loss: 0.7414, test_loss: 0.9329, test_f1: 0.5451
 epoch: 43, train_loss: 0.7292, test_loss: 0.9022, test_f1: 0.5391
 epoch: 44, train_loss: 0.7398, test_loss: 0.9261, test_f1: 0.5330
 epoch: 45, train_loss: 0.7184, test_loss: 0.8945, test_f1: 0.5503
 epoch: 46, train_loss: 0.7195, test_loss: 0.9064, test_f1: 0.5459
 epoch: 47, train_loss: 0.7147, test_loss: 0.9141, test_f1: 0.5492
 epoch: 48, train_loss: 0.7143, test_loss: 0.9304, test_f1: 0.5571
 epoch: 49, train_loss: 0.7151, test_loss: 0.9415, test_f1: 0.5507
 epoch: 50, train_loss: 0.7112, test_loss: 0.9445, test_f1: 0.5350
 epoch: 51, train_loss: 0.6899, test_loss: 0.9302, test_f1: 0.5471
 epoch: 52, train_loss: 0.6884, test_loss: 0.9369, test_f1: 0.5427
 epoch: 53, train_loss: 0.6737, test_loss: 0.9115, test_f1: 0.5600
 epoch: 54, train_loss: 0.6841, test_loss: 0.9480, test_f1: 0.5388
 epoch: 55, train_loss: 0.6802, test_loss: 0.9512, test_f1: 0.5430
 epoch: 56, train_loss: 0.6760, test_loss: 0.9527, test_f1: 0.5443
 epoch: 57, train_loss: 0.6680, test_loss: 0.9569, test_f1: 0.5456
 epoch: 58, train_loss: 0.6731, test_loss: 0.9346, test_f1: 0.5523
 epoch: 59, train_loss: 0.6639, test_loss: 0.9474, test_f1: 0.5605
 epoch: 60, train_loss: 0.6751, test_loss: 0.9338, test_f1: 0.5501
 epoch: 61, train_loss: 0.6691, test_loss: 0.9491, test_f1: 0.5474
 epoch: 62, train_loss: 0.6600, test_loss: 0.9580, test_f1: 0.5588
 epoch: 63, train_loss: 0.6597, test_loss: 0.9522, test_f1: 0.5580
 epoch: 64, train_loss: 0.6582, test_loss: 0.9644, test_f1: 0.5549
 epoch: 65, train_loss: 0.6619, test_loss: 0.9804, test_f1: 0.5475
 epoch: 66, train_loss: 0.6630, test_loss: 0.9835, test_f1: 0.5369
 epoch: 67, train_loss: 0.6415, test_loss: 0.9630, test_f1: 0.5510
 epoch: 68, train_loss: 0.6496, test_loss: 0.9716, test_f1: 0.5668
 epoch: 69, train_loss: 0.6430, test_loss: 0.9719, test_f1: 0.5549
 epoch: 70, train_loss: 0.6409, test_loss: 0.9921, test_f1: 0.5465
 epoch: 71, train_loss: 0.6479, test_loss: 0.9718, test_f1: 0.5543
 epoch: 72, train_loss: 0.6399, test_loss: 0.9665, test_f1: 0.5485
 epoch: 73, train_loss: 0.6392, test_loss: 0.9987, test_f1: 0.5548
 epoch: 74, train_loss: 0.6293, test_loss: 1.0192, test_f1: 0.5533
 epoch: 75, train_loss: 0.6318, test_loss: 0.9777, test_f1: 0.5628
 epoch: 76, train_loss: 0.6529, test_loss: 1.0039, test_f1: 0.5655
 epoch: 77, train_loss: 0.6268, test_loss: 1.0135, test_f1: 0.5501
 epoch: 78, train_loss: 0.6287, test_loss: 1.0005, test_f1: 0.5506
 epoch: 79, train_loss: 0.6303, test_loss: 1.0189, test_f1: 0.5524
 epoch: 80, train_loss: 0.6193, test_loss: 1.0122, test_f1: 0.5538
 epoch: 81, train_loss: 0.6297, test_loss: 1.0057, test_f1: 0.5425
 epoch: 82, train_loss: 0.6351, test_loss: 0.9761, test_f1: 0.5635
 epoch: 83, train_loss: 0.6199, test_loss: 0.9971, test_f1: 0.5538
 epoch: 84, train_loss: 0.6201, test_loss: 1.0114, test_f1: 0.5582
 epoch: 85, train_loss: 0.6254, test_loss: 1.0074, test_f1: 0.5540
 epoch: 86, train_loss: 0.6218, test_loss: 1.0065, test_f1: 0.5559
 epoch: 87, train_loss: 0.6277, test_loss: 0.9892, test_f1: 0.5699
 epoch: 88, train_loss: 0.6143, test_loss: 1.0146, test_f1: 0.5635
 epoch: 89, train_loss: 0.6117, test_loss: 1.0437, test_f1: 0.5483
 epoch: 90, train_loss: 0.6158, test_loss: 0.9956, test_f1: 0.5517
 epoch: 91, train_loss: 0.6105, test_loss: 1.0301, test_f1: 0.5620
 epoch: 92, train_loss: 0.6176, test_loss: 1.0327, test_f1: 0.5530
 epoch: 93, train_loss: 0.6083, test_loss: 1.0366, test_f1: 0.5526
 epoch: 94, train_loss: 0.6051, test_loss: 0.9913, test_f1: 0.5602
 epoch: 95, train_loss: 0.6059, test_loss: 1.0560, test_f1: 0.5461
 epoch: 96, train_loss: 0.6101, test_loss: 1.0426, test_f1: 0.5578
 epoch: 97, train_loss: 0.6027, test_loss: 1.0179, test_f1: 0.5590
 epoch: 98, train_loss: 0.5963, test_loss: 1.0367, test_f1: 0.5588
 epoch: 99, train_loss: 0.6089, test_loss: 1.0452, test_f1: 0.5548
##################ITERATION #6 ****************************************
 epoch: 0, train_loss: 1.2803, test_loss: 1.2796, test_f1: 0.2260
 epoch: 1, train_loss: 1.1836, test_loss: 1.1930, test_f1: 0.2767
 epoch: 2, train_loss: 1.1415, test_loss: 1.0760, test_f1: 0.4712
 epoch: 3, train_loss: 1.1102, test_loss: 1.0341, test_f1: 0.4615
 epoch: 4, train_loss: 1.0788, test_loss: 1.0079, test_f1: 0.4689
 epoch: 5, train_loss: 1.0525, test_loss: 0.9927, test_f1: 0.4722
 epoch: 6, train_loss: 1.0216, test_loss: 0.9765, test_f1: 0.4687
 epoch: 7, train_loss: 1.0178, test_loss: 0.9751, test_f1: 0.4658
 epoch: 8, train_loss: 0.9916, test_loss: 0.9712, test_f1: 0.4707
 epoch: 9, train_loss: 0.9832, test_loss: 0.9555, test_f1: 0.4630
 epoch: 10, train_loss: 0.9706, test_loss: 0.9558, test_f1: 0.4863
 epoch: 11, train_loss: 0.9472, test_loss: 0.9544, test_f1: 0.4997
 epoch: 12, train_loss: 0.9461, test_loss: 0.9397, test_f1: 0.4787
 epoch: 13, train_loss: 0.9362, test_loss: 0.9451, test_f1: 0.4743
 epoch: 14, train_loss: 0.9223, test_loss: 0.9437, test_f1: 0.5028
 epoch: 15, train_loss: 0.9128, test_loss: 0.9639, test_f1: 0.5083
 epoch: 16, train_loss: 0.8980, test_loss: 0.9375, test_f1: 0.5016
 epoch: 17, train_loss: 0.8891, test_loss: 0.9325, test_f1: 0.5039
 epoch: 18, train_loss: 0.8838, test_loss: 0.9396, test_f1: 0.5126
 epoch: 19, train_loss: 0.8747, test_loss: 0.9397, test_f1: 0.5073
 epoch: 20, train_loss: 0.8696, test_loss: 0.9207, test_f1: 0.5338
 epoch: 21, train_loss: 0.8614, test_loss: 0.9316, test_f1: 0.5396
 epoch: 22, train_loss: 0.8504, test_loss: 0.9275, test_f1: 0.5205
 epoch: 23, train_loss: 0.8439, test_loss: 0.9115, test_f1: 0.5306
 epoch: 24, train_loss: 0.8442, test_loss: 0.9277, test_f1: 0.5408
 epoch: 25, train_loss: 0.8337, test_loss: 0.9358, test_f1: 0.5414
 epoch: 26, train_loss: 0.8326, test_loss: 0.8991, test_f1: 0.5357
 epoch: 27, train_loss: 0.8191, test_loss: 0.9113, test_f1: 0.5401
 epoch: 28, train_loss: 0.8132, test_loss: 0.9074, test_f1: 0.5400
 epoch: 29, train_loss: 0.8058, test_loss: 0.9192, test_f1: 0.5437
 epoch: 30, train_loss: 0.7915, test_loss: 0.9084, test_f1: 0.5457
 epoch: 31, train_loss: 0.8001, test_loss: 0.9424, test_f1: 0.5363
 epoch: 32, train_loss: 0.7916, test_loss: 0.9152, test_f1: 0.5414
 epoch: 33, train_loss: 0.7926, test_loss: 0.9145, test_f1: 0.5397
 epoch: 34, train_loss: 0.7731, test_loss: 0.9038, test_f1: 0.5469
 epoch: 35, train_loss: 0.7779, test_loss: 0.9192, test_f1: 0.5319
 epoch: 36, train_loss: 0.7762, test_loss: 0.9138, test_f1: 0.5452
 epoch: 37, train_loss: 0.7638, test_loss: 0.8856, test_f1: 0.5613
 epoch: 38, train_loss: 0.7558, test_loss: 0.9127, test_f1: 0.5596
 epoch: 39, train_loss: 0.7541, test_loss: 0.9059, test_f1: 0.5486
 epoch: 40, train_loss: 0.7432, test_loss: 0.9225, test_f1: 0.5548
 epoch: 41, train_loss: 0.7367, test_loss: 0.9341, test_f1: 0.5564
 epoch: 42, train_loss: 0.7271, test_loss: 0.9192, test_f1: 0.5399
 epoch: 43, train_loss: 0.7260, test_loss: 0.9157, test_f1: 0.5588
 epoch: 44, train_loss: 0.7261, test_loss: 0.9161, test_f1: 0.5485
 epoch: 45, train_loss: 0.7209, test_loss: 0.9223, test_f1: 0.5610
 epoch: 46, train_loss: 0.7200, test_loss: 0.9304, test_f1: 0.5439
 epoch: 47, train_loss: 0.7331, test_loss: 0.9490, test_f1: 0.5464
 epoch: 48, train_loss: 0.7179, test_loss: 0.9381, test_f1: 0.5529
 epoch: 49, train_loss: 0.7039, test_loss: 0.9305, test_f1: 0.5639
 epoch: 50, train_loss: 0.7052, test_loss: 0.9569, test_f1: 0.5462
 epoch: 51, train_loss: 0.7059, test_loss: 0.9790, test_f1: 0.5434
 epoch: 52, train_loss: 0.6924, test_loss: 0.9896, test_f1: 0.5469
 epoch: 53, train_loss: 0.6864, test_loss: 0.9105, test_f1: 0.5647
 epoch: 54, train_loss: 0.6862, test_loss: 0.9066, test_f1: 0.5526
 epoch: 55, train_loss: 0.6899, test_loss: 0.9181, test_f1: 0.5647
 epoch: 56, train_loss: 0.6835, test_loss: 0.9556, test_f1: 0.5490
 epoch: 57, train_loss: 0.6822, test_loss: 0.9669, test_f1: 0.5512
 epoch: 58, train_loss: 0.6928, test_loss: 0.9507, test_f1: 0.5405
 epoch: 59, train_loss: 0.6770, test_loss: 0.9638, test_f1: 0.5554
 epoch: 60, train_loss: 0.6612, test_loss: 0.9358, test_f1: 0.5671
 epoch: 61, train_loss: 0.6699, test_loss: 0.9508, test_f1: 0.5549
 epoch: 62, train_loss: 0.6743, test_loss: 1.0076, test_f1: 0.5408
 epoch: 63, train_loss: 0.6702, test_loss: 1.0430, test_f1: 0.5411
 epoch: 64, train_loss: 0.6673, test_loss: 0.9469, test_f1: 0.5465
 epoch: 65, train_loss: 0.6671, test_loss: 0.9841, test_f1: 0.5537
 epoch: 66, train_loss: 0.6738, test_loss: 0.9504, test_f1: 0.5651
 epoch: 67, train_loss: 0.6693, test_loss: 0.9432, test_f1: 0.5714
 epoch: 68, train_loss: 0.6592, test_loss: 1.0333, test_f1: 0.5529
 epoch: 69, train_loss: 0.6513, test_loss: 0.9452, test_f1: 0.5553
 epoch: 70, train_loss: 0.6452, test_loss: 0.9728, test_f1: 0.5591
 epoch: 71, train_loss: 0.6547, test_loss: 0.9427, test_f1: 0.5551
 epoch: 72, train_loss: 0.6692, test_loss: 0.9568, test_f1: 0.5544
 epoch: 73, train_loss: 0.6548, test_loss: 0.9567, test_f1: 0.5587
 epoch: 74, train_loss: 0.6588, test_loss: 0.9763, test_f1: 0.5476
 epoch: 75, train_loss: 0.6499, test_loss: 1.0069, test_f1: 0.5426
 epoch: 76, train_loss: 0.6410, test_loss: 0.9738, test_f1: 0.5528
 epoch: 77, train_loss: 0.6431, test_loss: 0.9622, test_f1: 0.5488
 epoch: 78, train_loss: 0.6487, test_loss: 1.0741, test_f1: 0.5451
 epoch: 79, train_loss: 0.6298, test_loss: 1.0051, test_f1: 0.5619
 epoch: 80, train_loss: 0.6479, test_loss: 0.9305, test_f1: 0.5658
 epoch: 81, train_loss: 0.6486, test_loss: 0.9967, test_f1: 0.5567
 epoch: 82, train_loss: 0.6421, test_loss: 0.9538, test_f1: 0.5633
 epoch: 83, train_loss: 0.6471, test_loss: 0.9829, test_f1: 0.5640
 epoch: 84, train_loss: 0.6382, test_loss: 0.9950, test_f1: 0.5536
 epoch: 85, train_loss: 0.6370, test_loss: 0.9570, test_f1: 0.5729
 epoch: 86, train_loss: 0.6247, test_loss: 0.9986, test_f1: 0.5506
 epoch: 87, train_loss: 0.6420, test_loss: 1.0088, test_f1: 0.5538
 epoch: 88, train_loss: 0.6352, test_loss: 1.0285, test_f1: 0.5509
 epoch: 89, train_loss: 0.6315, test_loss: 1.0380, test_f1: 0.5528
 epoch: 90, train_loss: 0.6373, test_loss: 1.0437, test_f1: 0.5531
 epoch: 91, train_loss: 0.6339, test_loss: 1.0804, test_f1: 0.5537
 epoch: 92, train_loss: 0.6296, test_loss: 1.0784, test_f1: 0.5519
 epoch: 93, train_loss: 0.6178, test_loss: 1.0559, test_f1: 0.5575
 epoch: 94, train_loss: 0.6244, test_loss: 0.9877, test_f1: 0.5639
 epoch: 95, train_loss: 0.6222, test_loss: 1.0317, test_f1: 0.5591
 epoch: 96, train_loss: 0.6222, test_loss: 1.0387, test_f1: 0.5557
 epoch: 97, train_loss: 0.6315, test_loss: 1.0950, test_f1: 0.5669
 epoch: 98, train_loss: 0.6255, test_loss: 1.0640, test_f1: 0.5563
 epoch: 99, train_loss: 0.6097, test_loss: 1.1546, test_f1: 0.5465
##################ITERATION #7 ****************************************
 epoch: 0, train_loss: 1.2748, test_loss: 1.3007, test_f1: 0.2748
 epoch: 1, train_loss: 1.2042, test_loss: 1.2350, test_f1: 0.3237
 epoch: 2, train_loss: 1.1602, test_loss: 1.1398, test_f1: 0.4206
 epoch: 3, train_loss: 1.1229, test_loss: 1.0689, test_f1: 0.4562
 epoch: 4, train_loss: 1.0989, test_loss: 1.0436, test_f1: 0.4598
 epoch: 5, train_loss: 1.0728, test_loss: 1.0227, test_f1: 0.4571
 epoch: 6, train_loss: 1.0456, test_loss: 1.0150, test_f1: 0.4670
 epoch: 7, train_loss: 1.0424, test_loss: 1.0176, test_f1: 0.4654
 epoch: 8, train_loss: 1.0291, test_loss: 1.0063, test_f1: 0.4652
 epoch: 9, train_loss: 1.0157, test_loss: 0.9998, test_f1: 0.4756
 epoch: 10, train_loss: 1.0051, test_loss: 0.9932, test_f1: 0.4772
 epoch: 11, train_loss: 0.9965, test_loss: 0.9996, test_f1: 0.4772
 epoch: 12, train_loss: 0.9864, test_loss: 0.9919, test_f1: 0.4882
 epoch: 13, train_loss: 0.9858, test_loss: 0.9906, test_f1: 0.4902
 epoch: 14, train_loss: 0.9715, test_loss: 0.9908, test_f1: 0.4846
 epoch: 15, train_loss: 0.9659, test_loss: 0.9918, test_f1: 0.4945
 epoch: 16, train_loss: 0.9543, test_loss: 0.9772, test_f1: 0.4913
 epoch: 17, train_loss: 0.9398, test_loss: 0.9847, test_f1: 0.5071
 epoch: 18, train_loss: 0.9343, test_loss: 0.9808, test_f1: 0.5118
 epoch: 19, train_loss: 0.9245, test_loss: 0.9761, test_f1: 0.5248
 epoch: 20, train_loss: 0.9207, test_loss: 0.9759, test_f1: 0.5196
 epoch: 21, train_loss: 0.9184, test_loss: 0.9809, test_f1: 0.5166
 epoch: 22, train_loss: 0.9072, test_loss: 0.9722, test_f1: 0.5177
 epoch: 23, train_loss: 0.9022, test_loss: 0.9621, test_f1: 0.5101
 epoch: 24, train_loss: 0.8853, test_loss: 0.9756, test_f1: 0.5130
 epoch: 25, train_loss: 0.8946, test_loss: 0.9740, test_f1: 0.5095
 epoch: 26, train_loss: 0.8869, test_loss: 0.9720, test_f1: 0.5222
 epoch: 27, train_loss: 0.8727, test_loss: 1.0429, test_f1: 0.5031
 epoch: 28, train_loss: 0.8712, test_loss: 0.9745, test_f1: 0.5196
 epoch: 29, train_loss: 0.8622, test_loss: 0.9798, test_f1: 0.5265
 epoch: 30, train_loss: 0.8573, test_loss: 1.0031, test_f1: 0.5041
 epoch: 31, train_loss: 0.8554, test_loss: 0.9793, test_f1: 0.5247
 epoch: 32, train_loss: 0.8498, test_loss: 0.9998, test_f1: 0.5160
 epoch: 33, train_loss: 0.8493, test_loss: 0.9643, test_f1: 0.5439
 epoch: 34, train_loss: 0.8476, test_loss: 0.9712, test_f1: 0.5268
 epoch: 35, train_loss: 0.8338, test_loss: 0.9947, test_f1: 0.5172
 epoch: 36, train_loss: 0.8243, test_loss: 0.9897, test_f1: 0.5203
 epoch: 37, train_loss: 0.8254, test_loss: 0.9688, test_f1: 0.5238
 epoch: 38, train_loss: 0.8164, test_loss: 0.9729, test_f1: 0.5215
 epoch: 39, train_loss: 0.8065, test_loss: 0.9704, test_f1: 0.5108
 epoch: 40, train_loss: 0.7954, test_loss: 0.9849, test_f1: 0.5200
 epoch: 41, train_loss: 0.8023, test_loss: 0.9857, test_f1: 0.5221
 epoch: 42, train_loss: 0.7907, test_loss: 1.0212, test_f1: 0.5179
 epoch: 43, train_loss: 0.7919, test_loss: 1.0174, test_f1: 0.5221
 epoch: 44, train_loss: 0.7841, test_loss: 1.0218, test_f1: 0.5197
 epoch: 45, train_loss: 0.7940, test_loss: 0.9704, test_f1: 0.5183
 epoch: 46, train_loss: 0.7837, test_loss: 0.9645, test_f1: 0.5294
 epoch: 47, train_loss: 0.7695, test_loss: 1.0089, test_f1: 0.5169
 epoch: 48, train_loss: 0.7765, test_loss: 1.0010, test_f1: 0.5371
 epoch: 49, train_loss: 0.7717, test_loss: 0.9887, test_f1: 0.5303
 epoch: 50, train_loss: 0.7600, test_loss: 0.9618, test_f1: 0.5479
 epoch: 51, train_loss: 0.7489, test_loss: 0.9971, test_f1: 0.5331
 epoch: 52, train_loss: 0.7477, test_loss: 1.0142, test_f1: 0.5297
 epoch: 53, train_loss: 0.7481, test_loss: 1.0271, test_f1: 0.5191
 epoch: 54, train_loss: 0.7483, test_loss: 0.9804, test_f1: 0.5247
 epoch: 55, train_loss: 0.7359, test_loss: 0.9894, test_f1: 0.5271
 epoch: 56, train_loss: 0.7346, test_loss: 1.0013, test_f1: 0.5256
 epoch: 57, train_loss: 0.7300, test_loss: 1.0107, test_f1: 0.5177
 epoch: 58, train_loss: 0.7296, test_loss: 1.0266, test_f1: 0.5221
 epoch: 59, train_loss: 0.7404, test_loss: 1.0418, test_f1: 0.5146
 epoch: 60, train_loss: 0.7359, test_loss: 0.9992, test_f1: 0.5486
 epoch: 61, train_loss: 0.7255, test_loss: 1.0144, test_f1: 0.5229
 epoch: 62, train_loss: 0.7238, test_loss: 1.0095, test_f1: 0.5291
 epoch: 63, train_loss: 0.7282, test_loss: 1.0210, test_f1: 0.5188
 epoch: 64, train_loss: 0.7228, test_loss: 1.0056, test_f1: 0.5373
 epoch: 65, train_loss: 0.7176, test_loss: 1.0158, test_f1: 0.5244
 epoch: 66, train_loss: 0.7090, test_loss: 0.9712, test_f1: 0.5437
 epoch: 67, train_loss: 0.7201, test_loss: 1.0088, test_f1: 0.5200
 epoch: 68, train_loss: 0.7108, test_loss: 1.0196, test_f1: 0.5242
 epoch: 69, train_loss: 0.7111, test_loss: 1.0161, test_f1: 0.5201
 epoch: 70, train_loss: 0.7054, test_loss: 1.0396, test_f1: 0.5187
 epoch: 71, train_loss: 0.7135, test_loss: 1.0303, test_f1: 0.5142
 epoch: 72, train_loss: 0.6976, test_loss: 1.0423, test_f1: 0.5196
 epoch: 73, train_loss: 0.6981, test_loss: 1.0323, test_f1: 0.5216
 epoch: 74, train_loss: 0.7026, test_loss: 0.9832, test_f1: 0.5256
 epoch: 75, train_loss: 0.6858, test_loss: 1.0343, test_f1: 0.5156
 epoch: 76, train_loss: 0.6946, test_loss: 1.0408, test_f1: 0.5217
 epoch: 77, train_loss: 0.6887, test_loss: 1.0271, test_f1: 0.5270
 epoch: 78, train_loss: 0.6888, test_loss: 1.0449, test_f1: 0.5299
 epoch: 79, train_loss: 0.6846, test_loss: 1.0395, test_f1: 0.5230
 epoch: 80, train_loss: 0.6805, test_loss: 1.0482, test_f1: 0.5214
 epoch: 81, train_loss: 0.6996, test_loss: 1.0631, test_f1: 0.5202
 epoch: 82, train_loss: 0.6862, test_loss: 1.0261, test_f1: 0.5466
 epoch: 83, train_loss: 0.6809, test_loss: 1.0533, test_f1: 0.5222
 epoch: 84, train_loss: 0.6834, test_loss: 1.0487, test_f1: 0.5218
 epoch: 85, train_loss: 0.6788, test_loss: 1.0946, test_f1: 0.5211
 epoch: 86, train_loss: 0.6833, test_loss: 1.0557, test_f1: 0.5307
 epoch: 87, train_loss: 0.6702, test_loss: 1.0836, test_f1: 0.5156
 epoch: 88, train_loss: 0.6792, test_loss: 1.0967, test_f1: 0.5086
 epoch: 89, train_loss: 0.6770, test_loss: 1.0525, test_f1: 0.5222
 epoch: 90, train_loss: 0.6734, test_loss: 1.0473, test_f1: 0.5265
 epoch: 91, train_loss: 0.6775, test_loss: 1.0569, test_f1: 0.5186
 epoch: 92, train_loss: 0.6749, test_loss: 1.0941, test_f1: 0.5227
 epoch: 93, train_loss: 0.6642, test_loss: 1.0917, test_f1: 0.5188
 epoch: 94, train_loss: 0.6683, test_loss: 1.0547, test_f1: 0.5319
 epoch: 95, train_loss: 0.6583, test_loss: 1.0954, test_f1: 0.5136
 epoch: 96, train_loss: 0.6683, test_loss: 1.1010, test_f1: 0.5145
 epoch: 97, train_loss: 0.6642, test_loss: 1.0822, test_f1: 0.5178
 epoch: 98, train_loss: 0.6584, test_loss: 1.0955, test_f1: 0.5119
 epoch: 99, train_loss: 0.6546, test_loss: 1.0811, test_f1: 0.5408
##################ITERATION #8 ****************************************
 epoch: 0, train_loss: 1.2611, test_loss: 1.2567, test_f1: 0.2260
 epoch: 1, train_loss: 1.1791, test_loss: 1.1390, test_f1: 0.3866
 epoch: 2, train_loss: 1.1401, test_loss: 1.0737, test_f1: 0.4391
 epoch: 3, train_loss: 1.1121, test_loss: 1.0312, test_f1: 0.4820
 epoch: 4, train_loss: 1.0880, test_loss: 1.0071, test_f1: 0.5035
 epoch: 5, train_loss: 1.0727, test_loss: 0.9954, test_f1: 0.4842
 epoch: 6, train_loss: 1.0538, test_loss: 0.9831, test_f1: 0.4801
 epoch: 7, train_loss: 1.0426, test_loss: 0.9757, test_f1: 0.4907
 epoch: 8, train_loss: 1.0227, test_loss: 0.9725, test_f1: 0.4924
 epoch: 9, train_loss: 1.0290, test_loss: 0.9657, test_f1: 0.4864
 epoch: 10, train_loss: 1.0113, test_loss: 0.9557, test_f1: 0.5130
 epoch: 11, train_loss: 0.9921, test_loss: 0.9607, test_f1: 0.4804
 epoch: 12, train_loss: 0.9847, test_loss: 0.9540, test_f1: 0.4971
 epoch: 13, train_loss: 0.9762, test_loss: 0.9559, test_f1: 0.4874
 epoch: 14, train_loss: 0.9677, test_loss: 0.9549, test_f1: 0.5080
 epoch: 15, train_loss: 0.9579, test_loss: 0.9490, test_f1: 0.5187
 epoch: 16, train_loss: 0.9606, test_loss: 0.9443, test_f1: 0.5207
 epoch: 17, train_loss: 0.9414, test_loss: 0.9468, test_f1: 0.5054
 epoch: 18, train_loss: 0.9354, test_loss: 0.9578, test_f1: 0.5252
 epoch: 19, train_loss: 0.9190, test_loss: 0.9552, test_f1: 0.5178
 epoch: 20, train_loss: 0.9253, test_loss: 0.9393, test_f1: 0.5397
 epoch: 21, train_loss: 0.9187, test_loss: 0.9589, test_f1: 0.5153
 epoch: 22, train_loss: 0.9101, test_loss: 0.9416, test_f1: 0.5023
 epoch: 23, train_loss: 0.9050, test_loss: 0.9439, test_f1: 0.5192
 epoch: 24, train_loss: 0.8984, test_loss: 0.9349, test_f1: 0.5404
 epoch: 25, train_loss: 0.8975, test_loss: 0.9527, test_f1: 0.5106
 epoch: 26, train_loss: 0.8884, test_loss: 0.9197, test_f1: 0.5233
 epoch: 27, train_loss: 0.8711, test_loss: 0.9287, test_f1: 0.5352
 epoch: 28, train_loss: 0.8705, test_loss: 0.9285, test_f1: 0.5352
 epoch: 29, train_loss: 0.8697, test_loss: 0.9220, test_f1: 0.5240
 epoch: 30, train_loss: 0.8590, test_loss: 0.9296, test_f1: 0.5354
 epoch: 31, train_loss: 0.8619, test_loss: 0.9296, test_f1: 0.5150
 epoch: 32, train_loss: 0.8378, test_loss: 0.9562, test_f1: 0.5302
 epoch: 33, train_loss: 0.8601, test_loss: 0.9359, test_f1: 0.5363
 epoch: 34, train_loss: 0.8383, test_loss: 0.9338, test_f1: 0.5435
 epoch: 35, train_loss: 0.8376, test_loss: 0.9307, test_f1: 0.5496
 epoch: 36, train_loss: 0.8394, test_loss: 0.9194, test_f1: 0.5599
 epoch: 37, train_loss: 0.8243, test_loss: 0.9359, test_f1: 0.5339
 epoch: 38, train_loss: 0.8254, test_loss: 0.9314, test_f1: 0.5405
 epoch: 39, train_loss: 0.8088, test_loss: 0.9369, test_f1: 0.5400
 epoch: 40, train_loss: 0.8153, test_loss: 0.9597, test_f1: 0.5289
 epoch: 41, train_loss: 0.8048, test_loss: 0.9170, test_f1: 0.5646
 epoch: 42, train_loss: 0.8011, test_loss: 0.9094, test_f1: 0.5623
 epoch: 43, train_loss: 0.7832, test_loss: 0.9176, test_f1: 0.5668
 epoch: 44, train_loss: 0.7865, test_loss: 0.9097, test_f1: 0.5621
 epoch: 45, train_loss: 0.7893, test_loss: 0.9368, test_f1: 0.5503
 epoch: 46, train_loss: 0.7765, test_loss: 0.9191, test_f1: 0.5533
 epoch: 47, train_loss: 0.7731, test_loss: 0.9053, test_f1: 0.5513
 epoch: 48, train_loss: 0.7683, test_loss: 0.9131, test_f1: 0.5542
 epoch: 49, train_loss: 0.7671, test_loss: 0.9285, test_f1: 0.5468
 epoch: 50, train_loss: 0.7741, test_loss: 0.9277, test_f1: 0.5553
 epoch: 51, train_loss: 0.7615, test_loss: 0.9129, test_f1: 0.5599
 epoch: 52, train_loss: 0.7515, test_loss: 0.9047, test_f1: 0.5484
 epoch: 53, train_loss: 0.7438, test_loss: 0.9193, test_f1: 0.5580
 epoch: 54, train_loss: 0.7385, test_loss: 0.9046, test_f1: 0.5438
 epoch: 55, train_loss: 0.7431, test_loss: 0.8975, test_f1: 0.5595
 epoch: 56, train_loss: 0.7422, test_loss: 0.8941, test_f1: 0.5562
 epoch: 57, train_loss: 0.7429, test_loss: 0.9193, test_f1: 0.5529
 epoch: 58, train_loss: 0.7319, test_loss: 0.9140, test_f1: 0.5598
 epoch: 59, train_loss: 0.7251, test_loss: 0.8930, test_f1: 0.5614
 epoch: 60, train_loss: 0.7253, test_loss: 0.8994, test_f1: 0.5473
 epoch: 61, train_loss: 0.7221, test_loss: 0.9092, test_f1: 0.5599
 epoch: 62, train_loss: 0.7506, test_loss: 0.9198, test_f1: 0.5418
 epoch: 63, train_loss: 0.7271, test_loss: 0.9277, test_f1: 0.5455
 epoch: 64, train_loss: 0.7330, test_loss: 0.9127, test_f1: 0.5572
 epoch: 65, train_loss: 0.7157, test_loss: 0.9251, test_f1: 0.5599
 epoch: 66, train_loss: 0.7221, test_loss: 0.9334, test_f1: 0.5477
 epoch: 67, train_loss: 0.7120, test_loss: 0.9250, test_f1: 0.5555
 epoch: 68, train_loss: 0.7212, test_loss: 0.9215, test_f1: 0.5520
 epoch: 69, train_loss: 0.7225, test_loss: 0.9166, test_f1: 0.5483
 epoch: 70, train_loss: 0.7072, test_loss: 0.9140, test_f1: 0.5628
 epoch: 71, train_loss: 0.7079, test_loss: 0.9189, test_f1: 0.5632
 epoch: 72, train_loss: 0.7027, test_loss: 0.9297, test_f1: 0.5605
 epoch: 73, train_loss: 0.6921, test_loss: 0.9383, test_f1: 0.5471
 epoch: 74, train_loss: 0.7005, test_loss: 0.9163, test_f1: 0.5565
 epoch: 75, train_loss: 0.7002, test_loss: 0.9065, test_f1: 0.5564
 epoch: 76, train_loss: 0.6971, test_loss: 0.9309, test_f1: 0.5669
 epoch: 77, train_loss: 0.6929, test_loss: 0.9497, test_f1: 0.5669
 epoch: 78, train_loss: 0.6898, test_loss: 0.9380, test_f1: 0.5602
 epoch: 79, train_loss: 0.6949, test_loss: 0.9424, test_f1: 0.5681
 epoch: 80, train_loss: 0.6860, test_loss: 0.9531, test_f1: 0.5603
 epoch: 81, train_loss: 0.6867, test_loss: 0.9374, test_f1: 0.5656
 epoch: 82, train_loss: 0.6793, test_loss: 0.9286, test_f1: 0.5657
 epoch: 83, train_loss: 0.6780, test_loss: 0.9511, test_f1: 0.5576
 epoch: 84, train_loss: 0.6964, test_loss: 0.9470, test_f1: 0.5576
 epoch: 85, train_loss: 0.6768, test_loss: 0.9419, test_f1: 0.5686
 epoch: 86, train_loss: 0.6832, test_loss: 0.9668, test_f1: 0.5528
 epoch: 87, train_loss: 0.6835, test_loss: 0.9414, test_f1: 0.5569
 epoch: 88, train_loss: 0.6688, test_loss: 0.9456, test_f1: 0.5543
 epoch: 89, train_loss: 0.6797, test_loss: 0.9420, test_f1: 0.5605
 epoch: 90, train_loss: 0.6891, test_loss: 0.9309, test_f1: 0.5623
 epoch: 91, train_loss: 0.6735, test_loss: 0.9529, test_f1: 0.5551
 epoch: 92, train_loss: 0.6727, test_loss: 0.9331, test_f1: 0.5586
 epoch: 93, train_loss: 0.6615, test_loss: 0.9534, test_f1: 0.5543
 epoch: 94, train_loss: 0.6712, test_loss: 0.9632, test_f1: 0.5550
 epoch: 95, train_loss: 0.6718, test_loss: 0.9792, test_f1: 0.5417
 epoch: 96, train_loss: 0.6686, test_loss: 0.9687, test_f1: 0.5619
 epoch: 97, train_loss: 0.6654, test_loss: 0.9833, test_f1: 0.5363
 epoch: 98, train_loss: 0.6519, test_loss: 0.9666, test_f1: 0.5677
 epoch: 99, train_loss: 0.6711, test_loss: 0.9944, test_f1: 0.5527
##################ITERATION #9 ****************************************
 epoch: 0, train_loss: 1.2806, test_loss: 1.2673, test_f1: 0.3138
 epoch: 1, train_loss: 1.1698, test_loss: 1.1663, test_f1: 0.3999
 epoch: 2, train_loss: 1.1336, test_loss: 1.0673, test_f1: 0.4685
 epoch: 3, train_loss: 1.0945, test_loss: 1.0418, test_f1: 0.4704
 epoch: 4, train_loss: 1.0826, test_loss: 1.0123, test_f1: 0.4851
 epoch: 5, train_loss: 1.0485, test_loss: 1.0013, test_f1: 0.4831
 epoch: 6, train_loss: 1.0367, test_loss: 0.9898, test_f1: 0.4879
 epoch: 7, train_loss: 1.0206, test_loss: 0.9809, test_f1: 0.4879
 epoch: 8, train_loss: 1.0069, test_loss: 0.9716, test_f1: 0.5193
 epoch: 9, train_loss: 0.9844, test_loss: 0.9665, test_f1: 0.5171
 epoch: 10, train_loss: 0.9858, test_loss: 0.9539, test_f1: 0.4939
 epoch: 11, train_loss: 0.9689, test_loss: 0.9535, test_f1: 0.5245
 epoch: 12, train_loss: 0.9663, test_loss: 0.9409, test_f1: 0.5147
 epoch: 13, train_loss: 0.9529, test_loss: 0.9444, test_f1: 0.5131
 epoch: 14, train_loss: 0.9356, test_loss: 0.9353, test_f1: 0.5130
 epoch: 15, train_loss: 0.9248, test_loss: 0.9245, test_f1: 0.5225
 epoch: 16, train_loss: 0.9146, test_loss: 0.9267, test_f1: 0.5192
 epoch: 17, train_loss: 0.9124, test_loss: 0.9221, test_f1: 0.5254
 epoch: 18, train_loss: 0.9024, test_loss: 0.9202, test_f1: 0.4983
 epoch: 19, train_loss: 0.8971, test_loss: 0.9049, test_f1: 0.5165
 epoch: 20, train_loss: 0.8908, test_loss: 0.9052, test_f1: 0.5303
 epoch: 21, train_loss: 0.8886, test_loss: 0.9245, test_f1: 0.5429
 epoch: 22, train_loss: 0.8758, test_loss: 0.9238, test_f1: 0.5312
 epoch: 23, train_loss: 0.8640, test_loss: 0.8938, test_f1: 0.5190
 epoch: 24, train_loss: 0.8684, test_loss: 0.9035, test_f1: 0.5295
 epoch: 25, train_loss: 0.8600, test_loss: 0.9113, test_f1: 0.5315
 epoch: 26, train_loss: 0.8561, test_loss: 0.8946, test_f1: 0.5229
 epoch: 27, train_loss: 0.8465, test_loss: 0.9057, test_f1: 0.5522
 epoch: 28, train_loss: 0.8325, test_loss: 0.9066, test_f1: 0.5208
 epoch: 29, train_loss: 0.8309, test_loss: 0.8996, test_f1: 0.5608
 epoch: 30, train_loss: 0.8380, test_loss: 0.9135, test_f1: 0.5463
 epoch: 31, train_loss: 0.8207, test_loss: 0.8914, test_f1: 0.5493
 epoch: 32, train_loss: 0.8064, test_loss: 0.9061, test_f1: 0.5493
 epoch: 33, train_loss: 0.8117, test_loss: 0.8867, test_f1: 0.5421
 epoch: 34, train_loss: 0.8023, test_loss: 0.8963, test_f1: 0.5559
 epoch: 35, train_loss: 0.7967, test_loss: 0.8880, test_f1: 0.5592
 epoch: 36, train_loss: 0.8068, test_loss: 0.9050, test_f1: 0.5434
 epoch: 37, train_loss: 0.7963, test_loss: 0.8893, test_f1: 0.5621
 epoch: 38, train_loss: 0.7962, test_loss: 0.8935, test_f1: 0.5585
 epoch: 39, train_loss: 0.7778, test_loss: 0.9019, test_f1: 0.5539
 epoch: 40, train_loss: 0.7736, test_loss: 0.9013, test_f1: 0.5291
 epoch: 41, train_loss: 0.7788, test_loss: 0.9302, test_f1: 0.5243
 epoch: 42, train_loss: 0.7662, test_loss: 0.8883, test_f1: 0.5709
 epoch: 43, train_loss: 0.7665, test_loss: 0.9010, test_f1: 0.5652
 epoch: 44, train_loss: 0.7655, test_loss: 0.8989, test_f1: 0.5586
 epoch: 45, train_loss: 0.7456, test_loss: 0.9210, test_f1: 0.5583
 epoch: 46, train_loss: 0.7572, test_loss: 0.9143, test_f1: 0.5569
 epoch: 47, train_loss: 0.7444, test_loss: 0.9042, test_f1: 0.5428
 epoch: 48, train_loss: 0.7472, test_loss: 0.9109, test_f1: 0.5475
 epoch: 49, train_loss: 0.7450, test_loss: 0.9041, test_f1: 0.5532
 epoch: 50, train_loss: 0.7412, test_loss: 0.9022, test_f1: 0.5447
 epoch: 51, train_loss: 0.7422, test_loss: 0.9172, test_f1: 0.5510
 epoch: 52, train_loss: 0.7337, test_loss: 0.9115, test_f1: 0.5449
 epoch: 53, train_loss: 0.7309, test_loss: 0.9179, test_f1: 0.5560
 epoch: 54, train_loss: 0.7341, test_loss: 0.9139, test_f1: 0.5573
 epoch: 55, train_loss: 0.7190, test_loss: 0.9087, test_f1: 0.5577
 epoch: 56, train_loss: 0.7226, test_loss: 0.9317, test_f1: 0.5439
 epoch: 57, train_loss: 0.7156, test_loss: 0.9095, test_f1: 0.5649
 epoch: 58, train_loss: 0.7155, test_loss: 0.9189, test_f1: 0.5648
 epoch: 59, train_loss: 0.7103, test_loss: 0.9076, test_f1: 0.5698
 epoch: 60, train_loss: 0.7161, test_loss: 0.9095, test_f1: 0.5508
 epoch: 61, train_loss: 0.7034, test_loss: 0.9218, test_f1: 0.5496
 epoch: 62, train_loss: 0.7049, test_loss: 0.9293, test_f1: 0.5466
 epoch: 63, train_loss: 0.7097, test_loss: 0.9161, test_f1: 0.5489
 epoch: 64, train_loss: 0.7158, test_loss: 0.9311, test_f1: 0.5626
 epoch: 65, train_loss: 0.7084, test_loss: 0.9035, test_f1: 0.5492
 epoch: 66, train_loss: 0.7110, test_loss: 0.9229, test_f1: 0.5374
 epoch: 67, train_loss: 0.7008, test_loss: 0.9317, test_f1: 0.5618
 epoch: 68, train_loss: 0.6886, test_loss: 0.9214, test_f1: 0.5643
 epoch: 69, train_loss: 0.6962, test_loss: 0.9097, test_f1: 0.5594
 epoch: 70, train_loss: 0.6947, test_loss: 0.9346, test_f1: 0.5488
 epoch: 71, train_loss: 0.6855, test_loss: 0.9257, test_f1: 0.5525
 epoch: 72, train_loss: 0.6878, test_loss: 0.9128, test_f1: 0.5458
 epoch: 73, train_loss: 0.7019, test_loss: 0.9270, test_f1: 0.5535
 epoch: 74, train_loss: 0.6958, test_loss: 0.9522, test_f1: 0.5430
 epoch: 75, train_loss: 0.6851, test_loss: 0.9409, test_f1: 0.5613
 epoch: 76, train_loss: 0.6886, test_loss: 0.9311, test_f1: 0.5367
 epoch: 77, train_loss: 0.7048, test_loss: 0.9322, test_f1: 0.5581
 epoch: 78, train_loss: 0.6827, test_loss: 0.9266, test_f1: 0.5484
 epoch: 79, train_loss: 0.6878, test_loss: 0.9281, test_f1: 0.5408
 epoch: 80, train_loss: 0.6755, test_loss: 0.9182, test_f1: 0.5537
 epoch: 81, train_loss: 0.6758, test_loss: 0.9140, test_f1: 0.5723
 epoch: 82, train_loss: 0.6798, test_loss: 0.9403, test_f1: 0.5466
 epoch: 83, train_loss: 0.6692, test_loss: 0.9702, test_f1: 0.5510
 epoch: 84, train_loss: 0.6661, test_loss: 0.9269, test_f1: 0.5566
 epoch: 85, train_loss: 0.6607, test_loss: 0.9235, test_f1: 0.5510
 epoch: 86, train_loss: 0.6612, test_loss: 0.9324, test_f1: 0.5534
 epoch: 87, train_loss: 0.6670, test_loss: 0.9544, test_f1: 0.5328
 epoch: 88, train_loss: 0.6516, test_loss: 0.9320, test_f1: 0.5628
 epoch: 89, train_loss: 0.6724, test_loss: 0.9442, test_f1: 0.5554
 epoch: 90, train_loss: 0.6717, test_loss: 0.9361, test_f1: 0.5610
 epoch: 91, train_loss: 0.6709, test_loss: 0.9593, test_f1: 0.5560
 epoch: 92, train_loss: 0.6553, test_loss: 0.9375, test_f1: 0.5457
 epoch: 93, train_loss: 0.6457, test_loss: 0.9403, test_f1: 0.5461
 epoch: 94, train_loss: 0.6617, test_loss: 0.9363, test_f1: 0.5429
 epoch: 95, train_loss: 0.6664, test_loss: 0.9265, test_f1: 0.5645
 epoch: 96, train_loss: 0.6569, test_loss: 0.9475, test_f1: 0.5432
 epoch: 97, train_loss: 0.6537, test_loss: 0.9225, test_f1: 0.5607
 epoch: 98, train_loss: 0.6477, test_loss: 0.9274, test_f1: 0.5617
 epoch: 99, train_loss: 0.6630, test_loss: 0.9387, test_f1: 0.5652

Training completed in 575.77 seconds
Best F1: 0.5842 at epoch 92
Mean F1 across iterations: 0.5647  0.0154
========================FINAL RESULTS================================
FEGIN weighted F1: 0.5842  0.0154
python main.py --data ltspice_examples --representation component_pin --model FEGIN --layers 6 --hiddens 64 --batch_size 128 --lr 0.0001 --emb_size 250 --epochs 100 --save_appendix component_pin_L6_H64_BS128_LR0.0001_E250 --no_val
-----



STDERR:
  File "main.py", line 370, in <module>
    main()
  File "main.py", line 254, in main
    dataset = dataset_class(
  File "/home/philip/projects/ltspice_examples_code_repo/Circuit-Completion-Using-GNNs/component_classification_with_link_prediction_head/evaluation/FEGIN/kernel/circuit_datasets.py", line 15, in __init__
    self.data, self.slices = torch.load(self.processed_paths[0])
  File "/home/philip/.local/lib/python3.8/site-packages/torch/serialization.py", line 1040, in load
    warnings.warn(
  File "/usr/lib/python3.8/warnings.py", line 109, in _showwarnmsg
    sw(msg.message, msg.category, msg.filename, msg.lineno,
  File "main.py", line 47, in warn_with_traceback
    traceback.print_stack(file=log)
/home/philip/projects/ltspice_examples_code_repo/Circuit-Completion-Using-GNNs/component_classification_with_link_prediction_head/evaluation/FEGIN/kernel/circuit_datasets.py:15: FutureWarning: You are using `torch.load` with `weights_only=False` (the current default value), which uses the default pickle module implicitly. It is possible to construct malicious pickle data which will execute arbitrary code during unpickling (See https://github.com/pytorch/pytorch/blob/main/SECURITY.md#untrusted-models for more details). In a future release, the default value for `weights_only` will be flipped to `True`. This limits the functions that could be executed during unpickling. Arbitrary objects will no longer be allowed to be loaded via this mode unless they are explicitly allowlisted by the user via `torch.serialization.add_safe_globals`. We recommend you start setting `weights_only=True` for any use case where you don't have full control of the loaded file. Please open an issue on GitHub for any issues related to this experimental feature.
  self.data, self.slices = torch.load(self.processed_paths[0])
