STDOUT:
Results will be saved in /home/philip/projects/ltspice_examples_code_repo/Circuit-Completion-Using-GNNs/component_classification_with_link_prediction_head/evaluation/FEGIN/results/model_FEGIN_dataset_ltspice_demos
Command line input: python main.py --data ltspice_demos --representation component_pin --model FEGIN --layers 4 --hiddens 16 --batch_size 64 --lr 0.001 --emb_size 250 --epochs 100 --save_appendix component_pin_L4_H16_BS64_LR0.001_E250 --no_val
 is saved.
-----
ltspice_demos - FEGIN
Using 4 layers, 16 hidden units, h = 2
Loading component_pin representation dataset
ENTERED
Training FEGIN on component_pin representation
Train: 1565, Test: 383
##################ITERATION #0 ****************************************
 epoch: 0, train_loss: 1.4364, test_loss: 1.4040, test_f1: 0.0497
 epoch: 1, train_loss: 1.3601, test_loss: 1.3605, test_f1: 0.1365
 epoch: 2, train_loss: 1.2939, test_loss: 1.3172, test_f1: 0.1365
 epoch: 3, train_loss: 1.2400, test_loss: 1.2764, test_f1: 0.1485
 epoch: 4, train_loss: 1.2035, test_loss: 1.2427, test_f1: 0.1796
 epoch: 5, train_loss: 1.1761, test_loss: 1.2523, test_f1: 0.3416
 epoch: 6, train_loss: 1.1552, test_loss: 1.2286, test_f1: 0.2648
 epoch: 7, train_loss: 1.1293, test_loss: 1.2255, test_f1: 0.2311
 epoch: 8, train_loss: 1.1170, test_loss: 1.2098, test_f1: 0.3705
 epoch: 9, train_loss: 1.1030, test_loss: 1.1652, test_f1: 0.4531
 epoch: 10, train_loss: 1.0959, test_loss: 1.1550, test_f1: 0.4504
 epoch: 11, train_loss: 1.0732, test_loss: 1.2235, test_f1: 0.4207
 epoch: 12, train_loss: 1.0663, test_loss: 1.2838, test_f1: 0.4159
 epoch: 13, train_loss: 1.0628, test_loss: 1.2143, test_f1: 0.3557
 epoch: 14, train_loss: 1.0330, test_loss: 1.1231, test_f1: 0.4341
 epoch: 15, train_loss: 1.0157, test_loss: 1.0832, test_f1: 0.4707
 epoch: 16, train_loss: 0.9895, test_loss: 1.0570, test_f1: 0.4512
 epoch: 17, train_loss: 0.9714, test_loss: 1.0660, test_f1: 0.4814
 epoch: 18, train_loss: 0.9540, test_loss: 1.1549, test_f1: 0.4017
 epoch: 19, train_loss: 0.9373, test_loss: 1.1076, test_f1: 0.4863
 epoch: 20, train_loss: 0.9240, test_loss: 1.0327, test_f1: 0.5419
 epoch: 21, train_loss: 0.9260, test_loss: 1.0625, test_f1: 0.5053
 epoch: 22, train_loss: 0.9035, test_loss: 1.0027, test_f1: 0.5604
 epoch: 23, train_loss: 0.9025, test_loss: 1.0860, test_f1: 0.5464
 epoch: 24, train_loss: 0.9155, test_loss: 1.1904, test_f1: 0.4336
 epoch: 25, train_loss: 0.8832, test_loss: 1.1649, test_f1: 0.4733
 epoch: 26, train_loss: 0.8890, test_loss: 1.0212, test_f1: 0.5777
 epoch: 27, train_loss: 0.8616, test_loss: 1.0523, test_f1: 0.5821
 epoch: 28, train_loss: 0.8659, test_loss: 1.0264, test_f1: 0.5733
 epoch: 29, train_loss: 0.8486, test_loss: 0.9532, test_f1: 0.5757
 epoch: 30, train_loss: 0.8413, test_loss: 0.9953, test_f1: 0.5755
 epoch: 31, train_loss: 0.8720, test_loss: 1.1603, test_f1: 0.5630
 epoch: 32, train_loss: 0.8437, test_loss: 0.9490, test_f1: 0.5963
 epoch: 33, train_loss: 0.8142, test_loss: 1.0853, test_f1: 0.5826
 epoch: 34, train_loss: 0.8330, test_loss: 0.9451, test_f1: 0.5612
 epoch: 35, train_loss: 0.7972, test_loss: 0.9762, test_f1: 0.5986
 epoch: 36, train_loss: 0.8053, test_loss: 1.0950, test_f1: 0.5748
 epoch: 37, train_loss: 0.8081, test_loss: 1.1087, test_f1: 0.5435
 epoch: 38, train_loss: 0.8147, test_loss: 0.9516, test_f1: 0.5853
 epoch: 39, train_loss: 0.7797, test_loss: 0.9514, test_f1: 0.5897
 epoch: 40, train_loss: 0.7817, test_loss: 1.1406, test_f1: 0.5771
 epoch: 41, train_loss: 0.7904, test_loss: 1.1352, test_f1: 0.5880
 epoch: 42, train_loss: 0.7887, test_loss: 1.1175, test_f1: 0.5766
 epoch: 43, train_loss: 0.7984, test_loss: 0.9603, test_f1: 0.6271
 epoch: 44, train_loss: 0.7935, test_loss: 0.9976, test_f1: 0.5772
 epoch: 45, train_loss: 0.7673, test_loss: 1.0173, test_f1: 0.5920
 epoch: 46, train_loss: 0.7585, test_loss: 1.0760, test_f1: 0.5677
 epoch: 47, train_loss: 0.7675, test_loss: 1.1682, test_f1: 0.5632
 epoch: 48, train_loss: 0.7612, test_loss: 1.0891, test_f1: 0.6027
 epoch: 49, train_loss: 0.7541, test_loss: 1.0074, test_f1: 0.5970
 epoch: 50, train_loss: 0.7662, test_loss: 1.0782, test_f1: 0.5823
 epoch: 51, train_loss: 0.7514, test_loss: 1.0356, test_f1: 0.5879
 epoch: 52, train_loss: 0.7415, test_loss: 0.9896, test_f1: 0.6038
 epoch: 53, train_loss: 0.7303, test_loss: 1.0579, test_f1: 0.5929
 epoch: 54, train_loss: 0.7267, test_loss: 1.0373, test_f1: 0.6036
 epoch: 55, train_loss: 0.7323, test_loss: 1.0701, test_f1: 0.5715
 epoch: 56, train_loss: 0.7283, test_loss: 1.0411, test_f1: 0.5775
 epoch: 57, train_loss: 0.7279, test_loss: 1.1181, test_f1: 0.5776
 epoch: 58, train_loss: 0.7074, test_loss: 1.1378, test_f1: 0.5733
 epoch: 59, train_loss: 0.7292, test_loss: 1.0285, test_f1: 0.5807
 epoch: 60, train_loss: 0.7379, test_loss: 1.1673, test_f1: 0.5725
 epoch: 61, train_loss: 0.7178, test_loss: 1.0364, test_f1: 0.5810
 epoch: 62, train_loss: 0.7162, test_loss: 1.0780, test_f1: 0.5585
 epoch: 63, train_loss: 0.7191, test_loss: 1.1243, test_f1: 0.5576
 epoch: 64, train_loss: 0.7276, test_loss: 1.0303, test_f1: 0.5854
 epoch: 65, train_loss: 0.6870, test_loss: 1.0571, test_f1: 0.5481
 epoch: 66, train_loss: 0.7207, test_loss: 1.1244, test_f1: 0.5409
 epoch: 67, train_loss: 0.7153, test_loss: 1.0690, test_f1: 0.5576
 epoch: 68, train_loss: 0.6963, test_loss: 1.0244, test_f1: 0.5780
 epoch: 69, train_loss: 0.7118, test_loss: 1.0820, test_f1: 0.5692
 epoch: 70, train_loss: 0.7128, test_loss: 1.0680, test_f1: 0.5666
 epoch: 71, train_loss: 0.7176, test_loss: 1.0374, test_f1: 0.5811
 epoch: 72, train_loss: 0.6981, test_loss: 1.1520, test_f1: 0.5373
 epoch: 73, train_loss: 0.6988, test_loss: 1.0796, test_f1: 0.5613
 epoch: 74, train_loss: 0.7106, test_loss: 1.1143, test_f1: 0.5587
 epoch: 75, train_loss: 0.7096, test_loss: 1.0660, test_f1: 0.5487
 epoch: 76, train_loss: 0.6933, test_loss: 1.1555, test_f1: 0.5852
 epoch: 77, train_loss: 0.7005, test_loss: 1.2450, test_f1: 0.5482
 epoch: 78, train_loss: 0.6966, test_loss: 1.0981, test_f1: 0.5595
 epoch: 79, train_loss: 0.6908, test_loss: 1.1304, test_f1: 0.5572
 epoch: 80, train_loss: 0.7022, test_loss: 1.0914, test_f1: 0.5354
 epoch: 81, train_loss: 0.7177, test_loss: 1.2259, test_f1: 0.5771
 epoch: 82, train_loss: 0.6966, test_loss: 1.0964, test_f1: 0.5711
 epoch: 83, train_loss: 0.6806, test_loss: 1.1021, test_f1: 0.5777
 epoch: 84, train_loss: 0.6762, test_loss: 1.1690, test_f1: 0.5638
 epoch: 85, train_loss: 0.6785, test_loss: 1.1511, test_f1: 0.5307
 epoch: 86, train_loss: 0.6938, test_loss: 1.1235, test_f1: 0.5664
 epoch: 87, train_loss: 0.6880, test_loss: 1.1453, test_f1: 0.5935
 epoch: 88, train_loss: 0.6974, test_loss: 1.1303, test_f1: 0.5741
 epoch: 89, train_loss: 0.6901, test_loss: 1.1378, test_f1: 0.5763
 epoch: 90, train_loss: 0.6814, test_loss: 1.1030, test_f1: 0.5737
 epoch: 91, train_loss: 0.6696, test_loss: 1.1590, test_f1: 0.5626
 epoch: 92, train_loss: 0.6828, test_loss: 1.2434, test_f1: 0.5748
 epoch: 93, train_loss: 0.6618, test_loss: 1.2803, test_f1: 0.5565
 epoch: 94, train_loss: 0.6717, test_loss: 1.1141, test_f1: 0.5731
 epoch: 95, train_loss: 0.6925, test_loss: 1.2239, test_f1: 0.5560
 epoch: 96, train_loss: 0.6696, test_loss: 1.1602, test_f1: 0.5830
 epoch: 97, train_loss: 0.6748, test_loss: 1.2247, test_f1: 0.5469
 epoch: 98, train_loss: 0.6585, test_loss: 1.1900, test_f1: 0.5768
 epoch: 99, train_loss: 0.6803, test_loss: 1.1622, test_f1: 0.5650
##################ITERATION #1 ****************************************
 epoch: 0, train_loss: 1.3834, test_loss: 1.3022, test_f1: 0.2281
 epoch: 1, train_loss: 1.2237, test_loss: 1.2666, test_f1: 0.2281
 epoch: 2, train_loss: 1.1949, test_loss: 1.2383, test_f1: 0.2281
 epoch: 3, train_loss: 1.1774, test_loss: 1.2272, test_f1: 0.2993
 epoch: 4, train_loss: 1.1336, test_loss: 1.2052, test_f1: 0.3587
 epoch: 5, train_loss: 1.1182, test_loss: 1.1926, test_f1: 0.3801
 epoch: 6, train_loss: 1.0971, test_loss: 1.1658, test_f1: 0.4030
 epoch: 7, train_loss: 1.0660, test_loss: 1.1377, test_f1: 0.4316
 epoch: 8, train_loss: 1.0481, test_loss: 1.1368, test_f1: 0.4421
 epoch: 9, train_loss: 1.0080, test_loss: 1.0991, test_f1: 0.4330
 epoch: 10, train_loss: 1.0034, test_loss: 1.0788, test_f1: 0.4542
 epoch: 11, train_loss: 0.9751, test_loss: 1.0886, test_f1: 0.4526
 epoch: 12, train_loss: 0.9408, test_loss: 1.0720, test_f1: 0.4861
 epoch: 13, train_loss: 0.9273, test_loss: 1.0350, test_f1: 0.5245
 epoch: 14, train_loss: 0.9164, test_loss: 1.0222, test_f1: 0.4781
 epoch: 15, train_loss: 0.8969, test_loss: 1.0253, test_f1: 0.5087
 epoch: 16, train_loss: 0.8796, test_loss: 1.0436, test_f1: 0.4817
 epoch: 17, train_loss: 0.8822, test_loss: 1.0274, test_f1: 0.5074
 epoch: 18, train_loss: 0.8777, test_loss: 1.1426, test_f1: 0.5124
 epoch: 19, train_loss: 0.8557, test_loss: 1.0499, test_f1: 0.4816
 epoch: 20, train_loss: 0.8508, test_loss: 1.0785, test_f1: 0.5273
 epoch: 21, train_loss: 0.8357, test_loss: 1.0526, test_f1: 0.4697
 epoch: 22, train_loss: 0.8143, test_loss: 1.0971, test_f1: 0.5278
 epoch: 23, train_loss: 0.8186, test_loss: 1.1033, test_f1: 0.5353
 epoch: 24, train_loss: 0.8265, test_loss: 1.0447, test_f1: 0.5019
 epoch: 25, train_loss: 0.8161, test_loss: 1.0763, test_f1: 0.5426
 epoch: 26, train_loss: 0.8227, test_loss: 1.0310, test_f1: 0.5431
 epoch: 27, train_loss: 0.8210, test_loss: 1.0891, test_f1: 0.5373
 epoch: 28, train_loss: 0.8038, test_loss: 1.0533, test_f1: 0.5302
 epoch: 29, train_loss: 0.7996, test_loss: 1.0242, test_f1: 0.5674
 epoch: 30, train_loss: 0.7885, test_loss: 1.0444, test_f1: 0.5569
 epoch: 31, train_loss: 0.7947, test_loss: 1.0956, test_f1: 0.5097
 epoch: 32, train_loss: 0.7873, test_loss: 1.0394, test_f1: 0.5600
 epoch: 33, train_loss: 0.7653, test_loss: 1.0247, test_f1: 0.5685
 epoch: 34, train_loss: 0.7765, test_loss: 1.0296, test_f1: 0.5848
 epoch: 35, train_loss: 0.7618, test_loss: 1.0465, test_f1: 0.5364
 epoch: 36, train_loss: 0.7751, test_loss: 1.0371, test_f1: 0.5871
 epoch: 37, train_loss: 0.7680, test_loss: 1.0152, test_f1: 0.5550
 epoch: 38, train_loss: 0.7996, test_loss: 1.0217, test_f1: 0.5261
 epoch: 39, train_loss: 0.7801, test_loss: 1.0913, test_f1: 0.5372
 epoch: 40, train_loss: 0.7729, test_loss: 1.0235, test_f1: 0.5571
 epoch: 41, train_loss: 0.7655, test_loss: 1.0765, test_f1: 0.5691
 epoch: 42, train_loss: 0.7447, test_loss: 1.1077, test_f1: 0.5189
 epoch: 43, train_loss: 0.7702, test_loss: 1.0294, test_f1: 0.5381
 epoch: 44, train_loss: 0.7552, test_loss: 1.1074, test_f1: 0.5422
 epoch: 45, train_loss: 0.7695, test_loss: 0.9893, test_f1: 0.5722
 epoch: 46, train_loss: 0.7477, test_loss: 1.0565, test_f1: 0.5654
 epoch: 47, train_loss: 0.7437, test_loss: 1.0344, test_f1: 0.5695
 epoch: 48, train_loss: 0.7300, test_loss: 1.0745, test_f1: 0.5549
 epoch: 49, train_loss: 0.7385, test_loss: 1.1228, test_f1: 0.5473
 epoch: 50, train_loss: 0.7341, test_loss: 1.1330, test_f1: 0.5390
 epoch: 51, train_loss: 0.7229, test_loss: 1.0190, test_f1: 0.5694
 epoch: 52, train_loss: 0.7299, test_loss: 1.0912, test_f1: 0.5678
 epoch: 53, train_loss: 0.7164, test_loss: 1.0371, test_f1: 0.5631
 epoch: 54, train_loss: 0.7137, test_loss: 1.0114, test_f1: 0.5745
 epoch: 55, train_loss: 0.7159, test_loss: 1.0566, test_f1: 0.5893
 epoch: 56, train_loss: 0.7076, test_loss: 1.0530, test_f1: 0.5840
 epoch: 57, train_loss: 0.7176, test_loss: 1.0599, test_f1: 0.5683
 epoch: 58, train_loss: 0.7229, test_loss: 1.0641, test_f1: 0.5530
 epoch: 59, train_loss: 0.7166, test_loss: 1.0428, test_f1: 0.5859
 epoch: 60, train_loss: 0.7082, test_loss: 1.0153, test_f1: 0.6094
 epoch: 61, train_loss: 0.7045, test_loss: 1.0702, test_f1: 0.5668
 epoch: 62, train_loss: 0.7046, test_loss: 1.0095, test_f1: 0.5998
 epoch: 63, train_loss: 0.7037, test_loss: 1.0297, test_f1: 0.5736
 epoch: 64, train_loss: 0.6955, test_loss: 1.0910, test_f1: 0.5874
 epoch: 65, train_loss: 0.6818, test_loss: 1.0474, test_f1: 0.5698
 epoch: 66, train_loss: 0.7086, test_loss: 1.1223, test_f1: 0.5720
 epoch: 67, train_loss: 0.7071, test_loss: 1.0821, test_f1: 0.5384
 epoch: 68, train_loss: 0.7045, test_loss: 1.0795, test_f1: 0.5720
 epoch: 69, train_loss: 0.7064, test_loss: 1.1222, test_f1: 0.5486
 epoch: 70, train_loss: 0.7035, test_loss: 1.0702, test_f1: 0.5818
 epoch: 71, train_loss: 0.6844, test_loss: 1.1372, test_f1: 0.5407
 epoch: 72, train_loss: 0.7056, test_loss: 1.1017, test_f1: 0.5421
 epoch: 73, train_loss: 0.6985, test_loss: 1.1142, test_f1: 0.5182
 epoch: 74, train_loss: 0.7153, test_loss: 1.1879, test_f1: 0.5492
 epoch: 75, train_loss: 0.6926, test_loss: 1.2089, test_f1: 0.5471
 epoch: 76, train_loss: 0.6884, test_loss: 1.1011, test_f1: 0.5466
 epoch: 77, train_loss: 0.6941, test_loss: 1.0869, test_f1: 0.5608
 epoch: 78, train_loss: 0.6979, test_loss: 1.2772, test_f1: 0.5409
 epoch: 79, train_loss: 0.6942, test_loss: 1.0993, test_f1: 0.5666
 epoch: 80, train_loss: 0.6880, test_loss: 1.2046, test_f1: 0.5396
 epoch: 81, train_loss: 0.6954, test_loss: 1.0999, test_f1: 0.5822
 epoch: 82, train_loss: 0.7012, test_loss: 1.0949, test_f1: 0.5339
 epoch: 83, train_loss: 0.6907, test_loss: 1.1530, test_f1: 0.5476
 epoch: 84, train_loss: 0.6863, test_loss: 1.1114, test_f1: 0.5751
 epoch: 85, train_loss: 0.6751, test_loss: 1.1908, test_f1: 0.5640
 epoch: 86, train_loss: 0.6769, test_loss: 1.1156, test_f1: 0.5667
 epoch: 87, train_loss: 0.6768, test_loss: 1.0911, test_f1: 0.5689
 epoch: 88, train_loss: 0.6752, test_loss: 1.1295, test_f1: 0.5733
 epoch: 89, train_loss: 0.6797, test_loss: 1.1263, test_f1: 0.5535
 epoch: 90, train_loss: 0.6879, test_loss: 1.2361, test_f1: 0.5598
 epoch: 91, train_loss: 0.6850, test_loss: 1.2743, test_f1: 0.5421
 epoch: 92, train_loss: 0.6693, test_loss: 1.0774, test_f1: 0.5731
 epoch: 93, train_loss: 0.6773, test_loss: 1.1247, test_f1: 0.5854
 epoch: 94, train_loss: 0.7061, test_loss: 1.1140, test_f1: 0.5402
 epoch: 95, train_loss: 0.6869, test_loss: 1.1613, test_f1: 0.5694
 epoch: 96, train_loss: 0.6824, test_loss: 1.2036, test_f1: 0.5393
 epoch: 97, train_loss: 0.6696, test_loss: 1.1798, test_f1: 0.5621
 epoch: 98, train_loss: 0.6678, test_loss: 1.1917, test_f1: 0.5797
 epoch: 99, train_loss: 0.6626, test_loss: 1.1437, test_f1: 0.5692
##################ITERATION #2 ****************************************
 epoch: 0, train_loss: 1.4014, test_loss: 1.3396, test_f1: 0.2281
 epoch: 1, train_loss: 1.2414, test_loss: 1.3117, test_f1: 0.2281
 epoch: 2, train_loss: 1.1897, test_loss: 1.2322, test_f1: 0.2390
 epoch: 3, train_loss: 1.1376, test_loss: 1.2047, test_f1: 0.3082
 epoch: 4, train_loss: 1.1019, test_loss: 1.1582, test_f1: 0.3800
 epoch: 5, train_loss: 1.0778, test_loss: 1.1421, test_f1: 0.3879
 epoch: 6, train_loss: 1.0506, test_loss: 1.1378, test_f1: 0.4084
 epoch: 7, train_loss: 1.0360, test_loss: 1.1296, test_f1: 0.3965
 epoch: 8, train_loss: 1.0204, test_loss: 1.1518, test_f1: 0.3986
 epoch: 9, train_loss: 1.0023, test_loss: 1.1099, test_f1: 0.4662
 epoch: 10, train_loss: 0.9963, test_loss: 1.0890, test_f1: 0.4542
 epoch: 11, train_loss: 0.9856, test_loss: 1.0812, test_f1: 0.4557
 epoch: 12, train_loss: 0.9601, test_loss: 1.1350, test_f1: 0.4554
 epoch: 13, train_loss: 0.9485, test_loss: 1.0684, test_f1: 0.4959
 epoch: 14, train_loss: 0.9360, test_loss: 1.0717, test_f1: 0.4962
 epoch: 15, train_loss: 0.9187, test_loss: 1.0620, test_f1: 0.5521
 epoch: 16, train_loss: 0.9094, test_loss: 1.1467, test_f1: 0.4831
 epoch: 17, train_loss: 0.8830, test_loss: 1.0824, test_f1: 0.5419
 epoch: 18, train_loss: 0.8783, test_loss: 1.0415, test_f1: 0.5413
 epoch: 19, train_loss: 0.8686, test_loss: 1.0618, test_f1: 0.5282
 epoch: 20, train_loss: 0.8494, test_loss: 1.1216, test_f1: 0.5041
 epoch: 21, train_loss: 0.8352, test_loss: 1.1171, test_f1: 0.4879
 epoch: 22, train_loss: 0.8393, test_loss: 1.1456, test_f1: 0.5257
 epoch: 23, train_loss: 0.8306, test_loss: 1.0919, test_f1: 0.5095
 epoch: 24, train_loss: 0.7962, test_loss: 1.0357, test_f1: 0.5404
 epoch: 25, train_loss: 0.8070, test_loss: 1.1335, test_f1: 0.4815
 epoch: 26, train_loss: 0.8038, test_loss: 1.0940, test_f1: 0.5034
 epoch: 27, train_loss: 0.7911, test_loss: 1.0974, test_f1: 0.5016
 epoch: 28, train_loss: 0.7957, test_loss: 1.0729, test_f1: 0.5200
 epoch: 29, train_loss: 0.7834, test_loss: 1.1490, test_f1: 0.5020
 epoch: 30, train_loss: 0.8006, test_loss: 1.1803, test_f1: 0.5397
 epoch: 31, train_loss: 0.8171, test_loss: 1.1392, test_f1: 0.5023
 epoch: 32, train_loss: 0.7883, test_loss: 1.0620, test_f1: 0.4778
 epoch: 33, train_loss: 0.7717, test_loss: 1.0505, test_f1: 0.5109
 epoch: 34, train_loss: 0.7555, test_loss: 1.2936, test_f1: 0.4625
 epoch: 35, train_loss: 0.7627, test_loss: 1.0596, test_f1: 0.5608
 epoch: 36, train_loss: 0.7648, test_loss: 1.2417, test_f1: 0.4302
 epoch: 37, train_loss: 0.7471, test_loss: 1.0671, test_f1: 0.5549
 epoch: 38, train_loss: 0.7369, test_loss: 1.1608, test_f1: 0.4988
 epoch: 39, train_loss: 0.7379, test_loss: 1.1031, test_f1: 0.4847
 epoch: 40, train_loss: 0.7633, test_loss: 1.0011, test_f1: 0.5584
 epoch: 41, train_loss: 0.7365, test_loss: 1.0883, test_f1: 0.5194
 epoch: 42, train_loss: 0.7339, test_loss: 1.0582, test_f1: 0.5237
 epoch: 43, train_loss: 0.7306, test_loss: 1.1279, test_f1: 0.4777
 epoch: 44, train_loss: 0.7262, test_loss: 1.1517, test_f1: 0.5053
 epoch: 45, train_loss: 0.7174, test_loss: 1.0712, test_f1: 0.5581
 epoch: 46, train_loss: 0.7123, test_loss: 1.1379, test_f1: 0.4884
 epoch: 47, train_loss: 0.7091, test_loss: 1.0872, test_f1: 0.5243
 epoch: 48, train_loss: 0.7115, test_loss: 1.1639, test_f1: 0.5398
 epoch: 49, train_loss: 0.7052, test_loss: 1.0338, test_f1: 0.5736
 epoch: 50, train_loss: 0.7209, test_loss: 1.0372, test_f1: 0.5846
 epoch: 51, train_loss: 0.6960, test_loss: 1.1384, test_f1: 0.5545
 epoch: 52, train_loss: 0.7070, test_loss: 1.1002, test_f1: 0.5547
 epoch: 53, train_loss: 0.6879, test_loss: 1.0941, test_f1: 0.5626
 epoch: 54, train_loss: 0.6689, test_loss: 1.0907, test_f1: 0.5864
 epoch: 55, train_loss: 0.6808, test_loss: 1.0801, test_f1: 0.5481
 epoch: 56, train_loss: 0.6765, test_loss: 1.0838, test_f1: 0.5817
 epoch: 57, train_loss: 0.6825, test_loss: 1.0716, test_f1: 0.5602
 epoch: 58, train_loss: 0.7020, test_loss: 1.0370, test_f1: 0.5379
 epoch: 59, train_loss: 0.6876, test_loss: 1.0906, test_f1: 0.5297
 epoch: 60, train_loss: 0.6780, test_loss: 1.0698, test_f1: 0.5707
 epoch: 61, train_loss: 0.6635, test_loss: 1.0246, test_f1: 0.5712
 epoch: 62, train_loss: 0.6652, test_loss: 1.1009, test_f1: 0.5583
 epoch: 63, train_loss: 0.6738, test_loss: 1.1214, test_f1: 0.5409
 epoch: 64, train_loss: 0.6532, test_loss: 1.0998, test_f1: 0.5419
 epoch: 65, train_loss: 0.6576, test_loss: 1.1000, test_f1: 0.5434
 epoch: 66, train_loss: 0.6642, test_loss: 1.1015, test_f1: 0.5510
 epoch: 67, train_loss: 0.6590, test_loss: 1.1079, test_f1: 0.5624
 epoch: 68, train_loss: 0.6695, test_loss: 1.0790, test_f1: 0.5685
 epoch: 69, train_loss: 0.6678, test_loss: 1.0745, test_f1: 0.5466
 epoch: 70, train_loss: 0.6593, test_loss: 1.0943, test_f1: 0.5689
 epoch: 71, train_loss: 0.6495, test_loss: 1.0832, test_f1: 0.5773
 epoch: 72, train_loss: 0.6735, test_loss: 1.1413, test_f1: 0.5236
 epoch: 73, train_loss: 0.6576, test_loss: 1.1883, test_f1: 0.5291
 epoch: 74, train_loss: 0.6596, test_loss: 1.0713, test_f1: 0.5486
 epoch: 75, train_loss: 0.6522, test_loss: 1.0828, test_f1: 0.5830
 epoch: 76, train_loss: 0.6481, test_loss: 1.1873, test_f1: 0.5287
 epoch: 77, train_loss: 0.6496, test_loss: 1.0956, test_f1: 0.5179
 epoch: 78, train_loss: 0.6486, test_loss: 1.1451, test_f1: 0.5445
 epoch: 79, train_loss: 0.6605, test_loss: 1.3538, test_f1: 0.5513
 epoch: 80, train_loss: 0.6358, test_loss: 1.1079, test_f1: 0.5631
 epoch: 81, train_loss: 0.6567, test_loss: 1.2001, test_f1: 0.5424
 epoch: 82, train_loss: 0.6436, test_loss: 1.1144, test_f1: 0.5607
 epoch: 83, train_loss: 0.6523, test_loss: 1.1468, test_f1: 0.5395
 epoch: 84, train_loss: 0.6461, test_loss: 1.1135, test_f1: 0.5537
 epoch: 85, train_loss: 0.6355, test_loss: 1.3306, test_f1: 0.5034
 epoch: 86, train_loss: 0.6441, test_loss: 1.1278, test_f1: 0.5513
 epoch: 87, train_loss: 0.6158, test_loss: 1.1408, test_f1: 0.5521
 epoch: 88, train_loss: 0.6474, test_loss: 1.1084, test_f1: 0.5603
 epoch: 89, train_loss: 0.6524, test_loss: 1.0675, test_f1: 0.5729
 epoch: 90, train_loss: 0.6385, test_loss: 1.1655, test_f1: 0.5458
 epoch: 91, train_loss: 0.6329, test_loss: 1.4876, test_f1: 0.5157
 epoch: 92, train_loss: 0.6378, test_loss: 1.0849, test_f1: 0.5872
 epoch: 93, train_loss: 0.6286, test_loss: 1.1258, test_f1: 0.5475
 epoch: 94, train_loss: 0.6362, test_loss: 1.1291, test_f1: 0.5518
 epoch: 95, train_loss: 0.6450, test_loss: 1.1237, test_f1: 0.5239
 epoch: 96, train_loss: 0.6306, test_loss: 1.1333, test_f1: 0.5341
 epoch: 97, train_loss: 0.6316, test_loss: 1.1150, test_f1: 0.5268
 epoch: 98, train_loss: 0.6387, test_loss: 1.0909, test_f1: 0.5420
 epoch: 99, train_loss: 0.6300, test_loss: 1.1958, test_f1: 0.4886
##################ITERATION #3 ****************************************
 epoch: 0, train_loss: 1.3686, test_loss: 1.3098, test_f1: 0.2281
 epoch: 1, train_loss: 1.1925, test_loss: 1.2806, test_f1: 0.2281
 epoch: 2, train_loss: 1.1607, test_loss: 1.2164, test_f1: 0.3068
 epoch: 3, train_loss: 1.1307, test_loss: 1.1892, test_f1: 0.4064
 epoch: 4, train_loss: 1.1026, test_loss: 1.1660, test_f1: 0.4011
 epoch: 5, train_loss: 1.0956, test_loss: 1.1557, test_f1: 0.4116
 epoch: 6, train_loss: 1.0778, test_loss: 1.1572, test_f1: 0.4104
 epoch: 7, train_loss: 1.0463, test_loss: 1.1503, test_f1: 0.4206
 epoch: 8, train_loss: 1.0498, test_loss: 1.1415, test_f1: 0.4036
 epoch: 9, train_loss: 1.0392, test_loss: 1.1155, test_f1: 0.4506
 epoch: 10, train_loss: 1.0192, test_loss: 1.1305, test_f1: 0.4456
 epoch: 11, train_loss: 1.0057, test_loss: 1.0934, test_f1: 0.4805
 epoch: 12, train_loss: 0.9944, test_loss: 1.0957, test_f1: 0.5068
 epoch: 13, train_loss: 0.9749, test_loss: 1.0820, test_f1: 0.4981
 epoch: 14, train_loss: 0.9785, test_loss: 1.0752, test_f1: 0.4847
 epoch: 15, train_loss: 0.9631, test_loss: 1.0768, test_f1: 0.4830
 epoch: 16, train_loss: 0.9555, test_loss: 1.0654, test_f1: 0.4352
 epoch: 17, train_loss: 0.9481, test_loss: 1.0522, test_f1: 0.4643
 epoch: 18, train_loss: 0.9358, test_loss: 1.0280, test_f1: 0.5283
 epoch: 19, train_loss: 0.9160, test_loss: 1.0611, test_f1: 0.4989
 epoch: 20, train_loss: 0.9302, test_loss: 1.0399, test_f1: 0.5113
 epoch: 21, train_loss: 0.9122, test_loss: 1.0642, test_f1: 0.5014
 epoch: 22, train_loss: 0.9048, test_loss: 1.0524, test_f1: 0.4915
 epoch: 23, train_loss: 0.9166, test_loss: 1.0295, test_f1: 0.5125
 epoch: 24, train_loss: 0.9180, test_loss: 1.1219, test_f1: 0.4643
 epoch: 25, train_loss: 0.9160, test_loss: 1.0674, test_f1: 0.5319
 epoch: 26, train_loss: 0.9014, test_loss: 1.0529, test_f1: 0.5103
 epoch: 27, train_loss: 0.8937, test_loss: 1.0902, test_f1: 0.5149
 epoch: 28, train_loss: 0.8831, test_loss: 1.0211, test_f1: 0.5212
 epoch: 29, train_loss: 0.8673, test_loss: 1.0444, test_f1: 0.5194
 epoch: 30, train_loss: 0.8845, test_loss: 1.2168, test_f1: 0.4501
 epoch: 31, train_loss: 0.8787, test_loss: 1.0343, test_f1: 0.5458
 epoch: 32, train_loss: 0.8596, test_loss: 1.0929, test_f1: 0.4990
 epoch: 33, train_loss: 0.8555, test_loss: 1.1302, test_f1: 0.4761
 epoch: 34, train_loss: 0.8495, test_loss: 1.0228, test_f1: 0.5434
 epoch: 35, train_loss: 0.8470, test_loss: 1.0542, test_f1: 0.5298
 epoch: 36, train_loss: 0.8624, test_loss: 1.0634, test_f1: 0.5084
 epoch: 37, train_loss: 0.8417, test_loss: 1.0187, test_f1: 0.5521
 epoch: 38, train_loss: 0.8435, test_loss: 1.0274, test_f1: 0.5173
 epoch: 39, train_loss: 0.8260, test_loss: 1.0802, test_f1: 0.5149
 epoch: 40, train_loss: 0.8369, test_loss: 1.0365, test_f1: 0.5041
 epoch: 41, train_loss: 0.8210, test_loss: 1.3666, test_f1: 0.4527
 epoch: 42, train_loss: 0.8366, test_loss: 1.0967, test_f1: 0.4774
 epoch: 43, train_loss: 0.8238, test_loss: 1.0796, test_f1: 0.4789
 epoch: 44, train_loss: 0.8169, test_loss: 1.0499, test_f1: 0.4955
 epoch: 45, train_loss: 0.8143, test_loss: 1.1383, test_f1: 0.5181
 epoch: 46, train_loss: 0.8084, test_loss: 1.1312, test_f1: 0.4842
 epoch: 47, train_loss: 0.8140, test_loss: 1.0461, test_f1: 0.5431
 epoch: 48, train_loss: 0.8147, test_loss: 1.0713, test_f1: 0.4901
 epoch: 49, train_loss: 0.8183, test_loss: 1.0264, test_f1: 0.5159
 epoch: 50, train_loss: 0.7867, test_loss: 1.0695, test_f1: 0.5147
 epoch: 51, train_loss: 0.7939, test_loss: 1.0451, test_f1: 0.5039
 epoch: 52, train_loss: 0.7888, test_loss: 1.0879, test_f1: 0.5053
 epoch: 53, train_loss: 0.7727, test_loss: 1.0524, test_f1: 0.5083
 epoch: 54, train_loss: 0.7715, test_loss: 1.0244, test_f1: 0.5433
 epoch: 55, train_loss: 0.7816, test_loss: 1.0252, test_f1: 0.5426
 epoch: 56, train_loss: 0.7623, test_loss: 1.0768, test_f1: 0.5131
 epoch: 57, train_loss: 0.7733, test_loss: 1.0246, test_f1: 0.5310
 epoch: 58, train_loss: 0.7710, test_loss: 1.0967, test_f1: 0.5076
 epoch: 59, train_loss: 0.7707, test_loss: 1.0712, test_f1: 0.5031
 epoch: 60, train_loss: 0.7654, test_loss: 1.0089, test_f1: 0.5363
 epoch: 61, train_loss: 0.7550, test_loss: 1.0456, test_f1: 0.5227
 epoch: 62, train_loss: 0.7658, test_loss: 1.0759, test_f1: 0.5106
 epoch: 63, train_loss: 0.7582, test_loss: 1.1346, test_f1: 0.5163
 epoch: 64, train_loss: 0.7629, test_loss: 1.0914, test_f1: 0.5169
 epoch: 65, train_loss: 0.7589, test_loss: 1.1574, test_f1: 0.4999
 epoch: 66, train_loss: 0.7606, test_loss: 1.0805, test_f1: 0.5172
 epoch: 67, train_loss: 0.7569, test_loss: 1.0814, test_f1: 0.5082
 epoch: 68, train_loss: 0.7556, test_loss: 1.1175, test_f1: 0.5167
 epoch: 69, train_loss: 0.7421, test_loss: 1.0491, test_f1: 0.5411
 epoch: 70, train_loss: 0.7380, test_loss: 1.1051, test_f1: 0.5196
 epoch: 71, train_loss: 0.7505, test_loss: 1.0979, test_f1: 0.5066
 epoch: 72, train_loss: 0.7654, test_loss: 1.0935, test_f1: 0.5347
 epoch: 73, train_loss: 0.7400, test_loss: 1.0515, test_f1: 0.5423
 epoch: 74, train_loss: 0.7384, test_loss: 1.0581, test_f1: 0.5383
 epoch: 75, train_loss: 0.7308, test_loss: 1.0755, test_f1: 0.5298
 epoch: 76, train_loss: 0.7424, test_loss: 1.0862, test_f1: 0.5360
 epoch: 77, train_loss: 0.7276, test_loss: 1.0530, test_f1: 0.5282
 epoch: 78, train_loss: 0.7492, test_loss: 1.1335, test_f1: 0.5159
 epoch: 79, train_loss: 0.7348, test_loss: 1.1361, test_f1: 0.5049
 epoch: 80, train_loss: 0.7286, test_loss: 1.1000, test_f1: 0.5280
 epoch: 81, train_loss: 0.7232, test_loss: 1.0576, test_f1: 0.5283
 epoch: 82, train_loss: 0.7519, test_loss: 1.2522, test_f1: 0.5010
 epoch: 83, train_loss: 0.7215, test_loss: 1.0679, test_f1: 0.5173
 epoch: 84, train_loss: 0.7340, test_loss: 1.1195, test_f1: 0.5021
 epoch: 85, train_loss: 0.7513, test_loss: 1.1298, test_f1: 0.5041
 epoch: 86, train_loss: 0.7326, test_loss: 1.1108, test_f1: 0.5231
 epoch: 87, train_loss: 0.7365, test_loss: 1.0713, test_f1: 0.5099
 epoch: 88, train_loss: 0.7174, test_loss: 1.1068, test_f1: 0.5002
 epoch: 89, train_loss: 0.7373, test_loss: 1.0804, test_f1: 0.5378
 epoch: 90, train_loss: 0.7506, test_loss: 1.0764, test_f1: 0.5084
 epoch: 91, train_loss: 0.7149, test_loss: 1.1305, test_f1: 0.5102
 epoch: 92, train_loss: 0.7185, test_loss: 1.1219, test_f1: 0.5019
 epoch: 93, train_loss: 0.7272, test_loss: 1.0635, test_f1: 0.5071
 epoch: 94, train_loss: 0.7288, test_loss: 1.1647, test_f1: 0.5143
 epoch: 95, train_loss: 0.7230, test_loss: 1.1285, test_f1: 0.5080
 epoch: 96, train_loss: 0.7179, test_loss: 1.1090, test_f1: 0.5174
 epoch: 97, train_loss: 0.7166, test_loss: 1.0828, test_f1: 0.5082
 epoch: 98, train_loss: 0.7325, test_loss: 1.1888, test_f1: 0.5081
 epoch: 99, train_loss: 0.7193, test_loss: 1.2322, test_f1: 0.5044
##################ITERATION #4 ****************************************
 epoch: 0, train_loss: 1.3516, test_loss: 1.3231, test_f1: 0.2281
 epoch: 1, train_loss: 1.1996, test_loss: 1.2541, test_f1: 0.2281
 epoch: 2, train_loss: 1.1261, test_loss: 1.2111, test_f1: 0.3577
 epoch: 3, train_loss: 1.1159, test_loss: 1.1567, test_f1: 0.4016
 epoch: 4, train_loss: 1.0834, test_loss: 1.1332, test_f1: 0.4382
 epoch: 5, train_loss: 1.0449, test_loss: 1.1094, test_f1: 0.4525
 epoch: 6, train_loss: 1.0325, test_loss: 1.0794, test_f1: 0.5091
 epoch: 7, train_loss: 1.0119, test_loss: 1.0736, test_f1: 0.4494
 epoch: 8, train_loss: 0.9994, test_loss: 1.0421, test_f1: 0.4996
 epoch: 9, train_loss: 0.9863, test_loss: 1.0134, test_f1: 0.5204
 epoch: 10, train_loss: 0.9636, test_loss: 1.0205, test_f1: 0.4956
 epoch: 11, train_loss: 0.9762, test_loss: 1.0133, test_f1: 0.5182
 epoch: 12, train_loss: 0.9458, test_loss: 0.9857, test_f1: 0.5375
 epoch: 13, train_loss: 0.9503, test_loss: 1.0254, test_f1: 0.5348
 epoch: 14, train_loss: 0.9259, test_loss: 0.9892, test_f1: 0.5340
 epoch: 15, train_loss: 0.9305, test_loss: 0.9797, test_f1: 0.5295
 epoch: 16, train_loss: 0.9194, test_loss: 0.9748, test_f1: 0.5371
 epoch: 17, train_loss: 0.9087, test_loss: 0.9747, test_f1: 0.5487
 epoch: 18, train_loss: 0.8962, test_loss: 0.9809, test_f1: 0.5289
 epoch: 19, train_loss: 0.8947, test_loss: 0.9946, test_f1: 0.5306
 epoch: 20, train_loss: 0.8692, test_loss: 1.0213, test_f1: 0.5246
 epoch: 21, train_loss: 0.8705, test_loss: 0.9903, test_f1: 0.5353
 epoch: 22, train_loss: 0.8632, test_loss: 0.9654, test_f1: 0.5640
 epoch: 23, train_loss: 0.8550, test_loss: 0.9722, test_f1: 0.5616
 epoch: 24, train_loss: 0.8414, test_loss: 0.9929, test_f1: 0.5282
 epoch: 25, train_loss: 0.8283, test_loss: 1.0138, test_f1: 0.5520
 epoch: 26, train_loss: 0.8184, test_loss: 0.9989, test_f1: 0.5587
 epoch: 27, train_loss: 0.8151, test_loss: 1.1507, test_f1: 0.5114
 epoch: 28, train_loss: 0.8221, test_loss: 0.9864, test_f1: 0.5070
 epoch: 29, train_loss: 0.8426, test_loss: 0.9910, test_f1: 0.5572
 epoch: 30, train_loss: 0.8076, test_loss: 0.9845, test_f1: 0.5537
 epoch: 31, train_loss: 0.7992, test_loss: 1.0569, test_f1: 0.5509
 epoch: 32, train_loss: 0.8062, test_loss: 0.9956, test_f1: 0.5719
 epoch: 33, train_loss: 0.8038, test_loss: 1.0244, test_f1: 0.5531
 epoch: 34, train_loss: 0.7913, test_loss: 1.0901, test_f1: 0.5332
 epoch: 35, train_loss: 0.7887, test_loss: 1.0470, test_f1: 0.5401
 epoch: 36, train_loss: 0.7874, test_loss: 1.1082, test_f1: 0.5095
 epoch: 37, train_loss: 0.7692, test_loss: 1.0109, test_f1: 0.5712
 epoch: 38, train_loss: 0.7788, test_loss: 1.0878, test_f1: 0.5667
 epoch: 39, train_loss: 0.7754, test_loss: 1.1547, test_f1: 0.5078
 epoch: 40, train_loss: 0.7515, test_loss: 1.1010, test_f1: 0.5567
 epoch: 41, train_loss: 0.7792, test_loss: 1.0549, test_f1: 0.5564
 epoch: 42, train_loss: 0.7663, test_loss: 1.0273, test_f1: 0.5365
 epoch: 43, train_loss: 0.7582, test_loss: 1.0753, test_f1: 0.5059
 epoch: 44, train_loss: 0.7634, test_loss: 1.0428, test_f1: 0.5432
 epoch: 45, train_loss: 0.7408, test_loss: 0.9873, test_f1: 0.5672
 epoch: 46, train_loss: 0.7579, test_loss: 1.0218, test_f1: 0.5547
 epoch: 47, train_loss: 0.7608, test_loss: 1.1370, test_f1: 0.5500
 epoch: 48, train_loss: 0.7511, test_loss: 1.1090, test_f1: 0.4661
 epoch: 49, train_loss: 0.7553, test_loss: 1.0837, test_f1: 0.5462
 epoch: 50, train_loss: 0.7345, test_loss: 1.1600, test_f1: 0.5424
 epoch: 51, train_loss: 0.7243, test_loss: 1.0853, test_f1: 0.5640
 epoch: 52, train_loss: 0.7183, test_loss: 1.1180, test_f1: 0.5625
 epoch: 53, train_loss: 0.7243, test_loss: 0.9943, test_f1: 0.5707
 epoch: 54, train_loss: 0.7023, test_loss: 1.1021, test_f1: 0.5589
 epoch: 55, train_loss: 0.7105, test_loss: 1.0382, test_f1: 0.5749
 epoch: 56, train_loss: 0.7117, test_loss: 1.1470, test_f1: 0.5455
 epoch: 57, train_loss: 0.7100, test_loss: 1.1104, test_f1: 0.5646
 epoch: 58, train_loss: 0.7216, test_loss: 1.0686, test_f1: 0.5773
 epoch: 59, train_loss: 0.7066, test_loss: 1.0433, test_f1: 0.5575
 epoch: 60, train_loss: 0.7099, test_loss: 1.0690, test_f1: 0.5342
 epoch: 61, train_loss: 0.7050, test_loss: 1.0876, test_f1: 0.5605
 epoch: 62, train_loss: 0.7104, test_loss: 1.0781, test_f1: 0.5780
 epoch: 63, train_loss: 0.7028, test_loss: 1.1867, test_f1: 0.5686
 epoch: 64, train_loss: 0.7008, test_loss: 1.0978, test_f1: 0.5481
 epoch: 65, train_loss: 0.7005, test_loss: 1.0836, test_f1: 0.5650
 epoch: 66, train_loss: 0.6910, test_loss: 1.2480, test_f1: 0.5534
 epoch: 67, train_loss: 0.6954, test_loss: 1.1573, test_f1: 0.5423
 epoch: 68, train_loss: 0.7005, test_loss: 1.0966, test_f1: 0.5713
 epoch: 69, train_loss: 0.6965, test_loss: 1.1160, test_f1: 0.5442
 epoch: 70, train_loss: 0.6911, test_loss: 1.1249, test_f1: 0.5761
 epoch: 71, train_loss: 0.6962, test_loss: 1.1514, test_f1: 0.5723
 epoch: 72, train_loss: 0.7039, test_loss: 1.1539, test_f1: 0.5567
 epoch: 73, train_loss: 0.6949, test_loss: 1.1163, test_f1: 0.5976
 epoch: 74, train_loss: 0.6943, test_loss: 1.1398, test_f1: 0.5792
 epoch: 75, train_loss: 0.6863, test_loss: 1.0665, test_f1: 0.5803
 epoch: 76, train_loss: 0.6842, test_loss: 1.1442, test_f1: 0.5688
 epoch: 77, train_loss: 0.6754, test_loss: 1.1515, test_f1: 0.5663
 epoch: 78, train_loss: 0.6982, test_loss: 1.1354, test_f1: 0.5703
 epoch: 79, train_loss: 0.6951, test_loss: 1.1713, test_f1: 0.5634
 epoch: 80, train_loss: 0.6957, test_loss: 1.1869, test_f1: 0.5827
 epoch: 81, train_loss: 0.6774, test_loss: 1.2615, test_f1: 0.5449
 epoch: 82, train_loss: 0.6771, test_loss: 1.1261, test_f1: 0.5836
 epoch: 83, train_loss: 0.6850, test_loss: 1.3941, test_f1: 0.5379
 epoch: 84, train_loss: 0.6826, test_loss: 1.1617, test_f1: 0.5418
 epoch: 85, train_loss: 0.6999, test_loss: 1.1498, test_f1: 0.5700
 epoch: 86, train_loss: 0.6918, test_loss: 1.1707, test_f1: 0.5729
 epoch: 87, train_loss: 0.6867, test_loss: 1.1876, test_f1: 0.5729
 epoch: 88, train_loss: 0.6669, test_loss: 1.1836, test_f1: 0.5609
 epoch: 89, train_loss: 0.6757, test_loss: 1.0940, test_f1: 0.5948
 epoch: 90, train_loss: 0.6922, test_loss: 1.1768, test_f1: 0.5994
 epoch: 91, train_loss: 0.6737, test_loss: 1.1814, test_f1: 0.5544
 epoch: 92, train_loss: 0.6676, test_loss: 1.2532, test_f1: 0.5584
 epoch: 93, train_loss: 0.6693, test_loss: 1.2371, test_f1: 0.5761
 epoch: 94, train_loss: 0.6648, test_loss: 1.1522, test_f1: 0.5663
 epoch: 95, train_loss: 0.6715, test_loss: 1.3673, test_f1: 0.5464
 epoch: 96, train_loss: 0.6511, test_loss: 1.3889, test_f1: 0.5693
 epoch: 97, train_loss: 0.6622, test_loss: 1.3393, test_f1: 0.5495
 epoch: 98, train_loss: 0.6641, test_loss: 1.2462, test_f1: 0.5545
 epoch: 99, train_loss: 0.6709, test_loss: 1.2482, test_f1: 0.5502
##################ITERATION #5 ****************************************
 epoch: 0, train_loss: 1.3708, test_loss: 1.3306, test_f1: 0.2281
 epoch: 1, train_loss: 1.1895, test_loss: 1.3067, test_f1: 0.2281
 epoch: 2, train_loss: 1.1311, test_loss: 1.2413, test_f1: 0.2641
 epoch: 3, train_loss: 1.0734, test_loss: 1.1487, test_f1: 0.3686
 epoch: 4, train_loss: 1.0451, test_loss: 1.0882, test_f1: 0.3700
 epoch: 5, train_loss: 1.0345, test_loss: 1.0811, test_f1: 0.4262
 epoch: 6, train_loss: 1.0106, test_loss: 1.0672, test_f1: 0.4443
 epoch: 7, train_loss: 1.0073, test_loss: 1.0403, test_f1: 0.4893
 epoch: 8, train_loss: 0.9745, test_loss: 1.0433, test_f1: 0.5205
 epoch: 9, train_loss: 0.9636, test_loss: 1.0252, test_f1: 0.4984
 epoch: 10, train_loss: 0.9569, test_loss: 1.0345, test_f1: 0.5172
 epoch: 11, train_loss: 0.9378, test_loss: 1.0085, test_f1: 0.5607
 epoch: 12, train_loss: 0.9142, test_loss: 1.0667, test_f1: 0.4990
 epoch: 13, train_loss: 0.9217, test_loss: 1.0187, test_f1: 0.5420
 epoch: 14, train_loss: 0.9080, test_loss: 0.9998, test_f1: 0.5255
 epoch: 15, train_loss: 0.9136, test_loss: 0.9981, test_f1: 0.5524
 epoch: 16, train_loss: 0.8880, test_loss: 0.9847, test_f1: 0.5664
 epoch: 17, train_loss: 0.8778, test_loss: 0.9979, test_f1: 0.5280
 epoch: 18, train_loss: 0.8757, test_loss: 0.9888, test_f1: 0.5706
 epoch: 19, train_loss: 0.8693, test_loss: 0.9840, test_f1: 0.5606
 epoch: 20, train_loss: 0.8718, test_loss: 1.0096, test_f1: 0.5694
 epoch: 21, train_loss: 0.8430, test_loss: 0.9836, test_f1: 0.6028
 epoch: 22, train_loss: 0.8509, test_loss: 0.9894, test_f1: 0.5719
 epoch: 23, train_loss: 0.8578, test_loss: 0.9698, test_f1: 0.5992
 epoch: 24, train_loss: 0.8317, test_loss: 0.9645, test_f1: 0.5992
 epoch: 25, train_loss: 0.8052, test_loss: 0.9556, test_f1: 0.6109
 epoch: 26, train_loss: 0.8202, test_loss: 0.9658, test_f1: 0.6161
 epoch: 27, train_loss: 0.8138, test_loss: 1.1548, test_f1: 0.5305
 epoch: 28, train_loss: 0.8155, test_loss: 1.0023, test_f1: 0.6009
 epoch: 29, train_loss: 0.8107, test_loss: 0.9573, test_f1: 0.6047
 epoch: 30, train_loss: 0.8146, test_loss: 0.9560, test_f1: 0.5959
 epoch: 31, train_loss: 0.7995, test_loss: 0.9526, test_f1: 0.6151
 epoch: 32, train_loss: 0.7888, test_loss: 0.9564, test_f1: 0.5966
 epoch: 33, train_loss: 0.7800, test_loss: 0.9238, test_f1: 0.6272
 epoch: 34, train_loss: 0.7911, test_loss: 1.0063, test_f1: 0.5695
 epoch: 35, train_loss: 0.7918, test_loss: 1.0114, test_f1: 0.5888
 epoch: 36, train_loss: 0.7481, test_loss: 0.9696, test_f1: 0.6112
 epoch: 37, train_loss: 0.7595, test_loss: 0.9867, test_f1: 0.5819
 epoch: 38, train_loss: 0.7691, test_loss: 0.9616, test_f1: 0.5974
 epoch: 39, train_loss: 0.7468, test_loss: 0.9911, test_f1: 0.5605
 epoch: 40, train_loss: 0.7469, test_loss: 1.1693, test_f1: 0.5237
 epoch: 41, train_loss: 0.7498, test_loss: 0.9599, test_f1: 0.5977
 epoch: 42, train_loss: 0.7516, test_loss: 0.9923, test_f1: 0.6118
 epoch: 43, train_loss: 0.7784, test_loss: 0.9767, test_f1: 0.6421
 epoch: 44, train_loss: 0.7323, test_loss: 1.0474, test_f1: 0.5491
 epoch: 45, train_loss: 0.7452, test_loss: 1.0207, test_f1: 0.5107
 epoch: 46, train_loss: 0.7472, test_loss: 0.9819, test_f1: 0.5885
 epoch: 47, train_loss: 0.7159, test_loss: 0.9596, test_f1: 0.5861
 epoch: 48, train_loss: 0.7228, test_loss: 1.0251, test_f1: 0.5981
 epoch: 49, train_loss: 0.7139, test_loss: 0.9710, test_f1: 0.6180
 epoch: 50, train_loss: 0.7251, test_loss: 1.0319, test_f1: 0.5842
 epoch: 51, train_loss: 0.7097, test_loss: 0.9937, test_f1: 0.5997
 epoch: 52, train_loss: 0.6949, test_loss: 1.0480, test_f1: 0.5953
 epoch: 53, train_loss: 0.6919, test_loss: 1.0070, test_f1: 0.6162
 epoch: 54, train_loss: 0.7057, test_loss: 1.0122, test_f1: 0.5959
 epoch: 55, train_loss: 0.6976, test_loss: 0.9961, test_f1: 0.6085
 epoch: 56, train_loss: 0.7067, test_loss: 0.9980, test_f1: 0.5907
 epoch: 57, train_loss: 0.6966, test_loss: 0.9989, test_f1: 0.6106
 epoch: 58, train_loss: 0.6841, test_loss: 1.0475, test_f1: 0.5802
 epoch: 59, train_loss: 0.6928, test_loss: 1.0727, test_f1: 0.5806
 epoch: 60, train_loss: 0.6945, test_loss: 0.9866, test_f1: 0.6335
 epoch: 61, train_loss: 0.6950, test_loss: 1.1130, test_f1: 0.5857
 epoch: 62, train_loss: 0.7007, test_loss: 1.0435, test_f1: 0.5975
 epoch: 63, train_loss: 0.6756, test_loss: 1.0366, test_f1: 0.6041
 epoch: 64, train_loss: 0.6794, test_loss: 1.0553, test_f1: 0.6263
 epoch: 65, train_loss: 0.6906, test_loss: 1.0526, test_f1: 0.5819
 epoch: 66, train_loss: 0.6742, test_loss: 1.0036, test_f1: 0.6238
 epoch: 67, train_loss: 0.6743, test_loss: 1.1064, test_f1: 0.6032
 epoch: 68, train_loss: 0.6662, test_loss: 1.0150, test_f1: 0.5939
 epoch: 69, train_loss: 0.6759, test_loss: 1.1165, test_f1: 0.5824
 epoch: 70, train_loss: 0.6819, test_loss: 1.1136, test_f1: 0.5761
 epoch: 71, train_loss: 0.6821, test_loss: 1.1792, test_f1: 0.5943
 epoch: 72, train_loss: 0.6637, test_loss: 1.0354, test_f1: 0.5812
 epoch: 73, train_loss: 0.6671, test_loss: 1.0737, test_f1: 0.5904
 epoch: 74, train_loss: 0.6712, test_loss: 1.0453, test_f1: 0.6212
 epoch: 75, train_loss: 0.6718, test_loss: 1.0650, test_f1: 0.6160
 epoch: 76, train_loss: 0.6745, test_loss: 1.0440, test_f1: 0.6338
 epoch: 77, train_loss: 0.6737, test_loss: 1.0564, test_f1: 0.6016
 epoch: 78, train_loss: 0.6507, test_loss: 1.0554, test_f1: 0.6337
 epoch: 79, train_loss: 0.6683, test_loss: 1.1457, test_f1: 0.6025
 epoch: 80, train_loss: 0.6688, test_loss: 1.1113, test_f1: 0.6077
 epoch: 81, train_loss: 0.6667, test_loss: 1.0235, test_f1: 0.6328
 epoch: 82, train_loss: 0.6463, test_loss: 1.0221, test_f1: 0.6128
 epoch: 83, train_loss: 0.6483, test_loss: 1.0821, test_f1: 0.6221
 epoch: 84, train_loss: 0.6493, test_loss: 1.0818, test_f1: 0.6309
 epoch: 85, train_loss: 0.6356, test_loss: 1.1402, test_f1: 0.6095
 epoch: 86, train_loss: 0.6561, test_loss: 1.1552, test_f1: 0.5935
 epoch: 87, train_loss: 0.6662, test_loss: 1.1321, test_f1: 0.6137
 epoch: 88, train_loss: 0.6565, test_loss: 1.1591, test_f1: 0.6350
 epoch: 89, train_loss: 0.6583, test_loss: 1.1286, test_f1: 0.6292
 epoch: 90, train_loss: 0.6536, test_loss: 1.1330, test_f1: 0.6257
 epoch: 91, train_loss: 0.6464, test_loss: 1.1889, test_f1: 0.5997
 epoch: 92, train_loss: 0.6521, test_loss: 1.1289, test_f1: 0.6163
 epoch: 93, train_loss: 0.6542, test_loss: 1.1252, test_f1: 0.6089
 epoch: 94, train_loss: 0.6581, test_loss: 1.1895, test_f1: 0.6126
 epoch: 95, train_loss: 0.6541, test_loss: 1.1459, test_f1: 0.5896
 epoch: 96, train_loss: 0.6551, test_loss: 1.1409, test_f1: 0.6304
 epoch: 97, train_loss: 0.6328, test_loss: 1.0827, test_f1: 0.6143
 epoch: 98, train_loss: 0.6308, test_loss: 1.1182, test_f1: 0.6111
 epoch: 99, train_loss: 0.6424, test_loss: 1.1515, test_f1: 0.6399
##################ITERATION #6 ****************************************
 epoch: 0, train_loss: 1.2984, test_loss: 1.2963, test_f1: 0.2281
 epoch: 1, train_loss: 1.1932, test_loss: 1.2452, test_f1: 0.2281
 epoch: 2, train_loss: 1.1773, test_loss: 1.2091, test_f1: 0.3126
 epoch: 3, train_loss: 1.1344, test_loss: 1.1796, test_f1: 0.3478
 epoch: 4, train_loss: 1.1147, test_loss: 1.1471, test_f1: 0.3648
 epoch: 5, train_loss: 1.0827, test_loss: 1.1344, test_f1: 0.3824
 epoch: 6, train_loss: 1.0502, test_loss: 1.1192, test_f1: 0.4060
 epoch: 7, train_loss: 1.0223, test_loss: 1.0989, test_f1: 0.4436
 epoch: 8, train_loss: 1.0071, test_loss: 1.0917, test_f1: 0.4491
 epoch: 9, train_loss: 1.0054, test_loss: 1.0964, test_f1: 0.4642
 epoch: 10, train_loss: 0.9879, test_loss: 1.0920, test_f1: 0.4605
 epoch: 11, train_loss: 0.9674, test_loss: 1.0154, test_f1: 0.5122
 epoch: 12, train_loss: 0.9601, test_loss: 1.0670, test_f1: 0.5141
 epoch: 13, train_loss: 0.9540, test_loss: 1.0415, test_f1: 0.4860
 epoch: 14, train_loss: 0.9396, test_loss: 1.0763, test_f1: 0.4630
 epoch: 15, train_loss: 0.9222, test_loss: 1.0626, test_f1: 0.4955
 epoch: 16, train_loss: 0.9234, test_loss: 1.0700, test_f1: 0.5056
 epoch: 17, train_loss: 0.8888, test_loss: 1.0602, test_f1: 0.4777
 epoch: 18, train_loss: 0.8983, test_loss: 1.0943, test_f1: 0.5120
 epoch: 19, train_loss: 0.8916, test_loss: 1.0500, test_f1: 0.4584
 epoch: 20, train_loss: 0.8666, test_loss: 1.0653, test_f1: 0.5210
 epoch: 21, train_loss: 0.8724, test_loss: 1.0632, test_f1: 0.4966
 epoch: 22, train_loss: 0.8556, test_loss: 1.0772, test_f1: 0.5351
 epoch: 23, train_loss: 0.8545, test_loss: 1.0505, test_f1: 0.5106
 epoch: 24, train_loss: 0.8584, test_loss: 1.0521, test_f1: 0.5093
 epoch: 25, train_loss: 0.8328, test_loss: 1.0344, test_f1: 0.5105
 epoch: 26, train_loss: 0.8241, test_loss: 1.0628, test_f1: 0.5263
 epoch: 27, train_loss: 0.8200, test_loss: 1.0220, test_f1: 0.5137
 epoch: 28, train_loss: 0.8343, test_loss: 1.0262, test_f1: 0.5454
 epoch: 29, train_loss: 0.8193, test_loss: 1.0290, test_f1: 0.5169
 epoch: 30, train_loss: 0.8013, test_loss: 1.0590, test_f1: 0.5386
 epoch: 31, train_loss: 0.8022, test_loss: 1.0737, test_f1: 0.5131
 epoch: 32, train_loss: 0.7834, test_loss: 1.0569, test_f1: 0.5504
 epoch: 33, train_loss: 0.7941, test_loss: 1.0519, test_f1: 0.5250
 epoch: 34, train_loss: 0.7772, test_loss: 1.0417, test_f1: 0.5505
 epoch: 35, train_loss: 0.7875, test_loss: 1.1065, test_f1: 0.5212
 epoch: 36, train_loss: 0.7736, test_loss: 1.0540, test_f1: 0.5406
 epoch: 37, train_loss: 0.7730, test_loss: 1.0391, test_f1: 0.5450
 epoch: 38, train_loss: 0.7632, test_loss: 1.0971, test_f1: 0.5061
 epoch: 39, train_loss: 0.7695, test_loss: 1.0348, test_f1: 0.5351
 epoch: 40, train_loss: 0.7652, test_loss: 1.0358, test_f1: 0.5627
 epoch: 41, train_loss: 0.7535, test_loss: 1.0319, test_f1: 0.5714
 epoch: 42, train_loss: 0.7722, test_loss: 1.0496, test_f1: 0.5380
 epoch: 43, train_loss: 0.7546, test_loss: 1.0242, test_f1: 0.5489
 epoch: 44, train_loss: 0.7607, test_loss: 1.0799, test_f1: 0.5352
 epoch: 45, train_loss: 0.7449, test_loss: 1.0646, test_f1: 0.5618
 epoch: 46, train_loss: 0.7320, test_loss: 1.1001, test_f1: 0.5534
 epoch: 47, train_loss: 0.7499, test_loss: 1.1439, test_f1: 0.5531
 epoch: 48, train_loss: 0.7210, test_loss: 1.1204, test_f1: 0.5321
 epoch: 49, train_loss: 0.7398, test_loss: 1.1778, test_f1: 0.5438
 epoch: 50, train_loss: 0.7316, test_loss: 1.1949, test_f1: 0.5541
 epoch: 51, train_loss: 0.7032, test_loss: 1.1475, test_f1: 0.5479
 epoch: 52, train_loss: 0.7213, test_loss: 1.1169, test_f1: 0.5553
 epoch: 53, train_loss: 0.6961, test_loss: 1.2216, test_f1: 0.5358
 epoch: 54, train_loss: 0.7056, test_loss: 1.1813, test_f1: 0.5519
 epoch: 55, train_loss: 0.6960, test_loss: 1.1775, test_f1: 0.5429
 epoch: 56, train_loss: 0.6918, test_loss: 1.2236, test_f1: 0.5471
 epoch: 57, train_loss: 0.6909, test_loss: 1.2569, test_f1: 0.5485
 epoch: 58, train_loss: 0.7183, test_loss: 1.1063, test_f1: 0.5795
 epoch: 59, train_loss: 0.6862, test_loss: 1.2430, test_f1: 0.5563
 epoch: 60, train_loss: 0.6985, test_loss: 1.2017, test_f1: 0.5555
 epoch: 61, train_loss: 0.6929, test_loss: 1.2238, test_f1: 0.5376
 epoch: 62, train_loss: 0.6866, test_loss: 1.2231, test_f1: 0.5545
 epoch: 63, train_loss: 0.6791, test_loss: 1.1988, test_f1: 0.5523
 epoch: 64, train_loss: 0.6725, test_loss: 1.2382, test_f1: 0.5379
 epoch: 65, train_loss: 0.6907, test_loss: 1.2173, test_f1: 0.5565
 epoch: 66, train_loss: 0.6817, test_loss: 1.3298, test_f1: 0.5421
 epoch: 67, train_loss: 0.6669, test_loss: 1.2691, test_f1: 0.5397
 epoch: 68, train_loss: 0.6793, test_loss: 1.3186, test_f1: 0.5348
 epoch: 69, train_loss: 0.6741, test_loss: 1.2612, test_f1: 0.5545
 epoch: 70, train_loss: 0.6691, test_loss: 1.3244, test_f1: 0.5614
 epoch: 71, train_loss: 0.6692, test_loss: 1.2391, test_f1: 0.5664
 epoch: 72, train_loss: 0.6786, test_loss: 1.2867, test_f1: 0.5558
 epoch: 73, train_loss: 0.6795, test_loss: 1.2903, test_f1: 0.5558
 epoch: 74, train_loss: 0.6697, test_loss: 1.2825, test_f1: 0.5369
 epoch: 75, train_loss: 0.6672, test_loss: 1.3462, test_f1: 0.5379
 epoch: 76, train_loss: 0.6697, test_loss: 1.2947, test_f1: 0.5597
 epoch: 77, train_loss: 0.6605, test_loss: 1.3674, test_f1: 0.5310
 epoch: 78, train_loss: 0.6867, test_loss: 1.4351, test_f1: 0.5602
 epoch: 79, train_loss: 0.6694, test_loss: 1.3059, test_f1: 0.5505
 epoch: 80, train_loss: 0.6664, test_loss: 1.2986, test_f1: 0.5425
 epoch: 81, train_loss: 0.6732, test_loss: 1.3139, test_f1: 0.5523
 epoch: 82, train_loss: 0.6686, test_loss: 1.2505, test_f1: 0.5396
 epoch: 83, train_loss: 0.6826, test_loss: 1.3834, test_f1: 0.5483
 epoch: 84, train_loss: 0.6646, test_loss: 1.3449, test_f1: 0.5545
 epoch: 85, train_loss: 0.6702, test_loss: 1.3089, test_f1: 0.5644
 epoch: 86, train_loss: 0.6530, test_loss: 1.3689, test_f1: 0.5474
 epoch: 87, train_loss: 0.6537, test_loss: 1.3881, test_f1: 0.5342
 epoch: 88, train_loss: 0.6573, test_loss: 1.3647, test_f1: 0.5488
 epoch: 89, train_loss: 0.6447, test_loss: 1.3895, test_f1: 0.5576
 epoch: 90, train_loss: 0.6479, test_loss: 1.4566, test_f1: 0.5331
 epoch: 91, train_loss: 0.6546, test_loss: 1.3743, test_f1: 0.5234
 epoch: 92, train_loss: 0.6596, test_loss: 1.3864, test_f1: 0.5548
 epoch: 93, train_loss: 0.6496, test_loss: 1.3781, test_f1: 0.5223
 epoch: 94, train_loss: 0.6549, test_loss: 1.4262, test_f1: 0.5362
 epoch: 95, train_loss: 0.6439, test_loss: 1.3745, test_f1: 0.5509
 epoch: 96, train_loss: 0.6575, test_loss: 1.3778, test_f1: 0.5401
 epoch: 97, train_loss: 0.6530, test_loss: 1.4287, test_f1: 0.5346
 epoch: 98, train_loss: 0.6526, test_loss: 1.4464, test_f1: 0.5473
 epoch: 99, train_loss: 0.6563, test_loss: 1.4636, test_f1: 0.5561
##################ITERATION #7 ****************************************
 epoch: 0, train_loss: 1.4987, test_loss: 1.4506, test_f1: 0.2281
 epoch: 1, train_loss: 1.2038, test_loss: 1.4350, test_f1: 0.2767
 epoch: 2, train_loss: 1.1388, test_loss: 1.2117, test_f1: 0.3615
 epoch: 3, train_loss: 1.0970, test_loss: 1.1550, test_f1: 0.4388
 epoch: 4, train_loss: 1.0542, test_loss: 1.2396, test_f1: 0.4168
 epoch: 5, train_loss: 1.0450, test_loss: 1.1881, test_f1: 0.4389
 epoch: 6, train_loss: 1.0329, test_loss: 1.1354, test_f1: 0.4579
 epoch: 7, train_loss: 0.9947, test_loss: 1.1276, test_f1: 0.4559
 epoch: 8, train_loss: 1.0092, test_loss: 1.2307, test_f1: 0.4300
 epoch: 9, train_loss: 1.0071, test_loss: 1.3195, test_f1: 0.3506
 epoch: 10, train_loss: 0.9789, test_loss: 1.0642, test_f1: 0.4948
 epoch: 11, train_loss: 0.9717, test_loss: 1.0743, test_f1: 0.4970
 epoch: 12, train_loss: 0.9544, test_loss: 1.0537, test_f1: 0.4872
 epoch: 13, train_loss: 0.9497, test_loss: 1.0474, test_f1: 0.4985
 epoch: 14, train_loss: 0.9236, test_loss: 1.0268, test_f1: 0.5203
 epoch: 15, train_loss: 0.9209, test_loss: 1.0161, test_f1: 0.4900
 epoch: 16, train_loss: 0.8993, test_loss: 1.0241, test_f1: 0.5237
 epoch: 17, train_loss: 0.9016, test_loss: 1.0136, test_f1: 0.4597
 epoch: 18, train_loss: 0.8884, test_loss: 1.0280, test_f1: 0.4897
 epoch: 19, train_loss: 0.9111, test_loss: 1.0303, test_f1: 0.5175
 epoch: 20, train_loss: 0.8943, test_loss: 1.0154, test_f1: 0.4931
 epoch: 21, train_loss: 0.8805, test_loss: 0.9766, test_f1: 0.5404
 epoch: 22, train_loss: 0.8658, test_loss: 0.9577, test_f1: 0.5415
 epoch: 23, train_loss: 0.8675, test_loss: 1.0065, test_f1: 0.5479
 epoch: 24, train_loss: 0.8464, test_loss: 0.9507, test_f1: 0.5515
 epoch: 25, train_loss: 0.8491, test_loss: 0.9504, test_f1: 0.5387
 epoch: 26, train_loss: 0.8397, test_loss: 0.9776, test_f1: 0.5674
 epoch: 27, train_loss: 0.8219, test_loss: 0.9936, test_f1: 0.5705
 epoch: 28, train_loss: 0.8140, test_loss: 0.9795, test_f1: 0.5545
 epoch: 29, train_loss: 0.8219, test_loss: 0.9842, test_f1: 0.5713
 epoch: 30, train_loss: 0.7966, test_loss: 1.0014, test_f1: 0.5660
 epoch: 31, train_loss: 0.8030, test_loss: 0.9816, test_f1: 0.5541
 epoch: 32, train_loss: 0.8069, test_loss: 1.0089, test_f1: 0.5349
 epoch: 33, train_loss: 0.8070, test_loss: 0.9872, test_f1: 0.5774
 epoch: 34, train_loss: 0.7981, test_loss: 1.0307, test_f1: 0.5762
 epoch: 35, train_loss: 0.7929, test_loss: 0.9545, test_f1: 0.5608
 epoch: 36, train_loss: 0.7801, test_loss: 1.0227, test_f1: 0.5566
 epoch: 37, train_loss: 0.7714, test_loss: 1.0301, test_f1: 0.5334
 epoch: 38, train_loss: 0.7659, test_loss: 1.0031, test_f1: 0.5768
 epoch: 39, train_loss: 0.7519, test_loss: 1.0131, test_f1: 0.5722
 epoch: 40, train_loss: 0.7734, test_loss: 1.0135, test_f1: 0.5382
 epoch: 41, train_loss: 0.7527, test_loss: 0.9960, test_f1: 0.6067
 epoch: 42, train_loss: 0.7779, test_loss: 1.0202, test_f1: 0.6117
 epoch: 43, train_loss: 0.7544, test_loss: 0.9776, test_f1: 0.5960
 epoch: 44, train_loss: 0.7534, test_loss: 1.0701, test_f1: 0.5881
 epoch: 45, train_loss: 0.7460, test_loss: 1.0502, test_f1: 0.5745
 epoch: 46, train_loss: 0.7523, test_loss: 1.0392, test_f1: 0.5821
 epoch: 47, train_loss: 0.7529, test_loss: 1.0271, test_f1: 0.5846
 epoch: 48, train_loss: 0.7406, test_loss: 1.0135, test_f1: 0.6125
 epoch: 49, train_loss: 0.7372, test_loss: 0.9802, test_f1: 0.6188
 epoch: 50, train_loss: 0.7352, test_loss: 1.0739, test_f1: 0.5703
 epoch: 51, train_loss: 0.7171, test_loss: 1.0142, test_f1: 0.6216
 epoch: 52, train_loss: 0.7116, test_loss: 1.0208, test_f1: 0.6001
 epoch: 53, train_loss: 0.7070, test_loss: 1.0231, test_f1: 0.6072
 epoch: 54, train_loss: 0.7178, test_loss: 1.0294, test_f1: 0.5831
 epoch: 55, train_loss: 0.7085, test_loss: 1.0346, test_f1: 0.6007
 epoch: 56, train_loss: 0.7053, test_loss: 1.0663, test_f1: 0.5862
 epoch: 57, train_loss: 0.7050, test_loss: 1.0357, test_f1: 0.6225
 epoch: 58, train_loss: 0.7088, test_loss: 1.0345, test_f1: 0.6054
 epoch: 59, train_loss: 0.7016, test_loss: 1.0382, test_f1: 0.6242
 epoch: 60, train_loss: 0.7125, test_loss: 1.0382, test_f1: 0.6078
 epoch: 61, train_loss: 0.7006, test_loss: 1.0204, test_f1: 0.6104
 epoch: 62, train_loss: 0.7078, test_loss: 1.0485, test_f1: 0.6016
 epoch: 63, train_loss: 0.6933, test_loss: 1.0192, test_f1: 0.5923
 epoch: 64, train_loss: 0.6844, test_loss: 1.0408, test_f1: 0.6020
 epoch: 65, train_loss: 0.6977, test_loss: 1.0454, test_f1: 0.6004
 epoch: 66, train_loss: 0.6830, test_loss: 1.0914, test_f1: 0.5904
 epoch: 67, train_loss: 0.6846, test_loss: 1.0905, test_f1: 0.5812
 epoch: 68, train_loss: 0.6866, test_loss: 1.0853, test_f1: 0.6049
 epoch: 69, train_loss: 0.6874, test_loss: 1.0232, test_f1: 0.5978
 epoch: 70, train_loss: 0.6913, test_loss: 1.1067, test_f1: 0.5957
 epoch: 71, train_loss: 0.6846, test_loss: 1.0953, test_f1: 0.5993
 epoch: 72, train_loss: 0.6983, test_loss: 1.0555, test_f1: 0.5991
 epoch: 73, train_loss: 0.6835, test_loss: 1.0672, test_f1: 0.6129
 epoch: 74, train_loss: 0.6829, test_loss: 1.0848, test_f1: 0.5886
 epoch: 75, train_loss: 0.6716, test_loss: 1.0585, test_f1: 0.5893
 epoch: 76, train_loss: 0.6629, test_loss: 1.0855, test_f1: 0.6003
 epoch: 77, train_loss: 0.6756, test_loss: 1.1666, test_f1: 0.5811
 epoch: 78, train_loss: 0.6732, test_loss: 1.1174, test_f1: 0.6083
 epoch: 79, train_loss: 0.6698, test_loss: 1.0980, test_f1: 0.6203
 epoch: 80, train_loss: 0.6614, test_loss: 1.1552, test_f1: 0.5770
 epoch: 81, train_loss: 0.6557, test_loss: 1.0576, test_f1: 0.5996
 epoch: 82, train_loss: 0.6605, test_loss: 1.1144, test_f1: 0.5964
 epoch: 83, train_loss: 0.6818, test_loss: 1.1907, test_f1: 0.5827
 epoch: 84, train_loss: 0.6799, test_loss: 1.0851, test_f1: 0.6346
 epoch: 85, train_loss: 0.6561, test_loss: 1.0640, test_f1: 0.5949
 epoch: 86, train_loss: 0.6465, test_loss: 1.1343, test_f1: 0.5893
 epoch: 87, train_loss: 0.6653, test_loss: 1.1758, test_f1: 0.5970
 epoch: 88, train_loss: 0.6723, test_loss: 1.2124, test_f1: 0.5936
 epoch: 89, train_loss: 0.6658, test_loss: 1.0439, test_f1: 0.6039
 epoch: 90, train_loss: 0.6710, test_loss: 1.1803, test_f1: 0.5967
 epoch: 91, train_loss: 0.6568, test_loss: 1.0889, test_f1: 0.5909
 epoch: 92, train_loss: 0.6473, test_loss: 1.1447, test_f1: 0.5982
 epoch: 93, train_loss: 0.6452, test_loss: 1.2570, test_f1: 0.5945
 epoch: 94, train_loss: 0.6464, test_loss: 1.1383, test_f1: 0.5927
 epoch: 95, train_loss: 0.6645, test_loss: 1.1074, test_f1: 0.6019
 epoch: 96, train_loss: 0.6520, test_loss: 1.1072, test_f1: 0.5938
 epoch: 97, train_loss: 0.6357, test_loss: 1.2030, test_f1: 0.5930
 epoch: 98, train_loss: 0.6284, test_loss: 1.2115, test_f1: 0.6098
 epoch: 99, train_loss: 0.6418, test_loss: 1.1247, test_f1: 0.6227
##################ITERATION #8 ****************************************
 epoch: 0, train_loss: 1.4650, test_loss: 1.3686, test_f1: 0.2281
 epoch: 1, train_loss: 1.2369, test_loss: 1.3158, test_f1: 0.2281
 epoch: 2, train_loss: 1.1607, test_loss: 1.2577, test_f1: 0.3277
 epoch: 3, train_loss: 1.1578, test_loss: 1.2327, test_f1: 0.3565
 epoch: 4, train_loss: 1.1225, test_loss: 1.2221, test_f1: 0.4143
 epoch: 5, train_loss: 1.1134, test_loss: 1.1757, test_f1: 0.4100
 epoch: 6, train_loss: 1.1079, test_loss: 1.1836, test_f1: 0.4159
 epoch: 7, train_loss: 1.0763, test_loss: 1.1660, test_f1: 0.4737
 epoch: 8, train_loss: 1.0661, test_loss: 1.1489, test_f1: 0.4547
 epoch: 9, train_loss: 1.0449, test_loss: 1.1311, test_f1: 0.5379
 epoch: 10, train_loss: 1.0411, test_loss: 1.1019, test_f1: 0.5591
 epoch: 11, train_loss: 1.0057, test_loss: 1.0957, test_f1: 0.5628
 epoch: 12, train_loss: 1.0056, test_loss: 1.1063, test_f1: 0.5207
 epoch: 13, train_loss: 0.9838, test_loss: 1.1260, test_f1: 0.4936
 epoch: 14, train_loss: 0.9810, test_loss: 1.0672, test_f1: 0.5659
 epoch: 15, train_loss: 0.9669, test_loss: 1.0785, test_f1: 0.5184
 epoch: 16, train_loss: 0.9691, test_loss: 1.0262, test_f1: 0.5827
 epoch: 17, train_loss: 0.9404, test_loss: 1.0184, test_f1: 0.6099
 epoch: 18, train_loss: 0.9228, test_loss: 1.0357, test_f1: 0.5581
 epoch: 19, train_loss: 0.9235, test_loss: 1.0117, test_f1: 0.6168
 epoch: 20, train_loss: 0.8996, test_loss: 1.0273, test_f1: 0.5653
 epoch: 21, train_loss: 0.9065, test_loss: 1.0786, test_f1: 0.5724
 epoch: 22, train_loss: 0.8984, test_loss: 1.0419, test_f1: 0.5798
 epoch: 23, train_loss: 0.8923, test_loss: 0.9940, test_f1: 0.5738
 epoch: 24, train_loss: 0.8742, test_loss: 1.0127, test_f1: 0.5369
 epoch: 25, train_loss: 0.8681, test_loss: 1.0139, test_f1: 0.5771
 epoch: 26, train_loss: 0.8685, test_loss: 1.0640, test_f1: 0.5637
 epoch: 27, train_loss: 0.8537, test_loss: 1.0244, test_f1: 0.6131
 epoch: 28, train_loss: 0.8430, test_loss: 1.0294, test_f1: 0.5782
 epoch: 29, train_loss: 0.8514, test_loss: 1.0102, test_f1: 0.5944
 epoch: 30, train_loss: 0.8388, test_loss: 0.9963, test_f1: 0.5699
 epoch: 31, train_loss: 0.8288, test_loss: 1.0070, test_f1: 0.5913
 epoch: 32, train_loss: 0.8189, test_loss: 1.0079, test_f1: 0.6005
 epoch: 33, train_loss: 0.8168, test_loss: 1.0113, test_f1: 0.5641
 epoch: 34, train_loss: 0.8030, test_loss: 0.9863, test_f1: 0.6197
 epoch: 35, train_loss: 0.8014, test_loss: 1.0384, test_f1: 0.5503
 epoch: 36, train_loss: 0.7868, test_loss: 0.9925, test_f1: 0.5799
 epoch: 37, train_loss: 0.7700, test_loss: 0.9829, test_f1: 0.5886
 epoch: 38, train_loss: 0.8224, test_loss: 1.0329, test_f1: 0.6066
 epoch: 39, train_loss: 0.8130, test_loss: 0.9943, test_f1: 0.5827
 epoch: 40, train_loss: 0.8099, test_loss: 0.9832, test_f1: 0.6010
 epoch: 41, train_loss: 0.7728, test_loss: 0.9651, test_f1: 0.6014
 epoch: 42, train_loss: 0.7821, test_loss: 0.9500, test_f1: 0.5829
 epoch: 43, train_loss: 0.7643, test_loss: 0.9454, test_f1: 0.6066
 epoch: 44, train_loss: 0.7781, test_loss: 0.9699, test_f1: 0.5930
 epoch: 45, train_loss: 0.7582, test_loss: 0.9745, test_f1: 0.5640
 epoch: 46, train_loss: 0.7464, test_loss: 0.9721, test_f1: 0.6087
 epoch: 47, train_loss: 0.7548, test_loss: 0.9666, test_f1: 0.6261
 epoch: 48, train_loss: 0.7618, test_loss: 0.9932, test_f1: 0.5995
 epoch: 49, train_loss: 0.7364, test_loss: 0.9957, test_f1: 0.5570
 epoch: 50, train_loss: 0.7353, test_loss: 0.9514, test_f1: 0.6064
 epoch: 51, train_loss: 0.7434, test_loss: 0.9944, test_f1: 0.5788
 epoch: 52, train_loss: 0.7290, test_loss: 0.9652, test_f1: 0.5950
 epoch: 53, train_loss: 0.7270, test_loss: 0.9835, test_f1: 0.5877
 epoch: 54, train_loss: 0.7166, test_loss: 0.9800, test_f1: 0.5727
 epoch: 55, train_loss: 0.7159, test_loss: 1.0201, test_f1: 0.6056
 epoch: 56, train_loss: 0.7185, test_loss: 0.9865, test_f1: 0.5723
 epoch: 57, train_loss: 0.7140, test_loss: 1.0404, test_f1: 0.5883
 epoch: 58, train_loss: 0.7097, test_loss: 1.0235, test_f1: 0.5617
 epoch: 59, train_loss: 0.7196, test_loss: 0.9678, test_f1: 0.6044
 epoch: 60, train_loss: 0.7059, test_loss: 0.9870, test_f1: 0.5690
 epoch: 61, train_loss: 0.7077, test_loss: 0.9658, test_f1: 0.5910
 epoch: 62, train_loss: 0.7018, test_loss: 0.9918, test_f1: 0.5870
 epoch: 63, train_loss: 0.7105, test_loss: 1.0116, test_f1: 0.5833
 epoch: 64, train_loss: 0.7058, test_loss: 0.9889, test_f1: 0.5856
 epoch: 65, train_loss: 0.6816, test_loss: 1.2313, test_f1: 0.5190
 epoch: 66, train_loss: 0.7017, test_loss: 1.0497, test_f1: 0.5960
 epoch: 67, train_loss: 0.7145, test_loss: 0.9958, test_f1: 0.6056
 epoch: 68, train_loss: 0.7045, test_loss: 1.0440, test_f1: 0.6180
 epoch: 69, train_loss: 0.7161, test_loss: 1.0193, test_f1: 0.5932
 epoch: 70, train_loss: 0.6865, test_loss: 1.0938, test_f1: 0.5504
 epoch: 71, train_loss: 0.6911, test_loss: 1.0250, test_f1: 0.6032
 epoch: 72, train_loss: 0.6708, test_loss: 1.0718, test_f1: 0.5698
 epoch: 73, train_loss: 0.6884, test_loss: 1.0535, test_f1: 0.6061
 epoch: 74, train_loss: 0.6813, test_loss: 1.0707, test_f1: 0.5993
 epoch: 75, train_loss: 0.6966, test_loss: 1.0753, test_f1: 0.5931
 epoch: 76, train_loss: 0.6862, test_loss: 1.0328, test_f1: 0.5940
 epoch: 77, train_loss: 0.6731, test_loss: 1.0070, test_f1: 0.6295
 epoch: 78, train_loss: 0.6816, test_loss: 1.0997, test_f1: 0.5551
 epoch: 79, train_loss: 0.6833, test_loss: 1.0209, test_f1: 0.6163
 epoch: 80, train_loss: 0.6771, test_loss: 1.0679, test_f1: 0.5690
 epoch: 81, train_loss: 0.6705, test_loss: 1.0380, test_f1: 0.5703
 epoch: 82, train_loss: 0.6609, test_loss: 1.0691, test_f1: 0.5832
 epoch: 83, train_loss: 0.6641, test_loss: 1.0477, test_f1: 0.6043
 epoch: 84, train_loss: 0.6662, test_loss: 1.0847, test_f1: 0.5695
 epoch: 85, train_loss: 0.6613, test_loss: 1.0637, test_f1: 0.5957
 epoch: 86, train_loss: 0.6708, test_loss: 1.0574, test_f1: 0.5897
 epoch: 87, train_loss: 0.6594, test_loss: 1.0517, test_f1: 0.6183
 epoch: 88, train_loss: 0.6747, test_loss: 1.0720, test_f1: 0.5673
 epoch: 89, train_loss: 0.6871, test_loss: 1.0393, test_f1: 0.6195
 epoch: 90, train_loss: 0.6508, test_loss: 1.1062, test_f1: 0.5919
 epoch: 91, train_loss: 0.6667, test_loss: 1.1224, test_f1: 0.5912
 epoch: 92, train_loss: 0.6702, test_loss: 1.1305, test_f1: 0.5328
 epoch: 93, train_loss: 0.6598, test_loss: 1.0399, test_f1: 0.6096
 epoch: 94, train_loss: 0.6428, test_loss: 1.0571, test_f1: 0.6006
 epoch: 95, train_loss: 0.6578, test_loss: 1.1054, test_f1: 0.5584
 epoch: 96, train_loss: 0.6436, test_loss: 1.0680, test_f1: 0.5865
 epoch: 97, train_loss: 0.6679, test_loss: 1.1140, test_f1: 0.5915
 epoch: 98, train_loss: 0.6424, test_loss: 1.0832, test_f1: 0.5811
 epoch: 99, train_loss: 0.6527, test_loss: 1.1062, test_f1: 0.5950
##################ITERATION #9 ****************************************
 epoch: 0, train_loss: 1.4829, test_loss: 1.3658, test_f1: 0.2238
 epoch: 1, train_loss: 1.2654, test_loss: 1.2918, test_f1: 0.2806
 epoch: 2, train_loss: 1.1959, test_loss: 1.2087, test_f1: 0.3098
 epoch: 3, train_loss: 1.1648, test_loss: 1.3361, test_f1: 0.3617
 epoch: 4, train_loss: 1.1358, test_loss: 1.3154, test_f1: 0.4204
 epoch: 5, train_loss: 1.0898, test_loss: 1.1216, test_f1: 0.4219
 epoch: 6, train_loss: 1.0490, test_loss: 1.0698, test_f1: 0.5119
 epoch: 7, train_loss: 1.0375, test_loss: 1.0543, test_f1: 0.5397
 epoch: 8, train_loss: 1.0205, test_loss: 1.0276, test_f1: 0.5121
 epoch: 9, train_loss: 0.9859, test_loss: 0.9946, test_f1: 0.5990
 epoch: 10, train_loss: 0.9631, test_loss: 0.9869, test_f1: 0.5889
 epoch: 11, train_loss: 0.9391, test_loss: 0.9813, test_f1: 0.5775
 epoch: 12, train_loss: 0.9128, test_loss: 0.9868, test_f1: 0.5582
 epoch: 13, train_loss: 0.8907, test_loss: 0.9573, test_f1: 0.5391
 epoch: 14, train_loss: 0.8791, test_loss: 0.9717, test_f1: 0.5721
 epoch: 15, train_loss: 0.8724, test_loss: 0.9591, test_f1: 0.5559
 epoch: 16, train_loss: 0.8691, test_loss: 0.9516, test_f1: 0.5802
 epoch: 17, train_loss: 0.8672, test_loss: 0.9633, test_f1: 0.5682
 epoch: 18, train_loss: 0.8457, test_loss: 0.9752, test_f1: 0.5552
 epoch: 19, train_loss: 0.8387, test_loss: 0.9661, test_f1: 0.5664
 epoch: 20, train_loss: 0.8164, test_loss: 0.9560, test_f1: 0.5672
 epoch: 21, train_loss: 0.8202, test_loss: 0.9672, test_f1: 0.5643
 epoch: 22, train_loss: 0.8229, test_loss: 0.9792, test_f1: 0.5812
 epoch: 23, train_loss: 0.8178, test_loss: 0.9807, test_f1: 0.5697
 epoch: 24, train_loss: 0.8176, test_loss: 0.9476, test_f1: 0.5679
 epoch: 25, train_loss: 0.7772, test_loss: 0.9903, test_f1: 0.5786
 epoch: 26, train_loss: 0.7826, test_loss: 0.9460, test_f1: 0.6244
 epoch: 27, train_loss: 0.7915, test_loss: 0.9705, test_f1: 0.5810
 epoch: 28, train_loss: 0.7856, test_loss: 0.9364, test_f1: 0.5807
 epoch: 29, train_loss: 0.7836, test_loss: 0.9680, test_f1: 0.6064
 epoch: 30, train_loss: 0.7463, test_loss: 0.9650, test_f1: 0.5963
 epoch: 31, train_loss: 0.7590, test_loss: 0.9802, test_f1: 0.5872
 epoch: 32, train_loss: 0.7546, test_loss: 0.9364, test_f1: 0.5982
 epoch: 33, train_loss: 0.7494, test_loss: 0.9681, test_f1: 0.5971
 epoch: 34, train_loss: 0.7481, test_loss: 0.9803, test_f1: 0.6007
 epoch: 35, train_loss: 0.7527, test_loss: 1.0135, test_f1: 0.5826
 epoch: 36, train_loss: 0.7404, test_loss: 1.0174, test_f1: 0.5777
 epoch: 37, train_loss: 0.7439, test_loss: 0.9759, test_f1: 0.6100
 epoch: 38, train_loss: 0.7265, test_loss: 1.0047, test_f1: 0.5800
 epoch: 39, train_loss: 0.7393, test_loss: 0.9617, test_f1: 0.5867
 epoch: 40, train_loss: 0.7301, test_loss: 1.0315, test_f1: 0.6026
 epoch: 41, train_loss: 0.7153, test_loss: 0.9313, test_f1: 0.5972
 epoch: 42, train_loss: 0.7183, test_loss: 1.0654, test_f1: 0.5985
 epoch: 43, train_loss: 0.7382, test_loss: 0.9896, test_f1: 0.5798
 epoch: 44, train_loss: 0.7249, test_loss: 1.0056, test_f1: 0.5973
 epoch: 45, train_loss: 0.7180, test_loss: 0.9828, test_f1: 0.5909
 epoch: 46, train_loss: 0.7388, test_loss: 1.0230, test_f1: 0.5951
 epoch: 47, train_loss: 0.7118, test_loss: 0.9559, test_f1: 0.6104
 epoch: 48, train_loss: 0.7018, test_loss: 1.0188, test_f1: 0.5918
 epoch: 49, train_loss: 0.7022, test_loss: 1.0061, test_f1: 0.6202
 epoch: 50, train_loss: 0.6995, test_loss: 1.0285, test_f1: 0.5983
 epoch: 51, train_loss: 0.6809, test_loss: 1.0419, test_f1: 0.5810
 epoch: 52, train_loss: 0.6768, test_loss: 1.0080, test_f1: 0.5921
 epoch: 53, train_loss: 0.6788, test_loss: 1.0476, test_f1: 0.5951
 epoch: 54, train_loss: 0.6770, test_loss: 1.0421, test_f1: 0.5681
 epoch: 55, train_loss: 0.6898, test_loss: 1.0503, test_f1: 0.5873
 epoch: 56, train_loss: 0.6889, test_loss: 1.0762, test_f1: 0.5652
 epoch: 57, train_loss: 0.6840, test_loss: 1.0236, test_f1: 0.5820
 epoch: 58, train_loss: 0.6763, test_loss: 1.0684, test_f1: 0.5572
 epoch: 59, train_loss: 0.6645, test_loss: 1.1067, test_f1: 0.5467
 epoch: 60, train_loss: 0.6775, test_loss: 1.0628, test_f1: 0.6232
 epoch: 61, train_loss: 0.6722, test_loss: 1.0657, test_f1: 0.6088
 epoch: 62, train_loss: 0.6839, test_loss: 1.0340, test_f1: 0.5930
 epoch: 63, train_loss: 0.6610, test_loss: 1.0735, test_f1: 0.5874
 epoch: 64, train_loss: 0.6711, test_loss: 1.0764, test_f1: 0.5725
 epoch: 65, train_loss: 0.6408, test_loss: 1.1320, test_f1: 0.5658
 epoch: 66, train_loss: 0.6586, test_loss: 1.1058, test_f1: 0.5776
 epoch: 67, train_loss: 0.6512, test_loss: 1.1418, test_f1: 0.5635
 epoch: 68, train_loss: 0.6728, test_loss: 1.0608, test_f1: 0.5870
 epoch: 69, train_loss: 0.6607, test_loss: 1.1004, test_f1: 0.6093
 epoch: 70, train_loss: 0.6640, test_loss: 1.0819, test_f1: 0.5625
 epoch: 71, train_loss: 0.6543, test_loss: 1.1310, test_f1: 0.5648
 epoch: 72, train_loss: 0.6492, test_loss: 1.0951, test_f1: 0.5635
 epoch: 73, train_loss: 0.6464, test_loss: 1.1205, test_f1: 0.5652
 epoch: 74, train_loss: 0.6515, test_loss: 1.1063, test_f1: 0.5692
 epoch: 75, train_loss: 0.6481, test_loss: 1.1521, test_f1: 0.5714
 epoch: 76, train_loss: 0.6396, test_loss: 1.1451, test_f1: 0.5699
 epoch: 77, train_loss: 0.6351, test_loss: 1.1795, test_f1: 0.5539
 epoch: 78, train_loss: 0.6382, test_loss: 1.1278, test_f1: 0.5675
 epoch: 79, train_loss: 0.6490, test_loss: 1.1527, test_f1: 0.5807
 epoch: 80, train_loss: 0.6479, test_loss: 1.1331, test_f1: 0.5762
 epoch: 81, train_loss: 0.6360, test_loss: 1.1376, test_f1: 0.5760
 epoch: 82, train_loss: 0.6402, test_loss: 1.0664, test_f1: 0.5833
 epoch: 83, train_loss: 0.6413, test_loss: 1.1661, test_f1: 0.5788
 epoch: 84, train_loss: 0.6189, test_loss: 1.1785, test_f1: 0.5641
 epoch: 85, train_loss: 0.6430, test_loss: 1.1477, test_f1: 0.5726
 epoch: 86, train_loss: 0.6331, test_loss: 1.1421, test_f1: 0.5630
 epoch: 87, train_loss: 0.6286, test_loss: 1.1094, test_f1: 0.5888
 epoch: 88, train_loss: 0.6175, test_loss: 1.1923, test_f1: 0.5875
 epoch: 89, train_loss: 0.6351, test_loss: 1.1590, test_f1: 0.5783
 epoch: 90, train_loss: 0.6349, test_loss: 1.1426, test_f1: 0.5897
 epoch: 91, train_loss: 0.6351, test_loss: 1.1992, test_f1: 0.5851
 epoch: 92, train_loss: 0.6383, test_loss: 1.1555, test_f1: 0.5601
 epoch: 93, train_loss: 0.6421, test_loss: 1.1534, test_f1: 0.5875
 epoch: 94, train_loss: 0.6329, test_loss: 1.0940, test_f1: 0.5975
 epoch: 95, train_loss: 0.6448, test_loss: 1.1078, test_f1: 0.5943
 epoch: 96, train_loss: 0.6219, test_loss: 1.2241, test_f1: 0.5581
 epoch: 97, train_loss: 0.6235, test_loss: 1.1334, test_f1: 0.5820
 epoch: 98, train_loss: 0.6133, test_loss: 1.1213, test_f1: 0.5833
 epoch: 99, train_loss: 0.6394, test_loss: 1.1153, test_f1: 0.5880

Training completed in 662.20 seconds
Best F1: 0.6421 at epoch 43
Mean F1 across iterations: 0.6085  0.0272
========================FINAL RESULTS================================
FEGIN weighted F1: 0.6421  0.0272
python main.py --data ltspice_demos --representation component_pin --model FEGIN --layers 4 --hiddens 16 --batch_size 64 --lr 0.001 --emb_size 250 --epochs 100 --save_appendix component_pin_L4_H16_BS64_LR0.001_E250 --no_val
-----



STDERR:
  File "main.py", line 370, in <module>
    main()
  File "main.py", line 254, in main
    dataset = dataset_class(
  File "/home/philip/projects/ltspice_examples_code_repo/Circuit-Completion-Using-GNNs/component_classification_with_link_prediction_head/evaluation/FEGIN/kernel/circuit_datasets.py", line 15, in __init__
    self.data, self.slices = torch.load(self.processed_paths[0])
  File "/home/philip/.local/lib/python3.8/site-packages/torch/serialization.py", line 1040, in load
    warnings.warn(
  File "/usr/lib/python3.8/warnings.py", line 109, in _showwarnmsg
    sw(msg.message, msg.category, msg.filename, msg.lineno,
  File "main.py", line 47, in warn_with_traceback
    traceback.print_stack(file=log)
/home/philip/projects/ltspice_examples_code_repo/Circuit-Completion-Using-GNNs/component_classification_with_link_prediction_head/evaluation/FEGIN/kernel/circuit_datasets.py:15: FutureWarning: You are using `torch.load` with `weights_only=False` (the current default value), which uses the default pickle module implicitly. It is possible to construct malicious pickle data which will execute arbitrary code during unpickling (See https://github.com/pytorch/pytorch/blob/main/SECURITY.md#untrusted-models for more details). In a future release, the default value for `weights_only` will be flipped to `True`. This limits the functions that could be executed during unpickling. Arbitrary objects will no longer be allowed to be loaded via this mode unless they are explicitly allowlisted by the user via `torch.serialization.add_safe_globals`. We recommend you start setting `weights_only=True` for any use case where you don't have full control of the loaded file. Please open an issue on GitHub for any issues related to this experimental feature.
  self.data, self.slices = torch.load(self.processed_paths[0])
